STDOUT:
Results will be saved in /home/philip/projects/ltspice_examples_code_repo/Circuit-Completion-Using-GNNs/component_classification_with_link_prediction_head/evaluation/FEGIN/results/model_FEGIN_dataset_ltspice_demos
Command line input: python main.py --data ltspice_demos --representation component_pin_net --model FEGIN --layers 4 --hiddens 16 --batch_size 256 --lr 0.001 --emb_size 128 --epochs 100 --save_appendix component_pin_net_L4_H16_BS256_LR0.001_E128 --no_val
 is saved.
-----
ltspice_demos - FEGIN
Using 4 layers, 16 hidden units, h = 2
Loading component_pin_net representation dataset
ENTERED
Training FEGIN on component_pin_net representation
Train: 1565, Test: 383
##################ITERATION #0 ****************************************
 epoch: 0, train_loss: 1.4598, test_loss: 1.4423, test_f1: 0.0507
 epoch: 1, train_loss: 1.4429, test_loss: 1.4350, test_f1: 0.0507
 epoch: 2, train_loss: 1.4280, test_loss: 1.4256, test_f1: 0.0507
 epoch: 3, train_loss: 1.4143, test_loss: 1.4102, test_f1: 0.0507
 epoch: 4, train_loss: 1.3951, test_loss: 1.3940, test_f1: 0.1815
 epoch: 5, train_loss: 1.3757, test_loss: 1.3784, test_f1: 0.1512
 epoch: 6, train_loss: 1.3528, test_loss: 1.3619, test_f1: 0.1572
 epoch: 7, train_loss: 1.3243, test_loss: 1.3425, test_f1: 0.1606
 epoch: 8, train_loss: 1.2980, test_loss: 1.3229, test_f1: 0.1365
 epoch: 9, train_loss: 1.2766, test_loss: 1.3070, test_f1: 0.1365
 epoch: 10, train_loss: 1.2607, test_loss: 1.2970, test_f1: 0.1365
 epoch: 11, train_loss: 1.2444, test_loss: 1.2873, test_f1: 0.1365
 epoch: 12, train_loss: 1.2317, test_loss: 1.2731, test_f1: 0.1365
 epoch: 13, train_loss: 1.2115, test_loss: 1.2628, test_f1: 0.1379
 epoch: 14, train_loss: 1.2002, test_loss: 1.2519, test_f1: 0.1486
 epoch: 15, train_loss: 1.1840, test_loss: 1.2468, test_f1: 0.2256
 epoch: 16, train_loss: 1.1810, test_loss: 1.2407, test_f1: 0.3456
 epoch: 17, train_loss: 1.1658, test_loss: 1.2305, test_f1: 0.3477
 epoch: 18, train_loss: 1.1607, test_loss: 1.2204, test_f1: 0.3519
 epoch: 19, train_loss: 1.1526, test_loss: 1.2198, test_f1: 0.3518
 epoch: 20, train_loss: 1.1420, test_loss: 1.2240, test_f1: 0.3354
 epoch: 21, train_loss: 1.1373, test_loss: 1.2194, test_f1: 0.3449
 epoch: 22, train_loss: 1.1282, test_loss: 1.2101, test_f1: 0.3629
 epoch: 23, train_loss: 1.1183, test_loss: 1.2102, test_f1: 0.3902
 epoch: 24, train_loss: 1.1183, test_loss: 1.2042, test_f1: 0.4314
 epoch: 25, train_loss: 1.1073, test_loss: 1.1998, test_f1: 0.4511
 epoch: 26, train_loss: 1.1077, test_loss: 1.1999, test_f1: 0.4594
 epoch: 27, train_loss: 1.1071, test_loss: 1.2017, test_f1: 0.4348
 epoch: 28, train_loss: 1.0929, test_loss: 1.1922, test_f1: 0.4368
 epoch: 29, train_loss: 1.0962, test_loss: 1.1855, test_f1: 0.4162
 epoch: 30, train_loss: 1.0886, test_loss: 1.1883, test_f1: 0.4400
 epoch: 31, train_loss: 1.0866, test_loss: 1.1826, test_f1: 0.4473
 epoch: 32, train_loss: 1.0851, test_loss: 1.1849, test_f1: 0.4256
 epoch: 33, train_loss: 1.0724, test_loss: 1.1803, test_f1: 0.4238
 epoch: 34, train_loss: 1.0712, test_loss: 1.1824, test_f1: 0.4329
 epoch: 35, train_loss: 1.0659, test_loss: 1.1826, test_f1: 0.4508
 epoch: 36, train_loss: 1.0534, test_loss: 1.1827, test_f1: 0.4392
 epoch: 37, train_loss: 1.0606, test_loss: 1.1838, test_f1: 0.4304
 epoch: 38, train_loss: 1.0579, test_loss: 1.2126, test_f1: 0.4401
 epoch: 39, train_loss: 1.0498, test_loss: 1.1949, test_f1: 0.4390
 epoch: 40, train_loss: 1.0537, test_loss: 1.1622, test_f1: 0.4357
 epoch: 41, train_loss: 1.0489, test_loss: 1.1673, test_f1: 0.4440
 epoch: 42, train_loss: 1.0441, test_loss: 1.1554, test_f1: 0.4464
 epoch: 43, train_loss: 1.0358, test_loss: 1.1587, test_f1: 0.4305
 epoch: 44, train_loss: 1.0400, test_loss: 1.1561, test_f1: 0.4282
 epoch: 45, train_loss: 1.0267, test_loss: 1.1956, test_f1: 0.4547
 epoch: 46, train_loss: 1.0172, test_loss: 1.1765, test_f1: 0.4448
 epoch: 47, train_loss: 1.0206, test_loss: 1.1625, test_f1: 0.4375
 epoch: 48, train_loss: 1.0239, test_loss: 1.1481, test_f1: 0.4287
 epoch: 49, train_loss: 1.0147, test_loss: 1.1397, test_f1: 0.4324
 epoch: 50, train_loss: 1.0057, test_loss: 1.1482, test_f1: 0.4281
 epoch: 51, train_loss: 1.0051, test_loss: 1.1493, test_f1: 0.4441
 epoch: 52, train_loss: 1.0134, test_loss: 1.1566, test_f1: 0.4304
 epoch: 53, train_loss: 1.0075, test_loss: 1.1582, test_f1: 0.4549
 epoch: 54, train_loss: 0.9981, test_loss: 1.1670, test_f1: 0.4611
 epoch: 55, train_loss: 0.9934, test_loss: 1.1590, test_f1: 0.4485
 epoch: 56, train_loss: 0.9956, test_loss: 1.1474, test_f1: 0.4378
 epoch: 57, train_loss: 1.0051, test_loss: 1.1555, test_f1: 0.4545
 epoch: 58, train_loss: 0.9892, test_loss: 1.1453, test_f1: 0.4554
 epoch: 59, train_loss: 0.9930, test_loss: 1.1373, test_f1: 0.4325
 epoch: 60, train_loss: 0.9832, test_loss: 1.1476, test_f1: 0.4413
 epoch: 61, train_loss: 0.9918, test_loss: 1.1464, test_f1: 0.4372
 epoch: 62, train_loss: 0.9949, test_loss: 1.1419, test_f1: 0.4344
 epoch: 63, train_loss: 0.9806, test_loss: 1.1554, test_f1: 0.4674
 epoch: 64, train_loss: 0.9842, test_loss: 1.1328, test_f1: 0.4566
 epoch: 65, train_loss: 0.9795, test_loss: 1.1278, test_f1: 0.4503
 epoch: 66, train_loss: 0.9851, test_loss: 1.1367, test_f1: 0.4401
 epoch: 67, train_loss: 0.9781, test_loss: 1.1363, test_f1: 0.4551
 epoch: 68, train_loss: 0.9804, test_loss: 1.1402, test_f1: 0.4552
 epoch: 69, train_loss: 0.9809, test_loss: 1.1447, test_f1: 0.4543
 epoch: 70, train_loss: 0.9751, test_loss: 1.1343, test_f1: 0.4378
 epoch: 71, train_loss: 0.9653, test_loss: 1.1443, test_f1: 0.4408
 epoch: 72, train_loss: 0.9693, test_loss: 1.1582, test_f1: 0.4492
 epoch: 73, train_loss: 0.9641, test_loss: 1.1683, test_f1: 0.4458
 epoch: 74, train_loss: 0.9698, test_loss: 1.1211, test_f1: 0.4302
 epoch: 75, train_loss: 0.9665, test_loss: 1.1230, test_f1: 0.4404
 epoch: 76, train_loss: 0.9637, test_loss: 1.1272, test_f1: 0.4534
 epoch: 77, train_loss: 0.9630, test_loss: 1.1318, test_f1: 0.4608
 epoch: 78, train_loss: 0.9670, test_loss: 1.1673, test_f1: 0.4499
 epoch: 79, train_loss: 0.9560, test_loss: 1.1722, test_f1: 0.4614
 epoch: 80, train_loss: 0.9635, test_loss: 1.1589, test_f1: 0.4683
 epoch: 81, train_loss: 0.9570, test_loss: 1.1585, test_f1: 0.4592
 epoch: 82, train_loss: 0.9595, test_loss: 1.1715, test_f1: 0.4533
 epoch: 83, train_loss: 0.9473, test_loss: 1.1339, test_f1: 0.4490
 epoch: 84, train_loss: 0.9572, test_loss: 1.1319, test_f1: 0.4408
 epoch: 85, train_loss: 0.9570, test_loss: 1.1843, test_f1: 0.4580
 epoch: 86, train_loss: 0.9575, test_loss: 1.1820, test_f1: 0.4521
 epoch: 87, train_loss: 0.9506, test_loss: 1.1335, test_f1: 0.4601
 epoch: 88, train_loss: 0.9436, test_loss: 1.1214, test_f1: 0.4687
 epoch: 89, train_loss: 0.9522, test_loss: 1.1572, test_f1: 0.4446
 epoch: 90, train_loss: 0.9435, test_loss: 1.1521, test_f1: 0.4531
 epoch: 91, train_loss: 0.9396, test_loss: 1.1253, test_f1: 0.4399
 epoch: 92, train_loss: 0.9497, test_loss: 1.1325, test_f1: 0.4403
 epoch: 93, train_loss: 0.9447, test_loss: 1.1256, test_f1: 0.4580
 epoch: 94, train_loss: 0.9516, test_loss: 1.1789, test_f1: 0.4519
 epoch: 95, train_loss: 0.9267, test_loss: 1.1750, test_f1: 0.4488
 epoch: 96, train_loss: 0.9366, test_loss: 1.1739, test_f1: 0.4488
 epoch: 97, train_loss: 0.9477, test_loss: 1.1553, test_f1: 0.4456
 epoch: 98, train_loss: 0.9315, test_loss: 1.1755, test_f1: 0.4519
 epoch: 99, train_loss: 0.9359, test_loss: 1.1839, test_f1: 0.4519
##################ITERATION #1 ****************************************
 epoch: 0, train_loss: 1.4393, test_loss: 1.4314, test_f1: 0.0301
 epoch: 1, train_loss: 1.3645, test_loss: 1.4064, test_f1: 0.0301
 epoch: 2, train_loss: 1.3168, test_loss: 1.3670, test_f1: 0.2281
 epoch: 3, train_loss: 1.2714, test_loss: 1.3340, test_f1: 0.2281
 epoch: 4, train_loss: 1.2296, test_loss: 1.3156, test_f1: 0.2281
 epoch: 5, train_loss: 1.2038, test_loss: 1.3037, test_f1: 0.2281
 epoch: 6, train_loss: 1.1730, test_loss: 1.2887, test_f1: 0.2281
 epoch: 7, train_loss: 1.1557, test_loss: 1.2762, test_f1: 0.2720
 epoch: 8, train_loss: 1.1397, test_loss: 1.2684, test_f1: 0.3386
 epoch: 9, train_loss: 1.1346, test_loss: 1.2658, test_f1: 0.4253
 epoch: 10, train_loss: 1.1287, test_loss: 1.2501, test_f1: 0.4253
 epoch: 11, train_loss: 1.1193, test_loss: 1.2255, test_f1: 0.4108
 epoch: 12, train_loss: 1.1162, test_loss: 1.2127, test_f1: 0.4334
 epoch: 13, train_loss: 1.1164, test_loss: 1.2063, test_f1: 0.4138
 epoch: 14, train_loss: 1.1086, test_loss: 1.1977, test_f1: 0.4138
 epoch: 15, train_loss: 1.0962, test_loss: 1.1951, test_f1: 0.4162
 epoch: 16, train_loss: 1.0973, test_loss: 1.1991, test_f1: 0.4166
 epoch: 17, train_loss: 1.0952, test_loss: 1.1937, test_f1: 0.4262
 epoch: 18, train_loss: 1.0921, test_loss: 1.1938, test_f1: 0.4292
 epoch: 19, train_loss: 1.0960, test_loss: 1.2028, test_f1: 0.4068
 epoch: 20, train_loss: 1.0855, test_loss: 1.2027, test_f1: 0.3947
 epoch: 21, train_loss: 1.0735, test_loss: 1.1940, test_f1: 0.3670
 epoch: 22, train_loss: 1.0730, test_loss: 1.2014, test_f1: 0.3829
 epoch: 23, train_loss: 1.0678, test_loss: 1.1998, test_f1: 0.3608
 epoch: 24, train_loss: 1.0683, test_loss: 1.1830, test_f1: 0.4043
 epoch: 25, train_loss: 1.0670, test_loss: 1.1878, test_f1: 0.4134
 epoch: 26, train_loss: 1.0625, test_loss: 1.1844, test_f1: 0.4106
 epoch: 27, train_loss: 1.0569, test_loss: 1.1814, test_f1: 0.4130
 epoch: 28, train_loss: 1.0510, test_loss: 1.1900, test_f1: 0.4138
 epoch: 29, train_loss: 1.0349, test_loss: 1.1751, test_f1: 0.4333
 epoch: 30, train_loss: 1.0467, test_loss: 1.1982, test_f1: 0.4247
 epoch: 31, train_loss: 1.0293, test_loss: 1.1880, test_f1: 0.4158
 epoch: 32, train_loss: 1.0348, test_loss: 1.1986, test_f1: 0.4142
 epoch: 33, train_loss: 1.0144, test_loss: 1.1951, test_f1: 0.4082
 epoch: 34, train_loss: 1.0146, test_loss: 1.1931, test_f1: 0.4128
 epoch: 35, train_loss: 1.0165, test_loss: 1.1737, test_f1: 0.4082
 epoch: 36, train_loss: 1.0191, test_loss: 1.1874, test_f1: 0.4079
 epoch: 37, train_loss: 1.0130, test_loss: 1.1780, test_f1: 0.4046
 epoch: 38, train_loss: 1.0031, test_loss: 1.1875, test_f1: 0.4146
 epoch: 39, train_loss: 1.0056, test_loss: 1.1918, test_f1: 0.4168
 epoch: 40, train_loss: 0.9968, test_loss: 1.2064, test_f1: 0.4193
 epoch: 41, train_loss: 0.9924, test_loss: 1.1768, test_f1: 0.4031
 epoch: 42, train_loss: 1.0281, test_loss: 1.1726, test_f1: 0.3982
 epoch: 43, train_loss: 1.0270, test_loss: 1.1593, test_f1: 0.4089
 epoch: 44, train_loss: 1.0240, test_loss: 1.1375, test_f1: 0.4303
 epoch: 45, train_loss: 1.0096, test_loss: 1.1423, test_f1: 0.4283
 epoch: 46, train_loss: 1.0029, test_loss: 1.1759, test_f1: 0.4278
 epoch: 47, train_loss: 0.9930, test_loss: 1.1892, test_f1: 0.4334
 epoch: 48, train_loss: 1.0051, test_loss: 1.1762, test_f1: 0.4194
 epoch: 49, train_loss: 0.9824, test_loss: 1.1546, test_f1: 0.4136
 epoch: 50, train_loss: 0.9803, test_loss: 1.1672, test_f1: 0.4118
 epoch: 51, train_loss: 0.9743, test_loss: 1.1698, test_f1: 0.4121
 epoch: 52, train_loss: 0.9742, test_loss: 1.1651, test_f1: 0.4142
 epoch: 53, train_loss: 0.9733, test_loss: 1.1645, test_f1: 0.4078
 epoch: 54, train_loss: 0.9725, test_loss: 1.1670, test_f1: 0.4076
 epoch: 55, train_loss: 0.9688, test_loss: 1.1741, test_f1: 0.4076
 epoch: 56, train_loss: 0.9731, test_loss: 1.1856, test_f1: 0.4099
 epoch: 57, train_loss: 0.9704, test_loss: 1.1947, test_f1: 0.4087
 epoch: 58, train_loss: 0.9657, test_loss: 1.1946, test_f1: 0.4180
 epoch: 59, train_loss: 0.9615, test_loss: 1.1891, test_f1: 0.4287
 epoch: 60, train_loss: 0.9668, test_loss: 1.1888, test_f1: 0.4242
 epoch: 61, train_loss: 0.9513, test_loss: 1.1990, test_f1: 0.4170
 epoch: 62, train_loss: 0.9608, test_loss: 1.2084, test_f1: 0.4121
 epoch: 63, train_loss: 0.9588, test_loss: 1.2026, test_f1: 0.4170
 epoch: 64, train_loss: 0.9508, test_loss: 1.2059, test_f1: 0.4170
 epoch: 65, train_loss: 0.9462, test_loss: 1.2001, test_f1: 0.4187
 epoch: 66, train_loss: 0.9500, test_loss: 1.1932, test_f1: 0.4288
 epoch: 67, train_loss: 0.9569, test_loss: 1.2075, test_f1: 0.4183
 epoch: 68, train_loss: 0.9570, test_loss: 1.2141, test_f1: 0.4261
 epoch: 69, train_loss: 0.9522, test_loss: 1.2136, test_f1: 0.4258
 epoch: 70, train_loss: 0.9608, test_loss: 1.2130, test_f1: 0.4229
 epoch: 71, train_loss: 0.9547, test_loss: 1.2171, test_f1: 0.4297
 epoch: 72, train_loss: 0.9544, test_loss: 1.2135, test_f1: 0.4323
 epoch: 73, train_loss: 0.9367, test_loss: 1.2100, test_f1: 0.4340
 epoch: 74, train_loss: 0.9433, test_loss: 1.2065, test_f1: 0.4328
 epoch: 75, train_loss: 0.9429, test_loss: 1.1997, test_f1: 0.4371
 epoch: 76, train_loss: 0.9508, test_loss: 1.2063, test_f1: 0.4365
 epoch: 77, train_loss: 0.9498, test_loss: 1.2103, test_f1: 0.4493
 epoch: 78, train_loss: 0.9419, test_loss: 1.2010, test_f1: 0.4357
 epoch: 79, train_loss: 0.9483, test_loss: 1.1871, test_f1: 0.4410
 epoch: 80, train_loss: 0.9323, test_loss: 1.1878, test_f1: 0.4476
 epoch: 81, train_loss: 0.9515, test_loss: 1.1800, test_f1: 0.4588
 epoch: 82, train_loss: 0.9450, test_loss: 1.2158, test_f1: 0.4532
 epoch: 83, train_loss: 0.9396, test_loss: 1.2324, test_f1: 0.4428
 epoch: 84, train_loss: 0.9476, test_loss: 1.2040, test_f1: 0.4568
 epoch: 85, train_loss: 0.9298, test_loss: 1.1986, test_f1: 0.4373
 epoch: 86, train_loss: 0.9334, test_loss: 1.2094, test_f1: 0.4564
 epoch: 87, train_loss: 0.9394, test_loss: 1.2380, test_f1: 0.4503
 epoch: 88, train_loss: 0.9316, test_loss: 1.2347, test_f1: 0.4526
 epoch: 89, train_loss: 0.9417, test_loss: 1.2201, test_f1: 0.4636
 epoch: 90, train_loss: 0.9426, test_loss: 1.2089, test_f1: 0.4571
 epoch: 91, train_loss: 0.9269, test_loss: 1.2091, test_f1: 0.4521
 epoch: 92, train_loss: 0.9247, test_loss: 1.1929, test_f1: 0.4561
 epoch: 93, train_loss: 0.9260, test_loss: 1.2139, test_f1: 0.4711
 epoch: 94, train_loss: 0.9272, test_loss: 1.2231, test_f1: 0.4823
 epoch: 95, train_loss: 0.9359, test_loss: 1.2082, test_f1: 0.4674
 epoch: 96, train_loss: 0.9317, test_loss: 1.1827, test_f1: 0.4666
 epoch: 97, train_loss: 0.9235, test_loss: 1.1949, test_f1: 0.4583
 epoch: 98, train_loss: 0.9250, test_loss: 1.2105, test_f1: 0.4589
 epoch: 99, train_loss: 0.9247, test_loss: 1.2088, test_f1: 0.4635
##################ITERATION #2 ****************************************
 epoch: 0, train_loss: 1.3764, test_loss: 1.4004, test_f1: 0.0301
 epoch: 1, train_loss: 1.2786, test_loss: 1.3742, test_f1: 0.2281
 epoch: 2, train_loss: 1.2379, test_loss: 1.3597, test_f1: 0.2281
 epoch: 3, train_loss: 1.2042, test_loss: 1.3432, test_f1: 0.2281
 epoch: 4, train_loss: 1.1785, test_loss: 1.3160, test_f1: 0.2872
 epoch: 5, train_loss: 1.1681, test_loss: 1.2927, test_f1: 0.2940
 epoch: 6, train_loss: 1.1532, test_loss: 1.2717, test_f1: 0.2982
 epoch: 7, train_loss: 1.1281, test_loss: 1.2401, test_f1: 0.3145
 epoch: 8, train_loss: 1.1130, test_loss: 1.2182, test_f1: 0.3149
 epoch: 9, train_loss: 1.1164, test_loss: 1.1938, test_f1: 0.3409
 epoch: 10, train_loss: 1.1053, test_loss: 1.1783, test_f1: 0.3673
 epoch: 11, train_loss: 1.1005, test_loss: 1.1664, test_f1: 0.3412
 epoch: 12, train_loss: 1.0895, test_loss: 1.1581, test_f1: 0.3535
 epoch: 13, train_loss: 1.0750, test_loss: 1.1511, test_f1: 0.4069
 epoch: 14, train_loss: 1.0740, test_loss: 1.1478, test_f1: 0.4145
 epoch: 15, train_loss: 1.0695, test_loss: 1.1422, test_f1: 0.4025
 epoch: 16, train_loss: 1.0762, test_loss: 1.1448, test_f1: 0.4079
 epoch: 17, train_loss: 1.0591, test_loss: 1.1483, test_f1: 0.4495
 epoch: 18, train_loss: 1.0564, test_loss: 1.1345, test_f1: 0.4338
 epoch: 19, train_loss: 1.0478, test_loss: 1.1241, test_f1: 0.4071
 epoch: 20, train_loss: 1.0439, test_loss: 1.1346, test_f1: 0.4163
 epoch: 21, train_loss: 1.0514, test_loss: 1.1251, test_f1: 0.4140
 epoch: 22, train_loss: 1.0332, test_loss: 1.1222, test_f1: 0.4311
 epoch: 23, train_loss: 1.0279, test_loss: 1.1221, test_f1: 0.4111
 epoch: 24, train_loss: 1.0261, test_loss: 1.1259, test_f1: 0.4118
 epoch: 25, train_loss: 1.0250, test_loss: 1.1197, test_f1: 0.4080
 epoch: 26, train_loss: 1.0078, test_loss: 1.1114, test_f1: 0.4153
 epoch: 27, train_loss: 1.0121, test_loss: 1.1131, test_f1: 0.4169
 epoch: 28, train_loss: 1.0102, test_loss: 1.1081, test_f1: 0.4255
 epoch: 29, train_loss: 1.0093, test_loss: 1.1179, test_f1: 0.4201
 epoch: 30, train_loss: 1.0093, test_loss: 1.1021, test_f1: 0.4157
 epoch: 31, train_loss: 0.9994, test_loss: 1.1069, test_f1: 0.4419
 epoch: 32, train_loss: 0.9962, test_loss: 1.1177, test_f1: 0.4079
 epoch: 33, train_loss: 0.9926, test_loss: 1.1006, test_f1: 0.4126
 epoch: 34, train_loss: 0.9957, test_loss: 1.1247, test_f1: 0.4140
 epoch: 35, train_loss: 0.9894, test_loss: 1.0900, test_f1: 0.4006
 epoch: 36, train_loss: 0.9892, test_loss: 1.1378, test_f1: 0.4068
 epoch: 37, train_loss: 0.9985, test_loss: 1.1355, test_f1: 0.4047
 epoch: 38, train_loss: 0.9903, test_loss: 1.1002, test_f1: 0.4123
 epoch: 39, train_loss: 0.9875, test_loss: 1.1542, test_f1: 0.4126
 epoch: 40, train_loss: 0.9734, test_loss: 1.1108, test_f1: 0.4144
 epoch: 41, train_loss: 0.9969, test_loss: 1.0975, test_f1: 0.4781
 epoch: 42, train_loss: 0.9796, test_loss: 1.1437, test_f1: 0.4449
 epoch: 43, train_loss: 0.9754, test_loss: 1.1166, test_f1: 0.4156
 epoch: 44, train_loss: 0.9607, test_loss: 1.1085, test_f1: 0.4114
 epoch: 45, train_loss: 0.9549, test_loss: 1.1028, test_f1: 0.4067
 epoch: 46, train_loss: 0.9633, test_loss: 1.0956, test_f1: 0.4066
 epoch: 47, train_loss: 0.9566, test_loss: 1.0903, test_f1: 0.4111
 epoch: 48, train_loss: 0.9521, test_loss: 1.1354, test_f1: 0.4109
 epoch: 49, train_loss: 0.9637, test_loss: 1.0966, test_f1: 0.4233
 epoch: 50, train_loss: 0.9567, test_loss: 1.0973, test_f1: 0.4298
 epoch: 51, train_loss: 0.9495, test_loss: 1.0901, test_f1: 0.4215
 epoch: 52, train_loss: 0.9488, test_loss: 1.0937, test_f1: 0.4267
 epoch: 53, train_loss: 0.9409, test_loss: 1.0890, test_f1: 0.4286
 epoch: 54, train_loss: 0.9377, test_loss: 1.1057, test_f1: 0.4269
 epoch: 55, train_loss: 0.9351, test_loss: 1.1074, test_f1: 0.4269
 epoch: 56, train_loss: 0.9421, test_loss: 1.1041, test_f1: 0.4354
 epoch: 57, train_loss: 0.9415, test_loss: 1.0712, test_f1: 0.4410
 epoch: 58, train_loss: 0.9449, test_loss: 1.0882, test_f1: 0.4431
 epoch: 59, train_loss: 0.9392, test_loss: 1.0732, test_f1: 0.4369
 epoch: 60, train_loss: 0.9350, test_loss: 1.0812, test_f1: 0.4315
 epoch: 61, train_loss: 0.9317, test_loss: 1.0852, test_f1: 0.4264
 epoch: 62, train_loss: 0.9320, test_loss: 1.0753, test_f1: 0.4314
 epoch: 63, train_loss: 0.9277, test_loss: 1.0757, test_f1: 0.4270
 epoch: 64, train_loss: 0.9235, test_loss: 1.0671, test_f1: 0.4319
 epoch: 65, train_loss: 0.9278, test_loss: 1.0981, test_f1: 0.4261
 epoch: 66, train_loss: 0.9279, test_loss: 1.1085, test_f1: 0.4340
 epoch: 67, train_loss: 0.9179, test_loss: 1.1108, test_f1: 0.4290
 epoch: 68, train_loss: 0.9173, test_loss: 1.0758, test_f1: 0.4369
 epoch: 69, train_loss: 0.9160, test_loss: 1.1117, test_f1: 0.4369
 epoch: 70, train_loss: 0.9215, test_loss: 1.1029, test_f1: 0.4419
 epoch: 71, train_loss: 0.9211, test_loss: 1.1107, test_f1: 0.4419
 epoch: 72, train_loss: 0.9116, test_loss: 1.1134, test_f1: 0.4582
 epoch: 73, train_loss: 0.9118, test_loss: 1.0822, test_f1: 0.4434
 epoch: 74, train_loss: 0.9258, test_loss: 1.0848, test_f1: 0.4645
 epoch: 75, train_loss: 0.9176, test_loss: 1.0821, test_f1: 0.4734
 epoch: 76, train_loss: 0.9128, test_loss: 1.0691, test_f1: 0.4648
 epoch: 77, train_loss: 0.9217, test_loss: 1.0763, test_f1: 0.4689
 epoch: 78, train_loss: 0.9070, test_loss: 1.1081, test_f1: 0.4408
 epoch: 79, train_loss: 0.9164, test_loss: 1.1120, test_f1: 0.4465
 epoch: 80, train_loss: 0.9224, test_loss: 1.1277, test_f1: 0.4662
 epoch: 81, train_loss: 0.9046, test_loss: 1.1049, test_f1: 0.4641
 epoch: 82, train_loss: 0.9118, test_loss: 1.1116, test_f1: 0.4510
 epoch: 83, train_loss: 0.9235, test_loss: 1.1614, test_f1: 0.4468
 epoch: 84, train_loss: 0.9180, test_loss: 1.0956, test_f1: 0.4423
 epoch: 85, train_loss: 0.9107, test_loss: 1.1193, test_f1: 0.4547
 epoch: 86, train_loss: 0.9038, test_loss: 1.1086, test_f1: 0.4627
 epoch: 87, train_loss: 0.9054, test_loss: 1.0775, test_f1: 0.4745
 epoch: 88, train_loss: 0.9144, test_loss: 1.0685, test_f1: 0.4709
 epoch: 89, train_loss: 0.9114, test_loss: 1.0486, test_f1: 0.4633
 epoch: 90, train_loss: 0.8963, test_loss: 1.0651, test_f1: 0.4714
 epoch: 91, train_loss: 0.9047, test_loss: 1.0665, test_f1: 0.4650
 epoch: 92, train_loss: 0.8911, test_loss: 1.1157, test_f1: 0.4727
 epoch: 93, train_loss: 0.8973, test_loss: 1.0877, test_f1: 0.4725
 epoch: 94, train_loss: 0.8917, test_loss: 1.1158, test_f1: 0.4732
 epoch: 95, train_loss: 0.8974, test_loss: 1.1019, test_f1: 0.4715
 epoch: 96, train_loss: 0.8855, test_loss: 1.1063, test_f1: 0.4716
 epoch: 97, train_loss: 0.8980, test_loss: 1.1541, test_f1: 0.4986
 epoch: 98, train_loss: 0.9022, test_loss: 1.0892, test_f1: 0.5080
 epoch: 99, train_loss: 0.9050, test_loss: 1.1220, test_f1: 0.4917
##################ITERATION #3 ****************************************
 epoch: 0, train_loss: 1.3053, test_loss: 1.3252, test_f1: 0.2281
 epoch: 1, train_loss: 1.2311, test_loss: 1.3100, test_f1: 0.2281
 epoch: 2, train_loss: 1.2147, test_loss: 1.3000, test_f1: 0.2281
 epoch: 3, train_loss: 1.1849, test_loss: 1.2922, test_f1: 0.2281
 epoch: 4, train_loss: 1.1731, test_loss: 1.2803, test_f1: 0.2281
 epoch: 5, train_loss: 1.1512, test_loss: 1.2674, test_f1: 0.2281
 epoch: 6, train_loss: 1.1366, test_loss: 1.2528, test_f1: 0.2281
 epoch: 7, train_loss: 1.1316, test_loss: 1.2406, test_f1: 0.2462
 epoch: 8, train_loss: 1.1240, test_loss: 1.2125, test_f1: 0.2724
 epoch: 9, train_loss: 1.1153, test_loss: 1.1835, test_f1: 0.3300
 epoch: 10, train_loss: 1.0987, test_loss: 1.1787, test_f1: 0.3599
 epoch: 11, train_loss: 1.1017, test_loss: 1.1643, test_f1: 0.3659
 epoch: 12, train_loss: 1.1057, test_loss: 1.1587, test_f1: 0.4058
 epoch: 13, train_loss: 1.0901, test_loss: 1.1977, test_f1: 0.4332
 epoch: 14, train_loss: 1.0848, test_loss: 1.1765, test_f1: 0.4457
 epoch: 15, train_loss: 1.0830, test_loss: 1.1759, test_f1: 0.4225
 epoch: 16, train_loss: 1.0679, test_loss: 1.1605, test_f1: 0.4328
 epoch: 17, train_loss: 1.0580, test_loss: 1.1583, test_f1: 0.4386
 epoch: 18, train_loss: 1.0582, test_loss: 1.1536, test_f1: 0.4301
 epoch: 19, train_loss: 1.0459, test_loss: 1.1486, test_f1: 0.4342
 epoch: 20, train_loss: 1.0447, test_loss: 1.1412, test_f1: 0.4240
 epoch: 21, train_loss: 1.0250, test_loss: 1.1356, test_f1: 0.4410
 epoch: 22, train_loss: 1.0205, test_loss: 1.1340, test_f1: 0.3970
 epoch: 23, train_loss: 1.0177, test_loss: 1.1167, test_f1: 0.4147
 epoch: 24, train_loss: 1.0112, test_loss: 1.1784, test_f1: 0.3964
 epoch: 25, train_loss: 1.0033, test_loss: 1.1991, test_f1: 0.3967
 epoch: 26, train_loss: 0.9948, test_loss: 1.1341, test_f1: 0.4374
 epoch: 27, train_loss: 0.9974, test_loss: 1.0841, test_f1: 0.4607
 epoch: 28, train_loss: 0.9818, test_loss: 1.0973, test_f1: 0.4503
 epoch: 29, train_loss: 0.9909, test_loss: 1.0946, test_f1: 0.4447
 epoch: 30, train_loss: 0.9939, test_loss: 1.1002, test_f1: 0.4347
 epoch: 31, train_loss: 0.9828, test_loss: 1.0830, test_f1: 0.4615
 epoch: 32, train_loss: 0.9894, test_loss: 1.2335, test_f1: 0.4224
 epoch: 33, train_loss: 0.9801, test_loss: 1.2275, test_f1: 0.4281
 epoch: 34, train_loss: 0.9766, test_loss: 1.0881, test_f1: 0.4470
 epoch: 35, train_loss: 0.9731, test_loss: 1.0905, test_f1: 0.4394
 epoch: 36, train_loss: 0.9699, test_loss: 1.1326, test_f1: 0.4464
 epoch: 37, train_loss: 0.9872, test_loss: 1.2350, test_f1: 0.4085
 epoch: 38, train_loss: 0.9702, test_loss: 1.1163, test_f1: 0.4248
 epoch: 39, train_loss: 0.9730, test_loss: 1.0886, test_f1: 0.4587
 epoch: 40, train_loss: 0.9660, test_loss: 1.0788, test_f1: 0.4595
 epoch: 41, train_loss: 0.9614, test_loss: 1.0781, test_f1: 0.4264
 epoch: 42, train_loss: 0.9602, test_loss: 1.0736, test_f1: 0.4487
 epoch: 43, train_loss: 0.9500, test_loss: 1.0721, test_f1: 0.4447
 epoch: 44, train_loss: 0.9377, test_loss: 1.0665, test_f1: 0.4550
 epoch: 45, train_loss: 0.9386, test_loss: 1.0469, test_f1: 0.4681
 epoch: 46, train_loss: 0.9366, test_loss: 1.0512, test_f1: 0.4642
 epoch: 47, train_loss: 0.9279, test_loss: 1.0566, test_f1: 0.4607
 epoch: 48, train_loss: 0.9326, test_loss: 1.0495, test_f1: 0.4561
 epoch: 49, train_loss: 0.9569, test_loss: 1.0436, test_f1: 0.4675
 epoch: 50, train_loss: 0.9494, test_loss: 1.0404, test_f1: 0.4693
 epoch: 51, train_loss: 0.9264, test_loss: 1.0620, test_f1: 0.4691
 epoch: 52, train_loss: 0.9209, test_loss: 1.0950, test_f1: 0.4810
 epoch: 53, train_loss: 0.9253, test_loss: 1.0736, test_f1: 0.4823
 epoch: 54, train_loss: 0.9171, test_loss: 1.0578, test_f1: 0.4688
 epoch: 55, train_loss: 0.9257, test_loss: 1.0426, test_f1: 0.4604
 epoch: 56, train_loss: 0.9116, test_loss: 1.0431, test_f1: 0.4663
 epoch: 57, train_loss: 0.9132, test_loss: 1.0415, test_f1: 0.4645
 epoch: 58, train_loss: 0.9146, test_loss: 1.0498, test_f1: 0.4751
 epoch: 59, train_loss: 0.9110, test_loss: 1.0403, test_f1: 0.4778
 epoch: 60, train_loss: 0.9173, test_loss: 1.0953, test_f1: 0.4818
 epoch: 61, train_loss: 0.9065, test_loss: 1.1296, test_f1: 0.4691
 epoch: 62, train_loss: 0.9141, test_loss: 1.0662, test_f1: 0.4663
 epoch: 63, train_loss: 0.9057, test_loss: 1.0524, test_f1: 0.4836
 epoch: 64, train_loss: 0.9080, test_loss: 1.0495, test_f1: 0.4630
 epoch: 65, train_loss: 0.8988, test_loss: 1.0579, test_f1: 0.4582
 epoch: 66, train_loss: 0.8985, test_loss: 1.0535, test_f1: 0.4744
 epoch: 67, train_loss: 0.9128, test_loss: 1.0566, test_f1: 0.4819
 epoch: 68, train_loss: 0.9036, test_loss: 1.0512, test_f1: 0.4847
 epoch: 69, train_loss: 0.9128, test_loss: 1.0455, test_f1: 0.4811
 epoch: 70, train_loss: 0.9054, test_loss: 1.0394, test_f1: 0.5137
 epoch: 71, train_loss: 0.9073, test_loss: 1.0518, test_f1: 0.5146
 epoch: 72, train_loss: 0.8962, test_loss: 1.0340, test_f1: 0.5216
 epoch: 73, train_loss: 0.9042, test_loss: 1.0551, test_f1: 0.4998
 epoch: 74, train_loss: 0.8973, test_loss: 1.0691, test_f1: 0.4994
 epoch: 75, train_loss: 0.8961, test_loss: 1.0383, test_f1: 0.5054
 epoch: 76, train_loss: 0.8876, test_loss: 1.0399, test_f1: 0.5032
 epoch: 77, train_loss: 0.8998, test_loss: 1.0329, test_f1: 0.5027
 epoch: 78, train_loss: 0.8939, test_loss: 1.0406, test_f1: 0.4894
 epoch: 79, train_loss: 0.8939, test_loss: 1.0680, test_f1: 0.5077
 epoch: 80, train_loss: 0.8902, test_loss: 1.0729, test_f1: 0.4967
 epoch: 81, train_loss: 0.8972, test_loss: 1.0620, test_f1: 0.5056
 epoch: 82, train_loss: 0.8865, test_loss: 1.0435, test_f1: 0.5094
 epoch: 83, train_loss: 0.8835, test_loss: 1.0303, test_f1: 0.5154
 epoch: 84, train_loss: 0.8845, test_loss: 1.0359, test_f1: 0.5063
 epoch: 85, train_loss: 0.8859, test_loss: 1.0432, test_f1: 0.5246
 epoch: 86, train_loss: 0.8790, test_loss: 1.0655, test_f1: 0.5166
 epoch: 87, train_loss: 0.8896, test_loss: 1.0540, test_f1: 0.5303
 epoch: 88, train_loss: 0.8761, test_loss: 1.0620, test_f1: 0.5250
 epoch: 89, train_loss: 0.8894, test_loss: 1.0585, test_f1: 0.5283
 epoch: 90, train_loss: 0.8815, test_loss: 1.0366, test_f1: 0.5235
 epoch: 91, train_loss: 0.8719, test_loss: 1.0782, test_f1: 0.4960
 epoch: 92, train_loss: 0.8959, test_loss: 1.0497, test_f1: 0.5119
 epoch: 93, train_loss: 0.8975, test_loss: 1.0363, test_f1: 0.5498
 epoch: 94, train_loss: 0.8737, test_loss: 1.0379, test_f1: 0.5310
 epoch: 95, train_loss: 0.8748, test_loss: 1.0615, test_f1: 0.5336
 epoch: 96, train_loss: 0.8754, test_loss: 1.0492, test_f1: 0.5306
 epoch: 97, train_loss: 0.8718, test_loss: 1.0527, test_f1: 0.5251
 epoch: 98, train_loss: 0.8705, test_loss: 1.0663, test_f1: 0.5229
 epoch: 99, train_loss: 0.8753, test_loss: 1.0366, test_f1: 0.5286
##################ITERATION #4 ****************************************
 epoch: 0, train_loss: 1.2679, test_loss: 1.3171, test_f1: 0.2281
 epoch: 1, train_loss: 1.1914, test_loss: 1.3027, test_f1: 0.2281
 epoch: 2, train_loss: 1.1748, test_loss: 1.2981, test_f1: 0.2281
 epoch: 3, train_loss: 1.1556, test_loss: 1.3043, test_f1: 0.2281
 epoch: 4, train_loss: 1.1437, test_loss: 1.3205, test_f1: 0.2281
 epoch: 5, train_loss: 1.1371, test_loss: 1.3058, test_f1: 0.2281
 epoch: 6, train_loss: 1.1342, test_loss: 1.2764, test_f1: 0.2281
 epoch: 7, train_loss: 1.1252, test_loss: 1.2435, test_f1: 0.2639
 epoch: 8, train_loss: 1.1164, test_loss: 1.2226, test_f1: 0.2692
 epoch: 9, train_loss: 1.1090, test_loss: 1.1976, test_f1: 0.3647
 epoch: 10, train_loss: 1.0993, test_loss: 1.1766, test_f1: 0.3705
 epoch: 11, train_loss: 1.0991, test_loss: 1.1679, test_f1: 0.3758
 epoch: 12, train_loss: 1.0837, test_loss: 1.1661, test_f1: 0.4364
 epoch: 13, train_loss: 1.0733, test_loss: 1.1666, test_f1: 0.4414
 epoch: 14, train_loss: 1.0842, test_loss: 1.1691, test_f1: 0.4366
 epoch: 15, train_loss: 1.0604, test_loss: 1.1579, test_f1: 0.4328
 epoch: 16, train_loss: 1.0582, test_loss: 1.1646, test_f1: 0.4343
 epoch: 17, train_loss: 1.0566, test_loss: 1.1702, test_f1: 0.4294
 epoch: 18, train_loss: 1.0547, test_loss: 1.1442, test_f1: 0.4301
 epoch: 19, train_loss: 1.0440, test_loss: 1.1235, test_f1: 0.4394
 epoch: 20, train_loss: 1.0456, test_loss: 1.1432, test_f1: 0.4367
 epoch: 21, train_loss: 1.0344, test_loss: 1.1430, test_f1: 0.4328
 epoch: 22, train_loss: 1.0342, test_loss: 1.1345, test_f1: 0.4346
 epoch: 23, train_loss: 1.0243, test_loss: 1.1416, test_f1: 0.4395
 epoch: 24, train_loss: 1.0302, test_loss: 1.1447, test_f1: 0.4399
 epoch: 25, train_loss: 1.0275, test_loss: 1.1272, test_f1: 0.4389
 epoch: 26, train_loss: 1.0277, test_loss: 1.1183, test_f1: 0.4336
 epoch: 27, train_loss: 1.0179, test_loss: 1.1132, test_f1: 0.4350
 epoch: 28, train_loss: 1.0092, test_loss: 1.1199, test_f1: 0.4326
 epoch: 29, train_loss: 1.0205, test_loss: 1.1152, test_f1: 0.4350
 epoch: 30, train_loss: 1.0112, test_loss: 1.1071, test_f1: 0.4368
 epoch: 31, train_loss: 1.0026, test_loss: 1.1106, test_f1: 0.4322
 epoch: 32, train_loss: 1.0104, test_loss: 1.1150, test_f1: 0.4322
 epoch: 33, train_loss: 1.0128, test_loss: 1.1145, test_f1: 0.4312
 epoch: 34, train_loss: 1.0117, test_loss: 1.1046, test_f1: 0.4372
 epoch: 35, train_loss: 1.0092, test_loss: 1.1065, test_f1: 0.4411
 epoch: 36, train_loss: 0.9923, test_loss: 1.1207, test_f1: 0.4341
 epoch: 37, train_loss: 1.0005, test_loss: 1.1054, test_f1: 0.4390
 epoch: 38, train_loss: 0.9950, test_loss: 1.1148, test_f1: 0.4274
 epoch: 39, train_loss: 0.9905, test_loss: 1.1308, test_f1: 0.4281
 epoch: 40, train_loss: 0.9894, test_loss: 1.1102, test_f1: 0.4363
 epoch: 41, train_loss: 0.9952, test_loss: 1.1059, test_f1: 0.4374
 epoch: 42, train_loss: 0.9960, test_loss: 1.1232, test_f1: 0.4246
 epoch: 43, train_loss: 1.0007, test_loss: 1.1132, test_f1: 0.4332
 epoch: 44, train_loss: 0.9834, test_loss: 1.0910, test_f1: 0.4376
 epoch: 45, train_loss: 0.9938, test_loss: 1.0988, test_f1: 0.4376
 epoch: 46, train_loss: 0.9832, test_loss: 1.1058, test_f1: 0.4344
 epoch: 47, train_loss: 0.9877, test_loss: 1.0996, test_f1: 0.4370
 epoch: 48, train_loss: 0.9815, test_loss: 1.0863, test_f1: 0.4205
 epoch: 49, train_loss: 0.9765, test_loss: 1.1060, test_f1: 0.4053
 epoch: 50, train_loss: 0.9749, test_loss: 1.1014, test_f1: 0.4354
 epoch: 51, train_loss: 0.9730, test_loss: 1.0893, test_f1: 0.4336
 epoch: 52, train_loss: 0.9736, test_loss: 1.0904, test_f1: 0.4351
 epoch: 53, train_loss: 0.9786, test_loss: 1.0961, test_f1: 0.4388
 epoch: 54, train_loss: 0.9715, test_loss: 1.0926, test_f1: 0.4191
 epoch: 55, train_loss: 0.9684, test_loss: 1.0880, test_f1: 0.4245
 epoch: 56, train_loss: 0.9628, test_loss: 1.0949, test_f1: 0.4336
 epoch: 57, train_loss: 0.9690, test_loss: 1.0904, test_f1: 0.4368
 epoch: 58, train_loss: 0.9623, test_loss: 1.0883, test_f1: 0.4387
 epoch: 59, train_loss: 0.9672, test_loss: 1.0841, test_f1: 0.4358
 epoch: 60, train_loss: 0.9706, test_loss: 1.0785, test_f1: 0.4428
 epoch: 61, train_loss: 0.9612, test_loss: 1.0846, test_f1: 0.4416
 epoch: 62, train_loss: 0.9584, test_loss: 1.0903, test_f1: 0.4375
 epoch: 63, train_loss: 0.9661, test_loss: 1.0717, test_f1: 0.4364
 epoch: 64, train_loss: 0.9597, test_loss: 1.0803, test_f1: 0.4331
 epoch: 65, train_loss: 0.9497, test_loss: 1.0802, test_f1: 0.4383
 epoch: 66, train_loss: 0.9664, test_loss: 1.0723, test_f1: 0.4432
 epoch: 67, train_loss: 0.9590, test_loss: 1.0802, test_f1: 0.4316
 epoch: 68, train_loss: 0.9536, test_loss: 1.1020, test_f1: 0.4367
 epoch: 69, train_loss: 0.9527, test_loss: 1.0874, test_f1: 0.4351
 epoch: 70, train_loss: 0.9503, test_loss: 1.0798, test_f1: 0.4382
 epoch: 71, train_loss: 0.9527, test_loss: 1.0861, test_f1: 0.4356
 epoch: 72, train_loss: 0.9485, test_loss: 1.0881, test_f1: 0.4375
 epoch: 73, train_loss: 0.9460, test_loss: 1.0990, test_f1: 0.4351
 epoch: 74, train_loss: 0.9604, test_loss: 1.0961, test_f1: 0.4375
 epoch: 75, train_loss: 0.9449, test_loss: 1.1162, test_f1: 0.4308
 epoch: 76, train_loss: 0.9639, test_loss: 1.1142, test_f1: 0.4363
 epoch: 77, train_loss: 0.9386, test_loss: 1.1040, test_f1: 0.4295
 epoch: 78, train_loss: 0.9456, test_loss: 1.1021, test_f1: 0.4380
 epoch: 79, train_loss: 0.9435, test_loss: 1.0876, test_f1: 0.4357
 epoch: 80, train_loss: 0.9426, test_loss: 1.1018, test_f1: 0.4387
 epoch: 81, train_loss: 0.9418, test_loss: 1.0907, test_f1: 0.4357
 epoch: 82, train_loss: 0.9398, test_loss: 1.0985, test_f1: 0.4345
 epoch: 83, train_loss: 0.9384, test_loss: 1.0971, test_f1: 0.4365
 epoch: 84, train_loss: 0.9395, test_loss: 1.1363, test_f1: 0.4311
 epoch: 85, train_loss: 0.9345, test_loss: 1.1370, test_f1: 0.4343
 epoch: 86, train_loss: 0.9500, test_loss: 1.1229, test_f1: 0.4382
 epoch: 87, train_loss: 0.9348, test_loss: 1.1396, test_f1: 0.4432
 epoch: 88, train_loss: 0.9369, test_loss: 1.1169, test_f1: 0.4363
 epoch: 89, train_loss: 0.9392, test_loss: 1.1170, test_f1: 0.4363
 epoch: 90, train_loss: 0.9471, test_loss: 1.0761, test_f1: 0.4364
 epoch: 91, train_loss: 0.9428, test_loss: 1.0800, test_f1: 0.4310
 epoch: 92, train_loss: 0.9413, test_loss: 1.1123, test_f1: 0.4332
 epoch: 93, train_loss: 0.9464, test_loss: 1.1135, test_f1: 0.4387
 epoch: 94, train_loss: 0.9334, test_loss: 1.0921, test_f1: 0.4364
 epoch: 95, train_loss: 0.9351, test_loss: 1.0904, test_f1: 0.4389
 epoch: 96, train_loss: 0.9458, test_loss: 1.0832, test_f1: 0.4353
 epoch: 97, train_loss: 0.9223, test_loss: 1.0801, test_f1: 0.4303
 epoch: 98, train_loss: 0.9235, test_loss: 1.0932, test_f1: 0.4438
 epoch: 99, train_loss: 0.9327, test_loss: 1.0933, test_f1: 0.4377
##################ITERATION #5 ****************************************
 epoch: 0, train_loss: 1.2934, test_loss: 1.3192, test_f1: 0.2281
 epoch: 1, train_loss: 1.2014, test_loss: 1.3179, test_f1: 0.2281
 epoch: 2, train_loss: 1.1738, test_loss: 1.2992, test_f1: 0.2281
 epoch: 3, train_loss: 1.1449, test_loss: 1.2882, test_f1: 0.2281
 epoch: 4, train_loss: 1.1401, test_loss: 1.2687, test_f1: 0.2281
 epoch: 5, train_loss: 1.1227, test_loss: 1.2412, test_f1: 0.3015
 epoch: 6, train_loss: 1.1142, test_loss: 1.2121, test_f1: 0.3147
 epoch: 7, train_loss: 1.1039, test_loss: 1.1881, test_f1: 0.3140
 epoch: 8, train_loss: 1.0948, test_loss: 1.1762, test_f1: 0.3548
 epoch: 9, train_loss: 1.0898, test_loss: 1.1566, test_f1: 0.3776
 epoch: 10, train_loss: 1.0730, test_loss: 1.1427, test_f1: 0.3792
 epoch: 11, train_loss: 1.0635, test_loss: 1.1503, test_f1: 0.3740
 epoch: 12, train_loss: 1.0527, test_loss: 1.1297, test_f1: 0.3766
 epoch: 13, train_loss: 1.0663, test_loss: 1.1249, test_f1: 0.3932
 epoch: 14, train_loss: 1.0508, test_loss: 1.1391, test_f1: 0.3896
 epoch: 15, train_loss: 1.0532, test_loss: 1.1507, test_f1: 0.3821
 epoch: 16, train_loss: 1.0471, test_loss: 1.1216, test_f1: 0.3844
 epoch: 17, train_loss: 1.0451, test_loss: 1.1201, test_f1: 0.3793
 epoch: 18, train_loss: 1.0311, test_loss: 1.1116, test_f1: 0.3776
 epoch: 19, train_loss: 1.0298, test_loss: 1.1131, test_f1: 0.4084
 epoch: 20, train_loss: 1.0295, test_loss: 1.1349, test_f1: 0.4231
 epoch: 21, train_loss: 1.0284, test_loss: 1.1155, test_f1: 0.4002
 epoch: 22, train_loss: 1.0232, test_loss: 1.0963, test_f1: 0.3932
 epoch: 23, train_loss: 1.0192, test_loss: 1.1076, test_f1: 0.4259
 epoch: 24, train_loss: 1.0147, test_loss: 1.1149, test_f1: 0.3925
 epoch: 25, train_loss: 1.0010, test_loss: 1.1020, test_f1: 0.4265
 epoch: 26, train_loss: 1.0090, test_loss: 1.0949, test_f1: 0.4277
 epoch: 27, train_loss: 0.9983, test_loss: 1.0894, test_f1: 0.4318
 epoch: 28, train_loss: 0.9938, test_loss: 1.0875, test_f1: 0.4283
 epoch: 29, train_loss: 0.9865, test_loss: 1.0934, test_f1: 0.4375
 epoch: 30, train_loss: 0.9977, test_loss: 1.0822, test_f1: 0.4320
 epoch: 31, train_loss: 1.0003, test_loss: 1.0926, test_f1: 0.4291
 epoch: 32, train_loss: 1.0020, test_loss: 1.0693, test_f1: 0.3879
 epoch: 33, train_loss: 0.9941, test_loss: 1.0771, test_f1: 0.4307
 epoch: 34, train_loss: 0.9913, test_loss: 1.0904, test_f1: 0.4491
 epoch: 35, train_loss: 0.9931, test_loss: 1.0813, test_f1: 0.4366
 epoch: 36, train_loss: 0.9848, test_loss: 1.0909, test_f1: 0.4304
 epoch: 37, train_loss: 0.9841, test_loss: 1.1020, test_f1: 0.4386
 epoch: 38, train_loss: 0.9858, test_loss: 1.0711, test_f1: 0.4391
 epoch: 39, train_loss: 0.9803, test_loss: 1.0703, test_f1: 0.4290
 epoch: 40, train_loss: 0.9802, test_loss: 1.0709, test_f1: 0.4325
 epoch: 41, train_loss: 0.9772, test_loss: 1.1002, test_f1: 0.4459
 epoch: 42, train_loss: 0.9646, test_loss: 1.0898, test_f1: 0.4510
 epoch: 43, train_loss: 0.9599, test_loss: 1.0860, test_f1: 0.4616
 epoch: 44, train_loss: 0.9566, test_loss: 1.0621, test_f1: 0.4556
 epoch: 45, train_loss: 0.9573, test_loss: 1.0943, test_f1: 0.4527
 epoch: 46, train_loss: 0.9567, test_loss: 1.0872, test_f1: 0.4601
 epoch: 47, train_loss: 0.9526, test_loss: 1.0878, test_f1: 0.4572
 epoch: 48, train_loss: 0.9506, test_loss: 1.0688, test_f1: 0.4628
 epoch: 49, train_loss: 0.9461, test_loss: 1.0626, test_f1: 0.4519
 epoch: 50, train_loss: 0.9516, test_loss: 1.0656, test_f1: 0.4574
 epoch: 51, train_loss: 0.9342, test_loss: 1.0900, test_f1: 0.4608
 epoch: 52, train_loss: 0.9371, test_loss: 1.0889, test_f1: 0.4610
 epoch: 53, train_loss: 0.9445, test_loss: 1.0709, test_f1: 0.4610
 epoch: 54, train_loss: 0.9389, test_loss: 1.0678, test_f1: 0.4589
 epoch: 55, train_loss: 0.9364, test_loss: 1.0789, test_f1: 0.4633
 epoch: 56, train_loss: 0.9425, test_loss: 1.0986, test_f1: 0.4589
 epoch: 57, train_loss: 0.9357, test_loss: 1.0864, test_f1: 0.4538
 epoch: 58, train_loss: 0.9460, test_loss: 1.0720, test_f1: 0.4575
 epoch: 59, train_loss: 0.9354, test_loss: 1.0586, test_f1: 0.4605
 epoch: 60, train_loss: 0.9306, test_loss: 1.0682, test_f1: 0.4642
 epoch: 61, train_loss: 0.9249, test_loss: 1.0953, test_f1: 0.4527
 epoch: 62, train_loss: 0.9393, test_loss: 1.0646, test_f1: 0.4608
 epoch: 63, train_loss: 0.9315, test_loss: 1.0474, test_f1: 0.4521
 epoch: 64, train_loss: 0.9272, test_loss: 1.0382, test_f1: 0.4687
 epoch: 65, train_loss: 0.9325, test_loss: 1.0471, test_f1: 0.4732
 epoch: 66, train_loss: 0.9173, test_loss: 1.0673, test_f1: 0.4824
 epoch: 67, train_loss: 0.9239, test_loss: 1.0491, test_f1: 0.4858
 epoch: 68, train_loss: 0.9270, test_loss: 1.0411, test_f1: 0.4934
 epoch: 69, train_loss: 0.9188, test_loss: 1.0267, test_f1: 0.5064
 epoch: 70, train_loss: 0.9185, test_loss: 1.0381, test_f1: 0.5022
 epoch: 71, train_loss: 0.9226, test_loss: 1.0588, test_f1: 0.4922
 epoch: 72, train_loss: 0.9169, test_loss: 1.0666, test_f1: 0.4859
 epoch: 73, train_loss: 0.9275, test_loss: 1.0768, test_f1: 0.4882
 epoch: 74, train_loss: 0.9135, test_loss: 1.0623, test_f1: 0.4943
 epoch: 75, train_loss: 0.9137, test_loss: 1.0536, test_f1: 0.4999
 epoch: 76, train_loss: 0.9086, test_loss: 1.0647, test_f1: 0.4947
 epoch: 77, train_loss: 0.9203, test_loss: 1.0642, test_f1: 0.5008
 epoch: 78, train_loss: 0.9176, test_loss: 1.0582, test_f1: 0.5021
 epoch: 79, train_loss: 0.9122, test_loss: 1.0843, test_f1: 0.4756
 epoch: 80, train_loss: 0.9049, test_loss: 1.1003, test_f1: 0.5038
 epoch: 81, train_loss: 0.9269, test_loss: 1.0711, test_f1: 0.5082
 epoch: 82, train_loss: 0.9165, test_loss: 1.0395, test_f1: 0.5209
 epoch: 83, train_loss: 0.9189, test_loss: 1.0709, test_f1: 0.5132
 epoch: 84, train_loss: 0.9129, test_loss: 1.0658, test_f1: 0.5146
 epoch: 85, train_loss: 0.9037, test_loss: 1.0623, test_f1: 0.5168
 epoch: 86, train_loss: 0.9071, test_loss: 1.0810, test_f1: 0.5048
 epoch: 87, train_loss: 0.9196, test_loss: 1.0452, test_f1: 0.5161
 epoch: 88, train_loss: 0.9060, test_loss: 1.0243, test_f1: 0.5322
 epoch: 89, train_loss: 0.9284, test_loss: 1.0270, test_f1: 0.5233
 epoch: 90, train_loss: 0.9096, test_loss: 1.0290, test_f1: 0.5163
 epoch: 91, train_loss: 0.9071, test_loss: 1.0570, test_f1: 0.4901
 epoch: 92, train_loss: 0.8987, test_loss: 1.0649, test_f1: 0.4878
 epoch: 93, train_loss: 0.9141, test_loss: 1.1003, test_f1: 0.4878
 epoch: 94, train_loss: 0.9078, test_loss: 1.0750, test_f1: 0.5123
 epoch: 95, train_loss: 0.9150, test_loss: 1.0391, test_f1: 0.5364
 epoch: 96, train_loss: 0.9046, test_loss: 1.0381, test_f1: 0.5329
 epoch: 97, train_loss: 0.8962, test_loss: 1.0432, test_f1: 0.5469
 epoch: 98, train_loss: 0.8909, test_loss: 1.0339, test_f1: 0.5325
 epoch: 99, train_loss: 0.8973, test_loss: 1.0603, test_f1: 0.5465
##################ITERATION #6 ****************************************
 epoch: 0, train_loss: 1.3704, test_loss: 1.3525, test_f1: 0.2281
 epoch: 1, train_loss: 1.2013, test_loss: 1.3246, test_f1: 0.2281
 epoch: 2, train_loss: 1.1418, test_loss: 1.3034, test_f1: 0.2281
 epoch: 3, train_loss: 1.1105, test_loss: 1.2966, test_f1: 0.2281
 epoch: 4, train_loss: 1.0912, test_loss: 1.3399, test_f1: 0.2281
 epoch: 5, train_loss: 1.0758, test_loss: 1.3985, test_f1: 0.2390
 epoch: 6, train_loss: 1.0637, test_loss: 1.3616, test_f1: 0.2752
 epoch: 7, train_loss: 1.0621, test_loss: 1.2582, test_f1: 0.3680
 epoch: 8, train_loss: 1.0447, test_loss: 1.1935, test_f1: 0.3593
 epoch: 9, train_loss: 1.0324, test_loss: 1.1672, test_f1: 0.3738
 epoch: 10, train_loss: 1.0364, test_loss: 1.1344, test_f1: 0.3717
 epoch: 11, train_loss: 1.0259, test_loss: 1.1255, test_f1: 0.3840
 epoch: 12, train_loss: 1.0204, test_loss: 1.1020, test_f1: 0.3817
 epoch: 13, train_loss: 1.0169, test_loss: 1.1095, test_f1: 0.3868
 epoch: 14, train_loss: 1.0207, test_loss: 1.1094, test_f1: 0.3887
 epoch: 15, train_loss: 1.0080, test_loss: 1.0939, test_f1: 0.3816
 epoch: 16, train_loss: 0.9992, test_loss: 1.1099, test_f1: 0.3896
 epoch: 17, train_loss: 0.9985, test_loss: 1.1075, test_f1: 0.3945
 epoch: 18, train_loss: 0.9967, test_loss: 1.1265, test_f1: 0.3963
 epoch: 19, train_loss: 0.9956, test_loss: 1.1898, test_f1: 0.4033
 epoch: 20, train_loss: 0.9916, test_loss: 1.1559, test_f1: 0.4018
 epoch: 21, train_loss: 0.9885, test_loss: 1.1213, test_f1: 0.4013
 epoch: 22, train_loss: 0.9987, test_loss: 1.1203, test_f1: 0.4256
 epoch: 23, train_loss: 0.9816, test_loss: 1.1110, test_f1: 0.4175
 epoch: 24, train_loss: 0.9732, test_loss: 1.0840, test_f1: 0.3951
 epoch: 25, train_loss: 0.9818, test_loss: 1.0734, test_f1: 0.3932
 epoch: 26, train_loss: 0.9735, test_loss: 1.0652, test_f1: 0.3916
 epoch: 27, train_loss: 0.9682, test_loss: 1.0568, test_f1: 0.4521
 epoch: 28, train_loss: 0.9791, test_loss: 1.0630, test_f1: 0.4565
 epoch: 29, train_loss: 0.9652, test_loss: 1.0865, test_f1: 0.4211
 epoch: 30, train_loss: 0.9617, test_loss: 1.0954, test_f1: 0.4402
 epoch: 31, train_loss: 0.9552, test_loss: 1.0650, test_f1: 0.4359
 epoch: 32, train_loss: 0.9590, test_loss: 1.0780, test_f1: 0.4432
 epoch: 33, train_loss: 0.9553, test_loss: 1.0789, test_f1: 0.4587
 epoch: 34, train_loss: 0.9547, test_loss: 1.0688, test_f1: 0.4615
 epoch: 35, train_loss: 0.9598, test_loss: 1.0583, test_f1: 0.4600
 epoch: 36, train_loss: 0.9560, test_loss: 1.0621, test_f1: 0.4524
 epoch: 37, train_loss: 0.9530, test_loss: 1.0592, test_f1: 0.4525
 epoch: 38, train_loss: 0.9545, test_loss: 1.0894, test_f1: 0.4643
 epoch: 39, train_loss: 0.9471, test_loss: 1.0684, test_f1: 0.4688
 epoch: 40, train_loss: 0.9338, test_loss: 1.0483, test_f1: 0.4473
 epoch: 41, train_loss: 0.9423, test_loss: 1.0625, test_f1: 0.4532
 epoch: 42, train_loss: 0.9391, test_loss: 1.0598, test_f1: 0.4561
 epoch: 43, train_loss: 0.9362, test_loss: 1.0776, test_f1: 0.4386
 epoch: 44, train_loss: 0.9409, test_loss: 1.1539, test_f1: 0.4529
 epoch: 45, train_loss: 0.9529, test_loss: 1.1041, test_f1: 0.4634
 epoch: 46, train_loss: 0.9440, test_loss: 1.0559, test_f1: 0.4781
 epoch: 47, train_loss: 0.9388, test_loss: 1.0681, test_f1: 0.4942
 epoch: 48, train_loss: 0.9305, test_loss: 1.0935, test_f1: 0.5203
 epoch: 49, train_loss: 0.9342, test_loss: 1.0718, test_f1: 0.5354
 epoch: 50, train_loss: 0.9245, test_loss: 1.0280, test_f1: 0.5245
 epoch: 51, train_loss: 0.9275, test_loss: 1.0357, test_f1: 0.5310
 epoch: 52, train_loss: 0.9310, test_loss: 1.0519, test_f1: 0.5135
 epoch: 53, train_loss: 0.9262, test_loss: 1.0615, test_f1: 0.5129
 epoch: 54, train_loss: 0.9281, test_loss: 1.0638, test_f1: 0.5181
 epoch: 55, train_loss: 0.9262, test_loss: 1.0694, test_f1: 0.5209
 epoch: 56, train_loss: 0.9219, test_loss: 1.0601, test_f1: 0.5209
 epoch: 57, train_loss: 0.9136, test_loss: 1.0557, test_f1: 0.5219
 epoch: 58, train_loss: 0.9162, test_loss: 1.0649, test_f1: 0.5218
 epoch: 59, train_loss: 0.9248, test_loss: 1.0540, test_f1: 0.5227
 epoch: 60, train_loss: 0.9220, test_loss: 1.0395, test_f1: 0.5024
 epoch: 61, train_loss: 0.9207, test_loss: 1.0518, test_f1: 0.5169
 epoch: 62, train_loss: 0.9150, test_loss: 1.0538, test_f1: 0.5158
 epoch: 63, train_loss: 0.9250, test_loss: 1.0554, test_f1: 0.5252
 epoch: 64, train_loss: 0.9151, test_loss: 1.0530, test_f1: 0.5287
 epoch: 65, train_loss: 0.9150, test_loss: 1.0609, test_f1: 0.5387
 epoch: 66, train_loss: 0.9202, test_loss: 1.0593, test_f1: 0.5329
 epoch: 67, train_loss: 0.8957, test_loss: 1.0398, test_f1: 0.5249
 epoch: 68, train_loss: 0.9274, test_loss: 1.0440, test_f1: 0.5186
 epoch: 69, train_loss: 0.9161, test_loss: 1.0505, test_f1: 0.5071
 epoch: 70, train_loss: 0.9036, test_loss: 1.0512, test_f1: 0.5083
 epoch: 71, train_loss: 0.9090, test_loss: 1.0466, test_f1: 0.5178
 epoch: 72, train_loss: 0.9070, test_loss: 1.0479, test_f1: 0.5152
 epoch: 73, train_loss: 0.9033, test_loss: 1.0396, test_f1: 0.5075
 epoch: 74, train_loss: 0.9111, test_loss: 1.0407, test_f1: 0.5117
 epoch: 75, train_loss: 0.9030, test_loss: 1.0387, test_f1: 0.5138
 epoch: 76, train_loss: 0.9020, test_loss: 1.0430, test_f1: 0.5043
 epoch: 77, train_loss: 0.9051, test_loss: 1.0514, test_f1: 0.5053
 epoch: 78, train_loss: 0.8931, test_loss: 1.0498, test_f1: 0.5080
 epoch: 79, train_loss: 0.8893, test_loss: 1.0428, test_f1: 0.5209
 epoch: 80, train_loss: 0.8948, test_loss: 1.0376, test_f1: 0.5154
 epoch: 81, train_loss: 0.9033, test_loss: 1.0469, test_f1: 0.5131
 epoch: 82, train_loss: 0.9012, test_loss: 1.0493, test_f1: 0.5158
 epoch: 83, train_loss: 0.9035, test_loss: 1.0361, test_f1: 0.5196
 epoch: 84, train_loss: 0.9027, test_loss: 1.0473, test_f1: 0.5160
 epoch: 85, train_loss: 0.8976, test_loss: 1.0436, test_f1: 0.5156
 epoch: 86, train_loss: 0.8941, test_loss: 1.0653, test_f1: 0.5263
 epoch: 87, train_loss: 0.8942, test_loss: 1.0585, test_f1: 0.5274
 epoch: 88, train_loss: 0.8937, test_loss: 1.0485, test_f1: 0.5074
 epoch: 89, train_loss: 0.9007, test_loss: 1.0447, test_f1: 0.5128
 epoch: 90, train_loss: 0.8917, test_loss: 1.0320, test_f1: 0.5188
 epoch: 91, train_loss: 0.8890, test_loss: 1.0251, test_f1: 0.5366
 epoch: 92, train_loss: 0.8933, test_loss: 1.0204, test_f1: 0.5221
 epoch: 93, train_loss: 0.8927, test_loss: 1.0209, test_f1: 0.5278
 epoch: 94, train_loss: 0.8881, test_loss: 1.0262, test_f1: 0.5181
 epoch: 95, train_loss: 0.8945, test_loss: 1.0491, test_f1: 0.5221
 epoch: 96, train_loss: 0.8915, test_loss: 1.0512, test_f1: 0.5320
 epoch: 97, train_loss: 0.8954, test_loss: 1.0674, test_f1: 0.5395
 epoch: 98, train_loss: 0.8871, test_loss: 1.0540, test_f1: 0.5341
 epoch: 99, train_loss: 0.8893, test_loss: 1.0784, test_f1: 0.5468
##################ITERATION #7 ****************************************
 epoch: 0, train_loss: 1.2615, test_loss: 1.3118, test_f1: 0.2281
 epoch: 1, train_loss: 1.1786, test_loss: 1.3169, test_f1: 0.2281
 epoch: 2, train_loss: 1.1529, test_loss: 1.3366, test_f1: 0.2281
 epoch: 3, train_loss: 1.1285, test_loss: 1.3659, test_f1: 0.2281
 epoch: 4, train_loss: 1.1120, test_loss: 1.3873, test_f1: 0.2270
 epoch: 5, train_loss: 1.1041, test_loss: 1.3841, test_f1: 0.3215
 epoch: 6, train_loss: 1.0794, test_loss: 1.3617, test_f1: 0.3083
 epoch: 7, train_loss: 1.0694, test_loss: 1.3224, test_f1: 0.3137
 epoch: 8, train_loss: 1.0549, test_loss: 1.2785, test_f1: 0.3641
 epoch: 9, train_loss: 1.0496, test_loss: 1.2127, test_f1: 0.4033
 epoch: 10, train_loss: 1.0434, test_loss: 1.1616, test_f1: 0.4305
 epoch: 11, train_loss: 1.0388, test_loss: 1.1367, test_f1: 0.4312
 epoch: 12, train_loss: 1.0321, test_loss: 1.1220, test_f1: 0.4428
 epoch: 13, train_loss: 1.0134, test_loss: 1.1053, test_f1: 0.4310
 epoch: 14, train_loss: 1.0183, test_loss: 1.1019, test_f1: 0.4382
 epoch: 15, train_loss: 1.0071, test_loss: 1.0905, test_f1: 0.4498
 epoch: 16, train_loss: 1.0026, test_loss: 1.0763, test_f1: 0.4643
 epoch: 17, train_loss: 1.0021, test_loss: 1.0789, test_f1: 0.4435
 epoch: 18, train_loss: 0.9910, test_loss: 1.0796, test_f1: 0.4455
 epoch: 19, train_loss: 0.9950, test_loss: 1.0860, test_f1: 0.4455
 epoch: 20, train_loss: 0.9895, test_loss: 1.0781, test_f1: 0.4551
 epoch: 21, train_loss: 0.9781, test_loss: 1.0734, test_f1: 0.4724
 epoch: 22, train_loss: 0.9760, test_loss: 1.0784, test_f1: 0.4543
 epoch: 23, train_loss: 0.9710, test_loss: 1.0793, test_f1: 0.4647
 epoch: 24, train_loss: 0.9716, test_loss: 1.0702, test_f1: 0.4499
 epoch: 25, train_loss: 0.9666, test_loss: 1.0694, test_f1: 0.4503
 epoch: 26, train_loss: 0.9657, test_loss: 1.0745, test_f1: 0.4525
 epoch: 27, train_loss: 0.9628, test_loss: 1.0775, test_f1: 0.4608
 epoch: 28, train_loss: 0.9599, test_loss: 1.0715, test_f1: 0.4529
 epoch: 29, train_loss: 0.9656, test_loss: 1.0681, test_f1: 0.4507
 epoch: 30, train_loss: 0.9549, test_loss: 1.0596, test_f1: 0.4506
 epoch: 31, train_loss: 0.9507, test_loss: 1.0525, test_f1: 0.4661
 epoch: 32, train_loss: 0.9423, test_loss: 1.0538, test_f1: 0.4503
 epoch: 33, train_loss: 0.9523, test_loss: 1.0492, test_f1: 0.4489
 epoch: 34, train_loss: 0.9438, test_loss: 1.0474, test_f1: 0.4508
 epoch: 35, train_loss: 0.9559, test_loss: 1.0610, test_f1: 0.4630
 epoch: 36, train_loss: 0.9431, test_loss: 1.0752, test_f1: 0.4518
 epoch: 37, train_loss: 0.9388, test_loss: 1.0980, test_f1: 0.4440
 epoch: 38, train_loss: 0.9400, test_loss: 1.0747, test_f1: 0.4578
 epoch: 39, train_loss: 0.9325, test_loss: 1.0605, test_f1: 0.4500
 epoch: 40, train_loss: 0.9247, test_loss: 1.0417, test_f1: 0.4534
 epoch: 41, train_loss: 0.9251, test_loss: 1.0439, test_f1: 0.4510
 epoch: 42, train_loss: 0.9278, test_loss: 1.0358, test_f1: 0.4577
 epoch: 43, train_loss: 0.9336, test_loss: 1.0405, test_f1: 0.4815
 epoch: 44, train_loss: 0.9246, test_loss: 1.0328, test_f1: 0.4862
 epoch: 45, train_loss: 0.9040, test_loss: 1.0316, test_f1: 0.4938
 epoch: 46, train_loss: 0.9196, test_loss: 1.0687, test_f1: 0.4971
 epoch: 47, train_loss: 0.9150, test_loss: 1.0870, test_f1: 0.4974
 epoch: 48, train_loss: 0.9257, test_loss: 1.0277, test_f1: 0.5259
 epoch: 49, train_loss: 0.9163, test_loss: 1.0346, test_f1: 0.5083
 epoch: 50, train_loss: 0.9149, test_loss: 1.0591, test_f1: 0.5147
 epoch: 51, train_loss: 0.9129, test_loss: 1.0730, test_f1: 0.5358
 epoch: 52, train_loss: 0.9024, test_loss: 1.0644, test_f1: 0.5125
 epoch: 53, train_loss: 0.8972, test_loss: 1.0586, test_f1: 0.5255
 epoch: 54, train_loss: 0.8961, test_loss: 1.0505, test_f1: 0.5397
 epoch: 55, train_loss: 0.8912, test_loss: 1.0277, test_f1: 0.5379
 epoch: 56, train_loss: 0.9037, test_loss: 1.0427, test_f1: 0.5353
 epoch: 57, train_loss: 0.9105, test_loss: 1.0527, test_f1: 0.5165
 epoch: 58, train_loss: 0.8914, test_loss: 1.0350, test_f1: 0.5140
 epoch: 59, train_loss: 0.9013, test_loss: 1.0252, test_f1: 0.5170
 epoch: 60, train_loss: 0.8974, test_loss: 1.0265, test_f1: 0.5236
 epoch: 61, train_loss: 0.8940, test_loss: 1.0369, test_f1: 0.5117
 epoch: 62, train_loss: 0.8927, test_loss: 1.0524, test_f1: 0.5176
 epoch: 63, train_loss: 0.8980, test_loss: 1.0519, test_f1: 0.5162
 epoch: 64, train_loss: 0.8834, test_loss: 1.0424, test_f1: 0.5327
 epoch: 65, train_loss: 0.8796, test_loss: 1.0375, test_f1: 0.5217
 epoch: 66, train_loss: 0.8768, test_loss: 1.0449, test_f1: 0.5297
 epoch: 67, train_loss: 0.8966, test_loss: 1.0522, test_f1: 0.5469
 epoch: 68, train_loss: 0.8726, test_loss: 1.0525, test_f1: 0.5554
 epoch: 69, train_loss: 0.8750, test_loss: 1.0531, test_f1: 0.5427
 epoch: 70, train_loss: 0.8736, test_loss: 1.0513, test_f1: 0.5242
 epoch: 71, train_loss: 0.8806, test_loss: 1.0437, test_f1: 0.5331
 epoch: 72, train_loss: 0.8766, test_loss: 1.0485, test_f1: 0.5253
 epoch: 73, train_loss: 0.8611, test_loss: 1.0528, test_f1: 0.5277
 epoch: 74, train_loss: 0.8717, test_loss: 1.0458, test_f1: 0.5454
 epoch: 75, train_loss: 0.8674, test_loss: 1.0534, test_f1: 0.5323
 epoch: 76, train_loss: 0.8672, test_loss: 1.0459, test_f1: 0.5210
 epoch: 77, train_loss: 0.8642, test_loss: 1.0328, test_f1: 0.5340
 epoch: 78, train_loss: 0.8679, test_loss: 1.0185, test_f1: 0.5184
 epoch: 79, train_loss: 0.8627, test_loss: 1.0500, test_f1: 0.5329
 epoch: 80, train_loss: 0.8680, test_loss: 1.0450, test_f1: 0.5346
 epoch: 81, train_loss: 0.8819, test_loss: 1.0622, test_f1: 0.5341
 epoch: 82, train_loss: 0.8739, test_loss: 1.0803, test_f1: 0.5293
 epoch: 83, train_loss: 0.8700, test_loss: 1.0724, test_f1: 0.5494
 epoch: 84, train_loss: 0.8601, test_loss: 1.0786, test_f1: 0.5445
 epoch: 85, train_loss: 0.8687, test_loss: 1.0805, test_f1: 0.5511
 epoch: 86, train_loss: 0.8614, test_loss: 1.0799, test_f1: 0.5437
 epoch: 87, train_loss: 0.8537, test_loss: 1.0803, test_f1: 0.5493
 epoch: 88, train_loss: 0.8546, test_loss: 1.0548, test_f1: 0.5420
 epoch: 89, train_loss: 0.8512, test_loss: 1.0272, test_f1: 0.5266
 epoch: 90, train_loss: 0.8536, test_loss: 1.0356, test_f1: 0.5237
 epoch: 91, train_loss: 0.8525, test_loss: 1.0423, test_f1: 0.5351
 epoch: 92, train_loss: 0.8558, test_loss: 1.0442, test_f1: 0.5395
 epoch: 93, train_loss: 0.8481, test_loss: 1.0435, test_f1: 0.5328
 epoch: 94, train_loss: 0.8476, test_loss: 1.0375, test_f1: 0.5400
 epoch: 95, train_loss: 0.8470, test_loss: 1.0382, test_f1: 0.5416
 epoch: 96, train_loss: 0.8489, test_loss: 1.0305, test_f1: 0.5474
 epoch: 97, train_loss: 0.8437, test_loss: 1.0364, test_f1: 0.5220
 epoch: 98, train_loss: 0.8571, test_loss: 1.0276, test_f1: 0.5524
 epoch: 99, train_loss: 0.8445, test_loss: 1.0325, test_f1: 0.5430
##################ITERATION #8 ****************************************
 epoch: 0, train_loss: 1.3508, test_loss: 1.3246, test_f1: 0.2281
 epoch: 1, train_loss: 1.2181, test_loss: 1.3061, test_f1: 0.2281
 epoch: 2, train_loss: 1.1740, test_loss: 1.2927, test_f1: 0.2281
 epoch: 3, train_loss: 1.1410, test_loss: 1.2784, test_f1: 0.2281
 epoch: 4, train_loss: 1.1311, test_loss: 1.2512, test_f1: 0.3018
 epoch: 5, train_loss: 1.0941, test_loss: 1.2082, test_f1: 0.3317
 epoch: 6, train_loss: 1.0776, test_loss: 1.1746, test_f1: 0.3395
 epoch: 7, train_loss: 1.0659, test_loss: 1.1446, test_f1: 0.3607
 epoch: 8, train_loss: 1.0564, test_loss: 1.1249, test_f1: 0.4223
 epoch: 9, train_loss: 1.0441, test_loss: 1.1127, test_f1: 0.4362
 epoch: 10, train_loss: 1.0327, test_loss: 1.1086, test_f1: 0.4264
 epoch: 11, train_loss: 1.0352, test_loss: 1.1124, test_f1: 0.3865
 epoch: 12, train_loss: 1.0220, test_loss: 1.1222, test_f1: 0.4061
 epoch: 13, train_loss: 1.0228, test_loss: 1.1252, test_f1: 0.4283
 epoch: 14, train_loss: 1.0093, test_loss: 1.1258, test_f1: 0.4194
 epoch: 15, train_loss: 1.0051, test_loss: 1.1245, test_f1: 0.4197
 epoch: 16, train_loss: 0.9964, test_loss: 1.1150, test_f1: 0.4301
 epoch: 17, train_loss: 0.9931, test_loss: 1.1056, test_f1: 0.4374
 epoch: 18, train_loss: 1.0028, test_loss: 1.1014, test_f1: 0.4296
 epoch: 19, train_loss: 0.9725, test_loss: 1.1096, test_f1: 0.4203
 epoch: 20, train_loss: 0.9872, test_loss: 1.1171, test_f1: 0.4292
 epoch: 21, train_loss: 0.9786, test_loss: 1.1157, test_f1: 0.4416
 epoch: 22, train_loss: 0.9724, test_loss: 1.0946, test_f1: 0.4476
 epoch: 23, train_loss: 0.9701, test_loss: 1.0946, test_f1: 0.4684
 epoch: 24, train_loss: 0.9607, test_loss: 1.1215, test_f1: 0.4468
 epoch: 25, train_loss: 0.9625, test_loss: 1.1069, test_f1: 0.4604
 epoch: 26, train_loss: 0.9607, test_loss: 1.0972, test_f1: 0.4621
 epoch: 27, train_loss: 0.9626, test_loss: 1.0932, test_f1: 0.4563
 epoch: 28, train_loss: 0.9676, test_loss: 1.0935, test_f1: 0.4746
 epoch: 29, train_loss: 0.9594, test_loss: 1.0821, test_f1: 0.4815
 epoch: 30, train_loss: 0.9432, test_loss: 1.0888, test_f1: 0.4821
 epoch: 31, train_loss: 0.9432, test_loss: 1.1369, test_f1: 0.4603
 epoch: 32, train_loss: 0.9406, test_loss: 1.1482, test_f1: 0.4699
 epoch: 33, train_loss: 0.9272, test_loss: 1.1306, test_f1: 0.4876
 epoch: 34, train_loss: 0.9353, test_loss: 1.0968, test_f1: 0.4959
 epoch: 35, train_loss: 0.9292, test_loss: 1.1045, test_f1: 0.5031
 epoch: 36, train_loss: 0.9222, test_loss: 1.1199, test_f1: 0.4933
 epoch: 37, train_loss: 0.9181, test_loss: 1.1354, test_f1: 0.5026
 epoch: 38, train_loss: 0.9274, test_loss: 1.0852, test_f1: 0.5439
 epoch: 39, train_loss: 0.9271, test_loss: 1.0869, test_f1: 0.5169
 epoch: 40, train_loss: 0.9200, test_loss: 1.0708, test_f1: 0.4882
 epoch: 41, train_loss: 0.9173, test_loss: 1.0943, test_f1: 0.5254
 epoch: 42, train_loss: 0.9117, test_loss: 1.1406, test_f1: 0.5026
 epoch: 43, train_loss: 0.9222, test_loss: 1.1644, test_f1: 0.4630
 epoch: 44, train_loss: 0.9125, test_loss: 1.1232, test_f1: 0.4893
 epoch: 45, train_loss: 0.9168, test_loss: 1.0645, test_f1: 0.5171
 epoch: 46, train_loss: 0.9184, test_loss: 1.0522, test_f1: 0.5356
 epoch: 47, train_loss: 0.9242, test_loss: 1.0919, test_f1: 0.5249
 epoch: 48, train_loss: 0.8978, test_loss: 1.0880, test_f1: 0.5497
 epoch: 49, train_loss: 0.8981, test_loss: 1.0586, test_f1: 0.5612
 epoch: 50, train_loss: 0.9004, test_loss: 1.0551, test_f1: 0.5412
 epoch: 51, train_loss: 0.8978, test_loss: 1.0691, test_f1: 0.5401
 epoch: 52, train_loss: 0.8862, test_loss: 1.0715, test_f1: 0.5345
 epoch: 53, train_loss: 0.8922, test_loss: 1.0635, test_f1: 0.5208
 epoch: 54, train_loss: 0.8849, test_loss: 1.0813, test_f1: 0.5098
 epoch: 55, train_loss: 0.8856, test_loss: 1.0748, test_f1: 0.5242
 epoch: 56, train_loss: 0.8785, test_loss: 1.0572, test_f1: 0.5156
 epoch: 57, train_loss: 0.8852, test_loss: 1.0559, test_f1: 0.5251
 epoch: 58, train_loss: 0.8716, test_loss: 1.0505, test_f1: 0.5332
 epoch: 59, train_loss: 0.8839, test_loss: 1.0549, test_f1: 0.5350
 epoch: 60, train_loss: 0.8704, test_loss: 1.0606, test_f1: 0.5382
 epoch: 61, train_loss: 0.8751, test_loss: 1.0495, test_f1: 0.5393
 epoch: 62, train_loss: 0.8680, test_loss: 1.0687, test_f1: 0.5080
 epoch: 63, train_loss: 0.8622, test_loss: 1.0645, test_f1: 0.5316
 epoch: 64, train_loss: 0.8680, test_loss: 1.0578, test_f1: 0.5553
 epoch: 65, train_loss: 0.8532, test_loss: 1.0637, test_f1: 0.5471
 epoch: 66, train_loss: 0.8636, test_loss: 1.0636, test_f1: 0.5383
 epoch: 67, train_loss: 0.8577, test_loss: 1.0724, test_f1: 0.5377
 epoch: 68, train_loss: 0.8611, test_loss: 1.0875, test_f1: 0.5322
 epoch: 69, train_loss: 0.8718, test_loss: 1.0862, test_f1: 0.5441
 epoch: 70, train_loss: 0.8595, test_loss: 1.0753, test_f1: 0.5246
 epoch: 71, train_loss: 0.8672, test_loss: 1.0747, test_f1: 0.5586
 epoch: 72, train_loss: 0.8574, test_loss: 1.1041, test_f1: 0.5449
 epoch: 73, train_loss: 0.8514, test_loss: 1.0487, test_f1: 0.5560
 epoch: 74, train_loss: 0.8549, test_loss: 1.0332, test_f1: 0.5664
 epoch: 75, train_loss: 0.8410, test_loss: 1.0557, test_f1: 0.5492
 epoch: 76, train_loss: 0.8570, test_loss: 1.0588, test_f1: 0.5530
 epoch: 77, train_loss: 0.8358, test_loss: 1.0472, test_f1: 0.5522
 epoch: 78, train_loss: 0.8447, test_loss: 1.0428, test_f1: 0.5531
 epoch: 79, train_loss: 0.8393, test_loss: 1.0501, test_f1: 0.5406
 epoch: 80, train_loss: 0.8440, test_loss: 1.0627, test_f1: 0.5446
 epoch: 81, train_loss: 0.8307, test_loss: 1.0604, test_f1: 0.5471
 epoch: 82, train_loss: 0.8328, test_loss: 1.0618, test_f1: 0.5492
 epoch: 83, train_loss: 0.8322, test_loss: 1.0553, test_f1: 0.5606
 epoch: 84, train_loss: 0.8346, test_loss: 1.0591, test_f1: 0.5585
 epoch: 85, train_loss: 0.8356, test_loss: 1.0506, test_f1: 0.5590
 epoch: 86, train_loss: 0.8338, test_loss: 1.0398, test_f1: 0.5580
 epoch: 87, train_loss: 0.8239, test_loss: 1.0432, test_f1: 0.5595
 epoch: 88, train_loss: 0.8258, test_loss: 1.0656, test_f1: 0.5525
 epoch: 89, train_loss: 0.8258, test_loss: 1.0670, test_f1: 0.5438
 epoch: 90, train_loss: 0.8201, test_loss: 1.1135, test_f1: 0.5227
 epoch: 91, train_loss: 0.8187, test_loss: 1.0626, test_f1: 0.5824
 epoch: 92, train_loss: 0.8108, test_loss: 1.0504, test_f1: 0.5628
 epoch: 93, train_loss: 0.8075, test_loss: 1.0514, test_f1: 0.5347
 epoch: 94, train_loss: 0.8145, test_loss: 1.0875, test_f1: 0.5297
 epoch: 95, train_loss: 0.8084, test_loss: 1.0688, test_f1: 0.5401
 epoch: 96, train_loss: 0.8256, test_loss: 1.0606, test_f1: 0.5573
 epoch: 97, train_loss: 0.8253, test_loss: 1.0344, test_f1: 0.5559
 epoch: 98, train_loss: 0.8142, test_loss: 1.0584, test_f1: 0.5421
 epoch: 99, train_loss: 0.8135, test_loss: 1.0948, test_f1: 0.5665
##################ITERATION #9 ****************************************
 epoch: 0, train_loss: 1.5436, test_loss: 1.3669, test_f1: 0.2281
 epoch: 1, train_loss: 1.2643, test_loss: 1.3193, test_f1: 0.2281
 epoch: 2, train_loss: 1.1971, test_loss: 1.2940, test_f1: 0.2281
 epoch: 3, train_loss: 1.1499, test_loss: 1.3373, test_f1: 0.2281
 epoch: 4, train_loss: 1.1328, test_loss: 1.3810, test_f1: 0.2597
 epoch: 5, train_loss: 1.1333, test_loss: 1.3550, test_f1: 0.3088
 epoch: 6, train_loss: 1.1184, test_loss: 1.2983, test_f1: 0.3334
 epoch: 7, train_loss: 1.1072, test_loss: 1.2478, test_f1: 0.3615
 epoch: 8, train_loss: 1.0933, test_loss: 1.2152, test_f1: 0.4051
 epoch: 9, train_loss: 1.0832, test_loss: 1.1949, test_f1: 0.4418
 epoch: 10, train_loss: 1.0767, test_loss: 1.1885, test_f1: 0.4430
 epoch: 11, train_loss: 1.0666, test_loss: 1.1732, test_f1: 0.4303
 epoch: 12, train_loss: 1.0619, test_loss: 1.1712, test_f1: 0.4219
 epoch: 13, train_loss: 1.0470, test_loss: 1.1691, test_f1: 0.4184
 epoch: 14, train_loss: 1.0538, test_loss: 1.1567, test_f1: 0.4199
 epoch: 15, train_loss: 1.0445, test_loss: 1.1466, test_f1: 0.4223
 epoch: 16, train_loss: 1.0345, test_loss: 1.1289, test_f1: 0.4406
 epoch: 17, train_loss: 1.0223, test_loss: 1.1218, test_f1: 0.4357
 epoch: 18, train_loss: 1.0233, test_loss: 1.1053, test_f1: 0.4502
 epoch: 19, train_loss: 1.0186, test_loss: 1.0987, test_f1: 0.4643
 epoch: 20, train_loss: 1.0144, test_loss: 1.0990, test_f1: 0.4670
 epoch: 21, train_loss: 1.0103, test_loss: 1.1002, test_f1: 0.4584
 epoch: 22, train_loss: 1.0094, test_loss: 1.0987, test_f1: 0.4713
 epoch: 23, train_loss: 0.9948, test_loss: 1.1029, test_f1: 0.4574
 epoch: 24, train_loss: 0.9985, test_loss: 1.1120, test_f1: 0.4468
 epoch: 25, train_loss: 0.9981, test_loss: 1.0994, test_f1: 0.4469
 epoch: 26, train_loss: 0.9886, test_loss: 1.1037, test_f1: 0.4512
 epoch: 27, train_loss: 0.9794, test_loss: 1.0949, test_f1: 0.4680
 epoch: 28, train_loss: 0.9782, test_loss: 1.0867, test_f1: 0.4667
 epoch: 29, train_loss: 0.9878, test_loss: 1.0925, test_f1: 0.4806
 epoch: 30, train_loss: 0.9869, test_loss: 1.0844, test_f1: 0.4737
 epoch: 31, train_loss: 0.9703, test_loss: 1.0777, test_f1: 0.4945
 epoch: 32, train_loss: 0.9795, test_loss: 1.0750, test_f1: 0.4867
 epoch: 33, train_loss: 0.9741, test_loss: 1.0722, test_f1: 0.4825
 epoch: 34, train_loss: 0.9696, test_loss: 1.0787, test_f1: 0.4926
 epoch: 35, train_loss: 0.9606, test_loss: 1.0886, test_f1: 0.4994
 epoch: 36, train_loss: 0.9590, test_loss: 1.0714, test_f1: 0.5020
 epoch: 37, train_loss: 0.9638, test_loss: 1.0802, test_f1: 0.5038
 epoch: 38, train_loss: 0.9577, test_loss: 1.1108, test_f1: 0.4895
 epoch: 39, train_loss: 0.9638, test_loss: 1.0845, test_f1: 0.5078
 epoch: 40, train_loss: 0.9521, test_loss: 1.0626, test_f1: 0.5102
 epoch: 41, train_loss: 0.9554, test_loss: 1.0596, test_f1: 0.5092
 epoch: 42, train_loss: 0.9498, test_loss: 1.0751, test_f1: 0.5163
 epoch: 43, train_loss: 0.9551, test_loss: 1.1005, test_f1: 0.5122
 epoch: 44, train_loss: 0.9617, test_loss: 1.0920, test_f1: 0.5076
 epoch: 45, train_loss: 0.9423, test_loss: 1.0650, test_f1: 0.5234
 epoch: 46, train_loss: 0.9458, test_loss: 1.0664, test_f1: 0.5171
 epoch: 47, train_loss: 0.9336, test_loss: 1.0774, test_f1: 0.5091
 epoch: 48, train_loss: 0.9342, test_loss: 1.0664, test_f1: 0.5031
 epoch: 49, train_loss: 0.9390, test_loss: 1.0571, test_f1: 0.5185
 epoch: 50, train_loss: 0.9320, test_loss: 1.0579, test_f1: 0.5314
 epoch: 51, train_loss: 0.9482, test_loss: 1.0493, test_f1: 0.5313
 epoch: 52, train_loss: 0.9307, test_loss: 1.0490, test_f1: 0.5224
 epoch: 53, train_loss: 0.9367, test_loss: 1.0467, test_f1: 0.5332
 epoch: 54, train_loss: 0.9206, test_loss: 1.0331, test_f1: 0.5323
 epoch: 55, train_loss: 0.9280, test_loss: 1.0363, test_f1: 0.5233
 epoch: 56, train_loss: 0.9190, test_loss: 1.0398, test_f1: 0.5121
 epoch: 57, train_loss: 0.9159, test_loss: 1.0441, test_f1: 0.5205
 epoch: 58, train_loss: 0.9160, test_loss: 1.0447, test_f1: 0.5182
 epoch: 59, train_loss: 0.9188, test_loss: 1.0463, test_f1: 0.5200
 epoch: 60, train_loss: 0.9102, test_loss: 1.0493, test_f1: 0.5284
 epoch: 61, train_loss: 0.9148, test_loss: 1.0520, test_f1: 0.5260
 epoch: 62, train_loss: 0.9110, test_loss: 1.0479, test_f1: 0.5347
 epoch: 63, train_loss: 0.8996, test_loss: 1.0449, test_f1: 0.5360
 epoch: 64, train_loss: 0.9102, test_loss: 1.0522, test_f1: 0.5347
 epoch: 65, train_loss: 0.9147, test_loss: 1.0522, test_f1: 0.5294
 epoch: 66, train_loss: 0.9103, test_loss: 1.0430, test_f1: 0.5384
 epoch: 67, train_loss: 0.9082, test_loss: 1.0353, test_f1: 0.5384
 epoch: 68, train_loss: 0.9167, test_loss: 1.0358, test_f1: 0.5336
 epoch: 69, train_loss: 0.9055, test_loss: 1.0543, test_f1: 0.5404
 epoch: 70, train_loss: 0.9141, test_loss: 1.0616, test_f1: 0.5449
 epoch: 71, train_loss: 0.8972, test_loss: 1.0378, test_f1: 0.5306
 epoch: 72, train_loss: 0.8955, test_loss: 1.0307, test_f1: 0.5358
 epoch: 73, train_loss: 0.8891, test_loss: 1.0426, test_f1: 0.5354
 epoch: 74, train_loss: 0.8983, test_loss: 1.0313, test_f1: 0.5447
 epoch: 75, train_loss: 0.9000, test_loss: 1.0187, test_f1: 0.5376
 epoch: 76, train_loss: 0.8992, test_loss: 1.0201, test_f1: 0.5250
 epoch: 77, train_loss: 0.9014, test_loss: 1.0411, test_f1: 0.5126
 epoch: 78, train_loss: 0.8928, test_loss: 1.0369, test_f1: 0.5282
 epoch: 79, train_loss: 0.8978, test_loss: 1.0478, test_f1: 0.5562
 epoch: 80, train_loss: 0.8965, test_loss: 1.0478, test_f1: 0.5514
 epoch: 81, train_loss: 0.9052, test_loss: 1.0425, test_f1: 0.5292
 epoch: 82, train_loss: 0.8903, test_loss: 1.0502, test_f1: 0.5236
 epoch: 83, train_loss: 0.9009, test_loss: 1.0377, test_f1: 0.5561
 epoch: 84, train_loss: 0.9056, test_loss: 1.0195, test_f1: 0.5343
 epoch: 85, train_loss: 0.8932, test_loss: 1.0246, test_f1: 0.5343
 epoch: 86, train_loss: 0.8980, test_loss: 1.0434, test_f1: 0.4981
 epoch: 87, train_loss: 0.8948, test_loss: 1.0448, test_f1: 0.5347
 epoch: 88, train_loss: 0.8835, test_loss: 1.0467, test_f1: 0.5328
 epoch: 89, train_loss: 0.8700, test_loss: 1.0388, test_f1: 0.5460
 epoch: 90, train_loss: 0.8873, test_loss: 1.0356, test_f1: 0.5428
 epoch: 91, train_loss: 0.8970, test_loss: 1.0496, test_f1: 0.5473
 epoch: 92, train_loss: 0.8927, test_loss: 1.0490, test_f1: 0.5333
 epoch: 93, train_loss: 0.8937, test_loss: 1.0329, test_f1: 0.5567
 epoch: 94, train_loss: 0.8808, test_loss: 1.0375, test_f1: 0.5772
 epoch: 95, train_loss: 0.8834, test_loss: 1.0386, test_f1: 0.5829
 epoch: 96, train_loss: 0.8865, test_loss: 1.0366, test_f1: 0.5649
 epoch: 97, train_loss: 0.8932, test_loss: 1.0287, test_f1: 0.5430
 epoch: 98, train_loss: 0.8688, test_loss: 1.0416, test_f1: 0.5607
 epoch: 99, train_loss: 0.8691, test_loss: 1.0477, test_f1: 0.5599

Training completed in 306.63 seconds
Best F1: 0.5829 at epoch 95
Mean F1 across iterations: 0.5267  0.0458
========================FINAL RESULTS================================
FEGIN weighted F1: 0.5829  0.0458
python main.py --data ltspice_demos --representation component_pin_net --model FEGIN --layers 4 --hiddens 16 --batch_size 256 --lr 0.001 --emb_size 128 --epochs 100 --save_appendix component_pin_net_L4_H16_BS256_LR0.001_E128 --no_val
-----



STDERR:
  File "main.py", line 370, in <module>
    main()
  File "main.py", line 254, in main
    dataset = dataset_class(
  File "/home/philip/projects/ltspice_examples_code_repo/Circuit-Completion-Using-GNNs/component_classification_with_link_prediction_head/evaluation/FEGIN/kernel/circuit_datasets.py", line 15, in __init__
    self.data, self.slices = torch.load(self.processed_paths[0])
  File "/home/philip/.local/lib/python3.8/site-packages/torch/serialization.py", line 1040, in load
    warnings.warn(
  File "/usr/lib/python3.8/warnings.py", line 109, in _showwarnmsg
    sw(msg.message, msg.category, msg.filename, msg.lineno,
  File "main.py", line 47, in warn_with_traceback
    traceback.print_stack(file=log)
/home/philip/projects/ltspice_examples_code_repo/Circuit-Completion-Using-GNNs/component_classification_with_link_prediction_head/evaluation/FEGIN/kernel/circuit_datasets.py:15: FutureWarning: You are using `torch.load` with `weights_only=False` (the current default value), which uses the default pickle module implicitly. It is possible to construct malicious pickle data which will execute arbitrary code during unpickling (See https://github.com/pytorch/pytorch/blob/main/SECURITY.md#untrusted-models for more details). In a future release, the default value for `weights_only` will be flipped to `True`. This limits the functions that could be executed during unpickling. Arbitrary objects will no longer be allowed to be loaded via this mode unless they are explicitly allowlisted by the user via `torch.serialization.add_safe_globals`. We recommend you start setting `weights_only=True` for any use case where you don't have full control of the loaded file. Please open an issue on GitHub for any issues related to this experimental feature.
  self.data, self.slices = torch.load(self.processed_paths[0])
