STDOUT:
Results will be saved in /home/philip/projects/ltspice_examples_code_repo/Circuit-Completion-Using-GNNs/component_classification_with_link_prediction_head/evaluation/FEGIN/results/model_FEGIN_dataset_ltspice_examples
Command line input: python main.py --data ltspice_examples --representation component_pin --model FEGIN --layers 3 --hiddens 16 --batch_size 256 --lr 0.1 --emb_size 128 --epochs 100 --save_appendix component_pin_L3_H16_BS256_LR0.1_E128 --no_val
 is saved.
-----
ltspice_examples - FEGIN
Using 3 layers, 16 hidden units, h = 2
Loading component_pin representation dataset
ENTERED
Training FEGIN on component_pin representation
Train: 3560, Test: 848
##################ITERATION #0 ****************************************
 epoch: 0, train_loss: 1.2721, test_loss: 1.6764, test_f1: 0.3474
 epoch: 1, train_loss: 1.1044, test_loss: 1.2383, test_f1: 0.3890
 epoch: 2, train_loss: 1.0483, test_loss: 1.1041, test_f1: 0.3775
 epoch: 3, train_loss: 1.0377, test_loss: 1.0314, test_f1: 0.4518
 epoch: 4, train_loss: 1.0274, test_loss: 1.0725, test_f1: 0.4088
 epoch: 5, train_loss: 1.0062, test_loss: 0.9971, test_f1: 0.4223
 epoch: 6, train_loss: 1.0126, test_loss: 1.1097, test_f1: 0.3479
 epoch: 7, train_loss: 0.9951, test_loss: 1.1511, test_f1: 0.4525
 epoch: 8, train_loss: 1.0000, test_loss: 1.0686, test_f1: 0.4124
 epoch: 9, train_loss: 0.9814, test_loss: 1.0233, test_f1: 0.4851
 epoch: 10, train_loss: 0.9545, test_loss: 1.1403, test_f1: 0.4422
 epoch: 11, train_loss: 0.9467, test_loss: 1.2518, test_f1: 0.3947
 epoch: 12, train_loss: 0.9614, test_loss: 1.1175, test_f1: 0.4767
 epoch: 13, train_loss: 0.9754, test_loss: 1.0505, test_f1: 0.4386
 epoch: 14, train_loss: 0.9652, test_loss: 1.0890, test_f1: 0.4504
 epoch: 15, train_loss: 0.9804, test_loss: 1.0044, test_f1: 0.4886
 epoch: 16, train_loss: 0.9531, test_loss: 1.1715, test_f1: 0.4017
 epoch: 17, train_loss: 0.9571, test_loss: 0.9802, test_f1: 0.4529
 epoch: 18, train_loss: 0.9604, test_loss: 1.4007, test_f1: 0.3427
 epoch: 19, train_loss: 0.9081, test_loss: 0.9673, test_f1: 0.4770
 epoch: 20, train_loss: 0.9418, test_loss: 1.0073, test_f1: 0.4681
 epoch: 21, train_loss: 0.9424, test_loss: 1.2138, test_f1: 0.4402
 epoch: 22, train_loss: 0.9310, test_loss: 1.0073, test_f1: 0.4476
 epoch: 23, train_loss: 0.9283, test_loss: 0.9402, test_f1: 0.4438
 epoch: 24, train_loss: 0.9217, test_loss: 1.2793, test_f1: 0.4179
 epoch: 25, train_loss: 0.8989, test_loss: 0.9352, test_f1: 0.4678
 epoch: 26, train_loss: 0.9120, test_loss: 0.9306, test_f1: 0.4362
 epoch: 27, train_loss: 0.9206, test_loss: 1.0756, test_f1: 0.4855
 epoch: 28, train_loss: 0.9061, test_loss: 0.9451, test_f1: 0.4727
 epoch: 29, train_loss: 0.9032, test_loss: 1.0119, test_f1: 0.5162
 epoch: 30, train_loss: 0.9181, test_loss: 1.0132, test_f1: 0.4741
 epoch: 31, train_loss: 0.9070, test_loss: 0.9765, test_f1: 0.4904
 epoch: 32, train_loss: 0.9122, test_loss: 1.1041, test_f1: 0.4178
 epoch: 33, train_loss: 0.9030, test_loss: 0.9843, test_f1: 0.4344
 epoch: 34, train_loss: 0.8826, test_loss: 0.9784, test_f1: 0.4407
 epoch: 35, train_loss: 0.8816, test_loss: 1.1848, test_f1: 0.4486
 epoch: 36, train_loss: 0.9036, test_loss: 1.1150, test_f1: 0.4693
 epoch: 37, train_loss: 0.8854, test_loss: 1.0320, test_f1: 0.5169
 epoch: 38, train_loss: 0.9124, test_loss: 0.9297, test_f1: 0.4692
 epoch: 39, train_loss: 0.9003, test_loss: 1.0485, test_f1: 0.5123
 epoch: 40, train_loss: 0.8826, test_loss: 1.0875, test_f1: 0.5074
 epoch: 41, train_loss: 0.8917, test_loss: 1.1937, test_f1: 0.4875
 epoch: 42, train_loss: 0.8931, test_loss: 0.9097, test_f1: 0.4934
 epoch: 43, train_loss: 0.8814, test_loss: 1.0721, test_f1: 0.5088
 epoch: 44, train_loss: 0.8954, test_loss: 1.0202, test_f1: 0.4785
 epoch: 45, train_loss: 0.8867, test_loss: 0.9353, test_f1: 0.4761
 epoch: 46, train_loss: 0.8899, test_loss: 1.1280, test_f1: 0.5386
 epoch: 47, train_loss: 0.8811, test_loss: 1.1999, test_f1: 0.4631
 epoch: 48, train_loss: 0.8840, test_loss: 1.2126, test_f1: 0.4244
 epoch: 49, train_loss: 0.8804, test_loss: 0.9561, test_f1: 0.5046
 epoch: 50, train_loss: 0.8885, test_loss: 0.9418, test_f1: 0.5908
 epoch: 51, train_loss: 0.8685, test_loss: 1.1393, test_f1: 0.5113
 epoch: 52, train_loss: 0.8628, test_loss: 1.0857, test_f1: 0.5352
 epoch: 53, train_loss: 0.8570, test_loss: 0.9813, test_f1: 0.5413
 epoch: 54, train_loss: 0.8575, test_loss: 1.0096, test_f1: 0.5238
 epoch: 55, train_loss: 0.8383, test_loss: 1.2194, test_f1: 0.4923
 epoch: 56, train_loss: 0.8417, test_loss: 1.1935, test_f1: 0.5219
 epoch: 57, train_loss: 0.8442, test_loss: 1.0787, test_f1: 0.5168
 epoch: 58, train_loss: 0.8486, test_loss: 1.1070, test_f1: 0.5039
 epoch: 59, train_loss: 0.8503, test_loss: 0.9780, test_f1: 0.5279
 epoch: 60, train_loss: 0.8561, test_loss: 0.9689, test_f1: 0.5492
 epoch: 61, train_loss: 0.8402, test_loss: 1.0947, test_f1: 0.5240
 epoch: 62, train_loss: 0.8431, test_loss: 1.0529, test_f1: 0.4613
 epoch: 63, train_loss: 0.8356, test_loss: 1.2707, test_f1: 0.4912
 epoch: 64, train_loss: 0.8347, test_loss: 1.0514, test_f1: 0.5126
 epoch: 65, train_loss: 0.8395, test_loss: 0.9854, test_f1: 0.5159
 epoch: 66, train_loss: 0.8515, test_loss: 1.0138, test_f1: 0.5578
 epoch: 67, train_loss: 0.8481, test_loss: 1.2525, test_f1: 0.4097
 epoch: 68, train_loss: 0.8354, test_loss: 0.8513, test_f1: 0.5448
 epoch: 69, train_loss: 0.8633, test_loss: 1.0151, test_f1: 0.5203
 epoch: 70, train_loss: 0.8424, test_loss: 1.0551, test_f1: 0.5169
 epoch: 71, train_loss: 0.8307, test_loss: 1.1738, test_f1: 0.5211
 epoch: 72, train_loss: 0.8195, test_loss: 1.0210, test_f1: 0.5293
 epoch: 73, train_loss: 0.8382, test_loss: 1.0143, test_f1: 0.5161
 epoch: 74, train_loss: 0.8483, test_loss: 1.3020, test_f1: 0.4808
 epoch: 75, train_loss: 0.8464, test_loss: 1.1402, test_f1: 0.5115
 epoch: 76, train_loss: 0.8229, test_loss: 0.9736, test_f1: 0.5369
 epoch: 77, train_loss: 0.8157, test_loss: 1.1359, test_f1: 0.5208
 epoch: 78, train_loss: 0.8147, test_loss: 1.0571, test_f1: 0.5430
 epoch: 79, train_loss: 0.8248, test_loss: 1.1504, test_f1: 0.4772
 epoch: 80, train_loss: 0.8218, test_loss: 0.9967, test_f1: 0.5164
 epoch: 81, train_loss: 0.8264, test_loss: 0.9868, test_f1: 0.5140
 epoch: 82, train_loss: 0.8287, test_loss: 1.2816, test_f1: 0.5351
 epoch: 83, train_loss: 0.8495, test_loss: 1.0579, test_f1: 0.5175
 epoch: 84, train_loss: 0.8330, test_loss: 1.0899, test_f1: 0.5555
 epoch: 85, train_loss: 0.8277, test_loss: 0.9908, test_f1: 0.5300
 epoch: 86, train_loss: 0.8317, test_loss: 1.1604, test_f1: 0.5089
 epoch: 87, train_loss: 0.8284, test_loss: 0.9569, test_f1: 0.4806
 epoch: 88, train_loss: 0.8315, test_loss: 1.0657, test_f1: 0.5556
 epoch: 89, train_loss: 0.8084, test_loss: 1.0618, test_f1: 0.5593
 epoch: 90, train_loss: 0.8176, test_loss: 1.3353, test_f1: 0.5124
 epoch: 91, train_loss: 0.7991, test_loss: 1.1497, test_f1: 0.5044
 epoch: 92, train_loss: 0.8097, test_loss: 1.0552, test_f1: 0.5267
 epoch: 93, train_loss: 0.8154, test_loss: 1.1543, test_f1: 0.5470
 epoch: 94, train_loss: 0.8094, test_loss: 1.1097, test_f1: 0.5667
 epoch: 95, train_loss: 0.7926, test_loss: 1.5563, test_f1: 0.5136
 epoch: 96, train_loss: 0.8233, test_loss: 1.3144, test_f1: 0.5341
 epoch: 97, train_loss: 0.8111, test_loss: 1.2554, test_f1: 0.5760
 epoch: 98, train_loss: 0.8177, test_loss: 1.5707, test_f1: 0.4721
 epoch: 99, train_loss: 0.8346, test_loss: 0.9777, test_f1: 0.5177
##################ITERATION #1 ****************************************
 epoch: 0, train_loss: 1.3841, test_loss: 1.3322, test_f1: 0.2260
 epoch: 1, train_loss: 1.3108, test_loss: 1.3146, test_f1: 0.2260
 epoch: 2, train_loss: 1.3022, test_loss: 1.3160, test_f1: 0.2260
 epoch: 3, train_loss: 1.3024, test_loss: 1.3153, test_f1: 0.2260
 epoch: 4, train_loss: 1.3022, test_loss: 1.3162, test_f1: 0.2260
 epoch: 5, train_loss: 1.3022, test_loss: 1.3155, test_f1: 0.2260
 epoch: 6, train_loss: 1.3017, test_loss: 1.3154, test_f1: 0.2260
 epoch: 7, train_loss: 1.3022, test_loss: 1.3158, test_f1: 0.2260
 epoch: 8, train_loss: 1.3021, test_loss: 1.3147, test_f1: 0.2260
 epoch: 9, train_loss: 1.3018, test_loss: 1.3156, test_f1: 0.2260
 epoch: 10, train_loss: 1.3018, test_loss: 1.3150, test_f1: 0.2260
 epoch: 11, train_loss: 1.3026, test_loss: 1.3153, test_f1: 0.2260
 epoch: 12, train_loss: 1.3025, test_loss: 1.3151, test_f1: 0.2260
 epoch: 13, train_loss: 1.3022, test_loss: 1.3153, test_f1: 0.2260
 epoch: 14, train_loss: 1.3018, test_loss: 1.3163, test_f1: 0.2260
 epoch: 15, train_loss: 1.3016, test_loss: 1.3143, test_f1: 0.2260
 epoch: 16, train_loss: 1.3019, test_loss: 1.3149, test_f1: 0.2260
 epoch: 17, train_loss: 1.3021, test_loss: 1.3153, test_f1: 0.2260
 epoch: 18, train_loss: 1.3030, test_loss: 1.3143, test_f1: 0.2260
 epoch: 19, train_loss: 1.3029, test_loss: 1.3160, test_f1: 0.2260
 epoch: 20, train_loss: 1.3022, test_loss: 1.3150, test_f1: 0.2260
 epoch: 21, train_loss: 1.3018, test_loss: 1.3153, test_f1: 0.2260
 epoch: 22, train_loss: 1.3032, test_loss: 1.3158, test_f1: 0.2260
 epoch: 23, train_loss: 1.3026, test_loss: 1.3156, test_f1: 0.2260
 epoch: 24, train_loss: 1.3017, test_loss: 1.3147, test_f1: 0.2260
 epoch: 25, train_loss: 1.3021, test_loss: 1.3151, test_f1: 0.2260
 epoch: 26, train_loss: 1.3018, test_loss: 1.3151, test_f1: 0.2260
 epoch: 27, train_loss: 1.3028, test_loss: 1.3146, test_f1: 0.2260
 epoch: 28, train_loss: 1.3024, test_loss: 1.3160, test_f1: 0.2260
 epoch: 29, train_loss: 1.3023, test_loss: 1.3150, test_f1: 0.2260
 epoch: 30, train_loss: 1.3020, test_loss: 1.3154, test_f1: 0.2260
 epoch: 31, train_loss: 1.3018, test_loss: 1.3157, test_f1: 0.2260
 epoch: 32, train_loss: 1.3019, test_loss: 1.3154, test_f1: 0.2260
 epoch: 33, train_loss: 1.3026, test_loss: 1.3147, test_f1: 0.2260
 epoch: 34, train_loss: 1.3019, test_loss: 1.3155, test_f1: 0.2260
 epoch: 35, train_loss: 1.3017, test_loss: 1.3148, test_f1: 0.2260
 epoch: 36, train_loss: 1.3016, test_loss: 1.3163, test_f1: 0.2260
 epoch: 37, train_loss: 1.3026, test_loss: 1.3171, test_f1: 0.2260
 epoch: 38, train_loss: 1.3028, test_loss: 1.3149, test_f1: 0.2260
 epoch: 39, train_loss: 1.3018, test_loss: 1.3154, test_f1: 0.2260
 epoch: 40, train_loss: 1.3026, test_loss: 1.3143, test_f1: 0.2260
 epoch: 41, train_loss: 1.3023, test_loss: 1.3155, test_f1: 0.2260
 epoch: 42, train_loss: 1.3020, test_loss: 1.3151, test_f1: 0.2260
 epoch: 43, train_loss: 1.3020, test_loss: 1.3163, test_f1: 0.2260
 epoch: 44, train_loss: 1.3018, test_loss: 1.3151, test_f1: 0.2260
 epoch: 45, train_loss: 1.3023, test_loss: 1.3164, test_f1: 0.2260
 epoch: 46, train_loss: 1.3020, test_loss: 1.3151, test_f1: 0.2260
 epoch: 47, train_loss: 1.3016, test_loss: 1.3162, test_f1: 0.2260
 epoch: 48, train_loss: 1.3023, test_loss: 1.3154, test_f1: 0.2260
 epoch: 49, train_loss: 1.3018, test_loss: 1.3158, test_f1: 0.2260
 epoch: 50, train_loss: 1.3019, test_loss: 1.3146, test_f1: 0.2260
 epoch: 51, train_loss: 1.3015, test_loss: 1.3150, test_f1: 0.2260
 epoch: 52, train_loss: 1.3016, test_loss: 1.3146, test_f1: 0.2260
 epoch: 53, train_loss: 1.3014, test_loss: 1.3161, test_f1: 0.2260
 epoch: 54, train_loss: 1.3017, test_loss: 1.3151, test_f1: 0.2260
 epoch: 55, train_loss: 1.3016, test_loss: 1.3151, test_f1: 0.2260
 epoch: 56, train_loss: 1.3015, test_loss: 1.3151, test_f1: 0.2260
 epoch: 57, train_loss: 1.3016, test_loss: 1.3160, test_f1: 0.2260
 epoch: 58, train_loss: 1.3017, test_loss: 1.3150, test_f1: 0.2260
 epoch: 59, train_loss: 1.3018, test_loss: 1.3147, test_f1: 0.2260
 epoch: 60, train_loss: 1.3018, test_loss: 1.3159, test_f1: 0.2260
 epoch: 61, train_loss: 1.3017, test_loss: 1.3150, test_f1: 0.2260
 epoch: 62, train_loss: 1.3014, test_loss: 1.3155, test_f1: 0.2260
 epoch: 63, train_loss: 1.3022, test_loss: 1.3156, test_f1: 0.2260
 epoch: 64, train_loss: 1.3017, test_loss: 1.3144, test_f1: 0.2260
 epoch: 65, train_loss: 1.3017, test_loss: 1.3167, test_f1: 0.2260
 epoch: 66, train_loss: 1.3016, test_loss: 1.3149, test_f1: 0.2260
 epoch: 67, train_loss: 1.3015, test_loss: 1.3154, test_f1: 0.2260
 epoch: 68, train_loss: 1.3017, test_loss: 1.3145, test_f1: 0.2260
 epoch: 69, train_loss: 1.3021, test_loss: 1.3155, test_f1: 0.2260
 epoch: 70, train_loss: 1.3025, test_loss: 1.3155, test_f1: 0.2260
 epoch: 71, train_loss: 1.3016, test_loss: 1.3145, test_f1: 0.2260
 epoch: 72, train_loss: 1.3018, test_loss: 1.3156, test_f1: 0.2260
 epoch: 73, train_loss: 1.3016, test_loss: 1.3151, test_f1: 0.2260
 epoch: 74, train_loss: 1.3016, test_loss: 1.3151, test_f1: 0.2260
 epoch: 75, train_loss: 1.3014, test_loss: 1.3153, test_f1: 0.2260
 epoch: 76, train_loss: 1.3017, test_loss: 1.3164, test_f1: 0.2260
 epoch: 77, train_loss: 1.3020, test_loss: 1.3146, test_f1: 0.2260
 epoch: 78, train_loss: 1.3018, test_loss: 1.3149, test_f1: 0.2260
 epoch: 79, train_loss: 1.3018, test_loss: 1.3160, test_f1: 0.2260
 epoch: 80, train_loss: 1.3018, test_loss: 1.3143, test_f1: 0.2260
 epoch: 81, train_loss: 1.3014, test_loss: 1.3160, test_f1: 0.2260
 epoch: 82, train_loss: 1.3018, test_loss: 1.3152, test_f1: 0.2260
 epoch: 83, train_loss: 1.3018, test_loss: 1.3145, test_f1: 0.2260
 epoch: 84, train_loss: 1.3018, test_loss: 1.3163, test_f1: 0.2260
 epoch: 85, train_loss: 1.3014, test_loss: 1.3153, test_f1: 0.2260
 epoch: 86, train_loss: 1.3019, test_loss: 1.3154, test_f1: 0.2260
 epoch: 87, train_loss: 1.3020, test_loss: 1.3144, test_f1: 0.2260
 epoch: 88, train_loss: 1.3021, test_loss: 1.3163, test_f1: 0.2260
 epoch: 89, train_loss: 1.3024, test_loss: 1.3152, test_f1: 0.2260
 epoch: 90, train_loss: 1.3015, test_loss: 1.3167, test_f1: 0.2260
 epoch: 91, train_loss: 1.3016, test_loss: 1.3147, test_f1: 0.2260
 epoch: 92, train_loss: 1.3015, test_loss: 1.3149, test_f1: 0.2260
 epoch: 93, train_loss: 1.3019, test_loss: 1.3165, test_f1: 0.2260
 epoch: 94, train_loss: 1.3018, test_loss: 1.3143, test_f1: 0.2260
 epoch: 95, train_loss: 1.3015, test_loss: 1.3161, test_f1: 0.2260
 epoch: 96, train_loss: 1.3017, test_loss: 1.3149, test_f1: 0.2260
 epoch: 97, train_loss: 1.3015, test_loss: 1.3153, test_f1: 0.2260
 epoch: 98, train_loss: 1.3017, test_loss: 1.3155, test_f1: 0.2260
 epoch: 99, train_loss: 1.3017, test_loss: 1.3151, test_f1: 0.2260
##################ITERATION #2 ****************************************
 epoch: 0, train_loss: 1.3048, test_loss: 1.3165, test_f1: 0.2260
 epoch: 1, train_loss: 1.3034, test_loss: 1.3151, test_f1: 0.2260
 epoch: 2, train_loss: 1.3040, test_loss: 1.3174, test_f1: 0.2260
 epoch: 3, train_loss: 1.3027, test_loss: 1.3144, test_f1: 0.2260
 epoch: 4, train_loss: 1.3015, test_loss: 1.3171, test_f1: 0.2260
 epoch: 5, train_loss: 1.3017, test_loss: 1.3149, test_f1: 0.2260
 epoch: 6, train_loss: 1.3019, test_loss: 1.3138, test_f1: 0.2260
 epoch: 7, train_loss: 1.3021, test_loss: 1.3165, test_f1: 0.2260
 epoch: 8, train_loss: 1.3025, test_loss: 1.3153, test_f1: 0.2260
 epoch: 9, train_loss: 1.3018, test_loss: 1.3148, test_f1: 0.2260
 epoch: 10, train_loss: 1.3032, test_loss: 1.3145, test_f1: 0.2260
 epoch: 11, train_loss: 1.3018, test_loss: 1.3162, test_f1: 0.2260
 epoch: 12, train_loss: 1.3023, test_loss: 1.3146, test_f1: 0.2260
 epoch: 13, train_loss: 1.3017, test_loss: 1.3153, test_f1: 0.2260
 epoch: 14, train_loss: 1.3026, test_loss: 1.3151, test_f1: 0.2260
 epoch: 15, train_loss: 1.3036, test_loss: 1.3158, test_f1: 0.2260
 epoch: 16, train_loss: 1.3045, test_loss: 1.3142, test_f1: 0.2260
 epoch: 17, train_loss: 1.3040, test_loss: 1.3173, test_f1: 0.2260
 epoch: 18, train_loss: 1.3031, test_loss: 1.3144, test_f1: 0.2260
 epoch: 19, train_loss: 1.3037, test_loss: 1.3159, test_f1: 0.2260
 epoch: 20, train_loss: 1.3032, test_loss: 1.3149, test_f1: 0.2260
 epoch: 21, train_loss: 1.3017, test_loss: 1.3149, test_f1: 0.2260
 epoch: 22, train_loss: 1.3022, test_loss: 1.3156, test_f1: 0.2260
 epoch: 23, train_loss: 1.3024, test_loss: 1.3145, test_f1: 0.2260
 epoch: 24, train_loss: 1.3029, test_loss: 1.3163, test_f1: 0.2260
 epoch: 25, train_loss: 1.3024, test_loss: 1.3154, test_f1: 0.2260
 epoch: 26, train_loss: 1.3020, test_loss: 1.3146, test_f1: 0.2260
 epoch: 27, train_loss: 1.3023, test_loss: 1.3153, test_f1: 0.2260
 epoch: 28, train_loss: 1.3019, test_loss: 1.3150, test_f1: 0.2260
 epoch: 29, train_loss: 1.3023, test_loss: 1.3148, test_f1: 0.2260
 epoch: 30, train_loss: 1.3022, test_loss: 1.3165, test_f1: 0.2260
 epoch: 31, train_loss: 1.3035, test_loss: 1.3154, test_f1: 0.2260
 epoch: 32, train_loss: 1.3023, test_loss: 1.3143, test_f1: 0.2260
 epoch: 33, train_loss: 1.3025, test_loss: 1.3153, test_f1: 0.2260
 epoch: 34, train_loss: 1.3019, test_loss: 1.3146, test_f1: 0.2260
 epoch: 35, train_loss: 1.3026, test_loss: 1.3147, test_f1: 0.2260
 epoch: 36, train_loss: 1.3023, test_loss: 1.3149, test_f1: 0.2260
 epoch: 37, train_loss: 1.3018, test_loss: 1.3159, test_f1: 0.2260
 epoch: 38, train_loss: 1.3021, test_loss: 1.3143, test_f1: 0.2260
 epoch: 39, train_loss: 1.3030, test_loss: 1.3157, test_f1: 0.2260
 epoch: 40, train_loss: 1.3020, test_loss: 1.3162, test_f1: 0.2260
 epoch: 41, train_loss: 1.3018, test_loss: 1.3151, test_f1: 0.2260
 epoch: 42, train_loss: 1.3021, test_loss: 1.3155, test_f1: 0.2260
 epoch: 43, train_loss: 1.3027, test_loss: 1.3148, test_f1: 0.2260
 epoch: 44, train_loss: 1.3021, test_loss: 1.3153, test_f1: 0.2260
 epoch: 45, train_loss: 1.3017, test_loss: 1.3162, test_f1: 0.2260
 epoch: 46, train_loss: 1.3023, test_loss: 1.3141, test_f1: 0.2260
 epoch: 47, train_loss: 1.3017, test_loss: 1.3161, test_f1: 0.2260
 epoch: 48, train_loss: 1.3023, test_loss: 1.3145, test_f1: 0.2260
 epoch: 49, train_loss: 1.3021, test_loss: 1.3146, test_f1: 0.2260
 epoch: 50, train_loss: 1.3025, test_loss: 1.3166, test_f1: 0.2260
 epoch: 51, train_loss: 1.3017, test_loss: 1.3148, test_f1: 0.2260
 epoch: 52, train_loss: 1.3016, test_loss: 1.3156, test_f1: 0.2260
 epoch: 53, train_loss: 1.3015, test_loss: 1.3153, test_f1: 0.2260
 epoch: 54, train_loss: 1.3016, test_loss: 1.3147, test_f1: 0.2260
 epoch: 55, train_loss: 1.3021, test_loss: 1.3159, test_f1: 0.2260
 epoch: 56, train_loss: 1.3018, test_loss: 1.3151, test_f1: 0.2260
 epoch: 57, train_loss: 1.3016, test_loss: 1.3162, test_f1: 0.2260
 epoch: 58, train_loss: 1.3016, test_loss: 1.3145, test_f1: 0.2260
 epoch: 59, train_loss: 1.3015, test_loss: 1.3158, test_f1: 0.2260
 epoch: 60, train_loss: 1.3021, test_loss: 1.3151, test_f1: 0.2260
 epoch: 61, train_loss: 1.3015, test_loss: 1.3157, test_f1: 0.2260
 epoch: 62, train_loss: 1.3020, test_loss: 1.3153, test_f1: 0.2260
 epoch: 63, train_loss: 1.3015, test_loss: 1.3149, test_f1: 0.2260
 epoch: 64, train_loss: 1.3023, test_loss: 1.3142, test_f1: 0.2260
 epoch: 65, train_loss: 1.3015, test_loss: 1.3166, test_f1: 0.2260
 epoch: 66, train_loss: 1.3020, test_loss: 1.3156, test_f1: 0.2260
 epoch: 67, train_loss: 1.3015, test_loss: 1.3145, test_f1: 0.2260
 epoch: 68, train_loss: 1.3016, test_loss: 1.3152, test_f1: 0.2260
 epoch: 69, train_loss: 1.3016, test_loss: 1.3157, test_f1: 0.2260
 epoch: 70, train_loss: 1.3017, test_loss: 1.3151, test_f1: 0.2260
 epoch: 71, train_loss: 1.3022, test_loss: 1.3143, test_f1: 0.2260
 epoch: 72, train_loss: 1.3020, test_loss: 1.3166, test_f1: 0.2260
 epoch: 73, train_loss: 1.3020, test_loss: 1.3150, test_f1: 0.2260
 epoch: 74, train_loss: 1.3018, test_loss: 1.3159, test_f1: 0.2260
 epoch: 75, train_loss: 1.3021, test_loss: 1.3146, test_f1: 0.2260
 epoch: 76, train_loss: 1.3016, test_loss: 1.3161, test_f1: 0.2260
 epoch: 77, train_loss: 1.3015, test_loss: 1.3153, test_f1: 0.2260
 epoch: 78, train_loss: 1.3016, test_loss: 1.3147, test_f1: 0.2260
 epoch: 79, train_loss: 1.3016, test_loss: 1.3147, test_f1: 0.2260
 epoch: 80, train_loss: 1.3014, test_loss: 1.3156, test_f1: 0.2260
 epoch: 81, train_loss: 1.3015, test_loss: 1.3151, test_f1: 0.2260
 epoch: 82, train_loss: 1.3017, test_loss: 1.3161, test_f1: 0.2260
 epoch: 83, train_loss: 1.3016, test_loss: 1.3148, test_f1: 0.2260
 epoch: 84, train_loss: 1.3020, test_loss: 1.3157, test_f1: 0.2260
 epoch: 85, train_loss: 1.3014, test_loss: 1.3152, test_f1: 0.2260
 epoch: 86, train_loss: 1.3018, test_loss: 1.3147, test_f1: 0.2260
 epoch: 87, train_loss: 1.3017, test_loss: 1.3148, test_f1: 0.2260
 epoch: 88, train_loss: 1.3017, test_loss: 1.3161, test_f1: 0.2260
 epoch: 89, train_loss: 1.3017, test_loss: 1.3154, test_f1: 0.2260
 epoch: 90, train_loss: 1.3020, test_loss: 1.3165, test_f1: 0.2260
 epoch: 91, train_loss: 1.3018, test_loss: 1.3147, test_f1: 0.2260
 epoch: 92, train_loss: 1.3017, test_loss: 1.3150, test_f1: 0.2260
 epoch: 93, train_loss: 1.3017, test_loss: 1.3152, test_f1: 0.2260
 epoch: 94, train_loss: 1.3016, test_loss: 1.3147, test_f1: 0.2260
 epoch: 95, train_loss: 1.3017, test_loss: 1.3160, test_f1: 0.2260
 epoch: 96, train_loss: 1.3027, test_loss: 1.3146, test_f1: 0.2260
 epoch: 97, train_loss: 1.3018, test_loss: 1.3159, test_f1: 0.2260
 epoch: 98, train_loss: 1.3013, test_loss: 1.3156, test_f1: 0.2260
 epoch: 99, train_loss: 1.3016, test_loss: 1.3149, test_f1: 0.2260
##################ITERATION #3 ****************************************
 epoch: 0, train_loss: 1.3162, test_loss: 1.3197, test_f1: 0.2260
 epoch: 1, train_loss: 1.3029, test_loss: 1.3149, test_f1: 0.2260
 epoch: 2, train_loss: 1.3019, test_loss: 1.3160, test_f1: 0.2260
 epoch: 3, train_loss: 1.3017, test_loss: 1.3161, test_f1: 0.2260
 epoch: 4, train_loss: 1.3019, test_loss: 1.3152, test_f1: 0.2260
 epoch: 5, train_loss: 1.3026, test_loss: 1.3143, test_f1: 0.2260
 epoch: 6, train_loss: 1.3020, test_loss: 1.3163, test_f1: 0.2260
 epoch: 7, train_loss: 1.3021, test_loss: 1.3149, test_f1: 0.2260
 epoch: 8, train_loss: 1.3026, test_loss: 1.3176, test_f1: 0.2260
 epoch: 9, train_loss: 1.3033, test_loss: 1.3140, test_f1: 0.2260
 epoch: 10, train_loss: 1.3025, test_loss: 1.3161, test_f1: 0.2260
 epoch: 11, train_loss: 1.3021, test_loss: 1.3157, test_f1: 0.2260
 epoch: 12, train_loss: 1.3030, test_loss: 1.3140, test_f1: 0.2260
 epoch: 13, train_loss: 1.3040, test_loss: 1.3162, test_f1: 0.2260
 epoch: 14, train_loss: 1.3033, test_loss: 1.3153, test_f1: 0.2260
 epoch: 15, train_loss: 1.3020, test_loss: 1.3164, test_f1: 0.2260
 epoch: 16, train_loss: 1.3016, test_loss: 1.3150, test_f1: 0.2260
 epoch: 17, train_loss: 1.3019, test_loss: 1.3155, test_f1: 0.2260
 epoch: 18, train_loss: 1.3021, test_loss: 1.3146, test_f1: 0.2260
 epoch: 19, train_loss: 1.3023, test_loss: 1.3167, test_f1: 0.2260
 epoch: 20, train_loss: 1.3019, test_loss: 1.3139, test_f1: 0.2260
 epoch: 21, train_loss: 1.3027, test_loss: 1.3165, test_f1: 0.2260
 epoch: 22, train_loss: 1.3029, test_loss: 1.3146, test_f1: 0.2260
 epoch: 23, train_loss: 1.3034, test_loss: 1.3159, test_f1: 0.2260
 epoch: 24, train_loss: 1.3025, test_loss: 1.3151, test_f1: 0.2260
 epoch: 25, train_loss: 1.3015, test_loss: 1.3149, test_f1: 0.2260
 epoch: 26, train_loss: 1.3020, test_loss: 1.3153, test_f1: 0.2260
 epoch: 27, train_loss: 1.3019, test_loss: 1.3150, test_f1: 0.2260
 epoch: 28, train_loss: 1.3014, test_loss: 1.3155, test_f1: 0.2260
 epoch: 29, train_loss: 1.3019, test_loss: 1.3151, test_f1: 0.2260
 epoch: 30, train_loss: 1.3038, test_loss: 1.3173, test_f1: 0.2260
 epoch: 31, train_loss: 1.3023, test_loss: 1.3157, test_f1: 0.2260
 epoch: 32, train_loss: 1.3023, test_loss: 1.3161, test_f1: 0.2260
 epoch: 33, train_loss: 1.3020, test_loss: 1.3156, test_f1: 0.2260
 epoch: 34, train_loss: 1.3022, test_loss: 1.3153, test_f1: 0.2260
 epoch: 35, train_loss: 1.3028, test_loss: 1.3148, test_f1: 0.2260
 epoch: 36, train_loss: 1.3020, test_loss: 1.3158, test_f1: 0.2260
 epoch: 37, train_loss: 1.3026, test_loss: 1.3157, test_f1: 0.2260
 epoch: 38, train_loss: 1.3019, test_loss: 1.3146, test_f1: 0.2260
 epoch: 39, train_loss: 1.3024, test_loss: 1.3158, test_f1: 0.2260
 epoch: 40, train_loss: 1.3022, test_loss: 1.3153, test_f1: 0.2260
 epoch: 41, train_loss: 1.3018, test_loss: 1.3158, test_f1: 0.2260
 epoch: 42, train_loss: 1.3025, test_loss: 1.3153, test_f1: 0.2260
 epoch: 43, train_loss: 1.3021, test_loss: 1.3148, test_f1: 0.2260
 epoch: 44, train_loss: 1.3016, test_loss: 1.3148, test_f1: 0.2260
 epoch: 45, train_loss: 1.3021, test_loss: 1.3148, test_f1: 0.2260
 epoch: 46, train_loss: 1.3019, test_loss: 1.3156, test_f1: 0.2260
 epoch: 47, train_loss: 1.3018, test_loss: 1.3156, test_f1: 0.2260
 epoch: 48, train_loss: 1.3020, test_loss: 1.3163, test_f1: 0.2260
 epoch: 49, train_loss: 1.3023, test_loss: 1.3162, test_f1: 0.2260
 epoch: 50, train_loss: 1.3021, test_loss: 1.3151, test_f1: 0.2260
 epoch: 51, train_loss: 1.3019, test_loss: 1.3142, test_f1: 0.2260
 epoch: 52, train_loss: 1.3016, test_loss: 1.3159, test_f1: 0.2260
 epoch: 53, train_loss: 1.3014, test_loss: 1.3161, test_f1: 0.2260
 epoch: 54, train_loss: 1.3016, test_loss: 1.3158, test_f1: 0.2260
 epoch: 55, train_loss: 1.3017, test_loss: 1.3141, test_f1: 0.2260
 epoch: 56, train_loss: 1.3017, test_loss: 1.3154, test_f1: 0.2260
 epoch: 57, train_loss: 1.3014, test_loss: 1.3151, test_f1: 0.2260
 epoch: 58, train_loss: 1.3015, test_loss: 1.3157, test_f1: 0.2260
 epoch: 59, train_loss: 1.3018, test_loss: 1.3150, test_f1: 0.2260
 epoch: 60, train_loss: 1.3017, test_loss: 1.3153, test_f1: 0.2260
 epoch: 61, train_loss: 1.3020, test_loss: 1.3144, test_f1: 0.2260
 epoch: 62, train_loss: 1.3017, test_loss: 1.3164, test_f1: 0.2260
 epoch: 63, train_loss: 1.3016, test_loss: 1.3147, test_f1: 0.2260
 epoch: 64, train_loss: 1.3016, test_loss: 1.3156, test_f1: 0.2260
 epoch: 65, train_loss: 1.3014, test_loss: 1.3155, test_f1: 0.2260
 epoch: 66, train_loss: 1.3014, test_loss: 1.3152, test_f1: 0.2260
 epoch: 67, train_loss: 1.3015, test_loss: 1.3149, test_f1: 0.2260
 epoch: 68, train_loss: 1.3016, test_loss: 1.3152, test_f1: 0.2260
 epoch: 69, train_loss: 1.3014, test_loss: 1.3156, test_f1: 0.2260
 epoch: 70, train_loss: 1.3016, test_loss: 1.3149, test_f1: 0.2260
 epoch: 71, train_loss: 1.3018, test_loss: 1.3146, test_f1: 0.2260
 epoch: 72, train_loss: 1.3018, test_loss: 1.3158, test_f1: 0.2260
 epoch: 73, train_loss: 1.3016, test_loss: 1.3152, test_f1: 0.2260
 epoch: 74, train_loss: 1.3017, test_loss: 1.3158, test_f1: 0.2260
 epoch: 75, train_loss: 1.3016, test_loss: 1.3147, test_f1: 0.2260
 epoch: 76, train_loss: 1.3017, test_loss: 1.3159, test_f1: 0.2260
 epoch: 77, train_loss: 1.3016, test_loss: 1.3147, test_f1: 0.2260
 epoch: 78, train_loss: 1.3015, test_loss: 1.3153, test_f1: 0.2260
 epoch: 79, train_loss: 1.3015, test_loss: 1.3153, test_f1: 0.2260
 epoch: 80, train_loss: 1.3016, test_loss: 1.3151, test_f1: 0.2260
 epoch: 81, train_loss: 1.3018, test_loss: 1.3151, test_f1: 0.2260
 epoch: 82, train_loss: 1.3016, test_loss: 1.3156, test_f1: 0.2260
 epoch: 83, train_loss: 1.3016, test_loss: 1.3151, test_f1: 0.2260
 epoch: 84, train_loss: 1.3017, test_loss: 1.3150, test_f1: 0.2260
 epoch: 85, train_loss: 1.3021, test_loss: 1.3159, test_f1: 0.2260
 epoch: 86, train_loss: 1.3018, test_loss: 1.3156, test_f1: 0.2260
 epoch: 87, train_loss: 1.3025, test_loss: 1.3146, test_f1: 0.2260
 epoch: 88, train_loss: 1.3020, test_loss: 1.3164, test_f1: 0.2260
 epoch: 89, train_loss: 1.3016, test_loss: 1.3147, test_f1: 0.2260
 epoch: 90, train_loss: 1.3015, test_loss: 1.3157, test_f1: 0.2260
 epoch: 91, train_loss: 1.3016, test_loss: 1.3152, test_f1: 0.2260
 epoch: 92, train_loss: 1.3014, test_loss: 1.3151, test_f1: 0.2260
 epoch: 93, train_loss: 1.3018, test_loss: 1.3149, test_f1: 0.2260
 epoch: 94, train_loss: 1.3022, test_loss: 1.3168, test_f1: 0.2260
 epoch: 95, train_loss: 1.3018, test_loss: 1.3140, test_f1: 0.2260
 epoch: 96, train_loss: 1.3017, test_loss: 1.3160, test_f1: 0.2260
 epoch: 97, train_loss: 1.3022, test_loss: 1.3159, test_f1: 0.2260
 epoch: 98, train_loss: 1.3017, test_loss: 1.3155, test_f1: 0.2260
 epoch: 99, train_loss: 1.3018, test_loss: 1.3151, test_f1: 0.2260
##################ITERATION #4 ****************************************
 epoch: 0, train_loss: 1.3054, test_loss: 1.3157, test_f1: 0.2260
 epoch: 1, train_loss: 1.3016, test_loss: 1.3153, test_f1: 0.2260
 epoch: 2, train_loss: 1.3015, test_loss: 1.3152, test_f1: 0.2260
 epoch: 3, train_loss: 1.3022, test_loss: 1.3154, test_f1: 0.2260
 epoch: 4, train_loss: 1.3032, test_loss: 1.3143, test_f1: 0.2260
 epoch: 5, train_loss: 1.3027, test_loss: 1.3159, test_f1: 0.2260
 epoch: 6, train_loss: 1.3023, test_loss: 1.3146, test_f1: 0.2260
 epoch: 7, train_loss: 1.3022, test_loss: 1.3158, test_f1: 0.2260
 epoch: 8, train_loss: 1.3024, test_loss: 1.3164, test_f1: 0.2260
 epoch: 9, train_loss: 1.3027, test_loss: 1.3157, test_f1: 0.2260
 epoch: 10, train_loss: 1.3019, test_loss: 1.3154, test_f1: 0.2260
 epoch: 11, train_loss: 1.3023, test_loss: 1.3145, test_f1: 0.2260
 epoch: 12, train_loss: 1.3027, test_loss: 1.3159, test_f1: 0.2260
 epoch: 13, train_loss: 1.3021, test_loss: 1.3138, test_f1: 0.2260
 epoch: 14, train_loss: 1.3018, test_loss: 1.3155, test_f1: 0.2260
 epoch: 15, train_loss: 1.3024, test_loss: 1.3144, test_f1: 0.2260
 epoch: 16, train_loss: 1.3023, test_loss: 1.3155, test_f1: 0.2260
 epoch: 17, train_loss: 1.3028, test_loss: 1.3163, test_f1: 0.2260
 epoch: 18, train_loss: 1.3023, test_loss: 1.3157, test_f1: 0.2260
 epoch: 19, train_loss: 1.3037, test_loss: 1.3146, test_f1: 0.2260
 epoch: 20, train_loss: 1.3038, test_loss: 1.3159, test_f1: 0.2260
 epoch: 21, train_loss: 1.3022, test_loss: 1.3144, test_f1: 0.2260
 epoch: 22, train_loss: 1.3020, test_loss: 1.3151, test_f1: 0.2260
 epoch: 23, train_loss: 1.3016, test_loss: 1.3158, test_f1: 0.2260
 epoch: 24, train_loss: 1.3022, test_loss: 1.3146, test_f1: 0.2260
 epoch: 25, train_loss: 1.3024, test_loss: 1.3146, test_f1: 0.2260
 epoch: 26, train_loss: 1.3023, test_loss: 1.3161, test_f1: 0.2260
 epoch: 27, train_loss: 1.3022, test_loss: 1.3144, test_f1: 0.2260
 epoch: 28, train_loss: 1.3026, test_loss: 1.3182, test_f1: 0.2260
 epoch: 29, train_loss: 1.3032, test_loss: 1.3146, test_f1: 0.2260
 epoch: 30, train_loss: 1.3017, test_loss: 1.3151, test_f1: 0.2260
 epoch: 31, train_loss: 1.3019, test_loss: 1.3155, test_f1: 0.2260
 epoch: 32, train_loss: 1.3030, test_loss: 1.3171, test_f1: 0.2260
 epoch: 33, train_loss: 1.3023, test_loss: 1.3153, test_f1: 0.2260
 epoch: 34, train_loss: 1.3029, test_loss: 1.3144, test_f1: 0.2260
 epoch: 35, train_loss: 1.3020, test_loss: 1.3172, test_f1: 0.2260
 epoch: 36, train_loss: 1.3017, test_loss: 1.3147, test_f1: 0.2260
 epoch: 37, train_loss: 1.3020, test_loss: 1.3170, test_f1: 0.2260
 epoch: 38, train_loss: 1.3034, test_loss: 1.3153, test_f1: 0.2260
 epoch: 39, train_loss: 1.3023, test_loss: 1.3160, test_f1: 0.2260
 epoch: 40, train_loss: 1.3019, test_loss: 1.3161, test_f1: 0.2260
 epoch: 41, train_loss: 1.3025, test_loss: 1.3150, test_f1: 0.2260
 epoch: 42, train_loss: 1.3020, test_loss: 1.3164, test_f1: 0.2260
 epoch: 43, train_loss: 1.3028, test_loss: 1.3145, test_f1: 0.2260
 epoch: 44, train_loss: 1.3021, test_loss: 1.3155, test_f1: 0.2260
 epoch: 45, train_loss: 1.3019, test_loss: 1.3158, test_f1: 0.2260
 epoch: 46, train_loss: 1.3018, test_loss: 1.3156, test_f1: 0.2260
 epoch: 47, train_loss: 1.3015, test_loss: 1.3158, test_f1: 0.2260
 epoch: 48, train_loss: 1.3018, test_loss: 1.3150, test_f1: 0.2260
 epoch: 49, train_loss: 1.3022, test_loss: 1.3144, test_f1: 0.2260
 epoch: 50, train_loss: 1.3024, test_loss: 1.3157, test_f1: 0.2260
 epoch: 51, train_loss: 1.3016, test_loss: 1.3150, test_f1: 0.2260
 epoch: 52, train_loss: 1.3019, test_loss: 1.3153, test_f1: 0.2260
 epoch: 53, train_loss: 1.3017, test_loss: 1.3155, test_f1: 0.2260
 epoch: 54, train_loss: 1.3019, test_loss: 1.3153, test_f1: 0.2260
 epoch: 55, train_loss: 1.3020, test_loss: 1.3149, test_f1: 0.2260
 epoch: 56, train_loss: 1.3019, test_loss: 1.3159, test_f1: 0.2260
 epoch: 57, train_loss: 1.3014, test_loss: 1.3150, test_f1: 0.2260
 epoch: 58, train_loss: 1.3018, test_loss: 1.3148, test_f1: 0.2260
 epoch: 59, train_loss: 1.3017, test_loss: 1.3154, test_f1: 0.2260
 epoch: 60, train_loss: 1.3016, test_loss: 1.3167, test_f1: 0.2260
 epoch: 61, train_loss: 1.3014, test_loss: 1.3148, test_f1: 0.2260
 epoch: 62, train_loss: 1.3017, test_loss: 1.3156, test_f1: 0.2260
 epoch: 63, train_loss: 1.3014, test_loss: 1.3148, test_f1: 0.2260
 epoch: 64, train_loss: 1.3016, test_loss: 1.3148, test_f1: 0.2260
 epoch: 65, train_loss: 1.3013, test_loss: 1.3155, test_f1: 0.2260
 epoch: 66, train_loss: 1.3016, test_loss: 1.3165, test_f1: 0.2260
 epoch: 67, train_loss: 1.3014, test_loss: 1.3151, test_f1: 0.2260
 epoch: 68, train_loss: 1.3019, test_loss: 1.3145, test_f1: 0.2260
 epoch: 69, train_loss: 1.3019, test_loss: 1.3157, test_f1: 0.2260
 epoch: 70, train_loss: 1.3017, test_loss: 1.3154, test_f1: 0.2260
 epoch: 71, train_loss: 1.3015, test_loss: 1.3146, test_f1: 0.2260
 epoch: 72, train_loss: 1.3022, test_loss: 1.3158, test_f1: 0.2260
 epoch: 73, train_loss: 1.3019, test_loss: 1.3149, test_f1: 0.2260
 epoch: 74, train_loss: 1.3019, test_loss: 1.3156, test_f1: 0.2260
 epoch: 75, train_loss: 1.3024, test_loss: 1.3146, test_f1: 0.2260
 epoch: 76, train_loss: 1.3022, test_loss: 1.3161, test_f1: 0.2260
 epoch: 77, train_loss: 1.3016, test_loss: 1.3142, test_f1: 0.2260
 epoch: 78, train_loss: 1.3015, test_loss: 1.3158, test_f1: 0.2260
 epoch: 79, train_loss: 1.3016, test_loss: 1.3155, test_f1: 0.2260
 epoch: 80, train_loss: 1.3015, test_loss: 1.3153, test_f1: 0.2260
 epoch: 81, train_loss: 1.3015, test_loss: 1.3154, test_f1: 0.2260
 epoch: 82, train_loss: 1.3022, test_loss: 1.3143, test_f1: 0.2260
 epoch: 83, train_loss: 1.3018, test_loss: 1.3160, test_f1: 0.2260
 epoch: 84, train_loss: 1.3017, test_loss: 1.3150, test_f1: 0.2260
 epoch: 85, train_loss: 1.3016, test_loss: 1.3160, test_f1: 0.2260
 epoch: 86, train_loss: 1.3016, test_loss: 1.3163, test_f1: 0.2260
 epoch: 87, train_loss: 1.3016, test_loss: 1.3149, test_f1: 0.2260
 epoch: 88, train_loss: 1.3023, test_loss: 1.3141, test_f1: 0.2260
 epoch: 89, train_loss: 1.3016, test_loss: 1.3167, test_f1: 0.2260
 epoch: 90, train_loss: 1.3019, test_loss: 1.3147, test_f1: 0.2260
 epoch: 91, train_loss: 1.3014, test_loss: 1.3153, test_f1: 0.2260
 epoch: 92, train_loss: 1.3016, test_loss: 1.3153, test_f1: 0.2260
 epoch: 93, train_loss: 1.3016, test_loss: 1.3155, test_f1: 0.2260
 epoch: 94, train_loss: 1.3017, test_loss: 1.3157, test_f1: 0.2260
 epoch: 95, train_loss: 1.3024, test_loss: 1.3152, test_f1: 0.2260
 epoch: 96, train_loss: 1.3021, test_loss: 1.3143, test_f1: 0.2260
 epoch: 97, train_loss: 1.3019, test_loss: 1.3166, test_f1: 0.2260
 epoch: 98, train_loss: 1.3018, test_loss: 1.3150, test_f1: 0.2260
 epoch: 99, train_loss: 1.3022, test_loss: 1.3146, test_f1: 0.2260
##################ITERATION #5 ****************************************
 epoch: 0, train_loss: 1.3038, test_loss: 1.3200, test_f1: 0.2260
 epoch: 1, train_loss: 1.3051, test_loss: 1.3169, test_f1: 0.2260
 epoch: 2, train_loss: 1.3025, test_loss: 1.3150, test_f1: 0.2260
 epoch: 3, train_loss: 1.3023, test_loss: 1.3144, test_f1: 0.2260
 epoch: 4, train_loss: 1.3021, test_loss: 1.3168, test_f1: 0.2260
 epoch: 5, train_loss: 1.3022, test_loss: 1.3158, test_f1: 0.2260
 epoch: 6, train_loss: 1.3016, test_loss: 1.3156, test_f1: 0.2260
 epoch: 7, train_loss: 1.3024, test_loss: 1.3147, test_f1: 0.2260
 epoch: 8, train_loss: 1.3023, test_loss: 1.3157, test_f1: 0.2260
 epoch: 9, train_loss: 1.3037, test_loss: 1.3140, test_f1: 0.2260
 epoch: 10, train_loss: 1.3035, test_loss: 1.3171, test_f1: 0.2260
 epoch: 11, train_loss: 1.3026, test_loss: 1.3151, test_f1: 0.2260
 epoch: 12, train_loss: 1.3020, test_loss: 1.3154, test_f1: 0.2260
 epoch: 13, train_loss: 1.3017, test_loss: 1.3146, test_f1: 0.2260
 epoch: 14, train_loss: 1.3027, test_loss: 1.3163, test_f1: 0.2260
 epoch: 15, train_loss: 1.3029, test_loss: 1.3158, test_f1: 0.2260
 epoch: 16, train_loss: 1.3016, test_loss: 1.3152, test_f1: 0.2260
 epoch: 17, train_loss: 1.3027, test_loss: 1.3144, test_f1: 0.2260
 epoch: 18, train_loss: 1.3019, test_loss: 1.3151, test_f1: 0.2260
 epoch: 19, train_loss: 1.3015, test_loss: 1.3158, test_f1: 0.2260
 epoch: 20, train_loss: 1.3019, test_loss: 1.3146, test_f1: 0.2260
 epoch: 21, train_loss: 1.3017, test_loss: 1.3154, test_f1: 0.2260
 epoch: 22, train_loss: 1.3019, test_loss: 1.3146, test_f1: 0.2260
 epoch: 23, train_loss: 1.3024, test_loss: 1.3158, test_f1: 0.2260
 epoch: 24, train_loss: 1.3017, test_loss: 1.3154, test_f1: 0.2260
 epoch: 25, train_loss: 1.3025, test_loss: 1.3153, test_f1: 0.2260
 epoch: 26, train_loss: 1.3022, test_loss: 1.3149, test_f1: 0.2260
 epoch: 27, train_loss: 1.3033, test_loss: 1.3171, test_f1: 0.2260
 epoch: 28, train_loss: 1.3027, test_loss: 1.3138, test_f1: 0.2260
 epoch: 29, train_loss: 1.3020, test_loss: 1.3167, test_f1: 0.2260
 epoch: 30, train_loss: 1.3021, test_loss: 1.3144, test_f1: 0.2260
 epoch: 31, train_loss: 1.3021, test_loss: 1.3158, test_f1: 0.2260
 epoch: 32, train_loss: 1.3022, test_loss: 1.3156, test_f1: 0.2260
 epoch: 33, train_loss: 1.3020, test_loss: 1.3165, test_f1: 0.2260
 epoch: 34, train_loss: 1.3022, test_loss: 1.3144, test_f1: 0.2260
 epoch: 35, train_loss: 1.3016, test_loss: 1.3173, test_f1: 0.2260
 epoch: 36, train_loss: 1.3020, test_loss: 1.3148, test_f1: 0.2260
 epoch: 37, train_loss: 1.3023, test_loss: 1.3144, test_f1: 0.2260
 epoch: 38, train_loss: 1.3018, test_loss: 1.3171, test_f1: 0.2260
 epoch: 39, train_loss: 1.3021, test_loss: 1.3147, test_f1: 0.2260
 epoch: 40, train_loss: 1.3028, test_loss: 1.3160, test_f1: 0.2260
 epoch: 41, train_loss: 1.3027, test_loss: 1.3159, test_f1: 0.2260
 epoch: 42, train_loss: 1.3020, test_loss: 1.3150, test_f1: 0.2260
 epoch: 43, train_loss: 1.3024, test_loss: 1.3154, test_f1: 0.2260
 epoch: 44, train_loss: 1.3020, test_loss: 1.3146, test_f1: 0.2260
 epoch: 45, train_loss: 1.3020, test_loss: 1.3155, test_f1: 0.2260
 epoch: 46, train_loss: 1.3018, test_loss: 1.3154, test_f1: 0.2260
 epoch: 47, train_loss: 1.3017, test_loss: 1.3154, test_f1: 0.2260
 epoch: 48, train_loss: 1.3025, test_loss: 1.3161, test_f1: 0.2260
 epoch: 49, train_loss: 1.3024, test_loss: 1.3151, test_f1: 0.2260
 epoch: 50, train_loss: 1.3019, test_loss: 1.3149, test_f1: 0.2260
 epoch: 51, train_loss: 1.3018, test_loss: 1.3152, test_f1: 0.2260
 epoch: 52, train_loss: 1.3017, test_loss: 1.3156, test_f1: 0.2260
 epoch: 53, train_loss: 1.3016, test_loss: 1.3155, test_f1: 0.2260
 epoch: 54, train_loss: 1.3016, test_loss: 1.3145, test_f1: 0.2260
 epoch: 55, train_loss: 1.3024, test_loss: 1.3161, test_f1: 0.2260
 epoch: 56, train_loss: 1.3019, test_loss: 1.3143, test_f1: 0.2260
 epoch: 57, train_loss: 1.3017, test_loss: 1.3159, test_f1: 0.2260
 epoch: 58, train_loss: 1.3017, test_loss: 1.3155, test_f1: 0.2260
 epoch: 59, train_loss: 1.3017, test_loss: 1.3152, test_f1: 0.2260
 epoch: 60, train_loss: 1.3016, test_loss: 1.3147, test_f1: 0.2260
 epoch: 61, train_loss: 1.3017, test_loss: 1.3160, test_f1: 0.2260
 epoch: 62, train_loss: 1.3021, test_loss: 1.3150, test_f1: 0.2260
 epoch: 63, train_loss: 1.3016, test_loss: 1.3153, test_f1: 0.2260
 epoch: 64, train_loss: 1.3017, test_loss: 1.3152, test_f1: 0.2260
 epoch: 65, train_loss: 1.3015, test_loss: 1.3158, test_f1: 0.2260
 epoch: 66, train_loss: 1.3016, test_loss: 1.3152, test_f1: 0.2260
 epoch: 67, train_loss: 1.3019, test_loss: 1.3142, test_f1: 0.2260
 epoch: 68, train_loss: 1.3032, test_loss: 1.3167, test_f1: 0.2260
 epoch: 69, train_loss: 1.3014, test_loss: 1.3142, test_f1: 0.2260
 epoch: 70, train_loss: 1.3018, test_loss: 1.3156, test_f1: 0.2260
 epoch: 71, train_loss: 1.3017, test_loss: 1.3156, test_f1: 0.2260
 epoch: 72, train_loss: 1.3016, test_loss: 1.3151, test_f1: 0.2260
 epoch: 73, train_loss: 1.3016, test_loss: 1.3155, test_f1: 0.2260
 epoch: 74, train_loss: 1.3017, test_loss: 1.3143, test_f1: 0.2260
 epoch: 75, train_loss: 1.3016, test_loss: 1.3154, test_f1: 0.2260
 epoch: 76, train_loss: 1.3016, test_loss: 1.3150, test_f1: 0.2260
 epoch: 77, train_loss: 1.3016, test_loss: 1.3150, test_f1: 0.2260
 epoch: 78, train_loss: 1.3016, test_loss: 1.3154, test_f1: 0.2260
 epoch: 79, train_loss: 1.3016, test_loss: 1.3165, test_f1: 0.2260
 epoch: 80, train_loss: 1.3015, test_loss: 1.3146, test_f1: 0.2260
 epoch: 81, train_loss: 1.3021, test_loss: 1.3156, test_f1: 0.2260
 epoch: 82, train_loss: 1.3018, test_loss: 1.3159, test_f1: 0.2260
 epoch: 83, train_loss: 1.3015, test_loss: 1.3147, test_f1: 0.2260
 epoch: 84, train_loss: 1.3015, test_loss: 1.3150, test_f1: 0.2260
 epoch: 85, train_loss: 1.3017, test_loss: 1.3159, test_f1: 0.2260
 epoch: 86, train_loss: 1.3020, test_loss: 1.3148, test_f1: 0.2260
 epoch: 87, train_loss: 1.3013, test_loss: 1.3154, test_f1: 0.2260
 epoch: 88, train_loss: 1.3023, test_loss: 1.3163, test_f1: 0.2260
 epoch: 89, train_loss: 1.3018, test_loss: 1.3142, test_f1: 0.2260
 epoch: 90, train_loss: 1.3019, test_loss: 1.3160, test_f1: 0.2260
 epoch: 91, train_loss: 1.3014, test_loss: 1.3151, test_f1: 0.2260
 epoch: 92, train_loss: 1.3016, test_loss: 1.3150, test_f1: 0.2260
 epoch: 93, train_loss: 1.3016, test_loss: 1.3147, test_f1: 0.2260
 epoch: 94, train_loss: 1.3014, test_loss: 1.3157, test_f1: 0.2260
 epoch: 95, train_loss: 1.3016, test_loss: 1.3153, test_f1: 0.2260
 epoch: 96, train_loss: 1.3017, test_loss: 1.3158, test_f1: 0.2260
 epoch: 97, train_loss: 1.3021, test_loss: 1.3149, test_f1: 0.2260
 epoch: 98, train_loss: 1.3023, test_loss: 1.3151, test_f1: 0.2260
 epoch: 99, train_loss: 1.3015, test_loss: 1.3159, test_f1: 0.2260
##################ITERATION #6 ****************************************
 epoch: 0, train_loss: 1.3053, test_loss: 1.3285, test_f1: 0.2260
 epoch: 1, train_loss: 1.3067, test_loss: 1.3140, test_f1: 0.2260
 epoch: 2, train_loss: 1.3028, test_loss: 1.3160, test_f1: 0.2260
 epoch: 3, train_loss: 1.3019, test_loss: 1.3146, test_f1: 0.2260
 epoch: 4, train_loss: 1.3026, test_loss: 1.3153, test_f1: 0.2260
 epoch: 5, train_loss: 1.3018, test_loss: 1.3159, test_f1: 0.2260
 epoch: 6, train_loss: 1.3023, test_loss: 1.3155, test_f1: 0.2260
 epoch: 7, train_loss: 1.3017, test_loss: 1.3155, test_f1: 0.2260
 epoch: 8, train_loss: 1.3017, test_loss: 1.3149, test_f1: 0.2260
 epoch: 9, train_loss: 1.3025, test_loss: 1.3160, test_f1: 0.2260
 epoch: 10, train_loss: 1.3016, test_loss: 1.3148, test_f1: 0.2260
 epoch: 11, train_loss: 1.3017, test_loss: 1.3145, test_f1: 0.2260
 epoch: 12, train_loss: 1.3021, test_loss: 1.3160, test_f1: 0.2260
 epoch: 13, train_loss: 1.3018, test_loss: 1.3148, test_f1: 0.2260
 epoch: 14, train_loss: 1.3019, test_loss: 1.3163, test_f1: 0.2260
 epoch: 15, train_loss: 1.3024, test_loss: 1.3168, test_f1: 0.2260
 epoch: 16, train_loss: 1.3020, test_loss: 1.3151, test_f1: 0.2260
 epoch: 17, train_loss: 1.3017, test_loss: 1.3152, test_f1: 0.2260
 epoch: 18, train_loss: 1.3020, test_loss: 1.3158, test_f1: 0.2260
 epoch: 19, train_loss: 1.3037, test_loss: 1.3150, test_f1: 0.2260
 epoch: 20, train_loss: 1.3027, test_loss: 1.3150, test_f1: 0.2260
 epoch: 21, train_loss: 1.3025, test_loss: 1.3158, test_f1: 0.2260
 epoch: 22, train_loss: 1.3020, test_loss: 1.3149, test_f1: 0.2260
 epoch: 23, train_loss: 1.3016, test_loss: 1.3146, test_f1: 0.2260
 epoch: 24, train_loss: 1.3021, test_loss: 1.3158, test_f1: 0.2260
 epoch: 25, train_loss: 1.3019, test_loss: 1.3154, test_f1: 0.2260
 epoch: 26, train_loss: 1.3017, test_loss: 1.3158, test_f1: 0.2260
 epoch: 27, train_loss: 1.3021, test_loss: 1.3141, test_f1: 0.2260
 epoch: 28, train_loss: 1.3021, test_loss: 1.3154, test_f1: 0.2260
 epoch: 29, train_loss: 1.3016, test_loss: 1.3145, test_f1: 0.2260
 epoch: 30, train_loss: 1.3016, test_loss: 1.3166, test_f1: 0.2260
 epoch: 31, train_loss: 1.3019, test_loss: 1.3152, test_f1: 0.2260
 epoch: 32, train_loss: 1.3020, test_loss: 1.3147, test_f1: 0.2260
 epoch: 33, train_loss: 1.3042, test_loss: 1.3188, test_f1: 0.2260
 epoch: 34, train_loss: 1.3044, test_loss: 1.3142, test_f1: 0.2260
 epoch: 35, train_loss: 1.3021, test_loss: 1.3181, test_f1: 0.2260
 epoch: 36, train_loss: 1.3033, test_loss: 1.3140, test_f1: 0.2260
 epoch: 37, train_loss: 1.3023, test_loss: 1.3158, test_f1: 0.2260
 epoch: 38, train_loss: 1.3017, test_loss: 1.3154, test_f1: 0.2260
 epoch: 39, train_loss: 1.3023, test_loss: 1.3160, test_f1: 0.2260
 epoch: 40, train_loss: 1.3025, test_loss: 1.3145, test_f1: 0.2260
 epoch: 41, train_loss: 1.3031, test_loss: 1.3157, test_f1: 0.2260
 epoch: 42, train_loss: 1.3024, test_loss: 1.3147, test_f1: 0.2260
 epoch: 43, train_loss: 1.3027, test_loss: 1.3146, test_f1: 0.2260
 epoch: 44, train_loss: 1.3018, test_loss: 1.3168, test_f1: 0.2260
 epoch: 45, train_loss: 1.3016, test_loss: 1.3153, test_f1: 0.2260
 epoch: 46, train_loss: 1.3026, test_loss: 1.3149, test_f1: 0.2260
 epoch: 47, train_loss: 1.3026, test_loss: 1.3143, test_f1: 0.2260
 epoch: 48, train_loss: 1.3022, test_loss: 1.3151, test_f1: 0.2260
 epoch: 49, train_loss: 1.3027, test_loss: 1.3157, test_f1: 0.2260
 epoch: 50, train_loss: 1.3026, test_loss: 1.3154, test_f1: 0.2260
 epoch: 51, train_loss: 1.3020, test_loss: 1.3147, test_f1: 0.2260
 epoch: 52, train_loss: 1.3016, test_loss: 1.3169, test_f1: 0.2260
 epoch: 53, train_loss: 1.3017, test_loss: 1.3148, test_f1: 0.2260
 epoch: 54, train_loss: 1.3016, test_loss: 1.3148, test_f1: 0.2260
 epoch: 55, train_loss: 1.3019, test_loss: 1.3160, test_f1: 0.2260
 epoch: 56, train_loss: 1.3017, test_loss: 1.3147, test_f1: 0.2260
 epoch: 57, train_loss: 1.3016, test_loss: 1.3153, test_f1: 0.2260
 epoch: 58, train_loss: 1.3026, test_loss: 1.3147, test_f1: 0.2260
 epoch: 59, train_loss: 1.3024, test_loss: 1.3164, test_f1: 0.2260
 epoch: 60, train_loss: 1.3019, test_loss: 1.3149, test_f1: 0.2260
 epoch: 61, train_loss: 1.3017, test_loss: 1.3155, test_f1: 0.2260
 epoch: 62, train_loss: 1.3015, test_loss: 1.3147, test_f1: 0.2260
 epoch: 63, train_loss: 1.3017, test_loss: 1.3149, test_f1: 0.2260
 epoch: 64, train_loss: 1.3016, test_loss: 1.3156, test_f1: 0.2260
 epoch: 65, train_loss: 1.3018, test_loss: 1.3153, test_f1: 0.2260
 epoch: 66, train_loss: 1.3015, test_loss: 1.3157, test_f1: 0.2260
 epoch: 67, train_loss: 1.3016, test_loss: 1.3153, test_f1: 0.2260
 epoch: 68, train_loss: 1.3018, test_loss: 1.3146, test_f1: 0.2260
 epoch: 69, train_loss: 1.3016, test_loss: 1.3156, test_f1: 0.2260
 epoch: 70, train_loss: 1.3017, test_loss: 1.3150, test_f1: 0.2260
 epoch: 71, train_loss: 1.3023, test_loss: 1.3151, test_f1: 0.2260
 epoch: 72, train_loss: 1.3018, test_loss: 1.3161, test_f1: 0.2260
 epoch: 73, train_loss: 1.3015, test_loss: 1.3155, test_f1: 0.2260
 epoch: 74, train_loss: 1.3017, test_loss: 1.3156, test_f1: 0.2260
 epoch: 75, train_loss: 1.3016, test_loss: 1.3147, test_f1: 0.2260
 epoch: 76, train_loss: 1.3018, test_loss: 1.3155, test_f1: 0.2260
 epoch: 77, train_loss: 1.3014, test_loss: 1.3146, test_f1: 0.2260
 epoch: 78, train_loss: 1.3015, test_loss: 1.3155, test_f1: 0.2260
 epoch: 79, train_loss: 1.3014, test_loss: 1.3155, test_f1: 0.2260
 epoch: 80, train_loss: 1.3016, test_loss: 1.3150, test_f1: 0.2260
 epoch: 81, train_loss: 1.3014, test_loss: 1.3154, test_f1: 0.2260
 epoch: 82, train_loss: 1.3017, test_loss: 1.3156, test_f1: 0.2260
 epoch: 83, train_loss: 1.3018, test_loss: 1.3145, test_f1: 0.2260
 epoch: 84, train_loss: 1.3015, test_loss: 1.3159, test_f1: 0.2260
 epoch: 85, train_loss: 1.3022, test_loss: 1.3160, test_f1: 0.2260
 epoch: 86, train_loss: 1.3020, test_loss: 1.3151, test_f1: 0.2260
 epoch: 87, train_loss: 1.3015, test_loss: 1.3156, test_f1: 0.2260
 epoch: 88, train_loss: 1.3017, test_loss: 1.3150, test_f1: 0.2260
 epoch: 89, train_loss: 1.3015, test_loss: 1.3160, test_f1: 0.2260
 epoch: 90, train_loss: 1.3016, test_loss: 1.3151, test_f1: 0.2260
 epoch: 91, train_loss: 1.3015, test_loss: 1.3147, test_f1: 0.2260
 epoch: 92, train_loss: 1.3019, test_loss: 1.3152, test_f1: 0.2260
 epoch: 93, train_loss: 1.3015, test_loss: 1.3153, test_f1: 0.2260
 epoch: 94, train_loss: 1.3015, test_loss: 1.3149, test_f1: 0.2260
 epoch: 95, train_loss: 1.3024, test_loss: 1.3153, test_f1: 0.2260
 epoch: 96, train_loss: 1.3018, test_loss: 1.3144, test_f1: 0.2260
 epoch: 97, train_loss: 1.3021, test_loss: 1.3161, test_f1: 0.2260
 epoch: 98, train_loss: 1.3015, test_loss: 1.3148, test_f1: 0.2260
 epoch: 99, train_loss: 1.3016, test_loss: 1.3149, test_f1: 0.2260
##################ITERATION #7 ****************************************
 epoch: 0, train_loss: 1.3036, test_loss: 1.3243, test_f1: 0.2260
 epoch: 1, train_loss: 1.3033, test_loss: 1.3140, test_f1: 0.2260
 epoch: 2, train_loss: 1.3029, test_loss: 1.3161, test_f1: 0.2260
 epoch: 3, train_loss: 1.3019, test_loss: 1.3145, test_f1: 0.2260
 epoch: 4, train_loss: 1.3020, test_loss: 1.3164, test_f1: 0.2260
 epoch: 5, train_loss: 1.3021, test_loss: 1.3154, test_f1: 0.2260
 epoch: 6, train_loss: 1.3027, test_loss: 1.3156, test_f1: 0.2260
 epoch: 7, train_loss: 1.3020, test_loss: 1.3156, test_f1: 0.2260
 epoch: 8, train_loss: 1.3022, test_loss: 1.3150, test_f1: 0.2260
 epoch: 9, train_loss: 1.3025, test_loss: 1.3166, test_f1: 0.2260
 epoch: 10, train_loss: 1.3023, test_loss: 1.3137, test_f1: 0.2260
 epoch: 11, train_loss: 1.3028, test_loss: 1.3170, test_f1: 0.2260
 epoch: 12, train_loss: 1.3019, test_loss: 1.3161, test_f1: 0.2260
 epoch: 13, train_loss: 1.3019, test_loss: 1.3147, test_f1: 0.2260
 epoch: 14, train_loss: 1.3022, test_loss: 1.3166, test_f1: 0.2260
 epoch: 15, train_loss: 1.3018, test_loss: 1.3142, test_f1: 0.2260
 epoch: 16, train_loss: 1.3019, test_loss: 1.3155, test_f1: 0.2260
 epoch: 17, train_loss: 1.3019, test_loss: 1.3141, test_f1: 0.2260
 epoch: 18, train_loss: 1.3023, test_loss: 1.3178, test_f1: 0.2260
 epoch: 19, train_loss: 1.3019, test_loss: 1.3150, test_f1: 0.2260
 epoch: 20, train_loss: 1.3019, test_loss: 1.3149, test_f1: 0.2260
 epoch: 21, train_loss: 1.3027, test_loss: 1.3164, test_f1: 0.2260
 epoch: 22, train_loss: 1.3034, test_loss: 1.3155, test_f1: 0.2260
 epoch: 23, train_loss: 1.3030, test_loss: 1.3154, test_f1: 0.2260
 epoch: 24, train_loss: 1.3021, test_loss: 1.3144, test_f1: 0.2260
 epoch: 25, train_loss: 1.3016, test_loss: 1.3166, test_f1: 0.2260
 epoch: 26, train_loss: 1.3022, test_loss: 1.3142, test_f1: 0.2260
 epoch: 27, train_loss: 1.3021, test_loss: 1.3156, test_f1: 0.2260
 epoch: 28, train_loss: 1.3023, test_loss: 1.3160, test_f1: 0.2260
 epoch: 29, train_loss: 1.3026, test_loss: 1.3151, test_f1: 0.2260
 epoch: 30, train_loss: 1.3031, test_loss: 1.3166, test_f1: 0.2260
 epoch: 31, train_loss: 1.3031, test_loss: 1.3146, test_f1: 0.2260
 epoch: 32, train_loss: 1.3022, test_loss: 1.3151, test_f1: 0.2260
 epoch: 33, train_loss: 1.3020, test_loss: 1.3153, test_f1: 0.2260
 epoch: 34, train_loss: 1.3023, test_loss: 1.3161, test_f1: 0.2260
 epoch: 35, train_loss: 1.3025, test_loss: 1.3167, test_f1: 0.2260
 epoch: 36, train_loss: 1.3020, test_loss: 1.3153, test_f1: 0.2260
 epoch: 37, train_loss: 1.3021, test_loss: 1.3165, test_f1: 0.2260
 epoch: 38, train_loss: 1.3026, test_loss: 1.3166, test_f1: 0.2260
 epoch: 39, train_loss: 1.3017, test_loss: 1.3157, test_f1: 0.2260
 epoch: 40, train_loss: 1.3020, test_loss: 1.3153, test_f1: 0.2260
 epoch: 41, train_loss: 1.3015, test_loss: 1.3162, test_f1: 0.2260
 epoch: 42, train_loss: 1.3021, test_loss: 1.3142, test_f1: 0.2260
 epoch: 43, train_loss: 1.3017, test_loss: 1.3165, test_f1: 0.2260
 epoch: 44, train_loss: 1.3019, test_loss: 1.3148, test_f1: 0.2260
 epoch: 45, train_loss: 1.3019, test_loss: 1.3158, test_f1: 0.2260
 epoch: 46, train_loss: 1.3023, test_loss: 1.3147, test_f1: 0.2260
 epoch: 47, train_loss: 1.3026, test_loss: 1.3168, test_f1: 0.2260
 epoch: 48, train_loss: 1.3027, test_loss: 1.3144, test_f1: 0.2260
 epoch: 49, train_loss: 1.3022, test_loss: 1.3157, test_f1: 0.2260
 epoch: 50, train_loss: 1.3026, test_loss: 1.3167, test_f1: 0.2260
 epoch: 51, train_loss: 1.3016, test_loss: 1.3140, test_f1: 0.2260
 epoch: 52, train_loss: 1.3016, test_loss: 1.3151, test_f1: 0.2260
 epoch: 53, train_loss: 1.3016, test_loss: 1.3164, test_f1: 0.2260
 epoch: 54, train_loss: 1.3018, test_loss: 1.3145, test_f1: 0.2260
 epoch: 55, train_loss: 1.3018, test_loss: 1.3156, test_f1: 0.2260
 epoch: 56, train_loss: 1.3016, test_loss: 1.3157, test_f1: 0.2260
 epoch: 57, train_loss: 1.3018, test_loss: 1.3150, test_f1: 0.2260
 epoch: 58, train_loss: 1.3016, test_loss: 1.3156, test_f1: 0.2260
 epoch: 59, train_loss: 1.3025, test_loss: 1.3144, test_f1: 0.2260
 epoch: 60, train_loss: 1.3017, test_loss: 1.3164, test_f1: 0.2260
 epoch: 61, train_loss: 1.3026, test_loss: 1.3144, test_f1: 0.2260
 epoch: 62, train_loss: 1.3016, test_loss: 1.3165, test_f1: 0.2260
 epoch: 63, train_loss: 1.3016, test_loss: 1.3148, test_f1: 0.2260
 epoch: 64, train_loss: 1.3017, test_loss: 1.3157, test_f1: 0.2260
 epoch: 65, train_loss: 1.3016, test_loss: 1.3150, test_f1: 0.2260
 epoch: 66, train_loss: 1.3015, test_loss: 1.3157, test_f1: 0.2260
 epoch: 67, train_loss: 1.3015, test_loss: 1.3150, test_f1: 0.2260
 epoch: 68, train_loss: 1.3021, test_loss: 1.3154, test_f1: 0.2260
 epoch: 69, train_loss: 1.3017, test_loss: 1.3150, test_f1: 0.2260
 epoch: 70, train_loss: 1.3018, test_loss: 1.3163, test_f1: 0.2260
 epoch: 71, train_loss: 1.3014, test_loss: 1.3147, test_f1: 0.2260
 epoch: 72, train_loss: 1.3016, test_loss: 1.3154, test_f1: 0.2260
 epoch: 73, train_loss: 1.3015, test_loss: 1.3153, test_f1: 0.2260
 epoch: 74, train_loss: 1.3016, test_loss: 1.3154, test_f1: 0.2260
 epoch: 75, train_loss: 1.3016, test_loss: 1.3160, test_f1: 0.2260
 epoch: 76, train_loss: 1.3016, test_loss: 1.3148, test_f1: 0.2260
 epoch: 77, train_loss: 1.3016, test_loss: 1.3159, test_f1: 0.2260
 epoch: 78, train_loss: 1.3015, test_loss: 1.3152, test_f1: 0.2260
 epoch: 79, train_loss: 1.3020, test_loss: 1.3150, test_f1: 0.2260
 epoch: 80, train_loss: 1.3020, test_loss: 1.3150, test_f1: 0.2260
 epoch: 81, train_loss: 1.3015, test_loss: 1.3150, test_f1: 0.2260
 epoch: 82, train_loss: 1.3020, test_loss: 1.3159, test_f1: 0.2260
 epoch: 83, train_loss: 1.3015, test_loss: 1.3150, test_f1: 0.2260
 epoch: 84, train_loss: 1.3019, test_loss: 1.3147, test_f1: 0.2260
 epoch: 85, train_loss: 1.3015, test_loss: 1.3156, test_f1: 0.2260
 epoch: 86, train_loss: 1.3014, test_loss: 1.3158, test_f1: 0.2260
 epoch: 87, train_loss: 1.3017, test_loss: 1.3150, test_f1: 0.2260
 epoch: 88, train_loss: 1.3015, test_loss: 1.3154, test_f1: 0.2260
 epoch: 89, train_loss: 1.3018, test_loss: 1.3157, test_f1: 0.2260
 epoch: 90, train_loss: 1.3018, test_loss: 1.3157, test_f1: 0.2260
 epoch: 91, train_loss: 1.3015, test_loss: 1.3147, test_f1: 0.2260
 epoch: 92, train_loss: 1.3018, test_loss: 1.3152, test_f1: 0.2260
 epoch: 93, train_loss: 1.3014, test_loss: 1.3151, test_f1: 0.2260
 epoch: 94, train_loss: 1.3018, test_loss: 1.3154, test_f1: 0.2260
 epoch: 95, train_loss: 1.3014, test_loss: 1.3150, test_f1: 0.2260
 epoch: 96, train_loss: 1.3015, test_loss: 1.3151, test_f1: 0.2260
 epoch: 97, train_loss: 1.3015, test_loss: 1.3153, test_f1: 0.2260
 epoch: 98, train_loss: 1.3017, test_loss: 1.3160, test_f1: 0.2260
 epoch: 99, train_loss: 1.3013, test_loss: 1.3156, test_f1: 0.2260
##################ITERATION #8 ****************************************
 epoch: 0, train_loss: 1.3037, test_loss: 1.3164, test_f1: 0.2260
 epoch: 1, train_loss: 1.3023, test_loss: 1.3167, test_f1: 0.2260
 epoch: 2, train_loss: 1.3031, test_loss: 1.3162, test_f1: 0.2260
 epoch: 3, train_loss: 1.3025, test_loss: 1.3151, test_f1: 0.2260
 epoch: 4, train_loss: 1.3022, test_loss: 1.3161, test_f1: 0.2260
 epoch: 5, train_loss: 1.3018, test_loss: 1.3154, test_f1: 0.2260
 epoch: 6, train_loss: 1.3027, test_loss: 1.3163, test_f1: 0.2260
 epoch: 7, train_loss: 1.3024, test_loss: 1.3157, test_f1: 0.2260
 epoch: 8, train_loss: 1.3026, test_loss: 1.3149, test_f1: 0.2260
 epoch: 9, train_loss: 1.3025, test_loss: 1.3146, test_f1: 0.2260
 epoch: 10, train_loss: 1.3020, test_loss: 1.3156, test_f1: 0.2260
 epoch: 11, train_loss: 1.3026, test_loss: 1.3151, test_f1: 0.2260
 epoch: 12, train_loss: 1.3030, test_loss: 1.3149, test_f1: 0.2260
 epoch: 13, train_loss: 1.3028, test_loss: 1.3166, test_f1: 0.2260
 epoch: 14, train_loss: 1.3026, test_loss: 1.3145, test_f1: 0.2260
 epoch: 15, train_loss: 1.3021, test_loss: 1.3154, test_f1: 0.2260
 epoch: 16, train_loss: 1.3021, test_loss: 1.3162, test_f1: 0.2260
 epoch: 17, train_loss: 1.3023, test_loss: 1.3155, test_f1: 0.2260
 epoch: 18, train_loss: 1.3027, test_loss: 1.3148, test_f1: 0.2260
 epoch: 19, train_loss: 1.3022, test_loss: 1.3151, test_f1: 0.2260
 epoch: 20, train_loss: 1.3031, test_loss: 1.3161, test_f1: 0.2260
 epoch: 21, train_loss: 1.3023, test_loss: 1.3148, test_f1: 0.2260
 epoch: 22, train_loss: 1.3022, test_loss: 1.3157, test_f1: 0.2260
 epoch: 23, train_loss: 1.3022, test_loss: 1.3158, test_f1: 0.2260
 epoch: 24, train_loss: 1.3022, test_loss: 1.3145, test_f1: 0.2260
 epoch: 25, train_loss: 1.3021, test_loss: 1.3164, test_f1: 0.2260
 epoch: 26, train_loss: 1.3021, test_loss: 1.3151, test_f1: 0.2260
 epoch: 27, train_loss: 1.3019, test_loss: 1.3148, test_f1: 0.2260
 epoch: 28, train_loss: 1.3025, test_loss: 1.3163, test_f1: 0.2260
 epoch: 29, train_loss: 1.3028, test_loss: 1.3158, test_f1: 0.2260
 epoch: 30, train_loss: 1.3037, test_loss: 1.3154, test_f1: 0.2260
 epoch: 31, train_loss: 1.3023, test_loss: 1.3158, test_f1: 0.2260
 epoch: 32, train_loss: 1.3025, test_loss: 1.3150, test_f1: 0.2260
 epoch: 33, train_loss: 1.3025, test_loss: 1.3151, test_f1: 0.2260
 epoch: 34, train_loss: 1.3023, test_loss: 1.3168, test_f1: 0.2260
 epoch: 35, train_loss: 1.3027, test_loss: 1.3147, test_f1: 0.2260
 epoch: 36, train_loss: 1.3023, test_loss: 1.3152, test_f1: 0.2260
 epoch: 37, train_loss: 1.3022, test_loss: 1.3159, test_f1: 0.2260
 epoch: 38, train_loss: 1.3028, test_loss: 1.3144, test_f1: 0.2260
 epoch: 39, train_loss: 1.3024, test_loss: 1.3162, test_f1: 0.2260
 epoch: 40, train_loss: 1.3026, test_loss: 1.3146, test_f1: 0.2260
 epoch: 41, train_loss: 1.3019, test_loss: 1.3164, test_f1: 0.2260
 epoch: 42, train_loss: 1.3021, test_loss: 1.3159, test_f1: 0.2260
 epoch: 43, train_loss: 1.3024, test_loss: 1.3154, test_f1: 0.2260
 epoch: 44, train_loss: 1.3026, test_loss: 1.3161, test_f1: 0.2260
 epoch: 45, train_loss: 1.3027, test_loss: 1.3148, test_f1: 0.2260
 epoch: 46, train_loss: 1.3025, test_loss: 1.3164, test_f1: 0.2260
 epoch: 47, train_loss: 1.3026, test_loss: 1.3158, test_f1: 0.2260
 epoch: 48, train_loss: 1.3038, test_loss: 1.3150, test_f1: 0.2260
 epoch: 49, train_loss: 1.3015, test_loss: 1.3147, test_f1: 0.2260
 epoch: 50, train_loss: 1.3021, test_loss: 1.3161, test_f1: 0.2260
 epoch: 51, train_loss: 1.3018, test_loss: 1.3152, test_f1: 0.2260
 epoch: 52, train_loss: 1.3015, test_loss: 1.3159, test_f1: 0.2260
 epoch: 53, train_loss: 1.3016, test_loss: 1.3151, test_f1: 0.2260
 epoch: 54, train_loss: 1.3017, test_loss: 1.3159, test_f1: 0.2260
 epoch: 55, train_loss: 1.3015, test_loss: 1.3151, test_f1: 0.2260
 epoch: 56, train_loss: 1.3016, test_loss: 1.3150, test_f1: 0.2260
 epoch: 57, train_loss: 1.3017, test_loss: 1.3160, test_f1: 0.2260
 epoch: 58, train_loss: 1.3017, test_loss: 1.3143, test_f1: 0.2260
 epoch: 59, train_loss: 1.3018, test_loss: 1.3146, test_f1: 0.2260
 epoch: 60, train_loss: 1.3019, test_loss: 1.3170, test_f1: 0.2260
 epoch: 61, train_loss: 1.3017, test_loss: 1.3152, test_f1: 0.2260
 epoch: 62, train_loss: 1.3017, test_loss: 1.3144, test_f1: 0.2260
 epoch: 63, train_loss: 1.3015, test_loss: 1.3160, test_f1: 0.2260
 epoch: 64, train_loss: 1.3017, test_loss: 1.3148, test_f1: 0.2260
 epoch: 65, train_loss: 1.3016, test_loss: 1.3163, test_f1: 0.2260
 epoch: 66, train_loss: 1.3016, test_loss: 1.3144, test_f1: 0.2260
 epoch: 67, train_loss: 1.3018, test_loss: 1.3155, test_f1: 0.2260
 epoch: 68, train_loss: 1.3019, test_loss: 1.3148, test_f1: 0.2260
 epoch: 69, train_loss: 1.3020, test_loss: 1.3164, test_f1: 0.2260
 epoch: 70, train_loss: 1.3015, test_loss: 1.3149, test_f1: 0.2260
 epoch: 71, train_loss: 1.3016, test_loss: 1.3147, test_f1: 0.2260
 epoch: 72, train_loss: 1.3024, test_loss: 1.3156, test_f1: 0.2260
 epoch: 73, train_loss: 1.3014, test_loss: 1.3152, test_f1: 0.2260
 epoch: 74, train_loss: 1.3017, test_loss: 1.3150, test_f1: 0.2260
 epoch: 75, train_loss: 1.3019, test_loss: 1.3151, test_f1: 0.2260
 epoch: 76, train_loss: 1.3019, test_loss: 1.3147, test_f1: 0.2260
 epoch: 77, train_loss: 1.3013, test_loss: 1.3162, test_f1: 0.2260
 epoch: 78, train_loss: 1.3016, test_loss: 1.3152, test_f1: 0.2260
 epoch: 79, train_loss: 1.3016, test_loss: 1.3150, test_f1: 0.2260
 epoch: 80, train_loss: 1.3017, test_loss: 1.3145, test_f1: 0.2260
 epoch: 81, train_loss: 1.3020, test_loss: 1.3162, test_f1: 0.2260
 epoch: 82, train_loss: 1.3018, test_loss: 1.3144, test_f1: 0.2260
 epoch: 83, train_loss: 1.3016, test_loss: 1.3152, test_f1: 0.2260
 epoch: 84, train_loss: 1.3015, test_loss: 1.3158, test_f1: 0.2260
 epoch: 85, train_loss: 1.3020, test_loss: 1.3154, test_f1: 0.2260
 epoch: 86, train_loss: 1.3020, test_loss: 1.3140, test_f1: 0.2260
 epoch: 87, train_loss: 1.3016, test_loss: 1.3161, test_f1: 0.2260
 epoch: 88, train_loss: 1.3016, test_loss: 1.3157, test_f1: 0.2260
 epoch: 89, train_loss: 1.3015, test_loss: 1.3149, test_f1: 0.2260
 epoch: 90, train_loss: 1.3015, test_loss: 1.3150, test_f1: 0.2260
 epoch: 91, train_loss: 1.3025, test_loss: 1.3157, test_f1: 0.2260
 epoch: 92, train_loss: 1.3022, test_loss: 1.3151, test_f1: 0.2260
 epoch: 93, train_loss: 1.3016, test_loss: 1.3161, test_f1: 0.2260
 epoch: 94, train_loss: 1.3022, test_loss: 1.3145, test_f1: 0.2260
 epoch: 95, train_loss: 1.3013, test_loss: 1.3160, test_f1: 0.2260
 epoch: 96, train_loss: 1.3021, test_loss: 1.3160, test_f1: 0.2260
 epoch: 97, train_loss: 1.3019, test_loss: 1.3143, test_f1: 0.2260
 epoch: 98, train_loss: 1.3016, test_loss: 1.3162, test_f1: 0.2260
 epoch: 99, train_loss: 1.3018, test_loss: 1.3157, test_f1: 0.2260
##################ITERATION #9 ****************************************
 epoch: 0, train_loss: 1.3048, test_loss: 1.3184, test_f1: 0.2260
 epoch: 1, train_loss: 1.3017, test_loss: 1.3156, test_f1: 0.2260
 epoch: 2, train_loss: 1.3027, test_loss: 1.3161, test_f1: 0.2260
 epoch: 3, train_loss: 1.3019, test_loss: 1.3155, test_f1: 0.2260
 epoch: 4, train_loss: 1.3018, test_loss: 1.3149, test_f1: 0.2260
 epoch: 5, train_loss: 1.3023, test_loss: 1.3150, test_f1: 0.2260
 epoch: 6, train_loss: 1.3028, test_loss: 1.3143, test_f1: 0.2260
 epoch: 7, train_loss: 1.3024, test_loss: 1.3160, test_f1: 0.2260
 epoch: 8, train_loss: 1.3018, test_loss: 1.3158, test_f1: 0.2260
 epoch: 9, train_loss: 1.3028, test_loss: 1.3157, test_f1: 0.2260
 epoch: 10, train_loss: 1.3024, test_loss: 1.3141, test_f1: 0.2260
 epoch: 11, train_loss: 1.3028, test_loss: 1.3145, test_f1: 0.2260
 epoch: 12, train_loss: 1.3025, test_loss: 1.3150, test_f1: 0.2260
 epoch: 13, train_loss: 1.3042, test_loss: 1.3150, test_f1: 0.2260
 epoch: 14, train_loss: 1.3045, test_loss: 1.3166, test_f1: 0.2260
 epoch: 15, train_loss: 1.3024, test_loss: 1.3151, test_f1: 0.2260
 epoch: 16, train_loss: 1.3024, test_loss: 1.3150, test_f1: 0.2260
 epoch: 17, train_loss: 1.3018, test_loss: 1.3149, test_f1: 0.2260
 epoch: 18, train_loss: 1.3033, test_loss: 1.3148, test_f1: 0.2260
 epoch: 19, train_loss: 1.3033, test_loss: 1.3153, test_f1: 0.2260
 epoch: 20, train_loss: 1.3021, test_loss: 1.3157, test_f1: 0.2260
 epoch: 21, train_loss: 1.3024, test_loss: 1.3152, test_f1: 0.2260
 epoch: 22, train_loss: 1.3026, test_loss: 1.3165, test_f1: 0.2260
 epoch: 23, train_loss: 1.3021, test_loss: 1.3145, test_f1: 0.2260
 epoch: 24, train_loss: 1.3030, test_loss: 1.3172, test_f1: 0.2260
 epoch: 25, train_loss: 1.3024, test_loss: 1.3147, test_f1: 0.2260
 epoch: 26, train_loss: 1.3031, test_loss: 1.3162, test_f1: 0.2260
 epoch: 27, train_loss: 1.3038, test_loss: 1.3165, test_f1: 0.2260
 epoch: 28, train_loss: 1.3018, test_loss: 1.3144, test_f1: 0.2260
 epoch: 29, train_loss: 1.3019, test_loss: 1.3155, test_f1: 0.2260
 epoch: 30, train_loss: 1.3028, test_loss: 1.3145, test_f1: 0.2260
 epoch: 31, train_loss: 1.3025, test_loss: 1.3155, test_f1: 0.2260
 epoch: 32, train_loss: 1.3022, test_loss: 1.3144, test_f1: 0.2260
 epoch: 33, train_loss: 1.3025, test_loss: 1.3165, test_f1: 0.2260
 epoch: 34, train_loss: 1.3023, test_loss: 1.3155, test_f1: 0.2260
 epoch: 35, train_loss: 1.3027, test_loss: 1.3159, test_f1: 0.2260
 epoch: 36, train_loss: 1.3017, test_loss: 1.3158, test_f1: 0.2260
 epoch: 37, train_loss: 1.3035, test_loss: 1.3153, test_f1: 0.2260
 epoch: 38, train_loss: 1.3025, test_loss: 1.3166, test_f1: 0.2260
 epoch: 39, train_loss: 1.3024, test_loss: 1.3160, test_f1: 0.2260
 epoch: 40, train_loss: 1.3026, test_loss: 1.3157, test_f1: 0.2260
 epoch: 41, train_loss: 1.3019, test_loss: 1.3150, test_f1: 0.2260
 epoch: 42, train_loss: 1.3024, test_loss: 1.3165, test_f1: 0.2260
 epoch: 43, train_loss: 1.3031, test_loss: 1.3147, test_f1: 0.2260
 epoch: 44, train_loss: 1.3033, test_loss: 1.3153, test_f1: 0.2260
 epoch: 45, train_loss: 1.3017, test_loss: 1.3154, test_f1: 0.2260
 epoch: 46, train_loss: 1.3024, test_loss: 1.3161, test_f1: 0.2260
 epoch: 47, train_loss: 1.3026, test_loss: 1.3141, test_f1: 0.2260
 epoch: 48, train_loss: 1.3027, test_loss: 1.3169, test_f1: 0.2260
 epoch: 49, train_loss: 1.3024, test_loss: 1.3145, test_f1: 0.2260
 epoch: 50, train_loss: 1.3020, test_loss: 1.3163, test_f1: 0.2260
 epoch: 51, train_loss: 1.3021, test_loss: 1.3150, test_f1: 0.2260
 epoch: 52, train_loss: 1.3016, test_loss: 1.3157, test_f1: 0.2260
 epoch: 53, train_loss: 1.3022, test_loss: 1.3149, test_f1: 0.2260
 epoch: 54, train_loss: 1.3022, test_loss: 1.3155, test_f1: 0.2260
 epoch: 55, train_loss: 1.3017, test_loss: 1.3154, test_f1: 0.2260
 epoch: 56, train_loss: 1.3015, test_loss: 1.3151, test_f1: 0.2260
 epoch: 57, train_loss: 1.3019, test_loss: 1.3166, test_f1: 0.2260
 epoch: 58, train_loss: 1.3018, test_loss: 1.3146, test_f1: 0.2260
 epoch: 59, train_loss: 1.3020, test_loss: 1.3152, test_f1: 0.2260
 epoch: 60, train_loss: 1.3018, test_loss: 1.3158, test_f1: 0.2260
 epoch: 61, train_loss: 1.3016, test_loss: 1.3150, test_f1: 0.2260
 epoch: 62, train_loss: 1.3020, test_loss: 1.3154, test_f1: 0.2260
 epoch: 63, train_loss: 1.3017, test_loss: 1.3151, test_f1: 0.2260
 epoch: 64, train_loss: 1.3018, test_loss: 1.3156, test_f1: 0.2260
 epoch: 65, train_loss: 1.3017, test_loss: 1.3146, test_f1: 0.2260
 epoch: 66, train_loss: 1.3016, test_loss: 1.3155, test_f1: 0.2260
 epoch: 67, train_loss: 1.3019, test_loss: 1.3150, test_f1: 0.2260
 epoch: 68, train_loss: 1.3023, test_loss: 1.3166, test_f1: 0.2260
 epoch: 69, train_loss: 1.3020, test_loss: 1.3145, test_f1: 0.2260
 epoch: 70, train_loss: 1.3015, test_loss: 1.3154, test_f1: 0.2260
 epoch: 71, train_loss: 1.3025, test_loss: 1.3153, test_f1: 0.2260
 epoch: 72, train_loss: 1.3018, test_loss: 1.3160, test_f1: 0.2260
 epoch: 73, train_loss: 1.3025, test_loss: 1.3155, test_f1: 0.2260
 epoch: 74, train_loss: 1.3014, test_loss: 1.3154, test_f1: 0.2260
 epoch: 75, train_loss: 1.3017, test_loss: 1.3155, test_f1: 0.2260
 epoch: 76, train_loss: 1.3015, test_loss: 1.3150, test_f1: 0.2260
 epoch: 77, train_loss: 1.3018, test_loss: 1.3152, test_f1: 0.2260
 epoch: 78, train_loss: 1.3016, test_loss: 1.3151, test_f1: 0.2260
 epoch: 79, train_loss: 1.3017, test_loss: 1.3154, test_f1: 0.2260
 epoch: 80, train_loss: 1.3020, test_loss: 1.3149, test_f1: 0.2260
 epoch: 81, train_loss: 1.3015, test_loss: 1.3164, test_f1: 0.2260
 epoch: 82, train_loss: 1.3016, test_loss: 1.3149, test_f1: 0.2260
 epoch: 83, train_loss: 1.3014, test_loss: 1.3155, test_f1: 0.2260
 epoch: 84, train_loss: 1.3018, test_loss: 1.3152, test_f1: 0.2260
 epoch: 85, train_loss: 1.3017, test_loss: 1.3155, test_f1: 0.2260
 epoch: 86, train_loss: 1.3015, test_loss: 1.3147, test_f1: 0.2260
 epoch: 87, train_loss: 1.3015, test_loss: 1.3154, test_f1: 0.2260
 epoch: 88, train_loss: 1.3015, test_loss: 1.3151, test_f1: 0.2260
 epoch: 89, train_loss: 1.3017, test_loss: 1.3158, test_f1: 0.2260
 epoch: 90, train_loss: 1.3016, test_loss: 1.3156, test_f1: 0.2260
 epoch: 91, train_loss: 1.3019, test_loss: 1.3158, test_f1: 0.2260
 epoch: 92, train_loss: 1.3015, test_loss: 1.3150, test_f1: 0.2260
 epoch: 93, train_loss: 1.3017, test_loss: 1.3154, test_f1: 0.2260
 epoch: 94, train_loss: 1.3016, test_loss: 1.3148, test_f1: 0.2260
 epoch: 95, train_loss: 1.3018, test_loss: 1.3153, test_f1: 0.2260
 epoch: 96, train_loss: 1.3017, test_loss: 1.3153, test_f1: 0.2260
 epoch: 97, train_loss: 1.3015, test_loss: 1.3153, test_f1: 0.2260
 epoch: 98, train_loss: 1.3019, test_loss: 1.3152, test_f1: 0.2260
 epoch: 99, train_loss: 1.3016, test_loss: 1.3156, test_f1: 0.2260

Training completed in 403.24 seconds
Best F1: 0.5908 at epoch 50
Mean F1 across iterations: 0.2625  0.1094
========================FINAL RESULTS================================
FEGIN weighted F1: 0.5908  0.1094
python main.py --data ltspice_examples --representation component_pin --model FEGIN --layers 3 --hiddens 16 --batch_size 256 --lr 0.1 --emb_size 128 --epochs 100 --save_appendix component_pin_L3_H16_BS256_LR0.1_E128 --no_val
-----



STDERR:
  File "main.py", line 370, in <module>
    main()
  File "main.py", line 254, in main
    dataset = dataset_class(
  File "/home/philip/projects/ltspice_examples_code_repo/Circuit-Completion-Using-GNNs/component_classification_with_link_prediction_head/evaluation/FEGIN/kernel/circuit_datasets.py", line 15, in __init__
    self.data, self.slices = torch.load(self.processed_paths[0])
  File "/home/philip/.local/lib/python3.8/site-packages/torch/serialization.py", line 1040, in load
    warnings.warn(
  File "/usr/lib/python3.8/warnings.py", line 109, in _showwarnmsg
    sw(msg.message, msg.category, msg.filename, msg.lineno,
  File "main.py", line 47, in warn_with_traceback
    traceback.print_stack(file=log)
/home/philip/projects/ltspice_examples_code_repo/Circuit-Completion-Using-GNNs/component_classification_with_link_prediction_head/evaluation/FEGIN/kernel/circuit_datasets.py:15: FutureWarning: You are using `torch.load` with `weights_only=False` (the current default value), which uses the default pickle module implicitly. It is possible to construct malicious pickle data which will execute arbitrary code during unpickling (See https://github.com/pytorch/pytorch/blob/main/SECURITY.md#untrusted-models for more details). In a future release, the default value for `weights_only` will be flipped to `True`. This limits the functions that could be executed during unpickling. Arbitrary objects will no longer be allowed to be loaded via this mode unless they are explicitly allowlisted by the user via `torch.serialization.add_safe_globals`. We recommend you start setting `weights_only=True` for any use case where you don't have full control of the loaded file. Please open an issue on GitHub for any issues related to this experimental feature.
  self.data, self.slices = torch.load(self.processed_paths[0])
