STDOUT:
Results will be saved in /home/philip/projects/ltspice_examples_code_repo/Circuit-Completion-Using-GNNs/component_classification_with_link_prediction_head/evaluation/FEGIN/results/model_FEGIN_dataset_ltspice_examples
Command line input: python main.py --data ltspice_examples --representation component_pin_net --model FEGIN --layers 4 --hiddens 32 --batch_size 64 --lr 0.001 --emb_size 512 --epochs 100 --save_appendix component_pin_net_L4_H32_BS64_LR0.001_E512 --no_val
 is saved.
-----
ltspice_examples - FEGIN
Using 4 layers, 32 hidden units, h = 2
Loading component_pin_net representation dataset
ENTERED
Training FEGIN on component_pin_net representation
Train: 3558, Test: 846
##################ITERATION #0 ****************************************
 epoch: 0, train_loss: 1.2574, test_loss: 1.1041, test_f1: 0.3769
 epoch: 1, train_loss: 1.0607, test_loss: 1.0473, test_f1: 0.3659
 epoch: 2, train_loss: 1.0315, test_loss: 1.0236, test_f1: 0.4208
 epoch: 3, train_loss: 1.0119, test_loss: 1.0410, test_f1: 0.4151
 epoch: 4, train_loss: 0.9947, test_loss: 1.0083, test_f1: 0.4287
 epoch: 5, train_loss: 0.9803, test_loss: 0.9944, test_f1: 0.4782
 epoch: 6, train_loss: 0.9620, test_loss: 0.9681, test_f1: 0.5047
 epoch: 7, train_loss: 0.9477, test_loss: 0.9704, test_f1: 0.5011
 epoch: 8, train_loss: 0.9334, test_loss: 0.9485, test_f1: 0.5256
 epoch: 9, train_loss: 0.9216, test_loss: 0.9027, test_f1: 0.5204
 epoch: 10, train_loss: 0.9144, test_loss: 0.9141, test_f1: 0.5129
 epoch: 11, train_loss: 0.9073, test_loss: 0.9492, test_f1: 0.5240
 epoch: 12, train_loss: 0.8905, test_loss: 0.9655, test_f1: 0.4788
 epoch: 13, train_loss: 0.8767, test_loss: 1.0211, test_f1: 0.4940
 epoch: 14, train_loss: 0.8716, test_loss: 0.9619, test_f1: 0.5278
 epoch: 15, train_loss: 0.8615, test_loss: 0.9040, test_f1: 0.5417
 epoch: 16, train_loss: 0.8568, test_loss: 0.9428, test_f1: 0.5337
 epoch: 17, train_loss: 0.8487, test_loss: 0.8860, test_f1: 0.5119
 epoch: 18, train_loss: 0.8385, test_loss: 0.8358, test_f1: 0.5500
 epoch: 19, train_loss: 0.8221, test_loss: 0.8911, test_f1: 0.4938
 epoch: 20, train_loss: 0.8105, test_loss: 0.9833, test_f1: 0.5001
 epoch: 21, train_loss: 0.8242, test_loss: 0.8786, test_f1: 0.5633
 epoch: 22, train_loss: 0.8062, test_loss: 0.8825, test_f1: 0.5305
 epoch: 23, train_loss: 0.7983, test_loss: 0.8951, test_f1: 0.5276
 epoch: 24, train_loss: 0.7983, test_loss: 0.8505, test_f1: 0.5702
 epoch: 25, train_loss: 0.7931, test_loss: 0.9011, test_f1: 0.5620
 epoch: 26, train_loss: 0.7927, test_loss: 0.8955, test_f1: 0.5547
 epoch: 27, train_loss: 0.7986, test_loss: 0.8762, test_f1: 0.5418
 epoch: 28, train_loss: 0.7809, test_loss: 0.9012, test_f1: 0.5446
 epoch: 29, train_loss: 0.7753, test_loss: 0.8324, test_f1: 0.5620
 epoch: 30, train_loss: 0.7626, test_loss: 0.9302, test_f1: 0.5415
 epoch: 31, train_loss: 0.7602, test_loss: 0.8702, test_f1: 0.5561
 epoch: 32, train_loss: 0.7505, test_loss: 0.9047, test_f1: 0.5865
 epoch: 33, train_loss: 0.7441, test_loss: 0.9131, test_f1: 0.5653
 epoch: 34, train_loss: 0.7457, test_loss: 0.8976, test_f1: 0.5748
 epoch: 35, train_loss: 0.7463, test_loss: 0.9178, test_f1: 0.5895
 epoch: 36, train_loss: 0.7442, test_loss: 0.9394, test_f1: 0.5724
 epoch: 37, train_loss: 0.7200, test_loss: 0.8457, test_f1: 0.5784
 epoch: 38, train_loss: 0.7170, test_loss: 0.9503, test_f1: 0.5511
 epoch: 39, train_loss: 0.7204, test_loss: 0.8921, test_f1: 0.5949
 epoch: 40, train_loss: 0.7168, test_loss: 0.9331, test_f1: 0.5747
 epoch: 41, train_loss: 0.7281, test_loss: 0.8341, test_f1: 0.6051
 epoch: 42, train_loss: 0.6980, test_loss: 0.8687, test_f1: 0.5868
 epoch: 43, train_loss: 0.7138, test_loss: 0.8288, test_f1: 0.5877
 epoch: 44, train_loss: 0.7032, test_loss: 0.8603, test_f1: 0.5922
 epoch: 45, train_loss: 0.6946, test_loss: 0.8674, test_f1: 0.6040
 epoch: 46, train_loss: 0.6909, test_loss: 0.9144, test_f1: 0.5780
 epoch: 47, train_loss: 0.6721, test_loss: 0.9193, test_f1: 0.6031
 epoch: 48, train_loss: 0.6792, test_loss: 0.9226, test_f1: 0.5881
 epoch: 49, train_loss: 0.6774, test_loss: 0.8686, test_f1: 0.5974
 epoch: 50, train_loss: 0.6628, test_loss: 0.9584, test_f1: 0.6212
 epoch: 51, train_loss: 0.6391, test_loss: 0.8692, test_f1: 0.6346
 epoch: 52, train_loss: 0.6332, test_loss: 0.9013, test_f1: 0.6176
 epoch: 53, train_loss: 0.6333, test_loss: 0.9252, test_f1: 0.6135
 epoch: 54, train_loss: 0.6174, test_loss: 0.9302, test_f1: 0.6105
 epoch: 55, train_loss: 0.6175, test_loss: 0.9222, test_f1: 0.6272
 epoch: 56, train_loss: 0.6207, test_loss: 0.9169, test_f1: 0.6180
 epoch: 57, train_loss: 0.6102, test_loss: 1.0034, test_f1: 0.6255
 epoch: 58, train_loss: 0.6018, test_loss: 0.9920, test_f1: 0.6226
 epoch: 59, train_loss: 0.6129, test_loss: 0.9890, test_f1: 0.6127
 epoch: 60, train_loss: 0.6090, test_loss: 0.9716, test_f1: 0.6223
 epoch: 61, train_loss: 0.5899, test_loss: 0.9749, test_f1: 0.6398
 epoch: 62, train_loss: 0.5922, test_loss: 1.0353, test_f1: 0.6187
 epoch: 63, train_loss: 0.5825, test_loss: 1.0180, test_f1: 0.6351
 epoch: 64, train_loss: 0.5910, test_loss: 0.9989, test_f1: 0.6409
 epoch: 65, train_loss: 0.5917, test_loss: 0.9892, test_f1: 0.6300
 epoch: 66, train_loss: 0.5779, test_loss: 1.0637, test_f1: 0.6282
 epoch: 67, train_loss: 0.5820, test_loss: 1.0436, test_f1: 0.6359
 epoch: 68, train_loss: 0.5848, test_loss: 1.0415, test_f1: 0.6334
 epoch: 69, train_loss: 0.5780, test_loss: 1.0490, test_f1: 0.6321
 epoch: 70, train_loss: 0.5757, test_loss: 1.0543, test_f1: 0.6098
 epoch: 71, train_loss: 0.5798, test_loss: 1.0617, test_f1: 0.6239
 epoch: 72, train_loss: 0.5700, test_loss: 1.0806, test_f1: 0.6274
 epoch: 73, train_loss: 0.5580, test_loss: 1.0581, test_f1: 0.6317
 epoch: 74, train_loss: 0.5673, test_loss: 1.0774, test_f1: 0.6237
 epoch: 75, train_loss: 0.5633, test_loss: 1.0936, test_f1: 0.6303
 epoch: 76, train_loss: 0.5636, test_loss: 1.0721, test_f1: 0.6292
 epoch: 77, train_loss: 0.5515, test_loss: 1.0440, test_f1: 0.6409
 epoch: 78, train_loss: 0.5677, test_loss: 1.0911, test_f1: 0.6329
 epoch: 79, train_loss: 0.5514, test_loss: 1.1040, test_f1: 0.6231
 epoch: 80, train_loss: 0.5409, test_loss: 1.0798, test_f1: 0.6277
 epoch: 81, train_loss: 0.5494, test_loss: 1.1180, test_f1: 0.6344
 epoch: 82, train_loss: 0.5335, test_loss: 1.0844, test_f1: 0.6468
 epoch: 83, train_loss: 0.5428, test_loss: 1.0978, test_f1: 0.6327
 epoch: 84, train_loss: 0.5438, test_loss: 1.1104, test_f1: 0.6388
 epoch: 85, train_loss: 0.5280, test_loss: 1.0920, test_f1: 0.6183
 epoch: 86, train_loss: 0.5316, test_loss: 1.1906, test_f1: 0.6242
 epoch: 87, train_loss: 0.5394, test_loss: 1.1367, test_f1: 0.6267
 epoch: 88, train_loss: 0.5346, test_loss: 1.1379, test_f1: 0.6382
 epoch: 89, train_loss: 0.5293, test_loss: 1.0475, test_f1: 0.6274
 epoch: 90, train_loss: 0.5292, test_loss: 1.1433, test_f1: 0.6225
 epoch: 91, train_loss: 0.5333, test_loss: 1.1808, test_f1: 0.6319
 epoch: 92, train_loss: 0.5398, test_loss: 1.0779, test_f1: 0.6398
 epoch: 93, train_loss: 0.5139, test_loss: 1.2355, test_f1: 0.6274
 epoch: 94, train_loss: 0.5209, test_loss: 1.1653, test_f1: 0.6190
 epoch: 95, train_loss: 0.5119, test_loss: 1.2412, test_f1: 0.6269
 epoch: 96, train_loss: 0.5066, test_loss: 1.1318, test_f1: 0.6322
 epoch: 97, train_loss: 0.5047, test_loss: 1.1265, test_f1: 0.6283
 epoch: 98, train_loss: 0.5007, test_loss: 1.1540, test_f1: 0.6369
 epoch: 99, train_loss: 0.4997, test_loss: 1.2602, test_f1: 0.6353
##################ITERATION #1 ****************************************
 epoch: 0, train_loss: 1.1176, test_loss: 1.0686, test_f1: 0.4350
 epoch: 1, train_loss: 0.9883, test_loss: 0.9712, test_f1: 0.4998
 epoch: 2, train_loss: 0.9621, test_loss: 0.9391, test_f1: 0.5166
 epoch: 3, train_loss: 0.9337, test_loss: 0.9236, test_f1: 0.5032
 epoch: 4, train_loss: 0.9150, test_loss: 0.8892, test_f1: 0.5080
 epoch: 5, train_loss: 0.9070, test_loss: 0.8942, test_f1: 0.5183
 epoch: 6, train_loss: 0.8896, test_loss: 0.8679, test_f1: 0.5502
 epoch: 7, train_loss: 0.8718, test_loss: 0.8301, test_f1: 0.5548
 epoch: 8, train_loss: 0.8650, test_loss: 0.8393, test_f1: 0.5397
 epoch: 9, train_loss: 0.8524, test_loss: 0.8178, test_f1: 0.5610
 epoch: 10, train_loss: 0.8384, test_loss: 0.8344, test_f1: 0.5576
 epoch: 11, train_loss: 0.8331, test_loss: 0.8078, test_f1: 0.5547
 epoch: 12, train_loss: 0.8117, test_loss: 0.8737, test_f1: 0.5569
 epoch: 13, train_loss: 0.8116, test_loss: 0.8228, test_f1: 0.5622
 epoch: 14, train_loss: 0.7983, test_loss: 0.8224, test_f1: 0.5644
 epoch: 15, train_loss: 0.7848, test_loss: 0.7684, test_f1: 0.5966
 epoch: 16, train_loss: 0.7866, test_loss: 0.7580, test_f1: 0.6047
 epoch: 17, train_loss: 0.7826, test_loss: 0.7932, test_f1: 0.5862
 epoch: 18, train_loss: 0.7726, test_loss: 0.7954, test_f1: 0.5706
 epoch: 19, train_loss: 0.7635, test_loss: 0.7624, test_f1: 0.5879
 epoch: 20, train_loss: 0.7524, test_loss: 0.7668, test_f1: 0.5921
 epoch: 21, train_loss: 0.7455, test_loss: 0.7398, test_f1: 0.5930
 epoch: 22, train_loss: 0.7445, test_loss: 0.7542, test_f1: 0.6162
 epoch: 23, train_loss: 0.7346, test_loss: 0.7107, test_f1: 0.6153
 epoch: 24, train_loss: 0.7370, test_loss: 0.7536, test_f1: 0.6010
 epoch: 25, train_loss: 0.7274, test_loss: 0.7266, test_f1: 0.6272
 epoch: 26, train_loss: 0.7143, test_loss: 0.7025, test_f1: 0.6649
 epoch: 27, train_loss: 0.7068, test_loss: 0.7032, test_f1: 0.6225
 epoch: 28, train_loss: 0.7010, test_loss: 0.7059, test_f1: 0.6270
 epoch: 29, train_loss: 0.7018, test_loss: 0.8072, test_f1: 0.6130
 epoch: 30, train_loss: 0.7063, test_loss: 0.7484, test_f1: 0.6188
 epoch: 31, train_loss: 0.6827, test_loss: 0.7399, test_f1: 0.6237
 epoch: 32, train_loss: 0.6764, test_loss: 0.6979, test_f1: 0.6380
 epoch: 33, train_loss: 0.6684, test_loss: 0.7352, test_f1: 0.6240
 epoch: 34, train_loss: 0.6782, test_loss: 0.6994, test_f1: 0.6263
 epoch: 35, train_loss: 0.6745, test_loss: 0.6754, test_f1: 0.6877
 epoch: 36, train_loss: 0.6710, test_loss: 0.6817, test_f1: 0.6339
 epoch: 37, train_loss: 0.6477, test_loss: 0.6764, test_f1: 0.6560
 epoch: 38, train_loss: 0.6528, test_loss: 0.6981, test_f1: 0.6454
 epoch: 39, train_loss: 0.6532, test_loss: 0.7019, test_f1: 0.6542
 epoch: 40, train_loss: 0.6529, test_loss: 0.7077, test_f1: 0.6328
 epoch: 41, train_loss: 0.6474, test_loss: 0.7627, test_f1: 0.6287
 epoch: 42, train_loss: 0.6389, test_loss: 0.7528, test_f1: 0.6349
 epoch: 43, train_loss: 0.6464, test_loss: 0.7149, test_f1: 0.6537
 epoch: 44, train_loss: 0.6208, test_loss: 0.7306, test_f1: 0.6558
 epoch: 45, train_loss: 0.6081, test_loss: 0.7202, test_f1: 0.6432
 epoch: 46, train_loss: 0.6072, test_loss: 0.6911, test_f1: 0.6515
 epoch: 47, train_loss: 0.6073, test_loss: 0.7201, test_f1: 0.6672
 epoch: 48, train_loss: 0.6110, test_loss: 0.7344, test_f1: 0.6427
 epoch: 49, train_loss: 0.6216, test_loss: 0.6938, test_f1: 0.6729
 epoch: 50, train_loss: 0.6107, test_loss: 0.7161, test_f1: 0.6612
 epoch: 51, train_loss: 0.5843, test_loss: 0.6749, test_f1: 0.6782
 epoch: 52, train_loss: 0.5730, test_loss: 0.7044, test_f1: 0.6725
 epoch: 53, train_loss: 0.5401, test_loss: 0.7038, test_f1: 0.6617
 epoch: 54, train_loss: 0.5493, test_loss: 0.6919, test_f1: 0.6804
 epoch: 55, train_loss: 0.5561, test_loss: 0.7364, test_f1: 0.6667
 epoch: 56, train_loss: 0.5497, test_loss: 0.7109, test_f1: 0.6545
 epoch: 57, train_loss: 0.5489, test_loss: 0.7261, test_f1: 0.6624
 epoch: 58, train_loss: 0.5473, test_loss: 0.7335, test_f1: 0.6613
 epoch: 59, train_loss: 0.5313, test_loss: 0.7518, test_f1: 0.6708
 epoch: 60, train_loss: 0.5367, test_loss: 0.7633, test_f1: 0.6664
 epoch: 61, train_loss: 0.5381, test_loss: 0.7648, test_f1: 0.6659
 epoch: 62, train_loss: 0.5298, test_loss: 0.7002, test_f1: 0.6907
 epoch: 63, train_loss: 0.5259, test_loss: 0.7377, test_f1: 0.6526
 epoch: 64, train_loss: 0.5195, test_loss: 0.7446, test_f1: 0.6633
 epoch: 65, train_loss: 0.5395, test_loss: 0.7688, test_f1: 0.6504
 epoch: 66, train_loss: 0.5181, test_loss: 0.7532, test_f1: 0.6591
 epoch: 67, train_loss: 0.5104, test_loss: 0.7281, test_f1: 0.6719
 epoch: 68, train_loss: 0.5206, test_loss: 0.7281, test_f1: 0.6726
 epoch: 69, train_loss: 0.5048, test_loss: 0.6941, test_f1: 0.6733
 epoch: 70, train_loss: 0.5081, test_loss: 0.8228, test_f1: 0.6447
 epoch: 71, train_loss: 0.5047, test_loss: 0.7160, test_f1: 0.6666
 epoch: 72, train_loss: 0.5001, test_loss: 0.7452, test_f1: 0.6737
 epoch: 73, train_loss: 0.4963, test_loss: 0.7399, test_f1: 0.6705
 epoch: 74, train_loss: 0.5134, test_loss: 0.7213, test_f1: 0.7038
 epoch: 75, train_loss: 0.4931, test_loss: 0.7628, test_f1: 0.6612
 epoch: 76, train_loss: 0.5044, test_loss: 0.7210, test_f1: 0.6711
 epoch: 77, train_loss: 0.4973, test_loss: 0.8181, test_f1: 0.6603
 epoch: 78, train_loss: 0.4826, test_loss: 0.7735, test_f1: 0.6753
 epoch: 79, train_loss: 0.4938, test_loss: 0.7940, test_f1: 0.6645
 epoch: 80, train_loss: 0.4717, test_loss: 0.8074, test_f1: 0.6653
 epoch: 81, train_loss: 0.4802, test_loss: 0.7918, test_f1: 0.6728
 epoch: 82, train_loss: 0.4762, test_loss: 0.7952, test_f1: 0.6643
 epoch: 83, train_loss: 0.4816, test_loss: 0.8857, test_f1: 0.6527
 epoch: 84, train_loss: 0.4645, test_loss: 0.7658, test_f1: 0.6802
 epoch: 85, train_loss: 0.4739, test_loss: 0.8453, test_f1: 0.6676
 epoch: 86, train_loss: 0.4693, test_loss: 0.8335, test_f1: 0.6745
 epoch: 87, train_loss: 0.4669, test_loss: 0.7989, test_f1: 0.6737
 epoch: 88, train_loss: 0.4646, test_loss: 0.7775, test_f1: 0.6847
 epoch: 89, train_loss: 0.4650, test_loss: 0.8987, test_f1: 0.6632
 epoch: 90, train_loss: 0.4666, test_loss: 0.8155, test_f1: 0.6668
 epoch: 91, train_loss: 0.4492, test_loss: 0.7902, test_f1: 0.6807
 epoch: 92, train_loss: 0.4529, test_loss: 0.8215, test_f1: 0.6888
 epoch: 93, train_loss: 0.4708, test_loss: 0.7926, test_f1: 0.6607
 epoch: 94, train_loss: 0.4507, test_loss: 0.8457, test_f1: 0.6711
 epoch: 95, train_loss: 0.4620, test_loss: 0.8573, test_f1: 0.6715
 epoch: 96, train_loss: 0.4591, test_loss: 0.8456, test_f1: 0.6673
 epoch: 97, train_loss: 0.4511, test_loss: 0.8861, test_f1: 0.6676
 epoch: 98, train_loss: 0.4464, test_loss: 0.8627, test_f1: 0.6742
 epoch: 99, train_loss: 0.4617, test_loss: 0.8475, test_f1: 0.6671
##################ITERATION #2 ****************************************
 epoch: 0, train_loss: 1.1275, test_loss: 1.0386, test_f1: 0.3892
 epoch: 1, train_loss: 1.0022, test_loss: 1.0004, test_f1: 0.4702
 epoch: 2, train_loss: 0.9748, test_loss: 0.9663, test_f1: 0.4792
 epoch: 3, train_loss: 0.9516, test_loss: 0.9466, test_f1: 0.5002
 epoch: 4, train_loss: 0.9426, test_loss: 0.9511, test_f1: 0.5010
 epoch: 5, train_loss: 0.9186, test_loss: 0.9231, test_f1: 0.5162
 epoch: 6, train_loss: 0.9110, test_loss: 0.8904, test_f1: 0.5321
 epoch: 7, train_loss: 0.9000, test_loss: 0.8793, test_f1: 0.5143
 epoch: 8, train_loss: 0.8853, test_loss: 0.8643, test_f1: 0.5370
 epoch: 9, train_loss: 0.8748, test_loss: 0.8678, test_f1: 0.5723
 epoch: 10, train_loss: 0.8606, test_loss: 0.8548, test_f1: 0.5354
 epoch: 11, train_loss: 0.8363, test_loss: 0.9055, test_f1: 0.5310
 epoch: 12, train_loss: 0.8481, test_loss: 0.8125, test_f1: 0.6020
 epoch: 13, train_loss: 0.8416, test_loss: 0.8307, test_f1: 0.5490
 epoch: 14, train_loss: 0.8153, test_loss: 0.8635, test_f1: 0.5578
 epoch: 15, train_loss: 0.8121, test_loss: 0.8349, test_f1: 0.5647
 epoch: 16, train_loss: 0.7965, test_loss: 0.8286, test_f1: 0.5977
 epoch: 17, train_loss: 0.7937, test_loss: 0.8005, test_f1: 0.5662
 epoch: 18, train_loss: 0.7827, test_loss: 0.8246, test_f1: 0.6146
 epoch: 19, train_loss: 0.7644, test_loss: 0.8297, test_f1: 0.5827
 epoch: 20, train_loss: 0.7694, test_loss: 0.8253, test_f1: 0.6015
 epoch: 21, train_loss: 0.7567, test_loss: 0.7988, test_f1: 0.6281
 epoch: 22, train_loss: 0.7479, test_loss: 0.8254, test_f1: 0.6020
 epoch: 23, train_loss: 0.7371, test_loss: 0.8563, test_f1: 0.6130
 epoch: 24, train_loss: 0.7295, test_loss: 0.8227, test_f1: 0.6021
 epoch: 25, train_loss: 0.7197, test_loss: 0.7976, test_f1: 0.6435
 epoch: 26, train_loss: 0.7112, test_loss: 0.7984, test_f1: 0.6292
 epoch: 27, train_loss: 0.7127, test_loss: 0.7180, test_f1: 0.6247
 epoch: 28, train_loss: 0.7003, test_loss: 0.8432, test_f1: 0.5986
 epoch: 29, train_loss: 0.6904, test_loss: 0.7194, test_f1: 0.6570
 epoch: 30, train_loss: 0.6878, test_loss: 0.6936, test_f1: 0.6751
 epoch: 31, train_loss: 0.6945, test_loss: 0.7305, test_f1: 0.6249
 epoch: 32, train_loss: 0.6957, test_loss: 0.8019, test_f1: 0.6293
 epoch: 33, train_loss: 0.6887, test_loss: 0.8593, test_f1: 0.6078
 epoch: 34, train_loss: 0.6755, test_loss: 0.8348, test_f1: 0.6228
 epoch: 35, train_loss: 0.6603, test_loss: 0.8279, test_f1: 0.6486
 epoch: 36, train_loss: 0.6741, test_loss: 0.7566, test_f1: 0.6359
 epoch: 37, train_loss: 0.6669, test_loss: 0.7345, test_f1: 0.6482
 epoch: 38, train_loss: 0.6465, test_loss: 0.8695, test_f1: 0.6511
 epoch: 39, train_loss: 0.6491, test_loss: 0.7757, test_f1: 0.6377
 epoch: 40, train_loss: 0.6264, test_loss: 0.7926, test_f1: 0.6350
 epoch: 41, train_loss: 0.6368, test_loss: 0.7761, test_f1: 0.6481
 epoch: 42, train_loss: 0.6264, test_loss: 0.7170, test_f1: 0.6686
 epoch: 43, train_loss: 0.6304, test_loss: 0.7158, test_f1: 0.6721
 epoch: 44, train_loss: 0.6215, test_loss: 0.7567, test_f1: 0.6252
 epoch: 45, train_loss: 0.6190, test_loss: 0.7104, test_f1: 0.6647
 epoch: 46, train_loss: 0.6158, test_loss: 0.7594, test_f1: 0.6302
 epoch: 47, train_loss: 0.5956, test_loss: 0.7354, test_f1: 0.6655
 epoch: 48, train_loss: 0.6335, test_loss: 0.8702, test_f1: 0.6660
 epoch: 49, train_loss: 0.6077, test_loss: 0.8282, test_f1: 0.6332
 epoch: 50, train_loss: 0.5859, test_loss: 0.8474, test_f1: 0.6178
 epoch: 51, train_loss: 0.5780, test_loss: 0.8012, test_f1: 0.6351
 epoch: 52, train_loss: 0.5583, test_loss: 0.7872, test_f1: 0.6506
 epoch: 53, train_loss: 0.5570, test_loss: 0.8292, test_f1: 0.6334
 epoch: 54, train_loss: 0.5523, test_loss: 0.7782, test_f1: 0.6466
 epoch: 55, train_loss: 0.5517, test_loss: 0.8734, test_f1: 0.6414
 epoch: 56, train_loss: 0.5389, test_loss: 0.7626, test_f1: 0.6598
 epoch: 57, train_loss: 0.5348, test_loss: 0.7706, test_f1: 0.6590
 epoch: 58, train_loss: 0.5448, test_loss: 0.7735, test_f1: 0.6547
 epoch: 59, train_loss: 0.5249, test_loss: 0.8590, test_f1: 0.6517
 epoch: 60, train_loss: 0.5335, test_loss: 0.8398, test_f1: 0.6628
 epoch: 61, train_loss: 0.5245, test_loss: 0.8528, test_f1: 0.6460
 epoch: 62, train_loss: 0.5210, test_loss: 0.8766, test_f1: 0.6227
 epoch: 63, train_loss: 0.5317, test_loss: 0.8275, test_f1: 0.6434
 epoch: 64, train_loss: 0.5195, test_loss: 0.8125, test_f1: 0.6547
 epoch: 65, train_loss: 0.5045, test_loss: 0.8029, test_f1: 0.6485
 epoch: 66, train_loss: 0.5219, test_loss: 0.8301, test_f1: 0.6646
 epoch: 67, train_loss: 0.5080, test_loss: 0.8743, test_f1: 0.6477
 epoch: 68, train_loss: 0.5076, test_loss: 0.8370, test_f1: 0.6350
 epoch: 69, train_loss: 0.5180, test_loss: 0.8639, test_f1: 0.6308
 epoch: 70, train_loss: 0.5086, test_loss: 0.8603, test_f1: 0.6433
 epoch: 71, train_loss: 0.5166, test_loss: 0.8557, test_f1: 0.6517
 epoch: 72, train_loss: 0.5058, test_loss: 0.9375, test_f1: 0.6506
 epoch: 73, train_loss: 0.5021, test_loss: 0.8703, test_f1: 0.6497
 epoch: 74, train_loss: 0.5017, test_loss: 0.8928, test_f1: 0.6477
 epoch: 75, train_loss: 0.4841, test_loss: 0.9700, test_f1: 0.6309
 epoch: 76, train_loss: 0.5001, test_loss: 0.9095, test_f1: 0.6495
 epoch: 77, train_loss: 0.4852, test_loss: 0.9269, test_f1: 0.6442
 epoch: 78, train_loss: 0.4936, test_loss: 0.8884, test_f1: 0.6513
 epoch: 79, train_loss: 0.4767, test_loss: 0.9015, test_f1: 0.6670
 epoch: 80, train_loss: 0.4870, test_loss: 0.8760, test_f1: 0.6527
 epoch: 81, train_loss: 0.4850, test_loss: 0.8624, test_f1: 0.6623
 epoch: 82, train_loss: 0.4809, test_loss: 0.8461, test_f1: 0.6614
 epoch: 83, train_loss: 0.4672, test_loss: 0.9001, test_f1: 0.6508
 epoch: 84, train_loss: 0.4706, test_loss: 0.9640, test_f1: 0.6354
 epoch: 85, train_loss: 0.4898, test_loss: 0.9556, test_f1: 0.6620
 epoch: 86, train_loss: 0.4751, test_loss: 0.8648, test_f1: 0.6777
 epoch: 87, train_loss: 0.4776, test_loss: 0.9591, test_f1: 0.6489
 epoch: 88, train_loss: 0.4786, test_loss: 0.9986, test_f1: 0.6428
 epoch: 89, train_loss: 0.4547, test_loss: 1.0713, test_f1: 0.6366
 epoch: 90, train_loss: 0.4705, test_loss: 0.9643, test_f1: 0.6384
 epoch: 91, train_loss: 0.4650, test_loss: 0.9641, test_f1: 0.6471
 epoch: 92, train_loss: 0.4451, test_loss: 0.9815, test_f1: 0.6454
 epoch: 93, train_loss: 0.4620, test_loss: 0.9682, test_f1: 0.6449
 epoch: 94, train_loss: 0.4652, test_loss: 0.9310, test_f1: 0.6606
 epoch: 95, train_loss: 0.4548, test_loss: 1.0108, test_f1: 0.6362
 epoch: 96, train_loss: 0.4578, test_loss: 1.0688, test_f1: 0.6541
 epoch: 97, train_loss: 0.4478, test_loss: 1.0322, test_f1: 0.6480
 epoch: 98, train_loss: 0.4420, test_loss: 1.0271, test_f1: 0.6482
 epoch: 99, train_loss: 0.4434, test_loss: 1.0129, test_f1: 0.6403
##################ITERATION #3 ****************************************
 epoch: 0, train_loss: 1.1710, test_loss: 1.3092, test_f1: 0.2340
 epoch: 1, train_loss: 1.0009, test_loss: 0.9407, test_f1: 0.4725
 epoch: 2, train_loss: 0.9667, test_loss: 0.9247, test_f1: 0.5088
 epoch: 3, train_loss: 0.9414, test_loss: 0.9242, test_f1: 0.5183
 epoch: 4, train_loss: 0.9185, test_loss: 0.9061, test_f1: 0.5318
 epoch: 5, train_loss: 0.9098, test_loss: 0.8535, test_f1: 0.5410
 epoch: 6, train_loss: 0.8902, test_loss: 0.8722, test_f1: 0.5493
 epoch: 7, train_loss: 0.8631, test_loss: 0.8131, test_f1: 0.5936
 epoch: 8, train_loss: 0.8620, test_loss: 0.8074, test_f1: 0.5963
 epoch: 9, train_loss: 0.8448, test_loss: 0.8146, test_f1: 0.5695
 epoch: 10, train_loss: 0.8356, test_loss: 0.8061, test_f1: 0.6034
 epoch: 11, train_loss: 0.8233, test_loss: 0.8055, test_f1: 0.6001
 epoch: 12, train_loss: 0.7992, test_loss: 0.7785, test_f1: 0.5884
 epoch: 13, train_loss: 0.7934, test_loss: 0.8162, test_f1: 0.6129
 epoch: 14, train_loss: 0.7899, test_loss: 0.8351, test_f1: 0.5583
 epoch: 15, train_loss: 0.7741, test_loss: 0.8537, test_f1: 0.5579
 epoch: 16, train_loss: 0.7586, test_loss: 0.8059, test_f1: 0.6105
 epoch: 17, train_loss: 0.7652, test_loss: 0.7576, test_f1: 0.5944
 epoch: 18, train_loss: 0.7510, test_loss: 0.7809, test_f1: 0.6399
 epoch: 19, train_loss: 0.7332, test_loss: 0.7795, test_f1: 0.6051
 epoch: 20, train_loss: 0.7462, test_loss: 0.7654, test_f1: 0.6163
 epoch: 21, train_loss: 0.7303, test_loss: 0.8036, test_f1: 0.5990
 epoch: 22, train_loss: 0.7113, test_loss: 0.7851, test_f1: 0.6103
 epoch: 23, train_loss: 0.7196, test_loss: 0.8187, test_f1: 0.6360
 epoch: 24, train_loss: 0.7006, test_loss: 0.8883, test_f1: 0.6085
 epoch: 25, train_loss: 0.6923, test_loss: 0.8407, test_f1: 0.5913
 epoch: 26, train_loss: 0.7167, test_loss: 0.7578, test_f1: 0.6291
 epoch: 27, train_loss: 0.6815, test_loss: 0.8002, test_f1: 0.6187
 epoch: 28, train_loss: 0.6902, test_loss: 0.7924, test_f1: 0.6285
 epoch: 29, train_loss: 0.6621, test_loss: 0.7484, test_f1: 0.6341
 epoch: 30, train_loss: 0.6622, test_loss: 0.8111, test_f1: 0.6066
 epoch: 31, train_loss: 0.6756, test_loss: 0.8054, test_f1: 0.6441
 epoch: 32, train_loss: 0.6639, test_loss: 0.8133, test_f1: 0.6410
 epoch: 33, train_loss: 0.6518, test_loss: 0.8269, test_f1: 0.6359
 epoch: 34, train_loss: 0.6364, test_loss: 0.8559, test_f1: 0.6064
 epoch: 35, train_loss: 0.6373, test_loss: 0.9087, test_f1: 0.6147
 epoch: 36, train_loss: 0.6333, test_loss: 0.8959, test_f1: 0.6200
 epoch: 37, train_loss: 0.6279, test_loss: 0.8911, test_f1: 0.6282
 epoch: 38, train_loss: 0.6213, test_loss: 0.9014, test_f1: 0.6536
 epoch: 39, train_loss: 0.6186, test_loss: 0.9154, test_f1: 0.6024
 epoch: 40, train_loss: 0.6142, test_loss: 0.8722, test_f1: 0.6599
 epoch: 41, train_loss: 0.6034, test_loss: 0.9262, test_f1: 0.6332
 epoch: 42, train_loss: 0.6029, test_loss: 0.8948, test_f1: 0.6387
 epoch: 43, train_loss: 0.5903, test_loss: 0.8996, test_f1: 0.6272
 epoch: 44, train_loss: 0.5936, test_loss: 0.9668, test_f1: 0.6016
 epoch: 45, train_loss: 0.5894, test_loss: 0.8931, test_f1: 0.6093
 epoch: 46, train_loss: 0.5708, test_loss: 0.9109, test_f1: 0.6034
 epoch: 47, train_loss: 0.5906, test_loss: 0.9742, test_f1: 0.6172
 epoch: 48, train_loss: 0.5702, test_loss: 0.8737, test_f1: 0.6457
 epoch: 49, train_loss: 0.5766, test_loss: 0.9522, test_f1: 0.6151
 epoch: 50, train_loss: 0.5750, test_loss: 0.9269, test_f1: 0.6351
 epoch: 51, train_loss: 0.5433, test_loss: 0.9422, test_f1: 0.6275
 epoch: 52, train_loss: 0.5406, test_loss: 0.9428, test_f1: 0.6333
 epoch: 53, train_loss: 0.5179, test_loss: 0.9408, test_f1: 0.6269
 epoch: 54, train_loss: 0.5088, test_loss: 0.9419, test_f1: 0.6331
 epoch: 55, train_loss: 0.5110, test_loss: 0.9242, test_f1: 0.6408
 epoch: 56, train_loss: 0.4955, test_loss: 1.0002, test_f1: 0.6364
 epoch: 57, train_loss: 0.5199, test_loss: 0.9885, test_f1: 0.6394
 epoch: 58, train_loss: 0.5057, test_loss: 1.0369, test_f1: 0.6483
 epoch: 59, train_loss: 0.5079, test_loss: 1.0158, test_f1: 0.6309
 epoch: 60, train_loss: 0.5015, test_loss: 0.9900, test_f1: 0.6334
 epoch: 61, train_loss: 0.4913, test_loss: 1.0163, test_f1: 0.6374
 epoch: 62, train_loss: 0.4914, test_loss: 0.9809, test_f1: 0.6391
 epoch: 63, train_loss: 0.4848, test_loss: 1.0169, test_f1: 0.6311
 epoch: 64, train_loss: 0.4792, test_loss: 1.0009, test_f1: 0.6372
 epoch: 65, train_loss: 0.4794, test_loss: 1.0527, test_f1: 0.6454
 epoch: 66, train_loss: 0.4775, test_loss: 1.0109, test_f1: 0.6425
 epoch: 67, train_loss: 0.4639, test_loss: 1.1037, test_f1: 0.6324
 epoch: 68, train_loss: 0.4831, test_loss: 1.1138, test_f1: 0.6288
 epoch: 69, train_loss: 0.4771, test_loss: 1.0232, test_f1: 0.6404
 epoch: 70, train_loss: 0.4666, test_loss: 1.1413, test_f1: 0.6308
 epoch: 71, train_loss: 0.5015, test_loss: 1.0669, test_f1: 0.6409
 epoch: 72, train_loss: 0.4615, test_loss: 1.1470, test_f1: 0.6422
 epoch: 73, train_loss: 0.4681, test_loss: 1.0541, test_f1: 0.6436
 epoch: 74, train_loss: 0.4682, test_loss: 1.1352, test_f1: 0.6410
 epoch: 75, train_loss: 0.4623, test_loss: 1.1565, test_f1: 0.6390
 epoch: 76, train_loss: 0.4483, test_loss: 1.1360, test_f1: 0.6244
 epoch: 77, train_loss: 0.4598, test_loss: 1.1079, test_f1: 0.6439
 epoch: 78, train_loss: 0.4598, test_loss: 1.1090, test_f1: 0.6498
 epoch: 79, train_loss: 0.4521, test_loss: 1.0679, test_f1: 0.6374
 epoch: 80, train_loss: 0.4560, test_loss: 1.1325, test_f1: 0.6491
 epoch: 81, train_loss: 0.4426, test_loss: 1.0942, test_f1: 0.6433
 epoch: 82, train_loss: 0.4480, test_loss: 1.1317, test_f1: 0.6575
 epoch: 83, train_loss: 0.4571, test_loss: 1.1389, test_f1: 0.6303
 epoch: 84, train_loss: 0.4488, test_loss: 1.1801, test_f1: 0.6535
 epoch: 85, train_loss: 0.4475, test_loss: 1.1938, test_f1: 0.6483
 epoch: 86, train_loss: 0.4391, test_loss: 1.1749, test_f1: 0.6395
 epoch: 87, train_loss: 0.4383, test_loss: 1.2139, test_f1: 0.6502
 epoch: 88, train_loss: 0.4263, test_loss: 1.2184, test_f1: 0.6428
 epoch: 89, train_loss: 0.4381, test_loss: 1.1610, test_f1: 0.6545
 epoch: 90, train_loss: 0.4380, test_loss: 1.1812, test_f1: 0.6465
 epoch: 91, train_loss: 0.4274, test_loss: 1.2816, test_f1: 0.6501
 epoch: 92, train_loss: 0.4320, test_loss: 1.1773, test_f1: 0.6499
 epoch: 93, train_loss: 0.4181, test_loss: 1.2519, test_f1: 0.6542
 epoch: 94, train_loss: 0.4113, test_loss: 1.2474, test_f1: 0.6582
 epoch: 95, train_loss: 0.4591, test_loss: 1.2611, test_f1: 0.6341
 epoch: 96, train_loss: 0.4159, test_loss: 1.2241, test_f1: 0.6467
 epoch: 97, train_loss: 0.4160, test_loss: 1.2036, test_f1: 0.6633
 epoch: 98, train_loss: 0.3955, test_loss: 1.3868, test_f1: 0.6549
 epoch: 99, train_loss: 0.4216, test_loss: 1.2486, test_f1: 0.6550
##################ITERATION #4 ****************************************
 epoch: 0, train_loss: 1.2241, test_loss: 1.1155, test_f1: 0.3805
 epoch: 1, train_loss: 1.0198, test_loss: 0.9787, test_f1: 0.4815
 epoch: 2, train_loss: 0.9807, test_loss: 0.9585, test_f1: 0.4983
 epoch: 3, train_loss: 0.9516, test_loss: 0.9406, test_f1: 0.5268
 epoch: 4, train_loss: 0.9504, test_loss: 0.9706, test_f1: 0.4606
 epoch: 5, train_loss: 0.9278, test_loss: 0.9169, test_f1: 0.5017
 epoch: 6, train_loss: 0.9123, test_loss: 0.9041, test_f1: 0.4945
 epoch: 7, train_loss: 0.9061, test_loss: 0.9194, test_f1: 0.4891
 epoch: 8, train_loss: 0.8881, test_loss: 0.8968, test_f1: 0.5181
 epoch: 9, train_loss: 0.8743, test_loss: 0.9090, test_f1: 0.5591
 epoch: 10, train_loss: 0.8599, test_loss: 0.8760, test_f1: 0.5402
 epoch: 11, train_loss: 0.8526, test_loss: 0.8849, test_f1: 0.5619
 epoch: 12, train_loss: 0.8401, test_loss: 0.8733, test_f1: 0.5480
 epoch: 13, train_loss: 0.8324, test_loss: 0.8624, test_f1: 0.5695
 epoch: 14, train_loss: 0.8228, test_loss: 0.8620, test_f1: 0.5576
 epoch: 15, train_loss: 0.8223, test_loss: 0.8517, test_f1: 0.5597
 epoch: 16, train_loss: 0.8078, test_loss: 0.8041, test_f1: 0.5935
 epoch: 17, train_loss: 0.8023, test_loss: 0.8108, test_f1: 0.5701
 epoch: 18, train_loss: 0.7917, test_loss: 0.8145, test_f1: 0.6077
 epoch: 19, train_loss: 0.7665, test_loss: 0.8422, test_f1: 0.5746
 epoch: 20, train_loss: 0.7911, test_loss: 0.7578, test_f1: 0.6057
 epoch: 21, train_loss: 0.7755, test_loss: 0.8317, test_f1: 0.5857
 epoch: 22, train_loss: 0.7512, test_loss: 0.7676, test_f1: 0.5870
 epoch: 23, train_loss: 0.7430, test_loss: 0.7733, test_f1: 0.5897
 epoch: 24, train_loss: 0.7426, test_loss: 0.7980, test_f1: 0.5855
 epoch: 25, train_loss: 0.7267, test_loss: 0.7782, test_f1: 0.5895
 epoch: 26, train_loss: 0.7185, test_loss: 0.7199, test_f1: 0.6467
 epoch: 27, train_loss: 0.7259, test_loss: 0.8113, test_f1: 0.5814
 epoch: 28, train_loss: 0.7214, test_loss: 0.7589, test_f1: 0.5928
 epoch: 29, train_loss: 0.7119, test_loss: 0.7503, test_f1: 0.6182
 epoch: 30, train_loss: 0.7037, test_loss: 0.7888, test_f1: 0.6013
 epoch: 31, train_loss: 0.6986, test_loss: 0.7812, test_f1: 0.5977
 epoch: 32, train_loss: 0.6935, test_loss: 0.8523, test_f1: 0.6019
 epoch: 33, train_loss: 0.6857, test_loss: 0.8239, test_f1: 0.6535
 epoch: 34, train_loss: 0.6786, test_loss: 0.7939, test_f1: 0.6016
 epoch: 35, train_loss: 0.6665, test_loss: 0.7681, test_f1: 0.6320
 epoch: 36, train_loss: 0.6876, test_loss: 0.8257, test_f1: 0.6308
 epoch: 37, train_loss: 0.6619, test_loss: 0.8302, test_f1: 0.6365
 epoch: 38, train_loss: 0.6575, test_loss: 0.7537, test_f1: 0.6431
 epoch: 39, train_loss: 0.6486, test_loss: 0.7548, test_f1: 0.6300
 epoch: 40, train_loss: 0.6394, test_loss: 0.7694, test_f1: 0.6294
 epoch: 41, train_loss: 0.6575, test_loss: 0.8714, test_f1: 0.6020
 epoch: 42, train_loss: 0.6389, test_loss: 0.8013, test_f1: 0.6572
 epoch: 43, train_loss: 0.6301, test_loss: 0.7406, test_f1: 0.6321
 epoch: 44, train_loss: 0.6154, test_loss: 0.7489, test_f1: 0.6449
 epoch: 45, train_loss: 0.6176, test_loss: 0.8405, test_f1: 0.6405
 epoch: 46, train_loss: 0.6200, test_loss: 0.8302, test_f1: 0.6346
 epoch: 47, train_loss: 0.6136, test_loss: 0.8060, test_f1: 0.6352
 epoch: 48, train_loss: 0.6002, test_loss: 0.8816, test_f1: 0.6450
 epoch: 49, train_loss: 0.5961, test_loss: 0.8275, test_f1: 0.6675
 epoch: 50, train_loss: 0.5834, test_loss: 1.0005, test_f1: 0.6034
 epoch: 51, train_loss: 0.5663, test_loss: 0.7545, test_f1: 0.6758
 epoch: 52, train_loss: 0.5702, test_loss: 0.7970, test_f1: 0.6394
 epoch: 53, train_loss: 0.5576, test_loss: 0.8720, test_f1: 0.6235
 epoch: 54, train_loss: 0.5501, test_loss: 0.8433, test_f1: 0.6249
 epoch: 55, train_loss: 0.5383, test_loss: 0.8812, test_f1: 0.6584
 epoch: 56, train_loss: 0.5390, test_loss: 0.8866, test_f1: 0.6534
 epoch: 57, train_loss: 0.5372, test_loss: 0.9206, test_f1: 0.6332
 epoch: 58, train_loss: 0.5335, test_loss: 0.8841, test_f1: 0.6260
 epoch: 59, train_loss: 0.5383, test_loss: 0.9318, test_f1: 0.6152
 epoch: 60, train_loss: 0.5241, test_loss: 0.9149, test_f1: 0.6417
 epoch: 61, train_loss: 0.5192, test_loss: 0.8539, test_f1: 0.6470
 epoch: 62, train_loss: 0.5216, test_loss: 0.9426, test_f1: 0.6394
 epoch: 63, train_loss: 0.5260, test_loss: 0.8738, test_f1: 0.6527
 epoch: 64, train_loss: 0.5213, test_loss: 0.8607, test_f1: 0.6500
 epoch: 65, train_loss: 0.5208, test_loss: 0.9262, test_f1: 0.6593
 epoch: 66, train_loss: 0.5008, test_loss: 0.9371, test_f1: 0.6259
 epoch: 67, train_loss: 0.5333, test_loss: 0.9152, test_f1: 0.6648
 epoch: 68, train_loss: 0.5133, test_loss: 0.9594, test_f1: 0.6415
 epoch: 69, train_loss: 0.5033, test_loss: 0.8835, test_f1: 0.6489
 epoch: 70, train_loss: 0.5030, test_loss: 0.9315, test_f1: 0.6436
 epoch: 71, train_loss: 0.5038, test_loss: 0.9751, test_f1: 0.6263
 epoch: 72, train_loss: 0.4981, test_loss: 1.0159, test_f1: 0.6437
 epoch: 73, train_loss: 0.5041, test_loss: 0.9524, test_f1: 0.6366
 epoch: 74, train_loss: 0.5039, test_loss: 0.9228, test_f1: 0.6428
 epoch: 75, train_loss: 0.4896, test_loss: 1.0105, test_f1: 0.6574
 epoch: 76, train_loss: 0.4966, test_loss: 1.0150, test_f1: 0.6566
 epoch: 77, train_loss: 0.4874, test_loss: 0.9032, test_f1: 0.6372
 epoch: 78, train_loss: 0.4829, test_loss: 0.9559, test_f1: 0.6436
 epoch: 79, train_loss: 0.4983, test_loss: 1.0511, test_f1: 0.6567
 epoch: 80, train_loss: 0.4841, test_loss: 1.0348, test_f1: 0.6389
 epoch: 81, train_loss: 0.4886, test_loss: 0.9986, test_f1: 0.6444
 epoch: 82, train_loss: 0.4707, test_loss: 1.0181, test_f1: 0.6413
 epoch: 83, train_loss: 0.4713, test_loss: 1.0507, test_f1: 0.6422
 epoch: 84, train_loss: 0.4651, test_loss: 1.0632, test_f1: 0.6440
 epoch: 85, train_loss: 0.4735, test_loss: 1.0897, test_f1: 0.6479
 epoch: 86, train_loss: 0.4684, test_loss: 1.1068, test_f1: 0.6547
 epoch: 87, train_loss: 0.4739, test_loss: 1.0720, test_f1: 0.6405
 epoch: 88, train_loss: 0.4736, test_loss: 1.0802, test_f1: 0.6490
 epoch: 89, train_loss: 0.4577, test_loss: 1.1404, test_f1: 0.6207
 epoch: 90, train_loss: 0.4755, test_loss: 1.0254, test_f1: 0.6559
 epoch: 91, train_loss: 0.4527, test_loss: 1.0564, test_f1: 0.6554
 epoch: 92, train_loss: 0.4517, test_loss: 1.0844, test_f1: 0.6394
 epoch: 93, train_loss: 0.4632, test_loss: 1.1454, test_f1: 0.6609
 epoch: 94, train_loss: 0.4497, test_loss: 1.1165, test_f1: 0.6583
 epoch: 95, train_loss: 0.4546, test_loss: 1.0826, test_f1: 0.6615
 epoch: 96, train_loss: 0.4412, test_loss: 1.0729, test_f1: 0.6416
 epoch: 97, train_loss: 0.4432, test_loss: 1.2049, test_f1: 0.6264
 epoch: 98, train_loss: 0.4506, test_loss: 1.0750, test_f1: 0.6448
 epoch: 99, train_loss: 0.4294, test_loss: 1.2763, test_f1: 0.6321
##################ITERATION #5 ****************************************
 epoch: 0, train_loss: 1.3924, test_loss: 1.1120, test_f1: 0.3961
 epoch: 1, train_loss: 1.0804, test_loss: 0.9936, test_f1: 0.4482
 epoch: 2, train_loss: 1.0174, test_loss: 0.9213, test_f1: 0.5220
 epoch: 3, train_loss: 0.9754, test_loss: 0.9089, test_f1: 0.5241
 epoch: 4, train_loss: 0.9539, test_loss: 0.8933, test_f1: 0.5257
 epoch: 5, train_loss: 0.9470, test_loss: 0.8886, test_f1: 0.5252
 epoch: 6, train_loss: 0.9250, test_loss: 0.9052, test_f1: 0.4970
 epoch: 7, train_loss: 0.9114, test_loss: 0.8525, test_f1: 0.5424
 epoch: 8, train_loss: 0.8878, test_loss: 0.8964, test_f1: 0.5661
 epoch: 9, train_loss: 0.8814, test_loss: 0.8490, test_f1: 0.5180
 epoch: 10, train_loss: 0.8582, test_loss: 0.8434, test_f1: 0.5586
 epoch: 11, train_loss: 0.8573, test_loss: 0.8113, test_f1: 0.5966
 epoch: 12, train_loss: 0.8338, test_loss: 0.8397, test_f1: 0.5894
 epoch: 13, train_loss: 0.8359, test_loss: 0.8089, test_f1: 0.5929
 epoch: 14, train_loss: 0.8046, test_loss: 0.8106, test_f1: 0.5667
 epoch: 15, train_loss: 0.8039, test_loss: 0.7841, test_f1: 0.6078
 epoch: 16, train_loss: 0.7967, test_loss: 0.7511, test_f1: 0.6131
 epoch: 17, train_loss: 0.7939, test_loss: 0.7997, test_f1: 0.6430
 epoch: 18, train_loss: 0.7785, test_loss: 0.7580, test_f1: 0.6361
 epoch: 19, train_loss: 0.7862, test_loss: 0.7966, test_f1: 0.6048
 epoch: 20, train_loss: 0.7593, test_loss: 0.7676, test_f1: 0.6258
 epoch: 21, train_loss: 0.7580, test_loss: 0.7553, test_f1: 0.6089
 epoch: 22, train_loss: 0.7480, test_loss: 0.7943, test_f1: 0.5949
 epoch: 23, train_loss: 0.7424, test_loss: 0.8102, test_f1: 0.6247
 epoch: 24, train_loss: 0.7368, test_loss: 0.8315, test_f1: 0.6131
 epoch: 25, train_loss: 0.7243, test_loss: 0.8159, test_f1: 0.5986
 epoch: 26, train_loss: 0.7163, test_loss: 0.7778, test_f1: 0.6175
 epoch: 27, train_loss: 0.7069, test_loss: 0.8121, test_f1: 0.6146
 epoch: 28, train_loss: 0.6980, test_loss: 0.7927, test_f1: 0.6268
 epoch: 29, train_loss: 0.6965, test_loss: 0.7827, test_f1: 0.6345
 epoch: 30, train_loss: 0.6900, test_loss: 0.7820, test_f1: 0.6505
 epoch: 31, train_loss: 0.6775, test_loss: 0.8051, test_f1: 0.6353
 epoch: 32, train_loss: 0.6809, test_loss: 0.8064, test_f1: 0.6397
 epoch: 33, train_loss: 0.6779, test_loss: 0.7521, test_f1: 0.6564
 epoch: 34, train_loss: 0.6584, test_loss: 0.7980, test_f1: 0.6385
 epoch: 35, train_loss: 0.6620, test_loss: 0.7755, test_f1: 0.6065
 epoch: 36, train_loss: 0.6464, test_loss: 0.7601, test_f1: 0.6341
 epoch: 37, train_loss: 0.6631, test_loss: 0.8413, test_f1: 0.6604
 epoch: 38, train_loss: 0.6675, test_loss: 0.7918, test_f1: 0.6314
 epoch: 39, train_loss: 0.6302, test_loss: 0.8404, test_f1: 0.6366
 epoch: 40, train_loss: 0.6358, test_loss: 0.7837, test_f1: 0.6515
 epoch: 41, train_loss: 0.6370, test_loss: 0.8365, test_f1: 0.6288
 epoch: 42, train_loss: 0.6270, test_loss: 0.8245, test_f1: 0.6276
 epoch: 43, train_loss: 0.6184, test_loss: 0.7391, test_f1: 0.6535
 epoch: 44, train_loss: 0.6223, test_loss: 0.8278, test_f1: 0.6843
 epoch: 45, train_loss: 0.6080, test_loss: 0.8047, test_f1: 0.6173
 epoch: 46, train_loss: 0.6132, test_loss: 0.7771, test_f1: 0.6638
 epoch: 47, train_loss: 0.6132, test_loss: 0.8418, test_f1: 0.6416
 epoch: 48, train_loss: 0.6020, test_loss: 0.8380, test_f1: 0.6793
 epoch: 49, train_loss: 0.6135, test_loss: 0.7662, test_f1: 0.6443
 epoch: 50, train_loss: 0.5983, test_loss: 0.8641, test_f1: 0.6552
 epoch: 51, train_loss: 0.5696, test_loss: 0.8381, test_f1: 0.6767
 epoch: 52, train_loss: 0.5558, test_loss: 0.8126, test_f1: 0.6612
 epoch: 53, train_loss: 0.5449, test_loss: 0.8660, test_f1: 0.6824
 epoch: 54, train_loss: 0.5461, test_loss: 0.8452, test_f1: 0.6823
 epoch: 55, train_loss: 0.5572, test_loss: 0.8382, test_f1: 0.6753
 epoch: 56, train_loss: 0.5390, test_loss: 0.8239, test_f1: 0.6684
 epoch: 57, train_loss: 0.5463, test_loss: 0.8132, test_f1: 0.6581
 epoch: 58, train_loss: 0.5344, test_loss: 0.8521, test_f1: 0.6542
 epoch: 59, train_loss: 0.5389, test_loss: 0.9061, test_f1: 0.6481
 epoch: 60, train_loss: 0.5428, test_loss: 0.8009, test_f1: 0.6884
 epoch: 61, train_loss: 0.5342, test_loss: 0.9251, test_f1: 0.6579
 epoch: 62, train_loss: 0.5307, test_loss: 0.8770, test_f1: 0.6786
 epoch: 63, train_loss: 0.5318, test_loss: 0.8955, test_f1: 0.6863
 epoch: 64, train_loss: 0.5185, test_loss: 0.9073, test_f1: 0.6783
 epoch: 65, train_loss: 0.5215, test_loss: 0.8743, test_f1: 0.6795
 epoch: 66, train_loss: 0.5210, test_loss: 0.8730, test_f1: 0.6812
 epoch: 67, train_loss: 0.5201, test_loss: 0.8789, test_f1: 0.6863
 epoch: 68, train_loss: 0.5203, test_loss: 0.9043, test_f1: 0.6903
 epoch: 69, train_loss: 0.5064, test_loss: 0.9316, test_f1: 0.6757
 epoch: 70, train_loss: 0.5034, test_loss: 0.9173, test_f1: 0.6464
 epoch: 71, train_loss: 0.5099, test_loss: 0.9142, test_f1: 0.6516
 epoch: 72, train_loss: 0.4989, test_loss: 0.9546, test_f1: 0.6531
 epoch: 73, train_loss: 0.5076, test_loss: 0.9282, test_f1: 0.6505
 epoch: 74, train_loss: 0.5118, test_loss: 0.8849, test_f1: 0.6623
 epoch: 75, train_loss: 0.5037, test_loss: 0.9650, test_f1: 0.6778
 epoch: 76, train_loss: 0.4960, test_loss: 0.9511, test_f1: 0.6619
 epoch: 77, train_loss: 0.4981, test_loss: 0.9285, test_f1: 0.6673
 epoch: 78, train_loss: 0.4887, test_loss: 1.0536, test_f1: 0.6488
 epoch: 79, train_loss: 0.5091, test_loss: 0.9286, test_f1: 0.6708
 epoch: 80, train_loss: 0.4886, test_loss: 0.9438, test_f1: 0.6549
 epoch: 81, train_loss: 0.4716, test_loss: 0.9568, test_f1: 0.6903
 epoch: 82, train_loss: 0.4849, test_loss: 0.9209, test_f1: 0.6746
 epoch: 83, train_loss: 0.4816, test_loss: 0.9682, test_f1: 0.6878
 epoch: 84, train_loss: 0.5045, test_loss: 0.9520, test_f1: 0.6693
 epoch: 85, train_loss: 0.4732, test_loss: 1.0093, test_f1: 0.6705
 epoch: 86, train_loss: 0.4738, test_loss: 0.9498, test_f1: 0.6696
 epoch: 87, train_loss: 0.4893, test_loss: 1.0431, test_f1: 0.6822
 epoch: 88, train_loss: 0.4861, test_loss: 0.9862, test_f1: 0.6613
 epoch: 89, train_loss: 0.4852, test_loss: 1.0256, test_f1: 0.6528
 epoch: 90, train_loss: 0.4767, test_loss: 1.0416, test_f1: 0.6632
 epoch: 91, train_loss: 0.4838, test_loss: 1.0255, test_f1: 0.6446
 epoch: 92, train_loss: 0.4754, test_loss: 1.0572, test_f1: 0.6556
 epoch: 93, train_loss: 0.4699, test_loss: 1.0135, test_f1: 0.6668
 epoch: 94, train_loss: 0.4666, test_loss: 1.0134, test_f1: 0.6588
 epoch: 95, train_loss: 0.4671, test_loss: 1.0420, test_f1: 0.6675
 epoch: 96, train_loss: 0.4707, test_loss: 0.9981, test_f1: 0.6777
 epoch: 97, train_loss: 0.4514, test_loss: 0.9983, test_f1: 0.6789
 epoch: 98, train_loss: 0.4787, test_loss: 0.9831, test_f1: 0.6734
 epoch: 99, train_loss: 0.4524, test_loss: 0.9792, test_f1: 0.6853
##################ITERATION #6 ****************************************
 epoch: 0, train_loss: 1.3529, test_loss: 1.1436, test_f1: 0.4268
 epoch: 1, train_loss: 1.0820, test_loss: 1.0087, test_f1: 0.5041
 epoch: 2, train_loss: 1.0072, test_loss: 0.9852, test_f1: 0.4928
 epoch: 3, train_loss: 0.9879, test_loss: 0.9891, test_f1: 0.5143
 epoch: 4, train_loss: 0.9662, test_loss: 0.9731, test_f1: 0.5221
 epoch: 5, train_loss: 0.9577, test_loss: 0.9688, test_f1: 0.5213
 epoch: 6, train_loss: 0.9390, test_loss: 0.9481, test_f1: 0.5434
 epoch: 7, train_loss: 0.9211, test_loss: 0.9242, test_f1: 0.5749
 epoch: 8, train_loss: 0.9017, test_loss: 0.9066, test_f1: 0.5889
 epoch: 9, train_loss: 0.8891, test_loss: 0.9066, test_f1: 0.5454
 epoch: 10, train_loss: 0.8766, test_loss: 0.8701, test_f1: 0.5813
 epoch: 11, train_loss: 0.8607, test_loss: 0.8884, test_f1: 0.5899
 epoch: 12, train_loss: 0.8581, test_loss: 0.8368, test_f1: 0.6273
 epoch: 13, train_loss: 0.8466, test_loss: 0.8303, test_f1: 0.5738
 epoch: 14, train_loss: 0.8507, test_loss: 0.8553, test_f1: 0.5841
 epoch: 15, train_loss: 0.8242, test_loss: 0.8181, test_f1: 0.6284
 epoch: 16, train_loss: 0.8234, test_loss: 0.8365, test_f1: 0.6111
 epoch: 17, train_loss: 0.8141, test_loss: 0.8188, test_f1: 0.6156
 epoch: 18, train_loss: 0.8044, test_loss: 0.8233, test_f1: 0.6152
 epoch: 19, train_loss: 0.7977, test_loss: 0.8837, test_f1: 0.5813
 epoch: 20, train_loss: 0.7869, test_loss: 0.7938, test_f1: 0.6371
 epoch: 21, train_loss: 0.7810, test_loss: 0.8250, test_f1: 0.6079
 epoch: 22, train_loss: 0.7768, test_loss: 0.8226, test_f1: 0.6140
 epoch: 23, train_loss: 0.7647, test_loss: 0.8468, test_f1: 0.6248
 epoch: 24, train_loss: 0.7540, test_loss: 0.8431, test_f1: 0.5990
 epoch: 25, train_loss: 0.7620, test_loss: 0.8212, test_f1: 0.6609
 epoch: 26, train_loss: 0.7395, test_loss: 0.7931, test_f1: 0.6306
 epoch: 27, train_loss: 0.7277, test_loss: 0.8184, test_f1: 0.6191
 epoch: 28, train_loss: 0.7396, test_loss: 0.7943, test_f1: 0.6178
 epoch: 29, train_loss: 0.7354, test_loss: 0.8356, test_f1: 0.6311
 epoch: 30, train_loss: 0.7198, test_loss: 0.8060, test_f1: 0.6303
 epoch: 31, train_loss: 0.7191, test_loss: 0.8610, test_f1: 0.6074
 epoch: 32, train_loss: 0.7153, test_loss: 0.8159, test_f1: 0.6223
 epoch: 33, train_loss: 0.7125, test_loss: 0.8557, test_f1: 0.6356
 epoch: 34, train_loss: 0.6857, test_loss: 0.8241, test_f1: 0.6250
 epoch: 35, train_loss: 0.6941, test_loss: 0.7781, test_f1: 0.6280
 epoch: 36, train_loss: 0.7027, test_loss: 0.8557, test_f1: 0.6116
 epoch: 37, train_loss: 0.7011, test_loss: 0.8366, test_f1: 0.5817
 epoch: 38, train_loss: 0.6931, test_loss: 0.8243, test_f1: 0.6056
 epoch: 39, train_loss: 0.6689, test_loss: 0.7943, test_f1: 0.6184
 epoch: 40, train_loss: 0.6665, test_loss: 0.8194, test_f1: 0.6255
 epoch: 41, train_loss: 0.6741, test_loss: 0.7852, test_f1: 0.6334
 epoch: 42, train_loss: 0.6484, test_loss: 0.8222, test_f1: 0.6111
 epoch: 43, train_loss: 0.6626, test_loss: 0.8897, test_f1: 0.6174
 epoch: 44, train_loss: 0.6441, test_loss: 0.7841, test_f1: 0.6604
 epoch: 45, train_loss: 0.6532, test_loss: 0.8908, test_f1: 0.6139
 epoch: 46, train_loss: 0.6634, test_loss: 0.8251, test_f1: 0.6337
 epoch: 47, train_loss: 0.6430, test_loss: 0.8426, test_f1: 0.6323
 epoch: 48, train_loss: 0.6471, test_loss: 0.8905, test_f1: 0.6209
 epoch: 49, train_loss: 0.6265, test_loss: 0.8593, test_f1: 0.6489
 epoch: 50, train_loss: 0.6445, test_loss: 0.7936, test_f1: 0.6520
 epoch: 51, train_loss: 0.6046, test_loss: 0.8307, test_f1: 0.6376
 epoch: 52, train_loss: 0.5846, test_loss: 0.8246, test_f1: 0.6451
 epoch: 53, train_loss: 0.5879, test_loss: 0.8258, test_f1: 0.6433
 epoch: 54, train_loss: 0.5905, test_loss: 0.8601, test_f1: 0.6301
 epoch: 55, train_loss: 0.5894, test_loss: 0.8847, test_f1: 0.6356
 epoch: 56, train_loss: 0.5747, test_loss: 0.8527, test_f1: 0.6464
 epoch: 57, train_loss: 0.5660, test_loss: 0.9037, test_f1: 0.6417
 epoch: 58, train_loss: 0.5778, test_loss: 0.9191, test_f1: 0.6257
 epoch: 59, train_loss: 0.5664, test_loss: 0.8634, test_f1: 0.6410
 epoch: 60, train_loss: 0.5633, test_loss: 0.8571, test_f1: 0.6442
 epoch: 61, train_loss: 0.5668, test_loss: 0.9432, test_f1: 0.6278
 epoch: 62, train_loss: 0.5732, test_loss: 0.9614, test_f1: 0.6285
 epoch: 63, train_loss: 0.5680, test_loss: 0.9530, test_f1: 0.6215
 epoch: 64, train_loss: 0.5600, test_loss: 0.8871, test_f1: 0.6306
 epoch: 65, train_loss: 0.5697, test_loss: 0.9511, test_f1: 0.6466
 epoch: 66, train_loss: 0.5537, test_loss: 0.8955, test_f1: 0.6429
 epoch: 67, train_loss: 0.5584, test_loss: 0.9940, test_f1: 0.6368
 epoch: 68, train_loss: 0.5397, test_loss: 0.9646, test_f1: 0.6478
 epoch: 69, train_loss: 0.5414, test_loss: 0.9560, test_f1: 0.6499
 epoch: 70, train_loss: 0.5445, test_loss: 0.9125, test_f1: 0.6550
 epoch: 71, train_loss: 0.5427, test_loss: 0.9364, test_f1: 0.6610
 epoch: 72, train_loss: 0.5371, test_loss: 0.9618, test_f1: 0.6569
 epoch: 73, train_loss: 0.5498, test_loss: 0.9846, test_f1: 0.6351
 epoch: 74, train_loss: 0.5439, test_loss: 0.9739, test_f1: 0.6552
 epoch: 75, train_loss: 0.5312, test_loss: 0.9619, test_f1: 0.6394
 epoch: 76, train_loss: 0.5125, test_loss: 0.9599, test_f1: 0.6458
 epoch: 77, train_loss: 0.5399, test_loss: 1.0846, test_f1: 0.6261
 epoch: 78, train_loss: 0.5180, test_loss: 1.0823, test_f1: 0.6099
 epoch: 79, train_loss: 0.5214, test_loss: 0.9463, test_f1: 0.6732
 epoch: 80, train_loss: 0.5137, test_loss: 1.0034, test_f1: 0.6311
 epoch: 81, train_loss: 0.5176, test_loss: 0.9505, test_f1: 0.6477
 epoch: 82, train_loss: 0.5157, test_loss: 1.0374, test_f1: 0.6438
 epoch: 83, train_loss: 0.5247, test_loss: 1.0313, test_f1: 0.6443
 epoch: 84, train_loss: 0.5271, test_loss: 0.9801, test_f1: 0.6684
 epoch: 85, train_loss: 0.5136, test_loss: 1.0514, test_f1: 0.6355
 epoch: 86, train_loss: 0.5089, test_loss: 1.0522, test_f1: 0.6325
 epoch: 87, train_loss: 0.5016, test_loss: 0.9928, test_f1: 0.6529
 epoch: 88, train_loss: 0.4919, test_loss: 1.0656, test_f1: 0.6473
 epoch: 89, train_loss: 0.5135, test_loss: 1.0283, test_f1: 0.6613
 epoch: 90, train_loss: 0.5084, test_loss: 1.0212, test_f1: 0.6247
 epoch: 91, train_loss: 0.4992, test_loss: 1.0023, test_f1: 0.6375
 epoch: 92, train_loss: 0.5137, test_loss: 1.0841, test_f1: 0.6410
 epoch: 93, train_loss: 0.5093, test_loss: 1.0193, test_f1: 0.6417
 epoch: 94, train_loss: 0.4946, test_loss: 1.0804, test_f1: 0.6570
 epoch: 95, train_loss: 0.4811, test_loss: 1.0259, test_f1: 0.6566
 epoch: 96, train_loss: 0.4940, test_loss: 1.0257, test_f1: 0.6491
 epoch: 97, train_loss: 0.4988, test_loss: 1.0677, test_f1: 0.6303
 epoch: 98, train_loss: 0.4755, test_loss: 1.0977, test_f1: 0.6467
 epoch: 99, train_loss: 0.4785, test_loss: 1.1485, test_f1: 0.6438
##################ITERATION #7 ****************************************
 epoch: 0, train_loss: 1.2154, test_loss: 1.2121, test_f1: 0.3748
 epoch: 1, train_loss: 1.0169, test_loss: 0.9718, test_f1: 0.4786
 epoch: 2, train_loss: 0.9653, test_loss: 0.9512, test_f1: 0.4984
 epoch: 3, train_loss: 0.9554, test_loss: 0.8803, test_f1: 0.5226
 epoch: 4, train_loss: 0.9305, test_loss: 0.9115, test_f1: 0.5143
 epoch: 5, train_loss: 0.9172, test_loss: 0.9194, test_f1: 0.5371
 epoch: 6, train_loss: 0.8956, test_loss: 0.8780, test_f1: 0.5265
 epoch: 7, train_loss: 0.8733, test_loss: 0.8847, test_f1: 0.5726
 epoch: 8, train_loss: 0.8741, test_loss: 0.9374, test_f1: 0.5511
 epoch: 9, train_loss: 0.8667, test_loss: 0.9140, test_f1: 0.5652
 epoch: 10, train_loss: 0.8286, test_loss: 0.8623, test_f1: 0.6047
 epoch: 11, train_loss: 0.8400, test_loss: 0.8608, test_f1: 0.5871
 epoch: 12, train_loss: 0.8252, test_loss: 0.8803, test_f1: 0.5787
 epoch: 13, train_loss: 0.8024, test_loss: 0.8940, test_f1: 0.5939
 epoch: 14, train_loss: 0.7985, test_loss: 0.8887, test_f1: 0.5742
 epoch: 15, train_loss: 0.7976, test_loss: 0.8821, test_f1: 0.5667
 epoch: 16, train_loss: 0.7868, test_loss: 0.8504, test_f1: 0.5837
 epoch: 17, train_loss: 0.7647, test_loss: 0.8892, test_f1: 0.5672
 epoch: 18, train_loss: 0.7741, test_loss: 0.8543, test_f1: 0.5717
 epoch: 19, train_loss: 0.7475, test_loss: 0.8405, test_f1: 0.6006
 epoch: 20, train_loss: 0.7532, test_loss: 0.8789, test_f1: 0.5761
 epoch: 21, train_loss: 0.7469, test_loss: 0.8582, test_f1: 0.5985
 epoch: 22, train_loss: 0.7391, test_loss: 0.8137, test_f1: 0.6233
 epoch: 23, train_loss: 0.7243, test_loss: 0.8189, test_f1: 0.6054
 epoch: 24, train_loss: 0.7194, test_loss: 0.8342, test_f1: 0.6207
 epoch: 25, train_loss: 0.7060, test_loss: 0.8509, test_f1: 0.6192
 epoch: 26, train_loss: 0.7062, test_loss: 0.8502, test_f1: 0.5994
 epoch: 27, train_loss: 0.7000, test_loss: 0.8342, test_f1: 0.5879
 epoch: 28, train_loss: 0.7040, test_loss: 0.8600, test_f1: 0.6007
 epoch: 29, train_loss: 0.6963, test_loss: 0.8685, test_f1: 0.5990
 epoch: 30, train_loss: 0.6911, test_loss: 0.8315, test_f1: 0.6245
 epoch: 31, train_loss: 0.6909, test_loss: 0.9041, test_f1: 0.5906
 epoch: 32, train_loss: 0.6620, test_loss: 0.8798, test_f1: 0.6091
 epoch: 33, train_loss: 0.6674, test_loss: 0.8581, test_f1: 0.6152
 epoch: 34, train_loss: 0.6544, test_loss: 0.8699, test_f1: 0.6215
 epoch: 35, train_loss: 0.6665, test_loss: 0.8073, test_f1: 0.6178
 epoch: 36, train_loss: 0.6570, test_loss: 0.8199, test_f1: 0.6047
 epoch: 37, train_loss: 0.6331, test_loss: 0.8369, test_f1: 0.6170
 epoch: 38, train_loss: 0.6484, test_loss: 0.8385, test_f1: 0.6304
 epoch: 39, train_loss: 0.6371, test_loss: 0.8407, test_f1: 0.6242
 epoch: 40, train_loss: 0.6639, test_loss: 0.9312, test_f1: 0.6214
 epoch: 41, train_loss: 0.6444, test_loss: 0.7837, test_f1: 0.6308
 epoch: 42, train_loss: 0.6340, test_loss: 0.8476, test_f1: 0.6217
 epoch: 43, train_loss: 0.6352, test_loss: 0.8413, test_f1: 0.6413
 epoch: 44, train_loss: 0.6262, test_loss: 0.8630, test_f1: 0.6297
 epoch: 45, train_loss: 0.6120, test_loss: 0.8623, test_f1: 0.6575
 epoch: 46, train_loss: 0.6202, test_loss: 0.8795, test_f1: 0.6258
 epoch: 47, train_loss: 0.6142, test_loss: 0.8872, test_f1: 0.6256
 epoch: 48, train_loss: 0.6108, test_loss: 0.9077, test_f1: 0.6317
 epoch: 49, train_loss: 0.6376, test_loss: 0.9250, test_f1: 0.6026
 epoch: 50, train_loss: 0.5928, test_loss: 0.9169, test_f1: 0.6227
 epoch: 51, train_loss: 0.5570, test_loss: 0.8714, test_f1: 0.6295
 epoch: 52, train_loss: 0.5536, test_loss: 0.8637, test_f1: 0.6480
 epoch: 53, train_loss: 0.5594, test_loss: 0.8630, test_f1: 0.6636
 epoch: 54, train_loss: 0.5559, test_loss: 0.8775, test_f1: 0.6415
 epoch: 55, train_loss: 0.5563, test_loss: 0.8764, test_f1: 0.6384
 epoch: 56, train_loss: 0.5502, test_loss: 0.8924, test_f1: 0.6644
 epoch: 57, train_loss: 0.5510, test_loss: 0.9060, test_f1: 0.6256
 epoch: 58, train_loss: 0.5251, test_loss: 0.8883, test_f1: 0.6471
 epoch: 59, train_loss: 0.5283, test_loss: 0.8871, test_f1: 0.6451
 epoch: 60, train_loss: 0.5355, test_loss: 0.9294, test_f1: 0.6432
 epoch: 61, train_loss: 0.5300, test_loss: 0.9011, test_f1: 0.6720
 epoch: 62, train_loss: 0.5333, test_loss: 0.9139, test_f1: 0.6458
 epoch: 63, train_loss: 0.5345, test_loss: 0.9033, test_f1: 0.6650
 epoch: 64, train_loss: 0.5271, test_loss: 0.9399, test_f1: 0.6665
 epoch: 65, train_loss: 0.5136, test_loss: 0.9110, test_f1: 0.6529
 epoch: 66, train_loss: 0.5056, test_loss: 0.8921, test_f1: 0.6498
 epoch: 67, train_loss: 0.5023, test_loss: 0.9388, test_f1: 0.6531
 epoch: 68, train_loss: 0.5194, test_loss: 1.0276, test_f1: 0.6357
 epoch: 69, train_loss: 0.5132, test_loss: 0.9470, test_f1: 0.6400
 epoch: 70, train_loss: 0.5076, test_loss: 0.9016, test_f1: 0.6493
 epoch: 71, train_loss: 0.5137, test_loss: 0.9878, test_f1: 0.6259
 epoch: 72, train_loss: 0.5056, test_loss: 0.9699, test_f1: 0.6529
 epoch: 73, train_loss: 0.5000, test_loss: 0.9554, test_f1: 0.6586
 epoch: 74, train_loss: 0.4884, test_loss: 0.9497, test_f1: 0.6649
 epoch: 75, train_loss: 0.4918, test_loss: 0.9628, test_f1: 0.6596
 epoch: 76, train_loss: 0.4985, test_loss: 1.0361, test_f1: 0.6395
 epoch: 77, train_loss: 0.4979, test_loss: 0.9734, test_f1: 0.6482
 epoch: 78, train_loss: 0.4818, test_loss: 1.0145, test_f1: 0.6415
 epoch: 79, train_loss: 0.4952, test_loss: 0.9600, test_f1: 0.6498
 epoch: 80, train_loss: 0.4992, test_loss: 0.9659, test_f1: 0.6678
 epoch: 81, train_loss: 0.4877, test_loss: 1.0018, test_f1: 0.6392
 epoch: 82, train_loss: 0.4750, test_loss: 0.9942, test_f1: 0.6390
 epoch: 83, train_loss: 0.4834, test_loss: 1.0064, test_f1: 0.6743
 epoch: 84, train_loss: 0.4846, test_loss: 0.9933, test_f1: 0.6389
 epoch: 85, train_loss: 0.4676, test_loss: 1.0743, test_f1: 0.6598
 epoch: 86, train_loss: 0.4676, test_loss: 1.0668, test_f1: 0.6564
 epoch: 87, train_loss: 0.4748, test_loss: 1.0505, test_f1: 0.6506
 epoch: 88, train_loss: 0.4643, test_loss: 1.0833, test_f1: 0.6532
 epoch: 89, train_loss: 0.4546, test_loss: 1.0765, test_f1: 0.6470
 epoch: 90, train_loss: 0.4526, test_loss: 1.1124, test_f1: 0.6568
 epoch: 91, train_loss: 0.4648, test_loss: 1.0704, test_f1: 0.6565
 epoch: 92, train_loss: 0.4533, test_loss: 1.0941, test_f1: 0.6557
 epoch: 93, train_loss: 0.4610, test_loss: 1.1124, test_f1: 0.6545
 epoch: 94, train_loss: 0.4589, test_loss: 1.1524, test_f1: 0.6311
 epoch: 95, train_loss: 0.4565, test_loss: 1.0583, test_f1: 0.6585
 epoch: 96, train_loss: 0.4722, test_loss: 1.0714, test_f1: 0.6543
 epoch: 97, train_loss: 0.4571, test_loss: 1.1090, test_f1: 0.6569
 epoch: 98, train_loss: 0.4546, test_loss: 1.1752, test_f1: 0.6427
 epoch: 99, train_loss: 0.4610, test_loss: 1.1382, test_f1: 0.6371
##################ITERATION #8 ****************************************
 epoch: 0, train_loss: 1.3824, test_loss: 1.1930, test_f1: 0.3756
 epoch: 1, train_loss: 1.0513, test_loss: 0.9998, test_f1: 0.4820
 epoch: 2, train_loss: 1.0200, test_loss: 0.9777, test_f1: 0.5055
 epoch: 3, train_loss: 0.9886, test_loss: 1.0186, test_f1: 0.5007
 epoch: 4, train_loss: 0.9645, test_loss: 0.9881, test_f1: 0.5282
 epoch: 5, train_loss: 0.9466, test_loss: 0.9480, test_f1: 0.5405
 epoch: 6, train_loss: 0.9339, test_loss: 0.9538, test_f1: 0.5462
 epoch: 7, train_loss: 0.9285, test_loss: 0.9268, test_f1: 0.5134
 epoch: 8, train_loss: 0.9092, test_loss: 0.9256, test_f1: 0.5308
 epoch: 9, train_loss: 0.8944, test_loss: 0.9209, test_f1: 0.5560
 epoch: 10, train_loss: 0.8815, test_loss: 0.9163, test_f1: 0.5741
 epoch: 11, train_loss: 0.8743, test_loss: 0.8773, test_f1: 0.5906
 epoch: 12, train_loss: 0.8595, test_loss: 0.8807, test_f1: 0.5428
 epoch: 13, train_loss: 0.8466, test_loss: 0.8763, test_f1: 0.5884
 epoch: 14, train_loss: 0.8360, test_loss: 0.8959, test_f1: 0.6014
 epoch: 15, train_loss: 0.8340, test_loss: 0.8326, test_f1: 0.6044
 epoch: 16, train_loss: 0.8348, test_loss: 0.8476, test_f1: 0.5888
 epoch: 17, train_loss: 0.8203, test_loss: 0.8621, test_f1: 0.5967
 epoch: 18, train_loss: 0.8038, test_loss: 0.8391, test_f1: 0.6017
 epoch: 19, train_loss: 0.8082, test_loss: 0.8518, test_f1: 0.6020
 epoch: 20, train_loss: 0.7840, test_loss: 0.8137, test_f1: 0.6160
 epoch: 21, train_loss: 0.7755, test_loss: 0.8392, test_f1: 0.6124
 epoch: 22, train_loss: 0.7810, test_loss: 0.8702, test_f1: 0.5874
 epoch: 23, train_loss: 0.7805, test_loss: 0.8348, test_f1: 0.5826
 epoch: 24, train_loss: 0.7709, test_loss: 0.8594, test_f1: 0.6167
 epoch: 25, train_loss: 0.7627, test_loss: 0.7962, test_f1: 0.6262
 epoch: 26, train_loss: 0.7499, test_loss: 0.7793, test_f1: 0.6087
 epoch: 27, train_loss: 0.7428, test_loss: 0.7615, test_f1: 0.5998
 epoch: 28, train_loss: 0.7508, test_loss: 0.7701, test_f1: 0.6116
 epoch: 29, train_loss: 0.7391, test_loss: 0.8143, test_f1: 0.6510
 epoch: 30, train_loss: 0.7243, test_loss: 0.8146, test_f1: 0.6390
 epoch: 31, train_loss: 0.7196, test_loss: 0.7613, test_f1: 0.5980
 epoch: 32, train_loss: 0.7253, test_loss: 0.7789, test_f1: 0.6089
 epoch: 33, train_loss: 0.7240, test_loss: 0.7647, test_f1: 0.6440
 epoch: 34, train_loss: 0.7086, test_loss: 0.7892, test_f1: 0.6255
 epoch: 35, train_loss: 0.7107, test_loss: 0.8769, test_f1: 0.6484
 epoch: 36, train_loss: 0.7139, test_loss: 0.7841, test_f1: 0.6096
 epoch: 37, train_loss: 0.6972, test_loss: 0.8096, test_f1: 0.6323
 epoch: 38, train_loss: 0.6893, test_loss: 0.8509, test_f1: 0.6321
 epoch: 39, train_loss: 0.7087, test_loss: 0.7807, test_f1: 0.6402
 epoch: 40, train_loss: 0.6863, test_loss: 0.8072, test_f1: 0.6312
 epoch: 41, train_loss: 0.6723, test_loss: 0.8119, test_f1: 0.6357
 epoch: 42, train_loss: 0.6735, test_loss: 0.7880, test_f1: 0.6511
 epoch: 43, train_loss: 0.6706, test_loss: 0.7745, test_f1: 0.6583
 epoch: 44, train_loss: 0.6728, test_loss: 0.8089, test_f1: 0.6252
 epoch: 45, train_loss: 0.6764, test_loss: 0.8647, test_f1: 0.6298
 epoch: 46, train_loss: 0.6807, test_loss: 0.8139, test_f1: 0.6406
 epoch: 47, train_loss: 0.6653, test_loss: 0.7845, test_f1: 0.6707
 epoch: 48, train_loss: 0.6688, test_loss: 0.7358, test_f1: 0.6511
 epoch: 49, train_loss: 0.6760, test_loss: 0.7700, test_f1: 0.6559
 epoch: 50, train_loss: 0.6575, test_loss: 0.7816, test_f1: 0.6344
 epoch: 51, train_loss: 0.6354, test_loss: 0.7447, test_f1: 0.6540
 epoch: 52, train_loss: 0.6192, test_loss: 0.8220, test_f1: 0.6439
 epoch: 53, train_loss: 0.6148, test_loss: 0.7619, test_f1: 0.6593
 epoch: 54, train_loss: 0.6218, test_loss: 0.7955, test_f1: 0.6435
 epoch: 55, train_loss: 0.6135, test_loss: 0.7861, test_f1: 0.6587
 epoch: 56, train_loss: 0.6044, test_loss: 0.8277, test_f1: 0.6400
 epoch: 57, train_loss: 0.6011, test_loss: 0.8530, test_f1: 0.6522
 epoch: 58, train_loss: 0.6037, test_loss: 0.8100, test_f1: 0.6499
 epoch: 59, train_loss: 0.6027, test_loss: 0.8258, test_f1: 0.6432
 epoch: 60, train_loss: 0.5849, test_loss: 0.8044, test_f1: 0.6407
 epoch: 61, train_loss: 0.5906, test_loss: 0.8567, test_f1: 0.6522
 epoch: 62, train_loss: 0.5984, test_loss: 0.8159, test_f1: 0.6558
 epoch: 63, train_loss: 0.5835, test_loss: 0.8031, test_f1: 0.6544
 epoch: 64, train_loss: 0.5893, test_loss: 0.7950, test_f1: 0.6306
 epoch: 65, train_loss: 0.5758, test_loss: 0.9133, test_f1: 0.6367
 epoch: 66, train_loss: 0.5859, test_loss: 0.8456, test_f1: 0.6516
 epoch: 67, train_loss: 0.5770, test_loss: 0.8582, test_f1: 0.6506
 epoch: 68, train_loss: 0.5832, test_loss: 0.8647, test_f1: 0.6360
 epoch: 69, train_loss: 0.5764, test_loss: 0.8325, test_f1: 0.6569
 epoch: 70, train_loss: 0.5706, test_loss: 0.8412, test_f1: 0.6512
 epoch: 71, train_loss: 0.5754, test_loss: 0.9179, test_f1: 0.6464
 epoch: 72, train_loss: 0.5724, test_loss: 0.8870, test_f1: 0.6441
 epoch: 73, train_loss: 0.5621, test_loss: 0.8744, test_f1: 0.6549
 epoch: 74, train_loss: 0.5713, test_loss: 0.9002, test_f1: 0.6427
 epoch: 75, train_loss: 0.5576, test_loss: 0.9211, test_f1: 0.6469
 epoch: 76, train_loss: 0.5580, test_loss: 0.8783, test_f1: 0.6713
 epoch: 77, train_loss: 0.5383, test_loss: 0.9265, test_f1: 0.6584
 epoch: 78, train_loss: 0.5567, test_loss: 0.9484, test_f1: 0.6511
 epoch: 79, train_loss: 0.5608, test_loss: 0.9007, test_f1: 0.6647
 epoch: 80, train_loss: 0.5364, test_loss: 0.9285, test_f1: 0.6464
 epoch: 81, train_loss: 0.5460, test_loss: 0.9096, test_f1: 0.6652
 epoch: 82, train_loss: 0.5502, test_loss: 0.9513, test_f1: 0.6464
 epoch: 83, train_loss: 0.5678, test_loss: 0.9692, test_f1: 0.6437
 epoch: 84, train_loss: 0.5610, test_loss: 0.9473, test_f1: 0.6339
 epoch: 85, train_loss: 0.5511, test_loss: 0.9983, test_f1: 0.6567
 epoch: 86, train_loss: 0.5570, test_loss: 0.9140, test_f1: 0.6637
 epoch: 87, train_loss: 0.5366, test_loss: 0.9317, test_f1: 0.6544
 epoch: 88, train_loss: 0.5385, test_loss: 0.9441, test_f1: 0.6529
 epoch: 89, train_loss: 0.5241, test_loss: 0.9865, test_f1: 0.6513
 epoch: 90, train_loss: 0.5526, test_loss: 0.9479, test_f1: 0.6600
 epoch: 91, train_loss: 0.5311, test_loss: 0.9362, test_f1: 0.6391
 epoch: 92, train_loss: 0.5325, test_loss: 0.9534, test_f1: 0.6495
 epoch: 93, train_loss: 0.5114, test_loss: 0.8933, test_f1: 0.6733
 epoch: 94, train_loss: 0.5151, test_loss: 0.9917, test_f1: 0.6593
 epoch: 95, train_loss: 0.5194, test_loss: 0.9969, test_f1: 0.6424
 epoch: 96, train_loss: 0.5290, test_loss: 0.9147, test_f1: 0.6845
 epoch: 97, train_loss: 0.5220, test_loss: 0.9530, test_f1: 0.6486
 epoch: 98, train_loss: 0.5244, test_loss: 0.9608, test_f1: 0.6538
 epoch: 99, train_loss: 0.5238, test_loss: 1.0013, test_f1: 0.6546
##################ITERATION #9 ****************************************
 epoch: 0, train_loss: 1.3338, test_loss: 1.1741, test_f1: 0.3433
 epoch: 1, train_loss: 1.0419, test_loss: 0.9600, test_f1: 0.4485
 epoch: 2, train_loss: 0.9937, test_loss: 0.9467, test_f1: 0.4768
 epoch: 3, train_loss: 0.9793, test_loss: 0.9112, test_f1: 0.4777
 epoch: 4, train_loss: 0.9537, test_loss: 0.8935, test_f1: 0.5040
 epoch: 5, train_loss: 0.9307, test_loss: 0.9202, test_f1: 0.4814
 epoch: 6, train_loss: 0.9009, test_loss: 0.8630, test_f1: 0.5149
 epoch: 7, train_loss: 0.9172, test_loss: 0.8970, test_f1: 0.5031
 epoch: 8, train_loss: 0.8951, test_loss: 0.8310, test_f1: 0.5304
 epoch: 9, train_loss: 0.8770, test_loss: 0.8229, test_f1: 0.5495
 epoch: 10, train_loss: 0.8634, test_loss: 0.8807, test_f1: 0.5378
 epoch: 11, train_loss: 0.8626, test_loss: 0.8568, test_f1: 0.5460
 epoch: 12, train_loss: 0.8440, test_loss: 0.8855, test_f1: 0.5408
 epoch: 13, train_loss: 0.8350, test_loss: 0.8728, test_f1: 0.5348
 epoch: 14, train_loss: 0.8219, test_loss: 0.8256, test_f1: 0.5964
 epoch: 15, train_loss: 0.7993, test_loss: 0.7659, test_f1: 0.6197
 epoch: 16, train_loss: 0.7960, test_loss: 0.8378, test_f1: 0.5967
 epoch: 17, train_loss: 0.8023, test_loss: 0.7929, test_f1: 0.5953
 epoch: 18, train_loss: 0.7872, test_loss: 0.8646, test_f1: 0.5232
 epoch: 19, train_loss: 0.8007, test_loss: 0.7761, test_f1: 0.5947
 epoch: 20, train_loss: 0.7782, test_loss: 0.7571, test_f1: 0.6174
 epoch: 21, train_loss: 0.7835, test_loss: 0.8335, test_f1: 0.5967
 epoch: 22, train_loss: 0.7614, test_loss: 0.7854, test_f1: 0.6193
 epoch: 23, train_loss: 0.7609, test_loss: 0.8690, test_f1: 0.5985
 epoch: 24, train_loss: 0.7466, test_loss: 0.7999, test_f1: 0.5911
 epoch: 25, train_loss: 0.7423, test_loss: 0.8259, test_f1: 0.5990
 epoch: 26, train_loss: 0.7343, test_loss: 0.7973, test_f1: 0.5951
 epoch: 27, train_loss: 0.7193, test_loss: 0.7974, test_f1: 0.6071
 epoch: 28, train_loss: 0.7285, test_loss: 0.7631, test_f1: 0.6233
 epoch: 29, train_loss: 0.7193, test_loss: 0.8306, test_f1: 0.5830
 epoch: 30, train_loss: 0.6975, test_loss: 0.8017, test_f1: 0.6200
 epoch: 31, train_loss: 0.7009, test_loss: 0.7460, test_f1: 0.6573
 epoch: 32, train_loss: 0.7100, test_loss: 0.8169, test_f1: 0.6047
 epoch: 33, train_loss: 0.6980, test_loss: 0.8408, test_f1: 0.5993
 epoch: 34, train_loss: 0.7007, test_loss: 0.8224, test_f1: 0.5843
 epoch: 35, train_loss: 0.6876, test_loss: 0.8195, test_f1: 0.6225
 epoch: 36, train_loss: 0.6790, test_loss: 0.8099, test_f1: 0.6557
 epoch: 37, train_loss: 0.6620, test_loss: 0.8084, test_f1: 0.6495
 epoch: 38, train_loss: 0.6764, test_loss: 0.7813, test_f1: 0.6538
 epoch: 39, train_loss: 0.6682, test_loss: 0.8767, test_f1: 0.6211
 epoch: 40, train_loss: 0.6643, test_loss: 0.8634, test_f1: 0.6188
 epoch: 41, train_loss: 0.6678, test_loss: 0.7735, test_f1: 0.6693
 epoch: 42, train_loss: 0.6534, test_loss: 0.8391, test_f1: 0.6413
 epoch: 43, train_loss: 0.6523, test_loss: 0.8147, test_f1: 0.6482
 epoch: 44, train_loss: 0.6503, test_loss: 0.8373, test_f1: 0.6417
 epoch: 45, train_loss: 0.6323, test_loss: 0.7749, test_f1: 0.6750
 epoch: 46, train_loss: 0.6356, test_loss: 0.9015, test_f1: 0.6229
 epoch: 47, train_loss: 0.6246, test_loss: 0.8510, test_f1: 0.6211
 epoch: 48, train_loss: 0.6066, test_loss: 0.8173, test_f1: 0.6534
 epoch: 49, train_loss: 0.6086, test_loss: 0.8253, test_f1: 0.6502
 epoch: 50, train_loss: 0.6236, test_loss: 0.8048, test_f1: 0.6438
 epoch: 51, train_loss: 0.5910, test_loss: 0.7954, test_f1: 0.6694
 epoch: 52, train_loss: 0.5926, test_loss: 0.8340, test_f1: 0.6630
 epoch: 53, train_loss: 0.5648, test_loss: 0.8162, test_f1: 0.6675
 epoch: 54, train_loss: 0.5752, test_loss: 0.8392, test_f1: 0.6472
 epoch: 55, train_loss: 0.5616, test_loss: 0.8235, test_f1: 0.6585
 epoch: 56, train_loss: 0.5604, test_loss: 0.8677, test_f1: 0.6689
 epoch: 57, train_loss: 0.5684, test_loss: 0.8023, test_f1: 0.6671
 epoch: 58, train_loss: 0.5619, test_loss: 0.8209, test_f1: 0.6777
 epoch: 59, train_loss: 0.5455, test_loss: 0.8227, test_f1: 0.6643
 epoch: 60, train_loss: 0.5500, test_loss: 0.8351, test_f1: 0.6622
 epoch: 61, train_loss: 0.5455, test_loss: 0.8635, test_f1: 0.6616
 epoch: 62, train_loss: 0.5446, test_loss: 0.8495, test_f1: 0.6691
 epoch: 63, train_loss: 0.5210, test_loss: 0.8528, test_f1: 0.6613
 epoch: 64, train_loss: 0.5443, test_loss: 0.8606, test_f1: 0.6688
 epoch: 65, train_loss: 0.5360, test_loss: 0.8781, test_f1: 0.6602
 epoch: 66, train_loss: 0.5591, test_loss: 0.8398, test_f1: 0.6689
 epoch: 67, train_loss: 0.5453, test_loss: 0.8679, test_f1: 0.6558
 epoch: 68, train_loss: 0.5298, test_loss: 0.8216, test_f1: 0.6736
 epoch: 69, train_loss: 0.5113, test_loss: 0.8569, test_f1: 0.6724
 epoch: 70, train_loss: 0.5094, test_loss: 0.8970, test_f1: 0.6691
 epoch: 71, train_loss: 0.5233, test_loss: 0.9249, test_f1: 0.6687
 epoch: 72, train_loss: 0.5174, test_loss: 0.9067, test_f1: 0.6520
 epoch: 73, train_loss: 0.5130, test_loss: 0.8984, test_f1: 0.6438
 epoch: 74, train_loss: 0.5255, test_loss: 0.9040, test_f1: 0.6540
 epoch: 75, train_loss: 0.5109, test_loss: 0.8591, test_f1: 0.6686
 epoch: 76, train_loss: 0.5165, test_loss: 0.9561, test_f1: 0.6399
 epoch: 77, train_loss: 0.5130, test_loss: 0.9361, test_f1: 0.6467
 epoch: 78, train_loss: 0.4947, test_loss: 0.9790, test_f1: 0.6439
 epoch: 79, train_loss: 0.5188, test_loss: 0.9122, test_f1: 0.6688
 epoch: 80, train_loss: 0.5034, test_loss: 0.9140, test_f1: 0.6566
 epoch: 81, train_loss: 0.4947, test_loss: 0.9510, test_f1: 0.6581
 epoch: 82, train_loss: 0.5048, test_loss: 0.9603, test_f1: 0.6502
 epoch: 83, train_loss: 0.4996, test_loss: 0.9580, test_f1: 0.6599
 epoch: 84, train_loss: 0.4937, test_loss: 1.0039, test_f1: 0.6208
 epoch: 85, train_loss: 0.5020, test_loss: 0.9781, test_f1: 0.6277
 epoch: 86, train_loss: 0.4913, test_loss: 1.0664, test_f1: 0.6294
 epoch: 87, train_loss: 0.4907, test_loss: 0.9836, test_f1: 0.6565
 epoch: 88, train_loss: 0.4680, test_loss: 0.9404, test_f1: 0.6559
 epoch: 89, train_loss: 0.4806, test_loss: 1.0248, test_f1: 0.6368
 epoch: 90, train_loss: 0.4875, test_loss: 1.0749, test_f1: 0.6316
 epoch: 91, train_loss: 0.4840, test_loss: 0.9763, test_f1: 0.6406
 epoch: 92, train_loss: 0.4947, test_loss: 1.0094, test_f1: 0.6393
 epoch: 93, train_loss: 0.4912, test_loss: 0.9731, test_f1: 0.6594
 epoch: 94, train_loss: 0.4734, test_loss: 1.0392, test_f1: 0.6523
 epoch: 95, train_loss: 0.4750, test_loss: 1.0193, test_f1: 0.6458
 epoch: 96, train_loss: 0.4555, test_loss: 1.0308, test_f1: 0.6397
 epoch: 97, train_loss: 0.4822, test_loss: 1.0117, test_f1: 0.6688
 epoch: 98, train_loss: 0.4591, test_loss: 1.0198, test_f1: 0.6466
 epoch: 99, train_loss: 0.4721, test_loss: 1.0151, test_f1: 0.6658

Training completed in 694.76 seconds
Best F1: 0.7038 at epoch 74
Mean F1 across iterations: 0.6768  0.0144
========================FINAL RESULTS================================
FEGIN weighted F1: 0.7038  0.0144
python main.py --data ltspice_examples --representation component_pin_net --model FEGIN --layers 4 --hiddens 32 --batch_size 64 --lr 0.001 --emb_size 512 --epochs 100 --save_appendix component_pin_net_L4_H32_BS64_LR0.001_E512 --no_val
-----



STDERR:
  File "main.py", line 370, in <module>
    main()
  File "main.py", line 254, in main
    dataset = dataset_class(
  File "/home/philip/projects/ltspice_examples_code_repo/Circuit-Completion-Using-GNNs/component_classification_with_link_prediction_head/evaluation/FEGIN/kernel/circuit_datasets.py", line 15, in __init__
    self.data, self.slices = torch.load(self.processed_paths[0])
  File "/home/philip/.local/lib/python3.8/site-packages/torch/serialization.py", line 1040, in load
    warnings.warn(
  File "/usr/lib/python3.8/warnings.py", line 109, in _showwarnmsg
    sw(msg.message, msg.category, msg.filename, msg.lineno,
  File "main.py", line 47, in warn_with_traceback
    traceback.print_stack(file=log)
/home/philip/projects/ltspice_examples_code_repo/Circuit-Completion-Using-GNNs/component_classification_with_link_prediction_head/evaluation/FEGIN/kernel/circuit_datasets.py:15: FutureWarning: You are using `torch.load` with `weights_only=False` (the current default value), which uses the default pickle module implicitly. It is possible to construct malicious pickle data which will execute arbitrary code during unpickling (See https://github.com/pytorch/pytorch/blob/main/SECURITY.md#untrusted-models for more details). In a future release, the default value for `weights_only` will be flipped to `True`. This limits the functions that could be executed during unpickling. Arbitrary objects will no longer be allowed to be loaded via this mode unless they are explicitly allowlisted by the user via `torch.serialization.add_safe_globals`. We recommend you start setting `weights_only=True` for any use case where you don't have full control of the loaded file. Please open an issue on GitHub for any issues related to this experimental feature.
  self.data, self.slices = torch.load(self.processed_paths[0])
