STDOUT:
Results will be saved in /home/philip/projects/ltspice_examples_code_repo/Circuit-Completion-Using-GNNs/component_classification_with_link_prediction_head/evaluation/FEGIN/results/model_FEGIN_dataset_ltspice_examples
Command line input: python main.py --data ltspice_examples --representation component_net --model FEGIN --layers 5 --hiddens 128 --batch_size 64 --lr 0.0001 --emb_size 128 --epochs 100 --save_appendix component_net_L5_H128_BS64_LR0.0001_E128 --no_val
 is saved.
-----
ltspice_examples - FEGIN
Using 5 layers, 128 hidden units, h = 2
Loading component_net representation dataset
ENTERED
Training FEGIN on component_net representation
Train: 3558, Test: 846
##################ITERATION #0 ****************************************
 epoch: 0, train_loss: 1.3412, test_loss: 1.3216, test_f1: 0.2270
 epoch: 1, train_loss: 1.2636, test_loss: 1.2330, test_f1: 0.2295
 epoch: 2, train_loss: 1.2220, test_loss: 1.1821, test_f1: 0.3045
 epoch: 3, train_loss: 1.1776, test_loss: 1.1350, test_f1: 0.3670
 epoch: 4, train_loss: 1.1309, test_loss: 1.0785, test_f1: 0.4903
 epoch: 5, train_loss: 1.0844, test_loss: 1.0275, test_f1: 0.5045
 epoch: 6, train_loss: 1.0391, test_loss: 0.9894, test_f1: 0.5092
 epoch: 7, train_loss: 0.9929, test_loss: 0.9450, test_f1: 0.4967
 epoch: 8, train_loss: 0.9562, test_loss: 0.9188, test_f1: 0.5360
 epoch: 9, train_loss: 0.9343, test_loss: 0.9260, test_f1: 0.5151
 epoch: 10, train_loss: 0.9046, test_loss: 0.9112, test_f1: 0.5078
 epoch: 11, train_loss: 0.8843, test_loss: 0.9348, test_f1: 0.5014
 epoch: 12, train_loss: 0.8746, test_loss: 0.9098, test_f1: 0.5464
 epoch: 13, train_loss: 0.8518, test_loss: 0.9195, test_f1: 0.5545
 epoch: 14, train_loss: 0.8495, test_loss: 0.9299, test_f1: 0.5490
 epoch: 15, train_loss: 0.8333, test_loss: 0.9166, test_f1: 0.5539
 epoch: 16, train_loss: 0.8200, test_loss: 0.9135, test_f1: 0.5291
 epoch: 17, train_loss: 0.8123, test_loss: 0.9385, test_f1: 0.5296
 epoch: 18, train_loss: 0.8031, test_loss: 0.9054, test_f1: 0.5399
 epoch: 19, train_loss: 0.7973, test_loss: 0.9344, test_f1: 0.5095
 epoch: 20, train_loss: 0.7920, test_loss: 0.9320, test_f1: 0.5163
 epoch: 21, train_loss: 0.7816, test_loss: 0.9000, test_f1: 0.5458
 epoch: 22, train_loss: 0.7770, test_loss: 0.9203, test_f1: 0.5632
 epoch: 23, train_loss: 0.7676, test_loss: 0.9270, test_f1: 0.5360
 epoch: 24, train_loss: 0.7611, test_loss: 0.9004, test_f1: 0.5616
 epoch: 25, train_loss: 0.7538, test_loss: 0.9005, test_f1: 0.5847
 epoch: 26, train_loss: 0.7512, test_loss: 0.9040, test_f1: 0.5683
 epoch: 27, train_loss: 0.7485, test_loss: 0.9128, test_f1: 0.5701
 epoch: 28, train_loss: 0.7244, test_loss: 0.9220, test_f1: 0.5834
 epoch: 29, train_loss: 0.7223, test_loss: 0.9447, test_f1: 0.5586
 epoch: 30, train_loss: 0.7191, test_loss: 0.9025, test_f1: 0.5686
 epoch: 31, train_loss: 0.7079, test_loss: 0.9206, test_f1: 0.5694
 epoch: 32, train_loss: 0.7005, test_loss: 0.9186, test_f1: 0.5680
 epoch: 33, train_loss: 0.7127, test_loss: 0.9354, test_f1: 0.5772
 epoch: 34, train_loss: 0.7001, test_loss: 0.9148, test_f1: 0.5705
 epoch: 35, train_loss: 0.7051, test_loss: 0.9437, test_f1: 0.5856
 epoch: 36, train_loss: 0.6837, test_loss: 0.9019, test_f1: 0.5720
 epoch: 37, train_loss: 0.6714, test_loss: 0.9022, test_f1: 0.5702
 epoch: 38, train_loss: 0.6833, test_loss: 0.9229, test_f1: 0.5913
 epoch: 39, train_loss: 0.6763, test_loss: 0.9337, test_f1: 0.5813
 epoch: 40, train_loss: 0.6742, test_loss: 0.9282, test_f1: 0.5915
 epoch: 41, train_loss: 0.6586, test_loss: 0.9461, test_f1: 0.5807
 epoch: 42, train_loss: 0.6500, test_loss: 0.9333, test_f1: 0.6003
 epoch: 43, train_loss: 0.6468, test_loss: 0.9588, test_f1: 0.5823
 epoch: 44, train_loss: 0.6512, test_loss: 0.9048, test_f1: 0.5923
 epoch: 45, train_loss: 0.6398, test_loss: 0.9141, test_f1: 0.5990
 epoch: 46, train_loss: 0.6426, test_loss: 0.9477, test_f1: 0.5863
 epoch: 47, train_loss: 0.6263, test_loss: 0.9220, test_f1: 0.6059
 epoch: 48, train_loss: 0.6276, test_loss: 0.9459, test_f1: 0.6032
 epoch: 49, train_loss: 0.6263, test_loss: 0.9282, test_f1: 0.6184
 epoch: 50, train_loss: 0.6083, test_loss: 0.9499, test_f1: 0.6197
 epoch: 51, train_loss: 0.6043, test_loss: 0.9300, test_f1: 0.6199
 epoch: 52, train_loss: 0.5848, test_loss: 0.9383, test_f1: 0.6129
 epoch: 53, train_loss: 0.5856, test_loss: 0.9236, test_f1: 0.6227
 epoch: 54, train_loss: 0.5681, test_loss: 0.9301, test_f1: 0.6224
 epoch: 55, train_loss: 0.5687, test_loss: 0.9437, test_f1: 0.6021
 epoch: 56, train_loss: 0.5697, test_loss: 0.9471, test_f1: 0.6144
 epoch: 57, train_loss: 0.5694, test_loss: 0.9359, test_f1: 0.6121
 epoch: 58, train_loss: 0.5646, test_loss: 0.9443, test_f1: 0.6296
 epoch: 59, train_loss: 0.5663, test_loss: 0.9604, test_f1: 0.6176
 epoch: 60, train_loss: 0.5534, test_loss: 0.9412, test_f1: 0.6268
 epoch: 61, train_loss: 0.5594, test_loss: 0.9196, test_f1: 0.6315
 epoch: 62, train_loss: 0.5413, test_loss: 0.9161, test_f1: 0.6257
 epoch: 63, train_loss: 0.5317, test_loss: 0.9296, test_f1: 0.6165
 epoch: 64, train_loss: 0.5370, test_loss: 0.9292, test_f1: 0.6215
 epoch: 65, train_loss: 0.5518, test_loss: 0.9654, test_f1: 0.6111
 epoch: 66, train_loss: 0.5335, test_loss: 0.9663, test_f1: 0.6211
 epoch: 67, train_loss: 0.5286, test_loss: 0.9537, test_f1: 0.6145
 epoch: 68, train_loss: 0.5381, test_loss: 0.9374, test_f1: 0.6143
 epoch: 69, train_loss: 0.5295, test_loss: 0.9214, test_f1: 0.6208
 epoch: 70, train_loss: 0.5212, test_loss: 0.9696, test_f1: 0.6270
 epoch: 71, train_loss: 0.5428, test_loss: 0.9708, test_f1: 0.6138
 epoch: 72, train_loss: 0.5175, test_loss: 0.9319, test_f1: 0.6288
 epoch: 73, train_loss: 0.5152, test_loss: 0.9324, test_f1: 0.6148
 epoch: 74, train_loss: 0.5334, test_loss: 0.9520, test_f1: 0.6186
 epoch: 75, train_loss: 0.5108, test_loss: 0.9500, test_f1: 0.6382
 epoch: 76, train_loss: 0.4921, test_loss: 0.9519, test_f1: 0.6244
 epoch: 77, train_loss: 0.4950, test_loss: 0.9540, test_f1: 0.6190
 epoch: 78, train_loss: 0.5170, test_loss: 0.9646, test_f1: 0.6259
 epoch: 79, train_loss: 0.4997, test_loss: 0.9351, test_f1: 0.6360
 epoch: 80, train_loss: 0.5073, test_loss: 0.9634, test_f1: 0.6306
 epoch: 81, train_loss: 0.4984, test_loss: 0.9779, test_f1: 0.6367
 epoch: 82, train_loss: 0.4840, test_loss: 0.9542, test_f1: 0.6300
 epoch: 83, train_loss: 0.4949, test_loss: 1.0021, test_f1: 0.6247
 epoch: 84, train_loss: 0.4785, test_loss: 0.9768, test_f1: 0.6455
 epoch: 85, train_loss: 0.4835, test_loss: 0.9847, test_f1: 0.6348
 epoch: 86, train_loss: 0.4909, test_loss: 0.9693, test_f1: 0.6506
 epoch: 87, train_loss: 0.4845, test_loss: 0.9779, test_f1: 0.6326
 epoch: 88, train_loss: 0.4838, test_loss: 0.9879, test_f1: 0.6409
 epoch: 89, train_loss: 0.4804, test_loss: 0.9814, test_f1: 0.6297
 epoch: 90, train_loss: 0.4700, test_loss: 0.9859, test_f1: 0.6290
 epoch: 91, train_loss: 0.4656, test_loss: 0.9835, test_f1: 0.6517
 epoch: 92, train_loss: 0.4693, test_loss: 1.0074, test_f1: 0.6297
 epoch: 93, train_loss: 0.4640, test_loss: 0.9866, test_f1: 0.6368
 epoch: 94, train_loss: 0.4672, test_loss: 1.0061, test_f1: 0.6263
 epoch: 95, train_loss: 0.4601, test_loss: 1.0164, test_f1: 0.6385
 epoch: 96, train_loss: 0.4472, test_loss: 1.0179, test_f1: 0.6358
 epoch: 97, train_loss: 0.4481, test_loss: 0.9963, test_f1: 0.6401
 epoch: 98, train_loss: 0.4482, test_loss: 1.0175, test_f1: 0.6443
 epoch: 99, train_loss: 0.4483, test_loss: 1.0170, test_f1: 0.6417
##################ITERATION #1 ****************************************
 epoch: 0, train_loss: 1.2389, test_loss: 1.2312, test_f1: 0.3560
 epoch: 1, train_loss: 1.1277, test_loss: 1.0643, test_f1: 0.4694
 epoch: 2, train_loss: 1.0788, test_loss: 1.0107, test_f1: 0.4622
 epoch: 3, train_loss: 1.0310, test_loss: 0.9680, test_f1: 0.4742
 epoch: 4, train_loss: 0.9899, test_loss: 0.9594, test_f1: 0.4773
 epoch: 5, train_loss: 0.9658, test_loss: 0.9129, test_f1: 0.5009
 epoch: 6, train_loss: 0.9449, test_loss: 0.9270, test_f1: 0.5062
 epoch: 7, train_loss: 0.9193, test_loss: 0.8954, test_f1: 0.5186
 epoch: 8, train_loss: 0.9041, test_loss: 0.9360, test_f1: 0.5199
 epoch: 9, train_loss: 0.8849, test_loss: 0.9015, test_f1: 0.5216
 epoch: 10, train_loss: 0.8712, test_loss: 0.9029, test_f1: 0.5383
 epoch: 11, train_loss: 0.8572, test_loss: 0.9185, test_f1: 0.5540
 epoch: 12, train_loss: 0.8563, test_loss: 0.9322, test_f1: 0.5315
 epoch: 13, train_loss: 0.8440, test_loss: 0.9157, test_f1: 0.5374
 epoch: 14, train_loss: 0.8323, test_loss: 0.9092, test_f1: 0.5238
 epoch: 15, train_loss: 0.8269, test_loss: 0.8888, test_f1: 0.5858
 epoch: 16, train_loss: 0.8028, test_loss: 0.8983, test_f1: 0.5753
 epoch: 17, train_loss: 0.8077, test_loss: 0.9090, test_f1: 0.5854
 epoch: 18, train_loss: 0.7939, test_loss: 0.9169, test_f1: 0.5552
 epoch: 19, train_loss: 0.7827, test_loss: 0.9134, test_f1: 0.5872
 epoch: 20, train_loss: 0.7691, test_loss: 0.9284, test_f1: 0.5714
 epoch: 21, train_loss: 0.7687, test_loss: 0.9257, test_f1: 0.5769
 epoch: 22, train_loss: 0.7550, test_loss: 0.9115, test_f1: 0.5704
 epoch: 23, train_loss: 0.7481, test_loss: 0.8886, test_f1: 0.5829
 epoch: 24, train_loss: 0.7353, test_loss: 0.9008, test_f1: 0.5971
 epoch: 25, train_loss: 0.7295, test_loss: 0.8881, test_f1: 0.6108
 epoch: 26, train_loss: 0.7244, test_loss: 0.9226, test_f1: 0.5996
 epoch: 27, train_loss: 0.7208, test_loss: 0.8692, test_f1: 0.6201
 epoch: 28, train_loss: 0.7181, test_loss: 0.9208, test_f1: 0.6115
 epoch: 29, train_loss: 0.7047, test_loss: 0.9695, test_f1: 0.5945
 epoch: 30, train_loss: 0.7043, test_loss: 0.8913, test_f1: 0.6551
 epoch: 31, train_loss: 0.7011, test_loss: 0.8987, test_f1: 0.6253
 epoch: 32, train_loss: 0.6870, test_loss: 0.8896, test_f1: 0.6466
 epoch: 33, train_loss: 0.6734, test_loss: 0.8964, test_f1: 0.6225
 epoch: 34, train_loss: 0.6884, test_loss: 0.9103, test_f1: 0.6281
 epoch: 35, train_loss: 0.6642, test_loss: 0.9365, test_f1: 0.6155
 epoch: 36, train_loss: 0.6662, test_loss: 0.9027, test_f1: 0.6352
 epoch: 37, train_loss: 0.6487, test_loss: 0.9116, test_f1: 0.6509
 epoch: 38, train_loss: 0.6420, test_loss: 0.9148, test_f1: 0.6393
 epoch: 39, train_loss: 0.6479, test_loss: 0.9487, test_f1: 0.6335
 epoch: 40, train_loss: 0.6421, test_loss: 0.9322, test_f1: 0.6156
 epoch: 41, train_loss: 0.6337, test_loss: 0.9588, test_f1: 0.5881
 epoch: 42, train_loss: 0.6351, test_loss: 0.9187, test_f1: 0.6227
 epoch: 43, train_loss: 0.6205, test_loss: 0.9508, test_f1: 0.6097
 epoch: 44, train_loss: 0.6167, test_loss: 0.9437, test_f1: 0.6443
 epoch: 45, train_loss: 0.6084, test_loss: 0.9239, test_f1: 0.6271
 epoch: 46, train_loss: 0.6031, test_loss: 0.9442, test_f1: 0.6253
 epoch: 47, train_loss: 0.6130, test_loss: 0.9331, test_f1: 0.6501
 epoch: 48, train_loss: 0.5983, test_loss: 0.9609, test_f1: 0.6163
 epoch: 49, train_loss: 0.5905, test_loss: 0.9185, test_f1: 0.6423
 epoch: 50, train_loss: 0.5768, test_loss: 0.9483, test_f1: 0.6726
 epoch: 51, train_loss: 0.5599, test_loss: 0.9398, test_f1: 0.6487
 epoch: 52, train_loss: 0.5688, test_loss: 0.9769, test_f1: 0.6414
 epoch: 53, train_loss: 0.5467, test_loss: 0.9632, test_f1: 0.6311
 epoch: 54, train_loss: 0.5394, test_loss: 0.9396, test_f1: 0.6531
 epoch: 55, train_loss: 0.5358, test_loss: 0.9416, test_f1: 0.6689
 epoch: 56, train_loss: 0.5344, test_loss: 0.9262, test_f1: 0.6719
 epoch: 57, train_loss: 0.5518, test_loss: 0.9890, test_f1: 0.6401
 epoch: 58, train_loss: 0.5392, test_loss: 0.9942, test_f1: 0.6605
 epoch: 59, train_loss: 0.5305, test_loss: 1.0169, test_f1: 0.6397
 epoch: 60, train_loss: 0.5275, test_loss: 0.9501, test_f1: 0.6320
 epoch: 61, train_loss: 0.5333, test_loss: 0.9863, test_f1: 0.6581
 epoch: 62, train_loss: 0.5252, test_loss: 0.9742, test_f1: 0.6539
 epoch: 63, train_loss: 0.5111, test_loss: 0.9811, test_f1: 0.6421
 epoch: 64, train_loss: 0.5180, test_loss: 0.9862, test_f1: 0.6716
 epoch: 65, train_loss: 0.5082, test_loss: 0.9822, test_f1: 0.6697
 epoch: 66, train_loss: 0.5054, test_loss: 0.9893, test_f1: 0.6402
 epoch: 67, train_loss: 0.4994, test_loss: 0.9998, test_f1: 0.6744
 epoch: 68, train_loss: 0.5092, test_loss: 0.9916, test_f1: 0.6596
 epoch: 69, train_loss: 0.4924, test_loss: 0.9940, test_f1: 0.6519
 epoch: 70, train_loss: 0.4937, test_loss: 0.9835, test_f1: 0.6540
 epoch: 71, train_loss: 0.5023, test_loss: 1.0437, test_f1: 0.6397
 epoch: 72, train_loss: 0.4954, test_loss: 1.0136, test_f1: 0.6576
 epoch: 73, train_loss: 0.4855, test_loss: 1.0243, test_f1: 0.6473
 epoch: 74, train_loss: 0.4937, test_loss: 1.0002, test_f1: 0.6690
 epoch: 75, train_loss: 0.4775, test_loss: 1.0717, test_f1: 0.6617
 epoch: 76, train_loss: 0.4856, test_loss: 1.0455, test_f1: 0.6485
 epoch: 77, train_loss: 0.4662, test_loss: 1.0471, test_f1: 0.6557
 epoch: 78, train_loss: 0.4681, test_loss: 1.0371, test_f1: 0.6635
 epoch: 79, train_loss: 0.4681, test_loss: 1.0522, test_f1: 0.6518
 epoch: 80, train_loss: 0.4533, test_loss: 1.0349, test_f1: 0.6685
 epoch: 81, train_loss: 0.4637, test_loss: 1.0497, test_f1: 0.6513
 epoch: 82, train_loss: 0.4719, test_loss: 1.0531, test_f1: 0.6580
 epoch: 83, train_loss: 0.4648, test_loss: 1.0240, test_f1: 0.6679
 epoch: 84, train_loss: 0.4484, test_loss: 1.0731, test_f1: 0.6529
 epoch: 85, train_loss: 0.4517, test_loss: 1.0930, test_f1: 0.6611
 epoch: 86, train_loss: 0.4460, test_loss: 1.0617, test_f1: 0.6438
 epoch: 87, train_loss: 0.4485, test_loss: 1.1008, test_f1: 0.6428
 epoch: 88, train_loss: 0.4413, test_loss: 1.0862, test_f1: 0.6619
 epoch: 89, train_loss: 0.4418, test_loss: 1.0443, test_f1: 0.6509
 epoch: 90, train_loss: 0.4447, test_loss: 1.0811, test_f1: 0.6596
 epoch: 91, train_loss: 0.4510, test_loss: 1.1290, test_f1: 0.6467
 epoch: 92, train_loss: 0.4458, test_loss: 1.1289, test_f1: 0.6460
 epoch: 93, train_loss: 0.4433, test_loss: 1.0964, test_f1: 0.6594
 epoch: 94, train_loss: 0.4578, test_loss: 1.1120, test_f1: 0.6434
 epoch: 95, train_loss: 0.4329, test_loss: 1.1666, test_f1: 0.6374
 epoch: 96, train_loss: 0.4302, test_loss: 1.1092, test_f1: 0.6553
 epoch: 97, train_loss: 0.4225, test_loss: 1.1013, test_f1: 0.6447
 epoch: 98, train_loss: 0.4336, test_loss: 1.1075, test_f1: 0.6545
 epoch: 99, train_loss: 0.4243, test_loss: 1.1297, test_f1: 0.6666
##################ITERATION #2 ****************************************
 epoch: 0, train_loss: 1.2234, test_loss: 1.1974, test_f1: 0.3611
 epoch: 1, train_loss: 1.1128, test_loss: 1.0485, test_f1: 0.4976
 epoch: 2, train_loss: 1.0664, test_loss: 1.0038, test_f1: 0.4905
 epoch: 3, train_loss: 1.0234, test_loss: 0.9504, test_f1: 0.5008
 epoch: 4, train_loss: 0.9924, test_loss: 0.9406, test_f1: 0.5062
 epoch: 5, train_loss: 0.9742, test_loss: 0.9389, test_f1: 0.4814
 epoch: 6, train_loss: 0.9462, test_loss: 0.9024, test_f1: 0.5004
 epoch: 7, train_loss: 0.9310, test_loss: 0.9067, test_f1: 0.5006
 epoch: 8, train_loss: 0.9128, test_loss: 0.8832, test_f1: 0.5272
 epoch: 9, train_loss: 0.9017, test_loss: 0.8842, test_f1: 0.5461
 epoch: 10, train_loss: 0.8820, test_loss: 0.8819, test_f1: 0.5476
 epoch: 11, train_loss: 0.8678, test_loss: 0.9102, test_f1: 0.5454
 epoch: 12, train_loss: 0.8650, test_loss: 0.8658, test_f1: 0.5645
 epoch: 13, train_loss: 0.8575, test_loss: 0.8943, test_f1: 0.5640
 epoch: 14, train_loss: 0.8424, test_loss: 0.8635, test_f1: 0.5566
 epoch: 15, train_loss: 0.8346, test_loss: 0.8942, test_f1: 0.5804
 epoch: 16, train_loss: 0.8236, test_loss: 0.8720, test_f1: 0.5918
 epoch: 17, train_loss: 0.8171, test_loss: 0.8986, test_f1: 0.5644
 epoch: 18, train_loss: 0.8086, test_loss: 0.8930, test_f1: 0.5669
 epoch: 19, train_loss: 0.7964, test_loss: 0.8936, test_f1: 0.5817
 epoch: 20, train_loss: 0.7961, test_loss: 0.8935, test_f1: 0.5783
 epoch: 21, train_loss: 0.7853, test_loss: 0.8823, test_f1: 0.5898
 epoch: 22, train_loss: 0.7750, test_loss: 0.8760, test_f1: 0.5846
 epoch: 23, train_loss: 0.7785, test_loss: 0.8814, test_f1: 0.6021
 epoch: 24, train_loss: 0.7583, test_loss: 0.8753, test_f1: 0.6069
 epoch: 25, train_loss: 0.7638, test_loss: 0.9128, test_f1: 0.5966
 epoch: 26, train_loss: 0.7567, test_loss: 0.8850, test_f1: 0.6017
 epoch: 27, train_loss: 0.7398, test_loss: 0.9180, test_f1: 0.6052
 epoch: 28, train_loss: 0.7429, test_loss: 0.8773, test_f1: 0.6117
 epoch: 29, train_loss: 0.7311, test_loss: 0.8771, test_f1: 0.6159
 epoch: 30, train_loss: 0.7363, test_loss: 0.9049, test_f1: 0.5745
 epoch: 31, train_loss: 0.7206, test_loss: 0.8688, test_f1: 0.6128
 epoch: 32, train_loss: 0.7166, test_loss: 0.8689, test_f1: 0.6205
 epoch: 33, train_loss: 0.7094, test_loss: 0.8891, test_f1: 0.6252
 epoch: 34, train_loss: 0.7054, test_loss: 0.9153, test_f1: 0.6149
 epoch: 35, train_loss: 0.6965, test_loss: 0.9215, test_f1: 0.6140
 epoch: 36, train_loss: 0.7009, test_loss: 0.8810, test_f1: 0.6223
 epoch: 37, train_loss: 0.6833, test_loss: 0.8674, test_f1: 0.6144
 epoch: 38, train_loss: 0.6788, test_loss: 0.9019, test_f1: 0.6303
 epoch: 39, train_loss: 0.6718, test_loss: 0.8900, test_f1: 0.6446
 epoch: 40, train_loss: 0.6777, test_loss: 0.8794, test_f1: 0.6219
 epoch: 41, train_loss: 0.6727, test_loss: 0.8487, test_f1: 0.6285
 epoch: 42, train_loss: 0.6657, test_loss: 0.9182, test_f1: 0.6148
 epoch: 43, train_loss: 0.6549, test_loss: 0.8612, test_f1: 0.6411
 epoch: 44, train_loss: 0.6612, test_loss: 0.9215, test_f1: 0.6233
 epoch: 45, train_loss: 0.6414, test_loss: 0.8951, test_f1: 0.6497
 epoch: 46, train_loss: 0.6473, test_loss: 0.9121, test_f1: 0.6425
 epoch: 47, train_loss: 0.6284, test_loss: 0.9313, test_f1: 0.6281
 epoch: 48, train_loss: 0.6270, test_loss: 0.8875, test_f1: 0.6326
 epoch: 49, train_loss: 0.6333, test_loss: 0.9325, test_f1: 0.6353
 epoch: 50, train_loss: 0.6294, test_loss: 0.9213, test_f1: 0.6187
 epoch: 51, train_loss: 0.6036, test_loss: 0.8819, test_f1: 0.6521
 epoch: 52, train_loss: 0.5905, test_loss: 0.8812, test_f1: 0.6682
 epoch: 53, train_loss: 0.5883, test_loss: 0.9376, test_f1: 0.6505
 epoch: 54, train_loss: 0.5939, test_loss: 0.9246, test_f1: 0.6500
 epoch: 55, train_loss: 0.5904, test_loss: 0.9294, test_f1: 0.6479
 epoch: 56, train_loss: 0.5863, test_loss: 0.9411, test_f1: 0.6400
 epoch: 57, train_loss: 0.5832, test_loss: 0.9439, test_f1: 0.6562
 epoch: 58, train_loss: 0.5731, test_loss: 0.9496, test_f1: 0.6349
 epoch: 59, train_loss: 0.5729, test_loss: 0.9477, test_f1: 0.6563
 epoch: 60, train_loss: 0.5667, test_loss: 0.9610, test_f1: 0.6697
 epoch: 61, train_loss: 0.5576, test_loss: 0.9470, test_f1: 0.6619
 epoch: 62, train_loss: 0.5584, test_loss: 0.9827, test_f1: 0.6400
 epoch: 63, train_loss: 0.5495, test_loss: 0.9731, test_f1: 0.6476
 epoch: 64, train_loss: 0.5491, test_loss: 0.9682, test_f1: 0.6363
 epoch: 65, train_loss: 0.5634, test_loss: 0.9517, test_f1: 0.6650
 epoch: 66, train_loss: 0.5579, test_loss: 0.9715, test_f1: 0.6462
 epoch: 67, train_loss: 0.5410, test_loss: 0.9762, test_f1: 0.6500
 epoch: 68, train_loss: 0.5424, test_loss: 0.9585, test_f1: 0.6705
 epoch: 69, train_loss: 0.5450, test_loss: 1.0084, test_f1: 0.6369
 epoch: 70, train_loss: 0.5364, test_loss: 0.9492, test_f1: 0.6589
 epoch: 71, train_loss: 0.5287, test_loss: 0.9735, test_f1: 0.6609
 epoch: 72, train_loss: 0.5295, test_loss: 0.9750, test_f1: 0.6709
 epoch: 73, train_loss: 0.5341, test_loss: 0.9925, test_f1: 0.6564
 epoch: 74, train_loss: 0.5294, test_loss: 0.9813, test_f1: 0.6497
 epoch: 75, train_loss: 0.5236, test_loss: 0.9895, test_f1: 0.6590
 epoch: 76, train_loss: 0.5280, test_loss: 0.9805, test_f1: 0.6563
 epoch: 77, train_loss: 0.5221, test_loss: 0.9946, test_f1: 0.6457
 epoch: 78, train_loss: 0.5128, test_loss: 1.0201, test_f1: 0.6661
 epoch: 79, train_loss: 0.5251, test_loss: 1.0015, test_f1: 0.6510
 epoch: 80, train_loss: 0.5148, test_loss: 1.0068, test_f1: 0.6465
 epoch: 81, train_loss: 0.5103, test_loss: 1.0083, test_f1: 0.6563
 epoch: 82, train_loss: 0.5111, test_loss: 1.0484, test_f1: 0.6453
 epoch: 83, train_loss: 0.4942, test_loss: 1.0410, test_f1: 0.6529
 epoch: 84, train_loss: 0.4894, test_loss: 1.0413, test_f1: 0.6546
 epoch: 85, train_loss: 0.5077, test_loss: 1.0326, test_f1: 0.6708
 epoch: 86, train_loss: 0.4931, test_loss: 1.0355, test_f1: 0.6374
 epoch: 87, train_loss: 0.4874, test_loss: 1.0470, test_f1: 0.6766
 epoch: 88, train_loss: 0.4944, test_loss: 1.0268, test_f1: 0.6691
 epoch: 89, train_loss: 0.4979, test_loss: 1.0537, test_f1: 0.6500
 epoch: 90, train_loss: 0.4902, test_loss: 1.0738, test_f1: 0.6399
 epoch: 91, train_loss: 0.4984, test_loss: 1.0381, test_f1: 0.6490
 epoch: 92, train_loss: 0.4749, test_loss: 1.0742, test_f1: 0.6304
 epoch: 93, train_loss: 0.4858, test_loss: 1.0755, test_f1: 0.6400
 epoch: 94, train_loss: 0.4668, test_loss: 1.0873, test_f1: 0.6538
 epoch: 95, train_loss: 0.4818, test_loss: 1.0257, test_f1: 0.6628
 epoch: 96, train_loss: 0.4760, test_loss: 1.0634, test_f1: 0.6572
 epoch: 97, train_loss: 0.4773, test_loss: 1.0487, test_f1: 0.6529
 epoch: 98, train_loss: 0.4633, test_loss: 1.0797, test_f1: 0.6535
 epoch: 99, train_loss: 0.4843, test_loss: 1.0947, test_f1: 0.6506
##################ITERATION #3 ****************************************
 epoch: 0, train_loss: 1.2000, test_loss: 1.1506, test_f1: 0.4493
 epoch: 1, train_loss: 1.0869, test_loss: 1.0249, test_f1: 0.4711
 epoch: 2, train_loss: 1.0439, test_loss: 0.9944, test_f1: 0.4902
 epoch: 3, train_loss: 1.0055, test_loss: 0.9543, test_f1: 0.5150
 epoch: 4, train_loss: 0.9769, test_loss: 0.9456, test_f1: 0.5073
 epoch: 5, train_loss: 0.9651, test_loss: 0.9327, test_f1: 0.5206
 epoch: 6, train_loss: 0.9359, test_loss: 0.9240, test_f1: 0.5209
 epoch: 7, train_loss: 0.9171, test_loss: 0.9101, test_f1: 0.5438
 epoch: 8, train_loss: 0.9018, test_loss: 0.9275, test_f1: 0.5179
 epoch: 9, train_loss: 0.8872, test_loss: 0.9281, test_f1: 0.5248
 epoch: 10, train_loss: 0.8834, test_loss: 0.9186, test_f1: 0.5437
 epoch: 11, train_loss: 0.8630, test_loss: 0.9088, test_f1: 0.5547
 epoch: 12, train_loss: 0.8606, test_loss: 0.9339, test_f1: 0.5472
 epoch: 13, train_loss: 0.8365, test_loss: 0.9124, test_f1: 0.5843
 epoch: 14, train_loss: 0.8323, test_loss: 0.9165, test_f1: 0.5631
 epoch: 15, train_loss: 0.8165, test_loss: 0.8971, test_f1: 0.6105
 epoch: 16, train_loss: 0.8091, test_loss: 0.8955, test_f1: 0.5654
 epoch: 17, train_loss: 0.7906, test_loss: 0.9075, test_f1: 0.5751
 epoch: 18, train_loss: 0.8012, test_loss: 0.9361, test_f1: 0.5602
 epoch: 19, train_loss: 0.7812, test_loss: 0.9246, test_f1: 0.5770
 epoch: 20, train_loss: 0.7753, test_loss: 0.9262, test_f1: 0.5721
 epoch: 21, train_loss: 0.7636, test_loss: 0.9234, test_f1: 0.5679
 epoch: 22, train_loss: 0.7650, test_loss: 0.8995, test_f1: 0.5774
 epoch: 23, train_loss: 0.7685, test_loss: 0.9136, test_f1: 0.5831
 epoch: 24, train_loss: 0.7506, test_loss: 0.9420, test_f1: 0.5774
 epoch: 25, train_loss: 0.7495, test_loss: 0.9125, test_f1: 0.5730
 epoch: 26, train_loss: 0.7338, test_loss: 0.9734, test_f1: 0.5691
 epoch: 27, train_loss: 0.7324, test_loss: 0.9516, test_f1: 0.5773
 epoch: 28, train_loss: 0.7280, test_loss: 0.9177, test_f1: 0.5861
 epoch: 29, train_loss: 0.7212, test_loss: 0.9138, test_f1: 0.5843
 epoch: 30, train_loss: 0.7113, test_loss: 0.9246, test_f1: 0.5829
 epoch: 31, train_loss: 0.7025, test_loss: 0.9396, test_f1: 0.5927
 epoch: 32, train_loss: 0.7021, test_loss: 0.9266, test_f1: 0.6119
 epoch: 33, train_loss: 0.6885, test_loss: 0.9209, test_f1: 0.6161
 epoch: 34, train_loss: 0.6895, test_loss: 0.9291, test_f1: 0.6002
 epoch: 35, train_loss: 0.6870, test_loss: 0.9415, test_f1: 0.5965
 epoch: 36, train_loss: 0.6739, test_loss: 0.9129, test_f1: 0.5973
 epoch: 37, train_loss: 0.6645, test_loss: 0.9551, test_f1: 0.5683
 epoch: 38, train_loss: 0.6628, test_loss: 0.9642, test_f1: 0.6005
 epoch: 39, train_loss: 0.6595, test_loss: 0.9597, test_f1: 0.5948
 epoch: 40, train_loss: 0.6548, test_loss: 0.9478, test_f1: 0.5909
 epoch: 41, train_loss: 0.6457, test_loss: 0.9320, test_f1: 0.6177
 epoch: 42, train_loss: 0.6450, test_loss: 0.9365, test_f1: 0.6096
 epoch: 43, train_loss: 0.6333, test_loss: 0.9801, test_f1: 0.5900
 epoch: 44, train_loss: 0.6336, test_loss: 0.9528, test_f1: 0.6329
 epoch: 45, train_loss: 0.6397, test_loss: 0.9971, test_f1: 0.5868
 epoch: 46, train_loss: 0.6126, test_loss: 1.0310, test_f1: 0.5959
 epoch: 47, train_loss: 0.6073, test_loss: 0.9595, test_f1: 0.6161
 epoch: 48, train_loss: 0.6116, test_loss: 0.9281, test_f1: 0.6265
 epoch: 49, train_loss: 0.6013, test_loss: 0.9908, test_f1: 0.6332
 epoch: 50, train_loss: 0.6013, test_loss: 0.9643, test_f1: 0.6234
 epoch: 51, train_loss: 0.5867, test_loss: 0.9809, test_f1: 0.6179
 epoch: 52, train_loss: 0.5765, test_loss: 0.9694, test_f1: 0.6404
 epoch: 53, train_loss: 0.5643, test_loss: 0.9656, test_f1: 0.6398
 epoch: 54, train_loss: 0.5489, test_loss: 0.9536, test_f1: 0.6444
 epoch: 55, train_loss: 0.5594, test_loss: 0.9708, test_f1: 0.6306
 epoch: 56, train_loss: 0.5537, test_loss: 0.9596, test_f1: 0.6461
 epoch: 57, train_loss: 0.5494, test_loss: 0.9997, test_f1: 0.6273
 epoch: 58, train_loss: 0.5508, test_loss: 1.0198, test_f1: 0.6095
 epoch: 59, train_loss: 0.5277, test_loss: 1.0053, test_f1: 0.6193
 epoch: 60, train_loss: 0.5302, test_loss: 1.0019, test_f1: 0.6208
 epoch: 61, train_loss: 0.5396, test_loss: 0.9948, test_f1: 0.6472
 epoch: 62, train_loss: 0.5292, test_loss: 1.0194, test_f1: 0.6262
 epoch: 63, train_loss: 0.5313, test_loss: 1.0235, test_f1: 0.6264
 epoch: 64, train_loss: 0.5142, test_loss: 1.0191, test_f1: 0.6483
 epoch: 65, train_loss: 0.5104, test_loss: 1.0101, test_f1: 0.6274
 epoch: 66, train_loss: 0.5299, test_loss: 1.0304, test_f1: 0.6339
 epoch: 67, train_loss: 0.5138, test_loss: 1.0561, test_f1: 0.6257
 epoch: 68, train_loss: 0.5076, test_loss: 1.0745, test_f1: 0.6334
 epoch: 69, train_loss: 0.5105, test_loss: 1.0033, test_f1: 0.6263
 epoch: 70, train_loss: 0.4965, test_loss: 1.0252, test_f1: 0.6462
 epoch: 71, train_loss: 0.4962, test_loss: 1.0212, test_f1: 0.6408
 epoch: 72, train_loss: 0.5027, test_loss: 1.0283, test_f1: 0.6473
 epoch: 73, train_loss: 0.5071, test_loss: 1.0066, test_f1: 0.6797
 epoch: 74, train_loss: 0.4870, test_loss: 1.0457, test_f1: 0.6427
 epoch: 75, train_loss: 0.5045, test_loss: 1.0755, test_f1: 0.6254
 epoch: 76, train_loss: 0.4923, test_loss: 1.0075, test_f1: 0.6464
 epoch: 77, train_loss: 0.4783, test_loss: 1.0575, test_f1: 0.6335
 epoch: 78, train_loss: 0.4646, test_loss: 1.0543, test_f1: 0.6448
 epoch: 79, train_loss: 0.4661, test_loss: 1.0825, test_f1: 0.6322
 epoch: 80, train_loss: 0.4772, test_loss: 1.0988, test_f1: 0.6379
 epoch: 81, train_loss: 0.4652, test_loss: 1.0655, test_f1: 0.6569
 epoch: 82, train_loss: 0.4763, test_loss: 1.0771, test_f1: 0.6479
 epoch: 83, train_loss: 0.4547, test_loss: 1.1004, test_f1: 0.6479
 epoch: 84, train_loss: 0.4493, test_loss: 1.1081, test_f1: 0.6495
 epoch: 85, train_loss: 0.4570, test_loss: 1.0556, test_f1: 0.6610
 epoch: 86, train_loss: 0.4633, test_loss: 1.0895, test_f1: 0.6429
 epoch: 87, train_loss: 0.4579, test_loss: 1.1723, test_f1: 0.6476
 epoch: 88, train_loss: 0.4473, test_loss: 1.1319, test_f1: 0.6606
 epoch: 89, train_loss: 0.4450, test_loss: 1.1092, test_f1: 0.6499
 epoch: 90, train_loss: 0.4578, test_loss: 1.1513, test_f1: 0.6641
 epoch: 91, train_loss: 0.4504, test_loss: 1.1371, test_f1: 0.6432
 epoch: 92, train_loss: 0.4469, test_loss: 1.1481, test_f1: 0.6424
 epoch: 93, train_loss: 0.4311, test_loss: 1.1520, test_f1: 0.6383
 epoch: 94, train_loss: 0.4329, test_loss: 1.1654, test_f1: 0.6619
 epoch: 95, train_loss: 0.4394, test_loss: 1.1460, test_f1: 0.6646
 epoch: 96, train_loss: 0.4388, test_loss: 1.1453, test_f1: 0.6620
 epoch: 97, train_loss: 0.4325, test_loss: 1.1067, test_f1: 0.6483
 epoch: 98, train_loss: 0.4285, test_loss: 1.1729, test_f1: 0.6496
 epoch: 99, train_loss: 0.4316, test_loss: 1.1279, test_f1: 0.6473
##################ITERATION #4 ****************************************
 epoch: 0, train_loss: 1.1971, test_loss: 1.1126, test_f1: 0.4507
 epoch: 1, train_loss: 1.0709, test_loss: 0.9978, test_f1: 0.4632
 epoch: 2, train_loss: 1.0339, test_loss: 0.9666, test_f1: 0.4792
 epoch: 3, train_loss: 0.9897, test_loss: 0.9464, test_f1: 0.5091
 epoch: 4, train_loss: 0.9638, test_loss: 0.9072, test_f1: 0.5392
 epoch: 5, train_loss: 0.9424, test_loss: 0.9250, test_f1: 0.5484
 epoch: 6, train_loss: 0.9221, test_loss: 0.8909, test_f1: 0.5385
 epoch: 7, train_loss: 0.9041, test_loss: 0.8972, test_f1: 0.5624
 epoch: 8, train_loss: 0.9010, test_loss: 0.8873, test_f1: 0.5551
 epoch: 9, train_loss: 0.8840, test_loss: 0.9303, test_f1: 0.5383
 epoch: 10, train_loss: 0.8628, test_loss: 0.8930, test_f1: 0.5824
 epoch: 11, train_loss: 0.8624, test_loss: 0.9309, test_f1: 0.5488
 epoch: 12, train_loss: 0.8473, test_loss: 0.9165, test_f1: 0.5618
 epoch: 13, train_loss: 0.8317, test_loss: 0.9049, test_f1: 0.5857
 epoch: 14, train_loss: 0.8242, test_loss: 0.8808, test_f1: 0.5700
 epoch: 15, train_loss: 0.8150, test_loss: 0.9015, test_f1: 0.5954
 epoch: 16, train_loss: 0.8263, test_loss: 0.8958, test_f1: 0.5709
 epoch: 17, train_loss: 0.8104, test_loss: 0.9073, test_f1: 0.5938
 epoch: 18, train_loss: 0.7997, test_loss: 0.8940, test_f1: 0.5882
 epoch: 19, train_loss: 0.7750, test_loss: 0.9010, test_f1: 0.5895
 epoch: 20, train_loss: 0.7814, test_loss: 0.8967, test_f1: 0.5746
 epoch: 21, train_loss: 0.7675, test_loss: 0.8938, test_f1: 0.5951
 epoch: 22, train_loss: 0.7628, test_loss: 0.8996, test_f1: 0.5954
 epoch: 23, train_loss: 0.7597, test_loss: 0.8821, test_f1: 0.6149
 epoch: 24, train_loss: 0.7488, test_loss: 0.8898, test_f1: 0.6248
 epoch: 25, train_loss: 0.7427, test_loss: 0.9000, test_f1: 0.5969
 epoch: 26, train_loss: 0.7394, test_loss: 0.8957, test_f1: 0.5963
 epoch: 27, train_loss: 0.7336, test_loss: 0.9055, test_f1: 0.5946
 epoch: 28, train_loss: 0.7298, test_loss: 0.9106, test_f1: 0.6141
 epoch: 29, train_loss: 0.7281, test_loss: 0.9016, test_f1: 0.6242
 epoch: 30, train_loss: 0.7060, test_loss: 0.8829, test_f1: 0.6085
 epoch: 31, train_loss: 0.6963, test_loss: 0.8861, test_f1: 0.6309
 epoch: 32, train_loss: 0.6951, test_loss: 0.8855, test_f1: 0.6480
 epoch: 33, train_loss: 0.6865, test_loss: 0.8872, test_f1: 0.6129
 epoch: 34, train_loss: 0.6790, test_loss: 0.8930, test_f1: 0.6446
 epoch: 35, train_loss: 0.6836, test_loss: 0.8864, test_f1: 0.6084
 epoch: 36, train_loss: 0.6781, test_loss: 0.9007, test_f1: 0.6184
 epoch: 37, train_loss: 0.6682, test_loss: 0.9361, test_f1: 0.6431
 epoch: 38, train_loss: 0.6562, test_loss: 0.8884, test_f1: 0.6487
 epoch: 39, train_loss: 0.6542, test_loss: 0.9006, test_f1: 0.6206
 epoch: 40, train_loss: 0.6475, test_loss: 0.9076, test_f1: 0.6273
 epoch: 41, train_loss: 0.6453, test_loss: 0.8960, test_f1: 0.6457
 epoch: 42, train_loss: 0.6501, test_loss: 0.8932, test_f1: 0.6390
 epoch: 43, train_loss: 0.6314, test_loss: 0.9000, test_f1: 0.6242
 epoch: 44, train_loss: 0.6340, test_loss: 0.8902, test_f1: 0.6329
 epoch: 45, train_loss: 0.6270, test_loss: 0.9290, test_f1: 0.6328
 epoch: 46, train_loss: 0.6176, test_loss: 0.9156, test_f1: 0.6701
 epoch: 47, train_loss: 0.6083, test_loss: 0.9173, test_f1: 0.6567
 epoch: 48, train_loss: 0.6143, test_loss: 0.9232, test_f1: 0.6445
 epoch: 49, train_loss: 0.5988, test_loss: 0.9156, test_f1: 0.6324
 epoch: 50, train_loss: 0.5908, test_loss: 0.9318, test_f1: 0.6400
 epoch: 51, train_loss: 0.5716, test_loss: 0.9218, test_f1: 0.6389
 epoch: 52, train_loss: 0.5627, test_loss: 0.9387, test_f1: 0.6346
 epoch: 53, train_loss: 0.5585, test_loss: 0.9616, test_f1: 0.6386
 epoch: 54, train_loss: 0.5492, test_loss: 0.9459, test_f1: 0.6431
 epoch: 55, train_loss: 0.5514, test_loss: 0.9310, test_f1: 0.6599
 epoch: 56, train_loss: 0.5330, test_loss: 0.9253, test_f1: 0.6728
 epoch: 57, train_loss: 0.5283, test_loss: 0.9561, test_f1: 0.6386
 epoch: 58, train_loss: 0.5412, test_loss: 0.9426, test_f1: 0.6424
 epoch: 59, train_loss: 0.5315, test_loss: 0.9575, test_f1: 0.6384
 epoch: 60, train_loss: 0.5267, test_loss: 0.9715, test_f1: 0.6554
 epoch: 61, train_loss: 0.5353, test_loss: 0.9611, test_f1: 0.6602
 epoch: 62, train_loss: 0.5436, test_loss: 0.9600, test_f1: 0.6645
 epoch: 63, train_loss: 0.5186, test_loss: 0.9753, test_f1: 0.6451
 epoch: 64, train_loss: 0.5161, test_loss: 0.9904, test_f1: 0.6369
 epoch: 65, train_loss: 0.5152, test_loss: 0.9880, test_f1: 0.6486
 epoch: 66, train_loss: 0.5119, test_loss: 0.9772, test_f1: 0.6556
 epoch: 67, train_loss: 0.5200, test_loss: 0.9637, test_f1: 0.6623
 epoch: 68, train_loss: 0.5153, test_loss: 0.9976, test_f1: 0.6591
 epoch: 69, train_loss: 0.5216, test_loss: 0.9973, test_f1: 0.6611
 epoch: 70, train_loss: 0.5069, test_loss: 0.9998, test_f1: 0.6559
 epoch: 71, train_loss: 0.5081, test_loss: 1.0515, test_f1: 0.6472
 epoch: 72, train_loss: 0.4941, test_loss: 0.9852, test_f1: 0.6556
 epoch: 73, train_loss: 0.4891, test_loss: 1.0189, test_f1: 0.6683
 epoch: 74, train_loss: 0.4825, test_loss: 1.0407, test_f1: 0.6628
 epoch: 75, train_loss: 0.4959, test_loss: 1.0200, test_f1: 0.6686
 epoch: 76, train_loss: 0.4778, test_loss: 1.0067, test_f1: 0.6507
 epoch: 77, train_loss: 0.4774, test_loss: 1.0079, test_f1: 0.6550
 epoch: 78, train_loss: 0.4854, test_loss: 0.9666, test_f1: 0.6764
 epoch: 79, train_loss: 0.4762, test_loss: 0.9918, test_f1: 0.6570
 epoch: 80, train_loss: 0.4657, test_loss: 1.0359, test_f1: 0.6554
 epoch: 81, train_loss: 0.4651, test_loss: 1.0212, test_f1: 0.6713
 epoch: 82, train_loss: 0.4626, test_loss: 1.0588, test_f1: 0.6574
 epoch: 83, train_loss: 0.4791, test_loss: 1.0241, test_f1: 0.6673
 epoch: 84, train_loss: 0.4677, test_loss: 1.0947, test_f1: 0.6445
 epoch: 85, train_loss: 0.4647, test_loss: 1.0342, test_f1: 0.6568
 epoch: 86, train_loss: 0.4644, test_loss: 1.0569, test_f1: 0.6616
 epoch: 87, train_loss: 0.4636, test_loss: 1.0511, test_f1: 0.6637
 epoch: 88, train_loss: 0.4561, test_loss: 1.0439, test_f1: 0.6766
 epoch: 89, train_loss: 0.4478, test_loss: 1.0426, test_f1: 0.6683
 epoch: 90, train_loss: 0.4594, test_loss: 1.0948, test_f1: 0.6486
 epoch: 91, train_loss: 0.4533, test_loss: 1.0686, test_f1: 0.6634
 epoch: 92, train_loss: 0.4459, test_loss: 1.1238, test_f1: 0.6627
 epoch: 93, train_loss: 0.4500, test_loss: 1.0960, test_f1: 0.6654
 epoch: 94, train_loss: 0.4350, test_loss: 1.0687, test_f1: 0.6571
 epoch: 95, train_loss: 0.4335, test_loss: 1.1063, test_f1: 0.6579
 epoch: 96, train_loss: 0.4437, test_loss: 1.1040, test_f1: 0.6548
 epoch: 97, train_loss: 0.4385, test_loss: 1.0707, test_f1: 0.6785
 epoch: 98, train_loss: 0.4390, test_loss: 1.0641, test_f1: 0.6835
 epoch: 99, train_loss: 0.4228, test_loss: 1.0804, test_f1: 0.6655
##################ITERATION #5 ****************************************
 epoch: 0, train_loss: 1.2181, test_loss: 1.1536, test_f1: 0.4315
 epoch: 1, train_loss: 1.0720, test_loss: 0.9790, test_f1: 0.5063
 epoch: 2, train_loss: 1.0146, test_loss: 0.9496, test_f1: 0.5090
 epoch: 3, train_loss: 0.9907, test_loss: 0.9298, test_f1: 0.4996
 epoch: 4, train_loss: 0.9627, test_loss: 0.9339, test_f1: 0.5138
 epoch: 5, train_loss: 0.9453, test_loss: 0.9252, test_f1: 0.5229
 epoch: 6, train_loss: 0.9300, test_loss: 0.9139, test_f1: 0.5342
 epoch: 7, train_loss: 0.9154, test_loss: 0.8994, test_f1: 0.5242
 epoch: 8, train_loss: 0.8992, test_loss: 0.8976, test_f1: 0.5636
 epoch: 9, train_loss: 0.8821, test_loss: 0.8809, test_f1: 0.5478
 epoch: 10, train_loss: 0.8746, test_loss: 0.9048, test_f1: 0.5392
 epoch: 11, train_loss: 0.8694, test_loss: 0.8787, test_f1: 0.5589
 epoch: 12, train_loss: 0.8556, test_loss: 0.8922, test_f1: 0.5640
 epoch: 13, train_loss: 0.8439, test_loss: 0.8736, test_f1: 0.5941
 epoch: 14, train_loss: 0.8156, test_loss: 0.8843, test_f1: 0.5612
 epoch: 15, train_loss: 0.8139, test_loss: 0.8757, test_f1: 0.5795
 epoch: 16, train_loss: 0.8108, test_loss: 0.8816, test_f1: 0.5908
 epoch: 17, train_loss: 0.7995, test_loss: 0.8754, test_f1: 0.5860
 epoch: 18, train_loss: 0.7860, test_loss: 0.8657, test_f1: 0.5836
 epoch: 19, train_loss: 0.7858, test_loss: 0.8675, test_f1: 0.5931
 epoch: 20, train_loss: 0.7769, test_loss: 0.8609, test_f1: 0.6068
 epoch: 21, train_loss: 0.7698, test_loss: 0.9178, test_f1: 0.5795
 epoch: 22, train_loss: 0.7659, test_loss: 0.8749, test_f1: 0.6081
 epoch: 23, train_loss: 0.7540, test_loss: 0.8699, test_f1: 0.6066
 epoch: 24, train_loss: 0.7398, test_loss: 0.8932, test_f1: 0.6003
 epoch: 25, train_loss: 0.7315, test_loss: 0.8757, test_f1: 0.5992
 epoch: 26, train_loss: 0.7219, test_loss: 0.9176, test_f1: 0.6032
 epoch: 27, train_loss: 0.7228, test_loss: 0.8916, test_f1: 0.6362
 epoch: 28, train_loss: 0.7088, test_loss: 0.9121, test_f1: 0.5981
 epoch: 29, train_loss: 0.7070, test_loss: 0.9208, test_f1: 0.6183
 epoch: 30, train_loss: 0.7066, test_loss: 0.9123, test_f1: 0.6116
 epoch: 31, train_loss: 0.6983, test_loss: 0.8912, test_f1: 0.6146
 epoch: 32, train_loss: 0.6878, test_loss: 0.8840, test_f1: 0.6133
 epoch: 33, train_loss: 0.6963, test_loss: 0.9159, test_f1: 0.6098
 epoch: 34, train_loss: 0.6687, test_loss: 0.8986, test_f1: 0.6309
 epoch: 35, train_loss: 0.6603, test_loss: 0.9130, test_f1: 0.6192
 epoch: 36, train_loss: 0.6644, test_loss: 0.9507, test_f1: 0.6328
 epoch: 37, train_loss: 0.6714, test_loss: 0.8927, test_f1: 0.6358
 epoch: 38, train_loss: 0.6524, test_loss: 0.9228, test_f1: 0.6329
 epoch: 39, train_loss: 0.6514, test_loss: 0.9232, test_f1: 0.6198
 epoch: 40, train_loss: 0.6352, test_loss: 0.9068, test_f1: 0.6431
 epoch: 41, train_loss: 0.6444, test_loss: 0.9333, test_f1: 0.6442
 epoch: 42, train_loss: 0.6255, test_loss: 0.9446, test_f1: 0.6508
 epoch: 43, train_loss: 0.6226, test_loss: 0.9307, test_f1: 0.6588
 epoch: 44, train_loss: 0.6185, test_loss: 0.9862, test_f1: 0.6343
 epoch: 45, train_loss: 0.6296, test_loss: 0.9806, test_f1: 0.6343
 epoch: 46, train_loss: 0.6039, test_loss: 0.9683, test_f1: 0.6394
 epoch: 47, train_loss: 0.6099, test_loss: 0.9332, test_f1: 0.6584
 epoch: 48, train_loss: 0.5996, test_loss: 0.9429, test_f1: 0.6427
 epoch: 49, train_loss: 0.5992, test_loss: 0.9833, test_f1: 0.6508
 epoch: 50, train_loss: 0.5816, test_loss: 0.9825, test_f1: 0.6271
 epoch: 51, train_loss: 0.5860, test_loss: 0.9515, test_f1: 0.6521
 epoch: 52, train_loss: 0.5569, test_loss: 0.9666, test_f1: 0.6555
 epoch: 53, train_loss: 0.5601, test_loss: 0.9687, test_f1: 0.6502
 epoch: 54, train_loss: 0.5452, test_loss: 0.9666, test_f1: 0.6455
 epoch: 55, train_loss: 0.5388, test_loss: 0.9909, test_f1: 0.6542
 epoch: 56, train_loss: 0.5509, test_loss: 1.0132, test_f1: 0.6410
 epoch: 57, train_loss: 0.5443, test_loss: 0.9871, test_f1: 0.6565
 epoch: 58, train_loss: 0.5343, test_loss: 0.9849, test_f1: 0.6572
 epoch: 59, train_loss: 0.5172, test_loss: 0.9977, test_f1: 0.6527
 epoch: 60, train_loss: 0.5217, test_loss: 0.9707, test_f1: 0.6560
 epoch: 61, train_loss: 0.5345, test_loss: 0.9760, test_f1: 0.6581
 epoch: 62, train_loss: 0.5243, test_loss: 1.0031, test_f1: 0.6632
 epoch: 63, train_loss: 0.5248, test_loss: 1.0423, test_f1: 0.6528
 epoch: 64, train_loss: 0.5161, test_loss: 1.0072, test_f1: 0.6631
 epoch: 65, train_loss: 0.5124, test_loss: 1.0207, test_f1: 0.6666
 epoch: 66, train_loss: 0.5215, test_loss: 1.0204, test_f1: 0.6583
 epoch: 67, train_loss: 0.5100, test_loss: 1.0340, test_f1: 0.6605
 epoch: 68, train_loss: 0.5154, test_loss: 1.0348, test_f1: 0.6574
 epoch: 69, train_loss: 0.4999, test_loss: 1.0251, test_f1: 0.6548
 epoch: 70, train_loss: 0.4891, test_loss: 1.0448, test_f1: 0.6566
 epoch: 71, train_loss: 0.4906, test_loss: 1.0484, test_f1: 0.6658
 epoch: 72, train_loss: 0.4852, test_loss: 1.0518, test_f1: 0.6525
 epoch: 73, train_loss: 0.4907, test_loss: 1.0365, test_f1: 0.6636
 epoch: 74, train_loss: 0.5037, test_loss: 1.0489, test_f1: 0.6708
 epoch: 75, train_loss: 0.4813, test_loss: 1.0401, test_f1: 0.6783
 epoch: 76, train_loss: 0.4911, test_loss: 1.0654, test_f1: 0.6613
 epoch: 77, train_loss: 0.4930, test_loss: 1.0643, test_f1: 0.6811
 epoch: 78, train_loss: 0.4834, test_loss: 1.0765, test_f1: 0.6496
 epoch: 79, train_loss: 0.4674, test_loss: 1.0852, test_f1: 0.6616
 epoch: 80, train_loss: 0.4620, test_loss: 1.0774, test_f1: 0.6616
 epoch: 81, train_loss: 0.4717, test_loss: 1.0952, test_f1: 0.6592
 epoch: 82, train_loss: 0.4709, test_loss: 1.0979, test_f1: 0.6617
 epoch: 83, train_loss: 0.4661, test_loss: 1.0993, test_f1: 0.6429
 epoch: 84, train_loss: 0.4672, test_loss: 1.1174, test_f1: 0.6464
 epoch: 85, train_loss: 0.4645, test_loss: 1.1076, test_f1: 0.6512
 epoch: 86, train_loss: 0.4591, test_loss: 1.1107, test_f1: 0.6534
 epoch: 87, train_loss: 0.4583, test_loss: 1.0828, test_f1: 0.6836
 epoch: 88, train_loss: 0.4548, test_loss: 1.1220, test_f1: 0.6567
 epoch: 89, train_loss: 0.4472, test_loss: 1.1098, test_f1: 0.6658
 epoch: 90, train_loss: 0.4577, test_loss: 1.1170, test_f1: 0.6585
 epoch: 91, train_loss: 0.4446, test_loss: 1.0806, test_f1: 0.6779
 epoch: 92, train_loss: 0.4345, test_loss: 1.1181, test_f1: 0.6656
 epoch: 93, train_loss: 0.4398, test_loss: 1.1160, test_f1: 0.6585
 epoch: 94, train_loss: 0.4374, test_loss: 1.1072, test_f1: 0.6807
 epoch: 95, train_loss: 0.4337, test_loss: 1.1119, test_f1: 0.6595
 epoch: 96, train_loss: 0.4348, test_loss: 1.1271, test_f1: 0.6714
 epoch: 97, train_loss: 0.4325, test_loss: 1.1861, test_f1: 0.6640
 epoch: 98, train_loss: 0.4330, test_loss: 1.1504, test_f1: 0.6671
 epoch: 99, train_loss: 0.4292, test_loss: 1.1462, test_f1: 0.6652
##################ITERATION #6 ****************************************
 epoch: 0, train_loss: 1.2361, test_loss: 1.2197, test_f1: 0.3821
 epoch: 1, train_loss: 1.1157, test_loss: 0.9936, test_f1: 0.5176
 epoch: 2, train_loss: 1.0538, test_loss: 0.9774, test_f1: 0.5219
 epoch: 3, train_loss: 1.0173, test_loss: 0.9475, test_f1: 0.5277
 epoch: 4, train_loss: 0.9931, test_loss: 0.9325, test_f1: 0.5371
 epoch: 5, train_loss: 0.9835, test_loss: 0.9407, test_f1: 0.5348
 epoch: 6, train_loss: 0.9653, test_loss: 0.9140, test_f1: 0.5323
 epoch: 7, train_loss: 0.9406, test_loss: 0.9146, test_f1: 0.5521
 epoch: 8, train_loss: 0.9267, test_loss: 0.9188, test_f1: 0.5519
 epoch: 9, train_loss: 0.9216, test_loss: 0.9250, test_f1: 0.5631
 epoch: 10, train_loss: 0.9069, test_loss: 0.8908, test_f1: 0.5475
 epoch: 11, train_loss: 0.8935, test_loss: 0.9067, test_f1: 0.5743
 epoch: 12, train_loss: 0.8848, test_loss: 0.8990, test_f1: 0.5628
 epoch: 13, train_loss: 0.8702, test_loss: 0.8795, test_f1: 0.5630
 epoch: 14, train_loss: 0.8576, test_loss: 0.9379, test_f1: 0.5589
 epoch: 15, train_loss: 0.8515, test_loss: 0.8971, test_f1: 0.5560
 epoch: 16, train_loss: 0.8420, test_loss: 0.9307, test_f1: 0.5533
 epoch: 17, train_loss: 0.8366, test_loss: 0.8959, test_f1: 0.5552
 epoch: 18, train_loss: 0.8201, test_loss: 0.8989, test_f1: 0.5530
 epoch: 19, train_loss: 0.8226, test_loss: 0.8834, test_f1: 0.5730
 epoch: 20, train_loss: 0.8035, test_loss: 0.9389, test_f1: 0.5444
 epoch: 21, train_loss: 0.8028, test_loss: 0.9090, test_f1: 0.5848
 epoch: 22, train_loss: 0.7945, test_loss: 0.8915, test_f1: 0.5670
 epoch: 23, train_loss: 0.7905, test_loss: 0.9280, test_f1: 0.5786
 epoch: 24, train_loss: 0.7815, test_loss: 0.8937, test_f1: 0.5746
 epoch: 25, train_loss: 0.7626, test_loss: 0.9100, test_f1: 0.5702
 epoch: 26, train_loss: 0.7635, test_loss: 0.9641, test_f1: 0.5369
 epoch: 27, train_loss: 0.7625, test_loss: 0.9078, test_f1: 0.5817
 epoch: 28, train_loss: 0.7496, test_loss: 0.8800, test_f1: 0.5952
 epoch: 29, train_loss: 0.7484, test_loss: 0.8723, test_f1: 0.6066
 epoch: 30, train_loss: 0.7553, test_loss: 0.9272, test_f1: 0.5769
 epoch: 31, train_loss: 0.7391, test_loss: 0.9403, test_f1: 0.5901
 epoch: 32, train_loss: 0.7456, test_loss: 0.9228, test_f1: 0.6017
 epoch: 33, train_loss: 0.7298, test_loss: 0.9381, test_f1: 0.5887
 epoch: 34, train_loss: 0.7306, test_loss: 0.9399, test_f1: 0.6078
 epoch: 35, train_loss: 0.7077, test_loss: 0.9353, test_f1: 0.5739
 epoch: 36, train_loss: 0.7215, test_loss: 0.9603, test_f1: 0.5887
 epoch: 37, train_loss: 0.6966, test_loss: 0.9118, test_f1: 0.6143
 epoch: 38, train_loss: 0.6956, test_loss: 0.9687, test_f1: 0.5925
 epoch: 39, train_loss: 0.6892, test_loss: 0.9634, test_f1: 0.5819
 epoch: 40, train_loss: 0.6924, test_loss: 0.9368, test_f1: 0.6115
 epoch: 41, train_loss: 0.6788, test_loss: 0.9327, test_f1: 0.6068
 epoch: 42, train_loss: 0.6938, test_loss: 0.9765, test_f1: 0.5855
 epoch: 43, train_loss: 0.6685, test_loss: 0.9278, test_f1: 0.6130
 epoch: 44, train_loss: 0.6635, test_loss: 0.9563, test_f1: 0.6140
 epoch: 45, train_loss: 0.6711, test_loss: 0.9503, test_f1: 0.5985
 epoch: 46, train_loss: 0.6534, test_loss: 0.9535, test_f1: 0.6108
 epoch: 47, train_loss: 0.6561, test_loss: 0.9457, test_f1: 0.6046
 epoch: 48, train_loss: 0.6535, test_loss: 0.9274, test_f1: 0.6174
 epoch: 49, train_loss: 0.6368, test_loss: 0.9747, test_f1: 0.6048
 epoch: 50, train_loss: 0.6437, test_loss: 0.9592, test_f1: 0.5975
 epoch: 51, train_loss: 0.6245, test_loss: 0.9528, test_f1: 0.6210
 epoch: 52, train_loss: 0.6125, test_loss: 0.9622, test_f1: 0.6146
 epoch: 53, train_loss: 0.6144, test_loss: 0.9677, test_f1: 0.6157
 epoch: 54, train_loss: 0.6081, test_loss: 0.9650, test_f1: 0.6235
 epoch: 55, train_loss: 0.5986, test_loss: 0.9389, test_f1: 0.6179
 epoch: 56, train_loss: 0.6043, test_loss: 1.0048, test_f1: 0.6042
 epoch: 57, train_loss: 0.5909, test_loss: 0.9883, test_f1: 0.6062
 epoch: 58, train_loss: 0.5867, test_loss: 0.9838, test_f1: 0.6161
 epoch: 59, train_loss: 0.5816, test_loss: 0.9879, test_f1: 0.6216
 epoch: 60, train_loss: 0.5799, test_loss: 0.9930, test_f1: 0.6035
 epoch: 61, train_loss: 0.5807, test_loss: 0.9842, test_f1: 0.6227
 epoch: 62, train_loss: 0.5789, test_loss: 0.9850, test_f1: 0.6099
 epoch: 63, train_loss: 0.5725, test_loss: 1.0082, test_f1: 0.6234
 epoch: 64, train_loss: 0.5624, test_loss: 0.9926, test_f1: 0.6142
 epoch: 65, train_loss: 0.5640, test_loss: 1.0094, test_f1: 0.6209
 epoch: 66, train_loss: 0.5649, test_loss: 0.9969, test_f1: 0.6298
 epoch: 67, train_loss: 0.5567, test_loss: 1.0022, test_f1: 0.6165
 epoch: 68, train_loss: 0.5590, test_loss: 1.0087, test_f1: 0.6129
 epoch: 69, train_loss: 0.5596, test_loss: 1.0161, test_f1: 0.6091
 epoch: 70, train_loss: 0.5430, test_loss: 1.0443, test_f1: 0.6135
 epoch: 71, train_loss: 0.5612, test_loss: 1.0193, test_f1: 0.6199
 epoch: 72, train_loss: 0.5478, test_loss: 1.0558, test_f1: 0.6114
 epoch: 73, train_loss: 0.5387, test_loss: 1.0403, test_f1: 0.6096
 epoch: 74, train_loss: 0.5391, test_loss: 1.0292, test_f1: 0.6267
 epoch: 75, train_loss: 0.5579, test_loss: 1.0444, test_f1: 0.6225
 epoch: 76, train_loss: 0.5340, test_loss: 1.0322, test_f1: 0.6294
 epoch: 77, train_loss: 0.5377, test_loss: 1.0531, test_f1: 0.6180
 epoch: 78, train_loss: 0.5327, test_loss: 1.0627, test_f1: 0.6140
 epoch: 79, train_loss: 0.5228, test_loss: 1.0591, test_f1: 0.6268
 epoch: 80, train_loss: 0.5256, test_loss: 1.0595, test_f1: 0.6210
 epoch: 81, train_loss: 0.5233, test_loss: 1.0794, test_f1: 0.6116
 epoch: 82, train_loss: 0.5265, test_loss: 1.0646, test_f1: 0.6191
 epoch: 83, train_loss: 0.5159, test_loss: 1.0806, test_f1: 0.6055
 epoch: 84, train_loss: 0.5019, test_loss: 1.0692, test_f1: 0.6306
 epoch: 85, train_loss: 0.5152, test_loss: 1.0778, test_f1: 0.6133
 epoch: 86, train_loss: 0.5146, test_loss: 1.0871, test_f1: 0.6255
 epoch: 87, train_loss: 0.5095, test_loss: 1.0832, test_f1: 0.6038
 epoch: 88, train_loss: 0.4883, test_loss: 1.0607, test_f1: 0.6052
 epoch: 89, train_loss: 0.4918, test_loss: 1.1088, test_f1: 0.6179
 epoch: 90, train_loss: 0.5010, test_loss: 1.0840, test_f1: 0.6180
 epoch: 91, train_loss: 0.5020, test_loss: 1.1037, test_f1: 0.6201
 epoch: 92, train_loss: 0.4937, test_loss: 1.1100, test_f1: 0.6286
 epoch: 93, train_loss: 0.4744, test_loss: 1.0916, test_f1: 0.6152
 epoch: 94, train_loss: 0.4813, test_loss: 1.1370, test_f1: 0.6234
 epoch: 95, train_loss: 0.4915, test_loss: 1.1763, test_f1: 0.5928
 epoch: 96, train_loss: 0.4875, test_loss: 1.1365, test_f1: 0.6201
 epoch: 97, train_loss: 0.4894, test_loss: 1.1234, test_f1: 0.6401
 epoch: 98, train_loss: 0.4832, test_loss: 1.1520, test_f1: 0.6267
 epoch: 99, train_loss: 0.4882, test_loss: 1.1493, test_f1: 0.6171
##################ITERATION #7 ****************************************
 epoch: 0, train_loss: 1.2645, test_loss: 1.1582, test_f1: 0.4057
 epoch: 1, train_loss: 1.1022, test_loss: 0.9661, test_f1: 0.5130
 epoch: 2, train_loss: 1.0649, test_loss: 0.9407, test_f1: 0.5191
 epoch: 3, train_loss: 1.0120, test_loss: 0.9295, test_f1: 0.4985
 epoch: 4, train_loss: 1.0011, test_loss: 0.9245, test_f1: 0.4817
 epoch: 5, train_loss: 0.9615, test_loss: 0.9165, test_f1: 0.5293
 epoch: 6, train_loss: 0.9509, test_loss: 0.9127, test_f1: 0.5035
 epoch: 7, train_loss: 0.9322, test_loss: 0.8938, test_f1: 0.5079
 epoch: 8, train_loss: 0.9246, test_loss: 0.8799, test_f1: 0.5265
 epoch: 9, train_loss: 0.8970, test_loss: 0.8849, test_f1: 0.5137
 epoch: 10, train_loss: 0.8799, test_loss: 0.8733, test_f1: 0.5469
 epoch: 11, train_loss: 0.8744, test_loss: 0.8948, test_f1: 0.5466
 epoch: 12, train_loss: 0.8769, test_loss: 0.8819, test_f1: 0.5373
 epoch: 13, train_loss: 0.8582, test_loss: 0.8475, test_f1: 0.5677
 epoch: 14, train_loss: 0.8471, test_loss: 0.8609, test_f1: 0.5543
 epoch: 15, train_loss: 0.8376, test_loss: 0.8469, test_f1: 0.5690
 epoch: 16, train_loss: 0.8431, test_loss: 0.8719, test_f1: 0.5488
 epoch: 17, train_loss: 0.8135, test_loss: 0.8661, test_f1: 0.5694
 epoch: 18, train_loss: 0.8106, test_loss: 0.8692, test_f1: 0.5773
 epoch: 19, train_loss: 0.8142, test_loss: 0.8624, test_f1: 0.5737
 epoch: 20, train_loss: 0.7972, test_loss: 0.8767, test_f1: 0.5557
 epoch: 21, train_loss: 0.7869, test_loss: 0.8572, test_f1: 0.5640
 epoch: 22, train_loss: 0.7835, test_loss: 0.8700, test_f1: 0.5568
 epoch: 23, train_loss: 0.7744, test_loss: 0.8437, test_f1: 0.5688
 epoch: 24, train_loss: 0.7757, test_loss: 0.8415, test_f1: 0.5790
 epoch: 25, train_loss: 0.7628, test_loss: 0.8684, test_f1: 0.5923
 epoch: 26, train_loss: 0.7509, test_loss: 0.8591, test_f1: 0.6026
 epoch: 27, train_loss: 0.7452, test_loss: 0.9189, test_f1: 0.5632
 epoch: 28, train_loss: 0.7542, test_loss: 0.8549, test_f1: 0.5835
 epoch: 29, train_loss: 0.7456, test_loss: 0.8792, test_f1: 0.5765
 epoch: 30, train_loss: 0.7319, test_loss: 0.8857, test_f1: 0.5777
 epoch: 31, train_loss: 0.7289, test_loss: 0.8848, test_f1: 0.6041
 epoch: 32, train_loss: 0.7122, test_loss: 0.8827, test_f1: 0.5957
 epoch: 33, train_loss: 0.7207, test_loss: 0.8813, test_f1: 0.5833
 epoch: 34, train_loss: 0.7192, test_loss: 0.8410, test_f1: 0.6206
 epoch: 35, train_loss: 0.7095, test_loss: 0.8780, test_f1: 0.6192
 epoch: 36, train_loss: 0.6981, test_loss: 0.8879, test_f1: 0.6082
 epoch: 37, train_loss: 0.7025, test_loss: 0.8948, test_f1: 0.6019
 epoch: 38, train_loss: 0.6933, test_loss: 0.8863, test_f1: 0.6023
 epoch: 39, train_loss: 0.6788, test_loss: 0.8975, test_f1: 0.6024
 epoch: 40, train_loss: 0.6670, test_loss: 0.9041, test_f1: 0.6059
 epoch: 41, train_loss: 0.6636, test_loss: 0.9298, test_f1: 0.5990
 epoch: 42, train_loss: 0.6764, test_loss: 0.8928, test_f1: 0.6384
 epoch: 43, train_loss: 0.6645, test_loss: 0.8910, test_f1: 0.6329
 epoch: 44, train_loss: 0.6637, test_loss: 0.9107, test_f1: 0.5926
 epoch: 45, train_loss: 0.6554, test_loss: 0.9461, test_f1: 0.6282
 epoch: 46, train_loss: 0.6433, test_loss: 0.9018, test_f1: 0.6267
 epoch: 47, train_loss: 0.6342, test_loss: 0.9422, test_f1: 0.6252
 epoch: 48, train_loss: 0.6389, test_loss: 0.9588, test_f1: 0.6004
 epoch: 49, train_loss: 0.6192, test_loss: 0.9424, test_f1: 0.6201
 epoch: 50, train_loss: 0.6271, test_loss: 0.9300, test_f1: 0.6465
 epoch: 51, train_loss: 0.6064, test_loss: 0.9049, test_f1: 0.6532
 epoch: 52, train_loss: 0.5840, test_loss: 0.9187, test_f1: 0.6385
 epoch: 53, train_loss: 0.5931, test_loss: 0.9218, test_f1: 0.6369
 epoch: 54, train_loss: 0.5860, test_loss: 0.9351, test_f1: 0.6341
 epoch: 55, train_loss: 0.5917, test_loss: 0.9328, test_f1: 0.6387
 epoch: 56, train_loss: 0.5665, test_loss: 0.9154, test_f1: 0.6468
 epoch: 57, train_loss: 0.5723, test_loss: 0.9291, test_f1: 0.6375
 epoch: 58, train_loss: 0.5515, test_loss: 0.9339, test_f1: 0.6399
 epoch: 59, train_loss: 0.5696, test_loss: 0.9305, test_f1: 0.6278
 epoch: 60, train_loss: 0.5660, test_loss: 0.9332, test_f1: 0.6271
 epoch: 61, train_loss: 0.5653, test_loss: 0.9303, test_f1: 0.6290
 epoch: 62, train_loss: 0.5567, test_loss: 0.9454, test_f1: 0.6268
 epoch: 63, train_loss: 0.5533, test_loss: 0.9663, test_f1: 0.6404
 epoch: 64, train_loss: 0.5499, test_loss: 0.9316, test_f1: 0.6539
 epoch: 65, train_loss: 0.5472, test_loss: 0.9796, test_f1: 0.6219
 epoch: 66, train_loss: 0.5394, test_loss: 0.9467, test_f1: 0.6498
 epoch: 67, train_loss: 0.5458, test_loss: 0.9681, test_f1: 0.6436
 epoch: 68, train_loss: 0.5384, test_loss: 0.9618, test_f1: 0.6369
 epoch: 69, train_loss: 0.5488, test_loss: 0.9522, test_f1: 0.6503
 epoch: 70, train_loss: 0.5294, test_loss: 0.9878, test_f1: 0.6383
 epoch: 71, train_loss: 0.5218, test_loss: 0.9850, test_f1: 0.6308
 epoch: 72, train_loss: 0.5209, test_loss: 0.9634, test_f1: 0.6451
 epoch: 73, train_loss: 0.5271, test_loss: 1.0077, test_f1: 0.6132
 epoch: 74, train_loss: 0.5111, test_loss: 0.9550, test_f1: 0.6432
 epoch: 75, train_loss: 0.5104, test_loss: 0.9933, test_f1: 0.6186
 epoch: 76, train_loss: 0.5177, test_loss: 0.9663, test_f1: 0.6331
 epoch: 77, train_loss: 0.5149, test_loss: 0.9869, test_f1: 0.6338
 epoch: 78, train_loss: 0.5034, test_loss: 1.0046, test_f1: 0.6395
 epoch: 79, train_loss: 0.4986, test_loss: 1.0278, test_f1: 0.6311
 epoch: 80, train_loss: 0.4963, test_loss: 0.9971, test_f1: 0.6315
 epoch: 81, train_loss: 0.4989, test_loss: 0.9844, test_f1: 0.6467
 epoch: 82, train_loss: 0.4916, test_loss: 1.0009, test_f1: 0.6366
 epoch: 83, train_loss: 0.4837, test_loss: 1.0418, test_f1: 0.6462
 epoch: 84, train_loss: 0.4979, test_loss: 0.9986, test_f1: 0.6410
 epoch: 85, train_loss: 0.4826, test_loss: 1.0122, test_f1: 0.6442
 epoch: 86, train_loss: 0.4848, test_loss: 1.0604, test_f1: 0.6391
 epoch: 87, train_loss: 0.4774, test_loss: 1.0090, test_f1: 0.6427
 epoch: 88, train_loss: 0.4746, test_loss: 1.0131, test_f1: 0.6384
 epoch: 89, train_loss: 0.4878, test_loss: 1.0415, test_f1: 0.6393
 epoch: 90, train_loss: 0.4770, test_loss: 1.0279, test_f1: 0.6376
 epoch: 91, train_loss: 0.4705, test_loss: 1.0516, test_f1: 0.6323
 epoch: 92, train_loss: 0.4683, test_loss: 1.0455, test_f1: 0.6618
 epoch: 93, train_loss: 0.4612, test_loss: 1.0246, test_f1: 0.6459
 epoch: 94, train_loss: 0.4741, test_loss: 1.0846, test_f1: 0.6447
 epoch: 95, train_loss: 0.4535, test_loss: 1.0776, test_f1: 0.6506
 epoch: 96, train_loss: 0.4620, test_loss: 1.0764, test_f1: 0.6451
 epoch: 97, train_loss: 0.4555, test_loss: 1.0787, test_f1: 0.6466
 epoch: 98, train_loss: 0.4415, test_loss: 1.0737, test_f1: 0.6419
 epoch: 99, train_loss: 0.4391, test_loss: 1.0737, test_f1: 0.6479
##################ITERATION #8 ****************************************
 epoch: 0, train_loss: 1.2598, test_loss: 1.1461, test_f1: 0.4430
 epoch: 1, train_loss: 1.1108, test_loss: 1.0093, test_f1: 0.4834
 epoch: 2, train_loss: 1.0679, test_loss: 0.9906, test_f1: 0.4714
 epoch: 3, train_loss: 1.0328, test_loss: 0.9808, test_f1: 0.4886
 epoch: 4, train_loss: 1.0151, test_loss: 0.9622, test_f1: 0.5100
 epoch: 5, train_loss: 0.9898, test_loss: 0.9498, test_f1: 0.5171
 epoch: 6, train_loss: 0.9517, test_loss: 0.9616, test_f1: 0.5172
 epoch: 7, train_loss: 0.9438, test_loss: 0.9111, test_f1: 0.5593
 epoch: 8, train_loss: 0.9245, test_loss: 0.9286, test_f1: 0.5418
 epoch: 9, train_loss: 0.9167, test_loss: 0.9621, test_f1: 0.5104
 epoch: 10, train_loss: 0.8946, test_loss: 0.9204, test_f1: 0.5504
 epoch: 11, train_loss: 0.8863, test_loss: 0.9299, test_f1: 0.5367
 epoch: 12, train_loss: 0.8886, test_loss: 0.9022, test_f1: 0.5410
 epoch: 13, train_loss: 0.8739, test_loss: 0.9231, test_f1: 0.5490
 epoch: 14, train_loss: 0.8616, test_loss: 0.9048, test_f1: 0.5677
 epoch: 15, train_loss: 0.8469, test_loss: 0.9081, test_f1: 0.5760
 epoch: 16, train_loss: 0.8417, test_loss: 0.8958, test_f1: 0.5669
 epoch: 17, train_loss: 0.8289, test_loss: 0.9023, test_f1: 0.5514
 epoch: 18, train_loss: 0.8273, test_loss: 0.9125, test_f1: 0.5794
 epoch: 19, train_loss: 0.8258, test_loss: 0.9195, test_f1: 0.5986
 epoch: 20, train_loss: 0.8128, test_loss: 0.9196, test_f1: 0.5694
 epoch: 21, train_loss: 0.8143, test_loss: 0.9121, test_f1: 0.5755
 epoch: 22, train_loss: 0.8002, test_loss: 0.8827, test_f1: 0.6010
 epoch: 23, train_loss: 0.7922, test_loss: 0.9146, test_f1: 0.6100
 epoch: 24, train_loss: 0.7916, test_loss: 0.9179, test_f1: 0.6108
 epoch: 25, train_loss: 0.7730, test_loss: 0.9105, test_f1: 0.6054
 epoch: 26, train_loss: 0.7774, test_loss: 0.9460, test_f1: 0.5947
 epoch: 27, train_loss: 0.7644, test_loss: 0.9489, test_f1: 0.5602
 epoch: 28, train_loss: 0.7683, test_loss: 0.9336, test_f1: 0.6120
 epoch: 29, train_loss: 0.7570, test_loss: 0.9486, test_f1: 0.5936
 epoch: 30, train_loss: 0.7493, test_loss: 0.9201, test_f1: 0.6097
 epoch: 31, train_loss: 0.7418, test_loss: 0.9458, test_f1: 0.5966
 epoch: 32, train_loss: 0.7334, test_loss: 0.9636, test_f1: 0.5873
 epoch: 33, train_loss: 0.7310, test_loss: 0.9261, test_f1: 0.6189
 epoch: 34, train_loss: 0.7207, test_loss: 0.9346, test_f1: 0.6008
 epoch: 35, train_loss: 0.7252, test_loss: 0.9323, test_f1: 0.6061
 epoch: 36, train_loss: 0.7134, test_loss: 0.9160, test_f1: 0.6116
 epoch: 37, train_loss: 0.7097, test_loss: 0.9425, test_f1: 0.6139
 epoch: 38, train_loss: 0.7074, test_loss: 0.9467, test_f1: 0.6068
 epoch: 39, train_loss: 0.7018, test_loss: 0.9276, test_f1: 0.6225
 epoch: 40, train_loss: 0.6912, test_loss: 0.9305, test_f1: 0.6230
 epoch: 41, train_loss: 0.6895, test_loss: 0.9391, test_f1: 0.6212
 epoch: 42, train_loss: 0.6841, test_loss: 0.9477, test_f1: 0.6302
 epoch: 43, train_loss: 0.6637, test_loss: 0.9542, test_f1: 0.6239
 epoch: 44, train_loss: 0.6780, test_loss: 0.9728, test_f1: 0.5781
 epoch: 45, train_loss: 0.6679, test_loss: 0.9661, test_f1: 0.6027
 epoch: 46, train_loss: 0.6634, test_loss: 0.9362, test_f1: 0.6373
 epoch: 47, train_loss: 0.6517, test_loss: 0.9148, test_f1: 0.6566
 epoch: 48, train_loss: 0.6487, test_loss: 0.9369, test_f1: 0.6594
 epoch: 49, train_loss: 0.6495, test_loss: 0.9518, test_f1: 0.6293
 epoch: 50, train_loss: 0.6470, test_loss: 0.9865, test_f1: 0.6341
 epoch: 51, train_loss: 0.6295, test_loss: 0.9414, test_f1: 0.6278
 epoch: 52, train_loss: 0.6168, test_loss: 0.9419, test_f1: 0.6390
 epoch: 53, train_loss: 0.6137, test_loss: 0.9319, test_f1: 0.6530
 epoch: 54, train_loss: 0.6071, test_loss: 0.9376, test_f1: 0.6412
 epoch: 55, train_loss: 0.6118, test_loss: 0.9425, test_f1: 0.6533
 epoch: 56, train_loss: 0.6114, test_loss: 0.9355, test_f1: 0.6458
 epoch: 57, train_loss: 0.5917, test_loss: 0.9619, test_f1: 0.6400
 epoch: 58, train_loss: 0.5924, test_loss: 0.9608, test_f1: 0.6514
 epoch: 59, train_loss: 0.5971, test_loss: 0.9455, test_f1: 0.6334
 epoch: 60, train_loss: 0.6116, test_loss: 0.9336, test_f1: 0.6537
 epoch: 61, train_loss: 0.5793, test_loss: 0.9531, test_f1: 0.6430
 epoch: 62, train_loss: 0.5793, test_loss: 0.9539, test_f1: 0.6438
 epoch: 63, train_loss: 0.5844, test_loss: 0.9734, test_f1: 0.6572
 epoch: 64, train_loss: 0.5750, test_loss: 0.9707, test_f1: 0.6508
 epoch: 65, train_loss: 0.5702, test_loss: 0.9774, test_f1: 0.6339
 epoch: 66, train_loss: 0.5805, test_loss: 0.9608, test_f1: 0.6502
 epoch: 67, train_loss: 0.5657, test_loss: 0.9697, test_f1: 0.6245
 epoch: 68, train_loss: 0.5692, test_loss: 0.9623, test_f1: 0.6381
 epoch: 69, train_loss: 0.5582, test_loss: 0.9562, test_f1: 0.6246
 epoch: 70, train_loss: 0.5559, test_loss: 0.9723, test_f1: 0.6165
 epoch: 71, train_loss: 0.5645, test_loss: 0.9665, test_f1: 0.6458
 epoch: 72, train_loss: 0.5526, test_loss: 0.9449, test_f1: 0.6351
 epoch: 73, train_loss: 0.5450, test_loss: 0.9641, test_f1: 0.6476
 epoch: 74, train_loss: 0.5509, test_loss: 1.0133, test_f1: 0.6084
 epoch: 75, train_loss: 0.5504, test_loss: 1.0140, test_f1: 0.6379
 epoch: 76, train_loss: 0.5506, test_loss: 1.0082, test_f1: 0.6227
 epoch: 77, train_loss: 0.5507, test_loss: 1.0386, test_f1: 0.6369
 epoch: 78, train_loss: 0.5362, test_loss: 1.0092, test_f1: 0.6228
 epoch: 79, train_loss: 0.5345, test_loss: 1.0109, test_f1: 0.6303
 epoch: 80, train_loss: 0.5261, test_loss: 0.9909, test_f1: 0.6686
 epoch: 81, train_loss: 0.5444, test_loss: 0.9910, test_f1: 0.6444
 epoch: 82, train_loss: 0.5264, test_loss: 1.0079, test_f1: 0.6437
 epoch: 83, train_loss: 0.5237, test_loss: 1.0296, test_f1: 0.6217
 epoch: 84, train_loss: 0.5286, test_loss: 1.0130, test_f1: 0.6369
 epoch: 85, train_loss: 0.5263, test_loss: 0.9930, test_f1: 0.6365
 epoch: 86, train_loss: 0.5244, test_loss: 1.0159, test_f1: 0.6490
 epoch: 87, train_loss: 0.5235, test_loss: 1.0249, test_f1: 0.6369
 epoch: 88, train_loss: 0.5055, test_loss: 1.0368, test_f1: 0.6256
 epoch: 89, train_loss: 0.5016, test_loss: 1.0275, test_f1: 0.6386
 epoch: 90, train_loss: 0.5000, test_loss: 1.0732, test_f1: 0.6194
 epoch: 91, train_loss: 0.5074, test_loss: 1.0155, test_f1: 0.6522
 epoch: 92, train_loss: 0.4983, test_loss: 1.0160, test_f1: 0.6445
 epoch: 93, train_loss: 0.5050, test_loss: 1.0529, test_f1: 0.6431
 epoch: 94, train_loss: 0.4995, test_loss: 1.0924, test_f1: 0.6338
 epoch: 95, train_loss: 0.5075, test_loss: 1.0462, test_f1: 0.6613
 epoch: 96, train_loss: 0.4879, test_loss: 1.0761, test_f1: 0.6395
 epoch: 97, train_loss: 0.4763, test_loss: 1.0381, test_f1: 0.6502
 epoch: 98, train_loss: 0.4960, test_loss: 1.0238, test_f1: 0.6577
 epoch: 99, train_loss: 0.4898, test_loss: 1.0958, test_f1: 0.6538
##################ITERATION #9 ****************************************
 epoch: 0, train_loss: 1.2632, test_loss: 1.0913, test_f1: 0.4434
 epoch: 1, train_loss: 1.0886, test_loss: 0.9603, test_f1: 0.5062
 epoch: 2, train_loss: 1.0510, test_loss: 0.9652, test_f1: 0.4904
 epoch: 3, train_loss: 1.0071, test_loss: 0.9383, test_f1: 0.5004
 epoch: 4, train_loss: 0.9961, test_loss: 0.9295, test_f1: 0.5451
 epoch: 5, train_loss: 0.9859, test_loss: 0.9195, test_f1: 0.5076
 epoch: 6, train_loss: 0.9575, test_loss: 0.8981, test_f1: 0.5246
 epoch: 7, train_loss: 0.9497, test_loss: 0.9020, test_f1: 0.5153
 epoch: 8, train_loss: 0.9302, test_loss: 0.9335, test_f1: 0.5173
 epoch: 9, train_loss: 0.9134, test_loss: 0.9045, test_f1: 0.5554
 epoch: 10, train_loss: 0.9061, test_loss: 0.8926, test_f1: 0.5217
 epoch: 11, train_loss: 0.9069, test_loss: 0.9138, test_f1: 0.5327
 epoch: 12, train_loss: 0.8837, test_loss: 0.9064, test_f1: 0.5494
 epoch: 13, train_loss: 0.8782, test_loss: 0.8927, test_f1: 0.5393
 epoch: 14, train_loss: 0.8764, test_loss: 0.8795, test_f1: 0.5403
 epoch: 15, train_loss: 0.8596, test_loss: 0.8669, test_f1: 0.5812
 epoch: 16, train_loss: 0.8524, test_loss: 0.9097, test_f1: 0.5791
 epoch: 17, train_loss: 0.8540, test_loss: 0.8725, test_f1: 0.5767
 epoch: 18, train_loss: 0.8408, test_loss: 0.8941, test_f1: 0.5738
 epoch: 19, train_loss: 0.8172, test_loss: 0.8750, test_f1: 0.5884
 epoch: 20, train_loss: 0.8203, test_loss: 0.8901, test_f1: 0.5847
 epoch: 21, train_loss: 0.8055, test_loss: 0.9343, test_f1: 0.5557
 epoch: 22, train_loss: 0.8026, test_loss: 0.8703, test_f1: 0.5788
 epoch: 23, train_loss: 0.7923, test_loss: 0.8997, test_f1: 0.6013
 epoch: 24, train_loss: 0.7910, test_loss: 0.9033, test_f1: 0.5773
 epoch: 25, train_loss: 0.7916, test_loss: 0.8980, test_f1: 0.5828
 epoch: 26, train_loss: 0.7789, test_loss: 0.8812, test_f1: 0.5660
 epoch: 27, train_loss: 0.7763, test_loss: 0.9131, test_f1: 0.5674
 epoch: 28, train_loss: 0.7669, test_loss: 0.8821, test_f1: 0.6121
 epoch: 29, train_loss: 0.7599, test_loss: 0.8855, test_f1: 0.5839
 epoch: 30, train_loss: 0.7581, test_loss: 0.8833, test_f1: 0.6173
 epoch: 31, train_loss: 0.7464, test_loss: 0.8728, test_f1: 0.6121
 epoch: 32, train_loss: 0.7467, test_loss: 0.9113, test_f1: 0.5896
 epoch: 33, train_loss: 0.7482, test_loss: 0.9000, test_f1: 0.5959
 epoch: 34, train_loss: 0.7236, test_loss: 0.8824, test_f1: 0.5917
 epoch: 35, train_loss: 0.7308, test_loss: 0.8877, test_f1: 0.6053
 epoch: 36, train_loss: 0.7089, test_loss: 0.8727, test_f1: 0.6357
 epoch: 37, train_loss: 0.7204, test_loss: 0.9092, test_f1: 0.5797
 epoch: 38, train_loss: 0.7265, test_loss: 0.8872, test_f1: 0.5920
 epoch: 39, train_loss: 0.6904, test_loss: 0.9095, test_f1: 0.6098
 epoch: 40, train_loss: 0.7001, test_loss: 0.9383, test_f1: 0.5867
 epoch: 41, train_loss: 0.6805, test_loss: 0.9015, test_f1: 0.6325
 epoch: 42, train_loss: 0.6836, test_loss: 0.9280, test_f1: 0.6037
 epoch: 43, train_loss: 0.6865, test_loss: 0.9195, test_f1: 0.6118
 epoch: 44, train_loss: 0.6767, test_loss: 0.9017, test_f1: 0.6207
 epoch: 45, train_loss: 0.6679, test_loss: 0.8812, test_f1: 0.6302
 epoch: 46, train_loss: 0.6699, test_loss: 0.8955, test_f1: 0.6258
 epoch: 47, train_loss: 0.6589, test_loss: 0.9246, test_f1: 0.6339
 epoch: 48, train_loss: 0.6580, test_loss: 0.9024, test_f1: 0.6331
 epoch: 49, train_loss: 0.6437, test_loss: 0.8740, test_f1: 0.6301
 epoch: 50, train_loss: 0.6472, test_loss: 0.9137, test_f1: 0.6159
 epoch: 51, train_loss: 0.6411, test_loss: 0.8943, test_f1: 0.6438
 epoch: 52, train_loss: 0.6168, test_loss: 0.9052, test_f1: 0.6133
 epoch: 53, train_loss: 0.6320, test_loss: 0.8859, test_f1: 0.6310
 epoch: 54, train_loss: 0.6148, test_loss: 0.8671, test_f1: 0.6343
 epoch: 55, train_loss: 0.6193, test_loss: 0.8997, test_f1: 0.6397
 epoch: 56, train_loss: 0.6101, test_loss: 0.8963, test_f1: 0.6342
 epoch: 57, train_loss: 0.6087, test_loss: 0.9107, test_f1: 0.6248
 epoch: 58, train_loss: 0.6040, test_loss: 0.9074, test_f1: 0.6298
 epoch: 59, train_loss: 0.6008, test_loss: 0.9143, test_f1: 0.6405
 epoch: 60, train_loss: 0.6021, test_loss: 0.9227, test_f1: 0.6332
 epoch: 61, train_loss: 0.5937, test_loss: 0.8843, test_f1: 0.6448
 epoch: 62, train_loss: 0.5863, test_loss: 0.9130, test_f1: 0.6262
 epoch: 63, train_loss: 0.5824, test_loss: 0.8968, test_f1: 0.6460
 epoch: 64, train_loss: 0.5983, test_loss: 0.9057, test_f1: 0.6516
 epoch: 65, train_loss: 0.5693, test_loss: 0.9108, test_f1: 0.6535
 epoch: 66, train_loss: 0.5770, test_loss: 0.9062, test_f1: 0.6528
 epoch: 67, train_loss: 0.5784, test_loss: 0.9153, test_f1: 0.6440
 epoch: 68, train_loss: 0.5618, test_loss: 0.9053, test_f1: 0.6396
 epoch: 69, train_loss: 0.5728, test_loss: 0.9073, test_f1: 0.6414
 epoch: 70, train_loss: 0.5536, test_loss: 0.9038, test_f1: 0.6509
 epoch: 71, train_loss: 0.5642, test_loss: 0.9126, test_f1: 0.6524
 epoch: 72, train_loss: 0.5640, test_loss: 0.9113, test_f1: 0.6462
 epoch: 73, train_loss: 0.5516, test_loss: 0.9355, test_f1: 0.6558
 epoch: 74, train_loss: 0.5430, test_loss: 0.9512, test_f1: 0.6469
 epoch: 75, train_loss: 0.5500, test_loss: 0.9524, test_f1: 0.6387
 epoch: 76, train_loss: 0.5501, test_loss: 0.9197, test_f1: 0.6592
 epoch: 77, train_loss: 0.5425, test_loss: 0.9255, test_f1: 0.6471
 epoch: 78, train_loss: 0.5315, test_loss: 0.9598, test_f1: 0.6443
 epoch: 79, train_loss: 0.5351, test_loss: 0.9620, test_f1: 0.6450
 epoch: 80, train_loss: 0.5278, test_loss: 0.9525, test_f1: 0.6423
 epoch: 81, train_loss: 0.5248, test_loss: 0.9481, test_f1: 0.6507
 epoch: 82, train_loss: 0.5251, test_loss: 0.9651, test_f1: 0.6427
 epoch: 83, train_loss: 0.5284, test_loss: 0.9482, test_f1: 0.6515
 epoch: 84, train_loss: 0.5273, test_loss: 0.9681, test_f1: 0.6594
 epoch: 85, train_loss: 0.5255, test_loss: 0.9428, test_f1: 0.6612
 epoch: 86, train_loss: 0.5341, test_loss: 0.9619, test_f1: 0.6676
 epoch: 87, train_loss: 0.5172, test_loss: 0.9492, test_f1: 0.6500
 epoch: 88, train_loss: 0.5118, test_loss: 0.9863, test_f1: 0.6379
 epoch: 89, train_loss: 0.5036, test_loss: 0.9789, test_f1: 0.6505
 epoch: 90, train_loss: 0.5194, test_loss: 0.9957, test_f1: 0.6615
 epoch: 91, train_loss: 0.5044, test_loss: 0.9717, test_f1: 0.6480
 epoch: 92, train_loss: 0.5043, test_loss: 0.9985, test_f1: 0.6498
 epoch: 93, train_loss: 0.5067, test_loss: 0.9911, test_f1: 0.6496
 epoch: 94, train_loss: 0.4932, test_loss: 0.9899, test_f1: 0.6602
 epoch: 95, train_loss: 0.5010, test_loss: 0.9937, test_f1: 0.6378
 epoch: 96, train_loss: 0.5009, test_loss: 1.0150, test_f1: 0.6594
 epoch: 97, train_loss: 0.4888, test_loss: 1.0141, test_f1: 0.6671
 epoch: 98, train_loss: 0.4845, test_loss: 1.0046, test_f1: 0.6442
 epoch: 99, train_loss: 0.4888, test_loss: 1.0034, test_f1: 0.6470

Training completed in 799.36 seconds
Best F1: 0.6836 at epoch 87
Mean F1 across iterations: 0.6688  0.0135
========================FINAL RESULTS================================
FEGIN weighted F1: 0.6836  0.0135
python main.py --data ltspice_examples --representation component_net --model FEGIN --layers 5 --hiddens 128 --batch_size 64 --lr 0.0001 --emb_size 128 --epochs 100 --save_appendix component_net_L5_H128_BS64_LR0.0001_E128 --no_val
-----



STDERR:
  File "main.py", line 370, in <module>
    main()
  File "main.py", line 254, in main
    dataset = dataset_class(
  File "/home/philip/projects/ltspice_examples_code_repo/Circuit-Completion-Using-GNNs/component_classification_with_link_prediction_head/evaluation/FEGIN/kernel/circuit_datasets.py", line 15, in __init__
    self.data, self.slices = torch.load(self.processed_paths[0])
  File "/home/philip/.local/lib/python3.8/site-packages/torch/serialization.py", line 1040, in load
    warnings.warn(
  File "/usr/lib/python3.8/warnings.py", line 109, in _showwarnmsg
    sw(msg.message, msg.category, msg.filename, msg.lineno,
  File "main.py", line 47, in warn_with_traceback
    traceback.print_stack(file=log)
/home/philip/projects/ltspice_examples_code_repo/Circuit-Completion-Using-GNNs/component_classification_with_link_prediction_head/evaluation/FEGIN/kernel/circuit_datasets.py:15: FutureWarning: You are using `torch.load` with `weights_only=False` (the current default value), which uses the default pickle module implicitly. It is possible to construct malicious pickle data which will execute arbitrary code during unpickling (See https://github.com/pytorch/pytorch/blob/main/SECURITY.md#untrusted-models for more details). In a future release, the default value for `weights_only` will be flipped to `True`. This limits the functions that could be executed during unpickling. Arbitrary objects will no longer be allowed to be loaded via this mode unless they are explicitly allowlisted by the user via `torch.serialization.add_safe_globals`. We recommend you start setting `weights_only=True` for any use case where you don't have full control of the loaded file. Please open an issue on GitHub for any issues related to this experimental feature.
  self.data, self.slices = torch.load(self.processed_paths[0])
