STDOUT:
Results will be saved in /home/philip/projects/ltspice_examples_code_repo/Circuit-Completion-Using-GNNs/component_classification_with_link_prediction_head/evaluation/FEGIN/results/model_FEGIN_dataset_ltspice_demos
Command line input: python main.py --data ltspice_demos --representation component_net --model FEGIN --layers 5 --hiddens 64 --batch_size 32 --lr 0.0001 --emb_size 250 --epochs 100 --save_appendix component_net_L5_H64_BS32_LR0.0001_E250 --no_val
 is saved.
-----
ltspice_demos - FEGIN
Using 5 layers, 64 hidden units, h = 2
Loading component_net representation dataset
ENTERED
Training FEGIN on component_net representation
Train: 1565, Test: 383
##################ITERATION #0 ****************************************
 epoch: 0, train_loss: 1.3810, test_loss: 1.3765, test_f1: 0.1365
 epoch: 1, train_loss: 1.3391, test_loss: 1.3422, test_f1: 0.2559
 epoch: 2, train_loss: 1.2977, test_loss: 1.3038, test_f1: 0.2887
 epoch: 3, train_loss: 1.2487, test_loss: 1.2613, test_f1: 0.2801
 epoch: 4, train_loss: 1.2112, test_loss: 1.2405, test_f1: 0.2801
 epoch: 5, train_loss: 1.1807, test_loss: 1.2248, test_f1: 0.2815
 epoch: 6, train_loss: 1.1627, test_loss: 1.2086, test_f1: 0.2799
 epoch: 7, train_loss: 1.1459, test_loss: 1.1949, test_f1: 0.2880
 epoch: 8, train_loss: 1.1397, test_loss: 1.1844, test_f1: 0.2918
 epoch: 9, train_loss: 1.1302, test_loss: 1.1740, test_f1: 0.2912
 epoch: 10, train_loss: 1.1147, test_loss: 1.1695, test_f1: 0.3231
 epoch: 11, train_loss: 1.1089, test_loss: 1.1539, test_f1: 0.3612
 epoch: 12, train_loss: 1.1011, test_loss: 1.1532, test_f1: 0.4067
 epoch: 13, train_loss: 1.0918, test_loss: 1.1416, test_f1: 0.4086
 epoch: 14, train_loss: 1.0914, test_loss: 1.1316, test_f1: 0.4263
 epoch: 15, train_loss: 1.0828, test_loss: 1.1276, test_f1: 0.4517
 epoch: 16, train_loss: 1.0672, test_loss: 1.1157, test_f1: 0.4533
 epoch: 17, train_loss: 1.0591, test_loss: 1.1162, test_f1: 0.4873
 epoch: 18, train_loss: 1.0425, test_loss: 1.1025, test_f1: 0.4684
 epoch: 19, train_loss: 1.0354, test_loss: 1.0893, test_f1: 0.4900
 epoch: 20, train_loss: 1.0334, test_loss: 1.0960, test_f1: 0.5084
 epoch: 21, train_loss: 1.0276, test_loss: 1.0935, test_f1: 0.5096
 epoch: 22, train_loss: 1.0068, test_loss: 1.0867, test_f1: 0.5033
 epoch: 23, train_loss: 0.9969, test_loss: 1.0702, test_f1: 0.5271
 epoch: 24, train_loss: 0.9933, test_loss: 1.0496, test_f1: 0.5079
 epoch: 25, train_loss: 0.9817, test_loss: 1.0430, test_f1: 0.5286
 epoch: 26, train_loss: 0.9670, test_loss: 1.0395, test_f1: 0.5320
 epoch: 27, train_loss: 0.9660, test_loss: 1.0879, test_f1: 0.5279
 epoch: 28, train_loss: 0.9558, test_loss: 1.0727, test_f1: 0.5186
 epoch: 29, train_loss: 0.9368, test_loss: 1.0800, test_f1: 0.5448
 epoch: 30, train_loss: 0.9408, test_loss: 1.0390, test_f1: 0.5490
 epoch: 31, train_loss: 0.9232, test_loss: 1.0471, test_f1: 0.5410
 epoch: 32, train_loss: 0.9142, test_loss: 1.0614, test_f1: 0.5498
 epoch: 33, train_loss: 0.9031, test_loss: 1.0470, test_f1: 0.5545
 epoch: 34, train_loss: 0.9198, test_loss: 1.0227, test_f1: 0.5648
 epoch: 35, train_loss: 0.8954, test_loss: 1.0440, test_f1: 0.5552
 epoch: 36, train_loss: 0.8969, test_loss: 1.0411, test_f1: 0.5634
 epoch: 37, train_loss: 0.8908, test_loss: 1.0373, test_f1: 0.5650
 epoch: 38, train_loss: 0.8760, test_loss: 1.0525, test_f1: 0.5534
 epoch: 39, train_loss: 0.8738, test_loss: 1.0509, test_f1: 0.5866
 epoch: 40, train_loss: 0.8690, test_loss: 1.0582, test_f1: 0.5668
 epoch: 41, train_loss: 0.8735, test_loss: 1.0591, test_f1: 0.5644
 epoch: 42, train_loss: 0.8593, test_loss: 1.1092, test_f1: 0.5543
 epoch: 43, train_loss: 0.8578, test_loss: 1.0864, test_f1: 0.5925
 epoch: 44, train_loss: 0.8681, test_loss: 1.0862, test_f1: 0.5888
 epoch: 45, train_loss: 0.8378, test_loss: 1.0920, test_f1: 0.5805
 epoch: 46, train_loss: 0.8427, test_loss: 1.0588, test_f1: 0.5687
 epoch: 47, train_loss: 0.8346, test_loss: 1.0897, test_f1: 0.5673
 epoch: 48, train_loss: 0.8307, test_loss: 1.0594, test_f1: 0.5849
 epoch: 49, train_loss: 0.8303, test_loss: 1.1005, test_f1: 0.5644
 epoch: 50, train_loss: 0.8308, test_loss: 1.1402, test_f1: 0.5717
 epoch: 51, train_loss: 0.8210, test_loss: 1.1033, test_f1: 0.5675
 epoch: 52, train_loss: 0.8128, test_loss: 1.0923, test_f1: 0.5755
 epoch: 53, train_loss: 0.8036, test_loss: 1.0800, test_f1: 0.5826
 epoch: 54, train_loss: 0.8096, test_loss: 1.0986, test_f1: 0.5660
 epoch: 55, train_loss: 0.8057, test_loss: 1.0878, test_f1: 0.5737
 epoch: 56, train_loss: 0.7965, test_loss: 1.0841, test_f1: 0.5787
 epoch: 57, train_loss: 0.8088, test_loss: 1.0876, test_f1: 0.5639
 epoch: 58, train_loss: 0.8108, test_loss: 1.0841, test_f1: 0.5639
 epoch: 59, train_loss: 0.8001, test_loss: 1.0746, test_f1: 0.5736
 epoch: 60, train_loss: 0.7907, test_loss: 1.1078, test_f1: 0.5868
 epoch: 61, train_loss: 0.7839, test_loss: 1.1462, test_f1: 0.5667
 epoch: 62, train_loss: 0.7943, test_loss: 1.1278, test_f1: 0.5766
 epoch: 63, train_loss: 0.7906, test_loss: 1.1266, test_f1: 0.5702
 epoch: 64, train_loss: 0.7875, test_loss: 1.1115, test_f1: 0.5805
 epoch: 65, train_loss: 0.7766, test_loss: 1.1459, test_f1: 0.5763
 epoch: 66, train_loss: 0.7741, test_loss: 1.1577, test_f1: 0.5644
 epoch: 67, train_loss: 0.7716, test_loss: 1.1172, test_f1: 0.5743
 epoch: 68, train_loss: 0.7859, test_loss: 1.1345, test_f1: 0.5761
 epoch: 69, train_loss: 0.7682, test_loss: 1.1055, test_f1: 0.5659
 epoch: 70, train_loss: 0.7973, test_loss: 1.1219, test_f1: 0.5607
 epoch: 71, train_loss: 0.7797, test_loss: 1.1545, test_f1: 0.5715
 epoch: 72, train_loss: 0.7593, test_loss: 1.1359, test_f1: 0.5771
 epoch: 73, train_loss: 0.7787, test_loss: 1.1411, test_f1: 0.5670
 epoch: 74, train_loss: 0.7624, test_loss: 1.1222, test_f1: 0.5708
 epoch: 75, train_loss: 0.7779, test_loss: 1.1639, test_f1: 0.5596
 epoch: 76, train_loss: 0.7726, test_loss: 1.1793, test_f1: 0.5568
 epoch: 77, train_loss: 0.7648, test_loss: 1.1850, test_f1: 0.5534
 epoch: 78, train_loss: 0.7878, test_loss: 1.1432, test_f1: 0.5701
 epoch: 79, train_loss: 0.7895, test_loss: 1.1879, test_f1: 0.5704
 epoch: 80, train_loss: 0.7649, test_loss: 1.1536, test_f1: 0.5724
 epoch: 81, train_loss: 0.7814, test_loss: 1.1345, test_f1: 0.5733
 epoch: 82, train_loss: 0.7700, test_loss: 1.1291, test_f1: 0.5820
 epoch: 83, train_loss: 0.7587, test_loss: 1.1658, test_f1: 0.5680
 epoch: 84, train_loss: 0.7579, test_loss: 1.1593, test_f1: 0.5685
 epoch: 85, train_loss: 0.7511, test_loss: 1.1813, test_f1: 0.5682
 epoch: 86, train_loss: 0.7614, test_loss: 1.2232, test_f1: 0.5608
 epoch: 87, train_loss: 0.7581, test_loss: 1.1691, test_f1: 0.5760
 epoch: 88, train_loss: 0.7475, test_loss: 1.1892, test_f1: 0.5796
 epoch: 89, train_loss: 0.7463, test_loss: 1.2009, test_f1: 0.5726
 epoch: 90, train_loss: 0.7468, test_loss: 1.1661, test_f1: 0.5842
 epoch: 91, train_loss: 0.7331, test_loss: 1.1624, test_f1: 0.5701
 epoch: 92, train_loss: 0.7451, test_loss: 1.2171, test_f1: 0.5507
 epoch: 93, train_loss: 0.7533, test_loss: 1.2148, test_f1: 0.5615
 epoch: 94, train_loss: 0.7566, test_loss: 1.1706, test_f1: 0.5611
 epoch: 95, train_loss: 0.7543, test_loss: 1.1996, test_f1: 0.5717
 epoch: 96, train_loss: 0.7339, test_loss: 1.2066, test_f1: 0.5663
 epoch: 97, train_loss: 0.7474, test_loss: 1.1984, test_f1: 0.5791
 epoch: 98, train_loss: 0.7385, test_loss: 1.1985, test_f1: 0.5618
 epoch: 99, train_loss: 0.7326, test_loss: 1.1766, test_f1: 0.5796
##################ITERATION #1 ****************************************
 epoch: 0, train_loss: 1.3012, test_loss: 1.3274, test_f1: 0.1524
 epoch: 1, train_loss: 1.2174, test_loss: 1.2654, test_f1: 0.3442
 epoch: 2, train_loss: 1.1887, test_loss: 1.2397, test_f1: 0.3118
 epoch: 3, train_loss: 1.1596, test_loss: 1.2154, test_f1: 0.2947
 epoch: 4, train_loss: 1.1472, test_loss: 1.1979, test_f1: 0.2965
 epoch: 5, train_loss: 1.1282, test_loss: 1.1805, test_f1: 0.3113
 epoch: 6, train_loss: 1.1123, test_loss: 1.1702, test_f1: 0.3420
 epoch: 7, train_loss: 1.0994, test_loss: 1.1569, test_f1: 0.3766
 epoch: 8, train_loss: 1.0833, test_loss: 1.1471, test_f1: 0.3912
 epoch: 9, train_loss: 1.0755, test_loss: 1.1348, test_f1: 0.4395
 epoch: 10, train_loss: 1.0627, test_loss: 1.1274, test_f1: 0.4115
 epoch: 11, train_loss: 1.0484, test_loss: 1.1148, test_f1: 0.4586
 epoch: 12, train_loss: 1.0360, test_loss: 1.0958, test_f1: 0.4800
 epoch: 13, train_loss: 1.0274, test_loss: 1.0999, test_f1: 0.4826
 epoch: 14, train_loss: 1.0076, test_loss: 1.0796, test_f1: 0.5091
 epoch: 15, train_loss: 1.0094, test_loss: 1.0794, test_f1: 0.5081
 epoch: 16, train_loss: 0.9955, test_loss: 1.0666, test_f1: 0.5138
 epoch: 17, train_loss: 0.9950, test_loss: 1.0614, test_f1: 0.5172
 epoch: 18, train_loss: 0.9706, test_loss: 1.0691, test_f1: 0.5099
 epoch: 19, train_loss: 0.9673, test_loss: 1.0619, test_f1: 0.5150
 epoch: 20, train_loss: 0.9720, test_loss: 1.0763, test_f1: 0.5274
 epoch: 21, train_loss: 0.9519, test_loss: 1.0729, test_f1: 0.5218
 epoch: 22, train_loss: 0.9490, test_loss: 1.0491, test_f1: 0.5182
 epoch: 23, train_loss: 0.9388, test_loss: 1.0573, test_f1: 0.5146
 epoch: 24, train_loss: 0.9291, test_loss: 1.0692, test_f1: 0.5260
 epoch: 25, train_loss: 0.9198, test_loss: 1.0779, test_f1: 0.5352
 epoch: 26, train_loss: 0.9142, test_loss: 1.0815, test_f1: 0.5174
 epoch: 27, train_loss: 0.9131, test_loss: 1.0756, test_f1: 0.5473
 epoch: 28, train_loss: 0.9102, test_loss: 1.0488, test_f1: 0.5380
 epoch: 29, train_loss: 0.9047, test_loss: 1.0623, test_f1: 0.5391
 epoch: 30, train_loss: 0.9021, test_loss: 1.0569, test_f1: 0.5343
 epoch: 31, train_loss: 0.8920, test_loss: 1.0740, test_f1: 0.5294
 epoch: 32, train_loss: 0.8927, test_loss: 1.0533, test_f1: 0.5604
 epoch: 33, train_loss: 0.8889, test_loss: 1.0611, test_f1: 0.5488
 epoch: 34, train_loss: 0.8630, test_loss: 1.0759, test_f1: 0.5577
 epoch: 35, train_loss: 0.8792, test_loss: 1.0953, test_f1: 0.5614
 epoch: 36, train_loss: 0.8774, test_loss: 1.0931, test_f1: 0.5658
 epoch: 37, train_loss: 0.8668, test_loss: 1.0771, test_f1: 0.5647
 epoch: 38, train_loss: 0.8556, test_loss: 1.0590, test_f1: 0.5786
 epoch: 39, train_loss: 0.8618, test_loss: 1.0616, test_f1: 0.5610
 epoch: 40, train_loss: 0.8585, test_loss: 1.0652, test_f1: 0.5658
 epoch: 41, train_loss: 0.8570, test_loss: 1.0675, test_f1: 0.5511
 epoch: 42, train_loss: 0.8578, test_loss: 1.0676, test_f1: 0.5573
 epoch: 43, train_loss: 0.8346, test_loss: 1.0471, test_f1: 0.5729
 epoch: 44, train_loss: 0.8473, test_loss: 1.0544, test_f1: 0.5660
 epoch: 45, train_loss: 0.8340, test_loss: 1.0662, test_f1: 0.5676
 epoch: 46, train_loss: 0.8484, test_loss: 1.0821, test_f1: 0.5749
 epoch: 47, train_loss: 0.8323, test_loss: 1.0833, test_f1: 0.5791
 epoch: 48, train_loss: 0.8308, test_loss: 1.0673, test_f1: 0.5894
 epoch: 49, train_loss: 0.8187, test_loss: 1.0494, test_f1: 0.5724
 epoch: 50, train_loss: 0.8125, test_loss: 1.0607, test_f1: 0.5692
 epoch: 51, train_loss: 0.8136, test_loss: 1.0617, test_f1: 0.5845
 epoch: 52, train_loss: 0.8093, test_loss: 1.0571, test_f1: 0.5874
 epoch: 53, train_loss: 0.7933, test_loss: 1.0819, test_f1: 0.5801
 epoch: 54, train_loss: 0.7971, test_loss: 1.0530, test_f1: 0.5901
 epoch: 55, train_loss: 0.8136, test_loss: 1.0759, test_f1: 0.5823
 epoch: 56, train_loss: 0.7984, test_loss: 1.0674, test_f1: 0.6005
 epoch: 57, train_loss: 0.8097, test_loss: 1.0676, test_f1: 0.5962
 epoch: 58, train_loss: 0.7837, test_loss: 1.0946, test_f1: 0.5707
 epoch: 59, train_loss: 0.7859, test_loss: 1.0708, test_f1: 0.5773
 epoch: 60, train_loss: 0.7956, test_loss: 1.0714, test_f1: 0.5946
 epoch: 61, train_loss: 0.7919, test_loss: 1.0866, test_f1: 0.5797
 epoch: 62, train_loss: 0.7860, test_loss: 1.0765, test_f1: 0.5875
 epoch: 63, train_loss: 0.7906, test_loss: 1.0886, test_f1: 0.5830
 epoch: 64, train_loss: 0.7873, test_loss: 1.0433, test_f1: 0.6016
 epoch: 65, train_loss: 0.7887, test_loss: 1.0604, test_f1: 0.5962
 epoch: 66, train_loss: 0.7838, test_loss: 1.0708, test_f1: 0.5901
 epoch: 67, train_loss: 0.7801, test_loss: 1.0611, test_f1: 0.5686
 epoch: 68, train_loss: 0.7832, test_loss: 1.1097, test_f1: 0.5614
 epoch: 69, train_loss: 0.7778, test_loss: 1.0757, test_f1: 0.5845
 epoch: 70, train_loss: 0.7622, test_loss: 1.0874, test_f1: 0.5852
 epoch: 71, train_loss: 0.7822, test_loss: 1.1127, test_f1: 0.5803
 epoch: 72, train_loss: 0.7803, test_loss: 1.1436, test_f1: 0.5677
 epoch: 73, train_loss: 0.7797, test_loss: 1.1359, test_f1: 0.5696
 epoch: 74, train_loss: 0.7708, test_loss: 1.1011, test_f1: 0.5905
 epoch: 75, train_loss: 0.7792, test_loss: 1.1352, test_f1: 0.5749
 epoch: 76, train_loss: 0.7745, test_loss: 1.1272, test_f1: 0.5686
 epoch: 77, train_loss: 0.7645, test_loss: 1.1149, test_f1: 0.5568
 epoch: 78, train_loss: 0.7805, test_loss: 1.1161, test_f1: 0.5751
 epoch: 79, train_loss: 0.7640, test_loss: 1.1646, test_f1: 0.5695
 epoch: 80, train_loss: 0.7628, test_loss: 1.1344, test_f1: 0.5646
 epoch: 81, train_loss: 0.7634, test_loss: 1.1461, test_f1: 0.5542
 epoch: 82, train_loss: 0.7515, test_loss: 1.1358, test_f1: 0.5667
 epoch: 83, train_loss: 0.7719, test_loss: 1.1349, test_f1: 0.5622
 epoch: 84, train_loss: 0.7446, test_loss: 1.1651, test_f1: 0.5663
 epoch: 85, train_loss: 0.7732, test_loss: 1.1077, test_f1: 0.5750
 epoch: 86, train_loss: 0.7720, test_loss: 1.1078, test_f1: 0.5672
 epoch: 87, train_loss: 0.7501, test_loss: 1.1460, test_f1: 0.5798
 epoch: 88, train_loss: 0.7475, test_loss: 1.1795, test_f1: 0.5577
 epoch: 89, train_loss: 0.7581, test_loss: 1.1510, test_f1: 0.5690
 epoch: 90, train_loss: 0.7376, test_loss: 1.1229, test_f1: 0.5802
 epoch: 91, train_loss: 0.7404, test_loss: 1.1319, test_f1: 0.5886
 epoch: 92, train_loss: 0.7345, test_loss: 1.1904, test_f1: 0.5606
 epoch: 93, train_loss: 0.7471, test_loss: 1.1182, test_f1: 0.5808
 epoch: 94, train_loss: 0.7517, test_loss: 1.1463, test_f1: 0.5715
 epoch: 95, train_loss: 0.7459, test_loss: 1.1720, test_f1: 0.5798
 epoch: 96, train_loss: 0.7576, test_loss: 1.1420, test_f1: 0.5834
 epoch: 97, train_loss: 0.7385, test_loss: 1.1687, test_f1: 0.5642
 epoch: 98, train_loss: 0.7416, test_loss: 1.1785, test_f1: 0.5772
 epoch: 99, train_loss: 0.7341, test_loss: 1.1641, test_f1: 0.5815
##################ITERATION #2 ****************************************
 epoch: 0, train_loss: 1.2585, test_loss: 1.3260, test_f1: 0.2281
 epoch: 1, train_loss: 1.1852, test_loss: 1.2378, test_f1: 0.2545
 epoch: 2, train_loss: 1.1448, test_loss: 1.2259, test_f1: 0.3170
 epoch: 3, train_loss: 1.1276, test_loss: 1.2251, test_f1: 0.3398
 epoch: 4, train_loss: 1.0988, test_loss: 1.2099, test_f1: 0.3960
 epoch: 5, train_loss: 1.0951, test_loss: 1.2229, test_f1: 0.4069
 epoch: 6, train_loss: 1.0783, test_loss: 1.2011, test_f1: 0.4178
 epoch: 7, train_loss: 1.0587, test_loss: 1.2028, test_f1: 0.4356
 epoch: 8, train_loss: 1.0510, test_loss: 1.1969, test_f1: 0.4415
 epoch: 9, train_loss: 1.0426, test_loss: 1.1897, test_f1: 0.4712
 epoch: 10, train_loss: 1.0305, test_loss: 1.1724, test_f1: 0.4750
 epoch: 11, train_loss: 1.0186, test_loss: 1.1691, test_f1: 0.4748
 epoch: 12, train_loss: 1.0135, test_loss: 1.1584, test_f1: 0.4981
 epoch: 13, train_loss: 0.9921, test_loss: 1.1387, test_f1: 0.4986
 epoch: 14, train_loss: 0.9871, test_loss: 1.1452, test_f1: 0.4902
 epoch: 15, train_loss: 0.9789, test_loss: 1.1382, test_f1: 0.5090
 epoch: 16, train_loss: 0.9726, test_loss: 1.1241, test_f1: 0.5020
 epoch: 17, train_loss: 0.9706, test_loss: 1.1509, test_f1: 0.5046
 epoch: 18, train_loss: 0.9630, test_loss: 1.0962, test_f1: 0.5025
 epoch: 19, train_loss: 0.9436, test_loss: 1.1199, test_f1: 0.5088
 epoch: 20, train_loss: 0.9315, test_loss: 1.1190, test_f1: 0.5203
 epoch: 21, train_loss: 0.9277, test_loss: 1.1074, test_f1: 0.5222
 epoch: 22, train_loss: 0.9360, test_loss: 1.1210, test_f1: 0.5146
 epoch: 23, train_loss: 0.9258, test_loss: 1.1137, test_f1: 0.5344
 epoch: 24, train_loss: 0.9146, test_loss: 1.1072, test_f1: 0.5319
 epoch: 25, train_loss: 0.9239, test_loss: 1.0973, test_f1: 0.5360
 epoch: 26, train_loss: 0.9023, test_loss: 1.1093, test_f1: 0.5266
 epoch: 27, train_loss: 0.9014, test_loss: 1.1254, test_f1: 0.5443
 epoch: 28, train_loss: 0.8958, test_loss: 1.1390, test_f1: 0.5368
 epoch: 29, train_loss: 0.8949, test_loss: 1.1484, test_f1: 0.5265
 epoch: 30, train_loss: 0.8889, test_loss: 1.0973, test_f1: 0.5523
 epoch: 31, train_loss: 0.8751, test_loss: 1.1766, test_f1: 0.5533
 epoch: 32, train_loss: 0.8726, test_loss: 1.1738, test_f1: 0.5414
 epoch: 33, train_loss: 0.8605, test_loss: 1.1936, test_f1: 0.5438
 epoch: 34, train_loss: 0.8770, test_loss: 1.1890, test_f1: 0.5582
 epoch: 35, train_loss: 0.8582, test_loss: 1.0951, test_f1: 0.5598
 epoch: 36, train_loss: 0.8653, test_loss: 1.1669, test_f1: 0.5370
 epoch: 37, train_loss: 0.8640, test_loss: 1.1553, test_f1: 0.5610
 epoch: 38, train_loss: 0.8494, test_loss: 1.0987, test_f1: 0.5686
 epoch: 39, train_loss: 0.8580, test_loss: 1.1327, test_f1: 0.5683
 epoch: 40, train_loss: 0.8421, test_loss: 1.1172, test_f1: 0.5670
 epoch: 41, train_loss: 0.8519, test_loss: 1.0999, test_f1: 0.5518
 epoch: 42, train_loss: 0.8578, test_loss: 1.1446, test_f1: 0.5672
 epoch: 43, train_loss: 0.8426, test_loss: 1.1286, test_f1: 0.5824
 epoch: 44, train_loss: 0.8363, test_loss: 1.0762, test_f1: 0.5936
 epoch: 45, train_loss: 0.8273, test_loss: 1.1828, test_f1: 0.5788
 epoch: 46, train_loss: 0.8283, test_loss: 1.1942, test_f1: 0.5684
 epoch: 47, train_loss: 0.8323, test_loss: 1.1649, test_f1: 0.5534
 epoch: 48, train_loss: 0.8232, test_loss: 1.1519, test_f1: 0.5673
 epoch: 49, train_loss: 0.8005, test_loss: 1.1840, test_f1: 0.5788
 epoch: 50, train_loss: 0.8083, test_loss: 1.2119, test_f1: 0.5776
 epoch: 51, train_loss: 0.7915, test_loss: 1.2403, test_f1: 0.5828
 epoch: 52, train_loss: 0.7967, test_loss: 1.2261, test_f1: 0.5728
 epoch: 53, train_loss: 0.7980, test_loss: 1.2247, test_f1: 0.5786
 epoch: 54, train_loss: 0.8009, test_loss: 1.1612, test_f1: 0.5788
 epoch: 55, train_loss: 0.7790, test_loss: 1.2390, test_f1: 0.5739
 epoch: 56, train_loss: 0.7879, test_loss: 1.1648, test_f1: 0.5703
 epoch: 57, train_loss: 0.7787, test_loss: 1.2276, test_f1: 0.5800
 epoch: 58, train_loss: 0.7903, test_loss: 1.1896, test_f1: 0.5836
 epoch: 59, train_loss: 0.7851, test_loss: 1.1662, test_f1: 0.5756
 epoch: 60, train_loss: 0.7816, test_loss: 1.1904, test_f1: 0.5765
 epoch: 61, train_loss: 0.7647, test_loss: 1.2257, test_f1: 0.5817
 epoch: 62, train_loss: 0.7948, test_loss: 1.2083, test_f1: 0.5855
 epoch: 63, train_loss: 0.7941, test_loss: 1.2371, test_f1: 0.5751
 epoch: 64, train_loss: 0.7712, test_loss: 1.2349, test_f1: 0.5930
 epoch: 65, train_loss: 0.7790, test_loss: 1.2604, test_f1: 0.5919
 epoch: 66, train_loss: 0.7674, test_loss: 1.2374, test_f1: 0.5858
 epoch: 67, train_loss: 0.7698, test_loss: 1.2941, test_f1: 0.5751
 epoch: 68, train_loss: 0.7866, test_loss: 1.3007, test_f1: 0.5730
 epoch: 69, train_loss: 0.7588, test_loss: 1.2772, test_f1: 0.5866
 epoch: 70, train_loss: 0.7655, test_loss: 1.2763, test_f1: 0.5918
 epoch: 71, train_loss: 0.7673, test_loss: 1.2964, test_f1: 0.5881
 epoch: 72, train_loss: 0.7699, test_loss: 1.2863, test_f1: 0.5855
 epoch: 73, train_loss: 0.7638, test_loss: 1.3039, test_f1: 0.5927
 epoch: 74, train_loss: 0.7531, test_loss: 1.2426, test_f1: 0.5763
 epoch: 75, train_loss: 0.7534, test_loss: 1.2870, test_f1: 0.5813
 epoch: 76, train_loss: 0.7619, test_loss: 1.2796, test_f1: 0.5926
 epoch: 77, train_loss: 0.7442, test_loss: 1.2810, test_f1: 0.6016
 epoch: 78, train_loss: 0.7440, test_loss: 1.3433, test_f1: 0.5842
 epoch: 79, train_loss: 0.7526, test_loss: 1.3136, test_f1: 0.5802
 epoch: 80, train_loss: 0.7522, test_loss: 1.3283, test_f1: 0.5832
 epoch: 81, train_loss: 0.7632, test_loss: 1.3193, test_f1: 0.5921
 epoch: 82, train_loss: 0.7279, test_loss: 1.3427, test_f1: 0.5787
 epoch: 83, train_loss: 0.7492, test_loss: 1.3518, test_f1: 0.5817
 epoch: 84, train_loss: 0.7474, test_loss: 1.3205, test_f1: 0.5949
 epoch: 85, train_loss: 0.7446, test_loss: 1.3454, test_f1: 0.5879
 epoch: 86, train_loss: 0.7457, test_loss: 1.3429, test_f1: 0.5773
 epoch: 87, train_loss: 0.7471, test_loss: 1.3770, test_f1: 0.5741
 epoch: 88, train_loss: 0.7449, test_loss: 1.3324, test_f1: 0.6074
 epoch: 89, train_loss: 0.7464, test_loss: 1.4022, test_f1: 0.5777
 epoch: 90, train_loss: 0.7398, test_loss: 1.3548, test_f1: 0.6024
 epoch: 91, train_loss: 0.7222, test_loss: 1.3607, test_f1: 0.5834
 epoch: 92, train_loss: 0.7390, test_loss: 1.3565, test_f1: 0.5851
 epoch: 93, train_loss: 0.7522, test_loss: 1.3103, test_f1: 0.5933
 epoch: 94, train_loss: 0.7295, test_loss: 1.3494, test_f1: 0.5873
 epoch: 95, train_loss: 0.7381, test_loss: 1.3472, test_f1: 0.5895
 epoch: 96, train_loss: 0.7215, test_loss: 1.3537, test_f1: 0.5974
 epoch: 97, train_loss: 0.7417, test_loss: 1.3557, test_f1: 0.6027
 epoch: 98, train_loss: 0.7086, test_loss: 1.3396, test_f1: 0.5953
 epoch: 99, train_loss: 0.7291, test_loss: 1.3253, test_f1: 0.5938
##################ITERATION #3 ****************************************
 epoch: 0, train_loss: 1.2383, test_loss: 1.2643, test_f1: 0.2583
 epoch: 1, train_loss: 1.1535, test_loss: 1.2052, test_f1: 0.2945
 epoch: 2, train_loss: 1.1274, test_loss: 1.1944, test_f1: 0.3381
 epoch: 3, train_loss: 1.1026, test_loss: 1.1680, test_f1: 0.3762
 epoch: 4, train_loss: 1.0896, test_loss: 1.1540, test_f1: 0.3764
 epoch: 5, train_loss: 1.0732, test_loss: 1.1375, test_f1: 0.4462
 epoch: 6, train_loss: 1.0505, test_loss: 1.1297, test_f1: 0.4191
 epoch: 7, train_loss: 1.0526, test_loss: 1.0989, test_f1: 0.4801
 epoch: 8, train_loss: 1.0330, test_loss: 1.1087, test_f1: 0.4652
 epoch: 9, train_loss: 1.0242, test_loss: 1.0915, test_f1: 0.4776
 epoch: 10, train_loss: 0.9993, test_loss: 1.0887, test_f1: 0.4895
 epoch: 11, train_loss: 1.0081, test_loss: 1.0853, test_f1: 0.5000
 epoch: 12, train_loss: 0.9940, test_loss: 1.0754, test_f1: 0.4911
 epoch: 13, train_loss: 0.9691, test_loss: 1.0794, test_f1: 0.4828
 epoch: 14, train_loss: 0.9621, test_loss: 1.0804, test_f1: 0.4884
 epoch: 15, train_loss: 0.9540, test_loss: 1.0698, test_f1: 0.4842
 epoch: 16, train_loss: 0.9482, test_loss: 1.0798, test_f1: 0.4998
 epoch: 17, train_loss: 0.9439, test_loss: 1.0808, test_f1: 0.5001
 epoch: 18, train_loss: 0.9330, test_loss: 1.0732, test_f1: 0.5141
 epoch: 19, train_loss: 0.9438, test_loss: 1.0557, test_f1: 0.5092
 epoch: 20, train_loss: 0.9197, test_loss: 1.0519, test_f1: 0.5141
 epoch: 21, train_loss: 0.9187, test_loss: 1.0778, test_f1: 0.5184
 epoch: 22, train_loss: 0.9071, test_loss: 1.0604, test_f1: 0.5261
 epoch: 23, train_loss: 0.9059, test_loss: 1.0704, test_f1: 0.5191
 epoch: 24, train_loss: 0.9008, test_loss: 1.0709, test_f1: 0.5473
 epoch: 25, train_loss: 0.8929, test_loss: 1.0724, test_f1: 0.5308
 epoch: 26, train_loss: 0.8865, test_loss: 1.0501, test_f1: 0.5523
 epoch: 27, train_loss: 0.8788, test_loss: 1.0543, test_f1: 0.5354
 epoch: 28, train_loss: 0.8740, test_loss: 1.0265, test_f1: 0.5266
 epoch: 29, train_loss: 0.8666, test_loss: 1.0370, test_f1: 0.5437
 epoch: 30, train_loss: 0.8568, test_loss: 1.0449, test_f1: 0.5488
 epoch: 31, train_loss: 0.8590, test_loss: 1.0381, test_f1: 0.5426
 epoch: 32, train_loss: 0.8537, test_loss: 1.0551, test_f1: 0.5554
 epoch: 33, train_loss: 0.8369, test_loss: 1.0926, test_f1: 0.5508
 epoch: 34, train_loss: 0.8501, test_loss: 1.0588, test_f1: 0.5528
 epoch: 35, train_loss: 0.8290, test_loss: 1.0390, test_f1: 0.5555
 epoch: 36, train_loss: 0.8208, test_loss: 1.0805, test_f1: 0.5562
 epoch: 37, train_loss: 0.8220, test_loss: 1.0367, test_f1: 0.5611
 epoch: 38, train_loss: 0.8143, test_loss: 1.0504, test_f1: 0.5706
 epoch: 39, train_loss: 0.8138, test_loss: 1.0365, test_f1: 0.5550
 epoch: 40, train_loss: 0.8165, test_loss: 1.0083, test_f1: 0.5804
 epoch: 41, train_loss: 0.8135, test_loss: 1.0688, test_f1: 0.5505
 epoch: 42, train_loss: 0.8117, test_loss: 1.0484, test_f1: 0.5689
 epoch: 43, train_loss: 0.7981, test_loss: 1.0516, test_f1: 0.5794
 epoch: 44, train_loss: 0.7918, test_loss: 1.0583, test_f1: 0.5969
 epoch: 45, train_loss: 0.8109, test_loss: 1.0628, test_f1: 0.5647
 epoch: 46, train_loss: 0.7830, test_loss: 1.0427, test_f1: 0.5965
 epoch: 47, train_loss: 0.7759, test_loss: 1.0602, test_f1: 0.5918
 epoch: 48, train_loss: 0.7917, test_loss: 1.0594, test_f1: 0.5893
 epoch: 49, train_loss: 0.7748, test_loss: 1.0048, test_f1: 0.6057
 epoch: 50, train_loss: 0.7754, test_loss: 1.0651, test_f1: 0.6057
 epoch: 51, train_loss: 0.7712, test_loss: 1.0391, test_f1: 0.5951
 epoch: 52, train_loss: 0.7669, test_loss: 1.0609, test_f1: 0.6034
 epoch: 53, train_loss: 0.7694, test_loss: 1.0488, test_f1: 0.6218
 epoch: 54, train_loss: 0.7619, test_loss: 1.0647, test_f1: 0.6001
 epoch: 55, train_loss: 0.7459, test_loss: 1.0689, test_f1: 0.6109
 epoch: 56, train_loss: 0.7280, test_loss: 1.0834, test_f1: 0.6104
 epoch: 57, train_loss: 0.7531, test_loss: 1.0669, test_f1: 0.6093
 epoch: 58, train_loss: 0.7538, test_loss: 1.0683, test_f1: 0.5885
 epoch: 59, train_loss: 0.7635, test_loss: 1.0840, test_f1: 0.5921
 epoch: 60, train_loss: 0.7590, test_loss: 1.0608, test_f1: 0.6060
 epoch: 61, train_loss: 0.7486, test_loss: 1.0743, test_f1: 0.6108
 epoch: 62, train_loss: 0.7410, test_loss: 1.0986, test_f1: 0.6025
 epoch: 63, train_loss: 0.7539, test_loss: 1.0953, test_f1: 0.6010
 epoch: 64, train_loss: 0.7412, test_loss: 1.0802, test_f1: 0.6087
 epoch: 65, train_loss: 0.7360, test_loss: 1.0917, test_f1: 0.5935
 epoch: 66, train_loss: 0.7332, test_loss: 1.0784, test_f1: 0.6038
 epoch: 67, train_loss: 0.7219, test_loss: 1.0711, test_f1: 0.5979
 epoch: 68, train_loss: 0.7331, test_loss: 1.0969, test_f1: 0.6056
 epoch: 69, train_loss: 0.7402, test_loss: 1.0950, test_f1: 0.6140
 epoch: 70, train_loss: 0.7393, test_loss: 1.0957, test_f1: 0.6231
 epoch: 71, train_loss: 0.7313, test_loss: 1.1234, test_f1: 0.6264
 epoch: 72, train_loss: 0.7326, test_loss: 1.1219, test_f1: 0.5966
 epoch: 73, train_loss: 0.7151, test_loss: 1.0999, test_f1: 0.5875
 epoch: 74, train_loss: 0.7263, test_loss: 1.1184, test_f1: 0.6245
 epoch: 75, train_loss: 0.7308, test_loss: 1.0859, test_f1: 0.6051
 epoch: 76, train_loss: 0.7161, test_loss: 1.0985, test_f1: 0.6181
 epoch: 77, train_loss: 0.7119, test_loss: 1.0943, test_f1: 0.5999
 epoch: 78, train_loss: 0.7211, test_loss: 1.0926, test_f1: 0.5924
 epoch: 79, train_loss: 0.7121, test_loss: 1.1076, test_f1: 0.6002
 epoch: 80, train_loss: 0.7169, test_loss: 1.1113, test_f1: 0.5875
 epoch: 81, train_loss: 0.7180, test_loss: 1.0884, test_f1: 0.6034
 epoch: 82, train_loss: 0.7131, test_loss: 1.0999, test_f1: 0.6051
 epoch: 83, train_loss: 0.7204, test_loss: 1.1179, test_f1: 0.5856
 epoch: 84, train_loss: 0.7059, test_loss: 1.1106, test_f1: 0.6051
 epoch: 85, train_loss: 0.6969, test_loss: 1.1289, test_f1: 0.5930
 epoch: 86, train_loss: 0.7023, test_loss: 1.1410, test_f1: 0.6003
 epoch: 87, train_loss: 0.7139, test_loss: 1.1538, test_f1: 0.6003
 epoch: 88, train_loss: 0.6908, test_loss: 1.1063, test_f1: 0.6025
 epoch: 89, train_loss: 0.6900, test_loss: 1.1408, test_f1: 0.6035
 epoch: 90, train_loss: 0.6908, test_loss: 1.1450, test_f1: 0.6173
 epoch: 91, train_loss: 0.6905, test_loss: 1.1311, test_f1: 0.5974
 epoch: 92, train_loss: 0.7061, test_loss: 1.1466, test_f1: 0.6022
 epoch: 93, train_loss: 0.6909, test_loss: 1.1306, test_f1: 0.6010
 epoch: 94, train_loss: 0.6993, test_loss: 1.1331, test_f1: 0.6086
 epoch: 95, train_loss: 0.6775, test_loss: 1.1539, test_f1: 0.6018
 epoch: 96, train_loss: 0.6899, test_loss: 1.1558, test_f1: 0.6076
 epoch: 97, train_loss: 0.6977, test_loss: 1.1635, test_f1: 0.6009
 epoch: 98, train_loss: 0.6875, test_loss: 1.1405, test_f1: 0.6165
 epoch: 99, train_loss: 0.6659, test_loss: 1.1580, test_f1: 0.6271
##################ITERATION #4 ****************************************
 epoch: 0, train_loss: 1.2228, test_loss: 1.2732, test_f1: 0.2736
 epoch: 1, train_loss: 1.1559, test_loss: 1.2082, test_f1: 0.3724
 epoch: 2, train_loss: 1.1347, test_loss: 1.1737, test_f1: 0.3899
 epoch: 3, train_loss: 1.1091, test_loss: 1.1599, test_f1: 0.4331
 epoch: 4, train_loss: 1.0818, test_loss: 1.1352, test_f1: 0.4479
 epoch: 5, train_loss: 1.0863, test_loss: 1.1250, test_f1: 0.4619
 epoch: 6, train_loss: 1.0621, test_loss: 1.1049, test_f1: 0.4786
 epoch: 7, train_loss: 1.0551, test_loss: 1.0999, test_f1: 0.5078
 epoch: 8, train_loss: 1.0471, test_loss: 1.0939, test_f1: 0.4744
 epoch: 9, train_loss: 1.0240, test_loss: 1.0950, test_f1: 0.4972
 epoch: 10, train_loss: 1.0125, test_loss: 1.0868, test_f1: 0.5155
 epoch: 11, train_loss: 1.0201, test_loss: 1.0681, test_f1: 0.4945
 epoch: 12, train_loss: 0.9972, test_loss: 1.0486, test_f1: 0.5187
 epoch: 13, train_loss: 0.9984, test_loss: 1.0640, test_f1: 0.5236
 epoch: 14, train_loss: 0.9965, test_loss: 1.0633, test_f1: 0.5296
 epoch: 15, train_loss: 0.9814, test_loss: 1.0641, test_f1: 0.5209
 epoch: 16, train_loss: 0.9755, test_loss: 1.0531, test_f1: 0.5205
 epoch: 17, train_loss: 0.9770, test_loss: 1.0500, test_f1: 0.5276
 epoch: 18, train_loss: 0.9522, test_loss: 1.0462, test_f1: 0.5282
 epoch: 19, train_loss: 0.9501, test_loss: 1.0326, test_f1: 0.5329
 epoch: 20, train_loss: 0.9480, test_loss: 1.0420, test_f1: 0.5260
 epoch: 21, train_loss: 0.9348, test_loss: 1.0725, test_f1: 0.5206
 epoch: 22, train_loss: 0.9501, test_loss: 1.0409, test_f1: 0.5310
 epoch: 23, train_loss: 0.9428, test_loss: 1.0331, test_f1: 0.5413
 epoch: 24, train_loss: 0.9348, test_loss: 1.0344, test_f1: 0.5430
 epoch: 25, train_loss: 0.9320, test_loss: 1.0380, test_f1: 0.5271
 epoch: 26, train_loss: 0.9268, test_loss: 1.0267, test_f1: 0.5256
 epoch: 27, train_loss: 0.9139, test_loss: 1.0133, test_f1: 0.5318
 epoch: 28, train_loss: 0.9131, test_loss: 1.0186, test_f1: 0.5496
 epoch: 29, train_loss: 0.9021, test_loss: 1.0537, test_f1: 0.5306
 epoch: 30, train_loss: 0.9033, test_loss: 1.0598, test_f1: 0.5256
 epoch: 31, train_loss: 0.8959, test_loss: 1.0429, test_f1: 0.5380
 epoch: 32, train_loss: 0.8879, test_loss: 1.0458, test_f1: 0.5480
 epoch: 33, train_loss: 0.8916, test_loss: 1.0347, test_f1: 0.5357
 epoch: 34, train_loss: 0.8741, test_loss: 1.0594, test_f1: 0.5358
 epoch: 35, train_loss: 0.8737, test_loss: 1.0488, test_f1: 0.5535
 epoch: 36, train_loss: 0.8616, test_loss: 1.0480, test_f1: 0.5385
 epoch: 37, train_loss: 0.8792, test_loss: 1.0543, test_f1: 0.5529
 epoch: 38, train_loss: 0.8683, test_loss: 1.0713, test_f1: 0.5429
 epoch: 39, train_loss: 0.8639, test_loss: 1.0306, test_f1: 0.5737
 epoch: 40, train_loss: 0.8744, test_loss: 1.0531, test_f1: 0.5391
 epoch: 41, train_loss: 0.8457, test_loss: 1.0201, test_f1: 0.5633
 epoch: 42, train_loss: 0.8585, test_loss: 1.0482, test_f1: 0.5609
 epoch: 43, train_loss: 0.8534, test_loss: 1.0437, test_f1: 0.5340
 epoch: 44, train_loss: 0.8313, test_loss: 1.0457, test_f1: 0.5681
 epoch: 45, train_loss: 0.8309, test_loss: 1.0360, test_f1: 0.5820
 epoch: 46, train_loss: 0.8328, test_loss: 1.0287, test_f1: 0.5786
 epoch: 47, train_loss: 0.8274, test_loss: 1.0567, test_f1: 0.5659
 epoch: 48, train_loss: 0.8269, test_loss: 1.0646, test_f1: 0.5608
 epoch: 49, train_loss: 0.8202, test_loss: 1.0692, test_f1: 0.5555
 epoch: 50, train_loss: 0.8082, test_loss: 1.0464, test_f1: 0.5873
 epoch: 51, train_loss: 0.8209, test_loss: 1.0733, test_f1: 0.5671
 epoch: 52, train_loss: 0.8189, test_loss: 1.0552, test_f1: 0.5591
 epoch: 53, train_loss: 0.7963, test_loss: 1.0692, test_f1: 0.5499
 epoch: 54, train_loss: 0.7977, test_loss: 1.0635, test_f1: 0.5596
 epoch: 55, train_loss: 0.7912, test_loss: 1.0759, test_f1: 0.5656
 epoch: 56, train_loss: 0.7795, test_loss: 1.0652, test_f1: 0.5555
 epoch: 57, train_loss: 0.7947, test_loss: 1.1119, test_f1: 0.5512
 epoch: 58, train_loss: 0.7915, test_loss: 1.0846, test_f1: 0.5660
 epoch: 59, train_loss: 0.7985, test_loss: 1.0644, test_f1: 0.5634
 epoch: 60, train_loss: 0.7819, test_loss: 1.0930, test_f1: 0.5549
 epoch: 61, train_loss: 0.7831, test_loss: 1.0921, test_f1: 0.5634
 epoch: 62, train_loss: 0.7786, test_loss: 1.0884, test_f1: 0.5552
 epoch: 63, train_loss: 0.7828, test_loss: 1.0908, test_f1: 0.5647
 epoch: 64, train_loss: 0.7658, test_loss: 1.0752, test_f1: 0.5661
 epoch: 65, train_loss: 0.7902, test_loss: 1.1023, test_f1: 0.5663
 epoch: 66, train_loss: 0.7833, test_loss: 1.0980, test_f1: 0.5722
 epoch: 67, train_loss: 0.7788, test_loss: 1.0787, test_f1: 0.5574
 epoch: 68, train_loss: 0.7651, test_loss: 1.1011, test_f1: 0.5385
 epoch: 69, train_loss: 0.7618, test_loss: 1.1222, test_f1: 0.5391
 epoch: 70, train_loss: 0.7737, test_loss: 1.0692, test_f1: 0.5831
 epoch: 71, train_loss: 0.7702, test_loss: 1.0935, test_f1: 0.5598
 epoch: 72, train_loss: 0.7655, test_loss: 1.0616, test_f1: 0.5891
 epoch: 73, train_loss: 0.7722, test_loss: 1.0799, test_f1: 0.5652
 epoch: 74, train_loss: 0.7614, test_loss: 1.0949, test_f1: 0.5642
 epoch: 75, train_loss: 0.7665, test_loss: 1.1371, test_f1: 0.5415
 epoch: 76, train_loss: 0.7557, test_loss: 1.0974, test_f1: 0.5745
 epoch: 77, train_loss: 0.7685, test_loss: 1.1075, test_f1: 0.5701
 epoch: 78, train_loss: 0.7430, test_loss: 1.0971, test_f1: 0.5701
 epoch: 79, train_loss: 0.7504, test_loss: 1.1114, test_f1: 0.5622
 epoch: 80, train_loss: 0.7638, test_loss: 1.1239, test_f1: 0.5731
 epoch: 81, train_loss: 0.7477, test_loss: 1.1191, test_f1: 0.5669
 epoch: 82, train_loss: 0.7452, test_loss: 1.1409, test_f1: 0.5753
 epoch: 83, train_loss: 0.7423, test_loss: 1.1215, test_f1: 0.5809
 epoch: 84, train_loss: 0.7409, test_loss: 1.1274, test_f1: 0.5704
 epoch: 85, train_loss: 0.7271, test_loss: 1.1570, test_f1: 0.5906
 epoch: 86, train_loss: 0.7432, test_loss: 1.1749, test_f1: 0.5582
 epoch: 87, train_loss: 0.7458, test_loss: 1.1617, test_f1: 0.5455
 epoch: 88, train_loss: 0.7390, test_loss: 1.1362, test_f1: 0.5807
 epoch: 89, train_loss: 0.7275, test_loss: 1.1661, test_f1: 0.5531
 epoch: 90, train_loss: 0.7316, test_loss: 1.1453, test_f1: 0.5618
 epoch: 91, train_loss: 0.7294, test_loss: 1.1196, test_f1: 0.5747
 epoch: 92, train_loss: 0.7326, test_loss: 1.1556, test_f1: 0.5566
 epoch: 93, train_loss: 0.7210, test_loss: 1.1562, test_f1: 0.5556
 epoch: 94, train_loss: 0.7235, test_loss: 1.1726, test_f1: 0.5668
 epoch: 95, train_loss: 0.7212, test_loss: 1.1497, test_f1: 0.5782
 epoch: 96, train_loss: 0.7174, test_loss: 1.1501, test_f1: 0.5538
 epoch: 97, train_loss: 0.7131, test_loss: 1.1416, test_f1: 0.5651
 epoch: 98, train_loss: 0.7080, test_loss: 1.1781, test_f1: 0.5424
 epoch: 99, train_loss: 0.7070, test_loss: 1.1517, test_f1: 0.5708
##################ITERATION #5 ****************************************
 epoch: 0, train_loss: 1.2277, test_loss: 1.2785, test_f1: 0.3759
 epoch: 1, train_loss: 1.1370, test_loss: 1.1955, test_f1: 0.4048
 epoch: 2, train_loss: 1.1085, test_loss: 1.1720, test_f1: 0.4429
 epoch: 3, train_loss: 1.0976, test_loss: 1.1422, test_f1: 0.4912
 epoch: 4, train_loss: 1.0742, test_loss: 1.1207, test_f1: 0.5174
 epoch: 5, train_loss: 1.0604, test_loss: 1.1148, test_f1: 0.5045
 epoch: 6, train_loss: 1.0405, test_loss: 1.1038, test_f1: 0.5075
 epoch: 7, train_loss: 1.0357, test_loss: 1.0953, test_f1: 0.5150
 epoch: 8, train_loss: 1.0085, test_loss: 1.0813, test_f1: 0.5077
 epoch: 9, train_loss: 1.0074, test_loss: 1.0601, test_f1: 0.5128
 epoch: 10, train_loss: 1.0014, test_loss: 1.0450, test_f1: 0.5270
 epoch: 11, train_loss: 0.9901, test_loss: 1.0546, test_f1: 0.5266
 epoch: 12, train_loss: 0.9686, test_loss: 1.0482, test_f1: 0.5382
 epoch: 13, train_loss: 0.9687, test_loss: 1.0379, test_f1: 0.5227
 epoch: 14, train_loss: 0.9708, test_loss: 1.0501, test_f1: 0.5224
 epoch: 15, train_loss: 0.9622, test_loss: 1.0373, test_f1: 0.5328
 epoch: 16, train_loss: 0.9410, test_loss: 1.0533, test_f1: 0.5511
 epoch: 17, train_loss: 0.9380, test_loss: 1.0344, test_f1: 0.5405
 epoch: 18, train_loss: 0.9281, test_loss: 1.0285, test_f1: 0.5479
 epoch: 19, train_loss: 0.9228, test_loss: 1.0101, test_f1: 0.5695
 epoch: 20, train_loss: 0.9294, test_loss: 1.0255, test_f1: 0.5437
 epoch: 21, train_loss: 0.9143, test_loss: 1.0284, test_f1: 0.5746
 epoch: 22, train_loss: 0.9230, test_loss: 1.0408, test_f1: 0.5527
 epoch: 23, train_loss: 0.8943, test_loss: 1.0333, test_f1: 0.5816
 epoch: 24, train_loss: 0.8918, test_loss: 1.0116, test_f1: 0.5552
 epoch: 25, train_loss: 0.8838, test_loss: 1.0385, test_f1: 0.5695
 epoch: 26, train_loss: 0.8681, test_loss: 1.0329, test_f1: 0.5572
 epoch: 27, train_loss: 0.8649, test_loss: 1.0274, test_f1: 0.5673
 epoch: 28, train_loss: 0.8609, test_loss: 1.0371, test_f1: 0.5757
 epoch: 29, train_loss: 0.8862, test_loss: 1.0567, test_f1: 0.5671
 epoch: 30, train_loss: 0.8572, test_loss: 1.0225, test_f1: 0.5713
 epoch: 31, train_loss: 0.8680, test_loss: 1.0649, test_f1: 0.5650
 epoch: 32, train_loss: 0.8533, test_loss: 1.0333, test_f1: 0.5671
 epoch: 33, train_loss: 0.8555, test_loss: 1.0356, test_f1: 0.5648
 epoch: 34, train_loss: 0.8321, test_loss: 1.0526, test_f1: 0.5578
 epoch: 35, train_loss: 0.8412, test_loss: 1.0415, test_f1: 0.5597
 epoch: 36, train_loss: 0.8393, test_loss: 1.0401, test_f1: 0.5750
 epoch: 37, train_loss: 0.8341, test_loss: 1.0539, test_f1: 0.5747
 epoch: 38, train_loss: 0.8218, test_loss: 1.0431, test_f1: 0.5694
 epoch: 39, train_loss: 0.8162, test_loss: 1.0344, test_f1: 0.5683
 epoch: 40, train_loss: 0.8329, test_loss: 1.0639, test_f1: 0.5701
 epoch: 41, train_loss: 0.8148, test_loss: 1.0664, test_f1: 0.5694
 epoch: 42, train_loss: 0.7996, test_loss: 1.0288, test_f1: 0.5683
 epoch: 43, train_loss: 0.8211, test_loss: 1.0596, test_f1: 0.5776
 epoch: 44, train_loss: 0.8029, test_loss: 1.0154, test_f1: 0.5650
 epoch: 45, train_loss: 0.8029, test_loss: 1.0446, test_f1: 0.5980
 epoch: 46, train_loss: 0.8074, test_loss: 1.0683, test_f1: 0.5806
 epoch: 47, train_loss: 0.7831, test_loss: 1.0714, test_f1: 0.5664
 epoch: 48, train_loss: 0.7843, test_loss: 1.0493, test_f1: 0.5739
 epoch: 49, train_loss: 0.7786, test_loss: 1.0409, test_f1: 0.5873
 epoch: 50, train_loss: 0.7817, test_loss: 1.0800, test_f1: 0.5781
 epoch: 51, train_loss: 0.7605, test_loss: 1.0945, test_f1: 0.5889
 epoch: 52, train_loss: 0.7686, test_loss: 1.0977, test_f1: 0.5944
 epoch: 53, train_loss: 0.7713, test_loss: 1.0859, test_f1: 0.5830
 epoch: 54, train_loss: 0.7842, test_loss: 1.0636, test_f1: 0.5657
 epoch: 55, train_loss: 0.7620, test_loss: 1.1016, test_f1: 0.5888
 epoch: 56, train_loss: 0.7557, test_loss: 1.1101, test_f1: 0.5737
 epoch: 57, train_loss: 0.7722, test_loss: 1.1180, test_f1: 0.5900
 epoch: 58, train_loss: 0.7552, test_loss: 1.1073, test_f1: 0.5945
 epoch: 59, train_loss: 0.7537, test_loss: 1.1050, test_f1: 0.5797
 epoch: 60, train_loss: 0.7690, test_loss: 1.1080, test_f1: 0.5901
 epoch: 61, train_loss: 0.7638, test_loss: 1.1148, test_f1: 0.5854
 epoch: 62, train_loss: 0.7489, test_loss: 1.1115, test_f1: 0.5766
 epoch: 63, train_loss: 0.7414, test_loss: 1.1012, test_f1: 0.5841
 epoch: 64, train_loss: 0.7575, test_loss: 1.0949, test_f1: 0.5677
 epoch: 65, train_loss: 0.7558, test_loss: 1.1040, test_f1: 0.5745
 epoch: 66, train_loss: 0.7397, test_loss: 1.1238, test_f1: 0.5815
 epoch: 67, train_loss: 0.7457, test_loss: 1.1455, test_f1: 0.5767
 epoch: 68, train_loss: 0.7316, test_loss: 1.1703, test_f1: 0.5835
 epoch: 69, train_loss: 0.7286, test_loss: 1.1515, test_f1: 0.6010
 epoch: 70, train_loss: 0.7281, test_loss: 1.1429, test_f1: 0.5967
 epoch: 71, train_loss: 0.7314, test_loss: 1.1581, test_f1: 0.5875
 epoch: 72, train_loss: 0.7313, test_loss: 1.1599, test_f1: 0.5871
 epoch: 73, train_loss: 0.7231, test_loss: 1.1298, test_f1: 0.5729
 epoch: 74, train_loss: 0.7325, test_loss: 1.1744, test_f1: 0.5625
 epoch: 75, train_loss: 0.7215, test_loss: 1.1630, test_f1: 0.5779
 epoch: 76, train_loss: 0.7173, test_loss: 1.1588, test_f1: 0.5774
 epoch: 77, train_loss: 0.7212, test_loss: 1.1659, test_f1: 0.5786
 epoch: 78, train_loss: 0.7083, test_loss: 1.1424, test_f1: 0.5887
 epoch: 79, train_loss: 0.7231, test_loss: 1.1383, test_f1: 0.6041
 epoch: 80, train_loss: 0.7386, test_loss: 1.1595, test_f1: 0.5828
 epoch: 81, train_loss: 0.7248, test_loss: 1.1702, test_f1: 0.5764
 epoch: 82, train_loss: 0.7166, test_loss: 1.2163, test_f1: 0.5701
 epoch: 83, train_loss: 0.7139, test_loss: 1.1809, test_f1: 0.5813
 epoch: 84, train_loss: 0.7173, test_loss: 1.1772, test_f1: 0.5945
 epoch: 85, train_loss: 0.7149, test_loss: 1.1549, test_f1: 0.5824
 epoch: 86, train_loss: 0.6913, test_loss: 1.1838, test_f1: 0.6060
 epoch: 87, train_loss: 0.7163, test_loss: 1.2037, test_f1: 0.5839
 epoch: 88, train_loss: 0.6928, test_loss: 1.2030, test_f1: 0.6007
 epoch: 89, train_loss: 0.7065, test_loss: 1.1904, test_f1: 0.5785
 epoch: 90, train_loss: 0.6807, test_loss: 1.1935, test_f1: 0.5978
 epoch: 91, train_loss: 0.6942, test_loss: 1.2228, test_f1: 0.5912
 epoch: 92, train_loss: 0.7250, test_loss: 1.2014, test_f1: 0.5762
 epoch: 93, train_loss: 0.7016, test_loss: 1.2037, test_f1: 0.5681
 epoch: 94, train_loss: 0.7130, test_loss: 1.2241, test_f1: 0.5828
 epoch: 95, train_loss: 0.6884, test_loss: 1.2319, test_f1: 0.5834
 epoch: 96, train_loss: 0.7013, test_loss: 1.2569, test_f1: 0.5783
 epoch: 97, train_loss: 0.6891, test_loss: 1.2211, test_f1: 0.5859
 epoch: 98, train_loss: 0.7019, test_loss: 1.2298, test_f1: 0.5833
 epoch: 99, train_loss: 0.6882, test_loss: 1.2676, test_f1: 0.5860
##################ITERATION #6 ****************************************
 epoch: 0, train_loss: 1.2408, test_loss: 1.2882, test_f1: 0.2394
 epoch: 1, train_loss: 1.1385, test_loss: 1.1874, test_f1: 0.3444
 epoch: 2, train_loss: 1.1044, test_loss: 1.1527, test_f1: 0.4278
 epoch: 3, train_loss: 1.0977, test_loss: 1.1482, test_f1: 0.4521
 epoch: 4, train_loss: 1.0674, test_loss: 1.1194, test_f1: 0.4837
 epoch: 5, train_loss: 1.0552, test_loss: 1.1054, test_f1: 0.5043
 epoch: 6, train_loss: 1.0330, test_loss: 1.0971, test_f1: 0.4843
 epoch: 7, train_loss: 1.0148, test_loss: 1.0901, test_f1: 0.5031
 epoch: 8, train_loss: 1.0061, test_loss: 1.0859, test_f1: 0.5124
 epoch: 9, train_loss: 0.9941, test_loss: 1.0896, test_f1: 0.5171
 epoch: 10, train_loss: 0.9733, test_loss: 1.0841, test_f1: 0.5242
 epoch: 11, train_loss: 0.9672, test_loss: 1.0831, test_f1: 0.5264
 epoch: 12, train_loss: 0.9834, test_loss: 1.0864, test_f1: 0.5266
 epoch: 13, train_loss: 0.9581, test_loss: 1.0748, test_f1: 0.5224
 epoch: 14, train_loss: 0.9638, test_loss: 1.0770, test_f1: 0.5294
 epoch: 15, train_loss: 0.9375, test_loss: 1.0795, test_f1: 0.5311
 epoch: 16, train_loss: 0.9347, test_loss: 1.0785, test_f1: 0.5285
 epoch: 17, train_loss: 0.9412, test_loss: 1.0794, test_f1: 0.5368
 epoch: 18, train_loss: 0.9255, test_loss: 1.0938, test_f1: 0.5416
 epoch: 19, train_loss: 0.9258, test_loss: 1.0868, test_f1: 0.5426
 epoch: 20, train_loss: 0.9088, test_loss: 1.0827, test_f1: 0.5543
 epoch: 21, train_loss: 0.9023, test_loss: 1.0623, test_f1: 0.5496
 epoch: 22, train_loss: 0.9011, test_loss: 1.0724, test_f1: 0.5535
 epoch: 23, train_loss: 0.8986, test_loss: 1.0806, test_f1: 0.5505
 epoch: 24, train_loss: 0.8853, test_loss: 1.0858, test_f1: 0.5484
 epoch: 25, train_loss: 0.8822, test_loss: 1.0647, test_f1: 0.5514
 epoch: 26, train_loss: 0.8706, test_loss: 1.0794, test_f1: 0.5644
 epoch: 27, train_loss: 0.8744, test_loss: 1.0861, test_f1: 0.5711
 epoch: 28, train_loss: 0.8707, test_loss: 1.0613, test_f1: 0.5913
 epoch: 29, train_loss: 0.8619, test_loss: 1.0642, test_f1: 0.5976
 epoch: 30, train_loss: 0.8622, test_loss: 1.0849, test_f1: 0.5754
 epoch: 31, train_loss: 0.8495, test_loss: 1.0663, test_f1: 0.5716
 epoch: 32, train_loss: 0.8601, test_loss: 1.0903, test_f1: 0.5468
 epoch: 33, train_loss: 0.8477, test_loss: 1.0712, test_f1: 0.5638
 epoch: 34, train_loss: 0.8474, test_loss: 1.0857, test_f1: 0.5650
 epoch: 35, train_loss: 0.8442, test_loss: 1.0921, test_f1: 0.5462
 epoch: 36, train_loss: 0.8265, test_loss: 1.1208, test_f1: 0.5568
 epoch: 37, train_loss: 0.8165, test_loss: 1.0788, test_f1: 0.5677
 epoch: 38, train_loss: 0.8205, test_loss: 1.0967, test_f1: 0.5449
 epoch: 39, train_loss: 0.8207, test_loss: 1.0630, test_f1: 0.5541
 epoch: 40, train_loss: 0.8182, test_loss: 1.0776, test_f1: 0.5594
 epoch: 41, train_loss: 0.8014, test_loss: 1.1339, test_f1: 0.5431
 epoch: 42, train_loss: 0.8188, test_loss: 1.1029, test_f1: 0.5696
 epoch: 43, train_loss: 0.8142, test_loss: 1.1099, test_f1: 0.5550
 epoch: 44, train_loss: 0.7996, test_loss: 1.1281, test_f1: 0.5453
 epoch: 45, train_loss: 0.8003, test_loss: 1.1304, test_f1: 0.5505
 epoch: 46, train_loss: 0.8111, test_loss: 1.0827, test_f1: 0.5716
 epoch: 47, train_loss: 0.8009, test_loss: 1.0892, test_f1: 0.5665
 epoch: 48, train_loss: 0.7980, test_loss: 1.0699, test_f1: 0.5689
 epoch: 49, train_loss: 0.7882, test_loss: 1.1177, test_f1: 0.5376
 epoch: 50, train_loss: 0.7984, test_loss: 1.0737, test_f1: 0.5703
 epoch: 51, train_loss: 0.7838, test_loss: 1.1004, test_f1: 0.5566
 epoch: 52, train_loss: 0.7718, test_loss: 1.0904, test_f1: 0.5541
 epoch: 53, train_loss: 0.7697, test_loss: 1.1193, test_f1: 0.5478
 epoch: 54, train_loss: 0.7564, test_loss: 1.1324, test_f1: 0.5474
 epoch: 55, train_loss: 0.7724, test_loss: 1.1208, test_f1: 0.5361
 epoch: 56, train_loss: 0.7568, test_loss: 1.1170, test_f1: 0.5494
 epoch: 57, train_loss: 0.7659, test_loss: 1.1284, test_f1: 0.5741
 epoch: 58, train_loss: 0.7692, test_loss: 1.1451, test_f1: 0.5517
 epoch: 59, train_loss: 0.7474, test_loss: 1.1256, test_f1: 0.5375
 epoch: 60, train_loss: 0.7539, test_loss: 1.1417, test_f1: 0.5541
 epoch: 61, train_loss: 0.7649, test_loss: 1.1483, test_f1: 0.5468
 epoch: 62, train_loss: 0.7531, test_loss: 1.1186, test_f1: 0.5607
 epoch: 63, train_loss: 0.7405, test_loss: 1.1209, test_f1: 0.5619
 epoch: 64, train_loss: 0.7503, test_loss: 1.1097, test_f1: 0.5783
 epoch: 65, train_loss: 0.7459, test_loss: 1.1489, test_f1: 0.5572
 epoch: 66, train_loss: 0.7346, test_loss: 1.1421, test_f1: 0.5486
 epoch: 67, train_loss: 0.7420, test_loss: 1.1480, test_f1: 0.5703
 epoch: 68, train_loss: 0.7335, test_loss: 1.1351, test_f1: 0.5650
 epoch: 69, train_loss: 0.7300, test_loss: 1.1384, test_f1: 0.5587
 epoch: 70, train_loss: 0.7397, test_loss: 1.1613, test_f1: 0.5552
 epoch: 71, train_loss: 0.7451, test_loss: 1.1691, test_f1: 0.5525
 epoch: 72, train_loss: 0.7454, test_loss: 1.1677, test_f1: 0.5542
 epoch: 73, train_loss: 0.7444, test_loss: 1.1597, test_f1: 0.5652
 epoch: 74, train_loss: 0.7395, test_loss: 1.1982, test_f1: 0.5434
 epoch: 75, train_loss: 0.7301, test_loss: 1.1891, test_f1: 0.5489
 epoch: 76, train_loss: 0.7467, test_loss: 1.2086, test_f1: 0.5461
 epoch: 77, train_loss: 0.7166, test_loss: 1.1996, test_f1: 0.5540
 epoch: 78, train_loss: 0.7310, test_loss: 1.2311, test_f1: 0.5622
 epoch: 79, train_loss: 0.7050, test_loss: 1.1833, test_f1: 0.5578
 epoch: 80, train_loss: 0.7274, test_loss: 1.2233, test_f1: 0.5401
 epoch: 81, train_loss: 0.7268, test_loss: 1.1817, test_f1: 0.5572
 epoch: 82, train_loss: 0.7222, test_loss: 1.1936, test_f1: 0.5650
 epoch: 83, train_loss: 0.7117, test_loss: 1.1791, test_f1: 0.5574
 epoch: 84, train_loss: 0.7150, test_loss: 1.2408, test_f1: 0.5578
 epoch: 85, train_loss: 0.7260, test_loss: 1.2271, test_f1: 0.5500
 epoch: 86, train_loss: 0.7136, test_loss: 1.2621, test_f1: 0.5428
 epoch: 87, train_loss: 0.7174, test_loss: 1.2222, test_f1: 0.5619
 epoch: 88, train_loss: 0.7118, test_loss: 1.2173, test_f1: 0.5584
 epoch: 89, train_loss: 0.7085, test_loss: 1.1998, test_f1: 0.5690
 epoch: 90, train_loss: 0.7200, test_loss: 1.1877, test_f1: 0.5843
 epoch: 91, train_loss: 0.6984, test_loss: 1.2271, test_f1: 0.5415
 epoch: 92, train_loss: 0.7145, test_loss: 1.1929, test_f1: 0.5764
 epoch: 93, train_loss: 0.7088, test_loss: 1.2006, test_f1: 0.5527
 epoch: 94, train_loss: 0.7114, test_loss: 1.2236, test_f1: 0.5561
 epoch: 95, train_loss: 0.6878, test_loss: 1.2186, test_f1: 0.5558
 epoch: 96, train_loss: 0.7012, test_loss: 1.2477, test_f1: 0.5492
 epoch: 97, train_loss: 0.7044, test_loss: 1.2231, test_f1: 0.5532
 epoch: 98, train_loss: 0.7058, test_loss: 1.2139, test_f1: 0.5447
 epoch: 99, train_loss: 0.7044, test_loss: 1.1830, test_f1: 0.5762
##################ITERATION #7 ****************************************
 epoch: 0, train_loss: 1.2379, test_loss: 1.3076, test_f1: 0.2978
 epoch: 1, train_loss: 1.1475, test_loss: 1.1877, test_f1: 0.4338
 epoch: 2, train_loss: 1.1264, test_loss: 1.1885, test_f1: 0.4392
 epoch: 3, train_loss: 1.0898, test_loss: 1.1874, test_f1: 0.4493
 epoch: 4, train_loss: 1.0770, test_loss: 1.1639, test_f1: 0.4439
 epoch: 5, train_loss: 1.0747, test_loss: 1.1473, test_f1: 0.4713
 epoch: 6, train_loss: 1.0469, test_loss: 1.1246, test_f1: 0.4812
 epoch: 7, train_loss: 1.0306, test_loss: 1.1104, test_f1: 0.4993
 epoch: 8, train_loss: 1.0364, test_loss: 1.1127, test_f1: 0.4879
 epoch: 9, train_loss: 1.0232, test_loss: 1.0950, test_f1: 0.5158
 epoch: 10, train_loss: 1.0103, test_loss: 1.0923, test_f1: 0.5271
 epoch: 11, train_loss: 0.9836, test_loss: 1.0967, test_f1: 0.5175
 epoch: 12, train_loss: 0.9808, test_loss: 1.1076, test_f1: 0.5132
 epoch: 13, train_loss: 0.9761, test_loss: 1.0997, test_f1: 0.5171
 epoch: 14, train_loss: 0.9710, test_loss: 1.0923, test_f1: 0.5159
 epoch: 15, train_loss: 0.9804, test_loss: 1.0910, test_f1: 0.5154
 epoch: 16, train_loss: 0.9662, test_loss: 1.0782, test_f1: 0.5366
 epoch: 17, train_loss: 0.9541, test_loss: 1.0570, test_f1: 0.5480
 epoch: 18, train_loss: 0.9436, test_loss: 1.0742, test_f1: 0.5314
 epoch: 19, train_loss: 0.9453, test_loss: 1.0520, test_f1: 0.5406
 epoch: 20, train_loss: 0.9472, test_loss: 1.0537, test_f1: 0.5513
 epoch: 21, train_loss: 0.9430, test_loss: 1.0582, test_f1: 0.5532
 epoch: 22, train_loss: 0.9281, test_loss: 1.0500, test_f1: 0.5483
 epoch: 23, train_loss: 0.9195, test_loss: 1.0577, test_f1: 0.5405
 epoch: 24, train_loss: 0.9308, test_loss: 1.0350, test_f1: 0.5539
 epoch: 25, train_loss: 0.9034, test_loss: 1.0496, test_f1: 0.5509
 epoch: 26, train_loss: 0.9041, test_loss: 1.0415, test_f1: 0.5525
 epoch: 27, train_loss: 0.8950, test_loss: 1.0482, test_f1: 0.5568
 epoch: 28, train_loss: 0.8984, test_loss: 1.0378, test_f1: 0.5671
 epoch: 29, train_loss: 0.8929, test_loss: 1.0532, test_f1: 0.5514
 epoch: 30, train_loss: 0.8974, test_loss: 1.0351, test_f1: 0.5638
 epoch: 31, train_loss: 0.8625, test_loss: 1.0340, test_f1: 0.5661
 epoch: 32, train_loss: 0.8834, test_loss: 1.0273, test_f1: 0.5683
 epoch: 33, train_loss: 0.8783, test_loss: 1.0155, test_f1: 0.5917
 epoch: 34, train_loss: 0.8665, test_loss: 1.0322, test_f1: 0.5731
 epoch: 35, train_loss: 0.8645, test_loss: 1.0421, test_f1: 0.5700
 epoch: 36, train_loss: 0.8749, test_loss: 1.0236, test_f1: 0.5579
 epoch: 37, train_loss: 0.8689, test_loss: 0.9920, test_f1: 0.5734
 epoch: 38, train_loss: 0.8581, test_loss: 1.0320, test_f1: 0.5656
 epoch: 39, train_loss: 0.8579, test_loss: 1.0497, test_f1: 0.5594
 epoch: 40, train_loss: 0.8447, test_loss: 1.0198, test_f1: 0.5792
 epoch: 41, train_loss: 0.8539, test_loss: 1.0481, test_f1: 0.5854
 epoch: 42, train_loss: 0.8513, test_loss: 1.0684, test_f1: 0.5758
 epoch: 43, train_loss: 0.8582, test_loss: 1.0587, test_f1: 0.5841
 epoch: 44, train_loss: 0.8382, test_loss: 1.0310, test_f1: 0.5858
 epoch: 45, train_loss: 0.8368, test_loss: 0.9918, test_f1: 0.5975
 epoch: 46, train_loss: 0.8365, test_loss: 1.0464, test_f1: 0.5786
 epoch: 47, train_loss: 0.8375, test_loss: 1.0674, test_f1: 0.5900
 epoch: 48, train_loss: 0.8290, test_loss: 1.0516, test_f1: 0.5903
 epoch: 49, train_loss: 0.8221, test_loss: 1.0228, test_f1: 0.6018
 epoch: 50, train_loss: 0.8121, test_loss: 1.0653, test_f1: 0.5690
 epoch: 51, train_loss: 0.8029, test_loss: 1.0461, test_f1: 0.5846
 epoch: 52, train_loss: 0.8117, test_loss: 1.0520, test_f1: 0.5794
 epoch: 53, train_loss: 0.8060, test_loss: 1.0880, test_f1: 0.5844
 epoch: 54, train_loss: 0.8039, test_loss: 1.1025, test_f1: 0.5737
 epoch: 55, train_loss: 0.7840, test_loss: 1.0745, test_f1: 0.5881
 epoch: 56, train_loss: 0.7996, test_loss: 1.0738, test_f1: 0.5975
 epoch: 57, train_loss: 0.7973, test_loss: 1.0539, test_f1: 0.5894
 epoch: 58, train_loss: 0.8039, test_loss: 1.0463, test_f1: 0.5955
 epoch: 59, train_loss: 0.8001, test_loss: 1.0982, test_f1: 0.5847
 epoch: 60, train_loss: 0.8059, test_loss: 1.0408, test_f1: 0.5961
 epoch: 61, train_loss: 0.7925, test_loss: 1.1132, test_f1: 0.5743
 epoch: 62, train_loss: 0.7823, test_loss: 1.0821, test_f1: 0.5878
 epoch: 63, train_loss: 0.8099, test_loss: 1.0674, test_f1: 0.6113
 epoch: 64, train_loss: 0.7853, test_loss: 1.0762, test_f1: 0.5837
 epoch: 65, train_loss: 0.7766, test_loss: 1.0825, test_f1: 0.5995
 epoch: 66, train_loss: 0.7862, test_loss: 1.0918, test_f1: 0.5960
 epoch: 67, train_loss: 0.7925, test_loss: 1.0963, test_f1: 0.6033
 epoch: 68, train_loss: 0.7821, test_loss: 1.0859, test_f1: 0.5824
 epoch: 69, train_loss: 0.7728, test_loss: 1.0823, test_f1: 0.5926
 epoch: 70, train_loss: 0.7635, test_loss: 1.0766, test_f1: 0.5913
 epoch: 71, train_loss: 0.7786, test_loss: 1.1249, test_f1: 0.5852
 epoch: 72, train_loss: 0.7671, test_loss: 1.0984, test_f1: 0.6058
 epoch: 73, train_loss: 0.7746, test_loss: 1.0875, test_f1: 0.5980
 epoch: 74, train_loss: 0.7833, test_loss: 1.1174, test_f1: 0.5957
 epoch: 75, train_loss: 0.7659, test_loss: 1.0751, test_f1: 0.6058
 epoch: 76, train_loss: 0.7669, test_loss: 1.0990, test_f1: 0.5913
 epoch: 77, train_loss: 0.7533, test_loss: 1.0935, test_f1: 0.5889
 epoch: 78, train_loss: 0.7720, test_loss: 1.0998, test_f1: 0.6020
 epoch: 79, train_loss: 0.7682, test_loss: 1.1247, test_f1: 0.5959
 epoch: 80, train_loss: 0.7536, test_loss: 1.1068, test_f1: 0.5994
 epoch: 81, train_loss: 0.7494, test_loss: 1.0792, test_f1: 0.6047
 epoch: 82, train_loss: 0.7687, test_loss: 1.1202, test_f1: 0.5889
 epoch: 83, train_loss: 0.7542, test_loss: 1.1334, test_f1: 0.5913
 epoch: 84, train_loss: 0.7575, test_loss: 1.1021, test_f1: 0.5966
 epoch: 85, train_loss: 0.7523, test_loss: 1.1102, test_f1: 0.5964
 epoch: 86, train_loss: 0.7651, test_loss: 1.0940, test_f1: 0.5932
 epoch: 87, train_loss: 0.7555, test_loss: 1.1177, test_f1: 0.6095
 epoch: 88, train_loss: 0.7439, test_loss: 1.1305, test_f1: 0.5988
 epoch: 89, train_loss: 0.7431, test_loss: 1.1441, test_f1: 0.5857
 epoch: 90, train_loss: 0.7483, test_loss: 1.1470, test_f1: 0.5752
 epoch: 91, train_loss: 0.7611, test_loss: 1.1297, test_f1: 0.5849
 epoch: 92, train_loss: 0.7287, test_loss: 1.1500, test_f1: 0.5825
 epoch: 93, train_loss: 0.7561, test_loss: 1.1561, test_f1: 0.6012
 epoch: 94, train_loss: 0.7435, test_loss: 1.1569, test_f1: 0.6058
 epoch: 95, train_loss: 0.7339, test_loss: 1.1631, test_f1: 0.5780
 epoch: 96, train_loss: 0.7306, test_loss: 1.1822, test_f1: 0.5753
 epoch: 97, train_loss: 0.7335, test_loss: 1.1238, test_f1: 0.6033
 epoch: 98, train_loss: 0.7393, test_loss: 1.1526, test_f1: 0.6048
 epoch: 99, train_loss: 0.7235, test_loss: 1.1334, test_f1: 0.6092
##################ITERATION #8 ****************************************
 epoch: 0, train_loss: 1.2826, test_loss: 1.2259, test_f1: 0.3661
 epoch: 1, train_loss: 1.1473, test_loss: 1.1564, test_f1: 0.4097
 epoch: 2, train_loss: 1.1081, test_loss: 1.1402, test_f1: 0.4497
 epoch: 3, train_loss: 1.0934, test_loss: 1.1277, test_f1: 0.4516
 epoch: 4, train_loss: 1.0931, test_loss: 1.1025, test_f1: 0.4831
 epoch: 5, train_loss: 1.0686, test_loss: 1.0971, test_f1: 0.4894
 epoch: 6, train_loss: 1.0517, test_loss: 1.0799, test_f1: 0.4943
 epoch: 7, train_loss: 1.0207, test_loss: 1.0743, test_f1: 0.5203
 epoch: 8, train_loss: 1.0389, test_loss: 1.0559, test_f1: 0.5283
 epoch: 9, train_loss: 1.0140, test_loss: 1.0661, test_f1: 0.4959
 epoch: 10, train_loss: 0.9974, test_loss: 1.0730, test_f1: 0.5116
 epoch: 11, train_loss: 0.9849, test_loss: 1.0738, test_f1: 0.5107
 epoch: 12, train_loss: 0.9864, test_loss: 1.0713, test_f1: 0.5499
 epoch: 13, train_loss: 0.9732, test_loss: 1.0403, test_f1: 0.5329
 epoch: 14, train_loss: 0.9913, test_loss: 1.0327, test_f1: 0.5288
 epoch: 15, train_loss: 0.9440, test_loss: 1.0454, test_f1: 0.5568
 epoch: 16, train_loss: 0.9625, test_loss: 1.0393, test_f1: 0.5411
 epoch: 17, train_loss: 0.9441, test_loss: 1.0483, test_f1: 0.5540
 epoch: 18, train_loss: 0.9358, test_loss: 1.0336, test_f1: 0.5635
 epoch: 19, train_loss: 0.9344, test_loss: 1.0295, test_f1: 0.5652
 epoch: 20, train_loss: 0.9152, test_loss: 1.0410, test_f1: 0.5599
 epoch: 21, train_loss: 0.9316, test_loss: 1.0273, test_f1: 0.5458
 epoch: 22, train_loss: 0.9061, test_loss: 1.0281, test_f1: 0.5543
 epoch: 23, train_loss: 0.9036, test_loss: 1.0670, test_f1: 0.5391
 epoch: 24, train_loss: 0.9133, test_loss: 1.0116, test_f1: 0.5558
 epoch: 25, train_loss: 0.8993, test_loss: 1.0248, test_f1: 0.5408
 epoch: 26, train_loss: 0.9012, test_loss: 1.0141, test_f1: 0.5699
 epoch: 27, train_loss: 0.8987, test_loss: 1.0306, test_f1: 0.5668
 epoch: 28, train_loss: 0.8808, test_loss: 1.0246, test_f1: 0.5586
 epoch: 29, train_loss: 0.8810, test_loss: 1.0306, test_f1: 0.5581
 epoch: 30, train_loss: 0.8794, test_loss: 1.0275, test_f1: 0.5703
 epoch: 31, train_loss: 0.8748, test_loss: 1.0077, test_f1: 0.5655
 epoch: 32, train_loss: 0.8631, test_loss: 1.0149, test_f1: 0.5619
 epoch: 33, train_loss: 0.8724, test_loss: 1.0345, test_f1: 0.5749
 epoch: 34, train_loss: 0.8571, test_loss: 0.9954, test_f1: 0.5697
 epoch: 35, train_loss: 0.8561, test_loss: 1.0524, test_f1: 0.5628
 epoch: 36, train_loss: 0.8432, test_loss: 1.0403, test_f1: 0.5529
 epoch: 37, train_loss: 0.8608, test_loss: 1.0221, test_f1: 0.5738
 epoch: 38, train_loss: 0.8441, test_loss: 0.9976, test_f1: 0.5649
 epoch: 39, train_loss: 0.8465, test_loss: 1.0401, test_f1: 0.5764
 epoch: 40, train_loss: 0.8177, test_loss: 1.0166, test_f1: 0.5826
 epoch: 41, train_loss: 0.8311, test_loss: 1.0098, test_f1: 0.5764
 epoch: 42, train_loss: 0.8409, test_loss: 1.0528, test_f1: 0.5963
 epoch: 43, train_loss: 0.8249, test_loss: 1.0827, test_f1: 0.5724
 epoch: 44, train_loss: 0.8019, test_loss: 1.0718, test_f1: 0.5717
 epoch: 45, train_loss: 0.8133, test_loss: 1.0499, test_f1: 0.5807
 epoch: 46, train_loss: 0.8239, test_loss: 1.0220, test_f1: 0.5828
 epoch: 47, train_loss: 0.7994, test_loss: 1.0450, test_f1: 0.5703
 epoch: 48, train_loss: 0.8081, test_loss: 1.0468, test_f1: 0.5946
 epoch: 49, train_loss: 0.7901, test_loss: 1.0363, test_f1: 0.5967
 epoch: 50, train_loss: 0.7998, test_loss: 1.0228, test_f1: 0.5886
 epoch: 51, train_loss: 0.7820, test_loss: 1.0118, test_f1: 0.6028
 epoch: 52, train_loss: 0.7939, test_loss: 1.0446, test_f1: 0.5862
 epoch: 53, train_loss: 0.7791, test_loss: 1.0487, test_f1: 0.5956
 epoch: 54, train_loss: 0.7945, test_loss: 1.0325, test_f1: 0.5881
 epoch: 55, train_loss: 0.7803, test_loss: 1.0376, test_f1: 0.5986
 epoch: 56, train_loss: 0.7791, test_loss: 1.0379, test_f1: 0.5925
 epoch: 57, train_loss: 0.7487, test_loss: 1.0460, test_f1: 0.5919
 epoch: 58, train_loss: 0.7742, test_loss: 1.0350, test_f1: 0.6017
 epoch: 59, train_loss: 0.7725, test_loss: 1.0434, test_f1: 0.5949
 epoch: 60, train_loss: 0.7491, test_loss: 1.0269, test_f1: 0.6077
 epoch: 61, train_loss: 0.7581, test_loss: 1.0471, test_f1: 0.5962
 epoch: 62, train_loss: 0.7551, test_loss: 1.0787, test_f1: 0.5960
 epoch: 63, train_loss: 0.7677, test_loss: 1.0270, test_f1: 0.5904
 epoch: 64, train_loss: 0.7522, test_loss: 1.0466, test_f1: 0.5899
 epoch: 65, train_loss: 0.7423, test_loss: 1.0518, test_f1: 0.5947
 epoch: 66, train_loss: 0.7464, test_loss: 1.0591, test_f1: 0.5902
 epoch: 67, train_loss: 0.7510, test_loss: 1.0370, test_f1: 0.6032
 epoch: 68, train_loss: 0.7434, test_loss: 1.0778, test_f1: 0.5922
 epoch: 69, train_loss: 0.7513, test_loss: 1.0775, test_f1: 0.6054
 epoch: 70, train_loss: 0.7585, test_loss: 1.0847, test_f1: 0.6050
 epoch: 71, train_loss: 0.7461, test_loss: 1.0695, test_f1: 0.6204
 epoch: 72, train_loss: 0.7234, test_loss: 1.1014, test_f1: 0.5986
 epoch: 73, train_loss: 0.7620, test_loss: 1.0599, test_f1: 0.5888
 epoch: 74, train_loss: 0.7536, test_loss: 1.0726, test_f1: 0.6067
 epoch: 75, train_loss: 0.7368, test_loss: 1.1260, test_f1: 0.6024
 epoch: 76, train_loss: 0.7337, test_loss: 1.0772, test_f1: 0.6042
 epoch: 77, train_loss: 0.7277, test_loss: 1.0750, test_f1: 0.6109
 epoch: 78, train_loss: 0.7395, test_loss: 1.0792, test_f1: 0.5963
 epoch: 79, train_loss: 0.7353, test_loss: 1.1236, test_f1: 0.6120
 epoch: 80, train_loss: 0.7295, test_loss: 1.0982, test_f1: 0.6142
 epoch: 81, train_loss: 0.7257, test_loss: 1.0802, test_f1: 0.5962
 epoch: 82, train_loss: 0.7170, test_loss: 1.0987, test_f1: 0.6017
 epoch: 83, train_loss: 0.7332, test_loss: 1.1025, test_f1: 0.6071
 epoch: 84, train_loss: 0.7211, test_loss: 1.0921, test_f1: 0.6040
 epoch: 85, train_loss: 0.7237, test_loss: 1.1004, test_f1: 0.5934
 epoch: 86, train_loss: 0.7264, test_loss: 1.1135, test_f1: 0.6025
 epoch: 87, train_loss: 0.7339, test_loss: 1.1225, test_f1: 0.6118
 epoch: 88, train_loss: 0.7288, test_loss: 1.0926, test_f1: 0.6034
 epoch: 89, train_loss: 0.6963, test_loss: 1.1081, test_f1: 0.6082
 epoch: 90, train_loss: 0.7369, test_loss: 1.0981, test_f1: 0.6011
 epoch: 91, train_loss: 0.7175, test_loss: 1.1183, test_f1: 0.6042
 epoch: 92, train_loss: 0.7103, test_loss: 1.1582, test_f1: 0.6184
 epoch: 93, train_loss: 0.6914, test_loss: 1.1221, test_f1: 0.6128
 epoch: 94, train_loss: 0.7022, test_loss: 1.1342, test_f1: 0.6329
 epoch: 95, train_loss: 0.7021, test_loss: 1.1624, test_f1: 0.6040
 epoch: 96, train_loss: 0.6902, test_loss: 1.1069, test_f1: 0.6147
 epoch: 97, train_loss: 0.7007, test_loss: 1.1057, test_f1: 0.6298
 epoch: 98, train_loss: 0.7200, test_loss: 1.1450, test_f1: 0.6136
 epoch: 99, train_loss: 0.6894, test_loss: 1.1134, test_f1: 0.5907
##################ITERATION #9 ****************************************
 epoch: 0, train_loss: 1.2660, test_loss: 1.2760, test_f1: 0.2979
 epoch: 1, train_loss: 1.1492, test_loss: 1.2197, test_f1: 0.4223
 epoch: 2, train_loss: 1.1192, test_loss: 1.1947, test_f1: 0.4686
 epoch: 3, train_loss: 1.0723, test_loss: 1.2013, test_f1: 0.4631
 epoch: 4, train_loss: 1.0726, test_loss: 1.2019, test_f1: 0.4491
 epoch: 5, train_loss: 1.0341, test_loss: 1.2020, test_f1: 0.4701
 epoch: 6, train_loss: 1.0386, test_loss: 1.1891, test_f1: 0.4921
 epoch: 7, train_loss: 1.0237, test_loss: 1.1690, test_f1: 0.4893
 epoch: 8, train_loss: 1.0023, test_loss: 1.1614, test_f1: 0.5069
 epoch: 9, train_loss: 0.9853, test_loss: 1.1512, test_f1: 0.5167
 epoch: 10, train_loss: 0.9875, test_loss: 1.1546, test_f1: 0.5326
 epoch: 11, train_loss: 0.9902, test_loss: 1.1466, test_f1: 0.5214
 epoch: 12, train_loss: 0.9643, test_loss: 1.1246, test_f1: 0.5235
 epoch: 13, train_loss: 0.9636, test_loss: 1.1438, test_f1: 0.5307
 epoch: 14, train_loss: 0.9453, test_loss: 1.1150, test_f1: 0.5273
 epoch: 15, train_loss: 0.9450, test_loss: 1.1388, test_f1: 0.5410
 epoch: 16, train_loss: 0.9343, test_loss: 1.1286, test_f1: 0.5539
 epoch: 17, train_loss: 0.9337, test_loss: 1.1028, test_f1: 0.5403
 epoch: 18, train_loss: 0.9271, test_loss: 1.1313, test_f1: 0.5415
 epoch: 19, train_loss: 0.9255, test_loss: 1.1300, test_f1: 0.5321
 epoch: 20, train_loss: 0.9141, test_loss: 1.1259, test_f1: 0.5556
 epoch: 21, train_loss: 0.8986, test_loss: 1.1099, test_f1: 0.5494
 epoch: 22, train_loss: 0.8958, test_loss: 1.1320, test_f1: 0.5527
 epoch: 23, train_loss: 0.8834, test_loss: 1.0737, test_f1: 0.5601
 epoch: 24, train_loss: 0.9006, test_loss: 1.1122, test_f1: 0.5510
 epoch: 25, train_loss: 0.8676, test_loss: 1.0951, test_f1: 0.5471
 epoch: 26, train_loss: 0.8588, test_loss: 1.0971, test_f1: 0.5519
 epoch: 27, train_loss: 0.8745, test_loss: 1.1128, test_f1: 0.5660
 epoch: 28, train_loss: 0.8679, test_loss: 1.1145, test_f1: 0.5567
 epoch: 29, train_loss: 0.8497, test_loss: 1.1305, test_f1: 0.5706
 epoch: 30, train_loss: 0.8565, test_loss: 1.1244, test_f1: 0.5365
 epoch: 31, train_loss: 0.8400, test_loss: 1.1425, test_f1: 0.5552
 epoch: 32, train_loss: 0.8561, test_loss: 1.1393, test_f1: 0.5662
 epoch: 33, train_loss: 0.8421, test_loss: 1.1250, test_f1: 0.5656
 epoch: 34, train_loss: 0.8390, test_loss: 1.1266, test_f1: 0.5422
 epoch: 35, train_loss: 0.8455, test_loss: 1.1294, test_f1: 0.5588
 epoch: 36, train_loss: 0.8415, test_loss: 1.1346, test_f1: 0.5664
 epoch: 37, train_loss: 0.8183, test_loss: 1.1402, test_f1: 0.5631
 epoch: 38, train_loss: 0.8158, test_loss: 1.1870, test_f1: 0.5433
 epoch: 39, train_loss: 0.8011, test_loss: 1.1523, test_f1: 0.5590
 epoch: 40, train_loss: 0.8143, test_loss: 1.1276, test_f1: 0.5626
 epoch: 41, train_loss: 0.8273, test_loss: 1.1981, test_f1: 0.5546
 epoch: 42, train_loss: 0.7932, test_loss: 1.1729, test_f1: 0.5742
 epoch: 43, train_loss: 0.8034, test_loss: 1.1944, test_f1: 0.5688
 epoch: 44, train_loss: 0.7893, test_loss: 1.1825, test_f1: 0.6008
 epoch: 45, train_loss: 0.7963, test_loss: 1.1696, test_f1: 0.5774
 epoch: 46, train_loss: 0.7888, test_loss: 1.1681, test_f1: 0.5536
 epoch: 47, train_loss: 0.7893, test_loss: 1.1649, test_f1: 0.5624
 epoch: 48, train_loss: 0.7746, test_loss: 1.1575, test_f1: 0.5783
 epoch: 49, train_loss: 0.7811, test_loss: 1.1473, test_f1: 0.5934
 epoch: 50, train_loss: 0.7676, test_loss: 1.2086, test_f1: 0.5689
 epoch: 51, train_loss: 0.7693, test_loss: 1.2046, test_f1: 0.5756
 epoch: 52, train_loss: 0.7597, test_loss: 1.2091, test_f1: 0.5833
 epoch: 53, train_loss: 0.7658, test_loss: 1.1746, test_f1: 0.5757
 epoch: 54, train_loss: 0.7449, test_loss: 1.1977, test_f1: 0.5808
 epoch: 55, train_loss: 0.7638, test_loss: 1.1777, test_f1: 0.5835
 epoch: 56, train_loss: 0.7587, test_loss: 1.1950, test_f1: 0.5910
 epoch: 57, train_loss: 0.7532, test_loss: 1.2008, test_f1: 0.5755
 epoch: 58, train_loss: 0.7512, test_loss: 1.2159, test_f1: 0.5756
 epoch: 59, train_loss: 0.7465, test_loss: 1.2182, test_f1: 0.5703
 epoch: 60, train_loss: 0.7512, test_loss: 1.2286, test_f1: 0.5735
 epoch: 61, train_loss: 0.7396, test_loss: 1.1896, test_f1: 0.5756
 epoch: 62, train_loss: 0.7332, test_loss: 1.2325, test_f1: 0.5764
 epoch: 63, train_loss: 0.7331, test_loss: 1.2490, test_f1: 0.5833
 epoch: 64, train_loss: 0.7311, test_loss: 1.1975, test_f1: 0.5930
 epoch: 65, train_loss: 0.7467, test_loss: 1.2297, test_f1: 0.5703
 epoch: 66, train_loss: 0.7362, test_loss: 1.1807, test_f1: 0.5860
 epoch: 67, train_loss: 0.7301, test_loss: 1.1993, test_f1: 0.5910
 epoch: 68, train_loss: 0.7166, test_loss: 1.2309, test_f1: 0.5755
 epoch: 69, train_loss: 0.7292, test_loss: 1.2223, test_f1: 0.5654
 epoch: 70, train_loss: 0.7247, test_loss: 1.2660, test_f1: 0.5783
 epoch: 71, train_loss: 0.7152, test_loss: 1.2426, test_f1: 0.5835
 epoch: 72, train_loss: 0.7094, test_loss: 1.2586, test_f1: 0.5783
 epoch: 73, train_loss: 0.7214, test_loss: 1.2304, test_f1: 0.5834
 epoch: 74, train_loss: 0.7056, test_loss: 1.2688, test_f1: 0.5805
 epoch: 75, train_loss: 0.7127, test_loss: 1.2554, test_f1: 0.5886
 epoch: 76, train_loss: 0.7080, test_loss: 1.2660, test_f1: 0.5697
 epoch: 77, train_loss: 0.7238, test_loss: 1.2443, test_f1: 0.5882
 epoch: 78, train_loss: 0.6937, test_loss: 1.3062, test_f1: 0.5594
 epoch: 79, train_loss: 0.6974, test_loss: 1.2697, test_f1: 0.5754
 epoch: 80, train_loss: 0.7102, test_loss: 1.2616, test_f1: 0.5786
 epoch: 81, train_loss: 0.6898, test_loss: 1.2543, test_f1: 0.5650
 epoch: 82, train_loss: 0.6844, test_loss: 1.2760, test_f1: 0.5884
 epoch: 83, train_loss: 0.6945, test_loss: 1.2729, test_f1: 0.5831
 epoch: 84, train_loss: 0.7060, test_loss: 1.2870, test_f1: 0.5834
 epoch: 85, train_loss: 0.6977, test_loss: 1.2481, test_f1: 0.5729
 epoch: 86, train_loss: 0.6811, test_loss: 1.2706, test_f1: 0.5840
 epoch: 87, train_loss: 0.6901, test_loss: 1.2190, test_f1: 0.5757
 epoch: 88, train_loss: 0.6783, test_loss: 1.2348, test_f1: 0.5680
 epoch: 89, train_loss: 0.6991, test_loss: 1.2866, test_f1: 0.5540
 epoch: 90, train_loss: 0.6792, test_loss: 1.2947, test_f1: 0.5680
 epoch: 91, train_loss: 0.6748, test_loss: 1.2824, test_f1: 0.5654
 epoch: 92, train_loss: 0.6765, test_loss: 1.2993, test_f1: 0.5615
 epoch: 93, train_loss: 0.6821, test_loss: 1.2861, test_f1: 0.5507
 epoch: 94, train_loss: 0.6651, test_loss: 1.2746, test_f1: 0.5620
 epoch: 95, train_loss: 0.6587, test_loss: 1.3200, test_f1: 0.5603
 epoch: 96, train_loss: 0.6734, test_loss: 1.3249, test_f1: 0.5660
 epoch: 97, train_loss: 0.6650, test_loss: 1.3067, test_f1: 0.5726
 epoch: 98, train_loss: 0.6657, test_loss: 1.2930, test_f1: 0.5778
 epoch: 99, train_loss: 0.6655, test_loss: 1.2965, test_f1: 0.5759

Training completed in 732.88 seconds
Best F1: 0.6329 at epoch 94
Mean F1 across iterations: 0.6068  0.0131
========================FINAL RESULTS================================
FEGIN weighted F1: 0.6329  0.0131
python main.py --data ltspice_demos --representation component_net --model FEGIN --layers 5 --hiddens 64 --batch_size 32 --lr 0.0001 --emb_size 250 --epochs 100 --save_appendix component_net_L5_H64_BS32_LR0.0001_E250 --no_val
-----



STDERR:
  File "main.py", line 370, in <module>
    main()
  File "main.py", line 254, in main
    dataset = dataset_class(
  File "/home/philip/projects/ltspice_examples_code_repo/Circuit-Completion-Using-GNNs/component_classification_with_link_prediction_head/evaluation/FEGIN/kernel/circuit_datasets.py", line 15, in __init__
    self.data, self.slices = torch.load(self.processed_paths[0])
  File "/home/philip/.local/lib/python3.8/site-packages/torch/serialization.py", line 1040, in load
    warnings.warn(
  File "/usr/lib/python3.8/warnings.py", line 109, in _showwarnmsg
    sw(msg.message, msg.category, msg.filename, msg.lineno,
  File "main.py", line 47, in warn_with_traceback
    traceback.print_stack(file=log)
/home/philip/projects/ltspice_examples_code_repo/Circuit-Completion-Using-GNNs/component_classification_with_link_prediction_head/evaluation/FEGIN/kernel/circuit_datasets.py:15: FutureWarning: You are using `torch.load` with `weights_only=False` (the current default value), which uses the default pickle module implicitly. It is possible to construct malicious pickle data which will execute arbitrary code during unpickling (See https://github.com/pytorch/pytorch/blob/main/SECURITY.md#untrusted-models for more details). In a future release, the default value for `weights_only` will be flipped to `True`. This limits the functions that could be executed during unpickling. Arbitrary objects will no longer be allowed to be loaded via this mode unless they are explicitly allowlisted by the user via `torch.serialization.add_safe_globals`. We recommend you start setting `weights_only=True` for any use case where you don't have full control of the loaded file. Please open an issue on GitHub for any issues related to this experimental feature.
  self.data, self.slices = torch.load(self.processed_paths[0])
