STDOUT:
Results will be saved in /home/philip/projects/llm_inference_code_repo/Circuit-Completion-Using-GNNs/component_classification_with_link_prediction_head/evaluation/FEGIN/results/model_FEGIN_dataset_ltspice_examples
Command line input: python main.py --data ltspice_examples --representation component_pin_net --model FEGIN --layers 4 --hiddens 64 --batch_size 64 --lr 0.001 --emb_size 128 --epochs 100 --save_appendix component_pin_net_L4_H64_BS64_LR0.001_E128 --no_val
 is saved.
-----
ltspice_examples - FEGIN
Using 4 layers, 64 hidden units, h = 2
Loading component_pin_net representation dataset
ENTERED
Training FEGIN on component_pin_net representation
Train: 3558, Test: 846
##################ITERATION #0 ****************************************
 epoch: 0, train_loss: 1.1977, test_loss: 1.0504, test_f1: 0.3545
 epoch: 1, train_loss: 1.0199, test_loss: 1.0627, test_f1: 0.4418
 epoch: 2, train_loss: 0.9711, test_loss: 0.9529, test_f1: 0.4995
 epoch: 3, train_loss: 0.9558, test_loss: 1.0235, test_f1: 0.4559
 epoch: 4, train_loss: 0.9290, test_loss: 0.9767, test_f1: 0.5242
 epoch: 5, train_loss: 0.9085, test_loss: 0.9029, test_f1: 0.5321
 epoch: 6, train_loss: 0.9060, test_loss: 0.9250, test_f1: 0.5181
 epoch: 7, train_loss: 0.8842, test_loss: 0.8837, test_f1: 0.5242
 epoch: 8, train_loss: 0.8589, test_loss: 0.8992, test_f1: 0.5322
 epoch: 9, train_loss: 0.8453, test_loss: 0.8440, test_f1: 0.6110
 epoch: 10, train_loss: 0.8326, test_loss: 0.8361, test_f1: 0.5413
 epoch: 11, train_loss: 0.8237, test_loss: 0.8155, test_f1: 0.5488
 epoch: 12, train_loss: 0.8104, test_loss: 0.9099, test_f1: 0.5620
 epoch: 13, train_loss: 0.7865, test_loss: 0.8442, test_f1: 0.5853
 epoch: 14, train_loss: 0.7789, test_loss: 0.8543, test_f1: 0.5834
 epoch: 15, train_loss: 0.7602, test_loss: 0.7956, test_f1: 0.5956
 epoch: 16, train_loss: 0.7497, test_loss: 0.8120, test_f1: 0.6233
 epoch: 17, train_loss: 0.7205, test_loss: 0.7675, test_f1: 0.6186
 epoch: 18, train_loss: 0.7162, test_loss: 0.7934, test_f1: 0.6091
 epoch: 19, train_loss: 0.6960, test_loss: 0.7831, test_f1: 0.6263
 epoch: 20, train_loss: 0.7012, test_loss: 0.7888, test_f1: 0.6329
 epoch: 21, train_loss: 0.6885, test_loss: 0.7593, test_f1: 0.5939
 epoch: 22, train_loss: 0.6755, test_loss: 0.7449, test_f1: 0.6644
 epoch: 23, train_loss: 0.6665, test_loss: 0.7992, test_f1: 0.6031
 epoch: 24, train_loss: 0.6465, test_loss: 0.7473, test_f1: 0.6342
 epoch: 25, train_loss: 0.6384, test_loss: 0.8427, test_f1: 0.6140
 epoch: 26, train_loss: 0.6234, test_loss: 0.8296, test_f1: 0.6519
 epoch: 27, train_loss: 0.6270, test_loss: 0.7641, test_f1: 0.6431
 epoch: 28, train_loss: 0.6261, test_loss: 0.7580, test_f1: 0.6507
 epoch: 29, train_loss: 0.5936, test_loss: 0.7541, test_f1: 0.6475
 epoch: 30, train_loss: 0.6072, test_loss: 0.7246, test_f1: 0.6718
 epoch: 31, train_loss: 0.5878, test_loss: 0.8138, test_f1: 0.6434
 epoch: 32, train_loss: 0.5617, test_loss: 0.8945, test_f1: 0.6280
 epoch: 33, train_loss: 0.5737, test_loss: 0.7953, test_f1: 0.6226
 epoch: 34, train_loss: 0.5752, test_loss: 0.8094, test_f1: 0.6445
 epoch: 35, train_loss: 0.5638, test_loss: 0.7327, test_f1: 0.6710
 epoch: 36, train_loss: 0.5429, test_loss: 0.7313, test_f1: 0.6585
 epoch: 37, train_loss: 0.5249, test_loss: 0.7971, test_f1: 0.6662
 epoch: 38, train_loss: 0.5180, test_loss: 0.8529, test_f1: 0.6988
 epoch: 39, train_loss: 0.5039, test_loss: 0.9165, test_f1: 0.6349
 epoch: 40, train_loss: 0.5056, test_loss: 0.9536, test_f1: 0.6650
 epoch: 41, train_loss: 0.5021, test_loss: 1.1363, test_f1: 0.6101
 epoch: 42, train_loss: 0.4866, test_loss: 0.9738, test_f1: 0.6304
 epoch: 43, train_loss: 0.4760, test_loss: 0.8327, test_f1: 0.6785
 epoch: 44, train_loss: 0.4666, test_loss: 0.8804, test_f1: 0.6471
 epoch: 45, train_loss: 0.4821, test_loss: 0.9715, test_f1: 0.6208
 epoch: 46, train_loss: 0.4758, test_loss: 0.8857, test_f1: 0.6270
 epoch: 47, train_loss: 0.4540, test_loss: 0.9042, test_f1: 0.6794
 epoch: 48, train_loss: 0.4527, test_loss: 0.9786, test_f1: 0.6432
 epoch: 49, train_loss: 0.4754, test_loss: 0.9545, test_f1: 0.6561
 epoch: 50, train_loss: 0.4597, test_loss: 0.8291, test_f1: 0.6734
 epoch: 51, train_loss: 0.4181, test_loss: 0.8504, test_f1: 0.6642
 epoch: 52, train_loss: 0.4001, test_loss: 0.9818, test_f1: 0.6834
 epoch: 53, train_loss: 0.3805, test_loss: 0.9219, test_f1: 0.6897
 epoch: 54, train_loss: 0.3741, test_loss: 0.9655, test_f1: 0.6868
 epoch: 55, train_loss: 0.3641, test_loss: 1.0391, test_f1: 0.6599
 epoch: 56, train_loss: 0.3571, test_loss: 1.2398, test_f1: 0.6396
 epoch: 57, train_loss: 0.3527, test_loss: 1.2122, test_f1: 0.6324
 epoch: 58, train_loss: 0.3544, test_loss: 1.2443, test_f1: 0.6349
 epoch: 59, train_loss: 0.3498, test_loss: 1.1529, test_f1: 0.6620
 epoch: 60, train_loss: 0.3462, test_loss: 1.2624, test_f1: 0.6433
 epoch: 61, train_loss: 0.3296, test_loss: 1.2363, test_f1: 0.6376
 epoch: 62, train_loss: 0.3508, test_loss: 1.2740, test_f1: 0.6580
 epoch: 63, train_loss: 0.3469, test_loss: 1.1250, test_f1: 0.6844
 epoch: 64, train_loss: 0.3390, test_loss: 1.1750, test_f1: 0.6826
 epoch: 65, train_loss: 0.3326, test_loss: 1.2733, test_f1: 0.6448
 epoch: 66, train_loss: 0.3118, test_loss: 1.2268, test_f1: 0.6716
 epoch: 67, train_loss: 0.3007, test_loss: 1.2483, test_f1: 0.6563
 epoch: 68, train_loss: 0.3070, test_loss: 1.1808, test_f1: 0.6758
 epoch: 69, train_loss: 0.3052, test_loss: 1.2657, test_f1: 0.6992
 epoch: 70, train_loss: 0.2978, test_loss: 1.3841, test_f1: 0.6487
 epoch: 71, train_loss: 0.2930, test_loss: 1.3865, test_f1: 0.6650
 epoch: 72, train_loss: 0.3056, test_loss: 1.4273, test_f1: 0.6492
 epoch: 73, train_loss: 0.2799, test_loss: 1.3517, test_f1: 0.6540
 epoch: 74, train_loss: 0.2837, test_loss: 1.4033, test_f1: 0.6613
 epoch: 75, train_loss: 0.2922, test_loss: 1.2856, test_f1: 0.6837
 epoch: 76, train_loss: 0.2906, test_loss: 1.2346, test_f1: 0.6698
 epoch: 77, train_loss: 0.2849, test_loss: 1.4474, test_f1: 0.6580
 epoch: 78, train_loss: 0.2737, test_loss: 1.6591, test_f1: 0.6582
 epoch: 79, train_loss: 0.2811, test_loss: 1.4023, test_f1: 0.6809
 epoch: 80, train_loss: 0.2709, test_loss: 1.4694, test_f1: 0.6649
 epoch: 81, train_loss: 0.2733, test_loss: 1.4499, test_f1: 0.6663
 epoch: 82, train_loss: 0.2691, test_loss: 1.3219, test_f1: 0.6835
 epoch: 83, train_loss: 0.2764, test_loss: 1.4411, test_f1: 0.6669
 epoch: 84, train_loss: 0.2457, test_loss: 1.6612, test_f1: 0.6412
 epoch: 85, train_loss: 0.2559, test_loss: 1.7079, test_f1: 0.6433
 epoch: 86, train_loss: 0.2557, test_loss: 1.6642, test_f1: 0.6457
 epoch: 87, train_loss: 0.2453, test_loss: 1.8079, test_f1: 0.6336
 epoch: 88, train_loss: 0.2465, test_loss: 1.5456, test_f1: 0.6696
 epoch: 89, train_loss: 0.2515, test_loss: 1.5797, test_f1: 0.6759
 epoch: 90, train_loss: 0.2511, test_loss: 1.7190, test_f1: 0.6528
 epoch: 91, train_loss: 0.2501, test_loss: 1.6839, test_f1: 0.6473
 epoch: 92, train_loss: 0.2308, test_loss: 1.8482, test_f1: 0.6479
 epoch: 93, train_loss: 0.2455, test_loss: 1.8189, test_f1: 0.6583
 epoch: 94, train_loss: 0.2468, test_loss: 1.7790, test_f1: 0.6564
 epoch: 95, train_loss: 0.2275, test_loss: 1.7232, test_f1: 0.6752
 epoch: 96, train_loss: 0.2112, test_loss: 1.7803, test_f1: 0.6600
 epoch: 97, train_loss: 0.2461, test_loss: 1.7633, test_f1: 0.6464
 epoch: 98, train_loss: 0.2236, test_loss: 1.8919, test_f1: 0.6527
 epoch: 99, train_loss: 0.2301, test_loss: 1.6097, test_f1: 0.6897
##################ITERATION #1 ****************************************
 epoch: 0, train_loss: 1.0723, test_loss: 1.8707, test_f1: 0.1928
 epoch: 1, train_loss: 0.9735, test_loss: 0.9967, test_f1: 0.4917
 epoch: 2, train_loss: 0.9326, test_loss: 0.8978, test_f1: 0.5235
 epoch: 3, train_loss: 0.9013, test_loss: 0.9093, test_f1: 0.5102
 epoch: 4, train_loss: 0.8822, test_loss: 0.9122, test_f1: 0.4950
 epoch: 5, train_loss: 0.8729, test_loss: 0.8381, test_f1: 0.5835
 epoch: 6, train_loss: 0.8415, test_loss: 0.8045, test_f1: 0.5647
 epoch: 7, train_loss: 0.8252, test_loss: 0.7886, test_f1: 0.5948
 epoch: 8, train_loss: 0.7983, test_loss: 0.8027, test_f1: 0.5860
 epoch: 9, train_loss: 0.8021, test_loss: 0.8099, test_f1: 0.5880
 epoch: 10, train_loss: 0.7709, test_loss: 0.7735, test_f1: 0.6173
 epoch: 11, train_loss: 0.7559, test_loss: 0.7663, test_f1: 0.6048
 epoch: 12, train_loss: 0.7399, test_loss: 0.7371, test_f1: 0.6276
 epoch: 13, train_loss: 0.7270, test_loss: 0.7977, test_f1: 0.6119
 epoch: 14, train_loss: 0.7328, test_loss: 0.7705, test_f1: 0.6077
 epoch: 15, train_loss: 0.7052, test_loss: 0.7664, test_f1: 0.6799
 epoch: 16, train_loss: 0.7047, test_loss: 0.7418, test_f1: 0.6668
 epoch: 17, train_loss: 0.6874, test_loss: 0.7394, test_f1: 0.6546
 epoch: 18, train_loss: 0.6744, test_loss: 0.7452, test_f1: 0.6494
 epoch: 19, train_loss: 0.6699, test_loss: 0.7195, test_f1: 0.6642
 epoch: 20, train_loss: 0.6672, test_loss: 0.7366, test_f1: 0.6345
 epoch: 21, train_loss: 0.6485, test_loss: 0.7141, test_f1: 0.6777
 epoch: 22, train_loss: 0.6441, test_loss: 0.7378, test_f1: 0.6433
 epoch: 23, train_loss: 0.6390, test_loss: 0.6989, test_f1: 0.6913
 epoch: 24, train_loss: 0.6263, test_loss: 0.7453, test_f1: 0.6364
 epoch: 25, train_loss: 0.6052, test_loss: 0.7122, test_f1: 0.6778
 epoch: 26, train_loss: 0.5997, test_loss: 0.7420, test_f1: 0.6528
 epoch: 27, train_loss: 0.6066, test_loss: 0.7610, test_f1: 0.6684
 epoch: 28, train_loss: 0.5771, test_loss: 0.7700, test_f1: 0.6607
 epoch: 29, train_loss: 0.5841, test_loss: 0.7203, test_f1: 0.6875
 epoch: 30, train_loss: 0.5686, test_loss: 0.8630, test_f1: 0.6216
 epoch: 31, train_loss: 0.5686, test_loss: 0.8099, test_f1: 0.6592
 epoch: 32, train_loss: 0.5583, test_loss: 0.8528, test_f1: 0.6572
 epoch: 33, train_loss: 0.5482, test_loss: 0.7868, test_f1: 0.6575
 epoch: 34, train_loss: 0.5507, test_loss: 0.7724, test_f1: 0.6837
 epoch: 35, train_loss: 0.5286, test_loss: 0.7678, test_f1: 0.6630
 epoch: 36, train_loss: 0.5067, test_loss: 0.8223, test_f1: 0.6606
 epoch: 37, train_loss: 0.5214, test_loss: 0.8958, test_f1: 0.6511
 epoch: 38, train_loss: 0.5103, test_loss: 0.9015, test_f1: 0.6502
 epoch: 39, train_loss: 0.5072, test_loss: 0.8556, test_f1: 0.6257
 epoch: 40, train_loss: 0.5093, test_loss: 0.8913, test_f1: 0.6538
 epoch: 41, train_loss: 0.5023, test_loss: 0.8352, test_f1: 0.6761
 epoch: 42, train_loss: 0.4857, test_loss: 0.9486, test_f1: 0.6495
 epoch: 43, train_loss: 0.4757, test_loss: 0.9077, test_f1: 0.6756
 epoch: 44, train_loss: 0.4895, test_loss: 1.0261, test_f1: 0.6319
 epoch: 45, train_loss: 0.4824, test_loss: 0.8023, test_f1: 0.6684
 epoch: 46, train_loss: 0.4465, test_loss: 0.9390, test_f1: 0.6666
 epoch: 47, train_loss: 0.4566, test_loss: 1.0374, test_f1: 0.6479
 epoch: 48, train_loss: 0.4593, test_loss: 1.0461, test_f1: 0.6475
 epoch: 49, train_loss: 0.4564, test_loss: 0.9316, test_f1: 0.6641
 epoch: 50, train_loss: 0.4528, test_loss: 1.0651, test_f1: 0.6427
 epoch: 51, train_loss: 0.4187, test_loss: 0.9266, test_f1: 0.6791
 epoch: 52, train_loss: 0.3893, test_loss: 0.9258, test_f1: 0.6664
 epoch: 53, train_loss: 0.3772, test_loss: 1.0459, test_f1: 0.6649
 epoch: 54, train_loss: 0.3829, test_loss: 1.0854, test_f1: 0.6636
 epoch: 55, train_loss: 0.3695, test_loss: 0.9834, test_f1: 0.6744
 epoch: 56, train_loss: 0.3639, test_loss: 1.0437, test_f1: 0.6746
 epoch: 57, train_loss: 0.3688, test_loss: 1.1724, test_f1: 0.6715
 epoch: 58, train_loss: 0.3588, test_loss: 1.0702, test_f1: 0.6587
 epoch: 59, train_loss: 0.3639, test_loss: 1.2278, test_f1: 0.6650
 epoch: 60, train_loss: 0.3480, test_loss: 1.1309, test_f1: 0.6607
 epoch: 61, train_loss: 0.3381, test_loss: 1.1087, test_f1: 0.6751
 epoch: 62, train_loss: 0.3464, test_loss: 1.1830, test_f1: 0.6601
 epoch: 63, train_loss: 0.3318, test_loss: 1.2998, test_f1: 0.6725
 epoch: 64, train_loss: 0.3346, test_loss: 1.1106, test_f1: 0.6749
 epoch: 65, train_loss: 0.3345, test_loss: 1.2516, test_f1: 0.6800
 epoch: 66, train_loss: 0.3198, test_loss: 1.1664, test_f1: 0.6850
 epoch: 67, train_loss: 0.3242, test_loss: 1.1892, test_f1: 0.6874
 epoch: 68, train_loss: 0.3301, test_loss: 1.3109, test_f1: 0.6668
 epoch: 69, train_loss: 0.3188, test_loss: 1.3045, test_f1: 0.6701
 epoch: 70, train_loss: 0.3169, test_loss: 1.4490, test_f1: 0.6646
 epoch: 71, train_loss: 0.3274, test_loss: 1.3171, test_f1: 0.6778
 epoch: 72, train_loss: 0.3215, test_loss: 1.4163, test_f1: 0.6724
 epoch: 73, train_loss: 0.3095, test_loss: 1.3172, test_f1: 0.6662
 epoch: 74, train_loss: 0.3273, test_loss: 1.2011, test_f1: 0.6658
 epoch: 75, train_loss: 0.2981, test_loss: 1.2862, test_f1: 0.6685
 epoch: 76, train_loss: 0.3072, test_loss: 1.3198, test_f1: 0.6561
 epoch: 77, train_loss: 0.2946, test_loss: 1.2096, test_f1: 0.6704
 epoch: 78, train_loss: 0.2910, test_loss: 1.4004, test_f1: 0.6687
 epoch: 79, train_loss: 0.2850, test_loss: 1.3296, test_f1: 0.6698
 epoch: 80, train_loss: 0.3051, test_loss: 1.4725, test_f1: 0.6554
 epoch: 81, train_loss: 0.3082, test_loss: 1.2830, test_f1: 0.6647
 epoch: 82, train_loss: 0.2854, test_loss: 1.2698, test_f1: 0.6725
 epoch: 83, train_loss: 0.2798, test_loss: 1.4611, test_f1: 0.6595
 epoch: 84, train_loss: 0.2975, test_loss: 1.3710, test_f1: 0.6726
 epoch: 85, train_loss: 0.2799, test_loss: 1.4655, test_f1: 0.6831
 epoch: 86, train_loss: 0.2928, test_loss: 1.4369, test_f1: 0.6722
 epoch: 87, train_loss: 0.2747, test_loss: 1.5285, test_f1: 0.6786
 epoch: 88, train_loss: 0.2716, test_loss: 1.3717, test_f1: 0.6784
 epoch: 89, train_loss: 0.2457, test_loss: 1.5162, test_f1: 0.6660
 epoch: 90, train_loss: 0.2658, test_loss: 1.5314, test_f1: 0.6687
 epoch: 91, train_loss: 0.2711, test_loss: 1.5335, test_f1: 0.6720
 epoch: 92, train_loss: 0.2738, test_loss: 1.5577, test_f1: 0.6769
 epoch: 93, train_loss: 0.2841, test_loss: 1.5040, test_f1: 0.6532
 epoch: 94, train_loss: 0.2618, test_loss: 1.3694, test_f1: 0.6713
 epoch: 95, train_loss: 0.2584, test_loss: 1.5744, test_f1: 0.6667
 epoch: 96, train_loss: 0.2458, test_loss: 1.5395, test_f1: 0.6612
 epoch: 97, train_loss: 0.2369, test_loss: 1.5866, test_f1: 0.6735
 epoch: 98, train_loss: 0.2672, test_loss: 1.6509, test_f1: 0.6663
 epoch: 99, train_loss: 0.2555, test_loss: 1.4567, test_f1: 0.6856
##################ITERATION #2 ****************************************
 epoch: 0, train_loss: 1.0882, test_loss: 1.0700, test_f1: 0.4226
 epoch: 1, train_loss: 0.9655, test_loss: 0.9237, test_f1: 0.5227
 epoch: 2, train_loss: 0.9254, test_loss: 0.9068, test_f1: 0.5108
 epoch: 3, train_loss: 0.9056, test_loss: 0.8740, test_f1: 0.5306
 epoch: 4, train_loss: 0.8681, test_loss: 0.8220, test_f1: 0.5567
 epoch: 5, train_loss: 0.8567, test_loss: 0.8619, test_f1: 0.5203
 epoch: 6, train_loss: 0.8587, test_loss: 0.8148, test_f1: 0.5590
 epoch: 7, train_loss: 0.8366, test_loss: 0.8062, test_f1: 0.5969
 epoch: 8, train_loss: 0.8116, test_loss: 0.8418, test_f1: 0.6024
 epoch: 9, train_loss: 0.7956, test_loss: 0.8495, test_f1: 0.5716
 epoch: 10, train_loss: 0.7817, test_loss: 0.7706, test_f1: 0.6021
 epoch: 11, train_loss: 0.7717, test_loss: 0.8625, test_f1: 0.5888
 epoch: 12, train_loss: 0.7454, test_loss: 0.7888, test_f1: 0.6609
 epoch: 13, train_loss: 0.7221, test_loss: 0.7933, test_f1: 0.5970
 epoch: 14, train_loss: 0.7222, test_loss: 0.8070, test_f1: 0.6080
 epoch: 15, train_loss: 0.7096, test_loss: 0.7773, test_f1: 0.6494
 epoch: 16, train_loss: 0.7002, test_loss: 0.7033, test_f1: 0.6539
 epoch: 17, train_loss: 0.6943, test_loss: 0.7354, test_f1: 0.6490
 epoch: 18, train_loss: 0.6768, test_loss: 0.7616, test_f1: 0.6646
 epoch: 19, train_loss: 0.6723, test_loss: 0.7743, test_f1: 0.6539
 epoch: 20, train_loss: 0.6380, test_loss: 0.7664, test_f1: 0.6407
 epoch: 21, train_loss: 0.6380, test_loss: 0.8189, test_f1: 0.6502
 epoch: 22, train_loss: 0.6262, test_loss: 0.7213, test_f1: 0.6617
 epoch: 23, train_loss: 0.6334, test_loss: 0.8057, test_f1: 0.6618
 epoch: 24, train_loss: 0.6246, test_loss: 0.7119, test_f1: 0.6517
 epoch: 25, train_loss: 0.6130, test_loss: 0.6798, test_f1: 0.6814
 epoch: 26, train_loss: 0.5937, test_loss: 0.7892, test_f1: 0.6925
 epoch: 27, train_loss: 0.5972, test_loss: 0.8038, test_f1: 0.6846
 epoch: 28, train_loss: 0.5734, test_loss: 0.7591, test_f1: 0.6669
 epoch: 29, train_loss: 0.5743, test_loss: 0.8069, test_f1: 0.6665
 epoch: 30, train_loss: 0.5590, test_loss: 0.8218, test_f1: 0.6743
 epoch: 31, train_loss: 0.5591, test_loss: 0.7517, test_f1: 0.6868
 epoch: 32, train_loss: 0.5483, test_loss: 0.8458, test_f1: 0.6780
 epoch: 33, train_loss: 0.5516, test_loss: 0.7915, test_f1: 0.6763
 epoch: 34, train_loss: 0.5447, test_loss: 0.7423, test_f1: 0.6984
 epoch: 35, train_loss: 0.5563, test_loss: 0.8282, test_f1: 0.6455
 epoch: 36, train_loss: 0.5308, test_loss: 0.8289, test_f1: 0.6505
 epoch: 37, train_loss: 0.5601, test_loss: 0.7828, test_f1: 0.7092
 epoch: 38, train_loss: 0.5173, test_loss: 0.8283, test_f1: 0.6712
 epoch: 39, train_loss: 0.5124, test_loss: 0.7932, test_f1: 0.6937
 epoch: 40, train_loss: 0.5017, test_loss: 0.9440, test_f1: 0.6494
 epoch: 41, train_loss: 0.5059, test_loss: 0.8786, test_f1: 0.6680
 epoch: 42, train_loss: 0.5059, test_loss: 0.9437, test_f1: 0.6685
 epoch: 43, train_loss: 0.4951, test_loss: 0.8093, test_f1: 0.6730
 epoch: 44, train_loss: 0.4783, test_loss: 0.7979, test_f1: 0.6776
 epoch: 45, train_loss: 0.4819, test_loss: 0.7866, test_f1: 0.6807
 epoch: 46, train_loss: 0.4579, test_loss: 0.8150, test_f1: 0.6840
 epoch: 47, train_loss: 0.4742, test_loss: 0.8574, test_f1: 0.6781
 epoch: 48, train_loss: 0.4659, test_loss: 0.8667, test_f1: 0.6988
 epoch: 49, train_loss: 0.4516, test_loss: 0.8487, test_f1: 0.6941
 epoch: 50, train_loss: 0.4490, test_loss: 0.7776, test_f1: 0.6963
 epoch: 51, train_loss: 0.4043, test_loss: 0.8198, test_f1: 0.7145
 epoch: 52, train_loss: 0.3858, test_loss: 0.7624, test_f1: 0.7149
 epoch: 53, train_loss: 0.3709, test_loss: 0.7989, test_f1: 0.7469
 epoch: 54, train_loss: 0.3720, test_loss: 0.8006, test_f1: 0.7152
 epoch: 55, train_loss: 0.3736, test_loss: 0.8790, test_f1: 0.6989
 epoch: 56, train_loss: 0.3651, test_loss: 0.8759, test_f1: 0.7161
 epoch: 57, train_loss: 0.3559, test_loss: 0.8894, test_f1: 0.6977
 epoch: 58, train_loss: 0.3692, test_loss: 0.8776, test_f1: 0.7129
 epoch: 59, train_loss: 0.3622, test_loss: 0.9092, test_f1: 0.6943
 epoch: 60, train_loss: 0.3507, test_loss: 0.9009, test_f1: 0.7216
 epoch: 61, train_loss: 0.3507, test_loss: 0.8931, test_f1: 0.7246
 epoch: 62, train_loss: 0.3426, test_loss: 0.8835, test_f1: 0.7127
 epoch: 63, train_loss: 0.3385, test_loss: 0.9656, test_f1: 0.6999
 epoch: 64, train_loss: 0.3398, test_loss: 0.9770, test_f1: 0.7066
 epoch: 65, train_loss: 0.3320, test_loss: 0.9613, test_f1: 0.7116
 epoch: 66, train_loss: 0.3183, test_loss: 1.0443, test_f1: 0.7071
 epoch: 67, train_loss: 0.3242, test_loss: 0.9448, test_f1: 0.7159
 epoch: 68, train_loss: 0.3125, test_loss: 1.0046, test_f1: 0.7176
 epoch: 69, train_loss: 0.3200, test_loss: 1.0009, test_f1: 0.7028
 epoch: 70, train_loss: 0.3255, test_loss: 1.1164, test_f1: 0.7152
 epoch: 71, train_loss: 0.3165, test_loss: 1.0759, test_f1: 0.6944
 epoch: 72, train_loss: 0.3180, test_loss: 1.1059, test_f1: 0.7006
 epoch: 73, train_loss: 0.3053, test_loss: 1.0134, test_f1: 0.7124
 epoch: 74, train_loss: 0.2932, test_loss: 1.0696, test_f1: 0.7160
 epoch: 75, train_loss: 0.2884, test_loss: 1.1046, test_f1: 0.7000
 epoch: 76, train_loss: 0.2978, test_loss: 1.0128, test_f1: 0.7101
 epoch: 77, train_loss: 0.3000, test_loss: 1.1236, test_f1: 0.7017
 epoch: 78, train_loss: 0.2916, test_loss: 1.1626, test_f1: 0.6899
 epoch: 79, train_loss: 0.2954, test_loss: 1.1448, test_f1: 0.7178
 epoch: 80, train_loss: 0.2958, test_loss: 1.0342, test_f1: 0.6964
 epoch: 81, train_loss: 0.2855, test_loss: 1.1900, test_f1: 0.6841
 epoch: 82, train_loss: 0.2872, test_loss: 1.2044, test_f1: 0.6930
 epoch: 83, train_loss: 0.2858, test_loss: 1.2430, test_f1: 0.7087
 epoch: 84, train_loss: 0.2694, test_loss: 1.1071, test_f1: 0.7043
 epoch: 85, train_loss: 0.2758, test_loss: 1.0875, test_f1: 0.6991
 epoch: 86, train_loss: 0.2936, test_loss: 1.0146, test_f1: 0.7206
 epoch: 87, train_loss: 0.2787, test_loss: 1.0913, test_f1: 0.7022
 epoch: 88, train_loss: 0.2735, test_loss: 1.1307, test_f1: 0.7151
 epoch: 89, train_loss: 0.2749, test_loss: 1.0272, test_f1: 0.7180
 epoch: 90, train_loss: 0.2676, test_loss: 1.3427, test_f1: 0.6842
 epoch: 91, train_loss: 0.2653, test_loss: 1.1629, test_f1: 0.7061
 epoch: 92, train_loss: 0.2656, test_loss: 1.0843, test_f1: 0.7066
 epoch: 93, train_loss: 0.2625, test_loss: 1.1614, test_f1: 0.7109
 epoch: 94, train_loss: 0.2553, test_loss: 1.2630, test_f1: 0.7014
 epoch: 95, train_loss: 0.2566, test_loss: 1.2479, test_f1: 0.6997
 epoch: 96, train_loss: 0.2547, test_loss: 1.1179, test_f1: 0.7121
 epoch: 97, train_loss: 0.2700, test_loss: 1.1759, test_f1: 0.7073
 epoch: 98, train_loss: 0.2637, test_loss: 1.2852, test_f1: 0.7132
 epoch: 99, train_loss: 0.2180, test_loss: 1.2912, test_f1: 0.6818
##################ITERATION #3 ****************************************
 epoch: 0, train_loss: 1.1591, test_loss: 1.0683, test_f1: 0.4019
 epoch: 1, train_loss: 0.9956, test_loss: 0.9735, test_f1: 0.4967
 epoch: 2, train_loss: 0.9439, test_loss: 0.8980, test_f1: 0.4804
 epoch: 3, train_loss: 0.9017, test_loss: 0.8750, test_f1: 0.5268
 epoch: 4, train_loss: 0.8938, test_loss: 0.8207, test_f1: 0.5877
 epoch: 5, train_loss: 0.8627, test_loss: 0.8342, test_f1: 0.5571
 epoch: 6, train_loss: 0.8446, test_loss: 0.8159, test_f1: 0.5588
 epoch: 7, train_loss: 0.8158, test_loss: 0.7927, test_f1: 0.5610
 epoch: 8, train_loss: 0.8025, test_loss: 0.7498, test_f1: 0.6022
 epoch: 9, train_loss: 0.7975, test_loss: 0.7671, test_f1: 0.6210
 epoch: 10, train_loss: 0.7839, test_loss: 0.7398, test_f1: 0.6326
 epoch: 11, train_loss: 0.7720, test_loss: 0.7440, test_f1: 0.5998
 epoch: 12, train_loss: 0.7580, test_loss: 0.7698, test_f1: 0.6227
 epoch: 13, train_loss: 0.7468, test_loss: 0.7653, test_f1: 0.5983
 epoch: 14, train_loss: 0.7372, test_loss: 0.7377, test_f1: 0.6104
 epoch: 15, train_loss: 0.7107, test_loss: 0.6989, test_f1: 0.6541
 epoch: 16, train_loss: 0.6972, test_loss: 0.7039, test_f1: 0.6512
 epoch: 17, train_loss: 0.6970, test_loss: 0.7370, test_f1: 0.6262
 epoch: 18, train_loss: 0.6911, test_loss: 0.7037, test_f1: 0.6666
 epoch: 19, train_loss: 0.6709, test_loss: 0.7265, test_f1: 0.6634
 epoch: 20, train_loss: 0.6586, test_loss: 0.7261, test_f1: 0.6579
 epoch: 21, train_loss: 0.6552, test_loss: 0.7087, test_f1: 0.6712
 epoch: 22, train_loss: 0.6535, test_loss: 0.7259, test_f1: 0.6724
 epoch: 23, train_loss: 0.6278, test_loss: 0.7070, test_f1: 0.6686
 epoch: 24, train_loss: 0.6284, test_loss: 0.7430, test_f1: 0.6650
 epoch: 25, train_loss: 0.6269, test_loss: 0.7522, test_f1: 0.6505
 epoch: 26, train_loss: 0.6094, test_loss: 0.7058, test_f1: 0.6604
 epoch: 27, train_loss: 0.5982, test_loss: 0.7155, test_f1: 0.6694
 epoch: 28, train_loss: 0.5836, test_loss: 0.7361, test_f1: 0.6569
 epoch: 29, train_loss: 0.5643, test_loss: 0.7876, test_f1: 0.6525
 epoch: 30, train_loss: 0.5878, test_loss: 0.7806, test_f1: 0.6568
 epoch: 31, train_loss: 0.5763, test_loss: 0.7118, test_f1: 0.6710
 epoch: 32, train_loss: 0.5502, test_loss: 0.8290, test_f1: 0.6561
 epoch: 33, train_loss: 0.5512, test_loss: 0.7481, test_f1: 0.6774
 epoch: 34, train_loss: 0.5514, test_loss: 0.7285, test_f1: 0.6699
 epoch: 35, train_loss: 0.5561, test_loss: 0.7956, test_f1: 0.6780
 epoch: 36, train_loss: 0.5403, test_loss: 0.7638, test_f1: 0.6715
 epoch: 37, train_loss: 0.5252, test_loss: 0.8782, test_f1: 0.6379
 epoch: 38, train_loss: 0.5126, test_loss: 0.8514, test_f1: 0.6646
 epoch: 39, train_loss: 0.5167, test_loss: 0.8150, test_f1: 0.6627
 epoch: 40, train_loss: 0.5250, test_loss: 0.8150, test_f1: 0.6531
 epoch: 41, train_loss: 0.4981, test_loss: 0.8217, test_f1: 0.6712
 epoch: 42, train_loss: 0.4899, test_loss: 0.7859, test_f1: 0.6789
 epoch: 43, train_loss: 0.4967, test_loss: 0.7942, test_f1: 0.6755
 epoch: 44, train_loss: 0.4832, test_loss: 0.7901, test_f1: 0.6953
 epoch: 45, train_loss: 0.4833, test_loss: 0.8217, test_f1: 0.7052
 epoch: 46, train_loss: 0.4594, test_loss: 0.8027, test_f1: 0.6841
 epoch: 47, train_loss: 0.4650, test_loss: 0.8763, test_f1: 0.6771
 epoch: 48, train_loss: 0.4665, test_loss: 0.8303, test_f1: 0.6800
 epoch: 49, train_loss: 0.4751, test_loss: 0.8098, test_f1: 0.6623
 epoch: 50, train_loss: 0.4468, test_loss: 0.8219, test_f1: 0.6822
 epoch: 51, train_loss: 0.4111, test_loss: 0.8774, test_f1: 0.6512
 epoch: 52, train_loss: 0.3907, test_loss: 0.9283, test_f1: 0.6611
 epoch: 53, train_loss: 0.3859, test_loss: 0.8744, test_f1: 0.6820
 epoch: 54, train_loss: 0.3731, test_loss: 0.9423, test_f1: 0.6700
 epoch: 55, train_loss: 0.3801, test_loss: 0.9366, test_f1: 0.6749
 epoch: 56, train_loss: 0.3645, test_loss: 0.9841, test_f1: 0.6576
 epoch: 57, train_loss: 0.3613, test_loss: 0.9900, test_f1: 0.6651
 epoch: 58, train_loss: 0.3655, test_loss: 1.0199, test_f1: 0.6643
 epoch: 59, train_loss: 0.3766, test_loss: 0.9618, test_f1: 0.6760
 epoch: 60, train_loss: 0.3626, test_loss: 1.0587, test_f1: 0.6746
 epoch: 61, train_loss: 0.3514, test_loss: 1.0220, test_f1: 0.6747
 epoch: 62, train_loss: 0.3623, test_loss: 0.9987, test_f1: 0.6609
 epoch: 63, train_loss: 0.3495, test_loss: 1.0589, test_f1: 0.6641
 epoch: 64, train_loss: 0.3420, test_loss: 1.0340, test_f1: 0.6550
 epoch: 65, train_loss: 0.3446, test_loss: 1.0417, test_f1: 0.6733
 epoch: 66, train_loss: 0.3380, test_loss: 1.1095, test_f1: 0.6756
 epoch: 67, train_loss: 0.3205, test_loss: 1.1277, test_f1: 0.6612
 epoch: 68, train_loss: 0.3325, test_loss: 1.1297, test_f1: 0.6794
 epoch: 69, train_loss: 0.3404, test_loss: 1.0901, test_f1: 0.6629
 epoch: 70, train_loss: 0.3384, test_loss: 1.1585, test_f1: 0.6518
 epoch: 71, train_loss: 0.3147, test_loss: 1.0894, test_f1: 0.6726
 epoch: 72, train_loss: 0.3236, test_loss: 1.1217, test_f1: 0.6524
 epoch: 73, train_loss: 0.3130, test_loss: 1.0905, test_f1: 0.6700
 epoch: 74, train_loss: 0.3122, test_loss: 1.1862, test_f1: 0.6616
 epoch: 75, train_loss: 0.3329, test_loss: 1.0894, test_f1: 0.6732
 epoch: 76, train_loss: 0.2953, test_loss: 1.1975, test_f1: 0.6798
 epoch: 77, train_loss: 0.3117, test_loss: 1.2098, test_f1: 0.6726
 epoch: 78, train_loss: 0.2964, test_loss: 1.1916, test_f1: 0.6417
 epoch: 79, train_loss: 0.2909, test_loss: 1.1662, test_f1: 0.6642
 epoch: 80, train_loss: 0.2925, test_loss: 1.2538, test_f1: 0.6530
 epoch: 81, train_loss: 0.3064, test_loss: 1.1927, test_f1: 0.6558
 epoch: 82, train_loss: 0.2861, test_loss: 1.2336, test_f1: 0.6635
 epoch: 83, train_loss: 0.2948, test_loss: 1.2573, test_f1: 0.6683
 epoch: 84, train_loss: 0.2870, test_loss: 1.3153, test_f1: 0.6607
 epoch: 85, train_loss: 0.2942, test_loss: 1.1600, test_f1: 0.6908
 epoch: 86, train_loss: 0.2976, test_loss: 1.2719, test_f1: 0.6555
 epoch: 87, train_loss: 0.2824, test_loss: 1.3322, test_f1: 0.6741
 epoch: 88, train_loss: 0.2799, test_loss: 1.2913, test_f1: 0.6634
 epoch: 89, train_loss: 0.2782, test_loss: 1.2722, test_f1: 0.6603
 epoch: 90, train_loss: 0.2806, test_loss: 1.3070, test_f1: 0.6683
 epoch: 91, train_loss: 0.2770, test_loss: 1.4137, test_f1: 0.6547
 epoch: 92, train_loss: 0.2786, test_loss: 1.1900, test_f1: 0.6627
 epoch: 93, train_loss: 0.2841, test_loss: 1.2947, test_f1: 0.6572
 epoch: 94, train_loss: 0.2540, test_loss: 1.3595, test_f1: 0.6741
 epoch: 95, train_loss: 0.2696, test_loss: 1.3955, test_f1: 0.6626
 epoch: 96, train_loss: 0.2624, test_loss: 1.3967, test_f1: 0.6671
 epoch: 97, train_loss: 0.2511, test_loss: 1.1968, test_f1: 0.6976
 epoch: 98, train_loss: 0.2514, test_loss: 1.3740, test_f1: 0.6584
 epoch: 99, train_loss: 0.2500, test_loss: 1.3432, test_f1: 0.6673
##################ITERATION #4 ****************************************
 epoch: 0, train_loss: 1.2900, test_loss: 1.2141, test_f1: 0.3905
 epoch: 1, train_loss: 0.9997, test_loss: 0.9362, test_f1: 0.5033
 epoch: 2, train_loss: 0.9508, test_loss: 0.9142, test_f1: 0.5364
 epoch: 3, train_loss: 0.9203, test_loss: 0.8776, test_f1: 0.5254
 epoch: 4, train_loss: 0.8898, test_loss: 0.8606, test_f1: 0.5559
 epoch: 5, train_loss: 0.8727, test_loss: 0.8608, test_f1: 0.5903
 epoch: 6, train_loss: 0.8489, test_loss: 0.8217, test_f1: 0.5568
 epoch: 7, train_loss: 0.8266, test_loss: 0.8624, test_f1: 0.5778
 epoch: 8, train_loss: 0.8035, test_loss: 0.8737, test_f1: 0.5739
 epoch: 9, train_loss: 0.8137, test_loss: 0.8016, test_f1: 0.6262
 epoch: 10, train_loss: 0.7886, test_loss: 0.7853, test_f1: 0.5987
 epoch: 11, train_loss: 0.7725, test_loss: 0.7776, test_f1: 0.6156
 epoch: 12, train_loss: 0.7727, test_loss: 0.8091, test_f1: 0.6172
 epoch: 13, train_loss: 0.7473, test_loss: 0.8374, test_f1: 0.5961
 epoch: 14, train_loss: 0.7364, test_loss: 0.7475, test_f1: 0.6477
 epoch: 15, train_loss: 0.7249, test_loss: 0.7654, test_f1: 0.6560
 epoch: 16, train_loss: 0.7194, test_loss: 0.7664, test_f1: 0.6129
 epoch: 17, train_loss: 0.7257, test_loss: 0.8108, test_f1: 0.6371
 epoch: 18, train_loss: 0.6815, test_loss: 0.8125, test_f1: 0.6599
 epoch: 19, train_loss: 0.6783, test_loss: 0.7671, test_f1: 0.6542
 epoch: 20, train_loss: 0.6768, test_loss: 0.7864, test_f1: 0.6238
 epoch: 21, train_loss: 0.6796, test_loss: 0.8201, test_f1: 0.6119
 epoch: 22, train_loss: 0.6900, test_loss: 0.7985, test_f1: 0.6323
 epoch: 23, train_loss: 0.6447, test_loss: 0.8497, test_f1: 0.6202
 epoch: 24, train_loss: 0.6459, test_loss: 0.8134, test_f1: 0.6559
 epoch: 25, train_loss: 0.6416, test_loss: 0.8087, test_f1: 0.6698
 epoch: 26, train_loss: 0.6355, test_loss: 0.8499, test_f1: 0.6648
 epoch: 27, train_loss: 0.6070, test_loss: 0.8156, test_f1: 0.6615
 epoch: 28, train_loss: 0.6092, test_loss: 0.8600, test_f1: 0.6653
 epoch: 29, train_loss: 0.5930, test_loss: 0.8552, test_f1: 0.6590
 epoch: 30, train_loss: 0.5851, test_loss: 0.8470, test_f1: 0.6424
 epoch: 31, train_loss: 0.6137, test_loss: 0.8225, test_f1: 0.6636
 epoch: 32, train_loss: 0.5825, test_loss: 0.8374, test_f1: 0.6780
 epoch: 33, train_loss: 0.5531, test_loss: 0.9079, test_f1: 0.6849
 epoch: 34, train_loss: 0.5593, test_loss: 0.8939, test_f1: 0.6824
 epoch: 35, train_loss: 0.5436, test_loss: 0.8485, test_f1: 0.6808
 epoch: 36, train_loss: 0.5487, test_loss: 0.8982, test_f1: 0.6734
 epoch: 37, train_loss: 0.5129, test_loss: 0.8732, test_f1: 0.6661
 epoch: 38, train_loss: 0.5175, test_loss: 0.9231, test_f1: 0.6802
 epoch: 39, train_loss: 0.5214, test_loss: 0.8930, test_f1: 0.6737
 epoch: 40, train_loss: 0.5253, test_loss: 0.9900, test_f1: 0.6747
 epoch: 41, train_loss: 0.5305, test_loss: 0.8672, test_f1: 0.7078
 epoch: 42, train_loss: 0.5366, test_loss: 1.0397, test_f1: 0.6465
 epoch: 43, train_loss: 0.5118, test_loss: 0.9031, test_f1: 0.6813
 epoch: 44, train_loss: 0.5063, test_loss: 0.9340, test_f1: 0.6669
 epoch: 45, train_loss: 0.4876, test_loss: 0.9554, test_f1: 0.6726
 epoch: 46, train_loss: 0.4609, test_loss: 0.9752, test_f1: 0.6882
 epoch: 47, train_loss: 0.4640, test_loss: 0.9908, test_f1: 0.6572
 epoch: 48, train_loss: 0.4875, test_loss: 0.9157, test_f1: 0.6886
 epoch: 49, train_loss: 0.4906, test_loss: 0.8909, test_f1: 0.6766
 epoch: 50, train_loss: 0.4657, test_loss: 1.0091, test_f1: 0.6888
 epoch: 51, train_loss: 0.4222, test_loss: 0.9902, test_f1: 0.6654
 epoch: 52, train_loss: 0.4056, test_loss: 0.9950, test_f1: 0.7040
 epoch: 53, train_loss: 0.3987, test_loss: 1.0189, test_f1: 0.6866
 epoch: 54, train_loss: 0.3997, test_loss: 1.0284, test_f1: 0.6863
 epoch: 55, train_loss: 0.3781, test_loss: 1.0924, test_f1: 0.6818
 epoch: 56, train_loss: 0.3857, test_loss: 1.1139, test_f1: 0.6752
 epoch: 57, train_loss: 0.3719, test_loss: 1.0656, test_f1: 0.6856
 epoch: 58, train_loss: 0.3733, test_loss: 1.0758, test_f1: 0.6920
 epoch: 59, train_loss: 0.3752, test_loss: 1.0734, test_f1: 0.6996
 epoch: 60, train_loss: 0.3668, test_loss: 1.1425, test_f1: 0.6774
 epoch: 61, train_loss: 0.3577, test_loss: 1.1362, test_f1: 0.6954
 epoch: 62, train_loss: 0.3479, test_loss: 1.1679, test_f1: 0.6869
 epoch: 63, train_loss: 0.3479, test_loss: 1.2013, test_f1: 0.6893
 epoch: 64, train_loss: 0.3423, test_loss: 1.1978, test_f1: 0.6815
 epoch: 65, train_loss: 0.3544, test_loss: 1.2191, test_f1: 0.6920
 epoch: 66, train_loss: 0.3517, test_loss: 1.2322, test_f1: 0.6885
 epoch: 67, train_loss: 0.3560, test_loss: 1.1869, test_f1: 0.6876
 epoch: 68, train_loss: 0.3265, test_loss: 1.2586, test_f1: 0.6721
 epoch: 69, train_loss: 0.3346, test_loss: 1.3824, test_f1: 0.6712
 epoch: 70, train_loss: 0.3272, test_loss: 1.2916, test_f1: 0.6975
 epoch: 71, train_loss: 0.3262, test_loss: 1.2663, test_f1: 0.6769
 epoch: 72, train_loss: 0.3223, test_loss: 1.3940, test_f1: 0.6918
 epoch: 73, train_loss: 0.3262, test_loss: 1.3289, test_f1: 0.6811
 epoch: 74, train_loss: 0.3177, test_loss: 1.3108, test_f1: 0.6834
 epoch: 75, train_loss: 0.3126, test_loss: 1.2914, test_f1: 0.6889
 epoch: 76, train_loss: 0.2935, test_loss: 1.3074, test_f1: 0.6849
 epoch: 77, train_loss: 0.3206, test_loss: 1.3982, test_f1: 0.6779
 epoch: 78, train_loss: 0.3233, test_loss: 1.3751, test_f1: 0.6672
 epoch: 79, train_loss: 0.2924, test_loss: 1.3335, test_f1: 0.6870
 epoch: 80, train_loss: 0.2996, test_loss: 1.3007, test_f1: 0.6762
 epoch: 81, train_loss: 0.2961, test_loss: 1.3109, test_f1: 0.6937
 epoch: 82, train_loss: 0.2889, test_loss: 1.3910, test_f1: 0.6773
 epoch: 83, train_loss: 0.2909, test_loss: 1.3903, test_f1: 0.6798
 epoch: 84, train_loss: 0.3043, test_loss: 1.4265, test_f1: 0.6681
 epoch: 85, train_loss: 0.2987, test_loss: 1.4814, test_f1: 0.6754
 epoch: 86, train_loss: 0.2947, test_loss: 1.4177, test_f1: 0.6875
 epoch: 87, train_loss: 0.2838, test_loss: 1.2815, test_f1: 0.7085
 epoch: 88, train_loss: 0.2819, test_loss: 1.4316, test_f1: 0.6816
 epoch: 89, train_loss: 0.2663, test_loss: 1.4564, test_f1: 0.6740
 epoch: 90, train_loss: 0.2609, test_loss: 1.5047, test_f1: 0.6705
 epoch: 91, train_loss: 0.2664, test_loss: 1.4051, test_f1: 0.6892
 epoch: 92, train_loss: 0.2628, test_loss: 1.4941, test_f1: 0.6804
 epoch: 93, train_loss: 0.2581, test_loss: 1.5696, test_f1: 0.6859
 epoch: 94, train_loss: 0.2631, test_loss: 1.5084, test_f1: 0.6832
 epoch: 95, train_loss: 0.2513, test_loss: 1.5508, test_f1: 0.6751
 epoch: 96, train_loss: 0.2663, test_loss: 1.5630, test_f1: 0.6872
 epoch: 97, train_loss: 0.2835, test_loss: 1.5041, test_f1: 0.6856
 epoch: 98, train_loss: 0.2618, test_loss: 1.4659, test_f1: 0.6725
 epoch: 99, train_loss: 0.2444, test_loss: 1.6222, test_f1: 0.6865
##################ITERATION #5 ****************************************
 epoch: 0, train_loss: 1.2526, test_loss: 1.2643, test_f1: 0.3839
 epoch: 1, train_loss: 1.0102, test_loss: 0.9111, test_f1: 0.4936
 epoch: 2, train_loss: 0.9526, test_loss: 0.8955, test_f1: 0.5084
 epoch: 3, train_loss: 0.9364, test_loss: 0.8719, test_f1: 0.5069
 epoch: 4, train_loss: 0.9109, test_loss: 0.8540, test_f1: 0.5214
 epoch: 5, train_loss: 0.8910, test_loss: 0.9455, test_f1: 0.5423
 epoch: 6, train_loss: 0.8609, test_loss: 0.8326, test_f1: 0.5515
 epoch: 7, train_loss: 0.8386, test_loss: 0.8876, test_f1: 0.5584
 epoch: 8, train_loss: 0.8273, test_loss: 0.8527, test_f1: 0.5640
 epoch: 9, train_loss: 0.8160, test_loss: 0.8594, test_f1: 0.5523
 epoch: 10, train_loss: 0.8049, test_loss: 0.7973, test_f1: 0.6093
 epoch: 11, train_loss: 0.8077, test_loss: 0.8452, test_f1: 0.5736
 epoch: 12, train_loss: 0.7688, test_loss: 0.8585, test_f1: 0.5918
 epoch: 13, train_loss: 0.7575, test_loss: 0.8143, test_f1: 0.5825
 epoch: 14, train_loss: 0.7485, test_loss: 0.8439, test_f1: 0.5684
 epoch: 15, train_loss: 0.7413, test_loss: 0.7110, test_f1: 0.6307
 epoch: 16, train_loss: 0.7178, test_loss: 0.7431, test_f1: 0.6083
 epoch: 17, train_loss: 0.7177, test_loss: 0.7498, test_f1: 0.6225
 epoch: 18, train_loss: 0.6906, test_loss: 0.7437, test_f1: 0.6496
 epoch: 19, train_loss: 0.6995, test_loss: 0.7578, test_f1: 0.6217
 epoch: 20, train_loss: 0.6777, test_loss: 0.7522, test_f1: 0.6499
 epoch: 21, train_loss: 0.6588, test_loss: 0.8347, test_f1: 0.6526
 epoch: 22, train_loss: 0.6781, test_loss: 0.7874, test_f1: 0.6262
 epoch: 23, train_loss: 0.6661, test_loss: 0.8551, test_f1: 0.6373
 epoch: 24, train_loss: 0.6451, test_loss: 0.8150, test_f1: 0.6312
 epoch: 25, train_loss: 0.6389, test_loss: 0.7788, test_f1: 0.6224
 epoch: 26, train_loss: 0.6391, test_loss: 0.7493, test_f1: 0.6622
 epoch: 27, train_loss: 0.6147, test_loss: 0.7871, test_f1: 0.6488
 epoch: 28, train_loss: 0.6062, test_loss: 0.7425, test_f1: 0.6559
 epoch: 29, train_loss: 0.6079, test_loss: 0.7262, test_f1: 0.6483
 epoch: 30, train_loss: 0.5952, test_loss: 0.8532, test_f1: 0.6300
 epoch: 31, train_loss: 0.5946, test_loss: 0.7614, test_f1: 0.6291
 epoch: 32, train_loss: 0.5829, test_loss: 0.9162, test_f1: 0.6525
 epoch: 33, train_loss: 0.5718, test_loss: 0.8476, test_f1: 0.6562
 epoch: 34, train_loss: 0.5664, test_loss: 0.8015, test_f1: 0.6613
 epoch: 35, train_loss: 0.5784, test_loss: 0.8223, test_f1: 0.6599
 epoch: 36, train_loss: 0.5412, test_loss: 0.8243, test_f1: 0.6496
 epoch: 37, train_loss: 0.5498, test_loss: 0.9238, test_f1: 0.6611
 epoch: 38, train_loss: 0.5443, test_loss: 0.8922, test_f1: 0.6455
 epoch: 39, train_loss: 0.5482, test_loss: 0.8203, test_f1: 0.6350
 epoch: 40, train_loss: 0.5266, test_loss: 0.7959, test_f1: 0.6765
 epoch: 41, train_loss: 0.5182, test_loss: 0.8032, test_f1: 0.6943
 epoch: 42, train_loss: 0.5112, test_loss: 0.8229, test_f1: 0.6875
 epoch: 43, train_loss: 0.5073, test_loss: 0.8548, test_f1: 0.6498
 epoch: 44, train_loss: 0.5057, test_loss: 0.9124, test_f1: 0.6624
 epoch: 45, train_loss: 0.5074, test_loss: 0.8066, test_f1: 0.6722
 epoch: 46, train_loss: 0.4910, test_loss: 0.8440, test_f1: 0.6833
 epoch: 47, train_loss: 0.4884, test_loss: 0.8773, test_f1: 0.6567
 epoch: 48, train_loss: 0.4922, test_loss: 0.8739, test_f1: 0.6516
 epoch: 49, train_loss: 0.4751, test_loss: 0.8376, test_f1: 0.6720
 epoch: 50, train_loss: 0.4803, test_loss: 0.8347, test_f1: 0.6623
 epoch: 51, train_loss: 0.4478, test_loss: 0.8942, test_f1: 0.6684
 epoch: 52, train_loss: 0.4172, test_loss: 0.9035, test_f1: 0.6617
 epoch: 53, train_loss: 0.4206, test_loss: 0.9239, test_f1: 0.6660
 epoch: 54, train_loss: 0.4084, test_loss: 0.8860, test_f1: 0.6714
 epoch: 55, train_loss: 0.4123, test_loss: 0.9397, test_f1: 0.6538
 epoch: 56, train_loss: 0.3833, test_loss: 0.9401, test_f1: 0.6638
 epoch: 57, train_loss: 0.3784, test_loss: 0.9192, test_f1: 0.6547
 epoch: 58, train_loss: 0.3937, test_loss: 1.0392, test_f1: 0.6536
 epoch: 59, train_loss: 0.3827, test_loss: 0.9045, test_f1: 0.6633
 epoch: 60, train_loss: 0.3797, test_loss: 1.0388, test_f1: 0.6541
 epoch: 61, train_loss: 0.3781, test_loss: 1.0234, test_f1: 0.6837
 epoch: 62, train_loss: 0.3557, test_loss: 1.0595, test_f1: 0.6582
 epoch: 63, train_loss: 0.3653, test_loss: 1.0179, test_f1: 0.6624
 epoch: 64, train_loss: 0.3629, test_loss: 1.0803, test_f1: 0.6587
 epoch: 65, train_loss: 0.3634, test_loss: 1.0454, test_f1: 0.6684
 epoch: 66, train_loss: 0.3619, test_loss: 1.0854, test_f1: 0.6634
 epoch: 67, train_loss: 0.3541, test_loss: 1.1362, test_f1: 0.6585
 epoch: 68, train_loss: 0.3496, test_loss: 1.1127, test_f1: 0.6495
 epoch: 69, train_loss: 0.3393, test_loss: 1.1917, test_f1: 0.6448
 epoch: 70, train_loss: 0.3273, test_loss: 1.1052, test_f1: 0.6568
 epoch: 71, train_loss: 0.3417, test_loss: 1.1262, test_f1: 0.6569
 epoch: 72, train_loss: 0.3268, test_loss: 1.1057, test_f1: 0.6592
 epoch: 73, train_loss: 0.3310, test_loss: 1.0862, test_f1: 0.6578
 epoch: 74, train_loss: 0.3380, test_loss: 1.2108, test_f1: 0.6484
 epoch: 75, train_loss: 0.3364, test_loss: 1.2193, test_f1: 0.6356
 epoch: 76, train_loss: 0.3448, test_loss: 1.1647, test_f1: 0.6612
 epoch: 77, train_loss: 0.3308, test_loss: 1.1766, test_f1: 0.6554
 epoch: 78, train_loss: 0.3315, test_loss: 1.1370, test_f1: 0.6496
 epoch: 79, train_loss: 0.3341, test_loss: 1.2069, test_f1: 0.6547
 epoch: 80, train_loss: 0.3142, test_loss: 1.2448, test_f1: 0.6590
 epoch: 81, train_loss: 0.3124, test_loss: 1.1603, test_f1: 0.6587
 epoch: 82, train_loss: 0.3129, test_loss: 1.1928, test_f1: 0.6619
 epoch: 83, train_loss: 0.3107, test_loss: 1.2626, test_f1: 0.6499
 epoch: 84, train_loss: 0.3022, test_loss: 1.2244, test_f1: 0.6554
 epoch: 85, train_loss: 0.3216, test_loss: 1.2912, test_f1: 0.6755
 epoch: 86, train_loss: 0.2999, test_loss: 1.2203, test_f1: 0.6451
 epoch: 87, train_loss: 0.3126, test_loss: 1.1493, test_f1: 0.6794
 epoch: 88, train_loss: 0.3067, test_loss: 1.2496, test_f1: 0.6598
 epoch: 89, train_loss: 0.2894, test_loss: 1.2868, test_f1: 0.6352
 epoch: 90, train_loss: 0.2962, test_loss: 1.2990, test_f1: 0.6420
 epoch: 91, train_loss: 0.2907, test_loss: 1.3324, test_f1: 0.6492
 epoch: 92, train_loss: 0.2902, test_loss: 1.4064, test_f1: 0.6438
 epoch: 93, train_loss: 0.2871, test_loss: 1.2763, test_f1: 0.6513
 epoch: 94, train_loss: 0.2804, test_loss: 1.2913, test_f1: 0.6535
 epoch: 95, train_loss: 0.2867, test_loss: 1.3626, test_f1: 0.6498
 epoch: 96, train_loss: 0.2804, test_loss: 1.2869, test_f1: 0.6435
 epoch: 97, train_loss: 0.2716, test_loss: 1.3095, test_f1: 0.6576
 epoch: 98, train_loss: 0.2664, test_loss: 1.4442, test_f1: 0.6568
 epoch: 99, train_loss: 0.2688, test_loss: 1.3583, test_f1: 0.6526
##################ITERATION #6 ****************************************
 epoch: 0, train_loss: 1.2721, test_loss: 1.1146, test_f1: 0.3559
 epoch: 1, train_loss: 0.9953, test_loss: 0.9365, test_f1: 0.5325
 epoch: 2, train_loss: 0.9491, test_loss: 0.8567, test_f1: 0.5220
 epoch: 3, train_loss: 0.9221, test_loss: 0.8925, test_f1: 0.5213
 epoch: 4, train_loss: 0.8882, test_loss: 0.8661, test_f1: 0.5480
 epoch: 5, train_loss: 0.8726, test_loss: 0.8758, test_f1: 0.5134
 epoch: 6, train_loss: 0.8533, test_loss: 0.8344, test_f1: 0.5595
 epoch: 7, train_loss: 0.8371, test_loss: 0.7749, test_f1: 0.5991
 epoch: 8, train_loss: 0.8184, test_loss: 0.7971, test_f1: 0.5941
 epoch: 9, train_loss: 0.8057, test_loss: 0.8131, test_f1: 0.5962
 epoch: 10, train_loss: 0.7843, test_loss: 0.7651, test_f1: 0.6055
 epoch: 11, train_loss: 0.7715, test_loss: 0.7797, test_f1: 0.5957
 epoch: 12, train_loss: 0.7548, test_loss: 0.7913, test_f1: 0.6174
 epoch: 13, train_loss: 0.7376, test_loss: 0.8398, test_f1: 0.5951
 epoch: 14, train_loss: 0.7513, test_loss: 0.8143, test_f1: 0.6207
 epoch: 15, train_loss: 0.7186, test_loss: 0.7549, test_f1: 0.6198
 epoch: 16, train_loss: 0.7151, test_loss: 0.7418, test_f1: 0.6134
 epoch: 17, train_loss: 0.6922, test_loss: 0.7920, test_f1: 0.6090
 epoch: 18, train_loss: 0.6895, test_loss: 0.8040, test_f1: 0.6230
 epoch: 19, train_loss: 0.6790, test_loss: 0.7970, test_f1: 0.6440
 epoch: 20, train_loss: 0.6532, test_loss: 0.7768, test_f1: 0.6002
 epoch: 21, train_loss: 0.6646, test_loss: 0.7619, test_f1: 0.6276
 epoch: 22, train_loss: 0.6460, test_loss: 0.6975, test_f1: 0.6957
 epoch: 23, train_loss: 0.6534, test_loss: 0.7222, test_f1: 0.6823
 epoch: 24, train_loss: 0.6416, test_loss: 0.7213, test_f1: 0.6882
 epoch: 25, train_loss: 0.6133, test_loss: 0.7610, test_f1: 0.6654
 epoch: 26, train_loss: 0.6051, test_loss: 0.8040, test_f1: 0.6550
 epoch: 27, train_loss: 0.6421, test_loss: 0.7418, test_f1: 0.6781
 epoch: 28, train_loss: 0.5959, test_loss: 0.7335, test_f1: 0.6671
 epoch: 29, train_loss: 0.5898, test_loss: 0.9038, test_f1: 0.6736
 epoch: 30, train_loss: 0.5939, test_loss: 0.8345, test_f1: 0.6737
 epoch: 31, train_loss: 0.5768, test_loss: 0.8096, test_f1: 0.6468
 epoch: 32, train_loss: 0.5518, test_loss: 0.8707, test_f1: 0.6461
 epoch: 33, train_loss: 0.5604, test_loss: 0.8507, test_f1: 0.6477
 epoch: 34, train_loss: 0.5639, test_loss: 0.9079, test_f1: 0.6391
 epoch: 35, train_loss: 0.5565, test_loss: 0.9030, test_f1: 0.6386
 epoch: 36, train_loss: 0.5453, test_loss: 0.9236, test_f1: 0.6618
 epoch: 37, train_loss: 0.5512, test_loss: 0.9530, test_f1: 0.6509
 epoch: 38, train_loss: 0.5433, test_loss: 0.8829, test_f1: 0.6471
 epoch: 39, train_loss: 0.5228, test_loss: 0.8847, test_f1: 0.6714
 epoch: 40, train_loss: 0.5330, test_loss: 0.8865, test_f1: 0.6662
 epoch: 41, train_loss: 0.5099, test_loss: 0.9661, test_f1: 0.6625
 epoch: 42, train_loss: 0.5057, test_loss: 0.9558, test_f1: 0.6508
 epoch: 43, train_loss: 0.4869, test_loss: 0.9159, test_f1: 0.6891
 epoch: 44, train_loss: 0.4896, test_loss: 0.9662, test_f1: 0.6300
 epoch: 45, train_loss: 0.4771, test_loss: 0.9161, test_f1: 0.6648
 epoch: 46, train_loss: 0.4955, test_loss: 0.9461, test_f1: 0.6528
 epoch: 47, train_loss: 0.4829, test_loss: 0.9819, test_f1: 0.6440
 epoch: 48, train_loss: 0.4771, test_loss: 1.0029, test_f1: 0.6454
 epoch: 49, train_loss: 0.4607, test_loss: 1.0278, test_f1: 0.6538
 epoch: 50, train_loss: 0.4574, test_loss: 1.1062, test_f1: 0.6409
 epoch: 51, train_loss: 0.4287, test_loss: 0.9876, test_f1: 0.6710
 epoch: 52, train_loss: 0.4169, test_loss: 1.1228, test_f1: 0.6568
 epoch: 53, train_loss: 0.4159, test_loss: 1.0541, test_f1: 0.6608
 epoch: 54, train_loss: 0.4001, test_loss: 1.0772, test_f1: 0.6658
 epoch: 55, train_loss: 0.3932, test_loss: 1.0985, test_f1: 0.6544
 epoch: 56, train_loss: 0.3859, test_loss: 1.0843, test_f1: 0.6515
 epoch: 57, train_loss: 0.3808, test_loss: 1.1713, test_f1: 0.6618
 epoch: 58, train_loss: 0.3808, test_loss: 1.1972, test_f1: 0.6728
 epoch: 59, train_loss: 0.3672, test_loss: 1.1417, test_f1: 0.6830
 epoch: 60, train_loss: 0.3779, test_loss: 1.2074, test_f1: 0.6377
 epoch: 61, train_loss: 0.3653, test_loss: 1.1371, test_f1: 0.6758
 epoch: 62, train_loss: 0.3484, test_loss: 1.1718, test_f1: 0.6707
 epoch: 63, train_loss: 0.3598, test_loss: 1.2598, test_f1: 0.6496
 epoch: 64, train_loss: 0.3617, test_loss: 1.2083, test_f1: 0.6749
 epoch: 65, train_loss: 0.3546, test_loss: 1.2942, test_f1: 0.6620
 epoch: 66, train_loss: 0.3362, test_loss: 1.2735, test_f1: 0.6614
 epoch: 67, train_loss: 0.3519, test_loss: 1.2477, test_f1: 0.6630
 epoch: 68, train_loss: 0.3281, test_loss: 1.2540, test_f1: 0.6573
 epoch: 69, train_loss: 0.3526, test_loss: 1.2148, test_f1: 0.6670
 epoch: 70, train_loss: 0.3387, test_loss: 1.2957, test_f1: 0.6579
 epoch: 71, train_loss: 0.3417, test_loss: 1.2371, test_f1: 0.6682
 epoch: 72, train_loss: 0.3216, test_loss: 1.3115, test_f1: 0.6642
 epoch: 73, train_loss: 0.3534, test_loss: 1.2858, test_f1: 0.6654
 epoch: 74, train_loss: 0.3341, test_loss: 1.2906, test_f1: 0.6618
 epoch: 75, train_loss: 0.3360, test_loss: 1.2939, test_f1: 0.6723
 epoch: 76, train_loss: 0.3453, test_loss: 1.3278, test_f1: 0.6552
 epoch: 77, train_loss: 0.3294, test_loss: 1.2650, test_f1: 0.6758
 epoch: 78, train_loss: 0.3178, test_loss: 1.3843, test_f1: 0.6542
 epoch: 79, train_loss: 0.3194, test_loss: 1.4228, test_f1: 0.6409
 epoch: 80, train_loss: 0.3279, test_loss: 1.4140, test_f1: 0.6608
 epoch: 81, train_loss: 0.3197, test_loss: 1.3896, test_f1: 0.6787
 epoch: 82, train_loss: 0.3058, test_loss: 1.3461, test_f1: 0.6792
 epoch: 83, train_loss: 0.2958, test_loss: 1.4754, test_f1: 0.6675
 epoch: 84, train_loss: 0.3103, test_loss: 1.4060, test_f1: 0.6659
 epoch: 85, train_loss: 0.3025, test_loss: 1.4398, test_f1: 0.6619
 epoch: 86, train_loss: 0.3078, test_loss: 1.3795, test_f1: 0.6776
 epoch: 87, train_loss: 0.3008, test_loss: 1.4305, test_f1: 0.6789
 epoch: 88, train_loss: 0.3099, test_loss: 1.4148, test_f1: 0.6627
 epoch: 89, train_loss: 0.2873, test_loss: 1.4278, test_f1: 0.6809
 epoch: 90, train_loss: 0.2818, test_loss: 1.5088, test_f1: 0.6681
 epoch: 91, train_loss: 0.2931, test_loss: 1.4845, test_f1: 0.6729
 epoch: 92, train_loss: 0.2911, test_loss: 1.3793, test_f1: 0.6885
 epoch: 93, train_loss: 0.2923, test_loss: 1.4628, test_f1: 0.6702
 epoch: 94, train_loss: 0.2913, test_loss: 1.4912, test_f1: 0.6763
 epoch: 95, train_loss: 0.2844, test_loss: 1.5584, test_f1: 0.6714
 epoch: 96, train_loss: 0.2678, test_loss: 1.5449, test_f1: 0.6615
 epoch: 97, train_loss: 0.2765, test_loss: 1.6398, test_f1: 0.6813
 epoch: 98, train_loss: 0.2869, test_loss: 1.5587, test_f1: 0.6775
 epoch: 99, train_loss: 0.2886, test_loss: 1.5368, test_f1: 0.6870
##################ITERATION #7 ****************************************
 epoch: 0, train_loss: 1.3951, test_loss: 1.0776, test_f1: 0.4945
 epoch: 1, train_loss: 1.0374, test_loss: 0.9178, test_f1: 0.5038
 epoch: 2, train_loss: 0.9651, test_loss: 0.9416, test_f1: 0.4995
 epoch: 3, train_loss: 0.9248, test_loss: 0.9380, test_f1: 0.4906
 epoch: 4, train_loss: 0.9220, test_loss: 0.9048, test_f1: 0.5499
 epoch: 5, train_loss: 0.8910, test_loss: 0.8777, test_f1: 0.5503
 epoch: 6, train_loss: 0.8815, test_loss: 0.9169, test_f1: 0.5457
 epoch: 7, train_loss: 0.8517, test_loss: 0.8198, test_f1: 0.5944
 epoch: 8, train_loss: 0.8315, test_loss: 0.8089, test_f1: 0.5595
 epoch: 9, train_loss: 0.8225, test_loss: 0.8593, test_f1: 0.5635
 epoch: 10, train_loss: 0.8111, test_loss: 0.8511, test_f1: 0.5897
 epoch: 11, train_loss: 0.7836, test_loss: 0.8401, test_f1: 0.5677
 epoch: 12, train_loss: 0.7882, test_loss: 0.8972, test_f1: 0.5584
 epoch: 13, train_loss: 0.7639, test_loss: 0.8813, test_f1: 0.5545
 epoch: 14, train_loss: 0.7552, test_loss: 0.7977, test_f1: 0.6099
 epoch: 15, train_loss: 0.7300, test_loss: 0.7924, test_f1: 0.6305
 epoch: 16, train_loss: 0.7283, test_loss: 0.7501, test_f1: 0.6388
 epoch: 17, train_loss: 0.7175, test_loss: 0.8358, test_f1: 0.6413
 epoch: 18, train_loss: 0.7271, test_loss: 0.7895, test_f1: 0.6178
 epoch: 19, train_loss: 0.7025, test_loss: 0.7353, test_f1: 0.6448
 epoch: 20, train_loss: 0.6823, test_loss: 0.7417, test_f1: 0.6474
 epoch: 21, train_loss: 0.6847, test_loss: 0.7607, test_f1: 0.6453
 epoch: 22, train_loss: 0.6697, test_loss: 0.7655, test_f1: 0.6517
 epoch: 23, train_loss: 0.6558, test_loss: 0.7889, test_f1: 0.6302
 epoch: 24, train_loss: 0.6329, test_loss: 0.7903, test_f1: 0.6306
 epoch: 25, train_loss: 0.6517, test_loss: 0.8139, test_f1: 0.6413
 epoch: 26, train_loss: 0.6248, test_loss: 0.7196, test_f1: 0.6686
 epoch: 27, train_loss: 0.6268, test_loss: 0.7965, test_f1: 0.6299
 epoch: 28, train_loss: 0.6184, test_loss: 0.7202, test_f1: 0.6544
 epoch: 29, train_loss: 0.6188, test_loss: 0.7489, test_f1: 0.6654
 epoch: 30, train_loss: 0.5873, test_loss: 0.7499, test_f1: 0.6770
 epoch: 31, train_loss: 0.6170, test_loss: 0.7730, test_f1: 0.6580
 epoch: 32, train_loss: 0.5977, test_loss: 0.8264, test_f1: 0.6419
 epoch: 33, train_loss: 0.5853, test_loss: 0.7864, test_f1: 0.6722
 epoch: 34, train_loss: 0.5761, test_loss: 0.8448, test_f1: 0.6218
 epoch: 35, train_loss: 0.5698, test_loss: 0.7792, test_f1: 0.6638
 epoch: 36, train_loss: 0.5665, test_loss: 0.8317, test_f1: 0.6695
 epoch: 37, train_loss: 0.5475, test_loss: 0.7772, test_f1: 0.6472
 epoch: 38, train_loss: 0.5468, test_loss: 0.7569, test_f1: 0.6786
 epoch: 39, train_loss: 0.5270, test_loss: 0.7348, test_f1: 0.6701
 epoch: 40, train_loss: 0.5253, test_loss: 0.8321, test_f1: 0.6396
 epoch: 41, train_loss: 0.5097, test_loss: 0.7659, test_f1: 0.6740
 epoch: 42, train_loss: 0.5366, test_loss: 0.7879, test_f1: 0.6895
 epoch: 43, train_loss: 0.5111, test_loss: 0.7417, test_f1: 0.6810
 epoch: 44, train_loss: 0.5062, test_loss: 0.7936, test_f1: 0.6612
 epoch: 45, train_loss: 0.5018, test_loss: 0.7930, test_f1: 0.6865
 epoch: 46, train_loss: 0.4973, test_loss: 0.7553, test_f1: 0.6998
 epoch: 47, train_loss: 0.4869, test_loss: 0.9819, test_f1: 0.6313
 epoch: 48, train_loss: 0.4825, test_loss: 0.8912, test_f1: 0.6668
 epoch: 49, train_loss: 0.4890, test_loss: 0.8536, test_f1: 0.6402
 epoch: 50, train_loss: 0.4819, test_loss: 0.8460, test_f1: 0.7076
 epoch: 51, train_loss: 0.4256, test_loss: 0.7986, test_f1: 0.7142
 epoch: 52, train_loss: 0.4268, test_loss: 0.8129, test_f1: 0.6622
 epoch: 53, train_loss: 0.4171, test_loss: 0.9093, test_f1: 0.6802
 epoch: 54, train_loss: 0.3920, test_loss: 0.8299, test_f1: 0.6748
 epoch: 55, train_loss: 0.3825, test_loss: 0.9980, test_f1: 0.6764
 epoch: 56, train_loss: 0.4049, test_loss: 0.8821, test_f1: 0.6833
 epoch: 57, train_loss: 0.3870, test_loss: 0.9637, test_f1: 0.6880
 epoch: 58, train_loss: 0.3631, test_loss: 0.9595, test_f1: 0.6748
 epoch: 59, train_loss: 0.3789, test_loss: 0.9775, test_f1: 0.7012
 epoch: 60, train_loss: 0.3829, test_loss: 0.9474, test_f1: 0.6930
 epoch: 61, train_loss: 0.3687, test_loss: 0.9031, test_f1: 0.6881
 epoch: 62, train_loss: 0.3661, test_loss: 1.0197, test_f1: 0.6689
 epoch: 63, train_loss: 0.3743, test_loss: 1.0257, test_f1: 0.6823
 epoch: 64, train_loss: 0.3406, test_loss: 1.0781, test_f1: 0.6689
 epoch: 65, train_loss: 0.3426, test_loss: 1.0361, test_f1: 0.6838
 epoch: 66, train_loss: 0.3469, test_loss: 1.0897, test_f1: 0.6792
 epoch: 67, train_loss: 0.3412, test_loss: 1.1652, test_f1: 0.6871
 epoch: 68, train_loss: 0.3337, test_loss: 1.0382, test_f1: 0.6763
 epoch: 69, train_loss: 0.3512, test_loss: 1.0669, test_f1: 0.6786
 epoch: 70, train_loss: 0.3373, test_loss: 1.0732, test_f1: 0.6680
 epoch: 71, train_loss: 0.3267, test_loss: 1.1325, test_f1: 0.6689
 epoch: 72, train_loss: 0.3388, test_loss: 1.2916, test_f1: 0.6537
 epoch: 73, train_loss: 0.3292, test_loss: 1.1101, test_f1: 0.6759
 epoch: 74, train_loss: 0.3232, test_loss: 1.2823, test_f1: 0.6721
 epoch: 75, train_loss: 0.3449, test_loss: 1.2369, test_f1: 0.6540
 epoch: 76, train_loss: 0.3267, test_loss: 1.2683, test_f1: 0.6541
 epoch: 77, train_loss: 0.3135, test_loss: 1.1718, test_f1: 0.6655
 epoch: 78, train_loss: 0.2981, test_loss: 1.2129, test_f1: 0.6685
 epoch: 79, train_loss: 0.3163, test_loss: 1.1494, test_f1: 0.6883
 epoch: 80, train_loss: 0.3268, test_loss: 1.1114, test_f1: 0.6957
 epoch: 81, train_loss: 0.3212, test_loss: 1.1929, test_f1: 0.6752
 epoch: 82, train_loss: 0.3165, test_loss: 1.1204, test_f1: 0.6674
 epoch: 83, train_loss: 0.2988, test_loss: 1.1951, test_f1: 0.6776
 epoch: 84, train_loss: 0.3023, test_loss: 1.2522, test_f1: 0.6706
 epoch: 85, train_loss: 0.2908, test_loss: 1.3102, test_f1: 0.6821
 epoch: 86, train_loss: 0.2999, test_loss: 1.2732, test_f1: 0.6577
 epoch: 87, train_loss: 0.2883, test_loss: 1.1807, test_f1: 0.7078
 epoch: 88, train_loss: 0.2877, test_loss: 1.2612, test_f1: 0.6893
 epoch: 89, train_loss: 0.2691, test_loss: 1.2322, test_f1: 0.6789
 epoch: 90, train_loss: 0.2772, test_loss: 1.3279, test_f1: 0.6673
 epoch: 91, train_loss: 0.3017, test_loss: 1.2519, test_f1: 0.6749
 epoch: 92, train_loss: 0.2813, test_loss: 1.2172, test_f1: 0.6862
 epoch: 93, train_loss: 0.2730, test_loss: 1.2994, test_f1: 0.6947
 epoch: 94, train_loss: 0.2834, test_loss: 1.4352, test_f1: 0.6805
 epoch: 95, train_loss: 0.2828, test_loss: 1.2588, test_f1: 0.6816
 epoch: 96, train_loss: 0.2693, test_loss: 1.3576, test_f1: 0.6616
 epoch: 97, train_loss: 0.2916, test_loss: 1.3431, test_f1: 0.6694
 epoch: 98, train_loss: 0.2544, test_loss: 1.1942, test_f1: 0.6924
 epoch: 99, train_loss: 0.2630, test_loss: 1.2702, test_f1: 0.6780
##################ITERATION #8 ****************************************
 epoch: 0, train_loss: 1.3316, test_loss: 1.0536, test_f1: 0.4402
 epoch: 1, train_loss: 1.0135, test_loss: 0.9445, test_f1: 0.5367
 epoch: 2, train_loss: 0.9699, test_loss: 0.9237, test_f1: 0.5189
 epoch: 3, train_loss: 0.9267, test_loss: 0.9173, test_f1: 0.5304
 epoch: 4, train_loss: 0.9060, test_loss: 0.9250, test_f1: 0.5134
 epoch: 5, train_loss: 0.8897, test_loss: 0.8289, test_f1: 0.5779
 epoch: 6, train_loss: 0.8792, test_loss: 0.8991, test_f1: 0.5873
 epoch: 7, train_loss: 0.8711, test_loss: 0.8835, test_f1: 0.5938
 epoch: 8, train_loss: 0.8486, test_loss: 0.8945, test_f1: 0.5857
 epoch: 9, train_loss: 0.8395, test_loss: 0.8527, test_f1: 0.5787
 epoch: 10, train_loss: 0.8258, test_loss: 0.8094, test_f1: 0.5800
 epoch: 11, train_loss: 0.8174, test_loss: 0.8951, test_f1: 0.5269
 epoch: 12, train_loss: 0.7897, test_loss: 0.7925, test_f1: 0.6090
 epoch: 13, train_loss: 0.7690, test_loss: 0.8189, test_f1: 0.6192
 epoch: 14, train_loss: 0.7670, test_loss: 0.7708, test_f1: 0.6026
 epoch: 15, train_loss: 0.7636, test_loss: 0.7688, test_f1: 0.6105
 epoch: 16, train_loss: 0.7476, test_loss: 0.7977, test_f1: 0.5981
 epoch: 17, train_loss: 0.7382, test_loss: 0.7692, test_f1: 0.5892
 epoch: 18, train_loss: 0.7302, test_loss: 0.7629, test_f1: 0.6027
 epoch: 19, train_loss: 0.7175, test_loss: 0.7544, test_f1: 0.6340
 epoch: 20, train_loss: 0.7093, test_loss: 0.8310, test_f1: 0.6381
 epoch: 21, train_loss: 0.6956, test_loss: 0.6904, test_f1: 0.6670
 epoch: 22, train_loss: 0.6906, test_loss: 0.8136, test_f1: 0.6310
 epoch: 23, train_loss: 0.6786, test_loss: 0.7426, test_f1: 0.6326
 epoch: 24, train_loss: 0.6799, test_loss: 0.7319, test_f1: 0.6292
 epoch: 25, train_loss: 0.6680, test_loss: 0.6850, test_f1: 0.6593
 epoch: 26, train_loss: 0.6656, test_loss: 0.7497, test_f1: 0.5929
 epoch: 27, train_loss: 0.6434, test_loss: 0.7294, test_f1: 0.6352
 epoch: 28, train_loss: 0.6322, test_loss: 0.7129, test_f1: 0.6373
 epoch: 29, train_loss: 0.6108, test_loss: 0.7410, test_f1: 0.6227
 epoch: 30, train_loss: 0.6116, test_loss: 0.6934, test_f1: 0.6432
 epoch: 31, train_loss: 0.6318, test_loss: 0.7014, test_f1: 0.6680
 epoch: 32, train_loss: 0.6148, test_loss: 0.7833, test_f1: 0.6349
 epoch: 33, train_loss: 0.5920, test_loss: 0.7628, test_f1: 0.6326
 epoch: 34, train_loss: 0.5963, test_loss: 0.7379, test_f1: 0.6566
 epoch: 35, train_loss: 0.5666, test_loss: 0.7281, test_f1: 0.6602
 epoch: 36, train_loss: 0.5921, test_loss: 0.7375, test_f1: 0.6474
 epoch: 37, train_loss: 0.5775, test_loss: 0.7426, test_f1: 0.6453
 epoch: 38, train_loss: 0.5663, test_loss: 0.7612, test_f1: 0.6670
 epoch: 39, train_loss: 0.5567, test_loss: 0.7019, test_f1: 0.6654
 epoch: 40, train_loss: 0.5453, test_loss: 0.7779, test_f1: 0.6520
 epoch: 41, train_loss: 0.5553, test_loss: 0.7726, test_f1: 0.6701
 epoch: 42, train_loss: 0.5308, test_loss: 0.7758, test_f1: 0.6478
 epoch: 43, train_loss: 0.5238, test_loss: 0.7908, test_f1: 0.6682
 epoch: 44, train_loss: 0.5239, test_loss: 0.7000, test_f1: 0.6760
 epoch: 45, train_loss: 0.4935, test_loss: 0.7904, test_f1: 0.6392
 epoch: 46, train_loss: 0.5269, test_loss: 0.7329, test_f1: 0.6875
 epoch: 47, train_loss: 0.4944, test_loss: 0.7552, test_f1: 0.7039
 epoch: 48, train_loss: 0.4968, test_loss: 0.8139, test_f1: 0.6465
 epoch: 49, train_loss: 0.5233, test_loss: 0.7490, test_f1: 0.7013
 epoch: 50, train_loss: 0.4963, test_loss: 0.7828, test_f1: 0.7063
 epoch: 51, train_loss: 0.4563, test_loss: 0.7460, test_f1: 0.6758
 epoch: 52, train_loss: 0.4244, test_loss: 0.7626, test_f1: 0.6944
 epoch: 53, train_loss: 0.4190, test_loss: 0.8144, test_f1: 0.6809
 epoch: 54, train_loss: 0.4403, test_loss: 0.7817, test_f1: 0.6928
 epoch: 55, train_loss: 0.3898, test_loss: 0.8276, test_f1: 0.6643
 epoch: 56, train_loss: 0.4068, test_loss: 0.7805, test_f1: 0.6940
 epoch: 57, train_loss: 0.3965, test_loss: 0.8934, test_f1: 0.6951
 epoch: 58, train_loss: 0.4064, test_loss: 0.8841, test_f1: 0.6857
 epoch: 59, train_loss: 0.3941, test_loss: 0.8334, test_f1: 0.6827
 epoch: 60, train_loss: 0.4061, test_loss: 0.9610, test_f1: 0.6678
 epoch: 61, train_loss: 0.3870, test_loss: 0.8910, test_f1: 0.6697
 epoch: 62, train_loss: 0.4098, test_loss: 0.9615, test_f1: 0.6922
 epoch: 63, train_loss: 0.3802, test_loss: 0.9449, test_f1: 0.6971
 epoch: 64, train_loss: 0.3770, test_loss: 0.9476, test_f1: 0.6929
 epoch: 65, train_loss: 0.3802, test_loss: 0.9348, test_f1: 0.6879
 epoch: 66, train_loss: 0.3684, test_loss: 1.0490, test_f1: 0.6831
 epoch: 67, train_loss: 0.3624, test_loss: 0.9915, test_f1: 0.6825
 epoch: 68, train_loss: 0.3726, test_loss: 1.0287, test_f1: 0.6741
 epoch: 69, train_loss: 0.3442, test_loss: 1.0956, test_f1: 0.6621
 epoch: 70, train_loss: 0.3442, test_loss: 0.9675, test_f1: 0.6871
 epoch: 71, train_loss: 0.3617, test_loss: 1.0168, test_f1: 0.6825
 epoch: 72, train_loss: 0.3493, test_loss: 1.0516, test_f1: 0.6980
 epoch: 73, train_loss: 0.3604, test_loss: 1.0489, test_f1: 0.7000
 epoch: 74, train_loss: 0.3389, test_loss: 1.0276, test_f1: 0.6729
 epoch: 75, train_loss: 0.3354, test_loss: 1.0839, test_f1: 0.6704
 epoch: 76, train_loss: 0.3257, test_loss: 1.1205, test_f1: 0.6862
 epoch: 77, train_loss: 0.3364, test_loss: 1.1002, test_f1: 0.6875
 epoch: 78, train_loss: 0.3148, test_loss: 1.1729, test_f1: 0.6803
 epoch: 79, train_loss: 0.3170, test_loss: 1.0795, test_f1: 0.6886
 epoch: 80, train_loss: 0.3084, test_loss: 1.2192, test_f1: 0.6925
 epoch: 81, train_loss: 0.3094, test_loss: 1.1862, test_f1: 0.6703
 epoch: 82, train_loss: 0.3134, test_loss: 1.2276, test_f1: 0.6771
 epoch: 83, train_loss: 0.3018, test_loss: 1.2472, test_f1: 0.6752
 epoch: 84, train_loss: 0.2793, test_loss: 1.3482, test_f1: 0.6723
 epoch: 85, train_loss: 0.3152, test_loss: 1.2173, test_f1: 0.6858
 epoch: 86, train_loss: 0.3022, test_loss: 1.2663, test_f1: 0.6837
 epoch: 87, train_loss: 0.2828, test_loss: 1.2483, test_f1: 0.6727
 epoch: 88, train_loss: 0.2942, test_loss: 1.2194, test_f1: 0.6793
 epoch: 89, train_loss: 0.2746, test_loss: 1.3432, test_f1: 0.6723
 epoch: 90, train_loss: 0.2924, test_loss: 1.3325, test_f1: 0.6806
 epoch: 91, train_loss: 0.2938, test_loss: 1.3118, test_f1: 0.6752
 epoch: 92, train_loss: 0.2686, test_loss: 1.2302, test_f1: 0.6859
 epoch: 93, train_loss: 0.2856, test_loss: 1.2736, test_f1: 0.6848
 epoch: 94, train_loss: 0.3028, test_loss: 1.3573, test_f1: 0.6739
 epoch: 95, train_loss: 0.2668, test_loss: 1.3234, test_f1: 0.6781
 epoch: 96, train_loss: 0.2929, test_loss: 1.2632, test_f1: 0.6820
 epoch: 97, train_loss: 0.2685, test_loss: 1.2243, test_f1: 0.6782
 epoch: 98, train_loss: 0.2644, test_loss: 1.2279, test_f1: 0.6770
 epoch: 99, train_loss: 0.2667, test_loss: 1.2784, test_f1: 0.6748
##################ITERATION #9 ****************************************
 epoch: 0, train_loss: 1.3594, test_loss: 1.1764, test_f1: 0.3862
 epoch: 1, train_loss: 0.9960, test_loss: 0.9063, test_f1: 0.5058
 epoch: 2, train_loss: 0.9306, test_loss: 0.8668, test_f1: 0.5452
 epoch: 3, train_loss: 0.9197, test_loss: 0.8499, test_f1: 0.5240
 epoch: 4, train_loss: 0.8971, test_loss: 0.8175, test_f1: 0.5928
 epoch: 5, train_loss: 0.8691, test_loss: 0.7974, test_f1: 0.5870
 epoch: 6, train_loss: 0.8758, test_loss: 0.8562, test_f1: 0.5507
 epoch: 7, train_loss: 0.8540, test_loss: 0.8275, test_f1: 0.5949
 epoch: 8, train_loss: 0.8388, test_loss: 0.8337, test_f1: 0.5664
 epoch: 9, train_loss: 0.8160, test_loss: 0.7524, test_f1: 0.6239
 epoch: 10, train_loss: 0.7999, test_loss: 0.7644, test_f1: 0.6072
 epoch: 11, train_loss: 0.7940, test_loss: 0.7414, test_f1: 0.6437
 epoch: 12, train_loss: 0.7744, test_loss: 0.7473, test_f1: 0.6309
 epoch: 13, train_loss: 0.7716, test_loss: 0.7547, test_f1: 0.6173
 epoch: 14, train_loss: 0.7619, test_loss: 0.7392, test_f1: 0.6231
 epoch: 15, train_loss: 0.7471, test_loss: 0.7654, test_f1: 0.6320
 epoch: 16, train_loss: 0.7316, test_loss: 0.7342, test_f1: 0.6317
 epoch: 17, train_loss: 0.7259, test_loss: 0.7401, test_f1: 0.6328
 epoch: 18, train_loss: 0.7196, test_loss: 0.6934, test_f1: 0.6709
 epoch: 19, train_loss: 0.7170, test_loss: 0.6772, test_f1: 0.6789
 epoch: 20, train_loss: 0.6740, test_loss: 0.6983, test_f1: 0.6687
 epoch: 21, train_loss: 0.6715, test_loss: 0.7062, test_f1: 0.6707
 epoch: 22, train_loss: 0.6789, test_loss: 0.7036, test_f1: 0.6899
 epoch: 23, train_loss: 0.6636, test_loss: 0.7317, test_f1: 0.6369
 epoch: 24, train_loss: 0.6441, test_loss: 0.7381, test_f1: 0.6670
 epoch: 25, train_loss: 0.6532, test_loss: 0.6841, test_f1: 0.6670
 epoch: 26, train_loss: 0.6529, test_loss: 0.6937, test_f1: 0.6621
 epoch: 27, train_loss: 0.6366, test_loss: 0.6906, test_f1: 0.6822
 epoch: 28, train_loss: 0.6385, test_loss: 0.8016, test_f1: 0.6349
 epoch: 29, train_loss: 0.6260, test_loss: 0.7747, test_f1: 0.6475
 epoch: 30, train_loss: 0.5939, test_loss: 0.7573, test_f1: 0.6501
 epoch: 31, train_loss: 0.6064, test_loss: 0.7540, test_f1: 0.6620
 epoch: 32, train_loss: 0.5944, test_loss: 0.7653, test_f1: 0.6436
 epoch: 33, train_loss: 0.5955, test_loss: 0.7073, test_f1: 0.6658
 epoch: 34, train_loss: 0.5826, test_loss: 0.7577, test_f1: 0.6493
 epoch: 35, train_loss: 0.5751, test_loss: 0.7440, test_f1: 0.6551
 epoch: 36, train_loss: 0.5641, test_loss: 0.7368, test_f1: 0.7028
 epoch: 37, train_loss: 0.5690, test_loss: 0.7376, test_f1: 0.6590
 epoch: 38, train_loss: 0.5676, test_loss: 0.7999, test_f1: 0.6414
 epoch: 39, train_loss: 0.5824, test_loss: 0.7815, test_f1: 0.6570
 epoch: 40, train_loss: 0.5591, test_loss: 0.7319, test_f1: 0.6897
 epoch: 41, train_loss: 0.5413, test_loss: 0.7746, test_f1: 0.6457
 epoch: 42, train_loss: 0.5303, test_loss: 0.7040, test_f1: 0.6676
 epoch: 43, train_loss: 0.5122, test_loss: 0.7898, test_f1: 0.6686
 epoch: 44, train_loss: 0.5202, test_loss: 0.7490, test_f1: 0.6432
 epoch: 45, train_loss: 0.5166, test_loss: 0.7530, test_f1: 0.6373
 epoch: 46, train_loss: 0.5106, test_loss: 0.8600, test_f1: 0.6790
 epoch: 47, train_loss: 0.5185, test_loss: 0.7971, test_f1: 0.6413
 epoch: 48, train_loss: 0.4981, test_loss: 0.8367, test_f1: 0.6480
 epoch: 49, train_loss: 0.5009, test_loss: 0.7431, test_f1: 0.6631
 epoch: 50, train_loss: 0.5077, test_loss: 0.7454, test_f1: 0.6545
 epoch: 51, train_loss: 0.4385, test_loss: 0.7637, test_f1: 0.6804
 epoch: 52, train_loss: 0.4432, test_loss: 0.8070, test_f1: 0.6567
 epoch: 53, train_loss: 0.4145, test_loss: 0.8507, test_f1: 0.6648
 epoch: 54, train_loss: 0.4239, test_loss: 0.7993, test_f1: 0.6786
 epoch: 55, train_loss: 0.4172, test_loss: 0.7876, test_f1: 0.6802
 epoch: 56, train_loss: 0.4146, test_loss: 0.8481, test_f1: 0.6751
 epoch: 57, train_loss: 0.4178, test_loss: 0.9114, test_f1: 0.6617
 epoch: 58, train_loss: 0.3979, test_loss: 0.8939, test_f1: 0.6647
 epoch: 59, train_loss: 0.4078, test_loss: 0.9182, test_f1: 0.6580
 epoch: 60, train_loss: 0.3974, test_loss: 0.9167, test_f1: 0.6628
 epoch: 61, train_loss: 0.3966, test_loss: 0.8788, test_f1: 0.6548
 epoch: 62, train_loss: 0.4094, test_loss: 0.9920, test_f1: 0.6602
 epoch: 63, train_loss: 0.4000, test_loss: 0.8817, test_f1: 0.6675
 epoch: 64, train_loss: 0.3856, test_loss: 0.9776, test_f1: 0.6632
 epoch: 65, train_loss: 0.3894, test_loss: 0.9568, test_f1: 0.6440
 epoch: 66, train_loss: 0.3792, test_loss: 0.9961, test_f1: 0.6622
 epoch: 67, train_loss: 0.3940, test_loss: 0.9055, test_f1: 0.6706
 epoch: 68, train_loss: 0.3630, test_loss: 0.9926, test_f1: 0.6624
 epoch: 69, train_loss: 0.3624, test_loss: 1.0191, test_f1: 0.6588
 epoch: 70, train_loss: 0.3505, test_loss: 1.0098, test_f1: 0.6636
 epoch: 71, train_loss: 0.3600, test_loss: 1.0434, test_f1: 0.6661
 epoch: 72, train_loss: 0.3569, test_loss: 1.0904, test_f1: 0.6494
 epoch: 73, train_loss: 0.3533, test_loss: 1.1396, test_f1: 0.6634
 epoch: 74, train_loss: 0.3603, test_loss: 1.0131, test_f1: 0.6707
 epoch: 75, train_loss: 0.3335, test_loss: 1.0848, test_f1: 0.6604
 epoch: 76, train_loss: 0.3297, test_loss: 1.1442, test_f1: 0.6501
 epoch: 77, train_loss: 0.3441, test_loss: 1.1232, test_f1: 0.6457
 epoch: 78, train_loss: 0.3454, test_loss: 1.1118, test_f1: 0.6492
 epoch: 79, train_loss: 0.3261, test_loss: 1.1279, test_f1: 0.6592
 epoch: 80, train_loss: 0.3396, test_loss: 1.2046, test_f1: 0.6470
 epoch: 81, train_loss: 0.3142, test_loss: 1.1752, test_f1: 0.6587
 epoch: 82, train_loss: 0.3176, test_loss: 1.1128, test_f1: 0.6551
 epoch: 83, train_loss: 0.3237, test_loss: 1.1536, test_f1: 0.6549
 epoch: 84, train_loss: 0.3176, test_loss: 1.1935, test_f1: 0.6525
 epoch: 85, train_loss: 0.3428, test_loss: 1.1517, test_f1: 0.6649
 epoch: 86, train_loss: 0.3166, test_loss: 1.2058, test_f1: 0.6658
 epoch: 87, train_loss: 0.3100, test_loss: 1.2112, test_f1: 0.6571
 epoch: 88, train_loss: 0.3247, test_loss: 1.2248, test_f1: 0.6496
 epoch: 89, train_loss: 0.2893, test_loss: 1.2665, test_f1: 0.6575
 epoch: 90, train_loss: 0.3081, test_loss: 1.2589, test_f1: 0.6728
 epoch: 91, train_loss: 0.3171, test_loss: 1.1764, test_f1: 0.6680
 epoch: 92, train_loss: 0.2976, test_loss: 1.2477, test_f1: 0.6608
 epoch: 93, train_loss: 0.3092, test_loss: 1.1866, test_f1: 0.6538
 epoch: 94, train_loss: 0.3052, test_loss: 1.2221, test_f1: 0.6635
 epoch: 95, train_loss: 0.3041, test_loss: 1.1635, test_f1: 0.6643
 epoch: 96, train_loss: 0.2746, test_loss: 1.2427, test_f1: 0.6519
 epoch: 97, train_loss: 0.3003, test_loss: 1.3434, test_f1: 0.6566
 epoch: 98, train_loss: 0.2862, test_loss: 1.2886, test_f1: 0.6549
 epoch: 99, train_loss: 0.2928, test_loss: 1.2533, test_f1: 0.6579

Training completed in 1155.75 seconds
Best F1: 0.7469 at epoch 53
Mean F1 across iterations: 0.7064  0.0150
========================FINAL RESULTS================================
FEGIN weighted F1: 0.7469  0.0150
python main.py --data ltspice_examples --representation component_pin_net --model FEGIN --layers 4 --hiddens 64 --batch_size 64 --lr 0.001 --emb_size 128 --epochs 100 --save_appendix component_pin_net_L4_H64_BS64_LR0.001_E128 --no_val
-----



STDERR:
  File "main.py", line 370, in <module>
    main()
  File "main.py", line 254, in main
    dataset = dataset_class(
  File "/home/philip/projects/llm_inference_code_repo/Circuit-Completion-Using-GNNs/component_classification_with_link_prediction_head/evaluation/FEGIN/kernel/circuit_datasets.py", line 15, in __init__
    self.data, self.slices = torch.load(self.processed_paths[0])
  File "/home/philip/.local/lib/python3.8/site-packages/torch/serialization.py", line 1040, in load
    warnings.warn(
  File "/usr/lib/python3.8/warnings.py", line 109, in _showwarnmsg
    sw(msg.message, msg.category, msg.filename, msg.lineno,
  File "main.py", line 47, in warn_with_traceback
    traceback.print_stack(file=log)
/home/philip/projects/llm_inference_code_repo/Circuit-Completion-Using-GNNs/component_classification_with_link_prediction_head/evaluation/FEGIN/kernel/circuit_datasets.py:15: FutureWarning: You are using `torch.load` with `weights_only=False` (the current default value), which uses the default pickle module implicitly. It is possible to construct malicious pickle data which will execute arbitrary code during unpickling (See https://github.com/pytorch/pytorch/blob/main/SECURITY.md#untrusted-models for more details). In a future release, the default value for `weights_only` will be flipped to `True`. This limits the functions that could be executed during unpickling. Arbitrary objects will no longer be allowed to be loaded via this mode unless they are explicitly allowlisted by the user via `torch.serialization.add_safe_globals`. We recommend you start setting `weights_only=True` for any use case where you don't have full control of the loaded file. Please open an issue on GitHub for any issues related to this experimental feature.
  self.data, self.slices = torch.load(self.processed_paths[0])
