STDOUT:
Results will be saved in /home/philip/projects/ltspice_examples_code_repo/Circuit-Completion-Using-GNNs/component_classification_with_link_prediction_head/evaluation/FEGIN/results/model_FEGIN_dataset_ltspice_demos
Command line input: python main.py --data ltspice_demos --representation component_pin --model FEGIN --layers 6 --hiddens 64 --batch_size 128 --lr 0.0001 --emb_size 250 --epochs 100 --save_appendix component_pin_L6_H64_BS128_LR0.0001_E250 --no_val
 is saved.
-----
ltspice_demos - FEGIN
Using 6 layers, 64 hidden units, h = 2
Loading component_pin representation dataset
ENTERED
Training FEGIN on component_pin representation
Train: 1565, Test: 383
##################ITERATION #0 ****************************************
 epoch: 0, train_loss: 1.3906, test_loss: 1.3906, test_f1: 0.1365
 epoch: 1, train_loss: 1.3842, test_loss: 1.3876, test_f1: 0.1365
 epoch: 2, train_loss: 1.3798, test_loss: 1.3846, test_f1: 0.1365
 epoch: 3, train_loss: 1.3754, test_loss: 1.3818, test_f1: 0.1365
 epoch: 4, train_loss: 1.3699, test_loss: 1.3782, test_f1: 0.1365
 epoch: 5, train_loss: 1.3638, test_loss: 1.3735, test_f1: 0.1682
 epoch: 6, train_loss: 1.3569, test_loss: 1.3677, test_f1: 0.3030
 epoch: 7, train_loss: 1.3491, test_loss: 1.3606, test_f1: 0.3307
 epoch: 8, train_loss: 1.3390, test_loss: 1.3527, test_f1: 0.3251
 epoch: 9, train_loss: 1.3263, test_loss: 1.3431, test_f1: 0.3371
 epoch: 10, train_loss: 1.3118, test_loss: 1.3324, test_f1: 0.3341
 epoch: 11, train_loss: 1.2951, test_loss: 1.3207, test_f1: 0.3343
 epoch: 12, train_loss: 1.2752, test_loss: 1.3074, test_f1: 0.3362
 epoch: 13, train_loss: 1.2589, test_loss: 1.2955, test_f1: 0.3361
 epoch: 14, train_loss: 1.2402, test_loss: 1.2847, test_f1: 0.3360
 epoch: 15, train_loss: 1.2222, test_loss: 1.2734, test_f1: 0.3360
 epoch: 16, train_loss: 1.2040, test_loss: 1.2624, test_f1: 0.3303
 epoch: 17, train_loss: 1.1902, test_loss: 1.2533, test_f1: 0.3341
 epoch: 18, train_loss: 1.1859, test_loss: 1.2475, test_f1: 0.3340
 epoch: 19, train_loss: 1.1710, test_loss: 1.2394, test_f1: 0.3342
 epoch: 20, train_loss: 1.1659, test_loss: 1.2339, test_f1: 0.3340
 epoch: 21, train_loss: 1.1578, test_loss: 1.2382, test_f1: 0.3339
 epoch: 22, train_loss: 1.1523, test_loss: 1.2247, test_f1: 0.3340
 epoch: 23, train_loss: 1.1446, test_loss: 1.2259, test_f1: 0.3395
 epoch: 24, train_loss: 1.1361, test_loss: 1.2191, test_f1: 0.3867
 epoch: 25, train_loss: 1.1299, test_loss: 1.2173, test_f1: 0.3784
 epoch: 26, train_loss: 1.1239, test_loss: 1.2112, test_f1: 0.4056
 epoch: 27, train_loss: 1.1211, test_loss: 1.2061, test_f1: 0.4056
 epoch: 28, train_loss: 1.1144, test_loss: 1.1976, test_f1: 0.4191
 epoch: 29, train_loss: 1.1115, test_loss: 1.1910, test_f1: 0.4347
 epoch: 30, train_loss: 1.1036, test_loss: 1.1878, test_f1: 0.4319
 epoch: 31, train_loss: 1.0976, test_loss: 1.1852, test_f1: 0.4393
 epoch: 32, train_loss: 1.0914, test_loss: 1.1814, test_f1: 0.4285
 epoch: 33, train_loss: 1.0878, test_loss: 1.1786, test_f1: 0.4477
 epoch: 34, train_loss: 1.0772, test_loss: 1.1697, test_f1: 0.4420
 epoch: 35, train_loss: 1.0778, test_loss: 1.1851, test_f1: 0.4336
 epoch: 36, train_loss: 1.0669, test_loss: 1.1593, test_f1: 0.4477
 epoch: 37, train_loss: 1.0577, test_loss: 1.1373, test_f1: 0.4450
 epoch: 38, train_loss: 1.0472, test_loss: 1.1470, test_f1: 0.4449
 epoch: 39, train_loss: 1.0397, test_loss: 1.1344, test_f1: 0.4460
 epoch: 40, train_loss: 1.0385, test_loss: 1.1423, test_f1: 0.4462
 epoch: 41, train_loss: 1.0239, test_loss: 1.1156, test_f1: 0.4397
 epoch: 42, train_loss: 1.0207, test_loss: 1.1216, test_f1: 0.4438
 epoch: 43, train_loss: 1.0077, test_loss: 1.1158, test_f1: 0.4403
 epoch: 44, train_loss: 1.0084, test_loss: 1.1031, test_f1: 0.4408
 epoch: 45, train_loss: 0.9924, test_loss: 1.1086, test_f1: 0.4423
 epoch: 46, train_loss: 0.9901, test_loss: 1.1320, test_f1: 0.4271
 epoch: 47, train_loss: 0.9829, test_loss: 1.1055, test_f1: 0.4509
 epoch: 48, train_loss: 0.9695, test_loss: 1.0868, test_f1: 0.4477
 epoch: 49, train_loss: 0.9511, test_loss: 1.0700, test_f1: 0.4441
 epoch: 50, train_loss: 0.9452, test_loss: 1.0851, test_f1: 0.4385
 epoch: 51, train_loss: 0.9370, test_loss: 1.0642, test_f1: 0.4457
 epoch: 52, train_loss: 0.9285, test_loss: 1.0614, test_f1: 0.4463
 epoch: 53, train_loss: 0.9263, test_loss: 1.0703, test_f1: 0.4401
 epoch: 54, train_loss: 0.9175, test_loss: 1.0527, test_f1: 0.4445
 epoch: 55, train_loss: 0.9103, test_loss: 1.0575, test_f1: 0.4424
 epoch: 56, train_loss: 0.9063, test_loss: 1.0659, test_f1: 0.4414
 epoch: 57, train_loss: 0.9127, test_loss: 1.0492, test_f1: 0.4449
 epoch: 58, train_loss: 0.8967, test_loss: 1.0555, test_f1: 0.4573
 epoch: 59, train_loss: 0.8972, test_loss: 1.0544, test_f1: 0.4454
 epoch: 60, train_loss: 0.9002, test_loss: 1.0724, test_f1: 0.4442
 epoch: 61, train_loss: 0.8996, test_loss: 1.0487, test_f1: 0.4463
 epoch: 62, train_loss: 0.8909, test_loss: 1.0405, test_f1: 0.4468
 epoch: 63, train_loss: 0.8904, test_loss: 1.0530, test_f1: 0.4564
 epoch: 64, train_loss: 0.8769, test_loss: 1.0460, test_f1: 0.4603
 epoch: 65, train_loss: 0.8778, test_loss: 1.0430, test_f1: 0.4636
 epoch: 66, train_loss: 0.8900, test_loss: 1.0570, test_f1: 0.4716
 epoch: 67, train_loss: 0.8684, test_loss: 1.0319, test_f1: 0.4661
 epoch: 68, train_loss: 0.8718, test_loss: 1.0422, test_f1: 0.4618
 epoch: 69, train_loss: 0.8649, test_loss: 1.0380, test_f1: 0.4668
 epoch: 70, train_loss: 0.8598, test_loss: 1.0257, test_f1: 0.5050
 epoch: 71, train_loss: 0.8594, test_loss: 1.0490, test_f1: 0.4782
 epoch: 72, train_loss: 0.8653, test_loss: 1.0336, test_f1: 0.5003
 epoch: 73, train_loss: 0.8541, test_loss: 1.0342, test_f1: 0.4929
 epoch: 74, train_loss: 0.8505, test_loss: 1.0377, test_f1: 0.5092
 epoch: 75, train_loss: 0.8545, test_loss: 1.0269, test_f1: 0.5215
 epoch: 76, train_loss: 0.8563, test_loss: 1.0408, test_f1: 0.5247
 epoch: 77, train_loss: 0.8425, test_loss: 1.0314, test_f1: 0.5319
 epoch: 78, train_loss: 0.8458, test_loss: 1.0333, test_f1: 0.5085
 epoch: 79, train_loss: 0.8401, test_loss: 1.0413, test_f1: 0.5237
 epoch: 80, train_loss: 0.8340, test_loss: 1.0383, test_f1: 0.5312
 epoch: 81, train_loss: 0.8373, test_loss: 1.0412, test_f1: 0.5290
 epoch: 82, train_loss: 0.8308, test_loss: 1.0313, test_f1: 0.5362
 epoch: 83, train_loss: 0.8279, test_loss: 1.0383, test_f1: 0.5391
 epoch: 84, train_loss: 0.8306, test_loss: 1.0474, test_f1: 0.5376
 epoch: 85, train_loss: 0.8207, test_loss: 1.0270, test_f1: 0.5459
 epoch: 86, train_loss: 0.8291, test_loss: 1.0290, test_f1: 0.5536
 epoch: 87, train_loss: 0.8137, test_loss: 1.0332, test_f1: 0.5554
 epoch: 88, train_loss: 0.8103, test_loss: 1.0456, test_f1: 0.5472
 epoch: 89, train_loss: 0.8085, test_loss: 1.0329, test_f1: 0.5433
 epoch: 90, train_loss: 0.8058, test_loss: 1.0251, test_f1: 0.5596
 epoch: 91, train_loss: 0.8055, test_loss: 1.0427, test_f1: 0.5569
 epoch: 92, train_loss: 0.7995, test_loss: 1.0260, test_f1: 0.5469
 epoch: 93, train_loss: 0.7948, test_loss: 1.0369, test_f1: 0.5302
 epoch: 94, train_loss: 0.8019, test_loss: 1.0354, test_f1: 0.5356
 epoch: 95, train_loss: 0.7942, test_loss: 1.0358, test_f1: 0.5524
 epoch: 96, train_loss: 0.7964, test_loss: 1.0187, test_f1: 0.5558
 epoch: 97, train_loss: 0.8063, test_loss: 1.0367, test_f1: 0.5576
 epoch: 98, train_loss: 0.7921, test_loss: 1.0316, test_f1: 0.5633
 epoch: 99, train_loss: 0.7875, test_loss: 1.0160, test_f1: 0.5476
##################ITERATION #1 ****************************************
 epoch: 0, train_loss: 1.3587, test_loss: 1.3697, test_f1: 0.1365
 epoch: 1, train_loss: 1.3384, test_loss: 1.3607, test_f1: 0.1365
 epoch: 2, train_loss: 1.3243, test_loss: 1.3493, test_f1: 0.1365
 epoch: 3, train_loss: 1.3057, test_loss: 1.3363, test_f1: 0.3053
 epoch: 4, train_loss: 1.2906, test_loss: 1.3237, test_f1: 0.3284
 epoch: 5, train_loss: 1.2706, test_loss: 1.3102, test_f1: 0.3357
 epoch: 6, train_loss: 1.2531, test_loss: 1.2991, test_f1: 0.3467
 epoch: 7, train_loss: 1.2350, test_loss: 1.2867, test_f1: 0.3512
 epoch: 8, train_loss: 1.2174, test_loss: 1.2760, test_f1: 0.3512
 epoch: 9, train_loss: 1.2020, test_loss: 1.2650, test_f1: 0.3512
 epoch: 10, train_loss: 1.1923, test_loss: 1.2578, test_f1: 0.3512
 epoch: 11, train_loss: 1.1828, test_loss: 1.2500, test_f1: 0.3533
 epoch: 12, train_loss: 1.1692, test_loss: 1.2414, test_f1: 0.3533
 epoch: 13, train_loss: 1.1637, test_loss: 1.2360, test_f1: 0.3749
 epoch: 14, train_loss: 1.1548, test_loss: 1.2276, test_f1: 0.4103
 epoch: 15, train_loss: 1.1501, test_loss: 1.2244, test_f1: 0.4200
 epoch: 16, train_loss: 1.1378, test_loss: 1.2150, test_f1: 0.4547
 epoch: 17, train_loss: 1.1275, test_loss: 1.2075, test_f1: 0.4516
 epoch: 18, train_loss: 1.1175, test_loss: 1.1988, test_f1: 0.4581
 epoch: 19, train_loss: 1.1154, test_loss: 1.1862, test_f1: 0.4615
 epoch: 20, train_loss: 1.1072, test_loss: 1.1832, test_f1: 0.4608
 epoch: 21, train_loss: 1.0924, test_loss: 1.1838, test_f1: 0.4571
 epoch: 22, train_loss: 1.0834, test_loss: 1.1644, test_f1: 0.4582
 epoch: 23, train_loss: 1.0767, test_loss: 1.1650, test_f1: 0.4552
 epoch: 24, train_loss: 1.0701, test_loss: 1.1510, test_f1: 0.4602
 epoch: 25, train_loss: 1.0538, test_loss: 1.1405, test_f1: 0.4592
 epoch: 26, train_loss: 1.0440, test_loss: 1.1366, test_f1: 0.4573
 epoch: 27, train_loss: 1.0384, test_loss: 1.1306, test_f1: 0.4562
 epoch: 28, train_loss: 1.0316, test_loss: 1.1187, test_f1: 0.4579
 epoch: 29, train_loss: 1.0215, test_loss: 1.1098, test_f1: 0.4623
 epoch: 30, train_loss: 1.0059, test_loss: 1.0969, test_f1: 0.4588
 epoch: 31, train_loss: 0.9951, test_loss: 1.0945, test_f1: 0.4610
 epoch: 32, train_loss: 0.9972, test_loss: 1.0826, test_f1: 0.4598
 epoch: 33, train_loss: 0.9807, test_loss: 1.0902, test_f1: 0.4605
 epoch: 34, train_loss: 0.9681, test_loss: 1.0777, test_f1: 0.4551
 epoch: 35, train_loss: 0.9701, test_loss: 1.0671, test_f1: 0.4642
 epoch: 36, train_loss: 0.9598, test_loss: 1.0691, test_f1: 0.4611
 epoch: 37, train_loss: 0.9446, test_loss: 1.0696, test_f1: 0.4469
 epoch: 38, train_loss: 0.9414, test_loss: 1.0719, test_f1: 0.4580
 epoch: 39, train_loss: 0.9406, test_loss: 1.0599, test_f1: 0.4567
 epoch: 40, train_loss: 0.9325, test_loss: 1.0559, test_f1: 0.4684
 epoch: 41, train_loss: 0.9213, test_loss: 1.0596, test_f1: 0.4589
 epoch: 42, train_loss: 0.9159, test_loss: 1.0492, test_f1: 0.4853
 epoch: 43, train_loss: 0.9117, test_loss: 1.0736, test_f1: 0.4786
 epoch: 44, train_loss: 0.9006, test_loss: 1.0371, test_f1: 0.4756
 epoch: 45, train_loss: 0.8950, test_loss: 1.0465, test_f1: 0.4977
 epoch: 46, train_loss: 0.8965, test_loss: 1.0563, test_f1: 0.5070
 epoch: 47, train_loss: 0.8818, test_loss: 1.0781, test_f1: 0.4955
 epoch: 48, train_loss: 0.8796, test_loss: 1.0603, test_f1: 0.5127
 epoch: 49, train_loss: 0.8958, test_loss: 1.0585, test_f1: 0.5114
 epoch: 50, train_loss: 0.8769, test_loss: 1.0697, test_f1: 0.5054
 epoch: 51, train_loss: 0.8655, test_loss: 1.0658, test_f1: 0.5179
 epoch: 52, train_loss: 0.8625, test_loss: 1.0493, test_f1: 0.5412
 epoch: 53, train_loss: 0.8635, test_loss: 1.0671, test_f1: 0.5238
 epoch: 54, train_loss: 0.8505, test_loss: 1.0634, test_f1: 0.5376
 epoch: 55, train_loss: 0.8471, test_loss: 1.0662, test_f1: 0.5294
 epoch: 56, train_loss: 0.8495, test_loss: 1.0563, test_f1: 0.5425
 epoch: 57, train_loss: 0.8469, test_loss: 1.0416, test_f1: 0.5553
 epoch: 58, train_loss: 0.8449, test_loss: 1.0524, test_f1: 0.5595
 epoch: 59, train_loss: 0.8431, test_loss: 1.0833, test_f1: 0.5156
 epoch: 60, train_loss: 0.8502, test_loss: 1.0606, test_f1: 0.5541
 epoch: 61, train_loss: 0.8326, test_loss: 1.0601, test_f1: 0.5550
 epoch: 62, train_loss: 0.8256, test_loss: 1.0804, test_f1: 0.5336
 epoch: 63, train_loss: 0.8322, test_loss: 1.0706, test_f1: 0.5326
 epoch: 64, train_loss: 0.8275, test_loss: 1.0742, test_f1: 0.5233
 epoch: 65, train_loss: 0.8384, test_loss: 1.0657, test_f1: 0.5634
 epoch: 66, train_loss: 0.8186, test_loss: 1.0730, test_f1: 0.5360
 epoch: 67, train_loss: 0.8240, test_loss: 1.0690, test_f1: 0.5453
 epoch: 68, train_loss: 0.8137, test_loss: 1.0717, test_f1: 0.5373
 epoch: 69, train_loss: 0.8212, test_loss: 1.0940, test_f1: 0.5348
 epoch: 70, train_loss: 0.8117, test_loss: 1.0671, test_f1: 0.5535
 epoch: 71, train_loss: 0.8161, test_loss: 1.0684, test_f1: 0.5670
 epoch: 72, train_loss: 0.8121, test_loss: 1.0629, test_f1: 0.5549
 epoch: 73, train_loss: 0.8130, test_loss: 1.0832, test_f1: 0.5453
 epoch: 74, train_loss: 0.8041, test_loss: 1.0878, test_f1: 0.5407
 epoch: 75, train_loss: 0.8047, test_loss: 1.0773, test_f1: 0.5435
 epoch: 76, train_loss: 0.8000, test_loss: 1.0704, test_f1: 0.5453
 epoch: 77, train_loss: 0.7977, test_loss: 1.0925, test_f1: 0.5469
 epoch: 78, train_loss: 0.7998, test_loss: 1.0727, test_f1: 0.5366
 epoch: 79, train_loss: 0.7971, test_loss: 1.0638, test_f1: 0.5845
 epoch: 80, train_loss: 0.7879, test_loss: 1.0678, test_f1: 0.5668
 epoch: 81, train_loss: 0.7944, test_loss: 1.0802, test_f1: 0.5471
 epoch: 82, train_loss: 0.7895, test_loss: 1.0800, test_f1: 0.5447
 epoch: 83, train_loss: 0.7866, test_loss: 1.0978, test_f1: 0.5575
 epoch: 84, train_loss: 0.7858, test_loss: 1.0834, test_f1: 0.5474
 epoch: 85, train_loss: 0.7836, test_loss: 1.0718, test_f1: 0.5640
 epoch: 86, train_loss: 0.7770, test_loss: 1.0901, test_f1: 0.5528
 epoch: 87, train_loss: 0.7667, test_loss: 1.0743, test_f1: 0.5767
 epoch: 88, train_loss: 0.7712, test_loss: 1.0694, test_f1: 0.5774
 epoch: 89, train_loss: 0.7753, test_loss: 1.0974, test_f1: 0.5528
 epoch: 90, train_loss: 0.7708, test_loss: 1.0808, test_f1: 0.5558
 epoch: 91, train_loss: 0.7799, test_loss: 1.0401, test_f1: 0.5774
 epoch: 92, train_loss: 0.7710, test_loss: 1.0498, test_f1: 0.5718
 epoch: 93, train_loss: 0.7780, test_loss: 1.0551, test_f1: 0.5760
 epoch: 94, train_loss: 0.7636, test_loss: 1.0725, test_f1: 0.5766
 epoch: 95, train_loss: 0.7686, test_loss: 1.0708, test_f1: 0.5668
 epoch: 96, train_loss: 0.7660, test_loss: 1.1182, test_f1: 0.5606
 epoch: 97, train_loss: 0.7601, test_loss: 1.0838, test_f1: 0.5742
 epoch: 98, train_loss: 0.7531, test_loss: 1.0879, test_f1: 0.5659
 epoch: 99, train_loss: 0.7529, test_loss: 1.1005, test_f1: 0.5759
##################ITERATION #2 ****************************************
 epoch: 0, train_loss: 1.3432, test_loss: 1.3622, test_f1: 0.1365
 epoch: 1, train_loss: 1.3111, test_loss: 1.3531, test_f1: 0.1365
 epoch: 2, train_loss: 1.2929, test_loss: 1.3447, test_f1: 0.1365
 epoch: 3, train_loss: 1.2754, test_loss: 1.3336, test_f1: 0.1365
 epoch: 4, train_loss: 1.2571, test_loss: 1.3165, test_f1: 0.1365
 epoch: 5, train_loss: 1.2425, test_loss: 1.2985, test_f1: 0.1573
 epoch: 6, train_loss: 1.2218, test_loss: 1.2809, test_f1: 0.1732
 epoch: 7, train_loss: 1.2079, test_loss: 1.2647, test_f1: 0.2379
 epoch: 8, train_loss: 1.1889, test_loss: 1.2465, test_f1: 0.2923
 epoch: 9, train_loss: 1.1756, test_loss: 1.2341, test_f1: 0.4308
 epoch: 10, train_loss: 1.1612, test_loss: 1.2218, test_f1: 0.4563
 epoch: 11, train_loss: 1.1443, test_loss: 1.2084, test_f1: 0.4441
 epoch: 12, train_loss: 1.1276, test_loss: 1.1980, test_f1: 0.3859
 epoch: 13, train_loss: 1.1193, test_loss: 1.1763, test_f1: 0.3935
 epoch: 14, train_loss: 1.0953, test_loss: 1.1621, test_f1: 0.3904
 epoch: 15, train_loss: 1.0827, test_loss: 1.1497, test_f1: 0.4077
 epoch: 16, train_loss: 1.0693, test_loss: 1.1360, test_f1: 0.4078
 epoch: 17, train_loss: 1.0583, test_loss: 1.1284, test_f1: 0.3998
 epoch: 18, train_loss: 1.0440, test_loss: 1.1107, test_f1: 0.3958
 epoch: 19, train_loss: 1.0329, test_loss: 1.0968, test_f1: 0.4164
 epoch: 20, train_loss: 1.0251, test_loss: 1.0970, test_f1: 0.3834
 epoch: 21, train_loss: 1.0175, test_loss: 1.0878, test_f1: 0.3984
 epoch: 22, train_loss: 0.9974, test_loss: 1.0815, test_f1: 0.4016
 epoch: 23, train_loss: 0.9948, test_loss: 1.0947, test_f1: 0.3953
 epoch: 24, train_loss: 0.9802, test_loss: 1.0858, test_f1: 0.3898
 epoch: 25, train_loss: 0.9744, test_loss: 1.0683, test_f1: 0.4107
 epoch: 26, train_loss: 0.9656, test_loss: 1.0435, test_f1: 0.3941
 epoch: 27, train_loss: 0.9554, test_loss: 1.0390, test_f1: 0.3861
 epoch: 28, train_loss: 0.9487, test_loss: 1.0459, test_f1: 0.4110
 epoch: 29, train_loss: 0.9382, test_loss: 1.0298, test_f1: 0.4376
 epoch: 30, train_loss: 0.9312, test_loss: 1.0338, test_f1: 0.4410
 epoch: 31, train_loss: 0.9274, test_loss: 1.0578, test_f1: 0.4212
 epoch: 32, train_loss: 0.9158, test_loss: 1.0497, test_f1: 0.4580
 epoch: 33, train_loss: 0.9128, test_loss: 1.0301, test_f1: 0.4571
 epoch: 34, train_loss: 0.9025, test_loss: 1.0576, test_f1: 0.4726
 epoch: 35, train_loss: 0.8932, test_loss: 1.0488, test_f1: 0.4816
 epoch: 36, train_loss: 0.9005, test_loss: 1.0699, test_f1: 0.4670
 epoch: 37, train_loss: 0.8881, test_loss: 1.0218, test_f1: 0.4961
 epoch: 38, train_loss: 0.8753, test_loss: 1.0038, test_f1: 0.5018
 epoch: 39, train_loss: 0.8709, test_loss: 0.9868, test_f1: 0.5043
 epoch: 40, train_loss: 0.8603, test_loss: 1.0158, test_f1: 0.5270
 epoch: 41, train_loss: 0.8512, test_loss: 0.9687, test_f1: 0.5295
 epoch: 42, train_loss: 0.8528, test_loss: 0.9849, test_f1: 0.5440
 epoch: 43, train_loss: 0.8368, test_loss: 0.9807, test_f1: 0.5430
 epoch: 44, train_loss: 0.8325, test_loss: 0.9669, test_f1: 0.5660
 epoch: 45, train_loss: 0.8302, test_loss: 0.9863, test_f1: 0.5643
 epoch: 46, train_loss: 0.8255, test_loss: 0.9704, test_f1: 0.5613
 epoch: 47, train_loss: 0.8079, test_loss: 0.9796, test_f1: 0.5555
 epoch: 48, train_loss: 0.7984, test_loss: 0.9697, test_f1: 0.5655
 epoch: 49, train_loss: 0.8022, test_loss: 0.9620, test_f1: 0.5685
 epoch: 50, train_loss: 0.7929, test_loss: 0.9708, test_f1: 0.5703
 epoch: 51, train_loss: 0.7878, test_loss: 0.9464, test_f1: 0.5664
 epoch: 52, train_loss: 0.7823, test_loss: 0.9460, test_f1: 0.5823
 epoch: 53, train_loss: 0.7838, test_loss: 0.9649, test_f1: 0.5718
 epoch: 54, train_loss: 0.7722, test_loss: 0.9590, test_f1: 0.5618
 epoch: 55, train_loss: 0.7756, test_loss: 0.9540, test_f1: 0.5738
 epoch: 56, train_loss: 0.7575, test_loss: 0.9616, test_f1: 0.5747
 epoch: 57, train_loss: 0.7620, test_loss: 0.9563, test_f1: 0.5723
 epoch: 58, train_loss: 0.7668, test_loss: 0.9640, test_f1: 0.5778
 epoch: 59, train_loss: 0.7690, test_loss: 0.9697, test_f1: 0.5665
 epoch: 60, train_loss: 0.7589, test_loss: 0.9556, test_f1: 0.5790
 epoch: 61, train_loss: 0.7542, test_loss: 0.9474, test_f1: 0.5845
 epoch: 62, train_loss: 0.7577, test_loss: 0.9548, test_f1: 0.5794
 epoch: 63, train_loss: 0.7558, test_loss: 0.9464, test_f1: 0.5721
 epoch: 64, train_loss: 0.7482, test_loss: 0.9469, test_f1: 0.5846
 epoch: 65, train_loss: 0.7450, test_loss: 0.9390, test_f1: 0.5697
 epoch: 66, train_loss: 0.7484, test_loss: 0.9455, test_f1: 0.5823
 epoch: 67, train_loss: 0.7548, test_loss: 0.9468, test_f1: 0.5746
 epoch: 68, train_loss: 0.7454, test_loss: 0.9470, test_f1: 0.5916
 epoch: 69, train_loss: 0.7361, test_loss: 0.9577, test_f1: 0.5779
 epoch: 70, train_loss: 0.7347, test_loss: 0.9813, test_f1: 0.5701
 epoch: 71, train_loss: 0.7364, test_loss: 0.9523, test_f1: 0.5770
 epoch: 72, train_loss: 0.7367, test_loss: 0.9630, test_f1: 0.5745
 epoch: 73, train_loss: 0.7436, test_loss: 0.9656, test_f1: 0.5578
 epoch: 74, train_loss: 0.7350, test_loss: 0.9539, test_f1: 0.5710
 epoch: 75, train_loss: 0.7320, test_loss: 0.9649, test_f1: 0.5794
 epoch: 76, train_loss: 0.7176, test_loss: 0.9585, test_f1: 0.5655
 epoch: 77, train_loss: 0.7212, test_loss: 0.9605, test_f1: 0.5622
 epoch: 78, train_loss: 0.7210, test_loss: 0.9600, test_f1: 0.5623
 epoch: 79, train_loss: 0.7309, test_loss: 0.9590, test_f1: 0.5813
 epoch: 80, train_loss: 0.7087, test_loss: 0.9528, test_f1: 0.5920
 epoch: 81, train_loss: 0.7130, test_loss: 0.9479, test_f1: 0.5906
 epoch: 82, train_loss: 0.7143, test_loss: 0.9609, test_f1: 0.5762
 epoch: 83, train_loss: 0.7107, test_loss: 0.9727, test_f1: 0.5663
 epoch: 84, train_loss: 0.7028, test_loss: 0.9885, test_f1: 0.5580
 epoch: 85, train_loss: 0.7083, test_loss: 0.9867, test_f1: 0.5709
 epoch: 86, train_loss: 0.7089, test_loss: 0.9683, test_f1: 0.5762
 epoch: 87, train_loss: 0.6976, test_loss: 0.9663, test_f1: 0.5724
 epoch: 88, train_loss: 0.6987, test_loss: 0.9650, test_f1: 0.5710
 epoch: 89, train_loss: 0.7015, test_loss: 0.9874, test_f1: 0.5612
 epoch: 90, train_loss: 0.7005, test_loss: 0.9787, test_f1: 0.5724
 epoch: 91, train_loss: 0.7010, test_loss: 0.9678, test_f1: 0.5860
 epoch: 92, train_loss: 0.7000, test_loss: 0.9689, test_f1: 0.5760
 epoch: 93, train_loss: 0.6935, test_loss: 0.9643, test_f1: 0.5785
 epoch: 94, train_loss: 0.6843, test_loss: 0.9578, test_f1: 0.5794
 epoch: 95, train_loss: 0.6914, test_loss: 0.9610, test_f1: 0.5758
 epoch: 96, train_loss: 0.6797, test_loss: 0.9759, test_f1: 0.5695
 epoch: 97, train_loss: 0.6901, test_loss: 0.9746, test_f1: 0.5695
 epoch: 98, train_loss: 0.6833, test_loss: 1.0018, test_f1: 0.5675
 epoch: 99, train_loss: 0.6848, test_loss: 1.0179, test_f1: 0.5700
##################ITERATION #3 ****************************************
 epoch: 0, train_loss: 1.3003, test_loss: 1.3193, test_f1: 0.1527
 epoch: 1, train_loss: 1.2573, test_loss: 1.3073, test_f1: 0.1365
 epoch: 2, train_loss: 1.2395, test_loss: 1.3052, test_f1: 0.1836
 epoch: 3, train_loss: 1.2219, test_loss: 1.2930, test_f1: 0.1881
 epoch: 4, train_loss: 1.2038, test_loss: 1.2685, test_f1: 0.2409
 epoch: 5, train_loss: 1.1902, test_loss: 1.2517, test_f1: 0.3666
 epoch: 6, train_loss: 1.1752, test_loss: 1.2429, test_f1: 0.4308
 epoch: 7, train_loss: 1.1629, test_loss: 1.2273, test_f1: 0.4124
 epoch: 8, train_loss: 1.1493, test_loss: 1.2110, test_f1: 0.4299
 epoch: 9, train_loss: 1.1331, test_loss: 1.1960, test_f1: 0.4183
 epoch: 10, train_loss: 1.1184, test_loss: 1.1809, test_f1: 0.3886
 epoch: 11, train_loss: 1.1060, test_loss: 1.1688, test_f1: 0.3680
 epoch: 12, train_loss: 1.0923, test_loss: 1.1616, test_f1: 0.4001
 epoch: 13, train_loss: 1.0796, test_loss: 1.1556, test_f1: 0.3487
 epoch: 14, train_loss: 1.0708, test_loss: 1.1368, test_f1: 0.3705
 epoch: 15, train_loss: 1.0548, test_loss: 1.1297, test_f1: 0.3817
 epoch: 16, train_loss: 1.0469, test_loss: 1.1268, test_f1: 0.3633
 epoch: 17, train_loss: 1.0293, test_loss: 1.1154, test_f1: 0.4016
 epoch: 18, train_loss: 1.0236, test_loss: 1.1120, test_f1: 0.3988
 epoch: 19, train_loss: 1.0191, test_loss: 1.1091, test_f1: 0.3858
 epoch: 20, train_loss: 1.0059, test_loss: 1.0915, test_f1: 0.3993
 epoch: 21, train_loss: 0.9976, test_loss: 1.0804, test_f1: 0.4351
 epoch: 22, train_loss: 0.9816, test_loss: 1.0762, test_f1: 0.4499
 epoch: 23, train_loss: 0.9675, test_loss: 1.0680, test_f1: 0.4562
 epoch: 24, train_loss: 0.9697, test_loss: 1.0666, test_f1: 0.4262
 epoch: 25, train_loss: 0.9589, test_loss: 1.0582, test_f1: 0.4708
 epoch: 26, train_loss: 0.9539, test_loss: 1.0571, test_f1: 0.4404
 epoch: 27, train_loss: 0.9382, test_loss: 1.0439, test_f1: 0.4573
 epoch: 28, train_loss: 0.9245, test_loss: 1.0409, test_f1: 0.4669
 epoch: 29, train_loss: 0.9233, test_loss: 1.0327, test_f1: 0.5016
 epoch: 30, train_loss: 0.9201, test_loss: 1.0209, test_f1: 0.5033
 epoch: 31, train_loss: 0.9090, test_loss: 1.0038, test_f1: 0.5202
 epoch: 32, train_loss: 0.8979, test_loss: 1.0263, test_f1: 0.4940
 epoch: 33, train_loss: 0.8973, test_loss: 1.0146, test_f1: 0.5035
 epoch: 34, train_loss: 0.8808, test_loss: 1.0170, test_f1: 0.5147
 epoch: 35, train_loss: 0.8791, test_loss: 0.9964, test_f1: 0.5288
 epoch: 36, train_loss: 0.8672, test_loss: 1.0077, test_f1: 0.5233
 epoch: 37, train_loss: 0.8636, test_loss: 0.9929, test_f1: 0.5351
 epoch: 38, train_loss: 0.8523, test_loss: 0.9804, test_f1: 0.5535
 epoch: 39, train_loss: 0.8423, test_loss: 0.9933, test_f1: 0.5376
 epoch: 40, train_loss: 0.8340, test_loss: 0.9871, test_f1: 0.5311
 epoch: 41, train_loss: 0.8350, test_loss: 0.9874, test_f1: 0.5638
 epoch: 42, train_loss: 0.8242, test_loss: 1.0131, test_f1: 0.5647
 epoch: 43, train_loss: 0.8196, test_loss: 0.9897, test_f1: 0.5643
 epoch: 44, train_loss: 0.8132, test_loss: 0.9698, test_f1: 0.5590
 epoch: 45, train_loss: 0.8106, test_loss: 0.9706, test_f1: 0.5633
 epoch: 46, train_loss: 0.7997, test_loss: 0.9865, test_f1: 0.5630
 epoch: 47, train_loss: 0.7981, test_loss: 0.9753, test_f1: 0.5510
 epoch: 48, train_loss: 0.7868, test_loss: 0.9868, test_f1: 0.5444
 epoch: 49, train_loss: 0.7940, test_loss: 0.9800, test_f1: 0.5611
 epoch: 50, train_loss: 0.7831, test_loss: 0.9709, test_f1: 0.5739
 epoch: 51, train_loss: 0.7746, test_loss: 0.9805, test_f1: 0.5842
 epoch: 52, train_loss: 0.7810, test_loss: 0.9694, test_f1: 0.5804
 epoch: 53, train_loss: 0.7733, test_loss: 0.9796, test_f1: 0.5682
 epoch: 54, train_loss: 0.7647, test_loss: 0.9846, test_f1: 0.5633
 epoch: 55, train_loss: 0.7562, test_loss: 0.9736, test_f1: 0.5609
 epoch: 56, train_loss: 0.7539, test_loss: 0.9645, test_f1: 0.5595
 epoch: 57, train_loss: 0.7592, test_loss: 0.9670, test_f1: 0.5649
 epoch: 58, train_loss: 0.7580, test_loss: 0.9711, test_f1: 0.5790
 epoch: 59, train_loss: 0.7533, test_loss: 0.9706, test_f1: 0.5778
 epoch: 60, train_loss: 0.7479, test_loss: 0.9921, test_f1: 0.5620
 epoch: 61, train_loss: 0.7404, test_loss: 0.9887, test_f1: 0.5736
 epoch: 62, train_loss: 0.7434, test_loss: 0.9802, test_f1: 0.5594
 epoch: 63, train_loss: 0.7394, test_loss: 0.9874, test_f1: 0.5515
 epoch: 64, train_loss: 0.7510, test_loss: 1.0002, test_f1: 0.5538
 epoch: 65, train_loss: 0.7500, test_loss: 0.9764, test_f1: 0.5596
 epoch: 66, train_loss: 0.7281, test_loss: 0.9915, test_f1: 0.5604
 epoch: 67, train_loss: 0.7321, test_loss: 0.9896, test_f1: 0.5692
 epoch: 68, train_loss: 0.7186, test_loss: 0.9949, test_f1: 0.5666
 epoch: 69, train_loss: 0.7294, test_loss: 0.9771, test_f1: 0.5657
 epoch: 70, train_loss: 0.7191, test_loss: 0.9714, test_f1: 0.5627
 epoch: 71, train_loss: 0.7223, test_loss: 0.9887, test_f1: 0.5655
 epoch: 72, train_loss: 0.7227, test_loss: 0.9821, test_f1: 0.5656
 epoch: 73, train_loss: 0.7195, test_loss: 0.9797, test_f1: 0.5647
 epoch: 74, train_loss: 0.7078, test_loss: 0.9965, test_f1: 0.5533
 epoch: 75, train_loss: 0.7250, test_loss: 0.9882, test_f1: 0.5458
 epoch: 76, train_loss: 0.7141, test_loss: 0.9777, test_f1: 0.5738
 epoch: 77, train_loss: 0.7027, test_loss: 0.9778, test_f1: 0.5637
 epoch: 78, train_loss: 0.7054, test_loss: 0.9917, test_f1: 0.5588
 epoch: 79, train_loss: 0.7122, test_loss: 0.9915, test_f1: 0.5587
 epoch: 80, train_loss: 0.7053, test_loss: 0.9742, test_f1: 0.5749
 epoch: 81, train_loss: 0.7029, test_loss: 0.9831, test_f1: 0.5635
 epoch: 82, train_loss: 0.7082, test_loss: 0.9632, test_f1: 0.5751
 epoch: 83, train_loss: 0.7014, test_loss: 0.9758, test_f1: 0.5655
 epoch: 84, train_loss: 0.6936, test_loss: 0.9764, test_f1: 0.5630
 epoch: 85, train_loss: 0.6938, test_loss: 0.9715, test_f1: 0.5671
 epoch: 86, train_loss: 0.6877, test_loss: 0.9645, test_f1: 0.5818
 epoch: 87, train_loss: 0.6907, test_loss: 0.9708, test_f1: 0.5773
 epoch: 88, train_loss: 0.6938, test_loss: 0.9862, test_f1: 0.5633
 epoch: 89, train_loss: 0.6881, test_loss: 1.0242, test_f1: 0.5580
 epoch: 90, train_loss: 0.6855, test_loss: 0.9880, test_f1: 0.5625
 epoch: 91, train_loss: 0.6778, test_loss: 0.9690, test_f1: 0.5729
 epoch: 92, train_loss: 0.6769, test_loss: 1.0032, test_f1: 0.5631
 epoch: 93, train_loss: 0.6729, test_loss: 1.0069, test_f1: 0.5499
 epoch: 94, train_loss: 0.6789, test_loss: 0.9969, test_f1: 0.5575
 epoch: 95, train_loss: 0.6731, test_loss: 0.9881, test_f1: 0.5801
 epoch: 96, train_loss: 0.6818, test_loss: 0.9925, test_f1: 0.5691
 epoch: 97, train_loss: 0.6722, test_loss: 0.9882, test_f1: 0.5713
 epoch: 98, train_loss: 0.6745, test_loss: 0.9816, test_f1: 0.5731
 epoch: 99, train_loss: 0.6687, test_loss: 1.0095, test_f1: 0.5673
##################ITERATION #4 ****************************************
 epoch: 0, train_loss: 1.2830, test_loss: 1.3301, test_f1: 0.2281
 epoch: 1, train_loss: 1.2434, test_loss: 1.3149, test_f1: 0.2281
 epoch: 2, train_loss: 1.2131, test_loss: 1.3049, test_f1: 0.2281
 epoch: 3, train_loss: 1.2056, test_loss: 1.2919, test_f1: 0.2281
 epoch: 4, train_loss: 1.1864, test_loss: 1.2797, test_f1: 0.2527
 epoch: 5, train_loss: 1.1709, test_loss: 1.2628, test_f1: 0.2992
 epoch: 6, train_loss: 1.1569, test_loss: 1.2511, test_f1: 0.3281
 epoch: 7, train_loss: 1.1407, test_loss: 1.2394, test_f1: 0.3572
 epoch: 8, train_loss: 1.1277, test_loss: 1.2240, test_f1: 0.3487
 epoch: 9, train_loss: 1.1181, test_loss: 1.2194, test_f1: 0.3653
 epoch: 10, train_loss: 1.1141, test_loss: 1.2029, test_f1: 0.3859
 epoch: 11, train_loss: 1.0907, test_loss: 1.2025, test_f1: 0.3957
 epoch: 12, train_loss: 1.0845, test_loss: 1.1815, test_f1: 0.3943
 epoch: 13, train_loss: 1.0619, test_loss: 1.1803, test_f1: 0.4151
 epoch: 14, train_loss: 1.0534, test_loss: 1.1681, test_f1: 0.3923
 epoch: 15, train_loss: 1.0444, test_loss: 1.1748, test_f1: 0.4244
 epoch: 16, train_loss: 1.0280, test_loss: 1.1644, test_f1: 0.4421
 epoch: 17, train_loss: 1.0273, test_loss: 1.1632, test_f1: 0.4499
 epoch: 18, train_loss: 1.0083, test_loss: 1.1556, test_f1: 0.4580
 epoch: 19, train_loss: 0.9891, test_loss: 1.1494, test_f1: 0.4652
 epoch: 20, train_loss: 0.9836, test_loss: 1.1492, test_f1: 0.4683
 epoch: 21, train_loss: 0.9718, test_loss: 1.1480, test_f1: 0.4799
 epoch: 22, train_loss: 0.9612, test_loss: 1.1360, test_f1: 0.4894
 epoch: 23, train_loss: 0.9500, test_loss: 1.1438, test_f1: 0.4803
 epoch: 24, train_loss: 0.9422, test_loss: 1.1446, test_f1: 0.4818
 epoch: 25, train_loss: 0.9448, test_loss: 1.1147, test_f1: 0.4781
 epoch: 26, train_loss: 0.9289, test_loss: 1.1420, test_f1: 0.4755
 epoch: 27, train_loss: 0.9258, test_loss: 1.1252, test_f1: 0.4854
 epoch: 28, train_loss: 0.8975, test_loss: 1.1399, test_f1: 0.4924
 epoch: 29, train_loss: 0.9064, test_loss: 1.1338, test_f1: 0.4932
 epoch: 30, train_loss: 0.8962, test_loss: 1.1328, test_f1: 0.5012
 epoch: 31, train_loss: 0.8881, test_loss: 1.0762, test_f1: 0.5161
 epoch: 32, train_loss: 0.8839, test_loss: 1.1397, test_f1: 0.4891
 epoch: 33, train_loss: 0.8719, test_loss: 1.1468, test_f1: 0.5246
 epoch: 34, train_loss: 0.8694, test_loss: 1.1267, test_f1: 0.5290
 epoch: 35, train_loss: 0.8664, test_loss: 1.1663, test_f1: 0.5231
 epoch: 36, train_loss: 0.8505, test_loss: 1.1478, test_f1: 0.5201
 epoch: 37, train_loss: 0.8455, test_loss: 1.0909, test_f1: 0.5360
 epoch: 38, train_loss: 0.8410, test_loss: 1.1168, test_f1: 0.5308
 epoch: 39, train_loss: 0.8359, test_loss: 1.1273, test_f1: 0.5254
 epoch: 40, train_loss: 0.8228, test_loss: 1.1399, test_f1: 0.5337
 epoch: 41, train_loss: 0.8269, test_loss: 1.1345, test_f1: 0.5249
 epoch: 42, train_loss: 0.8134, test_loss: 1.1986, test_f1: 0.5454
 epoch: 43, train_loss: 0.8137, test_loss: 1.1897, test_f1: 0.5260
 epoch: 44, train_loss: 0.8057, test_loss: 1.1212, test_f1: 0.5399
 epoch: 45, train_loss: 0.8130, test_loss: 1.1280, test_f1: 0.5561
 epoch: 46, train_loss: 0.7995, test_loss: 1.1360, test_f1: 0.5251
 epoch: 47, train_loss: 0.7974, test_loss: 1.1379, test_f1: 0.5414
 epoch: 48, train_loss: 0.7801, test_loss: 1.1561, test_f1: 0.5388
 epoch: 49, train_loss: 0.7762, test_loss: 1.1558, test_f1: 0.5459
 epoch: 50, train_loss: 0.7696, test_loss: 1.1530, test_f1: 0.5539
 epoch: 51, train_loss: 0.7654, test_loss: 1.1699, test_f1: 0.5361
 epoch: 52, train_loss: 0.7627, test_loss: 1.1507, test_f1: 0.5466
 epoch: 53, train_loss: 0.7518, test_loss: 1.1412, test_f1: 0.5414
 epoch: 54, train_loss: 0.7635, test_loss: 1.1563, test_f1: 0.5484
 epoch: 55, train_loss: 0.7553, test_loss: 1.1683, test_f1: 0.5454
 epoch: 56, train_loss: 0.7576, test_loss: 1.1598, test_f1: 0.5578
 epoch: 57, train_loss: 0.7409, test_loss: 1.1536, test_f1: 0.5588
 epoch: 58, train_loss: 0.7507, test_loss: 1.1553, test_f1: 0.5456
 epoch: 59, train_loss: 0.7575, test_loss: 1.1729, test_f1: 0.5528
 epoch: 60, train_loss: 0.7554, test_loss: 1.1580, test_f1: 0.5562
 epoch: 61, train_loss: 0.7366, test_loss: 1.2085, test_f1: 0.5412
 epoch: 62, train_loss: 0.7405, test_loss: 1.1566, test_f1: 0.5538
 epoch: 63, train_loss: 0.7380, test_loss: 1.1252, test_f1: 0.5538
 epoch: 64, train_loss: 0.7349, test_loss: 1.1616, test_f1: 0.5480
 epoch: 65, train_loss: 0.7135, test_loss: 1.1849, test_f1: 0.5600
 epoch: 66, train_loss: 0.7268, test_loss: 1.1973, test_f1: 0.5620
 epoch: 67, train_loss: 0.7221, test_loss: 1.1837, test_f1: 0.5634
 epoch: 68, train_loss: 0.7384, test_loss: 1.1781, test_f1: 0.5595
 epoch: 69, train_loss: 0.7199, test_loss: 1.2274, test_f1: 0.5543
 epoch: 70, train_loss: 0.7132, test_loss: 1.2366, test_f1: 0.5547
 epoch: 71, train_loss: 0.7296, test_loss: 1.2299, test_f1: 0.5657
 epoch: 72, train_loss: 0.7278, test_loss: 1.1974, test_f1: 0.5638
 epoch: 73, train_loss: 0.7144, test_loss: 1.1805, test_f1: 0.5655
 epoch: 74, train_loss: 0.7114, test_loss: 1.1955, test_f1: 0.5610
 epoch: 75, train_loss: 0.7123, test_loss: 1.2415, test_f1: 0.5399
 epoch: 76, train_loss: 0.7038, test_loss: 1.2260, test_f1: 0.5589
 epoch: 77, train_loss: 0.7132, test_loss: 1.2323, test_f1: 0.5612
 epoch: 78, train_loss: 0.7032, test_loss: 1.2434, test_f1: 0.5516
 epoch: 79, train_loss: 0.7050, test_loss: 1.2451, test_f1: 0.5516
 epoch: 80, train_loss: 0.6919, test_loss: 1.2208, test_f1: 0.5535
 epoch: 81, train_loss: 0.6947, test_loss: 1.2514, test_f1: 0.5555
 epoch: 82, train_loss: 0.6913, test_loss: 1.2604, test_f1: 0.5581
 epoch: 83, train_loss: 0.7015, test_loss: 1.2164, test_f1: 0.5697
 epoch: 84, train_loss: 0.6904, test_loss: 1.2331, test_f1: 0.5694
 epoch: 85, train_loss: 0.6856, test_loss: 1.1872, test_f1: 0.5634
 epoch: 86, train_loss: 0.6749, test_loss: 1.1947, test_f1: 0.5706
 epoch: 87, train_loss: 0.6769, test_loss: 1.2501, test_f1: 0.5456
 epoch: 88, train_loss: 0.6956, test_loss: 1.2456, test_f1: 0.5676
 epoch: 89, train_loss: 0.6868, test_loss: 1.1752, test_f1: 0.5744
 epoch: 90, train_loss: 0.6760, test_loss: 1.2319, test_f1: 0.5558
 epoch: 91, train_loss: 0.6775, test_loss: 1.2270, test_f1: 0.5599
 epoch: 92, train_loss: 0.6838, test_loss: 1.2613, test_f1: 0.5468
 epoch: 93, train_loss: 0.6698, test_loss: 1.2629, test_f1: 0.5484
 epoch: 94, train_loss: 0.6876, test_loss: 1.2722, test_f1: 0.5460
 epoch: 95, train_loss: 0.6667, test_loss: 1.2510, test_f1: 0.5577
 epoch: 96, train_loss: 0.6710, test_loss: 1.2503, test_f1: 0.5669
 epoch: 97, train_loss: 0.6689, test_loss: 1.2616, test_f1: 0.5775
 epoch: 98, train_loss: 0.6747, test_loss: 1.2485, test_f1: 0.5637
 epoch: 99, train_loss: 0.6680, test_loss: 1.2684, test_f1: 0.5645
##################ITERATION #5 ****************************************
 epoch: 0, train_loss: 1.2514, test_loss: 1.3055, test_f1: 0.2281
 epoch: 1, train_loss: 1.2145, test_loss: 1.3010, test_f1: 0.2281
 epoch: 2, train_loss: 1.1955, test_loss: 1.2906, test_f1: 0.2281
 epoch: 3, train_loss: 1.1829, test_loss: 1.2699, test_f1: 0.2281
 epoch: 4, train_loss: 1.1656, test_loss: 1.2534, test_f1: 0.2738
 epoch: 5, train_loss: 1.1542, test_loss: 1.2222, test_f1: 0.3085
 epoch: 6, train_loss: 1.1340, test_loss: 1.1904, test_f1: 0.4034
 epoch: 7, train_loss: 1.1249, test_loss: 1.1883, test_f1: 0.4375
 epoch: 8, train_loss: 1.1121, test_loss: 1.1747, test_f1: 0.4700
 epoch: 9, train_loss: 1.1017, test_loss: 1.1668, test_f1: 0.4730
 epoch: 10, train_loss: 1.0867, test_loss: 1.1575, test_f1: 0.4953
 epoch: 11, train_loss: 1.0657, test_loss: 1.1485, test_f1: 0.5076
 epoch: 12, train_loss: 1.0557, test_loss: 1.1285, test_f1: 0.4998
 epoch: 13, train_loss: 1.0375, test_loss: 1.1166, test_f1: 0.4991
 epoch: 14, train_loss: 1.0297, test_loss: 1.1049, test_f1: 0.5118
 epoch: 15, train_loss: 1.0204, test_loss: 1.1005, test_f1: 0.5194
 epoch: 16, train_loss: 1.0021, test_loss: 1.0917, test_f1: 0.5149
 epoch: 17, train_loss: 0.9970, test_loss: 1.0817, test_f1: 0.5240
 epoch: 18, train_loss: 0.9823, test_loss: 1.0642, test_f1: 0.5186
 epoch: 19, train_loss: 0.9603, test_loss: 1.0494, test_f1: 0.5357
 epoch: 20, train_loss: 0.9662, test_loss: 1.0497, test_f1: 0.5352
 epoch: 21, train_loss: 0.9453, test_loss: 1.0587, test_f1: 0.5330
 epoch: 22, train_loss: 0.9437, test_loss: 1.0404, test_f1: 0.5333
 epoch: 23, train_loss: 0.9333, test_loss: 1.0533, test_f1: 0.5338
 epoch: 24, train_loss: 0.9238, test_loss: 1.0371, test_f1: 0.5337
 epoch: 25, train_loss: 0.9100, test_loss: 1.0249, test_f1: 0.5561
 epoch: 26, train_loss: 0.9178, test_loss: 1.0222, test_f1: 0.5498
 epoch: 27, train_loss: 0.9001, test_loss: 1.0127, test_f1: 0.5504
 epoch: 28, train_loss: 0.8941, test_loss: 1.0231, test_f1: 0.5595
 epoch: 29, train_loss: 0.8976, test_loss: 1.0168, test_f1: 0.5542
 epoch: 30, train_loss: 0.8762, test_loss: 1.0177, test_f1: 0.5515
 epoch: 31, train_loss: 0.8661, test_loss: 1.0009, test_f1: 0.5647
 epoch: 32, train_loss: 0.8655, test_loss: 1.0025, test_f1: 0.5874
 epoch: 33, train_loss: 0.8438, test_loss: 1.0019, test_f1: 0.5835
 epoch: 34, train_loss: 0.8476, test_loss: 0.9865, test_f1: 0.5911
 epoch: 35, train_loss: 0.8386, test_loss: 0.9814, test_f1: 0.5836
 epoch: 36, train_loss: 0.8370, test_loss: 0.9723, test_f1: 0.5945
 epoch: 37, train_loss: 0.8309, test_loss: 0.9898, test_f1: 0.5908
 epoch: 38, train_loss: 0.8190, test_loss: 0.9804, test_f1: 0.5995
 epoch: 39, train_loss: 0.8043, test_loss: 0.9903, test_f1: 0.5966
 epoch: 40, train_loss: 0.7855, test_loss: 0.9891, test_f1: 0.5856
 epoch: 41, train_loss: 0.7890, test_loss: 1.0029, test_f1: 0.5840
 epoch: 42, train_loss: 0.7771, test_loss: 1.0269, test_f1: 0.5745
 epoch: 43, train_loss: 0.7756, test_loss: 1.0100, test_f1: 0.5847
 epoch: 44, train_loss: 0.7826, test_loss: 0.9943, test_f1: 0.5665
 epoch: 45, train_loss: 0.7710, test_loss: 0.9958, test_f1: 0.5703
 epoch: 46, train_loss: 0.7578, test_loss: 1.0058, test_f1: 0.5701
 epoch: 47, train_loss: 0.7542, test_loss: 1.0104, test_f1: 0.5795
 epoch: 48, train_loss: 0.7448, test_loss: 0.9783, test_f1: 0.5668
 epoch: 49, train_loss: 0.7467, test_loss: 1.0058, test_f1: 0.5630
 epoch: 50, train_loss: 0.7355, test_loss: 1.0461, test_f1: 0.5510
 epoch: 51, train_loss: 0.7223, test_loss: 0.9958, test_f1: 0.5764
 epoch: 52, train_loss: 0.7285, test_loss: 0.9949, test_f1: 0.5741
 epoch: 53, train_loss: 0.7203, test_loss: 1.0025, test_f1: 0.5660
 epoch: 54, train_loss: 0.7378, test_loss: 1.0012, test_f1: 0.5770
 epoch: 55, train_loss: 0.7188, test_loss: 0.9991, test_f1: 0.5756
 epoch: 56, train_loss: 0.7249, test_loss: 1.0212, test_f1: 0.5747
 epoch: 57, train_loss: 0.7094, test_loss: 1.0308, test_f1: 0.5730
 epoch: 58, train_loss: 0.7075, test_loss: 1.0169, test_f1: 0.5752
 epoch: 59, train_loss: 0.7006, test_loss: 1.0195, test_f1: 0.5756
 epoch: 60, train_loss: 0.6959, test_loss: 1.0357, test_f1: 0.5767
 epoch: 61, train_loss: 0.6959, test_loss: 1.0463, test_f1: 0.5713
 epoch: 62, train_loss: 0.6871, test_loss: 1.0241, test_f1: 0.5698
 epoch: 63, train_loss: 0.6888, test_loss: 1.0456, test_f1: 0.5605
 epoch: 64, train_loss: 0.7086, test_loss: 1.0454, test_f1: 0.5752
 epoch: 65, train_loss: 0.6963, test_loss: 1.0109, test_f1: 0.5730
 epoch: 66, train_loss: 0.6957, test_loss: 1.0054, test_f1: 0.5697
 epoch: 67, train_loss: 0.6796, test_loss: 1.0052, test_f1: 0.5637
 epoch: 68, train_loss: 0.6838, test_loss: 1.0225, test_f1: 0.5637
 epoch: 69, train_loss: 0.6802, test_loss: 1.0469, test_f1: 0.5607
 epoch: 70, train_loss: 0.6734, test_loss: 1.0515, test_f1: 0.5656
 epoch: 71, train_loss: 0.6740, test_loss: 1.0173, test_f1: 0.5733
 epoch: 72, train_loss: 0.6744, test_loss: 1.0550, test_f1: 0.5758
 epoch: 73, train_loss: 0.6824, test_loss: 1.0546, test_f1: 0.5747
 epoch: 74, train_loss: 0.6617, test_loss: 1.0670, test_f1: 0.5708
 epoch: 75, train_loss: 0.6684, test_loss: 1.0283, test_f1: 0.5796
 epoch: 76, train_loss: 0.6684, test_loss: 1.0198, test_f1: 0.5865
 epoch: 77, train_loss: 0.6654, test_loss: 1.0670, test_f1: 0.5700
 epoch: 78, train_loss: 0.6533, test_loss: 1.0555, test_f1: 0.5750
 epoch: 79, train_loss: 0.6633, test_loss: 1.0520, test_f1: 0.5711
 epoch: 80, train_loss: 0.6534, test_loss: 1.0431, test_f1: 0.5675
 epoch: 81, train_loss: 0.6652, test_loss: 1.0370, test_f1: 0.5980
 epoch: 82, train_loss: 0.6545, test_loss: 1.0391, test_f1: 0.5662
 epoch: 83, train_loss: 0.6510, test_loss: 1.0522, test_f1: 0.5786
 epoch: 84, train_loss: 0.6604, test_loss: 1.0359, test_f1: 0.5836
 epoch: 85, train_loss: 0.6463, test_loss: 1.0568, test_f1: 0.5756
 epoch: 86, train_loss: 0.6536, test_loss: 1.0544, test_f1: 0.5826
 epoch: 87, train_loss: 0.6424, test_loss: 1.0639, test_f1: 0.5754
 epoch: 88, train_loss: 0.6516, test_loss: 1.0640, test_f1: 0.5740
 epoch: 89, train_loss: 0.6424, test_loss: 1.0621, test_f1: 0.5885
 epoch: 90, train_loss: 0.6548, test_loss: 1.0762, test_f1: 0.5907
 epoch: 91, train_loss: 0.6396, test_loss: 1.0568, test_f1: 0.5842
 epoch: 92, train_loss: 0.6479, test_loss: 1.0746, test_f1: 0.5933
 epoch: 93, train_loss: 0.6277, test_loss: 1.0884, test_f1: 0.5985
 epoch: 94, train_loss: 0.6224, test_loss: 1.0994, test_f1: 0.5922
 epoch: 95, train_loss: 0.6252, test_loss: 1.0835, test_f1: 0.5909
 epoch: 96, train_loss: 0.6411, test_loss: 1.0682, test_f1: 0.5897
 epoch: 97, train_loss: 0.6405, test_loss: 1.0787, test_f1: 0.5897
 epoch: 98, train_loss: 0.6349, test_loss: 1.0781, test_f1: 0.5880
 epoch: 99, train_loss: 0.6314, test_loss: 1.0876, test_f1: 0.5766
##################ITERATION #6 ****************************************
 epoch: 0, train_loss: 1.2503, test_loss: 1.3038, test_f1: 0.2404
 epoch: 1, train_loss: 1.2088, test_loss: 1.3027, test_f1: 0.2357
 epoch: 2, train_loss: 1.1985, test_loss: 1.2919, test_f1: 0.2652
 epoch: 3, train_loss: 1.1818, test_loss: 1.2720, test_f1: 0.2682
 epoch: 4, train_loss: 1.1628, test_loss: 1.2494, test_f1: 0.2697
 epoch: 5, train_loss: 1.1425, test_loss: 1.2472, test_f1: 0.3108
 epoch: 6, train_loss: 1.1376, test_loss: 1.2203, test_f1: 0.3552
 epoch: 7, train_loss: 1.1146, test_loss: 1.1960, test_f1: 0.4112
 epoch: 8, train_loss: 1.0952, test_loss: 1.1795, test_f1: 0.4448
 epoch: 9, train_loss: 1.0699, test_loss: 1.1478, test_f1: 0.4335
 epoch: 10, train_loss: 1.0606, test_loss: 1.1227, test_f1: 0.4468
 epoch: 11, train_loss: 1.0485, test_loss: 1.1015, test_f1: 0.4766
 epoch: 12, train_loss: 1.0236, test_loss: 1.1615, test_f1: 0.4663
 epoch: 13, train_loss: 1.0153, test_loss: 1.1665, test_f1: 0.4859
 epoch: 14, train_loss: 1.0051, test_loss: 1.0925, test_f1: 0.4861
 epoch: 15, train_loss: 0.9790, test_loss: 1.1122, test_f1: 0.4970
 epoch: 16, train_loss: 0.9769, test_loss: 1.1443, test_f1: 0.4903
 epoch: 17, train_loss: 0.9505, test_loss: 1.1187, test_f1: 0.5361
 epoch: 18, train_loss: 0.9538, test_loss: 1.0900, test_f1: 0.5319
 epoch: 19, train_loss: 0.9364, test_loss: 1.1002, test_f1: 0.5691
 epoch: 20, train_loss: 0.9196, test_loss: 1.0989, test_f1: 0.5507
 epoch: 21, train_loss: 0.9202, test_loss: 1.0881, test_f1: 0.5454
 epoch: 22, train_loss: 0.9078, test_loss: 1.0799, test_f1: 0.5493
 epoch: 23, train_loss: 0.8953, test_loss: 1.1073, test_f1: 0.5683
 epoch: 24, train_loss: 0.8871, test_loss: 1.1253, test_f1: 0.5394
 epoch: 25, train_loss: 0.8769, test_loss: 1.1136, test_f1: 0.5414
 epoch: 26, train_loss: 0.8703, test_loss: 1.1621, test_f1: 0.5544
 epoch: 27, train_loss: 0.8785, test_loss: 1.1221, test_f1: 0.5523
 epoch: 28, train_loss: 0.8496, test_loss: 1.0584, test_f1: 0.5727
 epoch: 29, train_loss: 0.8602, test_loss: 1.0446, test_f1: 0.5798
 epoch: 30, train_loss: 0.8413, test_loss: 1.0705, test_f1: 0.6045
 epoch: 31, train_loss: 0.8218, test_loss: 1.0887, test_f1: 0.5994
 epoch: 32, train_loss: 0.8233, test_loss: 1.1188, test_f1: 0.5877
 epoch: 33, train_loss: 0.8142, test_loss: 1.1783, test_f1: 0.5823
 epoch: 34, train_loss: 0.8002, test_loss: 1.2036, test_f1: 0.5386
 epoch: 35, train_loss: 0.8064, test_loss: 1.2475, test_f1: 0.5441
 epoch: 36, train_loss: 0.8013, test_loss: 1.2156, test_f1: 0.5481
 epoch: 37, train_loss: 0.7924, test_loss: 1.2158, test_f1: 0.5362
 epoch: 38, train_loss: 0.7762, test_loss: 1.2610, test_f1: 0.5594
 epoch: 39, train_loss: 0.7780, test_loss: 1.2129, test_f1: 0.5390
 epoch: 40, train_loss: 0.7684, test_loss: 1.2302, test_f1: 0.5719
 epoch: 41, train_loss: 0.7693, test_loss: 1.1683, test_f1: 0.5664
 epoch: 42, train_loss: 0.7664, test_loss: 1.1412, test_f1: 0.5438
 epoch: 43, train_loss: 0.7510, test_loss: 1.2260, test_f1: 0.5236
 epoch: 44, train_loss: 0.7371, test_loss: 1.1799, test_f1: 0.5718
 epoch: 45, train_loss: 0.7484, test_loss: 1.2281, test_f1: 0.5551
 epoch: 46, train_loss: 0.7255, test_loss: 1.1763, test_f1: 0.5705
 epoch: 47, train_loss: 0.7343, test_loss: 1.2518, test_f1: 0.5545
 epoch: 48, train_loss: 0.7258, test_loss: 1.2433, test_f1: 0.5445
 epoch: 49, train_loss: 0.7173, test_loss: 1.1860, test_f1: 0.5590
 epoch: 50, train_loss: 0.7169, test_loss: 1.0825, test_f1: 0.5441
 epoch: 51, train_loss: 0.6981, test_loss: 1.2392, test_f1: 0.5654
 epoch: 52, train_loss: 0.7049, test_loss: 1.1999, test_f1: 0.5576
 epoch: 53, train_loss: 0.6860, test_loss: 1.1878, test_f1: 0.5668
 epoch: 54, train_loss: 0.6981, test_loss: 1.2102, test_f1: 0.5605
 epoch: 55, train_loss: 0.6985, test_loss: 1.2072, test_f1: 0.5590
 epoch: 56, train_loss: 0.6823, test_loss: 1.2001, test_f1: 0.5575
 epoch: 57, train_loss: 0.6899, test_loss: 1.1555, test_f1: 0.5587
 epoch: 58, train_loss: 0.6780, test_loss: 1.2083, test_f1: 0.5624
 epoch: 59, train_loss: 0.6836, test_loss: 1.1989, test_f1: 0.5524
 epoch: 60, train_loss: 0.6730, test_loss: 1.2205, test_f1: 0.5580
 epoch: 61, train_loss: 0.6686, test_loss: 1.1451, test_f1: 0.5430
 epoch: 62, train_loss: 0.6733, test_loss: 1.1725, test_f1: 0.5443
 epoch: 63, train_loss: 0.6723, test_loss: 1.1852, test_f1: 0.5631
 epoch: 64, train_loss: 0.6743, test_loss: 1.1601, test_f1: 0.5577
 epoch: 65, train_loss: 0.6673, test_loss: 1.1362, test_f1: 0.5771
 epoch: 66, train_loss: 0.6659, test_loss: 1.2014, test_f1: 0.5732
 epoch: 67, train_loss: 0.6542, test_loss: 1.1635, test_f1: 0.5406
 epoch: 68, train_loss: 0.6622, test_loss: 1.1379, test_f1: 0.5321
 epoch: 69, train_loss: 0.6517, test_loss: 1.1417, test_f1: 0.5699
 epoch: 70, train_loss: 0.6628, test_loss: 1.1516, test_f1: 0.5653
 epoch: 71, train_loss: 0.6602, test_loss: 1.1329, test_f1: 0.5762
 epoch: 72, train_loss: 0.6667, test_loss: 1.1707, test_f1: 0.5758
 epoch: 73, train_loss: 0.6471, test_loss: 1.1825, test_f1: 0.5753
 epoch: 74, train_loss: 0.6448, test_loss: 1.1810, test_f1: 0.5631
 epoch: 75, train_loss: 0.6498, test_loss: 1.1848, test_f1: 0.5536
 epoch: 76, train_loss: 0.6432, test_loss: 1.1814, test_f1: 0.5844
 epoch: 77, train_loss: 0.6397, test_loss: 1.2442, test_f1: 0.5825
 epoch: 78, train_loss: 0.6463, test_loss: 1.1750, test_f1: 0.5784
 epoch: 79, train_loss: 0.6398, test_loss: 1.1554, test_f1: 0.5841
 epoch: 80, train_loss: 0.6377, test_loss: 1.1962, test_f1: 0.5812
 epoch: 81, train_loss: 0.6292, test_loss: 1.1078, test_f1: 0.5928
 epoch: 82, train_loss: 0.6287, test_loss: 1.0883, test_f1: 0.5791
 epoch: 83, train_loss: 0.6304, test_loss: 1.1606, test_f1: 0.5598
 epoch: 84, train_loss: 0.6377, test_loss: 1.2385, test_f1: 0.5785
 epoch: 85, train_loss: 0.6405, test_loss: 1.1981, test_f1: 0.5672
 epoch: 86, train_loss: 0.6270, test_loss: 1.2226, test_f1: 0.5776
 epoch: 87, train_loss: 0.6295, test_loss: 1.2163, test_f1: 0.5719
 epoch: 88, train_loss: 0.6375, test_loss: 1.2138, test_f1: 0.5748
 epoch: 89, train_loss: 0.6197, test_loss: 1.2340, test_f1: 0.5694
 epoch: 90, train_loss: 0.6267, test_loss: 1.2083, test_f1: 0.5893
 epoch: 91, train_loss: 0.6181, test_loss: 1.2003, test_f1: 0.5696
 epoch: 92, train_loss: 0.6208, test_loss: 1.1555, test_f1: 0.5749
 epoch: 93, train_loss: 0.6336, test_loss: 1.1854, test_f1: 0.5771
 epoch: 94, train_loss: 0.6301, test_loss: 1.1755, test_f1: 0.5758
 epoch: 95, train_loss: 0.6155, test_loss: 1.1813, test_f1: 0.5776
 epoch: 96, train_loss: 0.6175, test_loss: 1.2306, test_f1: 0.5763
 epoch: 97, train_loss: 0.6221, test_loss: 1.3292, test_f1: 0.5999
 epoch: 98, train_loss: 0.5945, test_loss: 1.2645, test_f1: 0.5828
 epoch: 99, train_loss: 0.6001, test_loss: 1.2241, test_f1: 0.5695
##################ITERATION #7 ****************************************
 epoch: 0, train_loss: 1.2521, test_loss: 1.3031, test_f1: 0.2354
 epoch: 1, train_loss: 1.2063, test_loss: 1.3052, test_f1: 0.2404
 epoch: 2, train_loss: 1.1779, test_loss: 1.3025, test_f1: 0.2251
 epoch: 3, train_loss: 1.1575, test_loss: 1.2811, test_f1: 0.2580
 epoch: 4, train_loss: 1.1374, test_loss: 1.2468, test_f1: 0.2644
 epoch: 5, train_loss: 1.1267, test_loss: 1.2089, test_f1: 0.3563
 epoch: 6, train_loss: 1.1101, test_loss: 1.1889, test_f1: 0.4067
 epoch: 7, train_loss: 1.0920, test_loss: 1.1830, test_f1: 0.4098
 epoch: 8, train_loss: 1.0801, test_loss: 1.1580, test_f1: 0.4270
 epoch: 9, train_loss: 1.0799, test_loss: 1.1500, test_f1: 0.4320
 epoch: 10, train_loss: 1.0645, test_loss: 1.1407, test_f1: 0.4417
 epoch: 11, train_loss: 1.0488, test_loss: 1.1443, test_f1: 0.4583
 epoch: 12, train_loss: 1.0414, test_loss: 1.1409, test_f1: 0.4569
 epoch: 13, train_loss: 1.0244, test_loss: 1.1307, test_f1: 0.4738
 epoch: 14, train_loss: 1.0138, test_loss: 1.1298, test_f1: 0.4815
 epoch: 15, train_loss: 1.0037, test_loss: 1.1182, test_f1: 0.4791
 epoch: 16, train_loss: 0.9938, test_loss: 1.1157, test_f1: 0.4960
 epoch: 17, train_loss: 0.9802, test_loss: 1.1068, test_f1: 0.4997
 epoch: 18, train_loss: 0.9737, test_loss: 1.1167, test_f1: 0.5189
 epoch: 19, train_loss: 0.9643, test_loss: 1.0946, test_f1: 0.5349
 epoch: 20, train_loss: 0.9610, test_loss: 1.0940, test_f1: 0.5241
 epoch: 21, train_loss: 0.9404, test_loss: 1.1072, test_f1: 0.5214
 epoch: 22, train_loss: 0.9386, test_loss: 1.0930, test_f1: 0.5382
 epoch: 23, train_loss: 0.9391, test_loss: 1.0946, test_f1: 0.5357
 epoch: 24, train_loss: 0.9234, test_loss: 1.1032, test_f1: 0.5475
 epoch: 25, train_loss: 0.9086, test_loss: 1.1037, test_f1: 0.5375
 epoch: 26, train_loss: 0.8935, test_loss: 1.1042, test_f1: 0.5409
 epoch: 27, train_loss: 0.8954, test_loss: 1.0855, test_f1: 0.5529
 epoch: 28, train_loss: 0.8848, test_loss: 1.0908, test_f1: 0.5549
 epoch: 29, train_loss: 0.8822, test_loss: 1.0972, test_f1: 0.5642
 epoch: 30, train_loss: 0.8670, test_loss: 1.0833, test_f1: 0.5624
 epoch: 31, train_loss: 0.8582, test_loss: 1.0846, test_f1: 0.5616
 epoch: 32, train_loss: 0.8594, test_loss: 1.0963, test_f1: 0.5651
 epoch: 33, train_loss: 0.8548, test_loss: 1.0876, test_f1: 0.5729
 epoch: 34, train_loss: 0.8445, test_loss: 1.1057, test_f1: 0.5466
 epoch: 35, train_loss: 0.8416, test_loss: 1.0664, test_f1: 0.6011
 epoch: 36, train_loss: 0.8363, test_loss: 1.0480, test_f1: 0.5886
 epoch: 37, train_loss: 0.8331, test_loss: 1.0396, test_f1: 0.5855
 epoch: 38, train_loss: 0.8185, test_loss: 1.0693, test_f1: 0.5985
 epoch: 39, train_loss: 0.8140, test_loss: 1.0903, test_f1: 0.5995
 epoch: 40, train_loss: 0.8064, test_loss: 1.0947, test_f1: 0.5713
 epoch: 41, train_loss: 0.8110, test_loss: 1.0594, test_f1: 0.6140
 epoch: 42, train_loss: 0.7965, test_loss: 1.0961, test_f1: 0.5999
 epoch: 43, train_loss: 0.8095, test_loss: 1.1417, test_f1: 0.5626
 epoch: 44, train_loss: 0.7944, test_loss: 1.0984, test_f1: 0.6109
 epoch: 45, train_loss: 0.7920, test_loss: 1.0924, test_f1: 0.5987
 epoch: 46, train_loss: 0.7819, test_loss: 1.1118, test_f1: 0.5901
 epoch: 47, train_loss: 0.7675, test_loss: 1.0887, test_f1: 0.5929
 epoch: 48, train_loss: 0.7670, test_loss: 1.1261, test_f1: 0.5995
 epoch: 49, train_loss: 0.7572, test_loss: 1.0901, test_f1: 0.6105
 epoch: 50, train_loss: 0.7603, test_loss: 1.1377, test_f1: 0.6161
 epoch: 51, train_loss: 0.7517, test_loss: 1.1367, test_f1: 0.5899
 epoch: 52, train_loss: 0.7639, test_loss: 1.0987, test_f1: 0.5800
 epoch: 53, train_loss: 0.7402, test_loss: 1.1106, test_f1: 0.6093
 epoch: 54, train_loss: 0.7523, test_loss: 1.1086, test_f1: 0.6073
 epoch: 55, train_loss: 0.7389, test_loss: 1.1309, test_f1: 0.5811
 epoch: 56, train_loss: 0.7386, test_loss: 1.1078, test_f1: 0.6045
 epoch: 57, train_loss: 0.7444, test_loss: 1.1219, test_f1: 0.5962
 epoch: 58, train_loss: 0.7380, test_loss: 1.1122, test_f1: 0.5936
 epoch: 59, train_loss: 0.7281, test_loss: 1.0976, test_f1: 0.5898
 epoch: 60, train_loss: 0.7319, test_loss: 1.1214, test_f1: 0.5755
 epoch: 61, train_loss: 0.7276, test_loss: 1.1301, test_f1: 0.5696
 epoch: 62, train_loss: 0.7131, test_loss: 1.1228, test_f1: 0.5751
 epoch: 63, train_loss: 0.7097, test_loss: 1.1137, test_f1: 0.5795
 epoch: 64, train_loss: 0.7221, test_loss: 1.1160, test_f1: 0.5843
 epoch: 65, train_loss: 0.7104, test_loss: 1.1170, test_f1: 0.5888
 epoch: 66, train_loss: 0.7174, test_loss: 1.1249, test_f1: 0.5900
 epoch: 67, train_loss: 0.7086, test_loss: 1.1694, test_f1: 0.5743
 epoch: 68, train_loss: 0.7159, test_loss: 1.1856, test_f1: 0.5676
 epoch: 69, train_loss: 0.7117, test_loss: 1.1386, test_f1: 0.5850
 epoch: 70, train_loss: 0.6917, test_loss: 1.1650, test_f1: 0.6145
 epoch: 71, train_loss: 0.6977, test_loss: 1.1650, test_f1: 0.5911
 epoch: 72, train_loss: 0.6995, test_loss: 1.1772, test_f1: 0.5730
 epoch: 73, train_loss: 0.6897, test_loss: 1.1684, test_f1: 0.5917
 epoch: 74, train_loss: 0.6843, test_loss: 1.1844, test_f1: 0.5929
 epoch: 75, train_loss: 0.6862, test_loss: 1.1762, test_f1: 0.6057
 epoch: 76, train_loss: 0.6944, test_loss: 1.1715, test_f1: 0.6158
 epoch: 77, train_loss: 0.6944, test_loss: 1.1508, test_f1: 0.6181
 epoch: 78, train_loss: 0.6969, test_loss: 1.1655, test_f1: 0.6212
 epoch: 79, train_loss: 0.7103, test_loss: 1.1850, test_f1: 0.5724
 epoch: 80, train_loss: 0.6952, test_loss: 1.2038, test_f1: 0.5833
 epoch: 81, train_loss: 0.6751, test_loss: 1.1899, test_f1: 0.5753
 epoch: 82, train_loss: 0.6709, test_loss: 1.2179, test_f1: 0.5798
 epoch: 83, train_loss: 0.6823, test_loss: 1.1789, test_f1: 0.6007
 epoch: 84, train_loss: 0.6855, test_loss: 1.1861, test_f1: 0.5678
 epoch: 85, train_loss: 0.6722, test_loss: 1.2166, test_f1: 0.5834
 epoch: 86, train_loss: 0.6703, test_loss: 1.2131, test_f1: 0.5748
 epoch: 87, train_loss: 0.6695, test_loss: 1.1983, test_f1: 0.5774
 epoch: 88, train_loss: 0.6617, test_loss: 1.2225, test_f1: 0.5857
 epoch: 89, train_loss: 0.6663, test_loss: 1.2354, test_f1: 0.5840
 epoch: 90, train_loss: 0.6478, test_loss: 1.1966, test_f1: 0.5860
 epoch: 91, train_loss: 0.6462, test_loss: 1.1939, test_f1: 0.5972
 epoch: 92, train_loss: 0.6606, test_loss: 1.1743, test_f1: 0.5920
 epoch: 93, train_loss: 0.6510, test_loss: 1.1945, test_f1: 0.5897
 epoch: 94, train_loss: 0.6642, test_loss: 1.1681, test_f1: 0.5812
 epoch: 95, train_loss: 0.6486, test_loss: 1.1944, test_f1: 0.6038
 epoch: 96, train_loss: 0.6463, test_loss: 1.1878, test_f1: 0.5833
 epoch: 97, train_loss: 0.6437, test_loss: 1.2407, test_f1: 0.5861
 epoch: 98, train_loss: 0.6432, test_loss: 1.2168, test_f1: 0.6202
 epoch: 99, train_loss: 0.6441, test_loss: 1.1971, test_f1: 0.6024
##################ITERATION #8 ****************************************
 epoch: 0, train_loss: 1.2600, test_loss: 1.3009, test_f1: 0.2348
 epoch: 1, train_loss: 1.2014, test_loss: 1.2924, test_f1: 0.2601
 epoch: 2, train_loss: 1.1783, test_loss: 1.2824, test_f1: 0.2647
 epoch: 3, train_loss: 1.1660, test_loss: 1.2544, test_f1: 0.2776
 epoch: 4, train_loss: 1.1328, test_loss: 1.2359, test_f1: 0.2595
 epoch: 5, train_loss: 1.1275, test_loss: 1.2182, test_f1: 0.3459
 epoch: 6, train_loss: 1.1141, test_loss: 1.2075, test_f1: 0.3876
 epoch: 7, train_loss: 1.0978, test_loss: 1.2081, test_f1: 0.4104
 epoch: 8, train_loss: 1.0726, test_loss: 1.1858, test_f1: 0.4547
 epoch: 9, train_loss: 1.0542, test_loss: 1.1633, test_f1: 0.4923
 epoch: 10, train_loss: 1.0455, test_loss: 1.1706, test_f1: 0.4878
 epoch: 11, train_loss: 1.0295, test_loss: 1.1323, test_f1: 0.4874
 epoch: 12, train_loss: 1.0000, test_loss: 1.1190, test_f1: 0.5117
 epoch: 13, train_loss: 0.9924, test_loss: 1.1264, test_f1: 0.4969
 epoch: 14, train_loss: 0.9839, test_loss: 1.0943, test_f1: 0.5272
 epoch: 15, train_loss: 0.9708, test_loss: 1.0855, test_f1: 0.5207
 epoch: 16, train_loss: 0.9707, test_loss: 1.0856, test_f1: 0.5169
 epoch: 17, train_loss: 0.9460, test_loss: 1.0958, test_f1: 0.5331
 epoch: 18, train_loss: 0.9346, test_loss: 1.0779, test_f1: 0.5171
 epoch: 19, train_loss: 0.9192, test_loss: 1.0627, test_f1: 0.5259
 epoch: 20, train_loss: 0.9143, test_loss: 1.0436, test_f1: 0.5143
 epoch: 21, train_loss: 0.9134, test_loss: 1.0514, test_f1: 0.5212
 epoch: 22, train_loss: 0.8929, test_loss: 1.0699, test_f1: 0.5243
 epoch: 23, train_loss: 0.8981, test_loss: 1.0451, test_f1: 0.5148
 epoch: 24, train_loss: 0.8794, test_loss: 1.0489, test_f1: 0.5277
 epoch: 25, train_loss: 0.8668, test_loss: 1.0759, test_f1: 0.5193
 epoch: 26, train_loss: 0.8610, test_loss: 1.0488, test_f1: 0.5318
 epoch: 27, train_loss: 0.8532, test_loss: 1.0257, test_f1: 0.5314
 epoch: 28, train_loss: 0.8485, test_loss: 1.0557, test_f1: 0.5147
 epoch: 29, train_loss: 0.8430, test_loss: 1.0630, test_f1: 0.5161
 epoch: 30, train_loss: 0.8402, test_loss: 1.0423, test_f1: 0.5136
 epoch: 31, train_loss: 0.8304, test_loss: 1.0841, test_f1: 0.5185
 epoch: 32, train_loss: 0.8365, test_loss: 1.0868, test_f1: 0.5139
 epoch: 33, train_loss: 0.8203, test_loss: 1.0762, test_f1: 0.5181
 epoch: 34, train_loss: 0.8090, test_loss: 1.0993, test_f1: 0.4952
 epoch: 35, train_loss: 0.8011, test_loss: 1.0691, test_f1: 0.5177
 epoch: 36, train_loss: 0.8050, test_loss: 1.0475, test_f1: 0.5187
 epoch: 37, train_loss: 0.7863, test_loss: 1.0452, test_f1: 0.5090
 epoch: 38, train_loss: 0.7816, test_loss: 1.0550, test_f1: 0.5275
 epoch: 39, train_loss: 0.7891, test_loss: 1.0417, test_f1: 0.5157
 epoch: 40, train_loss: 0.7686, test_loss: 1.0733, test_f1: 0.5224
 epoch: 41, train_loss: 0.7628, test_loss: 1.0219, test_f1: 0.5194
 epoch: 42, train_loss: 0.7747, test_loss: 1.0617, test_f1: 0.5098
 epoch: 43, train_loss: 0.7477, test_loss: 1.0668, test_f1: 0.5143
 epoch: 44, train_loss: 0.7428, test_loss: 1.0766, test_f1: 0.5039
 epoch: 45, train_loss: 0.7381, test_loss: 1.0990, test_f1: 0.5184
 epoch: 46, train_loss: 0.7440, test_loss: 1.1169, test_f1: 0.5115
 epoch: 47, train_loss: 0.7289, test_loss: 1.0967, test_f1: 0.5218
 epoch: 48, train_loss: 0.7307, test_loss: 1.0970, test_f1: 0.5072
 epoch: 49, train_loss: 0.7162, test_loss: 1.0824, test_f1: 0.5160
 epoch: 50, train_loss: 0.7144, test_loss: 1.1335, test_f1: 0.5085
 epoch: 51, train_loss: 0.7359, test_loss: 1.1164, test_f1: 0.5112
 epoch: 52, train_loss: 0.7037, test_loss: 1.1012, test_f1: 0.5017
 epoch: 53, train_loss: 0.6985, test_loss: 1.1113, test_f1: 0.5029
 epoch: 54, train_loss: 0.7034, test_loss: 1.1190, test_f1: 0.5177
 epoch: 55, train_loss: 0.6873, test_loss: 1.1185, test_f1: 0.5218
 epoch: 56, train_loss: 0.6876, test_loss: 1.1775, test_f1: 0.5263
 epoch: 57, train_loss: 0.6995, test_loss: 1.2150, test_f1: 0.5225
 epoch: 58, train_loss: 0.6944, test_loss: 1.1636, test_f1: 0.5082
 epoch: 59, train_loss: 0.7019, test_loss: 1.1616, test_f1: 0.5129
 epoch: 60, train_loss: 0.6890, test_loss: 1.1496, test_f1: 0.5433
 epoch: 61, train_loss: 0.6775, test_loss: 1.1503, test_f1: 0.5205
 epoch: 62, train_loss: 0.6852, test_loss: 1.1721, test_f1: 0.5200
 epoch: 63, train_loss: 0.6933, test_loss: 1.1442, test_f1: 0.5231
 epoch: 64, train_loss: 0.6875, test_loss: 1.1375, test_f1: 0.5056
 epoch: 65, train_loss: 0.6556, test_loss: 1.1713, test_f1: 0.5044
 epoch: 66, train_loss: 0.6778, test_loss: 1.1570, test_f1: 0.5205
 epoch: 67, train_loss: 0.6852, test_loss: 1.1319, test_f1: 0.5279
 epoch: 68, train_loss: 0.6600, test_loss: 1.1496, test_f1: 0.5313
 epoch: 69, train_loss: 0.6631, test_loss: 1.2066, test_f1: 0.5175
 epoch: 70, train_loss: 0.6563, test_loss: 1.1821, test_f1: 0.5184
 epoch: 71, train_loss: 0.6696, test_loss: 1.1976, test_f1: 0.5275
 epoch: 72, train_loss: 0.6633, test_loss: 1.1962, test_f1: 0.5267
 epoch: 73, train_loss: 0.6665, test_loss: 1.1882, test_f1: 0.5257
 epoch: 74, train_loss: 0.6563, test_loss: 1.2217, test_f1: 0.5192
 epoch: 75, train_loss: 0.6443, test_loss: 1.1901, test_f1: 0.5187
 epoch: 76, train_loss: 0.6482, test_loss: 1.2118, test_f1: 0.5152
 epoch: 77, train_loss: 0.6438, test_loss: 1.1779, test_f1: 0.5277
 epoch: 78, train_loss: 0.6688, test_loss: 1.1816, test_f1: 0.5242
 epoch: 79, train_loss: 0.6640, test_loss: 1.1903, test_f1: 0.5320
 epoch: 80, train_loss: 0.6441, test_loss: 1.2369, test_f1: 0.5070
 epoch: 81, train_loss: 0.6366, test_loss: 1.2584, test_f1: 0.5065
 epoch: 82, train_loss: 0.6396, test_loss: 1.2432, test_f1: 0.5243
 epoch: 83, train_loss: 0.6318, test_loss: 1.2732, test_f1: 0.5225
 epoch: 84, train_loss: 0.6305, test_loss: 1.2448, test_f1: 0.5092
 epoch: 85, train_loss: 0.6473, test_loss: 1.2469, test_f1: 0.5093
 epoch: 86, train_loss: 0.6335, test_loss: 1.2098, test_f1: 0.5198
 epoch: 87, train_loss: 0.6339, test_loss: 1.2746, test_f1: 0.4894
 epoch: 88, train_loss: 0.6285, test_loss: 1.3057, test_f1: 0.4917
 epoch: 89, train_loss: 0.6374, test_loss: 1.2587, test_f1: 0.5103
 epoch: 90, train_loss: 0.6373, test_loss: 1.2151, test_f1: 0.5227
 epoch: 91, train_loss: 0.6314, test_loss: 1.2526, test_f1: 0.5079
 epoch: 92, train_loss: 0.6247, test_loss: 1.2059, test_f1: 0.5068
 epoch: 93, train_loss: 0.6172, test_loss: 1.2001, test_f1: 0.5177
 epoch: 94, train_loss: 0.6226, test_loss: 1.2438, test_f1: 0.5242
 epoch: 95, train_loss: 0.6280, test_loss: 1.2444, test_f1: 0.5086
 epoch: 96, train_loss: 0.6244, test_loss: 1.2265, test_f1: 0.5197
 epoch: 97, train_loss: 0.6315, test_loss: 1.2217, test_f1: 0.5090
 epoch: 98, train_loss: 0.6172, test_loss: 1.2046, test_f1: 0.5319
 epoch: 99, train_loss: 0.6223, test_loss: 1.2890, test_f1: 0.5113
##################ITERATION #9 ****************************************
 epoch: 0, train_loss: 1.2625, test_loss: 1.3171, test_f1: 0.2289
 epoch: 1, train_loss: 1.2045, test_loss: 1.3076, test_f1: 0.2281
 epoch: 2, train_loss: 1.1794, test_loss: 1.3030, test_f1: 0.2449
 epoch: 3, train_loss: 1.1752, test_loss: 1.2832, test_f1: 0.2924
 epoch: 4, train_loss: 1.1510, test_loss: 1.2608, test_f1: 0.2969
 epoch: 5, train_loss: 1.1326, test_loss: 1.2333, test_f1: 0.3653
 epoch: 6, train_loss: 1.1221, test_loss: 1.2213, test_f1: 0.4016
 epoch: 7, train_loss: 1.0971, test_loss: 1.2012, test_f1: 0.3994
 epoch: 8, train_loss: 1.0790, test_loss: 1.1857, test_f1: 0.4255
 epoch: 9, train_loss: 1.0571, test_loss: 1.1623, test_f1: 0.3972
 epoch: 10, train_loss: 1.0539, test_loss: 1.1633, test_f1: 0.3965
 epoch: 11, train_loss: 1.0412, test_loss: 1.1610, test_f1: 0.4426
 epoch: 12, train_loss: 1.0371, test_loss: 1.1398, test_f1: 0.4541
 epoch: 13, train_loss: 1.0184, test_loss: 1.1260, test_f1: 0.4733
 epoch: 14, train_loss: 1.0117, test_loss: 1.1506, test_f1: 0.4986
 epoch: 15, train_loss: 0.9864, test_loss: 1.1150, test_f1: 0.5131
 epoch: 16, train_loss: 0.9837, test_loss: 1.1173, test_f1: 0.5157
 epoch: 17, train_loss: 0.9699, test_loss: 1.1164, test_f1: 0.5153
 epoch: 18, train_loss: 0.9618, test_loss: 1.1013, test_f1: 0.5249
 epoch: 19, train_loss: 0.9590, test_loss: 1.1243, test_f1: 0.5387
 epoch: 20, train_loss: 0.9457, test_loss: 1.0986, test_f1: 0.5369
 epoch: 21, train_loss: 0.9304, test_loss: 1.1030, test_f1: 0.5420
 epoch: 22, train_loss: 0.9323, test_loss: 1.1106, test_f1: 0.5427
 epoch: 23, train_loss: 0.9162, test_loss: 1.1061, test_f1: 0.5516
 epoch: 24, train_loss: 0.9077, test_loss: 1.0831, test_f1: 0.5581
 epoch: 25, train_loss: 0.9053, test_loss: 1.0398, test_f1: 0.5780
 epoch: 26, train_loss: 0.9009, test_loss: 1.0317, test_f1: 0.5631
 epoch: 27, train_loss: 0.8973, test_loss: 1.0357, test_f1: 0.5620
 epoch: 28, train_loss: 0.8862, test_loss: 1.0659, test_f1: 0.5429
 epoch: 29, train_loss: 0.8775, test_loss: 1.0781, test_f1: 0.5512
 epoch: 30, train_loss: 0.8627, test_loss: 1.0932, test_f1: 0.5525
 epoch: 31, train_loss: 0.8828, test_loss: 1.0928, test_f1: 0.5782
 epoch: 32, train_loss: 0.8523, test_loss: 1.0597, test_f1: 0.5783
 epoch: 33, train_loss: 0.8453, test_loss: 1.0156, test_f1: 0.5617
 epoch: 34, train_loss: 0.8494, test_loss: 1.0684, test_f1: 0.5711
 epoch: 35, train_loss: 0.8381, test_loss: 1.0222, test_f1: 0.5665
 epoch: 36, train_loss: 0.8166, test_loss: 1.0257, test_f1: 0.5690
 epoch: 37, train_loss: 0.8210, test_loss: 1.0347, test_f1: 0.5594
 epoch: 38, train_loss: 0.8098, test_loss: 1.1160, test_f1: 0.5416
 epoch: 39, train_loss: 0.8192, test_loss: 1.1166, test_f1: 0.5659
 epoch: 40, train_loss: 0.7995, test_loss: 1.0202, test_f1: 0.5584
 epoch: 41, train_loss: 0.7996, test_loss: 1.0664, test_f1: 0.5438
 epoch: 42, train_loss: 0.7973, test_loss: 1.0414, test_f1: 0.5342
 epoch: 43, train_loss: 0.7873, test_loss: 1.0675, test_f1: 0.5495
 epoch: 44, train_loss: 0.7797, test_loss: 1.0776, test_f1: 0.5496
 epoch: 45, train_loss: 0.7694, test_loss: 1.0512, test_f1: 0.5585
 epoch: 46, train_loss: 0.7581, test_loss: 1.0745, test_f1: 0.5573
 epoch: 47, train_loss: 0.7677, test_loss: 1.0628, test_f1: 0.5545
 epoch: 48, train_loss: 0.7645, test_loss: 1.0667, test_f1: 0.5547
 epoch: 49, train_loss: 0.7643, test_loss: 1.0212, test_f1: 0.5366
 epoch: 50, train_loss: 0.7436, test_loss: 0.9990, test_f1: 0.5403
 epoch: 51, train_loss: 0.7522, test_loss: 1.0092, test_f1: 0.5519
 epoch: 52, train_loss: 0.7361, test_loss: 1.0102, test_f1: 0.5524
 epoch: 53, train_loss: 0.7366, test_loss: 1.0205, test_f1: 0.5591
 epoch: 54, train_loss: 0.7380, test_loss: 1.0465, test_f1: 0.5635
 epoch: 55, train_loss: 0.7282, test_loss: 1.0728, test_f1: 0.5701
 epoch: 56, train_loss: 0.7320, test_loss: 1.0301, test_f1: 0.5533
 epoch: 57, train_loss: 0.7172, test_loss: 1.0648, test_f1: 0.5495
 epoch: 58, train_loss: 0.7208, test_loss: 1.0963, test_f1: 0.5489
 epoch: 59, train_loss: 0.7308, test_loss: 1.0584, test_f1: 0.5345
 epoch: 60, train_loss: 0.7133, test_loss: 1.0514, test_f1: 0.5334
 epoch: 61, train_loss: 0.7175, test_loss: 1.0347, test_f1: 0.5537
 epoch: 62, train_loss: 0.7224, test_loss: 1.0267, test_f1: 0.5567
 epoch: 63, train_loss: 0.7022, test_loss: 1.0314, test_f1: 0.5412
 epoch: 64, train_loss: 0.6966, test_loss: 1.0389, test_f1: 0.5459
 epoch: 65, train_loss: 0.7156, test_loss: 1.0304, test_f1: 0.5393
 epoch: 66, train_loss: 0.6968, test_loss: 1.0304, test_f1: 0.5429
 epoch: 67, train_loss: 0.6994, test_loss: 1.0393, test_f1: 0.5360
 epoch: 68, train_loss: 0.7067, test_loss: 1.0746, test_f1: 0.5353
 epoch: 69, train_loss: 0.6886, test_loss: 1.0447, test_f1: 0.5451
 epoch: 70, train_loss: 0.6918, test_loss: 1.0353, test_f1: 0.5357
 epoch: 71, train_loss: 0.6897, test_loss: 1.0360, test_f1: 0.5444
 epoch: 72, train_loss: 0.6908, test_loss: 1.0348, test_f1: 0.5518
 epoch: 73, train_loss: 0.6791, test_loss: 1.0315, test_f1: 0.5530
 epoch: 74, train_loss: 0.6757, test_loss: 1.0427, test_f1: 0.5519
 epoch: 75, train_loss: 0.6940, test_loss: 1.0570, test_f1: 0.5473
 epoch: 76, train_loss: 0.6703, test_loss: 1.0642, test_f1: 0.5413
 epoch: 77, train_loss: 0.6708, test_loss: 1.0649, test_f1: 0.5471
 epoch: 78, train_loss: 0.6842, test_loss: 1.0620, test_f1: 0.5368
 epoch: 79, train_loss: 0.6674, test_loss: 1.0486, test_f1: 0.5441
 epoch: 80, train_loss: 0.6674, test_loss: 1.0841, test_f1: 0.5391
 epoch: 81, train_loss: 0.6667, test_loss: 1.1029, test_f1: 0.5273
 epoch: 82, train_loss: 0.6639, test_loss: 1.0867, test_f1: 0.5340
 epoch: 83, train_loss: 0.6629, test_loss: 1.0778, test_f1: 0.5319
 epoch: 84, train_loss: 0.6592, test_loss: 1.0739, test_f1: 0.5460
 epoch: 85, train_loss: 0.6584, test_loss: 1.0827, test_f1: 0.5382
 epoch: 86, train_loss: 0.6504, test_loss: 1.0937, test_f1: 0.5382
 epoch: 87, train_loss: 0.6454, test_loss: 1.0955, test_f1: 0.5538
 epoch: 88, train_loss: 0.6620, test_loss: 1.0799, test_f1: 0.5446
 epoch: 89, train_loss: 0.6596, test_loss: 1.0945, test_f1: 0.5448
 epoch: 90, train_loss: 0.6428, test_loss: 1.0867, test_f1: 0.5437
 epoch: 91, train_loss: 0.6512, test_loss: 1.0962, test_f1: 0.5334
 epoch: 92, train_loss: 0.6570, test_loss: 1.0848, test_f1: 0.5361
 epoch: 93, train_loss: 0.6367, test_loss: 1.0943, test_f1: 0.5386
 epoch: 94, train_loss: 0.6334, test_loss: 1.0807, test_f1: 0.5266
 epoch: 95, train_loss: 0.6446, test_loss: 1.1048, test_f1: 0.5241
 epoch: 96, train_loss: 0.6451, test_loss: 1.1051, test_f1: 0.5204
 epoch: 97, train_loss: 0.6459, test_loss: 1.1160, test_f1: 0.5397
 epoch: 98, train_loss: 0.6315, test_loss: 1.1145, test_f1: 0.5357
 epoch: 99, train_loss: 0.6424, test_loss: 1.1359, test_f1: 0.5432

Training completed in 392.14 seconds
Best F1: 0.6212 at epoch 78
Mean F1 across iterations: 0.5848  0.0206
========================FINAL RESULTS================================
FEGIN weighted F1: 0.6212  0.0206
python main.py --data ltspice_demos --representation component_pin --model FEGIN --layers 6 --hiddens 64 --batch_size 128 --lr 0.0001 --emb_size 250 --epochs 100 --save_appendix component_pin_L6_H64_BS128_LR0.0001_E250 --no_val
-----



STDERR:
  File "main.py", line 370, in <module>
    main()
  File "main.py", line 254, in main
    dataset = dataset_class(
  File "/home/philip/projects/ltspice_examples_code_repo/Circuit-Completion-Using-GNNs/component_classification_with_link_prediction_head/evaluation/FEGIN/kernel/circuit_datasets.py", line 15, in __init__
    self.data, self.slices = torch.load(self.processed_paths[0])
  File "/home/philip/.local/lib/python3.8/site-packages/torch/serialization.py", line 1040, in load
    warnings.warn(
  File "/usr/lib/python3.8/warnings.py", line 109, in _showwarnmsg
    sw(msg.message, msg.category, msg.filename, msg.lineno,
  File "main.py", line 47, in warn_with_traceback
    traceback.print_stack(file=log)
/home/philip/projects/ltspice_examples_code_repo/Circuit-Completion-Using-GNNs/component_classification_with_link_prediction_head/evaluation/FEGIN/kernel/circuit_datasets.py:15: FutureWarning: You are using `torch.load` with `weights_only=False` (the current default value), which uses the default pickle module implicitly. It is possible to construct malicious pickle data which will execute arbitrary code during unpickling (See https://github.com/pytorch/pytorch/blob/main/SECURITY.md#untrusted-models for more details). In a future release, the default value for `weights_only` will be flipped to `True`. This limits the functions that could be executed during unpickling. Arbitrary objects will no longer be allowed to be loaded via this mode unless they are explicitly allowlisted by the user via `torch.serialization.add_safe_globals`. We recommend you start setting `weights_only=True` for any use case where you don't have full control of the loaded file. Please open an issue on GitHub for any issues related to this experimental feature.
  self.data, self.slices = torch.load(self.processed_paths[0])
