STDOUT:
Results will be saved in /home/philip/projects/ltspice_examples_code_repo/Circuit-Completion-Using-GNNs/component_classification_with_link_prediction_head/evaluation/FEGIN/results/model_FEGIN_dataset_ltspice_demos
Command line input: python main.py --data ltspice_demos --representation component_pin --model FEGIN --layers 6 --hiddens 64 --batch_size 128 --lr 0.0001 --emb_size 250 --epochs 100 --save_appendix component_pin_L6_H64_BS128_LR0.0001_E250 --no_val
 is saved.
-----
ltspice_demos - FEGIN
Using 6 layers, 64 hidden units, h = 2
Loading component_pin representation dataset
ENTERED
Training FEGIN on component_pin representation
Train: 1565, Test: 383
##################ITERATION #0 ****************************************
 epoch: 0, train_loss: 1.3906, test_loss: 1.3906, test_f1: 0.1365
 epoch: 1, train_loss: 1.3841, test_loss: 1.3875, test_f1: 0.1365
 epoch: 2, train_loss: 1.3796, test_loss: 1.3846, test_f1: 0.1365
 epoch: 3, train_loss: 1.3753, test_loss: 1.3816, test_f1: 0.1365
 epoch: 4, train_loss: 1.3697, test_loss: 1.3780, test_f1: 0.1365
 epoch: 5, train_loss: 1.3635, test_loss: 1.3736, test_f1: 0.1729
 epoch: 6, train_loss: 1.3568, test_loss: 1.3673, test_f1: 0.2946
 epoch: 7, train_loss: 1.3487, test_loss: 1.3608, test_f1: 0.3372
 epoch: 8, train_loss: 1.3386, test_loss: 1.3527, test_f1: 0.3251
 epoch: 9, train_loss: 1.3256, test_loss: 1.3431, test_f1: 0.3379
 epoch: 10, train_loss: 1.3109, test_loss: 1.3320, test_f1: 0.3322
 epoch: 11, train_loss: 1.2939, test_loss: 1.3208, test_f1: 0.3322
 epoch: 12, train_loss: 1.2730, test_loss: 1.3074, test_f1: 0.3362
 epoch: 13, train_loss: 1.2570, test_loss: 1.2952, test_f1: 0.3342
 epoch: 14, train_loss: 1.2384, test_loss: 1.2843, test_f1: 0.3341
 epoch: 15, train_loss: 1.2201, test_loss: 1.2739, test_f1: 0.3283
 epoch: 16, train_loss: 1.2024, test_loss: 1.2625, test_f1: 0.3358
 epoch: 17, train_loss: 1.1888, test_loss: 1.2532, test_f1: 0.3340
 epoch: 18, train_loss: 1.1843, test_loss: 1.2441, test_f1: 0.3341
 epoch: 19, train_loss: 1.1697, test_loss: 1.2376, test_f1: 0.3344
 epoch: 20, train_loss: 1.1634, test_loss: 1.2331, test_f1: 0.3311
 epoch: 21, train_loss: 1.1573, test_loss: 1.2392, test_f1: 0.3341
 epoch: 22, train_loss: 1.1505, test_loss: 1.2222, test_f1: 0.3317
 epoch: 23, train_loss: 1.1432, test_loss: 1.2256, test_f1: 0.3371
 epoch: 24, train_loss: 1.1343, test_loss: 1.2197, test_f1: 0.3935
 epoch: 25, train_loss: 1.1269, test_loss: 1.2140, test_f1: 0.3832
 epoch: 26, train_loss: 1.1212, test_loss: 1.2078, test_f1: 0.4062
 epoch: 27, train_loss: 1.1180, test_loss: 1.2044, test_f1: 0.4260
 epoch: 28, train_loss: 1.1119, test_loss: 1.1924, test_f1: 0.4322
 epoch: 29, train_loss: 1.1112, test_loss: 1.1910, test_f1: 0.4457
 epoch: 30, train_loss: 1.1012, test_loss: 1.1872, test_f1: 0.4340
 epoch: 31, train_loss: 1.0962, test_loss: 1.1811, test_f1: 0.4464
 epoch: 32, train_loss: 1.0905, test_loss: 1.1807, test_f1: 0.4488
 epoch: 33, train_loss: 1.0878, test_loss: 1.1698, test_f1: 0.4516
 epoch: 34, train_loss: 1.0781, test_loss: 1.1705, test_f1: 0.4427
 epoch: 35, train_loss: 1.0770, test_loss: 1.1820, test_f1: 0.4342
 epoch: 36, train_loss: 1.0656, test_loss: 1.1669, test_f1: 0.4535
 epoch: 37, train_loss: 1.0561, test_loss: 1.1438, test_f1: 0.4510
 epoch: 38, train_loss: 1.0484, test_loss: 1.1551, test_f1: 0.4510
 epoch: 39, train_loss: 1.0401, test_loss: 1.1295, test_f1: 0.4510
 epoch: 40, train_loss: 1.0361, test_loss: 1.1435, test_f1: 0.4478
 epoch: 41, train_loss: 1.0223, test_loss: 1.1196, test_f1: 0.4530
 epoch: 42, train_loss: 1.0181, test_loss: 1.1237, test_f1: 0.4526
 epoch: 43, train_loss: 1.0077, test_loss: 1.1295, test_f1: 0.4473
 epoch: 44, train_loss: 1.0033, test_loss: 1.0984, test_f1: 0.4519
 epoch: 45, train_loss: 0.9927, test_loss: 1.1049, test_f1: 0.4536
 epoch: 46, train_loss: 0.9781, test_loss: 1.1052, test_f1: 0.4515
 epoch: 47, train_loss: 0.9763, test_loss: 1.0941, test_f1: 0.4491
 epoch: 48, train_loss: 0.9692, test_loss: 1.0855, test_f1: 0.4491
 epoch: 49, train_loss: 0.9507, test_loss: 1.1051, test_f1: 0.4163
 epoch: 50, train_loss: 0.9520, test_loss: 1.1002, test_f1: 0.4491
 epoch: 51, train_loss: 0.9381, test_loss: 1.0633, test_f1: 0.4474
 epoch: 52, train_loss: 0.9274, test_loss: 1.0633, test_f1: 0.4542
 epoch: 53, train_loss: 0.9251, test_loss: 1.0847, test_f1: 0.4543
 epoch: 54, train_loss: 0.9195, test_loss: 1.0584, test_f1: 0.4506
 epoch: 55, train_loss: 0.9105, test_loss: 1.0599, test_f1: 0.4507
 epoch: 56, train_loss: 0.9114, test_loss: 1.0659, test_f1: 0.4496
 epoch: 57, train_loss: 0.9117, test_loss: 1.0555, test_f1: 0.4548
 epoch: 58, train_loss: 0.8960, test_loss: 1.0500, test_f1: 0.4743
 epoch: 59, train_loss: 0.8996, test_loss: 1.0522, test_f1: 0.4506
 epoch: 60, train_loss: 0.8987, test_loss: 1.0646, test_f1: 0.4556
 epoch: 61, train_loss: 0.8989, test_loss: 1.0543, test_f1: 0.4605
 epoch: 62, train_loss: 0.8955, test_loss: 1.0456, test_f1: 0.4764
 epoch: 63, train_loss: 0.8906, test_loss: 1.0484, test_f1: 0.4740
 epoch: 64, train_loss: 0.8764, test_loss: 1.0427, test_f1: 0.4721
 epoch: 65, train_loss: 0.8804, test_loss: 1.0448, test_f1: 0.4565
 epoch: 66, train_loss: 0.8854, test_loss: 1.0608, test_f1: 0.4723
 epoch: 67, train_loss: 0.8668, test_loss: 1.0343, test_f1: 0.4753
 epoch: 68, train_loss: 0.8700, test_loss: 1.0404, test_f1: 0.4826
 epoch: 69, train_loss: 0.8645, test_loss: 1.0423, test_f1: 0.4796
 epoch: 70, train_loss: 0.8605, test_loss: 1.0306, test_f1: 0.4982
 epoch: 71, train_loss: 0.8639, test_loss: 1.0485, test_f1: 0.4888
 epoch: 72, train_loss: 0.8647, test_loss: 1.0283, test_f1: 0.5126
 epoch: 73, train_loss: 0.8547, test_loss: 1.0312, test_f1: 0.5120
 epoch: 74, train_loss: 0.8518, test_loss: 1.0426, test_f1: 0.5044
 epoch: 75, train_loss: 0.8506, test_loss: 1.0342, test_f1: 0.5102
 epoch: 76, train_loss: 0.8521, test_loss: 1.0448, test_f1: 0.5110
 epoch: 77, train_loss: 0.8432, test_loss: 1.0343, test_f1: 0.5239
 epoch: 78, train_loss: 0.8484, test_loss: 1.0248, test_f1: 0.5280
 epoch: 79, train_loss: 0.8424, test_loss: 1.0334, test_f1: 0.5269
 epoch: 80, train_loss: 0.8377, test_loss: 1.0291, test_f1: 0.5220
 epoch: 81, train_loss: 0.8384, test_loss: 1.0331, test_f1: 0.5259
 epoch: 82, train_loss: 0.8290, test_loss: 1.0384, test_f1: 0.5260
 epoch: 83, train_loss: 0.8343, test_loss: 1.0242, test_f1: 0.5393
 epoch: 84, train_loss: 0.8375, test_loss: 1.0535, test_f1: 0.5039
 epoch: 85, train_loss: 0.8233, test_loss: 1.0333, test_f1: 0.5264
 epoch: 86, train_loss: 0.8303, test_loss: 1.0264, test_f1: 0.5397
 epoch: 87, train_loss: 0.8135, test_loss: 1.0283, test_f1: 0.5464
 epoch: 88, train_loss: 0.8119, test_loss: 1.0259, test_f1: 0.5552
 epoch: 89, train_loss: 0.8073, test_loss: 1.0368, test_f1: 0.5450
 epoch: 90, train_loss: 0.8063, test_loss: 1.0271, test_f1: 0.5555
 epoch: 91, train_loss: 0.8045, test_loss: 1.0312, test_f1: 0.5642
 epoch: 92, train_loss: 0.7969, test_loss: 1.0173, test_f1: 0.5622
 epoch: 93, train_loss: 0.7915, test_loss: 1.0253, test_f1: 0.5444
 epoch: 94, train_loss: 0.8038, test_loss: 1.0265, test_f1: 0.5551
 epoch: 95, train_loss: 0.7958, test_loss: 1.0279, test_f1: 0.5534
 epoch: 96, train_loss: 0.7912, test_loss: 1.0127, test_f1: 0.5473
 epoch: 97, train_loss: 0.7992, test_loss: 1.0219, test_f1: 0.5545
 epoch: 98, train_loss: 0.7939, test_loss: 1.0121, test_f1: 0.5482
 epoch: 99, train_loss: 0.7859, test_loss: 1.0158, test_f1: 0.5592
##################ITERATION #1 ****************************************
 epoch: 0, train_loss: 1.3584, test_loss: 1.3697, test_f1: 0.1365
 epoch: 1, train_loss: 1.3380, test_loss: 1.3607, test_f1: 0.1365
 epoch: 2, train_loss: 1.3237, test_loss: 1.3491, test_f1: 0.1365
 epoch: 3, train_loss: 1.3054, test_loss: 1.3354, test_f1: 0.3074
 epoch: 4, train_loss: 1.2900, test_loss: 1.3243, test_f1: 0.3348
 epoch: 5, train_loss: 1.2699, test_loss: 1.3111, test_f1: 0.3354
 epoch: 6, train_loss: 1.2519, test_loss: 1.2988, test_f1: 0.3414
 epoch: 7, train_loss: 1.2338, test_loss: 1.2887, test_f1: 0.3513
 epoch: 8, train_loss: 1.2166, test_loss: 1.2769, test_f1: 0.3512
 epoch: 9, train_loss: 1.2013, test_loss: 1.2661, test_f1: 0.3512
 epoch: 10, train_loss: 1.1920, test_loss: 1.2581, test_f1: 0.3512
 epoch: 11, train_loss: 1.1830, test_loss: 1.2501, test_f1: 0.3513
 epoch: 12, train_loss: 1.1694, test_loss: 1.2417, test_f1: 0.3515
 epoch: 13, train_loss: 1.1645, test_loss: 1.2387, test_f1: 0.3779
 epoch: 14, train_loss: 1.1568, test_loss: 1.2310, test_f1: 0.4044
 epoch: 15, train_loss: 1.1523, test_loss: 1.2259, test_f1: 0.4161
 epoch: 16, train_loss: 1.1389, test_loss: 1.2191, test_f1: 0.4483
 epoch: 17, train_loss: 1.1302, test_loss: 1.2119, test_f1: 0.4361
 epoch: 18, train_loss: 1.1188, test_loss: 1.2037, test_f1: 0.4479
 epoch: 19, train_loss: 1.1154, test_loss: 1.1938, test_f1: 0.4402
 epoch: 20, train_loss: 1.1092, test_loss: 1.1909, test_f1: 0.4410
 epoch: 21, train_loss: 1.0940, test_loss: 1.1916, test_f1: 0.4418
 epoch: 22, train_loss: 1.0858, test_loss: 1.1760, test_f1: 0.4419
 epoch: 23, train_loss: 1.0787, test_loss: 1.1689, test_f1: 0.4430
 epoch: 24, train_loss: 1.0751, test_loss: 1.1611, test_f1: 0.4450
 epoch: 25, train_loss: 1.0586, test_loss: 1.1515, test_f1: 0.4408
 epoch: 26, train_loss: 1.0518, test_loss: 1.1470, test_f1: 0.4417
 epoch: 27, train_loss: 1.0448, test_loss: 1.1331, test_f1: 0.4441
 epoch: 28, train_loss: 1.0393, test_loss: 1.1314, test_f1: 0.4458
 epoch: 29, train_loss: 1.0267, test_loss: 1.1288, test_f1: 0.4317
 epoch: 30, train_loss: 1.0142, test_loss: 1.1139, test_f1: 0.4435
 epoch: 31, train_loss: 1.0019, test_loss: 1.1020, test_f1: 0.4421
 epoch: 32, train_loss: 1.0040, test_loss: 1.0953, test_f1: 0.4402
 epoch: 33, train_loss: 0.9838, test_loss: 1.1169, test_f1: 0.4254
 epoch: 34, train_loss: 0.9753, test_loss: 1.0919, test_f1: 0.4328
 epoch: 35, train_loss: 0.9760, test_loss: 1.0888, test_f1: 0.4347
 epoch: 36, train_loss: 0.9676, test_loss: 1.1060, test_f1: 0.4353
 epoch: 37, train_loss: 0.9553, test_loss: 1.0895, test_f1: 0.4235
 epoch: 38, train_loss: 0.9510, test_loss: 1.0948, test_f1: 0.4316
 epoch: 39, train_loss: 0.9472, test_loss: 1.0743, test_f1: 0.4412
 epoch: 40, train_loss: 0.9382, test_loss: 1.0759, test_f1: 0.4367
 epoch: 41, train_loss: 0.9274, test_loss: 1.0688, test_f1: 0.4369
 epoch: 42, train_loss: 0.9200, test_loss: 1.0638, test_f1: 0.4474
 epoch: 43, train_loss: 0.9204, test_loss: 1.0745, test_f1: 0.4552
 epoch: 44, train_loss: 0.9054, test_loss: 1.0416, test_f1: 0.4881
 epoch: 45, train_loss: 0.9016, test_loss: 1.0505, test_f1: 0.4703
 epoch: 46, train_loss: 0.9013, test_loss: 1.0554, test_f1: 0.4761
 epoch: 47, train_loss: 0.8892, test_loss: 1.0661, test_f1: 0.4893
 epoch: 48, train_loss: 0.8854, test_loss: 1.0625, test_f1: 0.4572
 epoch: 49, train_loss: 0.9006, test_loss: 1.0473, test_f1: 0.5189
 epoch: 50, train_loss: 0.8862, test_loss: 1.0631, test_f1: 0.4959
 epoch: 51, train_loss: 0.8707, test_loss: 1.0669, test_f1: 0.4948
 epoch: 52, train_loss: 0.8679, test_loss: 1.0587, test_f1: 0.4835
 epoch: 53, train_loss: 0.8676, test_loss: 1.0552, test_f1: 0.4955
 epoch: 54, train_loss: 0.8566, test_loss: 1.0513, test_f1: 0.5097
 epoch: 55, train_loss: 0.8548, test_loss: 1.0732, test_f1: 0.5183
 epoch: 56, train_loss: 0.8600, test_loss: 1.0638, test_f1: 0.4938
 epoch: 57, train_loss: 0.8541, test_loss: 1.0638, test_f1: 0.5326
 epoch: 58, train_loss: 0.8489, test_loss: 1.0670, test_f1: 0.5211
 epoch: 59, train_loss: 0.8473, test_loss: 1.0699, test_f1: 0.5076
 epoch: 60, train_loss: 0.8551, test_loss: 1.0632, test_f1: 0.5179
 epoch: 61, train_loss: 0.8404, test_loss: 1.0575, test_f1: 0.5184
 epoch: 62, train_loss: 0.8356, test_loss: 1.0674, test_f1: 0.5201
 epoch: 63, train_loss: 0.8388, test_loss: 1.0684, test_f1: 0.5244
 epoch: 64, train_loss: 0.8334, test_loss: 1.0835, test_f1: 0.5111
 epoch: 65, train_loss: 0.8404, test_loss: 1.0804, test_f1: 0.5158
 epoch: 66, train_loss: 0.8233, test_loss: 1.0705, test_f1: 0.5172
 epoch: 67, train_loss: 0.8299, test_loss: 1.0560, test_f1: 0.5427
 epoch: 68, train_loss: 0.8170, test_loss: 1.0723, test_f1: 0.5092
 epoch: 69, train_loss: 0.8280, test_loss: 1.0811, test_f1: 0.5290
 epoch: 70, train_loss: 0.8208, test_loss: 1.0711, test_f1: 0.5363
 epoch: 71, train_loss: 0.8225, test_loss: 1.0564, test_f1: 0.5488
 epoch: 72, train_loss: 0.8190, test_loss: 1.0745, test_f1: 0.5225
 epoch: 73, train_loss: 0.8201, test_loss: 1.0930, test_f1: 0.5214
 epoch: 74, train_loss: 0.8118, test_loss: 1.0883, test_f1: 0.5184
 epoch: 75, train_loss: 0.8124, test_loss: 1.0589, test_f1: 0.5402
 epoch: 76, train_loss: 0.8027, test_loss: 1.0761, test_f1: 0.5302
 epoch: 77, train_loss: 0.8049, test_loss: 1.0933, test_f1: 0.5216
 epoch: 78, train_loss: 0.8108, test_loss: 1.0724, test_f1: 0.5284
 epoch: 79, train_loss: 0.8055, test_loss: 1.0727, test_f1: 0.5468
 epoch: 80, train_loss: 0.7976, test_loss: 1.0764, test_f1: 0.5403
 epoch: 81, train_loss: 0.8001, test_loss: 1.0821, test_f1: 0.5451
 epoch: 82, train_loss: 0.7929, test_loss: 1.0760, test_f1: 0.5507
 epoch: 83, train_loss: 0.7958, test_loss: 1.0810, test_f1: 0.5445
 epoch: 84, train_loss: 0.7895, test_loss: 1.0818, test_f1: 0.5355
 epoch: 85, train_loss: 0.7911, test_loss: 1.0702, test_f1: 0.5467
 epoch: 86, train_loss: 0.7803, test_loss: 1.0992, test_f1: 0.5468
 epoch: 87, train_loss: 0.7706, test_loss: 1.0905, test_f1: 0.5439
 epoch: 88, train_loss: 0.7751, test_loss: 1.0778, test_f1: 0.5564
 epoch: 89, train_loss: 0.7826, test_loss: 1.0812, test_f1: 0.5573
 epoch: 90, train_loss: 0.7733, test_loss: 1.0756, test_f1: 0.5348
 epoch: 91, train_loss: 0.7793, test_loss: 1.0652, test_f1: 0.5339
 epoch: 92, train_loss: 0.7709, test_loss: 1.0937, test_f1: 0.5304
 epoch: 93, train_loss: 0.7798, test_loss: 1.0991, test_f1: 0.5406
 epoch: 94, train_loss: 0.7669, test_loss: 1.0644, test_f1: 0.5389
 epoch: 95, train_loss: 0.7685, test_loss: 1.0742, test_f1: 0.5438
 epoch: 96, train_loss: 0.7631, test_loss: 1.0960, test_f1: 0.5407
 epoch: 97, train_loss: 0.7623, test_loss: 1.0597, test_f1: 0.5522
 epoch: 98, train_loss: 0.7539, test_loss: 1.0626, test_f1: 0.5525
 epoch: 99, train_loss: 0.7567, test_loss: 1.0677, test_f1: 0.5458
##################ITERATION #2 ****************************************
 epoch: 0, train_loss: 1.3417, test_loss: 1.3610, test_f1: 0.1365
 epoch: 1, train_loss: 1.3094, test_loss: 1.3512, test_f1: 0.1365
 epoch: 2, train_loss: 1.2919, test_loss: 1.3428, test_f1: 0.1365
 epoch: 3, train_loss: 1.2749, test_loss: 1.3341, test_f1: 0.1365
 epoch: 4, train_loss: 1.2565, test_loss: 1.3175, test_f1: 0.1365
 epoch: 5, train_loss: 1.2421, test_loss: 1.2990, test_f1: 0.1485
 epoch: 6, train_loss: 1.2231, test_loss: 1.2817, test_f1: 0.1770
 epoch: 7, train_loss: 1.2092, test_loss: 1.2671, test_f1: 0.2325
 epoch: 8, train_loss: 1.1889, test_loss: 1.2550, test_f1: 0.3393
 epoch: 9, train_loss: 1.1781, test_loss: 1.2396, test_f1: 0.4404
 epoch: 10, train_loss: 1.1638, test_loss: 1.2279, test_f1: 0.4377
 epoch: 11, train_loss: 1.1467, test_loss: 1.2130, test_f1: 0.4315
 epoch: 12, train_loss: 1.1306, test_loss: 1.1988, test_f1: 0.3894
 epoch: 13, train_loss: 1.1213, test_loss: 1.1850, test_f1: 0.3707
 epoch: 14, train_loss: 1.0977, test_loss: 1.1694, test_f1: 0.3754
 epoch: 15, train_loss: 1.0844, test_loss: 1.1527, test_f1: 0.3718
 epoch: 16, train_loss: 1.0710, test_loss: 1.1411, test_f1: 0.3743
 epoch: 17, train_loss: 1.0573, test_loss: 1.1258, test_f1: 0.3766
 epoch: 18, train_loss: 1.0421, test_loss: 1.1160, test_f1: 0.3650
 epoch: 19, train_loss: 1.0314, test_loss: 1.1086, test_f1: 0.3848
 epoch: 20, train_loss: 1.0236, test_loss: 1.1041, test_f1: 0.3705
 epoch: 21, train_loss: 1.0147, test_loss: 1.0908, test_f1: 0.3773
 epoch: 22, train_loss: 0.9960, test_loss: 1.0841, test_f1: 0.3858
 epoch: 23, train_loss: 0.9948, test_loss: 1.0742, test_f1: 0.4044
 epoch: 24, train_loss: 0.9773, test_loss: 1.0661, test_f1: 0.3988
 epoch: 25, train_loss: 0.9724, test_loss: 1.0702, test_f1: 0.3829
 epoch: 26, train_loss: 0.9597, test_loss: 1.0542, test_f1: 0.4085
 epoch: 27, train_loss: 0.9508, test_loss: 1.0466, test_f1: 0.4312
 epoch: 28, train_loss: 0.9434, test_loss: 1.0491, test_f1: 0.4724
 epoch: 29, train_loss: 0.9353, test_loss: 1.0319, test_f1: 0.4730
 epoch: 30, train_loss: 0.9274, test_loss: 1.0242, test_f1: 0.4845
 epoch: 31, train_loss: 0.9229, test_loss: 1.0402, test_f1: 0.4733
 epoch: 32, train_loss: 0.9100, test_loss: 1.0174, test_f1: 0.4979
 epoch: 33, train_loss: 0.9065, test_loss: 1.0285, test_f1: 0.4952
 epoch: 34, train_loss: 0.8983, test_loss: 1.0211, test_f1: 0.4915
 epoch: 35, train_loss: 0.8893, test_loss: 1.0038, test_f1: 0.5150
 epoch: 36, train_loss: 0.8943, test_loss: 0.9899, test_f1: 0.5238
 epoch: 37, train_loss: 0.8804, test_loss: 0.9866, test_f1: 0.5291
 epoch: 38, train_loss: 0.8684, test_loss: 0.9911, test_f1: 0.5169
 epoch: 39, train_loss: 0.8623, test_loss: 0.9961, test_f1: 0.5131
 epoch: 40, train_loss: 0.8598, test_loss: 1.0178, test_f1: 0.5141
 epoch: 41, train_loss: 0.8425, test_loss: 0.9864, test_f1: 0.5185
 epoch: 42, train_loss: 0.8374, test_loss: 0.9855, test_f1: 0.5449
 epoch: 43, train_loss: 0.8262, test_loss: 0.9768, test_f1: 0.5709
 epoch: 44, train_loss: 0.8222, test_loss: 0.9618, test_f1: 0.5716
 epoch: 45, train_loss: 0.8173, test_loss: 0.9892, test_f1: 0.5628
 epoch: 46, train_loss: 0.8161, test_loss: 0.9712, test_f1: 0.5634
 epoch: 47, train_loss: 0.7998, test_loss: 0.9840, test_f1: 0.5321
 epoch: 48, train_loss: 0.7852, test_loss: 0.9774, test_f1: 0.5581
 epoch: 49, train_loss: 0.7926, test_loss: 0.9790, test_f1: 0.5687
 epoch: 50, train_loss: 0.7833, test_loss: 0.9634, test_f1: 0.5626
 epoch: 51, train_loss: 0.7763, test_loss: 0.9567, test_f1: 0.5849
 epoch: 52, train_loss: 0.7735, test_loss: 0.9614, test_f1: 0.5885
 epoch: 53, train_loss: 0.7702, test_loss: 0.9693, test_f1: 0.5599
 epoch: 54, train_loss: 0.7659, test_loss: 0.9660, test_f1: 0.5634
 epoch: 55, train_loss: 0.7644, test_loss: 0.9704, test_f1: 0.5818
 epoch: 56, train_loss: 0.7547, test_loss: 0.9717, test_f1: 0.5809
 epoch: 57, train_loss: 0.7502, test_loss: 0.9785, test_f1: 0.5685
 epoch: 58, train_loss: 0.7536, test_loss: 0.9826, test_f1: 0.5689
 epoch: 59, train_loss: 0.7560, test_loss: 0.9829, test_f1: 0.5866
 epoch: 60, train_loss: 0.7452, test_loss: 0.9721, test_f1: 0.5861
 epoch: 61, train_loss: 0.7452, test_loss: 0.9676, test_f1: 0.5942
 epoch: 62, train_loss: 0.7420, test_loss: 0.9679, test_f1: 0.5819
 epoch: 63, train_loss: 0.7399, test_loss: 0.9558, test_f1: 0.5869
 epoch: 64, train_loss: 0.7316, test_loss: 0.9619, test_f1: 0.5887
 epoch: 65, train_loss: 0.7280, test_loss: 0.9642, test_f1: 0.5874
 epoch: 66, train_loss: 0.7344, test_loss: 0.9783, test_f1: 0.5629
 epoch: 67, train_loss: 0.7415, test_loss: 0.9657, test_f1: 0.5660
 epoch: 68, train_loss: 0.7254, test_loss: 0.9806, test_f1: 0.5707
 epoch: 69, train_loss: 0.7208, test_loss: 0.9691, test_f1: 0.5906
 epoch: 70, train_loss: 0.7290, test_loss: 0.9620, test_f1: 0.5945
 epoch: 71, train_loss: 0.7152, test_loss: 0.9675, test_f1: 0.5826
 epoch: 72, train_loss: 0.7195, test_loss: 0.9738, test_f1: 0.5889
 epoch: 73, train_loss: 0.7179, test_loss: 0.9727, test_f1: 0.5770
 epoch: 74, train_loss: 0.7154, test_loss: 0.9744, test_f1: 0.5679
 epoch: 75, train_loss: 0.7146, test_loss: 0.9736, test_f1: 0.5663
 epoch: 76, train_loss: 0.7006, test_loss: 0.9788, test_f1: 0.5624
 epoch: 77, train_loss: 0.7046, test_loss: 0.9876, test_f1: 0.5613
 epoch: 78, train_loss: 0.7030, test_loss: 0.9813, test_f1: 0.5667
 epoch: 79, train_loss: 0.7107, test_loss: 0.9892, test_f1: 0.5732
 epoch: 80, train_loss: 0.6935, test_loss: 0.9954, test_f1: 0.5792
 epoch: 81, train_loss: 0.6976, test_loss: 0.9741, test_f1: 0.5739
 epoch: 82, train_loss: 0.7032, test_loss: 0.9847, test_f1: 0.5577
 epoch: 83, train_loss: 0.6984, test_loss: 0.9875, test_f1: 0.5595
 epoch: 84, train_loss: 0.6822, test_loss: 1.0062, test_f1: 0.5475
 epoch: 85, train_loss: 0.6894, test_loss: 1.0063, test_f1: 0.5680
 epoch: 86, train_loss: 0.6865, test_loss: 0.9854, test_f1: 0.5774
 epoch: 87, train_loss: 0.6854, test_loss: 0.9697, test_f1: 0.5874
 epoch: 88, train_loss: 0.6812, test_loss: 0.9687, test_f1: 0.5817
 epoch: 89, train_loss: 0.6797, test_loss: 0.9798, test_f1: 0.5852
 epoch: 90, train_loss: 0.6845, test_loss: 0.9860, test_f1: 0.5817
 epoch: 91, train_loss: 0.6990, test_loss: 0.9625, test_f1: 0.5457
 epoch: 92, train_loss: 0.6816, test_loss: 0.9832, test_f1: 0.5584
 epoch: 93, train_loss: 0.6841, test_loss: 0.9828, test_f1: 0.5712
 epoch: 94, train_loss: 0.6731, test_loss: 0.9893, test_f1: 0.5950
 epoch: 95, train_loss: 0.6805, test_loss: 0.9890, test_f1: 0.5846
 epoch: 96, train_loss: 0.6599, test_loss: 1.0041, test_f1: 0.5695
 epoch: 97, train_loss: 0.6646, test_loss: 0.9923, test_f1: 0.5784
 epoch: 98, train_loss: 0.6610, test_loss: 1.0017, test_f1: 0.5820
 epoch: 99, train_loss: 0.6646, test_loss: 0.9956, test_f1: 0.5864
##################ITERATION #3 ****************************************
 epoch: 0, train_loss: 1.2964, test_loss: 1.3184, test_f1: 0.1365
 epoch: 1, train_loss: 1.2533, test_loss: 1.3072, test_f1: 0.1365
 epoch: 2, train_loss: 1.2361, test_loss: 1.3064, test_f1: 0.1835
 epoch: 3, train_loss: 1.2191, test_loss: 1.2902, test_f1: 0.1537
 epoch: 4, train_loss: 1.2003, test_loss: 1.2690, test_f1: 0.3145
 epoch: 5, train_loss: 1.1861, test_loss: 1.2516, test_f1: 0.3958
 epoch: 6, train_loss: 1.1712, test_loss: 1.2370, test_f1: 0.4227
 epoch: 7, train_loss: 1.1575, test_loss: 1.2238, test_f1: 0.4052
 epoch: 8, train_loss: 1.1443, test_loss: 1.2109, test_f1: 0.3864
 epoch: 9, train_loss: 1.1267, test_loss: 1.1937, test_f1: 0.3908
 epoch: 10, train_loss: 1.1119, test_loss: 1.1788, test_f1: 0.4079
 epoch: 11, train_loss: 1.1007, test_loss: 1.1713, test_f1: 0.3994
 epoch: 12, train_loss: 1.0861, test_loss: 1.1670, test_f1: 0.3886
 epoch: 13, train_loss: 1.0723, test_loss: 1.1510, test_f1: 0.3816
 epoch: 14, train_loss: 1.0648, test_loss: 1.1424, test_f1: 0.3927
 epoch: 15, train_loss: 1.0484, test_loss: 1.1347, test_f1: 0.3996
 epoch: 16, train_loss: 1.0403, test_loss: 1.1318, test_f1: 0.3868
 epoch: 17, train_loss: 1.0234, test_loss: 1.1164, test_f1: 0.3900
 epoch: 18, train_loss: 1.0180, test_loss: 1.1122, test_f1: 0.3958
 epoch: 19, train_loss: 1.0116, test_loss: 1.1072, test_f1: 0.3830
 epoch: 20, train_loss: 0.9995, test_loss: 1.0944, test_f1: 0.4103
 epoch: 21, train_loss: 0.9903, test_loss: 1.0911, test_f1: 0.4277
 epoch: 22, train_loss: 0.9749, test_loss: 1.0912, test_f1: 0.4476
 epoch: 23, train_loss: 0.9621, test_loss: 1.0865, test_f1: 0.4491
 epoch: 24, train_loss: 0.9603, test_loss: 1.0827, test_f1: 0.4658
 epoch: 25, train_loss: 0.9522, test_loss: 1.0675, test_f1: 0.4956
 epoch: 26, train_loss: 0.9452, test_loss: 1.0577, test_f1: 0.4856
 epoch: 27, train_loss: 0.9294, test_loss: 1.0448, test_f1: 0.4989
 epoch: 28, train_loss: 0.9199, test_loss: 1.0451, test_f1: 0.5019
 epoch: 29, train_loss: 0.9136, test_loss: 1.0366, test_f1: 0.5000
 epoch: 30, train_loss: 0.9138, test_loss: 1.0249, test_f1: 0.5188
 epoch: 31, train_loss: 0.9015, test_loss: 1.0327, test_f1: 0.5184
 epoch: 32, train_loss: 0.8891, test_loss: 1.0298, test_f1: 0.5115
 epoch: 33, train_loss: 0.8837, test_loss: 1.0021, test_f1: 0.5431
 epoch: 34, train_loss: 0.8724, test_loss: 1.0189, test_f1: 0.5314
 epoch: 35, train_loss: 0.8692, test_loss: 1.0091, test_f1: 0.5271
 epoch: 36, train_loss: 0.8585, test_loss: 0.9959, test_f1: 0.5334
 epoch: 37, train_loss: 0.8563, test_loss: 0.9849, test_f1: 0.5359
 epoch: 38, train_loss: 0.8378, test_loss: 0.9835, test_f1: 0.5306
 epoch: 39, train_loss: 0.8385, test_loss: 0.9808, test_f1: 0.5335
 epoch: 40, train_loss: 0.8186, test_loss: 0.9714, test_f1: 0.5571
 epoch: 41, train_loss: 0.8265, test_loss: 0.9621, test_f1: 0.5550
 epoch: 42, train_loss: 0.8158, test_loss: 0.9748, test_f1: 0.5642
 epoch: 43, train_loss: 0.8051, test_loss: 0.9924, test_f1: 0.5457
 epoch: 44, train_loss: 0.7945, test_loss: 0.9874, test_f1: 0.5555
 epoch: 45, train_loss: 0.7973, test_loss: 0.9700, test_f1: 0.5589
 epoch: 46, train_loss: 0.7853, test_loss: 1.0110, test_f1: 0.5679
 epoch: 47, train_loss: 0.7826, test_loss: 1.0126, test_f1: 0.5441
 epoch: 48, train_loss: 0.7694, test_loss: 0.9749, test_f1: 0.5614
 epoch: 49, train_loss: 0.7710, test_loss: 1.0421, test_f1: 0.5595
 epoch: 50, train_loss: 0.7637, test_loss: 1.0252, test_f1: 0.5550
 epoch: 51, train_loss: 0.7653, test_loss: 1.0606, test_f1: 0.5463
 epoch: 52, train_loss: 0.7595, test_loss: 0.9934, test_f1: 0.5621
 epoch: 53, train_loss: 0.7525, test_loss: 0.9873, test_f1: 0.5757
 epoch: 54, train_loss: 0.7463, test_loss: 0.9904, test_f1: 0.5722
 epoch: 55, train_loss: 0.7291, test_loss: 1.0640, test_f1: 0.5653
 epoch: 56, train_loss: 0.7293, test_loss: 1.0451, test_f1: 0.5707
 epoch: 57, train_loss: 0.7374, test_loss: 1.0321, test_f1: 0.5755
 epoch: 58, train_loss: 0.7345, test_loss: 1.0774, test_f1: 0.5756
 epoch: 59, train_loss: 0.7331, test_loss: 1.0537, test_f1: 0.5902
 epoch: 60, train_loss: 0.7280, test_loss: 1.0125, test_f1: 0.5704
 epoch: 61, train_loss: 0.7161, test_loss: 0.9770, test_f1: 0.5858
 epoch: 62, train_loss: 0.7238, test_loss: 0.9949, test_f1: 0.5682
 epoch: 63, train_loss: 0.7134, test_loss: 0.9718, test_f1: 0.5836
 epoch: 64, train_loss: 0.7187, test_loss: 0.9769, test_f1: 0.5820
 epoch: 65, train_loss: 0.7220, test_loss: 0.9758, test_f1: 0.6020
 epoch: 66, train_loss: 0.6984, test_loss: 0.9742, test_f1: 0.5834
 epoch: 67, train_loss: 0.7031, test_loss: 0.9600, test_f1: 0.5898
 epoch: 68, train_loss: 0.6926, test_loss: 0.9665, test_f1: 0.5848
 epoch: 69, train_loss: 0.7018, test_loss: 0.9622, test_f1: 0.5831
 epoch: 70, train_loss: 0.6895, test_loss: 0.9693, test_f1: 0.6114
 epoch: 71, train_loss: 0.6920, test_loss: 0.9777, test_f1: 0.5873
 epoch: 72, train_loss: 0.6957, test_loss: 0.9732, test_f1: 0.5984
 epoch: 73, train_loss: 0.6971, test_loss: 0.9673, test_f1: 0.5946
 epoch: 74, train_loss: 0.6881, test_loss: 1.0010, test_f1: 0.5839
 epoch: 75, train_loss: 0.7052, test_loss: 0.9732, test_f1: 0.6020
 epoch: 76, train_loss: 0.6940, test_loss: 0.9760, test_f1: 0.6074
 epoch: 77, train_loss: 0.6831, test_loss: 0.9834, test_f1: 0.6048
 epoch: 78, train_loss: 0.6793, test_loss: 0.9889, test_f1: 0.5981
 epoch: 79, train_loss: 0.6940, test_loss: 1.0219, test_f1: 0.5739
 epoch: 80, train_loss: 0.6805, test_loss: 0.9926, test_f1: 0.6030
 epoch: 81, train_loss: 0.6826, test_loss: 1.0012, test_f1: 0.5841
 epoch: 82, train_loss: 0.6778, test_loss: 0.9961, test_f1: 0.5907
 epoch: 83, train_loss: 0.6716, test_loss: 0.9914, test_f1: 0.5871
 epoch: 84, train_loss: 0.6675, test_loss: 1.0068, test_f1: 0.5703
 epoch: 85, train_loss: 0.6661, test_loss: 0.9966, test_f1: 0.5873
 epoch: 86, train_loss: 0.6590, test_loss: 0.9879, test_f1: 0.5961
 epoch: 87, train_loss: 0.6690, test_loss: 0.9928, test_f1: 0.5935
 epoch: 88, train_loss: 0.6693, test_loss: 0.9985, test_f1: 0.5941
 epoch: 89, train_loss: 0.6625, test_loss: 1.0152, test_f1: 0.6029
 epoch: 90, train_loss: 0.6565, test_loss: 0.9823, test_f1: 0.6135
 epoch: 91, train_loss: 0.6576, test_loss: 0.9903, test_f1: 0.5934
 epoch: 92, train_loss: 0.6570, test_loss: 0.9941, test_f1: 0.5851
 epoch: 93, train_loss: 0.6552, test_loss: 1.0019, test_f1: 0.5827
 epoch: 94, train_loss: 0.6565, test_loss: 0.9899, test_f1: 0.6083
 epoch: 95, train_loss: 0.6406, test_loss: 0.9930, test_f1: 0.6078
 epoch: 96, train_loss: 0.6494, test_loss: 1.0142, test_f1: 0.5923
 epoch: 97, train_loss: 0.6417, test_loss: 1.0138, test_f1: 0.5815
 epoch: 98, train_loss: 0.6445, test_loss: 1.0123, test_f1: 0.5769
 epoch: 99, train_loss: 0.6438, test_loss: 1.0048, test_f1: 0.5923
##################ITERATION #4 ****************************************
 epoch: 0, train_loss: 1.2851, test_loss: 1.3309, test_f1: 0.2281
 epoch: 1, train_loss: 1.2432, test_loss: 1.3150, test_f1: 0.2281
 epoch: 2, train_loss: 1.2149, test_loss: 1.3030, test_f1: 0.2281
 epoch: 3, train_loss: 1.2057, test_loss: 1.2885, test_f1: 0.2281
 epoch: 4, train_loss: 1.1856, test_loss: 1.2705, test_f1: 0.2533
 epoch: 5, train_loss: 1.1706, test_loss: 1.2571, test_f1: 0.3440
 epoch: 6, train_loss: 1.1561, test_loss: 1.2497, test_f1: 0.3819
 epoch: 7, train_loss: 1.1403, test_loss: 1.2325, test_f1: 0.3788
 epoch: 8, train_loss: 1.1267, test_loss: 1.2128, test_f1: 0.3818
 epoch: 9, train_loss: 1.1175, test_loss: 1.2085, test_f1: 0.4129
 epoch: 10, train_loss: 1.1123, test_loss: 1.1923, test_f1: 0.4196
 epoch: 11, train_loss: 1.0912, test_loss: 1.1887, test_f1: 0.4203
 epoch: 12, train_loss: 1.0825, test_loss: 1.1680, test_f1: 0.4222
 epoch: 13, train_loss: 1.0629, test_loss: 1.1618, test_f1: 0.4748
 epoch: 14, train_loss: 1.0531, test_loss: 1.1479, test_f1: 0.4731
 epoch: 15, train_loss: 1.0428, test_loss: 1.1501, test_f1: 0.4611
 epoch: 16, train_loss: 1.0280, test_loss: 1.1459, test_f1: 0.4662
 epoch: 17, train_loss: 1.0221, test_loss: 1.1407, test_f1: 0.4818
 epoch: 18, train_loss: 1.0083, test_loss: 1.1267, test_f1: 0.4777
 epoch: 19, train_loss: 0.9890, test_loss: 1.1070, test_f1: 0.4824
 epoch: 20, train_loss: 0.9842, test_loss: 1.1098, test_f1: 0.4847
 epoch: 21, train_loss: 0.9730, test_loss: 1.1205, test_f1: 0.4818
 epoch: 22, train_loss: 0.9639, test_loss: 1.1101, test_f1: 0.4947
 epoch: 23, train_loss: 0.9479, test_loss: 1.0971, test_f1: 0.4941
 epoch: 24, train_loss: 0.9411, test_loss: 1.0999, test_f1: 0.5029
 epoch: 25, train_loss: 0.9471, test_loss: 1.0756, test_f1: 0.5099
 epoch: 26, train_loss: 0.9262, test_loss: 1.0923, test_f1: 0.4978
 epoch: 27, train_loss: 0.9262, test_loss: 1.0770, test_f1: 0.5049
 epoch: 28, train_loss: 0.8985, test_loss: 1.0791, test_f1: 0.5106
 epoch: 29, train_loss: 0.9042, test_loss: 1.0721, test_f1: 0.5081
 epoch: 30, train_loss: 0.8924, test_loss: 1.0995, test_f1: 0.5182
 epoch: 31, train_loss: 0.8824, test_loss: 1.0634, test_f1: 0.5274
 epoch: 32, train_loss: 0.8825, test_loss: 1.0780, test_f1: 0.5179
 epoch: 33, train_loss: 0.8716, test_loss: 1.0722, test_f1: 0.5341
 epoch: 34, train_loss: 0.8684, test_loss: 1.0555, test_f1: 0.5278
 epoch: 35, train_loss: 0.8619, test_loss: 1.0704, test_f1: 0.5274
 epoch: 36, train_loss: 0.8503, test_loss: 1.0740, test_f1: 0.5156
 epoch: 37, train_loss: 0.8438, test_loss: 1.0795, test_f1: 0.5227
 epoch: 38, train_loss: 0.8371, test_loss: 1.1051, test_f1: 0.5083
 epoch: 39, train_loss: 0.8293, test_loss: 1.0912, test_f1: 0.5184
 epoch: 40, train_loss: 0.8196, test_loss: 1.0612, test_f1: 0.5302
 epoch: 41, train_loss: 0.8143, test_loss: 1.0553, test_f1: 0.5425
 epoch: 42, train_loss: 0.8012, test_loss: 1.0620, test_f1: 0.5526
 epoch: 43, train_loss: 0.8073, test_loss: 1.0713, test_f1: 0.5403
 epoch: 44, train_loss: 0.8009, test_loss: 1.0716, test_f1: 0.5314
 epoch: 45, train_loss: 0.8026, test_loss: 1.0569, test_f1: 0.5396
 epoch: 46, train_loss: 0.7918, test_loss: 1.0755, test_f1: 0.5307
 epoch: 47, train_loss: 0.7862, test_loss: 1.0625, test_f1: 0.5421
 epoch: 48, train_loss: 0.7744, test_loss: 1.0727, test_f1: 0.5365
 epoch: 49, train_loss: 0.7712, test_loss: 1.0896, test_f1: 0.5481
 epoch: 50, train_loss: 0.7542, test_loss: 1.0927, test_f1: 0.5425
 epoch: 51, train_loss: 0.7542, test_loss: 1.0885, test_f1: 0.5401
 epoch: 52, train_loss: 0.7528, test_loss: 1.0899, test_f1: 0.5463
 epoch: 53, train_loss: 0.7430, test_loss: 1.0996, test_f1: 0.5506
 epoch: 54, train_loss: 0.7489, test_loss: 1.1078, test_f1: 0.5433
 epoch: 55, train_loss: 0.7503, test_loss: 1.1122, test_f1: 0.5525
 epoch: 56, train_loss: 0.7459, test_loss: 1.1249, test_f1: 0.5461
 epoch: 57, train_loss: 0.7295, test_loss: 1.0987, test_f1: 0.5613
 epoch: 58, train_loss: 0.7419, test_loss: 1.1001, test_f1: 0.5558
 epoch: 59, train_loss: 0.7477, test_loss: 1.1200, test_f1: 0.5442
 epoch: 60, train_loss: 0.7456, test_loss: 1.1028, test_f1: 0.5453
 epoch: 61, train_loss: 0.7238, test_loss: 1.1048, test_f1: 0.5583
 epoch: 62, train_loss: 0.7172, test_loss: 1.1193, test_f1: 0.5500
 epoch: 63, train_loss: 0.7300, test_loss: 1.1239, test_f1: 0.5441
 epoch: 64, train_loss: 0.7216, test_loss: 1.1420, test_f1: 0.5373
 epoch: 65, train_loss: 0.7044, test_loss: 1.1198, test_f1: 0.5556
 epoch: 66, train_loss: 0.7177, test_loss: 1.1119, test_f1: 0.5362
 epoch: 67, train_loss: 0.7129, test_loss: 1.1070, test_f1: 0.5386
 epoch: 68, train_loss: 0.7157, test_loss: 1.1133, test_f1: 0.5433
 epoch: 69, train_loss: 0.7053, test_loss: 1.1251, test_f1: 0.5435
 epoch: 70, train_loss: 0.7012, test_loss: 1.1273, test_f1: 0.5317
 epoch: 71, train_loss: 0.7130, test_loss: 1.1286, test_f1: 0.5211
 epoch: 72, train_loss: 0.7071, test_loss: 1.1192, test_f1: 0.5581
 epoch: 73, train_loss: 0.7009, test_loss: 1.1272, test_f1: 0.5577
 epoch: 74, train_loss: 0.6883, test_loss: 1.1319, test_f1: 0.5503
 epoch: 75, train_loss: 0.6885, test_loss: 1.1355, test_f1: 0.5675
 epoch: 76, train_loss: 0.6870, test_loss: 1.1613, test_f1: 0.5222
 epoch: 77, train_loss: 0.6969, test_loss: 1.1525, test_f1: 0.5614
 epoch: 78, train_loss: 0.6862, test_loss: 1.1574, test_f1: 0.5429
 epoch: 79, train_loss: 0.6941, test_loss: 1.1614, test_f1: 0.5445
 epoch: 80, train_loss: 0.6799, test_loss: 1.1399, test_f1: 0.5614
 epoch: 81, train_loss: 0.6750, test_loss: 1.2102, test_f1: 0.5057
 epoch: 82, train_loss: 0.6815, test_loss: 1.2147, test_f1: 0.5308
 epoch: 83, train_loss: 0.6884, test_loss: 1.1576, test_f1: 0.5455
 epoch: 84, train_loss: 0.6745, test_loss: 1.1625, test_f1: 0.5508
 epoch: 85, train_loss: 0.6737, test_loss: 1.1521, test_f1: 0.5588
 epoch: 86, train_loss: 0.6708, test_loss: 1.1572, test_f1: 0.5542
 epoch: 87, train_loss: 0.6706, test_loss: 1.1829, test_f1: 0.5165
 epoch: 88, train_loss: 0.6822, test_loss: 1.1839, test_f1: 0.5444
 epoch: 89, train_loss: 0.6744, test_loss: 1.1685, test_f1: 0.5414
 epoch: 90, train_loss: 0.6644, test_loss: 1.1824, test_f1: 0.5362
 epoch: 91, train_loss: 0.6542, test_loss: 1.1845, test_f1: 0.5509
 epoch: 92, train_loss: 0.6763, test_loss: 1.2074, test_f1: 0.5298
 epoch: 93, train_loss: 0.6753, test_loss: 1.2016, test_f1: 0.5308
 epoch: 94, train_loss: 0.6724, test_loss: 1.1796, test_f1: 0.5476
 epoch: 95, train_loss: 0.6523, test_loss: 1.1865, test_f1: 0.5432
 epoch: 96, train_loss: 0.6557, test_loss: 1.1690, test_f1: 0.5558
 epoch: 97, train_loss: 0.6620, test_loss: 1.1848, test_f1: 0.5460
 epoch: 98, train_loss: 0.6660, test_loss: 1.1678, test_f1: 0.5383
 epoch: 99, train_loss: 0.6540, test_loss: 1.1807, test_f1: 0.5530
##################ITERATION #5 ****************************************
 epoch: 0, train_loss: 1.2508, test_loss: 1.3054, test_f1: 0.2281
 epoch: 1, train_loss: 1.2125, test_loss: 1.3011, test_f1: 0.2281
 epoch: 2, train_loss: 1.1953, test_loss: 1.2933, test_f1: 0.2281
 epoch: 3, train_loss: 1.1817, test_loss: 1.2769, test_f1: 0.2270
 epoch: 4, train_loss: 1.1668, test_loss: 1.2563, test_f1: 0.2525
 epoch: 5, train_loss: 1.1543, test_loss: 1.2210, test_f1: 0.3102
 epoch: 6, train_loss: 1.1346, test_loss: 1.1905, test_f1: 0.4022
 epoch: 7, train_loss: 1.1256, test_loss: 1.1912, test_f1: 0.4433
 epoch: 8, train_loss: 1.1115, test_loss: 1.1766, test_f1: 0.4537
 epoch: 9, train_loss: 1.1035, test_loss: 1.1629, test_f1: 0.4634
 epoch: 10, train_loss: 1.0925, test_loss: 1.1571, test_f1: 0.4996
 epoch: 11, train_loss: 1.0690, test_loss: 1.1422, test_f1: 0.5062
 epoch: 12, train_loss: 1.0608, test_loss: 1.1238, test_f1: 0.5184
 epoch: 13, train_loss: 1.0386, test_loss: 1.1144, test_f1: 0.5249
 epoch: 14, train_loss: 1.0297, test_loss: 1.1095, test_f1: 0.5173
 epoch: 15, train_loss: 1.0222, test_loss: 1.0988, test_f1: 0.5208
 epoch: 16, train_loss: 1.0052, test_loss: 1.0977, test_f1: 0.5252
 epoch: 17, train_loss: 0.9981, test_loss: 1.0929, test_f1: 0.5359
 epoch: 18, train_loss: 0.9852, test_loss: 1.0710, test_f1: 0.5449
 epoch: 19, train_loss: 0.9625, test_loss: 1.0574, test_f1: 0.5402
 epoch: 20, train_loss: 0.9663, test_loss: 1.0626, test_f1: 0.5494
 epoch: 21, train_loss: 0.9472, test_loss: 1.0626, test_f1: 0.5378
 epoch: 22, train_loss: 0.9448, test_loss: 1.0558, test_f1: 0.5436
 epoch: 23, train_loss: 0.9365, test_loss: 1.0509, test_f1: 0.5365
 epoch: 24, train_loss: 0.9240, test_loss: 1.0247, test_f1: 0.5629
 epoch: 25, train_loss: 0.9137, test_loss: 1.0262, test_f1: 0.5560
 epoch: 26, train_loss: 0.9187, test_loss: 1.0283, test_f1: 0.5340
 epoch: 27, train_loss: 0.8996, test_loss: 1.0098, test_f1: 0.5255
 epoch: 28, train_loss: 0.8970, test_loss: 1.0316, test_f1: 0.5371
 epoch: 29, train_loss: 0.8964, test_loss: 1.0122, test_f1: 0.5459
 epoch: 30, train_loss: 0.8741, test_loss: 1.0116, test_f1: 0.5286
 epoch: 31, train_loss: 0.8651, test_loss: 0.9969, test_f1: 0.5576
 epoch: 32, train_loss: 0.8604, test_loss: 0.9819, test_f1: 0.5770
 epoch: 33, train_loss: 0.8431, test_loss: 0.9935, test_f1: 0.5750
 epoch: 34, train_loss: 0.8455, test_loss: 0.9967, test_f1: 0.5794
 epoch: 35, train_loss: 0.8330, test_loss: 0.9759, test_f1: 0.5786
 epoch: 36, train_loss: 0.8327, test_loss: 0.9776, test_f1: 0.5788
 epoch: 37, train_loss: 0.8279, test_loss: 0.9947, test_f1: 0.5800
 epoch: 38, train_loss: 0.8121, test_loss: 0.9816, test_f1: 0.5787
 epoch: 39, train_loss: 0.8021, test_loss: 0.9912, test_f1: 0.5828
 epoch: 40, train_loss: 0.7757, test_loss: 0.9863, test_f1: 0.5871
 epoch: 41, train_loss: 0.7767, test_loss: 0.9821, test_f1: 0.5947
 epoch: 42, train_loss: 0.7706, test_loss: 0.9781, test_f1: 0.5897
 epoch: 43, train_loss: 0.7684, test_loss: 1.0203, test_f1: 0.5826
 epoch: 44, train_loss: 0.7738, test_loss: 1.0101, test_f1: 0.5782
 epoch: 45, train_loss: 0.7586, test_loss: 1.0012, test_f1: 0.5771
 epoch: 46, train_loss: 0.7491, test_loss: 1.0058, test_f1: 0.5801
 epoch: 47, train_loss: 0.7490, test_loss: 1.0065, test_f1: 0.5823
 epoch: 48, train_loss: 0.7337, test_loss: 1.0255, test_f1: 0.5762
 epoch: 49, train_loss: 0.7359, test_loss: 1.0157, test_f1: 0.5690
 epoch: 50, train_loss: 0.7303, test_loss: 1.0523, test_f1: 0.5601
 epoch: 51, train_loss: 0.7122, test_loss: 1.0152, test_f1: 0.5727
 epoch: 52, train_loss: 0.7196, test_loss: 1.0108, test_f1: 0.5686
 epoch: 53, train_loss: 0.7140, test_loss: 1.0309, test_f1: 0.5810
 epoch: 54, train_loss: 0.7164, test_loss: 1.0463, test_f1: 0.5927
 epoch: 55, train_loss: 0.7077, test_loss: 1.0531, test_f1: 0.5824
 epoch: 56, train_loss: 0.7126, test_loss: 1.0498, test_f1: 0.5785
 epoch: 57, train_loss: 0.7011, test_loss: 1.0359, test_f1: 0.5659
 epoch: 58, train_loss: 0.6919, test_loss: 1.0292, test_f1: 0.5813
 epoch: 59, train_loss: 0.6907, test_loss: 1.0426, test_f1: 0.5730
 epoch: 60, train_loss: 0.6906, test_loss: 1.0559, test_f1: 0.5618
 epoch: 61, train_loss: 0.6880, test_loss: 1.0541, test_f1: 0.5826
 epoch: 62, train_loss: 0.6753, test_loss: 1.0425, test_f1: 0.5978
 epoch: 63, train_loss: 0.6799, test_loss: 1.0358, test_f1: 0.5855
 epoch: 64, train_loss: 0.6931, test_loss: 1.0458, test_f1: 0.5921
 epoch: 65, train_loss: 0.6802, test_loss: 1.0432, test_f1: 0.5968
 epoch: 66, train_loss: 0.6746, test_loss: 1.0509, test_f1: 0.5933
 epoch: 67, train_loss: 0.6665, test_loss: 1.0460, test_f1: 0.5903
 epoch: 68, train_loss: 0.6725, test_loss: 1.0508, test_f1: 0.5892
 epoch: 69, train_loss: 0.6691, test_loss: 1.0847, test_f1: 0.5786
 epoch: 70, train_loss: 0.6552, test_loss: 1.0768, test_f1: 0.5958
 epoch: 71, train_loss: 0.6543, test_loss: 1.0816, test_f1: 0.5906
 epoch: 72, train_loss: 0.6582, test_loss: 1.1121, test_f1: 0.5849
 epoch: 73, train_loss: 0.6684, test_loss: 1.1087, test_f1: 0.5805
 epoch: 74, train_loss: 0.6458, test_loss: 1.1066, test_f1: 0.5913
 epoch: 75, train_loss: 0.6528, test_loss: 1.1181, test_f1: 0.5875
 epoch: 76, train_loss: 0.6496, test_loss: 1.1251, test_f1: 0.5734
 epoch: 77, train_loss: 0.6495, test_loss: 1.1507, test_f1: 0.5733
 epoch: 78, train_loss: 0.6346, test_loss: 1.1354, test_f1: 0.5823
 epoch: 79, train_loss: 0.6458, test_loss: 1.1516, test_f1: 0.5707
 epoch: 80, train_loss: 0.6424, test_loss: 1.1255, test_f1: 0.5845
 epoch: 81, train_loss: 0.6546, test_loss: 1.1045, test_f1: 0.5810
 epoch: 82, train_loss: 0.6396, test_loss: 1.1330, test_f1: 0.5823
 epoch: 83, train_loss: 0.6342, test_loss: 1.1255, test_f1: 0.5905
 epoch: 84, train_loss: 0.6516, test_loss: 1.1292, test_f1: 0.5857
 epoch: 85, train_loss: 0.6379, test_loss: 1.1621, test_f1: 0.5765
 epoch: 86, train_loss: 0.6330, test_loss: 1.1514, test_f1: 0.5847
 epoch: 87, train_loss: 0.6256, test_loss: 1.1878, test_f1: 0.5806
 epoch: 88, train_loss: 0.6316, test_loss: 1.1523, test_f1: 0.5829
 epoch: 89, train_loss: 0.6189, test_loss: 1.1623, test_f1: 0.5879
 epoch: 90, train_loss: 0.6315, test_loss: 1.1554, test_f1: 0.5901
 epoch: 91, train_loss: 0.6098, test_loss: 1.1757, test_f1: 0.5858
 epoch: 92, train_loss: 0.6342, test_loss: 1.2080, test_f1: 0.5750
 epoch: 93, train_loss: 0.6224, test_loss: 1.1619, test_f1: 0.5877
 epoch: 94, train_loss: 0.6067, test_loss: 1.1656, test_f1: 0.5931
 epoch: 95, train_loss: 0.6089, test_loss: 1.1547, test_f1: 0.5931
 epoch: 96, train_loss: 0.6198, test_loss: 1.1455, test_f1: 0.5814
 epoch: 97, train_loss: 0.6170, test_loss: 1.1687, test_f1: 0.5871
 epoch: 98, train_loss: 0.6116, test_loss: 1.1856, test_f1: 0.5727
 epoch: 99, train_loss: 0.6077, test_loss: 1.1994, test_f1: 0.5597
##################ITERATION #6 ****************************************
 epoch: 0, train_loss: 1.2501, test_loss: 1.3034, test_f1: 0.2257
 epoch: 1, train_loss: 1.2094, test_loss: 1.3038, test_f1: 0.2407
 epoch: 2, train_loss: 1.1992, test_loss: 1.2920, test_f1: 0.2654
 epoch: 3, train_loss: 1.1821, test_loss: 1.2671, test_f1: 0.2590
 epoch: 4, train_loss: 1.1627, test_loss: 1.2380, test_f1: 0.2627
 epoch: 5, train_loss: 1.1459, test_loss: 1.2185, test_f1: 0.3512
 epoch: 6, train_loss: 1.1386, test_loss: 1.2000, test_f1: 0.4100
 epoch: 7, train_loss: 1.1166, test_loss: 1.1786, test_f1: 0.4563
 epoch: 8, train_loss: 1.0999, test_loss: 1.1591, test_f1: 0.4594
 epoch: 9, train_loss: 1.0749, test_loss: 1.1505, test_f1: 0.4897
 epoch: 10, train_loss: 1.0624, test_loss: 1.1427, test_f1: 0.4708
 epoch: 11, train_loss: 1.0517, test_loss: 1.1098, test_f1: 0.4792
 epoch: 12, train_loss: 1.0270, test_loss: 1.0924, test_f1: 0.4833
 epoch: 13, train_loss: 1.0175, test_loss: 1.0820, test_f1: 0.4919
 epoch: 14, train_loss: 1.0031, test_loss: 1.0786, test_f1: 0.5170
 epoch: 15, train_loss: 0.9778, test_loss: 1.0638, test_f1: 0.5193
 epoch: 16, train_loss: 0.9794, test_loss: 1.0376, test_f1: 0.5130
 epoch: 17, train_loss: 0.9508, test_loss: 1.0384, test_f1: 0.5475
 epoch: 18, train_loss: 0.9524, test_loss: 1.0467, test_f1: 0.5312
 epoch: 19, train_loss: 0.9350, test_loss: 1.0406, test_f1: 0.5640
 epoch: 20, train_loss: 0.9213, test_loss: 1.0407, test_f1: 0.5523
 epoch: 21, train_loss: 0.9170, test_loss: 0.9932, test_f1: 0.5498
 epoch: 22, train_loss: 0.9053, test_loss: 0.9883, test_f1: 0.5572
 epoch: 23, train_loss: 0.8955, test_loss: 0.9788, test_f1: 0.5567
 epoch: 24, train_loss: 0.8912, test_loss: 1.0039, test_f1: 0.5402
 epoch: 25, train_loss: 0.8755, test_loss: 0.9963, test_f1: 0.5770
 epoch: 26, train_loss: 0.8710, test_loss: 1.0085, test_f1: 0.5498
 epoch: 27, train_loss: 0.8711, test_loss: 0.9782, test_f1: 0.5411
 epoch: 28, train_loss: 0.8386, test_loss: 0.9767, test_f1: 0.5539
 epoch: 29, train_loss: 0.8457, test_loss: 0.9765, test_f1: 0.5482
 epoch: 30, train_loss: 0.8301, test_loss: 0.9686, test_f1: 0.5759
 epoch: 31, train_loss: 0.8134, test_loss: 0.9764, test_f1: 0.5747
 epoch: 32, train_loss: 0.8136, test_loss: 0.9802, test_f1: 0.5530
 epoch: 33, train_loss: 0.8103, test_loss: 1.0190, test_f1: 0.5645
 epoch: 34, train_loss: 0.7993, test_loss: 0.9778, test_f1: 0.5533
 epoch: 35, train_loss: 0.7988, test_loss: 0.9687, test_f1: 0.5419
 epoch: 36, train_loss: 0.7991, test_loss: 0.9728, test_f1: 0.5476
 epoch: 37, train_loss: 0.7813, test_loss: 0.9683, test_f1: 0.5432
 epoch: 38, train_loss: 0.7629, test_loss: 0.9495, test_f1: 0.5626
 epoch: 39, train_loss: 0.7651, test_loss: 0.9368, test_f1: 0.5814
 epoch: 40, train_loss: 0.7694, test_loss: 0.9456, test_f1: 0.5700
 epoch: 41, train_loss: 0.7624, test_loss: 0.9385, test_f1: 0.5653
 epoch: 42, train_loss: 0.7593, test_loss: 0.9628, test_f1: 0.5802
 epoch: 43, train_loss: 0.7510, test_loss: 0.9461, test_f1: 0.5705
 epoch: 44, train_loss: 0.7373, test_loss: 0.9301, test_f1: 0.5787
 epoch: 45, train_loss: 0.7490, test_loss: 0.9610, test_f1: 0.5765
 epoch: 46, train_loss: 0.7226, test_loss: 0.9497, test_f1: 0.5874
 epoch: 47, train_loss: 0.7266, test_loss: 0.9536, test_f1: 0.5515
 epoch: 48, train_loss: 0.7165, test_loss: 0.9580, test_f1: 0.5889
 epoch: 49, train_loss: 0.7155, test_loss: 0.9614, test_f1: 0.5877
 epoch: 50, train_loss: 0.7187, test_loss: 0.9506, test_f1: 0.5612
 epoch: 51, train_loss: 0.7048, test_loss: 0.9695, test_f1: 0.5673
 epoch: 52, train_loss: 0.7147, test_loss: 0.9931, test_f1: 0.5724
 epoch: 53, train_loss: 0.6936, test_loss: 0.9568, test_f1: 0.6019
 epoch: 54, train_loss: 0.6961, test_loss: 0.9585, test_f1: 0.5980
 epoch: 55, train_loss: 0.7016, test_loss: 0.9723, test_f1: 0.6018
 epoch: 56, train_loss: 0.6827, test_loss: 0.9702, test_f1: 0.5979
 epoch: 57, train_loss: 0.6915, test_loss: 0.9952, test_f1: 0.5916
 epoch: 58, train_loss: 0.6718, test_loss: 0.9913, test_f1: 0.5758
 epoch: 59, train_loss: 0.6835, test_loss: 1.0002, test_f1: 0.5676
 epoch: 60, train_loss: 0.6827, test_loss: 0.9762, test_f1: 0.5804
 epoch: 61, train_loss: 0.6709, test_loss: 0.9473, test_f1: 0.5861
 epoch: 62, train_loss: 0.6782, test_loss: 0.9506, test_f1: 0.5873
 epoch: 63, train_loss: 0.6694, test_loss: 0.9678, test_f1: 0.5847
 epoch: 64, train_loss: 0.6753, test_loss: 0.9815, test_f1: 0.5774
 epoch: 65, train_loss: 0.6651, test_loss: 0.9905, test_f1: 0.5772
 epoch: 66, train_loss: 0.6656, test_loss: 0.9866, test_f1: 0.5714
 epoch: 67, train_loss: 0.6534, test_loss: 0.9978, test_f1: 0.5723
 epoch: 68, train_loss: 0.6573, test_loss: 0.9600, test_f1: 0.5851
 epoch: 69, train_loss: 0.6573, test_loss: 0.9658, test_f1: 0.5770
 epoch: 70, train_loss: 0.6584, test_loss: 0.9980, test_f1: 0.5688
 epoch: 71, train_loss: 0.6665, test_loss: 1.0067, test_f1: 0.5717
 epoch: 72, train_loss: 0.6624, test_loss: 1.0114, test_f1: 0.5676
 epoch: 73, train_loss: 0.6516, test_loss: 0.9927, test_f1: 0.5718
 epoch: 74, train_loss: 0.6490, test_loss: 0.9793, test_f1: 0.5836
 epoch: 75, train_loss: 0.6442, test_loss: 0.9596, test_f1: 0.5799
 epoch: 76, train_loss: 0.6431, test_loss: 0.9703, test_f1: 0.5813
 epoch: 77, train_loss: 0.6431, test_loss: 0.9639, test_f1: 0.5760
 epoch: 78, train_loss: 0.6458, test_loss: 0.9962, test_f1: 0.5633
 epoch: 79, train_loss: 0.6461, test_loss: 0.9705, test_f1: 0.5721
 epoch: 80, train_loss: 0.6438, test_loss: 0.9563, test_f1: 0.5864
 epoch: 81, train_loss: 0.6303, test_loss: 0.9660, test_f1: 0.5957
 epoch: 82, train_loss: 0.6327, test_loss: 0.9865, test_f1: 0.6011
 epoch: 83, train_loss: 0.6283, test_loss: 0.9818, test_f1: 0.5959
 epoch: 84, train_loss: 0.6265, test_loss: 0.9901, test_f1: 0.6063
 epoch: 85, train_loss: 0.6374, test_loss: 0.9975, test_f1: 0.5940
 epoch: 86, train_loss: 0.6282, test_loss: 0.9951, test_f1: 0.5922
 epoch: 87, train_loss: 0.6426, test_loss: 1.0157, test_f1: 0.5673
 epoch: 88, train_loss: 0.6291, test_loss: 0.9765, test_f1: 0.5816
 epoch: 89, train_loss: 0.6301, test_loss: 0.9523, test_f1: 0.5914
 epoch: 90, train_loss: 0.6285, test_loss: 0.9943, test_f1: 0.5975
 epoch: 91, train_loss: 0.6251, test_loss: 0.9995, test_f1: 0.6008
 epoch: 92, train_loss: 0.6220, test_loss: 1.0068, test_f1: 0.6094
 epoch: 93, train_loss: 0.6343, test_loss: 0.9869, test_f1: 0.6035
 epoch: 94, train_loss: 0.6295, test_loss: 0.9947, test_f1: 0.5816
 epoch: 95, train_loss: 0.6116, test_loss: 0.9985, test_f1: 0.5812
 epoch: 96, train_loss: 0.6229, test_loss: 0.9801, test_f1: 0.5899
 epoch: 97, train_loss: 0.6239, test_loss: 0.9689, test_f1: 0.5945
 epoch: 98, train_loss: 0.6090, test_loss: 1.0240, test_f1: 0.6073
 epoch: 99, train_loss: 0.6118, test_loss: 1.0176, test_f1: 0.5958
##################ITERATION #7 ****************************************
 epoch: 0, train_loss: 1.2514, test_loss: 1.3028, test_f1: 0.2357
 epoch: 1, train_loss: 1.2035, test_loss: 1.3033, test_f1: 0.2236
 epoch: 2, train_loss: 1.1742, test_loss: 1.3001, test_f1: 0.2537
 epoch: 3, train_loss: 1.1564, test_loss: 1.2850, test_f1: 0.2476
 epoch: 4, train_loss: 1.1381, test_loss: 1.2527, test_f1: 0.2704
 epoch: 5, train_loss: 1.1283, test_loss: 1.2204, test_f1: 0.3646
 epoch: 6, train_loss: 1.1140, test_loss: 1.1977, test_f1: 0.4280
 epoch: 7, train_loss: 1.0996, test_loss: 1.1788, test_f1: 0.4075
 epoch: 8, train_loss: 1.0861, test_loss: 1.1618, test_f1: 0.4356
 epoch: 9, train_loss: 1.0811, test_loss: 1.1526, test_f1: 0.4351
 epoch: 10, train_loss: 1.0710, test_loss: 1.1475, test_f1: 0.4367
 epoch: 11, train_loss: 1.0527, test_loss: 1.1424, test_f1: 0.4402
 epoch: 12, train_loss: 1.0516, test_loss: 1.1260, test_f1: 0.4806
 epoch: 13, train_loss: 1.0294, test_loss: 1.1159, test_f1: 0.4984
 epoch: 14, train_loss: 1.0189, test_loss: 1.1160, test_f1: 0.4895
 epoch: 15, train_loss: 1.0064, test_loss: 1.1056, test_f1: 0.4853
 epoch: 16, train_loss: 1.0001, test_loss: 1.0905, test_f1: 0.4905
 epoch: 17, train_loss: 0.9842, test_loss: 1.0836, test_f1: 0.4836
 epoch: 18, train_loss: 0.9735, test_loss: 1.0601, test_f1: 0.5161
 epoch: 19, train_loss: 0.9642, test_loss: 1.0516, test_f1: 0.5104
 epoch: 20, train_loss: 0.9661, test_loss: 1.0629, test_f1: 0.5014
 epoch: 21, train_loss: 0.9420, test_loss: 1.0413, test_f1: 0.5056
 epoch: 22, train_loss: 0.9391, test_loss: 1.0446, test_f1: 0.5178
 epoch: 23, train_loss: 0.9367, test_loss: 1.0467, test_f1: 0.5235
 epoch: 24, train_loss: 0.9194, test_loss: 1.0497, test_f1: 0.5243
 epoch: 25, train_loss: 0.9076, test_loss: 1.0266, test_f1: 0.5319
 epoch: 26, train_loss: 0.8930, test_loss: 1.0332, test_f1: 0.5078
 epoch: 27, train_loss: 0.8960, test_loss: 1.0214, test_f1: 0.5358
 epoch: 28, train_loss: 0.8869, test_loss: 1.0298, test_f1: 0.5268
 epoch: 29, train_loss: 0.8775, test_loss: 1.0280, test_f1: 0.5122
 epoch: 30, train_loss: 0.8653, test_loss: 1.0124, test_f1: 0.5564
 epoch: 31, train_loss: 0.8648, test_loss: 1.0483, test_f1: 0.5245
 epoch: 32, train_loss: 0.8639, test_loss: 1.0362, test_f1: 0.5485
 epoch: 33, train_loss: 0.8602, test_loss: 1.0754, test_f1: 0.5334
 epoch: 34, train_loss: 0.8372, test_loss: 1.1084, test_f1: 0.5188
 epoch: 35, train_loss: 0.8396, test_loss: 1.0470, test_f1: 0.5442
 epoch: 36, train_loss: 0.8300, test_loss: 1.0436, test_f1: 0.5428
 epoch: 37, train_loss: 0.8319, test_loss: 1.0186, test_f1: 0.5512
 epoch: 38, train_loss: 0.8231, test_loss: 1.0308, test_f1: 0.5300
 epoch: 39, train_loss: 0.8246, test_loss: 1.0335, test_f1: 0.5372
 epoch: 40, train_loss: 0.8053, test_loss: 1.0201, test_f1: 0.5400
 epoch: 41, train_loss: 0.8055, test_loss: 1.0268, test_f1: 0.5475
 epoch: 42, train_loss: 0.7977, test_loss: 1.0475, test_f1: 0.5528
 epoch: 43, train_loss: 0.8124, test_loss: 1.0226, test_f1: 0.5527
 epoch: 44, train_loss: 0.7925, test_loss: 1.0512, test_f1: 0.5391
 epoch: 45, train_loss: 0.7906, test_loss: 1.0237, test_f1: 0.5664
 epoch: 46, train_loss: 0.7903, test_loss: 1.0092, test_f1: 0.5674
 epoch: 47, train_loss: 0.7716, test_loss: 0.9950, test_f1: 0.5680
 epoch: 48, train_loss: 0.7620, test_loss: 1.0138, test_f1: 0.5772
 epoch: 49, train_loss: 0.7643, test_loss: 1.0290, test_f1: 0.5779
 epoch: 50, train_loss: 0.7596, test_loss: 0.9999, test_f1: 0.5779
 epoch: 51, train_loss: 0.7513, test_loss: 1.0106, test_f1: 0.5681
 epoch: 52, train_loss: 0.7601, test_loss: 1.0042, test_f1: 0.5639
 epoch: 53, train_loss: 0.7350, test_loss: 0.9994, test_f1: 0.5710
 epoch: 54, train_loss: 0.7475, test_loss: 1.0168, test_f1: 0.5581
 epoch: 55, train_loss: 0.7351, test_loss: 1.0141, test_f1: 0.5812
 epoch: 56, train_loss: 0.7381, test_loss: 1.0059, test_f1: 0.5869
 epoch: 57, train_loss: 0.7477, test_loss: 1.0125, test_f1: 0.5724
 epoch: 58, train_loss: 0.7299, test_loss: 1.0334, test_f1: 0.5556
 epoch: 59, train_loss: 0.7233, test_loss: 1.0287, test_f1: 0.5597
 epoch: 60, train_loss: 0.7305, test_loss: 1.0247, test_f1: 0.5536
 epoch: 61, train_loss: 0.7262, test_loss: 1.0235, test_f1: 0.5754
 epoch: 62, train_loss: 0.7070, test_loss: 1.0140, test_f1: 0.5602
 epoch: 63, train_loss: 0.7093, test_loss: 1.0213, test_f1: 0.5678
 epoch: 64, train_loss: 0.7220, test_loss: 1.0360, test_f1: 0.5822
 epoch: 65, train_loss: 0.7088, test_loss: 1.0314, test_f1: 0.5869
 epoch: 66, train_loss: 0.7136, test_loss: 1.0364, test_f1: 0.5790
 epoch: 67, train_loss: 0.7025, test_loss: 1.0618, test_f1: 0.5724
 epoch: 68, train_loss: 0.7037, test_loss: 1.0536, test_f1: 0.5528
 epoch: 69, train_loss: 0.7118, test_loss: 1.0569, test_f1: 0.5565
 epoch: 70, train_loss: 0.6932, test_loss: 1.0420, test_f1: 0.5795
 epoch: 71, train_loss: 0.6973, test_loss: 1.0532, test_f1: 0.5635
 epoch: 72, train_loss: 0.7008, test_loss: 1.0846, test_f1: 0.5575
 epoch: 73, train_loss: 0.6885, test_loss: 1.0657, test_f1: 0.5667
 epoch: 74, train_loss: 0.6817, test_loss: 1.0311, test_f1: 0.5640
 epoch: 75, train_loss: 0.6946, test_loss: 1.0328, test_f1: 0.5746
 epoch: 76, train_loss: 0.6881, test_loss: 1.0664, test_f1: 0.5423
 epoch: 77, train_loss: 0.6918, test_loss: 1.0549, test_f1: 0.5557
 epoch: 78, train_loss: 0.6867, test_loss: 1.0210, test_f1: 0.5721
 epoch: 79, train_loss: 0.6997, test_loss: 1.0369, test_f1: 0.5864
 epoch: 80, train_loss: 0.6892, test_loss: 1.0721, test_f1: 0.5644
 epoch: 81, train_loss: 0.6784, test_loss: 1.0670, test_f1: 0.5754
 epoch: 82, train_loss: 0.6631, test_loss: 1.0737, test_f1: 0.5526
 epoch: 83, train_loss: 0.6730, test_loss: 1.0669, test_f1: 0.5526
 epoch: 84, train_loss: 0.6796, test_loss: 1.0764, test_f1: 0.5789
 epoch: 85, train_loss: 0.6850, test_loss: 1.1042, test_f1: 0.5641
 epoch: 86, train_loss: 0.6749, test_loss: 1.0842, test_f1: 0.5517
 epoch: 87, train_loss: 0.6644, test_loss: 1.0780, test_f1: 0.5757
 epoch: 88, train_loss: 0.6618, test_loss: 1.0947, test_f1: 0.5601
 epoch: 89, train_loss: 0.6680, test_loss: 1.0863, test_f1: 0.5773
 epoch: 90, train_loss: 0.6448, test_loss: 1.0888, test_f1: 0.5450
 epoch: 91, train_loss: 0.6529, test_loss: 1.0940, test_f1: 0.5475
 epoch: 92, train_loss: 0.6587, test_loss: 1.1027, test_f1: 0.5555
 epoch: 93, train_loss: 0.6557, test_loss: 1.0988, test_f1: 0.5827
 epoch: 94, train_loss: 0.6548, test_loss: 1.1218, test_f1: 0.5555
 epoch: 95, train_loss: 0.6479, test_loss: 1.0961, test_f1: 0.5718
 epoch: 96, train_loss: 0.6538, test_loss: 1.0972, test_f1: 0.5731
 epoch: 97, train_loss: 0.6427, test_loss: 1.1115, test_f1: 0.5420
 epoch: 98, train_loss: 0.6409, test_loss: 1.0897, test_f1: 0.5758
 epoch: 99, train_loss: 0.6403, test_loss: 1.0752, test_f1: 0.6081
##################ITERATION #8 ****************************************
 epoch: 0, train_loss: 1.2602, test_loss: 1.3017, test_f1: 0.2407
 epoch: 1, train_loss: 1.1995, test_loss: 1.2919, test_f1: 0.2440
 epoch: 2, train_loss: 1.1772, test_loss: 1.2809, test_f1: 0.2680
 epoch: 3, train_loss: 1.1647, test_loss: 1.2517, test_f1: 0.2648
 epoch: 4, train_loss: 1.1312, test_loss: 1.2306, test_f1: 0.2644
 epoch: 5, train_loss: 1.1261, test_loss: 1.2248, test_f1: 0.3515
 epoch: 6, train_loss: 1.1115, test_loss: 1.2218, test_f1: 0.3807
 epoch: 7, train_loss: 1.0977, test_loss: 1.2150, test_f1: 0.4048
 epoch: 8, train_loss: 1.0743, test_loss: 1.1860, test_f1: 0.4405
 epoch: 9, train_loss: 1.0548, test_loss: 1.1651, test_f1: 0.4871
 epoch: 10, train_loss: 1.0482, test_loss: 1.1658, test_f1: 0.4860
 epoch: 11, train_loss: 1.0350, test_loss: 1.1659, test_f1: 0.4833
 epoch: 12, train_loss: 1.0043, test_loss: 1.1505, test_f1: 0.5015
 epoch: 13, train_loss: 0.9980, test_loss: 1.1638, test_f1: 0.4981
 epoch: 14, train_loss: 0.9905, test_loss: 1.1135, test_f1: 0.5104
 epoch: 15, train_loss: 0.9760, test_loss: 1.1085, test_f1: 0.5094
 epoch: 16, train_loss: 0.9764, test_loss: 1.1131, test_f1: 0.5151
 epoch: 17, train_loss: 0.9510, test_loss: 1.1257, test_f1: 0.5202
 epoch: 18, train_loss: 0.9385, test_loss: 1.0941, test_f1: 0.5213
 epoch: 19, train_loss: 0.9262, test_loss: 1.0637, test_f1: 0.5310
 epoch: 20, train_loss: 0.9172, test_loss: 1.0431, test_f1: 0.5302
 epoch: 21, train_loss: 0.9187, test_loss: 1.0755, test_f1: 0.5343
 epoch: 22, train_loss: 0.9001, test_loss: 1.0611, test_f1: 0.5332
 epoch: 23, train_loss: 0.9045, test_loss: 1.0614, test_f1: 0.5158
 epoch: 24, train_loss: 0.8828, test_loss: 1.0812, test_f1: 0.5208
 epoch: 25, train_loss: 0.8703, test_loss: 1.1144, test_f1: 0.5161
 epoch: 26, train_loss: 0.8675, test_loss: 1.1052, test_f1: 0.5231
 epoch: 27, train_loss: 0.8589, test_loss: 1.0326, test_f1: 0.5122
 epoch: 28, train_loss: 0.8498, test_loss: 1.0757, test_f1: 0.5127
 epoch: 29, train_loss: 0.8413, test_loss: 1.0962, test_f1: 0.5114
 epoch: 30, train_loss: 0.8389, test_loss: 1.0259, test_f1: 0.5280
 epoch: 31, train_loss: 0.8304, test_loss: 1.0319, test_f1: 0.5102
 epoch: 32, train_loss: 0.8336, test_loss: 1.0462, test_f1: 0.5083
 epoch: 33, train_loss: 0.8181, test_loss: 1.0383, test_f1: 0.5139
 epoch: 34, train_loss: 0.8115, test_loss: 1.0254, test_f1: 0.5234
 epoch: 35, train_loss: 0.8063, test_loss: 1.0050, test_f1: 0.5210
 epoch: 36, train_loss: 0.8056, test_loss: 1.0305, test_f1: 0.5100
 epoch: 37, train_loss: 0.7898, test_loss: 1.0365, test_f1: 0.5103
 epoch: 38, train_loss: 0.7819, test_loss: 1.0287, test_f1: 0.5314
 epoch: 39, train_loss: 0.7949, test_loss: 1.0074, test_f1: 0.5249
 epoch: 40, train_loss: 0.7781, test_loss: 1.0522, test_f1: 0.5245
 epoch: 41, train_loss: 0.7662, test_loss: 0.9710, test_f1: 0.5437
 epoch: 42, train_loss: 0.7722, test_loss: 0.9964, test_f1: 0.5319
 epoch: 43, train_loss: 0.7487, test_loss: 1.0064, test_f1: 0.5416
 epoch: 44, train_loss: 0.7468, test_loss: 1.0127, test_f1: 0.5483
 epoch: 45, train_loss: 0.7436, test_loss: 1.0269, test_f1: 0.5461
 epoch: 46, train_loss: 0.7390, test_loss: 1.0046, test_f1: 0.5610
 epoch: 47, train_loss: 0.7347, test_loss: 0.9970, test_f1: 0.5653
 epoch: 48, train_loss: 0.7285, test_loss: 0.9688, test_f1: 0.5771
 epoch: 49, train_loss: 0.7171, test_loss: 0.9716, test_f1: 0.5737
 epoch: 50, train_loss: 0.7128, test_loss: 0.9799, test_f1: 0.5522
 epoch: 51, train_loss: 0.7327, test_loss: 0.9876, test_f1: 0.5760
 epoch: 52, train_loss: 0.7029, test_loss: 0.9728, test_f1: 0.5784
 epoch: 53, train_loss: 0.7000, test_loss: 0.9786, test_f1: 0.5462
 epoch: 54, train_loss: 0.7037, test_loss: 0.9707, test_f1: 0.5792
 epoch: 55, train_loss: 0.6915, test_loss: 0.9639, test_f1: 0.5768
 epoch: 56, train_loss: 0.6840, test_loss: 0.9913, test_f1: 0.5723
 epoch: 57, train_loss: 0.6948, test_loss: 1.0125, test_f1: 0.5385
 epoch: 58, train_loss: 0.6889, test_loss: 0.9967, test_f1: 0.5497
 epoch: 59, train_loss: 0.6912, test_loss: 1.0013, test_f1: 0.5816
 epoch: 60, train_loss: 0.6902, test_loss: 0.9990, test_f1: 0.5690
 epoch: 61, train_loss: 0.6745, test_loss: 0.9822, test_f1: 0.5802
 epoch: 62, train_loss: 0.6849, test_loss: 0.9820, test_f1: 0.5737
 epoch: 63, train_loss: 0.6948, test_loss: 0.9955, test_f1: 0.5593
 epoch: 64, train_loss: 0.6821, test_loss: 0.9779, test_f1: 0.5782
 epoch: 65, train_loss: 0.6617, test_loss: 1.0106, test_f1: 0.5693
 epoch: 66, train_loss: 0.6839, test_loss: 0.9971, test_f1: 0.5462
 epoch: 67, train_loss: 0.6876, test_loss: 0.9975, test_f1: 0.5512
 epoch: 68, train_loss: 0.6608, test_loss: 1.0072, test_f1: 0.5709
 epoch: 69, train_loss: 0.6622, test_loss: 1.0155, test_f1: 0.5708
 epoch: 70, train_loss: 0.6631, test_loss: 0.9907, test_f1: 0.5832
 epoch: 71, train_loss: 0.6638, test_loss: 1.0050, test_f1: 0.5613
 epoch: 72, train_loss: 0.6650, test_loss: 0.9909, test_f1: 0.5671
 epoch: 73, train_loss: 0.6729, test_loss: 1.0105, test_f1: 0.5516
 epoch: 74, train_loss: 0.6585, test_loss: 0.9935, test_f1: 0.5600
 epoch: 75, train_loss: 0.6441, test_loss: 0.9725, test_f1: 0.5889
 epoch: 76, train_loss: 0.6483, test_loss: 0.9980, test_f1: 0.5510
 epoch: 77, train_loss: 0.6442, test_loss: 0.9922, test_f1: 0.5712
 epoch: 78, train_loss: 0.6600, test_loss: 0.9951, test_f1: 0.5541
 epoch: 79, train_loss: 0.6541, test_loss: 1.0063, test_f1: 0.5732
 epoch: 80, train_loss: 0.6332, test_loss: 1.0098, test_f1: 0.5423
 epoch: 81, train_loss: 0.6324, test_loss: 1.0155, test_f1: 0.5277
 epoch: 82, train_loss: 0.6429, test_loss: 1.0331, test_f1: 0.5409
 epoch: 83, train_loss: 0.6284, test_loss: 1.0550, test_f1: 0.5617
 epoch: 84, train_loss: 0.6344, test_loss: 1.0181, test_f1: 0.5682
 epoch: 85, train_loss: 0.6433, test_loss: 1.0356, test_f1: 0.5294
 epoch: 86, train_loss: 0.6327, test_loss: 1.0228, test_f1: 0.5285
 epoch: 87, train_loss: 0.6317, test_loss: 1.0279, test_f1: 0.5478
 epoch: 88, train_loss: 0.6208, test_loss: 1.0176, test_f1: 0.5396
 epoch: 89, train_loss: 0.6349, test_loss: 1.0137, test_f1: 0.5589
 epoch: 90, train_loss: 0.6330, test_loss: 1.0077, test_f1: 0.5683
 epoch: 91, train_loss: 0.6321, test_loss: 1.0439, test_f1: 0.5342
 epoch: 92, train_loss: 0.6183, test_loss: 1.0130, test_f1: 0.5727
 epoch: 93, train_loss: 0.6177, test_loss: 1.0065, test_f1: 0.5647
 epoch: 94, train_loss: 0.6270, test_loss: 1.0058, test_f1: 0.5719
 epoch: 95, train_loss: 0.6203, test_loss: 1.0174, test_f1: 0.5518
 epoch: 96, train_loss: 0.6220, test_loss: 1.0454, test_f1: 0.5337
 epoch: 97, train_loss: 0.6304, test_loss: 1.0410, test_f1: 0.5289
 epoch: 98, train_loss: 0.6130, test_loss: 1.0089, test_f1: 0.5751
 epoch: 99, train_loss: 0.6158, test_loss: 1.0404, test_f1: 0.5458
##################ITERATION #9 ****************************************
 epoch: 0, train_loss: 1.2599, test_loss: 1.3172, test_f1: 0.2289
 epoch: 1, train_loss: 1.2062, test_loss: 1.3078, test_f1: 0.2281
 epoch: 2, train_loss: 1.1820, test_loss: 1.3050, test_f1: 0.2582
 epoch: 3, train_loss: 1.1693, test_loss: 1.2768, test_f1: 0.2809
 epoch: 4, train_loss: 1.1579, test_loss: 1.2488, test_f1: 0.3218
 epoch: 5, train_loss: 1.1334, test_loss: 1.2223, test_f1: 0.3814
 epoch: 6, train_loss: 1.1204, test_loss: 1.2001, test_f1: 0.3959
 epoch: 7, train_loss: 1.0945, test_loss: 1.1846, test_f1: 0.4254
 epoch: 8, train_loss: 1.0783, test_loss: 1.1805, test_f1: 0.4345
 epoch: 9, train_loss: 1.0519, test_loss: 1.1556, test_f1: 0.4683
 epoch: 10, train_loss: 1.0513, test_loss: 1.1309, test_f1: 0.4627
 epoch: 11, train_loss: 1.0389, test_loss: 1.1344, test_f1: 0.5271
 epoch: 12, train_loss: 1.0334, test_loss: 1.1111, test_f1: 0.5191
 epoch: 13, train_loss: 1.0062, test_loss: 1.0890, test_f1: 0.4982
 epoch: 14, train_loss: 0.9983, test_loss: 1.0839, test_f1: 0.5254
 epoch: 15, train_loss: 0.9786, test_loss: 1.0694, test_f1: 0.5442
 epoch: 16, train_loss: 0.9798, test_loss: 1.0643, test_f1: 0.5352
 epoch: 17, train_loss: 0.9613, test_loss: 1.0590, test_f1: 0.5469
 epoch: 18, train_loss: 0.9494, test_loss: 1.0504, test_f1: 0.5685
 epoch: 19, train_loss: 0.9404, test_loss: 1.0576, test_f1: 0.5759
 epoch: 20, train_loss: 0.9298, test_loss: 1.0529, test_f1: 0.5722
 epoch: 21, train_loss: 0.9168, test_loss: 1.0542, test_f1: 0.5671
 epoch: 22, train_loss: 0.9146, test_loss: 1.0452, test_f1: 0.5627
 epoch: 23, train_loss: 0.9133, test_loss: 1.0282, test_f1: 0.5788
 epoch: 24, train_loss: 0.8989, test_loss: 1.0309, test_f1: 0.5513
 epoch: 25, train_loss: 0.8903, test_loss: 1.0275, test_f1: 0.5644
 epoch: 26, train_loss: 0.8794, test_loss: 1.0191, test_f1: 0.5913
 epoch: 27, train_loss: 0.8852, test_loss: 1.0141, test_f1: 0.5675
 epoch: 28, train_loss: 0.8672, test_loss: 1.0186, test_f1: 0.5762
 epoch: 29, train_loss: 0.8528, test_loss: 1.0134, test_f1: 0.5622
 epoch: 30, train_loss: 0.8337, test_loss: 1.0150, test_f1: 0.5542
 epoch: 31, train_loss: 0.8593, test_loss: 1.0187, test_f1: 0.5370
 epoch: 32, train_loss: 0.8325, test_loss: 1.0091, test_f1: 0.5519
 epoch: 33, train_loss: 0.8324, test_loss: 1.0101, test_f1: 0.5535
 epoch: 34, train_loss: 0.8352, test_loss: 1.0122, test_f1: 0.5513
 epoch: 35, train_loss: 0.8137, test_loss: 0.9981, test_f1: 0.5617
 epoch: 36, train_loss: 0.8006, test_loss: 1.0067, test_f1: 0.5404
 epoch: 37, train_loss: 0.8016, test_loss: 1.0103, test_f1: 0.5399
 epoch: 38, train_loss: 0.7906, test_loss: 1.0268, test_f1: 0.5467
 epoch: 39, train_loss: 0.7991, test_loss: 1.0197, test_f1: 0.5495
 epoch: 40, train_loss: 0.7764, test_loss: 1.0010, test_f1: 0.5553
 epoch: 41, train_loss: 0.7672, test_loss: 1.0252, test_f1: 0.5629
 epoch: 42, train_loss: 0.7733, test_loss: 1.0304, test_f1: 0.5483
 epoch: 43, train_loss: 0.7588, test_loss: 1.0251, test_f1: 0.5693
 epoch: 44, train_loss: 0.7568, test_loss: 1.0195, test_f1: 0.5697
 epoch: 45, train_loss: 0.7468, test_loss: 1.0403, test_f1: 0.5567
 epoch: 46, train_loss: 0.7452, test_loss: 1.0164, test_f1: 0.5553
 epoch: 47, train_loss: 0.7388, test_loss: 1.0284, test_f1: 0.5614
 epoch: 48, train_loss: 0.7402, test_loss: 1.0404, test_f1: 0.5593
 epoch: 49, train_loss: 0.7333, test_loss: 1.0308, test_f1: 0.5584
 epoch: 50, train_loss: 0.7229, test_loss: 1.0287, test_f1: 0.5571
 epoch: 51, train_loss: 0.7232, test_loss: 1.0322, test_f1: 0.5604
 epoch: 52, train_loss: 0.7089, test_loss: 1.0433, test_f1: 0.5464
 epoch: 53, train_loss: 0.7126, test_loss: 1.0400, test_f1: 0.5677
 epoch: 54, train_loss: 0.7092, test_loss: 1.0368, test_f1: 0.5688
 epoch: 55, train_loss: 0.7069, test_loss: 1.0470, test_f1: 0.5580
 epoch: 56, train_loss: 0.7069, test_loss: 1.0407, test_f1: 0.5597
 epoch: 57, train_loss: 0.6881, test_loss: 1.0511, test_f1: 0.5583
 epoch: 58, train_loss: 0.7051, test_loss: 1.0537, test_f1: 0.5677
 epoch: 59, train_loss: 0.7078, test_loss: 1.0825, test_f1: 0.5597
 epoch: 60, train_loss: 0.6899, test_loss: 1.0519, test_f1: 0.5634
 epoch: 61, train_loss: 0.6910, test_loss: 1.0685, test_f1: 0.5698
 epoch: 62, train_loss: 0.6965, test_loss: 1.0601, test_f1: 0.5606
 epoch: 63, train_loss: 0.6773, test_loss: 1.0818, test_f1: 0.5600
 epoch: 64, train_loss: 0.6718, test_loss: 1.0674, test_f1: 0.5719
 epoch: 65, train_loss: 0.6820, test_loss: 1.0704, test_f1: 0.5562
 epoch: 66, train_loss: 0.6713, test_loss: 1.0662, test_f1: 0.5623
 epoch: 67, train_loss: 0.6756, test_loss: 1.0758, test_f1: 0.5660
 epoch: 68, train_loss: 0.6812, test_loss: 1.0875, test_f1: 0.5581
 epoch: 69, train_loss: 0.6662, test_loss: 1.0746, test_f1: 0.5731
 epoch: 70, train_loss: 0.6706, test_loss: 1.0829, test_f1: 0.5598
 epoch: 71, train_loss: 0.6712, test_loss: 1.0993, test_f1: 0.5603
 epoch: 72, train_loss: 0.6681, test_loss: 1.0793, test_f1: 0.5597
 epoch: 73, train_loss: 0.6631, test_loss: 1.0929, test_f1: 0.5702
 epoch: 74, train_loss: 0.6588, test_loss: 1.1041, test_f1: 0.5803
 epoch: 75, train_loss: 0.6683, test_loss: 1.0904, test_f1: 0.5732
 epoch: 76, train_loss: 0.6524, test_loss: 1.0901, test_f1: 0.5705
 epoch: 77, train_loss: 0.6531, test_loss: 1.1084, test_f1: 0.5494
 epoch: 78, train_loss: 0.6599, test_loss: 1.1107, test_f1: 0.5638
 epoch: 79, train_loss: 0.6459, test_loss: 1.0972, test_f1: 0.5617
 epoch: 80, train_loss: 0.6575, test_loss: 1.1122, test_f1: 0.5520
 epoch: 81, train_loss: 0.6434, test_loss: 1.1232, test_f1: 0.5439
 epoch: 82, train_loss: 0.6461, test_loss: 1.1244, test_f1: 0.5505
 epoch: 83, train_loss: 0.6451, test_loss: 1.1261, test_f1: 0.5529
 epoch: 84, train_loss: 0.6419, test_loss: 1.1232, test_f1: 0.5459
 epoch: 85, train_loss: 0.6389, test_loss: 1.1208, test_f1: 0.5565
 epoch: 86, train_loss: 0.6380, test_loss: 1.1097, test_f1: 0.5524
 epoch: 87, train_loss: 0.6289, test_loss: 1.1361, test_f1: 0.5453
 epoch: 88, train_loss: 0.6446, test_loss: 1.1591, test_f1: 0.5415
 epoch: 89, train_loss: 0.6239, test_loss: 1.1366, test_f1: 0.5483
 epoch: 90, train_loss: 0.6203, test_loss: 1.1587, test_f1: 0.5387
 epoch: 91, train_loss: 0.6242, test_loss: 1.1232, test_f1: 0.5407
 epoch: 92, train_loss: 0.6345, test_loss: 1.1184, test_f1: 0.5516
 epoch: 93, train_loss: 0.6169, test_loss: 1.1384, test_f1: 0.5473
 epoch: 94, train_loss: 0.6085, test_loss: 1.1445, test_f1: 0.5497
 epoch: 95, train_loss: 0.6138, test_loss: 1.1345, test_f1: 0.5591
 epoch: 96, train_loss: 0.6224, test_loss: 1.1406, test_f1: 0.5512
 epoch: 97, train_loss: 0.6301, test_loss: 1.1330, test_f1: 0.5694
 epoch: 98, train_loss: 0.6246, test_loss: 1.1567, test_f1: 0.5556
 epoch: 99, train_loss: 0.6258, test_loss: 1.1778, test_f1: 0.5500

Training completed in 392.69 seconds
Best F1: 0.6135 at epoch 90
Mean F1 across iterations: 0.5893  0.0189
========================FINAL RESULTS================================
FEGIN weighted F1: 0.6135  0.0189
python main.py --data ltspice_demos --representation component_pin --model FEGIN --layers 6 --hiddens 64 --batch_size 128 --lr 0.0001 --emb_size 250 --epochs 100 --save_appendix component_pin_L6_H64_BS128_LR0.0001_E250 --no_val
-----



STDERR:
  File "main.py", line 370, in <module>
    main()
  File "main.py", line 254, in main
    dataset = dataset_class(
  File "/home/philip/projects/ltspice_examples_code_repo/Circuit-Completion-Using-GNNs/component_classification_with_link_prediction_head/evaluation/FEGIN/kernel/circuit_datasets.py", line 15, in __init__
    self.data, self.slices = torch.load(self.processed_paths[0])
  File "/home/philip/.local/lib/python3.8/site-packages/torch/serialization.py", line 1040, in load
    warnings.warn(
  File "/usr/lib/python3.8/warnings.py", line 109, in _showwarnmsg
    sw(msg.message, msg.category, msg.filename, msg.lineno,
  File "main.py", line 47, in warn_with_traceback
    traceback.print_stack(file=log)
/home/philip/projects/ltspice_examples_code_repo/Circuit-Completion-Using-GNNs/component_classification_with_link_prediction_head/evaluation/FEGIN/kernel/circuit_datasets.py:15: FutureWarning: You are using `torch.load` with `weights_only=False` (the current default value), which uses the default pickle module implicitly. It is possible to construct malicious pickle data which will execute arbitrary code during unpickling (See https://github.com/pytorch/pytorch/blob/main/SECURITY.md#untrusted-models for more details). In a future release, the default value for `weights_only` will be flipped to `True`. This limits the functions that could be executed during unpickling. Arbitrary objects will no longer be allowed to be loaded via this mode unless they are explicitly allowlisted by the user via `torch.serialization.add_safe_globals`. We recommend you start setting `weights_only=True` for any use case where you don't have full control of the loaded file. Please open an issue on GitHub for any issues related to this experimental feature.
  self.data, self.slices = torch.load(self.processed_paths[0])
