STDOUT:
Results will be saved in /home/philip/projects/ltspice_examples_code_repo/Circuit-Completion-Using-GNNs/component_classification_with_link_prediction_head/evaluation/FEGIN/results/model_FEGIN_dataset_ltspice_demos
Command line input: python main.py --data ltspice_demos --representation component_net --model FEGIN --layers 2 --hiddens 64 --batch_size 128 --lr 0.0001 --emb_size 512 --epochs 100 --save_appendix component_net_L2_H64_BS128_LR0.0001_E512 --no_val
 is saved.
-----
ltspice_demos - FEGIN
Using 2 layers, 64 hidden units, h = 2
Loading component_net representation dataset
ENTERED
Training FEGIN on component_net representation
Train: 1565, Test: 383
##################ITERATION #0 ****************************************
 epoch: 0, train_loss: 1.3729, test_loss: 1.3675, test_f1: 0.2281
 epoch: 1, train_loss: 1.3663, test_loss: 1.3651, test_f1: 0.2281
 epoch: 2, train_loss: 1.3625, test_loss: 1.3625, test_f1: 0.2281
 epoch: 3, train_loss: 1.3589, test_loss: 1.3600, test_f1: 0.2281
 epoch: 4, train_loss: 1.3552, test_loss: 1.3573, test_f1: 0.2281
 epoch: 5, train_loss: 1.3512, test_loss: 1.3545, test_f1: 0.2281
 epoch: 6, train_loss: 1.3466, test_loss: 1.3516, test_f1: 0.2281
 epoch: 7, train_loss: 1.3421, test_loss: 1.3485, test_f1: 0.2281
 epoch: 8, train_loss: 1.3366, test_loss: 1.3447, test_f1: 0.2281
 epoch: 9, train_loss: 1.3315, test_loss: 1.3406, test_f1: 0.2281
 epoch: 10, train_loss: 1.3239, test_loss: 1.3359, test_f1: 0.2281
 epoch: 11, train_loss: 1.3171, test_loss: 1.3306, test_f1: 0.2281
 epoch: 12, train_loss: 1.3089, test_loss: 1.3250, test_f1: 0.2281
 epoch: 13, train_loss: 1.2980, test_loss: 1.3194, test_f1: 0.2281
 epoch: 14, train_loss: 1.2878, test_loss: 1.3123, test_f1: 0.2357
 epoch: 15, train_loss: 1.2781, test_loss: 1.3050, test_f1: 0.2719
 epoch: 16, train_loss: 1.2665, test_loss: 1.2971, test_f1: 0.2775
 epoch: 17, train_loss: 1.2517, test_loss: 1.2884, test_f1: 0.2746
 epoch: 18, train_loss: 1.2415, test_loss: 1.2803, test_f1: 0.2775
 epoch: 19, train_loss: 1.2311, test_loss: 1.2722, test_f1: 0.2775
 epoch: 20, train_loss: 1.2170, test_loss: 1.2630, test_f1: 0.2775
 epoch: 21, train_loss: 1.2041, test_loss: 1.2549, test_f1: 0.2818
 epoch: 22, train_loss: 1.1939, test_loss: 1.2471, test_f1: 0.2975
 epoch: 23, train_loss: 1.1868, test_loss: 1.2402, test_f1: 0.3366
 epoch: 24, train_loss: 1.1720, test_loss: 1.2340, test_f1: 0.3294
 epoch: 25, train_loss: 1.1692, test_loss: 1.2277, test_f1: 0.3384
 epoch: 26, train_loss: 1.1581, test_loss: 1.2203, test_f1: 0.3368
 epoch: 27, train_loss: 1.1478, test_loss: 1.2146, test_f1: 0.3408
 epoch: 28, train_loss: 1.1392, test_loss: 1.2099, test_f1: 0.3408
 epoch: 29, train_loss: 1.1343, test_loss: 1.2053, test_f1: 0.3495
 epoch: 30, train_loss: 1.1208, test_loss: 1.1996, test_f1: 0.3505
 epoch: 31, train_loss: 1.1185, test_loss: 1.1950, test_f1: 0.3508
 epoch: 32, train_loss: 1.1080, test_loss: 1.1892, test_f1: 0.3619
 epoch: 33, train_loss: 1.1038, test_loss: 1.1854, test_f1: 0.3670
 epoch: 34, train_loss: 1.0968, test_loss: 1.1815, test_f1: 0.3703
 epoch: 35, train_loss: 1.0903, test_loss: 1.1771, test_f1: 0.3826
 epoch: 36, train_loss: 1.0836, test_loss: 1.1752, test_f1: 0.3842
 epoch: 37, train_loss: 1.0755, test_loss: 1.1692, test_f1: 0.3949
 epoch: 38, train_loss: 1.0756, test_loss: 1.1658, test_f1: 0.4071
 epoch: 39, train_loss: 1.0661, test_loss: 1.1611, test_f1: 0.3907
 epoch: 40, train_loss: 1.0606, test_loss: 1.1514, test_f1: 0.3929
 epoch: 41, train_loss: 1.0544, test_loss: 1.1528, test_f1: 0.3873
 epoch: 42, train_loss: 1.0513, test_loss: 1.1519, test_f1: 0.3927
 epoch: 43, train_loss: 1.0431, test_loss: 1.1497, test_f1: 0.3961
 epoch: 44, train_loss: 1.0458, test_loss: 1.1418, test_f1: 0.4047
 epoch: 45, train_loss: 1.0343, test_loss: 1.1394, test_f1: 0.4121
 epoch: 46, train_loss: 1.0327, test_loss: 1.1413, test_f1: 0.4239
 epoch: 47, train_loss: 1.0321, test_loss: 1.1348, test_f1: 0.4254
 epoch: 48, train_loss: 1.0220, test_loss: 1.1362, test_f1: 0.4337
 epoch: 49, train_loss: 1.0187, test_loss: 1.1356, test_f1: 0.4250
 epoch: 50, train_loss: 1.0137, test_loss: 1.1339, test_f1: 0.4362
 epoch: 51, train_loss: 1.0121, test_loss: 1.1294, test_f1: 0.4350
 epoch: 52, train_loss: 1.0077, test_loss: 1.1303, test_f1: 0.4385
 epoch: 53, train_loss: 1.0044, test_loss: 1.1305, test_f1: 0.4321
 epoch: 54, train_loss: 1.0034, test_loss: 1.1236, test_f1: 0.4388
 epoch: 55, train_loss: 1.0047, test_loss: 1.1257, test_f1: 0.4426
 epoch: 56, train_loss: 0.9964, test_loss: 1.1227, test_f1: 0.4482
 epoch: 57, train_loss: 1.0021, test_loss: 1.1194, test_f1: 0.4406
 epoch: 58, train_loss: 0.9963, test_loss: 1.1167, test_f1: 0.4378
 epoch: 59, train_loss: 0.9982, test_loss: 1.1146, test_f1: 0.4472
 epoch: 60, train_loss: 0.9939, test_loss: 1.1066, test_f1: 0.4542
 epoch: 61, train_loss: 0.9913, test_loss: 1.1054, test_f1: 0.4542
 epoch: 62, train_loss: 0.9922, test_loss: 1.1082, test_f1: 0.4563
 epoch: 63, train_loss: 0.9884, test_loss: 1.1063, test_f1: 0.4523
 epoch: 64, train_loss: 0.9881, test_loss: 1.1081, test_f1: 0.4628
 epoch: 65, train_loss: 0.9826, test_loss: 1.1099, test_f1: 0.4547
 epoch: 66, train_loss: 0.9788, test_loss: 1.1101, test_f1: 0.4646
 epoch: 67, train_loss: 0.9864, test_loss: 1.1083, test_f1: 0.4608
 epoch: 68, train_loss: 0.9800, test_loss: 1.1031, test_f1: 0.4608
 epoch: 69, train_loss: 0.9751, test_loss: 1.1034, test_f1: 0.4678
 epoch: 70, train_loss: 0.9794, test_loss: 1.0981, test_f1: 0.4641
 epoch: 71, train_loss: 0.9749, test_loss: 1.0983, test_f1: 0.4676
 epoch: 72, train_loss: 0.9697, test_loss: 1.1061, test_f1: 0.4435
 epoch: 73, train_loss: 0.9703, test_loss: 1.0980, test_f1: 0.4632
 epoch: 74, train_loss: 0.9688, test_loss: 1.0981, test_f1: 0.4654
 epoch: 75, train_loss: 0.9725, test_loss: 1.0999, test_f1: 0.4654
 epoch: 76, train_loss: 0.9618, test_loss: 1.0965, test_f1: 0.4760
 epoch: 77, train_loss: 0.9592, test_loss: 1.0912, test_f1: 0.4754
 epoch: 78, train_loss: 0.9676, test_loss: 1.0972, test_f1: 0.4820
 epoch: 79, train_loss: 0.9614, test_loss: 1.0939, test_f1: 0.4791
 epoch: 80, train_loss: 0.9604, test_loss: 1.0950, test_f1: 0.4809
 epoch: 81, train_loss: 0.9607, test_loss: 1.0939, test_f1: 0.4760
 epoch: 82, train_loss: 0.9557, test_loss: 1.0955, test_f1: 0.4759
 epoch: 83, train_loss: 0.9585, test_loss: 1.0923, test_f1: 0.4698
 epoch: 84, train_loss: 0.9484, test_loss: 1.0966, test_f1: 0.4729
 epoch: 85, train_loss: 0.9554, test_loss: 1.0857, test_f1: 0.4659
 epoch: 86, train_loss: 0.9469, test_loss: 1.0792, test_f1: 0.4664
 epoch: 87, train_loss: 0.9538, test_loss: 1.0878, test_f1: 0.4853
 epoch: 88, train_loss: 0.9486, test_loss: 1.0886, test_f1: 0.4671
 epoch: 89, train_loss: 0.9456, test_loss: 1.0938, test_f1: 0.4759
 epoch: 90, train_loss: 0.9408, test_loss: 1.0865, test_f1: 0.4790
 epoch: 91, train_loss: 0.9418, test_loss: 1.0822, test_f1: 0.4798
 epoch: 92, train_loss: 0.9320, test_loss: 1.0895, test_f1: 0.4738
 epoch: 93, train_loss: 0.9430, test_loss: 1.0896, test_f1: 0.4727
 epoch: 94, train_loss: 0.9335, test_loss: 1.0897, test_f1: 0.4893
 epoch: 95, train_loss: 0.9376, test_loss: 1.0890, test_f1: 0.4810
 epoch: 96, train_loss: 0.9462, test_loss: 1.0930, test_f1: 0.4794
 epoch: 97, train_loss: 0.9292, test_loss: 1.0847, test_f1: 0.4691
 epoch: 98, train_loss: 0.9375, test_loss: 1.0814, test_f1: 0.4896
 epoch: 99, train_loss: 0.9297, test_loss: 1.0882, test_f1: 0.4821
##################ITERATION #1 ****************************************
 epoch: 0, train_loss: 1.3195, test_loss: 1.3377, test_f1: 0.2281
 epoch: 1, train_loss: 1.2993, test_loss: 1.3313, test_f1: 0.2281
 epoch: 2, train_loss: 1.2858, test_loss: 1.3229, test_f1: 0.2281
 epoch: 3, train_loss: 1.2739, test_loss: 1.3113, test_f1: 0.2281
 epoch: 4, train_loss: 1.2641, test_loss: 1.2991, test_f1: 0.2583
 epoch: 5, train_loss: 1.2516, test_loss: 1.2884, test_f1: 0.2583
 epoch: 6, train_loss: 1.2375, test_loss: 1.2813, test_f1: 0.2642
 epoch: 7, train_loss: 1.2249, test_loss: 1.2732, test_f1: 0.2777
 epoch: 8, train_loss: 1.2125, test_loss: 1.2650, test_f1: 0.2831
 epoch: 9, train_loss: 1.2008, test_loss: 1.2572, test_f1: 0.2831
 epoch: 10, train_loss: 1.1894, test_loss: 1.2480, test_f1: 0.2883
 epoch: 11, train_loss: 1.1762, test_loss: 1.2392, test_f1: 0.2934
 epoch: 12, train_loss: 1.1676, test_loss: 1.2311, test_f1: 0.2921
 epoch: 13, train_loss: 1.1510, test_loss: 1.2221, test_f1: 0.3012
 epoch: 14, train_loss: 1.1432, test_loss: 1.2136, test_f1: 0.3460
 epoch: 15, train_loss: 1.1321, test_loss: 1.2061, test_f1: 0.3615
 epoch: 16, train_loss: 1.1222, test_loss: 1.1981, test_f1: 0.3721
 epoch: 17, train_loss: 1.1090, test_loss: 1.1899, test_f1: 0.3877
 epoch: 18, train_loss: 1.1020, test_loss: 1.1830, test_f1: 0.3947
 epoch: 19, train_loss: 1.0933, test_loss: 1.1773, test_f1: 0.3989
 epoch: 20, train_loss: 1.0855, test_loss: 1.1690, test_f1: 0.4026
 epoch: 21, train_loss: 1.0781, test_loss: 1.1615, test_f1: 0.4029
 epoch: 22, train_loss: 1.0682, test_loss: 1.1589, test_f1: 0.4029
 epoch: 23, train_loss: 1.0567, test_loss: 1.1580, test_f1: 0.4069
 epoch: 24, train_loss: 1.0612, test_loss: 1.1504, test_f1: 0.4056
 epoch: 25, train_loss: 1.0435, test_loss: 1.1452, test_f1: 0.4058
 epoch: 26, train_loss: 1.0451, test_loss: 1.1407, test_f1: 0.4078
 epoch: 27, train_loss: 1.0413, test_loss: 1.1383, test_f1: 0.4058
 epoch: 28, train_loss: 1.0317, test_loss: 1.1350, test_f1: 0.4140
 epoch: 29, train_loss: 1.0353, test_loss: 1.1275, test_f1: 0.4119
 epoch: 30, train_loss: 1.0245, test_loss: 1.1235, test_f1: 0.4203
 epoch: 31, train_loss: 1.0102, test_loss: 1.1228, test_f1: 0.4284
 epoch: 32, train_loss: 1.0120, test_loss: 1.1177, test_f1: 0.4220
 epoch: 33, train_loss: 1.0190, test_loss: 1.1120, test_f1: 0.4262
 epoch: 34, train_loss: 1.0043, test_loss: 1.1068, test_f1: 0.4359
 epoch: 35, train_loss: 1.0093, test_loss: 1.1072, test_f1: 0.4392
 epoch: 36, train_loss: 0.9855, test_loss: 1.0962, test_f1: 0.4475
 epoch: 37, train_loss: 0.9914, test_loss: 1.1018, test_f1: 0.4335
 epoch: 38, train_loss: 0.9846, test_loss: 1.0955, test_f1: 0.4364
 epoch: 39, train_loss: 0.9848, test_loss: 1.0964, test_f1: 0.4420
 epoch: 40, train_loss: 0.9840, test_loss: 1.0880, test_f1: 0.4425
 epoch: 41, train_loss: 0.9718, test_loss: 1.0888, test_f1: 0.4465
 epoch: 42, train_loss: 0.9737, test_loss: 1.0855, test_f1: 0.4423
 epoch: 43, train_loss: 0.9702, test_loss: 1.0901, test_f1: 0.4394
 epoch: 44, train_loss: 0.9617, test_loss: 1.0809, test_f1: 0.4599
 epoch: 45, train_loss: 0.9582, test_loss: 1.0867, test_f1: 0.4584
 epoch: 46, train_loss: 0.9600, test_loss: 1.0755, test_f1: 0.4523
 epoch: 47, train_loss: 0.9585, test_loss: 1.0767, test_f1: 0.4541
 epoch: 48, train_loss: 0.9504, test_loss: 1.0817, test_f1: 0.4646
 epoch: 49, train_loss: 0.9452, test_loss: 1.0778, test_f1: 0.4910
 epoch: 50, train_loss: 0.9441, test_loss: 1.0866, test_f1: 0.4830
 epoch: 51, train_loss: 0.9384, test_loss: 1.0843, test_f1: 0.4761
 epoch: 52, train_loss: 0.9367, test_loss: 1.0797, test_f1: 0.4711
 epoch: 53, train_loss: 0.9320, test_loss: 1.0793, test_f1: 0.4790
 epoch: 54, train_loss: 0.9433, test_loss: 1.0812, test_f1: 0.4798
 epoch: 55, train_loss: 0.9318, test_loss: 1.0812, test_f1: 0.4589
 epoch: 56, train_loss: 0.9283, test_loss: 1.0839, test_f1: 0.4659
 epoch: 57, train_loss: 0.9277, test_loss: 1.0821, test_f1: 0.4649
 epoch: 58, train_loss: 0.9328, test_loss: 1.0804, test_f1: 0.4693
 epoch: 59, train_loss: 0.9262, test_loss: 1.0743, test_f1: 0.4695
 epoch: 60, train_loss: 0.9253, test_loss: 1.0798, test_f1: 0.4668
 epoch: 61, train_loss: 0.9259, test_loss: 1.0856, test_f1: 0.4742
 epoch: 62, train_loss: 0.9241, test_loss: 1.0902, test_f1: 0.4692
 epoch: 63, train_loss: 0.9260, test_loss: 1.0835, test_f1: 0.4903
 epoch: 64, train_loss: 0.9209, test_loss: 1.0824, test_f1: 0.4957
 epoch: 65, train_loss: 0.9234, test_loss: 1.0836, test_f1: 0.4731
 epoch: 66, train_loss: 0.9219, test_loss: 1.0764, test_f1: 0.4969
 epoch: 67, train_loss: 0.9202, test_loss: 1.0834, test_f1: 0.4856
 epoch: 68, train_loss: 0.9179, test_loss: 1.0821, test_f1: 0.4934
 epoch: 69, train_loss: 0.9152, test_loss: 1.0818, test_f1: 0.4796
 epoch: 70, train_loss: 0.9261, test_loss: 1.0837, test_f1: 0.4931
 epoch: 71, train_loss: 0.9169, test_loss: 1.0820, test_f1: 0.5098
 epoch: 72, train_loss: 0.9112, test_loss: 1.0852, test_f1: 0.5010
 epoch: 73, train_loss: 0.9142, test_loss: 1.0902, test_f1: 0.4931
 epoch: 74, train_loss: 0.9063, test_loss: 1.0803, test_f1: 0.4753
 epoch: 75, train_loss: 0.9126, test_loss: 1.0949, test_f1: 0.4864
 epoch: 76, train_loss: 0.9117, test_loss: 1.0949, test_f1: 0.4799
 epoch: 77, train_loss: 0.9151, test_loss: 1.0921, test_f1: 0.5058
 epoch: 78, train_loss: 0.9118, test_loss: 1.0891, test_f1: 0.5037
 epoch: 79, train_loss: 0.9073, test_loss: 1.0867, test_f1: 0.4997
 epoch: 80, train_loss: 0.9060, test_loss: 1.0882, test_f1: 0.5057
 epoch: 81, train_loss: 0.9137, test_loss: 1.0875, test_f1: 0.5036
 epoch: 82, train_loss: 0.9096, test_loss: 1.0832, test_f1: 0.5059
 epoch: 83, train_loss: 0.9003, test_loss: 1.0857, test_f1: 0.4994
 epoch: 84, train_loss: 0.9130, test_loss: 1.0980, test_f1: 0.5067
 epoch: 85, train_loss: 0.9033, test_loss: 1.0763, test_f1: 0.5061
 epoch: 86, train_loss: 0.8978, test_loss: 1.0706, test_f1: 0.5064
 epoch: 87, train_loss: 0.8993, test_loss: 1.0885, test_f1: 0.5059
 epoch: 88, train_loss: 0.8950, test_loss: 1.0842, test_f1: 0.5088
 epoch: 89, train_loss: 0.9104, test_loss: 1.0883, test_f1: 0.5112
 epoch: 90, train_loss: 0.9036, test_loss: 1.0879, test_f1: 0.5046
 epoch: 91, train_loss: 0.8990, test_loss: 1.0947, test_f1: 0.5080
 epoch: 92, train_loss: 0.8959, test_loss: 1.0918, test_f1: 0.5104
 epoch: 93, train_loss: 0.8962, test_loss: 1.0898, test_f1: 0.5022
 epoch: 94, train_loss: 0.8937, test_loss: 1.0896, test_f1: 0.4992
 epoch: 95, train_loss: 0.8910, test_loss: 1.0904, test_f1: 0.5056
 epoch: 96, train_loss: 0.8930, test_loss: 1.0823, test_f1: 0.5068
 epoch: 97, train_loss: 0.8938, test_loss: 1.0868, test_f1: 0.5107
 epoch: 98, train_loss: 0.8941, test_loss: 1.0813, test_f1: 0.5083
 epoch: 99, train_loss: 0.8859, test_loss: 1.0853, test_f1: 0.5061
##################ITERATION #2 ****************************************
 epoch: 0, train_loss: 1.3123, test_loss: 1.3321, test_f1: 0.2281
 epoch: 1, train_loss: 1.2858, test_loss: 1.3243, test_f1: 0.2281
 epoch: 2, train_loss: 1.2703, test_loss: 1.3159, test_f1: 0.2281
 epoch: 3, train_loss: 1.2555, test_loss: 1.3032, test_f1: 0.2281
 epoch: 4, train_loss: 1.2448, test_loss: 1.2894, test_f1: 0.2281
 epoch: 5, train_loss: 1.2266, test_loss: 1.2757, test_f1: 0.2281
 epoch: 6, train_loss: 1.2165, test_loss: 1.2632, test_f1: 0.2390
 epoch: 7, train_loss: 1.2005, test_loss: 1.2515, test_f1: 0.2744
 epoch: 8, train_loss: 1.1884, test_loss: 1.2419, test_f1: 0.2842
 epoch: 9, train_loss: 1.1764, test_loss: 1.2319, test_f1: 0.2873
 epoch: 10, train_loss: 1.1591, test_loss: 1.2217, test_f1: 0.2899
 epoch: 11, train_loss: 1.1496, test_loss: 1.2122, test_f1: 0.2962
 epoch: 12, train_loss: 1.1322, test_loss: 1.2044, test_f1: 0.3035
 epoch: 13, train_loss: 1.1263, test_loss: 1.1951, test_f1: 0.3183
 epoch: 14, train_loss: 1.1129, test_loss: 1.1840, test_f1: 0.3353
 epoch: 15, train_loss: 1.1088, test_loss: 1.1738, test_f1: 0.3395
 epoch: 16, train_loss: 1.0995, test_loss: 1.1685, test_f1: 0.3482
 epoch: 17, train_loss: 1.0770, test_loss: 1.1664, test_f1: 0.3476
 epoch: 18, train_loss: 1.0782, test_loss: 1.1600, test_f1: 0.3701
 epoch: 19, train_loss: 1.0714, test_loss: 1.1565, test_f1: 0.4047
 epoch: 20, train_loss: 1.0651, test_loss: 1.1501, test_f1: 0.4037
 epoch: 21, train_loss: 1.0617, test_loss: 1.1461, test_f1: 0.4012
 epoch: 22, train_loss: 1.0532, test_loss: 1.1415, test_f1: 0.4037
 epoch: 23, train_loss: 1.0432, test_loss: 1.1397, test_f1: 0.4094
 epoch: 24, train_loss: 1.0371, test_loss: 1.1376, test_f1: 0.4080
 epoch: 25, train_loss: 1.0299, test_loss: 1.1314, test_f1: 0.4104
 epoch: 26, train_loss: 1.0262, test_loss: 1.1310, test_f1: 0.4176
 epoch: 27, train_loss: 1.0243, test_loss: 1.1320, test_f1: 0.4156
 epoch: 28, train_loss: 1.0224, test_loss: 1.1308, test_f1: 0.4182
 epoch: 29, train_loss: 1.0074, test_loss: 1.1275, test_f1: 0.4155
 epoch: 30, train_loss: 1.0077, test_loss: 1.1255, test_f1: 0.4137
 epoch: 31, train_loss: 1.0064, test_loss: 1.1231, test_f1: 0.4155
 epoch: 32, train_loss: 1.0107, test_loss: 1.1246, test_f1: 0.4179
 epoch: 33, train_loss: 0.9928, test_loss: 1.1177, test_f1: 0.4161
 epoch: 34, train_loss: 0.9951, test_loss: 1.1159, test_f1: 0.4229
 epoch: 35, train_loss: 0.9869, test_loss: 1.1154, test_f1: 0.4231
 epoch: 36, train_loss: 0.9839, test_loss: 1.1236, test_f1: 0.4283
 epoch: 37, train_loss: 0.9756, test_loss: 1.1085, test_f1: 0.4227
 epoch: 38, train_loss: 0.9756, test_loss: 1.1070, test_f1: 0.4389
 epoch: 39, train_loss: 0.9770, test_loss: 1.1053, test_f1: 0.4340
 epoch: 40, train_loss: 0.9770, test_loss: 1.1079, test_f1: 0.4309
 epoch: 41, train_loss: 0.9722, test_loss: 1.1104, test_f1: 0.4335
 epoch: 42, train_loss: 0.9660, test_loss: 1.1210, test_f1: 0.4348
 epoch: 43, train_loss: 0.9615, test_loss: 1.1064, test_f1: 0.4356
 epoch: 44, train_loss: 0.9598, test_loss: 1.1173, test_f1: 0.4352
 epoch: 45, train_loss: 0.9539, test_loss: 1.1053, test_f1: 0.4391
 epoch: 46, train_loss: 0.9493, test_loss: 1.1116, test_f1: 0.4413
 epoch: 47, train_loss: 0.9498, test_loss: 1.1059, test_f1: 0.4378
 epoch: 48, train_loss: 0.9462, test_loss: 1.1056, test_f1: 0.4405
 epoch: 49, train_loss: 0.9456, test_loss: 1.1078, test_f1: 0.4424
 epoch: 50, train_loss: 0.9424, test_loss: 1.1095, test_f1: 0.4563
 epoch: 51, train_loss: 0.9312, test_loss: 1.0955, test_f1: 0.4474
 epoch: 52, train_loss: 0.9342, test_loss: 1.0976, test_f1: 0.4514
 epoch: 53, train_loss: 0.9319, test_loss: 1.1047, test_f1: 0.4502
 epoch: 54, train_loss: 0.9288, test_loss: 1.1070, test_f1: 0.4510
 epoch: 55, train_loss: 0.9323, test_loss: 1.1058, test_f1: 0.4558
 epoch: 56, train_loss: 0.9278, test_loss: 1.1014, test_f1: 0.4552
 epoch: 57, train_loss: 0.9371, test_loss: 1.1022, test_f1: 0.4630
 epoch: 58, train_loss: 0.9227, test_loss: 1.1036, test_f1: 0.4543
 epoch: 59, train_loss: 0.9266, test_loss: 1.1077, test_f1: 0.4626
 epoch: 60, train_loss: 0.9226, test_loss: 1.1035, test_f1: 0.4714
 epoch: 61, train_loss: 0.9232, test_loss: 1.1060, test_f1: 0.4661
 epoch: 62, train_loss: 0.9167, test_loss: 1.1082, test_f1: 0.4800
 epoch: 63, train_loss: 0.9289, test_loss: 1.1079, test_f1: 0.4697
 epoch: 64, train_loss: 0.9131, test_loss: 1.1024, test_f1: 0.4748
 epoch: 65, train_loss: 0.9187, test_loss: 1.0959, test_f1: 0.4725
 epoch: 66, train_loss: 0.9192, test_loss: 1.1042, test_f1: 0.4710
 epoch: 67, train_loss: 0.9258, test_loss: 1.0962, test_f1: 0.4773
 epoch: 68, train_loss: 0.9241, test_loss: 1.1000, test_f1: 0.4883
 epoch: 69, train_loss: 0.9102, test_loss: 1.0977, test_f1: 0.4675
 epoch: 70, train_loss: 0.9096, test_loss: 1.0991, test_f1: 0.4713
 epoch: 71, train_loss: 0.9076, test_loss: 1.0941, test_f1: 0.4681
 epoch: 72, train_loss: 0.9103, test_loss: 1.0937, test_f1: 0.4636
 epoch: 73, train_loss: 0.9067, test_loss: 1.0951, test_f1: 0.4721
 epoch: 74, train_loss: 0.9047, test_loss: 1.0908, test_f1: 0.4698
 epoch: 75, train_loss: 0.9075, test_loss: 1.0955, test_f1: 0.4678
 epoch: 76, train_loss: 0.9034, test_loss: 1.0983, test_f1: 0.4676
 epoch: 77, train_loss: 0.9005, test_loss: 1.0915, test_f1: 0.4758
 epoch: 78, train_loss: 0.9053, test_loss: 1.0952, test_f1: 0.4763
 epoch: 79, train_loss: 0.9072, test_loss: 1.0873, test_f1: 0.4852
 epoch: 80, train_loss: 0.9062, test_loss: 1.0884, test_f1: 0.4801
 epoch: 81, train_loss: 0.9021, test_loss: 1.0985, test_f1: 0.4868
 epoch: 82, train_loss: 0.8878, test_loss: 1.0794, test_f1: 0.4879
 epoch: 83, train_loss: 0.8933, test_loss: 1.0947, test_f1: 0.4844
 epoch: 84, train_loss: 0.8909, test_loss: 1.0903, test_f1: 0.4892
 epoch: 85, train_loss: 0.8929, test_loss: 1.0953, test_f1: 0.4844
 epoch: 86, train_loss: 0.8867, test_loss: 1.0855, test_f1: 0.4936
 epoch: 87, train_loss: 0.8953, test_loss: 1.0909, test_f1: 0.4858
 epoch: 88, train_loss: 0.8954, test_loss: 1.0866, test_f1: 0.4784
 epoch: 89, train_loss: 0.8901, test_loss: 1.1062, test_f1: 0.4883
 epoch: 90, train_loss: 0.8910, test_loss: 1.0821, test_f1: 0.5018
 epoch: 91, train_loss: 0.8863, test_loss: 1.0909, test_f1: 0.4849
 epoch: 92, train_loss: 0.8896, test_loss: 1.0921, test_f1: 0.4845
 epoch: 93, train_loss: 0.8962, test_loss: 1.0949, test_f1: 0.4983
 epoch: 94, train_loss: 0.8895, test_loss: 1.0811, test_f1: 0.4983
 epoch: 95, train_loss: 0.8912, test_loss: 1.0814, test_f1: 0.5014
 epoch: 96, train_loss: 0.8796, test_loss: 1.0830, test_f1: 0.5003
 epoch: 97, train_loss: 0.8885, test_loss: 1.0902, test_f1: 0.5031
 epoch: 98, train_loss: 0.8876, test_loss: 1.1075, test_f1: 0.4922
 epoch: 99, train_loss: 0.8864, test_loss: 1.0889, test_f1: 0.5040
##################ITERATION #3 ****************************************
 epoch: 0, train_loss: 1.3058, test_loss: 1.3342, test_f1: 0.2281
 epoch: 1, train_loss: 1.2652, test_loss: 1.3249, test_f1: 0.2281
 epoch: 2, train_loss: 1.2458, test_loss: 1.3143, test_f1: 0.2281
 epoch: 3, train_loss: 1.2262, test_loss: 1.3024, test_f1: 0.2281
 epoch: 4, train_loss: 1.2122, test_loss: 1.2826, test_f1: 0.2336
 epoch: 5, train_loss: 1.1960, test_loss: 1.2632, test_f1: 0.2444
 epoch: 6, train_loss: 1.1788, test_loss: 1.2500, test_f1: 0.2540
 epoch: 7, train_loss: 1.1716, test_loss: 1.2379, test_f1: 0.2570
 epoch: 8, train_loss: 1.1571, test_loss: 1.2270, test_f1: 0.2571
 epoch: 9, train_loss: 1.1428, test_loss: 1.2169, test_f1: 0.2994
 epoch: 10, train_loss: 1.1266, test_loss: 1.2077, test_f1: 0.3015
 epoch: 11, train_loss: 1.1232, test_loss: 1.1997, test_f1: 0.3130
 epoch: 12, train_loss: 1.1109, test_loss: 1.1917, test_f1: 0.3165
 epoch: 13, train_loss: 1.1008, test_loss: 1.1863, test_f1: 0.3451
 epoch: 14, train_loss: 1.1020, test_loss: 1.1835, test_f1: 0.3500
 epoch: 15, train_loss: 1.0882, test_loss: 1.1777, test_f1: 0.3500
 epoch: 16, train_loss: 1.0792, test_loss: 1.1728, test_f1: 0.3696
 epoch: 17, train_loss: 1.0654, test_loss: 1.1708, test_f1: 0.3972
 epoch: 18, train_loss: 1.0625, test_loss: 1.1662, test_f1: 0.3950
 epoch: 19, train_loss: 1.0558, test_loss: 1.1634, test_f1: 0.3973
 epoch: 20, train_loss: 1.0513, test_loss: 1.1588, test_f1: 0.3979
 epoch: 21, train_loss: 1.0497, test_loss: 1.1526, test_f1: 0.4008
 epoch: 22, train_loss: 1.0357, test_loss: 1.1468, test_f1: 0.4025
 epoch: 23, train_loss: 1.0383, test_loss: 1.1474, test_f1: 0.4085
 epoch: 24, train_loss: 1.0254, test_loss: 1.1427, test_f1: 0.4068
 epoch: 25, train_loss: 1.0295, test_loss: 1.1402, test_f1: 0.4028
 epoch: 26, train_loss: 1.0222, test_loss: 1.1363, test_f1: 0.4004
 epoch: 27, train_loss: 1.0215, test_loss: 1.1381, test_f1: 0.4144
 epoch: 28, train_loss: 1.0186, test_loss: 1.1269, test_f1: 0.4124
 epoch: 29, train_loss: 0.9997, test_loss: 1.1271, test_f1: 0.4207
 epoch: 30, train_loss: 0.9901, test_loss: 1.1284, test_f1: 0.4310
 epoch: 31, train_loss: 0.9936, test_loss: 1.1257, test_f1: 0.4285
 epoch: 32, train_loss: 0.9901, test_loss: 1.1224, test_f1: 0.4314
 epoch: 33, train_loss: 0.9797, test_loss: 1.1195, test_f1: 0.4328
 epoch: 34, train_loss: 0.9806, test_loss: 1.1221, test_f1: 0.4371
 epoch: 35, train_loss: 0.9722, test_loss: 1.1091, test_f1: 0.4359
 epoch: 36, train_loss: 0.9749, test_loss: 1.1154, test_f1: 0.4467
 epoch: 37, train_loss: 0.9719, test_loss: 1.1015, test_f1: 0.4565
 epoch: 38, train_loss: 0.9583, test_loss: 1.1033, test_f1: 0.4475
 epoch: 39, train_loss: 0.9542, test_loss: 1.1053, test_f1: 0.4553
 epoch: 40, train_loss: 0.9449, test_loss: 1.0943, test_f1: 0.4716
 epoch: 41, train_loss: 0.9457, test_loss: 1.1011, test_f1: 0.4484
 epoch: 42, train_loss: 0.9513, test_loss: 1.1019, test_f1: 0.4659
 epoch: 43, train_loss: 0.9352, test_loss: 1.0910, test_f1: 0.4806
 epoch: 44, train_loss: 0.9412, test_loss: 1.0916, test_f1: 0.4771
 epoch: 45, train_loss: 0.9280, test_loss: 1.0985, test_f1: 0.4813
 epoch: 46, train_loss: 0.9370, test_loss: 1.0912, test_f1: 0.4806
 epoch: 47, train_loss: 0.9250, test_loss: 1.0948, test_f1: 0.4842
 epoch: 48, train_loss: 0.9253, test_loss: 1.0984, test_f1: 0.4821
 epoch: 49, train_loss: 0.9183, test_loss: 1.0864, test_f1: 0.4849
 epoch: 50, train_loss: 0.9135, test_loss: 1.0958, test_f1: 0.4797
 epoch: 51, train_loss: 0.9088, test_loss: 1.0935, test_f1: 0.4858
 epoch: 52, train_loss: 0.9121, test_loss: 1.0923, test_f1: 0.4880
 epoch: 53, train_loss: 0.9149, test_loss: 1.1066, test_f1: 0.4866
 epoch: 54, train_loss: 0.9044, test_loss: 1.1014, test_f1: 0.4862
 epoch: 55, train_loss: 0.9033, test_loss: 1.0998, test_f1: 0.4878
 epoch: 56, train_loss: 0.9013, test_loss: 1.1007, test_f1: 0.4901
 epoch: 57, train_loss: 0.9024, test_loss: 1.1044, test_f1: 0.4905
 epoch: 58, train_loss: 0.8966, test_loss: 1.0954, test_f1: 0.4991
 epoch: 59, train_loss: 0.9067, test_loss: 1.1074, test_f1: 0.4928
 epoch: 60, train_loss: 0.8974, test_loss: 1.1029, test_f1: 0.4894
 epoch: 61, train_loss: 0.8951, test_loss: 1.0954, test_f1: 0.5071
 epoch: 62, train_loss: 0.8956, test_loss: 1.0992, test_f1: 0.5056
 epoch: 63, train_loss: 0.9018, test_loss: 1.0950, test_f1: 0.5114
 epoch: 64, train_loss: 0.8945, test_loss: 1.0999, test_f1: 0.5048
 epoch: 65, train_loss: 0.8970, test_loss: 1.0978, test_f1: 0.5052
 epoch: 66, train_loss: 0.8838, test_loss: 1.0872, test_f1: 0.4983
 epoch: 67, train_loss: 0.8817, test_loss: 1.0951, test_f1: 0.5157
 epoch: 68, train_loss: 0.8885, test_loss: 1.0932, test_f1: 0.5314
 epoch: 69, train_loss: 0.8859, test_loss: 1.0921, test_f1: 0.5226
 epoch: 70, train_loss: 0.8790, test_loss: 1.0997, test_f1: 0.5381
 epoch: 71, train_loss: 0.8783, test_loss: 1.0996, test_f1: 0.5222
 epoch: 72, train_loss: 0.8803, test_loss: 1.0971, test_f1: 0.5218
 epoch: 73, train_loss: 0.8813, test_loss: 1.0961, test_f1: 0.5129
 epoch: 74, train_loss: 0.8777, test_loss: 1.0862, test_f1: 0.5303
 epoch: 75, train_loss: 0.8812, test_loss: 1.0948, test_f1: 0.5427
 epoch: 76, train_loss: 0.8892, test_loss: 1.0949, test_f1: 0.5307
 epoch: 77, train_loss: 0.8792, test_loss: 1.0871, test_f1: 0.5279
 epoch: 78, train_loss: 0.8764, test_loss: 1.1023, test_f1: 0.5211
 epoch: 79, train_loss: 0.8850, test_loss: 1.0981, test_f1: 0.5236
 epoch: 80, train_loss: 0.8746, test_loss: 1.1054, test_f1: 0.5290
 epoch: 81, train_loss: 0.8765, test_loss: 1.0842, test_f1: 0.5440
 epoch: 82, train_loss: 0.8689, test_loss: 1.0898, test_f1: 0.5352
 epoch: 83, train_loss: 0.8728, test_loss: 1.1008, test_f1: 0.5283
 epoch: 84, train_loss: 0.8727, test_loss: 1.1072, test_f1: 0.5268
 epoch: 85, train_loss: 0.8714, test_loss: 1.1080, test_f1: 0.5297
 epoch: 86, train_loss: 0.8796, test_loss: 1.1039, test_f1: 0.5350
 epoch: 87, train_loss: 0.8675, test_loss: 1.0905, test_f1: 0.5317
 epoch: 88, train_loss: 0.8705, test_loss: 1.1110, test_f1: 0.5317
 epoch: 89, train_loss: 0.8701, test_loss: 1.0934, test_f1: 0.5365
 epoch: 90, train_loss: 0.8557, test_loss: 1.0839, test_f1: 0.5372
 epoch: 91, train_loss: 0.8658, test_loss: 1.0938, test_f1: 0.5382
 epoch: 92, train_loss: 0.8642, test_loss: 1.0899, test_f1: 0.5355
 epoch: 93, train_loss: 0.8569, test_loss: 1.0867, test_f1: 0.5299
 epoch: 94, train_loss: 0.8652, test_loss: 1.0849, test_f1: 0.5386
 epoch: 95, train_loss: 0.8566, test_loss: 1.0810, test_f1: 0.5365
 epoch: 96, train_loss: 0.8614, test_loss: 1.0882, test_f1: 0.5355
 epoch: 97, train_loss: 0.8593, test_loss: 1.0899, test_f1: 0.5396
 epoch: 98, train_loss: 0.8609, test_loss: 1.0913, test_f1: 0.5398
 epoch: 99, train_loss: 0.8558, test_loss: 1.0780, test_f1: 0.5424
##################ITERATION #4 ****************************************
 epoch: 0, train_loss: 1.3042, test_loss: 1.3253, test_f1: 0.2281
 epoch: 1, train_loss: 1.2361, test_loss: 1.3061, test_f1: 0.2281
 epoch: 2, train_loss: 1.2136, test_loss: 1.2815, test_f1: 0.2281
 epoch: 3, train_loss: 1.1952, test_loss: 1.2594, test_f1: 0.2583
 epoch: 4, train_loss: 1.1667, test_loss: 1.2400, test_f1: 0.2829
 epoch: 5, train_loss: 1.1525, test_loss: 1.2232, test_f1: 0.3070
 epoch: 6, train_loss: 1.1475, test_loss: 1.2084, test_f1: 0.3231
 epoch: 7, train_loss: 1.1259, test_loss: 1.1983, test_f1: 0.3229
 epoch: 8, train_loss: 1.1194, test_loss: 1.1874, test_f1: 0.3393
 epoch: 9, train_loss: 1.1022, test_loss: 1.1774, test_f1: 0.3458
 epoch: 10, train_loss: 1.0990, test_loss: 1.1700, test_f1: 0.3653
 epoch: 11, train_loss: 1.0871, test_loss: 1.1616, test_f1: 0.3738
 epoch: 12, train_loss: 1.0811, test_loss: 1.1534, test_f1: 0.3960
 epoch: 13, train_loss: 1.0751, test_loss: 1.1476, test_f1: 0.4114
 epoch: 14, train_loss: 1.0649, test_loss: 1.1404, test_f1: 0.4118
 epoch: 15, train_loss: 1.0517, test_loss: 1.1350, test_f1: 0.4097
 epoch: 16, train_loss: 1.0488, test_loss: 1.1281, test_f1: 0.4165
 epoch: 17, train_loss: 1.0458, test_loss: 1.1216, test_f1: 0.4165
 epoch: 18, train_loss: 1.0422, test_loss: 1.1153, test_f1: 0.4142
 epoch: 19, train_loss: 1.0338, test_loss: 1.1137, test_f1: 0.4168
 epoch: 20, train_loss: 1.0184, test_loss: 1.1144, test_f1: 0.4300
 epoch: 21, train_loss: 1.0190, test_loss: 1.1042, test_f1: 0.4288
 epoch: 22, train_loss: 1.0202, test_loss: 1.1029, test_f1: 0.4307
 epoch: 23, train_loss: 1.0103, test_loss: 1.0968, test_f1: 0.4334
 epoch: 24, train_loss: 1.0052, test_loss: 1.0949, test_f1: 0.4325
 epoch: 25, train_loss: 0.9999, test_loss: 1.0985, test_f1: 0.4298
 epoch: 26, train_loss: 0.9967, test_loss: 1.0871, test_f1: 0.4394
 epoch: 27, train_loss: 0.9906, test_loss: 1.0861, test_f1: 0.4432
 epoch: 28, train_loss: 0.9804, test_loss: 1.0779, test_f1: 0.4437
 epoch: 29, train_loss: 0.9742, test_loss: 1.0686, test_f1: 0.4711
 epoch: 30, train_loss: 0.9728, test_loss: 1.0733, test_f1: 0.4757
 epoch: 31, train_loss: 0.9658, test_loss: 1.0657, test_f1: 0.4740
 epoch: 32, train_loss: 0.9742, test_loss: 1.0606, test_f1: 0.4782
 epoch: 33, train_loss: 0.9659, test_loss: 1.0660, test_f1: 0.4803
 epoch: 34, train_loss: 0.9589, test_loss: 1.0571, test_f1: 0.4898
 epoch: 35, train_loss: 0.9523, test_loss: 1.0641, test_f1: 0.4928
 epoch: 36, train_loss: 0.9563, test_loss: 1.0529, test_f1: 0.4985
 epoch: 37, train_loss: 0.9468, test_loss: 1.0612, test_f1: 0.4925
 epoch: 38, train_loss: 0.9488, test_loss: 1.0537, test_f1: 0.4992
 epoch: 39, train_loss: 0.9441, test_loss: 1.0569, test_f1: 0.5016
 epoch: 40, train_loss: 0.9328, test_loss: 1.0498, test_f1: 0.4955
 epoch: 41, train_loss: 0.9329, test_loss: 1.0492, test_f1: 0.5115
 epoch: 42, train_loss: 0.9261, test_loss: 1.0376, test_f1: 0.5209
 epoch: 43, train_loss: 0.9246, test_loss: 1.0411, test_f1: 0.5176
 epoch: 44, train_loss: 0.9185, test_loss: 1.0406, test_f1: 0.5160
 epoch: 45, train_loss: 0.9195, test_loss: 1.0456, test_f1: 0.5113
 epoch: 46, train_loss: 0.9176, test_loss: 1.0458, test_f1: 0.5239
 epoch: 47, train_loss: 0.9067, test_loss: 1.0333, test_f1: 0.5432
 epoch: 48, train_loss: 0.9065, test_loss: 1.0413, test_f1: 0.5375
 epoch: 49, train_loss: 0.9057, test_loss: 1.0336, test_f1: 0.5563
 epoch: 50, train_loss: 0.9026, test_loss: 1.0338, test_f1: 0.5654
 epoch: 51, train_loss: 0.9028, test_loss: 1.0312, test_f1: 0.5589
 epoch: 52, train_loss: 0.8980, test_loss: 1.0260, test_f1: 0.5513
 epoch: 53, train_loss: 0.8988, test_loss: 1.0274, test_f1: 0.5596
 epoch: 54, train_loss: 0.9018, test_loss: 1.0262, test_f1: 0.5430
 epoch: 55, train_loss: 0.8979, test_loss: 1.0231, test_f1: 0.5461
 epoch: 56, train_loss: 0.8916, test_loss: 1.0380, test_f1: 0.5483
 epoch: 57, train_loss: 0.9014, test_loss: 1.0361, test_f1: 0.5531
 epoch: 58, train_loss: 0.8822, test_loss: 1.0252, test_f1: 0.5583
 epoch: 59, train_loss: 0.8910, test_loss: 1.0333, test_f1: 0.5636
 epoch: 60, train_loss: 0.8858, test_loss: 1.0352, test_f1: 0.5501
 epoch: 61, train_loss: 0.8913, test_loss: 1.0274, test_f1: 0.5616
 epoch: 62, train_loss: 0.8908, test_loss: 1.0259, test_f1: 0.5712
 epoch: 63, train_loss: 0.8798, test_loss: 1.0258, test_f1: 0.5720
 epoch: 64, train_loss: 0.8777, test_loss: 1.0258, test_f1: 0.5556
 epoch: 65, train_loss: 0.8887, test_loss: 1.0241, test_f1: 0.5689
 epoch: 66, train_loss: 0.8895, test_loss: 1.0240, test_f1: 0.5643
 epoch: 67, train_loss: 0.8750, test_loss: 1.0298, test_f1: 0.5786
 epoch: 68, train_loss: 0.8793, test_loss: 1.0303, test_f1: 0.5748
 epoch: 69, train_loss: 0.8793, test_loss: 1.0335, test_f1: 0.5674
 epoch: 70, train_loss: 0.8825, test_loss: 1.0258, test_f1: 0.5868
 epoch: 71, train_loss: 0.8830, test_loss: 1.0252, test_f1: 0.5791
 epoch: 72, train_loss: 0.8680, test_loss: 1.0228, test_f1: 0.5668
 epoch: 73, train_loss: 0.8822, test_loss: 1.0271, test_f1: 0.5737
 epoch: 74, train_loss: 0.8749, test_loss: 1.0342, test_f1: 0.5698
 epoch: 75, train_loss: 0.8685, test_loss: 1.0195, test_f1: 0.5705
 epoch: 76, train_loss: 0.8729, test_loss: 1.0258, test_f1: 0.5742
 epoch: 77, train_loss: 0.8771, test_loss: 1.0245, test_f1: 0.5739
 epoch: 78, train_loss: 0.8770, test_loss: 1.0282, test_f1: 0.5779
 epoch: 79, train_loss: 0.8654, test_loss: 1.0254, test_f1: 0.5722
 epoch: 80, train_loss: 0.8683, test_loss: 1.0283, test_f1: 0.5831
 epoch: 81, train_loss: 0.8688, test_loss: 1.0196, test_f1: 0.5704
 epoch: 82, train_loss: 0.8709, test_loss: 1.0195, test_f1: 0.5713
 epoch: 83, train_loss: 0.8672, test_loss: 1.0338, test_f1: 0.5698
 epoch: 84, train_loss: 0.8638, test_loss: 1.0214, test_f1: 0.5867
 epoch: 85, train_loss: 0.8640, test_loss: 1.0194, test_f1: 0.5873
 epoch: 86, train_loss: 0.8625, test_loss: 1.0215, test_f1: 0.5702
 epoch: 87, train_loss: 0.8538, test_loss: 1.0175, test_f1: 0.5755
 epoch: 88, train_loss: 0.8623, test_loss: 1.0227, test_f1: 0.5748
 epoch: 89, train_loss: 0.8620, test_loss: 1.0230, test_f1: 0.5843
 epoch: 90, train_loss: 0.8588, test_loss: 1.0187, test_f1: 0.5843
 epoch: 91, train_loss: 0.8478, test_loss: 1.0308, test_f1: 0.5846
 epoch: 92, train_loss: 0.8591, test_loss: 1.0341, test_f1: 0.5810
 epoch: 93, train_loss: 0.8487, test_loss: 1.0360, test_f1: 0.5782
 epoch: 94, train_loss: 0.8638, test_loss: 1.0254, test_f1: 0.5795
 epoch: 95, train_loss: 0.8561, test_loss: 1.0269, test_f1: 0.5754
 epoch: 96, train_loss: 0.8536, test_loss: 1.0209, test_f1: 0.5832
 epoch: 97, train_loss: 0.8513, test_loss: 1.0306, test_f1: 0.5843
 epoch: 98, train_loss: 0.8477, test_loss: 1.0280, test_f1: 0.5849
 epoch: 99, train_loss: 0.8499, test_loss: 1.0231, test_f1: 0.5800
##################ITERATION #5 ****************************************
 epoch: 0, train_loss: 1.2609, test_loss: 1.3109, test_f1: 0.2281
 epoch: 1, train_loss: 1.2050, test_loss: 1.2925, test_f1: 0.2281
 epoch: 2, train_loss: 1.1716, test_loss: 1.2602, test_f1: 0.2336
 epoch: 3, train_loss: 1.1550, test_loss: 1.2273, test_f1: 0.2979
 epoch: 4, train_loss: 1.1350, test_loss: 1.2024, test_f1: 0.3227
 epoch: 5, train_loss: 1.1168, test_loss: 1.1815, test_f1: 0.3203
 epoch: 6, train_loss: 1.1067, test_loss: 1.1673, test_f1: 0.3168
 epoch: 7, train_loss: 1.0911, test_loss: 1.1579, test_f1: 0.3162
 epoch: 8, train_loss: 1.0819, test_loss: 1.1513, test_f1: 0.3525
 epoch: 9, train_loss: 1.0798, test_loss: 1.1433, test_f1: 0.3528
 epoch: 10, train_loss: 1.0660, test_loss: 1.1369, test_f1: 0.3539
 epoch: 11, train_loss: 1.0555, test_loss: 1.1332, test_f1: 0.3654
 epoch: 12, train_loss: 1.0566, test_loss: 1.1303, test_f1: 0.3626
 epoch: 13, train_loss: 1.0549, test_loss: 1.1229, test_f1: 0.3776
 epoch: 14, train_loss: 1.0420, test_loss: 1.1201, test_f1: 0.4246
 epoch: 15, train_loss: 1.0396, test_loss: 1.1179, test_f1: 0.4360
 epoch: 16, train_loss: 1.0458, test_loss: 1.1152, test_f1: 0.4223
 epoch: 17, train_loss: 1.0327, test_loss: 1.1134, test_f1: 0.4250
 epoch: 18, train_loss: 1.0251, test_loss: 1.1095, test_f1: 0.4377
 epoch: 19, train_loss: 1.0278, test_loss: 1.1076, test_f1: 0.4386
 epoch: 20, train_loss: 1.0160, test_loss: 1.1034, test_f1: 0.4386
 epoch: 21, train_loss: 1.0088, test_loss: 1.1002, test_f1: 0.4434
 epoch: 22, train_loss: 1.0042, test_loss: 1.1021, test_f1: 0.4386
 epoch: 23, train_loss: 1.0022, test_loss: 1.0961, test_f1: 0.4419
 epoch: 24, train_loss: 1.0016, test_loss: 1.0901, test_f1: 0.4498
 epoch: 25, train_loss: 0.9929, test_loss: 1.0908, test_f1: 0.4591
 epoch: 26, train_loss: 0.9978, test_loss: 1.0856, test_f1: 0.4475
 epoch: 27, train_loss: 0.9952, test_loss: 1.0830, test_f1: 0.4374
 epoch: 28, train_loss: 0.9917, test_loss: 1.0802, test_f1: 0.4546
 epoch: 29, train_loss: 0.9816, test_loss: 1.0678, test_f1: 0.4501
 epoch: 30, train_loss: 0.9780, test_loss: 1.0703, test_f1: 0.4582
 epoch: 31, train_loss: 0.9780, test_loss: 1.0737, test_f1: 0.4647
 epoch: 32, train_loss: 0.9756, test_loss: 1.0685, test_f1: 0.4689
 epoch: 33, train_loss: 0.9699, test_loss: 1.0683, test_f1: 0.4611
 epoch: 34, train_loss: 0.9681, test_loss: 1.0651, test_f1: 0.4624
 epoch: 35, train_loss: 0.9670, test_loss: 1.0650, test_f1: 0.4698
 epoch: 36, train_loss: 0.9563, test_loss: 1.0623, test_f1: 0.4640
 epoch: 37, train_loss: 0.9643, test_loss: 1.0644, test_f1: 0.4653
 epoch: 38, train_loss: 0.9655, test_loss: 1.0486, test_f1: 0.4705
 epoch: 39, train_loss: 0.9558, test_loss: 1.0497, test_f1: 0.4725
 epoch: 40, train_loss: 0.9469, test_loss: 1.0621, test_f1: 0.4732
 epoch: 41, train_loss: 0.9434, test_loss: 1.0490, test_f1: 0.4745
 epoch: 42, train_loss: 0.9497, test_loss: 1.0436, test_f1: 0.4844
 epoch: 43, train_loss: 0.9391, test_loss: 1.0388, test_f1: 0.4965
 epoch: 44, train_loss: 0.9412, test_loss: 1.0457, test_f1: 0.4926
 epoch: 45, train_loss: 0.9397, test_loss: 1.0363, test_f1: 0.4974
 epoch: 46, train_loss: 0.9250, test_loss: 1.0415, test_f1: 0.4926
 epoch: 47, train_loss: 0.9336, test_loss: 1.0319, test_f1: 0.5155
 epoch: 48, train_loss: 0.9317, test_loss: 1.0251, test_f1: 0.5162
 epoch: 49, train_loss: 0.9175, test_loss: 1.0255, test_f1: 0.5162
 epoch: 50, train_loss: 0.9169, test_loss: 1.0329, test_f1: 0.5149
 epoch: 51, train_loss: 0.9127, test_loss: 1.0279, test_f1: 0.5131
 epoch: 52, train_loss: 0.9253, test_loss: 1.0269, test_f1: 0.5097
 epoch: 53, train_loss: 0.9200, test_loss: 1.0352, test_f1: 0.5117
 epoch: 54, train_loss: 0.9198, test_loss: 1.0277, test_f1: 0.5137
 epoch: 55, train_loss: 0.9208, test_loss: 1.0249, test_f1: 0.5172
 epoch: 56, train_loss: 0.9053, test_loss: 1.0305, test_f1: 0.5124
 epoch: 57, train_loss: 0.9176, test_loss: 1.0270, test_f1: 0.5205
 epoch: 58, train_loss: 0.9112, test_loss: 1.0234, test_f1: 0.5136
 epoch: 59, train_loss: 0.9174, test_loss: 1.0190, test_f1: 0.5157
 epoch: 60, train_loss: 0.9087, test_loss: 1.0271, test_f1: 0.5123
 epoch: 61, train_loss: 0.9049, test_loss: 1.0312, test_f1: 0.5130
 epoch: 62, train_loss: 0.9055, test_loss: 1.0264, test_f1: 0.5143
 epoch: 63, train_loss: 0.9105, test_loss: 1.0218, test_f1: 0.5147
 epoch: 64, train_loss: 0.9028, test_loss: 1.0199, test_f1: 0.5126
 epoch: 65, train_loss: 0.8932, test_loss: 1.0224, test_f1: 0.5150
 epoch: 66, train_loss: 0.8978, test_loss: 1.0192, test_f1: 0.5115
 epoch: 67, train_loss: 0.8949, test_loss: 1.0211, test_f1: 0.5139
 epoch: 68, train_loss: 0.8888, test_loss: 1.0118, test_f1: 0.5311
 epoch: 69, train_loss: 0.8992, test_loss: 1.0237, test_f1: 0.5139
 epoch: 70, train_loss: 0.8957, test_loss: 1.0117, test_f1: 0.5285
 epoch: 71, train_loss: 0.8964, test_loss: 1.0141, test_f1: 0.5228
 epoch: 72, train_loss: 0.8949, test_loss: 1.0142, test_f1: 0.5253
 epoch: 73, train_loss: 0.8909, test_loss: 1.0136, test_f1: 0.5258
 epoch: 74, train_loss: 0.8925, test_loss: 1.0116, test_f1: 0.5319
 epoch: 75, train_loss: 0.8945, test_loss: 1.0082, test_f1: 0.5360
 epoch: 76, train_loss: 0.8850, test_loss: 1.0098, test_f1: 0.5396
 epoch: 77, train_loss: 0.8934, test_loss: 1.0183, test_f1: 0.5263
 epoch: 78, train_loss: 0.8912, test_loss: 1.0167, test_f1: 0.5302
 epoch: 79, train_loss: 0.8925, test_loss: 1.0131, test_f1: 0.5323
 epoch: 80, train_loss: 0.8829, test_loss: 1.0096, test_f1: 0.5424
 epoch: 81, train_loss: 0.8865, test_loss: 1.0120, test_f1: 0.5374
 epoch: 82, train_loss: 0.8907, test_loss: 1.0125, test_f1: 0.5334
 epoch: 83, train_loss: 0.8918, test_loss: 1.0116, test_f1: 0.5384
 epoch: 84, train_loss: 0.8705, test_loss: 1.0151, test_f1: 0.5363
 epoch: 85, train_loss: 0.8812, test_loss: 1.0077, test_f1: 0.5396
 epoch: 86, train_loss: 0.8760, test_loss: 1.0197, test_f1: 0.5308
 epoch: 87, train_loss: 0.8763, test_loss: 1.0074, test_f1: 0.5370
 epoch: 88, train_loss: 0.8797, test_loss: 1.0154, test_f1: 0.5385
 epoch: 89, train_loss: 0.8789, test_loss: 1.0120, test_f1: 0.5331
 epoch: 90, train_loss: 0.8804, test_loss: 1.0003, test_f1: 0.5435
 epoch: 91, train_loss: 0.8767, test_loss: 1.0054, test_f1: 0.5374
 epoch: 92, train_loss: 0.8724, test_loss: 1.0018, test_f1: 0.5391
 epoch: 93, train_loss: 0.8699, test_loss: 0.9975, test_f1: 0.5489
 epoch: 94, train_loss: 0.8705, test_loss: 1.0062, test_f1: 0.5331
 epoch: 95, train_loss: 0.8574, test_loss: 1.0067, test_f1: 0.5357
 epoch: 96, train_loss: 0.8748, test_loss: 1.0107, test_f1: 0.5331
 epoch: 97, train_loss: 0.8641, test_loss: 1.0067, test_f1: 0.5331
 epoch: 98, train_loss: 0.8587, test_loss: 1.0071, test_f1: 0.5306
 epoch: 99, train_loss: 0.8722, test_loss: 0.9981, test_f1: 0.5432
##################ITERATION #6 ****************************************
 epoch: 0, train_loss: 1.2715, test_loss: 1.3064, test_f1: 0.2281
 epoch: 1, train_loss: 1.2185, test_loss: 1.2938, test_f1: 0.2281
 epoch: 2, train_loss: 1.1912, test_loss: 1.2795, test_f1: 0.2281
 epoch: 3, train_loss: 1.1692, test_loss: 1.2570, test_f1: 0.2336
 epoch: 4, train_loss: 1.1531, test_loss: 1.2345, test_f1: 0.2889
 epoch: 5, train_loss: 1.1401, test_loss: 1.2163, test_f1: 0.3062
 epoch: 6, train_loss: 1.1206, test_loss: 1.2021, test_f1: 0.3172
 epoch: 7, train_loss: 1.1194, test_loss: 1.1923, test_f1: 0.3472
 epoch: 8, train_loss: 1.1082, test_loss: 1.1842, test_f1: 0.3835
 epoch: 9, train_loss: 1.0960, test_loss: 1.1776, test_f1: 0.4018
 epoch: 10, train_loss: 1.0934, test_loss: 1.1697, test_f1: 0.4189
 epoch: 11, train_loss: 1.0781, test_loss: 1.1664, test_f1: 0.4382
 epoch: 12, train_loss: 1.0749, test_loss: 1.1601, test_f1: 0.4478
 epoch: 13, train_loss: 1.0693, test_loss: 1.1546, test_f1: 0.4542
 epoch: 14, train_loss: 1.0678, test_loss: 1.1544, test_f1: 0.4493
 epoch: 15, train_loss: 1.0550, test_loss: 1.1556, test_f1: 0.4398
 epoch: 16, train_loss: 1.0557, test_loss: 1.1522, test_f1: 0.4335
 epoch: 17, train_loss: 1.0492, test_loss: 1.1444, test_f1: 0.4510
 epoch: 18, train_loss: 1.0429, test_loss: 1.1359, test_f1: 0.4540
 epoch: 19, train_loss: 1.0331, test_loss: 1.1316, test_f1: 0.4532
 epoch: 20, train_loss: 1.0262, test_loss: 1.1337, test_f1: 0.4480
 epoch: 21, train_loss: 1.0263, test_loss: 1.1276, test_f1: 0.4469
 epoch: 22, train_loss: 1.0193, test_loss: 1.1266, test_f1: 0.4466
 epoch: 23, train_loss: 1.0097, test_loss: 1.1206, test_f1: 0.4473
 epoch: 24, train_loss: 1.0093, test_loss: 1.1217, test_f1: 0.4408
 epoch: 25, train_loss: 1.0117, test_loss: 1.1153, test_f1: 0.4597
 epoch: 26, train_loss: 0.9988, test_loss: 1.1059, test_f1: 0.4637
 epoch: 27, train_loss: 1.0017, test_loss: 1.1056, test_f1: 0.4765
 epoch: 28, train_loss: 0.9849, test_loss: 1.1051, test_f1: 0.4715
 epoch: 29, train_loss: 0.9915, test_loss: 1.1000, test_f1: 0.4725
 epoch: 30, train_loss: 0.9800, test_loss: 1.0979, test_f1: 0.4905
 epoch: 31, train_loss: 0.9818, test_loss: 1.0940, test_f1: 0.4866
 epoch: 32, train_loss: 0.9743, test_loss: 1.0859, test_f1: 0.4888
 epoch: 33, train_loss: 0.9820, test_loss: 1.0855, test_f1: 0.4889
 epoch: 34, train_loss: 0.9644, test_loss: 1.0878, test_f1: 0.5046
 epoch: 35, train_loss: 0.9621, test_loss: 1.0814, test_f1: 0.5101
 epoch: 36, train_loss: 0.9645, test_loss: 1.0749, test_f1: 0.5055
 epoch: 37, train_loss: 0.9590, test_loss: 1.0723, test_f1: 0.5089
 epoch: 38, train_loss: 0.9502, test_loss: 1.0732, test_f1: 0.5144
 epoch: 39, train_loss: 0.9476, test_loss: 1.0676, test_f1: 0.5206
 epoch: 40, train_loss: 0.9542, test_loss: 1.0631, test_f1: 0.5102
 epoch: 41, train_loss: 0.9386, test_loss: 1.0623, test_f1: 0.5208
 epoch: 42, train_loss: 0.9474, test_loss: 1.0582, test_f1: 0.5282
 epoch: 43, train_loss: 0.9387, test_loss: 1.0506, test_f1: 0.5275
 epoch: 44, train_loss: 0.9314, test_loss: 1.0460, test_f1: 0.5224
 epoch: 45, train_loss: 0.9322, test_loss: 1.0404, test_f1: 0.5204
 epoch: 46, train_loss: 0.9263, test_loss: 1.0418, test_f1: 0.5220
 epoch: 47, train_loss: 0.9294, test_loss: 1.0490, test_f1: 0.5220
 epoch: 48, train_loss: 0.9165, test_loss: 1.0474, test_f1: 0.5200
 epoch: 49, train_loss: 0.9169, test_loss: 1.0408, test_f1: 0.5199
 epoch: 50, train_loss: 0.9161, test_loss: 1.0427, test_f1: 0.5176
 epoch: 51, train_loss: 0.9069, test_loss: 1.0463, test_f1: 0.5155
 epoch: 52, train_loss: 0.9145, test_loss: 1.0441, test_f1: 0.5212
 epoch: 53, train_loss: 0.9181, test_loss: 1.0450, test_f1: 0.5213
 epoch: 54, train_loss: 0.8972, test_loss: 1.0455, test_f1: 0.5203
 epoch: 55, train_loss: 0.9135, test_loss: 1.0450, test_f1: 0.5230
 epoch: 56, train_loss: 0.9048, test_loss: 1.0450, test_f1: 0.5307
 epoch: 57, train_loss: 0.9100, test_loss: 1.0465, test_f1: 0.5299
 epoch: 58, train_loss: 0.9072, test_loss: 1.0375, test_f1: 0.5354
 epoch: 59, train_loss: 0.8997, test_loss: 1.0414, test_f1: 0.5220
 epoch: 60, train_loss: 0.9058, test_loss: 1.0506, test_f1: 0.5229
 epoch: 61, train_loss: 0.9034, test_loss: 1.0429, test_f1: 0.5355
 epoch: 62, train_loss: 0.8981, test_loss: 1.0387, test_f1: 0.5374
 epoch: 63, train_loss: 0.9037, test_loss: 1.0444, test_f1: 0.5353
 epoch: 64, train_loss: 0.8980, test_loss: 1.0489, test_f1: 0.5357
 epoch: 65, train_loss: 0.8954, test_loss: 1.0476, test_f1: 0.5316
 epoch: 66, train_loss: 0.8963, test_loss: 1.0474, test_f1: 0.5309
 epoch: 67, train_loss: 0.8921, test_loss: 1.0496, test_f1: 0.5217
 epoch: 68, train_loss: 0.8928, test_loss: 1.0576, test_f1: 0.5286
 epoch: 69, train_loss: 0.8855, test_loss: 1.0395, test_f1: 0.5393
 epoch: 70, train_loss: 0.8889, test_loss: 1.0429, test_f1: 0.5363
 epoch: 71, train_loss: 0.8910, test_loss: 1.0378, test_f1: 0.5366
 epoch: 72, train_loss: 0.8825, test_loss: 1.0496, test_f1: 0.5183
 epoch: 73, train_loss: 0.8848, test_loss: 1.0471, test_f1: 0.5316
 epoch: 74, train_loss: 0.8919, test_loss: 1.0384, test_f1: 0.5405
 epoch: 75, train_loss: 0.8862, test_loss: 1.0483, test_f1: 0.5372
 epoch: 76, train_loss: 0.8944, test_loss: 1.0411, test_f1: 0.5351
 epoch: 77, train_loss: 0.8881, test_loss: 1.0498, test_f1: 0.5276
 epoch: 78, train_loss: 0.8756, test_loss: 1.0478, test_f1: 0.5268
 epoch: 79, train_loss: 0.8863, test_loss: 1.0387, test_f1: 0.5386
 epoch: 80, train_loss: 0.8768, test_loss: 1.0454, test_f1: 0.5366
 epoch: 81, train_loss: 0.8749, test_loss: 1.0602, test_f1: 0.5219
 epoch: 82, train_loss: 0.8755, test_loss: 1.0466, test_f1: 0.5319
 epoch: 83, train_loss: 0.8728, test_loss: 1.0432, test_f1: 0.5293
 epoch: 84, train_loss: 0.8715, test_loss: 1.0367, test_f1: 0.5356
 epoch: 85, train_loss: 0.8675, test_loss: 1.0465, test_f1: 0.5323
 epoch: 86, train_loss: 0.8627, test_loss: 1.0365, test_f1: 0.5428
 epoch: 87, train_loss: 0.8683, test_loss: 1.0448, test_f1: 0.5353
 epoch: 88, train_loss: 0.8666, test_loss: 1.0597, test_f1: 0.5265
 epoch: 89, train_loss: 0.8594, test_loss: 1.0540, test_f1: 0.5347
 epoch: 90, train_loss: 0.8613, test_loss: 1.0496, test_f1: 0.5389
 epoch: 91, train_loss: 0.8671, test_loss: 1.0426, test_f1: 0.5377
 epoch: 92, train_loss: 0.8603, test_loss: 1.0531, test_f1: 0.5373
 epoch: 93, train_loss: 0.8685, test_loss: 1.0503, test_f1: 0.5355
 epoch: 94, train_loss: 0.8524, test_loss: 1.0383, test_f1: 0.5407
 epoch: 95, train_loss: 0.8723, test_loss: 1.0297, test_f1: 0.5443
 epoch: 96, train_loss: 0.8583, test_loss: 1.0432, test_f1: 0.5370
 epoch: 97, train_loss: 0.8563, test_loss: 1.0490, test_f1: 0.5379
 epoch: 98, train_loss: 0.8678, test_loss: 1.0461, test_f1: 0.5463
 epoch: 99, train_loss: 0.8524, test_loss: 1.0516, test_f1: 0.5439
##################ITERATION #7 ****************************************
 epoch: 0, train_loss: 1.3000, test_loss: 1.3183, test_f1: 0.2281
 epoch: 1, train_loss: 1.2200, test_loss: 1.3078, test_f1: 0.2281
 epoch: 2, train_loss: 1.1972, test_loss: 1.2912, test_f1: 0.2281
 epoch: 3, train_loss: 1.1784, test_loss: 1.2727, test_f1: 0.2336
 epoch: 4, train_loss: 1.1709, test_loss: 1.2531, test_f1: 0.2336
 epoch: 5, train_loss: 1.1506, test_loss: 1.2391, test_f1: 0.2452
 epoch: 6, train_loss: 1.1471, test_loss: 1.2290, test_f1: 0.2856
 epoch: 7, train_loss: 1.1424, test_loss: 1.2210, test_f1: 0.2891
 epoch: 8, train_loss: 1.1267, test_loss: 1.2145, test_f1: 0.2968
 epoch: 9, train_loss: 1.1342, test_loss: 1.2071, test_f1: 0.3137
 epoch: 10, train_loss: 1.1137, test_loss: 1.2019, test_f1: 0.3137
 epoch: 11, train_loss: 1.1160, test_loss: 1.1933, test_f1: 0.3679
 epoch: 12, train_loss: 1.1013, test_loss: 1.1852, test_f1: 0.3718
 epoch: 13, train_loss: 1.0952, test_loss: 1.1796, test_f1: 0.3839
 epoch: 14, train_loss: 1.0889, test_loss: 1.1723, test_f1: 0.3859
 epoch: 15, train_loss: 1.0855, test_loss: 1.1693, test_f1: 0.3870
 epoch: 16, train_loss: 1.0747, test_loss: 1.1660, test_f1: 0.3947
 epoch: 17, train_loss: 1.0693, test_loss: 1.1574, test_f1: 0.3990
 epoch: 18, train_loss: 1.0657, test_loss: 1.1527, test_f1: 0.3972
 epoch: 19, train_loss: 1.0591, test_loss: 1.1493, test_f1: 0.4086
 epoch: 20, train_loss: 1.0580, test_loss: 1.1438, test_f1: 0.4111
 epoch: 21, train_loss: 1.0446, test_loss: 1.1425, test_f1: 0.4163
 epoch: 22, train_loss: 1.0429, test_loss: 1.1355, test_f1: 0.4246
 epoch: 23, train_loss: 1.0359, test_loss: 1.1291, test_f1: 0.4398
 epoch: 24, train_loss: 1.0300, test_loss: 1.1288, test_f1: 0.4400
 epoch: 25, train_loss: 1.0216, test_loss: 1.1249, test_f1: 0.4450
 epoch: 26, train_loss: 1.0210, test_loss: 1.1221, test_f1: 0.4454
 epoch: 27, train_loss: 1.0161, test_loss: 1.1158, test_f1: 0.4502
 epoch: 28, train_loss: 1.0161, test_loss: 1.1132, test_f1: 0.4437
 epoch: 29, train_loss: 1.0067, test_loss: 1.1137, test_f1: 0.4521
 epoch: 30, train_loss: 0.9968, test_loss: 1.1042, test_f1: 0.4585
 epoch: 31, train_loss: 0.9978, test_loss: 1.1034, test_f1: 0.4688
 epoch: 32, train_loss: 0.9946, test_loss: 1.0978, test_f1: 0.4710
 epoch: 33, train_loss: 0.9928, test_loss: 1.0866, test_f1: 0.4815
 epoch: 34, train_loss: 0.9932, test_loss: 1.0889, test_f1: 0.4798
 epoch: 35, train_loss: 0.9854, test_loss: 1.0821, test_f1: 0.4779
 epoch: 36, train_loss: 0.9774, test_loss: 1.0810, test_f1: 0.4754
 epoch: 37, train_loss: 0.9769, test_loss: 1.0760, test_f1: 0.4902
 epoch: 38, train_loss: 0.9652, test_loss: 1.0695, test_f1: 0.4826
 epoch: 39, train_loss: 0.9623, test_loss: 1.0699, test_f1: 0.4801
 epoch: 40, train_loss: 0.9633, test_loss: 1.0666, test_f1: 0.4838
 epoch: 41, train_loss: 0.9564, test_loss: 1.0659, test_f1: 0.4870
 epoch: 42, train_loss: 0.9573, test_loss: 1.0624, test_f1: 0.4853
 epoch: 43, train_loss: 0.9554, test_loss: 1.0582, test_f1: 0.4882
 epoch: 44, train_loss: 0.9435, test_loss: 1.0549, test_f1: 0.4969
 epoch: 45, train_loss: 0.9432, test_loss: 1.0546, test_f1: 0.4872
 epoch: 46, train_loss: 0.9326, test_loss: 1.0485, test_f1: 0.4962
 epoch: 47, train_loss: 0.9247, test_loss: 1.0505, test_f1: 0.4965
 epoch: 48, train_loss: 0.9211, test_loss: 1.0458, test_f1: 0.4936
 epoch: 49, train_loss: 0.9314, test_loss: 1.0462, test_f1: 0.5072
 epoch: 50, train_loss: 0.9252, test_loss: 1.0504, test_f1: 0.5022
 epoch: 51, train_loss: 0.9243, test_loss: 1.0523, test_f1: 0.4949
 epoch: 52, train_loss: 0.9343, test_loss: 1.0497, test_f1: 0.5021
 epoch: 53, train_loss: 0.9179, test_loss: 1.0488, test_f1: 0.5021
 epoch: 54, train_loss: 0.9168, test_loss: 1.0506, test_f1: 0.4973
 epoch: 55, train_loss: 0.9163, test_loss: 1.0502, test_f1: 0.4973
 epoch: 56, train_loss: 0.9134, test_loss: 1.0496, test_f1: 0.4988
 epoch: 57, train_loss: 0.9188, test_loss: 1.0470, test_f1: 0.5043
 epoch: 58, train_loss: 0.9186, test_loss: 1.0475, test_f1: 0.5093
 epoch: 59, train_loss: 0.9244, test_loss: 1.0489, test_f1: 0.5103
 epoch: 60, train_loss: 0.9142, test_loss: 1.0483, test_f1: 0.5103
 epoch: 61, train_loss: 0.9208, test_loss: 1.0492, test_f1: 0.5054
 epoch: 62, train_loss: 0.9151, test_loss: 1.0498, test_f1: 0.5102
 epoch: 63, train_loss: 0.9131, test_loss: 1.0549, test_f1: 0.5017
 epoch: 64, train_loss: 0.9009, test_loss: 1.0488, test_f1: 0.5068
 epoch: 65, train_loss: 0.9121, test_loss: 1.0470, test_f1: 0.5104
 epoch: 66, train_loss: 0.9040, test_loss: 1.0428, test_f1: 0.5082
 epoch: 67, train_loss: 0.9087, test_loss: 1.0424, test_f1: 0.5058
 epoch: 68, train_loss: 0.9077, test_loss: 1.0466, test_f1: 0.5130
 epoch: 69, train_loss: 0.8964, test_loss: 1.0511, test_f1: 0.5097
 epoch: 70, train_loss: 0.9023, test_loss: 1.0502, test_f1: 0.5120
 epoch: 71, train_loss: 0.8987, test_loss: 1.0528, test_f1: 0.5108
 epoch: 72, train_loss: 0.8944, test_loss: 1.0448, test_f1: 0.5152
 epoch: 73, train_loss: 0.9002, test_loss: 1.0460, test_f1: 0.5148
 epoch: 74, train_loss: 0.9008, test_loss: 1.0452, test_f1: 0.5047
 epoch: 75, train_loss: 0.8994, test_loss: 1.0477, test_f1: 0.5158
 epoch: 76, train_loss: 0.8983, test_loss: 1.0462, test_f1: 0.5160
 epoch: 77, train_loss: 0.8884, test_loss: 1.0445, test_f1: 0.5217
 epoch: 78, train_loss: 0.8899, test_loss: 1.0446, test_f1: 0.5143
 epoch: 79, train_loss: 0.8922, test_loss: 1.0426, test_f1: 0.5167
 epoch: 80, train_loss: 0.8895, test_loss: 1.0462, test_f1: 0.5201
 epoch: 81, train_loss: 0.8884, test_loss: 1.0402, test_f1: 0.5162
 epoch: 82, train_loss: 0.8845, test_loss: 1.0425, test_f1: 0.5202
 epoch: 83, train_loss: 0.8877, test_loss: 1.0412, test_f1: 0.5291
 epoch: 84, train_loss: 0.8861, test_loss: 1.0415, test_f1: 0.5190
 epoch: 85, train_loss: 0.8886, test_loss: 1.0511, test_f1: 0.5189
 epoch: 86, train_loss: 0.8897, test_loss: 1.0488, test_f1: 0.5152
 epoch: 87, train_loss: 0.8814, test_loss: 1.0454, test_f1: 0.5158
 epoch: 88, train_loss: 0.8735, test_loss: 1.0447, test_f1: 0.5187
 epoch: 89, train_loss: 0.8841, test_loss: 1.0443, test_f1: 0.5185
 epoch: 90, train_loss: 0.8842, test_loss: 1.0406, test_f1: 0.5220
 epoch: 91, train_loss: 0.8941, test_loss: 1.0406, test_f1: 0.5246
 epoch: 92, train_loss: 0.8760, test_loss: 1.0424, test_f1: 0.5254
 epoch: 93, train_loss: 0.8667, test_loss: 1.0436, test_f1: 0.5287
 epoch: 94, train_loss: 0.8725, test_loss: 1.0422, test_f1: 0.5254
 epoch: 95, train_loss: 0.8739, test_loss: 1.0422, test_f1: 0.5218
 epoch: 96, train_loss: 0.8835, test_loss: 1.0450, test_f1: 0.5287
 epoch: 97, train_loss: 0.8808, test_loss: 1.0423, test_f1: 0.5320
 epoch: 98, train_loss: 0.8679, test_loss: 1.0447, test_f1: 0.5191
 epoch: 99, train_loss: 0.8745, test_loss: 1.0408, test_f1: 0.5320
##################ITERATION #8 ****************************************
 epoch: 0, train_loss: 1.2728, test_loss: 1.3375, test_f1: 0.2281
 epoch: 1, train_loss: 1.1949, test_loss: 1.3280, test_f1: 0.2583
 epoch: 2, train_loss: 1.1659, test_loss: 1.2972, test_f1: 0.2722
 epoch: 3, train_loss: 1.1513, test_loss: 1.2506, test_f1: 0.3260
 epoch: 4, train_loss: 1.1375, test_loss: 1.2061, test_f1: 0.3772
 epoch: 5, train_loss: 1.1355, test_loss: 1.1815, test_f1: 0.3981
 epoch: 6, train_loss: 1.1152, test_loss: 1.1699, test_f1: 0.4056
 epoch: 7, train_loss: 1.1085, test_loss: 1.1607, test_f1: 0.4047
 epoch: 8, train_loss: 1.0917, test_loss: 1.1505, test_f1: 0.4222
 epoch: 9, train_loss: 1.0965, test_loss: 1.1434, test_f1: 0.4301
 epoch: 10, train_loss: 1.0841, test_loss: 1.1315, test_f1: 0.4330
 epoch: 11, train_loss: 1.0778, test_loss: 1.1223, test_f1: 0.4264
 epoch: 12, train_loss: 1.0511, test_loss: 1.1166, test_f1: 0.4359
 epoch: 13, train_loss: 1.0532, test_loss: 1.1116, test_f1: 0.4559
 epoch: 14, train_loss: 1.0378, test_loss: 1.1059, test_f1: 0.4483
 epoch: 15, train_loss: 1.0351, test_loss: 1.1027, test_f1: 0.4566
 epoch: 16, train_loss: 1.0389, test_loss: 1.0960, test_f1: 0.4584
 epoch: 17, train_loss: 1.0327, test_loss: 1.0890, test_f1: 0.4614
 epoch: 18, train_loss: 1.0321, test_loss: 1.0865, test_f1: 0.4705
 epoch: 19, train_loss: 1.0246, test_loss: 1.0845, test_f1: 0.4771
 epoch: 20, train_loss: 1.0156, test_loss: 1.0793, test_f1: 0.4827
 epoch: 21, train_loss: 1.0118, test_loss: 1.0745, test_f1: 0.4859
 epoch: 22, train_loss: 1.0029, test_loss: 1.0710, test_f1: 0.4899
 epoch: 23, train_loss: 0.9991, test_loss: 1.0617, test_f1: 0.4998
 epoch: 24, train_loss: 1.0035, test_loss: 1.0591, test_f1: 0.4994
 epoch: 25, train_loss: 0.9859, test_loss: 1.0532, test_f1: 0.4964
 epoch: 26, train_loss: 0.9948, test_loss: 1.0457, test_f1: 0.4938
 epoch: 27, train_loss: 0.9851, test_loss: 1.0490, test_f1: 0.5057
 epoch: 28, train_loss: 0.9793, test_loss: 1.0464, test_f1: 0.5037
 epoch: 29, train_loss: 0.9795, test_loss: 1.0401, test_f1: 0.4995
 epoch: 30, train_loss: 0.9753, test_loss: 1.0460, test_f1: 0.4957
 epoch: 31, train_loss: 0.9699, test_loss: 1.0356, test_f1: 0.4980
 epoch: 32, train_loss: 0.9667, test_loss: 1.0376, test_f1: 0.5058
 epoch: 33, train_loss: 0.9691, test_loss: 1.0386, test_f1: 0.5038
 epoch: 34, train_loss: 0.9533, test_loss: 1.0303, test_f1: 0.5078
 epoch: 35, train_loss: 0.9593, test_loss: 1.0301, test_f1: 0.5093
 epoch: 36, train_loss: 0.9523, test_loss: 1.0267, test_f1: 0.5166
 epoch: 37, train_loss: 0.9516, test_loss: 1.0293, test_f1: 0.5186
 epoch: 38, train_loss: 0.9527, test_loss: 1.0312, test_f1: 0.5046
 epoch: 39, train_loss: 0.9434, test_loss: 1.0137, test_f1: 0.5137
 epoch: 40, train_loss: 0.9436, test_loss: 1.0160, test_f1: 0.5029
 epoch: 41, train_loss: 0.9410, test_loss: 1.0162, test_f1: 0.5154
 epoch: 42, train_loss: 0.9306, test_loss: 1.0157, test_f1: 0.5174
 epoch: 43, train_loss: 0.9337, test_loss: 1.0103, test_f1: 0.5304
 epoch: 44, train_loss: 0.9426, test_loss: 1.0204, test_f1: 0.5111
 epoch: 45, train_loss: 0.9343, test_loss: 1.0067, test_f1: 0.5376
 epoch: 46, train_loss: 0.9256, test_loss: 1.0057, test_f1: 0.5456
 epoch: 47, train_loss: 0.9280, test_loss: 1.0102, test_f1: 0.5418
 epoch: 48, train_loss: 0.9195, test_loss: 1.0027, test_f1: 0.5451
 epoch: 49, train_loss: 0.9215, test_loss: 1.0045, test_f1: 0.5404
 epoch: 50, train_loss: 0.9172, test_loss: 1.0116, test_f1: 0.5406
 epoch: 51, train_loss: 0.9111, test_loss: 1.0040, test_f1: 0.5389
 epoch: 52, train_loss: 0.9173, test_loss: 1.0003, test_f1: 0.5420
 epoch: 53, train_loss: 0.9128, test_loss: 0.9985, test_f1: 0.5452
 epoch: 54, train_loss: 0.9065, test_loss: 0.9987, test_f1: 0.5452
 epoch: 55, train_loss: 0.9073, test_loss: 1.0024, test_f1: 0.5379
 epoch: 56, train_loss: 0.9023, test_loss: 1.0080, test_f1: 0.5392
 epoch: 57, train_loss: 0.8979, test_loss: 1.0017, test_f1: 0.5464
 epoch: 58, train_loss: 0.8977, test_loss: 0.9988, test_f1: 0.5430
 epoch: 59, train_loss: 0.9022, test_loss: 1.0013, test_f1: 0.5421
 epoch: 60, train_loss: 0.9106, test_loss: 1.0046, test_f1: 0.5445
 epoch: 61, train_loss: 0.9043, test_loss: 1.0008, test_f1: 0.5479
 epoch: 62, train_loss: 0.9037, test_loss: 0.9960, test_f1: 0.5405
 epoch: 63, train_loss: 0.8931, test_loss: 0.9960, test_f1: 0.5394
 epoch: 64, train_loss: 0.9051, test_loss: 0.9970, test_f1: 0.5357
 epoch: 65, train_loss: 0.8963, test_loss: 0.9982, test_f1: 0.5331
 epoch: 66, train_loss: 0.8935, test_loss: 0.9974, test_f1: 0.5323
 epoch: 67, train_loss: 0.8989, test_loss: 0.9996, test_f1: 0.5430
 epoch: 68, train_loss: 0.8927, test_loss: 0.9933, test_f1: 0.5364
 epoch: 69, train_loss: 0.9004, test_loss: 0.9938, test_f1: 0.5470
 epoch: 70, train_loss: 0.8984, test_loss: 0.9972, test_f1: 0.5464
 epoch: 71, train_loss: 0.8934, test_loss: 0.9992, test_f1: 0.5464
 epoch: 72, train_loss: 0.8888, test_loss: 1.0051, test_f1: 0.5329
 epoch: 73, train_loss: 0.8824, test_loss: 0.9977, test_f1: 0.5395
 epoch: 74, train_loss: 0.8869, test_loss: 0.9967, test_f1: 0.5451
 epoch: 75, train_loss: 0.8836, test_loss: 0.9994, test_f1: 0.5389
 epoch: 76, train_loss: 0.8861, test_loss: 1.0019, test_f1: 0.5356
 epoch: 77, train_loss: 0.8898, test_loss: 1.0038, test_f1: 0.5362
 epoch: 78, train_loss: 0.8852, test_loss: 0.9993, test_f1: 0.5348
 epoch: 79, train_loss: 0.8895, test_loss: 0.9962, test_f1: 0.5371
 epoch: 80, train_loss: 0.8778, test_loss: 1.0015, test_f1: 0.5352
 epoch: 81, train_loss: 0.8816, test_loss: 1.0042, test_f1: 0.5338
 epoch: 82, train_loss: 0.8774, test_loss: 1.0062, test_f1: 0.5393
 epoch: 83, train_loss: 0.8710, test_loss: 1.0018, test_f1: 0.5350
 epoch: 84, train_loss: 0.8776, test_loss: 1.0001, test_f1: 0.5435
 epoch: 85, train_loss: 0.8662, test_loss: 0.9979, test_f1: 0.5355
 epoch: 86, train_loss: 0.8716, test_loss: 1.0007, test_f1: 0.5270
 epoch: 87, train_loss: 0.8787, test_loss: 0.9995, test_f1: 0.5322
 epoch: 88, train_loss: 0.8749, test_loss: 0.9991, test_f1: 0.5339
 epoch: 89, train_loss: 0.8727, test_loss: 1.0010, test_f1: 0.5127
 epoch: 90, train_loss: 0.8660, test_loss: 1.0026, test_f1: 0.5201
 epoch: 91, train_loss: 0.8813, test_loss: 0.9997, test_f1: 0.5404
 epoch: 92, train_loss: 0.8692, test_loss: 0.9972, test_f1: 0.5155
 epoch: 93, train_loss: 0.8634, test_loss: 1.0035, test_f1: 0.5207
 epoch: 94, train_loss: 0.8709, test_loss: 1.0014, test_f1: 0.5383
 epoch: 95, train_loss: 0.8637, test_loss: 1.0013, test_f1: 0.5470
 epoch: 96, train_loss: 0.8656, test_loss: 0.9989, test_f1: 0.5446
 epoch: 97, train_loss: 0.8645, test_loss: 0.9976, test_f1: 0.5472
 epoch: 98, train_loss: 0.8648, test_loss: 1.0010, test_f1: 0.5323
 epoch: 99, train_loss: 0.8548, test_loss: 1.0015, test_f1: 0.5348
##################ITERATION #9 ****************************************
 epoch: 0, train_loss: 1.2913, test_loss: 1.3074, test_f1: 0.2281
 epoch: 1, train_loss: 1.2098, test_loss: 1.2943, test_f1: 0.2281
 epoch: 2, train_loss: 1.1847, test_loss: 1.2797, test_f1: 0.2336
 epoch: 3, train_loss: 1.1650, test_loss: 1.2481, test_f1: 0.2867
 epoch: 4, train_loss: 1.1480, test_loss: 1.2094, test_f1: 0.3078
 epoch: 5, train_loss: 1.1338, test_loss: 1.1818, test_f1: 0.3086
 epoch: 6, train_loss: 1.1186, test_loss: 1.1663, test_f1: 0.3132
 epoch: 7, train_loss: 1.1061, test_loss: 1.1568, test_f1: 0.3156
 epoch: 8, train_loss: 1.1019, test_loss: 1.1463, test_f1: 0.3115
 epoch: 9, train_loss: 1.0903, test_loss: 1.1392, test_f1: 0.3158
 epoch: 10, train_loss: 1.0760, test_loss: 1.1327, test_f1: 0.3242
 epoch: 11, train_loss: 1.0707, test_loss: 1.1276, test_f1: 0.3437
 epoch: 12, train_loss: 1.0650, test_loss: 1.1221, test_f1: 0.3542
 epoch: 13, train_loss: 1.0625, test_loss: 1.1190, test_f1: 0.3566
 epoch: 14, train_loss: 1.0414, test_loss: 1.1095, test_f1: 0.3595
 epoch: 15, train_loss: 1.0377, test_loss: 1.1104, test_f1: 0.3611
 epoch: 16, train_loss: 1.0383, test_loss: 1.1032, test_f1: 0.3674
 epoch: 17, train_loss: 1.0231, test_loss: 1.0988, test_f1: 0.3725
 epoch: 18, train_loss: 1.0183, test_loss: 1.0957, test_f1: 0.3773
 epoch: 19, train_loss: 1.0117, test_loss: 1.0904, test_f1: 0.3851
 epoch: 20, train_loss: 1.0012, test_loss: 1.0863, test_f1: 0.3983
 epoch: 21, train_loss: 1.0113, test_loss: 1.0793, test_f1: 0.3969
 epoch: 22, train_loss: 1.0016, test_loss: 1.0774, test_f1: 0.4236
 epoch: 23, train_loss: 0.9968, test_loss: 1.0803, test_f1: 0.4170
 epoch: 24, train_loss: 0.9958, test_loss: 1.0753, test_f1: 0.4160
 epoch: 25, train_loss: 0.9881, test_loss: 1.0763, test_f1: 0.4255
 epoch: 26, train_loss: 0.9963, test_loss: 1.0716, test_f1: 0.4157
 epoch: 27, train_loss: 0.9767, test_loss: 1.0682, test_f1: 0.4199
 epoch: 28, train_loss: 0.9750, test_loss: 1.0604, test_f1: 0.4335
 epoch: 29, train_loss: 0.9745, test_loss: 1.0593, test_f1: 0.4871
 epoch: 30, train_loss: 0.9682, test_loss: 1.0566, test_f1: 0.4986
 epoch: 31, train_loss: 0.9719, test_loss: 1.0500, test_f1: 0.5055
 epoch: 32, train_loss: 0.9612, test_loss: 1.0455, test_f1: 0.4932
 epoch: 33, train_loss: 0.9626, test_loss: 1.0535, test_f1: 0.4938
 epoch: 34, train_loss: 0.9575, test_loss: 1.0468, test_f1: 0.4896
 epoch: 35, train_loss: 0.9483, test_loss: 1.0606, test_f1: 0.4882
 epoch: 36, train_loss: 0.9480, test_loss: 1.0597, test_f1: 0.5047
 epoch: 37, train_loss: 0.9511, test_loss: 1.0542, test_f1: 0.5010
 epoch: 38, train_loss: 0.9335, test_loss: 1.0521, test_f1: 0.5058
 epoch: 39, train_loss: 0.9354, test_loss: 1.0536, test_f1: 0.5059
 epoch: 40, train_loss: 0.9269, test_loss: 1.0516, test_f1: 0.5136
 epoch: 41, train_loss: 0.9339, test_loss: 1.0541, test_f1: 0.5179
 epoch: 42, train_loss: 0.9192, test_loss: 1.0520, test_f1: 0.5012
 epoch: 43, train_loss: 0.9143, test_loss: 1.0440, test_f1: 0.5242
 epoch: 44, train_loss: 0.9160, test_loss: 1.0438, test_f1: 0.5261
 epoch: 45, train_loss: 0.9146, test_loss: 1.0506, test_f1: 0.5221
 epoch: 46, train_loss: 0.9247, test_loss: 1.0431, test_f1: 0.5360
 epoch: 47, train_loss: 0.9124, test_loss: 1.0477, test_f1: 0.5260
 epoch: 48, train_loss: 0.9139, test_loss: 1.0569, test_f1: 0.5460
 epoch: 49, train_loss: 0.9125, test_loss: 1.0506, test_f1: 0.5388
 epoch: 50, train_loss: 0.8964, test_loss: 1.0494, test_f1: 0.5325
 epoch: 51, train_loss: 0.8953, test_loss: 1.0492, test_f1: 0.5372
 epoch: 52, train_loss: 0.9036, test_loss: 1.0522, test_f1: 0.5369
 epoch: 53, train_loss: 0.8880, test_loss: 1.0532, test_f1: 0.5296
 epoch: 54, train_loss: 0.8935, test_loss: 1.0488, test_f1: 0.5297
 epoch: 55, train_loss: 0.8951, test_loss: 1.0509, test_f1: 0.5336
 epoch: 56, train_loss: 0.8895, test_loss: 1.0528, test_f1: 0.5311
 epoch: 57, train_loss: 0.8976, test_loss: 1.0515, test_f1: 0.5361
 epoch: 58, train_loss: 0.8982, test_loss: 1.0522, test_f1: 0.5338
 epoch: 59, train_loss: 0.8932, test_loss: 1.0571, test_f1: 0.5384
 epoch: 60, train_loss: 0.8894, test_loss: 1.0563, test_f1: 0.5327
 epoch: 61, train_loss: 0.8931, test_loss: 1.0596, test_f1: 0.5298
 epoch: 62, train_loss: 0.8820, test_loss: 1.0532, test_f1: 0.5323
 epoch: 63, train_loss: 0.8878, test_loss: 1.0533, test_f1: 0.5341
 epoch: 64, train_loss: 0.8777, test_loss: 1.0582, test_f1: 0.5284
 epoch: 65, train_loss: 0.8809, test_loss: 1.0593, test_f1: 0.5330
 epoch: 66, train_loss: 0.8855, test_loss: 1.0583, test_f1: 0.5320
 epoch: 67, train_loss: 0.8785, test_loss: 1.0623, test_f1: 0.5276
 epoch: 68, train_loss: 0.8833, test_loss: 1.0576, test_f1: 0.5343
 epoch: 69, train_loss: 0.8795, test_loss: 1.0580, test_f1: 0.5300
 epoch: 70, train_loss: 0.8735, test_loss: 1.0572, test_f1: 0.5338
 epoch: 71, train_loss: 0.8813, test_loss: 1.0592, test_f1: 0.5291
 epoch: 72, train_loss: 0.8743, test_loss: 1.0641, test_f1: 0.5328
 epoch: 73, train_loss: 0.8682, test_loss: 1.0674, test_f1: 0.5382
 epoch: 74, train_loss: 0.8725, test_loss: 1.0719, test_f1: 0.5358
 epoch: 75, train_loss: 0.8679, test_loss: 1.0694, test_f1: 0.5377
 epoch: 76, train_loss: 0.8731, test_loss: 1.0641, test_f1: 0.5294
 epoch: 77, train_loss: 0.8778, test_loss: 1.0649, test_f1: 0.5371
 epoch: 78, train_loss: 0.8672, test_loss: 1.0685, test_f1: 0.5313
 epoch: 79, train_loss: 0.8715, test_loss: 1.0743, test_f1: 0.5311
 epoch: 80, train_loss: 0.8670, test_loss: 1.0709, test_f1: 0.5298
 epoch: 81, train_loss: 0.8653, test_loss: 1.0753, test_f1: 0.5438
 epoch: 82, train_loss: 0.8572, test_loss: 1.0712, test_f1: 0.5352
 epoch: 83, train_loss: 0.8722, test_loss: 1.0689, test_f1: 0.5343
 epoch: 84, train_loss: 0.8618, test_loss: 1.0689, test_f1: 0.5297
 epoch: 85, train_loss: 0.8504, test_loss: 1.0725, test_f1: 0.5358
 epoch: 86, train_loss: 0.8567, test_loss: 1.0720, test_f1: 0.5297
 epoch: 87, train_loss: 0.8589, test_loss: 1.0735, test_f1: 0.5274
 epoch: 88, train_loss: 0.8681, test_loss: 1.0693, test_f1: 0.5373
 epoch: 89, train_loss: 0.8557, test_loss: 1.0766, test_f1: 0.5353
 epoch: 90, train_loss: 0.8608, test_loss: 1.0833, test_f1: 0.5377
 epoch: 91, train_loss: 0.8619, test_loss: 1.0798, test_f1: 0.5312
 epoch: 92, train_loss: 0.8519, test_loss: 1.0743, test_f1: 0.5312
 epoch: 93, train_loss: 0.8607, test_loss: 1.0773, test_f1: 0.5314
 epoch: 94, train_loss: 0.8532, test_loss: 1.0781, test_f1: 0.5366
 epoch: 95, train_loss: 0.8566, test_loss: 1.0778, test_f1: 0.5353
 epoch: 96, train_loss: 0.8466, test_loss: 1.0848, test_f1: 0.5283
 epoch: 97, train_loss: 0.8457, test_loss: 1.0846, test_f1: 0.5336
 epoch: 98, train_loss: 0.8471, test_loss: 1.0854, test_f1: 0.5284
 epoch: 99, train_loss: 0.8463, test_loss: 1.0807, test_f1: 0.5327

Training completed in 312.00 seconds
Best F1: 0.5873 at epoch 85
Mean F1 across iterations: 0.5357  0.0265
========================FINAL RESULTS================================
FEGIN weighted F1: 0.5873  0.0265
python main.py --data ltspice_demos --representation component_net --model FEGIN --layers 2 --hiddens 64 --batch_size 128 --lr 0.0001 --emb_size 512 --epochs 100 --save_appendix component_net_L2_H64_BS128_LR0.0001_E512 --no_val
-----



STDERR:
  File "main.py", line 370, in <module>
    main()
  File "main.py", line 254, in main
    dataset = dataset_class(
  File "/home/philip/projects/ltspice_examples_code_repo/Circuit-Completion-Using-GNNs/component_classification_with_link_prediction_head/evaluation/FEGIN/kernel/circuit_datasets.py", line 15, in __init__
    self.data, self.slices = torch.load(self.processed_paths[0])
  File "/home/philip/.local/lib/python3.8/site-packages/torch/serialization.py", line 1040, in load
    warnings.warn(
  File "/usr/lib/python3.8/warnings.py", line 109, in _showwarnmsg
    sw(msg.message, msg.category, msg.filename, msg.lineno,
  File "main.py", line 47, in warn_with_traceback
    traceback.print_stack(file=log)
/home/philip/projects/ltspice_examples_code_repo/Circuit-Completion-Using-GNNs/component_classification_with_link_prediction_head/evaluation/FEGIN/kernel/circuit_datasets.py:15: FutureWarning: You are using `torch.load` with `weights_only=False` (the current default value), which uses the default pickle module implicitly. It is possible to construct malicious pickle data which will execute arbitrary code during unpickling (See https://github.com/pytorch/pytorch/blob/main/SECURITY.md#untrusted-models for more details). In a future release, the default value for `weights_only` will be flipped to `True`. This limits the functions that could be executed during unpickling. Arbitrary objects will no longer be allowed to be loaded via this mode unless they are explicitly allowlisted by the user via `torch.serialization.add_safe_globals`. We recommend you start setting `weights_only=True` for any use case where you don't have full control of the loaded file. Please open an issue on GitHub for any issues related to this experimental feature.
  self.data, self.slices = torch.load(self.processed_paths[0])
