STDOUT:
Results will be saved in /home/philip/projects/ltspice_examples_code_repo/Circuit-Completion-Using-GNNs/component_classification_with_link_prediction_head/evaluation/FEGIN/results/model_FEGIN_dataset_ltspice_demos
Command line input: python main.py --data ltspice_demos --representation component_net --model FEGIN --layers 2 --hiddens 64 --batch_size 128 --lr 0.0001 --emb_size 512 --epochs 100 --save_appendix component_net_L2_H64_BS128_LR0.0001_E512 --no_val
 is saved.
-----
ltspice_demos - FEGIN
Using 2 layers, 64 hidden units, h = 2
Loading component_net representation dataset
ENTERED
Training FEGIN on component_net representation
Train: 1565, Test: 383
##################ITERATION #0 ****************************************
 epoch: 0, train_loss: 1.3729, test_loss: 1.3675, test_f1: 0.2281
 epoch: 1, train_loss: 1.3663, test_loss: 1.3651, test_f1: 0.2281
 epoch: 2, train_loss: 1.3625, test_loss: 1.3625, test_f1: 0.2281
 epoch: 3, train_loss: 1.3589, test_loss: 1.3600, test_f1: 0.2281
 epoch: 4, train_loss: 1.3552, test_loss: 1.3573, test_f1: 0.2281
 epoch: 5, train_loss: 1.3512, test_loss: 1.3545, test_f1: 0.2281
 epoch: 6, train_loss: 1.3466, test_loss: 1.3516, test_f1: 0.2281
 epoch: 7, train_loss: 1.3421, test_loss: 1.3485, test_f1: 0.2281
 epoch: 8, train_loss: 1.3366, test_loss: 1.3448, test_f1: 0.2281
 epoch: 9, train_loss: 1.3315, test_loss: 1.3406, test_f1: 0.2281
 epoch: 10, train_loss: 1.3239, test_loss: 1.3359, test_f1: 0.2281
 epoch: 11, train_loss: 1.3171, test_loss: 1.3306, test_f1: 0.2281
 epoch: 12, train_loss: 1.3089, test_loss: 1.3250, test_f1: 0.2281
 epoch: 13, train_loss: 1.2980, test_loss: 1.3194, test_f1: 0.2281
 epoch: 14, train_loss: 1.2878, test_loss: 1.3123, test_f1: 0.2357
 epoch: 15, train_loss: 1.2781, test_loss: 1.3050, test_f1: 0.2719
 epoch: 16, train_loss: 1.2664, test_loss: 1.2971, test_f1: 0.2775
 epoch: 17, train_loss: 1.2517, test_loss: 1.2884, test_f1: 0.2731
 epoch: 18, train_loss: 1.2415, test_loss: 1.2802, test_f1: 0.2775
 epoch: 19, train_loss: 1.2311, test_loss: 1.2722, test_f1: 0.2775
 epoch: 20, train_loss: 1.2170, test_loss: 1.2629, test_f1: 0.2775
 epoch: 21, train_loss: 1.2041, test_loss: 1.2548, test_f1: 0.2803
 epoch: 22, train_loss: 1.1939, test_loss: 1.2471, test_f1: 0.2975
 epoch: 23, train_loss: 1.1867, test_loss: 1.2402, test_f1: 0.3366
 epoch: 24, train_loss: 1.1720, test_loss: 1.2340, test_f1: 0.3294
 epoch: 25, train_loss: 1.1692, test_loss: 1.2277, test_f1: 0.3384
 epoch: 26, train_loss: 1.1581, test_loss: 1.2202, test_f1: 0.3368
 epoch: 27, train_loss: 1.1478, test_loss: 1.2145, test_f1: 0.3408
 epoch: 28, train_loss: 1.1392, test_loss: 1.2098, test_f1: 0.3408
 epoch: 29, train_loss: 1.1343, test_loss: 1.2052, test_f1: 0.3495
 epoch: 30, train_loss: 1.1208, test_loss: 1.1996, test_f1: 0.3503
 epoch: 31, train_loss: 1.1185, test_loss: 1.1950, test_f1: 0.3508
 epoch: 32, train_loss: 1.1080, test_loss: 1.1891, test_f1: 0.3619
 epoch: 33, train_loss: 1.1038, test_loss: 1.1853, test_f1: 0.3706
 epoch: 34, train_loss: 1.0967, test_loss: 1.1816, test_f1: 0.3703
 epoch: 35, train_loss: 1.0903, test_loss: 1.1769, test_f1: 0.3807
 epoch: 36, train_loss: 1.0835, test_loss: 1.1750, test_f1: 0.3842
 epoch: 37, train_loss: 1.0755, test_loss: 1.1693, test_f1: 0.3950
 epoch: 38, train_loss: 1.0755, test_loss: 1.1662, test_f1: 0.4051
 epoch: 39, train_loss: 1.0661, test_loss: 1.1614, test_f1: 0.3933
 epoch: 40, train_loss: 1.0605, test_loss: 1.1515, test_f1: 0.3929
 epoch: 41, train_loss: 1.0544, test_loss: 1.1532, test_f1: 0.3873
 epoch: 42, train_loss: 1.0513, test_loss: 1.1522, test_f1: 0.3927
 epoch: 43, train_loss: 1.0431, test_loss: 1.1499, test_f1: 0.3961
 epoch: 44, train_loss: 1.0458, test_loss: 1.1419, test_f1: 0.4047
 epoch: 45, train_loss: 1.0343, test_loss: 1.1395, test_f1: 0.4121
 epoch: 46, train_loss: 1.0327, test_loss: 1.1417, test_f1: 0.4270
 epoch: 47, train_loss: 1.0320, test_loss: 1.1353, test_f1: 0.4286
 epoch: 48, train_loss: 1.0219, test_loss: 1.1364, test_f1: 0.4338
 epoch: 49, train_loss: 1.0188, test_loss: 1.1356, test_f1: 0.4250
 epoch: 50, train_loss: 1.0137, test_loss: 1.1342, test_f1: 0.4362
 epoch: 51, train_loss: 1.0121, test_loss: 1.1295, test_f1: 0.4350
 epoch: 52, train_loss: 1.0076, test_loss: 1.1307, test_f1: 0.4385
 epoch: 53, train_loss: 1.0044, test_loss: 1.1310, test_f1: 0.4321
 epoch: 54, train_loss: 1.0034, test_loss: 1.1240, test_f1: 0.4388
 epoch: 55, train_loss: 1.0046, test_loss: 1.1259, test_f1: 0.4426
 epoch: 56, train_loss: 0.9964, test_loss: 1.1229, test_f1: 0.4487
 epoch: 57, train_loss: 1.0021, test_loss: 1.1193, test_f1: 0.4406
 epoch: 58, train_loss: 0.9964, test_loss: 1.1167, test_f1: 0.4431
 epoch: 59, train_loss: 0.9982, test_loss: 1.1145, test_f1: 0.4472
 epoch: 60, train_loss: 0.9939, test_loss: 1.1065, test_f1: 0.4542
 epoch: 61, train_loss: 0.9913, test_loss: 1.1056, test_f1: 0.4542
 epoch: 62, train_loss: 0.9922, test_loss: 1.1083, test_f1: 0.4563
 epoch: 63, train_loss: 0.9884, test_loss: 1.1065, test_f1: 0.4523
 epoch: 64, train_loss: 0.9881, test_loss: 1.1084, test_f1: 0.4559
 epoch: 65, train_loss: 0.9827, test_loss: 1.1103, test_f1: 0.4579
 epoch: 66, train_loss: 0.9788, test_loss: 1.1106, test_f1: 0.4597
 epoch: 67, train_loss: 0.9863, test_loss: 1.1091, test_f1: 0.4608
 epoch: 68, train_loss: 0.9800, test_loss: 1.1037, test_f1: 0.4608
 epoch: 69, train_loss: 0.9750, test_loss: 1.1037, test_f1: 0.4630
 epoch: 70, train_loss: 0.9794, test_loss: 1.0987, test_f1: 0.4641
 epoch: 71, train_loss: 0.9749, test_loss: 1.0990, test_f1: 0.4676
 epoch: 72, train_loss: 0.9698, test_loss: 1.1069, test_f1: 0.4435
 epoch: 73, train_loss: 0.9702, test_loss: 1.0988, test_f1: 0.4632
 epoch: 74, train_loss: 0.9689, test_loss: 1.0985, test_f1: 0.4654
 epoch: 75, train_loss: 0.9728, test_loss: 1.1001, test_f1: 0.4686
 epoch: 76, train_loss: 0.9620, test_loss: 1.0974, test_f1: 0.4760
 epoch: 77, train_loss: 0.9596, test_loss: 1.0924, test_f1: 0.4760
 epoch: 78, train_loss: 0.9682, test_loss: 1.0990, test_f1: 0.4822
 epoch: 79, train_loss: 0.9619, test_loss: 1.0950, test_f1: 0.4822
 epoch: 80, train_loss: 0.9611, test_loss: 1.0955, test_f1: 0.4767
 epoch: 81, train_loss: 0.9612, test_loss: 1.0944, test_f1: 0.4760
 epoch: 82, train_loss: 0.9568, test_loss: 1.0954, test_f1: 0.4760
 epoch: 83, train_loss: 0.9594, test_loss: 1.0919, test_f1: 0.4698
 epoch: 84, train_loss: 0.9493, test_loss: 1.0959, test_f1: 0.4729
 epoch: 85, train_loss: 0.9562, test_loss: 1.0865, test_f1: 0.4691
 epoch: 86, train_loss: 0.9478, test_loss: 1.0802, test_f1: 0.4664
 epoch: 87, train_loss: 0.9550, test_loss: 1.0874, test_f1: 0.4853
 epoch: 88, train_loss: 0.9494, test_loss: 1.0893, test_f1: 0.4703
 epoch: 89, train_loss: 0.9462, test_loss: 1.0946, test_f1: 0.4764
 epoch: 90, train_loss: 0.9416, test_loss: 1.0871, test_f1: 0.4790
 epoch: 91, train_loss: 0.9425, test_loss: 1.0831, test_f1: 0.4824
 epoch: 92, train_loss: 0.9325, test_loss: 1.0903, test_f1: 0.4769
 epoch: 93, train_loss: 0.9436, test_loss: 1.0890, test_f1: 0.4758
 epoch: 94, train_loss: 0.9343, test_loss: 1.0886, test_f1: 0.4852
 epoch: 95, train_loss: 0.9381, test_loss: 1.0881, test_f1: 0.4810
 epoch: 96, train_loss: 0.9467, test_loss: 1.0936, test_f1: 0.4829
 epoch: 97, train_loss: 0.9298, test_loss: 1.0862, test_f1: 0.4696
 epoch: 98, train_loss: 0.9381, test_loss: 1.0820, test_f1: 0.4928
 epoch: 99, train_loss: 0.9304, test_loss: 1.0882, test_f1: 0.4832
##################ITERATION #1 ****************************************
 epoch: 0, train_loss: 1.3196, test_loss: 1.3378, test_f1: 0.2281
 epoch: 1, train_loss: 1.2994, test_loss: 1.3313, test_f1: 0.2281
 epoch: 2, train_loss: 1.2859, test_loss: 1.3230, test_f1: 0.2281
 epoch: 3, train_loss: 1.2740, test_loss: 1.3114, test_f1: 0.2281
 epoch: 4, train_loss: 1.2642, test_loss: 1.2991, test_f1: 0.2583
 epoch: 5, train_loss: 1.2517, test_loss: 1.2885, test_f1: 0.2583
 epoch: 6, train_loss: 1.2376, test_loss: 1.2813, test_f1: 0.2641
 epoch: 7, train_loss: 1.2249, test_loss: 1.2733, test_f1: 0.2777
 epoch: 8, train_loss: 1.2125, test_loss: 1.2650, test_f1: 0.2831
 epoch: 9, train_loss: 1.2008, test_loss: 1.2573, test_f1: 0.2831
 epoch: 10, train_loss: 1.1893, test_loss: 1.2480, test_f1: 0.2883
 epoch: 11, train_loss: 1.1761, test_loss: 1.2390, test_f1: 0.2934
 epoch: 12, train_loss: 1.1674, test_loss: 1.2309, test_f1: 0.2921
 epoch: 13, train_loss: 1.1509, test_loss: 1.2218, test_f1: 0.3012
 epoch: 14, train_loss: 1.1433, test_loss: 1.2133, test_f1: 0.3570
 epoch: 15, train_loss: 1.1320, test_loss: 1.2059, test_f1: 0.3615
 epoch: 16, train_loss: 1.1223, test_loss: 1.1981, test_f1: 0.3721
 epoch: 17, train_loss: 1.1091, test_loss: 1.1899, test_f1: 0.3877
 epoch: 18, train_loss: 1.1019, test_loss: 1.1827, test_f1: 0.3963
 epoch: 19, train_loss: 1.0932, test_loss: 1.1769, test_f1: 0.3986
 epoch: 20, train_loss: 1.0854, test_loss: 1.1682, test_f1: 0.4004
 epoch: 21, train_loss: 1.0780, test_loss: 1.1608, test_f1: 0.4029
 epoch: 22, train_loss: 1.0682, test_loss: 1.1577, test_f1: 0.4029
 epoch: 23, train_loss: 1.0566, test_loss: 1.1568, test_f1: 0.4069
 epoch: 24, train_loss: 1.0611, test_loss: 1.1495, test_f1: 0.4058
 epoch: 25, train_loss: 1.0438, test_loss: 1.1447, test_f1: 0.4058
 epoch: 26, train_loss: 1.0450, test_loss: 1.1404, test_f1: 0.4078
 epoch: 27, train_loss: 1.0412, test_loss: 1.1382, test_f1: 0.4054
 epoch: 28, train_loss: 1.0319, test_loss: 1.1347, test_f1: 0.4140
 epoch: 29, train_loss: 1.0355, test_loss: 1.1274, test_f1: 0.4119
 epoch: 30, train_loss: 1.0246, test_loss: 1.1232, test_f1: 0.4182
 epoch: 31, train_loss: 1.0103, test_loss: 1.1221, test_f1: 0.4263
 epoch: 32, train_loss: 1.0120, test_loss: 1.1165, test_f1: 0.4199
 epoch: 33, train_loss: 1.0189, test_loss: 1.1120, test_f1: 0.4241
 epoch: 34, train_loss: 1.0047, test_loss: 1.1059, test_f1: 0.4340
 epoch: 35, train_loss: 1.0091, test_loss: 1.1064, test_f1: 0.4391
 epoch: 36, train_loss: 0.9861, test_loss: 1.0964, test_f1: 0.4440
 epoch: 37, train_loss: 0.9920, test_loss: 1.1033, test_f1: 0.4335
 epoch: 38, train_loss: 0.9850, test_loss: 1.0971, test_f1: 0.4407
 epoch: 39, train_loss: 0.9853, test_loss: 1.0964, test_f1: 0.4362
 epoch: 40, train_loss: 0.9845, test_loss: 1.0904, test_f1: 0.4420
 epoch: 41, train_loss: 0.9725, test_loss: 1.0883, test_f1: 0.4490
 epoch: 42, train_loss: 0.9746, test_loss: 1.0837, test_f1: 0.4432
 epoch: 43, train_loss: 0.9707, test_loss: 1.0888, test_f1: 0.4401
 epoch: 44, train_loss: 0.9621, test_loss: 1.0811, test_f1: 0.4560
 epoch: 45, train_loss: 0.9586, test_loss: 1.0870, test_f1: 0.4545
 epoch: 46, train_loss: 0.9607, test_loss: 1.0746, test_f1: 0.4526
 epoch: 47, train_loss: 0.9594, test_loss: 1.0768, test_f1: 0.4563
 epoch: 48, train_loss: 0.9514, test_loss: 1.0829, test_f1: 0.4662
 epoch: 49, train_loss: 0.9463, test_loss: 1.0799, test_f1: 0.4986
 epoch: 50, train_loss: 0.9455, test_loss: 1.0870, test_f1: 0.4783
 epoch: 51, train_loss: 0.9394, test_loss: 1.0858, test_f1: 0.4901
 epoch: 52, train_loss: 0.9377, test_loss: 1.0808, test_f1: 0.4744
 epoch: 53, train_loss: 0.9330, test_loss: 1.0812, test_f1: 0.4847
 epoch: 54, train_loss: 0.9447, test_loss: 1.0835, test_f1: 0.4903
 epoch: 55, train_loss: 0.9330, test_loss: 1.0824, test_f1: 0.4635
 epoch: 56, train_loss: 0.9297, test_loss: 1.0832, test_f1: 0.4703
 epoch: 57, train_loss: 0.9291, test_loss: 1.0820, test_f1: 0.4642
 epoch: 58, train_loss: 0.9336, test_loss: 1.0813, test_f1: 0.4693
 epoch: 59, train_loss: 0.9275, test_loss: 1.0774, test_f1: 0.4803
 epoch: 60, train_loss: 0.9267, test_loss: 1.0817, test_f1: 0.4635
 epoch: 61, train_loss: 0.9273, test_loss: 1.0871, test_f1: 0.4905
 epoch: 62, train_loss: 0.9256, test_loss: 1.0921, test_f1: 0.4719
 epoch: 63, train_loss: 0.9276, test_loss: 1.0845, test_f1: 0.4942
 epoch: 64, train_loss: 0.9222, test_loss: 1.0832, test_f1: 0.5063
 epoch: 65, train_loss: 0.9248, test_loss: 1.0836, test_f1: 0.4849
 epoch: 66, train_loss: 0.9233, test_loss: 1.0785, test_f1: 0.4988
 epoch: 67, train_loss: 0.9218, test_loss: 1.0849, test_f1: 0.4930
 epoch: 68, train_loss: 0.9198, test_loss: 1.0833, test_f1: 0.4976
 epoch: 69, train_loss: 0.9170, test_loss: 1.0817, test_f1: 0.4796
 epoch: 70, train_loss: 0.9280, test_loss: 1.0830, test_f1: 0.4922
 epoch: 71, train_loss: 0.9190, test_loss: 1.0822, test_f1: 0.5135
 epoch: 72, train_loss: 0.9126, test_loss: 1.0872, test_f1: 0.4987
 epoch: 73, train_loss: 0.9157, test_loss: 1.0928, test_f1: 0.4877
 epoch: 74, train_loss: 0.9079, test_loss: 1.0841, test_f1: 0.4683
 epoch: 75, train_loss: 0.9141, test_loss: 1.0999, test_f1: 0.4840
 epoch: 76, train_loss: 0.9129, test_loss: 1.0950, test_f1: 0.4806
 epoch: 77, train_loss: 0.9167, test_loss: 1.0935, test_f1: 0.5061
 epoch: 78, train_loss: 0.9133, test_loss: 1.0907, test_f1: 0.5037
 epoch: 79, train_loss: 0.9089, test_loss: 1.0864, test_f1: 0.4997
 epoch: 80, train_loss: 0.9087, test_loss: 1.0932, test_f1: 0.5026
 epoch: 81, train_loss: 0.9156, test_loss: 1.0937, test_f1: 0.5035
 epoch: 82, train_loss: 0.9110, test_loss: 1.0867, test_f1: 0.5057
 epoch: 83, train_loss: 0.9018, test_loss: 1.0869, test_f1: 0.4995
 epoch: 84, train_loss: 0.9143, test_loss: 1.0990, test_f1: 0.5025
 epoch: 85, train_loss: 0.9054, test_loss: 1.0855, test_f1: 0.5048
 epoch: 86, train_loss: 0.8998, test_loss: 1.0728, test_f1: 0.5039
 epoch: 87, train_loss: 0.9013, test_loss: 1.0899, test_f1: 0.5059
 epoch: 88, train_loss: 0.8972, test_loss: 1.0879, test_f1: 0.5048
 epoch: 89, train_loss: 0.9122, test_loss: 1.0903, test_f1: 0.5066
 epoch: 90, train_loss: 0.9056, test_loss: 1.0886, test_f1: 0.5026
 epoch: 91, train_loss: 0.9008, test_loss: 1.1008, test_f1: 0.4979
 epoch: 92, train_loss: 0.8975, test_loss: 1.1018, test_f1: 0.5104
 epoch: 93, train_loss: 0.8973, test_loss: 1.1006, test_f1: 0.4993
 epoch: 94, train_loss: 0.8961, test_loss: 1.0954, test_f1: 0.5044
 epoch: 95, train_loss: 0.8927, test_loss: 1.0926, test_f1: 0.5086
 epoch: 96, train_loss: 0.8949, test_loss: 1.0867, test_f1: 0.5082
 epoch: 97, train_loss: 0.8956, test_loss: 1.0937, test_f1: 0.5107
 epoch: 98, train_loss: 0.8962, test_loss: 1.0879, test_f1: 0.5106
 epoch: 99, train_loss: 0.8878, test_loss: 1.0907, test_f1: 0.5061
##################ITERATION #2 ****************************************
 epoch: 0, train_loss: 1.3123, test_loss: 1.3321, test_f1: 0.2281
 epoch: 1, train_loss: 1.2858, test_loss: 1.3243, test_f1: 0.2281
 epoch: 2, train_loss: 1.2703, test_loss: 1.3160, test_f1: 0.2281
 epoch: 3, train_loss: 1.2556, test_loss: 1.3033, test_f1: 0.2281
 epoch: 4, train_loss: 1.2449, test_loss: 1.2896, test_f1: 0.2281
 epoch: 5, train_loss: 1.2267, test_loss: 1.2757, test_f1: 0.2281
 epoch: 6, train_loss: 1.2166, test_loss: 1.2633, test_f1: 0.2390
 epoch: 7, train_loss: 1.2007, test_loss: 1.2518, test_f1: 0.2744
 epoch: 8, train_loss: 1.1887, test_loss: 1.2421, test_f1: 0.2842
 epoch: 9, train_loss: 1.1766, test_loss: 1.2322, test_f1: 0.2873
 epoch: 10, train_loss: 1.1593, test_loss: 1.2222, test_f1: 0.2899
 epoch: 11, train_loss: 1.1500, test_loss: 1.2128, test_f1: 0.2923
 epoch: 12, train_loss: 1.1323, test_loss: 1.2050, test_f1: 0.2999
 epoch: 13, train_loss: 1.1264, test_loss: 1.1947, test_f1: 0.3183
 epoch: 14, train_loss: 1.1133, test_loss: 1.1844, test_f1: 0.3389
 epoch: 15, train_loss: 1.1090, test_loss: 1.1751, test_f1: 0.3400
 epoch: 16, train_loss: 1.0998, test_loss: 1.1688, test_f1: 0.3482
 epoch: 17, train_loss: 1.0772, test_loss: 1.1664, test_f1: 0.3503
 epoch: 18, train_loss: 1.0781, test_loss: 1.1601, test_f1: 0.3701
 epoch: 19, train_loss: 1.0714, test_loss: 1.1573, test_f1: 0.4031
 epoch: 20, train_loss: 1.0652, test_loss: 1.1505, test_f1: 0.4037
 epoch: 21, train_loss: 1.0618, test_loss: 1.1474, test_f1: 0.4012
 epoch: 22, train_loss: 1.0531, test_loss: 1.1416, test_f1: 0.4031
 epoch: 23, train_loss: 1.0428, test_loss: 1.1402, test_f1: 0.4094
 epoch: 24, train_loss: 1.0368, test_loss: 1.1376, test_f1: 0.4150
 epoch: 25, train_loss: 1.0295, test_loss: 1.1318, test_f1: 0.4104
 epoch: 26, train_loss: 1.0255, test_loss: 1.1315, test_f1: 0.4211
 epoch: 27, train_loss: 1.0237, test_loss: 1.1318, test_f1: 0.4158
 epoch: 28, train_loss: 1.0220, test_loss: 1.1306, test_f1: 0.4202
 epoch: 29, train_loss: 1.0063, test_loss: 1.1273, test_f1: 0.4155
 epoch: 30, train_loss: 1.0065, test_loss: 1.1256, test_f1: 0.4106
 epoch: 31, train_loss: 1.0052, test_loss: 1.1248, test_f1: 0.4155
 epoch: 32, train_loss: 1.0088, test_loss: 1.1253, test_f1: 0.4249
 epoch: 33, train_loss: 0.9918, test_loss: 1.1186, test_f1: 0.4227
 epoch: 34, train_loss: 0.9944, test_loss: 1.1164, test_f1: 0.4229
 epoch: 35, train_loss: 0.9862, test_loss: 1.1147, test_f1: 0.4231
 epoch: 36, train_loss: 0.9828, test_loss: 1.1249, test_f1: 0.4283
 epoch: 37, train_loss: 0.9741, test_loss: 1.1086, test_f1: 0.4249
 epoch: 38, train_loss: 0.9750, test_loss: 1.1063, test_f1: 0.4367
 epoch: 39, train_loss: 0.9764, test_loss: 1.1053, test_f1: 0.4341
 epoch: 40, train_loss: 0.9768, test_loss: 1.1091, test_f1: 0.4310
 epoch: 41, train_loss: 0.9719, test_loss: 1.1077, test_f1: 0.4313
 epoch: 42, train_loss: 0.9659, test_loss: 1.1191, test_f1: 0.4337
 epoch: 43, train_loss: 0.9613, test_loss: 1.1041, test_f1: 0.4356
 epoch: 44, train_loss: 0.9598, test_loss: 1.1160, test_f1: 0.4352
 epoch: 45, train_loss: 0.9535, test_loss: 1.1057, test_f1: 0.4413
 epoch: 46, train_loss: 0.9487, test_loss: 1.1113, test_f1: 0.4369
 epoch: 47, train_loss: 0.9494, test_loss: 1.1060, test_f1: 0.4351
 epoch: 48, train_loss: 0.9461, test_loss: 1.1082, test_f1: 0.4461
 epoch: 49, train_loss: 0.9454, test_loss: 1.1085, test_f1: 0.4459
 epoch: 50, train_loss: 0.9424, test_loss: 1.1083, test_f1: 0.4542
 epoch: 51, train_loss: 0.9310, test_loss: 1.0968, test_f1: 0.4509
 epoch: 52, train_loss: 0.9339, test_loss: 1.0995, test_f1: 0.4534
 epoch: 53, train_loss: 0.9315, test_loss: 1.1068, test_f1: 0.4500
 epoch: 54, train_loss: 0.9283, test_loss: 1.1087, test_f1: 0.4514
 epoch: 55, train_loss: 0.9321, test_loss: 1.1060, test_f1: 0.4567
 epoch: 56, train_loss: 0.9277, test_loss: 1.1013, test_f1: 0.4561
 epoch: 57, train_loss: 0.9370, test_loss: 1.1027, test_f1: 0.4623
 epoch: 58, train_loss: 0.9229, test_loss: 1.1036, test_f1: 0.4566
 epoch: 59, train_loss: 0.9265, test_loss: 1.1100, test_f1: 0.4538
 epoch: 60, train_loss: 0.9227, test_loss: 1.1070, test_f1: 0.4690
 epoch: 61, train_loss: 0.9234, test_loss: 1.1081, test_f1: 0.4619
 epoch: 62, train_loss: 0.9167, test_loss: 1.1084, test_f1: 0.4627
 epoch: 63, train_loss: 0.9291, test_loss: 1.1080, test_f1: 0.4694
 epoch: 64, train_loss: 0.9134, test_loss: 1.1045, test_f1: 0.4692
 epoch: 65, train_loss: 0.9190, test_loss: 1.0964, test_f1: 0.4651
 epoch: 66, train_loss: 0.9192, test_loss: 1.1043, test_f1: 0.4659
 epoch: 67, train_loss: 0.9253, test_loss: 1.0977, test_f1: 0.4628
 epoch: 68, train_loss: 0.9236, test_loss: 1.1037, test_f1: 0.4836
 epoch: 69, train_loss: 0.9104, test_loss: 1.1008, test_f1: 0.4656
 epoch: 70, train_loss: 0.9097, test_loss: 1.1014, test_f1: 0.4602
 epoch: 71, train_loss: 0.9074, test_loss: 1.0958, test_f1: 0.4594
 epoch: 72, train_loss: 0.9101, test_loss: 1.0956, test_f1: 0.4600
 epoch: 73, train_loss: 0.9069, test_loss: 1.0947, test_f1: 0.4658
 epoch: 74, train_loss: 0.9053, test_loss: 1.0922, test_f1: 0.4634
 epoch: 75, train_loss: 0.9074, test_loss: 1.0967, test_f1: 0.4645
 epoch: 76, train_loss: 0.9039, test_loss: 1.0992, test_f1: 0.4654
 epoch: 77, train_loss: 0.9011, test_loss: 1.0949, test_f1: 0.4723
 epoch: 78, train_loss: 0.9055, test_loss: 1.0972, test_f1: 0.4790
 epoch: 79, train_loss: 0.9074, test_loss: 1.0901, test_f1: 0.4701
 epoch: 80, train_loss: 0.9063, test_loss: 1.0898, test_f1: 0.4806
 epoch: 81, train_loss: 0.9017, test_loss: 1.0999, test_f1: 0.4808
 epoch: 82, train_loss: 0.8885, test_loss: 1.0830, test_f1: 0.4935
 epoch: 83, train_loss: 0.8930, test_loss: 1.0955, test_f1: 0.4856
 epoch: 84, train_loss: 0.8915, test_loss: 1.0922, test_f1: 0.4892
 epoch: 85, train_loss: 0.8933, test_loss: 1.0984, test_f1: 0.4811
 epoch: 86, train_loss: 0.8872, test_loss: 1.0869, test_f1: 0.4972
 epoch: 87, train_loss: 0.8968, test_loss: 1.0925, test_f1: 0.4819
 epoch: 88, train_loss: 0.8954, test_loss: 1.0870, test_f1: 0.4680
 epoch: 89, train_loss: 0.8902, test_loss: 1.1073, test_f1: 0.4907
 epoch: 90, train_loss: 0.8909, test_loss: 1.0850, test_f1: 0.4952
 epoch: 91, train_loss: 0.8861, test_loss: 1.0930, test_f1: 0.4807
 epoch: 92, train_loss: 0.8902, test_loss: 1.0907, test_f1: 0.4998
 epoch: 93, train_loss: 0.8966, test_loss: 1.0947, test_f1: 0.5012
 epoch: 94, train_loss: 0.8893, test_loss: 1.0844, test_f1: 0.5002
 epoch: 95, train_loss: 0.8922, test_loss: 1.0874, test_f1: 0.5037
 epoch: 96, train_loss: 0.8802, test_loss: 1.0894, test_f1: 0.5127
 epoch: 97, train_loss: 0.8886, test_loss: 1.0935, test_f1: 0.5150
 epoch: 98, train_loss: 0.8884, test_loss: 1.1122, test_f1: 0.5110
 epoch: 99, train_loss: 0.8867, test_loss: 1.0919, test_f1: 0.5126
##################ITERATION #3 ****************************************
 epoch: 0, train_loss: 1.3058, test_loss: 1.3343, test_f1: 0.2281
 epoch: 1, train_loss: 1.2653, test_loss: 1.3251, test_f1: 0.2281
 epoch: 2, train_loss: 1.2459, test_loss: 1.3146, test_f1: 0.2281
 epoch: 3, train_loss: 1.2265, test_loss: 1.3025, test_f1: 0.2281
 epoch: 4, train_loss: 1.2124, test_loss: 1.2829, test_f1: 0.2336
 epoch: 5, train_loss: 1.1963, test_loss: 1.2631, test_f1: 0.2444
 epoch: 6, train_loss: 1.1792, test_loss: 1.2501, test_f1: 0.2540
 epoch: 7, train_loss: 1.1718, test_loss: 1.2381, test_f1: 0.2570
 epoch: 8, train_loss: 1.1574, test_loss: 1.2272, test_f1: 0.2571
 epoch: 9, train_loss: 1.1429, test_loss: 1.2169, test_f1: 0.2992
 epoch: 10, train_loss: 1.1266, test_loss: 1.2077, test_f1: 0.3015
 epoch: 11, train_loss: 1.1231, test_loss: 1.1996, test_f1: 0.3130
 epoch: 12, train_loss: 1.1107, test_loss: 1.1912, test_f1: 0.3186
 epoch: 13, train_loss: 1.1008, test_loss: 1.1861, test_f1: 0.3407
 epoch: 14, train_loss: 1.1020, test_loss: 1.1830, test_f1: 0.3502
 epoch: 15, train_loss: 1.0880, test_loss: 1.1780, test_f1: 0.3500
 epoch: 16, train_loss: 1.0794, test_loss: 1.1727, test_f1: 0.3858
 epoch: 17, train_loss: 1.0654, test_loss: 1.1713, test_f1: 0.3974
 epoch: 18, train_loss: 1.0624, test_loss: 1.1660, test_f1: 0.3973
 epoch: 19, train_loss: 1.0554, test_loss: 1.1620, test_f1: 0.3979
 epoch: 20, train_loss: 1.0502, test_loss: 1.1576, test_f1: 0.4005
 epoch: 21, train_loss: 1.0491, test_loss: 1.1527, test_f1: 0.3983
 epoch: 22, train_loss: 1.0349, test_loss: 1.1463, test_f1: 0.4023
 epoch: 23, train_loss: 1.0376, test_loss: 1.1464, test_f1: 0.4025
 epoch: 24, train_loss: 1.0245, test_loss: 1.1432, test_f1: 0.4048
 epoch: 25, train_loss: 1.0285, test_loss: 1.1422, test_f1: 0.4012
 epoch: 26, train_loss: 1.0216, test_loss: 1.1371, test_f1: 0.4023
 epoch: 27, train_loss: 1.0212, test_loss: 1.1384, test_f1: 0.4147
 epoch: 28, train_loss: 1.0185, test_loss: 1.1269, test_f1: 0.4122
 epoch: 29, train_loss: 0.9999, test_loss: 1.1271, test_f1: 0.4232
 epoch: 30, train_loss: 0.9907, test_loss: 1.1272, test_f1: 0.4285
 epoch: 31, train_loss: 0.9938, test_loss: 1.1263, test_f1: 0.4325
 epoch: 32, train_loss: 0.9913, test_loss: 1.1218, test_f1: 0.4314
 epoch: 33, train_loss: 0.9803, test_loss: 1.1233, test_f1: 0.4328
 epoch: 34, train_loss: 0.9815, test_loss: 1.1189, test_f1: 0.4297
 epoch: 35, train_loss: 0.9746, test_loss: 1.1094, test_f1: 0.4374
 epoch: 36, train_loss: 0.9766, test_loss: 1.1220, test_f1: 0.4421
 epoch: 37, train_loss: 0.9733, test_loss: 1.1038, test_f1: 0.4559
 epoch: 38, train_loss: 0.9599, test_loss: 1.1029, test_f1: 0.4475
 epoch: 39, train_loss: 0.9559, test_loss: 1.1048, test_f1: 0.4556
 epoch: 40, train_loss: 0.9465, test_loss: 1.0937, test_f1: 0.4713
 epoch: 41, train_loss: 0.9462, test_loss: 1.1034, test_f1: 0.4513
 epoch: 42, train_loss: 0.9528, test_loss: 1.1049, test_f1: 0.4575
 epoch: 43, train_loss: 0.9375, test_loss: 1.0907, test_f1: 0.4766
 epoch: 44, train_loss: 0.9430, test_loss: 1.0941, test_f1: 0.4811
 epoch: 45, train_loss: 0.9296, test_loss: 1.1035, test_f1: 0.4771
 epoch: 46, train_loss: 0.9395, test_loss: 1.0983, test_f1: 0.4771
 epoch: 47, train_loss: 0.9273, test_loss: 1.0911, test_f1: 0.4816
 epoch: 48, train_loss: 0.9280, test_loss: 1.1008, test_f1: 0.4778
 epoch: 49, train_loss: 0.9200, test_loss: 1.0882, test_f1: 0.4861
 epoch: 50, train_loss: 0.9157, test_loss: 1.0987, test_f1: 0.4824
 epoch: 51, train_loss: 0.9114, test_loss: 1.0960, test_f1: 0.4861
 epoch: 52, train_loss: 0.9152, test_loss: 1.0935, test_f1: 0.4819
 epoch: 53, train_loss: 0.9180, test_loss: 1.1116, test_f1: 0.4858
 epoch: 54, train_loss: 0.9074, test_loss: 1.1121, test_f1: 0.4855
 epoch: 55, train_loss: 0.9063, test_loss: 1.1025, test_f1: 0.4861
 epoch: 56, train_loss: 0.9040, test_loss: 1.1021, test_f1: 0.4915
 epoch: 57, train_loss: 0.9044, test_loss: 1.1123, test_f1: 0.5017
 epoch: 58, train_loss: 0.8997, test_loss: 1.1035, test_f1: 0.5055
 epoch: 59, train_loss: 0.9094, test_loss: 1.1116, test_f1: 0.5161
 epoch: 60, train_loss: 0.9019, test_loss: 1.1100, test_f1: 0.5144
 epoch: 61, train_loss: 0.8985, test_loss: 1.1050, test_f1: 0.5052
 epoch: 62, train_loss: 0.8999, test_loss: 1.1109, test_f1: 0.5083
 epoch: 63, train_loss: 0.9039, test_loss: 1.1030, test_f1: 0.5091
 epoch: 64, train_loss: 0.8972, test_loss: 1.1025, test_f1: 0.5113
 epoch: 65, train_loss: 0.8995, test_loss: 1.1031, test_f1: 0.5087
 epoch: 66, train_loss: 0.8866, test_loss: 1.0971, test_f1: 0.5155
 epoch: 67, train_loss: 0.8827, test_loss: 1.1047, test_f1: 0.5116
 epoch: 68, train_loss: 0.8918, test_loss: 1.1001, test_f1: 0.5273
 epoch: 69, train_loss: 0.8881, test_loss: 1.0993, test_f1: 0.5218
 epoch: 70, train_loss: 0.8823, test_loss: 1.1078, test_f1: 0.5309
 epoch: 71, train_loss: 0.8820, test_loss: 1.1043, test_f1: 0.5182
 epoch: 72, train_loss: 0.8839, test_loss: 1.1047, test_f1: 0.5212
 epoch: 73, train_loss: 0.8841, test_loss: 1.1052, test_f1: 0.5148
 epoch: 74, train_loss: 0.8802, test_loss: 1.1010, test_f1: 0.5201
 epoch: 75, train_loss: 0.8832, test_loss: 1.1084, test_f1: 0.5316
 epoch: 76, train_loss: 0.8921, test_loss: 1.1071, test_f1: 0.5186
 epoch: 77, train_loss: 0.8826, test_loss: 1.0951, test_f1: 0.5207
 epoch: 78, train_loss: 0.8783, test_loss: 1.1046, test_f1: 0.5213
 epoch: 79, train_loss: 0.8866, test_loss: 1.1052, test_f1: 0.5253
 epoch: 80, train_loss: 0.8782, test_loss: 1.1172, test_f1: 0.5284
 epoch: 81, train_loss: 0.8794, test_loss: 1.0916, test_f1: 0.5506
 epoch: 82, train_loss: 0.8703, test_loss: 1.0993, test_f1: 0.5469
 epoch: 83, train_loss: 0.8756, test_loss: 1.1167, test_f1: 0.5253
 epoch: 84, train_loss: 0.8759, test_loss: 1.1175, test_f1: 0.5251
 epoch: 85, train_loss: 0.8739, test_loss: 1.1216, test_f1: 0.5282
 epoch: 86, train_loss: 0.8824, test_loss: 1.1139, test_f1: 0.5297
 epoch: 87, train_loss: 0.8708, test_loss: 1.0998, test_f1: 0.5324
 epoch: 88, train_loss: 0.8736, test_loss: 1.1258, test_f1: 0.5253
 epoch: 89, train_loss: 0.8717, test_loss: 1.1042, test_f1: 0.5348
 epoch: 90, train_loss: 0.8580, test_loss: 1.0983, test_f1: 0.5348
 epoch: 91, train_loss: 0.8682, test_loss: 1.1066, test_f1: 0.5314
 epoch: 92, train_loss: 0.8674, test_loss: 1.0994, test_f1: 0.5313
 epoch: 93, train_loss: 0.8605, test_loss: 1.0985, test_f1: 0.5314
 epoch: 94, train_loss: 0.8691, test_loss: 1.0939, test_f1: 0.5419
 epoch: 95, train_loss: 0.8598, test_loss: 1.0880, test_f1: 0.5486
 epoch: 96, train_loss: 0.8638, test_loss: 1.0986, test_f1: 0.5314
 epoch: 97, train_loss: 0.8620, test_loss: 1.1102, test_f1: 0.5279
 epoch: 98, train_loss: 0.8616, test_loss: 1.1013, test_f1: 0.5452
 epoch: 99, train_loss: 0.8561, test_loss: 1.0890, test_f1: 0.5415
##################ITERATION #4 ****************************************
 epoch: 0, train_loss: 1.3041, test_loss: 1.3253, test_f1: 0.2281
 epoch: 1, train_loss: 1.2362, test_loss: 1.3060, test_f1: 0.2281
 epoch: 2, train_loss: 1.2136, test_loss: 1.2814, test_f1: 0.2281
 epoch: 3, train_loss: 1.1950, test_loss: 1.2592, test_f1: 0.2583
 epoch: 4, train_loss: 1.1665, test_loss: 1.2399, test_f1: 0.2829
 epoch: 5, train_loss: 1.1523, test_loss: 1.2231, test_f1: 0.3070
 epoch: 6, train_loss: 1.1472, test_loss: 1.2079, test_f1: 0.3231
 epoch: 7, train_loss: 1.1254, test_loss: 1.1974, test_f1: 0.3231
 epoch: 8, train_loss: 1.1191, test_loss: 1.1862, test_f1: 0.3399
 epoch: 9, train_loss: 1.1017, test_loss: 1.1753, test_f1: 0.3458
 epoch: 10, train_loss: 1.0980, test_loss: 1.1681, test_f1: 0.3679
 epoch: 11, train_loss: 1.0864, test_loss: 1.1586, test_f1: 0.3811
 epoch: 12, train_loss: 1.0799, test_loss: 1.1510, test_f1: 0.3840
 epoch: 13, train_loss: 1.0742, test_loss: 1.1478, test_f1: 0.4118
 epoch: 14, train_loss: 1.0637, test_loss: 1.1387, test_f1: 0.4119
 epoch: 15, train_loss: 1.0515, test_loss: 1.1356, test_f1: 0.4122
 epoch: 16, train_loss: 1.0476, test_loss: 1.1255, test_f1: 0.4184
 epoch: 17, train_loss: 1.0448, test_loss: 1.1188, test_f1: 0.4153
 epoch: 18, train_loss: 1.0411, test_loss: 1.1128, test_f1: 0.4149
 epoch: 19, train_loss: 1.0330, test_loss: 1.1124, test_f1: 0.4168
 epoch: 20, train_loss: 1.0174, test_loss: 1.1126, test_f1: 0.4300
 epoch: 21, train_loss: 1.0179, test_loss: 1.1027, test_f1: 0.4215
 epoch: 22, train_loss: 1.0204, test_loss: 1.1037, test_f1: 0.4265
 epoch: 23, train_loss: 1.0097, test_loss: 1.0925, test_f1: 0.4337
 epoch: 24, train_loss: 1.0053, test_loss: 1.0942, test_f1: 0.4337
 epoch: 25, train_loss: 0.9990, test_loss: 1.0979, test_f1: 0.4376
 epoch: 26, train_loss: 0.9951, test_loss: 1.0848, test_f1: 0.4350
 epoch: 27, train_loss: 0.9899, test_loss: 1.0850, test_f1: 0.4430
 epoch: 28, train_loss: 0.9789, test_loss: 1.0753, test_f1: 0.4537
 epoch: 29, train_loss: 0.9736, test_loss: 1.0665, test_f1: 0.4759
 epoch: 30, train_loss: 0.9717, test_loss: 1.0733, test_f1: 0.4771
 epoch: 31, train_loss: 0.9653, test_loss: 1.0655, test_f1: 0.4785
 epoch: 32, train_loss: 0.9735, test_loss: 1.0615, test_f1: 0.4773
 epoch: 33, train_loss: 0.9657, test_loss: 1.0662, test_f1: 0.4851
 epoch: 34, train_loss: 0.9582, test_loss: 1.0555, test_f1: 0.4874
 epoch: 35, train_loss: 0.9515, test_loss: 1.0600, test_f1: 0.4962
 epoch: 36, train_loss: 0.9558, test_loss: 1.0537, test_f1: 0.4922
 epoch: 37, train_loss: 0.9470, test_loss: 1.0578, test_f1: 0.4959
 epoch: 38, train_loss: 0.9480, test_loss: 1.0536, test_f1: 0.5054
 epoch: 39, train_loss: 0.9444, test_loss: 1.0544, test_f1: 0.4996
 epoch: 40, train_loss: 0.9327, test_loss: 1.0461, test_f1: 0.4948
 epoch: 41, train_loss: 0.9333, test_loss: 1.0475, test_f1: 0.5282
 epoch: 42, train_loss: 0.9255, test_loss: 1.0357, test_f1: 0.5118
 epoch: 43, train_loss: 0.9242, test_loss: 1.0381, test_f1: 0.5112
 epoch: 44, train_loss: 0.9177, test_loss: 1.0406, test_f1: 0.5152
 epoch: 45, train_loss: 0.9179, test_loss: 1.0429, test_f1: 0.5153
 epoch: 46, train_loss: 0.9175, test_loss: 1.0438, test_f1: 0.5225
 epoch: 47, train_loss: 0.9065, test_loss: 1.0343, test_f1: 0.5382
 epoch: 48, train_loss: 0.9063, test_loss: 1.0398, test_f1: 0.5397
 epoch: 49, train_loss: 0.9059, test_loss: 1.0383, test_f1: 0.5484
 epoch: 50, train_loss: 0.9021, test_loss: 1.0323, test_f1: 0.5597
 epoch: 51, train_loss: 0.9025, test_loss: 1.0300, test_f1: 0.5570
 epoch: 52, train_loss: 0.8977, test_loss: 1.0270, test_f1: 0.5600
 epoch: 53, train_loss: 0.8988, test_loss: 1.0289, test_f1: 0.5558
 epoch: 54, train_loss: 0.9007, test_loss: 1.0264, test_f1: 0.5419
 epoch: 55, train_loss: 0.8975, test_loss: 1.0249, test_f1: 0.5425
 epoch: 56, train_loss: 0.8910, test_loss: 1.0410, test_f1: 0.5406
 epoch: 57, train_loss: 0.9012, test_loss: 1.0331, test_f1: 0.5441
 epoch: 58, train_loss: 0.8817, test_loss: 1.0256, test_f1: 0.5583
 epoch: 59, train_loss: 0.8897, test_loss: 1.0341, test_f1: 0.5582
 epoch: 60, train_loss: 0.8855, test_loss: 1.0361, test_f1: 0.5445
 epoch: 61, train_loss: 0.8918, test_loss: 1.0272, test_f1: 0.5641
 epoch: 62, train_loss: 0.8899, test_loss: 1.0265, test_f1: 0.5591
 epoch: 63, train_loss: 0.8796, test_loss: 1.0254, test_f1: 0.5683
 epoch: 64, train_loss: 0.8774, test_loss: 1.0259, test_f1: 0.5656
 epoch: 65, train_loss: 0.8880, test_loss: 1.0236, test_f1: 0.5696
 epoch: 66, train_loss: 0.8892, test_loss: 1.0232, test_f1: 0.5659
 epoch: 67, train_loss: 0.8747, test_loss: 1.0310, test_f1: 0.5690
 epoch: 68, train_loss: 0.8792, test_loss: 1.0301, test_f1: 0.5694
 epoch: 69, train_loss: 0.8783, test_loss: 1.0306, test_f1: 0.5691
 epoch: 70, train_loss: 0.8816, test_loss: 1.0245, test_f1: 0.5801
 epoch: 71, train_loss: 0.8830, test_loss: 1.0271, test_f1: 0.5809
 epoch: 72, train_loss: 0.8667, test_loss: 1.0225, test_f1: 0.5736
 epoch: 73, train_loss: 0.8820, test_loss: 1.0292, test_f1: 0.5678
 epoch: 74, train_loss: 0.8740, test_loss: 1.0359, test_f1: 0.5658
 epoch: 75, train_loss: 0.8686, test_loss: 1.0191, test_f1: 0.5767
 epoch: 76, train_loss: 0.8726, test_loss: 1.0274, test_f1: 0.5775
 epoch: 77, train_loss: 0.8768, test_loss: 1.0234, test_f1: 0.5705
 epoch: 78, train_loss: 0.8766, test_loss: 1.0309, test_f1: 0.5789
 epoch: 79, train_loss: 0.8654, test_loss: 1.0302, test_f1: 0.5726
 epoch: 80, train_loss: 0.8677, test_loss: 1.0277, test_f1: 0.5748
 epoch: 81, train_loss: 0.8684, test_loss: 1.0219, test_f1: 0.5658
 epoch: 82, train_loss: 0.8704, test_loss: 1.0212, test_f1: 0.5755
 epoch: 83, train_loss: 0.8662, test_loss: 1.0345, test_f1: 0.5765
 epoch: 84, train_loss: 0.8640, test_loss: 1.0215, test_f1: 0.5781
 epoch: 85, train_loss: 0.8635, test_loss: 1.0212, test_f1: 0.5843
 epoch: 86, train_loss: 0.8616, test_loss: 1.0242, test_f1: 0.5788
 epoch: 87, train_loss: 0.8534, test_loss: 1.0194, test_f1: 0.5730
 epoch: 88, train_loss: 0.8622, test_loss: 1.0239, test_f1: 0.5715
 epoch: 89, train_loss: 0.8617, test_loss: 1.0271, test_f1: 0.5699
 epoch: 90, train_loss: 0.8591, test_loss: 1.0221, test_f1: 0.5727
 epoch: 91, train_loss: 0.8470, test_loss: 1.0296, test_f1: 0.5785
 epoch: 92, train_loss: 0.8582, test_loss: 1.0313, test_f1: 0.5750
 epoch: 93, train_loss: 0.8491, test_loss: 1.0405, test_f1: 0.5673
 epoch: 94, train_loss: 0.8633, test_loss: 1.0282, test_f1: 0.5795
 epoch: 95, train_loss: 0.8559, test_loss: 1.0264, test_f1: 0.5800
 epoch: 96, train_loss: 0.8529, test_loss: 1.0221, test_f1: 0.5773
 epoch: 97, train_loss: 0.8512, test_loss: 1.0363, test_f1: 0.5789
 epoch: 98, train_loss: 0.8478, test_loss: 1.0307, test_f1: 0.5847
 epoch: 99, train_loss: 0.8499, test_loss: 1.0240, test_f1: 0.5780
##################ITERATION #5 ****************************************
 epoch: 0, train_loss: 1.2611, test_loss: 1.3110, test_f1: 0.2281
 epoch: 1, train_loss: 1.2052, test_loss: 1.2925, test_f1: 0.2281
 epoch: 2, train_loss: 1.1719, test_loss: 1.2602, test_f1: 0.2336
 epoch: 3, train_loss: 1.1552, test_loss: 1.2272, test_f1: 0.2979
 epoch: 4, train_loss: 1.1350, test_loss: 1.2023, test_f1: 0.3227
 epoch: 5, train_loss: 1.1168, test_loss: 1.1813, test_f1: 0.3203
 epoch: 6, train_loss: 1.1065, test_loss: 1.1668, test_f1: 0.3168
 epoch: 7, train_loss: 1.0912, test_loss: 1.1574, test_f1: 0.3162
 epoch: 8, train_loss: 1.0822, test_loss: 1.1509, test_f1: 0.3503
 epoch: 9, train_loss: 1.0798, test_loss: 1.1430, test_f1: 0.3522
 epoch: 10, train_loss: 1.0662, test_loss: 1.1370, test_f1: 0.3585
 epoch: 11, train_loss: 1.0552, test_loss: 1.1338, test_f1: 0.3869
 epoch: 12, train_loss: 1.0567, test_loss: 1.1300, test_f1: 0.3918
 epoch: 13, train_loss: 1.0553, test_loss: 1.1232, test_f1: 0.4056
 epoch: 14, train_loss: 1.0421, test_loss: 1.1204, test_f1: 0.4260
 epoch: 15, train_loss: 1.0398, test_loss: 1.1174, test_f1: 0.4382
 epoch: 16, train_loss: 1.0457, test_loss: 1.1147, test_f1: 0.4339
 epoch: 17, train_loss: 1.0328, test_loss: 1.1129, test_f1: 0.4271
 epoch: 18, train_loss: 1.0249, test_loss: 1.1087, test_f1: 0.4311
 epoch: 19, train_loss: 1.0277, test_loss: 1.1066, test_f1: 0.4365
 epoch: 20, train_loss: 1.0162, test_loss: 1.1023, test_f1: 0.4365
 epoch: 21, train_loss: 1.0087, test_loss: 1.0997, test_f1: 0.4410
 epoch: 22, train_loss: 1.0038, test_loss: 1.1020, test_f1: 0.4436
 epoch: 23, train_loss: 1.0021, test_loss: 1.0958, test_f1: 0.4323
 epoch: 24, train_loss: 1.0015, test_loss: 1.0901, test_f1: 0.4453
 epoch: 25, train_loss: 0.9916, test_loss: 1.0897, test_f1: 0.4359
 epoch: 26, train_loss: 0.9964, test_loss: 1.0841, test_f1: 0.4393
 epoch: 27, train_loss: 0.9946, test_loss: 1.0807, test_f1: 0.4343
 epoch: 28, train_loss: 0.9911, test_loss: 1.0780, test_f1: 0.4447
 epoch: 29, train_loss: 0.9807, test_loss: 1.0666, test_f1: 0.4492
 epoch: 30, train_loss: 0.9773, test_loss: 1.0684, test_f1: 0.4529
 epoch: 31, train_loss: 0.9770, test_loss: 1.0702, test_f1: 0.4630
 epoch: 32, train_loss: 0.9751, test_loss: 1.0661, test_f1: 0.4644
 epoch: 33, train_loss: 0.9690, test_loss: 1.0657, test_f1: 0.4671
 epoch: 34, train_loss: 0.9673, test_loss: 1.0608, test_f1: 0.4515
 epoch: 35, train_loss: 0.9658, test_loss: 1.0629, test_f1: 0.4654
 epoch: 36, train_loss: 0.9554, test_loss: 1.0584, test_f1: 0.4653
 epoch: 37, train_loss: 0.9641, test_loss: 1.0600, test_f1: 0.4629
 epoch: 38, train_loss: 0.9643, test_loss: 1.0448, test_f1: 0.4731
 epoch: 39, train_loss: 0.9546, test_loss: 1.0472, test_f1: 0.4758
 epoch: 40, train_loss: 0.9452, test_loss: 1.0590, test_f1: 0.4737
 epoch: 41, train_loss: 0.9422, test_loss: 1.0436, test_f1: 0.4778
 epoch: 42, train_loss: 0.9481, test_loss: 1.0398, test_f1: 0.4873
 epoch: 43, train_loss: 0.9383, test_loss: 1.0352, test_f1: 0.4994
 epoch: 44, train_loss: 0.9396, test_loss: 1.0436, test_f1: 0.4901
 epoch: 45, train_loss: 0.9374, test_loss: 1.0350, test_f1: 0.4968
 epoch: 46, train_loss: 0.9248, test_loss: 1.0389, test_f1: 0.4918
 epoch: 47, train_loss: 0.9319, test_loss: 1.0327, test_f1: 0.5059
 epoch: 48, train_loss: 0.9306, test_loss: 1.0256, test_f1: 0.5213
 epoch: 49, train_loss: 0.9172, test_loss: 1.0261, test_f1: 0.5188
 epoch: 50, train_loss: 0.9160, test_loss: 1.0291, test_f1: 0.5271
 epoch: 51, train_loss: 0.9120, test_loss: 1.0243, test_f1: 0.5162
 epoch: 52, train_loss: 0.9243, test_loss: 1.0237, test_f1: 0.5160
 epoch: 53, train_loss: 0.9186, test_loss: 1.0304, test_f1: 0.5167
 epoch: 54, train_loss: 0.9187, test_loss: 1.0231, test_f1: 0.5243
 epoch: 55, train_loss: 0.9204, test_loss: 1.0235, test_f1: 0.5283
 epoch: 56, train_loss: 0.9044, test_loss: 1.0279, test_f1: 0.5181
 epoch: 57, train_loss: 0.9170, test_loss: 1.0231, test_f1: 0.5283
 epoch: 58, train_loss: 0.9103, test_loss: 1.0194, test_f1: 0.5215
 epoch: 59, train_loss: 0.9162, test_loss: 1.0168, test_f1: 0.5215
 epoch: 60, train_loss: 0.9079, test_loss: 1.0235, test_f1: 0.5206
 epoch: 61, train_loss: 0.9036, test_loss: 1.0283, test_f1: 0.5218
 epoch: 62, train_loss: 0.9043, test_loss: 1.0259, test_f1: 0.5171
 epoch: 63, train_loss: 0.9087, test_loss: 1.0231, test_f1: 0.5152
 epoch: 64, train_loss: 0.9016, test_loss: 1.0191, test_f1: 0.5157
 epoch: 65, train_loss: 0.8924, test_loss: 1.0199, test_f1: 0.5201
 epoch: 66, train_loss: 0.8968, test_loss: 1.0178, test_f1: 0.5118
 epoch: 67, train_loss: 0.8942, test_loss: 1.0200, test_f1: 0.5227
 epoch: 68, train_loss: 0.8890, test_loss: 1.0110, test_f1: 0.5348
 epoch: 69, train_loss: 0.8973, test_loss: 1.0202, test_f1: 0.5235
 epoch: 70, train_loss: 0.8946, test_loss: 1.0084, test_f1: 0.5245
 epoch: 71, train_loss: 0.8940, test_loss: 1.0137, test_f1: 0.5283
 epoch: 72, train_loss: 0.8939, test_loss: 1.0136, test_f1: 0.5311
 epoch: 73, train_loss: 0.8907, test_loss: 1.0141, test_f1: 0.5250
 epoch: 74, train_loss: 0.8912, test_loss: 1.0107, test_f1: 0.5289
 epoch: 75, train_loss: 0.8935, test_loss: 1.0050, test_f1: 0.5253
 epoch: 76, train_loss: 0.8837, test_loss: 1.0055, test_f1: 0.5332
 epoch: 77, train_loss: 0.8931, test_loss: 1.0195, test_f1: 0.5250
 epoch: 78, train_loss: 0.8898, test_loss: 1.0151, test_f1: 0.5300
 epoch: 79, train_loss: 0.8914, test_loss: 1.0063, test_f1: 0.5361
 epoch: 80, train_loss: 0.8806, test_loss: 1.0017, test_f1: 0.5473
 epoch: 81, train_loss: 0.8849, test_loss: 1.0076, test_f1: 0.5378
 epoch: 82, train_loss: 0.8886, test_loss: 1.0100, test_f1: 0.5315
 epoch: 83, train_loss: 0.8899, test_loss: 1.0105, test_f1: 0.5318
 epoch: 84, train_loss: 0.8680, test_loss: 1.0086, test_f1: 0.5287
 epoch: 85, train_loss: 0.8796, test_loss: 1.0006, test_f1: 0.5386
 epoch: 86, train_loss: 0.8744, test_loss: 1.0147, test_f1: 0.5295
 epoch: 87, train_loss: 0.8748, test_loss: 1.0041, test_f1: 0.5423
 epoch: 88, train_loss: 0.8781, test_loss: 1.0140, test_f1: 0.5360
 epoch: 89, train_loss: 0.8761, test_loss: 1.0096, test_f1: 0.5356
 epoch: 90, train_loss: 0.8788, test_loss: 0.9962, test_f1: 0.5410
 epoch: 91, train_loss: 0.8746, test_loss: 0.9999, test_f1: 0.5422
 epoch: 92, train_loss: 0.8709, test_loss: 0.9988, test_f1: 0.5433
 epoch: 93, train_loss: 0.8668, test_loss: 0.9975, test_f1: 0.5454
 epoch: 94, train_loss: 0.8682, test_loss: 1.0067, test_f1: 0.5358
 epoch: 95, train_loss: 0.8553, test_loss: 1.0045, test_f1: 0.5399
 epoch: 96, train_loss: 0.8734, test_loss: 1.0115, test_f1: 0.5350
 epoch: 97, train_loss: 0.8621, test_loss: 1.0095, test_f1: 0.5350
 epoch: 98, train_loss: 0.8559, test_loss: 1.0062, test_f1: 0.5350
 epoch: 99, train_loss: 0.8712, test_loss: 0.9963, test_f1: 0.5424
##################ITERATION #6 ****************************************
 epoch: 0, train_loss: 1.2715, test_loss: 1.3069, test_f1: 0.2281
 epoch: 1, train_loss: 1.2180, test_loss: 1.2941, test_f1: 0.2281
 epoch: 2, train_loss: 1.1906, test_loss: 1.2798, test_f1: 0.2281
 epoch: 3, train_loss: 1.1689, test_loss: 1.2573, test_f1: 0.2336
 epoch: 4, train_loss: 1.1526, test_loss: 1.2343, test_f1: 0.2889
 epoch: 5, train_loss: 1.1405, test_loss: 1.2156, test_f1: 0.3062
 epoch: 6, train_loss: 1.1207, test_loss: 1.2005, test_f1: 0.3283
 epoch: 7, train_loss: 1.1191, test_loss: 1.1896, test_f1: 0.3594
 epoch: 8, train_loss: 1.1073, test_loss: 1.1812, test_f1: 0.3960
 epoch: 9, train_loss: 1.0949, test_loss: 1.1747, test_f1: 0.4267
 epoch: 10, train_loss: 1.0916, test_loss: 1.1662, test_f1: 0.4400
 epoch: 11, train_loss: 1.0760, test_loss: 1.1620, test_f1: 0.4437
 epoch: 12, train_loss: 1.0736, test_loss: 1.1558, test_f1: 0.4497
 epoch: 13, train_loss: 1.0675, test_loss: 1.1506, test_f1: 0.4530
 epoch: 14, train_loss: 1.0669, test_loss: 1.1502, test_f1: 0.4461
 epoch: 15, train_loss: 1.0537, test_loss: 1.1527, test_f1: 0.4356
 epoch: 16, train_loss: 1.0548, test_loss: 1.1495, test_f1: 0.4351
 epoch: 17, train_loss: 1.0482, test_loss: 1.1414, test_f1: 0.4435
 epoch: 18, train_loss: 1.0425, test_loss: 1.1341, test_f1: 0.4521
 epoch: 19, train_loss: 1.0335, test_loss: 1.1326, test_f1: 0.4473
 epoch: 20, train_loss: 1.0251, test_loss: 1.1350, test_f1: 0.4418
 epoch: 21, train_loss: 1.0258, test_loss: 1.1283, test_f1: 0.4470
 epoch: 22, train_loss: 1.0186, test_loss: 1.1262, test_f1: 0.4422
 epoch: 23, train_loss: 1.0100, test_loss: 1.1184, test_f1: 0.4501
 epoch: 24, train_loss: 1.0097, test_loss: 1.1187, test_f1: 0.4545
 epoch: 25, train_loss: 1.0115, test_loss: 1.1131, test_f1: 0.4553
 epoch: 26, train_loss: 0.9976, test_loss: 1.1052, test_f1: 0.4608
 epoch: 27, train_loss: 1.0017, test_loss: 1.1037, test_f1: 0.4708
 epoch: 28, train_loss: 0.9850, test_loss: 1.1041, test_f1: 0.4663
 epoch: 29, train_loss: 0.9911, test_loss: 1.1002, test_f1: 0.4778
 epoch: 30, train_loss: 0.9801, test_loss: 1.0964, test_f1: 0.4885
 epoch: 31, train_loss: 0.9799, test_loss: 1.0927, test_f1: 0.4953
 epoch: 32, train_loss: 0.9733, test_loss: 1.0849, test_f1: 0.4921
 epoch: 33, train_loss: 0.9803, test_loss: 1.0861, test_f1: 0.4972
 epoch: 34, train_loss: 0.9642, test_loss: 1.0881, test_f1: 0.4860
 epoch: 35, train_loss: 0.9618, test_loss: 1.0823, test_f1: 0.4993
 epoch: 36, train_loss: 0.9633, test_loss: 1.0785, test_f1: 0.5130
 epoch: 37, train_loss: 0.9584, test_loss: 1.0772, test_f1: 0.5061
 epoch: 38, train_loss: 0.9499, test_loss: 1.0750, test_f1: 0.5250
 epoch: 39, train_loss: 0.9459, test_loss: 1.0704, test_f1: 0.5173
 epoch: 40, train_loss: 0.9523, test_loss: 1.0675, test_f1: 0.5070
 epoch: 41, train_loss: 0.9362, test_loss: 1.0620, test_f1: 0.5088
 epoch: 42, train_loss: 0.9471, test_loss: 1.0631, test_f1: 0.5214
 epoch: 43, train_loss: 0.9372, test_loss: 1.0545, test_f1: 0.5193
 epoch: 44, train_loss: 0.9296, test_loss: 1.0488, test_f1: 0.5162
 epoch: 45, train_loss: 0.9299, test_loss: 1.0438, test_f1: 0.5166
 epoch: 46, train_loss: 0.9255, test_loss: 1.0470, test_f1: 0.5165
 epoch: 47, train_loss: 0.9295, test_loss: 1.0555, test_f1: 0.5143
 epoch: 48, train_loss: 0.9148, test_loss: 1.0556, test_f1: 0.5176
 epoch: 49, train_loss: 0.9154, test_loss: 1.0440, test_f1: 0.5192
 epoch: 50, train_loss: 0.9158, test_loss: 1.0460, test_f1: 0.5181
 epoch: 51, train_loss: 0.9055, test_loss: 1.0471, test_f1: 0.5134
 epoch: 52, train_loss: 0.9136, test_loss: 1.0447, test_f1: 0.5241
 epoch: 53, train_loss: 0.9180, test_loss: 1.0463, test_f1: 0.5247
 epoch: 54, train_loss: 0.8970, test_loss: 1.0466, test_f1: 0.5199
 epoch: 55, train_loss: 0.9129, test_loss: 1.0476, test_f1: 0.5161
 epoch: 56, train_loss: 0.9038, test_loss: 1.0467, test_f1: 0.5295
 epoch: 57, train_loss: 0.9092, test_loss: 1.0482, test_f1: 0.5274
 epoch: 58, train_loss: 0.9070, test_loss: 1.0380, test_f1: 0.5320
 epoch: 59, train_loss: 0.8991, test_loss: 1.0434, test_f1: 0.5259
 epoch: 60, train_loss: 0.9059, test_loss: 1.0532, test_f1: 0.5260
 epoch: 61, train_loss: 0.9015, test_loss: 1.0439, test_f1: 0.5329
 epoch: 62, train_loss: 0.8961, test_loss: 1.0415, test_f1: 0.5386
 epoch: 63, train_loss: 0.9017, test_loss: 1.0471, test_f1: 0.5310
 epoch: 64, train_loss: 0.8981, test_loss: 1.0524, test_f1: 0.5307
 epoch: 65, train_loss: 0.8955, test_loss: 1.0521, test_f1: 0.5272
 epoch: 66, train_loss: 0.8947, test_loss: 1.0484, test_f1: 0.5249
 epoch: 67, train_loss: 0.8917, test_loss: 1.0510, test_f1: 0.5278
 epoch: 68, train_loss: 0.8916, test_loss: 1.0541, test_f1: 0.5290
 epoch: 69, train_loss: 0.8850, test_loss: 1.0393, test_f1: 0.5255
 epoch: 70, train_loss: 0.8877, test_loss: 1.0445, test_f1: 0.5255
 epoch: 71, train_loss: 0.8907, test_loss: 1.0401, test_f1: 0.5323
 epoch: 72, train_loss: 0.8824, test_loss: 1.0484, test_f1: 0.5229
 epoch: 73, train_loss: 0.8848, test_loss: 1.0433, test_f1: 0.5302
 epoch: 74, train_loss: 0.8916, test_loss: 1.0360, test_f1: 0.5404
 epoch: 75, train_loss: 0.8845, test_loss: 1.0466, test_f1: 0.5339
 epoch: 76, train_loss: 0.8934, test_loss: 1.0392, test_f1: 0.5374
 epoch: 77, train_loss: 0.8868, test_loss: 1.0499, test_f1: 0.5294
 epoch: 78, train_loss: 0.8741, test_loss: 1.0489, test_f1: 0.5234
 epoch: 79, train_loss: 0.8856, test_loss: 1.0395, test_f1: 0.5407
 epoch: 80, train_loss: 0.8756, test_loss: 1.0431, test_f1: 0.5419
 epoch: 81, train_loss: 0.8737, test_loss: 1.0560, test_f1: 0.5220
 epoch: 82, train_loss: 0.8751, test_loss: 1.0444, test_f1: 0.5285
 epoch: 83, train_loss: 0.8736, test_loss: 1.0476, test_f1: 0.5256
 epoch: 84, train_loss: 0.8710, test_loss: 1.0417, test_f1: 0.5356
 epoch: 85, train_loss: 0.8661, test_loss: 1.0478, test_f1: 0.5333
 epoch: 86, train_loss: 0.8627, test_loss: 1.0420, test_f1: 0.5344
 epoch: 87, train_loss: 0.8691, test_loss: 1.0518, test_f1: 0.5376
 epoch: 88, train_loss: 0.8660, test_loss: 1.0599, test_f1: 0.5263
 epoch: 89, train_loss: 0.8585, test_loss: 1.0507, test_f1: 0.5351
 epoch: 90, train_loss: 0.8607, test_loss: 1.0470, test_f1: 0.5402
 epoch: 91, train_loss: 0.8654, test_loss: 1.0398, test_f1: 0.5407
 epoch: 92, train_loss: 0.8616, test_loss: 1.0475, test_f1: 0.5337
 epoch: 93, train_loss: 0.8681, test_loss: 1.0455, test_f1: 0.5247
 epoch: 94, train_loss: 0.8532, test_loss: 1.0379, test_f1: 0.5313
 epoch: 95, train_loss: 0.8730, test_loss: 1.0297, test_f1: 0.5348
 epoch: 96, train_loss: 0.8591, test_loss: 1.0409, test_f1: 0.5344
 epoch: 97, train_loss: 0.8561, test_loss: 1.0512, test_f1: 0.5295
 epoch: 98, train_loss: 0.8674, test_loss: 1.0441, test_f1: 0.5381
 epoch: 99, train_loss: 0.8529, test_loss: 1.0496, test_f1: 0.5317
##################ITERATION #7 ****************************************
 epoch: 0, train_loss: 1.3005, test_loss: 1.3188, test_f1: 0.2281
 epoch: 1, train_loss: 1.2202, test_loss: 1.3080, test_f1: 0.2281
 epoch: 2, train_loss: 1.1976, test_loss: 1.2913, test_f1: 0.2281
 epoch: 3, train_loss: 1.1787, test_loss: 1.2727, test_f1: 0.2336
 epoch: 4, train_loss: 1.1708, test_loss: 1.2532, test_f1: 0.2336
 epoch: 5, train_loss: 1.1507, test_loss: 1.2391, test_f1: 0.2452
 epoch: 6, train_loss: 1.1471, test_loss: 1.2289, test_f1: 0.2856
 epoch: 7, train_loss: 1.1422, test_loss: 1.2205, test_f1: 0.2891
 epoch: 8, train_loss: 1.1266, test_loss: 1.2140, test_f1: 0.2968
 epoch: 9, train_loss: 1.1338, test_loss: 1.2068, test_f1: 0.3148
 epoch: 10, train_loss: 1.1134, test_loss: 1.2015, test_f1: 0.3137
 epoch: 11, train_loss: 1.1153, test_loss: 1.1936, test_f1: 0.3678
 epoch: 12, train_loss: 1.1010, test_loss: 1.1853, test_f1: 0.3720
 epoch: 13, train_loss: 1.0946, test_loss: 1.1795, test_f1: 0.3839
 epoch: 14, train_loss: 1.0891, test_loss: 1.1720, test_f1: 0.3857
 epoch: 15, train_loss: 1.0854, test_loss: 1.1704, test_f1: 0.3887
 epoch: 16, train_loss: 1.0750, test_loss: 1.1656, test_f1: 0.3944
 epoch: 17, train_loss: 1.0695, test_loss: 1.1569, test_f1: 0.3970
 epoch: 18, train_loss: 1.0661, test_loss: 1.1524, test_f1: 0.3972
 epoch: 19, train_loss: 1.0586, test_loss: 1.1502, test_f1: 0.4088
 epoch: 20, train_loss: 1.0583, test_loss: 1.1447, test_f1: 0.4086
 epoch: 21, train_loss: 1.0438, test_loss: 1.1422, test_f1: 0.4122
 epoch: 22, train_loss: 1.0430, test_loss: 1.1349, test_f1: 0.4275
 epoch: 23, train_loss: 1.0367, test_loss: 1.1293, test_f1: 0.4394
 epoch: 24, train_loss: 1.0298, test_loss: 1.1291, test_f1: 0.4414
 epoch: 25, train_loss: 1.0213, test_loss: 1.1245, test_f1: 0.4514
 epoch: 26, train_loss: 1.0215, test_loss: 1.1219, test_f1: 0.4478
 epoch: 27, train_loss: 1.0159, test_loss: 1.1161, test_f1: 0.4494
 epoch: 28, train_loss: 1.0164, test_loss: 1.1135, test_f1: 0.4456
 epoch: 29, train_loss: 1.0068, test_loss: 1.1131, test_f1: 0.4447
 epoch: 30, train_loss: 0.9978, test_loss: 1.1049, test_f1: 0.4538
 epoch: 31, train_loss: 0.9978, test_loss: 1.1035, test_f1: 0.4517
 epoch: 32, train_loss: 0.9949, test_loss: 1.0981, test_f1: 0.4582
 epoch: 33, train_loss: 0.9929, test_loss: 1.0874, test_f1: 0.4859
 epoch: 34, train_loss: 0.9929, test_loss: 1.0883, test_f1: 0.4681
 epoch: 35, train_loss: 0.9851, test_loss: 1.0826, test_f1: 0.4776
 epoch: 36, train_loss: 0.9777, test_loss: 1.0818, test_f1: 0.4791
 epoch: 37, train_loss: 0.9775, test_loss: 1.0769, test_f1: 0.4861
 epoch: 38, train_loss: 0.9662, test_loss: 1.0713, test_f1: 0.4868
 epoch: 39, train_loss: 0.9633, test_loss: 1.0720, test_f1: 0.4842
 epoch: 40, train_loss: 0.9647, test_loss: 1.0667, test_f1: 0.4881
 epoch: 41, train_loss: 0.9574, test_loss: 1.0688, test_f1: 0.4872
 epoch: 42, train_loss: 0.9591, test_loss: 1.0659, test_f1: 0.4816
 epoch: 43, train_loss: 0.9566, test_loss: 1.0608, test_f1: 0.4867
 epoch: 44, train_loss: 0.9439, test_loss: 1.0569, test_f1: 0.4953
 epoch: 45, train_loss: 0.9439, test_loss: 1.0558, test_f1: 0.4931
 epoch: 46, train_loss: 0.9342, test_loss: 1.0498, test_f1: 0.4908
 epoch: 47, train_loss: 0.9246, test_loss: 1.0524, test_f1: 0.4958
 epoch: 48, train_loss: 0.9225, test_loss: 1.0447, test_f1: 0.4959
 epoch: 49, train_loss: 0.9317, test_loss: 1.0454, test_f1: 0.5032
 epoch: 50, train_loss: 0.9262, test_loss: 1.0515, test_f1: 0.4937
 epoch: 51, train_loss: 0.9247, test_loss: 1.0524, test_f1: 0.4922
 epoch: 52, train_loss: 0.9354, test_loss: 1.0494, test_f1: 0.4985
 epoch: 53, train_loss: 0.9192, test_loss: 1.0476, test_f1: 0.5021
 epoch: 54, train_loss: 0.9180, test_loss: 1.0502, test_f1: 0.4973
 epoch: 55, train_loss: 0.9170, test_loss: 1.0504, test_f1: 0.4972
 epoch: 56, train_loss: 0.9138, test_loss: 1.0482, test_f1: 0.4997
 epoch: 57, train_loss: 0.9200, test_loss: 1.0460, test_f1: 0.5036
 epoch: 58, train_loss: 0.9192, test_loss: 1.0472, test_f1: 0.5097
 epoch: 59, train_loss: 0.9251, test_loss: 1.0479, test_f1: 0.5092
 epoch: 60, train_loss: 0.9147, test_loss: 1.0476, test_f1: 0.5092
 epoch: 61, train_loss: 0.9210, test_loss: 1.0490, test_f1: 0.5019
 epoch: 62, train_loss: 0.9144, test_loss: 1.0489, test_f1: 0.5102
 epoch: 63, train_loss: 0.9134, test_loss: 1.0549, test_f1: 0.5065
 epoch: 64, train_loss: 0.9009, test_loss: 1.0493, test_f1: 0.5092
 epoch: 65, train_loss: 0.9123, test_loss: 1.0485, test_f1: 0.5062
 epoch: 66, train_loss: 0.9040, test_loss: 1.0447, test_f1: 0.5081
 epoch: 67, train_loss: 0.9087, test_loss: 1.0443, test_f1: 0.5126
 epoch: 68, train_loss: 0.9084, test_loss: 1.0488, test_f1: 0.5081
 epoch: 69, train_loss: 0.8968, test_loss: 1.0529, test_f1: 0.5131
 epoch: 70, train_loss: 0.9033, test_loss: 1.0526, test_f1: 0.5153
 epoch: 71, train_loss: 0.8988, test_loss: 1.0551, test_f1: 0.5108
 epoch: 72, train_loss: 0.8948, test_loss: 1.0459, test_f1: 0.5064
 epoch: 73, train_loss: 0.9012, test_loss: 1.0479, test_f1: 0.5123
 epoch: 74, train_loss: 0.9013, test_loss: 1.0471, test_f1: 0.5071
 epoch: 75, train_loss: 0.9001, test_loss: 1.0505, test_f1: 0.5103
 epoch: 76, train_loss: 0.8984, test_loss: 1.0478, test_f1: 0.5125
 epoch: 77, train_loss: 0.8895, test_loss: 1.0456, test_f1: 0.5206
 epoch: 78, train_loss: 0.8907, test_loss: 1.0462, test_f1: 0.5119
 epoch: 79, train_loss: 0.8926, test_loss: 1.0446, test_f1: 0.5163
 epoch: 80, train_loss: 0.8901, test_loss: 1.0483, test_f1: 0.5211
 epoch: 81, train_loss: 0.8886, test_loss: 1.0414, test_f1: 0.5140
 epoch: 82, train_loss: 0.8848, test_loss: 1.0436, test_f1: 0.5236
 epoch: 83, train_loss: 0.8876, test_loss: 1.0422, test_f1: 0.5280
 epoch: 84, train_loss: 0.8864, test_loss: 1.0437, test_f1: 0.5247
 epoch: 85, train_loss: 0.8886, test_loss: 1.0516, test_f1: 0.5131
 epoch: 86, train_loss: 0.8901, test_loss: 1.0491, test_f1: 0.5210
 epoch: 87, train_loss: 0.8823, test_loss: 1.0467, test_f1: 0.5163
 epoch: 88, train_loss: 0.8743, test_loss: 1.0465, test_f1: 0.5246
 epoch: 89, train_loss: 0.8848, test_loss: 1.0489, test_f1: 0.5150
 epoch: 90, train_loss: 0.8847, test_loss: 1.0444, test_f1: 0.5179
 epoch: 91, train_loss: 0.8947, test_loss: 1.0453, test_f1: 0.5254
 epoch: 92, train_loss: 0.8756, test_loss: 1.0450, test_f1: 0.5213
 epoch: 93, train_loss: 0.8669, test_loss: 1.0454, test_f1: 0.5144
 epoch: 94, train_loss: 0.8725, test_loss: 1.0428, test_f1: 0.5252
 epoch: 95, train_loss: 0.8744, test_loss: 1.0440, test_f1: 0.5313
 epoch: 96, train_loss: 0.8843, test_loss: 1.0472, test_f1: 0.5238
 epoch: 97, train_loss: 0.8811, test_loss: 1.0452, test_f1: 0.5165
 epoch: 98, train_loss: 0.8686, test_loss: 1.0469, test_f1: 0.5176
 epoch: 99, train_loss: 0.8754, test_loss: 1.0438, test_f1: 0.5312
##################ITERATION #8 ****************************************
 epoch: 0, train_loss: 1.2731, test_loss: 1.3377, test_f1: 0.2281
 epoch: 1, train_loss: 1.1951, test_loss: 1.3283, test_f1: 0.2583
 epoch: 2, train_loss: 1.1661, test_loss: 1.2974, test_f1: 0.2722
 epoch: 3, train_loss: 1.1512, test_loss: 1.2507, test_f1: 0.3260
 epoch: 4, train_loss: 1.1373, test_loss: 1.2058, test_f1: 0.3772
 epoch: 5, train_loss: 1.1349, test_loss: 1.1811, test_f1: 0.3945
 epoch: 6, train_loss: 1.1145, test_loss: 1.1700, test_f1: 0.4076
 epoch: 7, train_loss: 1.1081, test_loss: 1.1607, test_f1: 0.4067
 epoch: 8, train_loss: 1.0911, test_loss: 1.1506, test_f1: 0.4219
 epoch: 9, train_loss: 1.0959, test_loss: 1.1439, test_f1: 0.4301
 epoch: 10, train_loss: 1.0837, test_loss: 1.1320, test_f1: 0.4330
 epoch: 11, train_loss: 1.0777, test_loss: 1.1222, test_f1: 0.4249
 epoch: 12, train_loss: 1.0505, test_loss: 1.1170, test_f1: 0.4410
 epoch: 13, train_loss: 1.0526, test_loss: 1.1121, test_f1: 0.4465
 epoch: 14, train_loss: 1.0366, test_loss: 1.1066, test_f1: 0.4483
 epoch: 15, train_loss: 1.0342, test_loss: 1.1039, test_f1: 0.4542
 epoch: 16, train_loss: 1.0376, test_loss: 1.0962, test_f1: 0.4517
 epoch: 17, train_loss: 1.0315, test_loss: 1.0901, test_f1: 0.4612
 epoch: 18, train_loss: 1.0315, test_loss: 1.0865, test_f1: 0.4702
 epoch: 19, train_loss: 1.0246, test_loss: 1.0843, test_f1: 0.4681
 epoch: 20, train_loss: 1.0147, test_loss: 1.0790, test_f1: 0.4873
 epoch: 21, train_loss: 1.0110, test_loss: 1.0748, test_f1: 0.4819
 epoch: 22, train_loss: 1.0027, test_loss: 1.0716, test_f1: 0.4941
 epoch: 23, train_loss: 0.9988, test_loss: 1.0622, test_f1: 0.4868
 epoch: 24, train_loss: 1.0028, test_loss: 1.0595, test_f1: 0.4987
 epoch: 25, train_loss: 0.9859, test_loss: 1.0536, test_f1: 0.4964
 epoch: 26, train_loss: 0.9937, test_loss: 1.0452, test_f1: 0.4994
 epoch: 27, train_loss: 0.9846, test_loss: 1.0486, test_f1: 0.5057
 epoch: 28, train_loss: 0.9781, test_loss: 1.0462, test_f1: 0.5032
 epoch: 29, train_loss: 0.9786, test_loss: 1.0411, test_f1: 0.5029
 epoch: 30, train_loss: 0.9741, test_loss: 1.0438, test_f1: 0.5038
 epoch: 31, train_loss: 0.9687, test_loss: 1.0345, test_f1: 0.4993
 epoch: 32, train_loss: 0.9650, test_loss: 1.0360, test_f1: 0.5036
 epoch: 33, train_loss: 0.9674, test_loss: 1.0376, test_f1: 0.5038
 epoch: 34, train_loss: 0.9524, test_loss: 1.0303, test_f1: 0.5022
 epoch: 35, train_loss: 0.9585, test_loss: 1.0298, test_f1: 0.5088
 epoch: 36, train_loss: 0.9508, test_loss: 1.0251, test_f1: 0.5106
 epoch: 37, train_loss: 0.9507, test_loss: 1.0261, test_f1: 0.5140
 epoch: 38, train_loss: 0.9519, test_loss: 1.0303, test_f1: 0.5098
 epoch: 39, train_loss: 0.9429, test_loss: 1.0161, test_f1: 0.5191
 epoch: 40, train_loss: 0.9417, test_loss: 1.0175, test_f1: 0.5241
 epoch: 41, train_loss: 0.9386, test_loss: 1.0170, test_f1: 0.5245
 epoch: 42, train_loss: 0.9289, test_loss: 1.0152, test_f1: 0.5200
 epoch: 43, train_loss: 0.9325, test_loss: 1.0084, test_f1: 0.5375
 epoch: 44, train_loss: 0.9419, test_loss: 1.0158, test_f1: 0.5423
 epoch: 45, train_loss: 0.9335, test_loss: 1.0049, test_f1: 0.5379
 epoch: 46, train_loss: 0.9243, test_loss: 1.0101, test_f1: 0.5404
 epoch: 47, train_loss: 0.9276, test_loss: 1.0117, test_f1: 0.5418
 epoch: 48, train_loss: 0.9186, test_loss: 1.0047, test_f1: 0.5384
 epoch: 49, train_loss: 0.9198, test_loss: 1.0088, test_f1: 0.5386
 epoch: 50, train_loss: 0.9156, test_loss: 1.0146, test_f1: 0.5319
 epoch: 51, train_loss: 0.9093, test_loss: 1.0067, test_f1: 0.5336
 epoch: 52, train_loss: 0.9168, test_loss: 1.0021, test_f1: 0.5426
 epoch: 53, train_loss: 0.9110, test_loss: 1.0012, test_f1: 0.5422
 epoch: 54, train_loss: 0.9056, test_loss: 1.0025, test_f1: 0.5394
 epoch: 55, train_loss: 0.9061, test_loss: 1.0071, test_f1: 0.5359
 epoch: 56, train_loss: 0.9016, test_loss: 1.0123, test_f1: 0.5375
 epoch: 57, train_loss: 0.8972, test_loss: 1.0074, test_f1: 0.5416
 epoch: 58, train_loss: 0.8961, test_loss: 1.0045, test_f1: 0.5413
 epoch: 59, train_loss: 0.8996, test_loss: 1.0091, test_f1: 0.5316
 epoch: 60, train_loss: 0.9082, test_loss: 1.0121, test_f1: 0.5389
 epoch: 61, train_loss: 0.9035, test_loss: 1.0072, test_f1: 0.5362
 epoch: 62, train_loss: 0.9024, test_loss: 1.0046, test_f1: 0.5191
 epoch: 63, train_loss: 0.8922, test_loss: 1.0037, test_f1: 0.5171
 epoch: 64, train_loss: 0.9047, test_loss: 1.0049, test_f1: 0.5373
 epoch: 65, train_loss: 0.8964, test_loss: 1.0081, test_f1: 0.5267
 epoch: 66, train_loss: 0.8915, test_loss: 1.0092, test_f1: 0.5290
 epoch: 67, train_loss: 0.8980, test_loss: 1.0103, test_f1: 0.5332
 epoch: 68, train_loss: 0.8925, test_loss: 1.0036, test_f1: 0.5367
 epoch: 69, train_loss: 0.8999, test_loss: 1.0060, test_f1: 0.5280
 epoch: 70, train_loss: 0.8973, test_loss: 1.0100, test_f1: 0.5306
 epoch: 71, train_loss: 0.8924, test_loss: 1.0111, test_f1: 0.5214
 epoch: 72, train_loss: 0.8887, test_loss: 1.0163, test_f1: 0.5389
 epoch: 73, train_loss: 0.8804, test_loss: 1.0107, test_f1: 0.5240
 epoch: 74, train_loss: 0.8879, test_loss: 1.0117, test_f1: 0.5229
 epoch: 75, train_loss: 0.8835, test_loss: 1.0123, test_f1: 0.5183
 epoch: 76, train_loss: 0.8855, test_loss: 1.0162, test_f1: 0.5138
 epoch: 77, train_loss: 0.8895, test_loss: 1.0175, test_f1: 0.5217
 epoch: 78, train_loss: 0.8845, test_loss: 1.0126, test_f1: 0.5145
 epoch: 79, train_loss: 0.8889, test_loss: 1.0124, test_f1: 0.5195
 epoch: 80, train_loss: 0.8759, test_loss: 1.0182, test_f1: 0.5178
 epoch: 81, train_loss: 0.8822, test_loss: 1.0187, test_f1: 0.5194
 epoch: 82, train_loss: 0.8771, test_loss: 1.0198, test_f1: 0.5342
 epoch: 83, train_loss: 0.8703, test_loss: 1.0160, test_f1: 0.5217
 epoch: 84, train_loss: 0.8769, test_loss: 1.0187, test_f1: 0.5191
 epoch: 85, train_loss: 0.8659, test_loss: 1.0188, test_f1: 0.5192
 epoch: 86, train_loss: 0.8721, test_loss: 1.0191, test_f1: 0.5242
 epoch: 87, train_loss: 0.8778, test_loss: 1.0148, test_f1: 0.5196
 epoch: 88, train_loss: 0.8763, test_loss: 1.0176, test_f1: 0.5215
 epoch: 89, train_loss: 0.8724, test_loss: 1.0224, test_f1: 0.5249
 epoch: 90, train_loss: 0.8671, test_loss: 1.0238, test_f1: 0.5255
 epoch: 91, train_loss: 0.8800, test_loss: 1.0197, test_f1: 0.5224
 epoch: 92, train_loss: 0.8708, test_loss: 1.0197, test_f1: 0.5194
 epoch: 93, train_loss: 0.8634, test_loss: 1.0248, test_f1: 0.5171
 epoch: 94, train_loss: 0.8704, test_loss: 1.0208, test_f1: 0.5235
 epoch: 95, train_loss: 0.8650, test_loss: 1.0158, test_f1: 0.5260
 epoch: 96, train_loss: 0.8680, test_loss: 1.0144, test_f1: 0.5228
 epoch: 97, train_loss: 0.8656, test_loss: 1.0186, test_f1: 0.5257
 epoch: 98, train_loss: 0.8638, test_loss: 1.0254, test_f1: 0.5288
 epoch: 99, train_loss: 0.8553, test_loss: 1.0263, test_f1: 0.5239
##################ITERATION #9 ****************************************
 epoch: 0, train_loss: 1.2918, test_loss: 1.3080, test_f1: 0.2281
 epoch: 1, train_loss: 1.2102, test_loss: 1.2949, test_f1: 0.2281
 epoch: 2, train_loss: 1.1850, test_loss: 1.2803, test_f1: 0.2336
 epoch: 3, train_loss: 1.1653, test_loss: 1.2485, test_f1: 0.2900
 epoch: 4, train_loss: 1.1481, test_loss: 1.2097, test_f1: 0.3078
 epoch: 5, train_loss: 1.1339, test_loss: 1.1819, test_f1: 0.3086
 epoch: 6, train_loss: 1.1186, test_loss: 1.1665, test_f1: 0.3132
 epoch: 7, train_loss: 1.1058, test_loss: 1.1573, test_f1: 0.3156
 epoch: 8, train_loss: 1.1019, test_loss: 1.1468, test_f1: 0.3115
 epoch: 9, train_loss: 1.0900, test_loss: 1.1396, test_f1: 0.3156
 epoch: 10, train_loss: 1.0757, test_loss: 1.1335, test_f1: 0.3185
 epoch: 11, train_loss: 1.0705, test_loss: 1.1284, test_f1: 0.3437
 epoch: 12, train_loss: 1.0648, test_loss: 1.1230, test_f1: 0.3542
 epoch: 13, train_loss: 1.0626, test_loss: 1.1195, test_f1: 0.3566
 epoch: 14, train_loss: 1.0413, test_loss: 1.1096, test_f1: 0.3595
 epoch: 15, train_loss: 1.0380, test_loss: 1.1105, test_f1: 0.3586
 epoch: 16, train_loss: 1.0392, test_loss: 1.1031, test_f1: 0.3674
 epoch: 17, train_loss: 1.0233, test_loss: 1.0991, test_f1: 0.3725
 epoch: 18, train_loss: 1.0181, test_loss: 1.0969, test_f1: 0.3725
 epoch: 19, train_loss: 1.0118, test_loss: 1.0914, test_f1: 0.3857
 epoch: 20, train_loss: 1.0014, test_loss: 1.0877, test_f1: 0.3903
 epoch: 21, train_loss: 1.0115, test_loss: 1.0799, test_f1: 0.3980
 epoch: 22, train_loss: 1.0023, test_loss: 1.0774, test_f1: 0.4165
 epoch: 23, train_loss: 0.9973, test_loss: 1.0807, test_f1: 0.4037
 epoch: 24, train_loss: 0.9964, test_loss: 1.0767, test_f1: 0.4114
 epoch: 25, train_loss: 0.9881, test_loss: 1.0770, test_f1: 0.4147
 epoch: 26, train_loss: 0.9962, test_loss: 1.0721, test_f1: 0.4136
 epoch: 27, train_loss: 0.9778, test_loss: 1.0677, test_f1: 0.4114
 epoch: 28, train_loss: 0.9750, test_loss: 1.0604, test_f1: 0.4127
 epoch: 29, train_loss: 0.9753, test_loss: 1.0614, test_f1: 0.4459
 epoch: 30, train_loss: 0.9681, test_loss: 1.0584, test_f1: 0.4393
 epoch: 31, train_loss: 0.9736, test_loss: 1.0512, test_f1: 0.4786
 epoch: 32, train_loss: 0.9618, test_loss: 1.0474, test_f1: 0.4798
 epoch: 33, train_loss: 0.9630, test_loss: 1.0562, test_f1: 0.5111
 epoch: 34, train_loss: 0.9580, test_loss: 1.0495, test_f1: 0.5016
 epoch: 35, train_loss: 0.9486, test_loss: 1.0609, test_f1: 0.4980
 epoch: 36, train_loss: 0.9494, test_loss: 1.0605, test_f1: 0.5086
 epoch: 37, train_loss: 0.9511, test_loss: 1.0561, test_f1: 0.5043
 epoch: 38, train_loss: 0.9340, test_loss: 1.0536, test_f1: 0.5136
 epoch: 39, train_loss: 0.9351, test_loss: 1.0543, test_f1: 0.5139
 epoch: 40, train_loss: 0.9278, test_loss: 1.0517, test_f1: 0.5199
 epoch: 41, train_loss: 0.9341, test_loss: 1.0546, test_f1: 0.5184
 epoch: 42, train_loss: 0.9199, test_loss: 1.0529, test_f1: 0.5139
 epoch: 43, train_loss: 0.9149, test_loss: 1.0460, test_f1: 0.5146
 epoch: 44, train_loss: 0.9161, test_loss: 1.0453, test_f1: 0.5218
 epoch: 45, train_loss: 0.9148, test_loss: 1.0512, test_f1: 0.5221
 epoch: 46, train_loss: 0.9254, test_loss: 1.0421, test_f1: 0.5268
 epoch: 47, train_loss: 0.9126, test_loss: 1.0433, test_f1: 0.5217
 epoch: 48, train_loss: 0.9144, test_loss: 1.0529, test_f1: 0.5464
 epoch: 49, train_loss: 0.9134, test_loss: 1.0476, test_f1: 0.5494
 epoch: 50, train_loss: 0.8974, test_loss: 1.0496, test_f1: 0.5182
 epoch: 51, train_loss: 0.8959, test_loss: 1.0489, test_f1: 0.5137
 epoch: 52, train_loss: 0.9038, test_loss: 1.0510, test_f1: 0.5179
 epoch: 53, train_loss: 0.8878, test_loss: 1.0518, test_f1: 0.5264
 epoch: 54, train_loss: 0.8944, test_loss: 1.0482, test_f1: 0.5296
 epoch: 55, train_loss: 0.8951, test_loss: 1.0492, test_f1: 0.5314
 epoch: 56, train_loss: 0.8905, test_loss: 1.0502, test_f1: 0.5288
 epoch: 57, train_loss: 0.8988, test_loss: 1.0478, test_f1: 0.5274
 epoch: 58, train_loss: 0.8981, test_loss: 1.0502, test_f1: 0.5311
 epoch: 59, train_loss: 0.8943, test_loss: 1.0564, test_f1: 0.5312
 epoch: 60, train_loss: 0.8902, test_loss: 1.0557, test_f1: 0.5275
 epoch: 61, train_loss: 0.8942, test_loss: 1.0597, test_f1: 0.5276
 epoch: 62, train_loss: 0.8840, test_loss: 1.0517, test_f1: 0.5342
 epoch: 63, train_loss: 0.8888, test_loss: 1.0519, test_f1: 0.5344
 epoch: 64, train_loss: 0.8786, test_loss: 1.0580, test_f1: 0.5314
 epoch: 65, train_loss: 0.8807, test_loss: 1.0586, test_f1: 0.5303
 epoch: 66, train_loss: 0.8865, test_loss: 1.0573, test_f1: 0.5293
 epoch: 67, train_loss: 0.8784, test_loss: 1.0607, test_f1: 0.5249
 epoch: 68, train_loss: 0.8836, test_loss: 1.0565, test_f1: 0.5272
 epoch: 69, train_loss: 0.8807, test_loss: 1.0565, test_f1: 0.5309
 epoch: 70, train_loss: 0.8739, test_loss: 1.0540, test_f1: 0.5332
 epoch: 71, train_loss: 0.8818, test_loss: 1.0558, test_f1: 0.5284
 epoch: 72, train_loss: 0.8751, test_loss: 1.0596, test_f1: 0.5293
 epoch: 73, train_loss: 0.8689, test_loss: 1.0620, test_f1: 0.5317
 epoch: 74, train_loss: 0.8740, test_loss: 1.0660, test_f1: 0.5403
 epoch: 75, train_loss: 0.8691, test_loss: 1.0657, test_f1: 0.5430
 epoch: 76, train_loss: 0.8741, test_loss: 1.0609, test_f1: 0.5317
 epoch: 77, train_loss: 0.8792, test_loss: 1.0615, test_f1: 0.5340
 epoch: 78, train_loss: 0.8676, test_loss: 1.0656, test_f1: 0.5316
 epoch: 79, train_loss: 0.8721, test_loss: 1.0700, test_f1: 0.5299
 epoch: 80, train_loss: 0.8680, test_loss: 1.0660, test_f1: 0.5317
 epoch: 81, train_loss: 0.8659, test_loss: 1.0700, test_f1: 0.5380
 epoch: 82, train_loss: 0.8580, test_loss: 1.0643, test_f1: 0.5317
 epoch: 83, train_loss: 0.8737, test_loss: 1.0622, test_f1: 0.5228
 epoch: 84, train_loss: 0.8624, test_loss: 1.0628, test_f1: 0.5249
 epoch: 85, train_loss: 0.8510, test_loss: 1.0672, test_f1: 0.5296
 epoch: 86, train_loss: 0.8575, test_loss: 1.0657, test_f1: 0.5297
 epoch: 87, train_loss: 0.8593, test_loss: 1.0676, test_f1: 0.5301
 epoch: 88, train_loss: 0.8697, test_loss: 1.0637, test_f1: 0.5350
 epoch: 89, train_loss: 0.8565, test_loss: 1.0703, test_f1: 0.5305
 epoch: 90, train_loss: 0.8615, test_loss: 1.0752, test_f1: 0.5353
 epoch: 91, train_loss: 0.8635, test_loss: 1.0699, test_f1: 0.5284
 epoch: 92, train_loss: 0.8535, test_loss: 1.0632, test_f1: 0.5278
 epoch: 93, train_loss: 0.8613, test_loss: 1.0650, test_f1: 0.5227
 epoch: 94, train_loss: 0.8546, test_loss: 1.0688, test_f1: 0.5363
 epoch: 95, train_loss: 0.8571, test_loss: 1.0670, test_f1: 0.5305
 epoch: 96, train_loss: 0.8480, test_loss: 1.0726, test_f1: 0.5333
 epoch: 97, train_loss: 0.8472, test_loss: 1.0726, test_f1: 0.5333
 epoch: 98, train_loss: 0.8473, test_loss: 1.0727, test_f1: 0.5332
 epoch: 99, train_loss: 0.8475, test_loss: 1.0688, test_f1: 0.5356

Training completed in 313.61 seconds
Best F1: 0.5847 at epoch 98
Mean F1 across iterations: 0.5369  0.0241
========================FINAL RESULTS================================
FEGIN weighted F1: 0.5847  0.0241
python main.py --data ltspice_demos --representation component_net --model FEGIN --layers 2 --hiddens 64 --batch_size 128 --lr 0.0001 --emb_size 512 --epochs 100 --save_appendix component_net_L2_H64_BS128_LR0.0001_E512 --no_val
-----



STDERR:
  File "main.py", line 370, in <module>
    main()
  File "main.py", line 254, in main
    dataset = dataset_class(
  File "/home/philip/projects/ltspice_examples_code_repo/Circuit-Completion-Using-GNNs/component_classification_with_link_prediction_head/evaluation/FEGIN/kernel/circuit_datasets.py", line 15, in __init__
    self.data, self.slices = torch.load(self.processed_paths[0])
  File "/home/philip/.local/lib/python3.8/site-packages/torch/serialization.py", line 1040, in load
    warnings.warn(
  File "/usr/lib/python3.8/warnings.py", line 109, in _showwarnmsg
    sw(msg.message, msg.category, msg.filename, msg.lineno,
  File "main.py", line 47, in warn_with_traceback
    traceback.print_stack(file=log)
/home/philip/projects/ltspice_examples_code_repo/Circuit-Completion-Using-GNNs/component_classification_with_link_prediction_head/evaluation/FEGIN/kernel/circuit_datasets.py:15: FutureWarning: You are using `torch.load` with `weights_only=False` (the current default value), which uses the default pickle module implicitly. It is possible to construct malicious pickle data which will execute arbitrary code during unpickling (See https://github.com/pytorch/pytorch/blob/main/SECURITY.md#untrusted-models for more details). In a future release, the default value for `weights_only` will be flipped to `True`. This limits the functions that could be executed during unpickling. Arbitrary objects will no longer be allowed to be loaded via this mode unless they are explicitly allowlisted by the user via `torch.serialization.add_safe_globals`. We recommend you start setting `weights_only=True` for any use case where you don't have full control of the loaded file. Please open an issue on GitHub for any issues related to this experimental feature.
  self.data, self.slices = torch.load(self.processed_paths[0])
