STDOUT:
Results will be saved in /home/philip/projects/ltspice_examples_code_repo/Circuit-Completion-Using-GNNs/component_classification_with_link_prediction_head/evaluation/FEGIN/results/model_FEGIN_dataset_ltspice_examples
Command line input: python main.py --data ltspice_examples --representation component_pin_net --model FEGIN --layers 4 --hiddens 16 --batch_size 32 --lr 0.01 --emb_size 250 --epochs 100 --save_appendix component_pin_net_L4_H16_BS32_LR0.01_E250 --no_val
 is saved.
-----
ltspice_examples - FEGIN
Using 4 layers, 16 hidden units, h = 2
Loading component_pin_net representation dataset
ENTERED
Training FEGIN on component_pin_net representation
Train: 3558, Test: 846
##################ITERATION #0 ****************************************
 epoch: 0, train_loss: 1.1692, test_loss: 1.0962, test_f1: 0.3955
 epoch: 1, train_loss: 1.0526, test_loss: 1.0881, test_f1: 0.3824
 epoch: 2, train_loss: 1.0269, test_loss: 1.0276, test_f1: 0.4723
 epoch: 3, train_loss: 1.0028, test_loss: 1.0333, test_f1: 0.4770
 epoch: 4, train_loss: 0.9926, test_loss: 1.0714, test_f1: 0.4750
 epoch: 5, train_loss: 1.0108, test_loss: 0.9539, test_f1: 0.4800
 epoch: 6, train_loss: 0.9858, test_loss: 0.9907, test_f1: 0.5293
 epoch: 7, train_loss: 0.9700, test_loss: 1.0567, test_f1: 0.4087
 epoch: 8, train_loss: 0.9617, test_loss: 0.9978, test_f1: 0.4962
 epoch: 9, train_loss: 0.9521, test_loss: 0.9830, test_f1: 0.5333
 epoch: 10, train_loss: 0.9411, test_loss: 0.9300, test_f1: 0.5240
 epoch: 11, train_loss: 0.9596, test_loss: 0.9407, test_f1: 0.4958
 epoch: 12, train_loss: 0.9358, test_loss: 0.9550, test_f1: 0.5063
 epoch: 13, train_loss: 0.9316, test_loss: 0.9321, test_f1: 0.4985
 epoch: 14, train_loss: 0.9177, test_loss: 0.9390, test_f1: 0.5496
 epoch: 15, train_loss: 0.9180, test_loss: 0.9250, test_f1: 0.5326
 epoch: 16, train_loss: 0.9221, test_loss: 0.9026, test_f1: 0.5228
 epoch: 17, train_loss: 0.9057, test_loss: 0.8964, test_f1: 0.5258
 epoch: 18, train_loss: 0.9512, test_loss: 1.0850, test_f1: 0.4196
 epoch: 19, train_loss: 0.9578, test_loss: 0.9071, test_f1: 0.5128
 epoch: 20, train_loss: 0.9177, test_loss: 0.8850, test_f1: 0.5136
 epoch: 21, train_loss: 0.9011, test_loss: 0.9096, test_f1: 0.5210
 epoch: 22, train_loss: 0.9101, test_loss: 0.9234, test_f1: 0.5028
 epoch: 23, train_loss: 0.9049, test_loss: 0.9144, test_f1: 0.5377
 epoch: 24, train_loss: 0.8933, test_loss: 0.9008, test_f1: 0.5333
 epoch: 25, train_loss: 0.8965, test_loss: 0.8814, test_f1: 0.5593
 epoch: 26, train_loss: 0.8872, test_loss: 0.8806, test_f1: 0.5527
 epoch: 27, train_loss: 0.8863, test_loss: 0.9831, test_f1: 0.5223
 epoch: 28, train_loss: 0.8801, test_loss: 0.8834, test_f1: 0.5387
 epoch: 29, train_loss: 0.8698, test_loss: 0.9001, test_f1: 0.5894
 epoch: 30, train_loss: 0.8805, test_loss: 0.9031, test_f1: 0.5323
 epoch: 31, train_loss: 0.8669, test_loss: 0.8535, test_f1: 0.5517
 epoch: 32, train_loss: 0.8828, test_loss: 0.8771, test_f1: 0.5281
 epoch: 33, train_loss: 0.8536, test_loss: 0.9118, test_f1: 0.5287
 epoch: 34, train_loss: 0.8737, test_loss: 0.9229, test_f1: 0.5293
 epoch: 35, train_loss: 0.8622, test_loss: 0.8344, test_f1: 0.5476
 epoch: 36, train_loss: 0.8707, test_loss: 0.8385, test_f1: 0.5521
 epoch: 37, train_loss: 0.8573, test_loss: 0.8840, test_f1: 0.5326
 epoch: 38, train_loss: 0.8640, test_loss: 0.8750, test_f1: 0.5851
 epoch: 39, train_loss: 0.8635, test_loss: 0.8505, test_f1: 0.5489
 epoch: 40, train_loss: 0.8620, test_loss: 0.8797, test_f1: 0.5641
 epoch: 41, train_loss: 0.8710, test_loss: 0.8663, test_f1: 0.5434
 epoch: 42, train_loss: 0.8530, test_loss: 0.8352, test_f1: 0.5569
 epoch: 43, train_loss: 0.8488, test_loss: 0.9131, test_f1: 0.5224
 epoch: 44, train_loss: 0.8419, test_loss: 1.0441, test_f1: 0.5231
 epoch: 45, train_loss: 0.8761, test_loss: 0.8471, test_f1: 0.5833
 epoch: 46, train_loss: 0.8626, test_loss: 0.8737, test_f1: 0.5484
 epoch: 47, train_loss: 0.8470, test_loss: 0.8538, test_f1: 0.5673
 epoch: 48, train_loss: 0.8555, test_loss: 0.9373, test_f1: 0.5134
 epoch: 49, train_loss: 0.8673, test_loss: 0.8759, test_f1: 0.5445
 epoch: 50, train_loss: 0.8657, test_loss: 0.8513, test_f1: 0.5467
 epoch: 51, train_loss: 0.8269, test_loss: 0.8554, test_f1: 0.5530
 epoch: 52, train_loss: 0.8232, test_loss: 0.8778, test_f1: 0.5621
 epoch: 53, train_loss: 0.8125, test_loss: 0.8796, test_f1: 0.5498
 epoch: 54, train_loss: 0.8195, test_loss: 0.8443, test_f1: 0.5756
 epoch: 55, train_loss: 0.8107, test_loss: 0.8485, test_f1: 0.5751
 epoch: 56, train_loss: 0.8138, test_loss: 0.8572, test_f1: 0.6032
 epoch: 57, train_loss: 0.8242, test_loss: 0.8634, test_f1: 0.5593
 epoch: 58, train_loss: 0.8169, test_loss: 0.8682, test_f1: 0.5604
 epoch: 59, train_loss: 0.8097, test_loss: 0.8592, test_f1: 0.5782
 epoch: 60, train_loss: 0.8133, test_loss: 0.8458, test_f1: 0.5579
 epoch: 61, train_loss: 0.8258, test_loss: 0.8716, test_f1: 0.5792
 epoch: 62, train_loss: 0.8205, test_loss: 0.8354, test_f1: 0.5724
 epoch: 63, train_loss: 0.8046, test_loss: 0.8492, test_f1: 0.5733
 epoch: 64, train_loss: 0.8028, test_loss: 0.8403, test_f1: 0.5715
 epoch: 65, train_loss: 0.8058, test_loss: 0.8421, test_f1: 0.5678
 epoch: 66, train_loss: 0.8102, test_loss: 0.8547, test_f1: 0.5560
 epoch: 67, train_loss: 0.8049, test_loss: 0.8647, test_f1: 0.5708
 epoch: 68, train_loss: 0.7917, test_loss: 0.8721, test_f1: 0.6034
 epoch: 69, train_loss: 0.8175, test_loss: 0.8584, test_f1: 0.6039
 epoch: 70, train_loss: 0.7994, test_loss: 0.8732, test_f1: 0.6142
 epoch: 71, train_loss: 0.8053, test_loss: 0.8376, test_f1: 0.6199
 epoch: 72, train_loss: 0.8035, test_loss: 0.8743, test_f1: 0.5857
 epoch: 73, train_loss: 0.7898, test_loss: 0.8509, test_f1: 0.6140
 epoch: 74, train_loss: 0.8002, test_loss: 0.8904, test_f1: 0.5933
 epoch: 75, train_loss: 0.8035, test_loss: 0.8899, test_f1: 0.6030
 epoch: 76, train_loss: 0.7927, test_loss: 0.8552, test_f1: 0.5725
 epoch: 77, train_loss: 0.7873, test_loss: 0.8562, test_f1: 0.6186
 epoch: 78, train_loss: 0.7860, test_loss: 0.8765, test_f1: 0.5797
 epoch: 79, train_loss: 0.7981, test_loss: 0.8754, test_f1: 0.5693
 epoch: 80, train_loss: 0.7925, test_loss: 0.8544, test_f1: 0.6102
 epoch: 81, train_loss: 0.7923, test_loss: 0.9090, test_f1: 0.5716
 epoch: 82, train_loss: 0.7918, test_loss: 0.8788, test_f1: 0.5883
 epoch: 83, train_loss: 0.7903, test_loss: 0.9033, test_f1: 0.5630
 epoch: 84, train_loss: 0.7990, test_loss: 0.8770, test_f1: 0.6040
 epoch: 85, train_loss: 0.7939, test_loss: 0.8466, test_f1: 0.5979
 epoch: 86, train_loss: 0.7959, test_loss: 0.8073, test_f1: 0.6079
 epoch: 87, train_loss: 0.7824, test_loss: 0.8410, test_f1: 0.6206
 epoch: 88, train_loss: 0.7807, test_loss: 0.8359, test_f1: 0.5893
 epoch: 89, train_loss: 0.7785, test_loss: 0.8487, test_f1: 0.6210
 epoch: 90, train_loss: 0.7954, test_loss: 0.8331, test_f1: 0.5978
 epoch: 91, train_loss: 0.7765, test_loss: 0.8527, test_f1: 0.5997
 epoch: 92, train_loss: 0.7917, test_loss: 0.8336, test_f1: 0.5812
 epoch: 93, train_loss: 0.7761, test_loss: 0.8431, test_f1: 0.6202
 epoch: 94, train_loss: 0.7643, test_loss: 0.8958, test_f1: 0.5749
 epoch: 95, train_loss: 0.7762, test_loss: 0.8536, test_f1: 0.6013
 epoch: 96, train_loss: 0.7802, test_loss: 0.8484, test_f1: 0.6115
 epoch: 97, train_loss: 0.7756, test_loss: 0.8525, test_f1: 0.6189
 epoch: 98, train_loss: 0.7839, test_loss: 0.8617, test_f1: 0.6020
 epoch: 99, train_loss: 0.7889, test_loss: 0.8710, test_f1: 0.5929
##################ITERATION #1 ****************************************
 epoch: 0, train_loss: 1.1143, test_loss: 1.0831, test_f1: 0.4519
 epoch: 1, train_loss: 1.0156, test_loss: 1.0461, test_f1: 0.4688
 epoch: 2, train_loss: 1.0009, test_loss: 0.9806, test_f1: 0.4884
 epoch: 3, train_loss: 0.9813, test_loss: 1.0192, test_f1: 0.5084
 epoch: 4, train_loss: 0.9728, test_loss: 0.9629, test_f1: 0.4895
 epoch: 5, train_loss: 0.9665, test_loss: 1.0093, test_f1: 0.4422
 epoch: 6, train_loss: 0.9528, test_loss: 0.9399, test_f1: 0.4798
 epoch: 7, train_loss: 0.9530, test_loss: 1.2525, test_f1: 0.4338
 epoch: 8, train_loss: 0.9329, test_loss: 0.9420, test_f1: 0.5100
 epoch: 9, train_loss: 0.9392, test_loss: 0.9979, test_f1: 0.5012
 epoch: 10, train_loss: 0.9270, test_loss: 0.9268, test_f1: 0.4937
 epoch: 11, train_loss: 0.9317, test_loss: 0.9743, test_f1: 0.5217
 epoch: 12, train_loss: 0.9299, test_loss: 0.8918, test_f1: 0.4855
 epoch: 13, train_loss: 0.9096, test_loss: 0.8702, test_f1: 0.5216
 epoch: 14, train_loss: 0.9155, test_loss: 0.9679, test_f1: 0.5159
 epoch: 15, train_loss: 0.9034, test_loss: 0.8701, test_f1: 0.5303
 epoch: 16, train_loss: 0.9059, test_loss: 0.9829, test_f1: 0.5163
 epoch: 17, train_loss: 0.8930, test_loss: 1.0680, test_f1: 0.4752
 epoch: 18, train_loss: 0.8939, test_loss: 0.9422, test_f1: 0.5057
 epoch: 19, train_loss: 0.9136, test_loss: 0.9119, test_f1: 0.4917
 epoch: 20, train_loss: 0.8781, test_loss: 0.9440, test_f1: 0.5009
 epoch: 21, train_loss: 0.8820, test_loss: 0.9534, test_f1: 0.5386
 epoch: 22, train_loss: 0.8801, test_loss: 0.8940, test_f1: 0.5421
 epoch: 23, train_loss: 0.8569, test_loss: 0.9177, test_f1: 0.5554
 epoch: 24, train_loss: 0.8404, test_loss: 0.9958, test_f1: 0.5578
 epoch: 25, train_loss: 0.8665, test_loss: 0.8577, test_f1: 0.5373
 epoch: 26, train_loss: 0.8596, test_loss: 0.9508, test_f1: 0.5270
 epoch: 27, train_loss: 0.8521, test_loss: 0.8846, test_f1: 0.5406
 epoch: 28, train_loss: 0.8586, test_loss: 0.8705, test_f1: 0.5596
 epoch: 29, train_loss: 0.8487, test_loss: 1.0206, test_f1: 0.5258
 epoch: 30, train_loss: 0.8526, test_loss: 0.8556, test_f1: 0.5726
 epoch: 31, train_loss: 0.8326, test_loss: 0.8993, test_f1: 0.5714
 epoch: 32, train_loss: 0.8374, test_loss: 1.0101, test_f1: 0.5305
 epoch: 33, train_loss: 0.8736, test_loss: 0.8628, test_f1: 0.6023
 epoch: 34, train_loss: 0.8546, test_loss: 0.8297, test_f1: 0.5601
 epoch: 35, train_loss: 0.8355, test_loss: 0.8661, test_f1: 0.5444
 epoch: 36, train_loss: 0.8270, test_loss: 0.8995, test_f1: 0.5591
 epoch: 37, train_loss: 0.8346, test_loss: 0.9032, test_f1: 0.5970
 epoch: 38, train_loss: 0.8213, test_loss: 0.9131, test_f1: 0.5341
 epoch: 39, train_loss: 0.8248, test_loss: 0.9753, test_f1: 0.5288
 epoch: 40, train_loss: 0.8232, test_loss: 0.8837, test_f1: 0.6096
 epoch: 41, train_loss: 0.8216, test_loss: 0.9014, test_f1: 0.5862
 epoch: 42, train_loss: 0.8105, test_loss: 0.9461, test_f1: 0.5491
 epoch: 43, train_loss: 0.8056, test_loss: 0.9348, test_f1: 0.5555
 epoch: 44, train_loss: 0.8105, test_loss: 0.9053, test_f1: 0.6149
 epoch: 45, train_loss: 0.8298, test_loss: 0.9139, test_f1: 0.5924
 epoch: 46, train_loss: 0.8097, test_loss: 0.8926, test_f1: 0.5452
 epoch: 47, train_loss: 0.8432, test_loss: 0.8866, test_f1: 0.5889
 epoch: 48, train_loss: 0.8076, test_loss: 0.9466, test_f1: 0.5467
 epoch: 49, train_loss: 0.8055, test_loss: 0.8886, test_f1: 0.5333
 epoch: 50, train_loss: 0.7902, test_loss: 0.9069, test_f1: 0.5643
 epoch: 51, train_loss: 0.7770, test_loss: 0.9440, test_f1: 0.6259
 epoch: 52, train_loss: 0.7719, test_loss: 0.9224, test_f1: 0.6250
 epoch: 53, train_loss: 0.7560, test_loss: 0.9130, test_f1: 0.6030
 epoch: 54, train_loss: 0.7631, test_loss: 0.9722, test_f1: 0.5999
 epoch: 55, train_loss: 0.7669, test_loss: 0.9409, test_f1: 0.5710
 epoch: 56, train_loss: 0.7668, test_loss: 0.9235, test_f1: 0.6030
 epoch: 57, train_loss: 0.7574, test_loss: 0.9433, test_f1: 0.5953
 epoch: 58, train_loss: 0.7620, test_loss: 0.9592, test_f1: 0.5759
 epoch: 59, train_loss: 0.7432, test_loss: 0.9317, test_f1: 0.6091
 epoch: 60, train_loss: 0.7544, test_loss: 0.9463, test_f1: 0.6241
 epoch: 61, train_loss: 0.7386, test_loss: 0.9578, test_f1: 0.6241
 epoch: 62, train_loss: 0.7480, test_loss: 0.9422, test_f1: 0.6092
 epoch: 63, train_loss: 0.7485, test_loss: 0.9554, test_f1: 0.6258
 epoch: 64, train_loss: 0.7433, test_loss: 1.0219, test_f1: 0.6123
 epoch: 65, train_loss: 0.7418, test_loss: 0.9785, test_f1: 0.5838
 epoch: 66, train_loss: 0.7565, test_loss: 0.9714, test_f1: 0.6158
 epoch: 67, train_loss: 0.7607, test_loss: 0.9596, test_f1: 0.5655
 epoch: 68, train_loss: 0.7472, test_loss: 0.9957, test_f1: 0.6015
 epoch: 69, train_loss: 0.7517, test_loss: 0.9626, test_f1: 0.6131
 epoch: 70, train_loss: 0.7321, test_loss: 1.0293, test_f1: 0.5838
 epoch: 71, train_loss: 0.7285, test_loss: 0.9999, test_f1: 0.5940
 epoch: 72, train_loss: 0.7398, test_loss: 1.0658, test_f1: 0.5781
 epoch: 73, train_loss: 0.7429, test_loss: 1.0181, test_f1: 0.5791
 epoch: 74, train_loss: 0.7393, test_loss: 1.0150, test_f1: 0.5832
 epoch: 75, train_loss: 0.7373, test_loss: 0.9886, test_f1: 0.6405
 epoch: 76, train_loss: 0.7402, test_loss: 0.9553, test_f1: 0.6271
 epoch: 77, train_loss: 0.7384, test_loss: 0.9793, test_f1: 0.5919
 epoch: 78, train_loss: 0.7460, test_loss: 1.0195, test_f1: 0.6288
 epoch: 79, train_loss: 0.7334, test_loss: 0.9705, test_f1: 0.6127
 epoch: 80, train_loss: 0.7502, test_loss: 1.0503, test_f1: 0.6154
 epoch: 81, train_loss: 0.7336, test_loss: 1.0415, test_f1: 0.6228
 epoch: 82, train_loss: 0.7280, test_loss: 1.0756, test_f1: 0.5764
 epoch: 83, train_loss: 0.7366, test_loss: 1.0454, test_f1: 0.6153
 epoch: 84, train_loss: 0.7336, test_loss: 0.9880, test_f1: 0.6273
 epoch: 85, train_loss: 0.7303, test_loss: 1.0460, test_f1: 0.5812
 epoch: 86, train_loss: 0.7287, test_loss: 1.0308, test_f1: 0.6014
 epoch: 87, train_loss: 0.7179, test_loss: 1.0175, test_f1: 0.6414
 epoch: 88, train_loss: 0.7194, test_loss: 0.9905, test_f1: 0.6222
 epoch: 89, train_loss: 0.7230, test_loss: 1.0228, test_f1: 0.6169
 epoch: 90, train_loss: 0.7153, test_loss: 1.0575, test_f1: 0.6268
 epoch: 91, train_loss: 0.7188, test_loss: 1.0041, test_f1: 0.5999
 epoch: 92, train_loss: 0.7226, test_loss: 1.0297, test_f1: 0.6268
 epoch: 93, train_loss: 0.7310, test_loss: 1.0977, test_f1: 0.6247
 epoch: 94, train_loss: 0.7214, test_loss: 1.0715, test_f1: 0.6000
 epoch: 95, train_loss: 0.7334, test_loss: 0.9945, test_f1: 0.6387
 epoch: 96, train_loss: 0.7090, test_loss: 1.1194, test_f1: 0.6457
 epoch: 97, train_loss: 0.7143, test_loss: 1.1387, test_f1: 0.6306
 epoch: 98, train_loss: 0.7131, test_loss: 1.0487, test_f1: 0.5780
 epoch: 99, train_loss: 0.7231, test_loss: 1.0046, test_f1: 0.6368
##################ITERATION #2 ****************************************
 epoch: 0, train_loss: 1.1304, test_loss: 1.0629, test_f1: 0.3869
 epoch: 1, train_loss: 1.0460, test_loss: 1.1176, test_f1: 0.4542
 epoch: 2, train_loss: 1.0265, test_loss: 0.9988, test_f1: 0.4917
 epoch: 3, train_loss: 1.0134, test_loss: 1.0349, test_f1: 0.4944
 epoch: 4, train_loss: 0.9830, test_loss: 1.0032, test_f1: 0.5218
 epoch: 5, train_loss: 0.9777, test_loss: 1.0278, test_f1: 0.4842
 epoch: 6, train_loss: 0.9750, test_loss: 1.0556, test_f1: 0.4784
 epoch: 7, train_loss: 0.9629, test_loss: 1.0061, test_f1: 0.5117
 epoch: 8, train_loss: 0.9573, test_loss: 0.9860, test_f1: 0.5040
 epoch: 9, train_loss: 0.9640, test_loss: 0.9764, test_f1: 0.4720
 epoch: 10, train_loss: 0.9504, test_loss: 0.9831, test_f1: 0.4960
 epoch: 11, train_loss: 0.9719, test_loss: 0.9674, test_f1: 0.4850
 epoch: 12, train_loss: 0.9584, test_loss: 0.9831, test_f1: 0.4755
 epoch: 13, train_loss: 0.9487, test_loss: 0.9915, test_f1: 0.4762
 epoch: 14, train_loss: 0.9298, test_loss: 0.9381, test_f1: 0.5111
 epoch: 15, train_loss: 0.9305, test_loss: 0.9354, test_f1: 0.5004
 epoch: 16, train_loss: 0.9211, test_loss: 1.0562, test_f1: 0.4814
 epoch: 17, train_loss: 0.9135, test_loss: 0.9104, test_f1: 0.5206
 epoch: 18, train_loss: 0.9085, test_loss: 0.9579, test_f1: 0.5605
 epoch: 19, train_loss: 0.9106, test_loss: 0.9391, test_f1: 0.5041
 epoch: 20, train_loss: 0.9066, test_loss: 0.9633, test_f1: 0.5135
 epoch: 21, train_loss: 0.9223, test_loss: 0.9397, test_f1: 0.5315
 epoch: 22, train_loss: 0.8882, test_loss: 0.9141, test_f1: 0.5592
 epoch: 23, train_loss: 0.8966, test_loss: 0.9646, test_f1: 0.5021
 epoch: 24, train_loss: 0.8994, test_loss: 0.8980, test_f1: 0.5180
 epoch: 25, train_loss: 0.8926, test_loss: 0.9175, test_f1: 0.5278
 epoch: 26, train_loss: 0.8943, test_loss: 1.0061, test_f1: 0.4838
 epoch: 27, train_loss: 0.8988, test_loss: 0.8850, test_f1: 0.5490
 epoch: 28, train_loss: 0.8949, test_loss: 0.9372, test_f1: 0.4925
 epoch: 29, train_loss: 0.8607, test_loss: 0.9207, test_f1: 0.5358
 epoch: 30, train_loss: 0.8741, test_loss: 0.9550, test_f1: 0.5247
 epoch: 31, train_loss: 0.8836, test_loss: 0.8888, test_f1: 0.5450
 epoch: 32, train_loss: 0.8668, test_loss: 0.8936, test_f1: 0.5423
 epoch: 33, train_loss: 0.8800, test_loss: 0.8632, test_f1: 0.5446
 epoch: 34, train_loss: 0.8637, test_loss: 0.9124, test_f1: 0.5331
 epoch: 35, train_loss: 0.8662, test_loss: 0.9643, test_f1: 0.5460
 epoch: 36, train_loss: 0.8632, test_loss: 0.9372, test_f1: 0.5005
 epoch: 37, train_loss: 0.8678, test_loss: 0.8970, test_f1: 0.5416
 epoch: 38, train_loss: 0.8738, test_loss: 0.8484, test_f1: 0.5593
 epoch: 39, train_loss: 0.8629, test_loss: 0.8242, test_f1: 0.5613
 epoch: 40, train_loss: 0.8551, test_loss: 0.9202, test_f1: 0.5179
 epoch: 41, train_loss: 0.8411, test_loss: 0.9030, test_f1: 0.5409
 epoch: 42, train_loss: 0.8581, test_loss: 0.8516, test_f1: 0.5661
 epoch: 43, train_loss: 0.8653, test_loss: 0.9194, test_f1: 0.5903
 epoch: 44, train_loss: 0.8548, test_loss: 0.9176, test_f1: 0.5427
 epoch: 45, train_loss: 0.8632, test_loss: 0.8993, test_f1: 0.5690
 epoch: 46, train_loss: 0.8604, test_loss: 0.8781, test_f1: 0.5386
 epoch: 47, train_loss: 0.8353, test_loss: 0.8548, test_f1: 0.5688
 epoch: 48, train_loss: 0.8424, test_loss: 0.8119, test_f1: 0.5891
 epoch: 49, train_loss: 0.8423, test_loss: 0.8448, test_f1: 0.5871
 epoch: 50, train_loss: 0.8450, test_loss: 0.8635, test_f1: 0.5709
 epoch: 51, train_loss: 0.8165, test_loss: 0.8444, test_f1: 0.5679
 epoch: 52, train_loss: 0.8155, test_loss: 0.8270, test_f1: 0.6246
 epoch: 53, train_loss: 0.8083, test_loss: 0.8240, test_f1: 0.5870
 epoch: 54, train_loss: 0.8087, test_loss: 0.7983, test_f1: 0.5768
 epoch: 55, train_loss: 0.8135, test_loss: 0.8342, test_f1: 0.5887
 epoch: 56, train_loss: 0.8142, test_loss: 0.8101, test_f1: 0.6287
 epoch: 57, train_loss: 0.8101, test_loss: 0.8200, test_f1: 0.5966
 epoch: 58, train_loss: 0.8116, test_loss: 0.8088, test_f1: 0.5839
 epoch: 59, train_loss: 0.7842, test_loss: 0.8443, test_f1: 0.5654
 epoch: 60, train_loss: 0.7942, test_loss: 0.8189, test_f1: 0.6129
 epoch: 61, train_loss: 0.8210, test_loss: 0.8488, test_f1: 0.5807
 epoch: 62, train_loss: 0.7900, test_loss: 0.8413, test_f1: 0.5981
 epoch: 63, train_loss: 0.7970, test_loss: 0.8207, test_f1: 0.6016
 epoch: 64, train_loss: 0.7921, test_loss: 0.8190, test_f1: 0.5789
 epoch: 65, train_loss: 0.7851, test_loss: 0.8038, test_f1: 0.6045
 epoch: 66, train_loss: 0.7871, test_loss: 0.8408, test_f1: 0.5824
 epoch: 67, train_loss: 0.7744, test_loss: 0.8293, test_f1: 0.6103
 epoch: 68, train_loss: 0.7781, test_loss: 0.8412, test_f1: 0.6184
 epoch: 69, train_loss: 0.7859, test_loss: 0.8408, test_f1: 0.6098
 epoch: 70, train_loss: 0.7927, test_loss: 0.8129, test_f1: 0.6258
 epoch: 71, train_loss: 0.7786, test_loss: 0.8546, test_f1: 0.5769
 epoch: 72, train_loss: 0.7941, test_loss: 0.8275, test_f1: 0.6079
 epoch: 73, train_loss: 0.7909, test_loss: 0.8660, test_f1: 0.6001
 epoch: 74, train_loss: 0.7766, test_loss: 0.8058, test_f1: 0.6278
 epoch: 75, train_loss: 0.7660, test_loss: 0.8555, test_f1: 0.6290
 epoch: 76, train_loss: 0.7766, test_loss: 0.8610, test_f1: 0.6228
 epoch: 77, train_loss: 0.7840, test_loss: 0.8458, test_f1: 0.6218
 epoch: 78, train_loss: 0.7826, test_loss: 0.8509, test_f1: 0.6079
 epoch: 79, train_loss: 0.7808, test_loss: 0.8801, test_f1: 0.5898
 epoch: 80, train_loss: 0.7679, test_loss: 0.8522, test_f1: 0.6071
 epoch: 81, train_loss: 0.7609, test_loss: 0.8526, test_f1: 0.6092
 epoch: 82, train_loss: 0.7775, test_loss: 0.8742, test_f1: 0.5744
 epoch: 83, train_loss: 0.7740, test_loss: 0.8437, test_f1: 0.5996
 epoch: 84, train_loss: 0.7695, test_loss: 0.8626, test_f1: 0.6143
 epoch: 85, train_loss: 0.7772, test_loss: 0.8137, test_f1: 0.6209
 epoch: 86, train_loss: 0.7677, test_loss: 0.8812, test_f1: 0.5949
 epoch: 87, train_loss: 0.7750, test_loss: 0.8410, test_f1: 0.6311
 epoch: 88, train_loss: 0.7826, test_loss: 0.8136, test_f1: 0.6245
 epoch: 89, train_loss: 0.7716, test_loss: 0.8544, test_f1: 0.6331
 epoch: 90, train_loss: 0.7611, test_loss: 0.9047, test_f1: 0.6032
 epoch: 91, train_loss: 0.7637, test_loss: 0.8415, test_f1: 0.6440
 epoch: 92, train_loss: 0.7570, test_loss: 0.8663, test_f1: 0.6135
 epoch: 93, train_loss: 0.7466, test_loss: 0.9077, test_f1: 0.6017
 epoch: 94, train_loss: 0.7555, test_loss: 0.8501, test_f1: 0.5965
 epoch: 95, train_loss: 0.7581, test_loss: 0.8551, test_f1: 0.6256
 epoch: 96, train_loss: 0.7663, test_loss: 0.9067, test_f1: 0.5899
 epoch: 97, train_loss: 0.7674, test_loss: 0.8689, test_f1: 0.6242
 epoch: 98, train_loss: 0.7829, test_loss: 0.8272, test_f1: 0.6360
 epoch: 99, train_loss: 0.7453, test_loss: 0.8729, test_f1: 0.5976
##################ITERATION #3 ****************************************
 epoch: 0, train_loss: 1.1161, test_loss: 1.3105, test_f1: 0.3491
 epoch: 1, train_loss: 1.0383, test_loss: 1.0937, test_f1: 0.4968
 epoch: 2, train_loss: 1.0329, test_loss: 1.0084, test_f1: 0.4648
 epoch: 3, train_loss: 1.0259, test_loss: 1.1178, test_f1: 0.4600
 epoch: 4, train_loss: 0.9863, test_loss: 1.0923, test_f1: 0.4511
 epoch: 5, train_loss: 0.9930, test_loss: 1.0186, test_f1: 0.4679
 epoch: 6, train_loss: 0.9678, test_loss: 1.0248, test_f1: 0.4618
 epoch: 7, train_loss: 0.9524, test_loss: 0.9749, test_f1: 0.4875
 epoch: 8, train_loss: 0.9562, test_loss: 0.9739, test_f1: 0.4516
 epoch: 9, train_loss: 0.9560, test_loss: 1.0027, test_f1: 0.4717
 epoch: 10, train_loss: 0.9316, test_loss: 1.3003, test_f1: 0.4267
 epoch: 11, train_loss: 0.9510, test_loss: 0.9595, test_f1: 0.4907
 epoch: 12, train_loss: 0.9434, test_loss: 0.9997, test_f1: 0.5027
 epoch: 13, train_loss: 0.9311, test_loss: 0.9630, test_f1: 0.5145
 epoch: 14, train_loss: 0.9298, test_loss: 0.9849, test_f1: 0.5039
 epoch: 15, train_loss: 0.9398, test_loss: 1.0176, test_f1: 0.4642
 epoch: 16, train_loss: 0.9219, test_loss: 0.9336, test_f1: 0.5121
 epoch: 17, train_loss: 0.9210, test_loss: 0.9072, test_f1: 0.5174
 epoch: 18, train_loss: 0.8969, test_loss: 0.9356, test_f1: 0.5333
 epoch: 19, train_loss: 0.8995, test_loss: 0.9598, test_f1: 0.4871
 epoch: 20, train_loss: 0.8982, test_loss: 0.9351, test_f1: 0.5210
 epoch: 21, train_loss: 0.9046, test_loss: 0.9160, test_f1: 0.5363
 epoch: 22, train_loss: 0.9161, test_loss: 1.1539, test_f1: 0.4406
 epoch: 23, train_loss: 0.9132, test_loss: 0.8911, test_f1: 0.5802
 epoch: 24, train_loss: 0.8910, test_loss: 0.9220, test_f1: 0.5517
 epoch: 25, train_loss: 0.8976, test_loss: 0.8766, test_f1: 0.5288
 epoch: 26, train_loss: 0.8874, test_loss: 0.9023, test_f1: 0.5300
 epoch: 27, train_loss: 0.8879, test_loss: 0.9272, test_f1: 0.5029
 epoch: 28, train_loss: 0.8945, test_loss: 0.8626, test_f1: 0.5310
 epoch: 29, train_loss: 0.9256, test_loss: 0.9465, test_f1: 0.5139
 epoch: 30, train_loss: 0.8997, test_loss: 0.8941, test_f1: 0.5258
 epoch: 31, train_loss: 0.8910, test_loss: 0.9087, test_f1: 0.5319
 epoch: 32, train_loss: 0.8734, test_loss: 0.8728, test_f1: 0.5493
 epoch: 33, train_loss: 0.8862, test_loss: 0.9456, test_f1: 0.5552
 epoch: 34, train_loss: 0.8884, test_loss: 0.8760, test_f1: 0.5742
 epoch: 35, train_loss: 0.8760, test_loss: 0.9599, test_f1: 0.5048
 epoch: 36, train_loss: 0.8686, test_loss: 0.9109, test_f1: 0.5298
 epoch: 37, train_loss: 0.8862, test_loss: 0.8803, test_f1: 0.5781
 epoch: 38, train_loss: 0.8983, test_loss: 0.9092, test_f1: 0.5493
 epoch: 39, train_loss: 0.8880, test_loss: 0.8935, test_f1: 0.5350
 epoch: 40, train_loss: 0.8559, test_loss: 0.9017, test_f1: 0.5370
 epoch: 41, train_loss: 0.8677, test_loss: 0.9093, test_f1: 0.5480
 epoch: 42, train_loss: 0.8598, test_loss: 0.8453, test_f1: 0.5695
 epoch: 43, train_loss: 0.8543, test_loss: 0.9431, test_f1: 0.5661
 epoch: 44, train_loss: 0.8860, test_loss: 0.9382, test_f1: 0.5302
 epoch: 45, train_loss: 0.8653, test_loss: 0.9137, test_f1: 0.5307
 epoch: 46, train_loss: 0.8505, test_loss: 0.8834, test_f1: 0.5582
 epoch: 47, train_loss: 0.8539, test_loss: 0.8900, test_f1: 0.5462
 epoch: 48, train_loss: 0.8488, test_loss: 0.8654, test_f1: 0.6120
 epoch: 49, train_loss: 0.8368, test_loss: 0.8368, test_f1: 0.5460
 epoch: 50, train_loss: 0.8655, test_loss: 0.8702, test_f1: 0.6081
 epoch: 51, train_loss: 0.8412, test_loss: 0.8498, test_f1: 0.5729
 epoch: 52, train_loss: 0.8400, test_loss: 0.8486, test_f1: 0.5647
 epoch: 53, train_loss: 0.8282, test_loss: 0.8808, test_f1: 0.5458
 epoch: 54, train_loss: 0.8353, test_loss: 0.8818, test_f1: 0.5556
 epoch: 55, train_loss: 0.8352, test_loss: 0.8399, test_f1: 0.5795
 epoch: 56, train_loss: 0.8183, test_loss: 0.8458, test_f1: 0.5592
 epoch: 57, train_loss: 0.8318, test_loss: 0.8491, test_f1: 0.5638
 epoch: 58, train_loss: 0.8300, test_loss: 0.8272, test_f1: 0.5651
 epoch: 59, train_loss: 0.8093, test_loss: 0.8488, test_f1: 0.5667
 epoch: 60, train_loss: 0.8248, test_loss: 0.8411, test_f1: 0.5549
 epoch: 61, train_loss: 0.8238, test_loss: 0.8381, test_f1: 0.5891
 epoch: 62, train_loss: 0.8151, test_loss: 0.8504, test_f1: 0.5542
 epoch: 63, train_loss: 0.8100, test_loss: 0.8231, test_f1: 0.5790
 epoch: 64, train_loss: 0.8146, test_loss: 0.8586, test_f1: 0.5721
 epoch: 65, train_loss: 0.8170, test_loss: 0.8603, test_f1: 0.5601
 epoch: 66, train_loss: 0.8140, test_loss: 0.8423, test_f1: 0.5690
 epoch: 67, train_loss: 0.8089, test_loss: 0.8655, test_f1: 0.5561
 epoch: 68, train_loss: 0.8061, test_loss: 0.8593, test_f1: 0.5581
 epoch: 69, train_loss: 0.8211, test_loss: 0.8346, test_f1: 0.5856
 epoch: 70, train_loss: 0.8146, test_loss: 0.8293, test_f1: 0.5479
 epoch: 71, train_loss: 0.8188, test_loss: 0.8398, test_f1: 0.5918
 epoch: 72, train_loss: 0.7947, test_loss: 0.8252, test_f1: 0.5703
 epoch: 73, train_loss: 0.8151, test_loss: 0.8420, test_f1: 0.5621
 epoch: 74, train_loss: 0.8031, test_loss: 0.8429, test_f1: 0.6027
 epoch: 75, train_loss: 0.8029, test_loss: 0.8261, test_f1: 0.5562
 epoch: 76, train_loss: 0.8058, test_loss: 0.8458, test_f1: 0.5669
 epoch: 77, train_loss: 0.7964, test_loss: 0.8120, test_f1: 0.5694
 epoch: 78, train_loss: 0.8001, test_loss: 0.8364, test_f1: 0.5740
 epoch: 79, train_loss: 0.8121, test_loss: 0.8421, test_f1: 0.5654
 epoch: 80, train_loss: 0.7892, test_loss: 0.8190, test_f1: 0.5694
 epoch: 81, train_loss: 0.8064, test_loss: 0.8574, test_f1: 0.5517
 epoch: 82, train_loss: 0.8043, test_loss: 0.8501, test_f1: 0.5794
 epoch: 83, train_loss: 0.7932, test_loss: 0.8291, test_f1: 0.5706
 epoch: 84, train_loss: 0.7933, test_loss: 0.8415, test_f1: 0.5814
 epoch: 85, train_loss: 0.8056, test_loss: 0.8681, test_f1: 0.5527
 epoch: 86, train_loss: 0.7920, test_loss: 0.8442, test_f1: 0.5739
 epoch: 87, train_loss: 0.7911, test_loss: 0.8229, test_f1: 0.5586
 epoch: 88, train_loss: 0.8000, test_loss: 0.8466, test_f1: 0.5632
 epoch: 89, train_loss: 0.7909, test_loss: 0.8108, test_f1: 0.5776
 epoch: 90, train_loss: 0.7995, test_loss: 0.8083, test_f1: 0.5857
 epoch: 91, train_loss: 0.7906, test_loss: 0.8052, test_f1: 0.5992
 epoch: 92, train_loss: 0.8064, test_loss: 0.8072, test_f1: 0.5842
 epoch: 93, train_loss: 0.7850, test_loss: 0.8178, test_f1: 0.6174
 epoch: 94, train_loss: 0.7856, test_loss: 0.8120, test_f1: 0.5688
 epoch: 95, train_loss: 0.8038, test_loss: 0.8421, test_f1: 0.5740
 epoch: 96, train_loss: 0.7928, test_loss: 0.8190, test_f1: 0.5751
 epoch: 97, train_loss: 0.8030, test_loss: 0.7898, test_f1: 0.5859
 epoch: 98, train_loss: 0.7886, test_loss: 0.8363, test_f1: 0.5912
 epoch: 99, train_loss: 0.7932, test_loss: 0.8227, test_f1: 0.5706
##################ITERATION #4 ****************************************
 epoch: 0, train_loss: 1.1205, test_loss: 1.1823, test_f1: 0.3724
 epoch: 1, train_loss: 1.0391, test_loss: 1.0997, test_f1: 0.4517
 epoch: 2, train_loss: 1.0309, test_loss: 1.0052, test_f1: 0.4626
 epoch: 3, train_loss: 1.0210, test_loss: 1.0690, test_f1: 0.4433
 epoch: 4, train_loss: 0.9927, test_loss: 1.0550, test_f1: 0.4828
 epoch: 5, train_loss: 0.9968, test_loss: 1.0685, test_f1: 0.4842
 epoch: 6, train_loss: 0.9720, test_loss: 1.0025, test_f1: 0.4981
 epoch: 7, train_loss: 0.9523, test_loss: 1.0831, test_f1: 0.4952
 epoch: 8, train_loss: 0.9526, test_loss: 0.9260, test_f1: 0.5017
 epoch: 9, train_loss: 0.9548, test_loss: 0.9841, test_f1: 0.4984
 epoch: 10, train_loss: 0.9509, test_loss: 1.0046, test_f1: 0.4231
 epoch: 11, train_loss: 0.9551, test_loss: 1.0224, test_f1: 0.4548
 epoch: 12, train_loss: 0.9347, test_loss: 0.9631, test_f1: 0.4922
 epoch: 13, train_loss: 0.9466, test_loss: 0.9693, test_f1: 0.5086
 epoch: 14, train_loss: 0.9536, test_loss: 0.9271, test_f1: 0.5006
 epoch: 15, train_loss: 0.9413, test_loss: 0.9314, test_f1: 0.5011
 epoch: 16, train_loss: 0.9275, test_loss: 0.9659, test_f1: 0.5213
 epoch: 17, train_loss: 0.9104, test_loss: 1.0038, test_f1: 0.5053
 epoch: 18, train_loss: 0.9045, test_loss: 0.9523, test_f1: 0.5463
 epoch: 19, train_loss: 0.9084, test_loss: 0.9459, test_f1: 0.5497
 epoch: 20, train_loss: 0.9062, test_loss: 0.8936, test_f1: 0.5386
 epoch: 21, train_loss: 0.8981, test_loss: 0.9418, test_f1: 0.5121
 epoch: 22, train_loss: 0.8932, test_loss: 0.9972, test_f1: 0.5142
 epoch: 23, train_loss: 0.9012, test_loss: 0.9327, test_f1: 0.5095
 epoch: 24, train_loss: 0.8743, test_loss: 0.8976, test_f1: 0.5274
 epoch: 25, train_loss: 0.8812, test_loss: 0.9717, test_f1: 0.5122
 epoch: 26, train_loss: 0.8817, test_loss: 0.9707, test_f1: 0.4795
 epoch: 27, train_loss: 0.8834, test_loss: 0.8532, test_f1: 0.5639
 epoch: 28, train_loss: 0.8784, test_loss: 0.8901, test_f1: 0.5249
 epoch: 29, train_loss: 0.8837, test_loss: 0.8788, test_f1: 0.5385
 epoch: 30, train_loss: 0.8651, test_loss: 0.8909, test_f1: 0.5219
 epoch: 31, train_loss: 0.8634, test_loss: 0.8659, test_f1: 0.5616
 epoch: 32, train_loss: 0.8571, test_loss: 0.8458, test_f1: 0.5535
 epoch: 33, train_loss: 0.8555, test_loss: 0.8758, test_f1: 0.5347
 epoch: 34, train_loss: 0.8744, test_loss: 0.9177, test_f1: 0.5325
 epoch: 35, train_loss: 0.8454, test_loss: 0.8685, test_f1: 0.5558
 epoch: 36, train_loss: 0.8710, test_loss: 0.8541, test_f1: 0.5812
 epoch: 37, train_loss: 0.8590, test_loss: 0.8569, test_f1: 0.5556
 epoch: 38, train_loss: 0.8490, test_loss: 0.8646, test_f1: 0.5508
 epoch: 39, train_loss: 0.8302, test_loss: 0.8551, test_f1: 0.5553
 epoch: 40, train_loss: 0.8412, test_loss: 0.8606, test_f1: 0.5421
 epoch: 41, train_loss: 0.8518, test_loss: 0.8769, test_f1: 0.5457
 epoch: 42, train_loss: 0.8433, test_loss: 0.8362, test_f1: 0.5571
 epoch: 43, train_loss: 0.8344, test_loss: 0.8640, test_f1: 0.5609
 epoch: 44, train_loss: 0.8565, test_loss: 0.8656, test_f1: 0.5601
 epoch: 45, train_loss: 0.8254, test_loss: 0.8584, test_f1: 0.5659
 epoch: 46, train_loss: 0.8361, test_loss: 0.8701, test_f1: 0.5561
 epoch: 47, train_loss: 0.8284, test_loss: 0.8333, test_f1: 0.5557
 epoch: 48, train_loss: 0.8275, test_loss: 0.8944, test_f1: 0.5716
 epoch: 49, train_loss: 0.8404, test_loss: 0.9310, test_f1: 0.5370
 epoch: 50, train_loss: 0.8363, test_loss: 0.8648, test_f1: 0.5643
 epoch: 51, train_loss: 0.8100, test_loss: 0.8627, test_f1: 0.5588
 epoch: 52, train_loss: 0.8045, test_loss: 0.8405, test_f1: 0.5837
 epoch: 53, train_loss: 0.7969, test_loss: 0.8346, test_f1: 0.5807
 epoch: 54, train_loss: 0.8066, test_loss: 0.8357, test_f1: 0.5835
 epoch: 55, train_loss: 0.7911, test_loss: 0.8554, test_f1: 0.5774
 epoch: 56, train_loss: 0.8088, test_loss: 0.8129, test_f1: 0.5941
 epoch: 57, train_loss: 0.7916, test_loss: 0.8329, test_f1: 0.5804
 epoch: 58, train_loss: 0.7841, test_loss: 0.8304, test_f1: 0.5824
 epoch: 59, train_loss: 0.7851, test_loss: 0.8154, test_f1: 0.5822
 epoch: 60, train_loss: 0.7886, test_loss: 0.8331, test_f1: 0.5764
 epoch: 61, train_loss: 0.7777, test_loss: 0.9599, test_f1: 0.5512
 epoch: 62, train_loss: 0.7719, test_loss: 0.8244, test_f1: 0.5783
 epoch: 63, train_loss: 0.7879, test_loss: 0.8127, test_f1: 0.6071
 epoch: 64, train_loss: 0.7682, test_loss: 0.8048, test_f1: 0.5884
 epoch: 65, train_loss: 0.7684, test_loss: 0.8185, test_f1: 0.5980
 epoch: 66, train_loss: 0.7820, test_loss: 0.8141, test_f1: 0.5925
 epoch: 67, train_loss: 0.7809, test_loss: 0.8113, test_f1: 0.6061
 epoch: 68, train_loss: 0.7732, test_loss: 0.8156, test_f1: 0.5985
 epoch: 69, train_loss: 0.7800, test_loss: 0.8035, test_f1: 0.6361
 epoch: 70, train_loss: 0.7692, test_loss: 0.8359, test_f1: 0.6177
 epoch: 71, train_loss: 0.7760, test_loss: 0.8101, test_f1: 0.6221
 epoch: 72, train_loss: 0.7626, test_loss: 0.8170, test_f1: 0.6312
 epoch: 73, train_loss: 0.7604, test_loss: 0.8270, test_f1: 0.6126
 epoch: 74, train_loss: 0.7667, test_loss: 0.8164, test_f1: 0.6276
 epoch: 75, train_loss: 0.7763, test_loss: 0.8212, test_f1: 0.6029
 epoch: 76, train_loss: 0.7703, test_loss: 0.8040, test_f1: 0.6462
 epoch: 77, train_loss: 0.7711, test_loss: 0.8336, test_f1: 0.6093
 epoch: 78, train_loss: 0.7697, test_loss: 0.8116, test_f1: 0.5860
 epoch: 79, train_loss: 0.7564, test_loss: 0.8496, test_f1: 0.6211
 epoch: 80, train_loss: 0.7588, test_loss: 0.8378, test_f1: 0.5691
 epoch: 81, train_loss: 0.7761, test_loss: 0.8117, test_f1: 0.6141
 epoch: 82, train_loss: 0.7603, test_loss: 0.8073, test_f1: 0.6068
 epoch: 83, train_loss: 0.7550, test_loss: 0.8148, test_f1: 0.6060
 epoch: 84, train_loss: 0.7568, test_loss: 0.8107, test_f1: 0.6181
 epoch: 85, train_loss: 0.7583, test_loss: 0.8231, test_f1: 0.6441
 epoch: 86, train_loss: 0.7619, test_loss: 0.8006, test_f1: 0.6063
 epoch: 87, train_loss: 0.7645, test_loss: 0.7948, test_f1: 0.6120
 epoch: 88, train_loss: 0.7621, test_loss: 0.8563, test_f1: 0.6142
 epoch: 89, train_loss: 0.7520, test_loss: 0.8087, test_f1: 0.6059
 epoch: 90, train_loss: 0.7559, test_loss: 0.8039, test_f1: 0.6078
 epoch: 91, train_loss: 0.7466, test_loss: 0.8180, test_f1: 0.6205
 epoch: 92, train_loss: 0.7590, test_loss: 0.8042, test_f1: 0.5974
 epoch: 93, train_loss: 0.7530, test_loss: 0.8526, test_f1: 0.6291
 epoch: 94, train_loss: 0.7368, test_loss: 0.8560, test_f1: 0.5946
 epoch: 95, train_loss: 0.7436, test_loss: 0.8132, test_f1: 0.5960
 epoch: 96, train_loss: 0.7458, test_loss: 0.8621, test_f1: 0.5770
 epoch: 97, train_loss: 0.7410, test_loss: 0.8317, test_f1: 0.6219
 epoch: 98, train_loss: 0.7549, test_loss: 0.8175, test_f1: 0.6335
 epoch: 99, train_loss: 0.7492, test_loss: 0.8074, test_f1: 0.6219
##################ITERATION #5 ****************************************
 epoch: 0, train_loss: 1.1279, test_loss: 1.0340, test_f1: 0.3755
 epoch: 1, train_loss: 1.0415, test_loss: 1.0318, test_f1: 0.4001
 epoch: 2, train_loss: 1.0169, test_loss: 1.0582, test_f1: 0.4378
 epoch: 3, train_loss: 0.9930, test_loss: 1.0539, test_f1: 0.4565
 epoch: 4, train_loss: 0.9845, test_loss: 1.0196, test_f1: 0.4479
 epoch: 5, train_loss: 0.9755, test_loss: 1.0505, test_f1: 0.4405
 epoch: 6, train_loss: 0.9672, test_loss: 1.0678, test_f1: 0.4477
 epoch: 7, train_loss: 0.9603, test_loss: 1.0034, test_f1: 0.4966
 epoch: 8, train_loss: 0.9398, test_loss: 1.1371, test_f1: 0.4641
 epoch: 9, train_loss: 0.9653, test_loss: 0.9790, test_f1: 0.4827
 epoch: 10, train_loss: 0.9399, test_loss: 0.9687, test_f1: 0.5054
 epoch: 11, train_loss: 0.9257, test_loss: 0.9747, test_f1: 0.5038
 epoch: 12, train_loss: 0.9102, test_loss: 1.0657, test_f1: 0.4788
 epoch: 13, train_loss: 0.9144, test_loss: 0.9611, test_f1: 0.5207
 epoch: 14, train_loss: 0.9013, test_loss: 1.0392, test_f1: 0.4888
 epoch: 15, train_loss: 0.9119, test_loss: 1.0392, test_f1: 0.4783
 epoch: 16, train_loss: 0.9052, test_loss: 0.9272, test_f1: 0.5297
 epoch: 17, train_loss: 0.9124, test_loss: 0.8939, test_f1: 0.5555
 epoch: 18, train_loss: 0.8998, test_loss: 0.9765, test_f1: 0.5155
 epoch: 19, train_loss: 0.9063, test_loss: 0.9646, test_f1: 0.4815
 epoch: 20, train_loss: 0.8971, test_loss: 0.9300, test_f1: 0.5281
 epoch: 21, train_loss: 0.8716, test_loss: 0.9513, test_f1: 0.4892
 epoch: 22, train_loss: 0.8796, test_loss: 0.9560, test_f1: 0.5113
 epoch: 23, train_loss: 0.8786, test_loss: 1.0259, test_f1: 0.4732
 epoch: 24, train_loss: 0.8915, test_loss: 0.8854, test_f1: 0.5383
 epoch: 25, train_loss: 0.8699, test_loss: 1.0035, test_f1: 0.5103
 epoch: 26, train_loss: 0.8760, test_loss: 0.9112, test_f1: 0.5164
 epoch: 27, train_loss: 0.8651, test_loss: 0.9281, test_f1: 0.5291
 epoch: 28, train_loss: 0.8897, test_loss: 0.9075, test_f1: 0.4857
 epoch: 29, train_loss: 0.8688, test_loss: 0.9458, test_f1: 0.5198
 epoch: 30, train_loss: 0.8583, test_loss: 1.0894, test_f1: 0.4816
 epoch: 31, train_loss: 0.8589, test_loss: 0.9966, test_f1: 0.4914
 epoch: 32, train_loss: 0.8825, test_loss: 0.9928, test_f1: 0.4977
 epoch: 33, train_loss: 0.8763, test_loss: 0.9235, test_f1: 0.5320
 epoch: 34, train_loss: 0.8546, test_loss: 0.9529, test_f1: 0.5099
 epoch: 35, train_loss: 0.8592, test_loss: 0.9858, test_f1: 0.5221
 epoch: 36, train_loss: 0.8435, test_loss: 0.9703, test_f1: 0.5578
 epoch: 37, train_loss: 0.8507, test_loss: 0.9474, test_f1: 0.5373
 epoch: 38, train_loss: 0.8403, test_loss: 0.9030, test_f1: 0.5516
 epoch: 39, train_loss: 0.8255, test_loss: 0.9291, test_f1: 0.5911
 epoch: 40, train_loss: 0.8338, test_loss: 0.9333, test_f1: 0.5640
 epoch: 41, train_loss: 0.8402, test_loss: 0.9225, test_f1: 0.5390
 epoch: 42, train_loss: 0.8340, test_loss: 0.9457, test_f1: 0.5023
 epoch: 43, train_loss: 0.8315, test_loss: 0.9522, test_f1: 0.5272
 epoch: 44, train_loss: 0.8244, test_loss: 0.9738, test_f1: 0.5383
 epoch: 45, train_loss: 0.8336, test_loss: 0.9240, test_f1: 0.5335
 epoch: 46, train_loss: 0.8261, test_loss: 0.9060, test_f1: 0.5433
 epoch: 47, train_loss: 0.8174, test_loss: 0.9059, test_f1: 0.5799
 epoch: 48, train_loss: 0.8274, test_loss: 0.9111, test_f1: 0.6098
 epoch: 49, train_loss: 0.8100, test_loss: 0.9073, test_f1: 0.5684
 epoch: 50, train_loss: 0.8206, test_loss: 0.9425, test_f1: 0.5983
 epoch: 51, train_loss: 0.8022, test_loss: 0.9244, test_f1: 0.5583
 epoch: 52, train_loss: 0.7851, test_loss: 0.8925, test_f1: 0.6367
 epoch: 53, train_loss: 0.7915, test_loss: 0.9178, test_f1: 0.5978
 epoch: 54, train_loss: 0.7773, test_loss: 0.9484, test_f1: 0.6032
 epoch: 55, train_loss: 0.7735, test_loss: 1.0137, test_f1: 0.6047
 epoch: 56, train_loss: 0.7906, test_loss: 0.9364, test_f1: 0.6296
 epoch: 57, train_loss: 0.7774, test_loss: 0.9251, test_f1: 0.5803
 epoch: 58, train_loss: 0.7733, test_loss: 0.8989, test_f1: 0.5751
 epoch: 59, train_loss: 0.7845, test_loss: 0.9432, test_f1: 0.5527
 epoch: 60, train_loss: 0.7686, test_loss: 0.9498, test_f1: 0.6096
 epoch: 61, train_loss: 0.7639, test_loss: 0.9734, test_f1: 0.5737
 epoch: 62, train_loss: 0.7751, test_loss: 0.9969, test_f1: 0.6041
 epoch: 63, train_loss: 0.7668, test_loss: 0.9623, test_f1: 0.5866
 epoch: 64, train_loss: 0.7726, test_loss: 1.0029, test_f1: 0.6102
 epoch: 65, train_loss: 0.7680, test_loss: 0.9299, test_f1: 0.6159
 epoch: 66, train_loss: 0.7569, test_loss: 0.9395, test_f1: 0.5534
 epoch: 67, train_loss: 0.7563, test_loss: 1.0189, test_f1: 0.5552
 epoch: 68, train_loss: 0.7649, test_loss: 0.9669, test_f1: 0.5564
 epoch: 69, train_loss: 0.7564, test_loss: 0.9372, test_f1: 0.6146
 epoch: 70, train_loss: 0.7609, test_loss: 0.9716, test_f1: 0.6185
 epoch: 71, train_loss: 0.7676, test_loss: 0.9820, test_f1: 0.6100
 epoch: 72, train_loss: 0.7410, test_loss: 1.0036, test_f1: 0.5426
 epoch: 73, train_loss: 0.7500, test_loss: 1.0538, test_f1: 0.5179
 epoch: 74, train_loss: 0.7365, test_loss: 1.0359, test_f1: 0.5566
 epoch: 75, train_loss: 0.7498, test_loss: 0.9810, test_f1: 0.5819
 epoch: 76, train_loss: 0.7483, test_loss: 1.0417, test_f1: 0.5347
 epoch: 77, train_loss: 0.7479, test_loss: 1.0302, test_f1: 0.6024
 epoch: 78, train_loss: 0.7693, test_loss: 0.9512, test_f1: 0.6322
 epoch: 79, train_loss: 0.7429, test_loss: 0.9996, test_f1: 0.5984
 epoch: 80, train_loss: 0.7523, test_loss: 0.9950, test_f1: 0.5566
 epoch: 81, train_loss: 0.7432, test_loss: 1.0339, test_f1: 0.5940
 epoch: 82, train_loss: 0.7337, test_loss: 0.9826, test_f1: 0.6418
 epoch: 83, train_loss: 0.7439, test_loss: 0.9914, test_f1: 0.5487
 epoch: 84, train_loss: 0.7527, test_loss: 1.0508, test_f1: 0.5807
 epoch: 85, train_loss: 0.7377, test_loss: 1.0177, test_f1: 0.5299
 epoch: 86, train_loss: 0.7272, test_loss: 0.9683, test_f1: 0.6146
 epoch: 87, train_loss: 0.7225, test_loss: 0.9873, test_f1: 0.5894
 epoch: 88, train_loss: 0.7428, test_loss: 0.9629, test_f1: 0.5423
 epoch: 89, train_loss: 0.7355, test_loss: 0.9237, test_f1: 0.5577
 epoch: 90, train_loss: 0.7271, test_loss: 0.9314, test_f1: 0.6313
 epoch: 91, train_loss: 0.7278, test_loss: 1.0466, test_f1: 0.5225
 epoch: 92, train_loss: 0.7300, test_loss: 0.9818, test_f1: 0.6115
 epoch: 93, train_loss: 0.7271, test_loss: 0.9622, test_f1: 0.5880
 epoch: 94, train_loss: 0.7137, test_loss: 0.9926, test_f1: 0.5592
 epoch: 95, train_loss: 0.7343, test_loss: 1.0066, test_f1: 0.5736
 epoch: 96, train_loss: 0.7224, test_loss: 1.0734, test_f1: 0.6050
 epoch: 97, train_loss: 0.7343, test_loss: 1.0475, test_f1: 0.6100
 epoch: 98, train_loss: 0.7343, test_loss: 1.0532, test_f1: 0.6094
 epoch: 99, train_loss: 0.7256, test_loss: 0.9788, test_f1: 0.5838
##################ITERATION #6 ****************************************
 epoch: 0, train_loss: 1.1361, test_loss: 1.0510, test_f1: 0.4397
 epoch: 1, train_loss: 1.0394, test_loss: 1.0159, test_f1: 0.4641
 epoch: 2, train_loss: 1.0188, test_loss: 1.0393, test_f1: 0.4652
 epoch: 3, train_loss: 1.0193, test_loss: 1.0509, test_f1: 0.4752
 epoch: 4, train_loss: 0.9878, test_loss: 1.0157, test_f1: 0.4748
 epoch: 5, train_loss: 0.9874, test_loss: 0.9342, test_f1: 0.4847
 epoch: 6, train_loss: 0.9750, test_loss: 0.9878, test_f1: 0.5174
 epoch: 7, train_loss: 0.9855, test_loss: 1.1475, test_f1: 0.4490
 epoch: 8, train_loss: 0.9700, test_loss: 1.0012, test_f1: 0.4467
 epoch: 9, train_loss: 0.9615, test_loss: 1.0041, test_f1: 0.4549
 epoch: 10, train_loss: 0.9533, test_loss: 0.9495, test_f1: 0.4866
 epoch: 11, train_loss: 0.9470, test_loss: 1.0413, test_f1: 0.4455
 epoch: 12, train_loss: 0.9398, test_loss: 0.9928, test_f1: 0.5051
 epoch: 13, train_loss: 0.9635, test_loss: 0.9693, test_f1: 0.4894
 epoch: 14, train_loss: 0.9341, test_loss: 1.0091, test_f1: 0.5284
 epoch: 15, train_loss: 0.9320, test_loss: 0.9016, test_f1: 0.4885
 epoch: 16, train_loss: 0.9406, test_loss: 1.0016, test_f1: 0.4283
 epoch: 17, train_loss: 0.9462, test_loss: 1.0173, test_f1: 0.5116
 epoch: 18, train_loss: 0.9390, test_loss: 1.0241, test_f1: 0.4404
 epoch: 19, train_loss: 0.9306, test_loss: 0.8802, test_f1: 0.5111
 epoch: 20, train_loss: 0.9106, test_loss: 0.9465, test_f1: 0.5261
 epoch: 21, train_loss: 0.9086, test_loss: 0.9658, test_f1: 0.5328
 epoch: 22, train_loss: 0.9178, test_loss: 0.9775, test_f1: 0.5292
 epoch: 23, train_loss: 0.9124, test_loss: 0.9201, test_f1: 0.5054
 epoch: 24, train_loss: 0.9047, test_loss: 1.0209, test_f1: 0.4985
 epoch: 25, train_loss: 0.9287, test_loss: 0.9424, test_f1: 0.4953
 epoch: 26, train_loss: 0.9022, test_loss: 0.9558, test_f1: 0.4970
 epoch: 27, train_loss: 0.8953, test_loss: 0.9423, test_f1: 0.5543
 epoch: 28, train_loss: 0.8926, test_loss: 0.9258, test_f1: 0.5350
 epoch: 29, train_loss: 0.8918, test_loss: 0.9038, test_f1: 0.5226
 epoch: 30, train_loss: 0.8792, test_loss: 0.9307, test_f1: 0.5566
 epoch: 31, train_loss: 0.8955, test_loss: 0.9514, test_f1: 0.5411
 epoch: 32, train_loss: 0.8797, test_loss: 0.9196, test_f1: 0.5100
 epoch: 33, train_loss: 0.8874, test_loss: 0.8748, test_f1: 0.5523
 epoch: 34, train_loss: 0.8768, test_loss: 0.8499, test_f1: 0.5869
 epoch: 35, train_loss: 0.8732, test_loss: 0.9173, test_f1: 0.5209
 epoch: 36, train_loss: 0.8689, test_loss: 0.9020, test_f1: 0.5122
 epoch: 37, train_loss: 0.8701, test_loss: 0.8617, test_f1: 0.5399
 epoch: 38, train_loss: 0.8856, test_loss: 0.8582, test_f1: 0.5046
 epoch: 39, train_loss: 0.8763, test_loss: 0.8999, test_f1: 0.5480
 epoch: 40, train_loss: 0.8640, test_loss: 0.8144, test_f1: 0.5630
 epoch: 41, train_loss: 0.8704, test_loss: 0.8409, test_f1: 0.5427
 epoch: 42, train_loss: 0.8623, test_loss: 0.9258, test_f1: 0.5057
 epoch: 43, train_loss: 0.8682, test_loss: 0.9092, test_f1: 0.5270
 epoch: 44, train_loss: 0.8680, test_loss: 0.8551, test_f1: 0.5370
 epoch: 45, train_loss: 0.8614, test_loss: 0.8942, test_f1: 0.5561
 epoch: 46, train_loss: 0.8520, test_loss: 0.9186, test_f1: 0.5755
 epoch: 47, train_loss: 0.8580, test_loss: 0.9023, test_f1: 0.5205
 epoch: 48, train_loss: 0.8467, test_loss: 0.9310, test_f1: 0.5370
 epoch: 49, train_loss: 0.8726, test_loss: 0.9780, test_f1: 0.4809
 epoch: 50, train_loss: 0.8642, test_loss: 0.8668, test_f1: 0.5276
 epoch: 51, train_loss: 0.8441, test_loss: 0.8800, test_f1: 0.5940
 epoch: 52, train_loss: 0.8431, test_loss: 0.8809, test_f1: 0.5648
 epoch: 53, train_loss: 0.8304, test_loss: 0.8529, test_f1: 0.5697
 epoch: 54, train_loss: 0.8409, test_loss: 0.8834, test_f1: 0.5853
 epoch: 55, train_loss: 0.8326, test_loss: 0.8884, test_f1: 0.5762
 epoch: 56, train_loss: 0.8184, test_loss: 0.9108, test_f1: 0.5219
 epoch: 57, train_loss: 0.8254, test_loss: 0.8495, test_f1: 0.6254
 epoch: 58, train_loss: 0.8390, test_loss: 0.8291, test_f1: 0.5856
 epoch: 59, train_loss: 0.8143, test_loss: 0.8525, test_f1: 0.6117
 epoch: 60, train_loss: 0.8185, test_loss: 0.8582, test_f1: 0.5971
 epoch: 61, train_loss: 0.8277, test_loss: 0.9293, test_f1: 0.5156
 epoch: 62, train_loss: 0.8401, test_loss: 0.8698, test_f1: 0.6327
 epoch: 63, train_loss: 0.8177, test_loss: 0.8977, test_f1: 0.5589
 epoch: 64, train_loss: 0.8149, test_loss: 0.8243, test_f1: 0.5447
 epoch: 65, train_loss: 0.8039, test_loss: 0.8519, test_f1: 0.6011
 epoch: 66, train_loss: 0.8017, test_loss: 0.8660, test_f1: 0.5631
 epoch: 67, train_loss: 0.8160, test_loss: 0.8814, test_f1: 0.5584
 epoch: 68, train_loss: 0.8033, test_loss: 0.8888, test_f1: 0.5614
 epoch: 69, train_loss: 0.8164, test_loss: 0.8823, test_f1: 0.5722
 epoch: 70, train_loss: 0.7992, test_loss: 0.8796, test_f1: 0.5721
 epoch: 71, train_loss: 0.8064, test_loss: 0.8681, test_f1: 0.5639
 epoch: 72, train_loss: 0.7983, test_loss: 0.9854, test_f1: 0.5381
 epoch: 73, train_loss: 0.8125, test_loss: 0.8266, test_f1: 0.6177
 epoch: 74, train_loss: 0.8020, test_loss: 0.8471, test_f1: 0.5878
 epoch: 75, train_loss: 0.7960, test_loss: 0.8263, test_f1: 0.6161
 epoch: 76, train_loss: 0.7944, test_loss: 0.8270, test_f1: 0.5805
 epoch: 77, train_loss: 0.8022, test_loss: 0.8569, test_f1: 0.6313
 epoch: 78, train_loss: 0.7899, test_loss: 0.8526, test_f1: 0.5739
 epoch: 79, train_loss: 0.7869, test_loss: 0.8588, test_f1: 0.6200
 epoch: 80, train_loss: 0.7881, test_loss: 0.8607, test_f1: 0.6109
 epoch: 81, train_loss: 0.7918, test_loss: 0.8546, test_f1: 0.5835
 epoch: 82, train_loss: 0.7892, test_loss: 0.8888, test_f1: 0.5487
 epoch: 83, train_loss: 0.7735, test_loss: 0.8356, test_f1: 0.5705
 epoch: 84, train_loss: 0.7909, test_loss: 0.8996, test_f1: 0.5380
 epoch: 85, train_loss: 0.7864, test_loss: 0.8575, test_f1: 0.5647
 epoch: 86, train_loss: 0.7794, test_loss: 0.8669, test_f1: 0.5764
 epoch: 87, train_loss: 0.7843, test_loss: 0.8540, test_f1: 0.5848
 epoch: 88, train_loss: 0.7788, test_loss: 0.8280, test_f1: 0.5836
 epoch: 89, train_loss: 0.7803, test_loss: 0.8496, test_f1: 0.5487
 epoch: 90, train_loss: 0.7862, test_loss: 0.8658, test_f1: 0.5739
 epoch: 91, train_loss: 0.8006, test_loss: 0.8634, test_f1: 0.5787
 epoch: 92, train_loss: 0.7784, test_loss: 0.8646, test_f1: 0.5770
 epoch: 93, train_loss: 0.7839, test_loss: 0.8754, test_f1: 0.5671
 epoch: 94, train_loss: 0.7678, test_loss: 0.8826, test_f1: 0.5763
 epoch: 95, train_loss: 0.7784, test_loss: 0.9030, test_f1: 0.5970
 epoch: 96, train_loss: 0.7861, test_loss: 0.8516, test_f1: 0.5773
 epoch: 97, train_loss: 0.7764, test_loss: 0.8779, test_f1: 0.5756
 epoch: 98, train_loss: 0.7771, test_loss: 0.8601, test_f1: 0.5845
 epoch: 99, train_loss: 0.7705, test_loss: 0.8368, test_f1: 0.6045
##################ITERATION #7 ****************************************
 epoch: 0, train_loss: 1.1318, test_loss: 1.0804, test_f1: 0.4025
 epoch: 1, train_loss: 1.0456, test_loss: 1.0770, test_f1: 0.4905
 epoch: 2, train_loss: 1.0292, test_loss: 1.0833, test_f1: 0.4334
 epoch: 3, train_loss: 1.0107, test_loss: 1.0504, test_f1: 0.4507
 epoch: 4, train_loss: 1.0013, test_loss: 1.0347, test_f1: 0.4561
 epoch: 5, train_loss: 0.9817, test_loss: 1.0014, test_f1: 0.4896
 epoch: 6, train_loss: 0.9791, test_loss: 1.0008, test_f1: 0.4726
 epoch: 7, train_loss: 0.9642, test_loss: 0.9673, test_f1: 0.5194
 epoch: 8, train_loss: 0.9650, test_loss: 0.9951, test_f1: 0.5142
 epoch: 9, train_loss: 0.9608, test_loss: 0.9597, test_f1: 0.5050
 epoch: 10, train_loss: 0.9520, test_loss: 0.9559, test_f1: 0.5055
 epoch: 11, train_loss: 0.9409, test_loss: 1.0162, test_f1: 0.4705
 epoch: 12, train_loss: 0.9466, test_loss: 1.0638, test_f1: 0.4678
 epoch: 13, train_loss: 0.9545, test_loss: 0.9936, test_f1: 0.4905
 epoch: 14, train_loss: 0.9173, test_loss: 0.9559, test_f1: 0.4954
 epoch: 15, train_loss: 0.9249, test_loss: 0.9403, test_f1: 0.5336
 epoch: 16, train_loss: 0.9144, test_loss: 1.0235, test_f1: 0.5053
 epoch: 17, train_loss: 0.8997, test_loss: 0.9700, test_f1: 0.5031
 epoch: 18, train_loss: 0.9095, test_loss: 0.9240, test_f1: 0.5125
 epoch: 19, train_loss: 0.8905, test_loss: 0.9135, test_f1: 0.5216
 epoch: 20, train_loss: 0.9061, test_loss: 0.9102, test_f1: 0.5172
 epoch: 21, train_loss: 0.8810, test_loss: 0.9824, test_f1: 0.5004
 epoch: 22, train_loss: 0.8920, test_loss: 0.8923, test_f1: 0.5386
 epoch: 23, train_loss: 0.8761, test_loss: 0.9022, test_f1: 0.5220
 epoch: 24, train_loss: 0.8991, test_loss: 0.9929, test_f1: 0.4874
 epoch: 25, train_loss: 0.8736, test_loss: 0.9223, test_f1: 0.5016
 epoch: 26, train_loss: 0.8562, test_loss: 0.8902, test_f1: 0.5450
 epoch: 27, train_loss: 0.8950, test_loss: 0.9517, test_f1: 0.5111
 epoch: 28, train_loss: 0.8759, test_loss: 0.9020, test_f1: 0.5335
 epoch: 29, train_loss: 0.8736, test_loss: 0.8817, test_f1: 0.5422
 epoch: 30, train_loss: 0.8644, test_loss: 1.2239, test_f1: 0.4274
 epoch: 31, train_loss: 0.8734, test_loss: 0.9335, test_f1: 0.5137
 epoch: 32, train_loss: 0.8611, test_loss: 0.9123, test_f1: 0.5562
 epoch: 33, train_loss: 0.8709, test_loss: 0.9614, test_f1: 0.5117
 epoch: 34, train_loss: 0.8437, test_loss: 0.8851, test_f1: 0.5415
 epoch: 35, train_loss: 0.8733, test_loss: 0.9171, test_f1: 0.5068
 epoch: 36, train_loss: 0.8508, test_loss: 0.8748, test_f1: 0.5453
 epoch: 37, train_loss: 0.8554, test_loss: 0.8849, test_f1: 0.5484
 epoch: 38, train_loss: 0.8402, test_loss: 0.9858, test_f1: 0.5192
 epoch: 39, train_loss: 0.8398, test_loss: 0.9365, test_f1: 0.5083
 epoch: 40, train_loss: 0.8418, test_loss: 0.8852, test_f1: 0.5267
 epoch: 41, train_loss: 0.8363, test_loss: 0.8497, test_f1: 0.5539
 epoch: 42, train_loss: 0.8363, test_loss: 0.8850, test_f1: 0.5811
 epoch: 43, train_loss: 0.8583, test_loss: 0.8729, test_f1: 0.5499
 epoch: 44, train_loss: 0.8189, test_loss: 0.8877, test_f1: 0.5547
 epoch: 45, train_loss: 0.8563, test_loss: 0.8425, test_f1: 0.5879
 epoch: 46, train_loss: 0.8503, test_loss: 0.9163, test_f1: 0.5532
 epoch: 47, train_loss: 0.8338, test_loss: 0.8794, test_f1: 0.5374
 epoch: 48, train_loss: 0.8139, test_loss: 0.8888, test_f1: 0.5198
 epoch: 49, train_loss: 0.8272, test_loss: 0.8778, test_f1: 0.5467
 epoch: 50, train_loss: 0.8173, test_loss: 0.8688, test_f1: 0.5412
 epoch: 51, train_loss: 0.8120, test_loss: 0.8373, test_f1: 0.5754
 epoch: 52, train_loss: 0.7989, test_loss: 0.8413, test_f1: 0.5860
 epoch: 53, train_loss: 0.7928, test_loss: 0.8779, test_f1: 0.5394
 epoch: 54, train_loss: 0.7895, test_loss: 0.8433, test_f1: 0.5850
 epoch: 55, train_loss: 0.7794, test_loss: 0.8311, test_f1: 0.5790
 epoch: 56, train_loss: 0.7763, test_loss: 0.8529, test_f1: 0.5885
 epoch: 57, train_loss: 0.7851, test_loss: 0.8181, test_f1: 0.5961
 epoch: 58, train_loss: 0.7940, test_loss: 0.8631, test_f1: 0.5806
 epoch: 59, train_loss: 0.7803, test_loss: 0.8610, test_f1: 0.5879
 epoch: 60, train_loss: 0.7784, test_loss: 0.8200, test_f1: 0.5604
 epoch: 61, train_loss: 0.7828, test_loss: 0.8462, test_f1: 0.5624
 epoch: 62, train_loss: 0.7805, test_loss: 0.8341, test_f1: 0.5748
 epoch: 63, train_loss: 0.7762, test_loss: 0.8582, test_f1: 0.5779
 epoch: 64, train_loss: 0.7736, test_loss: 0.8383, test_f1: 0.6007
 epoch: 65, train_loss: 0.7819, test_loss: 0.8472, test_f1: 0.5849
 epoch: 66, train_loss: 0.7763, test_loss: 0.8764, test_f1: 0.5915
 epoch: 67, train_loss: 0.7745, test_loss: 0.8559, test_f1: 0.6089
 epoch: 68, train_loss: 0.7649, test_loss: 0.8292, test_f1: 0.5689
 epoch: 69, train_loss: 0.7647, test_loss: 0.8588, test_f1: 0.5589
 epoch: 70, train_loss: 0.7758, test_loss: 0.8426, test_f1: 0.5625
 epoch: 71, train_loss: 0.7687, test_loss: 0.8811, test_f1: 0.5472
 epoch: 72, train_loss: 0.7691, test_loss: 0.8576, test_f1: 0.5739
 epoch: 73, train_loss: 0.7567, test_loss: 0.8545, test_f1: 0.5974
 epoch: 74, train_loss: 0.7537, test_loss: 0.8701, test_f1: 0.5672
 epoch: 75, train_loss: 0.7635, test_loss: 0.8106, test_f1: 0.6058
 epoch: 76, train_loss: 0.7911, test_loss: 0.8700, test_f1: 0.5703
 epoch: 77, train_loss: 0.7587, test_loss: 0.8340, test_f1: 0.6183
 epoch: 78, train_loss: 0.7509, test_loss: 0.8593, test_f1: 0.5836
 epoch: 79, train_loss: 0.7564, test_loss: 0.8494, test_f1: 0.5821
 epoch: 80, train_loss: 0.7487, test_loss: 0.8343, test_f1: 0.5817
 epoch: 81, train_loss: 0.7549, test_loss: 0.8463, test_f1: 0.5912
 epoch: 82, train_loss: 0.7586, test_loss: 0.8877, test_f1: 0.5456
 epoch: 83, train_loss: 0.7651, test_loss: 0.8119, test_f1: 0.6095
 epoch: 84, train_loss: 0.7642, test_loss: 0.8625, test_f1: 0.5479
 epoch: 85, train_loss: 0.7508, test_loss: 0.8447, test_f1: 0.5963
 epoch: 86, train_loss: 0.7582, test_loss: 0.8271, test_f1: 0.5717
 epoch: 87, train_loss: 0.7419, test_loss: 0.8331, test_f1: 0.5699
 epoch: 88, train_loss: 0.7571, test_loss: 0.8332, test_f1: 0.5745
 epoch: 89, train_loss: 0.7628, test_loss: 0.8212, test_f1: 0.5807
 epoch: 90, train_loss: 0.7501, test_loss: 0.8398, test_f1: 0.5624
 epoch: 91, train_loss: 0.7395, test_loss: 0.8377, test_f1: 0.5762
 epoch: 92, train_loss: 0.7365, test_loss: 0.8119, test_f1: 0.6309
 epoch: 93, train_loss: 0.7479, test_loss: 0.8377, test_f1: 0.5832
 epoch: 94, train_loss: 0.7420, test_loss: 0.8307, test_f1: 0.5599
 epoch: 95, train_loss: 0.7710, test_loss: 0.7985, test_f1: 0.5844
 epoch: 96, train_loss: 0.7443, test_loss: 0.8378, test_f1: 0.5730
 epoch: 97, train_loss: 0.7553, test_loss: 0.8402, test_f1: 0.5599
 epoch: 98, train_loss: 0.7435, test_loss: 0.8028, test_f1: 0.5877
 epoch: 99, train_loss: 0.7464, test_loss: 0.8446, test_f1: 0.5576
##################ITERATION #8 ****************************************
 epoch: 0, train_loss: 1.1091, test_loss: 1.0804, test_f1: 0.4118
 epoch: 1, train_loss: 1.0077, test_loss: 0.9795, test_f1: 0.4375
 epoch: 2, train_loss: 1.0002, test_loss: 1.0406, test_f1: 0.4590
 epoch: 3, train_loss: 0.9807, test_loss: 0.9394, test_f1: 0.4962
 epoch: 4, train_loss: 0.9634, test_loss: 1.0480, test_f1: 0.4285
 epoch: 5, train_loss: 0.9589, test_loss: 0.9362, test_f1: 0.4708
 epoch: 6, train_loss: 0.9462, test_loss: 0.9586, test_f1: 0.4911
 epoch: 7, train_loss: 0.9415, test_loss: 0.9565, test_f1: 0.4825
 epoch: 8, train_loss: 0.9348, test_loss: 0.9212, test_f1: 0.5005
 epoch: 9, train_loss: 0.9417, test_loss: 0.9644, test_f1: 0.4875
 epoch: 10, train_loss: 0.9318, test_loss: 0.9391, test_f1: 0.5069
 epoch: 11, train_loss: 0.9125, test_loss: 0.9276, test_f1: 0.5211
 epoch: 12, train_loss: 0.9234, test_loss: 0.9298, test_f1: 0.5284
 epoch: 13, train_loss: 0.9066, test_loss: 0.9597, test_f1: 0.4896
 epoch: 14, train_loss: 0.9241, test_loss: 0.9633, test_f1: 0.4996
 epoch: 15, train_loss: 0.9123, test_loss: 0.9234, test_f1: 0.5267
 epoch: 16, train_loss: 0.8996, test_loss: 0.9021, test_f1: 0.5277
 epoch: 17, train_loss: 0.9066, test_loss: 0.9459, test_f1: 0.5295
 epoch: 18, train_loss: 0.9060, test_loss: 0.9026, test_f1: 0.4970
 epoch: 19, train_loss: 0.8945, test_loss: 0.9191, test_f1: 0.4938
 epoch: 20, train_loss: 0.8939, test_loss: 0.9034, test_f1: 0.5489
 epoch: 21, train_loss: 0.8760, test_loss: 0.8915, test_f1: 0.5531
 epoch: 22, train_loss: 0.8935, test_loss: 0.9560, test_f1: 0.5033
 epoch: 23, train_loss: 0.8864, test_loss: 0.8710, test_f1: 0.5330
 epoch: 24, train_loss: 0.8961, test_loss: 0.8577, test_f1: 0.5261
 epoch: 25, train_loss: 0.8851, test_loss: 0.9051, test_f1: 0.5650
 epoch: 26, train_loss: 0.8807, test_loss: 0.8847, test_f1: 0.5470
 epoch: 27, train_loss: 0.8607, test_loss: 0.8525, test_f1: 0.5636
 epoch: 28, train_loss: 0.8573, test_loss: 0.8994, test_f1: 0.5732
 epoch: 29, train_loss: 0.8510, test_loss: 0.8973, test_f1: 0.5202
 epoch: 30, train_loss: 0.8503, test_loss: 0.8636, test_f1: 0.5608
 epoch: 31, train_loss: 0.8559, test_loss: 0.8554, test_f1: 0.5561
 epoch: 32, train_loss: 0.8462, test_loss: 0.8350, test_f1: 0.5736
 epoch: 33, train_loss: 0.8498, test_loss: 0.8855, test_f1: 0.5661
 epoch: 34, train_loss: 0.8362, test_loss: 0.8836, test_f1: 0.5821
 epoch: 35, train_loss: 0.8399, test_loss: 0.8741, test_f1: 0.5486
 epoch: 36, train_loss: 0.8506, test_loss: 0.9029, test_f1: 0.5569
 epoch: 37, train_loss: 0.8265, test_loss: 0.9113, test_f1: 0.5760
 epoch: 38, train_loss: 0.8452, test_loss: 0.8552, test_f1: 0.6201
 epoch: 39, train_loss: 0.8403, test_loss: 0.8632, test_f1: 0.5431
 epoch: 40, train_loss: 0.8268, test_loss: 0.8563, test_f1: 0.5422
 epoch: 41, train_loss: 0.8356, test_loss: 0.8477, test_f1: 0.5812
 epoch: 42, train_loss: 0.8166, test_loss: 0.8771, test_f1: 0.5727
 epoch: 43, train_loss: 0.8191, test_loss: 0.8976, test_f1: 0.5877
 epoch: 44, train_loss: 0.8341, test_loss: 0.8695, test_f1: 0.5378
 epoch: 45, train_loss: 0.8335, test_loss: 0.8565, test_f1: 0.6181
 epoch: 46, train_loss: 0.8150, test_loss: 0.8461, test_f1: 0.5947
 epoch: 47, train_loss: 0.8040, test_loss: 0.8664, test_f1: 0.5474
 epoch: 48, train_loss: 0.8200, test_loss: 0.8831, test_f1: 0.5319
 epoch: 49, train_loss: 0.8197, test_loss: 0.8677, test_f1: 0.5795
 epoch: 50, train_loss: 0.8295, test_loss: 0.8824, test_f1: 0.5624
 epoch: 51, train_loss: 0.7933, test_loss: 0.8548, test_f1: 0.5843
 epoch: 52, train_loss: 0.7892, test_loss: 0.8255, test_f1: 0.5809
 epoch: 53, train_loss: 0.7688, test_loss: 0.8497, test_f1: 0.6080
 epoch: 54, train_loss: 0.7840, test_loss: 0.8444, test_f1: 0.6027
 epoch: 55, train_loss: 0.7724, test_loss: 0.8484, test_f1: 0.6015
 epoch: 56, train_loss: 0.7809, test_loss: 0.8442, test_f1: 0.6105
 epoch: 57, train_loss: 0.7719, test_loss: 0.8377, test_f1: 0.5701
 epoch: 58, train_loss: 0.7736, test_loss: 0.8567, test_f1: 0.6054
 epoch: 59, train_loss: 0.7882, test_loss: 0.8566, test_f1: 0.6172
 epoch: 60, train_loss: 0.7737, test_loss: 0.8630, test_f1: 0.5915
 epoch: 61, train_loss: 0.7835, test_loss: 0.8494, test_f1: 0.5928
 epoch: 62, train_loss: 0.7667, test_loss: 0.8236, test_f1: 0.6046
 epoch: 63, train_loss: 0.7885, test_loss: 0.8495, test_f1: 0.5578
 epoch: 64, train_loss: 0.7690, test_loss: 0.8407, test_f1: 0.6055
 epoch: 65, train_loss: 0.7656, test_loss: 0.8337, test_f1: 0.5766
 epoch: 66, train_loss: 0.7605, test_loss: 0.8225, test_f1: 0.5909
 epoch: 67, train_loss: 0.7713, test_loss: 0.8504, test_f1: 0.5657
 epoch: 68, train_loss: 0.7680, test_loss: 0.8488, test_f1: 0.5836
 epoch: 69, train_loss: 0.7785, test_loss: 0.8574, test_f1: 0.5986
 epoch: 70, train_loss: 0.7777, test_loss: 0.8789, test_f1: 0.5815
 epoch: 71, train_loss: 0.7514, test_loss: 0.8418, test_f1: 0.5917
 epoch: 72, train_loss: 0.7541, test_loss: 0.8444, test_f1: 0.6049
 epoch: 73, train_loss: 0.7729, test_loss: 0.8541, test_f1: 0.5729
 epoch: 74, train_loss: 0.7495, test_loss: 0.8118, test_f1: 0.6053
 epoch: 75, train_loss: 0.7599, test_loss: 0.8565, test_f1: 0.5971
 epoch: 76, train_loss: 0.7657, test_loss: 0.9116, test_f1: 0.5511
 epoch: 77, train_loss: 0.7642, test_loss: 0.8612, test_f1: 0.5569
 epoch: 78, train_loss: 0.7603, test_loss: 0.8550, test_f1: 0.5811
 epoch: 79, train_loss: 0.7677, test_loss: 0.8586, test_f1: 0.5747
 epoch: 80, train_loss: 0.7562, test_loss: 0.8573, test_f1: 0.6054
 epoch: 81, train_loss: 0.7743, test_loss: 0.8409, test_f1: 0.5875
 epoch: 82, train_loss: 0.7696, test_loss: 0.8366, test_f1: 0.5679
 epoch: 83, train_loss: 0.7617, test_loss: 0.8633, test_f1: 0.5661
 epoch: 84, train_loss: 0.7575, test_loss: 0.8394, test_f1: 0.6110
 epoch: 85, train_loss: 0.7534, test_loss: 0.8392, test_f1: 0.5918
 epoch: 86, train_loss: 0.7584, test_loss: 0.8363, test_f1: 0.5789
 epoch: 87, train_loss: 0.7520, test_loss: 0.8081, test_f1: 0.5767
 epoch: 88, train_loss: 0.7427, test_loss: 0.8270, test_f1: 0.5899
 epoch: 89, train_loss: 0.7545, test_loss: 0.8435, test_f1: 0.5788
 epoch: 90, train_loss: 0.7596, test_loss: 0.8403, test_f1: 0.5899
 epoch: 91, train_loss: 0.7471, test_loss: 0.8150, test_f1: 0.5998
 epoch: 92, train_loss: 0.7472, test_loss: 0.8439, test_f1: 0.5768
 epoch: 93, train_loss: 0.7608, test_loss: 0.8251, test_f1: 0.6188
 epoch: 94, train_loss: 0.7546, test_loss: 0.8488, test_f1: 0.6073
 epoch: 95, train_loss: 0.7579, test_loss: 0.8310, test_f1: 0.5907
 epoch: 96, train_loss: 0.7513, test_loss: 0.8436, test_f1: 0.5715
 epoch: 97, train_loss: 0.7532, test_loss: 0.8454, test_f1: 0.5725
 epoch: 98, train_loss: 0.7677, test_loss: 0.7914, test_f1: 0.5955
 epoch: 99, train_loss: 0.7556, test_loss: 0.8277, test_f1: 0.5894
##################ITERATION #9 ****************************************
 epoch: 0, train_loss: 1.1264, test_loss: 1.1258, test_f1: 0.4357
 epoch: 1, train_loss: 1.0362, test_loss: 1.0423, test_f1: 0.4374
 epoch: 2, train_loss: 1.0165, test_loss: 1.0159, test_f1: 0.4972
 epoch: 3, train_loss: 1.0037, test_loss: 1.0412, test_f1: 0.4697
 epoch: 4, train_loss: 0.9974, test_loss: 1.0509, test_f1: 0.4640
 epoch: 5, train_loss: 0.9941, test_loss: 1.0468, test_f1: 0.4723
 epoch: 6, train_loss: 0.9872, test_loss: 1.1520, test_f1: 0.3687
 epoch: 7, train_loss: 0.9618, test_loss: 1.0128, test_f1: 0.5122
 epoch: 8, train_loss: 0.9651, test_loss: 0.9933, test_f1: 0.4762
 epoch: 9, train_loss: 0.9680, test_loss: 0.9743, test_f1: 0.4841
 epoch: 10, train_loss: 0.9504, test_loss: 1.0223, test_f1: 0.4855
 epoch: 11, train_loss: 0.9384, test_loss: 1.1386, test_f1: 0.3893
 epoch: 12, train_loss: 0.9474, test_loss: 0.9902, test_f1: 0.4960
 epoch: 13, train_loss: 0.9219, test_loss: 0.9646, test_f1: 0.4915
 epoch: 14, train_loss: 0.9350, test_loss: 0.9800, test_f1: 0.5154
 epoch: 15, train_loss: 0.9238, test_loss: 0.9628, test_f1: 0.5020
 epoch: 16, train_loss: 0.9319, test_loss: 0.9729, test_f1: 0.5054
 epoch: 17, train_loss: 0.9162, test_loss: 0.9511, test_f1: 0.5165
 epoch: 18, train_loss: 0.9107, test_loss: 0.8917, test_f1: 0.5099
 epoch: 19, train_loss: 0.9062, test_loss: 1.0027, test_f1: 0.4383
 epoch: 20, train_loss: 0.9066, test_loss: 0.9054, test_f1: 0.5539
 epoch: 21, train_loss: 0.9120, test_loss: 0.9882, test_f1: 0.4938
 epoch: 22, train_loss: 0.9047, test_loss: 0.9605, test_f1: 0.5429
 epoch: 23, train_loss: 0.9047, test_loss: 0.9049, test_f1: 0.5668
 epoch: 24, train_loss: 0.9004, test_loss: 0.9014, test_f1: 0.5399
 epoch: 25, train_loss: 0.8954, test_loss: 0.9131, test_f1: 0.5173
 epoch: 26, train_loss: 0.8917, test_loss: 0.9244, test_f1: 0.5185
 epoch: 27, train_loss: 0.9059, test_loss: 0.8825, test_f1: 0.5264
 epoch: 28, train_loss: 0.9004, test_loss: 0.8540, test_f1: 0.5733
 epoch: 29, train_loss: 0.8948, test_loss: 0.9016, test_f1: 0.5100
 epoch: 30, train_loss: 0.8837, test_loss: 0.9141, test_f1: 0.4894
 epoch: 31, train_loss: 0.8827, test_loss: 0.8726, test_f1: 0.5380
 epoch: 32, train_loss: 0.8906, test_loss: 0.8605, test_f1: 0.5591
 epoch: 33, train_loss: 0.8670, test_loss: 0.8719, test_f1: 0.5331
 epoch: 34, train_loss: 0.8824, test_loss: 0.9042, test_f1: 0.5653
 epoch: 35, train_loss: 0.8769, test_loss: 0.8674, test_f1: 0.5623
 epoch: 36, train_loss: 0.8821, test_loss: 0.8565, test_f1: 0.5785
 epoch: 37, train_loss: 0.8659, test_loss: 0.9068, test_f1: 0.5244
 epoch: 38, train_loss: 0.8713, test_loss: 0.9029, test_f1: 0.5162
 epoch: 39, train_loss: 0.8752, test_loss: 0.9001, test_f1: 0.5115
 epoch: 40, train_loss: 0.8785, test_loss: 0.8385, test_f1: 0.5882
 epoch: 41, train_loss: 0.8577, test_loss: 0.8063, test_f1: 0.5528
 epoch: 42, train_loss: 0.8753, test_loss: 0.8482, test_f1: 0.5444
 epoch: 43, train_loss: 0.8662, test_loss: 0.8657, test_f1: 0.5341
 epoch: 44, train_loss: 0.8500, test_loss: 0.8197, test_f1: 0.6234
 epoch: 45, train_loss: 0.8499, test_loss: 0.8118, test_f1: 0.5343
 epoch: 46, train_loss: 0.8488, test_loss: 0.8257, test_f1: 0.5772
 epoch: 47, train_loss: 0.8543, test_loss: 0.8913, test_f1: 0.5197
 epoch: 48, train_loss: 0.8660, test_loss: 0.8418, test_f1: 0.5295
 epoch: 49, train_loss: 0.8599, test_loss: 0.8484, test_f1: 0.5709
 epoch: 50, train_loss: 0.8613, test_loss: 0.8608, test_f1: 0.5838
 epoch: 51, train_loss: 0.8427, test_loss: 0.8562, test_f1: 0.5546
 epoch: 52, train_loss: 0.8291, test_loss: 0.8531, test_f1: 0.5487
 epoch: 53, train_loss: 0.8251, test_loss: 0.8446, test_f1: 0.5915
 epoch: 54, train_loss: 0.8173, test_loss: 0.8170, test_f1: 0.6054
 epoch: 55, train_loss: 0.8214, test_loss: 0.8181, test_f1: 0.5833
 epoch: 56, train_loss: 0.8193, test_loss: 0.8726, test_f1: 0.5652
 epoch: 57, train_loss: 0.8066, test_loss: 0.7855, test_f1: 0.5821
 epoch: 58, train_loss: 0.8173, test_loss: 0.8429, test_f1: 0.5376
 epoch: 59, train_loss: 0.8077, test_loss: 0.8381, test_f1: 0.5834
 epoch: 60, train_loss: 0.8049, test_loss: 0.8647, test_f1: 0.5419
 epoch: 61, train_loss: 0.8113, test_loss: 0.8570, test_f1: 0.5700
 epoch: 62, train_loss: 0.7947, test_loss: 0.7811, test_f1: 0.5863
 epoch: 63, train_loss: 0.8084, test_loss: 0.8109, test_f1: 0.5433
 epoch: 64, train_loss: 0.8210, test_loss: 0.8076, test_f1: 0.5640
 epoch: 65, train_loss: 0.8100, test_loss: 0.8068, test_f1: 0.5814
 epoch: 66, train_loss: 0.7996, test_loss: 0.7937, test_f1: 0.5678
 epoch: 67, train_loss: 0.7997, test_loss: 0.8543, test_f1: 0.5603
 epoch: 68, train_loss: 0.8094, test_loss: 0.7747, test_f1: 0.6175
 epoch: 69, train_loss: 0.7843, test_loss: 0.7621, test_f1: 0.5833
 epoch: 70, train_loss: 0.7941, test_loss: 0.8448, test_f1: 0.5712
 epoch: 71, train_loss: 0.7839, test_loss: 0.7933, test_f1: 0.5963
 epoch: 72, train_loss: 0.7994, test_loss: 0.7797, test_f1: 0.5875
 epoch: 73, train_loss: 0.8006, test_loss: 0.7904, test_f1: 0.5935
 epoch: 74, train_loss: 0.7910, test_loss: 0.7982, test_f1: 0.5689
 epoch: 75, train_loss: 0.8010, test_loss: 0.8366, test_f1: 0.5281
 epoch: 76, train_loss: 0.7877, test_loss: 0.7869, test_f1: 0.5901
 epoch: 77, train_loss: 0.7906, test_loss: 0.7820, test_f1: 0.6211
 epoch: 78, train_loss: 0.7918, test_loss: 0.7571, test_f1: 0.5913
 epoch: 79, train_loss: 0.7754, test_loss: 0.7625, test_f1: 0.6233
 epoch: 80, train_loss: 0.7874, test_loss: 0.7816, test_f1: 0.5751
 epoch: 81, train_loss: 0.7856, test_loss: 0.7603, test_f1: 0.5907
 epoch: 82, train_loss: 0.7981, test_loss: 0.8128, test_f1: 0.5941
 epoch: 83, train_loss: 0.7926, test_loss: 0.7767, test_f1: 0.6040
 epoch: 84, train_loss: 0.7789, test_loss: 0.8249, test_f1: 0.5806
 epoch: 85, train_loss: 0.7811, test_loss: 0.7851, test_f1: 0.6304
 epoch: 86, train_loss: 0.7866, test_loss: 0.7976, test_f1: 0.5908
 epoch: 87, train_loss: 0.7833, test_loss: 0.7823, test_f1: 0.6125
 epoch: 88, train_loss: 0.7862, test_loss: 0.7975, test_f1: 0.6065
 epoch: 89, train_loss: 0.7819, test_loss: 0.8060, test_f1: 0.5971
 epoch: 90, train_loss: 0.7881, test_loss: 0.7816, test_f1: 0.5989
 epoch: 91, train_loss: 0.7707, test_loss: 0.7494, test_f1: 0.6377
 epoch: 92, train_loss: 0.7685, test_loss: 0.7457, test_f1: 0.5972
 epoch: 93, train_loss: 0.7714, test_loss: 0.7699, test_f1: 0.6145
 epoch: 94, train_loss: 0.7736, test_loss: 0.7604, test_f1: 0.6203
 epoch: 95, train_loss: 0.7673, test_loss: 0.7557, test_f1: 0.6101
 epoch: 96, train_loss: 0.7709, test_loss: 0.7633, test_f1: 0.6169
 epoch: 97, train_loss: 0.7775, test_loss: 0.8232, test_f1: 0.5675
 epoch: 98, train_loss: 0.7569, test_loss: 0.7476, test_f1: 0.6314
 epoch: 99, train_loss: 0.7664, test_loss: 0.7924, test_f1: 0.5918

Training completed in 1108.26 seconds
Best F1: 0.6462 at epoch 76
Mean F1 across iterations: 0.6337  0.0105
========================FINAL RESULTS================================
FEGIN weighted F1: 0.6462  0.0105
python main.py --data ltspice_examples --representation component_pin_net --model FEGIN --layers 4 --hiddens 16 --batch_size 32 --lr 0.01 --emb_size 250 --epochs 100 --save_appendix component_pin_net_L4_H16_BS32_LR0.01_E250 --no_val
-----



STDERR:
  File "main.py", line 370, in <module>
    main()
  File "main.py", line 254, in main
    dataset = dataset_class(
  File "/home/philip/projects/ltspice_examples_code_repo/Circuit-Completion-Using-GNNs/component_classification_with_link_prediction_head/evaluation/FEGIN/kernel/circuit_datasets.py", line 15, in __init__
    self.data, self.slices = torch.load(self.processed_paths[0])
  File "/home/philip/.local/lib/python3.8/site-packages/torch/serialization.py", line 1040, in load
    warnings.warn(
  File "/usr/lib/python3.8/warnings.py", line 109, in _showwarnmsg
    sw(msg.message, msg.category, msg.filename, msg.lineno,
  File "main.py", line 47, in warn_with_traceback
    traceback.print_stack(file=log)
/home/philip/projects/ltspice_examples_code_repo/Circuit-Completion-Using-GNNs/component_classification_with_link_prediction_head/evaluation/FEGIN/kernel/circuit_datasets.py:15: FutureWarning: You are using `torch.load` with `weights_only=False` (the current default value), which uses the default pickle module implicitly. It is possible to construct malicious pickle data which will execute arbitrary code during unpickling (See https://github.com/pytorch/pytorch/blob/main/SECURITY.md#untrusted-models for more details). In a future release, the default value for `weights_only` will be flipped to `True`. This limits the functions that could be executed during unpickling. Arbitrary objects will no longer be allowed to be loaded via this mode unless they are explicitly allowlisted by the user via `torch.serialization.add_safe_globals`. We recommend you start setting `weights_only=True` for any use case where you don't have full control of the loaded file. Please open an issue on GitHub for any issues related to this experimental feature.
  self.data, self.slices = torch.load(self.processed_paths[0])
