STDOUT:
Results will be saved in /home/philip/projects/llm_inference_code_repo/Circuit-Completion-Using-GNNs/component_classification_with_link_prediction_head/evaluation/FEGIN/results/model_FEGIN_dataset_ltspice_examples
Command line input: python main.py --data ltspice_examples --representation component_net --model FEGIN --layers 5 --hiddens 64 --batch_size 64 --lr 0.001 --emb_size 512 --epochs 100 --save_appendix component_net_L5_H64_BS64_LR0.001_E512 --no_val
 is saved.
-----
ltspice_examples - FEGIN
Using 5 layers, 64 hidden units, h = 2
Loading component_net representation dataset
ENTERED
Training FEGIN on component_net representation
Train: 3558, Test: 846
##################ITERATION #0 ****************************************
 epoch: 0, train_loss: 1.2618, test_loss: 1.1635, test_f1: 0.2984
 epoch: 1, train_loss: 1.1170, test_loss: 1.0264, test_f1: 0.5291
 epoch: 2, train_loss: 1.0116, test_loss: 0.9728, test_f1: 0.4938
 epoch: 3, train_loss: 0.9647, test_loss: 0.9865, test_f1: 0.4895
 epoch: 4, train_loss: 0.9321, test_loss: 0.9507, test_f1: 0.5212
 epoch: 5, train_loss: 0.9169, test_loss: 0.9045, test_f1: 0.5312
 epoch: 6, train_loss: 0.9089, test_loss: 0.9479, test_f1: 0.5559
 epoch: 7, train_loss: 0.8991, test_loss: 0.8940, test_f1: 0.5572
 epoch: 8, train_loss: 0.8729, test_loss: 0.8888, test_f1: 0.5290
 epoch: 9, train_loss: 0.8620, test_loss: 0.9208, test_f1: 0.5693
 epoch: 10, train_loss: 0.8495, test_loss: 0.9123, test_f1: 0.5899
 epoch: 11, train_loss: 0.8305, test_loss: 0.9599, test_f1: 0.5564
 epoch: 12, train_loss: 0.8147, test_loss: 0.9760, test_f1: 0.5899
 epoch: 13, train_loss: 0.8231, test_loss: 0.9449, test_f1: 0.5831
 epoch: 14, train_loss: 0.8197, test_loss: 0.8892, test_f1: 0.5796
 epoch: 15, train_loss: 0.8074, test_loss: 0.9043, test_f1: 0.6109
 epoch: 16, train_loss: 0.7903, test_loss: 0.9014, test_f1: 0.6132
 epoch: 17, train_loss: 0.7771, test_loss: 0.8783, test_f1: 0.6106
 epoch: 18, train_loss: 0.7681, test_loss: 0.8980, test_f1: 0.6239
 epoch: 19, train_loss: 0.7613, test_loss: 0.9087, test_f1: 0.5971
 epoch: 20, train_loss: 0.7496, test_loss: 0.8867, test_f1: 0.6170
 epoch: 21, train_loss: 0.7368, test_loss: 0.8886, test_f1: 0.5995
 epoch: 22, train_loss: 0.7403, test_loss: 0.9548, test_f1: 0.5910
 epoch: 23, train_loss: 0.7393, test_loss: 0.9051, test_f1: 0.5722
 epoch: 24, train_loss: 0.7081, test_loss: 0.9473, test_f1: 0.6198
 epoch: 25, train_loss: 0.7153, test_loss: 1.0528, test_f1: 0.5820
 epoch: 26, train_loss: 0.7094, test_loss: 0.8847, test_f1: 0.6263
 epoch: 27, train_loss: 0.7094, test_loss: 0.8561, test_f1: 0.5968
 epoch: 28, train_loss: 0.6874, test_loss: 0.9057, test_f1: 0.6229
 epoch: 29, train_loss: 0.6971, test_loss: 0.9368, test_f1: 0.6267
 epoch: 30, train_loss: 0.6782, test_loss: 0.8581, test_f1: 0.6438
 epoch: 31, train_loss: 0.6786, test_loss: 0.9304, test_f1: 0.5888
 epoch: 32, train_loss: 0.6646, test_loss: 1.0062, test_f1: 0.5960
 epoch: 33, train_loss: 0.6747, test_loss: 0.9879, test_f1: 0.5797
 epoch: 34, train_loss: 0.6651, test_loss: 0.8936, test_f1: 0.6382
 epoch: 35, train_loss: 0.6593, test_loss: 1.0442, test_f1: 0.5600
 epoch: 36, train_loss: 0.6351, test_loss: 0.9382, test_f1: 0.6346
 epoch: 37, train_loss: 0.6128, test_loss: 0.9421, test_f1: 0.5867
 epoch: 38, train_loss: 0.6252, test_loss: 1.0151, test_f1: 0.6040
 epoch: 39, train_loss: 0.6261, test_loss: 1.0186, test_f1: 0.6104
 epoch: 40, train_loss: 0.6027, test_loss: 1.0844, test_f1: 0.6210
 epoch: 41, train_loss: 0.6138, test_loss: 0.9636, test_f1: 0.6152
 epoch: 42, train_loss: 0.5863, test_loss: 0.9538, test_f1: 0.6379
 epoch: 43, train_loss: 0.5728, test_loss: 1.1570, test_f1: 0.5732
 epoch: 44, train_loss: 0.5900, test_loss: 1.0286, test_f1: 0.5887
 epoch: 45, train_loss: 0.5612, test_loss: 0.9758, test_f1: 0.6323
 epoch: 46, train_loss: 0.5745, test_loss: 1.0949, test_f1: 0.5737
 epoch: 47, train_loss: 0.5761, test_loss: 0.9955, test_f1: 0.6228
 epoch: 48, train_loss: 0.5676, test_loss: 1.0350, test_f1: 0.6186
 epoch: 49, train_loss: 0.5463, test_loss: 1.1002, test_f1: 0.6209
 epoch: 50, train_loss: 0.5437, test_loss: 1.1204, test_f1: 0.6068
 epoch: 51, train_loss: 0.5088, test_loss: 1.0414, test_f1: 0.6468
 epoch: 52, train_loss: 0.4710, test_loss: 1.1329, test_f1: 0.6134
 epoch: 53, train_loss: 0.4725, test_loss: 1.0897, test_f1: 0.6455
 epoch: 54, train_loss: 0.4683, test_loss: 1.1766, test_f1: 0.6023
 epoch: 55, train_loss: 0.4684, test_loss: 1.0561, test_f1: 0.6465
 epoch: 56, train_loss: 0.4512, test_loss: 1.2910, test_f1: 0.5891
 epoch: 57, train_loss: 0.4606, test_loss: 1.1715, test_f1: 0.6426
 epoch: 58, train_loss: 0.4503, test_loss: 1.1406, test_f1: 0.6280
 epoch: 59, train_loss: 0.4438, test_loss: 1.1323, test_f1: 0.6344
 epoch: 60, train_loss: 0.4383, test_loss: 1.1709, test_f1: 0.6472
 epoch: 61, train_loss: 0.4288, test_loss: 1.1611, test_f1: 0.6600
 epoch: 62, train_loss: 0.4028, test_loss: 1.3015, test_f1: 0.6222
 epoch: 63, train_loss: 0.4142, test_loss: 1.2056, test_f1: 0.6406
 epoch: 64, train_loss: 0.4105, test_loss: 1.1679, test_f1: 0.6522
 epoch: 65, train_loss: 0.3860, test_loss: 1.2892, test_f1: 0.6184
 epoch: 66, train_loss: 0.4100, test_loss: 1.2069, test_f1: 0.6505
 epoch: 67, train_loss: 0.4036, test_loss: 1.3278, test_f1: 0.6251
 epoch: 68, train_loss: 0.3966, test_loss: 1.2872, test_f1: 0.6267
 epoch: 69, train_loss: 0.3992, test_loss: 1.2813, test_f1: 0.6486
 epoch: 70, train_loss: 0.3738, test_loss: 1.3206, test_f1: 0.6200
 epoch: 71, train_loss: 0.3878, test_loss: 1.2641, test_f1: 0.6318
 epoch: 72, train_loss: 0.3674, test_loss: 1.3756, test_f1: 0.6512
 epoch: 73, train_loss: 0.3765, test_loss: 1.3820, test_f1: 0.6369
 epoch: 74, train_loss: 0.3750, test_loss: 1.3063, test_f1: 0.6374
 epoch: 75, train_loss: 0.3732, test_loss: 1.3546, test_f1: 0.6322
 epoch: 76, train_loss: 0.3574, test_loss: 1.3185, test_f1: 0.6258
 epoch: 77, train_loss: 0.3799, test_loss: 1.4064, test_f1: 0.6183
 epoch: 78, train_loss: 0.3814, test_loss: 1.4019, test_f1: 0.6490
 epoch: 79, train_loss: 0.3661, test_loss: 1.4190, test_f1: 0.6186
 epoch: 80, train_loss: 0.3587, test_loss: 1.4807, test_f1: 0.6237
 epoch: 81, train_loss: 0.3709, test_loss: 1.3833, test_f1: 0.6374
 epoch: 82, train_loss: 0.3334, test_loss: 1.4236, test_f1: 0.6561
 epoch: 83, train_loss: 0.3389, test_loss: 1.4183, test_f1: 0.6286
 epoch: 84, train_loss: 0.3339, test_loss: 1.4751, test_f1: 0.6357
 epoch: 85, train_loss: 0.3440, test_loss: 1.5154, test_f1: 0.6189
 epoch: 86, train_loss: 0.3389, test_loss: 1.5887, test_f1: 0.6441
 epoch: 87, train_loss: 0.3306, test_loss: 1.5119, test_f1: 0.6277
 epoch: 88, train_loss: 0.3182, test_loss: 1.5550, test_f1: 0.6476
 epoch: 89, train_loss: 0.3307, test_loss: 1.5986, test_f1: 0.6189
 epoch: 90, train_loss: 0.3169, test_loss: 1.6269, test_f1: 0.6197
 epoch: 91, train_loss: 0.3236, test_loss: 1.6724, test_f1: 0.6356
 epoch: 92, train_loss: 0.3042, test_loss: 1.7046, test_f1: 0.6282
 epoch: 93, train_loss: 0.3257, test_loss: 1.6536, test_f1: 0.6019
 epoch: 94, train_loss: 0.3364, test_loss: 1.5542, test_f1: 0.6364
 epoch: 95, train_loss: 0.3089, test_loss: 1.6908, test_f1: 0.6263
 epoch: 96, train_loss: 0.3090, test_loss: 1.6715, test_f1: 0.6371
 epoch: 97, train_loss: 0.2996, test_loss: 1.7124, test_f1: 0.6241
 epoch: 98, train_loss: 0.3046, test_loss: 1.8647, test_f1: 0.6156
 epoch: 99, train_loss: 0.2959, test_loss: 1.7556, test_f1: 0.6237
##################ITERATION #1 ****************************************
 epoch: 0, train_loss: 1.1693, test_loss: 1.0920, test_f1: 0.4597
 epoch: 1, train_loss: 1.0145, test_loss: 0.9227, test_f1: 0.5524
 epoch: 2, train_loss: 0.9662, test_loss: 0.8993, test_f1: 0.4965
 epoch: 3, train_loss: 0.9305, test_loss: 0.9473, test_f1: 0.4987
 epoch: 4, train_loss: 0.9004, test_loss: 0.8875, test_f1: 0.5912
 epoch: 5, train_loss: 0.8813, test_loss: 0.9440, test_f1: 0.5547
 epoch: 6, train_loss: 0.8777, test_loss: 0.9564, test_f1: 0.5225
 epoch: 7, train_loss: 0.8668, test_loss: 0.9233, test_f1: 0.5539
 epoch: 8, train_loss: 0.8491, test_loss: 0.9415, test_f1: 0.5486
 epoch: 9, train_loss: 0.8391, test_loss: 0.9430, test_f1: 0.5710
 epoch: 10, train_loss: 0.8360, test_loss: 0.9618, test_f1: 0.5919
 epoch: 11, train_loss: 0.8264, test_loss: 0.9222, test_f1: 0.5774
 epoch: 12, train_loss: 0.8116, test_loss: 0.9290, test_f1: 0.6076
 epoch: 13, train_loss: 0.7974, test_loss: 0.9456, test_f1: 0.5801
 epoch: 14, train_loss: 0.7822, test_loss: 0.9678, test_f1: 0.5846
 epoch: 15, train_loss: 0.7752, test_loss: 0.9518, test_f1: 0.6025
 epoch: 16, train_loss: 0.7760, test_loss: 0.9583, test_f1: 0.5789
 epoch: 17, train_loss: 0.7821, test_loss: 0.9521, test_f1: 0.6090
 epoch: 18, train_loss: 0.7580, test_loss: 0.9370, test_f1: 0.5885
 epoch: 19, train_loss: 0.7402, test_loss: 0.9370, test_f1: 0.5965
 epoch: 20, train_loss: 0.7449, test_loss: 0.9494, test_f1: 0.6052
 epoch: 21, train_loss: 0.7348, test_loss: 0.9960, test_f1: 0.5926
 epoch: 22, train_loss: 0.7495, test_loss: 0.9282, test_f1: 0.6289
 epoch: 23, train_loss: 0.7265, test_loss: 0.9705, test_f1: 0.6302
 epoch: 24, train_loss: 0.7201, test_loss: 0.9647, test_f1: 0.5853
 epoch: 25, train_loss: 0.7122, test_loss: 1.0003, test_f1: 0.5997
 epoch: 26, train_loss: 0.6886, test_loss: 1.0139, test_f1: 0.5978
 epoch: 27, train_loss: 0.6885, test_loss: 0.9803, test_f1: 0.6296
 epoch: 28, train_loss: 0.6898, test_loss: 0.9808, test_f1: 0.6213
 epoch: 29, train_loss: 0.6778, test_loss: 1.0056, test_f1: 0.6681
 epoch: 30, train_loss: 0.6615, test_loss: 1.0050, test_f1: 0.6483
 epoch: 31, train_loss: 0.6412, test_loss: 1.0074, test_f1: 0.6349
 epoch: 32, train_loss: 0.6350, test_loss: 1.0190, test_f1: 0.6470
 epoch: 33, train_loss: 0.6489, test_loss: 0.9763, test_f1: 0.6446
 epoch: 34, train_loss: 0.6404, test_loss: 1.0491, test_f1: 0.6188
 epoch: 35, train_loss: 0.6473, test_loss: 1.0128, test_f1: 0.6617
 epoch: 36, train_loss: 0.6078, test_loss: 1.0492, test_f1: 0.6076
 epoch: 37, train_loss: 0.6204, test_loss: 0.9948, test_f1: 0.6319
 epoch: 38, train_loss: 0.6053, test_loss: 1.0433, test_f1: 0.6631
 epoch: 39, train_loss: 0.6055, test_loss: 1.0796, test_f1: 0.6232
 epoch: 40, train_loss: 0.5807, test_loss: 1.0718, test_f1: 0.6432
 epoch: 41, train_loss: 0.5823, test_loss: 1.0777, test_f1: 0.6466
 epoch: 42, train_loss: 0.5695, test_loss: 1.1015, test_f1: 0.6513
 epoch: 43, train_loss: 0.5730, test_loss: 1.0338, test_f1: 0.6561
 epoch: 44, train_loss: 0.5614, test_loss: 0.9788, test_f1: 0.6516
 epoch: 45, train_loss: 0.5503, test_loss: 1.0680, test_f1: 0.6703
 epoch: 46, train_loss: 0.5433, test_loss: 1.1666, test_f1: 0.6232
 epoch: 47, train_loss: 0.5485, test_loss: 1.1350, test_f1: 0.6496
 epoch: 48, train_loss: 0.5484, test_loss: 1.1184, test_f1: 0.6562
 epoch: 49, train_loss: 0.5247, test_loss: 1.1092, test_f1: 0.6482
 epoch: 50, train_loss: 0.5151, test_loss: 1.1826, test_f1: 0.6635
 epoch: 51, train_loss: 0.4844, test_loss: 1.1422, test_f1: 0.6523
 epoch: 52, train_loss: 0.4526, test_loss: 1.1466, test_f1: 0.6871
 epoch: 53, train_loss: 0.4567, test_loss: 1.1846, test_f1: 0.6549
 epoch: 54, train_loss: 0.4377, test_loss: 1.2125, test_f1: 0.6566
 epoch: 55, train_loss: 0.4317, test_loss: 1.1620, test_f1: 0.6664
 epoch: 56, train_loss: 0.4177, test_loss: 1.3197, test_f1: 0.6420
 epoch: 57, train_loss: 0.4273, test_loss: 1.2854, test_f1: 0.6704
 epoch: 58, train_loss: 0.4124, test_loss: 1.3022, test_f1: 0.6750
 epoch: 59, train_loss: 0.4171, test_loss: 1.2421, test_f1: 0.6635
 epoch: 60, train_loss: 0.3857, test_loss: 1.2486, test_f1: 0.6689
 epoch: 61, train_loss: 0.4187, test_loss: 1.2163, test_f1: 0.6799
 epoch: 62, train_loss: 0.4041, test_loss: 1.3082, test_f1: 0.6586
 epoch: 63, train_loss: 0.3746, test_loss: 1.2979, test_f1: 0.6738
 epoch: 64, train_loss: 0.3828, test_loss: 1.4125, test_f1: 0.6188
 epoch: 65, train_loss: 0.3830, test_loss: 1.3268, test_f1: 0.6601
 epoch: 66, train_loss: 0.3872, test_loss: 1.3034, test_f1: 0.6708
 epoch: 67, train_loss: 0.3630, test_loss: 1.3845, test_f1: 0.6524
 epoch: 68, train_loss: 0.3901, test_loss: 1.4603, test_f1: 0.6208
 epoch: 69, train_loss: 0.3813, test_loss: 1.3485, test_f1: 0.6597
 epoch: 70, train_loss: 0.3754, test_loss: 1.4071, test_f1: 0.6647
 epoch: 71, train_loss: 0.3770, test_loss: 1.3657, test_f1: 0.6663
 epoch: 72, train_loss: 0.3491, test_loss: 1.3809, test_f1: 0.6823
 epoch: 73, train_loss: 0.3537, test_loss: 1.4717, test_f1: 0.6605
 epoch: 74, train_loss: 0.3511, test_loss: 1.3461, test_f1: 0.6620
 epoch: 75, train_loss: 0.3445, test_loss: 1.3726, test_f1: 0.6614
 epoch: 76, train_loss: 0.3271, test_loss: 1.4260, test_f1: 0.6419
 epoch: 77, train_loss: 0.3292, test_loss: 1.5176, test_f1: 0.6483
 epoch: 78, train_loss: 0.3315, test_loss: 1.5840, test_f1: 0.6476
 epoch: 79, train_loss: 0.3340, test_loss: 1.5303, test_f1: 0.6424
 epoch: 80, train_loss: 0.3261, test_loss: 1.4596, test_f1: 0.6748
 epoch: 81, train_loss: 0.3206, test_loss: 1.5546, test_f1: 0.6498
 epoch: 82, train_loss: 0.3199, test_loss: 1.5460, test_f1: 0.6487
 epoch: 83, train_loss: 0.3355, test_loss: 1.6554, test_f1: 0.6389
 epoch: 84, train_loss: 0.3204, test_loss: 1.5817, test_f1: 0.6621
 epoch: 85, train_loss: 0.3180, test_loss: 1.5894, test_f1: 0.6587
 epoch: 86, train_loss: 0.3034, test_loss: 1.5258, test_f1: 0.6641
 epoch: 87, train_loss: 0.2956, test_loss: 1.5923, test_f1: 0.6310
 epoch: 88, train_loss: 0.3252, test_loss: 1.6022, test_f1: 0.6336
 epoch: 89, train_loss: 0.2950, test_loss: 1.6620, test_f1: 0.6651
 epoch: 90, train_loss: 0.3109, test_loss: 1.5745, test_f1: 0.6654
 epoch: 91, train_loss: 0.3101, test_loss: 1.5719, test_f1: 0.6730
 epoch: 92, train_loss: 0.3167, test_loss: 1.5537, test_f1: 0.6897
 epoch: 93, train_loss: 0.2923, test_loss: 1.6411, test_f1: 0.6660
 epoch: 94, train_loss: 0.2832, test_loss: 1.6827, test_f1: 0.6347
 epoch: 95, train_loss: 0.2770, test_loss: 1.6019, test_f1: 0.6502
 epoch: 96, train_loss: 0.2920, test_loss: 1.6348, test_f1: 0.6676
 epoch: 97, train_loss: 0.2842, test_loss: 1.5715, test_f1: 0.6659
 epoch: 98, train_loss: 0.2647, test_loss: 1.6499, test_f1: 0.6772
 epoch: 99, train_loss: 0.2820, test_loss: 1.6165, test_f1: 0.6782
##################ITERATION #2 ****************************************
 epoch: 0, train_loss: 1.1795, test_loss: 1.0954, test_f1: 0.4703
 epoch: 1, train_loss: 1.0255, test_loss: 0.9720, test_f1: 0.5346
 epoch: 2, train_loss: 0.9799, test_loss: 0.9128, test_f1: 0.5366
 epoch: 3, train_loss: 0.9420, test_loss: 0.9454, test_f1: 0.5158
 epoch: 4, train_loss: 0.9311, test_loss: 0.9522, test_f1: 0.5138
 epoch: 5, train_loss: 0.9077, test_loss: 0.9651, test_f1: 0.5563
 epoch: 6, train_loss: 0.8906, test_loss: 0.9128, test_f1: 0.5573
 epoch: 7, train_loss: 0.8708, test_loss: 0.9235, test_f1: 0.5688
 epoch: 8, train_loss: 0.8731, test_loss: 0.9638, test_f1: 0.5484
 epoch: 9, train_loss: 0.8599, test_loss: 0.8439, test_f1: 0.5938
 epoch: 10, train_loss: 0.8539, test_loss: 0.8982, test_f1: 0.6173
 epoch: 11, train_loss: 0.8203, test_loss: 0.9399, test_f1: 0.5748
 epoch: 12, train_loss: 0.8164, test_loss: 0.9400, test_f1: 0.6001
 epoch: 13, train_loss: 0.8155, test_loss: 0.9327, test_f1: 0.5327
 epoch: 14, train_loss: 0.7982, test_loss: 0.9176, test_f1: 0.6006
 epoch: 15, train_loss: 0.7844, test_loss: 0.8596, test_f1: 0.5771
 epoch: 16, train_loss: 0.7634, test_loss: 0.9534, test_f1: 0.5628
 epoch: 17, train_loss: 0.7692, test_loss: 0.9280, test_f1: 0.5906
 epoch: 18, train_loss: 0.7716, test_loss: 0.9305, test_f1: 0.5973
 epoch: 19, train_loss: 0.7573, test_loss: 0.9633, test_f1: 0.6089
 epoch: 20, train_loss: 0.7458, test_loss: 0.9525, test_f1: 0.6029
 epoch: 21, train_loss: 0.7403, test_loss: 0.9545, test_f1: 0.6313
 epoch: 22, train_loss: 0.7412, test_loss: 0.9564, test_f1: 0.5892
 epoch: 23, train_loss: 0.7122, test_loss: 1.0206, test_f1: 0.5622
 epoch: 24, train_loss: 0.7188, test_loss: 0.9016, test_f1: 0.6212
 epoch: 25, train_loss: 0.7025, test_loss: 0.9142, test_f1: 0.6363
 epoch: 26, train_loss: 0.7049, test_loss: 0.9134, test_f1: 0.6249
 epoch: 27, train_loss: 0.6794, test_loss: 0.9002, test_f1: 0.6522
 epoch: 28, train_loss: 0.6755, test_loss: 0.9188, test_f1: 0.6395
 epoch: 29, train_loss: 0.6456, test_loss: 0.9018, test_f1: 0.5906
 epoch: 30, train_loss: 0.6642, test_loss: 0.9885, test_f1: 0.6357
 epoch: 31, train_loss: 0.6503, test_loss: 0.9743, test_f1: 0.6275
 epoch: 32, train_loss: 0.6476, test_loss: 0.9690, test_f1: 0.6300
 epoch: 33, train_loss: 0.6365, test_loss: 0.9600, test_f1: 0.5976
 epoch: 34, train_loss: 0.6158, test_loss: 0.8977, test_f1: 0.6766
 epoch: 35, train_loss: 0.6142, test_loss: 1.0058, test_f1: 0.5938
 epoch: 36, train_loss: 0.6173, test_loss: 0.9570, test_f1: 0.6538
 epoch: 37, train_loss: 0.5932, test_loss: 0.9849, test_f1: 0.6546
 epoch: 38, train_loss: 0.5862, test_loss: 1.0535, test_f1: 0.6271
 epoch: 39, train_loss: 0.5965, test_loss: 1.0162, test_f1: 0.6263
 epoch: 40, train_loss: 0.5664, test_loss: 1.0840, test_f1: 0.6426
 epoch: 41, train_loss: 0.5579, test_loss: 1.0448, test_f1: 0.6333
 epoch: 42, train_loss: 0.5661, test_loss: 0.9830, test_f1: 0.6357
 epoch: 43, train_loss: 0.5588, test_loss: 0.9811, test_f1: 0.6639
 epoch: 44, train_loss: 0.5500, test_loss: 1.0658, test_f1: 0.6110
 epoch: 45, train_loss: 0.5539, test_loss: 0.9503, test_f1: 0.6581
 epoch: 46, train_loss: 0.5284, test_loss: 0.9935, test_f1: 0.6211
 epoch: 47, train_loss: 0.5354, test_loss: 1.0244, test_f1: 0.6439
 epoch: 48, train_loss: 0.5198, test_loss: 1.0244, test_f1: 0.6432
 epoch: 49, train_loss: 0.5213, test_loss: 0.9866, test_f1: 0.6664
 epoch: 50, train_loss: 0.5094, test_loss: 1.1685, test_f1: 0.6255
 epoch: 51, train_loss: 0.4846, test_loss: 1.0365, test_f1: 0.6502
 epoch: 52, train_loss: 0.4487, test_loss: 1.0122, test_f1: 0.6652
 epoch: 53, train_loss: 0.4557, test_loss: 0.9967, test_f1: 0.6836
 epoch: 54, train_loss: 0.4364, test_loss: 1.0459, test_f1: 0.6649
 epoch: 55, train_loss: 0.4277, test_loss: 1.0530, test_f1: 0.6659
 epoch: 56, train_loss: 0.4361, test_loss: 1.0497, test_f1: 0.6673
 epoch: 57, train_loss: 0.3999, test_loss: 1.0920, test_f1: 0.6521
 epoch: 58, train_loss: 0.4085, test_loss: 1.0606, test_f1: 0.6542
 epoch: 59, train_loss: 0.4065, test_loss: 1.0513, test_f1: 0.6708
 epoch: 60, train_loss: 0.4146, test_loss: 1.1033, test_f1: 0.6704
 epoch: 61, train_loss: 0.3972, test_loss: 1.0789, test_f1: 0.6581
 epoch: 62, train_loss: 0.3791, test_loss: 1.1019, test_f1: 0.6829
 epoch: 63, train_loss: 0.3719, test_loss: 1.1562, test_f1: 0.6506
 epoch: 64, train_loss: 0.3882, test_loss: 1.0857, test_f1: 0.6462
 epoch: 65, train_loss: 0.3826, test_loss: 1.1130, test_f1: 0.6756
 epoch: 66, train_loss: 0.3813, test_loss: 1.2153, test_f1: 0.6379
 epoch: 67, train_loss: 0.3953, test_loss: 1.1599, test_f1: 0.6581
 epoch: 68, train_loss: 0.3602, test_loss: 1.2102, test_f1: 0.6417
 epoch: 69, train_loss: 0.3568, test_loss: 1.1581, test_f1: 0.6601
 epoch: 70, train_loss: 0.3466, test_loss: 1.1751, test_f1: 0.6730
 epoch: 71, train_loss: 0.3540, test_loss: 1.1669, test_f1: 0.6373
 epoch: 72, train_loss: 0.3404, test_loss: 1.3222, test_f1: 0.6352
 epoch: 73, train_loss: 0.3593, test_loss: 1.2039, test_f1: 0.6835
 epoch: 74, train_loss: 0.3648, test_loss: 1.2067, test_f1: 0.6739
 epoch: 75, train_loss: 0.3434, test_loss: 1.2596, test_f1: 0.6602
 epoch: 76, train_loss: 0.3502, test_loss: 1.2518, test_f1: 0.6433
 epoch: 77, train_loss: 0.3423, test_loss: 1.2978, test_f1: 0.6585
 epoch: 78, train_loss: 0.3350, test_loss: 1.2730, test_f1: 0.6286
 epoch: 79, train_loss: 0.3469, test_loss: 1.2204, test_f1: 0.6646
 epoch: 80, train_loss: 0.3291, test_loss: 1.3142, test_f1: 0.6415
 epoch: 81, train_loss: 0.3086, test_loss: 1.3162, test_f1: 0.6672
 epoch: 82, train_loss: 0.3272, test_loss: 1.2668, test_f1: 0.6750
 epoch: 83, train_loss: 0.3245, test_loss: 1.3363, test_f1: 0.6535
 epoch: 84, train_loss: 0.3127, test_loss: 1.3430, test_f1: 0.6529
 epoch: 85, train_loss: 0.3213, test_loss: 1.3609, test_f1: 0.6236
 epoch: 86, train_loss: 0.3241, test_loss: 1.2938, test_f1: 0.6689
 epoch: 87, train_loss: 0.3004, test_loss: 1.4263, test_f1: 0.6421
 epoch: 88, train_loss: 0.3043, test_loss: 1.3417, test_f1: 0.6568
 epoch: 89, train_loss: 0.3053, test_loss: 1.3427, test_f1: 0.6597
 epoch: 90, train_loss: 0.3038, test_loss: 1.3372, test_f1: 0.6372
 epoch: 91, train_loss: 0.3086, test_loss: 1.3638, test_f1: 0.6351
 epoch: 92, train_loss: 0.3145, test_loss: 1.3662, test_f1: 0.6511
 epoch: 93, train_loss: 0.3153, test_loss: 1.3925, test_f1: 0.6752
 epoch: 94, train_loss: 0.3090, test_loss: 1.4240, test_f1: 0.6482
 epoch: 95, train_loss: 0.2950, test_loss: 1.4311, test_f1: 0.6499
 epoch: 96, train_loss: 0.2964, test_loss: 1.4924, test_f1: 0.6572
 epoch: 97, train_loss: 0.2822, test_loss: 1.5157, test_f1: 0.6317
 epoch: 98, train_loss: 0.2828, test_loss: 1.4692, test_f1: 0.6376
 epoch: 99, train_loss: 0.3004, test_loss: 1.4028, test_f1: 0.6662
##################ITERATION #3 ****************************************
 epoch: 0, train_loss: 1.2196, test_loss: 1.0019, test_f1: 0.4808
 epoch: 1, train_loss: 1.0425, test_loss: 0.9632, test_f1: 0.5230
 epoch: 2, train_loss: 0.9741, test_loss: 0.9195, test_f1: 0.5017
 epoch: 3, train_loss: 0.9553, test_loss: 0.9961, test_f1: 0.4933
 epoch: 4, train_loss: 0.9417, test_loss: 0.9716, test_f1: 0.5088
 epoch: 5, train_loss: 0.9215, test_loss: 0.9835, test_f1: 0.5352
 epoch: 6, train_loss: 0.8897, test_loss: 0.9770, test_f1: 0.5429
 epoch: 7, train_loss: 0.8902, test_loss: 0.9905, test_f1: 0.5377
 epoch: 8, train_loss: 0.8846, test_loss: 0.9331, test_f1: 0.5698
 epoch: 9, train_loss: 0.8713, test_loss: 0.9915, test_f1: 0.5585
 epoch: 10, train_loss: 0.8645, test_loss: 0.9914, test_f1: 0.5303
 epoch: 11, train_loss: 0.8575, test_loss: 0.9815, test_f1: 0.5708
 epoch: 12, train_loss: 0.8412, test_loss: 0.9648, test_f1: 0.5523
 epoch: 13, train_loss: 0.8382, test_loss: 0.9530, test_f1: 0.5861
 epoch: 14, train_loss: 0.8265, test_loss: 0.9817, test_f1: 0.5622
 epoch: 15, train_loss: 0.8254, test_loss: 0.9844, test_f1: 0.5858
 epoch: 16, train_loss: 0.7938, test_loss: 1.0005, test_f1: 0.6011
 epoch: 17, train_loss: 0.8119, test_loss: 0.9867, test_f1: 0.5777
 epoch: 18, train_loss: 0.7896, test_loss: 0.9884, test_f1: 0.5959
 epoch: 19, train_loss: 0.7937, test_loss: 0.9895, test_f1: 0.6253
 epoch: 20, train_loss: 0.7778, test_loss: 0.9735, test_f1: 0.5863
 epoch: 21, train_loss: 0.7762, test_loss: 1.0038, test_f1: 0.5833
 epoch: 22, train_loss: 0.7685, test_loss: 1.0003, test_f1: 0.5847
 epoch: 23, train_loss: 0.7642, test_loss: 0.9718, test_f1: 0.6231
 epoch: 24, train_loss: 0.7614, test_loss: 1.0400, test_f1: 0.6033
 epoch: 25, train_loss: 0.7552, test_loss: 0.9569, test_f1: 0.6306
 epoch: 26, train_loss: 0.7452, test_loss: 0.9763, test_f1: 0.6002
 epoch: 27, train_loss: 0.7379, test_loss: 1.0002, test_f1: 0.6161
 epoch: 28, train_loss: 0.7143, test_loss: 1.0533, test_f1: 0.5883
 epoch: 29, train_loss: 0.7343, test_loss: 1.0129, test_f1: 0.5919
 epoch: 30, train_loss: 0.7161, test_loss: 1.0181, test_f1: 0.6324
 epoch: 31, train_loss: 0.7020, test_loss: 0.9667, test_f1: 0.5894
 epoch: 32, train_loss: 0.7057, test_loss: 1.0115, test_f1: 0.6094
 epoch: 33, train_loss: 0.6991, test_loss: 1.0874, test_f1: 0.6249
 epoch: 34, train_loss: 0.7057, test_loss: 1.0132, test_f1: 0.5963
 epoch: 35, train_loss: 0.6874, test_loss: 0.9673, test_f1: 0.6595
 epoch: 36, train_loss: 0.7098, test_loss: 0.9605, test_f1: 0.6481
 epoch: 37, train_loss: 0.6755, test_loss: 1.0676, test_f1: 0.6170
 epoch: 38, train_loss: 0.6654, test_loss: 1.0717, test_f1: 0.6081
 epoch: 39, train_loss: 0.6535, test_loss: 1.0415, test_f1: 0.6070
 epoch: 40, train_loss: 0.6543, test_loss: 1.0454, test_f1: 0.6287
 epoch: 41, train_loss: 0.6465, test_loss: 1.0667, test_f1: 0.6245
 epoch: 42, train_loss: 0.6476, test_loss: 1.0105, test_f1: 0.6122
 epoch: 43, train_loss: 0.6325, test_loss: 1.0045, test_f1: 0.6391
 epoch: 44, train_loss: 0.6313, test_loss: 1.0568, test_f1: 0.6385
 epoch: 45, train_loss: 0.6266, test_loss: 1.0587, test_f1: 0.6629
 epoch: 46, train_loss: 0.6047, test_loss: 1.1359, test_f1: 0.6324
 epoch: 47, train_loss: 0.6170, test_loss: 1.0590, test_f1: 0.6294
 epoch: 48, train_loss: 0.5982, test_loss: 1.1139, test_f1: 0.6366
 epoch: 49, train_loss: 0.5939, test_loss: 1.0690, test_f1: 0.6465
 epoch: 50, train_loss: 0.6197, test_loss: 1.1139, test_f1: 0.6547
 epoch: 51, train_loss: 0.5552, test_loss: 1.1304, test_f1: 0.6373
 epoch: 52, train_loss: 0.5402, test_loss: 1.0714, test_f1: 0.6875
 epoch: 53, train_loss: 0.5271, test_loss: 1.1102, test_f1: 0.6578
 epoch: 54, train_loss: 0.5222, test_loss: 1.1880, test_f1: 0.6684
 epoch: 55, train_loss: 0.5363, test_loss: 1.1348, test_f1: 0.6447
 epoch: 56, train_loss: 0.5057, test_loss: 1.0915, test_f1: 0.6898
 epoch: 57, train_loss: 0.5097, test_loss: 1.0597, test_f1: 0.6840
 epoch: 58, train_loss: 0.4884, test_loss: 1.1177, test_f1: 0.6808
 epoch: 59, train_loss: 0.4913, test_loss: 1.1531, test_f1: 0.6687
 epoch: 60, train_loss: 0.4902, test_loss: 1.1404, test_f1: 0.6581
 epoch: 61, train_loss: 0.5044, test_loss: 1.2114, test_f1: 0.6720
 epoch: 62, train_loss: 0.4940, test_loss: 1.1615, test_f1: 0.6594
 epoch: 63, train_loss: 0.4783, test_loss: 1.1695, test_f1: 0.6624
 epoch: 64, train_loss: 0.4606, test_loss: 1.2283, test_f1: 0.6457
 epoch: 65, train_loss: 0.4671, test_loss: 1.1704, test_f1: 0.6653
 epoch: 66, train_loss: 0.4663, test_loss: 1.2143, test_f1: 0.6523
 epoch: 67, train_loss: 0.4578, test_loss: 1.2045, test_f1: 0.6619
 epoch: 68, train_loss: 0.4481, test_loss: 1.1917, test_f1: 0.6717
 epoch: 69, train_loss: 0.4671, test_loss: 1.2535, test_f1: 0.6568
 epoch: 70, train_loss: 0.4683, test_loss: 1.1967, test_f1: 0.6609
 epoch: 71, train_loss: 0.4566, test_loss: 1.2156, test_f1: 0.6619
 epoch: 72, train_loss: 0.4464, test_loss: 1.2395, test_f1: 0.6317
 epoch: 73, train_loss: 0.4455, test_loss: 1.2479, test_f1: 0.6656
 epoch: 74, train_loss: 0.4547, test_loss: 1.2402, test_f1: 0.6754
 epoch: 75, train_loss: 0.4173, test_loss: 1.2435, test_f1: 0.6674
 epoch: 76, train_loss: 0.4263, test_loss: 1.2867, test_f1: 0.6832
 epoch: 77, train_loss: 0.4439, test_loss: 1.2476, test_f1: 0.6674
 epoch: 78, train_loss: 0.4149, test_loss: 1.2793, test_f1: 0.6509
 epoch: 79, train_loss: 0.4136, test_loss: 1.2937, test_f1: 0.6700
 epoch: 80, train_loss: 0.4291, test_loss: 1.3430, test_f1: 0.6828
 epoch: 81, train_loss: 0.4092, test_loss: 1.2929, test_f1: 0.6435
 epoch: 82, train_loss: 0.4046, test_loss: 1.3138, test_f1: 0.6591
 epoch: 83, train_loss: 0.3937, test_loss: 1.3674, test_f1: 0.6629
 epoch: 84, train_loss: 0.4088, test_loss: 1.4319, test_f1: 0.6517
 epoch: 85, train_loss: 0.4054, test_loss: 1.3004, test_f1: 0.6476
 epoch: 86, train_loss: 0.3877, test_loss: 1.3070, test_f1: 0.6619
 epoch: 87, train_loss: 0.3983, test_loss: 1.4090, test_f1: 0.6397
 epoch: 88, train_loss: 0.3836, test_loss: 1.4543, test_f1: 0.6342
 epoch: 89, train_loss: 0.3897, test_loss: 1.4098, test_f1: 0.6655
 epoch: 90, train_loss: 0.3888, test_loss: 1.4448, test_f1: 0.6628
 epoch: 91, train_loss: 0.3657, test_loss: 1.4348, test_f1: 0.6684
 epoch: 92, train_loss: 0.3578, test_loss: 1.3668, test_f1: 0.6716
 epoch: 93, train_loss: 0.3730, test_loss: 1.4505, test_f1: 0.6827
 epoch: 94, train_loss: 0.3496, test_loss: 1.4826, test_f1: 0.6407
 epoch: 95, train_loss: 0.3683, test_loss: 1.4519, test_f1: 0.6719
 epoch: 96, train_loss: 0.3598, test_loss: 1.5005, test_f1: 0.6540
 epoch: 97, train_loss: 0.3662, test_loss: 1.4455, test_f1: 0.6621
 epoch: 98, train_loss: 0.3655, test_loss: 1.3941, test_f1: 0.6543
 epoch: 99, train_loss: 0.3527, test_loss: 1.4830, test_f1: 0.6430
##################ITERATION #4 ****************************************
 epoch: 0, train_loss: 1.2504, test_loss: 1.0455, test_f1: 0.4624
 epoch: 1, train_loss: 1.0423, test_loss: 0.9976, test_f1: 0.4815
 epoch: 2, train_loss: 0.9865, test_loss: 0.9253, test_f1: 0.5325
 epoch: 3, train_loss: 0.9698, test_loss: 0.9332, test_f1: 0.5179
 epoch: 4, train_loss: 0.9462, test_loss: 0.9294, test_f1: 0.5166
 epoch: 5, train_loss: 0.9229, test_loss: 0.9714, test_f1: 0.5132
 epoch: 6, train_loss: 0.9100, test_loss: 0.9434, test_f1: 0.5371
 epoch: 7, train_loss: 0.8919, test_loss: 0.9391, test_f1: 0.5487
 epoch: 8, train_loss: 0.8863, test_loss: 0.9328, test_f1: 0.5403
 epoch: 9, train_loss: 0.8728, test_loss: 0.9689, test_f1: 0.5495
 epoch: 10, train_loss: 0.8749, test_loss: 0.9264, test_f1: 0.5342
 epoch: 11, train_loss: 0.8587, test_loss: 0.9373, test_f1: 0.5420
 epoch: 12, train_loss: 0.8417, test_loss: 0.9205, test_f1: 0.5570
 epoch: 13, train_loss: 0.8413, test_loss: 0.9531, test_f1: 0.5380
 epoch: 14, train_loss: 0.8221, test_loss: 0.9550, test_f1: 0.5798
 epoch: 15, train_loss: 0.8235, test_loss: 1.0628, test_f1: 0.5520
 epoch: 16, train_loss: 0.8057, test_loss: 0.9452, test_f1: 0.5821
 epoch: 17, train_loss: 0.8135, test_loss: 0.9418, test_f1: 0.6014
 epoch: 18, train_loss: 0.7938, test_loss: 0.9330, test_f1: 0.5884
 epoch: 19, train_loss: 0.7973, test_loss: 0.9420, test_f1: 0.5784
 epoch: 20, train_loss: 0.7870, test_loss: 0.9287, test_f1: 0.5834
 epoch: 21, train_loss: 0.7725, test_loss: 0.9390, test_f1: 0.5709
 epoch: 22, train_loss: 0.7528, test_loss: 0.9346, test_f1: 0.5807
 epoch: 23, train_loss: 0.7699, test_loss: 0.9912, test_f1: 0.5956
 epoch: 24, train_loss: 0.7595, test_loss: 1.0226, test_f1: 0.5965
 epoch: 25, train_loss: 0.7451, test_loss: 0.9661, test_f1: 0.5741
 epoch: 26, train_loss: 0.7659, test_loss: 0.9323, test_f1: 0.5867
 epoch: 27, train_loss: 0.7249, test_loss: 0.9029, test_f1: 0.6165
 epoch: 28, train_loss: 0.7441, test_loss: 0.9524, test_f1: 0.6023
 epoch: 29, train_loss: 0.7170, test_loss: 0.9250, test_f1: 0.5900
 epoch: 30, train_loss: 0.7169, test_loss: 1.0027, test_f1: 0.6129
 epoch: 31, train_loss: 0.7130, test_loss: 1.0080, test_f1: 0.6053
 epoch: 32, train_loss: 0.6964, test_loss: 0.9486, test_f1: 0.5979
 epoch: 33, train_loss: 0.6965, test_loss: 0.8964, test_f1: 0.6038
 epoch: 34, train_loss: 0.6882, test_loss: 0.9901, test_f1: 0.6065
 epoch: 35, train_loss: 0.6953, test_loss: 0.9885, test_f1: 0.6150
 epoch: 36, train_loss: 0.6917, test_loss: 0.9541, test_f1: 0.5983
 epoch: 37, train_loss: 0.6731, test_loss: 0.9822, test_f1: 0.6343
 epoch: 38, train_loss: 0.6675, test_loss: 1.0301, test_f1: 0.6078
 epoch: 39, train_loss: 0.6562, test_loss: 1.1423, test_f1: 0.5526
 epoch: 40, train_loss: 0.6639, test_loss: 1.0116, test_f1: 0.6178
 epoch: 41, train_loss: 0.6548, test_loss: 1.0275, test_f1: 0.6117
 epoch: 42, train_loss: 0.6547, test_loss: 1.0499, test_f1: 0.6003
 epoch: 43, train_loss: 0.6368, test_loss: 1.0496, test_f1: 0.6251
 epoch: 44, train_loss: 0.6462, test_loss: 1.0113, test_f1: 0.6161
 epoch: 45, train_loss: 0.6338, test_loss: 0.9975, test_f1: 0.6225
 epoch: 46, train_loss: 0.6421, test_loss: 1.2035, test_f1: 0.5791
 epoch: 47, train_loss: 0.6283, test_loss: 1.0614, test_f1: 0.6059
 epoch: 48, train_loss: 0.6169, test_loss: 1.0551, test_f1: 0.6064
 epoch: 49, train_loss: 0.5968, test_loss: 1.0922, test_f1: 0.6085
 epoch: 50, train_loss: 0.6032, test_loss: 1.0331, test_f1: 0.6252
 epoch: 51, train_loss: 0.5670, test_loss: 1.0639, test_f1: 0.6460
 epoch: 52, train_loss: 0.5567, test_loss: 1.0304, test_f1: 0.6508
 epoch: 53, train_loss: 0.5414, test_loss: 1.0724, test_f1: 0.6658
 epoch: 54, train_loss: 0.5328, test_loss: 1.0710, test_f1: 0.6544
 epoch: 55, train_loss: 0.5347, test_loss: 1.0902, test_f1: 0.6567
 epoch: 56, train_loss: 0.5175, test_loss: 1.0797, test_f1: 0.6532
 epoch: 57, train_loss: 0.5069, test_loss: 1.1124, test_f1: 0.6539
 epoch: 58, train_loss: 0.5183, test_loss: 1.0856, test_f1: 0.6279
 epoch: 59, train_loss: 0.5092, test_loss: 1.0754, test_f1: 0.6770
 epoch: 60, train_loss: 0.4913, test_loss: 1.1247, test_f1: 0.6531
 epoch: 61, train_loss: 0.4912, test_loss: 1.0782, test_f1: 0.6517
 epoch: 62, train_loss: 0.5080, test_loss: 1.1013, test_f1: 0.6369
 epoch: 63, train_loss: 0.4797, test_loss: 1.1215, test_f1: 0.6355
 epoch: 64, train_loss: 0.4883, test_loss: 1.1089, test_f1: 0.6599
 epoch: 65, train_loss: 0.4691, test_loss: 1.1021, test_f1: 0.6594
 epoch: 66, train_loss: 0.4545, test_loss: 1.1918, test_f1: 0.6424
 epoch: 67, train_loss: 0.4747, test_loss: 1.1395, test_f1: 0.6744
 epoch: 68, train_loss: 0.4546, test_loss: 1.1757, test_f1: 0.6682
 epoch: 69, train_loss: 0.4496, test_loss: 1.1820, test_f1: 0.6564
 epoch: 70, train_loss: 0.4594, test_loss: 1.1609, test_f1: 0.6671
 epoch: 71, train_loss: 0.4514, test_loss: 1.1713, test_f1: 0.6946
 epoch: 72, train_loss: 0.4498, test_loss: 1.1790, test_f1: 0.6616
 epoch: 73, train_loss: 0.4310, test_loss: 1.1496, test_f1: 0.6790
 epoch: 74, train_loss: 0.4424, test_loss: 1.2058, test_f1: 0.6727
 epoch: 75, train_loss: 0.4540, test_loss: 1.2533, test_f1: 0.6314
 epoch: 76, train_loss: 0.4433, test_loss: 1.1745, test_f1: 0.7065
 epoch: 77, train_loss: 0.4347, test_loss: 1.2011, test_f1: 0.6857
 epoch: 78, train_loss: 0.4346, test_loss: 1.1849, test_f1: 0.6720
 epoch: 79, train_loss: 0.4332, test_loss: 1.2460, test_f1: 0.6679
 epoch: 80, train_loss: 0.4124, test_loss: 1.2387, test_f1: 0.6510
 epoch: 81, train_loss: 0.4204, test_loss: 1.2537, test_f1: 0.6639
 epoch: 82, train_loss: 0.4093, test_loss: 1.2805, test_f1: 0.6271
 epoch: 83, train_loss: 0.4041, test_loss: 1.2143, test_f1: 0.6439
 epoch: 84, train_loss: 0.4116, test_loss: 1.2183, test_f1: 0.6484
 epoch: 85, train_loss: 0.4012, test_loss: 1.2593, test_f1: 0.6791
 epoch: 86, train_loss: 0.3893, test_loss: 1.3093, test_f1: 0.6500
 epoch: 87, train_loss: 0.4063, test_loss: 1.2243, test_f1: 0.6708
 epoch: 88, train_loss: 0.3960, test_loss: 1.3233, test_f1: 0.6744
 epoch: 89, train_loss: 0.4037, test_loss: 1.3390, test_f1: 0.6583
 epoch: 90, train_loss: 0.3762, test_loss: 1.2837, test_f1: 0.6714
 epoch: 91, train_loss: 0.3613, test_loss: 1.2816, test_f1: 0.6627
 epoch: 92, train_loss: 0.3790, test_loss: 1.3355, test_f1: 0.6799
 epoch: 93, train_loss: 0.3798, test_loss: 1.3524, test_f1: 0.6586
 epoch: 94, train_loss: 0.3758, test_loss: 1.3125, test_f1: 0.6574
 epoch: 95, train_loss: 0.3694, test_loss: 1.4198, test_f1: 0.6381
 epoch: 96, train_loss: 0.3372, test_loss: 1.3675, test_f1: 0.6426
 epoch: 97, train_loss: 0.3688, test_loss: 1.3543, test_f1: 0.6761
 epoch: 98, train_loss: 0.3642, test_loss: 1.4564, test_f1: 0.6667
 epoch: 99, train_loss: 0.3633, test_loss: 1.3051, test_f1: 0.6709
##################ITERATION #5 ****************************************
 epoch: 0, train_loss: 1.2597, test_loss: 1.0534, test_f1: 0.4578
 epoch: 1, train_loss: 1.0355, test_loss: 0.9886, test_f1: 0.4462
 epoch: 2, train_loss: 0.9884, test_loss: 0.9616, test_f1: 0.4820
 epoch: 3, train_loss: 0.9561, test_loss: 0.9863, test_f1: 0.5075
 epoch: 4, train_loss: 0.9465, test_loss: 0.9340, test_f1: 0.4970
 epoch: 5, train_loss: 0.9262, test_loss: 0.9531, test_f1: 0.4935
 epoch: 6, train_loss: 0.9098, test_loss: 0.9455, test_f1: 0.5022
 epoch: 7, train_loss: 0.9090, test_loss: 0.9763, test_f1: 0.4968
 epoch: 8, train_loss: 0.9004, test_loss: 0.9538, test_f1: 0.5160
 epoch: 9, train_loss: 0.8631, test_loss: 0.9695, test_f1: 0.5285
 epoch: 10, train_loss: 0.8753, test_loss: 0.9333, test_f1: 0.5201
 epoch: 11, train_loss: 0.8524, test_loss: 0.9425, test_f1: 0.5321
 epoch: 12, train_loss: 0.8529, test_loss: 0.9541, test_f1: 0.5419
 epoch: 13, train_loss: 0.8576, test_loss: 0.8947, test_f1: 0.5590
 epoch: 14, train_loss: 0.8473, test_loss: 0.9318, test_f1: 0.5315
 epoch: 15, train_loss: 0.8269, test_loss: 0.9244, test_f1: 0.5298
 epoch: 16, train_loss: 0.8138, test_loss: 0.9270, test_f1: 0.5435
 epoch: 17, train_loss: 0.8095, test_loss: 0.9511, test_f1: 0.5527
 epoch: 18, train_loss: 0.8034, test_loss: 0.9550, test_f1: 0.5433
 epoch: 19, train_loss: 0.7995, test_loss: 0.8881, test_f1: 0.5777
 epoch: 20, train_loss: 0.7886, test_loss: 0.8897, test_f1: 0.5738
 epoch: 21, train_loss: 0.7738, test_loss: 0.9305, test_f1: 0.5742
 epoch: 22, train_loss: 0.7703, test_loss: 0.9198, test_f1: 0.5674
 epoch: 23, train_loss: 0.7606, test_loss: 0.9026, test_f1: 0.5798
 epoch: 24, train_loss: 0.7718, test_loss: 0.9248, test_f1: 0.5828
 epoch: 25, train_loss: 0.7553, test_loss: 0.8658, test_f1: 0.5744
 epoch: 26, train_loss: 0.7637, test_loss: 0.9278, test_f1: 0.5560
 epoch: 27, train_loss: 0.7749, test_loss: 0.8601, test_f1: 0.5927
 epoch: 28, train_loss: 0.7541, test_loss: 0.9959, test_f1: 0.5419
 epoch: 29, train_loss: 0.7358, test_loss: 0.9044, test_f1: 0.5764
 epoch: 30, train_loss: 0.7250, test_loss: 0.8980, test_f1: 0.6025
 epoch: 31, train_loss: 0.7261, test_loss: 0.8992, test_f1: 0.5986
 epoch: 32, train_loss: 0.7094, test_loss: 0.8964, test_f1: 0.5812
 epoch: 33, train_loss: 0.6918, test_loss: 0.9289, test_f1: 0.5815
 epoch: 34, train_loss: 0.6867, test_loss: 0.9754, test_f1: 0.5955
 epoch: 35, train_loss: 0.6844, test_loss: 0.9454, test_f1: 0.6107
 epoch: 36, train_loss: 0.7094, test_loss: 1.0050, test_f1: 0.6168
 epoch: 37, train_loss: 0.7018, test_loss: 0.9486, test_f1: 0.5854
 epoch: 38, train_loss: 0.6930, test_loss: 0.9221, test_f1: 0.5998
 epoch: 39, train_loss: 0.6886, test_loss: 0.9360, test_f1: 0.5897
 epoch: 40, train_loss: 0.6643, test_loss: 0.9763, test_f1: 0.5951
 epoch: 41, train_loss: 0.6516, test_loss: 0.9971, test_f1: 0.6179
 epoch: 42, train_loss: 0.6619, test_loss: 1.0020, test_f1: 0.5936
 epoch: 43, train_loss: 0.6533, test_loss: 0.9573, test_f1: 0.6015
 epoch: 44, train_loss: 0.6542, test_loss: 0.9361, test_f1: 0.6465
 epoch: 45, train_loss: 0.6497, test_loss: 0.9953, test_f1: 0.6263
 epoch: 46, train_loss: 0.6558, test_loss: 0.9604, test_f1: 0.6015
 epoch: 47, train_loss: 0.6398, test_loss: 0.9951, test_f1: 0.6102
 epoch: 48, train_loss: 0.6274, test_loss: 1.0376, test_f1: 0.6012
 epoch: 49, train_loss: 0.6192, test_loss: 0.9847, test_f1: 0.6253
 epoch: 50, train_loss: 0.6099, test_loss: 0.9693, test_f1: 0.6488
 epoch: 51, train_loss: 0.5634, test_loss: 1.0212, test_f1: 0.6470
 epoch: 52, train_loss: 0.5530, test_loss: 1.0174, test_f1: 0.6513
 epoch: 53, train_loss: 0.5397, test_loss: 1.0213, test_f1: 0.6211
 epoch: 54, train_loss: 0.5379, test_loss: 1.0494, test_f1: 0.6302
 epoch: 55, train_loss: 0.5226, test_loss: 1.0339, test_f1: 0.6426
 epoch: 56, train_loss: 0.5230, test_loss: 1.1140, test_f1: 0.6107
 epoch: 57, train_loss: 0.5090, test_loss: 1.0646, test_f1: 0.6538
 epoch: 58, train_loss: 0.5126, test_loss: 1.0435, test_f1: 0.6664
 epoch: 59, train_loss: 0.5130, test_loss: 1.0842, test_f1: 0.6190
 epoch: 60, train_loss: 0.4986, test_loss: 1.0793, test_f1: 0.6284
 epoch: 61, train_loss: 0.4846, test_loss: 1.1003, test_f1: 0.6287
 epoch: 62, train_loss: 0.4778, test_loss: 1.0921, test_f1: 0.6305
 epoch: 63, train_loss: 0.4798, test_loss: 1.1506, test_f1: 0.6341
 epoch: 64, train_loss: 0.4967, test_loss: 1.1162, test_f1: 0.6442
 epoch: 65, train_loss: 0.4762, test_loss: 1.1383, test_f1: 0.6245
 epoch: 66, train_loss: 0.4797, test_loss: 1.1130, test_f1: 0.6319
 epoch: 67, train_loss: 0.4814, test_loss: 1.1748, test_f1: 0.6161
 epoch: 68, train_loss: 0.4684, test_loss: 1.2195, test_f1: 0.6401
 epoch: 69, train_loss: 0.4731, test_loss: 1.1631, test_f1: 0.6602
 epoch: 70, train_loss: 0.4545, test_loss: 1.1631, test_f1: 0.6297
 epoch: 71, train_loss: 0.4595, test_loss: 1.2339, test_f1: 0.6265
 epoch: 72, train_loss: 0.4549, test_loss: 1.2188, test_f1: 0.6514
 epoch: 73, train_loss: 0.4524, test_loss: 1.1785, test_f1: 0.6413
 epoch: 74, train_loss: 0.4496, test_loss: 1.2954, test_f1: 0.6510
 epoch: 75, train_loss: 0.4365, test_loss: 1.2704, test_f1: 0.6342
 epoch: 76, train_loss: 0.4253, test_loss: 1.2719, test_f1: 0.6224
 epoch: 77, train_loss: 0.4276, test_loss: 1.2548, test_f1: 0.6437
 epoch: 78, train_loss: 0.4484, test_loss: 1.3002, test_f1: 0.6349
 epoch: 79, train_loss: 0.4272, test_loss: 1.2874, test_f1: 0.6506
 epoch: 80, train_loss: 0.4379, test_loss: 1.2461, test_f1: 0.6316
 epoch: 81, train_loss: 0.4083, test_loss: 1.3321, test_f1: 0.6229
 epoch: 82, train_loss: 0.4162, test_loss: 1.2367, test_f1: 0.6570
 epoch: 83, train_loss: 0.4064, test_loss: 1.3714, test_f1: 0.6513
 epoch: 84, train_loss: 0.3979, test_loss: 1.2802, test_f1: 0.6402
 epoch: 85, train_loss: 0.3883, test_loss: 1.2751, test_f1: 0.6443
 epoch: 86, train_loss: 0.4094, test_loss: 1.3748, test_f1: 0.6303
 epoch: 87, train_loss: 0.3969, test_loss: 1.3257, test_f1: 0.6580
 epoch: 88, train_loss: 0.3972, test_loss: 1.3147, test_f1: 0.6507
 epoch: 89, train_loss: 0.4145, test_loss: 1.3356, test_f1: 0.6379
 epoch: 90, train_loss: 0.3944, test_loss: 1.3551, test_f1: 0.6529
 epoch: 91, train_loss: 0.3898, test_loss: 1.3178, test_f1: 0.6765
 epoch: 92, train_loss: 0.3872, test_loss: 1.4292, test_f1: 0.6561
 epoch: 93, train_loss: 0.3935, test_loss: 1.3556, test_f1: 0.6489
 epoch: 94, train_loss: 0.3797, test_loss: 1.3483, test_f1: 0.6521
 epoch: 95, train_loss: 0.3760, test_loss: 1.4783, test_f1: 0.6318
 epoch: 96, train_loss: 0.3718, test_loss: 1.3796, test_f1: 0.6540
 epoch: 97, train_loss: 0.3762, test_loss: 1.4406, test_f1: 0.6180
 epoch: 98, train_loss: 0.3827, test_loss: 1.4111, test_f1: 0.6394
 epoch: 99, train_loss: 0.3598, test_loss: 1.4315, test_f1: 0.6465
##################ITERATION #6 ****************************************
 epoch: 0, train_loss: 1.3324, test_loss: 1.0590, test_f1: 0.4426
 epoch: 1, train_loss: 1.0608, test_loss: 0.9889, test_f1: 0.4577
 epoch: 2, train_loss: 1.0056, test_loss: 0.9876, test_f1: 0.4673
 epoch: 3, train_loss: 0.9742, test_loss: 0.9917, test_f1: 0.4729
 epoch: 4, train_loss: 0.9500, test_loss: 0.9811, test_f1: 0.4596
 epoch: 5, train_loss: 0.9376, test_loss: 0.9494, test_f1: 0.5344
 epoch: 6, train_loss: 0.9232, test_loss: 0.9344, test_f1: 0.5314
 epoch: 7, train_loss: 0.9092, test_loss: 0.9343, test_f1: 0.5316
 epoch: 8, train_loss: 0.8952, test_loss: 0.9396, test_f1: 0.5096
 epoch: 9, train_loss: 0.8838, test_loss: 0.9300, test_f1: 0.5402
 epoch: 10, train_loss: 0.8710, test_loss: 0.9384, test_f1: 0.5338
 epoch: 11, train_loss: 0.8638, test_loss: 0.9345, test_f1: 0.5532
 epoch: 12, train_loss: 0.8579, test_loss: 0.9135, test_f1: 0.5360
 epoch: 13, train_loss: 0.8566, test_loss: 0.9418, test_f1: 0.5189
 epoch: 14, train_loss: 0.8372, test_loss: 0.9363, test_f1: 0.5501
 epoch: 15, train_loss: 0.8303, test_loss: 0.9501, test_f1: 0.5793
 epoch: 16, train_loss: 0.8356, test_loss: 0.9104, test_f1: 0.5409
 epoch: 17, train_loss: 0.8298, test_loss: 0.9447, test_f1: 0.5422
 epoch: 18, train_loss: 0.8366, test_loss: 0.9799, test_f1: 0.5352
 epoch: 19, train_loss: 0.8108, test_loss: 0.8860, test_f1: 0.5916
 epoch: 20, train_loss: 0.8089, test_loss: 0.8983, test_f1: 0.5562
 epoch: 21, train_loss: 0.8108, test_loss: 0.9338, test_f1: 0.5475
 epoch: 22, train_loss: 0.8003, test_loss: 0.9303, test_f1: 0.5888
 epoch: 23, train_loss: 0.7817, test_loss: 0.9326, test_f1: 0.5994
 epoch: 24, train_loss: 0.7910, test_loss: 0.9507, test_f1: 0.5650
 epoch: 25, train_loss: 0.7644, test_loss: 0.9288, test_f1: 0.5778
 epoch: 26, train_loss: 0.7450, test_loss: 0.9268, test_f1: 0.6026
 epoch: 27, train_loss: 0.7556, test_loss: 0.9070, test_f1: 0.5631
 epoch: 28, train_loss: 0.7482, test_loss: 0.9966, test_f1: 0.5517
 epoch: 29, train_loss: 0.7385, test_loss: 0.8956, test_f1: 0.6048
 epoch: 30, train_loss: 0.7483, test_loss: 0.9617, test_f1: 0.5583
 epoch: 31, train_loss: 0.7417, test_loss: 0.9156, test_f1: 0.5905
 epoch: 32, train_loss: 0.7282, test_loss: 0.9186, test_f1: 0.6104
 epoch: 33, train_loss: 0.7099, test_loss: 0.9864, test_f1: 0.5837
 epoch: 34, train_loss: 0.7119, test_loss: 0.9378, test_f1: 0.5628
 epoch: 35, train_loss: 0.7140, test_loss: 0.9476, test_f1: 0.5885
 epoch: 36, train_loss: 0.7075, test_loss: 0.9390, test_f1: 0.6052
 epoch: 37, train_loss: 0.6910, test_loss: 0.9253, test_f1: 0.5852
 epoch: 38, train_loss: 0.6888, test_loss: 0.9699, test_f1: 0.5846
 epoch: 39, train_loss: 0.6837, test_loss: 0.9603, test_f1: 0.5880
 epoch: 40, train_loss: 0.6730, test_loss: 0.9231, test_f1: 0.5996
 epoch: 41, train_loss: 0.6629, test_loss: 1.0161, test_f1: 0.5768
 epoch: 42, train_loss: 0.6568, test_loss: 0.9549, test_f1: 0.6223
 epoch: 43, train_loss: 0.6705, test_loss: 0.8984, test_f1: 0.5915
 epoch: 44, train_loss: 0.6558, test_loss: 0.9313, test_f1: 0.6150
 epoch: 45, train_loss: 0.6455, test_loss: 0.9711, test_f1: 0.6036
 epoch: 46, train_loss: 0.6357, test_loss: 1.0205, test_f1: 0.6013
 epoch: 47, train_loss: 0.6187, test_loss: 0.9798, test_f1: 0.5924
 epoch: 48, train_loss: 0.6271, test_loss: 1.0528, test_f1: 0.5876
 epoch: 49, train_loss: 0.6394, test_loss: 0.9786, test_f1: 0.5999
 epoch: 50, train_loss: 0.6072, test_loss: 0.9676, test_f1: 0.6351
 epoch: 51, train_loss: 0.5930, test_loss: 1.0066, test_f1: 0.6236
 epoch: 52, train_loss: 0.5677, test_loss: 0.9481, test_f1: 0.6560
 epoch: 53, train_loss: 0.5647, test_loss: 1.0180, test_f1: 0.6192
 epoch: 54, train_loss: 0.5449, test_loss: 0.9899, test_f1: 0.6262
 epoch: 55, train_loss: 0.5455, test_loss: 1.0143, test_f1: 0.6301
 epoch: 56, train_loss: 0.5330, test_loss: 0.9809, test_f1: 0.6365
 epoch: 57, train_loss: 0.5457, test_loss: 0.9686, test_f1: 0.6476
 epoch: 58, train_loss: 0.5323, test_loss: 1.0425, test_f1: 0.6093
 epoch: 59, train_loss: 0.5231, test_loss: 0.9586, test_f1: 0.6331
 epoch: 60, train_loss: 0.5011, test_loss: 1.0129, test_f1: 0.6211
 epoch: 61, train_loss: 0.5002, test_loss: 1.0299, test_f1: 0.6493
 epoch: 62, train_loss: 0.5039, test_loss: 1.0751, test_f1: 0.6499
 epoch: 63, train_loss: 0.5012, test_loss: 1.0527, test_f1: 0.6001
 epoch: 64, train_loss: 0.4846, test_loss: 1.0297, test_f1: 0.6230
 epoch: 65, train_loss: 0.4740, test_loss: 1.0692, test_f1: 0.6289
 epoch: 66, train_loss: 0.4833, test_loss: 1.0695, test_f1: 0.6080
 epoch: 67, train_loss: 0.4766, test_loss: 1.0679, test_f1: 0.6089
 epoch: 68, train_loss: 0.4861, test_loss: 1.1433, test_f1: 0.6123
 epoch: 69, train_loss: 0.4955, test_loss: 1.0529, test_f1: 0.6361
 epoch: 70, train_loss: 0.4678, test_loss: 1.0876, test_f1: 0.6153
 epoch: 71, train_loss: 0.4568, test_loss: 1.0601, test_f1: 0.6367
 epoch: 72, train_loss: 0.4463, test_loss: 1.0419, test_f1: 0.6707
 epoch: 73, train_loss: 0.4465, test_loss: 1.0835, test_f1: 0.6397
 epoch: 74, train_loss: 0.4731, test_loss: 1.0812, test_f1: 0.6167
 epoch: 75, train_loss: 0.4520, test_loss: 1.0915, test_f1: 0.6391
 epoch: 76, train_loss: 0.4485, test_loss: 1.0906, test_f1: 0.6280
 epoch: 77, train_loss: 0.4570, test_loss: 1.1556, test_f1: 0.6389
 epoch: 78, train_loss: 0.4344, test_loss: 1.0587, test_f1: 0.6283
 epoch: 79, train_loss: 0.4361, test_loss: 1.0956, test_f1: 0.6609
 epoch: 80, train_loss: 0.4151, test_loss: 1.1218, test_f1: 0.6318
 epoch: 81, train_loss: 0.4245, test_loss: 1.1387, test_f1: 0.6390
 epoch: 82, train_loss: 0.4345, test_loss: 1.1161, test_f1: 0.6307
 epoch: 83, train_loss: 0.4256, test_loss: 1.1405, test_f1: 0.6501
 epoch: 84, train_loss: 0.4249, test_loss: 1.1734, test_f1: 0.6416
 epoch: 85, train_loss: 0.4148, test_loss: 1.1510, test_f1: 0.6490
 epoch: 86, train_loss: 0.3989, test_loss: 1.1824, test_f1: 0.6336
 epoch: 87, train_loss: 0.4109, test_loss: 1.1341, test_f1: 0.6235
 epoch: 88, train_loss: 0.3937, test_loss: 1.2338, test_f1: 0.6314
 epoch: 89, train_loss: 0.3953, test_loss: 1.1808, test_f1: 0.6395
 epoch: 90, train_loss: 0.3987, test_loss: 1.2584, test_f1: 0.6213
 epoch: 91, train_loss: 0.3937, test_loss: 1.2294, test_f1: 0.6437
 epoch: 92, train_loss: 0.3993, test_loss: 1.2585, test_f1: 0.6379
 epoch: 93, train_loss: 0.3803, test_loss: 1.2025, test_f1: 0.6332
 epoch: 94, train_loss: 0.3812, test_loss: 1.1982, test_f1: 0.6377
 epoch: 95, train_loss: 0.3765, test_loss: 1.2408, test_f1: 0.6564
 epoch: 96, train_loss: 0.3816, test_loss: 1.1639, test_f1: 0.6344
 epoch: 97, train_loss: 0.3614, test_loss: 1.3955, test_f1: 0.6172
 epoch: 98, train_loss: 0.3765, test_loss: 1.1850, test_f1: 0.6436
 epoch: 99, train_loss: 0.3515, test_loss: 1.3131, test_f1: 0.6437
##################ITERATION #7 ****************************************
 epoch: 0, train_loss: 1.3075, test_loss: 1.0318, test_f1: 0.4484
 epoch: 1, train_loss: 1.0646, test_loss: 0.9665, test_f1: 0.4836
 epoch: 2, train_loss: 1.0112, test_loss: 0.9264, test_f1: 0.4666
 epoch: 3, train_loss: 0.9857, test_loss: 0.9534, test_f1: 0.4845
 epoch: 4, train_loss: 0.9380, test_loss: 0.9434, test_f1: 0.4828
 epoch: 5, train_loss: 0.9183, test_loss: 0.9459, test_f1: 0.5447
 epoch: 6, train_loss: 0.9208, test_loss: 0.9231, test_f1: 0.4917
 epoch: 7, train_loss: 0.9073, test_loss: 0.9230, test_f1: 0.5383
 epoch: 8, train_loss: 0.8946, test_loss: 0.9223, test_f1: 0.4931
 epoch: 9, train_loss: 0.8744, test_loss: 0.9409, test_f1: 0.5376
 epoch: 10, train_loss: 0.8580, test_loss: 0.9491, test_f1: 0.5476
 epoch: 11, train_loss: 0.8577, test_loss: 0.9169, test_f1: 0.5372
 epoch: 12, train_loss: 0.8491, test_loss: 0.9421, test_f1: 0.5626
 epoch: 13, train_loss: 0.8361, test_loss: 0.9717, test_f1: 0.5273
 epoch: 14, train_loss: 0.8301, test_loss: 0.9435, test_f1: 0.5343
 epoch: 15, train_loss: 0.8320, test_loss: 0.9416, test_f1: 0.5253
 epoch: 16, train_loss: 0.8188, test_loss: 0.9007, test_f1: 0.5806
 epoch: 17, train_loss: 0.8051, test_loss: 0.8804, test_f1: 0.5924
 epoch: 18, train_loss: 0.7889, test_loss: 0.8890, test_f1: 0.5730
 epoch: 19, train_loss: 0.7853, test_loss: 0.9288, test_f1: 0.5657
 epoch: 20, train_loss: 0.7709, test_loss: 0.9561, test_f1: 0.5931
 epoch: 21, train_loss: 0.7801, test_loss: 0.8644, test_f1: 0.6124
 epoch: 22, train_loss: 0.7843, test_loss: 0.9667, test_f1: 0.5430
 epoch: 23, train_loss: 0.7777, test_loss: 1.0079, test_f1: 0.5839
 epoch: 24, train_loss: 0.7715, test_loss: 0.9781, test_f1: 0.5781
 epoch: 25, train_loss: 0.7490, test_loss: 0.9472, test_f1: 0.5537
 epoch: 26, train_loss: 0.7422, test_loss: 0.8785, test_f1: 0.6007
 epoch: 27, train_loss: 0.7431, test_loss: 0.9020, test_f1: 0.6098
 epoch: 28, train_loss: 0.7421, test_loss: 0.8750, test_f1: 0.5807
 epoch: 29, train_loss: 0.7307, test_loss: 0.9856, test_f1: 0.6033
 epoch: 30, train_loss: 0.7132, test_loss: 0.9416, test_f1: 0.5755
 epoch: 31, train_loss: 0.7101, test_loss: 0.9463, test_f1: 0.5642
 epoch: 32, train_loss: 0.7166, test_loss: 1.0275, test_f1: 0.6075
 epoch: 33, train_loss: 0.7133, test_loss: 0.9961, test_f1: 0.5516
 epoch: 34, train_loss: 0.6905, test_loss: 0.9770, test_f1: 0.6107
 epoch: 35, train_loss: 0.7066, test_loss: 0.9409, test_f1: 0.6261
 epoch: 36, train_loss: 0.6923, test_loss: 1.0075, test_f1: 0.6338
 epoch: 37, train_loss: 0.6843, test_loss: 0.9743, test_f1: 0.6474
 epoch: 38, train_loss: 0.6658, test_loss: 0.9700, test_f1: 0.6111
 epoch: 39, train_loss: 0.6616, test_loss: 0.9064, test_f1: 0.6587
 epoch: 40, train_loss: 0.6686, test_loss: 0.9449, test_f1: 0.6480
 epoch: 41, train_loss: 0.6681, test_loss: 0.9748, test_f1: 0.5863
 epoch: 42, train_loss: 0.6534, test_loss: 1.0313, test_f1: 0.6067
 epoch: 43, train_loss: 0.6414, test_loss: 0.8972, test_f1: 0.6499
 epoch: 44, train_loss: 0.6502, test_loss: 1.0114, test_f1: 0.6118
 epoch: 45, train_loss: 0.6370, test_loss: 1.0070, test_f1: 0.6443
 epoch: 46, train_loss: 0.6440, test_loss: 0.9657, test_f1: 0.6555
 epoch: 47, train_loss: 0.6235, test_loss: 0.9286, test_f1: 0.6483
 epoch: 48, train_loss: 0.6182, test_loss: 0.9327, test_f1: 0.6669
 epoch: 49, train_loss: 0.6157, test_loss: 1.0138, test_f1: 0.5917
 epoch: 50, train_loss: 0.6077, test_loss: 0.9882, test_f1: 0.6610
 epoch: 51, train_loss: 0.5731, test_loss: 0.9577, test_f1: 0.6552
 epoch: 52, train_loss: 0.5419, test_loss: 0.9763, test_f1: 0.6446
 epoch: 53, train_loss: 0.5505, test_loss: 1.0136, test_f1: 0.6397
 epoch: 54, train_loss: 0.5291, test_loss: 0.9771, test_f1: 0.6494
 epoch: 55, train_loss: 0.5221, test_loss: 0.9764, test_f1: 0.6455
 epoch: 56, train_loss: 0.5203, test_loss: 1.0153, test_f1: 0.6704
 epoch: 57, train_loss: 0.5096, test_loss: 1.0605, test_f1: 0.6412
 epoch: 58, train_loss: 0.5104, test_loss: 0.9984, test_f1: 0.6708
 epoch: 59, train_loss: 0.5006, test_loss: 1.0201, test_f1: 0.6679
 epoch: 60, train_loss: 0.4907, test_loss: 1.0757, test_f1: 0.6432
 epoch: 61, train_loss: 0.5098, test_loss: 1.1082, test_f1: 0.6128
 epoch: 62, train_loss: 0.4995, test_loss: 1.0213, test_f1: 0.6614
 epoch: 63, train_loss: 0.4747, test_loss: 1.0435, test_f1: 0.6519
 epoch: 64, train_loss: 0.4711, test_loss: 1.0817, test_f1: 0.6361
 epoch: 65, train_loss: 0.4636, test_loss: 1.0992, test_f1: 0.6529
 epoch: 66, train_loss: 0.4912, test_loss: 1.0322, test_f1: 0.6616
 epoch: 67, train_loss: 0.4608, test_loss: 1.0761, test_f1: 0.6435
 epoch: 68, train_loss: 0.4695, test_loss: 1.0698, test_f1: 0.6453
 epoch: 69, train_loss: 0.4633, test_loss: 1.1271, test_f1: 0.6661
 epoch: 70, train_loss: 0.4666, test_loss: 1.1389, test_f1: 0.6286
 epoch: 71, train_loss: 0.4615, test_loss: 1.0645, test_f1: 0.6489
 epoch: 72, train_loss: 0.4517, test_loss: 1.0756, test_f1: 0.6953
 epoch: 73, train_loss: 0.4405, test_loss: 1.0917, test_f1: 0.6680
 epoch: 74, train_loss: 0.4169, test_loss: 1.0502, test_f1: 0.6448
 epoch: 75, train_loss: 0.4377, test_loss: 1.1793, test_f1: 0.6232
 epoch: 76, train_loss: 0.4411, test_loss: 1.1553, test_f1: 0.6341
 epoch: 77, train_loss: 0.4445, test_loss: 1.2511, test_f1: 0.6425
 epoch: 78, train_loss: 0.4438, test_loss: 1.1208, test_f1: 0.6909
 epoch: 79, train_loss: 0.4271, test_loss: 1.1715, test_f1: 0.6424
 epoch: 80, train_loss: 0.4253, test_loss: 1.1432, test_f1: 0.6558
 epoch: 81, train_loss: 0.4083, test_loss: 1.2446, test_f1: 0.6767
 epoch: 82, train_loss: 0.4245, test_loss: 1.1500, test_f1: 0.6923
 epoch: 83, train_loss: 0.4053, test_loss: 1.1990, test_f1: 0.6676
 epoch: 84, train_loss: 0.4035, test_loss: 1.2584, test_f1: 0.6501
 epoch: 85, train_loss: 0.4118, test_loss: 1.2466, test_f1: 0.6263
 epoch: 86, train_loss: 0.3868, test_loss: 1.2277, test_f1: 0.6533
 epoch: 87, train_loss: 0.3970, test_loss: 1.2653, test_f1: 0.6372
 epoch: 88, train_loss: 0.3864, test_loss: 1.1921, test_f1: 0.6613
 epoch: 89, train_loss: 0.3626, test_loss: 1.1969, test_f1: 0.6801
 epoch: 90, train_loss: 0.3934, test_loss: 1.2101, test_f1: 0.6323
 epoch: 91, train_loss: 0.3806, test_loss: 1.1712, test_f1: 0.6653
 epoch: 92, train_loss: 0.3874, test_loss: 1.1965, test_f1: 0.6740
 epoch: 93, train_loss: 0.3801, test_loss: 1.2418, test_f1: 0.6680
 epoch: 94, train_loss: 0.3606, test_loss: 1.2253, test_f1: 0.6652
 epoch: 95, train_loss: 0.3783, test_loss: 1.4188, test_f1: 0.6474
 epoch: 96, train_loss: 0.3719, test_loss: 1.3385, test_f1: 0.6307
 epoch: 97, train_loss: 0.3834, test_loss: 1.1723, test_f1: 0.6748
 epoch: 98, train_loss: 0.3496, test_loss: 1.3357, test_f1: 0.6462
 epoch: 99, train_loss: 0.3557, test_loss: 1.2597, test_f1: 0.6680
##################ITERATION #8 ****************************************
 epoch: 0, train_loss: 1.3250, test_loss: 1.0477, test_f1: 0.4651
 epoch: 1, train_loss: 1.0729, test_loss: 0.9647, test_f1: 0.4746
 epoch: 2, train_loss: 1.0083, test_loss: 0.9490, test_f1: 0.4763
 epoch: 3, train_loss: 0.9833, test_loss: 0.9396, test_f1: 0.4904
 epoch: 4, train_loss: 0.9653, test_loss: 0.9802, test_f1: 0.4667
 epoch: 5, train_loss: 0.9323, test_loss: 0.9347, test_f1: 0.4904
 epoch: 6, train_loss: 0.9169, test_loss: 0.9405, test_f1: 0.5145
 epoch: 7, train_loss: 0.9004, test_loss: 0.9563, test_f1: 0.5198
 epoch: 8, train_loss: 0.9107, test_loss: 0.9073, test_f1: 0.5458
 epoch: 9, train_loss: 0.8829, test_loss: 0.8751, test_f1: 0.5240
 epoch: 10, train_loss: 0.8637, test_loss: 1.0088, test_f1: 0.5293
 epoch: 11, train_loss: 0.8617, test_loss: 0.9896, test_f1: 0.5198
 epoch: 12, train_loss: 0.8573, test_loss: 0.9121, test_f1: 0.5547
 epoch: 13, train_loss: 0.8454, test_loss: 0.9020, test_f1: 0.5472
 epoch: 14, train_loss: 0.8408, test_loss: 0.9297, test_f1: 0.5782
 epoch: 15, train_loss: 0.8274, test_loss: 0.9548, test_f1: 0.5675
 epoch: 16, train_loss: 0.8166, test_loss: 1.0346, test_f1: 0.5450
 epoch: 17, train_loss: 0.8062, test_loss: 0.9507, test_f1: 0.5851
 epoch: 18, train_loss: 0.7879, test_loss: 0.9224, test_f1: 0.6094
 epoch: 19, train_loss: 0.7954, test_loss: 0.9653, test_f1: 0.5693
 epoch: 20, train_loss: 0.7831, test_loss: 0.9399, test_f1: 0.5930
 epoch: 21, train_loss: 0.7806, test_loss: 0.9591, test_f1: 0.5971
 epoch: 22, train_loss: 0.7677, test_loss: 0.9937, test_f1: 0.5897
 epoch: 23, train_loss: 0.7642, test_loss: 0.9596, test_f1: 0.5836
 epoch: 24, train_loss: 0.7517, test_loss: 0.9545, test_f1: 0.6271
 epoch: 25, train_loss: 0.7554, test_loss: 0.9925, test_f1: 0.6128
 epoch: 26, train_loss: 0.7405, test_loss: 0.9076, test_f1: 0.6042
 epoch: 27, train_loss: 0.7399, test_loss: 0.9484, test_f1: 0.6047
 epoch: 28, train_loss: 0.7521, test_loss: 0.9471, test_f1: 0.5702
 epoch: 29, train_loss: 0.7279, test_loss: 0.9971, test_f1: 0.6114
 epoch: 30, train_loss: 0.7315, test_loss: 0.9678, test_f1: 0.6037
 epoch: 31, train_loss: 0.7228, test_loss: 0.9489, test_f1: 0.5989
 epoch: 32, train_loss: 0.7057, test_loss: 0.9632, test_f1: 0.6172
 epoch: 33, train_loss: 0.7094, test_loss: 0.9677, test_f1: 0.6166
 epoch: 34, train_loss: 0.6920, test_loss: 0.9906, test_f1: 0.6148
 epoch: 35, train_loss: 0.7087, test_loss: 0.9384, test_f1: 0.6236
 epoch: 36, train_loss: 0.6781, test_loss: 0.9372, test_f1: 0.6064
 epoch: 37, train_loss: 0.6742, test_loss: 0.9555, test_f1: 0.6093
 epoch: 38, train_loss: 0.6743, test_loss: 0.9496, test_f1: 0.6077
 epoch: 39, train_loss: 0.6742, test_loss: 0.9817, test_f1: 0.5661
 epoch: 40, train_loss: 0.6911, test_loss: 0.9981, test_f1: 0.6178
 epoch: 41, train_loss: 0.6764, test_loss: 0.9534, test_f1: 0.6121
 epoch: 42, train_loss: 0.6663, test_loss: 0.9692, test_f1: 0.6369
 epoch: 43, train_loss: 0.6652, test_loss: 1.0543, test_f1: 0.6112
 epoch: 44, train_loss: 0.6805, test_loss: 1.0290, test_f1: 0.6210
 epoch: 45, train_loss: 0.6425, test_loss: 1.0184, test_f1: 0.6115
 epoch: 46, train_loss: 0.6294, test_loss: 0.9910, test_f1: 0.6313
 epoch: 47, train_loss: 0.6253, test_loss: 1.0511, test_f1: 0.6332
 epoch: 48, train_loss: 0.6261, test_loss: 1.0817, test_f1: 0.6038
 epoch: 49, train_loss: 0.6204, test_loss: 1.0717, test_f1: 0.6289
 epoch: 50, train_loss: 0.6386, test_loss: 1.0173, test_f1: 0.6293
 epoch: 51, train_loss: 0.5770, test_loss: 0.9907, test_f1: 0.6426
 epoch: 52, train_loss: 0.5493, test_loss: 1.0642, test_f1: 0.6430
 epoch: 53, train_loss: 0.5457, test_loss: 1.0293, test_f1: 0.6204
 epoch: 54, train_loss: 0.5489, test_loss: 0.9966, test_f1: 0.6369
 epoch: 55, train_loss: 0.5400, test_loss: 1.0829, test_f1: 0.6510
 epoch: 56, train_loss: 0.5370, test_loss: 1.0347, test_f1: 0.6427
 epoch: 57, train_loss: 0.5400, test_loss: 1.0853, test_f1: 0.6507
 epoch: 58, train_loss: 0.5271, test_loss: 1.0620, test_f1: 0.6874
 epoch: 59, train_loss: 0.4974, test_loss: 1.0381, test_f1: 0.6520
 epoch: 60, train_loss: 0.5071, test_loss: 1.0804, test_f1: 0.6550
 epoch: 61, train_loss: 0.4929, test_loss: 1.0863, test_f1: 0.6483
 epoch: 62, train_loss: 0.5045, test_loss: 1.0482, test_f1: 0.6664
 epoch: 63, train_loss: 0.4988, test_loss: 1.1264, test_f1: 0.6600
 epoch: 64, train_loss: 0.4960, test_loss: 1.0810, test_f1: 0.6461
 epoch: 65, train_loss: 0.4815, test_loss: 1.0739, test_f1: 0.6683
 epoch: 66, train_loss: 0.4816, test_loss: 1.1090, test_f1: 0.6731
 epoch: 67, train_loss: 0.4739, test_loss: 1.1288, test_f1: 0.6501
 epoch: 68, train_loss: 0.4909, test_loss: 1.1435, test_f1: 0.6679
 epoch: 69, train_loss: 0.4611, test_loss: 1.1792, test_f1: 0.6631
 epoch: 70, train_loss: 0.4614, test_loss: 1.1151, test_f1: 0.6587
 epoch: 71, train_loss: 0.4516, test_loss: 1.1310, test_f1: 0.6864
 epoch: 72, train_loss: 0.4527, test_loss: 1.1837, test_f1: 0.6441
 epoch: 73, train_loss: 0.4512, test_loss: 1.1437, test_f1: 0.6621
 epoch: 74, train_loss: 0.4679, test_loss: 1.1508, test_f1: 0.6555
 epoch: 75, train_loss: 0.4486, test_loss: 1.1203, test_f1: 0.6760
 epoch: 76, train_loss: 0.4352, test_loss: 1.0913, test_f1: 0.6629
 epoch: 77, train_loss: 0.4304, test_loss: 1.1582, test_f1: 0.6637
 epoch: 78, train_loss: 0.4252, test_loss: 1.2260, test_f1: 0.6302
 epoch: 79, train_loss: 0.4400, test_loss: 1.1768, test_f1: 0.6490
 epoch: 80, train_loss: 0.4392, test_loss: 1.2106, test_f1: 0.6519
 epoch: 81, train_loss: 0.4177, test_loss: 1.2276, test_f1: 0.6446
 epoch: 82, train_loss: 0.4150, test_loss: 1.1591, test_f1: 0.6983
 epoch: 83, train_loss: 0.3929, test_loss: 1.1864, test_f1: 0.6460
 epoch: 84, train_loss: 0.4125, test_loss: 1.2195, test_f1: 0.6691
 epoch: 85, train_loss: 0.4110, test_loss: 1.1593, test_f1: 0.6814
 epoch: 86, train_loss: 0.3992, test_loss: 1.2388, test_f1: 0.6680
 epoch: 87, train_loss: 0.4054, test_loss: 1.2218, test_f1: 0.6851
 epoch: 88, train_loss: 0.3907, test_loss: 1.2232, test_f1: 0.6441
 epoch: 89, train_loss: 0.3976, test_loss: 1.1753, test_f1: 0.6484
 epoch: 90, train_loss: 0.3824, test_loss: 1.2045, test_f1: 0.6816
 epoch: 91, train_loss: 0.3842, test_loss: 1.2091, test_f1: 0.6861
 epoch: 92, train_loss: 0.3697, test_loss: 1.2601, test_f1: 0.6700
 epoch: 93, train_loss: 0.3938, test_loss: 1.2485, test_f1: 0.6855
 epoch: 94, train_loss: 0.3911, test_loss: 1.2477, test_f1: 0.6551
 epoch: 95, train_loss: 0.3800, test_loss: 1.2495, test_f1: 0.6548
 epoch: 96, train_loss: 0.3814, test_loss: 1.2088, test_f1: 0.6757
 epoch: 97, train_loss: 0.3679, test_loss: 1.2849, test_f1: 0.6489
 epoch: 98, train_loss: 0.3490, test_loss: 1.2882, test_f1: 0.6611
 epoch: 99, train_loss: 0.3801, test_loss: 1.2060, test_f1: 0.6822
##################ITERATION #9 ****************************************
 epoch: 0, train_loss: 1.3433, test_loss: 1.0694, test_f1: 0.4360
 epoch: 1, train_loss: 1.0569, test_loss: 0.9952, test_f1: 0.4487
 epoch: 2, train_loss: 1.0068, test_loss: 0.9876, test_f1: 0.4574
 epoch: 3, train_loss: 0.9626, test_loss: 0.9907, test_f1: 0.4623
 epoch: 4, train_loss: 0.9554, test_loss: 0.9504, test_f1: 0.5261
 epoch: 5, train_loss: 0.9299, test_loss: 1.0274, test_f1: 0.5042
 epoch: 6, train_loss: 0.9217, test_loss: 0.9767, test_f1: 0.4972
 epoch: 7, train_loss: 0.8998, test_loss: 0.9651, test_f1: 0.5382
 epoch: 8, train_loss: 0.8906, test_loss: 0.9560, test_f1: 0.5274
 epoch: 9, train_loss: 0.8869, test_loss: 0.9494, test_f1: 0.5360
 epoch: 10, train_loss: 0.8570, test_loss: 0.9801, test_f1: 0.4923
 epoch: 11, train_loss: 0.8665, test_loss: 0.9724, test_f1: 0.5681
 epoch: 12, train_loss: 0.8427, test_loss: 0.9120, test_f1: 0.5486
 epoch: 13, train_loss: 0.8488, test_loss: 0.9666, test_f1: 0.5326
 epoch: 14, train_loss: 0.8379, test_loss: 0.8999, test_f1: 0.5488
 epoch: 15, train_loss: 0.8178, test_loss: 0.9674, test_f1: 0.5410
 epoch: 16, train_loss: 0.8125, test_loss: 0.8938, test_f1: 0.5359
 epoch: 17, train_loss: 0.8109, test_loss: 0.9490, test_f1: 0.5705
 epoch: 18, train_loss: 0.7985, test_loss: 0.9040, test_f1: 0.5674
 epoch: 19, train_loss: 0.7955, test_loss: 0.9436, test_f1: 0.5466
 epoch: 20, train_loss: 0.7884, test_loss: 0.9293, test_f1: 0.5538
 epoch: 21, train_loss: 0.7679, test_loss: 1.0246, test_f1: 0.5487
 epoch: 22, train_loss: 0.7826, test_loss: 0.9373, test_f1: 0.6104
 epoch: 23, train_loss: 0.7662, test_loss: 0.9566, test_f1: 0.5773
 epoch: 24, train_loss: 0.7453, test_loss: 0.9550, test_f1: 0.5884
 epoch: 25, train_loss: 0.7510, test_loss: 0.9445, test_f1: 0.5723
 epoch: 26, train_loss: 0.7454, test_loss: 0.9262, test_f1: 0.6268
 epoch: 27, train_loss: 0.7168, test_loss: 0.9319, test_f1: 0.5995
 epoch: 28, train_loss: 0.7110, test_loss: 0.9252, test_f1: 0.6132
 epoch: 29, train_loss: 0.7231, test_loss: 0.8958, test_f1: 0.6221
 epoch: 30, train_loss: 0.7226, test_loss: 0.9430, test_f1: 0.5902
 epoch: 31, train_loss: 0.7223, test_loss: 0.9560, test_f1: 0.5981
 epoch: 32, train_loss: 0.7124, test_loss: 0.9601, test_f1: 0.6132
 epoch: 33, train_loss: 0.7077, test_loss: 0.9878, test_f1: 0.5931
 epoch: 34, train_loss: 0.7176, test_loss: 1.0060, test_f1: 0.5799
 epoch: 35, train_loss: 0.7006, test_loss: 0.9943, test_f1: 0.5510
 epoch: 36, train_loss: 0.6943, test_loss: 0.9515, test_f1: 0.6183
 epoch: 37, train_loss: 0.6859, test_loss: 0.9708, test_f1: 0.6046
 epoch: 38, train_loss: 0.6674, test_loss: 1.0192, test_f1: 0.5889
 epoch: 39, train_loss: 0.6667, test_loss: 1.0172, test_f1: 0.5754
 epoch: 40, train_loss: 0.6585, test_loss: 0.9242, test_f1: 0.6168
 epoch: 41, train_loss: 0.6360, test_loss: 1.0681, test_f1: 0.5891
 epoch: 42, train_loss: 0.6548, test_loss: 0.9692, test_f1: 0.6060
 epoch: 43, train_loss: 0.6505, test_loss: 0.9746, test_f1: 0.5900
 epoch: 44, train_loss: 0.6449, test_loss: 0.9443, test_f1: 0.6168
 epoch: 45, train_loss: 0.6339, test_loss: 0.9508, test_f1: 0.6294
 epoch: 46, train_loss: 0.6089, test_loss: 0.9187, test_f1: 0.6010
 epoch: 47, train_loss: 0.6356, test_loss: 1.0193, test_f1: 0.6211
 epoch: 48, train_loss: 0.5996, test_loss: 0.9990, test_f1: 0.6141
 epoch: 49, train_loss: 0.6076, test_loss: 1.0456, test_f1: 0.6072
 epoch: 50, train_loss: 0.6007, test_loss: 1.0831, test_f1: 0.6139
 epoch: 51, train_loss: 0.5696, test_loss: 1.0022, test_f1: 0.6234
 epoch: 52, train_loss: 0.5428, test_loss: 1.0556, test_f1: 0.6427
 epoch: 53, train_loss: 0.5470, test_loss: 1.0318, test_f1: 0.6488
 epoch: 54, train_loss: 0.5359, test_loss: 1.1499, test_f1: 0.6153
 epoch: 55, train_loss: 0.5394, test_loss: 1.0770, test_f1: 0.6203
 epoch: 56, train_loss: 0.5199, test_loss: 1.0722, test_f1: 0.6327
 epoch: 57, train_loss: 0.5128, test_loss: 1.0863, test_f1: 0.6213
 epoch: 58, train_loss: 0.4996, test_loss: 1.1548, test_f1: 0.6335
 epoch: 59, train_loss: 0.5047, test_loss: 1.1704, test_f1: 0.6214
 epoch: 60, train_loss: 0.5084, test_loss: 1.0859, test_f1: 0.6445
 epoch: 61, train_loss: 0.5019, test_loss: 1.0436, test_f1: 0.6648
 epoch: 62, train_loss: 0.4937, test_loss: 1.1290, test_f1: 0.6274
 epoch: 63, train_loss: 0.4817, test_loss: 1.0985, test_f1: 0.6380
 epoch: 64, train_loss: 0.4938, test_loss: 1.0791, test_f1: 0.6689
 epoch: 65, train_loss: 0.4692, test_loss: 1.0697, test_f1: 0.6547
 epoch: 66, train_loss: 0.4863, test_loss: 1.0982, test_f1: 0.6512
 epoch: 67, train_loss: 0.4658, test_loss: 1.1085, test_f1: 0.6511
 epoch: 68, train_loss: 0.4646, test_loss: 1.1633, test_f1: 0.6192
 epoch: 69, train_loss: 0.4629, test_loss: 1.1704, test_f1: 0.6468
 epoch: 70, train_loss: 0.4582, test_loss: 1.1220, test_f1: 0.6525
 epoch: 71, train_loss: 0.4542, test_loss: 1.2353, test_f1: 0.6114
 epoch: 72, train_loss: 0.4584, test_loss: 1.2245, test_f1: 0.6346
 epoch: 73, train_loss: 0.4581, test_loss: 1.1575, test_f1: 0.6511
 epoch: 74, train_loss: 0.4431, test_loss: 1.1492, test_f1: 0.6632
 epoch: 75, train_loss: 0.4504, test_loss: 1.1191, test_f1: 0.6315
 epoch: 76, train_loss: 0.4411, test_loss: 1.2182, test_f1: 0.6198
 epoch: 77, train_loss: 0.4472, test_loss: 1.2095, test_f1: 0.6289
 epoch: 78, train_loss: 0.4430, test_loss: 1.2147, test_f1: 0.6191
 epoch: 79, train_loss: 0.4190, test_loss: 1.1749, test_f1: 0.6491
 epoch: 80, train_loss: 0.4243, test_loss: 1.2364, test_f1: 0.6427
 epoch: 81, train_loss: 0.4278, test_loss: 1.1884, test_f1: 0.6616
 epoch: 82, train_loss: 0.4244, test_loss: 1.1772, test_f1: 0.6605
 epoch: 83, train_loss: 0.4316, test_loss: 1.3312, test_f1: 0.6303
 epoch: 84, train_loss: 0.4172, test_loss: 1.3175, test_f1: 0.6289
 epoch: 85, train_loss: 0.4118, test_loss: 1.1908, test_f1: 0.6554
 epoch: 86, train_loss: 0.3858, test_loss: 1.3295, test_f1: 0.6290
 epoch: 87, train_loss: 0.4054, test_loss: 1.2674, test_f1: 0.6315
 epoch: 88, train_loss: 0.3840, test_loss: 1.2829, test_f1: 0.6570
 epoch: 89, train_loss: 0.4058, test_loss: 1.2809, test_f1: 0.6539
 epoch: 90, train_loss: 0.3642, test_loss: 1.3048, test_f1: 0.6484
 epoch: 91, train_loss: 0.3810, test_loss: 1.2794, test_f1: 0.6566
 epoch: 92, train_loss: 0.3716, test_loss: 1.2572, test_f1: 0.6572
 epoch: 93, train_loss: 0.3721, test_loss: 1.2635, test_f1: 0.6359
 epoch: 94, train_loss: 0.3729, test_loss: 1.3698, test_f1: 0.6357
 epoch: 95, train_loss: 0.3666, test_loss: 1.3546, test_f1: 0.6324
 epoch: 96, train_loss: 0.3718, test_loss: 1.2778, test_f1: 0.6515
 epoch: 97, train_loss: 0.3765, test_loss: 1.4468, test_f1: 0.6107
 epoch: 98, train_loss: 0.3866, test_loss: 1.2980, test_f1: 0.6419
 epoch: 99, train_loss: 0.3482, test_loss: 1.4199, test_f1: 0.6531

Training completed in 1026.44 seconds
Best F1: 0.7065 at epoch 76
Mean F1 across iterations: 0.6839  0.0139
========================FINAL RESULTS================================
FEGIN weighted F1: 0.7065  0.0139
python main.py --data ltspice_examples --representation component_net --model FEGIN --layers 5 --hiddens 64 --batch_size 64 --lr 0.001 --emb_size 512 --epochs 100 --save_appendix component_net_L5_H64_BS64_LR0.001_E512 --no_val
-----



STDERR:
  File "main.py", line 370, in <module>
    main()
  File "main.py", line 254, in main
    dataset = dataset_class(
  File "/home/philip/projects/llm_inference_code_repo/Circuit-Completion-Using-GNNs/component_classification_with_link_prediction_head/evaluation/FEGIN/kernel/circuit_datasets.py", line 15, in __init__
    self.data, self.slices = torch.load(self.processed_paths[0])
  File "/home/philip/.local/lib/python3.8/site-packages/torch/serialization.py", line 1040, in load
    warnings.warn(
  File "/usr/lib/python3.8/warnings.py", line 109, in _showwarnmsg
    sw(msg.message, msg.category, msg.filename, msg.lineno,
  File "main.py", line 47, in warn_with_traceback
    traceback.print_stack(file=log)
/home/philip/projects/llm_inference_code_repo/Circuit-Completion-Using-GNNs/component_classification_with_link_prediction_head/evaluation/FEGIN/kernel/circuit_datasets.py:15: FutureWarning: You are using `torch.load` with `weights_only=False` (the current default value), which uses the default pickle module implicitly. It is possible to construct malicious pickle data which will execute arbitrary code during unpickling (See https://github.com/pytorch/pytorch/blob/main/SECURITY.md#untrusted-models for more details). In a future release, the default value for `weights_only` will be flipped to `True`. This limits the functions that could be executed during unpickling. Arbitrary objects will no longer be allowed to be loaded via this mode unless they are explicitly allowlisted by the user via `torch.serialization.add_safe_globals`. We recommend you start setting `weights_only=True` for any use case where you don't have full control of the loaded file. Please open an issue on GitHub for any issues related to this experimental feature.
  self.data, self.slices = torch.load(self.processed_paths[0])
