STDOUT:
Results will be saved in /home/philip/projects/ltspice_examples_code_repo/Circuit-Completion-Using-GNNs/component_classification_with_link_prediction_head/evaluation/FEGIN/results/model_FEGIN_dataset_ltspice_examples
Command line input: python main.py --data ltspice_examples --representation component_component --model FEGIN --layers 2 --hiddens 64 --batch_size 32 --lr 0.01 --emb_size 512 --epochs 100 --save_appendix component_component_L2_H64_BS32_LR0.01_E512 --no_val
 is saved.
-----
ltspice_examples - FEGIN
Using 2 layers, 64 hidden units, h = 2
Loading component_component representation dataset
ENTERED
Training FEGIN on component_component representation
Train: 3556, Test: 845
##################ITERATION #0 ****************************************
 epoch: 0, train_loss: 1.2338, test_loss: 1.1164, test_f1: 0.3876
 epoch: 1, train_loss: 1.0885, test_loss: 0.9956, test_f1: 0.4685
 epoch: 2, train_loss: 1.0355, test_loss: 1.0213, test_f1: 0.4361
 epoch: 3, train_loss: 1.0097, test_loss: 0.9945, test_f1: 0.4745
 epoch: 4, train_loss: 0.9741, test_loss: 1.0578, test_f1: 0.4880
 epoch: 5, train_loss: 0.9747, test_loss: 0.9575, test_f1: 0.5352
 epoch: 6, train_loss: 0.9559, test_loss: 1.0122, test_f1: 0.5114
 epoch: 7, train_loss: 0.9362, test_loss: 1.0856, test_f1: 0.5498
 epoch: 8, train_loss: 0.9547, test_loss: 1.0305, test_f1: 0.4732
 epoch: 9, train_loss: 0.9120, test_loss: 0.9912, test_f1: 0.5580
 epoch: 10, train_loss: 0.9091, test_loss: 1.0245, test_f1: 0.5274
 epoch: 11, train_loss: 0.9455, test_loss: 1.0527, test_f1: 0.5318
 epoch: 12, train_loss: 0.9131, test_loss: 0.9593, test_f1: 0.5576
 epoch: 13, train_loss: 0.9016, test_loss: 1.1092, test_f1: 0.5123
 epoch: 14, train_loss: 0.8867, test_loss: 1.0486, test_f1: 0.5471
 epoch: 15, train_loss: 0.9157, test_loss: 1.0297, test_f1: 0.5509
 epoch: 16, train_loss: 0.9178, test_loss: 0.9791, test_f1: 0.5286
 epoch: 17, train_loss: 0.8977, test_loss: 1.0087, test_f1: 0.5209
 epoch: 18, train_loss: 0.8789, test_loss: 1.2723, test_f1: 0.5036
 epoch: 19, train_loss: 0.8829, test_loss: 1.0019, test_f1: 0.5148
 epoch: 20, train_loss: 0.8770, test_loss: 0.9941, test_f1: 0.5543
 epoch: 21, train_loss: 0.8674, test_loss: 0.9392, test_f1: 0.5706
 epoch: 22, train_loss: 0.8810, test_loss: 0.9687, test_f1: 0.5596
 epoch: 23, train_loss: 0.9104, test_loss: 0.9344, test_f1: 0.5271
 epoch: 24, train_loss: 0.8855, test_loss: 0.9331, test_f1: 0.5472
 epoch: 25, train_loss: 0.8437, test_loss: 1.1166, test_f1: 0.5467
 epoch: 26, train_loss: 0.8579, test_loss: 1.1399, test_f1: 0.5173
 epoch: 27, train_loss: 0.8284, test_loss: 0.9770, test_f1: 0.5453
 epoch: 28, train_loss: 0.8407, test_loss: 1.0260, test_f1: 0.5600
 epoch: 29, train_loss: 0.8316, test_loss: 1.1692, test_f1: 0.5104
 epoch: 30, train_loss: 0.8454, test_loss: 1.1886, test_f1: 0.5258
 epoch: 31, train_loss: 0.8386, test_loss: 0.9746, test_f1: 0.5405
 epoch: 32, train_loss: 0.8304, test_loss: 0.9777, test_f1: 0.5429
 epoch: 33, train_loss: 0.8360, test_loss: 1.0152, test_f1: 0.5020
 epoch: 34, train_loss: 0.8296, test_loss: 1.1037, test_f1: 0.5265
 epoch: 35, train_loss: 0.8229, test_loss: 0.9030, test_f1: 0.5236
 epoch: 36, train_loss: 0.8193, test_loss: 0.9759, test_f1: 0.5615
 epoch: 37, train_loss: 0.8244, test_loss: 1.0161, test_f1: 0.5455
 epoch: 38, train_loss: 0.7948, test_loss: 0.9720, test_f1: 0.5445
 epoch: 39, train_loss: 0.7892, test_loss: 0.9679, test_f1: 0.5317
 epoch: 40, train_loss: 0.8247, test_loss: 1.1410, test_f1: 0.5054
 epoch: 41, train_loss: 0.8061, test_loss: 1.0756, test_f1: 0.5325
 epoch: 42, train_loss: 0.8015, test_loss: 0.9492, test_f1: 0.5170
 epoch: 43, train_loss: 0.7856, test_loss: 1.2229, test_f1: 0.5107
 epoch: 44, train_loss: 0.7940, test_loss: 1.0647, test_f1: 0.5493
 epoch: 45, train_loss: 0.7818, test_loss: 1.0214, test_f1: 0.5815
 epoch: 46, train_loss: 0.8071, test_loss: 1.1105, test_f1: 0.5337
 epoch: 47, train_loss: 0.8266, test_loss: 1.0456, test_f1: 0.5405
 epoch: 48, train_loss: 0.7801, test_loss: 1.1865, test_f1: 0.5344
 epoch: 49, train_loss: 0.7896, test_loss: 1.0852, test_f1: 0.5469
 epoch: 50, train_loss: 0.7647, test_loss: 1.0012, test_f1: 0.5634
 epoch: 51, train_loss: 0.7456, test_loss: 1.0197, test_f1: 0.5180
 epoch: 52, train_loss: 0.7279, test_loss: 0.9552, test_f1: 0.5454
 epoch: 53, train_loss: 0.7100, test_loss: 0.9786, test_f1: 0.5624
 epoch: 54, train_loss: 0.7073, test_loss: 0.9888, test_f1: 0.5476
 epoch: 55, train_loss: 0.7092, test_loss: 0.9746, test_f1: 0.5309
 epoch: 56, train_loss: 0.7020, test_loss: 0.9917, test_f1: 0.5652
 epoch: 57, train_loss: 0.7042, test_loss: 1.1050, test_f1: 0.5302
 epoch: 58, train_loss: 0.7056, test_loss: 1.0939, test_f1: 0.5853
 epoch: 59, train_loss: 0.6886, test_loss: 0.9577, test_f1: 0.5695
 epoch: 60, train_loss: 0.7046, test_loss: 1.0609, test_f1: 0.5295
 epoch: 61, train_loss: 0.7058, test_loss: 0.9874, test_f1: 0.5249
 epoch: 62, train_loss: 0.6959, test_loss: 1.0300, test_f1: 0.5355
 epoch: 63, train_loss: 0.6996, test_loss: 0.9917, test_f1: 0.5665
 epoch: 64, train_loss: 0.6823, test_loss: 1.1095, test_f1: 0.5454
 epoch: 65, train_loss: 0.6865, test_loss: 0.9948, test_f1: 0.5554
 epoch: 66, train_loss: 0.6849, test_loss: 0.9806, test_f1: 0.5499
 epoch: 67, train_loss: 0.6943, test_loss: 1.0146, test_f1: 0.5374
 epoch: 68, train_loss: 0.6676, test_loss: 1.0501, test_f1: 0.5522
 epoch: 69, train_loss: 0.6741, test_loss: 1.0865, test_f1: 0.5433
 epoch: 70, train_loss: 0.6725, test_loss: 1.0266, test_f1: 0.5368
 epoch: 71, train_loss: 0.6738, test_loss: 1.0302, test_f1: 0.5496
 epoch: 72, train_loss: 0.6639, test_loss: 1.0173, test_f1: 0.5294
 epoch: 73, train_loss: 0.6654, test_loss: 1.0058, test_f1: 0.5558
 epoch: 74, train_loss: 0.6678, test_loss: 1.0513, test_f1: 0.5731
 epoch: 75, train_loss: 0.6687, test_loss: 1.0473, test_f1: 0.5672
 epoch: 76, train_loss: 0.6757, test_loss: 1.0822, test_f1: 0.5258
 epoch: 77, train_loss: 0.6530, test_loss: 1.0300, test_f1: 0.5298
 epoch: 78, train_loss: 0.6681, test_loss: 1.0571, test_f1: 0.5449
 epoch: 79, train_loss: 0.6577, test_loss: 1.0578, test_f1: 0.5495
 epoch: 80, train_loss: 0.6567, test_loss: 1.1556, test_f1: 0.5346
 epoch: 81, train_loss: 0.6658, test_loss: 1.0554, test_f1: 0.5165
 epoch: 82, train_loss: 0.6578, test_loss: 1.1499, test_f1: 0.5164
 epoch: 83, train_loss: 0.6395, test_loss: 1.0159, test_f1: 0.5815
 epoch: 84, train_loss: 0.6396, test_loss: 1.0853, test_f1: 0.5340
 epoch: 85, train_loss: 0.6306, test_loss: 1.1302, test_f1: 0.5360
 epoch: 86, train_loss: 0.6461, test_loss: 1.0649, test_f1: 0.5508
 epoch: 87, train_loss: 0.6518, test_loss: 1.3267, test_f1: 0.5379
 epoch: 88, train_loss: 0.6261, test_loss: 1.1658, test_f1: 0.5274
 epoch: 89, train_loss: 0.6223, test_loss: 1.0993, test_f1: 0.5319
 epoch: 90, train_loss: 0.6236, test_loss: 1.0653, test_f1: 0.5664
 epoch: 91, train_loss: 0.6237, test_loss: 1.1204, test_f1: 0.5482
 epoch: 92, train_loss: 0.6151, test_loss: 1.0198, test_f1: 0.5501
 epoch: 93, train_loss: 0.6734, test_loss: 1.1798, test_f1: 0.5456
 epoch: 94, train_loss: 0.6322, test_loss: 0.9791, test_f1: 0.5732
 epoch: 95, train_loss: 0.6470, test_loss: 1.0775, test_f1: 0.5671
 epoch: 96, train_loss: 0.6222, test_loss: 1.0675, test_f1: 0.5736
 epoch: 97, train_loss: 0.6153, test_loss: 1.0599, test_f1: 0.5826
 epoch: 98, train_loss: 0.6297, test_loss: 1.1425, test_f1: 0.5388
 epoch: 99, train_loss: 0.6389, test_loss: 0.9758, test_f1: 0.5387
##################ITERATION #1 ****************************************
 epoch: 0, train_loss: 1.2780, test_loss: 1.2810, test_f1: 0.3509
 epoch: 1, train_loss: 1.1857, test_loss: 1.0570, test_f1: 0.4647
 epoch: 2, train_loss: 1.0912, test_loss: 1.0095, test_f1: 0.4728
 epoch: 3, train_loss: 1.0509, test_loss: 1.0544, test_f1: 0.4958
 epoch: 4, train_loss: 1.0226, test_loss: 1.0699, test_f1: 0.5211
 epoch: 5, train_loss: 0.9943, test_loss: 1.0349, test_f1: 0.5446
 epoch: 6, train_loss: 0.9768, test_loss: 0.9838, test_f1: 0.4666
 epoch: 7, train_loss: 0.9655, test_loss: 1.0731, test_f1: 0.5011
 epoch: 8, train_loss: 0.9574, test_loss: 1.0239, test_f1: 0.4511
 epoch: 9, train_loss: 0.9411, test_loss: 1.0291, test_f1: 0.4891
 epoch: 10, train_loss: 0.9314, test_loss: 1.0959, test_f1: 0.4920
 epoch: 11, train_loss: 0.9262, test_loss: 1.0177, test_f1: 0.5439
 epoch: 12, train_loss: 0.9263, test_loss: 1.0797, test_f1: 0.5257
 epoch: 13, train_loss: 0.9166, test_loss: 1.0316, test_f1: 0.4961
 epoch: 14, train_loss: 0.9031, test_loss: 1.2146, test_f1: 0.4703
 epoch: 15, train_loss: 0.9180, test_loss: 0.9706, test_f1: 0.5405
 epoch: 16, train_loss: 0.8949, test_loss: 1.0171, test_f1: 0.5123
 epoch: 17, train_loss: 0.9175, test_loss: 1.0262, test_f1: 0.4831
 epoch: 18, train_loss: 0.8847, test_loss: 0.9745, test_f1: 0.4936
 epoch: 19, train_loss: 0.8729, test_loss: 1.0161, test_f1: 0.4860
 epoch: 20, train_loss: 0.8778, test_loss: 1.0728, test_f1: 0.4643
 epoch: 21, train_loss: 0.8754, test_loss: 1.0193, test_f1: 0.4960
 epoch: 22, train_loss: 0.9397, test_loss: 1.4251, test_f1: 0.4458
 epoch: 23, train_loss: 0.9356, test_loss: 0.9436, test_f1: 0.5029
 epoch: 24, train_loss: 0.8952, test_loss: 0.9567, test_f1: 0.5326
 epoch: 25, train_loss: 0.9049, test_loss: 1.0846, test_f1: 0.4557
 epoch: 26, train_loss: 0.8957, test_loss: 1.1269, test_f1: 0.4652
 epoch: 27, train_loss: 0.9316, test_loss: 0.9395, test_f1: 0.4970
 epoch: 28, train_loss: 0.8956, test_loss: 1.0961, test_f1: 0.4934
 epoch: 29, train_loss: 0.8825, test_loss: 1.0367, test_f1: 0.4926
 epoch: 30, train_loss: 0.8694, test_loss: 1.0465, test_f1: 0.4638
 epoch: 31, train_loss: 0.8492, test_loss: 0.9899, test_f1: 0.5282
 epoch: 32, train_loss: 0.8539, test_loss: 0.9821, test_f1: 0.5247
 epoch: 33, train_loss: 0.8446, test_loss: 1.0535, test_f1: 0.4982
 epoch: 34, train_loss: 0.8491, test_loss: 1.0596, test_f1: 0.5373
 epoch: 35, train_loss: 0.8604, test_loss: 0.9921, test_f1: 0.5456
 epoch: 36, train_loss: 0.8469, test_loss: 1.0483, test_f1: 0.5522
 epoch: 37, train_loss: 0.8424, test_loss: 1.0882, test_f1: 0.4625
 epoch: 38, train_loss: 0.8070, test_loss: 1.0598, test_f1: 0.5566
 epoch: 39, train_loss: 0.8296, test_loss: 1.0065, test_f1: 0.5342
 epoch: 40, train_loss: 0.8301, test_loss: 1.3793, test_f1: 0.4896
 epoch: 41, train_loss: 0.8335, test_loss: 1.0892, test_f1: 0.4983
 epoch: 42, train_loss: 0.8255, test_loss: 0.9839, test_f1: 0.5450
 epoch: 43, train_loss: 0.8023, test_loss: 1.1674, test_f1: 0.5079
 epoch: 44, train_loss: 0.8153, test_loss: 1.1478, test_f1: 0.4856
 epoch: 45, train_loss: 0.8282, test_loss: 1.1267, test_f1: 0.5295
 epoch: 46, train_loss: 0.8426, test_loss: 1.3702, test_f1: 0.4928
 epoch: 47, train_loss: 0.9165, test_loss: 1.0108, test_f1: 0.4942
 epoch: 48, train_loss: 0.8477, test_loss: 1.1337, test_f1: 0.5012
 epoch: 49, train_loss: 0.8792, test_loss: 1.0711, test_f1: 0.5054
 epoch: 50, train_loss: 0.8341, test_loss: 0.9815, test_f1: 0.5220
 epoch: 51, train_loss: 0.8053, test_loss: 1.1607, test_f1: 0.5345
 epoch: 52, train_loss: 0.7807, test_loss: 1.1290, test_f1: 0.5372
 epoch: 53, train_loss: 0.7763, test_loss: 1.1436, test_f1: 0.5506
 epoch: 54, train_loss: 0.7623, test_loss: 1.1895, test_f1: 0.5518
 epoch: 55, train_loss: 0.7775, test_loss: 1.1636, test_f1: 0.5774
 epoch: 56, train_loss: 0.7583, test_loss: 1.1702, test_f1: 0.5542
 epoch: 57, train_loss: 0.7451, test_loss: 1.3282, test_f1: 0.5316
 epoch: 58, train_loss: 0.7754, test_loss: 1.2889, test_f1: 0.4973
 epoch: 59, train_loss: 0.8473, test_loss: 1.1195, test_f1: 0.5420
 epoch: 60, train_loss: 0.7829, test_loss: 1.2512, test_f1: 0.5278
 epoch: 61, train_loss: 0.7752, test_loss: 1.1150, test_f1: 0.5740
 epoch: 62, train_loss: 0.7659, test_loss: 1.2226, test_f1: 0.5712
 epoch: 63, train_loss: 0.7597, test_loss: 1.1645, test_f1: 0.5639
 epoch: 64, train_loss: 0.7554, test_loss: 1.1778, test_f1: 0.5460
 epoch: 65, train_loss: 0.7502, test_loss: 1.2676, test_f1: 0.5631
 epoch: 66, train_loss: 0.7400, test_loss: 1.3582, test_f1: 0.5200
 epoch: 67, train_loss: 0.7317, test_loss: 1.4437, test_f1: 0.5550
 epoch: 68, train_loss: 0.7236, test_loss: 1.4160, test_f1: 0.5367
 epoch: 69, train_loss: 0.7051, test_loss: 1.2664, test_f1: 0.5747
 epoch: 70, train_loss: 0.7131, test_loss: 1.1994, test_f1: 0.5535
 epoch: 71, train_loss: 0.7314, test_loss: 1.2100, test_f1: 0.5196
 epoch: 72, train_loss: 0.7091, test_loss: 1.1722, test_f1: 0.5562
 epoch: 73, train_loss: 0.7103, test_loss: 1.1164, test_f1: 0.5601
 epoch: 74, train_loss: 0.7053, test_loss: 1.3708, test_f1: 0.5448
 epoch: 75, train_loss: 0.7133, test_loss: 1.2299, test_f1: 0.5448
 epoch: 76, train_loss: 0.7012, test_loss: 1.0995, test_f1: 0.5584
 epoch: 77, train_loss: 0.6880, test_loss: 1.2382, test_f1: 0.5548
 epoch: 78, train_loss: 0.7000, test_loss: 1.2731, test_f1: 0.5506
 epoch: 79, train_loss: 0.6960, test_loss: 1.4305, test_f1: 0.5315
 epoch: 80, train_loss: 0.6872, test_loss: 1.4567, test_f1: 0.5280
 epoch: 81, train_loss: 0.7029, test_loss: 1.2053, test_f1: 0.5400
 epoch: 82, train_loss: 0.7237, test_loss: 1.0169, test_f1: 0.5564
 epoch: 83, train_loss: 0.6881, test_loss: 1.2812, test_f1: 0.5263
 epoch: 84, train_loss: 0.7138, test_loss: 1.2458, test_f1: 0.5227
 epoch: 85, train_loss: 0.6882, test_loss: 1.3341, test_f1: 0.5461
 epoch: 86, train_loss: 0.6919, test_loss: 1.0661, test_f1: 0.5619
 epoch: 87, train_loss: 0.6787, test_loss: 1.2441, test_f1: 0.5436
 epoch: 88, train_loss: 0.6775, test_loss: 1.0925, test_f1: 0.5565
 epoch: 89, train_loss: 0.6640, test_loss: 1.1292, test_f1: 0.5449
 epoch: 90, train_loss: 0.6605, test_loss: 1.1024, test_f1: 0.5674
 epoch: 91, train_loss: 0.6868, test_loss: 1.1321, test_f1: 0.5529
 epoch: 92, train_loss: 0.6638, test_loss: 1.3776, test_f1: 0.5629
 epoch: 93, train_loss: 0.6521, test_loss: 1.5524, test_f1: 0.5670
 epoch: 94, train_loss: 0.6723, test_loss: 1.7245, test_f1: 0.5471
 epoch: 95, train_loss: 0.6996, test_loss: 1.2135, test_f1: 0.5440
 epoch: 96, train_loss: 0.6631, test_loss: 1.2108, test_f1: 0.5300
 epoch: 97, train_loss: 0.6485, test_loss: 1.1512, test_f1: 0.5761
 epoch: 98, train_loss: 0.6406, test_loss: 1.3437, test_f1: 0.5643
 epoch: 99, train_loss: 0.6500, test_loss: 1.4406, test_f1: 0.5545
##################ITERATION #2 ****************************************
 epoch: 0, train_loss: 1.2598, test_loss: 1.2125, test_f1: 0.3846
 epoch: 1, train_loss: 1.1302, test_loss: 1.0001, test_f1: 0.5165
 epoch: 2, train_loss: 1.0606, test_loss: 0.9832, test_f1: 0.5172
 epoch: 3, train_loss: 1.0315, test_loss: 0.9711, test_f1: 0.4786
 epoch: 4, train_loss: 1.0407, test_loss: 0.9087, test_f1: 0.5114
 epoch: 5, train_loss: 1.0070, test_loss: 1.0648, test_f1: 0.4406
 epoch: 6, train_loss: 0.9914, test_loss: 0.9580, test_f1: 0.4953
 epoch: 7, train_loss: 0.9733, test_loss: 0.9856, test_f1: 0.5386
 epoch: 8, train_loss: 0.9788, test_loss: 0.9859, test_f1: 0.5011
 epoch: 9, train_loss: 0.9545, test_loss: 1.0776, test_f1: 0.5303
 epoch: 10, train_loss: 0.9516, test_loss: 1.0246, test_f1: 0.5018
 epoch: 11, train_loss: 0.9307, test_loss: 0.9536, test_f1: 0.5146
 epoch: 12, train_loss: 0.9371, test_loss: 0.9897, test_f1: 0.5064
 epoch: 13, train_loss: 0.9238, test_loss: 0.9979, test_f1: 0.5798
 epoch: 14, train_loss: 0.9288, test_loss: 0.9656, test_f1: 0.5284
 epoch: 15, train_loss: 0.9137, test_loss: 0.9610, test_f1: 0.5318
 epoch: 16, train_loss: 0.9164, test_loss: 0.9656, test_f1: 0.5350
 epoch: 17, train_loss: 0.8998, test_loss: 0.9667, test_f1: 0.5208
 epoch: 18, train_loss: 0.9073, test_loss: 1.0276, test_f1: 0.5326
 epoch: 19, train_loss: 0.8946, test_loss: 1.1314, test_f1: 0.5412
 epoch: 20, train_loss: 0.9151, test_loss: 0.9645, test_f1: 0.5185
 epoch: 21, train_loss: 0.8970, test_loss: 0.9996, test_f1: 0.5582
 epoch: 22, train_loss: 0.8780, test_loss: 1.0092, test_f1: 0.5507
 epoch: 23, train_loss: 0.8784, test_loss: 0.9739, test_f1: 0.5364
 epoch: 24, train_loss: 0.8673, test_loss: 0.9797, test_f1: 0.5061
 epoch: 25, train_loss: 0.8920, test_loss: 1.0613, test_f1: 0.5044
 epoch: 26, train_loss: 0.8696, test_loss: 1.1139, test_f1: 0.4994
 epoch: 27, train_loss: 0.8773, test_loss: 1.0872, test_f1: 0.5241
 epoch: 28, train_loss: 0.8893, test_loss: 1.0957, test_f1: 0.5430
 epoch: 29, train_loss: 0.8507, test_loss: 0.9808, test_f1: 0.5030
 epoch: 30, train_loss: 0.8472, test_loss: 1.2172, test_f1: 0.4923
 epoch: 31, train_loss: 0.8662, test_loss: 0.9925, test_f1: 0.5511
 epoch: 32, train_loss: 0.8570, test_loss: 1.1737, test_f1: 0.5036
 epoch: 33, train_loss: 0.8667, test_loss: 1.1585, test_f1: 0.5684
 epoch: 34, train_loss: 0.8641, test_loss: 1.2295, test_f1: 0.5390
 epoch: 35, train_loss: 0.8484, test_loss: 1.0316, test_f1: 0.5870
 epoch: 36, train_loss: 0.8521, test_loss: 1.2161, test_f1: 0.5510
 epoch: 37, train_loss: 0.8538, test_loss: 1.2705, test_f1: 0.5120
 epoch: 38, train_loss: 0.8470, test_loss: 1.1752, test_f1: 0.5546
 epoch: 39, train_loss: 0.8346, test_loss: 1.1722, test_f1: 0.5263
 epoch: 40, train_loss: 0.8235, test_loss: 1.1559, test_f1: 0.5498
 epoch: 41, train_loss: 0.8254, test_loss: 1.1748, test_f1: 0.5024
 epoch: 42, train_loss: 0.8267, test_loss: 1.1650, test_f1: 0.5521
 epoch: 43, train_loss: 0.8523, test_loss: 1.0545, test_f1: 0.5679
 epoch: 44, train_loss: 0.8165, test_loss: 1.0550, test_f1: 0.5653
 epoch: 45, train_loss: 0.8263, test_loss: 1.1111, test_f1: 0.5513
 epoch: 46, train_loss: 0.8108, test_loss: 1.0874, test_f1: 0.5563
 epoch: 47, train_loss: 0.8131, test_loss: 0.9783, test_f1: 0.5896
 epoch: 48, train_loss: 0.8079, test_loss: 1.0387, test_f1: 0.5594
 epoch: 49, train_loss: 0.8083, test_loss: 1.1890, test_f1: 0.5304
 epoch: 50, train_loss: 0.7976, test_loss: 1.1835, test_f1: 0.5874
 epoch: 51, train_loss: 0.7711, test_loss: 1.0568, test_f1: 0.5620
 epoch: 52, train_loss: 0.7464, test_loss: 1.0864, test_f1: 0.5454
 epoch: 53, train_loss: 0.7350, test_loss: 1.1536, test_f1: 0.5656
 epoch: 54, train_loss: 0.7467, test_loss: 1.0674, test_f1: 0.5857
 epoch: 55, train_loss: 0.7420, test_loss: 1.1088, test_f1: 0.5670
 epoch: 56, train_loss: 0.7455, test_loss: 1.1424, test_f1: 0.5651
 epoch: 57, train_loss: 0.7334, test_loss: 1.0068, test_f1: 0.5837
 epoch: 58, train_loss: 0.7251, test_loss: 1.1548, test_f1: 0.5459
 epoch: 59, train_loss: 0.7452, test_loss: 1.1031, test_f1: 0.5487
 epoch: 60, train_loss: 0.7354, test_loss: 1.1846, test_f1: 0.5427
 epoch: 61, train_loss: 0.7425, test_loss: 1.3559, test_f1: 0.5330
 epoch: 62, train_loss: 0.7451, test_loss: 1.0469, test_f1: 0.5590
 epoch: 63, train_loss: 0.7435, test_loss: 1.0719, test_f1: 0.5186
 epoch: 64, train_loss: 0.7210, test_loss: 1.1760, test_f1: 0.5768
 epoch: 65, train_loss: 0.7172, test_loss: 1.2254, test_f1: 0.5718
 epoch: 66, train_loss: 0.7969, test_loss: 0.9100, test_f1: 0.5756
 epoch: 67, train_loss: 0.7256, test_loss: 1.1049, test_f1: 0.5403
 epoch: 68, train_loss: 0.7072, test_loss: 1.1309, test_f1: 0.5719
 epoch: 69, train_loss: 0.7162, test_loss: 1.0025, test_f1: 0.5535
 epoch: 70, train_loss: 0.7108, test_loss: 1.1221, test_f1: 0.5646
 epoch: 71, train_loss: 0.6927, test_loss: 0.9976, test_f1: 0.5776
 epoch: 72, train_loss: 0.6946, test_loss: 1.0669, test_f1: 0.5577
 epoch: 73, train_loss: 0.6989, test_loss: 1.1287, test_f1: 0.5733
 epoch: 74, train_loss: 0.7147, test_loss: 1.0719, test_f1: 0.5616
 epoch: 75, train_loss: 0.7053, test_loss: 1.1417, test_f1: 0.5421
 epoch: 76, train_loss: 0.6862, test_loss: 1.1387, test_f1: 0.5540
 epoch: 77, train_loss: 0.6866, test_loss: 1.0674, test_f1: 0.5725
 epoch: 78, train_loss: 0.6868, test_loss: 1.1567, test_f1: 0.5789
 epoch: 79, train_loss: 0.6945, test_loss: 1.0195, test_f1: 0.5716
 epoch: 80, train_loss: 0.6844, test_loss: 1.1797, test_f1: 0.5588
 epoch: 81, train_loss: 0.6873, test_loss: 1.2467, test_f1: 0.5579
 epoch: 82, train_loss: 0.6759, test_loss: 1.1716, test_f1: 0.5822
 epoch: 83, train_loss: 0.6789, test_loss: 1.2118, test_f1: 0.6047
 epoch: 84, train_loss: 0.6682, test_loss: 1.1711, test_f1: 0.5755
 epoch: 85, train_loss: 0.6628, test_loss: 1.2004, test_f1: 0.5549
 epoch: 86, train_loss: 0.6764, test_loss: 1.2541, test_f1: 0.5880
 epoch: 87, train_loss: 0.6707, test_loss: 1.1514, test_f1: 0.5699
 epoch: 88, train_loss: 0.6746, test_loss: 1.0732, test_f1: 0.5595
 epoch: 89, train_loss: 0.6640, test_loss: 1.0562, test_f1: 0.5636
 epoch: 90, train_loss: 0.6605, test_loss: 1.2352, test_f1: 0.5652
 epoch: 91, train_loss: 0.6623, test_loss: 1.0596, test_f1: 0.5968
 epoch: 92, train_loss: 0.6593, test_loss: 1.0682, test_f1: 0.5851
 epoch: 93, train_loss: 0.6556, test_loss: 1.1300, test_f1: 0.5588
 epoch: 94, train_loss: 0.6634, test_loss: 1.5094, test_f1: 0.5492
 epoch: 95, train_loss: 0.6527, test_loss: 1.2958, test_f1: 0.5485
 epoch: 96, train_loss: 0.6565, test_loss: 1.2778, test_f1: 0.5512
 epoch: 97, train_loss: 0.6576, test_loss: 1.4140, test_f1: 0.5753
 epoch: 98, train_loss: 0.6580, test_loss: 1.3177, test_f1: 0.5427
 epoch: 99, train_loss: 0.6923, test_loss: 1.2955, test_f1: 0.5407
##################ITERATION #3 ****************************************
 epoch: 0, train_loss: 1.2354, test_loss: 1.1193, test_f1: 0.4453
 epoch: 1, train_loss: 1.1305, test_loss: 1.0368, test_f1: 0.4193
 epoch: 2, train_loss: 1.0685, test_loss: 0.9729, test_f1: 0.4716
 epoch: 3, train_loss: 1.0438, test_loss: 1.0591, test_f1: 0.4329
 epoch: 4, train_loss: 1.0196, test_loss: 1.0384, test_f1: 0.4711
 epoch: 5, train_loss: 1.0076, test_loss: 1.0379, test_f1: 0.4970
 epoch: 6, train_loss: 0.9862, test_loss: 1.0262, test_f1: 0.4821
 epoch: 7, train_loss: 0.9713, test_loss: 1.0386, test_f1: 0.4712
 epoch: 8, train_loss: 0.9620, test_loss: 0.9650, test_f1: 0.4988
 epoch: 9, train_loss: 0.9615, test_loss: 1.0099, test_f1: 0.5281
 epoch: 10, train_loss: 0.9495, test_loss: 0.9944, test_f1: 0.5037
 epoch: 11, train_loss: 0.9414, test_loss: 0.9746, test_f1: 0.4795
 epoch: 12, train_loss: 0.9362, test_loss: 0.9346, test_f1: 0.5173
 epoch: 13, train_loss: 0.9381, test_loss: 0.9684, test_f1: 0.4995
 epoch: 14, train_loss: 0.9135, test_loss: 1.0121, test_f1: 0.5013
 epoch: 15, train_loss: 0.9091, test_loss: 0.9886, test_f1: 0.5242
 epoch: 16, train_loss: 0.9206, test_loss: 0.9840, test_f1: 0.5160
 epoch: 17, train_loss: 0.9138, test_loss: 0.9775, test_f1: 0.5487
 epoch: 18, train_loss: 0.8963, test_loss: 1.0501, test_f1: 0.5081
 epoch: 19, train_loss: 0.8912, test_loss: 1.1423, test_f1: 0.5155
 epoch: 20, train_loss: 0.8956, test_loss: 1.0514, test_f1: 0.4958
 epoch: 21, train_loss: 0.8928, test_loss: 0.9957, test_f1: 0.5576
 epoch: 22, train_loss: 0.8762, test_loss: 1.0226, test_f1: 0.5195
 epoch: 23, train_loss: 0.8813, test_loss: 1.0254, test_f1: 0.5182
 epoch: 24, train_loss: 0.8713, test_loss: 1.0887, test_f1: 0.5129
 epoch: 25, train_loss: 0.8865, test_loss: 0.9521, test_f1: 0.5190
 epoch: 26, train_loss: 0.8773, test_loss: 1.0047, test_f1: 0.5610
 epoch: 27, train_loss: 0.8689, test_loss: 0.9603, test_f1: 0.4897
 epoch: 28, train_loss: 0.8562, test_loss: 0.9566, test_f1: 0.5092
 epoch: 29, train_loss: 0.8546, test_loss: 1.0427, test_f1: 0.5428
 epoch: 30, train_loss: 0.8663, test_loss: 0.9219, test_f1: 0.5265
 epoch: 31, train_loss: 0.8468, test_loss: 1.0315, test_f1: 0.5247
 epoch: 32, train_loss: 0.8504, test_loss: 1.0968, test_f1: 0.4764
 epoch: 33, train_loss: 0.8494, test_loss: 1.0969, test_f1: 0.5100
 epoch: 34, train_loss: 0.8388, test_loss: 1.0057, test_f1: 0.5272
 epoch: 35, train_loss: 0.8316, test_loss: 1.1708, test_f1: 0.4900
 epoch: 36, train_loss: 0.8318, test_loss: 1.0291, test_f1: 0.5748
 epoch: 37, train_loss: 0.8486, test_loss: 1.1328, test_f1: 0.4719
 epoch: 38, train_loss: 0.8350, test_loss: 1.4405, test_f1: 0.4884
 epoch: 39, train_loss: 0.8441, test_loss: 1.3923, test_f1: 0.4556
 epoch: 40, train_loss: 0.8111, test_loss: 1.1185, test_f1: 0.5373
 epoch: 41, train_loss: 0.8280, test_loss: 1.1264, test_f1: 0.4855
 epoch: 42, train_loss: 0.8340, test_loss: 1.0299, test_f1: 0.5241
 epoch: 43, train_loss: 0.8204, test_loss: 1.3514, test_f1: 0.5186
 epoch: 44, train_loss: 0.7986, test_loss: 1.0152, test_f1: 0.5098
 epoch: 45, train_loss: 0.8096, test_loss: 1.0447, test_f1: 0.5112
 epoch: 46, train_loss: 0.7883, test_loss: 1.0630, test_f1: 0.5517
 epoch: 47, train_loss: 0.8003, test_loss: 1.0622, test_f1: 0.5588
 epoch: 48, train_loss: 0.7727, test_loss: 1.0992, test_f1: 0.5015
 epoch: 49, train_loss: 0.7943, test_loss: 1.1325, test_f1: 0.5311
 epoch: 50, train_loss: 0.7851, test_loss: 1.1288, test_f1: 0.5211
 epoch: 51, train_loss: 0.8371, test_loss: 1.0626, test_f1: 0.5381
 epoch: 52, train_loss: 0.7811, test_loss: 1.2269, test_f1: 0.5399
 epoch: 53, train_loss: 0.7698, test_loss: 1.2178, test_f1: 0.5040
 epoch: 54, train_loss: 0.7664, test_loss: 1.1924, test_f1: 0.5063
 epoch: 55, train_loss: 0.7355, test_loss: 1.1877, test_f1: 0.5159
 epoch: 56, train_loss: 0.7337, test_loss: 1.3543, test_f1: 0.5110
 epoch: 57, train_loss: 0.7324, test_loss: 1.2694, test_f1: 0.5669
 epoch: 58, train_loss: 0.7299, test_loss: 1.1589, test_f1: 0.5544
 epoch: 59, train_loss: 0.7215, test_loss: 1.2368, test_f1: 0.5690
 epoch: 60, train_loss: 0.7067, test_loss: 1.2496, test_f1: 0.5668
 epoch: 61, train_loss: 0.6958, test_loss: 1.1700, test_f1: 0.5649
 epoch: 62, train_loss: 0.6959, test_loss: 1.5000, test_f1: 0.5119
 epoch: 63, train_loss: 0.7110, test_loss: 1.1607, test_f1: 0.5696
 epoch: 64, train_loss: 0.6989, test_loss: 1.5343, test_f1: 0.5216
 epoch: 65, train_loss: 0.7452, test_loss: 1.1889, test_f1: 0.5364
 epoch: 66, train_loss: 0.7056, test_loss: 1.0843, test_f1: 0.5731
 epoch: 67, train_loss: 0.6874, test_loss: 1.1293, test_f1: 0.5561
 epoch: 68, train_loss: 0.7037, test_loss: 1.3504, test_f1: 0.5456
 epoch: 69, train_loss: 0.7045, test_loss: 1.2771, test_f1: 0.5218
 epoch: 70, train_loss: 0.6906, test_loss: 1.5526, test_f1: 0.5303
 epoch: 71, train_loss: 0.6899, test_loss: 1.1671, test_f1: 0.5467
 epoch: 72, train_loss: 0.6802, test_loss: 1.5278, test_f1: 0.5409
 epoch: 73, train_loss: 0.6852, test_loss: 1.2731, test_f1: 0.5391
 epoch: 74, train_loss: 0.6688, test_loss: 1.2794, test_f1: 0.5634
 epoch: 75, train_loss: 0.6784, test_loss: 1.2162, test_f1: 0.5572
 epoch: 76, train_loss: 0.6633, test_loss: 1.2461, test_f1: 0.5383
 epoch: 77, train_loss: 0.6841, test_loss: 1.1636, test_f1: 0.5811
 epoch: 78, train_loss: 0.6691, test_loss: 1.2074, test_f1: 0.5840
 epoch: 79, train_loss: 0.6643, test_loss: 1.1744, test_f1: 0.5672
 epoch: 80, train_loss: 0.6543, test_loss: 1.1660, test_f1: 0.5429
 epoch: 81, train_loss: 0.6589, test_loss: 1.1312, test_f1: 0.5567
 epoch: 82, train_loss: 0.6714, test_loss: 1.3085, test_f1: 0.5140
 epoch: 83, train_loss: 0.6502, test_loss: 1.1482, test_f1: 0.5631
 epoch: 84, train_loss: 0.6686, test_loss: 1.1585, test_f1: 0.5530
 epoch: 85, train_loss: 0.6680, test_loss: 1.1302, test_f1: 0.5559
 epoch: 86, train_loss: 0.6542, test_loss: 1.1081, test_f1: 0.5640
 epoch: 87, train_loss: 0.6395, test_loss: 1.3167, test_f1: 0.5423
 epoch: 88, train_loss: 0.6477, test_loss: 1.2803, test_f1: 0.5559
 epoch: 89, train_loss: 0.6424, test_loss: 1.2777, test_f1: 0.5353
 epoch: 90, train_loss: 0.6380, test_loss: 1.3319, test_f1: 0.5652
 epoch: 91, train_loss: 0.6407, test_loss: 1.2273, test_f1: 0.5724
 epoch: 92, train_loss: 0.6314, test_loss: 1.3121, test_f1: 0.5495
 epoch: 93, train_loss: 0.6340, test_loss: 1.1680, test_f1: 0.5707
 epoch: 94, train_loss: 0.6210, test_loss: 1.4946, test_f1: 0.5617
 epoch: 95, train_loss: 0.6269, test_loss: 1.2421, test_f1: 0.5778
 epoch: 96, train_loss: 0.6270, test_loss: 1.1727, test_f1: 0.5497
 epoch: 97, train_loss: 0.6129, test_loss: 1.2473, test_f1: 0.5739
 epoch: 98, train_loss: 0.6032, test_loss: 1.2221, test_f1: 0.5563
 epoch: 99, train_loss: 0.6372, test_loss: 1.2846, test_f1: 0.5407
##################ITERATION #4 ****************************************
 epoch: 0, train_loss: 1.2847, test_loss: 1.2080, test_f1: 0.3882
 epoch: 1, train_loss: 1.1390, test_loss: 1.0730, test_f1: 0.4740
 epoch: 2, train_loss: 1.0713, test_loss: 1.0302, test_f1: 0.4616
 epoch: 3, train_loss: 1.0275, test_loss: 1.0007, test_f1: 0.4529
 epoch: 4, train_loss: 1.0230, test_loss: 1.0006, test_f1: 0.4556
 epoch: 5, train_loss: 1.0050, test_loss: 0.9786, test_f1: 0.4783
 epoch: 6, train_loss: 0.9873, test_loss: 1.0536, test_f1: 0.4397
 epoch: 7, train_loss: 0.9733, test_loss: 1.1245, test_f1: 0.4855
 epoch: 8, train_loss: 0.9694, test_loss: 1.0246, test_f1: 0.5109
 epoch: 9, train_loss: 0.9647, test_loss: 1.0034, test_f1: 0.4868
 epoch: 10, train_loss: 0.9428, test_loss: 1.1553, test_f1: 0.4590
 epoch: 11, train_loss: 0.9523, test_loss: 1.0509, test_f1: 0.5132
 epoch: 12, train_loss: 0.9324, test_loss: 1.2481, test_f1: 0.4330
 epoch: 13, train_loss: 0.9364, test_loss: 1.1890, test_f1: 0.4808
 epoch: 14, train_loss: 0.9233, test_loss: 1.0472, test_f1: 0.4700
 epoch: 15, train_loss: 0.9170, test_loss: 1.2286, test_f1: 0.4960
 epoch: 16, train_loss: 0.9041, test_loss: 1.1270, test_f1: 0.4656
 epoch: 17, train_loss: 0.9149, test_loss: 1.1080, test_f1: 0.4823
 epoch: 18, train_loss: 0.9152, test_loss: 1.0561, test_f1: 0.5293
 epoch: 19, train_loss: 0.9028, test_loss: 1.1093, test_f1: 0.4874
 epoch: 20, train_loss: 0.9158, test_loss: 1.0540, test_f1: 0.4967
 epoch: 21, train_loss: 0.8900, test_loss: 1.0310, test_f1: 0.4981
 epoch: 22, train_loss: 0.9048, test_loss: 1.0005, test_f1: 0.5486
 epoch: 23, train_loss: 0.8957, test_loss: 1.0203, test_f1: 0.4814
 epoch: 24, train_loss: 0.8839, test_loss: 1.2441, test_f1: 0.4636
 epoch: 25, train_loss: 0.8810, test_loss: 1.0567, test_f1: 0.5047
 epoch: 26, train_loss: 0.8588, test_loss: 1.3299, test_f1: 0.5014
 epoch: 27, train_loss: 0.8731, test_loss: 1.5906, test_f1: 0.4631
 epoch: 28, train_loss: 0.8854, test_loss: 1.2571, test_f1: 0.4795
 epoch: 29, train_loss: 0.8626, test_loss: 1.0282, test_f1: 0.5453
 epoch: 30, train_loss: 0.8704, test_loss: 1.1453, test_f1: 0.4746
 epoch: 31, train_loss: 0.8563, test_loss: 1.0674, test_f1: 0.5456
 epoch: 32, train_loss: 0.8521, test_loss: 1.1853, test_f1: 0.4795
 epoch: 33, train_loss: 0.9387, test_loss: 1.0164, test_f1: 0.4887
 epoch: 34, train_loss: 0.8842, test_loss: 1.1363, test_f1: 0.4914
 epoch: 35, train_loss: 0.8726, test_loss: 1.0864, test_f1: 0.5265
 epoch: 36, train_loss: 0.8853, test_loss: 1.3142, test_f1: 0.5132
 epoch: 37, train_loss: 0.8690, test_loss: 1.0676, test_f1: 0.5200
 epoch: 38, train_loss: 0.8565, test_loss: 1.2241, test_f1: 0.4814
 epoch: 39, train_loss: 0.8583, test_loss: 1.0444, test_f1: 0.5048
 epoch: 40, train_loss: 0.8666, test_loss: 1.0985, test_f1: 0.4930
 epoch: 41, train_loss: 0.8524, test_loss: 1.2016, test_f1: 0.4941
 epoch: 42, train_loss: 0.8344, test_loss: 1.1583, test_f1: 0.5020
 epoch: 43, train_loss: 0.8552, test_loss: 1.2277, test_f1: 0.4805
 epoch: 44, train_loss: 0.8450, test_loss: 1.1769, test_f1: 0.5159
 epoch: 45, train_loss: 0.8332, test_loss: 1.2480, test_f1: 0.4990
 epoch: 46, train_loss: 0.8463, test_loss: 1.2161, test_f1: 0.5082
 epoch: 47, train_loss: 0.8321, test_loss: 1.0290, test_f1: 0.5126
 epoch: 48, train_loss: 0.8204, test_loss: 1.2348, test_f1: 0.4805
 epoch: 49, train_loss: 0.8200, test_loss: 1.0446, test_f1: 0.5078
 epoch: 50, train_loss: 0.8330, test_loss: 1.3441, test_f1: 0.5060
 epoch: 51, train_loss: 0.7943, test_loss: 1.1666, test_f1: 0.4980
 epoch: 52, train_loss: 0.7972, test_loss: 1.0862, test_f1: 0.4820
 epoch: 53, train_loss: 0.7757, test_loss: 1.2785, test_f1: 0.4949
 epoch: 54, train_loss: 0.7855, test_loss: 1.1555, test_f1: 0.4865
 epoch: 55, train_loss: 0.7793, test_loss: 1.0249, test_f1: 0.5130
 epoch: 56, train_loss: 0.7692, test_loss: 1.0500, test_f1: 0.5017
 epoch: 57, train_loss: 0.7619, test_loss: 1.0231, test_f1: 0.5148
 epoch: 58, train_loss: 0.7766, test_loss: 1.0823, test_f1: 0.4853
 epoch: 59, train_loss: 0.7613, test_loss: 1.0811, test_f1: 0.5109
 epoch: 60, train_loss: 0.7575, test_loss: 1.0453, test_f1: 0.5137
 epoch: 61, train_loss: 0.7701, test_loss: 1.1256, test_f1: 0.5217
 epoch: 62, train_loss: 0.7588, test_loss: 1.1623, test_f1: 0.5217
 epoch: 63, train_loss: 0.7546, test_loss: 1.2630, test_f1: 0.5224
 epoch: 64, train_loss: 0.7675, test_loss: 1.1353, test_f1: 0.5520
 epoch: 65, train_loss: 0.7661, test_loss: 1.0678, test_f1: 0.5422
 epoch: 66, train_loss: 0.7523, test_loss: 1.0393, test_f1: 0.5668
 epoch: 67, train_loss: 0.7518, test_loss: 1.0677, test_f1: 0.5147
 epoch: 68, train_loss: 0.7347, test_loss: 1.1801, test_f1: 0.5028
 epoch: 69, train_loss: 0.7432, test_loss: 1.2410, test_f1: 0.5330
 epoch: 70, train_loss: 0.7309, test_loss: 1.1681, test_f1: 0.5466
 epoch: 71, train_loss: 0.7438, test_loss: 1.2843, test_f1: 0.5094
 epoch: 72, train_loss: 0.7310, test_loss: 1.1343, test_f1: 0.5097
 epoch: 73, train_loss: 0.7343, test_loss: 1.1590, test_f1: 0.5188
 epoch: 74, train_loss: 0.7431, test_loss: 1.2693, test_f1: 0.5084
 epoch: 75, train_loss: 0.7435, test_loss: 1.2802, test_f1: 0.4888
 epoch: 76, train_loss: 0.7246, test_loss: 1.1553, test_f1: 0.5094
 epoch: 77, train_loss: 0.7407, test_loss: 1.1080, test_f1: 0.4797
 epoch: 78, train_loss: 0.7253, test_loss: 1.2323, test_f1: 0.4909
 epoch: 79, train_loss: 0.7035, test_loss: 1.2936, test_f1: 0.5122
 epoch: 80, train_loss: 0.7087, test_loss: 1.2866, test_f1: 0.4911
 epoch: 81, train_loss: 0.7036, test_loss: 1.2231, test_f1: 0.5393
 epoch: 82, train_loss: 0.7127, test_loss: 1.2485, test_f1: 0.5378
 epoch: 83, train_loss: 0.7169, test_loss: 0.9860, test_f1: 0.5457
 epoch: 84, train_loss: 0.7242, test_loss: 1.2758, test_f1: 0.5165
 epoch: 85, train_loss: 0.7008, test_loss: 1.2463, test_f1: 0.5150
 epoch: 86, train_loss: 0.6970, test_loss: 1.2912, test_f1: 0.5075
 epoch: 87, train_loss: 0.7019, test_loss: 1.2467, test_f1: 0.4827
 epoch: 88, train_loss: 0.6861, test_loss: 1.0849, test_f1: 0.5738
 epoch: 89, train_loss: 0.7084, test_loss: 1.2630, test_f1: 0.5260
 epoch: 90, train_loss: 0.7012, test_loss: 1.3288, test_f1: 0.5381
 epoch: 91, train_loss: 0.6868, test_loss: 1.1254, test_f1: 0.5876
 epoch: 92, train_loss: 0.6914, test_loss: 1.2237, test_f1: 0.5045
 epoch: 93, train_loss: 0.6755, test_loss: 1.0823, test_f1: 0.5461
 epoch: 94, train_loss: 0.6831, test_loss: 1.0962, test_f1: 0.5662
 epoch: 95, train_loss: 0.6918, test_loss: 1.0863, test_f1: 0.5082
 epoch: 96, train_loss: 0.6735, test_loss: 1.2915, test_f1: 0.5477
 epoch: 97, train_loss: 0.6904, test_loss: 1.3497, test_f1: 0.5763
 epoch: 98, train_loss: 0.6777, test_loss: 1.2926, test_f1: 0.5654
 epoch: 99, train_loss: 0.6880, test_loss: 1.4234, test_f1: 0.5710
##################ITERATION #5 ****************************************
 epoch: 0, train_loss: 1.2762, test_loss: 1.1334, test_f1: 0.4542
 epoch: 1, train_loss: 1.1412, test_loss: 1.1455, test_f1: 0.4175
 epoch: 2, train_loss: 1.0818, test_loss: 0.9916, test_f1: 0.5005
 epoch: 3, train_loss: 1.0564, test_loss: 0.9489, test_f1: 0.4696
 epoch: 4, train_loss: 1.0158, test_loss: 0.9926, test_f1: 0.4844
 epoch: 5, train_loss: 0.9868, test_loss: 1.0712, test_f1: 0.4590
 epoch: 6, train_loss: 0.9804, test_loss: 1.0934, test_f1: 0.4888
 epoch: 7, train_loss: 0.9639, test_loss: 1.0306, test_f1: 0.5011
 epoch: 8, train_loss: 0.9520, test_loss: 0.9585, test_f1: 0.4842
 epoch: 9, train_loss: 0.9746, test_loss: 0.9704, test_f1: 0.4775
 epoch: 10, train_loss: 0.9440, test_loss: 1.0300, test_f1: 0.5137
 epoch: 11, train_loss: 0.9328, test_loss: 0.9745, test_f1: 0.5110
 epoch: 12, train_loss: 0.9138, test_loss: 1.1896, test_f1: 0.4779
 epoch: 13, train_loss: 0.9186, test_loss: 0.9996, test_f1: 0.5266
 epoch: 14, train_loss: 0.9208, test_loss: 0.9851, test_f1: 0.5175
 epoch: 15, train_loss: 0.9194, test_loss: 1.0277, test_f1: 0.4948
 epoch: 16, train_loss: 0.8796, test_loss: 0.9546, test_f1: 0.5156
 epoch: 17, train_loss: 0.9039, test_loss: 0.9375, test_f1: 0.5283
 epoch: 18, train_loss: 0.9031, test_loss: 0.9198, test_f1: 0.4993
 epoch: 19, train_loss: 0.8853, test_loss: 0.9799, test_f1: 0.4806
 epoch: 20, train_loss: 0.8777, test_loss: 1.0187, test_f1: 0.5362
 epoch: 21, train_loss: 0.9115, test_loss: 0.9741, test_f1: 0.5276
 epoch: 22, train_loss: 0.8822, test_loss: 0.9533, test_f1: 0.5082
 epoch: 23, train_loss: 0.8812, test_loss: 1.0538, test_f1: 0.5140
 epoch: 24, train_loss: 0.8861, test_loss: 1.0689, test_f1: 0.4988
 epoch: 25, train_loss: 0.8665, test_loss: 1.1908, test_f1: 0.5117
 epoch: 26, train_loss: 0.8669, test_loss: 1.0001, test_f1: 0.5316
 epoch: 27, train_loss: 0.8605, test_loss: 1.0012, test_f1: 0.5616
 epoch: 28, train_loss: 0.8626, test_loss: 1.0970, test_f1: 0.4914
 epoch: 29, train_loss: 0.8609, test_loss: 1.0680, test_f1: 0.5146
 epoch: 30, train_loss: 0.8468, test_loss: 1.1470, test_f1: 0.4527
 epoch: 31, train_loss: 0.9252, test_loss: 1.0011, test_f1: 0.5106
 epoch: 32, train_loss: 0.8708, test_loss: 1.0529, test_f1: 0.5571
 epoch: 33, train_loss: 0.8754, test_loss: 0.9648, test_f1: 0.5391
 epoch: 34, train_loss: 0.8559, test_loss: 0.9011, test_f1: 0.5432
 epoch: 35, train_loss: 0.8596, test_loss: 0.9625, test_f1: 0.5775
 epoch: 36, train_loss: 0.8386, test_loss: 1.0369, test_f1: 0.5609
 epoch: 37, train_loss: 0.8467, test_loss: 0.9868, test_f1: 0.5611
 epoch: 38, train_loss: 0.8441, test_loss: 0.8348, test_f1: 0.5556
 epoch: 39, train_loss: 0.8222, test_loss: 1.3050, test_f1: 0.5366
 epoch: 40, train_loss: 0.8186, test_loss: 0.9333, test_f1: 0.5766
 epoch: 41, train_loss: 0.8124, test_loss: 1.0719, test_f1: 0.5574
 epoch: 42, train_loss: 0.8132, test_loss: 1.0841, test_f1: 0.5633
 epoch: 43, train_loss: 0.8234, test_loss: 0.9912, test_f1: 0.5560
 epoch: 44, train_loss: 0.8237, test_loss: 0.9993, test_f1: 0.5420
 epoch: 45, train_loss: 0.8342, test_loss: 1.1452, test_f1: 0.5359
 epoch: 46, train_loss: 0.8033, test_loss: 0.9886, test_f1: 0.5281
 epoch: 47, train_loss: 0.8469, test_loss: 0.9980, test_f1: 0.5661
 epoch: 48, train_loss: 0.8054, test_loss: 1.2086, test_f1: 0.5304
 epoch: 49, train_loss: 0.8014, test_loss: 1.2513, test_f1: 0.5385
 epoch: 50, train_loss: 0.8053, test_loss: 1.1901, test_f1: 0.5052
 epoch: 51, train_loss: 0.7796, test_loss: 0.9432, test_f1: 0.5773
 epoch: 52, train_loss: 0.7606, test_loss: 0.9428, test_f1: 0.5582
 epoch: 53, train_loss: 0.7583, test_loss: 0.9898, test_f1: 0.5946
 epoch: 54, train_loss: 0.7471, test_loss: 1.0913, test_f1: 0.5705
 epoch: 55, train_loss: 0.7414, test_loss: 0.8994, test_f1: 0.5799
 epoch: 56, train_loss: 0.7365, test_loss: 1.1247, test_f1: 0.5294
 epoch: 57, train_loss: 0.7463, test_loss: 1.0850, test_f1: 0.5077
 epoch: 58, train_loss: 0.7370, test_loss: 1.0247, test_f1: 0.5774
 epoch: 59, train_loss: 0.7235, test_loss: 1.1380, test_f1: 0.5525
 epoch: 60, train_loss: 0.7215, test_loss: 1.0666, test_f1: 0.5705
 epoch: 61, train_loss: 0.7398, test_loss: 1.0100, test_f1: 0.5921
 epoch: 62, train_loss: 0.7206, test_loss: 1.5345, test_f1: 0.5371
 epoch: 63, train_loss: 0.7266, test_loss: 1.0323, test_f1: 0.5406
 epoch: 64, train_loss: 0.7382, test_loss: 1.0889, test_f1: 0.5428
 epoch: 65, train_loss: 0.7340, test_loss: 1.1918, test_f1: 0.5431
 epoch: 66, train_loss: 0.7216, test_loss: 1.0200, test_f1: 0.5639
 epoch: 67, train_loss: 0.7009, test_loss: 1.4138, test_f1: 0.5404
 epoch: 68, train_loss: 0.7221, test_loss: 1.3869, test_f1: 0.5501
 epoch: 69, train_loss: 0.7528, test_loss: 0.9560, test_f1: 0.5719
 epoch: 70, train_loss: 0.7158, test_loss: 1.1010, test_f1: 0.5458
 epoch: 71, train_loss: 0.7113, test_loss: 1.0203, test_f1: 0.5640
 epoch: 72, train_loss: 0.6908, test_loss: 0.9396, test_f1: 0.5782
 epoch: 73, train_loss: 0.7182, test_loss: 0.9899, test_f1: 0.5604
 epoch: 74, train_loss: 0.6768, test_loss: 1.0194, test_f1: 0.5444
 epoch: 75, train_loss: 0.6936, test_loss: 1.0528, test_f1: 0.5677
 epoch: 76, train_loss: 0.6884, test_loss: 1.2479, test_f1: 0.5553
 epoch: 77, train_loss: 0.6897, test_loss: 1.3289, test_f1: 0.5288
 epoch: 78, train_loss: 0.6911, test_loss: 1.2028, test_f1: 0.5952
 epoch: 79, train_loss: 0.6741, test_loss: 1.2256, test_f1: 0.5777
 epoch: 80, train_loss: 0.6849, test_loss: 1.2976, test_f1: 0.5600
 epoch: 81, train_loss: 0.6838, test_loss: 1.2581, test_f1: 0.5771
 epoch: 82, train_loss: 0.6797, test_loss: 1.0248, test_f1: 0.5703
 epoch: 83, train_loss: 0.6862, test_loss: 1.0997, test_f1: 0.5671
 epoch: 84, train_loss: 0.6720, test_loss: 1.0902, test_f1: 0.5877
 epoch: 85, train_loss: 0.6630, test_loss: 1.2651, test_f1: 0.5683
 epoch: 86, train_loss: 0.6692, test_loss: 1.1834, test_f1: 0.5605
 epoch: 87, train_loss: 0.6809, test_loss: 1.2685, test_f1: 0.5806
 epoch: 88, train_loss: 0.6707, test_loss: 1.1432, test_f1: 0.5811
 epoch: 89, train_loss: 0.6888, test_loss: 1.0935, test_f1: 0.5381
 epoch: 90, train_loss: 0.6625, test_loss: 1.1303, test_f1: 0.5287
 epoch: 91, train_loss: 0.6475, test_loss: 1.2773, test_f1: 0.5334
 epoch: 92, train_loss: 0.6685, test_loss: 1.1484, test_f1: 0.5854
 epoch: 93, train_loss: 0.6561, test_loss: 1.4370, test_f1: 0.5449
 epoch: 94, train_loss: 0.6528, test_loss: 1.6366, test_f1: 0.5217
 epoch: 95, train_loss: 0.6461, test_loss: 1.3925, test_f1: 0.5509
 epoch: 96, train_loss: 0.6962, test_loss: 1.6075, test_f1: 0.5271
 epoch: 97, train_loss: 0.6771, test_loss: 1.3608, test_f1: 0.5289
 epoch: 98, train_loss: 0.6869, test_loss: 0.9578, test_f1: 0.5662
 epoch: 99, train_loss: 0.6446, test_loss: 1.0822, test_f1: 0.5756
##################ITERATION #6 ****************************************
 epoch: 0, train_loss: 1.2999, test_loss: 1.1932, test_f1: 0.3829
 epoch: 1, train_loss: 1.1567, test_loss: 1.3225, test_f1: 0.3745
 epoch: 2, train_loss: 1.0778, test_loss: 1.0657, test_f1: 0.4827
 epoch: 3, train_loss: 1.0517, test_loss: 1.0574, test_f1: 0.4851
 epoch: 4, train_loss: 1.0269, test_loss: 0.9958, test_f1: 0.4870
 epoch: 5, train_loss: 1.0090, test_loss: 0.9569, test_f1: 0.5025
 epoch: 6, train_loss: 0.9985, test_loss: 0.9953, test_f1: 0.4977
 epoch: 7, train_loss: 0.9710, test_loss: 1.0266, test_f1: 0.4658
 epoch: 8, train_loss: 0.9770, test_loss: 0.9969, test_f1: 0.5462
 epoch: 9, train_loss: 0.9550, test_loss: 1.0078, test_f1: 0.4731
 epoch: 10, train_loss: 0.9555, test_loss: 1.0138, test_f1: 0.5070
 epoch: 11, train_loss: 0.9334, test_loss: 1.0937, test_f1: 0.4779
 epoch: 12, train_loss: 0.9711, test_loss: 1.0668, test_f1: 0.5421
 epoch: 13, train_loss: 0.9435, test_loss: 1.1221, test_f1: 0.4673
 epoch: 14, train_loss: 0.9200, test_loss: 1.1364, test_f1: 0.4997
 epoch: 15, train_loss: 0.9105, test_loss: 1.1238, test_f1: 0.5122
 epoch: 16, train_loss: 0.9150, test_loss: 1.1260, test_f1: 0.4722
 epoch: 17, train_loss: 0.8957, test_loss: 1.0667, test_f1: 0.4987
 epoch: 18, train_loss: 0.8926, test_loss: 1.0456, test_f1: 0.5255
 epoch: 19, train_loss: 0.9204, test_loss: 1.0611, test_f1: 0.5352
 epoch: 20, train_loss: 0.8893, test_loss: 1.0641, test_f1: 0.5218
 epoch: 21, train_loss: 0.8837, test_loss: 1.1179, test_f1: 0.5203
 epoch: 22, train_loss: 0.8899, test_loss: 1.0227, test_f1: 0.5550
 epoch: 23, train_loss: 0.8739, test_loss: 1.0916, test_f1: 0.5397
 epoch: 24, train_loss: 0.8906, test_loss: 1.0968, test_f1: 0.5037
 epoch: 25, train_loss: 0.8834, test_loss: 1.1316, test_f1: 0.5242
 epoch: 26, train_loss: 0.8724, test_loss: 0.9547, test_f1: 0.5466
 epoch: 27, train_loss: 0.8879, test_loss: 1.0064, test_f1: 0.5397
 epoch: 28, train_loss: 0.8703, test_loss: 1.0270, test_f1: 0.5276
 epoch: 29, train_loss: 0.8536, test_loss: 1.0276, test_f1: 0.5353
 epoch: 30, train_loss: 0.8387, test_loss: 1.0906, test_f1: 0.5287
 epoch: 31, train_loss: 0.8508, test_loss: 0.9774, test_f1: 0.5399
 epoch: 32, train_loss: 0.8491, test_loss: 1.1206, test_f1: 0.4943
 epoch: 33, train_loss: 0.8411, test_loss: 1.0215, test_f1: 0.5490
 epoch: 34, train_loss: 0.8315, test_loss: 1.1655, test_f1: 0.5479
 epoch: 35, train_loss: 0.8384, test_loss: 0.9908, test_f1: 0.5778
 epoch: 36, train_loss: 0.8304, test_loss: 1.0233, test_f1: 0.5367
 epoch: 37, train_loss: 0.8361, test_loss: 0.9847, test_f1: 0.5787
 epoch: 38, train_loss: 0.8160, test_loss: 1.0312, test_f1: 0.5332
 epoch: 39, train_loss: 0.8014, test_loss: 1.0661, test_f1: 0.5738
 epoch: 40, train_loss: 0.8164, test_loss: 1.3225, test_f1: 0.5415
 epoch: 41, train_loss: 0.7977, test_loss: 1.0800, test_f1: 0.5624
 epoch: 42, train_loss: 0.7923, test_loss: 1.0893, test_f1: 0.5590
 epoch: 43, train_loss: 0.8020, test_loss: 1.0496, test_f1: 0.5548
 epoch: 44, train_loss: 0.7952, test_loss: 1.2154, test_f1: 0.5465
 epoch: 45, train_loss: 0.7983, test_loss: 1.1440, test_f1: 0.5413
 epoch: 46, train_loss: 0.8092, test_loss: 0.9622, test_f1: 0.5605
 epoch: 47, train_loss: 0.7901, test_loss: 1.3496, test_f1: 0.5211
 epoch: 48, train_loss: 0.7763, test_loss: 1.1234, test_f1: 0.5277
 epoch: 49, train_loss: 0.7624, test_loss: 1.2332, test_f1: 0.5718
 epoch: 50, train_loss: 0.7885, test_loss: 1.2054, test_f1: 0.5461
 epoch: 51, train_loss: 0.7251, test_loss: 1.3229, test_f1: 0.5643
 epoch: 52, train_loss: 0.7103, test_loss: 1.4133, test_f1: 0.5729
 epoch: 53, train_loss: 0.7076, test_loss: 1.5312, test_f1: 0.5731
 epoch: 54, train_loss: 0.7524, test_loss: 1.4530, test_f1: 0.5455
 epoch: 55, train_loss: 0.7185, test_loss: 1.4077, test_f1: 0.5612
 epoch: 56, train_loss: 0.7082, test_loss: 1.2516, test_f1: 0.5953
 epoch: 57, train_loss: 0.6985, test_loss: 1.3025, test_f1: 0.5764
 epoch: 58, train_loss: 0.6878, test_loss: 1.3545, test_f1: 0.5646
 epoch: 59, train_loss: 0.6778, test_loss: 1.3803, test_f1: 0.5876
 epoch: 60, train_loss: 0.6695, test_loss: 1.4395, test_f1: 0.5885
 epoch: 61, train_loss: 0.6911, test_loss: 1.4278, test_f1: 0.5800
 epoch: 62, train_loss: 0.6706, test_loss: 1.8009, test_f1: 0.5669
 epoch: 63, train_loss: 0.6705, test_loss: 1.3673, test_f1: 0.5874
 epoch: 64, train_loss: 0.6558, test_loss: 1.6298, test_f1: 0.6054
 epoch: 65, train_loss: 0.6702, test_loss: 1.3368, test_f1: 0.5823
 epoch: 66, train_loss: 0.6542, test_loss: 1.2278, test_f1: 0.5952
 epoch: 67, train_loss: 0.6659, test_loss: 1.5004, test_f1: 0.5468
 epoch: 68, train_loss: 0.6700, test_loss: 1.3481, test_f1: 0.5857
 epoch: 69, train_loss: 0.6547, test_loss: 1.4922, test_f1: 0.5546
 epoch: 70, train_loss: 0.8343, test_loss: 1.5441, test_f1: 0.5796
 epoch: 71, train_loss: 0.7338, test_loss: 1.0877, test_f1: 0.5795
 epoch: 72, train_loss: 0.6993, test_loss: 1.3193, test_f1: 0.5545
 epoch: 73, train_loss: 0.6827, test_loss: 1.3258, test_f1: 0.5533
 epoch: 74, train_loss: 0.6664, test_loss: 1.5770, test_f1: 0.5505
 epoch: 75, train_loss: 0.6997, test_loss: 1.3320, test_f1: 0.6045
 epoch: 76, train_loss: 0.6382, test_loss: 1.1869, test_f1: 0.5687
 epoch: 77, train_loss: 0.6551, test_loss: 1.0607, test_f1: 0.5874
 epoch: 78, train_loss: 0.6673, test_loss: 1.2455, test_f1: 0.5596
 epoch: 79, train_loss: 0.6392, test_loss: 1.2424, test_f1: 0.5938
 epoch: 80, train_loss: 0.6258, test_loss: 1.3743, test_f1: 0.5614
 epoch: 81, train_loss: 0.6325, test_loss: 1.3544, test_f1: 0.5934
 epoch: 82, train_loss: 0.6209, test_loss: 1.2691, test_f1: 0.5993
 epoch: 83, train_loss: 0.6720, test_loss: 1.2570, test_f1: 0.5854
 epoch: 84, train_loss: 0.6291, test_loss: 1.3232, test_f1: 0.5861
 epoch: 85, train_loss: 0.6223, test_loss: 1.3479, test_f1: 0.6168
 epoch: 86, train_loss: 0.6126, test_loss: 1.3160, test_f1: 0.5894
 epoch: 87, train_loss: 0.6069, test_loss: 1.3263, test_f1: 0.5891
 epoch: 88, train_loss: 0.6069, test_loss: 1.1731, test_f1: 0.5784
 epoch: 89, train_loss: 0.6483, test_loss: 1.2142, test_f1: 0.5815
 epoch: 90, train_loss: 0.6321, test_loss: 1.5267, test_f1: 0.5609
 epoch: 91, train_loss: 0.6075, test_loss: 1.3969, test_f1: 0.5833
 epoch: 92, train_loss: 0.5915, test_loss: 1.5005, test_f1: 0.5747
 epoch: 93, train_loss: 0.5981, test_loss: 1.3979, test_f1: 0.5640
 epoch: 94, train_loss: 0.5998, test_loss: 1.3976, test_f1: 0.5697
 epoch: 95, train_loss: 0.6132, test_loss: 1.3980, test_f1: 0.5920
 epoch: 96, train_loss: 0.5942, test_loss: 1.4801, test_f1: 0.5661
 epoch: 97, train_loss: 0.5752, test_loss: 1.5414, test_f1: 0.5833
 epoch: 98, train_loss: 0.5801, test_loss: 1.6244, test_f1: 0.5899
 epoch: 99, train_loss: 0.5863, test_loss: 1.6055, test_f1: 0.5796
##################ITERATION #7 ****************************************
 epoch: 0, train_loss: 1.2733, test_loss: 1.2508, test_f1: 0.3054
 epoch: 1, train_loss: 1.1503, test_loss: 1.0626, test_f1: 0.4362
 epoch: 2, train_loss: 1.0777, test_loss: 1.0464, test_f1: 0.4492
 epoch: 3, train_loss: 1.0370, test_loss: 0.9473, test_f1: 0.4665
 epoch: 4, train_loss: 1.0173, test_loss: 0.9236, test_f1: 0.4801
 epoch: 5, train_loss: 0.9960, test_loss: 0.9822, test_f1: 0.4553
 epoch: 6, train_loss: 0.9802, test_loss: 0.9137, test_f1: 0.4780
 epoch: 7, train_loss: 1.0108, test_loss: 0.9758, test_f1: 0.4387
 epoch: 8, train_loss: 0.9742, test_loss: 1.0012, test_f1: 0.4716
 epoch: 9, train_loss: 0.9774, test_loss: 0.9511, test_f1: 0.5413
 epoch: 10, train_loss: 0.9608, test_loss: 1.0112, test_f1: 0.4639
 epoch: 11, train_loss: 0.9429, test_loss: 0.9935, test_f1: 0.5507
 epoch: 12, train_loss: 0.9333, test_loss: 0.8894, test_f1: 0.5159
 epoch: 13, train_loss: 0.9388, test_loss: 0.9310, test_f1: 0.5082
 epoch: 14, train_loss: 0.9420, test_loss: 1.0018, test_f1: 0.5019
 epoch: 15, train_loss: 0.9607, test_loss: 1.2617, test_f1: 0.4848
 epoch: 16, train_loss: 0.9328, test_loss: 1.0220, test_f1: 0.5248
 epoch: 17, train_loss: 0.9114, test_loss: 1.0785, test_f1: 0.4926
 epoch: 18, train_loss: 0.9052, test_loss: 1.0187, test_f1: 0.5462
 epoch: 19, train_loss: 0.9036, test_loss: 1.0236, test_f1: 0.5300
 epoch: 20, train_loss: 0.9022, test_loss: 1.0157, test_f1: 0.4832
 epoch: 21, train_loss: 0.8899, test_loss: 1.0449, test_f1: 0.5444
 epoch: 22, train_loss: 0.8553, test_loss: 0.9712, test_f1: 0.5639
 epoch: 23, train_loss: 0.8769, test_loss: 0.9833, test_f1: 0.4967
 epoch: 24, train_loss: 0.8568, test_loss: 1.0107, test_f1: 0.4972
 epoch: 25, train_loss: 0.8598, test_loss: 0.9890, test_f1: 0.5283
 epoch: 26, train_loss: 0.8614, test_loss: 0.9787, test_f1: 0.5458
 epoch: 27, train_loss: 0.8620, test_loss: 0.9353, test_f1: 0.5812
 epoch: 28, train_loss: 0.8596, test_loss: 0.9360, test_f1: 0.5408
 epoch: 29, train_loss: 0.8524, test_loss: 0.9623, test_f1: 0.5609
 epoch: 30, train_loss: 0.8458, test_loss: 0.8816, test_f1: 0.5935
 epoch: 31, train_loss: 0.8361, test_loss: 0.8931, test_f1: 0.5440
 epoch: 32, train_loss: 0.8503, test_loss: 0.9018, test_f1: 0.5390
 epoch: 33, train_loss: 0.8340, test_loss: 0.9035, test_f1: 0.5286
 epoch: 34, train_loss: 0.8398, test_loss: 0.9956, test_f1: 0.5368
 epoch: 35, train_loss: 0.8262, test_loss: 1.0220, test_f1: 0.5704
 epoch: 36, train_loss: 0.8342, test_loss: 0.9163, test_f1: 0.5602
 epoch: 37, train_loss: 0.8184, test_loss: 1.0172, test_f1: 0.5939
 epoch: 38, train_loss: 0.8315, test_loss: 0.9529, test_f1: 0.5609
 epoch: 39, train_loss: 0.8257, test_loss: 1.0166, test_f1: 0.5186
 epoch: 40, train_loss: 0.8596, test_loss: 1.0276, test_f1: 0.5319
 epoch: 41, train_loss: 0.8226, test_loss: 0.9347, test_f1: 0.5541
 epoch: 42, train_loss: 0.7967, test_loss: 1.0009, test_f1: 0.5672
 epoch: 43, train_loss: 0.8045, test_loss: 0.9659, test_f1: 0.5652
 epoch: 44, train_loss: 0.7980, test_loss: 1.1399, test_f1: 0.5341
 epoch: 45, train_loss: 0.8171, test_loss: 0.9571, test_f1: 0.5413
 epoch: 46, train_loss: 0.7976, test_loss: 0.9181, test_f1: 0.5572
 epoch: 47, train_loss: 0.8005, test_loss: 0.9436, test_f1: 0.5785
 epoch: 48, train_loss: 0.7903, test_loss: 0.9365, test_f1: 0.5454
 epoch: 49, train_loss: 0.8007, test_loss: 0.9508, test_f1: 0.5778
 epoch: 50, train_loss: 0.7943, test_loss: 0.9508, test_f1: 0.5725
 epoch: 51, train_loss: 0.7496, test_loss: 0.9350, test_f1: 0.5552
 epoch: 52, train_loss: 0.7481, test_loss: 0.9810, test_f1: 0.5503
 epoch: 53, train_loss: 0.7377, test_loss: 1.0098, test_f1: 0.5709
 epoch: 54, train_loss: 0.7333, test_loss: 0.9766, test_f1: 0.5767
 epoch: 55, train_loss: 0.7279, test_loss: 0.9677, test_f1: 0.5456
 epoch: 56, train_loss: 0.7321, test_loss: 0.9271, test_f1: 0.5828
 epoch: 57, train_loss: 0.7235, test_loss: 0.8806, test_f1: 0.5881
 epoch: 58, train_loss: 0.7101, test_loss: 0.8850, test_f1: 0.5786
 epoch: 59, train_loss: 0.7113, test_loss: 0.8845, test_f1: 0.5911
 epoch: 60, train_loss: 0.7146, test_loss: 0.9684, test_f1: 0.5923
 epoch: 61, train_loss: 0.7014, test_loss: 0.8994, test_f1: 0.6099
 epoch: 62, train_loss: 0.6963, test_loss: 0.9196, test_f1: 0.5869
 epoch: 63, train_loss: 0.7012, test_loss: 0.8844, test_f1: 0.5672
 epoch: 64, train_loss: 0.6961, test_loss: 0.8669, test_f1: 0.5777
 epoch: 65, train_loss: 0.7120, test_loss: 0.9389, test_f1: 0.5620
 epoch: 66, train_loss: 0.6997, test_loss: 1.0815, test_f1: 0.5569
 epoch: 67, train_loss: 0.7083, test_loss: 0.8579, test_f1: 0.5803
 epoch: 68, train_loss: 0.6980, test_loss: 0.9460, test_f1: 0.5702
 epoch: 69, train_loss: 0.6924, test_loss: 0.9140, test_f1: 0.5764
 epoch: 70, train_loss: 0.6894, test_loss: 0.9651, test_f1: 0.5972
 epoch: 71, train_loss: 0.6869, test_loss: 0.9489, test_f1: 0.5557
 epoch: 72, train_loss: 0.6949, test_loss: 0.8917, test_f1: 0.5869
 epoch: 73, train_loss: 0.6928, test_loss: 0.9326, test_f1: 0.6008
 epoch: 74, train_loss: 0.6796, test_loss: 1.0504, test_f1: 0.5540
 epoch: 75, train_loss: 0.6822, test_loss: 1.0375, test_f1: 0.5621
 epoch: 76, train_loss: 0.6690, test_loss: 0.9203, test_f1: 0.5692
 epoch: 77, train_loss: 0.6616, test_loss: 0.9472, test_f1: 0.5740
 epoch: 78, train_loss: 0.6801, test_loss: 1.1103, test_f1: 0.5675
 epoch: 79, train_loss: 0.6656, test_loss: 0.9402, test_f1: 0.5757
 epoch: 80, train_loss: 0.6585, test_loss: 0.9679, test_f1: 0.5862
 epoch: 81, train_loss: 0.6678, test_loss: 0.9760, test_f1: 0.5694
 epoch: 82, train_loss: 0.6566, test_loss: 0.9330, test_f1: 0.5765
 epoch: 83, train_loss: 0.6461, test_loss: 0.9351, test_f1: 0.5869
 epoch: 84, train_loss: 0.6576, test_loss: 1.0422, test_f1: 0.5891
 epoch: 85, train_loss: 0.6747, test_loss: 1.0085, test_f1: 0.5938
 epoch: 86, train_loss: 0.6459, test_loss: 0.9827, test_f1: 0.5613
 epoch: 87, train_loss: 0.6483, test_loss: 0.9541, test_f1: 0.5596
 epoch: 88, train_loss: 0.6586, test_loss: 0.9918, test_f1: 0.5628
 epoch: 89, train_loss: 0.6530, test_loss: 1.0018, test_f1: 0.5659
 epoch: 90, train_loss: 0.6546, test_loss: 0.9411, test_f1: 0.5567
 epoch: 91, train_loss: 0.6483, test_loss: 0.8934, test_f1: 0.6017
 epoch: 92, train_loss: 0.6326, test_loss: 1.0377, test_f1: 0.5312
 epoch: 93, train_loss: 0.6482, test_loss: 1.0245, test_f1: 0.5661
 epoch: 94, train_loss: 0.6267, test_loss: 1.0373, test_f1: 0.5368
 epoch: 95, train_loss: 0.6317, test_loss: 1.1067, test_f1: 0.5279
 epoch: 96, train_loss: 0.6270, test_loss: 0.9704, test_f1: 0.5664
 epoch: 97, train_loss: 0.6390, test_loss: 1.0262, test_f1: 0.5457
 epoch: 98, train_loss: 0.6531, test_loss: 1.0500, test_f1: 0.5606
 epoch: 99, train_loss: 0.6349, test_loss: 0.9741, test_f1: 0.5529
##################ITERATION #8 ****************************************
 epoch: 0, train_loss: 1.2682, test_loss: 1.1096, test_f1: 0.4100
 epoch: 1, train_loss: 1.1180, test_loss: 1.0154, test_f1: 0.4530
 epoch: 2, train_loss: 1.0706, test_loss: 0.9297, test_f1: 0.4954
 epoch: 3, train_loss: 1.0418, test_loss: 0.9402, test_f1: 0.4864
 epoch: 4, train_loss: 1.0064, test_loss: 0.9816, test_f1: 0.4694
 epoch: 5, train_loss: 0.9924, test_loss: 0.9103, test_f1: 0.5293
 epoch: 6, train_loss: 0.9896, test_loss: 0.9367, test_f1: 0.4988
 epoch: 7, train_loss: 0.9798, test_loss: 0.9247, test_f1: 0.5364
 epoch: 8, train_loss: 0.9650, test_loss: 1.0017, test_f1: 0.4891
 epoch: 9, train_loss: 0.9516, test_loss: 1.0467, test_f1: 0.4767
 epoch: 10, train_loss: 0.9445, test_loss: 0.9938, test_f1: 0.4978
 epoch: 11, train_loss: 0.9347, test_loss: 0.9527, test_f1: 0.5360
 epoch: 12, train_loss: 0.9364, test_loss: 0.9639, test_f1: 0.5154
 epoch: 13, train_loss: 0.9372, test_loss: 0.9859, test_f1: 0.4934
 epoch: 14, train_loss: 0.9209, test_loss: 0.9528, test_f1: 0.5080
 epoch: 15, train_loss: 0.9310, test_loss: 0.9551, test_f1: 0.5039
 epoch: 16, train_loss: 0.8957, test_loss: 0.9747, test_f1: 0.5279
 epoch: 17, train_loss: 0.9577, test_loss: 0.9594, test_f1: 0.5650
 epoch: 18, train_loss: 0.8991, test_loss: 1.0223, test_f1: 0.5376
 epoch: 19, train_loss: 0.9096, test_loss: 0.9524, test_f1: 0.5365
 epoch: 20, train_loss: 0.9103, test_loss: 0.9679, test_f1: 0.5446
 epoch: 21, train_loss: 0.8985, test_loss: 0.9800, test_f1: 0.5233
 epoch: 22, train_loss: 0.8746, test_loss: 1.0335, test_f1: 0.5085
 epoch: 23, train_loss: 0.8761, test_loss: 1.0030, test_f1: 0.5610
 epoch: 24, train_loss: 0.8823, test_loss: 0.9884, test_f1: 0.5334
 epoch: 25, train_loss: 0.8575, test_loss: 0.9754, test_f1: 0.5623
 epoch: 26, train_loss: 0.8801, test_loss: 1.1245, test_f1: 0.5135
 epoch: 27, train_loss: 0.8597, test_loss: 1.0055, test_f1: 0.5366
 epoch: 28, train_loss: 0.8518, test_loss: 1.0558, test_f1: 0.5431
 epoch: 29, train_loss: 0.8652, test_loss: 1.0064, test_f1: 0.5156
 epoch: 30, train_loss: 0.8568, test_loss: 0.9514, test_f1: 0.5542
 epoch: 31, train_loss: 0.8436, test_loss: 0.9638, test_f1: 0.5819
 epoch: 32, train_loss: 0.8373, test_loss: 1.0534, test_f1: 0.5580
 epoch: 33, train_loss: 0.8337, test_loss: 1.0739, test_f1: 0.5080
 epoch: 34, train_loss: 0.8235, test_loss: 1.0186, test_f1: 0.5022
 epoch: 35, train_loss: 0.8344, test_loss: 0.9773, test_f1: 0.5585
 epoch: 36, train_loss: 0.8271, test_loss: 1.0564, test_f1: 0.5367
 epoch: 37, train_loss: 0.8337, test_loss: 1.1222, test_f1: 0.5134
 epoch: 38, train_loss: 0.8287, test_loss: 1.1091, test_f1: 0.5512
 epoch: 39, train_loss: 0.8083, test_loss: 1.0248, test_f1: 0.5566
 epoch: 40, train_loss: 0.8096, test_loss: 1.0065, test_f1: 0.5585
 epoch: 41, train_loss: 0.8073, test_loss: 1.0500, test_f1: 0.5784
 epoch: 42, train_loss: 0.8225, test_loss: 0.9056, test_f1: 0.5832
 epoch: 43, train_loss: 0.8181, test_loss: 0.8777, test_f1: 0.5500
 epoch: 44, train_loss: 0.8163, test_loss: 0.9118, test_f1: 0.5721
 epoch: 45, train_loss: 0.8035, test_loss: 1.0077, test_f1: 0.5745
 epoch: 46, train_loss: 0.8101, test_loss: 0.9201, test_f1: 0.5580
 epoch: 47, train_loss: 0.7981, test_loss: 1.0370, test_f1: 0.5783
 epoch: 48, train_loss: 0.7992, test_loss: 0.9664, test_f1: 0.5640
 epoch: 49, train_loss: 0.7976, test_loss: 0.9435, test_f1: 0.5563
 epoch: 50, train_loss: 0.7841, test_loss: 1.0464, test_f1: 0.5289
 epoch: 51, train_loss: 0.7605, test_loss: 0.9815, test_f1: 0.5705
 epoch: 52, train_loss: 0.7435, test_loss: 1.0213, test_f1: 0.5232
 epoch: 53, train_loss: 0.7340, test_loss: 1.0263, test_f1: 0.5496
 epoch: 54, train_loss: 0.7347, test_loss: 1.0381, test_f1: 0.5746
 epoch: 55, train_loss: 0.7107, test_loss: 1.0365, test_f1: 0.5804
 epoch: 56, train_loss: 0.7152, test_loss: 0.9414, test_f1: 0.5742
 epoch: 57, train_loss: 0.7128, test_loss: 1.0157, test_f1: 0.5678
 epoch: 58, train_loss: 0.7125, test_loss: 1.1007, test_f1: 0.5491
 epoch: 59, train_loss: 0.7279, test_loss: 1.0185, test_f1: 0.5752
 epoch: 60, train_loss: 0.7428, test_loss: 1.1600, test_f1: 0.5760
 epoch: 61, train_loss: 0.6940, test_loss: 1.0517, test_f1: 0.5570
 epoch: 62, train_loss: 0.7083, test_loss: 1.0501, test_f1: 0.5813
 epoch: 63, train_loss: 0.6929, test_loss: 1.1168, test_f1: 0.5679
 epoch: 64, train_loss: 0.6965, test_loss: 1.1174, test_f1: 0.5782
 epoch: 65, train_loss: 0.6901, test_loss: 1.1383, test_f1: 0.5868
 epoch: 66, train_loss: 0.6875, test_loss: 1.0006, test_f1: 0.5725
 epoch: 67, train_loss: 0.6753, test_loss: 1.2236, test_f1: 0.5352
 epoch: 68, train_loss: 0.6775, test_loss: 1.0268, test_f1: 0.5731
 epoch: 69, train_loss: 0.6793, test_loss: 1.0046, test_f1: 0.5667
 epoch: 70, train_loss: 0.6751, test_loss: 1.0901, test_f1: 0.5841
 epoch: 71, train_loss: 0.6600, test_loss: 1.0597, test_f1: 0.5462
 epoch: 72, train_loss: 0.6630, test_loss: 1.0495, test_f1: 0.5616
 epoch: 73, train_loss: 0.6570, test_loss: 1.0198, test_f1: 0.5912
 epoch: 74, train_loss: 0.6487, test_loss: 1.1529, test_f1: 0.5727
 epoch: 75, train_loss: 0.6514, test_loss: 1.2250, test_f1: 0.5754
 epoch: 76, train_loss: 0.6583, test_loss: 1.0188, test_f1: 0.5686
 epoch: 77, train_loss: 0.6646, test_loss: 1.0873, test_f1: 0.5683
 epoch: 78, train_loss: 0.6516, test_loss: 1.0704, test_f1: 0.6006
 epoch: 79, train_loss: 0.6553, test_loss: 1.2033, test_f1: 0.5755
 epoch: 80, train_loss: 0.6509, test_loss: 1.0647, test_f1: 0.5794
 epoch: 81, train_loss: 0.6521, test_loss: 1.1788, test_f1: 0.5702
 epoch: 82, train_loss: 0.6569, test_loss: 1.1700, test_f1: 0.5967
 epoch: 83, train_loss: 0.6509, test_loss: 1.1158, test_f1: 0.5972
 epoch: 84, train_loss: 0.6384, test_loss: 1.0197, test_f1: 0.5769
 epoch: 85, train_loss: 0.6254, test_loss: 1.1365, test_f1: 0.5815
 epoch: 86, train_loss: 0.6597, test_loss: 1.0863, test_f1: 0.6042
 epoch: 87, train_loss: 0.6375, test_loss: 1.2091, test_f1: 0.5783
 epoch: 88, train_loss: 0.6143, test_loss: 1.1473, test_f1: 0.5831
 epoch: 89, train_loss: 0.6343, test_loss: 1.2109, test_f1: 0.5771
 epoch: 90, train_loss: 0.6294, test_loss: 1.2899, test_f1: 0.5552
 epoch: 91, train_loss: 0.6190, test_loss: 1.1603, test_f1: 0.5808
 epoch: 92, train_loss: 0.6283, test_loss: 1.1604, test_f1: 0.5933
 epoch: 93, train_loss: 0.5972, test_loss: 1.1504, test_f1: 0.5886
 epoch: 94, train_loss: 0.6102, test_loss: 1.1857, test_f1: 0.5976
 epoch: 95, train_loss: 0.5938, test_loss: 1.3525, test_f1: 0.5460
 epoch: 96, train_loss: 0.6028, test_loss: 1.2909, test_f1: 0.5905
 epoch: 97, train_loss: 0.5905, test_loss: 1.2704, test_f1: 0.5611
 epoch: 98, train_loss: 0.5978, test_loss: 1.2418, test_f1: 0.5922
 epoch: 99, train_loss: 0.6526, test_loss: 1.1014, test_f1: 0.5769
##################ITERATION #9 ****************************************
 epoch: 0, train_loss: 1.2730, test_loss: 1.1396, test_f1: 0.4320
 epoch: 1, train_loss: 1.1210, test_loss: 1.0258, test_f1: 0.4731
 epoch: 2, train_loss: 1.0651, test_loss: 1.1005, test_f1: 0.4718
 epoch: 3, train_loss: 1.0694, test_loss: 0.9797, test_f1: 0.5082
 epoch: 4, train_loss: 1.0206, test_loss: 1.0015, test_f1: 0.4953
 epoch: 5, train_loss: 1.0148, test_loss: 0.9532, test_f1: 0.5362
 epoch: 6, train_loss: 0.9811, test_loss: 0.9905, test_f1: 0.5119
 epoch: 7, train_loss: 1.0007, test_loss: 1.0174, test_f1: 0.5010
 epoch: 8, train_loss: 0.9867, test_loss: 1.0829, test_f1: 0.5119
 epoch: 9, train_loss: 0.9572, test_loss: 1.0519, test_f1: 0.5076
 epoch: 10, train_loss: 0.9848, test_loss: 1.0634, test_f1: 0.4996
 epoch: 11, train_loss: 0.9696, test_loss: 1.0061, test_f1: 0.5044
 epoch: 12, train_loss: 0.9381, test_loss: 1.1736, test_f1: 0.4788
 epoch: 13, train_loss: 0.9405, test_loss: 1.1215, test_f1: 0.5374
 epoch: 14, train_loss: 0.9279, test_loss: 0.9729, test_f1: 0.4970
 epoch: 15, train_loss: 0.9284, test_loss: 0.9961, test_f1: 0.5070
 epoch: 16, train_loss: 0.9475, test_loss: 1.0319, test_f1: 0.5467
 epoch: 17, train_loss: 0.9158, test_loss: 0.9449, test_f1: 0.5235
 epoch: 18, train_loss: 0.9186, test_loss: 0.9242, test_f1: 0.4883
 epoch: 19, train_loss: 0.9034, test_loss: 0.9746, test_f1: 0.5138
 epoch: 20, train_loss: 0.8924, test_loss: 1.0331, test_f1: 0.4996
 epoch: 21, train_loss: 0.9014, test_loss: 0.9669, test_f1: 0.5053
 epoch: 22, train_loss: 0.8992, test_loss: 0.9472, test_f1: 0.5252
 epoch: 23, train_loss: 0.8815, test_loss: 1.0931, test_f1: 0.5384
 epoch: 24, train_loss: 0.8803, test_loss: 1.2037, test_f1: 0.5587
 epoch: 25, train_loss: 0.8861, test_loss: 1.1060, test_f1: 0.5281
 epoch: 26, train_loss: 0.9109, test_loss: 1.0753, test_f1: 0.5020
 epoch: 27, train_loss: 0.8880, test_loss: 0.9406, test_f1: 0.5395
 epoch: 28, train_loss: 0.8839, test_loss: 1.0239, test_f1: 0.5366
 epoch: 29, train_loss: 0.8627, test_loss: 0.9720, test_f1: 0.5304
 epoch: 30, train_loss: 0.8683, test_loss: 1.1171, test_f1: 0.5181
 epoch: 31, train_loss: 0.8587, test_loss: 1.1531, test_f1: 0.5278
 epoch: 32, train_loss: 0.8577, test_loss: 1.0067, test_f1: 0.5233
 epoch: 33, train_loss: 0.8564, test_loss: 1.0608, test_f1: 0.5469
 epoch: 34, train_loss: 0.8707, test_loss: 1.0544, test_f1: 0.5660
 epoch: 35, train_loss: 0.8644, test_loss: 1.2142, test_f1: 0.5255
 epoch: 36, train_loss: 0.8818, test_loss: 1.3470, test_f1: 0.5297
 epoch: 37, train_loss: 0.8653, test_loss: 1.0363, test_f1: 0.5527
 epoch: 38, train_loss: 0.8490, test_loss: 0.9792, test_f1: 0.5338
 epoch: 39, train_loss: 0.8429, test_loss: 1.1607, test_f1: 0.5046
 epoch: 40, train_loss: 0.8819, test_loss: 1.3296, test_f1: 0.5025
 epoch: 41, train_loss: 0.8566, test_loss: 1.3136, test_f1: 0.5748
 epoch: 42, train_loss: 0.8272, test_loss: 0.9615, test_f1: 0.5516
 epoch: 43, train_loss: 0.8326, test_loss: 1.3401, test_f1: 0.5408
 epoch: 44, train_loss: 0.8512, test_loss: 1.6301, test_f1: 0.5277
 epoch: 45, train_loss: 0.8442, test_loss: 1.3490, test_f1: 0.5498
 epoch: 46, train_loss: 0.8319, test_loss: 1.3090, test_f1: 0.5191
 epoch: 47, train_loss: 0.8243, test_loss: 1.2455, test_f1: 0.5388
 epoch: 48, train_loss: 0.8238, test_loss: 1.0653, test_f1: 0.5660
 epoch: 49, train_loss: 0.8209, test_loss: 1.0112, test_f1: 0.5455
 epoch: 50, train_loss: 0.8258, test_loss: 1.0713, test_f1: 0.5733
 epoch: 51, train_loss: 0.7960, test_loss: 1.2650, test_f1: 0.5529
 epoch: 52, train_loss: 0.7827, test_loss: 1.0502, test_f1: 0.5592
 epoch: 53, train_loss: 0.8182, test_loss: 0.9589, test_f1: 0.5992
 epoch: 54, train_loss: 0.7948, test_loss: 1.0705, test_f1: 0.5479
 epoch: 55, train_loss: 0.7865, test_loss: 1.0035, test_f1: 0.5319
 epoch: 56, train_loss: 0.7774, test_loss: 1.0154, test_f1: 0.5814
 epoch: 57, train_loss: 0.7960, test_loss: 0.9916, test_f1: 0.5494
 epoch: 58, train_loss: 0.7532, test_loss: 1.1867, test_f1: 0.5655
 epoch: 59, train_loss: 0.7641, test_loss: 1.1678, test_f1: 0.5450
 epoch: 60, train_loss: 0.7544, test_loss: 1.1485, test_f1: 0.5496
 epoch: 61, train_loss: 0.7618, test_loss: 0.9192, test_f1: 0.5812
 epoch: 62, train_loss: 0.7624, test_loss: 0.9977, test_f1: 0.5548
 epoch: 63, train_loss: 0.7528, test_loss: 1.5894, test_f1: 0.5624
 epoch: 64, train_loss: 0.7608, test_loss: 1.0683, test_f1: 0.5680
 epoch: 65, train_loss: 0.7497, test_loss: 1.0413, test_f1: 0.5523
 epoch: 66, train_loss: 0.7527, test_loss: 0.9536, test_f1: 0.5830
 epoch: 67, train_loss: 0.7484, test_loss: 0.9943, test_f1: 0.5841
 epoch: 68, train_loss: 0.7279, test_loss: 0.9308, test_f1: 0.5902
 epoch: 69, train_loss: 0.7300, test_loss: 1.1468, test_f1: 0.5528
 epoch: 70, train_loss: 0.7167, test_loss: 0.9192, test_f1: 0.5905
 epoch: 71, train_loss: 0.7212, test_loss: 1.0164, test_f1: 0.5334
 epoch: 72, train_loss: 0.7294, test_loss: 0.9189, test_f1: 0.5608
 epoch: 73, train_loss: 0.7213, test_loss: 1.0864, test_f1: 0.5744
 epoch: 74, train_loss: 0.7416, test_loss: 1.2918, test_f1: 0.5657
 epoch: 75, train_loss: 0.7210, test_loss: 1.3096, test_f1: 0.5826
 epoch: 76, train_loss: 0.7076, test_loss: 1.4669, test_f1: 0.5897
 epoch: 77, train_loss: 0.7019, test_loss: 1.3475, test_f1: 0.5728
 epoch: 78, train_loss: 0.7271, test_loss: 1.0710, test_f1: 0.5656
 epoch: 79, train_loss: 0.7236, test_loss: 1.0870, test_f1: 0.5579
 epoch: 80, train_loss: 0.7083, test_loss: 1.0201, test_f1: 0.5847
 epoch: 81, train_loss: 0.6969, test_loss: 1.0508, test_f1: 0.5710
 epoch: 82, train_loss: 0.6959, test_loss: 1.1999, test_f1: 0.5144
 epoch: 83, train_loss: 0.7136, test_loss: 0.9838, test_f1: 0.5672
 epoch: 84, train_loss: 0.6969, test_loss: 1.1274, test_f1: 0.5786
 epoch: 85, train_loss: 0.6935, test_loss: 1.2478, test_f1: 0.5604
 epoch: 86, train_loss: 0.6844, test_loss: 1.4592, test_f1: 0.5815
 epoch: 87, train_loss: 0.6778, test_loss: 0.9530, test_f1: 0.5740
 epoch: 88, train_loss: 0.6816, test_loss: 1.2623, test_f1: 0.5637
 epoch: 89, train_loss: 0.7429, test_loss: 1.3107, test_f1: 0.5616
 epoch: 90, train_loss: 0.6838, test_loss: 1.0761, test_f1: 0.5567
 epoch: 91, train_loss: 0.6788, test_loss: 1.1315, test_f1: 0.5259
 epoch: 92, train_loss: 0.6776, test_loss: 1.4175, test_f1: 0.5670
 epoch: 93, train_loss: 0.6860, test_loss: 1.1444, test_f1: 0.5745
 epoch: 94, train_loss: 0.6594, test_loss: 1.3915, test_f1: 0.5685
 epoch: 95, train_loss: 0.6935, test_loss: 1.2485, test_f1: 0.5790
 epoch: 96, train_loss: 0.6730, test_loss: 1.4055, test_f1: 0.5748
 epoch: 97, train_loss: 0.6726, test_loss: 1.2606, test_f1: 0.5849
 epoch: 98, train_loss: 0.6446, test_loss: 1.3960, test_f1: 0.5854
 epoch: 99, train_loss: 0.6462, test_loss: 1.0209, test_f1: 0.5650

Training completed in 791.70 seconds
Best F1: 0.6168 at epoch 85
Mean F1 across iterations: 0.5964  0.0120
========================FINAL RESULTS================================
FEGIN weighted F1: 0.6168  0.0120
python main.py --data ltspice_examples --representation component_component --model FEGIN --layers 2 --hiddens 64 --batch_size 32 --lr 0.01 --emb_size 512 --epochs 100 --save_appendix component_component_L2_H64_BS32_LR0.01_E512 --no_val
-----



STDERR:
  File "main.py", line 370, in <module>
    main()
  File "main.py", line 254, in main
    dataset = dataset_class(
  File "/home/philip/projects/ltspice_examples_code_repo/Circuit-Completion-Using-GNNs/component_classification_with_link_prediction_head/evaluation/FEGIN/kernel/circuit_datasets.py", line 15, in __init__
    self.data, self.slices = torch.load(self.processed_paths[0])
  File "/home/philip/.local/lib/python3.8/site-packages/torch/serialization.py", line 1040, in load
    warnings.warn(
  File "/usr/lib/python3.8/warnings.py", line 109, in _showwarnmsg
    sw(msg.message, msg.category, msg.filename, msg.lineno,
  File "main.py", line 47, in warn_with_traceback
    traceback.print_stack(file=log)
/home/philip/projects/ltspice_examples_code_repo/Circuit-Completion-Using-GNNs/component_classification_with_link_prediction_head/evaluation/FEGIN/kernel/circuit_datasets.py:15: FutureWarning: You are using `torch.load` with `weights_only=False` (the current default value), which uses the default pickle module implicitly. It is possible to construct malicious pickle data which will execute arbitrary code during unpickling (See https://github.com/pytorch/pytorch/blob/main/SECURITY.md#untrusted-models for more details). In a future release, the default value for `weights_only` will be flipped to `True`. This limits the functions that could be executed during unpickling. Arbitrary objects will no longer be allowed to be loaded via this mode unless they are explicitly allowlisted by the user via `torch.serialization.add_safe_globals`. We recommend you start setting `weights_only=True` for any use case where you don't have full control of the loaded file. Please open an issue on GitHub for any issues related to this experimental feature.
  self.data, self.slices = torch.load(self.processed_paths[0])
