STDOUT:
Results will be saved in /home/philip/projects/ltspice_examples_code_repo/Circuit-Completion-Using-GNNs/component_classification_with_link_prediction_head/evaluation/FEGIN/results/model_FEGIN_dataset_ltspice_examples
Command line input: python main.py --data ltspice_examples --representation component_component --model FEGIN --layers 2 --hiddens 128 --batch_size 256 --lr 0.0001 --emb_size 128 --epochs 100 --save_appendix component_component_L2_H128_BS256_LR0.0001_E128 --no_val
 is saved.
-----
ltspice_examples - FEGIN
Using 2 layers, 128 hidden units, h = 2
Loading component_component representation dataset
ENTERED
Training FEGIN on component_component representation
Train: 3556, Test: 845
##################ITERATION #0 ****************************************
 epoch: 0, train_loss: 1.3704, test_loss: 1.3678, test_f1: 0.2274
 epoch: 1, train_loss: 1.3539, test_loss: 1.3580, test_f1: 0.2274
 epoch: 2, train_loss: 1.3434, test_loss: 1.3444, test_f1: 0.2274
 epoch: 3, train_loss: 1.3307, test_loss: 1.3278, test_f1: 0.2274
 epoch: 4, train_loss: 1.3162, test_loss: 1.3092, test_f1: 0.2274
 epoch: 5, train_loss: 1.2989, test_loss: 1.2904, test_f1: 0.2274
 epoch: 6, train_loss: 1.2840, test_loss: 1.2726, test_f1: 0.2274
 epoch: 7, train_loss: 1.2666, test_loss: 1.2554, test_f1: 0.2276
 epoch: 8, train_loss: 1.2508, test_loss: 1.2396, test_f1: 0.2390
 epoch: 9, train_loss: 1.2365, test_loss: 1.2253, test_f1: 0.2578
 epoch: 10, train_loss: 1.2207, test_loss: 1.2107, test_f1: 0.2899
 epoch: 11, train_loss: 1.2073, test_loss: 1.1982, test_f1: 0.3399
 epoch: 12, train_loss: 1.1943, test_loss: 1.1835, test_f1: 0.3483
 epoch: 13, train_loss: 1.1827, test_loss: 1.1723, test_f1: 0.3586
 epoch: 14, train_loss: 1.1686, test_loss: 1.1608, test_f1: 0.3573
 epoch: 15, train_loss: 1.1564, test_loss: 1.1491, test_f1: 0.3738
 epoch: 16, train_loss: 1.1474, test_loss: 1.1412, test_f1: 0.4129
 epoch: 17, train_loss: 1.1322, test_loss: 1.1301, test_f1: 0.4324
 epoch: 18, train_loss: 1.1161, test_loss: 1.1199, test_f1: 0.4375
 epoch: 19, train_loss: 1.1083, test_loss: 1.1122, test_f1: 0.4359
 epoch: 20, train_loss: 1.0984, test_loss: 1.1006, test_f1: 0.4467
 epoch: 21, train_loss: 1.0865, test_loss: 1.0931, test_f1: 0.4587
 epoch: 22, train_loss: 1.0719, test_loss: 1.0858, test_f1: 0.4324
 epoch: 23, train_loss: 1.0612, test_loss: 1.0747, test_f1: 0.4625
 epoch: 24, train_loss: 1.0512, test_loss: 1.0660, test_f1: 0.4460
 epoch: 25, train_loss: 1.0318, test_loss: 1.0579, test_f1: 0.4748
 epoch: 26, train_loss: 1.0305, test_loss: 1.0491, test_f1: 0.4750
 epoch: 27, train_loss: 1.0202, test_loss: 1.0428, test_f1: 0.4686
 epoch: 28, train_loss: 1.0113, test_loss: 1.0353, test_f1: 0.4829
 epoch: 29, train_loss: 0.9992, test_loss: 1.0288, test_f1: 0.4788
 epoch: 30, train_loss: 0.9867, test_loss: 1.0190, test_f1: 0.4780
 epoch: 31, train_loss: 0.9814, test_loss: 1.0159, test_f1: 0.4813
 epoch: 32, train_loss: 0.9706, test_loss: 1.0164, test_f1: 0.4867
 epoch: 33, train_loss: 0.9571, test_loss: 1.0105, test_f1: 0.4828
 epoch: 34, train_loss: 0.9486, test_loss: 1.0086, test_f1: 0.4827
 epoch: 35, train_loss: 0.9415, test_loss: 0.9942, test_f1: 0.4964
 epoch: 36, train_loss: 0.9297, test_loss: 0.9980, test_f1: 0.4920
 epoch: 37, train_loss: 0.9263, test_loss: 0.9971, test_f1: 0.4813
 epoch: 38, train_loss: 0.9151, test_loss: 0.9870, test_f1: 0.4831
 epoch: 39, train_loss: 0.9126, test_loss: 0.9847, test_f1: 0.4699
 epoch: 40, train_loss: 0.9048, test_loss: 1.0007, test_f1: 0.4803
 epoch: 41, train_loss: 0.8968, test_loss: 0.9877, test_f1: 0.4880
 epoch: 42, train_loss: 0.8856, test_loss: 0.9834, test_f1: 0.4751
 epoch: 43, train_loss: 0.8793, test_loss: 0.9815, test_f1: 0.4866
 epoch: 44, train_loss: 0.8698, test_loss: 1.0137, test_f1: 0.4735
 epoch: 45, train_loss: 0.8616, test_loss: 0.9837, test_f1: 0.4889
 epoch: 46, train_loss: 0.8581, test_loss: 0.9920, test_f1: 0.5031
 epoch: 47, train_loss: 0.8449, test_loss: 0.9934, test_f1: 0.4949
 epoch: 48, train_loss: 0.8363, test_loss: 0.9936, test_f1: 0.5001
 epoch: 49, train_loss: 0.8271, test_loss: 0.9932, test_f1: 0.5055
 epoch: 50, train_loss: 0.8308, test_loss: 1.0004, test_f1: 0.4916
 epoch: 51, train_loss: 0.8244, test_loss: 0.9973, test_f1: 0.4953
 epoch: 52, train_loss: 0.8085, test_loss: 1.0068, test_f1: 0.5013
 epoch: 53, train_loss: 0.8107, test_loss: 1.0047, test_f1: 0.4958
 epoch: 54, train_loss: 0.8017, test_loss: 1.0102, test_f1: 0.4883
 epoch: 55, train_loss: 0.8000, test_loss: 1.0087, test_f1: 0.4941
 epoch: 56, train_loss: 0.7928, test_loss: 1.0147, test_f1: 0.5034
 epoch: 57, train_loss: 0.7914, test_loss: 1.0318, test_f1: 0.4865
 epoch: 58, train_loss: 0.7887, test_loss: 1.0173, test_f1: 0.5079
 epoch: 59, train_loss: 0.7827, test_loss: 1.0148, test_f1: 0.5028
 epoch: 60, train_loss: 0.7823, test_loss: 1.0321, test_f1: 0.5013
 epoch: 61, train_loss: 0.7737, test_loss: 1.0231, test_f1: 0.4918
 epoch: 62, train_loss: 0.7734, test_loss: 1.0274, test_f1: 0.5111
 epoch: 63, train_loss: 0.7687, test_loss: 1.0277, test_f1: 0.5019
 epoch: 64, train_loss: 0.7686, test_loss: 1.0310, test_f1: 0.5019
 epoch: 65, train_loss: 0.7607, test_loss: 1.0408, test_f1: 0.5091
 epoch: 66, train_loss: 0.7607, test_loss: 1.0421, test_f1: 0.4902
 epoch: 67, train_loss: 0.7563, test_loss: 1.0394, test_f1: 0.4974
 epoch: 68, train_loss: 0.7560, test_loss: 1.0430, test_f1: 0.5028
 epoch: 69, train_loss: 0.7443, test_loss: 1.0447, test_f1: 0.5022
 epoch: 70, train_loss: 0.7490, test_loss: 1.0498, test_f1: 0.4923
 epoch: 71, train_loss: 0.7396, test_loss: 1.0522, test_f1: 0.5056
 epoch: 72, train_loss: 0.7465, test_loss: 1.0478, test_f1: 0.4946
 epoch: 73, train_loss: 0.7386, test_loss: 1.0569, test_f1: 0.5055
 epoch: 74, train_loss: 0.7343, test_loss: 1.0597, test_f1: 0.5038
 epoch: 75, train_loss: 0.7353, test_loss: 1.0647, test_f1: 0.5108
 epoch: 76, train_loss: 0.7255, test_loss: 1.0680, test_f1: 0.4966
 epoch: 77, train_loss: 0.7369, test_loss: 1.0597, test_f1: 0.4959
 epoch: 78, train_loss: 0.7307, test_loss: 1.0755, test_f1: 0.5127
 epoch: 79, train_loss: 0.7266, test_loss: 1.0698, test_f1: 0.5000
 epoch: 80, train_loss: 0.7195, test_loss: 1.0794, test_f1: 0.4970
 epoch: 81, train_loss: 0.7124, test_loss: 1.0822, test_f1: 0.4976
 epoch: 82, train_loss: 0.7076, test_loss: 1.0897, test_f1: 0.5079
 epoch: 83, train_loss: 0.7064, test_loss: 1.0823, test_f1: 0.4962
 epoch: 84, train_loss: 0.7057, test_loss: 1.0952, test_f1: 0.4982
 epoch: 85, train_loss: 0.7089, test_loss: 1.0848, test_f1: 0.4937
 epoch: 86, train_loss: 0.7009, test_loss: 1.0892, test_f1: 0.5058
 epoch: 87, train_loss: 0.7113, test_loss: 1.1031, test_f1: 0.5017
 epoch: 88, train_loss: 0.6898, test_loss: 1.0922, test_f1: 0.5144
 epoch: 89, train_loss: 0.6896, test_loss: 1.1118, test_f1: 0.5027
 epoch: 90, train_loss: 0.6920, test_loss: 1.1085, test_f1: 0.5011
 epoch: 91, train_loss: 0.6887, test_loss: 1.1103, test_f1: 0.5055
 epoch: 92, train_loss: 0.6840, test_loss: 1.1218, test_f1: 0.5070
 epoch: 93, train_loss: 0.6776, test_loss: 1.0892, test_f1: 0.5210
 epoch: 94, train_loss: 0.6768, test_loss: 1.1070, test_f1: 0.5153
 epoch: 95, train_loss: 0.6757, test_loss: 1.1211, test_f1: 0.5273
 epoch: 96, train_loss: 0.6682, test_loss: 1.1130, test_f1: 0.5151
 epoch: 97, train_loss: 0.6698, test_loss: 1.1249, test_f1: 0.5289
 epoch: 98, train_loss: 0.6726, test_loss: 1.1319, test_f1: 0.5149
 epoch: 99, train_loss: 0.6719, test_loss: 1.1146, test_f1: 0.5187
##################ITERATION #1 ****************************************
 epoch: 0, train_loss: 1.3351, test_loss: 1.3363, test_f1: 0.2274
 epoch: 1, train_loss: 1.2924, test_loss: 1.3053, test_f1: 0.2533
 epoch: 2, train_loss: 1.2716, test_loss: 1.2738, test_f1: 0.2603
 epoch: 3, train_loss: 1.2522, test_loss: 1.2417, test_f1: 0.2582
 epoch: 4, train_loss: 1.2354, test_loss: 1.2155, test_f1: 0.3119
 epoch: 5, train_loss: 1.2173, test_loss: 1.1932, test_f1: 0.3351
 epoch: 6, train_loss: 1.2067, test_loss: 1.1750, test_f1: 0.3632
 epoch: 7, train_loss: 1.1900, test_loss: 1.1596, test_f1: 0.4025
 epoch: 8, train_loss: 1.1729, test_loss: 1.1453, test_f1: 0.4179
 epoch: 9, train_loss: 1.1655, test_loss: 1.1330, test_f1: 0.4360
 epoch: 10, train_loss: 1.1514, test_loss: 1.1185, test_f1: 0.4401
 epoch: 11, train_loss: 1.1380, test_loss: 1.1063, test_f1: 0.4454
 epoch: 12, train_loss: 1.1238, test_loss: 1.0948, test_f1: 0.4553
 epoch: 13, train_loss: 1.1117, test_loss: 1.0799, test_f1: 0.4432
 epoch: 14, train_loss: 1.0994, test_loss: 1.0674, test_f1: 0.4366
 epoch: 15, train_loss: 1.0934, test_loss: 1.0581, test_f1: 0.4426
 epoch: 16, train_loss: 1.0759, test_loss: 1.0479, test_f1: 0.4423
 epoch: 17, train_loss: 1.0670, test_loss: 1.0354, test_f1: 0.4526
 epoch: 18, train_loss: 1.0541, test_loss: 1.0259, test_f1: 0.4506
 epoch: 19, train_loss: 1.0472, test_loss: 1.0190, test_f1: 0.4498
 epoch: 20, train_loss: 1.0416, test_loss: 1.0102, test_f1: 0.4557
 epoch: 21, train_loss: 1.0320, test_loss: 1.0035, test_f1: 0.4724
 epoch: 22, train_loss: 1.0239, test_loss: 0.9976, test_f1: 0.4796
 epoch: 23, train_loss: 1.0066, test_loss: 0.9882, test_f1: 0.4831
 epoch: 24, train_loss: 1.0050, test_loss: 0.9810, test_f1: 0.4833
 epoch: 25, train_loss: 0.9864, test_loss: 0.9780, test_f1: 0.4734
 epoch: 26, train_loss: 0.9837, test_loss: 0.9755, test_f1: 0.4908
 epoch: 27, train_loss: 0.9796, test_loss: 0.9668, test_f1: 0.4933
 epoch: 28, train_loss: 0.9677, test_loss: 0.9617, test_f1: 0.4882
 epoch: 29, train_loss: 0.9578, test_loss: 0.9553, test_f1: 0.4839
 epoch: 30, train_loss: 0.9586, test_loss: 0.9618, test_f1: 0.4799
 epoch: 31, train_loss: 0.9431, test_loss: 0.9552, test_f1: 0.4831
 epoch: 32, train_loss: 0.9391, test_loss: 0.9519, test_f1: 0.4827
 epoch: 33, train_loss: 0.9301, test_loss: 0.9501, test_f1: 0.4830
 epoch: 34, train_loss: 0.9276, test_loss: 0.9475, test_f1: 0.5082
 epoch: 35, train_loss: 0.9132, test_loss: 0.9470, test_f1: 0.4893
 epoch: 36, train_loss: 0.9076, test_loss: 0.9404, test_f1: 0.4784
 epoch: 37, train_loss: 0.9033, test_loss: 0.9438, test_f1: 0.4950
 epoch: 38, train_loss: 0.8999, test_loss: 0.9339, test_f1: 0.5048
 epoch: 39, train_loss: 0.8916, test_loss: 0.9453, test_f1: 0.5002
 epoch: 40, train_loss: 0.8866, test_loss: 0.9424, test_f1: 0.5059
 epoch: 41, train_loss: 0.8837, test_loss: 0.9442, test_f1: 0.4999
 epoch: 42, train_loss: 0.8755, test_loss: 0.9405, test_f1: 0.5047
 epoch: 43, train_loss: 0.8627, test_loss: 0.9473, test_f1: 0.5037
 epoch: 44, train_loss: 0.8633, test_loss: 0.9423, test_f1: 0.5165
 epoch: 45, train_loss: 0.8556, test_loss: 0.9473, test_f1: 0.5141
 epoch: 46, train_loss: 0.8512, test_loss: 0.9358, test_f1: 0.5073
 epoch: 47, train_loss: 0.8494, test_loss: 0.9396, test_f1: 0.5165
 epoch: 48, train_loss: 0.8364, test_loss: 0.9493, test_f1: 0.5099
 epoch: 49, train_loss: 0.8313, test_loss: 0.9400, test_f1: 0.5147
 epoch: 50, train_loss: 0.8265, test_loss: 0.9517, test_f1: 0.5168
 epoch: 51, train_loss: 0.8234, test_loss: 0.9451, test_f1: 0.5168
 epoch: 52, train_loss: 0.8132, test_loss: 0.9503, test_f1: 0.5216
 epoch: 53, train_loss: 0.8193, test_loss: 0.9488, test_f1: 0.5176
 epoch: 54, train_loss: 0.8110, test_loss: 0.9433, test_f1: 0.5219
 epoch: 55, train_loss: 0.8056, test_loss: 0.9423, test_f1: 0.5280
 epoch: 56, train_loss: 0.8021, test_loss: 0.9458, test_f1: 0.5248
 epoch: 57, train_loss: 0.8031, test_loss: 0.9456, test_f1: 0.5285
 epoch: 58, train_loss: 0.8085, test_loss: 0.9464, test_f1: 0.5216
 epoch: 59, train_loss: 0.8000, test_loss: 0.9504, test_f1: 0.5261
 epoch: 60, train_loss: 0.7993, test_loss: 0.9495, test_f1: 0.5280
 epoch: 61, train_loss: 0.7877, test_loss: 0.9479, test_f1: 0.5139
 epoch: 62, train_loss: 0.7919, test_loss: 0.9500, test_f1: 0.5273
 epoch: 63, train_loss: 0.7840, test_loss: 0.9471, test_f1: 0.5222
 epoch: 64, train_loss: 0.7829, test_loss: 0.9573, test_f1: 0.5241
 epoch: 65, train_loss: 0.7766, test_loss: 0.9595, test_f1: 0.5286
 epoch: 66, train_loss: 0.7863, test_loss: 0.9482, test_f1: 0.5275
 epoch: 67, train_loss: 0.7753, test_loss: 0.9525, test_f1: 0.5173
 epoch: 68, train_loss: 0.7800, test_loss: 0.9497, test_f1: 0.5229
 epoch: 69, train_loss: 0.7680, test_loss: 0.9575, test_f1: 0.5214
 epoch: 70, train_loss: 0.7758, test_loss: 0.9645, test_f1: 0.5247
 epoch: 71, train_loss: 0.7613, test_loss: 0.9688, test_f1: 0.5149
 epoch: 72, train_loss: 0.7587, test_loss: 0.9641, test_f1: 0.5284
 epoch: 73, train_loss: 0.7507, test_loss: 0.9516, test_f1: 0.5303
 epoch: 74, train_loss: 0.7603, test_loss: 0.9679, test_f1: 0.5291
 epoch: 75, train_loss: 0.7619, test_loss: 0.9725, test_f1: 0.5160
 epoch: 76, train_loss: 0.7466, test_loss: 0.9725, test_f1: 0.5210
 epoch: 77, train_loss: 0.7521, test_loss: 0.9627, test_f1: 0.5130
 epoch: 78, train_loss: 0.7489, test_loss: 0.9659, test_f1: 0.5287
 epoch: 79, train_loss: 0.7555, test_loss: 0.9695, test_f1: 0.5235
 epoch: 80, train_loss: 0.7458, test_loss: 0.9680, test_f1: 0.5296
 epoch: 81, train_loss: 0.7443, test_loss: 0.9661, test_f1: 0.5225
 epoch: 82, train_loss: 0.7338, test_loss: 0.9753, test_f1: 0.5295
 epoch: 83, train_loss: 0.7417, test_loss: 0.9737, test_f1: 0.5343
 epoch: 84, train_loss: 0.7402, test_loss: 0.9741, test_f1: 0.5352
 epoch: 85, train_loss: 0.7337, test_loss: 0.9837, test_f1: 0.5357
 epoch: 86, train_loss: 0.7282, test_loss: 0.9813, test_f1: 0.5345
 epoch: 87, train_loss: 0.7356, test_loss: 0.9989, test_f1: 0.5266
 epoch: 88, train_loss: 0.7336, test_loss: 0.9757, test_f1: 0.5356
 epoch: 89, train_loss: 0.7146, test_loss: 0.9887, test_f1: 0.5332
 epoch: 90, train_loss: 0.7272, test_loss: 0.9947, test_f1: 0.5350
 epoch: 91, train_loss: 0.7285, test_loss: 0.9946, test_f1: 0.5365
 epoch: 92, train_loss: 0.7188, test_loss: 1.0057, test_f1: 0.5391
 epoch: 93, train_loss: 0.7191, test_loss: 0.9943, test_f1: 0.5349
 epoch: 94, train_loss: 0.7116, test_loss: 0.9978, test_f1: 0.5341
 epoch: 95, train_loss: 0.7135, test_loss: 1.0128, test_f1: 0.5247
 epoch: 96, train_loss: 0.7081, test_loss: 1.0059, test_f1: 0.5336
 epoch: 97, train_loss: 0.7021, test_loss: 1.0166, test_f1: 0.5322
 epoch: 98, train_loss: 0.7036, test_loss: 1.0118, test_f1: 0.5330
 epoch: 99, train_loss: 0.6999, test_loss: 1.0060, test_f1: 0.5285
##################ITERATION #2 ****************************************
 epoch: 0, train_loss: 1.3058, test_loss: 1.3053, test_f1: 0.2274
 epoch: 1, train_loss: 1.2369, test_loss: 1.2740, test_f1: 0.2555
 epoch: 2, train_loss: 1.2182, test_loss: 1.2292, test_f1: 0.2839
 epoch: 3, train_loss: 1.1940, test_loss: 1.1891, test_f1: 0.3825
 epoch: 4, train_loss: 1.1745, test_loss: 1.1597, test_f1: 0.4200
 epoch: 5, train_loss: 1.1564, test_loss: 1.1404, test_f1: 0.4575
 epoch: 6, train_loss: 1.1429, test_loss: 1.1234, test_f1: 0.4632
 epoch: 7, train_loss: 1.1263, test_loss: 1.1054, test_f1: 0.4597
 epoch: 8, train_loss: 1.1142, test_loss: 1.0893, test_f1: 0.4707
 epoch: 9, train_loss: 1.0986, test_loss: 1.0791, test_f1: 0.4718
 epoch: 10, train_loss: 1.0887, test_loss: 1.0691, test_f1: 0.4682
 epoch: 11, train_loss: 1.0741, test_loss: 1.0598, test_f1: 0.4748
 epoch: 12, train_loss: 1.0694, test_loss: 1.0532, test_f1: 0.4596
 epoch: 13, train_loss: 1.0567, test_loss: 1.0470, test_f1: 0.4592
 epoch: 14, train_loss: 1.0498, test_loss: 1.0352, test_f1: 0.4663
 epoch: 15, train_loss: 1.0416, test_loss: 1.0256, test_f1: 0.4722
 epoch: 16, train_loss: 1.0399, test_loss: 1.0232, test_f1: 0.4743
 epoch: 17, train_loss: 1.0215, test_loss: 1.0162, test_f1: 0.4697
 epoch: 18, train_loss: 1.0244, test_loss: 1.0107, test_f1: 0.4750
 epoch: 19, train_loss: 1.0126, test_loss: 1.0229, test_f1: 0.4807
 epoch: 20, train_loss: 1.0059, test_loss: 1.0000, test_f1: 0.4875
 epoch: 21, train_loss: 0.9942, test_loss: 1.0068, test_f1: 0.4850
 epoch: 22, train_loss: 0.9887, test_loss: 0.9934, test_f1: 0.4928
 epoch: 23, train_loss: 0.9793, test_loss: 0.9866, test_f1: 0.4959
 epoch: 24, train_loss: 0.9779, test_loss: 0.9880, test_f1: 0.4856
 epoch: 25, train_loss: 0.9684, test_loss: 0.9788, test_f1: 0.4986
 epoch: 26, train_loss: 0.9586, test_loss: 0.9849, test_f1: 0.4882
 epoch: 27, train_loss: 0.9546, test_loss: 0.9808, test_f1: 0.5020
 epoch: 28, train_loss: 0.9526, test_loss: 0.9712, test_f1: 0.5075
 epoch: 29, train_loss: 0.9424, test_loss: 0.9725, test_f1: 0.4969
 epoch: 30, train_loss: 0.9386, test_loss: 0.9727, test_f1: 0.4916
 epoch: 31, train_loss: 0.9272, test_loss: 0.9714, test_f1: 0.4960
 epoch: 32, train_loss: 0.9291, test_loss: 0.9707, test_f1: 0.4889
 epoch: 33, train_loss: 0.9165, test_loss: 0.9569, test_f1: 0.4971
 epoch: 34, train_loss: 0.9052, test_loss: 0.9761, test_f1: 0.4880
 epoch: 35, train_loss: 0.9096, test_loss: 0.9494, test_f1: 0.5011
 epoch: 36, train_loss: 0.9020, test_loss: 0.9849, test_f1: 0.4912
 epoch: 37, train_loss: 0.9090, test_loss: 0.9653, test_f1: 0.4938
 epoch: 38, train_loss: 0.8968, test_loss: 0.9494, test_f1: 0.5005
 epoch: 39, train_loss: 0.8878, test_loss: 0.9600, test_f1: 0.5068
 epoch: 40, train_loss: 0.8881, test_loss: 0.9582, test_f1: 0.4894
 epoch: 41, train_loss: 0.8827, test_loss: 0.9612, test_f1: 0.4910
 epoch: 42, train_loss: 0.8746, test_loss: 0.9596, test_f1: 0.4972
 epoch: 43, train_loss: 0.8647, test_loss: 0.9571, test_f1: 0.5006
 epoch: 44, train_loss: 0.8609, test_loss: 0.9658, test_f1: 0.5016
 epoch: 45, train_loss: 0.8523, test_loss: 0.9466, test_f1: 0.5036
 epoch: 46, train_loss: 0.8635, test_loss: 0.9678, test_f1: 0.5056
 epoch: 47, train_loss: 0.8490, test_loss: 0.9699, test_f1: 0.5083
 epoch: 48, train_loss: 0.8459, test_loss: 0.9500, test_f1: 0.5075
 epoch: 49, train_loss: 0.8322, test_loss: 0.9710, test_f1: 0.4891
 epoch: 50, train_loss: 0.8317, test_loss: 0.9641, test_f1: 0.5197
 epoch: 51, train_loss: 0.8376, test_loss: 0.9710, test_f1: 0.4917
 epoch: 52, train_loss: 0.8212, test_loss: 0.9649, test_f1: 0.5056
 epoch: 53, train_loss: 0.8208, test_loss: 0.9650, test_f1: 0.5061
 epoch: 54, train_loss: 0.8149, test_loss: 0.9678, test_f1: 0.5051
 epoch: 55, train_loss: 0.8103, test_loss: 0.9782, test_f1: 0.4971
 epoch: 56, train_loss: 0.8154, test_loss: 0.9759, test_f1: 0.5025
 epoch: 57, train_loss: 0.8018, test_loss: 0.9708, test_f1: 0.5034
 epoch: 58, train_loss: 0.8065, test_loss: 0.9718, test_f1: 0.5085
 epoch: 59, train_loss: 0.8000, test_loss: 0.9809, test_f1: 0.5032
 epoch: 60, train_loss: 0.7996, test_loss: 0.9812, test_f1: 0.5068
 epoch: 61, train_loss: 0.7978, test_loss: 0.9887, test_f1: 0.5023
 epoch: 62, train_loss: 0.7922, test_loss: 1.0003, test_f1: 0.4893
 epoch: 63, train_loss: 0.7910, test_loss: 0.9721, test_f1: 0.5072
 epoch: 64, train_loss: 0.7936, test_loss: 0.9948, test_f1: 0.5012
 epoch: 65, train_loss: 0.7881, test_loss: 0.9896, test_f1: 0.4946
 epoch: 66, train_loss: 0.7919, test_loss: 0.9908, test_f1: 0.5070
 epoch: 67, train_loss: 0.7912, test_loss: 0.9818, test_f1: 0.5101
 epoch: 68, train_loss: 0.7805, test_loss: 0.9878, test_f1: 0.5043
 epoch: 69, train_loss: 0.7762, test_loss: 0.9815, test_f1: 0.5058
 epoch: 70, train_loss: 0.7782, test_loss: 0.9981, test_f1: 0.5005
 epoch: 71, train_loss: 0.7733, test_loss: 1.0008, test_f1: 0.5038
 epoch: 72, train_loss: 0.7598, test_loss: 1.0124, test_f1: 0.4816
 epoch: 73, train_loss: 0.7718, test_loss: 1.0135, test_f1: 0.4793
 epoch: 74, train_loss: 0.7680, test_loss: 1.0008, test_f1: 0.5105
 epoch: 75, train_loss: 0.7600, test_loss: 0.9995, test_f1: 0.5142
 epoch: 76, train_loss: 0.7563, test_loss: 1.0047, test_f1: 0.5032
 epoch: 77, train_loss: 0.7612, test_loss: 1.0127, test_f1: 0.5116
 epoch: 78, train_loss: 0.7563, test_loss: 1.0200, test_f1: 0.4831
 epoch: 79, train_loss: 0.7523, test_loss: 1.0104, test_f1: 0.5018
 epoch: 80, train_loss: 0.7459, test_loss: 1.0277, test_f1: 0.4857
 epoch: 81, train_loss: 0.7513, test_loss: 1.0116, test_f1: 0.5080
 epoch: 82, train_loss: 0.7501, test_loss: 1.0268, test_f1: 0.5091
 epoch: 83, train_loss: 0.7435, test_loss: 1.0310, test_f1: 0.4945
 epoch: 84, train_loss: 0.7433, test_loss: 1.0279, test_f1: 0.5003
 epoch: 85, train_loss: 0.7301, test_loss: 1.0334, test_f1: 0.4959
 epoch: 86, train_loss: 0.7390, test_loss: 1.0336, test_f1: 0.4988
 epoch: 87, train_loss: 0.7354, test_loss: 1.0342, test_f1: 0.5129
 epoch: 88, train_loss: 0.7340, test_loss: 1.0245, test_f1: 0.5010
 epoch: 89, train_loss: 0.7263, test_loss: 1.0570, test_f1: 0.4843
 epoch: 90, train_loss: 0.7241, test_loss: 1.0531, test_f1: 0.5032
 epoch: 91, train_loss: 0.7303, test_loss: 1.0541, test_f1: 0.4831
 epoch: 92, train_loss: 0.7324, test_loss: 1.0548, test_f1: 0.4873
 epoch: 93, train_loss: 0.7117, test_loss: 1.0387, test_f1: 0.5185
 epoch: 94, train_loss: 0.7190, test_loss: 1.0477, test_f1: 0.5021
 epoch: 95, train_loss: 0.7126, test_loss: 1.0692, test_f1: 0.4849
 epoch: 96, train_loss: 0.7178, test_loss: 1.0322, test_f1: 0.5122
 epoch: 97, train_loss: 0.7239, test_loss: 1.0438, test_f1: 0.5121
 epoch: 98, train_loss: 0.7178, test_loss: 1.0480, test_f1: 0.5053
 epoch: 99, train_loss: 0.7140, test_loss: 1.0824, test_f1: 0.4855
##################ITERATION #3 ****************************************
 epoch: 0, train_loss: 1.3261, test_loss: 1.3011, test_f1: 0.2274
 epoch: 1, train_loss: 1.2416, test_loss: 1.2574, test_f1: 0.2859
 epoch: 2, train_loss: 1.2131, test_loss: 1.2058, test_f1: 0.3556
 epoch: 3, train_loss: 1.1858, test_loss: 1.1664, test_f1: 0.4170
 epoch: 4, train_loss: 1.1725, test_loss: 1.1414, test_f1: 0.4461
 epoch: 5, train_loss: 1.1503, test_loss: 1.1256, test_f1: 0.4531
 epoch: 6, train_loss: 1.1374, test_loss: 1.1147, test_f1: 0.4590
 epoch: 7, train_loss: 1.1275, test_loss: 1.1038, test_f1: 0.4572
 epoch: 8, train_loss: 1.1072, test_loss: 1.0966, test_f1: 0.4600
 epoch: 9, train_loss: 1.1062, test_loss: 1.0935, test_f1: 0.4522
 epoch: 10, train_loss: 1.0833, test_loss: 1.0806, test_f1: 0.4614
 epoch: 11, train_loss: 1.0794, test_loss: 1.0707, test_f1: 0.4646
 epoch: 12, train_loss: 1.0751, test_loss: 1.0622, test_f1: 0.4534
 epoch: 13, train_loss: 1.0601, test_loss: 1.0667, test_f1: 0.4422
 epoch: 14, train_loss: 1.0469, test_loss: 1.0575, test_f1: 0.4532
 epoch: 15, train_loss: 1.0427, test_loss: 1.0435, test_f1: 0.4656
 epoch: 16, train_loss: 1.0291, test_loss: 1.0374, test_f1: 0.4631
 epoch: 17, train_loss: 1.0169, test_loss: 1.0333, test_f1: 0.4613
 epoch: 18, train_loss: 1.0151, test_loss: 1.0239, test_f1: 0.4654
 epoch: 19, train_loss: 1.0077, test_loss: 1.0126, test_f1: 0.4565
 epoch: 20, train_loss: 0.9933, test_loss: 1.0049, test_f1: 0.4722
 epoch: 21, train_loss: 0.9881, test_loss: 1.0061, test_f1: 0.4666
 epoch: 22, train_loss: 0.9878, test_loss: 0.9983, test_f1: 0.4653
 epoch: 23, train_loss: 0.9736, test_loss: 0.9954, test_f1: 0.4718
 epoch: 24, train_loss: 0.9744, test_loss: 0.9859, test_f1: 0.4815
 epoch: 25, train_loss: 0.9605, test_loss: 0.9803, test_f1: 0.4805
 epoch: 26, train_loss: 0.9573, test_loss: 0.9847, test_f1: 0.4907
 epoch: 27, train_loss: 0.9421, test_loss: 0.9767, test_f1: 0.4823
 epoch: 28, train_loss: 0.9349, test_loss: 0.9796, test_f1: 0.4921
 epoch: 29, train_loss: 0.9268, test_loss: 0.9769, test_f1: 0.4981
 epoch: 30, train_loss: 0.9246, test_loss: 0.9714, test_f1: 0.5018
 epoch: 31, train_loss: 0.9246, test_loss: 0.9647, test_f1: 0.4993
 epoch: 32, train_loss: 0.9105, test_loss: 0.9666, test_f1: 0.4994
 epoch: 33, train_loss: 0.9081, test_loss: 0.9522, test_f1: 0.5031
 epoch: 34, train_loss: 0.9007, test_loss: 0.9634, test_f1: 0.5010
 epoch: 35, train_loss: 0.8964, test_loss: 0.9660, test_f1: 0.5008
 epoch: 36, train_loss: 0.8904, test_loss: 0.9601, test_f1: 0.5114
 epoch: 37, train_loss: 0.8853, test_loss: 0.9664, test_f1: 0.4999
 epoch: 38, train_loss: 0.8796, test_loss: 0.9681, test_f1: 0.5105
 epoch: 39, train_loss: 0.8710, test_loss: 0.9643, test_f1: 0.5057
 epoch: 40, train_loss: 0.8575, test_loss: 0.9650, test_f1: 0.5189
 epoch: 41, train_loss: 0.8601, test_loss: 0.9838, test_f1: 0.5110
 epoch: 42, train_loss: 0.8512, test_loss: 0.9958, test_f1: 0.4930
 epoch: 43, train_loss: 0.8511, test_loss: 0.9815, test_f1: 0.4986
 epoch: 44, train_loss: 0.8468, test_loss: 0.9766, test_f1: 0.5145
 epoch: 45, train_loss: 0.8421, test_loss: 0.9768, test_f1: 0.5055
 epoch: 46, train_loss: 0.8329, test_loss: 0.9938, test_f1: 0.5192
 epoch: 47, train_loss: 0.8312, test_loss: 0.9997, test_f1: 0.5117
 epoch: 48, train_loss: 0.8224, test_loss: 0.9856, test_f1: 0.5150
 epoch: 49, train_loss: 0.8226, test_loss: 1.0008, test_f1: 0.5158
 epoch: 50, train_loss: 0.8193, test_loss: 1.0046, test_f1: 0.5048
 epoch: 51, train_loss: 0.8053, test_loss: 0.9898, test_f1: 0.5190
 epoch: 52, train_loss: 0.8025, test_loss: 0.9953, test_f1: 0.5194
 epoch: 53, train_loss: 0.7953, test_loss: 1.0021, test_f1: 0.5038
 epoch: 54, train_loss: 0.7987, test_loss: 0.9904, test_f1: 0.5134
 epoch: 55, train_loss: 0.8009, test_loss: 0.9928, test_f1: 0.5194
 epoch: 56, train_loss: 0.7917, test_loss: 0.9939, test_f1: 0.5192
 epoch: 57, train_loss: 0.7906, test_loss: 1.0035, test_f1: 0.5203
 epoch: 58, train_loss: 0.7823, test_loss: 1.0070, test_f1: 0.5244
 epoch: 59, train_loss: 0.7797, test_loss: 1.0107, test_f1: 0.5195
 epoch: 60, train_loss: 0.7816, test_loss: 1.0175, test_f1: 0.5176
 epoch: 61, train_loss: 0.7773, test_loss: 1.0072, test_f1: 0.5244
 epoch: 62, train_loss: 0.7832, test_loss: 1.0195, test_f1: 0.5149
 epoch: 63, train_loss: 0.7742, test_loss: 1.0308, test_f1: 0.4917
 epoch: 64, train_loss: 0.7736, test_loss: 1.0501, test_f1: 0.4900
 epoch: 65, train_loss: 0.7618, test_loss: 1.0325, test_f1: 0.4998
 epoch: 66, train_loss: 0.7721, test_loss: 1.0283, test_f1: 0.5013
 epoch: 67, train_loss: 0.7704, test_loss: 1.0264, test_f1: 0.5132
 epoch: 68, train_loss: 0.7643, test_loss: 1.0239, test_f1: 0.5124
 epoch: 69, train_loss: 0.7633, test_loss: 1.0354, test_f1: 0.5295
 epoch: 70, train_loss: 0.7531, test_loss: 1.0581, test_f1: 0.4989
 epoch: 71, train_loss: 0.7592, test_loss: 1.0554, test_f1: 0.5143
 epoch: 72, train_loss: 0.7436, test_loss: 1.0733, test_f1: 0.5000
 epoch: 73, train_loss: 0.7499, test_loss: 1.0650, test_f1: 0.5054
 epoch: 74, train_loss: 0.7488, test_loss: 1.0576, test_f1: 0.5139
 epoch: 75, train_loss: 0.7526, test_loss: 1.0664, test_f1: 0.5150
 epoch: 76, train_loss: 0.7440, test_loss: 1.0783, test_f1: 0.5000
 epoch: 77, train_loss: 0.7428, test_loss: 1.0509, test_f1: 0.5265
 epoch: 78, train_loss: 0.7410, test_loss: 1.0516, test_f1: 0.5329
 epoch: 79, train_loss: 0.7429, test_loss: 1.0550, test_f1: 0.5245
 epoch: 80, train_loss: 0.7383, test_loss: 1.0642, test_f1: 0.5312
 epoch: 81, train_loss: 0.7354, test_loss: 1.0589, test_f1: 0.5187
 epoch: 82, train_loss: 0.7387, test_loss: 1.0712, test_f1: 0.5121
 epoch: 83, train_loss: 0.7377, test_loss: 1.0512, test_f1: 0.5220
 epoch: 84, train_loss: 0.7290, test_loss: 1.0735, test_f1: 0.5176
 epoch: 85, train_loss: 0.7256, test_loss: 1.0701, test_f1: 0.5172
 epoch: 86, train_loss: 0.7228, test_loss: 1.0660, test_f1: 0.5242
 epoch: 87, train_loss: 0.7255, test_loss: 1.0718, test_f1: 0.5293
 epoch: 88, train_loss: 0.7104, test_loss: 1.0793, test_f1: 0.5372
 epoch: 89, train_loss: 0.7345, test_loss: 1.0792, test_f1: 0.5308
 epoch: 90, train_loss: 0.7133, test_loss: 1.0832, test_f1: 0.5330
 epoch: 91, train_loss: 0.7178, test_loss: 1.0871, test_f1: 0.5274
 epoch: 92, train_loss: 0.7216, test_loss: 1.1065, test_f1: 0.5176
 epoch: 93, train_loss: 0.7046, test_loss: 1.1024, test_f1: 0.5287
 epoch: 94, train_loss: 0.7039, test_loss: 1.1056, test_f1: 0.5134
 epoch: 95, train_loss: 0.7012, test_loss: 1.0993, test_f1: 0.5301
 epoch: 96, train_loss: 0.6970, test_loss: 1.1049, test_f1: 0.5328
 epoch: 97, train_loss: 0.7023, test_loss: 1.1047, test_f1: 0.5323
 epoch: 98, train_loss: 0.7079, test_loss: 1.1074, test_f1: 0.5348
 epoch: 99, train_loss: 0.7004, test_loss: 1.1140, test_f1: 0.5419
##################ITERATION #4 ****************************************
 epoch: 0, train_loss: 1.3307, test_loss: 1.2920, test_f1: 0.2284
 epoch: 1, train_loss: 1.2413, test_loss: 1.2552, test_f1: 0.3172
 epoch: 2, train_loss: 1.2047, test_loss: 1.2154, test_f1: 0.3990
 epoch: 3, train_loss: 1.1879, test_loss: 1.1739, test_f1: 0.4215
 epoch: 4, train_loss: 1.1646, test_loss: 1.1388, test_f1: 0.4466
 epoch: 5, train_loss: 1.1470, test_loss: 1.1192, test_f1: 0.4551
 epoch: 6, train_loss: 1.1265, test_loss: 1.1022, test_f1: 0.4628
 epoch: 7, train_loss: 1.1275, test_loss: 1.0890, test_f1: 0.4603
 epoch: 8, train_loss: 1.1047, test_loss: 1.0799, test_f1: 0.4556
 epoch: 9, train_loss: 1.1024, test_loss: 1.0735, test_f1: 0.4597
 epoch: 10, train_loss: 1.0880, test_loss: 1.0616, test_f1: 0.4650
 epoch: 11, train_loss: 1.0828, test_loss: 1.0503, test_f1: 0.4591
 epoch: 12, train_loss: 1.0600, test_loss: 1.0442, test_f1: 0.4659
 epoch: 13, train_loss: 1.0506, test_loss: 1.0411, test_f1: 0.4627
 epoch: 14, train_loss: 1.0441, test_loss: 1.0345, test_f1: 0.4576
 epoch: 15, train_loss: 1.0365, test_loss: 1.0221, test_f1: 0.4655
 epoch: 16, train_loss: 1.0299, test_loss: 1.0200, test_f1: 0.4642
 epoch: 17, train_loss: 1.0215, test_loss: 1.0145, test_f1: 0.4609
 epoch: 18, train_loss: 1.0168, test_loss: 1.0098, test_f1: 0.4545
 epoch: 19, train_loss: 0.9998, test_loss: 1.0041, test_f1: 0.4557
 epoch: 20, train_loss: 0.9995, test_loss: 1.0044, test_f1: 0.4582
 epoch: 21, train_loss: 0.9928, test_loss: 0.9948, test_f1: 0.4680
 epoch: 22, train_loss: 0.9932, test_loss: 0.9986, test_f1: 0.4517
 epoch: 23, train_loss: 0.9828, test_loss: 0.9865, test_f1: 0.4631
 epoch: 24, train_loss: 0.9749, test_loss: 0.9890, test_f1: 0.4660
 epoch: 25, train_loss: 0.9580, test_loss: 0.9928, test_f1: 0.4602
 epoch: 26, train_loss: 0.9563, test_loss: 0.9792, test_f1: 0.4693
 epoch: 27, train_loss: 0.9579, test_loss: 0.9838, test_f1: 0.4727
 epoch: 28, train_loss: 0.9542, test_loss: 0.9796, test_f1: 0.4688
 epoch: 29, train_loss: 0.9469, test_loss: 0.9942, test_f1: 0.4649
 epoch: 30, train_loss: 0.9428, test_loss: 0.9755, test_f1: 0.4690
 epoch: 31, train_loss: 0.9314, test_loss: 0.9708, test_f1: 0.4844
 epoch: 32, train_loss: 0.9277, test_loss: 0.9895, test_f1: 0.4479
 epoch: 33, train_loss: 0.9297, test_loss: 0.9854, test_f1: 0.4613
 epoch: 34, train_loss: 0.9118, test_loss: 0.9801, test_f1: 0.4750
 epoch: 35, train_loss: 0.9118, test_loss: 0.9835, test_f1: 0.4702
 epoch: 36, train_loss: 0.9125, test_loss: 0.9636, test_f1: 0.4882
 epoch: 37, train_loss: 0.8929, test_loss: 0.9849, test_f1: 0.4935
 epoch: 38, train_loss: 0.9007, test_loss: 0.9836, test_f1: 0.4913
 epoch: 39, train_loss: 0.8822, test_loss: 0.9774, test_f1: 0.4977
 epoch: 40, train_loss: 0.8787, test_loss: 0.9860, test_f1: 0.4792
 epoch: 41, train_loss: 0.8731, test_loss: 0.9869, test_f1: 0.4617
 epoch: 42, train_loss: 0.8742, test_loss: 0.9813, test_f1: 0.5030
 epoch: 43, train_loss: 0.8627, test_loss: 0.9858, test_f1: 0.4526
 epoch: 44, train_loss: 0.8616, test_loss: 0.9877, test_f1: 0.4889
 epoch: 45, train_loss: 0.8513, test_loss: 0.9925, test_f1: 0.4416
 epoch: 46, train_loss: 0.8525, test_loss: 0.9838, test_f1: 0.4714
 epoch: 47, train_loss: 0.8421, test_loss: 0.9944, test_f1: 0.4876
 epoch: 48, train_loss: 0.8376, test_loss: 0.9912, test_f1: 0.4803
 epoch: 49, train_loss: 0.8408, test_loss: 1.0200, test_f1: 0.4937
 epoch: 50, train_loss: 0.8254, test_loss: 0.9866, test_f1: 0.4901
 epoch: 51, train_loss: 0.8198, test_loss: 0.9934, test_f1: 0.4913
 epoch: 52, train_loss: 0.8127, test_loss: 0.9880, test_f1: 0.4810
 epoch: 53, train_loss: 0.8133, test_loss: 0.9998, test_f1: 0.4801
 epoch: 54, train_loss: 0.8074, test_loss: 1.0084, test_f1: 0.4755
 epoch: 55, train_loss: 0.8068, test_loss: 1.0031, test_f1: 0.4891
 epoch: 56, train_loss: 0.7966, test_loss: 1.0045, test_f1: 0.4838
 epoch: 57, train_loss: 0.8127, test_loss: 1.0299, test_f1: 0.4611
 epoch: 58, train_loss: 0.7957, test_loss: 1.0233, test_f1: 0.4915
 epoch: 59, train_loss: 0.8010, test_loss: 1.0097, test_f1: 0.4863
 epoch: 60, train_loss: 0.8050, test_loss: 1.0129, test_f1: 0.4715
 epoch: 61, train_loss: 0.7890, test_loss: 1.0196, test_f1: 0.4696
 epoch: 62, train_loss: 0.7953, test_loss: 1.0216, test_f1: 0.4905
 epoch: 63, train_loss: 0.7916, test_loss: 1.0134, test_f1: 0.4775
 epoch: 64, train_loss: 0.7843, test_loss: 1.0200, test_f1: 0.4704
 epoch: 65, train_loss: 0.7884, test_loss: 1.0270, test_f1: 0.4862
 epoch: 66, train_loss: 0.7848, test_loss: 1.0187, test_f1: 0.4821
 epoch: 67, train_loss: 0.7737, test_loss: 1.0252, test_f1: 0.4762
 epoch: 68, train_loss: 0.7784, test_loss: 1.0203, test_f1: 0.4728
 epoch: 69, train_loss: 0.7730, test_loss: 1.0283, test_f1: 0.4859
 epoch: 70, train_loss: 0.7704, test_loss: 1.0193, test_f1: 0.4834
 epoch: 71, train_loss: 0.7656, test_loss: 1.0264, test_f1: 0.4959
 epoch: 72, train_loss: 0.7670, test_loss: 1.0249, test_f1: 0.4619
 epoch: 73, train_loss: 0.7669, test_loss: 1.0327, test_f1: 0.4749
 epoch: 74, train_loss: 0.7686, test_loss: 1.0266, test_f1: 0.4812
 epoch: 75, train_loss: 0.7676, test_loss: 1.0367, test_f1: 0.4713
 epoch: 76, train_loss: 0.7610, test_loss: 1.0408, test_f1: 0.4816
 epoch: 77, train_loss: 0.7546, test_loss: 1.0427, test_f1: 0.4847
 epoch: 78, train_loss: 0.7615, test_loss: 1.0434, test_f1: 0.4749
 epoch: 79, train_loss: 0.7435, test_loss: 1.0375, test_f1: 0.4830
 epoch: 80, train_loss: 0.7486, test_loss: 1.0387, test_f1: 0.4985
 epoch: 81, train_loss: 0.7472, test_loss: 1.0440, test_f1: 0.4845
 epoch: 82, train_loss: 0.7555, test_loss: 1.0452, test_f1: 0.4850
 epoch: 83, train_loss: 0.7397, test_loss: 1.0501, test_f1: 0.4934
 epoch: 84, train_loss: 0.7512, test_loss: 1.0564, test_f1: 0.4807
 epoch: 85, train_loss: 0.7397, test_loss: 1.0509, test_f1: 0.4879
 epoch: 86, train_loss: 0.7297, test_loss: 1.0585, test_f1: 0.4873
 epoch: 87, train_loss: 0.7393, test_loss: 1.0597, test_f1: 0.4951
 epoch: 88, train_loss: 0.7307, test_loss: 1.0433, test_f1: 0.4910
 epoch: 89, train_loss: 0.7338, test_loss: 1.0619, test_f1: 0.4961
 epoch: 90, train_loss: 0.7360, test_loss: 1.0682, test_f1: 0.4829
 epoch: 91, train_loss: 0.7333, test_loss: 1.0652, test_f1: 0.4848
 epoch: 92, train_loss: 0.7279, test_loss: 1.0544, test_f1: 0.4915
 epoch: 93, train_loss: 0.7221, test_loss: 1.0757, test_f1: 0.4930
 epoch: 94, train_loss: 0.7124, test_loss: 1.0757, test_f1: 0.5019
 epoch: 95, train_loss: 0.7184, test_loss: 1.0807, test_f1: 0.4991
 epoch: 96, train_loss: 0.7153, test_loss: 1.0731, test_f1: 0.4921
 epoch: 97, train_loss: 0.7202, test_loss: 1.0726, test_f1: 0.4859
 epoch: 98, train_loss: 0.7093, test_loss: 1.0713, test_f1: 0.5035
 epoch: 99, train_loss: 0.7234, test_loss: 1.0739, test_f1: 0.4881
##################ITERATION #5 ****************************************
 epoch: 0, train_loss: 1.2974, test_loss: 1.2845, test_f1: 0.2274
 epoch: 1, train_loss: 1.2184, test_loss: 1.2540, test_f1: 0.2266
 epoch: 2, train_loss: 1.1950, test_loss: 1.2086, test_f1: 0.2797
 epoch: 3, train_loss: 1.1741, test_loss: 1.1605, test_f1: 0.4259
 epoch: 4, train_loss: 1.1591, test_loss: 1.1246, test_f1: 0.4480
 epoch: 5, train_loss: 1.1383, test_loss: 1.0950, test_f1: 0.4682
 epoch: 6, train_loss: 1.1277, test_loss: 1.0749, test_f1: 0.4644
 epoch: 7, train_loss: 1.1195, test_loss: 1.0660, test_f1: 0.4689
 epoch: 8, train_loss: 1.1103, test_loss: 1.0547, test_f1: 0.4738
 epoch: 9, train_loss: 1.0881, test_loss: 1.0433, test_f1: 0.4734
 epoch: 10, train_loss: 1.0756, test_loss: 1.0344, test_f1: 0.4728
 epoch: 11, train_loss: 1.0659, test_loss: 1.0295, test_f1: 0.4740
 epoch: 12, train_loss: 1.0508, test_loss: 1.0221, test_f1: 0.4775
 epoch: 13, train_loss: 1.0395, test_loss: 1.0174, test_f1: 0.4673
 epoch: 14, train_loss: 1.0375, test_loss: 1.0056, test_f1: 0.4723
 epoch: 15, train_loss: 1.0331, test_loss: 1.0057, test_f1: 0.4684
 epoch: 16, train_loss: 1.0209, test_loss: 1.0040, test_f1: 0.4775
 epoch: 17, train_loss: 1.0116, test_loss: 0.9993, test_f1: 0.4788
 epoch: 18, train_loss: 1.0035, test_loss: 0.9896, test_f1: 0.4829
 epoch: 19, train_loss: 0.9985, test_loss: 0.9805, test_f1: 0.4876
 epoch: 20, train_loss: 0.9867, test_loss: 0.9846, test_f1: 0.4912
 epoch: 21, train_loss: 0.9787, test_loss: 0.9804, test_f1: 0.4798
 epoch: 22, train_loss: 0.9790, test_loss: 0.9698, test_f1: 0.4960
 epoch: 23, train_loss: 0.9734, test_loss: 0.9639, test_f1: 0.4948
 epoch: 24, train_loss: 0.9591, test_loss: 0.9677, test_f1: 0.4938
 epoch: 25, train_loss: 0.9512, test_loss: 0.9672, test_f1: 0.4948
 epoch: 26, train_loss: 0.9525, test_loss: 0.9624, test_f1: 0.4906
 epoch: 27, train_loss: 0.9356, test_loss: 0.9623, test_f1: 0.5075
 epoch: 28, train_loss: 0.9360, test_loss: 0.9581, test_f1: 0.4982
 epoch: 29, train_loss: 0.9233, test_loss: 0.9615, test_f1: 0.4990
 epoch: 30, train_loss: 0.9164, test_loss: 0.9548, test_f1: 0.5048
 epoch: 31, train_loss: 0.9102, test_loss: 0.9600, test_f1: 0.5061
 epoch: 32, train_loss: 0.9128, test_loss: 0.9645, test_f1: 0.5109
 epoch: 33, train_loss: 0.9077, test_loss: 0.9461, test_f1: 0.5069
 epoch: 34, train_loss: 0.8928, test_loss: 0.9526, test_f1: 0.5136
 epoch: 35, train_loss: 0.8936, test_loss: 0.9562, test_f1: 0.5230
 epoch: 36, train_loss: 0.8904, test_loss: 0.9645, test_f1: 0.5199
 epoch: 37, train_loss: 0.8913, test_loss: 0.9686, test_f1: 0.5167
 epoch: 38, train_loss: 0.8781, test_loss: 0.9525, test_f1: 0.5103
 epoch: 39, train_loss: 0.8725, test_loss: 0.9578, test_f1: 0.5115
 epoch: 40, train_loss: 0.8698, test_loss: 0.9594, test_f1: 0.5051
 epoch: 41, train_loss: 0.8606, test_loss: 0.9682, test_f1: 0.5142
 epoch: 42, train_loss: 0.8630, test_loss: 0.9670, test_f1: 0.5123
 epoch: 43, train_loss: 0.8620, test_loss: 0.9626, test_f1: 0.5208
 epoch: 44, train_loss: 0.8468, test_loss: 0.9721, test_f1: 0.5209
 epoch: 45, train_loss: 0.8460, test_loss: 0.9755, test_f1: 0.5329
 epoch: 46, train_loss: 0.8402, test_loss: 0.9572, test_f1: 0.5304
 epoch: 47, train_loss: 0.8429, test_loss: 0.9672, test_f1: 0.5193
 epoch: 48, train_loss: 0.8334, test_loss: 0.9638, test_f1: 0.5159
 epoch: 49, train_loss: 0.8271, test_loss: 0.9793, test_f1: 0.5123
 epoch: 50, train_loss: 0.8195, test_loss: 0.9884, test_f1: 0.5112
 epoch: 51, train_loss: 0.8089, test_loss: 0.9748, test_f1: 0.5226
 epoch: 52, train_loss: 0.8104, test_loss: 0.9727, test_f1: 0.5274
 epoch: 53, train_loss: 0.8057, test_loss: 0.9639, test_f1: 0.5210
 epoch: 54, train_loss: 0.8057, test_loss: 0.9770, test_f1: 0.5170
 epoch: 55, train_loss: 0.8008, test_loss: 0.9796, test_f1: 0.5208
 epoch: 56, train_loss: 0.7957, test_loss: 0.9954, test_f1: 0.5127
 epoch: 57, train_loss: 0.7953, test_loss: 1.0075, test_f1: 0.5076
 epoch: 58, train_loss: 0.7938, test_loss: 1.0201, test_f1: 0.4909
 epoch: 59, train_loss: 0.7859, test_loss: 1.0126, test_f1: 0.5073
 epoch: 60, train_loss: 0.7868, test_loss: 1.0012, test_f1: 0.5215
 epoch: 61, train_loss: 0.7932, test_loss: 1.0185, test_f1: 0.5208
 epoch: 62, train_loss: 0.7799, test_loss: 1.0045, test_f1: 0.5314
 epoch: 63, train_loss: 0.7817, test_loss: 1.0016, test_f1: 0.5261
 epoch: 64, train_loss: 0.7714, test_loss: 1.0028, test_f1: 0.5209
 epoch: 65, train_loss: 0.7757, test_loss: 1.0016, test_f1: 0.5339
 epoch: 66, train_loss: 0.7825, test_loss: 1.0034, test_f1: 0.5162
 epoch: 67, train_loss: 0.7718, test_loss: 1.0256, test_f1: 0.5039
 epoch: 68, train_loss: 0.7624, test_loss: 1.0364, test_f1: 0.5125
 epoch: 69, train_loss: 0.7549, test_loss: 1.0213, test_f1: 0.5256
 epoch: 70, train_loss: 0.7625, test_loss: 1.0383, test_f1: 0.5171
 epoch: 71, train_loss: 0.7685, test_loss: 1.0827, test_f1: 0.4976
 epoch: 72, train_loss: 0.7642, test_loss: 1.0486, test_f1: 0.5176
 epoch: 73, train_loss: 0.7576, test_loss: 1.0440, test_f1: 0.5190
 epoch: 74, train_loss: 0.7568, test_loss: 1.0605, test_f1: 0.5003
 epoch: 75, train_loss: 0.7501, test_loss: 1.0788, test_f1: 0.4968
 epoch: 76, train_loss: 0.7530, test_loss: 1.0505, test_f1: 0.5182
 epoch: 77, train_loss: 0.7425, test_loss: 1.0736, test_f1: 0.5027
 epoch: 78, train_loss: 0.7508, test_loss: 1.0835, test_f1: 0.4991
 epoch: 79, train_loss: 0.7401, test_loss: 1.0654, test_f1: 0.5148
 epoch: 80, train_loss: 0.7447, test_loss: 1.0729, test_f1: 0.5136
 epoch: 81, train_loss: 0.7336, test_loss: 1.0811, test_f1: 0.5058
 epoch: 82, train_loss: 0.7396, test_loss: 1.0568, test_f1: 0.5101
 epoch: 83, train_loss: 0.7273, test_loss: 1.0812, test_f1: 0.5038
 epoch: 84, train_loss: 0.7195, test_loss: 1.0662, test_f1: 0.5175
 epoch: 85, train_loss: 0.7224, test_loss: 1.1268, test_f1: 0.4946
 epoch: 86, train_loss: 0.7220, test_loss: 1.1359, test_f1: 0.4940
 epoch: 87, train_loss: 0.7231, test_loss: 1.0836, test_f1: 0.5041
 epoch: 88, train_loss: 0.7292, test_loss: 1.0816, test_f1: 0.4911
 epoch: 89, train_loss: 0.7148, test_loss: 1.1102, test_f1: 0.5109
 epoch: 90, train_loss: 0.7158, test_loss: 1.1104, test_f1: 0.5241
 epoch: 91, train_loss: 0.7238, test_loss: 1.1191, test_f1: 0.5058
 epoch: 92, train_loss: 0.7181, test_loss: 1.1550, test_f1: 0.4840
 epoch: 93, train_loss: 0.7149, test_loss: 1.0847, test_f1: 0.5146
 epoch: 94, train_loss: 0.7011, test_loss: 1.1029, test_f1: 0.5021
 epoch: 95, train_loss: 0.6957, test_loss: 1.1659, test_f1: 0.5048
 epoch: 96, train_loss: 0.6951, test_loss: 1.1831, test_f1: 0.4979
 epoch: 97, train_loss: 0.7075, test_loss: 1.1430, test_f1: 0.5000
 epoch: 98, train_loss: 0.7036, test_loss: 1.1509, test_f1: 0.4987
 epoch: 99, train_loss: 0.6983, test_loss: 1.1151, test_f1: 0.5100
##################ITERATION #6 ****************************************
 epoch: 0, train_loss: 1.3502, test_loss: 1.2839, test_f1: 0.2276
 epoch: 1, train_loss: 1.2684, test_loss: 1.2368, test_f1: 0.2869
 epoch: 2, train_loss: 1.2227, test_loss: 1.1892, test_f1: 0.3859
 epoch: 3, train_loss: 1.2016, test_loss: 1.1484, test_f1: 0.4465
 epoch: 4, train_loss: 1.1908, test_loss: 1.1219, test_f1: 0.4626
 epoch: 5, train_loss: 1.1607, test_loss: 1.1084, test_f1: 0.4536
 epoch: 6, train_loss: 1.1414, test_loss: 1.0968, test_f1: 0.4484
 epoch: 7, train_loss: 1.1317, test_loss: 1.0850, test_f1: 0.4388
 epoch: 8, train_loss: 1.1255, test_loss: 1.0752, test_f1: 0.4454
 epoch: 9, train_loss: 1.1111, test_loss: 1.0667, test_f1: 0.4492
 epoch: 10, train_loss: 1.0890, test_loss: 1.0625, test_f1: 0.4455
 epoch: 11, train_loss: 1.0822, test_loss: 1.0559, test_f1: 0.4451
 epoch: 12, train_loss: 1.0879, test_loss: 1.0485, test_f1: 0.4523
 epoch: 13, train_loss: 1.0738, test_loss: 1.0455, test_f1: 0.4577
 epoch: 14, train_loss: 1.0570, test_loss: 1.0413, test_f1: 0.4601
 epoch: 15, train_loss: 1.0624, test_loss: 1.0348, test_f1: 0.4641
 epoch: 16, train_loss: 1.0414, test_loss: 1.0299, test_f1: 0.4509
 epoch: 17, train_loss: 1.0349, test_loss: 1.0243, test_f1: 0.4548
 epoch: 18, train_loss: 1.0245, test_loss: 1.0158, test_f1: 0.4622
 epoch: 19, train_loss: 1.0179, test_loss: 1.0123, test_f1: 0.4703
 epoch: 20, train_loss: 1.0102, test_loss: 1.0072, test_f1: 0.4610
 epoch: 21, train_loss: 1.0026, test_loss: 1.0023, test_f1: 0.4729
 epoch: 22, train_loss: 0.9951, test_loss: 0.9965, test_f1: 0.4654
 epoch: 23, train_loss: 0.9946, test_loss: 0.9934, test_f1: 0.4656
 epoch: 24, train_loss: 0.9915, test_loss: 0.9844, test_f1: 0.4679
 epoch: 25, train_loss: 0.9778, test_loss: 0.9873, test_f1: 0.4524
 epoch: 26, train_loss: 0.9714, test_loss: 0.9815, test_f1: 0.4538
 epoch: 27, train_loss: 0.9712, test_loss: 0.9723, test_f1: 0.4748
 epoch: 28, train_loss: 0.9602, test_loss: 0.9677, test_f1: 0.4746
 epoch: 29, train_loss: 0.9461, test_loss: 0.9681, test_f1: 0.4782
 epoch: 30, train_loss: 0.9387, test_loss: 0.9608, test_f1: 0.4792
 epoch: 31, train_loss: 0.9456, test_loss: 0.9669, test_f1: 0.4762
 epoch: 32, train_loss: 0.9372, test_loss: 0.9672, test_f1: 0.4915
 epoch: 33, train_loss: 0.9190, test_loss: 0.9576, test_f1: 0.4752
 epoch: 34, train_loss: 0.9242, test_loss: 0.9482, test_f1: 0.4850
 epoch: 35, train_loss: 0.9162, test_loss: 0.9597, test_f1: 0.4696
 epoch: 36, train_loss: 0.9188, test_loss: 0.9560, test_f1: 0.4893
 epoch: 37, train_loss: 0.9117, test_loss: 0.9476, test_f1: 0.4834
 epoch: 38, train_loss: 0.9041, test_loss: 0.9548, test_f1: 0.4959
 epoch: 39, train_loss: 0.9125, test_loss: 0.9458, test_f1: 0.4889
 epoch: 40, train_loss: 0.8929, test_loss: 0.9409, test_f1: 0.4788
 epoch: 41, train_loss: 0.8870, test_loss: 0.9402, test_f1: 0.4973
 epoch: 42, train_loss: 0.8945, test_loss: 0.9298, test_f1: 0.5215
 epoch: 43, train_loss: 0.8801, test_loss: 0.9480, test_f1: 0.4865
 epoch: 44, train_loss: 0.8859, test_loss: 0.9330, test_f1: 0.4956
 epoch: 45, train_loss: 0.8756, test_loss: 0.9508, test_f1: 0.5047
 epoch: 46, train_loss: 0.8821, test_loss: 0.9471, test_f1: 0.5029
 epoch: 47, train_loss: 0.8664, test_loss: 0.9747, test_f1: 0.4895
 epoch: 48, train_loss: 0.8577, test_loss: 0.9389, test_f1: 0.5098
 epoch: 49, train_loss: 0.8506, test_loss: 0.9374, test_f1: 0.4995
 epoch: 50, train_loss: 0.8565, test_loss: 0.9547, test_f1: 0.5130
 epoch: 51, train_loss: 0.8497, test_loss: 0.9467, test_f1: 0.5165
 epoch: 52, train_loss: 0.8480, test_loss: 0.9473, test_f1: 0.5059
 epoch: 53, train_loss: 0.8391, test_loss: 0.9393, test_f1: 0.5083
 epoch: 54, train_loss: 0.8239, test_loss: 0.9417, test_f1: 0.5044
 epoch: 55, train_loss: 0.8369, test_loss: 0.9464, test_f1: 0.5075
 epoch: 56, train_loss: 0.8276, test_loss: 0.9475, test_f1: 0.5130
 epoch: 57, train_loss: 0.8272, test_loss: 0.9498, test_f1: 0.5211
 epoch: 58, train_loss: 0.8283, test_loss: 0.9471, test_f1: 0.5207
 epoch: 59, train_loss: 0.8344, test_loss: 0.9453, test_f1: 0.5189
 epoch: 60, train_loss: 0.8232, test_loss: 0.9709, test_f1: 0.5107
 epoch: 61, train_loss: 0.8300, test_loss: 0.9556, test_f1: 0.5251
 epoch: 62, train_loss: 0.8130, test_loss: 0.9488, test_f1: 0.5251
 epoch: 63, train_loss: 0.8155, test_loss: 0.9714, test_f1: 0.5197
 epoch: 64, train_loss: 0.8232, test_loss: 0.9547, test_f1: 0.5104
 epoch: 65, train_loss: 0.8153, test_loss: 0.9604, test_f1: 0.5330
 epoch: 66, train_loss: 0.8074, test_loss: 0.9671, test_f1: 0.5131
 epoch: 67, train_loss: 0.8097, test_loss: 0.9696, test_f1: 0.5187
 epoch: 68, train_loss: 0.8085, test_loss: 0.9717, test_f1: 0.5317
 epoch: 69, train_loss: 0.7985, test_loss: 0.9635, test_f1: 0.5202
 epoch: 70, train_loss: 0.8125, test_loss: 0.9661, test_f1: 0.5290
 epoch: 71, train_loss: 0.7991, test_loss: 0.9890, test_f1: 0.5285
 epoch: 72, train_loss: 0.7910, test_loss: 0.9675, test_f1: 0.5302
 epoch: 73, train_loss: 0.7920, test_loss: 0.9705, test_f1: 0.5282
 epoch: 74, train_loss: 0.7948, test_loss: 0.9545, test_f1: 0.5342
 epoch: 75, train_loss: 0.7925, test_loss: 0.9732, test_f1: 0.5411
 epoch: 76, train_loss: 0.7954, test_loss: 0.9776, test_f1: 0.5160
 epoch: 77, train_loss: 0.7934, test_loss: 0.9679, test_f1: 0.5222
 epoch: 78, train_loss: 0.7791, test_loss: 0.9927, test_f1: 0.5311
 epoch: 79, train_loss: 0.7827, test_loss: 0.9783, test_f1: 0.5240
 epoch: 80, train_loss: 0.7799, test_loss: 0.9857, test_f1: 0.5240
 epoch: 81, train_loss: 0.7837, test_loss: 1.0094, test_f1: 0.5106
 epoch: 82, train_loss: 0.7863, test_loss: 0.9865, test_f1: 0.5353
 epoch: 83, train_loss: 0.7765, test_loss: 1.0014, test_f1: 0.5346
 epoch: 84, train_loss: 0.7779, test_loss: 0.9909, test_f1: 0.5261
 epoch: 85, train_loss: 0.7892, test_loss: 0.9850, test_f1: 0.5285
 epoch: 86, train_loss: 0.7657, test_loss: 0.9885, test_f1: 0.5335
 epoch: 87, train_loss: 0.7699, test_loss: 0.9874, test_f1: 0.5275
 epoch: 88, train_loss: 0.7672, test_loss: 1.0216, test_f1: 0.5194
 epoch: 89, train_loss: 0.7601, test_loss: 0.9834, test_f1: 0.5356
 epoch: 90, train_loss: 0.7618, test_loss: 1.0012, test_f1: 0.5327
 epoch: 91, train_loss: 0.7745, test_loss: 1.0169, test_f1: 0.5383
 epoch: 92, train_loss: 0.7629, test_loss: 1.0229, test_f1: 0.5381
 epoch: 93, train_loss: 0.7635, test_loss: 0.9880, test_f1: 0.5341
 epoch: 94, train_loss: 0.7457, test_loss: 1.0081, test_f1: 0.5383
 epoch: 95, train_loss: 0.7635, test_loss: 1.0023, test_f1: 0.5522
 epoch: 96, train_loss: 0.7448, test_loss: 1.0188, test_f1: 0.5374
 epoch: 97, train_loss: 0.7447, test_loss: 1.0203, test_f1: 0.5399
 epoch: 98, train_loss: 0.7544, test_loss: 1.0388, test_f1: 0.5422
 epoch: 99, train_loss: 0.7461, test_loss: 1.0152, test_f1: 0.5465
##################ITERATION #7 ****************************************
 epoch: 0, train_loss: 1.3583, test_loss: 1.2659, test_f1: 0.2274
 epoch: 1, train_loss: 1.2476, test_loss: 1.2317, test_f1: 0.2869
 epoch: 2, train_loss: 1.2138, test_loss: 1.1963, test_f1: 0.2920
 epoch: 3, train_loss: 1.1922, test_loss: 1.1536, test_f1: 0.4079
 epoch: 4, train_loss: 1.1746, test_loss: 1.1195, test_f1: 0.4555
 epoch: 5, train_loss: 1.1712, test_loss: 1.0923, test_f1: 0.4858
 epoch: 6, train_loss: 1.1361, test_loss: 1.0777, test_f1: 0.4877
 epoch: 7, train_loss: 1.1417, test_loss: 1.0620, test_f1: 0.4866
 epoch: 8, train_loss: 1.1106, test_loss: 1.0557, test_f1: 0.4872
 epoch: 9, train_loss: 1.1049, test_loss: 1.0459, test_f1: 0.4850
 epoch: 10, train_loss: 1.0898, test_loss: 1.0369, test_f1: 0.4837
 epoch: 11, train_loss: 1.0771, test_loss: 1.0322, test_f1: 0.4905
 epoch: 12, train_loss: 1.0671, test_loss: 1.0287, test_f1: 0.4891
 epoch: 13, train_loss: 1.0603, test_loss: 1.0185, test_f1: 0.4899
 epoch: 14, train_loss: 1.0433, test_loss: 1.0145, test_f1: 0.4884
 epoch: 15, train_loss: 1.0449, test_loss: 1.0084, test_f1: 0.4798
 epoch: 16, train_loss: 1.0259, test_loss: 1.0001, test_f1: 0.4843
 epoch: 17, train_loss: 1.0241, test_loss: 0.9989, test_f1: 0.4762
 epoch: 18, train_loss: 1.0165, test_loss: 0.9958, test_f1: 0.4770
 epoch: 19, train_loss: 1.0107, test_loss: 0.9912, test_f1: 0.4788
 epoch: 20, train_loss: 0.9965, test_loss: 0.9782, test_f1: 0.4792
 epoch: 21, train_loss: 0.9860, test_loss: 0.9816, test_f1: 0.4874
 epoch: 22, train_loss: 0.9786, test_loss: 0.9762, test_f1: 0.4910
 epoch: 23, train_loss: 0.9670, test_loss: 0.9781, test_f1: 0.4911
 epoch: 24, train_loss: 0.9550, test_loss: 0.9754, test_f1: 0.4910
 epoch: 25, train_loss: 0.9678, test_loss: 0.9739, test_f1: 0.4961
 epoch: 26, train_loss: 0.9554, test_loss: 0.9724, test_f1: 0.4987
 epoch: 27, train_loss: 0.9399, test_loss: 0.9687, test_f1: 0.4960
 epoch: 28, train_loss: 0.9336, test_loss: 0.9701, test_f1: 0.5064
 epoch: 29, train_loss: 0.9313, test_loss: 0.9587, test_f1: 0.4993
 epoch: 30, train_loss: 0.9118, test_loss: 0.9593, test_f1: 0.4986
 epoch: 31, train_loss: 0.9184, test_loss: 0.9618, test_f1: 0.4997
 epoch: 32, train_loss: 0.9103, test_loss: 0.9647, test_f1: 0.4922
 epoch: 33, train_loss: 0.9100, test_loss: 0.9650, test_f1: 0.4942
 epoch: 34, train_loss: 0.8906, test_loss: 0.9711, test_f1: 0.4971
 epoch: 35, train_loss: 0.9005, test_loss: 0.9697, test_f1: 0.5000
 epoch: 36, train_loss: 0.8871, test_loss: 0.9675, test_f1: 0.4941
 epoch: 37, train_loss: 0.8810, test_loss: 0.9684, test_f1: 0.4938
 epoch: 38, train_loss: 0.8746, test_loss: 0.9703, test_f1: 0.4975
 epoch: 39, train_loss: 0.8759, test_loss: 0.9756, test_f1: 0.4921
 epoch: 40, train_loss: 0.8616, test_loss: 0.9639, test_f1: 0.5093
 epoch: 41, train_loss: 0.8653, test_loss: 0.9858, test_f1: 0.5031
 epoch: 42, train_loss: 0.8523, test_loss: 0.9846, test_f1: 0.5023
 epoch: 43, train_loss: 0.8535, test_loss: 0.9824, test_f1: 0.5056
 epoch: 44, train_loss: 0.8331, test_loss: 0.9842, test_f1: 0.5001
 epoch: 45, train_loss: 0.8353, test_loss: 0.9999, test_f1: 0.5000
 epoch: 46, train_loss: 0.8295, test_loss: 1.0027, test_f1: 0.5115
 epoch: 47, train_loss: 0.8314, test_loss: 1.0044, test_f1: 0.5073
 epoch: 48, train_loss: 0.8243, test_loss: 1.0094, test_f1: 0.5102
 epoch: 49, train_loss: 0.8124, test_loss: 1.0062, test_f1: 0.5139
 epoch: 50, train_loss: 0.8056, test_loss: 1.0274, test_f1: 0.5149
 epoch: 51, train_loss: 0.7962, test_loss: 1.0252, test_f1: 0.5168
 epoch: 52, train_loss: 0.8011, test_loss: 1.0203, test_f1: 0.5107
 epoch: 53, train_loss: 0.7903, test_loss: 1.0226, test_f1: 0.5110
 epoch: 54, train_loss: 0.7918, test_loss: 1.0257, test_f1: 0.5091
 epoch: 55, train_loss: 0.8028, test_loss: 1.0363, test_f1: 0.5071
 epoch: 56, train_loss: 0.7951, test_loss: 1.0307, test_f1: 0.5201
 epoch: 57, train_loss: 0.7845, test_loss: 1.0246, test_f1: 0.5130
 epoch: 58, train_loss: 0.7773, test_loss: 1.0280, test_f1: 0.5266
 epoch: 59, train_loss: 0.7769, test_loss: 1.0328, test_f1: 0.5238
 epoch: 60, train_loss: 0.7670, test_loss: 1.0274, test_f1: 0.5258
 epoch: 61, train_loss: 0.7702, test_loss: 1.0350, test_f1: 0.5334
 epoch: 62, train_loss: 0.7669, test_loss: 1.0451, test_f1: 0.5358
 epoch: 63, train_loss: 0.7749, test_loss: 1.0463, test_f1: 0.5317
 epoch: 64, train_loss: 0.7668, test_loss: 1.0600, test_f1: 0.5120
 epoch: 65, train_loss: 0.7627, test_loss: 1.0478, test_f1: 0.5148
 epoch: 66, train_loss: 0.7538, test_loss: 1.0594, test_f1: 0.5283
 epoch: 67, train_loss: 0.7715, test_loss: 1.0566, test_f1: 0.5282
 epoch: 68, train_loss: 0.7535, test_loss: 1.0573, test_f1: 0.5418
 epoch: 69, train_loss: 0.7486, test_loss: 1.0633, test_f1: 0.5205
 epoch: 70, train_loss: 0.7635, test_loss: 1.0621, test_f1: 0.5276
 epoch: 71, train_loss: 0.7421, test_loss: 1.0636, test_f1: 0.5313
 epoch: 72, train_loss: 0.7394, test_loss: 1.0770, test_f1: 0.5404
 epoch: 73, train_loss: 0.7436, test_loss: 1.0791, test_f1: 0.5371
 epoch: 74, train_loss: 0.7463, test_loss: 1.0824, test_f1: 0.5364
 epoch: 75, train_loss: 0.7341, test_loss: 1.0836, test_f1: 0.5263
 epoch: 76, train_loss: 0.7335, test_loss: 1.0869, test_f1: 0.5191
 epoch: 77, train_loss: 0.7280, test_loss: 1.0741, test_f1: 0.5207
 epoch: 78, train_loss: 0.7281, test_loss: 1.0773, test_f1: 0.5219
 epoch: 79, train_loss: 0.7300, test_loss: 1.0913, test_f1: 0.5417
 epoch: 80, train_loss: 0.7314, test_loss: 1.0898, test_f1: 0.5498
 epoch: 81, train_loss: 0.7277, test_loss: 1.0930, test_f1: 0.5391
 epoch: 82, train_loss: 0.7255, test_loss: 1.0965, test_f1: 0.5395
 epoch: 83, train_loss: 0.7239, test_loss: 1.1084, test_f1: 0.5298
 epoch: 84, train_loss: 0.7102, test_loss: 1.1076, test_f1: 0.5175
 epoch: 85, train_loss: 0.7360, test_loss: 1.0974, test_f1: 0.5240
 epoch: 86, train_loss: 0.7105, test_loss: 1.1115, test_f1: 0.5249
 epoch: 87, train_loss: 0.7045, test_loss: 1.1108, test_f1: 0.5313
 epoch: 88, train_loss: 0.7155, test_loss: 1.1175, test_f1: 0.5351
 epoch: 89, train_loss: 0.7122, test_loss: 1.1381, test_f1: 0.5340
 epoch: 90, train_loss: 0.7057, test_loss: 1.1208, test_f1: 0.5344
 epoch: 91, train_loss: 0.7087, test_loss: 1.1246, test_f1: 0.5389
 epoch: 92, train_loss: 0.6972, test_loss: 1.1200, test_f1: 0.5403
 epoch: 93, train_loss: 0.7094, test_loss: 1.1309, test_f1: 0.5083
 epoch: 94, train_loss: 0.6843, test_loss: 1.1255, test_f1: 0.5129
 epoch: 95, train_loss: 0.7070, test_loss: 1.1376, test_f1: 0.5185
 epoch: 96, train_loss: 0.6913, test_loss: 1.1287, test_f1: 0.5247
 epoch: 97, train_loss: 0.6910, test_loss: 1.1253, test_f1: 0.5170
 epoch: 98, train_loss: 0.6954, test_loss: 1.1382, test_f1: 0.5227
 epoch: 99, train_loss: 0.6882, test_loss: 1.1297, test_f1: 0.5423
##################ITERATION #8 ****************************************
 epoch: 0, train_loss: 1.4112, test_loss: 1.2957, test_f1: 0.2459
 epoch: 1, train_loss: 1.2785, test_loss: 1.2577, test_f1: 0.2702
 epoch: 2, train_loss: 1.2365, test_loss: 1.2162, test_f1: 0.3340
 epoch: 3, train_loss: 1.1967, test_loss: 1.1654, test_f1: 0.4324
 epoch: 4, train_loss: 1.1884, test_loss: 1.1288, test_f1: 0.4378
 epoch: 5, train_loss: 1.1695, test_loss: 1.1094, test_f1: 0.4404
 epoch: 6, train_loss: 1.1493, test_loss: 1.0930, test_f1: 0.4478
 epoch: 7, train_loss: 1.1366, test_loss: 1.0783, test_f1: 0.4548
 epoch: 8, train_loss: 1.1294, test_loss: 1.0699, test_f1: 0.4547
 epoch: 9, train_loss: 1.1084, test_loss: 1.0627, test_f1: 0.4549
 epoch: 10, train_loss: 1.0801, test_loss: 1.0524, test_f1: 0.4455
 epoch: 11, train_loss: 1.0799, test_loss: 1.0462, test_f1: 0.4497
 epoch: 12, train_loss: 1.0758, test_loss: 1.0328, test_f1: 0.4660
 epoch: 13, train_loss: 1.0649, test_loss: 1.0216, test_f1: 0.4623
 epoch: 14, train_loss: 1.0586, test_loss: 1.0254, test_f1: 0.4587
 epoch: 15, train_loss: 1.0466, test_loss: 1.0137, test_f1: 0.4626
 epoch: 16, train_loss: 1.0357, test_loss: 1.0097, test_f1: 0.4696
 epoch: 17, train_loss: 1.0217, test_loss: 1.0041, test_f1: 0.4704
 epoch: 18, train_loss: 1.0136, test_loss: 0.9973, test_f1: 0.4790
 epoch: 19, train_loss: 1.0034, test_loss: 0.9960, test_f1: 0.4823
 epoch: 20, train_loss: 0.9914, test_loss: 0.9881, test_f1: 0.4654
 epoch: 21, train_loss: 0.9894, test_loss: 0.9833, test_f1: 0.4850
 epoch: 22, train_loss: 0.9811, test_loss: 0.9888, test_f1: 0.4674
 epoch: 23, train_loss: 0.9731, test_loss: 0.9847, test_f1: 0.4750
 epoch: 24, train_loss: 0.9708, test_loss: 0.9652, test_f1: 0.4715
 epoch: 25, train_loss: 0.9553, test_loss: 0.9624, test_f1: 0.4731
 epoch: 26, train_loss: 0.9644, test_loss: 0.9719, test_f1: 0.4752
 epoch: 27, train_loss: 0.9536, test_loss: 0.9624, test_f1: 0.4873
 epoch: 28, train_loss: 0.9444, test_loss: 0.9700, test_f1: 0.4602
 epoch: 29, train_loss: 0.9322, test_loss: 0.9652, test_f1: 0.4698
 epoch: 30, train_loss: 0.9358, test_loss: 0.9709, test_f1: 0.4661
 epoch: 31, train_loss: 0.9275, test_loss: 0.9684, test_f1: 0.4639
 epoch: 32, train_loss: 0.9186, test_loss: 0.9615, test_f1: 0.4817
 epoch: 33, train_loss: 0.9070, test_loss: 0.9586, test_f1: 0.4761
 epoch: 34, train_loss: 0.9104, test_loss: 0.9676, test_f1: 0.4767
 epoch: 35, train_loss: 0.9155, test_loss: 0.9767, test_f1: 0.4699
 epoch: 36, train_loss: 0.8985, test_loss: 0.9659, test_f1: 0.4770
 epoch: 37, train_loss: 0.8949, test_loss: 0.9704, test_f1: 0.4687
 epoch: 38, train_loss: 0.8838, test_loss: 0.9686, test_f1: 0.4834
 epoch: 39, train_loss: 0.8802, test_loss: 0.9711, test_f1: 0.4831
 epoch: 40, train_loss: 0.8783, test_loss: 0.9530, test_f1: 0.4809
 epoch: 41, train_loss: 0.8709, test_loss: 0.9604, test_f1: 0.4889
 epoch: 42, train_loss: 0.8677, test_loss: 0.9596, test_f1: 0.4772
 epoch: 43, train_loss: 0.8625, test_loss: 0.9750, test_f1: 0.4732
 epoch: 44, train_loss: 0.8542, test_loss: 0.9720, test_f1: 0.4855
 epoch: 45, train_loss: 0.8622, test_loss: 0.9617, test_f1: 0.4866
 epoch: 46, train_loss: 0.8464, test_loss: 0.9575, test_f1: 0.4937
 epoch: 47, train_loss: 0.8533, test_loss: 0.9621, test_f1: 0.4859
 epoch: 48, train_loss: 0.8410, test_loss: 0.9550, test_f1: 0.4955
 epoch: 49, train_loss: 0.8354, test_loss: 0.9742, test_f1: 0.4980
 epoch: 50, train_loss: 0.8331, test_loss: 0.9747, test_f1: 0.4989
 epoch: 51, train_loss: 0.8177, test_loss: 0.9644, test_f1: 0.4853
 epoch: 52, train_loss: 0.8198, test_loss: 0.9673, test_f1: 0.4984
 epoch: 53, train_loss: 0.8184, test_loss: 0.9734, test_f1: 0.4957
 epoch: 54, train_loss: 0.8227, test_loss: 0.9649, test_f1: 0.4866
 epoch: 55, train_loss: 0.7996, test_loss: 0.9721, test_f1: 0.4889
 epoch: 56, train_loss: 0.8033, test_loss: 0.9771, test_f1: 0.4855
 epoch: 57, train_loss: 0.8059, test_loss: 0.9818, test_f1: 0.4656
 epoch: 58, train_loss: 0.8020, test_loss: 0.9741, test_f1: 0.4794
 epoch: 59, train_loss: 0.8069, test_loss: 0.9721, test_f1: 0.4763
 epoch: 60, train_loss: 0.8028, test_loss: 0.9760, test_f1: 0.4818
 epoch: 61, train_loss: 0.7996, test_loss: 0.9710, test_f1: 0.4885
 epoch: 62, train_loss: 0.8008, test_loss: 0.9735, test_f1: 0.4920
 epoch: 63, train_loss: 0.7918, test_loss: 0.9886, test_f1: 0.4617
 epoch: 64, train_loss: 0.7960, test_loss: 0.9754, test_f1: 0.4685
 epoch: 65, train_loss: 0.8029, test_loss: 0.9914, test_f1: 0.4653
 epoch: 66, train_loss: 0.7852, test_loss: 0.9819, test_f1: 0.5048
 epoch: 67, train_loss: 0.7847, test_loss: 0.9830, test_f1: 0.4872
 epoch: 68, train_loss: 0.7824, test_loss: 0.9805, test_f1: 0.4948
 epoch: 69, train_loss: 0.7795, test_loss: 0.9940, test_f1: 0.4926
 epoch: 70, train_loss: 0.7748, test_loss: 0.9918, test_f1: 0.4927
 epoch: 71, train_loss: 0.7770, test_loss: 0.9935, test_f1: 0.5026
 epoch: 72, train_loss: 0.7828, test_loss: 0.9925, test_f1: 0.5075
 epoch: 73, train_loss: 0.7714, test_loss: 0.9976, test_f1: 0.4918
 epoch: 74, train_loss: 0.7611, test_loss: 0.9972, test_f1: 0.4736
 epoch: 75, train_loss: 0.7670, test_loss: 1.0080, test_f1: 0.4932
 epoch: 76, train_loss: 0.7677, test_loss: 1.0157, test_f1: 0.4940
 epoch: 77, train_loss: 0.7697, test_loss: 1.0199, test_f1: 0.4868
 epoch: 78, train_loss: 0.7712, test_loss: 0.9870, test_f1: 0.5080
 epoch: 79, train_loss: 0.7751, test_loss: 0.9929, test_f1: 0.5033
 epoch: 80, train_loss: 0.7617, test_loss: 1.0025, test_f1: 0.4938
 epoch: 81, train_loss: 0.7484, test_loss: 1.0138, test_f1: 0.4955
 epoch: 82, train_loss: 0.7631, test_loss: 1.0122, test_f1: 0.4957
 epoch: 83, train_loss: 0.7487, test_loss: 1.0170, test_f1: 0.4704
 epoch: 84, train_loss: 0.7578, test_loss: 1.0120, test_f1: 0.4883
 epoch: 85, train_loss: 0.7395, test_loss: 1.0102, test_f1: 0.4936
 epoch: 86, train_loss: 0.7481, test_loss: 1.0054, test_f1: 0.5147
 epoch: 87, train_loss: 0.7528, test_loss: 1.0193, test_f1: 0.4708
 epoch: 88, train_loss: 0.7474, test_loss: 1.0039, test_f1: 0.5089
 epoch: 89, train_loss: 0.7433, test_loss: 1.0020, test_f1: 0.4988
 epoch: 90, train_loss: 0.7416, test_loss: 1.0157, test_f1: 0.4957
 epoch: 91, train_loss: 0.7264, test_loss: 1.0078, test_f1: 0.5198
 epoch: 92, train_loss: 0.7411, test_loss: 1.0090, test_f1: 0.5020
 epoch: 93, train_loss: 0.7401, test_loss: 1.0374, test_f1: 0.4784
 epoch: 94, train_loss: 0.7326, test_loss: 1.0316, test_f1: 0.4959
 epoch: 95, train_loss: 0.7317, test_loss: 1.0373, test_f1: 0.4781
 epoch: 96, train_loss: 0.7227, test_loss: 1.0401, test_f1: 0.4969
 epoch: 97, train_loss: 0.7300, test_loss: 1.0075, test_f1: 0.5125
 epoch: 98, train_loss: 0.7185, test_loss: 1.0404, test_f1: 0.4875
 epoch: 99, train_loss: 0.7105, test_loss: 1.0347, test_f1: 0.5070
##################ITERATION #9 ****************************************
 epoch: 0, train_loss: 1.3608, test_loss: 1.2610, test_f1: 0.3264
 epoch: 1, train_loss: 1.2598, test_loss: 1.1868, test_f1: 0.3415
 epoch: 2, train_loss: 1.2187, test_loss: 1.1411, test_f1: 0.4369
 epoch: 3, train_loss: 1.1804, test_loss: 1.1005, test_f1: 0.4713
 epoch: 4, train_loss: 1.1636, test_loss: 1.0783, test_f1: 0.4776
 epoch: 5, train_loss: 1.1683, test_loss: 1.0667, test_f1: 0.4584
 epoch: 6, train_loss: 1.1416, test_loss: 1.0636, test_f1: 0.4738
 epoch: 7, train_loss: 1.1194, test_loss: 1.0515, test_f1: 0.4534
 epoch: 8, train_loss: 1.1092, test_loss: 1.0504, test_f1: 0.4655
 epoch: 9, train_loss: 1.1059, test_loss: 1.0442, test_f1: 0.4483
 epoch: 10, train_loss: 1.1039, test_loss: 1.0384, test_f1: 0.4425
 epoch: 11, train_loss: 1.0751, test_loss: 1.0310, test_f1: 0.4443
 epoch: 12, train_loss: 1.0790, test_loss: 1.0215, test_f1: 0.4623
 epoch: 13, train_loss: 1.0604, test_loss: 1.0192, test_f1: 0.4713
 epoch: 14, train_loss: 1.0536, test_loss: 1.0104, test_f1: 0.4680
 epoch: 15, train_loss: 1.0555, test_loss: 1.0093, test_f1: 0.4857
 epoch: 16, train_loss: 1.0505, test_loss: 1.0028, test_f1: 0.4860
 epoch: 17, train_loss: 1.0198, test_loss: 0.9970, test_f1: 0.4868
 epoch: 18, train_loss: 1.0293, test_loss: 0.9912, test_f1: 0.4869
 epoch: 19, train_loss: 1.0284, test_loss: 0.9902, test_f1: 0.4817
 epoch: 20, train_loss: 1.0108, test_loss: 0.9872, test_f1: 0.4916
 epoch: 21, train_loss: 1.0059, test_loss: 0.9910, test_f1: 0.4883
 epoch: 22, train_loss: 1.0061, test_loss: 0.9812, test_f1: 0.4914
 epoch: 23, train_loss: 1.0004, test_loss: 0.9872, test_f1: 0.4949
 epoch: 24, train_loss: 0.9858, test_loss: 0.9752, test_f1: 0.5079
 epoch: 25, train_loss: 0.9814, test_loss: 0.9736, test_f1: 0.5128
 epoch: 26, train_loss: 0.9766, test_loss: 0.9934, test_f1: 0.4880
 epoch: 27, train_loss: 0.9693, test_loss: 0.9747, test_f1: 0.5035
 epoch: 28, train_loss: 0.9661, test_loss: 0.9639, test_f1: 0.5074
 epoch: 29, train_loss: 0.9676, test_loss: 0.9828, test_f1: 0.4989
 epoch: 30, train_loss: 0.9431, test_loss: 1.0116, test_f1: 0.4943
 epoch: 31, train_loss: 0.9559, test_loss: 0.9684, test_f1: 0.5012
 epoch: 32, train_loss: 0.9525, test_loss: 1.0013, test_f1: 0.4962
 epoch: 33, train_loss: 0.9389, test_loss: 1.0213, test_f1: 0.4961
 epoch: 34, train_loss: 0.9458, test_loss: 0.9791, test_f1: 0.4955
 epoch: 35, train_loss: 0.9303, test_loss: 0.9805, test_f1: 0.4919
 epoch: 36, train_loss: 0.9216, test_loss: 0.9799, test_f1: 0.4802
 epoch: 37, train_loss: 0.9138, test_loss: 0.9578, test_f1: 0.4872
 epoch: 38, train_loss: 0.9131, test_loss: 1.0101, test_f1: 0.4690
 epoch: 39, train_loss: 0.9118, test_loss: 1.0138, test_f1: 0.4838
 epoch: 40, train_loss: 0.8994, test_loss: 0.9726, test_f1: 0.4779
 epoch: 41, train_loss: 0.9051, test_loss: 0.9849, test_f1: 0.4856
 epoch: 42, train_loss: 0.8949, test_loss: 1.0420, test_f1: 0.4823
 epoch: 43, train_loss: 0.8844, test_loss: 0.9587, test_f1: 0.4762
 epoch: 44, train_loss: 0.8814, test_loss: 1.1589, test_f1: 0.4606
 epoch: 45, train_loss: 0.8745, test_loss: 0.9942, test_f1: 0.4742
 epoch: 46, train_loss: 0.8759, test_loss: 0.9958, test_f1: 0.4794
 epoch: 47, train_loss: 0.8684, test_loss: 1.0145, test_f1: 0.4775
 epoch: 48, train_loss: 0.8692, test_loss: 1.0086, test_f1: 0.4791
 epoch: 49, train_loss: 0.8577, test_loss: 1.0268, test_f1: 0.4863
 epoch: 50, train_loss: 0.8534, test_loss: 1.0517, test_f1: 0.4723
 epoch: 51, train_loss: 0.8515, test_loss: 1.0185, test_f1: 0.4924
 epoch: 52, train_loss: 0.8473, test_loss: 1.0190, test_f1: 0.4948
 epoch: 53, train_loss: 0.8359, test_loss: 1.0051, test_f1: 0.4919
 epoch: 54, train_loss: 0.8433, test_loss: 1.0192, test_f1: 0.4817
 epoch: 55, train_loss: 0.8448, test_loss: 1.0286, test_f1: 0.4781
 epoch: 56, train_loss: 0.8273, test_loss: 1.0042, test_f1: 0.4866
 epoch: 57, train_loss: 0.8365, test_loss: 1.0333, test_f1: 0.4826
 epoch: 58, train_loss: 0.8289, test_loss: 1.0313, test_f1: 0.4772
 epoch: 59, train_loss: 0.8352, test_loss: 1.0350, test_f1: 0.4813
 epoch: 60, train_loss: 0.8226, test_loss: 1.0300, test_f1: 0.4764
 epoch: 61, train_loss: 0.8151, test_loss: 1.0157, test_f1: 0.4810
 epoch: 62, train_loss: 0.8172, test_loss: 1.0535, test_f1: 0.4807
 epoch: 63, train_loss: 0.8179, test_loss: 1.0522, test_f1: 0.4798
 epoch: 64, train_loss: 0.8151, test_loss: 1.0697, test_f1: 0.4850
 epoch: 65, train_loss: 0.8080, test_loss: 1.0694, test_f1: 0.4720
 epoch: 66, train_loss: 0.8213, test_loss: 1.0526, test_f1: 0.4797
 epoch: 67, train_loss: 0.8032, test_loss: 1.0259, test_f1: 0.4934
 epoch: 68, train_loss: 0.8038, test_loss: 1.0433, test_f1: 0.4825
 epoch: 69, train_loss: 0.8111, test_loss: 1.0586, test_f1: 0.4784
 epoch: 70, train_loss: 0.8124, test_loss: 1.0637, test_f1: 0.4792
 epoch: 71, train_loss: 0.8086, test_loss: 1.0881, test_f1: 0.4724
 epoch: 72, train_loss: 0.8102, test_loss: 1.1074, test_f1: 0.4731
 epoch: 73, train_loss: 0.7926, test_loss: 1.1559, test_f1: 0.4512
 epoch: 74, train_loss: 0.7912, test_loss: 1.1097, test_f1: 0.4706
 epoch: 75, train_loss: 0.7952, test_loss: 1.0725, test_f1: 0.4771
 epoch: 76, train_loss: 0.7936, test_loss: 1.0890, test_f1: 0.4774
 epoch: 77, train_loss: 0.7835, test_loss: 1.0771, test_f1: 0.4819
 epoch: 78, train_loss: 0.7815, test_loss: 1.0881, test_f1: 0.4732
 epoch: 79, train_loss: 0.7987, test_loss: 1.0910, test_f1: 0.4728
 epoch: 80, train_loss: 0.7772, test_loss: 1.0993, test_f1: 0.4618
 epoch: 81, train_loss: 0.7843, test_loss: 1.0857, test_f1: 0.4738
 epoch: 82, train_loss: 0.7726, test_loss: 1.1390, test_f1: 0.4725
 epoch: 83, train_loss: 0.7662, test_loss: 1.1060, test_f1: 0.4755
 epoch: 84, train_loss: 0.7740, test_loss: 1.1157, test_f1: 0.4757
 epoch: 85, train_loss: 0.7683, test_loss: 1.1225, test_f1: 0.4641
 epoch: 86, train_loss: 0.7560, test_loss: 1.1572, test_f1: 0.4639
 epoch: 87, train_loss: 0.7939, test_loss: 1.1522, test_f1: 0.4720
 epoch: 88, train_loss: 0.7720, test_loss: 1.1189, test_f1: 0.4837
 epoch: 89, train_loss: 0.7698, test_loss: 1.1263, test_f1: 0.4702
 epoch: 90, train_loss: 0.7619, test_loss: 1.1909, test_f1: 0.4616
 epoch: 91, train_loss: 0.7662, test_loss: 1.0838, test_f1: 0.4720
 epoch: 92, train_loss: 0.7606, test_loss: 1.1022, test_f1: 0.4799
 epoch: 93, train_loss: 0.7627, test_loss: 1.1371, test_f1: 0.4768
 epoch: 94, train_loss: 0.7533, test_loss: 1.2177, test_f1: 0.4820
 epoch: 95, train_loss: 0.7500, test_loss: 1.1605, test_f1: 0.4733
 epoch: 96, train_loss: 0.7477, test_loss: 1.1098, test_f1: 0.4800
 epoch: 97, train_loss: 0.7333, test_loss: 1.1887, test_f1: 0.4717
 epoch: 98, train_loss: 0.7494, test_loss: 1.1399, test_f1: 0.4848
 epoch: 99, train_loss: 0.7402, test_loss: 1.1554, test_f1: 0.4774

Training completed in 361.81 seconds
Best F1: 0.5522 at epoch 95
Mean F1 across iterations: 0.5302  0.0153
========================FINAL RESULTS================================
FEGIN weighted F1: 0.5522  0.0153
python main.py --data ltspice_examples --representation component_component --model FEGIN --layers 2 --hiddens 128 --batch_size 256 --lr 0.0001 --emb_size 128 --epochs 100 --save_appendix component_component_L2_H128_BS256_LR0.0001_E128 --no_val
-----



STDERR:
  File "main.py", line 370, in <module>
    main()
  File "main.py", line 254, in main
    dataset = dataset_class(
  File "/home/philip/projects/ltspice_examples_code_repo/Circuit-Completion-Using-GNNs/component_classification_with_link_prediction_head/evaluation/FEGIN/kernel/circuit_datasets.py", line 15, in __init__
    self.data, self.slices = torch.load(self.processed_paths[0])
  File "/home/philip/.local/lib/python3.8/site-packages/torch/serialization.py", line 1040, in load
    warnings.warn(
  File "/usr/lib/python3.8/warnings.py", line 109, in _showwarnmsg
    sw(msg.message, msg.category, msg.filename, msg.lineno,
  File "main.py", line 47, in warn_with_traceback
    traceback.print_stack(file=log)
/home/philip/projects/ltspice_examples_code_repo/Circuit-Completion-Using-GNNs/component_classification_with_link_prediction_head/evaluation/FEGIN/kernel/circuit_datasets.py:15: FutureWarning: You are using `torch.load` with `weights_only=False` (the current default value), which uses the default pickle module implicitly. It is possible to construct malicious pickle data which will execute arbitrary code during unpickling (See https://github.com/pytorch/pytorch/blob/main/SECURITY.md#untrusted-models for more details). In a future release, the default value for `weights_only` will be flipped to `True`. This limits the functions that could be executed during unpickling. Arbitrary objects will no longer be allowed to be loaded via this mode unless they are explicitly allowlisted by the user via `torch.serialization.add_safe_globals`. We recommend you start setting `weights_only=True` for any use case where you don't have full control of the loaded file. Please open an issue on GitHub for any issues related to this experimental feature.
  self.data, self.slices = torch.load(self.processed_paths[0])
