STDOUT:
Results will be saved in /home/philip/projects/ltspice_examples_code_repo/Circuit-Completion-Using-GNNs/component_classification_with_link_prediction_head/evaluation/FEGIN/results/model_FEGIN_dataset_ltspice_demos
Command line input: python main.py --data ltspice_demos --representation component_pin --model FEGIN --layers 6 --hiddens 64 --batch_size 64 --lr 0.01 --emb_size 250 --epochs 100 --save_appendix component_pin_L6_H64_BS64_LR0.01_E250 --no_val
 is saved.
-----
ltspice_demos - FEGIN
Using 6 layers, 64 hidden units, h = 2
Loading component_pin representation dataset
ENTERED
Training FEGIN on component_pin representation
Train: 1565, Test: 383
##################ITERATION #0 ****************************************
 epoch: 0, train_loss: 1.2334, test_loss: 1.3573, test_f1: 0.2327
 epoch: 1, train_loss: 1.0509, test_loss: 1.0524, test_f1: 0.5396
 epoch: 2, train_loss: 0.9755, test_loss: 1.1966, test_f1: 0.3502
 epoch: 3, train_loss: 0.9414, test_loss: 1.1033, test_f1: 0.4743
 epoch: 4, train_loss: 0.8907, test_loss: 1.2563, test_f1: 0.4240
 epoch: 5, train_loss: 0.8976, test_loss: 1.0821, test_f1: 0.4690
 epoch: 6, train_loss: 0.8556, test_loss: 1.0328, test_f1: 0.4400
 epoch: 7, train_loss: 0.8743, test_loss: 1.0996, test_f1: 0.5635
 epoch: 8, train_loss: 0.8185, test_loss: 1.7703, test_f1: 0.3744
 epoch: 9, train_loss: 0.8166, test_loss: 1.5817, test_f1: 0.3583
 epoch: 10, train_loss: 0.7956, test_loss: 1.2584, test_f1: 0.4415
 epoch: 11, train_loss: 0.7730, test_loss: 1.1237, test_f1: 0.4780
 epoch: 12, train_loss: 0.7807, test_loss: 246.9057, test_f1: 0.5206
 epoch: 13, train_loss: 0.7797, test_loss: 1.2519, test_f1: 0.5203
 epoch: 14, train_loss: 0.7446, test_loss: 1.4481, test_f1: 0.5615
 epoch: 15, train_loss: 0.7465, test_loss: 1.3159, test_f1: 0.5434
 epoch: 16, train_loss: 0.7434, test_loss: 1.3125, test_f1: 0.4875
 epoch: 17, train_loss: 0.7546, test_loss: 1.4392, test_f1: 0.4686
 epoch: 18, train_loss: 0.7352, test_loss: 1.0492, test_f1: 0.6014
 epoch: 19, train_loss: 0.6998, test_loss: 1.1049, test_f1: 0.6018
 epoch: 20, train_loss: 0.7151, test_loss: 1.0323, test_f1: 0.5680
 epoch: 21, train_loss: 0.7336, test_loss: 1.2567, test_f1: 0.5328
 epoch: 22, train_loss: 0.7251, test_loss: 1.0180, test_f1: 0.5942
 epoch: 23, train_loss: 0.7070, test_loss: 1.1496, test_f1: 0.5346
 epoch: 24, train_loss: 0.6975, test_loss: 1.2784, test_f1: 0.5318
 epoch: 25, train_loss: 0.7167, test_loss: 1.4978, test_f1: 0.5152
 epoch: 26, train_loss: 0.6869, test_loss: 1.1928, test_f1: 0.6003
 epoch: 27, train_loss: 0.6877, test_loss: 1.1535, test_f1: 0.4972
 epoch: 28, train_loss: 0.6854, test_loss: 1.3842, test_f1: 0.6210
 epoch: 29, train_loss: 0.6732, test_loss: 1.3720, test_f1: 0.5288
 epoch: 30, train_loss: 0.7013, test_loss: 1.3287, test_f1: 0.5023
 epoch: 31, train_loss: 0.6783, test_loss: 1.4750, test_f1: 0.6111
 epoch: 32, train_loss: 0.6700, test_loss: 1.5290, test_f1: 0.5589
 epoch: 33, train_loss: 0.6815, test_loss: 2.7167, test_f1: 0.5483
 epoch: 34, train_loss: 0.6702, test_loss: 1.5307, test_f1: 0.5368
 epoch: 35, train_loss: 0.6846, test_loss: 1.3220, test_f1: 0.5516
 epoch: 36, train_loss: 0.6471, test_loss: 1.5918, test_f1: 0.6203
 epoch: 37, train_loss: 0.6830, test_loss: 1.4423, test_f1: 0.5557
 epoch: 38, train_loss: 0.6712, test_loss: 1.5296, test_f1: 0.6009
 epoch: 39, train_loss: 0.6417, test_loss: 1.2497, test_f1: 0.5234
 epoch: 40, train_loss: 0.6352, test_loss: 1.4461, test_f1: 0.5480
 epoch: 41, train_loss: 0.6612, test_loss: 1.3809, test_f1: 0.5448
 epoch: 42, train_loss: 0.6320, test_loss: 1.4395, test_f1: 0.5760
 epoch: 43, train_loss: 0.6313, test_loss: 1.7772, test_f1: 0.5408
 epoch: 44, train_loss: 0.6305, test_loss: 1.0402, test_f1: 0.5818
 epoch: 45, train_loss: 0.6214, test_loss: 1.3620, test_f1: 0.5530
 epoch: 46, train_loss: 0.6045, test_loss: 1.7098, test_f1: 0.4168
 epoch: 47, train_loss: 0.6257, test_loss: 1.3925, test_f1: 0.5713
 epoch: 48, train_loss: 0.6119, test_loss: 1.8245, test_f1: 0.5786
 epoch: 49, train_loss: 0.6345, test_loss: 1.3983, test_f1: 0.5336
 epoch: 50, train_loss: 0.6116, test_loss: 1.4083, test_f1: 0.6031
 epoch: 51, train_loss: 0.5597, test_loss: 1.3192, test_f1: 0.6127
 epoch: 52, train_loss: 0.5458, test_loss: 1.7901, test_f1: 0.5729
 epoch: 53, train_loss: 0.5493, test_loss: 1.3850, test_f1: 0.5487
 epoch: 54, train_loss: 0.5340, test_loss: 1.7147, test_f1: 0.5840
 epoch: 55, train_loss: 0.5345, test_loss: 1.6737, test_f1: 0.5710
 epoch: 56, train_loss: 0.5254, test_loss: 1.6729, test_f1: 0.5872
 epoch: 57, train_loss: 0.5120, test_loss: 2.0069, test_f1: 0.5811
 epoch: 58, train_loss: 0.5249, test_loss: 1.6441, test_f1: 0.6063
 epoch: 59, train_loss: 0.5162, test_loss: 1.3289, test_f1: 0.5950
 epoch: 60, train_loss: 0.4878, test_loss: 1.8345, test_f1: 0.5542
 epoch: 61, train_loss: 0.4968, test_loss: 1.8415, test_f1: 0.5602
 epoch: 62, train_loss: 0.4944, test_loss: 1.6943, test_f1: 0.6475
 epoch: 63, train_loss: 0.4762, test_loss: 1.6912, test_f1: 0.5874
 epoch: 64, train_loss: 0.4574, test_loss: 1.9067, test_f1: 0.6656
 epoch: 65, train_loss: 0.4484, test_loss: 1.6531, test_f1: 0.5994
 epoch: 66, train_loss: 0.4763, test_loss: 2.0510, test_f1: 0.5984
 epoch: 67, train_loss: 0.4783, test_loss: 1.8802, test_f1: 0.6358
 epoch: 68, train_loss: 0.4675, test_loss: 1.8619, test_f1: 0.5627
 epoch: 69, train_loss: 0.4793, test_loss: 1.8516, test_f1: 0.5383
 epoch: 70, train_loss: 0.5153, test_loss: 1.4889, test_f1: 0.5807
 epoch: 71, train_loss: 0.4817, test_loss: 1.9090, test_f1: 0.5766
 epoch: 72, train_loss: 0.4654, test_loss: 2.0027, test_f1: 0.5578
 epoch: 73, train_loss: 0.4418, test_loss: 1.8117, test_f1: 0.5710
 epoch: 74, train_loss: 0.4387, test_loss: 1.7353, test_f1: 0.6187
 epoch: 75, train_loss: 0.4729, test_loss: 1.7916, test_f1: 0.5996
 epoch: 76, train_loss: 0.4715, test_loss: 1.5294, test_f1: 0.5947
 epoch: 77, train_loss: 0.4692, test_loss: 1.7256, test_f1: 0.6012
 epoch: 78, train_loss: 0.4318, test_loss: 1.8679, test_f1: 0.5969
 epoch: 79, train_loss: 0.4131, test_loss: 1.7082, test_f1: 0.6020
 epoch: 80, train_loss: 0.4248, test_loss: 1.6080, test_f1: 0.6239
 epoch: 81, train_loss: 0.4178, test_loss: 1.9794, test_f1: 0.5844
 epoch: 82, train_loss: 0.4106, test_loss: 1.6423, test_f1: 0.6514
 epoch: 83, train_loss: 0.4108, test_loss: 2.0085, test_f1: 0.5990
 epoch: 84, train_loss: 0.3921, test_loss: 2.5993, test_f1: 0.5465
 epoch: 85, train_loss: 0.4203, test_loss: 2.1295, test_f1: 0.5860
 epoch: 86, train_loss: 0.4044, test_loss: 2.0027, test_f1: 0.5478
 epoch: 87, train_loss: 0.3776, test_loss: 1.8843, test_f1: 0.6007
 epoch: 88, train_loss: 0.3961, test_loss: 1.9310, test_f1: 0.6031
 epoch: 89, train_loss: 0.3680, test_loss: 2.1328, test_f1: 0.5948
 epoch: 90, train_loss: 0.3536, test_loss: 2.6247, test_f1: 0.5567
 epoch: 91, train_loss: 0.4081, test_loss: 1.7204, test_f1: 0.6109
 epoch: 92, train_loss: 0.3723, test_loss: 2.3516, test_f1: 0.6104
 epoch: 93, train_loss: 0.3585, test_loss: 2.0401, test_f1: 0.6096
 epoch: 94, train_loss: 0.3912, test_loss: 1.9407, test_f1: 0.5579
 epoch: 95, train_loss: 0.3513, test_loss: 2.1783, test_f1: 0.6049
 epoch: 96, train_loss: 0.3669, test_loss: 1.9379, test_f1: 0.6028
 epoch: 97, train_loss: 0.3652, test_loss: 1.8653, test_f1: 0.6008
 epoch: 98, train_loss: 0.3664, test_loss: 2.3229, test_f1: 0.5376
 epoch: 99, train_loss: 0.3832, test_loss: 1.6503, test_f1: 0.6000
##################ITERATION #1 ****************************************
 epoch: 0, train_loss: 1.1583, test_loss: 1.3543, test_f1: 0.3475
 epoch: 1, train_loss: 1.0078, test_loss: 1.2054, test_f1: 0.4454
 epoch: 2, train_loss: 0.9360, test_loss: 1.1573, test_f1: 0.4741
 epoch: 3, train_loss: 0.8844, test_loss: 0.9639, test_f1: 0.5541
 epoch: 4, train_loss: 0.8717, test_loss: 1.0219, test_f1: 0.5127
 epoch: 5, train_loss: 0.8491, test_loss: 1.0708, test_f1: 0.4549
 epoch: 6, train_loss: 0.8672, test_loss: 0.9898, test_f1: 0.5059
 epoch: 7, train_loss: 0.8280, test_loss: 1.2427, test_f1: 0.4890
 epoch: 8, train_loss: 0.8310, test_loss: 1.7156, test_f1: 0.2975
 epoch: 9, train_loss: 0.7854, test_loss: 1.0448, test_f1: 0.5288
 epoch: 10, train_loss: 0.7829, test_loss: 1.3782, test_f1: 0.4473
 epoch: 11, train_loss: 0.8094, test_loss: 1.0722, test_f1: 0.5321
 epoch: 12, train_loss: 0.7916, test_loss: 1.0817, test_f1: 0.5779
 epoch: 13, train_loss: 0.7932, test_loss: 1.1133, test_f1: 0.5310
 epoch: 14, train_loss: 0.7717, test_loss: 1.0622, test_f1: 0.5140
 epoch: 15, train_loss: 0.7507, test_loss: 1.0221, test_f1: 0.5791
 epoch: 16, train_loss: 0.7709, test_loss: 1.0789, test_f1: 0.5236
 epoch: 17, train_loss: 0.7696, test_loss: 1.1369, test_f1: 0.5746
 epoch: 18, train_loss: 0.7341, test_loss: 1.2764, test_f1: 0.4798
 epoch: 19, train_loss: 0.7370, test_loss: 0.9865, test_f1: 0.6187
 epoch: 20, train_loss: 0.7358, test_loss: 1.0673, test_f1: 0.5019
 epoch: 21, train_loss: 0.7461, test_loss: 1.4461, test_f1: 0.5080
 epoch: 22, train_loss: 0.7275, test_loss: 1.7123, test_f1: 0.4587
 epoch: 23, train_loss: 0.7165, test_loss: 1.1031, test_f1: 0.5389
 epoch: 24, train_loss: 0.7048, test_loss: 1.0514, test_f1: 0.5648
 epoch: 25, train_loss: 0.6905, test_loss: 1.1126, test_f1: 0.5424
 epoch: 26, train_loss: 0.6912, test_loss: 1.4888, test_f1: 0.5624
 epoch: 27, train_loss: 0.7262, test_loss: 1.1318, test_f1: 0.5596
 epoch: 28, train_loss: 0.6893, test_loss: 1.4969, test_f1: 0.4850
 epoch: 29, train_loss: 0.7021, test_loss: 1.1370, test_f1: 0.5065
 epoch: 30, train_loss: 0.6702, test_loss: 1.1616, test_f1: 0.6195
 epoch: 31, train_loss: 0.6509, test_loss: 1.2420, test_f1: 0.5110
 epoch: 32, train_loss: 0.6668, test_loss: 1.4361, test_f1: 0.5149
 epoch: 33, train_loss: 0.6771, test_loss: 1.1163, test_f1: 0.5669
 epoch: 34, train_loss: 0.6714, test_loss: 1.4899, test_f1: 0.5439
 epoch: 35, train_loss: 0.6680, test_loss: 1.2357, test_f1: 0.5687
 epoch: 36, train_loss: 0.6791, test_loss: 0.9913, test_f1: 0.6296
 epoch: 37, train_loss: 0.6521, test_loss: 1.2459, test_f1: 0.5492
 epoch: 38, train_loss: 0.6208, test_loss: 1.4200, test_f1: 0.5248
 epoch: 39, train_loss: 0.6700, test_loss: 1.3954, test_f1: 0.4607
 epoch: 40, train_loss: 0.6749, test_loss: 0.9414, test_f1: 0.6322
 epoch: 41, train_loss: 0.6176, test_loss: 1.2726, test_f1: 0.6105
 epoch: 42, train_loss: 0.6070, test_loss: 1.8801, test_f1: 0.5628
 epoch: 43, train_loss: 0.6320, test_loss: 1.2002, test_f1: 0.6128
 epoch: 44, train_loss: 0.6129, test_loss: 1.2611, test_f1: 0.5448
 epoch: 45, train_loss: 0.6238, test_loss: 1.6286, test_f1: 0.4371
 epoch: 46, train_loss: 0.6121, test_loss: 1.2809, test_f1: 0.5483
 epoch: 47, train_loss: 0.5880, test_loss: 1.4626, test_f1: 0.5807
 epoch: 48, train_loss: 0.5880, test_loss: 1.2658, test_f1: 0.6002
 epoch: 49, train_loss: 0.5648, test_loss: 1.3496, test_f1: 0.5834
 epoch: 50, train_loss: 0.5835, test_loss: 1.5150, test_f1: 0.5825
 epoch: 51, train_loss: 0.5328, test_loss: 1.5518, test_f1: 0.5870
 epoch: 52, train_loss: 0.5221, test_loss: 1.3845, test_f1: 0.5887
 epoch: 53, train_loss: 0.5166, test_loss: 1.5211, test_f1: 0.5638
 epoch: 54, train_loss: 0.5213, test_loss: 1.2933, test_f1: 0.6000
 epoch: 55, train_loss: 0.4821, test_loss: 1.8095, test_f1: 0.4838
 epoch: 56, train_loss: 0.5255, test_loss: 1.4353, test_f1: 0.5991
 epoch: 57, train_loss: 0.4991, test_loss: 1.4645, test_f1: 0.5907
 epoch: 58, train_loss: 0.4838, test_loss: 1.3892, test_f1: 0.5872
 epoch: 59, train_loss: 0.4851, test_loss: 1.5030, test_f1: 0.5705
 epoch: 60, train_loss: 0.4870, test_loss: 1.4962, test_f1: 0.6207
 epoch: 61, train_loss: 0.4852, test_loss: 1.5172, test_f1: 0.5699
 epoch: 62, train_loss: 0.4508, test_loss: 1.5431, test_f1: 0.6285
 epoch: 63, train_loss: 0.4473, test_loss: 1.7192, test_f1: 0.5333
 epoch: 64, train_loss: 0.4526, test_loss: 1.4436, test_f1: 0.6558
 epoch: 65, train_loss: 0.4694, test_loss: 1.7352, test_f1: 0.5566
 epoch: 66, train_loss: 0.4282, test_loss: 1.7756, test_f1: 0.6045
 epoch: 67, train_loss: 0.4425, test_loss: 1.7003, test_f1: 0.6143
 epoch: 68, train_loss: 0.4366, test_loss: 1.6630, test_f1: 0.6463
 epoch: 69, train_loss: 0.4221, test_loss: 1.7433, test_f1: 0.5523
 epoch: 70, train_loss: 0.4312, test_loss: 1.6492, test_f1: 0.6443
 epoch: 71, train_loss: 0.4235, test_loss: 1.4950, test_f1: 0.6476
 epoch: 72, train_loss: 0.3841, test_loss: 1.7365, test_f1: 0.6273
 epoch: 73, train_loss: 0.4272, test_loss: 1.8180, test_f1: 0.6091
 epoch: 74, train_loss: 0.4180, test_loss: 1.8325, test_f1: 0.6353
 epoch: 75, train_loss: 0.4143, test_loss: 1.8066, test_f1: 0.6071
 epoch: 76, train_loss: 0.4054, test_loss: 1.7289, test_f1: 0.6282
 epoch: 77, train_loss: 0.4204, test_loss: 1.7586, test_f1: 0.6597
 epoch: 78, train_loss: 0.4534, test_loss: 1.3631, test_f1: 0.6123
 epoch: 79, train_loss: 0.4311, test_loss: 1.6089, test_f1: 0.6509
 epoch: 80, train_loss: 0.3951, test_loss: 1.7022, test_f1: 0.6373
 epoch: 81, train_loss: 0.3735, test_loss: 2.0824, test_f1: 0.5304
 epoch: 82, train_loss: 0.4214, test_loss: 1.5755, test_f1: 0.5958
 epoch: 83, train_loss: 0.3804, test_loss: 2.2776, test_f1: 0.6184
 epoch: 84, train_loss: 0.4193, test_loss: 1.4410, test_f1: 0.6169
 epoch: 85, train_loss: 0.4113, test_loss: 1.7292, test_f1: 0.6510
 epoch: 86, train_loss: 0.3537, test_loss: 1.9759, test_f1: 0.6029
 epoch: 87, train_loss: 0.3530, test_loss: 1.8371, test_f1: 0.6177
 epoch: 88, train_loss: 0.3399, test_loss: 1.9206, test_f1: 0.6158
 epoch: 89, train_loss: 0.3529, test_loss: 1.7369, test_f1: 0.5954
 epoch: 90, train_loss: 0.3396, test_loss: 2.0385, test_f1: 0.6578
 epoch: 91, train_loss: 0.3860, test_loss: 1.9533, test_f1: 0.5986
 epoch: 92, train_loss: 0.3592, test_loss: 2.2891, test_f1: 0.5539
 epoch: 93, train_loss: 0.3845, test_loss: 1.9486, test_f1: 0.6446
 epoch: 94, train_loss: 0.3851, test_loss: 2.0259, test_f1: 0.6561
 epoch: 95, train_loss: 0.3502, test_loss: 1.9096, test_f1: 0.6132
 epoch: 96, train_loss: 0.3451, test_loss: 1.8612, test_f1: 0.6411
 epoch: 97, train_loss: 0.3519, test_loss: 1.9858, test_f1: 0.6256
 epoch: 98, train_loss: 0.3212, test_loss: 1.9550, test_f1: 0.6723
 epoch: 99, train_loss: 0.2990, test_loss: 1.9055, test_f1: 0.6296
##################ITERATION #2 ****************************************
 epoch: 0, train_loss: 1.2401, test_loss: 1.2510, test_f1: 0.2845
 epoch: 1, train_loss: 1.0675, test_loss: 1.0998, test_f1: 0.4714
 epoch: 2, train_loss: 0.9564, test_loss: 1.0238, test_f1: 0.4411
 epoch: 3, train_loss: 0.9060, test_loss: 1.0668, test_f1: 0.5023
 epoch: 4, train_loss: 0.8712, test_loss: 1.1649, test_f1: 0.4185
 epoch: 5, train_loss: 0.8590, test_loss: 1.0455, test_f1: 0.5156
 epoch: 6, train_loss: 0.8429, test_loss: 1.0126, test_f1: 0.5236
 epoch: 7, train_loss: 0.8290, test_loss: 1.1739, test_f1: 0.5467
 epoch: 8, train_loss: 0.7954, test_loss: 1.0094, test_f1: 0.4612
 epoch: 9, train_loss: 0.8062, test_loss: 1.1627, test_f1: 0.5207
 epoch: 10, train_loss: 0.7858, test_loss: 1.0221, test_f1: 0.4977
 epoch: 11, train_loss: 0.7802, test_loss: 0.9825, test_f1: 0.5423
 epoch: 12, train_loss: 0.8036, test_loss: 0.9735, test_f1: 0.5601
 epoch: 13, train_loss: 0.7843, test_loss: 0.9759, test_f1: 0.5560
 epoch: 14, train_loss: 0.7495, test_loss: 1.1420, test_f1: 0.5590
 epoch: 15, train_loss: 0.7455, test_loss: 1.0369, test_f1: 0.5154
 epoch: 16, train_loss: 0.7180, test_loss: 1.2849, test_f1: 0.4837
 epoch: 17, train_loss: 0.7549, test_loss: 1.0092, test_f1: 0.5820
 epoch: 18, train_loss: 0.7227, test_loss: 1.2400, test_f1: 0.5115
 epoch: 19, train_loss: 0.7344, test_loss: 1.2274, test_f1: 0.5707
 epoch: 20, train_loss: 0.7349, test_loss: 0.9926, test_f1: 0.5880
 epoch: 21, train_loss: 0.7197, test_loss: 0.9857, test_f1: 0.5749
 epoch: 22, train_loss: 0.6972, test_loss: 1.1167, test_f1: 0.5759
 epoch: 23, train_loss: 0.7262, test_loss: 1.2377, test_f1: 0.5141
 epoch: 24, train_loss: 0.6838, test_loss: 1.2206, test_f1: 0.5730
 epoch: 25, train_loss: 0.7109, test_loss: 1.1620, test_f1: 0.5675
 epoch: 26, train_loss: 0.7095, test_loss: 1.0697, test_f1: 0.6037
 epoch: 27, train_loss: 0.7005, test_loss: 0.9628, test_f1: 0.5520
 epoch: 28, train_loss: 0.6695, test_loss: 0.9569, test_f1: 0.6049
 epoch: 29, train_loss: 0.6755, test_loss: 1.2089, test_f1: 0.5528
 epoch: 30, train_loss: 0.6520, test_loss: 1.1533, test_f1: 0.5878
 epoch: 31, train_loss: 0.6529, test_loss: 1.0578, test_f1: 0.5773
 epoch: 32, train_loss: 0.6378, test_loss: 1.2899, test_f1: 0.4956
 epoch: 33, train_loss: 0.6110, test_loss: 1.1965, test_f1: 0.5568
 epoch: 34, train_loss: 0.6258, test_loss: 1.1006, test_f1: 0.5571
 epoch: 35, train_loss: 0.6592, test_loss: 0.9084, test_f1: 0.6256
 epoch: 36, train_loss: 0.6177, test_loss: 1.1749, test_f1: 0.6059
 epoch: 37, train_loss: 0.6248, test_loss: 1.0046, test_f1: 0.6450
 epoch: 38, train_loss: 0.6192, test_loss: 1.0159, test_f1: 0.6357
 epoch: 39, train_loss: 0.6105, test_loss: 1.1534, test_f1: 0.6521
 epoch: 40, train_loss: 0.5973, test_loss: 1.0530, test_f1: 0.6528
 epoch: 41, train_loss: 0.6089, test_loss: 0.9557, test_f1: 0.6056
 epoch: 42, train_loss: 0.5935, test_loss: 1.1306, test_f1: 0.6350
 epoch: 43, train_loss: 0.5976, test_loss: 1.0758, test_f1: 0.6695
 epoch: 44, train_loss: 0.5767, test_loss: 1.1703, test_f1: 0.6058
 epoch: 45, train_loss: 0.5558, test_loss: 1.2022, test_f1: 0.5628
 epoch: 46, train_loss: 0.5914, test_loss: 1.1780, test_f1: 0.5720
 epoch: 47, train_loss: 0.5614, test_loss: 1.3116, test_f1: 0.6235
 epoch: 48, train_loss: 0.5655, test_loss: 1.1428, test_f1: 0.5911
 epoch: 49, train_loss: 0.5772, test_loss: 1.1039, test_f1: 0.6304
 epoch: 50, train_loss: 0.5494, test_loss: 1.3015, test_f1: 0.5728
 epoch: 51, train_loss: 0.5248, test_loss: 1.1980, test_f1: 0.6353
 epoch: 52, train_loss: 0.5093, test_loss: 1.1200, test_f1: 0.6350
 epoch: 53, train_loss: 0.4851, test_loss: 1.2994, test_f1: 0.6607
 epoch: 54, train_loss: 0.4513, test_loss: 1.2820, test_f1: 0.6484
 epoch: 55, train_loss: 0.4321, test_loss: 1.2460, test_f1: 0.6555
 epoch: 56, train_loss: 0.4529, test_loss: 1.5173, test_f1: 0.6468
 epoch: 57, train_loss: 0.4415, test_loss: 1.2796, test_f1: 0.6392
 epoch: 58, train_loss: 0.4468, test_loss: 1.1888, test_f1: 0.6574
 epoch: 59, train_loss: 0.4521, test_loss: 1.6338, test_f1: 0.6324
 epoch: 60, train_loss: 0.4433, test_loss: 1.3100, test_f1: 0.6084
 epoch: 61, train_loss: 0.4420, test_loss: 1.3586, test_f1: 0.6317
 epoch: 62, train_loss: 0.4622, test_loss: 1.4525, test_f1: 0.6309
 epoch: 63, train_loss: 0.4505, test_loss: 1.2555, test_f1: 0.6282
 epoch: 64, train_loss: 0.4018, test_loss: 1.5301, test_f1: 0.6395
 epoch: 65, train_loss: 0.4320, test_loss: 1.3387, test_f1: 0.6768
 epoch: 66, train_loss: 0.4140, test_loss: 1.6865, test_f1: 0.5989
 epoch: 67, train_loss: 0.4201, test_loss: 1.2726, test_f1: 0.6304
 epoch: 68, train_loss: 0.4255, test_loss: 1.2944, test_f1: 0.6597
 epoch: 69, train_loss: 0.3926, test_loss: 1.5145, test_f1: 0.6614
 epoch: 70, train_loss: 0.3843, test_loss: 1.6749, test_f1: 0.6351
 epoch: 71, train_loss: 0.4020, test_loss: 1.3884, test_f1: 0.6827
 epoch: 72, train_loss: 0.3908, test_loss: 1.4634, test_f1: 0.6825
 epoch: 73, train_loss: 0.4124, test_loss: 1.2419, test_f1: 0.6706
 epoch: 74, train_loss: 0.4078, test_loss: 1.3981, test_f1: 0.6178
 epoch: 75, train_loss: 0.4130, test_loss: 1.5388, test_f1: 0.6648
 epoch: 76, train_loss: 0.4291, test_loss: 1.2689, test_f1: 0.6335
 epoch: 77, train_loss: 0.4232, test_loss: 1.7416, test_f1: 0.6601
 epoch: 78, train_loss: 0.3679, test_loss: 1.3535, test_f1: 0.6414
 epoch: 79, train_loss: 0.3793, test_loss: 1.3849, test_f1: 0.6345
 epoch: 80, train_loss: 0.3520, test_loss: 1.5149, test_f1: 0.6849
 epoch: 81, train_loss: 0.3594, test_loss: 1.4757, test_f1: 0.6338
 epoch: 82, train_loss: 0.3808, test_loss: 1.3823, test_f1: 0.6332
 epoch: 83, train_loss: 0.3619, test_loss: 1.5463, test_f1: 0.6395
 epoch: 84, train_loss: 0.3742, test_loss: 1.3774, test_f1: 0.6562
 epoch: 85, train_loss: 0.3432, test_loss: 1.4946, test_f1: 0.6521
 epoch: 86, train_loss: 0.3410, test_loss: 1.5314, test_f1: 0.6251
 epoch: 87, train_loss: 0.3465, test_loss: 1.5661, test_f1: 0.6389
 epoch: 88, train_loss: 0.3626, test_loss: 1.5180, test_f1: 0.6568
 epoch: 89, train_loss: 0.3348, test_loss: 1.5741, test_f1: 0.6387
 epoch: 90, train_loss: 0.3307, test_loss: 1.3678, test_f1: 0.6615
 epoch: 91, train_loss: 0.3753, test_loss: 1.5351, test_f1: 0.6580
 epoch: 92, train_loss: 0.3429, test_loss: 1.6337, test_f1: 0.6207
 epoch: 93, train_loss: 0.3355, test_loss: 1.5155, test_f1: 0.6446
 epoch: 94, train_loss: 0.3479, test_loss: 1.6522, test_f1: 0.6201
 epoch: 95, train_loss: 0.3459, test_loss: 1.6528, test_f1: 0.6421
 epoch: 96, train_loss: 0.3080, test_loss: 1.6895, test_f1: 0.6748
 epoch: 97, train_loss: 0.2999, test_loss: 1.7132, test_f1: 0.6852
 epoch: 98, train_loss: 0.3218, test_loss: 1.5055, test_f1: 0.6399
 epoch: 99, train_loss: 0.3187, test_loss: 1.4752, test_f1: 0.6623
##################ITERATION #3 ****************************************
 epoch: 0, train_loss: 1.2031, test_loss: 1.3719, test_f1: 0.3132
 epoch: 1, train_loss: 0.9864, test_loss: 1.1135, test_f1: 0.4837
 epoch: 2, train_loss: 0.9562, test_loss: 1.0169, test_f1: 0.5427
 epoch: 3, train_loss: 0.9387, test_loss: 1.2134, test_f1: 0.4260
 epoch: 4, train_loss: 0.9189, test_loss: 1.0504, test_f1: 0.5083
 epoch: 5, train_loss: 0.8960, test_loss: 1.2092, test_f1: 0.5563
 epoch: 6, train_loss: 0.8413, test_loss: 0.9722, test_f1: 0.5638
 epoch: 7, train_loss: 0.8228, test_loss: 1.0003, test_f1: 0.5894
 epoch: 8, train_loss: 0.8100, test_loss: 1.0403, test_f1: 0.5710
 epoch: 9, train_loss: 0.8179, test_loss: 1.0191, test_f1: 0.5529
 epoch: 10, train_loss: 0.8054, test_loss: 1.2039, test_f1: 0.4692
 epoch: 11, train_loss: 0.7925, test_loss: 1.0607, test_f1: 0.6028
 epoch: 12, train_loss: 0.8062, test_loss: 0.9790, test_f1: 0.5710
 epoch: 13, train_loss: 0.7708, test_loss: 1.1323, test_f1: 0.5232
 epoch: 14, train_loss: 0.7465, test_loss: 1.0746, test_f1: 0.5496
 epoch: 15, train_loss: 0.7478, test_loss: 1.1098, test_f1: 0.5642
 epoch: 16, train_loss: 0.7279, test_loss: 1.4103, test_f1: 0.4704
 epoch: 17, train_loss: 0.7255, test_loss: 1.0056, test_f1: 0.5522
 epoch: 18, train_loss: 0.7233, test_loss: 1.1591, test_f1: 0.5494
 epoch: 19, train_loss: 0.7155, test_loss: 1.2055, test_f1: 0.4699
 epoch: 20, train_loss: 0.7422, test_loss: 1.0721, test_f1: 0.4810
 epoch: 21, train_loss: 0.7130, test_loss: 1.0778, test_f1: 0.5343
 epoch: 22, train_loss: 0.7007, test_loss: 1.4511, test_f1: 0.5764
 epoch: 23, train_loss: 0.6935, test_loss: 1.2331, test_f1: 0.6132
 epoch: 24, train_loss: 0.7191, test_loss: 0.9885, test_f1: 0.5999
 epoch: 25, train_loss: 0.6792, test_loss: 0.9610, test_f1: 0.6304
 epoch: 26, train_loss: 0.6945, test_loss: 1.4641, test_f1: 0.5502
 epoch: 27, train_loss: 0.6814, test_loss: 1.1063, test_f1: 0.5288
 epoch: 28, train_loss: 0.6522, test_loss: 1.7974, test_f1: 0.5305
 epoch: 29, train_loss: 0.6892, test_loss: 1.2158, test_f1: 0.5111
 epoch: 30, train_loss: 0.6686, test_loss: 1.1069, test_f1: 0.5141
 epoch: 31, train_loss: 0.6613, test_loss: 1.1529, test_f1: 0.6172
 epoch: 32, train_loss: 0.6070, test_loss: 1.2675, test_f1: 0.5313
 epoch: 33, train_loss: 0.6452, test_loss: 1.0422, test_f1: 0.6027
 epoch: 34, train_loss: 0.6547, test_loss: 1.0283, test_f1: 0.5757
 epoch: 35, train_loss: 0.6156, test_loss: 1.1116, test_f1: 0.6455
 epoch: 36, train_loss: 0.6032, test_loss: 1.1032, test_f1: 0.6301
 epoch: 37, train_loss: 0.5990, test_loss: 1.3360, test_f1: 0.6241
 epoch: 38, train_loss: 0.6077, test_loss: 1.3352, test_f1: 0.5790
 epoch: 39, train_loss: 0.5857, test_loss: 1.2634, test_f1: 0.6199
 epoch: 40, train_loss: 0.5903, test_loss: 1.2463, test_f1: 0.5321
 epoch: 41, train_loss: 0.5732, test_loss: 1.1698, test_f1: 0.5294
 epoch: 42, train_loss: 0.5968, test_loss: 1.2059, test_f1: 0.6419
 epoch: 43, train_loss: 0.5552, test_loss: 1.1284, test_f1: 0.6110
 epoch: 44, train_loss: 0.5991, test_loss: 1.1516, test_f1: 0.5219
 epoch: 45, train_loss: 0.6133, test_loss: 1.3040, test_f1: 0.5955
 epoch: 46, train_loss: 0.5560, test_loss: 1.0955, test_f1: 0.6602
 epoch: 47, train_loss: 0.5297, test_loss: 1.3463, test_f1: 0.6408
 epoch: 48, train_loss: 0.5902, test_loss: 1.0564, test_f1: 0.6257
 epoch: 49, train_loss: 0.5842, test_loss: 1.3203, test_f1: 0.6227
 epoch: 50, train_loss: 0.5577, test_loss: 1.4340, test_f1: 0.5721
 epoch: 51, train_loss: 0.4994, test_loss: 1.2013, test_f1: 0.6181
 epoch: 52, train_loss: 0.4664, test_loss: 1.3292, test_f1: 0.5886
 epoch: 53, train_loss: 0.4878, test_loss: 1.1055, test_f1: 0.6569
 epoch: 54, train_loss: 0.4759, test_loss: 1.2189, test_f1: 0.6236
 epoch: 55, train_loss: 0.4330, test_loss: 1.2348, test_f1: 0.6286
 epoch: 56, train_loss: 0.4563, test_loss: 1.3955, test_f1: 0.5861
 epoch: 57, train_loss: 0.4282, test_loss: 1.3605, test_f1: 0.6282
 epoch: 58, train_loss: 0.4407, test_loss: 1.2546, test_f1: 0.6262
 epoch: 59, train_loss: 0.4366, test_loss: 1.1627, test_f1: 0.6809
 epoch: 60, train_loss: 0.4253, test_loss: 1.4410, test_f1: 0.6571
 epoch: 61, train_loss: 0.4244, test_loss: 1.2526, test_f1: 0.6629
 epoch: 62, train_loss: 0.4152, test_loss: 1.4350, test_f1: 0.6177
 epoch: 63, train_loss: 0.3897, test_loss: 1.5570, test_f1: 0.6020
 epoch: 64, train_loss: 0.4117, test_loss: 1.6385, test_f1: 0.6017
 epoch: 65, train_loss: 0.4065, test_loss: 1.5338, test_f1: 0.6425
 epoch: 66, train_loss: 0.3660, test_loss: 1.3524, test_f1: 0.6542
 epoch: 67, train_loss: 0.3995, test_loss: 1.5118, test_f1: 0.6212
 epoch: 68, train_loss: 0.4234, test_loss: 1.6346, test_f1: 0.6131
 epoch: 69, train_loss: 0.4295, test_loss: 1.2137, test_f1: 0.6592
 epoch: 70, train_loss: 0.3605, test_loss: 1.4657, test_f1: 0.6433
 epoch: 71, train_loss: 0.3694, test_loss: 1.8682, test_f1: 0.5792
 epoch: 72, train_loss: 0.3965, test_loss: 1.7462, test_f1: 0.6224
 epoch: 73, train_loss: 0.3737, test_loss: 1.7082, test_f1: 0.5991
 epoch: 74, train_loss: 0.3913, test_loss: 1.8290, test_f1: 0.5737
 epoch: 75, train_loss: 0.3915, test_loss: 2.1152, test_f1: 0.5986
 epoch: 76, train_loss: 0.4096, test_loss: 1.5166, test_f1: 0.6238
 epoch: 77, train_loss: 0.3684, test_loss: 1.4906, test_f1: 0.6327
 epoch: 78, train_loss: 0.3622, test_loss: 1.7516, test_f1: 0.6570
 epoch: 79, train_loss: 0.3571, test_loss: 1.7482, test_f1: 0.6401
 epoch: 80, train_loss: 0.3653, test_loss: 1.8187, test_f1: 0.6034
 epoch: 81, train_loss: 0.3673, test_loss: 2.1834, test_f1: 0.6501
 epoch: 82, train_loss: 0.3445, test_loss: 1.5899, test_f1: 0.6646
 epoch: 83, train_loss: 0.3754, test_loss: 1.7749, test_f1: 0.6096
 epoch: 84, train_loss: 0.3437, test_loss: 1.8289, test_f1: 0.6228
 epoch: 85, train_loss: 0.3559, test_loss: 1.9100, test_f1: 0.6580
 epoch: 86, train_loss: 0.3440, test_loss: 1.8986, test_f1: 0.6083
 epoch: 87, train_loss: 0.3280, test_loss: 1.6756, test_f1: 0.6550
 epoch: 88, train_loss: 0.3573, test_loss: 2.1557, test_f1: 0.6260
 epoch: 89, train_loss: 0.4036, test_loss: 2.0845, test_f1: 0.6149
 epoch: 90, train_loss: 0.3551, test_loss: 1.8002, test_f1: 0.6424
 epoch: 91, train_loss: 0.3434, test_loss: 1.8637, test_f1: 0.6205
 epoch: 92, train_loss: 0.3275, test_loss: 1.6974, test_f1: 0.5618
 epoch: 93, train_loss: 0.3104, test_loss: 1.6690, test_f1: 0.6287
 epoch: 94, train_loss: 0.3410, test_loss: 1.8695, test_f1: 0.6344
 epoch: 95, train_loss: 0.3442, test_loss: 1.5989, test_f1: 0.6681
 epoch: 96, train_loss: 0.3025, test_loss: 2.0770, test_f1: 0.6486
 epoch: 97, train_loss: 0.3019, test_loss: 1.9075, test_f1: 0.6008
 epoch: 98, train_loss: 0.3441, test_loss: 1.5039, test_f1: 0.6675
 epoch: 99, train_loss: 0.2899, test_loss: 1.7895, test_f1: 0.6366
##################ITERATION #4 ****************************************
 epoch: 0, train_loss: 1.2992, test_loss: 1.2613, test_f1: 0.4135
 epoch: 1, train_loss: 0.9989, test_loss: 1.1265, test_f1: 0.4599
 epoch: 2, train_loss: 0.9514, test_loss: 1.1096, test_f1: 0.5348
 epoch: 3, train_loss: 0.9013, test_loss: 1.0395, test_f1: 0.5508
 epoch: 4, train_loss: 0.8763, test_loss: 1.1223, test_f1: 0.5268
 epoch: 5, train_loss: 0.8498, test_loss: 1.1113, test_f1: 0.5341
 epoch: 6, train_loss: 0.8311, test_loss: 1.3397, test_f1: 0.4781
 epoch: 7, train_loss: 0.8661, test_loss: 0.9907, test_f1: 0.5515
 epoch: 8, train_loss: 0.8205, test_loss: 1.0661, test_f1: 0.5606
 epoch: 9, train_loss: 0.8431, test_loss: 1.0120, test_f1: 0.5874
 epoch: 10, train_loss: 0.8016, test_loss: 1.0052, test_f1: 0.5879
 epoch: 11, train_loss: 0.7761, test_loss: 1.1080, test_f1: 0.5732
 epoch: 12, train_loss: 0.7570, test_loss: 1.0743, test_f1: 0.5558
 epoch: 13, train_loss: 0.7510, test_loss: 1.0220, test_f1: 0.5874
 epoch: 14, train_loss: 0.7417, test_loss: 1.1092, test_f1: 0.5638
 epoch: 15, train_loss: 0.7479, test_loss: 1.0226, test_f1: 0.5843
 epoch: 16, train_loss: 0.7268, test_loss: 1.1408, test_f1: 0.5504
 epoch: 17, train_loss: 0.7497, test_loss: 1.1598, test_f1: 0.5373
 epoch: 18, train_loss: 0.7417, test_loss: 1.0248, test_f1: 0.5781
 epoch: 19, train_loss: 0.6988, test_loss: 1.1672, test_f1: 0.5661
 epoch: 20, train_loss: 0.7409, test_loss: 1.3742, test_f1: 0.4904
 epoch: 21, train_loss: 0.7133, test_loss: 1.2035, test_f1: 0.5623
 epoch: 22, train_loss: 0.6979, test_loss: 1.1016, test_f1: 0.5703
 epoch: 23, train_loss: 0.6982, test_loss: 1.2738, test_f1: 0.5680
 epoch: 24, train_loss: 0.6783, test_loss: 1.0773, test_f1: 0.6448
 epoch: 25, train_loss: 0.6767, test_loss: 1.1008, test_f1: 0.5532
 epoch: 26, train_loss: 0.6870, test_loss: 0.9763, test_f1: 0.6081
 epoch: 27, train_loss: 0.6755, test_loss: 1.0897, test_f1: 0.5554
 epoch: 28, train_loss: 0.6896, test_loss: 1.1804, test_f1: 0.5553
 epoch: 29, train_loss: 0.6770, test_loss: 1.0786, test_f1: 0.5729
 epoch: 30, train_loss: 0.6841, test_loss: 1.1649, test_f1: 0.5727
 epoch: 31, train_loss: 0.6726, test_loss: 1.0719, test_f1: 0.5894
 epoch: 32, train_loss: 0.7104, test_loss: 1.1881, test_f1: 0.5689
 epoch: 33, train_loss: 0.6370, test_loss: 1.1759, test_f1: 0.6204
 epoch: 34, train_loss: 0.6419, test_loss: 1.1039, test_f1: 0.5804
 epoch: 35, train_loss: 0.6504, test_loss: 1.2049, test_f1: 0.5976
 epoch: 36, train_loss: 0.6336, test_loss: 1.0779, test_f1: 0.6108
 epoch: 37, train_loss: 0.6217, test_loss: 1.1721, test_f1: 0.6120
 epoch: 38, train_loss: 0.6215, test_loss: 1.2915, test_f1: 0.5520
 epoch: 39, train_loss: 0.6051, test_loss: 1.2875, test_f1: 0.5767
 epoch: 40, train_loss: 0.6351, test_loss: 1.3934, test_f1: 0.4726
 epoch: 41, train_loss: 0.6400, test_loss: 1.2508, test_f1: 0.5854
 epoch: 42, train_loss: 0.6646, test_loss: 1.0743, test_f1: 0.5653
 epoch: 43, train_loss: 0.6181, test_loss: 2.8700, test_f1: 0.4552
 epoch: 44, train_loss: 0.6454, test_loss: 1.1067, test_f1: 0.6326
 epoch: 45, train_loss: 0.6126, test_loss: 1.0006, test_f1: 0.6173
 epoch: 46, train_loss: 0.6012, test_loss: 1.0764, test_f1: 0.6099
 epoch: 47, train_loss: 0.6046, test_loss: 1.2193, test_f1: 0.5689
 epoch: 48, train_loss: 0.5885, test_loss: 1.2784, test_f1: 0.5729
 epoch: 49, train_loss: 0.5845, test_loss: 1.2542, test_f1: 0.6054
 epoch: 50, train_loss: 0.5837, test_loss: 1.2347, test_f1: 0.5905
 epoch: 51, train_loss: 0.5796, test_loss: 1.2731, test_f1: 0.6260
 epoch: 52, train_loss: 0.5395, test_loss: 1.1906, test_f1: 0.5967
 epoch: 53, train_loss: 0.5182, test_loss: 1.2953, test_f1: 0.6141
 epoch: 54, train_loss: 0.5194, test_loss: 1.1950, test_f1: 0.6222
 epoch: 55, train_loss: 0.4969, test_loss: 1.2797, test_f1: 0.6114
 epoch: 56, train_loss: 0.4961, test_loss: 1.2261, test_f1: 0.6149
 epoch: 57, train_loss: 0.4967, test_loss: 1.2388, test_f1: 0.6401
 epoch: 58, train_loss: 0.4910, test_loss: 1.2255, test_f1: 0.6288
 epoch: 59, train_loss: 0.4951, test_loss: 1.3526, test_f1: 0.6153
 epoch: 60, train_loss: 0.4744, test_loss: 1.3937, test_f1: 0.6487
 epoch: 61, train_loss: 0.4815, test_loss: 1.4257, test_f1: 0.6440
 epoch: 62, train_loss: 0.4935, test_loss: 1.1353, test_f1: 0.6471
 epoch: 63, train_loss: 0.4906, test_loss: 1.6496, test_f1: 0.6310
 epoch: 64, train_loss: 0.4837, test_loss: 1.3212, test_f1: 0.5755
 epoch: 65, train_loss: 0.4576, test_loss: 1.3973, test_f1: 0.6435
 epoch: 66, train_loss: 0.4479, test_loss: 1.3499, test_f1: 0.6460
 epoch: 67, train_loss: 0.4640, test_loss: 1.3443, test_f1: 0.6510
 epoch: 68, train_loss: 0.4377, test_loss: 1.5172, test_f1: 0.6500
 epoch: 69, train_loss: 0.4836, test_loss: 1.2501, test_f1: 0.6712
 epoch: 70, train_loss: 0.4401, test_loss: 1.3696, test_f1: 0.6405
 epoch: 71, train_loss: 0.4454, test_loss: 1.5217, test_f1: 0.6307
 epoch: 72, train_loss: 0.4318, test_loss: 1.4092, test_f1: 0.6311
 epoch: 73, train_loss: 0.4337, test_loss: 1.4927, test_f1: 0.6404
 epoch: 74, train_loss: 0.4309, test_loss: 1.2303, test_f1: 0.6405
 epoch: 75, train_loss: 0.4577, test_loss: 1.5187, test_f1: 0.6391
 epoch: 76, train_loss: 0.4399, test_loss: 1.5225, test_f1: 0.6294
 epoch: 77, train_loss: 0.4483, test_loss: 1.3478, test_f1: 0.6498
 epoch: 78, train_loss: 0.4034, test_loss: 1.3945, test_f1: 0.6036
 epoch: 79, train_loss: 0.3813, test_loss: 1.6688, test_f1: 0.6012
 epoch: 80, train_loss: 0.4087, test_loss: 1.6173, test_f1: 0.5931
 epoch: 81, train_loss: 0.4207, test_loss: 1.3935, test_f1: 0.6284
 epoch: 82, train_loss: 0.4123, test_loss: 1.5568, test_f1: 0.6041
 epoch: 83, train_loss: 0.4055, test_loss: 1.7323, test_f1: 0.6344
 epoch: 84, train_loss: 0.4039, test_loss: 1.6012, test_f1: 0.6441
 epoch: 85, train_loss: 0.4106, test_loss: 1.5749, test_f1: 0.6422
 epoch: 86, train_loss: 0.3597, test_loss: 1.9653, test_f1: 0.6251
 epoch: 87, train_loss: 0.3921, test_loss: 1.8079, test_f1: 0.6054
 epoch: 88, train_loss: 0.3907, test_loss: 1.5707, test_f1: 0.6199
 epoch: 89, train_loss: 0.3687, test_loss: 1.8419, test_f1: 0.6367
 epoch: 90, train_loss: 0.3619, test_loss: 1.7653, test_f1: 0.6276
 epoch: 91, train_loss: 0.3539, test_loss: 1.8242, test_f1: 0.6154
 epoch: 92, train_loss: 0.3757, test_loss: 1.5547, test_f1: 0.6120
 epoch: 93, train_loss: 0.3625, test_loss: 1.6359, test_f1: 0.6687
 epoch: 94, train_loss: 0.3639, test_loss: 1.9136, test_f1: 0.6123
 epoch: 95, train_loss: 0.3824, test_loss: 1.8201, test_f1: 0.5734
 epoch: 96, train_loss: 0.3382, test_loss: 2.0862, test_f1: 0.6126
 epoch: 97, train_loss: 0.3418, test_loss: 1.7700, test_f1: 0.6518
 epoch: 98, train_loss: 0.3384, test_loss: 2.0898, test_f1: 0.6380
 epoch: 99, train_loss: 0.3487, test_loss: 1.8327, test_f1: 0.6265
##################ITERATION #5 ****************************************
 epoch: 0, train_loss: 1.1822, test_loss: 1.8100, test_f1: 0.1607
 epoch: 1, train_loss: 0.9499, test_loss: 1.3015, test_f1: 0.3029
 epoch: 2, train_loss: 0.8726, test_loss: 1.0657, test_f1: 0.5315
 epoch: 3, train_loss: 0.8469, test_loss: 0.9868, test_f1: 0.5505
 epoch: 4, train_loss: 0.8662, test_loss: 1.1725, test_f1: 0.4947
 epoch: 5, train_loss: 0.8326, test_loss: 1.0492, test_f1: 0.5662
 epoch: 6, train_loss: 0.8201, test_loss: 1.0469, test_f1: 0.5328
 epoch: 7, train_loss: 0.8101, test_loss: 1.4251, test_f1: 0.4078
 epoch: 8, train_loss: 0.8247, test_loss: 0.9475, test_f1: 0.5532
 epoch: 9, train_loss: 0.7772, test_loss: 1.1219, test_f1: 0.4515
 epoch: 10, train_loss: 0.7575, test_loss: 1.1163, test_f1: 0.5167
 epoch: 11, train_loss: 0.7886, test_loss: 0.9466, test_f1: 0.5760
 epoch: 12, train_loss: 0.7680, test_loss: 1.0660, test_f1: 0.5178
 epoch: 13, train_loss: 0.7507, test_loss: 1.8062, test_f1: 0.2973
 epoch: 14, train_loss: 0.7491, test_loss: 1.0481, test_f1: 0.4844
 epoch: 15, train_loss: 0.7492, test_loss: 1.2323, test_f1: 0.4904
 epoch: 16, train_loss: 0.7302, test_loss: 1.3779, test_f1: 0.4818
 epoch: 17, train_loss: 0.7356, test_loss: 1.2280, test_f1: 0.4899
 epoch: 18, train_loss: 0.7782, test_loss: 1.0370, test_f1: 0.5396
 epoch: 19, train_loss: 0.7415, test_loss: 0.9982, test_f1: 0.6120
 epoch: 20, train_loss: 0.7154, test_loss: 0.9467, test_f1: 0.5728
 epoch: 21, train_loss: 0.7153, test_loss: 1.0410, test_f1: 0.6060
 epoch: 22, train_loss: 0.7173, test_loss: 1.0620, test_f1: 0.5910
 epoch: 23, train_loss: 0.6890, test_loss: 1.1627, test_f1: 0.5433
 epoch: 24, train_loss: 0.6920, test_loss: 1.3740, test_f1: 0.4826
 epoch: 25, train_loss: 0.7200, test_loss: 1.0052, test_f1: 0.5714
 epoch: 26, train_loss: 0.6988, test_loss: 1.0538, test_f1: 0.6039
 epoch: 27, train_loss: 0.7211, test_loss: 1.2787, test_f1: 0.4950
 epoch: 28, train_loss: 0.7122, test_loss: 0.9770, test_f1: 0.6296
 epoch: 29, train_loss: 0.6974, test_loss: 1.4394, test_f1: 0.4773
 epoch: 30, train_loss: 0.6785, test_loss: 0.9998, test_f1: 0.5977
 epoch: 31, train_loss: 0.6649, test_loss: 0.9412, test_f1: 0.6407
 epoch: 32, train_loss: 0.6565, test_loss: 1.1760, test_f1: 0.5084
 epoch: 33, train_loss: 0.6612, test_loss: 1.4293, test_f1: 0.5650
 epoch: 34, train_loss: 0.6464, test_loss: 1.1705, test_f1: 0.4892
 epoch: 35, train_loss: 0.6499, test_loss: 1.0353, test_f1: 0.6293
 epoch: 36, train_loss: 0.6314, test_loss: 1.0513, test_f1: 0.6127
 epoch: 37, train_loss: 0.6174, test_loss: 1.0448, test_f1: 0.6397
 epoch: 38, train_loss: 0.6218, test_loss: 1.1410, test_f1: 0.6381
 epoch: 39, train_loss: 0.5924, test_loss: 1.1765, test_f1: 0.6080
 epoch: 40, train_loss: 0.5928, test_loss: 0.8912, test_f1: 0.6915
 epoch: 41, train_loss: 0.6195, test_loss: 1.1203, test_f1: 0.6159
 epoch: 42, train_loss: 0.6152, test_loss: 1.2652, test_f1: 0.5411
 epoch: 43, train_loss: 0.5966, test_loss: 1.1140, test_f1: 0.6070
 epoch: 44, train_loss: 0.6493, test_loss: 1.5407, test_f1: 0.5786
 epoch: 45, train_loss: 0.6317, test_loss: 1.2336, test_f1: 0.5354
 epoch: 46, train_loss: 0.6024, test_loss: 1.5761, test_f1: 0.5291
 epoch: 47, train_loss: 0.6155, test_loss: 1.2550, test_f1: 0.5665
 epoch: 48, train_loss: 0.6112, test_loss: 1.2963, test_f1: 0.6262
 epoch: 49, train_loss: 0.5897, test_loss: 1.3096, test_f1: 0.5881
 epoch: 50, train_loss: 0.5738, test_loss: 1.2023, test_f1: 0.6604
 epoch: 51, train_loss: 0.5217, test_loss: 1.2313, test_f1: 0.6375
 epoch: 52, train_loss: 0.5243, test_loss: 1.3121, test_f1: 0.6294
 epoch: 53, train_loss: 0.4811, test_loss: 1.5451, test_f1: 0.6590
 epoch: 54, train_loss: 0.5211, test_loss: 1.3347, test_f1: 0.6758
 epoch: 55, train_loss: 0.4793, test_loss: 1.3286, test_f1: 0.6776
 epoch: 56, train_loss: 0.4745, test_loss: 1.2779, test_f1: 0.6238
 epoch: 57, train_loss: 0.4651, test_loss: 1.8572, test_f1: 0.6015
 epoch: 58, train_loss: 0.5023, test_loss: 1.3336, test_f1: 0.6053
 epoch: 59, train_loss: 0.4633, test_loss: 1.6206, test_f1: 0.6325
 epoch: 60, train_loss: 0.4491, test_loss: 1.3703, test_f1: 0.6299
 epoch: 61, train_loss: 0.4753, test_loss: 1.8006, test_f1: 0.5746
 epoch: 62, train_loss: 0.4697, test_loss: 1.9776, test_f1: 0.5372
 epoch: 63, train_loss: 0.4966, test_loss: 1.9637, test_f1: 0.5862
 epoch: 64, train_loss: 0.4822, test_loss: 1.5709, test_f1: 0.6273
 epoch: 65, train_loss: 0.4525, test_loss: 1.4228, test_f1: 0.6378
 epoch: 66, train_loss: 0.4418, test_loss: 1.7152, test_f1: 0.6343
 epoch: 67, train_loss: 0.4930, test_loss: 2.0529, test_f1: 0.5588
 epoch: 68, train_loss: 0.5241, test_loss: 1.2631, test_f1: 0.6063
 epoch: 69, train_loss: 0.4689, test_loss: 1.3429, test_f1: 0.6630
 epoch: 70, train_loss: 0.4460, test_loss: 1.4313, test_f1: 0.6756
 epoch: 71, train_loss: 0.4350, test_loss: 1.3487, test_f1: 0.6358
 epoch: 72, train_loss: 0.4276, test_loss: 1.4022, test_f1: 0.5100
 epoch: 73, train_loss: 0.4586, test_loss: 1.4806, test_f1: 0.6183
 epoch: 74, train_loss: 0.4241, test_loss: 1.7026, test_f1: 0.6542
 epoch: 75, train_loss: 0.4517, test_loss: 1.9653, test_f1: 0.6092
 epoch: 76, train_loss: 0.4631, test_loss: 1.5497, test_f1: 0.6020
 epoch: 77, train_loss: 0.4634, test_loss: 1.8271, test_f1: 0.6093
 epoch: 78, train_loss: 0.4275, test_loss: 1.8526, test_f1: 0.6463
 epoch: 79, train_loss: 0.4087, test_loss: 1.6894, test_f1: 0.6240
 epoch: 80, train_loss: 0.4072, test_loss: 1.4883, test_f1: 0.6183
 epoch: 81, train_loss: 0.4158, test_loss: 1.6909, test_f1: 0.6390
 epoch: 82, train_loss: 0.4139, test_loss: 1.6794, test_f1: 0.6315
 epoch: 83, train_loss: 0.3948, test_loss: 1.7871, test_f1: 0.6365
 epoch: 84, train_loss: 0.4023, test_loss: 1.4644, test_f1: 0.6227
 epoch: 85, train_loss: 0.4066, test_loss: 1.4327, test_f1: 0.6370
 epoch: 86, train_loss: 0.3937, test_loss: 1.6412, test_f1: 0.6480
 epoch: 87, train_loss: 0.3963, test_loss: 1.9993, test_f1: 0.6240
 epoch: 88, train_loss: 0.4323, test_loss: 1.8593, test_f1: 0.5847
 epoch: 89, train_loss: 0.4211, test_loss: 1.3328, test_f1: 0.6391
 epoch: 90, train_loss: 0.3871, test_loss: 1.5832, test_f1: 0.6412
 epoch: 91, train_loss: 0.3700, test_loss: 1.7882, test_f1: 0.6157
 epoch: 92, train_loss: 0.4084, test_loss: 1.5659, test_f1: 0.6326
 epoch: 93, train_loss: 0.3890, test_loss: 1.7070, test_f1: 0.6297
 epoch: 94, train_loss: 0.4062, test_loss: 1.6462, test_f1: 0.6177
 epoch: 95, train_loss: 0.3866, test_loss: 1.4644, test_f1: 0.6854
 epoch: 96, train_loss: 0.3647, test_loss: 1.5810, test_f1: 0.6101
 epoch: 97, train_loss: 0.3411, test_loss: 1.7580, test_f1: 0.6223
 epoch: 98, train_loss: 0.3867, test_loss: 1.7671, test_f1: 0.6088
 epoch: 99, train_loss: 0.3634, test_loss: 2.0902, test_f1: 0.6435
##################ITERATION #6 ****************************************
 epoch: 0, train_loss: 1.2383, test_loss: 1.4936, test_f1: 0.1434
 epoch: 1, train_loss: 1.0198, test_loss: 1.1365, test_f1: 0.4994
 epoch: 2, train_loss: 0.9390, test_loss: 1.1306, test_f1: 0.4425
 epoch: 3, train_loss: 0.9034, test_loss: 1.0376, test_f1: 0.5795
 epoch: 4, train_loss: 0.8768, test_loss: 1.0935, test_f1: 0.4892
 epoch: 5, train_loss: 0.8554, test_loss: 1.7660, test_f1: 0.3228
 epoch: 6, train_loss: 0.8395, test_loss: 1.3438, test_f1: 0.4345
 epoch: 7, train_loss: 0.8194, test_loss: 1.2144, test_f1: 0.4410
 epoch: 8, train_loss: 0.8204, test_loss: 1.4327, test_f1: 0.4022
 epoch: 9, train_loss: 0.7968, test_loss: 1.1914, test_f1: 0.4543
 epoch: 10, train_loss: 0.8218, test_loss: 1.1948, test_f1: 0.4014
 epoch: 11, train_loss: 0.8235, test_loss: 1.2328, test_f1: 0.4660
 epoch: 12, train_loss: 0.8200, test_loss: 1.1776, test_f1: 0.4398
 epoch: 13, train_loss: 0.7483, test_loss: 0.9729, test_f1: 0.5775
 epoch: 14, train_loss: 0.7680, test_loss: 1.0110, test_f1: 0.5751
 epoch: 15, train_loss: 0.7573, test_loss: 1.1873, test_f1: 0.4352
 epoch: 16, train_loss: 0.7875, test_loss: 0.9272, test_f1: 0.5781
 epoch: 17, train_loss: 0.7708, test_loss: 1.1398, test_f1: 0.4988
 epoch: 18, train_loss: 0.7675, test_loss: 1.4386, test_f1: 0.4543
 epoch: 19, train_loss: 0.7264, test_loss: 0.9578, test_f1: 0.5837
 epoch: 20, train_loss: 0.7287, test_loss: 1.3891, test_f1: 0.5008
 epoch: 21, train_loss: 0.7587, test_loss: 1.3368, test_f1: 0.4774
 epoch: 22, train_loss: 0.7512, test_loss: 1.1789, test_f1: 0.4744
 epoch: 23, train_loss: 0.7421, test_loss: 1.0671, test_f1: 0.5160
 epoch: 24, train_loss: 0.7647, test_loss: 1.1167, test_f1: 0.5160
 epoch: 25, train_loss: 0.7576, test_loss: 1.1287, test_f1: 0.4990
 epoch: 26, train_loss: 0.7449, test_loss: 1.1563, test_f1: 0.5341
 epoch: 27, train_loss: 0.7304, test_loss: 1.0215, test_f1: 0.5691
 epoch: 28, train_loss: 0.7061, test_loss: 1.2126, test_f1: 0.5439
 epoch: 29, train_loss: 0.7033, test_loss: 1.1924, test_f1: 0.5415
 epoch: 30, train_loss: 0.7017, test_loss: 0.9617, test_f1: 0.6056
 epoch: 31, train_loss: 0.6830, test_loss: 1.0687, test_f1: 0.5587
 epoch: 32, train_loss: 0.6751, test_loss: 1.1220, test_f1: 0.5360
 epoch: 33, train_loss: 0.6743, test_loss: 1.0138, test_f1: 0.5908
 epoch: 34, train_loss: 0.6989, test_loss: 1.1521, test_f1: 0.5189
 epoch: 35, train_loss: 0.6909, test_loss: 1.1344, test_f1: 0.5435
 epoch: 36, train_loss: 0.6758, test_loss: 1.3230, test_f1: 0.4789
 epoch: 37, train_loss: 0.6620, test_loss: 1.1716, test_f1: 0.6183
 epoch: 38, train_loss: 0.6570, test_loss: 0.9331, test_f1: 0.5934
 epoch: 39, train_loss: 0.6768, test_loss: 1.7383, test_f1: 0.4367
 epoch: 40, train_loss: 0.6601, test_loss: 0.9613, test_f1: 0.5606
 epoch: 41, train_loss: 0.6601, test_loss: 0.9490, test_f1: 0.6355
 epoch: 42, train_loss: 0.6586, test_loss: 1.0391, test_f1: 0.5975
 epoch: 43, train_loss: 0.6361, test_loss: 1.1760, test_f1: 0.5999
 epoch: 44, train_loss: 0.6568, test_loss: 4.6299, test_f1: 0.1902
 epoch: 45, train_loss: 0.6470, test_loss: 1.0509, test_f1: 0.6106
 epoch: 46, train_loss: 0.6657, test_loss: 1.1260, test_f1: 0.5279
 epoch: 47, train_loss: 0.6525, test_loss: 1.1150, test_f1: 0.6097
 epoch: 48, train_loss: 0.6463, test_loss: 0.9402, test_f1: 0.5534
 epoch: 49, train_loss: 0.6377, test_loss: 1.3823, test_f1: 0.5779
 epoch: 50, train_loss: 0.6003, test_loss: 1.2319, test_f1: 0.5474
 epoch: 51, train_loss: 0.5685, test_loss: 1.1089, test_f1: 0.5888
 epoch: 52, train_loss: 0.5632, test_loss: 1.0785, test_f1: 0.6220
 epoch: 53, train_loss: 0.5439, test_loss: 1.3101, test_f1: 0.5922
 epoch: 54, train_loss: 0.5649, test_loss: 1.0836, test_f1: 0.6271
 epoch: 55, train_loss: 0.5643, test_loss: 1.0435, test_f1: 0.6097
 epoch: 56, train_loss: 0.5103, test_loss: 1.1028, test_f1: 0.6438
 epoch: 57, train_loss: 0.5142, test_loss: 1.0331, test_f1: 0.6270
 epoch: 58, train_loss: 0.5015, test_loss: 1.1151, test_f1: 0.6819
 epoch: 59, train_loss: 0.4961, test_loss: 1.1606, test_f1: 0.6381
 epoch: 60, train_loss: 0.4975, test_loss: 1.1736, test_f1: 0.6614
 epoch: 61, train_loss: 0.5050, test_loss: 1.3331, test_f1: 0.6356
 epoch: 62, train_loss: 0.4721, test_loss: 1.2739, test_f1: 0.6360
 epoch: 63, train_loss: 0.4675, test_loss: 1.1689, test_f1: 0.6463
 epoch: 64, train_loss: 0.4588, test_loss: 1.2232, test_f1: 0.6929
 epoch: 65, train_loss: 0.4603, test_loss: 1.4341, test_f1: 0.5528
 epoch: 66, train_loss: 0.4695, test_loss: 1.2324, test_f1: 0.6115
 epoch: 67, train_loss: 0.4640, test_loss: 1.2636, test_f1: 0.5358
 epoch: 68, train_loss: 0.4791, test_loss: 1.4842, test_f1: 0.5933
 epoch: 69, train_loss: 0.4794, test_loss: 1.7003, test_f1: 0.6233
 epoch: 70, train_loss: 0.4815, test_loss: 1.1970, test_f1: 0.6284
 epoch: 71, train_loss: 0.4942, test_loss: 1.4732, test_f1: 0.6236
 epoch: 72, train_loss: 0.4440, test_loss: 1.2487, test_f1: 0.6339
 epoch: 73, train_loss: 0.4290, test_loss: 1.2857, test_f1: 0.6008
 epoch: 74, train_loss: 0.4507, test_loss: 1.2732, test_f1: 0.6422
 epoch: 75, train_loss: 0.4902, test_loss: 1.2591, test_f1: 0.6903
 epoch: 76, train_loss: 0.4600, test_loss: 1.2204, test_f1: 0.6179
 epoch: 77, train_loss: 0.4845, test_loss: 1.3173, test_f1: 0.6499
 epoch: 78, train_loss: 0.4611, test_loss: 1.3442, test_f1: 0.6356
 epoch: 79, train_loss: 0.4519, test_loss: 1.3094, test_f1: 0.6744
 epoch: 80, train_loss: 0.4300, test_loss: 1.2175, test_f1: 0.6431
 epoch: 81, train_loss: 0.4187, test_loss: 1.4158, test_f1: 0.5855
 epoch: 82, train_loss: 0.4006, test_loss: 1.3686, test_f1: 0.6745
 epoch: 83, train_loss: 0.4199, test_loss: 1.2940, test_f1: 0.6369
 epoch: 84, train_loss: 0.4115, test_loss: 1.3242, test_f1: 0.6400
 epoch: 85, train_loss: 0.4189, test_loss: 1.2790, test_f1: 0.6234
 epoch: 86, train_loss: 0.4146, test_loss: 1.3395, test_f1: 0.6568
 epoch: 87, train_loss: 0.4057, test_loss: 1.2291, test_f1: 0.6395
 epoch: 88, train_loss: 0.3941, test_loss: 1.3404, test_f1: 0.6308
 epoch: 89, train_loss: 0.3972, test_loss: 1.5500, test_f1: 0.6151
 epoch: 90, train_loss: 0.4156, test_loss: 1.7553, test_f1: 0.4820
 epoch: 91, train_loss: 0.4127, test_loss: 1.7226, test_f1: 0.5267
 epoch: 92, train_loss: 0.4597, test_loss: 1.4845, test_f1: 0.5299
 epoch: 93, train_loss: 0.4037, test_loss: 1.4668, test_f1: 0.6130
 epoch: 94, train_loss: 0.4055, test_loss: 1.3453, test_f1: 0.6454
 epoch: 95, train_loss: 0.3866, test_loss: 2.0290, test_f1: 0.5348
 epoch: 96, train_loss: 0.3897, test_loss: 1.3836, test_f1: 0.6706
 epoch: 97, train_loss: 0.3652, test_loss: 1.3624, test_f1: 0.6377
 epoch: 98, train_loss: 0.3677, test_loss: 1.5565, test_f1: 0.6210
 epoch: 99, train_loss: 0.3823, test_loss: 1.2361, test_f1: 0.7229
##################ITERATION #7 ****************************************
 epoch: 0, train_loss: 1.1763, test_loss: 1.3849, test_f1: 0.3825
 epoch: 1, train_loss: 0.9770, test_loss: 1.0389, test_f1: 0.5393
 epoch: 2, train_loss: 0.9195, test_loss: 1.0302, test_f1: 0.5530
 epoch: 3, train_loss: 0.8761, test_loss: 0.9553, test_f1: 0.5871
 epoch: 4, train_loss: 0.8789, test_loss: 1.0695, test_f1: 0.5113
 epoch: 5, train_loss: 0.8502, test_loss: 1.0565, test_f1: 0.5904
 epoch: 6, train_loss: 0.8295, test_loss: 1.1492, test_f1: 0.5248
 epoch: 7, train_loss: 0.8301, test_loss: 1.3981, test_f1: 0.4218
 epoch: 8, train_loss: 0.8486, test_loss: 1.0776, test_f1: 0.5653
 epoch: 9, train_loss: 0.7943, test_loss: 0.9883, test_f1: 0.5810
 epoch: 10, train_loss: 0.8102, test_loss: 2.6674, test_f1: 0.4045
 epoch: 11, train_loss: 0.8007, test_loss: 0.9560, test_f1: 0.5921
 epoch: 12, train_loss: 0.7780, test_loss: 1.0708, test_f1: 0.5297
 epoch: 13, train_loss: 0.7977, test_loss: 1.1175, test_f1: 0.5728
 epoch: 14, train_loss: 0.8228, test_loss: 1.0077, test_f1: 0.5535
 epoch: 15, train_loss: 0.7562, test_loss: 0.9412, test_f1: 0.5982
 epoch: 16, train_loss: 0.7591, test_loss: 1.0296, test_f1: 0.4958
 epoch: 17, train_loss: 0.7590, test_loss: 0.9707, test_f1: 0.5802
 epoch: 18, train_loss: 0.7319, test_loss: 1.0569, test_f1: 0.5669
 epoch: 19, train_loss: 0.7311, test_loss: 0.9329, test_f1: 0.5592
 epoch: 20, train_loss: 0.7428, test_loss: 1.0701, test_f1: 0.5376
 epoch: 21, train_loss: 0.7292, test_loss: 1.0453, test_f1: 0.5570
 epoch: 22, train_loss: 0.7083, test_loss: 1.1410, test_f1: 0.5597
 epoch: 23, train_loss: 0.7257, test_loss: 1.0030, test_f1: 0.5464
 epoch: 24, train_loss: 0.7523, test_loss: 0.9537, test_f1: 0.5818
 epoch: 25, train_loss: 0.7028, test_loss: 1.0055, test_f1: 0.5620
 epoch: 26, train_loss: 0.7158, test_loss: 0.9524, test_f1: 0.6193
 epoch: 27, train_loss: 0.6979, test_loss: 1.2664, test_f1: 0.5628
 epoch: 28, train_loss: 0.6966, test_loss: 1.1366, test_f1: 0.5766
 epoch: 29, train_loss: 0.6845, test_loss: 1.0509, test_f1: 0.5219
 epoch: 30, train_loss: 0.6753, test_loss: 1.2225, test_f1: 0.5044
 epoch: 31, train_loss: 0.7003, test_loss: 1.0690, test_f1: 0.6431
 epoch: 32, train_loss: 0.6931, test_loss: 1.0195, test_f1: 0.6016
 epoch: 33, train_loss: 0.7248, test_loss: 1.0476, test_f1: 0.4811
 epoch: 34, train_loss: 0.6928, test_loss: 1.0011, test_f1: 0.5677
 epoch: 35, train_loss: 0.7034, test_loss: 1.0968, test_f1: 0.5499
 epoch: 36, train_loss: 0.6719, test_loss: 1.1458, test_f1: 0.6205
 epoch: 37, train_loss: 0.6557, test_loss: 1.0156, test_f1: 0.6003
 epoch: 38, train_loss: 0.6378, test_loss: 1.0944, test_f1: 0.5880
 epoch: 39, train_loss: 0.6665, test_loss: 1.1837, test_f1: 0.4255
 epoch: 40, train_loss: 0.6846, test_loss: 1.3616, test_f1: 0.5122
 epoch: 41, train_loss: 0.6592, test_loss: 1.0433, test_f1: 0.5644
 epoch: 42, train_loss: 0.6419, test_loss: 0.9868, test_f1: 0.5874
 epoch: 43, train_loss: 0.6379, test_loss: 1.6583, test_f1: 0.5783
 epoch: 44, train_loss: 0.6368, test_loss: 1.2970, test_f1: 0.5751
 epoch: 45, train_loss: 0.5952, test_loss: 1.3373, test_f1: 0.5918
 epoch: 46, train_loss: 0.6169, test_loss: 1.1386, test_f1: 0.6104
 epoch: 47, train_loss: 0.6046, test_loss: 1.1803, test_f1: 0.5655
 epoch: 48, train_loss: 0.6608, test_loss: 1.1099, test_f1: 0.5620
 epoch: 49, train_loss: 0.6626, test_loss: 0.9713, test_f1: 0.5916
 epoch: 50, train_loss: 0.6576, test_loss: 1.1522, test_f1: 0.5818
 epoch: 51, train_loss: 0.6031, test_loss: 1.1612, test_f1: 0.5394
 epoch: 52, train_loss: 0.5751, test_loss: 1.0616, test_f1: 0.6457
 epoch: 53, train_loss: 0.5784, test_loss: 1.1267, test_f1: 0.5774
 epoch: 54, train_loss: 0.5560, test_loss: 1.2469, test_f1: 0.6302
 epoch: 55, train_loss: 0.5560, test_loss: 1.1044, test_f1: 0.6207
 epoch: 56, train_loss: 0.5404, test_loss: 1.3689, test_f1: 0.6043
 epoch: 57, train_loss: 0.5468, test_loss: 1.2134, test_f1: 0.6276
 epoch: 58, train_loss: 0.5580, test_loss: 1.2563, test_f1: 0.5798
 epoch: 59, train_loss: 0.5429, test_loss: 1.1756, test_f1: 0.6075
 epoch: 60, train_loss: 0.5172, test_loss: 1.1935, test_f1: 0.5983
 epoch: 61, train_loss: 0.5445, test_loss: 1.1406, test_f1: 0.6116
 epoch: 62, train_loss: 0.5121, test_loss: 1.2592, test_f1: 0.6455
 epoch: 63, train_loss: 0.5379, test_loss: 1.2127, test_f1: 0.5683
 epoch: 64, train_loss: 0.5242, test_loss: 1.4418, test_f1: 0.5418
 epoch: 65, train_loss: 0.5047, test_loss: 1.2891, test_f1: 0.5867
 epoch: 66, train_loss: 0.4762, test_loss: 1.7599, test_f1: 0.5319
 epoch: 67, train_loss: 0.5073, test_loss: 1.2153, test_f1: 0.6292
 epoch: 68, train_loss: 0.4890, test_loss: 1.2490, test_f1: 0.5798
 epoch: 69, train_loss: 0.4634, test_loss: 1.4361, test_f1: 0.6148
 epoch: 70, train_loss: 0.4574, test_loss: 1.6775, test_f1: 0.5983
 epoch: 71, train_loss: 0.4956, test_loss: 1.3980, test_f1: 0.5728
 epoch: 72, train_loss: 0.4922, test_loss: 1.4408, test_f1: 0.5852
 epoch: 73, train_loss: 0.4977, test_loss: 1.2907, test_f1: 0.6513
 epoch: 74, train_loss: 0.5043, test_loss: 1.3728, test_f1: 0.6329
 epoch: 75, train_loss: 0.4765, test_loss: 1.4484, test_f1: 0.5424
 epoch: 76, train_loss: 0.4809, test_loss: 1.7014, test_f1: 0.5735
 epoch: 77, train_loss: 0.4842, test_loss: 1.5093, test_f1: 0.5540
 epoch: 78, train_loss: 0.4937, test_loss: 1.4398, test_f1: 0.5714
 epoch: 79, train_loss: 0.4899, test_loss: 1.3555, test_f1: 0.5796
 epoch: 80, train_loss: 0.4843, test_loss: 1.3900, test_f1: 0.6237
 epoch: 81, train_loss: 0.4316, test_loss: 1.4062, test_f1: 0.5768
 epoch: 82, train_loss: 0.4545, test_loss: 1.5807, test_f1: 0.6220
 epoch: 83, train_loss: 0.4567, test_loss: 1.7585, test_f1: 0.6277
 epoch: 84, train_loss: 0.4302, test_loss: 1.5016, test_f1: 0.5953
 epoch: 85, train_loss: 0.4056, test_loss: 1.5757, test_f1: 0.6079
 epoch: 86, train_loss: 0.4424, test_loss: 1.5315, test_f1: 0.5722
 epoch: 87, train_loss: 0.3893, test_loss: 1.6586, test_f1: 0.6023
 epoch: 88, train_loss: 0.4097, test_loss: 1.5564, test_f1: 0.5913
 epoch: 89, train_loss: 0.4424, test_loss: 1.6648, test_f1: 0.5250
 epoch: 90, train_loss: 0.4309, test_loss: 1.4919, test_f1: 0.6114
 epoch: 91, train_loss: 0.4112, test_loss: 1.6771, test_f1: 0.5768
 epoch: 92, train_loss: 0.4179, test_loss: 1.4642, test_f1: 0.6428
 epoch: 93, train_loss: 0.4062, test_loss: 1.4277, test_f1: 0.6201
 epoch: 94, train_loss: 0.4099, test_loss: 1.5414, test_f1: 0.6853
 epoch: 95, train_loss: 0.3731, test_loss: 1.6340, test_f1: 0.6438
 epoch: 96, train_loss: 0.3439, test_loss: 1.9315, test_f1: 0.6025
 epoch: 97, train_loss: 0.3526, test_loss: 2.2351, test_f1: 0.5445
 epoch: 98, train_loss: 0.3996, test_loss: 1.9583, test_f1: 0.5192
 epoch: 99, train_loss: 0.3497, test_loss: 1.7709, test_f1: 0.6200
##################ITERATION #8 ****************************************
 epoch: 0, train_loss: 1.2481, test_loss: 1.4392, test_f1: 0.1984
 epoch: 1, train_loss: 0.9628, test_loss: 1.0951, test_f1: 0.5341
 epoch: 2, train_loss: 0.8952, test_loss: 1.0043, test_f1: 0.5697
 epoch: 3, train_loss: 0.8913, test_loss: 1.0305, test_f1: 0.5469
 epoch: 4, train_loss: 0.8357, test_loss: 1.0478, test_f1: 0.5652
 epoch: 5, train_loss: 0.8507, test_loss: 1.1330, test_f1: 0.4984
 epoch: 6, train_loss: 0.8277, test_loss: 0.9531, test_f1: 0.5674
 epoch: 7, train_loss: 0.7905, test_loss: 0.9850, test_f1: 0.5645
 epoch: 8, train_loss: 0.7935, test_loss: 0.9769, test_f1: 0.5358
 epoch: 9, train_loss: 0.7792, test_loss: 1.0357, test_f1: 0.5608
 epoch: 10, train_loss: 0.7834, test_loss: 1.1715, test_f1: 0.5282
 epoch: 11, train_loss: 0.7538, test_loss: 0.9707, test_f1: 0.6403
 epoch: 12, train_loss: 0.7411, test_loss: 1.2114, test_f1: 0.5567
 epoch: 13, train_loss: 0.7703, test_loss: 1.4406, test_f1: 0.5089
 epoch: 14, train_loss: 0.7323, test_loss: 1.3498, test_f1: 0.4716
 epoch: 15, train_loss: 0.7506, test_loss: 1.1449, test_f1: 0.5995
 epoch: 16, train_loss: 0.7489, test_loss: 1.0056, test_f1: 0.6331
 epoch: 17, train_loss: 0.7274, test_loss: 1.2630, test_f1: 0.5531
 epoch: 18, train_loss: 0.7263, test_loss: 1.0361, test_f1: 0.6094
 epoch: 19, train_loss: 0.7259, test_loss: 1.0412, test_f1: 0.5822
 epoch: 20, train_loss: 0.6942, test_loss: 0.9444, test_f1: 0.5872
 epoch: 21, train_loss: 0.6876, test_loss: 1.1084, test_f1: 0.6160
 epoch: 22, train_loss: 0.6904, test_loss: 1.2607, test_f1: 0.5462
 epoch: 23, train_loss: 0.6697, test_loss: 1.5425, test_f1: 0.5951
 epoch: 24, train_loss: 0.6547, test_loss: 0.9923, test_f1: 0.6419
 epoch: 25, train_loss: 0.6725, test_loss: 1.1348, test_f1: 0.6244
 epoch: 26, train_loss: 0.6500, test_loss: 1.1556, test_f1: 0.6441
 epoch: 27, train_loss: 0.6793, test_loss: 1.2081, test_f1: 0.6089
 epoch: 28, train_loss: 0.6679, test_loss: 1.0439, test_f1: 0.6494
 epoch: 29, train_loss: 0.6376, test_loss: 1.0402, test_f1: 0.6570
 epoch: 30, train_loss: 0.6432, test_loss: 1.2667, test_f1: 0.5646
 epoch: 31, train_loss: 0.6463, test_loss: 1.3644, test_f1: 0.5503
 epoch: 32, train_loss: 0.6730, test_loss: 1.0469, test_f1: 0.5856
 epoch: 33, train_loss: 0.6062, test_loss: 1.0376, test_f1: 0.6721
 epoch: 34, train_loss: 0.5961, test_loss: 1.2354, test_f1: 0.5428
 epoch: 35, train_loss: 0.5763, test_loss: 1.3239, test_f1: 0.6263
 epoch: 36, train_loss: 0.6025, test_loss: 1.2413, test_f1: 0.5424
 epoch: 37, train_loss: 0.5984, test_loss: 1.1443, test_f1: 0.6722
 epoch: 38, train_loss: 0.6066, test_loss: 1.6280, test_f1: 0.5253
 epoch: 39, train_loss: 0.5757, test_loss: 1.2119, test_f1: 0.5722
 epoch: 40, train_loss: 0.5725, test_loss: 1.1120, test_f1: 0.6480
 epoch: 41, train_loss: 0.6076, test_loss: 1.2585, test_f1: 0.6261
 epoch: 42, train_loss: 0.5673, test_loss: 1.1219, test_f1: 0.6492
 epoch: 43, train_loss: 0.5422, test_loss: 1.4200, test_f1: 0.6136
 epoch: 44, train_loss: 0.5782, test_loss: 1.4598, test_f1: 0.6404
 epoch: 45, train_loss: 0.5490, test_loss: 1.4112, test_f1: 0.6371
 epoch: 46, train_loss: 0.5339, test_loss: 1.4048, test_f1: 0.5894
 epoch: 47, train_loss: 0.5654, test_loss: 1.4259, test_f1: 0.5420
 epoch: 48, train_loss: 0.5477, test_loss: 1.1897, test_f1: 0.6055
 epoch: 49, train_loss: 0.5368, test_loss: 1.5548, test_f1: 0.6314
 epoch: 50, train_loss: 0.5515, test_loss: 1.7183, test_f1: 0.5544
 epoch: 51, train_loss: 0.5116, test_loss: 1.2159, test_f1: 0.6647
 epoch: 52, train_loss: 0.4672, test_loss: 1.2870, test_f1: 0.6659
 epoch: 53, train_loss: 0.4276, test_loss: 1.3578, test_f1: 0.6411
 epoch: 54, train_loss: 0.4680, test_loss: 1.2065, test_f1: 0.6682
 epoch: 55, train_loss: 0.4361, test_loss: 1.7389, test_f1: 0.6611
 epoch: 56, train_loss: 0.4227, test_loss: 1.4838, test_f1: 0.6350
 epoch: 57, train_loss: 0.4402, test_loss: 1.4308, test_f1: 0.6765
 epoch: 58, train_loss: 0.4576, test_loss: 1.6294, test_f1: 0.6651
 epoch: 59, train_loss: 0.4111, test_loss: 1.9658, test_f1: 0.5891
 epoch: 60, train_loss: 0.4195, test_loss: 1.8483, test_f1: 0.6390
 epoch: 61, train_loss: 0.4334, test_loss: 1.6657, test_f1: 0.6465
 epoch: 62, train_loss: 0.4104, test_loss: 1.5419, test_f1: 0.6235
 epoch: 63, train_loss: 0.4083, test_loss: 1.7928, test_f1: 0.6458
 epoch: 64, train_loss: 0.3765, test_loss: 1.8948, test_f1: 0.5942
 epoch: 65, train_loss: 0.3684, test_loss: 1.7149, test_f1: 0.6075
 epoch: 66, train_loss: 0.3903, test_loss: 2.4029, test_f1: 0.6190
 epoch: 67, train_loss: 0.3933, test_loss: 1.8086, test_f1: 0.6283
 epoch: 68, train_loss: 0.3969, test_loss: 1.7882, test_f1: 0.6093
 epoch: 69, train_loss: 0.3860, test_loss: 2.2855, test_f1: 0.6080
 epoch: 70, train_loss: 0.3682, test_loss: 1.8648, test_f1: 0.6317
 epoch: 71, train_loss: 0.3846, test_loss: 1.7543, test_f1: 0.6407
 epoch: 72, train_loss: 0.3427, test_loss: 1.7779, test_f1: 0.6045
 epoch: 73, train_loss: 0.3693, test_loss: 1.6047, test_f1: 0.6697
 epoch: 74, train_loss: 0.3606, test_loss: 2.0460, test_f1: 0.6561
 epoch: 75, train_loss: 0.3704, test_loss: 1.7361, test_f1: 0.6527
 epoch: 76, train_loss: 0.3811, test_loss: 2.3307, test_f1: 0.6338
 epoch: 77, train_loss: 0.3484, test_loss: 1.6680, test_f1: 0.6440
 epoch: 78, train_loss: 0.3548, test_loss: 1.7411, test_f1: 0.6387
 epoch: 79, train_loss: 0.3446, test_loss: 1.4954, test_f1: 0.6661
 epoch: 80, train_loss: 0.3381, test_loss: 2.2189, test_f1: 0.5936
 epoch: 81, train_loss: 0.3365, test_loss: 1.5661, test_f1: 0.6695
 epoch: 82, train_loss: 0.3228, test_loss: 2.0843, test_f1: 0.6139
 epoch: 83, train_loss: 0.3154, test_loss: 2.5368, test_f1: 0.6004
 epoch: 84, train_loss: 0.3507, test_loss: 2.2441, test_f1: 0.6235
 epoch: 85, train_loss: 0.3637, test_loss: 2.2018, test_f1: 0.6313
 epoch: 86, train_loss: 0.3502, test_loss: 1.9241, test_f1: 0.6162
 epoch: 87, train_loss: 0.3280, test_loss: 2.0542, test_f1: 0.6208
 epoch: 88, train_loss: 0.3074, test_loss: 2.0668, test_f1: 0.6166
 epoch: 89, train_loss: 0.3546, test_loss: 2.2317, test_f1: 0.6222
 epoch: 90, train_loss: 0.3495, test_loss: 1.9020, test_f1: 0.6042
 epoch: 91, train_loss: 0.3286, test_loss: 1.7512, test_f1: 0.6050
 epoch: 92, train_loss: 0.2786, test_loss: 2.5995, test_f1: 0.5821
 epoch: 93, train_loss: 0.2769, test_loss: 2.3986, test_f1: 0.5981
 epoch: 94, train_loss: 0.3152, test_loss: 2.2956, test_f1: 0.5852
 epoch: 95, train_loss: 0.3093, test_loss: 1.8156, test_f1: 0.6424
 epoch: 96, train_loss: 0.3193, test_loss: 1.9297, test_f1: 0.6550
 epoch: 97, train_loss: 0.2776, test_loss: 2.2921, test_f1: 0.6292
 epoch: 98, train_loss: 0.3043, test_loss: 2.1811, test_f1: 0.6294
 epoch: 99, train_loss: 0.3051, test_loss: 2.1353, test_f1: 0.6602
##################ITERATION #9 ****************************************
 epoch: 0, train_loss: 1.3116, test_loss: 1.3652, test_f1: 0.2936
 epoch: 1, train_loss: 1.0457, test_loss: 1.1031, test_f1: 0.4884
 epoch: 2, train_loss: 0.9729, test_loss: 1.1419, test_f1: 0.4378
 epoch: 3, train_loss: 0.9166, test_loss: 1.0245, test_f1: 0.5596
 epoch: 4, train_loss: 0.8872, test_loss: 1.1552, test_f1: 0.4698
 epoch: 5, train_loss: 0.8617, test_loss: 0.9951, test_f1: 0.5691
 epoch: 6, train_loss: 0.8339, test_loss: 1.0128, test_f1: 0.5529
 epoch: 7, train_loss: 0.8185, test_loss: 1.1096, test_f1: 0.5530
 epoch: 8, train_loss: 0.8082, test_loss: 1.2731, test_f1: 0.4961
 epoch: 9, train_loss: 0.8704, test_loss: 1.1542, test_f1: 0.5242
 epoch: 10, train_loss: 0.8118, test_loss: 1.0086, test_f1: 0.5637
 epoch: 11, train_loss: 0.7812, test_loss: 2.0886, test_f1: 0.2179
 epoch: 12, train_loss: 0.8025, test_loss: 0.9634, test_f1: 0.5719
 epoch: 13, train_loss: 0.7928, test_loss: 1.0329, test_f1: 0.5399
 epoch: 14, train_loss: 0.7605, test_loss: 1.1159, test_f1: 0.5151
 epoch: 15, train_loss: 0.7689, test_loss: 0.9787, test_f1: 0.6154
 epoch: 16, train_loss: 0.7428, test_loss: 0.9882, test_f1: 0.5820
 epoch: 17, train_loss: 0.7129, test_loss: 1.0753, test_f1: 0.5699
 epoch: 18, train_loss: 0.7279, test_loss: 1.8450, test_f1: 0.4280
 epoch: 19, train_loss: 0.7211, test_loss: 1.0252, test_f1: 0.5628
 epoch: 20, train_loss: 0.7084, test_loss: 1.1328, test_f1: 0.5573
 epoch: 21, train_loss: 0.7112, test_loss: 1.0181, test_f1: 0.5825
 epoch: 22, train_loss: 0.6907, test_loss: 1.5065, test_f1: 0.5197
 epoch: 23, train_loss: 0.7368, test_loss: 1.1028, test_f1: 0.5269
 epoch: 24, train_loss: 0.7062, test_loss: 1.5708, test_f1: 0.4737
 epoch: 25, train_loss: 0.7231, test_loss: 1.0149, test_f1: 0.5999
 epoch: 26, train_loss: 0.6789, test_loss: 1.0988, test_f1: 0.6053
 epoch: 27, train_loss: 0.6720, test_loss: 1.4813, test_f1: 0.4937
 epoch: 28, train_loss: 0.6461, test_loss: 1.1092, test_f1: 0.5711
 epoch: 29, train_loss: 0.6718, test_loss: 1.1938, test_f1: 0.5280
 epoch: 30, train_loss: 0.6617, test_loss: 1.2582, test_f1: 0.5216
 epoch: 31, train_loss: 0.6401, test_loss: 1.6051, test_f1: 0.4383
 epoch: 32, train_loss: 0.6493, test_loss: 1.1158, test_f1: 0.6407
 epoch: 33, train_loss: 0.6404, test_loss: 1.0021, test_f1: 0.6218
 epoch: 34, train_loss: 0.6647, test_loss: 1.2221, test_f1: 0.6215
 epoch: 35, train_loss: 0.6554, test_loss: 1.0822, test_f1: 0.6185
 epoch: 36, train_loss: 0.6407, test_loss: 1.0376, test_f1: 0.5917
 epoch: 37, train_loss: 0.6512, test_loss: 1.0620, test_f1: 0.6227
 epoch: 38, train_loss: 0.6412, test_loss: 1.1684, test_f1: 0.5461
 epoch: 39, train_loss: 0.6655, test_loss: 1.0837, test_f1: 0.5831
 epoch: 40, train_loss: 0.6814, test_loss: 1.0808, test_f1: 0.6267
 epoch: 41, train_loss: 0.6535, test_loss: 1.6467, test_f1: 0.4000
 epoch: 42, train_loss: 0.6253, test_loss: 1.0306, test_f1: 0.6155
 epoch: 43, train_loss: 0.5956, test_loss: 1.3039, test_f1: 0.6258
 epoch: 44, train_loss: 0.6552, test_loss: 1.2047, test_f1: 0.4902
 epoch: 45, train_loss: 0.6867, test_loss: 1.1833, test_f1: 0.5015
 epoch: 46, train_loss: 0.6661, test_loss: 1.2402, test_f1: 0.4566
 epoch: 47, train_loss: 0.6559, test_loss: 1.0579, test_f1: 0.5751
 epoch: 48, train_loss: 0.5929, test_loss: 1.1073, test_f1: 0.5979
 epoch: 49, train_loss: 0.6083, test_loss: 1.1285, test_f1: 0.5986
 epoch: 50, train_loss: 0.5818, test_loss: 1.2269, test_f1: 0.5802
 epoch: 51, train_loss: 0.5751, test_loss: 1.2981, test_f1: 0.5116
 epoch: 52, train_loss: 0.5274, test_loss: 1.2747, test_f1: 0.5755
 epoch: 53, train_loss: 0.5216, test_loss: 1.1928, test_f1: 0.5970
 epoch: 54, train_loss: 0.5148, test_loss: 1.2644, test_f1: 0.6005
 epoch: 55, train_loss: 0.5232, test_loss: 1.2175, test_f1: 0.5868
 epoch: 56, train_loss: 0.4996, test_loss: 1.3489, test_f1: 0.6251
 epoch: 57, train_loss: 0.4946, test_loss: 1.2675, test_f1: 0.6297
 epoch: 58, train_loss: 0.4938, test_loss: 1.4103, test_f1: 0.6298
 epoch: 59, train_loss: 0.4864, test_loss: 1.2411, test_f1: 0.6158
 epoch: 60, train_loss: 0.4741, test_loss: 1.2600, test_f1: 0.6131
 epoch: 61, train_loss: 0.4729, test_loss: 1.4786, test_f1: 0.6119
 epoch: 62, train_loss: 0.4658, test_loss: 1.3396, test_f1: 0.6134
 epoch: 63, train_loss: 0.4691, test_loss: 1.5926, test_f1: 0.5330
 epoch: 64, train_loss: 0.4955, test_loss: 1.3822, test_f1: 0.6446
 epoch: 65, train_loss: 0.4823, test_loss: 1.4037, test_f1: 0.6014
 epoch: 66, train_loss: 0.4708, test_loss: 1.3682, test_f1: 0.5908
 epoch: 67, train_loss: 0.4870, test_loss: 1.4086, test_f1: 0.6303
 epoch: 68, train_loss: 0.4562, test_loss: 1.3134, test_f1: 0.6441
 epoch: 69, train_loss: 0.4484, test_loss: 1.6587, test_f1: 0.5736
 epoch: 70, train_loss: 0.4620, test_loss: 1.5986, test_f1: 0.5776
 epoch: 71, train_loss: 0.4442, test_loss: 1.4695, test_f1: 0.5872
 epoch: 72, train_loss: 0.4516, test_loss: 1.4341, test_f1: 0.6149
 epoch: 73, train_loss: 0.4884, test_loss: 1.5828, test_f1: 0.6118
 epoch: 74, train_loss: 0.4582, test_loss: 1.3832, test_f1: 0.6035
 epoch: 75, train_loss: 0.4433, test_loss: 1.4068, test_f1: 0.5933
 epoch: 76, train_loss: 0.4096, test_loss: 1.5002, test_f1: 0.6003
 epoch: 77, train_loss: 0.4111, test_loss: 1.7241, test_f1: 0.5851
 epoch: 78, train_loss: 0.4470, test_loss: 1.6328, test_f1: 0.5746
 epoch: 79, train_loss: 0.4506, test_loss: 1.3652, test_f1: 0.6436
 epoch: 80, train_loss: 0.4155, test_loss: 1.4260, test_f1: 0.5992
 epoch: 81, train_loss: 0.3968, test_loss: 1.5478, test_f1: 0.5910
 epoch: 82, train_loss: 0.3899, test_loss: 1.5603, test_f1: 0.6195
 epoch: 83, train_loss: 0.4053, test_loss: 1.5656, test_f1: 0.6008
 epoch: 84, train_loss: 0.3965, test_loss: 1.6601, test_f1: 0.6008
 epoch: 85, train_loss: 0.3875, test_loss: 1.6792, test_f1: 0.5766
 epoch: 86, train_loss: 0.3859, test_loss: 1.8788, test_f1: 0.5702
 epoch: 87, train_loss: 0.3993, test_loss: 1.4562, test_f1: 0.6612
 epoch: 88, train_loss: 0.4193, test_loss: 1.6130, test_f1: 0.6009
 epoch: 89, train_loss: 0.3710, test_loss: 1.6719, test_f1: 0.6376
 epoch: 90, train_loss: 0.3703, test_loss: 1.8165, test_f1: 0.5990
 epoch: 91, train_loss: 0.4000, test_loss: 1.5797, test_f1: 0.6490
 epoch: 92, train_loss: 0.3719, test_loss: 1.7077, test_f1: 0.6358
 epoch: 93, train_loss: 0.3654, test_loss: 1.6669, test_f1: 0.6419
 epoch: 94, train_loss: 0.3123, test_loss: 1.6930, test_f1: 0.6141
 epoch: 95, train_loss: 0.3644, test_loss: 1.7028, test_f1: 0.6087
 epoch: 96, train_loss: 0.3636, test_loss: 1.9794, test_f1: 0.5675
 epoch: 97, train_loss: 0.3591, test_loss: 1.7683, test_f1: 0.6210
 epoch: 98, train_loss: 0.3501, test_loss: 1.7884, test_f1: 0.6492
 epoch: 99, train_loss: 0.3341, test_loss: 2.0283, test_f1: 0.6028

Training completed in 749.08 seconds
Best F1: 0.7229 at epoch 99
Mean F1 across iterations: 0.6813  0.0165
========================FINAL RESULTS================================
FEGIN weighted F1: 0.7229  0.0165
python main.py --data ltspice_demos --representation component_pin --model FEGIN --layers 6 --hiddens 64 --batch_size 64 --lr 0.01 --emb_size 250 --epochs 100 --save_appendix component_pin_L6_H64_BS64_LR0.01_E250 --no_val
-----



STDERR:
  File "main.py", line 370, in <module>
    main()
  File "main.py", line 254, in main
    dataset = dataset_class(
  File "/home/philip/projects/ltspice_examples_code_repo/Circuit-Completion-Using-GNNs/component_classification_with_link_prediction_head/evaluation/FEGIN/kernel/circuit_datasets.py", line 15, in __init__
    self.data, self.slices = torch.load(self.processed_paths[0])
  File "/home/philip/.local/lib/python3.8/site-packages/torch/serialization.py", line 1040, in load
    warnings.warn(
  File "/usr/lib/python3.8/warnings.py", line 109, in _showwarnmsg
    sw(msg.message, msg.category, msg.filename, msg.lineno,
  File "main.py", line 47, in warn_with_traceback
    traceback.print_stack(file=log)
/home/philip/projects/ltspice_examples_code_repo/Circuit-Completion-Using-GNNs/component_classification_with_link_prediction_head/evaluation/FEGIN/kernel/circuit_datasets.py:15: FutureWarning: You are using `torch.load` with `weights_only=False` (the current default value), which uses the default pickle module implicitly. It is possible to construct malicious pickle data which will execute arbitrary code during unpickling (See https://github.com/pytorch/pytorch/blob/main/SECURITY.md#untrusted-models for more details). In a future release, the default value for `weights_only` will be flipped to `True`. This limits the functions that could be executed during unpickling. Arbitrary objects will no longer be allowed to be loaded via this mode unless they are explicitly allowlisted by the user via `torch.serialization.add_safe_globals`. We recommend you start setting `weights_only=True` for any use case where you don't have full control of the loaded file. Please open an issue on GitHub for any issues related to this experimental feature.
  self.data, self.slices = torch.load(self.processed_paths[0])
