STDOUT:
Results will be saved in /home/philip/projects/ltspice_examples_code_repo/Circuit-Completion-Using-GNNs/component_classification_with_link_prediction_head/evaluation/FEGIN/results/model_FEGIN_dataset_ltspice_examples
Command line input: python main.py --data ltspice_examples --representation component_pin_net --model FEGIN --layers 5 --hiddens 128 --batch_size 256 --lr 0.01 --emb_size 512 --epochs 100 --save_appendix component_pin_net_L5_H128_BS256_LR0.01_E512 --no_val
 is saved.
-----
ltspice_examples - FEGIN
Using 5 layers, 128 hidden units, h = 2
Loading component_pin_net representation dataset
Loading component_pin_net representation data...
Loaded 4404 examples (component_pin_net)
saving path: data/processed/ltspice_examples_component_pin_net_processed.pt
ENTERED
Training FEGIN on component_pin_net representation
Train: 3558, Test: 846
##################ITERATION #0 ****************************************
 epoch: 0, train_loss: 1.1644, test_loss: 1.5414, test_f1: 0.2533
 epoch: 1, train_loss: 0.9989, test_loss: 1.0483, test_f1: 0.4185
 epoch: 2, train_loss: 0.9710, test_loss: 0.9153, test_f1: 0.4991
 epoch: 3, train_loss: 0.9334, test_loss: 0.9207, test_f1: 0.4986
 epoch: 4, train_loss: 0.9092, test_loss: 1.0257, test_f1: 0.5045
 epoch: 5, train_loss: 0.8871, test_loss: 1.0559, test_f1: 0.4652
 epoch: 6, train_loss: 0.8517, test_loss: 1.0323, test_f1: 0.5486
 epoch: 7, train_loss: 0.8248, test_loss: 0.9480, test_f1: 0.5210
 epoch: 8, train_loss: 0.8254, test_loss: 0.9702, test_f1: 0.5809
 epoch: 9, train_loss: 0.7995, test_loss: 0.9561, test_f1: 0.5148
 epoch: 10, train_loss: 0.7764, test_loss: 0.8537, test_f1: 0.5632
 epoch: 11, train_loss: 0.7825, test_loss: 0.9770, test_f1: 0.5638
 epoch: 12, train_loss: 0.7371, test_loss: 1.0804, test_f1: 0.5313
 epoch: 13, train_loss: 0.7294, test_loss: 0.8223, test_f1: 0.6358
 epoch: 14, train_loss: 0.7045, test_loss: 1.1709, test_f1: 0.5512
 epoch: 15, train_loss: 0.6880, test_loss: 0.8316, test_f1: 0.5658
 epoch: 16, train_loss: 0.6926, test_loss: 0.9464, test_f1: 0.6090
 epoch: 17, train_loss: 0.6921, test_loss: 0.9236, test_f1: 0.5843
 epoch: 18, train_loss: 0.6487, test_loss: 1.0768, test_f1: 0.5706
 epoch: 19, train_loss: 0.6567, test_loss: 1.0432, test_f1: 0.6250
 epoch: 20, train_loss: 0.6203, test_loss: 1.0283, test_f1: 0.6247
 epoch: 21, train_loss: 0.6214, test_loss: 0.7692, test_f1: 0.6534
 epoch: 22, train_loss: 0.6072, test_loss: 0.9267, test_f1: 0.6310
 epoch: 23, train_loss: 0.5961, test_loss: 0.8671, test_f1: 0.6492
 epoch: 24, train_loss: 0.5702, test_loss: 1.0490, test_f1: 0.6322
 epoch: 25, train_loss: 0.5395, test_loss: 1.5234, test_f1: 0.5824
 epoch: 26, train_loss: 0.5718, test_loss: 1.1720, test_f1: 0.6328
 epoch: 27, train_loss: 0.5472, test_loss: 1.0663, test_f1: 0.6116
 epoch: 28, train_loss: 0.5386, test_loss: 1.1420, test_f1: 0.6621
 epoch: 29, train_loss: 0.5518, test_loss: 0.9980, test_f1: 0.5718
 epoch: 30, train_loss: 0.5612, test_loss: 1.0063, test_f1: 0.6198
 epoch: 31, train_loss: 0.5294, test_loss: 1.1747, test_f1: 0.6322
 epoch: 32, train_loss: 0.5442, test_loss: 1.4200, test_f1: 0.5891
 epoch: 33, train_loss: 0.5092, test_loss: 1.2617, test_f1: 0.6113
 epoch: 34, train_loss: 0.4936, test_loss: 1.2212, test_f1: 0.5726
 epoch: 35, train_loss: 0.4837, test_loss: 0.9592, test_f1: 0.6455
 epoch: 36, train_loss: 0.4588, test_loss: 1.1127, test_f1: 0.6374
 epoch: 37, train_loss: 0.4819, test_loss: 1.1073, test_f1: 0.6463
 epoch: 38, train_loss: 0.4974, test_loss: 1.2140, test_f1: 0.6671
 epoch: 39, train_loss: 0.4497, test_loss: 1.3257, test_f1: 0.6493
 epoch: 40, train_loss: 0.4384, test_loss: 1.1902, test_f1: 0.6439
 epoch: 41, train_loss: 0.4468, test_loss: 0.9788, test_f1: 0.6271
 epoch: 42, train_loss: 0.4470, test_loss: 1.1949, test_f1: 0.6270
 epoch: 43, train_loss: 0.4161, test_loss: 1.8203, test_f1: 0.6008
 epoch: 44, train_loss: 0.4464, test_loss: 1.1154, test_f1: 0.6213
 epoch: 45, train_loss: 0.4271, test_loss: 1.3626, test_f1: 0.6369
 epoch: 46, train_loss: 0.3738, test_loss: 1.5424, test_f1: 0.6535
 epoch: 47, train_loss: 0.3780, test_loss: 1.1796, test_f1: 0.6140
 epoch: 48, train_loss: 0.4311, test_loss: 1.0882, test_f1: 0.6365
 epoch: 49, train_loss: 0.3942, test_loss: 1.4242, test_f1: 0.6529
 epoch: 50, train_loss: 0.4057, test_loss: 1.4890, test_f1: 0.6356
 epoch: 51, train_loss: 0.3698, test_loss: 1.3335, test_f1: 0.6762
 epoch: 52, train_loss: 0.3102, test_loss: 1.3984, test_f1: 0.6896
 epoch: 53, train_loss: 0.2924, test_loss: 1.3537, test_f1: 0.6509
 epoch: 54, train_loss: 0.2856, test_loss: 1.4633, test_f1: 0.6729
 epoch: 55, train_loss: 0.2984, test_loss: 1.5046, test_f1: 0.6973
 epoch: 56, train_loss: 0.2680, test_loss: 1.4872, test_f1: 0.6846
 epoch: 57, train_loss: 0.2387, test_loss: 1.6456, test_f1: 0.7087
 epoch: 58, train_loss: 0.2621, test_loss: 1.4189, test_f1: 0.6872
 epoch: 59, train_loss: 0.2240, test_loss: 1.5071, test_f1: 0.7047
 epoch: 60, train_loss: 0.2374, test_loss: 1.7170, test_f1: 0.6808
 epoch: 61, train_loss: 0.2531, test_loss: 1.5881, test_f1: 0.7078
 epoch: 62, train_loss: 0.2685, test_loss: 1.6539, test_f1: 0.6713
 epoch: 63, train_loss: 0.2357, test_loss: 1.7570, test_f1: 0.6818
 epoch: 64, train_loss: 0.2462, test_loss: 1.6053, test_f1: 0.7064
 epoch: 65, train_loss: 0.2335, test_loss: 1.7030, test_f1: 0.6601
 epoch: 66, train_loss: 0.2432, test_loss: 1.6310, test_f1: 0.6903
 epoch: 67, train_loss: 0.2209, test_loss: 1.4981, test_f1: 0.6843
 epoch: 68, train_loss: 0.2097, test_loss: 1.7579, test_f1: 0.6825
 epoch: 69, train_loss: 0.2096, test_loss: 1.8641, test_f1: 0.6864
 epoch: 70, train_loss: 0.2363, test_loss: 1.6819, test_f1: 0.6622
 epoch: 71, train_loss: 0.2204, test_loss: 1.8310, test_f1: 0.6474
 epoch: 72, train_loss: 0.2266, test_loss: 1.7011, test_f1: 0.6885
 epoch: 73, train_loss: 0.1919, test_loss: 1.7052, test_f1: 0.6918
 epoch: 74, train_loss: 0.1909, test_loss: 1.8924, test_f1: 0.6782
 epoch: 75, train_loss: 0.1859, test_loss: 1.8263, test_f1: 0.6784
 epoch: 76, train_loss: 0.2134, test_loss: 1.9536, test_f1: 0.6911
 epoch: 77, train_loss: 0.2160, test_loss: 1.8760, test_f1: 0.6694
 epoch: 78, train_loss: 0.2092, test_loss: 2.0183, test_f1: 0.6545
 epoch: 79, train_loss: 0.1893, test_loss: 1.8235, test_f1: 0.6623
 epoch: 80, train_loss: 0.1895, test_loss: 1.7607, test_f1: 0.6879
 epoch: 81, train_loss: 0.1689, test_loss: 1.8937, test_f1: 0.6818
 epoch: 82, train_loss: 0.1658, test_loss: 2.0778, test_f1: 0.6958
 epoch: 83, train_loss: 0.1711, test_loss: 2.0260, test_f1: 0.6606
 epoch: 84, train_loss: 0.1863, test_loss: 1.8123, test_f1: 0.6771
 epoch: 85, train_loss: 0.1883, test_loss: 1.8691, test_f1: 0.6731
 epoch: 86, train_loss: 0.1941, test_loss: 1.7861, test_f1: 0.6745
 epoch: 87, train_loss: 0.1913, test_loss: 2.0334, test_f1: 0.6852
 epoch: 88, train_loss: 0.1902, test_loss: 1.8209, test_f1: 0.6908
 epoch: 89, train_loss: 0.1868, test_loss: 1.9981, test_f1: 0.6869
 epoch: 90, train_loss: 0.1819, test_loss: 1.9165, test_f1: 0.7053
 epoch: 91, train_loss: 0.2019, test_loss: 1.8655, test_f1: 0.6582
 epoch: 92, train_loss: 0.1612, test_loss: 2.0408, test_f1: 0.6868
 epoch: 93, train_loss: 0.1549, test_loss: 2.0607, test_f1: 0.6910
 epoch: 94, train_loss: 0.1511, test_loss: 2.1999, test_f1: 0.6744
 epoch: 95, train_loss: 0.1625, test_loss: 2.1667, test_f1: 0.6710
 epoch: 96, train_loss: 0.1756, test_loss: 2.2267, test_f1: 0.6757
 epoch: 97, train_loss: 0.2051, test_loss: 2.1021, test_f1: 0.6421
 epoch: 98, train_loss: 0.2079, test_loss: 2.1836, test_f1: 0.6945
 epoch: 99, train_loss: 0.1799, test_loss: 2.0493, test_f1: 0.6870
##################ITERATION #1 ****************************************
 epoch: 0, train_loss: 1.4064, test_loss: 1.2436, test_f1: 0.3195
 epoch: 1, train_loss: 1.0327, test_loss: 1.1099, test_f1: 0.4143
 epoch: 2, train_loss: 0.9743, test_loss: 1.0058, test_f1: 0.4686
 epoch: 3, train_loss: 0.9526, test_loss: 0.9607, test_f1: 0.4592
 epoch: 4, train_loss: 0.9346, test_loss: 0.9459, test_f1: 0.4674
 epoch: 5, train_loss: 0.9229, test_loss: 1.0678, test_f1: 0.4788
 epoch: 6, train_loss: 0.9012, test_loss: 0.9357, test_f1: 0.5436
 epoch: 7, train_loss: 0.8857, test_loss: 0.9016, test_f1: 0.5137
 epoch: 8, train_loss: 0.8590, test_loss: 0.9326, test_f1: 0.5288
 epoch: 9, train_loss: 0.8437, test_loss: 0.9929, test_f1: 0.5135
 epoch: 10, train_loss: 0.8262, test_loss: 0.8855, test_f1: 0.5549
 epoch: 11, train_loss: 0.8281, test_loss: 1.0512, test_f1: 0.4735
 epoch: 12, train_loss: 0.8171, test_loss: 0.8485, test_f1: 0.5852
 epoch: 13, train_loss: 0.7844, test_loss: 1.0027, test_f1: 0.5463
 epoch: 14, train_loss: 0.7682, test_loss: 0.8764, test_f1: 0.6060
 epoch: 15, train_loss: 0.7395, test_loss: 0.8659, test_f1: 0.6117
 epoch: 16, train_loss: 0.7304, test_loss: 0.8118, test_f1: 0.6130
 epoch: 17, train_loss: 0.7027, test_loss: 0.7819, test_f1: 0.6536
 epoch: 18, train_loss: 0.7033, test_loss: 0.8805, test_f1: 0.6241
 epoch: 19, train_loss: 0.6785, test_loss: 1.0364, test_f1: 0.6146
 epoch: 20, train_loss: 0.6723, test_loss: 0.9404, test_f1: 0.6224
 epoch: 21, train_loss: 0.6879, test_loss: 1.0928, test_f1: 0.5882
 epoch: 22, train_loss: 0.6641, test_loss: 0.8785, test_f1: 0.6004
 epoch: 23, train_loss: 0.6422, test_loss: 1.4326, test_f1: 0.5121
 epoch: 24, train_loss: 0.6570, test_loss: 0.9987, test_f1: 0.6150
 epoch: 25, train_loss: 0.6581, test_loss: 0.8708, test_f1: 0.6192
 epoch: 26, train_loss: 0.6187, test_loss: 1.3948, test_f1: 0.5862
 epoch: 27, train_loss: 0.6053, test_loss: 0.9138, test_f1: 0.6318
 epoch: 28, train_loss: 0.6037, test_loss: 1.0016, test_f1: 0.6328
 epoch: 29, train_loss: 0.5921, test_loss: 1.0553, test_f1: 0.6204
 epoch: 30, train_loss: 0.6112, test_loss: 1.1448, test_f1: 0.6383
 epoch: 31, train_loss: 0.6012, test_loss: 1.1536, test_f1: 0.6197
 epoch: 32, train_loss: 0.5882, test_loss: 0.9356, test_f1: 0.6417
 epoch: 33, train_loss: 0.5688, test_loss: 1.2611, test_f1: 0.6162
 epoch: 34, train_loss: 0.5477, test_loss: 1.0388, test_f1: 0.6115
 epoch: 35, train_loss: 0.5623, test_loss: 1.0047, test_f1: 0.6238
 epoch: 36, train_loss: 0.5497, test_loss: 0.9520, test_f1: 0.6495
 epoch: 37, train_loss: 0.5388, test_loss: 0.9999, test_f1: 0.6565
 epoch: 38, train_loss: 0.5297, test_loss: 1.1161, test_f1: 0.6484
 epoch: 39, train_loss: 0.5315, test_loss: 1.1949, test_f1: 0.6216
 epoch: 40, train_loss: 0.5266, test_loss: 0.9706, test_f1: 0.6752
 epoch: 41, train_loss: 0.5144, test_loss: 1.2612, test_f1: 0.5596
 epoch: 42, train_loss: 0.5289, test_loss: 1.4838, test_f1: 0.5861
 epoch: 43, train_loss: 0.5007, test_loss: 1.2760, test_f1: 0.6236
 epoch: 44, train_loss: 0.4635, test_loss: 1.2592, test_f1: 0.6635
 epoch: 45, train_loss: 0.4660, test_loss: 1.5703, test_f1: 0.6189
 epoch: 46, train_loss: 0.4682, test_loss: 1.3221, test_f1: 0.6240
 epoch: 47, train_loss: 0.4619, test_loss: 1.3377, test_f1: 0.6419
 epoch: 48, train_loss: 0.4304, test_loss: 1.3704, test_f1: 0.6154
 epoch: 49, train_loss: 0.4780, test_loss: 1.7424, test_f1: 0.5826
 epoch: 50, train_loss: 0.4712, test_loss: 1.2902, test_f1: 0.6378
 epoch: 51, train_loss: 0.4108, test_loss: 1.2691, test_f1: 0.6297
 epoch: 52, train_loss: 0.3822, test_loss: 1.4582, test_f1: 0.6366
 epoch: 53, train_loss: 0.3541, test_loss: 1.4667, test_f1: 0.6382
 epoch: 54, train_loss: 0.3623, test_loss: 1.3578, test_f1: 0.6420
 epoch: 55, train_loss: 0.3399, test_loss: 1.5309, test_f1: 0.6469
 epoch: 56, train_loss: 0.3246, test_loss: 1.4144, test_f1: 0.6504
 epoch: 57, train_loss: 0.3273, test_loss: 1.4848, test_f1: 0.6402
 epoch: 58, train_loss: 0.3444, test_loss: 1.4172, test_f1: 0.6698
 epoch: 59, train_loss: 0.3232, test_loss: 1.7714, test_f1: 0.6566
 epoch: 60, train_loss: 0.3200, test_loss: 1.4393, test_f1: 0.6668
 epoch: 61, train_loss: 0.3392, test_loss: 1.3698, test_f1: 0.6693
 epoch: 62, train_loss: 0.2894, test_loss: 1.6200, test_f1: 0.6691
 epoch: 63, train_loss: 0.2873, test_loss: 1.5102, test_f1: 0.6567
 epoch: 64, train_loss: 0.2855, test_loss: 1.4410, test_f1: 0.6299
 epoch: 65, train_loss: 0.2872, test_loss: 1.5135, test_f1: 0.6550
 epoch: 66, train_loss: 0.2875, test_loss: 1.7009, test_f1: 0.6506
 epoch: 67, train_loss: 0.3012, test_loss: 1.5315, test_f1: 0.6550
 epoch: 68, train_loss: 0.3060, test_loss: 1.5431, test_f1: 0.6718
 epoch: 69, train_loss: 0.2840, test_loss: 1.6480, test_f1: 0.6343
 epoch: 70, train_loss: 0.2813, test_loss: 1.5590, test_f1: 0.6512
 epoch: 71, train_loss: 0.2589, test_loss: 1.7168, test_f1: 0.6678
 epoch: 72, train_loss: 0.2647, test_loss: 1.6738, test_f1: 0.6472
 epoch: 73, train_loss: 0.2693, test_loss: 1.6930, test_f1: 0.6568
 epoch: 74, train_loss: 0.2952, test_loss: 1.4739, test_f1: 0.6581
 epoch: 75, train_loss: 0.2802, test_loss: 1.7276, test_f1: 0.6380
 epoch: 76, train_loss: 0.2757, test_loss: 1.7824, test_f1: 0.6432
 epoch: 77, train_loss: 0.2731, test_loss: 1.6225, test_f1: 0.6682
 epoch: 78, train_loss: 0.2373, test_loss: 1.9107, test_f1: 0.6420
 epoch: 79, train_loss: 0.2412, test_loss: 1.5618, test_f1: 0.6462
 epoch: 80, train_loss: 0.2618, test_loss: 1.7301, test_f1: 0.6571
 epoch: 81, train_loss: 0.2387, test_loss: 1.6779, test_f1: 0.6725
 epoch: 82, train_loss: 0.2293, test_loss: 1.6941, test_f1: 0.6558
 epoch: 83, train_loss: 0.2243, test_loss: 2.0030, test_f1: 0.6513
 epoch: 84, train_loss: 0.2455, test_loss: 2.0658, test_f1: 0.6551
 epoch: 85, train_loss: 0.2345, test_loss: 1.8358, test_f1: 0.6593
 epoch: 86, train_loss: 0.2464, test_loss: 2.1026, test_f1: 0.6276
 epoch: 87, train_loss: 0.2714, test_loss: 1.8640, test_f1: 0.6382
 epoch: 88, train_loss: 0.2727, test_loss: 1.6577, test_f1: 0.6300
 epoch: 89, train_loss: 0.2623, test_loss: 1.9213, test_f1: 0.6257
 epoch: 90, train_loss: 0.2491, test_loss: 1.9052, test_f1: 0.6514
 epoch: 91, train_loss: 0.2194, test_loss: 1.7679, test_f1: 0.6307
 epoch: 92, train_loss: 0.2403, test_loss: 1.9588, test_f1: 0.6723
 epoch: 93, train_loss: 0.2530, test_loss: 1.9469, test_f1: 0.6676
 epoch: 94, train_loss: 0.2396, test_loss: 2.1448, test_f1: 0.6543
 epoch: 95, train_loss: 0.2186, test_loss: 1.7379, test_f1: 0.6654
 epoch: 96, train_loss: 0.2063, test_loss: 1.9146, test_f1: 0.6645
 epoch: 97, train_loss: 0.2152, test_loss: 2.0413, test_f1: 0.6708
 epoch: 98, train_loss: 0.2362, test_loss: 1.9463, test_f1: 0.6649
 epoch: 99, train_loss: 0.2039, test_loss: 2.1161, test_f1: 0.6379
##################ITERATION #2 ****************************************
 epoch: 0, train_loss: 1.2853, test_loss: 2.0394, test_f1: 0.3150
 epoch: 1, train_loss: 1.0150, test_loss: 1.2234, test_f1: 0.3464
 epoch: 2, train_loss: 0.9523, test_loss: 1.0198, test_f1: 0.5024
 epoch: 3, train_loss: 0.9109, test_loss: 1.0458, test_f1: 0.4640
 epoch: 4, train_loss: 0.8947, test_loss: 0.9556, test_f1: 0.4926
 epoch: 5, train_loss: 0.8545, test_loss: 0.9910, test_f1: 0.5531
 epoch: 6, train_loss: 0.8428, test_loss: 1.0492, test_f1: 0.5101
 epoch: 7, train_loss: 0.8291, test_loss: 1.0723, test_f1: 0.5401
 epoch: 8, train_loss: 0.8159, test_loss: 1.2961, test_f1: 0.5153
 epoch: 9, train_loss: 0.7864, test_loss: 0.9454, test_f1: 0.5927
 epoch: 10, train_loss: 0.7766, test_loss: 1.0572, test_f1: 0.4952
 epoch: 11, train_loss: 0.7755, test_loss: 0.9397, test_f1: 0.5947
 epoch: 12, train_loss: 0.7334, test_loss: 0.9655, test_f1: 0.5804
 epoch: 13, train_loss: 0.7370, test_loss: 0.9024, test_f1: 0.5506
 epoch: 14, train_loss: 0.7467, test_loss: 0.8098, test_f1: 0.5880
 epoch: 15, train_loss: 0.7118, test_loss: 0.8710, test_f1: 0.5967
 epoch: 16, train_loss: 0.6900, test_loss: 0.9487, test_f1: 0.5786
 epoch: 17, train_loss: 0.6865, test_loss: 0.8612, test_f1: 0.6339
 epoch: 18, train_loss: 0.6715, test_loss: 0.9205, test_f1: 0.5887
 epoch: 19, train_loss: 0.6681, test_loss: 0.9420, test_f1: 0.6306
 epoch: 20, train_loss: 0.6499, test_loss: 0.8321, test_f1: 0.5749
 epoch: 21, train_loss: 0.6516, test_loss: 0.9178, test_f1: 0.6075
 epoch: 22, train_loss: 0.6385, test_loss: 0.8161, test_f1: 0.6284
 epoch: 23, train_loss: 0.6172, test_loss: 0.8252, test_f1: 0.6268
 epoch: 24, train_loss: 0.6134, test_loss: 0.9011, test_f1: 0.6252
 epoch: 25, train_loss: 0.6078, test_loss: 0.8209, test_f1: 0.6101
 epoch: 26, train_loss: 0.5877, test_loss: 1.0171, test_f1: 0.6344
 epoch: 27, train_loss: 0.6040, test_loss: 0.9384, test_f1: 0.6133
 epoch: 28, train_loss: 0.6349, test_loss: 0.9382, test_f1: 0.6145
 epoch: 29, train_loss: 0.5955, test_loss: 1.0240, test_f1: 0.5676
 epoch: 30, train_loss: 0.5797, test_loss: 0.8824, test_f1: 0.6500
 epoch: 31, train_loss: 0.5637, test_loss: 0.9383, test_f1: 0.6398
 epoch: 32, train_loss: 0.5639, test_loss: 0.8568, test_f1: 0.6484
 epoch: 33, train_loss: 0.5713, test_loss: 0.8821, test_f1: 0.6278
 epoch: 34, train_loss: 0.5556, test_loss: 1.1534, test_f1: 0.5339
 epoch: 35, train_loss: 0.5350, test_loss: 0.8554, test_f1: 0.6392
 epoch: 36, train_loss: 0.5509, test_loss: 1.1070, test_f1: 0.6221
 epoch: 37, train_loss: 0.5139, test_loss: 1.1623, test_f1: 0.5949
 epoch: 38, train_loss: 0.5048, test_loss: 1.1263, test_f1: 0.6282
 epoch: 39, train_loss: 0.4984, test_loss: 1.1453, test_f1: 0.6528
 epoch: 40, train_loss: 0.5050, test_loss: 1.0662, test_f1: 0.6196
 epoch: 41, train_loss: 0.4916, test_loss: 0.9264, test_f1: 0.6440
 epoch: 42, train_loss: 0.4866, test_loss: 0.9237, test_f1: 0.6350
 epoch: 43, train_loss: 0.4610, test_loss: 1.0914, test_f1: 0.6075
 epoch: 44, train_loss: 0.4867, test_loss: 1.1544, test_f1: 0.5919
 epoch: 45, train_loss: 0.4884, test_loss: 0.9357, test_f1: 0.6462
 epoch: 46, train_loss: 0.4866, test_loss: 1.0346, test_f1: 0.6289
 epoch: 47, train_loss: 0.4747, test_loss: 1.1827, test_f1: 0.6272
 epoch: 48, train_loss: 0.4664, test_loss: 1.0097, test_f1: 0.6523
 epoch: 49, train_loss: 0.4630, test_loss: 1.0803, test_f1: 0.6588
 epoch: 50, train_loss: 0.4521, test_loss: 1.3033, test_f1: 0.6475
 epoch: 51, train_loss: 0.4046, test_loss: 1.0766, test_f1: 0.6569
 epoch: 52, train_loss: 0.3561, test_loss: 1.2155, test_f1: 0.6590
 epoch: 53, train_loss: 0.3511, test_loss: 1.1827, test_f1: 0.6519
 epoch: 54, train_loss: 0.3409, test_loss: 1.1675, test_f1: 0.6788
 epoch: 55, train_loss: 0.3152, test_loss: 1.1508, test_f1: 0.6399
 epoch: 56, train_loss: 0.3096, test_loss: 1.4142, test_f1: 0.6639
 epoch: 57, train_loss: 0.3224, test_loss: 1.1752, test_f1: 0.6520
 epoch: 58, train_loss: 0.2974, test_loss: 1.2638, test_f1: 0.6638
 epoch: 59, train_loss: 0.3266, test_loss: 1.2835, test_f1: 0.6430
 epoch: 60, train_loss: 0.2993, test_loss: 1.3182, test_f1: 0.6526
 epoch: 61, train_loss: 0.3003, test_loss: 1.3234, test_f1: 0.6576
 epoch: 62, train_loss: 0.2910, test_loss: 1.3814, test_f1: 0.6553
 epoch: 63, train_loss: 0.2930, test_loss: 1.3220, test_f1: 0.6528
 epoch: 64, train_loss: 0.3147, test_loss: 1.1764, test_f1: 0.6521
 epoch: 65, train_loss: 0.2871, test_loss: 1.3386, test_f1: 0.6531
 epoch: 66, train_loss: 0.2702, test_loss: 1.5236, test_f1: 0.6372
 epoch: 67, train_loss: 0.2678, test_loss: 1.2503, test_f1: 0.6639
 epoch: 68, train_loss: 0.2650, test_loss: 1.4275, test_f1: 0.6179
 epoch: 69, train_loss: 0.2601, test_loss: 1.4867, test_f1: 0.6392
 epoch: 70, train_loss: 0.2545, test_loss: 1.4442, test_f1: 0.6486
 epoch: 71, train_loss: 0.2549, test_loss: 1.4242, test_f1: 0.6462
 epoch: 72, train_loss: 0.2768, test_loss: 1.5252, test_f1: 0.6624
 epoch: 73, train_loss: 0.2635, test_loss: 1.5154, test_f1: 0.6391
 epoch: 74, train_loss: 0.2664, test_loss: 1.4010, test_f1: 0.6607
 epoch: 75, train_loss: 0.2881, test_loss: 1.4083, test_f1: 0.6464
 epoch: 76, train_loss: 0.2611, test_loss: 1.4495, test_f1: 0.6435
 epoch: 77, train_loss: 0.2516, test_loss: 1.5510, test_f1: 0.6467
 epoch: 78, train_loss: 0.2537, test_loss: 1.5031, test_f1: 0.6549
 epoch: 79, train_loss: 0.2383, test_loss: 1.2907, test_f1: 0.6445
 epoch: 80, train_loss: 0.2411, test_loss: 1.4957, test_f1: 0.6370
 epoch: 81, train_loss: 0.2213, test_loss: 1.5470, test_f1: 0.6361
 epoch: 82, train_loss: 0.2326, test_loss: 1.5250, test_f1: 0.6512
 epoch: 83, train_loss: 0.2562, test_loss: 1.7014, test_f1: 0.6425
 epoch: 84, train_loss: 0.2454, test_loss: 1.5202, test_f1: 0.5998
 epoch: 85, train_loss: 0.2319, test_loss: 1.4004, test_f1: 0.6629
 epoch: 86, train_loss: 0.2129, test_loss: 1.6421, test_f1: 0.6429
 epoch: 87, train_loss: 0.2114, test_loss: 1.5413, test_f1: 0.6308
 epoch: 88, train_loss: 0.2122, test_loss: 1.6042, test_f1: 0.6436
 epoch: 89, train_loss: 0.2217, test_loss: 1.7530, test_f1: 0.5834
 epoch: 90, train_loss: 0.2249, test_loss: 1.5003, test_f1: 0.6337
 epoch: 91, train_loss: 0.2182, test_loss: 1.8308, test_f1: 0.6348
 epoch: 92, train_loss: 0.2052, test_loss: 1.6980, test_f1: 0.6370
 epoch: 93, train_loss: 0.2005, test_loss: 1.8333, test_f1: 0.6120
 epoch: 94, train_loss: 0.2092, test_loss: 1.5758, test_f1: 0.6474
 epoch: 95, train_loss: 0.1994, test_loss: 1.6926, test_f1: 0.6495
 epoch: 96, train_loss: 0.2262, test_loss: 1.5902, test_f1: 0.6050
 epoch: 97, train_loss: 0.2037, test_loss: 1.6917, test_f1: 0.6443
 epoch: 98, train_loss: 0.2184, test_loss: 1.5538, test_f1: 0.6337
 epoch: 99, train_loss: 0.2030, test_loss: 1.8120, test_f1: 0.6345
##################ITERATION #3 ****************************************
 epoch: 0, train_loss: 1.3498, test_loss: 1.3979, test_f1: 0.2405
 epoch: 1, train_loss: 1.0621, test_loss: 1.0691, test_f1: 0.3462
 epoch: 2, train_loss: 1.0386, test_loss: 1.0463, test_f1: 0.3642
 epoch: 3, train_loss: 1.0074, test_loss: 0.9997, test_f1: 0.4275
 epoch: 4, train_loss: 0.9897, test_loss: 0.9798, test_f1: 0.4725
 epoch: 5, train_loss: 0.9641, test_loss: 0.9988, test_f1: 0.4503
 epoch: 6, train_loss: 0.9483, test_loss: 0.9531, test_f1: 0.5083
 epoch: 7, train_loss: 0.9433, test_loss: 1.0520, test_f1: 0.4022
 epoch: 8, train_loss: 0.9293, test_loss: 0.9185, test_f1: 0.5177
 epoch: 9, train_loss: 0.9020, test_loss: 0.9801, test_f1: 0.4794
 epoch: 10, train_loss: 0.8892, test_loss: 0.9226, test_f1: 0.5358
 epoch: 11, train_loss: 0.8730, test_loss: 0.9602, test_f1: 0.5060
 epoch: 12, train_loss: 0.8616, test_loss: 0.9338, test_f1: 0.5173
 epoch: 13, train_loss: 0.8341, test_loss: 0.8289, test_f1: 0.5746
 epoch: 14, train_loss: 0.8192, test_loss: 0.8112, test_f1: 0.5436
 epoch: 15, train_loss: 0.8087, test_loss: 0.8433, test_f1: 0.5465
 epoch: 16, train_loss: 0.8026, test_loss: 0.9397, test_f1: 0.5490
 epoch: 17, train_loss: 0.7937, test_loss: 0.9327, test_f1: 0.5042
 epoch: 18, train_loss: 0.7791, test_loss: 0.9257, test_f1: 0.5630
 epoch: 19, train_loss: 0.7622, test_loss: 0.7996, test_f1: 0.6198
 epoch: 20, train_loss: 0.7538, test_loss: 0.9147, test_f1: 0.5739
 epoch: 21, train_loss: 0.7444, test_loss: 1.0579, test_f1: 0.5252
 epoch: 22, train_loss: 0.7272, test_loss: 0.8703, test_f1: 0.5560
 epoch: 23, train_loss: 0.7129, test_loss: 0.8472, test_f1: 0.5713
 epoch: 24, train_loss: 0.7232, test_loss: 0.8537, test_f1: 0.5532
 epoch: 25, train_loss: 0.7084, test_loss: 0.8801, test_f1: 0.5605
 epoch: 26, train_loss: 0.6936, test_loss: 0.7864, test_f1: 0.6126
 epoch: 27, train_loss: 0.6821, test_loss: 0.8761, test_f1: 0.5661
 epoch: 28, train_loss: 0.6593, test_loss: 0.8464, test_f1: 0.5629
 epoch: 29, train_loss: 0.6668, test_loss: 1.0132, test_f1: 0.5987
 epoch: 30, train_loss: 0.6901, test_loss: 0.9354, test_f1: 0.5694
 epoch: 31, train_loss: 0.6679, test_loss: 0.8331, test_f1: 0.5746
 epoch: 32, train_loss: 0.6386, test_loss: 0.7503, test_f1: 0.5957
 epoch: 33, train_loss: 0.6604, test_loss: 1.0239, test_f1: 0.5493
 epoch: 34, train_loss: 0.6311, test_loss: 1.0500, test_f1: 0.6435
 epoch: 35, train_loss: 0.6095, test_loss: 0.9810, test_f1: 0.6370
 epoch: 36, train_loss: 0.6090, test_loss: 0.9037, test_f1: 0.5965
 epoch: 37, train_loss: 0.6040, test_loss: 0.8917, test_f1: 0.5938
 epoch: 38, train_loss: 0.6189, test_loss: 0.9143, test_f1: 0.5873
 epoch: 39, train_loss: 0.5983, test_loss: 0.9249, test_f1: 0.5681
 epoch: 40, train_loss: 0.5865, test_loss: 0.7850, test_f1: 0.6638
 epoch: 41, train_loss: 0.5958, test_loss: 0.9701, test_f1: 0.6392
 epoch: 42, train_loss: 0.5900, test_loss: 0.7792, test_f1: 0.6296
 epoch: 43, train_loss: 0.5679, test_loss: 1.1266, test_f1: 0.6227
 epoch: 44, train_loss: 0.5400, test_loss: 0.8849, test_f1: 0.6325
 epoch: 45, train_loss: 0.5341, test_loss: 0.7797, test_f1: 0.6416
 epoch: 46, train_loss: 0.5674, test_loss: 0.9068, test_f1: 0.6259
 epoch: 47, train_loss: 0.5519, test_loss: 1.2912, test_f1: 0.4410
 epoch: 48, train_loss: 0.5435, test_loss: 0.7219, test_f1: 0.6578
 epoch: 49, train_loss: 0.5226, test_loss: 0.9332, test_f1: 0.6282
 epoch: 50, train_loss: 0.5207, test_loss: 0.8157, test_f1: 0.6487
 epoch: 51, train_loss: 0.5043, test_loss: 0.8352, test_f1: 0.6561
 epoch: 52, train_loss: 0.4761, test_loss: 0.9034, test_f1: 0.6272
 epoch: 53, train_loss: 0.4765, test_loss: 0.8478, test_f1: 0.6541
 epoch: 54, train_loss: 0.4361, test_loss: 0.7892, test_f1: 0.6710
 epoch: 55, train_loss: 0.4373, test_loss: 0.8406, test_f1: 0.6817
 epoch: 56, train_loss: 0.4246, test_loss: 0.7614, test_f1: 0.6549
 epoch: 57, train_loss: 0.4114, test_loss: 0.8676, test_f1: 0.6800
 epoch: 58, train_loss: 0.4086, test_loss: 0.8253, test_f1: 0.6486
 epoch: 59, train_loss: 0.3923, test_loss: 0.7552, test_f1: 0.6892
 epoch: 60, train_loss: 0.4040, test_loss: 0.9543, test_f1: 0.6603
 epoch: 61, train_loss: 0.4108, test_loss: 0.9452, test_f1: 0.6019
 epoch: 62, train_loss: 0.3874, test_loss: 0.7818, test_f1: 0.6790
 epoch: 63, train_loss: 0.3955, test_loss: 0.9072, test_f1: 0.6481
 epoch: 64, train_loss: 0.3878, test_loss: 0.8065, test_f1: 0.6799
 epoch: 65, train_loss: 0.3844, test_loss: 0.9710, test_f1: 0.6649
 epoch: 66, train_loss: 0.3831, test_loss: 0.8333, test_f1: 0.6909
 epoch: 67, train_loss: 0.3862, test_loss: 0.7868, test_f1: 0.6979
 epoch: 68, train_loss: 0.3743, test_loss: 0.8312, test_f1: 0.6831
 epoch: 69, train_loss: 0.3601, test_loss: 0.9243, test_f1: 0.6663
 epoch: 70, train_loss: 0.3456, test_loss: 0.9209, test_f1: 0.6538
 epoch: 71, train_loss: 0.3380, test_loss: 0.8915, test_f1: 0.6685
 epoch: 72, train_loss: 0.3438, test_loss: 0.8056, test_f1: 0.6787
 epoch: 73, train_loss: 0.3356, test_loss: 1.0320, test_f1: 0.6548
 epoch: 74, train_loss: 0.3510, test_loss: 0.8390, test_f1: 0.6771
 epoch: 75, train_loss: 0.3306, test_loss: 0.8722, test_f1: 0.6733
 epoch: 76, train_loss: 0.3421, test_loss: 1.0274, test_f1: 0.6525
 epoch: 77, train_loss: 0.3334, test_loss: 0.9207, test_f1: 0.6854
 epoch: 78, train_loss: 0.3167, test_loss: 0.8595, test_f1: 0.7064
 epoch: 79, train_loss: 0.3118, test_loss: 1.0139, test_f1: 0.6662
 epoch: 80, train_loss: 0.3119, test_loss: 1.0755, test_f1: 0.6693
 epoch: 81, train_loss: 0.3206, test_loss: 1.0308, test_f1: 0.6876
 epoch: 82, train_loss: 0.2992, test_loss: 1.1272, test_f1: 0.6573
 epoch: 83, train_loss: 0.3116, test_loss: 1.0008, test_f1: 0.6701
 epoch: 84, train_loss: 0.3206, test_loss: 1.1193, test_f1: 0.6616
 epoch: 85, train_loss: 0.3031, test_loss: 1.1920, test_f1: 0.6472
 epoch: 86, train_loss: 0.2998, test_loss: 1.2509, test_f1: 0.6582
 epoch: 87, train_loss: 0.3023, test_loss: 0.8598, test_f1: 0.6637
 epoch: 88, train_loss: 0.3320, test_loss: 1.1679, test_f1: 0.5881
 epoch: 89, train_loss: 0.2942, test_loss: 1.1166, test_f1: 0.6782
 epoch: 90, train_loss: 0.2854, test_loss: 1.0976, test_f1: 0.6487
 epoch: 91, train_loss: 0.2927, test_loss: 1.1462, test_f1: 0.6645
 epoch: 92, train_loss: 0.2664, test_loss: 1.0471, test_f1: 0.6576
 epoch: 93, train_loss: 0.2896, test_loss: 1.0622, test_f1: 0.6527
 epoch: 94, train_loss: 0.2855, test_loss: 1.1837, test_f1: 0.6389
 epoch: 95, train_loss: 0.2648, test_loss: 1.0217, test_f1: 0.6663
 epoch: 96, train_loss: 0.2622, test_loss: 1.0346, test_f1: 0.6612
 epoch: 97, train_loss: 0.2521, test_loss: 1.0135, test_f1: 0.6855
 epoch: 98, train_loss: 0.2516, test_loss: 1.1660, test_f1: 0.6515
 epoch: 99, train_loss: 0.2560, test_loss: 1.0852, test_f1: 0.6246
##################ITERATION #4 ****************************************
 epoch: 0, train_loss: 1.4529, test_loss: 1.5881, test_f1: 0.2620
 epoch: 1, train_loss: 1.0141, test_loss: 1.0480, test_f1: 0.4053
 epoch: 2, train_loss: 0.9646, test_loss: 0.9626, test_f1: 0.4897
 epoch: 3, train_loss: 0.9437, test_loss: 0.9409, test_f1: 0.5440
 epoch: 4, train_loss: 0.9275, test_loss: 0.9681, test_f1: 0.5074
 epoch: 5, train_loss: 0.9083, test_loss: 0.8732, test_f1: 0.5262
 epoch: 6, train_loss: 0.8874, test_loss: 0.8727, test_f1: 0.5348
 epoch: 7, train_loss: 0.8636, test_loss: 1.0131, test_f1: 0.5109
 epoch: 8, train_loss: 0.8577, test_loss: 0.9662, test_f1: 0.5578
 epoch: 9, train_loss: 0.8297, test_loss: 1.0166, test_f1: 0.5183
 epoch: 10, train_loss: 0.8239, test_loss: 0.8682, test_f1: 0.5392
 epoch: 11, train_loss: 0.8070, test_loss: 0.9662, test_f1: 0.5012
 epoch: 12, train_loss: 0.7759, test_loss: 0.8383, test_f1: 0.5774
 epoch: 13, train_loss: 0.7679, test_loss: 0.8314, test_f1: 0.5440
 epoch: 14, train_loss: 0.7411, test_loss: 4.7384, test_f1: 0.2032
 epoch: 15, train_loss: 0.7326, test_loss: 1.0366, test_f1: 0.5574
 epoch: 16, train_loss: 0.7123, test_loss: 0.9779, test_f1: 0.5864
 epoch: 17, train_loss: 0.7194, test_loss: 0.7912, test_f1: 0.6311
 epoch: 18, train_loss: 0.6902, test_loss: 0.7785, test_f1: 0.6158
 epoch: 19, train_loss: 0.6831, test_loss: 0.8491, test_f1: 0.6293
 epoch: 20, train_loss: 0.6925, test_loss: 0.7918, test_f1: 0.5997
 epoch: 21, train_loss: 0.6787, test_loss: 0.8991, test_f1: 0.6231
 epoch: 22, train_loss: 0.6647, test_loss: 0.8575, test_f1: 0.6221
 epoch: 23, train_loss: 0.6651, test_loss: 0.9065, test_f1: 0.6082
 epoch: 24, train_loss: 0.6861, test_loss: 0.8062, test_f1: 0.6089
 epoch: 25, train_loss: 0.6613, test_loss: 1.2576, test_f1: 0.5396
 epoch: 26, train_loss: 0.6328, test_loss: 0.8465, test_f1: 0.6069
 epoch: 27, train_loss: 0.6142, test_loss: 1.0474, test_f1: 0.6196
 epoch: 28, train_loss: 0.6044, test_loss: 0.9326, test_f1: 0.6329
 epoch: 29, train_loss: 0.6143, test_loss: 0.9075, test_f1: 0.6348
 epoch: 30, train_loss: 0.6104, test_loss: 0.9625, test_f1: 0.6485
 epoch: 31, train_loss: 0.5878, test_loss: 1.2061, test_f1: 0.5600
 epoch: 32, train_loss: 0.5761, test_loss: 1.1224, test_f1: 0.6204
 epoch: 33, train_loss: 0.5563, test_loss: 5.6998, test_f1: 0.2314
 epoch: 34, train_loss: 0.5651, test_loss: 1.2124, test_f1: 0.6369
 epoch: 35, train_loss: 0.5692, test_loss: 1.2661, test_f1: 0.5823
 epoch: 36, train_loss: 0.5505, test_loss: 1.1449, test_f1: 0.5964
 epoch: 37, train_loss: 0.5401, test_loss: 1.1454, test_f1: 0.6376
 epoch: 38, train_loss: 0.5438, test_loss: 1.1694, test_f1: 0.6109
 epoch: 39, train_loss: 0.5138, test_loss: 1.0568, test_f1: 0.6312
 epoch: 40, train_loss: 0.5063, test_loss: 1.5379, test_f1: 0.5598
 epoch: 41, train_loss: 0.5232, test_loss: 1.0948, test_f1: 0.6570
 epoch: 42, train_loss: 0.5059, test_loss: 1.1833, test_f1: 0.6171
 epoch: 43, train_loss: 0.4973, test_loss: 1.3970, test_f1: 0.6267
 epoch: 44, train_loss: 0.4875, test_loss: 1.3742, test_f1: 0.6415
 epoch: 45, train_loss: 0.4929, test_loss: 1.0928, test_f1: 0.6462
 epoch: 46, train_loss: 0.4657, test_loss: 1.6268, test_f1: 0.5766
 epoch: 47, train_loss: 0.4623, test_loss: 1.1282, test_f1: 0.6480
 epoch: 48, train_loss: 0.4944, test_loss: 1.1166, test_f1: 0.6249
 epoch: 49, train_loss: 0.4605, test_loss: 1.1999, test_f1: 0.6446
 epoch: 50, train_loss: 0.4780, test_loss: 1.2265, test_f1: 0.6553
 epoch: 51, train_loss: 0.4257, test_loss: 1.0734, test_f1: 0.6800
 epoch: 52, train_loss: 0.3946, test_loss: 1.1657, test_f1: 0.6634
 epoch: 53, train_loss: 0.3896, test_loss: 1.1702, test_f1: 0.6630
 epoch: 54, train_loss: 0.3600, test_loss: 1.2483, test_f1: 0.6741
 epoch: 55, train_loss: 0.3491, test_loss: 1.2049, test_f1: 0.6925
 epoch: 56, train_loss: 0.3464, test_loss: 1.1630, test_f1: 0.6676
 epoch: 57, train_loss: 0.3378, test_loss: 1.3401, test_f1: 0.6624
 epoch: 58, train_loss: 0.3177, test_loss: 1.8177, test_f1: 0.6374
 epoch: 59, train_loss: 0.3115, test_loss: 2.0382, test_f1: 0.5959
 epoch: 60, train_loss: 0.3148, test_loss: 1.5921, test_f1: 0.6655
 epoch: 61, train_loss: 0.3219, test_loss: 1.5622, test_f1: 0.6633
 epoch: 62, train_loss: 0.2862, test_loss: 1.4523, test_f1: 0.6788
 epoch: 63, train_loss: 0.3039, test_loss: 1.4539, test_f1: 0.6659
 epoch: 64, train_loss: 0.2833, test_loss: 1.5344, test_f1: 0.6628
 epoch: 65, train_loss: 0.2874, test_loss: 1.6796, test_f1: 0.6192
 epoch: 66, train_loss: 0.2786, test_loss: 1.4709, test_f1: 0.6696
 epoch: 67, train_loss: 0.2812, test_loss: 1.2226, test_f1: 0.6675
 epoch: 68, train_loss: 0.2664, test_loss: 1.4367, test_f1: 0.6770
 epoch: 69, train_loss: 0.2930, test_loss: 1.4605, test_f1: 0.6647
 epoch: 70, train_loss: 0.2990, test_loss: 1.4067, test_f1: 0.6674
 epoch: 71, train_loss: 0.2787, test_loss: 1.4090, test_f1: 0.6719
 epoch: 72, train_loss: 0.2420, test_loss: 1.4458, test_f1: 0.6921
 epoch: 73, train_loss: 0.2508, test_loss: 1.7567, test_f1: 0.6454
 epoch: 74, train_loss: 0.2629, test_loss: 1.5499, test_f1: 0.6527
 epoch: 75, train_loss: 0.2431, test_loss: 1.5572, test_f1: 0.6576
 epoch: 76, train_loss: 0.2254, test_loss: 1.5936, test_f1: 0.6736
 epoch: 77, train_loss: 0.2556, test_loss: 1.5856, test_f1: 0.6575
 epoch: 78, train_loss: 0.2465, test_loss: 1.5400, test_f1: 0.6740
 epoch: 79, train_loss: 0.2804, test_loss: 1.5423, test_f1: 0.6580
 epoch: 80, train_loss: 0.2813, test_loss: 1.6366, test_f1: 0.6568
 epoch: 81, train_loss: 0.2434, test_loss: 1.6071, test_f1: 0.6729
 epoch: 82, train_loss: 0.2280, test_loss: 1.7125, test_f1: 0.6519
 epoch: 83, train_loss: 0.2175, test_loss: 1.8146, test_f1: 0.6775
 epoch: 84, train_loss: 0.2231, test_loss: 1.6658, test_f1: 0.6698
 epoch: 85, train_loss: 0.2333, test_loss: 1.6600, test_f1: 0.6706
 epoch: 86, train_loss: 0.2232, test_loss: 1.7433, test_f1: 0.6759
 epoch: 87, train_loss: 0.2285, test_loss: 1.6196, test_f1: 0.6885
 epoch: 88, train_loss: 0.2123, test_loss: 1.6763, test_f1: 0.6894
 epoch: 89, train_loss: 0.2202, test_loss: 1.7696, test_f1: 0.6602
 epoch: 90, train_loss: 0.2166, test_loss: 1.6499, test_f1: 0.6756
 epoch: 91, train_loss: 0.1956, test_loss: 1.7911, test_f1: 0.6593
 epoch: 92, train_loss: 0.1934, test_loss: 1.8769, test_f1: 0.6442
 epoch: 93, train_loss: 0.2016, test_loss: 1.8931, test_f1: 0.6499
 epoch: 94, train_loss: 0.2203, test_loss: 1.8569, test_f1: 0.6394
 epoch: 95, train_loss: 0.1982, test_loss: 1.6142, test_f1: 0.6715
 epoch: 96, train_loss: 0.1935, test_loss: 1.5986, test_f1: 0.6494
 epoch: 97, train_loss: 0.1975, test_loss: 1.8020, test_f1: 0.6510
 epoch: 98, train_loss: 0.1980, test_loss: 1.8996, test_f1: 0.6185
 epoch: 99, train_loss: 0.1706, test_loss: 1.9019, test_f1: 0.6591
##################ITERATION #5 ****************************************
 epoch: 0, train_loss: 1.4622, test_loss: 1.3774, test_f1: 0.2791
 epoch: 1, train_loss: 1.0360, test_loss: 1.2010, test_f1: 0.3709
 epoch: 2, train_loss: 0.9846, test_loss: 1.1113, test_f1: 0.4021
 epoch: 3, train_loss: 0.9512, test_loss: 1.0849, test_f1: 0.4606
 epoch: 4, train_loss: 0.9275, test_loss: 1.1489, test_f1: 0.4601
 epoch: 5, train_loss: 0.8989, test_loss: 0.9713, test_f1: 0.4919
 epoch: 6, train_loss: 0.8755, test_loss: 0.9819, test_f1: 0.5478
 epoch: 7, train_loss: 0.8684, test_loss: 1.1172, test_f1: 0.5260
 epoch: 8, train_loss: 0.8571, test_loss: 0.9454, test_f1: 0.5211
 epoch: 9, train_loss: 0.8224, test_loss: 0.8907, test_f1: 0.5514
 epoch: 10, train_loss: 0.8055, test_loss: 1.2148, test_f1: 0.5396
 epoch: 11, train_loss: 0.8153, test_loss: 0.9862, test_f1: 0.5881
 epoch: 12, train_loss: 0.8112, test_loss: 0.8657, test_f1: 0.5710
 epoch: 13, train_loss: 0.7827, test_loss: 0.9580, test_f1: 0.5331
 epoch: 14, train_loss: 0.7876, test_loss: 1.1005, test_f1: 0.5460
 epoch: 15, train_loss: 0.7608, test_loss: 0.8580, test_f1: 0.5924
 epoch: 16, train_loss: 0.7320, test_loss: 0.8149, test_f1: 0.6179
 epoch: 17, train_loss: 0.7160, test_loss: 0.8859, test_f1: 0.6203
 epoch: 18, train_loss: 0.6758, test_loss: 0.9576, test_f1: 0.6153
 epoch: 19, train_loss: 0.6778, test_loss: 0.9108, test_f1: 0.5930
 epoch: 20, train_loss: 0.6715, test_loss: 0.9560, test_f1: 0.5862
 epoch: 21, train_loss: 0.6507, test_loss: 0.8850, test_f1: 0.5943
 epoch: 22, train_loss: 0.6622, test_loss: 0.9363, test_f1: 0.6038
 epoch: 23, train_loss: 0.6350, test_loss: 0.8271, test_f1: 0.6735
 epoch: 24, train_loss: 0.6109, test_loss: 0.8790, test_f1: 0.6188
 epoch: 25, train_loss: 0.6169, test_loss: 1.2499, test_f1: 0.5617
 epoch: 26, train_loss: 0.6237, test_loss: 1.0111, test_f1: 0.5987
 epoch: 27, train_loss: 0.6270, test_loss: 1.1039, test_f1: 0.5548
 epoch: 28, train_loss: 0.6140, test_loss: 0.7790, test_f1: 0.6499
 epoch: 29, train_loss: 0.5959, test_loss: 0.8345, test_f1: 0.6230
 epoch: 30, train_loss: 0.5896, test_loss: 0.8850, test_f1: 0.6234
 epoch: 31, train_loss: 0.5888, test_loss: 1.2107, test_f1: 0.6112
 epoch: 32, train_loss: 0.5512, test_loss: 0.8281, test_f1: 0.6584
 epoch: 33, train_loss: 0.5692, test_loss: 1.1132, test_f1: 0.6235
 epoch: 34, train_loss: 0.5392, test_loss: 1.1357, test_f1: 0.6078
 epoch: 35, train_loss: 0.5627, test_loss: 1.0245, test_f1: 0.6508
 epoch: 36, train_loss: 0.5723, test_loss: 1.9907, test_f1: 0.4598
 epoch: 37, train_loss: 0.5565, test_loss: 1.3348, test_f1: 0.5059
 epoch: 38, train_loss: 0.5375, test_loss: 1.0267, test_f1: 0.5537
 epoch: 39, train_loss: 0.5330, test_loss: 0.8685, test_f1: 0.6554
 epoch: 40, train_loss: 0.5287, test_loss: 0.7523, test_f1: 0.6765
 epoch: 41, train_loss: 0.5228, test_loss: 1.4086, test_f1: 0.5741
 epoch: 42, train_loss: 0.5032, test_loss: 1.0426, test_f1: 0.6044
 epoch: 43, train_loss: 0.4915, test_loss: 1.3110, test_f1: 0.5559
 epoch: 44, train_loss: 0.4726, test_loss: 1.0517, test_f1: 0.6288
 epoch: 45, train_loss: 0.4909, test_loss: 1.0482, test_f1: 0.6162
 epoch: 46, train_loss: 0.4570, test_loss: 1.1505, test_f1: 0.6476
 epoch: 47, train_loss: 0.4484, test_loss: 1.0888, test_f1: 0.6225
 epoch: 48, train_loss: 0.4383, test_loss: 1.1391, test_f1: 0.6548
 epoch: 49, train_loss: 0.4452, test_loss: 1.2238, test_f1: 0.6336
 epoch: 50, train_loss: 0.4218, test_loss: 1.0507, test_f1: 0.6436
 epoch: 51, train_loss: 0.4010, test_loss: 0.9303, test_f1: 0.6651
 epoch: 52, train_loss: 0.3525, test_loss: 0.9514, test_f1: 0.6622
 epoch: 53, train_loss: 0.3418, test_loss: 1.0865, test_f1: 0.6700
 epoch: 54, train_loss: 0.3243, test_loss: 1.5088, test_f1: 0.6334
 epoch: 55, train_loss: 0.3250, test_loss: 1.1419, test_f1: 0.6505
 epoch: 56, train_loss: 0.3213, test_loss: 0.9427, test_f1: 0.6782
 epoch: 57, train_loss: 0.3337, test_loss: 1.0978, test_f1: 0.6593
 epoch: 58, train_loss: 0.3328, test_loss: 1.1454, test_f1: 0.6616
 epoch: 59, train_loss: 0.3100, test_loss: 1.0445, test_f1: 0.6620
 epoch: 60, train_loss: 0.3144, test_loss: 1.1577, test_f1: 0.6474
 epoch: 61, train_loss: 0.3121, test_loss: 1.4834, test_f1: 0.6460
 epoch: 62, train_loss: 0.2862, test_loss: 1.4334, test_f1: 0.6622
 epoch: 63, train_loss: 0.2859, test_loss: 1.1157, test_f1: 0.6715
 epoch: 64, train_loss: 0.2826, test_loss: 1.5106, test_f1: 0.6117
 epoch: 65, train_loss: 0.2840, test_loss: 1.3015, test_f1: 0.6733
 epoch: 66, train_loss: 0.2817, test_loss: 1.1912, test_f1: 0.6842
 epoch: 67, train_loss: 0.2845, test_loss: 1.0593, test_f1: 0.6777
 epoch: 68, train_loss: 0.2746, test_loss: 1.4594, test_f1: 0.6824
 epoch: 69, train_loss: 0.2615, test_loss: 1.3103, test_f1: 0.6744
 epoch: 70, train_loss: 0.2767, test_loss: 1.0589, test_f1: 0.7118
 epoch: 71, train_loss: 0.2686, test_loss: 1.5518, test_f1: 0.6788
 epoch: 72, train_loss: 0.2523, test_loss: 1.6248, test_f1: 0.6506
 epoch: 73, train_loss: 0.2408, test_loss: 1.5880, test_f1: 0.6755
 epoch: 74, train_loss: 0.2556, test_loss: 1.3453, test_f1: 0.6847
 epoch: 75, train_loss: 0.2392, test_loss: 1.3512, test_f1: 0.6587
 epoch: 76, train_loss: 0.2511, test_loss: 1.1610, test_f1: 0.6908
 epoch: 77, train_loss: 0.2393, test_loss: 1.1727, test_f1: 0.6997
 epoch: 78, train_loss: 0.2311, test_loss: 1.2953, test_f1: 0.6828
 epoch: 79, train_loss: 0.2329, test_loss: 1.5691, test_f1: 0.6783
 epoch: 80, train_loss: 0.2402, test_loss: 1.1844, test_f1: 0.6935
 epoch: 81, train_loss: 0.2430, test_loss: 1.3989, test_f1: 0.6667
 epoch: 82, train_loss: 0.2334, test_loss: 1.0214, test_f1: 0.7077
 epoch: 83, train_loss: 0.2286, test_loss: 1.6466, test_f1: 0.6657
 epoch: 84, train_loss: 0.2457, test_loss: 1.2288, test_f1: 0.6937
 epoch: 85, train_loss: 0.2119, test_loss: 1.2893, test_f1: 0.6954
 epoch: 86, train_loss: 0.2077, test_loss: 1.5182, test_f1: 0.6532
 epoch: 87, train_loss: 0.2225, test_loss: 1.7479, test_f1: 0.6318
 epoch: 88, train_loss: 0.2155, test_loss: 1.2199, test_f1: 0.6849
 epoch: 89, train_loss: 0.2138, test_loss: 1.6620, test_f1: 0.6694
 epoch: 90, train_loss: 0.2125, test_loss: 1.3129, test_f1: 0.6706
 epoch: 91, train_loss: 0.2351, test_loss: 1.2115, test_f1: 0.6970
 epoch: 92, train_loss: 0.2314, test_loss: 1.4472, test_f1: 0.6677
 epoch: 93, train_loss: 0.2063, test_loss: 1.7990, test_f1: 0.6584
 epoch: 94, train_loss: 0.1916, test_loss: 1.6194, test_f1: 0.6670
 epoch: 95, train_loss: 0.1916, test_loss: 1.2387, test_f1: 0.6730
 epoch: 96, train_loss: 0.1964, test_loss: 1.5519, test_f1: 0.6761
 epoch: 97, train_loss: 0.1857, test_loss: 1.4978, test_f1: 0.6843
 epoch: 98, train_loss: 0.1984, test_loss: 1.1688, test_f1: 0.6986
 epoch: 99, train_loss: 0.1778, test_loss: 1.6055, test_f1: 0.6620
##################ITERATION #6 ****************************************
 epoch: 0, train_loss: 1.8731, test_loss: 1.4121, test_f1: 0.1222
 epoch: 1, train_loss: 1.1576, test_loss: 1.1848, test_f1: 0.3941
 epoch: 2, train_loss: 1.0719, test_loss: 1.1823, test_f1: 0.3257
 epoch: 3, train_loss: 1.0423, test_loss: 1.0959, test_f1: 0.3941
 epoch: 4, train_loss: 0.9993, test_loss: 1.0682, test_f1: 0.3382
 epoch: 5, train_loss: 0.9956, test_loss: 1.0116, test_f1: 0.4540
 epoch: 6, train_loss: 0.9793, test_loss: 0.9648, test_f1: 0.4705
 epoch: 7, train_loss: 0.9667, test_loss: 1.0290, test_f1: 0.4409
 epoch: 8, train_loss: 0.9741, test_loss: 0.9978, test_f1: 0.4624
 epoch: 9, train_loss: 0.9411, test_loss: 0.9823, test_f1: 0.5209
 epoch: 10, train_loss: 0.9310, test_loss: 0.9555, test_f1: 0.5094
 epoch: 11, train_loss: 0.9060, test_loss: 0.9581, test_f1: 0.5378
 epoch: 12, train_loss: 0.8970, test_loss: 0.9654, test_f1: 0.5392
 epoch: 13, train_loss: 0.8941, test_loss: 0.9371, test_f1: 0.5361
 epoch: 14, train_loss: 0.8696, test_loss: 0.8591, test_f1: 0.5893
 epoch: 15, train_loss: 0.8438, test_loss: 0.9793, test_f1: 0.5613
 epoch: 16, train_loss: 0.8218, test_loss: 2.2958, test_f1: 0.3824
 epoch: 17, train_loss: 0.8030, test_loss: 0.9286, test_f1: 0.5498
 epoch: 18, train_loss: 0.7896, test_loss: 0.8076, test_f1: 0.6004
 epoch: 19, train_loss: 0.7704, test_loss: 0.9159, test_f1: 0.5440
 epoch: 20, train_loss: 0.7672, test_loss: 1.3485, test_f1: 0.4878
 epoch: 21, train_loss: 0.7580, test_loss: 0.8074, test_f1: 0.6291
 epoch: 22, train_loss: 0.7401, test_loss: 1.7343, test_f1: 0.3999
 epoch: 23, train_loss: 0.6991, test_loss: 0.9156, test_f1: 0.6200
 epoch: 24, train_loss: 0.6975, test_loss: 0.7635, test_f1: 0.6674
 epoch: 25, train_loss: 0.6874, test_loss: 0.7898, test_f1: 0.6552
 epoch: 26, train_loss: 0.6858, test_loss: 0.8370, test_f1: 0.6159
 epoch: 27, train_loss: 0.6592, test_loss: 0.8029, test_f1: 0.6403
 epoch: 28, train_loss: 0.6576, test_loss: 0.8834, test_f1: 0.6381
 epoch: 29, train_loss: 0.6606, test_loss: 0.8533, test_f1: 0.6230
 epoch: 30, train_loss: 0.6517, test_loss: 1.3017, test_f1: 0.5181
 epoch: 31, train_loss: 0.7014, test_loss: 0.8300, test_f1: 0.5951
 epoch: 32, train_loss: 0.7023, test_loss: 0.8787, test_f1: 0.6480
 epoch: 33, train_loss: 0.6597, test_loss: 0.8326, test_f1: 0.6515
 epoch: 34, train_loss: 0.6430, test_loss: 0.8469, test_f1: 0.6419
 epoch: 35, train_loss: 0.6144, test_loss: 0.9651, test_f1: 0.6724
 epoch: 36, train_loss: 0.5960, test_loss: 0.7498, test_f1: 0.6695
 epoch: 37, train_loss: 0.5743, test_loss: 0.8601, test_f1: 0.6462
 epoch: 38, train_loss: 0.5821, test_loss: 0.8460, test_f1: 0.6561
 epoch: 39, train_loss: 0.5665, test_loss: 0.8730, test_f1: 0.6241
 epoch: 40, train_loss: 0.5750, test_loss: 0.7822, test_f1: 0.6590
 epoch: 41, train_loss: 0.5834, test_loss: 0.7702, test_f1: 0.6708
 epoch: 42, train_loss: 0.5622, test_loss: 1.0042, test_f1: 0.6270
 epoch: 43, train_loss: 0.5626, test_loss: 0.9816, test_f1: 0.6183
 epoch: 44, train_loss: 0.5432, test_loss: 0.7986, test_f1: 0.6695
 epoch: 45, train_loss: 0.5270, test_loss: 0.9312, test_f1: 0.6417
 epoch: 46, train_loss: 0.5093, test_loss: 0.9586, test_f1: 0.6598
 epoch: 47, train_loss: 0.5216, test_loss: 0.9969, test_f1: 0.6297
 epoch: 48, train_loss: 0.5204, test_loss: 0.9242, test_f1: 0.6375
 epoch: 49, train_loss: 0.5124, test_loss: 0.9240, test_f1: 0.6566
 epoch: 50, train_loss: 0.5435, test_loss: 1.0024, test_f1: 0.6014
 epoch: 51, train_loss: 0.4782, test_loss: 0.8061, test_f1: 0.6875
 epoch: 52, train_loss: 0.4341, test_loss: 1.0328, test_f1: 0.6626
 epoch: 53, train_loss: 0.4228, test_loss: 0.8932, test_f1: 0.6591
 epoch: 54, train_loss: 0.4172, test_loss: 1.0134, test_f1: 0.6629
 epoch: 55, train_loss: 0.3913, test_loss: 0.8939, test_f1: 0.6911
 epoch: 56, train_loss: 0.3966, test_loss: 0.8893, test_f1: 0.6867
 epoch: 57, train_loss: 0.3839, test_loss: 0.9460, test_f1: 0.6936
 epoch: 58, train_loss: 0.3851, test_loss: 0.9836, test_f1: 0.6767
 epoch: 59, train_loss: 0.3710, test_loss: 0.9602, test_f1: 0.6887
 epoch: 60, train_loss: 0.3737, test_loss: 0.9456, test_f1: 0.6889
 epoch: 61, train_loss: 0.3716, test_loss: 0.9901, test_f1: 0.6893
 epoch: 62, train_loss: 0.3470, test_loss: 0.9676, test_f1: 0.7120
 epoch: 63, train_loss: 0.3414, test_loss: 1.0405, test_f1: 0.6673
 epoch: 64, train_loss: 0.3512, test_loss: 1.1455, test_f1: 0.6616
 epoch: 65, train_loss: 0.3214, test_loss: 1.1537, test_f1: 0.6588
 epoch: 66, train_loss: 0.3201, test_loss: 1.2392, test_f1: 0.6505
 epoch: 67, train_loss: 0.3209, test_loss: 1.1733, test_f1: 0.6601
 epoch: 68, train_loss: 0.3120, test_loss: 1.1190, test_f1: 0.6749
 epoch: 69, train_loss: 0.3156, test_loss: 1.1356, test_f1: 0.6606
 epoch: 70, train_loss: 0.3548, test_loss: 1.0209, test_f1: 0.7018
 epoch: 71, train_loss: 0.3029, test_loss: 1.0900, test_f1: 0.7029
 epoch: 72, train_loss: 0.3022, test_loss: 1.0597, test_f1: 0.7056
 epoch: 73, train_loss: 0.2972, test_loss: 1.1752, test_f1: 0.6904
 epoch: 74, train_loss: 0.2915, test_loss: 1.0331, test_f1: 0.7094
 epoch: 75, train_loss: 0.3043, test_loss: 1.0550, test_f1: 0.7110
 epoch: 76, train_loss: 0.2941, test_loss: 1.1416, test_f1: 0.6801
 epoch: 77, train_loss: 0.2943, test_loss: 1.1190, test_f1: 0.6646
 epoch: 78, train_loss: 0.2983, test_loss: 1.1900, test_f1: 0.6694
 epoch: 79, train_loss: 0.2935, test_loss: 1.1045, test_f1: 0.6729
 epoch: 80, train_loss: 0.2846, test_loss: 1.3627, test_f1: 0.6959
 epoch: 81, train_loss: 0.2852, test_loss: 1.2601, test_f1: 0.6860
 epoch: 82, train_loss: 0.2746, test_loss: 1.2530, test_f1: 0.6560
 epoch: 83, train_loss: 0.2551, test_loss: 1.4166, test_f1: 0.6660
 epoch: 84, train_loss: 0.2711, test_loss: 1.3860, test_f1: 0.6663
 epoch: 85, train_loss: 0.2395, test_loss: 1.3159, test_f1: 0.6778
 epoch: 86, train_loss: 0.2625, test_loss: 1.6275, test_f1: 0.6556
 epoch: 87, train_loss: 0.3065, test_loss: 1.3396, test_f1: 0.6618
 epoch: 88, train_loss: 0.2781, test_loss: 1.2062, test_f1: 0.6812
 epoch: 89, train_loss: 0.2698, test_loss: 1.4500, test_f1: 0.6765
 epoch: 90, train_loss: 0.2629, test_loss: 1.2722, test_f1: 0.6864
 epoch: 91, train_loss: 0.2593, test_loss: 1.3539, test_f1: 0.6519
 epoch: 92, train_loss: 0.2503, test_loss: 1.6236, test_f1: 0.6521
 epoch: 93, train_loss: 0.2616, test_loss: 1.2307, test_f1: 0.6806
 epoch: 94, train_loss: 0.2526, test_loss: 1.0878, test_f1: 0.7067
 epoch: 95, train_loss: 0.2497, test_loss: 1.3934, test_f1: 0.6838
 epoch: 96, train_loss: 0.2307, test_loss: 1.2973, test_f1: 0.6978
 epoch: 97, train_loss: 0.2077, test_loss: 1.1420, test_f1: 0.6823
 epoch: 98, train_loss: 0.2357, test_loss: 1.4296, test_f1: 0.6466
 epoch: 99, train_loss: 0.2217, test_loss: 1.6247, test_f1: 0.6581
##################ITERATION #7 ****************************************
 epoch: 0, train_loss: 1.7591, test_loss: 1.4253, test_f1: 0.2688
 epoch: 1, train_loss: 1.0606, test_loss: 1.2366, test_f1: 0.3340
 epoch: 2, train_loss: 0.9800, test_loss: 1.0602, test_f1: 0.3850
 epoch: 3, train_loss: 0.9529, test_loss: 1.0020, test_f1: 0.5012
 epoch: 4, train_loss: 0.9240, test_loss: 0.9915, test_f1: 0.5367
 epoch: 5, train_loss: 0.9171, test_loss: 0.8899, test_f1: 0.5420
 epoch: 6, train_loss: 0.8965, test_loss: 0.8897, test_f1: 0.5092
 epoch: 7, train_loss: 0.8554, test_loss: 0.8948, test_f1: 0.5535
 epoch: 8, train_loss: 0.8373, test_loss: 0.8703, test_f1: 0.5818
 epoch: 9, train_loss: 0.8230, test_loss: 0.9086, test_f1: 0.5708
 epoch: 10, train_loss: 0.8295, test_loss: 0.9830, test_f1: 0.5223
 epoch: 11, train_loss: 0.8399, test_loss: 0.9120, test_f1: 0.5777
 epoch: 12, train_loss: 0.8118, test_loss: 0.9179, test_f1: 0.4948
 epoch: 13, train_loss: 0.7755, test_loss: 0.9545, test_f1: 0.5058
 epoch: 14, train_loss: 0.7734, test_loss: 0.9789, test_f1: 0.4811
 epoch: 15, train_loss: 0.7703, test_loss: 0.8620, test_f1: 0.5600
 epoch: 16, train_loss: 0.7511, test_loss: 0.8109, test_f1: 0.6066
 epoch: 17, train_loss: 0.7363, test_loss: 1.1237, test_f1: 0.5452
 epoch: 18, train_loss: 0.7399, test_loss: 0.8841, test_f1: 0.5863
 epoch: 19, train_loss: 0.7144, test_loss: 0.8090, test_f1: 0.6100
 epoch: 20, train_loss: 0.6867, test_loss: 0.8136, test_f1: 0.6073
 epoch: 21, train_loss: 0.6861, test_loss: 0.8354, test_f1: 0.6054
 epoch: 22, train_loss: 0.6784, test_loss: 1.0186, test_f1: 0.5661
 epoch: 23, train_loss: 0.6635, test_loss: 0.8780, test_f1: 0.6123
 epoch: 24, train_loss: 0.6579, test_loss: 0.9818, test_f1: 0.5629
 epoch: 25, train_loss: 0.6695, test_loss: 1.0938, test_f1: 0.6085
 epoch: 26, train_loss: 0.6581, test_loss: 1.0800, test_f1: 0.5031
 epoch: 27, train_loss: 0.6569, test_loss: 0.7647, test_f1: 0.6556
 epoch: 28, train_loss: 0.6428, test_loss: 0.8152, test_f1: 0.6425
 epoch: 29, train_loss: 0.6245, test_loss: 0.8385, test_f1: 0.6412
 epoch: 30, train_loss: 0.6366, test_loss: 0.8942, test_f1: 0.6161
 epoch: 31, train_loss: 0.6277, test_loss: 0.8828, test_f1: 0.6422
 epoch: 32, train_loss: 0.5866, test_loss: 0.9193, test_f1: 0.6347
 epoch: 33, train_loss: 0.5842, test_loss: 0.8299, test_f1: 0.6417
 epoch: 34, train_loss: 0.5878, test_loss: 1.0449, test_f1: 0.5706
 epoch: 35, train_loss: 0.5698, test_loss: 0.8919, test_f1: 0.6243
 epoch: 36, train_loss: 0.5766, test_loss: 0.9265, test_f1: 0.5960
 epoch: 37, train_loss: 0.5630, test_loss: 0.9728, test_f1: 0.6164
 epoch: 38, train_loss: 0.5519, test_loss: 0.8478, test_f1: 0.6484
 epoch: 39, train_loss: 0.5543, test_loss: 0.7372, test_f1: 0.6377
 epoch: 40, train_loss: 0.5269, test_loss: 0.9552, test_f1: 0.6110
 epoch: 41, train_loss: 0.5614, test_loss: 0.7955, test_f1: 0.6654
 epoch: 42, train_loss: 0.5393, test_loss: 1.0839, test_f1: 0.5795
 epoch: 43, train_loss: 0.5238, test_loss: 0.9696, test_f1: 0.6254
 epoch: 44, train_loss: 0.5221, test_loss: 0.9188, test_f1: 0.6405
 epoch: 45, train_loss: 0.5454, test_loss: 0.8441, test_f1: 0.6021
 epoch: 46, train_loss: 0.5246, test_loss: 0.6791, test_f1: 0.6858
 epoch: 47, train_loss: 0.5039, test_loss: 0.8496, test_f1: 0.6592
 epoch: 48, train_loss: 0.4997, test_loss: 1.0156, test_f1: 0.5872
 epoch: 49, train_loss: 0.5008, test_loss: 0.9573, test_f1: 0.6372
 epoch: 50, train_loss: 0.5166, test_loss: 0.8356, test_f1: 0.6574
 epoch: 51, train_loss: 0.5077, test_loss: 0.7668, test_f1: 0.6568
 epoch: 52, train_loss: 0.4358, test_loss: 0.8776, test_f1: 0.6736
 epoch: 53, train_loss: 0.4106, test_loss: 0.8729, test_f1: 0.6761
 epoch: 54, train_loss: 0.3991, test_loss: 0.8469, test_f1: 0.6801
 epoch: 55, train_loss: 0.4026, test_loss: 0.9618, test_f1: 0.6735
 epoch: 56, train_loss: 0.3814, test_loss: 0.9441, test_f1: 0.6633
 epoch: 57, train_loss: 0.3524, test_loss: 1.0173, test_f1: 0.6545
 epoch: 58, train_loss: 0.3764, test_loss: 0.9033, test_f1: 0.6771
 epoch: 59, train_loss: 0.3711, test_loss: 0.9883, test_f1: 0.6433
 epoch: 60, train_loss: 0.3460, test_loss: 0.9943, test_f1: 0.6649
 epoch: 61, train_loss: 0.3587, test_loss: 0.9859, test_f1: 0.6736
 epoch: 62, train_loss: 0.3597, test_loss: 0.9426, test_f1: 0.6681
 epoch: 63, train_loss: 0.3488, test_loss: 1.0007, test_f1: 0.6624
 epoch: 64, train_loss: 0.3376, test_loss: 1.0582, test_f1: 0.6548
 epoch: 65, train_loss: 0.3687, test_loss: 1.0900, test_f1: 0.6415
 epoch: 66, train_loss: 0.3547, test_loss: 1.0958, test_f1: 0.6742
 epoch: 67, train_loss: 0.3410, test_loss: 0.9838, test_f1: 0.6653
 epoch: 68, train_loss: 0.3354, test_loss: 0.9645, test_f1: 0.6603
 epoch: 69, train_loss: 0.3287, test_loss: 1.0082, test_f1: 0.6618
 epoch: 70, train_loss: 0.3311, test_loss: 1.0916, test_f1: 0.6557
 epoch: 71, train_loss: 0.3169, test_loss: 1.0282, test_f1: 0.6769
 epoch: 72, train_loss: 0.3245, test_loss: 1.1057, test_f1: 0.6512
 epoch: 73, train_loss: 0.3196, test_loss: 1.2020, test_f1: 0.6559
 epoch: 74, train_loss: 0.3003, test_loss: 1.0407, test_f1: 0.6735
 epoch: 75, train_loss: 0.3272, test_loss: 1.0781, test_f1: 0.6344
 epoch: 76, train_loss: 0.3083, test_loss: 1.0722, test_f1: 0.6748
 epoch: 77, train_loss: 0.3142, test_loss: 1.0162, test_f1: 0.6905
 epoch: 78, train_loss: 0.3064, test_loss: 1.0419, test_f1: 0.6659
 epoch: 79, train_loss: 0.2942, test_loss: 1.2623, test_f1: 0.6471
 epoch: 80, train_loss: 0.2873, test_loss: 1.0001, test_f1: 0.6797
 epoch: 81, train_loss: 0.2982, test_loss: 1.0169, test_f1: 0.6535
 epoch: 82, train_loss: 0.3128, test_loss: 1.2691, test_f1: 0.6499
 epoch: 83, train_loss: 0.3068, test_loss: 1.1582, test_f1: 0.6414
 epoch: 84, train_loss: 0.2888, test_loss: 1.0076, test_f1: 0.6658
 epoch: 85, train_loss: 0.2908, test_loss: 1.0967, test_f1: 0.6976
 epoch: 86, train_loss: 0.3055, test_loss: 1.0596, test_f1: 0.6784
 epoch: 87, train_loss: 0.2807, test_loss: 1.0997, test_f1: 0.6974
 epoch: 88, train_loss: 0.2886, test_loss: 1.1386, test_f1: 0.6463
 epoch: 89, train_loss: 0.2522, test_loss: 1.2060, test_f1: 0.6575
 epoch: 90, train_loss: 0.2540, test_loss: 1.0461, test_f1: 0.6774
 epoch: 91, train_loss: 0.2701, test_loss: 1.2451, test_f1: 0.6416
 epoch: 92, train_loss: 0.2892, test_loss: 1.0835, test_f1: 0.6990
 epoch: 93, train_loss: 0.2734, test_loss: 1.2217, test_f1: 0.6743
 epoch: 94, train_loss: 0.2573, test_loss: 1.3519, test_f1: 0.6602
 epoch: 95, train_loss: 0.2651, test_loss: 1.2241, test_f1: 0.6509
 epoch: 96, train_loss: 0.2642, test_loss: 1.2879, test_f1: 0.6716
 epoch: 97, train_loss: 0.2565, test_loss: 1.2533, test_f1: 0.6756
 epoch: 98, train_loss: 0.2694, test_loss: 1.2838, test_f1: 0.6785
 epoch: 99, train_loss: 0.2644, test_loss: 1.1924, test_f1: 0.6927
##################ITERATION #8 ****************************************
 epoch: 0, train_loss: 2.2779, test_loss: 1.6335, test_f1: 0.2270
 epoch: 1, train_loss: 1.0762, test_loss: 1.1841, test_f1: 0.3238
 epoch: 2, train_loss: 1.0038, test_loss: 1.0642, test_f1: 0.3850
 epoch: 3, train_loss: 0.9708, test_loss: 0.9994, test_f1: 0.4912
 epoch: 4, train_loss: 0.9539, test_loss: 1.0179, test_f1: 0.4831
 epoch: 5, train_loss: 0.9450, test_loss: 0.9904, test_f1: 0.5236
 epoch: 6, train_loss: 0.9278, test_loss: 1.0053, test_f1: 0.4945
 epoch: 7, train_loss: 0.9015, test_loss: 0.9741, test_f1: 0.5174
 epoch: 8, train_loss: 0.8994, test_loss: 0.9584, test_f1: 0.5538
 epoch: 9, train_loss: 0.8726, test_loss: 1.0175, test_f1: 0.5324
 epoch: 10, train_loss: 0.8715, test_loss: 0.9647, test_f1: 0.5683
 epoch: 11, train_loss: 0.8824, test_loss: 1.1450, test_f1: 0.5318
 epoch: 12, train_loss: 0.8515, test_loss: 0.9378, test_f1: 0.5752
 epoch: 13, train_loss: 0.8555, test_loss: 1.0173, test_f1: 0.5442
 epoch: 14, train_loss: 0.8300, test_loss: 1.0053, test_f1: 0.5171
 epoch: 15, train_loss: 0.8090, test_loss: 0.9424, test_f1: 0.5333
 epoch: 16, train_loss: 0.7951, test_loss: 0.9673, test_f1: 0.5660
 epoch: 17, train_loss: 0.8031, test_loss: 0.9872, test_f1: 0.6002
 epoch: 18, train_loss: 0.7789, test_loss: 0.9580, test_f1: 0.6220
 epoch: 19, train_loss: 0.7744, test_loss: 0.9217, test_f1: 0.5937
 epoch: 20, train_loss: 0.7533, test_loss: 1.0829, test_f1: 0.5450
 epoch: 21, train_loss: 0.7490, test_loss: 0.9301, test_f1: 0.5863
 epoch: 22, train_loss: 0.7369, test_loss: 0.8766, test_f1: 0.5992
 epoch: 23, train_loss: 0.7157, test_loss: 1.0286, test_f1: 0.5776
 epoch: 24, train_loss: 0.7240, test_loss: 0.9152, test_f1: 0.5885
 epoch: 25, train_loss: 0.7145, test_loss: 1.2418, test_f1: 0.5342
 epoch: 26, train_loss: 0.7038, test_loss: 0.9530, test_f1: 0.5734
 epoch: 27, train_loss: 0.6897, test_loss: 1.1251, test_f1: 0.5632
 epoch: 28, train_loss: 0.6914, test_loss: 1.1606, test_f1: 0.5395
 epoch: 29, train_loss: 0.6975, test_loss: 1.0551, test_f1: 0.5307
 epoch: 30, train_loss: 0.6804, test_loss: 1.1396, test_f1: 0.5862
 epoch: 31, train_loss: 0.6759, test_loss: 1.1462, test_f1: 0.5870
 epoch: 32, train_loss: 0.6551, test_loss: 1.1657, test_f1: 0.5593
 epoch: 33, train_loss: 0.6831, test_loss: 1.0515, test_f1: 0.6061
 epoch: 34, train_loss: 0.6667, test_loss: 1.0357, test_f1: 0.5722
 epoch: 35, train_loss: 0.6489, test_loss: 1.0522, test_f1: 0.5932
 epoch: 36, train_loss: 0.6269, test_loss: 0.8531, test_f1: 0.6278
 epoch: 37, train_loss: 0.6411, test_loss: 0.9435, test_f1: 0.6187
 epoch: 38, train_loss: 0.6273, test_loss: 0.8531, test_f1: 0.6585
 epoch: 39, train_loss: 0.6041, test_loss: 1.2365, test_f1: 0.5655
 epoch: 40, train_loss: 0.6112, test_loss: 1.3945, test_f1: 0.6041
 epoch: 41, train_loss: 0.6176, test_loss: 0.9076, test_f1: 0.6092
 epoch: 42, train_loss: 0.5913, test_loss: 0.9493, test_f1: 0.6419
 epoch: 43, train_loss: 0.5849, test_loss: 0.9864, test_f1: 0.6073
 epoch: 44, train_loss: 0.5974, test_loss: 1.2187, test_f1: 0.5792
 epoch: 45, train_loss: 0.6194, test_loss: 0.9321, test_f1: 0.6510
 epoch: 46, train_loss: 0.6018, test_loss: 1.0602, test_f1: 0.6577
 epoch: 47, train_loss: 0.5780, test_loss: 1.0240, test_f1: 0.6306
 epoch: 48, train_loss: 0.5685, test_loss: 1.0533, test_f1: 0.5905
 epoch: 49, train_loss: 0.5471, test_loss: 1.2112, test_f1: 0.5851
 epoch: 50, train_loss: 0.5563, test_loss: 1.1405, test_f1: 0.5942
 epoch: 51, train_loss: 0.5528, test_loss: 1.0364, test_f1: 0.6289
 epoch: 52, train_loss: 0.5035, test_loss: 1.1165, test_f1: 0.6339
 epoch: 53, train_loss: 0.4791, test_loss: 0.9938, test_f1: 0.6358
 epoch: 54, train_loss: 0.4830, test_loss: 1.0098, test_f1: 0.6414
 epoch: 55, train_loss: 0.4697, test_loss: 1.1640, test_f1: 0.6290
 epoch: 56, train_loss: 0.4606, test_loss: 1.0713, test_f1: 0.6312
 epoch: 57, train_loss: 0.4454, test_loss: 1.1775, test_f1: 0.6161
 epoch: 58, train_loss: 0.4413, test_loss: 1.0673, test_f1: 0.6220
 epoch: 59, train_loss: 0.4602, test_loss: 1.1088, test_f1: 0.6494
 epoch: 60, train_loss: 0.4620, test_loss: 1.1396, test_f1: 0.6319
 epoch: 61, train_loss: 0.4251, test_loss: 1.0707, test_f1: 0.6547
 epoch: 62, train_loss: 0.4264, test_loss: 1.1365, test_f1: 0.6336
 epoch: 63, train_loss: 0.4047, test_loss: 1.2789, test_f1: 0.6130
 epoch: 64, train_loss: 0.4082, test_loss: 1.2891, test_f1: 0.6296
 epoch: 65, train_loss: 0.3882, test_loss: 1.2522, test_f1: 0.6594
 epoch: 66, train_loss: 0.3847, test_loss: 1.1437, test_f1: 0.6448
 epoch: 67, train_loss: 0.4006, test_loss: 1.3620, test_f1: 0.6448
 epoch: 68, train_loss: 0.4065, test_loss: 1.1592, test_f1: 0.6529
 epoch: 69, train_loss: 0.3924, test_loss: 1.5185, test_f1: 0.6571
 epoch: 70, train_loss: 0.3948, test_loss: 1.5915, test_f1: 0.6503
 epoch: 71, train_loss: 0.3793, test_loss: 1.0129, test_f1: 0.6495
 epoch: 72, train_loss: 0.3598, test_loss: 1.4568, test_f1: 0.6451
 epoch: 73, train_loss: 0.3766, test_loss: 1.2886, test_f1: 0.6419
 epoch: 74, train_loss: 0.3647, test_loss: 1.3694, test_f1: 0.6683
 epoch: 75, train_loss: 0.3626, test_loss: 1.4754, test_f1: 0.6294
 epoch: 76, train_loss: 0.3689, test_loss: 1.2915, test_f1: 0.6596
 epoch: 77, train_loss: 0.3539, test_loss: 1.5228, test_f1: 0.6429
 epoch: 78, train_loss: 0.3778, test_loss: 1.3831, test_f1: 0.6145
 epoch: 79, train_loss: 0.3730, test_loss: 1.2780, test_f1: 0.6327
 epoch: 80, train_loss: 0.3561, test_loss: 1.8495, test_f1: 0.6284
 epoch: 81, train_loss: 0.3500, test_loss: 1.4831, test_f1: 0.6436
 epoch: 82, train_loss: 0.3559, test_loss: 1.2505, test_f1: 0.6422
 epoch: 83, train_loss: 0.3498, test_loss: 1.1243, test_f1: 0.6361
 epoch: 84, train_loss: 0.3407, test_loss: 1.2413, test_f1: 0.6243
 epoch: 85, train_loss: 0.3294, test_loss: 1.4563, test_f1: 0.6456
 epoch: 86, train_loss: 0.3269, test_loss: 1.4613, test_f1: 0.6374
 epoch: 87, train_loss: 0.3302, test_loss: 1.5996, test_f1: 0.6141
 epoch: 88, train_loss: 0.3243, test_loss: 1.5294, test_f1: 0.6504
 epoch: 89, train_loss: 0.3419, test_loss: 1.6941, test_f1: 0.6216
 epoch: 90, train_loss: 0.3602, test_loss: 1.4403, test_f1: 0.6649
 epoch: 91, train_loss: 0.3432, test_loss: 1.1233, test_f1: 0.6627
 epoch: 92, train_loss: 0.3280, test_loss: 1.6680, test_f1: 0.6275
 epoch: 93, train_loss: 0.3328, test_loss: 1.5261, test_f1: 0.6388
 epoch: 94, train_loss: 0.3286, test_loss: 1.7345, test_f1: 0.6536
 epoch: 95, train_loss: 0.3046, test_loss: 1.6792, test_f1: 0.6638
 epoch: 96, train_loss: 0.3029, test_loss: 1.5236, test_f1: 0.6562
 epoch: 97, train_loss: 0.3212, test_loss: 1.3400, test_f1: 0.6599
 epoch: 98, train_loss: 0.3126, test_loss: 1.3104, test_f1: 0.6315
 epoch: 99, train_loss: 0.2908, test_loss: 1.7911, test_f1: 0.6339
##################ITERATION #9 ****************************************
 epoch: 0, train_loss: 1.9216, test_loss: 1.7469, test_f1: 0.2270
 epoch: 1, train_loss: 1.0920, test_loss: 1.4103, test_f1: 0.3120
 epoch: 2, train_loss: 1.0237, test_loss: 1.1017, test_f1: 0.4516
 epoch: 3, train_loss: 1.0068, test_loss: 1.1431, test_f1: 0.4683
 epoch: 4, train_loss: 0.9742, test_loss: 0.9908, test_f1: 0.5094
 epoch: 5, train_loss: 0.9352, test_loss: 0.9197, test_f1: 0.4951
 epoch: 6, train_loss: 0.9335, test_loss: 0.9836, test_f1: 0.4922
 epoch: 7, train_loss: 0.8953, test_loss: 0.9124, test_f1: 0.5209
 epoch: 8, train_loss: 0.8766, test_loss: 0.9889, test_f1: 0.5237
 epoch: 9, train_loss: 0.8702, test_loss: 0.8681, test_f1: 0.5463
 epoch: 10, train_loss: 0.8734, test_loss: 0.8715, test_f1: 0.5644
 epoch: 11, train_loss: 0.8524, test_loss: 0.9489, test_f1: 0.4988
 epoch: 12, train_loss: 0.8456, test_loss: 1.0205, test_f1: 0.5290
 epoch: 13, train_loss: 0.8348, test_loss: 0.9272, test_f1: 0.5061
 epoch: 14, train_loss: 0.8057, test_loss: 0.8603, test_f1: 0.5781
 epoch: 15, train_loss: 0.7969, test_loss: 1.0303, test_f1: 0.4739
 epoch: 16, train_loss: 0.7834, test_loss: 0.9481, test_f1: 0.5367
 epoch: 17, train_loss: 0.7654, test_loss: 0.8411, test_f1: 0.5895
 epoch: 18, train_loss: 0.7542, test_loss: 0.7892, test_f1: 0.5908
 epoch: 19, train_loss: 0.7663, test_loss: 0.9389, test_f1: 0.5734
 epoch: 20, train_loss: 0.7560, test_loss: 0.8179, test_f1: 0.5816
 epoch: 21, train_loss: 0.7266, test_loss: 0.8261, test_f1: 0.5696
 epoch: 22, train_loss: 0.7194, test_loss: 0.7990, test_f1: 0.5658
 epoch: 23, train_loss: 0.7072, test_loss: 0.8658, test_f1: 0.5574
 epoch: 24, train_loss: 0.6982, test_loss: 0.8393, test_f1: 0.6273
 epoch: 25, train_loss: 0.7107, test_loss: 0.9794, test_f1: 0.5773
 epoch: 26, train_loss: 0.6859, test_loss: 0.8059, test_f1: 0.5985
 epoch: 27, train_loss: 0.6759, test_loss: 0.8256, test_f1: 0.5781
 epoch: 28, train_loss: 0.6649, test_loss: 0.7885, test_f1: 0.6410
 epoch: 29, train_loss: 0.6676, test_loss: 0.8730, test_f1: 0.5735
 epoch: 30, train_loss: 0.6541, test_loss: 0.8028, test_f1: 0.6278
 epoch: 31, train_loss: 0.6494, test_loss: 0.7661, test_f1: 0.6301
 epoch: 32, train_loss: 0.6589, test_loss: 0.9115, test_f1: 0.5535
 epoch: 33, train_loss: 0.6223, test_loss: 0.8781, test_f1: 0.5772
 epoch: 34, train_loss: 0.6294, test_loss: 0.8817, test_f1: 0.6243
 epoch: 35, train_loss: 0.6239, test_loss: 0.9030, test_f1: 0.5938
 epoch: 36, train_loss: 0.6154, test_loss: 0.8321, test_f1: 0.6255
 epoch: 37, train_loss: 0.6145, test_loss: 0.7846, test_f1: 0.6634
 epoch: 38, train_loss: 0.5915, test_loss: 0.8205, test_f1: 0.6238
 epoch: 39, train_loss: 0.5898, test_loss: 0.8929, test_f1: 0.5940
 epoch: 40, train_loss: 0.5657, test_loss: 0.7460, test_f1: 0.6561
 epoch: 41, train_loss: 0.5590, test_loss: 0.8856, test_f1: 0.5866
 epoch: 42, train_loss: 0.5515, test_loss: 0.8317, test_f1: 0.6005
 epoch: 43, train_loss: 0.5487, test_loss: 0.7542, test_f1: 0.6645
 epoch: 44, train_loss: 0.5377, test_loss: 0.9441, test_f1: 0.6148
 epoch: 45, train_loss: 0.5643, test_loss: 0.8046, test_f1: 0.6100
 epoch: 46, train_loss: 0.5824, test_loss: 1.0135, test_f1: 0.5809
 epoch: 47, train_loss: 0.5639, test_loss: 1.0354, test_f1: 0.5551
 epoch: 48, train_loss: 0.5657, test_loss: 0.8302, test_f1: 0.6334
 epoch: 49, train_loss: 0.5124, test_loss: 0.8362, test_f1: 0.6358
 epoch: 50, train_loss: 0.5076, test_loss: 0.9733, test_f1: 0.5967
 epoch: 51, train_loss: 0.4936, test_loss: 0.8023, test_f1: 0.6691
 epoch: 52, train_loss: 0.4582, test_loss: 0.8456, test_f1: 0.6667
 epoch: 53, train_loss: 0.4259, test_loss: 0.7896, test_f1: 0.6751
 epoch: 54, train_loss: 0.4352, test_loss: 0.8224, test_f1: 0.6581
 epoch: 55, train_loss: 0.4114, test_loss: 0.8147, test_f1: 0.6531
 epoch: 56, train_loss: 0.3993, test_loss: 0.8604, test_f1: 0.6406
 epoch: 57, train_loss: 0.4051, test_loss: 0.8008, test_f1: 0.6751
 epoch: 58, train_loss: 0.4226, test_loss: 0.8655, test_f1: 0.6378
 epoch: 59, train_loss: 0.3971, test_loss: 0.8451, test_f1: 0.6291
 epoch: 60, train_loss: 0.3801, test_loss: 1.0366, test_f1: 0.6642
 epoch: 61, train_loss: 0.3729, test_loss: 1.0242, test_f1: 0.6426
 epoch: 62, train_loss: 0.3843, test_loss: 0.7847, test_f1: 0.6577
 epoch: 63, train_loss: 0.3776, test_loss: 0.9765, test_f1: 0.6245
 epoch: 64, train_loss: 0.3777, test_loss: 1.1405, test_f1: 0.6632
 epoch: 65, train_loss: 0.3733, test_loss: 0.9187, test_f1: 0.6601
 epoch: 66, train_loss: 0.3866, test_loss: 0.9037, test_f1: 0.6756
 epoch: 67, train_loss: 0.3953, test_loss: 1.0016, test_f1: 0.6106
 epoch: 68, train_loss: 0.3744, test_loss: 0.9653, test_f1: 0.6392
 epoch: 69, train_loss: 0.3597, test_loss: 1.0597, test_f1: 0.6512
 epoch: 70, train_loss: 0.3412, test_loss: 0.9906, test_f1: 0.6595
 epoch: 71, train_loss: 0.3589, test_loss: 0.9573, test_f1: 0.6646
 epoch: 72, train_loss: 0.3460, test_loss: 1.0694, test_f1: 0.6534
 epoch: 73, train_loss: 0.3557, test_loss: 1.1335, test_f1: 0.6225
 epoch: 74, train_loss: 0.3616, test_loss: 1.1637, test_f1: 0.6071
 epoch: 75, train_loss: 0.3284, test_loss: 1.0239, test_f1: 0.6634
 epoch: 76, train_loss: 0.3541, test_loss: 1.1061, test_f1: 0.6160
 epoch: 77, train_loss: 0.3440, test_loss: 1.1787, test_f1: 0.6246
 epoch: 78, train_loss: 0.3102, test_loss: 1.2179, test_f1: 0.6282
 epoch: 79, train_loss: 0.3345, test_loss: 0.9905, test_f1: 0.6591
 epoch: 80, train_loss: 0.3562, test_loss: 1.0306, test_f1: 0.6421
 epoch: 81, train_loss: 0.3439, test_loss: 1.1189, test_f1: 0.6231
 epoch: 82, train_loss: 0.3252, test_loss: 1.2105, test_f1: 0.6284
 epoch: 83, train_loss: 0.3258, test_loss: 1.0982, test_f1: 0.6245
 epoch: 84, train_loss: 0.2891, test_loss: 1.1829, test_f1: 0.6503
 epoch: 85, train_loss: 0.2968, test_loss: 1.1037, test_f1: 0.6637
 epoch: 86, train_loss: 0.2970, test_loss: 1.1376, test_f1: 0.6568
 epoch: 87, train_loss: 0.2940, test_loss: 1.1602, test_f1: 0.6374
 epoch: 88, train_loss: 0.3218, test_loss: 1.2997, test_f1: 0.6258
 epoch: 89, train_loss: 0.2898, test_loss: 1.2277, test_f1: 0.6456
 epoch: 90, train_loss: 0.2859, test_loss: 1.0631, test_f1: 0.6599
 epoch: 91, train_loss: 0.3042, test_loss: 1.4062, test_f1: 0.6447
 epoch: 92, train_loss: 0.2982, test_loss: 1.3218, test_f1: 0.6206
 epoch: 93, train_loss: 0.2742, test_loss: 1.1879, test_f1: 0.6256
 epoch: 94, train_loss: 0.2846, test_loss: 1.1316, test_f1: 0.6333
 epoch: 95, train_loss: 0.2751, test_loss: 1.5178, test_f1: 0.5880
 epoch: 96, train_loss: 0.2859, test_loss: 1.2277, test_f1: 0.6736
 epoch: 97, train_loss: 0.2831, test_loss: 1.3648, test_f1: 0.6353
 epoch: 98, train_loss: 0.2967, test_loss: 1.1373, test_f1: 0.6321
 epoch: 99, train_loss: 0.3042, test_loss: 1.2721, test_f1: 0.6659

Training completed in 497.69 seconds
Best F1: 0.7120 at epoch 62
Mean F1 across iterations: 0.6928  0.0162
========================FINAL RESULTS================================
FEGIN weighted F1: 0.7120  0.0162
python main.py --data ltspice_examples --representation component_pin_net --model FEGIN --layers 5 --hiddens 128 --batch_size 256 --lr 0.01 --emb_size 512 --epochs 100 --save_appendix component_pin_net_L5_H128_BS256_LR0.01_E512 --no_val
-----



STDERR:
Processing...
Done!
  File "main.py", line 370, in <module>
    main()
  File "main.py", line 254, in main
    dataset = dataset_class(
  File "/home/philip/projects/ltspice_examples_code_repo/Circuit-Completion-Using-GNNs/component_classification_with_link_prediction_head/evaluation/FEGIN/kernel/circuit_datasets.py", line 15, in __init__
    self.data, self.slices = torch.load(self.processed_paths[0])
  File "/home/philip/.local/lib/python3.8/site-packages/torch/serialization.py", line 1040, in load
    warnings.warn(
  File "/usr/lib/python3.8/warnings.py", line 109, in _showwarnmsg
    sw(msg.message, msg.category, msg.filename, msg.lineno,
  File "main.py", line 47, in warn_with_traceback
    traceback.print_stack(file=log)
/home/philip/projects/ltspice_examples_code_repo/Circuit-Completion-Using-GNNs/component_classification_with_link_prediction_head/evaluation/FEGIN/kernel/circuit_datasets.py:15: FutureWarning: You are using `torch.load` with `weights_only=False` (the current default value), which uses the default pickle module implicitly. It is possible to construct malicious pickle data which will execute arbitrary code during unpickling (See https://github.com/pytorch/pytorch/blob/main/SECURITY.md#untrusted-models for more details). In a future release, the default value for `weights_only` will be flipped to `True`. This limits the functions that could be executed during unpickling. Arbitrary objects will no longer be allowed to be loaded via this mode unless they are explicitly allowlisted by the user via `torch.serialization.add_safe_globals`. We recommend you start setting `weights_only=True` for any use case where you don't have full control of the loaded file. Please open an issue on GitHub for any issues related to this experimental feature.
  self.data, self.slices = torch.load(self.processed_paths[0])
