STDOUT:
Results will be saved in /home/philip/projects/ltspice_examples_code_repo/Circuit-Completion-Using-GNNs/component_classification_with_link_prediction_head/evaluation/FEGIN/results/model_FEGIN_dataset_ltspice_demos
Command line input: python main.py --data ltspice_demos --representation component_pin_net --model FEGIN --layers 3 --hiddens 32 --batch_size 64 --lr 0.01 --emb_size 512 --epochs 100 --save_appendix component_pin_net_L3_H32_BS64_LR0.01_E512 --no_val
 is saved.
-----
ltspice_demos - FEGIN
Using 3 layers, 32 hidden units, h = 2
Loading component_pin_net representation dataset
ENTERED
Training FEGIN on component_pin_net representation
Train: 1565, Test: 383
##################ITERATION #0 ****************************************
 epoch: 0, train_loss: 1.2303, test_loss: 1.2489, test_f1: 0.2281
 epoch: 1, train_loss: 1.1087, test_loss: 1.1918, test_f1: 0.2943
 epoch: 2, train_loss: 1.0628, test_loss: 1.1846, test_f1: 0.4444
 epoch: 3, train_loss: 1.0058, test_loss: 1.0753, test_f1: 0.4815
 epoch: 4, train_loss: 0.9879, test_loss: 1.0360, test_f1: 0.5139
 epoch: 5, train_loss: 0.9613, test_loss: 1.1139, test_f1: 0.4430
 epoch: 6, train_loss: 0.9407, test_loss: 1.0784, test_f1: 0.4705
 epoch: 7, train_loss: 0.9180, test_loss: 1.1215, test_f1: 0.4388
 epoch: 8, train_loss: 0.9083, test_loss: 1.0489, test_f1: 0.5425
 epoch: 9, train_loss: 0.9161, test_loss: 1.0558, test_f1: 0.5057
 epoch: 10, train_loss: 0.8781, test_loss: 1.0902, test_f1: 0.4230
 epoch: 11, train_loss: 0.8567, test_loss: 0.9491, test_f1: 0.4901
 epoch: 12, train_loss: 0.8544, test_loss: 1.0695, test_f1: 0.5699
 epoch: 13, train_loss: 0.8238, test_loss: 1.4431, test_f1: 0.4545
 epoch: 14, train_loss: 0.8445, test_loss: 1.2710, test_f1: 0.3860
 epoch: 15, train_loss: 0.8122, test_loss: 1.1814, test_f1: 0.5196
 epoch: 16, train_loss: 0.8165, test_loss: 1.7745, test_f1: 0.3622
 epoch: 17, train_loss: 0.8040, test_loss: 1.0597, test_f1: 0.5112
 epoch: 18, train_loss: 0.7909, test_loss: 1.0099, test_f1: 0.5242
 epoch: 19, train_loss: 0.7868, test_loss: 0.9907, test_f1: 0.5246
 epoch: 20, train_loss: 0.7896, test_loss: 0.9501, test_f1: 0.5963
 epoch: 21, train_loss: 0.7592, test_loss: 1.0356, test_f1: 0.4915
 epoch: 22, train_loss: 0.7340, test_loss: 1.4787, test_f1: 0.4580
 epoch: 23, train_loss: 0.7557, test_loss: 0.9733, test_f1: 0.5272
 epoch: 24, train_loss: 0.7222, test_loss: 1.1813, test_f1: 0.5622
 epoch: 25, train_loss: 0.7126, test_loss: 1.0327, test_f1: 0.5246
 epoch: 26, train_loss: 0.7154, test_loss: 1.0113, test_f1: 0.5755
 epoch: 27, train_loss: 0.7128, test_loss: 1.0803, test_f1: 0.5118
 epoch: 28, train_loss: 0.6925, test_loss: 1.5211, test_f1: 0.4855
 epoch: 29, train_loss: 0.7514, test_loss: 1.3265, test_f1: 0.5407
 epoch: 30, train_loss: 0.7259, test_loss: 1.3822, test_f1: 0.5097
 epoch: 31, train_loss: 0.6613, test_loss: 1.1263, test_f1: 0.5294
 epoch: 32, train_loss: 0.6510, test_loss: 1.5601, test_f1: 0.4771
 epoch: 33, train_loss: 0.6651, test_loss: 1.0776, test_f1: 0.5273
 epoch: 34, train_loss: 0.6842, test_loss: 1.0084, test_f1: 0.6385
 epoch: 35, train_loss: 0.6663, test_loss: 1.0727, test_f1: 0.5909
 epoch: 36, train_loss: 0.6431, test_loss: 1.3147, test_f1: 0.4742
 epoch: 37, train_loss: 0.6270, test_loss: 1.1369, test_f1: 0.5130
 epoch: 38, train_loss: 0.6465, test_loss: 1.1812, test_f1: 0.5125
 epoch: 39, train_loss: 0.6408, test_loss: 1.1944, test_f1: 0.5502
 epoch: 40, train_loss: 0.6331, test_loss: 1.2407, test_f1: 0.5881
 epoch: 41, train_loss: 0.6277, test_loss: 1.3738, test_f1: 0.4686
 epoch: 42, train_loss: 0.6426, test_loss: 1.0604, test_f1: 0.5704
 epoch: 43, train_loss: 0.6513, test_loss: 1.1507, test_f1: 0.5605
 epoch: 44, train_loss: 0.6260, test_loss: 1.1427, test_f1: 0.5639
 epoch: 45, train_loss: 0.6117, test_loss: 1.5971, test_f1: 0.5825
 epoch: 46, train_loss: 0.6122, test_loss: 1.3531, test_f1: 0.5936
 epoch: 47, train_loss: 0.5851, test_loss: 1.1932, test_f1: 0.5869
 epoch: 48, train_loss: 0.5875, test_loss: 1.3387, test_f1: 0.6375
 epoch: 49, train_loss: 0.5833, test_loss: 1.2781, test_f1: 0.5807
 epoch: 50, train_loss: 0.5761, test_loss: 1.2526, test_f1: 0.5880
 epoch: 51, train_loss: 0.5342, test_loss: 1.3417, test_f1: 0.5863
 epoch: 52, train_loss: 0.5294, test_loss: 1.2143, test_f1: 0.5910
 epoch: 53, train_loss: 0.5105, test_loss: 1.3488, test_f1: 0.6023
 epoch: 54, train_loss: 0.4902, test_loss: 1.5190, test_f1: 0.5899
 epoch: 55, train_loss: 0.4978, test_loss: 1.6370, test_f1: 0.5475
 epoch: 56, train_loss: 0.5114, test_loss: 1.6118, test_f1: 0.5430
 epoch: 57, train_loss: 0.5282, test_loss: 1.3116, test_f1: 0.5557
 epoch: 58, train_loss: 0.4647, test_loss: 1.3327, test_f1: 0.5819
 epoch: 59, train_loss: 0.4821, test_loss: 1.4356, test_f1: 0.5975
 epoch: 60, train_loss: 0.4740, test_loss: 1.6478, test_f1: 0.5674
 epoch: 61, train_loss: 0.4753, test_loss: 1.7207, test_f1: 0.5806
 epoch: 62, train_loss: 0.4886, test_loss: 1.3357, test_f1: 0.6201
 epoch: 63, train_loss: 0.4555, test_loss: 1.5844, test_f1: 0.5815
 epoch: 64, train_loss: 0.4601, test_loss: 1.7009, test_f1: 0.6115
 epoch: 65, train_loss: 0.4459, test_loss: 1.8633, test_f1: 0.5027
 epoch: 66, train_loss: 0.4674, test_loss: 1.4574, test_f1: 0.5672
 epoch: 67, train_loss: 0.4896, test_loss: 1.5212, test_f1: 0.6183
 epoch: 68, train_loss: 0.4812, test_loss: 1.4071, test_f1: 0.6030
 epoch: 69, train_loss: 0.4329, test_loss: 1.5117, test_f1: 0.6243
 epoch: 70, train_loss: 0.4246, test_loss: 1.3913, test_f1: 0.6033
 epoch: 71, train_loss: 0.4718, test_loss: 1.6772, test_f1: 0.5733
 epoch: 72, train_loss: 0.4319, test_loss: 1.3586, test_f1: 0.6339
 epoch: 73, train_loss: 0.4327, test_loss: 1.9054, test_f1: 0.5375
 epoch: 74, train_loss: 0.4504, test_loss: 1.5826, test_f1: 0.6013
 epoch: 75, train_loss: 0.4323, test_loss: 1.4747, test_f1: 0.6320
 epoch: 76, train_loss: 0.4022, test_loss: 1.7850, test_f1: 0.5899
 epoch: 77, train_loss: 0.4256, test_loss: 1.7128, test_f1: 0.5534
 epoch: 78, train_loss: 0.4110, test_loss: 1.9049, test_f1: 0.5738
 epoch: 79, train_loss: 0.4166, test_loss: 1.4279, test_f1: 0.6610
 epoch: 80, train_loss: 0.3929, test_loss: 1.4309, test_f1: 0.6136
 epoch: 81, train_loss: 0.4388, test_loss: 1.6188, test_f1: 0.5940
 epoch: 82, train_loss: 0.4280, test_loss: 1.6461, test_f1: 0.5886
 epoch: 83, train_loss: 0.3938, test_loss: 1.3161, test_f1: 0.6471
 epoch: 84, train_loss: 0.4369, test_loss: 2.0853, test_f1: 0.5796
 epoch: 85, train_loss: 0.3673, test_loss: 1.6803, test_f1: 0.6128
 epoch: 86, train_loss: 0.4194, test_loss: 1.6305, test_f1: 0.5771
 epoch: 87, train_loss: 0.4469, test_loss: 1.5831, test_f1: 0.6502
 epoch: 88, train_loss: 0.4673, test_loss: 1.6417, test_f1: 0.6133
 epoch: 89, train_loss: 0.4383, test_loss: 1.8958, test_f1: 0.5756
 epoch: 90, train_loss: 0.4131, test_loss: 1.8128, test_f1: 0.6045
 epoch: 91, train_loss: 0.4068, test_loss: 1.4588, test_f1: 0.6222
 epoch: 92, train_loss: 0.3960, test_loss: 1.6621, test_f1: 0.6164
 epoch: 93, train_loss: 0.3813, test_loss: 1.6036, test_f1: 0.6194
 epoch: 94, train_loss: 0.4098, test_loss: 1.6009, test_f1: 0.6115
 epoch: 95, train_loss: 0.3871, test_loss: 1.8460, test_f1: 0.6080
 epoch: 96, train_loss: 0.4022, test_loss: 1.5804, test_f1: 0.6114
 epoch: 97, train_loss: 0.4003, test_loss: 1.6831, test_f1: 0.6319
 epoch: 98, train_loss: 0.3888, test_loss: 1.6384, test_f1: 0.6095
 epoch: 99, train_loss: 0.3616, test_loss: 1.5676, test_f1: 0.6395
##################ITERATION #1 ****************************************
 epoch: 0, train_loss: 1.0890, test_loss: 1.4030, test_f1: 0.3313
 epoch: 1, train_loss: 0.9800, test_loss: 1.0903, test_f1: 0.4754
 epoch: 2, train_loss: 0.9302, test_loss: 1.0636, test_f1: 0.5019
 epoch: 3, train_loss: 0.8961, test_loss: 1.0081, test_f1: 0.5485
 epoch: 4, train_loss: 0.8873, test_loss: 1.0698, test_f1: 0.5495
 epoch: 5, train_loss: 0.8555, test_loss: 0.9543, test_f1: 0.5505
 epoch: 6, train_loss: 0.8563, test_loss: 1.1511, test_f1: 0.4083
 epoch: 7, train_loss: 0.8377, test_loss: 0.9912, test_f1: 0.5746
 epoch: 8, train_loss: 0.8378, test_loss: 1.0162, test_f1: 0.5443
 epoch: 9, train_loss: 0.8028, test_loss: 1.0444, test_f1: 0.5364
 epoch: 10, train_loss: 0.8012, test_loss: 0.9777, test_f1: 0.5273
 epoch: 11, train_loss: 0.8160, test_loss: 1.2575, test_f1: 0.4794
 epoch: 12, train_loss: 0.8318, test_loss: 1.3320, test_f1: 0.4127
 epoch: 13, train_loss: 0.8073, test_loss: 1.3030, test_f1: 0.4469
 epoch: 14, train_loss: 0.8276, test_loss: 1.0842, test_f1: 0.5553
 epoch: 15, train_loss: 0.8100, test_loss: 1.0238, test_f1: 0.5523
 epoch: 16, train_loss: 0.8069, test_loss: 1.0660, test_f1: 0.5418
 epoch: 17, train_loss: 0.7711, test_loss: 0.9546, test_f1: 0.6244
 epoch: 18, train_loss: 0.7738, test_loss: 1.1231, test_f1: 0.5921
 epoch: 19, train_loss: 0.7591, test_loss: 1.0853, test_f1: 0.5536
 epoch: 20, train_loss: 0.7590, test_loss: 1.0466, test_f1: 0.5796
 epoch: 21, train_loss: 0.7873, test_loss: 1.5288, test_f1: 0.4031
 epoch: 22, train_loss: 0.7700, test_loss: 1.1202, test_f1: 0.5061
 epoch: 23, train_loss: 0.7562, test_loss: 1.4345, test_f1: 0.5014
 epoch: 24, train_loss: 0.7553, test_loss: 1.0348, test_f1: 0.5836
 epoch: 25, train_loss: 0.7351, test_loss: 1.0344, test_f1: 0.5618
 epoch: 26, train_loss: 0.7183, test_loss: 1.1104, test_f1: 0.5766
 epoch: 27, train_loss: 0.7213, test_loss: 1.0735, test_f1: 0.5685
 epoch: 28, train_loss: 0.7242, test_loss: 1.0430, test_f1: 0.6067
 epoch: 29, train_loss: 0.7076, test_loss: 1.0348, test_f1: 0.5403
 epoch: 30, train_loss: 0.6933, test_loss: 1.3666, test_f1: 0.5603
 epoch: 31, train_loss: 0.6831, test_loss: 1.1360, test_f1: 0.5777
 epoch: 32, train_loss: 0.6824, test_loss: 1.8525, test_f1: 0.5373
 epoch: 33, train_loss: 0.7080, test_loss: 1.0191, test_f1: 0.6041
 epoch: 34, train_loss: 0.7069, test_loss: 1.3358, test_f1: 0.5563
 epoch: 35, train_loss: 0.6958, test_loss: 1.2180, test_f1: 0.5565
 epoch: 36, train_loss: 0.6788, test_loss: 1.1431, test_f1: 0.5510
 epoch: 37, train_loss: 0.6777, test_loss: 1.1491, test_f1: 0.5820
 epoch: 38, train_loss: 0.6955, test_loss: 1.4394, test_f1: 0.4734
 epoch: 39, train_loss: 0.6920, test_loss: 1.4977, test_f1: 0.5826
 epoch: 40, train_loss: 0.6876, test_loss: 1.1729, test_f1: 0.5654
 epoch: 41, train_loss: 0.6791, test_loss: 1.3811, test_f1: 0.5611
 epoch: 42, train_loss: 0.6585, test_loss: 1.3466, test_f1: 0.5027
 epoch: 43, train_loss: 0.6410, test_loss: 1.2868, test_f1: 0.6026
 epoch: 44, train_loss: 0.6684, test_loss: 1.3657, test_f1: 0.5640
 epoch: 45, train_loss: 0.6338, test_loss: 1.3238, test_f1: 0.4959
 epoch: 46, train_loss: 0.6609, test_loss: 1.6121, test_f1: 0.5509
 epoch: 47, train_loss: 0.6675, test_loss: 1.2409, test_f1: 0.5975
 epoch: 48, train_loss: 0.6479, test_loss: 1.1905, test_f1: 0.5618
 epoch: 49, train_loss: 0.6718, test_loss: 1.1097, test_f1: 0.5554
 epoch: 50, train_loss: 0.6378, test_loss: 1.3351, test_f1: 0.5930
 epoch: 51, train_loss: 0.6152, test_loss: 1.2698, test_f1: 0.5974
 epoch: 52, train_loss: 0.5850, test_loss: 1.1649, test_f1: 0.6188
 epoch: 53, train_loss: 0.5845, test_loss: 1.3176, test_f1: 0.6229
 epoch: 54, train_loss: 0.6106, test_loss: 1.3398, test_f1: 0.6119
 epoch: 55, train_loss: 0.5822, test_loss: 1.1964, test_f1: 0.6101
 epoch: 56, train_loss: 0.5709, test_loss: 1.2639, test_f1: 0.5642
 epoch: 57, train_loss: 0.6017, test_loss: 1.1392, test_f1: 0.6380
 epoch: 58, train_loss: 0.5807, test_loss: 1.4443, test_f1: 0.6192
 epoch: 59, train_loss: 0.5451, test_loss: 1.2639, test_f1: 0.6345
 epoch: 60, train_loss: 0.5368, test_loss: 1.3221, test_f1: 0.6194
 epoch: 61, train_loss: 0.5421, test_loss: 1.4512, test_f1: 0.6398
 epoch: 62, train_loss: 0.5623, test_loss: 1.4567, test_f1: 0.6433
 epoch: 63, train_loss: 0.5543, test_loss: 1.3159, test_f1: 0.6103
 epoch: 64, train_loss: 0.5419, test_loss: 1.5956, test_f1: 0.6096
 epoch: 65, train_loss: 0.5593, test_loss: 1.4284, test_f1: 0.6121
 epoch: 66, train_loss: 0.5662, test_loss: 1.3599, test_f1: 0.6121
 epoch: 67, train_loss: 0.5774, test_loss: 1.2883, test_f1: 0.5984
 epoch: 68, train_loss: 0.5371, test_loss: 1.3396, test_f1: 0.6130
 epoch: 69, train_loss: 0.5235, test_loss: 1.3112, test_f1: 0.6224
 epoch: 70, train_loss: 0.5413, test_loss: 1.3207, test_f1: 0.6243
 epoch: 71, train_loss: 0.5234, test_loss: 1.4259, test_f1: 0.6345
 epoch: 72, train_loss: 0.5128, test_loss: 1.7732, test_f1: 0.6053
 epoch: 73, train_loss: 0.5453, test_loss: 1.5501, test_f1: 0.6119
 epoch: 74, train_loss: 0.5417, test_loss: 1.5538, test_f1: 0.5770
 epoch: 75, train_loss: 0.5339, test_loss: 1.5360, test_f1: 0.6299
 epoch: 76, train_loss: 0.5323, test_loss: 1.3365, test_f1: 0.5508
 epoch: 77, train_loss: 0.4911, test_loss: 1.6175, test_f1: 0.6092
 epoch: 78, train_loss: 0.4856, test_loss: 1.7438, test_f1: 0.5999
 epoch: 79, train_loss: 0.4916, test_loss: 1.6928, test_f1: 0.6114
 epoch: 80, train_loss: 0.4775, test_loss: 1.4661, test_f1: 0.5950
 epoch: 81, train_loss: 0.5179, test_loss: 1.6630, test_f1: 0.5770
 epoch: 82, train_loss: 0.5312, test_loss: 1.5648, test_f1: 0.5638
 epoch: 83, train_loss: 0.4975, test_loss: 1.4399, test_f1: 0.5544
 epoch: 84, train_loss: 0.5144, test_loss: 1.4590, test_f1: 0.5596
 epoch: 85, train_loss: 0.5120, test_loss: 1.3578, test_f1: 0.6026
 epoch: 86, train_loss: 0.5106, test_loss: 1.5345, test_f1: 0.6086
 epoch: 87, train_loss: 0.5271, test_loss: 2.0428, test_f1: 0.6096
 epoch: 88, train_loss: 0.5233, test_loss: 1.5676, test_f1: 0.5480
 epoch: 89, train_loss: 0.5008, test_loss: 1.7669, test_f1: 0.5501
 epoch: 90, train_loss: 0.4482, test_loss: 1.6253, test_f1: 0.5578
 epoch: 91, train_loss: 0.4913, test_loss: 1.5343, test_f1: 0.5927
 epoch: 92, train_loss: 0.4700, test_loss: 2.0988, test_f1: 0.5657
 epoch: 93, train_loss: 0.4735, test_loss: 1.8418, test_f1: 0.5586
 epoch: 94, train_loss: 0.4717, test_loss: 1.8356, test_f1: 0.5959
 epoch: 95, train_loss: 0.4781, test_loss: 1.7428, test_f1: 0.6002
 epoch: 96, train_loss: 0.4684, test_loss: 1.4223, test_f1: 0.5866
 epoch: 97, train_loss: 0.4400, test_loss: 1.8122, test_f1: 0.5846
 epoch: 98, train_loss: 0.4346, test_loss: 1.5962, test_f1: 0.6321
 epoch: 99, train_loss: 0.4596, test_loss: 1.8194, test_f1: 0.5956
##################ITERATION #2 ****************************************
 epoch: 0, train_loss: 1.1149, test_loss: 1.3515, test_f1: 0.2732
 epoch: 1, train_loss: 0.9838, test_loss: 1.0992, test_f1: 0.5423
 epoch: 2, train_loss: 0.9312, test_loss: 1.0278, test_f1: 0.5360
 epoch: 3, train_loss: 0.8800, test_loss: 1.0834, test_f1: 0.5068
 epoch: 4, train_loss: 0.8661, test_loss: 1.0001, test_f1: 0.5264
 epoch: 5, train_loss: 0.8553, test_loss: 1.0549, test_f1: 0.5219
 epoch: 6, train_loss: 0.8491, test_loss: 1.3505, test_f1: 0.3931
 epoch: 7, train_loss: 0.8511, test_loss: 1.6098, test_f1: 0.3948
 epoch: 8, train_loss: 0.8135, test_loss: 1.0279, test_f1: 0.5617
 epoch: 9, train_loss: 0.7745, test_loss: 1.1454, test_f1: 0.4994
 epoch: 10, train_loss: 0.7861, test_loss: 1.0355, test_f1: 0.5368
 epoch: 11, train_loss: 0.7799, test_loss: 1.0564, test_f1: 0.5626
 epoch: 12, train_loss: 0.7735, test_loss: 1.3190, test_f1: 0.5090
 epoch: 13, train_loss: 0.7709, test_loss: 1.0373, test_f1: 0.4747
 epoch: 14, train_loss: 0.7871, test_loss: 1.0042, test_f1: 0.5468
 epoch: 15, train_loss: 0.7706, test_loss: 1.3078, test_f1: 0.5524
 epoch: 16, train_loss: 0.7449, test_loss: 1.3126, test_f1: 0.4245
 epoch: 17, train_loss: 0.7607, test_loss: 1.2050, test_f1: 0.5186
 epoch: 18, train_loss: 0.7276, test_loss: 1.1364, test_f1: 0.5560
 epoch: 19, train_loss: 0.7105, test_loss: 1.1745, test_f1: 0.5548
 epoch: 20, train_loss: 0.6854, test_loss: 1.1140, test_f1: 0.5343
 epoch: 21, train_loss: 0.7014, test_loss: 1.1794, test_f1: 0.5469
 epoch: 22, train_loss: 0.7044, test_loss: 1.0345, test_f1: 0.6082
 epoch: 23, train_loss: 0.7384, test_loss: 1.0495, test_f1: 0.5575
 epoch: 24, train_loss: 0.6895, test_loss: 1.3021, test_f1: 0.4756
 epoch: 25, train_loss: 0.6846, test_loss: 1.1430, test_f1: 0.5545
 epoch: 26, train_loss: 0.6635, test_loss: 1.0286, test_f1: 0.6340
 epoch: 27, train_loss: 0.6608, test_loss: 1.2578, test_f1: 0.5585
 epoch: 28, train_loss: 0.6495, test_loss: 1.2813, test_f1: 0.5031
 epoch: 29, train_loss: 0.6601, test_loss: 1.1692, test_f1: 0.5915
 epoch: 30, train_loss: 0.6382, test_loss: 1.0860, test_f1: 0.5836
 epoch: 31, train_loss: 0.6663, test_loss: 1.2311, test_f1: 0.4873
 epoch: 32, train_loss: 0.6578, test_loss: 1.9648, test_f1: 0.4324
 epoch: 33, train_loss: 0.6329, test_loss: 1.3870, test_f1: 0.5637
 epoch: 34, train_loss: 0.6651, test_loss: 1.1192, test_f1: 0.5222
 epoch: 35, train_loss: 0.6214, test_loss: 1.3511, test_f1: 0.5125
 epoch: 36, train_loss: 0.6388, test_loss: 1.3156, test_f1: 0.5678
 epoch: 37, train_loss: 0.6412, test_loss: 1.1018, test_f1: 0.6256
 epoch: 38, train_loss: 0.6016, test_loss: 1.4577, test_f1: 0.5117
 epoch: 39, train_loss: 0.6370, test_loss: 1.3164, test_f1: 0.5709
 epoch: 40, train_loss: 0.6142, test_loss: 1.6596, test_f1: 0.5040
 epoch: 41, train_loss: 0.6778, test_loss: 1.0995, test_f1: 0.6181
 epoch: 42, train_loss: 0.6396, test_loss: 1.1468, test_f1: 0.5647
 epoch: 43, train_loss: 0.6088, test_loss: 1.2345, test_f1: 0.5895
 epoch: 44, train_loss: 0.5766, test_loss: 1.3027, test_f1: 0.5115
 epoch: 45, train_loss: 0.6305, test_loss: 1.2591, test_f1: 0.5632
 epoch: 46, train_loss: 0.5809, test_loss: 1.3557, test_f1: 0.5858
 epoch: 47, train_loss: 0.5802, test_loss: 1.1493, test_f1: 0.5856
 epoch: 48, train_loss: 0.5706, test_loss: 1.2816, test_f1: 0.5539
 epoch: 49, train_loss: 0.5740, test_loss: 1.6465, test_f1: 0.5305
 epoch: 50, train_loss: 0.5511, test_loss: 1.5676, test_f1: 0.4426
 epoch: 51, train_loss: 0.5167, test_loss: 1.6137, test_f1: 0.5532
 epoch: 52, train_loss: 0.4940, test_loss: 1.2217, test_f1: 0.6165
 epoch: 53, train_loss: 0.5121, test_loss: 1.2171, test_f1: 0.6324
 epoch: 54, train_loss: 0.4686, test_loss: 1.2580, test_f1: 0.5910
 epoch: 55, train_loss: 0.4789, test_loss: 1.6007, test_f1: 0.5643
 epoch: 56, train_loss: 0.4737, test_loss: 1.6035, test_f1: 0.5667
 epoch: 57, train_loss: 0.4600, test_loss: 1.5042, test_f1: 0.6096
 epoch: 58, train_loss: 0.4753, test_loss: 1.5853, test_f1: 0.5971
 epoch: 59, train_loss: 0.4648, test_loss: 1.5553, test_f1: 0.5841
 epoch: 60, train_loss: 0.4654, test_loss: 1.5945, test_f1: 0.5134
 epoch: 61, train_loss: 0.5015, test_loss: 1.5573, test_f1: 0.5745
 epoch: 62, train_loss: 0.4510, test_loss: 1.4794, test_f1: 0.5994
 epoch: 63, train_loss: 0.4664, test_loss: 1.4947, test_f1: 0.6394
 epoch: 64, train_loss: 0.5163, test_loss: 1.3742, test_f1: 0.6109
 epoch: 65, train_loss: 0.4626, test_loss: 1.5025, test_f1: 0.5449
 epoch: 66, train_loss: 0.4554, test_loss: 1.5923, test_f1: 0.5935
 epoch: 67, train_loss: 0.4445, test_loss: 1.5311, test_f1: 0.5670
 epoch: 68, train_loss: 0.4541, test_loss: 1.5389, test_f1: 0.5891
 epoch: 69, train_loss: 0.4174, test_loss: 1.5573, test_f1: 0.6263
 epoch: 70, train_loss: 0.4626, test_loss: 1.5443, test_f1: 0.5793
 epoch: 71, train_loss: 0.4464, test_loss: 1.5009, test_f1: 0.5958
 epoch: 72, train_loss: 0.4315, test_loss: 1.9171, test_f1: 0.5209
 epoch: 73, train_loss: 0.4326, test_loss: 1.4448, test_f1: 0.6328
 epoch: 74, train_loss: 0.4145, test_loss: 1.7852, test_f1: 0.5897
 epoch: 75, train_loss: 0.4394, test_loss: 1.9618, test_f1: 0.5342
 epoch: 76, train_loss: 0.4380, test_loss: 1.6443, test_f1: 0.5678
 epoch: 77, train_loss: 0.4105, test_loss: 1.9142, test_f1: 0.5828
 epoch: 78, train_loss: 0.4019, test_loss: 1.7371, test_f1: 0.5193
 epoch: 79, train_loss: 0.4003, test_loss: 2.5534, test_f1: 0.5388
 epoch: 80, train_loss: 0.4530, test_loss: 1.9830, test_f1: 0.5718
 epoch: 81, train_loss: 0.3998, test_loss: 1.8081, test_f1: 0.5451
 epoch: 82, train_loss: 0.4090, test_loss: 1.7775, test_f1: 0.5829
 epoch: 83, train_loss: 0.4386, test_loss: 1.4919, test_f1: 0.5777
 epoch: 84, train_loss: 0.4568, test_loss: 1.5386, test_f1: 0.6180
 epoch: 85, train_loss: 0.4194, test_loss: 1.6543, test_f1: 0.5998
 epoch: 86, train_loss: 0.4400, test_loss: 1.8692, test_f1: 0.5874
 epoch: 87, train_loss: 0.4113, test_loss: 1.6819, test_f1: 0.5316
 epoch: 88, train_loss: 0.3853, test_loss: 1.8518, test_f1: 0.5905
 epoch: 89, train_loss: 0.4129, test_loss: 1.6985, test_f1: 0.5879
 epoch: 90, train_loss: 0.4020, test_loss: 1.5601, test_f1: 0.5760
 epoch: 91, train_loss: 0.3906, test_loss: 1.7367, test_f1: 0.6183
 epoch: 92, train_loss: 0.3966, test_loss: 1.9890, test_f1: 0.5881
 epoch: 93, train_loss: 0.3978, test_loss: 1.7255, test_f1: 0.5753
 epoch: 94, train_loss: 0.3779, test_loss: 1.6981, test_f1: 0.6236
 epoch: 95, train_loss: 0.4109, test_loss: 1.6113, test_f1: 0.5731
 epoch: 96, train_loss: 0.3718, test_loss: 1.8880, test_f1: 0.5793
 epoch: 97, train_loss: 0.3785, test_loss: 1.8273, test_f1: 0.5707
 epoch: 98, train_loss: 0.3857, test_loss: 1.6385, test_f1: 0.5727
 epoch: 99, train_loss: 0.4125, test_loss: 1.9213, test_f1: 0.5333
##################ITERATION #3 ****************************************
 epoch: 0, train_loss: 1.1386, test_loss: 1.4077, test_f1: 0.2684
 epoch: 1, train_loss: 0.9458, test_loss: 1.0804, test_f1: 0.4839
 epoch: 2, train_loss: 0.9234, test_loss: 1.1895, test_f1: 0.4475
 epoch: 3, train_loss: 0.8693, test_loss: 1.1082, test_f1: 0.5481
 epoch: 4, train_loss: 0.8641, test_loss: 1.0311, test_f1: 0.5268
 epoch: 5, train_loss: 0.8470, test_loss: 1.0694, test_f1: 0.5305
 epoch: 6, train_loss: 0.8134, test_loss: 1.0595, test_f1: 0.4928
 epoch: 7, train_loss: 0.8127, test_loss: 1.0436, test_f1: 0.4801
 epoch: 8, train_loss: 0.8064, test_loss: 1.6818, test_f1: 0.4517
 epoch: 9, train_loss: 0.8013, test_loss: 1.1619, test_f1: 0.5472
 epoch: 10, train_loss: 0.8218, test_loss: 1.0708, test_f1: 0.5890
 epoch: 11, train_loss: 0.7957, test_loss: 1.0506, test_f1: 0.5690
 epoch: 12, train_loss: 0.7768, test_loss: 1.2138, test_f1: 0.5064
 epoch: 13, train_loss: 0.7980, test_loss: 1.2897, test_f1: 0.4925
 epoch: 14, train_loss: 0.7579, test_loss: 1.0134, test_f1: 0.6304
 epoch: 15, train_loss: 0.7695, test_loss: 1.0318, test_f1: 0.5870
 epoch: 16, train_loss: 0.7509, test_loss: 1.3526, test_f1: 0.5082
 epoch: 17, train_loss: 0.7467, test_loss: 1.4530, test_f1: 0.4844
 epoch: 18, train_loss: 0.7456, test_loss: 1.0357, test_f1: 0.5541
 epoch: 19, train_loss: 0.7707, test_loss: 1.3637, test_f1: 0.5092
 epoch: 20, train_loss: 0.7505, test_loss: 1.3233, test_f1: 0.4867
 epoch: 21, train_loss: 0.7122, test_loss: 1.0190, test_f1: 0.5844
 epoch: 22, train_loss: 0.7068, test_loss: 1.0751, test_f1: 0.5782
 epoch: 23, train_loss: 0.7213, test_loss: 1.8094, test_f1: 0.4524
 epoch: 24, train_loss: 0.7008, test_loss: 1.8073, test_f1: 0.5025
 epoch: 25, train_loss: 0.6883, test_loss: 1.2744, test_f1: 0.5082
 epoch: 26, train_loss: 0.7148, test_loss: 1.1617, test_f1: 0.4494
 epoch: 27, train_loss: 0.7030, test_loss: 1.2410, test_f1: 0.5855
 epoch: 28, train_loss: 0.7098, test_loss: 1.3885, test_f1: 0.4445
 epoch: 29, train_loss: 0.7050, test_loss: 1.1245, test_f1: 0.5161
 epoch: 30, train_loss: 0.6928, test_loss: 1.2261, test_f1: 0.6172
 epoch: 31, train_loss: 0.6559, test_loss: 1.0879, test_f1: 0.6144
 epoch: 32, train_loss: 0.6687, test_loss: 1.5486, test_f1: 0.4877
 epoch: 33, train_loss: 0.7165, test_loss: 1.0021, test_f1: 0.6122
 epoch: 34, train_loss: 0.6845, test_loss: 1.3067, test_f1: 0.5849
 epoch: 35, train_loss: 0.6793, test_loss: 1.6429, test_f1: 0.5460
 epoch: 36, train_loss: 0.6804, test_loss: 1.1054, test_f1: 0.5636
 epoch: 37, train_loss: 0.6563, test_loss: 1.1579, test_f1: 0.5806
 epoch: 38, train_loss: 0.6399, test_loss: 1.4876, test_f1: 0.5116
 epoch: 39, train_loss: 0.6736, test_loss: 1.1638, test_f1: 0.5670
 epoch: 40, train_loss: 0.6405, test_loss: 1.1067, test_f1: 0.5464
 epoch: 41, train_loss: 0.6502, test_loss: 1.3321, test_f1: 0.4735
 epoch: 42, train_loss: 0.6545, test_loss: 1.1684, test_f1: 0.5431
 epoch: 43, train_loss: 0.6486, test_loss: 1.0686, test_f1: 0.6431
 epoch: 44, train_loss: 0.6246, test_loss: 1.1911, test_f1: 0.5312
 epoch: 45, train_loss: 0.6311, test_loss: 1.4070, test_f1: 0.5494
 epoch: 46, train_loss: 0.6300, test_loss: 1.1819, test_f1: 0.5401
 epoch: 47, train_loss: 0.6428, test_loss: 1.2098, test_f1: 0.5553
 epoch: 48, train_loss: 0.6485, test_loss: 1.2213, test_f1: 0.5836
 epoch: 49, train_loss: 0.6116, test_loss: 1.6857, test_f1: 0.5173
 epoch: 50, train_loss: 0.6054, test_loss: 1.4468, test_f1: 0.5746
 epoch: 51, train_loss: 0.5824, test_loss: 1.2056, test_f1: 0.6325
 epoch: 52, train_loss: 0.5350, test_loss: 1.1743, test_f1: 0.6648
 epoch: 53, train_loss: 0.5198, test_loss: 1.3520, test_f1: 0.6104
 epoch: 54, train_loss: 0.5118, test_loss: 1.4521, test_f1: 0.6012
 epoch: 55, train_loss: 0.5114, test_loss: 1.1560, test_f1: 0.6118
 epoch: 56, train_loss: 0.5036, test_loss: 1.4404, test_f1: 0.5609
 epoch: 57, train_loss: 0.4952, test_loss: 1.2616, test_f1: 0.6323
 epoch: 58, train_loss: 0.4957, test_loss: 1.5824, test_f1: 0.5697
 epoch: 59, train_loss: 0.5086, test_loss: 1.3543, test_f1: 0.6010
 epoch: 60, train_loss: 0.5077, test_loss: 1.2927, test_f1: 0.6270
 epoch: 61, train_loss: 0.5074, test_loss: 1.4751, test_f1: 0.6320
 epoch: 62, train_loss: 0.4997, test_loss: 1.3225, test_f1: 0.6018
 epoch: 63, train_loss: 0.4739, test_loss: 1.7028, test_f1: 0.5402
 epoch: 64, train_loss: 0.4895, test_loss: 1.6277, test_f1: 0.5571
 epoch: 65, train_loss: 0.4920, test_loss: 1.4196, test_f1: 0.6032
 epoch: 66, train_loss: 0.4769, test_loss: 1.4977, test_f1: 0.6204
 epoch: 67, train_loss: 0.4868, test_loss: 1.2584, test_f1: 0.6564
 epoch: 68, train_loss: 0.5074, test_loss: 1.4731, test_f1: 0.6124
 epoch: 69, train_loss: 0.4959, test_loss: 1.3372, test_f1: 0.5789
 epoch: 70, train_loss: 0.4575, test_loss: 1.3499, test_f1: 0.6138
 epoch: 71, train_loss: 0.4887, test_loss: 1.3034, test_f1: 0.6221
 epoch: 72, train_loss: 0.5000, test_loss: 1.2116, test_f1: 0.6571
 epoch: 73, train_loss: 0.4807, test_loss: 1.4621, test_f1: 0.5937
 epoch: 74, train_loss: 0.4523, test_loss: 1.5249, test_f1: 0.5941
 epoch: 75, train_loss: 0.4460, test_loss: 1.4913, test_f1: 0.6452
 epoch: 76, train_loss: 0.4633, test_loss: 1.3003, test_f1: 0.6013
 epoch: 77, train_loss: 0.4328, test_loss: 1.7087, test_f1: 0.6192
 epoch: 78, train_loss: 0.4319, test_loss: 1.4364, test_f1: 0.6285
 epoch: 79, train_loss: 0.4426, test_loss: 1.5237, test_f1: 0.6297
 epoch: 80, train_loss: 0.4529, test_loss: 1.4012, test_f1: 0.6292
 epoch: 81, train_loss: 0.4214, test_loss: 1.8007, test_f1: 0.5878
 epoch: 82, train_loss: 0.4240, test_loss: 1.6398, test_f1: 0.6122
 epoch: 83, train_loss: 0.4472, test_loss: 1.6447, test_f1: 0.6187
 epoch: 84, train_loss: 0.4581, test_loss: 1.5979, test_f1: 0.6278
 epoch: 85, train_loss: 0.4478, test_loss: 2.2723, test_f1: 0.5284
 epoch: 86, train_loss: 0.4417, test_loss: 1.3088, test_f1: 0.6472
 epoch: 87, train_loss: 0.4348, test_loss: 1.5131, test_f1: 0.6344
 epoch: 88, train_loss: 0.4084, test_loss: 1.4652, test_f1: 0.6126
 epoch: 89, train_loss: 0.4317, test_loss: 1.7059, test_f1: 0.5947
 epoch: 90, train_loss: 0.4218, test_loss: 1.7906, test_f1: 0.6054
 epoch: 91, train_loss: 0.4255, test_loss: 1.5446, test_f1: 0.5999
 epoch: 92, train_loss: 0.4022, test_loss: 1.5951, test_f1: 0.5988
 epoch: 93, train_loss: 0.4309, test_loss: 1.5616, test_f1: 0.6196
 epoch: 94, train_loss: 0.4215, test_loss: 1.9815, test_f1: 0.6092
 epoch: 95, train_loss: 0.4018, test_loss: 1.7541, test_f1: 0.6022
 epoch: 96, train_loss: 0.3936, test_loss: 1.5676, test_f1: 0.6316
 epoch: 97, train_loss: 0.4145, test_loss: 1.7100, test_f1: 0.6200
 epoch: 98, train_loss: 0.4426, test_loss: 2.0997, test_f1: 0.5995
 epoch: 99, train_loss: 0.3747, test_loss: 1.6732, test_f1: 0.6300
##################ITERATION #4 ****************************************
 epoch: 0, train_loss: 1.1482, test_loss: 1.2967, test_f1: 0.3471
 epoch: 1, train_loss: 0.9918, test_loss: 1.1862, test_f1: 0.4043
 epoch: 2, train_loss: 0.9490, test_loss: 1.0962, test_f1: 0.4777
 epoch: 3, train_loss: 0.9060, test_loss: 0.9825, test_f1: 0.5353
 epoch: 4, train_loss: 0.8866, test_loss: 1.0387, test_f1: 0.5731
 epoch: 5, train_loss: 0.8503, test_loss: 1.0291, test_f1: 0.5308
 epoch: 6, train_loss: 0.8262, test_loss: 1.0002, test_f1: 0.5661
 epoch: 7, train_loss: 0.8293, test_loss: 1.0339, test_f1: 0.5317
 epoch: 8, train_loss: 0.8083, test_loss: 1.5632, test_f1: 0.4504
 epoch: 9, train_loss: 0.8839, test_loss: 1.0497, test_f1: 0.4919
 epoch: 10, train_loss: 0.8165, test_loss: 0.9969, test_f1: 0.5815
 epoch: 11, train_loss: 0.7951, test_loss: 1.0061, test_f1: 0.5361
 epoch: 12, train_loss: 0.7818, test_loss: 1.0214, test_f1: 0.5451
 epoch: 13, train_loss: 0.7529, test_loss: 1.3827, test_f1: 0.5167
 epoch: 14, train_loss: 0.7756, test_loss: 1.0904, test_f1: 0.5855
 epoch: 15, train_loss: 0.7778, test_loss: 1.4836, test_f1: 0.4415
 epoch: 16, train_loss: 0.8103, test_loss: 1.0544, test_f1: 0.5819
 epoch: 17, train_loss: 0.7608, test_loss: 1.4880, test_f1: 0.5395
 epoch: 18, train_loss: 0.7787, test_loss: 1.1025, test_f1: 0.5261
 epoch: 19, train_loss: 0.7273, test_loss: 1.1387, test_f1: 0.5370
 epoch: 20, train_loss: 0.7760, test_loss: 1.0812, test_f1: 0.5464
 epoch: 21, train_loss: 0.7417, test_loss: 1.1736, test_f1: 0.4914
 epoch: 22, train_loss: 0.7193, test_loss: 1.1306, test_f1: 0.5057
 epoch: 23, train_loss: 0.7568, test_loss: 1.3962, test_f1: 0.4992
 epoch: 24, train_loss: 0.7669, test_loss: 1.0563, test_f1: 0.5160
 epoch: 25, train_loss: 0.7159, test_loss: 1.0094, test_f1: 0.5771
 epoch: 26, train_loss: 0.6907, test_loss: 1.2380, test_f1: 0.4900
 epoch: 27, train_loss: 0.6914, test_loss: 1.2123, test_f1: 0.5407
 epoch: 28, train_loss: 0.6833, test_loss: 1.5080, test_f1: 0.3895
 epoch: 29, train_loss: 0.6934, test_loss: 1.4076, test_f1: 0.4575
 epoch: 30, train_loss: 0.7046, test_loss: 1.7216, test_f1: 0.4860
 epoch: 31, train_loss: 0.7142, test_loss: 1.0753, test_f1: 0.6015
 epoch: 32, train_loss: 0.6905, test_loss: 1.2568, test_f1: 0.4303
 epoch: 33, train_loss: 0.6844, test_loss: 1.1749, test_f1: 0.5461
 epoch: 34, train_loss: 0.6971, test_loss: 1.2210, test_f1: 0.5139
 epoch: 35, train_loss: 0.6991, test_loss: 1.1318, test_f1: 0.5731
 epoch: 36, train_loss: 0.6628, test_loss: 1.4868, test_f1: 0.4600
 epoch: 37, train_loss: 0.7069, test_loss: 1.1931, test_f1: 0.5571
 epoch: 38, train_loss: 0.6948, test_loss: 1.1495, test_f1: 0.5330
 epoch: 39, train_loss: 0.6422, test_loss: 1.1861, test_f1: 0.5778
 epoch: 40, train_loss: 0.6694, test_loss: 1.3714, test_f1: 0.5929
 epoch: 41, train_loss: 0.6380, test_loss: 1.2754, test_f1: 0.5026
 epoch: 42, train_loss: 0.6390, test_loss: 1.1892, test_f1: 0.5917
 epoch: 43, train_loss: 0.6642, test_loss: 1.9793, test_f1: 0.4576
 epoch: 44, train_loss: 0.6429, test_loss: 1.3053, test_f1: 0.5869
 epoch: 45, train_loss: 0.6159, test_loss: 1.4299, test_f1: 0.4883
 epoch: 46, train_loss: 0.6600, test_loss: 1.2999, test_f1: 0.4326
 epoch: 47, train_loss: 0.6147, test_loss: 1.7802, test_f1: 0.4907
 epoch: 48, train_loss: 0.6216, test_loss: 1.5052, test_f1: 0.5710
 epoch: 49, train_loss: 0.5867, test_loss: 1.1858, test_f1: 0.5331
 epoch: 50, train_loss: 0.5737, test_loss: 1.2379, test_f1: 0.5501
 epoch: 51, train_loss: 0.5800, test_loss: 1.4475, test_f1: 0.5937
 epoch: 52, train_loss: 0.5565, test_loss: 1.5106, test_f1: 0.5605
 epoch: 53, train_loss: 0.5199, test_loss: 1.4412, test_f1: 0.5415
 epoch: 54, train_loss: 0.5359, test_loss: 1.5781, test_f1: 0.5688
 epoch: 55, train_loss: 0.5213, test_loss: 1.3903, test_f1: 0.6005
 epoch: 56, train_loss: 0.5166, test_loss: 1.5246, test_f1: 0.5953
 epoch: 57, train_loss: 0.5079, test_loss: 1.1837, test_f1: 0.6163
 epoch: 58, train_loss: 0.4960, test_loss: 1.6626, test_f1: 0.5528
 epoch: 59, train_loss: 0.4845, test_loss: 1.5677, test_f1: 0.5516
 epoch: 60, train_loss: 0.4945, test_loss: 1.3634, test_f1: 0.5739
 epoch: 61, train_loss: 0.4934, test_loss: 1.4656, test_f1: 0.6015
 epoch: 62, train_loss: 0.5170, test_loss: 1.2760, test_f1: 0.6197
 epoch: 63, train_loss: 0.5380, test_loss: 1.3847, test_f1: 0.5879
 epoch: 64, train_loss: 0.5183, test_loss: 1.2264, test_f1: 0.5996
 epoch: 65, train_loss: 0.4699, test_loss: 1.3160, test_f1: 0.6274
 epoch: 66, train_loss: 0.4922, test_loss: 1.4689, test_f1: 0.5723
 epoch: 67, train_loss: 0.4776, test_loss: 1.6505, test_f1: 0.6017
 epoch: 68, train_loss: 0.4666, test_loss: 1.4704, test_f1: 0.5797
 epoch: 69, train_loss: 0.4850, test_loss: 1.4129, test_f1: 0.5949
 epoch: 70, train_loss: 0.4610, test_loss: 1.4617, test_f1: 0.5938
 epoch: 71, train_loss: 0.4632, test_loss: 1.9259, test_f1: 0.5656
 epoch: 72, train_loss: 0.4578, test_loss: 1.5630, test_f1: 0.6029
 epoch: 73, train_loss: 0.4650, test_loss: 1.4160, test_f1: 0.5967
 epoch: 74, train_loss: 0.4631, test_loss: 1.4685, test_f1: 0.6107
 epoch: 75, train_loss: 0.4327, test_loss: 1.8628, test_f1: 0.5665
 epoch: 76, train_loss: 0.4721, test_loss: 1.3677, test_f1: 0.5806
 epoch: 77, train_loss: 0.4488, test_loss: 2.0104, test_f1: 0.5988
 epoch: 78, train_loss: 0.4524, test_loss: 1.8246, test_f1: 0.5970
 epoch: 79, train_loss: 0.4597, test_loss: 1.4125, test_f1: 0.5924
 epoch: 80, train_loss: 0.4366, test_loss: 1.3930, test_f1: 0.5888
 epoch: 81, train_loss: 0.4337, test_loss: 1.4903, test_f1: 0.5922
 epoch: 82, train_loss: 0.4649, test_loss: 1.9164, test_f1: 0.5225
 epoch: 83, train_loss: 0.4287, test_loss: 1.7224, test_f1: 0.6067
 epoch: 84, train_loss: 0.4532, test_loss: 1.4171, test_f1: 0.6032
 epoch: 85, train_loss: 0.4421, test_loss: 1.6328, test_f1: 0.5568
 epoch: 86, train_loss: 0.4646, test_loss: 1.6120, test_f1: 0.6064
 epoch: 87, train_loss: 0.4359, test_loss: 1.7157, test_f1: 0.6173
 epoch: 88, train_loss: 0.4031, test_loss: 1.5529, test_f1: 0.6099
 epoch: 89, train_loss: 0.3992, test_loss: 2.1173, test_f1: 0.5809
 epoch: 90, train_loss: 0.4130, test_loss: 1.8118, test_f1: 0.5812
 epoch: 91, train_loss: 0.4234, test_loss: 2.2200, test_f1: 0.5482
 epoch: 92, train_loss: 0.4511, test_loss: 1.7470, test_f1: 0.5943
 epoch: 93, train_loss: 0.4563, test_loss: 1.7162, test_f1: 0.5173
 epoch: 94, train_loss: 0.3979, test_loss: 1.8427, test_f1: 0.5535
 epoch: 95, train_loss: 0.4113, test_loss: 1.8480, test_f1: 0.5801
 epoch: 96, train_loss: 0.4476, test_loss: 1.6028, test_f1: 0.5675
 epoch: 97, train_loss: 0.3979, test_loss: 1.7827, test_f1: 0.6067
 epoch: 98, train_loss: 0.4044, test_loss: 2.5052, test_f1: 0.5704
 epoch: 99, train_loss: 0.3814, test_loss: 1.6975, test_f1: 0.5934
##################ITERATION #5 ****************************************
 epoch: 0, train_loss: 1.1935, test_loss: 1.5871, test_f1: 0.1365
 epoch: 1, train_loss: 1.0226, test_loss: 1.1114, test_f1: 0.5140
 epoch: 2, train_loss: 0.9563, test_loss: 1.0942, test_f1: 0.4799
 epoch: 3, train_loss: 0.9373, test_loss: 1.0609, test_f1: 0.5685
 epoch: 4, train_loss: 0.9130, test_loss: 1.0692, test_f1: 0.4797
 epoch: 5, train_loss: 0.9076, test_loss: 1.0135, test_f1: 0.5476
 epoch: 6, train_loss: 0.8674, test_loss: 1.0180, test_f1: 0.5359
 epoch: 7, train_loss: 0.8613, test_loss: 1.0308, test_f1: 0.5150
 epoch: 8, train_loss: 0.8595, test_loss: 1.1189, test_f1: 0.3995
 epoch: 9, train_loss: 0.8579, test_loss: 0.9725, test_f1: 0.5237
 epoch: 10, train_loss: 0.8150, test_loss: 1.0818, test_f1: 0.5049
 epoch: 11, train_loss: 0.8183, test_loss: 0.9840, test_f1: 0.5575
 epoch: 12, train_loss: 0.7849, test_loss: 1.0248, test_f1: 0.5992
 epoch: 13, train_loss: 0.7810, test_loss: 1.1391, test_f1: 0.4859
 epoch: 14, train_loss: 0.7644, test_loss: 1.0400, test_f1: 0.5653
 epoch: 15, train_loss: 0.8010, test_loss: 1.1222, test_f1: 0.5592
 epoch: 16, train_loss: 0.7717, test_loss: 1.0176, test_f1: 0.5570
 epoch: 17, train_loss: 0.7515, test_loss: 1.1684, test_f1: 0.4956
 epoch: 18, train_loss: 0.7601, test_loss: 1.0862, test_f1: 0.5139
 epoch: 19, train_loss: 0.7391, test_loss: 0.9445, test_f1: 0.5621
 epoch: 20, train_loss: 0.7426, test_loss: 0.9962, test_f1: 0.5847
 epoch: 21, train_loss: 0.7201, test_loss: 1.1278, test_f1: 0.5682
 epoch: 22, train_loss: 0.7245, test_loss: 0.9613, test_f1: 0.6068
 epoch: 23, train_loss: 0.7185, test_loss: 1.4252, test_f1: 0.5150
 epoch: 24, train_loss: 0.7008, test_loss: 0.9331, test_f1: 0.6077
 epoch: 25, train_loss: 0.7006, test_loss: 1.1171, test_f1: 0.4904
 epoch: 26, train_loss: 0.6773, test_loss: 1.0211, test_f1: 0.5828
 epoch: 27, train_loss: 0.7035, test_loss: 1.0875, test_f1: 0.5186
 epoch: 28, train_loss: 0.7277, test_loss: 1.1315, test_f1: 0.5655
 epoch: 29, train_loss: 0.6931, test_loss: 1.1752, test_f1: 0.5138
 epoch: 30, train_loss: 0.6742, test_loss: 1.1570, test_f1: 0.4657
 epoch: 31, train_loss: 0.6916, test_loss: 1.0179, test_f1: 0.6010
 epoch: 32, train_loss: 0.7052, test_loss: 1.3409, test_f1: 0.4414
 epoch: 33, train_loss: 0.6755, test_loss: 1.2324, test_f1: 0.5418
 epoch: 34, train_loss: 0.6707, test_loss: 1.0130, test_f1: 0.6332
 epoch: 35, train_loss: 0.6328, test_loss: 1.1404, test_f1: 0.5474
 epoch: 36, train_loss: 0.6339, test_loss: 1.0082, test_f1: 0.6056
 epoch: 37, train_loss: 0.6327, test_loss: 1.2922, test_f1: 0.5340
 epoch: 38, train_loss: 0.6272, test_loss: 1.0245, test_f1: 0.6346
 epoch: 39, train_loss: 0.6372, test_loss: 1.0191, test_f1: 0.5847
 epoch: 40, train_loss: 0.6317, test_loss: 1.0327, test_f1: 0.6202
 epoch: 41, train_loss: 0.6291, test_loss: 1.0935, test_f1: 0.5925
 epoch: 42, train_loss: 0.6048, test_loss: 0.9743, test_f1: 0.6217
 epoch: 43, train_loss: 0.6008, test_loss: 1.1795, test_f1: 0.6040
 epoch: 44, train_loss: 0.5920, test_loss: 1.2105, test_f1: 0.5014
 epoch: 45, train_loss: 0.6325, test_loss: 1.0672, test_f1: 0.5652
 epoch: 46, train_loss: 0.6055, test_loss: 1.1967, test_f1: 0.5660
 epoch: 47, train_loss: 0.5910, test_loss: 1.0667, test_f1: 0.6205
 epoch: 48, train_loss: 0.5916, test_loss: 1.0518, test_f1: 0.6058
 epoch: 49, train_loss: 0.5670, test_loss: 1.0629, test_f1: 0.6325
 epoch: 50, train_loss: 0.5826, test_loss: 1.0262, test_f1: 0.6198
 epoch: 51, train_loss: 0.5767, test_loss: 1.0761, test_f1: 0.6272
 epoch: 52, train_loss: 0.5214, test_loss: 1.0870, test_f1: 0.6127
 epoch: 53, train_loss: 0.5038, test_loss: 1.2331, test_f1: 0.5524
 epoch: 54, train_loss: 0.4995, test_loss: 1.0238, test_f1: 0.6353
 epoch: 55, train_loss: 0.4801, test_loss: 1.1192, test_f1: 0.6235
 epoch: 56, train_loss: 0.4830, test_loss: 1.0631, test_f1: 0.6608
 epoch: 57, train_loss: 0.4601, test_loss: 1.2438, test_f1: 0.5965
 epoch: 58, train_loss: 0.4971, test_loss: 1.1823, test_f1: 0.6194
 epoch: 59, train_loss: 0.4778, test_loss: 1.4154, test_f1: 0.4756
 epoch: 60, train_loss: 0.4776, test_loss: 1.1979, test_f1: 0.5712
 epoch: 61, train_loss: 0.4735, test_loss: 1.2119, test_f1: 0.6267
 epoch: 62, train_loss: 0.4577, test_loss: 1.1416, test_f1: 0.6554
 epoch: 63, train_loss: 0.5132, test_loss: 1.2170, test_f1: 0.6092
 epoch: 64, train_loss: 0.4767, test_loss: 1.1123, test_f1: 0.6528
 epoch: 65, train_loss: 0.4643, test_loss: 1.0703, test_f1: 0.6518
 epoch: 66, train_loss: 0.4602, test_loss: 1.2389, test_f1: 0.6179
 epoch: 67, train_loss: 0.4269, test_loss: 1.2052, test_f1: 0.5974
 epoch: 68, train_loss: 0.4488, test_loss: 1.1843, test_f1: 0.6352
 epoch: 69, train_loss: 0.4573, test_loss: 1.2905, test_f1: 0.5646
 epoch: 70, train_loss: 0.4325, test_loss: 1.1930, test_f1: 0.6251
 epoch: 71, train_loss: 0.4551, test_loss: 1.1746, test_f1: 0.6377
 epoch: 72, train_loss: 0.4738, test_loss: 1.2769, test_f1: 0.6035
 epoch: 73, train_loss: 0.4353, test_loss: 1.1473, test_f1: 0.6171
 epoch: 74, train_loss: 0.4587, test_loss: 1.1467, test_f1: 0.6148
 epoch: 75, train_loss: 0.4144, test_loss: 1.2573, test_f1: 0.6185
 epoch: 76, train_loss: 0.4668, test_loss: 1.2418, test_f1: 0.5981
 epoch: 77, train_loss: 0.4299, test_loss: 1.4992, test_f1: 0.5778
 epoch: 78, train_loss: 0.4517, test_loss: 1.3311, test_f1: 0.5837
 epoch: 79, train_loss: 0.4688, test_loss: 1.4688, test_f1: 0.5746
 epoch: 80, train_loss: 0.4385, test_loss: 1.1395, test_f1: 0.6220
 epoch: 81, train_loss: 0.4062, test_loss: 1.1914, test_f1: 0.6272
 epoch: 82, train_loss: 0.3980, test_loss: 1.3488, test_f1: 0.5934
 epoch: 83, train_loss: 0.3910, test_loss: 1.1423, test_f1: 0.6177
 epoch: 84, train_loss: 0.4242, test_loss: 1.2884, test_f1: 0.6049
 epoch: 85, train_loss: 0.4209, test_loss: 1.2132, test_f1: 0.6038
 epoch: 86, train_loss: 0.4261, test_loss: 1.2616, test_f1: 0.6114
 epoch: 87, train_loss: 0.4018, test_loss: 1.2171, test_f1: 0.6573
 epoch: 88, train_loss: 0.4135, test_loss: 1.3167, test_f1: 0.6271
 epoch: 89, train_loss: 0.3849, test_loss: 1.2517, test_f1: 0.6081
 epoch: 90, train_loss: 0.3964, test_loss: 1.2596, test_f1: 0.6120
 epoch: 91, train_loss: 0.3971, test_loss: 1.3404, test_f1: 0.6172
 epoch: 92, train_loss: 0.4144, test_loss: 1.2643, test_f1: 0.6492
 epoch: 93, train_loss: 0.4041, test_loss: 1.2690, test_f1: 0.5979
 epoch: 94, train_loss: 0.3687, test_loss: 1.5180, test_f1: 0.6094
 epoch: 95, train_loss: 0.4063, test_loss: 1.3357, test_f1: 0.5976
 epoch: 96, train_loss: 0.3958, test_loss: 1.2782, test_f1: 0.6232
 epoch: 97, train_loss: 0.4319, test_loss: 1.2517, test_f1: 0.5879
 epoch: 98, train_loss: 0.4135, test_loss: 1.2557, test_f1: 0.6343
 epoch: 99, train_loss: 0.4241, test_loss: 1.3309, test_f1: 0.6050
##################ITERATION #6 ****************************************
 epoch: 0, train_loss: 1.1689, test_loss: 1.2864, test_f1: 0.3297
 epoch: 1, train_loss: 0.9962, test_loss: 1.1240, test_f1: 0.4484
 epoch: 2, train_loss: 0.9232, test_loss: 1.1640, test_f1: 0.4907
 epoch: 3, train_loss: 0.9338, test_loss: 1.0070, test_f1: 0.5481
 epoch: 4, train_loss: 0.8919, test_loss: 1.4653, test_f1: 0.4362
 epoch: 5, train_loss: 0.8517, test_loss: 1.0128, test_f1: 0.5464
 epoch: 6, train_loss: 0.8229, test_loss: 1.0483, test_f1: 0.5589
 epoch: 7, train_loss: 0.8579, test_loss: 1.1739, test_f1: 0.5232
 epoch: 8, train_loss: 0.8661, test_loss: 1.0541, test_f1: 0.5321
 epoch: 9, train_loss: 0.8352, test_loss: 1.0916, test_f1: 0.4992
 epoch: 10, train_loss: 0.8336, test_loss: 0.9925, test_f1: 0.5553
 epoch: 11, train_loss: 0.7994, test_loss: 1.0600, test_f1: 0.5290
 epoch: 12, train_loss: 0.8164, test_loss: 1.5483, test_f1: 0.4491
 epoch: 13, train_loss: 0.8008, test_loss: 1.0524, test_f1: 0.6018
 epoch: 14, train_loss: 0.7818, test_loss: 1.8674, test_f1: 0.4482
 epoch: 15, train_loss: 0.7678, test_loss: 1.5298, test_f1: 0.5315
 epoch: 16, train_loss: 0.7588, test_loss: 1.1979, test_f1: 0.5348
 epoch: 17, train_loss: 0.7655, test_loss: 1.2143, test_f1: 0.6190
 epoch: 18, train_loss: 0.7372, test_loss: 1.3990, test_f1: 0.5908
 epoch: 19, train_loss: 0.7355, test_loss: 1.3083, test_f1: 0.6142
 epoch: 20, train_loss: 0.7354, test_loss: 1.1701, test_f1: 0.5487
 epoch: 21, train_loss: 0.7244, test_loss: 1.4379, test_f1: 0.4208
 epoch: 22, train_loss: 0.7399, test_loss: 1.1663, test_f1: 0.5874
 epoch: 23, train_loss: 0.7289, test_loss: 1.0623, test_f1: 0.6373
 epoch: 24, train_loss: 0.7078, test_loss: 1.7412, test_f1: 0.6409
 epoch: 25, train_loss: 0.7291, test_loss: 1.9261, test_f1: 0.4829
 epoch: 26, train_loss: 0.7420, test_loss: 1.2694, test_f1: 0.5518
 epoch: 27, train_loss: 0.7139, test_loss: 2.2667, test_f1: 0.4785
 epoch: 28, train_loss: 0.6986, test_loss: 1.1322, test_f1: 0.5674
 epoch: 29, train_loss: 0.7289, test_loss: 1.0374, test_f1: 0.5505
 epoch: 30, train_loss: 0.7500, test_loss: 2.1993, test_f1: 0.4518
 epoch: 31, train_loss: 0.7183, test_loss: 1.2332, test_f1: 0.5002
 epoch: 32, train_loss: 0.6857, test_loss: 1.2060, test_f1: 0.5730
 epoch: 33, train_loss: 0.6663, test_loss: 1.3933, test_f1: 0.6473
 epoch: 34, train_loss: 0.6599, test_loss: 1.4747, test_f1: 0.5481
 epoch: 35, train_loss: 0.6809, test_loss: 1.1400, test_f1: 0.4722
 epoch: 36, train_loss: 0.6701, test_loss: 1.0396, test_f1: 0.6335
 epoch: 37, train_loss: 0.6730, test_loss: 0.9866, test_f1: 0.6521
 epoch: 38, train_loss: 0.7081, test_loss: 1.4987, test_f1: 0.5956
 epoch: 39, train_loss: 0.6720, test_loss: 1.3930, test_f1: 0.6046
 epoch: 40, train_loss: 0.6581, test_loss: 1.7107, test_f1: 0.5776
 epoch: 41, train_loss: 0.6419, test_loss: 1.0915, test_f1: 0.6248
 epoch: 42, train_loss: 0.6308, test_loss: 1.5535, test_f1: 0.5802
 epoch: 43, train_loss: 0.6319, test_loss: 1.1749, test_f1: 0.6505
 epoch: 44, train_loss: 0.6504, test_loss: 1.2964, test_f1: 0.5994
 epoch: 45, train_loss: 0.6415, test_loss: 1.7851, test_f1: 0.5726
 epoch: 46, train_loss: 0.6228, test_loss: 1.1475, test_f1: 0.6168
 epoch: 47, train_loss: 0.6315, test_loss: 1.5288, test_f1: 0.6274
 epoch: 48, train_loss: 0.6887, test_loss: 1.1957, test_f1: 0.5899
 epoch: 49, train_loss: 0.6267, test_loss: 1.3027, test_f1: 0.6029
 epoch: 50, train_loss: 0.5978, test_loss: 1.1735, test_f1: 0.5994
 epoch: 51, train_loss: 0.5995, test_loss: 1.1131, test_f1: 0.6382
 epoch: 52, train_loss: 0.5529, test_loss: 1.3544, test_f1: 0.6288
 epoch: 53, train_loss: 0.5572, test_loss: 1.5067, test_f1: 0.6311
 epoch: 54, train_loss: 0.5507, test_loss: 1.3593, test_f1: 0.6409
 epoch: 55, train_loss: 0.5436, test_loss: 1.6227, test_f1: 0.6192
 epoch: 56, train_loss: 0.5714, test_loss: 1.6563, test_f1: 0.6447
 epoch: 57, train_loss: 0.5546, test_loss: 1.4937, test_f1: 0.6352
 epoch: 58, train_loss: 0.5432, test_loss: 1.5083, test_f1: 0.6685
 epoch: 59, train_loss: 0.5413, test_loss: 1.1474, test_f1: 0.6441
 epoch: 60, train_loss: 0.5324, test_loss: 1.4756, test_f1: 0.6379
 epoch: 61, train_loss: 0.5475, test_loss: 1.4932, test_f1: 0.6453
 epoch: 62, train_loss: 0.5229, test_loss: 1.4423, test_f1: 0.6253
 epoch: 63, train_loss: 0.5190, test_loss: 1.5183, test_f1: 0.6352
 epoch: 64, train_loss: 0.5232, test_loss: 1.2261, test_f1: 0.6520
 epoch: 65, train_loss: 0.5160, test_loss: 1.1777, test_f1: 0.6484
 epoch: 66, train_loss: 0.5301, test_loss: 1.8600, test_f1: 0.6287
 epoch: 67, train_loss: 0.5111, test_loss: 1.4789, test_f1: 0.6541
 epoch: 68, train_loss: 0.5384, test_loss: 1.4558, test_f1: 0.5764
 epoch: 69, train_loss: 0.5198, test_loss: 1.5081, test_f1: 0.6443
 epoch: 70, train_loss: 0.4827, test_loss: 1.3753, test_f1: 0.6351
 epoch: 71, train_loss: 0.5135, test_loss: 1.5815, test_f1: 0.5985
 epoch: 72, train_loss: 0.4776, test_loss: 1.4939, test_f1: 0.6496
 epoch: 73, train_loss: 0.5106, test_loss: 1.3296, test_f1: 0.6369
 epoch: 74, train_loss: 0.5005, test_loss: 1.3734, test_f1: 0.6323
 epoch: 75, train_loss: 0.5002, test_loss: 2.2028, test_f1: 0.6009
 epoch: 76, train_loss: 0.5222, test_loss: 1.8561, test_f1: 0.6162
 epoch: 77, train_loss: 0.4804, test_loss: 1.5143, test_f1: 0.6317
 epoch: 78, train_loss: 0.4946, test_loss: 1.4761, test_f1: 0.6275
 epoch: 79, train_loss: 0.4970, test_loss: 1.5569, test_f1: 0.6234
 epoch: 80, train_loss: 0.4927, test_loss: 1.7728, test_f1: 0.6415
 epoch: 81, train_loss: 0.4709, test_loss: 1.3116, test_f1: 0.6499
 epoch: 82, train_loss: 0.4762, test_loss: 1.7888, test_f1: 0.6517
 epoch: 83, train_loss: 0.4779, test_loss: 1.5325, test_f1: 0.6065
 epoch: 84, train_loss: 0.4603, test_loss: 1.9016, test_f1: 0.6000
 epoch: 85, train_loss: 0.4856, test_loss: 1.5615, test_f1: 0.6010
 epoch: 86, train_loss: 0.4882, test_loss: 1.5362, test_f1: 0.6204
 epoch: 87, train_loss: 0.4943, test_loss: 1.7950, test_f1: 0.6315
 epoch: 88, train_loss: 0.4591, test_loss: 1.5446, test_f1: 0.6422
 epoch: 89, train_loss: 0.4404, test_loss: 1.6059, test_f1: 0.6103
 epoch: 90, train_loss: 0.4365, test_loss: 1.5994, test_f1: 0.6294
 epoch: 91, train_loss: 0.4283, test_loss: 1.8722, test_f1: 0.6119
 epoch: 92, train_loss: 0.4711, test_loss: 1.3358, test_f1: 0.6362
 epoch: 93, train_loss: 0.4228, test_loss: 1.9013, test_f1: 0.6615
 epoch: 94, train_loss: 0.5226, test_loss: 1.7216, test_f1: 0.6454
 epoch: 95, train_loss: 0.4828, test_loss: 1.3413, test_f1: 0.6422
 epoch: 96, train_loss: 0.4943, test_loss: 2.1315, test_f1: 0.6246
 epoch: 97, train_loss: 0.4679, test_loss: 1.5998, test_f1: 0.6327
 epoch: 98, train_loss: 0.4539, test_loss: 1.5401, test_f1: 0.6348
 epoch: 99, train_loss: 0.4788, test_loss: 1.5195, test_f1: 0.6365
##################ITERATION #7 ****************************************
 epoch: 0, train_loss: 1.1848, test_loss: 1.4179, test_f1: 0.2722
 epoch: 1, train_loss: 0.9785, test_loss: 1.1001, test_f1: 0.4350
 epoch: 2, train_loss: 0.9636, test_loss: 1.0371, test_f1: 0.5159
 epoch: 3, train_loss: 0.9300, test_loss: 0.9838, test_f1: 0.5708
 epoch: 4, train_loss: 0.8773, test_loss: 1.0142, test_f1: 0.5510
 epoch: 5, train_loss: 0.8866, test_loss: 1.0286, test_f1: 0.5374
 epoch: 6, train_loss: 0.8567, test_loss: 1.1679, test_f1: 0.4402
 epoch: 7, train_loss: 0.8556, test_loss: 0.9857, test_f1: 0.5404
 epoch: 8, train_loss: 0.8524, test_loss: 0.9652, test_f1: 0.5487
 epoch: 9, train_loss: 0.8299, test_loss: 0.9775, test_f1: 0.5903
 epoch: 10, train_loss: 0.8250, test_loss: 1.0469, test_f1: 0.5198
 epoch: 11, train_loss: 0.8006, test_loss: 1.0072, test_f1: 0.5187
 epoch: 12, train_loss: 0.7954, test_loss: 0.9850, test_f1: 0.5757
 epoch: 13, train_loss: 0.7904, test_loss: 1.2600, test_f1: 0.4923
 epoch: 14, train_loss: 0.8130, test_loss: 1.0793, test_f1: 0.4718
 epoch: 15, train_loss: 0.7782, test_loss: 1.0481, test_f1: 0.5831
 epoch: 16, train_loss: 0.7838, test_loss: 0.9676, test_f1: 0.6266
 epoch: 17, train_loss: 0.7535, test_loss: 1.0187, test_f1: 0.5516
 epoch: 18, train_loss: 0.7586, test_loss: 1.1130, test_f1: 0.5020
 epoch: 19, train_loss: 0.7545, test_loss: 0.9376, test_f1: 0.6349
 epoch: 20, train_loss: 0.7373, test_loss: 1.3212, test_f1: 0.5989
 epoch: 21, train_loss: 0.7390, test_loss: 1.0920, test_f1: 0.4966
 epoch: 22, train_loss: 0.7441, test_loss: 1.0974, test_f1: 0.6025
 epoch: 23, train_loss: 0.7273, test_loss: 1.2478, test_f1: 0.5452
 epoch: 24, train_loss: 0.7279, test_loss: 1.1449, test_f1: 0.4766
 epoch: 25, train_loss: 0.7248, test_loss: 0.9902, test_f1: 0.5885
 epoch: 26, train_loss: 0.7116, test_loss: 1.2261, test_f1: 0.4817
 epoch: 27, train_loss: 0.6950, test_loss: 1.0561, test_f1: 0.5327
 epoch: 28, train_loss: 0.6873, test_loss: 1.1253, test_f1: 0.4849
 epoch: 29, train_loss: 0.6950, test_loss: 1.3300, test_f1: 0.5594
 epoch: 30, train_loss: 0.6978, test_loss: 1.2211, test_f1: 0.5820
 epoch: 31, train_loss: 0.6902, test_loss: 1.0503, test_f1: 0.6016
 epoch: 32, train_loss: 0.6649, test_loss: 1.0653, test_f1: 0.5986
 epoch: 33, train_loss: 0.6618, test_loss: 1.1508, test_f1: 0.5925
 epoch: 34, train_loss: 0.6895, test_loss: 1.0319, test_f1: 0.5847
 epoch: 35, train_loss: 0.6617, test_loss: 1.2931, test_f1: 0.4519
 epoch: 36, train_loss: 0.6504, test_loss: 1.5527, test_f1: 0.4684
 epoch: 37, train_loss: 0.6768, test_loss: 0.9615, test_f1: 0.6334
 epoch: 38, train_loss: 0.6403, test_loss: 1.1999, test_f1: 0.5936
 epoch: 39, train_loss: 0.6464, test_loss: 1.0228, test_f1: 0.6091
 epoch: 40, train_loss: 0.6511, test_loss: 1.2590, test_f1: 0.6392
 epoch: 41, train_loss: 0.6448, test_loss: 1.2187, test_f1: 0.5878
 epoch: 42, train_loss: 0.6153, test_loss: 1.2846, test_f1: 0.5766
 epoch: 43, train_loss: 0.6130, test_loss: 1.5942, test_f1: 0.5334
 epoch: 44, train_loss: 0.6275, test_loss: 1.2623, test_f1: 0.4853
 epoch: 45, train_loss: 0.6570, test_loss: 1.0471, test_f1: 0.6434
 epoch: 46, train_loss: 0.6194, test_loss: 1.0933, test_f1: 0.5571
 epoch: 47, train_loss: 0.6429, test_loss: 1.2513, test_f1: 0.5624
 epoch: 48, train_loss: 0.6495, test_loss: 1.3278, test_f1: 0.5875
 epoch: 49, train_loss: 0.6045, test_loss: 1.4345, test_f1: 0.5516
 epoch: 50, train_loss: 0.6547, test_loss: 1.3177, test_f1: 0.6173
 epoch: 51, train_loss: 0.5847, test_loss: 1.3100, test_f1: 0.6311
 epoch: 52, train_loss: 0.5535, test_loss: 1.0285, test_f1: 0.6461
 epoch: 53, train_loss: 0.5449, test_loss: 1.2780, test_f1: 0.6382
 epoch: 54, train_loss: 0.5265, test_loss: 1.3294, test_f1: 0.6075
 epoch: 55, train_loss: 0.5350, test_loss: 1.5386, test_f1: 0.5939
 epoch: 56, train_loss: 0.5005, test_loss: 1.1975, test_f1: 0.6186
 epoch: 57, train_loss: 0.5101, test_loss: 1.3277, test_f1: 0.5888
 epoch: 58, train_loss: 0.5462, test_loss: 1.4876, test_f1: 0.5386
 epoch: 59, train_loss: 0.5258, test_loss: 1.5208, test_f1: 0.6104
 epoch: 60, train_loss: 0.5357, test_loss: 1.2300, test_f1: 0.5935
 epoch: 61, train_loss: 0.5201, test_loss: 1.3893, test_f1: 0.6391
 epoch: 62, train_loss: 0.4989, test_loss: 1.3773, test_f1: 0.6302
 epoch: 63, train_loss: 0.5522, test_loss: 1.5518, test_f1: 0.5973
 epoch: 64, train_loss: 0.5104, test_loss: 1.2810, test_f1: 0.6115
 epoch: 65, train_loss: 0.5430, test_loss: 1.1785, test_f1: 0.6293
 epoch: 66, train_loss: 0.4926, test_loss: 1.3985, test_f1: 0.6128
 epoch: 67, train_loss: 0.5107, test_loss: 1.3075, test_f1: 0.5939
 epoch: 68, train_loss: 0.4813, test_loss: 1.3196, test_f1: 0.5962
 epoch: 69, train_loss: 0.4794, test_loss: 1.5085, test_f1: 0.5976
 epoch: 70, train_loss: 0.5003, test_loss: 1.2993, test_f1: 0.6070
 epoch: 71, train_loss: 0.5003, test_loss: 1.4870, test_f1: 0.6074
 epoch: 72, train_loss: 0.4709, test_loss: 1.4216, test_f1: 0.6211
 epoch: 73, train_loss: 0.4931, test_loss: 1.2721, test_f1: 0.6230
 epoch: 74, train_loss: 0.5180, test_loss: 1.2407, test_f1: 0.6272
 epoch: 75, train_loss: 0.5360, test_loss: 1.1592, test_f1: 0.6225
 epoch: 76, train_loss: 0.4880, test_loss: 1.1736, test_f1: 0.6265
 epoch: 77, train_loss: 0.4553, test_loss: 1.7557, test_f1: 0.6080
 epoch: 78, train_loss: 0.4553, test_loss: 1.7899, test_f1: 0.5922
 epoch: 79, train_loss: 0.4973, test_loss: 1.6489, test_f1: 0.6179
 epoch: 80, train_loss: 0.4718, test_loss: 1.3672, test_f1: 0.6300
 epoch: 81, train_loss: 0.4603, test_loss: 1.5057, test_f1: 0.6153
 epoch: 82, train_loss: 0.4469, test_loss: 2.0635, test_f1: 0.5481
 epoch: 83, train_loss: 0.4887, test_loss: 1.4914, test_f1: 0.5890
 epoch: 84, train_loss: 0.4314, test_loss: 1.5542, test_f1: 0.6144
 epoch: 85, train_loss: 0.4432, test_loss: 1.4902, test_f1: 0.6313
 epoch: 86, train_loss: 0.4659, test_loss: 1.3083, test_f1: 0.6201
 epoch: 87, train_loss: 0.4543, test_loss: 1.4911, test_f1: 0.6047
 epoch: 88, train_loss: 0.4539, test_loss: 1.3856, test_f1: 0.6174
 epoch: 89, train_loss: 0.4540, test_loss: 1.6024, test_f1: 0.6493
 epoch: 90, train_loss: 0.4352, test_loss: 1.4082, test_f1: 0.6069
 epoch: 91, train_loss: 0.4573, test_loss: 1.5786, test_f1: 0.6224
 epoch: 92, train_loss: 0.4157, test_loss: 1.5298, test_f1: 0.6314
 epoch: 93, train_loss: 0.4541, test_loss: 1.6813, test_f1: 0.6026
 epoch: 94, train_loss: 0.4332, test_loss: 1.4877, test_f1: 0.6219
 epoch: 95, train_loss: 0.4317, test_loss: 1.5129, test_f1: 0.6024
 epoch: 96, train_loss: 0.4403, test_loss: 1.6080, test_f1: 0.6091
 epoch: 97, train_loss: 0.4220, test_loss: 1.6014, test_f1: 0.6148
 epoch: 98, train_loss: 0.4649, test_loss: 1.3578, test_f1: 0.6142
 epoch: 99, train_loss: 0.4330, test_loss: 1.4524, test_f1: 0.6384
##################ITERATION #8 ****************************************
 epoch: 0, train_loss: 1.1672, test_loss: 1.3747, test_f1: 0.2336
 epoch: 1, train_loss: 0.9545, test_loss: 1.1026, test_f1: 0.4558
 epoch: 2, train_loss: 0.9417, test_loss: 1.0448, test_f1: 0.5222
 epoch: 3, train_loss: 0.8952, test_loss: 1.0787, test_f1: 0.5256
 epoch: 4, train_loss: 0.8496, test_loss: 1.0320, test_f1: 0.5198
 epoch: 5, train_loss: 0.8262, test_loss: 1.1600, test_f1: 0.4488
 epoch: 6, train_loss: 0.8292, test_loss: 1.1725, test_f1: 0.4307
 epoch: 7, train_loss: 0.8155, test_loss: 1.4031, test_f1: 0.4744
 epoch: 8, train_loss: 0.8013, test_loss: 1.0463, test_f1: 0.5481
 epoch: 9, train_loss: 0.7845, test_loss: 1.0555, test_f1: 0.5448
 epoch: 10, train_loss: 0.7582, test_loss: 1.6750, test_f1: 0.4631
 epoch: 11, train_loss: 0.8097, test_loss: 1.1185, test_f1: 0.4540
 epoch: 12, train_loss: 0.7757, test_loss: 1.4865, test_f1: 0.5079
 epoch: 13, train_loss: 0.7484, test_loss: 1.0524, test_f1: 0.5523
 epoch: 14, train_loss: 0.7429, test_loss: 1.3995, test_f1: 0.4765
 epoch: 15, train_loss: 0.7185, test_loss: 1.0581, test_f1: 0.5770
 epoch: 16, train_loss: 0.7209, test_loss: 1.2037, test_f1: 0.3954
 epoch: 17, train_loss: 0.6801, test_loss: 1.3235, test_f1: 0.5179
 epoch: 18, train_loss: 0.7030, test_loss: 1.4361, test_f1: 0.3644
 epoch: 19, train_loss: 0.7028, test_loss: 1.0755, test_f1: 0.5274
 epoch: 20, train_loss: 0.7203, test_loss: 1.2982, test_f1: 0.4808
 epoch: 21, train_loss: 0.6895, test_loss: 1.0952, test_f1: 0.5621
 epoch: 22, train_loss: 0.6953, test_loss: 1.2736, test_f1: 0.5621
 epoch: 23, train_loss: 0.7369, test_loss: 1.1244, test_f1: 0.5763
 epoch: 24, train_loss: 0.7050, test_loss: 1.6377, test_f1: 0.4882
 epoch: 25, train_loss: 0.7228, test_loss: 1.0921, test_f1: 0.5052
 epoch: 26, train_loss: 0.6725, test_loss: 1.0947, test_f1: 0.5631
 epoch: 27, train_loss: 0.6434, test_loss: 1.8569, test_f1: 0.5131
 epoch: 28, train_loss: 0.6497, test_loss: 1.1876, test_f1: 0.5690
 epoch: 29, train_loss: 0.6793, test_loss: 1.0027, test_f1: 0.6092
 epoch: 30, train_loss: 0.6476, test_loss: 1.3170, test_f1: 0.5458
 epoch: 31, train_loss: 0.6464, test_loss: 0.9853, test_f1: 0.6485
 epoch: 32, train_loss: 0.6247, test_loss: 1.1219, test_f1: 0.6078
 epoch: 33, train_loss: 0.6267, test_loss: 1.0073, test_f1: 0.5921
 epoch: 34, train_loss: 0.5754, test_loss: 1.2430, test_f1: 0.5063
 epoch: 35, train_loss: 0.5986, test_loss: 1.9607, test_f1: 0.4166
 epoch: 36, train_loss: 0.6570, test_loss: 1.3389, test_f1: 0.4986
 epoch: 37, train_loss: 0.6632, test_loss: 1.0351, test_f1: 0.6081
 epoch: 38, train_loss: 0.6058, test_loss: 1.4017, test_f1: 0.5390
 epoch: 39, train_loss: 0.5966, test_loss: 1.1302, test_f1: 0.6111
 epoch: 40, train_loss: 0.6269, test_loss: 1.1663, test_f1: 0.5638
 epoch: 41, train_loss: 0.6136, test_loss: 1.2150, test_f1: 0.6216
 epoch: 42, train_loss: 0.5866, test_loss: 1.2116, test_f1: 0.6279
 epoch: 43, train_loss: 0.5828, test_loss: 1.2717, test_f1: 0.5985
 epoch: 44, train_loss: 0.5602, test_loss: 1.3275, test_f1: 0.5443
 epoch: 45, train_loss: 0.5834, test_loss: 1.1134, test_f1: 0.5873
 epoch: 46, train_loss: 0.5818, test_loss: 1.0283, test_f1: 0.6153
 epoch: 47, train_loss: 0.5726, test_loss: 1.2289, test_f1: 0.6039
 epoch: 48, train_loss: 0.5591, test_loss: 1.3901, test_f1: 0.5102
 epoch: 49, train_loss: 0.6001, test_loss: 1.2463, test_f1: 0.5495
 epoch: 50, train_loss: 0.6014, test_loss: 1.3289, test_f1: 0.5631
 epoch: 51, train_loss: 0.5533, test_loss: 1.0885, test_f1: 0.6133
 epoch: 52, train_loss: 0.5029, test_loss: 1.1764, test_f1: 0.5704
 epoch: 53, train_loss: 0.4993, test_loss: 1.3022, test_f1: 0.5781
 epoch: 54, train_loss: 0.4602, test_loss: 1.2292, test_f1: 0.5978
 epoch: 55, train_loss: 0.4638, test_loss: 1.0776, test_f1: 0.6936
 epoch: 56, train_loss: 0.4685, test_loss: 1.2012, test_f1: 0.6185
 epoch: 57, train_loss: 0.5026, test_loss: 1.1478, test_f1: 0.6859
 epoch: 58, train_loss: 0.5029, test_loss: 1.3491, test_f1: 0.6468
 epoch: 59, train_loss: 0.4661, test_loss: 1.2962, test_f1: 0.6269
 epoch: 60, train_loss: 0.4681, test_loss: 1.2011, test_f1: 0.6182
 epoch: 61, train_loss: 0.4484, test_loss: 1.5475, test_f1: 0.5515
 epoch: 62, train_loss: 0.4751, test_loss: 1.2310, test_f1: 0.6509
 epoch: 63, train_loss: 0.4212, test_loss: 1.1998, test_f1: 0.6701
 epoch: 64, train_loss: 0.4523, test_loss: 1.2690, test_f1: 0.6313
 epoch: 65, train_loss: 0.4399, test_loss: 1.2196, test_f1: 0.6407
 epoch: 66, train_loss: 0.4276, test_loss: 1.3468, test_f1: 0.5813
 epoch: 67, train_loss: 0.4798, test_loss: 1.3891, test_f1: 0.5908
 epoch: 68, train_loss: 0.4420, test_loss: 1.7576, test_f1: 0.5998
 epoch: 69, train_loss: 0.4340, test_loss: 1.3468, test_f1: 0.6164
 epoch: 70, train_loss: 0.4578, test_loss: 1.2989, test_f1: 0.5998
 epoch: 71, train_loss: 0.4471, test_loss: 1.4424, test_f1: 0.6437
 epoch: 72, train_loss: 0.4159, test_loss: 1.4648, test_f1: 0.6723
 epoch: 73, train_loss: 0.4567, test_loss: 1.6388, test_f1: 0.6065
 epoch: 74, train_loss: 0.4318, test_loss: 1.3037, test_f1: 0.6426
 epoch: 75, train_loss: 0.4189, test_loss: 1.5561, test_f1: 0.6461
 epoch: 76, train_loss: 0.4272, test_loss: 1.2852, test_f1: 0.6626
 epoch: 77, train_loss: 0.4423, test_loss: 1.3654, test_f1: 0.6042
 epoch: 78, train_loss: 0.4404, test_loss: 1.4753, test_f1: 0.5698
 epoch: 79, train_loss: 0.4470, test_loss: 1.2864, test_f1: 0.6336
 epoch: 80, train_loss: 0.4030, test_loss: 1.4949, test_f1: 0.6354
 epoch: 81, train_loss: 0.4178, test_loss: 1.4472, test_f1: 0.6454
 epoch: 82, train_loss: 0.4241, test_loss: 1.2465, test_f1: 0.6516
 epoch: 83, train_loss: 0.4284, test_loss: 1.6162, test_f1: 0.6210
 epoch: 84, train_loss: 0.4144, test_loss: 1.2545, test_f1: 0.6506
 epoch: 85, train_loss: 0.4120, test_loss: 1.4537, test_f1: 0.6292
 epoch: 86, train_loss: 0.4087, test_loss: 1.4275, test_f1: 0.6219
 epoch: 87, train_loss: 0.4202, test_loss: 1.5980, test_f1: 0.5850
 epoch: 88, train_loss: 0.4288, test_loss: 1.2426, test_f1: 0.6637
 epoch: 89, train_loss: 0.3918, test_loss: 1.3167, test_f1: 0.6492
 epoch: 90, train_loss: 0.4161, test_loss: 1.6056, test_f1: 0.6109
 epoch: 91, train_loss: 0.3898, test_loss: 1.4108, test_f1: 0.5951
 epoch: 92, train_loss: 0.3957, test_loss: 1.5959, test_f1: 0.6269
 epoch: 93, train_loss: 0.3972, test_loss: 1.3123, test_f1: 0.6125
 epoch: 94, train_loss: 0.3756, test_loss: 1.3543, test_f1: 0.6286
 epoch: 95, train_loss: 0.3937, test_loss: 1.3638, test_f1: 0.6277
 epoch: 96, train_loss: 0.4254, test_loss: 1.5123, test_f1: 0.6334
 epoch: 97, train_loss: 0.3699, test_loss: 1.3892, test_f1: 0.6374
 epoch: 98, train_loss: 0.3797, test_loss: 1.3917, test_f1: 0.6456
 epoch: 99, train_loss: 0.4136, test_loss: 1.2388, test_f1: 0.6436
##################ITERATION #9 ****************************************
 epoch: 0, train_loss: 1.1482, test_loss: 1.4626, test_f1: 0.3571
 epoch: 1, train_loss: 0.9885, test_loss: 1.2437, test_f1: 0.3268
 epoch: 2, train_loss: 0.9379, test_loss: 1.0414, test_f1: 0.5378
 epoch: 3, train_loss: 0.8865, test_loss: 1.0649, test_f1: 0.5238
 epoch: 4, train_loss: 0.8512, test_loss: 1.1505, test_f1: 0.4599
 epoch: 5, train_loss: 0.8430, test_loss: 1.0447, test_f1: 0.5182
 epoch: 6, train_loss: 0.8544, test_loss: 1.3277, test_f1: 0.4683
 epoch: 7, train_loss: 0.8246, test_loss: 2.7585, test_f1: 0.3501
 epoch: 8, train_loss: 0.7832, test_loss: 1.0162, test_f1: 0.5548
 epoch: 9, train_loss: 0.8105, test_loss: 1.1324, test_f1: 0.5217
 epoch: 10, train_loss: 0.7958, test_loss: 1.0184, test_f1: 0.6181
 epoch: 11, train_loss: 0.8002, test_loss: 1.1268, test_f1: 0.5469
 epoch: 12, train_loss: 0.7829, test_loss: 1.1279, test_f1: 0.5210
 epoch: 13, train_loss: 0.7783, test_loss: 1.0277, test_f1: 0.5974
 epoch: 14, train_loss: 0.7710, test_loss: 0.9874, test_f1: 0.6044
 epoch: 15, train_loss: 0.7495, test_loss: 1.1559, test_f1: 0.5538
 epoch: 16, train_loss: 0.7372, test_loss: 1.0721, test_f1: 0.5970
 epoch: 17, train_loss: 0.7753, test_loss: 1.0722, test_f1: 0.5489
 epoch: 18, train_loss: 0.7513, test_loss: 1.4950, test_f1: 0.5015
 epoch: 19, train_loss: 0.7348, test_loss: 1.8028, test_f1: 0.4752
 epoch: 20, train_loss: 0.7534, test_loss: 1.1264, test_f1: 0.5631
 epoch: 21, train_loss: 0.7152, test_loss: 1.4262, test_f1: 0.5628
 epoch: 22, train_loss: 0.7176, test_loss: 1.1016, test_f1: 0.5816
 epoch: 23, train_loss: 0.7097, test_loss: 1.1238, test_f1: 0.5953
 epoch: 24, train_loss: 0.7055, test_loss: 1.2173, test_f1: 0.5952
 epoch: 25, train_loss: 0.6910, test_loss: 1.3072, test_f1: 0.5644
 epoch: 26, train_loss: 0.7235, test_loss: 1.1509, test_f1: 0.4745
 epoch: 27, train_loss: 0.6999, test_loss: 1.1719, test_f1: 0.5994
 epoch: 28, train_loss: 0.6803, test_loss: 1.6265, test_f1: 0.5540
 epoch: 29, train_loss: 0.6691, test_loss: 1.1742, test_f1: 0.5665
 epoch: 30, train_loss: 0.6563, test_loss: 1.5026, test_f1: 0.5562
 epoch: 31, train_loss: 0.6759, test_loss: 1.4794, test_f1: 0.5136
 epoch: 32, train_loss: 0.6859, test_loss: 1.7405, test_f1: 0.5375
 epoch: 33, train_loss: 0.6587, test_loss: 1.2479, test_f1: 0.5145
 epoch: 34, train_loss: 0.6576, test_loss: 1.2526, test_f1: 0.5504
 epoch: 35, train_loss: 0.7304, test_loss: 1.1763, test_f1: 0.5748
 epoch: 36, train_loss: 0.6836, test_loss: 1.0676, test_f1: 0.6324
 epoch: 37, train_loss: 0.6754, test_loss: 1.0617, test_f1: 0.6088
 epoch: 38, train_loss: 0.6350, test_loss: 1.2825, test_f1: 0.5789
 epoch: 39, train_loss: 0.6386, test_loss: 1.4722, test_f1: 0.6410
 epoch: 40, train_loss: 0.6206, test_loss: 1.1967, test_f1: 0.5929
 epoch: 41, train_loss: 0.5998, test_loss: 1.2439, test_f1: 0.6049
 epoch: 42, train_loss: 0.6349, test_loss: 1.2100, test_f1: 0.5472
 epoch: 43, train_loss: 0.6053, test_loss: 1.2702, test_f1: 0.6054
 epoch: 44, train_loss: 0.6170, test_loss: 1.6549, test_f1: 0.5217
 epoch: 45, train_loss: 0.6255, test_loss: 1.4100, test_f1: 0.5981
 epoch: 46, train_loss: 0.6091, test_loss: 1.2538, test_f1: 0.5889
 epoch: 47, train_loss: 0.5928, test_loss: 1.3253, test_f1: 0.6221
 epoch: 48, train_loss: 0.5914, test_loss: 1.4803, test_f1: 0.5702
 epoch: 49, train_loss: 0.6039, test_loss: 1.1548, test_f1: 0.6122
 epoch: 50, train_loss: 0.6335, test_loss: 1.5255, test_f1: 0.5446
 epoch: 51, train_loss: 0.5745, test_loss: 1.2162, test_f1: 0.6169
 epoch: 52, train_loss: 0.5395, test_loss: 1.2575, test_f1: 0.6150
 epoch: 53, train_loss: 0.5161, test_loss: 1.2394, test_f1: 0.6298
 epoch: 54, train_loss: 0.5339, test_loss: 1.2983, test_f1: 0.6510
 epoch: 55, train_loss: 0.5308, test_loss: 1.5315, test_f1: 0.6080
 epoch: 56, train_loss: 0.5077, test_loss: 1.1783, test_f1: 0.6334
 epoch: 57, train_loss: 0.5420, test_loss: 1.2413, test_f1: 0.6149
 epoch: 58, train_loss: 0.5000, test_loss: 1.2954, test_f1: 0.5796
 epoch: 59, train_loss: 0.5210, test_loss: 1.4441, test_f1: 0.6396
 epoch: 60, train_loss: 0.5051, test_loss: 1.2403, test_f1: 0.6403
 epoch: 61, train_loss: 0.4780, test_loss: 1.3466, test_f1: 0.6393
 epoch: 62, train_loss: 0.4683, test_loss: 1.6377, test_f1: 0.6079
 epoch: 63, train_loss: 0.4805, test_loss: 1.5521, test_f1: 0.6170
 epoch: 64, train_loss: 0.4767, test_loss: 1.5331, test_f1: 0.5880
 epoch: 65, train_loss: 0.4818, test_loss: 1.3743, test_f1: 0.5811
 epoch: 66, train_loss: 0.4657, test_loss: 1.5232, test_f1: 0.5912
 epoch: 67, train_loss: 0.4651, test_loss: 1.3845, test_f1: 0.6462
 epoch: 68, train_loss: 0.4645, test_loss: 1.3081, test_f1: 0.6140
 epoch: 69, train_loss: 0.5059, test_loss: 1.4309, test_f1: 0.6209
 epoch: 70, train_loss: 0.5003, test_loss: 1.4764, test_f1: 0.5917
 epoch: 71, train_loss: 0.4884, test_loss: 1.4676, test_f1: 0.6329
 epoch: 72, train_loss: 0.4671, test_loss: 1.4558, test_f1: 0.6478
 epoch: 73, train_loss: 0.4709, test_loss: 1.5746, test_f1: 0.5880
 epoch: 74, train_loss: 0.4861, test_loss: 1.7059, test_f1: 0.5667
 epoch: 75, train_loss: 0.4611, test_loss: 1.6697, test_f1: 0.6499
 epoch: 76, train_loss: 0.4433, test_loss: 1.6648, test_f1: 0.6118
 epoch: 77, train_loss: 0.4529, test_loss: 1.3981, test_f1: 0.6504
 epoch: 78, train_loss: 0.4551, test_loss: 1.5534, test_f1: 0.6354
 epoch: 79, train_loss: 0.4454, test_loss: 1.4014, test_f1: 0.6105
 epoch: 80, train_loss: 0.4160, test_loss: 1.7291, test_f1: 0.6330
 epoch: 81, train_loss: 0.4251, test_loss: 1.7246, test_f1: 0.6202
 epoch: 82, train_loss: 0.4643, test_loss: 1.7469, test_f1: 0.5839
 epoch: 83, train_loss: 0.4473, test_loss: 1.7055, test_f1: 0.6147
 epoch: 84, train_loss: 0.4913, test_loss: 1.7005, test_f1: 0.5661
 epoch: 85, train_loss: 0.4236, test_loss: 1.8644, test_f1: 0.6140
 epoch: 86, train_loss: 0.4640, test_loss: 1.4658, test_f1: 0.6097
 epoch: 87, train_loss: 0.4334, test_loss: 1.3811, test_f1: 0.6242
 epoch: 88, train_loss: 0.4521, test_loss: 1.6152, test_f1: 0.6231
 epoch: 89, train_loss: 0.4385, test_loss: 1.6143, test_f1: 0.6362
 epoch: 90, train_loss: 0.4247, test_loss: 1.9115, test_f1: 0.6486
 epoch: 91, train_loss: 0.4000, test_loss: 1.7146, test_f1: 0.6066
 epoch: 92, train_loss: 0.4129, test_loss: 1.6001, test_f1: 0.6150
 epoch: 93, train_loss: 0.3991, test_loss: 1.6588, test_f1: 0.6174
 epoch: 94, train_loss: 0.3929, test_loss: 1.6282, test_f1: 0.6167
 epoch: 95, train_loss: 0.4213, test_loss: 1.6710, test_f1: 0.6357
 epoch: 96, train_loss: 0.4259, test_loss: 1.4463, test_f1: 0.6394
 epoch: 97, train_loss: 0.4260, test_loss: 1.9084, test_f1: 0.6202
 epoch: 98, train_loss: 0.4385, test_loss: 1.7262, test_f1: 0.6351
 epoch: 99, train_loss: 0.4160, test_loss: 1.7159, test_f1: 0.6258

Training completed in 417.05 seconds
Best F1: 0.6936 at epoch 55
Mean F1 across iterations: 0.6559  0.0174
========================FINAL RESULTS================================
FEGIN weighted F1: 0.6936  0.0174
python main.py --data ltspice_demos --representation component_pin_net --model FEGIN --layers 3 --hiddens 32 --batch_size 64 --lr 0.01 --emb_size 512 --epochs 100 --save_appendix component_pin_net_L3_H32_BS64_LR0.01_E512 --no_val
-----



STDERR:
  File "main.py", line 370, in <module>
    main()
  File "main.py", line 254, in main
    dataset = dataset_class(
  File "/home/philip/projects/ltspice_examples_code_repo/Circuit-Completion-Using-GNNs/component_classification_with_link_prediction_head/evaluation/FEGIN/kernel/circuit_datasets.py", line 15, in __init__
    self.data, self.slices = torch.load(self.processed_paths[0])
  File "/home/philip/.local/lib/python3.8/site-packages/torch/serialization.py", line 1040, in load
    warnings.warn(
  File "/usr/lib/python3.8/warnings.py", line 109, in _showwarnmsg
    sw(msg.message, msg.category, msg.filename, msg.lineno,
  File "main.py", line 47, in warn_with_traceback
    traceback.print_stack(file=log)
/home/philip/projects/ltspice_examples_code_repo/Circuit-Completion-Using-GNNs/component_classification_with_link_prediction_head/evaluation/FEGIN/kernel/circuit_datasets.py:15: FutureWarning: You are using `torch.load` with `weights_only=False` (the current default value), which uses the default pickle module implicitly. It is possible to construct malicious pickle data which will execute arbitrary code during unpickling (See https://github.com/pytorch/pytorch/blob/main/SECURITY.md#untrusted-models for more details). In a future release, the default value for `weights_only` will be flipped to `True`. This limits the functions that could be executed during unpickling. Arbitrary objects will no longer be allowed to be loaded via this mode unless they are explicitly allowlisted by the user via `torch.serialization.add_safe_globals`. We recommend you start setting `weights_only=True` for any use case where you don't have full control of the loaded file. Please open an issue on GitHub for any issues related to this experimental feature.
  self.data, self.slices = torch.load(self.processed_paths[0])
