STDOUT:
Results will be saved in /home/philip/projects/ltspice_examples_code_repo/Circuit-Completion-Using-GNNs/component_classification_with_link_prediction_head/evaluation/FEGIN/results/model_FEGIN_dataset_ltspice_examples
Command line input: python main.py --data ltspice_examples --representation component_net --model FEGIN --layers 4 --hiddens 64 --batch_size 256 --lr 0.0001 --emb_size 250 --epochs 100 --save_appendix component_net_L4_H64_BS256_LR0.0001_E250 --no_val
 is saved.
-----
ltspice_examples - FEGIN
Using 4 layers, 64 hidden units, h = 2
Loading component_net representation dataset
ENTERED
Training FEGIN on component_net representation
Train: 3558, Test: 846
##################ITERATION #0 ****************************************
 epoch: 0, train_loss: 1.3697, test_loss: 1.3756, test_f1: 0.2270
 epoch: 1, train_loss: 1.3602, test_loss: 1.3738, test_f1: 0.2270
 epoch: 2, train_loss: 1.3535, test_loss: 1.3686, test_f1: 0.2270
 epoch: 3, train_loss: 1.3456, test_loss: 1.3574, test_f1: 0.2270
 epoch: 4, train_loss: 1.3370, test_loss: 1.3415, test_f1: 0.2270
 epoch: 5, train_loss: 1.3275, test_loss: 1.3280, test_f1: 0.2270
 epoch: 6, train_loss: 1.3181, test_loss: 1.3170, test_f1: 0.2270
 epoch: 7, train_loss: 1.3085, test_loss: 1.3061, test_f1: 0.2270
 epoch: 8, train_loss: 1.2982, test_loss: 1.2961, test_f1: 0.2270
 epoch: 9, train_loss: 1.2872, test_loss: 1.2855, test_f1: 0.2270
 epoch: 10, train_loss: 1.2777, test_loss: 1.2741, test_f1: 0.2270
 epoch: 11, train_loss: 1.2656, test_loss: 1.2625, test_f1: 0.2270
 epoch: 12, train_loss: 1.2544, test_loss: 1.2502, test_f1: 0.2270
 epoch: 13, train_loss: 1.2409, test_loss: 1.2376, test_f1: 0.2295
 epoch: 14, train_loss: 1.2310, test_loss: 1.2260, test_f1: 0.2467
 epoch: 15, train_loss: 1.2221, test_loss: 1.2128, test_f1: 0.2744
 epoch: 16, train_loss: 1.2122, test_loss: 1.2030, test_f1: 0.2830
 epoch: 17, train_loss: 1.2015, test_loss: 1.1915, test_f1: 0.3105
 epoch: 18, train_loss: 1.1914, test_loss: 1.1778, test_f1: 0.3309
 epoch: 19, train_loss: 1.1762, test_loss: 1.1661, test_f1: 0.3353
 epoch: 20, train_loss: 1.1678, test_loss: 1.1499, test_f1: 0.3433
 epoch: 21, train_loss: 1.1551, test_loss: 1.1427, test_f1: 0.3401
 epoch: 22, train_loss: 1.1436, test_loss: 1.1220, test_f1: 0.3733
 epoch: 23, train_loss: 1.1251, test_loss: 1.1064, test_f1: 0.3997
 epoch: 24, train_loss: 1.1191, test_loss: 1.0927, test_f1: 0.4232
 epoch: 25, train_loss: 1.1060, test_loss: 1.0798, test_f1: 0.4429
 epoch: 26, train_loss: 1.0884, test_loss: 1.0645, test_f1: 0.4551
 epoch: 27, train_loss: 1.0742, test_loss: 1.0491, test_f1: 0.4794
 epoch: 28, train_loss: 1.0623, test_loss: 1.0329, test_f1: 0.4933
 epoch: 29, train_loss: 1.0533, test_loss: 1.0235, test_f1: 0.4870
 epoch: 30, train_loss: 1.0316, test_loss: 1.0012, test_f1: 0.4924
 epoch: 31, train_loss: 1.0204, test_loss: 0.9979, test_f1: 0.4916
 epoch: 32, train_loss: 1.0083, test_loss: 0.9838, test_f1: 0.5036
 epoch: 33, train_loss: 0.9929, test_loss: 0.9775, test_f1: 0.4983
 epoch: 34, train_loss: 0.9832, test_loss: 0.9656, test_f1: 0.5113
 epoch: 35, train_loss: 0.9734, test_loss: 0.9530, test_f1: 0.5019
 epoch: 36, train_loss: 0.9699, test_loss: 0.9441, test_f1: 0.5074
 epoch: 37, train_loss: 0.9549, test_loss: 0.9400, test_f1: 0.5219
 epoch: 38, train_loss: 0.9438, test_loss: 0.9318, test_f1: 0.5115
 epoch: 39, train_loss: 0.9414, test_loss: 0.9255, test_f1: 0.5027
 epoch: 40, train_loss: 0.9235, test_loss: 0.9241, test_f1: 0.5079
 epoch: 41, train_loss: 0.9213, test_loss: 0.9174, test_f1: 0.5207
 epoch: 42, train_loss: 0.9174, test_loss: 0.9247, test_f1: 0.5124
 epoch: 43, train_loss: 0.9083, test_loss: 0.9399, test_f1: 0.4973
 epoch: 44, train_loss: 0.9024, test_loss: 0.9004, test_f1: 0.5161
 epoch: 45, train_loss: 0.8927, test_loss: 0.9115, test_f1: 0.5045
 epoch: 46, train_loss: 0.8883, test_loss: 0.8958, test_f1: 0.5175
 epoch: 47, train_loss: 0.8885, test_loss: 0.9184, test_f1: 0.4994
 epoch: 48, train_loss: 0.8838, test_loss: 0.8919, test_f1: 0.5349
 epoch: 49, train_loss: 0.8795, test_loss: 0.9049, test_f1: 0.5230
 epoch: 50, train_loss: 0.8686, test_loss: 0.8867, test_f1: 0.5377
 epoch: 51, train_loss: 0.8716, test_loss: 0.8857, test_f1: 0.5332
 epoch: 52, train_loss: 0.8585, test_loss: 0.8953, test_f1: 0.5311
 epoch: 53, train_loss: 0.8570, test_loss: 0.8980, test_f1: 0.5234
 epoch: 54, train_loss: 0.8589, test_loss: 0.8977, test_f1: 0.5093
 epoch: 55, train_loss: 0.8536, test_loss: 0.8858, test_f1: 0.5127
 epoch: 56, train_loss: 0.8579, test_loss: 0.8974, test_f1: 0.5234
 epoch: 57, train_loss: 0.8616, test_loss: 0.8962, test_f1: 0.5192
 epoch: 58, train_loss: 0.8563, test_loss: 0.8992, test_f1: 0.5092
 epoch: 59, train_loss: 0.8578, test_loss: 0.8991, test_f1: 0.5326
 epoch: 60, train_loss: 0.8432, test_loss: 0.8928, test_f1: 0.5367
 epoch: 61, train_loss: 0.8531, test_loss: 0.9132, test_f1: 0.5323
 epoch: 62, train_loss: 0.8440, test_loss: 0.8854, test_f1: 0.5362
 epoch: 63, train_loss: 0.8403, test_loss: 0.8914, test_f1: 0.5152
 epoch: 64, train_loss: 0.8395, test_loss: 0.9025, test_f1: 0.5146
 epoch: 65, train_loss: 0.8378, test_loss: 0.9030, test_f1: 0.5129
 epoch: 66, train_loss: 0.8321, test_loss: 0.8958, test_f1: 0.5388
 epoch: 67, train_loss: 0.8336, test_loss: 0.8876, test_f1: 0.5344
 epoch: 68, train_loss: 0.8315, test_loss: 0.8995, test_f1: 0.5357
 epoch: 69, train_loss: 0.8257, test_loss: 0.9004, test_f1: 0.5358
 epoch: 70, train_loss: 0.8297, test_loss: 0.8935, test_f1: 0.5429
 epoch: 71, train_loss: 0.8326, test_loss: 0.9081, test_f1: 0.5357
 epoch: 72, train_loss: 0.8263, test_loss: 0.8941, test_f1: 0.5389
 epoch: 73, train_loss: 0.8288, test_loss: 0.9127, test_f1: 0.5309
 epoch: 74, train_loss: 0.8318, test_loss: 0.9126, test_f1: 0.5277
 epoch: 75, train_loss: 0.8242, test_loss: 0.8958, test_f1: 0.5398
 epoch: 76, train_loss: 0.8243, test_loss: 0.9174, test_f1: 0.5326
 epoch: 77, train_loss: 0.8314, test_loss: 0.9041, test_f1: 0.5379
 epoch: 78, train_loss: 0.8202, test_loss: 0.8948, test_f1: 0.5323
 epoch: 79, train_loss: 0.8220, test_loss: 0.9114, test_f1: 0.5278
 epoch: 80, train_loss: 0.8249, test_loss: 0.8949, test_f1: 0.5356
 epoch: 81, train_loss: 0.8193, test_loss: 0.9255, test_f1: 0.5210
 epoch: 82, train_loss: 0.8180, test_loss: 0.9047, test_f1: 0.5398
 epoch: 83, train_loss: 0.8189, test_loss: 0.9161, test_f1: 0.5319
 epoch: 84, train_loss: 0.8097, test_loss: 0.9128, test_f1: 0.5309
 epoch: 85, train_loss: 0.8135, test_loss: 0.9186, test_f1: 0.5275
 epoch: 86, train_loss: 0.8127, test_loss: 0.9189, test_f1: 0.5354
 epoch: 87, train_loss: 0.8024, test_loss: 0.9021, test_f1: 0.5336
 epoch: 88, train_loss: 0.8146, test_loss: 0.9036, test_f1: 0.5382
 epoch: 89, train_loss: 0.8080, test_loss: 0.9171, test_f1: 0.5302
 epoch: 90, train_loss: 0.8104, test_loss: 0.9077, test_f1: 0.5340
 epoch: 91, train_loss: 0.8002, test_loss: 0.9135, test_f1: 0.5346
 epoch: 92, train_loss: 0.8044, test_loss: 0.9084, test_f1: 0.5373
 epoch: 93, train_loss: 0.8038, test_loss: 0.9019, test_f1: 0.5382
 epoch: 94, train_loss: 0.7963, test_loss: 0.9116, test_f1: 0.5397
 epoch: 95, train_loss: 0.7976, test_loss: 0.9117, test_f1: 0.5329
 epoch: 96, train_loss: 0.7983, test_loss: 0.9294, test_f1: 0.5368
 epoch: 97, train_loss: 0.7885, test_loss: 0.9113, test_f1: 0.5415
 epoch: 98, train_loss: 0.7916, test_loss: 0.9282, test_f1: 0.5363
 epoch: 99, train_loss: 0.8023, test_loss: 0.9136, test_f1: 0.5360
##################ITERATION #1 ****************************************
 epoch: 0, train_loss: 1.3301, test_loss: 1.3593, test_f1: 0.2270
 epoch: 1, train_loss: 1.3065, test_loss: 1.3450, test_f1: 0.2270
 epoch: 2, train_loss: 1.2910, test_loss: 1.3261, test_f1: 0.2270
 epoch: 3, train_loss: 1.2790, test_loss: 1.3003, test_f1: 0.2270
 epoch: 4, train_loss: 1.2668, test_loss: 1.2733, test_f1: 0.2270
 epoch: 5, train_loss: 1.2533, test_loss: 1.2505, test_f1: 0.2270
 epoch: 6, train_loss: 1.2412, test_loss: 1.2310, test_f1: 0.2709
 epoch: 7, train_loss: 1.2286, test_loss: 1.2143, test_f1: 0.2836
 epoch: 8, train_loss: 1.2150, test_loss: 1.2002, test_f1: 0.2929
 epoch: 9, train_loss: 1.2013, test_loss: 1.1817, test_f1: 0.3335
 epoch: 10, train_loss: 1.1850, test_loss: 1.1676, test_f1: 0.3663
 epoch: 11, train_loss: 1.1714, test_loss: 1.1461, test_f1: 0.3964
 epoch: 12, train_loss: 1.1508, test_loss: 1.1270, test_f1: 0.4173
 epoch: 13, train_loss: 1.1367, test_loss: 1.1145, test_f1: 0.4187
 epoch: 14, train_loss: 1.1157, test_loss: 1.0852, test_f1: 0.4244
 epoch: 15, train_loss: 1.1009, test_loss: 1.0664, test_f1: 0.4511
 epoch: 16, train_loss: 1.0816, test_loss: 1.0476, test_f1: 0.4738
 epoch: 17, train_loss: 1.0670, test_loss: 1.0322, test_f1: 0.4682
 epoch: 18, train_loss: 1.0524, test_loss: 1.0174, test_f1: 0.4804
 epoch: 19, train_loss: 1.0322, test_loss: 1.0039, test_f1: 0.4790
 epoch: 20, train_loss: 1.0208, test_loss: 0.9901, test_f1: 0.4827
 epoch: 21, train_loss: 1.0085, test_loss: 0.9985, test_f1: 0.4867
 epoch: 22, train_loss: 0.9981, test_loss: 0.9689, test_f1: 0.4960
 epoch: 23, train_loss: 0.9963, test_loss: 0.9619, test_f1: 0.4985
 epoch: 24, train_loss: 0.9800, test_loss: 0.9480, test_f1: 0.4996
 epoch: 25, train_loss: 0.9663, test_loss: 0.9645, test_f1: 0.4994
 epoch: 26, train_loss: 0.9591, test_loss: 0.9383, test_f1: 0.5104
 epoch: 27, train_loss: 0.9515, test_loss: 0.9479, test_f1: 0.5041
 epoch: 28, train_loss: 0.9404, test_loss: 0.9323, test_f1: 0.5051
 epoch: 29, train_loss: 0.9292, test_loss: 0.9460, test_f1: 0.5078
 epoch: 30, train_loss: 0.9263, test_loss: 0.9265, test_f1: 0.5193
 epoch: 31, train_loss: 0.9199, test_loss: 0.9232, test_f1: 0.5126
 epoch: 32, train_loss: 0.9116, test_loss: 0.9295, test_f1: 0.4984
 epoch: 33, train_loss: 0.9147, test_loss: 1.0035, test_f1: 0.4847
 epoch: 34, train_loss: 0.9009, test_loss: 0.9143, test_f1: 0.5180
 epoch: 35, train_loss: 0.8977, test_loss: 0.9152, test_f1: 0.5242
 epoch: 36, train_loss: 0.8972, test_loss: 0.9627, test_f1: 0.5157
 epoch: 37, train_loss: 0.8898, test_loss: 0.9300, test_f1: 0.5141
 epoch: 38, train_loss: 0.8864, test_loss: 0.8980, test_f1: 0.5262
 epoch: 39, train_loss: 0.8826, test_loss: 0.9228, test_f1: 0.5231
 epoch: 40, train_loss: 0.8754, test_loss: 0.9234, test_f1: 0.5146
 epoch: 41, train_loss: 0.8713, test_loss: 0.9147, test_f1: 0.5160
 epoch: 42, train_loss: 0.8656, test_loss: 1.0843, test_f1: 0.4921
 epoch: 43, train_loss: 0.8594, test_loss: 0.9015, test_f1: 0.5246
 epoch: 44, train_loss: 0.8620, test_loss: 0.9032, test_f1: 0.5237
 epoch: 45, train_loss: 0.8594, test_loss: 0.9171, test_f1: 0.5297
 epoch: 46, train_loss: 0.8507, test_loss: 0.9438, test_f1: 0.5096
 epoch: 47, train_loss: 0.8523, test_loss: 0.9163, test_f1: 0.5121
 epoch: 48, train_loss: 0.8471, test_loss: 0.8996, test_f1: 0.5187
 epoch: 49, train_loss: 0.8520, test_loss: 0.9196, test_f1: 0.5288
 epoch: 50, train_loss: 0.8426, test_loss: 0.8898, test_f1: 0.5274
 epoch: 51, train_loss: 0.8312, test_loss: 0.8998, test_f1: 0.5260
 epoch: 52, train_loss: 0.8285, test_loss: 0.9215, test_f1: 0.5154
 epoch: 53, train_loss: 0.8300, test_loss: 0.9011, test_f1: 0.5144
 epoch: 54, train_loss: 0.8322, test_loss: 0.9233, test_f1: 0.5371
 epoch: 55, train_loss: 0.8242, test_loss: 0.9204, test_f1: 0.5278
 epoch: 56, train_loss: 0.8301, test_loss: 0.9077, test_f1: 0.5189
 epoch: 57, train_loss: 0.8262, test_loss: 0.9178, test_f1: 0.5465
 epoch: 58, train_loss: 0.8214, test_loss: 0.9460, test_f1: 0.5439
 epoch: 59, train_loss: 0.8208, test_loss: 0.9011, test_f1: 0.5501
 epoch: 60, train_loss: 0.8227, test_loss: 0.9236, test_f1: 0.5353
 epoch: 61, train_loss: 0.8103, test_loss: 0.9302, test_f1: 0.5467
 epoch: 62, train_loss: 0.8117, test_loss: 0.9079, test_f1: 0.5436
 epoch: 63, train_loss: 0.8158, test_loss: 0.9112, test_f1: 0.5445
 epoch: 64, train_loss: 0.8136, test_loss: 0.9410, test_f1: 0.5430
 epoch: 65, train_loss: 0.8195, test_loss: 0.9239, test_f1: 0.5431
 epoch: 66, train_loss: 0.8126, test_loss: 0.9147, test_f1: 0.5408
 epoch: 67, train_loss: 0.8083, test_loss: 0.9285, test_f1: 0.5378
 epoch: 68, train_loss: 0.8140, test_loss: 0.9152, test_f1: 0.5461
 epoch: 69, train_loss: 0.8101, test_loss: 0.9333, test_f1: 0.5316
 epoch: 70, train_loss: 0.8103, test_loss: 0.9429, test_f1: 0.5296
 epoch: 71, train_loss: 0.8119, test_loss: 0.9272, test_f1: 0.5288
 epoch: 72, train_loss: 0.8053, test_loss: 0.9144, test_f1: 0.5349
 epoch: 73, train_loss: 0.8074, test_loss: 0.9130, test_f1: 0.5309
 epoch: 74, train_loss: 0.7975, test_loss: 0.9231, test_f1: 0.5339
 epoch: 75, train_loss: 0.7974, test_loss: 0.9287, test_f1: 0.5416
 epoch: 76, train_loss: 0.8083, test_loss: 0.9276, test_f1: 0.5318
 epoch: 77, train_loss: 0.7975, test_loss: 0.9395, test_f1: 0.5498
 epoch: 78, train_loss: 0.7939, test_loss: 0.9266, test_f1: 0.5523
 epoch: 79, train_loss: 0.7977, test_loss: 0.9449, test_f1: 0.5425
 epoch: 80, train_loss: 0.7970, test_loss: 0.9186, test_f1: 0.5490
 epoch: 81, train_loss: 0.7966, test_loss: 0.9296, test_f1: 0.5463
 epoch: 82, train_loss: 0.7909, test_loss: 0.9505, test_f1: 0.5472
 epoch: 83, train_loss: 0.7864, test_loss: 0.9341, test_f1: 0.5397
 epoch: 84, train_loss: 0.7859, test_loss: 0.9314, test_f1: 0.5490
 epoch: 85, train_loss: 0.7896, test_loss: 0.9348, test_f1: 0.5389
 epoch: 86, train_loss: 0.7862, test_loss: 0.9493, test_f1: 0.5304
 epoch: 87, train_loss: 0.7926, test_loss: 0.9254, test_f1: 0.5300
 epoch: 88, train_loss: 0.7882, test_loss: 0.9486, test_f1: 0.5498
 epoch: 89, train_loss: 0.7849, test_loss: 0.9350, test_f1: 0.5303
 epoch: 90, train_loss: 0.7821, test_loss: 0.9192, test_f1: 0.5403
 epoch: 91, train_loss: 0.7817, test_loss: 0.9785, test_f1: 0.5336
 epoch: 92, train_loss: 0.7878, test_loss: 0.9288, test_f1: 0.5259
 epoch: 93, train_loss: 0.7715, test_loss: 0.9369, test_f1: 0.5371
 epoch: 94, train_loss: 0.7812, test_loss: 0.9315, test_f1: 0.5304
 epoch: 95, train_loss: 0.7772, test_loss: 0.9381, test_f1: 0.5276
 epoch: 96, train_loss: 0.7849, test_loss: 0.9930, test_f1: 0.5400
 epoch: 97, train_loss: 0.7732, test_loss: 0.9356, test_f1: 0.5310
 epoch: 98, train_loss: 0.7778, test_loss: 0.9503, test_f1: 0.5265
 epoch: 99, train_loss: 0.7912, test_loss: 0.9428, test_f1: 0.5253
##################ITERATION #2 ****************************************
 epoch: 0, train_loss: 1.3160, test_loss: 1.3423, test_f1: 0.2270
 epoch: 1, train_loss: 1.2806, test_loss: 1.3265, test_f1: 0.2270
 epoch: 2, train_loss: 1.2669, test_loss: 1.3081, test_f1: 0.2270
 epoch: 3, train_loss: 1.2472, test_loss: 1.2742, test_f1: 0.2392
 epoch: 4, train_loss: 1.2329, test_loss: 1.2342, test_f1: 0.2971
 epoch: 5, train_loss: 1.2167, test_loss: 1.2001, test_f1: 0.3471
 epoch: 6, train_loss: 1.1994, test_loss: 1.1730, test_f1: 0.3773
 epoch: 7, train_loss: 1.1803, test_loss: 1.1516, test_f1: 0.4172
 epoch: 8, train_loss: 1.1663, test_loss: 1.1333, test_f1: 0.4292
 epoch: 9, train_loss: 1.1473, test_loss: 1.1163, test_f1: 0.4336
 epoch: 10, train_loss: 1.1303, test_loss: 1.0949, test_f1: 0.4338
 epoch: 11, train_loss: 1.1153, test_loss: 1.0806, test_f1: 0.4365
 epoch: 12, train_loss: 1.0992, test_loss: 1.0636, test_f1: 0.4404
 epoch: 13, train_loss: 1.0844, test_loss: 1.0483, test_f1: 0.4531
 epoch: 14, train_loss: 1.0691, test_loss: 1.0369, test_f1: 0.4472
 epoch: 15, train_loss: 1.0580, test_loss: 1.0215, test_f1: 0.4516
 epoch: 16, train_loss: 1.0410, test_loss: 1.0091, test_f1: 0.4492
 epoch: 17, train_loss: 1.0270, test_loss: 0.9994, test_f1: 0.4629
 epoch: 18, train_loss: 1.0163, test_loss: 0.9876, test_f1: 0.4592
 epoch: 19, train_loss: 1.0033, test_loss: 0.9777, test_f1: 0.4690
 epoch: 20, train_loss: 0.9964, test_loss: 0.9683, test_f1: 0.4642
 epoch: 21, train_loss: 0.9805, test_loss: 0.9696, test_f1: 0.4691
 epoch: 22, train_loss: 0.9741, test_loss: 0.9536, test_f1: 0.4726
 epoch: 23, train_loss: 0.9627, test_loss: 0.9520, test_f1: 0.4833
 epoch: 24, train_loss: 0.9522, test_loss: 0.9434, test_f1: 0.4735
 epoch: 25, train_loss: 0.9460, test_loss: 0.9381, test_f1: 0.4682
 epoch: 26, train_loss: 0.9393, test_loss: 0.9354, test_f1: 0.4838
 epoch: 27, train_loss: 0.9272, test_loss: 0.9328, test_f1: 0.5068
 epoch: 28, train_loss: 0.9315, test_loss: 0.9261, test_f1: 0.5028
 epoch: 29, train_loss: 0.9240, test_loss: 0.9272, test_f1: 0.4906
 epoch: 30, train_loss: 0.9187, test_loss: 0.9344, test_f1: 0.4909
 epoch: 31, train_loss: 0.9050, test_loss: 0.9184, test_f1: 0.4910
 epoch: 32, train_loss: 0.9018, test_loss: 0.9097, test_f1: 0.4995
 epoch: 33, train_loss: 0.8949, test_loss: 0.9082, test_f1: 0.4968
 epoch: 34, train_loss: 0.8936, test_loss: 0.9170, test_f1: 0.5061
 epoch: 35, train_loss: 0.8839, test_loss: 0.9050, test_f1: 0.5020
 epoch: 36, train_loss: 0.8859, test_loss: 0.9180, test_f1: 0.5065
 epoch: 37, train_loss: 0.8708, test_loss: 0.9005, test_f1: 0.5092
 epoch: 38, train_loss: 0.8733, test_loss: 0.8949, test_f1: 0.4992
 epoch: 39, train_loss: 0.8706, test_loss: 0.9020, test_f1: 0.5128
 epoch: 40, train_loss: 0.8577, test_loss: 0.8991, test_f1: 0.5118
 epoch: 41, train_loss: 0.8578, test_loss: 0.9127, test_f1: 0.5193
 epoch: 42, train_loss: 0.8634, test_loss: 0.8916, test_f1: 0.5084
 epoch: 43, train_loss: 0.8537, test_loss: 0.9064, test_f1: 0.5134
 epoch: 44, train_loss: 0.8445, test_loss: 0.8946, test_f1: 0.5020
 epoch: 45, train_loss: 0.8403, test_loss: 0.9173, test_f1: 0.5182
 epoch: 46, train_loss: 0.8393, test_loss: 0.9226, test_f1: 0.5098
 epoch: 47, train_loss: 0.8348, test_loss: 0.8991, test_f1: 0.5163
 epoch: 48, train_loss: 0.8322, test_loss: 0.8987, test_f1: 0.5109
 epoch: 49, train_loss: 0.8347, test_loss: 0.9086, test_f1: 0.5064
 epoch: 50, train_loss: 0.8369, test_loss: 0.9139, test_f1: 0.5176
 epoch: 51, train_loss: 0.8246, test_loss: 0.9147, test_f1: 0.5105
 epoch: 52, train_loss: 0.8219, test_loss: 0.9108, test_f1: 0.5110
 epoch: 53, train_loss: 0.8146, test_loss: 0.9027, test_f1: 0.5075
 epoch: 54, train_loss: 0.8198, test_loss: 0.8989, test_f1: 0.5209
 epoch: 55, train_loss: 0.8225, test_loss: 0.9051, test_f1: 0.5174
 epoch: 56, train_loss: 0.8176, test_loss: 0.9026, test_f1: 0.5142
 epoch: 57, train_loss: 0.8131, test_loss: 0.9075, test_f1: 0.5139
 epoch: 58, train_loss: 0.8064, test_loss: 0.9071, test_f1: 0.5094
 epoch: 59, train_loss: 0.8050, test_loss: 0.9208, test_f1: 0.5122
 epoch: 60, train_loss: 0.8138, test_loss: 0.9074, test_f1: 0.5157
 epoch: 61, train_loss: 0.8052, test_loss: 0.9132, test_f1: 0.5151
 epoch: 62, train_loss: 0.8050, test_loss: 0.9084, test_f1: 0.5139
 epoch: 63, train_loss: 0.8071, test_loss: 0.9196, test_f1: 0.5140
 epoch: 64, train_loss: 0.7996, test_loss: 0.9297, test_f1: 0.5192
 epoch: 65, train_loss: 0.7985, test_loss: 0.9182, test_f1: 0.5176
 epoch: 66, train_loss: 0.7921, test_loss: 0.9159, test_f1: 0.5195
 epoch: 67, train_loss: 0.7999, test_loss: 0.9197, test_f1: 0.5183
 epoch: 68, train_loss: 0.7953, test_loss: 0.9168, test_f1: 0.5162
 epoch: 69, train_loss: 0.8014, test_loss: 0.9229, test_f1: 0.5033
 epoch: 70, train_loss: 0.7865, test_loss: 0.9166, test_f1: 0.5171
 epoch: 71, train_loss: 0.7945, test_loss: 0.9271, test_f1: 0.5160
 epoch: 72, train_loss: 0.7932, test_loss: 0.9276, test_f1: 0.5091
 epoch: 73, train_loss: 0.7837, test_loss: 0.9419, test_f1: 0.5258
 epoch: 74, train_loss: 0.7870, test_loss: 0.9412, test_f1: 0.5257
 epoch: 75, train_loss: 0.7843, test_loss: 0.9288, test_f1: 0.5121
 epoch: 76, train_loss: 0.7758, test_loss: 0.9383, test_f1: 0.5421
 epoch: 77, train_loss: 0.7861, test_loss: 0.9296, test_f1: 0.5189
 epoch: 78, train_loss: 0.7889, test_loss: 0.9318, test_f1: 0.5121
 epoch: 79, train_loss: 0.7911, test_loss: 0.9480, test_f1: 0.5221
 epoch: 80, train_loss: 0.7873, test_loss: 0.9495, test_f1: 0.5357
 epoch: 81, train_loss: 0.7779, test_loss: 0.9396, test_f1: 0.5217
 epoch: 82, train_loss: 0.7888, test_loss: 0.9434, test_f1: 0.5251
 epoch: 83, train_loss: 0.7848, test_loss: 0.9550, test_f1: 0.5164
 epoch: 84, train_loss: 0.7717, test_loss: 0.9463, test_f1: 0.5173
 epoch: 85, train_loss: 0.7735, test_loss: 0.9423, test_f1: 0.5178
 epoch: 86, train_loss: 0.7738, test_loss: 0.9496, test_f1: 0.5275
 epoch: 87, train_loss: 0.7786, test_loss: 0.9341, test_f1: 0.5186
 epoch: 88, train_loss: 0.7702, test_loss: 0.9353, test_f1: 0.5173
 epoch: 89, train_loss: 0.7743, test_loss: 0.9353, test_f1: 0.5174
 epoch: 90, train_loss: 0.7682, test_loss: 0.9580, test_f1: 0.5210
 epoch: 91, train_loss: 0.7651, test_loss: 0.9565, test_f1: 0.5168
 epoch: 92, train_loss: 0.7689, test_loss: 0.9605, test_f1: 0.5150
 epoch: 93, train_loss: 0.7775, test_loss: 0.9552, test_f1: 0.5384
 epoch: 94, train_loss: 0.7663, test_loss: 0.9566, test_f1: 0.5301
 epoch: 95, train_loss: 0.7634, test_loss: 0.9585, test_f1: 0.5336
 epoch: 96, train_loss: 0.7618, test_loss: 0.9431, test_f1: 0.5218
 epoch: 97, train_loss: 0.7587, test_loss: 0.9379, test_f1: 0.5347
 epoch: 98, train_loss: 0.7523, test_loss: 0.9452, test_f1: 0.5308
 epoch: 99, train_loss: 0.7666, test_loss: 0.9483, test_f1: 0.5293
##################ITERATION #3 ****************************************
 epoch: 0, train_loss: 1.2919, test_loss: 1.3254, test_f1: 0.2270
 epoch: 1, train_loss: 1.2600, test_loss: 1.3140, test_f1: 0.2270
 epoch: 2, train_loss: 1.2481, test_loss: 1.2856, test_f1: 0.2270
 epoch: 3, train_loss: 1.2360, test_loss: 1.2448, test_f1: 0.2270
 epoch: 4, train_loss: 1.2184, test_loss: 1.2099, test_f1: 0.2938
 epoch: 5, train_loss: 1.2058, test_loss: 1.1848, test_f1: 0.3231
 epoch: 6, train_loss: 1.1953, test_loss: 1.1645, test_f1: 0.3799
 epoch: 7, train_loss: 1.1735, test_loss: 1.1459, test_f1: 0.4027
 epoch: 8, train_loss: 1.1642, test_loss: 1.1282, test_f1: 0.4227
 epoch: 9, train_loss: 1.1513, test_loss: 1.1108, test_f1: 0.4431
 epoch: 10, train_loss: 1.1383, test_loss: 1.0924, test_f1: 0.4477
 epoch: 11, train_loss: 1.1187, test_loss: 1.0760, test_f1: 0.4605
 epoch: 12, train_loss: 1.0982, test_loss: 1.0559, test_f1: 0.4709
 epoch: 13, train_loss: 1.0881, test_loss: 1.0358, test_f1: 0.4770
 epoch: 14, train_loss: 1.0725, test_loss: 1.0201, test_f1: 0.4829
 epoch: 15, train_loss: 1.0551, test_loss: 1.0090, test_f1: 0.4824
 epoch: 16, train_loss: 1.0345, test_loss: 0.9872, test_f1: 0.4948
 epoch: 17, train_loss: 1.0289, test_loss: 0.9793, test_f1: 0.5019
 epoch: 18, train_loss: 1.0107, test_loss: 0.9661, test_f1: 0.5071
 epoch: 19, train_loss: 0.9995, test_loss: 0.9535, test_f1: 0.4960
 epoch: 20, train_loss: 0.9898, test_loss: 0.9416, test_f1: 0.5108
 epoch: 21, train_loss: 0.9749, test_loss: 0.9389, test_f1: 0.5079
 epoch: 22, train_loss: 0.9592, test_loss: 0.9370, test_f1: 0.5048
 epoch: 23, train_loss: 0.9548, test_loss: 0.9286, test_f1: 0.5072
 epoch: 24, train_loss: 0.9407, test_loss: 0.9203, test_f1: 0.5102
 epoch: 25, train_loss: 0.9395, test_loss: 0.9065, test_f1: 0.5134
 epoch: 26, train_loss: 0.9359, test_loss: 0.9181, test_f1: 0.4984
 epoch: 27, train_loss: 0.9183, test_loss: 0.9101, test_f1: 0.5120
 epoch: 28, train_loss: 0.9212, test_loss: 0.9092, test_f1: 0.5143
 epoch: 29, train_loss: 0.9157, test_loss: 0.9054, test_f1: 0.5093
 epoch: 30, train_loss: 0.9058, test_loss: 0.9057, test_f1: 0.5158
 epoch: 31, train_loss: 0.8981, test_loss: 0.9007, test_f1: 0.5322
 epoch: 32, train_loss: 0.8890, test_loss: 0.9005, test_f1: 0.5246
 epoch: 33, train_loss: 0.8831, test_loss: 0.8899, test_f1: 0.5314
 epoch: 34, train_loss: 0.8852, test_loss: 0.9076, test_f1: 0.5243
 epoch: 35, train_loss: 0.8797, test_loss: 0.8966, test_f1: 0.5223
 epoch: 36, train_loss: 0.8703, test_loss: 0.8992, test_f1: 0.5245
 epoch: 37, train_loss: 0.8723, test_loss: 0.9034, test_f1: 0.5264
 epoch: 38, train_loss: 0.8781, test_loss: 0.8861, test_f1: 0.5253
 epoch: 39, train_loss: 0.8620, test_loss: 0.8919, test_f1: 0.5289
 epoch: 40, train_loss: 0.8529, test_loss: 0.8928, test_f1: 0.5266
 epoch: 41, train_loss: 0.8522, test_loss: 0.8966, test_f1: 0.5221
 epoch: 42, train_loss: 0.8571, test_loss: 0.9009, test_f1: 0.5321
 epoch: 43, train_loss: 0.8418, test_loss: 0.9001, test_f1: 0.5367
 epoch: 44, train_loss: 0.8485, test_loss: 0.8937, test_f1: 0.5394
 epoch: 45, train_loss: 0.8397, test_loss: 0.9130, test_f1: 0.5240
 epoch: 46, train_loss: 0.8334, test_loss: 0.9039, test_f1: 0.5344
 epoch: 47, train_loss: 0.8266, test_loss: 0.8883, test_f1: 0.5392
 epoch: 48, train_loss: 0.8260, test_loss: 0.8938, test_f1: 0.5365
 epoch: 49, train_loss: 0.8258, test_loss: 0.8941, test_f1: 0.5499
 epoch: 50, train_loss: 0.8200, test_loss: 0.8848, test_f1: 0.5448
 epoch: 51, train_loss: 0.8186, test_loss: 0.8906, test_f1: 0.5361
 epoch: 52, train_loss: 0.8162, test_loss: 0.8932, test_f1: 0.5474
 epoch: 53, train_loss: 0.8162, test_loss: 0.8903, test_f1: 0.5466
 epoch: 54, train_loss: 0.8133, test_loss: 0.8950, test_f1: 0.5510
 epoch: 55, train_loss: 0.8110, test_loss: 0.8960, test_f1: 0.5476
 epoch: 56, train_loss: 0.8080, test_loss: 0.8992, test_f1: 0.5564
 epoch: 57, train_loss: 0.8109, test_loss: 0.8929, test_f1: 0.5526
 epoch: 58, train_loss: 0.8079, test_loss: 0.8863, test_f1: 0.5553
 epoch: 59, train_loss: 0.8024, test_loss: 0.8853, test_f1: 0.5577
 epoch: 60, train_loss: 0.8045, test_loss: 0.8876, test_f1: 0.5464
 epoch: 61, train_loss: 0.7984, test_loss: 0.8908, test_f1: 0.5501
 epoch: 62, train_loss: 0.7950, test_loss: 0.8966, test_f1: 0.5576
 epoch: 63, train_loss: 0.7965, test_loss: 0.8927, test_f1: 0.5536
 epoch: 64, train_loss: 0.8017, test_loss: 0.8997, test_f1: 0.5476
 epoch: 65, train_loss: 0.7938, test_loss: 0.8932, test_f1: 0.5497
 epoch: 66, train_loss: 0.7880, test_loss: 0.8965, test_f1: 0.5469
 epoch: 67, train_loss: 0.7982, test_loss: 0.8969, test_f1: 0.5473
 epoch: 68, train_loss: 0.7874, test_loss: 0.8968, test_f1: 0.5548
 epoch: 69, train_loss: 0.7829, test_loss: 0.8947, test_f1: 0.5488
 epoch: 70, train_loss: 0.7790, test_loss: 0.8969, test_f1: 0.5515
 epoch: 71, train_loss: 0.7794, test_loss: 0.8971, test_f1: 0.5532
 epoch: 72, train_loss: 0.7829, test_loss: 0.8992, test_f1: 0.5540
 epoch: 73, train_loss: 0.7825, test_loss: 0.8979, test_f1: 0.5500
 epoch: 74, train_loss: 0.7771, test_loss: 0.9012, test_f1: 0.5529
 epoch: 75, train_loss: 0.7842, test_loss: 0.9012, test_f1: 0.5514
 epoch: 76, train_loss: 0.7803, test_loss: 0.9033, test_f1: 0.5473
 epoch: 77, train_loss: 0.7800, test_loss: 0.9007, test_f1: 0.5541
 epoch: 78, train_loss: 0.7744, test_loss: 0.9132, test_f1: 0.5486
 epoch: 79, train_loss: 0.7744, test_loss: 0.8960, test_f1: 0.5489
 epoch: 80, train_loss: 0.7731, test_loss: 0.8936, test_f1: 0.5501
 epoch: 81, train_loss: 0.7707, test_loss: 0.8981, test_f1: 0.5451
 epoch: 82, train_loss: 0.7755, test_loss: 0.8954, test_f1: 0.5532
 epoch: 83, train_loss: 0.7599, test_loss: 0.9035, test_f1: 0.5556
 epoch: 84, train_loss: 0.7650, test_loss: 0.8911, test_f1: 0.5546
 epoch: 85, train_loss: 0.7677, test_loss: 0.9058, test_f1: 0.5428
 epoch: 86, train_loss: 0.7673, test_loss: 0.9013, test_f1: 0.5561
 epoch: 87, train_loss: 0.7590, test_loss: 0.9016, test_f1: 0.5515
 epoch: 88, train_loss: 0.7598, test_loss: 0.9057, test_f1: 0.5559
 epoch: 89, train_loss: 0.7655, test_loss: 0.9084, test_f1: 0.5538
 epoch: 90, train_loss: 0.7521, test_loss: 0.9126, test_f1: 0.5478
 epoch: 91, train_loss: 0.7565, test_loss: 0.9138, test_f1: 0.5543
 epoch: 92, train_loss: 0.7624, test_loss: 0.9049, test_f1: 0.5583
 epoch: 93, train_loss: 0.7581, test_loss: 0.9068, test_f1: 0.5532
 epoch: 94, train_loss: 0.7529, test_loss: 0.9030, test_f1: 0.5539
 epoch: 95, train_loss: 0.7575, test_loss: 0.9032, test_f1: 0.5562
 epoch: 96, train_loss: 0.7475, test_loss: 0.9076, test_f1: 0.5546
 epoch: 97, train_loss: 0.7443, test_loss: 0.9134, test_f1: 0.5522
 epoch: 98, train_loss: 0.7497, test_loss: 0.9055, test_f1: 0.5471
 epoch: 99, train_loss: 0.7538, test_loss: 0.9015, test_f1: 0.5530
##################ITERATION #4 ****************************************
 epoch: 0, train_loss: 1.2940, test_loss: 1.3324, test_f1: 0.2270
 epoch: 1, train_loss: 1.2365, test_loss: 1.3117, test_f1: 0.2270
 epoch: 2, train_loss: 1.2231, test_loss: 1.2757, test_f1: 0.2270
 epoch: 3, train_loss: 1.2005, test_loss: 1.2148, test_f1: 0.2747
 epoch: 4, train_loss: 1.1829, test_loss: 1.1639, test_f1: 0.3715
 epoch: 5, train_loss: 1.1652, test_loss: 1.1324, test_f1: 0.3896
 epoch: 6, train_loss: 1.1489, test_loss: 1.1104, test_f1: 0.4024
 epoch: 7, train_loss: 1.1342, test_loss: 1.0922, test_f1: 0.4259
 epoch: 8, train_loss: 1.1202, test_loss: 1.0735, test_f1: 0.4269
 epoch: 9, train_loss: 1.1024, test_loss: 1.0548, test_f1: 0.4379
 epoch: 10, train_loss: 1.0935, test_loss: 1.0381, test_f1: 0.4358
 epoch: 11, train_loss: 1.0779, test_loss: 1.0273, test_f1: 0.4458
 epoch: 12, train_loss: 1.0643, test_loss: 1.0176, test_f1: 0.4586
 epoch: 13, train_loss: 1.0498, test_loss: 1.0001, test_f1: 0.4636
 epoch: 14, train_loss: 1.0379, test_loss: 0.9906, test_f1: 0.4860
 epoch: 15, train_loss: 1.0305, test_loss: 0.9795, test_f1: 0.4814
 epoch: 16, train_loss: 1.0186, test_loss: 0.9698, test_f1: 0.4808
 epoch: 17, train_loss: 1.0027, test_loss: 0.9612, test_f1: 0.4842
 epoch: 18, train_loss: 0.9941, test_loss: 0.9527, test_f1: 0.4918
 epoch: 19, train_loss: 0.9917, test_loss: 0.9524, test_f1: 0.4932
 epoch: 20, train_loss: 0.9812, test_loss: 0.9429, test_f1: 0.4982
 epoch: 21, train_loss: 0.9752, test_loss: 0.9381, test_f1: 0.5018
 epoch: 22, train_loss: 0.9631, test_loss: 0.9322, test_f1: 0.5047
 epoch: 23, train_loss: 0.9619, test_loss: 0.9293, test_f1: 0.4965
 epoch: 24, train_loss: 0.9566, test_loss: 0.9227, test_f1: 0.4958
 epoch: 25, train_loss: 0.9548, test_loss: 0.9218, test_f1: 0.5030
 epoch: 26, train_loss: 0.9413, test_loss: 0.9196, test_f1: 0.5025
 epoch: 27, train_loss: 0.9375, test_loss: 0.9269, test_f1: 0.5072
 epoch: 28, train_loss: 0.9319, test_loss: 0.9217, test_f1: 0.5044
 epoch: 29, train_loss: 0.9233, test_loss: 0.9240, test_f1: 0.5075
 epoch: 30, train_loss: 0.9230, test_loss: 0.9206, test_f1: 0.5178
 epoch: 31, train_loss: 0.9156, test_loss: 0.9168, test_f1: 0.5094
 epoch: 32, train_loss: 0.9088, test_loss: 0.9109, test_f1: 0.5077
 epoch: 33, train_loss: 0.9128, test_loss: 0.9065, test_f1: 0.5113
 epoch: 34, train_loss: 0.9045, test_loss: 0.9167, test_f1: 0.5257
 epoch: 35, train_loss: 0.8972, test_loss: 0.9021, test_f1: 0.5281
 epoch: 36, train_loss: 0.8924, test_loss: 0.8961, test_f1: 0.5267
 epoch: 37, train_loss: 0.8915, test_loss: 0.9018, test_f1: 0.5269
 epoch: 38, train_loss: 0.8859, test_loss: 0.9052, test_f1: 0.5315
 epoch: 39, train_loss: 0.8809, test_loss: 0.9058, test_f1: 0.5276
 epoch: 40, train_loss: 0.8731, test_loss: 0.8990, test_f1: 0.5321
 epoch: 41, train_loss: 0.8817, test_loss: 0.9117, test_f1: 0.5364
 epoch: 42, train_loss: 0.8606, test_loss: 0.9035, test_f1: 0.5332
 epoch: 43, train_loss: 0.8651, test_loss: 0.8980, test_f1: 0.5239
 epoch: 44, train_loss: 0.8662, test_loss: 0.9028, test_f1: 0.5339
 epoch: 45, train_loss: 0.8548, test_loss: 0.9036, test_f1: 0.5420
 epoch: 46, train_loss: 0.8519, test_loss: 0.8914, test_f1: 0.5412
 epoch: 47, train_loss: 0.8512, test_loss: 0.8965, test_f1: 0.5355
 epoch: 48, train_loss: 0.8458, test_loss: 0.9018, test_f1: 0.5361
 epoch: 49, train_loss: 0.8403, test_loss: 0.8936, test_f1: 0.5493
 epoch: 50, train_loss: 0.8417, test_loss: 0.9080, test_f1: 0.5246
 epoch: 51, train_loss: 0.8345, test_loss: 0.8882, test_f1: 0.5317
 epoch: 52, train_loss: 0.8343, test_loss: 0.8985, test_f1: 0.5256
 epoch: 53, train_loss: 0.8228, test_loss: 0.9002, test_f1: 0.5272
 epoch: 54, train_loss: 0.8270, test_loss: 0.8962, test_f1: 0.5367
 epoch: 55, train_loss: 0.8315, test_loss: 0.9121, test_f1: 0.5303
 epoch: 56, train_loss: 0.8208, test_loss: 0.8969, test_f1: 0.5408
 epoch: 57, train_loss: 0.8237, test_loss: 0.8935, test_f1: 0.5391
 epoch: 58, train_loss: 0.8203, test_loss: 0.8969, test_f1: 0.5331
 epoch: 59, train_loss: 0.8221, test_loss: 0.8997, test_f1: 0.5288
 epoch: 60, train_loss: 0.8239, test_loss: 0.9075, test_f1: 0.5376
 epoch: 61, train_loss: 0.8130, test_loss: 0.9001, test_f1: 0.5364
 epoch: 62, train_loss: 0.8055, test_loss: 0.8938, test_f1: 0.5413
 epoch: 63, train_loss: 0.8104, test_loss: 0.8998, test_f1: 0.5543
 epoch: 64, train_loss: 0.8161, test_loss: 0.9000, test_f1: 0.5410
 epoch: 65, train_loss: 0.8071, test_loss: 0.9007, test_f1: 0.5413
 epoch: 66, train_loss: 0.8111, test_loss: 0.9037, test_f1: 0.5477
 epoch: 67, train_loss: 0.8063, test_loss: 0.8941, test_f1: 0.5450
 epoch: 68, train_loss: 0.8030, test_loss: 0.9139, test_f1: 0.5326
 epoch: 69, train_loss: 0.8062, test_loss: 0.9022, test_f1: 0.5433
 epoch: 70, train_loss: 0.7981, test_loss: 0.8939, test_f1: 0.5496
 epoch: 71, train_loss: 0.7981, test_loss: 0.8998, test_f1: 0.5510
 epoch: 72, train_loss: 0.7956, test_loss: 0.9000, test_f1: 0.5411
 epoch: 73, train_loss: 0.8008, test_loss: 0.9010, test_f1: 0.5611
 epoch: 74, train_loss: 0.7922, test_loss: 0.9014, test_f1: 0.5545
 epoch: 75, train_loss: 0.7991, test_loss: 0.9073, test_f1: 0.5570
 epoch: 76, train_loss: 0.7940, test_loss: 0.9114, test_f1: 0.5604
 epoch: 77, train_loss: 0.7838, test_loss: 0.9086, test_f1: 0.5598
 epoch: 78, train_loss: 0.7894, test_loss: 0.9082, test_f1: 0.5515
 epoch: 79, train_loss: 0.7857, test_loss: 0.9044, test_f1: 0.5537
 epoch: 80, train_loss: 0.7982, test_loss: 0.9076, test_f1: 0.5491
 epoch: 81, train_loss: 0.7816, test_loss: 0.8976, test_f1: 0.5585
 epoch: 82, train_loss: 0.7867, test_loss: 0.8971, test_f1: 0.5494
 epoch: 83, train_loss: 0.7851, test_loss: 0.9070, test_f1: 0.5558
 epoch: 84, train_loss: 0.7807, test_loss: 0.9028, test_f1: 0.5508
 epoch: 85, train_loss: 0.7868, test_loss: 0.9085, test_f1: 0.5603
 epoch: 86, train_loss: 0.7787, test_loss: 0.8998, test_f1: 0.5614
 epoch: 87, train_loss: 0.7822, test_loss: 0.9004, test_f1: 0.5529
 epoch: 88, train_loss: 0.7803, test_loss: 0.9057, test_f1: 0.5512
 epoch: 89, train_loss: 0.7763, test_loss: 0.9151, test_f1: 0.5397
 epoch: 90, train_loss: 0.7737, test_loss: 0.9092, test_f1: 0.5407
 epoch: 91, train_loss: 0.7777, test_loss: 0.9006, test_f1: 0.5479
 epoch: 92, train_loss: 0.7811, test_loss: 0.9088, test_f1: 0.5555
 epoch: 93, train_loss: 0.7721, test_loss: 0.9145, test_f1: 0.5573
 epoch: 94, train_loss: 0.7768, test_loss: 0.9047, test_f1: 0.5581
 epoch: 95, train_loss: 0.7729, test_loss: 0.9113, test_f1: 0.5578
 epoch: 96, train_loss: 0.7670, test_loss: 0.9049, test_f1: 0.5559
 epoch: 97, train_loss: 0.7567, test_loss: 0.9063, test_f1: 0.5550
 epoch: 98, train_loss: 0.7707, test_loss: 0.9103, test_f1: 0.5440
 epoch: 99, train_loss: 0.7575, test_loss: 0.9130, test_f1: 0.5525
##################ITERATION #5 ****************************************
 epoch: 0, train_loss: 1.3068, test_loss: 1.3272, test_f1: 0.2270
 epoch: 1, train_loss: 1.2497, test_loss: 1.3058, test_f1: 0.2270
 epoch: 2, train_loss: 1.2159, test_loss: 1.2837, test_f1: 0.2270
 epoch: 3, train_loss: 1.1964, test_loss: 1.2296, test_f1: 0.2270
 epoch: 4, train_loss: 1.1790, test_loss: 1.1761, test_f1: 0.3178
 epoch: 5, train_loss: 1.1487, test_loss: 1.1303, test_f1: 0.4201
 epoch: 6, train_loss: 1.1491, test_loss: 1.0964, test_f1: 0.4396
 epoch: 7, train_loss: 1.1253, test_loss: 1.0793, test_f1: 0.4440
 epoch: 8, train_loss: 1.1159, test_loss: 1.0658, test_f1: 0.4539
 epoch: 9, train_loss: 1.0984, test_loss: 1.0533, test_f1: 0.4583
 epoch: 10, train_loss: 1.0885, test_loss: 1.0391, test_f1: 0.4577
 epoch: 11, train_loss: 1.0694, test_loss: 1.0288, test_f1: 0.4600
 epoch: 12, train_loss: 1.0615, test_loss: 1.0194, test_f1: 0.4522
 epoch: 13, train_loss: 1.0491, test_loss: 1.0103, test_f1: 0.4593
 epoch: 14, train_loss: 1.0418, test_loss: 0.9983, test_f1: 0.4693
 epoch: 15, train_loss: 1.0302, test_loss: 0.9958, test_f1: 0.4727
 epoch: 16, train_loss: 1.0191, test_loss: 0.9829, test_f1: 0.4877
 epoch: 17, train_loss: 1.0087, test_loss: 0.9755, test_f1: 0.4835
 epoch: 18, train_loss: 1.0083, test_loss: 0.9714, test_f1: 0.4871
 epoch: 19, train_loss: 0.9898, test_loss: 0.9661, test_f1: 0.4878
 epoch: 20, train_loss: 0.9888, test_loss: 0.9637, test_f1: 0.4891
 epoch: 21, train_loss: 0.9796, test_loss: 0.9593, test_f1: 0.4863
 epoch: 22, train_loss: 0.9724, test_loss: 0.9537, test_f1: 0.4876
 epoch: 23, train_loss: 0.9624, test_loss: 0.9492, test_f1: 0.4872
 epoch: 24, train_loss: 0.9588, test_loss: 0.9512, test_f1: 0.4887
 epoch: 25, train_loss: 0.9465, test_loss: 0.9456, test_f1: 0.4899
 epoch: 26, train_loss: 0.9480, test_loss: 0.9404, test_f1: 0.4854
 epoch: 27, train_loss: 0.9366, test_loss: 0.9454, test_f1: 0.4871
 epoch: 28, train_loss: 0.9382, test_loss: 0.9373, test_f1: 0.4876
 epoch: 29, train_loss: 0.9271, test_loss: 0.9351, test_f1: 0.4966
 epoch: 30, train_loss: 0.9193, test_loss: 0.9363, test_f1: 0.5025
 epoch: 31, train_loss: 0.9111, test_loss: 0.9398, test_f1: 0.4982
 epoch: 32, train_loss: 0.9054, test_loss: 0.9340, test_f1: 0.5021
 epoch: 33, train_loss: 0.9009, test_loss: 0.9355, test_f1: 0.4992
 epoch: 34, train_loss: 0.9020, test_loss: 0.9357, test_f1: 0.5062
 epoch: 35, train_loss: 0.8987, test_loss: 0.9265, test_f1: 0.5169
 epoch: 36, train_loss: 0.8937, test_loss: 0.9381, test_f1: 0.5088
 epoch: 37, train_loss: 0.8853, test_loss: 0.9366, test_f1: 0.5254
 epoch: 38, train_loss: 0.8844, test_loss: 0.9235, test_f1: 0.5288
 epoch: 39, train_loss: 0.8776, test_loss: 0.9309, test_f1: 0.5279
 epoch: 40, train_loss: 0.8783, test_loss: 0.9327, test_f1: 0.5218
 epoch: 41, train_loss: 0.8648, test_loss: 0.9221, test_f1: 0.5154
 epoch: 42, train_loss: 0.8636, test_loss: 0.9312, test_f1: 0.5217
 epoch: 43, train_loss: 0.8607, test_loss: 0.9354, test_f1: 0.5254
 epoch: 44, train_loss: 0.8649, test_loss: 0.9403, test_f1: 0.5235
 epoch: 45, train_loss: 0.8542, test_loss: 0.9320, test_f1: 0.5241
 epoch: 46, train_loss: 0.8518, test_loss: 0.9285, test_f1: 0.5310
 epoch: 47, train_loss: 0.8450, test_loss: 0.9269, test_f1: 0.5475
 epoch: 48, train_loss: 0.8471, test_loss: 0.9463, test_f1: 0.5468
 epoch: 49, train_loss: 0.8413, test_loss: 0.9417, test_f1: 0.5478
 epoch: 50, train_loss: 0.8375, test_loss: 0.9262, test_f1: 0.5483
 epoch: 51, train_loss: 0.8382, test_loss: 0.9305, test_f1: 0.5527
 epoch: 52, train_loss: 0.8267, test_loss: 0.9374, test_f1: 0.5536
 epoch: 53, train_loss: 0.8253, test_loss: 0.9388, test_f1: 0.5431
 epoch: 54, train_loss: 0.8183, test_loss: 0.9369, test_f1: 0.5468
 epoch: 55, train_loss: 0.8185, test_loss: 0.9357, test_f1: 0.5593
 epoch: 56, train_loss: 0.8316, test_loss: 0.9310, test_f1: 0.5529
 epoch: 57, train_loss: 0.8127, test_loss: 0.9355, test_f1: 0.5551
 epoch: 58, train_loss: 0.8181, test_loss: 0.9466, test_f1: 0.5520
 epoch: 59, train_loss: 0.8130, test_loss: 0.9327, test_f1: 0.5582
 epoch: 60, train_loss: 0.8155, test_loss: 0.9389, test_f1: 0.5512
 epoch: 61, train_loss: 0.8182, test_loss: 0.9397, test_f1: 0.5528
 epoch: 62, train_loss: 0.8146, test_loss: 0.9488, test_f1: 0.5379
 epoch: 63, train_loss: 0.8220, test_loss: 0.9427, test_f1: 0.5558
 epoch: 64, train_loss: 0.8103, test_loss: 0.9504, test_f1: 0.5512
 epoch: 65, train_loss: 0.8105, test_loss: 0.9444, test_f1: 0.5517
 epoch: 66, train_loss: 0.8057, test_loss: 0.9522, test_f1: 0.5559
 epoch: 67, train_loss: 0.8102, test_loss: 0.9549, test_f1: 0.5600
 epoch: 68, train_loss: 0.8109, test_loss: 0.9384, test_f1: 0.5587
 epoch: 69, train_loss: 0.8052, test_loss: 0.9420, test_f1: 0.5575
 epoch: 70, train_loss: 0.8036, test_loss: 0.9456, test_f1: 0.5525
 epoch: 71, train_loss: 0.8050, test_loss: 0.9376, test_f1: 0.5513
 epoch: 72, train_loss: 0.7991, test_loss: 0.9375, test_f1: 0.5576
 epoch: 73, train_loss: 0.7987, test_loss: 0.9452, test_f1: 0.5533
 epoch: 74, train_loss: 0.7962, test_loss: 0.9396, test_f1: 0.5488
 epoch: 75, train_loss: 0.7959, test_loss: 0.9445, test_f1: 0.5573
 epoch: 76, train_loss: 0.8002, test_loss: 0.9515, test_f1: 0.5570
 epoch: 77, train_loss: 0.8011, test_loss: 0.9470, test_f1: 0.5552
 epoch: 78, train_loss: 0.7951, test_loss: 0.9439, test_f1: 0.5546
 epoch: 79, train_loss: 0.7838, test_loss: 0.9505, test_f1: 0.5489
 epoch: 80, train_loss: 0.7944, test_loss: 0.9481, test_f1: 0.5489
 epoch: 81, train_loss: 0.7905, test_loss: 0.9597, test_f1: 0.5525
 epoch: 82, train_loss: 0.7834, test_loss: 0.9475, test_f1: 0.5510
 epoch: 83, train_loss: 0.7775, test_loss: 0.9609, test_f1: 0.5525
 epoch: 84, train_loss: 0.7831, test_loss: 0.9568, test_f1: 0.5530
 epoch: 85, train_loss: 0.7869, test_loss: 0.9515, test_f1: 0.5459
 epoch: 86, train_loss: 0.7904, test_loss: 0.9652, test_f1: 0.5440
 epoch: 87, train_loss: 0.7794, test_loss: 0.9667, test_f1: 0.5370
 epoch: 88, train_loss: 0.7740, test_loss: 0.9569, test_f1: 0.5429
 epoch: 89, train_loss: 0.7752, test_loss: 0.9630, test_f1: 0.5534
 epoch: 90, train_loss: 0.7769, test_loss: 0.9539, test_f1: 0.5464
 epoch: 91, train_loss: 0.7834, test_loss: 0.9575, test_f1: 0.5555
 epoch: 92, train_loss: 0.7717, test_loss: 0.9704, test_f1: 0.5574
 epoch: 93, train_loss: 0.7692, test_loss: 0.9584, test_f1: 0.5463
 epoch: 94, train_loss: 0.7854, test_loss: 0.9642, test_f1: 0.5396
 epoch: 95, train_loss: 0.7747, test_loss: 0.9671, test_f1: 0.5474
 epoch: 96, train_loss: 0.7774, test_loss: 0.9643, test_f1: 0.5516
 epoch: 97, train_loss: 0.7668, test_loss: 0.9676, test_f1: 0.5508
 epoch: 98, train_loss: 0.7755, test_loss: 0.9544, test_f1: 0.5488
 epoch: 99, train_loss: 0.7688, test_loss: 0.9685, test_f1: 0.5406
##################ITERATION #6 ****************************************
 epoch: 0, train_loss: 1.3436, test_loss: 1.3722, test_f1: 0.2270
 epoch: 1, train_loss: 1.2492, test_loss: 1.3333, test_f1: 0.2270
 epoch: 2, train_loss: 1.2132, test_loss: 1.2777, test_f1: 0.2320
 epoch: 3, train_loss: 1.1912, test_loss: 1.2004, test_f1: 0.3669
 epoch: 4, train_loss: 1.1750, test_loss: 1.1477, test_f1: 0.3827
 epoch: 5, train_loss: 1.1532, test_loss: 1.1056, test_f1: 0.4068
 epoch: 6, train_loss: 1.1348, test_loss: 1.0866, test_f1: 0.4327
 epoch: 7, train_loss: 1.1213, test_loss: 1.0623, test_f1: 0.4521
 epoch: 8, train_loss: 1.1019, test_loss: 1.0440, test_f1: 0.4606
 epoch: 9, train_loss: 1.0877, test_loss: 1.0387, test_f1: 0.4559
 epoch: 10, train_loss: 1.0587, test_loss: 1.0274, test_f1: 0.4647
 epoch: 11, train_loss: 1.0549, test_loss: 1.0147, test_f1: 0.4646
 epoch: 12, train_loss: 1.0536, test_loss: 1.0168, test_f1: 0.4735
 epoch: 13, train_loss: 1.0276, test_loss: 0.9980, test_f1: 0.4827
 epoch: 14, train_loss: 1.0188, test_loss: 0.9902, test_f1: 0.4821
 epoch: 15, train_loss: 1.0109, test_loss: 0.9886, test_f1: 0.4877
 epoch: 16, train_loss: 1.0024, test_loss: 0.9823, test_f1: 0.4858
 epoch: 17, train_loss: 0.9841, test_loss: 0.9769, test_f1: 0.4815
 epoch: 18, train_loss: 0.9900, test_loss: 0.9761, test_f1: 0.4850
 epoch: 19, train_loss: 0.9737, test_loss: 0.9865, test_f1: 0.4968
 epoch: 20, train_loss: 0.9735, test_loss: 0.9675, test_f1: 0.4985
 epoch: 21, train_loss: 0.9551, test_loss: 0.9676, test_f1: 0.4988
 epoch: 22, train_loss: 0.9540, test_loss: 0.9645, test_f1: 0.5053
 epoch: 23, train_loss: 0.9450, test_loss: 0.9662, test_f1: 0.4939
 epoch: 24, train_loss: 0.9528, test_loss: 0.9693, test_f1: 0.5109
 epoch: 25, train_loss: 0.9384, test_loss: 0.9654, test_f1: 0.5149
 epoch: 26, train_loss: 0.9302, test_loss: 0.9588, test_f1: 0.4978
 epoch: 27, train_loss: 0.9372, test_loss: 0.9702, test_f1: 0.4932
 epoch: 28, train_loss: 0.9207, test_loss: 0.9494, test_f1: 0.4952
 epoch: 29, train_loss: 0.9177, test_loss: 0.9598, test_f1: 0.4915
 epoch: 30, train_loss: 0.9108, test_loss: 0.9661, test_f1: 0.4914
 epoch: 31, train_loss: 0.9141, test_loss: 0.9682, test_f1: 0.5253
 epoch: 32, train_loss: 0.9035, test_loss: 0.9733, test_f1: 0.4957
 epoch: 33, train_loss: 0.9149, test_loss: 0.9492, test_f1: 0.5136
 epoch: 34, train_loss: 0.8929, test_loss: 0.9602, test_f1: 0.5089
 epoch: 35, train_loss: 0.8902, test_loss: 0.9564, test_f1: 0.5290
 epoch: 36, train_loss: 0.8915, test_loss: 0.9703, test_f1: 0.5260
 epoch: 37, train_loss: 0.8891, test_loss: 0.9656, test_f1: 0.5215
 epoch: 38, train_loss: 0.8805, test_loss: 0.9665, test_f1: 0.5211
 epoch: 39, train_loss: 0.8821, test_loss: 0.9691, test_f1: 0.5168
 epoch: 40, train_loss: 0.8700, test_loss: 0.9658, test_f1: 0.5199
 epoch: 41, train_loss: 0.8755, test_loss: 0.9587, test_f1: 0.5257
 epoch: 42, train_loss: 0.8716, test_loss: 0.9790, test_f1: 0.5227
 epoch: 43, train_loss: 0.8628, test_loss: 0.9626, test_f1: 0.5265
 epoch: 44, train_loss: 0.8601, test_loss: 0.9692, test_f1: 0.5317
 epoch: 45, train_loss: 0.8612, test_loss: 0.9617, test_f1: 0.5390
 epoch: 46, train_loss: 0.8499, test_loss: 0.9619, test_f1: 0.5210
 epoch: 47, train_loss: 0.8509, test_loss: 0.9707, test_f1: 0.5276
 epoch: 48, train_loss: 0.8487, test_loss: 0.9708, test_f1: 0.5305
 epoch: 49, train_loss: 0.8424, test_loss: 0.9798, test_f1: 0.5253
 epoch: 50, train_loss: 0.8443, test_loss: 0.9602, test_f1: 0.5409
 epoch: 51, train_loss: 0.8495, test_loss: 0.9832, test_f1: 0.5351
 epoch: 52, train_loss: 0.8342, test_loss: 0.9834, test_f1: 0.5388
 epoch: 53, train_loss: 0.8401, test_loss: 0.9790, test_f1: 0.5297
 epoch: 54, train_loss: 0.8311, test_loss: 0.9900, test_f1: 0.5325
 epoch: 55, train_loss: 0.8293, test_loss: 0.9818, test_f1: 0.5325
 epoch: 56, train_loss: 0.8355, test_loss: 0.9730, test_f1: 0.5279
 epoch: 57, train_loss: 0.8260, test_loss: 0.9825, test_f1: 0.5303
 epoch: 58, train_loss: 0.8326, test_loss: 0.9768, test_f1: 0.5210
 epoch: 59, train_loss: 0.8291, test_loss: 0.9859, test_f1: 0.5291
 epoch: 60, train_loss: 0.8265, test_loss: 0.9902, test_f1: 0.5291
 epoch: 61, train_loss: 0.8422, test_loss: 0.9810, test_f1: 0.5302
 epoch: 62, train_loss: 0.8164, test_loss: 0.9811, test_f1: 0.5280
 epoch: 63, train_loss: 0.8251, test_loss: 0.9821, test_f1: 0.5216
 epoch: 64, train_loss: 0.8189, test_loss: 0.9944, test_f1: 0.5327
 epoch: 65, train_loss: 0.8193, test_loss: 0.9763, test_f1: 0.5260
 epoch: 66, train_loss: 0.8186, test_loss: 0.9885, test_f1: 0.5255
 epoch: 67, train_loss: 0.8268, test_loss: 0.9806, test_f1: 0.5291
 epoch: 68, train_loss: 0.8154, test_loss: 0.9846, test_f1: 0.5284
 epoch: 69, train_loss: 0.8197, test_loss: 0.9817, test_f1: 0.5288
 epoch: 70, train_loss: 0.8184, test_loss: 0.9910, test_f1: 0.5229
 epoch: 71, train_loss: 0.8159, test_loss: 0.9902, test_f1: 0.5324
 epoch: 72, train_loss: 0.8164, test_loss: 0.9917, test_f1: 0.5366
 epoch: 73, train_loss: 0.8142, test_loss: 0.9815, test_f1: 0.5310
 epoch: 74, train_loss: 0.8103, test_loss: 0.9806, test_f1: 0.5312
 epoch: 75, train_loss: 0.8031, test_loss: 0.9877, test_f1: 0.5346
 epoch: 76, train_loss: 0.8167, test_loss: 0.9874, test_f1: 0.5321
 epoch: 77, train_loss: 0.8060, test_loss: 0.9881, test_f1: 0.5174
 epoch: 78, train_loss: 0.8061, test_loss: 1.0056, test_f1: 0.5305
 epoch: 79, train_loss: 0.8061, test_loss: 0.9966, test_f1: 0.5181
 epoch: 80, train_loss: 0.8022, test_loss: 0.9990, test_f1: 0.5306
 epoch: 81, train_loss: 0.8034, test_loss: 0.9973, test_f1: 0.5364
 epoch: 82, train_loss: 0.8021, test_loss: 1.0079, test_f1: 0.5282
 epoch: 83, train_loss: 0.8152, test_loss: 0.9982, test_f1: 0.5278
 epoch: 84, train_loss: 0.8014, test_loss: 0.9840, test_f1: 0.5261
 epoch: 85, train_loss: 0.7936, test_loss: 0.9837, test_f1: 0.5130
 epoch: 86, train_loss: 0.7927, test_loss: 0.9885, test_f1: 0.5207
 epoch: 87, train_loss: 0.7885, test_loss: 0.9912, test_f1: 0.5149
 epoch: 88, train_loss: 0.7930, test_loss: 1.0058, test_f1: 0.5119
 epoch: 89, train_loss: 0.7979, test_loss: 0.9946, test_f1: 0.5155
 epoch: 90, train_loss: 0.7999, test_loss: 1.0000, test_f1: 0.5105
 epoch: 91, train_loss: 0.7937, test_loss: 0.9934, test_f1: 0.5150
 epoch: 92, train_loss: 0.7910, test_loss: 1.0040, test_f1: 0.5214
 epoch: 93, train_loss: 0.7974, test_loss: 1.0116, test_f1: 0.5173
 epoch: 94, train_loss: 0.7943, test_loss: 0.9993, test_f1: 0.5190
 epoch: 95, train_loss: 0.7936, test_loss: 1.0056, test_f1: 0.5195
 epoch: 96, train_loss: 0.7900, test_loss: 1.0058, test_f1: 0.5246
 epoch: 97, train_loss: 0.7884, test_loss: 1.0023, test_f1: 0.5164
 epoch: 98, train_loss: 0.7869, test_loss: 1.0005, test_f1: 0.5256
 epoch: 99, train_loss: 0.7897, test_loss: 0.9966, test_f1: 0.5194
##################ITERATION #7 ****************************************
 epoch: 0, train_loss: 1.3082, test_loss: 1.3285, test_f1: 0.2270
 epoch: 1, train_loss: 1.2271, test_loss: 1.3093, test_f1: 0.2270
 epoch: 2, train_loss: 1.2012, test_loss: 1.2857, test_f1: 0.2320
 epoch: 3, train_loss: 1.1810, test_loss: 1.2508, test_f1: 0.3293
 epoch: 4, train_loss: 1.1646, test_loss: 1.1892, test_f1: 0.3533
 epoch: 5, train_loss: 1.1449, test_loss: 1.1246, test_f1: 0.3904
 epoch: 6, train_loss: 1.1251, test_loss: 1.0862, test_f1: 0.4394
 epoch: 7, train_loss: 1.1175, test_loss: 1.0595, test_f1: 0.4533
 epoch: 8, train_loss: 1.0985, test_loss: 1.0393, test_f1: 0.4420
 epoch: 9, train_loss: 1.0812, test_loss: 1.0291, test_f1: 0.4341
 epoch: 10, train_loss: 1.0660, test_loss: 1.0122, test_f1: 0.4446
 epoch: 11, train_loss: 1.0528, test_loss: 1.0001, test_f1: 0.4459
 epoch: 12, train_loss: 1.0421, test_loss: 0.9871, test_f1: 0.4690
 epoch: 13, train_loss: 1.0367, test_loss: 0.9821, test_f1: 0.4656
 epoch: 14, train_loss: 1.0222, test_loss: 0.9725, test_f1: 0.4732
 epoch: 15, train_loss: 1.0225, test_loss: 0.9645, test_f1: 0.4966
 epoch: 16, train_loss: 1.0144, test_loss: 0.9588, test_f1: 0.4992
 epoch: 17, train_loss: 1.0015, test_loss: 0.9520, test_f1: 0.4926
 epoch: 18, train_loss: 0.9937, test_loss: 0.9473, test_f1: 0.4974
 epoch: 19, train_loss: 0.9824, test_loss: 0.9428, test_f1: 0.4985
 epoch: 20, train_loss: 0.9777, test_loss: 0.9424, test_f1: 0.5039
 epoch: 21, train_loss: 0.9760, test_loss: 0.9345, test_f1: 0.5057
 epoch: 22, train_loss: 0.9511, test_loss: 0.9404, test_f1: 0.5049
 epoch: 23, train_loss: 0.9585, test_loss: 0.9279, test_f1: 0.5138
 epoch: 24, train_loss: 0.9566, test_loss: 0.9342, test_f1: 0.5043
 epoch: 25, train_loss: 0.9421, test_loss: 0.9236, test_f1: 0.5131
 epoch: 26, train_loss: 0.9399, test_loss: 0.9243, test_f1: 0.5160
 epoch: 27, train_loss: 0.9344, test_loss: 0.9304, test_f1: 0.5098
 epoch: 28, train_loss: 0.9349, test_loss: 0.9182, test_f1: 0.5200
 epoch: 29, train_loss: 0.9246, test_loss: 0.9282, test_f1: 0.5172
 epoch: 30, train_loss: 0.9225, test_loss: 0.9166, test_f1: 0.5244
 epoch: 31, train_loss: 0.9233, test_loss: 0.9202, test_f1: 0.5173
 epoch: 32, train_loss: 0.9101, test_loss: 0.9137, test_f1: 0.5140
 epoch: 33, train_loss: 0.9076, test_loss: 0.9057, test_f1: 0.5237
 epoch: 34, train_loss: 0.8960, test_loss: 0.9215, test_f1: 0.5159
 epoch: 35, train_loss: 0.8919, test_loss: 0.9051, test_f1: 0.5152
 epoch: 36, train_loss: 0.8952, test_loss: 0.8987, test_f1: 0.5309
 epoch: 37, train_loss: 0.8883, test_loss: 0.9155, test_f1: 0.5283
 epoch: 38, train_loss: 0.8846, test_loss: 0.9145, test_f1: 0.5069
 epoch: 39, train_loss: 0.8803, test_loss: 0.9158, test_f1: 0.5281
 epoch: 40, train_loss: 0.8731, test_loss: 0.9032, test_f1: 0.5318
 epoch: 41, train_loss: 0.8743, test_loss: 0.9079, test_f1: 0.5367
 epoch: 42, train_loss: 0.8700, test_loss: 0.9133, test_f1: 0.5299
 epoch: 43, train_loss: 0.8602, test_loss: 0.8987, test_f1: 0.5297
 epoch: 44, train_loss: 0.8589, test_loss: 0.8965, test_f1: 0.5316
 epoch: 45, train_loss: 0.8537, test_loss: 0.9238, test_f1: 0.5343
 epoch: 46, train_loss: 0.8575, test_loss: 0.8910, test_f1: 0.5664
 epoch: 47, train_loss: 0.8455, test_loss: 0.9040, test_f1: 0.5297
 epoch: 48, train_loss: 0.8481, test_loss: 0.9496, test_f1: 0.5162
 epoch: 49, train_loss: 0.8452, test_loss: 0.9046, test_f1: 0.5387
 epoch: 50, train_loss: 0.8401, test_loss: 0.9026, test_f1: 0.5264
 epoch: 51, train_loss: 0.8438, test_loss: 0.9101, test_f1: 0.5368
 epoch: 52, train_loss: 0.8359, test_loss: 0.9048, test_f1: 0.5260
 epoch: 53, train_loss: 0.8265, test_loss: 0.9051, test_f1: 0.5214
 epoch: 54, train_loss: 0.8332, test_loss: 0.9029, test_f1: 0.5454
 epoch: 55, train_loss: 0.8367, test_loss: 0.9117, test_f1: 0.5348
 epoch: 56, train_loss: 0.8321, test_loss: 0.9131, test_f1: 0.5274
 epoch: 57, train_loss: 0.8271, test_loss: 0.9101, test_f1: 0.5557
 epoch: 58, train_loss: 0.8278, test_loss: 0.9186, test_f1: 0.5547
 epoch: 59, train_loss: 0.8197, test_loss: 0.9211, test_f1: 0.5529
 epoch: 60, train_loss: 0.8224, test_loss: 0.9082, test_f1: 0.5545
 epoch: 61, train_loss: 0.8116, test_loss: 0.9080, test_f1: 0.5306
 epoch: 62, train_loss: 0.8171, test_loss: 0.9100, test_f1: 0.5409
 epoch: 63, train_loss: 0.8186, test_loss: 0.9103, test_f1: 0.5597
 epoch: 64, train_loss: 0.8085, test_loss: 0.9073, test_f1: 0.5613
 epoch: 65, train_loss: 0.8181, test_loss: 0.9070, test_f1: 0.5477
 epoch: 66, train_loss: 0.8057, test_loss: 0.9193, test_f1: 0.5539
 epoch: 67, train_loss: 0.8045, test_loss: 0.9169, test_f1: 0.5501
 epoch: 68, train_loss: 0.8094, test_loss: 0.9301, test_f1: 0.5321
 epoch: 69, train_loss: 0.8033, test_loss: 0.9250, test_f1: 0.5552
 epoch: 70, train_loss: 0.8070, test_loss: 0.9247, test_f1: 0.5583
 epoch: 71, train_loss: 0.8040, test_loss: 0.9220, test_f1: 0.5444
 epoch: 72, train_loss: 0.8079, test_loss: 0.9241, test_f1: 0.5360
 epoch: 73, train_loss: 0.8021, test_loss: 0.9513, test_f1: 0.5545
 epoch: 74, train_loss: 0.7974, test_loss: 0.9341, test_f1: 0.5555
 epoch: 75, train_loss: 0.7996, test_loss: 0.9331, test_f1: 0.5565
 epoch: 76, train_loss: 0.7971, test_loss: 0.9407, test_f1: 0.5591
 epoch: 77, train_loss: 0.7965, test_loss: 0.9484, test_f1: 0.5491
 epoch: 78, train_loss: 0.7962, test_loss: 0.9432, test_f1: 0.5547
 epoch: 79, train_loss: 0.7886, test_loss: 0.9202, test_f1: 0.5569
 epoch: 80, train_loss: 0.7981, test_loss: 0.9303, test_f1: 0.5553
 epoch: 81, train_loss: 0.7877, test_loss: 0.9454, test_f1: 0.5489
 epoch: 82, train_loss: 0.7920, test_loss: 0.9328, test_f1: 0.5578
 epoch: 83, train_loss: 0.7874, test_loss: 0.9442, test_f1: 0.5464
 epoch: 84, train_loss: 0.7824, test_loss: 0.9490, test_f1: 0.5403
 epoch: 85, train_loss: 0.7875, test_loss: 0.9461, test_f1: 0.5452
 epoch: 86, train_loss: 0.7846, test_loss: 0.9248, test_f1: 0.5437
 epoch: 87, train_loss: 0.7842, test_loss: 0.9409, test_f1: 0.5516
 epoch: 88, train_loss: 0.7892, test_loss: 0.9478, test_f1: 0.5562
 epoch: 89, train_loss: 0.7761, test_loss: 0.9340, test_f1: 0.5562
 epoch: 90, train_loss: 0.7882, test_loss: 0.9627, test_f1: 0.5512
 epoch: 91, train_loss: 0.7752, test_loss: 0.9414, test_f1: 0.5553
 epoch: 92, train_loss: 0.7755, test_loss: 0.9511, test_f1: 0.5447
 epoch: 93, train_loss: 0.7719, test_loss: 0.9289, test_f1: 0.5527
 epoch: 94, train_loss: 0.7770, test_loss: 0.9678, test_f1: 0.5543
 epoch: 95, train_loss: 0.7727, test_loss: 0.9338, test_f1: 0.5500
 epoch: 96, train_loss: 0.7704, test_loss: 0.9722, test_f1: 0.5547
 epoch: 97, train_loss: 0.7710, test_loss: 0.9230, test_f1: 0.5587
 epoch: 98, train_loss: 0.7678, test_loss: 0.9508, test_f1: 0.5286
 epoch: 99, train_loss: 0.7621, test_loss: 0.9264, test_f1: 0.5583
##################ITERATION #8 ****************************************
 epoch: 0, train_loss: 1.3383, test_loss: 1.3159, test_f1: 0.2270
 epoch: 1, train_loss: 1.2293, test_loss: 1.3085, test_f1: 0.2270
 epoch: 2, train_loss: 1.2109, test_loss: 1.2749, test_f1: 0.3039
 epoch: 3, train_loss: 1.1884, test_loss: 1.2288, test_f1: 0.3070
 epoch: 4, train_loss: 1.1553, test_loss: 1.1573, test_f1: 0.3845
 epoch: 5, train_loss: 1.1402, test_loss: 1.1082, test_f1: 0.4321
 epoch: 6, train_loss: 1.1209, test_loss: 1.0739, test_f1: 0.4470
 epoch: 7, train_loss: 1.1053, test_loss: 1.0612, test_f1: 0.4682
 epoch: 8, train_loss: 1.0857, test_loss: 1.0482, test_f1: 0.4742
 epoch: 9, train_loss: 1.0689, test_loss: 1.0316, test_f1: 0.4759
 epoch: 10, train_loss: 1.0642, test_loss: 1.0155, test_f1: 0.4840
 epoch: 11, train_loss: 1.0394, test_loss: 0.9965, test_f1: 0.4958
 epoch: 12, train_loss: 1.0247, test_loss: 0.9864, test_f1: 0.5004
 epoch: 13, train_loss: 1.0187, test_loss: 0.9869, test_f1: 0.4986
 epoch: 14, train_loss: 1.0122, test_loss: 0.9741, test_f1: 0.5017
 epoch: 15, train_loss: 1.0036, test_loss: 0.9722, test_f1: 0.4998
 epoch: 16, train_loss: 0.9930, test_loss: 0.9663, test_f1: 0.5090
 epoch: 17, train_loss: 0.9770, test_loss: 0.9612, test_f1: 0.5067
 epoch: 18, train_loss: 0.9689, test_loss: 0.9550, test_f1: 0.5262
 epoch: 19, train_loss: 0.9645, test_loss: 0.9521, test_f1: 0.5146
 epoch: 20, train_loss: 0.9589, test_loss: 0.9491, test_f1: 0.5262
 epoch: 21, train_loss: 0.9452, test_loss: 0.9454, test_f1: 0.5277
 epoch: 22, train_loss: 0.9400, test_loss: 0.9411, test_f1: 0.5255
 epoch: 23, train_loss: 0.9329, test_loss: 0.9334, test_f1: 0.5314
 epoch: 24, train_loss: 0.9162, test_loss: 0.9431, test_f1: 0.5224
 epoch: 25, train_loss: 0.9218, test_loss: 0.9434, test_f1: 0.5327
 epoch: 26, train_loss: 0.9188, test_loss: 0.9419, test_f1: 0.5286
 epoch: 27, train_loss: 0.9069, test_loss: 0.9288, test_f1: 0.5372
 epoch: 28, train_loss: 0.9064, test_loss: 0.9321, test_f1: 0.5278
 epoch: 29, train_loss: 0.9030, test_loss: 0.9450, test_f1: 0.5179
 epoch: 30, train_loss: 0.8826, test_loss: 0.9340, test_f1: 0.5337
 epoch: 31, train_loss: 0.8821, test_loss: 0.9247, test_f1: 0.5360
 epoch: 32, train_loss: 0.8819, test_loss: 0.9350, test_f1: 0.5373
 epoch: 33, train_loss: 0.8695, test_loss: 0.9488, test_f1: 0.5275
 epoch: 34, train_loss: 0.8684, test_loss: 0.9450, test_f1: 0.5256
 epoch: 35, train_loss: 0.8634, test_loss: 0.9331, test_f1: 0.5378
 epoch: 36, train_loss: 0.8629, test_loss: 0.9533, test_f1: 0.5255
 epoch: 37, train_loss: 0.8635, test_loss: 0.9509, test_f1: 0.5204
 epoch: 38, train_loss: 0.8532, test_loss: 0.9301, test_f1: 0.5358
 epoch: 39, train_loss: 0.8501, test_loss: 0.9407, test_f1: 0.5388
 epoch: 40, train_loss: 0.8487, test_loss: 0.9487, test_f1: 0.5414
 epoch: 41, train_loss: 0.8476, test_loss: 0.9846, test_f1: 0.5257
 epoch: 42, train_loss: 0.8400, test_loss: 0.9478, test_f1: 0.5309
 epoch: 43, train_loss: 0.8498, test_loss: 0.9451, test_f1: 0.5380
 epoch: 44, train_loss: 0.8426, test_loss: 0.9596, test_f1: 0.5312
 epoch: 45, train_loss: 0.8384, test_loss: 0.9598, test_f1: 0.5343
 epoch: 46, train_loss: 0.8305, test_loss: 0.9524, test_f1: 0.5407
 epoch: 47, train_loss: 0.8296, test_loss: 0.9675, test_f1: 0.5361
 epoch: 48, train_loss: 0.8288, test_loss: 0.9518, test_f1: 0.5414
 epoch: 49, train_loss: 0.8234, test_loss: 0.9680, test_f1: 0.5300
 epoch: 50, train_loss: 0.8177, test_loss: 0.9599, test_f1: 0.5530
 epoch: 51, train_loss: 0.8183, test_loss: 0.9688, test_f1: 0.5501
 epoch: 52, train_loss: 0.8155, test_loss: 0.9654, test_f1: 0.5474
 epoch: 53, train_loss: 0.8114, test_loss: 0.9692, test_f1: 0.5476
 epoch: 54, train_loss: 0.8097, test_loss: 0.9664, test_f1: 0.5423
 epoch: 55, train_loss: 0.8039, test_loss: 0.9552, test_f1: 0.5496
 epoch: 56, train_loss: 0.8116, test_loss: 0.9591, test_f1: 0.5497
 epoch: 57, train_loss: 0.8022, test_loss: 0.9706, test_f1: 0.5533
 epoch: 58, train_loss: 0.8010, test_loss: 0.9617, test_f1: 0.5512
 epoch: 59, train_loss: 0.7978, test_loss: 0.9553, test_f1: 0.5512
 epoch: 60, train_loss: 0.7962, test_loss: 0.9625, test_f1: 0.5498
 epoch: 61, train_loss: 0.8012, test_loss: 0.9540, test_f1: 0.5487
 epoch: 62, train_loss: 0.7951, test_loss: 0.9778, test_f1: 0.5502
 epoch: 63, train_loss: 0.7869, test_loss: 0.9766, test_f1: 0.5514
 epoch: 64, train_loss: 0.7896, test_loss: 0.9694, test_f1: 0.5446
 epoch: 65, train_loss: 0.7908, test_loss: 0.9666, test_f1: 0.5506
 epoch: 66, train_loss: 0.7916, test_loss: 0.9807, test_f1: 0.5538
 epoch: 67, train_loss: 0.7883, test_loss: 0.9779, test_f1: 0.5520
 epoch: 68, train_loss: 0.7873, test_loss: 0.9792, test_f1: 0.5531
 epoch: 69, train_loss: 0.7873, test_loss: 0.9765, test_f1: 0.5548
 epoch: 70, train_loss: 0.7876, test_loss: 0.9769, test_f1: 0.5566
 epoch: 71, train_loss: 0.7891, test_loss: 0.9871, test_f1: 0.5594
 epoch: 72, train_loss: 0.7842, test_loss: 0.9786, test_f1: 0.5606
 epoch: 73, train_loss: 0.7858, test_loss: 0.9972, test_f1: 0.5542
 epoch: 74, train_loss: 0.7938, test_loss: 0.9867, test_f1: 0.5567
 epoch: 75, train_loss: 0.7779, test_loss: 0.9844, test_f1: 0.5602
 epoch: 76, train_loss: 0.7800, test_loss: 0.9848, test_f1: 0.5648
 epoch: 77, train_loss: 0.7676, test_loss: 0.9776, test_f1: 0.5607
 epoch: 78, train_loss: 0.7850, test_loss: 0.9737, test_f1: 0.5600
 epoch: 79, train_loss: 0.7732, test_loss: 0.9815, test_f1: 0.5598
 epoch: 80, train_loss: 0.7733, test_loss: 0.9799, test_f1: 0.5618
 epoch: 81, train_loss: 0.7717, test_loss: 1.0002, test_f1: 0.5607
 epoch: 82, train_loss: 0.7744, test_loss: 0.9863, test_f1: 0.5590
 epoch: 83, train_loss: 0.7731, test_loss: 0.9817, test_f1: 0.5588
 epoch: 84, train_loss: 0.7702, test_loss: 0.9906, test_f1: 0.5591
 epoch: 85, train_loss: 0.7779, test_loss: 0.9855, test_f1: 0.5674
 epoch: 86, train_loss: 0.7747, test_loss: 0.9899, test_f1: 0.5605
 epoch: 87, train_loss: 0.7642, test_loss: 0.9797, test_f1: 0.5728
 epoch: 88, train_loss: 0.7709, test_loss: 0.9710, test_f1: 0.5695
 epoch: 89, train_loss: 0.7734, test_loss: 0.9834, test_f1: 0.5732
 epoch: 90, train_loss: 0.7635, test_loss: 0.9889, test_f1: 0.5590
 epoch: 91, train_loss: 0.7624, test_loss: 0.9771, test_f1: 0.5669
 epoch: 92, train_loss: 0.7662, test_loss: 0.9869, test_f1: 0.5682
 epoch: 93, train_loss: 0.7605, test_loss: 0.9931, test_f1: 0.5639
 epoch: 94, train_loss: 0.7594, test_loss: 0.9835, test_f1: 0.5666
 epoch: 95, train_loss: 0.7604, test_loss: 0.9808, test_f1: 0.5673
 epoch: 96, train_loss: 0.7491, test_loss: 0.9929, test_f1: 0.5731
 epoch: 97, train_loss: 0.7578, test_loss: 0.9866, test_f1: 0.5687
 epoch: 98, train_loss: 0.7532, test_loss: 0.9813, test_f1: 0.5809
 epoch: 99, train_loss: 0.7573, test_loss: 0.9877, test_f1: 0.5714
##################ITERATION #9 ****************************************
 epoch: 0, train_loss: 1.3086, test_loss: 1.3093, test_f1: 0.2270
 epoch: 1, train_loss: 1.2077, test_loss: 1.2987, test_f1: 0.3324
 epoch: 2, train_loss: 1.1815, test_loss: 1.2560, test_f1: 0.2840
 epoch: 3, train_loss: 1.1569, test_loss: 1.1647, test_f1: 0.3796
 epoch: 4, train_loss: 1.1336, test_loss: 1.1335, test_f1: 0.4074
 epoch: 5, train_loss: 1.1077, test_loss: 1.1174, test_f1: 0.4296
 epoch: 6, train_loss: 1.1040, test_loss: 1.0684, test_f1: 0.4552
 epoch: 7, train_loss: 1.0795, test_loss: 1.0316, test_f1: 0.4744
 epoch: 8, train_loss: 1.0648, test_loss: 1.0199, test_f1: 0.4739
 epoch: 9, train_loss: 1.0488, test_loss: 1.0128, test_f1: 0.4701
 epoch: 10, train_loss: 1.0446, test_loss: 1.0042, test_f1: 0.4780
 epoch: 11, train_loss: 1.0283, test_loss: 0.9938, test_f1: 0.4932
 epoch: 12, train_loss: 1.0192, test_loss: 0.9841, test_f1: 0.4950
 epoch: 13, train_loss: 1.0124, test_loss: 0.9760, test_f1: 0.4946
 epoch: 14, train_loss: 0.9992, test_loss: 0.9703, test_f1: 0.4907
 epoch: 15, train_loss: 0.9931, test_loss: 0.9691, test_f1: 0.4978
 epoch: 16, train_loss: 0.9854, test_loss: 0.9583, test_f1: 0.5035
 epoch: 17, train_loss: 0.9740, test_loss: 0.9557, test_f1: 0.5040
 epoch: 18, train_loss: 0.9668, test_loss: 0.9532, test_f1: 0.5054
 epoch: 19, train_loss: 0.9691, test_loss: 0.9413, test_f1: 0.5084
 epoch: 20, train_loss: 0.9520, test_loss: 0.9479, test_f1: 0.5068
 epoch: 21, train_loss: 0.9522, test_loss: 0.9435, test_f1: 0.5077
 epoch: 22, train_loss: 0.9405, test_loss: 0.9346, test_f1: 0.5081
 epoch: 23, train_loss: 0.9413, test_loss: 0.9412, test_f1: 0.5072
 epoch: 24, train_loss: 0.9351, test_loss: 0.9372, test_f1: 0.5043
 epoch: 25, train_loss: 0.9325, test_loss: 0.9390, test_f1: 0.5081
 epoch: 26, train_loss: 0.9299, test_loss: 0.9320, test_f1: 0.5136
 epoch: 27, train_loss: 0.9189, test_loss: 0.9254, test_f1: 0.5146
 epoch: 28, train_loss: 0.9213, test_loss: 0.9348, test_f1: 0.5074
 epoch: 29, train_loss: 0.9177, test_loss: 0.9271, test_f1: 0.5051
 epoch: 30, train_loss: 0.9134, test_loss: 0.9217, test_f1: 0.5137
 epoch: 31, train_loss: 0.9049, test_loss: 0.9333, test_f1: 0.5134
 epoch: 32, train_loss: 0.8994, test_loss: 0.9358, test_f1: 0.5109
 epoch: 33, train_loss: 0.8954, test_loss: 0.9292, test_f1: 0.5165
 epoch: 34, train_loss: 0.8983, test_loss: 0.9262, test_f1: 0.5183
 epoch: 35, train_loss: 0.8879, test_loss: 0.9272, test_f1: 0.5202
 epoch: 36, train_loss: 0.8941, test_loss: 0.9226, test_f1: 0.5158
 epoch: 37, train_loss: 0.8818, test_loss: 0.9159, test_f1: 0.5156
 epoch: 38, train_loss: 0.8810, test_loss: 0.9321, test_f1: 0.5148
 epoch: 39, train_loss: 0.8749, test_loss: 0.9298, test_f1: 0.5131
 epoch: 40, train_loss: 0.8684, test_loss: 0.9293, test_f1: 0.5115
 epoch: 41, train_loss: 0.8702, test_loss: 0.9169, test_f1: 0.5173
 epoch: 42, train_loss: 0.8674, test_loss: 0.9278, test_f1: 0.5229
 epoch: 43, train_loss: 0.8582, test_loss: 0.9289, test_f1: 0.5116
 epoch: 44, train_loss: 0.8635, test_loss: 0.9239, test_f1: 0.5192
 epoch: 45, train_loss: 0.8697, test_loss: 0.9321, test_f1: 0.5259
 epoch: 46, train_loss: 0.8574, test_loss: 0.9290, test_f1: 0.5199
 epoch: 47, train_loss: 0.8550, test_loss: 0.9221, test_f1: 0.5163
 epoch: 48, train_loss: 0.8429, test_loss: 0.9360, test_f1: 0.5193
 epoch: 49, train_loss: 0.8431, test_loss: 0.9240, test_f1: 0.5258
 epoch: 50, train_loss: 0.8459, test_loss: 0.9351, test_f1: 0.5217
 epoch: 51, train_loss: 0.8453, test_loss: 0.9329, test_f1: 0.5210
 epoch: 52, train_loss: 0.8414, test_loss: 0.9308, test_f1: 0.5176
 epoch: 53, train_loss: 0.8369, test_loss: 0.9273, test_f1: 0.5274
 epoch: 54, train_loss: 0.8367, test_loss: 0.9213, test_f1: 0.5283
 epoch: 55, train_loss: 0.8293, test_loss: 0.9234, test_f1: 0.5252
 epoch: 56, train_loss: 0.8371, test_loss: 0.9301, test_f1: 0.5256
 epoch: 57, train_loss: 0.8349, test_loss: 0.9266, test_f1: 0.5277
 epoch: 58, train_loss: 0.8312, test_loss: 0.9259, test_f1: 0.5265
 epoch: 59, train_loss: 0.8233, test_loss: 0.9260, test_f1: 0.5295
 epoch: 60, train_loss: 0.8199, test_loss: 0.9325, test_f1: 0.5295
 epoch: 61, train_loss: 0.8275, test_loss: 0.9289, test_f1: 0.5296
 epoch: 62, train_loss: 0.8208, test_loss: 0.9322, test_f1: 0.5266
 epoch: 63, train_loss: 0.8193, test_loss: 0.9289, test_f1: 0.5326
 epoch: 64, train_loss: 0.8203, test_loss: 0.9343, test_f1: 0.5283
 epoch: 65, train_loss: 0.8153, test_loss: 0.9346, test_f1: 0.5332
 epoch: 66, train_loss: 0.8217, test_loss: 0.9307, test_f1: 0.5361
 epoch: 67, train_loss: 0.8134, test_loss: 0.9268, test_f1: 0.5308
 epoch: 68, train_loss: 0.8153, test_loss: 0.9391, test_f1: 0.5299
 epoch: 69, train_loss: 0.8176, test_loss: 0.9370, test_f1: 0.5363
 epoch: 70, train_loss: 0.8071, test_loss: 0.9289, test_f1: 0.5331
 epoch: 71, train_loss: 0.8052, test_loss: 0.9230, test_f1: 0.5350
 epoch: 72, train_loss: 0.8073, test_loss: 0.9358, test_f1: 0.5352
 epoch: 73, train_loss: 0.8098, test_loss: 0.9338, test_f1: 0.5382
 epoch: 74, train_loss: 0.8053, test_loss: 0.9338, test_f1: 0.5384
 epoch: 75, train_loss: 0.8018, test_loss: 0.9369, test_f1: 0.5345
 epoch: 76, train_loss: 0.8033, test_loss: 0.9356, test_f1: 0.5391
 epoch: 77, train_loss: 0.8016, test_loss: 0.9396, test_f1: 0.5424
 epoch: 78, train_loss: 0.8037, test_loss: 0.9318, test_f1: 0.5376
 epoch: 79, train_loss: 0.7912, test_loss: 0.9325, test_f1: 0.5405
 epoch: 80, train_loss: 0.7936, test_loss: 0.9252, test_f1: 0.5390
 epoch: 81, train_loss: 0.7986, test_loss: 0.9267, test_f1: 0.5412
 epoch: 82, train_loss: 0.7945, test_loss: 0.9310, test_f1: 0.5387
 epoch: 83, train_loss: 0.7911, test_loss: 0.9280, test_f1: 0.5430
 epoch: 84, train_loss: 0.7919, test_loss: 0.9320, test_f1: 0.5412
 epoch: 85, train_loss: 0.7879, test_loss: 0.9328, test_f1: 0.5339
 epoch: 86, train_loss: 0.7970, test_loss: 0.9292, test_f1: 0.5422
 epoch: 87, train_loss: 0.7847, test_loss: 0.9325, test_f1: 0.5420
 epoch: 88, train_loss: 0.7812, test_loss: 0.9341, test_f1: 0.5447
 epoch: 89, train_loss: 0.7850, test_loss: 0.9352, test_f1: 0.5448
 epoch: 90, train_loss: 0.7813, test_loss: 0.9378, test_f1: 0.5434
 epoch: 91, train_loss: 0.7847, test_loss: 0.9406, test_f1: 0.5435
 epoch: 92, train_loss: 0.7809, test_loss: 0.9377, test_f1: 0.5331
 epoch: 93, train_loss: 0.7847, test_loss: 0.9399, test_f1: 0.5348
 epoch: 94, train_loss: 0.7816, test_loss: 0.9383, test_f1: 0.5371
 epoch: 95, train_loss: 0.7760, test_loss: 0.9376, test_f1: 0.5495
 epoch: 96, train_loss: 0.7822, test_loss: 0.9389, test_f1: 0.5437
 epoch: 97, train_loss: 0.7750, test_loss: 0.9360, test_f1: 0.5402
 epoch: 98, train_loss: 0.7739, test_loss: 0.9415, test_f1: 0.5431
 epoch: 99, train_loss: 0.7798, test_loss: 0.9431, test_f1: 0.5430

Training completed in 398.40 seconds
Best F1: 0.5809 at epoch 98
Mean F1 across iterations: 0.5555  0.0119
========================FINAL RESULTS================================
FEGIN weighted F1: 0.5809  0.0119
python main.py --data ltspice_examples --representation component_net --model FEGIN --layers 4 --hiddens 64 --batch_size 256 --lr 0.0001 --emb_size 250 --epochs 100 --save_appendix component_net_L4_H64_BS256_LR0.0001_E250 --no_val
-----



STDERR:
  File "main.py", line 370, in <module>
    main()
  File "main.py", line 254, in main
    dataset = dataset_class(
  File "/home/philip/projects/ltspice_examples_code_repo/Circuit-Completion-Using-GNNs/component_classification_with_link_prediction_head/evaluation/FEGIN/kernel/circuit_datasets.py", line 15, in __init__
    self.data, self.slices = torch.load(self.processed_paths[0])
  File "/home/philip/.local/lib/python3.8/site-packages/torch/serialization.py", line 1040, in load
    warnings.warn(
  File "/usr/lib/python3.8/warnings.py", line 109, in _showwarnmsg
    sw(msg.message, msg.category, msg.filename, msg.lineno,
  File "main.py", line 47, in warn_with_traceback
    traceback.print_stack(file=log)
/home/philip/projects/ltspice_examples_code_repo/Circuit-Completion-Using-GNNs/component_classification_with_link_prediction_head/evaluation/FEGIN/kernel/circuit_datasets.py:15: FutureWarning: You are using `torch.load` with `weights_only=False` (the current default value), which uses the default pickle module implicitly. It is possible to construct malicious pickle data which will execute arbitrary code during unpickling (See https://github.com/pytorch/pytorch/blob/main/SECURITY.md#untrusted-models for more details). In a future release, the default value for `weights_only` will be flipped to `True`. This limits the functions that could be executed during unpickling. Arbitrary objects will no longer be allowed to be loaded via this mode unless they are explicitly allowlisted by the user via `torch.serialization.add_safe_globals`. We recommend you start setting `weights_only=True` for any use case where you don't have full control of the loaded file. Please open an issue on GitHub for any issues related to this experimental feature.
  self.data, self.slices = torch.load(self.processed_paths[0])
