STDOUT:
Results will be saved in /home/philip/projects/ltspice_examples_code_repo/Circuit-Completion-Using-GNNs/component_classification_with_link_prediction_head/evaluation/FEGIN/results/model_FEGIN_dataset_ltspice_examples
Command line input: python main.py --data ltspice_examples --representation component_component --model FEGIN --layers 6 --hiddens 32 --batch_size 256 --lr 0.0001 --emb_size 250 --epochs 100 --save_appendix component_component_L6_H32_BS256_LR0.0001_E250 --no_val
 is saved.
-----
ltspice_examples - FEGIN
Using 6 layers, 32 hidden units, h = 2
Loading component_component representation dataset
ENTERED
Training FEGIN on component_component representation
Train: 3556, Test: 845
##################ITERATION #0 ****************************************
 epoch: 0, train_loss: 1.4328, test_loss: 1.4239, test_f1: 0.1015
 epoch: 1, train_loss: 1.4289, test_loss: 1.4222, test_f1: 0.1015
 epoch: 2, train_loss: 1.4263, test_loss: 1.4205, test_f1: 0.1015
 epoch: 3, train_loss: 1.4240, test_loss: 1.4181, test_f1: 0.1011
 epoch: 4, train_loss: 1.4220, test_loss: 1.4155, test_f1: 0.1135
 epoch: 5, train_loss: 1.4191, test_loss: 1.4120, test_f1: 0.1136
 epoch: 6, train_loss: 1.4172, test_loss: 1.4097, test_f1: 0.1179
 epoch: 7, train_loss: 1.4148, test_loss: 1.4073, test_f1: 0.1196
 epoch: 8, train_loss: 1.4118, test_loss: 1.4053, test_f1: 0.1446
 epoch: 9, train_loss: 1.4097, test_loss: 1.4026, test_f1: 0.1463
 epoch: 10, train_loss: 1.4073, test_loss: 1.4001, test_f1: 0.1463
 epoch: 11, train_loss: 1.4036, test_loss: 1.3967, test_f1: 0.1463
 epoch: 12, train_loss: 1.4011, test_loss: 1.3935, test_f1: 0.1463
 epoch: 13, train_loss: 1.3972, test_loss: 1.3905, test_f1: 0.1463
 epoch: 14, train_loss: 1.3931, test_loss: 1.3863, test_f1: 0.1480
 epoch: 15, train_loss: 1.3897, test_loss: 1.3817, test_f1: 0.1582
 epoch: 16, train_loss: 1.3850, test_loss: 1.3763, test_f1: 0.1576
 epoch: 17, train_loss: 1.3787, test_loss: 1.3710, test_f1: 0.1597
 epoch: 18, train_loss: 1.3744, test_loss: 1.3650, test_f1: 0.1640
 epoch: 19, train_loss: 1.3668, test_loss: 1.3585, test_f1: 0.1634
 epoch: 20, train_loss: 1.3585, test_loss: 1.3514, test_f1: 0.1646
 epoch: 21, train_loss: 1.3523, test_loss: 1.3433, test_f1: 0.1898
 epoch: 22, train_loss: 1.3449, test_loss: 1.3355, test_f1: 0.2759
 epoch: 23, train_loss: 1.3367, test_loss: 1.3274, test_f1: 0.3126
 epoch: 24, train_loss: 1.3282, test_loss: 1.3187, test_f1: 0.3406
 epoch: 25, train_loss: 1.3187, test_loss: 1.3089, test_f1: 0.3584
 epoch: 26, train_loss: 1.3103, test_loss: 1.3009, test_f1: 0.3552
 epoch: 27, train_loss: 1.3048, test_loss: 1.2932, test_f1: 0.3522
 epoch: 28, train_loss: 1.2970, test_loss: 1.2856, test_f1: 0.3488
 epoch: 29, train_loss: 1.2866, test_loss: 1.2779, test_f1: 0.3486
 epoch: 30, train_loss: 1.2836, test_loss: 1.2722, test_f1: 0.3347
 epoch: 31, train_loss: 1.2735, test_loss: 1.2660, test_f1: 0.3349
 epoch: 32, train_loss: 1.2708, test_loss: 1.2597, test_f1: 0.3196
 epoch: 33, train_loss: 1.2686, test_loss: 1.2544, test_f1: 0.3312
 epoch: 34, train_loss: 1.2590, test_loss: 1.2505, test_f1: 0.3279
 epoch: 35, train_loss: 1.2574, test_loss: 1.2446, test_f1: 0.3190
 epoch: 36, train_loss: 1.2480, test_loss: 1.2393, test_f1: 0.3240
 epoch: 37, train_loss: 1.2453, test_loss: 1.2346, test_f1: 0.3314
 epoch: 38, train_loss: 1.2418, test_loss: 1.2306, test_f1: 0.3388
 epoch: 39, train_loss: 1.2374, test_loss: 1.2267, test_f1: 0.3395
 epoch: 40, train_loss: 1.2356, test_loss: 1.2251, test_f1: 0.3424
 epoch: 41, train_loss: 1.2305, test_loss: 1.2229, test_f1: 0.3408
 epoch: 42, train_loss: 1.2291, test_loss: 1.2194, test_f1: 0.3403
 epoch: 43, train_loss: 1.2272, test_loss: 1.2165, test_f1: 0.3432
 epoch: 44, train_loss: 1.2192, test_loss: 1.2135, test_f1: 0.3475
 epoch: 45, train_loss: 1.2148, test_loss: 1.2109, test_f1: 0.3391
 epoch: 46, train_loss: 1.2169, test_loss: 1.2081, test_f1: 0.3353
 epoch: 47, train_loss: 1.2075, test_loss: 1.2048, test_f1: 0.3444
 epoch: 48, train_loss: 1.2097, test_loss: 1.2033, test_f1: 0.3469
 epoch: 49, train_loss: 1.2069, test_loss: 1.2018, test_f1: 0.3534
 epoch: 50, train_loss: 1.1985, test_loss: 1.1983, test_f1: 0.3532
 epoch: 51, train_loss: 1.2031, test_loss: 1.1968, test_f1: 0.3514
 epoch: 52, train_loss: 1.1998, test_loss: 1.1964, test_f1: 0.3492
 epoch: 53, train_loss: 1.1961, test_loss: 1.1947, test_f1: 0.3497
 epoch: 54, train_loss: 1.1914, test_loss: 1.1949, test_f1: 0.3500
 epoch: 55, train_loss: 1.1928, test_loss: 1.1940, test_f1: 0.3556
 epoch: 56, train_loss: 1.1949, test_loss: 1.1934, test_f1: 0.3622
 epoch: 57, train_loss: 1.1952, test_loss: 1.1917, test_f1: 0.3541
 epoch: 58, train_loss: 1.1910, test_loss: 1.1902, test_f1: 0.3539
 epoch: 59, train_loss: 1.1914, test_loss: 1.1894, test_f1: 0.3541
 epoch: 60, train_loss: 1.1846, test_loss: 1.1888, test_f1: 0.3649
 epoch: 61, train_loss: 1.1879, test_loss: 1.1876, test_f1: 0.3665
 epoch: 62, train_loss: 1.1885, test_loss: 1.1870, test_f1: 0.3620
 epoch: 63, train_loss: 1.1848, test_loss: 1.1861, test_f1: 0.3579
 epoch: 64, train_loss: 1.1840, test_loss: 1.1860, test_f1: 0.3594
 epoch: 65, train_loss: 1.1849, test_loss: 1.1843, test_f1: 0.3526
 epoch: 66, train_loss: 1.1797, test_loss: 1.1832, test_f1: 0.3378
 epoch: 67, train_loss: 1.1811, test_loss: 1.1814, test_f1: 0.3417
 epoch: 68, train_loss: 1.1798, test_loss: 1.1801, test_f1: 0.3363
 epoch: 69, train_loss: 1.1777, test_loss: 1.1802, test_f1: 0.3372
 epoch: 70, train_loss: 1.1759, test_loss: 1.1794, test_f1: 0.3387
 epoch: 71, train_loss: 1.1720, test_loss: 1.1777, test_f1: 0.3370
 epoch: 72, train_loss: 1.1703, test_loss: 1.1777, test_f1: 0.3382
 epoch: 73, train_loss: 1.1736, test_loss: 1.1776, test_f1: 0.3414
 epoch: 74, train_loss: 1.1677, test_loss: 1.1767, test_f1: 0.3372
 epoch: 75, train_loss: 1.1698, test_loss: 1.1769, test_f1: 0.3397
 epoch: 76, train_loss: 1.1651, test_loss: 1.1778, test_f1: 0.3441
 epoch: 77, train_loss: 1.1637, test_loss: 1.1765, test_f1: 0.3356
 epoch: 78, train_loss: 1.1674, test_loss: 1.1754, test_f1: 0.3360
 epoch: 79, train_loss: 1.1671, test_loss: 1.1751, test_f1: 0.3377
 epoch: 80, train_loss: 1.1630, test_loss: 1.1752, test_f1: 0.3390
 epoch: 81, train_loss: 1.1643, test_loss: 1.1751, test_f1: 0.3355
 epoch: 82, train_loss: 1.1599, test_loss: 1.1724, test_f1: 0.3361
 epoch: 83, train_loss: 1.1573, test_loss: 1.1707, test_f1: 0.3435
 epoch: 84, train_loss: 1.1601, test_loss: 1.1709, test_f1: 0.3382
 epoch: 85, train_loss: 1.1577, test_loss: 1.1689, test_f1: 0.3475
 epoch: 86, train_loss: 1.1531, test_loss: 1.1704, test_f1: 0.3460
 epoch: 87, train_loss: 1.1604, test_loss: 1.1694, test_f1: 0.3483
 epoch: 88, train_loss: 1.1520, test_loss: 1.1663, test_f1: 0.3465
 epoch: 89, train_loss: 1.1502, test_loss: 1.1659, test_f1: 0.3480
 epoch: 90, train_loss: 1.1475, test_loss: 1.1645, test_f1: 0.3510
 epoch: 91, train_loss: 1.1419, test_loss: 1.1638, test_f1: 0.3466
 epoch: 92, train_loss: 1.1467, test_loss: 1.1644, test_f1: 0.3368
 epoch: 93, train_loss: 1.1466, test_loss: 1.1630, test_f1: 0.3401
 epoch: 94, train_loss: 1.1507, test_loss: 1.1614, test_f1: 0.3479
 epoch: 95, train_loss: 1.1486, test_loss: 1.1612, test_f1: 0.3460
 epoch: 96, train_loss: 1.1471, test_loss: 1.1605, test_f1: 0.3537
 epoch: 97, train_loss: 1.1428, test_loss: 1.1598, test_f1: 0.3539
 epoch: 98, train_loss: 1.1390, test_loss: 1.1597, test_f1: 0.3576
 epoch: 99, train_loss: 1.1374, test_loss: 1.1582, test_f1: 0.3592
##################ITERATION #1 ****************************************
 epoch: 0, train_loss: 1.3885, test_loss: 1.3879, test_f1: 0.1583
 epoch: 1, train_loss: 1.3827, test_loss: 1.3866, test_f1: 0.1637
 epoch: 2, train_loss: 1.3773, test_loss: 1.3819, test_f1: 0.1535
 epoch: 3, train_loss: 1.3729, test_loss: 1.3729, test_f1: 0.1963
 epoch: 4, train_loss: 1.3675, test_loss: 1.3658, test_f1: 0.2211
 epoch: 5, train_loss: 1.3617, test_loss: 1.3590, test_f1: 0.2559
 epoch: 6, train_loss: 1.3557, test_loss: 1.3518, test_f1: 0.2741
 epoch: 7, train_loss: 1.3501, test_loss: 1.3431, test_f1: 0.2773
 epoch: 8, train_loss: 1.3430, test_loss: 1.3354, test_f1: 0.2711
 epoch: 9, train_loss: 1.3348, test_loss: 1.3270, test_f1: 0.2772
 epoch: 10, train_loss: 1.3268, test_loss: 1.3193, test_f1: 0.2842
 epoch: 11, train_loss: 1.3191, test_loss: 1.3118, test_f1: 0.3130
 epoch: 12, train_loss: 1.3105, test_loss: 1.3036, test_f1: 0.2959
 epoch: 13, train_loss: 1.3034, test_loss: 1.2958, test_f1: 0.2991
 epoch: 14, train_loss: 1.2954, test_loss: 1.2884, test_f1: 0.2854
 epoch: 15, train_loss: 1.2889, test_loss: 1.2815, test_f1: 0.2771
 epoch: 16, train_loss: 1.2825, test_loss: 1.2747, test_f1: 0.2759
 epoch: 17, train_loss: 1.2731, test_loss: 1.2691, test_f1: 0.2711
 epoch: 18, train_loss: 1.2685, test_loss: 1.2635, test_f1: 0.2694
 epoch: 19, train_loss: 1.2590, test_loss: 1.2587, test_f1: 0.2687
 epoch: 20, train_loss: 1.2583, test_loss: 1.2539, test_f1: 0.2713
 epoch: 21, train_loss: 1.2508, test_loss: 1.2510, test_f1: 0.2688
 epoch: 22, train_loss: 1.2483, test_loss: 1.2472, test_f1: 0.2701
 epoch: 23, train_loss: 1.2420, test_loss: 1.2447, test_f1: 0.2712
 epoch: 24, train_loss: 1.2412, test_loss: 1.2420, test_f1: 0.2760
 epoch: 25, train_loss: 1.2424, test_loss: 1.2386, test_f1: 0.2764
 epoch: 26, train_loss: 1.2399, test_loss: 1.2360, test_f1: 0.2841
 epoch: 27, train_loss: 1.2317, test_loss: 1.2341, test_f1: 0.2884
 epoch: 28, train_loss: 1.2255, test_loss: 1.2314, test_f1: 0.2941
 epoch: 29, train_loss: 1.2238, test_loss: 1.2293, test_f1: 0.2926
 epoch: 30, train_loss: 1.2233, test_loss: 1.2266, test_f1: 0.3000
 epoch: 31, train_loss: 1.2241, test_loss: 1.2250, test_f1: 0.3108
 epoch: 32, train_loss: 1.2160, test_loss: 1.2224, test_f1: 0.3165
 epoch: 33, train_loss: 1.2150, test_loss: 1.2193, test_f1: 0.3181
 epoch: 34, train_loss: 1.2104, test_loss: 1.2164, test_f1: 0.3210
 epoch: 35, train_loss: 1.2072, test_loss: 1.2143, test_f1: 0.3325
 epoch: 36, train_loss: 1.2091, test_loss: 1.2121, test_f1: 0.3362
 epoch: 37, train_loss: 1.2011, test_loss: 1.2102, test_f1: 0.3405
 epoch: 38, train_loss: 1.1990, test_loss: 1.2077, test_f1: 0.3371
 epoch: 39, train_loss: 1.1994, test_loss: 1.2051, test_f1: 0.3427
 epoch: 40, train_loss: 1.1974, test_loss: 1.2031, test_f1: 0.3470
 epoch: 41, train_loss: 1.1939, test_loss: 1.2009, test_f1: 0.3512
 epoch: 42, train_loss: 1.1891, test_loss: 1.1970, test_f1: 0.3513
 epoch: 43, train_loss: 1.1890, test_loss: 1.1946, test_f1: 0.3551
 epoch: 44, train_loss: 1.1859, test_loss: 1.1930, test_f1: 0.3579
 epoch: 45, train_loss: 1.1801, test_loss: 1.1893, test_f1: 0.3609
 epoch: 46, train_loss: 1.1760, test_loss: 1.1875, test_f1: 0.3709
 epoch: 47, train_loss: 1.1747, test_loss: 1.1848, test_f1: 0.3686
 epoch: 48, train_loss: 1.1702, test_loss: 1.1824, test_f1: 0.3704
 epoch: 49, train_loss: 1.1648, test_loss: 1.1802, test_f1: 0.3720
 epoch: 50, train_loss: 1.1649, test_loss: 1.1775, test_f1: 0.3872
 epoch: 51, train_loss: 1.1639, test_loss: 1.1760, test_f1: 0.3831
 epoch: 52, train_loss: 1.1638, test_loss: 1.1753, test_f1: 0.3863
 epoch: 53, train_loss: 1.1633, test_loss: 1.1744, test_f1: 0.3791
 epoch: 54, train_loss: 1.1580, test_loss: 1.1721, test_f1: 0.3850
 epoch: 55, train_loss: 1.1530, test_loss: 1.1703, test_f1: 0.3838
 epoch: 56, train_loss: 1.1520, test_loss: 1.1703, test_f1: 0.3847
 epoch: 57, train_loss: 1.1565, test_loss: 1.1695, test_f1: 0.3849
 epoch: 58, train_loss: 1.1546, test_loss: 1.1689, test_f1: 0.3802
 epoch: 59, train_loss: 1.1489, test_loss: 1.1682, test_f1: 0.3781
 epoch: 60, train_loss: 1.1482, test_loss: 1.1664, test_f1: 0.3870
 epoch: 61, train_loss: 1.1483, test_loss: 1.1649, test_f1: 0.3833
 epoch: 62, train_loss: 1.1550, test_loss: 1.1652, test_f1: 0.3879
 epoch: 63, train_loss: 1.1416, test_loss: 1.1641, test_f1: 0.3846
 epoch: 64, train_loss: 1.1474, test_loss: 1.1633, test_f1: 0.3835
 epoch: 65, train_loss: 1.1420, test_loss: 1.1612, test_f1: 0.3919
 epoch: 66, train_loss: 1.1380, test_loss: 1.1618, test_f1: 0.3901
 epoch: 67, train_loss: 1.1360, test_loss: 1.1615, test_f1: 0.3883
 epoch: 68, train_loss: 1.1407, test_loss: 1.1605, test_f1: 0.3867
 epoch: 69, train_loss: 1.1336, test_loss: 1.1595, test_f1: 0.3876
 epoch: 70, train_loss: 1.1367, test_loss: 1.1587, test_f1: 0.3923
 epoch: 71, train_loss: 1.1344, test_loss: 1.1582, test_f1: 0.3924
 epoch: 72, train_loss: 1.1355, test_loss: 1.1572, test_f1: 0.3864
 epoch: 73, train_loss: 1.1288, test_loss: 1.1568, test_f1: 0.3836
 epoch: 74, train_loss: 1.1288, test_loss: 1.1561, test_f1: 0.3864
 epoch: 75, train_loss: 1.1247, test_loss: 1.1560, test_f1: 0.3832
 epoch: 76, train_loss: 1.1227, test_loss: 1.1550, test_f1: 0.3832
 epoch: 77, train_loss: 1.1224, test_loss: 1.1540, test_f1: 0.3863
 epoch: 78, train_loss: 1.1191, test_loss: 1.1521, test_f1: 0.3776
 epoch: 79, train_loss: 1.1245, test_loss: 1.1511, test_f1: 0.3798
 epoch: 80, train_loss: 1.1208, test_loss: 1.1506, test_f1: 0.3833
 epoch: 81, train_loss: 1.1168, test_loss: 1.1515, test_f1: 0.3873
 epoch: 82, train_loss: 1.1176, test_loss: 1.1517, test_f1: 0.3873
 epoch: 83, train_loss: 1.1177, test_loss: 1.1522, test_f1: 0.3853
 epoch: 84, train_loss: 1.1160, test_loss: 1.1497, test_f1: 0.3828
 epoch: 85, train_loss: 1.1147, test_loss: 1.1473, test_f1: 0.3852
 epoch: 86, train_loss: 1.1077, test_loss: 1.1481, test_f1: 0.3854
 epoch: 87, train_loss: 1.1134, test_loss: 1.1474, test_f1: 0.3863
 epoch: 88, train_loss: 1.1131, test_loss: 1.1466, test_f1: 0.3882
 epoch: 89, train_loss: 1.1097, test_loss: 1.1464, test_f1: 0.3892
 epoch: 90, train_loss: 1.1056, test_loss: 1.1466, test_f1: 0.3892
 epoch: 91, train_loss: 1.1070, test_loss: 1.1453, test_f1: 0.3855
 epoch: 92, train_loss: 1.1067, test_loss: 1.1453, test_f1: 0.3904
 epoch: 93, train_loss: 1.1073, test_loss: 1.1467, test_f1: 0.3871
 epoch: 94, train_loss: 1.1014, test_loss: 1.1472, test_f1: 0.3832
 epoch: 95, train_loss: 1.1025, test_loss: 1.1468, test_f1: 0.3871
 epoch: 96, train_loss: 1.1031, test_loss: 1.1464, test_f1: 0.3808
 epoch: 97, train_loss: 1.0964, test_loss: 1.1449, test_f1: 0.3817
 epoch: 98, train_loss: 1.1006, test_loss: 1.1441, test_f1: 0.3815
 epoch: 99, train_loss: 1.0924, test_loss: 1.1434, test_f1: 0.3899
##################ITERATION #2 ****************************************
 epoch: 0, train_loss: 1.3438, test_loss: 1.3525, test_f1: 0.2274
 epoch: 1, train_loss: 1.3345, test_loss: 1.3436, test_f1: 0.2274
 epoch: 2, train_loss: 1.3274, test_loss: 1.3366, test_f1: 0.2274
 epoch: 3, train_loss: 1.3193, test_loss: 1.3288, test_f1: 0.2274
 epoch: 4, train_loss: 1.3139, test_loss: 1.3217, test_f1: 0.2443
 epoch: 5, train_loss: 1.3077, test_loss: 1.3115, test_f1: 0.2643
 epoch: 6, train_loss: 1.3025, test_loss: 1.3007, test_f1: 0.2488
 epoch: 7, train_loss: 1.2953, test_loss: 1.2916, test_f1: 0.2500
 epoch: 8, train_loss: 1.2903, test_loss: 1.2852, test_f1: 0.2499
 epoch: 9, train_loss: 1.2846, test_loss: 1.2788, test_f1: 0.2500
 epoch: 10, train_loss: 1.2796, test_loss: 1.2738, test_f1: 0.2534
 epoch: 11, train_loss: 1.2744, test_loss: 1.2699, test_f1: 0.2578
 epoch: 12, train_loss: 1.2683, test_loss: 1.2637, test_f1: 0.2863
 epoch: 13, train_loss: 1.2629, test_loss: 1.2581, test_f1: 0.2958
 epoch: 14, train_loss: 1.2588, test_loss: 1.2531, test_f1: 0.3033
 epoch: 15, train_loss: 1.2569, test_loss: 1.2468, test_f1: 0.3035
 epoch: 16, train_loss: 1.2507, test_loss: 1.2420, test_f1: 0.3171
 epoch: 17, train_loss: 1.2445, test_loss: 1.2354, test_f1: 0.3233
 epoch: 18, train_loss: 1.2438, test_loss: 1.2320, test_f1: 0.3194
 epoch: 19, train_loss: 1.2404, test_loss: 1.2278, test_f1: 0.3279
 epoch: 20, train_loss: 1.2379, test_loss: 1.2245, test_f1: 0.3280
 epoch: 21, train_loss: 1.2322, test_loss: 1.2200, test_f1: 0.3332
 epoch: 22, train_loss: 1.2271, test_loss: 1.2168, test_f1: 0.3377
 epoch: 23, train_loss: 1.2252, test_loss: 1.2134, test_f1: 0.3402
 epoch: 24, train_loss: 1.2229, test_loss: 1.2095, test_f1: 0.3402
 epoch: 25, train_loss: 1.2221, test_loss: 1.2069, test_f1: 0.3385
 epoch: 26, train_loss: 1.2144, test_loss: 1.2047, test_f1: 0.3389
 epoch: 27, train_loss: 1.2153, test_loss: 1.2007, test_f1: 0.3326
 epoch: 28, train_loss: 1.2115, test_loss: 1.1979, test_f1: 0.3409
 epoch: 29, train_loss: 1.2072, test_loss: 1.1961, test_f1: 0.3395
 epoch: 30, train_loss: 1.2027, test_loss: 1.1935, test_f1: 0.3422
 epoch: 31, train_loss: 1.2060, test_loss: 1.1907, test_f1: 0.3466
 epoch: 32, train_loss: 1.1983, test_loss: 1.1889, test_f1: 0.3456
 epoch: 33, train_loss: 1.1999, test_loss: 1.1868, test_f1: 0.3420
 epoch: 34, train_loss: 1.1928, test_loss: 1.1847, test_f1: 0.3374
 epoch: 35, train_loss: 1.1879, test_loss: 1.1826, test_f1: 0.3397
 epoch: 36, train_loss: 1.1891, test_loss: 1.1795, test_f1: 0.3393
 epoch: 37, train_loss: 1.1882, test_loss: 1.1772, test_f1: 0.3419
 epoch: 38, train_loss: 1.1859, test_loss: 1.1759, test_f1: 0.3441
 epoch: 39, train_loss: 1.1839, test_loss: 1.1730, test_f1: 0.3367
 epoch: 40, train_loss: 1.1805, test_loss: 1.1715, test_f1: 0.3330
 epoch: 41, train_loss: 1.1817, test_loss: 1.1701, test_f1: 0.3353
 epoch: 42, train_loss: 1.1823, test_loss: 1.1685, test_f1: 0.3336
 epoch: 43, train_loss: 1.1751, test_loss: 1.1708, test_f1: 0.3377
 epoch: 44, train_loss: 1.1727, test_loss: 1.1715, test_f1: 0.3451
 epoch: 45, train_loss: 1.1671, test_loss: 1.1649, test_f1: 0.3457
 epoch: 46, train_loss: 1.1725, test_loss: 1.1607, test_f1: 0.3387
 epoch: 47, train_loss: 1.1646, test_loss: 1.1596, test_f1: 0.3386
 epoch: 48, train_loss: 1.1636, test_loss: 1.1583, test_f1: 0.3392
 epoch: 49, train_loss: 1.1638, test_loss: 1.1591, test_f1: 0.3357
 epoch: 50, train_loss: 1.1655, test_loss: 1.1578, test_f1: 0.3434
 epoch: 51, train_loss: 1.1556, test_loss: 1.1577, test_f1: 0.3440
 epoch: 52, train_loss: 1.1550, test_loss: 1.1563, test_f1: 0.3445
 epoch: 53, train_loss: 1.1510, test_loss: 1.1564, test_f1: 0.3456
 epoch: 54, train_loss: 1.1586, test_loss: 1.1558, test_f1: 0.3427
 epoch: 55, train_loss: 1.1509, test_loss: 1.1541, test_f1: 0.3447
 epoch: 56, train_loss: 1.1525, test_loss: 1.1539, test_f1: 0.3448
 epoch: 57, train_loss: 1.1512, test_loss: 1.1541, test_f1: 0.3506
 epoch: 58, train_loss: 1.1529, test_loss: 1.1546, test_f1: 0.3404
 epoch: 59, train_loss: 1.1468, test_loss: 1.1538, test_f1: 0.3437
 epoch: 60, train_loss: 1.1478, test_loss: 1.1528, test_f1: 0.3432
 epoch: 61, train_loss: 1.1454, test_loss: 1.1518, test_f1: 0.3484
 epoch: 62, train_loss: 1.1436, test_loss: 1.1515, test_f1: 0.3481
 epoch: 63, train_loss: 1.1467, test_loss: 1.1505, test_f1: 0.3478
 epoch: 64, train_loss: 1.1422, test_loss: 1.1499, test_f1: 0.3537
 epoch: 65, train_loss: 1.1410, test_loss: 1.1494, test_f1: 0.3478
 epoch: 66, train_loss: 1.1417, test_loss: 1.1488, test_f1: 0.3480
 epoch: 67, train_loss: 1.1409, test_loss: 1.1484, test_f1: 0.3509
 epoch: 68, train_loss: 1.1427, test_loss: 1.1477, test_f1: 0.3475
 epoch: 69, train_loss: 1.1349, test_loss: 1.1494, test_f1: 0.3491
 epoch: 70, train_loss: 1.1362, test_loss: 1.1474, test_f1: 0.3488
 epoch: 71, train_loss: 1.1361, test_loss: 1.1477, test_f1: 0.3509
 epoch: 72, train_loss: 1.1363, test_loss: 1.1467, test_f1: 0.3457
 epoch: 73, train_loss: 1.1403, test_loss: 1.1455, test_f1: 0.3480
 epoch: 74, train_loss: 1.1356, test_loss: 1.1444, test_f1: 0.3481
 epoch: 75, train_loss: 1.1359, test_loss: 1.1445, test_f1: 0.3490
 epoch: 76, train_loss: 1.1336, test_loss: 1.1444, test_f1: 0.3492
 epoch: 77, train_loss: 1.1279, test_loss: 1.1431, test_f1: 0.3491
 epoch: 78, train_loss: 1.1324, test_loss: 1.1435, test_f1: 0.3454
 epoch: 79, train_loss: 1.1285, test_loss: 1.1437, test_f1: 0.3452
 epoch: 80, train_loss: 1.1295, test_loss: 1.1419, test_f1: 0.3462
 epoch: 81, train_loss: 1.1279, test_loss: 1.1415, test_f1: 0.3425
 epoch: 82, train_loss: 1.1283, test_loss: 1.1413, test_f1: 0.3447
 epoch: 83, train_loss: 1.1217, test_loss: 1.1419, test_f1: 0.3440
 epoch: 84, train_loss: 1.1232, test_loss: 1.1412, test_f1: 0.3471
 epoch: 85, train_loss: 1.1217, test_loss: 1.1402, test_f1: 0.3462
 epoch: 86, train_loss: 1.1207, test_loss: 1.1405, test_f1: 0.3457
 epoch: 87, train_loss: 1.1167, test_loss: 1.1412, test_f1: 0.3433
 epoch: 88, train_loss: 1.1214, test_loss: 1.1414, test_f1: 0.3413
 epoch: 89, train_loss: 1.1208, test_loss: 1.1401, test_f1: 0.3427
 epoch: 90, train_loss: 1.1219, test_loss: 1.1395, test_f1: 0.3417
 epoch: 91, train_loss: 1.1173, test_loss: 1.1394, test_f1: 0.3417
 epoch: 92, train_loss: 1.1171, test_loss: 1.1388, test_f1: 0.3457
 epoch: 93, train_loss: 1.1143, test_loss: 1.1383, test_f1: 0.3474
 epoch: 94, train_loss: 1.1146, test_loss: 1.1387, test_f1: 0.3455
 epoch: 95, train_loss: 1.1145, test_loss: 1.1380, test_f1: 0.3502
 epoch: 96, train_loss: 1.1157, test_loss: 1.1375, test_f1: 0.3481
 epoch: 97, train_loss: 1.1126, test_loss: 1.1368, test_f1: 0.3461
 epoch: 98, train_loss: 1.1111, test_loss: 1.1366, test_f1: 0.3462
 epoch: 99, train_loss: 1.1121, test_loss: 1.1361, test_f1: 0.3554
##################ITERATION #3 ****************************************
 epoch: 0, train_loss: 1.3421, test_loss: 1.3597, test_f1: 0.2274
 epoch: 1, train_loss: 1.3307, test_loss: 1.3531, test_f1: 0.2274
 epoch: 2, train_loss: 1.3251, test_loss: 1.3409, test_f1: 0.2269
 epoch: 3, train_loss: 1.3205, test_loss: 1.3304, test_f1: 0.2325
 epoch: 4, train_loss: 1.3123, test_loss: 1.3194, test_f1: 0.2369
 epoch: 5, train_loss: 1.3092, test_loss: 1.3092, test_f1: 0.2529
 epoch: 6, train_loss: 1.3015, test_loss: 1.3018, test_f1: 0.2720
 epoch: 7, train_loss: 1.2974, test_loss: 1.2909, test_f1: 0.2748
 epoch: 8, train_loss: 1.2903, test_loss: 1.2865, test_f1: 0.2661
 epoch: 9, train_loss: 1.2839, test_loss: 1.2825, test_f1: 0.2817
 epoch: 10, train_loss: 1.2815, test_loss: 1.2716, test_f1: 0.2971
 epoch: 11, train_loss: 1.2768, test_loss: 1.2677, test_f1: 0.2925
 epoch: 12, train_loss: 1.2709, test_loss: 1.2612, test_f1: 0.3020
 epoch: 13, train_loss: 1.2651, test_loss: 1.2535, test_f1: 0.3030
 epoch: 14, train_loss: 1.2620, test_loss: 1.2483, test_f1: 0.3104
 epoch: 15, train_loss: 1.2564, test_loss: 1.2437, test_f1: 0.3294
 epoch: 16, train_loss: 1.2511, test_loss: 1.2379, test_f1: 0.3300
 epoch: 17, train_loss: 1.2477, test_loss: 1.2318, test_f1: 0.3256
 epoch: 18, train_loss: 1.2389, test_loss: 1.2257, test_f1: 0.3273
 epoch: 19, train_loss: 1.2404, test_loss: 1.2203, test_f1: 0.3369
 epoch: 20, train_loss: 1.2357, test_loss: 1.2159, test_f1: 0.3375
 epoch: 21, train_loss: 1.2316, test_loss: 1.2169, test_f1: 0.3342
 epoch: 22, train_loss: 1.2308, test_loss: 1.2104, test_f1: 0.3336
 epoch: 23, train_loss: 1.2285, test_loss: 1.2069, test_f1: 0.3349
 epoch: 24, train_loss: 1.2242, test_loss: 1.2038, test_f1: 0.3353
 epoch: 25, train_loss: 1.2216, test_loss: 1.1999, test_f1: 0.3396
 epoch: 26, train_loss: 1.2168, test_loss: 1.1990, test_f1: 0.3401
 epoch: 27, train_loss: 1.2180, test_loss: 1.1973, test_f1: 0.3416
 epoch: 28, train_loss: 1.2120, test_loss: 1.1942, test_f1: 0.3401
 epoch: 29, train_loss: 1.2105, test_loss: 1.1928, test_f1: 0.3429
 epoch: 30, train_loss: 1.2057, test_loss: 1.1902, test_f1: 0.3459
 epoch: 31, train_loss: 1.2067, test_loss: 1.1868, test_f1: 0.3448
 epoch: 32, train_loss: 1.1998, test_loss: 1.1860, test_f1: 0.3510
 epoch: 33, train_loss: 1.1951, test_loss: 1.1849, test_f1: 0.3503
 epoch: 34, train_loss: 1.2041, test_loss: 1.1843, test_f1: 0.3510
 epoch: 35, train_loss: 1.1984, test_loss: 1.1821, test_f1: 0.3506
 epoch: 36, train_loss: 1.1975, test_loss: 1.1838, test_f1: 0.3543
 epoch: 37, train_loss: 1.1895, test_loss: 1.1780, test_f1: 0.3548
 epoch: 38, train_loss: 1.1891, test_loss: 1.1757, test_f1: 0.3519
 epoch: 39, train_loss: 1.1876, test_loss: 1.1758, test_f1: 0.3607
 epoch: 40, train_loss: 1.1802, test_loss: 1.1706, test_f1: 0.3568
 epoch: 41, train_loss: 1.1855, test_loss: 1.1712, test_f1: 0.3569
 epoch: 42, train_loss: 1.1831, test_loss: 1.1687, test_f1: 0.3605
 epoch: 43, train_loss: 1.1773, test_loss: 1.1663, test_f1: 0.3780
 epoch: 44, train_loss: 1.1770, test_loss: 1.1638, test_f1: 0.3729
 epoch: 45, train_loss: 1.1647, test_loss: 1.1625, test_f1: 0.3715
 epoch: 46, train_loss: 1.1695, test_loss: 1.1611, test_f1: 0.3636
 epoch: 47, train_loss: 1.1693, test_loss: 1.1630, test_f1: 0.3677
 epoch: 48, train_loss: 1.1717, test_loss: 1.1603, test_f1: 0.3620
 epoch: 49, train_loss: 1.1657, test_loss: 1.1566, test_f1: 0.3647
 epoch: 50, train_loss: 1.1613, test_loss: 1.1542, test_f1: 0.3647
 epoch: 51, train_loss: 1.1576, test_loss: 1.1543, test_f1: 0.3673
 epoch: 52, train_loss: 1.1625, test_loss: 1.1534, test_f1: 0.3663
 epoch: 53, train_loss: 1.1582, test_loss: 1.1501, test_f1: 0.3768
 epoch: 54, train_loss: 1.1530, test_loss: 1.1483, test_f1: 0.3770
 epoch: 55, train_loss: 1.1569, test_loss: 1.1476, test_f1: 0.3756
 epoch: 56, train_loss: 1.1556, test_loss: 1.1476, test_f1: 0.3797
 epoch: 57, train_loss: 1.1548, test_loss: 1.1459, test_f1: 0.3775
 epoch: 58, train_loss: 1.1473, test_loss: 1.1467, test_f1: 0.3739
 epoch: 59, train_loss: 1.1538, test_loss: 1.1495, test_f1: 0.3766
 epoch: 60, train_loss: 1.1569, test_loss: 1.1493, test_f1: 0.3785
 epoch: 61, train_loss: 1.1519, test_loss: 1.1489, test_f1: 0.3784
 epoch: 62, train_loss: 1.1445, test_loss: 1.1462, test_f1: 0.3851
 epoch: 63, train_loss: 1.1439, test_loss: 1.1432, test_f1: 0.3831
 epoch: 64, train_loss: 1.1459, test_loss: 1.1403, test_f1: 0.3831
 epoch: 65, train_loss: 1.1397, test_loss: 1.1391, test_f1: 0.3824
 epoch: 66, train_loss: 1.1451, test_loss: 1.1358, test_f1: 0.3834
 epoch: 67, train_loss: 1.1376, test_loss: 1.1384, test_f1: 0.3788
 epoch: 68, train_loss: 1.1391, test_loss: 1.1418, test_f1: 0.3745
 epoch: 69, train_loss: 1.1412, test_loss: 1.1421, test_f1: 0.3783
 epoch: 70, train_loss: 1.1370, test_loss: 1.1407, test_f1: 0.3774
 epoch: 71, train_loss: 1.1407, test_loss: 1.1399, test_f1: 0.3746
 epoch: 72, train_loss: 1.1330, test_loss: 1.1408, test_f1: 0.3776
 epoch: 73, train_loss: 1.1392, test_loss: 1.1436, test_f1: 0.3785
 epoch: 74, train_loss: 1.1314, test_loss: 1.1421, test_f1: 0.3769
 epoch: 75, train_loss: 1.1305, test_loss: 1.1413, test_f1: 0.3711
 epoch: 76, train_loss: 1.1332, test_loss: 1.1403, test_f1: 0.3743
 epoch: 77, train_loss: 1.1358, test_loss: 1.1362, test_f1: 0.3781
 epoch: 78, train_loss: 1.1282, test_loss: 1.1349, test_f1: 0.3775
 epoch: 79, train_loss: 1.1323, test_loss: 1.1355, test_f1: 0.3787
 epoch: 80, train_loss: 1.1306, test_loss: 1.1372, test_f1: 0.3815
 epoch: 81, train_loss: 1.1242, test_loss: 1.1380, test_f1: 0.3725
 epoch: 82, train_loss: 1.1288, test_loss: 1.1363, test_f1: 0.3773
 epoch: 83, train_loss: 1.1232, test_loss: 1.1369, test_f1: 0.3824
 epoch: 84, train_loss: 1.1302, test_loss: 1.1368, test_f1: 0.3804
 epoch: 85, train_loss: 1.1246, test_loss: 1.1375, test_f1: 0.3814
 epoch: 86, train_loss: 1.1206, test_loss: 1.1332, test_f1: 0.3835
 epoch: 87, train_loss: 1.1216, test_loss: 1.1315, test_f1: 0.3837
 epoch: 88, train_loss: 1.1131, test_loss: 1.1312, test_f1: 0.3774
 epoch: 89, train_loss: 1.1210, test_loss: 1.1288, test_f1: 0.3805
 epoch: 90, train_loss: 1.1228, test_loss: 1.1274, test_f1: 0.3822
 epoch: 91, train_loss: 1.1234, test_loss: 1.1280, test_f1: 0.3789
 epoch: 92, train_loss: 1.1139, test_loss: 1.1303, test_f1: 0.3818
 epoch: 93, train_loss: 1.1162, test_loss: 1.1275, test_f1: 0.3857
 epoch: 94, train_loss: 1.1118, test_loss: 1.1265, test_f1: 0.3943
 epoch: 95, train_loss: 1.1159, test_loss: 1.1297, test_f1: 0.3978
 epoch: 96, train_loss: 1.1145, test_loss: 1.1325, test_f1: 0.3982
 epoch: 97, train_loss: 1.1102, test_loss: 1.1294, test_f1: 0.3878
 epoch: 98, train_loss: 1.1199, test_loss: 1.1264, test_f1: 0.3905
 epoch: 99, train_loss: 1.1081, test_loss: 1.1259, test_f1: 0.3961
##################ITERATION #4 ****************************************
 epoch: 0, train_loss: 1.3143, test_loss: 1.3580, test_f1: 0.2274
 epoch: 1, train_loss: 1.3023, test_loss: 1.3399, test_f1: 0.2274
 epoch: 2, train_loss: 1.2953, test_loss: 1.3222, test_f1: 0.2274
 epoch: 3, train_loss: 1.2884, test_loss: 1.3023, test_f1: 0.2276
 epoch: 4, train_loss: 1.2802, test_loss: 1.2831, test_f1: 0.2459
 epoch: 5, train_loss: 1.2731, test_loss: 1.2668, test_f1: 0.2773
 epoch: 6, train_loss: 1.2703, test_loss: 1.2588, test_f1: 0.2945
 epoch: 7, train_loss: 1.2602, test_loss: 1.2538, test_f1: 0.3045
 epoch: 8, train_loss: 1.2574, test_loss: 1.2473, test_f1: 0.3038
 epoch: 9, train_loss: 1.2509, test_loss: 1.2420, test_f1: 0.3063
 epoch: 10, train_loss: 1.2491, test_loss: 1.2370, test_f1: 0.3188
 epoch: 11, train_loss: 1.2470, test_loss: 1.2341, test_f1: 0.3210
 epoch: 12, train_loss: 1.2385, test_loss: 1.2287, test_f1: 0.3220
 epoch: 13, train_loss: 1.2329, test_loss: 1.2242, test_f1: 0.3212
 epoch: 14, train_loss: 1.2262, test_loss: 1.2181, test_f1: 0.3212
 epoch: 15, train_loss: 1.2266, test_loss: 1.2141, test_f1: 0.3166
 epoch: 16, train_loss: 1.2272, test_loss: 1.2107, test_f1: 0.3259
 epoch: 17, train_loss: 1.2208, test_loss: 1.2072, test_f1: 0.3331
 epoch: 18, train_loss: 1.2154, test_loss: 1.2057, test_f1: 0.3382
 epoch: 19, train_loss: 1.2171, test_loss: 1.2033, test_f1: 0.3366
 epoch: 20, train_loss: 1.2120, test_loss: 1.1990, test_f1: 0.3406
 epoch: 21, train_loss: 1.2094, test_loss: 1.1962, test_f1: 0.3434
 epoch: 22, train_loss: 1.2019, test_loss: 1.1938, test_f1: 0.3361
 epoch: 23, train_loss: 1.2072, test_loss: 1.1929, test_f1: 0.3375
 epoch: 24, train_loss: 1.1972, test_loss: 1.1921, test_f1: 0.3375
 epoch: 25, train_loss: 1.2005, test_loss: 1.1901, test_f1: 0.3352
 epoch: 26, train_loss: 1.1931, test_loss: 1.1860, test_f1: 0.3369
 epoch: 27, train_loss: 1.1883, test_loss: 1.1822, test_f1: 0.3374
 epoch: 28, train_loss: 1.1884, test_loss: 1.1818, test_f1: 0.3333
 epoch: 29, train_loss: 1.1893, test_loss: 1.1812, test_f1: 0.3372
 epoch: 30, train_loss: 1.1835, test_loss: 1.1809, test_f1: 0.3419
 epoch: 31, train_loss: 1.1807, test_loss: 1.1783, test_f1: 0.3380
 epoch: 32, train_loss: 1.1710, test_loss: 1.1779, test_f1: 0.3457
 epoch: 33, train_loss: 1.1742, test_loss: 1.1746, test_f1: 0.3441
 epoch: 34, train_loss: 1.1730, test_loss: 1.1740, test_f1: 0.3477
 epoch: 35, train_loss: 1.1722, test_loss: 1.1715, test_f1: 0.3468
 epoch: 36, train_loss: 1.1618, test_loss: 1.1673, test_f1: 0.3453
 epoch: 37, train_loss: 1.1629, test_loss: 1.1669, test_f1: 0.3448
 epoch: 38, train_loss: 1.1600, test_loss: 1.1661, test_f1: 0.3521
 epoch: 39, train_loss: 1.1546, test_loss: 1.1648, test_f1: 0.3468
 epoch: 40, train_loss: 1.1566, test_loss: 1.1666, test_f1: 0.3502
 epoch: 41, train_loss: 1.1463, test_loss: 1.1644, test_f1: 0.3484
 epoch: 42, train_loss: 1.1512, test_loss: 1.1635, test_f1: 0.3476
 epoch: 43, train_loss: 1.1430, test_loss: 1.1625, test_f1: 0.3538
 epoch: 44, train_loss: 1.1395, test_loss: 1.1605, test_f1: 0.3612
 epoch: 45, train_loss: 1.1382, test_loss: 1.1598, test_f1: 0.3586
 epoch: 46, train_loss: 1.1324, test_loss: 1.1628, test_f1: 0.3598
 epoch: 47, train_loss: 1.1368, test_loss: 1.1623, test_f1: 0.3584
 epoch: 48, train_loss: 1.1337, test_loss: 1.1605, test_f1: 0.3819
 epoch: 49, train_loss: 1.1238, test_loss: 1.1574, test_f1: 0.3984
 epoch: 50, train_loss: 1.1263, test_loss: 1.1572, test_f1: 0.4075
 epoch: 51, train_loss: 1.1180, test_loss: 1.1569, test_f1: 0.4235
 epoch: 52, train_loss: 1.1182, test_loss: 1.1568, test_f1: 0.4277
 epoch: 53, train_loss: 1.1196, test_loss: 1.1566, test_f1: 0.4273
 epoch: 54, train_loss: 1.1216, test_loss: 1.1552, test_f1: 0.4275
 epoch: 55, train_loss: 1.1188, test_loss: 1.1566, test_f1: 0.4283
 epoch: 56, train_loss: 1.1237, test_loss: 1.1599, test_f1: 0.4287
 epoch: 57, train_loss: 1.1127, test_loss: 1.1562, test_f1: 0.4337
 epoch: 58, train_loss: 1.1157, test_loss: 1.1601, test_f1: 0.4347
 epoch: 59, train_loss: 1.1109, test_loss: 1.1555, test_f1: 0.4297
 epoch: 60, train_loss: 1.1139, test_loss: 1.1560, test_f1: 0.4397
 epoch: 61, train_loss: 1.1106, test_loss: 1.1553, test_f1: 0.4463
 epoch: 62, train_loss: 1.1062, test_loss: 1.1552, test_f1: 0.4433
 epoch: 63, train_loss: 1.1091, test_loss: 1.1538, test_f1: 0.4477
 epoch: 64, train_loss: 1.1174, test_loss: 1.1488, test_f1: 0.4473
 epoch: 65, train_loss: 1.1072, test_loss: 1.1506, test_f1: 0.4416
 epoch: 66, train_loss: 1.1102, test_loss: 1.1542, test_f1: 0.4515
 epoch: 67, train_loss: 1.1043, test_loss: 1.1570, test_f1: 0.4548
 epoch: 68, train_loss: 1.1039, test_loss: 1.1566, test_f1: 0.4567
 epoch: 69, train_loss: 1.1010, test_loss: 1.1580, test_f1: 0.4563
 epoch: 70, train_loss: 1.1035, test_loss: 1.1559, test_f1: 0.4540
 epoch: 71, train_loss: 1.0979, test_loss: 1.1515, test_f1: 0.4579
 epoch: 72, train_loss: 1.0961, test_loss: 1.1574, test_f1: 0.4648
 epoch: 73, train_loss: 1.0947, test_loss: 1.1543, test_f1: 0.4587
 epoch: 74, train_loss: 1.0939, test_loss: 1.1587, test_f1: 0.4570
 epoch: 75, train_loss: 1.0937, test_loss: 1.1584, test_f1: 0.4538
 epoch: 76, train_loss: 1.0923, test_loss: 1.1547, test_f1: 0.4620
 epoch: 77, train_loss: 1.0960, test_loss: 1.1528, test_f1: 0.4585
 epoch: 78, train_loss: 1.0866, test_loss: 1.1531, test_f1: 0.4675
 epoch: 79, train_loss: 1.0900, test_loss: 1.1529, test_f1: 0.4617
 epoch: 80, train_loss: 1.0968, test_loss: 1.1504, test_f1: 0.4711
 epoch: 81, train_loss: 1.0907, test_loss: 1.1589, test_f1: 0.4721
 epoch: 82, train_loss: 1.0898, test_loss: 1.1548, test_f1: 0.4696
 epoch: 83, train_loss: 1.0900, test_loss: 1.1516, test_f1: 0.4702
 epoch: 84, train_loss: 1.0871, test_loss: 1.1539, test_f1: 0.4675
 epoch: 85, train_loss: 1.0845, test_loss: 1.1617, test_f1: 0.4730
 epoch: 86, train_loss: 1.0731, test_loss: 1.1539, test_f1: 0.4782
 epoch: 87, train_loss: 1.0784, test_loss: 1.1517, test_f1: 0.4682
 epoch: 88, train_loss: 1.0787, test_loss: 1.1487, test_f1: 0.4727
 epoch: 89, train_loss: 1.0801, test_loss: 1.1546, test_f1: 0.4708
 epoch: 90, train_loss: 1.0781, test_loss: 1.1475, test_f1: 0.4751
 epoch: 91, train_loss: 1.0760, test_loss: 1.1520, test_f1: 0.4742
 epoch: 92, train_loss: 1.0774, test_loss: 1.1565, test_f1: 0.4815
 epoch: 93, train_loss: 1.0744, test_loss: 1.1546, test_f1: 0.4711
 epoch: 94, train_loss: 1.0713, test_loss: 1.1543, test_f1: 0.4737
 epoch: 95, train_loss: 1.0762, test_loss: 1.1540, test_f1: 0.4691
 epoch: 96, train_loss: 1.0723, test_loss: 1.1510, test_f1: 0.4770
 epoch: 97, train_loss: 1.0619, test_loss: 1.1512, test_f1: 0.4723
 epoch: 98, train_loss: 1.0683, test_loss: 1.1474, test_f1: 0.4692
 epoch: 99, train_loss: 1.0696, test_loss: 1.1529, test_f1: 0.4776
##################ITERATION #5 ****************************************
 epoch: 0, train_loss: 1.3093, test_loss: 1.3325, test_f1: 0.2274
 epoch: 1, train_loss: 1.2928, test_loss: 1.3237, test_f1: 0.2274
 epoch: 2, train_loss: 1.2853, test_loss: 1.3107, test_f1: 0.2274
 epoch: 3, train_loss: 1.2776, test_loss: 1.2907, test_f1: 0.2274
 epoch: 4, train_loss: 1.2724, test_loss: 1.2695, test_f1: 0.2602
 epoch: 5, train_loss: 1.2651, test_loss: 1.2555, test_f1: 0.2836
 epoch: 6, train_loss: 1.2576, test_loss: 1.2442, test_f1: 0.2922
 epoch: 7, train_loss: 1.2564, test_loss: 1.2354, test_f1: 0.3048
 epoch: 8, train_loss: 1.2526, test_loss: 1.2294, test_f1: 0.3142
 epoch: 9, train_loss: 1.2449, test_loss: 1.2245, test_f1: 0.3149
 epoch: 10, train_loss: 1.2398, test_loss: 1.2164, test_f1: 0.3238
 epoch: 11, train_loss: 1.2297, test_loss: 1.2117, test_f1: 0.3238
 epoch: 12, train_loss: 1.2284, test_loss: 1.2062, test_f1: 0.3244
 epoch: 13, train_loss: 1.2265, test_loss: 1.1990, test_f1: 0.3328
 epoch: 14, train_loss: 1.2232, test_loss: 1.1971, test_f1: 0.3382
 epoch: 15, train_loss: 1.2141, test_loss: 1.1958, test_f1: 0.3370
 epoch: 16, train_loss: 1.2112, test_loss: 1.1900, test_f1: 0.3447
 epoch: 17, train_loss: 1.2090, test_loss: 1.1878, test_f1: 0.3526
 epoch: 18, train_loss: 1.2032, test_loss: 1.1836, test_f1: 0.3501
 epoch: 19, train_loss: 1.2020, test_loss: 1.1795, test_f1: 0.3515
 epoch: 20, train_loss: 1.2039, test_loss: 1.1755, test_f1: 0.3477
 epoch: 21, train_loss: 1.2013, test_loss: 1.1718, test_f1: 0.3444
 epoch: 22, train_loss: 1.1914, test_loss: 1.1689, test_f1: 0.3527
 epoch: 23, train_loss: 1.1847, test_loss: 1.1672, test_f1: 0.3562
 epoch: 24, train_loss: 1.1824, test_loss: 1.1660, test_f1: 0.3554
 epoch: 25, train_loss: 1.1867, test_loss: 1.1613, test_f1: 0.3469
 epoch: 26, train_loss: 1.1811, test_loss: 1.1584, test_f1: 0.3532
 epoch: 27, train_loss: 1.1812, test_loss: 1.1568, test_f1: 0.3496
 epoch: 28, train_loss: 1.1742, test_loss: 1.1548, test_f1: 0.3504
 epoch: 29, train_loss: 1.1782, test_loss: 1.1521, test_f1: 0.3566
 epoch: 30, train_loss: 1.1722, test_loss: 1.1504, test_f1: 0.3530
 epoch: 31, train_loss: 1.1778, test_loss: 1.1483, test_f1: 0.3516
 epoch: 32, train_loss: 1.1667, test_loss: 1.1466, test_f1: 0.3560
 epoch: 33, train_loss: 1.1701, test_loss: 1.1431, test_f1: 0.3595
 epoch: 34, train_loss: 1.1634, test_loss: 1.1407, test_f1: 0.3535
 epoch: 35, train_loss: 1.1626, test_loss: 1.1393, test_f1: 0.3475
 epoch: 36, train_loss: 1.1569, test_loss: 1.1400, test_f1: 0.3536
 epoch: 37, train_loss: 1.1573, test_loss: 1.1351, test_f1: 0.3535
 epoch: 38, train_loss: 1.1634, test_loss: 1.1337, test_f1: 0.3453
 epoch: 39, train_loss: 1.1543, test_loss: 1.1319, test_f1: 0.3575
 epoch: 40, train_loss: 1.1447, test_loss: 1.1295, test_f1: 0.3502
 epoch: 41, train_loss: 1.1528, test_loss: 1.1293, test_f1: 0.3535
 epoch: 42, train_loss: 1.1473, test_loss: 1.1288, test_f1: 0.3480
 epoch: 43, train_loss: 1.1459, test_loss: 1.1233, test_f1: 0.3560
 epoch: 44, train_loss: 1.1447, test_loss: 1.1210, test_f1: 0.3517
 epoch: 45, train_loss: 1.1438, test_loss: 1.1205, test_f1: 0.3481
 epoch: 46, train_loss: 1.1356, test_loss: 1.1182, test_f1: 0.3400
 epoch: 47, train_loss: 1.1424, test_loss: 1.1178, test_f1: 0.3609
 epoch: 48, train_loss: 1.1337, test_loss: 1.1178, test_f1: 0.3522
 epoch: 49, train_loss: 1.1356, test_loss: 1.1151, test_f1: 0.3595
 epoch: 50, train_loss: 1.1356, test_loss: 1.1105, test_f1: 0.3584
 epoch: 51, train_loss: 1.1279, test_loss: 1.1120, test_f1: 0.3585
 epoch: 52, train_loss: 1.1240, test_loss: 1.1110, test_f1: 0.3605
 epoch: 53, train_loss: 1.1284, test_loss: 1.1121, test_f1: 0.3649
 epoch: 54, train_loss: 1.1313, test_loss: 1.1115, test_f1: 0.3656
 epoch: 55, train_loss: 1.1242, test_loss: 1.1111, test_f1: 0.3589
 epoch: 56, train_loss: 1.1168, test_loss: 1.1096, test_f1: 0.3650
 epoch: 57, train_loss: 1.1279, test_loss: 1.1103, test_f1: 0.3657
 epoch: 58, train_loss: 1.1247, test_loss: 1.1106, test_f1: 0.3739
 epoch: 59, train_loss: 1.1185, test_loss: 1.1087, test_f1: 0.3702
 epoch: 60, train_loss: 1.1195, test_loss: 1.1085, test_f1: 0.3789
 epoch: 61, train_loss: 1.1165, test_loss: 1.1076, test_f1: 0.3767
 epoch: 62, train_loss: 1.1169, test_loss: 1.1075, test_f1: 0.3840
 epoch: 63, train_loss: 1.1222, test_loss: 1.1081, test_f1: 0.3829
 epoch: 64, train_loss: 1.1178, test_loss: 1.1082, test_f1: 0.3791
 epoch: 65, train_loss: 1.1067, test_loss: 1.1081, test_f1: 0.3818
 epoch: 66, train_loss: 1.1133, test_loss: 1.1081, test_f1: 0.3846
 epoch: 67, train_loss: 1.1171, test_loss: 1.1073, test_f1: 0.3926
 epoch: 68, train_loss: 1.1133, test_loss: 1.1066, test_f1: 0.3813
 epoch: 69, train_loss: 1.1069, test_loss: 1.1074, test_f1: 0.3937
 epoch: 70, train_loss: 1.1077, test_loss: 1.1040, test_f1: 0.3948
 epoch: 71, train_loss: 1.1060, test_loss: 1.1022, test_f1: 0.4039
 epoch: 72, train_loss: 1.1106, test_loss: 1.1016, test_f1: 0.3979
 epoch: 73, train_loss: 1.1057, test_loss: 1.1026, test_f1: 0.3875
 epoch: 74, train_loss: 1.1137, test_loss: 1.1028, test_f1: 0.3918
 epoch: 75, train_loss: 1.1057, test_loss: 1.1026, test_f1: 0.3921
 epoch: 76, train_loss: 1.1074, test_loss: 1.1019, test_f1: 0.4028
 epoch: 77, train_loss: 1.1015, test_loss: 1.0987, test_f1: 0.4088
 epoch: 78, train_loss: 1.1002, test_loss: 1.0988, test_f1: 0.4017
 epoch: 79, train_loss: 1.1018, test_loss: 1.0969, test_f1: 0.4029
 epoch: 80, train_loss: 1.0989, test_loss: 1.0987, test_f1: 0.3985
 epoch: 81, train_loss: 1.0999, test_loss: 1.0987, test_f1: 0.4041
 epoch: 82, train_loss: 1.0974, test_loss: 1.0970, test_f1: 0.3984
 epoch: 83, train_loss: 1.1004, test_loss: 1.0952, test_f1: 0.3973
 epoch: 84, train_loss: 1.0966, test_loss: 1.0956, test_f1: 0.4043
 epoch: 85, train_loss: 1.0911, test_loss: 1.0956, test_f1: 0.4094
 epoch: 86, train_loss: 1.0933, test_loss: 1.0953, test_f1: 0.4015
 epoch: 87, train_loss: 1.0978, test_loss: 1.0951, test_f1: 0.4026
 epoch: 88, train_loss: 1.0996, test_loss: 1.0954, test_f1: 0.4128
 epoch: 89, train_loss: 1.0885, test_loss: 1.0938, test_f1: 0.4142
 epoch: 90, train_loss: 1.0894, test_loss: 1.0929, test_f1: 0.4175
 epoch: 91, train_loss: 1.0903, test_loss: 1.0944, test_f1: 0.4087
 epoch: 92, train_loss: 1.0899, test_loss: 1.0941, test_f1: 0.4134
 epoch: 93, train_loss: 1.0846, test_loss: 1.0938, test_f1: 0.4146
 epoch: 94, train_loss: 1.0815, test_loss: 1.0929, test_f1: 0.4136
 epoch: 95, train_loss: 1.0911, test_loss: 1.0906, test_f1: 0.4093
 epoch: 96, train_loss: 1.0904, test_loss: 1.0906, test_f1: 0.4186
 epoch: 97, train_loss: 1.0804, test_loss: 1.0910, test_f1: 0.4134
 epoch: 98, train_loss: 1.0895, test_loss: 1.0915, test_f1: 0.4131
 epoch: 99, train_loss: 1.0836, test_loss: 1.0941, test_f1: 0.4112
##################ITERATION #6 ****************************************
 epoch: 0, train_loss: 1.3425, test_loss: 1.3677, test_f1: 0.2274
 epoch: 1, train_loss: 1.3214, test_loss: 1.3504, test_f1: 0.2274
 epoch: 2, train_loss: 1.3137, test_loss: 1.3370, test_f1: 0.2274
 epoch: 3, train_loss: 1.3069, test_loss: 1.3340, test_f1: 0.2274
 epoch: 4, train_loss: 1.2960, test_loss: 1.3141, test_f1: 0.2274
 epoch: 5, train_loss: 1.2881, test_loss: 1.2982, test_f1: 0.2387
 epoch: 6, train_loss: 1.2798, test_loss: 1.2811, test_f1: 0.2714
 epoch: 7, train_loss: 1.2750, test_loss: 1.2715, test_f1: 0.2774
 epoch: 8, train_loss: 1.2671, test_loss: 1.2624, test_f1: 0.2880
 epoch: 9, train_loss: 1.2597, test_loss: 1.2538, test_f1: 0.3008
 epoch: 10, train_loss: 1.2584, test_loss: 1.2477, test_f1: 0.3026
 epoch: 11, train_loss: 1.2542, test_loss: 1.2429, test_f1: 0.3068
 epoch: 12, train_loss: 1.2491, test_loss: 1.2371, test_f1: 0.3099
 epoch: 13, train_loss: 1.2418, test_loss: 1.2332, test_f1: 0.3273
 epoch: 14, train_loss: 1.2414, test_loss: 1.2281, test_f1: 0.3262
 epoch: 15, train_loss: 1.2370, test_loss: 1.2255, test_f1: 0.3468
 epoch: 16, train_loss: 1.2296, test_loss: 1.2211, test_f1: 0.3483
 epoch: 17, train_loss: 1.2267, test_loss: 1.2189, test_f1: 0.3423
 epoch: 18, train_loss: 1.2160, test_loss: 1.2129, test_f1: 0.3499
 epoch: 19, train_loss: 1.2196, test_loss: 1.2083, test_f1: 0.3693
 epoch: 20, train_loss: 1.2191, test_loss: 1.2055, test_f1: 0.3696
 epoch: 21, train_loss: 1.2121, test_loss: 1.2029, test_f1: 0.3667
 epoch: 22, train_loss: 1.2034, test_loss: 1.2009, test_f1: 0.3681
 epoch: 23, train_loss: 1.2088, test_loss: 1.1984, test_f1: 0.3542
 epoch: 24, train_loss: 1.2005, test_loss: 1.1960, test_f1: 0.3725
 epoch: 25, train_loss: 1.1948, test_loss: 1.1939, test_f1: 0.3726
 epoch: 26, train_loss: 1.1983, test_loss: 1.1910, test_f1: 0.3681
 epoch: 27, train_loss: 1.1902, test_loss: 1.1882, test_f1: 0.3576
 epoch: 28, train_loss: 1.1914, test_loss: 1.1864, test_f1: 0.3705
 epoch: 29, train_loss: 1.1923, test_loss: 1.1853, test_f1: 0.3703
 epoch: 30, train_loss: 1.1851, test_loss: 1.1826, test_f1: 0.3511
 epoch: 31, train_loss: 1.1805, test_loss: 1.1797, test_f1: 0.3607
 epoch: 32, train_loss: 1.1828, test_loss: 1.1785, test_f1: 0.3693
 epoch: 33, train_loss: 1.1801, test_loss: 1.1809, test_f1: 0.3715
 epoch: 34, train_loss: 1.1758, test_loss: 1.1774, test_f1: 0.3718
 epoch: 35, train_loss: 1.1760, test_loss: 1.1750, test_f1: 0.3676
 epoch: 36, train_loss: 1.1663, test_loss: 1.1734, test_f1: 0.3727
 epoch: 37, train_loss: 1.1692, test_loss: 1.1735, test_f1: 0.3640
 epoch: 38, train_loss: 1.1717, test_loss: 1.1721, test_f1: 0.3784
 epoch: 39, train_loss: 1.1683, test_loss: 1.1715, test_f1: 0.3767
 epoch: 40, train_loss: 1.1664, test_loss: 1.1705, test_f1: 0.3720
 epoch: 41, train_loss: 1.1595, test_loss: 1.1695, test_f1: 0.3704
 epoch: 42, train_loss: 1.1559, test_loss: 1.1667, test_f1: 0.3878
 epoch: 43, train_loss: 1.1537, test_loss: 1.1649, test_f1: 0.3803
 epoch: 44, train_loss: 1.1523, test_loss: 1.1721, test_f1: 0.3760
 epoch: 45, train_loss: 1.1532, test_loss: 1.1642, test_f1: 0.3741
 epoch: 46, train_loss: 1.1559, test_loss: 1.1657, test_f1: 0.3942
 epoch: 47, train_loss: 1.1500, test_loss: 1.1673, test_f1: 0.4257
 epoch: 48, train_loss: 1.1371, test_loss: 1.1684, test_f1: 0.4270
 epoch: 49, train_loss: 1.1412, test_loss: 1.1643, test_f1: 0.4070
 epoch: 50, train_loss: 1.1353, test_loss: 1.1669, test_f1: 0.4261
 epoch: 51, train_loss: 1.1400, test_loss: 1.1657, test_f1: 0.4313
 epoch: 52, train_loss: 1.1346, test_loss: 1.1694, test_f1: 0.4363
 epoch: 53, train_loss: 1.1375, test_loss: 1.1688, test_f1: 0.4299
 epoch: 54, train_loss: 1.1405, test_loss: 1.1700, test_f1: 0.4364
 epoch: 55, train_loss: 1.1301, test_loss: 1.1722, test_f1: 0.4283
 epoch: 56, train_loss: 1.1262, test_loss: 1.1729, test_f1: 0.4339
 epoch: 57, train_loss: 1.1277, test_loss: 1.1701, test_f1: 0.4477
 epoch: 58, train_loss: 1.1314, test_loss: 1.1691, test_f1: 0.4512
 epoch: 59, train_loss: 1.1284, test_loss: 1.1703, test_f1: 0.4511
 epoch: 60, train_loss: 1.1239, test_loss: 1.1723, test_f1: 0.4521
 epoch: 61, train_loss: 1.1262, test_loss: 1.1694, test_f1: 0.4393
 epoch: 62, train_loss: 1.1306, test_loss: 1.1732, test_f1: 0.4227
 epoch: 63, train_loss: 1.1210, test_loss: 1.1752, test_f1: 0.4306
 epoch: 64, train_loss: 1.1217, test_loss: 1.1721, test_f1: 0.4520
 epoch: 65, train_loss: 1.1144, test_loss: 1.1754, test_f1: 0.4440
 epoch: 66, train_loss: 1.1250, test_loss: 1.1738, test_f1: 0.4529
 epoch: 67, train_loss: 1.1220, test_loss: 1.1733, test_f1: 0.4541
 epoch: 68, train_loss: 1.1212, test_loss: 1.1755, test_f1: 0.4534
 epoch: 69, train_loss: 1.1174, test_loss: 1.1741, test_f1: 0.4507
 epoch: 70, train_loss: 1.1244, test_loss: 1.1808, test_f1: 0.4447
 epoch: 71, train_loss: 1.1169, test_loss: 1.1804, test_f1: 0.4439
 epoch: 72, train_loss: 1.1153, test_loss: 1.1767, test_f1: 0.4389
 epoch: 73, train_loss: 1.1045, test_loss: 1.1811, test_f1: 0.4385
 epoch: 74, train_loss: 1.1055, test_loss: 1.1796, test_f1: 0.4385
 epoch: 75, train_loss: 1.1091, test_loss: 1.1794, test_f1: 0.4367
 epoch: 76, train_loss: 1.0998, test_loss: 1.1824, test_f1: 0.4410
 epoch: 77, train_loss: 1.1085, test_loss: 1.1828, test_f1: 0.4520
 epoch: 78, train_loss: 1.1102, test_loss: 1.1820, test_f1: 0.4428
 epoch: 79, train_loss: 1.1100, test_loss: 1.1824, test_f1: 0.4437
 epoch: 80, train_loss: 1.1027, test_loss: 1.1776, test_f1: 0.4378
 epoch: 81, train_loss: 1.0983, test_loss: 1.1793, test_f1: 0.4388
 epoch: 82, train_loss: 1.1036, test_loss: 1.1852, test_f1: 0.4444
 epoch: 83, train_loss: 1.1077, test_loss: 1.1803, test_f1: 0.4517
 epoch: 84, train_loss: 1.1040, test_loss: 1.1828, test_f1: 0.4531
 epoch: 85, train_loss: 1.1014, test_loss: 1.1834, test_f1: 0.4433
 epoch: 86, train_loss: 1.0987, test_loss: 1.1798, test_f1: 0.4440
 epoch: 87, train_loss: 1.1005, test_loss: 1.1835, test_f1: 0.4461
 epoch: 88, train_loss: 1.1027, test_loss: 1.1881, test_f1: 0.4432
 epoch: 89, train_loss: 1.1027, test_loss: 1.1857, test_f1: 0.4474
 epoch: 90, train_loss: 1.0942, test_loss: 1.1863, test_f1: 0.4409
 epoch: 91, train_loss: 1.1013, test_loss: 1.1850, test_f1: 0.4389
 epoch: 92, train_loss: 1.0894, test_loss: 1.1871, test_f1: 0.4416
 epoch: 93, train_loss: 1.0932, test_loss: 1.1850, test_f1: 0.4423
 epoch: 94, train_loss: 1.0886, test_loss: 1.1863, test_f1: 0.4552
 epoch: 95, train_loss: 1.0929, test_loss: 1.1830, test_f1: 0.4397
 epoch: 96, train_loss: 1.0985, test_loss: 1.1780, test_f1: 0.4380
 epoch: 97, train_loss: 1.0949, test_loss: 1.1857, test_f1: 0.4323
 epoch: 98, train_loss: 1.0897, test_loss: 1.1910, test_f1: 0.4279
 epoch: 99, train_loss: 1.0850, test_loss: 1.1875, test_f1: 0.4343
##################ITERATION #7 ****************************************
 epoch: 0, train_loss: 1.3264, test_loss: 1.3551, test_f1: 0.2274
 epoch: 1, train_loss: 1.3041, test_loss: 1.3415, test_f1: 0.2274
 epoch: 2, train_loss: 1.2992, test_loss: 1.3246, test_f1: 0.2276
 epoch: 3, train_loss: 1.2888, test_loss: 1.2995, test_f1: 0.2384
 epoch: 4, train_loss: 1.2781, test_loss: 1.2809, test_f1: 0.2550
 epoch: 5, train_loss: 1.2722, test_loss: 1.2698, test_f1: 0.2587
 epoch: 6, train_loss: 1.2619, test_loss: 1.2610, test_f1: 0.2822
 epoch: 7, train_loss: 1.2555, test_loss: 1.2509, test_f1: 0.2873
 epoch: 8, train_loss: 1.2522, test_loss: 1.2423, test_f1: 0.2790
 epoch: 9, train_loss: 1.2378, test_loss: 1.2351, test_f1: 0.2925
 epoch: 10, train_loss: 1.2442, test_loss: 1.2299, test_f1: 0.2868
 epoch: 11, train_loss: 1.2351, test_loss: 1.2238, test_f1: 0.2988
 epoch: 12, train_loss: 1.2350, test_loss: 1.2182, test_f1: 0.3149
 epoch: 13, train_loss: 1.2309, test_loss: 1.2141, test_f1: 0.3218
 epoch: 14, train_loss: 1.2197, test_loss: 1.2091, test_f1: 0.3320
 epoch: 15, train_loss: 1.2181, test_loss: 1.2037, test_f1: 0.3431
 epoch: 16, train_loss: 1.2121, test_loss: 1.1989, test_f1: 0.3472
 epoch: 17, train_loss: 1.2130, test_loss: 1.1950, test_f1: 0.3507
 epoch: 18, train_loss: 1.2068, test_loss: 1.1912, test_f1: 0.3482
 epoch: 19, train_loss: 1.2017, test_loss: 1.1859, test_f1: 0.3566
 epoch: 20, train_loss: 1.2054, test_loss: 1.1849, test_f1: 0.3502
 epoch: 21, train_loss: 1.1956, test_loss: 1.1829, test_f1: 0.3617
 epoch: 22, train_loss: 1.1887, test_loss: 1.1784, test_f1: 0.3577
 epoch: 23, train_loss: 1.1924, test_loss: 1.1759, test_f1: 0.3624
 epoch: 24, train_loss: 1.1885, test_loss: 1.1761, test_f1: 0.3580
 epoch: 25, train_loss: 1.1854, test_loss: 1.1719, test_f1: 0.3578
 epoch: 26, train_loss: 1.1889, test_loss: 1.1692, test_f1: 0.3659
 epoch: 27, train_loss: 1.1825, test_loss: 1.1663, test_f1: 0.3618
 epoch: 28, train_loss: 1.1800, test_loss: 1.1665, test_f1: 0.3619
 epoch: 29, train_loss: 1.1759, test_loss: 1.1627, test_f1: 0.3672
 epoch: 30, train_loss: 1.1714, test_loss: 1.1608, test_f1: 0.3718
 epoch: 31, train_loss: 1.1697, test_loss: 1.1592, test_f1: 0.3712
 epoch: 32, train_loss: 1.1706, test_loss: 1.1577, test_f1: 0.3758
 epoch: 33, train_loss: 1.1656, test_loss: 1.1572, test_f1: 0.3832
 epoch: 34, train_loss: 1.1645, test_loss: 1.1549, test_f1: 0.3833
 epoch: 35, train_loss: 1.1677, test_loss: 1.1534, test_f1: 0.3676
 epoch: 36, train_loss: 1.1607, test_loss: 1.1524, test_f1: 0.3834
 epoch: 37, train_loss: 1.1553, test_loss: 1.1508, test_f1: 0.3857
 epoch: 38, train_loss: 1.1636, test_loss: 1.1487, test_f1: 0.3701
 epoch: 39, train_loss: 1.1535, test_loss: 1.1476, test_f1: 0.3714
 epoch: 40, train_loss: 1.1466, test_loss: 1.1482, test_f1: 0.3657
 epoch: 41, train_loss: 1.1536, test_loss: 1.1440, test_f1: 0.3717
 epoch: 42, train_loss: 1.1469, test_loss: 1.1413, test_f1: 0.3621
 epoch: 43, train_loss: 1.1563, test_loss: 1.1443, test_f1: 0.3633
 epoch: 44, train_loss: 1.1539, test_loss: 1.1406, test_f1: 0.3660
 epoch: 45, train_loss: 1.1451, test_loss: 1.1415, test_f1: 0.3611
 epoch: 46, train_loss: 1.1372, test_loss: 1.1408, test_f1: 0.3619
 epoch: 47, train_loss: 1.1373, test_loss: 1.1409, test_f1: 0.3724
 epoch: 48, train_loss: 1.1381, test_loss: 1.1415, test_f1: 0.3751
 epoch: 49, train_loss: 1.1301, test_loss: 1.1402, test_f1: 0.3670
 epoch: 50, train_loss: 1.1277, test_loss: 1.1344, test_f1: 0.3680
 epoch: 51, train_loss: 1.1336, test_loss: 1.1357, test_f1: 0.3685
 epoch: 52, train_loss: 1.1291, test_loss: 1.1354, test_f1: 0.3692
 epoch: 53, train_loss: 1.1294, test_loss: 1.1346, test_f1: 0.3768
 epoch: 54, train_loss: 1.1298, test_loss: 1.1336, test_f1: 0.3723
 epoch: 55, train_loss: 1.1230, test_loss: 1.1326, test_f1: 0.3754
 epoch: 56, train_loss: 1.1285, test_loss: 1.1327, test_f1: 0.3675
 epoch: 57, train_loss: 1.1295, test_loss: 1.1340, test_f1: 0.3742
 epoch: 58, train_loss: 1.1242, test_loss: 1.1320, test_f1: 0.3752
 epoch: 59, train_loss: 1.1198, test_loss: 1.1354, test_f1: 0.3804
 epoch: 60, train_loss: 1.1222, test_loss: 1.1328, test_f1: 0.3836
 epoch: 61, train_loss: 1.1274, test_loss: 1.1309, test_f1: 0.3908
 epoch: 62, train_loss: 1.1234, test_loss: 1.1341, test_f1: 0.3967
 epoch: 63, train_loss: 1.1215, test_loss: 1.1304, test_f1: 0.3943
 epoch: 64, train_loss: 1.1214, test_loss: 1.1307, test_f1: 0.4078
 epoch: 65, train_loss: 1.1103, test_loss: 1.1325, test_f1: 0.4092
 epoch: 66, train_loss: 1.1156, test_loss: 1.1315, test_f1: 0.4061
 epoch: 67, train_loss: 1.1178, test_loss: 1.1264, test_f1: 0.4100
 epoch: 68, train_loss: 1.1189, test_loss: 1.1322, test_f1: 0.4219
 epoch: 69, train_loss: 1.1086, test_loss: 1.1287, test_f1: 0.4344
 epoch: 70, train_loss: 1.1089, test_loss: 1.1303, test_f1: 0.4326
 epoch: 71, train_loss: 1.1102, test_loss: 1.1297, test_f1: 0.4358
 epoch: 72, train_loss: 1.1048, test_loss: 1.1277, test_f1: 0.4411
 epoch: 73, train_loss: 1.1091, test_loss: 1.1276, test_f1: 0.4445
 epoch: 74, train_loss: 1.1036, test_loss: 1.1252, test_f1: 0.4495
 epoch: 75, train_loss: 1.1097, test_loss: 1.1248, test_f1: 0.4431
 epoch: 76, train_loss: 1.1042, test_loss: 1.1240, test_f1: 0.4458
 epoch: 77, train_loss: 1.0989, test_loss: 1.1252, test_f1: 0.4472
 epoch: 78, train_loss: 1.1005, test_loss: 1.1274, test_f1: 0.4411
 epoch: 79, train_loss: 1.1042, test_loss: 1.1251, test_f1: 0.4441
 epoch: 80, train_loss: 1.0990, test_loss: 1.1277, test_f1: 0.4492
 epoch: 81, train_loss: 1.0900, test_loss: 1.1283, test_f1: 0.4466
 epoch: 82, train_loss: 1.1002, test_loss: 1.1256, test_f1: 0.4471
 epoch: 83, train_loss: 1.1011, test_loss: 1.1251, test_f1: 0.4433
 epoch: 84, train_loss: 1.0983, test_loss: 1.1243, test_f1: 0.4477
 epoch: 85, train_loss: 1.0972, test_loss: 1.1223, test_f1: 0.4520
 epoch: 86, train_loss: 1.0986, test_loss: 1.1170, test_f1: 0.4487
 epoch: 87, train_loss: 1.0865, test_loss: 1.1197, test_f1: 0.4474
 epoch: 88, train_loss: 1.1029, test_loss: 1.1192, test_f1: 0.4457
 epoch: 89, train_loss: 1.0946, test_loss: 1.1200, test_f1: 0.4443
 epoch: 90, train_loss: 1.0980, test_loss: 1.1179, test_f1: 0.4399
 epoch: 91, train_loss: 1.0924, test_loss: 1.1197, test_f1: 0.4598
 epoch: 92, train_loss: 1.0952, test_loss: 1.1181, test_f1: 0.4464
 epoch: 93, train_loss: 1.0872, test_loss: 1.1215, test_f1: 0.4431
 epoch: 94, train_loss: 1.0885, test_loss: 1.1188, test_f1: 0.4435
 epoch: 95, train_loss: 1.0780, test_loss: 1.1197, test_f1: 0.4452
 epoch: 96, train_loss: 1.0929, test_loss: 1.1126, test_f1: 0.4452
 epoch: 97, train_loss: 1.0922, test_loss: 1.1166, test_f1: 0.4443
 epoch: 98, train_loss: 1.0906, test_loss: 1.1175, test_f1: 0.4537
 epoch: 99, train_loss: 1.0847, test_loss: 1.1209, test_f1: 0.4325
##################ITERATION #8 ****************************************
 epoch: 0, train_loss: 1.3064, test_loss: 1.3204, test_f1: 0.2274
 epoch: 1, train_loss: 1.2938, test_loss: 1.3062, test_f1: 0.2274
 epoch: 2, train_loss: 1.2867, test_loss: 1.3017, test_f1: 0.2555
 epoch: 3, train_loss: 1.2834, test_loss: 1.2904, test_f1: 0.2276
 epoch: 4, train_loss: 1.2693, test_loss: 1.2756, test_f1: 0.2274
 epoch: 5, train_loss: 1.2665, test_loss: 1.2720, test_f1: 0.2300
 epoch: 6, train_loss: 1.2636, test_loss: 1.2672, test_f1: 0.2300
 epoch: 7, train_loss: 1.2589, test_loss: 1.2588, test_f1: 0.2301
 epoch: 8, train_loss: 1.2494, test_loss: 1.2570, test_f1: 0.2535
 epoch: 9, train_loss: 1.2468, test_loss: 1.2538, test_f1: 0.2504
 epoch: 10, train_loss: 1.2457, test_loss: 1.2484, test_f1: 0.2587
 epoch: 11, train_loss: 1.2439, test_loss: 1.2417, test_f1: 0.2635
 epoch: 12, train_loss: 1.2363, test_loss: 1.2417, test_f1: 0.2657
 epoch: 13, train_loss: 1.2349, test_loss: 1.2334, test_f1: 0.2774
 epoch: 14, train_loss: 1.2299, test_loss: 1.2298, test_f1: 0.2844
 epoch: 15, train_loss: 1.2275, test_loss: 1.2285, test_f1: 0.2901
 epoch: 16, train_loss: 1.2248, test_loss: 1.2309, test_f1: 0.2919
 epoch: 17, train_loss: 1.2208, test_loss: 1.2237, test_f1: 0.2949
 epoch: 18, train_loss: 1.2193, test_loss: 1.2237, test_f1: 0.3017
 epoch: 19, train_loss: 1.2143, test_loss: 1.2215, test_f1: 0.3134
 epoch: 20, train_loss: 1.2148, test_loss: 1.2111, test_f1: 0.3225
 epoch: 21, train_loss: 1.2089, test_loss: 1.2138, test_f1: 0.3273
 epoch: 22, train_loss: 1.2096, test_loss: 1.2133, test_f1: 0.3178
 epoch: 23, train_loss: 1.2073, test_loss: 1.2095, test_f1: 0.3229
 epoch: 24, train_loss: 1.2011, test_loss: 1.2083, test_f1: 0.3158
 epoch: 25, train_loss: 1.1983, test_loss: 1.2077, test_f1: 0.3263
 epoch: 26, train_loss: 1.2003, test_loss: 1.2044, test_f1: 0.3212
 epoch: 27, train_loss: 1.1914, test_loss: 1.2072, test_f1: 0.3239
 epoch: 28, train_loss: 1.1930, test_loss: 1.2038, test_f1: 0.3311
 epoch: 29, train_loss: 1.1888, test_loss: 1.2089, test_f1: 0.3212
 epoch: 30, train_loss: 1.1914, test_loss: 1.2098, test_f1: 0.3258
 epoch: 31, train_loss: 1.1893, test_loss: 1.1991, test_f1: 0.3212
 epoch: 32, train_loss: 1.1787, test_loss: 1.1985, test_f1: 0.3206
 epoch: 33, train_loss: 1.1825, test_loss: 1.1901, test_f1: 0.3274
 epoch: 34, train_loss: 1.1771, test_loss: 1.1935, test_f1: 0.3237
 epoch: 35, train_loss: 1.1760, test_loss: 1.1910, test_f1: 0.3235
 epoch: 36, train_loss: 1.1725, test_loss: 1.1897, test_f1: 0.3251
 epoch: 37, train_loss: 1.1763, test_loss: 1.1876, test_f1: 0.3340
 epoch: 38, train_loss: 1.1732, test_loss: 1.1788, test_f1: 0.3486
 epoch: 39, train_loss: 1.1644, test_loss: 1.1808, test_f1: 0.3717
 epoch: 40, train_loss: 1.1665, test_loss: 1.1767, test_f1: 0.3799
 epoch: 41, train_loss: 1.1578, test_loss: 1.1755, test_f1: 0.3751
 epoch: 42, train_loss: 1.1570, test_loss: 1.1805, test_f1: 0.3755
 epoch: 43, train_loss: 1.1528, test_loss: 1.1848, test_f1: 0.3797
 epoch: 44, train_loss: 1.1563, test_loss: 1.1728, test_f1: 0.3842
 epoch: 45, train_loss: 1.1574, test_loss: 1.1558, test_f1: 0.3854
 epoch: 46, train_loss: 1.1476, test_loss: 1.1679, test_f1: 0.3883
 epoch: 47, train_loss: 1.1492, test_loss: 1.1775, test_f1: 0.3915
 epoch: 48, train_loss: 1.1501, test_loss: 1.1826, test_f1: 0.3870
 epoch: 49, train_loss: 1.1346, test_loss: 1.1849, test_f1: 0.3889
 epoch: 50, train_loss: 1.1359, test_loss: 1.1884, test_f1: 0.3882
 epoch: 51, train_loss: 1.1407, test_loss: 1.1849, test_f1: 0.3885
 epoch: 52, train_loss: 1.1370, test_loss: 1.1874, test_f1: 0.3858
 epoch: 53, train_loss: 1.1320, test_loss: 1.1837, test_f1: 0.3882
 epoch: 54, train_loss: 1.1311, test_loss: 1.1771, test_f1: 0.3905
 epoch: 55, train_loss: 1.1334, test_loss: 1.1904, test_f1: 0.3908
 epoch: 56, train_loss: 1.1289, test_loss: 1.1869, test_f1: 0.3820
 epoch: 57, train_loss: 1.1306, test_loss: 1.1824, test_f1: 0.3798
 epoch: 58, train_loss: 1.1254, test_loss: 1.1724, test_f1: 0.3862
 epoch: 59, train_loss: 1.1207, test_loss: 1.1827, test_f1: 0.3847
 epoch: 60, train_loss: 1.1288, test_loss: 1.1759, test_f1: 0.3877
 epoch: 61, train_loss: 1.1234, test_loss: 1.1778, test_f1: 0.3893
 epoch: 62, train_loss: 1.1246, test_loss: 1.1689, test_f1: 0.3868
 epoch: 63, train_loss: 1.1207, test_loss: 1.1804, test_f1: 0.3893
 epoch: 64, train_loss: 1.1218, test_loss: 1.1882, test_f1: 0.3893
 epoch: 65, train_loss: 1.1145, test_loss: 1.1833, test_f1: 0.3846
 epoch: 66, train_loss: 1.1171, test_loss: 1.1817, test_f1: 0.3844
 epoch: 67, train_loss: 1.1192, test_loss: 1.1799, test_f1: 0.3867
 epoch: 68, train_loss: 1.1166, test_loss: 1.1760, test_f1: 0.3879
 epoch: 69, train_loss: 1.1110, test_loss: 1.1791, test_f1: 0.3915
 epoch: 70, train_loss: 1.1153, test_loss: 1.1717, test_f1: 0.3916
 epoch: 71, train_loss: 1.1101, test_loss: 1.1768, test_f1: 0.3846
 epoch: 72, train_loss: 1.1081, test_loss: 1.1706, test_f1: 0.3896
 epoch: 73, train_loss: 1.1099, test_loss: 1.1609, test_f1: 0.3924
 epoch: 74, train_loss: 1.1058, test_loss: 1.1680, test_f1: 0.3949
 epoch: 75, train_loss: 1.1119, test_loss: 1.1693, test_f1: 0.3911
 epoch: 76, train_loss: 1.1051, test_loss: 1.1771, test_f1: 0.3885
 epoch: 77, train_loss: 1.0990, test_loss: 1.1941, test_f1: 0.3939
 epoch: 78, train_loss: 1.1040, test_loss: 1.1784, test_f1: 0.3957
 epoch: 79, train_loss: 1.0967, test_loss: 1.1789, test_f1: 0.3943
 epoch: 80, train_loss: 1.1086, test_loss: 1.1783, test_f1: 0.3957
 epoch: 81, train_loss: 1.1077, test_loss: 1.1825, test_f1: 0.4018
 epoch: 82, train_loss: 1.1008, test_loss: 1.1846, test_f1: 0.4045
 epoch: 83, train_loss: 1.0901, test_loss: 1.1884, test_f1: 0.3975
 epoch: 84, train_loss: 1.0990, test_loss: 1.2190, test_f1: 0.4011
 epoch: 85, train_loss: 1.0948, test_loss: 1.2050, test_f1: 0.4027
 epoch: 86, train_loss: 1.0941, test_loss: 1.1973, test_f1: 0.4072
 epoch: 87, train_loss: 1.0935, test_loss: 1.1903, test_f1: 0.4044
 epoch: 88, train_loss: 1.0995, test_loss: 1.1906, test_f1: 0.3986
 epoch: 89, train_loss: 1.0865, test_loss: 1.2024, test_f1: 0.4012
 epoch: 90, train_loss: 1.0944, test_loss: 1.1905, test_f1: 0.3993
 epoch: 91, train_loss: 1.0912, test_loss: 1.1796, test_f1: 0.4009
 epoch: 92, train_loss: 1.0837, test_loss: 1.1838, test_f1: 0.4069
 epoch: 93, train_loss: 1.0848, test_loss: 1.2027, test_f1: 0.4046
 epoch: 94, train_loss: 1.0877, test_loss: 1.2005, test_f1: 0.4045
 epoch: 95, train_loss: 1.0789, test_loss: 1.2360, test_f1: 0.4007
 epoch: 96, train_loss: 1.0851, test_loss: 1.1440, test_f1: 0.4021
 epoch: 97, train_loss: 1.0789, test_loss: 1.1761, test_f1: 0.4058
 epoch: 98, train_loss: 1.0770, test_loss: 1.1716, test_f1: 0.4046
 epoch: 99, train_loss: 1.0806, test_loss: 1.1701, test_f1: 0.4005
##################ITERATION #9 ****************************************
 epoch: 0, train_loss: 1.3264, test_loss: 1.3452, test_f1: 0.2274
 epoch: 1, train_loss: 1.3056, test_loss: 1.3304, test_f1: 0.2274
 epoch: 2, train_loss: 1.2955, test_loss: 1.2993, test_f1: 0.2274
 epoch: 3, train_loss: 1.2885, test_loss: 1.2819, test_f1: 0.2274
 epoch: 4, train_loss: 1.2816, test_loss: 1.2731, test_f1: 0.2292
 epoch: 5, train_loss: 1.2727, test_loss: 1.2661, test_f1: 0.2493
 epoch: 6, train_loss: 1.2659, test_loss: 1.2566, test_f1: 0.2649
 epoch: 7, train_loss: 1.2588, test_loss: 1.2478, test_f1: 0.2759
 epoch: 8, train_loss: 1.2509, test_loss: 1.2379, test_f1: 0.2945
 epoch: 9, train_loss: 1.2419, test_loss: 1.2296, test_f1: 0.2973
 epoch: 10, train_loss: 1.2446, test_loss: 1.2225, test_f1: 0.2966
 epoch: 11, train_loss: 1.2347, test_loss: 1.2199, test_f1: 0.2975
 epoch: 12, train_loss: 1.2271, test_loss: 1.2164, test_f1: 0.3014
 epoch: 13, train_loss: 1.2263, test_loss: 1.2095, test_f1: 0.3006
 epoch: 14, train_loss: 1.2234, test_loss: 1.2049, test_f1: 0.3022
 epoch: 15, train_loss: 1.2231, test_loss: 1.1999, test_f1: 0.3164
 epoch: 16, train_loss: 1.2159, test_loss: 1.1966, test_f1: 0.3133
 epoch: 17, train_loss: 1.2139, test_loss: 1.1928, test_f1: 0.3086
 epoch: 18, train_loss: 1.2079, test_loss: 1.1901, test_f1: 0.3208
 epoch: 19, train_loss: 1.2043, test_loss: 1.1855, test_f1: 0.3245
 epoch: 20, train_loss: 1.2012, test_loss: 1.1806, test_f1: 0.3238
 epoch: 21, train_loss: 1.2065, test_loss: 1.1774, test_f1: 0.3289
 epoch: 22, train_loss: 1.1961, test_loss: 1.1731, test_f1: 0.3418
 epoch: 23, train_loss: 1.1938, test_loss: 1.1690, test_f1: 0.3380
 epoch: 24, train_loss: 1.1834, test_loss: 1.1669, test_f1: 0.3418
 epoch: 25, train_loss: 1.1881, test_loss: 1.1636, test_f1: 0.3414
 epoch: 26, train_loss: 1.1867, test_loss: 1.1617, test_f1: 0.3424
 epoch: 27, train_loss: 1.1864, test_loss: 1.1591, test_f1: 0.3432
 epoch: 28, train_loss: 1.1803, test_loss: 1.1564, test_f1: 0.3408
 epoch: 29, train_loss: 1.1748, test_loss: 1.1525, test_f1: 0.3476
 epoch: 30, train_loss: 1.1706, test_loss: 1.1483, test_f1: 0.3469
 epoch: 31, train_loss: 1.1755, test_loss: 1.1480, test_f1: 0.3443
 epoch: 32, train_loss: 1.1726, test_loss: 1.1448, test_f1: 0.3545
 epoch: 33, train_loss: 1.1645, test_loss: 1.1417, test_f1: 0.3559
 epoch: 34, train_loss: 1.1637, test_loss: 1.1418, test_f1: 0.3540
 epoch: 35, train_loss: 1.1573, test_loss: 1.1377, test_f1: 0.3533
 epoch: 36, train_loss: 1.1557, test_loss: 1.1392, test_f1: 0.3494
 epoch: 37, train_loss: 1.1570, test_loss: 1.1371, test_f1: 0.3456
 epoch: 38, train_loss: 1.1579, test_loss: 1.1352, test_f1: 0.3483
 epoch: 39, train_loss: 1.1491, test_loss: 1.1335, test_f1: 0.3461
 epoch: 40, train_loss: 1.1467, test_loss: 1.1306, test_f1: 0.3490
 epoch: 41, train_loss: 1.1486, test_loss: 1.1305, test_f1: 0.3477
 epoch: 42, train_loss: 1.1504, test_loss: 1.1276, test_f1: 0.3568
 epoch: 43, train_loss: 1.1378, test_loss: 1.1262, test_f1: 0.3627
 epoch: 44, train_loss: 1.1482, test_loss: 1.1269, test_f1: 0.3661
 epoch: 45, train_loss: 1.1310, test_loss: 1.1252, test_f1: 0.3673
 epoch: 46, train_loss: 1.1349, test_loss: 1.1249, test_f1: 0.3775
 epoch: 47, train_loss: 1.1351, test_loss: 1.1235, test_f1: 0.3781
 epoch: 48, train_loss: 1.1315, test_loss: 1.1209, test_f1: 0.3787
 epoch: 49, train_loss: 1.1297, test_loss: 1.1235, test_f1: 0.3788
 epoch: 50, train_loss: 1.1253, test_loss: 1.1201, test_f1: 0.3848
 epoch: 51, train_loss: 1.1257, test_loss: 1.1189, test_f1: 0.3881
 epoch: 52, train_loss: 1.1279, test_loss: 1.1204, test_f1: 0.3866
 epoch: 53, train_loss: 1.1190, test_loss: 1.1203, test_f1: 0.4012
 epoch: 54, train_loss: 1.1202, test_loss: 1.1182, test_f1: 0.4022
 epoch: 55, train_loss: 1.1166, test_loss: 1.1190, test_f1: 0.4017
 epoch: 56, train_loss: 1.1155, test_loss: 1.1183, test_f1: 0.4039
 epoch: 57, train_loss: 1.1193, test_loss: 1.1171, test_f1: 0.4043
 epoch: 58, train_loss: 1.1141, test_loss: 1.1168, test_f1: 0.4065
 epoch: 59, train_loss: 1.1157, test_loss: 1.1183, test_f1: 0.4054
 epoch: 60, train_loss: 1.1212, test_loss: 1.1170, test_f1: 0.4067
 epoch: 61, train_loss: 1.1192, test_loss: 1.1175, test_f1: 0.4062
 epoch: 62, train_loss: 1.1126, test_loss: 1.1153, test_f1: 0.4079
 epoch: 63, train_loss: 1.1243, test_loss: 1.1170, test_f1: 0.4086
 epoch: 64, train_loss: 1.1163, test_loss: 1.1170, test_f1: 0.4118
 epoch: 65, train_loss: 1.1136, test_loss: 1.1177, test_f1: 0.4099
 epoch: 66, train_loss: 1.1043, test_loss: 1.1178, test_f1: 0.4100
 epoch: 67, train_loss: 1.1093, test_loss: 1.1117, test_f1: 0.4186
 epoch: 68, train_loss: 1.1043, test_loss: 1.1112, test_f1: 0.4196
 epoch: 69, train_loss: 1.1081, test_loss: 1.1122, test_f1: 0.4196
 epoch: 70, train_loss: 1.1066, test_loss: 1.1111, test_f1: 0.4190
 epoch: 71, train_loss: 1.1006, test_loss: 1.1094, test_f1: 0.4207
 epoch: 72, train_loss: 1.1049, test_loss: 1.1099, test_f1: 0.4177
 epoch: 73, train_loss: 1.0971, test_loss: 1.1105, test_f1: 0.4170
 epoch: 74, train_loss: 1.0936, test_loss: 1.1080, test_f1: 0.4201
 epoch: 75, train_loss: 1.0888, test_loss: 1.1097, test_f1: 0.4199
 epoch: 76, train_loss: 1.0947, test_loss: 1.1097, test_f1: 0.4236
 epoch: 77, train_loss: 1.0969, test_loss: 1.1072, test_f1: 0.4224
 epoch: 78, train_loss: 1.0912, test_loss: 1.1048, test_f1: 0.4214
 epoch: 79, train_loss: 1.0929, test_loss: 1.1035, test_f1: 0.4212
 epoch: 80, train_loss: 1.0891, test_loss: 1.1043, test_f1: 0.4210
 epoch: 81, train_loss: 1.0928, test_loss: 1.1047, test_f1: 0.4210
 epoch: 82, train_loss: 1.0941, test_loss: 1.1066, test_f1: 0.4228
 epoch: 83, train_loss: 1.0916, test_loss: 1.1079, test_f1: 0.4158
 epoch: 84, train_loss: 1.0847, test_loss: 1.1072, test_f1: 0.4228
 epoch: 85, train_loss: 1.0900, test_loss: 1.1055, test_f1: 0.4174
 epoch: 86, train_loss: 1.0886, test_loss: 1.1060, test_f1: 0.4147
 epoch: 87, train_loss: 1.0831, test_loss: 1.1052, test_f1: 0.4143
 epoch: 88, train_loss: 1.0878, test_loss: 1.1030, test_f1: 0.4199
 epoch: 89, train_loss: 1.0911, test_loss: 1.1020, test_f1: 0.4198
 epoch: 90, train_loss: 1.0875, test_loss: 1.1010, test_f1: 0.4190
 epoch: 91, train_loss: 1.0801, test_loss: 1.1017, test_f1: 0.4159
 epoch: 92, train_loss: 1.0786, test_loss: 1.1007, test_f1: 0.4166
 epoch: 93, train_loss: 1.0873, test_loss: 1.0981, test_f1: 0.4180
 epoch: 94, train_loss: 1.0770, test_loss: 1.1009, test_f1: 0.4186
 epoch: 95, train_loss: 1.0770, test_loss: 1.0977, test_f1: 0.4223
 epoch: 96, train_loss: 1.0798, test_loss: 1.0984, test_f1: 0.4208
 epoch: 97, train_loss: 1.0759, test_loss: 1.0977, test_f1: 0.4198
 epoch: 98, train_loss: 1.0782, test_loss: 1.0970, test_f1: 0.4199
 epoch: 99, train_loss: 1.0721, test_loss: 1.0984, test_f1: 0.4226

Training completed in 419.61 seconds
Best F1: 0.4815 at epoch 92
Mean F1 across iterations: 0.4158  0.0386
========================FINAL RESULTS================================
FEGIN weighted F1: 0.4815  0.0386
python main.py --data ltspice_examples --representation component_component --model FEGIN --layers 6 --hiddens 32 --batch_size 256 --lr 0.0001 --emb_size 250 --epochs 100 --save_appendix component_component_L6_H32_BS256_LR0.0001_E250 --no_val
-----



STDERR:
  File "main.py", line 370, in <module>
    main()
  File "main.py", line 254, in main
    dataset = dataset_class(
  File "/home/philip/projects/ltspice_examples_code_repo/Circuit-Completion-Using-GNNs/component_classification_with_link_prediction_head/evaluation/FEGIN/kernel/circuit_datasets.py", line 15, in __init__
    self.data, self.slices = torch.load(self.processed_paths[0])
  File "/home/philip/.local/lib/python3.8/site-packages/torch/serialization.py", line 1040, in load
    warnings.warn(
  File "/usr/lib/python3.8/warnings.py", line 109, in _showwarnmsg
    sw(msg.message, msg.category, msg.filename, msg.lineno,
  File "main.py", line 47, in warn_with_traceback
    traceback.print_stack(file=log)
/home/philip/projects/ltspice_examples_code_repo/Circuit-Completion-Using-GNNs/component_classification_with_link_prediction_head/evaluation/FEGIN/kernel/circuit_datasets.py:15: FutureWarning: You are using `torch.load` with `weights_only=False` (the current default value), which uses the default pickle module implicitly. It is possible to construct malicious pickle data which will execute arbitrary code during unpickling (See https://github.com/pytorch/pytorch/blob/main/SECURITY.md#untrusted-models for more details). In a future release, the default value for `weights_only` will be flipped to `True`. This limits the functions that could be executed during unpickling. Arbitrary objects will no longer be allowed to be loaded via this mode unless they are explicitly allowlisted by the user via `torch.serialization.add_safe_globals`. We recommend you start setting `weights_only=True` for any use case where you don't have full control of the loaded file. Please open an issue on GitHub for any issues related to this experimental feature.
  self.data, self.slices = torch.load(self.processed_paths[0])
