STDOUT:
Results will be saved in /home/philip/projects/ltspice_examples_code_repo/Circuit-Completion-Using-GNNs/component_classification_with_link_prediction_head/evaluation/FEGIN/results/model_FEGIN_dataset_ltspice_examples
Command line input: python main.py --data ltspice_examples --representation component_net --model FEGIN --layers 2 --hiddens 16 --batch_size 256 --lr 0.001 --emb_size 250 --epochs 100 --save_appendix component_net_L2_H16_BS256_LR0.001_E250 --no_val
 is saved.
-----
ltspice_examples - FEGIN
Using 2 layers, 16 hidden units, h = 2
Loading component_net representation dataset
ENTERED
Training FEGIN on component_net representation
Train: 3558, Test: 846
##################ITERATION #0 ****************************************
 epoch: 0, train_loss: 1.4087, test_loss: 1.3918, test_f1: 0.1004
 epoch: 1, train_loss: 1.3876, test_loss: 1.3821, test_f1: 0.1004
 epoch: 2, train_loss: 1.3740, test_loss: 1.3699, test_f1: 0.1004
 epoch: 3, train_loss: 1.3585, test_loss: 1.3522, test_f1: 0.1703
 epoch: 4, train_loss: 1.3376, test_loss: 1.3266, test_f1: 0.3329
 epoch: 5, train_loss: 1.3141, test_loss: 1.2949, test_f1: 0.2373
 epoch: 6, train_loss: 1.2866, test_loss: 1.2683, test_f1: 0.2285
 epoch: 7, train_loss: 1.2665, test_loss: 1.2492, test_f1: 0.2289
 epoch: 8, train_loss: 1.2531, test_loss: 1.2319, test_f1: 0.2368
 epoch: 9, train_loss: 1.2419, test_loss: 1.2169, test_f1: 0.2439
 epoch: 10, train_loss: 1.2283, test_loss: 1.2008, test_f1: 0.2809
 epoch: 11, train_loss: 1.2103, test_loss: 1.1864, test_f1: 0.2994
 epoch: 12, train_loss: 1.1926, test_loss: 1.1639, test_f1: 0.3666
 epoch: 13, train_loss: 1.1840, test_loss: 1.1491, test_f1: 0.3833
 epoch: 14, train_loss: 1.1660, test_loss: 1.1272, test_f1: 0.3992
 epoch: 15, train_loss: 1.1470, test_loss: 1.1087, test_f1: 0.3930
 epoch: 16, train_loss: 1.1300, test_loss: 1.1017, test_f1: 0.4005
 epoch: 17, train_loss: 1.1123, test_loss: 1.0763, test_f1: 0.4108
 epoch: 18, train_loss: 1.1114, test_loss: 1.0865, test_f1: 0.3877
 epoch: 19, train_loss: 1.0893, test_loss: 1.0487, test_f1: 0.4276
 epoch: 20, train_loss: 1.0837, test_loss: 1.0533, test_f1: 0.3998
 epoch: 21, train_loss: 1.0706, test_loss: 1.0384, test_f1: 0.4206
 epoch: 22, train_loss: 1.0580, test_loss: 1.0295, test_f1: 0.4051
 epoch: 23, train_loss: 1.0487, test_loss: 1.0196, test_f1: 0.4392
 epoch: 24, train_loss: 1.0523, test_loss: 1.0196, test_f1: 0.4665
 epoch: 25, train_loss: 1.0341, test_loss: 1.0201, test_f1: 0.4632
 epoch: 26, train_loss: 1.0316, test_loss: 1.0117, test_f1: 0.4606
 epoch: 27, train_loss: 1.0211, test_loss: 0.9963, test_f1: 0.4581
 epoch: 28, train_loss: 1.0231, test_loss: 1.0124, test_f1: 0.4577
 epoch: 29, train_loss: 1.0157, test_loss: 0.9877, test_f1: 0.4630
 epoch: 30, train_loss: 1.0064, test_loss: 0.9834, test_f1: 0.4857
 epoch: 31, train_loss: 1.0122, test_loss: 1.0036, test_f1: 0.4804
 epoch: 32, train_loss: 1.0038, test_loss: 0.9830, test_f1: 0.4691
 epoch: 33, train_loss: 0.9992, test_loss: 1.0028, test_f1: 0.4843
 epoch: 34, train_loss: 0.9938, test_loss: 0.9769, test_f1: 0.4802
 epoch: 35, train_loss: 0.9855, test_loss: 0.9811, test_f1: 0.4591
 epoch: 36, train_loss: 0.9865, test_loss: 0.9850, test_f1: 0.4730
 epoch: 37, train_loss: 0.9838, test_loss: 1.0034, test_f1: 0.4724
 epoch: 38, train_loss: 0.9865, test_loss: 0.9838, test_f1: 0.4643
 epoch: 39, train_loss: 0.9792, test_loss: 0.9530, test_f1: 0.4841
 epoch: 40, train_loss: 0.9690, test_loss: 0.9823, test_f1: 0.4939
 epoch: 41, train_loss: 0.9802, test_loss: 0.9671, test_f1: 0.4873
 epoch: 42, train_loss: 0.9738, test_loss: 0.9498, test_f1: 0.4771
 epoch: 43, train_loss: 0.9670, test_loss: 0.9362, test_f1: 0.5051
 epoch: 44, train_loss: 0.9623, test_loss: 0.9500, test_f1: 0.4918
 epoch: 45, train_loss: 0.9662, test_loss: 0.9878, test_f1: 0.4840
 epoch: 46, train_loss: 0.9523, test_loss: 0.9293, test_f1: 0.5114
 epoch: 47, train_loss: 0.9422, test_loss: 0.9428, test_f1: 0.5088
 epoch: 48, train_loss: 0.9492, test_loss: 0.9318, test_f1: 0.4884
 epoch: 49, train_loss: 0.9405, test_loss: 0.9642, test_f1: 0.4955
 epoch: 50, train_loss: 0.9506, test_loss: 0.9367, test_f1: 0.5112
 epoch: 51, train_loss: 0.9401, test_loss: 0.9565, test_f1: 0.5072
 epoch: 52, train_loss: 0.9368, test_loss: 0.9263, test_f1: 0.4954
 epoch: 53, train_loss: 0.9322, test_loss: 0.9380, test_f1: 0.5070
 epoch: 54, train_loss: 0.9313, test_loss: 0.9286, test_f1: 0.4932
 epoch: 55, train_loss: 0.9278, test_loss: 0.9431, test_f1: 0.4957
 epoch: 56, train_loss: 0.9297, test_loss: 0.9216, test_f1: 0.4933
 epoch: 57, train_loss: 0.9315, test_loss: 0.9211, test_f1: 0.5135
 epoch: 58, train_loss: 0.9311, test_loss: 0.9509, test_f1: 0.5042
 epoch: 59, train_loss: 0.9288, test_loss: 0.9167, test_f1: 0.5115
 epoch: 60, train_loss: 0.9215, test_loss: 0.9436, test_f1: 0.4965
 epoch: 61, train_loss: 0.9245, test_loss: 0.9251, test_f1: 0.4957
 epoch: 62, train_loss: 0.9234, test_loss: 0.9476, test_f1: 0.5196
 epoch: 63, train_loss: 0.9157, test_loss: 0.9306, test_f1: 0.5122
 epoch: 64, train_loss: 0.9138, test_loss: 0.9217, test_f1: 0.5242
 epoch: 65, train_loss: 0.9161, test_loss: 0.9317, test_f1: 0.5127
 epoch: 66, train_loss: 0.9154, test_loss: 0.9246, test_f1: 0.5117
 epoch: 67, train_loss: 0.9082, test_loss: 0.9237, test_f1: 0.4972
 epoch: 68, train_loss: 0.9154, test_loss: 0.9145, test_f1: 0.5201
 epoch: 69, train_loss: 0.9064, test_loss: 0.9368, test_f1: 0.5170
 epoch: 70, train_loss: 0.9150, test_loss: 0.9102, test_f1: 0.5176
 epoch: 71, train_loss: 0.9123, test_loss: 0.9301, test_f1: 0.5093
 epoch: 72, train_loss: 0.9109, test_loss: 0.9319, test_f1: 0.5067
 epoch: 73, train_loss: 0.9064, test_loss: 0.9295, test_f1: 0.4935
 epoch: 74, train_loss: 0.9061, test_loss: 0.9111, test_f1: 0.5298
 epoch: 75, train_loss: 0.9046, test_loss: 0.9203, test_f1: 0.5016
 epoch: 76, train_loss: 0.8990, test_loss: 0.9187, test_f1: 0.5047
 epoch: 77, train_loss: 0.9012, test_loss: 0.9251, test_f1: 0.5090
 epoch: 78, train_loss: 0.9104, test_loss: 0.9090, test_f1: 0.5239
 epoch: 79, train_loss: 0.8998, test_loss: 0.9319, test_f1: 0.5140
 epoch: 80, train_loss: 0.9001, test_loss: 0.9100, test_f1: 0.5056
 epoch: 81, train_loss: 0.8996, test_loss: 0.9244, test_f1: 0.5134
 epoch: 82, train_loss: 0.8889, test_loss: 0.9075, test_f1: 0.5059
 epoch: 83, train_loss: 0.8919, test_loss: 0.9065, test_f1: 0.5137
 epoch: 84, train_loss: 0.8927, test_loss: 0.8995, test_f1: 0.5181
 epoch: 85, train_loss: 0.8856, test_loss: 0.9157, test_f1: 0.5175
 epoch: 86, train_loss: 0.8906, test_loss: 0.9172, test_f1: 0.5216
 epoch: 87, train_loss: 0.8821, test_loss: 0.9091, test_f1: 0.5060
 epoch: 88, train_loss: 0.8992, test_loss: 0.9153, test_f1: 0.5153
 epoch: 89, train_loss: 0.8967, test_loss: 0.9379, test_f1: 0.5020
 epoch: 90, train_loss: 0.8923, test_loss: 0.9079, test_f1: 0.5154
 epoch: 91, train_loss: 0.8932, test_loss: 0.9071, test_f1: 0.5219
 epoch: 92, train_loss: 0.8863, test_loss: 0.9294, test_f1: 0.5165
 epoch: 93, train_loss: 0.8885, test_loss: 0.9213, test_f1: 0.5133
 epoch: 94, train_loss: 0.8802, test_loss: 0.9047, test_f1: 0.5103
 epoch: 95, train_loss: 0.8806, test_loss: 0.9069, test_f1: 0.5148
 epoch: 96, train_loss: 0.8780, test_loss: 0.9222, test_f1: 0.5172
 epoch: 97, train_loss: 0.8792, test_loss: 0.9275, test_f1: 0.5198
 epoch: 98, train_loss: 0.8783, test_loss: 0.9271, test_f1: 0.5041
 epoch: 99, train_loss: 0.8867, test_loss: 0.9345, test_f1: 0.5165
##################ITERATION #1 ****************************************
 epoch: 0, train_loss: 1.3260, test_loss: 1.3336, test_f1: 0.1004
 epoch: 1, train_loss: 1.2842, test_loss: 1.3119, test_f1: 0.2270
 epoch: 2, train_loss: 1.2588, test_loss: 1.2684, test_f1: 0.2270
 epoch: 3, train_loss: 1.2361, test_loss: 1.2235, test_f1: 0.2439
 epoch: 4, train_loss: 1.2165, test_loss: 1.1848, test_f1: 0.3213
 epoch: 5, train_loss: 1.1907, test_loss: 1.1478, test_f1: 0.3262
 epoch: 6, train_loss: 1.1662, test_loss: 1.1194, test_f1: 0.3342
 epoch: 7, train_loss: 1.1430, test_loss: 1.1024, test_f1: 0.3495
 epoch: 8, train_loss: 1.1234, test_loss: 1.0866, test_f1: 0.3638
 epoch: 9, train_loss: 1.1099, test_loss: 1.0735, test_f1: 0.3875
 epoch: 10, train_loss: 1.0983, test_loss: 1.0577, test_f1: 0.3879
 epoch: 11, train_loss: 1.0884, test_loss: 1.0514, test_f1: 0.4036
 epoch: 12, train_loss: 1.0743, test_loss: 1.0417, test_f1: 0.4061
 epoch: 13, train_loss: 1.0675, test_loss: 1.0374, test_f1: 0.4087
 epoch: 14, train_loss: 1.0645, test_loss: 1.0247, test_f1: 0.4083
 epoch: 15, train_loss: 1.0511, test_loss: 1.0255, test_f1: 0.4177
 epoch: 16, train_loss: 1.0461, test_loss: 1.0207, test_f1: 0.4330
 epoch: 17, train_loss: 1.0304, test_loss: 1.0121, test_f1: 0.4298
 epoch: 18, train_loss: 1.0312, test_loss: 1.0056, test_f1: 0.4272
 epoch: 19, train_loss: 1.0230, test_loss: 1.0210, test_f1: 0.4383
 epoch: 20, train_loss: 1.0104, test_loss: 1.0017, test_f1: 0.4436
 epoch: 21, train_loss: 1.0079, test_loss: 0.9948, test_f1: 0.4458
 epoch: 22, train_loss: 1.0034, test_loss: 1.0104, test_f1: 0.4479
 epoch: 23, train_loss: 0.9963, test_loss: 0.9925, test_f1: 0.4507
 epoch: 24, train_loss: 0.9876, test_loss: 0.9924, test_f1: 0.4480
 epoch: 25, train_loss: 0.9904, test_loss: 0.9992, test_f1: 0.4546
 epoch: 26, train_loss: 0.9800, test_loss: 1.0044, test_f1: 0.4618
 epoch: 27, train_loss: 0.9724, test_loss: 0.9972, test_f1: 0.4627
 epoch: 28, train_loss: 0.9679, test_loss: 0.9900, test_f1: 0.4613
 epoch: 29, train_loss: 0.9681, test_loss: 0.9848, test_f1: 0.4733
 epoch: 30, train_loss: 0.9628, test_loss: 0.9849, test_f1: 0.4850
 epoch: 31, train_loss: 0.9563, test_loss: 0.9842, test_f1: 0.4869
 epoch: 32, train_loss: 0.9482, test_loss: 0.9814, test_f1: 0.4732
 epoch: 33, train_loss: 0.9529, test_loss: 0.9821, test_f1: 0.4946
 epoch: 34, train_loss: 0.9469, test_loss: 0.9998, test_f1: 0.4955
 epoch: 35, train_loss: 0.9434, test_loss: 0.9913, test_f1: 0.5001
 epoch: 36, train_loss: 0.9407, test_loss: 0.9884, test_f1: 0.4900
 epoch: 37, train_loss: 0.9420, test_loss: 0.9857, test_f1: 0.5037
 epoch: 38, train_loss: 0.9375, test_loss: 0.9920, test_f1: 0.4988
 epoch: 39, train_loss: 0.9256, test_loss: 1.0001, test_f1: 0.4864
 epoch: 40, train_loss: 0.9276, test_loss: 0.9799, test_f1: 0.4959
 epoch: 41, train_loss: 0.9247, test_loss: 0.9889, test_f1: 0.5017
 epoch: 42, train_loss: 0.9138, test_loss: 0.9984, test_f1: 0.5029
 epoch: 43, train_loss: 0.9252, test_loss: 0.9862, test_f1: 0.5042
 epoch: 44, train_loss: 0.9123, test_loss: 0.9836, test_f1: 0.4998
 epoch: 45, train_loss: 0.9100, test_loss: 0.9777, test_f1: 0.5215
 epoch: 46, train_loss: 0.9112, test_loss: 0.9978, test_f1: 0.5035
 epoch: 47, train_loss: 0.9079, test_loss: 0.9946, test_f1: 0.5116
 epoch: 48, train_loss: 0.9112, test_loss: 0.9596, test_f1: 0.5122
 epoch: 49, train_loss: 0.8988, test_loss: 1.0005, test_f1: 0.4892
 epoch: 50, train_loss: 0.9017, test_loss: 0.9695, test_f1: 0.5090
 epoch: 51, train_loss: 0.9063, test_loss: 0.9770, test_f1: 0.5058
 epoch: 52, train_loss: 0.8939, test_loss: 0.9794, test_f1: 0.5073
 epoch: 53, train_loss: 0.8868, test_loss: 0.9681, test_f1: 0.5147
 epoch: 54, train_loss: 0.8927, test_loss: 0.9825, test_f1: 0.5168
 epoch: 55, train_loss: 0.8938, test_loss: 0.9823, test_f1: 0.5164
 epoch: 56, train_loss: 0.8866, test_loss: 0.9829, test_f1: 0.5074
 epoch: 57, train_loss: 0.8929, test_loss: 0.9831, test_f1: 0.5130
 epoch: 58, train_loss: 0.8829, test_loss: 0.9856, test_f1: 0.5167
 epoch: 59, train_loss: 0.8870, test_loss: 0.9800, test_f1: 0.5070
 epoch: 60, train_loss: 0.8923, test_loss: 0.9838, test_f1: 0.5153
 epoch: 61, train_loss: 0.8793, test_loss: 0.9758, test_f1: 0.5132
 epoch: 62, train_loss: 0.8816, test_loss: 0.9973, test_f1: 0.5093
 epoch: 63, train_loss: 0.8813, test_loss: 0.9941, test_f1: 0.5092
 epoch: 64, train_loss: 0.8860, test_loss: 0.9908, test_f1: 0.5133
 epoch: 65, train_loss: 0.8908, test_loss: 1.0036, test_f1: 0.5115
 epoch: 66, train_loss: 0.8868, test_loss: 0.9775, test_f1: 0.5186
 epoch: 67, train_loss: 0.8813, test_loss: 0.9730, test_f1: 0.5185
 epoch: 68, train_loss: 0.8771, test_loss: 0.9947, test_f1: 0.5075
 epoch: 69, train_loss: 0.8713, test_loss: 0.9913, test_f1: 0.5193
 epoch: 70, train_loss: 0.8792, test_loss: 0.9848, test_f1: 0.5181
 epoch: 71, train_loss: 0.8715, test_loss: 1.0062, test_f1: 0.5011
 epoch: 72, train_loss: 0.8766, test_loss: 0.9823, test_f1: 0.5168
 epoch: 73, train_loss: 0.8769, test_loss: 0.9876, test_f1: 0.5170
 epoch: 74, train_loss: 0.8704, test_loss: 0.9842, test_f1: 0.5158
 epoch: 75, train_loss: 0.8786, test_loss: 0.9932, test_f1: 0.5167
 epoch: 76, train_loss: 0.8713, test_loss: 1.0071, test_f1: 0.5168
 epoch: 77, train_loss: 0.8653, test_loss: 0.9929, test_f1: 0.5145
 epoch: 78, train_loss: 0.8663, test_loss: 0.9741, test_f1: 0.5073
 epoch: 79, train_loss: 0.8743, test_loss: 0.9829, test_f1: 0.5155
 epoch: 80, train_loss: 0.8726, test_loss: 1.0029, test_f1: 0.5219
 epoch: 81, train_loss: 0.8642, test_loss: 0.9928, test_f1: 0.5153
 epoch: 82, train_loss: 0.8669, test_loss: 0.9946, test_f1: 0.5184
 epoch: 83, train_loss: 0.8617, test_loss: 0.9939, test_f1: 0.5343
 epoch: 84, train_loss: 0.8714, test_loss: 1.0059, test_f1: 0.5118
 epoch: 85, train_loss: 0.8728, test_loss: 0.9877, test_f1: 0.5129
 epoch: 86, train_loss: 0.8642, test_loss: 0.9839, test_f1: 0.5143
 epoch: 87, train_loss: 0.8675, test_loss: 1.0040, test_f1: 0.5142
 epoch: 88, train_loss: 0.8505, test_loss: 1.0141, test_f1: 0.5097
 epoch: 89, train_loss: 0.8611, test_loss: 1.0076, test_f1: 0.5226
 epoch: 90, train_loss: 0.8678, test_loss: 1.0101, test_f1: 0.5250
 epoch: 91, train_loss: 0.8509, test_loss: 0.9944, test_f1: 0.5180
 epoch: 92, train_loss: 0.8625, test_loss: 1.0011, test_f1: 0.5206
 epoch: 93, train_loss: 0.8574, test_loss: 1.0098, test_f1: 0.5146
 epoch: 94, train_loss: 0.8600, test_loss: 1.0177, test_f1: 0.5111
 epoch: 95, train_loss: 0.8556, test_loss: 1.0083, test_f1: 0.5131
 epoch: 96, train_loss: 0.8549, test_loss: 1.0176, test_f1: 0.5138
 epoch: 97, train_loss: 0.8497, test_loss: 0.9980, test_f1: 0.5182
 epoch: 98, train_loss: 0.8549, test_loss: 0.9963, test_f1: 0.5204
 epoch: 99, train_loss: 0.8565, test_loss: 0.9893, test_f1: 0.5142
##################ITERATION #2 ****************************************
 epoch: 0, train_loss: 1.2963, test_loss: 1.3148, test_f1: 0.2270
 epoch: 1, train_loss: 1.2410, test_loss: 1.3002, test_f1: 0.2270
 epoch: 2, train_loss: 1.2200, test_loss: 1.2539, test_f1: 0.2270
 epoch: 3, train_loss: 1.1958, test_loss: 1.1999, test_f1: 0.2281
 epoch: 4, train_loss: 1.1780, test_loss: 1.1505, test_f1: 0.3289
 epoch: 5, train_loss: 1.1492, test_loss: 1.1157, test_f1: 0.3947
 epoch: 6, train_loss: 1.1308, test_loss: 1.0960, test_f1: 0.4015
 epoch: 7, train_loss: 1.1153, test_loss: 1.0771, test_f1: 0.4068
 epoch: 8, train_loss: 1.0919, test_loss: 1.0505, test_f1: 0.3980
 epoch: 9, train_loss: 1.0793, test_loss: 1.0365, test_f1: 0.3896
 epoch: 10, train_loss: 1.0620, test_loss: 1.0141, test_f1: 0.4305
 epoch: 11, train_loss: 1.0514, test_loss: 1.0102, test_f1: 0.4288
 epoch: 12, train_loss: 1.0363, test_loss: 1.0026, test_f1: 0.4305
 epoch: 13, train_loss: 1.0179, test_loss: 0.9893, test_f1: 0.4515
 epoch: 14, train_loss: 1.0168, test_loss: 1.0035, test_f1: 0.4341
 epoch: 15, train_loss: 1.0131, test_loss: 0.9795, test_f1: 0.4619
 epoch: 16, train_loss: 1.0045, test_loss: 0.9696, test_f1: 0.4542
 epoch: 17, train_loss: 0.9933, test_loss: 0.9616, test_f1: 0.4767
 epoch: 18, train_loss: 0.9936, test_loss: 0.9540, test_f1: 0.4929
 epoch: 19, train_loss: 0.9986, test_loss: 0.9868, test_f1: 0.4642
 epoch: 20, train_loss: 0.9837, test_loss: 0.9587, test_f1: 0.4952
 epoch: 21, train_loss: 0.9684, test_loss: 0.9454, test_f1: 0.5038
 epoch: 22, train_loss: 0.9623, test_loss: 0.9542, test_f1: 0.4869
 epoch: 23, train_loss: 0.9638, test_loss: 0.9473, test_f1: 0.4938
 epoch: 24, train_loss: 0.9560, test_loss: 0.9443, test_f1: 0.5029
 epoch: 25, train_loss: 0.9514, test_loss: 0.9504, test_f1: 0.4990
 epoch: 26, train_loss: 0.9540, test_loss: 0.9377, test_f1: 0.5144
 epoch: 27, train_loss: 0.9541, test_loss: 0.9718, test_f1: 0.4824
 epoch: 28, train_loss: 0.9562, test_loss: 0.9483, test_f1: 0.5008
 epoch: 29, train_loss: 0.9516, test_loss: 0.9645, test_f1: 0.4778
 epoch: 30, train_loss: 0.9390, test_loss: 0.9364, test_f1: 0.5006
 epoch: 31, train_loss: 0.9314, test_loss: 0.9304, test_f1: 0.5118
 epoch: 32, train_loss: 0.9336, test_loss: 0.9225, test_f1: 0.5234
 epoch: 33, train_loss: 0.9342, test_loss: 0.9466, test_f1: 0.4944
 epoch: 34, train_loss: 0.9318, test_loss: 0.9374, test_f1: 0.5061
 epoch: 35, train_loss: 0.9192, test_loss: 0.9187, test_f1: 0.5295
 epoch: 36, train_loss: 0.9160, test_loss: 0.9756, test_f1: 0.4866
 epoch: 37, train_loss: 0.9119, test_loss: 0.9226, test_f1: 0.5208
 epoch: 38, train_loss: 0.9151, test_loss: 0.9526, test_f1: 0.5043
 epoch: 39, train_loss: 0.9287, test_loss: 0.9585, test_f1: 0.5143
 epoch: 40, train_loss: 0.9237, test_loss: 0.9209, test_f1: 0.5092
 epoch: 41, train_loss: 0.9171, test_loss: 0.9379, test_f1: 0.5179
 epoch: 42, train_loss: 0.9164, test_loss: 0.9378, test_f1: 0.5005
 epoch: 43, train_loss: 0.9189, test_loss: 0.9297, test_f1: 0.5222
 epoch: 44, train_loss: 0.9106, test_loss: 0.9271, test_f1: 0.5097
 epoch: 45, train_loss: 0.9056, test_loss: 0.9143, test_f1: 0.5165
 epoch: 46, train_loss: 0.9150, test_loss: 0.9302, test_f1: 0.5213
 epoch: 47, train_loss: 0.9002, test_loss: 0.9089, test_f1: 0.5202
 epoch: 48, train_loss: 0.9028, test_loss: 0.9214, test_f1: 0.5139
 epoch: 49, train_loss: 0.9045, test_loss: 0.9344, test_f1: 0.5066
 epoch: 50, train_loss: 0.8935, test_loss: 0.9160, test_f1: 0.5229
 epoch: 51, train_loss: 0.8991, test_loss: 0.9220, test_f1: 0.5208
 epoch: 52, train_loss: 0.8860, test_loss: 0.9228, test_f1: 0.5189
 epoch: 53, train_loss: 0.8957, test_loss: 0.9115, test_f1: 0.5207
 epoch: 54, train_loss: 0.8931, test_loss: 0.9133, test_f1: 0.5228
 epoch: 55, train_loss: 0.8881, test_loss: 0.9194, test_f1: 0.5231
 epoch: 56, train_loss: 0.8928, test_loss: 0.9208, test_f1: 0.5274
 epoch: 57, train_loss: 0.9014, test_loss: 0.9103, test_f1: 0.5261
 epoch: 58, train_loss: 0.8871, test_loss: 0.9161, test_f1: 0.5234
 epoch: 59, train_loss: 0.8804, test_loss: 0.9179, test_f1: 0.5215
 epoch: 60, train_loss: 0.8858, test_loss: 0.9110, test_f1: 0.5222
 epoch: 61, train_loss: 0.8870, test_loss: 0.9129, test_f1: 0.5202
 epoch: 62, train_loss: 0.8836, test_loss: 0.9120, test_f1: 0.5240
 epoch: 63, train_loss: 0.8800, test_loss: 0.9227, test_f1: 0.5177
 epoch: 64, train_loss: 0.8784, test_loss: 0.9118, test_f1: 0.5227
 epoch: 65, train_loss: 0.8865, test_loss: 0.9196, test_f1: 0.5232
 epoch: 66, train_loss: 0.8846, test_loss: 0.9158, test_f1: 0.5245
 epoch: 67, train_loss: 0.8781, test_loss: 0.9079, test_f1: 0.5295
 epoch: 68, train_loss: 0.8795, test_loss: 0.9183, test_f1: 0.5187
 epoch: 69, train_loss: 0.8745, test_loss: 0.9145, test_f1: 0.5177
 epoch: 70, train_loss: 0.8831, test_loss: 0.9295, test_f1: 0.5060
 epoch: 71, train_loss: 0.8783, test_loss: 0.9197, test_f1: 0.5172
 epoch: 72, train_loss: 0.8680, test_loss: 0.9228, test_f1: 0.5200
 epoch: 73, train_loss: 0.8741, test_loss: 0.9136, test_f1: 0.5087
 epoch: 74, train_loss: 0.8691, test_loss: 0.9104, test_f1: 0.5170
 epoch: 75, train_loss: 0.8777, test_loss: 0.9142, test_f1: 0.5207
 epoch: 76, train_loss: 0.8774, test_loss: 0.9094, test_f1: 0.5262
 epoch: 77, train_loss: 0.8733, test_loss: 0.9103, test_f1: 0.5223
 epoch: 78, train_loss: 0.8746, test_loss: 0.9421, test_f1: 0.5140
 epoch: 79, train_loss: 0.8710, test_loss: 0.9063, test_f1: 0.5222
 epoch: 80, train_loss: 0.8713, test_loss: 0.9140, test_f1: 0.5174
 epoch: 81, train_loss: 0.8793, test_loss: 0.9191, test_f1: 0.5056
 epoch: 82, train_loss: 0.8806, test_loss: 0.9118, test_f1: 0.5164
 epoch: 83, train_loss: 0.8733, test_loss: 0.9165, test_f1: 0.5142
 epoch: 84, train_loss: 0.8733, test_loss: 0.8969, test_f1: 0.5357
 epoch: 85, train_loss: 0.8707, test_loss: 0.9085, test_f1: 0.5139
 epoch: 86, train_loss: 0.8688, test_loss: 0.9051, test_f1: 0.5270
 epoch: 87, train_loss: 0.8720, test_loss: 0.9053, test_f1: 0.5207
 epoch: 88, train_loss: 0.8703, test_loss: 0.9091, test_f1: 0.5229
 epoch: 89, train_loss: 0.8719, test_loss: 0.9107, test_f1: 0.5100
 epoch: 90, train_loss: 0.8647, test_loss: 0.9061, test_f1: 0.5251
 epoch: 91, train_loss: 0.8684, test_loss: 0.9093, test_f1: 0.5136
 epoch: 92, train_loss: 0.8610, test_loss: 0.9091, test_f1: 0.5243
 epoch: 93, train_loss: 0.8672, test_loss: 0.9074, test_f1: 0.5189
 epoch: 94, train_loss: 0.8672, test_loss: 0.9198, test_f1: 0.5147
 epoch: 95, train_loss: 0.8702, test_loss: 0.9123, test_f1: 0.5180
 epoch: 96, train_loss: 0.8665, test_loss: 0.8967, test_f1: 0.5266
 epoch: 97, train_loss: 0.8627, test_loss: 0.9011, test_f1: 0.5241
 epoch: 98, train_loss: 0.8586, test_loss: 0.9084, test_f1: 0.5184
 epoch: 99, train_loss: 0.8514, test_loss: 0.9098, test_f1: 0.5147
##################ITERATION #3 ****************************************
 epoch: 0, train_loss: 1.2901, test_loss: 1.3161, test_f1: 0.2270
 epoch: 1, train_loss: 1.2313, test_loss: 1.2877, test_f1: 0.2270
 epoch: 2, train_loss: 1.2033, test_loss: 1.2590, test_f1: 0.2270
 epoch: 3, train_loss: 1.1865, test_loss: 1.2212, test_f1: 0.2295
 epoch: 4, train_loss: 1.1724, test_loss: 1.1829, test_f1: 0.2614
 epoch: 5, train_loss: 1.1581, test_loss: 1.1309, test_f1: 0.3451
 epoch: 6, train_loss: 1.1533, test_loss: 1.1002, test_f1: 0.3617
 epoch: 7, train_loss: 1.1400, test_loss: 1.1014, test_f1: 0.3669
 epoch: 8, train_loss: 1.1270, test_loss: 1.0872, test_f1: 0.3926
 epoch: 9, train_loss: 1.1202, test_loss: 1.0620, test_f1: 0.4108
 epoch: 10, train_loss: 1.1127, test_loss: 1.0520, test_f1: 0.4183
 epoch: 11, train_loss: 1.1085, test_loss: 1.0452, test_f1: 0.4201
 epoch: 12, train_loss: 1.1001, test_loss: 1.0483, test_f1: 0.4132
 epoch: 13, train_loss: 1.0831, test_loss: 1.0294, test_f1: 0.4117
 epoch: 14, train_loss: 1.0815, test_loss: 1.0242, test_f1: 0.4159
 epoch: 15, train_loss: 1.0774, test_loss: 1.0177, test_f1: 0.4158
 epoch: 16, train_loss: 1.0633, test_loss: 1.0236, test_f1: 0.4168
 epoch: 17, train_loss: 1.0713, test_loss: 1.0110, test_f1: 0.4229
 epoch: 18, train_loss: 1.0555, test_loss: 1.0077, test_f1: 0.4313
 epoch: 19, train_loss: 1.0537, test_loss: 1.0085, test_f1: 0.4225
 epoch: 20, train_loss: 1.0521, test_loss: 1.0119, test_f1: 0.4260
 epoch: 21, train_loss: 1.0379, test_loss: 0.9930, test_f1: 0.4314
 epoch: 22, train_loss: 1.0378, test_loss: 0.9960, test_f1: 0.4303
 epoch: 23, train_loss: 1.0309, test_loss: 1.0059, test_f1: 0.4431
 epoch: 24, train_loss: 1.0256, test_loss: 0.9979, test_f1: 0.4456
 epoch: 25, train_loss: 1.0220, test_loss: 0.9883, test_f1: 0.4441
 epoch: 26, train_loss: 1.0193, test_loss: 0.9946, test_f1: 0.4516
 epoch: 27, train_loss: 1.0196, test_loss: 0.9923, test_f1: 0.4496
 epoch: 28, train_loss: 1.0103, test_loss: 0.9887, test_f1: 0.4559
 epoch: 29, train_loss: 0.9994, test_loss: 0.9951, test_f1: 0.4601
 epoch: 30, train_loss: 0.9994, test_loss: 0.9878, test_f1: 0.4633
 epoch: 31, train_loss: 0.9941, test_loss: 0.9947, test_f1: 0.4558
 epoch: 32, train_loss: 0.9963, test_loss: 0.9969, test_f1: 0.4622
 epoch: 33, train_loss: 0.9962, test_loss: 0.9855, test_f1: 0.4597
 epoch: 34, train_loss: 0.9928, test_loss: 0.9851, test_f1: 0.4796
 epoch: 35, train_loss: 0.9836, test_loss: 0.9901, test_f1: 0.4582
 epoch: 36, train_loss: 0.9843, test_loss: 0.9956, test_f1: 0.4543
 epoch: 37, train_loss: 0.9749, test_loss: 0.9913, test_f1: 0.4782
 epoch: 38, train_loss: 0.9780, test_loss: 0.9808, test_f1: 0.4639
 epoch: 39, train_loss: 0.9705, test_loss: 0.9909, test_f1: 0.4768
 epoch: 40, train_loss: 0.9738, test_loss: 0.9911, test_f1: 0.4797
 epoch: 41, train_loss: 0.9648, test_loss: 0.9858, test_f1: 0.4656
 epoch: 42, train_loss: 0.9639, test_loss: 0.9893, test_f1: 0.4940
 epoch: 43, train_loss: 0.9651, test_loss: 0.9857, test_f1: 0.4703
 epoch: 44, train_loss: 0.9704, test_loss: 0.9971, test_f1: 0.4753
 epoch: 45, train_loss: 0.9611, test_loss: 0.9943, test_f1: 0.4720
 epoch: 46, train_loss: 0.9548, test_loss: 0.9870, test_f1: 0.4744
 epoch: 47, train_loss: 0.9592, test_loss: 1.0106, test_f1: 0.4853
 epoch: 48, train_loss: 0.9612, test_loss: 0.9887, test_f1: 0.4817
 epoch: 49, train_loss: 0.9523, test_loss: 0.9871, test_f1: 0.4852
 epoch: 50, train_loss: 0.9534, test_loss: 0.9646, test_f1: 0.4844
 epoch: 51, train_loss: 0.9475, test_loss: 0.9819, test_f1: 0.4873
 epoch: 52, train_loss: 0.9479, test_loss: 0.9924, test_f1: 0.4890
 epoch: 53, train_loss: 0.9460, test_loss: 0.9779, test_f1: 0.4840
 epoch: 54, train_loss: 0.9469, test_loss: 0.9790, test_f1: 0.4858
 epoch: 55, train_loss: 0.9456, test_loss: 0.9708, test_f1: 0.4833
 epoch: 56, train_loss: 0.9404, test_loss: 0.9808, test_f1: 0.4872
 epoch: 57, train_loss: 0.9345, test_loss: 0.9855, test_f1: 0.4963
 epoch: 58, train_loss: 0.9441, test_loss: 0.9846, test_f1: 0.4823
 epoch: 59, train_loss: 0.9385, test_loss: 0.9825, test_f1: 0.4832
 epoch: 60, train_loss: 0.9373, test_loss: 0.9877, test_f1: 0.4916
 epoch: 61, train_loss: 0.9334, test_loss: 0.9811, test_f1: 0.4841
 epoch: 62, train_loss: 0.9285, test_loss: 0.9855, test_f1: 0.4844
 epoch: 63, train_loss: 0.9397, test_loss: 0.9923, test_f1: 0.4874
 epoch: 64, train_loss: 0.9355, test_loss: 0.9833, test_f1: 0.4891
 epoch: 65, train_loss: 0.9287, test_loss: 0.9843, test_f1: 0.4841
 epoch: 66, train_loss: 0.9326, test_loss: 0.9783, test_f1: 0.4853
 epoch: 67, train_loss: 0.9354, test_loss: 0.9852, test_f1: 0.4842
 epoch: 68, train_loss: 0.9304, test_loss: 0.9778, test_f1: 0.4925
 epoch: 69, train_loss: 0.9303, test_loss: 0.9888, test_f1: 0.4849
 epoch: 70, train_loss: 0.9311, test_loss: 0.9809, test_f1: 0.4923
 epoch: 71, train_loss: 0.9327, test_loss: 0.9849, test_f1: 0.4870
 epoch: 72, train_loss: 0.9349, test_loss: 0.9855, test_f1: 0.4899
 epoch: 73, train_loss: 0.9229, test_loss: 0.9857, test_f1: 0.4879
 epoch: 74, train_loss: 0.9227, test_loss: 0.9897, test_f1: 0.4917
 epoch: 75, train_loss: 0.9279, test_loss: 0.9842, test_f1: 0.4908
 epoch: 76, train_loss: 0.9370, test_loss: 0.9822, test_f1: 0.4913
 epoch: 77, train_loss: 0.9183, test_loss: 0.9777, test_f1: 0.4863
 epoch: 78, train_loss: 0.9226, test_loss: 0.9886, test_f1: 0.4923
 epoch: 79, train_loss: 0.9266, test_loss: 0.9801, test_f1: 0.5008
 epoch: 80, train_loss: 0.9265, test_loss: 0.9783, test_f1: 0.4859
 epoch: 81, train_loss: 0.9145, test_loss: 0.9884, test_f1: 0.4828
 epoch: 82, train_loss: 0.9245, test_loss: 0.9819, test_f1: 0.4973
 epoch: 83, train_loss: 0.9128, test_loss: 0.9713, test_f1: 0.4981
 epoch: 84, train_loss: 0.9186, test_loss: 0.9917, test_f1: 0.5007
 epoch: 85, train_loss: 0.9154, test_loss: 0.9908, test_f1: 0.4887
 epoch: 86, train_loss: 0.9151, test_loss: 0.9847, test_f1: 0.5017
 epoch: 87, train_loss: 0.9172, test_loss: 0.9813, test_f1: 0.4990
 epoch: 88, train_loss: 0.9138, test_loss: 0.9842, test_f1: 0.4989
 epoch: 89, train_loss: 0.9152, test_loss: 0.9817, test_f1: 0.4924
 epoch: 90, train_loss: 0.9097, test_loss: 0.9909, test_f1: 0.4944
 epoch: 91, train_loss: 0.9062, test_loss: 0.9771, test_f1: 0.5043
 epoch: 92, train_loss: 0.9154, test_loss: 0.9738, test_f1: 0.4974
 epoch: 93, train_loss: 0.9060, test_loss: 0.9895, test_f1: 0.4904
 epoch: 94, train_loss: 0.9000, test_loss: 0.9731, test_f1: 0.5086
 epoch: 95, train_loss: 0.9001, test_loss: 0.9672, test_f1: 0.5004
 epoch: 96, train_loss: 0.9064, test_loss: 0.9737, test_f1: 0.5000
 epoch: 97, train_loss: 0.9090, test_loss: 1.0019, test_f1: 0.4998
 epoch: 98, train_loss: 0.9093, test_loss: 0.9650, test_f1: 0.4996
 epoch: 99, train_loss: 0.9116, test_loss: 0.9761, test_f1: 0.5091
##################ITERATION #4 ****************************************
 epoch: 0, train_loss: 1.3066, test_loss: 1.3415, test_f1: 0.2270
 epoch: 1, train_loss: 1.2255, test_loss: 1.2814, test_f1: 0.2270
 epoch: 2, train_loss: 1.1980, test_loss: 1.2306, test_f1: 0.2641
 epoch: 3, train_loss: 1.1652, test_loss: 1.1799, test_f1: 0.3140
 epoch: 4, train_loss: 1.1530, test_loss: 1.1323, test_f1: 0.3282
 epoch: 5, train_loss: 1.1350, test_loss: 1.0957, test_f1: 0.3536
 epoch: 6, train_loss: 1.1217, test_loss: 1.0749, test_f1: 0.3532
 epoch: 7, train_loss: 1.1003, test_loss: 1.0518, test_f1: 0.3538
 epoch: 8, train_loss: 1.0870, test_loss: 1.0477, test_f1: 0.3598
 epoch: 9, train_loss: 1.0769, test_loss: 1.0353, test_f1: 0.3648
 epoch: 10, train_loss: 1.0678, test_loss: 1.0232, test_f1: 0.3670
 epoch: 11, train_loss: 1.0592, test_loss: 1.0199, test_f1: 0.3760
 epoch: 12, train_loss: 1.0425, test_loss: 1.0124, test_f1: 0.3917
 epoch: 13, train_loss: 1.0395, test_loss: 1.0069, test_f1: 0.4230
 epoch: 14, train_loss: 1.0291, test_loss: 1.0058, test_f1: 0.4144
 epoch: 15, train_loss: 1.0154, test_loss: 1.0011, test_f1: 0.4484
 epoch: 16, train_loss: 1.0195, test_loss: 0.9996, test_f1: 0.4444
 epoch: 17, train_loss: 1.0081, test_loss: 0.9935, test_f1: 0.4392
 epoch: 18, train_loss: 1.0109, test_loss: 1.0059, test_f1: 0.4238
 epoch: 19, train_loss: 1.0193, test_loss: 1.0047, test_f1: 0.4392
 epoch: 20, train_loss: 1.0088, test_loss: 0.9951, test_f1: 0.4678
 epoch: 21, train_loss: 0.9995, test_loss: 0.9928, test_f1: 0.4673
 epoch: 22, train_loss: 0.9931, test_loss: 0.9933, test_f1: 0.4434
 epoch: 23, train_loss: 0.9953, test_loss: 0.9918, test_f1: 0.4768
 epoch: 24, train_loss: 0.9776, test_loss: 0.9920, test_f1: 0.4531
 epoch: 25, train_loss: 0.9812, test_loss: 0.9881, test_f1: 0.4825
 epoch: 26, train_loss: 0.9789, test_loss: 0.9895, test_f1: 0.4761
 epoch: 27, train_loss: 0.9747, test_loss: 0.9872, test_f1: 0.4818
 epoch: 28, train_loss: 0.9722, test_loss: 0.9895, test_f1: 0.4858
 epoch: 29, train_loss: 0.9708, test_loss: 0.9890, test_f1: 0.4909
 epoch: 30, train_loss: 0.9657, test_loss: 0.9902, test_f1: 0.4773
 epoch: 31, train_loss: 0.9627, test_loss: 0.9817, test_f1: 0.5003
 epoch: 32, train_loss: 0.9515, test_loss: 0.9828, test_f1: 0.4898
 epoch: 33, train_loss: 0.9599, test_loss: 0.9950, test_f1: 0.4811
 epoch: 34, train_loss: 0.9569, test_loss: 0.9911, test_f1: 0.4900
 epoch: 35, train_loss: 0.9474, test_loss: 0.9848, test_f1: 0.4900
 epoch: 36, train_loss: 0.9566, test_loss: 0.9975, test_f1: 0.4874
 epoch: 37, train_loss: 0.9446, test_loss: 0.9925, test_f1: 0.4913
 epoch: 38, train_loss: 0.9396, test_loss: 0.9884, test_f1: 0.4892
 epoch: 39, train_loss: 0.9381, test_loss: 0.9872, test_f1: 0.5080
 epoch: 40, train_loss: 0.9419, test_loss: 0.9947, test_f1: 0.4928
 epoch: 41, train_loss: 0.9484, test_loss: 1.0004, test_f1: 0.4720
 epoch: 42, train_loss: 0.9475, test_loss: 1.0027, test_f1: 0.4748
 epoch: 43, train_loss: 0.9303, test_loss: 0.9971, test_f1: 0.5046
 epoch: 44, train_loss: 0.9375, test_loss: 0.9960, test_f1: 0.4942
 epoch: 45, train_loss: 0.9374, test_loss: 1.0136, test_f1: 0.4669
 epoch: 46, train_loss: 0.9256, test_loss: 0.9979, test_f1: 0.5009
 epoch: 47, train_loss: 0.9343, test_loss: 0.9899, test_f1: 0.5077
 epoch: 48, train_loss: 0.9223, test_loss: 1.0029, test_f1: 0.4957
 epoch: 49, train_loss: 0.9314, test_loss: 0.9993, test_f1: 0.4914
 epoch: 50, train_loss: 0.9191, test_loss: 0.9982, test_f1: 0.5179
 epoch: 51, train_loss: 0.9147, test_loss: 1.0029, test_f1: 0.4996
 epoch: 52, train_loss: 0.9117, test_loss: 0.9939, test_f1: 0.5128
 epoch: 53, train_loss: 0.9219, test_loss: 0.9910, test_f1: 0.4998
 epoch: 54, train_loss: 0.9155, test_loss: 0.9958, test_f1: 0.5046
 epoch: 55, train_loss: 0.9140, test_loss: 1.0019, test_f1: 0.4913
 epoch: 56, train_loss: 0.9106, test_loss: 0.9943, test_f1: 0.5102
 epoch: 57, train_loss: 0.9130, test_loss: 1.0006, test_f1: 0.4943
 epoch: 58, train_loss: 0.9118, test_loss: 0.9945, test_f1: 0.5031
 epoch: 59, train_loss: 0.9070, test_loss: 0.9897, test_f1: 0.4960
 epoch: 60, train_loss: 0.9155, test_loss: 0.9910, test_f1: 0.5022
 epoch: 61, train_loss: 0.9052, test_loss: 0.9893, test_f1: 0.5050
 epoch: 62, train_loss: 0.9121, test_loss: 0.9986, test_f1: 0.4981
 epoch: 63, train_loss: 0.9065, test_loss: 0.9902, test_f1: 0.5035
 epoch: 64, train_loss: 0.9029, test_loss: 0.9945, test_f1: 0.5062
 epoch: 65, train_loss: 0.9051, test_loss: 0.9960, test_f1: 0.5008
 epoch: 66, train_loss: 0.9060, test_loss: 0.9926, test_f1: 0.5041
 epoch: 67, train_loss: 0.9087, test_loss: 0.9959, test_f1: 0.4973
 epoch: 68, train_loss: 0.8941, test_loss: 0.9967, test_f1: 0.5077
 epoch: 69, train_loss: 0.8996, test_loss: 0.9929, test_f1: 0.5057
 epoch: 70, train_loss: 0.9019, test_loss: 0.9927, test_f1: 0.5115
 epoch: 71, train_loss: 0.8951, test_loss: 0.9990, test_f1: 0.5112
 epoch: 72, train_loss: 0.8972, test_loss: 0.9969, test_f1: 0.5103
 epoch: 73, train_loss: 0.8961, test_loss: 0.9960, test_f1: 0.5064
 epoch: 74, train_loss: 0.8976, test_loss: 1.0044, test_f1: 0.5079
 epoch: 75, train_loss: 0.8909, test_loss: 0.9911, test_f1: 0.5087
 epoch: 76, train_loss: 0.8964, test_loss: 0.9926, test_f1: 0.4956
 epoch: 77, train_loss: 0.8964, test_loss: 0.9991, test_f1: 0.5011
 epoch: 78, train_loss: 0.8934, test_loss: 0.9971, test_f1: 0.5132
 epoch: 79, train_loss: 0.8857, test_loss: 0.9983, test_f1: 0.4966
 epoch: 80, train_loss: 0.8919, test_loss: 0.9951, test_f1: 0.5154
 epoch: 81, train_loss: 0.8930, test_loss: 0.9983, test_f1: 0.5035
 epoch: 82, train_loss: 0.8888, test_loss: 0.9936, test_f1: 0.5107
 epoch: 83, train_loss: 0.8882, test_loss: 0.9953, test_f1: 0.5045
 epoch: 84, train_loss: 0.8835, test_loss: 1.0095, test_f1: 0.4986
 epoch: 85, train_loss: 0.8819, test_loss: 0.9945, test_f1: 0.5076
 epoch: 86, train_loss: 0.8904, test_loss: 1.0053, test_f1: 0.5010
 epoch: 87, train_loss: 0.8885, test_loss: 0.9928, test_f1: 0.5224
 epoch: 88, train_loss: 0.8857, test_loss: 1.0006, test_f1: 0.5112
 epoch: 89, train_loss: 0.8909, test_loss: 1.0157, test_f1: 0.5034
 epoch: 90, train_loss: 0.8875, test_loss: 0.9988, test_f1: 0.5115
 epoch: 91, train_loss: 0.8825, test_loss: 1.0131, test_f1: 0.5076
 epoch: 92, train_loss: 0.8887, test_loss: 0.9936, test_f1: 0.5069
 epoch: 93, train_loss: 0.8923, test_loss: 1.0004, test_f1: 0.5038
 epoch: 94, train_loss: 0.8789, test_loss: 0.9991, test_f1: 0.5040
 epoch: 95, train_loss: 0.8898, test_loss: 1.0045, test_f1: 0.5088
 epoch: 96, train_loss: 0.8895, test_loss: 1.0014, test_f1: 0.5225
 epoch: 97, train_loss: 0.8743, test_loss: 0.9990, test_f1: 0.5043
 epoch: 98, train_loss: 0.8811, test_loss: 0.9935, test_f1: 0.5077
 epoch: 99, train_loss: 0.8826, test_loss: 0.9886, test_f1: 0.5172
##################ITERATION #5 ****************************************
 epoch: 0, train_loss: 1.3503, test_loss: 1.3600, test_f1: 0.2270
 epoch: 1, train_loss: 1.2440, test_loss: 1.3053, test_f1: 0.2270
 epoch: 2, train_loss: 1.2170, test_loss: 1.2413, test_f1: 0.2270
 epoch: 3, train_loss: 1.1968, test_loss: 1.1772, test_f1: 0.2968
 epoch: 4, train_loss: 1.1867, test_loss: 1.1478, test_f1: 0.3328
 epoch: 5, train_loss: 1.1715, test_loss: 1.1251, test_f1: 0.3446
 epoch: 6, train_loss: 1.1537, test_loss: 1.1152, test_f1: 0.3395
 epoch: 7, train_loss: 1.1392, test_loss: 1.0936, test_f1: 0.3427
 epoch: 8, train_loss: 1.1266, test_loss: 1.0743, test_f1: 0.3500
 epoch: 9, train_loss: 1.1159, test_loss: 1.0721, test_f1: 0.3519
 epoch: 10, train_loss: 1.0961, test_loss: 1.0753, test_f1: 0.3461
 epoch: 11, train_loss: 1.0868, test_loss: 1.0516, test_f1: 0.3516
 epoch: 12, train_loss: 1.0747, test_loss: 1.0565, test_f1: 0.3506
 epoch: 13, train_loss: 1.0704, test_loss: 1.0272, test_f1: 0.3583
 epoch: 14, train_loss: 1.0574, test_loss: 1.0350, test_f1: 0.3576
 epoch: 15, train_loss: 1.0505, test_loss: 1.0247, test_f1: 0.3798
 epoch: 16, train_loss: 1.0401, test_loss: 1.0029, test_f1: 0.3959
 epoch: 17, train_loss: 1.0357, test_loss: 1.0245, test_f1: 0.3987
 epoch: 18, train_loss: 1.0237, test_loss: 0.9972, test_f1: 0.4185
 epoch: 19, train_loss: 1.0259, test_loss: 0.9978, test_f1: 0.4296
 epoch: 20, train_loss: 1.0183, test_loss: 1.0390, test_f1: 0.4182
 epoch: 21, train_loss: 1.0079, test_loss: 0.9762, test_f1: 0.4384
 epoch: 22, train_loss: 1.0075, test_loss: 0.9766, test_f1: 0.4369
 epoch: 23, train_loss: 0.9958, test_loss: 1.0045, test_f1: 0.4446
 epoch: 24, train_loss: 0.9953, test_loss: 0.9926, test_f1: 0.4409
 epoch: 25, train_loss: 0.9866, test_loss: 0.9913, test_f1: 0.4469
 epoch: 26, train_loss: 0.9756, test_loss: 0.9599, test_f1: 0.4480
 epoch: 27, train_loss: 0.9856, test_loss: 0.9655, test_f1: 0.4837
 epoch: 28, train_loss: 0.9786, test_loss: 0.9499, test_f1: 0.4988
 epoch: 29, train_loss: 0.9649, test_loss: 0.9437, test_f1: 0.4791
 epoch: 30, train_loss: 0.9666, test_loss: 0.9446, test_f1: 0.4686
 epoch: 31, train_loss: 0.9662, test_loss: 0.9387, test_f1: 0.4947
 epoch: 32, train_loss: 0.9649, test_loss: 0.9411, test_f1: 0.4725
 epoch: 33, train_loss: 0.9557, test_loss: 0.9286, test_f1: 0.4894
 epoch: 34, train_loss: 0.9519, test_loss: 0.9416, test_f1: 0.4856
 epoch: 35, train_loss: 0.9498, test_loss: 0.9418, test_f1: 0.4707
 epoch: 36, train_loss: 0.9454, test_loss: 0.9828, test_f1: 0.4678
 epoch: 37, train_loss: 0.9468, test_loss: 0.9608, test_f1: 0.4707
 epoch: 38, train_loss: 0.9519, test_loss: 1.0232, test_f1: 0.4838
 epoch: 39, train_loss: 0.9501, test_loss: 0.9942, test_f1: 0.4643
 epoch: 40, train_loss: 0.9417, test_loss: 0.9952, test_f1: 0.4775
 epoch: 41, train_loss: 0.9389, test_loss: 0.9271, test_f1: 0.4972
 epoch: 42, train_loss: 0.9374, test_loss: 0.9246, test_f1: 0.5062
 epoch: 43, train_loss: 0.9423, test_loss: 0.9227, test_f1: 0.5010
 epoch: 44, train_loss: 0.9342, test_loss: 0.9936, test_f1: 0.4789
 epoch: 45, train_loss: 0.9351, test_loss: 0.9201, test_f1: 0.5007
 epoch: 46, train_loss: 0.9321, test_loss: 0.9436, test_f1: 0.4917
 epoch: 47, train_loss: 0.9331, test_loss: 0.9262, test_f1: 0.5053
 epoch: 48, train_loss: 0.9201, test_loss: 0.9443, test_f1: 0.5031
 epoch: 49, train_loss: 0.9243, test_loss: 0.9553, test_f1: 0.4856
 epoch: 50, train_loss: 0.9317, test_loss: 0.9393, test_f1: 0.5095
 epoch: 51, train_loss: 0.9239, test_loss: 1.0054, test_f1: 0.4997
 epoch: 52, train_loss: 0.9236, test_loss: 0.9380, test_f1: 0.4964
 epoch: 53, train_loss: 0.9182, test_loss: 0.9875, test_f1: 0.4969
 epoch: 54, train_loss: 0.9207, test_loss: 0.9365, test_f1: 0.5127
 epoch: 55, train_loss: 0.9141, test_loss: 0.9141, test_f1: 0.5111
 epoch: 56, train_loss: 0.9138, test_loss: 0.9742, test_f1: 0.4914
 epoch: 57, train_loss: 0.9135, test_loss: 0.9265, test_f1: 0.5038
 epoch: 58, train_loss: 0.9068, test_loss: 0.9524, test_f1: 0.4931
 epoch: 59, train_loss: 0.9162, test_loss: 0.9467, test_f1: 0.5007
 epoch: 60, train_loss: 0.9188, test_loss: 0.9638, test_f1: 0.5028
 epoch: 61, train_loss: 0.9141, test_loss: 0.9082, test_f1: 0.5109
 epoch: 62, train_loss: 0.9129, test_loss: 1.0021, test_f1: 0.4929
 epoch: 63, train_loss: 0.9082, test_loss: 0.9519, test_f1: 0.4963
 epoch: 64, train_loss: 0.9077, test_loss: 0.9097, test_f1: 0.5229
 epoch: 65, train_loss: 0.9079, test_loss: 0.9430, test_f1: 0.4946
 epoch: 66, train_loss: 0.9136, test_loss: 0.9362, test_f1: 0.5113
 epoch: 67, train_loss: 0.9057, test_loss: 0.9428, test_f1: 0.5100
 epoch: 68, train_loss: 0.9107, test_loss: 0.9397, test_f1: 0.5042
 epoch: 69, train_loss: 0.9088, test_loss: 0.9303, test_f1: 0.5085
 epoch: 70, train_loss: 0.9184, test_loss: 0.9752, test_f1: 0.5073
 epoch: 71, train_loss: 0.9105, test_loss: 0.9303, test_f1: 0.5142
 epoch: 72, train_loss: 0.9082, test_loss: 0.9511, test_f1: 0.5032
 epoch: 73, train_loss: 0.9070, test_loss: 0.9395, test_f1: 0.5061
 epoch: 74, train_loss: 0.8961, test_loss: 0.9219, test_f1: 0.5050
 epoch: 75, train_loss: 0.9063, test_loss: 0.9270, test_f1: 0.5117
 epoch: 76, train_loss: 0.9050, test_loss: 0.9287, test_f1: 0.5053
 epoch: 77, train_loss: 0.9046, test_loss: 0.9182, test_f1: 0.5100
 epoch: 78, train_loss: 0.8983, test_loss: 0.9048, test_f1: 0.5272
 epoch: 79, train_loss: 0.9015, test_loss: 0.9144, test_f1: 0.5050
 epoch: 80, train_loss: 0.9011, test_loss: 0.9721, test_f1: 0.4998
 epoch: 81, train_loss: 0.9015, test_loss: 0.9509, test_f1: 0.4996
 epoch: 82, train_loss: 0.9011, test_loss: 0.9089, test_f1: 0.5253
 epoch: 83, train_loss: 0.8973, test_loss: 0.9220, test_f1: 0.5059
 epoch: 84, train_loss: 0.9092, test_loss: 0.9902, test_f1: 0.5085
 epoch: 85, train_loss: 0.9058, test_loss: 0.9233, test_f1: 0.5110
 epoch: 86, train_loss: 0.8988, test_loss: 0.9693, test_f1: 0.5099
 epoch: 87, train_loss: 0.8962, test_loss: 0.9225, test_f1: 0.5098
 epoch: 88, train_loss: 0.8915, test_loss: 0.9879, test_f1: 0.5165
 epoch: 89, train_loss: 0.9010, test_loss: 0.9069, test_f1: 0.5317
 epoch: 90, train_loss: 0.8871, test_loss: 0.9092, test_f1: 0.5168
 epoch: 91, train_loss: 0.8916, test_loss: 0.9629, test_f1: 0.5108
 epoch: 92, train_loss: 0.8914, test_loss: 0.8952, test_f1: 0.5392
 epoch: 93, train_loss: 0.8898, test_loss: 0.9080, test_f1: 0.5236
 epoch: 94, train_loss: 0.8964, test_loss: 0.9117, test_f1: 0.5325
 epoch: 95, train_loss: 0.8928, test_loss: 0.9535, test_f1: 0.5122
 epoch: 96, train_loss: 0.8970, test_loss: 0.8996, test_f1: 0.5313
 epoch: 97, train_loss: 0.8855, test_loss: 0.9883, test_f1: 0.5085
 epoch: 98, train_loss: 0.8877, test_loss: 0.8996, test_f1: 0.5288
 epoch: 99, train_loss: 0.8914, test_loss: 0.9252, test_f1: 0.5226
##################ITERATION #6 ****************************************
 epoch: 0, train_loss: 1.3746, test_loss: 1.3151, test_f1: 0.2270
 epoch: 1, train_loss: 1.2570, test_loss: 1.2579, test_f1: 0.2270
 epoch: 2, train_loss: 1.2183, test_loss: 1.2067, test_f1: 0.2629
 epoch: 3, train_loss: 1.1788, test_loss: 1.1668, test_f1: 0.3213
 epoch: 4, train_loss: 1.1548, test_loss: 1.1373, test_f1: 0.3576
 epoch: 5, train_loss: 1.1414, test_loss: 1.1158, test_f1: 0.3622
 epoch: 6, train_loss: 1.1339, test_loss: 1.0798, test_f1: 0.3918
 epoch: 7, train_loss: 1.1219, test_loss: 1.0805, test_f1: 0.3954
 epoch: 8, train_loss: 1.1125, test_loss: 1.0701, test_f1: 0.3912
 epoch: 9, train_loss: 1.1008, test_loss: 1.0669, test_f1: 0.4035
 epoch: 10, train_loss: 1.0998, test_loss: 1.0765, test_f1: 0.4008
 epoch: 11, train_loss: 1.0841, test_loss: 1.0653, test_f1: 0.4161
 epoch: 12, train_loss: 1.0733, test_loss: 1.0596, test_f1: 0.4077
 epoch: 13, train_loss: 1.0673, test_loss: 1.0426, test_f1: 0.4337
 epoch: 14, train_loss: 1.0556, test_loss: 1.0445, test_f1: 0.4398
 epoch: 15, train_loss: 1.0488, test_loss: 1.0580, test_f1: 0.4147
 epoch: 16, train_loss: 1.0390, test_loss: 1.0588, test_f1: 0.4318
 epoch: 17, train_loss: 1.0412, test_loss: 1.0284, test_f1: 0.4494
 epoch: 18, train_loss: 1.0340, test_loss: 1.0321, test_f1: 0.4467
 epoch: 19, train_loss: 1.0222, test_loss: 1.0331, test_f1: 0.4470
 epoch: 20, train_loss: 1.0242, test_loss: 1.0217, test_f1: 0.4560
 epoch: 21, train_loss: 1.0162, test_loss: 1.0185, test_f1: 0.4461
 epoch: 22, train_loss: 1.0134, test_loss: 1.0268, test_f1: 0.4488
 epoch: 23, train_loss: 1.0086, test_loss: 1.0373, test_f1: 0.4512
 epoch: 24, train_loss: 1.0041, test_loss: 1.0083, test_f1: 0.4609
 epoch: 25, train_loss: 1.0026, test_loss: 1.0130, test_f1: 0.4535
 epoch: 26, train_loss: 0.9974, test_loss: 1.0110, test_f1: 0.4604
 epoch: 27, train_loss: 0.9871, test_loss: 1.0033, test_f1: 0.4633
 epoch: 28, train_loss: 0.9777, test_loss: 1.0085, test_f1: 0.4552
 epoch: 29, train_loss: 0.9829, test_loss: 1.0066, test_f1: 0.4595
 epoch: 30, train_loss: 0.9743, test_loss: 0.9981, test_f1: 0.4644
 epoch: 31, train_loss: 0.9813, test_loss: 0.9913, test_f1: 0.4618
 epoch: 32, train_loss: 0.9730, test_loss: 1.0001, test_f1: 0.4692
 epoch: 33, train_loss: 0.9637, test_loss: 0.9801, test_f1: 0.4791
 epoch: 34, train_loss: 0.9592, test_loss: 0.9829, test_f1: 0.4765
 epoch: 35, train_loss: 0.9559, test_loss: 0.9838, test_f1: 0.4786
 epoch: 36, train_loss: 0.9548, test_loss: 0.9822, test_f1: 0.4839
 epoch: 37, train_loss: 0.9518, test_loss: 0.9850, test_f1: 0.4961
 epoch: 38, train_loss: 0.9462, test_loss: 0.9785, test_f1: 0.4786
 epoch: 39, train_loss: 0.9450, test_loss: 0.9700, test_f1: 0.4812
 epoch: 40, train_loss: 0.9357, test_loss: 0.9699, test_f1: 0.4890
 epoch: 41, train_loss: 0.9391, test_loss: 0.9555, test_f1: 0.4940
 epoch: 42, train_loss: 0.9303, test_loss: 0.9760, test_f1: 0.5066
 epoch: 43, train_loss: 0.9287, test_loss: 0.9696, test_f1: 0.5014
 epoch: 44, train_loss: 0.9321, test_loss: 0.9622, test_f1: 0.4992
 epoch: 45, train_loss: 0.9283, test_loss: 0.9695, test_f1: 0.5118
 epoch: 46, train_loss: 0.9201, test_loss: 0.9639, test_f1: 0.4988
 epoch: 47, train_loss: 0.9269, test_loss: 0.9726, test_f1: 0.5077
 epoch: 48, train_loss: 0.9171, test_loss: 0.9801, test_f1: 0.5051
 epoch: 49, train_loss: 0.9167, test_loss: 0.9901, test_f1: 0.5019
 epoch: 50, train_loss: 0.9113, test_loss: 0.9804, test_f1: 0.5080
 epoch: 51, train_loss: 0.9199, test_loss: 0.9739, test_f1: 0.5119
 epoch: 52, train_loss: 0.9076, test_loss: 0.9746, test_f1: 0.5102
 epoch: 53, train_loss: 0.9137, test_loss: 0.9668, test_f1: 0.5039
 epoch: 54, train_loss: 0.9122, test_loss: 0.9539, test_f1: 0.5110
 epoch: 55, train_loss: 0.9078, test_loss: 0.9605, test_f1: 0.5156
 epoch: 56, train_loss: 0.9052, test_loss: 0.9722, test_f1: 0.5135
 epoch: 57, train_loss: 0.9174, test_loss: 0.9603, test_f1: 0.5117
 epoch: 58, train_loss: 0.9053, test_loss: 0.9656, test_f1: 0.5105
 epoch: 59, train_loss: 0.9055, test_loss: 0.9543, test_f1: 0.5083
 epoch: 60, train_loss: 0.9045, test_loss: 0.9615, test_f1: 0.5152
 epoch: 61, train_loss: 0.9081, test_loss: 0.9570, test_f1: 0.5176
 epoch: 62, train_loss: 0.8959, test_loss: 0.9691, test_f1: 0.5115
 epoch: 63, train_loss: 0.9030, test_loss: 0.9562, test_f1: 0.5147
 epoch: 64, train_loss: 0.9023, test_loss: 0.9529, test_f1: 0.5156
 epoch: 65, train_loss: 0.9028, test_loss: 0.9580, test_f1: 0.5165
 epoch: 66, train_loss: 0.9002, test_loss: 0.9572, test_f1: 0.5182
 epoch: 67, train_loss: 0.8996, test_loss: 0.9639, test_f1: 0.5168
 epoch: 68, train_loss: 0.8974, test_loss: 0.9569, test_f1: 0.5206
 epoch: 69, train_loss: 0.8968, test_loss: 0.9494, test_f1: 0.5171
 epoch: 70, train_loss: 0.8879, test_loss: 0.9522, test_f1: 0.5177
 epoch: 71, train_loss: 0.8953, test_loss: 0.9499, test_f1: 0.5236
 epoch: 72, train_loss: 0.8944, test_loss: 0.9602, test_f1: 0.5120
 epoch: 73, train_loss: 0.8972, test_loss: 0.9569, test_f1: 0.5142
 epoch: 74, train_loss: 0.8877, test_loss: 0.9546, test_f1: 0.5198
 epoch: 75, train_loss: 0.8948, test_loss: 0.9669, test_f1: 0.5142
 epoch: 76, train_loss: 0.8944, test_loss: 0.9483, test_f1: 0.5272
 epoch: 77, train_loss: 0.8871, test_loss: 0.9514, test_f1: 0.5175
 epoch: 78, train_loss: 0.8905, test_loss: 0.9496, test_f1: 0.5171
 epoch: 79, train_loss: 0.8912, test_loss: 0.9631, test_f1: 0.5152
 epoch: 80, train_loss: 0.8844, test_loss: 0.9520, test_f1: 0.5178
 epoch: 81, train_loss: 0.8917, test_loss: 0.9446, test_f1: 0.5333
 epoch: 82, train_loss: 0.8849, test_loss: 0.9484, test_f1: 0.5330
 epoch: 83, train_loss: 0.8824, test_loss: 0.9502, test_f1: 0.5134
 epoch: 84, train_loss: 0.8844, test_loss: 0.9507, test_f1: 0.5250
 epoch: 85, train_loss: 0.8911, test_loss: 0.9497, test_f1: 0.5242
 epoch: 86, train_loss: 0.8817, test_loss: 0.9519, test_f1: 0.5251
 epoch: 87, train_loss: 0.8784, test_loss: 0.9473, test_f1: 0.5219
 epoch: 88, train_loss: 0.8805, test_loss: 0.9649, test_f1: 0.5224
 epoch: 89, train_loss: 0.8837, test_loss: 0.9514, test_f1: 0.5343
 epoch: 90, train_loss: 0.8806, test_loss: 0.9544, test_f1: 0.5193
 epoch: 91, train_loss: 0.8845, test_loss: 0.9500, test_f1: 0.5319
 epoch: 92, train_loss: 0.8854, test_loss: 0.9555, test_f1: 0.5281
 epoch: 93, train_loss: 0.8852, test_loss: 0.9478, test_f1: 0.5286
 epoch: 94, train_loss: 0.8804, test_loss: 0.9540, test_f1: 0.5307
 epoch: 95, train_loss: 0.8771, test_loss: 0.9620, test_f1: 0.5190
 epoch: 96, train_loss: 0.8821, test_loss: 0.9463, test_f1: 0.5365
 epoch: 97, train_loss: 0.8758, test_loss: 0.9474, test_f1: 0.5352
 epoch: 98, train_loss: 0.8826, test_loss: 0.9478, test_f1: 0.5363
 epoch: 99, train_loss: 0.8740, test_loss: 0.9551, test_f1: 0.5254
##################ITERATION #7 ****************************************
 epoch: 0, train_loss: 1.4087, test_loss: 1.3196, test_f1: 0.2270
 epoch: 1, train_loss: 1.2734, test_loss: 1.3258, test_f1: 0.2270
 epoch: 2, train_loss: 1.2408, test_loss: 1.2926, test_f1: 0.2270
 epoch: 3, train_loss: 1.2241, test_loss: 1.2372, test_f1: 0.2320
 epoch: 4, train_loss: 1.2060, test_loss: 1.1898, test_f1: 0.2959
 epoch: 5, train_loss: 1.1980, test_loss: 1.1631, test_f1: 0.3029
 epoch: 6, train_loss: 1.1810, test_loss: 1.1429, test_f1: 0.3305
 epoch: 7, train_loss: 1.1694, test_loss: 1.1289, test_f1: 0.3467
 epoch: 8, train_loss: 1.1496, test_loss: 1.1126, test_f1: 0.3667
 epoch: 9, train_loss: 1.1349, test_loss: 1.0912, test_f1: 0.3571
 epoch: 10, train_loss: 1.1229, test_loss: 1.0755, test_f1: 0.3523
 epoch: 11, train_loss: 1.1110, test_loss: 1.0647, test_f1: 0.3745
 epoch: 12, train_loss: 1.1023, test_loss: 1.0471, test_f1: 0.3965
 epoch: 13, train_loss: 1.0871, test_loss: 1.0376, test_f1: 0.4022
 epoch: 14, train_loss: 1.0801, test_loss: 1.0321, test_f1: 0.4167
 epoch: 15, train_loss: 1.0592, test_loss: 1.0179, test_f1: 0.4106
 epoch: 16, train_loss: 1.0588, test_loss: 1.0186, test_f1: 0.4241
 epoch: 17, train_loss: 1.0488, test_loss: 1.0088, test_f1: 0.4245
 epoch: 18, train_loss: 1.0357, test_loss: 1.0095, test_f1: 0.4332
 epoch: 19, train_loss: 1.0309, test_loss: 0.9995, test_f1: 0.4236
 epoch: 20, train_loss: 1.0192, test_loss: 0.9961, test_f1: 0.4448
 epoch: 21, train_loss: 1.0161, test_loss: 1.0047, test_f1: 0.4392
 epoch: 22, train_loss: 1.0100, test_loss: 1.0171, test_f1: 0.4410
 epoch: 23, train_loss: 1.0138, test_loss: 0.9987, test_f1: 0.4502
 epoch: 24, train_loss: 1.0107, test_loss: 0.9892, test_f1: 0.4333
 epoch: 25, train_loss: 0.9993, test_loss: 1.0087, test_f1: 0.4430
 epoch: 26, train_loss: 0.9881, test_loss: 1.0062, test_f1: 0.4388
 epoch: 27, train_loss: 0.9854, test_loss: 0.9746, test_f1: 0.4482
 epoch: 28, train_loss: 0.9852, test_loss: 1.0062, test_f1: 0.4349
 epoch: 29, train_loss: 0.9841, test_loss: 1.0565, test_f1: 0.4315
 epoch: 30, train_loss: 0.9798, test_loss: 0.9778, test_f1: 0.4482
 epoch: 31, train_loss: 0.9787, test_loss: 1.0312, test_f1: 0.4340
 epoch: 32, train_loss: 0.9761, test_loss: 1.0212, test_f1: 0.4386
 epoch: 33, train_loss: 0.9658, test_loss: 0.9502, test_f1: 0.4560
 epoch: 34, train_loss: 0.9689, test_loss: 1.0330, test_f1: 0.4449
 epoch: 35, train_loss: 0.9596, test_loss: 1.0420, test_f1: 0.4396
 epoch: 36, train_loss: 0.9734, test_loss: 0.9827, test_f1: 0.4584
 epoch: 37, train_loss: 0.9651, test_loss: 1.0094, test_f1: 0.4611
 epoch: 38, train_loss: 0.9568, test_loss: 0.9939, test_f1: 0.4549
 epoch: 39, train_loss: 0.9561, test_loss: 0.9821, test_f1: 0.4622
 epoch: 40, train_loss: 0.9523, test_loss: 1.0358, test_f1: 0.4528
 epoch: 41, train_loss: 0.9507, test_loss: 0.9883, test_f1: 0.4720
 epoch: 42, train_loss: 0.9459, test_loss: 1.0092, test_f1: 0.4532
 epoch: 43, train_loss: 0.9503, test_loss: 1.0098, test_f1: 0.4688
 epoch: 44, train_loss: 0.9462, test_loss: 0.9889, test_f1: 0.4792
 epoch: 45, train_loss: 0.9476, test_loss: 0.9834, test_f1: 0.4630
 epoch: 46, train_loss: 0.9321, test_loss: 0.9736, test_f1: 0.4757
 epoch: 47, train_loss: 0.9358, test_loss: 1.0139, test_f1: 0.4668
 epoch: 48, train_loss: 0.9422, test_loss: 0.9921, test_f1: 0.4765
 epoch: 49, train_loss: 0.9369, test_loss: 1.0207, test_f1: 0.4687
 epoch: 50, train_loss: 0.9325, test_loss: 1.0440, test_f1: 0.4684
 epoch: 51, train_loss: 0.9297, test_loss: 1.0037, test_f1: 0.4673
 epoch: 52, train_loss: 0.9327, test_loss: 0.9851, test_f1: 0.4762
 epoch: 53, train_loss: 0.9275, test_loss: 0.9824, test_f1: 0.4840
 epoch: 54, train_loss: 0.9192, test_loss: 1.0164, test_f1: 0.4722
 epoch: 55, train_loss: 0.9215, test_loss: 1.0006, test_f1: 0.4752
 epoch: 56, train_loss: 0.9312, test_loss: 1.0294, test_f1: 0.4753
 epoch: 57, train_loss: 0.9271, test_loss: 1.0082, test_f1: 0.4778
 epoch: 58, train_loss: 0.9276, test_loss: 0.9718, test_f1: 0.4885
 epoch: 59, train_loss: 0.9235, test_loss: 1.0206, test_f1: 0.4722
 epoch: 60, train_loss: 0.9144, test_loss: 1.0251, test_f1: 0.4760
 epoch: 61, train_loss: 0.9172, test_loss: 0.9946, test_f1: 0.4873
 epoch: 62, train_loss: 0.9184, test_loss: 0.9834, test_f1: 0.4837
 epoch: 63, train_loss: 0.9166, test_loss: 1.0377, test_f1: 0.4704
 epoch: 64, train_loss: 0.9225, test_loss: 0.9929, test_f1: 0.4810
 epoch: 65, train_loss: 0.9195, test_loss: 0.9847, test_f1: 0.4911
 epoch: 66, train_loss: 0.9147, test_loss: 1.0164, test_f1: 0.4804
 epoch: 67, train_loss: 0.9198, test_loss: 1.0075, test_f1: 0.4764
 epoch: 68, train_loss: 0.9109, test_loss: 1.0337, test_f1: 0.4638
 epoch: 69, train_loss: 0.9172, test_loss: 1.0028, test_f1: 0.4814
 epoch: 70, train_loss: 0.9135, test_loss: 0.9855, test_f1: 0.4870
 epoch: 71, train_loss: 0.9087, test_loss: 0.9998, test_f1: 0.4846
 epoch: 72, train_loss: 0.9164, test_loss: 1.0074, test_f1: 0.4736
 epoch: 73, train_loss: 0.9143, test_loss: 0.9972, test_f1: 0.4870
 epoch: 74, train_loss: 0.9180, test_loss: 1.0318, test_f1: 0.4707
 epoch: 75, train_loss: 0.9064, test_loss: 1.0018, test_f1: 0.4748
 epoch: 76, train_loss: 0.9040, test_loss: 0.9875, test_f1: 0.4780
 epoch: 77, train_loss: 0.9037, test_loss: 0.9936, test_f1: 0.4705
 epoch: 78, train_loss: 0.9071, test_loss: 0.9802, test_f1: 0.4813
 epoch: 79, train_loss: 0.9033, test_loss: 1.0064, test_f1: 0.4752
 epoch: 80, train_loss: 0.8980, test_loss: 1.0053, test_f1: 0.4769
 epoch: 81, train_loss: 0.8972, test_loss: 1.0112, test_f1: 0.4717
 epoch: 82, train_loss: 0.9047, test_loss: 1.0083, test_f1: 0.4868
 epoch: 83, train_loss: 0.9043, test_loss: 1.0104, test_f1: 0.4743
 epoch: 84, train_loss: 0.8978, test_loss: 1.0407, test_f1: 0.4722
 epoch: 85, train_loss: 0.9038, test_loss: 0.9836, test_f1: 0.4907
 epoch: 86, train_loss: 0.9059, test_loss: 1.0160, test_f1: 0.4774
 epoch: 87, train_loss: 0.9065, test_loss: 0.9891, test_f1: 0.4871
 epoch: 88, train_loss: 0.8962, test_loss: 0.9929, test_f1: 0.4882
 epoch: 89, train_loss: 0.8870, test_loss: 1.0209, test_f1: 0.4736
 epoch: 90, train_loss: 0.8945, test_loss: 0.9918, test_f1: 0.4933
 epoch: 91, train_loss: 0.8939, test_loss: 0.9917, test_f1: 0.4900
 epoch: 92, train_loss: 0.8937, test_loss: 1.0177, test_f1: 0.4812
 epoch: 93, train_loss: 0.9018, test_loss: 1.0008, test_f1: 0.4804
 epoch: 94, train_loss: 0.8952, test_loss: 0.9994, test_f1: 0.4883
 epoch: 95, train_loss: 0.8913, test_loss: 0.9769, test_f1: 0.4987
 epoch: 96, train_loss: 0.8925, test_loss: 0.9974, test_f1: 0.4839
 epoch: 97, train_loss: 0.8896, test_loss: 0.9846, test_f1: 0.4985
 epoch: 98, train_loss: 0.8886, test_loss: 0.9983, test_f1: 0.4930
 epoch: 99, train_loss: 0.8893, test_loss: 0.9991, test_f1: 0.4852
##################ITERATION #8 ****************************************
 epoch: 0, train_loss: 1.3393, test_loss: 1.3445, test_f1: 0.2270
 epoch: 1, train_loss: 1.2188, test_loss: 1.3240, test_f1: 0.2270
 epoch: 2, train_loss: 1.2032, test_loss: 1.2540, test_f1: 0.2392
 epoch: 3, train_loss: 1.1742, test_loss: 1.1737, test_f1: 0.3157
 epoch: 4, train_loss: 1.1427, test_loss: 1.1120, test_f1: 0.3380
 epoch: 5, train_loss: 1.1290, test_loss: 1.0814, test_f1: 0.3673
 epoch: 6, train_loss: 1.0944, test_loss: 1.0587, test_f1: 0.3834
 epoch: 7, train_loss: 1.0841, test_loss: 1.0461, test_f1: 0.3872
 epoch: 8, train_loss: 1.0819, test_loss: 1.0354, test_f1: 0.3918
 epoch: 9, train_loss: 1.0791, test_loss: 1.0286, test_f1: 0.4122
 epoch: 10, train_loss: 1.0569, test_loss: 1.0303, test_f1: 0.4023
 epoch: 11, train_loss: 1.0617, test_loss: 1.0222, test_f1: 0.4114
 epoch: 12, train_loss: 1.0441, test_loss: 1.0176, test_f1: 0.4324
 epoch: 13, train_loss: 1.0345, test_loss: 1.0121, test_f1: 0.4502
 epoch: 14, train_loss: 1.0302, test_loss: 1.0108, test_f1: 0.4455
 epoch: 15, train_loss: 1.0247, test_loss: 1.0010, test_f1: 0.4495
 epoch: 16, train_loss: 1.0164, test_loss: 0.9998, test_f1: 0.4549
 epoch: 17, train_loss: 1.0084, test_loss: 0.9897, test_f1: 0.4524
 epoch: 18, train_loss: 1.0051, test_loss: 0.9879, test_f1: 0.4515
 epoch: 19, train_loss: 1.0028, test_loss: 0.9773, test_f1: 0.4644
 epoch: 20, train_loss: 1.0018, test_loss: 0.9702, test_f1: 0.4566
 epoch: 21, train_loss: 0.9959, test_loss: 0.9685, test_f1: 0.4564
 epoch: 22, train_loss: 0.9986, test_loss: 0.9612, test_f1: 0.4653
 epoch: 23, train_loss: 0.9915, test_loss: 0.9602, test_f1: 0.4700
 epoch: 24, train_loss: 0.9853, test_loss: 0.9531, test_f1: 0.4583
 epoch: 25, train_loss: 0.9837, test_loss: 0.9484, test_f1: 0.4685
 epoch: 26, train_loss: 0.9785, test_loss: 0.9543, test_f1: 0.4636
 epoch: 27, train_loss: 0.9670, test_loss: 0.9510, test_f1: 0.4600
 epoch: 28, train_loss: 0.9679, test_loss: 0.9390, test_f1: 0.4740
 epoch: 29, train_loss: 0.9593, test_loss: 0.9417, test_f1: 0.4629
 epoch: 30, train_loss: 0.9586, test_loss: 0.9308, test_f1: 0.4702
 epoch: 31, train_loss: 0.9661, test_loss: 0.9319, test_f1: 0.4734
 epoch: 32, train_loss: 0.9552, test_loss: 0.9287, test_f1: 0.4699
 epoch: 33, train_loss: 0.9575, test_loss: 0.9288, test_f1: 0.4758
 epoch: 34, train_loss: 0.9420, test_loss: 0.9337, test_f1: 0.4677
 epoch: 35, train_loss: 0.9507, test_loss: 0.9445, test_f1: 0.4539
 epoch: 36, train_loss: 0.9599, test_loss: 0.9214, test_f1: 0.4854
 epoch: 37, train_loss: 0.9434, test_loss: 0.9345, test_f1: 0.4682
 epoch: 38, train_loss: 0.9507, test_loss: 0.9220, test_f1: 0.4741
 epoch: 39, train_loss: 0.9345, test_loss: 0.9195, test_f1: 0.4949
 epoch: 40, train_loss: 0.9464, test_loss: 0.9156, test_f1: 0.4981
 epoch: 41, train_loss: 0.9347, test_loss: 0.9252, test_f1: 0.4737
 epoch: 42, train_loss: 0.9388, test_loss: 0.9210, test_f1: 0.4858
 epoch: 43, train_loss: 0.9389, test_loss: 0.9219, test_f1: 0.4901
 epoch: 44, train_loss: 0.9350, test_loss: 0.9214, test_f1: 0.4831
 epoch: 45, train_loss: 0.9343, test_loss: 0.9273, test_f1: 0.4851
 epoch: 46, train_loss: 0.9330, test_loss: 0.9198, test_f1: 0.4822
 epoch: 47, train_loss: 0.9322, test_loss: 0.9260, test_f1: 0.4883
 epoch: 48, train_loss: 0.9190, test_loss: 0.9100, test_f1: 0.4860
 epoch: 49, train_loss: 0.9220, test_loss: 0.9142, test_f1: 0.4866
 epoch: 50, train_loss: 0.9197, test_loss: 0.9066, test_f1: 0.4978
 epoch: 51, train_loss: 0.9140, test_loss: 0.9091, test_f1: 0.4850
 epoch: 52, train_loss: 0.9163, test_loss: 0.9135, test_f1: 0.4892
 epoch: 53, train_loss: 0.9139, test_loss: 0.9167, test_f1: 0.4972
 epoch: 54, train_loss: 0.9120, test_loss: 0.9117, test_f1: 0.4873
 epoch: 55, train_loss: 0.9141, test_loss: 0.9168, test_f1: 0.4948
 epoch: 56, train_loss: 0.9136, test_loss: 0.9169, test_f1: 0.4932
 epoch: 57, train_loss: 0.9178, test_loss: 0.9155, test_f1: 0.4960
 epoch: 58, train_loss: 0.9159, test_loss: 0.9110, test_f1: 0.4951
 epoch: 59, train_loss: 0.9159, test_loss: 0.9122, test_f1: 0.4947
 epoch: 60, train_loss: 0.9170, test_loss: 0.9112, test_f1: 0.4964
 epoch: 61, train_loss: 0.9153, test_loss: 0.9173, test_f1: 0.4951
 epoch: 62, train_loss: 0.9172, test_loss: 0.9113, test_f1: 0.5041
 epoch: 63, train_loss: 0.8982, test_loss: 0.9209, test_f1: 0.4926
 epoch: 64, train_loss: 0.9113, test_loss: 0.9103, test_f1: 0.4968
 epoch: 65, train_loss: 0.9087, test_loss: 0.9138, test_f1: 0.4938
 epoch: 66, train_loss: 0.9020, test_loss: 0.9115, test_f1: 0.4980
 epoch: 67, train_loss: 0.9082, test_loss: 0.9009, test_f1: 0.5008
 epoch: 68, train_loss: 0.9093, test_loss: 0.9034, test_f1: 0.5043
 epoch: 69, train_loss: 0.9051, test_loss: 0.9005, test_f1: 0.5009
 epoch: 70, train_loss: 0.9070, test_loss: 0.8984, test_f1: 0.5064
 epoch: 71, train_loss: 0.8995, test_loss: 0.9013, test_f1: 0.5058
 epoch: 72, train_loss: 0.8989, test_loss: 0.9067, test_f1: 0.5002
 epoch: 73, train_loss: 0.8929, test_loss: 0.9003, test_f1: 0.5033
 epoch: 74, train_loss: 0.8953, test_loss: 0.9029, test_f1: 0.4950
 epoch: 75, train_loss: 0.8987, test_loss: 0.9039, test_f1: 0.4974
 epoch: 76, train_loss: 0.8960, test_loss: 0.8974, test_f1: 0.4992
 epoch: 77, train_loss: 0.9070, test_loss: 0.8965, test_f1: 0.4994
 epoch: 78, train_loss: 0.8925, test_loss: 0.9056, test_f1: 0.4948
 epoch: 79, train_loss: 0.8936, test_loss: 0.9015, test_f1: 0.4948
 epoch: 80, train_loss: 0.8928, test_loss: 0.8934, test_f1: 0.5029
 epoch: 81, train_loss: 0.8860, test_loss: 0.9029, test_f1: 0.4982
 epoch: 82, train_loss: 0.8983, test_loss: 0.9068, test_f1: 0.4992
 epoch: 83, train_loss: 0.8905, test_loss: 0.9005, test_f1: 0.5042
 epoch: 84, train_loss: 0.8875, test_loss: 0.8905, test_f1: 0.5049
 epoch: 85, train_loss: 0.8866, test_loss: 0.8945, test_f1: 0.5054
 epoch: 86, train_loss: 0.8922, test_loss: 0.8980, test_f1: 0.5024
 epoch: 87, train_loss: 0.8904, test_loss: 0.8989, test_f1: 0.5075
 epoch: 88, train_loss: 0.8800, test_loss: 0.8963, test_f1: 0.5121
 epoch: 89, train_loss: 0.8821, test_loss: 0.8914, test_f1: 0.5094
 epoch: 90, train_loss: 0.8881, test_loss: 0.8994, test_f1: 0.5076
 epoch: 91, train_loss: 0.8902, test_loss: 0.8961, test_f1: 0.5132
 epoch: 92, train_loss: 0.8788, test_loss: 0.8911, test_f1: 0.5125
 epoch: 93, train_loss: 0.8810, test_loss: 0.8988, test_f1: 0.5022
 epoch: 94, train_loss: 0.8849, test_loss: 0.8963, test_f1: 0.5146
 epoch: 95, train_loss: 0.8831, test_loss: 0.8998, test_f1: 0.5116
 epoch: 96, train_loss: 0.8839, test_loss: 0.8970, test_f1: 0.5110
 epoch: 97, train_loss: 0.8806, test_loss: 0.8987, test_f1: 0.5123
 epoch: 98, train_loss: 0.8846, test_loss: 0.8990, test_f1: 0.5097
 epoch: 99, train_loss: 0.8847, test_loss: 0.8896, test_f1: 0.5147
##################ITERATION #9 ****************************************
 epoch: 0, train_loss: 1.4399, test_loss: 1.3336, test_f1: 0.2270
 epoch: 1, train_loss: 1.2812, test_loss: 1.2974, test_f1: 0.2320
 epoch: 2, train_loss: 1.2467, test_loss: 1.2501, test_f1: 0.2611
 epoch: 3, train_loss: 1.2022, test_loss: 1.1936, test_f1: 0.2834
 epoch: 4, train_loss: 1.1614, test_loss: 1.1463, test_f1: 0.3383
 epoch: 5, train_loss: 1.1525, test_loss: 1.0933, test_f1: 0.3713
 epoch: 6, train_loss: 1.1205, test_loss: 1.0620, test_f1: 0.3730
 epoch: 7, train_loss: 1.0933, test_loss: 1.0497, test_f1: 0.3695
 epoch: 8, train_loss: 1.0859, test_loss: 1.0477, test_f1: 0.3861
 epoch: 9, train_loss: 1.0655, test_loss: 1.0269, test_f1: 0.3898
 epoch: 10, train_loss: 1.0746, test_loss: 1.0152, test_f1: 0.3768
 epoch: 11, train_loss: 1.0614, test_loss: 1.0029, test_f1: 0.4029
 epoch: 12, train_loss: 1.0479, test_loss: 0.9988, test_f1: 0.3982
 epoch: 13, train_loss: 1.0382, test_loss: 0.9861, test_f1: 0.3958
 epoch: 14, train_loss: 1.0355, test_loss: 0.9827, test_f1: 0.4173
 epoch: 15, train_loss: 1.0260, test_loss: 0.9748, test_f1: 0.4350
 epoch: 16, train_loss: 1.0123, test_loss: 0.9721, test_f1: 0.4352
 epoch: 17, train_loss: 1.0185, test_loss: 0.9707, test_f1: 0.4504
 epoch: 18, train_loss: 1.0056, test_loss: 0.9624, test_f1: 0.4487
 epoch: 19, train_loss: 0.9933, test_loss: 0.9609, test_f1: 0.4529
 epoch: 20, train_loss: 0.9914, test_loss: 0.9729, test_f1: 0.4581
 epoch: 21, train_loss: 0.9947, test_loss: 0.9525, test_f1: 0.4666
 epoch: 22, train_loss: 0.9840, test_loss: 0.9518, test_f1: 0.4761
 epoch: 23, train_loss: 0.9781, test_loss: 0.9627, test_f1: 0.4617
 epoch: 24, train_loss: 0.9757, test_loss: 0.9501, test_f1: 0.4811
 epoch: 25, train_loss: 0.9816, test_loss: 0.9821, test_f1: 0.4539
 epoch: 26, train_loss: 0.9718, test_loss: 0.9400, test_f1: 0.4816
 epoch: 27, train_loss: 0.9652, test_loss: 0.9421, test_f1: 0.4788
 epoch: 28, train_loss: 0.9698, test_loss: 0.9488, test_f1: 0.4774
 epoch: 29, train_loss: 0.9695, test_loss: 0.9329, test_f1: 0.5071
 epoch: 30, train_loss: 0.9539, test_loss: 0.9461, test_f1: 0.4921
 epoch: 31, train_loss: 0.9598, test_loss: 0.9986, test_f1: 0.4813
 epoch: 32, train_loss: 0.9637, test_loss: 0.9294, test_f1: 0.4914
 epoch: 33, train_loss: 0.9557, test_loss: 0.9256, test_f1: 0.4956
 epoch: 34, train_loss: 0.9569, test_loss: 0.9351, test_f1: 0.4905
 epoch: 35, train_loss: 0.9584, test_loss: 0.9279, test_f1: 0.4945
 epoch: 36, train_loss: 0.9488, test_loss: 0.9250, test_f1: 0.4975
 epoch: 37, train_loss: 0.9461, test_loss: 0.9663, test_f1: 0.4700
 epoch: 38, train_loss: 0.9396, test_loss: 0.9295, test_f1: 0.4842
 epoch: 39, train_loss: 0.9388, test_loss: 0.9196, test_f1: 0.4967
 epoch: 40, train_loss: 0.9481, test_loss: 0.9263, test_f1: 0.4861
 epoch: 41, train_loss: 0.9348, test_loss: 0.9475, test_f1: 0.4875
 epoch: 42, train_loss: 0.9380, test_loss: 0.9243, test_f1: 0.4991
 epoch: 43, train_loss: 0.9315, test_loss: 0.9176, test_f1: 0.5030
 epoch: 44, train_loss: 0.9375, test_loss: 0.9262, test_f1: 0.4886
 epoch: 45, train_loss: 0.9289, test_loss: 0.9227, test_f1: 0.4855
 epoch: 46, train_loss: 0.9275, test_loss: 0.9294, test_f1: 0.4816
 epoch: 47, train_loss: 0.9299, test_loss: 0.9269, test_f1: 0.4868
 epoch: 48, train_loss: 0.9209, test_loss: 0.9359, test_f1: 0.5006
 epoch: 49, train_loss: 0.9301, test_loss: 0.9114, test_f1: 0.5041
 epoch: 50, train_loss: 0.9241, test_loss: 0.9709, test_f1: 0.4816
 epoch: 51, train_loss: 0.9211, test_loss: 0.9248, test_f1: 0.4947
 epoch: 52, train_loss: 0.9146, test_loss: 0.9197, test_f1: 0.5013
 epoch: 53, train_loss: 0.9160, test_loss: 0.9197, test_f1: 0.5010
 epoch: 54, train_loss: 0.9068, test_loss: 0.9230, test_f1: 0.4857
 epoch: 55, train_loss: 0.9186, test_loss: 0.9181, test_f1: 0.4978
 epoch: 56, train_loss: 0.9154, test_loss: 0.9367, test_f1: 0.4940
 epoch: 57, train_loss: 0.9213, test_loss: 0.9183, test_f1: 0.4999
 epoch: 58, train_loss: 0.9213, test_loss: 0.9183, test_f1: 0.4984
 epoch: 59, train_loss: 0.9124, test_loss: 0.9290, test_f1: 0.4866
 epoch: 60, train_loss: 0.9081, test_loss: 0.9275, test_f1: 0.4949
 epoch: 61, train_loss: 0.9097, test_loss: 0.9315, test_f1: 0.4926
 epoch: 62, train_loss: 0.9071, test_loss: 0.9245, test_f1: 0.4897
 epoch: 63, train_loss: 0.9124, test_loss: 0.9189, test_f1: 0.4985
 epoch: 64, train_loss: 0.9049, test_loss: 0.9347, test_f1: 0.4910
 epoch: 65, train_loss: 0.9162, test_loss: 0.9248, test_f1: 0.4903
 epoch: 66, train_loss: 0.9063, test_loss: 0.9160, test_f1: 0.5017
 epoch: 67, train_loss: 0.9012, test_loss: 0.9149, test_f1: 0.5006
 epoch: 68, train_loss: 0.8998, test_loss: 0.9171, test_f1: 0.5038
 epoch: 69, train_loss: 0.9040, test_loss: 0.9073, test_f1: 0.5064
 epoch: 70, train_loss: 0.9075, test_loss: 0.9239, test_f1: 0.5025
 epoch: 71, train_loss: 0.9089, test_loss: 0.9130, test_f1: 0.5075
 epoch: 72, train_loss: 0.9083, test_loss: 0.9410, test_f1: 0.5017
 epoch: 73, train_loss: 0.9062, test_loss: 0.9115, test_f1: 0.5085
 epoch: 74, train_loss: 0.9075, test_loss: 0.9628, test_f1: 0.4974
 epoch: 75, train_loss: 0.9045, test_loss: 0.9166, test_f1: 0.5003
 epoch: 76, train_loss: 0.8998, test_loss: 0.9419, test_f1: 0.4965
 epoch: 77, train_loss: 0.9001, test_loss: 0.9283, test_f1: 0.4929
 epoch: 78, train_loss: 0.8952, test_loss: 0.9438, test_f1: 0.5016
 epoch: 79, train_loss: 0.9030, test_loss: 0.9216, test_f1: 0.5038
 epoch: 80, train_loss: 0.9023, test_loss: 0.9345, test_f1: 0.5034
 epoch: 81, train_loss: 0.8949, test_loss: 0.9166, test_f1: 0.4972
 epoch: 82, train_loss: 0.8945, test_loss: 0.9244, test_f1: 0.5000
 epoch: 83, train_loss: 0.8918, test_loss: 0.9139, test_f1: 0.5041
 epoch: 84, train_loss: 0.8945, test_loss: 0.9384, test_f1: 0.5084
 epoch: 85, train_loss: 0.9043, test_loss: 0.9270, test_f1: 0.5062
 epoch: 86, train_loss: 0.8966, test_loss: 0.9323, test_f1: 0.5030
 epoch: 87, train_loss: 0.8995, test_loss: 0.9314, test_f1: 0.4918
 epoch: 88, train_loss: 0.8956, test_loss: 0.9266, test_f1: 0.5083
 epoch: 89, train_loss: 0.8915, test_loss: 0.9264, test_f1: 0.5118
 epoch: 90, train_loss: 0.8909, test_loss: 0.9229, test_f1: 0.5059
 epoch: 91, train_loss: 0.8912, test_loss: 0.9089, test_f1: 0.5194
 epoch: 92, train_loss: 0.8858, test_loss: 0.9224, test_f1: 0.5090
 epoch: 93, train_loss: 0.8905, test_loss: 0.9148, test_f1: 0.5107
 epoch: 94, train_loss: 0.8835, test_loss: 0.9305, test_f1: 0.5064
 epoch: 95, train_loss: 0.8803, test_loss: 0.9368, test_f1: 0.5027
 epoch: 96, train_loss: 0.8808, test_loss: 0.9247, test_f1: 0.5076
 epoch: 97, train_loss: 0.8814, test_loss: 0.9342, test_f1: 0.5061
 epoch: 98, train_loss: 0.8906, test_loss: 0.9282, test_f1: 0.5107
 epoch: 99, train_loss: 0.9014, test_loss: 0.9335, test_f1: 0.5064

Training completed in 370.65 seconds
Best F1: 0.5392 at epoch 92
Mean F1 across iterations: 0.5240  0.0128
========================FINAL RESULTS================================
FEGIN weighted F1: 0.5392  0.0128
python main.py --data ltspice_examples --representation component_net --model FEGIN --layers 2 --hiddens 16 --batch_size 256 --lr 0.001 --emb_size 250 --epochs 100 --save_appendix component_net_L2_H16_BS256_LR0.001_E250 --no_val
-----



STDERR:
  File "main.py", line 370, in <module>
    main()
  File "main.py", line 254, in main
    dataset = dataset_class(
  File "/home/philip/projects/ltspice_examples_code_repo/Circuit-Completion-Using-GNNs/component_classification_with_link_prediction_head/evaluation/FEGIN/kernel/circuit_datasets.py", line 15, in __init__
    self.data, self.slices = torch.load(self.processed_paths[0])
  File "/home/philip/.local/lib/python3.8/site-packages/torch/serialization.py", line 1040, in load
    warnings.warn(
  File "/usr/lib/python3.8/warnings.py", line 109, in _showwarnmsg
    sw(msg.message, msg.category, msg.filename, msg.lineno,
  File "main.py", line 47, in warn_with_traceback
    traceback.print_stack(file=log)
/home/philip/projects/ltspice_examples_code_repo/Circuit-Completion-Using-GNNs/component_classification_with_link_prediction_head/evaluation/FEGIN/kernel/circuit_datasets.py:15: FutureWarning: You are using `torch.load` with `weights_only=False` (the current default value), which uses the default pickle module implicitly. It is possible to construct malicious pickle data which will execute arbitrary code during unpickling (See https://github.com/pytorch/pytorch/blob/main/SECURITY.md#untrusted-models for more details). In a future release, the default value for `weights_only` will be flipped to `True`. This limits the functions that could be executed during unpickling. Arbitrary objects will no longer be allowed to be loaded via this mode unless they are explicitly allowlisted by the user via `torch.serialization.add_safe_globals`. We recommend you start setting `weights_only=True` for any use case where you don't have full control of the loaded file. Please open an issue on GitHub for any issues related to this experimental feature.
  self.data, self.slices = torch.load(self.processed_paths[0])
