STDOUT:
Results will be saved in /home/philip/projects/ltspice_examples_code_repo/Circuit-Completion-Using-GNNs/component_classification_with_link_prediction_head/evaluation/FEGIN/results/model_FEGIN_dataset_ltspice_demos
Command line input: python main.py --data ltspice_demos --representation component_net --model FEGIN --layers 2 --hiddens 64 --batch_size 64 --lr 0.0001 --emb_size 128 --epochs 100 --save_appendix component_net_L2_H64_BS64_LR0.0001_E128 --no_val
 is saved.
-----
ltspice_demos - FEGIN
Using 2 layers, 64 hidden units, h = 2
Loading component_net representation dataset
ENTERED
Training FEGIN on component_net representation
Train: 1565, Test: 383
##################ITERATION #0 ****************************************
 epoch: 0, train_loss: 1.3706, test_loss: 1.3641, test_f1: 0.2281
 epoch: 1, train_loss: 1.3594, test_loss: 1.3595, test_f1: 0.2281
 epoch: 2, train_loss: 1.3531, test_loss: 1.3543, test_f1: 0.2281
 epoch: 3, train_loss: 1.3457, test_loss: 1.3491, test_f1: 0.2281
 epoch: 4, train_loss: 1.3373, test_loss: 1.3428, test_f1: 0.2281
 epoch: 5, train_loss: 1.3277, test_loss: 1.3358, test_f1: 0.2281
 epoch: 6, train_loss: 1.3146, test_loss: 1.3270, test_f1: 0.2281
 epoch: 7, train_loss: 1.2989, test_loss: 1.3169, test_f1: 0.2281
 epoch: 8, train_loss: 1.2836, test_loss: 1.3045, test_f1: 0.2629
 epoch: 9, train_loss: 1.2626, test_loss: 1.2913, test_f1: 0.2720
 epoch: 10, train_loss: 1.2430, test_loss: 1.2775, test_f1: 0.2720
 epoch: 11, train_loss: 1.2220, test_loss: 1.2629, test_f1: 0.2720
 epoch: 12, train_loss: 1.2066, test_loss: 1.2506, test_f1: 0.2912
 epoch: 13, train_loss: 1.1854, test_loss: 1.2395, test_f1: 0.3258
 epoch: 14, train_loss: 1.1736, test_loss: 1.2286, test_f1: 0.3256
 epoch: 15, train_loss: 1.1601, test_loss: 1.2197, test_f1: 0.3309
 epoch: 16, train_loss: 1.1470, test_loss: 1.2116, test_f1: 0.3368
 epoch: 17, train_loss: 1.1367, test_loss: 1.2049, test_f1: 0.3436
 epoch: 18, train_loss: 1.1251, test_loss: 1.1965, test_f1: 0.3494
 epoch: 19, train_loss: 1.1134, test_loss: 1.1884, test_f1: 0.3546
 epoch: 20, train_loss: 1.0984, test_loss: 1.1843, test_f1: 0.3686
 epoch: 21, train_loss: 1.0933, test_loss: 1.1795, test_f1: 0.3783
 epoch: 22, train_loss: 1.0839, test_loss: 1.1733, test_f1: 0.3825
 epoch: 23, train_loss: 1.0766, test_loss: 1.1639, test_f1: 0.3860
 epoch: 24, train_loss: 1.0644, test_loss: 1.1641, test_f1: 0.3910
 epoch: 25, train_loss: 1.0662, test_loss: 1.1545, test_f1: 0.3948
 epoch: 26, train_loss: 1.0489, test_loss: 1.1559, test_f1: 0.3971
 epoch: 27, train_loss: 1.0482, test_loss: 1.1417, test_f1: 0.3928
 epoch: 28, train_loss: 1.0348, test_loss: 1.1445, test_f1: 0.4024
 epoch: 29, train_loss: 1.0339, test_loss: 1.1425, test_f1: 0.4080
 epoch: 30, train_loss: 1.0285, test_loss: 1.1327, test_f1: 0.4266
 epoch: 31, train_loss: 1.0209, test_loss: 1.1296, test_f1: 0.4151
 epoch: 32, train_loss: 1.0111, test_loss: 1.1279, test_f1: 0.4159
 epoch: 33, train_loss: 1.0038, test_loss: 1.1233, test_f1: 0.4354
 epoch: 34, train_loss: 1.0073, test_loss: 1.1157, test_f1: 0.4282
 epoch: 35, train_loss: 1.0001, test_loss: 1.1122, test_f1: 0.4614
 epoch: 36, train_loss: 0.9943, test_loss: 1.1161, test_f1: 0.4566
 epoch: 37, train_loss: 0.9842, test_loss: 1.1063, test_f1: 0.4611
 epoch: 38, train_loss: 0.9868, test_loss: 1.1053, test_f1: 0.4664
 epoch: 39, train_loss: 0.9724, test_loss: 1.1205, test_f1: 0.4603
 epoch: 40, train_loss: 0.9699, test_loss: 1.1018, test_f1: 0.4593
 epoch: 41, train_loss: 0.9655, test_loss: 1.0997, test_f1: 0.4625
 epoch: 42, train_loss: 0.9652, test_loss: 1.0963, test_f1: 0.4674
 epoch: 43, train_loss: 0.9514, test_loss: 1.1085, test_f1: 0.4674
 epoch: 44, train_loss: 0.9589, test_loss: 1.0962, test_f1: 0.4643
 epoch: 45, train_loss: 0.9527, test_loss: 1.0804, test_f1: 0.4683
 epoch: 46, train_loss: 0.9419, test_loss: 1.0963, test_f1: 0.4695
 epoch: 47, train_loss: 0.9420, test_loss: 1.0920, test_f1: 0.4836
 epoch: 48, train_loss: 0.9355, test_loss: 1.0863, test_f1: 0.4747
 epoch: 49, train_loss: 0.9336, test_loss: 1.0915, test_f1: 0.4663
 epoch: 50, train_loss: 0.9266, test_loss: 1.0902, test_f1: 0.4816
 epoch: 51, train_loss: 0.9232, test_loss: 1.0821, test_f1: 0.4827
 epoch: 52, train_loss: 0.9204, test_loss: 1.0872, test_f1: 0.4783
 epoch: 53, train_loss: 0.9315, test_loss: 1.0942, test_f1: 0.4822
 epoch: 54, train_loss: 0.9207, test_loss: 1.0782, test_f1: 0.4780
 epoch: 55, train_loss: 0.9199, test_loss: 1.0831, test_f1: 0.4831
 epoch: 56, train_loss: 0.9167, test_loss: 1.0730, test_f1: 0.4904
 epoch: 57, train_loss: 0.9207, test_loss: 1.0745, test_f1: 0.4811
 epoch: 58, train_loss: 0.9085, test_loss: 1.0851, test_f1: 0.4821
 epoch: 59, train_loss: 0.9056, test_loss: 1.0786, test_f1: 0.4911
 epoch: 60, train_loss: 0.9113, test_loss: 1.0648, test_f1: 0.4997
 epoch: 61, train_loss: 0.9038, test_loss: 1.0770, test_f1: 0.5000
 epoch: 62, train_loss: 0.9165, test_loss: 1.0759, test_f1: 0.4969
 epoch: 63, train_loss: 0.8962, test_loss: 1.0806, test_f1: 0.4983
 epoch: 64, train_loss: 0.9027, test_loss: 1.0812, test_f1: 0.4908
 epoch: 65, train_loss: 0.9016, test_loss: 1.0812, test_f1: 0.4952
 epoch: 66, train_loss: 0.8939, test_loss: 1.0871, test_f1: 0.5021
 epoch: 67, train_loss: 0.8994, test_loss: 1.0945, test_f1: 0.4951
 epoch: 68, train_loss: 0.8982, test_loss: 1.0834, test_f1: 0.4951
 epoch: 69, train_loss: 0.8938, test_loss: 1.0823, test_f1: 0.5031
 epoch: 70, train_loss: 0.8952, test_loss: 1.0744, test_f1: 0.5072
 epoch: 71, train_loss: 0.8980, test_loss: 1.0836, test_f1: 0.4991
 epoch: 72, train_loss: 0.8916, test_loss: 1.0987, test_f1: 0.4959
 epoch: 73, train_loss: 0.8914, test_loss: 1.0980, test_f1: 0.4969
 epoch: 74, train_loss: 0.8841, test_loss: 1.0824, test_f1: 0.5015
 epoch: 75, train_loss: 0.8903, test_loss: 1.0921, test_f1: 0.4986
 epoch: 76, train_loss: 0.8900, test_loss: 1.0850, test_f1: 0.4994
 epoch: 77, train_loss: 0.8933, test_loss: 1.0793, test_f1: 0.5020
 epoch: 78, train_loss: 0.8910, test_loss: 1.0889, test_f1: 0.5081
 epoch: 79, train_loss: 0.8921, test_loss: 1.0841, test_f1: 0.5056
 epoch: 80, train_loss: 0.8807, test_loss: 1.1050, test_f1: 0.5255
 epoch: 81, train_loss: 0.8815, test_loss: 1.0934, test_f1: 0.4960
 epoch: 82, train_loss: 0.8809, test_loss: 1.0997, test_f1: 0.4996
 epoch: 83, train_loss: 0.8734, test_loss: 1.0931, test_f1: 0.5131
 epoch: 84, train_loss: 0.8720, test_loss: 1.0956, test_f1: 0.5011
 epoch: 85, train_loss: 0.8686, test_loss: 1.0819, test_f1: 0.5044
 epoch: 86, train_loss: 0.8726, test_loss: 1.0953, test_f1: 0.5056
 epoch: 87, train_loss: 0.8763, test_loss: 1.0935, test_f1: 0.5074
 epoch: 88, train_loss: 0.8793, test_loss: 1.0949, test_f1: 0.5078
 epoch: 89, train_loss: 0.8700, test_loss: 1.1028, test_f1: 0.5046
 epoch: 90, train_loss: 0.8765, test_loss: 1.1061, test_f1: 0.5110
 epoch: 91, train_loss: 0.8576, test_loss: 1.0934, test_f1: 0.5126
 epoch: 92, train_loss: 0.8609, test_loss: 1.1012, test_f1: 0.5112
 epoch: 93, train_loss: 0.8752, test_loss: 1.1104, test_f1: 0.5151
 epoch: 94, train_loss: 0.8561, test_loss: 1.1157, test_f1: 0.5051
 epoch: 95, train_loss: 0.8719, test_loss: 1.1059, test_f1: 0.5144
 epoch: 96, train_loss: 0.8629, test_loss: 1.1086, test_f1: 0.5250
 epoch: 97, train_loss: 0.8576, test_loss: 1.0915, test_f1: 0.5221
 epoch: 98, train_loss: 0.8549, test_loss: 1.0894, test_f1: 0.5339
 epoch: 99, train_loss: 0.8487, test_loss: 1.1038, test_f1: 0.5314
##################ITERATION #1 ****************************************
 epoch: 0, train_loss: 1.3115, test_loss: 1.3314, test_f1: 0.2281
 epoch: 1, train_loss: 1.2716, test_loss: 1.3150, test_f1: 0.2281
 epoch: 2, train_loss: 1.2509, test_loss: 1.2922, test_f1: 0.2281
 epoch: 3, train_loss: 1.2263, test_loss: 1.2740, test_f1: 0.2639
 epoch: 4, train_loss: 1.2039, test_loss: 1.2607, test_f1: 0.2744
 epoch: 5, train_loss: 1.1882, test_loss: 1.2479, test_f1: 0.2794
 epoch: 6, train_loss: 1.1737, test_loss: 1.2388, test_f1: 0.2784
 epoch: 7, train_loss: 1.1592, test_loss: 1.2264, test_f1: 0.2861
 epoch: 8, train_loss: 1.1416, test_loss: 1.2144, test_f1: 0.3065
 epoch: 9, train_loss: 1.1232, test_loss: 1.2026, test_f1: 0.3648
 epoch: 10, train_loss: 1.1164, test_loss: 1.1928, test_f1: 0.3788
 epoch: 11, train_loss: 1.1006, test_loss: 1.1810, test_f1: 0.3790
 epoch: 12, train_loss: 1.0918, test_loss: 1.1701, test_f1: 0.3842
 epoch: 13, train_loss: 1.0829, test_loss: 1.1645, test_f1: 0.3937
 epoch: 14, train_loss: 1.0752, test_loss: 1.1602, test_f1: 0.4120
 epoch: 15, train_loss: 1.0643, test_loss: 1.1531, test_f1: 0.4030
 epoch: 16, train_loss: 1.0518, test_loss: 1.1446, test_f1: 0.4088
 epoch: 17, train_loss: 1.0428, test_loss: 1.1371, test_f1: 0.4233
 epoch: 18, train_loss: 1.0329, test_loss: 1.1306, test_f1: 0.4172
 epoch: 19, train_loss: 1.0277, test_loss: 1.1218, test_f1: 0.4168
 epoch: 20, train_loss: 1.0226, test_loss: 1.1220, test_f1: 0.4197
 epoch: 21, train_loss: 1.0114, test_loss: 1.1079, test_f1: 0.4172
 epoch: 22, train_loss: 1.0137, test_loss: 1.1044, test_f1: 0.4166
 epoch: 23, train_loss: 0.9940, test_loss: 1.1085, test_f1: 0.4267
 epoch: 24, train_loss: 0.9997, test_loss: 1.0901, test_f1: 0.4224
 epoch: 25, train_loss: 0.9904, test_loss: 1.0919, test_f1: 0.4359
 epoch: 26, train_loss: 0.9814, test_loss: 1.0897, test_f1: 0.4389
 epoch: 27, train_loss: 0.9679, test_loss: 1.0814, test_f1: 0.4687
 epoch: 28, train_loss: 0.9666, test_loss: 1.0720, test_f1: 0.4674
 epoch: 29, train_loss: 0.9611, test_loss: 1.0810, test_f1: 0.4636
 epoch: 30, train_loss: 0.9630, test_loss: 1.0698, test_f1: 0.4808
 epoch: 31, train_loss: 0.9551, test_loss: 1.0605, test_f1: 0.4950
 epoch: 32, train_loss: 0.9519, test_loss: 1.0587, test_f1: 0.4823
 epoch: 33, train_loss: 0.9429, test_loss: 1.0686, test_f1: 0.5132
 epoch: 34, train_loss: 0.9419, test_loss: 1.0494, test_f1: 0.4886
 epoch: 35, train_loss: 0.9338, test_loss: 1.0695, test_f1: 0.4928
 epoch: 36, train_loss: 0.9294, test_loss: 1.0459, test_f1: 0.4924
 epoch: 37, train_loss: 0.9249, test_loss: 1.0663, test_f1: 0.5244
 epoch: 38, train_loss: 0.9232, test_loss: 1.0537, test_f1: 0.5155
 epoch: 39, train_loss: 0.9196, test_loss: 1.0559, test_f1: 0.4950
 epoch: 40, train_loss: 0.9227, test_loss: 1.0511, test_f1: 0.5138
 epoch: 41, train_loss: 0.9135, test_loss: 1.0487, test_f1: 0.5048
 epoch: 42, train_loss: 0.9035, test_loss: 1.0535, test_f1: 0.5022
 epoch: 43, train_loss: 0.9037, test_loss: 1.0420, test_f1: 0.5287
 epoch: 44, train_loss: 0.9016, test_loss: 1.0609, test_f1: 0.5060
 epoch: 45, train_loss: 0.8982, test_loss: 1.0506, test_f1: 0.5238
 epoch: 46, train_loss: 0.8960, test_loss: 1.0541, test_f1: 0.5228
 epoch: 47, train_loss: 0.8884, test_loss: 1.0464, test_f1: 0.5372
 epoch: 48, train_loss: 0.8813, test_loss: 1.0516, test_f1: 0.5272
 epoch: 49, train_loss: 0.8956, test_loss: 1.0459, test_f1: 0.5282
 epoch: 50, train_loss: 0.8865, test_loss: 1.0634, test_f1: 0.5430
 epoch: 51, train_loss: 0.8854, test_loss: 1.0575, test_f1: 0.5458
 epoch: 52, train_loss: 0.8778, test_loss: 1.0573, test_f1: 0.5451
 epoch: 53, train_loss: 0.8704, test_loss: 1.0579, test_f1: 0.5506
 epoch: 54, train_loss: 0.8848, test_loss: 1.0603, test_f1: 0.5504
 epoch: 55, train_loss: 0.8779, test_loss: 1.0625, test_f1: 0.5441
 epoch: 56, train_loss: 0.8801, test_loss: 1.0636, test_f1: 0.5467
 epoch: 57, train_loss: 0.8725, test_loss: 1.0601, test_f1: 0.5440
 epoch: 58, train_loss: 0.8659, test_loss: 1.0547, test_f1: 0.5504
 epoch: 59, train_loss: 0.8639, test_loss: 1.0704, test_f1: 0.5532
 epoch: 60, train_loss: 0.8712, test_loss: 1.0573, test_f1: 0.5450
 epoch: 61, train_loss: 0.8656, test_loss: 1.0526, test_f1: 0.5502
 epoch: 62, train_loss: 0.8598, test_loss: 1.0582, test_f1: 0.5478
 epoch: 63, train_loss: 0.8528, test_loss: 1.0527, test_f1: 0.5526
 epoch: 64, train_loss: 0.8724, test_loss: 1.0645, test_f1: 0.5434
 epoch: 65, train_loss: 0.8593, test_loss: 1.0591, test_f1: 0.5534
 epoch: 66, train_loss: 0.8655, test_loss: 1.0562, test_f1: 0.5594
 epoch: 67, train_loss: 0.8693, test_loss: 1.0552, test_f1: 0.5579
 epoch: 68, train_loss: 0.8601, test_loss: 1.0526, test_f1: 0.5486
 epoch: 69, train_loss: 0.8621, test_loss: 1.0502, test_f1: 0.5561
 epoch: 70, train_loss: 0.8605, test_loss: 1.0617, test_f1: 0.5583
 epoch: 71, train_loss: 0.8579, test_loss: 1.0524, test_f1: 0.5443
 epoch: 72, train_loss: 0.8556, test_loss: 1.0593, test_f1: 0.5548
 epoch: 73, train_loss: 0.8545, test_loss: 1.0734, test_f1: 0.5549
 epoch: 74, train_loss: 0.8573, test_loss: 1.0418, test_f1: 0.5537
 epoch: 75, train_loss: 0.8521, test_loss: 1.0643, test_f1: 0.5449
 epoch: 76, train_loss: 0.8648, test_loss: 1.0697, test_f1: 0.5564
 epoch: 77, train_loss: 0.8577, test_loss: 1.0731, test_f1: 0.5557
 epoch: 78, train_loss: 0.8492, test_loss: 1.0635, test_f1: 0.5470
 epoch: 79, train_loss: 0.8462, test_loss: 1.0652, test_f1: 0.5574
 epoch: 80, train_loss: 0.8566, test_loss: 1.0655, test_f1: 0.5448
 epoch: 81, train_loss: 0.8494, test_loss: 1.0681, test_f1: 0.5654
 epoch: 82, train_loss: 0.8506, test_loss: 1.0525, test_f1: 0.5596
 epoch: 83, train_loss: 0.8416, test_loss: 1.0580, test_f1: 0.5688
 epoch: 84, train_loss: 0.8459, test_loss: 1.0705, test_f1: 0.5455
 epoch: 85, train_loss: 0.8394, test_loss: 1.0648, test_f1: 0.5603
 epoch: 86, train_loss: 0.8465, test_loss: 1.0492, test_f1: 0.5611
 epoch: 87, train_loss: 0.8396, test_loss: 1.0722, test_f1: 0.5539
 epoch: 88, train_loss: 0.8427, test_loss: 1.0728, test_f1: 0.5541
 epoch: 89, train_loss: 0.8440, test_loss: 1.0806, test_f1: 0.5584
 epoch: 90, train_loss: 0.8368, test_loss: 1.0705, test_f1: 0.5507
 epoch: 91, train_loss: 0.8315, test_loss: 1.0750, test_f1: 0.5619
 epoch: 92, train_loss: 0.8342, test_loss: 1.0828, test_f1: 0.5594
 epoch: 93, train_loss: 0.8413, test_loss: 1.0793, test_f1: 0.5698
 epoch: 94, train_loss: 0.8309, test_loss: 1.0774, test_f1: 0.5548
 epoch: 95, train_loss: 0.8352, test_loss: 1.0805, test_f1: 0.5549
 epoch: 96, train_loss: 0.8261, test_loss: 1.0724, test_f1: 0.5669
 epoch: 97, train_loss: 0.8293, test_loss: 1.0889, test_f1: 0.5538
 epoch: 98, train_loss: 0.8187, test_loss: 1.0791, test_f1: 0.5640
 epoch: 99, train_loss: 0.8213, test_loss: 1.0695, test_f1: 0.5625
##################ITERATION #2 ****************************************
 epoch: 0, train_loss: 1.3062, test_loss: 1.3207, test_f1: 0.2281
 epoch: 1, train_loss: 1.2412, test_loss: 1.2865, test_f1: 0.2281
 epoch: 2, train_loss: 1.2148, test_loss: 1.2574, test_f1: 0.2336
 epoch: 3, train_loss: 1.1913, test_loss: 1.2359, test_f1: 0.2390
 epoch: 4, train_loss: 1.1648, test_loss: 1.2192, test_f1: 0.2857
 epoch: 5, train_loss: 1.1449, test_loss: 1.2034, test_f1: 0.3026
 epoch: 6, train_loss: 1.1264, test_loss: 1.1896, test_f1: 0.3466
 epoch: 7, train_loss: 1.1087, test_loss: 1.1816, test_f1: 0.3454
 epoch: 8, train_loss: 1.0958, test_loss: 1.1711, test_f1: 0.3508
 epoch: 9, train_loss: 1.0845, test_loss: 1.1637, test_f1: 0.3535
 epoch: 10, train_loss: 1.0689, test_loss: 1.1593, test_f1: 0.3517
 epoch: 11, train_loss: 1.0696, test_loss: 1.1518, test_f1: 0.3536
 epoch: 12, train_loss: 1.0590, test_loss: 1.1494, test_f1: 0.3519
 epoch: 13, train_loss: 1.0450, test_loss: 1.1436, test_f1: 0.3519
 epoch: 14, train_loss: 1.0355, test_loss: 1.1359, test_f1: 0.3541
 epoch: 15, train_loss: 1.0385, test_loss: 1.1256, test_f1: 0.3564
 epoch: 16, train_loss: 1.0362, test_loss: 1.1269, test_f1: 0.3706
 epoch: 17, train_loss: 1.0165, test_loss: 1.1275, test_f1: 0.3839
 epoch: 18, train_loss: 1.0138, test_loss: 1.1267, test_f1: 0.4261
 epoch: 19, train_loss: 1.0149, test_loss: 1.1170, test_f1: 0.4306
 epoch: 20, train_loss: 1.0169, test_loss: 1.1126, test_f1: 0.4328
 epoch: 21, train_loss: 1.0016, test_loss: 1.1073, test_f1: 0.4254
 epoch: 22, train_loss: 1.0008, test_loss: 1.1105, test_f1: 0.4372
 epoch: 23, train_loss: 0.9884, test_loss: 1.0951, test_f1: 0.4547
 epoch: 24, train_loss: 0.9821, test_loss: 1.1003, test_f1: 0.4608
 epoch: 25, train_loss: 0.9825, test_loss: 1.0860, test_f1: 0.4611
 epoch: 26, train_loss: 0.9705, test_loss: 1.0859, test_f1: 0.4582
 epoch: 27, train_loss: 0.9611, test_loss: 1.0890, test_f1: 0.4557
 epoch: 28, train_loss: 0.9643, test_loss: 1.0809, test_f1: 0.4976
 epoch: 29, train_loss: 0.9649, test_loss: 1.0791, test_f1: 0.4672
 epoch: 30, train_loss: 0.9519, test_loss: 1.0727, test_f1: 0.4809
 epoch: 31, train_loss: 0.9529, test_loss: 1.0717, test_f1: 0.4724
 epoch: 32, train_loss: 0.9480, test_loss: 1.0703, test_f1: 0.4720
 epoch: 33, train_loss: 0.9496, test_loss: 1.0600, test_f1: 0.4932
 epoch: 34, train_loss: 0.9334, test_loss: 1.0691, test_f1: 0.4830
 epoch: 35, train_loss: 0.9279, test_loss: 1.0737, test_f1: 0.4828
 epoch: 36, train_loss: 0.9294, test_loss: 1.0606, test_f1: 0.4938
 epoch: 37, train_loss: 0.9098, test_loss: 1.0628, test_f1: 0.4888
 epoch: 38, train_loss: 0.9234, test_loss: 1.0598, test_f1: 0.5160
 epoch: 39, train_loss: 0.9190, test_loss: 1.0693, test_f1: 0.4958
 epoch: 40, train_loss: 0.9141, test_loss: 1.0618, test_f1: 0.5214
 epoch: 41, train_loss: 0.9107, test_loss: 1.0864, test_f1: 0.5224
 epoch: 42, train_loss: 0.9084, test_loss: 1.0611, test_f1: 0.5137
 epoch: 43, train_loss: 0.9015, test_loss: 1.0701, test_f1: 0.5105
 epoch: 44, train_loss: 0.9028, test_loss: 1.0815, test_f1: 0.5076
 epoch: 45, train_loss: 0.8858, test_loss: 1.0702, test_f1: 0.5178
 epoch: 46, train_loss: 0.8941, test_loss: 1.0703, test_f1: 0.5032
 epoch: 47, train_loss: 0.8823, test_loss: 1.0645, test_f1: 0.4948
 epoch: 48, train_loss: 0.8962, test_loss: 1.0816, test_f1: 0.5066
 epoch: 49, train_loss: 0.8833, test_loss: 1.0958, test_f1: 0.5025
 epoch: 50, train_loss: 0.8809, test_loss: 1.1021, test_f1: 0.5130
 epoch: 51, train_loss: 0.8809, test_loss: 1.0846, test_f1: 0.5023
 epoch: 52, train_loss: 0.8756, test_loss: 1.0885, test_f1: 0.5305
 epoch: 53, train_loss: 0.8758, test_loss: 1.0885, test_f1: 0.5023
 epoch: 54, train_loss: 0.8676, test_loss: 1.1044, test_f1: 0.5067
 epoch: 55, train_loss: 0.8644, test_loss: 1.1025, test_f1: 0.5077
 epoch: 56, train_loss: 0.8620, test_loss: 1.0924, test_f1: 0.5118
 epoch: 57, train_loss: 0.8639, test_loss: 1.0984, test_f1: 0.5066
 epoch: 58, train_loss: 0.8649, test_loss: 1.1016, test_f1: 0.5057
 epoch: 59, train_loss: 0.8636, test_loss: 1.1170, test_f1: 0.5124
 epoch: 60, train_loss: 0.8644, test_loss: 1.0993, test_f1: 0.5070
 epoch: 61, train_loss: 0.8709, test_loss: 1.1092, test_f1: 0.5223
 epoch: 62, train_loss: 0.8578, test_loss: 1.1082, test_f1: 0.5035
 epoch: 63, train_loss: 0.8623, test_loss: 1.1201, test_f1: 0.4973
 epoch: 64, train_loss: 0.8491, test_loss: 1.1297, test_f1: 0.5066
 epoch: 65, train_loss: 0.8638, test_loss: 1.1166, test_f1: 0.5087
 epoch: 66, train_loss: 0.8650, test_loss: 1.1205, test_f1: 0.5101
 epoch: 67, train_loss: 0.8518, test_loss: 1.1179, test_f1: 0.5140
 epoch: 68, train_loss: 0.8596, test_loss: 1.1161, test_f1: 0.5142
 epoch: 69, train_loss: 0.8457, test_loss: 1.1229, test_f1: 0.5132
 epoch: 70, train_loss: 0.8605, test_loss: 1.1234, test_f1: 0.5215
 epoch: 71, train_loss: 0.8421, test_loss: 1.1202, test_f1: 0.5141
 epoch: 72, train_loss: 0.8443, test_loss: 1.1182, test_f1: 0.5173
 epoch: 73, train_loss: 0.8466, test_loss: 1.1173, test_f1: 0.5303
 epoch: 74, train_loss: 0.8401, test_loss: 1.1225, test_f1: 0.5228
 epoch: 75, train_loss: 0.8458, test_loss: 1.1368, test_f1: 0.5278
 epoch: 76, train_loss: 0.8423, test_loss: 1.1420, test_f1: 0.5234
 epoch: 77, train_loss: 0.8372, test_loss: 1.1209, test_f1: 0.5293
 epoch: 78, train_loss: 0.8360, test_loss: 1.1272, test_f1: 0.5114
 epoch: 79, train_loss: 0.8429, test_loss: 1.1276, test_f1: 0.5167
 epoch: 80, train_loss: 0.8480, test_loss: 1.1262, test_f1: 0.5245
 epoch: 81, train_loss: 0.8463, test_loss: 1.1509, test_f1: 0.5275
 epoch: 82, train_loss: 0.8371, test_loss: 1.1453, test_f1: 0.5291
 epoch: 83, train_loss: 0.8406, test_loss: 1.1517, test_f1: 0.5053
 epoch: 84, train_loss: 0.8237, test_loss: 1.1526, test_f1: 0.5299
 epoch: 85, train_loss: 0.8294, test_loss: 1.1483, test_f1: 0.5122
 epoch: 86, train_loss: 0.8377, test_loss: 1.1430, test_f1: 0.5145
 epoch: 87, train_loss: 0.8290, test_loss: 1.1367, test_f1: 0.5119
 epoch: 88, train_loss: 0.8307, test_loss: 1.1492, test_f1: 0.5164
 epoch: 89, train_loss: 0.8276, test_loss: 1.1534, test_f1: 0.5312
 epoch: 90, train_loss: 0.8387, test_loss: 1.1561, test_f1: 0.5154
 epoch: 91, train_loss: 0.8249, test_loss: 1.1562, test_f1: 0.5207
 epoch: 92, train_loss: 0.8227, test_loss: 1.1512, test_f1: 0.5317
 epoch: 93, train_loss: 0.8313, test_loss: 1.1703, test_f1: 0.5271
 epoch: 94, train_loss: 0.8286, test_loss: 1.1463, test_f1: 0.5386
 epoch: 95, train_loss: 0.8180, test_loss: 1.1518, test_f1: 0.5289
 epoch: 96, train_loss: 0.8291, test_loss: 1.1649, test_f1: 0.5148
 epoch: 97, train_loss: 0.8235, test_loss: 1.1685, test_f1: 0.5216
 epoch: 98, train_loss: 0.8213, test_loss: 1.1745, test_f1: 0.5140
 epoch: 99, train_loss: 0.8145, test_loss: 1.1584, test_f1: 0.5320
##################ITERATION #3 ****************************************
 epoch: 0, train_loss: 1.2540, test_loss: 1.3011, test_f1: 0.2281
 epoch: 1, train_loss: 1.1979, test_loss: 1.2799, test_f1: 0.2281
 epoch: 2, train_loss: 1.1703, test_loss: 1.2517, test_f1: 0.2744
 epoch: 3, train_loss: 1.1503, test_loss: 1.2242, test_f1: 0.3117
 epoch: 4, train_loss: 1.1285, test_loss: 1.2109, test_f1: 0.3339
 epoch: 5, train_loss: 1.1215, test_loss: 1.1997, test_f1: 0.3546
 epoch: 6, train_loss: 1.1095, test_loss: 1.1912, test_f1: 0.3966
 epoch: 7, train_loss: 1.0949, test_loss: 1.1828, test_f1: 0.4087
 epoch: 8, train_loss: 1.0858, test_loss: 1.1745, test_f1: 0.4164
 epoch: 9, train_loss: 1.0813, test_loss: 1.1667, test_f1: 0.4104
 epoch: 10, train_loss: 1.0727, test_loss: 1.1621, test_f1: 0.4107
 epoch: 11, train_loss: 1.0627, test_loss: 1.1579, test_f1: 0.4124
 epoch: 12, train_loss: 1.0562, test_loss: 1.1475, test_f1: 0.4159
 epoch: 13, train_loss: 1.0544, test_loss: 1.1443, test_f1: 0.4168
 epoch: 14, train_loss: 1.0408, test_loss: 1.1400, test_f1: 0.4295
 epoch: 15, train_loss: 1.0301, test_loss: 1.1347, test_f1: 0.4300
 epoch: 16, train_loss: 1.0335, test_loss: 1.1246, test_f1: 0.4345
 epoch: 17, train_loss: 1.0263, test_loss: 1.1311, test_f1: 0.4678
 epoch: 18, train_loss: 1.0126, test_loss: 1.1206, test_f1: 0.4614
 epoch: 19, train_loss: 1.0173, test_loss: 1.1241, test_f1: 0.4722
 epoch: 20, train_loss: 1.0005, test_loss: 1.1176, test_f1: 0.4746
 epoch: 21, train_loss: 0.9955, test_loss: 1.1198, test_f1: 0.4766
 epoch: 22, train_loss: 0.9978, test_loss: 1.1024, test_f1: 0.4786
 epoch: 23, train_loss: 0.9915, test_loss: 1.1071, test_f1: 0.4762
 epoch: 24, train_loss: 0.9807, test_loss: 1.1042, test_f1: 0.4631
 epoch: 25, train_loss: 0.9770, test_loss: 1.0994, test_f1: 0.4842
 epoch: 26, train_loss: 0.9800, test_loss: 1.0837, test_f1: 0.4902
 epoch: 27, train_loss: 0.9810, test_loss: 1.0854, test_f1: 0.4983
 epoch: 28, train_loss: 0.9693, test_loss: 1.0712, test_f1: 0.4989
 epoch: 29, train_loss: 0.9637, test_loss: 1.0777, test_f1: 0.4906
 epoch: 30, train_loss: 0.9515, test_loss: 1.0730, test_f1: 0.4859
 epoch: 31, train_loss: 0.9501, test_loss: 1.0669, test_f1: 0.5063
 epoch: 32, train_loss: 0.9530, test_loss: 1.0714, test_f1: 0.5041
 epoch: 33, train_loss: 0.9405, test_loss: 1.0692, test_f1: 0.5088
 epoch: 34, train_loss: 0.9346, test_loss: 1.0640, test_f1: 0.5064
 epoch: 35, train_loss: 0.9298, test_loss: 1.0629, test_f1: 0.5107
 epoch: 36, train_loss: 0.9338, test_loss: 1.0632, test_f1: 0.5125
 epoch: 37, train_loss: 0.9212, test_loss: 1.0525, test_f1: 0.4977
 epoch: 38, train_loss: 0.9237, test_loss: 1.0493, test_f1: 0.5024
 epoch: 39, train_loss: 0.9165, test_loss: 1.0584, test_f1: 0.5096
 epoch: 40, train_loss: 0.9179, test_loss: 1.0594, test_f1: 0.5022
 epoch: 41, train_loss: 0.9127, test_loss: 1.0570, test_f1: 0.5047
 epoch: 42, train_loss: 0.8995, test_loss: 1.0618, test_f1: 0.4975
 epoch: 43, train_loss: 0.8986, test_loss: 1.0372, test_f1: 0.5172
 epoch: 44, train_loss: 0.9051, test_loss: 1.0330, test_f1: 0.5293
 epoch: 45, train_loss: 0.8976, test_loss: 1.0331, test_f1: 0.5214
 epoch: 46, train_loss: 0.8916, test_loss: 1.0367, test_f1: 0.5206
 epoch: 47, train_loss: 0.8833, test_loss: 1.0340, test_f1: 0.5270
 epoch: 48, train_loss: 0.8825, test_loss: 1.0330, test_f1: 0.5294
 epoch: 49, train_loss: 0.8777, test_loss: 1.0423, test_f1: 0.5221
 epoch: 50, train_loss: 0.8824, test_loss: 1.0242, test_f1: 0.5300
 epoch: 51, train_loss: 0.8648, test_loss: 1.0249, test_f1: 0.5399
 epoch: 52, train_loss: 0.8665, test_loss: 1.0308, test_f1: 0.5306
 epoch: 53, train_loss: 0.8736, test_loss: 1.0307, test_f1: 0.5270
 epoch: 54, train_loss: 0.8583, test_loss: 1.0368, test_f1: 0.5335
 epoch: 55, train_loss: 0.8691, test_loss: 1.0129, test_f1: 0.5235
 epoch: 56, train_loss: 0.8644, test_loss: 1.0222, test_f1: 0.5353
 epoch: 57, train_loss: 0.8570, test_loss: 1.0333, test_f1: 0.5502
 epoch: 58, train_loss: 0.8630, test_loss: 1.0304, test_f1: 0.5499
 epoch: 59, train_loss: 0.8646, test_loss: 1.0213, test_f1: 0.5529
 epoch: 60, train_loss: 0.8511, test_loss: 1.0332, test_f1: 0.5375
 epoch: 61, train_loss: 0.8611, test_loss: 1.0210, test_f1: 0.5498
 epoch: 62, train_loss: 0.8568, test_loss: 1.0362, test_f1: 0.5331
 epoch: 63, train_loss: 0.8553, test_loss: 1.0178, test_f1: 0.5528
 epoch: 64, train_loss: 0.8497, test_loss: 1.0175, test_f1: 0.5286
 epoch: 65, train_loss: 0.8572, test_loss: 1.0150, test_f1: 0.5601
 epoch: 66, train_loss: 0.8499, test_loss: 1.0280, test_f1: 0.5573
 epoch: 67, train_loss: 0.8500, test_loss: 1.0177, test_f1: 0.5459
 epoch: 68, train_loss: 0.8410, test_loss: 1.0138, test_f1: 0.5547
 epoch: 69, train_loss: 0.8433, test_loss: 1.0233, test_f1: 0.5475
 epoch: 70, train_loss: 0.8363, test_loss: 1.0270, test_f1: 0.5511
 epoch: 71, train_loss: 0.8394, test_loss: 1.0198, test_f1: 0.5523
 epoch: 72, train_loss: 0.8473, test_loss: 1.0104, test_f1: 0.5496
 epoch: 73, train_loss: 0.8369, test_loss: 1.0195, test_f1: 0.5530
 epoch: 74, train_loss: 0.8337, test_loss: 1.0108, test_f1: 0.5616
 epoch: 75, train_loss: 0.8413, test_loss: 1.0067, test_f1: 0.5597
 epoch: 76, train_loss: 0.8415, test_loss: 1.0158, test_f1: 0.5675
 epoch: 77, train_loss: 0.8352, test_loss: 1.0142, test_f1: 0.5549
 epoch: 78, train_loss: 0.8271, test_loss: 1.0129, test_f1: 0.5652
 epoch: 79, train_loss: 0.8345, test_loss: 1.0164, test_f1: 0.5600
 epoch: 80, train_loss: 0.8352, test_loss: 1.0053, test_f1: 0.5658
 epoch: 81, train_loss: 0.8243, test_loss: 1.0068, test_f1: 0.5667
 epoch: 82, train_loss: 0.8376, test_loss: 1.0209, test_f1: 0.5476
 epoch: 83, train_loss: 0.8367, test_loss: 1.0054, test_f1: 0.5684
 epoch: 84, train_loss: 0.8223, test_loss: 1.0226, test_f1: 0.5523
 epoch: 85, train_loss: 0.8232, test_loss: 1.0003, test_f1: 0.5779
 epoch: 86, train_loss: 0.8264, test_loss: 1.0089, test_f1: 0.5599
 epoch: 87, train_loss: 0.8194, test_loss: 1.0113, test_f1: 0.5681
 epoch: 88, train_loss: 0.8288, test_loss: 1.0154, test_f1: 0.5620
 epoch: 89, train_loss: 0.8170, test_loss: 1.0048, test_f1: 0.5730
 epoch: 90, train_loss: 0.8160, test_loss: 1.0029, test_f1: 0.5726
 epoch: 91, train_loss: 0.8210, test_loss: 1.0150, test_f1: 0.5666
 epoch: 92, train_loss: 0.8190, test_loss: 1.0017, test_f1: 0.5674
 epoch: 93, train_loss: 0.8038, test_loss: 1.0182, test_f1: 0.5819
 epoch: 94, train_loss: 0.8160, test_loss: 1.0107, test_f1: 0.5773
 epoch: 95, train_loss: 0.8132, test_loss: 1.0182, test_f1: 0.5713
 epoch: 96, train_loss: 0.8064, test_loss: 1.0007, test_f1: 0.5658
 epoch: 97, train_loss: 0.8139, test_loss: 1.0186, test_f1: 0.5698
 epoch: 98, train_loss: 0.8103, test_loss: 1.0015, test_f1: 0.5797
 epoch: 99, train_loss: 0.8088, test_loss: 0.9980, test_f1: 0.5746
##################ITERATION #4 ****************************************
 epoch: 0, train_loss: 1.2681, test_loss: 1.2815, test_f1: 0.2281
 epoch: 1, train_loss: 1.1825, test_loss: 1.2409, test_f1: 0.2336
 epoch: 2, train_loss: 1.1536, test_loss: 1.2064, test_f1: 0.2977
 epoch: 3, train_loss: 1.1279, test_loss: 1.1828, test_f1: 0.3243
 epoch: 4, train_loss: 1.1132, test_loss: 1.1670, test_f1: 0.3434
 epoch: 5, train_loss: 1.0933, test_loss: 1.1573, test_f1: 0.3545
 epoch: 6, train_loss: 1.0791, test_loss: 1.1439, test_f1: 0.3591
 epoch: 7, train_loss: 1.0728, test_loss: 1.1382, test_f1: 0.3966
 epoch: 8, train_loss: 1.0585, test_loss: 1.1296, test_f1: 0.4010
 epoch: 9, train_loss: 1.0474, test_loss: 1.1249, test_f1: 0.4381
 epoch: 10, train_loss: 1.0407, test_loss: 1.1190, test_f1: 0.4628
 epoch: 11, train_loss: 1.0204, test_loss: 1.1136, test_f1: 0.4625
 epoch: 12, train_loss: 1.0147, test_loss: 1.1057, test_f1: 0.4591
 epoch: 13, train_loss: 1.0201, test_loss: 1.1041, test_f1: 0.4692
 epoch: 14, train_loss: 1.0044, test_loss: 1.1016, test_f1: 0.4711
 epoch: 15, train_loss: 0.9955, test_loss: 1.1000, test_f1: 0.4809
 epoch: 16, train_loss: 0.9953, test_loss: 1.0900, test_f1: 0.4825
 epoch: 17, train_loss: 0.9895, test_loss: 1.0858, test_f1: 0.4894
 epoch: 18, train_loss: 0.9791, test_loss: 1.0784, test_f1: 0.4917
 epoch: 19, train_loss: 0.9606, test_loss: 1.0771, test_f1: 0.4986
 epoch: 20, train_loss: 0.9536, test_loss: 1.0804, test_f1: 0.5038
 epoch: 21, train_loss: 0.9638, test_loss: 1.0682, test_f1: 0.5063
 epoch: 22, train_loss: 0.9582, test_loss: 1.0788, test_f1: 0.4964
 epoch: 23, train_loss: 0.9484, test_loss: 1.0695, test_f1: 0.5186
 epoch: 24, train_loss: 0.9445, test_loss: 1.0709, test_f1: 0.5238
 epoch: 25, train_loss: 0.9304, test_loss: 1.0769, test_f1: 0.5195
 epoch: 26, train_loss: 0.9438, test_loss: 1.0680, test_f1: 0.5148
 epoch: 27, train_loss: 0.9359, test_loss: 1.0610, test_f1: 0.5250
 epoch: 28, train_loss: 0.9331, test_loss: 1.0646, test_f1: 0.5229
 epoch: 29, train_loss: 0.9169, test_loss: 1.0600, test_f1: 0.5227
 epoch: 30, train_loss: 0.9218, test_loss: 1.0592, test_f1: 0.5216
 epoch: 31, train_loss: 0.9160, test_loss: 1.0610, test_f1: 0.4971
 epoch: 32, train_loss: 0.9257, test_loss: 1.0615, test_f1: 0.5120
 epoch: 33, train_loss: 0.9084, test_loss: 1.0535, test_f1: 0.5004
 epoch: 34, train_loss: 0.8993, test_loss: 1.0560, test_f1: 0.5281
 epoch: 35, train_loss: 0.9160, test_loss: 1.0667, test_f1: 0.5009
 epoch: 36, train_loss: 0.8911, test_loss: 1.0644, test_f1: 0.5104
 epoch: 37, train_loss: 0.8945, test_loss: 1.0561, test_f1: 0.5185
 epoch: 38, train_loss: 0.9025, test_loss: 1.0772, test_f1: 0.5199
 epoch: 39, train_loss: 0.8967, test_loss: 1.0646, test_f1: 0.5177
 epoch: 40, train_loss: 0.8853, test_loss: 1.0595, test_f1: 0.5159
 epoch: 41, train_loss: 0.8805, test_loss: 1.0536, test_f1: 0.5082
 epoch: 42, train_loss: 0.8740, test_loss: 1.0643, test_f1: 0.5214
 epoch: 43, train_loss: 0.8760, test_loss: 1.0540, test_f1: 0.5206
 epoch: 44, train_loss: 0.8728, test_loss: 1.0623, test_f1: 0.5387
 epoch: 45, train_loss: 0.8697, test_loss: 1.0531, test_f1: 0.5166
 epoch: 46, train_loss: 0.8711, test_loss: 1.0528, test_f1: 0.5103
 epoch: 47, train_loss: 0.8590, test_loss: 1.0667, test_f1: 0.5220
 epoch: 48, train_loss: 0.8583, test_loss: 1.0647, test_f1: 0.5212
 epoch: 49, train_loss: 0.8587, test_loss: 1.0622, test_f1: 0.5221
 epoch: 50, train_loss: 0.8523, test_loss: 1.0716, test_f1: 0.5123
 epoch: 51, train_loss: 0.8575, test_loss: 1.0561, test_f1: 0.5181
 epoch: 52, train_loss: 0.8475, test_loss: 1.0549, test_f1: 0.5271
 epoch: 53, train_loss: 0.8443, test_loss: 1.0541, test_f1: 0.5208
 epoch: 54, train_loss: 0.8528, test_loss: 1.0527, test_f1: 0.5342
 epoch: 55, train_loss: 0.8494, test_loss: 1.0554, test_f1: 0.5178
 epoch: 56, train_loss: 0.8465, test_loss: 1.0664, test_f1: 0.5222
 epoch: 57, train_loss: 0.8396, test_loss: 1.0560, test_f1: 0.5223
 epoch: 58, train_loss: 0.8509, test_loss: 1.0585, test_f1: 0.5266
 epoch: 59, train_loss: 0.8349, test_loss: 1.0639, test_f1: 0.5347
 epoch: 60, train_loss: 0.8438, test_loss: 1.0578, test_f1: 0.5273
 epoch: 61, train_loss: 0.8494, test_loss: 1.0569, test_f1: 0.5129
 epoch: 62, train_loss: 0.8389, test_loss: 1.0513, test_f1: 0.5140
 epoch: 63, train_loss: 0.8443, test_loss: 1.0582, test_f1: 0.5232
 epoch: 64, train_loss: 0.8369, test_loss: 1.0568, test_f1: 0.5346
 epoch: 65, train_loss: 0.8324, test_loss: 1.0534, test_f1: 0.5193
 epoch: 66, train_loss: 0.8306, test_loss: 1.0593, test_f1: 0.5262
 epoch: 67, train_loss: 0.8315, test_loss: 1.0586, test_f1: 0.5323
 epoch: 68, train_loss: 0.8218, test_loss: 1.0553, test_f1: 0.5259
 epoch: 69, train_loss: 0.8296, test_loss: 1.0641, test_f1: 0.5303
 epoch: 70, train_loss: 0.8144, test_loss: 1.0518, test_f1: 0.5260
 epoch: 71, train_loss: 0.8284, test_loss: 1.0516, test_f1: 0.5338
 epoch: 72, train_loss: 0.8182, test_loss: 1.0559, test_f1: 0.5374
 epoch: 73, train_loss: 0.8259, test_loss: 1.0501, test_f1: 0.5323
 epoch: 74, train_loss: 0.8227, test_loss: 1.0689, test_f1: 0.5290
 epoch: 75, train_loss: 0.8322, test_loss: 1.0551, test_f1: 0.5349
 epoch: 76, train_loss: 0.8142, test_loss: 1.0539, test_f1: 0.5321
 epoch: 77, train_loss: 0.8242, test_loss: 1.0577, test_f1: 0.5389
 epoch: 78, train_loss: 0.8167, test_loss: 1.0520, test_f1: 0.5322
 epoch: 79, train_loss: 0.8163, test_loss: 1.0520, test_f1: 0.5475
 epoch: 80, train_loss: 0.8189, test_loss: 1.0550, test_f1: 0.5354
 epoch: 81, train_loss: 0.8152, test_loss: 1.0430, test_f1: 0.5277
 epoch: 82, train_loss: 0.8043, test_loss: 1.0497, test_f1: 0.5441
 epoch: 83, train_loss: 0.8084, test_loss: 1.0701, test_f1: 0.5316
 epoch: 84, train_loss: 0.8239, test_loss: 1.0416, test_f1: 0.5497
 epoch: 85, train_loss: 0.8176, test_loss: 1.0601, test_f1: 0.5311
 epoch: 86, train_loss: 0.8021, test_loss: 1.0520, test_f1: 0.5352
 epoch: 87, train_loss: 0.8069, test_loss: 1.0540, test_f1: 0.5389
 epoch: 88, train_loss: 0.8070, test_loss: 1.0643, test_f1: 0.5347
 epoch: 89, train_loss: 0.8155, test_loss: 1.0692, test_f1: 0.5422
 epoch: 90, train_loss: 0.7967, test_loss: 1.0638, test_f1: 0.5335
 epoch: 91, train_loss: 0.8107, test_loss: 1.0649, test_f1: 0.5394
 epoch: 92, train_loss: 0.8101, test_loss: 1.0579, test_f1: 0.5364
 epoch: 93, train_loss: 0.7969, test_loss: 1.0778, test_f1: 0.5266
 epoch: 94, train_loss: 0.8019, test_loss: 1.0579, test_f1: 0.5322
 epoch: 95, train_loss: 0.8071, test_loss: 1.0635, test_f1: 0.5373
 epoch: 96, train_loss: 0.7981, test_loss: 1.0425, test_f1: 0.5423
 epoch: 97, train_loss: 0.7900, test_loss: 1.0577, test_f1: 0.5307
 epoch: 98, train_loss: 0.8009, test_loss: 1.0461, test_f1: 0.5388
 epoch: 99, train_loss: 0.7955, test_loss: 1.0630, test_f1: 0.5401
##################ITERATION #5 ****************************************
 epoch: 0, train_loss: 1.2398, test_loss: 1.2937, test_f1: 0.2281
 epoch: 1, train_loss: 1.1728, test_loss: 1.2504, test_f1: 0.2639
 epoch: 2, train_loss: 1.1552, test_loss: 1.2123, test_f1: 0.3366
 epoch: 3, train_loss: 1.1366, test_loss: 1.1947, test_f1: 0.3402
 epoch: 4, train_loss: 1.1127, test_loss: 1.1783, test_f1: 0.3496
 epoch: 5, train_loss: 1.1025, test_loss: 1.1669, test_f1: 0.3541
 epoch: 6, train_loss: 1.0781, test_loss: 1.1598, test_f1: 0.3540
 epoch: 7, train_loss: 1.0568, test_loss: 1.1505, test_f1: 0.3563
 epoch: 8, train_loss: 1.0474, test_loss: 1.1404, test_f1: 0.3565
 epoch: 9, train_loss: 1.0448, test_loss: 1.1367, test_f1: 0.3545
 epoch: 10, train_loss: 1.0330, test_loss: 1.1232, test_f1: 0.3571
 epoch: 11, train_loss: 1.0190, test_loss: 1.1285, test_f1: 0.3879
 epoch: 12, train_loss: 1.0146, test_loss: 1.1178, test_f1: 0.3748
 epoch: 13, train_loss: 1.0079, test_loss: 1.1105, test_f1: 0.3750
 epoch: 14, train_loss: 0.9920, test_loss: 1.1070, test_f1: 0.4051
 epoch: 15, train_loss: 0.9875, test_loss: 1.1008, test_f1: 0.4159
 epoch: 16, train_loss: 0.9782, test_loss: 1.1132, test_f1: 0.4514
 epoch: 17, train_loss: 0.9785, test_loss: 1.0940, test_f1: 0.4594
 epoch: 18, train_loss: 0.9688, test_loss: 1.0967, test_f1: 0.4547
 epoch: 19, train_loss: 0.9716, test_loss: 1.1003, test_f1: 0.4552
 epoch: 20, train_loss: 0.9601, test_loss: 1.1010, test_f1: 0.4536
 epoch: 21, train_loss: 0.9616, test_loss: 1.1021, test_f1: 0.4556
 epoch: 22, train_loss: 0.9412, test_loss: 1.0936, test_f1: 0.4573
 epoch: 23, train_loss: 0.9507, test_loss: 1.0975, test_f1: 0.4563
 epoch: 24, train_loss: 0.9457, test_loss: 1.1018, test_f1: 0.4693
 epoch: 25, train_loss: 0.9292, test_loss: 1.1032, test_f1: 0.4690
 epoch: 26, train_loss: 0.9264, test_loss: 1.1011, test_f1: 0.4711
 epoch: 27, train_loss: 0.9318, test_loss: 1.1063, test_f1: 0.4619
 epoch: 28, train_loss: 0.9128, test_loss: 1.1148, test_f1: 0.4764
 epoch: 29, train_loss: 0.9157, test_loss: 1.0968, test_f1: 0.4713
 epoch: 30, train_loss: 0.9267, test_loss: 1.1084, test_f1: 0.4971
 epoch: 31, train_loss: 0.9062, test_loss: 1.1124, test_f1: 0.4973
 epoch: 32, train_loss: 0.9148, test_loss: 1.1368, test_f1: 0.5018
 epoch: 33, train_loss: 0.9017, test_loss: 1.1459, test_f1: 0.4945
 epoch: 34, train_loss: 0.9005, test_loss: 1.1552, test_f1: 0.4898
 epoch: 35, train_loss: 0.8973, test_loss: 1.1494, test_f1: 0.4971
 epoch: 36, train_loss: 0.8897, test_loss: 1.1685, test_f1: 0.4961
 epoch: 37, train_loss: 0.8956, test_loss: 1.1525, test_f1: 0.4989
 epoch: 38, train_loss: 0.9002, test_loss: 1.1667, test_f1: 0.5027
 epoch: 39, train_loss: 0.8855, test_loss: 1.1700, test_f1: 0.4984
 epoch: 40, train_loss: 0.8864, test_loss: 1.1641, test_f1: 0.5215
 epoch: 41, train_loss: 0.8805, test_loss: 1.1806, test_f1: 0.5066
 epoch: 42, train_loss: 0.8790, test_loss: 1.1665, test_f1: 0.5180
 epoch: 43, train_loss: 0.8808, test_loss: 1.1821, test_f1: 0.5054
 epoch: 44, train_loss: 0.8785, test_loss: 1.1773, test_f1: 0.5175
 epoch: 45, train_loss: 0.8719, test_loss: 1.1946, test_f1: 0.5153
 epoch: 46, train_loss: 0.8674, test_loss: 1.1992, test_f1: 0.5118
 epoch: 47, train_loss: 0.8768, test_loss: 1.1991, test_f1: 0.5041
 epoch: 48, train_loss: 0.8716, test_loss: 1.1914, test_f1: 0.4996
 epoch: 49, train_loss: 0.8628, test_loss: 1.1859, test_f1: 0.5042
 epoch: 50, train_loss: 0.8633, test_loss: 1.1724, test_f1: 0.5014
 epoch: 51, train_loss: 0.8599, test_loss: 1.1793, test_f1: 0.5023
 epoch: 52, train_loss: 0.8550, test_loss: 1.1691, test_f1: 0.5079
 epoch: 53, train_loss: 0.8596, test_loss: 1.1682, test_f1: 0.5174
 epoch: 54, train_loss: 0.8544, test_loss: 1.1630, test_f1: 0.5008
 epoch: 55, train_loss: 0.8613, test_loss: 1.1776, test_f1: 0.5114
 epoch: 56, train_loss: 0.8533, test_loss: 1.1838, test_f1: 0.5200
 epoch: 57, train_loss: 0.8515, test_loss: 1.1751, test_f1: 0.5071
 epoch: 58, train_loss: 0.8571, test_loss: 1.1832, test_f1: 0.5173
 epoch: 59, train_loss: 0.8585, test_loss: 1.1803, test_f1: 0.5035
 epoch: 60, train_loss: 0.8465, test_loss: 1.1786, test_f1: 0.5171
 epoch: 61, train_loss: 0.8396, test_loss: 1.1937, test_f1: 0.5194
 epoch: 62, train_loss: 0.8393, test_loss: 1.1856, test_f1: 0.5125
 epoch: 63, train_loss: 0.8483, test_loss: 1.1849, test_f1: 0.5077
 epoch: 64, train_loss: 0.8537, test_loss: 1.1813, test_f1: 0.5114
 epoch: 65, train_loss: 0.8440, test_loss: 1.1624, test_f1: 0.4986
 epoch: 66, train_loss: 0.8397, test_loss: 1.1737, test_f1: 0.5002
 epoch: 67, train_loss: 0.8282, test_loss: 1.1742, test_f1: 0.4995
 epoch: 68, train_loss: 0.8435, test_loss: 1.1759, test_f1: 0.4914
 epoch: 69, train_loss: 0.8372, test_loss: 1.1902, test_f1: 0.5061
 epoch: 70, train_loss: 0.8343, test_loss: 1.1784, test_f1: 0.5024
 epoch: 71, train_loss: 0.8309, test_loss: 1.1708, test_f1: 0.4977
 epoch: 72, train_loss: 0.8515, test_loss: 1.1687, test_f1: 0.5080
 epoch: 73, train_loss: 0.8259, test_loss: 1.1716, test_f1: 0.5058
 epoch: 74, train_loss: 0.8280, test_loss: 1.1743, test_f1: 0.5028
 epoch: 75, train_loss: 0.8326, test_loss: 1.1591, test_f1: 0.5051
 epoch: 76, train_loss: 0.8319, test_loss: 1.1710, test_f1: 0.5036
 epoch: 77, train_loss: 0.8260, test_loss: 1.1756, test_f1: 0.4931
 epoch: 78, train_loss: 0.8329, test_loss: 1.1851, test_f1: 0.5015
 epoch: 79, train_loss: 0.8325, test_loss: 1.1727, test_f1: 0.4959
 epoch: 80, train_loss: 0.8245, test_loss: 1.1898, test_f1: 0.5061
 epoch: 81, train_loss: 0.8227, test_loss: 1.1960, test_f1: 0.4995
 epoch: 82, train_loss: 0.8298, test_loss: 1.1823, test_f1: 0.4917
 epoch: 83, train_loss: 0.8211, test_loss: 1.1767, test_f1: 0.5101
 epoch: 84, train_loss: 0.8247, test_loss: 1.1738, test_f1: 0.5122
 epoch: 85, train_loss: 0.8164, test_loss: 1.1693, test_f1: 0.4956
 epoch: 86, train_loss: 0.8140, test_loss: 1.1767, test_f1: 0.4939
 epoch: 87, train_loss: 0.8230, test_loss: 1.1968, test_f1: 0.5143
 epoch: 88, train_loss: 0.8165, test_loss: 1.1817, test_f1: 0.4912
 epoch: 89, train_loss: 0.8150, test_loss: 1.1670, test_f1: 0.5011
 epoch: 90, train_loss: 0.8322, test_loss: 1.1613, test_f1: 0.4920
 epoch: 91, train_loss: 0.8066, test_loss: 1.1711, test_f1: 0.5062
 epoch: 92, train_loss: 0.8212, test_loss: 1.1783, test_f1: 0.4996
 epoch: 93, train_loss: 0.7974, test_loss: 1.1804, test_f1: 0.5028
 epoch: 94, train_loss: 0.8125, test_loss: 1.1740, test_f1: 0.4856
 epoch: 95, train_loss: 0.8107, test_loss: 1.1858, test_f1: 0.5074
 epoch: 96, train_loss: 0.8167, test_loss: 1.1570, test_f1: 0.4866
 epoch: 97, train_loss: 0.8100, test_loss: 1.1728, test_f1: 0.4799
 epoch: 98, train_loss: 0.8069, test_loss: 1.1724, test_f1: 0.5053
 epoch: 99, train_loss: 0.8122, test_loss: 1.1725, test_f1: 0.4832
##################ITERATION #6 ****************************************
 epoch: 0, train_loss: 1.2623, test_loss: 1.2856, test_f1: 0.2281
 epoch: 1, train_loss: 1.1798, test_loss: 1.2489, test_f1: 0.3154
 epoch: 2, train_loss: 1.1616, test_loss: 1.2171, test_f1: 0.3529
 epoch: 3, train_loss: 1.1281, test_loss: 1.1984, test_f1: 0.3606
 epoch: 4, train_loss: 1.1141, test_loss: 1.1910, test_f1: 0.3623
 epoch: 5, train_loss: 1.0985, test_loss: 1.1794, test_f1: 0.3630
 epoch: 6, train_loss: 1.0776, test_loss: 1.1693, test_f1: 0.3660
 epoch: 7, train_loss: 1.0821, test_loss: 1.1627, test_f1: 0.3676
 epoch: 8, train_loss: 1.0631, test_loss: 1.1581, test_f1: 0.3536
 epoch: 9, train_loss: 1.0428, test_loss: 1.1465, test_f1: 0.3848
 epoch: 10, train_loss: 1.0442, test_loss: 1.1390, test_f1: 0.3816
 epoch: 11, train_loss: 1.0360, test_loss: 1.1289, test_f1: 0.4145
 epoch: 12, train_loss: 1.0176, test_loss: 1.1251, test_f1: 0.4277
 epoch: 13, train_loss: 1.0316, test_loss: 1.1198, test_f1: 0.4639
 epoch: 14, train_loss: 1.0164, test_loss: 1.1175, test_f1: 0.4527
 epoch: 15, train_loss: 1.0031, test_loss: 1.1084, test_f1: 0.4737
 epoch: 16, train_loss: 0.9911, test_loss: 1.1021, test_f1: 0.4800
 epoch: 17, train_loss: 0.9962, test_loss: 1.1017, test_f1: 0.4811
 epoch: 18, train_loss: 0.9776, test_loss: 1.0903, test_f1: 0.4849
 epoch: 19, train_loss: 0.9802, test_loss: 1.0895, test_f1: 0.4936
 epoch: 20, train_loss: 0.9759, test_loss: 1.0818, test_f1: 0.4928
 epoch: 21, train_loss: 0.9752, test_loss: 1.0686, test_f1: 0.4944
 epoch: 22, train_loss: 0.9713, test_loss: 1.0788, test_f1: 0.5091
 epoch: 23, train_loss: 0.9602, test_loss: 1.0761, test_f1: 0.5070
 epoch: 24, train_loss: 0.9466, test_loss: 1.0733, test_f1: 0.4877
 epoch: 25, train_loss: 0.9523, test_loss: 1.0656, test_f1: 0.4958
 epoch: 26, train_loss: 0.9402, test_loss: 1.0570, test_f1: 0.5001
 epoch: 27, train_loss: 0.9356, test_loss: 1.0586, test_f1: 0.5136
 epoch: 28, train_loss: 0.9388, test_loss: 1.0525, test_f1: 0.5069
 epoch: 29, train_loss: 0.9216, test_loss: 1.0570, test_f1: 0.5261
 epoch: 30, train_loss: 0.9255, test_loss: 1.0606, test_f1: 0.5325
 epoch: 31, train_loss: 0.9051, test_loss: 1.0599, test_f1: 0.5169
 epoch: 32, train_loss: 0.9138, test_loss: 1.0439, test_f1: 0.5149
 epoch: 33, train_loss: 0.9086, test_loss: 1.0550, test_f1: 0.5155
 epoch: 34, train_loss: 0.9137, test_loss: 1.0460, test_f1: 0.5234
 epoch: 35, train_loss: 0.9066, test_loss: 1.0374, test_f1: 0.5278
 epoch: 36, train_loss: 0.8947, test_loss: 1.0408, test_f1: 0.5258
 epoch: 37, train_loss: 0.8968, test_loss: 1.0469, test_f1: 0.5307
 epoch: 38, train_loss: 0.8899, test_loss: 1.0362, test_f1: 0.5365
 epoch: 39, train_loss: 0.8802, test_loss: 1.0364, test_f1: 0.5409
 epoch: 40, train_loss: 0.8834, test_loss: 1.0417, test_f1: 0.5258
 epoch: 41, train_loss: 0.8831, test_loss: 1.0379, test_f1: 0.5287
 epoch: 42, train_loss: 0.8773, test_loss: 1.0352, test_f1: 0.5438
 epoch: 43, train_loss: 0.8717, test_loss: 1.0435, test_f1: 0.5310
 epoch: 44, train_loss: 0.8659, test_loss: 1.0275, test_f1: 0.5349
 epoch: 45, train_loss: 0.8643, test_loss: 1.0417, test_f1: 0.5292
 epoch: 46, train_loss: 0.8625, test_loss: 1.0346, test_f1: 0.5326
 epoch: 47, train_loss: 0.8641, test_loss: 1.0416, test_f1: 0.5256
 epoch: 48, train_loss: 0.8585, test_loss: 1.0407, test_f1: 0.5399
 epoch: 49, train_loss: 0.8601, test_loss: 1.0267, test_f1: 0.5432
 epoch: 50, train_loss: 0.8473, test_loss: 1.0319, test_f1: 0.5364
 epoch: 51, train_loss: 0.8438, test_loss: 1.0425, test_f1: 0.5525
 epoch: 52, train_loss: 0.8425, test_loss: 1.0434, test_f1: 0.5414
 epoch: 53, train_loss: 0.8510, test_loss: 1.0327, test_f1: 0.5605
 epoch: 54, train_loss: 0.8419, test_loss: 1.0397, test_f1: 0.5482
 epoch: 55, train_loss: 0.8545, test_loss: 1.0333, test_f1: 0.5414
 epoch: 56, train_loss: 0.8516, test_loss: 1.0255, test_f1: 0.5618
 epoch: 57, train_loss: 0.8316, test_loss: 1.0314, test_f1: 0.5506
 epoch: 58, train_loss: 0.8288, test_loss: 1.0272, test_f1: 0.5454
 epoch: 59, train_loss: 0.8335, test_loss: 1.0382, test_f1: 0.5619
 epoch: 60, train_loss: 0.8311, test_loss: 1.0376, test_f1: 0.5562
 epoch: 61, train_loss: 0.8372, test_loss: 1.0268, test_f1: 0.5470
 epoch: 62, train_loss: 0.8341, test_loss: 1.0171, test_f1: 0.5559
 epoch: 63, train_loss: 0.8312, test_loss: 1.0162, test_f1: 0.5526
 epoch: 64, train_loss: 0.8318, test_loss: 1.0291, test_f1: 0.5544
 epoch: 65, train_loss: 0.8333, test_loss: 1.0330, test_f1: 0.5576
 epoch: 66, train_loss: 0.8284, test_loss: 1.0252, test_f1: 0.5561
 epoch: 67, train_loss: 0.8319, test_loss: 1.0310, test_f1: 0.5678
 epoch: 68, train_loss: 0.8299, test_loss: 1.0340, test_f1: 0.5476
 epoch: 69, train_loss: 0.8162, test_loss: 1.0179, test_f1: 0.5648
 epoch: 70, train_loss: 0.8234, test_loss: 1.0293, test_f1: 0.5646
 epoch: 71, train_loss: 0.8133, test_loss: 1.0349, test_f1: 0.5743
 epoch: 72, train_loss: 0.8220, test_loss: 1.0406, test_f1: 0.5597
 epoch: 73, train_loss: 0.8178, test_loss: 1.0376, test_f1: 0.5726
 epoch: 74, train_loss: 0.8139, test_loss: 1.0249, test_f1: 0.5684
 epoch: 75, train_loss: 0.8196, test_loss: 1.0305, test_f1: 0.5584
 epoch: 76, train_loss: 0.8166, test_loss: 1.0481, test_f1: 0.5502
 epoch: 77, train_loss: 0.8162, test_loss: 1.0317, test_f1: 0.5662
 epoch: 78, train_loss: 0.8051, test_loss: 1.0321, test_f1: 0.5621
 epoch: 79, train_loss: 0.8359, test_loss: 1.0278, test_f1: 0.5495
 epoch: 80, train_loss: 0.8131, test_loss: 1.0345, test_f1: 0.5671
 epoch: 81, train_loss: 0.8168, test_loss: 1.0393, test_f1: 0.5573
 epoch: 82, train_loss: 0.8022, test_loss: 1.0343, test_f1: 0.5613
 epoch: 83, train_loss: 0.8072, test_loss: 1.0420, test_f1: 0.5703
 epoch: 84, train_loss: 0.8111, test_loss: 1.0139, test_f1: 0.5732
 epoch: 85, train_loss: 0.8055, test_loss: 1.0343, test_f1: 0.5711
 epoch: 86, train_loss: 0.8088, test_loss: 1.0347, test_f1: 0.5607
 epoch: 87, train_loss: 0.8013, test_loss: 1.0420, test_f1: 0.5620
 epoch: 88, train_loss: 0.8128, test_loss: 1.0341, test_f1: 0.5751
 epoch: 89, train_loss: 0.7956, test_loss: 1.0391, test_f1: 0.5745
 epoch: 90, train_loss: 0.7936, test_loss: 1.0266, test_f1: 0.5723
 epoch: 91, train_loss: 0.8045, test_loss: 1.0324, test_f1: 0.5646
 epoch: 92, train_loss: 0.8005, test_loss: 1.0329, test_f1: 0.5676
 epoch: 93, train_loss: 0.7955, test_loss: 1.0340, test_f1: 0.5608
 epoch: 94, train_loss: 0.7921, test_loss: 1.0257, test_f1: 0.5767
 epoch: 95, train_loss: 0.7989, test_loss: 1.0188, test_f1: 0.5787
 epoch: 96, train_loss: 0.7932, test_loss: 1.0231, test_f1: 0.5693
 epoch: 97, train_loss: 0.7955, test_loss: 1.0477, test_f1: 0.5427
 epoch: 98, train_loss: 0.7899, test_loss: 1.0271, test_f1: 0.5783
 epoch: 99, train_loss: 0.7965, test_loss: 1.0316, test_f1: 0.5600
##################ITERATION #7 ****************************************
 epoch: 0, train_loss: 1.2505, test_loss: 1.3081, test_f1: 0.2281
 epoch: 1, train_loss: 1.1643, test_loss: 1.2594, test_f1: 0.2575
 epoch: 2, train_loss: 1.1487, test_loss: 1.2128, test_f1: 0.3238
 epoch: 3, train_loss: 1.1251, test_loss: 1.1935, test_f1: 0.4178
 epoch: 4, train_loss: 1.1125, test_loss: 1.1817, test_f1: 0.4521
 epoch: 5, train_loss: 1.1116, test_loss: 1.1671, test_f1: 0.4617
 epoch: 6, train_loss: 1.0914, test_loss: 1.1523, test_f1: 0.4646
 epoch: 7, train_loss: 1.0812, test_loss: 1.1420, test_f1: 0.4700
 epoch: 8, train_loss: 1.0714, test_loss: 1.1310, test_f1: 0.4718
 epoch: 9, train_loss: 1.0565, test_loss: 1.1262, test_f1: 0.4811
 epoch: 10, train_loss: 1.0408, test_loss: 1.1182, test_f1: 0.4830
 epoch: 11, train_loss: 1.0438, test_loss: 1.1058, test_f1: 0.4924
 epoch: 12, train_loss: 1.0139, test_loss: 1.0968, test_f1: 0.4887
 epoch: 13, train_loss: 1.0246, test_loss: 1.0912, test_f1: 0.4876
 epoch: 14, train_loss: 1.0078, test_loss: 1.0844, test_f1: 0.5051
 epoch: 15, train_loss: 0.9986, test_loss: 1.0828, test_f1: 0.5179
 epoch: 16, train_loss: 0.9930, test_loss: 1.0788, test_f1: 0.5212
 epoch: 17, train_loss: 0.9879, test_loss: 1.0695, test_f1: 0.5096
 epoch: 18, train_loss: 0.9826, test_loss: 1.0686, test_f1: 0.5328
 epoch: 19, train_loss: 0.9746, test_loss: 1.0724, test_f1: 0.5256
 epoch: 20, train_loss: 0.9683, test_loss: 1.0656, test_f1: 0.5352
 epoch: 21, train_loss: 0.9633, test_loss: 1.0673, test_f1: 0.5325
 epoch: 22, train_loss: 0.9583, test_loss: 1.0654, test_f1: 0.5074
 epoch: 23, train_loss: 0.9511, test_loss: 1.0648, test_f1: 0.5073
 epoch: 24, train_loss: 0.9445, test_loss: 1.0612, test_f1: 0.5007
 epoch: 25, train_loss: 0.9402, test_loss: 1.0660, test_f1: 0.5216
 epoch: 26, train_loss: 0.9369, test_loss: 1.0574, test_f1: 0.5359
 epoch: 27, train_loss: 0.9377, test_loss: 1.0535, test_f1: 0.5145
 epoch: 28, train_loss: 0.9197, test_loss: 1.0464, test_f1: 0.5137
 epoch: 29, train_loss: 0.9231, test_loss: 1.0481, test_f1: 0.5046
 epoch: 30, train_loss: 0.9282, test_loss: 1.0480, test_f1: 0.5018
 epoch: 31, train_loss: 0.9134, test_loss: 1.0423, test_f1: 0.5169
 epoch: 32, train_loss: 0.9165, test_loss: 1.0574, test_f1: 0.5154
 epoch: 33, train_loss: 0.9168, test_loss: 1.0404, test_f1: 0.5155
 epoch: 34, train_loss: 0.9123, test_loss: 1.0440, test_f1: 0.5312
 epoch: 35, train_loss: 0.9010, test_loss: 1.0461, test_f1: 0.5131
 epoch: 36, train_loss: 0.9000, test_loss: 1.0433, test_f1: 0.5533
 epoch: 37, train_loss: 0.9043, test_loss: 1.0362, test_f1: 0.5202
 epoch: 38, train_loss: 0.8924, test_loss: 1.0301, test_f1: 0.5146
 epoch: 39, train_loss: 0.8966, test_loss: 1.0362, test_f1: 0.5385
 epoch: 40, train_loss: 0.8963, test_loss: 1.0382, test_f1: 0.5306
 epoch: 41, train_loss: 0.8943, test_loss: 1.0383, test_f1: 0.5298
 epoch: 42, train_loss: 0.8715, test_loss: 1.0411, test_f1: 0.5279
 epoch: 43, train_loss: 0.8718, test_loss: 1.0311, test_f1: 0.5354
 epoch: 44, train_loss: 0.8726, test_loss: 1.0241, test_f1: 0.5456
 epoch: 45, train_loss: 0.8746, test_loss: 1.0303, test_f1: 0.5592
 epoch: 46, train_loss: 0.8720, test_loss: 1.0280, test_f1: 0.5404
 epoch: 47, train_loss: 0.8721, test_loss: 1.0308, test_f1: 0.5656
 epoch: 48, train_loss: 0.8740, test_loss: 1.0311, test_f1: 0.5305
 epoch: 49, train_loss: 0.8688, test_loss: 1.0175, test_f1: 0.5733
 epoch: 50, train_loss: 0.8679, test_loss: 1.0225, test_f1: 0.5754
 epoch: 51, train_loss: 0.8593, test_loss: 1.0245, test_f1: 0.5484
 epoch: 52, train_loss: 0.8625, test_loss: 1.0260, test_f1: 0.5749
 epoch: 53, train_loss: 0.8490, test_loss: 1.0293, test_f1: 0.5948
 epoch: 54, train_loss: 0.8528, test_loss: 1.0243, test_f1: 0.5750
 epoch: 55, train_loss: 0.8330, test_loss: 1.0284, test_f1: 0.5745
 epoch: 56, train_loss: 0.8405, test_loss: 1.0287, test_f1: 0.5584
 epoch: 57, train_loss: 0.8377, test_loss: 1.0308, test_f1: 0.5669
 epoch: 58, train_loss: 0.8507, test_loss: 1.0321, test_f1: 0.5819
 epoch: 59, train_loss: 0.8437, test_loss: 1.0310, test_f1: 0.5702
 epoch: 60, train_loss: 0.8364, test_loss: 1.0275, test_f1: 0.5686
 epoch: 61, train_loss: 0.8394, test_loss: 1.0276, test_f1: 0.5699
 epoch: 62, train_loss: 0.8359, test_loss: 1.0291, test_f1: 0.5797
 epoch: 63, train_loss: 0.8470, test_loss: 1.0253, test_f1: 0.5780
 epoch: 64, train_loss: 0.8422, test_loss: 1.0257, test_f1: 0.5830
 epoch: 65, train_loss: 0.8415, test_loss: 1.0214, test_f1: 0.5797
 epoch: 66, train_loss: 0.8386, test_loss: 1.0195, test_f1: 0.5825
 epoch: 67, train_loss: 0.8321, test_loss: 1.0203, test_f1: 0.5955
 epoch: 68, train_loss: 0.8325, test_loss: 1.0122, test_f1: 0.5847
 epoch: 69, train_loss: 0.8327, test_loss: 1.0138, test_f1: 0.5803
 epoch: 70, train_loss: 0.8149, test_loss: 1.0153, test_f1: 0.5898
 epoch: 71, train_loss: 0.8347, test_loss: 1.0125, test_f1: 0.5828
 epoch: 72, train_loss: 0.8306, test_loss: 1.0171, test_f1: 0.6000
 epoch: 73, train_loss: 0.8302, test_loss: 1.0148, test_f1: 0.5978
 epoch: 74, train_loss: 0.8299, test_loss: 1.0243, test_f1: 0.5978
 epoch: 75, train_loss: 0.8299, test_loss: 1.0174, test_f1: 0.5902
 epoch: 76, train_loss: 0.8140, test_loss: 1.0174, test_f1: 0.5871
 epoch: 77, train_loss: 0.8175, test_loss: 1.0241, test_f1: 0.6002
 epoch: 78, train_loss: 0.8233, test_loss: 1.0239, test_f1: 0.5787
 epoch: 79, train_loss: 0.8177, test_loss: 1.0192, test_f1: 0.5895
 epoch: 80, train_loss: 0.8239, test_loss: 1.0258, test_f1: 0.5811
 epoch: 81, train_loss: 0.8171, test_loss: 1.0228, test_f1: 0.5844
 epoch: 82, train_loss: 0.8132, test_loss: 1.0235, test_f1: 0.5844
 epoch: 83, train_loss: 0.7975, test_loss: 1.0265, test_f1: 0.5919
 epoch: 84, train_loss: 0.8036, test_loss: 1.0301, test_f1: 0.5844
 epoch: 85, train_loss: 0.8106, test_loss: 1.0255, test_f1: 0.5854
 epoch: 86, train_loss: 0.8076, test_loss: 1.0271, test_f1: 0.6003
 epoch: 87, train_loss: 0.8074, test_loss: 1.0355, test_f1: 0.5782
 epoch: 88, train_loss: 0.8100, test_loss: 1.0276, test_f1: 0.5771
 epoch: 89, train_loss: 0.8167, test_loss: 1.0307, test_f1: 0.5931
 epoch: 90, train_loss: 0.8023, test_loss: 1.0305, test_f1: 0.5819
 epoch: 91, train_loss: 0.8126, test_loss: 1.0324, test_f1: 0.5891
 epoch: 92, train_loss: 0.8080, test_loss: 1.0284, test_f1: 0.5989
 epoch: 93, train_loss: 0.8070, test_loss: 1.0396, test_f1: 0.5844
 epoch: 94, train_loss: 0.7959, test_loss: 1.0373, test_f1: 0.5836
 epoch: 95, train_loss: 0.7981, test_loss: 1.0319, test_f1: 0.6000
 epoch: 96, train_loss: 0.8047, test_loss: 1.0276, test_f1: 0.5891
 epoch: 97, train_loss: 0.8008, test_loss: 1.0270, test_f1: 0.5741
 epoch: 98, train_loss: 0.7928, test_loss: 1.0434, test_f1: 0.5942
 epoch: 99, train_loss: 0.7989, test_loss: 1.0445, test_f1: 0.5911
##################ITERATION #8 ****************************************
 epoch: 0, train_loss: 1.2280, test_loss: 1.2694, test_f1: 0.2281
 epoch: 1, train_loss: 1.1502, test_loss: 1.2238, test_f1: 0.3155
 epoch: 2, train_loss: 1.1357, test_loss: 1.1885, test_f1: 0.3639
 epoch: 3, train_loss: 1.1209, test_loss: 1.1773, test_f1: 0.3428
 epoch: 4, train_loss: 1.1013, test_loss: 1.1715, test_f1: 0.3580
 epoch: 5, train_loss: 1.0784, test_loss: 1.1577, test_f1: 0.3699
 epoch: 6, train_loss: 1.0676, test_loss: 1.1548, test_f1: 0.3599
 epoch: 7, train_loss: 1.0508, test_loss: 1.1480, test_f1: 0.3742
 epoch: 8, train_loss: 1.0576, test_loss: 1.1401, test_f1: 0.4216
 epoch: 9, train_loss: 1.0343, test_loss: 1.1327, test_f1: 0.4369
 epoch: 10, train_loss: 1.0259, test_loss: 1.1206, test_f1: 0.4408
 epoch: 11, train_loss: 1.0224, test_loss: 1.1132, test_f1: 0.4280
 epoch: 12, train_loss: 1.0085, test_loss: 1.1059, test_f1: 0.4528
 epoch: 13, train_loss: 0.9930, test_loss: 1.0987, test_f1: 0.4549
 epoch: 14, train_loss: 0.9973, test_loss: 1.0970, test_f1: 0.4881
 epoch: 15, train_loss: 0.9886, test_loss: 1.0869, test_f1: 0.4967
 epoch: 16, train_loss: 0.9772, test_loss: 1.0807, test_f1: 0.5031
 epoch: 17, train_loss: 0.9713, test_loss: 1.0782, test_f1: 0.5108
 epoch: 18, train_loss: 0.9703, test_loss: 1.0840, test_f1: 0.5137
 epoch: 19, train_loss: 0.9763, test_loss: 1.0772, test_f1: 0.5051
 epoch: 20, train_loss: 0.9455, test_loss: 1.0723, test_f1: 0.5162
 epoch: 21, train_loss: 0.9574, test_loss: 1.0737, test_f1: 0.5101
 epoch: 22, train_loss: 0.9505, test_loss: 1.0665, test_f1: 0.5252
 epoch: 23, train_loss: 0.9501, test_loss: 1.0651, test_f1: 0.5292
 epoch: 24, train_loss: 0.9426, test_loss: 1.0506, test_f1: 0.5418
 epoch: 25, train_loss: 0.9316, test_loss: 1.0540, test_f1: 0.5358
 epoch: 26, train_loss: 0.9187, test_loss: 1.0546, test_f1: 0.5252
 epoch: 27, train_loss: 0.9358, test_loss: 1.0625, test_f1: 0.5251
 epoch: 28, train_loss: 0.9215, test_loss: 1.0624, test_f1: 0.5262
 epoch: 29, train_loss: 0.9147, test_loss: 1.0418, test_f1: 0.5460
 epoch: 30, train_loss: 0.9222, test_loss: 1.0548, test_f1: 0.5203
 epoch: 31, train_loss: 0.9125, test_loss: 1.0469, test_f1: 0.5463
 epoch: 32, train_loss: 0.9069, test_loss: 1.0510, test_f1: 0.5424
 epoch: 33, train_loss: 0.8988, test_loss: 1.0496, test_f1: 0.5516
 epoch: 34, train_loss: 0.9066, test_loss: 1.0413, test_f1: 0.5332
 epoch: 35, train_loss: 0.8894, test_loss: 1.0406, test_f1: 0.5650
 epoch: 36, train_loss: 0.8903, test_loss: 1.0395, test_f1: 0.5696
 epoch: 37, train_loss: 0.8851, test_loss: 1.0445, test_f1: 0.5447
 epoch: 38, train_loss: 0.8725, test_loss: 1.0411, test_f1: 0.5490
 epoch: 39, train_loss: 0.8747, test_loss: 1.0314, test_f1: 0.5729
 epoch: 40, train_loss: 0.8811, test_loss: 1.0397, test_f1: 0.5628
 epoch: 41, train_loss: 0.8609, test_loss: 1.0499, test_f1: 0.5404
 epoch: 42, train_loss: 0.8755, test_loss: 1.0409, test_f1: 0.5579
 epoch: 43, train_loss: 0.8663, test_loss: 1.0403, test_f1: 0.5494
 epoch: 44, train_loss: 0.8599, test_loss: 1.0384, test_f1: 0.5594
 epoch: 45, train_loss: 0.8574, test_loss: 1.0480, test_f1: 0.5416
 epoch: 46, train_loss: 0.8550, test_loss: 1.0508, test_f1: 0.5378
 epoch: 47, train_loss: 0.8516, test_loss: 1.0563, test_f1: 0.5355
 epoch: 48, train_loss: 0.8490, test_loss: 1.0585, test_f1: 0.5404
 epoch: 49, train_loss: 0.8482, test_loss: 1.0539, test_f1: 0.5588
 epoch: 50, train_loss: 0.8419, test_loss: 1.0526, test_f1: 0.5368
 epoch: 51, train_loss: 0.8348, test_loss: 1.0552, test_f1: 0.5345
 epoch: 52, train_loss: 0.8251, test_loss: 1.0493, test_f1: 0.5432
 epoch: 53, train_loss: 0.8498, test_loss: 1.0535, test_f1: 0.5424
 epoch: 54, train_loss: 0.8284, test_loss: 1.0507, test_f1: 0.5342
 epoch: 55, train_loss: 0.8402, test_loss: 1.0536, test_f1: 0.5371
 epoch: 56, train_loss: 0.8320, test_loss: 1.0580, test_f1: 0.5305
 epoch: 57, train_loss: 0.8267, test_loss: 1.0604, test_f1: 0.5308
 epoch: 58, train_loss: 0.8292, test_loss: 1.0633, test_f1: 0.5299
 epoch: 59, train_loss: 0.8226, test_loss: 1.0542, test_f1: 0.5397
 epoch: 60, train_loss: 0.8241, test_loss: 1.0511, test_f1: 0.5375
 epoch: 61, train_loss: 0.8293, test_loss: 1.0499, test_f1: 0.5411
 epoch: 62, train_loss: 0.8229, test_loss: 1.0631, test_f1: 0.5370
 epoch: 63, train_loss: 0.8135, test_loss: 1.0642, test_f1: 0.5293
 epoch: 64, train_loss: 0.8201, test_loss: 1.0667, test_f1: 0.5232
 epoch: 65, train_loss: 0.8240, test_loss: 1.0801, test_f1: 0.5332
 epoch: 66, train_loss: 0.8255, test_loss: 1.0710, test_f1: 0.5478
 epoch: 67, train_loss: 0.8125, test_loss: 1.0642, test_f1: 0.5385
 epoch: 68, train_loss: 0.8160, test_loss: 1.0715, test_f1: 0.5368
 epoch: 69, train_loss: 0.8093, test_loss: 1.0764, test_f1: 0.5282
 epoch: 70, train_loss: 0.8150, test_loss: 1.0693, test_f1: 0.5288
 epoch: 71, train_loss: 0.8229, test_loss: 1.0783, test_f1: 0.5293
 epoch: 72, train_loss: 0.8086, test_loss: 1.0638, test_f1: 0.5466
 epoch: 73, train_loss: 0.7942, test_loss: 1.0777, test_f1: 0.5295
 epoch: 74, train_loss: 0.7995, test_loss: 1.0897, test_f1: 0.5158
 epoch: 75, train_loss: 0.8071, test_loss: 1.0759, test_f1: 0.5370
 epoch: 76, train_loss: 0.8104, test_loss: 1.0750, test_f1: 0.5208
 epoch: 77, train_loss: 0.8001, test_loss: 1.0823, test_f1: 0.5329
 epoch: 78, train_loss: 0.7927, test_loss: 1.0891, test_f1: 0.5167
 epoch: 79, train_loss: 0.8079, test_loss: 1.0721, test_f1: 0.5364
 epoch: 80, train_loss: 0.7954, test_loss: 1.0924, test_f1: 0.5285
 epoch: 81, train_loss: 0.7969, test_loss: 1.0792, test_f1: 0.5371
 epoch: 82, train_loss: 0.8035, test_loss: 1.0934, test_f1: 0.5331
 epoch: 83, train_loss: 0.7918, test_loss: 1.0843, test_f1: 0.5407
 epoch: 84, train_loss: 0.7848, test_loss: 1.1117, test_f1: 0.5362
 epoch: 85, train_loss: 0.7784, test_loss: 1.0962, test_f1: 0.5344
 epoch: 86, train_loss: 0.7869, test_loss: 1.0920, test_f1: 0.5351
 epoch: 87, train_loss: 0.7857, test_loss: 1.0886, test_f1: 0.5293
 epoch: 88, train_loss: 0.7858, test_loss: 1.0944, test_f1: 0.5178
 epoch: 89, train_loss: 0.7866, test_loss: 1.1127, test_f1: 0.5281
 epoch: 90, train_loss: 0.7675, test_loss: 1.0873, test_f1: 0.5306
 epoch: 91, train_loss: 0.7536, test_loss: 1.0825, test_f1: 0.5371
 epoch: 92, train_loss: 0.7865, test_loss: 1.1020, test_f1: 0.5371
 epoch: 93, train_loss: 0.7716, test_loss: 1.1146, test_f1: 0.5300
 epoch: 94, train_loss: 0.7787, test_loss: 1.1164, test_f1: 0.5334
 epoch: 95, train_loss: 0.7719, test_loss: 1.1224, test_f1: 0.5234
 epoch: 96, train_loss: 0.7694, test_loss: 1.1173, test_f1: 0.5281
 epoch: 97, train_loss: 0.7683, test_loss: 1.1200, test_f1: 0.5336
 epoch: 98, train_loss: 0.7705, test_loss: 1.0889, test_f1: 0.5326
 epoch: 99, train_loss: 0.7693, test_loss: 1.1140, test_f1: 0.5234
##################ITERATION #9 ****************************************
 epoch: 0, train_loss: 1.2660, test_loss: 1.2751, test_f1: 0.2281
 epoch: 1, train_loss: 1.1710, test_loss: 1.2320, test_f1: 0.2706
 epoch: 2, train_loss: 1.1501, test_loss: 1.1915, test_f1: 0.3416
 epoch: 3, train_loss: 1.1210, test_loss: 1.1698, test_f1: 0.3660
 epoch: 4, train_loss: 1.1172, test_loss: 1.1550, test_f1: 0.3662
 epoch: 5, train_loss: 1.0976, test_loss: 1.1396, test_f1: 0.3669
 epoch: 6, train_loss: 1.0773, test_loss: 1.1275, test_f1: 0.3738
 epoch: 7, train_loss: 1.0739, test_loss: 1.1215, test_f1: 0.3750
 epoch: 8, train_loss: 1.0778, test_loss: 1.1160, test_f1: 0.3707
 epoch: 9, train_loss: 1.0472, test_loss: 1.1123, test_f1: 0.3745
 epoch: 10, train_loss: 1.0389, test_loss: 1.0988, test_f1: 0.3686
 epoch: 11, train_loss: 1.0453, test_loss: 1.0932, test_f1: 0.3925
 epoch: 12, train_loss: 1.0363, test_loss: 1.0873, test_f1: 0.3953
 epoch: 13, train_loss: 1.0230, test_loss: 1.0870, test_f1: 0.4495
 epoch: 14, train_loss: 1.0077, test_loss: 1.0749, test_f1: 0.4635
 epoch: 15, train_loss: 1.0149, test_loss: 1.0871, test_f1: 0.4635
 epoch: 16, train_loss: 1.0024, test_loss: 1.0710, test_f1: 0.4575
 epoch: 17, train_loss: 0.9888, test_loss: 1.0647, test_f1: 0.4604
 epoch: 18, train_loss: 0.9757, test_loss: 1.0617, test_f1: 0.4690
 epoch: 19, train_loss: 0.9796, test_loss: 1.0637, test_f1: 0.4690
 epoch: 20, train_loss: 0.9800, test_loss: 1.0626, test_f1: 0.4775
 epoch: 21, train_loss: 0.9671, test_loss: 1.0485, test_f1: 0.4795
 epoch: 22, train_loss: 0.9539, test_loss: 1.0330, test_f1: 0.4886
 epoch: 23, train_loss: 0.9516, test_loss: 1.0437, test_f1: 0.4794
 epoch: 24, train_loss: 0.9501, test_loss: 1.0367, test_f1: 0.4951
 epoch: 25, train_loss: 0.9520, test_loss: 1.0425, test_f1: 0.4890
 epoch: 26, train_loss: 0.9416, test_loss: 1.0383, test_f1: 0.4798
 epoch: 27, train_loss: 0.9359, test_loss: 1.0368, test_f1: 0.4872
 epoch: 28, train_loss: 0.9468, test_loss: 1.0345, test_f1: 0.5013
 epoch: 29, train_loss: 0.9239, test_loss: 1.0398, test_f1: 0.5026
 epoch: 30, train_loss: 0.9311, test_loss: 1.0451, test_f1: 0.5043
 epoch: 31, train_loss: 0.9213, test_loss: 1.0492, test_f1: 0.4891
 epoch: 32, train_loss: 0.9120, test_loss: 1.0383, test_f1: 0.4793
 epoch: 33, train_loss: 0.9151, test_loss: 1.0433, test_f1: 0.4956
 epoch: 34, train_loss: 0.9008, test_loss: 1.0355, test_f1: 0.4921
 epoch: 35, train_loss: 0.9140, test_loss: 1.0416, test_f1: 0.5167
 epoch: 36, train_loss: 0.8958, test_loss: 1.0441, test_f1: 0.5022
 epoch: 37, train_loss: 0.9079, test_loss: 1.0356, test_f1: 0.5099
 epoch: 38, train_loss: 0.8913, test_loss: 1.0394, test_f1: 0.5099
 epoch: 39, train_loss: 0.8905, test_loss: 1.0426, test_f1: 0.5074
 epoch: 40, train_loss: 0.8999, test_loss: 1.0433, test_f1: 0.4914
 epoch: 41, train_loss: 0.8851, test_loss: 1.0638, test_f1: 0.5037
 epoch: 42, train_loss: 0.8850, test_loss: 1.0614, test_f1: 0.5203
 epoch: 43, train_loss: 0.8895, test_loss: 1.0440, test_f1: 0.5062
 epoch: 44, train_loss: 0.8842, test_loss: 1.0475, test_f1: 0.5157
 epoch: 45, train_loss: 0.8775, test_loss: 1.0536, test_f1: 0.5046
 epoch: 46, train_loss: 0.8854, test_loss: 1.0576, test_f1: 0.5130
 epoch: 47, train_loss: 0.8678, test_loss: 1.0627, test_f1: 0.5117
 epoch: 48, train_loss: 0.8767, test_loss: 1.0537, test_f1: 0.5203
 epoch: 49, train_loss: 0.8680, test_loss: 1.0477, test_f1: 0.5318
 epoch: 50, train_loss: 0.8591, test_loss: 1.0520, test_f1: 0.5281
 epoch: 51, train_loss: 0.8732, test_loss: 1.0565, test_f1: 0.5297
 epoch: 52, train_loss: 0.8599, test_loss: 1.0585, test_f1: 0.5430
 epoch: 53, train_loss: 0.8548, test_loss: 1.0568, test_f1: 0.5350
 epoch: 54, train_loss: 0.8599, test_loss: 1.0594, test_f1: 0.5318
 epoch: 55, train_loss: 0.8524, test_loss: 1.0449, test_f1: 0.5308
 epoch: 56, train_loss: 0.8509, test_loss: 1.0483, test_f1: 0.5274
 epoch: 57, train_loss: 0.8570, test_loss: 1.0507, test_f1: 0.5244
 epoch: 58, train_loss: 0.8675, test_loss: 1.0585, test_f1: 0.5367
 epoch: 59, train_loss: 0.8536, test_loss: 1.0593, test_f1: 0.5500
 epoch: 60, train_loss: 0.8495, test_loss: 1.0480, test_f1: 0.5355
 epoch: 61, train_loss: 0.8559, test_loss: 1.0583, test_f1: 0.5259
 epoch: 62, train_loss: 0.8429, test_loss: 1.0475, test_f1: 0.5391
 epoch: 63, train_loss: 0.8461, test_loss: 1.0621, test_f1: 0.5356
 epoch: 64, train_loss: 0.8480, test_loss: 1.0669, test_f1: 0.5374
 epoch: 65, train_loss: 0.8329, test_loss: 1.0582, test_f1: 0.5480
 epoch: 66, train_loss: 0.8434, test_loss: 1.0625, test_f1: 0.5497
 epoch: 67, train_loss: 0.8363, test_loss: 1.0559, test_f1: 0.5441
 epoch: 68, train_loss: 0.8327, test_loss: 1.0524, test_f1: 0.5519
 epoch: 69, train_loss: 0.8406, test_loss: 1.0545, test_f1: 0.5342
 epoch: 70, train_loss: 0.8341, test_loss: 1.0573, test_f1: 0.5530
 epoch: 71, train_loss: 0.8434, test_loss: 1.0520, test_f1: 0.5540
 epoch: 72, train_loss: 0.8291, test_loss: 1.0551, test_f1: 0.5373
 epoch: 73, train_loss: 0.8291, test_loss: 1.0568, test_f1: 0.5459
 epoch: 74, train_loss: 0.8342, test_loss: 1.0585, test_f1: 0.5461
 epoch: 75, train_loss: 0.8328, test_loss: 1.0654, test_f1: 0.5507
 epoch: 76, train_loss: 0.8337, test_loss: 1.0558, test_f1: 0.5529
 epoch: 77, train_loss: 0.8325, test_loss: 1.0468, test_f1: 0.5631
 epoch: 78, train_loss: 0.8336, test_loss: 1.0443, test_f1: 0.5753
 epoch: 79, train_loss: 0.8297, test_loss: 1.0480, test_f1: 0.5422
 epoch: 80, train_loss: 0.8350, test_loss: 1.0455, test_f1: 0.5530
 epoch: 81, train_loss: 0.8293, test_loss: 1.0598, test_f1: 0.5552
 epoch: 82, train_loss: 0.8283, test_loss: 1.0491, test_f1: 0.5591
 epoch: 83, train_loss: 0.8233, test_loss: 1.0563, test_f1: 0.5380
 epoch: 84, train_loss: 0.8213, test_loss: 1.0469, test_f1: 0.5446
 epoch: 85, train_loss: 0.8142, test_loss: 1.0510, test_f1: 0.5448
 epoch: 86, train_loss: 0.8133, test_loss: 1.0511, test_f1: 0.5591
 epoch: 87, train_loss: 0.8203, test_loss: 1.0500, test_f1: 0.5561
 epoch: 88, train_loss: 0.8209, test_loss: 1.0434, test_f1: 0.5545
 epoch: 89, train_loss: 0.8240, test_loss: 1.0563, test_f1: 0.5352
 epoch: 90, train_loss: 0.8265, test_loss: 1.0663, test_f1: 0.5631
 epoch: 91, train_loss: 0.8124, test_loss: 1.0452, test_f1: 0.5585
 epoch: 92, train_loss: 0.8267, test_loss: 1.0439, test_f1: 0.5542
 epoch: 93, train_loss: 0.8212, test_loss: 1.0566, test_f1: 0.5507
 epoch: 94, train_loss: 0.8176, test_loss: 1.0559, test_f1: 0.5469
 epoch: 95, train_loss: 0.8096, test_loss: 1.0485, test_f1: 0.5487
 epoch: 96, train_loss: 0.8120, test_loss: 1.0481, test_f1: 0.5643
 epoch: 97, train_loss: 0.8055, test_loss: 1.0526, test_f1: 0.5578
 epoch: 98, train_loss: 0.8120, test_loss: 1.0530, test_f1: 0.5504
 epoch: 99, train_loss: 0.8187, test_loss: 1.0564, test_f1: 0.5495

Training completed in 374.57 seconds
Best F1: 0.6003 at epoch 86
Mean F1 across iterations: 0.5623  0.0237
========================FINAL RESULTS================================
FEGIN weighted F1: 0.6003  0.0237
python main.py --data ltspice_demos --representation component_net --model FEGIN --layers 2 --hiddens 64 --batch_size 64 --lr 0.0001 --emb_size 128 --epochs 100 --save_appendix component_net_L2_H64_BS64_LR0.0001_E128 --no_val
-----



STDERR:
  File "main.py", line 370, in <module>
    main()
  File "main.py", line 254, in main
    dataset = dataset_class(
  File "/home/philip/projects/ltspice_examples_code_repo/Circuit-Completion-Using-GNNs/component_classification_with_link_prediction_head/evaluation/FEGIN/kernel/circuit_datasets.py", line 15, in __init__
    self.data, self.slices = torch.load(self.processed_paths[0])
  File "/home/philip/.local/lib/python3.8/site-packages/torch/serialization.py", line 1040, in load
    warnings.warn(
  File "/usr/lib/python3.8/warnings.py", line 109, in _showwarnmsg
    sw(msg.message, msg.category, msg.filename, msg.lineno,
  File "main.py", line 47, in warn_with_traceback
    traceback.print_stack(file=log)
/home/philip/projects/ltspice_examples_code_repo/Circuit-Completion-Using-GNNs/component_classification_with_link_prediction_head/evaluation/FEGIN/kernel/circuit_datasets.py:15: FutureWarning: You are using `torch.load` with `weights_only=False` (the current default value), which uses the default pickle module implicitly. It is possible to construct malicious pickle data which will execute arbitrary code during unpickling (See https://github.com/pytorch/pytorch/blob/main/SECURITY.md#untrusted-models for more details). In a future release, the default value for `weights_only` will be flipped to `True`. This limits the functions that could be executed during unpickling. Arbitrary objects will no longer be allowed to be loaded via this mode unless they are explicitly allowlisted by the user via `torch.serialization.add_safe_globals`. We recommend you start setting `weights_only=True` for any use case where you don't have full control of the loaded file. Please open an issue on GitHub for any issues related to this experimental feature.
  self.data, self.slices = torch.load(self.processed_paths[0])
