STDOUT:
Results will be saved in /home/philip/projects/ltspice_examples_code_repo/Circuit-Completion-Using-GNNs/component_classification_with_link_prediction_head/evaluation/FEGIN/results/model_FEGIN_dataset_ltspice_examples
Command line input: python main.py --data ltspice_examples --representation component_pin --model FEGIN --layers 3 --hiddens 128 --batch_size 64 --lr 0.01 --emb_size 512 --epochs 100 --save_appendix component_pin_L3_H128_BS64_LR0.01_E512 --no_val
 is saved.
-----
ltspice_examples - FEGIN
Using 3 layers, 128 hidden units, h = 2
Loading component_pin representation dataset
ENTERED
Training FEGIN on component_pin representation
Train: 3560, Test: 848
##################ITERATION #0 ****************************************
 epoch: 0, train_loss: 1.1344, test_loss: 1.1414, test_f1: 0.4739
 epoch: 1, train_loss: 1.0052, test_loss: 1.0857, test_f1: 0.4513
 epoch: 2, train_loss: 0.9627, test_loss: 0.9519, test_f1: 0.4897
 epoch: 3, train_loss: 0.9417, test_loss: 1.0196, test_f1: 0.4935
 epoch: 4, train_loss: 0.9030, test_loss: 0.9928, test_f1: 0.4858
 epoch: 5, train_loss: 0.9143, test_loss: 1.0340, test_f1: 0.5210
 epoch: 6, train_loss: 0.8705, test_loss: 0.9420, test_f1: 0.5329
 epoch: 7, train_loss: 0.8690, test_loss: 0.9503, test_f1: 0.5375
 epoch: 8, train_loss: 0.8336, test_loss: 0.9263, test_f1: 0.5249
 epoch: 9, train_loss: 0.8326, test_loss: 0.8177, test_f1: 0.5594
 epoch: 10, train_loss: 0.8169, test_loss: 0.9716, test_f1: 0.5265
 epoch: 11, train_loss: 0.8086, test_loss: 0.9910, test_f1: 0.5243
 epoch: 12, train_loss: 0.7986, test_loss: 0.9987, test_f1: 0.5458
 epoch: 13, train_loss: 0.7898, test_loss: 0.8468, test_f1: 0.5393
 epoch: 14, train_loss: 0.7910, test_loss: 0.9329, test_f1: 0.5419
 epoch: 15, train_loss: 0.7634, test_loss: 1.0812, test_f1: 0.4944
 epoch: 16, train_loss: 0.7464, test_loss: 0.9149, test_f1: 0.5709
 epoch: 17, train_loss: 0.7547, test_loss: 0.9338, test_f1: 0.5560
 epoch: 18, train_loss: 0.7355, test_loss: 1.0290, test_f1: 0.5411
 epoch: 19, train_loss: 0.7103, test_loss: 1.1324, test_f1: 0.5363
 epoch: 20, train_loss: 0.7113, test_loss: 0.9966, test_f1: 0.5618
 epoch: 21, train_loss: 0.7218, test_loss: 0.8215, test_f1: 0.6082
 epoch: 22, train_loss: 0.6992, test_loss: 1.0354, test_f1: 0.6198
 epoch: 23, train_loss: 0.6976, test_loss: 1.1940, test_f1: 0.5069
 epoch: 24, train_loss: 0.7226, test_loss: 1.1397, test_f1: 0.6111
 epoch: 25, train_loss: 0.6960, test_loss: 0.9071, test_f1: 0.5544
 epoch: 26, train_loss: 0.6657, test_loss: 0.8831, test_f1: 0.5832
 epoch: 27, train_loss: 0.6850, test_loss: 1.3909, test_f1: 0.5007
 epoch: 28, train_loss: 0.6873, test_loss: 0.9890, test_f1: 0.6250
 epoch: 29, train_loss: 0.6584, test_loss: 0.8965, test_f1: 0.6051
 epoch: 30, train_loss: 0.6176, test_loss: 0.7583, test_f1: 0.6536
 epoch: 31, train_loss: 0.6253, test_loss: 0.9670, test_f1: 0.6138
 epoch: 32, train_loss: 0.6135, test_loss: 0.9662, test_f1: 0.6060
 epoch: 33, train_loss: 0.6072, test_loss: 0.9161, test_f1: 0.6131
 epoch: 34, train_loss: 0.6011, test_loss: 1.0553, test_f1: 0.5933
 epoch: 35, train_loss: 0.5902, test_loss: 1.2460, test_f1: 0.5581
 epoch: 36, train_loss: 0.6013, test_loss: 0.9045, test_f1: 0.6626
 epoch: 37, train_loss: 0.6038, test_loss: 0.9717, test_f1: 0.6578
 epoch: 38, train_loss: 0.5793, test_loss: 0.9957, test_f1: 0.6276
 epoch: 39, train_loss: 0.5694, test_loss: 1.1730, test_f1: 0.6466
 epoch: 40, train_loss: 0.5559, test_loss: 1.1015, test_f1: 0.6169
 epoch: 41, train_loss: 0.5607, test_loss: 0.9002, test_f1: 0.6433
 epoch: 42, train_loss: 0.5491, test_loss: 0.9809, test_f1: 0.6444
 epoch: 43, train_loss: 0.5474, test_loss: 0.9894, test_f1: 0.6142
 epoch: 44, train_loss: 0.5483, test_loss: 1.0101, test_f1: 0.6236
 epoch: 45, train_loss: 0.5439, test_loss: 0.9688, test_f1: 0.6392
 epoch: 46, train_loss: 0.5348, test_loss: 1.0057, test_f1: 0.6286
 epoch: 47, train_loss: 0.5070, test_loss: 1.0444, test_f1: 0.6479
 epoch: 48, train_loss: 0.5317, test_loss: 1.0951, test_f1: 0.6015
 epoch: 49, train_loss: 0.4831, test_loss: 1.3464, test_f1: 0.6154
 epoch: 50, train_loss: 0.5241, test_loss: 0.9632, test_f1: 0.6560
 epoch: 51, train_loss: 0.4630, test_loss: 1.2274, test_f1: 0.6303
 epoch: 52, train_loss: 0.4423, test_loss: 1.0918, test_f1: 0.6513
 epoch: 53, train_loss: 0.4044, test_loss: 1.1554, test_f1: 0.6687
 epoch: 54, train_loss: 0.4005, test_loss: 1.0868, test_f1: 0.6643
 epoch: 55, train_loss: 0.3896, test_loss: 1.2163, test_f1: 0.6308
 epoch: 56, train_loss: 0.4133, test_loss: 1.1299, test_f1: 0.6427
 epoch: 57, train_loss: 0.3932, test_loss: 1.1465, test_f1: 0.6539
 epoch: 58, train_loss: 0.3660, test_loss: 1.2151, test_f1: 0.6555
 epoch: 59, train_loss: 0.3808, test_loss: 1.2997, test_f1: 0.6420
 epoch: 60, train_loss: 0.3747, test_loss: 1.2462, test_f1: 0.6723
 epoch: 61, train_loss: 0.3671, test_loss: 1.1014, test_f1: 0.6693
 epoch: 62, train_loss: 0.3727, test_loss: 1.3022, test_f1: 0.6576
 epoch: 63, train_loss: 0.3873, test_loss: 1.1489, test_f1: 0.6657
 epoch: 64, train_loss: 0.3624, test_loss: 1.1860, test_f1: 0.6779
 epoch: 65, train_loss: 0.3505, test_loss: 1.1394, test_f1: 0.6412
 epoch: 66, train_loss: 0.3623, test_loss: 1.0540, test_f1: 0.6562
 epoch: 67, train_loss: 0.3343, test_loss: 1.3446, test_f1: 0.6434
 epoch: 68, train_loss: 0.3472, test_loss: 1.0926, test_f1: 0.6758
 epoch: 69, train_loss: 0.3376, test_loss: 1.0446, test_f1: 0.6675
 epoch: 70, train_loss: 0.3386, test_loss: 1.1140, test_f1: 0.6566
 epoch: 71, train_loss: 0.3596, test_loss: 1.1578, test_f1: 0.6579
 epoch: 72, train_loss: 0.3241, test_loss: 1.2519, test_f1: 0.6597
 epoch: 73, train_loss: 0.3278, test_loss: 1.2076, test_f1: 0.6776
 epoch: 74, train_loss: 0.3255, test_loss: 1.3635, test_f1: 0.6620
 epoch: 75, train_loss: 0.3288, test_loss: 1.2815, test_f1: 0.6334
 epoch: 76, train_loss: 0.3306, test_loss: 1.2978, test_f1: 0.6891
 epoch: 77, train_loss: 0.3126, test_loss: 1.2921, test_f1: 0.6826
 epoch: 78, train_loss: 0.3319, test_loss: 1.0987, test_f1: 0.6756
 epoch: 79, train_loss: 0.3087, test_loss: 1.4068, test_f1: 0.6507
 epoch: 80, train_loss: 0.3076, test_loss: 1.2639, test_f1: 0.6625
 epoch: 81, train_loss: 0.2994, test_loss: 1.2629, test_f1: 0.6617
 epoch: 82, train_loss: 0.2950, test_loss: 1.2877, test_f1: 0.6587
 epoch: 83, train_loss: 0.2735, test_loss: 1.3724, test_f1: 0.6540
 epoch: 84, train_loss: 0.2865, test_loss: 1.3813, test_f1: 0.6665
 epoch: 85, train_loss: 0.2968, test_loss: 1.2690, test_f1: 0.6675
 epoch: 86, train_loss: 0.2896, test_loss: 1.2772, test_f1: 0.6788
 epoch: 87, train_loss: 0.2669, test_loss: 1.4944, test_f1: 0.6528
 epoch: 88, train_loss: 0.2971, test_loss: 1.3055, test_f1: 0.6392
 epoch: 89, train_loss: 0.3034, test_loss: 1.4509, test_f1: 0.6624
 epoch: 90, train_loss: 0.3033, test_loss: 1.2012, test_f1: 0.6742
 epoch: 91, train_loss: 0.3046, test_loss: 1.5742, test_f1: 0.6610
 epoch: 92, train_loss: 0.3032, test_loss: 1.2351, test_f1: 0.6793
 epoch: 93, train_loss: 0.2642, test_loss: 1.3259, test_f1: 0.6607
 epoch: 94, train_loss: 0.2659, test_loss: 1.3538, test_f1: 0.6756
 epoch: 95, train_loss: 0.2498, test_loss: 1.8827, test_f1: 0.6160
 epoch: 96, train_loss: 0.2651, test_loss: 1.4047, test_f1: 0.6715
 epoch: 97, train_loss: 0.2545, test_loss: 1.5342, test_f1: 0.6690
 epoch: 98, train_loss: 0.2475, test_loss: 1.6024, test_f1: 0.6552
 epoch: 99, train_loss: 0.2541, test_loss: 1.5490, test_f1: 0.6674
##################ITERATION #1 ****************************************
 epoch: 0, train_loss: 1.1676, test_loss: 1.1217, test_f1: 0.4423
 epoch: 1, train_loss: 0.9965, test_loss: 0.9333, test_f1: 0.4744
 epoch: 2, train_loss: 0.9516, test_loss: 1.1764, test_f1: 0.4503
 epoch: 3, train_loss: 0.9076, test_loss: 0.8678, test_f1: 0.5508
 epoch: 4, train_loss: 0.9071, test_loss: 0.8791, test_f1: 0.5247
 epoch: 5, train_loss: 0.8809, test_loss: 0.9853, test_f1: 0.4845
 epoch: 6, train_loss: 0.8615, test_loss: 1.0957, test_f1: 0.4348
 epoch: 7, train_loss: 0.8410, test_loss: 0.8955, test_f1: 0.5249
 epoch: 8, train_loss: 0.8305, test_loss: 0.9848, test_f1: 0.4849
 epoch: 9, train_loss: 0.8339, test_loss: 0.9887, test_f1: 0.4460
 epoch: 10, train_loss: 0.8300, test_loss: 1.0099, test_f1: 0.5171
 epoch: 11, train_loss: 0.7977, test_loss: 1.0413, test_f1: 0.4996
 epoch: 12, train_loss: 0.8085, test_loss: 1.1204, test_f1: 0.5312
 epoch: 13, train_loss: 0.7735, test_loss: 1.0634, test_f1: 0.4897
 epoch: 14, train_loss: 0.7832, test_loss: 0.9875, test_f1: 0.5738
 epoch: 15, train_loss: 0.7598, test_loss: 0.9651, test_f1: 0.5312
 epoch: 16, train_loss: 0.7737, test_loss: 1.5729, test_f1: 0.4532
 epoch: 17, train_loss: 0.7372, test_loss: 0.8921, test_f1: 0.5781
 epoch: 18, train_loss: 0.7263, test_loss: 0.8622, test_f1: 0.5841
 epoch: 19, train_loss: 0.7239, test_loss: 0.8002, test_f1: 0.6361
 epoch: 20, train_loss: 0.7085, test_loss: 0.8807, test_f1: 0.5869
 epoch: 21, train_loss: 0.7035, test_loss: 0.9375, test_f1: 0.5640
 epoch: 22, train_loss: 0.7141, test_loss: 0.9832, test_f1: 0.6184
 epoch: 23, train_loss: 0.6992, test_loss: 1.0693, test_f1: 0.6188
 epoch: 24, train_loss: 0.6822, test_loss: 0.9042, test_f1: 0.5553
 epoch: 25, train_loss: 0.6849, test_loss: 0.9843, test_f1: 0.5983
 epoch: 26, train_loss: 0.6836, test_loss: 1.0762, test_f1: 0.5565
 epoch: 27, train_loss: 0.6831, test_loss: 0.9312, test_f1: 0.6205
 epoch: 28, train_loss: 0.6735, test_loss: 0.8316, test_f1: 0.6135
 epoch: 29, train_loss: 0.6685, test_loss: 0.9525, test_f1: 0.6446
 epoch: 30, train_loss: 0.6654, test_loss: 1.3592, test_f1: 0.6178
 epoch: 31, train_loss: 0.6567, test_loss: 0.8286, test_f1: 0.6331
 epoch: 32, train_loss: 0.6443, test_loss: 1.0102, test_f1: 0.5687
 epoch: 33, train_loss: 0.6124, test_loss: 0.9343, test_f1: 0.6691
 epoch: 34, train_loss: 0.6392, test_loss: 0.8526, test_f1: 0.6048
 epoch: 35, train_loss: 0.6287, test_loss: 0.9737, test_f1: 0.6674
 epoch: 36, train_loss: 0.6264, test_loss: 0.9940, test_f1: 0.6136
 epoch: 37, train_loss: 0.6455, test_loss: 1.3033, test_f1: 0.5142
 epoch: 38, train_loss: 0.6460, test_loss: 1.3452, test_f1: 0.5377
 epoch: 39, train_loss: 0.6264, test_loss: 0.9369, test_f1: 0.6041
 epoch: 40, train_loss: 0.5964, test_loss: 0.9755, test_f1: 0.6755
 epoch: 41, train_loss: 0.5964, test_loss: 0.8800, test_f1: 0.6171
 epoch: 42, train_loss: 0.5807, test_loss: 1.0133, test_f1: 0.5850
 epoch: 43, train_loss: 0.5782, test_loss: 1.1923, test_f1: 0.5994
 epoch: 44, train_loss: 0.5759, test_loss: 1.0196, test_f1: 0.6214
 epoch: 45, train_loss: 0.5768, test_loss: 0.9236, test_f1: 0.6246
 epoch: 46, train_loss: 0.5483, test_loss: 0.9045, test_f1: 0.6440
 epoch: 47, train_loss: 0.5547, test_loss: 0.9725, test_f1: 0.6320
 epoch: 48, train_loss: 0.5288, test_loss: 0.7853, test_f1: 0.6391
 epoch: 49, train_loss: 0.5496, test_loss: 0.8907, test_f1: 0.6529
 epoch: 50, train_loss: 0.5726, test_loss: 0.8660, test_f1: 0.6180
 epoch: 51, train_loss: 0.5037, test_loss: 0.9049, test_f1: 0.6444
 epoch: 52, train_loss: 0.4727, test_loss: 0.9488, test_f1: 0.6837
 epoch: 53, train_loss: 0.4707, test_loss: 1.0026, test_f1: 0.6645
 epoch: 54, train_loss: 0.4449, test_loss: 0.8902, test_f1: 0.6785
 epoch: 55, train_loss: 0.4216, test_loss: 0.8585, test_f1: 0.6744
 epoch: 56, train_loss: 0.4344, test_loss: 0.8882, test_f1: 0.6545
 epoch: 57, train_loss: 0.4141, test_loss: 0.8829, test_f1: 0.6754
 epoch: 58, train_loss: 0.4028, test_loss: 0.8986, test_f1: 0.6747
 epoch: 59, train_loss: 0.4201, test_loss: 1.0207, test_f1: 0.6791
 epoch: 60, train_loss: 0.4071, test_loss: 1.0090, test_f1: 0.6896
 epoch: 61, train_loss: 0.4056, test_loss: 0.9873, test_f1: 0.6690
 epoch: 62, train_loss: 0.4048, test_loss: 0.9248, test_f1: 0.6625
 epoch: 63, train_loss: 0.3919, test_loss: 1.2282, test_f1: 0.6573
 epoch: 64, train_loss: 0.4009, test_loss: 0.9493, test_f1: 0.6718
 epoch: 65, train_loss: 0.3873, test_loss: 0.9446, test_f1: 0.6919
 epoch: 66, train_loss: 0.3856, test_loss: 1.0894, test_f1: 0.6772
 epoch: 67, train_loss: 0.3693, test_loss: 0.9592, test_f1: 0.6897
 epoch: 68, train_loss: 0.3654, test_loss: 0.8859, test_f1: 0.6982
 epoch: 69, train_loss: 0.3718, test_loss: 1.0413, test_f1: 0.6753
 epoch: 70, train_loss: 0.3653, test_loss: 0.9632, test_f1: 0.6945
 epoch: 71, train_loss: 0.3721, test_loss: 0.9931, test_f1: 0.6706
 epoch: 72, train_loss: 0.3601, test_loss: 1.0416, test_f1: 0.6752
 epoch: 73, train_loss: 0.3602, test_loss: 1.2707, test_f1: 0.6477
 epoch: 74, train_loss: 0.3515, test_loss: 1.0183, test_f1: 0.7105
 epoch: 75, train_loss: 0.3557, test_loss: 0.9629, test_f1: 0.6885
 epoch: 76, train_loss: 0.3483, test_loss: 1.0207, test_f1: 0.6782
 epoch: 77, train_loss: 0.3244, test_loss: 1.0311, test_f1: 0.6937
 epoch: 78, train_loss: 0.3451, test_loss: 0.9945, test_f1: 0.6665
 epoch: 79, train_loss: 0.3339, test_loss: 0.9811, test_f1: 0.6700
 epoch: 80, train_loss: 0.3080, test_loss: 1.0000, test_f1: 0.6860
 epoch: 81, train_loss: 0.3243, test_loss: 0.9674, test_f1: 0.6860
 epoch: 82, train_loss: 0.3287, test_loss: 1.0099, test_f1: 0.7158
 epoch: 83, train_loss: 0.3180, test_loss: 1.1314, test_f1: 0.6729
 epoch: 84, train_loss: 0.3229, test_loss: 0.9256, test_f1: 0.7058
 epoch: 85, train_loss: 0.3330, test_loss: 1.1019, test_f1: 0.6657
 epoch: 86, train_loss: 0.3362, test_loss: 1.1407, test_f1: 0.6472
 epoch: 87, train_loss: 0.3024, test_loss: 1.1760, test_f1: 0.6887
 epoch: 88, train_loss: 0.3122, test_loss: 0.9881, test_f1: 0.6949
 epoch: 89, train_loss: 0.2927, test_loss: 1.1427, test_f1: 0.6784
 epoch: 90, train_loss: 0.2997, test_loss: 1.0826, test_f1: 0.6941
 epoch: 91, train_loss: 0.2985, test_loss: 1.0644, test_f1: 0.6914
 epoch: 92, train_loss: 0.2970, test_loss: 1.0094, test_f1: 0.7046
 epoch: 93, train_loss: 0.2983, test_loss: 1.2101, test_f1: 0.6861
 epoch: 94, train_loss: 0.2862, test_loss: 1.1211, test_f1: 0.6819
 epoch: 95, train_loss: 0.2949, test_loss: 1.2034, test_f1: 0.6963
 epoch: 96, train_loss: 0.2745, test_loss: 1.2001, test_f1: 0.6839
 epoch: 97, train_loss: 0.2971, test_loss: 1.1154, test_f1: 0.6721
 epoch: 98, train_loss: 0.2849, test_loss: 1.1073, test_f1: 0.7121
 epoch: 99, train_loss: 0.2727, test_loss: 1.1414, test_f1: 0.6969
##################ITERATION #2 ****************************************
 epoch: 0, train_loss: 1.1486, test_loss: 1.1203, test_f1: 0.4275
 epoch: 1, train_loss: 1.0028, test_loss: 1.0412, test_f1: 0.4431
 epoch: 2, train_loss: 0.9616, test_loss: 1.0062, test_f1: 0.4535
 epoch: 3, train_loss: 0.9340, test_loss: 0.9878, test_f1: 0.4832
 epoch: 4, train_loss: 0.8995, test_loss: 1.0758, test_f1: 0.4686
 epoch: 5, train_loss: 0.8861, test_loss: 0.9728, test_f1: 0.5383
 epoch: 6, train_loss: 0.8934, test_loss: 1.0324, test_f1: 0.5031
 epoch: 7, train_loss: 0.8732, test_loss: 0.9066, test_f1: 0.5101
 epoch: 8, train_loss: 0.8485, test_loss: 0.9034, test_f1: 0.5229
 epoch: 9, train_loss: 0.8370, test_loss: 0.8571, test_f1: 0.5396
 epoch: 10, train_loss: 0.8163, test_loss: 0.9967, test_f1: 0.4911
 epoch: 11, train_loss: 0.8090, test_loss: 0.8592, test_f1: 0.6228
 epoch: 12, train_loss: 0.7967, test_loss: 0.9584, test_f1: 0.5813
 epoch: 13, train_loss: 0.7944, test_loss: 0.8227, test_f1: 0.5545
 epoch: 14, train_loss: 0.7775, test_loss: 0.9577, test_f1: 0.5607
 epoch: 15, train_loss: 0.7861, test_loss: 0.8812, test_f1: 0.5368
 epoch: 16, train_loss: 0.7814, test_loss: 0.9513, test_f1: 0.4986
 epoch: 17, train_loss: 0.7722, test_loss: 0.9924, test_f1: 0.5425
 epoch: 18, train_loss: 0.7569, test_loss: 0.9146, test_f1: 0.5852
 epoch: 19, train_loss: 0.7350, test_loss: 1.0055, test_f1: 0.5627
 epoch: 20, train_loss: 0.7287, test_loss: 0.8010, test_f1: 0.5462
 epoch: 21, train_loss: 0.7231, test_loss: 0.8614, test_f1: 0.6026
 epoch: 22, train_loss: 0.7269, test_loss: 0.8811, test_f1: 0.5586
 epoch: 23, train_loss: 0.7278, test_loss: 0.9339, test_f1: 0.6065
 epoch: 24, train_loss: 0.7124, test_loss: 0.8850, test_f1: 0.5323
 epoch: 25, train_loss: 0.7009, test_loss: 0.9978, test_f1: 0.5537
 epoch: 26, train_loss: 0.6945, test_loss: 0.9658, test_f1: 0.5511
 epoch: 27, train_loss: 0.6762, test_loss: 1.0133, test_f1: 0.5378
 epoch: 28, train_loss: 0.6850, test_loss: 0.9653, test_f1: 0.5648
 epoch: 29, train_loss: 0.6854, test_loss: 0.9497, test_f1: 0.6038
 epoch: 30, train_loss: 0.6706, test_loss: 0.8161, test_f1: 0.6135
 epoch: 31, train_loss: 0.6499, test_loss: 0.8208, test_f1: 0.6505
 epoch: 32, train_loss: 0.6481, test_loss: 0.8303, test_f1: 0.6266
 epoch: 33, train_loss: 0.6451, test_loss: 0.9397, test_f1: 0.5713
 epoch: 34, train_loss: 0.6386, test_loss: 0.8521, test_f1: 0.5891
 epoch: 35, train_loss: 0.6249, test_loss: 0.8139, test_f1: 0.6315
 epoch: 36, train_loss: 0.6094, test_loss: 0.8401, test_f1: 0.5959
 epoch: 37, train_loss: 0.6279, test_loss: 0.8012, test_f1: 0.6132
 epoch: 38, train_loss: 0.5988, test_loss: 0.9777, test_f1: 0.5746
 epoch: 39, train_loss: 0.6224, test_loss: 0.8330, test_f1: 0.6443
 epoch: 40, train_loss: 0.6253, test_loss: 0.9959, test_f1: 0.5831
 epoch: 41, train_loss: 0.5905, test_loss: 0.8598, test_f1: 0.6392
 epoch: 42, train_loss: 0.5970, test_loss: 0.8047, test_f1: 0.6156
 epoch: 43, train_loss: 0.5907, test_loss: 0.9725, test_f1: 0.5585
 epoch: 44, train_loss: 0.5812, test_loss: 1.1392, test_f1: 0.5516
 epoch: 45, train_loss: 0.5737, test_loss: 0.8520, test_f1: 0.6531
 epoch: 46, train_loss: 0.5823, test_loss: 1.1833, test_f1: 0.6263
 epoch: 47, train_loss: 0.5713, test_loss: 0.8837, test_f1: 0.6146
 epoch: 48, train_loss: 0.5809, test_loss: 0.9622, test_f1: 0.6404
 epoch: 49, train_loss: 0.5626, test_loss: 0.8999, test_f1: 0.6403
 epoch: 50, train_loss: 0.5802, test_loss: 1.0127, test_f1: 0.5900
 epoch: 51, train_loss: 0.5261, test_loss: 0.9951, test_f1: 0.6244
 epoch: 52, train_loss: 0.4815, test_loss: 0.8715, test_f1: 0.6471
 epoch: 53, train_loss: 0.4928, test_loss: 0.9810, test_f1: 0.6482
 epoch: 54, train_loss: 0.4702, test_loss: 1.0609, test_f1: 0.6492
 epoch: 55, train_loss: 0.4647, test_loss: 1.1209, test_f1: 0.5904
 epoch: 56, train_loss: 0.4543, test_loss: 1.1366, test_f1: 0.6287
 epoch: 57, train_loss: 0.4650, test_loss: 0.9776, test_f1: 0.6126
 epoch: 58, train_loss: 0.4563, test_loss: 0.8546, test_f1: 0.6581
 epoch: 59, train_loss: 0.4480, test_loss: 1.1054, test_f1: 0.6150
 epoch: 60, train_loss: 0.4468, test_loss: 0.9702, test_f1: 0.6566
 epoch: 61, train_loss: 0.4358, test_loss: 0.9448, test_f1: 0.6521
 epoch: 62, train_loss: 0.4464, test_loss: 0.8942, test_f1: 0.6395
 epoch: 63, train_loss: 0.4044, test_loss: 1.0815, test_f1: 0.6657
 epoch: 64, train_loss: 0.4542, test_loss: 1.0614, test_f1: 0.6414
 epoch: 65, train_loss: 0.4248, test_loss: 1.7105, test_f1: 0.5693
 epoch: 66, train_loss: 0.4138, test_loss: 1.1908, test_f1: 0.6330
 epoch: 67, train_loss: 0.4018, test_loss: 1.2505, test_f1: 0.6522
 epoch: 68, train_loss: 0.4161, test_loss: 1.1006, test_f1: 0.6372
 epoch: 69, train_loss: 0.4133, test_loss: 1.2950, test_f1: 0.6226
 epoch: 70, train_loss: 0.4097, test_loss: 0.8667, test_f1: 0.6776
 epoch: 71, train_loss: 0.3809, test_loss: 1.2984, test_f1: 0.6511
 epoch: 72, train_loss: 0.3892, test_loss: 1.2161, test_f1: 0.6311
 epoch: 73, train_loss: 0.3993, test_loss: 1.1794, test_f1: 0.6040
 epoch: 74, train_loss: 0.3851, test_loss: 1.1907, test_f1: 0.6500
 epoch: 75, train_loss: 0.3799, test_loss: 0.9674, test_f1: 0.6425
 epoch: 76, train_loss: 0.3848, test_loss: 1.0940, test_f1: 0.6797
 epoch: 77, train_loss: 0.3672, test_loss: 1.0980, test_f1: 0.6619
 epoch: 78, train_loss: 0.3775, test_loss: 1.0191, test_f1: 0.6085
 epoch: 79, train_loss: 0.3678, test_loss: 1.2110, test_f1: 0.6493
 epoch: 80, train_loss: 0.3972, test_loss: 1.1100, test_f1: 0.6336
 epoch: 81, train_loss: 0.3806, test_loss: 1.0662, test_f1: 0.6052
 epoch: 82, train_loss: 0.3475, test_loss: 1.0546, test_f1: 0.6619
 epoch: 83, train_loss: 0.3568, test_loss: 1.0622, test_f1: 0.6277
 epoch: 84, train_loss: 0.3491, test_loss: 1.0358, test_f1: 0.6697
 epoch: 85, train_loss: 0.3659, test_loss: 1.1689, test_f1: 0.6526
 epoch: 86, train_loss: 0.3686, test_loss: 0.8724, test_f1: 0.6784
 epoch: 87, train_loss: 0.3453, test_loss: 1.0280, test_f1: 0.6631
 epoch: 88, train_loss: 0.3533, test_loss: 1.0075, test_f1: 0.6268
 epoch: 89, train_loss: 0.3306, test_loss: 1.1353, test_f1: 0.6652
 epoch: 90, train_loss: 0.3529, test_loss: 1.1639, test_f1: 0.6571
 epoch: 91, train_loss: 0.3499, test_loss: 1.2335, test_f1: 0.6374
 epoch: 92, train_loss: 0.3407, test_loss: 1.3686, test_f1: 0.6275
 epoch: 93, train_loss: 0.3346, test_loss: 1.2175, test_f1: 0.6595
 epoch: 94, train_loss: 0.3237, test_loss: 1.1762, test_f1: 0.6246
 epoch: 95, train_loss: 0.3186, test_loss: 1.0841, test_f1: 0.6730
 epoch: 96, train_loss: 0.3161, test_loss: 1.1921, test_f1: 0.6757
 epoch: 97, train_loss: 0.3479, test_loss: 1.4642, test_f1: 0.6420
 epoch: 98, train_loss: 0.3222, test_loss: 1.0610, test_f1: 0.6658
 epoch: 99, train_loss: 0.3309, test_loss: 1.0860, test_f1: 0.6546
##################ITERATION #3 ****************************************
 epoch: 0, train_loss: 1.2202, test_loss: 1.1509, test_f1: 0.4033
 epoch: 1, train_loss: 0.9947, test_loss: 0.9814, test_f1: 0.4696
 epoch: 2, train_loss: 0.9720, test_loss: 0.9305, test_f1: 0.5221
 epoch: 3, train_loss: 0.9238, test_loss: 0.8462, test_f1: 0.5556
 epoch: 4, train_loss: 0.9042, test_loss: 0.8796, test_f1: 0.5329
 epoch: 5, train_loss: 0.8907, test_loss: 1.1205, test_f1: 0.4599
 epoch: 6, train_loss: 0.8746, test_loss: 1.0530, test_f1: 0.5179
 epoch: 7, train_loss: 0.8336, test_loss: 1.2018, test_f1: 0.4721
 epoch: 8, train_loss: 0.8382, test_loss: 0.9323, test_f1: 0.5336
 epoch: 9, train_loss: 0.8206, test_loss: 0.9389, test_f1: 0.4886
 epoch: 10, train_loss: 0.8009, test_loss: 0.9034, test_f1: 0.5195
 epoch: 11, train_loss: 0.8162, test_loss: 0.8407, test_f1: 0.6109
 epoch: 12, train_loss: 0.7915, test_loss: 0.8279, test_f1: 0.5679
 epoch: 13, train_loss: 0.7908, test_loss: 0.9125, test_f1: 0.5628
 epoch: 14, train_loss: 0.7781, test_loss: 0.8146, test_f1: 0.5469
 epoch: 15, train_loss: 0.7738, test_loss: 0.9831, test_f1: 0.5604
 epoch: 16, train_loss: 0.7524, test_loss: 0.8470, test_f1: 0.5705
 epoch: 17, train_loss: 0.7340, test_loss: 0.8638, test_f1: 0.5687
 epoch: 18, train_loss: 0.7323, test_loss: 0.8352, test_f1: 0.5793
 epoch: 19, train_loss: 0.7265, test_loss: 0.7827, test_f1: 0.5693
 epoch: 20, train_loss: 0.7199, test_loss: 0.7710, test_f1: 0.6106
 epoch: 21, train_loss: 0.7167, test_loss: 0.9195, test_f1: 0.5940
 epoch: 22, train_loss: 0.7205, test_loss: 0.8198, test_f1: 0.6272
 epoch: 23, train_loss: 0.6910, test_loss: 0.7721, test_f1: 0.5986
 epoch: 24, train_loss: 0.7020, test_loss: 0.7459, test_f1: 0.5971
 epoch: 25, train_loss: 0.6659, test_loss: 0.6966, test_f1: 0.6489
 epoch: 26, train_loss: 0.6447, test_loss: 0.7883, test_f1: 0.5781
 epoch: 27, train_loss: 0.6381, test_loss: 0.8047, test_f1: 0.5962
 epoch: 28, train_loss: 0.6590, test_loss: 0.7858, test_f1: 0.5941
 epoch: 29, train_loss: 0.6248, test_loss: 0.7784, test_f1: 0.5933
 epoch: 30, train_loss: 0.6276, test_loss: 0.7602, test_f1: 0.6295
 epoch: 31, train_loss: 0.6182, test_loss: 0.7621, test_f1: 0.6237
 epoch: 32, train_loss: 0.6093, test_loss: 0.8632, test_f1: 0.5813
 epoch: 33, train_loss: 0.6272, test_loss: 0.9774, test_f1: 0.6309
 epoch: 34, train_loss: 0.6229, test_loss: 0.9520, test_f1: 0.6249
 epoch: 35, train_loss: 0.6048, test_loss: 1.0316, test_f1: 0.6045
 epoch: 36, train_loss: 0.6316, test_loss: 1.1757, test_f1: 0.5969
 epoch: 37, train_loss: 0.6033, test_loss: 0.7671, test_f1: 0.6248
 epoch: 38, train_loss: 0.5724, test_loss: 0.9927, test_f1: 0.6375
 epoch: 39, train_loss: 0.5898, test_loss: 0.9137, test_f1: 0.5924
 epoch: 40, train_loss: 0.5857, test_loss: 0.9345, test_f1: 0.6794
 epoch: 41, train_loss: 0.5808, test_loss: 1.0207, test_f1: 0.6681
 epoch: 42, train_loss: 0.5666, test_loss: 0.7267, test_f1: 0.6617
 epoch: 43, train_loss: 0.5620, test_loss: 0.8424, test_f1: 0.6285
 epoch: 44, train_loss: 0.5930, test_loss: 0.9981, test_f1: 0.6106
 epoch: 45, train_loss: 0.5676, test_loss: 0.8655, test_f1: 0.6097
 epoch: 46, train_loss: 0.5527, test_loss: 1.1290, test_f1: 0.6848
 epoch: 47, train_loss: 0.5554, test_loss: 1.0887, test_f1: 0.6034
 epoch: 48, train_loss: 0.5573, test_loss: 1.0845, test_f1: 0.6048
 epoch: 49, train_loss: 0.5074, test_loss: 0.9612, test_f1: 0.6757
 epoch: 50, train_loss: 0.5208, test_loss: 0.8056, test_f1: 0.6688
 epoch: 51, train_loss: 0.4774, test_loss: 0.7914, test_f1: 0.6884
 epoch: 52, train_loss: 0.4553, test_loss: 1.0586, test_f1: 0.6418
 epoch: 53, train_loss: 0.4551, test_loss: 1.2573, test_f1: 0.6570
 epoch: 54, train_loss: 0.4246, test_loss: 0.9806, test_f1: 0.6704
 epoch: 55, train_loss: 0.4587, test_loss: 0.9496, test_f1: 0.6561
 epoch: 56, train_loss: 0.4035, test_loss: 0.9909, test_f1: 0.6747
 epoch: 57, train_loss: 0.4109, test_loss: 1.1512, test_f1: 0.6489
 epoch: 58, train_loss: 0.3955, test_loss: 1.0866, test_f1: 0.6607
 epoch: 59, train_loss: 0.3931, test_loss: 1.4769, test_f1: 0.6424
 epoch: 60, train_loss: 0.3951, test_loss: 1.2278, test_f1: 0.6467
 epoch: 61, train_loss: 0.3825, test_loss: 1.1294, test_f1: 0.6688
 epoch: 62, train_loss: 0.3950, test_loss: 1.3194, test_f1: 0.6762
 epoch: 63, train_loss: 0.3750, test_loss: 1.2218, test_f1: 0.6737
 epoch: 64, train_loss: 0.4022, test_loss: 1.2753, test_f1: 0.6436
 epoch: 65, train_loss: 0.3609, test_loss: 1.5440, test_f1: 0.6645
 epoch: 66, train_loss: 0.3793, test_loss: 1.2718, test_f1: 0.6657
 epoch: 67, train_loss: 0.3634, test_loss: 1.1633, test_f1: 0.6966
 epoch: 68, train_loss: 0.3488, test_loss: 1.3893, test_f1: 0.6519
 epoch: 69, train_loss: 0.3677, test_loss: 1.2431, test_f1: 0.6576
 epoch: 70, train_loss: 0.3396, test_loss: 1.3966, test_f1: 0.6605
 epoch: 71, train_loss: 0.3208, test_loss: 1.9226, test_f1: 0.6571
 epoch: 72, train_loss: 0.3418, test_loss: 1.6493, test_f1: 0.6467
 epoch: 73, train_loss: 0.3420, test_loss: 1.6659, test_f1: 0.6600
 epoch: 74, train_loss: 0.3306, test_loss: 1.4719, test_f1: 0.6793
 epoch: 75, train_loss: 0.3416, test_loss: 1.8525, test_f1: 0.6533
 epoch: 76, train_loss: 0.3488, test_loss: 1.5785, test_f1: 0.6546
 epoch: 77, train_loss: 0.3341, test_loss: 1.2409, test_f1: 0.6712
 epoch: 78, train_loss: 0.3016, test_loss: 1.4957, test_f1: 0.6714
 epoch: 79, train_loss: 0.3149, test_loss: 1.3950, test_f1: 0.6740
 epoch: 80, train_loss: 0.3286, test_loss: 1.4780, test_f1: 0.6816
 epoch: 81, train_loss: 0.3245, test_loss: 1.1816, test_f1: 0.6779
 epoch: 82, train_loss: 0.3170, test_loss: 1.2252, test_f1: 0.7093
 epoch: 83, train_loss: 0.3069, test_loss: 1.4491, test_f1: 0.6729
 epoch: 84, train_loss: 0.2943, test_loss: 1.3160, test_f1: 0.6610
 epoch: 85, train_loss: 0.2935, test_loss: 1.3964, test_f1: 0.6846
 epoch: 86, train_loss: 0.3259, test_loss: 1.0850, test_f1: 0.6951
 epoch: 87, train_loss: 0.3053, test_loss: 1.2719, test_f1: 0.6671
 epoch: 88, train_loss: 0.3114, test_loss: 1.3770, test_f1: 0.6815
 epoch: 89, train_loss: 0.3007, test_loss: 1.6066, test_f1: 0.6449
 epoch: 90, train_loss: 0.3012, test_loss: 1.3994, test_f1: 0.7036
 epoch: 91, train_loss: 0.2848, test_loss: 1.4464, test_f1: 0.7048
 epoch: 92, train_loss: 0.2900, test_loss: 1.6946, test_f1: 0.6780
 epoch: 93, train_loss: 0.2849, test_loss: 1.5577, test_f1: 0.6839
 epoch: 94, train_loss: 0.2963, test_loss: 1.4178, test_f1: 0.6597
 epoch: 95, train_loss: 0.2792, test_loss: 1.6242, test_f1: 0.6524
 epoch: 96, train_loss: 0.2812, test_loss: 1.2290, test_f1: 0.6907
 epoch: 97, train_loss: 0.2785, test_loss: 1.7002, test_f1: 0.6468
 epoch: 98, train_loss: 0.2522, test_loss: 1.6704, test_f1: 0.6333
 epoch: 99, train_loss: 0.2729, test_loss: 1.5734, test_f1: 0.6482
##################ITERATION #4 ****************************************
 epoch: 0, train_loss: 1.1834, test_loss: 1.0089, test_f1: 0.4201
 epoch: 1, train_loss: 1.0133, test_loss: 0.9540, test_f1: 0.5059
 epoch: 2, train_loss: 0.9566, test_loss: 0.9748, test_f1: 0.5107
 epoch: 3, train_loss: 0.9523, test_loss: 0.9532, test_f1: 0.4693
 epoch: 4, train_loss: 0.9230, test_loss: 0.8737, test_f1: 0.5127
 epoch: 5, train_loss: 0.9042, test_loss: 1.0207, test_f1: 0.5072
 epoch: 6, train_loss: 0.9036, test_loss: 0.9514, test_f1: 0.5336
 epoch: 7, train_loss: 0.8672, test_loss: 0.9504, test_f1: 0.5125
 epoch: 8, train_loss: 0.8566, test_loss: 0.9771, test_f1: 0.5028
 epoch: 9, train_loss: 0.8399, test_loss: 0.8475, test_f1: 0.5455
 epoch: 10, train_loss: 0.8217, test_loss: 1.0041, test_f1: 0.4981
 epoch: 11, train_loss: 0.8297, test_loss: 0.8603, test_f1: 0.5837
 epoch: 12, train_loss: 0.8230, test_loss: 0.9678, test_f1: 0.4909
 epoch: 13, train_loss: 0.8261, test_loss: 0.8314, test_f1: 0.5575
 epoch: 14, train_loss: 0.7864, test_loss: 0.8557, test_f1: 0.5800
 epoch: 15, train_loss: 0.7656, test_loss: 0.8717, test_f1: 0.5467
 epoch: 16, train_loss: 0.7758, test_loss: 0.8407, test_f1: 0.5921
 epoch: 17, train_loss: 0.7647, test_loss: 0.9925, test_f1: 0.5341
 epoch: 18, train_loss: 0.7589, test_loss: 0.8984, test_f1: 0.5976
 epoch: 19, train_loss: 0.7688, test_loss: 0.9934, test_f1: 0.5430
 epoch: 20, train_loss: 0.7621, test_loss: 0.8378, test_f1: 0.5814
 epoch: 21, train_loss: 0.7608, test_loss: 0.7884, test_f1: 0.5713
 epoch: 22, train_loss: 0.7270, test_loss: 1.0299, test_f1: 0.5509
 epoch: 23, train_loss: 0.7083, test_loss: 0.8258, test_f1: 0.5898
 epoch: 24, train_loss: 0.7024, test_loss: 0.7845, test_f1: 0.5688
 epoch: 25, train_loss: 0.7021, test_loss: 1.4210, test_f1: 0.4684
 epoch: 26, train_loss: 0.6901, test_loss: 0.9297, test_f1: 0.6440
 epoch: 27, train_loss: 0.7061, test_loss: 0.8821, test_f1: 0.6287
 epoch: 28, train_loss: 0.7282, test_loss: 1.0275, test_f1: 0.5499
 epoch: 29, train_loss: 0.7277, test_loss: 0.9602, test_f1: 0.5719
 epoch: 30, train_loss: 0.7203, test_loss: 0.8570, test_f1: 0.6247
 epoch: 31, train_loss: 0.6644, test_loss: 0.8708, test_f1: 0.6097
 epoch: 32, train_loss: 0.6614, test_loss: 1.0774, test_f1: 0.5314
 epoch: 33, train_loss: 0.6619, test_loss: 1.0780, test_f1: 0.5784
 epoch: 34, train_loss: 0.6503, test_loss: 0.7929, test_f1: 0.5736
 epoch: 35, train_loss: 0.6467, test_loss: 0.8986, test_f1: 0.6172
 epoch: 36, train_loss: 0.6409, test_loss: 0.8747, test_f1: 0.6318
 epoch: 37, train_loss: 0.6458, test_loss: 0.8273, test_f1: 0.6391
 epoch: 38, train_loss: 0.6216, test_loss: 1.0641, test_f1: 0.5429
 epoch: 39, train_loss: 0.6147, test_loss: 1.0008, test_f1: 0.6499
 epoch: 40, train_loss: 0.6929, test_loss: 0.9506, test_f1: 0.5962
 epoch: 41, train_loss: 0.6324, test_loss: 0.8801, test_f1: 0.6338
 epoch: 42, train_loss: 0.6305, test_loss: 1.0293, test_f1: 0.6037
 epoch: 43, train_loss: 0.6230, test_loss: 0.9928, test_f1: 0.6039
 epoch: 44, train_loss: 0.6118, test_loss: 1.0140, test_f1: 0.6055
 epoch: 45, train_loss: 0.6147, test_loss: 0.9247, test_f1: 0.6594
 epoch: 46, train_loss: 0.5906, test_loss: 1.5030, test_f1: 0.5913
 epoch: 47, train_loss: 0.6038, test_loss: 0.7715, test_f1: 0.6421
 epoch: 48, train_loss: 0.5962, test_loss: 0.9117, test_f1: 0.6300
 epoch: 49, train_loss: 0.5894, test_loss: 1.0205, test_f1: 0.6467
 epoch: 50, train_loss: 0.5673, test_loss: 1.0232, test_f1: 0.6292
 epoch: 51, train_loss: 0.5389, test_loss: 1.0204, test_f1: 0.6314
 epoch: 52, train_loss: 0.5036, test_loss: 1.0098, test_f1: 0.6801
 epoch: 53, train_loss: 0.4939, test_loss: 1.0238, test_f1: 0.6537
 epoch: 54, train_loss: 0.4875, test_loss: 0.9699, test_f1: 0.6521
 epoch: 55, train_loss: 0.4803, test_loss: 1.1208, test_f1: 0.6771
 epoch: 56, train_loss: 0.4760, test_loss: 1.0293, test_f1: 0.6323
 epoch: 57, train_loss: 0.4839, test_loss: 0.9690, test_f1: 0.6598
 epoch: 58, train_loss: 0.5081, test_loss: 0.9361, test_f1: 0.6580
 epoch: 59, train_loss: 0.4869, test_loss: 0.9507, test_f1: 0.6575
 epoch: 60, train_loss: 0.4665, test_loss: 1.2354, test_f1: 0.6411
 epoch: 61, train_loss: 0.4664, test_loss: 1.1940, test_f1: 0.6550
 epoch: 62, train_loss: 0.4536, test_loss: 1.0819, test_f1: 0.6209
 epoch: 63, train_loss: 0.4439, test_loss: 1.1563, test_f1: 0.6688
 epoch: 64, train_loss: 0.4533, test_loss: 1.1174, test_f1: 0.6918
 epoch: 65, train_loss: 0.4299, test_loss: 1.2385, test_f1: 0.6760
 epoch: 66, train_loss: 0.4311, test_loss: 1.1366, test_f1: 0.6832
 epoch: 67, train_loss: 0.4231, test_loss: 1.3858, test_f1: 0.6560
 epoch: 68, train_loss: 0.4446, test_loss: 1.0555, test_f1: 0.6498
 epoch: 69, train_loss: 0.4259, test_loss: 1.2275, test_f1: 0.6462
 epoch: 70, train_loss: 0.4239, test_loss: 1.3577, test_f1: 0.6486
 epoch: 71, train_loss: 0.4211, test_loss: 1.2664, test_f1: 0.6833
 epoch: 72, train_loss: 0.4301, test_loss: 1.1826, test_f1: 0.6652
 epoch: 73, train_loss: 0.4112, test_loss: 1.2431, test_f1: 0.6748
 epoch: 74, train_loss: 0.4084, test_loss: 1.0669, test_f1: 0.6829
 epoch: 75, train_loss: 0.4000, test_loss: 1.3958, test_f1: 0.6363
 epoch: 76, train_loss: 0.3886, test_loss: 1.3614, test_f1: 0.6753
 epoch: 77, train_loss: 0.4203, test_loss: 1.2229, test_f1: 0.6662
 epoch: 78, train_loss: 0.4030, test_loss: 1.2933, test_f1: 0.6998
 epoch: 79, train_loss: 0.3952, test_loss: 1.2139, test_f1: 0.6978
 epoch: 80, train_loss: 0.3799, test_loss: 1.3386, test_f1: 0.6479
 epoch: 81, train_loss: 0.4026, test_loss: 1.0969, test_f1: 0.6655
 epoch: 82, train_loss: 0.3709, test_loss: 1.0768, test_f1: 0.6989
 epoch: 83, train_loss: 0.3678, test_loss: 1.1977, test_f1: 0.6718
 epoch: 84, train_loss: 0.3778, test_loss: 1.2788, test_f1: 0.6737
 epoch: 85, train_loss: 0.3672, test_loss: 1.2393, test_f1: 0.6840
 epoch: 86, train_loss: 0.3697, test_loss: 1.1442, test_f1: 0.6862
 epoch: 87, train_loss: 0.3531, test_loss: 1.3135, test_f1: 0.7019
 epoch: 88, train_loss: 0.3698, test_loss: 1.4098, test_f1: 0.6561
 epoch: 89, train_loss: 0.3709, test_loss: 1.2834, test_f1: 0.6955
 epoch: 90, train_loss: 0.3441, test_loss: 1.3965, test_f1: 0.6973
 epoch: 91, train_loss: 0.3701, test_loss: 1.3597, test_f1: 0.6972
 epoch: 92, train_loss: 0.3301, test_loss: 1.3361, test_f1: 0.6904
 epoch: 93, train_loss: 0.3380, test_loss: 1.2465, test_f1: 0.6777
 epoch: 94, train_loss: 0.3523, test_loss: 1.6771, test_f1: 0.6716
 epoch: 95, train_loss: 0.3724, test_loss: 1.1177, test_f1: 0.6504
 epoch: 96, train_loss: 0.3525, test_loss: 1.2178, test_f1: 0.6656
 epoch: 97, train_loss: 0.3267, test_loss: 1.4875, test_f1: 0.6757
 epoch: 98, train_loss: 0.3046, test_loss: 1.4554, test_f1: 0.6915
 epoch: 99, train_loss: 0.3094, test_loss: 1.3897, test_f1: 0.6758
##################ITERATION #5 ****************************************
 epoch: 0, train_loss: 1.2181, test_loss: 1.2519, test_f1: 0.3412
 epoch: 1, train_loss: 1.0764, test_loss: 1.1308, test_f1: 0.4420
 epoch: 2, train_loss: 1.0533, test_loss: 1.1520, test_f1: 0.4363
 epoch: 3, train_loss: 1.0452, test_loss: 1.0644, test_f1: 0.4437
 epoch: 4, train_loss: 1.0400, test_loss: 1.0537, test_f1: 0.4543
 epoch: 5, train_loss: 1.0150, test_loss: 1.1288, test_f1: 0.4729
 epoch: 6, train_loss: 0.9873, test_loss: 1.0811, test_f1: 0.4792
 epoch: 7, train_loss: 0.9752, test_loss: 1.1126, test_f1: 0.4915
 epoch: 8, train_loss: 0.9580, test_loss: 1.1353, test_f1: 0.4744
 epoch: 9, train_loss: 0.9505, test_loss: 1.0289, test_f1: 0.4708
 epoch: 10, train_loss: 0.9363, test_loss: 1.0759, test_f1: 0.4425
 epoch: 11, train_loss: 0.9333, test_loss: 1.0757, test_f1: 0.4871
 epoch: 12, train_loss: 0.9288, test_loss: 0.8970, test_f1: 0.5134
 epoch: 13, train_loss: 0.9079, test_loss: 0.9207, test_f1: 0.5198
 epoch: 14, train_loss: 0.8657, test_loss: 0.8836, test_f1: 0.5798
 epoch: 15, train_loss: 0.8209, test_loss: 1.0541, test_f1: 0.5668
 epoch: 16, train_loss: 0.8234, test_loss: 1.0629, test_f1: 0.5560
 epoch: 17, train_loss: 0.8418, test_loss: 0.8620, test_f1: 0.5644
 epoch: 18, train_loss: 0.8290, test_loss: 0.8743, test_f1: 0.5663
 epoch: 19, train_loss: 0.8105, test_loss: 0.8675, test_f1: 0.5280
 epoch: 20, train_loss: 0.7765, test_loss: 0.8822, test_f1: 0.5485
 epoch: 21, train_loss: 0.7770, test_loss: 0.9436, test_f1: 0.5102
 epoch: 22, train_loss: 0.7717, test_loss: 0.8656, test_f1: 0.5158
 epoch: 23, train_loss: 0.7666, test_loss: 0.9687, test_f1: 0.5427
 epoch: 24, train_loss: 0.7539, test_loss: 0.8450, test_f1: 0.5330
 epoch: 25, train_loss: 0.7369, test_loss: 0.7473, test_f1: 0.6300
 epoch: 26, train_loss: 0.7287, test_loss: 0.8144, test_f1: 0.6208
 epoch: 27, train_loss: 0.7325, test_loss: 0.8108, test_f1: 0.5818
 epoch: 28, train_loss: 0.7017, test_loss: 0.8225, test_f1: 0.5577
 epoch: 29, train_loss: 0.7239, test_loss: 1.1516, test_f1: 0.4815
 epoch: 30, train_loss: 0.7105, test_loss: 0.8080, test_f1: 0.5705
 epoch: 31, train_loss: 0.6887, test_loss: 0.8573, test_f1: 0.5678
 epoch: 32, train_loss: 0.7029, test_loss: 0.8586, test_f1: 0.6172
 epoch: 33, train_loss: 0.6786, test_loss: 0.8348, test_f1: 0.5772
 epoch: 34, train_loss: 0.6656, test_loss: 0.8845, test_f1: 0.5838
 epoch: 35, train_loss: 0.6705, test_loss: 0.8699, test_f1: 0.6049
 epoch: 36, train_loss: 0.6638, test_loss: 0.7912, test_f1: 0.6486
 epoch: 37, train_loss: 0.6700, test_loss: 0.7773, test_f1: 0.6098
 epoch: 38, train_loss: 0.6658, test_loss: 0.7969, test_f1: 0.6104
 epoch: 39, train_loss: 0.6371, test_loss: 0.9002, test_f1: 0.6429
 epoch: 40, train_loss: 0.6504, test_loss: 0.8215, test_f1: 0.6374
 epoch: 41, train_loss: 0.6396, test_loss: 0.8146, test_f1: 0.6303
 epoch: 42, train_loss: 0.6033, test_loss: 0.8526, test_f1: 0.6180
 epoch: 43, train_loss: 0.6115, test_loss: 0.8230, test_f1: 0.6245
 epoch: 44, train_loss: 0.6120, test_loss: 0.7990, test_f1: 0.6773
 epoch: 45, train_loss: 0.6124, test_loss: 0.8503, test_f1: 0.6202
 epoch: 46, train_loss: 0.6153, test_loss: 0.8573, test_f1: 0.6110
 epoch: 47, train_loss: 0.6105, test_loss: 0.7904, test_f1: 0.6486
 epoch: 48, train_loss: 0.5957, test_loss: 0.8596, test_f1: 0.6569
 epoch: 49, train_loss: 0.5882, test_loss: 11.3128, test_f1: 0.4744
 epoch: 50, train_loss: 0.5956, test_loss: 0.8277, test_f1: 0.6525
 epoch: 51, train_loss: 0.5261, test_loss: 0.9214, test_f1: 0.6716
 epoch: 52, train_loss: 0.5057, test_loss: 0.8154, test_f1: 0.6405
 epoch: 53, train_loss: 0.4953, test_loss: 0.8230, test_f1: 0.6572
 epoch: 54, train_loss: 0.4915, test_loss: 0.9731, test_f1: 0.6592
 epoch: 55, train_loss: 0.4923, test_loss: 1.0507, test_f1: 0.6447
 epoch: 56, train_loss: 0.5001, test_loss: 0.9150, test_f1: 0.6277
 epoch: 57, train_loss: 0.4823, test_loss: 0.9388, test_f1: 0.6519
 epoch: 58, train_loss: 0.4697, test_loss: 0.8539, test_f1: 0.6581
 epoch: 59, train_loss: 0.4542, test_loss: 0.8122, test_f1: 0.6771
 epoch: 60, train_loss: 0.4474, test_loss: 0.8195, test_f1: 0.6659
 epoch: 61, train_loss: 0.4465, test_loss: 1.0408, test_f1: 0.6265
 epoch: 62, train_loss: 0.4454, test_loss: 0.8753, test_f1: 0.6545
 epoch: 63, train_loss: 0.4410, test_loss: 0.9964, test_f1: 0.6717
 epoch: 64, train_loss: 0.4515, test_loss: 0.8535, test_f1: 0.6577
 epoch: 65, train_loss: 0.4404, test_loss: 0.7745, test_f1: 0.6766
 epoch: 66, train_loss: 0.4357, test_loss: 0.9505, test_f1: 0.6565
 epoch: 67, train_loss: 0.4397, test_loss: 0.9027, test_f1: 0.6605
 epoch: 68, train_loss: 0.4144, test_loss: 0.9241, test_f1: 0.6596
 epoch: 69, train_loss: 0.4039, test_loss: 0.9658, test_f1: 0.6536
 epoch: 70, train_loss: 0.4185, test_loss: 1.0014, test_f1: 0.6698
 epoch: 71, train_loss: 0.4322, test_loss: 0.8378, test_f1: 0.6435
 epoch: 72, train_loss: 0.4119, test_loss: 1.0621, test_f1: 0.6640
 epoch: 73, train_loss: 0.3981, test_loss: 1.0800, test_f1: 0.6481
 epoch: 74, train_loss: 0.3913, test_loss: 1.0196, test_f1: 0.6435
 epoch: 75, train_loss: 0.3891, test_loss: 1.0736, test_f1: 0.6579
 epoch: 76, train_loss: 0.3817, test_loss: 0.9959, test_f1: 0.6536
 epoch: 77, train_loss: 0.3815, test_loss: 0.9729, test_f1: 0.6648
 epoch: 78, train_loss: 0.3962, test_loss: 1.0772, test_f1: 0.6207
 epoch: 79, train_loss: 0.3835, test_loss: 1.2433, test_f1: 0.6390
 epoch: 80, train_loss: 0.4032, test_loss: 0.9736, test_f1: 0.6505
 epoch: 81, train_loss: 0.3982, test_loss: 0.9607, test_f1: 0.6435
 epoch: 82, train_loss: 0.3754, test_loss: 0.9551, test_f1: 0.6841
 epoch: 83, train_loss: 0.3415, test_loss: 1.0473, test_f1: 0.6361
 epoch: 84, train_loss: 0.3564, test_loss: 0.8770, test_f1: 0.6515
 epoch: 85, train_loss: 0.3573, test_loss: 1.0558, test_f1: 0.6762
 epoch: 86, train_loss: 0.3648, test_loss: 0.9967, test_f1: 0.6695
 epoch: 87, train_loss: 0.3513, test_loss: 1.3329, test_f1: 0.6514
 epoch: 88, train_loss: 0.3623, test_loss: 1.1466, test_f1: 0.6608
 epoch: 89, train_loss: 0.3771, test_loss: 1.0537, test_f1: 0.6733
 epoch: 90, train_loss: 0.3536, test_loss: 1.2101, test_f1: 0.6184
 epoch: 91, train_loss: 0.3616, test_loss: 1.1656, test_f1: 0.6588
 epoch: 92, train_loss: 0.3561, test_loss: 1.2573, test_f1: 0.6739
 epoch: 93, train_loss: 0.3299, test_loss: 1.0434, test_f1: 0.6596
 epoch: 94, train_loss: 0.3560, test_loss: 1.0812, test_f1: 0.6339
 epoch: 95, train_loss: 0.3348, test_loss: 1.2080, test_f1: 0.6610
 epoch: 96, train_loss: 0.3250, test_loss: 1.0697, test_f1: 0.6759
 epoch: 97, train_loss: 0.3503, test_loss: 1.0855, test_f1: 0.6766
 epoch: 98, train_loss: 0.3308, test_loss: 1.2087, test_f1: 0.6449
 epoch: 99, train_loss: 0.3252, test_loss: 1.1643, test_f1: 0.6721
##################ITERATION #6 ****************************************
 epoch: 0, train_loss: 1.1915, test_loss: 1.1138, test_f1: 0.4740
 epoch: 1, train_loss: 1.0340, test_loss: 1.0668, test_f1: 0.4351
 epoch: 2, train_loss: 0.9887, test_loss: 0.9841, test_f1: 0.4648
 epoch: 3, train_loss: 0.9556, test_loss: 1.0280, test_f1: 0.5060
 epoch: 4, train_loss: 0.9513, test_loss: 0.9931, test_f1: 0.4682
 epoch: 5, train_loss: 0.9184, test_loss: 1.0669, test_f1: 0.4983
 epoch: 6, train_loss: 0.9081, test_loss: 0.9455, test_f1: 0.5349
 epoch: 7, train_loss: 0.8899, test_loss: 0.9908, test_f1: 0.4753
 epoch: 8, train_loss: 0.8787, test_loss: 0.9096, test_f1: 0.5165
 epoch: 9, train_loss: 0.8704, test_loss: 0.8936, test_f1: 0.5333
 epoch: 10, train_loss: 0.8663, test_loss: 0.8852, test_f1: 0.5256
 epoch: 11, train_loss: 0.8539, test_loss: 1.0165, test_f1: 0.5035
 epoch: 12, train_loss: 0.8298, test_loss: 1.2516, test_f1: 0.4839
 epoch: 13, train_loss: 0.8333, test_loss: 0.8751, test_f1: 0.6051
 epoch: 14, train_loss: 0.8321, test_loss: 0.8168, test_f1: 0.5610
 epoch: 15, train_loss: 0.8045, test_loss: 0.8071, test_f1: 0.5673
 epoch: 16, train_loss: 0.7769, test_loss: 1.0131, test_f1: 0.5442
 epoch: 17, train_loss: 0.7860, test_loss: 0.8804, test_f1: 0.5441
 epoch: 18, train_loss: 0.7699, test_loss: 0.8368, test_f1: 0.5859
 epoch: 19, train_loss: 0.7609, test_loss: 0.8583, test_f1: 0.5491
 epoch: 20, train_loss: 0.7817, test_loss: 0.8060, test_f1: 0.5704
 epoch: 21, train_loss: 0.7971, test_loss: 0.9301, test_f1: 0.5395
 epoch: 22, train_loss: 0.7890, test_loss: 0.8472, test_f1: 0.5844
 epoch: 23, train_loss: 0.7694, test_loss: 0.7373, test_f1: 0.6364
 epoch: 24, train_loss: 0.7546, test_loss: 0.7491, test_f1: 0.6153
 epoch: 25, train_loss: 0.7199, test_loss: 0.9791, test_f1: 0.5948
 epoch: 26, train_loss: 0.7053, test_loss: 1.1429, test_f1: 0.5702
 epoch: 27, train_loss: 0.7095, test_loss: 0.8140, test_f1: 0.6506
 epoch: 28, train_loss: 0.7063, test_loss: 0.8110, test_f1: 0.6046
 epoch: 29, train_loss: 0.6853, test_loss: 0.8916, test_f1: 0.6454
 epoch: 30, train_loss: 0.7199, test_loss: 0.9479, test_f1: 0.5789
 epoch: 31, train_loss: 0.6898, test_loss: 1.0216, test_f1: 0.5501
 epoch: 32, train_loss: 0.6857, test_loss: 1.0261, test_f1: 0.5829
 epoch: 33, train_loss: 0.6673, test_loss: 0.8178, test_f1: 0.6103
 epoch: 34, train_loss: 0.6599, test_loss: 0.8438, test_f1: 0.6162
 epoch: 35, train_loss: 0.6649, test_loss: 0.8315, test_f1: 0.6212
 epoch: 36, train_loss: 0.6417, test_loss: 0.8037, test_f1: 0.6397
 epoch: 37, train_loss: 0.6623, test_loss: 0.7113, test_f1: 0.6709
 epoch: 38, train_loss: 0.6413, test_loss: 0.8092, test_f1: 0.6322
 epoch: 39, train_loss: 0.6578, test_loss: 0.7777, test_f1: 0.6262
 epoch: 40, train_loss: 0.6351, test_loss: 0.7683, test_f1: 0.6299
 epoch: 41, train_loss: 0.6461, test_loss: 0.8923, test_f1: 0.6138
 epoch: 42, train_loss: 0.6220, test_loss: 0.8846, test_f1: 0.6282
 epoch: 43, train_loss: 0.6137, test_loss: 0.8423, test_f1: 0.6251
 epoch: 44, train_loss: 0.6177, test_loss: 0.8301, test_f1: 0.6158
 epoch: 45, train_loss: 0.6260, test_loss: 0.8445, test_f1: 0.6184
 epoch: 46, train_loss: 0.6200, test_loss: 0.9148, test_f1: 0.6175
 epoch: 47, train_loss: 0.5734, test_loss: 0.8941, test_f1: 0.5793
 epoch: 48, train_loss: 0.5816, test_loss: 1.1719, test_f1: 0.5886
 epoch: 49, train_loss: 0.5845, test_loss: 0.9849, test_f1: 0.5642
 epoch: 50, train_loss: 0.5815, test_loss: 0.9091, test_f1: 0.5994
 epoch: 51, train_loss: 0.5370, test_loss: 0.8457, test_f1: 0.6341
 epoch: 52, train_loss: 0.5135, test_loss: 0.7870, test_f1: 0.6571
 epoch: 53, train_loss: 0.5025, test_loss: 0.8184, test_f1: 0.6640
 epoch: 54, train_loss: 0.4967, test_loss: 0.8931, test_f1: 0.6468
 epoch: 55, train_loss: 0.5053, test_loss: 0.8091, test_f1: 0.6472
 epoch: 56, train_loss: 0.4859, test_loss: 0.8729, test_f1: 0.6546
 epoch: 57, train_loss: 0.4789, test_loss: 0.8059, test_f1: 0.6613
 epoch: 58, train_loss: 0.4625, test_loss: 0.8055, test_f1: 0.6631
 epoch: 59, train_loss: 0.4727, test_loss: 0.7685, test_f1: 0.6857
 epoch: 60, train_loss: 0.4590, test_loss: 0.8200, test_f1: 0.6644
 epoch: 61, train_loss: 0.4629, test_loss: 0.8918, test_f1: 0.6354
 epoch: 62, train_loss: 0.4650, test_loss: 0.9522, test_f1: 0.6662
 epoch: 63, train_loss: 0.4524, test_loss: 0.9261, test_f1: 0.6548
 epoch: 64, train_loss: 0.4410, test_loss: 0.8905, test_f1: 0.6672
 epoch: 65, train_loss: 0.4383, test_loss: 0.8949, test_f1: 0.6645
 epoch: 66, train_loss: 0.4418, test_loss: 0.8490, test_f1: 0.6515
 epoch: 67, train_loss: 0.4443, test_loss: 0.9674, test_f1: 0.6663
 epoch: 68, train_loss: 0.4230, test_loss: 0.8968, test_f1: 0.6359
 epoch: 69, train_loss: 0.4304, test_loss: 0.8695, test_f1: 0.6658
 epoch: 70, train_loss: 0.4188, test_loss: 0.9132, test_f1: 0.6479
 epoch: 71, train_loss: 0.4390, test_loss: 0.8285, test_f1: 0.6936
 epoch: 72, train_loss: 0.4205, test_loss: 0.9030, test_f1: 0.6679
 epoch: 73, train_loss: 0.4163, test_loss: 0.8818, test_f1: 0.6645
 epoch: 74, train_loss: 0.4262, test_loss: 0.8429, test_f1: 0.6559
 epoch: 75, train_loss: 0.4160, test_loss: 0.8708, test_f1: 0.6602
 epoch: 76, train_loss: 0.4210, test_loss: 0.9733, test_f1: 0.6484
 epoch: 77, train_loss: 0.3980, test_loss: 1.0389, test_f1: 0.6544
 epoch: 78, train_loss: 0.3985, test_loss: 1.0148, test_f1: 0.6500
 epoch: 79, train_loss: 0.3892, test_loss: 0.9774, test_f1: 0.6523
 epoch: 80, train_loss: 0.3975, test_loss: 1.0651, test_f1: 0.6550
 epoch: 81, train_loss: 0.3966, test_loss: 0.9399, test_f1: 0.6695
 epoch: 82, train_loss: 0.4176, test_loss: 0.9988, test_f1: 0.6559
 epoch: 83, train_loss: 0.3951, test_loss: 0.9559, test_f1: 0.6561
 epoch: 84, train_loss: 0.3793, test_loss: 0.9935, test_f1: 0.6725
 epoch: 85, train_loss: 0.3740, test_loss: 1.0401, test_f1: 0.6771
 epoch: 86, train_loss: 0.3929, test_loss: 1.0483, test_f1: 0.6652
 epoch: 87, train_loss: 0.3750, test_loss: 1.1434, test_f1: 0.6596
 epoch: 88, train_loss: 0.3625, test_loss: 1.1663, test_f1: 0.6266
 epoch: 89, train_loss: 0.3581, test_loss: 1.2271, test_f1: 0.6253
 epoch: 90, train_loss: 0.3645, test_loss: 0.9559, test_f1: 0.6679
 epoch: 91, train_loss: 0.3593, test_loss: 1.0344, test_f1: 0.6678
 epoch: 92, train_loss: 0.3460, test_loss: 1.1544, test_f1: 0.6446
 epoch: 93, train_loss: 0.3251, test_loss: 1.0634, test_f1: 0.6652
 epoch: 94, train_loss: 0.3507, test_loss: 0.9983, test_f1: 0.6591
 epoch: 95, train_loss: 0.3510, test_loss: 1.1902, test_f1: 0.6499
 epoch: 96, train_loss: 0.3818, test_loss: 1.0510, test_f1: 0.6650
 epoch: 97, train_loss: 0.3500, test_loss: 1.1065, test_f1: 0.6391
 epoch: 98, train_loss: 0.3095, test_loss: 1.2597, test_f1: 0.6280
 epoch: 99, train_loss: 0.3347, test_loss: 1.2442, test_f1: 0.6534
##################ITERATION #7 ****************************************
 epoch: 0, train_loss: 1.2202, test_loss: 1.1181, test_f1: 0.4089
 epoch: 1, train_loss: 1.0236, test_loss: 1.1011, test_f1: 0.4201
 epoch: 2, train_loss: 0.9828, test_loss: 1.0434, test_f1: 0.4832
 epoch: 3, train_loss: 0.9598, test_loss: 1.2119, test_f1: 0.4053
 epoch: 4, train_loss: 0.9493, test_loss: 1.1522, test_f1: 0.3838
 epoch: 5, train_loss: 0.9165, test_loss: 0.9913, test_f1: 0.4688
 epoch: 6, train_loss: 0.9035, test_loss: 0.8881, test_f1: 0.5089
 epoch: 7, train_loss: 0.8796, test_loss: 0.9251, test_f1: 0.5283
 epoch: 8, train_loss: 0.8999, test_loss: 0.9456, test_f1: 0.5095
 epoch: 9, train_loss: 0.8933, test_loss: 1.0887, test_f1: 0.4920
 epoch: 10, train_loss: 0.8704, test_loss: 0.8828, test_f1: 0.4939
 epoch: 11, train_loss: 0.8408, test_loss: 0.9607, test_f1: 0.4868
 epoch: 12, train_loss: 0.8480, test_loss: 0.8751, test_f1: 0.5222
 epoch: 13, train_loss: 0.8369, test_loss: 0.8823, test_f1: 0.5104
 epoch: 14, train_loss: 0.8581, test_loss: 0.9636, test_f1: 0.5136
 epoch: 15, train_loss: 0.8462, test_loss: 0.9743, test_f1: 0.4899
 epoch: 16, train_loss: 0.8427, test_loss: 0.9468, test_f1: 0.5320
 epoch: 17, train_loss: 0.8209, test_loss: 0.8551, test_f1: 0.5261
 epoch: 18, train_loss: 0.8191, test_loss: 0.7633, test_f1: 0.5591
 epoch: 19, train_loss: 0.7822, test_loss: 1.0468, test_f1: 0.5032
 epoch: 20, train_loss: 0.7721, test_loss: 0.9131, test_f1: 0.5187
 epoch: 21, train_loss: 0.7941, test_loss: 0.9259, test_f1: 0.5306
 epoch: 22, train_loss: 0.7567, test_loss: 0.8874, test_f1: 0.5346
 epoch: 23, train_loss: 0.7511, test_loss: 0.9415, test_f1: 0.5757
 epoch: 24, train_loss: 0.7515, test_loss: 0.9760, test_f1: 0.5434
 epoch: 25, train_loss: 0.7347, test_loss: 0.8545, test_f1: 0.5612
 epoch: 26, train_loss: 0.7357, test_loss: 0.9440, test_f1: 0.5636
 epoch: 27, train_loss: 0.7087, test_loss: 0.9187, test_f1: 0.5473
 epoch: 28, train_loss: 0.7243, test_loss: 0.9369, test_f1: 0.5851
 epoch: 29, train_loss: 0.6984, test_loss: 0.8671, test_f1: 0.5503
 epoch: 30, train_loss: 0.7038, test_loss: 0.8371, test_f1: 0.5755
 epoch: 31, train_loss: 0.7076, test_loss: 0.8459, test_f1: 0.5960
 epoch: 32, train_loss: 0.6942, test_loss: 0.8070, test_f1: 0.5657
 epoch: 33, train_loss: 0.6825, test_loss: 0.8611, test_f1: 0.5877
 epoch: 34, train_loss: 0.7038, test_loss: 0.9767, test_f1: 0.5641
 epoch: 35, train_loss: 0.6628, test_loss: 0.9053, test_f1: 0.5722
 epoch: 36, train_loss: 0.6558, test_loss: 0.8906, test_f1: 0.5912
 epoch: 37, train_loss: 0.6656, test_loss: 0.9054, test_f1: 0.6196
 epoch: 38, train_loss: 0.6696, test_loss: 0.7347, test_f1: 0.5923
 epoch: 39, train_loss: 0.6259, test_loss: 0.8858, test_f1: 0.6023
 epoch: 40, train_loss: 0.6454, test_loss: 0.8438, test_f1: 0.5691
 epoch: 41, train_loss: 0.6458, test_loss: 0.8904, test_f1: 0.5640
 epoch: 42, train_loss: 0.6201, test_loss: 0.9499, test_f1: 0.5743
 epoch: 43, train_loss: 0.6042, test_loss: 1.0394, test_f1: 0.5784
 epoch: 44, train_loss: 0.6246, test_loss: 0.8889, test_f1: 0.6094
 epoch: 45, train_loss: 0.6191, test_loss: 0.7948, test_f1: 0.6169
 epoch: 46, train_loss: 0.6053, test_loss: 0.9574, test_f1: 0.6083
 epoch: 47, train_loss: 0.5990, test_loss: 0.8227, test_f1: 0.5972
 epoch: 48, train_loss: 0.6097, test_loss: 1.1200, test_f1: 0.5742
 epoch: 49, train_loss: 0.5812, test_loss: 0.9254, test_f1: 0.6201
 epoch: 50, train_loss: 0.5869, test_loss: 0.8199, test_f1: 0.6152
 epoch: 51, train_loss: 0.5479, test_loss: 1.0315, test_f1: 0.6092
 epoch: 52, train_loss: 0.5245, test_loss: 0.8551, test_f1: 0.6176
 epoch: 53, train_loss: 0.4994, test_loss: 1.0428, test_f1: 0.6117
 epoch: 54, train_loss: 0.5025, test_loss: 0.8620, test_f1: 0.6336
 epoch: 55, train_loss: 0.4882, test_loss: 0.9812, test_f1: 0.6663
 epoch: 56, train_loss: 0.5054, test_loss: 1.0325, test_f1: 0.6280
 epoch: 57, train_loss: 0.4880, test_loss: 1.1227, test_f1: 0.6099
 epoch: 58, train_loss: 0.4863, test_loss: 1.0599, test_f1: 0.6351
 epoch: 59, train_loss: 0.4832, test_loss: 1.3778, test_f1: 0.6307
 epoch: 60, train_loss: 0.4877, test_loss: 0.9925, test_f1: 0.6229
 epoch: 61, train_loss: 0.4788, test_loss: 1.6330, test_f1: 0.6436
 epoch: 62, train_loss: 0.4663, test_loss: 0.9951, test_f1: 0.6439
 epoch: 63, train_loss: 0.4599, test_loss: 1.0907, test_f1: 0.6538
 epoch: 64, train_loss: 0.4696, test_loss: 1.1197, test_f1: 0.6578
 epoch: 65, train_loss: 0.4532, test_loss: 1.0662, test_f1: 0.6439
 epoch: 66, train_loss: 0.4619, test_loss: 1.1391, test_f1: 0.6496
 epoch: 67, train_loss: 0.4479, test_loss: 0.9030, test_f1: 0.6373
 epoch: 68, train_loss: 0.4480, test_loss: 1.4638, test_f1: 0.6491
 epoch: 69, train_loss: 0.4474, test_loss: 0.9679, test_f1: 0.6558
 epoch: 70, train_loss: 0.4327, test_loss: 1.0870, test_f1: 0.6541
 epoch: 71, train_loss: 0.4428, test_loss: 0.9942, test_f1: 0.6556
 epoch: 72, train_loss: 0.4295, test_loss: 1.3704, test_f1: 0.6615
 epoch: 73, train_loss: 0.4310, test_loss: 1.1994, test_f1: 0.6497
 epoch: 74, train_loss: 0.4287, test_loss: 1.0491, test_f1: 0.6515
 epoch: 75, train_loss: 0.4381, test_loss: 1.0779, test_f1: 0.6504
 epoch: 76, train_loss: 0.4305, test_loss: 1.4209, test_f1: 0.6338
 epoch: 77, train_loss: 0.4395, test_loss: 1.1088, test_f1: 0.6520
 epoch: 78, train_loss: 0.4270, test_loss: 1.1172, test_f1: 0.6387
 epoch: 79, train_loss: 0.4359, test_loss: 1.1520, test_f1: 0.6319
 epoch: 80, train_loss: 0.4073, test_loss: 1.2505, test_f1: 0.6762
 epoch: 81, train_loss: 0.3840, test_loss: 1.1084, test_f1: 0.6682
 epoch: 82, train_loss: 0.3849, test_loss: 1.4234, test_f1: 0.6498
 epoch: 83, train_loss: 0.3995, test_loss: 1.1651, test_f1: 0.6463
 epoch: 84, train_loss: 0.3942, test_loss: 1.1799, test_f1: 0.6562
 epoch: 85, train_loss: 0.3872, test_loss: 1.5124, test_f1: 0.6471
 epoch: 86, train_loss: 0.3733, test_loss: 1.3361, test_f1: 0.6383
 epoch: 87, train_loss: 0.3656, test_loss: 1.2403, test_f1: 0.6434
 epoch: 88, train_loss: 0.3894, test_loss: 0.9940, test_f1: 0.6894
 epoch: 89, train_loss: 0.3712, test_loss: 1.4448, test_f1: 0.6868
 epoch: 90, train_loss: 0.3629, test_loss: 1.2466, test_f1: 0.6611
 epoch: 91, train_loss: 0.3898, test_loss: 1.1960, test_f1: 0.6814
 epoch: 92, train_loss: 0.3758, test_loss: 1.6431, test_f1: 0.6523
 epoch: 93, train_loss: 0.3758, test_loss: 1.4830, test_f1: 0.6673
 epoch: 94, train_loss: 0.3666, test_loss: 1.4098, test_f1: 0.6501
 epoch: 95, train_loss: 0.3977, test_loss: 1.4384, test_f1: 0.6371
 epoch: 96, train_loss: 0.3591, test_loss: 1.4060, test_f1: 0.6557
 epoch: 97, train_loss: 0.3626, test_loss: 1.4475, test_f1: 0.6840
 epoch: 98, train_loss: 0.3529, test_loss: 1.7263, test_f1: 0.6591
 epoch: 99, train_loss: 0.3498, test_loss: 1.2408, test_f1: 0.7042
##################ITERATION #8 ****************************************
 epoch: 0, train_loss: 1.3745, test_loss: 1.2011, test_f1: 0.4002
 epoch: 1, train_loss: 1.0213, test_loss: 1.0331, test_f1: 0.4823
 epoch: 2, train_loss: 0.9761, test_loss: 0.9230, test_f1: 0.5210
 epoch: 3, train_loss: 0.9302, test_loss: 0.9099, test_f1: 0.5147
 epoch: 4, train_loss: 0.9377, test_loss: 0.9204, test_f1: 0.4921
 epoch: 5, train_loss: 0.8946, test_loss: 2.6653, test_f1: 0.2520
 epoch: 6, train_loss: 0.8941, test_loss: 1.0146, test_f1: 0.5143
 epoch: 7, train_loss: 0.8467, test_loss: 0.8868, test_f1: 0.5599
 epoch: 8, train_loss: 0.8426, test_loss: 0.8759, test_f1: 0.5529
 epoch: 9, train_loss: 0.8434, test_loss: 1.0216, test_f1: 0.5315
 epoch: 10, train_loss: 0.8455, test_loss: 0.8265, test_f1: 0.5506
 epoch: 11, train_loss: 0.7955, test_loss: 0.9542, test_f1: 0.5127
 epoch: 12, train_loss: 0.8021, test_loss: 0.9984, test_f1: 0.5534
 epoch: 13, train_loss: 0.7921, test_loss: 0.8567, test_f1: 0.6014
 epoch: 14, train_loss: 0.7805, test_loss: 0.8251, test_f1: 0.5622
 epoch: 15, train_loss: 0.7708, test_loss: 0.8733, test_f1: 0.6094
 epoch: 16, train_loss: 0.7470, test_loss: 0.9830, test_f1: 0.5201
 epoch: 17, train_loss: 0.7467, test_loss: 1.0988, test_f1: 0.5363
 epoch: 18, train_loss: 0.7372, test_loss: 0.8967, test_f1: 0.5932
 epoch: 19, train_loss: 0.7405, test_loss: 1.0119, test_f1: 0.5768
 epoch: 20, train_loss: 0.7149, test_loss: 0.9777, test_f1: 0.5962
 epoch: 21, train_loss: 0.7164, test_loss: 0.9976, test_f1: 0.6124
 epoch: 22, train_loss: 0.7158, test_loss: 1.3928, test_f1: 0.5277
 epoch: 23, train_loss: 0.6829, test_loss: 0.9234, test_f1: 0.6198
 epoch: 24, train_loss: 0.7067, test_loss: 0.9917, test_f1: 0.5902
 epoch: 25, train_loss: 0.6860, test_loss: 0.8526, test_f1: 0.6237
 epoch: 26, train_loss: 0.6700, test_loss: 0.9363, test_f1: 0.6279
 epoch: 27, train_loss: 0.6687, test_loss: 0.9562, test_f1: 0.5827
 epoch: 28, train_loss: 0.6930, test_loss: 0.9166, test_f1: 0.6298
 epoch: 29, train_loss: 0.6671, test_loss: 0.9222, test_f1: 0.6207
 epoch: 30, train_loss: 0.6380, test_loss: 1.3036, test_f1: 0.5304
 epoch: 31, train_loss: 0.6297, test_loss: 0.9267, test_f1: 0.5815
 epoch: 32, train_loss: 0.6369, test_loss: 0.9909, test_f1: 0.5785
 epoch: 33, train_loss: 0.6451, test_loss: 0.8429, test_f1: 0.6238
 epoch: 34, train_loss: 0.6230, test_loss: 0.7936, test_f1: 0.6487
 epoch: 35, train_loss: 0.6219, test_loss: 0.9968, test_f1: 0.6079
 epoch: 36, train_loss: 0.6230, test_loss: 0.8486, test_f1: 0.6211
 epoch: 37, train_loss: 0.6221, test_loss: 0.9369, test_f1: 0.6130
 epoch: 38, train_loss: 0.6057, test_loss: 0.9589, test_f1: 0.6240
 epoch: 39, train_loss: 0.5990, test_loss: 0.8837, test_f1: 0.6487
 epoch: 40, train_loss: 0.6139, test_loss: 1.0285, test_f1: 0.6022
 epoch: 41, train_loss: 0.5921, test_loss: 1.0051, test_f1: 0.6397
 epoch: 42, train_loss: 0.5665, test_loss: 0.9386, test_f1: 0.6610
 epoch: 43, train_loss: 0.5846, test_loss: 0.9479, test_f1: 0.6238
 epoch: 44, train_loss: 0.5659, test_loss: 0.9450, test_f1: 0.6179
 epoch: 45, train_loss: 0.5554, test_loss: 0.9000, test_f1: 0.6313
 epoch: 46, train_loss: 0.5564, test_loss: 0.9020, test_f1: 0.6284
 epoch: 47, train_loss: 0.5686, test_loss: 0.8121, test_f1: 0.6257
 epoch: 48, train_loss: 0.5467, test_loss: 1.0683, test_f1: 0.6299
 epoch: 49, train_loss: 0.5597, test_loss: 0.9620, test_f1: 0.6578
 epoch: 50, train_loss: 0.5823, test_loss: 1.0191, test_f1: 0.6108
 epoch: 51, train_loss: 0.5101, test_loss: 0.9869, test_f1: 0.6707
 epoch: 52, train_loss: 0.4770, test_loss: 0.9510, test_f1: 0.6614
 epoch: 53, train_loss: 0.4492, test_loss: 1.0650, test_f1: 0.6496
 epoch: 54, train_loss: 0.4501, test_loss: 0.9466, test_f1: 0.6793
 epoch: 55, train_loss: 0.4322, test_loss: 1.0354, test_f1: 0.6779
 epoch: 56, train_loss: 0.4288, test_loss: 0.9530, test_f1: 0.6682
 epoch: 57, train_loss: 0.4139, test_loss: 0.9772, test_f1: 0.6515
 epoch: 58, train_loss: 0.4379, test_loss: 0.8692, test_f1: 0.6769
 epoch: 59, train_loss: 0.4067, test_loss: 0.9615, test_f1: 0.6493
 epoch: 60, train_loss: 0.4464, test_loss: 1.0423, test_f1: 0.6479
 epoch: 61, train_loss: 0.4088, test_loss: 0.9353, test_f1: 0.6616
 epoch: 62, train_loss: 0.4013, test_loss: 0.9776, test_f1: 0.6656
 epoch: 63, train_loss: 0.4133, test_loss: 1.1206, test_f1: 0.6472
 epoch: 64, train_loss: 0.3780, test_loss: 1.0172, test_f1: 0.6320
 epoch: 65, train_loss: 0.3963, test_loss: 1.0499, test_f1: 0.6830
 epoch: 66, train_loss: 0.3815, test_loss: 1.0508, test_f1: 0.6498
 epoch: 67, train_loss: 0.3918, test_loss: 1.1010, test_f1: 0.6397
 epoch: 68, train_loss: 0.4035, test_loss: 1.0682, test_f1: 0.6331
 epoch: 69, train_loss: 0.4022, test_loss: 0.9621, test_f1: 0.6631
 epoch: 70, train_loss: 0.3718, test_loss: 1.1837, test_f1: 0.6481
 epoch: 71, train_loss: 0.4081, test_loss: 1.0427, test_f1: 0.6556
 epoch: 72, train_loss: 0.3868, test_loss: 1.1035, test_f1: 0.6312
 epoch: 73, train_loss: 0.3785, test_loss: 1.1515, test_f1: 0.6333
 epoch: 74, train_loss: 0.3720, test_loss: 1.0573, test_f1: 0.6477
 epoch: 75, train_loss: 0.3371, test_loss: 1.1985, test_f1: 0.6726
 epoch: 76, train_loss: 0.3576, test_loss: 1.1883, test_f1: 0.6602
 epoch: 77, train_loss: 0.3404, test_loss: 1.3426, test_f1: 0.6497
 epoch: 78, train_loss: 0.3627, test_loss: 1.1384, test_f1: 0.6764
 epoch: 79, train_loss: 0.3431, test_loss: 1.1618, test_f1: 0.6535
 epoch: 80, train_loss: 0.3359, test_loss: 1.3395, test_f1: 0.6408
 epoch: 81, train_loss: 0.3427, test_loss: 1.1247, test_f1: 0.6502
 epoch: 82, train_loss: 0.3500, test_loss: 1.1821, test_f1: 0.6697
 epoch: 83, train_loss: 0.3286, test_loss: 1.1637, test_f1: 0.6612
 epoch: 84, train_loss: 0.3076, test_loss: 1.2228, test_f1: 0.6495
 epoch: 85, train_loss: 0.3391, test_loss: 1.2150, test_f1: 0.6435
 epoch: 86, train_loss: 0.3309, test_loss: 1.1307, test_f1: 0.6188
 epoch: 87, train_loss: 0.3207, test_loss: 1.3904, test_f1: 0.6268
 epoch: 88, train_loss: 0.3603, test_loss: 1.3123, test_f1: 0.6341
 epoch: 89, train_loss: 0.3096, test_loss: 1.2104, test_f1: 0.6543
 epoch: 90, train_loss: 0.3075, test_loss: 1.3354, test_f1: 0.6434
 epoch: 91, train_loss: 0.3386, test_loss: 1.2717, test_f1: 0.6636
 epoch: 92, train_loss: 0.3269, test_loss: 1.2647, test_f1: 0.6653
 epoch: 93, train_loss: 0.2890, test_loss: 1.3275, test_f1: 0.6536
 epoch: 94, train_loss: 0.3055, test_loss: 1.2394, test_f1: 0.6584
 epoch: 95, train_loss: 0.3035, test_loss: 1.2480, test_f1: 0.6746
 epoch: 96, train_loss: 0.3314, test_loss: 1.1061, test_f1: 0.6558
 epoch: 97, train_loss: 0.2970, test_loss: 1.3125, test_f1: 0.6859
 epoch: 98, train_loss: 0.3231, test_loss: 1.2697, test_f1: 0.6642
 epoch: 99, train_loss: 0.3101, test_loss: 1.2978, test_f1: 0.6346
##################ITERATION #9 ****************************************
 epoch: 0, train_loss: 1.2375, test_loss: 1.4593, test_f1: 0.4652
 epoch: 1, train_loss: 1.0562, test_loss: 1.1017, test_f1: 0.4778
 epoch: 2, train_loss: 1.0021, test_loss: 1.0124, test_f1: 0.5302
 epoch: 3, train_loss: 0.9787, test_loss: 0.9407, test_f1: 0.5177
 epoch: 4, train_loss: 0.9524, test_loss: 0.9237, test_f1: 0.5353
 epoch: 5, train_loss: 0.9231, test_loss: 1.0947, test_f1: 0.5195
 epoch: 6, train_loss: 0.9270, test_loss: 1.0615, test_f1: 0.5014
 epoch: 7, train_loss: 0.8947, test_loss: 0.9949, test_f1: 0.5617
 epoch: 8, train_loss: 0.8911, test_loss: 1.0304, test_f1: 0.5176
 epoch: 9, train_loss: 0.8651, test_loss: 0.9884, test_f1: 0.5534
 epoch: 10, train_loss: 0.8545, test_loss: 0.8995, test_f1: 0.5752
 epoch: 11, train_loss: 0.8323, test_loss: 1.0406, test_f1: 0.5528
 epoch: 12, train_loss: 0.8612, test_loss: 0.9621, test_f1: 0.5814
 epoch: 13, train_loss: 0.8308, test_loss: 1.2442, test_f1: 0.5224
 epoch: 14, train_loss: 0.8157, test_loss: 1.0467, test_f1: 0.5849
 epoch: 15, train_loss: 0.8138, test_loss: 0.9935, test_f1: 0.5588
 epoch: 16, train_loss: 0.8023, test_loss: 0.9462, test_f1: 0.5496
 epoch: 17, train_loss: 0.7875, test_loss: 1.0862, test_f1: 0.5314
 epoch: 18, train_loss: 0.7925, test_loss: 0.9094, test_f1: 0.5827
 epoch: 19, train_loss: 0.7894, test_loss: 0.9297, test_f1: 0.5465
 epoch: 20, train_loss: 0.7630, test_loss: 0.8771, test_f1: 0.6153
 epoch: 21, train_loss: 0.7542, test_loss: 0.9499, test_f1: 0.6116
 epoch: 22, train_loss: 0.7555, test_loss: 0.8351, test_f1: 0.5622
 epoch: 23, train_loss: 0.7357, test_loss: 0.8940, test_f1: 0.5711
 epoch: 24, train_loss: 0.7522, test_loss: 1.0001, test_f1: 0.5615
 epoch: 25, train_loss: 0.7492, test_loss: 0.9788, test_f1: 0.5212
 epoch: 26, train_loss: 0.7267, test_loss: 0.8715, test_f1: 0.5790
 epoch: 27, train_loss: 0.7014, test_loss: 0.9143, test_f1: 0.6036
 epoch: 28, train_loss: 0.6875, test_loss: 0.8628, test_f1: 0.5984
 epoch: 29, train_loss: 0.6960, test_loss: 0.8996, test_f1: 0.6139
 epoch: 30, train_loss: 0.6998, test_loss: 0.9622, test_f1: 0.6479
 epoch: 31, train_loss: 0.6877, test_loss: 0.8031, test_f1: 0.6516
 epoch: 32, train_loss: 0.6686, test_loss: 0.8294, test_f1: 0.6206
 epoch: 33, train_loss: 0.6673, test_loss: 0.8466, test_f1: 0.6313
 epoch: 34, train_loss: 0.6602, test_loss: 0.7661, test_f1: 0.6164
 epoch: 35, train_loss: 0.6552, test_loss: 0.8819, test_f1: 0.6216
 epoch: 36, train_loss: 0.6722, test_loss: 0.7571, test_f1: 0.6518
 epoch: 37, train_loss: 0.6535, test_loss: 1.0658, test_f1: 0.5886
 epoch: 38, train_loss: 0.6344, test_loss: 0.7804, test_f1: 0.6540
 epoch: 39, train_loss: 0.6689, test_loss: 0.8359, test_f1: 0.6181
 epoch: 40, train_loss: 0.6522, test_loss: 1.0344, test_f1: 0.5970
 epoch: 41, train_loss: 0.6164, test_loss: 0.8106, test_f1: 0.6427
 epoch: 42, train_loss: 0.6132, test_loss: 0.8542, test_f1: 0.6372
 epoch: 43, train_loss: 0.6072, test_loss: 0.9290, test_f1: 0.5876
 epoch: 44, train_loss: 0.6052, test_loss: 0.9051, test_f1: 0.6249
 epoch: 45, train_loss: 0.5965, test_loss: 0.7751, test_f1: 0.6514
 epoch: 46, train_loss: 0.6010, test_loss: 0.7512, test_f1: 0.6269
 epoch: 47, train_loss: 0.5580, test_loss: 0.8331, test_f1: 0.6091
 epoch: 48, train_loss: 0.5532, test_loss: 0.9013, test_f1: 0.6044
 epoch: 49, train_loss: 0.5791, test_loss: 0.7743, test_f1: 0.6443
 epoch: 50, train_loss: 0.5786, test_loss: 0.8901, test_f1: 0.6553
 epoch: 51, train_loss: 0.5207, test_loss: 0.7546, test_f1: 0.6806
 epoch: 52, train_loss: 0.5045, test_loss: 0.8203, test_f1: 0.6657
 epoch: 53, train_loss: 0.4803, test_loss: 0.8327, test_f1: 0.6607
 epoch: 54, train_loss: 0.4748, test_loss: 0.9126, test_f1: 0.6578
 epoch: 55, train_loss: 0.4808, test_loss: 0.9592, test_f1: 0.6917
 epoch: 56, train_loss: 0.4566, test_loss: 0.9312, test_f1: 0.6612
 epoch: 57, train_loss: 0.4555, test_loss: 0.9939, test_f1: 0.6475
 epoch: 58, train_loss: 0.4402, test_loss: 0.8904, test_f1: 0.6522
 epoch: 59, train_loss: 0.4483, test_loss: 1.0868, test_f1: 0.6297
 epoch: 60, train_loss: 0.4396, test_loss: 0.9685, test_f1: 0.6456
 epoch: 61, train_loss: 0.4414, test_loss: 0.9842, test_f1: 0.6680
 epoch: 62, train_loss: 0.4511, test_loss: 0.8247, test_f1: 0.6750
 epoch: 63, train_loss: 0.4259, test_loss: 0.8702, test_f1: 0.6576
 epoch: 64, train_loss: 0.4100, test_loss: 0.9269, test_f1: 0.6766
 epoch: 65, train_loss: 0.4264, test_loss: 0.9625, test_f1: 0.6683
 epoch: 66, train_loss: 0.4065, test_loss: 1.0356, test_f1: 0.6372
 epoch: 67, train_loss: 0.4113, test_loss: 1.0590, test_f1: 0.6668
 epoch: 68, train_loss: 0.4218, test_loss: 1.0015, test_f1: 0.6431
 epoch: 69, train_loss: 0.3935, test_loss: 1.0223, test_f1: 0.6479
 epoch: 70, train_loss: 0.3917, test_loss: 1.1711, test_f1: 0.6746
 epoch: 71, train_loss: 0.3880, test_loss: 0.9884, test_f1: 0.6530
 epoch: 72, train_loss: 0.3854, test_loss: 1.0376, test_f1: 0.6738
 epoch: 73, train_loss: 0.3921, test_loss: 0.9175, test_f1: 0.6774
 epoch: 74, train_loss: 0.3810, test_loss: 1.0445, test_f1: 0.6542
 epoch: 75, train_loss: 0.3987, test_loss: 0.9994, test_f1: 0.6745
 epoch: 76, train_loss: 0.3771, test_loss: 0.9056, test_f1: 0.6428
 epoch: 77, train_loss: 0.3415, test_loss: 1.0894, test_f1: 0.6674
 epoch: 78, train_loss: 0.3354, test_loss: 0.9337, test_f1: 0.6663
 epoch: 79, train_loss: 0.3614, test_loss: 0.9244, test_f1: 0.6685
 epoch: 80, train_loss: 0.3590, test_loss: 1.0534, test_f1: 0.6570
 epoch: 81, train_loss: 0.4076, test_loss: 1.0139, test_f1: 0.6790
 epoch: 82, train_loss: 0.3790, test_loss: 0.8042, test_f1: 0.6888
 epoch: 83, train_loss: 0.3541, test_loss: 1.0243, test_f1: 0.6728
 epoch: 84, train_loss: 0.3306, test_loss: 0.9752, test_f1: 0.6655
 epoch: 85, train_loss: 0.3314, test_loss: 0.9772, test_f1: 0.6735
 epoch: 86, train_loss: 0.3344, test_loss: 1.0262, test_f1: 0.6693
 epoch: 87, train_loss: 0.3392, test_loss: 1.1217, test_f1: 0.6462
 epoch: 88, train_loss: 0.3213, test_loss: 1.1201, test_f1: 0.6677
 epoch: 89, train_loss: 0.3408, test_loss: 1.0762, test_f1: 0.6557
 epoch: 90, train_loss: 0.3307, test_loss: 1.0036, test_f1: 0.6564
 epoch: 91, train_loss: 0.3163, test_loss: 0.9821, test_f1: 0.6672
 epoch: 92, train_loss: 0.3189, test_loss: 1.1186, test_f1: 0.6666
 epoch: 93, train_loss: 0.3224, test_loss: 0.9685, test_f1: 0.6736
 epoch: 94, train_loss: 0.3061, test_loss: 0.9915, test_f1: 0.6553
 epoch: 95, train_loss: 0.3008, test_loss: 1.0878, test_f1: 0.6635
 epoch: 96, train_loss: 0.3123, test_loss: 0.9993, test_f1: 0.6583
 epoch: 97, train_loss: 0.3241, test_loss: 0.9065, test_f1: 0.6770
 epoch: 98, train_loss: 0.2822, test_loss: 1.2683, test_f1: 0.6547
 epoch: 99, train_loss: 0.3070, test_loss: 1.1523, test_f1: 0.6488

Training completed in 653.94 seconds
Best F1: 0.7158 at epoch 82
Mean F1 across iterations: 0.6955  0.0112
========================FINAL RESULTS================================
FEGIN weighted F1: 0.7158  0.0112
python main.py --data ltspice_examples --representation component_pin --model FEGIN --layers 3 --hiddens 128 --batch_size 64 --lr 0.01 --emb_size 512 --epochs 100 --save_appendix component_pin_L3_H128_BS64_LR0.01_E512 --no_val
-----



STDERR:
  File "main.py", line 370, in <module>
    main()
  File "main.py", line 254, in main
    dataset = dataset_class(
  File "/home/philip/projects/ltspice_examples_code_repo/Circuit-Completion-Using-GNNs/component_classification_with_link_prediction_head/evaluation/FEGIN/kernel/circuit_datasets.py", line 15, in __init__
    self.data, self.slices = torch.load(self.processed_paths[0])
  File "/home/philip/.local/lib/python3.8/site-packages/torch/serialization.py", line 1040, in load
    warnings.warn(
  File "/usr/lib/python3.8/warnings.py", line 109, in _showwarnmsg
    sw(msg.message, msg.category, msg.filename, msg.lineno,
  File "main.py", line 47, in warn_with_traceback
    traceback.print_stack(file=log)
/home/philip/projects/ltspice_examples_code_repo/Circuit-Completion-Using-GNNs/component_classification_with_link_prediction_head/evaluation/FEGIN/kernel/circuit_datasets.py:15: FutureWarning: You are using `torch.load` with `weights_only=False` (the current default value), which uses the default pickle module implicitly. It is possible to construct malicious pickle data which will execute arbitrary code during unpickling (See https://github.com/pytorch/pytorch/blob/main/SECURITY.md#untrusted-models for more details). In a future release, the default value for `weights_only` will be flipped to `True`. This limits the functions that could be executed during unpickling. Arbitrary objects will no longer be allowed to be loaded via this mode unless they are explicitly allowlisted by the user via `torch.serialization.add_safe_globals`. We recommend you start setting `weights_only=True` for any use case where you don't have full control of the loaded file. Please open an issue on GitHub for any issues related to this experimental feature.
  self.data, self.slices = torch.load(self.processed_paths[0])
