STDOUT:
Results will be saved in /home/philip/projects/ltspice_examples_code_repo/Circuit-Completion-Using-GNNs/component_classification_with_link_prediction_head/evaluation/FEGIN/results/model_FEGIN_dataset_ltspice_examples
Command line input: python main.py --data ltspice_examples --representation component_pin --model FEGIN --layers 3 --hiddens 16 --batch_size 64 --lr 0.001 --emb_size 250 --epochs 100 --save_appendix component_pin_L3_H16_BS64_LR0.001_E250 --no_val
 is saved.
-----
ltspice_examples - FEGIN
Using 3 layers, 16 hidden units, h = 2
Loading component_pin representation dataset
ENTERED
Training FEGIN on component_pin representation
Train: 3560, Test: 848
##################ITERATION #0 ****************************************
 epoch: 0, train_loss: 1.3315, test_loss: 1.3089, test_f1: 0.2260
 epoch: 1, train_loss: 1.2642, test_loss: 1.2139, test_f1: 0.3381
 epoch: 2, train_loss: 1.1626, test_loss: 1.0930, test_f1: 0.3373
 epoch: 3, train_loss: 1.0855, test_loss: 1.0468, test_f1: 0.3470
 epoch: 4, train_loss: 1.0553, test_loss: 1.0356, test_f1: 0.3547
 epoch: 5, train_loss: 1.0372, test_loss: 1.0272, test_f1: 0.3451
 epoch: 6, train_loss: 1.0219, test_loss: 1.0283, test_f1: 0.3468
 epoch: 7, train_loss: 1.0048, test_loss: 1.0274, test_f1: 0.3553
 epoch: 8, train_loss: 0.9932, test_loss: 1.0151, test_f1: 0.4029
 epoch: 9, train_loss: 0.9804, test_loss: 1.0389, test_f1: 0.4293
 epoch: 10, train_loss: 0.9775, test_loss: 1.0228, test_f1: 0.4125
 epoch: 11, train_loss: 0.9656, test_loss: 0.9645, test_f1: 0.4525
 epoch: 12, train_loss: 0.9625, test_loss: 0.9800, test_f1: 0.4577
 epoch: 13, train_loss: 0.9511, test_loss: 1.1111, test_f1: 0.4078
 epoch: 14, train_loss: 0.9501, test_loss: 0.9670, test_f1: 0.4812
 epoch: 15, train_loss: 0.9418, test_loss: 0.9492, test_f1: 0.4636
 epoch: 16, train_loss: 0.9317, test_loss: 1.0108, test_f1: 0.4704
 epoch: 17, train_loss: 0.9379, test_loss: 1.0054, test_f1: 0.4443
 epoch: 18, train_loss: 0.9217, test_loss: 1.0378, test_f1: 0.4605
 epoch: 19, train_loss: 0.9135, test_loss: 1.0351, test_f1: 0.4560
 epoch: 20, train_loss: 0.9225, test_loss: 0.9365, test_f1: 0.4929
 epoch: 21, train_loss: 0.9076, test_loss: 0.9697, test_f1: 0.5052
 epoch: 22, train_loss: 0.9121, test_loss: 0.9606, test_f1: 0.4772
 epoch: 23, train_loss: 0.8973, test_loss: 0.9655, test_f1: 0.4848
 epoch: 24, train_loss: 0.8956, test_loss: 1.0829, test_f1: 0.4824
 epoch: 25, train_loss: 0.8981, test_loss: 0.9828, test_f1: 0.4986
 epoch: 26, train_loss: 0.8857, test_loss: 0.9207, test_f1: 0.4828
 epoch: 27, train_loss: 0.8862, test_loss: 0.9424, test_f1: 0.5004
 epoch: 28, train_loss: 0.8919, test_loss: 1.0930, test_f1: 0.4771
 epoch: 29, train_loss: 0.8830, test_loss: 0.9820, test_f1: 0.4942
 epoch: 30, train_loss: 0.8771, test_loss: 0.9623, test_f1: 0.4873
 epoch: 31, train_loss: 0.8623, test_loss: 0.9345, test_f1: 0.5142
 epoch: 32, train_loss: 0.8549, test_loss: 0.9723, test_f1: 0.5182
 epoch: 33, train_loss: 0.8526, test_loss: 0.9270, test_f1: 0.5041
 epoch: 34, train_loss: 0.8540, test_loss: 0.9542, test_f1: 0.5275
 epoch: 35, train_loss: 0.8438, test_loss: 0.9644, test_f1: 0.5252
 epoch: 36, train_loss: 0.8409, test_loss: 0.9405, test_f1: 0.5257
 epoch: 37, train_loss: 0.8265, test_loss: 0.9002, test_f1: 0.5375
 epoch: 38, train_loss: 0.8281, test_loss: 1.1120, test_f1: 0.4704
 epoch: 39, train_loss: 0.8232, test_loss: 0.9299, test_f1: 0.5558
 epoch: 40, train_loss: 0.8106, test_loss: 0.8883, test_f1: 0.5422
 epoch: 41, train_loss: 0.8138, test_loss: 0.8974, test_f1: 0.5294
 epoch: 42, train_loss: 0.8182, test_loss: 0.8892, test_f1: 0.5374
 epoch: 43, train_loss: 0.8089, test_loss: 0.9297, test_f1: 0.5511
 epoch: 44, train_loss: 0.8047, test_loss: 0.9820, test_f1: 0.5215
 epoch: 45, train_loss: 0.8103, test_loss: 0.8987, test_f1: 0.5366
 epoch: 46, train_loss: 0.8067, test_loss: 0.9436, test_f1: 0.5455
 epoch: 47, train_loss: 0.7976, test_loss: 0.9339, test_f1: 0.5249
 epoch: 48, train_loss: 0.7986, test_loss: 0.8744, test_f1: 0.5346
 epoch: 49, train_loss: 0.7959, test_loss: 0.9284, test_f1: 0.5301
 epoch: 50, train_loss: 0.8069, test_loss: 0.8728, test_f1: 0.5415
 epoch: 51, train_loss: 0.7863, test_loss: 0.9049, test_f1: 0.5289
 epoch: 52, train_loss: 0.7923, test_loss: 0.8948, test_f1: 0.5384
 epoch: 53, train_loss: 0.7705, test_loss: 0.9048, test_f1: 0.5388
 epoch: 54, train_loss: 0.7677, test_loss: 0.8954, test_f1: 0.5521
 epoch: 55, train_loss: 0.7666, test_loss: 0.9440, test_f1: 0.5408
 epoch: 56, train_loss: 0.7645, test_loss: 0.8848, test_f1: 0.5361
 epoch: 57, train_loss: 0.7710, test_loss: 0.8862, test_f1: 0.5273
 epoch: 58, train_loss: 0.7656, test_loss: 0.9277, test_f1: 0.5394
 epoch: 59, train_loss: 0.7790, test_loss: 0.9096, test_f1: 0.5452
 epoch: 60, train_loss: 0.7741, test_loss: 0.8920, test_f1: 0.5409
 epoch: 61, train_loss: 0.7716, test_loss: 0.9141, test_f1: 0.5447
 epoch: 62, train_loss: 0.7733, test_loss: 0.9102, test_f1: 0.5410
 epoch: 63, train_loss: 0.7685, test_loss: 0.9237, test_f1: 0.5491
 epoch: 64, train_loss: 0.7666, test_loss: 0.9178, test_f1: 0.5497
 epoch: 65, train_loss: 0.7686, test_loss: 0.9255, test_f1: 0.5435
 epoch: 66, train_loss: 0.7659, test_loss: 0.9092, test_f1: 0.5436
 epoch: 67, train_loss: 0.7589, test_loss: 0.9036, test_f1: 0.5385
 epoch: 68, train_loss: 0.7568, test_loss: 0.8979, test_f1: 0.5468
 epoch: 69, train_loss: 0.7507, test_loss: 0.8905, test_f1: 0.5329
 epoch: 70, train_loss: 0.7603, test_loss: 0.9316, test_f1: 0.5547
 epoch: 71, train_loss: 0.7526, test_loss: 0.8808, test_f1: 0.5424
 epoch: 72, train_loss: 0.7444, test_loss: 0.9081, test_f1: 0.5441
 epoch: 73, train_loss: 0.7576, test_loss: 0.8865, test_f1: 0.5432
 epoch: 74, train_loss: 0.7537, test_loss: 0.9191, test_f1: 0.5319
 epoch: 75, train_loss: 0.7576, test_loss: 0.8882, test_f1: 0.5443
 epoch: 76, train_loss: 0.7580, test_loss: 0.9153, test_f1: 0.5481
 epoch: 77, train_loss: 0.7397, test_loss: 0.9018, test_f1: 0.5517
 epoch: 78, train_loss: 0.7527, test_loss: 0.9172, test_f1: 0.5483
 epoch: 79, train_loss: 0.7380, test_loss: 0.8880, test_f1: 0.5424
 epoch: 80, train_loss: 0.7509, test_loss: 0.9339, test_f1: 0.5342
 epoch: 81, train_loss: 0.7459, test_loss: 0.9100, test_f1: 0.5449
 epoch: 82, train_loss: 0.7433, test_loss: 0.9355, test_f1: 0.5398
 epoch: 83, train_loss: 0.7474, test_loss: 0.9115, test_f1: 0.5468
 epoch: 84, train_loss: 0.7423, test_loss: 0.8735, test_f1: 0.5284
 epoch: 85, train_loss: 0.7366, test_loss: 0.9169, test_f1: 0.5549
 epoch: 86, train_loss: 0.7392, test_loss: 0.9533, test_f1: 0.5513
 epoch: 87, train_loss: 0.7410, test_loss: 0.9056, test_f1: 0.5523
 epoch: 88, train_loss: 0.7258, test_loss: 1.0340, test_f1: 0.5422
 epoch: 89, train_loss: 0.7323, test_loss: 0.8827, test_f1: 0.5468
 epoch: 90, train_loss: 0.7312, test_loss: 0.9435, test_f1: 0.5553
 epoch: 91, train_loss: 0.7378, test_loss: 0.9428, test_f1: 0.5503
 epoch: 92, train_loss: 0.7377, test_loss: 0.9098, test_f1: 0.5534
 epoch: 93, train_loss: 0.7365, test_loss: 0.9338, test_f1: 0.5507
 epoch: 94, train_loss: 0.7314, test_loss: 0.9569, test_f1: 0.5540
 epoch: 95, train_loss: 0.7267, test_loss: 0.9364, test_f1: 0.5564
 epoch: 96, train_loss: 0.7305, test_loss: 0.9553, test_f1: 0.5489
 epoch: 97, train_loss: 0.7226, test_loss: 0.8986, test_f1: 0.5559
 epoch: 98, train_loss: 0.7330, test_loss: 0.9394, test_f1: 0.5457
 epoch: 99, train_loss: 0.7368, test_loss: 0.9247, test_f1: 0.5448
##################ITERATION #1 ****************************************
 epoch: 0, train_loss: 1.2727, test_loss: 1.2093, test_f1: 0.3076
 epoch: 1, train_loss: 1.1574, test_loss: 1.0838, test_f1: 0.3393
 epoch: 2, train_loss: 1.0705, test_loss: 1.0428, test_f1: 0.3419
 epoch: 3, train_loss: 1.0365, test_loss: 1.0227, test_f1: 0.3508
 epoch: 4, train_loss: 1.0293, test_loss: 1.0242, test_f1: 0.3669
 epoch: 5, train_loss: 1.0105, test_loss: 1.0054, test_f1: 0.3719
 epoch: 6, train_loss: 0.9988, test_loss: 0.9888, test_f1: 0.3998
 epoch: 7, train_loss: 0.9947, test_loss: 1.0104, test_f1: 0.3999
 epoch: 8, train_loss: 0.9859, test_loss: 1.0034, test_f1: 0.4161
 epoch: 9, train_loss: 0.9789, test_loss: 0.9730, test_f1: 0.4027
 epoch: 10, train_loss: 0.9786, test_loss: 0.9707, test_f1: 0.4633
 epoch: 11, train_loss: 0.9693, test_loss: 0.9683, test_f1: 0.4328
 epoch: 12, train_loss: 0.9669, test_loss: 0.9740, test_f1: 0.4539
 epoch: 13, train_loss: 0.9625, test_loss: 0.9747, test_f1: 0.4388
 epoch: 14, train_loss: 0.9570, test_loss: 0.9920, test_f1: 0.4499
 epoch: 15, train_loss: 0.9490, test_loss: 0.9915, test_f1: 0.4590
 epoch: 16, train_loss: 0.9524, test_loss: 0.9972, test_f1: 0.4841
 epoch: 17, train_loss: 0.9436, test_loss: 1.0101, test_f1: 0.4762
 epoch: 18, train_loss: 0.9436, test_loss: 0.9731, test_f1: 0.4794
 epoch: 19, train_loss: 0.9319, test_loss: 0.9756, test_f1: 0.4692
 epoch: 20, train_loss: 0.9179, test_loss: 0.9287, test_f1: 0.4751
 epoch: 21, train_loss: 0.9091, test_loss: 0.9864, test_f1: 0.4815
 epoch: 22, train_loss: 0.9049, test_loss: 0.8972, test_f1: 0.5064
 epoch: 23, train_loss: 0.9052, test_loss: 0.9171, test_f1: 0.5029
 epoch: 24, train_loss: 0.9008, test_loss: 0.8876, test_f1: 0.5146
 epoch: 25, train_loss: 0.8920, test_loss: 0.9252, test_f1: 0.4967
 epoch: 26, train_loss: 0.8842, test_loss: 0.9721, test_f1: 0.5014
 epoch: 27, train_loss: 0.8790, test_loss: 0.8848, test_f1: 0.5320
 epoch: 28, train_loss: 0.8727, test_loss: 0.9507, test_f1: 0.4730
 epoch: 29, train_loss: 0.8679, test_loss: 0.9106, test_f1: 0.5155
 epoch: 30, train_loss: 0.8777, test_loss: 1.0072, test_f1: 0.4768
 epoch: 31, train_loss: 0.8683, test_loss: 0.8636, test_f1: 0.5100
 epoch: 32, train_loss: 0.8532, test_loss: 0.8818, test_f1: 0.5130
 epoch: 33, train_loss: 0.8663, test_loss: 0.8741, test_f1: 0.5082
 epoch: 34, train_loss: 0.8588, test_loss: 0.9145, test_f1: 0.5019
 epoch: 35, train_loss: 0.8477, test_loss: 0.9122, test_f1: 0.5011
 epoch: 36, train_loss: 0.8477, test_loss: 0.9360, test_f1: 0.5118
 epoch: 37, train_loss: 0.8289, test_loss: 0.8698, test_f1: 0.5322
 epoch: 38, train_loss: 0.8438, test_loss: 0.9541, test_f1: 0.5143
 epoch: 39, train_loss: 0.8415, test_loss: 0.8536, test_f1: 0.5265
 epoch: 40, train_loss: 0.8479, test_loss: 0.8709, test_f1: 0.5327
 epoch: 41, train_loss: 0.8413, test_loss: 0.8538, test_f1: 0.5449
 epoch: 42, train_loss: 0.8326, test_loss: 0.8544, test_f1: 0.5533
 epoch: 43, train_loss: 0.8267, test_loss: 0.8541, test_f1: 0.5438
 epoch: 44, train_loss: 0.8182, test_loss: 0.8794, test_f1: 0.5284
 epoch: 45, train_loss: 0.8133, test_loss: 0.8668, test_f1: 0.5431
 epoch: 46, train_loss: 0.8251, test_loss: 0.9044, test_f1: 0.5190
 epoch: 47, train_loss: 0.8128, test_loss: 0.9141, test_f1: 0.5255
 epoch: 48, train_loss: 0.8098, test_loss: 0.8918, test_f1: 0.5202
 epoch: 49, train_loss: 0.8111, test_loss: 0.8908, test_f1: 0.5339
 epoch: 50, train_loss: 0.7999, test_loss: 0.8743, test_f1: 0.5280
 epoch: 51, train_loss: 0.7970, test_loss: 0.8821, test_f1: 0.5450
 epoch: 52, train_loss: 0.7905, test_loss: 0.8757, test_f1: 0.5608
 epoch: 53, train_loss: 0.7886, test_loss: 0.8774, test_f1: 0.5505
 epoch: 54, train_loss: 0.7999, test_loss: 0.8761, test_f1: 0.5501
 epoch: 55, train_loss: 0.7911, test_loss: 0.8640, test_f1: 0.5660
 epoch: 56, train_loss: 0.7780, test_loss: 0.8750, test_f1: 0.5502
 epoch: 57, train_loss: 0.7771, test_loss: 0.8724, test_f1: 0.5495
 epoch: 58, train_loss: 0.7834, test_loss: 0.8853, test_f1: 0.5605
 epoch: 59, train_loss: 0.7810, test_loss: 0.8817, test_f1: 0.5463
 epoch: 60, train_loss: 0.7907, test_loss: 0.8722, test_f1: 0.5555
 epoch: 61, train_loss: 0.7677, test_loss: 0.8812, test_f1: 0.5586
 epoch: 62, train_loss: 0.7705, test_loss: 0.8551, test_f1: 0.5682
 epoch: 63, train_loss: 0.7927, test_loss: 0.8575, test_f1: 0.5597
 epoch: 64, train_loss: 0.7759, test_loss: 0.8884, test_f1: 0.5483
 epoch: 65, train_loss: 0.7674, test_loss: 0.8760, test_f1: 0.5536
 epoch: 66, train_loss: 0.7742, test_loss: 0.8813, test_f1: 0.5570
 epoch: 67, train_loss: 0.7657, test_loss: 0.8845, test_f1: 0.5401
 epoch: 68, train_loss: 0.7592, test_loss: 0.8873, test_f1: 0.5658
 epoch: 69, train_loss: 0.7697, test_loss: 0.8696, test_f1: 0.5578
 epoch: 70, train_loss: 0.7608, test_loss: 0.8717, test_f1: 0.5627
 epoch: 71, train_loss: 0.7564, test_loss: 0.8968, test_f1: 0.5607
 epoch: 72, train_loss: 0.7590, test_loss: 0.8963, test_f1: 0.5613
 epoch: 73, train_loss: 0.7702, test_loss: 0.8691, test_f1: 0.5651
 epoch: 74, train_loss: 0.7557, test_loss: 0.8814, test_f1: 0.5549
 epoch: 75, train_loss: 0.7609, test_loss: 0.8893, test_f1: 0.5608
 epoch: 76, train_loss: 0.7621, test_loss: 0.8916, test_f1: 0.5554
 epoch: 77, train_loss: 0.7580, test_loss: 0.8764, test_f1: 0.5611
 epoch: 78, train_loss: 0.7738, test_loss: 0.9050, test_f1: 0.5515
 epoch: 79, train_loss: 0.7520, test_loss: 0.8835, test_f1: 0.5655
 epoch: 80, train_loss: 0.7571, test_loss: 0.9053, test_f1: 0.5635
 epoch: 81, train_loss: 0.7550, test_loss: 0.8863, test_f1: 0.5698
 epoch: 82, train_loss: 0.7530, test_loss: 0.8879, test_f1: 0.5631
 epoch: 83, train_loss: 0.7667, test_loss: 0.8900, test_f1: 0.5636
 epoch: 84, train_loss: 0.7543, test_loss: 0.9028, test_f1: 0.5554
 epoch: 85, train_loss: 0.7526, test_loss: 0.8952, test_f1: 0.5588
 epoch: 86, train_loss: 0.7481, test_loss: 0.8944, test_f1: 0.5510
 epoch: 87, train_loss: 0.7482, test_loss: 0.8998, test_f1: 0.5595
 epoch: 88, train_loss: 0.7585, test_loss: 0.9135, test_f1: 0.5683
 epoch: 89, train_loss: 0.7466, test_loss: 0.9006, test_f1: 0.5550
 epoch: 90, train_loss: 0.7487, test_loss: 0.9075, test_f1: 0.5652
 epoch: 91, train_loss: 0.7445, test_loss: 0.9001, test_f1: 0.5624
 epoch: 92, train_loss: 0.7511, test_loss: 0.8867, test_f1: 0.5683
 epoch: 93, train_loss: 0.7522, test_loss: 0.9006, test_f1: 0.5575
 epoch: 94, train_loss: 0.7459, test_loss: 0.8927, test_f1: 0.5559
 epoch: 95, train_loss: 0.7502, test_loss: 0.9083, test_f1: 0.5501
 epoch: 96, train_loss: 0.7417, test_loss: 0.8901, test_f1: 0.5669
 epoch: 97, train_loss: 0.7519, test_loss: 0.8913, test_f1: 0.5644
 epoch: 98, train_loss: 0.7357, test_loss: 0.9008, test_f1: 0.5656
 epoch: 99, train_loss: 0.7416, test_loss: 0.8963, test_f1: 0.5536
##################ITERATION #2 ****************************************
 epoch: 0, train_loss: 1.2426, test_loss: 1.1621, test_f1: 0.3048
 epoch: 1, train_loss: 1.1205, test_loss: 1.0887, test_f1: 0.3367
 epoch: 2, train_loss: 1.0671, test_loss: 1.0668, test_f1: 0.3903
 epoch: 3, train_loss: 1.0310, test_loss: 1.0566, test_f1: 0.4171
 epoch: 4, train_loss: 1.0150, test_loss: 1.0345, test_f1: 0.4158
 epoch: 5, train_loss: 1.0002, test_loss: 1.0491, test_f1: 0.4408
 epoch: 6, train_loss: 0.9900, test_loss: 1.0236, test_f1: 0.4498
 epoch: 7, train_loss: 0.9765, test_loss: 1.0001, test_f1: 0.4674
 epoch: 8, train_loss: 0.9647, test_loss: 1.0173, test_f1: 0.4804
 epoch: 9, train_loss: 0.9520, test_loss: 1.0278, test_f1: 0.4810
 epoch: 10, train_loss: 0.9503, test_loss: 1.0230, test_f1: 0.4832
 epoch: 11, train_loss: 0.9262, test_loss: 1.0050, test_f1: 0.4801
 epoch: 12, train_loss: 0.9213, test_loss: 0.9890, test_f1: 0.4912
 epoch: 13, train_loss: 0.9080, test_loss: 0.9720, test_f1: 0.5194
 epoch: 14, train_loss: 0.9076, test_loss: 1.0589, test_f1: 0.5091
 epoch: 15, train_loss: 0.9031, test_loss: 1.0042, test_f1: 0.4705
 epoch: 16, train_loss: 0.8817, test_loss: 1.0277, test_f1: 0.4837
 epoch: 17, train_loss: 0.8831, test_loss: 0.9613, test_f1: 0.5093
 epoch: 18, train_loss: 0.8874, test_loss: 0.9894, test_f1: 0.4983
 epoch: 19, train_loss: 0.8782, test_loss: 0.9598, test_f1: 0.5210
 epoch: 20, train_loss: 0.8688, test_loss: 0.9597, test_f1: 0.5234
 epoch: 21, train_loss: 0.8549, test_loss: 0.9410, test_f1: 0.5166
 epoch: 22, train_loss: 0.8465, test_loss: 0.9841, test_f1: 0.5220
 epoch: 23, train_loss: 0.8524, test_loss: 0.9492, test_f1: 0.5319
 epoch: 24, train_loss: 0.8391, test_loss: 0.9061, test_f1: 0.5097
 epoch: 25, train_loss: 0.8365, test_loss: 1.0162, test_f1: 0.4905
 epoch: 26, train_loss: 0.8363, test_loss: 0.8885, test_f1: 0.5277
 epoch: 27, train_loss: 0.8349, test_loss: 0.9441, test_f1: 0.5191
 epoch: 28, train_loss: 0.8166, test_loss: 0.9067, test_f1: 0.5284
 epoch: 29, train_loss: 0.8100, test_loss: 0.8797, test_f1: 0.5377
 epoch: 30, train_loss: 0.8066, test_loss: 0.8994, test_f1: 0.5537
 epoch: 31, train_loss: 0.8034, test_loss: 0.9036, test_f1: 0.5390
 epoch: 32, train_loss: 0.8060, test_loss: 0.9415, test_f1: 0.5238
 epoch: 33, train_loss: 0.8077, test_loss: 0.9118, test_f1: 0.5222
 epoch: 34, train_loss: 0.7929, test_loss: 0.9592, test_f1: 0.5318
 epoch: 35, train_loss: 0.7798, test_loss: 0.8829, test_f1: 0.5285
 epoch: 36, train_loss: 0.7938, test_loss: 0.8787, test_f1: 0.5334
 epoch: 37, train_loss: 0.7948, test_loss: 0.8993, test_f1: 0.5368
 epoch: 38, train_loss: 0.7768, test_loss: 0.9320, test_f1: 0.5350
 epoch: 39, train_loss: 0.7647, test_loss: 0.9557, test_f1: 0.5287
 epoch: 40, train_loss: 0.7849, test_loss: 0.9066, test_f1: 0.5264
 epoch: 41, train_loss: 0.7753, test_loss: 0.9212, test_f1: 0.5196
 epoch: 42, train_loss: 0.7665, test_loss: 0.8987, test_f1: 0.5263
 epoch: 43, train_loss: 0.7732, test_loss: 0.8949, test_f1: 0.5434
 epoch: 44, train_loss: 0.7689, test_loss: 0.9339, test_f1: 0.5309
 epoch: 45, train_loss: 0.7829, test_loss: 0.9073, test_f1: 0.5238
 epoch: 46, train_loss: 0.7630, test_loss: 0.9299, test_f1: 0.5317
 epoch: 47, train_loss: 0.7646, test_loss: 0.9305, test_f1: 0.5327
 epoch: 48, train_loss: 0.7605, test_loss: 0.9314, test_f1: 0.5209
 epoch: 49, train_loss: 0.7688, test_loss: 0.9653, test_f1: 0.5282
 epoch: 50, train_loss: 0.7614, test_loss: 0.9881, test_f1: 0.5230
 epoch: 51, train_loss: 0.7418, test_loss: 0.9187, test_f1: 0.5301
 epoch: 52, train_loss: 0.7318, test_loss: 0.9345, test_f1: 0.5436
 epoch: 53, train_loss: 0.7482, test_loss: 0.9228, test_f1: 0.5509
 epoch: 54, train_loss: 0.7404, test_loss: 0.9833, test_f1: 0.5307
 epoch: 55, train_loss: 0.7420, test_loss: 0.9236, test_f1: 0.5470
 epoch: 56, train_loss: 0.7372, test_loss: 0.9127, test_f1: 0.5448
 epoch: 57, train_loss: 0.7432, test_loss: 0.9127, test_f1: 0.5272
 epoch: 58, train_loss: 0.7353, test_loss: 0.9310, test_f1: 0.5342
 epoch: 59, train_loss: 0.7264, test_loss: 0.9081, test_f1: 0.5448
 epoch: 60, train_loss: 0.7300, test_loss: 0.9285, test_f1: 0.5391
 epoch: 61, train_loss: 0.7319, test_loss: 0.9480, test_f1: 0.5355
 epoch: 62, train_loss: 0.7321, test_loss: 0.9264, test_f1: 0.5279
 epoch: 63, train_loss: 0.7163, test_loss: 0.9278, test_f1: 0.5286
 epoch: 64, train_loss: 0.7191, test_loss: 0.9201, test_f1: 0.5389
 epoch: 65, train_loss: 0.7235, test_loss: 0.9231, test_f1: 0.5279
 epoch: 66, train_loss: 0.7137, test_loss: 0.9502, test_f1: 0.5313
 epoch: 67, train_loss: 0.7231, test_loss: 0.9508, test_f1: 0.5247
 epoch: 68, train_loss: 0.7262, test_loss: 0.9237, test_f1: 0.5370
 epoch: 69, train_loss: 0.7160, test_loss: 0.9633, test_f1: 0.5255
 epoch: 70, train_loss: 0.7242, test_loss: 0.9144, test_f1: 0.5426
 epoch: 71, train_loss: 0.7374, test_loss: 0.9222, test_f1: 0.5356
 epoch: 72, train_loss: 0.7121, test_loss: 0.9223, test_f1: 0.5384
 epoch: 73, train_loss: 0.7289, test_loss: 0.9509, test_f1: 0.5277
 epoch: 74, train_loss: 0.7081, test_loss: 0.9536, test_f1: 0.5324
 epoch: 75, train_loss: 0.7118, test_loss: 0.9221, test_f1: 0.5480
 epoch: 76, train_loss: 0.7089, test_loss: 0.9040, test_f1: 0.5455
 epoch: 77, train_loss: 0.7082, test_loss: 0.9634, test_f1: 0.5397
 epoch: 78, train_loss: 0.7098, test_loss: 0.9316, test_f1: 0.5383
 epoch: 79, train_loss: 0.7094, test_loss: 0.9321, test_f1: 0.5347
 epoch: 80, train_loss: 0.7131, test_loss: 0.9198, test_f1: 0.5360
 epoch: 81, train_loss: 0.7106, test_loss: 0.9235, test_f1: 0.5672
 epoch: 82, train_loss: 0.7135, test_loss: 0.9301, test_f1: 0.5424
 epoch: 83, train_loss: 0.7108, test_loss: 0.9318, test_f1: 0.5454
 epoch: 84, train_loss: 0.7089, test_loss: 0.9869, test_f1: 0.5235
 epoch: 85, train_loss: 0.7122, test_loss: 0.9299, test_f1: 0.5478
 epoch: 86, train_loss: 0.7002, test_loss: 0.9078, test_f1: 0.5622
 epoch: 87, train_loss: 0.7233, test_loss: 0.9587, test_f1: 0.5325
 epoch: 88, train_loss: 0.7032, test_loss: 0.9488, test_f1: 0.5386
 epoch: 89, train_loss: 0.7030, test_loss: 0.9225, test_f1: 0.5449
 epoch: 90, train_loss: 0.7105, test_loss: 0.9063, test_f1: 0.5564
 epoch: 91, train_loss: 0.6994, test_loss: 0.9295, test_f1: 0.5401
 epoch: 92, train_loss: 0.7036, test_loss: 0.9225, test_f1: 0.5447
 epoch: 93, train_loss: 0.7049, test_loss: 0.9201, test_f1: 0.5407
 epoch: 94, train_loss: 0.6955, test_loss: 0.9611, test_f1: 0.5237
 epoch: 95, train_loss: 0.6889, test_loss: 0.9485, test_f1: 0.5429
 epoch: 96, train_loss: 0.6899, test_loss: 0.9321, test_f1: 0.5381
 epoch: 97, train_loss: 0.7049, test_loss: 0.9334, test_f1: 0.5437
 epoch: 98, train_loss: 0.6907, test_loss: 0.9410, test_f1: 0.5504
 epoch: 99, train_loss: 0.7007, test_loss: 0.9765, test_f1: 0.5432
##################ITERATION #3 ****************************************
 epoch: 0, train_loss: 1.2937, test_loss: 1.1685, test_f1: 0.3133
 epoch: 1, train_loss: 1.1661, test_loss: 1.0627, test_f1: 0.4476
 epoch: 2, train_loss: 1.1083, test_loss: 1.0045, test_f1: 0.4691
 epoch: 3, train_loss: 1.0642, test_loss: 0.9868, test_f1: 0.4612
 epoch: 4, train_loss: 1.0457, test_loss: 1.0078, test_f1: 0.4611
 epoch: 5, train_loss: 1.0218, test_loss: 0.9766, test_f1: 0.4627
 epoch: 6, train_loss: 1.0099, test_loss: 0.9728, test_f1: 0.4696
 epoch: 7, train_loss: 1.0028, test_loss: 0.9737, test_f1: 0.4805
 epoch: 8, train_loss: 0.9853, test_loss: 0.9544, test_f1: 0.4944
 epoch: 9, train_loss: 0.9780, test_loss: 0.9705, test_f1: 0.4933
 epoch: 10, train_loss: 0.9638, test_loss: 0.9687, test_f1: 0.4979
 epoch: 11, train_loss: 0.9587, test_loss: 0.9470, test_f1: 0.4995
 epoch: 12, train_loss: 0.9536, test_loss: 0.9610, test_f1: 0.4969
 epoch: 13, train_loss: 0.9397, test_loss: 0.9501, test_f1: 0.5114
 epoch: 14, train_loss: 0.9278, test_loss: 0.9794, test_f1: 0.5039
 epoch: 15, train_loss: 0.9208, test_loss: 0.9252, test_f1: 0.5081
 epoch: 16, train_loss: 0.9285, test_loss: 0.9305, test_f1: 0.5045
 epoch: 17, train_loss: 0.9153, test_loss: 0.9287, test_f1: 0.5091
 epoch: 18, train_loss: 0.9136, test_loss: 0.9505, test_f1: 0.5137
 epoch: 19, train_loss: 0.9099, test_loss: 0.9265, test_f1: 0.5283
 epoch: 20, train_loss: 0.9160, test_loss: 0.9272, test_f1: 0.5307
 epoch: 21, train_loss: 0.9064, test_loss: 0.9410, test_f1: 0.5024
 epoch: 22, train_loss: 0.9037, test_loss: 0.9393, test_f1: 0.5079
 epoch: 23, train_loss: 0.8922, test_loss: 0.9455, test_f1: 0.5053
 epoch: 24, train_loss: 0.8977, test_loss: 0.8986, test_f1: 0.5220
 epoch: 25, train_loss: 0.8941, test_loss: 0.9230, test_f1: 0.5190
 epoch: 26, train_loss: 0.8817, test_loss: 0.9155, test_f1: 0.5227
 epoch: 27, train_loss: 0.8795, test_loss: 0.9184, test_f1: 0.5291
 epoch: 28, train_loss: 0.8838, test_loss: 0.9239, test_f1: 0.5220
 epoch: 29, train_loss: 0.8768, test_loss: 0.9055, test_f1: 0.5343
 epoch: 30, train_loss: 0.8552, test_loss: 0.9537, test_f1: 0.5092
 epoch: 31, train_loss: 0.8643, test_loss: 0.9229, test_f1: 0.5327
 epoch: 32, train_loss: 0.8641, test_loss: 0.9332, test_f1: 0.5191
 epoch: 33, train_loss: 0.8585, test_loss: 0.9535, test_f1: 0.5303
 epoch: 34, train_loss: 0.8561, test_loss: 0.9732, test_f1: 0.5056
 epoch: 35, train_loss: 0.8690, test_loss: 0.9095, test_f1: 0.5351
 epoch: 36, train_loss: 0.8556, test_loss: 0.9134, test_f1: 0.5307
 epoch: 37, train_loss: 0.8518, test_loss: 0.8990, test_f1: 0.5358
 epoch: 38, train_loss: 0.8389, test_loss: 0.9515, test_f1: 0.5158
 epoch: 39, train_loss: 0.8528, test_loss: 0.9121, test_f1: 0.5276
 epoch: 40, train_loss: 0.8446, test_loss: 0.9238, test_f1: 0.5190
 epoch: 41, train_loss: 0.8417, test_loss: 0.9117, test_f1: 0.5358
 epoch: 42, train_loss: 0.8448, test_loss: 0.9536, test_f1: 0.5200
 epoch: 43, train_loss: 0.8341, test_loss: 0.9294, test_f1: 0.5191
 epoch: 44, train_loss: 0.8356, test_loss: 0.9292, test_f1: 0.5225
 epoch: 45, train_loss: 0.8409, test_loss: 0.9449, test_f1: 0.4976
 epoch: 46, train_loss: 0.8281, test_loss: 0.9648, test_f1: 0.5183
 epoch: 47, train_loss: 0.8304, test_loss: 0.9210, test_f1: 0.5371
 epoch: 48, train_loss: 0.8313, test_loss: 0.9334, test_f1: 0.5327
 epoch: 49, train_loss: 0.8217, test_loss: 0.9208, test_f1: 0.5268
 epoch: 50, train_loss: 0.8400, test_loss: 0.9067, test_f1: 0.5560
 epoch: 51, train_loss: 0.8056, test_loss: 0.9174, test_f1: 0.5442
 epoch: 52, train_loss: 0.8066, test_loss: 0.9001, test_f1: 0.5418
 epoch: 53, train_loss: 0.8055, test_loss: 0.9074, test_f1: 0.5479
 epoch: 54, train_loss: 0.8014, test_loss: 0.9198, test_f1: 0.5441
 epoch: 55, train_loss: 0.7927, test_loss: 0.8995, test_f1: 0.5595
 epoch: 56, train_loss: 0.8208, test_loss: 0.9163, test_f1: 0.5239
 epoch: 57, train_loss: 0.7975, test_loss: 0.8863, test_f1: 0.5384
 epoch: 58, train_loss: 0.8035, test_loss: 0.9098, test_f1: 0.5381
 epoch: 59, train_loss: 0.7955, test_loss: 0.8998, test_f1: 0.5472
 epoch: 60, train_loss: 0.8019, test_loss: 0.8944, test_f1: 0.5307
 epoch: 61, train_loss: 0.7991, test_loss: 0.8775, test_f1: 0.5627
 epoch: 62, train_loss: 0.8038, test_loss: 0.8866, test_f1: 0.5461
 epoch: 63, train_loss: 0.8022, test_loss: 0.9014, test_f1: 0.5494
 epoch: 64, train_loss: 0.7917, test_loss: 0.8812, test_f1: 0.5309
 epoch: 65, train_loss: 0.7890, test_loss: 0.8923, test_f1: 0.5436
 epoch: 66, train_loss: 0.8003, test_loss: 0.8825, test_f1: 0.5441
 epoch: 67, train_loss: 0.7856, test_loss: 0.8878, test_f1: 0.5520
 epoch: 68, train_loss: 0.7846, test_loss: 0.8956, test_f1: 0.5506
 epoch: 69, train_loss: 0.7821, test_loss: 0.9131, test_f1: 0.5327
 epoch: 70, train_loss: 0.7862, test_loss: 0.9083, test_f1: 0.5291
 epoch: 71, train_loss: 0.7923, test_loss: 0.9033, test_f1: 0.5384
 epoch: 72, train_loss: 0.7657, test_loss: 0.9083, test_f1: 0.5268
 epoch: 73, train_loss: 0.7874, test_loss: 0.8760, test_f1: 0.5653
 epoch: 74, train_loss: 0.7820, test_loss: 0.8737, test_f1: 0.5611
 epoch: 75, train_loss: 0.7876, test_loss: 0.8911, test_f1: 0.5589
 epoch: 76, train_loss: 0.7771, test_loss: 0.8873, test_f1: 0.5585
 epoch: 77, train_loss: 0.7718, test_loss: 0.8731, test_f1: 0.5586
 epoch: 78, train_loss: 0.7799, test_loss: 0.8857, test_f1: 0.5273
 epoch: 79, train_loss: 0.7821, test_loss: 0.8754, test_f1: 0.5513
 epoch: 80, train_loss: 0.7832, test_loss: 0.8827, test_f1: 0.5600
 epoch: 81, train_loss: 0.7687, test_loss: 0.8978, test_f1: 0.5397
 epoch: 82, train_loss: 0.7752, test_loss: 0.8978, test_f1: 0.5485
 epoch: 83, train_loss: 0.7702, test_loss: 0.8863, test_f1: 0.5503
 epoch: 84, train_loss: 0.7834, test_loss: 0.8830, test_f1: 0.5628
 epoch: 85, train_loss: 0.7742, test_loss: 0.9151, test_f1: 0.5303
 epoch: 86, train_loss: 0.7685, test_loss: 0.8980, test_f1: 0.5411
 epoch: 87, train_loss: 0.7669, test_loss: 0.9052, test_f1: 0.5444
 epoch: 88, train_loss: 0.7768, test_loss: 0.9075, test_f1: 0.5521
 epoch: 89, train_loss: 0.7744, test_loss: 0.9290, test_f1: 0.5485
 epoch: 90, train_loss: 0.7743, test_loss: 0.8868, test_f1: 0.5424
 epoch: 91, train_loss: 0.7607, test_loss: 0.8821, test_f1: 0.5563
 epoch: 92, train_loss: 0.7708, test_loss: 0.9056, test_f1: 0.5567
 epoch: 93, train_loss: 0.7641, test_loss: 0.8978, test_f1: 0.5422
 epoch: 94, train_loss: 0.7638, test_loss: 0.8841, test_f1: 0.5419
 epoch: 95, train_loss: 0.7598, test_loss: 0.9272, test_f1: 0.5383
 epoch: 96, train_loss: 0.7648, test_loss: 0.8952, test_f1: 0.5542
 epoch: 97, train_loss: 0.7636, test_loss: 0.8842, test_f1: 0.5410
 epoch: 98, train_loss: 0.7714, test_loss: 0.9011, test_f1: 0.5686
 epoch: 99, train_loss: 0.7500, test_loss: 0.8985, test_f1: 0.5580
##################ITERATION #4 ****************************************
 epoch: 0, train_loss: 1.2378, test_loss: 1.0990, test_f1: 0.3533
 epoch: 1, train_loss: 1.1081, test_loss: 1.0575, test_f1: 0.3967
 epoch: 2, train_loss: 1.0727, test_loss: 1.0137, test_f1: 0.4561
 epoch: 3, train_loss: 1.0442, test_loss: 1.0239, test_f1: 0.4287
 epoch: 4, train_loss: 1.0373, test_loss: 1.0283, test_f1: 0.4574
 epoch: 5, train_loss: 1.0248, test_loss: 1.0057, test_f1: 0.4927
 epoch: 6, train_loss: 1.0058, test_loss: 0.9936, test_f1: 0.5055
 epoch: 7, train_loss: 0.9970, test_loss: 1.0040, test_f1: 0.5044
 epoch: 8, train_loss: 0.9837, test_loss: 0.9813, test_f1: 0.5076
 epoch: 9, train_loss: 0.9773, test_loss: 0.9513, test_f1: 0.5267
 epoch: 10, train_loss: 0.9689, test_loss: 0.9864, test_f1: 0.4801
 epoch: 11, train_loss: 0.9697, test_loss: 0.9673, test_f1: 0.5226
 epoch: 12, train_loss: 0.9578, test_loss: 0.9692, test_f1: 0.5171
 epoch: 13, train_loss: 0.9508, test_loss: 0.9413, test_f1: 0.4985
 epoch: 14, train_loss: 0.9458, test_loss: 0.9647, test_f1: 0.5041
 epoch: 15, train_loss: 0.9395, test_loss: 1.0119, test_f1: 0.4823
 epoch: 16, train_loss: 0.9435, test_loss: 0.9258, test_f1: 0.5191
 epoch: 17, train_loss: 0.9290, test_loss: 0.9498, test_f1: 0.5188
 epoch: 18, train_loss: 0.9357, test_loss: 0.9419, test_f1: 0.5124
 epoch: 19, train_loss: 0.9170, test_loss: 0.9613, test_f1: 0.5056
 epoch: 20, train_loss: 0.9120, test_loss: 0.9489, test_f1: 0.5242
 epoch: 21, train_loss: 0.9190, test_loss: 0.9265, test_f1: 0.5207
 epoch: 22, train_loss: 0.9214, test_loss: 0.9162, test_f1: 0.5278
 epoch: 23, train_loss: 0.9012, test_loss: 0.9183, test_f1: 0.5303
 epoch: 24, train_loss: 0.8910, test_loss: 0.9287, test_f1: 0.5251
 epoch: 25, train_loss: 0.8966, test_loss: 0.9093, test_f1: 0.5336
 epoch: 26, train_loss: 0.8986, test_loss: 0.9180, test_f1: 0.5251
 epoch: 27, train_loss: 0.8916, test_loss: 0.9253, test_f1: 0.5229
 epoch: 28, train_loss: 0.8876, test_loss: 0.9312, test_f1: 0.5099
 epoch: 29, train_loss: 0.8771, test_loss: 0.9447, test_f1: 0.5139
 epoch: 30, train_loss: 0.8689, test_loss: 0.9031, test_f1: 0.5216
 epoch: 31, train_loss: 0.8753, test_loss: 0.9102, test_f1: 0.5237
 epoch: 32, train_loss: 0.8598, test_loss: 0.9593, test_f1: 0.5012
 epoch: 33, train_loss: 0.8652, test_loss: 0.9160, test_f1: 0.5248
 epoch: 34, train_loss: 0.8529, test_loss: 0.9275, test_f1: 0.5176
 epoch: 35, train_loss: 0.8597, test_loss: 0.8912, test_f1: 0.5287
 epoch: 36, train_loss: 0.8491, test_loss: 0.9326, test_f1: 0.5112
 epoch: 37, train_loss: 0.8461, test_loss: 0.8893, test_f1: 0.5257
 epoch: 38, train_loss: 0.8462, test_loss: 0.9209, test_f1: 0.5322
 epoch: 39, train_loss: 0.8466, test_loss: 0.9330, test_f1: 0.4988
 epoch: 40, train_loss: 0.8317, test_loss: 0.9321, test_f1: 0.5184
 epoch: 41, train_loss: 0.8516, test_loss: 0.9105, test_f1: 0.5040
 epoch: 42, train_loss: 0.8205, test_loss: 0.9180, test_f1: 0.5199
 epoch: 43, train_loss: 0.8484, test_loss: 0.9168, test_f1: 0.5207
 epoch: 44, train_loss: 0.8405, test_loss: 0.9013, test_f1: 0.5152
 epoch: 45, train_loss: 0.8349, test_loss: 0.8971, test_f1: 0.5252
 epoch: 46, train_loss: 0.8201, test_loss: 0.8970, test_f1: 0.5240
 epoch: 47, train_loss: 0.8229, test_loss: 0.9329, test_f1: 0.4997
 epoch: 48, train_loss: 0.8271, test_loss: 0.8901, test_f1: 0.5219
 epoch: 49, train_loss: 0.8163, test_loss: 0.8963, test_f1: 0.5242
 epoch: 50, train_loss: 0.8263, test_loss: 0.9139, test_f1: 0.5186
 epoch: 51, train_loss: 0.8066, test_loss: 0.9153, test_f1: 0.5235
 epoch: 52, train_loss: 0.8117, test_loss: 0.8963, test_f1: 0.5093
 epoch: 53, train_loss: 0.8027, test_loss: 0.9321, test_f1: 0.5297
 epoch: 54, train_loss: 0.8017, test_loss: 0.8978, test_f1: 0.5233
 epoch: 55, train_loss: 0.7971, test_loss: 0.9010, test_f1: 0.5286
 epoch: 56, train_loss: 0.8002, test_loss: 0.8948, test_f1: 0.5344
 epoch: 57, train_loss: 0.7942, test_loss: 0.9163, test_f1: 0.5328
 epoch: 58, train_loss: 0.8021, test_loss: 0.8983, test_f1: 0.5354
 epoch: 59, train_loss: 0.8020, test_loss: 0.8932, test_f1: 0.5298
 epoch: 60, train_loss: 0.7889, test_loss: 0.9151, test_f1: 0.5258
 epoch: 61, train_loss: 0.7890, test_loss: 0.8917, test_f1: 0.5172
 epoch: 62, train_loss: 0.7897, test_loss: 0.9075, test_f1: 0.5156
 epoch: 63, train_loss: 0.7851, test_loss: 0.9412, test_f1: 0.5201
 epoch: 64, train_loss: 0.7915, test_loss: 0.9239, test_f1: 0.5198
 epoch: 65, train_loss: 0.7789, test_loss: 0.9177, test_f1: 0.5255
 epoch: 66, train_loss: 0.7882, test_loss: 0.8952, test_f1: 0.5322
 epoch: 67, train_loss: 0.7905, test_loss: 0.9109, test_f1: 0.5135
 epoch: 68, train_loss: 0.7886, test_loss: 0.9059, test_f1: 0.5287
 epoch: 69, train_loss: 0.7824, test_loss: 0.9004, test_f1: 0.5135
 epoch: 70, train_loss: 0.7795, test_loss: 0.8947, test_f1: 0.5405
 epoch: 71, train_loss: 0.7755, test_loss: 0.9026, test_f1: 0.5274
 epoch: 72, train_loss: 0.7877, test_loss: 0.9154, test_f1: 0.5233
 epoch: 73, train_loss: 0.7778, test_loss: 0.8760, test_f1: 0.5322
 epoch: 74, train_loss: 0.7819, test_loss: 0.8905, test_f1: 0.5238
 epoch: 75, train_loss: 0.7645, test_loss: 0.9030, test_f1: 0.5153
 epoch: 76, train_loss: 0.7702, test_loss: 0.9033, test_f1: 0.5322
 epoch: 77, train_loss: 0.7792, test_loss: 0.9111, test_f1: 0.5219
 epoch: 78, train_loss: 0.7707, test_loss: 0.8971, test_f1: 0.5068
 epoch: 79, train_loss: 0.7711, test_loss: 0.9102, test_f1: 0.5230
 epoch: 80, train_loss: 0.7805, test_loss: 0.8900, test_f1: 0.5138
 epoch: 81, train_loss: 0.7740, test_loss: 0.9191, test_f1: 0.5146
 epoch: 82, train_loss: 0.7689, test_loss: 0.9290, test_f1: 0.5177
 epoch: 83, train_loss: 0.7743, test_loss: 0.8805, test_f1: 0.5226
 epoch: 84, train_loss: 0.7723, test_loss: 0.9194, test_f1: 0.5049
 epoch: 85, train_loss: 0.7679, test_loss: 0.9127, test_f1: 0.5152
 epoch: 86, train_loss: 0.7755, test_loss: 0.9196, test_f1: 0.5161
 epoch: 87, train_loss: 0.7587, test_loss: 0.9105, test_f1: 0.5141
 epoch: 88, train_loss: 0.7760, test_loss: 0.8937, test_f1: 0.5261
 epoch: 89, train_loss: 0.7719, test_loss: 0.9233, test_f1: 0.5190
 epoch: 90, train_loss: 0.7667, test_loss: 0.9283, test_f1: 0.5033
 epoch: 91, train_loss: 0.7663, test_loss: 0.8959, test_f1: 0.5278
 epoch: 92, train_loss: 0.7576, test_loss: 0.9215, test_f1: 0.5364
 epoch: 93, train_loss: 0.7556, test_loss: 0.8996, test_f1: 0.5154
 epoch: 94, train_loss: 0.7533, test_loss: 0.9244, test_f1: 0.5173
 epoch: 95, train_loss: 0.7601, test_loss: 0.9201, test_f1: 0.5438
 epoch: 96, train_loss: 0.7579, test_loss: 0.9066, test_f1: 0.5091
 epoch: 97, train_loss: 0.7570, test_loss: 0.9342, test_f1: 0.5090
 epoch: 98, train_loss: 0.7522, test_loss: 0.9164, test_f1: 0.5087
 epoch: 99, train_loss: 0.7497, test_loss: 0.9127, test_f1: 0.5220
##################ITERATION #5 ****************************************
 epoch: 0, train_loss: 1.2422, test_loss: 1.1380, test_f1: 0.3280
 epoch: 1, train_loss: 1.1078, test_loss: 1.1286, test_f1: 0.3167
 epoch: 2, train_loss: 1.0721, test_loss: 1.0527, test_f1: 0.3522
 epoch: 3, train_loss: 1.0543, test_loss: 1.0541, test_f1: 0.3483
 epoch: 4, train_loss: 1.0314, test_loss: 1.0554, test_f1: 0.4046
 epoch: 5, train_loss: 1.0236, test_loss: 1.0314, test_f1: 0.4603
 epoch: 6, train_loss: 1.0136, test_loss: 1.0747, test_f1: 0.3830
 epoch: 7, train_loss: 1.0007, test_loss: 1.0155, test_f1: 0.4568
 epoch: 8, train_loss: 0.9829, test_loss: 1.0298, test_f1: 0.4311
 epoch: 9, train_loss: 0.9825, test_loss: 1.0085, test_f1: 0.4701
 epoch: 10, train_loss: 0.9552, test_loss: 1.0169, test_f1: 0.4494
 epoch: 11, train_loss: 0.9522, test_loss: 0.9539, test_f1: 0.4909
 epoch: 12, train_loss: 0.9394, test_loss: 0.9824, test_f1: 0.5002
 epoch: 13, train_loss: 0.9359, test_loss: 0.9657, test_f1: 0.5026
 epoch: 14, train_loss: 0.9180, test_loss: 0.9779, test_f1: 0.5129
 epoch: 15, train_loss: 0.9195, test_loss: 0.9582, test_f1: 0.5186
 epoch: 16, train_loss: 0.9148, test_loss: 0.9587, test_f1: 0.5002
 epoch: 17, train_loss: 0.9115, test_loss: 0.9556, test_f1: 0.5119
 epoch: 18, train_loss: 0.8995, test_loss: 0.9676, test_f1: 0.5047
 epoch: 19, train_loss: 0.8927, test_loss: 1.0331, test_f1: 0.4989
 epoch: 20, train_loss: 0.8898, test_loss: 0.9434, test_f1: 0.5176
 epoch: 21, train_loss: 0.8903, test_loss: 0.9976, test_f1: 0.5024
 epoch: 22, train_loss: 0.8866, test_loss: 0.9471, test_f1: 0.5272
 epoch: 23, train_loss: 0.8748, test_loss: 0.9977, test_f1: 0.4979
 epoch: 24, train_loss: 0.8727, test_loss: 0.9812, test_f1: 0.5004
 epoch: 25, train_loss: 0.8682, test_loss: 0.9407, test_f1: 0.5333
 epoch: 26, train_loss: 0.8597, test_loss: 1.0011, test_f1: 0.5095
 epoch: 27, train_loss: 0.8649, test_loss: 0.9360, test_f1: 0.5175
 epoch: 28, train_loss: 0.8782, test_loss: 1.0220, test_f1: 0.4992
 epoch: 29, train_loss: 0.8554, test_loss: 0.9387, test_f1: 0.5216
 epoch: 30, train_loss: 0.8463, test_loss: 0.9870, test_f1: 0.5135
 epoch: 31, train_loss: 0.8366, test_loss: 1.1200, test_f1: 0.4722
 epoch: 32, train_loss: 0.8464, test_loss: 1.0179, test_f1: 0.4834
 epoch: 33, train_loss: 0.8349, test_loss: 0.9516, test_f1: 0.5311
 epoch: 34, train_loss: 0.8322, test_loss: 0.9831, test_f1: 0.5311
 epoch: 35, train_loss: 0.8341, test_loss: 0.9882, test_f1: 0.4985
 epoch: 36, train_loss: 0.8432, test_loss: 0.9665, test_f1: 0.5262
 epoch: 37, train_loss: 0.8311, test_loss: 0.9514, test_f1: 0.5335
 epoch: 38, train_loss: 0.8271, test_loss: 0.9454, test_f1: 0.5295
 epoch: 39, train_loss: 0.8199, test_loss: 0.9251, test_f1: 0.5380
 epoch: 40, train_loss: 0.8101, test_loss: 0.9467, test_f1: 0.5472
 epoch: 41, train_loss: 0.8243, test_loss: 0.9661, test_f1: 0.5310
 epoch: 42, train_loss: 0.8246, test_loss: 1.0224, test_f1: 0.5216
 epoch: 43, train_loss: 0.8091, test_loss: 0.9230, test_f1: 0.5548
 epoch: 44, train_loss: 0.8153, test_loss: 0.9911, test_f1: 0.5222
 epoch: 45, train_loss: 0.8095, test_loss: 0.9823, test_f1: 0.5408
 epoch: 46, train_loss: 0.8065, test_loss: 0.9456, test_f1: 0.5285
 epoch: 47, train_loss: 0.7952, test_loss: 0.9628, test_f1: 0.5253
 epoch: 48, train_loss: 0.8146, test_loss: 0.9869, test_f1: 0.5403
 epoch: 49, train_loss: 0.8098, test_loss: 0.9775, test_f1: 0.5397
 epoch: 50, train_loss: 0.8098, test_loss: 0.9789, test_f1: 0.5473
 epoch: 51, train_loss: 0.7812, test_loss: 0.9571, test_f1: 0.5454
 epoch: 52, train_loss: 0.7832, test_loss: 0.9663, test_f1: 0.5415
 epoch: 53, train_loss: 0.7880, test_loss: 0.9888, test_f1: 0.5550
 epoch: 54, train_loss: 0.7799, test_loss: 0.9548, test_f1: 0.5576
 epoch: 55, train_loss: 0.7812, test_loss: 0.9807, test_f1: 0.5460
 epoch: 56, train_loss: 0.7921, test_loss: 0.9807, test_f1: 0.5610
 epoch: 57, train_loss: 0.7894, test_loss: 0.9551, test_f1: 0.5381
 epoch: 58, train_loss: 0.7736, test_loss: 0.9730, test_f1: 0.5430
 epoch: 59, train_loss: 0.7587, test_loss: 0.9342, test_f1: 0.5635
 epoch: 60, train_loss: 0.7706, test_loss: 0.9396, test_f1: 0.5545
 epoch: 61, train_loss: 0.7721, test_loss: 0.9464, test_f1: 0.5579
 epoch: 62, train_loss: 0.7796, test_loss: 0.9672, test_f1: 0.5425
 epoch: 63, train_loss: 0.7690, test_loss: 0.9619, test_f1: 0.5500
 epoch: 64, train_loss: 0.7658, test_loss: 0.9709, test_f1: 0.5412
 epoch: 65, train_loss: 0.7668, test_loss: 0.9738, test_f1: 0.5486
 epoch: 66, train_loss: 0.7706, test_loss: 0.9651, test_f1: 0.5441
 epoch: 67, train_loss: 0.7691, test_loss: 0.9654, test_f1: 0.5573
 epoch: 68, train_loss: 0.7667, test_loss: 0.9539, test_f1: 0.5483
 epoch: 69, train_loss: 0.7739, test_loss: 0.9488, test_f1: 0.5561
 epoch: 70, train_loss: 0.7702, test_loss: 0.9918, test_f1: 0.5471
 epoch: 71, train_loss: 0.7608, test_loss: 0.9705, test_f1: 0.5628
 epoch: 72, train_loss: 0.7675, test_loss: 0.9572, test_f1: 0.5474
 epoch: 73, train_loss: 0.7466, test_loss: 0.9703, test_f1: 0.5484
 epoch: 74, train_loss: 0.7670, test_loss: 0.9826, test_f1: 0.5500
 epoch: 75, train_loss: 0.7588, test_loss: 0.9547, test_f1: 0.5449
 epoch: 76, train_loss: 0.7527, test_loss: 0.9668, test_f1: 0.5331
 epoch: 77, train_loss: 0.7568, test_loss: 0.9745, test_f1: 0.5453
 epoch: 78, train_loss: 0.7549, test_loss: 0.9487, test_f1: 0.5548
 epoch: 79, train_loss: 0.7570, test_loss: 0.9666, test_f1: 0.5389
 epoch: 80, train_loss: 0.7495, test_loss: 0.9889, test_f1: 0.5558
 epoch: 81, train_loss: 0.7570, test_loss: 0.9960, test_f1: 0.5559
 epoch: 82, train_loss: 0.7481, test_loss: 0.9906, test_f1: 0.5390
 epoch: 83, train_loss: 0.7453, test_loss: 0.9484, test_f1: 0.5578
 epoch: 84, train_loss: 0.7591, test_loss: 0.9614, test_f1: 0.5645
 epoch: 85, train_loss: 0.7369, test_loss: 0.9783, test_f1: 0.5540
 epoch: 86, train_loss: 0.7429, test_loss: 0.9571, test_f1: 0.5521
 epoch: 87, train_loss: 0.7499, test_loss: 0.9707, test_f1: 0.5279
 epoch: 88, train_loss: 0.7525, test_loss: 1.0066, test_f1: 0.5362
 epoch: 89, train_loss: 0.7434, test_loss: 0.9978, test_f1: 0.5193
 epoch: 90, train_loss: 0.7391, test_loss: 0.9595, test_f1: 0.5529
 epoch: 91, train_loss: 0.7373, test_loss: 0.9983, test_f1: 0.5494
 epoch: 92, train_loss: 0.7416, test_loss: 0.9710, test_f1: 0.5474
 epoch: 93, train_loss: 0.7345, test_loss: 1.0121, test_f1: 0.5435
 epoch: 94, train_loss: 0.7387, test_loss: 0.9582, test_f1: 0.5485
 epoch: 95, train_loss: 0.7274, test_loss: 1.0008, test_f1: 0.5440
 epoch: 96, train_loss: 0.7428, test_loss: 0.9860, test_f1: 0.5343
 epoch: 97, train_loss: 0.7319, test_loss: 1.0353, test_f1: 0.5404
 epoch: 98, train_loss: 0.7300, test_loss: 0.9976, test_f1: 0.5605
 epoch: 99, train_loss: 0.7224, test_loss: 1.0318, test_f1: 0.5391
##################ITERATION #6 ****************************************
 epoch: 0, train_loss: 1.2649, test_loss: 1.2424, test_f1: 0.2573
 epoch: 1, train_loss: 1.0811, test_loss: 1.0439, test_f1: 0.4543
 epoch: 2, train_loss: 1.0487, test_loss: 1.0192, test_f1: 0.4721
 epoch: 3, train_loss: 1.0270, test_loss: 1.0035, test_f1: 0.4493
 epoch: 4, train_loss: 0.9913, test_loss: 1.0159, test_f1: 0.4712
 epoch: 5, train_loss: 0.9816, test_loss: 0.9819, test_f1: 0.4740
 epoch: 6, train_loss: 0.9753, test_loss: 0.9722, test_f1: 0.5031
 epoch: 7, train_loss: 0.9539, test_loss: 1.0447, test_f1: 0.4561
 epoch: 8, train_loss: 0.9405, test_loss: 0.9599, test_f1: 0.4818
 epoch: 9, train_loss: 0.9362, test_loss: 1.0317, test_f1: 0.4604
 epoch: 10, train_loss: 0.9147, test_loss: 1.0464, test_f1: 0.4455
 epoch: 11, train_loss: 0.9276, test_loss: 0.9483, test_f1: 0.5033
 epoch: 12, train_loss: 0.9064, test_loss: 0.9694, test_f1: 0.4982
 epoch: 13, train_loss: 0.9089, test_loss: 0.9654, test_f1: 0.5105
 epoch: 14, train_loss: 0.8938, test_loss: 1.0457, test_f1: 0.4740
 epoch: 15, train_loss: 0.8942, test_loss: 0.9398, test_f1: 0.5010
 epoch: 16, train_loss: 0.8727, test_loss: 0.9566, test_f1: 0.5051
 epoch: 17, train_loss: 0.8884, test_loss: 1.0273, test_f1: 0.4866
 epoch: 18, train_loss: 0.8759, test_loss: 0.9579, test_f1: 0.5133
 epoch: 19, train_loss: 0.8873, test_loss: 1.0367, test_f1: 0.5034
 epoch: 20, train_loss: 0.8734, test_loss: 0.9256, test_f1: 0.5166
 epoch: 21, train_loss: 0.8547, test_loss: 1.1556, test_f1: 0.4363
 epoch: 22, train_loss: 0.8493, test_loss: 0.9533, test_f1: 0.5197
 epoch: 23, train_loss: 0.8454, test_loss: 0.9309, test_f1: 0.5281
 epoch: 24, train_loss: 0.8390, test_loss: 0.9372, test_f1: 0.5249
 epoch: 25, train_loss: 0.8418, test_loss: 0.9576, test_f1: 0.5126
 epoch: 26, train_loss: 0.8440, test_loss: 0.9468, test_f1: 0.5074
 epoch: 27, train_loss: 0.8424, test_loss: 0.9337, test_f1: 0.5281
 epoch: 28, train_loss: 0.8299, test_loss: 0.9890, test_f1: 0.5112
 epoch: 29, train_loss: 0.8285, test_loss: 0.9685, test_f1: 0.5083
 epoch: 30, train_loss: 0.8260, test_loss: 1.1030, test_f1: 0.4938
 epoch: 31, train_loss: 0.8137, test_loss: 0.9957, test_f1: 0.5185
 epoch: 32, train_loss: 0.8134, test_loss: 1.1145, test_f1: 0.4764
 epoch: 33, train_loss: 0.8063, test_loss: 1.0193, test_f1: 0.4879
 epoch: 34, train_loss: 0.8124, test_loss: 0.9554, test_f1: 0.5380
 epoch: 35, train_loss: 0.8069, test_loss: 0.9959, test_f1: 0.5394
 epoch: 36, train_loss: 0.8031, test_loss: 1.0616, test_f1: 0.5015
 epoch: 37, train_loss: 0.8071, test_loss: 0.9524, test_f1: 0.5194
 epoch: 38, train_loss: 0.8104, test_loss: 0.9811, test_f1: 0.5420
 epoch: 39, train_loss: 0.7969, test_loss: 0.9674, test_f1: 0.5385
 epoch: 40, train_loss: 0.7960, test_loss: 0.9712, test_f1: 0.5345
 epoch: 41, train_loss: 0.7916, test_loss: 0.9856, test_f1: 0.5281
 epoch: 42, train_loss: 0.7892, test_loss: 0.9810, test_f1: 0.5220
 epoch: 43, train_loss: 0.7910, test_loss: 1.0827, test_f1: 0.4956
 epoch: 44, train_loss: 0.7915, test_loss: 0.9689, test_f1: 0.5217
 epoch: 45, train_loss: 0.7682, test_loss: 1.0187, test_f1: 0.5320
 epoch: 46, train_loss: 0.7741, test_loss: 1.0064, test_f1: 0.5199
 epoch: 47, train_loss: 0.7731, test_loss: 1.0415, test_f1: 0.5223
 epoch: 48, train_loss: 0.7837, test_loss: 0.9907, test_f1: 0.5395
 epoch: 49, train_loss: 0.7786, test_loss: 0.9787, test_f1: 0.5534
 epoch: 50, train_loss: 0.7727, test_loss: 0.9835, test_f1: 0.5519
 epoch: 51, train_loss: 0.7595, test_loss: 0.9533, test_f1: 0.5483
 epoch: 52, train_loss: 0.7556, test_loss: 0.9560, test_f1: 0.5436
 epoch: 53, train_loss: 0.7637, test_loss: 1.0191, test_f1: 0.5230
 epoch: 54, train_loss: 0.7489, test_loss: 1.0016, test_f1: 0.5429
 epoch: 55, train_loss: 0.7495, test_loss: 1.0003, test_f1: 0.5448
 epoch: 56, train_loss: 0.7427, test_loss: 0.9660, test_f1: 0.5584
 epoch: 57, train_loss: 0.7403, test_loss: 1.0022, test_f1: 0.5514
 epoch: 58, train_loss: 0.7464, test_loss: 1.0119, test_f1: 0.5419
 epoch: 59, train_loss: 0.7314, test_loss: 1.0237, test_f1: 0.5391
 epoch: 60, train_loss: 0.7476, test_loss: 0.9656, test_f1: 0.5612
 epoch: 61, train_loss: 0.7414, test_loss: 1.0328, test_f1: 0.5377
 epoch: 62, train_loss: 0.7397, test_loss: 1.0291, test_f1: 0.5506
 epoch: 63, train_loss: 0.7385, test_loss: 1.0049, test_f1: 0.5535
 epoch: 64, train_loss: 0.7316, test_loss: 0.9964, test_f1: 0.5623
 epoch: 65, train_loss: 0.7457, test_loss: 1.0080, test_f1: 0.5377
 epoch: 66, train_loss: 0.7434, test_loss: 0.9705, test_f1: 0.5410
 epoch: 67, train_loss: 0.7456, test_loss: 1.0222, test_f1: 0.5469
 epoch: 68, train_loss: 0.7259, test_loss: 0.9857, test_f1: 0.5529
 epoch: 69, train_loss: 0.7289, test_loss: 0.9853, test_f1: 0.5558
 epoch: 70, train_loss: 0.7367, test_loss: 1.0486, test_f1: 0.5411
 epoch: 71, train_loss: 0.7469, test_loss: 0.9994, test_f1: 0.5587
 epoch: 72, train_loss: 0.7268, test_loss: 0.9865, test_f1: 0.5392
 epoch: 73, train_loss: 0.7366, test_loss: 1.0060, test_f1: 0.5267
 epoch: 74, train_loss: 0.7375, test_loss: 0.9980, test_f1: 0.5518
 epoch: 75, train_loss: 0.7362, test_loss: 0.9921, test_f1: 0.5332
 epoch: 76, train_loss: 0.7257, test_loss: 1.0106, test_f1: 0.5508
 epoch: 77, train_loss: 0.7335, test_loss: 0.9676, test_f1: 0.5680
 epoch: 78, train_loss: 0.7201, test_loss: 0.9925, test_f1: 0.5542
 epoch: 79, train_loss: 0.7322, test_loss: 0.9809, test_f1: 0.5592
 epoch: 80, train_loss: 0.7223, test_loss: 0.9902, test_f1: 0.5541
 epoch: 81, train_loss: 0.7156, test_loss: 0.9762, test_f1: 0.5803
 epoch: 82, train_loss: 0.7192, test_loss: 0.9843, test_f1: 0.5549
 epoch: 83, train_loss: 0.7201, test_loss: 0.9883, test_f1: 0.5532
 epoch: 84, train_loss: 0.7102, test_loss: 0.9966, test_f1: 0.5512
 epoch: 85, train_loss: 0.7308, test_loss: 1.0257, test_f1: 0.5555
 epoch: 86, train_loss: 0.7202, test_loss: 0.9814, test_f1: 0.5695
 epoch: 87, train_loss: 0.7104, test_loss: 0.9966, test_f1: 0.5537
 epoch: 88, train_loss: 0.7266, test_loss: 1.0519, test_f1: 0.5493
 epoch: 89, train_loss: 0.7184, test_loss: 1.0006, test_f1: 0.5418
 epoch: 90, train_loss: 0.7346, test_loss: 1.0116, test_f1: 0.5534
 epoch: 91, train_loss: 0.7190, test_loss: 0.9986, test_f1: 0.5745
 epoch: 92, train_loss: 0.7285, test_loss: 0.9875, test_f1: 0.5586
 epoch: 93, train_loss: 0.7073, test_loss: 1.0125, test_f1: 0.5609
 epoch: 94, train_loss: 0.7141, test_loss: 1.0048, test_f1: 0.5614
 epoch: 95, train_loss: 0.7205, test_loss: 1.0071, test_f1: 0.5468
 epoch: 96, train_loss: 0.7063, test_loss: 0.9829, test_f1: 0.5799
 epoch: 97, train_loss: 0.7294, test_loss: 1.0213, test_f1: 0.5472
 epoch: 98, train_loss: 0.7213, test_loss: 0.9848, test_f1: 0.5569
 epoch: 99, train_loss: 0.7091, test_loss: 0.9890, test_f1: 0.5605
##################ITERATION #7 ****************************************
 epoch: 0, train_loss: 1.2796, test_loss: 1.2961, test_f1: 0.2609
 epoch: 1, train_loss: 1.1248, test_loss: 1.0401, test_f1: 0.4130
 epoch: 2, train_loss: 1.0908, test_loss: 1.0337, test_f1: 0.4001
 epoch: 3, train_loss: 1.0676, test_loss: 1.0289, test_f1: 0.4104
 epoch: 4, train_loss: 1.0527, test_loss: 1.0220, test_f1: 0.4032
 epoch: 5, train_loss: 1.0458, test_loss: 1.0091, test_f1: 0.4048
 epoch: 6, train_loss: 1.0288, test_loss: 1.0000, test_f1: 0.4441
 epoch: 7, train_loss: 1.0100, test_loss: 0.9949, test_f1: 0.4281
 epoch: 8, train_loss: 1.0109, test_loss: 0.9849, test_f1: 0.4664
 epoch: 9, train_loss: 0.9938, test_loss: 0.9998, test_f1: 0.4498
 epoch: 10, train_loss: 0.9821, test_loss: 0.9945, test_f1: 0.4699
 epoch: 11, train_loss: 0.9781, test_loss: 0.9902, test_f1: 0.4628
 epoch: 12, train_loss: 0.9732, test_loss: 0.9969, test_f1: 0.4742
 epoch: 13, train_loss: 0.9568, test_loss: 0.9716, test_f1: 0.5051
 epoch: 14, train_loss: 0.9587, test_loss: 0.9576, test_f1: 0.5130
 epoch: 15, train_loss: 0.9514, test_loss: 0.9757, test_f1: 0.5118
 epoch: 16, train_loss: 0.9385, test_loss: 0.9992, test_f1: 0.5104
 epoch: 17, train_loss: 0.9532, test_loss: 0.9551, test_f1: 0.5209
 epoch: 18, train_loss: 0.9412, test_loss: 0.9527, test_f1: 0.5311
 epoch: 19, train_loss: 0.9272, test_loss: 0.9450, test_f1: 0.5474
 epoch: 20, train_loss: 0.9331, test_loss: 0.9838, test_f1: 0.5234
 epoch: 21, train_loss: 0.9194, test_loss: 0.9322, test_f1: 0.5583
 epoch: 22, train_loss: 0.9023, test_loss: 0.9213, test_f1: 0.5341
 epoch: 23, train_loss: 0.9145, test_loss: 0.9339, test_f1: 0.5403
 epoch: 24, train_loss: 0.9048, test_loss: 0.9332, test_f1: 0.5470
 epoch: 25, train_loss: 0.9045, test_loss: 0.9524, test_f1: 0.5338
 epoch: 26, train_loss: 0.8838, test_loss: 0.9219, test_f1: 0.5399
 epoch: 27, train_loss: 0.8827, test_loss: 0.9074, test_f1: 0.5452
 epoch: 28, train_loss: 0.8857, test_loss: 0.8975, test_f1: 0.5455
 epoch: 29, train_loss: 0.8804, test_loss: 0.9161, test_f1: 0.5526
 epoch: 30, train_loss: 0.8754, test_loss: 0.9292, test_f1: 0.5251
 epoch: 31, train_loss: 0.8865, test_loss: 0.9039, test_f1: 0.5401
 epoch: 32, train_loss: 0.8746, test_loss: 0.9034, test_f1: 0.5421
 epoch: 33, train_loss: 0.8613, test_loss: 0.8854, test_f1: 0.5642
 epoch: 34, train_loss: 0.8668, test_loss: 0.9160, test_f1: 0.5450
 epoch: 35, train_loss: 0.8541, test_loss: 0.9063, test_f1: 0.5299
 epoch: 36, train_loss: 0.8509, test_loss: 0.9015, test_f1: 0.5318
 epoch: 37, train_loss: 0.8500, test_loss: 0.8973, test_f1: 0.5504
 epoch: 38, train_loss: 0.8577, test_loss: 0.9217, test_f1: 0.5212
 epoch: 39, train_loss: 0.8500, test_loss: 0.8933, test_f1: 0.5279
 epoch: 40, train_loss: 0.8533, test_loss: 0.9109, test_f1: 0.5308
 epoch: 41, train_loss: 0.8398, test_loss: 0.9141, test_f1: 0.5568
 epoch: 42, train_loss: 0.8477, test_loss: 0.9048, test_f1: 0.5580
 epoch: 43, train_loss: 0.8309, test_loss: 0.8991, test_f1: 0.5516
 epoch: 44, train_loss: 0.8391, test_loss: 0.8956, test_f1: 0.5531
 epoch: 45, train_loss: 0.8346, test_loss: 0.8822, test_f1: 0.5574
 epoch: 46, train_loss: 0.8301, test_loss: 0.8610, test_f1: 0.5679
 epoch: 47, train_loss: 0.8261, test_loss: 0.8891, test_f1: 0.5279
 epoch: 48, train_loss: 0.8250, test_loss: 0.8572, test_f1: 0.5689
 epoch: 49, train_loss: 0.8224, test_loss: 0.8660, test_f1: 0.5642
 epoch: 50, train_loss: 0.8160, test_loss: 0.8883, test_f1: 0.5380
 epoch: 51, train_loss: 0.8013, test_loss: 0.8768, test_f1: 0.5411
 epoch: 52, train_loss: 0.8085, test_loss: 0.8718, test_f1: 0.5700
 epoch: 53, train_loss: 0.8102, test_loss: 0.8748, test_f1: 0.5424
 epoch: 54, train_loss: 0.7937, test_loss: 0.8788, test_f1: 0.5553
 epoch: 55, train_loss: 0.8098, test_loss: 0.8842, test_f1: 0.5644
 epoch: 56, train_loss: 0.7967, test_loss: 0.8897, test_f1: 0.5434
 epoch: 57, train_loss: 0.8064, test_loss: 0.8739, test_f1: 0.5555
 epoch: 58, train_loss: 0.7953, test_loss: 0.8855, test_f1: 0.5512
 epoch: 59, train_loss: 0.8029, test_loss: 0.8746, test_f1: 0.5615
 epoch: 60, train_loss: 0.7944, test_loss: 0.8733, test_f1: 0.5488
 epoch: 61, train_loss: 0.8055, test_loss: 0.8527, test_f1: 0.5655
 epoch: 62, train_loss: 0.7943, test_loss: 0.8647, test_f1: 0.5471
 epoch: 63, train_loss: 0.7995, test_loss: 0.8607, test_f1: 0.5598
 epoch: 64, train_loss: 0.8064, test_loss: 0.8721, test_f1: 0.5538
 epoch: 65, train_loss: 0.7974, test_loss: 0.8608, test_f1: 0.5582
 epoch: 66, train_loss: 0.7892, test_loss: 0.8848, test_f1: 0.5445
 epoch: 67, train_loss: 0.7932, test_loss: 0.8740, test_f1: 0.5569
 epoch: 68, train_loss: 0.7842, test_loss: 0.8817, test_f1: 0.5529
 epoch: 69, train_loss: 0.7969, test_loss: 0.8658, test_f1: 0.5528
 epoch: 70, train_loss: 0.7699, test_loss: 0.8676, test_f1: 0.5587
 epoch: 71, train_loss: 0.7990, test_loss: 0.8924, test_f1: 0.5472
 epoch: 72, train_loss: 0.7797, test_loss: 0.8663, test_f1: 0.5669
 epoch: 73, train_loss: 0.7870, test_loss: 0.8681, test_f1: 0.5538
 epoch: 74, train_loss: 0.7716, test_loss: 0.8695, test_f1: 0.5520
 epoch: 75, train_loss: 0.7944, test_loss: 0.8672, test_f1: 0.5540
 epoch: 76, train_loss: 0.7826, test_loss: 0.8646, test_f1: 0.5588
 epoch: 77, train_loss: 0.7817, test_loss: 0.8722, test_f1: 0.5617
 epoch: 78, train_loss: 0.7749, test_loss: 0.8731, test_f1: 0.5637
 epoch: 79, train_loss: 0.7867, test_loss: 0.8602, test_f1: 0.5670
 epoch: 80, train_loss: 0.7818, test_loss: 0.8669, test_f1: 0.5443
 epoch: 81, train_loss: 0.7779, test_loss: 0.8565, test_f1: 0.5521
 epoch: 82, train_loss: 0.7714, test_loss: 0.8634, test_f1: 0.5692
 epoch: 83, train_loss: 0.7695, test_loss: 0.8851, test_f1: 0.5568
 epoch: 84, train_loss: 0.7732, test_loss: 0.8667, test_f1: 0.5594
 epoch: 85, train_loss: 0.7780, test_loss: 0.8577, test_f1: 0.5523
 epoch: 86, train_loss: 0.7595, test_loss: 0.8731, test_f1: 0.5543
 epoch: 87, train_loss: 0.7667, test_loss: 0.8578, test_f1: 0.5568
 epoch: 88, train_loss: 0.7657, test_loss: 0.8636, test_f1: 0.5503
 epoch: 89, train_loss: 0.7655, test_loss: 0.8832, test_f1: 0.5404
 epoch: 90, train_loss: 0.7707, test_loss: 0.8663, test_f1: 0.5584
 epoch: 91, train_loss: 0.7644, test_loss: 0.8799, test_f1: 0.5555
 epoch: 92, train_loss: 0.7588, test_loss: 0.8765, test_f1: 0.5488
 epoch: 93, train_loss: 0.7575, test_loss: 0.8828, test_f1: 0.5536
 epoch: 94, train_loss: 0.7621, test_loss: 0.8993, test_f1: 0.5510
 epoch: 95, train_loss: 0.7639, test_loss: 0.8589, test_f1: 0.5630
 epoch: 96, train_loss: 0.7647, test_loss: 0.8675, test_f1: 0.5420
 epoch: 97, train_loss: 0.7546, test_loss: 0.8545, test_f1: 0.5533
 epoch: 98, train_loss: 0.7664, test_loss: 0.8527, test_f1: 0.5591
 epoch: 99, train_loss: 0.7577, test_loss: 0.8727, test_f1: 0.5564
##################ITERATION #8 ****************************************
 epoch: 0, train_loss: 1.3097, test_loss: 1.2565, test_f1: 0.2755
 epoch: 1, train_loss: 1.1368, test_loss: 1.0567, test_f1: 0.3436
 epoch: 2, train_loss: 1.1013, test_loss: 1.0169, test_f1: 0.4281
 epoch: 3, train_loss: 1.0755, test_loss: 1.0562, test_f1: 0.4011
 epoch: 4, train_loss: 1.0608, test_loss: 1.0078, test_f1: 0.4053
 epoch: 5, train_loss: 1.0389, test_loss: 0.9853, test_f1: 0.4378
 epoch: 6, train_loss: 1.0275, test_loss: 0.9700, test_f1: 0.4222
 epoch: 7, train_loss: 1.0003, test_loss: 0.9937, test_f1: 0.4119
 epoch: 8, train_loss: 1.0023, test_loss: 0.9891, test_f1: 0.4858
 epoch: 9, train_loss: 0.9843, test_loss: 1.0061, test_f1: 0.4723
 epoch: 10, train_loss: 0.9788, test_loss: 0.9899, test_f1: 0.4941
 epoch: 11, train_loss: 0.9690, test_loss: 1.0212, test_f1: 0.4405
 epoch: 12, train_loss: 0.9679, test_loss: 1.0203, test_f1: 0.4824
 epoch: 13, train_loss: 0.9678, test_loss: 1.0146, test_f1: 0.4745
 epoch: 14, train_loss: 0.9562, test_loss: 0.9911, test_f1: 0.4753
 epoch: 15, train_loss: 0.9470, test_loss: 0.9752, test_f1: 0.4942
 epoch: 16, train_loss: 0.9390, test_loss: 0.9657, test_f1: 0.4956
 epoch: 17, train_loss: 0.9228, test_loss: 0.9939, test_f1: 0.4715
 epoch: 18, train_loss: 0.9262, test_loss: 0.9745, test_f1: 0.5091
 epoch: 19, train_loss: 0.9208, test_loss: 0.9691, test_f1: 0.5232
 epoch: 20, train_loss: 0.9295, test_loss: 0.9876, test_f1: 0.4916
 epoch: 21, train_loss: 0.9084, test_loss: 0.9739, test_f1: 0.5196
 epoch: 22, train_loss: 0.9107, test_loss: 0.9740, test_f1: 0.4827
 epoch: 23, train_loss: 0.9036, test_loss: 0.9656, test_f1: 0.4934
 epoch: 24, train_loss: 0.8961, test_loss: 0.9603, test_f1: 0.4991
 epoch: 25, train_loss: 0.8959, test_loss: 0.9587, test_f1: 0.5052
 epoch: 26, train_loss: 0.8909, test_loss: 0.9629, test_f1: 0.5019
 epoch: 27, train_loss: 0.8805, test_loss: 0.9582, test_f1: 0.5080
 epoch: 28, train_loss: 0.8766, test_loss: 0.9551, test_f1: 0.5045
 epoch: 29, train_loss: 0.8749, test_loss: 0.9558, test_f1: 0.4840
 epoch: 30, train_loss: 0.8640, test_loss: 0.9480, test_f1: 0.4983
 epoch: 31, train_loss: 0.8743, test_loss: 0.9544, test_f1: 0.5001
 epoch: 32, train_loss: 0.8694, test_loss: 0.9870, test_f1: 0.4892
 epoch: 33, train_loss: 0.8569, test_loss: 0.9582, test_f1: 0.4994
 epoch: 34, train_loss: 0.8552, test_loss: 0.9389, test_f1: 0.5113
 epoch: 35, train_loss: 0.8646, test_loss: 0.9606, test_f1: 0.4848
 epoch: 36, train_loss: 0.8617, test_loss: 0.9470, test_f1: 0.5335
 epoch: 37, train_loss: 0.8614, test_loss: 0.9133, test_f1: 0.5178
 epoch: 38, train_loss: 0.8458, test_loss: 0.9380, test_f1: 0.5143
 epoch: 39, train_loss: 0.8315, test_loss: 1.0069, test_f1: 0.4955
 epoch: 40, train_loss: 0.8390, test_loss: 0.9520, test_f1: 0.5205
 epoch: 41, train_loss: 0.8295, test_loss: 0.9562, test_f1: 0.5122
 epoch: 42, train_loss: 0.8399, test_loss: 0.9543, test_f1: 0.5046
 epoch: 43, train_loss: 0.8358, test_loss: 0.9238, test_f1: 0.5307
 epoch: 44, train_loss: 0.8326, test_loss: 0.9420, test_f1: 0.5148
 epoch: 45, train_loss: 0.8305, test_loss: 0.9451, test_f1: 0.5208
 epoch: 46, train_loss: 0.8249, test_loss: 0.9578, test_f1: 0.5089
 epoch: 47, train_loss: 0.8310, test_loss: 0.9539, test_f1: 0.5125
 epoch: 48, train_loss: 0.8323, test_loss: 0.9186, test_f1: 0.5175
 epoch: 49, train_loss: 0.8127, test_loss: 0.9077, test_f1: 0.5417
 epoch: 50, train_loss: 0.8220, test_loss: 0.9631, test_f1: 0.5139
 epoch: 51, train_loss: 0.8073, test_loss: 0.9459, test_f1: 0.5133
 epoch: 52, train_loss: 0.7872, test_loss: 0.9403, test_f1: 0.5144
 epoch: 53, train_loss: 0.8004, test_loss: 0.9513, test_f1: 0.5142
 epoch: 54, train_loss: 0.8013, test_loss: 0.9300, test_f1: 0.5332
 epoch: 55, train_loss: 0.8102, test_loss: 0.9321, test_f1: 0.5325
 epoch: 56, train_loss: 0.7917, test_loss: 0.9335, test_f1: 0.5507
 epoch: 57, train_loss: 0.7922, test_loss: 0.9331, test_f1: 0.5353
 epoch: 58, train_loss: 0.7910, test_loss: 0.9174, test_f1: 0.5490
 epoch: 59, train_loss: 0.7997, test_loss: 0.9096, test_f1: 0.5324
 epoch: 60, train_loss: 0.7784, test_loss: 0.9684, test_f1: 0.5243
 epoch: 61, train_loss: 0.7914, test_loss: 0.9198, test_f1: 0.5424
 epoch: 62, train_loss: 0.7846, test_loss: 0.9392, test_f1: 0.5358
 epoch: 63, train_loss: 0.7952, test_loss: 0.9453, test_f1: 0.5244
 epoch: 64, train_loss: 0.7711, test_loss: 0.9087, test_f1: 0.5478
 epoch: 65, train_loss: 0.7810, test_loss: 0.9424, test_f1: 0.5124
 epoch: 66, train_loss: 0.7861, test_loss: 0.9521, test_f1: 0.5290
 epoch: 67, train_loss: 0.7904, test_loss: 0.9178, test_f1: 0.5183
 epoch: 68, train_loss: 0.7809, test_loss: 0.9240, test_f1: 0.5317
 epoch: 69, train_loss: 0.7904, test_loss: 0.9775, test_f1: 0.5158
 epoch: 70, train_loss: 0.7919, test_loss: 0.9418, test_f1: 0.5329
 epoch: 71, train_loss: 0.7685, test_loss: 0.9221, test_f1: 0.5447
 epoch: 72, train_loss: 0.7780, test_loss: 0.9259, test_f1: 0.5472
 epoch: 73, train_loss: 0.7756, test_loss: 0.9315, test_f1: 0.5181
 epoch: 74, train_loss: 0.7736, test_loss: 0.9101, test_f1: 0.5465
 epoch: 75, train_loss: 0.7747, test_loss: 0.9638, test_f1: 0.5517
 epoch: 76, train_loss: 0.7797, test_loss: 0.9689, test_f1: 0.5201
 epoch: 77, train_loss: 0.7831, test_loss: 0.9353, test_f1: 0.5221
 epoch: 78, train_loss: 0.7584, test_loss: 0.9607, test_f1: 0.5171
 epoch: 79, train_loss: 0.7644, test_loss: 0.9157, test_f1: 0.5581
 epoch: 80, train_loss: 0.7687, test_loss: 0.9375, test_f1: 0.5380
 epoch: 81, train_loss: 0.7618, test_loss: 0.9382, test_f1: 0.5494
 epoch: 82, train_loss: 0.7688, test_loss: 0.9336, test_f1: 0.5530
 epoch: 83, train_loss: 0.7658, test_loss: 0.9105, test_f1: 0.5552
 epoch: 84, train_loss: 0.7644, test_loss: 0.9278, test_f1: 0.5551
 epoch: 85, train_loss: 0.7727, test_loss: 0.9285, test_f1: 0.5427
 epoch: 86, train_loss: 0.7604, test_loss: 0.9291, test_f1: 0.5431
 epoch: 87, train_loss: 0.7575, test_loss: 0.9045, test_f1: 0.5557
 epoch: 88, train_loss: 0.7561, test_loss: 0.9269, test_f1: 0.5500
 epoch: 89, train_loss: 0.7676, test_loss: 0.9997, test_f1: 0.5203
 epoch: 90, train_loss: 0.7477, test_loss: 0.9573, test_f1: 0.5510
 epoch: 91, train_loss: 0.7531, test_loss: 0.9232, test_f1: 0.5505
 epoch: 92, train_loss: 0.7620, test_loss: 0.9846, test_f1: 0.5457
 epoch: 93, train_loss: 0.7625, test_loss: 0.9098, test_f1: 0.5665
 epoch: 94, train_loss: 0.7610, test_loss: 0.9447, test_f1: 0.5199
 epoch: 95, train_loss: 0.7630, test_loss: 0.9631, test_f1: 0.5313
 epoch: 96, train_loss: 0.7501, test_loss: 0.9375, test_f1: 0.5486
 epoch: 97, train_loss: 0.7597, test_loss: 0.9210, test_f1: 0.5595
 epoch: 98, train_loss: 0.7583, test_loss: 0.9708, test_f1: 0.5354
 epoch: 99, train_loss: 0.7457, test_loss: 0.9174, test_f1: 0.5598
##################ITERATION #9 ****************************************
 epoch: 0, train_loss: 1.4574, test_loss: 1.2250, test_f1: 0.2722
 epoch: 1, train_loss: 1.1711, test_loss: 1.1531, test_f1: 0.3672
 epoch: 2, train_loss: 1.1079, test_loss: 1.1033, test_f1: 0.3962
 epoch: 3, train_loss: 1.1038, test_loss: 1.0664, test_f1: 0.3732
 epoch: 4, train_loss: 1.0496, test_loss: 1.0565, test_f1: 0.3861
 epoch: 5, train_loss: 1.0323, test_loss: 1.0381, test_f1: 0.4058
 epoch: 6, train_loss: 1.0252, test_loss: 1.0319, test_f1: 0.4274
 epoch: 7, train_loss: 0.9986, test_loss: 1.0492, test_f1: 0.4155
 epoch: 8, train_loss: 0.9941, test_loss: 1.0025, test_f1: 0.4116
 epoch: 9, train_loss: 0.9750, test_loss: 0.9927, test_f1: 0.4286
 epoch: 10, train_loss: 0.9857, test_loss: 0.9740, test_f1: 0.4818
 epoch: 11, train_loss: 0.9615, test_loss: 0.9852, test_f1: 0.4788
 epoch: 12, train_loss: 0.9675, test_loss: 0.9684, test_f1: 0.5240
 epoch: 13, train_loss: 0.9517, test_loss: 0.9757, test_f1: 0.4484
 epoch: 14, train_loss: 0.9403, test_loss: 1.0214, test_f1: 0.4494
 epoch: 15, train_loss: 0.9437, test_loss: 0.9502, test_f1: 0.4958
 epoch: 16, train_loss: 0.9403, test_loss: 0.9598, test_f1: 0.5138
 epoch: 17, train_loss: 0.9288, test_loss: 0.9627, test_f1: 0.4876
 epoch: 18, train_loss: 0.9124, test_loss: 0.9414, test_f1: 0.5046
 epoch: 19, train_loss: 0.9071, test_loss: 0.9407, test_f1: 0.5260
 epoch: 20, train_loss: 0.9054, test_loss: 0.9515, test_f1: 0.4980
 epoch: 21, train_loss: 0.8976, test_loss: 0.9359, test_f1: 0.4841
 epoch: 22, train_loss: 0.8917, test_loss: 0.9084, test_f1: 0.5195
 epoch: 23, train_loss: 0.8863, test_loss: 0.9805, test_f1: 0.4860
 epoch: 24, train_loss: 0.8964, test_loss: 0.8839, test_f1: 0.5335
 epoch: 25, train_loss: 0.8647, test_loss: 0.9592, test_f1: 0.4688
 epoch: 26, train_loss: 0.8817, test_loss: 0.9270, test_f1: 0.5071
 epoch: 27, train_loss: 0.8665, test_loss: 0.8978, test_f1: 0.5147
 epoch: 28, train_loss: 0.8689, test_loss: 0.9085, test_f1: 0.5129
 epoch: 29, train_loss: 0.8504, test_loss: 0.8845, test_f1: 0.5276
 epoch: 30, train_loss: 0.8600, test_loss: 0.8754, test_f1: 0.5270
 epoch: 31, train_loss: 0.8503, test_loss: 0.9133, test_f1: 0.5057
 epoch: 32, train_loss: 0.8471, test_loss: 0.9160, test_f1: 0.5161
 epoch: 33, train_loss: 0.8531, test_loss: 0.9125, test_f1: 0.5140
 epoch: 34, train_loss: 0.8483, test_loss: 0.9013, test_f1: 0.5107
 epoch: 35, train_loss: 0.8331, test_loss: 0.8804, test_f1: 0.5206
 epoch: 36, train_loss: 0.8357, test_loss: 0.8965, test_f1: 0.5117
 epoch: 37, train_loss: 0.8447, test_loss: 0.8969, test_f1: 0.5308
 epoch: 38, train_loss: 0.8314, test_loss: 0.9036, test_f1: 0.5103
 epoch: 39, train_loss: 0.8106, test_loss: 0.8496, test_f1: 0.5471
 epoch: 40, train_loss: 0.8486, test_loss: 0.8739, test_f1: 0.5251
 epoch: 41, train_loss: 0.8269, test_loss: 0.9134, test_f1: 0.5190
 epoch: 42, train_loss: 0.8189, test_loss: 0.8684, test_f1: 0.5284
 epoch: 43, train_loss: 0.8195, test_loss: 0.8565, test_f1: 0.5451
 epoch: 44, train_loss: 0.8063, test_loss: 0.9149, test_f1: 0.5274
 epoch: 45, train_loss: 0.8052, test_loss: 0.8510, test_f1: 0.5431
 epoch: 46, train_loss: 0.8205, test_loss: 0.8491, test_f1: 0.5319
 epoch: 47, train_loss: 0.8167, test_loss: 0.8357, test_f1: 0.5367
 epoch: 48, train_loss: 0.8050, test_loss: 0.8613, test_f1: 0.5479
 epoch: 49, train_loss: 0.8088, test_loss: 0.8514, test_f1: 0.5357
 epoch: 50, train_loss: 0.7890, test_loss: 0.8471, test_f1: 0.5387
 epoch: 51, train_loss: 0.7891, test_loss: 0.8394, test_f1: 0.5456
 epoch: 52, train_loss: 0.7875, test_loss: 0.8591, test_f1: 0.5319
 epoch: 53, train_loss: 0.7750, test_loss: 0.8431, test_f1: 0.5415
 epoch: 54, train_loss: 0.7782, test_loss: 0.8323, test_f1: 0.5579
 epoch: 55, train_loss: 0.7822, test_loss: 0.8546, test_f1: 0.5416
 epoch: 56, train_loss: 0.7851, test_loss: 0.8534, test_f1: 0.5418
 epoch: 57, train_loss: 0.7769, test_loss: 0.8435, test_f1: 0.5422
 epoch: 58, train_loss: 0.7730, test_loss: 0.8554, test_f1: 0.5462
 epoch: 59, train_loss: 0.7796, test_loss: 0.8410, test_f1: 0.5368
 epoch: 60, train_loss: 0.7640, test_loss: 0.8416, test_f1: 0.5364
 epoch: 61, train_loss: 0.7741, test_loss: 0.8362, test_f1: 0.5522
 epoch: 62, train_loss: 0.7676, test_loss: 0.8348, test_f1: 0.5452
 epoch: 63, train_loss: 0.7802, test_loss: 0.8651, test_f1: 0.5477
 epoch: 64, train_loss: 0.7724, test_loss: 0.8261, test_f1: 0.5500
 epoch: 65, train_loss: 0.7696, test_loss: 0.8267, test_f1: 0.5519
 epoch: 66, train_loss: 0.7638, test_loss: 0.8290, test_f1: 0.5506
 epoch: 67, train_loss: 0.7693, test_loss: 0.8299, test_f1: 0.5432
 epoch: 68, train_loss: 0.7570, test_loss: 0.8418, test_f1: 0.5435
 epoch: 69, train_loss: 0.7685, test_loss: 0.8565, test_f1: 0.5399
 epoch: 70, train_loss: 0.7651, test_loss: 0.8465, test_f1: 0.5439
 epoch: 71, train_loss: 0.7565, test_loss: 0.8446, test_f1: 0.5488
 epoch: 72, train_loss: 0.7590, test_loss: 0.8439, test_f1: 0.5454
 epoch: 73, train_loss: 0.7663, test_loss: 0.8383, test_f1: 0.5459
 epoch: 74, train_loss: 0.7614, test_loss: 0.8357, test_f1: 0.5472
 epoch: 75, train_loss: 0.7505, test_loss: 0.8258, test_f1: 0.5554
 epoch: 76, train_loss: 0.7445, test_loss: 0.8448, test_f1: 0.5408
 epoch: 77, train_loss: 0.7518, test_loss: 0.8412, test_f1: 0.5456
 epoch: 78, train_loss: 0.7449, test_loss: 0.8263, test_f1: 0.5584
 epoch: 79, train_loss: 0.7472, test_loss: 0.8232, test_f1: 0.5567
 epoch: 80, train_loss: 0.7482, test_loss: 0.8338, test_f1: 0.5488
 epoch: 81, train_loss: 0.7677, test_loss: 0.8466, test_f1: 0.5458
 epoch: 82, train_loss: 0.7589, test_loss: 0.8298, test_f1: 0.5527
 epoch: 83, train_loss: 0.7485, test_loss: 0.8522, test_f1: 0.5446
 epoch: 84, train_loss: 0.7521, test_loss: 0.7793, test_f1: 0.5708
 epoch: 85, train_loss: 0.7449, test_loss: 0.8294, test_f1: 0.5515
 epoch: 86, train_loss: 0.7580, test_loss: 0.8209, test_f1: 0.5540
 epoch: 87, train_loss: 0.7382, test_loss: 0.8365, test_f1: 0.5482
 epoch: 88, train_loss: 0.7426, test_loss: 0.8288, test_f1: 0.5532
 epoch: 89, train_loss: 0.7426, test_loss: 0.8295, test_f1: 0.5511
 epoch: 90, train_loss: 0.7467, test_loss: 0.8120, test_f1: 0.5581
 epoch: 91, train_loss: 0.7373, test_loss: 0.8270, test_f1: 0.5424
 epoch: 92, train_loss: 0.7353, test_loss: 0.8267, test_f1: 0.5494
 epoch: 93, train_loss: 0.7469, test_loss: 0.8343, test_f1: 0.5448
 epoch: 94, train_loss: 0.7439, test_loss: 0.8459, test_f1: 0.5532
 epoch: 95, train_loss: 0.7501, test_loss: 0.8185, test_f1: 0.5607
 epoch: 96, train_loss: 0.7297, test_loss: 0.8167, test_f1: 0.5599
 epoch: 97, train_loss: 0.7454, test_loss: 0.8342, test_f1: 0.5491
 epoch: 98, train_loss: 0.7251, test_loss: 0.8353, test_f1: 0.5464
 epoch: 99, train_loss: 0.7355, test_loss: 0.8407, test_f1: 0.5466

Training completed in 628.74 seconds
Best F1: 0.5803 at epoch 81
Mean F1 across iterations: 0.5658  0.0092
========================FINAL RESULTS================================
FEGIN weighted F1: 0.5803  0.0092
python main.py --data ltspice_examples --representation component_pin --model FEGIN --layers 3 --hiddens 16 --batch_size 64 --lr 0.001 --emb_size 250 --epochs 100 --save_appendix component_pin_L3_H16_BS64_LR0.001_E250 --no_val
-----



STDERR:
  File "main.py", line 370, in <module>
    main()
  File "main.py", line 254, in main
    dataset = dataset_class(
  File "/home/philip/projects/ltspice_examples_code_repo/Circuit-Completion-Using-GNNs/component_classification_with_link_prediction_head/evaluation/FEGIN/kernel/circuit_datasets.py", line 15, in __init__
    self.data, self.slices = torch.load(self.processed_paths[0])
  File "/home/philip/.local/lib/python3.8/site-packages/torch/serialization.py", line 1040, in load
    warnings.warn(
  File "/usr/lib/python3.8/warnings.py", line 109, in _showwarnmsg
    sw(msg.message, msg.category, msg.filename, msg.lineno,
  File "main.py", line 47, in warn_with_traceback
    traceback.print_stack(file=log)
/home/philip/projects/ltspice_examples_code_repo/Circuit-Completion-Using-GNNs/component_classification_with_link_prediction_head/evaluation/FEGIN/kernel/circuit_datasets.py:15: FutureWarning: You are using `torch.load` with `weights_only=False` (the current default value), which uses the default pickle module implicitly. It is possible to construct malicious pickle data which will execute arbitrary code during unpickling (See https://github.com/pytorch/pytorch/blob/main/SECURITY.md#untrusted-models for more details). In a future release, the default value for `weights_only` will be flipped to `True`. This limits the functions that could be executed during unpickling. Arbitrary objects will no longer be allowed to be loaded via this mode unless they are explicitly allowlisted by the user via `torch.serialization.add_safe_globals`. We recommend you start setting `weights_only=True` for any use case where you don't have full control of the loaded file. Please open an issue on GitHub for any issues related to this experimental feature.
  self.data, self.slices = torch.load(self.processed_paths[0])
