STDOUT:
Results will be saved in /home/philip/projects/llm_inference_code_repo/Circuit-Completion-Using-GNNs/component_classification_with_link_prediction_head/evaluation/FEGIN/results/model_FEGIN_dataset_ltspice_examples
Command line input: python main.py --data ltspice_examples --representation component_pin_net --model FEGIN --layers 2 --hiddens 64 --batch_size 32 --lr 0.01 --emb_size 128 --epochs 100 --save_appendix component_pin_net_L2_H64_BS32_LR0.01_E128 --no_val
 is saved.
-----
ltspice_examples - FEGIN
Using 2 layers, 64 hidden units, h = 2
Loading component_pin_net representation dataset
ENTERED
Training FEGIN on component_pin_net representation
Train: 3558, Test: 846
##################ITERATION #0 ****************************************
 epoch: 0, train_loss: 1.1248, test_loss: 1.0517, test_f1: 0.3612
 epoch: 1, train_loss: 1.0169, test_loss: 1.0446, test_f1: 0.4611
 epoch: 2, train_loss: 0.9776, test_loss: 0.9803, test_f1: 0.5308
 epoch: 3, train_loss: 0.9649, test_loss: 1.0762, test_f1: 0.3988
 epoch: 4, train_loss: 0.9432, test_loss: 1.2027, test_f1: 0.4276
 epoch: 5, train_loss: 0.9353, test_loss: 1.1811, test_f1: 0.4457
 epoch: 6, train_loss: 0.9192, test_loss: 1.0441, test_f1: 0.4497
 epoch: 7, train_loss: 0.9304, test_loss: 1.2418, test_f1: 0.4319
 epoch: 8, train_loss: 0.9034, test_loss: 0.9707, test_f1: 0.5064
 epoch: 9, train_loss: 0.8959, test_loss: 0.9121, test_f1: 0.5112
 epoch: 10, train_loss: 0.8810, test_loss: 0.9376, test_f1: 0.5238
 epoch: 11, train_loss: 0.8958, test_loss: 0.9340, test_f1: 0.5148
 epoch: 12, train_loss: 0.8610, test_loss: 0.9043, test_f1: 0.5534
 epoch: 13, train_loss: 0.8482, test_loss: 0.8229, test_f1: 0.5746
 epoch: 14, train_loss: 0.8512, test_loss: 0.8819, test_f1: 0.6088
 epoch: 15, train_loss: 0.8421, test_loss: 0.8724, test_f1: 0.6004
 epoch: 16, train_loss: 0.8314, test_loss: 0.9999, test_f1: 0.5126
 epoch: 17, train_loss: 0.8386, test_loss: 0.8374, test_f1: 0.6202
 epoch: 18, train_loss: 0.8405, test_loss: 0.8745, test_f1: 0.5852
 epoch: 19, train_loss: 0.8206, test_loss: 0.9045, test_f1: 0.5829
 epoch: 20, train_loss: 0.8212, test_loss: 0.8348, test_f1: 0.6423
 epoch: 21, train_loss: 0.8052, test_loss: 0.9030, test_f1: 0.6072
 epoch: 22, train_loss: 0.8220, test_loss: 0.8596, test_f1: 0.5430
 epoch: 23, train_loss: 0.7959, test_loss: 0.8140, test_f1: 0.5913
 epoch: 24, train_loss: 0.7848, test_loss: 0.7936, test_f1: 0.6244
 epoch: 25, train_loss: 0.7833, test_loss: 0.8188, test_f1: 0.6268
 epoch: 26, train_loss: 0.7718, test_loss: 0.7724, test_f1: 0.5849
 epoch: 27, train_loss: 0.7765, test_loss: 0.7980, test_f1: 0.6131
 epoch: 28, train_loss: 0.7738, test_loss: 0.8266, test_f1: 0.6153
 epoch: 29, train_loss: 0.7661, test_loss: 0.8157, test_f1: 0.6388
 epoch: 30, train_loss: 0.7454, test_loss: 0.8280, test_f1: 0.5859
 epoch: 31, train_loss: 0.7528, test_loss: 0.8521, test_f1: 0.5769
 epoch: 32, train_loss: 0.7549, test_loss: 0.9557, test_f1: 0.5903
 epoch: 33, train_loss: 0.7584, test_loss: 0.8397, test_f1: 0.6246
 epoch: 34, train_loss: 0.7455, test_loss: 0.8360, test_f1: 0.6129
 epoch: 35, train_loss: 0.7390, test_loss: 0.7943, test_f1: 0.6164
 epoch: 36, train_loss: 0.7347, test_loss: 0.8902, test_f1: 0.6156
 epoch: 37, train_loss: 0.7512, test_loss: 0.8412, test_f1: 0.6334
 epoch: 38, train_loss: 0.7485, test_loss: 0.9011, test_f1: 0.6273
 epoch: 39, train_loss: 0.7468, test_loss: 0.8099, test_f1: 0.6339
 epoch: 40, train_loss: 0.7289, test_loss: 0.8050, test_f1: 0.6521
 epoch: 41, train_loss: 0.7115, test_loss: 0.9351, test_f1: 0.6319
 epoch: 42, train_loss: 0.7287, test_loss: 0.8438, test_f1: 0.6259
 epoch: 43, train_loss: 0.7279, test_loss: 0.8549, test_f1: 0.6110
 epoch: 44, train_loss: 0.7350, test_loss: 0.7477, test_f1: 0.6189
 epoch: 45, train_loss: 0.6959, test_loss: 0.7335, test_f1: 0.6367
 epoch: 46, train_loss: 0.6913, test_loss: 0.8244, test_f1: 0.6425
 epoch: 47, train_loss: 0.7003, test_loss: 0.8705, test_f1: 0.6591
 epoch: 48, train_loss: 0.6946, test_loss: 0.8876, test_f1: 0.5925
 epoch: 49, train_loss: 0.7095, test_loss: 0.8520, test_f1: 0.6395
 epoch: 50, train_loss: 0.6874, test_loss: 0.7986, test_f1: 0.6376
 epoch: 51, train_loss: 0.6614, test_loss: 0.9189, test_f1: 0.6452
 epoch: 52, train_loss: 0.6423, test_loss: 0.8672, test_f1: 0.6586
 epoch: 53, train_loss: 0.6310, test_loss: 0.9373, test_f1: 0.6795
 epoch: 54, train_loss: 0.6393, test_loss: 0.8597, test_f1: 0.6797
 epoch: 55, train_loss: 0.6210, test_loss: 0.9139, test_f1: 0.6617
 epoch: 56, train_loss: 0.6058, test_loss: 0.9622, test_f1: 0.6636
 epoch: 57, train_loss: 0.6300, test_loss: 0.9043, test_f1: 0.6525
 epoch: 58, train_loss: 0.6034, test_loss: 0.9843, test_f1: 0.6700
 epoch: 59, train_loss: 0.6292, test_loss: 0.9492, test_f1: 0.6521
 epoch: 60, train_loss: 0.6072, test_loss: 0.9183, test_f1: 0.6719
 epoch: 61, train_loss: 0.6073, test_loss: 0.8975, test_f1: 0.6917
 epoch: 62, train_loss: 0.6003, test_loss: 1.0667, test_f1: 0.6655
 epoch: 63, train_loss: 0.6036, test_loss: 1.0286, test_f1: 0.6771
 epoch: 64, train_loss: 0.6042, test_loss: 0.9345, test_f1: 0.6948
 epoch: 65, train_loss: 0.5917, test_loss: 0.9784, test_f1: 0.6524
 epoch: 66, train_loss: 0.5913, test_loss: 0.9171, test_f1: 0.6636
 epoch: 67, train_loss: 0.5894, test_loss: 0.9834, test_f1: 0.6649
 epoch: 68, train_loss: 0.5920, test_loss: 1.0440, test_f1: 0.6679
 epoch: 69, train_loss: 0.5809, test_loss: 0.9870, test_f1: 0.6855
 epoch: 70, train_loss: 0.5712, test_loss: 1.0348, test_f1: 0.6867
 epoch: 71, train_loss: 0.5993, test_loss: 0.8940, test_f1: 0.6627
 epoch: 72, train_loss: 0.5817, test_loss: 1.0372, test_f1: 0.6775
 epoch: 73, train_loss: 0.5806, test_loss: 0.9629, test_f1: 0.6622
 epoch: 74, train_loss: 0.5746, test_loss: 0.9272, test_f1: 0.6713
 epoch: 75, train_loss: 0.5680, test_loss: 0.9986, test_f1: 0.6704
 epoch: 76, train_loss: 0.5598, test_loss: 1.0104, test_f1: 0.6857
 epoch: 77, train_loss: 0.5689, test_loss: 0.9781, test_f1: 0.6953
 epoch: 78, train_loss: 0.5801, test_loss: 0.9929, test_f1: 0.6737
 epoch: 79, train_loss: 0.5665, test_loss: 1.1009, test_f1: 0.6868
 epoch: 80, train_loss: 0.5481, test_loss: 0.9389, test_f1: 0.6672
 epoch: 81, train_loss: 0.5484, test_loss: 1.0413, test_f1: 0.6728
 epoch: 82, train_loss: 0.5589, test_loss: 1.0628, test_f1: 0.6726
 epoch: 83, train_loss: 0.5550, test_loss: 0.9887, test_f1: 0.6777
 epoch: 84, train_loss: 0.5620, test_loss: 1.0559, test_f1: 0.6960
 epoch: 85, train_loss: 0.5525, test_loss: 1.1684, test_f1: 0.6990
 epoch: 86, train_loss: 0.5403, test_loss: 1.0952, test_f1: 0.6880
 epoch: 87, train_loss: 0.5496, test_loss: 1.0333, test_f1: 0.6568
 epoch: 88, train_loss: 0.5583, test_loss: 0.8918, test_f1: 0.7046
 epoch: 89, train_loss: 0.5457, test_loss: 1.0170, test_f1: 0.6634
 epoch: 90, train_loss: 0.5253, test_loss: 0.9509, test_f1: 0.6862
 epoch: 91, train_loss: 0.5466, test_loss: 1.0028, test_f1: 0.6731
 epoch: 92, train_loss: 0.5455, test_loss: 0.9992, test_f1: 0.6871
 epoch: 93, train_loss: 0.5406, test_loss: 0.9919, test_f1: 0.6687
 epoch: 94, train_loss: 0.5308, test_loss: 1.0415, test_f1: 0.6891
 epoch: 95, train_loss: 0.5262, test_loss: 1.2222, test_f1: 0.6869
 epoch: 96, train_loss: 0.5398, test_loss: 1.0399, test_f1: 0.6605
 epoch: 97, train_loss: 0.5541, test_loss: 1.2589, test_f1: 0.6392
 epoch: 98, train_loss: 0.5401, test_loss: 1.1690, test_f1: 0.6944
 epoch: 99, train_loss: 0.5318, test_loss: 1.0539, test_f1: 0.6995
##################ITERATION #1 ****************************************
 epoch: 0, train_loss: 1.1050, test_loss: 1.0961, test_f1: 0.4655
 epoch: 1, train_loss: 1.0121, test_loss: 0.9765, test_f1: 0.4858
 epoch: 2, train_loss: 0.9906, test_loss: 1.1051, test_f1: 0.4603
 epoch: 3, train_loss: 0.9583, test_loss: 1.0590, test_f1: 0.4808
 epoch: 4, train_loss: 0.9547, test_loss: 0.9865, test_f1: 0.5117
 epoch: 5, train_loss: 0.9334, test_loss: 0.9572, test_f1: 0.5101
 epoch: 6, train_loss: 0.9253, test_loss: 0.9481, test_f1: 0.4841
 epoch: 7, train_loss: 0.9141, test_loss: 0.9705, test_f1: 0.5232
 epoch: 8, train_loss: 0.8901, test_loss: 0.9878, test_f1: 0.4752
 epoch: 9, train_loss: 0.9002, test_loss: 0.9306, test_f1: 0.5153
 epoch: 10, train_loss: 0.8749, test_loss: 0.8788, test_f1: 0.5354
 epoch: 11, train_loss: 0.8723, test_loss: 0.9026, test_f1: 0.5169
 epoch: 12, train_loss: 0.8554, test_loss: 0.8803, test_f1: 0.5330
 epoch: 13, train_loss: 0.8601, test_loss: 0.8228, test_f1: 0.6004
 epoch: 14, train_loss: 0.8425, test_loss: 0.8668, test_f1: 0.5373
 epoch: 15, train_loss: 0.8467, test_loss: 0.8699, test_f1: 0.5628
 epoch: 16, train_loss: 0.8420, test_loss: 0.8341, test_f1: 0.5533
 epoch: 17, train_loss: 0.8280, test_loss: 0.9476, test_f1: 0.5005
 epoch: 18, train_loss: 0.8303, test_loss: 0.8031, test_f1: 0.5822
 epoch: 19, train_loss: 0.8197, test_loss: 0.8203, test_f1: 0.5652
 epoch: 20, train_loss: 0.8265, test_loss: 0.7671, test_f1: 0.5831
 epoch: 21, train_loss: 0.8242, test_loss: 1.1701, test_f1: 0.4850
 epoch: 22, train_loss: 0.8219, test_loss: 0.8166, test_f1: 0.6058
 epoch: 23, train_loss: 0.8049, test_loss: 0.8098, test_f1: 0.5890
 epoch: 24, train_loss: 0.7935, test_loss: 0.8529, test_f1: 0.5835
 epoch: 25, train_loss: 0.7874, test_loss: 0.8226, test_f1: 0.5760
 epoch: 26, train_loss: 0.7878, test_loss: 0.8285, test_f1: 0.5913
 epoch: 27, train_loss: 0.8171, test_loss: 0.8654, test_f1: 0.6002
 epoch: 28, train_loss: 0.8117, test_loss: 0.7953, test_f1: 0.6193
 epoch: 29, train_loss: 0.7913, test_loss: 0.8019, test_f1: 0.5827
 epoch: 30, train_loss: 0.8033, test_loss: 0.8106, test_f1: 0.5754
 epoch: 31, train_loss: 0.7834, test_loss: 0.8016, test_f1: 0.5888
 epoch: 32, train_loss: 0.7717, test_loss: 0.7579, test_f1: 0.6532
 epoch: 33, train_loss: 0.7948, test_loss: 0.9080, test_f1: 0.5800
 epoch: 34, train_loss: 0.7631, test_loss: 0.8137, test_f1: 0.6303
 epoch: 35, train_loss: 0.7590, test_loss: 0.8192, test_f1: 0.5842
 epoch: 36, train_loss: 0.7469, test_loss: 0.8279, test_f1: 0.5746
 epoch: 37, train_loss: 0.7459, test_loss: 0.8671, test_f1: 0.5858
 epoch: 38, train_loss: 0.7540, test_loss: 0.8204, test_f1: 0.6033
 epoch: 39, train_loss: 0.7464, test_loss: 0.7844, test_f1: 0.6224
 epoch: 40, train_loss: 0.7385, test_loss: 0.7930, test_f1: 0.5866
 epoch: 41, train_loss: 0.7331, test_loss: 0.8110, test_f1: 0.6425
 epoch: 42, train_loss: 0.7375, test_loss: 0.7775, test_f1: 0.6437
 epoch: 43, train_loss: 0.7361, test_loss: 0.7626, test_f1: 0.6737
 epoch: 44, train_loss: 0.7296, test_loss: 0.7944, test_f1: 0.6528
 epoch: 45, train_loss: 0.7302, test_loss: 0.8469, test_f1: 0.5970
 epoch: 46, train_loss: 0.7038, test_loss: 0.7758, test_f1: 0.6028
 epoch: 47, train_loss: 0.7317, test_loss: 0.7924, test_f1: 0.6307
 epoch: 48, train_loss: 0.7152, test_loss: 0.7790, test_f1: 0.6739
 epoch: 49, train_loss: 0.6995, test_loss: 0.8241, test_f1: 0.6801
 epoch: 50, train_loss: 0.7115, test_loss: 0.7985, test_f1: 0.6560
 epoch: 51, train_loss: 0.6495, test_loss: 0.8178, test_f1: 0.6691
 epoch: 52, train_loss: 0.6602, test_loss: 0.8040, test_f1: 0.6738
 epoch: 53, train_loss: 0.6422, test_loss: 0.8545, test_f1: 0.6798
 epoch: 54, train_loss: 0.6376, test_loss: 0.9399, test_f1: 0.6459
 epoch: 55, train_loss: 0.6405, test_loss: 0.9193, test_f1: 0.6373
 epoch: 56, train_loss: 0.6333, test_loss: 0.8375, test_f1: 0.6663
 epoch: 57, train_loss: 0.6334, test_loss: 0.8023, test_f1: 0.6766
 epoch: 58, train_loss: 0.6281, test_loss: 0.8947, test_f1: 0.6432
 epoch: 59, train_loss: 0.6141, test_loss: 0.8237, test_f1: 0.6812
 epoch: 60, train_loss: 0.6346, test_loss: 0.8091, test_f1: 0.7037
 epoch: 61, train_loss: 0.6128, test_loss: 0.8595, test_f1: 0.6404
 epoch: 62, train_loss: 0.6181, test_loss: 0.8279, test_f1: 0.6997
 epoch: 63, train_loss: 0.6032, test_loss: 0.9042, test_f1: 0.7064
 epoch: 64, train_loss: 0.6159, test_loss: 0.9408, test_f1: 0.6922
 epoch: 65, train_loss: 0.6021, test_loss: 0.8746, test_f1: 0.7062
 epoch: 66, train_loss: 0.6037, test_loss: 0.8183, test_f1: 0.6894
 epoch: 67, train_loss: 0.5903, test_loss: 0.8028, test_f1: 0.6821
 epoch: 68, train_loss: 0.5953, test_loss: 0.8039, test_f1: 0.6897
 epoch: 69, train_loss: 0.5940, test_loss: 0.8506, test_f1: 0.6937
 epoch: 70, train_loss: 0.5817, test_loss: 0.7994, test_f1: 0.7198
 epoch: 71, train_loss: 0.5687, test_loss: 0.9911, test_f1: 0.6937
 epoch: 72, train_loss: 0.5897, test_loss: 1.0133, test_f1: 0.6668
 epoch: 73, train_loss: 0.5955, test_loss: 0.9778, test_f1: 0.7027
 epoch: 74, train_loss: 0.5753, test_loss: 0.9568, test_f1: 0.6834
 epoch: 75, train_loss: 0.5967, test_loss: 0.7414, test_f1: 0.7083
 epoch: 76, train_loss: 0.5633, test_loss: 0.8166, test_f1: 0.7072
 epoch: 77, train_loss: 0.5850, test_loss: 0.8077, test_f1: 0.6704
 epoch: 78, train_loss: 0.5777, test_loss: 0.9201, test_f1: 0.6798
 epoch: 79, train_loss: 0.5765, test_loss: 0.9087, test_f1: 0.6930
 epoch: 80, train_loss: 0.5490, test_loss: 1.0430, test_f1: 0.6981
 epoch: 81, train_loss: 0.5610, test_loss: 0.9060, test_f1: 0.6771
 epoch: 82, train_loss: 0.5612, test_loss: 0.9881, test_f1: 0.6332
 epoch: 83, train_loss: 0.5598, test_loss: 0.8977, test_f1: 0.6831
 epoch: 84, train_loss: 0.5637, test_loss: 0.9414, test_f1: 0.6981
 epoch: 85, train_loss: 0.5574, test_loss: 0.8391, test_f1: 0.6984
 epoch: 86, train_loss: 0.5726, test_loss: 1.0267, test_f1: 0.6537
 epoch: 87, train_loss: 0.5480, test_loss: 0.8759, test_f1: 0.7102
 epoch: 88, train_loss: 0.5482, test_loss: 0.9338, test_f1: 0.6818
 epoch: 89, train_loss: 0.5573, test_loss: 1.0398, test_f1: 0.6925
 epoch: 90, train_loss: 0.5403, test_loss: 0.9095, test_f1: 0.7162
 epoch: 91, train_loss: 0.5543, test_loss: 0.9303, test_f1: 0.6599
 epoch: 92, train_loss: 0.5338, test_loss: 0.8439, test_f1: 0.6851
 epoch: 93, train_loss: 0.5326, test_loss: 0.8319, test_f1: 0.6847
 epoch: 94, train_loss: 0.5262, test_loss: 0.9803, test_f1: 0.7015
 epoch: 95, train_loss: 0.5498, test_loss: 0.8877, test_f1: 0.6863
 epoch: 96, train_loss: 0.5239, test_loss: 0.9336, test_f1: 0.6748
 epoch: 97, train_loss: 0.5250, test_loss: 0.8518, test_f1: 0.6843
 epoch: 98, train_loss: 0.5299, test_loss: 0.9809, test_f1: 0.6524
 epoch: 99, train_loss: 0.5252, test_loss: 0.9271, test_f1: 0.6991
##################ITERATION #2 ****************************************
 epoch: 0, train_loss: 1.0926, test_loss: 0.9958, test_f1: 0.4661
 epoch: 1, train_loss: 1.0171, test_loss: 0.9885, test_f1: 0.4655
 epoch: 2, train_loss: 0.9828, test_loss: 0.9628, test_f1: 0.4602
 epoch: 3, train_loss: 0.9677, test_loss: 0.9596, test_f1: 0.4840
 epoch: 4, train_loss: 0.9447, test_loss: 0.9722, test_f1: 0.5189
 epoch: 5, train_loss: 0.9389, test_loss: 1.1149, test_f1: 0.4549
 epoch: 6, train_loss: 0.9462, test_loss: 0.9711, test_f1: 0.5078
 epoch: 7, train_loss: 0.9174, test_loss: 1.0077, test_f1: 0.4449
 epoch: 8, train_loss: 0.9392, test_loss: 0.9357, test_f1: 0.5122
 epoch: 9, train_loss: 0.8926, test_loss: 0.9573, test_f1: 0.5253
 epoch: 10, train_loss: 0.8901, test_loss: 1.0016, test_f1: 0.5200
 epoch: 11, train_loss: 0.8876, test_loss: 0.9260, test_f1: 0.5427
 epoch: 12, train_loss: 0.8667, test_loss: 0.8993, test_f1: 0.6034
 epoch: 13, train_loss: 0.8770, test_loss: 0.9779, test_f1: 0.4954
 epoch: 14, train_loss: 0.8840, test_loss: 0.8542, test_f1: 0.5591
 epoch: 15, train_loss: 0.8711, test_loss: 0.8725, test_f1: 0.5271
 epoch: 16, train_loss: 0.8415, test_loss: 0.8070, test_f1: 0.5863
 epoch: 17, train_loss: 0.8385, test_loss: 0.8249, test_f1: 0.5791
 epoch: 18, train_loss: 0.8396, test_loss: 0.8483, test_f1: 0.6223
 epoch: 19, train_loss: 0.8293, test_loss: 0.8753, test_f1: 0.5952
 epoch: 20, train_loss: 0.8247, test_loss: 0.8440, test_f1: 0.5432
 epoch: 21, train_loss: 0.8079, test_loss: 0.8819, test_f1: 0.5739
 epoch: 22, train_loss: 0.8053, test_loss: 0.9220, test_f1: 0.5596
 epoch: 23, train_loss: 0.7985, test_loss: 0.8669, test_f1: 0.6155
 epoch: 24, train_loss: 0.7773, test_loss: 0.9102, test_f1: 0.5826
 epoch: 25, train_loss: 0.7803, test_loss: 0.8283, test_f1: 0.5601
 epoch: 26, train_loss: 0.7712, test_loss: 0.7634, test_f1: 0.5941
 epoch: 27, train_loss: 0.7640, test_loss: 0.8961, test_f1: 0.6220
 epoch: 28, train_loss: 0.7760, test_loss: 0.8350, test_f1: 0.6067
 epoch: 29, train_loss: 0.7501, test_loss: 0.9884, test_f1: 0.6090
 epoch: 30, train_loss: 0.7537, test_loss: 0.7778, test_f1: 0.6226
 epoch: 31, train_loss: 0.7790, test_loss: 0.8059, test_f1: 0.5587
 epoch: 32, train_loss: 0.7402, test_loss: 0.9467, test_f1: 0.5894
 epoch: 33, train_loss: 0.7564, test_loss: 0.9631, test_f1: 0.6317
 epoch: 34, train_loss: 0.7336, test_loss: 0.8890, test_f1: 0.5954
 epoch: 35, train_loss: 0.7436, test_loss: 0.8017, test_f1: 0.6506
 epoch: 36, train_loss: 0.7203, test_loss: 0.7666, test_f1: 0.6197
 epoch: 37, train_loss: 0.7439, test_loss: 0.7531, test_f1: 0.6468
 epoch: 38, train_loss: 0.7274, test_loss: 0.8673, test_f1: 0.6507
 epoch: 39, train_loss: 0.7111, test_loss: 0.9000, test_f1: 0.6378
 epoch: 40, train_loss: 0.7148, test_loss: 0.8512, test_f1: 0.6474
 epoch: 41, train_loss: 0.7323, test_loss: 0.8545, test_f1: 0.6387
 epoch: 42, train_loss: 0.7186, test_loss: 0.7469, test_f1: 0.6459
 epoch: 43, train_loss: 0.7116, test_loss: 0.8899, test_f1: 0.5797
 epoch: 44, train_loss: 0.7028, test_loss: 0.8890, test_f1: 0.6262
 epoch: 45, train_loss: 0.6851, test_loss: 0.8372, test_f1: 0.5907
 epoch: 46, train_loss: 0.7088, test_loss: 0.8711, test_f1: 0.6412
 epoch: 47, train_loss: 0.6916, test_loss: 0.9968, test_f1: 0.5926
 epoch: 48, train_loss: 0.6814, test_loss: 0.9524, test_f1: 0.6276
 epoch: 49, train_loss: 0.6693, test_loss: 1.1789, test_f1: 0.6168
 epoch: 50, train_loss: 0.6873, test_loss: 0.9824, test_f1: 0.6351
 epoch: 51, train_loss: 0.6536, test_loss: 0.9001, test_f1: 0.6375
 epoch: 52, train_loss: 0.6313, test_loss: 0.9704, test_f1: 0.6611
 epoch: 53, train_loss: 0.6069, test_loss: 0.8790, test_f1: 0.6606
 epoch: 54, train_loss: 0.6152, test_loss: 0.8154, test_f1: 0.6734
 epoch: 55, train_loss: 0.5983, test_loss: 0.8777, test_f1: 0.6701
 epoch: 56, train_loss: 0.6047, test_loss: 0.8421, test_f1: 0.6578
 epoch: 57, train_loss: 0.5975, test_loss: 0.7861, test_f1: 0.6508
 epoch: 58, train_loss: 0.5801, test_loss: 0.9716, test_f1: 0.6655
 epoch: 59, train_loss: 0.5886, test_loss: 0.9296, test_f1: 0.6735
 epoch: 60, train_loss: 0.5999, test_loss: 0.9052, test_f1: 0.6630
 epoch: 61, train_loss: 0.5726, test_loss: 0.9025, test_f1: 0.6747
 epoch: 62, train_loss: 0.5781, test_loss: 0.9101, test_f1: 0.6691
 epoch: 63, train_loss: 0.5806, test_loss: 1.0684, test_f1: 0.6447
 epoch: 64, train_loss: 0.5974, test_loss: 0.9639, test_f1: 0.6569
 epoch: 65, train_loss: 0.5731, test_loss: 0.8391, test_f1: 0.6675
 epoch: 66, train_loss: 0.5734, test_loss: 0.9990, test_f1: 0.6857
 epoch: 67, train_loss: 0.5728, test_loss: 0.9697, test_f1: 0.6855
 epoch: 68, train_loss: 0.5908, test_loss: 1.0047, test_f1: 0.6587
 epoch: 69, train_loss: 0.5792, test_loss: 0.8432, test_f1: 0.6521
 epoch: 70, train_loss: 0.5756, test_loss: 1.0181, test_f1: 0.6501
 epoch: 71, train_loss: 0.5753, test_loss: 1.0163, test_f1: 0.6853
 epoch: 72, train_loss: 0.5718, test_loss: 0.9599, test_f1: 0.6461
 epoch: 73, train_loss: 0.5601, test_loss: 0.8112, test_f1: 0.6816
 epoch: 74, train_loss: 0.5669, test_loss: 0.9150, test_f1: 0.6523
 epoch: 75, train_loss: 0.5703, test_loss: 0.7759, test_f1: 0.6424
 epoch: 76, train_loss: 0.5771, test_loss: 0.8043, test_f1: 0.6627
 epoch: 77, train_loss: 0.5469, test_loss: 0.7439, test_f1: 0.6740
 epoch: 78, train_loss: 0.5428, test_loss: 0.8751, test_f1: 0.6496
 epoch: 79, train_loss: 0.5681, test_loss: 0.7952, test_f1: 0.6961
 epoch: 80, train_loss: 0.5461, test_loss: 0.7731, test_f1: 0.6716
 epoch: 81, train_loss: 0.5525, test_loss: 0.7226, test_f1: 0.6766
 epoch: 82, train_loss: 0.5362, test_loss: 0.7687, test_f1: 0.6695
 epoch: 83, train_loss: 0.5374, test_loss: 0.8419, test_f1: 0.6625
 epoch: 84, train_loss: 0.5420, test_loss: 0.9039, test_f1: 0.6494
 epoch: 85, train_loss: 0.5381, test_loss: 0.8013, test_f1: 0.6729
 epoch: 86, train_loss: 0.5405, test_loss: 0.7716, test_f1: 0.6878
 epoch: 87, train_loss: 0.5470, test_loss: 0.7793, test_f1: 0.6719
 epoch: 88, train_loss: 0.5140, test_loss: 0.8402, test_f1: 0.6567
 epoch: 89, train_loss: 0.5165, test_loss: 0.9158, test_f1: 0.6745
 epoch: 90, train_loss: 0.5264, test_loss: 0.9050, test_f1: 0.6562
 epoch: 91, train_loss: 0.5284, test_loss: 0.8068, test_f1: 0.6836
 epoch: 92, train_loss: 0.5167, test_loss: 0.9499, test_f1: 0.6738
 epoch: 93, train_loss: 0.5182, test_loss: 0.7874, test_f1: 0.6741
 epoch: 94, train_loss: 0.5249, test_loss: 0.7894, test_f1: 0.6786
 epoch: 95, train_loss: 0.5287, test_loss: 0.7619, test_f1: 0.6639
 epoch: 96, train_loss: 0.5226, test_loss: 0.7641, test_f1: 0.6930
 epoch: 97, train_loss: 0.5102, test_loss: 0.9981, test_f1: 0.6652
 epoch: 98, train_loss: 0.5074, test_loss: 0.7762, test_f1: 0.6766
 epoch: 99, train_loss: 0.5096, test_loss: 0.7916, test_f1: 0.6610
##################ITERATION #3 ****************************************
 epoch: 0, train_loss: 1.0885, test_loss: 1.0787, test_f1: 0.4246
 epoch: 1, train_loss: 1.0029, test_loss: 1.0537, test_f1: 0.4866
 epoch: 2, train_loss: 0.9799, test_loss: 0.9405, test_f1: 0.5052
 epoch: 3, train_loss: 0.9517, test_loss: 0.9692, test_f1: 0.5040
 epoch: 4, train_loss: 0.9229, test_loss: 1.2259, test_f1: 0.4038
 epoch: 5, train_loss: 0.9327, test_loss: 0.8888, test_f1: 0.5505
 epoch: 6, train_loss: 0.9063, test_loss: 0.9536, test_f1: 0.4725
 epoch: 7, train_loss: 0.8964, test_loss: 0.9024, test_f1: 0.5090
 epoch: 8, train_loss: 0.9082, test_loss: 0.8715, test_f1: 0.5480
 epoch: 9, train_loss: 0.8850, test_loss: 0.9692, test_f1: 0.5194
 epoch: 10, train_loss: 0.8624, test_loss: 0.9227, test_f1: 0.5645
 epoch: 11, train_loss: 0.8551, test_loss: 0.8626, test_f1: 0.5633
 epoch: 12, train_loss: 0.8527, test_loss: 0.9226, test_f1: 0.5276
 epoch: 13, train_loss: 0.8363, test_loss: 0.8031, test_f1: 0.5684
 epoch: 14, train_loss: 0.8391, test_loss: 0.7860, test_f1: 0.5392
 epoch: 15, train_loss: 0.8371, test_loss: 0.7682, test_f1: 0.5560
 epoch: 16, train_loss: 0.8205, test_loss: 0.7543, test_f1: 0.6163
 epoch: 17, train_loss: 0.8378, test_loss: 0.8042, test_f1: 0.6067
 epoch: 18, train_loss: 0.8054, test_loss: 0.8686, test_f1: 0.5818
 epoch: 19, train_loss: 0.7974, test_loss: 0.8300, test_f1: 0.5918
 epoch: 20, train_loss: 0.8067, test_loss: 0.8457, test_f1: 0.5988
 epoch: 21, train_loss: 0.8019, test_loss: 0.7851, test_f1: 0.6294
 epoch: 22, train_loss: 0.7893, test_loss: 0.8348, test_f1: 0.6247
 epoch: 23, train_loss: 0.7952, test_loss: 0.8414, test_f1: 0.6117
 epoch: 24, train_loss: 0.7887, test_loss: 0.8859, test_f1: 0.6198
 epoch: 25, train_loss: 0.7715, test_loss: 0.8290, test_f1: 0.6410
 epoch: 26, train_loss: 0.7617, test_loss: 0.8400, test_f1: 0.6136
 epoch: 27, train_loss: 0.7720, test_loss: 0.8100, test_f1: 0.6071
 epoch: 28, train_loss: 0.7876, test_loss: 0.9626, test_f1: 0.6033
 epoch: 29, train_loss: 0.7433, test_loss: 0.8604, test_f1: 0.6101
 epoch: 30, train_loss: 0.7562, test_loss: 0.7403, test_f1: 0.6056
 epoch: 31, train_loss: 0.7495, test_loss: 0.7853, test_f1: 0.6198
 epoch: 32, train_loss: 0.7122, test_loss: 0.7835, test_f1: 0.6347
 epoch: 33, train_loss: 0.8002, test_loss: 0.8185, test_f1: 0.5983
 epoch: 34, train_loss: 0.7614, test_loss: 0.7782, test_f1: 0.6473
 epoch: 35, train_loss: 0.7589, test_loss: 0.7768, test_f1: 0.6420
 epoch: 36, train_loss: 0.7392, test_loss: 0.7439, test_f1: 0.6301
 epoch: 37, train_loss: 0.7444, test_loss: 0.7546, test_f1: 0.6185
 epoch: 38, train_loss: 0.7152, test_loss: 0.8016, test_f1: 0.6328
 epoch: 39, train_loss: 0.7430, test_loss: 0.7428, test_f1: 0.5568
 epoch: 40, train_loss: 0.7158, test_loss: 0.7382, test_f1: 0.6231
 epoch: 41, train_loss: 0.7242, test_loss: 0.7872, test_f1: 0.5996
 epoch: 42, train_loss: 0.7192, test_loss: 0.8180, test_f1: 0.5991
 epoch: 43, train_loss: 0.7164, test_loss: 0.7501, test_f1: 0.6674
 epoch: 44, train_loss: 0.7037, test_loss: 0.7475, test_f1: 0.6302
 epoch: 45, train_loss: 0.6930, test_loss: 0.8396, test_f1: 0.6515
 epoch: 46, train_loss: 0.6869, test_loss: 0.7479, test_f1: 0.6431
 epoch: 47, train_loss: 0.6909, test_loss: 0.7279, test_f1: 0.6731
 epoch: 48, train_loss: 0.6808, test_loss: 0.8188, test_f1: 0.6487
 epoch: 49, train_loss: 0.6779, test_loss: 0.7914, test_f1: 0.6141
 epoch: 50, train_loss: 0.6609, test_loss: 0.8739, test_f1: 0.6066
 epoch: 51, train_loss: 0.6553, test_loss: 0.7855, test_f1: 0.6545
 epoch: 52, train_loss: 0.6268, test_loss: 0.8130, test_f1: 0.6924
 epoch: 53, train_loss: 0.6248, test_loss: 0.8497, test_f1: 0.6647
 epoch: 54, train_loss: 0.6250, test_loss: 0.8516, test_f1: 0.6664
 epoch: 55, train_loss: 0.5960, test_loss: 0.8226, test_f1: 0.6756
 epoch: 56, train_loss: 0.6051, test_loss: 0.8301, test_f1: 0.6798
 epoch: 57, train_loss: 0.6025, test_loss: 0.7929, test_f1: 0.6578
 epoch: 58, train_loss: 0.5930, test_loss: 0.8399, test_f1: 0.6667
 epoch: 59, train_loss: 0.6196, test_loss: 0.7925, test_f1: 0.6574
 epoch: 60, train_loss: 0.6029, test_loss: 0.8275, test_f1: 0.6489
 epoch: 61, train_loss: 0.6073, test_loss: 0.8517, test_f1: 0.6605
 epoch: 62, train_loss: 0.5847, test_loss: 0.8659, test_f1: 0.6737
 epoch: 63, train_loss: 0.5922, test_loss: 0.9782, test_f1: 0.6756
 epoch: 64, train_loss: 0.5952, test_loss: 0.9992, test_f1: 0.6748
 epoch: 65, train_loss: 0.5888, test_loss: 0.9667, test_f1: 0.6722
 epoch: 66, train_loss: 0.5948, test_loss: 0.9070, test_f1: 0.6865
 epoch: 67, train_loss: 0.5794, test_loss: 0.8844, test_f1: 0.6722
 epoch: 68, train_loss: 0.5824, test_loss: 1.0074, test_f1: 0.6813
 epoch: 69, train_loss: 0.5712, test_loss: 1.1114, test_f1: 0.6737
 epoch: 70, train_loss: 0.5612, test_loss: 0.9358, test_f1: 0.6724
 epoch: 71, train_loss: 0.5668, test_loss: 0.9005, test_f1: 0.6645
 epoch: 72, train_loss: 0.5698, test_loss: 0.7856, test_f1: 0.6715
 epoch: 73, train_loss: 0.5495, test_loss: 0.9066, test_f1: 0.6651
 epoch: 74, train_loss: 0.5554, test_loss: 0.8327, test_f1: 0.6708
 epoch: 75, train_loss: 0.5738, test_loss: 0.9992, test_f1: 0.6514
 epoch: 76, train_loss: 0.5638, test_loss: 0.7292, test_f1: 0.6667
 epoch: 77, train_loss: 0.5499, test_loss: 0.8944, test_f1: 0.6773
 epoch: 78, train_loss: 0.5633, test_loss: 0.8356, test_f1: 0.6603
 epoch: 79, train_loss: 0.5435, test_loss: 0.9023, test_f1: 0.6565
 epoch: 80, train_loss: 0.5488, test_loss: 0.9546, test_f1: 0.6607
 epoch: 81, train_loss: 0.5431, test_loss: 0.9401, test_f1: 0.6848
 epoch: 82, train_loss: 0.5461, test_loss: 0.8914, test_f1: 0.6646
 epoch: 83, train_loss: 0.5451, test_loss: 0.9978, test_f1: 0.6559
 epoch: 84, train_loss: 0.5360, test_loss: 0.8678, test_f1: 0.6822
 epoch: 85, train_loss: 0.5367, test_loss: 0.9628, test_f1: 0.6714
 epoch: 86, train_loss: 0.5445, test_loss: 0.9676, test_f1: 0.6812
 epoch: 87, train_loss: 0.5332, test_loss: 0.7716, test_f1: 0.6802
 epoch: 88, train_loss: 0.5256, test_loss: 0.9650, test_f1: 0.6837
 epoch: 89, train_loss: 0.5342, test_loss: 1.0407, test_f1: 0.6620
 epoch: 90, train_loss: 0.5423, test_loss: 1.0113, test_f1: 0.6800
 epoch: 91, train_loss: 0.5324, test_loss: 1.1052, test_f1: 0.6681
 epoch: 92, train_loss: 0.5100, test_loss: 0.9554, test_f1: 0.6739
 epoch: 93, train_loss: 0.5297, test_loss: 1.2681, test_f1: 0.6986
 epoch: 94, train_loss: 0.5499, test_loss: 0.9190, test_f1: 0.6616
 epoch: 95, train_loss: 0.5206, test_loss: 1.0097, test_f1: 0.7023
 epoch: 96, train_loss: 0.5301, test_loss: 1.0863, test_f1: 0.6615
 epoch: 97, train_loss: 0.5333, test_loss: 1.0091, test_f1: 0.6846
 epoch: 98, train_loss: 0.5235, test_loss: 1.0147, test_f1: 0.6759
 epoch: 99, train_loss: 0.5318, test_loss: 0.9378, test_f1: 0.6958
##################ITERATION #4 ****************************************
 epoch: 0, train_loss: 1.0945, test_loss: 1.1673, test_f1: 0.4152
 epoch: 1, train_loss: 0.9878, test_loss: 1.0236, test_f1: 0.5028
 epoch: 2, train_loss: 0.9645, test_loss: 0.9454, test_f1: 0.5278
 epoch: 3, train_loss: 0.9417, test_loss: 0.9278, test_f1: 0.4626
 epoch: 4, train_loss: 0.9346, test_loss: 0.9379, test_f1: 0.5225
 epoch: 5, train_loss: 0.9440, test_loss: 0.9736, test_f1: 0.4939
 epoch: 6, train_loss: 0.9185, test_loss: 0.9181, test_f1: 0.5054
 epoch: 7, train_loss: 0.9287, test_loss: 0.9089, test_f1: 0.5362
 epoch: 8, train_loss: 0.9039, test_loss: 0.9196, test_f1: 0.5298
 epoch: 9, train_loss: 0.8890, test_loss: 0.9567, test_f1: 0.5463
 epoch: 10, train_loss: 0.8744, test_loss: 0.9309, test_f1: 0.5428
 epoch: 11, train_loss: 0.8917, test_loss: 0.9509, test_f1: 0.5987
 epoch: 12, train_loss: 0.8768, test_loss: 0.8992, test_f1: 0.5169
 epoch: 13, train_loss: 0.8480, test_loss: 0.9647, test_f1: 0.4785
 epoch: 14, train_loss: 0.8504, test_loss: 1.0355, test_f1: 0.5133
 epoch: 15, train_loss: 0.8358, test_loss: 0.8685, test_f1: 0.5839
 epoch: 16, train_loss: 0.8401, test_loss: 1.0067, test_f1: 0.5017
 epoch: 17, train_loss: 0.8216, test_loss: 0.9125, test_f1: 0.5669
 epoch: 18, train_loss: 0.8201, test_loss: 0.8289, test_f1: 0.5617
 epoch: 19, train_loss: 0.8060, test_loss: 0.8786, test_f1: 0.5395
 epoch: 20, train_loss: 0.8058, test_loss: 0.8314, test_f1: 0.6045
 epoch: 21, train_loss: 0.8044, test_loss: 0.8044, test_f1: 0.5586
 epoch: 22, train_loss: 0.7828, test_loss: 0.8373, test_f1: 0.6122
 epoch: 23, train_loss: 0.7826, test_loss: 0.8666, test_f1: 0.5820
 epoch: 24, train_loss: 0.7886, test_loss: 0.8215, test_f1: 0.6359
 epoch: 25, train_loss: 0.7791, test_loss: 0.8980, test_f1: 0.6205
 epoch: 26, train_loss: 0.7757, test_loss: 0.7856, test_f1: 0.6037
 epoch: 27, train_loss: 0.7646, test_loss: 0.7783, test_f1: 0.5840
 epoch: 28, train_loss: 0.7697, test_loss: 1.0092, test_f1: 0.5704
 epoch: 29, train_loss: 0.7439, test_loss: 0.8707, test_f1: 0.6385
 epoch: 30, train_loss: 0.7350, test_loss: 0.8953, test_f1: 0.6150
 epoch: 31, train_loss: 0.7414, test_loss: 0.8811, test_f1: 0.6071
 epoch: 32, train_loss: 0.7357, test_loss: 0.8886, test_f1: 0.5917
 epoch: 33, train_loss: 0.7253, test_loss: 0.8488, test_f1: 0.6427
 epoch: 34, train_loss: 0.7387, test_loss: 0.9607, test_f1: 0.5891
 epoch: 35, train_loss: 0.7132, test_loss: 0.8706, test_f1: 0.5773
 epoch: 36, train_loss: 0.7476, test_loss: 0.9112, test_f1: 0.6327
 epoch: 37, train_loss: 0.7243, test_loss: 0.8753, test_f1: 0.6505
 epoch: 38, train_loss: 0.7079, test_loss: 0.8906, test_f1: 0.5649
 epoch: 39, train_loss: 0.7246, test_loss: 0.7480, test_f1: 0.6350
 epoch: 40, train_loss: 0.6973, test_loss: 1.0076, test_f1: 0.6159
 epoch: 41, train_loss: 0.6962, test_loss: 0.8170, test_f1: 0.7026
 epoch: 42, train_loss: 0.7094, test_loss: 0.7814, test_f1: 0.6053
 epoch: 43, train_loss: 0.7037, test_loss: 0.9278, test_f1: 0.6558
 epoch: 44, train_loss: 0.7211, test_loss: 0.8499, test_f1: 0.6657
 epoch: 45, train_loss: 0.7012, test_loss: 1.1751, test_f1: 0.5787
 epoch: 46, train_loss: 0.7012, test_loss: 1.0095, test_f1: 0.6051
 epoch: 47, train_loss: 0.6776, test_loss: 0.9709, test_f1: 0.6480
 epoch: 48, train_loss: 0.6947, test_loss: 0.7306, test_f1: 0.6453
 epoch: 49, train_loss: 0.6738, test_loss: 0.7832, test_f1: 0.6224
 epoch: 50, train_loss: 0.6792, test_loss: 0.8850, test_f1: 0.6271
 epoch: 51, train_loss: 0.6664, test_loss: 0.7859, test_f1: 0.6619
 epoch: 52, train_loss: 0.6319, test_loss: 0.8507, test_f1: 0.6652
 epoch: 53, train_loss: 0.6413, test_loss: 0.9783, test_f1: 0.6498
 epoch: 54, train_loss: 0.6277, test_loss: 0.7669, test_f1: 0.6734
 epoch: 55, train_loss: 0.6080, test_loss: 0.9887, test_f1: 0.6775
 epoch: 56, train_loss: 0.6117, test_loss: 0.8776, test_f1: 0.6752
 epoch: 57, train_loss: 0.6065, test_loss: 0.8744, test_f1: 0.6926
 epoch: 58, train_loss: 0.6007, test_loss: 1.0221, test_f1: 0.6674
 epoch: 59, train_loss: 0.5932, test_loss: 0.9599, test_f1: 0.6652
 epoch: 60, train_loss: 0.5818, test_loss: 0.9934, test_f1: 0.6313
 epoch: 61, train_loss: 0.5924, test_loss: 0.9331, test_f1: 0.6628
 epoch: 62, train_loss: 0.5757, test_loss: 1.0073, test_f1: 0.6601
 epoch: 63, train_loss: 0.5726, test_loss: 0.9694, test_f1: 0.6694
 epoch: 64, train_loss: 0.5840, test_loss: 0.9209, test_f1: 0.6715
 epoch: 65, train_loss: 0.5871, test_loss: 1.0602, test_f1: 0.6836
 epoch: 66, train_loss: 0.5737, test_loss: 0.9494, test_f1: 0.6828
 epoch: 67, train_loss: 0.5642, test_loss: 0.9364, test_f1: 0.6723
 epoch: 68, train_loss: 0.5417, test_loss: 1.0111, test_f1: 0.6661
 epoch: 69, train_loss: 0.5642, test_loss: 0.9557, test_f1: 0.6675
 epoch: 70, train_loss: 0.5570, test_loss: 1.0564, test_f1: 0.6634
 epoch: 71, train_loss: 0.5716, test_loss: 0.9558, test_f1: 0.6706
 epoch: 72, train_loss: 0.5912, test_loss: 0.9485, test_f1: 0.6773
 epoch: 73, train_loss: 0.5558, test_loss: 1.0336, test_f1: 0.6754
 epoch: 74, train_loss: 0.5613, test_loss: 0.9667, test_f1: 0.6518
 epoch: 75, train_loss: 0.5671, test_loss: 0.9605, test_f1: 0.6317
 epoch: 76, train_loss: 0.5520, test_loss: 0.9411, test_f1: 0.6824
 epoch: 77, train_loss: 0.5493, test_loss: 1.0120, test_f1: 0.6650
 epoch: 78, train_loss: 0.5221, test_loss: 0.9202, test_f1: 0.6700
 epoch: 79, train_loss: 0.5375, test_loss: 0.9232, test_f1: 0.6631
 epoch: 80, train_loss: 0.5290, test_loss: 1.0675, test_f1: 0.6909
 epoch: 81, train_loss: 0.5471, test_loss: 0.9555, test_f1: 0.6628
 epoch: 82, train_loss: 0.5350, test_loss: 1.0150, test_f1: 0.6697
 epoch: 83, train_loss: 0.5401, test_loss: 1.0889, test_f1: 0.6643
 epoch: 84, train_loss: 0.5314, test_loss: 0.8825, test_f1: 0.6529
 epoch: 85, train_loss: 0.5092, test_loss: 0.9541, test_f1: 0.6568
 epoch: 86, train_loss: 0.5191, test_loss: 1.0377, test_f1: 0.6461
 epoch: 87, train_loss: 0.5281, test_loss: 0.8472, test_f1: 0.6701
 epoch: 88, train_loss: 0.5182, test_loss: 0.9147, test_f1: 0.6596
 epoch: 89, train_loss: 0.5032, test_loss: 0.8932, test_f1: 0.6851
 epoch: 90, train_loss: 0.5087, test_loss: 0.8407, test_f1: 0.6807
 epoch: 91, train_loss: 0.5011, test_loss: 1.0831, test_f1: 0.6775
 epoch: 92, train_loss: 0.5173, test_loss: 0.9970, test_f1: 0.6635
 epoch: 93, train_loss: 0.5184, test_loss: 0.9627, test_f1: 0.6774
 epoch: 94, train_loss: 0.5068, test_loss: 1.0334, test_f1: 0.6530
 epoch: 95, train_loss: 0.4920, test_loss: 0.9652, test_f1: 0.6573
 epoch: 96, train_loss: 0.5061, test_loss: 0.8787, test_f1: 0.6782
 epoch: 97, train_loss: 0.4955, test_loss: 0.9122, test_f1: 0.6453
 epoch: 98, train_loss: 0.4976, test_loss: 0.9789, test_f1: 0.6700
 epoch: 99, train_loss: 0.5016, test_loss: 0.8816, test_f1: 0.6796
##################ITERATION #5 ****************************************
 epoch: 0, train_loss: 1.0767, test_loss: 1.1003, test_f1: 0.4971
 epoch: 1, train_loss: 0.9982, test_loss: 0.9628, test_f1: 0.5369
 epoch: 2, train_loss: 0.9543, test_loss: 0.9832, test_f1: 0.5450
 epoch: 3, train_loss: 0.9394, test_loss: 0.9538, test_f1: 0.4993
 epoch: 4, train_loss: 0.9232, test_loss: 0.8897, test_f1: 0.4925
 epoch: 5, train_loss: 0.9303, test_loss: 0.9469, test_f1: 0.5165
 epoch: 6, train_loss: 0.9170, test_loss: 0.8779, test_f1: 0.5594
 epoch: 7, train_loss: 0.9106, test_loss: 0.9128, test_f1: 0.4939
 epoch: 8, train_loss: 0.8993, test_loss: 0.8694, test_f1: 0.5346
 epoch: 9, train_loss: 0.8763, test_loss: 1.0351, test_f1: 0.5220
 epoch: 10, train_loss: 0.8795, test_loss: 0.9008, test_f1: 0.5403
 epoch: 11, train_loss: 0.8585, test_loss: 0.8633, test_f1: 0.5876
 epoch: 12, train_loss: 0.8659, test_loss: 0.9359, test_f1: 0.5304
 epoch: 13, train_loss: 0.8557, test_loss: 0.8650, test_f1: 0.5910
 epoch: 14, train_loss: 0.8535, test_loss: 0.8235, test_f1: 0.5906
 epoch: 15, train_loss: 0.8524, test_loss: 1.0182, test_f1: 0.4832
 epoch: 16, train_loss: 0.8363, test_loss: 0.8657, test_f1: 0.6218
 epoch: 17, train_loss: 0.8275, test_loss: 0.8341, test_f1: 0.5799
 epoch: 18, train_loss: 0.8120, test_loss: 0.8298, test_f1: 0.5983
 epoch: 19, train_loss: 0.8153, test_loss: 0.8461, test_f1: 0.6053
 epoch: 20, train_loss: 0.8018, test_loss: 0.8386, test_f1: 0.5434
 epoch: 21, train_loss: 0.8202, test_loss: 0.9420, test_f1: 0.6033
 epoch: 22, train_loss: 0.7981, test_loss: 0.8199, test_f1: 0.6214
 epoch: 23, train_loss: 0.7931, test_loss: 0.8275, test_f1: 0.6424
 epoch: 24, train_loss: 0.7966, test_loss: 0.8378, test_f1: 0.5604
 epoch: 25, train_loss: 0.7937, test_loss: 0.9010, test_f1: 0.5714
 epoch: 26, train_loss: 0.7761, test_loss: 0.9017, test_f1: 0.6161
 epoch: 27, train_loss: 0.7665, test_loss: 0.7864, test_f1: 0.6329
 epoch: 28, train_loss: 0.7671, test_loss: 0.8101, test_f1: 0.5881
 epoch: 29, train_loss: 0.7770, test_loss: 0.8049, test_f1: 0.6349
 epoch: 30, train_loss: 0.7904, test_loss: 0.8507, test_f1: 0.5997
 epoch: 31, train_loss: 0.7648, test_loss: 0.8441, test_f1: 0.6148
 epoch: 32, train_loss: 0.7548, test_loss: 0.9074, test_f1: 0.6374
 epoch: 33, train_loss: 0.7475, test_loss: 0.9028, test_f1: 0.6074
 epoch: 34, train_loss: 0.7553, test_loss: 0.8227, test_f1: 0.6079
 epoch: 35, train_loss: 0.7602, test_loss: 0.8450, test_f1: 0.6377
 epoch: 36, train_loss: 0.7616, test_loss: 0.7958, test_f1: 0.6194
 epoch: 37, train_loss: 0.7474, test_loss: 0.9162, test_f1: 0.5798
 epoch: 38, train_loss: 0.7555, test_loss: 0.7973, test_f1: 0.6344
 epoch: 39, train_loss: 0.7379, test_loss: 0.8122, test_f1: 0.6306
 epoch: 40, train_loss: 0.7242, test_loss: 0.8088, test_f1: 0.6645
 epoch: 41, train_loss: 0.7272, test_loss: 0.8754, test_f1: 0.6088
 epoch: 42, train_loss: 0.7399, test_loss: 0.9543, test_f1: 0.6337
 epoch: 43, train_loss: 0.7090, test_loss: 0.8048, test_f1: 0.6375
 epoch: 44, train_loss: 0.6972, test_loss: 0.9310, test_f1: 0.5718
 epoch: 45, train_loss: 0.7079, test_loss: 0.8759, test_f1: 0.6838
 epoch: 46, train_loss: 0.7077, test_loss: 0.9037, test_f1: 0.6386
 epoch: 47, train_loss: 0.7155, test_loss: 0.8346, test_f1: 0.6051
 epoch: 48, train_loss: 0.7229, test_loss: 0.8277, test_f1: 0.6560
 epoch: 49, train_loss: 0.7084, test_loss: 0.8277, test_f1: 0.6431
 epoch: 50, train_loss: 0.6965, test_loss: 0.9510, test_f1: 0.6080
 epoch: 51, train_loss: 0.6917, test_loss: 0.8892, test_f1: 0.6132
 epoch: 52, train_loss: 0.6372, test_loss: 0.8834, test_f1: 0.6723
 epoch: 53, train_loss: 0.6336, test_loss: 0.8956, test_f1: 0.6800
 epoch: 54, train_loss: 0.6256, test_loss: 0.8575, test_f1: 0.6653
 epoch: 55, train_loss: 0.6260, test_loss: 0.8565, test_f1: 0.6661
 epoch: 56, train_loss: 0.6122, test_loss: 0.8187, test_f1: 0.6700
 epoch: 57, train_loss: 0.6099, test_loss: 0.9032, test_f1: 0.6548
 epoch: 58, train_loss: 0.6096, test_loss: 0.9461, test_f1: 0.6527
 epoch: 59, train_loss: 0.6016, test_loss: 1.0157, test_f1: 0.6444
 epoch: 60, train_loss: 0.5967, test_loss: 0.9721, test_f1: 0.6491
 epoch: 61, train_loss: 0.6213, test_loss: 0.9773, test_f1: 0.6733
 epoch: 62, train_loss: 0.5988, test_loss: 0.9878, test_f1: 0.6695
 epoch: 63, train_loss: 0.6094, test_loss: 1.0081, test_f1: 0.6667
 epoch: 64, train_loss: 0.6112, test_loss: 1.1721, test_f1: 0.6240
 epoch: 65, train_loss: 0.5885, test_loss: 1.0510, test_f1: 0.6505
 epoch: 66, train_loss: 0.6355, test_loss: 0.8536, test_f1: 0.6543
 epoch: 67, train_loss: 0.5891, test_loss: 0.9093, test_f1: 0.6666
 epoch: 68, train_loss: 0.5805, test_loss: 0.9058, test_f1: 0.6381
 epoch: 69, train_loss: 0.5737, test_loss: 1.0095, test_f1: 0.6716
 epoch: 70, train_loss: 0.5734, test_loss: 1.1054, test_f1: 0.6543
 epoch: 71, train_loss: 0.5888, test_loss: 0.9695, test_f1: 0.6469
 epoch: 72, train_loss: 0.5624, test_loss: 0.9792, test_f1: 0.6606
 epoch: 73, train_loss: 0.5661, test_loss: 1.0884, test_f1: 0.6546
 epoch: 74, train_loss: 0.5553, test_loss: 1.0197, test_f1: 0.6637
 epoch: 75, train_loss: 0.5646, test_loss: 1.0949, test_f1: 0.6451
 epoch: 76, train_loss: 0.5353, test_loss: 1.0018, test_f1: 0.6442
 epoch: 77, train_loss: 0.5634, test_loss: 1.0399, test_f1: 0.6558
 epoch: 78, train_loss: 0.5550, test_loss: 1.1697, test_f1: 0.6626
 epoch: 79, train_loss: 0.5446, test_loss: 1.0181, test_f1: 0.6709
 epoch: 80, train_loss: 0.5588, test_loss: 0.9401, test_f1: 0.6429
 epoch: 81, train_loss: 0.5481, test_loss: 1.0947, test_f1: 0.6448
 epoch: 82, train_loss: 0.5590, test_loss: 0.9784, test_f1: 0.6304
 epoch: 83, train_loss: 0.5544, test_loss: 1.0460, test_f1: 0.6733
 epoch: 84, train_loss: 0.5437, test_loss: 1.0827, test_f1: 0.6603
 epoch: 85, train_loss: 0.5505, test_loss: 1.2044, test_f1: 0.6494
 epoch: 86, train_loss: 0.5343, test_loss: 1.0551, test_f1: 0.6643
 epoch: 87, train_loss: 0.5492, test_loss: 0.9538, test_f1: 0.6566
 epoch: 88, train_loss: 0.5373, test_loss: 1.1063, test_f1: 0.6392
 epoch: 89, train_loss: 0.5408, test_loss: 0.9832, test_f1: 0.6529
 epoch: 90, train_loss: 0.5362, test_loss: 1.0048, test_f1: 0.6585
 epoch: 91, train_loss: 0.5335, test_loss: 1.0381, test_f1: 0.6698
 epoch: 92, train_loss: 0.5458, test_loss: 1.0902, test_f1: 0.6717
 epoch: 93, train_loss: 0.5345, test_loss: 1.1649, test_f1: 0.6750
 epoch: 94, train_loss: 0.5178, test_loss: 1.0050, test_f1: 0.6689
 epoch: 95, train_loss: 0.5158, test_loss: 1.0447, test_f1: 0.6416
 epoch: 96, train_loss: 0.5250, test_loss: 1.0523, test_f1: 0.6472
 epoch: 97, train_loss: 0.5138, test_loss: 1.1653, test_f1: 0.6576
 epoch: 98, train_loss: 0.5012, test_loss: 1.1571, test_f1: 0.6508
 epoch: 99, train_loss: 0.5156, test_loss: 1.1278, test_f1: 0.6615
##################ITERATION #6 ****************************************
 epoch: 0, train_loss: 1.0941, test_loss: 1.5357, test_f1: 0.3124
 epoch: 1, train_loss: 1.0020, test_loss: 0.9837, test_f1: 0.4702
 epoch: 2, train_loss: 0.9814, test_loss: 0.9857, test_f1: 0.5173
 epoch: 3, train_loss: 0.9599, test_loss: 0.9662, test_f1: 0.4665
 epoch: 4, train_loss: 0.9541, test_loss: 0.9562, test_f1: 0.5500
 epoch: 5, train_loss: 0.9763, test_loss: 1.0624, test_f1: 0.4630
 epoch: 6, train_loss: 0.9388, test_loss: 0.9500, test_f1: 0.5646
 epoch: 7, train_loss: 0.9220, test_loss: 0.9655, test_f1: 0.5139
 epoch: 8, train_loss: 0.8940, test_loss: 0.8801, test_f1: 0.5599
 epoch: 9, train_loss: 0.8904, test_loss: 0.9165, test_f1: 0.5293
 epoch: 10, train_loss: 0.8587, test_loss: 0.9011, test_f1: 0.5704
 epoch: 11, train_loss: 0.8606, test_loss: 0.8743, test_f1: 0.5586
 epoch: 12, train_loss: 0.8627, test_loss: 0.9011, test_f1: 0.5066
 epoch: 13, train_loss: 0.8609, test_loss: 0.9600, test_f1: 0.5337
 epoch: 14, train_loss: 0.8496, test_loss: 0.9666, test_f1: 0.5436
 epoch: 15, train_loss: 0.8553, test_loss: 1.1202, test_f1: 0.5022
 epoch: 16, train_loss: 0.8898, test_loss: 0.8804, test_f1: 0.5826
 epoch: 17, train_loss: 0.8557, test_loss: 0.8586, test_f1: 0.5694
 epoch: 18, train_loss: 0.8293, test_loss: 0.9050, test_f1: 0.5257
 epoch: 19, train_loss: 0.8439, test_loss: 0.8459, test_f1: 0.6022
 epoch: 20, train_loss: 0.8158, test_loss: 0.8596, test_f1: 0.5976
 epoch: 21, train_loss: 0.8194, test_loss: 0.8586, test_f1: 0.6151
 epoch: 22, train_loss: 0.8171, test_loss: 0.8589, test_f1: 0.5653
 epoch: 23, train_loss: 0.7837, test_loss: 0.9129, test_f1: 0.5692
 epoch: 24, train_loss: 0.7818, test_loss: 0.9338, test_f1: 0.5722
 epoch: 25, train_loss: 0.7725, test_loss: 0.8391, test_f1: 0.5858
 epoch: 26, train_loss: 0.7632, test_loss: 0.8514, test_f1: 0.6107
 epoch: 27, train_loss: 0.7628, test_loss: 0.8123, test_f1: 0.6419
 epoch: 28, train_loss: 0.7756, test_loss: 0.8315, test_f1: 0.6435
 epoch: 29, train_loss: 0.7540, test_loss: 0.8418, test_f1: 0.6087
 epoch: 30, train_loss: 0.7413, test_loss: 0.8978, test_f1: 0.5685
 epoch: 31, train_loss: 0.7455, test_loss: 0.8068, test_f1: 0.6242
 epoch: 32, train_loss: 0.7582, test_loss: 0.8244, test_f1: 0.5783
 epoch: 33, train_loss: 0.7443, test_loss: 0.8822, test_f1: 0.6157
 epoch: 34, train_loss: 0.7602, test_loss: 0.8080, test_f1: 0.6317
 epoch: 35, train_loss: 0.7216, test_loss: 0.8224, test_f1: 0.6571
 epoch: 36, train_loss: 0.7232, test_loss: 0.9772, test_f1: 0.6699
 epoch: 37, train_loss: 0.7219, test_loss: 0.9134, test_f1: 0.6382
 epoch: 38, train_loss: 0.7293, test_loss: 0.8049, test_f1: 0.6346
 epoch: 39, train_loss: 0.7102, test_loss: 0.7765, test_f1: 0.6532
 epoch: 40, train_loss: 0.6913, test_loss: 0.8532, test_f1: 0.6277
 epoch: 41, train_loss: 0.7271, test_loss: 0.7692, test_f1: 0.6519
 epoch: 42, train_loss: 0.7003, test_loss: 0.8839, test_f1: 0.6342
 epoch: 43, train_loss: 0.7005, test_loss: 0.8875, test_f1: 0.6309
 epoch: 44, train_loss: 0.6919, test_loss: 0.8891, test_f1: 0.6453
 epoch: 45, train_loss: 0.7211, test_loss: 0.9483, test_f1: 0.6383
 epoch: 46, train_loss: 0.6837, test_loss: 1.0098, test_f1: 0.6476
 epoch: 47, train_loss: 0.6746, test_loss: 0.8086, test_f1: 0.6455
 epoch: 48, train_loss: 0.6787, test_loss: 0.7998, test_f1: 0.6527
 epoch: 49, train_loss: 0.6772, test_loss: 0.9645, test_f1: 0.6121
 epoch: 50, train_loss: 0.6833, test_loss: 0.9587, test_f1: 0.6213
 epoch: 51, train_loss: 0.6644, test_loss: 1.0938, test_f1: 0.6589
 epoch: 52, train_loss: 0.6427, test_loss: 0.7842, test_f1: 0.7065
 epoch: 53, train_loss: 0.6153, test_loss: 0.9297, test_f1: 0.6429
 epoch: 54, train_loss: 0.6097, test_loss: 0.9291, test_f1: 0.6786
 epoch: 55, train_loss: 0.5932, test_loss: 0.9254, test_f1: 0.6794
 epoch: 56, train_loss: 0.5988, test_loss: 1.0394, test_f1: 0.6431
 epoch: 57, train_loss: 0.5937, test_loss: 0.9419, test_f1: 0.6850
 epoch: 58, train_loss: 0.6018, test_loss: 0.9229, test_f1: 0.6838
 epoch: 59, train_loss: 0.5885, test_loss: 0.8159, test_f1: 0.6739
 epoch: 60, train_loss: 0.5976, test_loss: 0.8950, test_f1: 0.6671
 epoch: 61, train_loss: 0.6050, test_loss: 0.8412, test_f1: 0.6690
 epoch: 62, train_loss: 0.5844, test_loss: 0.8251, test_f1: 0.6735
 epoch: 63, train_loss: 0.5819, test_loss: 0.8221, test_f1: 0.6675
 epoch: 64, train_loss: 0.5653, test_loss: 0.9698, test_f1: 0.6711
 epoch: 65, train_loss: 0.5824, test_loss: 0.9822, test_f1: 0.6707
 epoch: 66, train_loss: 0.5928, test_loss: 1.1105, test_f1: 0.6646
 epoch: 67, train_loss: 0.5587, test_loss: 1.0029, test_f1: 0.6525
 epoch: 68, train_loss: 0.5664, test_loss: 0.8726, test_f1: 0.6683
 epoch: 69, train_loss: 0.5575, test_loss: 1.0022, test_f1: 0.6612
 epoch: 70, train_loss: 0.5601, test_loss: 0.9966, test_f1: 0.6755
 epoch: 71, train_loss: 0.5551, test_loss: 1.0141, test_f1: 0.6652
 epoch: 72, train_loss: 0.5502, test_loss: 1.0279, test_f1: 0.6613
 epoch: 73, train_loss: 0.5302, test_loss: 1.0137, test_f1: 0.6715
 epoch: 74, train_loss: 0.5563, test_loss: 0.8939, test_f1: 0.6583
 epoch: 75, train_loss: 0.5422, test_loss: 0.8737, test_f1: 0.6785
 epoch: 76, train_loss: 0.5434, test_loss: 1.0071, test_f1: 0.6772
 epoch: 77, train_loss: 0.5374, test_loss: 0.9804, test_f1: 0.6593
 epoch: 78, train_loss: 0.5329, test_loss: 0.9255, test_f1: 0.6880
 epoch: 79, train_loss: 0.5603, test_loss: 1.0414, test_f1: 0.6749
 epoch: 80, train_loss: 0.5355, test_loss: 0.9812, test_f1: 0.6788
 epoch: 81, train_loss: 0.5410, test_loss: 1.0468, test_f1: 0.6535
 epoch: 82, train_loss: 0.5204, test_loss: 1.0441, test_f1: 0.6851
 epoch: 83, train_loss: 0.5149, test_loss: 1.0922, test_f1: 0.6568
 epoch: 84, train_loss: 0.5299, test_loss: 1.1894, test_f1: 0.6562
 epoch: 85, train_loss: 0.5134, test_loss: 1.1853, test_f1: 0.6650
 epoch: 86, train_loss: 0.5382, test_loss: 1.1494, test_f1: 0.6687
 epoch: 87, train_loss: 0.5275, test_loss: 1.1776, test_f1: 0.6447
 epoch: 88, train_loss: 0.5347, test_loss: 1.2106, test_f1: 0.6435
 epoch: 89, train_loss: 0.5341, test_loss: 1.0867, test_f1: 0.6662
 epoch: 90, train_loss: 0.5262, test_loss: 1.1304, test_f1: 0.6581
 epoch: 91, train_loss: 0.5013, test_loss: 1.0623, test_f1: 0.6838
 epoch: 92, train_loss: 0.5163, test_loss: 1.2324, test_f1: 0.6609
 epoch: 93, train_loss: 0.5127, test_loss: 1.1396, test_f1: 0.6782
 epoch: 94, train_loss: 0.5168, test_loss: 1.1551, test_f1: 0.6504
 epoch: 95, train_loss: 0.5358, test_loss: 1.0010, test_f1: 0.6618
 epoch: 96, train_loss: 0.5148, test_loss: 1.0485, test_f1: 0.6818
 epoch: 97, train_loss: 0.4927, test_loss: 1.0905, test_f1: 0.6779
 epoch: 98, train_loss: 0.5075, test_loss: 0.8985, test_f1: 0.6635
 epoch: 99, train_loss: 0.4878, test_loss: 1.0930, test_f1: 0.6726
##################ITERATION #7 ****************************************
 epoch: 0, train_loss: 1.1152, test_loss: 1.0859, test_f1: 0.4722
 epoch: 1, train_loss: 1.0061, test_loss: 1.0989, test_f1: 0.5241
 epoch: 2, train_loss: 0.9842, test_loss: 1.0722, test_f1: 0.4822
 epoch: 3, train_loss: 0.9530, test_loss: 0.9871, test_f1: 0.5239
 epoch: 4, train_loss: 0.9474, test_loss: 0.9490, test_f1: 0.5316
 epoch: 5, train_loss: 0.9233, test_loss: 1.0383, test_f1: 0.4587
 epoch: 6, train_loss: 0.9386, test_loss: 0.9222, test_f1: 0.5109
 epoch: 7, train_loss: 0.9139, test_loss: 0.9318, test_f1: 0.5356
 epoch: 8, train_loss: 0.9221, test_loss: 0.9777, test_f1: 0.5862
 epoch: 9, train_loss: 0.8940, test_loss: 0.8720, test_f1: 0.5581
 epoch: 10, train_loss: 0.8833, test_loss: 0.9438, test_f1: 0.5434
 epoch: 11, train_loss: 0.8724, test_loss: 1.0058, test_f1: 0.5733
 epoch: 12, train_loss: 0.8745, test_loss: 0.9521, test_f1: 0.5722
 epoch: 13, train_loss: 0.8581, test_loss: 0.9432, test_f1: 0.5674
 epoch: 14, train_loss: 0.8543, test_loss: 0.9234, test_f1: 0.5824
 epoch: 15, train_loss: 0.8494, test_loss: 1.0460, test_f1: 0.5706
 epoch: 16, train_loss: 0.8561, test_loss: 0.8493, test_f1: 0.5836
 epoch: 17, train_loss: 0.8357, test_loss: 0.9791, test_f1: 0.5440
 epoch: 18, train_loss: 0.8365, test_loss: 0.8723, test_f1: 0.5834
 epoch: 19, train_loss: 0.8260, test_loss: 0.8835, test_f1: 0.5642
 epoch: 20, train_loss: 0.8118, test_loss: 0.9055, test_f1: 0.6407
 epoch: 21, train_loss: 0.8003, test_loss: 0.9000, test_f1: 0.6333
 epoch: 22, train_loss: 0.7892, test_loss: 0.9707, test_f1: 0.6281
 epoch: 23, train_loss: 0.7697, test_loss: 1.0672, test_f1: 0.6110
 epoch: 24, train_loss: 0.7939, test_loss: 0.8407, test_f1: 0.5994
 epoch: 25, train_loss: 0.7913, test_loss: 1.1029, test_f1: 0.6039
 epoch: 26, train_loss: 0.8383, test_loss: 1.1432, test_f1: 0.5395
 epoch: 27, train_loss: 0.7687, test_loss: 1.0005, test_f1: 0.5811
 epoch: 28, train_loss: 0.7604, test_loss: 1.0508, test_f1: 0.5971
 epoch: 29, train_loss: 0.7494, test_loss: 1.0006, test_f1: 0.6161
 epoch: 30, train_loss: 0.7366, test_loss: 0.9683, test_f1: 0.6445
 epoch: 31, train_loss: 0.7798, test_loss: 1.0263, test_f1: 0.6260
 epoch: 32, train_loss: 0.7521, test_loss: 0.9159, test_f1: 0.6366
 epoch: 33, train_loss: 0.7402, test_loss: 0.9839, test_f1: 0.6457
 epoch: 34, train_loss: 0.7473, test_loss: 1.0074, test_f1: 0.6229
 epoch: 35, train_loss: 0.7321, test_loss: 0.9733, test_f1: 0.6108
 epoch: 36, train_loss: 0.7439, test_loss: 0.9583, test_f1: 0.6028
 epoch: 37, train_loss: 0.7225, test_loss: 0.9718, test_f1: 0.6561
 epoch: 38, train_loss: 0.7057, test_loss: 1.0233, test_f1: 0.6134
 epoch: 39, train_loss: 0.7240, test_loss: 1.0961, test_f1: 0.6588
 epoch: 40, train_loss: 0.7023, test_loss: 1.0046, test_f1: 0.5879
 epoch: 41, train_loss: 0.7110, test_loss: 0.9777, test_f1: 0.6411
 epoch: 42, train_loss: 0.6943, test_loss: 0.9485, test_f1: 0.6656
 epoch: 43, train_loss: 0.7198, test_loss: 0.9951, test_f1: 0.6054
 epoch: 44, train_loss: 0.6953, test_loss: 0.8897, test_f1: 0.6433
 epoch: 45, train_loss: 0.6942, test_loss: 0.9153, test_f1: 0.6056
 epoch: 46, train_loss: 0.6823, test_loss: 0.9899, test_f1: 0.6506
 epoch: 47, train_loss: 0.7016, test_loss: 0.9435, test_f1: 0.6397
 epoch: 48, train_loss: 0.6766, test_loss: 0.9523, test_f1: 0.6448
 epoch: 49, train_loss: 0.6869, test_loss: 1.0068, test_f1: 0.6267
 epoch: 50, train_loss: 0.6745, test_loss: 0.9226, test_f1: 0.6124
 epoch: 51, train_loss: 0.6449, test_loss: 1.0119, test_f1: 0.6521
 epoch: 52, train_loss: 0.6357, test_loss: 1.0418, test_f1: 0.6319
 epoch: 53, train_loss: 0.6206, test_loss: 1.0032, test_f1: 0.6746
 epoch: 54, train_loss: 0.6118, test_loss: 0.9565, test_f1: 0.6503
 epoch: 55, train_loss: 0.6154, test_loss: 1.0918, test_f1: 0.6666
 epoch: 56, train_loss: 0.5943, test_loss: 0.9698, test_f1: 0.6611
 epoch: 57, train_loss: 0.6084, test_loss: 0.9356, test_f1: 0.6661
 epoch: 58, train_loss: 0.5905, test_loss: 1.0299, test_f1: 0.6472
 epoch: 59, train_loss: 0.5792, test_loss: 1.1501, test_f1: 0.6457
 epoch: 60, train_loss: 0.5961, test_loss: 1.1051, test_f1: 0.6529
 epoch: 61, train_loss: 0.5908, test_loss: 1.0598, test_f1: 0.6678
 epoch: 62, train_loss: 0.5782, test_loss: 0.9315, test_f1: 0.6579
 epoch: 63, train_loss: 0.5708, test_loss: 0.9909, test_f1: 0.6834
 epoch: 64, train_loss: 0.5654, test_loss: 1.0375, test_f1: 0.6641
 epoch: 65, train_loss: 0.5818, test_loss: 1.0489, test_f1: 0.6777
 epoch: 66, train_loss: 0.5607, test_loss: 1.1443, test_f1: 0.6474
 epoch: 67, train_loss: 0.5839, test_loss: 1.0342, test_f1: 0.6551
 epoch: 68, train_loss: 0.5795, test_loss: 1.1049, test_f1: 0.6533
 epoch: 69, train_loss: 0.5489, test_loss: 1.1667, test_f1: 0.6569
 epoch: 70, train_loss: 0.5691, test_loss: 1.0660, test_f1: 0.6344
 epoch: 71, train_loss: 0.5544, test_loss: 1.1048, test_f1: 0.6623
 epoch: 72, train_loss: 0.5522, test_loss: 1.0878, test_f1: 0.6802
 epoch: 73, train_loss: 0.5662, test_loss: 1.0192, test_f1: 0.6592
 epoch: 74, train_loss: 0.5571, test_loss: 1.0467, test_f1: 0.6524
 epoch: 75, train_loss: 0.5515, test_loss: 1.0818, test_f1: 0.6791
 epoch: 76, train_loss: 0.5383, test_loss: 1.1656, test_f1: 0.6391
 epoch: 77, train_loss: 0.5419, test_loss: 1.1510, test_f1: 0.6869
 epoch: 78, train_loss: 0.5524, test_loss: 1.0621, test_f1: 0.6800
 epoch: 79, train_loss: 0.5605, test_loss: 1.0896, test_f1: 0.6580
 epoch: 80, train_loss: 0.5437, test_loss: 1.2502, test_f1: 0.6671
 epoch: 81, train_loss: 0.5320, test_loss: 1.2458, test_f1: 0.6660
 epoch: 82, train_loss: 0.5354, test_loss: 1.1439, test_f1: 0.6361
 epoch: 83, train_loss: 0.5426, test_loss: 1.1591, test_f1: 0.6730
 epoch: 84, train_loss: 0.5354, test_loss: 1.1764, test_f1: 0.6697
 epoch: 85, train_loss: 0.5298, test_loss: 1.0758, test_f1: 0.6872
 epoch: 86, train_loss: 0.5449, test_loss: 1.1715, test_f1: 0.6596
 epoch: 87, train_loss: 0.5348, test_loss: 1.0426, test_f1: 0.6612
 epoch: 88, train_loss: 0.5262, test_loss: 1.1215, test_f1: 0.6599
 epoch: 89, train_loss: 0.5046, test_loss: 1.1968, test_f1: 0.6799
 epoch: 90, train_loss: 0.5223, test_loss: 1.1397, test_f1: 0.6733
 epoch: 91, train_loss: 0.5277, test_loss: 1.1230, test_f1: 0.6616
 epoch: 92, train_loss: 0.5035, test_loss: 1.2844, test_f1: 0.6540
 epoch: 93, train_loss: 0.5101, test_loss: 1.0648, test_f1: 0.6719
 epoch: 94, train_loss: 0.5192, test_loss: 1.1580, test_f1: 0.6592
 epoch: 95, train_loss: 0.5103, test_loss: 1.1492, test_f1: 0.6721
 epoch: 96, train_loss: 0.5029, test_loss: 1.1994, test_f1: 0.6451
 epoch: 97, train_loss: 0.5039, test_loss: 1.3133, test_f1: 0.6647
 epoch: 98, train_loss: 0.4936, test_loss: 1.3334, test_f1: 0.6510
 epoch: 99, train_loss: 0.4832, test_loss: 1.2140, test_f1: 0.6742
##################ITERATION #8 ****************************************
 epoch: 0, train_loss: 1.1266, test_loss: 1.0175, test_f1: 0.4646
 epoch: 1, train_loss: 1.0152, test_loss: 0.9657, test_f1: 0.5162
 epoch: 2, train_loss: 0.9634, test_loss: 1.0124, test_f1: 0.5003
 epoch: 3, train_loss: 0.9554, test_loss: 0.9656, test_f1: 0.5234
 epoch: 4, train_loss: 0.9593, test_loss: 0.9504, test_f1: 0.5345
 epoch: 5, train_loss: 0.9267, test_loss: 0.9624, test_f1: 0.5109
 epoch: 6, train_loss: 0.9108, test_loss: 0.9034, test_f1: 0.5271
 epoch: 7, train_loss: 0.9069, test_loss: 0.9337, test_f1: 0.5201
 epoch: 8, train_loss: 0.8880, test_loss: 1.0075, test_f1: 0.4923
 epoch: 9, train_loss: 0.8949, test_loss: 1.0150, test_f1: 0.4275
 epoch: 10, train_loss: 0.8955, test_loss: 0.8419, test_f1: 0.5934
 epoch: 11, train_loss: 0.8726, test_loss: 0.8329, test_f1: 0.5510
 epoch: 12, train_loss: 0.8871, test_loss: 0.8247, test_f1: 0.5534
 epoch: 13, train_loss: 0.8611, test_loss: 0.8853, test_f1: 0.5374
 epoch: 14, train_loss: 0.8448, test_loss: 0.8440, test_f1: 0.5643
 epoch: 15, train_loss: 0.8273, test_loss: 0.8093, test_f1: 0.5705
 epoch: 16, train_loss: 0.8252, test_loss: 0.8818, test_f1: 0.5978
 epoch: 17, train_loss: 0.8340, test_loss: 0.7815, test_f1: 0.5559
 epoch: 18, train_loss: 0.8052, test_loss: 0.8558, test_f1: 0.5872
 epoch: 19, train_loss: 0.8055, test_loss: 0.9059, test_f1: 0.5390
 epoch: 20, train_loss: 0.8048, test_loss: 0.8673, test_f1: 0.6264
 epoch: 21, train_loss: 0.8112, test_loss: 0.7811, test_f1: 0.6177
 epoch: 22, train_loss: 0.7939, test_loss: 0.8441, test_f1: 0.5920
 epoch: 23, train_loss: 0.7919, test_loss: 0.8824, test_f1: 0.5484
 epoch: 24, train_loss: 0.7808, test_loss: 0.8322, test_f1: 0.6119
 epoch: 25, train_loss: 0.7648, test_loss: 0.9113, test_f1: 0.6072
 epoch: 26, train_loss: 0.7665, test_loss: 0.9558, test_f1: 0.6034
 epoch: 27, train_loss: 0.7621, test_loss: 0.9811, test_f1: 0.5782
 epoch: 28, train_loss: 0.7669, test_loss: 0.9060, test_f1: 0.5648
 epoch: 29, train_loss: 0.7653, test_loss: 0.9294, test_f1: 0.5696
 epoch: 30, train_loss: 0.7618, test_loss: 0.8393, test_f1: 0.6076
 epoch: 31, train_loss: 0.7290, test_loss: 0.9540, test_f1: 0.5910
 epoch: 32, train_loss: 0.7604, test_loss: 0.9160, test_f1: 0.6124
 epoch: 33, train_loss: 0.7463, test_loss: 0.8770, test_f1: 0.6111
 epoch: 34, train_loss: 0.7347, test_loss: 0.8867, test_f1: 0.6364
 epoch: 35, train_loss: 0.7444, test_loss: 0.9193, test_f1: 0.6280
 epoch: 36, train_loss: 0.7224, test_loss: 0.8625, test_f1: 0.5970
 epoch: 37, train_loss: 0.7278, test_loss: 0.8648, test_f1: 0.6113
 epoch: 38, train_loss: 0.7620, test_loss: 1.1313, test_f1: 0.5739
 epoch: 39, train_loss: 0.7255, test_loss: 0.8161, test_f1: 0.6120
 epoch: 40, train_loss: 0.7259, test_loss: 0.9669, test_f1: 0.6314
 epoch: 41, train_loss: 0.6998, test_loss: 0.9032, test_f1: 0.6171
 epoch: 42, train_loss: 0.7687, test_loss: 0.9962, test_f1: 0.6300
 epoch: 43, train_loss: 0.7190, test_loss: 0.8829, test_f1: 0.6102
 epoch: 44, train_loss: 0.7142, test_loss: 0.8968, test_f1: 0.5872
 epoch: 45, train_loss: 0.7020, test_loss: 0.9216, test_f1: 0.6500
 epoch: 46, train_loss: 0.6877, test_loss: 0.8863, test_f1: 0.6503
 epoch: 47, train_loss: 0.6962, test_loss: 0.9789, test_f1: 0.5831
 epoch: 48, train_loss: 0.6899, test_loss: 0.8762, test_f1: 0.6047
 epoch: 49, train_loss: 0.6765, test_loss: 0.8543, test_f1: 0.6238
 epoch: 50, train_loss: 0.6764, test_loss: 0.9655, test_f1: 0.6234
 epoch: 51, train_loss: 0.6327, test_loss: 0.8941, test_f1: 0.6303
 epoch: 52, train_loss: 0.6407, test_loss: 0.9131, test_f1: 0.6340
 epoch: 53, train_loss: 0.6242, test_loss: 0.9437, test_f1: 0.6472
 epoch: 54, train_loss: 0.6512, test_loss: 0.8702, test_f1: 0.6642
 epoch: 55, train_loss: 0.6114, test_loss: 0.9523, test_f1: 0.6635
 epoch: 56, train_loss: 0.6189, test_loss: 0.8986, test_f1: 0.6506
 epoch: 57, train_loss: 0.6166, test_loss: 0.9665, test_f1: 0.6258
 epoch: 58, train_loss: 0.6485, test_loss: 0.9999, test_f1: 0.6588
 epoch: 59, train_loss: 0.6242, test_loss: 0.9572, test_f1: 0.6478
 epoch: 60, train_loss: 0.6173, test_loss: 0.8729, test_f1: 0.6569
 epoch: 61, train_loss: 0.6097, test_loss: 1.0522, test_f1: 0.6501
 epoch: 62, train_loss: 0.6130, test_loss: 0.7685, test_f1: 0.6651
 epoch: 63, train_loss: 0.6016, test_loss: 0.9579, test_f1: 0.6529
 epoch: 64, train_loss: 0.6058, test_loss: 0.9720, test_f1: 0.6667
 epoch: 65, train_loss: 0.5847, test_loss: 0.8638, test_f1: 0.6541
 epoch: 66, train_loss: 0.5816, test_loss: 0.9937, test_f1: 0.6511
 epoch: 67, train_loss: 0.5902, test_loss: 0.9296, test_f1: 0.6485
 epoch: 68, train_loss: 0.5909, test_loss: 1.1611, test_f1: 0.6696
 epoch: 69, train_loss: 0.5901, test_loss: 0.9680, test_f1: 0.6704
 epoch: 70, train_loss: 0.5831, test_loss: 1.0835, test_f1: 0.6664
 epoch: 71, train_loss: 0.5890, test_loss: 1.0568, test_f1: 0.6913
 epoch: 72, train_loss: 0.5824, test_loss: 1.0278, test_f1: 0.6657
 epoch: 73, train_loss: 0.5806, test_loss: 1.1232, test_f1: 0.6589
 epoch: 74, train_loss: 0.5690, test_loss: 1.1062, test_f1: 0.6632
 epoch: 75, train_loss: 0.5699, test_loss: 1.1820, test_f1: 0.6523
 epoch: 76, train_loss: 0.5825, test_loss: 1.1331, test_f1: 0.6730
 epoch: 77, train_loss: 0.5995, test_loss: 1.0733, test_f1: 0.6524
 epoch: 78, train_loss: 0.5699, test_loss: 1.0379, test_f1: 0.6629
 epoch: 79, train_loss: 0.5576, test_loss: 1.1477, test_f1: 0.6688
 epoch: 80, train_loss: 0.5682, test_loss: 1.1708, test_f1: 0.6656
 epoch: 81, train_loss: 0.5654, test_loss: 1.2933, test_f1: 0.6750
 epoch: 82, train_loss: 0.5582, test_loss: 1.0186, test_f1: 0.6664
 epoch: 83, train_loss: 0.5496, test_loss: 1.0355, test_f1: 0.6670
 epoch: 84, train_loss: 0.5474, test_loss: 1.1282, test_f1: 0.6396
 epoch: 85, train_loss: 0.5481, test_loss: 1.1389, test_f1: 0.6747
 epoch: 86, train_loss: 0.5745, test_loss: 1.0374, test_f1: 0.6619
 epoch: 87, train_loss: 0.5437, test_loss: 1.0751, test_f1: 0.6734
 epoch: 88, train_loss: 0.5453, test_loss: 1.0054, test_f1: 0.6626
 epoch: 89, train_loss: 0.5558, test_loss: 1.0553, test_f1: 0.6857
 epoch: 90, train_loss: 0.5447, test_loss: 1.2560, test_f1: 0.6834
 epoch: 91, train_loss: 0.5608, test_loss: 1.0590, test_f1: 0.6821
 epoch: 92, train_loss: 0.5435, test_loss: 0.9411, test_f1: 0.6579
 epoch: 93, train_loss: 0.5539, test_loss: 1.0578, test_f1: 0.6853
 epoch: 94, train_loss: 0.5343, test_loss: 1.2028, test_f1: 0.6707
 epoch: 95, train_loss: 0.5563, test_loss: 1.1420, test_f1: 0.6886
 epoch: 96, train_loss: 0.5287, test_loss: 1.0942, test_f1: 0.6726
 epoch: 97, train_loss: 0.5391, test_loss: 0.9774, test_f1: 0.6726
 epoch: 98, train_loss: 0.5321, test_loss: 0.9589, test_f1: 0.6721
 epoch: 99, train_loss: 0.5173, test_loss: 1.0365, test_f1: 0.7006
##################ITERATION #9 ****************************************
 epoch: 0, train_loss: 1.1264, test_loss: 1.0957, test_f1: 0.4638
 epoch: 1, train_loss: 0.9856, test_loss: 1.0368, test_f1: 0.4590
 epoch: 2, train_loss: 0.9424, test_loss: 1.0565, test_f1: 0.5301
 epoch: 3, train_loss: 0.9483, test_loss: 0.9916, test_f1: 0.4891
 epoch: 4, train_loss: 0.9456, test_loss: 0.9601, test_f1: 0.4932
 epoch: 5, train_loss: 0.9241, test_loss: 0.9698, test_f1: 0.5230
 epoch: 6, train_loss: 0.8968, test_loss: 0.8738, test_f1: 0.5328
 epoch: 7, train_loss: 0.8826, test_loss: 0.9173, test_f1: 0.5349
 epoch: 8, train_loss: 0.8831, test_loss: 0.8984, test_f1: 0.5256
 epoch: 9, train_loss: 0.8867, test_loss: 0.8721, test_f1: 0.5380
 epoch: 10, train_loss: 0.8650, test_loss: 0.8180, test_f1: 0.5465
 epoch: 11, train_loss: 0.8539, test_loss: 0.9103, test_f1: 0.5727
 epoch: 12, train_loss: 0.8461, test_loss: 0.8471, test_f1: 0.6304
 epoch: 13, train_loss: 0.8336, test_loss: 0.8611, test_f1: 0.5946
 epoch: 14, train_loss: 0.8301, test_loss: 0.8858, test_f1: 0.5573
 epoch: 15, train_loss: 0.8223, test_loss: 0.9082, test_f1: 0.5595
 epoch: 16, train_loss: 0.8748, test_loss: 0.7871, test_f1: 0.5522
 epoch: 17, train_loss: 0.8301, test_loss: 0.8390, test_f1: 0.6015
 epoch: 18, train_loss: 0.8135, test_loss: 0.8434, test_f1: 0.6161
 epoch: 19, train_loss: 0.8004, test_loss: 0.7955, test_f1: 0.6198
 epoch: 20, train_loss: 0.7995, test_loss: 0.7980, test_f1: 0.5930
 epoch: 21, train_loss: 0.7947, test_loss: 0.8635, test_f1: 0.6239
 epoch: 22, train_loss: 0.7818, test_loss: 0.7755, test_f1: 0.6303
 epoch: 23, train_loss: 0.7811, test_loss: 0.7956, test_f1: 0.6506
 epoch: 24, train_loss: 0.7785, test_loss: 0.8368, test_f1: 0.6418
 epoch: 25, train_loss: 0.7829, test_loss: 0.8360, test_f1: 0.5983
 epoch: 26, train_loss: 0.7787, test_loss: 0.7722, test_f1: 0.6373
 epoch: 27, train_loss: 0.7784, test_loss: 0.8202, test_f1: 0.6328
 epoch: 28, train_loss: 0.7606, test_loss: 0.8423, test_f1: 0.6533
 epoch: 29, train_loss: 0.7454, test_loss: 0.8346, test_f1: 0.6270
 epoch: 30, train_loss: 0.7458, test_loss: 0.8621, test_f1: 0.6463
 epoch: 31, train_loss: 0.7448, test_loss: 0.9458, test_f1: 0.5571
 epoch: 32, train_loss: 0.7618, test_loss: 0.8545, test_f1: 0.6488
 epoch: 33, train_loss: 0.7481, test_loss: 0.8123, test_f1: 0.6252
 epoch: 34, train_loss: 0.7446, test_loss: 0.8129, test_f1: 0.6024
 epoch: 35, train_loss: 0.7448, test_loss: 0.7845, test_f1: 0.6467
 epoch: 36, train_loss: 0.7186, test_loss: 0.7942, test_f1: 0.6271
 epoch: 37, train_loss: 0.7421, test_loss: 0.8690, test_f1: 0.5815
 epoch: 38, train_loss: 0.7216, test_loss: 0.8189, test_f1: 0.6540
 epoch: 39, train_loss: 0.7264, test_loss: 0.8517, test_f1: 0.6229
 epoch: 40, train_loss: 0.7264, test_loss: 0.9802, test_f1: 0.5978
 epoch: 41, train_loss: 0.7094, test_loss: 0.9307, test_f1: 0.5859
 epoch: 42, train_loss: 0.7096, test_loss: 0.8400, test_f1: 0.6431
 epoch: 43, train_loss: 0.6961, test_loss: 0.7800, test_f1: 0.5909
 epoch: 44, train_loss: 0.7024, test_loss: 0.8838, test_f1: 0.6188
 epoch: 45, train_loss: 0.6728, test_loss: 0.8671, test_f1: 0.6402
 epoch: 46, train_loss: 0.6892, test_loss: 0.8144, test_f1: 0.6676
 epoch: 47, train_loss: 0.6831, test_loss: 0.8616, test_f1: 0.6540
 epoch: 48, train_loss: 0.6666, test_loss: 0.9028, test_f1: 0.6270
 epoch: 49, train_loss: 0.6895, test_loss: 0.8141, test_f1: 0.6610
 epoch: 50, train_loss: 0.6710, test_loss: 0.9604, test_f1: 0.5845
 epoch: 51, train_loss: 0.6431, test_loss: 0.8322, test_f1: 0.6747
 epoch: 52, train_loss: 0.6150, test_loss: 0.8610, test_f1: 0.6538
 epoch: 53, train_loss: 0.6188, test_loss: 0.8784, test_f1: 0.6601
 epoch: 54, train_loss: 0.6248, test_loss: 0.8937, test_f1: 0.6362
 epoch: 55, train_loss: 0.6137, test_loss: 0.8281, test_f1: 0.6759
 epoch: 56, train_loss: 0.5973, test_loss: 0.9442, test_f1: 0.6666
 epoch: 57, train_loss: 0.5977, test_loss: 0.8869, test_f1: 0.6690
 epoch: 58, train_loss: 0.5972, test_loss: 0.8807, test_f1: 0.6770
 epoch: 59, train_loss: 0.6073, test_loss: 0.8049, test_f1: 0.6708
 epoch: 60, train_loss: 0.6047, test_loss: 0.8421, test_f1: 0.6707
 epoch: 61, train_loss: 0.5903, test_loss: 0.9078, test_f1: 0.6588
 epoch: 62, train_loss: 0.5678, test_loss: 0.8000, test_f1: 0.6780
 epoch: 63, train_loss: 0.5801, test_loss: 0.9059, test_f1: 0.6500
 epoch: 64, train_loss: 0.5767, test_loss: 0.9510, test_f1: 0.6762
 epoch: 65, train_loss: 0.5659, test_loss: 0.8905, test_f1: 0.6679
 epoch: 66, train_loss: 0.5885, test_loss: 0.8923, test_f1: 0.6841
 epoch: 67, train_loss: 0.5802, test_loss: 0.9054, test_f1: 0.6925
 epoch: 68, train_loss: 0.5748, test_loss: 0.9682, test_f1: 0.6470
 epoch: 69, train_loss: 0.5653, test_loss: 0.8997, test_f1: 0.6524
 epoch: 70, train_loss: 0.5595, test_loss: 0.8719, test_f1: 0.6806
 epoch: 71, train_loss: 0.5549, test_loss: 0.9097, test_f1: 0.6820
 epoch: 72, train_loss: 0.5675, test_loss: 0.8986, test_f1: 0.6766
 epoch: 73, train_loss: 0.5589, test_loss: 0.8950, test_f1: 0.6912
 epoch: 74, train_loss: 0.5497, test_loss: 0.9359, test_f1: 0.6793
 epoch: 75, train_loss: 0.5437, test_loss: 0.9612, test_f1: 0.6827
 epoch: 76, train_loss: 0.5575, test_loss: 0.9010, test_f1: 0.6847
 epoch: 77, train_loss: 0.5273, test_loss: 0.9266, test_f1: 0.6996
 epoch: 78, train_loss: 0.5541, test_loss: 0.9172, test_f1: 0.6808
 epoch: 79, train_loss: 0.5295, test_loss: 1.0309, test_f1: 0.6839
 epoch: 80, train_loss: 0.5509, test_loss: 0.9113, test_f1: 0.6770
 epoch: 81, train_loss: 0.5392, test_loss: 0.9592, test_f1: 0.6876
 epoch: 82, train_loss: 0.5310, test_loss: 1.0139, test_f1: 0.6899
 epoch: 83, train_loss: 0.5296, test_loss: 0.9565, test_f1: 0.6967
 epoch: 84, train_loss: 0.5541, test_loss: 0.9088, test_f1: 0.6845
 epoch: 85, train_loss: 0.5438, test_loss: 0.8417, test_f1: 0.6882
 epoch: 86, train_loss: 0.5328, test_loss: 0.8788, test_f1: 0.6868
 epoch: 87, train_loss: 0.5099, test_loss: 0.9653, test_f1: 0.6770
 epoch: 88, train_loss: 0.5307, test_loss: 1.0366, test_f1: 0.6706
 epoch: 89, train_loss: 0.5229, test_loss: 1.0709, test_f1: 0.6695
 epoch: 90, train_loss: 0.5332, test_loss: 0.8925, test_f1: 0.6888
 epoch: 91, train_loss: 0.5212, test_loss: 1.0362, test_f1: 0.6681
 epoch: 92, train_loss: 0.5443, test_loss: 0.9796, test_f1: 0.6851
 epoch: 93, train_loss: 0.4978, test_loss: 0.9118, test_f1: 0.6892
 epoch: 94, train_loss: 0.5018, test_loss: 1.0242, test_f1: 0.6567
 epoch: 95, train_loss: 0.5229, test_loss: 0.9785, test_f1: 0.6550
 epoch: 96, train_loss: 0.4832, test_loss: 0.9159, test_f1: 0.6808
 epoch: 97, train_loss: 0.4881, test_loss: 0.9676, test_f1: 0.7050
 epoch: 98, train_loss: 0.5041, test_loss: 0.9323, test_f1: 0.6777
 epoch: 99, train_loss: 0.4865, test_loss: 0.9102, test_f1: 0.6882

Training completed in 1107.54 seconds
Best F1: 0.7198 at epoch 70
Mean F1 across iterations: 0.7009  0.0096
========================FINAL RESULTS================================
FEGIN weighted F1: 0.7198  0.0096
python main.py --data ltspice_examples --representation component_pin_net --model FEGIN --layers 2 --hiddens 64 --batch_size 32 --lr 0.01 --emb_size 128 --epochs 100 --save_appendix component_pin_net_L2_H64_BS32_LR0.01_E128 --no_val
-----



STDERR:
  File "main.py", line 370, in <module>
    main()
  File "main.py", line 254, in main
    dataset = dataset_class(
  File "/home/philip/projects/llm_inference_code_repo/Circuit-Completion-Using-GNNs/component_classification_with_link_prediction_head/evaluation/FEGIN/kernel/circuit_datasets.py", line 15, in __init__
    self.data, self.slices = torch.load(self.processed_paths[0])
  File "/home/philip/.local/lib/python3.8/site-packages/torch/serialization.py", line 1040, in load
    warnings.warn(
  File "/usr/lib/python3.8/warnings.py", line 109, in _showwarnmsg
    sw(msg.message, msg.category, msg.filename, msg.lineno,
  File "main.py", line 47, in warn_with_traceback
    traceback.print_stack(file=log)
/home/philip/projects/llm_inference_code_repo/Circuit-Completion-Using-GNNs/component_classification_with_link_prediction_head/evaluation/FEGIN/kernel/circuit_datasets.py:15: FutureWarning: You are using `torch.load` with `weights_only=False` (the current default value), which uses the default pickle module implicitly. It is possible to construct malicious pickle data which will execute arbitrary code during unpickling (See https://github.com/pytorch/pytorch/blob/main/SECURITY.md#untrusted-models for more details). In a future release, the default value for `weights_only` will be flipped to `True`. This limits the functions that could be executed during unpickling. Arbitrary objects will no longer be allowed to be loaded via this mode unless they are explicitly allowlisted by the user via `torch.serialization.add_safe_globals`. We recommend you start setting `weights_only=True` for any use case where you don't have full control of the loaded file. Please open an issue on GitHub for any issues related to this experimental feature.
  self.data, self.slices = torch.load(self.processed_paths[0])
