STDOUT:
Results will be saved in /home/philip/projects/llm_inference_code_repo/Circuit-Completion-Using-GNNs/component_classification_with_link_prediction_head/evaluation/FEGIN/results/model_FEGIN_dataset_ltspice_examples
Command line input: python main.py --data ltspice_examples --representation component_component --model FEGIN --layers 5 --hiddens 16 --batch_size 128 --lr 0.001 --emb_size 128 --epochs 100 --save_appendix component_component_L5_H16_BS128_LR0.001_E128 --no_val
 is saved.
-----
ltspice_examples - FEGIN
Using 5 layers, 16 hidden units, h = 2
Loading component_component representation dataset
Loading component_component representation data...
Loaded 4401 examples (component_component)
saving path: data/processed/ltspice_examples_component_component_processed.pt
ENTERED
Training FEGIN on component_component representation
Train: 3556, Test: 845
##################ITERATION #0 ****************************************
 epoch: 0, train_loss: 1.3908, test_loss: 1.3701, test_f1: 0.2274
 epoch: 1, train_loss: 1.3390, test_loss: 1.3283, test_f1: 0.2274
 epoch: 2, train_loss: 1.3023, test_loss: 1.2933, test_f1: 0.2274
 epoch: 3, train_loss: 1.2805, test_loss: 1.2652, test_f1: 0.2274
 epoch: 4, train_loss: 1.2683, test_loss: 1.2555, test_f1: 0.2274
 epoch: 5, train_loss: 1.2507, test_loss: 1.2382, test_f1: 0.2784
 epoch: 6, train_loss: 1.2357, test_loss: 1.2206, test_f1: 0.2899
 epoch: 7, train_loss: 1.2293, test_loss: 1.2120, test_f1: 0.3315
 epoch: 8, train_loss: 1.2204, test_loss: 1.2052, test_f1: 0.3492
 epoch: 9, train_loss: 1.2099, test_loss: 1.1944, test_f1: 0.3676
 epoch: 10, train_loss: 1.2026, test_loss: 1.1801, test_f1: 0.3955
 epoch: 11, train_loss: 1.1980, test_loss: 1.1774, test_f1: 0.4057
 epoch: 12, train_loss: 1.1893, test_loss: 1.1722, test_f1: 0.4023
 epoch: 13, train_loss: 1.1830, test_loss: 1.1540, test_f1: 0.4052
 epoch: 14, train_loss: 1.1737, test_loss: 1.1552, test_f1: 0.4211
 epoch: 15, train_loss: 1.1698, test_loss: 1.1457, test_f1: 0.3984
 epoch: 16, train_loss: 1.1489, test_loss: 1.1389, test_f1: 0.4323
 epoch: 17, train_loss: 1.1427, test_loss: 1.1195, test_f1: 0.4279
 epoch: 18, train_loss: 1.1386, test_loss: 1.1108, test_f1: 0.4510
 epoch: 19, train_loss: 1.1277, test_loss: 1.1059, test_f1: 0.4331
 epoch: 20, train_loss: 1.1219, test_loss: 1.0994, test_f1: 0.4403
 epoch: 21, train_loss: 1.1139, test_loss: 1.0971, test_f1: 0.4518
 epoch: 22, train_loss: 1.1065, test_loss: 1.0912, test_f1: 0.4459
 epoch: 23, train_loss: 1.1038, test_loss: 1.0873, test_f1: 0.4590
 epoch: 24, train_loss: 1.1007, test_loss: 1.0639, test_f1: 0.4684
 epoch: 25, train_loss: 1.0946, test_loss: 1.0665, test_f1: 0.4713
 epoch: 26, train_loss: 1.0764, test_loss: 1.0593, test_f1: 0.4644
 epoch: 27, train_loss: 1.0702, test_loss: 1.0506, test_f1: 0.4728
 epoch: 28, train_loss: 1.0764, test_loss: 1.0550, test_f1: 0.4678
 epoch: 29, train_loss: 1.0604, test_loss: 1.0638, test_f1: 0.4584
 epoch: 30, train_loss: 1.0524, test_loss: 1.0541, test_f1: 0.4649
 epoch: 31, train_loss: 1.0567, test_loss: 1.0568, test_f1: 0.4527
 epoch: 32, train_loss: 1.0595, test_loss: 1.0726, test_f1: 0.4534
 epoch: 33, train_loss: 1.0532, test_loss: 1.0497, test_f1: 0.4699
 epoch: 34, train_loss: 1.0423, test_loss: 1.0336, test_f1: 0.4631
 epoch: 35, train_loss: 1.0279, test_loss: 1.0225, test_f1: 0.4668
 epoch: 36, train_loss: 1.0239, test_loss: 1.0183, test_f1: 0.4858
 epoch: 37, train_loss: 1.0290, test_loss: 1.0282, test_f1: 0.4777
 epoch: 38, train_loss: 1.0206, test_loss: 1.0391, test_f1: 0.4809
 epoch: 39, train_loss: 1.0225, test_loss: 0.9961, test_f1: 0.4881
 epoch: 40, train_loss: 1.0141, test_loss: 1.0270, test_f1: 0.4780
 epoch: 41, train_loss: 1.0075, test_loss: 1.0141, test_f1: 0.4849
 epoch: 42, train_loss: 1.0076, test_loss: 1.0030, test_f1: 0.4771
 epoch: 43, train_loss: 0.9877, test_loss: 1.0231, test_f1: 0.4748
 epoch: 44, train_loss: 0.9794, test_loss: 1.0346, test_f1: 0.4627
 epoch: 45, train_loss: 0.9926, test_loss: 0.9998, test_f1: 0.4787
 epoch: 46, train_loss: 0.9939, test_loss: 1.0136, test_f1: 0.4746
 epoch: 47, train_loss: 0.9767, test_loss: 0.9971, test_f1: 0.4822
 epoch: 48, train_loss: 0.9725, test_loss: 1.0127, test_f1: 0.4778
 epoch: 49, train_loss: 0.9818, test_loss: 0.9901, test_f1: 0.4780
 epoch: 50, train_loss: 0.9823, test_loss: 1.0189, test_f1: 0.4678
 epoch: 51, train_loss: 0.9570, test_loss: 1.0261, test_f1: 0.4746
 epoch: 52, train_loss: 0.9524, test_loss: 0.9931, test_f1: 0.4779
 epoch: 53, train_loss: 0.9452, test_loss: 0.9961, test_f1: 0.4770
 epoch: 54, train_loss: 0.9426, test_loss: 1.0047, test_f1: 0.4701
 epoch: 55, train_loss: 0.9387, test_loss: 1.0177, test_f1: 0.4595
 epoch: 56, train_loss: 0.9435, test_loss: 0.9909, test_f1: 0.4751
 epoch: 57, train_loss: 0.9393, test_loss: 1.0101, test_f1: 0.4800
 epoch: 58, train_loss: 0.9412, test_loss: 0.9956, test_f1: 0.4771
 epoch: 59, train_loss: 0.9358, test_loss: 1.0071, test_f1: 0.4712
 epoch: 60, train_loss: 0.9361, test_loss: 0.9996, test_f1: 0.4841
 epoch: 61, train_loss: 0.9327, test_loss: 1.0130, test_f1: 0.4746
 epoch: 62, train_loss: 0.9422, test_loss: 1.0127, test_f1: 0.4734
 epoch: 63, train_loss: 0.9291, test_loss: 1.0181, test_f1: 0.4770
 epoch: 64, train_loss: 0.9202, test_loss: 1.0465, test_f1: 0.4538
 epoch: 65, train_loss: 0.9302, test_loss: 1.0000, test_f1: 0.4859
 epoch: 66, train_loss: 0.9273, test_loss: 1.0124, test_f1: 0.4745
 epoch: 67, train_loss: 0.9222, test_loss: 1.0111, test_f1: 0.4678
 epoch: 68, train_loss: 0.9244, test_loss: 1.0085, test_f1: 0.4748
 epoch: 69, train_loss: 0.9249, test_loss: 0.9939, test_f1: 0.4791
 epoch: 70, train_loss: 0.9276, test_loss: 1.0045, test_f1: 0.4836
 epoch: 71, train_loss: 0.9216, test_loss: 1.0149, test_f1: 0.4768
 epoch: 72, train_loss: 0.9124, test_loss: 1.0134, test_f1: 0.4762
 epoch: 73, train_loss: 0.9112, test_loss: 1.0090, test_f1: 0.4815
 epoch: 74, train_loss: 0.9343, test_loss: 1.0188, test_f1: 0.4931
 epoch: 75, train_loss: 0.9102, test_loss: 0.9978, test_f1: 0.4786
 epoch: 76, train_loss: 0.9101, test_loss: 1.0162, test_f1: 0.4782
 epoch: 77, train_loss: 0.9219, test_loss: 1.0151, test_f1: 0.4765
 epoch: 78, train_loss: 0.9260, test_loss: 0.9833, test_f1: 0.4899
 epoch: 79, train_loss: 0.9159, test_loss: 0.9961, test_f1: 0.4727
 epoch: 80, train_loss: 0.9106, test_loss: 1.0019, test_f1: 0.4866
 epoch: 81, train_loss: 0.9050, test_loss: 0.9959, test_f1: 0.4800
 epoch: 82, train_loss: 0.9043, test_loss: 0.9955, test_f1: 0.4744
 epoch: 83, train_loss: 0.9021, test_loss: 1.0029, test_f1: 0.4757
 epoch: 84, train_loss: 0.9009, test_loss: 1.0274, test_f1: 0.4701
 epoch: 85, train_loss: 0.9134, test_loss: 0.9942, test_f1: 0.4833
 epoch: 86, train_loss: 0.9120, test_loss: 1.0034, test_f1: 0.4798
 epoch: 87, train_loss: 0.8899, test_loss: 1.0093, test_f1: 0.4833
 epoch: 88, train_loss: 0.9009, test_loss: 1.0132, test_f1: 0.4711
 epoch: 89, train_loss: 0.8953, test_loss: 1.0049, test_f1: 0.4817
 epoch: 90, train_loss: 0.9033, test_loss: 1.0019, test_f1: 0.4758
 epoch: 91, train_loss: 0.8931, test_loss: 1.0144, test_f1: 0.4815
 epoch: 92, train_loss: 0.8974, test_loss: 1.0358, test_f1: 0.4626
 epoch: 93, train_loss: 0.8857, test_loss: 1.0340, test_f1: 0.4702
 epoch: 94, train_loss: 0.9021, test_loss: 1.0283, test_f1: 0.4717
 epoch: 95, train_loss: 0.8877, test_loss: 1.0136, test_f1: 0.4736
 epoch: 96, train_loss: 0.9003, test_loss: 1.0251, test_f1: 0.4731
 epoch: 97, train_loss: 0.8978, test_loss: 1.0269, test_f1: 0.4616
 epoch: 98, train_loss: 0.8870, test_loss: 1.0365, test_f1: 0.4858
 epoch: 99, train_loss: 0.8904, test_loss: 1.0353, test_f1: 0.4872
##################ITERATION #1 ****************************************
 epoch: 0, train_loss: 1.3138, test_loss: 1.3048, test_f1: 0.2274
 epoch: 1, train_loss: 1.2811, test_loss: 1.2855, test_f1: 0.2274
 epoch: 2, train_loss: 1.2671, test_loss: 1.2684, test_f1: 0.2343
 epoch: 3, train_loss: 1.2604, test_loss: 1.2555, test_f1: 0.2778
 epoch: 4, train_loss: 1.2439, test_loss: 1.2337, test_f1: 0.2769
 epoch: 5, train_loss: 1.2304, test_loss: 1.2104, test_f1: 0.2766
 epoch: 6, train_loss: 1.2157, test_loss: 1.1820, test_f1: 0.3622
 epoch: 7, train_loss: 1.1950, test_loss: 1.1569, test_f1: 0.3992
 epoch: 8, train_loss: 1.1854, test_loss: 1.1442, test_f1: 0.3988
 epoch: 9, train_loss: 1.1770, test_loss: 1.1369, test_f1: 0.4366
 epoch: 10, train_loss: 1.1543, test_loss: 1.1117, test_f1: 0.4294
 epoch: 11, train_loss: 1.1406, test_loss: 1.1075, test_f1: 0.4207
 epoch: 12, train_loss: 1.1310, test_loss: 1.0841, test_f1: 0.4511
 epoch: 13, train_loss: 1.1201, test_loss: 1.0719, test_f1: 0.4546
 epoch: 14, train_loss: 1.1194, test_loss: 1.0636, test_f1: 0.4693
 epoch: 15, train_loss: 1.1108, test_loss: 1.0636, test_f1: 0.4546
 epoch: 16, train_loss: 1.1021, test_loss: 1.0735, test_f1: 0.4320
 epoch: 17, train_loss: 1.0985, test_loss: 1.0718, test_f1: 0.4424
 epoch: 18, train_loss: 1.0954, test_loss: 1.0402, test_f1: 0.4662
 epoch: 19, train_loss: 1.0874, test_loss: 1.0578, test_f1: 0.4803
 epoch: 20, train_loss: 1.0898, test_loss: 1.0314, test_f1: 0.4669
 epoch: 21, train_loss: 1.0837, test_loss: 1.0517, test_f1: 0.4375
 epoch: 22, train_loss: 1.0727, test_loss: 1.0490, test_f1: 0.4587
 epoch: 23, train_loss: 1.0642, test_loss: 1.0283, test_f1: 0.4579
 epoch: 24, train_loss: 1.0725, test_loss: 1.0431, test_f1: 0.4545
 epoch: 25, train_loss: 1.0698, test_loss: 1.0328, test_f1: 0.4801
 epoch: 26, train_loss: 1.0557, test_loss: 1.0459, test_f1: 0.4559
 epoch: 27, train_loss: 1.0595, test_loss: 1.0317, test_f1: 0.4475
 epoch: 28, train_loss: 1.0600, test_loss: 1.0406, test_f1: 0.4700
 epoch: 29, train_loss: 1.0435, test_loss: 1.0145, test_f1: 0.4611
 epoch: 30, train_loss: 1.0466, test_loss: 1.0358, test_f1: 0.4845
 epoch: 31, train_loss: 1.0326, test_loss: 1.0377, test_f1: 0.4717
 epoch: 32, train_loss: 1.0346, test_loss: 1.0506, test_f1: 0.4390
 epoch: 33, train_loss: 1.0376, test_loss: 1.0628, test_f1: 0.4711
 epoch: 34, train_loss: 1.0417, test_loss: 1.0040, test_f1: 0.4727
 epoch: 35, train_loss: 1.0292, test_loss: 1.0226, test_f1: 0.4667
 epoch: 36, train_loss: 1.0290, test_loss: 1.0509, test_f1: 0.4916
 epoch: 37, train_loss: 1.0248, test_loss: 1.0281, test_f1: 0.4837
 epoch: 38, train_loss: 1.0100, test_loss: 1.0335, test_f1: 0.4855
 epoch: 39, train_loss: 1.0103, test_loss: 1.0503, test_f1: 0.4838
 epoch: 40, train_loss: 1.0125, test_loss: 1.0375, test_f1: 0.4564
 epoch: 41, train_loss: 1.0084, test_loss: 1.0089, test_f1: 0.4798
 epoch: 42, train_loss: 0.9913, test_loss: 1.0771, test_f1: 0.4750
 epoch: 43, train_loss: 1.0040, test_loss: 1.0191, test_f1: 0.4752
 epoch: 44, train_loss: 1.0067, test_loss: 1.0353, test_f1: 0.4810
 epoch: 45, train_loss: 1.0033, test_loss: 1.0437, test_f1: 0.5103
 epoch: 46, train_loss: 0.9894, test_loss: 1.0269, test_f1: 0.4661
 epoch: 47, train_loss: 0.9883, test_loss: 1.0041, test_f1: 0.4882
 epoch: 48, train_loss: 0.9867, test_loss: 1.0456, test_f1: 0.4750
 epoch: 49, train_loss: 0.9963, test_loss: 1.0251, test_f1: 0.4841
 epoch: 50, train_loss: 0.9945, test_loss: 0.9929, test_f1: 0.4767
 epoch: 51, train_loss: 0.9720, test_loss: 1.0186, test_f1: 0.4882
 epoch: 52, train_loss: 0.9732, test_loss: 1.0075, test_f1: 0.4972
 epoch: 53, train_loss: 0.9660, test_loss: 1.0390, test_f1: 0.5037
 epoch: 54, train_loss: 0.9692, test_loss: 1.0459, test_f1: 0.4862
 epoch: 55, train_loss: 0.9685, test_loss: 1.0475, test_f1: 0.4794
 epoch: 56, train_loss: 0.9639, test_loss: 1.0520, test_f1: 0.4952
 epoch: 57, train_loss: 0.9649, test_loss: 1.0381, test_f1: 0.4766
 epoch: 58, train_loss: 0.9669, test_loss: 1.0516, test_f1: 0.4685
 epoch: 59, train_loss: 0.9640, test_loss: 1.0199, test_f1: 0.5090
 epoch: 60, train_loss: 0.9555, test_loss: 1.0465, test_f1: 0.4789
 epoch: 61, train_loss: 0.9542, test_loss: 1.0503, test_f1: 0.5042
 epoch: 62, train_loss: 0.9500, test_loss: 1.0537, test_f1: 0.4739
 epoch: 63, train_loss: 0.9555, test_loss: 1.0587, test_f1: 0.4784
 epoch: 64, train_loss: 0.9595, test_loss: 1.0522, test_f1: 0.4891
 epoch: 65, train_loss: 0.9608, test_loss: 1.0403, test_f1: 0.4852
 epoch: 66, train_loss: 0.9507, test_loss: 1.0205, test_f1: 0.4789
 epoch: 67, train_loss: 0.9572, test_loss: 1.0571, test_f1: 0.4817
 epoch: 68, train_loss: 0.9483, test_loss: 1.0501, test_f1: 0.4930
 epoch: 69, train_loss: 0.9597, test_loss: 1.0336, test_f1: 0.4810
 epoch: 70, train_loss: 0.9521, test_loss: 1.0414, test_f1: 0.4905
 epoch: 71, train_loss: 0.9515, test_loss: 1.0521, test_f1: 0.4781
 epoch: 72, train_loss: 0.9507, test_loss: 1.0833, test_f1: 0.4972
 epoch: 73, train_loss: 0.9433, test_loss: 1.0733, test_f1: 0.4721
 epoch: 74, train_loss: 0.9391, test_loss: 1.0563, test_f1: 0.4863
 epoch: 75, train_loss: 0.9357, test_loss: 1.0667, test_f1: 0.4923
 epoch: 76, train_loss: 0.9435, test_loss: 1.0515, test_f1: 0.4893
 epoch: 77, train_loss: 0.9508, test_loss: 1.0655, test_f1: 0.4993
 epoch: 78, train_loss: 0.9343, test_loss: 1.0563, test_f1: 0.4916
 epoch: 79, train_loss: 0.9382, test_loss: 1.0356, test_f1: 0.5080
 epoch: 80, train_loss: 0.9425, test_loss: 1.0578, test_f1: 0.4825
 epoch: 81, train_loss: 0.9277, test_loss: 1.0597, test_f1: 0.4973
 epoch: 82, train_loss: 0.9337, test_loss: 1.0651, test_f1: 0.4916
 epoch: 83, train_loss: 0.9295, test_loss: 1.0590, test_f1: 0.4974
 epoch: 84, train_loss: 0.9403, test_loss: 1.1006, test_f1: 0.4936
 epoch: 85, train_loss: 0.9412, test_loss: 1.0438, test_f1: 0.5053
 epoch: 86, train_loss: 0.9362, test_loss: 1.0495, test_f1: 0.4786
 epoch: 87, train_loss: 0.9223, test_loss: 1.0703, test_f1: 0.4775
 epoch: 88, train_loss: 0.9220, test_loss: 1.0763, test_f1: 0.4898
 epoch: 89, train_loss: 0.9313, test_loss: 1.0423, test_f1: 0.4822
 epoch: 90, train_loss: 0.9212, test_loss: 1.0569, test_f1: 0.4918
 epoch: 91, train_loss: 0.9288, test_loss: 1.1012, test_f1: 0.4710
 epoch: 92, train_loss: 0.9139, test_loss: 1.0768, test_f1: 0.4728
 epoch: 93, train_loss: 0.9131, test_loss: 1.0902, test_f1: 0.4684
 epoch: 94, train_loss: 0.9222, test_loss: 1.0978, test_f1: 0.4947
 epoch: 95, train_loss: 0.9167, test_loss: 1.0675, test_f1: 0.5114
 epoch: 96, train_loss: 0.9231, test_loss: 1.1363, test_f1: 0.4647
 epoch: 97, train_loss: 0.9134, test_loss: 1.1043, test_f1: 0.4690
 epoch: 98, train_loss: 0.9324, test_loss: 1.1074, test_f1: 0.4839
 epoch: 99, train_loss: 0.9274, test_loss: 1.0522, test_f1: 0.4942
##################ITERATION #2 ****************************************
 epoch: 0, train_loss: 1.3251, test_loss: 1.2648, test_f1: 0.2274
 epoch: 1, train_loss: 1.2428, test_loss: 1.1926, test_f1: 0.3099
 epoch: 2, train_loss: 1.2156, test_loss: 1.1639, test_f1: 0.3299
 epoch: 3, train_loss: 1.1926, test_loss: 1.1599, test_f1: 0.3307
 epoch: 4, train_loss: 1.1854, test_loss: 1.1521, test_f1: 0.3483
 epoch: 5, train_loss: 1.1776, test_loss: 1.1312, test_f1: 0.3455
 epoch: 6, train_loss: 1.1725, test_loss: 1.1305, test_f1: 0.3454
 epoch: 7, train_loss: 1.1594, test_loss: 1.1030, test_f1: 0.4270
 epoch: 8, train_loss: 1.1480, test_loss: 1.1025, test_f1: 0.4196
 epoch: 9, train_loss: 1.1424, test_loss: 1.0965, test_f1: 0.4287
 epoch: 10, train_loss: 1.1448, test_loss: 1.0969, test_f1: 0.4327
 epoch: 11, train_loss: 1.1312, test_loss: 1.0853, test_f1: 0.4404
 epoch: 12, train_loss: 1.1246, test_loss: 1.0652, test_f1: 0.4493
 epoch: 13, train_loss: 1.1092, test_loss: 1.0533, test_f1: 0.4550
 epoch: 14, train_loss: 1.1074, test_loss: 1.0579, test_f1: 0.4380
 epoch: 15, train_loss: 1.1073, test_loss: 1.0499, test_f1: 0.4415
 epoch: 16, train_loss: 1.1059, test_loss: 1.0386, test_f1: 0.4619
 epoch: 17, train_loss: 1.0964, test_loss: 1.0344, test_f1: 0.4710
 epoch: 18, train_loss: 1.0880, test_loss: 1.0175, test_f1: 0.4659
 epoch: 19, train_loss: 1.0754, test_loss: 1.0212, test_f1: 0.4663
 epoch: 20, train_loss: 1.0698, test_loss: 1.0121, test_f1: 0.4508
 epoch: 21, train_loss: 1.0651, test_loss: 1.0148, test_f1: 0.4535
 epoch: 22, train_loss: 1.0559, test_loss: 1.0031, test_f1: 0.4808
 epoch: 23, train_loss: 1.0471, test_loss: 1.0480, test_f1: 0.4560
 epoch: 24, train_loss: 1.0493, test_loss: 0.9843, test_f1: 0.4920
 epoch: 25, train_loss: 1.0354, test_loss: 1.0593, test_f1: 0.4489
 epoch: 26, train_loss: 1.0346, test_loss: 0.9943, test_f1: 0.4703
 epoch: 27, train_loss: 1.0242, test_loss: 1.0121, test_f1: 0.4625
 epoch: 28, train_loss: 1.0305, test_loss: 0.9956, test_f1: 0.4712
 epoch: 29, train_loss: 1.0330, test_loss: 0.9839, test_f1: 0.4598
 epoch: 30, train_loss: 1.0109, test_loss: 0.9759, test_f1: 0.4704
 epoch: 31, train_loss: 1.0046, test_loss: 1.0121, test_f1: 0.4598
 epoch: 32, train_loss: 1.0115, test_loss: 0.9902, test_f1: 0.4594
 epoch: 33, train_loss: 1.0048, test_loss: 0.9576, test_f1: 0.4907
 epoch: 34, train_loss: 0.9975, test_loss: 0.9804, test_f1: 0.4681
 epoch: 35, train_loss: 0.9901, test_loss: 0.9544, test_f1: 0.5013
 epoch: 36, train_loss: 0.9900, test_loss: 0.9606, test_f1: 0.4831
 epoch: 37, train_loss: 0.9956, test_loss: 0.9672, test_f1: 0.4788
 epoch: 38, train_loss: 0.9904, test_loss: 0.9608, test_f1: 0.4753
 epoch: 39, train_loss: 0.9719, test_loss: 0.9947, test_f1: 0.4701
 epoch: 40, train_loss: 0.9814, test_loss: 0.9567, test_f1: 0.5042
 epoch: 41, train_loss: 0.9760, test_loss: 0.9844, test_f1: 0.4898
 epoch: 42, train_loss: 0.9707, test_loss: 0.9856, test_f1: 0.4589
 epoch: 43, train_loss: 0.9637, test_loss: 0.9879, test_f1: 0.4816
 epoch: 44, train_loss: 0.9548, test_loss: 0.9616, test_f1: 0.4815
 epoch: 45, train_loss: 0.9496, test_loss: 0.9905, test_f1: 0.4839
 epoch: 46, train_loss: 0.9667, test_loss: 0.9870, test_f1: 0.4634
 epoch: 47, train_loss: 0.9567, test_loss: 1.0353, test_f1: 0.4466
 epoch: 48, train_loss: 0.9547, test_loss: 1.0029, test_f1: 0.4902
 epoch: 49, train_loss: 0.9457, test_loss: 0.9867, test_f1: 0.4851
 epoch: 50, train_loss: 0.9517, test_loss: 1.0047, test_f1: 0.4771
 epoch: 51, train_loss: 0.9385, test_loss: 1.0053, test_f1: 0.4807
 epoch: 52, train_loss: 0.9238, test_loss: 1.0190, test_f1: 0.4813
 epoch: 53, train_loss: 0.9325, test_loss: 1.0044, test_f1: 0.4829
 epoch: 54, train_loss: 0.9282, test_loss: 1.0077, test_f1: 0.4806
 epoch: 55, train_loss: 0.9351, test_loss: 1.0129, test_f1: 0.4879
 epoch: 56, train_loss: 0.9240, test_loss: 1.0172, test_f1: 0.4922
 epoch: 57, train_loss: 0.9285, test_loss: 1.0087, test_f1: 0.4907
 epoch: 58, train_loss: 0.9283, test_loss: 1.0185, test_f1: 0.4774
 epoch: 59, train_loss: 0.9326, test_loss: 1.0187, test_f1: 0.4755
 epoch: 60, train_loss: 0.9219, test_loss: 1.0198, test_f1: 0.4922
 epoch: 61, train_loss: 0.9180, test_loss: 1.0330, test_f1: 0.4847
 epoch: 62, train_loss: 0.9160, test_loss: 1.0017, test_f1: 0.4934
 epoch: 63, train_loss: 0.9250, test_loss: 1.0152, test_f1: 0.4961
 epoch: 64, train_loss: 0.9088, test_loss: 1.0139, test_f1: 0.4868
 epoch: 65, train_loss: 0.9138, test_loss: 1.0318, test_f1: 0.4829
 epoch: 66, train_loss: 0.9108, test_loss: 1.0335, test_f1: 0.4827
 epoch: 67, train_loss: 0.9129, test_loss: 1.0311, test_f1: 0.4855
 epoch: 68, train_loss: 0.9123, test_loss: 1.0263, test_f1: 0.4884
 epoch: 69, train_loss: 0.9086, test_loss: 1.0565, test_f1: 0.4997
 epoch: 70, train_loss: 0.9159, test_loss: 1.0273, test_f1: 0.4863
 epoch: 71, train_loss: 0.9044, test_loss: 1.0285, test_f1: 0.4880
 epoch: 72, train_loss: 0.8961, test_loss: 1.0386, test_f1: 0.4795
 epoch: 73, train_loss: 0.9108, test_loss: 1.0211, test_f1: 0.4813
 epoch: 74, train_loss: 0.9008, test_loss: 1.0308, test_f1: 0.4830
 epoch: 75, train_loss: 0.9058, test_loss: 1.0552, test_f1: 0.4809
 epoch: 76, train_loss: 0.9027, test_loss: 1.0278, test_f1: 0.4945
 epoch: 77, train_loss: 0.8994, test_loss: 1.0369, test_f1: 0.4809
 epoch: 78, train_loss: 0.8958, test_loss: 1.0247, test_f1: 0.4846
 epoch: 79, train_loss: 0.8972, test_loss: 1.0361, test_f1: 0.4900
 epoch: 80, train_loss: 0.8923, test_loss: 1.0324, test_f1: 0.4897
 epoch: 81, train_loss: 0.8968, test_loss: 1.0201, test_f1: 0.4898
 epoch: 82, train_loss: 0.8891, test_loss: 1.0290, test_f1: 0.4852
 epoch: 83, train_loss: 0.9034, test_loss: 1.0419, test_f1: 0.4800
 epoch: 84, train_loss: 0.8983, test_loss: 1.0251, test_f1: 0.4904
 epoch: 85, train_loss: 0.8987, test_loss: 1.0308, test_f1: 0.4867
 epoch: 86, train_loss: 0.8859, test_loss: 1.0359, test_f1: 0.4834
 epoch: 87, train_loss: 0.8952, test_loss: 1.0344, test_f1: 0.4867
 epoch: 88, train_loss: 0.8823, test_loss: 1.0369, test_f1: 0.4877
 epoch: 89, train_loss: 0.9014, test_loss: 1.0273, test_f1: 0.4881
 epoch: 90, train_loss: 0.8939, test_loss: 1.0520, test_f1: 0.4940
 epoch: 91, train_loss: 0.8840, test_loss: 1.0410, test_f1: 0.5025
 epoch: 92, train_loss: 0.8834, test_loss: 1.0498, test_f1: 0.4840
 epoch: 93, train_loss: 0.8764, test_loss: 1.0496, test_f1: 0.4946
 epoch: 94, train_loss: 0.8843, test_loss: 1.0497, test_f1: 0.4937
 epoch: 95, train_loss: 0.8835, test_loss: 1.0447, test_f1: 0.4921
 epoch: 96, train_loss: 0.8748, test_loss: 1.0462, test_f1: 0.5120
 epoch: 97, train_loss: 0.8810, test_loss: 1.0389, test_f1: 0.4911
 epoch: 98, train_loss: 0.8876, test_loss: 1.0542, test_f1: 0.4782
 epoch: 99, train_loss: 0.8734, test_loss: 1.0482, test_f1: 0.4903
##################ITERATION #3 ****************************************
 epoch: 0, train_loss: 1.4104, test_loss: 1.3032, test_f1: 0.2274
 epoch: 1, train_loss: 1.2582, test_loss: 1.2455, test_f1: 0.2808
 epoch: 2, train_loss: 1.2406, test_loss: 1.2025, test_f1: 0.3317
 epoch: 3, train_loss: 1.2320, test_loss: 1.1833, test_f1: 0.3644
 epoch: 4, train_loss: 1.2273, test_loss: 1.1604, test_f1: 0.3802
 epoch: 5, train_loss: 1.2005, test_loss: 1.1495, test_f1: 0.3927
 epoch: 6, train_loss: 1.1912, test_loss: 1.1418, test_f1: 0.3985
 epoch: 7, train_loss: 1.1813, test_loss: 1.1401, test_f1: 0.4120
 epoch: 8, train_loss: 1.1643, test_loss: 1.1243, test_f1: 0.4182
 epoch: 9, train_loss: 1.1606, test_loss: 1.1288, test_f1: 0.3992
 epoch: 10, train_loss: 1.1452, test_loss: 1.1148, test_f1: 0.3932
 epoch: 11, train_loss: 1.1430, test_loss: 1.1049, test_f1: 0.4256
 epoch: 12, train_loss: 1.1383, test_loss: 1.0980, test_f1: 0.4021
 epoch: 13, train_loss: 1.1103, test_loss: 1.0887, test_f1: 0.4111
 epoch: 14, train_loss: 1.0944, test_loss: 1.0742, test_f1: 0.4109
 epoch: 15, train_loss: 1.0975, test_loss: 1.0752, test_f1: 0.4210
 epoch: 16, train_loss: 1.0896, test_loss: 1.0731, test_f1: 0.4284
 epoch: 17, train_loss: 1.0634, test_loss: 1.0458, test_f1: 0.4232
 epoch: 18, train_loss: 1.0717, test_loss: 1.0486, test_f1: 0.4348
 epoch: 19, train_loss: 1.0555, test_loss: 1.0524, test_f1: 0.4225
 epoch: 20, train_loss: 1.0603, test_loss: 1.0243, test_f1: 0.4611
 epoch: 21, train_loss: 1.0577, test_loss: 1.0479, test_f1: 0.4492
 epoch: 22, train_loss: 1.0426, test_loss: 1.0473, test_f1: 0.4390
 epoch: 23, train_loss: 1.0411, test_loss: 1.0175, test_f1: 0.4408
 epoch: 24, train_loss: 1.0302, test_loss: 1.0216, test_f1: 0.4748
 epoch: 25, train_loss: 1.0219, test_loss: 1.0375, test_f1: 0.4516
 epoch: 26, train_loss: 1.0284, test_loss: 1.0195, test_f1: 0.4483
 epoch: 27, train_loss: 1.0233, test_loss: 0.9931, test_f1: 0.4735
 epoch: 28, train_loss: 1.0100, test_loss: 0.9988, test_f1: 0.4572
 epoch: 29, train_loss: 1.0076, test_loss: 1.0198, test_f1: 0.4720
 epoch: 30, train_loss: 1.0171, test_loss: 1.0001, test_f1: 0.4594
 epoch: 31, train_loss: 1.0024, test_loss: 0.9951, test_f1: 0.4725
 epoch: 32, train_loss: 1.0021, test_loss: 0.9899, test_f1: 0.4668
 epoch: 33, train_loss: 0.9955, test_loss: 0.9758, test_f1: 0.4654
 epoch: 34, train_loss: 0.9881, test_loss: 0.9904, test_f1: 0.4736
 epoch: 35, train_loss: 0.9933, test_loss: 0.9966, test_f1: 0.4658
 epoch: 36, train_loss: 0.9881, test_loss: 0.9891, test_f1: 0.4691
 epoch: 37, train_loss: 0.9812, test_loss: 1.0159, test_f1: 0.4711
 epoch: 38, train_loss: 0.9836, test_loss: 0.9970, test_f1: 0.4482
 epoch: 39, train_loss: 0.9675, test_loss: 0.9682, test_f1: 0.4750
 epoch: 40, train_loss: 0.9671, test_loss: 1.0040, test_f1: 0.4596
 epoch: 41, train_loss: 0.9640, test_loss: 0.9803, test_f1: 0.4726
 epoch: 42, train_loss: 0.9614, test_loss: 1.0560, test_f1: 0.4481
 epoch: 43, train_loss: 0.9592, test_loss: 0.9899, test_f1: 0.4712
 epoch: 44, train_loss: 0.9566, test_loss: 0.9984, test_f1: 0.4731
 epoch: 45, train_loss: 0.9612, test_loss: 0.9845, test_f1: 0.4660
 epoch: 46, train_loss: 0.9528, test_loss: 1.0047, test_f1: 0.4594
 epoch: 47, train_loss: 0.9455, test_loss: 0.9964, test_f1: 0.4664
 epoch: 48, train_loss: 0.9528, test_loss: 1.0011, test_f1: 0.4566
 epoch: 49, train_loss: 0.9344, test_loss: 0.9989, test_f1: 0.4466
 epoch: 50, train_loss: 0.9438, test_loss: 0.9827, test_f1: 0.4782
 epoch: 51, train_loss: 0.9405, test_loss: 0.9826, test_f1: 0.4591
 epoch: 52, train_loss: 0.9233, test_loss: 0.9943, test_f1: 0.4797
 epoch: 53, train_loss: 0.9342, test_loss: 0.9642, test_f1: 0.4802
 epoch: 54, train_loss: 0.9202, test_loss: 0.9706, test_f1: 0.4723
 epoch: 55, train_loss: 0.9307, test_loss: 1.0271, test_f1: 0.4612
 epoch: 56, train_loss: 0.9208, test_loss: 0.9703, test_f1: 0.4869
 epoch: 57, train_loss: 0.9370, test_loss: 1.0027, test_f1: 0.4622
 epoch: 58, train_loss: 0.9286, test_loss: 0.9893, test_f1: 0.4799
 epoch: 59, train_loss: 0.9272, test_loss: 0.9836, test_f1: 0.4827
 epoch: 60, train_loss: 0.9168, test_loss: 0.9733, test_f1: 0.4798
 epoch: 61, train_loss: 0.9230, test_loss: 1.0167, test_f1: 0.4794
 epoch: 62, train_loss: 0.9154, test_loss: 0.9707, test_f1: 0.4765
 epoch: 63, train_loss: 0.9121, test_loss: 0.9760, test_f1: 0.4832
 epoch: 64, train_loss: 0.9185, test_loss: 0.9809, test_f1: 0.4725
 epoch: 65, train_loss: 0.9134, test_loss: 0.9963, test_f1: 0.4782
 epoch: 66, train_loss: 0.9112, test_loss: 0.9919, test_f1: 0.4931
 epoch: 67, train_loss: 0.9191, test_loss: 0.9936, test_f1: 0.4703
 epoch: 68, train_loss: 0.9090, test_loss: 1.0188, test_f1: 0.4899
 epoch: 69, train_loss: 0.9112, test_loss: 1.0016, test_f1: 0.4779
 epoch: 70, train_loss: 0.9062, test_loss: 0.9889, test_f1: 0.4921
 epoch: 71, train_loss: 0.8925, test_loss: 0.9897, test_f1: 0.4746
 epoch: 72, train_loss: 0.9096, test_loss: 0.9802, test_f1: 0.4968
 epoch: 73, train_loss: 0.8961, test_loss: 1.0173, test_f1: 0.4835
 epoch: 74, train_loss: 0.9079, test_loss: 1.0049, test_f1: 0.4850
 epoch: 75, train_loss: 0.9040, test_loss: 0.9839, test_f1: 0.4800
 epoch: 76, train_loss: 0.9061, test_loss: 0.9913, test_f1: 0.4870
 epoch: 77, train_loss: 0.9060, test_loss: 0.9869, test_f1: 0.4785
 epoch: 78, train_loss: 0.9016, test_loss: 0.9917, test_f1: 0.4881
 epoch: 79, train_loss: 0.9063, test_loss: 0.9635, test_f1: 0.4899
 epoch: 80, train_loss: 0.9057, test_loss: 0.9707, test_f1: 0.4842
 epoch: 81, train_loss: 0.9017, test_loss: 0.9723, test_f1: 0.4793
 epoch: 82, train_loss: 0.8998, test_loss: 1.0158, test_f1: 0.4782
 epoch: 83, train_loss: 0.8977, test_loss: 1.0220, test_f1: 0.4964
 epoch: 84, train_loss: 0.8910, test_loss: 0.9913, test_f1: 0.4829
 epoch: 85, train_loss: 0.9036, test_loss: 1.0274, test_f1: 0.4856
 epoch: 86, train_loss: 0.8971, test_loss: 1.0065, test_f1: 0.4865
 epoch: 87, train_loss: 0.8881, test_loss: 1.0319, test_f1: 0.4796
 epoch: 88, train_loss: 0.8958, test_loss: 1.0135, test_f1: 0.4977
 epoch: 89, train_loss: 0.8902, test_loss: 1.0214, test_f1: 0.4568
 epoch: 90, train_loss: 0.8946, test_loss: 0.9728, test_f1: 0.4925
 epoch: 91, train_loss: 0.9041, test_loss: 0.9901, test_f1: 0.4990
 epoch: 92, train_loss: 0.9016, test_loss: 1.0290, test_f1: 0.4900
 epoch: 93, train_loss: 0.8842, test_loss: 1.0193, test_f1: 0.4753
 epoch: 94, train_loss: 0.8893, test_loss: 1.0144, test_f1: 0.4966
 epoch: 95, train_loss: 0.8885, test_loss: 1.0036, test_f1: 0.5027
 epoch: 96, train_loss: 0.8904, test_loss: 0.9720, test_f1: 0.4995
 epoch: 97, train_loss: 0.8808, test_loss: 0.9897, test_f1: 0.5017
 epoch: 98, train_loss: 0.8874, test_loss: 0.9907, test_f1: 0.4900
 epoch: 99, train_loss: 0.8760, test_loss: 1.0114, test_f1: 0.4955
##################ITERATION #4 ****************************************
 epoch: 0, train_loss: 1.3644, test_loss: 1.3029, test_f1: 0.2557
 epoch: 1, train_loss: 1.2601, test_loss: 1.2294, test_f1: 0.2608
 epoch: 2, train_loss: 1.2324, test_loss: 1.1945, test_f1: 0.3413
 epoch: 3, train_loss: 1.2224, test_loss: 1.1702, test_f1: 0.3797
 epoch: 4, train_loss: 1.2046, test_loss: 1.1632, test_f1: 0.3748
 epoch: 5, train_loss: 1.1996, test_loss: 1.1421, test_f1: 0.4093
 epoch: 6, train_loss: 1.1881, test_loss: 1.1313, test_f1: 0.4122
 epoch: 7, train_loss: 1.1793, test_loss: 1.1150, test_f1: 0.4284
 epoch: 8, train_loss: 1.1638, test_loss: 1.0929, test_f1: 0.4362
 epoch: 9, train_loss: 1.1439, test_loss: 1.0907, test_f1: 0.4540
 epoch: 10, train_loss: 1.1417, test_loss: 1.0857, test_f1: 0.4530
 epoch: 11, train_loss: 1.1281, test_loss: 1.0818, test_f1: 0.4338
 epoch: 12, train_loss: 1.1202, test_loss: 1.0585, test_f1: 0.4625
 epoch: 13, train_loss: 1.1135, test_loss: 1.0519, test_f1: 0.4666
 epoch: 14, train_loss: 1.0972, test_loss: 1.0459, test_f1: 0.4629
 epoch: 15, train_loss: 1.0874, test_loss: 1.0322, test_f1: 0.4680
 epoch: 16, train_loss: 1.0839, test_loss: 1.0224, test_f1: 0.4692
 epoch: 17, train_loss: 1.0784, test_loss: 1.0129, test_f1: 0.4705
 epoch: 18, train_loss: 1.0688, test_loss: 1.0058, test_f1: 0.4728
 epoch: 19, train_loss: 1.0619, test_loss: 0.9986, test_f1: 0.4766
 epoch: 20, train_loss: 1.0419, test_loss: 0.9791, test_f1: 0.4817
 epoch: 21, train_loss: 1.0409, test_loss: 1.0025, test_f1: 0.4794
 epoch: 22, train_loss: 1.0516, test_loss: 0.9811, test_f1: 0.4744
 epoch: 23, train_loss: 1.0403, test_loss: 0.9654, test_f1: 0.4843
 epoch: 24, train_loss: 1.0278, test_loss: 0.9629, test_f1: 0.4832
 epoch: 25, train_loss: 1.0193, test_loss: 0.9642, test_f1: 0.4741
 epoch: 26, train_loss: 1.0214, test_loss: 0.9478, test_f1: 0.4969
 epoch: 27, train_loss: 1.0197, test_loss: 0.9490, test_f1: 0.4915
 epoch: 28, train_loss: 1.0035, test_loss: 0.9353, test_f1: 0.4927
 epoch: 29, train_loss: 1.0078, test_loss: 0.9538, test_f1: 0.4915
 epoch: 30, train_loss: 0.9993, test_loss: 0.9634, test_f1: 0.4729
 epoch: 31, train_loss: 0.9816, test_loss: 0.9554, test_f1: 0.4690
 epoch: 32, train_loss: 0.9867, test_loss: 0.9781, test_f1: 0.4611
 epoch: 33, train_loss: 1.0017, test_loss: 0.9526, test_f1: 0.4769
 epoch: 34, train_loss: 0.9880, test_loss: 0.9792, test_f1: 0.4570
 epoch: 35, train_loss: 0.9917, test_loss: 0.9485, test_f1: 0.4742
 epoch: 36, train_loss: 0.9695, test_loss: 0.9353, test_f1: 0.4966
 epoch: 37, train_loss: 0.9797, test_loss: 0.9452, test_f1: 0.4692
 epoch: 38, train_loss: 0.9690, test_loss: 0.9771, test_f1: 0.4604
 epoch: 39, train_loss: 0.9680, test_loss: 0.9622, test_f1: 0.4741
 epoch: 40, train_loss: 0.9647, test_loss: 0.9479, test_f1: 0.4688
 epoch: 41, train_loss: 0.9618, test_loss: 0.9270, test_f1: 0.4807
 epoch: 42, train_loss: 0.9675, test_loss: 0.9363, test_f1: 0.4951
 epoch: 43, train_loss: 0.9632, test_loss: 0.9550, test_f1: 0.4790
 epoch: 44, train_loss: 0.9507, test_loss: 0.9342, test_f1: 0.4882
 epoch: 45, train_loss: 0.9564, test_loss: 0.9914, test_f1: 0.4568
 epoch: 46, train_loss: 0.9520, test_loss: 0.9677, test_f1: 0.4729
 epoch: 47, train_loss: 0.9458, test_loss: 0.9705, test_f1: 0.4732
 epoch: 48, train_loss: 0.9564, test_loss: 0.9416, test_f1: 0.4785
 epoch: 49, train_loss: 0.9420, test_loss: 0.9318, test_f1: 0.4860
 epoch: 50, train_loss: 0.9294, test_loss: 1.0079, test_f1: 0.4502
 epoch: 51, train_loss: 0.9322, test_loss: 0.9605, test_f1: 0.4736
 epoch: 52, train_loss: 0.9401, test_loss: 0.9614, test_f1: 0.4794
 epoch: 53, train_loss: 0.9293, test_loss: 0.9548, test_f1: 0.4859
 epoch: 54, train_loss: 0.9247, test_loss: 0.9654, test_f1: 0.4849
 epoch: 55, train_loss: 0.9202, test_loss: 0.9840, test_f1: 0.4807
 epoch: 56, train_loss: 0.9191, test_loss: 0.9647, test_f1: 0.4756
 epoch: 57, train_loss: 0.9117, test_loss: 0.9594, test_f1: 0.4863
 epoch: 58, train_loss: 0.9217, test_loss: 0.9744, test_f1: 0.4787
 epoch: 59, train_loss: 0.9149, test_loss: 0.9612, test_f1: 0.4984
 epoch: 60, train_loss: 0.9214, test_loss: 0.9427, test_f1: 0.4905
 epoch: 61, train_loss: 0.9058, test_loss: 0.9722, test_f1: 0.4817
 epoch: 62, train_loss: 0.9080, test_loss: 0.9694, test_f1: 0.4870
 epoch: 63, train_loss: 0.9025, test_loss: 1.0104, test_f1: 0.4777
 epoch: 64, train_loss: 0.9061, test_loss: 0.9624, test_f1: 0.4866
 epoch: 65, train_loss: 0.9087, test_loss: 1.0016, test_f1: 0.4855
 epoch: 66, train_loss: 0.8996, test_loss: 0.9750, test_f1: 0.4835
 epoch: 67, train_loss: 0.9005, test_loss: 0.9772, test_f1: 0.4903
 epoch: 68, train_loss: 0.9059, test_loss: 0.9591, test_f1: 0.4883
 epoch: 69, train_loss: 0.9003, test_loss: 0.9847, test_f1: 0.4855
 epoch: 70, train_loss: 0.8951, test_loss: 0.9643, test_f1: 0.4814
 epoch: 71, train_loss: 0.9023, test_loss: 0.9765, test_f1: 0.4857
 epoch: 72, train_loss: 0.9021, test_loss: 0.9989, test_f1: 0.4617
 epoch: 73, train_loss: 0.8953, test_loss: 0.9593, test_f1: 0.4872
 epoch: 74, train_loss: 0.8904, test_loss: 0.9744, test_f1: 0.4834
 epoch: 75, train_loss: 0.8966, test_loss: 0.9967, test_f1: 0.4892
 epoch: 76, train_loss: 0.8903, test_loss: 0.9708, test_f1: 0.4917
 epoch: 77, train_loss: 0.8839, test_loss: 1.0062, test_f1: 0.4770
 epoch: 78, train_loss: 0.8839, test_loss: 0.9683, test_f1: 0.4824
 epoch: 79, train_loss: 0.8785, test_loss: 1.0352, test_f1: 0.4779
 epoch: 80, train_loss: 0.9023, test_loss: 0.9914, test_f1: 0.4825
 epoch: 81, train_loss: 0.8831, test_loss: 1.0078, test_f1: 0.4793
 epoch: 82, train_loss: 0.8838, test_loss: 1.0004, test_f1: 0.4848
 epoch: 83, train_loss: 0.8827, test_loss: 1.0034, test_f1: 0.4731
 epoch: 84, train_loss: 0.8910, test_loss: 0.9926, test_f1: 0.4745
 epoch: 85, train_loss: 0.8830, test_loss: 1.0175, test_f1: 0.4802
 epoch: 86, train_loss: 0.8884, test_loss: 0.9917, test_f1: 0.4867
 epoch: 87, train_loss: 0.8897, test_loss: 1.0002, test_f1: 0.4795
 epoch: 88, train_loss: 0.8853, test_loss: 1.0050, test_f1: 0.4789
 epoch: 89, train_loss: 0.8812, test_loss: 1.0182, test_f1: 0.4841
 epoch: 90, train_loss: 0.8805, test_loss: 1.0242, test_f1: 0.4836
 epoch: 91, train_loss: 0.8802, test_loss: 1.0302, test_f1: 0.4822
 epoch: 92, train_loss: 0.8806, test_loss: 1.0059, test_f1: 0.4775
 epoch: 93, train_loss: 0.8803, test_loss: 1.0035, test_f1: 0.4833
 epoch: 94, train_loss: 0.8693, test_loss: 1.0180, test_f1: 0.4816
 epoch: 95, train_loss: 0.8860, test_loss: 1.0133, test_f1: 0.4769
 epoch: 96, train_loss: 0.8794, test_loss: 1.0521, test_f1: 0.4810
 epoch: 97, train_loss: 0.8721, test_loss: 1.0014, test_f1: 0.4740
 epoch: 98, train_loss: 0.8812, test_loss: 1.0265, test_f1: 0.4923
 epoch: 99, train_loss: 0.8833, test_loss: 1.0163, test_f1: 0.4818
##################ITERATION #5 ****************************************
 epoch: 0, train_loss: 1.7255, test_loss: 1.3223, test_f1: 0.2555
 epoch: 1, train_loss: 1.3199, test_loss: 1.2360, test_f1: 0.2995
 epoch: 2, train_loss: 1.2746, test_loss: 1.2064, test_f1: 0.3405
 epoch: 3, train_loss: 1.2425, test_loss: 1.1876, test_f1: 0.3333
 epoch: 4, train_loss: 1.2385, test_loss: 1.1880, test_f1: 0.3530
 epoch: 5, train_loss: 1.2270, test_loss: 1.1791, test_f1: 0.3507
 epoch: 6, train_loss: 1.2106, test_loss: 1.1591, test_f1: 0.3697
 epoch: 7, train_loss: 1.1939, test_loss: 1.1523, test_f1: 0.3845
 epoch: 8, train_loss: 1.1940, test_loss: 1.1369, test_f1: 0.4416
 epoch: 9, train_loss: 1.1804, test_loss: 1.1333, test_f1: 0.4339
 epoch: 10, train_loss: 1.1829, test_loss: 1.1266, test_f1: 0.4143
 epoch: 11, train_loss: 1.1733, test_loss: 1.1210, test_f1: 0.4334
 epoch: 12, train_loss: 1.1622, test_loss: 1.1118, test_f1: 0.4193
 epoch: 13, train_loss: 1.1452, test_loss: 1.0973, test_f1: 0.4545
 epoch: 14, train_loss: 1.1515, test_loss: 1.1311, test_f1: 0.4359
 epoch: 15, train_loss: 1.1364, test_loss: 1.1028, test_f1: 0.4440
 epoch: 16, train_loss: 1.1279, test_loss: 1.0833, test_f1: 0.4590
 epoch: 17, train_loss: 1.1185, test_loss: 1.0690, test_f1: 0.4515
 epoch: 18, train_loss: 1.1093, test_loss: 1.0588, test_f1: 0.4725
 epoch: 19, train_loss: 1.1084, test_loss: 1.0478, test_f1: 0.5042
 epoch: 20, train_loss: 1.0945, test_loss: 1.0274, test_f1: 0.4790
 epoch: 21, train_loss: 1.0863, test_loss: 1.0346, test_f1: 0.4671
 epoch: 22, train_loss: 1.0783, test_loss: 1.0271, test_f1: 0.4437
 epoch: 23, train_loss: 1.0840, test_loss: 1.0201, test_f1: 0.4935
 epoch: 24, train_loss: 1.0687, test_loss: 1.0124, test_f1: 0.4592
 epoch: 25, train_loss: 1.0672, test_loss: 1.0097, test_f1: 0.4758
 epoch: 26, train_loss: 1.0569, test_loss: 1.0141, test_f1: 0.4492
 epoch: 27, train_loss: 1.0402, test_loss: 1.0431, test_f1: 0.4408
 epoch: 28, train_loss: 1.0452, test_loss: 1.0054, test_f1: 0.4808
 epoch: 29, train_loss: 1.0416, test_loss: 1.0163, test_f1: 0.4586
 epoch: 30, train_loss: 1.0262, test_loss: 1.0050, test_f1: 0.4772
 epoch: 31, train_loss: 1.0225, test_loss: 0.9909, test_f1: 0.4685
 epoch: 32, train_loss: 1.0207, test_loss: 1.0177, test_f1: 0.4804
 epoch: 33, train_loss: 1.0225, test_loss: 0.9889, test_f1: 0.4787
 epoch: 34, train_loss: 1.0172, test_loss: 0.9909, test_f1: 0.4555
 epoch: 35, train_loss: 1.0220, test_loss: 0.9716, test_f1: 0.4866
 epoch: 36, train_loss: 1.0188, test_loss: 0.9755, test_f1: 0.4757
 epoch: 37, train_loss: 1.0054, test_loss: 0.9778, test_f1: 0.4697
 epoch: 38, train_loss: 0.9917, test_loss: 0.9626, test_f1: 0.4861
 epoch: 39, train_loss: 0.9788, test_loss: 0.9771, test_f1: 0.4861
 epoch: 40, train_loss: 0.9877, test_loss: 0.9614, test_f1: 0.4865
 epoch: 41, train_loss: 0.9824, test_loss: 0.9918, test_f1: 0.4755
 epoch: 42, train_loss: 0.9811, test_loss: 0.9794, test_f1: 0.4749
 epoch: 43, train_loss: 0.9864, test_loss: 0.9684, test_f1: 0.4870
 epoch: 44, train_loss: 0.9814, test_loss: 0.9714, test_f1: 0.4765
 epoch: 45, train_loss: 0.9692, test_loss: 1.0007, test_f1: 0.4662
 epoch: 46, train_loss: 0.9701, test_loss: 0.9863, test_f1: 0.4716
 epoch: 47, train_loss: 0.9727, test_loss: 0.9477, test_f1: 0.5049
 epoch: 48, train_loss: 0.9695, test_loss: 0.9687, test_f1: 0.4960
 epoch: 49, train_loss: 0.9699, test_loss: 0.9698, test_f1: 0.4645
 epoch: 50, train_loss: 0.9498, test_loss: 0.9516, test_f1: 0.4888
 epoch: 51, train_loss: 0.9521, test_loss: 1.0096, test_f1: 0.4684
 epoch: 52, train_loss: 0.9551, test_loss: 0.9975, test_f1: 0.4501
 epoch: 53, train_loss: 0.9582, test_loss: 0.9854, test_f1: 0.4432
 epoch: 54, train_loss: 0.9585, test_loss: 0.9724, test_f1: 0.4691
 epoch: 55, train_loss: 0.9361, test_loss: 0.9720, test_f1: 0.4867
 epoch: 56, train_loss: 0.9316, test_loss: 0.9721, test_f1: 0.4901
 epoch: 57, train_loss: 0.9358, test_loss: 0.9971, test_f1: 0.4684
 epoch: 58, train_loss: 0.9353, test_loss: 0.9684, test_f1: 0.4701
 epoch: 59, train_loss: 0.9312, test_loss: 0.9779, test_f1: 0.4857
 epoch: 60, train_loss: 0.9203, test_loss: 0.9754, test_f1: 0.4753
 epoch: 61, train_loss: 0.9342, test_loss: 0.9765, test_f1: 0.4837
 epoch: 62, train_loss: 0.9204, test_loss: 0.9490, test_f1: 0.4809
 epoch: 63, train_loss: 0.9284, test_loss: 0.9928, test_f1: 0.4739
 epoch: 64, train_loss: 0.9249, test_loss: 0.9779, test_f1: 0.4677
 epoch: 65, train_loss: 0.9307, test_loss: 0.9561, test_f1: 0.4834
 epoch: 66, train_loss: 0.9248, test_loss: 0.9719, test_f1: 0.4558
 epoch: 67, train_loss: 0.9235, test_loss: 0.9525, test_f1: 0.4910
 epoch: 68, train_loss: 0.9145, test_loss: 0.9930, test_f1: 0.4674
 epoch: 69, train_loss: 0.9066, test_loss: 0.9708, test_f1: 0.4699
 epoch: 70, train_loss: 0.9306, test_loss: 0.9933, test_f1: 0.4629
 epoch: 71, train_loss: 0.9201, test_loss: 0.9620, test_f1: 0.4743
 epoch: 72, train_loss: 0.9136, test_loss: 0.9622, test_f1: 0.5117
 epoch: 73, train_loss: 0.9248, test_loss: 0.9742, test_f1: 0.4741
 epoch: 74, train_loss: 0.9113, test_loss: 0.9752, test_f1: 0.4792
 epoch: 75, train_loss: 0.9259, test_loss: 0.9737, test_f1: 0.4836
 epoch: 76, train_loss: 0.9145, test_loss: 0.9752, test_f1: 0.4820
 epoch: 77, train_loss: 0.9135, test_loss: 0.9769, test_f1: 0.4830
 epoch: 78, train_loss: 0.9041, test_loss: 0.9597, test_f1: 0.4836
 epoch: 79, train_loss: 0.9163, test_loss: 0.9580, test_f1: 0.4742
 epoch: 80, train_loss: 0.8969, test_loss: 0.9670, test_f1: 0.4843
 epoch: 81, train_loss: 0.9049, test_loss: 0.9763, test_f1: 0.4673
 epoch: 82, train_loss: 0.9076, test_loss: 0.9818, test_f1: 0.4828
 epoch: 83, train_loss: 0.9031, test_loss: 0.9680, test_f1: 0.4668
 epoch: 84, train_loss: 0.9103, test_loss: 0.9913, test_f1: 0.4811
 epoch: 85, train_loss: 0.9047, test_loss: 0.9361, test_f1: 0.4934
 epoch: 86, train_loss: 0.9012, test_loss: 0.9787, test_f1: 0.4710
 epoch: 87, train_loss: 0.8978, test_loss: 0.9652, test_f1: 0.4836
 epoch: 88, train_loss: 0.8848, test_loss: 0.9886, test_f1: 0.4766
 epoch: 89, train_loss: 0.8940, test_loss: 0.9525, test_f1: 0.4912
 epoch: 90, train_loss: 0.9048, test_loss: 0.9793, test_f1: 0.4782
 epoch: 91, train_loss: 0.9086, test_loss: 0.9788, test_f1: 0.4866
 epoch: 92, train_loss: 0.9018, test_loss: 0.9797, test_f1: 0.4837
 epoch: 93, train_loss: 0.8843, test_loss: 1.0132, test_f1: 0.4732
 epoch: 94, train_loss: 0.9034, test_loss: 1.0160, test_f1: 0.4646
 epoch: 95, train_loss: 0.8833, test_loss: 1.0002, test_f1: 0.4784
 epoch: 96, train_loss: 0.8874, test_loss: 0.9802, test_f1: 0.4763
 epoch: 97, train_loss: 0.8718, test_loss: 1.0231, test_f1: 0.4695
 epoch: 98, train_loss: 0.8928, test_loss: 1.0128, test_f1: 0.4627
 epoch: 99, train_loss: 0.8809, test_loss: 0.9763, test_f1: 0.4796
##################ITERATION #6 ****************************************
 epoch: 0, train_loss: 1.3429, test_loss: 1.2816, test_f1: 0.2274
 epoch: 1, train_loss: 1.2640, test_loss: 1.2390, test_f1: 0.2300
 epoch: 2, train_loss: 1.2568, test_loss: 1.2028, test_f1: 0.3284
 epoch: 3, train_loss: 1.2379, test_loss: 1.1872, test_f1: 0.3636
 epoch: 4, train_loss: 1.2257, test_loss: 1.1806, test_f1: 0.3753
 epoch: 5, train_loss: 1.2151, test_loss: 1.1829, test_f1: 0.3729
 epoch: 6, train_loss: 1.2092, test_loss: 1.1633, test_f1: 0.3794
 epoch: 7, train_loss: 1.1914, test_loss: 1.1616, test_f1: 0.3866
 epoch: 8, train_loss: 1.1979, test_loss: 1.1505, test_f1: 0.4054
 epoch: 9, train_loss: 1.1909, test_loss: 1.1403, test_f1: 0.4008
 epoch: 10, train_loss: 1.1900, test_loss: 1.1389, test_f1: 0.4044
 epoch: 11, train_loss: 1.1749, test_loss: 1.1244, test_f1: 0.3910
 epoch: 12, train_loss: 1.1603, test_loss: 1.1153, test_f1: 0.4055
 epoch: 13, train_loss: 1.1517, test_loss: 1.1032, test_f1: 0.3941
 epoch: 14, train_loss: 1.1363, test_loss: 1.0964, test_f1: 0.4048
 epoch: 15, train_loss: 1.1391, test_loss: 1.0888, test_f1: 0.4284
 epoch: 16, train_loss: 1.1282, test_loss: 1.0766, test_f1: 0.4035
 epoch: 17, train_loss: 1.1212, test_loss: 1.0761, test_f1: 0.4137
 epoch: 18, train_loss: 1.1040, test_loss: 1.0622, test_f1: 0.4109
 epoch: 19, train_loss: 1.1131, test_loss: 1.0536, test_f1: 0.4267
 epoch: 20, train_loss: 1.1003, test_loss: 1.0556, test_f1: 0.4289
 epoch: 21, train_loss: 1.1052, test_loss: 1.0342, test_f1: 0.4277
 epoch: 22, train_loss: 1.0886, test_loss: 1.0427, test_f1: 0.4081
 epoch: 23, train_loss: 1.0776, test_loss: 1.0231, test_f1: 0.4291
 epoch: 24, train_loss: 1.0773, test_loss: 1.0367, test_f1: 0.4361
 epoch: 25, train_loss: 1.0696, test_loss: 1.0265, test_f1: 0.4234
 epoch: 26, train_loss: 1.0678, test_loss: 1.0174, test_f1: 0.4531
 epoch: 27, train_loss: 1.0618, test_loss: 0.9979, test_f1: 0.4516
 epoch: 28, train_loss: 1.0650, test_loss: 1.0278, test_f1: 0.4306
 epoch: 29, train_loss: 1.0542, test_loss: 0.9881, test_f1: 0.4638
 epoch: 30, train_loss: 1.0383, test_loss: 0.9864, test_f1: 0.4617
 epoch: 31, train_loss: 1.0417, test_loss: 1.0293, test_f1: 0.4438
 epoch: 32, train_loss: 1.0346, test_loss: 1.0061, test_f1: 0.4487
 epoch: 33, train_loss: 1.0224, test_loss: 0.9939, test_f1: 0.4528
 epoch: 34, train_loss: 1.0176, test_loss: 1.0001, test_f1: 0.4692
 epoch: 35, train_loss: 1.0237, test_loss: 0.9992, test_f1: 0.4515
 epoch: 36, train_loss: 1.0225, test_loss: 1.0070, test_f1: 0.4653
 epoch: 37, train_loss: 1.0151, test_loss: 1.0055, test_f1: 0.4588
 epoch: 38, train_loss: 1.0071, test_loss: 0.9795, test_f1: 0.4588
 epoch: 39, train_loss: 1.0051, test_loss: 1.0120, test_f1: 0.4548
 epoch: 40, train_loss: 1.0058, test_loss: 1.0016, test_f1: 0.4631
 epoch: 41, train_loss: 0.9966, test_loss: 0.9967, test_f1: 0.4651
 epoch: 42, train_loss: 0.9904, test_loss: 1.0111, test_f1: 0.4548
 epoch: 43, train_loss: 0.9789, test_loss: 1.0101, test_f1: 0.4674
 epoch: 44, train_loss: 0.9832, test_loss: 1.0058, test_f1: 0.4498
 epoch: 45, train_loss: 0.9813, test_loss: 0.9918, test_f1: 0.4618
 epoch: 46, train_loss: 0.9703, test_loss: 1.0126, test_f1: 0.4693
 epoch: 47, train_loss: 0.9775, test_loss: 1.0225, test_f1: 0.4776
 epoch: 48, train_loss: 0.9740, test_loss: 1.0333, test_f1: 0.4561
 epoch: 49, train_loss: 0.9725, test_loss: 1.0021, test_f1: 0.4675
 epoch: 50, train_loss: 0.9779, test_loss: 1.0018, test_f1: 0.4709
 epoch: 51, train_loss: 0.9530, test_loss: 1.0122, test_f1: 0.4620
 epoch: 52, train_loss: 0.9565, test_loss: 1.0095, test_f1: 0.4672
 epoch: 53, train_loss: 0.9570, test_loss: 1.0097, test_f1: 0.4652
 epoch: 54, train_loss: 0.9524, test_loss: 0.9939, test_f1: 0.4724
 epoch: 55, train_loss: 0.9343, test_loss: 1.0067, test_f1: 0.4674
 epoch: 56, train_loss: 0.9343, test_loss: 0.9999, test_f1: 0.4711
 epoch: 57, train_loss: 0.9408, test_loss: 1.0041, test_f1: 0.4635
 epoch: 58, train_loss: 0.9505, test_loss: 1.0055, test_f1: 0.4629
 epoch: 59, train_loss: 0.9518, test_loss: 1.0118, test_f1: 0.4647
 epoch: 60, train_loss: 0.9290, test_loss: 1.0050, test_f1: 0.4735
 epoch: 61, train_loss: 0.9293, test_loss: 1.0006, test_f1: 0.4681
 epoch: 62, train_loss: 0.9253, test_loss: 1.0291, test_f1: 0.4812
 epoch: 63, train_loss: 0.9365, test_loss: 1.0072, test_f1: 0.4786
 epoch: 64, train_loss: 0.9241, test_loss: 1.0150, test_f1: 0.4736
 epoch: 65, train_loss: 0.9336, test_loss: 1.0316, test_f1: 0.4656
 epoch: 66, train_loss: 0.9293, test_loss: 1.0005, test_f1: 0.4748
 epoch: 67, train_loss: 0.9192, test_loss: 1.0386, test_f1: 0.4651
 epoch: 68, train_loss: 0.9308, test_loss: 1.0099, test_f1: 0.4785
 epoch: 69, train_loss: 0.9250, test_loss: 1.0179, test_f1: 0.4700
 epoch: 70, train_loss: 0.9390, test_loss: 1.0220, test_f1: 0.4645
 epoch: 71, train_loss: 0.9231, test_loss: 1.0553, test_f1: 0.4623
 epoch: 72, train_loss: 0.9377, test_loss: 1.0165, test_f1: 0.4742
 epoch: 73, train_loss: 0.9218, test_loss: 1.0129, test_f1: 0.4727
 epoch: 74, train_loss: 0.9289, test_loss: 1.0192, test_f1: 0.4853
 epoch: 75, train_loss: 0.9146, test_loss: 1.0329, test_f1: 0.4760
 epoch: 76, train_loss: 0.9290, test_loss: 1.0413, test_f1: 0.4628
 epoch: 77, train_loss: 0.9204, test_loss: 1.0228, test_f1: 0.4700
 epoch: 78, train_loss: 0.9164, test_loss: 1.0395, test_f1: 0.4770
 epoch: 79, train_loss: 0.9131, test_loss: 1.0527, test_f1: 0.4758
 epoch: 80, train_loss: 0.9120, test_loss: 1.0709, test_f1: 0.4723
 epoch: 81, train_loss: 0.9043, test_loss: 1.0531, test_f1: 0.4678
 epoch: 82, train_loss: 0.9220, test_loss: 1.0442, test_f1: 0.4731
 epoch: 83, train_loss: 0.9043, test_loss: 1.0469, test_f1: 0.4678
 epoch: 84, train_loss: 0.9179, test_loss: 1.0295, test_f1: 0.4761
 epoch: 85, train_loss: 0.9018, test_loss: 1.0372, test_f1: 0.4701
 epoch: 86, train_loss: 0.9083, test_loss: 1.0523, test_f1: 0.4621
 epoch: 87, train_loss: 0.9092, test_loss: 1.0589, test_f1: 0.4729
 epoch: 88, train_loss: 0.9007, test_loss: 1.0455, test_f1: 0.4771
 epoch: 89, train_loss: 0.9056, test_loss: 1.0422, test_f1: 0.4774
 epoch: 90, train_loss: 0.9017, test_loss: 1.0218, test_f1: 0.4763
 epoch: 91, train_loss: 0.9114, test_loss: 1.0428, test_f1: 0.4759
 epoch: 92, train_loss: 0.9072, test_loss: 1.0455, test_f1: 0.4771
 epoch: 93, train_loss: 0.9038, test_loss: 1.0508, test_f1: 0.4752
 epoch: 94, train_loss: 0.8936, test_loss: 1.0280, test_f1: 0.4697
 epoch: 95, train_loss: 0.9014, test_loss: 1.0627, test_f1: 0.4716
 epoch: 96, train_loss: 0.9048, test_loss: 1.0455, test_f1: 0.4670
 epoch: 97, train_loss: 0.9033, test_loss: 1.0527, test_f1: 0.4704
 epoch: 98, train_loss: 0.9031, test_loss: 1.0619, test_f1: 0.4648
 epoch: 99, train_loss: 0.8855, test_loss: 1.0500, test_f1: 0.4762
##################ITERATION #7 ****************************************
 epoch: 0, train_loss: 1.4886, test_loss: 1.3390, test_f1: 0.2274
 epoch: 1, train_loss: 1.2926, test_loss: 1.2525, test_f1: 0.2814
 epoch: 2, train_loss: 1.2607, test_loss: 1.2192, test_f1: 0.3063
 epoch: 3, train_loss: 1.2431, test_loss: 1.1855, test_f1: 0.3265
 epoch: 4, train_loss: 1.2296, test_loss: 1.1692, test_f1: 0.3320
 epoch: 5, train_loss: 1.2165, test_loss: 1.1501, test_f1: 0.3454
 epoch: 6, train_loss: 1.2029, test_loss: 1.1414, test_f1: 0.3420
 epoch: 7, train_loss: 1.1980, test_loss: 1.1360, test_f1: 0.3401
 epoch: 8, train_loss: 1.1905, test_loss: 1.1285, test_f1: 0.3703
 epoch: 9, train_loss: 1.1769, test_loss: 1.1187, test_f1: 0.3689
 epoch: 10, train_loss: 1.1726, test_loss: 1.1095, test_f1: 0.3908
 epoch: 11, train_loss: 1.1633, test_loss: 1.0994, test_f1: 0.3828
 epoch: 12, train_loss: 1.1606, test_loss: 1.0968, test_f1: 0.4062
 epoch: 13, train_loss: 1.1490, test_loss: 1.0935, test_f1: 0.4191
 epoch: 14, train_loss: 1.1419, test_loss: 1.0880, test_f1: 0.4321
 epoch: 15, train_loss: 1.1358, test_loss: 1.0808, test_f1: 0.4332
 epoch: 16, train_loss: 1.1355, test_loss: 1.0710, test_f1: 0.4396
 epoch: 17, train_loss: 1.1222, test_loss: 1.0630, test_f1: 0.4494
 epoch: 18, train_loss: 1.1204, test_loss: 1.0613, test_f1: 0.4447
 epoch: 19, train_loss: 1.1130, test_loss: 1.0474, test_f1: 0.4565
 epoch: 20, train_loss: 1.1007, test_loss: 1.0516, test_f1: 0.4434
 epoch: 21, train_loss: 1.0930, test_loss: 1.0592, test_f1: 0.4430
 epoch: 22, train_loss: 1.0980, test_loss: 1.0428, test_f1: 0.4184
 epoch: 23, train_loss: 1.0965, test_loss: 1.0276, test_f1: 0.4532
 epoch: 24, train_loss: 1.0857, test_loss: 1.0378, test_f1: 0.4561
 epoch: 25, train_loss: 1.0782, test_loss: 1.0286, test_f1: 0.4559
 epoch: 26, train_loss: 1.0711, test_loss: 1.0576, test_f1: 0.4390
 epoch: 27, train_loss: 1.0675, test_loss: 1.0434, test_f1: 0.4322
 epoch: 28, train_loss: 1.0594, test_loss: 1.0378, test_f1: 0.4296
 epoch: 29, train_loss: 1.0667, test_loss: 1.0248, test_f1: 0.4425
 epoch: 30, train_loss: 1.0575, test_loss: 1.0276, test_f1: 0.4746
 epoch: 31, train_loss: 1.0458, test_loss: 1.0298, test_f1: 0.4487
 epoch: 32, train_loss: 1.0518, test_loss: 1.0069, test_f1: 0.4673
 epoch: 33, train_loss: 1.0579, test_loss: 1.0109, test_f1: 0.4488
 epoch: 34, train_loss: 1.0438, test_loss: 1.0094, test_f1: 0.4759
 epoch: 35, train_loss: 1.0377, test_loss: 0.9946, test_f1: 0.4734
 epoch: 36, train_loss: 1.0382, test_loss: 1.0043, test_f1: 0.4600
 epoch: 37, train_loss: 1.0272, test_loss: 0.9878, test_f1: 0.4906
 epoch: 38, train_loss: 1.0421, test_loss: 1.0058, test_f1: 0.4829
 epoch: 39, train_loss: 1.0257, test_loss: 0.9915, test_f1: 0.4495
 epoch: 40, train_loss: 1.0255, test_loss: 0.9931, test_f1: 0.4523
 epoch: 41, train_loss: 1.0162, test_loss: 0.9943, test_f1: 0.4712
 epoch: 42, train_loss: 1.0171, test_loss: 0.9882, test_f1: 0.4723
 epoch: 43, train_loss: 1.0118, test_loss: 0.9843, test_f1: 0.4712
 epoch: 44, train_loss: 1.0097, test_loss: 1.0053, test_f1: 0.4364
 epoch: 45, train_loss: 1.0200, test_loss: 0.9687, test_f1: 0.4818
 epoch: 46, train_loss: 1.0002, test_loss: 0.9765, test_f1: 0.4684
 epoch: 47, train_loss: 1.0058, test_loss: 0.9858, test_f1: 0.4773
 epoch: 48, train_loss: 0.9989, test_loss: 0.9995, test_f1: 0.4500
 epoch: 49, train_loss: 0.9989, test_loss: 0.9787, test_f1: 0.4830
 epoch: 50, train_loss: 0.9937, test_loss: 0.9839, test_f1: 0.4902
 epoch: 51, train_loss: 0.9862, test_loss: 0.9689, test_f1: 0.4809
 epoch: 52, train_loss: 0.9881, test_loss: 0.9835, test_f1: 0.4585
 epoch: 53, train_loss: 0.9797, test_loss: 0.9837, test_f1: 0.4660
 epoch: 54, train_loss: 0.9721, test_loss: 0.9913, test_f1: 0.4593
 epoch: 55, train_loss: 0.9713, test_loss: 0.9768, test_f1: 0.4808
 epoch: 56, train_loss: 0.9697, test_loss: 0.9981, test_f1: 0.4511
 epoch: 57, train_loss: 0.9760, test_loss: 0.9706, test_f1: 0.4648
 epoch: 58, train_loss: 0.9731, test_loss: 0.9783, test_f1: 0.4536
 epoch: 59, train_loss: 0.9639, test_loss: 0.9780, test_f1: 0.4747
 epoch: 60, train_loss: 0.9724, test_loss: 0.9819, test_f1: 0.4682
 epoch: 61, train_loss: 0.9658, test_loss: 0.9979, test_f1: 0.4669
 epoch: 62, train_loss: 0.9639, test_loss: 0.9723, test_f1: 0.4773
 epoch: 63, train_loss: 0.9499, test_loss: 0.9901, test_f1: 0.4741
 epoch: 64, train_loss: 0.9614, test_loss: 0.9958, test_f1: 0.4692
 epoch: 65, train_loss: 0.9495, test_loss: 1.0208, test_f1: 0.4642
 epoch: 66, train_loss: 0.9715, test_loss: 1.0070, test_f1: 0.4455
 epoch: 67, train_loss: 0.9518, test_loss: 0.9908, test_f1: 0.4634
 epoch: 68, train_loss: 0.9570, test_loss: 0.9968, test_f1: 0.4580
 epoch: 69, train_loss: 0.9528, test_loss: 0.9984, test_f1: 0.4479
 epoch: 70, train_loss: 0.9559, test_loss: 1.0266, test_f1: 0.4410
 epoch: 71, train_loss: 0.9576, test_loss: 1.0024, test_f1: 0.4609
 epoch: 72, train_loss: 0.9364, test_loss: 0.9998, test_f1: 0.4546
 epoch: 73, train_loss: 0.9545, test_loss: 0.9915, test_f1: 0.4517
 epoch: 74, train_loss: 0.9476, test_loss: 1.0088, test_f1: 0.4614
 epoch: 75, train_loss: 0.9379, test_loss: 0.9939, test_f1: 0.4656
 epoch: 76, train_loss: 0.9417, test_loss: 0.9870, test_f1: 0.4826
 epoch: 77, train_loss: 0.9482, test_loss: 1.0002, test_f1: 0.4751
 epoch: 78, train_loss: 0.9437, test_loss: 1.0109, test_f1: 0.4723
 epoch: 79, train_loss: 0.9392, test_loss: 0.9898, test_f1: 0.4773
 epoch: 80, train_loss: 0.9321, test_loss: 1.0147, test_f1: 0.4515
 epoch: 81, train_loss: 0.9329, test_loss: 1.0035, test_f1: 0.4625
 epoch: 82, train_loss: 0.9317, test_loss: 1.0144, test_f1: 0.4477
 epoch: 83, train_loss: 0.9379, test_loss: 1.0340, test_f1: 0.4543
 epoch: 84, train_loss: 0.9336, test_loss: 0.9968, test_f1: 0.4574
 epoch: 85, train_loss: 0.9233, test_loss: 1.0094, test_f1: 0.4539
 epoch: 86, train_loss: 0.9192, test_loss: 1.0136, test_f1: 0.4777
 epoch: 87, train_loss: 0.9284, test_loss: 1.0299, test_f1: 0.4762
 epoch: 88, train_loss: 0.9243, test_loss: 0.9772, test_f1: 0.4701
 epoch: 89, train_loss: 0.9198, test_loss: 1.0025, test_f1: 0.4622
 epoch: 90, train_loss: 0.9289, test_loss: 0.9776, test_f1: 0.4789
 epoch: 91, train_loss: 0.9431, test_loss: 1.0233, test_f1: 0.4402
 epoch: 92, train_loss: 0.9096, test_loss: 0.9798, test_f1: 0.4540
 epoch: 93, train_loss: 0.9272, test_loss: 0.9962, test_f1: 0.4542
 epoch: 94, train_loss: 0.9252, test_loss: 0.9928, test_f1: 0.4616
 epoch: 95, train_loss: 0.9243, test_loss: 0.9669, test_f1: 0.4746
 epoch: 96, train_loss: 0.9261, test_loss: 0.9732, test_f1: 0.4750
 epoch: 97, train_loss: 0.9059, test_loss: 0.9845, test_f1: 0.4848
 epoch: 98, train_loss: 0.9171, test_loss: 0.9906, test_f1: 0.4784
 epoch: 99, train_loss: 0.9228, test_loss: 0.9701, test_f1: 0.4774
##################ITERATION #8 ****************************************
 epoch: 0, train_loss: 1.6812, test_loss: 1.3243, test_f1: 0.2461
 epoch: 1, train_loss: 1.3169, test_loss: 1.2450, test_f1: 0.2766
 epoch: 2, train_loss: 1.2848, test_loss: 1.2107, test_f1: 0.2969
 epoch: 3, train_loss: 1.2477, test_loss: 1.1960, test_f1: 0.3302
 epoch: 4, train_loss: 1.2421, test_loss: 1.1868, test_f1: 0.3386
 epoch: 5, train_loss: 1.2236, test_loss: 1.1897, test_f1: 0.3370
 epoch: 6, train_loss: 1.2150, test_loss: 1.1750, test_f1: 0.3857
 epoch: 7, train_loss: 1.2019, test_loss: 1.1532, test_f1: 0.3777
 epoch: 8, train_loss: 1.2052, test_loss: 1.1516, test_f1: 0.4001
 epoch: 9, train_loss: 1.1854, test_loss: 1.1365, test_f1: 0.3972
 epoch: 10, train_loss: 1.1815, test_loss: 1.1349, test_f1: 0.4105
 epoch: 11, train_loss: 1.1773, test_loss: 1.1238, test_f1: 0.4194
 epoch: 12, train_loss: 1.1685, test_loss: 1.1120, test_f1: 0.4193
 epoch: 13, train_loss: 1.1683, test_loss: 1.1044, test_f1: 0.4417
 epoch: 14, train_loss: 1.1605, test_loss: 1.1014, test_f1: 0.4480
 epoch: 15, train_loss: 1.1575, test_loss: 1.0995, test_f1: 0.4193
 epoch: 16, train_loss: 1.1415, test_loss: 1.0894, test_f1: 0.4226
 epoch: 17, train_loss: 1.1314, test_loss: 1.0775, test_f1: 0.4296
 epoch: 18, train_loss: 1.1367, test_loss: 1.0826, test_f1: 0.4365
 epoch: 19, train_loss: 1.1195, test_loss: 1.0597, test_f1: 0.4280
 epoch: 20, train_loss: 1.1115, test_loss: 1.0498, test_f1: 0.4420
 epoch: 21, train_loss: 1.1146, test_loss: 1.0422, test_f1: 0.4589
 epoch: 22, train_loss: 1.1040, test_loss: 1.0368, test_f1: 0.4524
 epoch: 23, train_loss: 1.1054, test_loss: 1.0313, test_f1: 0.4565
 epoch: 24, train_loss: 1.1038, test_loss: 1.0276, test_f1: 0.4578
 epoch: 25, train_loss: 1.0871, test_loss: 1.0321, test_f1: 0.4429
 epoch: 26, train_loss: 1.0809, test_loss: 1.0134, test_f1: 0.4413
 epoch: 27, train_loss: 1.0782, test_loss: 1.0225, test_f1: 0.4332
 epoch: 28, train_loss: 1.0709, test_loss: 1.0039, test_f1: 0.4605
 epoch: 29, train_loss: 1.0694, test_loss: 1.0030, test_f1: 0.4463
 epoch: 30, train_loss: 1.0676, test_loss: 1.0085, test_f1: 0.4532
 epoch: 31, train_loss: 1.0627, test_loss: 1.0078, test_f1: 0.4483
 epoch: 32, train_loss: 1.0473, test_loss: 1.0125, test_f1: 0.4479
 epoch: 33, train_loss: 1.0609, test_loss: 0.9905, test_f1: 0.4495
 epoch: 34, train_loss: 1.0328, test_loss: 1.0070, test_f1: 0.4354
 epoch: 35, train_loss: 1.0373, test_loss: 0.9886, test_f1: 0.4495
 epoch: 36, train_loss: 1.0335, test_loss: 0.9863, test_f1: 0.4448
 epoch: 37, train_loss: 1.0219, test_loss: 0.9979, test_f1: 0.4503
 epoch: 38, train_loss: 1.0256, test_loss: 0.9927, test_f1: 0.4463
 epoch: 39, train_loss: 1.0169, test_loss: 0.9817, test_f1: 0.4522
 epoch: 40, train_loss: 1.0109, test_loss: 0.9743, test_f1: 0.4526
 epoch: 41, train_loss: 1.0210, test_loss: 0.9717, test_f1: 0.4585
 epoch: 42, train_loss: 1.0038, test_loss: 0.9970, test_f1: 0.4487
 epoch: 43, train_loss: 1.0101, test_loss: 0.9908, test_f1: 0.4441
 epoch: 44, train_loss: 1.0090, test_loss: 0.9663, test_f1: 0.4505
 epoch: 45, train_loss: 0.9976, test_loss: 0.9814, test_f1: 0.4462
 epoch: 46, train_loss: 0.9958, test_loss: 1.0069, test_f1: 0.4459
 epoch: 47, train_loss: 0.9992, test_loss: 0.9982, test_f1: 0.4342
 epoch: 48, train_loss: 0.9829, test_loss: 0.9972, test_f1: 0.4436
 epoch: 49, train_loss: 0.9850, test_loss: 1.0448, test_f1: 0.4190
 epoch: 50, train_loss: 0.9960, test_loss: 0.9749, test_f1: 0.4400
 epoch: 51, train_loss: 0.9755, test_loss: 0.9894, test_f1: 0.4356
 epoch: 52, train_loss: 0.9741, test_loss: 0.9796, test_f1: 0.4422
 epoch: 53, train_loss: 0.9735, test_loss: 0.9801, test_f1: 0.4330
 epoch: 54, train_loss: 0.9734, test_loss: 0.9800, test_f1: 0.4325
 epoch: 55, train_loss: 0.9696, test_loss: 0.9802, test_f1: 0.4365
 epoch: 56, train_loss: 0.9739, test_loss: 0.9688, test_f1: 0.4448
 epoch: 57, train_loss: 0.9748, test_loss: 1.0002, test_f1: 0.4326
 epoch: 58, train_loss: 0.9708, test_loss: 0.9753, test_f1: 0.4542
 epoch: 59, train_loss: 0.9613, test_loss: 0.9904, test_f1: 0.4444
 epoch: 60, train_loss: 0.9555, test_loss: 0.9989, test_f1: 0.4571
 epoch: 61, train_loss: 0.9721, test_loss: 0.9829, test_f1: 0.4539
 epoch: 62, train_loss: 0.9618, test_loss: 0.9884, test_f1: 0.4561
 epoch: 63, train_loss: 0.9516, test_loss: 0.9941, test_f1: 0.4621
 epoch: 64, train_loss: 0.9573, test_loss: 0.9708, test_f1: 0.4570
 epoch: 65, train_loss: 0.9532, test_loss: 1.0009, test_f1: 0.4613
 epoch: 66, train_loss: 0.9565, test_loss: 0.9955, test_f1: 0.4722
 epoch: 67, train_loss: 0.9496, test_loss: 0.9709, test_f1: 0.4555
 epoch: 68, train_loss: 0.9587, test_loss: 1.0253, test_f1: 0.4557
 epoch: 69, train_loss: 0.9585, test_loss: 1.0041, test_f1: 0.4461
 epoch: 70, train_loss: 0.9525, test_loss: 0.9699, test_f1: 0.4663
 epoch: 71, train_loss: 0.9524, test_loss: 0.9875, test_f1: 0.4803
 epoch: 72, train_loss: 0.9557, test_loss: 1.0072, test_f1: 0.4550
 epoch: 73, train_loss: 0.9338, test_loss: 0.9928, test_f1: 0.4584
 epoch: 74, train_loss: 0.9501, test_loss: 0.9775, test_f1: 0.4699
 epoch: 75, train_loss: 0.9456, test_loss: 0.9895, test_f1: 0.4728
 epoch: 76, train_loss: 0.9450, test_loss: 0.9879, test_f1: 0.4739
 epoch: 77, train_loss: 0.9437, test_loss: 0.9885, test_f1: 0.4743
 epoch: 78, train_loss: 0.9416, test_loss: 0.9937, test_f1: 0.4693
 epoch: 79, train_loss: 0.9261, test_loss: 1.0131, test_f1: 0.4719
 epoch: 80, train_loss: 0.9308, test_loss: 1.0123, test_f1: 0.4727
 epoch: 81, train_loss: 0.9234, test_loss: 1.0149, test_f1: 0.4641
 epoch: 82, train_loss: 0.9284, test_loss: 1.0149, test_f1: 0.4737
 epoch: 83, train_loss: 0.9251, test_loss: 1.0164, test_f1: 0.4742
 epoch: 84, train_loss: 0.9223, test_loss: 1.0237, test_f1: 0.4700
 epoch: 85, train_loss: 0.9393, test_loss: 1.0245, test_f1: 0.4639
 epoch: 86, train_loss: 0.9110, test_loss: 1.0291, test_f1: 0.4752
 epoch: 87, train_loss: 0.9296, test_loss: 1.0273, test_f1: 0.4710
 epoch: 88, train_loss: 0.9175, test_loss: 1.0346, test_f1: 0.4691
 epoch: 89, train_loss: 0.9260, test_loss: 1.0160, test_f1: 0.4827
 epoch: 90, train_loss: 0.9226, test_loss: 1.0231, test_f1: 0.4833
 epoch: 91, train_loss: 0.9178, test_loss: 1.0611, test_f1: 0.4568
 epoch: 92, train_loss: 0.9183, test_loss: 1.0409, test_f1: 0.4719
 epoch: 93, train_loss: 0.9116, test_loss: 1.0337, test_f1: 0.4593
 epoch: 94, train_loss: 0.9172, test_loss: 1.0124, test_f1: 0.4801
 epoch: 95, train_loss: 0.9171, test_loss: 1.0018, test_f1: 0.4937
 epoch: 96, train_loss: 0.9103, test_loss: 1.0260, test_f1: 0.4813
 epoch: 97, train_loss: 0.9198, test_loss: 1.0334, test_f1: 0.4757
 epoch: 98, train_loss: 0.9034, test_loss: 1.0324, test_f1: 0.4801
 epoch: 99, train_loss: 0.9160, test_loss: 1.0564, test_f1: 0.4765
##################ITERATION #9 ****************************************
 epoch: 0, train_loss: 1.3445, test_loss: 1.2551, test_f1: 0.2274
 epoch: 1, train_loss: 1.2764, test_loss: 1.2045, test_f1: 0.2889
 epoch: 2, train_loss: 1.2459, test_loss: 1.1952, test_f1: 0.3348
 epoch: 3, train_loss: 1.2211, test_loss: 1.1730, test_f1: 0.3457
 epoch: 4, train_loss: 1.2257, test_loss: 1.1708, test_f1: 0.3530
 epoch: 5, train_loss: 1.1969, test_loss: 1.1545, test_f1: 0.3899
 epoch: 6, train_loss: 1.1938, test_loss: 1.1422, test_f1: 0.3961
 epoch: 7, train_loss: 1.1893, test_loss: 1.1297, test_f1: 0.4011
 epoch: 8, train_loss: 1.1864, test_loss: 1.1203, test_f1: 0.4125
 epoch: 9, train_loss: 1.1596, test_loss: 1.1058, test_f1: 0.4154
 epoch: 10, train_loss: 1.1658, test_loss: 1.1083, test_f1: 0.4239
 epoch: 11, train_loss: 1.1497, test_loss: 1.0793, test_f1: 0.4307
 epoch: 12, train_loss: 1.1448, test_loss: 1.0808, test_f1: 0.4314
 epoch: 13, train_loss: 1.1392, test_loss: 1.0717, test_f1: 0.4292
 epoch: 14, train_loss: 1.1364, test_loss: 1.0671, test_f1: 0.4387
 epoch: 15, train_loss: 1.1143, test_loss: 1.0505, test_f1: 0.4410
 epoch: 16, train_loss: 1.1056, test_loss: 1.0568, test_f1: 0.4339
 epoch: 17, train_loss: 1.1074, test_loss: 1.0424, test_f1: 0.4416
 epoch: 18, train_loss: 1.1025, test_loss: 1.0307, test_f1: 0.4448
 epoch: 19, train_loss: 1.0949, test_loss: 1.0234, test_f1: 0.4476
 epoch: 20, train_loss: 1.0857, test_loss: 1.0201, test_f1: 0.4553
 epoch: 21, train_loss: 1.0751, test_loss: 1.0232, test_f1: 0.4448
 epoch: 22, train_loss: 1.0765, test_loss: 1.0117, test_f1: 0.4388
 epoch: 23, train_loss: 1.0715, test_loss: 0.9994, test_f1: 0.4515
 epoch: 24, train_loss: 1.0606, test_loss: 0.9994, test_f1: 0.4520
 epoch: 25, train_loss: 1.0506, test_loss: 1.0138, test_f1: 0.4567
 epoch: 26, train_loss: 1.0529, test_loss: 1.0176, test_f1: 0.4418
 epoch: 27, train_loss: 1.0360, test_loss: 0.9937, test_f1: 0.4658
 epoch: 28, train_loss: 1.0522, test_loss: 0.9998, test_f1: 0.4475
 epoch: 29, train_loss: 1.0507, test_loss: 0.9685, test_f1: 0.4607
 epoch: 30, train_loss: 1.0392, test_loss: 0.9870, test_f1: 0.4500
 epoch: 31, train_loss: 1.0215, test_loss: 0.9947, test_f1: 0.4444
 epoch: 32, train_loss: 1.0068, test_loss: 0.9877, test_f1: 0.4485
 epoch: 33, train_loss: 1.0197, test_loss: 0.9945, test_f1: 0.4607
 epoch: 34, train_loss: 1.0073, test_loss: 0.9871, test_f1: 0.4502
 epoch: 35, train_loss: 0.9935, test_loss: 0.9821, test_f1: 0.4447
 epoch: 36, train_loss: 0.9891, test_loss: 0.9668, test_f1: 0.4610
 epoch: 37, train_loss: 0.9919, test_loss: 0.9736, test_f1: 0.4695
 epoch: 38, train_loss: 0.9919, test_loss: 0.9692, test_f1: 0.4629
 epoch: 39, train_loss: 0.9854, test_loss: 0.9698, test_f1: 0.4569
 epoch: 40, train_loss: 0.9847, test_loss: 0.9767, test_f1: 0.4657
 epoch: 41, train_loss: 0.9786, test_loss: 0.9649, test_f1: 0.4719
 epoch: 42, train_loss: 0.9778, test_loss: 1.0061, test_f1: 0.4699
 epoch: 43, train_loss: 0.9698, test_loss: 0.9831, test_f1: 0.4792
 epoch: 44, train_loss: 0.9626, test_loss: 0.9738, test_f1: 0.4688
 epoch: 45, train_loss: 0.9611, test_loss: 0.9712, test_f1: 0.4772
 epoch: 46, train_loss: 0.9549, test_loss: 0.9814, test_f1: 0.4721
 epoch: 47, train_loss: 0.9593, test_loss: 0.9967, test_f1: 0.4603
 epoch: 48, train_loss: 0.9571, test_loss: 0.9517, test_f1: 0.4714
 epoch: 49, train_loss: 0.9609, test_loss: 0.9814, test_f1: 0.4638
 epoch: 50, train_loss: 0.9524, test_loss: 0.9633, test_f1: 0.4929
 epoch: 51, train_loss: 0.9351, test_loss: 0.9680, test_f1: 0.4865
 epoch: 52, train_loss: 0.9286, test_loss: 0.9587, test_f1: 0.4900
 epoch: 53, train_loss: 0.9242, test_loss: 0.9912, test_f1: 0.4774
 epoch: 54, train_loss: 0.9334, test_loss: 0.9598, test_f1: 0.4753
 epoch: 55, train_loss: 0.9258, test_loss: 0.9792, test_f1: 0.4739
 epoch: 56, train_loss: 0.9224, test_loss: 0.9769, test_f1: 0.4816
 epoch: 57, train_loss: 0.9154, test_loss: 0.9896, test_f1: 0.4918
 epoch: 58, train_loss: 0.9202, test_loss: 0.9776, test_f1: 0.4925
 epoch: 59, train_loss: 0.9222, test_loss: 1.0034, test_f1: 0.4840
 epoch: 60, train_loss: 0.9172, test_loss: 0.9750, test_f1: 0.4869
 epoch: 61, train_loss: 0.9232, test_loss: 0.9926, test_f1: 0.4862
 epoch: 62, train_loss: 0.9164, test_loss: 0.9988, test_f1: 0.4863
 epoch: 63, train_loss: 0.9153, test_loss: 0.9878, test_f1: 0.4872
 epoch: 64, train_loss: 0.9107, test_loss: 0.9948, test_f1: 0.4956
 epoch: 65, train_loss: 0.9098, test_loss: 1.0101, test_f1: 0.4917
 epoch: 66, train_loss: 0.9120, test_loss: 1.0093, test_f1: 0.4971
 epoch: 67, train_loss: 0.9181, test_loss: 0.9959, test_f1: 0.4794
 epoch: 68, train_loss: 0.9066, test_loss: 0.9873, test_f1: 0.4888
 epoch: 69, train_loss: 0.9080, test_loss: 0.9980, test_f1: 0.4875
 epoch: 70, train_loss: 0.8991, test_loss: 0.9832, test_f1: 0.4909
 epoch: 71, train_loss: 0.8999, test_loss: 1.0103, test_f1: 0.4814
 epoch: 72, train_loss: 0.9074, test_loss: 0.9979, test_f1: 0.4963
 epoch: 73, train_loss: 0.9020, test_loss: 1.0132, test_f1: 0.4808
 epoch: 74, train_loss: 0.8983, test_loss: 1.0087, test_f1: 0.5124
 epoch: 75, train_loss: 0.8909, test_loss: 1.0142, test_f1: 0.4817
 epoch: 76, train_loss: 0.8888, test_loss: 1.0200, test_f1: 0.4897
 epoch: 77, train_loss: 0.9020, test_loss: 1.0437, test_f1: 0.4805
 epoch: 78, train_loss: 0.8944, test_loss: 0.9988, test_f1: 0.4905
 epoch: 79, train_loss: 0.8932, test_loss: 0.9887, test_f1: 0.4838
 epoch: 80, train_loss: 0.8937, test_loss: 1.0190, test_f1: 0.4861
 epoch: 81, train_loss: 0.8724, test_loss: 1.0218, test_f1: 0.4920
 epoch: 82, train_loss: 0.8857, test_loss: 1.0373, test_f1: 0.4907
 epoch: 83, train_loss: 0.8837, test_loss: 1.0361, test_f1: 0.5051
 epoch: 84, train_loss: 0.8872, test_loss: 1.0163, test_f1: 0.4989
 epoch: 85, train_loss: 0.8848, test_loss: 1.0228, test_f1: 0.4933
 epoch: 86, train_loss: 0.8935, test_loss: 0.9925, test_f1: 0.4980
 epoch: 87, train_loss: 0.8739, test_loss: 1.0160, test_f1: 0.4990
 epoch: 88, train_loss: 0.8756, test_loss: 1.0059, test_f1: 0.4924
 epoch: 89, train_loss: 0.8820, test_loss: 1.0385, test_f1: 0.4929
 epoch: 90, train_loss: 0.8726, test_loss: 1.0400, test_f1: 0.5004
 epoch: 91, train_loss: 0.8712, test_loss: 1.0313, test_f1: 0.5038
 epoch: 92, train_loss: 0.8740, test_loss: 1.0381, test_f1: 0.4966
 epoch: 93, train_loss: 0.8753, test_loss: 1.0154, test_f1: 0.5016
 epoch: 94, train_loss: 0.8755, test_loss: 1.0419, test_f1: 0.4937
 epoch: 95, train_loss: 0.8572, test_loss: 1.0562, test_f1: 0.4921
 epoch: 96, train_loss: 0.8667, test_loss: 1.0197, test_f1: 0.4972
 epoch: 97, train_loss: 0.8623, test_loss: 1.0399, test_f1: 0.4948
 epoch: 98, train_loss: 0.8641, test_loss: 1.0231, test_f1: 0.4982
 epoch: 99, train_loss: 0.8603, test_loss: 1.0374, test_f1: 0.5026

Training completed in 609.57 seconds
Best F1: 0.5124 at epoch 74
Mean F1 across iterations: 0.5011  0.0098
========================FINAL RESULTS================================
FEGIN weighted F1: 0.5124  0.0098
python main.py --data ltspice_examples --representation component_component --model FEGIN --layers 5 --hiddens 16 --batch_size 128 --lr 0.001 --emb_size 128 --epochs 100 --save_appendix component_component_L5_H16_BS128_LR0.001_E128 --no_val
-----



STDERR:
Processing...
Done!
  File "main.py", line 370, in <module>
    main()
  File "main.py", line 254, in main
    dataset = dataset_class(
  File "/home/philip/projects/llm_inference_code_repo/Circuit-Completion-Using-GNNs/component_classification_with_link_prediction_head/evaluation/FEGIN/kernel/circuit_datasets.py", line 15, in __init__
    self.data, self.slices = torch.load(self.processed_paths[0])
  File "/home/philip/.local/lib/python3.8/site-packages/torch/serialization.py", line 1040, in load
    warnings.warn(
  File "/usr/lib/python3.8/warnings.py", line 109, in _showwarnmsg
    sw(msg.message, msg.category, msg.filename, msg.lineno,
  File "main.py", line 47, in warn_with_traceback
    traceback.print_stack(file=log)
/home/philip/projects/llm_inference_code_repo/Circuit-Completion-Using-GNNs/component_classification_with_link_prediction_head/evaluation/FEGIN/kernel/circuit_datasets.py:15: FutureWarning: You are using `torch.load` with `weights_only=False` (the current default value), which uses the default pickle module implicitly. It is possible to construct malicious pickle data which will execute arbitrary code during unpickling (See https://github.com/pytorch/pytorch/blob/main/SECURITY.md#untrusted-models for more details). In a future release, the default value for `weights_only` will be flipped to `True`. This limits the functions that could be executed during unpickling. Arbitrary objects will no longer be allowed to be loaded via this mode unless they are explicitly allowlisted by the user via `torch.serialization.add_safe_globals`. We recommend you start setting `weights_only=True` for any use case where you don't have full control of the loaded file. Please open an issue on GitHub for any issues related to this experimental feature.
  self.data, self.slices = torch.load(self.processed_paths[0])
