STDOUT:
Results will be saved in /home/philip/projects/ltspice_examples_code_repo/Circuit-Completion-Using-GNNs/component_classification_with_link_prediction_head/evaluation/FEGIN/results/model_FEGIN_dataset_ltspice_examples
Command line input: python main.py --data ltspice_examples --representation component_net --model FEGIN --layers 5 --hiddens 64 --batch_size 64 --lr 0.001 --emb_size 512 --epochs 100 --save_appendix component_net_L5_H64_BS64_LR0.001_E512 --no_val
 is saved.
-----
ltspice_examples - FEGIN
Using 5 layers, 64 hidden units, h = 2
Loading component_net representation dataset
ENTERED
Training FEGIN on component_net representation
Train: 3558, Test: 846
##################ITERATION #0 ****************************************
 epoch: 0, train_loss: 1.2565, test_loss: 1.1391, test_f1: 0.3618
 epoch: 1, train_loss: 1.1194, test_loss: 1.0315, test_f1: 0.4821
 epoch: 2, train_loss: 1.0267, test_loss: 0.9746, test_f1: 0.5015
 epoch: 3, train_loss: 0.9838, test_loss: 0.9590, test_f1: 0.5108
 epoch: 4, train_loss: 0.9462, test_loss: 0.9253, test_f1: 0.4984
 epoch: 5, train_loss: 0.9251, test_loss: 0.9361, test_f1: 0.5497
 epoch: 6, train_loss: 0.9028, test_loss: 0.8907, test_f1: 0.5273
 epoch: 7, train_loss: 0.8953, test_loss: 0.9036, test_f1: 0.5556
 epoch: 8, train_loss: 0.8773, test_loss: 0.9336, test_f1: 0.5389
 epoch: 9, train_loss: 0.8561, test_loss: 0.9274, test_f1: 0.5654
 epoch: 10, train_loss: 0.8409, test_loss: 0.9371, test_f1: 0.5305
 epoch: 11, train_loss: 0.8347, test_loss: 0.9351, test_f1: 0.5367
 epoch: 12, train_loss: 0.8352, test_loss: 0.8930, test_f1: 0.5999
 epoch: 13, train_loss: 0.8110, test_loss: 0.9093, test_f1: 0.6006
 epoch: 14, train_loss: 0.8135, test_loss: 0.9240, test_f1: 0.5883
 epoch: 15, train_loss: 0.8041, test_loss: 0.9597, test_f1: 0.5771
 epoch: 16, train_loss: 0.8027, test_loss: 0.9295, test_f1: 0.5886
 epoch: 17, train_loss: 0.7946, test_loss: 0.9906, test_f1: 0.5770
 epoch: 18, train_loss: 0.7820, test_loss: 0.9493, test_f1: 0.5910
 epoch: 19, train_loss: 0.7686, test_loss: 0.9285, test_f1: 0.5878
 epoch: 20, train_loss: 0.7544, test_loss: 1.0033, test_f1: 0.5778
 epoch: 21, train_loss: 0.7426, test_loss: 1.0472, test_f1: 0.5686
 epoch: 22, train_loss: 0.7389, test_loss: 0.9967, test_f1: 0.5816
 epoch: 23, train_loss: 0.7305, test_loss: 0.9900, test_f1: 0.5926
 epoch: 24, train_loss: 0.7216, test_loss: 1.0207, test_f1: 0.5955
 epoch: 25, train_loss: 0.7179, test_loss: 0.9846, test_f1: 0.6022
 epoch: 26, train_loss: 0.7020, test_loss: 1.0110, test_f1: 0.5784
 epoch: 27, train_loss: 0.7044, test_loss: 0.9776, test_f1: 0.6224
 epoch: 28, train_loss: 0.6913, test_loss: 0.9908, test_f1: 0.6102
 epoch: 29, train_loss: 0.6732, test_loss: 1.0288, test_f1: 0.6153
 epoch: 30, train_loss: 0.6899, test_loss: 0.9897, test_f1: 0.5822
 epoch: 31, train_loss: 0.6748, test_loss: 0.9938, test_f1: 0.6111
 epoch: 32, train_loss: 0.6722, test_loss: 1.0639, test_f1: 0.5942
 epoch: 33, train_loss: 0.6651, test_loss: 0.9998, test_f1: 0.5875
 epoch: 34, train_loss: 0.6634, test_loss: 0.9339, test_f1: 0.6244
 epoch: 35, train_loss: 0.6508, test_loss: 0.9976, test_f1: 0.6128
 epoch: 36, train_loss: 0.6533, test_loss: 0.9817, test_f1: 0.6176
 epoch: 37, train_loss: 0.6304, test_loss: 1.0128, test_f1: 0.6064
 epoch: 38, train_loss: 0.6414, test_loss: 1.0177, test_f1: 0.6007
 epoch: 39, train_loss: 0.6445, test_loss: 1.0838, test_f1: 0.6197
 epoch: 40, train_loss: 0.6156, test_loss: 1.0299, test_f1: 0.6176
 epoch: 41, train_loss: 0.6050, test_loss: 1.0468, test_f1: 0.5994
 epoch: 42, train_loss: 0.6122, test_loss: 1.1053, test_f1: 0.6212
 epoch: 43, train_loss: 0.6024, test_loss: 1.0744, test_f1: 0.5951
 epoch: 44, train_loss: 0.6147, test_loss: 1.0611, test_f1: 0.6239
 epoch: 45, train_loss: 0.6023, test_loss: 1.0546, test_f1: 0.6119
 epoch: 46, train_loss: 0.5673, test_loss: 1.1035, test_f1: 0.6039
 epoch: 47, train_loss: 0.5871, test_loss: 1.1172, test_f1: 0.6035
 epoch: 48, train_loss: 0.5658, test_loss: 1.1243, test_f1: 0.6207
 epoch: 49, train_loss: 0.5724, test_loss: 1.1135, test_f1: 0.6352
 epoch: 50, train_loss: 0.5588, test_loss: 1.1372, test_f1: 0.5947
 epoch: 51, train_loss: 0.5268, test_loss: 1.1279, test_f1: 0.6028
 epoch: 52, train_loss: 0.4930, test_loss: 1.1505, test_f1: 0.6335
 epoch: 53, train_loss: 0.5027, test_loss: 1.1339, test_f1: 0.6276
 epoch: 54, train_loss: 0.4873, test_loss: 1.1040, test_f1: 0.6328
 epoch: 55, train_loss: 0.4695, test_loss: 1.2295, test_f1: 0.6120
 epoch: 56, train_loss: 0.4758, test_loss: 1.2018, test_f1: 0.6164
 epoch: 57, train_loss: 0.4744, test_loss: 1.1944, test_f1: 0.6447
 epoch: 58, train_loss: 0.4516, test_loss: 1.1471, test_f1: 0.6316
 epoch: 59, train_loss: 0.4588, test_loss: 1.1952, test_f1: 0.6287
 epoch: 60, train_loss: 0.4529, test_loss: 1.2596, test_f1: 0.6136
 epoch: 61, train_loss: 0.4611, test_loss: 1.2675, test_f1: 0.6239
 epoch: 62, train_loss: 0.4377, test_loss: 1.3756, test_f1: 0.6377
 epoch: 63, train_loss: 0.4556, test_loss: 1.2681, test_f1: 0.6259
 epoch: 64, train_loss: 0.4269, test_loss: 1.3004, test_f1: 0.6090
 epoch: 65, train_loss: 0.4192, test_loss: 1.2511, test_f1: 0.6464
 epoch: 66, train_loss: 0.4226, test_loss: 1.3237, test_f1: 0.6255
 epoch: 67, train_loss: 0.4383, test_loss: 1.2457, test_f1: 0.6363
 epoch: 68, train_loss: 0.4149, test_loss: 1.3439, test_f1: 0.6123
 epoch: 69, train_loss: 0.4254, test_loss: 1.3436, test_f1: 0.6255
 epoch: 70, train_loss: 0.4159, test_loss: 1.3536, test_f1: 0.6157
 epoch: 71, train_loss: 0.4084, test_loss: 1.4206, test_f1: 0.6200
 epoch: 72, train_loss: 0.3934, test_loss: 1.3775, test_f1: 0.6666
 epoch: 73, train_loss: 0.4006, test_loss: 1.3634, test_f1: 0.6234
 epoch: 74, train_loss: 0.4007, test_loss: 1.4219, test_f1: 0.6086
 epoch: 75, train_loss: 0.3816, test_loss: 1.4064, test_f1: 0.6219
 epoch: 76, train_loss: 0.3844, test_loss: 1.4120, test_f1: 0.6261
 epoch: 77, train_loss: 0.3686, test_loss: 1.4193, test_f1: 0.6124
 epoch: 78, train_loss: 0.3716, test_loss: 1.4460, test_f1: 0.6137
 epoch: 79, train_loss: 0.3905, test_loss: 1.4672, test_f1: 0.6273
 epoch: 80, train_loss: 0.3678, test_loss: 1.4309, test_f1: 0.6375
 epoch: 81, train_loss: 0.3635, test_loss: 1.4577, test_f1: 0.6300
 epoch: 82, train_loss: 0.3723, test_loss: 1.5207, test_f1: 0.6095
 epoch: 83, train_loss: 0.3602, test_loss: 1.4395, test_f1: 0.6446
 epoch: 84, train_loss: 0.3642, test_loss: 1.4480, test_f1: 0.6497
 epoch: 85, train_loss: 0.3518, test_loss: 1.5182, test_f1: 0.6185
 epoch: 86, train_loss: 0.3472, test_loss: 1.5494, test_f1: 0.6330
 epoch: 87, train_loss: 0.3455, test_loss: 1.5600, test_f1: 0.6260
 epoch: 88, train_loss: 0.3402, test_loss: 1.5172, test_f1: 0.6427
 epoch: 89, train_loss: 0.3496, test_loss: 1.6224, test_f1: 0.6416
 epoch: 90, train_loss: 0.3289, test_loss: 1.6713, test_f1: 0.5970
 epoch: 91, train_loss: 0.3341, test_loss: 1.6379, test_f1: 0.5995
 epoch: 92, train_loss: 0.3441, test_loss: 1.7226, test_f1: 0.6062
 epoch: 93, train_loss: 0.3368, test_loss: 1.7362, test_f1: 0.6133
 epoch: 94, train_loss: 0.3325, test_loss: 1.5800, test_f1: 0.6316
 epoch: 95, train_loss: 0.3105, test_loss: 1.6550, test_f1: 0.6067
 epoch: 96, train_loss: 0.3297, test_loss: 1.6753, test_f1: 0.6409
 epoch: 97, train_loss: 0.3362, test_loss: 1.6167, test_f1: 0.6135
 epoch: 98, train_loss: 0.3228, test_loss: 1.7261, test_f1: 0.6020
 epoch: 99, train_loss: 0.3249, test_loss: 1.6118, test_f1: 0.6469
##################ITERATION #1 ****************************************
 epoch: 0, train_loss: 1.1512, test_loss: 1.0293, test_f1: 0.4423
 epoch: 1, train_loss: 1.0095, test_loss: 0.9332, test_f1: 0.4761
 epoch: 2, train_loss: 0.9644, test_loss: 0.9327, test_f1: 0.5222
 epoch: 3, train_loss: 0.9399, test_loss: 0.9110, test_f1: 0.5139
 epoch: 4, train_loss: 0.9107, test_loss: 0.9405, test_f1: 0.5128
 epoch: 5, train_loss: 0.9082, test_loss: 0.9336, test_f1: 0.5335
 epoch: 6, train_loss: 0.8891, test_loss: 0.8739, test_f1: 0.5547
 epoch: 7, train_loss: 0.8714, test_loss: 0.8833, test_f1: 0.5511
 epoch: 8, train_loss: 0.8470, test_loss: 0.8838, test_f1: 0.5521
 epoch: 9, train_loss: 0.8395, test_loss: 0.9001, test_f1: 0.5527
 epoch: 10, train_loss: 0.8404, test_loss: 0.9424, test_f1: 0.5338
 epoch: 11, train_loss: 0.8295, test_loss: 0.9458, test_f1: 0.5647
 epoch: 12, train_loss: 0.8177, test_loss: 0.9506, test_f1: 0.6071
 epoch: 13, train_loss: 0.8098, test_loss: 0.9211, test_f1: 0.5622
 epoch: 14, train_loss: 0.8266, test_loss: 0.9243, test_f1: 0.5781
 epoch: 15, train_loss: 0.7900, test_loss: 0.9709, test_f1: 0.5805
 epoch: 16, train_loss: 0.7755, test_loss: 0.9744, test_f1: 0.5724
 epoch: 17, train_loss: 0.7658, test_loss: 0.9635, test_f1: 0.5804
 epoch: 18, train_loss: 0.7733, test_loss: 0.9190, test_f1: 0.5752
 epoch: 19, train_loss: 0.7581, test_loss: 0.8118, test_f1: 0.6070
 epoch: 20, train_loss: 0.7529, test_loss: 0.9233, test_f1: 0.5913
 epoch: 21, train_loss: 0.7264, test_loss: 0.9197, test_f1: 0.6220
 epoch: 22, train_loss: 0.7390, test_loss: 0.9342, test_f1: 0.5940
 epoch: 23, train_loss: 0.7471, test_loss: 0.9433, test_f1: 0.5743
 epoch: 24, train_loss: 0.7331, test_loss: 0.9156, test_f1: 0.6108
 epoch: 25, train_loss: 0.7171, test_loss: 0.8924, test_f1: 0.6088
 epoch: 26, train_loss: 0.7381, test_loss: 1.0338, test_f1: 0.5680
 epoch: 27, train_loss: 0.7351, test_loss: 0.9314, test_f1: 0.6016
 epoch: 28, train_loss: 0.6979, test_loss: 0.9778, test_f1: 0.6143
 epoch: 29, train_loss: 0.6898, test_loss: 0.9190, test_f1: 0.6267
 epoch: 30, train_loss: 0.7138, test_loss: 0.9993, test_f1: 0.5576
 epoch: 31, train_loss: 0.7038, test_loss: 0.9391, test_f1: 0.6249
 epoch: 32, train_loss: 0.6793, test_loss: 0.9685, test_f1: 0.6058
 epoch: 33, train_loss: 0.6583, test_loss: 0.9333, test_f1: 0.6446
 epoch: 34, train_loss: 0.6558, test_loss: 1.0338, test_f1: 0.6415
 epoch: 35, train_loss: 0.6419, test_loss: 1.0183, test_f1: 0.6154
 epoch: 36, train_loss: 0.6459, test_loss: 0.9854, test_f1: 0.6420
 epoch: 37, train_loss: 0.6565, test_loss: 0.9491, test_f1: 0.6237
 epoch: 38, train_loss: 0.6362, test_loss: 0.9809, test_f1: 0.5787
 epoch: 39, train_loss: 0.6062, test_loss: 0.9706, test_f1: 0.6489
 epoch: 40, train_loss: 0.6038, test_loss: 0.9874, test_f1: 0.6119
 epoch: 41, train_loss: 0.6365, test_loss: 0.9829, test_f1: 0.6216
 epoch: 42, train_loss: 0.5976, test_loss: 1.0637, test_f1: 0.6543
 epoch: 43, train_loss: 0.6015, test_loss: 0.9962, test_f1: 0.6449
 epoch: 44, train_loss: 0.5796, test_loss: 1.0853, test_f1: 0.6348
 epoch: 45, train_loss: 0.5719, test_loss: 1.0635, test_f1: 0.6280
 epoch: 46, train_loss: 0.5629, test_loss: 1.0900, test_f1: 0.6353
 epoch: 47, train_loss: 0.5692, test_loss: 1.0821, test_f1: 0.6489
 epoch: 48, train_loss: 0.5702, test_loss: 1.0733, test_f1: 0.6313
 epoch: 49, train_loss: 0.5481, test_loss: 1.0868, test_f1: 0.6581
 epoch: 50, train_loss: 0.5385, test_loss: 1.0962, test_f1: 0.6471
 epoch: 51, train_loss: 0.5133, test_loss: 1.0731, test_f1: 0.6639
 epoch: 52, train_loss: 0.4857, test_loss: 1.0483, test_f1: 0.6755
 epoch: 53, train_loss: 0.4567, test_loss: 1.1544, test_f1: 0.6574
 epoch: 54, train_loss: 0.4724, test_loss: 1.1732, test_f1: 0.6501
 epoch: 55, train_loss: 0.4714, test_loss: 1.1625, test_f1: 0.6716
 epoch: 56, train_loss: 0.4560, test_loss: 1.1656, test_f1: 0.6711
 epoch: 57, train_loss: 0.4546, test_loss: 1.1210, test_f1: 0.6518
 epoch: 58, train_loss: 0.4649, test_loss: 1.1570, test_f1: 0.6525
 epoch: 59, train_loss: 0.4514, test_loss: 1.1939, test_f1: 0.6587
 epoch: 60, train_loss: 0.4395, test_loss: 1.1792, test_f1: 0.6594
 epoch: 61, train_loss: 0.4345, test_loss: 1.2305, test_f1: 0.6569
 epoch: 62, train_loss: 0.4372, test_loss: 1.2660, test_f1: 0.6439
 epoch: 63, train_loss: 0.4166, test_loss: 1.3063, test_f1: 0.6312
 epoch: 64, train_loss: 0.4214, test_loss: 1.2457, test_f1: 0.6485
 epoch: 65, train_loss: 0.4191, test_loss: 1.1869, test_f1: 0.6580
 epoch: 66, train_loss: 0.4278, test_loss: 1.2361, test_f1: 0.6427
 epoch: 67, train_loss: 0.4170, test_loss: 1.2998, test_f1: 0.6395
 epoch: 68, train_loss: 0.4077, test_loss: 1.2666, test_f1: 0.6531
 epoch: 69, train_loss: 0.4043, test_loss: 1.2803, test_f1: 0.6488
 epoch: 70, train_loss: 0.4275, test_loss: 1.2892, test_f1: 0.6578
 epoch: 71, train_loss: 0.3932, test_loss: 1.3759, test_f1: 0.6335
 epoch: 72, train_loss: 0.4036, test_loss: 1.3783, test_f1: 0.6418
 epoch: 73, train_loss: 0.3700, test_loss: 1.3552, test_f1: 0.6468
 epoch: 74, train_loss: 0.3825, test_loss: 1.2980, test_f1: 0.6599
 epoch: 75, train_loss: 0.3778, test_loss: 1.3243, test_f1: 0.6638
 epoch: 76, train_loss: 0.3871, test_loss: 1.4320, test_f1: 0.6262
 epoch: 77, train_loss: 0.3888, test_loss: 1.3735, test_f1: 0.6512
 epoch: 78, train_loss: 0.3772, test_loss: 1.4140, test_f1: 0.6214
 epoch: 79, train_loss: 0.3634, test_loss: 1.4027, test_f1: 0.6508
 epoch: 80, train_loss: 0.3731, test_loss: 1.3718, test_f1: 0.6612
 epoch: 81, train_loss: 0.3645, test_loss: 1.3622, test_f1: 0.6421
 epoch: 82, train_loss: 0.3554, test_loss: 1.4036, test_f1: 0.6459
 epoch: 83, train_loss: 0.3543, test_loss: 1.4646, test_f1: 0.6734
 epoch: 84, train_loss: 0.3684, test_loss: 1.4192, test_f1: 0.6462
 epoch: 85, train_loss: 0.3416, test_loss: 1.4251, test_f1: 0.6493
 epoch: 86, train_loss: 0.3466, test_loss: 1.5646, test_f1: 0.6326
 epoch: 87, train_loss: 0.3567, test_loss: 1.3936, test_f1: 0.6642
 epoch: 88, train_loss: 0.3532, test_loss: 1.4407, test_f1: 0.6616
 epoch: 89, train_loss: 0.3318, test_loss: 1.5615, test_f1: 0.6579
 epoch: 90, train_loss: 0.3390, test_loss: 1.5848, test_f1: 0.6416
 epoch: 91, train_loss: 0.3263, test_loss: 1.6097, test_f1: 0.6422
 epoch: 92, train_loss: 0.3295, test_loss: 1.5263, test_f1: 0.6657
 epoch: 93, train_loss: 0.3413, test_loss: 1.4559, test_f1: 0.6496
 epoch: 94, train_loss: 0.3302, test_loss: 1.4867, test_f1: 0.6486
 epoch: 95, train_loss: 0.3389, test_loss: 1.5158, test_f1: 0.6551
 epoch: 96, train_loss: 0.3297, test_loss: 1.4587, test_f1: 0.6682
 epoch: 97, train_loss: 0.3094, test_loss: 1.6034, test_f1: 0.6465
 epoch: 98, train_loss: 0.3186, test_loss: 1.5218, test_f1: 0.6559
 epoch: 99, train_loss: 0.3104, test_loss: 1.5705, test_f1: 0.6491
##################ITERATION #2 ****************************************
 epoch: 0, train_loss: 1.1990, test_loss: 1.0938, test_f1: 0.3494
 epoch: 1, train_loss: 1.0325, test_loss: 0.9520, test_f1: 0.5117
 epoch: 2, train_loss: 0.9787, test_loss: 0.9426, test_f1: 0.5390
 epoch: 3, train_loss: 0.9637, test_loss: 0.9606, test_f1: 0.5161
 epoch: 4, train_loss: 0.9370, test_loss: 0.9372, test_f1: 0.5253
 epoch: 5, train_loss: 0.9211, test_loss: 0.9379, test_f1: 0.5320
 epoch: 6, train_loss: 0.8901, test_loss: 0.9114, test_f1: 0.5673
 epoch: 7, train_loss: 0.8817, test_loss: 0.9732, test_f1: 0.5647
 epoch: 8, train_loss: 0.8696, test_loss: 0.9723, test_f1: 0.5640
 epoch: 9, train_loss: 0.8583, test_loss: 1.0868, test_f1: 0.4876
 epoch: 10, train_loss: 0.8466, test_loss: 0.9443, test_f1: 0.5701
 epoch: 11, train_loss: 0.8487, test_loss: 0.9057, test_f1: 0.5876
 epoch: 12, train_loss: 0.8258, test_loss: 0.9482, test_f1: 0.5872
 epoch: 13, train_loss: 0.8228, test_loss: 0.9181, test_f1: 0.5799
 epoch: 14, train_loss: 0.8038, test_loss: 0.8791, test_f1: 0.5958
 epoch: 15, train_loss: 0.7928, test_loss: 0.9680, test_f1: 0.6043
 epoch: 16, train_loss: 0.8093, test_loss: 0.9900, test_f1: 0.5572
 epoch: 17, train_loss: 0.7896, test_loss: 0.9830, test_f1: 0.5459
 epoch: 18, train_loss: 0.7861, test_loss: 0.9847, test_f1: 0.5599
 epoch: 19, train_loss: 0.7718, test_loss: 0.9646, test_f1: 0.5960
 epoch: 20, train_loss: 0.7681, test_loss: 0.9661, test_f1: 0.5834
 epoch: 21, train_loss: 0.7663, test_loss: 0.9129, test_f1: 0.5927
 epoch: 22, train_loss: 0.7527, test_loss: 0.9729, test_f1: 0.5854
 epoch: 23, train_loss: 0.7543, test_loss: 0.9523, test_f1: 0.6227
 epoch: 24, train_loss: 0.7504, test_loss: 0.9491, test_f1: 0.5877
 epoch: 25, train_loss: 0.7364, test_loss: 0.9368, test_f1: 0.6308
 epoch: 26, train_loss: 0.7249, test_loss: 0.9514, test_f1: 0.5884
 epoch: 27, train_loss: 0.7064, test_loss: 1.0387, test_f1: 0.5817
 epoch: 28, train_loss: 0.7205, test_loss: 1.0494, test_f1: 0.5652
 epoch: 29, train_loss: 0.7040, test_loss: 0.9693, test_f1: 0.6291
 epoch: 30, train_loss: 0.6823, test_loss: 1.0188, test_f1: 0.6066
 epoch: 31, train_loss: 0.6895, test_loss: 0.9939, test_f1: 0.6245
 epoch: 32, train_loss: 0.6888, test_loss: 1.0195, test_f1: 0.5606
 epoch: 33, train_loss: 0.6869, test_loss: 1.0787, test_f1: 0.6321
 epoch: 34, train_loss: 0.6565, test_loss: 1.0541, test_f1: 0.6389
 epoch: 35, train_loss: 0.6725, test_loss: 0.9963, test_f1: 0.6230
 epoch: 36, train_loss: 0.6503, test_loss: 1.0324, test_f1: 0.6086
 epoch: 37, train_loss: 0.6602, test_loss: 1.0235, test_f1: 0.6193
 epoch: 38, train_loss: 0.6486, test_loss: 1.0016, test_f1: 0.6270
 epoch: 39, train_loss: 0.6544, test_loss: 1.0587, test_f1: 0.5987
 epoch: 40, train_loss: 0.6349, test_loss: 0.9947, test_f1: 0.6218
 epoch: 41, train_loss: 0.6356, test_loss: 1.0884, test_f1: 0.6193
 epoch: 42, train_loss: 0.6259, test_loss: 1.1061, test_f1: 0.6504
 epoch: 43, train_loss: 0.6150, test_loss: 1.1144, test_f1: 0.6300
 epoch: 44, train_loss: 0.6059, test_loss: 1.0893, test_f1: 0.6295
 epoch: 45, train_loss: 0.6246, test_loss: 1.2096, test_f1: 0.5986
 epoch: 46, train_loss: 0.5983, test_loss: 1.0789, test_f1: 0.6496
 epoch: 47, train_loss: 0.5837, test_loss: 1.1209, test_f1: 0.6383
 epoch: 48, train_loss: 0.5751, test_loss: 1.1441, test_f1: 0.6283
 epoch: 49, train_loss: 0.5624, test_loss: 1.1720, test_f1: 0.6381
 epoch: 50, train_loss: 0.5702, test_loss: 1.0768, test_f1: 0.6258
 epoch: 51, train_loss: 0.5493, test_loss: 1.1033, test_f1: 0.6548
 epoch: 52, train_loss: 0.5139, test_loss: 1.1365, test_f1: 0.6441
 epoch: 53, train_loss: 0.5082, test_loss: 1.1803, test_f1: 0.6644
 epoch: 54, train_loss: 0.4952, test_loss: 1.1796, test_f1: 0.6492
 epoch: 55, train_loss: 0.4831, test_loss: 1.1859, test_f1: 0.6389
 epoch: 56, train_loss: 0.4863, test_loss: 1.1955, test_f1: 0.6518
 epoch: 57, train_loss: 0.4636, test_loss: 1.2825, test_f1: 0.6341
 epoch: 58, train_loss: 0.4767, test_loss: 1.2072, test_f1: 0.6443
 epoch: 59, train_loss: 0.4585, test_loss: 1.2352, test_f1: 0.6391
 epoch: 60, train_loss: 0.4437, test_loss: 1.2624, test_f1: 0.6457
 epoch: 61, train_loss: 0.4550, test_loss: 1.2299, test_f1: 0.6537
 epoch: 62, train_loss: 0.4429, test_loss: 1.3162, test_f1: 0.6569
 epoch: 63, train_loss: 0.4454, test_loss: 1.3403, test_f1: 0.6383
 epoch: 64, train_loss: 0.4594, test_loss: 1.2711, test_f1: 0.6712
 epoch: 65, train_loss: 0.4318, test_loss: 1.2980, test_f1: 0.6509
 epoch: 66, train_loss: 0.4267, test_loss: 1.3129, test_f1: 0.6348
 epoch: 67, train_loss: 0.4286, test_loss: 1.3035, test_f1: 0.6641
 epoch: 68, train_loss: 0.4137, test_loss: 1.3461, test_f1: 0.6475
 epoch: 69, train_loss: 0.4127, test_loss: 1.3058, test_f1: 0.6587
 epoch: 70, train_loss: 0.4064, test_loss: 1.3292, test_f1: 0.6419
 epoch: 71, train_loss: 0.3960, test_loss: 1.3025, test_f1: 0.6334
 epoch: 72, train_loss: 0.3935, test_loss: 1.4258, test_f1: 0.6349
 epoch: 73, train_loss: 0.3887, test_loss: 1.3828, test_f1: 0.6348
 epoch: 74, train_loss: 0.3964, test_loss: 1.4332, test_f1: 0.6267
 epoch: 75, train_loss: 0.3911, test_loss: 1.3812, test_f1: 0.6571
 epoch: 76, train_loss: 0.3939, test_loss: 1.4309, test_f1: 0.6374
 epoch: 77, train_loss: 0.4045, test_loss: 1.4377, test_f1: 0.6444
 epoch: 78, train_loss: 0.3746, test_loss: 1.4129, test_f1: 0.6248
 epoch: 79, train_loss: 0.3827, test_loss: 1.4780, test_f1: 0.6704
 epoch: 80, train_loss: 0.3784, test_loss: 1.5147, test_f1: 0.6386
 epoch: 81, train_loss: 0.3699, test_loss: 1.4526, test_f1: 0.6231
 epoch: 82, train_loss: 0.3751, test_loss: 1.4635, test_f1: 0.6357
 epoch: 83, train_loss: 0.3600, test_loss: 1.5534, test_f1: 0.6429
 epoch: 84, train_loss: 0.3610, test_loss: 1.4944, test_f1: 0.6654
 epoch: 85, train_loss: 0.3509, test_loss: 1.6307, test_f1: 0.6429
 epoch: 86, train_loss: 0.3352, test_loss: 1.5127, test_f1: 0.6556
 epoch: 87, train_loss: 0.3519, test_loss: 1.5732, test_f1: 0.6420
 epoch: 88, train_loss: 0.3572, test_loss: 1.5063, test_f1: 0.6300
 epoch: 89, train_loss: 0.3422, test_loss: 1.5452, test_f1: 0.6494
 epoch: 90, train_loss: 0.3345, test_loss: 1.5453, test_f1: 0.6454
 epoch: 91, train_loss: 0.3244, test_loss: 1.6859, test_f1: 0.6282
 epoch: 92, train_loss: 0.3420, test_loss: 1.6485, test_f1: 0.6330
 epoch: 93, train_loss: 0.3268, test_loss: 1.4936, test_f1: 0.6442
 epoch: 94, train_loss: 0.3551, test_loss: 1.6384, test_f1: 0.6453
 epoch: 95, train_loss: 0.3211, test_loss: 1.5326, test_f1: 0.6326
 epoch: 96, train_loss: 0.3299, test_loss: 1.6129, test_f1: 0.6402
 epoch: 97, train_loss: 0.3210, test_loss: 1.6831, test_f1: 0.6415
 epoch: 98, train_loss: 0.3199, test_loss: 1.6315, test_f1: 0.6135
 epoch: 99, train_loss: 0.3310, test_loss: 1.8472, test_f1: 0.6143
##################ITERATION #3 ****************************************
 epoch: 0, train_loss: 1.2295, test_loss: 1.0249, test_f1: 0.4782
 epoch: 1, train_loss: 1.0498, test_loss: 0.9582, test_f1: 0.5138
 epoch: 2, train_loss: 0.9895, test_loss: 0.9143, test_f1: 0.5167
 epoch: 3, train_loss: 0.9632, test_loss: 0.9027, test_f1: 0.4875
 epoch: 4, train_loss: 0.9384, test_loss: 0.9585, test_f1: 0.4910
 epoch: 5, train_loss: 0.9250, test_loss: 0.9427, test_f1: 0.5004
 epoch: 6, train_loss: 0.9115, test_loss: 0.8967, test_f1: 0.5263
 epoch: 7, train_loss: 0.8918, test_loss: 0.9628, test_f1: 0.5302
 epoch: 8, train_loss: 0.8806, test_loss: 0.9389, test_f1: 0.5410
 epoch: 9, train_loss: 0.8775, test_loss: 0.9040, test_f1: 0.5488
 epoch: 10, train_loss: 0.8676, test_loss: 0.9807, test_f1: 0.5401
 epoch: 11, train_loss: 0.8580, test_loss: 0.8081, test_f1: 0.5430
 epoch: 12, train_loss: 0.8464, test_loss: 0.9371, test_f1: 0.5243
 epoch: 13, train_loss: 0.8376, test_loss: 0.9542, test_f1: 0.5599
 epoch: 14, train_loss: 0.8181, test_loss: 0.9760, test_f1: 0.5454
 epoch: 15, train_loss: 0.8244, test_loss: 0.9356, test_f1: 0.5843
 epoch: 16, train_loss: 0.8025, test_loss: 0.9223, test_f1: 0.5487
 epoch: 17, train_loss: 0.7961, test_loss: 0.9579, test_f1: 0.5555
 epoch: 18, train_loss: 0.7866, test_loss: 1.0317, test_f1: 0.5407
 epoch: 19, train_loss: 0.7778, test_loss: 0.9624, test_f1: 0.5799
 epoch: 20, train_loss: 0.7665, test_loss: 0.9209, test_f1: 0.5991
 epoch: 21, train_loss: 0.7719, test_loss: 0.9277, test_f1: 0.5906
 epoch: 22, train_loss: 0.7399, test_loss: 0.9679, test_f1: 0.5782
 epoch: 23, train_loss: 0.7385, test_loss: 0.9766, test_f1: 0.5595
 epoch: 24, train_loss: 0.7354, test_loss: 0.9398, test_f1: 0.5884
 epoch: 25, train_loss: 0.7382, test_loss: 0.9389, test_f1: 0.5880
 epoch: 26, train_loss: 0.7473, test_loss: 0.9804, test_f1: 0.6012
 epoch: 27, train_loss: 0.7111, test_loss: 1.0033, test_f1: 0.5491
 epoch: 28, train_loss: 0.7082, test_loss: 1.0785, test_f1: 0.5886
 epoch: 29, train_loss: 0.6952, test_loss: 0.9910, test_f1: 0.6053
 epoch: 30, train_loss: 0.6892, test_loss: 0.8993, test_f1: 0.6492
 epoch: 31, train_loss: 0.7051, test_loss: 0.9481, test_f1: 0.5896
 epoch: 32, train_loss: 0.6807, test_loss: 0.9168, test_f1: 0.6230
 epoch: 33, train_loss: 0.6801, test_loss: 0.9926, test_f1: 0.5929
 epoch: 34, train_loss: 0.6618, test_loss: 0.9544, test_f1: 0.6189
 epoch: 35, train_loss: 0.6797, test_loss: 0.8887, test_f1: 0.6280
 epoch: 36, train_loss: 0.6384, test_loss: 1.0477, test_f1: 0.5833
 epoch: 37, train_loss: 0.6418, test_loss: 1.0171, test_f1: 0.6257
 epoch: 38, train_loss: 0.6453, test_loss: 1.0387, test_f1: 0.5969
 epoch: 39, train_loss: 0.6223, test_loss: 1.0314, test_f1: 0.6084
 epoch: 40, train_loss: 0.6337, test_loss: 0.9923, test_f1: 0.6216
 epoch: 41, train_loss: 0.6135, test_loss: 1.0153, test_f1: 0.6241
 epoch: 42, train_loss: 0.5982, test_loss: 0.9685, test_f1: 0.6533
 epoch: 43, train_loss: 0.5822, test_loss: 1.0497, test_f1: 0.6209
 epoch: 44, train_loss: 0.5893, test_loss: 1.0428, test_f1: 0.6561
 epoch: 45, train_loss: 0.5852, test_loss: 1.0335, test_f1: 0.6482
 epoch: 46, train_loss: 0.5913, test_loss: 1.0987, test_f1: 0.6296
 epoch: 47, train_loss: 0.5597, test_loss: 1.0379, test_f1: 0.6284
 epoch: 48, train_loss: 0.5639, test_loss: 1.0871, test_f1: 0.6243
 epoch: 49, train_loss: 0.5682, test_loss: 1.1153, test_f1: 0.6189
 epoch: 50, train_loss: 0.5329, test_loss: 1.1574, test_f1: 0.6205
 epoch: 51, train_loss: 0.5025, test_loss: 1.1237, test_f1: 0.6522
 epoch: 52, train_loss: 0.4718, test_loss: 1.1557, test_f1: 0.6535
 epoch: 53, train_loss: 0.4786, test_loss: 1.1334, test_f1: 0.6546
 epoch: 54, train_loss: 0.4748, test_loss: 1.1193, test_f1: 0.6823
 epoch: 55, train_loss: 0.4733, test_loss: 1.1435, test_f1: 0.6417
 epoch: 56, train_loss: 0.4590, test_loss: 1.1382, test_f1: 0.6598
 epoch: 57, train_loss: 0.4631, test_loss: 1.2333, test_f1: 0.6343
 epoch: 58, train_loss: 0.4455, test_loss: 1.2496, test_f1: 0.6439
 epoch: 59, train_loss: 0.4492, test_loss: 1.2371, test_f1: 0.6565
 epoch: 60, train_loss: 0.4451, test_loss: 1.2638, test_f1: 0.6464
 epoch: 61, train_loss: 0.4232, test_loss: 1.2867, test_f1: 0.6536
 epoch: 62, train_loss: 0.4290, test_loss: 1.3488, test_f1: 0.6361
 epoch: 63, train_loss: 0.4234, test_loss: 1.2731, test_f1: 0.6416
 epoch: 64, train_loss: 0.4227, test_loss: 1.2759, test_f1: 0.6580
 epoch: 65, train_loss: 0.4082, test_loss: 1.4132, test_f1: 0.6185
 epoch: 66, train_loss: 0.4238, test_loss: 1.2849, test_f1: 0.6756
 epoch: 67, train_loss: 0.4386, test_loss: 1.2377, test_f1: 0.6512
 epoch: 68, train_loss: 0.4023, test_loss: 1.2949, test_f1: 0.6373
 epoch: 69, train_loss: 0.4241, test_loss: 1.3116, test_f1: 0.6483
 epoch: 70, train_loss: 0.3922, test_loss: 1.3582, test_f1: 0.6538
 epoch: 71, train_loss: 0.4016, test_loss: 1.2835, test_f1: 0.6748
 epoch: 72, train_loss: 0.3815, test_loss: 1.2801, test_f1: 0.6496
 epoch: 73, train_loss: 0.3867, test_loss: 1.3902, test_f1: 0.6488
 epoch: 74, train_loss: 0.3715, test_loss: 1.3961, test_f1: 0.6476
 epoch: 75, train_loss: 0.3812, test_loss: 1.3680, test_f1: 0.6608
 epoch: 76, train_loss: 0.3613, test_loss: 1.4032, test_f1: 0.6454
 epoch: 77, train_loss: 0.3721, test_loss: 1.4171, test_f1: 0.6925
 epoch: 78, train_loss: 0.3625, test_loss: 1.4185, test_f1: 0.6475
 epoch: 79, train_loss: 0.3704, test_loss: 1.3637, test_f1: 0.6432
 epoch: 80, train_loss: 0.3904, test_loss: 1.3382, test_f1: 0.6537
 epoch: 81, train_loss: 0.3666, test_loss: 1.3925, test_f1: 0.6468
 epoch: 82, train_loss: 0.3426, test_loss: 1.3825, test_f1: 0.6587
 epoch: 83, train_loss: 0.3427, test_loss: 1.4307, test_f1: 0.6321
 epoch: 84, train_loss: 0.3613, test_loss: 1.4596, test_f1: 0.6540
 epoch: 85, train_loss: 0.3578, test_loss: 1.4519, test_f1: 0.6750
 epoch: 86, train_loss: 0.3433, test_loss: 1.4414, test_f1: 0.6552
 epoch: 87, train_loss: 0.3411, test_loss: 1.4906, test_f1: 0.6435
 epoch: 88, train_loss: 0.3411, test_loss: 1.5443, test_f1: 0.6377
 epoch: 89, train_loss: 0.3315, test_loss: 1.4886, test_f1: 0.6517
 epoch: 90, train_loss: 0.3233, test_loss: 1.5892, test_f1: 0.6491
 epoch: 91, train_loss: 0.3200, test_loss: 1.5069, test_f1: 0.6583
 epoch: 92, train_loss: 0.3292, test_loss: 1.5531, test_f1: 0.6323
 epoch: 93, train_loss: 0.3230, test_loss: 1.6246, test_f1: 0.6569
 epoch: 94, train_loss: 0.3262, test_loss: 1.6438, test_f1: 0.6484
 epoch: 95, train_loss: 0.3103, test_loss: 1.5632, test_f1: 0.6510
 epoch: 96, train_loss: 0.3462, test_loss: 1.6044, test_f1: 0.6436
 epoch: 97, train_loss: 0.3209, test_loss: 1.6241, test_f1: 0.6388
 epoch: 98, train_loss: 0.3138, test_loss: 1.6196, test_f1: 0.6456
 epoch: 99, train_loss: 0.3131, test_loss: 1.6759, test_f1: 0.6522
##################ITERATION #4 ****************************************
 epoch: 0, train_loss: 1.2672, test_loss: 1.0353, test_f1: 0.4412
 epoch: 1, train_loss: 1.0680, test_loss: 0.9691, test_f1: 0.4925
 epoch: 2, train_loss: 1.0017, test_loss: 0.9783, test_f1: 0.4886
 epoch: 3, train_loss: 0.9864, test_loss: 0.9684, test_f1: 0.5335
 epoch: 4, train_loss: 0.9609, test_loss: 0.9420, test_f1: 0.5052
 epoch: 5, train_loss: 0.9642, test_loss: 0.9109, test_f1: 0.5068
 epoch: 6, train_loss: 0.9253, test_loss: 1.0181, test_f1: 0.4746
 epoch: 7, train_loss: 0.9227, test_loss: 0.9695, test_f1: 0.5211
 epoch: 8, train_loss: 0.9061, test_loss: 0.9464, test_f1: 0.5828
 epoch: 9, train_loss: 0.8903, test_loss: 0.9686, test_f1: 0.5334
 epoch: 10, train_loss: 0.8759, test_loss: 0.9691, test_f1: 0.5434
 epoch: 11, train_loss: 0.8700, test_loss: 0.9544, test_f1: 0.5551
 epoch: 12, train_loss: 0.8615, test_loss: 0.9196, test_f1: 0.5786
 epoch: 13, train_loss: 0.8518, test_loss: 0.9722, test_f1: 0.5575
 epoch: 14, train_loss: 0.8455, test_loss: 0.9546, test_f1: 0.5875
 epoch: 15, train_loss: 0.8282, test_loss: 0.8995, test_f1: 0.5592
 epoch: 16, train_loss: 0.8263, test_loss: 0.9429, test_f1: 0.5964
 epoch: 17, train_loss: 0.8121, test_loss: 0.9520, test_f1: 0.5595
 epoch: 18, train_loss: 0.8020, test_loss: 0.9842, test_f1: 0.5846
 epoch: 19, train_loss: 0.7916, test_loss: 0.9840, test_f1: 0.5690
 epoch: 20, train_loss: 0.8034, test_loss: 0.9104, test_f1: 0.5946
 epoch: 21, train_loss: 0.7788, test_loss: 0.9724, test_f1: 0.5901
 epoch: 22, train_loss: 0.7709, test_loss: 0.9465, test_f1: 0.5634
 epoch: 23, train_loss: 0.7797, test_loss: 0.9548, test_f1: 0.6128
 epoch: 24, train_loss: 0.7627, test_loss: 0.9518, test_f1: 0.5940
 epoch: 25, train_loss: 0.7605, test_loss: 0.9838, test_f1: 0.5677
 epoch: 26, train_loss: 0.7509, test_loss: 0.9584, test_f1: 0.5656
 epoch: 27, train_loss: 0.7522, test_loss: 0.9327, test_f1: 0.5972
 epoch: 28, train_loss: 0.7588, test_loss: 0.9390, test_f1: 0.6151
 epoch: 29, train_loss: 0.7311, test_loss: 0.9420, test_f1: 0.6255
 epoch: 30, train_loss: 0.7351, test_loss: 0.9737, test_f1: 0.6129
 epoch: 31, train_loss: 0.7505, test_loss: 0.9385, test_f1: 0.6366
 epoch: 32, train_loss: 0.7299, test_loss: 0.9688, test_f1: 0.6128
 epoch: 33, train_loss: 0.7125, test_loss: 0.9350, test_f1: 0.6317
 epoch: 34, train_loss: 0.7215, test_loss: 0.9265, test_f1: 0.6068
 epoch: 35, train_loss: 0.7193, test_loss: 1.0055, test_f1: 0.6147
 epoch: 36, train_loss: 0.7058, test_loss: 0.9843, test_f1: 0.5917
 epoch: 37, train_loss: 0.7031, test_loss: 0.9483, test_f1: 0.6053
 epoch: 38, train_loss: 0.6965, test_loss: 1.0265, test_f1: 0.5925
 epoch: 39, train_loss: 0.7018, test_loss: 0.8997, test_f1: 0.6206
 epoch: 40, train_loss: 0.6871, test_loss: 0.9818, test_f1: 0.6423
 epoch: 41, train_loss: 0.6652, test_loss: 1.0068, test_f1: 0.6011
 epoch: 42, train_loss: 0.6746, test_loss: 0.9837, test_f1: 0.6217
 epoch: 43, train_loss: 0.6737, test_loss: 0.9987, test_f1: 0.6136
 epoch: 44, train_loss: 0.6614, test_loss: 1.0680, test_f1: 0.5920
 epoch: 45, train_loss: 0.6536, test_loss: 0.9915, test_f1: 0.6526
 epoch: 46, train_loss: 0.6537, test_loss: 1.0076, test_f1: 0.6147
 epoch: 47, train_loss: 0.6711, test_loss: 1.0042, test_f1: 0.6147
 epoch: 48, train_loss: 0.6456, test_loss: 0.9476, test_f1: 0.6469
 epoch: 49, train_loss: 0.6432, test_loss: 1.0484, test_f1: 0.6190
 epoch: 50, train_loss: 0.6462, test_loss: 1.0459, test_f1: 0.6096
 epoch: 51, train_loss: 0.6142, test_loss: 1.0120, test_f1: 0.6470
 epoch: 52, train_loss: 0.5776, test_loss: 1.0357, test_f1: 0.6438
 epoch: 53, train_loss: 0.5677, test_loss: 1.0419, test_f1: 0.6524
 epoch: 54, train_loss: 0.5588, test_loss: 1.0374, test_f1: 0.6510
 epoch: 55, train_loss: 0.5553, test_loss: 1.0159, test_f1: 0.6337
 epoch: 56, train_loss: 0.5502, test_loss: 1.0591, test_f1: 0.6706
 epoch: 57, train_loss: 0.5347, test_loss: 1.0668, test_f1: 0.6341
 epoch: 58, train_loss: 0.5519, test_loss: 1.0881, test_f1: 0.6547
 epoch: 59, train_loss: 0.5428, test_loss: 1.0607, test_f1: 0.6363
 epoch: 60, train_loss: 0.5180, test_loss: 1.1127, test_f1: 0.6557
 epoch: 61, train_loss: 0.5274, test_loss: 1.1219, test_f1: 0.6596
 epoch: 62, train_loss: 0.5274, test_loss: 1.1165, test_f1: 0.6493
 epoch: 63, train_loss: 0.5274, test_loss: 1.0152, test_f1: 0.6672
 epoch: 64, train_loss: 0.5084, test_loss: 1.0495, test_f1: 0.6574
 epoch: 65, train_loss: 0.5010, test_loss: 1.1026, test_f1: 0.6465
 epoch: 66, train_loss: 0.5071, test_loss: 1.0598, test_f1: 0.6528
 epoch: 67, train_loss: 0.5120, test_loss: 1.0848, test_f1: 0.6637
 epoch: 68, train_loss: 0.4796, test_loss: 1.1141, test_f1: 0.6437
 epoch: 69, train_loss: 0.4954, test_loss: 1.0533, test_f1: 0.6593
 epoch: 70, train_loss: 0.4829, test_loss: 1.0878, test_f1: 0.6494
 epoch: 71, train_loss: 0.4904, test_loss: 1.0716, test_f1: 0.6355
 epoch: 72, train_loss: 0.4834, test_loss: 1.1065, test_f1: 0.6390
 epoch: 73, train_loss: 0.4801, test_loss: 1.0925, test_f1: 0.6606
 epoch: 74, train_loss: 0.4779, test_loss: 1.1294, test_f1: 0.6497
 epoch: 75, train_loss: 0.4466, test_loss: 1.0954, test_f1: 0.6701
 epoch: 76, train_loss: 0.4533, test_loss: 1.1219, test_f1: 0.6726
 epoch: 77, train_loss: 0.4695, test_loss: 1.1401, test_f1: 0.6657
 epoch: 78, train_loss: 0.4608, test_loss: 1.0980, test_f1: 0.6456
 epoch: 79, train_loss: 0.4530, test_loss: 1.0970, test_f1: 0.6736
 epoch: 80, train_loss: 0.4657, test_loss: 1.1074, test_f1: 0.6538
 epoch: 81, train_loss: 0.4376, test_loss: 1.0547, test_f1: 0.6883
 epoch: 82, train_loss: 0.4350, test_loss: 1.1608, test_f1: 0.6459
 epoch: 83, train_loss: 0.4304, test_loss: 1.1092, test_f1: 0.6764
 epoch: 84, train_loss: 0.4244, test_loss: 1.1233, test_f1: 0.6649
 epoch: 85, train_loss: 0.4518, test_loss: 1.0901, test_f1: 0.6968
 epoch: 86, train_loss: 0.4379, test_loss: 1.1839, test_f1: 0.6517
 epoch: 87, train_loss: 0.4334, test_loss: 1.0826, test_f1: 0.6443
 epoch: 88, train_loss: 0.4215, test_loss: 1.2107, test_f1: 0.6444
 epoch: 89, train_loss: 0.4344, test_loss: 1.1755, test_f1: 0.6339
 epoch: 90, train_loss: 0.4222, test_loss: 1.1620, test_f1: 0.6389
 epoch: 91, train_loss: 0.4049, test_loss: 1.1706, test_f1: 0.6900
 epoch: 92, train_loss: 0.4072, test_loss: 1.3215, test_f1: 0.6424
 epoch: 93, train_loss: 0.4083, test_loss: 1.2730, test_f1: 0.6370
 epoch: 94, train_loss: 0.4024, test_loss: 1.1503, test_f1: 0.6824
 epoch: 95, train_loss: 0.4173, test_loss: 1.2160, test_f1: 0.6723
 epoch: 96, train_loss: 0.4000, test_loss: 1.2801, test_f1: 0.6648
 epoch: 97, train_loss: 0.3969, test_loss: 1.3091, test_f1: 0.6193
 epoch: 98, train_loss: 0.3986, test_loss: 1.2377, test_f1: 0.6368
 epoch: 99, train_loss: 0.3859, test_loss: 1.2349, test_f1: 0.6643
##################ITERATION #5 ****************************************
 epoch: 0, train_loss: 1.2821, test_loss: 0.9983, test_f1: 0.4509
 epoch: 1, train_loss: 1.0331, test_loss: 0.9769, test_f1: 0.5025
 epoch: 2, train_loss: 0.9884, test_loss: 0.9553, test_f1: 0.5083
 epoch: 3, train_loss: 0.9663, test_loss: 0.9591, test_f1: 0.4860
 epoch: 4, train_loss: 0.9456, test_loss: 0.9364, test_f1: 0.5194
 epoch: 5, train_loss: 0.9302, test_loss: 0.9298, test_f1: 0.5059
 epoch: 6, train_loss: 0.9014, test_loss: 0.9165, test_f1: 0.5135
 epoch: 7, train_loss: 0.8913, test_loss: 0.9022, test_f1: 0.5673
 epoch: 8, train_loss: 0.8775, test_loss: 0.9453, test_f1: 0.5350
 epoch: 9, train_loss: 0.8841, test_loss: 0.8984, test_f1: 0.5560
 epoch: 10, train_loss: 0.8738, test_loss: 0.9488, test_f1: 0.5605
 epoch: 11, train_loss: 0.8478, test_loss: 0.9421, test_f1: 0.5442
 epoch: 12, train_loss: 0.8359, test_loss: 0.9644, test_f1: 0.5696
 epoch: 13, train_loss: 0.8380, test_loss: 0.9021, test_f1: 0.5595
 epoch: 14, train_loss: 0.8212, test_loss: 0.9209, test_f1: 0.5554
 epoch: 15, train_loss: 0.8066, test_loss: 0.9666, test_f1: 0.5434
 epoch: 16, train_loss: 0.8085, test_loss: 0.9105, test_f1: 0.5409
 epoch: 17, train_loss: 0.8075, test_loss: 0.9410, test_f1: 0.5151
 epoch: 18, train_loss: 0.8144, test_loss: 0.8948, test_f1: 0.5636
 epoch: 19, train_loss: 0.7889, test_loss: 0.9230, test_f1: 0.5881
 epoch: 20, train_loss: 0.7780, test_loss: 0.9072, test_f1: 0.6004
 epoch: 21, train_loss: 0.7549, test_loss: 0.8859, test_f1: 0.5940
 epoch: 22, train_loss: 0.7603, test_loss: 0.9067, test_f1: 0.5872
 epoch: 23, train_loss: 0.7687, test_loss: 0.8972, test_f1: 0.6192
 epoch: 24, train_loss: 0.7652, test_loss: 0.9535, test_f1: 0.5805
 epoch: 25, train_loss: 0.7371, test_loss: 0.9161, test_f1: 0.6120
 epoch: 26, train_loss: 0.7471, test_loss: 0.9453, test_f1: 0.5766
 epoch: 27, train_loss: 0.7338, test_loss: 0.9121, test_f1: 0.6016
 epoch: 28, train_loss: 0.7288, test_loss: 0.9157, test_f1: 0.6136
 epoch: 29, train_loss: 0.7274, test_loss: 0.9148, test_f1: 0.6140
 epoch: 30, train_loss: 0.7202, test_loss: 1.0200, test_f1: 0.5800
 epoch: 31, train_loss: 0.7032, test_loss: 0.9215, test_f1: 0.5958
 epoch: 32, train_loss: 0.7075, test_loss: 0.9476, test_f1: 0.5883
 epoch: 33, train_loss: 0.7022, test_loss: 0.9024, test_f1: 0.6297
 epoch: 34, train_loss: 0.7126, test_loss: 0.9178, test_f1: 0.5952
 epoch: 35, train_loss: 0.6903, test_loss: 0.9243, test_f1: 0.6099
 epoch: 36, train_loss: 0.6740, test_loss: 0.9503, test_f1: 0.6170
 epoch: 37, train_loss: 0.6789, test_loss: 0.9461, test_f1: 0.6312
 epoch: 38, train_loss: 0.6620, test_loss: 0.9328, test_f1: 0.6451
 epoch: 39, train_loss: 0.6729, test_loss: 0.9157, test_f1: 0.6376
 epoch: 40, train_loss: 0.6604, test_loss: 0.9196, test_f1: 0.6284
 epoch: 41, train_loss: 0.6363, test_loss: 0.9495, test_f1: 0.6388
 epoch: 42, train_loss: 0.6396, test_loss: 0.9308, test_f1: 0.6044
 epoch: 43, train_loss: 0.6518, test_loss: 0.9760, test_f1: 0.6061
 epoch: 44, train_loss: 0.6621, test_loss: 0.9781, test_f1: 0.6312
 epoch: 45, train_loss: 0.6368, test_loss: 0.8965, test_f1: 0.6383
 epoch: 46, train_loss: 0.6222, test_loss: 0.9713, test_f1: 0.5955
 epoch: 47, train_loss: 0.6144, test_loss: 0.9063, test_f1: 0.6472
 epoch: 48, train_loss: 0.6282, test_loss: 0.9516, test_f1: 0.6535
 epoch: 49, train_loss: 0.5956, test_loss: 1.0341, test_f1: 0.6193
 epoch: 50, train_loss: 0.6136, test_loss: 1.0508, test_f1: 0.6486
 epoch: 51, train_loss: 0.5829, test_loss: 0.9744, test_f1: 0.6336
 epoch: 52, train_loss: 0.5531, test_loss: 0.9808, test_f1: 0.6695
 epoch: 53, train_loss: 0.5506, test_loss: 0.9834, test_f1: 0.6490
 epoch: 54, train_loss: 0.5226, test_loss: 0.9902, test_f1: 0.6872
 epoch: 55, train_loss: 0.5169, test_loss: 0.9587, test_f1: 0.6778
 epoch: 56, train_loss: 0.5160, test_loss: 1.0035, test_f1: 0.6644
 epoch: 57, train_loss: 0.4974, test_loss: 0.9910, test_f1: 0.6539
 epoch: 58, train_loss: 0.5020, test_loss: 1.0395, test_f1: 0.6342
 epoch: 59, train_loss: 0.5023, test_loss: 1.0555, test_f1: 0.6677
 epoch: 60, train_loss: 0.4856, test_loss: 1.0276, test_f1: 0.6770
 epoch: 61, train_loss: 0.4911, test_loss: 1.0349, test_f1: 0.6449
 epoch: 62, train_loss: 0.4790, test_loss: 1.0153, test_f1: 0.6512
 epoch: 63, train_loss: 0.4696, test_loss: 1.0091, test_f1: 0.6650
 epoch: 64, train_loss: 0.4599, test_loss: 1.0678, test_f1: 0.6435
 epoch: 65, train_loss: 0.4563, test_loss: 1.0980, test_f1: 0.6420
 epoch: 66, train_loss: 0.4474, test_loss: 1.0840, test_f1: 0.6398
 epoch: 67, train_loss: 0.4518, test_loss: 1.0600, test_f1: 0.6743
 epoch: 68, train_loss: 0.4524, test_loss: 1.1269, test_f1: 0.6663
 epoch: 69, train_loss: 0.4466, test_loss: 1.0802, test_f1: 0.6553
 epoch: 70, train_loss: 0.4549, test_loss: 1.0873, test_f1: 0.6652
 epoch: 71, train_loss: 0.4334, test_loss: 1.0456, test_f1: 0.6444
 epoch: 72, train_loss: 0.4178, test_loss: 1.1014, test_f1: 0.6412
 epoch: 73, train_loss: 0.4341, test_loss: 1.1137, test_f1: 0.6796
 epoch: 74, train_loss: 0.4161, test_loss: 1.0896, test_f1: 0.6636
 epoch: 75, train_loss: 0.4122, test_loss: 1.1249, test_f1: 0.6651
 epoch: 76, train_loss: 0.4350, test_loss: 1.1531, test_f1: 0.6497
 epoch: 77, train_loss: 0.4021, test_loss: 1.1167, test_f1: 0.6653
 epoch: 78, train_loss: 0.4049, test_loss: 1.1239, test_f1: 0.6692
 epoch: 79, train_loss: 0.3887, test_loss: 1.1820, test_f1: 0.6590
 epoch: 80, train_loss: 0.4136, test_loss: 1.2433, test_f1: 0.6497
 epoch: 81, train_loss: 0.4031, test_loss: 1.1971, test_f1: 0.6502
 epoch: 82, train_loss: 0.3952, test_loss: 1.1495, test_f1: 0.6817
 epoch: 83, train_loss: 0.3870, test_loss: 1.2369, test_f1: 0.6631
 epoch: 84, train_loss: 0.3847, test_loss: 1.1591, test_f1: 0.6542
 epoch: 85, train_loss: 0.3842, test_loss: 1.2511, test_f1: 0.6651
 epoch: 86, train_loss: 0.3855, test_loss: 1.2466, test_f1: 0.6370
 epoch: 87, train_loss: 0.3735, test_loss: 1.2429, test_f1: 0.6504
 epoch: 88, train_loss: 0.3863, test_loss: 1.2791, test_f1: 0.6483
 epoch: 89, train_loss: 0.3581, test_loss: 1.2499, test_f1: 0.6620
 epoch: 90, train_loss: 0.3499, test_loss: 1.2259, test_f1: 0.6626
 epoch: 91, train_loss: 0.3732, test_loss: 1.2843, test_f1: 0.6667
 epoch: 92, train_loss: 0.3691, test_loss: 1.3062, test_f1: 0.6585
 epoch: 93, train_loss: 0.3518, test_loss: 1.2883, test_f1: 0.6489
 epoch: 94, train_loss: 0.3554, test_loss: 1.3556, test_f1: 0.6522
 epoch: 95, train_loss: 0.3472, test_loss: 1.2504, test_f1: 0.6673
 epoch: 96, train_loss: 0.3402, test_loss: 1.2321, test_f1: 0.6641
 epoch: 97, train_loss: 0.3502, test_loss: 1.2579, test_f1: 0.6897
 epoch: 98, train_loss: 0.3579, test_loss: 1.2481, test_f1: 0.6748
 epoch: 99, train_loss: 0.3456, test_loss: 1.2890, test_f1: 0.6477
##################ITERATION #6 ****************************************
 epoch: 0, train_loss: 1.3016, test_loss: 1.0223, test_f1: 0.4742
 epoch: 1, train_loss: 1.0339, test_loss: 0.9834, test_f1: 0.4803
 epoch: 2, train_loss: 0.9987, test_loss: 0.9727, test_f1: 0.4767
 epoch: 3, train_loss: 0.9659, test_loss: 0.9410, test_f1: 0.4903
 epoch: 4, train_loss: 0.9451, test_loss: 0.9605, test_f1: 0.4926
 epoch: 5, train_loss: 0.9297, test_loss: 0.9865, test_f1: 0.4897
 epoch: 6, train_loss: 0.9132, test_loss: 0.9370, test_f1: 0.5057
 epoch: 7, train_loss: 0.9076, test_loss: 0.9603, test_f1: 0.5007
 epoch: 8, train_loss: 0.8982, test_loss: 0.9813, test_f1: 0.5169
 epoch: 9, train_loss: 0.8872, test_loss: 0.9373, test_f1: 0.5433
 epoch: 10, train_loss: 0.8569, test_loss: 0.9724, test_f1: 0.5495
 epoch: 11, train_loss: 0.8577, test_loss: 0.9503, test_f1: 0.5349
 epoch: 12, train_loss: 0.8476, test_loss: 0.9215, test_f1: 0.5353
 epoch: 13, train_loss: 0.8436, test_loss: 0.9834, test_f1: 0.5453
 epoch: 14, train_loss: 0.8347, test_loss: 1.0334, test_f1: 0.5460
 epoch: 15, train_loss: 0.8161, test_loss: 0.9608, test_f1: 0.5694
 epoch: 16, train_loss: 0.8164, test_loss: 0.9545, test_f1: 0.5690
 epoch: 17, train_loss: 0.7888, test_loss: 1.0190, test_f1: 0.5721
 epoch: 18, train_loss: 0.8185, test_loss: 0.9181, test_f1: 0.5678
 epoch: 19, train_loss: 0.8016, test_loss: 1.0003, test_f1: 0.5638
 epoch: 20, train_loss: 0.7953, test_loss: 0.9278, test_f1: 0.5753
 epoch: 21, train_loss: 0.7713, test_loss: 0.9437, test_f1: 0.5433
 epoch: 22, train_loss: 0.7763, test_loss: 0.9447, test_f1: 0.5647
 epoch: 23, train_loss: 0.7749, test_loss: 0.9568, test_f1: 0.5668
 epoch: 24, train_loss: 0.7648, test_loss: 0.9140, test_f1: 0.6075
 epoch: 25, train_loss: 0.7414, test_loss: 1.0229, test_f1: 0.5324
 epoch: 26, train_loss: 0.7450, test_loss: 0.9806, test_f1: 0.5805
 epoch: 27, train_loss: 0.7174, test_loss: 0.9519, test_f1: 0.5793
 epoch: 28, train_loss: 0.7480, test_loss: 0.9371, test_f1: 0.6043
 epoch: 29, train_loss: 0.7245, test_loss: 0.9425, test_f1: 0.6114
 epoch: 30, train_loss: 0.7138, test_loss: 1.1130, test_f1: 0.5716
 epoch: 31, train_loss: 0.7302, test_loss: 0.9650, test_f1: 0.6059
 epoch: 32, train_loss: 0.7039, test_loss: 0.9694, test_f1: 0.6093
 epoch: 33, train_loss: 0.7057, test_loss: 1.0002, test_f1: 0.6148
 epoch: 34, train_loss: 0.6955, test_loss: 0.9708, test_f1: 0.6397
 epoch: 35, train_loss: 0.6947, test_loss: 1.0084, test_f1: 0.5650
 epoch: 36, train_loss: 0.6836, test_loss: 0.9508, test_f1: 0.6027
 epoch: 37, train_loss: 0.6873, test_loss: 0.9671, test_f1: 0.6219
 epoch: 38, train_loss: 0.6723, test_loss: 0.9801, test_f1: 0.6227
 epoch: 39, train_loss: 0.6644, test_loss: 0.9518, test_f1: 0.6566
 epoch: 40, train_loss: 0.6604, test_loss: 0.9481, test_f1: 0.6040
 epoch: 41, train_loss: 0.6684, test_loss: 0.9915, test_f1: 0.6244
 epoch: 42, train_loss: 0.6721, test_loss: 0.9752, test_f1: 0.5873
 epoch: 43, train_loss: 0.6551, test_loss: 1.0276, test_f1: 0.6203
 epoch: 44, train_loss: 0.6398, test_loss: 0.9544, test_f1: 0.6440
 epoch: 45, train_loss: 0.6566, test_loss: 0.9310, test_f1: 0.6578
 epoch: 46, train_loss: 0.6314, test_loss: 1.0181, test_f1: 0.6184
 epoch: 47, train_loss: 0.6332, test_loss: 0.9587, test_f1: 0.6316
 epoch: 48, train_loss: 0.6197, test_loss: 0.9454, test_f1: 0.6080
 epoch: 49, train_loss: 0.6077, test_loss: 0.9957, test_f1: 0.6459
 epoch: 50, train_loss: 0.6131, test_loss: 1.0117, test_f1: 0.6007
 epoch: 51, train_loss: 0.5648, test_loss: 0.9859, test_f1: 0.6259
 epoch: 52, train_loss: 0.5521, test_loss: 1.0465, test_f1: 0.6453
 epoch: 53, train_loss: 0.5386, test_loss: 1.0417, test_f1: 0.6425
 epoch: 54, train_loss: 0.5366, test_loss: 1.0361, test_f1: 0.6142
 epoch: 55, train_loss: 0.5288, test_loss: 1.0422, test_f1: 0.6610
 epoch: 56, train_loss: 0.5190, test_loss: 1.0354, test_f1: 0.6392
 epoch: 57, train_loss: 0.5159, test_loss: 1.0426, test_f1: 0.6620
 epoch: 58, train_loss: 0.4970, test_loss: 1.0797, test_f1: 0.6239
 epoch: 59, train_loss: 0.5171, test_loss: 1.0811, test_f1: 0.6331
 epoch: 60, train_loss: 0.5046, test_loss: 1.0956, test_f1: 0.6466
 epoch: 61, train_loss: 0.5142, test_loss: 1.0424, test_f1: 0.6607
 epoch: 62, train_loss: 0.5010, test_loss: 1.0634, test_f1: 0.6374
 epoch: 63, train_loss: 0.4910, test_loss: 1.0317, test_f1: 0.6661
 epoch: 64, train_loss: 0.4831, test_loss: 1.1292, test_f1: 0.6318
 epoch: 65, train_loss: 0.5088, test_loss: 1.1132, test_f1: 0.6346
 epoch: 66, train_loss: 0.4761, test_loss: 1.0850, test_f1: 0.6682
 epoch: 67, train_loss: 0.4804, test_loss: 1.0958, test_f1: 0.6142
 epoch: 68, train_loss: 0.4815, test_loss: 1.0591, test_f1: 0.6376
 epoch: 69, train_loss: 0.4548, test_loss: 1.1067, test_f1: 0.6190
 epoch: 70, train_loss: 0.4526, test_loss: 1.1314, test_f1: 0.5957
 epoch: 71, train_loss: 0.4710, test_loss: 1.0576, test_f1: 0.6401
 epoch: 72, train_loss: 0.4588, test_loss: 1.0211, test_f1: 0.6627
 epoch: 73, train_loss: 0.4526, test_loss: 1.1055, test_f1: 0.6365
 epoch: 74, train_loss: 0.4410, test_loss: 1.1904, test_f1: 0.6356
 epoch: 75, train_loss: 0.4342, test_loss: 1.2163, test_f1: 0.6118
 epoch: 76, train_loss: 0.4212, test_loss: 1.1050, test_f1: 0.6288
 epoch: 77, train_loss: 0.4366, test_loss: 1.1996, test_f1: 0.6324
 epoch: 78, train_loss: 0.4376, test_loss: 1.1446, test_f1: 0.6802
 epoch: 79, train_loss: 0.4527, test_loss: 1.1811, test_f1: 0.6269
 epoch: 80, train_loss: 0.4175, test_loss: 1.1960, test_f1: 0.6390
 epoch: 81, train_loss: 0.4158, test_loss: 1.2362, test_f1: 0.6393
 epoch: 82, train_loss: 0.4119, test_loss: 1.1398, test_f1: 0.6335
 epoch: 83, train_loss: 0.4117, test_loss: 1.2363, test_f1: 0.6427
 epoch: 84, train_loss: 0.3927, test_loss: 1.2095, test_f1: 0.6315
 epoch: 85, train_loss: 0.3984, test_loss: 1.2021, test_f1: 0.6216
 epoch: 86, train_loss: 0.4178, test_loss: 1.1867, test_f1: 0.6581
 epoch: 87, train_loss: 0.3841, test_loss: 1.3076, test_f1: 0.6216
 epoch: 88, train_loss: 0.4045, test_loss: 1.2478, test_f1: 0.6250
 epoch: 89, train_loss: 0.4034, test_loss: 1.2434, test_f1: 0.6324
 epoch: 90, train_loss: 0.3927, test_loss: 1.2901, test_f1: 0.6258
 epoch: 91, train_loss: 0.3976, test_loss: 1.3027, test_f1: 0.6301
 epoch: 92, train_loss: 0.3891, test_loss: 1.3361, test_f1: 0.6151
 epoch: 93, train_loss: 0.3744, test_loss: 1.3133, test_f1: 0.6404
 epoch: 94, train_loss: 0.3798, test_loss: 1.2755, test_f1: 0.6324
 epoch: 95, train_loss: 0.3632, test_loss: 1.3666, test_f1: 0.6147
 epoch: 96, train_loss: 0.3741, test_loss: 1.3078, test_f1: 0.6474
 epoch: 97, train_loss: 0.3594, test_loss: 1.3595, test_f1: 0.6488
 epoch: 98, train_loss: 0.3745, test_loss: 1.4345, test_f1: 0.6080
 epoch: 99, train_loss: 0.3538, test_loss: 1.4726, test_f1: 0.6139
##################ITERATION #7 ****************************************
 epoch: 0, train_loss: 1.2883, test_loss: 1.0398, test_f1: 0.4468
 epoch: 1, train_loss: 1.0580, test_loss: 0.9752, test_f1: 0.4813
 epoch: 2, train_loss: 1.0055, test_loss: 0.9483, test_f1: 0.4770
 epoch: 3, train_loss: 0.9624, test_loss: 0.9447, test_f1: 0.4892
 epoch: 4, train_loss: 0.9305, test_loss: 0.9485, test_f1: 0.4754
 epoch: 5, train_loss: 0.9136, test_loss: 0.9192, test_f1: 0.4969
 epoch: 6, train_loss: 0.9072, test_loss: 0.9166, test_f1: 0.5167
 epoch: 7, train_loss: 0.8906, test_loss: 0.9852, test_f1: 0.5034
 epoch: 8, train_loss: 0.8743, test_loss: 0.9431, test_f1: 0.5185
 epoch: 9, train_loss: 0.8590, test_loss: 0.9323, test_f1: 0.5185
 epoch: 10, train_loss: 0.8481, test_loss: 0.9340, test_f1: 0.5284
 epoch: 11, train_loss: 0.8371, test_loss: 0.9233, test_f1: 0.5374
 epoch: 12, train_loss: 0.8249, test_loss: 0.9625, test_f1: 0.5440
 epoch: 13, train_loss: 0.8224, test_loss: 0.9437, test_f1: 0.5371
 epoch: 14, train_loss: 0.8045, test_loss: 0.9227, test_f1: 0.5358
 epoch: 15, train_loss: 0.8069, test_loss: 0.9175, test_f1: 0.5656
 epoch: 16, train_loss: 0.8057, test_loss: 0.9257, test_f1: 0.5494
 epoch: 17, train_loss: 0.7937, test_loss: 0.9561, test_f1: 0.5889
 epoch: 18, train_loss: 0.8030, test_loss: 0.9781, test_f1: 0.5328
 epoch: 19, train_loss: 0.7926, test_loss: 0.9318, test_f1: 0.5359
 epoch: 20, train_loss: 0.7852, test_loss: 0.9309, test_f1: 0.5760
 epoch: 21, train_loss: 0.7904, test_loss: 0.9424, test_f1: 0.5795
 epoch: 22, train_loss: 0.7715, test_loss: 0.9201, test_f1: 0.5812
 epoch: 23, train_loss: 0.7686, test_loss: 0.9429, test_f1: 0.5873
 epoch: 24, train_loss: 0.7571, test_loss: 0.9637, test_f1: 0.5876
 epoch: 25, train_loss: 0.7347, test_loss: 0.9487, test_f1: 0.5867
 epoch: 26, train_loss: 0.7252, test_loss: 1.0252, test_f1: 0.5665
 epoch: 27, train_loss: 0.7291, test_loss: 0.9609, test_f1: 0.5863
 epoch: 28, train_loss: 0.7141, test_loss: 0.9621, test_f1: 0.6165
 epoch: 29, train_loss: 0.7121, test_loss: 0.9498, test_f1: 0.6292
 epoch: 30, train_loss: 0.7137, test_loss: 0.9187, test_f1: 0.5877
 epoch: 31, train_loss: 0.7173, test_loss: 0.8951, test_f1: 0.5915
 epoch: 32, train_loss: 0.7039, test_loss: 0.8859, test_f1: 0.6076
 epoch: 33, train_loss: 0.6942, test_loss: 0.9201, test_f1: 0.6463
 epoch: 34, train_loss: 0.6877, test_loss: 0.9370, test_f1: 0.6191
 epoch: 35, train_loss: 0.6984, test_loss: 0.9265, test_f1: 0.6298
 epoch: 36, train_loss: 0.6494, test_loss: 0.9501, test_f1: 0.6170
 epoch: 37, train_loss: 0.6558, test_loss: 0.9743, test_f1: 0.5969
 epoch: 38, train_loss: 0.6592, test_loss: 0.9348, test_f1: 0.6399
 epoch: 39, train_loss: 0.6648, test_loss: 0.9146, test_f1: 0.6264
 epoch: 40, train_loss: 0.6435, test_loss: 0.9220, test_f1: 0.6205
 epoch: 41, train_loss: 0.6461, test_loss: 0.9122, test_f1: 0.6282
 epoch: 42, train_loss: 0.6485, test_loss: 0.8787, test_f1: 0.6479
 epoch: 43, train_loss: 0.6302, test_loss: 0.9257, test_f1: 0.6590
 epoch: 44, train_loss: 0.6177, test_loss: 0.8972, test_f1: 0.6558
 epoch: 45, train_loss: 0.6128, test_loss: 0.9225, test_f1: 0.6493
 epoch: 46, train_loss: 0.6145, test_loss: 0.9887, test_f1: 0.6139
 epoch: 47, train_loss: 0.6020, test_loss: 0.9282, test_f1: 0.6656
 epoch: 48, train_loss: 0.6169, test_loss: 0.9424, test_f1: 0.6550
 epoch: 49, train_loss: 0.6000, test_loss: 0.9565, test_f1: 0.6443
 epoch: 50, train_loss: 0.6082, test_loss: 0.9984, test_f1: 0.6620
 epoch: 51, train_loss: 0.5537, test_loss: 0.9330, test_f1: 0.6572
 epoch: 52, train_loss: 0.5444, test_loss: 0.9634, test_f1: 0.6531
 epoch: 53, train_loss: 0.5339, test_loss: 0.9746, test_f1: 0.6442
 epoch: 54, train_loss: 0.5234, test_loss: 0.9509, test_f1: 0.6560
 epoch: 55, train_loss: 0.5180, test_loss: 0.9402, test_f1: 0.6660
 epoch: 56, train_loss: 0.5066, test_loss: 1.0285, test_f1: 0.6401
 epoch: 57, train_loss: 0.4979, test_loss: 0.9984, test_f1: 0.6461
 epoch: 58, train_loss: 0.4862, test_loss: 0.9905, test_f1: 0.6589
 epoch: 59, train_loss: 0.5017, test_loss: 1.0203, test_f1: 0.6453
 epoch: 60, train_loss: 0.4980, test_loss: 1.0263, test_f1: 0.6483
 epoch: 61, train_loss: 0.4847, test_loss: 1.0308, test_f1: 0.6570
 epoch: 62, train_loss: 0.4698, test_loss: 0.9770, test_f1: 0.6631
 epoch: 63, train_loss: 0.4813, test_loss: 1.0388, test_f1: 0.6696
 epoch: 64, train_loss: 0.4717, test_loss: 1.0181, test_f1: 0.6570
 epoch: 65, train_loss: 0.4706, test_loss: 1.1094, test_f1: 0.6610
 epoch: 66, train_loss: 0.4807, test_loss: 1.0374, test_f1: 0.6729
 epoch: 67, train_loss: 0.4671, test_loss: 1.0690, test_f1: 0.6227
 epoch: 68, train_loss: 0.4599, test_loss: 1.0300, test_f1: 0.6539
 epoch: 69, train_loss: 0.4535, test_loss: 1.0569, test_f1: 0.6735
 epoch: 70, train_loss: 0.4537, test_loss: 1.0660, test_f1: 0.6463
 epoch: 71, train_loss: 0.4588, test_loss: 1.1178, test_f1: 0.6507
 epoch: 72, train_loss: 0.4382, test_loss: 1.0749, test_f1: 0.6573
 epoch: 73, train_loss: 0.4358, test_loss: 1.0812, test_f1: 0.6648
 epoch: 74, train_loss: 0.4231, test_loss: 1.1092, test_f1: 0.6731
 epoch: 75, train_loss: 0.4351, test_loss: 1.0463, test_f1: 0.6713
 epoch: 76, train_loss: 0.4248, test_loss: 1.1605, test_f1: 0.6342
 epoch: 77, train_loss: 0.4202, test_loss: 1.1033, test_f1: 0.6650
 epoch: 78, train_loss: 0.4329, test_loss: 1.1252, test_f1: 0.6527
 epoch: 79, train_loss: 0.4290, test_loss: 1.2059, test_f1: 0.6549
 epoch: 80, train_loss: 0.4211, test_loss: 1.1269, test_f1: 0.6429
 epoch: 81, train_loss: 0.4131, test_loss: 1.1348, test_f1: 0.6461
 epoch: 82, train_loss: 0.4083, test_loss: 1.1154, test_f1: 0.6456
 epoch: 83, train_loss: 0.3838, test_loss: 1.1231, test_f1: 0.6612
 epoch: 84, train_loss: 0.3867, test_loss: 1.1433, test_f1: 0.6620
 epoch: 85, train_loss: 0.4309, test_loss: 1.2009, test_f1: 0.6383
 epoch: 86, train_loss: 0.4080, test_loss: 1.1946, test_f1: 0.6769
 epoch: 87, train_loss: 0.3984, test_loss: 1.1335, test_f1: 0.6733
 epoch: 88, train_loss: 0.3885, test_loss: 1.1369, test_f1: 0.6658
 epoch: 89, train_loss: 0.3860, test_loss: 1.2369, test_f1: 0.6411
 epoch: 90, train_loss: 0.3784, test_loss: 1.1829, test_f1: 0.6747
 epoch: 91, train_loss: 0.3804, test_loss: 1.2009, test_f1: 0.6559
 epoch: 92, train_loss: 0.3878, test_loss: 1.2399, test_f1: 0.6563
 epoch: 93, train_loss: 0.3872, test_loss: 1.1397, test_f1: 0.6925
 epoch: 94, train_loss: 0.3588, test_loss: 1.1986, test_f1: 0.6786
 epoch: 95, train_loss: 0.3621, test_loss: 1.2867, test_f1: 0.6554
 epoch: 96, train_loss: 0.3737, test_loss: 1.2035, test_f1: 0.6489
 epoch: 97, train_loss: 0.3483, test_loss: 1.2734, test_f1: 0.6689
 epoch: 98, train_loss: 0.3596, test_loss: 1.2172, test_f1: 0.6617
 epoch: 99, train_loss: 0.3590, test_loss: 1.2381, test_f1: 0.6381
##################ITERATION #8 ****************************************
 epoch: 0, train_loss: 1.3509, test_loss: 1.1415, test_f1: 0.3797
 epoch: 1, train_loss: 1.0586, test_loss: 0.9570, test_f1: 0.4666
 epoch: 2, train_loss: 0.9892, test_loss: 0.9346, test_f1: 0.4599
 epoch: 3, train_loss: 0.9697, test_loss: 0.9422, test_f1: 0.4715
 epoch: 4, train_loss: 0.9355, test_loss: 0.9629, test_f1: 0.4601
 epoch: 5, train_loss: 0.9311, test_loss: 0.9827, test_f1: 0.4989
 epoch: 6, train_loss: 0.8875, test_loss: 0.9405, test_f1: 0.5273
 epoch: 7, train_loss: 0.8926, test_loss: 0.9566, test_f1: 0.5014
 epoch: 8, train_loss: 0.8904, test_loss: 0.9419, test_f1: 0.5053
 epoch: 9, train_loss: 0.8739, test_loss: 0.9291, test_f1: 0.5147
 epoch: 10, train_loss: 0.8605, test_loss: 0.9663, test_f1: 0.5157
 epoch: 11, train_loss: 0.8500, test_loss: 0.9538, test_f1: 0.5351
 epoch: 12, train_loss: 0.8381, test_loss: 0.9175, test_f1: 0.5511
 epoch: 13, train_loss: 0.8258, test_loss: 0.8842, test_f1: 0.5466
 epoch: 14, train_loss: 0.8216, test_loss: 0.9087, test_f1: 0.5409
 epoch: 15, train_loss: 0.8181, test_loss: 0.9027, test_f1: 0.5395
 epoch: 16, train_loss: 0.8175, test_loss: 0.8816, test_f1: 0.5320
 epoch: 17, train_loss: 0.7998, test_loss: 0.9781, test_f1: 0.5667
 epoch: 18, train_loss: 0.7868, test_loss: 0.9444, test_f1: 0.5642
 epoch: 19, train_loss: 0.7857, test_loss: 0.9277, test_f1: 0.5366
 epoch: 20, train_loss: 0.7802, test_loss: 1.0272, test_f1: 0.5560
 epoch: 21, train_loss: 0.7775, test_loss: 0.9230, test_f1: 0.5766
 epoch: 22, train_loss: 0.7723, test_loss: 0.9068, test_f1: 0.5984
 epoch: 23, train_loss: 0.7746, test_loss: 0.9358, test_f1: 0.5576
 epoch: 24, train_loss: 0.7643, test_loss: 0.9813, test_f1: 0.5702
 epoch: 25, train_loss: 0.7533, test_loss: 0.9081, test_f1: 0.6071
 epoch: 26, train_loss: 0.7317, test_loss: 0.9577, test_f1: 0.6019
 epoch: 27, train_loss: 0.7360, test_loss: 1.0050, test_f1: 0.5688
 epoch: 28, train_loss: 0.7383, test_loss: 0.9492, test_f1: 0.5874
 epoch: 29, train_loss: 0.7439, test_loss: 0.9353, test_f1: 0.5831
 epoch: 30, train_loss: 0.7250, test_loss: 0.9727, test_f1: 0.5850
 epoch: 31, train_loss: 0.7312, test_loss: 0.9070, test_f1: 0.6035
 epoch: 32, train_loss: 0.7102, test_loss: 0.9560, test_f1: 0.6098
 epoch: 33, train_loss: 0.6983, test_loss: 1.0316, test_f1: 0.5688
 epoch: 34, train_loss: 0.7114, test_loss: 0.9387, test_f1: 0.6065
 epoch: 35, train_loss: 0.6768, test_loss: 1.0112, test_f1: 0.6039
 epoch: 36, train_loss: 0.6931, test_loss: 0.9926, test_f1: 0.5849
 epoch: 37, train_loss: 0.7040, test_loss: 0.9592, test_f1: 0.6110
 epoch: 38, train_loss: 0.6873, test_loss: 1.0139, test_f1: 0.6013
 epoch: 39, train_loss: 0.6718, test_loss: 0.8537, test_f1: 0.6491
 epoch: 40, train_loss: 0.6911, test_loss: 1.0057, test_f1: 0.6331
 epoch: 41, train_loss: 0.6682, test_loss: 1.0235, test_f1: 0.5899
 epoch: 42, train_loss: 0.6719, test_loss: 1.0835, test_f1: 0.6026
 epoch: 43, train_loss: 0.6632, test_loss: 0.8985, test_f1: 0.6112
 epoch: 44, train_loss: 0.6403, test_loss: 0.9973, test_f1: 0.6365
 epoch: 45, train_loss: 0.6423, test_loss: 0.9473, test_f1: 0.6355
 epoch: 46, train_loss: 0.6526, test_loss: 1.0476, test_f1: 0.6234
 epoch: 47, train_loss: 0.6156, test_loss: 0.9805, test_f1: 0.6392
 epoch: 48, train_loss: 0.6463, test_loss: 0.9564, test_f1: 0.6160
 epoch: 49, train_loss: 0.6092, test_loss: 0.9735, test_f1: 0.6179
 epoch: 50, train_loss: 0.6123, test_loss: 0.9676, test_f1: 0.6337
 epoch: 51, train_loss: 0.5894, test_loss: 0.9621, test_f1: 0.6183
 epoch: 52, train_loss: 0.5692, test_loss: 1.0389, test_f1: 0.6559
 epoch: 53, train_loss: 0.5493, test_loss: 0.9866, test_f1: 0.6404
 epoch: 54, train_loss: 0.5458, test_loss: 0.9891, test_f1: 0.6380
 epoch: 55, train_loss: 0.5259, test_loss: 0.9820, test_f1: 0.6630
 epoch: 56, train_loss: 0.5266, test_loss: 1.0146, test_f1: 0.6493
 epoch: 57, train_loss: 0.5249, test_loss: 1.0480, test_f1: 0.6258
 epoch: 58, train_loss: 0.5147, test_loss: 1.0244, test_f1: 0.6457
 epoch: 59, train_loss: 0.5181, test_loss: 1.0394, test_f1: 0.6614
 epoch: 60, train_loss: 0.5108, test_loss: 1.0161, test_f1: 0.6694
 epoch: 61, train_loss: 0.4996, test_loss: 1.0918, test_f1: 0.6350
 epoch: 62, train_loss: 0.5206, test_loss: 1.0742, test_f1: 0.6401
 epoch: 63, train_loss: 0.5046, test_loss: 1.0387, test_f1: 0.6667
 epoch: 64, train_loss: 0.4908, test_loss: 1.0534, test_f1: 0.6605
 epoch: 65, train_loss: 0.4872, test_loss: 1.0533, test_f1: 0.6253
 epoch: 66, train_loss: 0.5050, test_loss: 0.9950, test_f1: 0.6429
 epoch: 67, train_loss: 0.4835, test_loss: 1.1043, test_f1: 0.6270
 epoch: 68, train_loss: 0.4790, test_loss: 1.1710, test_f1: 0.6341
 epoch: 69, train_loss: 0.4783, test_loss: 1.0953, test_f1: 0.6377
 epoch: 70, train_loss: 0.4741, test_loss: 1.1131, test_f1: 0.6481
 epoch: 71, train_loss: 0.4568, test_loss: 1.0823, test_f1: 0.6200
 epoch: 72, train_loss: 0.4564, test_loss: 1.1324, test_f1: 0.6345
 epoch: 73, train_loss: 0.4492, test_loss: 1.0727, test_f1: 0.6394
 epoch: 74, train_loss: 0.4509, test_loss: 1.0712, test_f1: 0.6666
 epoch: 75, train_loss: 0.4653, test_loss: 1.1209, test_f1: 0.6585
 epoch: 76, train_loss: 0.4376, test_loss: 1.0579, test_f1: 0.6425
 epoch: 77, train_loss: 0.4598, test_loss: 1.1480, test_f1: 0.6303
 epoch: 78, train_loss: 0.4380, test_loss: 1.1588, test_f1: 0.6212
 epoch: 79, train_loss: 0.4365, test_loss: 1.1334, test_f1: 0.6305
 epoch: 80, train_loss: 0.4433, test_loss: 1.1949, test_f1: 0.6464
 epoch: 81, train_loss: 0.4349, test_loss: 1.1651, test_f1: 0.6278
 epoch: 82, train_loss: 0.4191, test_loss: 1.1270, test_f1: 0.6616
 epoch: 83, train_loss: 0.4308, test_loss: 1.1610, test_f1: 0.6320
 epoch: 84, train_loss: 0.4339, test_loss: 1.1804, test_f1: 0.6534
 epoch: 85, train_loss: 0.4070, test_loss: 1.1545, test_f1: 0.6453
 epoch: 86, train_loss: 0.4088, test_loss: 1.2021, test_f1: 0.6182
 epoch: 87, train_loss: 0.4130, test_loss: 1.1494, test_f1: 0.6661
 epoch: 88, train_loss: 0.4070, test_loss: 1.1721, test_f1: 0.6491
 epoch: 89, train_loss: 0.4034, test_loss: 1.2000, test_f1: 0.6495
 epoch: 90, train_loss: 0.4247, test_loss: 1.1715, test_f1: 0.6555
 epoch: 91, train_loss: 0.3901, test_loss: 1.2288, test_f1: 0.6571
 epoch: 92, train_loss: 0.3968, test_loss: 1.2675, test_f1: 0.6399
 epoch: 93, train_loss: 0.3915, test_loss: 1.2151, test_f1: 0.6235
 epoch: 94, train_loss: 0.3858, test_loss: 1.1457, test_f1: 0.6569
 epoch: 95, train_loss: 0.3860, test_loss: 1.2259, test_f1: 0.6449
 epoch: 96, train_loss: 0.3710, test_loss: 1.2469, test_f1: 0.6438
 epoch: 97, train_loss: 0.3789, test_loss: 1.3119, test_f1: 0.6344
 epoch: 98, train_loss: 0.3747, test_loss: 1.2608, test_f1: 0.6347
 epoch: 99, train_loss: 0.3740, test_loss: 1.2894, test_f1: 0.6204
##################ITERATION #9 ****************************************
 epoch: 0, train_loss: 1.3695, test_loss: 1.0851, test_f1: 0.4863
 epoch: 1, train_loss: 1.0459, test_loss: 0.9368, test_f1: 0.4590
 epoch: 2, train_loss: 0.9841, test_loss: 0.9647, test_f1: 0.4720
 epoch: 3, train_loss: 0.9685, test_loss: 0.9295, test_f1: 0.4961
 epoch: 4, train_loss: 0.9637, test_loss: 0.9163, test_f1: 0.4913
 epoch: 5, train_loss: 0.9368, test_loss: 0.9084, test_f1: 0.5133
 epoch: 6, train_loss: 0.9068, test_loss: 0.9364, test_f1: 0.5156
 epoch: 7, train_loss: 0.9165, test_loss: 0.8683, test_f1: 0.5348
 epoch: 8, train_loss: 0.8932, test_loss: 0.8822, test_f1: 0.5309
 epoch: 9, train_loss: 0.8968, test_loss: 0.8926, test_f1: 0.5267
 epoch: 10, train_loss: 0.8664, test_loss: 0.9090, test_f1: 0.5312
 epoch: 11, train_loss: 0.8634, test_loss: 0.9251, test_f1: 0.5447
 epoch: 12, train_loss: 0.8475, test_loss: 0.8629, test_f1: 0.5380
 epoch: 13, train_loss: 0.8436, test_loss: 0.8336, test_f1: 0.5355
 epoch: 14, train_loss: 0.8385, test_loss: 0.8841, test_f1: 0.5418
 epoch: 15, train_loss: 0.8189, test_loss: 0.8736, test_f1: 0.5424
 epoch: 16, train_loss: 0.8128, test_loss: 0.9135, test_f1: 0.5313
 epoch: 17, train_loss: 0.8220, test_loss: 0.9002, test_f1: 0.5575
 epoch: 18, train_loss: 0.8105, test_loss: 0.9214, test_f1: 0.5766
 epoch: 19, train_loss: 0.7958, test_loss: 0.8835, test_f1: 0.5512
 epoch: 20, train_loss: 0.7934, test_loss: 0.8479, test_f1: 0.5881
 epoch: 21, train_loss: 0.7726, test_loss: 0.9881, test_f1: 0.5109
 epoch: 22, train_loss: 0.7881, test_loss: 0.9537, test_f1: 0.5114
 epoch: 23, train_loss: 0.7792, test_loss: 0.9059, test_f1: 0.5661
 epoch: 24, train_loss: 0.7647, test_loss: 0.9175, test_f1: 0.5547
 epoch: 25, train_loss: 0.7378, test_loss: 0.8702, test_f1: 0.5957
 epoch: 26, train_loss: 0.7570, test_loss: 0.9527, test_f1: 0.5984
 epoch: 27, train_loss: 0.7455, test_loss: 0.8470, test_f1: 0.5922
 epoch: 28, train_loss: 0.7517, test_loss: 0.9640, test_f1: 0.5864
 epoch: 29, train_loss: 0.7259, test_loss: 0.8830, test_f1: 0.5967
 epoch: 30, train_loss: 0.7308, test_loss: 0.9405, test_f1: 0.5954
 epoch: 31, train_loss: 0.7259, test_loss: 0.8643, test_f1: 0.5707
 epoch: 32, train_loss: 0.7207, test_loss: 0.8971, test_f1: 0.6140
 epoch: 33, train_loss: 0.7086, test_loss: 0.8961, test_f1: 0.6320
 epoch: 34, train_loss: 0.7055, test_loss: 0.9865, test_f1: 0.6045
 epoch: 35, train_loss: 0.7066, test_loss: 0.9682, test_f1: 0.6313
 epoch: 36, train_loss: 0.7158, test_loss: 0.9829, test_f1: 0.5765
 epoch: 37, train_loss: 0.6891, test_loss: 0.9565, test_f1: 0.6022
 epoch: 38, train_loss: 0.6737, test_loss: 0.9434, test_f1: 0.6107
 epoch: 39, train_loss: 0.6740, test_loss: 0.9972, test_f1: 0.6145
 epoch: 40, train_loss: 0.6841, test_loss: 0.9942, test_f1: 0.6000
 epoch: 41, train_loss: 0.6920, test_loss: 0.8905, test_f1: 0.5984
 epoch: 42, train_loss: 0.6710, test_loss: 0.8909, test_f1: 0.6024
 epoch: 43, train_loss: 0.6643, test_loss: 0.8928, test_f1: 0.5907
 epoch: 44, train_loss: 0.6673, test_loss: 0.9323, test_f1: 0.5872
 epoch: 45, train_loss: 0.6318, test_loss: 0.8414, test_f1: 0.6248
 epoch: 46, train_loss: 0.6411, test_loss: 0.9558, test_f1: 0.6178
 epoch: 47, train_loss: 0.6482, test_loss: 0.9474, test_f1: 0.6406
 epoch: 48, train_loss: 0.6452, test_loss: 0.9225, test_f1: 0.5816
 epoch: 49, train_loss: 0.6304, test_loss: 1.0056, test_f1: 0.6181
 epoch: 50, train_loss: 0.6368, test_loss: 0.9867, test_f1: 0.6211
 epoch: 51, train_loss: 0.6054, test_loss: 0.9481, test_f1: 0.6479
 epoch: 52, train_loss: 0.5752, test_loss: 0.9237, test_f1: 0.6318
 epoch: 53, train_loss: 0.5725, test_loss: 0.9265, test_f1: 0.6582
 epoch: 54, train_loss: 0.5551, test_loss: 0.9704, test_f1: 0.6799
 epoch: 55, train_loss: 0.5473, test_loss: 0.9633, test_f1: 0.6553
 epoch: 56, train_loss: 0.5478, test_loss: 0.9927, test_f1: 0.6744
 epoch: 57, train_loss: 0.5220, test_loss: 1.0171, test_f1: 0.6747
 epoch: 58, train_loss: 0.5349, test_loss: 1.0208, test_f1: 0.6521
 epoch: 59, train_loss: 0.5360, test_loss: 1.0258, test_f1: 0.6721
 epoch: 60, train_loss: 0.5334, test_loss: 1.0972, test_f1: 0.6655
 epoch: 61, train_loss: 0.5185, test_loss: 1.0230, test_f1: 0.6677
 epoch: 62, train_loss: 0.5182, test_loss: 1.0761, test_f1: 0.6656
 epoch: 63, train_loss: 0.5306, test_loss: 1.0152, test_f1: 0.6577
 epoch: 64, train_loss: 0.5058, test_loss: 1.0306, test_f1: 0.6228
 epoch: 65, train_loss: 0.5092, test_loss: 1.0472, test_f1: 0.6600
 epoch: 66, train_loss: 0.5167, test_loss: 1.0094, test_f1: 0.6624
 epoch: 67, train_loss: 0.5076, test_loss: 1.0065, test_f1: 0.6808
 epoch: 68, train_loss: 0.4819, test_loss: 1.0261, test_f1: 0.6471
 epoch: 69, train_loss: 0.4751, test_loss: 0.9982, test_f1: 0.6475
 epoch: 70, train_loss: 0.4763, test_loss: 1.0927, test_f1: 0.6563
 epoch: 71, train_loss: 0.4966, test_loss: 1.0270, test_f1: 0.6563
 epoch: 72, train_loss: 0.4758, test_loss: 1.0052, test_f1: 0.6682
 epoch: 73, train_loss: 0.4873, test_loss: 1.0597, test_f1: 0.6579
 epoch: 74, train_loss: 0.4786, test_loss: 0.9543, test_f1: 0.6627
 epoch: 75, train_loss: 0.4511, test_loss: 1.0907, test_f1: 0.6624
 epoch: 76, train_loss: 0.4583, test_loss: 1.1272, test_f1: 0.6498
 epoch: 77, train_loss: 0.4530, test_loss: 0.9936, test_f1: 0.6689
 epoch: 78, train_loss: 0.4500, test_loss: 1.0124, test_f1: 0.6724
 epoch: 79, train_loss: 0.4422, test_loss: 1.0651, test_f1: 0.6774
 epoch: 80, train_loss: 0.4305, test_loss: 1.0242, test_f1: 0.6726
 epoch: 81, train_loss: 0.4453, test_loss: 1.0954, test_f1: 0.6659
 epoch: 82, train_loss: 0.4292, test_loss: 1.0555, test_f1: 0.6674
 epoch: 83, train_loss: 0.4287, test_loss: 1.0761, test_f1: 0.6548
 epoch: 84, train_loss: 0.4562, test_loss: 1.1213, test_f1: 0.6715
 epoch: 85, train_loss: 0.4343, test_loss: 0.9659, test_f1: 0.6925
 epoch: 86, train_loss: 0.4261, test_loss: 1.1052, test_f1: 0.6861
 epoch: 87, train_loss: 0.4145, test_loss: 1.0987, test_f1: 0.6757
 epoch: 88, train_loss: 0.4333, test_loss: 1.1130, test_f1: 0.6712
 epoch: 89, train_loss: 0.4167, test_loss: 1.1345, test_f1: 0.6570
 epoch: 90, train_loss: 0.3927, test_loss: 1.1625, test_f1: 0.6760
 epoch: 91, train_loss: 0.4038, test_loss: 1.1131, test_f1: 0.6735
 epoch: 92, train_loss: 0.4204, test_loss: 1.2018, test_f1: 0.6592
 epoch: 93, train_loss: 0.3814, test_loss: 1.1894, test_f1: 0.6645
 epoch: 94, train_loss: 0.4156, test_loss: 1.0928, test_f1: 0.6786
 epoch: 95, train_loss: 0.3987, test_loss: 1.1418, test_f1: 0.6922
 epoch: 96, train_loss: 0.3990, test_loss: 1.1233, test_f1: 0.6566
 epoch: 97, train_loss: 0.3738, test_loss: 1.1328, test_f1: 0.6828
 epoch: 98, train_loss: 0.3919, test_loss: 1.1933, test_f1: 0.6844
 epoch: 99, train_loss: 0.3905, test_loss: 1.2420, test_f1: 0.6825

Training completed in 743.78 seconds
Best F1: 0.6968 at epoch 85
Mean F1 across iterations: 0.6827  0.0108
========================FINAL RESULTS================================
FEGIN weighted F1: 0.6968  0.0108
python main.py --data ltspice_examples --representation component_net --model FEGIN --layers 5 --hiddens 64 --batch_size 64 --lr 0.001 --emb_size 512 --epochs 100 --save_appendix component_net_L5_H64_BS64_LR0.001_E512 --no_val
-----



STDERR:
  File "main.py", line 370, in <module>
    main()
  File "main.py", line 254, in main
    dataset = dataset_class(
  File "/home/philip/projects/ltspice_examples_code_repo/Circuit-Completion-Using-GNNs/component_classification_with_link_prediction_head/evaluation/FEGIN/kernel/circuit_datasets.py", line 15, in __init__
    self.data, self.slices = torch.load(self.processed_paths[0])
  File "/home/philip/.local/lib/python3.8/site-packages/torch/serialization.py", line 1040, in load
    warnings.warn(
  File "/usr/lib/python3.8/warnings.py", line 109, in _showwarnmsg
    sw(msg.message, msg.category, msg.filename, msg.lineno,
  File "main.py", line 47, in warn_with_traceback
    traceback.print_stack(file=log)
/home/philip/projects/ltspice_examples_code_repo/Circuit-Completion-Using-GNNs/component_classification_with_link_prediction_head/evaluation/FEGIN/kernel/circuit_datasets.py:15: FutureWarning: You are using `torch.load` with `weights_only=False` (the current default value), which uses the default pickle module implicitly. It is possible to construct malicious pickle data which will execute arbitrary code during unpickling (See https://github.com/pytorch/pytorch/blob/main/SECURITY.md#untrusted-models for more details). In a future release, the default value for `weights_only` will be flipped to `True`. This limits the functions that could be executed during unpickling. Arbitrary objects will no longer be allowed to be loaded via this mode unless they are explicitly allowlisted by the user via `torch.serialization.add_safe_globals`. We recommend you start setting `weights_only=True` for any use case where you don't have full control of the loaded file. Please open an issue on GitHub for any issues related to this experimental feature.
  self.data, self.slices = torch.load(self.processed_paths[0])
