STDOUT:
Results will be saved in /home/philip/projects/ltspice_examples_code_repo/Circuit-Completion-Using-GNNs/component_classification_with_link_prediction_head/evaluation/FEGIN/results/model_FEGIN_dataset_ltspice_demos
Command line input: python main.py --data ltspice_demos --representation component_net --model FEGIN --layers 4 --hiddens 64 --batch_size 256 --lr 0.0001 --emb_size 250 --epochs 100 --save_appendix component_net_L4_H64_BS256_LR0.0001_E250 --no_val
 is saved.
-----
ltspice_demos - FEGIN
Using 4 layers, 64 hidden units, h = 2
Loading component_net representation dataset
ENTERED
Training FEGIN on component_net representation
Train: 1565, Test: 383
##################ITERATION #0 ****************************************
 epoch: 0, train_loss: 1.3652, test_loss: 1.3699, test_f1: 0.2281
 epoch: 1, train_loss: 1.3586, test_loss: 1.3693, test_f1: 0.2281
 epoch: 2, train_loss: 1.3560, test_loss: 1.3682, test_f1: 0.2281
 epoch: 3, train_loss: 1.3533, test_loss: 1.3669, test_f1: 0.2281
 epoch: 4, train_loss: 1.3484, test_loss: 1.3650, test_f1: 0.2281
 epoch: 5, train_loss: 1.3440, test_loss: 1.3633, test_f1: 0.2281
 epoch: 6, train_loss: 1.3401, test_loss: 1.3612, test_f1: 0.2281
 epoch: 7, train_loss: 1.3368, test_loss: 1.3592, test_f1: 0.2281
 epoch: 8, train_loss: 1.3316, test_loss: 1.3566, test_f1: 0.2281
 epoch: 9, train_loss: 1.3261, test_loss: 1.3536, test_f1: 0.2281
 epoch: 10, train_loss: 1.3214, test_loss: 1.3500, test_f1: 0.2281
 epoch: 11, train_loss: 1.3148, test_loss: 1.3461, test_f1: 0.2274
 epoch: 12, train_loss: 1.3091, test_loss: 1.3424, test_f1: 0.2597
 epoch: 13, train_loss: 1.3018, test_loss: 1.3385, test_f1: 0.2583
 epoch: 14, train_loss: 1.2957, test_loss: 1.3339, test_f1: 0.2583
 epoch: 15, train_loss: 1.2899, test_loss: 1.3299, test_f1: 0.2585
 epoch: 16, train_loss: 1.2818, test_loss: 1.3256, test_f1: 0.2585
 epoch: 17, train_loss: 1.2771, test_loss: 1.3210, test_f1: 0.2587
 epoch: 18, train_loss: 1.2683, test_loss: 1.3161, test_f1: 0.2587
 epoch: 19, train_loss: 1.2595, test_loss: 1.3114, test_f1: 0.2765
 epoch: 20, train_loss: 1.2554, test_loss: 1.3065, test_f1: 0.2765
 epoch: 21, train_loss: 1.2464, test_loss: 1.3022, test_f1: 0.2721
 epoch: 22, train_loss: 1.2424, test_loss: 1.2964, test_f1: 0.2721
 epoch: 23, train_loss: 1.2324, test_loss: 1.2889, test_f1: 0.2721
 epoch: 24, train_loss: 1.2281, test_loss: 1.2835, test_f1: 0.2721
 epoch: 25, train_loss: 1.2181, test_loss: 1.2780, test_f1: 0.2721
 epoch: 26, train_loss: 1.2120, test_loss: 1.2709, test_f1: 0.2888
 epoch: 27, train_loss: 1.2048, test_loss: 1.2651, test_f1: 0.2991
 epoch: 28, train_loss: 1.1997, test_loss: 1.2596, test_f1: 0.3164
 epoch: 29, train_loss: 1.1932, test_loss: 1.2532, test_f1: 0.3164
 epoch: 30, train_loss: 1.1865, test_loss: 1.2470, test_f1: 0.3164
 epoch: 31, train_loss: 1.1854, test_loss: 1.2416, test_f1: 0.3163
 epoch: 32, train_loss: 1.1766, test_loss: 1.2374, test_f1: 0.3164
 epoch: 33, train_loss: 1.1729, test_loss: 1.2329, test_f1: 0.3201
 epoch: 34, train_loss: 1.1648, test_loss: 1.2287, test_f1: 0.3237
 epoch: 35, train_loss: 1.1590, test_loss: 1.2236, test_f1: 0.3237
 epoch: 36, train_loss: 1.1513, test_loss: 1.2192, test_f1: 0.3237
 epoch: 37, train_loss: 1.1517, test_loss: 1.2148, test_f1: 0.3237
 epoch: 38, train_loss: 1.1466, test_loss: 1.2106, test_f1: 0.3237
 epoch: 39, train_loss: 1.1413, test_loss: 1.2076, test_f1: 0.3237
 epoch: 40, train_loss: 1.1392, test_loss: 1.2059, test_f1: 0.3237
 epoch: 41, train_loss: 1.1405, test_loss: 1.2042, test_f1: 0.3237
 epoch: 42, train_loss: 1.1324, test_loss: 1.1990, test_f1: 0.3237
 epoch: 43, train_loss: 1.1311, test_loss: 1.1933, test_f1: 0.3237
 epoch: 44, train_loss: 1.1277, test_loss: 1.1887, test_f1: 0.3390
 epoch: 45, train_loss: 1.1223, test_loss: 1.1874, test_f1: 0.3390
 epoch: 46, train_loss: 1.1159, test_loss: 1.1849, test_f1: 0.3390
 epoch: 47, train_loss: 1.1157, test_loss: 1.1812, test_f1: 0.3255
 epoch: 48, train_loss: 1.1154, test_loss: 1.1788, test_f1: 0.3237
 epoch: 49, train_loss: 1.1150, test_loss: 1.1758, test_f1: 0.3390
 epoch: 50, train_loss: 1.1063, test_loss: 1.1729, test_f1: 0.3483
 epoch: 51, train_loss: 1.1038, test_loss: 1.1717, test_f1: 0.3558
 epoch: 52, train_loss: 1.1019, test_loss: 1.1689, test_f1: 0.3515
 epoch: 53, train_loss: 1.1041, test_loss: 1.1680, test_f1: 0.3515
 epoch: 54, train_loss: 1.0987, test_loss: 1.1681, test_f1: 0.3578
 epoch: 55, train_loss: 1.0971, test_loss: 1.1676, test_f1: 0.3578
 epoch: 56, train_loss: 1.0954, test_loss: 1.1659, test_f1: 0.3578
 epoch: 57, train_loss: 1.0964, test_loss: 1.1640, test_f1: 0.3515
 epoch: 58, train_loss: 1.0985, test_loss: 1.1620, test_f1: 0.3515
 epoch: 59, train_loss: 1.0933, test_loss: 1.1585, test_f1: 0.3483
 epoch: 60, train_loss: 1.0924, test_loss: 1.1584, test_f1: 0.3547
 epoch: 61, train_loss: 1.0943, test_loss: 1.1570, test_f1: 0.3547
 epoch: 62, train_loss: 1.0899, test_loss: 1.1561, test_f1: 0.3547
 epoch: 63, train_loss: 1.0895, test_loss: 1.1546, test_f1: 0.3547
 epoch: 64, train_loss: 1.0924, test_loss: 1.1553, test_f1: 0.3578
 epoch: 65, train_loss: 1.0888, test_loss: 1.1525, test_f1: 0.3515
 epoch: 66, train_loss: 1.0851, test_loss: 1.1521, test_f1: 0.3534
 epoch: 67, train_loss: 1.0831, test_loss: 1.1513, test_f1: 0.3534
 epoch: 68, train_loss: 1.0894, test_loss: 1.1492, test_f1: 0.3534
 epoch: 69, train_loss: 1.0879, test_loss: 1.1499, test_f1: 0.3502
 epoch: 70, train_loss: 1.0805, test_loss: 1.1490, test_f1: 0.3566
 epoch: 71, train_loss: 1.0801, test_loss: 1.1469, test_f1: 0.3597
 epoch: 72, train_loss: 1.0812, test_loss: 1.1463, test_f1: 0.3609
 epoch: 73, train_loss: 1.0760, test_loss: 1.1456, test_f1: 0.3597
 epoch: 74, train_loss: 1.0804, test_loss: 1.1454, test_f1: 0.3534
 epoch: 75, train_loss: 1.0807, test_loss: 1.1451, test_f1: 0.3534
 epoch: 76, train_loss: 1.0804, test_loss: 1.1442, test_f1: 0.3597
 epoch: 77, train_loss: 1.0739, test_loss: 1.1415, test_f1: 0.3566
 epoch: 78, train_loss: 1.0769, test_loss: 1.1376, test_f1: 0.3547
 epoch: 79, train_loss: 1.0732, test_loss: 1.1364, test_f1: 0.3609
 epoch: 80, train_loss: 1.0720, test_loss: 1.1371, test_f1: 0.3589
 epoch: 81, train_loss: 1.0674, test_loss: 1.1364, test_f1: 0.3589
 epoch: 82, train_loss: 1.0672, test_loss: 1.1351, test_f1: 0.3589
 epoch: 83, train_loss: 1.0673, test_loss: 1.1360, test_f1: 0.3679
 epoch: 84, train_loss: 1.0701, test_loss: 1.1361, test_f1: 0.3705
 epoch: 85, train_loss: 1.0679, test_loss: 1.1323, test_f1: 0.3699
 epoch: 86, train_loss: 1.0647, test_loss: 1.1296, test_f1: 0.3741
 epoch: 87, train_loss: 1.0670, test_loss: 1.1291, test_f1: 0.3721
 epoch: 88, train_loss: 1.0627, test_loss: 1.1291, test_f1: 0.3718
 epoch: 89, train_loss: 1.0657, test_loss: 1.1277, test_f1: 0.3818
 epoch: 90, train_loss: 1.0610, test_loss: 1.1268, test_f1: 0.3838
 epoch: 91, train_loss: 1.0591, test_loss: 1.1259, test_f1: 0.3847
 epoch: 92, train_loss: 1.0593, test_loss: 1.1244, test_f1: 0.3815
 epoch: 93, train_loss: 1.0563, test_loss: 1.1251, test_f1: 0.3849
 epoch: 94, train_loss: 1.0557, test_loss: 1.1296, test_f1: 0.3902
 epoch: 95, train_loss: 1.0535, test_loss: 1.1258, test_f1: 0.3962
 epoch: 96, train_loss: 1.0524, test_loss: 1.1227, test_f1: 0.4005
 epoch: 97, train_loss: 1.0531, test_loss: 1.1264, test_f1: 0.4061
 epoch: 98, train_loss: 1.0486, test_loss: 1.1239, test_f1: 0.4175
 epoch: 99, train_loss: 1.0482, test_loss: 1.1206, test_f1: 0.4021
##################ITERATION #1 ****************************************
 epoch: 0, train_loss: 1.3256, test_loss: 1.3529, test_f1: 0.2281
 epoch: 1, train_loss: 1.3127, test_loss: 1.3493, test_f1: 0.2281
 epoch: 2, train_loss: 1.3051, test_loss: 1.3440, test_f1: 0.2281
 epoch: 3, train_loss: 1.2981, test_loss: 1.3377, test_f1: 0.2281
 epoch: 4, train_loss: 1.2899, test_loss: 1.3329, test_f1: 0.2281
 epoch: 5, train_loss: 1.2829, test_loss: 1.3302, test_f1: 0.2281
 epoch: 6, train_loss: 1.2739, test_loss: 1.3277, test_f1: 0.2281
 epoch: 7, train_loss: 1.2664, test_loss: 1.3237, test_f1: 0.2281
 epoch: 8, train_loss: 1.2583, test_loss: 1.3162, test_f1: 0.2281
 epoch: 9, train_loss: 1.2503, test_loss: 1.3083, test_f1: 0.2281
 epoch: 10, train_loss: 1.2388, test_loss: 1.2981, test_f1: 0.2281
 epoch: 11, train_loss: 1.2305, test_loss: 1.2873, test_f1: 0.2281
 epoch: 12, train_loss: 1.2239, test_loss: 1.2776, test_f1: 0.2281
 epoch: 13, train_loss: 1.2159, test_loss: 1.2681, test_f1: 0.2281
 epoch: 14, train_loss: 1.2066, test_loss: 1.2585, test_f1: 0.2281
 epoch: 15, train_loss: 1.2011, test_loss: 1.2509, test_f1: 0.2248
 epoch: 16, train_loss: 1.1914, test_loss: 1.2440, test_f1: 0.2248
 epoch: 17, train_loss: 1.1868, test_loss: 1.2391, test_f1: 0.2238
 epoch: 18, train_loss: 1.1798, test_loss: 1.2336, test_f1: 0.2450
 epoch: 19, train_loss: 1.1722, test_loss: 1.2291, test_f1: 0.2450
 epoch: 20, train_loss: 1.1685, test_loss: 1.2238, test_f1: 0.2437
 epoch: 21, train_loss: 1.1649, test_loss: 1.2185, test_f1: 0.2644
 epoch: 22, train_loss: 1.1587, test_loss: 1.2138, test_f1: 0.2689
 epoch: 23, train_loss: 1.1511, test_loss: 1.2090, test_f1: 0.2475
 epoch: 24, train_loss: 1.1468, test_loss: 1.2050, test_f1: 0.2777
 epoch: 25, train_loss: 1.1407, test_loss: 1.2027, test_f1: 0.2690
 epoch: 26, train_loss: 1.1396, test_loss: 1.1997, test_f1: 0.2777
 epoch: 27, train_loss: 1.1379, test_loss: 1.1966, test_f1: 0.2777
 epoch: 28, train_loss: 1.1338, test_loss: 1.1936, test_f1: 0.2777
 epoch: 29, train_loss: 1.1299, test_loss: 1.1916, test_f1: 0.2734
 epoch: 30, train_loss: 1.1240, test_loss: 1.1893, test_f1: 0.2734
 epoch: 31, train_loss: 1.1224, test_loss: 1.1881, test_f1: 0.2777
 epoch: 32, train_loss: 1.1181, test_loss: 1.1881, test_f1: 0.2862
 epoch: 33, train_loss: 1.1153, test_loss: 1.1846, test_f1: 0.3009
 epoch: 34, train_loss: 1.1166, test_loss: 1.1813, test_f1: 0.3009
 epoch: 35, train_loss: 1.1051, test_loss: 1.1776, test_f1: 0.2992
 epoch: 36, train_loss: 1.1078, test_loss: 1.1766, test_f1: 0.2992
 epoch: 37, train_loss: 1.1030, test_loss: 1.1754, test_f1: 0.3015
 epoch: 38, train_loss: 1.1013, test_loss: 1.1745, test_f1: 0.2981
 epoch: 39, train_loss: 1.0962, test_loss: 1.1737, test_f1: 0.2981
 epoch: 40, train_loss: 1.0938, test_loss: 1.1723, test_f1: 0.2981
 epoch: 41, train_loss: 1.0921, test_loss: 1.1727, test_f1: 0.3015
 epoch: 42, train_loss: 1.0898, test_loss: 1.1730, test_f1: 0.2992
 epoch: 43, train_loss: 1.0918, test_loss: 1.1687, test_f1: 0.3031
 epoch: 44, train_loss: 1.0821, test_loss: 1.1668, test_f1: 0.3348
 epoch: 45, train_loss: 1.0787, test_loss: 1.1617, test_f1: 0.3348
 epoch: 46, train_loss: 1.0801, test_loss: 1.1585, test_f1: 0.3311
 epoch: 47, train_loss: 1.0789, test_loss: 1.1562, test_f1: 0.3346
 epoch: 48, train_loss: 1.0797, test_loss: 1.1640, test_f1: 0.3452
 epoch: 49, train_loss: 1.0769, test_loss: 1.1638, test_f1: 0.3553
 epoch: 50, train_loss: 1.0718, test_loss: 1.1662, test_f1: 0.3601
 epoch: 51, train_loss: 1.0724, test_loss: 1.1599, test_f1: 0.3646
 epoch: 52, train_loss: 1.0740, test_loss: 1.1578, test_f1: 0.3688
 epoch: 53, train_loss: 1.0728, test_loss: 1.1529, test_f1: 0.3690
 epoch: 54, train_loss: 1.0681, test_loss: 1.1520, test_f1: 0.3690
 epoch: 55, train_loss: 1.0626, test_loss: 1.1532, test_f1: 0.3690
 epoch: 56, train_loss: 1.0590, test_loss: 1.1526, test_f1: 0.3690
 epoch: 57, train_loss: 1.0625, test_loss: 1.1512, test_f1: 0.3773
 epoch: 58, train_loss: 1.0619, test_loss: 1.1497, test_f1: 0.3816
 epoch: 59, train_loss: 1.0610, test_loss: 1.1491, test_f1: 0.3856
 epoch: 60, train_loss: 1.0545, test_loss: 1.1469, test_f1: 0.3856
 epoch: 61, train_loss: 1.0524, test_loss: 1.1459, test_f1: 0.3830
 epoch: 62, train_loss: 1.0523, test_loss: 1.1479, test_f1: 0.3827
 epoch: 63, train_loss: 1.0530, test_loss: 1.1494, test_f1: 0.3900
 epoch: 64, train_loss: 1.0559, test_loss: 1.1419, test_f1: 0.3930
 epoch: 65, train_loss: 1.0525, test_loss: 1.1447, test_f1: 0.3998
 epoch: 66, train_loss: 1.0514, test_loss: 1.1498, test_f1: 0.3929
 epoch: 67, train_loss: 1.0479, test_loss: 1.1543, test_f1: 0.3929
 epoch: 68, train_loss: 1.0513, test_loss: 1.1484, test_f1: 0.3962
 epoch: 69, train_loss: 1.0491, test_loss: 1.1451, test_f1: 0.4022
 epoch: 70, train_loss: 1.0507, test_loss: 1.1470, test_f1: 0.4025
 epoch: 71, train_loss: 1.0441, test_loss: 1.1480, test_f1: 0.4022
 epoch: 72, train_loss: 1.0463, test_loss: 1.1421, test_f1: 0.4153
 epoch: 73, train_loss: 1.0487, test_loss: 1.1409, test_f1: 0.4151
 epoch: 74, train_loss: 1.0435, test_loss: 1.1442, test_f1: 0.4084
 epoch: 75, train_loss: 1.0443, test_loss: 1.1506, test_f1: 0.4037
 epoch: 76, train_loss: 1.0362, test_loss: 1.1488, test_f1: 0.4018
 epoch: 77, train_loss: 1.0371, test_loss: 1.1473, test_f1: 0.4049
 epoch: 78, train_loss: 1.0389, test_loss: 1.1442, test_f1: 0.4153
 epoch: 79, train_loss: 1.0365, test_loss: 1.1486, test_f1: 0.4197
 epoch: 80, train_loss: 1.0386, test_loss: 1.1381, test_f1: 0.4222
 epoch: 81, train_loss: 1.0326, test_loss: 1.1413, test_f1: 0.4169
 epoch: 82, train_loss: 1.0322, test_loss: 1.1476, test_f1: 0.4159
 epoch: 83, train_loss: 1.0285, test_loss: 1.1508, test_f1: 0.4254
 epoch: 84, train_loss: 1.0331, test_loss: 1.1506, test_f1: 0.4185
 epoch: 85, train_loss: 1.0341, test_loss: 1.1452, test_f1: 0.4203
 epoch: 86, train_loss: 1.0272, test_loss: 1.1414, test_f1: 0.4181
 epoch: 87, train_loss: 1.0234, test_loss: 1.1404, test_f1: 0.4213
 epoch: 88, train_loss: 1.0251, test_loss: 1.1380, test_f1: 0.4317
 epoch: 89, train_loss: 1.0294, test_loss: 1.1306, test_f1: 0.4268
 epoch: 90, train_loss: 1.0248, test_loss: 1.1274, test_f1: 0.4261
 epoch: 91, train_loss: 1.0256, test_loss: 1.1262, test_f1: 0.4227
 epoch: 92, train_loss: 1.0174, test_loss: 1.1332, test_f1: 0.4234
 epoch: 93, train_loss: 1.0194, test_loss: 1.1379, test_f1: 0.4234
 epoch: 94, train_loss: 1.0120, test_loss: 1.1391, test_f1: 0.4234
 epoch: 95, train_loss: 1.0172, test_loss: 1.1306, test_f1: 0.4237
 epoch: 96, train_loss: 1.0131, test_loss: 1.1396, test_f1: 0.4298
 epoch: 97, train_loss: 1.0114, test_loss: 1.1413, test_f1: 0.4298
 epoch: 98, train_loss: 1.0132, test_loss: 1.1286, test_f1: 0.4295
 epoch: 99, train_loss: 1.0128, test_loss: 1.1231, test_f1: 0.4324
##################ITERATION #2 ****************************************
 epoch: 0, train_loss: 1.3041, test_loss: 1.3522, test_f1: 0.2281
 epoch: 1, train_loss: 1.2850, test_loss: 1.3520, test_f1: 0.2281
 epoch: 2, train_loss: 1.2762, test_loss: 1.3503, test_f1: 0.2281
 epoch: 3, train_loss: 1.2636, test_loss: 1.3466, test_f1: 0.2281
 epoch: 4, train_loss: 1.2548, test_loss: 1.3401, test_f1: 0.2281
 epoch: 5, train_loss: 1.2421, test_loss: 1.3298, test_f1: 0.2281
 epoch: 6, train_loss: 1.2346, test_loss: 1.3189, test_f1: 0.2281
 epoch: 7, train_loss: 1.2197, test_loss: 1.3087, test_f1: 0.2281
 epoch: 8, train_loss: 1.2154, test_loss: 1.2972, test_f1: 0.2281
 epoch: 9, train_loss: 1.2103, test_loss: 1.2836, test_f1: 0.2281
 epoch: 10, train_loss: 1.2005, test_loss: 1.2727, test_f1: 0.2281
 epoch: 11, train_loss: 1.1942, test_loss: 1.2622, test_f1: 0.2281
 epoch: 12, train_loss: 1.1846, test_loss: 1.2514, test_f1: 0.2281
 epoch: 13, train_loss: 1.1791, test_loss: 1.2407, test_f1: 0.2281
 epoch: 14, train_loss: 1.1744, test_loss: 1.2317, test_f1: 0.2281
 epoch: 15, train_loss: 1.1679, test_loss: 1.2257, test_f1: 0.2281
 epoch: 16, train_loss: 1.1630, test_loss: 1.2183, test_f1: 0.2281
 epoch: 17, train_loss: 1.1552, test_loss: 1.2144, test_f1: 0.2281
 epoch: 18, train_loss: 1.1552, test_loss: 1.2067, test_f1: 0.2281
 epoch: 19, train_loss: 1.1516, test_loss: 1.2019, test_f1: 0.2281
 epoch: 20, train_loss: 1.1481, test_loss: 1.1962, test_f1: 0.2281
 epoch: 21, train_loss: 1.1385, test_loss: 1.1928, test_f1: 0.2281
 epoch: 22, train_loss: 1.1374, test_loss: 1.1903, test_f1: 0.2281
 epoch: 23, train_loss: 1.1321, test_loss: 1.1870, test_f1: 0.2270
 epoch: 24, train_loss: 1.1262, test_loss: 1.1834, test_f1: 0.2539
 epoch: 25, train_loss: 1.1240, test_loss: 1.1796, test_f1: 0.2539
 epoch: 26, train_loss: 1.1200, test_loss: 1.1766, test_f1: 0.2698
 epoch: 27, train_loss: 1.1124, test_loss: 1.1751, test_f1: 0.2869
 epoch: 28, train_loss: 1.1170, test_loss: 1.1726, test_f1: 0.2958
 epoch: 29, train_loss: 1.1093, test_loss: 1.1679, test_f1: 0.3002
 epoch: 30, train_loss: 1.1067, test_loss: 1.1660, test_f1: 0.3057
 epoch: 31, train_loss: 1.1041, test_loss: 1.1630, test_f1: 0.3057
 epoch: 32, train_loss: 1.0999, test_loss: 1.1611, test_f1: 0.3100
 epoch: 33, train_loss: 1.1010, test_loss: 1.1587, test_f1: 0.3109
 epoch: 34, train_loss: 1.0971, test_loss: 1.1557, test_f1: 0.3109
 epoch: 35, train_loss: 1.0946, test_loss: 1.1558, test_f1: 0.3163
 epoch: 36, train_loss: 1.0905, test_loss: 1.1468, test_f1: 0.3215
 epoch: 37, train_loss: 1.0898, test_loss: 1.1407, test_f1: 0.3248
 epoch: 38, train_loss: 1.0836, test_loss: 1.1378, test_f1: 0.3338
 epoch: 39, train_loss: 1.0785, test_loss: 1.1375, test_f1: 0.3516
 epoch: 40, train_loss: 1.0767, test_loss: 1.1377, test_f1: 0.3600
 epoch: 41, train_loss: 1.0779, test_loss: 1.1387, test_f1: 0.3597
 epoch: 42, train_loss: 1.0752, test_loss: 1.1397, test_f1: 0.3689
 epoch: 43, train_loss: 1.0704, test_loss: 1.1378, test_f1: 0.3786
 epoch: 44, train_loss: 1.0713, test_loss: 1.1380, test_f1: 0.3802
 epoch: 45, train_loss: 1.0645, test_loss: 1.1380, test_f1: 0.3865
 epoch: 46, train_loss: 1.0582, test_loss: 1.1367, test_f1: 0.3860
 epoch: 47, train_loss: 1.0575, test_loss: 1.1364, test_f1: 0.3824
 epoch: 48, train_loss: 1.0591, test_loss: 1.1368, test_f1: 0.3789
 epoch: 49, train_loss: 1.0569, test_loss: 1.1299, test_f1: 0.3816
 epoch: 50, train_loss: 1.0577, test_loss: 1.1318, test_f1: 0.3868
 epoch: 51, train_loss: 1.0505, test_loss: 1.1230, test_f1: 0.3902
 epoch: 52, train_loss: 1.0460, test_loss: 1.1229, test_f1: 0.3888
 epoch: 53, train_loss: 1.0459, test_loss: 1.1246, test_f1: 0.3942
 epoch: 54, train_loss: 1.0352, test_loss: 1.1182, test_f1: 0.3922
 epoch: 55, train_loss: 1.0456, test_loss: 1.1148, test_f1: 0.3925
 epoch: 56, train_loss: 1.0400, test_loss: 1.1182, test_f1: 0.3920
 epoch: 57, train_loss: 1.0376, test_loss: 1.1148, test_f1: 0.3940
 epoch: 58, train_loss: 1.0421, test_loss: 1.1145, test_f1: 0.3940
 epoch: 59, train_loss: 1.0346, test_loss: 1.1136, test_f1: 0.4053
 epoch: 60, train_loss: 1.0401, test_loss: 1.1142, test_f1: 0.4095
 epoch: 61, train_loss: 1.0323, test_loss: 1.1128, test_f1: 0.4112
 epoch: 62, train_loss: 1.0301, test_loss: 1.1094, test_f1: 0.4203
 epoch: 63, train_loss: 1.0298, test_loss: 1.1039, test_f1: 0.4147
 epoch: 64, train_loss: 1.0319, test_loss: 1.1047, test_f1: 0.4235
 epoch: 65, train_loss: 1.0216, test_loss: 1.1116, test_f1: 0.4184
 epoch: 66, train_loss: 1.0286, test_loss: 1.1134, test_f1: 0.4187
 epoch: 67, train_loss: 1.0204, test_loss: 1.1024, test_f1: 0.4056
 epoch: 68, train_loss: 1.0250, test_loss: 1.0962, test_f1: 0.4007
 epoch: 69, train_loss: 1.0220, test_loss: 1.1003, test_f1: 0.4207
 epoch: 70, train_loss: 1.0218, test_loss: 1.1008, test_f1: 0.4320
 epoch: 71, train_loss: 1.0163, test_loss: 1.1047, test_f1: 0.4320
 epoch: 72, train_loss: 1.0273, test_loss: 1.1078, test_f1: 0.4274
 epoch: 73, train_loss: 1.0125, test_loss: 1.1036, test_f1: 0.4252
 epoch: 74, train_loss: 1.0134, test_loss: 1.1008, test_f1: 0.4185
 epoch: 75, train_loss: 1.0175, test_loss: 1.1030, test_f1: 0.4180
 epoch: 76, train_loss: 1.0108, test_loss: 1.0981, test_f1: 0.4180
 epoch: 77, train_loss: 1.0097, test_loss: 1.1015, test_f1: 0.4191
 epoch: 78, train_loss: 1.0137, test_loss: 1.0930, test_f1: 0.4171
 epoch: 79, train_loss: 1.0053, test_loss: 1.0902, test_f1: 0.4320
 epoch: 80, train_loss: 1.0067, test_loss: 1.0866, test_f1: 0.4268
 epoch: 81, train_loss: 1.0056, test_loss: 1.0937, test_f1: 0.4238
 epoch: 82, train_loss: 1.0035, test_loss: 1.0956, test_f1: 0.4219
 epoch: 83, train_loss: 0.9975, test_loss: 1.1081, test_f1: 0.4108
 epoch: 84, train_loss: 0.9997, test_loss: 1.1000, test_f1: 0.4227
 epoch: 85, train_loss: 0.9925, test_loss: 1.0936, test_f1: 0.4228
 epoch: 86, train_loss: 0.9997, test_loss: 1.0866, test_f1: 0.4191
 epoch: 87, train_loss: 0.9935, test_loss: 1.0842, test_f1: 0.4293
 epoch: 88, train_loss: 0.9952, test_loss: 1.0784, test_f1: 0.4162
 epoch: 89, train_loss: 0.9919, test_loss: 1.0878, test_f1: 0.4142
 epoch: 90, train_loss: 0.9916, test_loss: 1.0929, test_f1: 0.4052
 epoch: 91, train_loss: 0.9830, test_loss: 1.1070, test_f1: 0.4198
 epoch: 92, train_loss: 0.9813, test_loss: 1.1033, test_f1: 0.4216
 epoch: 93, train_loss: 0.9865, test_loss: 1.0950, test_f1: 0.4218
 epoch: 94, train_loss: 0.9849, test_loss: 1.0944, test_f1: 0.4234
 epoch: 95, train_loss: 0.9786, test_loss: 1.0976, test_f1: 0.4270
 epoch: 96, train_loss: 0.9829, test_loss: 1.0910, test_f1: 0.4270
 epoch: 97, train_loss: 0.9781, test_loss: 1.0821, test_f1: 0.4288
 epoch: 98, train_loss: 0.9716, test_loss: 1.0790, test_f1: 0.4312
 epoch: 99, train_loss: 0.9698, test_loss: 1.0784, test_f1: 0.4310
##################ITERATION #3 ****************************************
 epoch: 0, train_loss: 1.2763, test_loss: 1.3462, test_f1: 0.2281
 epoch: 1, train_loss: 1.2528, test_loss: 1.3401, test_f1: 0.2281
 epoch: 2, train_loss: 1.2416, test_loss: 1.3328, test_f1: 0.2281
 epoch: 3, train_loss: 1.2319, test_loss: 1.3245, test_f1: 0.2281
 epoch: 4, train_loss: 1.2226, test_loss: 1.3163, test_f1: 0.2281
 epoch: 5, train_loss: 1.2104, test_loss: 1.3091, test_f1: 0.2281
 epoch: 6, train_loss: 1.2030, test_loss: 1.3006, test_f1: 0.2281
 epoch: 7, train_loss: 1.1960, test_loss: 1.2937, test_f1: 0.2281
 epoch: 8, train_loss: 1.1891, test_loss: 1.2836, test_f1: 0.2281
 epoch: 9, train_loss: 1.1795, test_loss: 1.2689, test_f1: 0.2281
 epoch: 10, train_loss: 1.1733, test_loss: 1.2575, test_f1: 0.2281
 epoch: 11, train_loss: 1.1664, test_loss: 1.2457, test_f1: 0.2281
 epoch: 12, train_loss: 1.1590, test_loss: 1.2363, test_f1: 0.2603
 epoch: 13, train_loss: 1.1548, test_loss: 1.2286, test_f1: 0.2623
 epoch: 14, train_loss: 1.1467, test_loss: 1.2216, test_f1: 0.2599
 epoch: 15, train_loss: 1.1449, test_loss: 1.2172, test_f1: 0.2601
 epoch: 16, train_loss: 1.1369, test_loss: 1.2134, test_f1: 0.2642
 epoch: 17, train_loss: 1.1351, test_loss: 1.2108, test_f1: 0.2642
 epoch: 18, train_loss: 1.1305, test_loss: 1.2060, test_f1: 0.2903
 epoch: 19, train_loss: 1.1245, test_loss: 1.2003, test_f1: 0.3204
 epoch: 20, train_loss: 1.1200, test_loss: 1.1967, test_f1: 0.3443
 epoch: 21, train_loss: 1.1168, test_loss: 1.1931, test_f1: 0.3820
 epoch: 22, train_loss: 1.1137, test_loss: 1.1921, test_f1: 0.3866
 epoch: 23, train_loss: 1.1122, test_loss: 1.1896, test_f1: 0.3956
 epoch: 24, train_loss: 1.1057, test_loss: 1.1833, test_f1: 0.3964
 epoch: 25, train_loss: 1.1054, test_loss: 1.1811, test_f1: 0.3910
 epoch: 26, train_loss: 1.0996, test_loss: 1.1790, test_f1: 0.3970
 epoch: 27, train_loss: 1.0951, test_loss: 1.1786, test_f1: 0.4003
 epoch: 28, train_loss: 1.0931, test_loss: 1.1786, test_f1: 0.4006
 epoch: 29, train_loss: 1.0845, test_loss: 1.1722, test_f1: 0.3946
 epoch: 30, train_loss: 1.0810, test_loss: 1.1706, test_f1: 0.4072
 epoch: 31, train_loss: 1.0841, test_loss: 1.1699, test_f1: 0.4155
 epoch: 32, train_loss: 1.0784, test_loss: 1.1631, test_f1: 0.4236
 epoch: 33, train_loss: 1.0747, test_loss: 1.1643, test_f1: 0.4307
 epoch: 34, train_loss: 1.0706, test_loss: 1.1551, test_f1: 0.4297
 epoch: 35, train_loss: 1.0681, test_loss: 1.1578, test_f1: 0.4251
 epoch: 36, train_loss: 1.0672, test_loss: 1.1573, test_f1: 0.4241
 epoch: 37, train_loss: 1.0628, test_loss: 1.1540, test_f1: 0.4195
 epoch: 38, train_loss: 1.0542, test_loss: 1.1485, test_f1: 0.4317
 epoch: 39, train_loss: 1.0566, test_loss: 1.1482, test_f1: 0.4385
 epoch: 40, train_loss: 1.0493, test_loss: 1.1514, test_f1: 0.4336
 epoch: 41, train_loss: 1.0505, test_loss: 1.1511, test_f1: 0.4336
 epoch: 42, train_loss: 1.0502, test_loss: 1.1487, test_f1: 0.4306
 epoch: 43, train_loss: 1.0397, test_loss: 1.1468, test_f1: 0.4230
 epoch: 44, train_loss: 1.0364, test_loss: 1.1431, test_f1: 0.4189
 epoch: 45, train_loss: 1.0416, test_loss: 1.1438, test_f1: 0.4213
 epoch: 46, train_loss: 1.0360, test_loss: 1.1444, test_f1: 0.4257
 epoch: 47, train_loss: 1.0289, test_loss: 1.1422, test_f1: 0.4275
 epoch: 48, train_loss: 1.0257, test_loss: 1.1428, test_f1: 0.4375
 epoch: 49, train_loss: 1.0241, test_loss: 1.1488, test_f1: 0.4456
 epoch: 50, train_loss: 1.0190, test_loss: 1.1437, test_f1: 0.4426
 epoch: 51, train_loss: 1.0214, test_loss: 1.1395, test_f1: 0.4429
 epoch: 52, train_loss: 1.0104, test_loss: 1.1395, test_f1: 0.4449
 epoch: 53, train_loss: 1.0128, test_loss: 1.1442, test_f1: 0.4459
 epoch: 54, train_loss: 1.0167, test_loss: 1.1323, test_f1: 0.4429
 epoch: 55, train_loss: 1.0036, test_loss: 1.1266, test_f1: 0.4330
 epoch: 56, train_loss: 1.0084, test_loss: 1.1266, test_f1: 0.4412
 epoch: 57, train_loss: 1.0047, test_loss: 1.1380, test_f1: 0.4428
 epoch: 58, train_loss: 1.0059, test_loss: 1.1323, test_f1: 0.4412
 epoch: 59, train_loss: 1.0039, test_loss: 1.1293, test_f1: 0.4342
 epoch: 60, train_loss: 1.0007, test_loss: 1.1284, test_f1: 0.4472
 epoch: 61, train_loss: 0.9941, test_loss: 1.1319, test_f1: 0.4480
 epoch: 62, train_loss: 0.9995, test_loss: 1.1393, test_f1: 0.4485
 epoch: 63, train_loss: 0.9998, test_loss: 1.1355, test_f1: 0.4487
 epoch: 64, train_loss: 0.9895, test_loss: 1.1400, test_f1: 0.4509
 epoch: 65, train_loss: 0.9971, test_loss: 1.1345, test_f1: 0.4507
 epoch: 66, train_loss: 0.9968, test_loss: 1.1354, test_f1: 0.4487
 epoch: 67, train_loss: 0.9911, test_loss: 1.1286, test_f1: 0.4487
 epoch: 68, train_loss: 0.9917, test_loss: 1.1324, test_f1: 0.4508
 epoch: 69, train_loss: 0.9942, test_loss: 1.1279, test_f1: 0.4508
 epoch: 70, train_loss: 0.9890, test_loss: 1.1247, test_f1: 0.4507
 epoch: 71, train_loss: 0.9909, test_loss: 1.1256, test_f1: 0.4485
 epoch: 72, train_loss: 0.9844, test_loss: 1.1255, test_f1: 0.4485
 epoch: 73, train_loss: 0.9772, test_loss: 1.1337, test_f1: 0.4534
 epoch: 74, train_loss: 0.9839, test_loss: 1.1318, test_f1: 0.4534
 epoch: 75, train_loss: 0.9921, test_loss: 1.1366, test_f1: 0.4505
 epoch: 76, train_loss: 0.9835, test_loss: 1.1422, test_f1: 0.4506
 epoch: 77, train_loss: 0.9830, test_loss: 1.1325, test_f1: 0.4505
 epoch: 78, train_loss: 0.9816, test_loss: 1.1311, test_f1: 0.4505
 epoch: 79, train_loss: 0.9784, test_loss: 1.1278, test_f1: 0.4507
 epoch: 80, train_loss: 0.9717, test_loss: 1.1317, test_f1: 0.4505
 epoch: 81, train_loss: 0.9672, test_loss: 1.1190, test_f1: 0.4508
 epoch: 82, train_loss: 0.9801, test_loss: 1.1287, test_f1: 0.4507
 epoch: 83, train_loss: 0.9686, test_loss: 1.1246, test_f1: 0.4506
 epoch: 84, train_loss: 0.9697, test_loss: 1.1173, test_f1: 0.4506
 epoch: 85, train_loss: 0.9678, test_loss: 1.1180, test_f1: 0.4486
 epoch: 86, train_loss: 0.9665, test_loss: 1.1164, test_f1: 0.4485
 epoch: 87, train_loss: 0.9595, test_loss: 1.1258, test_f1: 0.4507
 epoch: 88, train_loss: 0.9647, test_loss: 1.1297, test_f1: 0.4500
 epoch: 89, train_loss: 0.9638, test_loss: 1.1308, test_f1: 0.4500
 epoch: 90, train_loss: 0.9567, test_loss: 1.1257, test_f1: 0.4488
 epoch: 91, train_loss: 0.9586, test_loss: 1.1224, test_f1: 0.4531
 epoch: 92, train_loss: 0.9548, test_loss: 1.1177, test_f1: 0.4537
 epoch: 93, train_loss: 0.9593, test_loss: 1.1158, test_f1: 0.4489
 epoch: 94, train_loss: 0.9483, test_loss: 1.1164, test_f1: 0.4552
 epoch: 95, train_loss: 0.9559, test_loss: 1.1236, test_f1: 0.4540
 epoch: 96, train_loss: 0.9481, test_loss: 1.1206, test_f1: 0.4489
 epoch: 97, train_loss: 0.9441, test_loss: 1.1185, test_f1: 0.4490
 epoch: 98, train_loss: 0.9533, test_loss: 1.1164, test_f1: 0.4531
 epoch: 99, train_loss: 0.9494, test_loss: 1.1158, test_f1: 0.4531
##################ITERATION #4 ****************************************
 epoch: 0, train_loss: 1.2896, test_loss: 1.3603, test_f1: 0.2281
 epoch: 1, train_loss: 1.2525, test_loss: 1.3510, test_f1: 0.2281
 epoch: 2, train_loss: 1.2383, test_loss: 1.3355, test_f1: 0.2281
 epoch: 3, train_loss: 1.2234, test_loss: 1.3179, test_f1: 0.2281
 epoch: 4, train_loss: 1.2075, test_loss: 1.3023, test_f1: 0.2281
 epoch: 5, train_loss: 1.1961, test_loss: 1.2936, test_f1: 0.2281
 epoch: 6, train_loss: 1.1878, test_loss: 1.2879, test_f1: 0.2281
 epoch: 7, train_loss: 1.1811, test_loss: 1.2781, test_f1: 0.2336
 epoch: 8, train_loss: 1.1688, test_loss: 1.2691, test_f1: 0.2669
 epoch: 9, train_loss: 1.1648, test_loss: 1.2571, test_f1: 0.2743
 epoch: 10, train_loss: 1.1549, test_loss: 1.2397, test_f1: 0.2822
 epoch: 11, train_loss: 1.1498, test_loss: 1.2237, test_f1: 0.2826
 epoch: 12, train_loss: 1.1408, test_loss: 1.2148, test_f1: 0.2852
 epoch: 13, train_loss: 1.1374, test_loss: 1.2105, test_f1: 0.3122
 epoch: 14, train_loss: 1.1306, test_loss: 1.2091, test_f1: 0.3484
 epoch: 15, train_loss: 1.1272, test_loss: 1.2104, test_f1: 0.3466
 epoch: 16, train_loss: 1.1160, test_loss: 1.2180, test_f1: 0.3610
 epoch: 17, train_loss: 1.1120, test_loss: 1.2130, test_f1: 0.3874
 epoch: 18, train_loss: 1.1053, test_loss: 1.2282, test_f1: 0.3828
 epoch: 19, train_loss: 1.1017, test_loss: 1.2337, test_f1: 0.3886
 epoch: 20, train_loss: 1.0970, test_loss: 1.2271, test_f1: 0.3942
 epoch: 21, train_loss: 1.0987, test_loss: 1.2313, test_f1: 0.3849
 epoch: 22, train_loss: 1.0856, test_loss: 1.2264, test_f1: 0.3899
 epoch: 23, train_loss: 1.0844, test_loss: 1.2102, test_f1: 0.4021
 epoch: 24, train_loss: 1.0761, test_loss: 1.2064, test_f1: 0.4065
 epoch: 25, train_loss: 1.0763, test_loss: 1.1953, test_f1: 0.4113
 epoch: 26, train_loss: 1.0674, test_loss: 1.2007, test_f1: 0.4024
 epoch: 27, train_loss: 1.0674, test_loss: 1.2099, test_f1: 0.4155
 epoch: 28, train_loss: 1.0707, test_loss: 1.2089, test_f1: 0.4192
 epoch: 29, train_loss: 1.0605, test_loss: 1.2027, test_f1: 0.4180
 epoch: 30, train_loss: 1.0594, test_loss: 1.1980, test_f1: 0.4261
 epoch: 31, train_loss: 1.0556, test_loss: 1.1980, test_f1: 0.4213
 epoch: 32, train_loss: 1.0553, test_loss: 1.1910, test_f1: 0.4210
 epoch: 33, train_loss: 1.0508, test_loss: 1.1896, test_f1: 0.4227
 epoch: 34, train_loss: 1.0446, test_loss: 1.1989, test_f1: 0.4271
 epoch: 35, train_loss: 1.0396, test_loss: 1.1944, test_f1: 0.4364
 epoch: 36, train_loss: 1.0324, test_loss: 1.1939, test_f1: 0.4271
 epoch: 37, train_loss: 1.0333, test_loss: 1.1836, test_f1: 0.4320
 epoch: 38, train_loss: 1.0362, test_loss: 1.1568, test_f1: 0.4525
 epoch: 39, train_loss: 1.0287, test_loss: 1.1545, test_f1: 0.4386
 epoch: 40, train_loss: 1.0257, test_loss: 1.1590, test_f1: 0.4565
 epoch: 41, train_loss: 1.0236, test_loss: 1.1534, test_f1: 0.4577
 epoch: 42, train_loss: 1.0133, test_loss: 1.1420, test_f1: 0.4532
 epoch: 43, train_loss: 1.0136, test_loss: 1.1405, test_f1: 0.4443
 epoch: 44, train_loss: 1.0109, test_loss: 1.1280, test_f1: 0.4818
 epoch: 45, train_loss: 1.0041, test_loss: 1.1360, test_f1: 0.4790
 epoch: 46, train_loss: 1.0005, test_loss: 1.1428, test_f1: 0.4667
 epoch: 47, train_loss: 0.9973, test_loss: 1.1521, test_f1: 0.4727
 epoch: 48, train_loss: 0.9987, test_loss: 1.1568, test_f1: 0.4768
 epoch: 49, train_loss: 0.9905, test_loss: 1.1567, test_f1: 0.4718
 epoch: 50, train_loss: 0.9885, test_loss: 1.1635, test_f1: 0.4684
 epoch: 51, train_loss: 0.9845, test_loss: 1.1505, test_f1: 0.4751
 epoch: 52, train_loss: 0.9847, test_loss: 1.1372, test_f1: 0.4830
 epoch: 53, train_loss: 0.9766, test_loss: 1.1476, test_f1: 0.4887
 epoch: 54, train_loss: 0.9851, test_loss: 1.1501, test_f1: 0.4827
 epoch: 55, train_loss: 0.9775, test_loss: 1.1532, test_f1: 0.4913
 epoch: 56, train_loss: 0.9791, test_loss: 1.1533, test_f1: 0.4958
 epoch: 57, train_loss: 0.9807, test_loss: 1.1458, test_f1: 0.4838
 epoch: 58, train_loss: 0.9775, test_loss: 1.1452, test_f1: 0.4748
 epoch: 59, train_loss: 0.9762, test_loss: 1.1516, test_f1: 0.4802
 epoch: 60, train_loss: 0.9729, test_loss: 1.1371, test_f1: 0.4905
 epoch: 61, train_loss: 0.9709, test_loss: 1.1222, test_f1: 0.4927
 epoch: 62, train_loss: 0.9750, test_loss: 1.1381, test_f1: 0.4828
 epoch: 63, train_loss: 0.9662, test_loss: 1.1431, test_f1: 0.4976
 epoch: 64, train_loss: 0.9623, test_loss: 1.1530, test_f1: 0.5107
 epoch: 65, train_loss: 0.9611, test_loss: 1.1454, test_f1: 0.4945
 epoch: 66, train_loss: 0.9628, test_loss: 1.1552, test_f1: 0.5013
 epoch: 67, train_loss: 0.9562, test_loss: 1.1555, test_f1: 0.5126
 epoch: 68, train_loss: 0.9600, test_loss: 1.1497, test_f1: 0.4956
 epoch: 69, train_loss: 0.9667, test_loss: 1.1611, test_f1: 0.5093
 epoch: 70, train_loss: 0.9482, test_loss: 1.1346, test_f1: 0.5162
 epoch: 71, train_loss: 0.9488, test_loss: 1.1379, test_f1: 0.5162
 epoch: 72, train_loss: 0.9461, test_loss: 1.1421, test_f1: 0.5010
 epoch: 73, train_loss: 0.9479, test_loss: 1.1315, test_f1: 0.5078
 epoch: 74, train_loss: 0.9535, test_loss: 1.1468, test_f1: 0.5210
 epoch: 75, train_loss: 0.9518, test_loss: 1.1550, test_f1: 0.5150
 epoch: 76, train_loss: 0.9473, test_loss: 1.1509, test_f1: 0.5094
 epoch: 77, train_loss: 0.9391, test_loss: 1.1510, test_f1: 0.5218
 epoch: 78, train_loss: 0.9372, test_loss: 1.1506, test_f1: 0.5265
 epoch: 79, train_loss: 0.9382, test_loss: 1.1583, test_f1: 0.5274
 epoch: 80, train_loss: 0.9364, test_loss: 1.1673, test_f1: 0.5197
 epoch: 81, train_loss: 0.9382, test_loss: 1.1512, test_f1: 0.5177
 epoch: 82, train_loss: 0.9354, test_loss: 1.1671, test_f1: 0.5222
 epoch: 83, train_loss: 0.9362, test_loss: 1.1544, test_f1: 0.5215
 epoch: 84, train_loss: 0.9336, test_loss: 1.1352, test_f1: 0.5300
 epoch: 85, train_loss: 0.9307, test_loss: 1.1383, test_f1: 0.5146
 epoch: 86, train_loss: 0.9272, test_loss: 1.1357, test_f1: 0.5232
 epoch: 87, train_loss: 0.9225, test_loss: 1.1470, test_f1: 0.5270
 epoch: 88, train_loss: 0.9293, test_loss: 1.1455, test_f1: 0.5251
 epoch: 89, train_loss: 0.9227, test_loss: 1.1390, test_f1: 0.5321
 epoch: 90, train_loss: 0.9176, test_loss: 1.1412, test_f1: 0.5221
 epoch: 91, train_loss: 0.9204, test_loss: 1.1415, test_f1: 0.5336
 epoch: 92, train_loss: 0.9220, test_loss: 1.1290, test_f1: 0.5348
 epoch: 93, train_loss: 0.9128, test_loss: 1.1243, test_f1: 0.5166
 epoch: 94, train_loss: 0.9208, test_loss: 1.1259, test_f1: 0.5187
 epoch: 95, train_loss: 0.9223, test_loss: 1.1285, test_f1: 0.5276
 epoch: 96, train_loss: 0.9134, test_loss: 1.1205, test_f1: 0.5357
 epoch: 97, train_loss: 0.9128, test_loss: 1.1270, test_f1: 0.5346
 epoch: 98, train_loss: 0.9156, test_loss: 1.1359, test_f1: 0.5247
 epoch: 99, train_loss: 0.9075, test_loss: 1.1461, test_f1: 0.5451
##################ITERATION #5 ****************************************
 epoch: 0, train_loss: 1.2651, test_loss: 1.3300, test_f1: 0.2281
 epoch: 1, train_loss: 1.2303, test_loss: 1.3173, test_f1: 0.2281
 epoch: 2, train_loss: 1.2208, test_loss: 1.3048, test_f1: 0.2281
 epoch: 3, train_loss: 1.2104, test_loss: 1.2967, test_f1: 0.2281
 epoch: 4, train_loss: 1.2010, test_loss: 1.2918, test_f1: 0.2281
 epoch: 5, train_loss: 1.1920, test_loss: 1.2910, test_f1: 0.2281
 epoch: 6, train_loss: 1.1842, test_loss: 1.2885, test_f1: 0.2281
 epoch: 7, train_loss: 1.1708, test_loss: 1.2785, test_f1: 0.2281
 epoch: 8, train_loss: 1.1660, test_loss: 1.2620, test_f1: 0.2281
 epoch: 9, train_loss: 1.1561, test_loss: 1.2460, test_f1: 0.2281
 epoch: 10, train_loss: 1.1510, test_loss: 1.2326, test_f1: 0.2390
 epoch: 11, train_loss: 1.1463, test_loss: 1.2214, test_f1: 0.2687
 epoch: 12, train_loss: 1.1364, test_loss: 1.2132, test_f1: 0.3111
 epoch: 13, train_loss: 1.1323, test_loss: 1.2085, test_f1: 0.3189
 epoch: 14, train_loss: 1.1315, test_loss: 1.2008, test_f1: 0.3321
 epoch: 15, train_loss: 1.1169, test_loss: 1.2013, test_f1: 0.3360
 epoch: 16, train_loss: 1.1172, test_loss: 1.2073, test_f1: 0.3434
 epoch: 17, train_loss: 1.1117, test_loss: 1.2149, test_f1: 0.3537
 epoch: 18, train_loss: 1.1072, test_loss: 1.2179, test_f1: 0.3553
 epoch: 19, train_loss: 1.0949, test_loss: 1.2240, test_f1: 0.3681
 epoch: 20, train_loss: 1.0961, test_loss: 1.2114, test_f1: 0.3606
 epoch: 21, train_loss: 1.0951, test_loss: 1.2196, test_f1: 0.3653
 epoch: 22, train_loss: 1.0833, test_loss: 1.2183, test_f1: 0.3818
 epoch: 23, train_loss: 1.0860, test_loss: 1.2030, test_f1: 0.3926
 epoch: 24, train_loss: 1.0764, test_loss: 1.1905, test_f1: 0.4024
 epoch: 25, train_loss: 1.0703, test_loss: 1.1911, test_f1: 0.4086
 epoch: 26, train_loss: 1.0721, test_loss: 1.1914, test_f1: 0.4081
 epoch: 27, train_loss: 1.0630, test_loss: 1.1988, test_f1: 0.4110
 epoch: 28, train_loss: 1.0672, test_loss: 1.1923, test_f1: 0.4121
 epoch: 29, train_loss: 1.0528, test_loss: 1.1996, test_f1: 0.4127
 epoch: 30, train_loss: 1.0496, test_loss: 1.1593, test_f1: 0.4136
 epoch: 31, train_loss: 1.0467, test_loss: 1.1648, test_f1: 0.4137
 epoch: 32, train_loss: 1.0426, test_loss: 1.1629, test_f1: 0.4169
 epoch: 33, train_loss: 1.0393, test_loss: 1.1715, test_f1: 0.4175
 epoch: 34, train_loss: 1.0398, test_loss: 1.1635, test_f1: 0.4197
 epoch: 35, train_loss: 1.0378, test_loss: 1.1541, test_f1: 0.4181
 epoch: 36, train_loss: 1.0300, test_loss: 1.1394, test_f1: 0.3999
 epoch: 37, train_loss: 1.0269, test_loss: 1.1447, test_f1: 0.4146
 epoch: 38, train_loss: 1.0150, test_loss: 1.1342, test_f1: 0.4192
 epoch: 39, train_loss: 1.0234, test_loss: 1.1254, test_f1: 0.4245
 epoch: 40, train_loss: 1.0204, test_loss: 1.1373, test_f1: 0.4167
 epoch: 41, train_loss: 1.0117, test_loss: 1.1182, test_f1: 0.4376
 epoch: 42, train_loss: 1.0184, test_loss: 1.1123, test_f1: 0.4281
 epoch: 43, train_loss: 1.0074, test_loss: 1.1256, test_f1: 0.4294
 epoch: 44, train_loss: 1.0030, test_loss: 1.1000, test_f1: 0.4249
 epoch: 45, train_loss: 1.0014, test_loss: 1.0948, test_f1: 0.4240
 epoch: 46, train_loss: 0.9976, test_loss: 1.0884, test_f1: 0.4280
 epoch: 47, train_loss: 0.9854, test_loss: 1.0992, test_f1: 0.4235
 epoch: 48, train_loss: 0.9982, test_loss: 1.0908, test_f1: 0.4215
 epoch: 49, train_loss: 0.9845, test_loss: 1.0766, test_f1: 0.4266
 epoch: 50, train_loss: 0.9826, test_loss: 1.0861, test_f1: 0.4297
 epoch: 51, train_loss: 0.9837, test_loss: 1.0895, test_f1: 0.4263
 epoch: 52, train_loss: 0.9799, test_loss: 1.0831, test_f1: 0.4240
 epoch: 53, train_loss: 0.9819, test_loss: 1.0762, test_f1: 0.4193
 epoch: 54, train_loss: 0.9795, test_loss: 1.0753, test_f1: 0.4167
 epoch: 55, train_loss: 0.9771, test_loss: 1.0732, test_f1: 0.4239
 epoch: 56, train_loss: 0.9774, test_loss: 1.0838, test_f1: 0.4207
 epoch: 57, train_loss: 0.9718, test_loss: 1.0829, test_f1: 0.4110
 epoch: 58, train_loss: 0.9727, test_loss: 1.0779, test_f1: 0.4150
 epoch: 59, train_loss: 0.9671, test_loss: 1.0875, test_f1: 0.4128
 epoch: 60, train_loss: 0.9657, test_loss: 1.0864, test_f1: 0.4205
 epoch: 61, train_loss: 0.9642, test_loss: 1.0944, test_f1: 0.4261
 epoch: 62, train_loss: 0.9637, test_loss: 1.0885, test_f1: 0.4211
 epoch: 63, train_loss: 0.9712, test_loss: 1.0782, test_f1: 0.4233
 epoch: 64, train_loss: 0.9543, test_loss: 1.0781, test_f1: 0.4217
 epoch: 65, train_loss: 0.9570, test_loss: 1.0762, test_f1: 0.4263
 epoch: 66, train_loss: 0.9557, test_loss: 1.0705, test_f1: 0.4262
 epoch: 67, train_loss: 0.9585, test_loss: 1.0811, test_f1: 0.4242
 epoch: 68, train_loss: 0.9529, test_loss: 1.0803, test_f1: 0.4274
 epoch: 69, train_loss: 0.9518, test_loss: 1.0765, test_f1: 0.4235
 epoch: 70, train_loss: 0.9525, test_loss: 1.0821, test_f1: 0.4234
 epoch: 71, train_loss: 0.9501, test_loss: 1.0739, test_f1: 0.4334
 epoch: 72, train_loss: 0.9559, test_loss: 1.0672, test_f1: 0.4432
 epoch: 73, train_loss: 0.9452, test_loss: 1.0679, test_f1: 0.4316
 epoch: 74, train_loss: 0.9463, test_loss: 1.0651, test_f1: 0.4367
 epoch: 75, train_loss: 0.9461, test_loss: 1.0660, test_f1: 0.4254
 epoch: 76, train_loss: 0.9492, test_loss: 1.0599, test_f1: 0.4324
 epoch: 77, train_loss: 0.9445, test_loss: 1.0626, test_f1: 0.4326
 epoch: 78, train_loss: 0.9400, test_loss: 1.0544, test_f1: 0.4305
 epoch: 79, train_loss: 0.9363, test_loss: 1.0597, test_f1: 0.4235
 epoch: 80, train_loss: 0.9357, test_loss: 1.0719, test_f1: 0.4390
 epoch: 81, train_loss: 0.9349, test_loss: 1.0709, test_f1: 0.4400
 epoch: 82, train_loss: 0.9348, test_loss: 1.0636, test_f1: 0.4494
 epoch: 83, train_loss: 0.9273, test_loss: 1.0736, test_f1: 0.4457
 epoch: 84, train_loss: 0.9355, test_loss: 1.0649, test_f1: 0.4295
 epoch: 85, train_loss: 0.9285, test_loss: 1.0730, test_f1: 0.4493
 epoch: 86, train_loss: 0.9247, test_loss: 1.0905, test_f1: 0.4407
 epoch: 87, train_loss: 0.9213, test_loss: 1.0864, test_f1: 0.4429
 epoch: 88, train_loss: 0.9293, test_loss: 1.0860, test_f1: 0.4415
 epoch: 89, train_loss: 0.9165, test_loss: 1.0808, test_f1: 0.4540
 epoch: 90, train_loss: 0.9264, test_loss: 1.0721, test_f1: 0.4621
 epoch: 91, train_loss: 0.9277, test_loss: 1.0802, test_f1: 0.4634
 epoch: 92, train_loss: 0.9286, test_loss: 1.0841, test_f1: 0.4642
 epoch: 93, train_loss: 0.9137, test_loss: 1.0607, test_f1: 0.4565
 epoch: 94, train_loss: 0.9178, test_loss: 1.0724, test_f1: 0.4723
 epoch: 95, train_loss: 0.9128, test_loss: 1.0982, test_f1: 0.4632
 epoch: 96, train_loss: 0.9109, test_loss: 1.0921, test_f1: 0.4662
 epoch: 97, train_loss: 0.9039, test_loss: 1.0769, test_f1: 0.4683
 epoch: 98, train_loss: 0.9086, test_loss: 1.0634, test_f1: 0.4742
 epoch: 99, train_loss: 0.9179, test_loss: 1.0655, test_f1: 0.4830
##################ITERATION #6 ****************************************
 epoch: 0, train_loss: 1.2955, test_loss: 1.3693, test_f1: 0.2281
 epoch: 1, train_loss: 1.2470, test_loss: 1.3659, test_f1: 0.2281
 epoch: 2, train_loss: 1.2219, test_loss: 1.3572, test_f1: 0.2281
 epoch: 3, train_loss: 1.2093, test_loss: 1.3488, test_f1: 0.2281
 epoch: 4, train_loss: 1.1916, test_loss: 1.3435, test_f1: 0.2336
 epoch: 5, train_loss: 1.1861, test_loss: 1.3344, test_f1: 0.2775
 epoch: 6, train_loss: 1.1686, test_loss: 1.3194, test_f1: 0.2902
 epoch: 7, train_loss: 1.1635, test_loss: 1.3030, test_f1: 0.2997
 epoch: 8, train_loss: 1.1470, test_loss: 1.2813, test_f1: 0.2897
 epoch: 9, train_loss: 1.1355, test_loss: 1.2601, test_f1: 0.2870
 epoch: 10, train_loss: 1.1346, test_loss: 1.2385, test_f1: 0.2887
 epoch: 11, train_loss: 1.1287, test_loss: 1.2151, test_f1: 0.3010
 epoch: 12, train_loss: 1.1188, test_loss: 1.2035, test_f1: 0.3039
 epoch: 13, train_loss: 1.1079, test_loss: 1.1842, test_f1: 0.3547
 epoch: 14, train_loss: 1.1055, test_loss: 1.1735, test_f1: 0.3532
 epoch: 15, train_loss: 1.1028, test_loss: 1.1643, test_f1: 0.3809
 epoch: 16, train_loss: 1.0952, test_loss: 1.1636, test_f1: 0.3803
 epoch: 17, train_loss: 1.0869, test_loss: 1.1577, test_f1: 0.3868
 epoch: 18, train_loss: 1.0869, test_loss: 1.1464, test_f1: 0.3894
 epoch: 19, train_loss: 1.0840, test_loss: 1.1431, test_f1: 0.4037
 epoch: 20, train_loss: 1.0695, test_loss: 1.1336, test_f1: 0.3982
 epoch: 21, train_loss: 1.0613, test_loss: 1.1315, test_f1: 0.4202
 epoch: 22, train_loss: 1.0611, test_loss: 1.1303, test_f1: 0.4180
 epoch: 23, train_loss: 1.0548, test_loss: 1.1285, test_f1: 0.4209
 epoch: 24, train_loss: 1.0511, test_loss: 1.1336, test_f1: 0.4103
 epoch: 25, train_loss: 1.0469, test_loss: 1.1252, test_f1: 0.4124
 epoch: 26, train_loss: 1.0378, test_loss: 1.1249, test_f1: 0.4249
 epoch: 27, train_loss: 1.0478, test_loss: 1.1187, test_f1: 0.4161
 epoch: 28, train_loss: 1.0369, test_loss: 1.1186, test_f1: 0.4135
 epoch: 29, train_loss: 1.0343, test_loss: 1.1219, test_f1: 0.4145
 epoch: 30, train_loss: 1.0362, test_loss: 1.1129, test_f1: 0.4288
 epoch: 31, train_loss: 1.0268, test_loss: 1.1145, test_f1: 0.4206
 epoch: 32, train_loss: 1.0242, test_loss: 1.1331, test_f1: 0.4375
 epoch: 33, train_loss: 1.0203, test_loss: 1.1303, test_f1: 0.4376
 epoch: 34, train_loss: 1.0208, test_loss: 1.1104, test_f1: 0.4176
 epoch: 35, train_loss: 1.0033, test_loss: 1.1013, test_f1: 0.4172
 epoch: 36, train_loss: 1.0120, test_loss: 1.1020, test_f1: 0.4148
 epoch: 37, train_loss: 1.0054, test_loss: 1.1064, test_f1: 0.4376
 epoch: 38, train_loss: 1.0036, test_loss: 1.1035, test_f1: 0.4255
 epoch: 39, train_loss: 0.9975, test_loss: 1.0968, test_f1: 0.4264
 epoch: 40, train_loss: 0.9958, test_loss: 1.0980, test_f1: 0.4171
 epoch: 41, train_loss: 0.9925, test_loss: 1.1014, test_f1: 0.4274
 epoch: 42, train_loss: 0.9884, test_loss: 1.0964, test_f1: 0.4484
 epoch: 43, train_loss: 0.9892, test_loss: 1.0943, test_f1: 0.4395
 epoch: 44, train_loss: 0.9800, test_loss: 1.0970, test_f1: 0.4524
 epoch: 45, train_loss: 0.9805, test_loss: 1.0907, test_f1: 0.4370
 epoch: 46, train_loss: 0.9782, test_loss: 1.1056, test_f1: 0.4475
 epoch: 47, train_loss: 0.9720, test_loss: 1.0966, test_f1: 0.4297
 epoch: 48, train_loss: 0.9655, test_loss: 1.0915, test_f1: 0.4480
 epoch: 49, train_loss: 0.9692, test_loss: 1.0922, test_f1: 0.4295
 epoch: 50, train_loss: 0.9652, test_loss: 1.1148, test_f1: 0.4425
 epoch: 51, train_loss: 0.9688, test_loss: 1.1078, test_f1: 0.4473
 epoch: 52, train_loss: 0.9574, test_loss: 1.0853, test_f1: 0.4475
 epoch: 53, train_loss: 0.9551, test_loss: 1.0807, test_f1: 0.4449
 epoch: 54, train_loss: 0.9624, test_loss: 1.0854, test_f1: 0.4439
 epoch: 55, train_loss: 0.9666, test_loss: 1.0915, test_f1: 0.4398
 epoch: 56, train_loss: 0.9625, test_loss: 1.0882, test_f1: 0.4518
 epoch: 57, train_loss: 0.9599, test_loss: 1.0881, test_f1: 0.4434
 epoch: 58, train_loss: 0.9526, test_loss: 1.0791, test_f1: 0.4525
 epoch: 59, train_loss: 0.9541, test_loss: 1.0771, test_f1: 0.4557
 epoch: 60, train_loss: 0.9527, test_loss: 1.0824, test_f1: 0.4608
 epoch: 61, train_loss: 0.9542, test_loss: 1.0849, test_f1: 0.4579
 epoch: 62, train_loss: 0.9453, test_loss: 1.0807, test_f1: 0.4670
 epoch: 63, train_loss: 0.9487, test_loss: 1.0852, test_f1: 0.4591
 epoch: 64, train_loss: 0.9466, test_loss: 1.0948, test_f1: 0.4598
 epoch: 65, train_loss: 0.9376, test_loss: 1.0835, test_f1: 0.4663
 epoch: 66, train_loss: 0.9397, test_loss: 1.0853, test_f1: 0.4435
 epoch: 67, train_loss: 0.9433, test_loss: 1.0807, test_f1: 0.4514
 epoch: 68, train_loss: 0.9424, test_loss: 1.0813, test_f1: 0.4642
 epoch: 69, train_loss: 0.9343, test_loss: 1.0863, test_f1: 0.4613
 epoch: 70, train_loss: 0.9344, test_loss: 1.0815, test_f1: 0.4713
 epoch: 71, train_loss: 0.9385, test_loss: 1.0717, test_f1: 0.4638
 epoch: 72, train_loss: 0.9315, test_loss: 1.0823, test_f1: 0.4598
 epoch: 73, train_loss: 0.9464, test_loss: 1.0772, test_f1: 0.4555
 epoch: 74, train_loss: 0.9367, test_loss: 1.0738, test_f1: 0.4691
 epoch: 75, train_loss: 0.9354, test_loss: 1.0751, test_f1: 0.4741
 epoch: 76, train_loss: 0.9331, test_loss: 1.0866, test_f1: 0.4832
 epoch: 77, train_loss: 0.9269, test_loss: 1.0849, test_f1: 0.4832
 epoch: 78, train_loss: 0.9297, test_loss: 1.0766, test_f1: 0.4838
 epoch: 79, train_loss: 0.9270, test_loss: 1.0744, test_f1: 0.4800
 epoch: 80, train_loss: 0.9337, test_loss: 1.0743, test_f1: 0.4767
 epoch: 81, train_loss: 0.9230, test_loss: 1.0781, test_f1: 0.4803
 epoch: 82, train_loss: 0.9253, test_loss: 1.0859, test_f1: 0.4858
 epoch: 83, train_loss: 0.9309, test_loss: 1.0855, test_f1: 0.4875
 epoch: 84, train_loss: 0.9125, test_loss: 1.0812, test_f1: 0.4907
 epoch: 85, train_loss: 0.9128, test_loss: 1.0756, test_f1: 0.4994
 epoch: 86, train_loss: 0.9235, test_loss: 1.0822, test_f1: 0.4912
 epoch: 87, train_loss: 0.9117, test_loss: 1.0829, test_f1: 0.5063
 epoch: 88, train_loss: 0.9189, test_loss: 1.0836, test_f1: 0.5000
 epoch: 89, train_loss: 0.9322, test_loss: 1.0818, test_f1: 0.4953
 epoch: 90, train_loss: 0.9110, test_loss: 1.0862, test_f1: 0.5029
 epoch: 91, train_loss: 0.9153, test_loss: 1.0861, test_f1: 0.5127
 epoch: 92, train_loss: 0.9124, test_loss: 1.0853, test_f1: 0.5207
 epoch: 93, train_loss: 0.9101, test_loss: 1.0819, test_f1: 0.5085
 epoch: 94, train_loss: 0.9181, test_loss: 1.0799, test_f1: 0.5149
 epoch: 95, train_loss: 0.9019, test_loss: 1.0703, test_f1: 0.5046
 epoch: 96, train_loss: 0.9048, test_loss: 1.0593, test_f1: 0.5039
 epoch: 97, train_loss: 0.9132, test_loss: 1.0594, test_f1: 0.5124
 epoch: 98, train_loss: 0.9046, test_loss: 1.0559, test_f1: 0.5208
 epoch: 99, train_loss: 0.8985, test_loss: 1.0754, test_f1: 0.5193
##################ITERATION #7 ****************************************
 epoch: 0, train_loss: 1.2787, test_loss: 1.3606, test_f1: 0.2281
 epoch: 1, train_loss: 1.2332, test_loss: 1.3621, test_f1: 0.2281
 epoch: 2, train_loss: 1.2115, test_loss: 1.3546, test_f1: 0.2281
 epoch: 3, train_loss: 1.2053, test_loss: 1.3485, test_f1: 0.2281
 epoch: 4, train_loss: 1.1912, test_loss: 1.3416, test_f1: 0.2281
 epoch: 5, train_loss: 1.1703, test_loss: 1.3306, test_f1: 0.2285
 epoch: 6, train_loss: 1.1730, test_loss: 1.3051, test_f1: 0.2888
 epoch: 7, train_loss: 1.1619, test_loss: 1.2787, test_f1: 0.2939
 epoch: 8, train_loss: 1.1530, test_loss: 1.2581, test_f1: 0.3033
 epoch: 9, train_loss: 1.1366, test_loss: 1.2374, test_f1: 0.3166
 epoch: 10, train_loss: 1.1337, test_loss: 1.2173, test_f1: 0.3166
 epoch: 11, train_loss: 1.1207, test_loss: 1.2082, test_f1: 0.3240
 epoch: 12, train_loss: 1.1248, test_loss: 1.1917, test_f1: 0.3550
 epoch: 13, train_loss: 1.1008, test_loss: 1.1837, test_f1: 0.3830
 epoch: 14, train_loss: 1.1012, test_loss: 1.1730, test_f1: 0.3857
 epoch: 15, train_loss: 1.1002, test_loss: 1.1672, test_f1: 0.3884
 epoch: 16, train_loss: 1.0864, test_loss: 1.1625, test_f1: 0.3862
 epoch: 17, train_loss: 1.0841, test_loss: 1.1557, test_f1: 0.3863
 epoch: 18, train_loss: 1.0807, test_loss: 1.1500, test_f1: 0.3884
 epoch: 19, train_loss: 1.0745, test_loss: 1.1460, test_f1: 0.3981
 epoch: 20, train_loss: 1.0682, test_loss: 1.1397, test_f1: 0.4084
 epoch: 21, train_loss: 1.0730, test_loss: 1.1346, test_f1: 0.4031
 epoch: 22, train_loss: 1.0553, test_loss: 1.1324, test_f1: 0.4093
 epoch: 23, train_loss: 1.0593, test_loss: 1.1236, test_f1: 0.4188
 epoch: 24, train_loss: 1.0415, test_loss: 1.1215, test_f1: 0.4186
 epoch: 25, train_loss: 1.0528, test_loss: 1.1187, test_f1: 0.4246
 epoch: 26, train_loss: 1.0376, test_loss: 1.1194, test_f1: 0.4265
 epoch: 27, train_loss: 1.0390, test_loss: 1.1201, test_f1: 0.4291
 epoch: 28, train_loss: 1.0357, test_loss: 1.1147, test_f1: 0.4102
 epoch: 29, train_loss: 1.0288, test_loss: 1.1095, test_f1: 0.4166
 epoch: 30, train_loss: 1.0313, test_loss: 1.1034, test_f1: 0.4369
 epoch: 31, train_loss: 1.0256, test_loss: 1.1089, test_f1: 0.4193
 epoch: 32, train_loss: 1.0178, test_loss: 1.1092, test_f1: 0.4321
 epoch: 33, train_loss: 1.0082, test_loss: 1.1087, test_f1: 0.4388
 epoch: 34, train_loss: 1.0137, test_loss: 1.1013, test_f1: 0.4293
 epoch: 35, train_loss: 1.0062, test_loss: 1.0940, test_f1: 0.4310
 epoch: 36, train_loss: 1.0112, test_loss: 1.0909, test_f1: 0.4237
 epoch: 37, train_loss: 1.0082, test_loss: 1.0956, test_f1: 0.4366
 epoch: 38, train_loss: 1.0061, test_loss: 1.1027, test_f1: 0.4456
 epoch: 39, train_loss: 1.0021, test_loss: 1.0911, test_f1: 0.4452
 epoch: 40, train_loss: 0.9881, test_loss: 1.0861, test_f1: 0.4478
 epoch: 41, train_loss: 0.9928, test_loss: 1.0843, test_f1: 0.4601
 epoch: 42, train_loss: 0.9969, test_loss: 1.0837, test_f1: 0.4536
 epoch: 43, train_loss: 0.9914, test_loss: 1.0763, test_f1: 0.4613
 epoch: 44, train_loss: 0.9992, test_loss: 1.0845, test_f1: 0.4555
 epoch: 45, train_loss: 0.9848, test_loss: 1.1001, test_f1: 0.4551
 epoch: 46, train_loss: 0.9844, test_loss: 1.0853, test_f1: 0.4600
 epoch: 47, train_loss: 0.9738, test_loss: 1.0766, test_f1: 0.4522
 epoch: 48, train_loss: 0.9759, test_loss: 1.0748, test_f1: 0.4695
 epoch: 49, train_loss: 0.9685, test_loss: 1.0747, test_f1: 0.4750
 epoch: 50, train_loss: 0.9750, test_loss: 1.0743, test_f1: 0.4598
 epoch: 51, train_loss: 0.9737, test_loss: 1.0653, test_f1: 0.4376
 epoch: 52, train_loss: 0.9618, test_loss: 1.0604, test_f1: 0.4542
 epoch: 53, train_loss: 0.9759, test_loss: 1.0612, test_f1: 0.4683
 epoch: 54, train_loss: 0.9615, test_loss: 1.0629, test_f1: 0.4700
 epoch: 55, train_loss: 0.9741, test_loss: 1.0718, test_f1: 0.4842
 epoch: 56, train_loss: 0.9542, test_loss: 1.0648, test_f1: 0.4759
 epoch: 57, train_loss: 0.9579, test_loss: 1.0662, test_f1: 0.4715
 epoch: 58, train_loss: 0.9607, test_loss: 1.0672, test_f1: 0.4785
 epoch: 59, train_loss: 0.9597, test_loss: 1.0769, test_f1: 0.4759
 epoch: 60, train_loss: 0.9669, test_loss: 1.0694, test_f1: 0.4521
 epoch: 61, train_loss: 0.9616, test_loss: 1.0636, test_f1: 0.4654
 epoch: 62, train_loss: 0.9483, test_loss: 1.0698, test_f1: 0.4595
 epoch: 63, train_loss: 0.9512, test_loss: 1.0685, test_f1: 0.4528
 epoch: 64, train_loss: 0.9482, test_loss: 1.0639, test_f1: 0.4568
 epoch: 65, train_loss: 0.9481, test_loss: 1.0547, test_f1: 0.4594
 epoch: 66, train_loss: 0.9447, test_loss: 1.0555, test_f1: 0.4785
 epoch: 67, train_loss: 0.9498, test_loss: 1.0552, test_f1: 0.4610
 epoch: 68, train_loss: 0.9459, test_loss: 1.0545, test_f1: 0.4651
 epoch: 69, train_loss: 0.9479, test_loss: 1.0530, test_f1: 0.4896
 epoch: 70, train_loss: 0.9386, test_loss: 1.0508, test_f1: 0.4788
 epoch: 71, train_loss: 0.9387, test_loss: 1.0518, test_f1: 0.4740
 epoch: 72, train_loss: 0.9373, test_loss: 1.0526, test_f1: 0.4755
 epoch: 73, train_loss: 0.9333, test_loss: 1.0542, test_f1: 0.4851
 epoch: 74, train_loss: 0.9273, test_loss: 1.0638, test_f1: 0.4950
 epoch: 75, train_loss: 0.9295, test_loss: 1.0621, test_f1: 0.4852
 epoch: 76, train_loss: 0.9359, test_loss: 1.0543, test_f1: 0.4844
 epoch: 77, train_loss: 0.9289, test_loss: 1.0552, test_f1: 0.4964
 epoch: 78, train_loss: 0.9308, test_loss: 1.0479, test_f1: 0.4830
 epoch: 79, train_loss: 0.9337, test_loss: 1.0537, test_f1: 0.4748
 epoch: 80, train_loss: 0.9314, test_loss: 1.0499, test_f1: 0.4730
 epoch: 81, train_loss: 0.9325, test_loss: 1.0627, test_f1: 0.4756
 epoch: 82, train_loss: 0.9311, test_loss: 1.0616, test_f1: 0.4854
 epoch: 83, train_loss: 0.9239, test_loss: 1.0415, test_f1: 0.4707
 epoch: 84, train_loss: 0.9224, test_loss: 1.0403, test_f1: 0.4750
 epoch: 85, train_loss: 0.9244, test_loss: 1.0533, test_f1: 0.4862
 epoch: 86, train_loss: 0.9225, test_loss: 1.0618, test_f1: 0.4992
 epoch: 87, train_loss: 0.9157, test_loss: 1.0591, test_f1: 0.4969
 epoch: 88, train_loss: 0.9155, test_loss: 1.0547, test_f1: 0.4959
 epoch: 89, train_loss: 0.9178, test_loss: 1.0637, test_f1: 0.4918
 epoch: 90, train_loss: 0.9146, test_loss: 1.0696, test_f1: 0.4940
 epoch: 91, train_loss: 0.9209, test_loss: 1.0661, test_f1: 0.4981
 epoch: 92, train_loss: 0.9098, test_loss: 1.0725, test_f1: 0.5013
 epoch: 93, train_loss: 0.9078, test_loss: 1.0690, test_f1: 0.5020
 epoch: 94, train_loss: 0.9175, test_loss: 1.0504, test_f1: 0.5027
 epoch: 95, train_loss: 0.9100, test_loss: 1.0469, test_f1: 0.5031
 epoch: 96, train_loss: 0.9188, test_loss: 1.0559, test_f1: 0.5075
 epoch: 97, train_loss: 0.9166, test_loss: 1.0564, test_f1: 0.5091
 epoch: 98, train_loss: 0.9134, test_loss: 1.0567, test_f1: 0.5070
 epoch: 99, train_loss: 0.9049, test_loss: 1.0548, test_f1: 0.5054
##################ITERATION #8 ****************************************
 epoch: 0, train_loss: 1.2642, test_loss: 1.3476, test_f1: 0.2281
 epoch: 1, train_loss: 1.2173, test_loss: 1.3412, test_f1: 0.2281
 epoch: 2, train_loss: 1.2067, test_loss: 1.3331, test_f1: 0.2281
 epoch: 3, train_loss: 1.1877, test_loss: 1.3266, test_f1: 0.2281
 epoch: 4, train_loss: 1.1795, test_loss: 1.3235, test_f1: 0.2281
 epoch: 5, train_loss: 1.1756, test_loss: 1.3204, test_f1: 0.2604
 epoch: 6, train_loss: 1.1638, test_loss: 1.3088, test_f1: 0.2644
 epoch: 7, train_loss: 1.1448, test_loss: 1.2910, test_f1: 0.2586
 epoch: 8, train_loss: 1.1425, test_loss: 1.2660, test_f1: 0.3011
 epoch: 9, train_loss: 1.1314, test_loss: 1.2450, test_f1: 0.3100
 epoch: 10, train_loss: 1.1285, test_loss: 1.2304, test_f1: 0.3361
 epoch: 11, train_loss: 1.1134, test_loss: 1.2120, test_f1: 0.3140
 epoch: 12, train_loss: 1.1126, test_loss: 1.1977, test_f1: 0.3256
 epoch: 13, train_loss: 1.1034, test_loss: 1.1847, test_f1: 0.3291
 epoch: 14, train_loss: 1.0974, test_loss: 1.1764, test_f1: 0.3352
 epoch: 15, train_loss: 1.0859, test_loss: 1.1705, test_f1: 0.3423
 epoch: 16, train_loss: 1.0803, test_loss: 1.1660, test_f1: 0.3532
 epoch: 17, train_loss: 1.0809, test_loss: 1.1632, test_f1: 0.3468
 epoch: 18, train_loss: 1.0765, test_loss: 1.1613, test_f1: 0.3507
 epoch: 19, train_loss: 1.0711, test_loss: 1.1521, test_f1: 0.3460
 epoch: 20, train_loss: 1.0588, test_loss: 1.1441, test_f1: 0.3503
 epoch: 21, train_loss: 1.0593, test_loss: 1.1435, test_f1: 0.3552
 epoch: 22, train_loss: 1.0523, test_loss: 1.1411, test_f1: 0.3662
 epoch: 23, train_loss: 1.0463, test_loss: 1.1343, test_f1: 0.3702
 epoch: 24, train_loss: 1.0584, test_loss: 1.1304, test_f1: 0.3743
 epoch: 25, train_loss: 1.0363, test_loss: 1.1284, test_f1: 0.3784
 epoch: 26, train_loss: 1.0376, test_loss: 1.1263, test_f1: 0.3837
 epoch: 27, train_loss: 1.0293, test_loss: 1.1249, test_f1: 0.3712
 epoch: 28, train_loss: 1.0288, test_loss: 1.1190, test_f1: 0.3713
 epoch: 29, train_loss: 1.0231, test_loss: 1.1138, test_f1: 0.3828
 epoch: 30, train_loss: 1.0251, test_loss: 1.1104, test_f1: 0.3969
 epoch: 31, train_loss: 1.0277, test_loss: 1.1069, test_f1: 0.4152
 epoch: 32, train_loss: 1.0037, test_loss: 1.1049, test_f1: 0.4272
 epoch: 33, train_loss: 1.0101, test_loss: 1.1070, test_f1: 0.4352
 epoch: 34, train_loss: 1.0143, test_loss: 1.1106, test_f1: 0.4153
 epoch: 35, train_loss: 1.0042, test_loss: 1.1084, test_f1: 0.4195
 epoch: 36, train_loss: 0.9972, test_loss: 1.1079, test_f1: 0.4116
 epoch: 37, train_loss: 0.9898, test_loss: 1.1081, test_f1: 0.4295
 epoch: 38, train_loss: 0.9984, test_loss: 1.0998, test_f1: 0.4610
 epoch: 39, train_loss: 0.9850, test_loss: 1.0995, test_f1: 0.4585
 epoch: 40, train_loss: 0.9905, test_loss: 1.1149, test_f1: 0.4529
 epoch: 41, train_loss: 0.9946, test_loss: 1.1100, test_f1: 0.4531
 epoch: 42, train_loss: 0.9880, test_loss: 1.0965, test_f1: 0.4615
 epoch: 43, train_loss: 0.9778, test_loss: 1.0893, test_f1: 0.4541
 epoch: 44, train_loss: 0.9786, test_loss: 1.0890, test_f1: 0.4618
 epoch: 45, train_loss: 0.9836, test_loss: 1.0902, test_f1: 0.4652
 epoch: 46, train_loss: 0.9712, test_loss: 1.0966, test_f1: 0.4683
 epoch: 47, train_loss: 0.9678, test_loss: 1.0936, test_f1: 0.4593
 epoch: 48, train_loss: 0.9645, test_loss: 1.0927, test_f1: 0.4624
 epoch: 49, train_loss: 0.9626, test_loss: 1.0839, test_f1: 0.4640
 epoch: 50, train_loss: 0.9587, test_loss: 1.0819, test_f1: 0.4798
 epoch: 51, train_loss: 0.9590, test_loss: 1.0782, test_f1: 0.4876
 epoch: 52, train_loss: 0.9585, test_loss: 1.0834, test_f1: 0.4964
 epoch: 53, train_loss: 0.9527, test_loss: 1.0867, test_f1: 0.4874
 epoch: 54, train_loss: 0.9509, test_loss: 1.0851, test_f1: 0.5041
 epoch: 55, train_loss: 0.9639, test_loss: 1.0811, test_f1: 0.4819
 epoch: 56, train_loss: 0.9543, test_loss: 1.0885, test_f1: 0.4959
 epoch: 57, train_loss: 0.9479, test_loss: 1.0866, test_f1: 0.4929
 epoch: 58, train_loss: 0.9559, test_loss: 1.0933, test_f1: 0.4964
 epoch: 59, train_loss: 0.9544, test_loss: 1.0877, test_f1: 0.4849
 epoch: 60, train_loss: 0.9501, test_loss: 1.0862, test_f1: 0.4871
 epoch: 61, train_loss: 0.9538, test_loss: 1.0881, test_f1: 0.4939
 epoch: 62, train_loss: 0.9401, test_loss: 1.0812, test_f1: 0.4978
 epoch: 63, train_loss: 0.9358, test_loss: 1.0795, test_f1: 0.5067
 epoch: 64, train_loss: 0.9427, test_loss: 1.0881, test_f1: 0.4993
 epoch: 65, train_loss: 0.9402, test_loss: 1.0907, test_f1: 0.5082
 epoch: 66, train_loss: 0.9426, test_loss: 1.0920, test_f1: 0.5082
 epoch: 67, train_loss: 0.9455, test_loss: 1.0872, test_f1: 0.5129
 epoch: 68, train_loss: 0.9463, test_loss: 1.0836, test_f1: 0.5096
 epoch: 69, train_loss: 0.9298, test_loss: 1.0801, test_f1: 0.4996
 epoch: 70, train_loss: 0.9365, test_loss: 1.0726, test_f1: 0.5001
 epoch: 71, train_loss: 0.9433, test_loss: 1.0695, test_f1: 0.5022
 epoch: 72, train_loss: 0.9319, test_loss: 1.0751, test_f1: 0.4952
 epoch: 73, train_loss: 0.9272, test_loss: 1.0790, test_f1: 0.4946
 epoch: 74, train_loss: 0.9320, test_loss: 1.0718, test_f1: 0.5152
 epoch: 75, train_loss: 0.9203, test_loss: 1.0725, test_f1: 0.5135
 epoch: 76, train_loss: 0.9247, test_loss: 1.0781, test_f1: 0.4864
 epoch: 77, train_loss: 0.9267, test_loss: 1.0791, test_f1: 0.4979
 epoch: 78, train_loss: 0.9248, test_loss: 1.0755, test_f1: 0.5154
 epoch: 79, train_loss: 0.9273, test_loss: 1.0755, test_f1: 0.5276
 epoch: 80, train_loss: 0.9186, test_loss: 1.0736, test_f1: 0.5209
 epoch: 81, train_loss: 0.9263, test_loss: 1.0722, test_f1: 0.5270
 epoch: 82, train_loss: 0.9206, test_loss: 1.0769, test_f1: 0.5242
 epoch: 83, train_loss: 0.9182, test_loss: 1.0767, test_f1: 0.5254
 epoch: 84, train_loss: 0.9168, test_loss: 1.0741, test_f1: 0.5145
 epoch: 85, train_loss: 0.9177, test_loss: 1.0749, test_f1: 0.5149
 epoch: 86, train_loss: 0.9229, test_loss: 1.0721, test_f1: 0.5149
 epoch: 87, train_loss: 0.9155, test_loss: 1.0771, test_f1: 0.5241
 epoch: 88, train_loss: 0.9062, test_loss: 1.0786, test_f1: 0.5264
 epoch: 89, train_loss: 0.9100, test_loss: 1.0762, test_f1: 0.5269
 epoch: 90, train_loss: 0.9209, test_loss: 1.0792, test_f1: 0.5224
 epoch: 91, train_loss: 0.9076, test_loss: 1.0737, test_f1: 0.5208
 epoch: 92, train_loss: 0.9117, test_loss: 1.0722, test_f1: 0.5209
 epoch: 93, train_loss: 0.9060, test_loss: 1.0741, test_f1: 0.5179
 epoch: 94, train_loss: 0.9010, test_loss: 1.0775, test_f1: 0.5145
 epoch: 95, train_loss: 0.8980, test_loss: 1.0754, test_f1: 0.5328
 epoch: 96, train_loss: 0.9063, test_loss: 1.0753, test_f1: 0.5334
 epoch: 97, train_loss: 0.9062, test_loss: 1.0818, test_f1: 0.5342
 epoch: 98, train_loss: 0.9032, test_loss: 1.0828, test_f1: 0.5365
 epoch: 99, train_loss: 0.8981, test_loss: 1.0793, test_f1: 0.5365
##################ITERATION #9 ****************************************
 epoch: 0, train_loss: 1.2771, test_loss: 1.3338, test_f1: 0.2281
 epoch: 1, train_loss: 1.2327, test_loss: 1.3188, test_f1: 0.2281
 epoch: 2, train_loss: 1.2169, test_loss: 1.3045, test_f1: 0.2281
 epoch: 3, train_loss: 1.1944, test_loss: 1.2909, test_f1: 0.2281
 epoch: 4, train_loss: 1.1886, test_loss: 1.2842, test_f1: 0.2281
 epoch: 5, train_loss: 1.1713, test_loss: 1.2755, test_f1: 0.2281
 epoch: 6, train_loss: 1.1633, test_loss: 1.2610, test_f1: 0.2390
 epoch: 7, train_loss: 1.1543, test_loss: 1.2446, test_f1: 0.2615
 epoch: 8, train_loss: 1.1504, test_loss: 1.2311, test_f1: 0.2723
 epoch: 9, train_loss: 1.1409, test_loss: 1.2225, test_f1: 0.3199
 epoch: 10, train_loss: 1.1296, test_loss: 1.2144, test_f1: 0.3559
 epoch: 11, train_loss: 1.1240, test_loss: 1.2087, test_f1: 0.3638
 epoch: 12, train_loss: 1.1232, test_loss: 1.2013, test_f1: 0.3897
 epoch: 13, train_loss: 1.1131, test_loss: 1.1945, test_f1: 0.3781
 epoch: 14, train_loss: 1.1028, test_loss: 1.1852, test_f1: 0.3918
 epoch: 15, train_loss: 1.0975, test_loss: 1.1778, test_f1: 0.3836
 epoch: 16, train_loss: 1.0970, test_loss: 1.1716, test_f1: 0.3876
 epoch: 17, train_loss: 1.0829, test_loss: 1.1690, test_f1: 0.3898
 epoch: 18, train_loss: 1.0831, test_loss: 1.1659, test_f1: 0.3933
 epoch: 19, train_loss: 1.0806, test_loss: 1.1593, test_f1: 0.4197
 epoch: 20, train_loss: 1.0707, test_loss: 1.1560, test_f1: 0.4301
 epoch: 21, train_loss: 1.0692, test_loss: 1.1576, test_f1: 0.4245
 epoch: 22, train_loss: 1.0635, test_loss: 1.1539, test_f1: 0.4062
 epoch: 23, train_loss: 1.0565, test_loss: 1.1502, test_f1: 0.4075
 epoch: 24, train_loss: 1.0535, test_loss: 1.1412, test_f1: 0.4417
 epoch: 25, train_loss: 1.0514, test_loss: 1.1399, test_f1: 0.4427
 epoch: 26, train_loss: 1.0409, test_loss: 1.1384, test_f1: 0.4490
 epoch: 27, train_loss: 1.0442, test_loss: 1.1362, test_f1: 0.4430
 epoch: 28, train_loss: 1.0374, test_loss: 1.1298, test_f1: 0.4509
 epoch: 29, train_loss: 1.0205, test_loss: 1.1254, test_f1: 0.4460
 epoch: 30, train_loss: 1.0304, test_loss: 1.1254, test_f1: 0.4488
 epoch: 31, train_loss: 1.0186, test_loss: 1.1287, test_f1: 0.4485
 epoch: 32, train_loss: 1.0189, test_loss: 1.1233, test_f1: 0.4472
 epoch: 33, train_loss: 1.0273, test_loss: 1.1194, test_f1: 0.4533
 epoch: 34, train_loss: 1.0166, test_loss: 1.1178, test_f1: 0.4479
 epoch: 35, train_loss: 1.0084, test_loss: 1.1218, test_f1: 0.4538
 epoch: 36, train_loss: 1.0033, test_loss: 1.1271, test_f1: 0.4559
 epoch: 37, train_loss: 1.0076, test_loss: 1.1351, test_f1: 0.4407
 epoch: 38, train_loss: 0.9974, test_loss: 1.1295, test_f1: 0.4507
 epoch: 39, train_loss: 0.9890, test_loss: 1.1114, test_f1: 0.4383
 epoch: 40, train_loss: 0.9863, test_loss: 1.1120, test_f1: 0.4531
 epoch: 41, train_loss: 0.9857, test_loss: 1.1190, test_f1: 0.4479
 epoch: 42, train_loss: 0.9824, test_loss: 1.1204, test_f1: 0.4456
 epoch: 43, train_loss: 0.9823, test_loss: 1.1215, test_f1: 0.4532
 epoch: 44, train_loss: 0.9708, test_loss: 1.1243, test_f1: 0.4602
 epoch: 45, train_loss: 0.9785, test_loss: 1.1210, test_f1: 0.4674
 epoch: 46, train_loss: 0.9728, test_loss: 1.1181, test_f1: 0.4741
 epoch: 47, train_loss: 0.9600, test_loss: 1.1181, test_f1: 0.4719
 epoch: 48, train_loss: 0.9564, test_loss: 1.1152, test_f1: 0.4520
 epoch: 49, train_loss: 0.9571, test_loss: 1.1240, test_f1: 0.4593
 epoch: 50, train_loss: 0.9532, test_loss: 1.1320, test_f1: 0.4544
 epoch: 51, train_loss: 0.9548, test_loss: 1.1203, test_f1: 0.4648
 epoch: 52, train_loss: 0.9513, test_loss: 1.1126, test_f1: 0.4618
 epoch: 53, train_loss: 0.9456, test_loss: 1.1166, test_f1: 0.4670
 epoch: 54, train_loss: 0.9518, test_loss: 1.1156, test_f1: 0.4722
 epoch: 55, train_loss: 0.9492, test_loss: 1.1138, test_f1: 0.4883
 epoch: 56, train_loss: 0.9431, test_loss: 1.1087, test_f1: 0.4904
 epoch: 57, train_loss: 0.9462, test_loss: 1.1099, test_f1: 0.4832
 epoch: 58, train_loss: 0.9496, test_loss: 1.1082, test_f1: 0.4975
 epoch: 59, train_loss: 0.9482, test_loss: 1.1024, test_f1: 0.4832
 epoch: 60, train_loss: 0.9455, test_loss: 1.0995, test_f1: 0.4897
 epoch: 61, train_loss: 0.9324, test_loss: 1.1089, test_f1: 0.4953
 epoch: 62, train_loss: 0.9352, test_loss: 1.1112, test_f1: 0.4976
 epoch: 63, train_loss: 0.9340, test_loss: 1.1162, test_f1: 0.4930
 epoch: 64, train_loss: 0.9316, test_loss: 1.1169, test_f1: 0.4949
 epoch: 65, train_loss: 0.9263, test_loss: 1.1175, test_f1: 0.4992
 epoch: 66, train_loss: 0.9181, test_loss: 1.1151, test_f1: 0.5039
 epoch: 67, train_loss: 0.9245, test_loss: 1.1173, test_f1: 0.4881
 epoch: 68, train_loss: 0.9300, test_loss: 1.1141, test_f1: 0.5064
 epoch: 69, train_loss: 0.9298, test_loss: 1.1188, test_f1: 0.4876
 epoch: 70, train_loss: 0.9210, test_loss: 1.1157, test_f1: 0.4876
 epoch: 71, train_loss: 0.9231, test_loss: 1.1219, test_f1: 0.4975
 epoch: 72, train_loss: 0.9132, test_loss: 1.1226, test_f1: 0.4927
 epoch: 73, train_loss: 0.9187, test_loss: 1.1221, test_f1: 0.4924
 epoch: 74, train_loss: 0.9194, test_loss: 1.1253, test_f1: 0.4882
 epoch: 75, train_loss: 0.9254, test_loss: 1.1266, test_f1: 0.4882
 epoch: 76, train_loss: 0.9142, test_loss: 1.1129, test_f1: 0.5081
 epoch: 77, train_loss: 0.9043, test_loss: 1.1179, test_f1: 0.4950
 epoch: 78, train_loss: 0.9109, test_loss: 1.1164, test_f1: 0.5149
 epoch: 79, train_loss: 0.9078, test_loss: 1.1166, test_f1: 0.5049
 epoch: 80, train_loss: 0.8993, test_loss: 1.1285, test_f1: 0.4991
 epoch: 81, train_loss: 0.9068, test_loss: 1.1265, test_f1: 0.5032
 epoch: 82, train_loss: 0.9127, test_loss: 1.1185, test_f1: 0.4994
 epoch: 83, train_loss: 0.9081, test_loss: 1.1129, test_f1: 0.4996
 epoch: 84, train_loss: 0.9053, test_loss: 1.1123, test_f1: 0.5094
 epoch: 85, train_loss: 0.9082, test_loss: 1.1149, test_f1: 0.5099
 epoch: 86, train_loss: 0.8999, test_loss: 1.1183, test_f1: 0.4968
 epoch: 87, train_loss: 0.8936, test_loss: 1.1177, test_f1: 0.5042
 epoch: 88, train_loss: 0.9015, test_loss: 1.1180, test_f1: 0.5117
 epoch: 89, train_loss: 0.8966, test_loss: 1.1220, test_f1: 0.5115
 epoch: 90, train_loss: 0.8996, test_loss: 1.1320, test_f1: 0.5132
 epoch: 91, train_loss: 0.8940, test_loss: 1.1463, test_f1: 0.5092
 epoch: 92, train_loss: 0.8865, test_loss: 1.1387, test_f1: 0.5162
 epoch: 93, train_loss: 0.8915, test_loss: 1.1353, test_f1: 0.5075
 epoch: 94, train_loss: 0.8890, test_loss: 1.1354, test_f1: 0.5072
 epoch: 95, train_loss: 0.8878, test_loss: 1.1394, test_f1: 0.5052
 epoch: 96, train_loss: 0.8841, test_loss: 1.1464, test_f1: 0.5095
 epoch: 97, train_loss: 0.8794, test_loss: 1.1513, test_f1: 0.5078
 epoch: 98, train_loss: 0.8855, test_loss: 1.1505, test_f1: 0.5074
 epoch: 99, train_loss: 0.8867, test_loss: 1.1491, test_f1: 0.5096

Training completed in 371.42 seconds
Best F1: 0.5451 at epoch 99
Mean F1 across iterations: 0.4848  0.0449
========================FINAL RESULTS================================
FEGIN weighted F1: 0.5451  0.0449
python main.py --data ltspice_demos --representation component_net --model FEGIN --layers 4 --hiddens 64 --batch_size 256 --lr 0.0001 --emb_size 250 --epochs 100 --save_appendix component_net_L4_H64_BS256_LR0.0001_E250 --no_val
-----



STDERR:
  File "main.py", line 370, in <module>
    main()
  File "main.py", line 254, in main
    dataset = dataset_class(
  File "/home/philip/projects/ltspice_examples_code_repo/Circuit-Completion-Using-GNNs/component_classification_with_link_prediction_head/evaluation/FEGIN/kernel/circuit_datasets.py", line 15, in __init__
    self.data, self.slices = torch.load(self.processed_paths[0])
  File "/home/philip/.local/lib/python3.8/site-packages/torch/serialization.py", line 1040, in load
    warnings.warn(
  File "/usr/lib/python3.8/warnings.py", line 109, in _showwarnmsg
    sw(msg.message, msg.category, msg.filename, msg.lineno,
  File "main.py", line 47, in warn_with_traceback
    traceback.print_stack(file=log)
/home/philip/projects/ltspice_examples_code_repo/Circuit-Completion-Using-GNNs/component_classification_with_link_prediction_head/evaluation/FEGIN/kernel/circuit_datasets.py:15: FutureWarning: You are using `torch.load` with `weights_only=False` (the current default value), which uses the default pickle module implicitly. It is possible to construct malicious pickle data which will execute arbitrary code during unpickling (See https://github.com/pytorch/pytorch/blob/main/SECURITY.md#untrusted-models for more details). In a future release, the default value for `weights_only` will be flipped to `True`. This limits the functions that could be executed during unpickling. Arbitrary objects will no longer be allowed to be loaded via this mode unless they are explicitly allowlisted by the user via `torch.serialization.add_safe_globals`. We recommend you start setting `weights_only=True` for any use case where you don't have full control of the loaded file. Please open an issue on GitHub for any issues related to this experimental feature.
  self.data, self.slices = torch.load(self.processed_paths[0])
