STDOUT:
Results will be saved in /home/philip/projects/ltspice_examples_code_repo/Circuit-Completion-Using-GNNs/component_classification_with_link_prediction_head/evaluation/FEGIN/results/model_FEGIN_dataset_ltspice_demos
Command line input: python main.py --data ltspice_demos --representation component_net --model FEGIN --layers 5 --hiddens 64 --batch_size 64 --lr 0.001 --emb_size 512 --epochs 100 --save_appendix component_net_L5_H64_BS64_LR0.001_E512 --no_val
 is saved.
-----
ltspice_demos - FEGIN
Using 5 layers, 64 hidden units, h = 2
Loading component_net representation dataset
ENTERED
Training FEGIN on component_net representation
Train: 1565, Test: 383
##################ITERATION #0 ****************************************
 epoch: 0, train_loss: 1.2641, test_loss: 1.3155, test_f1: 0.1365
 epoch: 1, train_loss: 1.1456, test_loss: 1.2631, test_f1: 0.3056
 epoch: 2, train_loss: 1.0989, test_loss: 1.1985, test_f1: 0.4288
 epoch: 3, train_loss: 1.0735, test_loss: 1.1550, test_f1: 0.4961
 epoch: 4, train_loss: 1.0263, test_loss: 1.0895, test_f1: 0.5303
 epoch: 5, train_loss: 0.9965, test_loss: 1.0712, test_f1: 0.5281
 epoch: 6, train_loss: 0.9581, test_loss: 1.0494, test_f1: 0.4926
 epoch: 7, train_loss: 0.9369, test_loss: 1.1420, test_f1: 0.5400
 epoch: 8, train_loss: 0.9344, test_loss: 1.1313, test_f1: 0.5446
 epoch: 9, train_loss: 0.9287, test_loss: 1.0835, test_f1: 0.5506
 epoch: 10, train_loss: 0.8748, test_loss: 1.0525, test_f1: 0.5652
 epoch: 11, train_loss: 0.8461, test_loss: 1.0724, test_f1: 0.5785
 epoch: 12, train_loss: 0.8428, test_loss: 1.1249, test_f1: 0.5706
 epoch: 13, train_loss: 0.8505, test_loss: 1.0899, test_f1: 0.5900
 epoch: 14, train_loss: 0.8293, test_loss: 1.1371, test_f1: 0.5484
 epoch: 15, train_loss: 0.8342, test_loss: 1.1074, test_f1: 0.5936
 epoch: 16, train_loss: 0.7930, test_loss: 1.2202, test_f1: 0.5876
 epoch: 17, train_loss: 0.7780, test_loss: 1.2706, test_f1: 0.5752
 epoch: 18, train_loss: 0.7925, test_loss: 1.1870, test_f1: 0.5924
 epoch: 19, train_loss: 0.7697, test_loss: 1.2740, test_f1: 0.6093
 epoch: 20, train_loss: 0.7644, test_loss: 1.1853, test_f1: 0.5778
 epoch: 21, train_loss: 0.7433, test_loss: 1.1809, test_f1: 0.5960
 epoch: 22, train_loss: 0.7301, test_loss: 1.2513, test_f1: 0.6099
 epoch: 23, train_loss: 0.7107, test_loss: 1.2683, test_f1: 0.6034
 epoch: 24, train_loss: 0.7108, test_loss: 1.3312, test_f1: 0.6261
 epoch: 25, train_loss: 0.7082, test_loss: 1.2945, test_f1: 0.6223
 epoch: 26, train_loss: 0.6835, test_loss: 1.3165, test_f1: 0.5814
 epoch: 27, train_loss: 0.6760, test_loss: 1.3703, test_f1: 0.6223
 epoch: 28, train_loss: 0.6804, test_loss: 1.3660, test_f1: 0.5926
 epoch: 29, train_loss: 0.6568, test_loss: 1.5055, test_f1: 0.5824
 epoch: 30, train_loss: 0.6331, test_loss: 1.2217, test_f1: 0.6160
 epoch: 31, train_loss: 0.6580, test_loss: 1.5602, test_f1: 0.6166
 epoch: 32, train_loss: 0.6345, test_loss: 1.6503, test_f1: 0.5922
 epoch: 33, train_loss: 0.6520, test_loss: 1.4877, test_f1: 0.6047
 epoch: 34, train_loss: 0.6248, test_loss: 1.6351, test_f1: 0.5893
 epoch: 35, train_loss: 0.6021, test_loss: 1.3317, test_f1: 0.6321
 epoch: 36, train_loss: 0.5787, test_loss: 1.6648, test_f1: 0.6041
 epoch: 37, train_loss: 0.5657, test_loss: 1.6534, test_f1: 0.5715
 epoch: 38, train_loss: 0.5685, test_loss: 1.7418, test_f1: 0.5928
 epoch: 39, train_loss: 0.5702, test_loss: 1.9453, test_f1: 0.5929
 epoch: 40, train_loss: 0.5671, test_loss: 1.5373, test_f1: 0.6101
 epoch: 41, train_loss: 0.5560, test_loss: 1.4873, test_f1: 0.6309
 epoch: 42, train_loss: 0.5418, test_loss: 2.0038, test_f1: 0.5794
 epoch: 43, train_loss: 0.5480, test_loss: 2.1774, test_f1: 0.5867
 epoch: 44, train_loss: 0.5303, test_loss: 1.9032, test_f1: 0.6092
 epoch: 45, train_loss: 0.5024, test_loss: 1.7230, test_f1: 0.6102
 epoch: 46, train_loss: 0.5047, test_loss: 1.9917, test_f1: 0.5734
 epoch: 47, train_loss: 0.4927, test_loss: 2.0621, test_f1: 0.5839
 epoch: 48, train_loss: 0.4767, test_loss: 1.7738, test_f1: 0.6220
 epoch: 49, train_loss: 0.4951, test_loss: 2.0587, test_f1: 0.6089
 epoch: 50, train_loss: 0.4795, test_loss: 1.9992, test_f1: 0.5583
 epoch: 51, train_loss: 0.4438, test_loss: 1.9604, test_f1: 0.6195
 epoch: 52, train_loss: 0.4284, test_loss: 2.1225, test_f1: 0.6255
 epoch: 53, train_loss: 0.4080, test_loss: 2.0928, test_f1: 0.6163
 epoch: 54, train_loss: 0.3816, test_loss: 2.2827, test_f1: 0.6160
 epoch: 55, train_loss: 0.3750, test_loss: 2.2811, test_f1: 0.5934
 epoch: 56, train_loss: 0.3743, test_loss: 2.3041, test_f1: 0.5937
 epoch: 57, train_loss: 0.3827, test_loss: 2.6179, test_f1: 0.6013
 epoch: 58, train_loss: 0.3709, test_loss: 2.5264, test_f1: 0.6015
 epoch: 59, train_loss: 0.3649, test_loss: 2.3271, test_f1: 0.5929
 epoch: 60, train_loss: 0.3555, test_loss: 2.8785, test_f1: 0.5851
 epoch: 61, train_loss: 0.3381, test_loss: 2.3525, test_f1: 0.6211
 epoch: 62, train_loss: 0.3399, test_loss: 2.8967, test_f1: 0.5924
 epoch: 63, train_loss: 0.3364, test_loss: 2.5914, test_f1: 0.5961
 epoch: 64, train_loss: 0.3491, test_loss: 2.7062, test_f1: 0.6070
 epoch: 65, train_loss: 0.3190, test_loss: 2.5496, test_f1: 0.5879
 epoch: 66, train_loss: 0.3126, test_loss: 2.8555, test_f1: 0.5916
 epoch: 67, train_loss: 0.3195, test_loss: 2.8260, test_f1: 0.5863
 epoch: 68, train_loss: 0.3431, test_loss: 2.9469, test_f1: 0.5948
 epoch: 69, train_loss: 0.3204, test_loss: 2.9115, test_f1: 0.5788
 epoch: 70, train_loss: 0.3237, test_loss: 2.8786, test_f1: 0.6009
 epoch: 71, train_loss: 0.3021, test_loss: 2.9245, test_f1: 0.5985
 epoch: 72, train_loss: 0.2963, test_loss: 2.8526, test_f1: 0.5994
 epoch: 73, train_loss: 0.2875, test_loss: 2.9773, test_f1: 0.5961
 epoch: 74, train_loss: 0.3034, test_loss: 2.8131, test_f1: 0.6141
 epoch: 75, train_loss: 0.3355, test_loss: 3.1574, test_f1: 0.5978
 epoch: 76, train_loss: 0.3046, test_loss: 3.1721, test_f1: 0.5710
 epoch: 77, train_loss: 0.2884, test_loss: 3.0380, test_f1: 0.6035
 epoch: 78, train_loss: 0.2750, test_loss: 3.1115, test_f1: 0.6007
 epoch: 79, train_loss: 0.2962, test_loss: 3.4287, test_f1: 0.5964
 epoch: 80, train_loss: 0.2671, test_loss: 3.0958, test_f1: 0.6001
 epoch: 81, train_loss: 0.2785, test_loss: 3.2796, test_f1: 0.6014
 epoch: 82, train_loss: 0.2950, test_loss: 3.8287, test_f1: 0.5822
 epoch: 83, train_loss: 0.2639, test_loss: 3.5566, test_f1: 0.5888
 epoch: 84, train_loss: 0.2865, test_loss: 3.4256, test_f1: 0.5997
 epoch: 85, train_loss: 0.2577, test_loss: 3.3765, test_f1: 0.6080
 epoch: 86, train_loss: 0.2382, test_loss: 3.7973, test_f1: 0.6111
 epoch: 87, train_loss: 0.2971, test_loss: 3.1107, test_f1: 0.5881
 epoch: 88, train_loss: 0.2577, test_loss: 3.3390, test_f1: 0.6040
 epoch: 89, train_loss: 0.2620, test_loss: 3.3707, test_f1: 0.5938
 epoch: 90, train_loss: 0.2382, test_loss: 3.3600, test_f1: 0.6015
 epoch: 91, train_loss: 0.2329, test_loss: 3.3637, test_f1: 0.6072
 epoch: 92, train_loss: 0.2212, test_loss: 3.5567, test_f1: 0.5926
 epoch: 93, train_loss: 0.2435, test_loss: 3.3944, test_f1: 0.6063
 epoch: 94, train_loss: 0.2326, test_loss: 3.6808, test_f1: 0.6035
 epoch: 95, train_loss: 0.2055, test_loss: 3.8564, test_f1: 0.5858
 epoch: 96, train_loss: 0.2366, test_loss: 4.0207, test_f1: 0.5891
 epoch: 97, train_loss: 0.2496, test_loss: 4.0274, test_f1: 0.5851
 epoch: 98, train_loss: 0.2218, test_loss: 3.5347, test_f1: 0.6142
 epoch: 99, train_loss: 0.2478, test_loss: 3.9059, test_f1: 0.6075
##################ITERATION #1 ****************************************
 epoch: 0, train_loss: 1.1765, test_loss: 1.2945, test_f1: 0.2479
 epoch: 1, train_loss: 1.0473, test_loss: 1.1411, test_f1: 0.4475
 epoch: 2, train_loss: 1.0220, test_loss: 1.0572, test_f1: 0.4969
 epoch: 3, train_loss: 0.9863, test_loss: 1.0654, test_f1: 0.5157
 epoch: 4, train_loss: 0.9470, test_loss: 1.1100, test_f1: 0.5112
 epoch: 5, train_loss: 0.9463, test_loss: 1.1164, test_f1: 0.5112
 epoch: 6, train_loss: 0.9254, test_loss: 1.0635, test_f1: 0.5286
 epoch: 7, train_loss: 0.9073, test_loss: 1.1148, test_f1: 0.5525
 epoch: 8, train_loss: 0.8701, test_loss: 1.1132, test_f1: 0.5124
 epoch: 9, train_loss: 0.8614, test_loss: 1.0911, test_f1: 0.5787
 epoch: 10, train_loss: 0.8672, test_loss: 1.1084, test_f1: 0.5675
 epoch: 11, train_loss: 0.8482, test_loss: 1.1079, test_f1: 0.5863
 epoch: 12, train_loss: 0.8485, test_loss: 1.0933, test_f1: 0.5680
 epoch: 13, train_loss: 0.8413, test_loss: 1.0613, test_f1: 0.5968
 epoch: 14, train_loss: 0.8004, test_loss: 1.1793, test_f1: 0.5942
 epoch: 15, train_loss: 0.7896, test_loss: 1.1351, test_f1: 0.5500
 epoch: 16, train_loss: 0.7994, test_loss: 1.2317, test_f1: 0.5562
 epoch: 17, train_loss: 0.7900, test_loss: 1.1546, test_f1: 0.5938
 epoch: 18, train_loss: 0.7703, test_loss: 1.1532, test_f1: 0.5712
 epoch: 19, train_loss: 0.7504, test_loss: 1.2065, test_f1: 0.5600
 epoch: 20, train_loss: 0.7486, test_loss: 1.2197, test_f1: 0.5556
 epoch: 21, train_loss: 0.7546, test_loss: 1.1237, test_f1: 0.5732
 epoch: 22, train_loss: 0.7428, test_loss: 1.1684, test_f1: 0.5784
 epoch: 23, train_loss: 0.7205, test_loss: 1.2376, test_f1: 0.5652
 epoch: 24, train_loss: 0.6985, test_loss: 1.2797, test_f1: 0.5884
 epoch: 25, train_loss: 0.6910, test_loss: 1.3114, test_f1: 0.6020
 epoch: 26, train_loss: 0.6845, test_loss: 1.2529, test_f1: 0.6055
 epoch: 27, train_loss: 0.6653, test_loss: 1.2944, test_f1: 0.5653
 epoch: 28, train_loss: 0.6662, test_loss: 1.3840, test_f1: 0.6098
 epoch: 29, train_loss: 0.6892, test_loss: 1.3545, test_f1: 0.5844
 epoch: 30, train_loss: 0.6536, test_loss: 1.4075, test_f1: 0.6021
 epoch: 31, train_loss: 0.6143, test_loss: 1.4936, test_f1: 0.5745
 epoch: 32, train_loss: 0.6506, test_loss: 1.4824, test_f1: 0.6075
 epoch: 33, train_loss: 0.6368, test_loss: 1.3897, test_f1: 0.6191
 epoch: 34, train_loss: 0.6020, test_loss: 1.6945, test_f1: 0.5612
 epoch: 35, train_loss: 0.5990, test_loss: 1.4491, test_f1: 0.6361
 epoch: 36, train_loss: 0.6093, test_loss: 1.5447, test_f1: 0.6086
 epoch: 37, train_loss: 0.5969, test_loss: 1.5721, test_f1: 0.6341
 epoch: 38, train_loss: 0.5480, test_loss: 1.4814, test_f1: 0.6263
 epoch: 39, train_loss: 0.5644, test_loss: 1.5006, test_f1: 0.6318
 epoch: 40, train_loss: 0.5716, test_loss: 1.7567, test_f1: 0.5864
 epoch: 41, train_loss: 0.5506, test_loss: 1.6209, test_f1: 0.6085
 epoch: 42, train_loss: 0.5406, test_loss: 1.6660, test_f1: 0.5799
 epoch: 43, train_loss: 0.5107, test_loss: 1.7778, test_f1: 0.6227
 epoch: 44, train_loss: 0.4996, test_loss: 1.8007, test_f1: 0.6066
 epoch: 45, train_loss: 0.4828, test_loss: 1.9618, test_f1: 0.6076
 epoch: 46, train_loss: 0.5114, test_loss: 2.0767, test_f1: 0.6063
 epoch: 47, train_loss: 0.4898, test_loss: 1.8611, test_f1: 0.5561
 epoch: 48, train_loss: 0.5151, test_loss: 1.7915, test_f1: 0.5991
 epoch: 49, train_loss: 0.5029, test_loss: 1.7209, test_f1: 0.6173
 epoch: 50, train_loss: 0.4555, test_loss: 1.7778, test_f1: 0.6211
 epoch: 51, train_loss: 0.4331, test_loss: 1.7557, test_f1: 0.6217
 epoch: 52, train_loss: 0.4000, test_loss: 1.7236, test_f1: 0.6337
 epoch: 53, train_loss: 0.3939, test_loss: 1.9502, test_f1: 0.5963
 epoch: 54, train_loss: 0.3723, test_loss: 2.0281, test_f1: 0.6042
 epoch: 55, train_loss: 0.3768, test_loss: 1.9945, test_f1: 0.5959
 epoch: 56, train_loss: 0.3593, test_loss: 2.0853, test_f1: 0.6046
 epoch: 57, train_loss: 0.3378, test_loss: 2.1626, test_f1: 0.6003
 epoch: 58, train_loss: 0.3322, test_loss: 2.2382, test_f1: 0.5559
 epoch: 59, train_loss: 0.3619, test_loss: 2.4268, test_f1: 0.6039
 epoch: 60, train_loss: 0.3184, test_loss: 2.3535, test_f1: 0.5912
 epoch: 61, train_loss: 0.3327, test_loss: 2.3822, test_f1: 0.6077
 epoch: 62, train_loss: 0.3333, test_loss: 2.2734, test_f1: 0.5788
 epoch: 63, train_loss: 0.3221, test_loss: 2.2353, test_f1: 0.5721
 epoch: 64, train_loss: 0.3073, test_loss: 2.2547, test_f1: 0.5933
 epoch: 65, train_loss: 0.3379, test_loss: 2.4063, test_f1: 0.6001
 epoch: 66, train_loss: 0.3301, test_loss: 2.5414, test_f1: 0.5833
 epoch: 67, train_loss: 0.3119, test_loss: 2.4034, test_f1: 0.5963
 epoch: 68, train_loss: 0.2908, test_loss: 2.5005, test_f1: 0.5826
 epoch: 69, train_loss: 0.2715, test_loss: 2.5723, test_f1: 0.6039
 epoch: 70, train_loss: 0.2844, test_loss: 2.5410, test_f1: 0.6101
 epoch: 71, train_loss: 0.2609, test_loss: 2.6368, test_f1: 0.6003
 epoch: 72, train_loss: 0.2652, test_loss: 2.7520, test_f1: 0.5941
 epoch: 73, train_loss: 0.2519, test_loss: 2.7407, test_f1: 0.5825
 epoch: 74, train_loss: 0.2774, test_loss: 2.9623, test_f1: 0.5905
 epoch: 75, train_loss: 0.2764, test_loss: 2.8059, test_f1: 0.5888
 epoch: 76, train_loss: 0.2721, test_loss: 2.9282, test_f1: 0.6015
 epoch: 77, train_loss: 0.2634, test_loss: 3.2986, test_f1: 0.5649
 epoch: 78, train_loss: 0.2845, test_loss: 2.5956, test_f1: 0.5969
 epoch: 79, train_loss: 0.2685, test_loss: 3.0545, test_f1: 0.5908
 epoch: 80, train_loss: 0.2536, test_loss: 2.9647, test_f1: 0.6018
 epoch: 81, train_loss: 0.2454, test_loss: 2.8189, test_f1: 0.6010
 epoch: 82, train_loss: 0.2309, test_loss: 2.9783, test_f1: 0.5685
 epoch: 83, train_loss: 0.2278, test_loss: 2.9724, test_f1: 0.6307
 epoch: 84, train_loss: 0.2287, test_loss: 2.8596, test_f1: 0.6067
 epoch: 85, train_loss: 0.2282, test_loss: 3.0264, test_f1: 0.5745
 epoch: 86, train_loss: 0.2188, test_loss: 3.1741, test_f1: 0.5905
 epoch: 87, train_loss: 0.2521, test_loss: 2.9745, test_f1: 0.6097
 epoch: 88, train_loss: 0.2690, test_loss: 3.0754, test_f1: 0.5917
 epoch: 89, train_loss: 0.2340, test_loss: 3.3231, test_f1: 0.5946
 epoch: 90, train_loss: 0.2542, test_loss: 3.2789, test_f1: 0.5766
 epoch: 91, train_loss: 0.2294, test_loss: 3.0985, test_f1: 0.6043
 epoch: 92, train_loss: 0.2451, test_loss: 3.3782, test_f1: 0.5946
 epoch: 93, train_loss: 0.2188, test_loss: 3.0109, test_f1: 0.5802
 epoch: 94, train_loss: 0.2183, test_loss: 3.0425, test_f1: 0.5849
 epoch: 95, train_loss: 0.2297, test_loss: 3.2881, test_f1: 0.5851
 epoch: 96, train_loss: 0.2124, test_loss: 3.2743, test_f1: 0.5996
 epoch: 97, train_loss: 0.2044, test_loss: 3.4789, test_f1: 0.5861
 epoch: 98, train_loss: 0.2033, test_loss: 3.2053, test_f1: 0.6002
 epoch: 99, train_loss: 0.1935, test_loss: 3.3646, test_f1: 0.5858
##################ITERATION #2 ****************************************
 epoch: 0, train_loss: 1.2123, test_loss: 1.2840, test_f1: 0.1733
 epoch: 1, train_loss: 1.0602, test_loss: 1.1916, test_f1: 0.3929
 epoch: 2, train_loss: 1.0114, test_loss: 1.1051, test_f1: 0.4871
 epoch: 3, train_loss: 0.9838, test_loss: 1.1327, test_f1: 0.4871
 epoch: 4, train_loss: 0.9372, test_loss: 1.0680, test_f1: 0.5608
 epoch: 5, train_loss: 0.9240, test_loss: 1.0360, test_f1: 0.5591
 epoch: 6, train_loss: 0.9266, test_loss: 1.0176, test_f1: 0.5512
 epoch: 7, train_loss: 0.8809, test_loss: 1.0799, test_f1: 0.5798
 epoch: 8, train_loss: 0.8623, test_loss: 1.0982, test_f1: 0.5753
 epoch: 9, train_loss: 0.8630, test_loss: 1.1178, test_f1: 0.5860
 epoch: 10, train_loss: 0.8325, test_loss: 1.1259, test_f1: 0.5473
 epoch: 11, train_loss: 0.8267, test_loss: 1.1040, test_f1: 0.5915
 epoch: 12, train_loss: 0.8406, test_loss: 1.0993, test_f1: 0.5906
 epoch: 13, train_loss: 0.8090, test_loss: 1.1468, test_f1: 0.5805
 epoch: 14, train_loss: 0.7988, test_loss: 1.1155, test_f1: 0.6152
 epoch: 15, train_loss: 0.7911, test_loss: 1.2692, test_f1: 0.5468
 epoch: 16, train_loss: 0.7534, test_loss: 1.1272, test_f1: 0.6003
 epoch: 17, train_loss: 0.7667, test_loss: 1.2548, test_f1: 0.5367
 epoch: 18, train_loss: 0.7573, test_loss: 1.1726, test_f1: 0.5739
 epoch: 19, train_loss: 0.7649, test_loss: 1.4022, test_f1: 0.5244
 epoch: 20, train_loss: 0.7386, test_loss: 1.2391, test_f1: 0.5570
 epoch: 21, train_loss: 0.7213, test_loss: 1.2112, test_f1: 0.5946
 epoch: 22, train_loss: 0.7260, test_loss: 1.3511, test_f1: 0.5534
 epoch: 23, train_loss: 0.7054, test_loss: 1.2642, test_f1: 0.5852
 epoch: 24, train_loss: 0.7098, test_loss: 1.2311, test_f1: 0.5929
 epoch: 25, train_loss: 0.6886, test_loss: 1.1146, test_f1: 0.5798
 epoch: 26, train_loss: 0.6740, test_loss: 1.2353, test_f1: 0.6090
 epoch: 27, train_loss: 0.6859, test_loss: 1.5517, test_f1: 0.4974
 epoch: 28, train_loss: 0.6683, test_loss: 1.3678, test_f1: 0.5532
 epoch: 29, train_loss: 0.6541, test_loss: 1.5013, test_f1: 0.5841
 epoch: 30, train_loss: 0.6488, test_loss: 1.3933, test_f1: 0.5982
 epoch: 31, train_loss: 0.6482, test_loss: 1.6073, test_f1: 0.5884
 epoch: 32, train_loss: 0.6422, test_loss: 1.4883, test_f1: 0.6006
 epoch: 33, train_loss: 0.6354, test_loss: 1.4943, test_f1: 0.5784
 epoch: 34, train_loss: 0.6058, test_loss: 1.5342, test_f1: 0.5793
 epoch: 35, train_loss: 0.5783, test_loss: 1.4394, test_f1: 0.6107
 epoch: 36, train_loss: 0.6048, test_loss: 1.7593, test_f1: 0.5673
 epoch: 37, train_loss: 0.6131, test_loss: 1.4625, test_f1: 0.6293
 epoch: 38, train_loss: 0.6065, test_loss: 1.5450, test_f1: 0.5772
 epoch: 39, train_loss: 0.5812, test_loss: 1.6077, test_f1: 0.5931
 epoch: 40, train_loss: 0.5357, test_loss: 1.5523, test_f1: 0.6165
 epoch: 41, train_loss: 0.5734, test_loss: 1.7736, test_f1: 0.5454
 epoch: 42, train_loss: 0.5734, test_loss: 1.7374, test_f1: 0.5647
 epoch: 43, train_loss: 0.5532, test_loss: 1.7677, test_f1: 0.6011
 epoch: 44, train_loss: 0.5451, test_loss: 1.6502, test_f1: 0.6008
 epoch: 45, train_loss: 0.5369, test_loss: 1.7999, test_f1: 0.6083
 epoch: 46, train_loss: 0.5179, test_loss: 1.7605, test_f1: 0.5817
 epoch: 47, train_loss: 0.5229, test_loss: 1.7908, test_f1: 0.6151
 epoch: 48, train_loss: 0.4988, test_loss: 1.9836, test_f1: 0.5909
 epoch: 49, train_loss: 0.4686, test_loss: 2.1149, test_f1: 0.5581
 epoch: 50, train_loss: 0.4972, test_loss: 1.9536, test_f1: 0.6166
 epoch: 51, train_loss: 0.4558, test_loss: 1.8721, test_f1: 0.6206
 epoch: 52, train_loss: 0.4190, test_loss: 1.9130, test_f1: 0.6128
 epoch: 53, train_loss: 0.4006, test_loss: 1.9694, test_f1: 0.5910
 epoch: 54, train_loss: 0.3902, test_loss: 2.1727, test_f1: 0.6093
 epoch: 55, train_loss: 0.3845, test_loss: 2.0223, test_f1: 0.6202
 epoch: 56, train_loss: 0.3901, test_loss: 2.1087, test_f1: 0.5921
 epoch: 57, train_loss: 0.3824, test_loss: 2.2110, test_f1: 0.5752
 epoch: 58, train_loss: 0.3915, test_loss: 2.1633, test_f1: 0.5943
 epoch: 59, train_loss: 0.3808, test_loss: 2.1584, test_f1: 0.6165
 epoch: 60, train_loss: 0.3766, test_loss: 2.2782, test_f1: 0.6025
 epoch: 61, train_loss: 0.3513, test_loss: 2.3647, test_f1: 0.5977
 epoch: 62, train_loss: 0.3721, test_loss: 2.2895, test_f1: 0.5743
 epoch: 63, train_loss: 0.3792, test_loss: 2.4462, test_f1: 0.6039
 epoch: 64, train_loss: 0.3505, test_loss: 2.5096, test_f1: 0.6049
 epoch: 65, train_loss: 0.3402, test_loss: 2.4108, test_f1: 0.5981
 epoch: 66, train_loss: 0.3392, test_loss: 2.4032, test_f1: 0.6012
 epoch: 67, train_loss: 0.3534, test_loss: 2.6446, test_f1: 0.5897
 epoch: 68, train_loss: 0.3506, test_loss: 2.7157, test_f1: 0.5859
 epoch: 69, train_loss: 0.3375, test_loss: 2.5976, test_f1: 0.5889
 epoch: 70, train_loss: 0.3072, test_loss: 2.6151, test_f1: 0.6082
 epoch: 71, train_loss: 0.3039, test_loss: 2.6173, test_f1: 0.6129
 epoch: 72, train_loss: 0.3258, test_loss: 2.8275, test_f1: 0.5902
 epoch: 73, train_loss: 0.3311, test_loss: 2.9035, test_f1: 0.5893
 epoch: 74, train_loss: 0.3084, test_loss: 2.5525, test_f1: 0.6057
 epoch: 75, train_loss: 0.3092, test_loss: 2.7511, test_f1: 0.5902
 epoch: 76, train_loss: 0.2990, test_loss: 2.6470, test_f1: 0.5943
 epoch: 77, train_loss: 0.3030, test_loss: 2.8732, test_f1: 0.6036
 epoch: 78, train_loss: 0.2982, test_loss: 3.0724, test_f1: 0.6058
 epoch: 79, train_loss: 0.2717, test_loss: 2.9497, test_f1: 0.5971
 epoch: 80, train_loss: 0.3056, test_loss: 2.9430, test_f1: 0.6184
 epoch: 81, train_loss: 0.3007, test_loss: 3.1566, test_f1: 0.5876
 epoch: 82, train_loss: 0.3053, test_loss: 2.9910, test_f1: 0.6001
 epoch: 83, train_loss: 0.2839, test_loss: 3.1965, test_f1: 0.5711
 epoch: 84, train_loss: 0.2888, test_loss: 3.1249, test_f1: 0.5832
 epoch: 85, train_loss: 0.2994, test_loss: 3.1984, test_f1: 0.5966
 epoch: 86, train_loss: 0.2679, test_loss: 3.3095, test_f1: 0.5876
 epoch: 87, train_loss: 0.2510, test_loss: 3.2510, test_f1: 0.5876
 epoch: 88, train_loss: 0.2587, test_loss: 3.0688, test_f1: 0.6175
 epoch: 89, train_loss: 0.2704, test_loss: 3.2657, test_f1: 0.5847
 epoch: 90, train_loss: 0.2337, test_loss: 3.0812, test_f1: 0.5900
 epoch: 91, train_loss: 0.2393, test_loss: 3.6631, test_f1: 0.5922
 epoch: 92, train_loss: 0.2590, test_loss: 3.4220, test_f1: 0.5911
 epoch: 93, train_loss: 0.2547, test_loss: 3.6582, test_f1: 0.5693
 epoch: 94, train_loss: 0.2487, test_loss: 3.3882, test_f1: 0.5990
 epoch: 95, train_loss: 0.2346, test_loss: 3.4228, test_f1: 0.5903
 epoch: 96, train_loss: 0.2564, test_loss: 3.8917, test_f1: 0.5963
 epoch: 97, train_loss: 0.2599, test_loss: 3.8038, test_f1: 0.5990
 epoch: 98, train_loss: 0.2430, test_loss: 3.4190, test_f1: 0.6122
 epoch: 99, train_loss: 0.2262, test_loss: 3.5962, test_f1: 0.5987
##################ITERATION #3 ****************************************
 epoch: 0, train_loss: 1.2476, test_loss: 1.2884, test_f1: 0.1512
 epoch: 1, train_loss: 1.0764, test_loss: 1.2400, test_f1: 0.2105
 epoch: 2, train_loss: 1.0285, test_loss: 1.0865, test_f1: 0.5336
 epoch: 3, train_loss: 0.9960, test_loss: 1.0779, test_f1: 0.4745
 epoch: 4, train_loss: 0.9757, test_loss: 1.1067, test_f1: 0.5648
 epoch: 5, train_loss: 0.9511, test_loss: 1.0310, test_f1: 0.5364
 epoch: 6, train_loss: 0.9160, test_loss: 1.0083, test_f1: 0.5757
 epoch: 7, train_loss: 0.9195, test_loss: 1.0286, test_f1: 0.5417
 epoch: 8, train_loss: 0.8858, test_loss: 0.9929, test_f1: 0.5624
 epoch: 9, train_loss: 0.8758, test_loss: 1.0087, test_f1: 0.5705
 epoch: 10, train_loss: 0.8584, test_loss: 1.0244, test_f1: 0.5517
 epoch: 11, train_loss: 0.8706, test_loss: 1.0431, test_f1: 0.5973
 epoch: 12, train_loss: 0.8414, test_loss: 0.9925, test_f1: 0.5959
 epoch: 13, train_loss: 0.8326, test_loss: 1.0832, test_f1: 0.5878
 epoch: 14, train_loss: 0.7999, test_loss: 1.0423, test_f1: 0.6190
 epoch: 15, train_loss: 0.8002, test_loss: 1.0481, test_f1: 0.6014
 epoch: 16, train_loss: 0.7956, test_loss: 1.0438, test_f1: 0.5935
 epoch: 17, train_loss: 0.7820, test_loss: 1.0390, test_f1: 0.5988
 epoch: 18, train_loss: 0.7735, test_loss: 1.0731, test_f1: 0.6094
 epoch: 19, train_loss: 0.7643, test_loss: 1.0473, test_f1: 0.5901
 epoch: 20, train_loss: 0.7316, test_loss: 1.0514, test_f1: 0.6240
 epoch: 21, train_loss: 0.7148, test_loss: 1.1520, test_f1: 0.5972
 epoch: 22, train_loss: 0.7259, test_loss: 1.0885, test_f1: 0.6522
 epoch: 23, train_loss: 0.7207, test_loss: 1.1163, test_f1: 0.6346
 epoch: 24, train_loss: 0.6911, test_loss: 1.1439, test_f1: 0.6043
 epoch: 25, train_loss: 0.6821, test_loss: 1.1572, test_f1: 0.6400
 epoch: 26, train_loss: 0.6503, test_loss: 1.2815, test_f1: 0.6196
 epoch: 27, train_loss: 0.6661, test_loss: 1.2171, test_f1: 0.6095
 epoch: 28, train_loss: 0.6546, test_loss: 1.2271, test_f1: 0.6093
 epoch: 29, train_loss: 0.6704, test_loss: 1.2916, test_f1: 0.5867
 epoch: 30, train_loss: 0.6278, test_loss: 1.2123, test_f1: 0.5738
 epoch: 31, train_loss: 0.5993, test_loss: 1.2003, test_f1: 0.6627
 epoch: 32, train_loss: 0.6103, test_loss: 1.3190, test_f1: 0.5733
 epoch: 33, train_loss: 0.6661, test_loss: 1.4497, test_f1: 0.5885
 epoch: 34, train_loss: 0.5964, test_loss: 1.2616, test_f1: 0.5876
 epoch: 35, train_loss: 0.5999, test_loss: 1.2386, test_f1: 0.6234
 epoch: 36, train_loss: 0.5549, test_loss: 1.3742, test_f1: 0.6279
 epoch: 37, train_loss: 0.5906, test_loss: 1.5252, test_f1: 0.5907
 epoch: 38, train_loss: 0.5766, test_loss: 1.3658, test_f1: 0.5790
 epoch: 39, train_loss: 0.5574, test_loss: 1.4762, test_f1: 0.6341
 epoch: 40, train_loss: 0.5415, test_loss: 1.4854, test_f1: 0.5916
 epoch: 41, train_loss: 0.5112, test_loss: 1.5861, test_f1: 0.6057
 epoch: 42, train_loss: 0.5553, test_loss: 1.4411, test_f1: 0.6299
 epoch: 43, train_loss: 0.5232, test_loss: 1.5800, test_f1: 0.6043
 epoch: 44, train_loss: 0.5309, test_loss: 1.6019, test_f1: 0.6189
 epoch: 45, train_loss: 0.5115, test_loss: 1.5642, test_f1: 0.6094
 epoch: 46, train_loss: 0.4671, test_loss: 1.6832, test_f1: 0.6131
 epoch: 47, train_loss: 0.4953, test_loss: 1.8069, test_f1: 0.5926
 epoch: 48, train_loss: 0.4873, test_loss: 1.8277, test_f1: 0.5869
 epoch: 49, train_loss: 0.4919, test_loss: 1.7982, test_f1: 0.5930
 epoch: 50, train_loss: 0.4669, test_loss: 1.8311, test_f1: 0.5981
 epoch: 51, train_loss: 0.4444, test_loss: 1.8491, test_f1: 0.6053
 epoch: 52, train_loss: 0.4198, test_loss: 1.9329, test_f1: 0.5889
 epoch: 53, train_loss: 0.4094, test_loss: 1.8660, test_f1: 0.5849
 epoch: 54, train_loss: 0.3970, test_loss: 1.9967, test_f1: 0.5859
 epoch: 55, train_loss: 0.3636, test_loss: 1.8837, test_f1: 0.6093
 epoch: 56, train_loss: 0.3588, test_loss: 1.9983, test_f1: 0.5931
 epoch: 57, train_loss: 0.3786, test_loss: 2.2032, test_f1: 0.5986
 epoch: 58, train_loss: 0.3382, test_loss: 1.8869, test_f1: 0.6036
 epoch: 59, train_loss: 0.3826, test_loss: 2.0333, test_f1: 0.6009
 epoch: 60, train_loss: 0.3699, test_loss: 2.0856, test_f1: 0.6285
 epoch: 61, train_loss: 0.3443, test_loss: 2.3314, test_f1: 0.5901
 epoch: 62, train_loss: 0.3496, test_loss: 2.2965, test_f1: 0.5846
 epoch: 63, train_loss: 0.3443, test_loss: 2.4781, test_f1: 0.6173
 epoch: 64, train_loss: 0.3343, test_loss: 2.1700, test_f1: 0.5948
 epoch: 65, train_loss: 0.3267, test_loss: 2.5373, test_f1: 0.6067
 epoch: 66, train_loss: 0.3111, test_loss: 2.3579, test_f1: 0.6100
 epoch: 67, train_loss: 0.3095, test_loss: 2.4115, test_f1: 0.6036
 epoch: 68, train_loss: 0.3157, test_loss: 2.9706, test_f1: 0.5686
 epoch: 69, train_loss: 0.3420, test_loss: 2.6238, test_f1: 0.6035
 epoch: 70, train_loss: 0.3173, test_loss: 2.5250, test_f1: 0.5753
 epoch: 71, train_loss: 0.3023, test_loss: 2.5499, test_f1: 0.6047
 epoch: 72, train_loss: 0.3208, test_loss: 2.6184, test_f1: 0.5783
 epoch: 73, train_loss: 0.2977, test_loss: 2.6761, test_f1: 0.5825
 epoch: 74, train_loss: 0.3051, test_loss: 2.6470, test_f1: 0.5732
 epoch: 75, train_loss: 0.3278, test_loss: 2.5033, test_f1: 0.5977
 epoch: 76, train_loss: 0.3062, test_loss: 2.7249, test_f1: 0.5931
 epoch: 77, train_loss: 0.2906, test_loss: 2.6380, test_f1: 0.5957
 epoch: 78, train_loss: 0.2802, test_loss: 2.8163, test_f1: 0.6053
 epoch: 79, train_loss: 0.2836, test_loss: 2.6067, test_f1: 0.5872
 epoch: 80, train_loss: 0.2971, test_loss: 2.5804, test_f1: 0.5846
 epoch: 81, train_loss: 0.2702, test_loss: 2.5461, test_f1: 0.6191
 epoch: 82, train_loss: 0.2909, test_loss: 2.4874, test_f1: 0.5825
 epoch: 83, train_loss: 0.2919, test_loss: 2.6653, test_f1: 0.5873
 epoch: 84, train_loss: 0.2525, test_loss: 2.6506, test_f1: 0.5934
 epoch: 85, train_loss: 0.2905, test_loss: 2.8920, test_f1: 0.5962
 epoch: 86, train_loss: 0.2559, test_loss: 2.7537, test_f1: 0.5887
 epoch: 87, train_loss: 0.2584, test_loss: 2.7396, test_f1: 0.5877
 epoch: 88, train_loss: 0.2307, test_loss: 2.7410, test_f1: 0.5973
 epoch: 89, train_loss: 0.2654, test_loss: 3.0489, test_f1: 0.5707
 epoch: 90, train_loss: 0.2461, test_loss: 2.8897, test_f1: 0.5816
 epoch: 91, train_loss: 0.2404, test_loss: 2.4960, test_f1: 0.5986
 epoch: 92, train_loss: 0.2339, test_loss: 2.8050, test_f1: 0.6135
 epoch: 93, train_loss: 0.2532, test_loss: 2.8104, test_f1: 0.5760
 epoch: 94, train_loss: 0.2386, test_loss: 3.0425, test_f1: 0.5486
 epoch: 95, train_loss: 0.2499, test_loss: 2.8143, test_f1: 0.6000
 epoch: 96, train_loss: 0.2525, test_loss: 2.7507, test_f1: 0.6068
 epoch: 97, train_loss: 0.2514, test_loss: 3.0721, test_f1: 0.5946
 epoch: 98, train_loss: 0.2368, test_loss: 2.9068, test_f1: 0.5977
 epoch: 99, train_loss: 0.2187, test_loss: 3.2422, test_f1: 0.6125
##################ITERATION #4 ****************************************
 epoch: 0, train_loss: 1.2770, test_loss: 1.2249, test_f1: 0.4511
 epoch: 1, train_loss: 1.0924, test_loss: 1.1250, test_f1: 0.4163
 epoch: 2, train_loss: 1.0335, test_loss: 1.0552, test_f1: 0.5318
 epoch: 3, train_loss: 1.0108, test_loss: 1.0984, test_f1: 0.5088
 epoch: 4, train_loss: 0.9718, test_loss: 1.1542, test_f1: 0.5126
 epoch: 5, train_loss: 0.9445, test_loss: 1.0645, test_f1: 0.5446
 epoch: 6, train_loss: 0.9231, test_loss: 0.9860, test_f1: 0.5632
 epoch: 7, train_loss: 0.9122, test_loss: 0.9863, test_f1: 0.5447
 epoch: 8, train_loss: 0.8775, test_loss: 0.9737, test_f1: 0.5542
 epoch: 9, train_loss: 0.8692, test_loss: 1.0800, test_f1: 0.5551
 epoch: 10, train_loss: 0.8733, test_loss: 1.0680, test_f1: 0.5768
 epoch: 11, train_loss: 0.8544, test_loss: 1.0925, test_f1: 0.5459
 epoch: 12, train_loss: 0.8406, test_loss: 1.0848, test_f1: 0.5529
 epoch: 13, train_loss: 0.8181, test_loss: 1.1713, test_f1: 0.5538
 epoch: 14, train_loss: 0.7954, test_loss: 1.1360, test_f1: 0.5983
 epoch: 15, train_loss: 0.7922, test_loss: 1.1580, test_f1: 0.5647
 epoch: 16, train_loss: 0.8169, test_loss: 1.1320, test_f1: 0.5491
 epoch: 17, train_loss: 0.7956, test_loss: 1.1161, test_f1: 0.5661
 epoch: 18, train_loss: 0.7570, test_loss: 1.1158, test_f1: 0.5746
 epoch: 19, train_loss: 0.7425, test_loss: 1.1025, test_f1: 0.5890
 epoch: 20, train_loss: 0.7512, test_loss: 1.2597, test_f1: 0.5272
 epoch: 21, train_loss: 0.7376, test_loss: 1.1677, test_f1: 0.5636
 epoch: 22, train_loss: 0.7347, test_loss: 1.1603, test_f1: 0.5772
 epoch: 23, train_loss: 0.7264, test_loss: 1.2214, test_f1: 0.5675
 epoch: 24, train_loss: 0.6747, test_loss: 1.1398, test_f1: 0.6387
 epoch: 25, train_loss: 0.6946, test_loss: 1.2069, test_f1: 0.6014
 epoch: 26, train_loss: 0.6810, test_loss: 1.0886, test_f1: 0.6109
 epoch: 27, train_loss: 0.6751, test_loss: 1.3857, test_f1: 0.5704
 epoch: 28, train_loss: 0.6727, test_loss: 1.2625, test_f1: 0.5988
 epoch: 29, train_loss: 0.6594, test_loss: 1.2954, test_f1: 0.5711
 epoch: 30, train_loss: 0.6450, test_loss: 1.1710, test_f1: 0.6099
 epoch: 31, train_loss: 0.6308, test_loss: 1.3304, test_f1: 0.6062
 epoch: 32, train_loss: 0.6083, test_loss: 1.5230, test_f1: 0.5558
 epoch: 33, train_loss: 0.6120, test_loss: 1.4450, test_f1: 0.5631
 epoch: 34, train_loss: 0.5929, test_loss: 1.8383, test_f1: 0.4974
 epoch: 35, train_loss: 0.6035, test_loss: 1.3312, test_f1: 0.5956
 epoch: 36, train_loss: 0.5788, test_loss: 1.3090, test_f1: 0.6273
 epoch: 37, train_loss: 0.5649, test_loss: 1.4386, test_f1: 0.5802
 epoch: 38, train_loss: 0.5910, test_loss: 1.4025, test_f1: 0.6304
 epoch: 39, train_loss: 0.5498, test_loss: 1.3275, test_f1: 0.6319
 epoch: 40, train_loss: 0.5429, test_loss: 1.4313, test_f1: 0.6212
 epoch: 41, train_loss: 0.5588, test_loss: 1.5481, test_f1: 0.5932
 epoch: 42, train_loss: 0.5623, test_loss: 1.5942, test_f1: 0.5226
 epoch: 43, train_loss: 0.5416, test_loss: 1.5670, test_f1: 0.5865
 epoch: 44, train_loss: 0.5212, test_loss: 1.4954, test_f1: 0.5763
 epoch: 45, train_loss: 0.5200, test_loss: 1.3830, test_f1: 0.6240
 epoch: 46, train_loss: 0.4903, test_loss: 1.4997, test_f1: 0.6357
 epoch: 47, train_loss: 0.5246, test_loss: 1.6380, test_f1: 0.5790
 epoch: 48, train_loss: 0.5005, test_loss: 1.5653, test_f1: 0.6340
 epoch: 49, train_loss: 0.5174, test_loss: 1.6378, test_f1: 0.5982
 epoch: 50, train_loss: 0.4898, test_loss: 1.5933, test_f1: 0.5993
 epoch: 51, train_loss: 0.4626, test_loss: 1.5747, test_f1: 0.6084
 epoch: 52, train_loss: 0.4299, test_loss: 1.5439, test_f1: 0.6235
 epoch: 53, train_loss: 0.4130, test_loss: 1.6880, test_f1: 0.5897
 epoch: 54, train_loss: 0.4146, test_loss: 1.6853, test_f1: 0.5669
 epoch: 55, train_loss: 0.4069, test_loss: 1.5904, test_f1: 0.6382
 epoch: 56, train_loss: 0.3902, test_loss: 1.5306, test_f1: 0.6421
 epoch: 57, train_loss: 0.3769, test_loss: 1.8218, test_f1: 0.6124
 epoch: 58, train_loss: 0.4206, test_loss: 1.5940, test_f1: 0.6268
 epoch: 59, train_loss: 0.3698, test_loss: 1.7483, test_f1: 0.6220
 epoch: 60, train_loss: 0.3597, test_loss: 1.6751, test_f1: 0.6399
 epoch: 61, train_loss: 0.3568, test_loss: 1.7533, test_f1: 0.5980
 epoch: 62, train_loss: 0.3530, test_loss: 1.7470, test_f1: 0.6185
 epoch: 63, train_loss: 0.3822, test_loss: 2.0144, test_f1: 0.6239
 epoch: 64, train_loss: 0.3830, test_loss: 1.9450, test_f1: 0.6174
 epoch: 65, train_loss: 0.3617, test_loss: 1.8744, test_f1: 0.5984
 epoch: 66, train_loss: 0.3460, test_loss: 2.0644, test_f1: 0.6289
 epoch: 67, train_loss: 0.3570, test_loss: 1.8796, test_f1: 0.5894
 epoch: 68, train_loss: 0.3366, test_loss: 1.8270, test_f1: 0.6334
 epoch: 69, train_loss: 0.3436, test_loss: 1.9345, test_f1: 0.6172
 epoch: 70, train_loss: 0.3267, test_loss: 1.8491, test_f1: 0.6174
 epoch: 71, train_loss: 0.3482, test_loss: 2.0096, test_f1: 0.6151
 epoch: 72, train_loss: 0.3366, test_loss: 2.0261, test_f1: 0.6086
 epoch: 73, train_loss: 0.2963, test_loss: 1.8472, test_f1: 0.6344
 epoch: 74, train_loss: 0.3145, test_loss: 2.0574, test_f1: 0.6207
 epoch: 75, train_loss: 0.3146, test_loss: 1.8382, test_f1: 0.6592
 epoch: 76, train_loss: 0.3112, test_loss: 2.1877, test_f1: 0.6129
 epoch: 77, train_loss: 0.3074, test_loss: 2.2705, test_f1: 0.6009
 epoch: 78, train_loss: 0.3035, test_loss: 2.0198, test_f1: 0.6313
 epoch: 79, train_loss: 0.3293, test_loss: 2.0982, test_f1: 0.6235
 epoch: 80, train_loss: 0.2893, test_loss: 2.1588, test_f1: 0.6290
 epoch: 81, train_loss: 0.2711, test_loss: 2.2031, test_f1: 0.6125
 epoch: 82, train_loss: 0.2796, test_loss: 2.2162, test_f1: 0.6121
 epoch: 83, train_loss: 0.2975, test_loss: 2.1150, test_f1: 0.6328
 epoch: 84, train_loss: 0.2969, test_loss: 2.1004, test_f1: 0.6170
 epoch: 85, train_loss: 0.2888, test_loss: 2.3333, test_f1: 0.6124
 epoch: 86, train_loss: 0.2673, test_loss: 2.2556, test_f1: 0.6103
 epoch: 87, train_loss: 0.2624, test_loss: 2.2156, test_f1: 0.6022
 epoch: 88, train_loss: 0.2545, test_loss: 2.1761, test_f1: 0.6360
 epoch: 89, train_loss: 0.2786, test_loss: 2.4417, test_f1: 0.6047
 epoch: 90, train_loss: 0.2610, test_loss: 2.1487, test_f1: 0.5951
 epoch: 91, train_loss: 0.2480, test_loss: 2.5152, test_f1: 0.5884
 epoch: 92, train_loss: 0.2929, test_loss: 2.6060, test_f1: 0.5825
 epoch: 93, train_loss: 0.2625, test_loss: 2.4964, test_f1: 0.6051
 epoch: 94, train_loss: 0.2510, test_loss: 2.8314, test_f1: 0.5748
 epoch: 95, train_loss: 0.2324, test_loss: 2.8380, test_f1: 0.5977
 epoch: 96, train_loss: 0.2564, test_loss: 2.4687, test_f1: 0.5999
 epoch: 97, train_loss: 0.2623, test_loss: 2.6457, test_f1: 0.6100
 epoch: 98, train_loss: 0.3100, test_loss: 2.4990, test_f1: 0.5928
 epoch: 99, train_loss: 0.2832, test_loss: 2.7345, test_f1: 0.6083
##################ITERATION #5 ****************************************
 epoch: 0, train_loss: 1.2560, test_loss: 1.3851, test_f1: 0.1365
 epoch: 1, train_loss: 1.0776, test_loss: 1.2550, test_f1: 0.2517
 epoch: 2, train_loss: 1.0189, test_loss: 1.1727, test_f1: 0.4796
 epoch: 3, train_loss: 1.0006, test_loss: 1.1275, test_f1: 0.5247
 epoch: 4, train_loss: 0.9485, test_loss: 1.1514, test_f1: 0.5107
 epoch: 5, train_loss: 0.9466, test_loss: 1.0710, test_f1: 0.5532
 epoch: 6, train_loss: 0.9141, test_loss: 1.0755, test_f1: 0.5474
 epoch: 7, train_loss: 0.8937, test_loss: 1.0684, test_f1: 0.5221
 epoch: 8, train_loss: 0.8827, test_loss: 1.1263, test_f1: 0.5393
 epoch: 9, train_loss: 0.8642, test_loss: 1.1352, test_f1: 0.5417
 epoch: 10, train_loss: 0.8838, test_loss: 1.0517, test_f1: 0.5732
 epoch: 11, train_loss: 0.8439, test_loss: 1.0715, test_f1: 0.5901
 epoch: 12, train_loss: 0.8334, test_loss: 1.1512, test_f1: 0.5641
 epoch: 13, train_loss: 0.8143, test_loss: 1.2638, test_f1: 0.5130
 epoch: 14, train_loss: 0.8164, test_loss: 1.1296, test_f1: 0.5968
 epoch: 15, train_loss: 0.8119, test_loss: 1.0908, test_f1: 0.5763
 epoch: 16, train_loss: 0.7833, test_loss: 1.1559, test_f1: 0.5809
 epoch: 17, train_loss: 0.7905, test_loss: 1.1972, test_f1: 0.5500
 epoch: 18, train_loss: 0.8008, test_loss: 1.1440, test_f1: 0.5643
 epoch: 19, train_loss: 0.7856, test_loss: 1.0865, test_f1: 0.5981
 epoch: 20, train_loss: 0.7608, test_loss: 1.1684, test_f1: 0.5987
 epoch: 21, train_loss: 0.7482, test_loss: 1.2634, test_f1: 0.5780
 epoch: 22, train_loss: 0.7333, test_loss: 1.1056, test_f1: 0.6093
 epoch: 23, train_loss: 0.7218, test_loss: 1.2104, test_f1: 0.6106
 epoch: 24, train_loss: 0.7272, test_loss: 1.2630, test_f1: 0.5914
 epoch: 25, train_loss: 0.6951, test_loss: 1.1746, test_f1: 0.5649
 epoch: 26, train_loss: 0.6943, test_loss: 1.1440, test_f1: 0.6184
 epoch: 27, train_loss: 0.7156, test_loss: 1.2880, test_f1: 0.5878
 epoch: 28, train_loss: 0.6952, test_loss: 1.2185, test_f1: 0.5681
 epoch: 29, train_loss: 0.7006, test_loss: 1.1657, test_f1: 0.6091
 epoch: 30, train_loss: 0.6747, test_loss: 1.2981, test_f1: 0.6156
 epoch: 31, train_loss: 0.6469, test_loss: 1.3251, test_f1: 0.5825
 epoch: 32, train_loss: 0.6531, test_loss: 1.3622, test_f1: 0.5977
 epoch: 33, train_loss: 0.6372, test_loss: 1.1591, test_f1: 0.6584
 epoch: 34, train_loss: 0.6356, test_loss: 1.3315, test_f1: 0.6144
 epoch: 35, train_loss: 0.6207, test_loss: 1.3465, test_f1: 0.6065
 epoch: 36, train_loss: 0.5948, test_loss: 1.3695, test_f1: 0.5951
 epoch: 37, train_loss: 0.5944, test_loss: 1.4967, test_f1: 0.5958
 epoch: 38, train_loss: 0.6283, test_loss: 1.3292, test_f1: 0.6086
 epoch: 39, train_loss: 0.6040, test_loss: 1.2897, test_f1: 0.6242
 epoch: 40, train_loss: 0.5719, test_loss: 1.4568, test_f1: 0.6021
 epoch: 41, train_loss: 0.5690, test_loss: 1.5331, test_f1: 0.5866
 epoch: 42, train_loss: 0.5648, test_loss: 1.4371, test_f1: 0.6263
 epoch: 43, train_loss: 0.5378, test_loss: 1.4925, test_f1: 0.6181
 epoch: 44, train_loss: 0.5408, test_loss: 1.4768, test_f1: 0.5929
 epoch: 45, train_loss: 0.5605, test_loss: 1.2790, test_f1: 0.6041
 epoch: 46, train_loss: 0.5707, test_loss: 1.5586, test_f1: 0.6073
 epoch: 47, train_loss: 0.5283, test_loss: 1.6760, test_f1: 0.5882
 epoch: 48, train_loss: 0.5220, test_loss: 1.4666, test_f1: 0.6303
 epoch: 49, train_loss: 0.5071, test_loss: 1.5032, test_f1: 0.6097
 epoch: 50, train_loss: 0.4758, test_loss: 1.3986, test_f1: 0.6255
 epoch: 51, train_loss: 0.4588, test_loss: 1.7009, test_f1: 0.6144
 epoch: 52, train_loss: 0.4401, test_loss: 1.6294, test_f1: 0.6029
 epoch: 53, train_loss: 0.4413, test_loss: 1.5187, test_f1: 0.5955
 epoch: 54, train_loss: 0.4115, test_loss: 1.7067, test_f1: 0.6250
 epoch: 55, train_loss: 0.3999, test_loss: 1.7666, test_f1: 0.5876
 epoch: 56, train_loss: 0.4065, test_loss: 1.7676, test_f1: 0.5901
 epoch: 57, train_loss: 0.4010, test_loss: 1.9132, test_f1: 0.5773
 epoch: 58, train_loss: 0.4000, test_loss: 1.8878, test_f1: 0.6050
 epoch: 59, train_loss: 0.3934, test_loss: 1.8965, test_f1: 0.6076
 epoch: 60, train_loss: 0.3759, test_loss: 1.8761, test_f1: 0.6264
 epoch: 61, train_loss: 0.3968, test_loss: 2.0227, test_f1: 0.5970
 epoch: 62, train_loss: 0.3899, test_loss: 2.0006, test_f1: 0.5643
 epoch: 63, train_loss: 0.3638, test_loss: 2.0308, test_f1: 0.6183
 epoch: 64, train_loss: 0.3695, test_loss: 1.9781, test_f1: 0.6188
 epoch: 65, train_loss: 0.3645, test_loss: 1.8835, test_f1: 0.6116
 epoch: 66, train_loss: 0.3585, test_loss: 2.2266, test_f1: 0.5884
 epoch: 67, train_loss: 0.3507, test_loss: 2.2395, test_f1: 0.5994
 epoch: 68, train_loss: 0.3507, test_loss: 2.2919, test_f1: 0.5956
 epoch: 69, train_loss: 0.3338, test_loss: 2.1281, test_f1: 0.5654
 epoch: 70, train_loss: 0.3328, test_loss: 2.1864, test_f1: 0.6144
 epoch: 71, train_loss: 0.3539, test_loss: 2.4977, test_f1: 0.5874
 epoch: 72, train_loss: 0.3437, test_loss: 2.1399, test_f1: 0.5852
 epoch: 73, train_loss: 0.3179, test_loss: 2.3156, test_f1: 0.5965
 epoch: 74, train_loss: 0.3203, test_loss: 2.5494, test_f1: 0.5989
 epoch: 75, train_loss: 0.3280, test_loss: 2.2565, test_f1: 0.5811
 epoch: 76, train_loss: 0.3149, test_loss: 2.2390, test_f1: 0.6194
 epoch: 77, train_loss: 0.3021, test_loss: 2.2602, test_f1: 0.5851
 epoch: 78, train_loss: 0.3309, test_loss: 2.5470, test_f1: 0.5869
 epoch: 79, train_loss: 0.3038, test_loss: 2.3806, test_f1: 0.6058
 epoch: 80, train_loss: 0.3294, test_loss: 2.3559, test_f1: 0.5913
 epoch: 81, train_loss: 0.3238, test_loss: 2.5282, test_f1: 0.5964
 epoch: 82, train_loss: 0.3056, test_loss: 2.2080, test_f1: 0.6146
 epoch: 83, train_loss: 0.3074, test_loss: 2.4503, test_f1: 0.6100
 epoch: 84, train_loss: 0.2877, test_loss: 2.4756, test_f1: 0.6245
 epoch: 85, train_loss: 0.2864, test_loss: 2.3019, test_f1: 0.6311
 epoch: 86, train_loss: 0.2771, test_loss: 2.5983, test_f1: 0.6294
 epoch: 87, train_loss: 0.2968, test_loss: 2.4551, test_f1: 0.5868
 epoch: 88, train_loss: 0.2925, test_loss: 2.4324, test_f1: 0.6139
 epoch: 89, train_loss: 0.2839, test_loss: 2.2713, test_f1: 0.6383
 epoch: 90, train_loss: 0.2706, test_loss: 2.6539, test_f1: 0.6041
 epoch: 91, train_loss: 0.2591, test_loss: 2.5622, test_f1: 0.6069
 epoch: 92, train_loss: 0.2746, test_loss: 2.4626, test_f1: 0.6142
 epoch: 93, train_loss: 0.2647, test_loss: 2.5453, test_f1: 0.6004
 epoch: 94, train_loss: 0.2649, test_loss: 2.6544, test_f1: 0.5780
 epoch: 95, train_loss: 0.2667, test_loss: 2.3802, test_f1: 0.5957
 epoch: 96, train_loss: 0.2782, test_loss: 2.8969, test_f1: 0.5908
 epoch: 97, train_loss: 0.2765, test_loss: 2.5326, test_f1: 0.6314
 epoch: 98, train_loss: 0.2532, test_loss: 2.5564, test_f1: 0.6159
 epoch: 99, train_loss: 0.2728, test_loss: 2.5603, test_f1: 0.6049
##################ITERATION #6 ****************************************
 epoch: 0, train_loss: 1.2943, test_loss: 1.2884, test_f1: 0.2288
 epoch: 1, train_loss: 1.1000, test_loss: 1.1690, test_f1: 0.3240
 epoch: 2, train_loss: 1.0226, test_loss: 1.1534, test_f1: 0.4458
 epoch: 3, train_loss: 0.9921, test_loss: 1.1349, test_f1: 0.5353
 epoch: 4, train_loss: 0.9822, test_loss: 1.1076, test_f1: 0.5274
 epoch: 5, train_loss: 0.9578, test_loss: 1.0799, test_f1: 0.5152
 epoch: 6, train_loss: 0.9308, test_loss: 1.1837, test_f1: 0.5232
 epoch: 7, train_loss: 0.9209, test_loss: 1.1485, test_f1: 0.5405
 epoch: 8, train_loss: 0.8868, test_loss: 1.0529, test_f1: 0.5907
 epoch: 9, train_loss: 0.8632, test_loss: 1.1169, test_f1: 0.5686
 epoch: 10, train_loss: 0.8556, test_loss: 1.1177, test_f1: 0.5481
 epoch: 11, train_loss: 0.8613, test_loss: 1.0280, test_f1: 0.5828
 epoch: 12, train_loss: 0.8490, test_loss: 1.0813, test_f1: 0.5305
 epoch: 13, train_loss: 0.8453, test_loss: 1.0661, test_f1: 0.5722
 epoch: 14, train_loss: 0.8091, test_loss: 1.0788, test_f1: 0.5954
 epoch: 15, train_loss: 0.8078, test_loss: 1.0277, test_f1: 0.5664
 epoch: 16, train_loss: 0.7785, test_loss: 1.0975, test_f1: 0.5777
 epoch: 17, train_loss: 0.7764, test_loss: 0.9735, test_f1: 0.6024
 epoch: 18, train_loss: 0.7708, test_loss: 1.1230, test_f1: 0.5612
 epoch: 19, train_loss: 0.7672, test_loss: 1.1272, test_f1: 0.5696
 epoch: 20, train_loss: 0.7615, test_loss: 1.0784, test_f1: 0.5665
 epoch: 21, train_loss: 0.7344, test_loss: 0.9927, test_f1: 0.5966
 epoch: 22, train_loss: 0.7564, test_loss: 1.0906, test_f1: 0.6372
 epoch: 23, train_loss: 0.7258, test_loss: 1.0491, test_f1: 0.6536
 epoch: 24, train_loss: 0.7032, test_loss: 1.1341, test_f1: 0.5950
 epoch: 25, train_loss: 0.6940, test_loss: 1.1641, test_f1: 0.5162
 epoch: 26, train_loss: 0.7139, test_loss: 1.0649, test_f1: 0.6322
 epoch: 27, train_loss: 0.6974, test_loss: 1.3204, test_f1: 0.6116
 epoch: 28, train_loss: 0.6859, test_loss: 0.9722, test_f1: 0.5916
 epoch: 29, train_loss: 0.6544, test_loss: 1.1915, test_f1: 0.5986
 epoch: 30, train_loss: 0.6836, test_loss: 1.1150, test_f1: 0.6003
 epoch: 31, train_loss: 0.6385, test_loss: 1.2022, test_f1: 0.5824
 epoch: 32, train_loss: 0.6635, test_loss: 1.1290, test_f1: 0.6274
 epoch: 33, train_loss: 0.6704, test_loss: 1.1014, test_f1: 0.5941
 epoch: 34, train_loss: 0.6457, test_loss: 1.2107, test_f1: 0.6105
 epoch: 35, train_loss: 0.6018, test_loss: 1.2069, test_f1: 0.5963
 epoch: 36, train_loss: 0.6329, test_loss: 1.2744, test_f1: 0.6128
 epoch: 37, train_loss: 0.6010, test_loss: 1.2591, test_f1: 0.5904
 epoch: 38, train_loss: 0.6159, test_loss: 1.3864, test_f1: 0.6204
 epoch: 39, train_loss: 0.5853, test_loss: 1.2242, test_f1: 0.6274
 epoch: 40, train_loss: 0.5745, test_loss: 1.3790, test_f1: 0.5891
 epoch: 41, train_loss: 0.5821, test_loss: 1.4369, test_f1: 0.6467
 epoch: 42, train_loss: 0.5905, test_loss: 1.4019, test_f1: 0.5765
 epoch: 43, train_loss: 0.5610, test_loss: 1.3410, test_f1: 0.5996
 epoch: 44, train_loss: 0.5477, test_loss: 1.4149, test_f1: 0.6306
 epoch: 45, train_loss: 0.5480, test_loss: 1.3143, test_f1: 0.6180
 epoch: 46, train_loss: 0.5472, test_loss: 1.5393, test_f1: 0.6059
 epoch: 47, train_loss: 0.5165, test_loss: 1.5504, test_f1: 0.6114
 epoch: 48, train_loss: 0.5402, test_loss: 1.6807, test_f1: 0.6155
 epoch: 49, train_loss: 0.5464, test_loss: 1.7192, test_f1: 0.5971
 epoch: 50, train_loss: 0.5662, test_loss: 1.5901, test_f1: 0.6389
 epoch: 51, train_loss: 0.4998, test_loss: 1.4838, test_f1: 0.6443
 epoch: 52, train_loss: 0.4594, test_loss: 1.4291, test_f1: 0.6602
 epoch: 53, train_loss: 0.4586, test_loss: 1.5155, test_f1: 0.6131
 epoch: 54, train_loss: 0.4290, test_loss: 1.5334, test_f1: 0.6382
 epoch: 55, train_loss: 0.4048, test_loss: 1.4827, test_f1: 0.6241
 epoch: 56, train_loss: 0.4246, test_loss: 1.6100, test_f1: 0.6118
 epoch: 57, train_loss: 0.4093, test_loss: 1.6390, test_f1: 0.6409
 epoch: 58, train_loss: 0.4162, test_loss: 1.6021, test_f1: 0.6250
 epoch: 59, train_loss: 0.4246, test_loss: 1.7488, test_f1: 0.6503
 epoch: 60, train_loss: 0.3778, test_loss: 1.8041, test_f1: 0.6237
 epoch: 61, train_loss: 0.3761, test_loss: 1.7043, test_f1: 0.5984
 epoch: 62, train_loss: 0.3941, test_loss: 1.7384, test_f1: 0.6212
 epoch: 63, train_loss: 0.3630, test_loss: 1.8756, test_f1: 0.6077
 epoch: 64, train_loss: 0.3817, test_loss: 1.9072, test_f1: 0.6086
 epoch: 65, train_loss: 0.4009, test_loss: 1.7448, test_f1: 0.6379
 epoch: 66, train_loss: 0.3705, test_loss: 1.6594, test_f1: 0.6434
 epoch: 67, train_loss: 0.3776, test_loss: 1.7592, test_f1: 0.6224
 epoch: 68, train_loss: 0.3588, test_loss: 1.6868, test_f1: 0.6414
 epoch: 69, train_loss: 0.3453, test_loss: 1.9036, test_f1: 0.6273
 epoch: 70, train_loss: 0.4014, test_loss: 1.9597, test_f1: 0.5837
 epoch: 71, train_loss: 0.3435, test_loss: 2.0306, test_f1: 0.5999
 epoch: 72, train_loss: 0.3816, test_loss: 1.9310, test_f1: 0.6067
 epoch: 73, train_loss: 0.3346, test_loss: 1.8145, test_f1: 0.6304
 epoch: 74, train_loss: 0.3678, test_loss: 1.9111, test_f1: 0.6031
 epoch: 75, train_loss: 0.3600, test_loss: 1.8497, test_f1: 0.6093
 epoch: 76, train_loss: 0.3303, test_loss: 2.0967, test_f1: 0.6117
 epoch: 77, train_loss: 0.3186, test_loss: 1.9717, test_f1: 0.6352
 epoch: 78, train_loss: 0.3281, test_loss: 2.1792, test_f1: 0.5878
 epoch: 79, train_loss: 0.2970, test_loss: 1.9953, test_f1: 0.6115
 epoch: 80, train_loss: 0.3186, test_loss: 2.0725, test_f1: 0.6102
 epoch: 81, train_loss: 0.3023, test_loss: 1.8983, test_f1: 0.6267
 epoch: 82, train_loss: 0.3055, test_loss: 2.1486, test_f1: 0.5998
 epoch: 83, train_loss: 0.2963, test_loss: 2.4188, test_f1: 0.5925
 epoch: 84, train_loss: 0.2935, test_loss: 2.0628, test_f1: 0.6427
 epoch: 85, train_loss: 0.3152, test_loss: 2.3160, test_f1: 0.5913
 epoch: 86, train_loss: 0.3164, test_loss: 2.0360, test_f1: 0.6364
 epoch: 87, train_loss: 0.3012, test_loss: 2.0400, test_f1: 0.6446
 epoch: 88, train_loss: 0.2872, test_loss: 2.1230, test_f1: 0.6159
 epoch: 89, train_loss: 0.2827, test_loss: 2.3158, test_f1: 0.5837
 epoch: 90, train_loss: 0.2709, test_loss: 2.1732, test_f1: 0.6223
 epoch: 91, train_loss: 0.2845, test_loss: 2.2445, test_f1: 0.6076
 epoch: 92, train_loss: 0.2900, test_loss: 2.0296, test_f1: 0.6323
 epoch: 93, train_loss: 0.2622, test_loss: 2.0885, test_f1: 0.6012
 epoch: 94, train_loss: 0.2695, test_loss: 2.3475, test_f1: 0.6077
 epoch: 95, train_loss: 0.2571, test_loss: 2.0654, test_f1: 0.6065
 epoch: 96, train_loss: 0.2677, test_loss: 2.1036, test_f1: 0.6054
 epoch: 97, train_loss: 0.2443, test_loss: 2.2245, test_f1: 0.6386
 epoch: 98, train_loss: 0.2686, test_loss: 2.2975, test_f1: 0.6192
 epoch: 99, train_loss: 0.2664, test_loss: 2.3704, test_f1: 0.6207
##################ITERATION #7 ****************************************
 epoch: 0, train_loss: 1.3626, test_loss: 1.3014, test_f1: 0.1365
 epoch: 1, train_loss: 1.1580, test_loss: 1.3083, test_f1: 0.2559
 epoch: 2, train_loss: 1.0671, test_loss: 1.2726, test_f1: 0.4089
 epoch: 3, train_loss: 1.0190, test_loss: 1.1076, test_f1: 0.5196
 epoch: 4, train_loss: 0.9891, test_loss: 1.1262, test_f1: 0.5306
 epoch: 5, train_loss: 0.9713, test_loss: 1.0980, test_f1: 0.5188
 epoch: 6, train_loss: 0.9484, test_loss: 1.1141, test_f1: 0.5096
 epoch: 7, train_loss: 0.9464, test_loss: 1.0243, test_f1: 0.5732
 epoch: 8, train_loss: 0.8982, test_loss: 1.1044, test_f1: 0.5522
 epoch: 9, train_loss: 0.8897, test_loss: 1.1591, test_f1: 0.5282
 epoch: 10, train_loss: 0.8984, test_loss: 1.1597, test_f1: 0.5315
 epoch: 11, train_loss: 0.8520, test_loss: 1.1075, test_f1: 0.5523
 epoch: 12, train_loss: 0.8529, test_loss: 1.2387, test_f1: 0.5693
 epoch: 13, train_loss: 0.8730, test_loss: 1.0661, test_f1: 0.5661
 epoch: 14, train_loss: 0.8260, test_loss: 1.0255, test_f1: 0.5776
 epoch: 15, train_loss: 0.8380, test_loss: 1.1431, test_f1: 0.5629
 epoch: 16, train_loss: 0.8008, test_loss: 1.1592, test_f1: 0.5504
 epoch: 17, train_loss: 0.8202, test_loss: 1.2197, test_f1: 0.5874
 epoch: 18, train_loss: 0.7653, test_loss: 1.1308, test_f1: 0.5885
 epoch: 19, train_loss: 0.7685, test_loss: 1.2904, test_f1: 0.5946
 epoch: 20, train_loss: 0.7759, test_loss: 1.0605, test_f1: 0.6103
 epoch: 21, train_loss: 0.7602, test_loss: 1.1154, test_f1: 0.5711
 epoch: 22, train_loss: 0.7565, test_loss: 1.2692, test_f1: 0.5529
 epoch: 23, train_loss: 0.7364, test_loss: 1.2207, test_f1: 0.5854
 epoch: 24, train_loss: 0.7316, test_loss: 1.0912, test_f1: 0.6192
 epoch: 25, train_loss: 0.6988, test_loss: 1.2450, test_f1: 0.5579
 epoch: 26, train_loss: 0.7131, test_loss: 1.3543, test_f1: 0.5799
 epoch: 27, train_loss: 0.6648, test_loss: 1.2340, test_f1: 0.5927
 epoch: 28, train_loss: 0.6672, test_loss: 1.3187, test_f1: 0.5792
 epoch: 29, train_loss: 0.6764, test_loss: 1.2905, test_f1: 0.5687
 epoch: 30, train_loss: 0.6620, test_loss: 1.3964, test_f1: 0.5650
 epoch: 31, train_loss: 0.6522, test_loss: 1.3079, test_f1: 0.6022
 epoch: 32, train_loss: 0.6208, test_loss: 1.4826, test_f1: 0.5527
 epoch: 33, train_loss: 0.6256, test_loss: 1.5664, test_f1: 0.5809
 epoch: 34, train_loss: 0.6263, test_loss: 1.3654, test_f1: 0.6100
 epoch: 35, train_loss: 0.6134, test_loss: 1.3132, test_f1: 0.5650
 epoch: 36, train_loss: 0.5806, test_loss: 1.3785, test_f1: 0.6011
 epoch: 37, train_loss: 0.6125, test_loss: 1.4362, test_f1: 0.5600
 epoch: 38, train_loss: 0.6048, test_loss: 1.3706, test_f1: 0.6199
 epoch: 39, train_loss: 0.5787, test_loss: 1.7476, test_f1: 0.5742
 epoch: 40, train_loss: 0.6016, test_loss: 1.2907, test_f1: 0.6018
 epoch: 41, train_loss: 0.5650, test_loss: 1.3591, test_f1: 0.5911
 epoch: 42, train_loss: 0.5470, test_loss: 1.3718, test_f1: 0.5908
 epoch: 43, train_loss: 0.5707, test_loss: 1.4524, test_f1: 0.5225
 epoch: 44, train_loss: 0.5272, test_loss: 1.3568, test_f1: 0.5782
 epoch: 45, train_loss: 0.5352, test_loss: 1.3869, test_f1: 0.6057
 epoch: 46, train_loss: 0.5517, test_loss: 1.5479, test_f1: 0.5876
 epoch: 47, train_loss: 0.5435, test_loss: 1.5457, test_f1: 0.5231
 epoch: 48, train_loss: 0.5314, test_loss: 1.5229, test_f1: 0.5859
 epoch: 49, train_loss: 0.5219, test_loss: 1.3660, test_f1: 0.6325
 epoch: 50, train_loss: 0.5196, test_loss: 1.5159, test_f1: 0.5974
 epoch: 51, train_loss: 0.4497, test_loss: 1.5423, test_f1: 0.6077
 epoch: 52, train_loss: 0.4462, test_loss: 1.5319, test_f1: 0.5870
 epoch: 53, train_loss: 0.4147, test_loss: 1.6299, test_f1: 0.6075
 epoch: 54, train_loss: 0.4030, test_loss: 1.7333, test_f1: 0.6041
 epoch: 55, train_loss: 0.4078, test_loss: 1.7636, test_f1: 0.5917
 epoch: 56, train_loss: 0.3918, test_loss: 1.5576, test_f1: 0.6247
 epoch: 57, train_loss: 0.3672, test_loss: 1.6897, test_f1: 0.6087
 epoch: 58, train_loss: 0.3801, test_loss: 1.7595, test_f1: 0.5950
 epoch: 59, train_loss: 0.3570, test_loss: 1.8529, test_f1: 0.5920
 epoch: 60, train_loss: 0.3664, test_loss: 1.8699, test_f1: 0.5951
 epoch: 61, train_loss: 0.3821, test_loss: 1.7716, test_f1: 0.5594
 epoch: 62, train_loss: 0.3758, test_loss: 1.9681, test_f1: 0.5854
 epoch: 63, train_loss: 0.3728, test_loss: 1.9728, test_f1: 0.5706
 epoch: 64, train_loss: 0.3701, test_loss: 1.9477, test_f1: 0.5885
 epoch: 65, train_loss: 0.3661, test_loss: 1.8798, test_f1: 0.5969
 epoch: 66, train_loss: 0.3420, test_loss: 1.8840, test_f1: 0.5795
 epoch: 67, train_loss: 0.3494, test_loss: 2.0617, test_f1: 0.6041
 epoch: 68, train_loss: 0.3215, test_loss: 1.8696, test_f1: 0.5793
 epoch: 69, train_loss: 0.3320, test_loss: 1.9875, test_f1: 0.5925
 epoch: 70, train_loss: 0.3164, test_loss: 2.1532, test_f1: 0.5975
 epoch: 71, train_loss: 0.3235, test_loss: 2.0958, test_f1: 0.6061
 epoch: 72, train_loss: 0.3545, test_loss: 2.2237, test_f1: 0.5973
 epoch: 73, train_loss: 0.3302, test_loss: 2.1351, test_f1: 0.6024
 epoch: 74, train_loss: 0.3263, test_loss: 2.1949, test_f1: 0.5942
 epoch: 75, train_loss: 0.3124, test_loss: 2.2562, test_f1: 0.5713
 epoch: 76, train_loss: 0.3090, test_loss: 2.1567, test_f1: 0.6054
 epoch: 77, train_loss: 0.3115, test_loss: 2.1467, test_f1: 0.6120
 epoch: 78, train_loss: 0.2744, test_loss: 2.0618, test_f1: 0.6087
 epoch: 79, train_loss: 0.2721, test_loss: 2.0822, test_f1: 0.6175
 epoch: 80, train_loss: 0.2903, test_loss: 2.1269, test_f1: 0.6174
 epoch: 81, train_loss: 0.2807, test_loss: 2.3609, test_f1: 0.6051
 epoch: 82, train_loss: 0.3034, test_loss: 2.2710, test_f1: 0.6363
 epoch: 83, train_loss: 0.3013, test_loss: 2.3418, test_f1: 0.5814
 epoch: 84, train_loss: 0.3083, test_loss: 2.1803, test_f1: 0.5975
 epoch: 85, train_loss: 0.2923, test_loss: 2.0977, test_f1: 0.6148
 epoch: 86, train_loss: 0.2748, test_loss: 2.2906, test_f1: 0.5927
 epoch: 87, train_loss: 0.2532, test_loss: 2.5660, test_f1: 0.5756
 epoch: 88, train_loss: 0.2492, test_loss: 2.3855, test_f1: 0.6247
 epoch: 89, train_loss: 0.2457, test_loss: 2.6915, test_f1: 0.6074
 epoch: 90, train_loss: 0.2719, test_loss: 2.1383, test_f1: 0.6178
 epoch: 91, train_loss: 0.2807, test_loss: 2.4965, test_f1: 0.5688
 epoch: 92, train_loss: 0.2913, test_loss: 2.2704, test_f1: 0.6107
 epoch: 93, train_loss: 0.2987, test_loss: 2.3027, test_f1: 0.5864
 epoch: 94, train_loss: 0.2612, test_loss: 2.3139, test_f1: 0.6084
 epoch: 95, train_loss: 0.2400, test_loss: 2.5132, test_f1: 0.6096
 epoch: 96, train_loss: 0.2204, test_loss: 2.4521, test_f1: 0.6015
 epoch: 97, train_loss: 0.2633, test_loss: 2.4247, test_f1: 0.6032
 epoch: 98, train_loss: 0.2365, test_loss: 2.7241, test_f1: 0.5779
 epoch: 99, train_loss: 0.2307, test_loss: 2.5893, test_f1: 0.5999
##################ITERATION #8 ****************************************
 epoch: 0, train_loss: 1.3700, test_loss: 1.2702, test_f1: 0.1365
 epoch: 1, train_loss: 1.1251, test_loss: 1.2621, test_f1: 0.3171
 epoch: 2, train_loss: 1.0544, test_loss: 1.1475, test_f1: 0.4313
 epoch: 3, train_loss: 1.0003, test_loss: 1.0951, test_f1: 0.4748
 epoch: 4, train_loss: 0.9910, test_loss: 1.0762, test_f1: 0.5187
 epoch: 5, train_loss: 0.9576, test_loss: 1.1896, test_f1: 0.4857
 epoch: 6, train_loss: 0.9222, test_loss: 1.1226, test_f1: 0.5375
 epoch: 7, train_loss: 0.8907, test_loss: 1.0325, test_f1: 0.5580
 epoch: 8, train_loss: 0.8930, test_loss: 1.0259, test_f1: 0.5441
 epoch: 9, train_loss: 0.8642, test_loss: 1.1042, test_f1: 0.5444
 epoch: 10, train_loss: 0.8487, test_loss: 1.1024, test_f1: 0.5556
 epoch: 11, train_loss: 0.8267, test_loss: 1.1483, test_f1: 0.5646
 epoch: 12, train_loss: 0.8272, test_loss: 1.0913, test_f1: 0.5881
 epoch: 13, train_loss: 0.8488, test_loss: 1.0874, test_f1: 0.5840
 epoch: 14, train_loss: 0.8151, test_loss: 1.0353, test_f1: 0.5954
 epoch: 15, train_loss: 0.7934, test_loss: 1.1103, test_f1: 0.5989
 epoch: 16, train_loss: 0.7927, test_loss: 1.1593, test_f1: 0.5547
 epoch: 17, train_loss: 0.7712, test_loss: 1.1574, test_f1: 0.6050
 epoch: 18, train_loss: 0.7610, test_loss: 1.1294, test_f1: 0.5910
 epoch: 19, train_loss: 0.7437, test_loss: 1.2348, test_f1: 0.5720
 epoch: 20, train_loss: 0.7256, test_loss: 1.3644, test_f1: 0.5437
 epoch: 21, train_loss: 0.7387, test_loss: 1.1604, test_f1: 0.5847
 epoch: 22, train_loss: 0.7132, test_loss: 1.2293, test_f1: 0.5620
 epoch: 23, train_loss: 0.6993, test_loss: 1.1674, test_f1: 0.6037
 epoch: 24, train_loss: 0.7134, test_loss: 1.1232, test_f1: 0.5940
 epoch: 25, train_loss: 0.6897, test_loss: 1.1982, test_f1: 0.5663
 epoch: 26, train_loss: 0.6720, test_loss: 1.2735, test_f1: 0.5880
 epoch: 27, train_loss: 0.6780, test_loss: 1.1524, test_f1: 0.6393
 epoch: 28, train_loss: 0.6737, test_loss: 1.2892, test_f1: 0.5913
 epoch: 29, train_loss: 0.6593, test_loss: 1.3601, test_f1: 0.6080
 epoch: 30, train_loss: 0.6544, test_loss: 1.3353, test_f1: 0.6033
 epoch: 31, train_loss: 0.6284, test_loss: 1.2570, test_f1: 0.6199
 epoch: 32, train_loss: 0.6262, test_loss: 1.1980, test_f1: 0.6198
 epoch: 33, train_loss: 0.6586, test_loss: 1.4499, test_f1: 0.6167
 epoch: 34, train_loss: 0.6329, test_loss: 1.1904, test_f1: 0.6101
 epoch: 35, train_loss: 0.5760, test_loss: 1.3942, test_f1: 0.6462
 epoch: 36, train_loss: 0.5856, test_loss: 1.4035, test_f1: 0.6299
 epoch: 37, train_loss: 0.5983, test_loss: 1.4532, test_f1: 0.6162
 epoch: 38, train_loss: 0.5828, test_loss: 1.4012, test_f1: 0.5625
 epoch: 39, train_loss: 0.6157, test_loss: 1.3538, test_f1: 0.5985
 epoch: 40, train_loss: 0.5708, test_loss: 1.5205, test_f1: 0.6111
 epoch: 41, train_loss: 0.5693, test_loss: 1.3501, test_f1: 0.6095
 epoch: 42, train_loss: 0.5476, test_loss: 1.2934, test_f1: 0.6507
 epoch: 43, train_loss: 0.5572, test_loss: 1.5859, test_f1: 0.5983
 epoch: 44, train_loss: 0.5067, test_loss: 1.6749, test_f1: 0.5724
 epoch: 45, train_loss: 0.5147, test_loss: 1.5033, test_f1: 0.5942
 epoch: 46, train_loss: 0.5140, test_loss: 1.5883, test_f1: 0.5905
 epoch: 47, train_loss: 0.5431, test_loss: 1.5343, test_f1: 0.5835
 epoch: 48, train_loss: 0.5411, test_loss: 1.3916, test_f1: 0.6271
 epoch: 49, train_loss: 0.5070, test_loss: 1.4633, test_f1: 0.5882
 epoch: 50, train_loss: 0.5045, test_loss: 1.4408, test_f1: 0.6312
 epoch: 51, train_loss: 0.4648, test_loss: 1.5103, test_f1: 0.5943
 epoch: 52, train_loss: 0.4435, test_loss: 1.5495, test_f1: 0.5914
 epoch: 53, train_loss: 0.4343, test_loss: 1.6245, test_f1: 0.5900
 epoch: 54, train_loss: 0.4103, test_loss: 1.7817, test_f1: 0.6020
 epoch: 55, train_loss: 0.4194, test_loss: 1.9104, test_f1: 0.6096
 epoch: 56, train_loss: 0.3902, test_loss: 1.5988, test_f1: 0.5941
 epoch: 57, train_loss: 0.3956, test_loss: 1.6877, test_f1: 0.6076
 epoch: 58, train_loss: 0.3823, test_loss: 1.8549, test_f1: 0.6161
 epoch: 59, train_loss: 0.3962, test_loss: 1.6635, test_f1: 0.6295
 epoch: 60, train_loss: 0.3927, test_loss: 1.8054, test_f1: 0.6031
 epoch: 61, train_loss: 0.3678, test_loss: 1.9316, test_f1: 0.6014
 epoch: 62, train_loss: 0.3430, test_loss: 2.0175, test_f1: 0.5926
 epoch: 63, train_loss: 0.3748, test_loss: 2.1261, test_f1: 0.6004
 epoch: 64, train_loss: 0.3657, test_loss: 1.9597, test_f1: 0.5811
 epoch: 65, train_loss: 0.3532, test_loss: 1.9770, test_f1: 0.5862
 epoch: 66, train_loss: 0.3787, test_loss: 1.8647, test_f1: 0.6112
 epoch: 67, train_loss: 0.3787, test_loss: 2.1238, test_f1: 0.5907
 epoch: 68, train_loss: 0.3740, test_loss: 2.0190, test_f1: 0.5948
 epoch: 69, train_loss: 0.3517, test_loss: 2.2111, test_f1: 0.5912
 epoch: 70, train_loss: 0.3517, test_loss: 2.0924, test_f1: 0.6033
 epoch: 71, train_loss: 0.3460, test_loss: 2.3352, test_f1: 0.5988
 epoch: 72, train_loss: 0.3291, test_loss: 2.4060, test_f1: 0.6051
 epoch: 73, train_loss: 0.3422, test_loss: 2.0219, test_f1: 0.6169
 epoch: 74, train_loss: 0.3337, test_loss: 2.1396, test_f1: 0.6169
 epoch: 75, train_loss: 0.3231, test_loss: 2.3480, test_f1: 0.6085
 epoch: 76, train_loss: 0.3257, test_loss: 2.0026, test_f1: 0.5832
 epoch: 77, train_loss: 0.3128, test_loss: 2.5183, test_f1: 0.6425
 epoch: 78, train_loss: 0.3115, test_loss: 2.1821, test_f1: 0.5924
 epoch: 79, train_loss: 0.2992, test_loss: 2.4950, test_f1: 0.6080
 epoch: 80, train_loss: 0.2955, test_loss: 2.8045, test_f1: 0.5828
 epoch: 81, train_loss: 0.3004, test_loss: 2.4811, test_f1: 0.5899
 epoch: 82, train_loss: 0.3187, test_loss: 2.4504, test_f1: 0.6148
 epoch: 83, train_loss: 0.2958, test_loss: 2.6370, test_f1: 0.5807
 epoch: 84, train_loss: 0.2956, test_loss: 2.5982, test_f1: 0.5788
 epoch: 85, train_loss: 0.3195, test_loss: 2.2865, test_f1: 0.6228
 epoch: 86, train_loss: 0.2963, test_loss: 2.3892, test_f1: 0.6083
 epoch: 87, train_loss: 0.2975, test_loss: 2.3965, test_f1: 0.6033
 epoch: 88, train_loss: 0.2743, test_loss: 2.9242, test_f1: 0.6216
 epoch: 89, train_loss: 0.2878, test_loss: 2.6230, test_f1: 0.5971
 epoch: 90, train_loss: 0.2722, test_loss: 2.6378, test_f1: 0.5902
 epoch: 91, train_loss: 0.2623, test_loss: 2.6168, test_f1: 0.6212
 epoch: 92, train_loss: 0.2672, test_loss: 2.6132, test_f1: 0.6042
 epoch: 93, train_loss: 0.2608, test_loss: 2.5963, test_f1: 0.6089
 epoch: 94, train_loss: 0.2595, test_loss: 2.5495, test_f1: 0.6084
 epoch: 95, train_loss: 0.2645, test_loss: 2.7551, test_f1: 0.6048
 epoch: 96, train_loss: 0.2853, test_loss: 2.6210, test_f1: 0.6197
 epoch: 97, train_loss: 0.2642, test_loss: 2.5664, test_f1: 0.5938
 epoch: 98, train_loss: 0.2734, test_loss: 2.6773, test_f1: 0.5975
 epoch: 99, train_loss: 0.2599, test_loss: 2.6851, test_f1: 0.6001
##################ITERATION #9 ****************************************
 epoch: 0, train_loss: 1.4214, test_loss: 1.3288, test_f1: 0.1419
 epoch: 1, train_loss: 1.1327, test_loss: 1.1730, test_f1: 0.4080
 epoch: 2, train_loss: 1.0374, test_loss: 1.1504, test_f1: 0.4720
 epoch: 3, train_loss: 1.0437, test_loss: 1.1020, test_f1: 0.5020
 epoch: 4, train_loss: 1.0017, test_loss: 1.1271, test_f1: 0.5434
 epoch: 5, train_loss: 0.9620, test_loss: 1.0866, test_f1: 0.5461
 epoch: 6, train_loss: 0.9433, test_loss: 1.0789, test_f1: 0.5748
 epoch: 7, train_loss: 0.9392, test_loss: 1.0880, test_f1: 0.5563
 epoch: 8, train_loss: 0.9018, test_loss: 1.0660, test_f1: 0.5434
 epoch: 9, train_loss: 0.8916, test_loss: 1.0714, test_f1: 0.5511
 epoch: 10, train_loss: 0.8779, test_loss: 1.1887, test_f1: 0.5388
 epoch: 11, train_loss: 0.8673, test_loss: 1.0576, test_f1: 0.5869
 epoch: 12, train_loss: 0.8510, test_loss: 1.1081, test_f1: 0.5470
 epoch: 13, train_loss: 0.8586, test_loss: 1.0193, test_f1: 0.6191
 epoch: 14, train_loss: 0.8298, test_loss: 1.1604, test_f1: 0.5984
 epoch: 15, train_loss: 0.8363, test_loss: 1.0229, test_f1: 0.6059
 epoch: 16, train_loss: 0.8284, test_loss: 1.0928, test_f1: 0.5884
 epoch: 17, train_loss: 0.7811, test_loss: 1.0214, test_f1: 0.5880
 epoch: 18, train_loss: 0.7881, test_loss: 1.0735, test_f1: 0.5911
 epoch: 19, train_loss: 0.7822, test_loss: 1.1474, test_f1: 0.5950
 epoch: 20, train_loss: 0.7629, test_loss: 1.1923, test_f1: 0.5705
 epoch: 21, train_loss: 0.7725, test_loss: 1.1178, test_f1: 0.6028
 epoch: 22, train_loss: 0.7527, test_loss: 1.1416, test_f1: 0.6016
 epoch: 23, train_loss: 0.7268, test_loss: 1.1701, test_f1: 0.5835
 epoch: 24, train_loss: 0.7157, test_loss: 1.2438, test_f1: 0.5740
 epoch: 25, train_loss: 0.7162, test_loss: 1.1796, test_f1: 0.5633
 epoch: 26, train_loss: 0.7061, test_loss: 1.2325, test_f1: 0.5602
 epoch: 27, train_loss: 0.7270, test_loss: 1.1695, test_f1: 0.6032
 epoch: 28, train_loss: 0.7099, test_loss: 1.1766, test_f1: 0.6216
 epoch: 29, train_loss: 0.7004, test_loss: 1.2856, test_f1: 0.6058
 epoch: 30, train_loss: 0.6978, test_loss: 1.2380, test_f1: 0.5951
 epoch: 31, train_loss: 0.6790, test_loss: 1.1662, test_f1: 0.5974
 epoch: 32, train_loss: 0.6689, test_loss: 1.2004, test_f1: 0.6066
 epoch: 33, train_loss: 0.6550, test_loss: 1.3461, test_f1: 0.5659
 epoch: 34, train_loss: 0.6566, test_loss: 1.2826, test_f1: 0.5937
 epoch: 35, train_loss: 0.6443, test_loss: 1.3405, test_f1: 0.5996
 epoch: 36, train_loss: 0.6329, test_loss: 1.3467, test_f1: 0.5612
 epoch: 37, train_loss: 0.6210, test_loss: 1.4158, test_f1: 0.5835
 epoch: 38, train_loss: 0.6041, test_loss: 1.2804, test_f1: 0.6102
 epoch: 39, train_loss: 0.5899, test_loss: 1.3110, test_f1: 0.5950
 epoch: 40, train_loss: 0.6032, test_loss: 1.4023, test_f1: 0.5738
 epoch: 41, train_loss: 0.6655, test_loss: 1.3221, test_f1: 0.6043
 epoch: 42, train_loss: 0.6250, test_loss: 1.2188, test_f1: 0.6178
 epoch: 43, train_loss: 0.6038, test_loss: 1.3534, test_f1: 0.5851
 epoch: 44, train_loss: 0.5590, test_loss: 1.3932, test_f1: 0.5976
 epoch: 45, train_loss: 0.6037, test_loss: 1.4995, test_f1: 0.6222
 epoch: 46, train_loss: 0.5740, test_loss: 1.2337, test_f1: 0.6471
 epoch: 47, train_loss: 0.5872, test_loss: 1.2153, test_f1: 0.6116
 epoch: 48, train_loss: 0.5822, test_loss: 1.3535, test_f1: 0.6149
 epoch: 49, train_loss: 0.5492, test_loss: 1.3705, test_f1: 0.6528
 epoch: 50, train_loss: 0.5352, test_loss: 1.3709, test_f1: 0.6291
 epoch: 51, train_loss: 0.5012, test_loss: 1.4086, test_f1: 0.6417
 epoch: 52, train_loss: 0.4915, test_loss: 1.4186, test_f1: 0.6461
 epoch: 53, train_loss: 0.4654, test_loss: 1.3378, test_f1: 0.6486
 epoch: 54, train_loss: 0.4811, test_loss: 1.6458, test_f1: 0.5672
 epoch: 55, train_loss: 0.4545, test_loss: 1.6632, test_f1: 0.5870
 epoch: 56, train_loss: 0.4541, test_loss: 1.5413, test_f1: 0.6239
 epoch: 57, train_loss: 0.4652, test_loss: 1.5190, test_f1: 0.6117
 epoch: 58, train_loss: 0.4562, test_loss: 1.6430, test_f1: 0.5846
 epoch: 59, train_loss: 0.4427, test_loss: 1.6756, test_f1: 0.6107
 epoch: 60, train_loss: 0.4112, test_loss: 1.6150, test_f1: 0.5981
 epoch: 61, train_loss: 0.4215, test_loss: 1.7425, test_f1: 0.6083
 epoch: 62, train_loss: 0.4023, test_loss: 1.6405, test_f1: 0.5977
 epoch: 63, train_loss: 0.4027, test_loss: 1.8075, test_f1: 0.5820
 epoch: 64, train_loss: 0.4301, test_loss: 1.8262, test_f1: 0.6325
 epoch: 65, train_loss: 0.4110, test_loss: 1.8103, test_f1: 0.6255
 epoch: 66, train_loss: 0.4175, test_loss: 1.7214, test_f1: 0.6491
 epoch: 67, train_loss: 0.3931, test_loss: 1.7529, test_f1: 0.6226
 epoch: 68, train_loss: 0.3764, test_loss: 1.8312, test_f1: 0.6118
 epoch: 69, train_loss: 0.3892, test_loss: 1.8099, test_f1: 0.6270
 epoch: 70, train_loss: 0.3793, test_loss: 1.8516, test_f1: 0.6318
 epoch: 71, train_loss: 0.3914, test_loss: 1.8587, test_f1: 0.6251
 epoch: 72, train_loss: 0.3857, test_loss: 2.0904, test_f1: 0.5845
 epoch: 73, train_loss: 0.3933, test_loss: 2.1044, test_f1: 0.5969
 epoch: 74, train_loss: 0.3675, test_loss: 2.0414, test_f1: 0.6233
 epoch: 75, train_loss: 0.3868, test_loss: 2.0680, test_f1: 0.6123
 epoch: 76, train_loss: 0.3731, test_loss: 2.0653, test_f1: 0.5907
 epoch: 77, train_loss: 0.3699, test_loss: 2.0923, test_f1: 0.6063
 epoch: 78, train_loss: 0.3479, test_loss: 1.9235, test_f1: 0.6259
 epoch: 79, train_loss: 0.3677, test_loss: 2.0101, test_f1: 0.6015
 epoch: 80, train_loss: 0.3721, test_loss: 1.9693, test_f1: 0.6198
 epoch: 81, train_loss: 0.3558, test_loss: 2.0531, test_f1: 0.5949
 epoch: 82, train_loss: 0.3470, test_loss: 2.1821, test_f1: 0.6100
 epoch: 83, train_loss: 0.3464, test_loss: 2.1522, test_f1: 0.6192
 epoch: 84, train_loss: 0.3381, test_loss: 2.1281, test_f1: 0.6137
 epoch: 85, train_loss: 0.3402, test_loss: 2.2454, test_f1: 0.6130
 epoch: 86, train_loss: 0.3368, test_loss: 2.2220, test_f1: 0.6229
 epoch: 87, train_loss: 0.3318, test_loss: 2.2598, test_f1: 0.5940
 epoch: 88, train_loss: 0.3223, test_loss: 2.0808, test_f1: 0.6282
 epoch: 89, train_loss: 0.3279, test_loss: 2.1686, test_f1: 0.6116
 epoch: 90, train_loss: 0.3182, test_loss: 2.4160, test_f1: 0.5859
 epoch: 91, train_loss: 0.3402, test_loss: 2.3351, test_f1: 0.6108
 epoch: 92, train_loss: 0.3273, test_loss: 2.1637, test_f1: 0.6074
 epoch: 93, train_loss: 0.3174, test_loss: 2.3864, test_f1: 0.6064
 epoch: 94, train_loss: 0.2980, test_loss: 2.3217, test_f1: 0.6130
 epoch: 95, train_loss: 0.3173, test_loss: 2.2922, test_f1: 0.5972
 epoch: 96, train_loss: 0.3093, test_loss: 2.2493, test_f1: 0.5856
 epoch: 97, train_loss: 0.2983, test_loss: 2.1955, test_f1: 0.6316
 epoch: 98, train_loss: 0.3381, test_loss: 2.2494, test_f1: 0.6347
 epoch: 99, train_loss: 0.2950, test_loss: 2.2990, test_f1: 0.6087

Training completed in 674.93 seconds
Best F1: 0.6627 at epoch 31
Mean F1 across iterations: 0.6478  0.0123
========================FINAL RESULTS================================
FEGIN weighted F1: 0.6627  0.0123
python main.py --data ltspice_demos --representation component_net --model FEGIN --layers 5 --hiddens 64 --batch_size 64 --lr 0.001 --emb_size 512 --epochs 100 --save_appendix component_net_L5_H64_BS64_LR0.001_E512 --no_val
-----



STDERR:
  File "main.py", line 370, in <module>
    main()
  File "main.py", line 254, in main
    dataset = dataset_class(
  File "/home/philip/projects/ltspice_examples_code_repo/Circuit-Completion-Using-GNNs/component_classification_with_link_prediction_head/evaluation/FEGIN/kernel/circuit_datasets.py", line 15, in __init__
    self.data, self.slices = torch.load(self.processed_paths[0])
  File "/home/philip/.local/lib/python3.8/site-packages/torch/serialization.py", line 1040, in load
    warnings.warn(
  File "/usr/lib/python3.8/warnings.py", line 109, in _showwarnmsg
    sw(msg.message, msg.category, msg.filename, msg.lineno,
  File "main.py", line 47, in warn_with_traceback
    traceback.print_stack(file=log)
/home/philip/projects/ltspice_examples_code_repo/Circuit-Completion-Using-GNNs/component_classification_with_link_prediction_head/evaluation/FEGIN/kernel/circuit_datasets.py:15: FutureWarning: You are using `torch.load` with `weights_only=False` (the current default value), which uses the default pickle module implicitly. It is possible to construct malicious pickle data which will execute arbitrary code during unpickling (See https://github.com/pytorch/pytorch/blob/main/SECURITY.md#untrusted-models for more details). In a future release, the default value for `weights_only` will be flipped to `True`. This limits the functions that could be executed during unpickling. Arbitrary objects will no longer be allowed to be loaded via this mode unless they are explicitly allowlisted by the user via `torch.serialization.add_safe_globals`. We recommend you start setting `weights_only=True` for any use case where you don't have full control of the loaded file. Please open an issue on GitHub for any issues related to this experimental feature.
  self.data, self.slices = torch.load(self.processed_paths[0])
