STDOUT:
Results will be saved in /home/philip/projects/ltspice_examples_code_repo/Circuit-Completion-Using-GNNs/component_classification_with_link_prediction_head/evaluation/FEGIN/results/model_FEGIN_dataset_ltspice_examples
Command line input: python main.py --data ltspice_examples --representation component_pin_net --model FEGIN --layers 2 --hiddens 64 --batch_size 32 --lr 0.001 --emb_size 128 --epochs 100 --save_appendix component_pin_net_L2_H64_BS32_LR0.001_E128 --no_val
 is saved.
-----
ltspice_examples - FEGIN
Using 2 layers, 64 hidden units, h = 2
Loading component_pin_net representation dataset
ENTERED
Training FEGIN on component_pin_net representation
Train: 3558, Test: 846
##################ITERATION #0 ****************************************
 epoch: 0, train_loss: 1.1703, test_loss: 1.0098, test_f1: 0.4606
 epoch: 1, train_loss: 0.9933, test_loss: 0.9856, test_f1: 0.4948
 epoch: 2, train_loss: 0.9706, test_loss: 0.9417, test_f1: 0.4750
 epoch: 3, train_loss: 0.9550, test_loss: 0.9376, test_f1: 0.5032
 epoch: 4, train_loss: 0.9285, test_loss: 0.9012, test_f1: 0.5429
 epoch: 5, train_loss: 0.9232, test_loss: 0.8728, test_f1: 0.5118
 epoch: 6, train_loss: 0.9093, test_loss: 0.8729, test_f1: 0.5281
 epoch: 7, train_loss: 0.9016, test_loss: 0.8475, test_f1: 0.5488
 epoch: 8, train_loss: 0.8768, test_loss: 0.8488, test_f1: 0.5380
 epoch: 9, train_loss: 0.8625, test_loss: 0.8000, test_f1: 0.5678
 epoch: 10, train_loss: 0.8331, test_loss: 0.8253, test_f1: 0.5437
 epoch: 11, train_loss: 0.8237, test_loss: 0.9362, test_f1: 0.5062
 epoch: 12, train_loss: 0.8224, test_loss: 0.8631, test_f1: 0.5566
 epoch: 13, train_loss: 0.8120, test_loss: 0.8620, test_f1: 0.6050
 epoch: 14, train_loss: 0.7952, test_loss: 0.7952, test_f1: 0.5888
 epoch: 15, train_loss: 0.7686, test_loss: 0.7709, test_f1: 0.6307
 epoch: 16, train_loss: 0.7707, test_loss: 0.7699, test_f1: 0.5964
 epoch: 17, train_loss: 0.7531, test_loss: 0.7690, test_f1: 0.6224
 epoch: 18, train_loss: 0.7464, test_loss: 0.8050, test_f1: 0.6036
 epoch: 19, train_loss: 0.7275, test_loss: 0.8493, test_f1: 0.5865
 epoch: 20, train_loss: 0.7340, test_loss: 0.8115, test_f1: 0.6607
 epoch: 21, train_loss: 0.7013, test_loss: 0.8098, test_f1: 0.5998
 epoch: 22, train_loss: 0.7077, test_loss: 0.7988, test_f1: 0.6281
 epoch: 23, train_loss: 0.6835, test_loss: 0.8212, test_f1: 0.6415
 epoch: 24, train_loss: 0.6928, test_loss: 0.8162, test_f1: 0.6385
 epoch: 25, train_loss: 0.6712, test_loss: 0.8814, test_f1: 0.6271
 epoch: 26, train_loss: 0.6655, test_loss: 0.8512, test_f1: 0.5912
 epoch: 27, train_loss: 0.6758, test_loss: 0.8293, test_f1: 0.6178
 epoch: 28, train_loss: 0.6711, test_loss: 0.8416, test_f1: 0.6164
 epoch: 29, train_loss: 0.6571, test_loss: 0.8163, test_f1: 0.6584
 epoch: 30, train_loss: 0.6490, test_loss: 0.8380, test_f1: 0.6356
 epoch: 31, train_loss: 0.6338, test_loss: 0.8127, test_f1: 0.6122
 epoch: 32, train_loss: 0.6202, test_loss: 0.8304, test_f1: 0.6649
 epoch: 33, train_loss: 0.6145, test_loss: 0.8668, test_f1: 0.6236
 epoch: 34, train_loss: 0.6202, test_loss: 0.8723, test_f1: 0.6529
 epoch: 35, train_loss: 0.6266, test_loss: 0.8580, test_f1: 0.6705
 epoch: 36, train_loss: 0.5973, test_loss: 0.8347, test_f1: 0.6770
 epoch: 37, train_loss: 0.6012, test_loss: 0.8808, test_f1: 0.6448
 epoch: 38, train_loss: 0.5964, test_loss: 0.8329, test_f1: 0.6687
 epoch: 39, train_loss: 0.5988, test_loss: 0.9003, test_f1: 0.6458
 epoch: 40, train_loss: 0.5958, test_loss: 0.7912, test_f1: 0.6543
 epoch: 41, train_loss: 0.5949, test_loss: 0.8217, test_f1: 0.6746
 epoch: 42, train_loss: 0.5756, test_loss: 0.8416, test_f1: 0.6940
 epoch: 43, train_loss: 0.5801, test_loss: 0.8688, test_f1: 0.6557
 epoch: 44, train_loss: 0.5825, test_loss: 0.8010, test_f1: 0.6727
 epoch: 45, train_loss: 0.5561, test_loss: 0.8561, test_f1: 0.6608
 epoch: 46, train_loss: 0.5548, test_loss: 0.9122, test_f1: 0.6663
 epoch: 47, train_loss: 0.5517, test_loss: 0.8993, test_f1: 0.6491
 epoch: 48, train_loss: 0.5442, test_loss: 0.8677, test_f1: 0.6595
 epoch: 49, train_loss: 0.5677, test_loss: 1.0119, test_f1: 0.6287
 epoch: 50, train_loss: 0.5530, test_loss: 0.9037, test_f1: 0.6608
 epoch: 51, train_loss: 0.5168, test_loss: 0.8840, test_f1: 0.6511
 epoch: 52, train_loss: 0.5105, test_loss: 0.8919, test_f1: 0.6501
 epoch: 53, train_loss: 0.4900, test_loss: 0.9546, test_f1: 0.6731
 epoch: 54, train_loss: 0.4870, test_loss: 0.8760, test_f1: 0.6600
 epoch: 55, train_loss: 0.4899, test_loss: 0.9534, test_f1: 0.6659
 epoch: 56, train_loss: 0.4828, test_loss: 0.9517, test_f1: 0.6481
 epoch: 57, train_loss: 0.4778, test_loss: 0.9338, test_f1: 0.6708
 epoch: 58, train_loss: 0.4739, test_loss: 0.9441, test_f1: 0.6794
 epoch: 59, train_loss: 0.4726, test_loss: 0.9325, test_f1: 0.6780
 epoch: 60, train_loss: 0.4772, test_loss: 1.0130, test_f1: 0.6707
 epoch: 61, train_loss: 0.4647, test_loss: 0.9600, test_f1: 0.6748
 epoch: 62, train_loss: 0.4653, test_loss: 0.9910, test_f1: 0.6714
 epoch: 63, train_loss: 0.4722, test_loss: 1.0095, test_f1: 0.6696
 epoch: 64, train_loss: 0.4527, test_loss: 0.9968, test_f1: 0.6989
 epoch: 65, train_loss: 0.4466, test_loss: 0.9877, test_f1: 0.6802
 epoch: 66, train_loss: 0.4504, test_loss: 0.9927, test_f1: 0.6822
 epoch: 67, train_loss: 0.4503, test_loss: 0.9988, test_f1: 0.6845
 epoch: 68, train_loss: 0.4479, test_loss: 0.9948, test_f1: 0.6758
 epoch: 69, train_loss: 0.4542, test_loss: 0.9860, test_f1: 0.6932
 epoch: 70, train_loss: 0.4214, test_loss: 0.9827, test_f1: 0.6761
 epoch: 71, train_loss: 0.4417, test_loss: 1.0353, test_f1: 0.6745
 epoch: 72, train_loss: 0.4408, test_loss: 1.0521, test_f1: 0.6828
 epoch: 73, train_loss: 0.4378, test_loss: 1.0254, test_f1: 0.6836
 epoch: 74, train_loss: 0.4299, test_loss: 1.0598, test_f1: 0.6865
 epoch: 75, train_loss: 0.4441, test_loss: 1.0352, test_f1: 0.6800
 epoch: 76, train_loss: 0.4399, test_loss: 1.0768, test_f1: 0.6856
 epoch: 77, train_loss: 0.4279, test_loss: 1.0696, test_f1: 0.6879
 epoch: 78, train_loss: 0.4275, test_loss: 1.1261, test_f1: 0.6878
 epoch: 79, train_loss: 0.4361, test_loss: 1.1630, test_f1: 0.6752
 epoch: 80, train_loss: 0.4222, test_loss: 1.1483, test_f1: 0.6771
 epoch: 81, train_loss: 0.4248, test_loss: 1.0899, test_f1: 0.6625
 epoch: 82, train_loss: 0.4248, test_loss: 1.0708, test_f1: 0.6996
 epoch: 83, train_loss: 0.3973, test_loss: 1.1811, test_f1: 0.6754
 epoch: 84, train_loss: 0.4082, test_loss: 1.0770, test_f1: 0.6759
 epoch: 85, train_loss: 0.4104, test_loss: 1.1877, test_f1: 0.6633
 epoch: 86, train_loss: 0.4158, test_loss: 1.1695, test_f1: 0.6795
 epoch: 87, train_loss: 0.3962, test_loss: 1.1533, test_f1: 0.6690
 epoch: 88, train_loss: 0.3933, test_loss: 1.2223, test_f1: 0.6702
 epoch: 89, train_loss: 0.3877, test_loss: 1.1430, test_f1: 0.7027
 epoch: 90, train_loss: 0.4061, test_loss: 1.1925, test_f1: 0.6795
 epoch: 91, train_loss: 0.3896, test_loss: 1.2408, test_f1: 0.6846
 epoch: 92, train_loss: 0.3886, test_loss: 1.2353, test_f1: 0.6606
 epoch: 93, train_loss: 0.3794, test_loss: 1.2231, test_f1: 0.6919
 epoch: 94, train_loss: 0.3811, test_loss: 1.1635, test_f1: 0.6913
 epoch: 95, train_loss: 0.3874, test_loss: 1.1792, test_f1: 0.6656
 epoch: 96, train_loss: 0.3892, test_loss: 1.2206, test_f1: 0.6926
 epoch: 97, train_loss: 0.3718, test_loss: 1.1825, test_f1: 0.6773
 epoch: 98, train_loss: 0.3974, test_loss: 1.1717, test_f1: 0.6762
 epoch: 99, train_loss: 0.3855, test_loss: 1.2413, test_f1: 0.6850
##################ITERATION #1 ****************************************
 epoch: 0, train_loss: 1.0834, test_loss: 1.0342, test_f1: 0.4526
 epoch: 1, train_loss: 0.9673, test_loss: 0.9476, test_f1: 0.5051
 epoch: 2, train_loss: 0.9418, test_loss: 0.9528, test_f1: 0.5059
 epoch: 3, train_loss: 0.9226, test_loss: 0.9913, test_f1: 0.5127
 epoch: 4, train_loss: 0.8964, test_loss: 0.8713, test_f1: 0.5666
 epoch: 5, train_loss: 0.8774, test_loss: 0.8305, test_f1: 0.5563
 epoch: 6, train_loss: 0.8415, test_loss: 0.8513, test_f1: 0.5324
 epoch: 7, train_loss: 0.8489, test_loss: 0.8047, test_f1: 0.5821
 epoch: 8, train_loss: 0.8244, test_loss: 0.8057, test_f1: 0.5693
 epoch: 9, train_loss: 0.8058, test_loss: 0.8321, test_f1: 0.5813
 epoch: 10, train_loss: 0.8088, test_loss: 0.8111, test_f1: 0.5624
 epoch: 11, train_loss: 0.7722, test_loss: 0.8221, test_f1: 0.5738
 epoch: 12, train_loss: 0.7779, test_loss: 0.8380, test_f1: 0.5949
 epoch: 13, train_loss: 0.7677, test_loss: 0.7448, test_f1: 0.6353
 epoch: 14, train_loss: 0.7596, test_loss: 0.8559, test_f1: 0.5924
 epoch: 15, train_loss: 0.7453, test_loss: 0.8270, test_f1: 0.6094
 epoch: 16, train_loss: 0.7330, test_loss: 0.7516, test_f1: 0.6158
 epoch: 17, train_loss: 0.7359, test_loss: 0.8086, test_f1: 0.6424
 epoch: 18, train_loss: 0.7191, test_loss: 0.7803, test_f1: 0.6240
 epoch: 19, train_loss: 0.7200, test_loss: 0.8040, test_f1: 0.6219
 epoch: 20, train_loss: 0.7069, test_loss: 0.8272, test_f1: 0.6169
 epoch: 21, train_loss: 0.7018, test_loss: 0.7446, test_f1: 0.6475
 epoch: 22, train_loss: 0.6973, test_loss: 0.7264, test_f1: 0.6591
 epoch: 23, train_loss: 0.6982, test_loss: 0.7543, test_f1: 0.6129
 epoch: 24, train_loss: 0.6775, test_loss: 0.7266, test_f1: 0.6502
 epoch: 25, train_loss: 0.6769, test_loss: 0.8269, test_f1: 0.6213
 epoch: 26, train_loss: 0.6831, test_loss: 0.7148, test_f1: 0.6633
 epoch: 27, train_loss: 0.6593, test_loss: 0.7478, test_f1: 0.6399
 epoch: 28, train_loss: 0.6636, test_loss: 0.7565, test_f1: 0.6176
 epoch: 29, train_loss: 0.6528, test_loss: 0.7020, test_f1: 0.6563
 epoch: 30, train_loss: 0.6516, test_loss: 0.6859, test_f1: 0.6500
 epoch: 31, train_loss: 0.6420, test_loss: 0.7636, test_f1: 0.6247
 epoch: 32, train_loss: 0.6227, test_loss: 0.7078, test_f1: 0.6737
 epoch: 33, train_loss: 0.6281, test_loss: 0.7312, test_f1: 0.6427
 epoch: 34, train_loss: 0.6326, test_loss: 0.7585, test_f1: 0.6762
 epoch: 35, train_loss: 0.6338, test_loss: 0.7811, test_f1: 0.6653
 epoch: 36, train_loss: 0.5864, test_loss: 0.7055, test_f1: 0.6674
 epoch: 37, train_loss: 0.6054, test_loss: 0.7211, test_f1: 0.6594
 epoch: 38, train_loss: 0.6070, test_loss: 0.7932, test_f1: 0.6344
 epoch: 39, train_loss: 0.6057, test_loss: 0.7717, test_f1: 0.6457
 epoch: 40, train_loss: 0.5794, test_loss: 0.8184, test_f1: 0.6409
 epoch: 41, train_loss: 0.5622, test_loss: 0.8044, test_f1: 0.6591
 epoch: 42, train_loss: 0.5942, test_loss: 0.8874, test_f1: 0.6585
 epoch: 43, train_loss: 0.5831, test_loss: 0.7448, test_f1: 0.6832
 epoch: 44, train_loss: 0.5952, test_loss: 0.8712, test_f1: 0.6372
 epoch: 45, train_loss: 0.5778, test_loss: 0.8614, test_f1: 0.6584
 epoch: 46, train_loss: 0.5575, test_loss: 0.7590, test_f1: 0.6742
 epoch: 47, train_loss: 0.5670, test_loss: 0.8445, test_f1: 0.6534
 epoch: 48, train_loss: 0.5583, test_loss: 0.7818, test_f1: 0.6682
 epoch: 49, train_loss: 0.5500, test_loss: 0.8140, test_f1: 0.6863
 epoch: 50, train_loss: 0.5589, test_loss: 0.8077, test_f1: 0.6897
 epoch: 51, train_loss: 0.5172, test_loss: 0.8717, test_f1: 0.6887
 epoch: 52, train_loss: 0.4963, test_loss: 0.8704, test_f1: 0.6652
 epoch: 53, train_loss: 0.4953, test_loss: 0.8565, test_f1: 0.6704
 epoch: 54, train_loss: 0.4892, test_loss: 0.9173, test_f1: 0.6551
 epoch: 55, train_loss: 0.4974, test_loss: 0.9794, test_f1: 0.6894
 epoch: 56, train_loss: 0.4812, test_loss: 0.8889, test_f1: 0.6743
 epoch: 57, train_loss: 0.4729, test_loss: 0.9232, test_f1: 0.6787
 epoch: 58, train_loss: 0.4809, test_loss: 0.8460, test_f1: 0.6669
 epoch: 59, train_loss: 0.4852, test_loss: 0.9608, test_f1: 0.6785
 epoch: 60, train_loss: 0.4689, test_loss: 0.8692, test_f1: 0.6805
 epoch: 61, train_loss: 0.4821, test_loss: 0.9231, test_f1: 0.6952
 epoch: 62, train_loss: 0.4671, test_loss: 0.8980, test_f1: 0.7044
 epoch: 63, train_loss: 0.4727, test_loss: 0.8996, test_f1: 0.6875
 epoch: 64, train_loss: 0.4664, test_loss: 0.9478, test_f1: 0.6544
 epoch: 65, train_loss: 0.4594, test_loss: 0.9508, test_f1: 0.6679
 epoch: 66, train_loss: 0.4558, test_loss: 0.8624, test_f1: 0.6723
 epoch: 67, train_loss: 0.4539, test_loss: 0.9370, test_f1: 0.6789
 epoch: 68, train_loss: 0.4628, test_loss: 0.9093, test_f1: 0.6808
 epoch: 69, train_loss: 0.4462, test_loss: 0.9471, test_f1: 0.6798
 epoch: 70, train_loss: 0.4410, test_loss: 0.9259, test_f1: 0.6706
 epoch: 71, train_loss: 0.4311, test_loss: 1.0124, test_f1: 0.6911
 epoch: 72, train_loss: 0.4463, test_loss: 0.9365, test_f1: 0.6862
 epoch: 73, train_loss: 0.4289, test_loss: 1.0376, test_f1: 0.6857
 epoch: 74, train_loss: 0.4354, test_loss: 1.0360, test_f1: 0.7078
 epoch: 75, train_loss: 0.4330, test_loss: 0.9875, test_f1: 0.6989
 epoch: 76, train_loss: 0.4378, test_loss: 0.9519, test_f1: 0.6900
 epoch: 77, train_loss: 0.4253, test_loss: 1.0566, test_f1: 0.6821
 epoch: 78, train_loss: 0.4311, test_loss: 0.9801, test_f1: 0.6791
 epoch: 79, train_loss: 0.4259, test_loss: 1.0805, test_f1: 0.6756
 epoch: 80, train_loss: 0.4155, test_loss: 1.0283, test_f1: 0.6749
 epoch: 81, train_loss: 0.4127, test_loss: 0.9953, test_f1: 0.6891
 epoch: 82, train_loss: 0.4183, test_loss: 1.0000, test_f1: 0.6819
 epoch: 83, train_loss: 0.4113, test_loss: 1.1528, test_f1: 0.6480
 epoch: 84, train_loss: 0.4167, test_loss: 1.1197, test_f1: 0.6729
 epoch: 85, train_loss: 0.4177, test_loss: 1.1327, test_f1: 0.6731
 epoch: 86, train_loss: 0.4212, test_loss: 1.0645, test_f1: 0.7032
 epoch: 87, train_loss: 0.4033, test_loss: 1.0709, test_f1: 0.6882
 epoch: 88, train_loss: 0.4029, test_loss: 1.0333, test_f1: 0.7087
 epoch: 89, train_loss: 0.4184, test_loss: 1.1522, test_f1: 0.6892
 epoch: 90, train_loss: 0.4177, test_loss: 1.0920, test_f1: 0.6916
 epoch: 91, train_loss: 0.4090, test_loss: 1.0577, test_f1: 0.6842
 epoch: 92, train_loss: 0.4171, test_loss: 1.0962, test_f1: 0.6866
 epoch: 93, train_loss: 0.4014, test_loss: 1.0832, test_f1: 0.6706
 epoch: 94, train_loss: 0.4006, test_loss: 1.1401, test_f1: 0.6794
 epoch: 95, train_loss: 0.4012, test_loss: 1.0375, test_f1: 0.6915
 epoch: 96, train_loss: 0.3967, test_loss: 1.1239, test_f1: 0.6738
 epoch: 97, train_loss: 0.3908, test_loss: 1.0920, test_f1: 0.6882
 epoch: 98, train_loss: 0.3928, test_loss: 1.1528, test_f1: 0.6878
 epoch: 99, train_loss: 0.3946, test_loss: 1.1889, test_f1: 0.6722
##################ITERATION #2 ****************************************
 epoch: 0, train_loss: 1.0852, test_loss: 0.9181, test_f1: 0.5131
 epoch: 1, train_loss: 0.9680, test_loss: 0.9619, test_f1: 0.5076
 epoch: 2, train_loss: 0.9343, test_loss: 0.9318, test_f1: 0.5198
 epoch: 3, train_loss: 0.9145, test_loss: 0.8922, test_f1: 0.5485
 epoch: 4, train_loss: 0.8868, test_loss: 0.8732, test_f1: 0.5023
 epoch: 5, train_loss: 0.8848, test_loss: 0.8431, test_f1: 0.5604
 epoch: 6, train_loss: 0.8553, test_loss: 0.8627, test_f1: 0.5520
 epoch: 7, train_loss: 0.8417, test_loss: 0.8622, test_f1: 0.6035
 epoch: 8, train_loss: 0.8213, test_loss: 0.8118, test_f1: 0.6451
 epoch: 9, train_loss: 0.8169, test_loss: 0.8661, test_f1: 0.6088
 epoch: 10, train_loss: 0.8076, test_loss: 0.8133, test_f1: 0.6433
 epoch: 11, train_loss: 0.7988, test_loss: 0.7483, test_f1: 0.6687
 epoch: 12, train_loss: 0.7837, test_loss: 0.7994, test_f1: 0.6461
 epoch: 13, train_loss: 0.7647, test_loss: 0.7929, test_f1: 0.6123
 epoch: 14, train_loss: 0.7596, test_loss: 0.7832, test_f1: 0.6359
 epoch: 15, train_loss: 0.7423, test_loss: 0.7690, test_f1: 0.6546
 epoch: 16, train_loss: 0.7320, test_loss: 0.7924, test_f1: 0.6444
 epoch: 17, train_loss: 0.7010, test_loss: 0.8280, test_f1: 0.6218
 epoch: 18, train_loss: 0.7190, test_loss: 0.7116, test_f1: 0.6687
 epoch: 19, train_loss: 0.7118, test_loss: 0.7611, test_f1: 0.6507
 epoch: 20, train_loss: 0.6964, test_loss: 0.7974, test_f1: 0.6678
 epoch: 21, train_loss: 0.6859, test_loss: 0.7991, test_f1: 0.6612
 epoch: 22, train_loss: 0.6881, test_loss: 0.7973, test_f1: 0.6535
 epoch: 23, train_loss: 0.6867, test_loss: 0.8467, test_f1: 0.6289
 epoch: 24, train_loss: 0.6789, test_loss: 0.8485, test_f1: 0.6280
 epoch: 25, train_loss: 0.6517, test_loss: 0.8307, test_f1: 0.6653
 epoch: 26, train_loss: 0.6629, test_loss: 0.8773, test_f1: 0.6434
 epoch: 27, train_loss: 0.6464, test_loss: 0.8549, test_f1: 0.6477
 epoch: 28, train_loss: 0.6392, test_loss: 0.8494, test_f1: 0.6451
 epoch: 29, train_loss: 0.6312, test_loss: 0.8077, test_f1: 0.6755
 epoch: 30, train_loss: 0.6365, test_loss: 0.8471, test_f1: 0.6627
 epoch: 31, train_loss: 0.6460, test_loss: 0.8205, test_f1: 0.6510
 epoch: 32, train_loss: 0.6325, test_loss: 0.8720, test_f1: 0.6307
 epoch: 33, train_loss: 0.6326, test_loss: 0.8539, test_f1: 0.6780
 epoch: 34, train_loss: 0.6135, test_loss: 0.8329, test_f1: 0.6535
 epoch: 35, train_loss: 0.6082, test_loss: 0.8327, test_f1: 0.6738
 epoch: 36, train_loss: 0.6001, test_loss: 0.8800, test_f1: 0.6479
 epoch: 37, train_loss: 0.6000, test_loss: 0.9104, test_f1: 0.6570
 epoch: 38, train_loss: 0.5877, test_loss: 0.8535, test_f1: 0.6559
 epoch: 39, train_loss: 0.5759, test_loss: 0.8537, test_f1: 0.6813
 epoch: 40, train_loss: 0.5772, test_loss: 0.8957, test_f1: 0.6543
 epoch: 41, train_loss: 0.5898, test_loss: 0.8871, test_f1: 0.6664
 epoch: 42, train_loss: 0.5827, test_loss: 0.8401, test_f1: 0.6679
 epoch: 43, train_loss: 0.5654, test_loss: 0.8909, test_f1: 0.6772
 epoch: 44, train_loss: 0.5591, test_loss: 0.8711, test_f1: 0.6496
 epoch: 45, train_loss: 0.5684, test_loss: 0.9266, test_f1: 0.6736
 epoch: 46, train_loss: 0.5580, test_loss: 0.8656, test_f1: 0.6606
 epoch: 47, train_loss: 0.5718, test_loss: 0.8887, test_f1: 0.6669
 epoch: 48, train_loss: 0.5475, test_loss: 0.8930, test_f1: 0.6682
 epoch: 49, train_loss: 0.5392, test_loss: 0.8626, test_f1: 0.6883
 epoch: 50, train_loss: 0.5485, test_loss: 0.8495, test_f1: 0.6931
 epoch: 51, train_loss: 0.5169, test_loss: 0.8528, test_f1: 0.7020
 epoch: 52, train_loss: 0.4920, test_loss: 0.9638, test_f1: 0.6714
 epoch: 53, train_loss: 0.4959, test_loss: 0.9248, test_f1: 0.6697
 epoch: 54, train_loss: 0.4825, test_loss: 0.9440, test_f1: 0.6797
 epoch: 55, train_loss: 0.4830, test_loss: 0.9221, test_f1: 0.6729
 epoch: 56, train_loss: 0.4724, test_loss: 0.9035, test_f1: 0.6720
 epoch: 57, train_loss: 0.4907, test_loss: 0.9603, test_f1: 0.6755
 epoch: 58, train_loss: 0.4842, test_loss: 0.9190, test_f1: 0.6853
 epoch: 59, train_loss: 0.4691, test_loss: 0.9747, test_f1: 0.6874
 epoch: 60, train_loss: 0.4704, test_loss: 1.0154, test_f1: 0.6896
 epoch: 61, train_loss: 0.4721, test_loss: 1.0325, test_f1: 0.6859
 epoch: 62, train_loss: 0.4607, test_loss: 0.9673, test_f1: 0.6775
 epoch: 63, train_loss: 0.4361, test_loss: 0.9938, test_f1: 0.6751
 epoch: 64, train_loss: 0.4479, test_loss: 1.0139, test_f1: 0.6868
 epoch: 65, train_loss: 0.4356, test_loss: 1.0833, test_f1: 0.6681
 epoch: 66, train_loss: 0.4287, test_loss: 1.0606, test_f1: 0.6826
 epoch: 67, train_loss: 0.4314, test_loss: 0.9850, test_f1: 0.6853
 epoch: 68, train_loss: 0.4554, test_loss: 1.0738, test_f1: 0.6748
 epoch: 69, train_loss: 0.4403, test_loss: 1.0163, test_f1: 0.6584
 epoch: 70, train_loss: 0.4460, test_loss: 1.0405, test_f1: 0.6824
 epoch: 71, train_loss: 0.4460, test_loss: 1.0677, test_f1: 0.6712
 epoch: 72, train_loss: 0.4393, test_loss: 1.0862, test_f1: 0.6548
 epoch: 73, train_loss: 0.4233, test_loss: 1.0827, test_f1: 0.6834
 epoch: 74, train_loss: 0.4520, test_loss: 1.0971, test_f1: 0.6955
 epoch: 75, train_loss: 0.4382, test_loss: 1.0732, test_f1: 0.6758
 epoch: 76, train_loss: 0.4092, test_loss: 1.0889, test_f1: 0.6804
 epoch: 77, train_loss: 0.4158, test_loss: 1.1246, test_f1: 0.6862
 epoch: 78, train_loss: 0.4273, test_loss: 1.0774, test_f1: 0.6674
 epoch: 79, train_loss: 0.3993, test_loss: 1.1551, test_f1: 0.6448
 epoch: 80, train_loss: 0.4284, test_loss: 1.0847, test_f1: 0.6736
 epoch: 81, train_loss: 0.4071, test_loss: 1.1251, test_f1: 0.6696
 epoch: 82, train_loss: 0.4170, test_loss: 1.0786, test_f1: 0.6689
 epoch: 83, train_loss: 0.4106, test_loss: 1.1097, test_f1: 0.6705
 epoch: 84, train_loss: 0.4257, test_loss: 1.0726, test_f1: 0.6699
 epoch: 85, train_loss: 0.4147, test_loss: 1.0864, test_f1: 0.6808
 epoch: 86, train_loss: 0.4137, test_loss: 1.1821, test_f1: 0.6593
 epoch: 87, train_loss: 0.3917, test_loss: 1.1410, test_f1: 0.6710
 epoch: 88, train_loss: 0.3958, test_loss: 1.1471, test_f1: 0.6877
 epoch: 89, train_loss: 0.3882, test_loss: 1.1507, test_f1: 0.6837
 epoch: 90, train_loss: 0.3809, test_loss: 1.1333, test_f1: 0.6838
 epoch: 91, train_loss: 0.3713, test_loss: 1.2226, test_f1: 0.6686
 epoch: 92, train_loss: 0.3993, test_loss: 1.1189, test_f1: 0.6877
 epoch: 93, train_loss: 0.4055, test_loss: 1.2607, test_f1: 0.6589
 epoch: 94, train_loss: 0.3896, test_loss: 1.0870, test_f1: 0.6935
 epoch: 95, train_loss: 0.3759, test_loss: 1.1797, test_f1: 0.6748
 epoch: 96, train_loss: 0.3690, test_loss: 1.1771, test_f1: 0.6787
 epoch: 97, train_loss: 0.3923, test_loss: 1.2802, test_f1: 0.6792
 epoch: 98, train_loss: 0.3832, test_loss: 1.1623, test_f1: 0.6823
 epoch: 99, train_loss: 0.3640, test_loss: 1.2159, test_f1: 0.6947
##################ITERATION #3 ****************************************
 epoch: 0, train_loss: 1.1733, test_loss: 0.9738, test_f1: 0.4755
 epoch: 1, train_loss: 0.9809, test_loss: 0.9986, test_f1: 0.5473
 epoch: 2, train_loss: 0.9524, test_loss: 0.8929, test_f1: 0.5550
 epoch: 3, train_loss: 0.9304, test_loss: 0.8520, test_f1: 0.5788
 epoch: 4, train_loss: 0.9142, test_loss: 0.8340, test_f1: 0.5510
 epoch: 5, train_loss: 0.8870, test_loss: 0.8605, test_f1: 0.5556
 epoch: 6, train_loss: 0.8604, test_loss: 0.8707, test_f1: 0.5591
 epoch: 7, train_loss: 0.8475, test_loss: 0.8371, test_f1: 0.5749
 epoch: 8, train_loss: 0.8440, test_loss: 0.8358, test_f1: 0.6177
 epoch: 9, train_loss: 0.8217, test_loss: 0.8212, test_f1: 0.6403
 epoch: 10, train_loss: 0.8158, test_loss: 0.7920, test_f1: 0.6418
 epoch: 11, train_loss: 0.8042, test_loss: 0.7822, test_f1: 0.6170
 epoch: 12, train_loss: 0.8008, test_loss: 0.8035, test_f1: 0.6127
 epoch: 13, train_loss: 0.7973, test_loss: 0.8065, test_f1: 0.6382
 epoch: 14, train_loss: 0.7897, test_loss: 0.7646, test_f1: 0.6352
 epoch: 15, train_loss: 0.7664, test_loss: 0.7961, test_f1: 0.6772
 epoch: 16, train_loss: 0.7732, test_loss: 0.7713, test_f1: 0.6530
 epoch: 17, train_loss: 0.7385, test_loss: 0.8128, test_f1: 0.6416
 epoch: 18, train_loss: 0.7474, test_loss: 0.8074, test_f1: 0.6127
 epoch: 19, train_loss: 0.7289, test_loss: 0.7681, test_f1: 0.6421
 epoch: 20, train_loss: 0.7100, test_loss: 0.8323, test_f1: 0.6412
 epoch: 21, train_loss: 0.7246, test_loss: 0.8274, test_f1: 0.6455
 epoch: 22, train_loss: 0.7091, test_loss: 0.8079, test_f1: 0.6520
 epoch: 23, train_loss: 0.6910, test_loss: 0.7991, test_f1: 0.6556
 epoch: 24, train_loss: 0.6969, test_loss: 0.7900, test_f1: 0.6449
 epoch: 25, train_loss: 0.6906, test_loss: 0.7535, test_f1: 0.6622
 epoch: 26, train_loss: 0.6728, test_loss: 0.8344, test_f1: 0.6264
 epoch: 27, train_loss: 0.6795, test_loss: 0.8161, test_f1: 0.6429
 epoch: 28, train_loss: 0.6840, test_loss: 0.8322, test_f1: 0.6321
 epoch: 29, train_loss: 0.6527, test_loss: 0.8216, test_f1: 0.6393
 epoch: 30, train_loss: 0.6511, test_loss: 0.7854, test_f1: 0.6390
 epoch: 31, train_loss: 0.6492, test_loss: 0.8289, test_f1: 0.6403
 epoch: 32, train_loss: 0.6373, test_loss: 0.8379, test_f1: 0.6595
 epoch: 33, train_loss: 0.6332, test_loss: 0.7982, test_f1: 0.6463
 epoch: 34, train_loss: 0.6282, test_loss: 0.8420, test_f1: 0.6499
 epoch: 35, train_loss: 0.6163, test_loss: 0.8208, test_f1: 0.6759
 epoch: 36, train_loss: 0.6190, test_loss: 0.8109, test_f1: 0.6411
 epoch: 37, train_loss: 0.6053, test_loss: 0.8307, test_f1: 0.6626
 epoch: 38, train_loss: 0.6034, test_loss: 0.8053, test_f1: 0.6340
 epoch: 39, train_loss: 0.6096, test_loss: 0.7844, test_f1: 0.6574
 epoch: 40, train_loss: 0.6055, test_loss: 0.8817, test_f1: 0.6513
 epoch: 41, train_loss: 0.5934, test_loss: 0.8530, test_f1: 0.6567
 epoch: 42, train_loss: 0.6002, test_loss: 0.8853, test_f1: 0.6484
 epoch: 43, train_loss: 0.5756, test_loss: 0.8706, test_f1: 0.6533
 epoch: 44, train_loss: 0.5761, test_loss: 0.8327, test_f1: 0.6551
 epoch: 45, train_loss: 0.5711, test_loss: 0.8686, test_f1: 0.6549
 epoch: 46, train_loss: 0.5722, test_loss: 0.8059, test_f1: 0.6821
 epoch: 47, train_loss: 0.5657, test_loss: 0.8878, test_f1: 0.6610
 epoch: 48, train_loss: 0.5739, test_loss: 0.8655, test_f1: 0.6635
 epoch: 49, train_loss: 0.5421, test_loss: 0.8668, test_f1: 0.6592
 epoch: 50, train_loss: 0.5567, test_loss: 0.8473, test_f1: 0.6545
 epoch: 51, train_loss: 0.5137, test_loss: 0.8708, test_f1: 0.6726
 epoch: 52, train_loss: 0.4913, test_loss: 0.8480, test_f1: 0.6593
 epoch: 53, train_loss: 0.5094, test_loss: 0.8715, test_f1: 0.6740
 epoch: 54, train_loss: 0.4916, test_loss: 0.9257, test_f1: 0.6642
 epoch: 55, train_loss: 0.4817, test_loss: 0.9475, test_f1: 0.6672
 epoch: 56, train_loss: 0.4873, test_loss: 0.8792, test_f1: 0.6614
 epoch: 57, train_loss: 0.4882, test_loss: 0.9210, test_f1: 0.6602
 epoch: 58, train_loss: 0.4856, test_loss: 0.8935, test_f1: 0.6581
 epoch: 59, train_loss: 0.4820, test_loss: 0.8694, test_f1: 0.6764
 epoch: 60, train_loss: 0.4878, test_loss: 0.9496, test_f1: 0.6479
 epoch: 61, train_loss: 0.4852, test_loss: 0.9282, test_f1: 0.6716
 epoch: 62, train_loss: 0.4869, test_loss: 0.9095, test_f1: 0.6785
 epoch: 63, train_loss: 0.4613, test_loss: 0.9142, test_f1: 0.6662
 epoch: 64, train_loss: 0.4641, test_loss: 0.9704, test_f1: 0.6503
 epoch: 65, train_loss: 0.4533, test_loss: 0.9890, test_f1: 0.6583
 epoch: 66, train_loss: 0.4669, test_loss: 0.8756, test_f1: 0.6687
 epoch: 67, train_loss: 0.4651, test_loss: 0.9975, test_f1: 0.6494
 epoch: 68, train_loss: 0.4545, test_loss: 0.9905, test_f1: 0.6646
 epoch: 69, train_loss: 0.4521, test_loss: 0.9134, test_f1: 0.6786
 epoch: 70, train_loss: 0.4722, test_loss: 0.9554, test_f1: 0.6560
 epoch: 71, train_loss: 0.4578, test_loss: 0.8801, test_f1: 0.6670
 epoch: 72, train_loss: 0.4308, test_loss: 0.9787, test_f1: 0.6519
 epoch: 73, train_loss: 0.4511, test_loss: 0.9369, test_f1: 0.6627
 epoch: 74, train_loss: 0.4412, test_loss: 0.9589, test_f1: 0.6681
 epoch: 75, train_loss: 0.4318, test_loss: 0.9735, test_f1: 0.6660
 epoch: 76, train_loss: 0.4426, test_loss: 1.0085, test_f1: 0.6501
 epoch: 77, train_loss: 0.4440, test_loss: 1.0090, test_f1: 0.6714
 epoch: 78, train_loss: 0.4253, test_loss: 0.9642, test_f1: 0.6675
 epoch: 79, train_loss: 0.4367, test_loss: 0.9445, test_f1: 0.6566
 epoch: 80, train_loss: 0.4181, test_loss: 0.9592, test_f1: 0.6752
 epoch: 81, train_loss: 0.4519, test_loss: 1.0387, test_f1: 0.6615
 epoch: 82, train_loss: 0.4416, test_loss: 0.9789, test_f1: 0.6527
 epoch: 83, train_loss: 0.4339, test_loss: 1.0218, test_f1: 0.6635
 epoch: 84, train_loss: 0.4267, test_loss: 0.9408, test_f1: 0.6788
 epoch: 85, train_loss: 0.4121, test_loss: 0.9868, test_f1: 0.6805
 epoch: 86, train_loss: 0.4280, test_loss: 0.9727, test_f1: 0.6697
 epoch: 87, train_loss: 0.4210, test_loss: 0.9616, test_f1: 0.6889
 epoch: 88, train_loss: 0.4116, test_loss: 0.9651, test_f1: 0.6787
 epoch: 89, train_loss: 0.4173, test_loss: 0.9754, test_f1: 0.6851
 epoch: 90, train_loss: 0.3997, test_loss: 0.9855, test_f1: 0.6556
 epoch: 91, train_loss: 0.4034, test_loss: 1.0425, test_f1: 0.6835
 epoch: 92, train_loss: 0.4185, test_loss: 1.0203, test_f1: 0.6732
 epoch: 93, train_loss: 0.3850, test_loss: 1.0720, test_f1: 0.6743
 epoch: 94, train_loss: 0.4031, test_loss: 0.9999, test_f1: 0.6839
 epoch: 95, train_loss: 0.4055, test_loss: 1.0361, test_f1: 0.6646
 epoch: 96, train_loss: 0.3988, test_loss: 1.0071, test_f1: 0.6695
 epoch: 97, train_loss: 0.3980, test_loss: 1.0378, test_f1: 0.6640
 epoch: 98, train_loss: 0.4026, test_loss: 1.0323, test_f1: 0.6696
 epoch: 99, train_loss: 0.3885, test_loss: 0.9867, test_f1: 0.6730
##################ITERATION #4 ****************************************
 epoch: 0, train_loss: 1.1970, test_loss: 1.0367, test_f1: 0.4927
 epoch: 1, train_loss: 0.9883, test_loss: 0.9946, test_f1: 0.5316
 epoch: 2, train_loss: 0.9531, test_loss: 0.9718, test_f1: 0.5137
 epoch: 3, train_loss: 0.9227, test_loss: 0.9381, test_f1: 0.5032
 epoch: 4, train_loss: 0.9155, test_loss: 0.9218, test_f1: 0.5039
 epoch: 5, train_loss: 0.8843, test_loss: 0.8992, test_f1: 0.5238
 epoch: 6, train_loss: 0.8697, test_loss: 0.8411, test_f1: 0.5570
 epoch: 7, train_loss: 0.8511, test_loss: 0.8368, test_f1: 0.5528
 epoch: 8, train_loss: 0.8420, test_loss: 0.8070, test_f1: 0.5713
 epoch: 9, train_loss: 0.8409, test_loss: 0.7904, test_f1: 0.5776
 epoch: 10, train_loss: 0.8188, test_loss: 0.8424, test_f1: 0.6023
 epoch: 11, train_loss: 0.8022, test_loss: 0.7690, test_f1: 0.5972
 epoch: 12, train_loss: 0.8003, test_loss: 0.7684, test_f1: 0.6019
 epoch: 13, train_loss: 0.7848, test_loss: 0.8023, test_f1: 0.6065
 epoch: 14, train_loss: 0.7775, test_loss: 0.8222, test_f1: 0.6205
 epoch: 15, train_loss: 0.7708, test_loss: 0.7680, test_f1: 0.6171
 epoch: 16, train_loss: 0.7683, test_loss: 0.7765, test_f1: 0.6274
 epoch: 17, train_loss: 0.7568, test_loss: 0.7536, test_f1: 0.6262
 epoch: 18, train_loss: 0.7380, test_loss: 0.7327, test_f1: 0.6381
 epoch: 19, train_loss: 0.7326, test_loss: 0.7880, test_f1: 0.6330
 epoch: 20, train_loss: 0.7271, test_loss: 0.8169, test_f1: 0.6203
 epoch: 21, train_loss: 0.7122, test_loss: 0.7895, test_f1: 0.6413
 epoch: 22, train_loss: 0.7154, test_loss: 0.7678, test_f1: 0.6523
 epoch: 23, train_loss: 0.7107, test_loss: 0.7422, test_f1: 0.6415
 epoch: 24, train_loss: 0.7034, test_loss: 0.9071, test_f1: 0.6198
 epoch: 25, train_loss: 0.6742, test_loss: 0.8052, test_f1: 0.6152
 epoch: 26, train_loss: 0.6687, test_loss: 0.7692, test_f1: 0.6636
 epoch: 27, train_loss: 0.6903, test_loss: 0.8347, test_f1: 0.6186
 epoch: 28, train_loss: 0.6760, test_loss: 0.8532, test_f1: 0.6151
 epoch: 29, train_loss: 0.6576, test_loss: 0.8238, test_f1: 0.6724
 epoch: 30, train_loss: 0.6513, test_loss: 0.7590, test_f1: 0.6444
 epoch: 31, train_loss: 0.6439, test_loss: 0.7612, test_f1: 0.6541
 epoch: 32, train_loss: 0.6316, test_loss: 0.8335, test_f1: 0.6290
 epoch: 33, train_loss: 0.6560, test_loss: 0.8367, test_f1: 0.6430
 epoch: 34, train_loss: 0.6587, test_loss: 0.8365, test_f1: 0.6281
 epoch: 35, train_loss: 0.6260, test_loss: 0.7944, test_f1: 0.6339
 epoch: 36, train_loss: 0.6268, test_loss: 0.8671, test_f1: 0.6283
 epoch: 37, train_loss: 0.6155, test_loss: 0.7879, test_f1: 0.6397
 epoch: 38, train_loss: 0.6083, test_loss: 0.8174, test_f1: 0.6554
 epoch: 39, train_loss: 0.6136, test_loss: 0.8662, test_f1: 0.6361
 epoch: 40, train_loss: 0.6101, test_loss: 0.8261, test_f1: 0.6661
 epoch: 41, train_loss: 0.6022, test_loss: 0.7978, test_f1: 0.6545
 epoch: 42, train_loss: 0.5857, test_loss: 0.8618, test_f1: 0.6648
 epoch: 43, train_loss: 0.5840, test_loss: 0.8047, test_f1: 0.6496
 epoch: 44, train_loss: 0.5978, test_loss: 0.8870, test_f1: 0.6684
 epoch: 45, train_loss: 0.5867, test_loss: 0.8587, test_f1: 0.6428
 epoch: 46, train_loss: 0.5761, test_loss: 0.8887, test_f1: 0.6518
 epoch: 47, train_loss: 0.6034, test_loss: 0.8475, test_f1: 0.6633
 epoch: 48, train_loss: 0.5650, test_loss: 0.8951, test_f1: 0.6677
 epoch: 49, train_loss: 0.5685, test_loss: 0.8570, test_f1: 0.6723
 epoch: 50, train_loss: 0.5728, test_loss: 0.8422, test_f1: 0.6608
 epoch: 51, train_loss: 0.5363, test_loss: 0.8515, test_f1: 0.6587
 epoch: 52, train_loss: 0.5190, test_loss: 0.8422, test_f1: 0.6538
 epoch: 53, train_loss: 0.5304, test_loss: 0.8321, test_f1: 0.6607
 epoch: 54, train_loss: 0.5128, test_loss: 0.8100, test_f1: 0.6986
 epoch: 55, train_loss: 0.5103, test_loss: 0.8279, test_f1: 0.6631
 epoch: 56, train_loss: 0.4983, test_loss: 0.8598, test_f1: 0.6804
 epoch: 57, train_loss: 0.4872, test_loss: 0.9393, test_f1: 0.6734
 epoch: 58, train_loss: 0.4925, test_loss: 0.9580, test_f1: 0.6689
 epoch: 59, train_loss: 0.5134, test_loss: 0.9520, test_f1: 0.6813
 epoch: 60, train_loss: 0.4850, test_loss: 0.8950, test_f1: 0.6624
 epoch: 61, train_loss: 0.4801, test_loss: 0.9630, test_f1: 0.6622
 epoch: 62, train_loss: 0.4854, test_loss: 1.0079, test_f1: 0.6699
 epoch: 63, train_loss: 0.4767, test_loss: 0.9351, test_f1: 0.6912
 epoch: 64, train_loss: 0.4744, test_loss: 0.9262, test_f1: 0.6729
 epoch: 65, train_loss: 0.4712, test_loss: 0.8997, test_f1: 0.6912
 epoch: 66, train_loss: 0.4807, test_loss: 0.9200, test_f1: 0.6938
 epoch: 67, train_loss: 0.4733, test_loss: 0.9274, test_f1: 0.6820
 epoch: 68, train_loss: 0.4691, test_loss: 1.0140, test_f1: 0.6777
 epoch: 69, train_loss: 0.4593, test_loss: 0.9745, test_f1: 0.6630
 epoch: 70, train_loss: 0.4518, test_loss: 1.0023, test_f1: 0.6899
 epoch: 71, train_loss: 0.4622, test_loss: 0.9871, test_f1: 0.6633
 epoch: 72, train_loss: 0.4568, test_loss: 0.9887, test_f1: 0.7022
 epoch: 73, train_loss: 0.4642, test_loss: 1.0122, test_f1: 0.6540
 epoch: 74, train_loss: 0.4508, test_loss: 0.9725, test_f1: 0.6707
 epoch: 75, train_loss: 0.4337, test_loss: 1.0308, test_f1: 0.6710
 epoch: 76, train_loss: 0.4598, test_loss: 1.0410, test_f1: 0.6828
 epoch: 77, train_loss: 0.4528, test_loss: 0.9657, test_f1: 0.6765
 epoch: 78, train_loss: 0.4277, test_loss: 0.9918, test_f1: 0.7054
 epoch: 79, train_loss: 0.4444, test_loss: 0.9825, test_f1: 0.6875
 epoch: 80, train_loss: 0.4311, test_loss: 1.0233, test_f1: 0.6616
 epoch: 81, train_loss: 0.4288, test_loss: 1.0209, test_f1: 0.6751
 epoch: 82, train_loss: 0.4405, test_loss: 1.0303, test_f1: 0.6773
 epoch: 83, train_loss: 0.4499, test_loss: 1.0710, test_f1: 0.6995
 epoch: 84, train_loss: 0.4335, test_loss: 1.0225, test_f1: 0.6618
 epoch: 85, train_loss: 0.4053, test_loss: 1.0875, test_f1: 0.6532
 epoch: 86, train_loss: 0.4302, test_loss: 1.0555, test_f1: 0.6802
 epoch: 87, train_loss: 0.4384, test_loss: 1.0947, test_f1: 0.6572
 epoch: 88, train_loss: 0.4151, test_loss: 1.0784, test_f1: 0.6906
 epoch: 89, train_loss: 0.4091, test_loss: 1.1254, test_f1: 0.6800
 epoch: 90, train_loss: 0.3996, test_loss: 1.0284, test_f1: 0.6703
 epoch: 91, train_loss: 0.4103, test_loss: 1.1202, test_f1: 0.6619
 epoch: 92, train_loss: 0.4025, test_loss: 1.0571, test_f1: 0.6846
 epoch: 93, train_loss: 0.4255, test_loss: 1.0892, test_f1: 0.6724
 epoch: 94, train_loss: 0.3978, test_loss: 1.1389, test_f1: 0.6690
 epoch: 95, train_loss: 0.4071, test_loss: 1.1610, test_f1: 0.6709
 epoch: 96, train_loss: 0.3991, test_loss: 1.1217, test_f1: 0.6982
 epoch: 97, train_loss: 0.3812, test_loss: 1.0789, test_f1: 0.6906
 epoch: 98, train_loss: 0.4008, test_loss: 1.0968, test_f1: 0.6872
 epoch: 99, train_loss: 0.4004, test_loss: 1.1430, test_f1: 0.6707
##################ITERATION #5 ****************************************
 epoch: 0, train_loss: 1.1840, test_loss: 1.0224, test_f1: 0.5280
 epoch: 1, train_loss: 0.9864, test_loss: 0.9816, test_f1: 0.5262
 epoch: 2, train_loss: 0.9662, test_loss: 0.9405, test_f1: 0.5575
 epoch: 3, train_loss: 0.9319, test_loss: 0.9154, test_f1: 0.5332
 epoch: 4, train_loss: 0.9167, test_loss: 0.9221, test_f1: 0.5351
 epoch: 5, train_loss: 0.9056, test_loss: 0.8869, test_f1: 0.5304
 epoch: 6, train_loss: 0.8731, test_loss: 0.8803, test_f1: 0.5929
 epoch: 7, train_loss: 0.8721, test_loss: 0.8614, test_f1: 0.5729
 epoch: 8, train_loss: 0.8546, test_loss: 0.9126, test_f1: 0.5493
 epoch: 9, train_loss: 0.8562, test_loss: 0.8631, test_f1: 0.5733
 epoch: 10, train_loss: 0.8405, test_loss: 0.8516, test_f1: 0.5822
 epoch: 11, train_loss: 0.8118, test_loss: 0.8214, test_f1: 0.6143
 epoch: 12, train_loss: 0.8067, test_loss: 0.8341, test_f1: 0.6257
 epoch: 13, train_loss: 0.7934, test_loss: 0.8170, test_f1: 0.5828
 epoch: 14, train_loss: 0.7879, test_loss: 0.8154, test_f1: 0.6269
 epoch: 15, train_loss: 0.7960, test_loss: 0.8324, test_f1: 0.6026
 epoch: 16, train_loss: 0.7993, test_loss: 0.8174, test_f1: 0.5933
 epoch: 17, train_loss: 0.7766, test_loss: 0.7388, test_f1: 0.6341
 epoch: 18, train_loss: 0.7457, test_loss: 0.7861, test_f1: 0.6190
 epoch: 19, train_loss: 0.7407, test_loss: 0.7949, test_f1: 0.6103
 epoch: 20, train_loss: 0.7274, test_loss: 0.7940, test_f1: 0.6051
 epoch: 21, train_loss: 0.7284, test_loss: 0.7639, test_f1: 0.6083
 epoch: 22, train_loss: 0.7138, test_loss: 0.7385, test_f1: 0.6434
 epoch: 23, train_loss: 0.7153, test_loss: 0.7562, test_f1: 0.6354
 epoch: 24, train_loss: 0.7158, test_loss: 0.7830, test_f1: 0.6199
 epoch: 25, train_loss: 0.6876, test_loss: 0.7564, test_f1: 0.6384
 epoch: 26, train_loss: 0.6916, test_loss: 0.7406, test_f1: 0.6382
 epoch: 27, train_loss: 0.6859, test_loss: 0.7870, test_f1: 0.6391
 epoch: 28, train_loss: 0.6820, test_loss: 0.7684, test_f1: 0.6511
 epoch: 29, train_loss: 0.6569, test_loss: 0.7663, test_f1: 0.6661
 epoch: 30, train_loss: 0.6617, test_loss: 0.7631, test_f1: 0.6420
 epoch: 31, train_loss: 0.6520, test_loss: 0.7406, test_f1: 0.6531
 epoch: 32, train_loss: 0.6597, test_loss: 0.7512, test_f1: 0.6593
 epoch: 33, train_loss: 0.6482, test_loss: 0.7827, test_f1: 0.6511
 epoch: 34, train_loss: 0.6290, test_loss: 0.8125, test_f1: 0.6595
 epoch: 35, train_loss: 0.6511, test_loss: 0.7770, test_f1: 0.6533
 epoch: 36, train_loss: 0.6112, test_loss: 0.7970, test_f1: 0.6473
 epoch: 37, train_loss: 0.6199, test_loss: 0.8139, test_f1: 0.6613
 epoch: 38, train_loss: 0.6031, test_loss: 0.8113, test_f1: 0.6283
 epoch: 39, train_loss: 0.6150, test_loss: 0.8820, test_f1: 0.6490
 epoch: 40, train_loss: 0.6047, test_loss: 0.7822, test_f1: 0.6716
 epoch: 41, train_loss: 0.6228, test_loss: 0.8237, test_f1: 0.6536
 epoch: 42, train_loss: 0.6179, test_loss: 0.8197, test_f1: 0.6524
 epoch: 43, train_loss: 0.5946, test_loss: 0.7906, test_f1: 0.6400
 epoch: 44, train_loss: 0.5791, test_loss: 0.7663, test_f1: 0.6598
 epoch: 45, train_loss: 0.5959, test_loss: 0.7576, test_f1: 0.6517
 epoch: 46, train_loss: 0.5832, test_loss: 0.7829, test_f1: 0.6491
 epoch: 47, train_loss: 0.5793, test_loss: 0.7937, test_f1: 0.6708
 epoch: 48, train_loss: 0.5548, test_loss: 0.8489, test_f1: 0.6486
 epoch: 49, train_loss: 0.5641, test_loss: 0.7671, test_f1: 0.6897
 epoch: 50, train_loss: 0.5508, test_loss: 0.8221, test_f1: 0.6562
 epoch: 51, train_loss: 0.5298, test_loss: 0.8036, test_f1: 0.6648
 epoch: 52, train_loss: 0.5261, test_loss: 0.8577, test_f1: 0.6596
 epoch: 53, train_loss: 0.5074, test_loss: 0.8634, test_f1: 0.6716
 epoch: 54, train_loss: 0.4992, test_loss: 0.8192, test_f1: 0.6800
 epoch: 55, train_loss: 0.5018, test_loss: 0.8313, test_f1: 0.6712
 epoch: 56, train_loss: 0.5059, test_loss: 0.8910, test_f1: 0.6485
 epoch: 57, train_loss: 0.4829, test_loss: 0.8321, test_f1: 0.6686
 epoch: 58, train_loss: 0.4895, test_loss: 0.8690, test_f1: 0.6586
 epoch: 59, train_loss: 0.4985, test_loss: 0.8595, test_f1: 0.6755
 epoch: 60, train_loss: 0.4961, test_loss: 0.8691, test_f1: 0.6632
 epoch: 61, train_loss: 0.4890, test_loss: 0.8791, test_f1: 0.6763
 epoch: 62, train_loss: 0.4728, test_loss: 0.9146, test_f1: 0.6641
 epoch: 63, train_loss: 0.4696, test_loss: 0.8601, test_f1: 0.6805
 epoch: 64, train_loss: 0.4738, test_loss: 0.9250, test_f1: 0.6637
 epoch: 65, train_loss: 0.4893, test_loss: 0.9177, test_f1: 0.6587
 epoch: 66, train_loss: 0.4639, test_loss: 0.9750, test_f1: 0.6576
 epoch: 67, train_loss: 0.4530, test_loss: 0.8955, test_f1: 0.6891
 epoch: 68, train_loss: 0.4773, test_loss: 0.8983, test_f1: 0.6752
 epoch: 69, train_loss: 0.4624, test_loss: 0.8851, test_f1: 0.6736
 epoch: 70, train_loss: 0.4564, test_loss: 0.8829, test_f1: 0.6846
 epoch: 71, train_loss: 0.4623, test_loss: 0.8836, test_f1: 0.6687
 epoch: 72, train_loss: 0.4546, test_loss: 0.9201, test_f1: 0.6632
 epoch: 73, train_loss: 0.4489, test_loss: 0.9250, test_f1: 0.6813
 epoch: 74, train_loss: 0.4576, test_loss: 0.9238, test_f1: 0.6735
 epoch: 75, train_loss: 0.4596, test_loss: 0.8636, test_f1: 0.6773
 epoch: 76, train_loss: 0.4440, test_loss: 0.9127, test_f1: 0.6736
 epoch: 77, train_loss: 0.4454, test_loss: 0.9199, test_f1: 0.6826
 epoch: 78, train_loss: 0.4465, test_loss: 0.9778, test_f1: 0.6830
 epoch: 79, train_loss: 0.4465, test_loss: 0.9266, test_f1: 0.6860
 epoch: 80, train_loss: 0.4505, test_loss: 0.9153, test_f1: 0.6848
 epoch: 81, train_loss: 0.4451, test_loss: 1.0362, test_f1: 0.6746
 epoch: 82, train_loss: 0.4423, test_loss: 0.9225, test_f1: 0.6858
 epoch: 83, train_loss: 0.4191, test_loss: 0.9157, test_f1: 0.6792
 epoch: 84, train_loss: 0.4306, test_loss: 0.9767, test_f1: 0.6857
 epoch: 85, train_loss: 0.4283, test_loss: 0.8961, test_f1: 0.6871
 epoch: 86, train_loss: 0.4270, test_loss: 0.9237, test_f1: 0.6868
 epoch: 87, train_loss: 0.4360, test_loss: 0.9937, test_f1: 0.6811
 epoch: 88, train_loss: 0.4356, test_loss: 0.9690, test_f1: 0.6737
 epoch: 89, train_loss: 0.4077, test_loss: 1.0077, test_f1: 0.6706
 epoch: 90, train_loss: 0.4261, test_loss: 0.9193, test_f1: 0.6791
 epoch: 91, train_loss: 0.4070, test_loss: 0.9550, test_f1: 0.6926
 epoch: 92, train_loss: 0.4003, test_loss: 0.9615, test_f1: 0.6966
 epoch: 93, train_loss: 0.4067, test_loss: 1.0092, test_f1: 0.6902
 epoch: 94, train_loss: 0.4128, test_loss: 0.9636, test_f1: 0.6765
 epoch: 95, train_loss: 0.4112, test_loss: 0.9513, test_f1: 0.6843
 epoch: 96, train_loss: 0.4004, test_loss: 0.9825, test_f1: 0.6807
 epoch: 97, train_loss: 0.3957, test_loss: 1.0098, test_f1: 0.6819
 epoch: 98, train_loss: 0.3984, test_loss: 1.0163, test_f1: 0.6872
 epoch: 99, train_loss: 0.3988, test_loss: 0.9673, test_f1: 0.6790
##################ITERATION #6 ****************************************
 epoch: 0, train_loss: 1.2750, test_loss: 0.9709, test_f1: 0.5265
 epoch: 1, train_loss: 1.0138, test_loss: 0.9723, test_f1: 0.5154
 epoch: 2, train_loss: 0.9604, test_loss: 0.9320, test_f1: 0.5430
 epoch: 3, train_loss: 0.9363, test_loss: 0.8691, test_f1: 0.5662
 epoch: 4, train_loss: 0.9176, test_loss: 0.8918, test_f1: 0.5720
 epoch: 5, train_loss: 0.9040, test_loss: 0.8672, test_f1: 0.5204
 epoch: 6, train_loss: 0.8914, test_loss: 0.8194, test_f1: 0.5725
 epoch: 7, train_loss: 0.8781, test_loss: 0.8323, test_f1: 0.5632
 epoch: 8, train_loss: 0.8571, test_loss: 0.8198, test_f1: 0.5909
 epoch: 9, train_loss: 0.8298, test_loss: 0.8017, test_f1: 0.5674
 epoch: 10, train_loss: 0.8382, test_loss: 0.8563, test_f1: 0.6081
 epoch: 11, train_loss: 0.8183, test_loss: 0.7749, test_f1: 0.6257
 epoch: 12, train_loss: 0.7989, test_loss: 0.8192, test_f1: 0.6197
 epoch: 13, train_loss: 0.8025, test_loss: 0.7755, test_f1: 0.6247
 epoch: 14, train_loss: 0.7810, test_loss: 0.8029, test_f1: 0.6342
 epoch: 15, train_loss: 0.7657, test_loss: 0.7320, test_f1: 0.6314
 epoch: 16, train_loss: 0.7798, test_loss: 0.8174, test_f1: 0.6277
 epoch: 17, train_loss: 0.7541, test_loss: 0.7881, test_f1: 0.6674
 epoch: 18, train_loss: 0.7468, test_loss: 0.7312, test_f1: 0.6656
 epoch: 19, train_loss: 0.7254, test_loss: 0.7396, test_f1: 0.6512
 epoch: 20, train_loss: 0.7354, test_loss: 0.7073, test_f1: 0.6512
 epoch: 21, train_loss: 0.7102, test_loss: 0.7730, test_f1: 0.5997
 epoch: 22, train_loss: 0.7081, test_loss: 0.7810, test_f1: 0.6562
 epoch: 23, train_loss: 0.7003, test_loss: 0.8432, test_f1: 0.6344
 epoch: 24, train_loss: 0.6965, test_loss: 0.7617, test_f1: 0.6396
 epoch: 25, train_loss: 0.6960, test_loss: 0.7101, test_f1: 0.6510
 epoch: 26, train_loss: 0.6808, test_loss: 0.7280, test_f1: 0.6615
 epoch: 27, train_loss: 0.6734, test_loss: 0.7499, test_f1: 0.6701
 epoch: 28, train_loss: 0.6595, test_loss: 0.7996, test_f1: 0.6482
 epoch: 29, train_loss: 0.6690, test_loss: 0.7768, test_f1: 0.6422
 epoch: 30, train_loss: 0.6640, test_loss: 0.7695, test_f1: 0.6471
 epoch: 31, train_loss: 0.6429, test_loss: 0.8196, test_f1: 0.6489
 epoch: 32, train_loss: 0.6491, test_loss: 0.7785, test_f1: 0.6622
 epoch: 33, train_loss: 0.6308, test_loss: 0.8227, test_f1: 0.6484
 epoch: 34, train_loss: 0.6274, test_loss: 0.7679, test_f1: 0.6431
 epoch: 35, train_loss: 0.6252, test_loss: 0.7555, test_f1: 0.6771
 epoch: 36, train_loss: 0.6233, test_loss: 0.7262, test_f1: 0.6645
 epoch: 37, train_loss: 0.6122, test_loss: 0.7438, test_f1: 0.6655
 epoch: 38, train_loss: 0.6042, test_loss: 0.8030, test_f1: 0.6654
 epoch: 39, train_loss: 0.5969, test_loss: 0.8288, test_f1: 0.6483
 epoch: 40, train_loss: 0.6055, test_loss: 0.8818, test_f1: 0.6481
 epoch: 41, train_loss: 0.6052, test_loss: 0.8494, test_f1: 0.6527
 epoch: 42, train_loss: 0.6107, test_loss: 0.8131, test_f1: 0.6662
 epoch: 43, train_loss: 0.5980, test_loss: 0.8262, test_f1: 0.6668
 epoch: 44, train_loss: 0.5776, test_loss: 0.8211, test_f1: 0.6689
 epoch: 45, train_loss: 0.5843, test_loss: 0.8842, test_f1: 0.6740
 epoch: 46, train_loss: 0.5545, test_loss: 0.8754, test_f1: 0.6608
 epoch: 47, train_loss: 0.5655, test_loss: 0.8320, test_f1: 0.6620
 epoch: 48, train_loss: 0.5657, test_loss: 0.8546, test_f1: 0.6777
 epoch: 49, train_loss: 0.5567, test_loss: 0.9125, test_f1: 0.6446
 epoch: 50, train_loss: 0.5633, test_loss: 0.9331, test_f1: 0.6584
 epoch: 51, train_loss: 0.5224, test_loss: 0.8417, test_f1: 0.6907
 epoch: 52, train_loss: 0.4861, test_loss: 0.8576, test_f1: 0.6773
 epoch: 53, train_loss: 0.5015, test_loss: 0.8546, test_f1: 0.6719
 epoch: 54, train_loss: 0.4894, test_loss: 0.8728, test_f1: 0.6578
 epoch: 55, train_loss: 0.4973, test_loss: 0.8404, test_f1: 0.6932
 epoch: 56, train_loss: 0.4822, test_loss: 0.8377, test_f1: 0.6747
 epoch: 57, train_loss: 0.4801, test_loss: 0.8766, test_f1: 0.6759
 epoch: 58, train_loss: 0.4812, test_loss: 0.8553, test_f1: 0.6784
 epoch: 59, train_loss: 0.4765, test_loss: 0.9198, test_f1: 0.6666
 epoch: 60, train_loss: 0.4741, test_loss: 0.9404, test_f1: 0.6737
 epoch: 61, train_loss: 0.4778, test_loss: 0.9166, test_f1: 0.6754
 epoch: 62, train_loss: 0.4598, test_loss: 0.9341, test_f1: 0.6699
 epoch: 63, train_loss: 0.4628, test_loss: 0.8889, test_f1: 0.6909
 epoch: 64, train_loss: 0.4701, test_loss: 0.9706, test_f1: 0.6839
 epoch: 65, train_loss: 0.4412, test_loss: 0.9800, test_f1: 0.6705
 epoch: 66, train_loss: 0.4523, test_loss: 0.8792, test_f1: 0.6861
 epoch: 67, train_loss: 0.4578, test_loss: 0.9767, test_f1: 0.6592
 epoch: 68, train_loss: 0.4546, test_loss: 0.9467, test_f1: 0.6838
 epoch: 69, train_loss: 0.4547, test_loss: 0.9695, test_f1: 0.6750
 epoch: 70, train_loss: 0.4417, test_loss: 0.9290, test_f1: 0.6947
 epoch: 71, train_loss: 0.4424, test_loss: 0.9516, test_f1: 0.6763
 epoch: 72, train_loss: 0.4364, test_loss: 0.9720, test_f1: 0.6895
 epoch: 73, train_loss: 0.4541, test_loss: 0.9663, test_f1: 0.6737
 epoch: 74, train_loss: 0.4286, test_loss: 1.0171, test_f1: 0.6624
 epoch: 75, train_loss: 0.4522, test_loss: 0.9151, test_f1: 0.6920
 epoch: 76, train_loss: 0.4287, test_loss: 0.9731, test_f1: 0.6697
 epoch: 77, train_loss: 0.4133, test_loss: 0.9962, test_f1: 0.6724
 epoch: 78, train_loss: 0.4222, test_loss: 0.9974, test_f1: 0.6844
 epoch: 79, train_loss: 0.4081, test_loss: 0.9334, test_f1: 0.6901
 epoch: 80, train_loss: 0.4120, test_loss: 1.0091, test_f1: 0.6866
 epoch: 81, train_loss: 0.4244, test_loss: 1.0393, test_f1: 0.6660
 epoch: 82, train_loss: 0.4286, test_loss: 1.0642, test_f1: 0.6701
 epoch: 83, train_loss: 0.3944, test_loss: 0.9994, test_f1: 0.6731
 epoch: 84, train_loss: 0.4049, test_loss: 0.9998, test_f1: 0.6808
 epoch: 85, train_loss: 0.3945, test_loss: 1.0084, test_f1: 0.6888
 epoch: 86, train_loss: 0.3965, test_loss: 1.0204, test_f1: 0.7055
 epoch: 87, train_loss: 0.3879, test_loss: 1.0693, test_f1: 0.6880
 epoch: 88, train_loss: 0.4191, test_loss: 1.0927, test_f1: 0.6739
 epoch: 89, train_loss: 0.4213, test_loss: 1.0475, test_f1: 0.6953
 epoch: 90, train_loss: 0.3818, test_loss: 1.0501, test_f1: 0.6992
 epoch: 91, train_loss: 0.4170, test_loss: 1.0529, test_f1: 0.6704
 epoch: 92, train_loss: 0.3931, test_loss: 0.9796, test_f1: 0.6965
 epoch: 93, train_loss: 0.4113, test_loss: 1.0708, test_f1: 0.6795
 epoch: 94, train_loss: 0.3852, test_loss: 1.0863, test_f1: 0.6834
 epoch: 95, train_loss: 0.3995, test_loss: 1.1024, test_f1: 0.6796
 epoch: 96, train_loss: 0.3772, test_loss: 1.1396, test_f1: 0.6689
 epoch: 97, train_loss: 0.3760, test_loss: 1.1088, test_f1: 0.6638
 epoch: 98, train_loss: 0.4048, test_loss: 1.1292, test_f1: 0.6803
 epoch: 99, train_loss: 0.3967, test_loss: 1.1220, test_f1: 0.6765
##################ITERATION #7 ****************************************
 epoch: 0, train_loss: 1.1829, test_loss: 0.9869, test_f1: 0.5045
 epoch: 1, train_loss: 0.9785, test_loss: 0.9422, test_f1: 0.5117
 epoch: 2, train_loss: 0.9397, test_loss: 0.9088, test_f1: 0.5189
 epoch: 3, train_loss: 0.9264, test_loss: 0.8555, test_f1: 0.5136
 epoch: 4, train_loss: 0.9006, test_loss: 0.8873, test_f1: 0.5472
 epoch: 5, train_loss: 0.8866, test_loss: 0.9063, test_f1: 0.5498
 epoch: 6, train_loss: 0.8604, test_loss: 0.8291, test_f1: 0.5589
 epoch: 7, train_loss: 0.8526, test_loss: 0.8541, test_f1: 0.5775
 epoch: 8, train_loss: 0.8381, test_loss: 0.8409, test_f1: 0.5602
 epoch: 9, train_loss: 0.8259, test_loss: 0.8683, test_f1: 0.5998
 epoch: 10, train_loss: 0.8138, test_loss: 0.7654, test_f1: 0.6159
 epoch: 11, train_loss: 0.7940, test_loss: 0.8336, test_f1: 0.5927
 epoch: 12, train_loss: 0.7829, test_loss: 0.8949, test_f1: 0.6115
 epoch: 13, train_loss: 0.7934, test_loss: 0.8533, test_f1: 0.6160
 epoch: 14, train_loss: 0.7639, test_loss: 0.8127, test_f1: 0.6186
 epoch: 15, train_loss: 0.7455, test_loss: 0.8482, test_f1: 0.6207
 epoch: 16, train_loss: 0.7399, test_loss: 0.7911, test_f1: 0.6441
 epoch: 17, train_loss: 0.7574, test_loss: 0.8252, test_f1: 0.6380
 epoch: 18, train_loss: 0.7239, test_loss: 0.7956, test_f1: 0.6430
 epoch: 19, train_loss: 0.7114, test_loss: 0.8350, test_f1: 0.6331
 epoch: 20, train_loss: 0.7099, test_loss: 0.8249, test_f1: 0.6724
 epoch: 21, train_loss: 0.6944, test_loss: 0.7924, test_f1: 0.6666
 epoch: 22, train_loss: 0.7224, test_loss: 0.7636, test_f1: 0.6414
 epoch: 23, train_loss: 0.6910, test_loss: 0.7871, test_f1: 0.6663
 epoch: 24, train_loss: 0.6684, test_loss: 0.8339, test_f1: 0.6424
 epoch: 25, train_loss: 0.6673, test_loss: 0.8005, test_f1: 0.6566
 epoch: 26, train_loss: 0.6565, test_loss: 0.8637, test_f1: 0.6309
 epoch: 27, train_loss: 0.6664, test_loss: 0.8590, test_f1: 0.6386
 epoch: 28, train_loss: 0.6454, test_loss: 0.8076, test_f1: 0.6559
 epoch: 29, train_loss: 0.6599, test_loss: 0.8377, test_f1: 0.6910
 epoch: 30, train_loss: 0.6456, test_loss: 0.8411, test_f1: 0.6627
 epoch: 31, train_loss: 0.6470, test_loss: 0.7929, test_f1: 0.6986
 epoch: 32, train_loss: 0.6278, test_loss: 0.8191, test_f1: 0.6782
 epoch: 33, train_loss: 0.6322, test_loss: 0.8093, test_f1: 0.6623
 epoch: 34, train_loss: 0.6176, test_loss: 0.8379, test_f1: 0.6670
 epoch: 35, train_loss: 0.6126, test_loss: 0.8856, test_f1: 0.6565
 epoch: 36, train_loss: 0.6060, test_loss: 0.8159, test_f1: 0.6660
 epoch: 37, train_loss: 0.6074, test_loss: 0.8404, test_f1: 0.6631
 epoch: 38, train_loss: 0.5921, test_loss: 0.9340, test_f1: 0.6195
 epoch: 39, train_loss: 0.5953, test_loss: 0.8860, test_f1: 0.6740
 epoch: 40, train_loss: 0.5912, test_loss: 0.8362, test_f1: 0.7166
 epoch: 41, train_loss: 0.5875, test_loss: 0.9255, test_f1: 0.6887
 epoch: 42, train_loss: 0.5855, test_loss: 0.8813, test_f1: 0.6760
 epoch: 43, train_loss: 0.5846, test_loss: 0.8709, test_f1: 0.6715
 epoch: 44, train_loss: 0.5683, test_loss: 0.9369, test_f1: 0.6754
 epoch: 45, train_loss: 0.5769, test_loss: 0.9062, test_f1: 0.6823
 epoch: 46, train_loss: 0.5735, test_loss: 0.9570, test_f1: 0.6774
 epoch: 47, train_loss: 0.5558, test_loss: 0.9222, test_f1: 0.6793
 epoch: 48, train_loss: 0.5647, test_loss: 0.8961, test_f1: 0.6875
 epoch: 49, train_loss: 0.5322, test_loss: 0.9544, test_f1: 0.6761
 epoch: 50, train_loss: 0.5601, test_loss: 0.9753, test_f1: 0.6919
 epoch: 51, train_loss: 0.5248, test_loss: 0.9571, test_f1: 0.7070
 epoch: 52, train_loss: 0.4994, test_loss: 0.9337, test_f1: 0.6875
 epoch: 53, train_loss: 0.5016, test_loss: 0.9471, test_f1: 0.6925
 epoch: 54, train_loss: 0.4982, test_loss: 0.9612, test_f1: 0.6885
 epoch: 55, train_loss: 0.5005, test_loss: 0.9510, test_f1: 0.6783
 epoch: 56, train_loss: 0.4971, test_loss: 0.9677, test_f1: 0.6712
 epoch: 57, train_loss: 0.4961, test_loss: 1.0242, test_f1: 0.7050
 epoch: 58, train_loss: 0.4919, test_loss: 1.0187, test_f1: 0.6984
 epoch: 59, train_loss: 0.4788, test_loss: 1.0374, test_f1: 0.6945
 epoch: 60, train_loss: 0.4625, test_loss: 0.9701, test_f1: 0.6907
 epoch: 61, train_loss: 0.4572, test_loss: 1.0309, test_f1: 0.6779
 epoch: 62, train_loss: 0.4554, test_loss: 1.0512, test_f1: 0.6810
 epoch: 63, train_loss: 0.4619, test_loss: 0.9552, test_f1: 0.7017
 epoch: 64, train_loss: 0.4621, test_loss: 0.9812, test_f1: 0.6893
 epoch: 65, train_loss: 0.4576, test_loss: 0.9408, test_f1: 0.6829
 epoch: 66, train_loss: 0.4583, test_loss: 1.0561, test_f1: 0.6848
 epoch: 67, train_loss: 0.4486, test_loss: 1.0575, test_f1: 0.6657
 epoch: 68, train_loss: 0.4470, test_loss: 1.0913, test_f1: 0.6956
 epoch: 69, train_loss: 0.4379, test_loss: 1.0462, test_f1: 0.6715
 epoch: 70, train_loss: 0.4452, test_loss: 1.0378, test_f1: 0.6862
 epoch: 71, train_loss: 0.4358, test_loss: 1.0087, test_f1: 0.7003
 epoch: 72, train_loss: 0.4472, test_loss: 1.0171, test_f1: 0.6821
 epoch: 73, train_loss: 0.4233, test_loss: 1.1065, test_f1: 0.6569
 epoch: 74, train_loss: 0.4369, test_loss: 1.0781, test_f1: 0.6816
 epoch: 75, train_loss: 0.4227, test_loss: 1.1656, test_f1: 0.6671
 epoch: 76, train_loss: 0.4209, test_loss: 1.1154, test_f1: 0.6893
 epoch: 77, train_loss: 0.4286, test_loss: 1.1583, test_f1: 0.6801
 epoch: 78, train_loss: 0.4105, test_loss: 1.2145, test_f1: 0.6750
 epoch: 79, train_loss: 0.4320, test_loss: 1.0989, test_f1: 0.6955
 epoch: 80, train_loss: 0.4209, test_loss: 1.1205, test_f1: 0.6887
 epoch: 81, train_loss: 0.3950, test_loss: 1.1251, test_f1: 0.6747
 epoch: 82, train_loss: 0.4112, test_loss: 1.1429, test_f1: 0.6824
 epoch: 83, train_loss: 0.4038, test_loss: 1.1789, test_f1: 0.6918
 epoch: 84, train_loss: 0.4017, test_loss: 1.1616, test_f1: 0.6809
 epoch: 85, train_loss: 0.4080, test_loss: 1.0842, test_f1: 0.6982
 epoch: 86, train_loss: 0.3957, test_loss: 1.1588, test_f1: 0.6767
 epoch: 87, train_loss: 0.4037, test_loss: 1.1789, test_f1: 0.6941
 epoch: 88, train_loss: 0.4139, test_loss: 1.1568, test_f1: 0.6726
 epoch: 89, train_loss: 0.3987, test_loss: 1.1504, test_f1: 0.6613
 epoch: 90, train_loss: 0.3989, test_loss: 1.1724, test_f1: 0.6830
 epoch: 91, train_loss: 0.3913, test_loss: 1.1838, test_f1: 0.6881
 epoch: 92, train_loss: 0.3985, test_loss: 1.1354, test_f1: 0.6970
 epoch: 93, train_loss: 0.3923, test_loss: 1.1640, test_f1: 0.6872
 epoch: 94, train_loss: 0.3865, test_loss: 1.2946, test_f1: 0.6810
 epoch: 95, train_loss: 0.3777, test_loss: 1.2194, test_f1: 0.6776
 epoch: 96, train_loss: 0.3814, test_loss: 1.2396, test_f1: 0.6850
 epoch: 97, train_loss: 0.3723, test_loss: 1.2299, test_f1: 0.6974
 epoch: 98, train_loss: 0.3855, test_loss: 1.2649, test_f1: 0.6527
 epoch: 99, train_loss: 0.3676, test_loss: 1.2606, test_f1: 0.6821
##################ITERATION #8 ****************************************
 epoch: 0, train_loss: 1.2304, test_loss: 0.9575, test_f1: 0.4526
 epoch: 1, train_loss: 0.9954, test_loss: 0.9413, test_f1: 0.4831
 epoch: 2, train_loss: 0.9696, test_loss: 0.9018, test_f1: 0.5569
 epoch: 3, train_loss: 0.9322, test_loss: 0.8918, test_f1: 0.4987
 epoch: 4, train_loss: 0.9195, test_loss: 0.9320, test_f1: 0.5263
 epoch: 5, train_loss: 0.8967, test_loss: 0.8259, test_f1: 0.5739
 epoch: 6, train_loss: 0.8855, test_loss: 0.8904, test_f1: 0.5545
 epoch: 7, train_loss: 0.8724, test_loss: 0.8772, test_f1: 0.5504
 epoch: 8, train_loss: 0.8588, test_loss: 0.7947, test_f1: 0.5831
 epoch: 9, train_loss: 0.8408, test_loss: 0.7814, test_f1: 0.6102
 epoch: 10, train_loss: 0.8306, test_loss: 0.8268, test_f1: 0.5778
 epoch: 11, train_loss: 0.8205, test_loss: 0.8149, test_f1: 0.5863
 epoch: 12, train_loss: 0.7990, test_loss: 0.7714, test_f1: 0.6145
 epoch: 13, train_loss: 0.7891, test_loss: 0.7430, test_f1: 0.6350
 epoch: 14, train_loss: 0.7948, test_loss: 0.8330, test_f1: 0.6282
 epoch: 15, train_loss: 0.7677, test_loss: 0.8072, test_f1: 0.6059
 epoch: 16, train_loss: 0.7580, test_loss: 0.7203, test_f1: 0.6254
 epoch: 17, train_loss: 0.7526, test_loss: 0.7852, test_f1: 0.6128
 epoch: 18, train_loss: 0.7378, test_loss: 0.7853, test_f1: 0.6203
 epoch: 19, train_loss: 0.7328, test_loss: 0.7380, test_f1: 0.6343
 epoch: 20, train_loss: 0.7374, test_loss: 0.7204, test_f1: 0.6550
 epoch: 21, train_loss: 0.7114, test_loss: 0.8087, test_f1: 0.6018
 epoch: 22, train_loss: 0.7168, test_loss: 0.7578, test_f1: 0.6431
 epoch: 23, train_loss: 0.6894, test_loss: 0.7186, test_f1: 0.6611
 epoch: 24, train_loss: 0.6932, test_loss: 0.7474, test_f1: 0.6838
 epoch: 25, train_loss: 0.6766, test_loss: 0.7775, test_f1: 0.6462
 epoch: 26, train_loss: 0.6840, test_loss: 0.7300, test_f1: 0.6497
 epoch: 27, train_loss: 0.6970, test_loss: 0.8156, test_f1: 0.6275
 epoch: 28, train_loss: 0.6783, test_loss: 0.7973, test_f1: 0.6391
 epoch: 29, train_loss: 0.6630, test_loss: 0.8397, test_f1: 0.6382
 epoch: 30, train_loss: 0.6489, test_loss: 0.8070, test_f1: 0.6416
 epoch: 31, train_loss: 0.6539, test_loss: 0.7905, test_f1: 0.6776
 epoch: 32, train_loss: 0.6255, test_loss: 0.7893, test_f1: 0.6301
 epoch: 33, train_loss: 0.6628, test_loss: 0.8169, test_f1: 0.6387
 epoch: 34, train_loss: 0.6492, test_loss: 0.7517, test_f1: 0.6357
 epoch: 35, train_loss: 0.6206, test_loss: 0.8070, test_f1: 0.6292
 epoch: 36, train_loss: 0.6154, test_loss: 0.7618, test_f1: 0.6590
 epoch: 37, train_loss: 0.6064, test_loss: 0.7866, test_f1: 0.6563
 epoch: 38, train_loss: 0.6189, test_loss: 0.8845, test_f1: 0.6469
 epoch: 39, train_loss: 0.6055, test_loss: 0.7901, test_f1: 0.6593
 epoch: 40, train_loss: 0.5963, test_loss: 0.8186, test_f1: 0.6647
 epoch: 41, train_loss: 0.6080, test_loss: 0.8251, test_f1: 0.6456
 epoch: 42, train_loss: 0.6074, test_loss: 0.8290, test_f1: 0.6423
 epoch: 43, train_loss: 0.6107, test_loss: 0.8527, test_f1: 0.6638
 epoch: 44, train_loss: 0.5832, test_loss: 0.8802, test_f1: 0.6623
 epoch: 45, train_loss: 0.5710, test_loss: 0.8530, test_f1: 0.6510
 epoch: 46, train_loss: 0.5665, test_loss: 0.8063, test_f1: 0.6652
 epoch: 47, train_loss: 0.5644, test_loss: 0.8104, test_f1: 0.6661
 epoch: 48, train_loss: 0.5663, test_loss: 0.8732, test_f1: 0.6726
 epoch: 49, train_loss: 0.5663, test_loss: 0.8013, test_f1: 0.6603
 epoch: 50, train_loss: 0.5435, test_loss: 0.9093, test_f1: 0.6691
 epoch: 51, train_loss: 0.5323, test_loss: 0.8596, test_f1: 0.6740
 epoch: 52, train_loss: 0.5067, test_loss: 0.8917, test_f1: 0.6786
 epoch: 53, train_loss: 0.4950, test_loss: 0.9092, test_f1: 0.6586
 epoch: 54, train_loss: 0.4825, test_loss: 0.8978, test_f1: 0.6668
 epoch: 55, train_loss: 0.4924, test_loss: 0.9348, test_f1: 0.6718
 epoch: 56, train_loss: 0.4807, test_loss: 0.9457, test_f1: 0.6740
 epoch: 57, train_loss: 0.4843, test_loss: 0.9615, test_f1: 0.6568
 epoch: 58, train_loss: 0.4857, test_loss: 0.9102, test_f1: 0.6681
 epoch: 59, train_loss: 0.4782, test_loss: 0.8677, test_f1: 0.6725
 epoch: 60, train_loss: 0.4820, test_loss: 0.8947, test_f1: 0.6863
 epoch: 61, train_loss: 0.4621, test_loss: 0.9444, test_f1: 0.6786
 epoch: 62, train_loss: 0.4550, test_loss: 0.9383, test_f1: 0.6763
 epoch: 63, train_loss: 0.4474, test_loss: 0.9917, test_f1: 0.6672
 epoch: 64, train_loss: 0.4598, test_loss: 1.0822, test_f1: 0.6728
 epoch: 65, train_loss: 0.4749, test_loss: 1.0188, test_f1: 0.6802
 epoch: 66, train_loss: 0.4444, test_loss: 1.0706, test_f1: 0.6594
 epoch: 67, train_loss: 0.4604, test_loss: 0.9684, test_f1: 0.6683
 epoch: 68, train_loss: 0.4451, test_loss: 1.0724, test_f1: 0.6609
 epoch: 69, train_loss: 0.4474, test_loss: 1.0511, test_f1: 0.6724
 epoch: 70, train_loss: 0.4501, test_loss: 1.0581, test_f1: 0.6717
 epoch: 71, train_loss: 0.4435, test_loss: 1.1004, test_f1: 0.6784
 epoch: 72, train_loss: 0.4390, test_loss: 0.9693, test_f1: 0.6862
 epoch: 73, train_loss: 0.4235, test_loss: 1.0946, test_f1: 0.6651
 epoch: 74, train_loss: 0.4317, test_loss: 1.1328, test_f1: 0.6565
 epoch: 75, train_loss: 0.4139, test_loss: 1.0366, test_f1: 0.6784
 epoch: 76, train_loss: 0.4228, test_loss: 1.0272, test_f1: 0.6915
 epoch: 77, train_loss: 0.4194, test_loss: 1.0221, test_f1: 0.6813
 epoch: 78, train_loss: 0.4155, test_loss: 1.0671, test_f1: 0.6930
 epoch: 79, train_loss: 0.4087, test_loss: 1.1122, test_f1: 0.6616
 epoch: 80, train_loss: 0.4249, test_loss: 1.1416, test_f1: 0.6757
 epoch: 81, train_loss: 0.4114, test_loss: 1.0890, test_f1: 0.6804
 epoch: 82, train_loss: 0.4085, test_loss: 1.2035, test_f1: 0.6589
 epoch: 83, train_loss: 0.4060, test_loss: 1.0908, test_f1: 0.6760
 epoch: 84, train_loss: 0.4132, test_loss: 1.0380, test_f1: 0.6738
 epoch: 85, train_loss: 0.4145, test_loss: 1.0403, test_f1: 0.6664
 epoch: 86, train_loss: 0.3906, test_loss: 1.1470, test_f1: 0.6809
 epoch: 87, train_loss: 0.4031, test_loss: 1.1835, test_f1: 0.6783
 epoch: 88, train_loss: 0.3925, test_loss: 1.2046, test_f1: 0.6693
 epoch: 89, train_loss: 0.3967, test_loss: 1.1207, test_f1: 0.6843
 epoch: 90, train_loss: 0.3915, test_loss: 1.0994, test_f1: 0.6614
 epoch: 91, train_loss: 0.3951, test_loss: 1.0954, test_f1: 0.6835
 epoch: 92, train_loss: 0.3852, test_loss: 1.2358, test_f1: 0.6692
 epoch: 93, train_loss: 0.3832, test_loss: 1.1959, test_f1: 0.6653
 epoch: 94, train_loss: 0.4059, test_loss: 1.1168, test_f1: 0.6718
 epoch: 95, train_loss: 0.3890, test_loss: 1.1929, test_f1: 0.6650
 epoch: 96, train_loss: 0.3815, test_loss: 1.1484, test_f1: 0.6706
 epoch: 97, train_loss: 0.3839, test_loss: 1.1314, test_f1: 0.6749
 epoch: 98, train_loss: 0.3768, test_loss: 1.1316, test_f1: 0.6826
 epoch: 99, train_loss: 0.3790, test_loss: 1.1765, test_f1: 0.6962
##################ITERATION #9 ****************************************
 epoch: 0, train_loss: 1.2419, test_loss: 1.0091, test_f1: 0.4991
 epoch: 1, train_loss: 0.9789, test_loss: 0.9528, test_f1: 0.5102
 epoch: 2, train_loss: 0.9425, test_loss: 0.8905, test_f1: 0.5373
 epoch: 3, train_loss: 0.9255, test_loss: 0.8880, test_f1: 0.5382
 epoch: 4, train_loss: 0.8914, test_loss: 0.8721, test_f1: 0.5091
 epoch: 5, train_loss: 0.8879, test_loss: 0.8851, test_f1: 0.5249
 epoch: 6, train_loss: 0.8846, test_loss: 0.8669, test_f1: 0.5415
 epoch: 7, train_loss: 0.8668, test_loss: 0.8372, test_f1: 0.5844
 epoch: 8, train_loss: 0.8269, test_loss: 0.8163, test_f1: 0.5936
 epoch: 9, train_loss: 0.8195, test_loss: 0.8041, test_f1: 0.5810
 epoch: 10, train_loss: 0.8148, test_loss: 0.8568, test_f1: 0.5941
 epoch: 11, train_loss: 0.7916, test_loss: 0.8347, test_f1: 0.5716
 epoch: 12, train_loss: 0.7710, test_loss: 0.8030, test_f1: 0.6617
 epoch: 13, train_loss: 0.7768, test_loss: 0.8074, test_f1: 0.6266
 epoch: 14, train_loss: 0.7562, test_loss: 0.7178, test_f1: 0.6426
 epoch: 15, train_loss: 0.7485, test_loss: 0.7803, test_f1: 0.6215
 epoch: 16, train_loss: 0.7586, test_loss: 0.7815, test_f1: 0.6170
 epoch: 17, train_loss: 0.7356, test_loss: 0.7641, test_f1: 0.6158
 epoch: 18, train_loss: 0.7422, test_loss: 0.8181, test_f1: 0.6520
 epoch: 19, train_loss: 0.7361, test_loss: 0.8007, test_f1: 0.5983
 epoch: 20, train_loss: 0.7215, test_loss: 0.7442, test_f1: 0.6629
 epoch: 21, train_loss: 0.7066, test_loss: 0.7715, test_f1: 0.6361
 epoch: 22, train_loss: 0.6904, test_loss: 0.8112, test_f1: 0.6428
 epoch: 23, train_loss: 0.6901, test_loss: 0.7386, test_f1: 0.6275
 epoch: 24, train_loss: 0.6877, test_loss: 0.7620, test_f1: 0.6515
 epoch: 25, train_loss: 0.6672, test_loss: 0.7940, test_f1: 0.6297
 epoch: 26, train_loss: 0.6701, test_loss: 0.7142, test_f1: 0.6691
 epoch: 27, train_loss: 0.6597, test_loss: 0.8276, test_f1: 0.6128
 epoch: 28, train_loss: 0.6820, test_loss: 0.7884, test_f1: 0.6390
 epoch: 29, train_loss: 0.6693, test_loss: 0.7690, test_f1: 0.6510
 epoch: 30, train_loss: 0.6392, test_loss: 0.7386, test_f1: 0.6647
 epoch: 31, train_loss: 0.6504, test_loss: 0.7502, test_f1: 0.6762
 epoch: 32, train_loss: 0.6289, test_loss: 0.7555, test_f1: 0.6592
 epoch: 33, train_loss: 0.6406, test_loss: 0.7398, test_f1: 0.6585
 epoch: 34, train_loss: 0.6165, test_loss: 0.7668, test_f1: 0.6402
 epoch: 35, train_loss: 0.6109, test_loss: 0.8408, test_f1: 0.6419
 epoch: 36, train_loss: 0.6032, test_loss: 0.8009, test_f1: 0.6337
 epoch: 37, train_loss: 0.5987, test_loss: 0.7340, test_f1: 0.6623
 epoch: 38, train_loss: 0.6026, test_loss: 0.8545, test_f1: 0.6325
 epoch: 39, train_loss: 0.6029, test_loss: 0.7872, test_f1: 0.6746
 epoch: 40, train_loss: 0.5818, test_loss: 0.7915, test_f1: 0.6502
 epoch: 41, train_loss: 0.6049, test_loss: 0.7896, test_f1: 0.6554
 epoch: 42, train_loss: 0.5814, test_loss: 0.7682, test_f1: 0.6615
 epoch: 43, train_loss: 0.5690, test_loss: 0.8168, test_f1: 0.6634
 epoch: 44, train_loss: 0.5588, test_loss: 0.8232, test_f1: 0.6734
 epoch: 45, train_loss: 0.5888, test_loss: 0.8249, test_f1: 0.6711
 epoch: 46, train_loss: 0.5608, test_loss: 0.8309, test_f1: 0.6735
 epoch: 47, train_loss: 0.5636, test_loss: 0.8796, test_f1: 0.6671
 epoch: 48, train_loss: 0.5713, test_loss: 0.7499, test_f1: 0.6791
 epoch: 49, train_loss: 0.5511, test_loss: 0.6967, test_f1: 0.6743
 epoch: 50, train_loss: 0.5382, test_loss: 0.8013, test_f1: 0.6780
 epoch: 51, train_loss: 0.5303, test_loss: 0.7691, test_f1: 0.6708
 epoch: 52, train_loss: 0.4931, test_loss: 0.8271, test_f1: 0.6544
 epoch: 53, train_loss: 0.4897, test_loss: 0.7887, test_f1: 0.6621
 epoch: 54, train_loss: 0.5046, test_loss: 0.8049, test_f1: 0.6578
 epoch: 55, train_loss: 0.4769, test_loss: 0.8437, test_f1: 0.6763
 epoch: 56, train_loss: 0.4830, test_loss: 0.8294, test_f1: 0.6682
 epoch: 57, train_loss: 0.4702, test_loss: 0.8368, test_f1: 0.6907
 epoch: 58, train_loss: 0.4840, test_loss: 0.8292, test_f1: 0.6690
 epoch: 59, train_loss: 0.4853, test_loss: 0.8533, test_f1: 0.6749
 epoch: 60, train_loss: 0.4787, test_loss: 0.8464, test_f1: 0.6835
 epoch: 61, train_loss: 0.4657, test_loss: 0.9220, test_f1: 0.6834
 epoch: 62, train_loss: 0.4718, test_loss: 0.9034, test_f1: 0.6719
 epoch: 63, train_loss: 0.4554, test_loss: 0.8431, test_f1: 0.6948
 epoch: 64, train_loss: 0.4750, test_loss: 0.8167, test_f1: 0.6698
 epoch: 65, train_loss: 0.4521, test_loss: 0.9000, test_f1: 0.6611
 epoch: 66, train_loss: 0.4456, test_loss: 0.8942, test_f1: 0.6538
 epoch: 67, train_loss: 0.4440, test_loss: 0.9372, test_f1: 0.6862
 epoch: 68, train_loss: 0.4542, test_loss: 0.8708, test_f1: 0.6687
 epoch: 69, train_loss: 0.4248, test_loss: 0.9016, test_f1: 0.6793
 epoch: 70, train_loss: 0.4503, test_loss: 0.8574, test_f1: 0.6816
 epoch: 71, train_loss: 0.4416, test_loss: 0.8726, test_f1: 0.6992
 epoch: 72, train_loss: 0.4432, test_loss: 0.8669, test_f1: 0.6961
 epoch: 73, train_loss: 0.4288, test_loss: 0.9290, test_f1: 0.6823
 epoch: 74, train_loss: 0.4355, test_loss: 1.0005, test_f1: 0.6553
 epoch: 75, train_loss: 0.4277, test_loss: 0.8233, test_f1: 0.6919
 epoch: 76, train_loss: 0.4028, test_loss: 0.9968, test_f1: 0.6848
 epoch: 77, train_loss: 0.4372, test_loss: 0.9732, test_f1: 0.6843
 epoch: 78, train_loss: 0.4310, test_loss: 0.9644, test_f1: 0.6600
 epoch: 79, train_loss: 0.4178, test_loss: 1.0190, test_f1: 0.6685
 epoch: 80, train_loss: 0.4167, test_loss: 0.9414, test_f1: 0.6718
 epoch: 81, train_loss: 0.4175, test_loss: 0.9698, test_f1: 0.6658
 epoch: 82, train_loss: 0.4136, test_loss: 0.9336, test_f1: 0.6763
 epoch: 83, train_loss: 0.4181, test_loss: 0.8637, test_f1: 0.7053
 epoch: 84, train_loss: 0.4044, test_loss: 0.9301, test_f1: 0.6901
 epoch: 85, train_loss: 0.4147, test_loss: 1.0543, test_f1: 0.6369
 epoch: 86, train_loss: 0.4049, test_loss: 0.9226, test_f1: 0.6931
 epoch: 87, train_loss: 0.3994, test_loss: 0.8967, test_f1: 0.6922
 epoch: 88, train_loss: 0.3980, test_loss: 0.9667, test_f1: 0.6856
 epoch: 89, train_loss: 0.4068, test_loss: 1.0348, test_f1: 0.6715
 epoch: 90, train_loss: 0.3893, test_loss: 1.0278, test_f1: 0.6655
 epoch: 91, train_loss: 0.4004, test_loss: 1.0524, test_f1: 0.6785
 epoch: 92, train_loss: 0.3980, test_loss: 1.0532, test_f1: 0.6652
 epoch: 93, train_loss: 0.3906, test_loss: 0.9920, test_f1: 0.6969
 epoch: 94, train_loss: 0.3961, test_loss: 0.9978, test_f1: 0.6710
 epoch: 95, train_loss: 0.3905, test_loss: 1.0516, test_f1: 0.6638
 epoch: 96, train_loss: 0.3975, test_loss: 0.9833, test_f1: 0.6793
 epoch: 97, train_loss: 0.3856, test_loss: 0.9897, test_f1: 0.6966
 epoch: 98, train_loss: 0.4049, test_loss: 1.0920, test_f1: 0.6415
 epoch: 99, train_loss: 0.4042, test_loss: 0.9212, test_f1: 0.6943

Training completed in 816.12 seconds
Best F1: 0.7166 at epoch 40
Mean F1 across iterations: 0.7028  0.0072
========================FINAL RESULTS================================
FEGIN weighted F1: 0.7166  0.0072
python main.py --data ltspice_examples --representation component_pin_net --model FEGIN --layers 2 --hiddens 64 --batch_size 32 --lr 0.001 --emb_size 128 --epochs 100 --save_appendix component_pin_net_L2_H64_BS32_LR0.001_E128 --no_val
-----



STDERR:
  File "main.py", line 370, in <module>
    main()
  File "main.py", line 254, in main
    dataset = dataset_class(
  File "/home/philip/projects/ltspice_examples_code_repo/Circuit-Completion-Using-GNNs/component_classification_with_link_prediction_head/evaluation/FEGIN/kernel/circuit_datasets.py", line 15, in __init__
    self.data, self.slices = torch.load(self.processed_paths[0])
  File "/home/philip/.local/lib/python3.8/site-packages/torch/serialization.py", line 1040, in load
    warnings.warn(
  File "/usr/lib/python3.8/warnings.py", line 109, in _showwarnmsg
    sw(msg.message, msg.category, msg.filename, msg.lineno,
  File "main.py", line 47, in warn_with_traceback
    traceback.print_stack(file=log)
/home/philip/projects/ltspice_examples_code_repo/Circuit-Completion-Using-GNNs/component_classification_with_link_prediction_head/evaluation/FEGIN/kernel/circuit_datasets.py:15: FutureWarning: You are using `torch.load` with `weights_only=False` (the current default value), which uses the default pickle module implicitly. It is possible to construct malicious pickle data which will execute arbitrary code during unpickling (See https://github.com/pytorch/pytorch/blob/main/SECURITY.md#untrusted-models for more details). In a future release, the default value for `weights_only` will be flipped to `True`. This limits the functions that could be executed during unpickling. Arbitrary objects will no longer be allowed to be loaded via this mode unless they are explicitly allowlisted by the user via `torch.serialization.add_safe_globals`. We recommend you start setting `weights_only=True` for any use case where you don't have full control of the loaded file. Please open an issue on GitHub for any issues related to this experimental feature.
  self.data, self.slices = torch.load(self.processed_paths[0])
