STDOUT:
Results will be saved in /home/philip/projects/ltspice_examples_code_repo/Circuit-Completion-Using-GNNs/component_classification_with_link_prediction_head/evaluation/FEGIN/results/model_FEGIN_dataset_ltspice_demos
Command line input: python main.py --data ltspice_demos --representation component_component --model FEGIN --layers 4 --hiddens 64 --batch_size 64 --lr 0.0001 --emb_size 250 --epochs 100 --save_appendix component_component_L4_H64_BS64_LR0.0001_E250 --no_val
 is saved.
-----
ltspice_demos - FEGIN
Using 4 layers, 64 hidden units, h = 2
Loading component_component representation dataset
ENTERED
Training FEGIN on component_component representation
Train: 1565, Test: 383
##################ITERATION #0 ****************************************
 epoch: 0, train_loss: 1.3821, test_loss: 1.3773, test_f1: 0.2281
 epoch: 1, train_loss: 1.3677, test_loss: 1.3668, test_f1: 0.2281
 epoch: 2, train_loss: 1.3563, test_loss: 1.3553, test_f1: 0.2281
 epoch: 3, train_loss: 1.3432, test_loss: 1.3439, test_f1: 0.2281
 epoch: 4, train_loss: 1.3235, test_loss: 1.3300, test_f1: 0.2281
 epoch: 5, train_loss: 1.3027, test_loss: 1.3136, test_f1: 0.2281
 epoch: 6, train_loss: 1.2735, test_loss: 1.2957, test_f1: 0.2281
 epoch: 7, train_loss: 1.2460, test_loss: 1.2809, test_f1: 0.2281
 epoch: 8, train_loss: 1.2267, test_loss: 1.2672, test_f1: 0.2285
 epoch: 9, train_loss: 1.2043, test_loss: 1.2591, test_f1: 0.2318
 epoch: 10, train_loss: 1.1894, test_loss: 1.2475, test_f1: 0.2334
 epoch: 11, train_loss: 1.1796, test_loss: 1.2453, test_f1: 0.2635
 epoch: 12, train_loss: 1.1636, test_loss: 1.2421, test_f1: 0.2631
 epoch: 13, train_loss: 1.1599, test_loss: 1.2339, test_f1: 0.2614
 epoch: 14, train_loss: 1.1494, test_loss: 1.2336, test_f1: 0.2692
 epoch: 15, train_loss: 1.1395, test_loss: 1.2305, test_f1: 0.2765
 epoch: 16, train_loss: 1.1350, test_loss: 1.2244, test_f1: 0.3196
 epoch: 17, train_loss: 1.1253, test_loss: 1.2243, test_f1: 0.3063
 epoch: 18, train_loss: 1.1149, test_loss: 1.2236, test_f1: 0.3063
 epoch: 19, train_loss: 1.1111, test_loss: 1.2217, test_f1: 0.3426
 epoch: 20, train_loss: 1.1055, test_loss: 1.2173, test_f1: 0.3497
 epoch: 21, train_loss: 1.0954, test_loss: 1.2157, test_f1: 0.3233
 epoch: 22, train_loss: 1.0863, test_loss: 1.2141, test_f1: 0.3710
 epoch: 23, train_loss: 1.0786, test_loss: 1.2101, test_f1: 0.4206
 epoch: 24, train_loss: 1.0720, test_loss: 1.2080, test_f1: 0.4210
 epoch: 25, train_loss: 1.0622, test_loss: 1.1994, test_f1: 0.4283
 epoch: 26, train_loss: 1.0510, test_loss: 1.1970, test_f1: 0.4236
 epoch: 27, train_loss: 1.0515, test_loss: 1.1942, test_f1: 0.4184
 epoch: 28, train_loss: 1.0332, test_loss: 1.1999, test_f1: 0.4005
 epoch: 29, train_loss: 1.0280, test_loss: 1.1866, test_f1: 0.4053
 epoch: 30, train_loss: 1.0196, test_loss: 1.1867, test_f1: 0.4173
 epoch: 31, train_loss: 1.0019, test_loss: 1.1760, test_f1: 0.4336
 epoch: 32, train_loss: 0.9968, test_loss: 1.1817, test_f1: 0.4228
 epoch: 33, train_loss: 0.9945, test_loss: 1.1837, test_f1: 0.4249
 epoch: 34, train_loss: 0.9775, test_loss: 1.1894, test_f1: 0.4262
 epoch: 35, train_loss: 0.9716, test_loss: 1.1805, test_f1: 0.4245
 epoch: 36, train_loss: 0.9716, test_loss: 1.2118, test_f1: 0.4296
 epoch: 37, train_loss: 0.9643, test_loss: 1.1836, test_f1: 0.4473
 epoch: 38, train_loss: 0.9459, test_loss: 1.1706, test_f1: 0.4415
 epoch: 39, train_loss: 0.9457, test_loss: 1.1882, test_f1: 0.4433
 epoch: 40, train_loss: 0.9218, test_loss: 1.1952, test_f1: 0.4379
 epoch: 41, train_loss: 0.9330, test_loss: 1.2189, test_f1: 0.4430
 epoch: 42, train_loss: 0.9259, test_loss: 1.2102, test_f1: 0.4373
 epoch: 43, train_loss: 0.9088, test_loss: 1.1975, test_f1: 0.4458
 epoch: 44, train_loss: 0.8902, test_loss: 1.2023, test_f1: 0.4652
 epoch: 45, train_loss: 0.8973, test_loss: 1.1968, test_f1: 0.4815
 epoch: 46, train_loss: 0.8915, test_loss: 1.2166, test_f1: 0.4698
 epoch: 47, train_loss: 0.8881, test_loss: 1.1748, test_f1: 0.4949
 epoch: 48, train_loss: 0.8893, test_loss: 1.2283, test_f1: 0.4811
 epoch: 49, train_loss: 0.8793, test_loss: 1.2403, test_f1: 0.5207
 epoch: 50, train_loss: 0.8756, test_loss: 1.2116, test_f1: 0.4950
 epoch: 51, train_loss: 0.8681, test_loss: 1.2054, test_f1: 0.4985
 epoch: 52, train_loss: 0.8691, test_loss: 1.2165, test_f1: 0.5137
 epoch: 53, train_loss: 0.8498, test_loss: 1.2277, test_f1: 0.5171
 epoch: 54, train_loss: 0.8544, test_loss: 1.2162, test_f1: 0.5201
 epoch: 55, train_loss: 0.8443, test_loss: 1.2417, test_f1: 0.5191
 epoch: 56, train_loss: 0.8477, test_loss: 1.2432, test_f1: 0.5221
 epoch: 57, train_loss: 0.8385, test_loss: 1.2701, test_f1: 0.5099
 epoch: 58, train_loss: 0.8340, test_loss: 1.2674, test_f1: 0.5150
 epoch: 59, train_loss: 0.8290, test_loss: 1.2696, test_f1: 0.5209
 epoch: 60, train_loss: 0.8148, test_loss: 1.2889, test_f1: 0.5182
 epoch: 61, train_loss: 0.8428, test_loss: 1.2906, test_f1: 0.5189
 epoch: 62, train_loss: 0.8354, test_loss: 1.2578, test_f1: 0.5231
 epoch: 63, train_loss: 0.8202, test_loss: 1.3009, test_f1: 0.5317
 epoch: 64, train_loss: 0.8208, test_loss: 1.2857, test_f1: 0.5162
 epoch: 65, train_loss: 0.8069, test_loss: 1.2892, test_f1: 0.5204
 epoch: 66, train_loss: 0.8244, test_loss: 1.3439, test_f1: 0.4981
 epoch: 67, train_loss: 0.8155, test_loss: 1.3134, test_f1: 0.5288
 epoch: 68, train_loss: 0.8115, test_loss: 1.3003, test_f1: 0.5329
 epoch: 69, train_loss: 0.8044, test_loss: 1.3262, test_f1: 0.5290
 epoch: 70, train_loss: 0.8052, test_loss: 1.3462, test_f1: 0.5423
 epoch: 71, train_loss: 0.8154, test_loss: 1.3174, test_f1: 0.5412
 epoch: 72, train_loss: 0.8039, test_loss: 1.3083, test_f1: 0.5301
 epoch: 73, train_loss: 0.7883, test_loss: 1.3511, test_f1: 0.5262
 epoch: 74, train_loss: 0.7977, test_loss: 1.3819, test_f1: 0.5197
 epoch: 75, train_loss: 0.7919, test_loss: 1.3645, test_f1: 0.5279
 epoch: 76, train_loss: 0.7906, test_loss: 1.3626, test_f1: 0.5363
 epoch: 77, train_loss: 0.7859, test_loss: 1.3640, test_f1: 0.5364
 epoch: 78, train_loss: 0.7704, test_loss: 1.3716, test_f1: 0.5286
 epoch: 79, train_loss: 0.7991, test_loss: 1.3678, test_f1: 0.5399
 epoch: 80, train_loss: 0.7933, test_loss: 1.3400, test_f1: 0.5302
 epoch: 81, train_loss: 0.7922, test_loss: 1.3457, test_f1: 0.5255
 epoch: 82, train_loss: 0.7845, test_loss: 1.3747, test_f1: 0.5179
 epoch: 83, train_loss: 0.7718, test_loss: 1.3940, test_f1: 0.5277
 epoch: 84, train_loss: 0.7749, test_loss: 1.3981, test_f1: 0.5318
 epoch: 85, train_loss: 0.7644, test_loss: 1.4131, test_f1: 0.5201
 epoch: 86, train_loss: 0.7563, test_loss: 1.3885, test_f1: 0.5201
 epoch: 87, train_loss: 0.7528, test_loss: 1.3995, test_f1: 0.5360
 epoch: 88, train_loss: 0.7524, test_loss: 1.4381, test_f1: 0.5284
 epoch: 89, train_loss: 0.7509, test_loss: 1.3805, test_f1: 0.5289
 epoch: 90, train_loss: 0.7590, test_loss: 1.3442, test_f1: 0.5322
 epoch: 91, train_loss: 0.7579, test_loss: 1.3947, test_f1: 0.5229
 epoch: 92, train_loss: 0.7516, test_loss: 1.3999, test_f1: 0.5139
 epoch: 93, train_loss: 0.7636, test_loss: 1.4162, test_f1: 0.5239
 epoch: 94, train_loss: 0.7378, test_loss: 1.4796, test_f1: 0.5053
 epoch: 95, train_loss: 0.7550, test_loss: 1.4693, test_f1: 0.5267
 epoch: 96, train_loss: 0.7381, test_loss: 1.4417, test_f1: 0.5215
 epoch: 97, train_loss: 0.7403, test_loss: 1.4996, test_f1: 0.5023
 epoch: 98, train_loss: 0.7590, test_loss: 1.5341, test_f1: 0.5287
 epoch: 99, train_loss: 0.7449, test_loss: 1.5061, test_f1: 0.4979
##################ITERATION #1 ****************************************
 epoch: 0, train_loss: 1.3480, test_loss: 1.3688, test_f1: 0.2281
 epoch: 1, train_loss: 1.2999, test_loss: 1.3460, test_f1: 0.2643
 epoch: 2, train_loss: 1.2724, test_loss: 1.3231, test_f1: 0.3406
 epoch: 3, train_loss: 1.2444, test_loss: 1.2952, test_f1: 0.3198
 epoch: 4, train_loss: 1.2284, test_loss: 1.2905, test_f1: 0.3231
 epoch: 5, train_loss: 1.2099, test_loss: 1.2813, test_f1: 0.3244
 epoch: 6, train_loss: 1.2008, test_loss: 1.2722, test_f1: 0.3223
 epoch: 7, train_loss: 1.1882, test_loss: 1.2647, test_f1: 0.3211
 epoch: 8, train_loss: 1.1836, test_loss: 1.2605, test_f1: 0.3180
 epoch: 9, train_loss: 1.1698, test_loss: 1.2582, test_f1: 0.3146
 epoch: 10, train_loss: 1.1658, test_loss: 1.2509, test_f1: 0.3321
 epoch: 11, train_loss: 1.1520, test_loss: 1.2417, test_f1: 0.3372
 epoch: 12, train_loss: 1.1443, test_loss: 1.2484, test_f1: 0.3774
 epoch: 13, train_loss: 1.1377, test_loss: 1.2377, test_f1: 0.3865
 epoch: 14, train_loss: 1.1302, test_loss: 1.2290, test_f1: 0.3891
 epoch: 15, train_loss: 1.1205, test_loss: 1.2198, test_f1: 0.3866
 epoch: 16, train_loss: 1.1058, test_loss: 1.2184, test_f1: 0.4168
 epoch: 17, train_loss: 1.1008, test_loss: 1.2234, test_f1: 0.4161
 epoch: 18, train_loss: 1.0907, test_loss: 1.2142, test_f1: 0.4057
 epoch: 19, train_loss: 1.0845, test_loss: 1.2130, test_f1: 0.4369
 epoch: 20, train_loss: 1.0731, test_loss: 1.2036, test_f1: 0.4410
 epoch: 21, train_loss: 1.0631, test_loss: 1.2000, test_f1: 0.4400
 epoch: 22, train_loss: 1.0531, test_loss: 1.2049, test_f1: 0.4477
 epoch: 23, train_loss: 1.0487, test_loss: 1.1988, test_f1: 0.4613
 epoch: 24, train_loss: 1.0453, test_loss: 1.1909, test_f1: 0.4417
 epoch: 25, train_loss: 1.0375, test_loss: 1.1886, test_f1: 0.4616
 epoch: 26, train_loss: 1.0204, test_loss: 1.1790, test_f1: 0.4809
 epoch: 27, train_loss: 1.0199, test_loss: 1.1808, test_f1: 0.4684
 epoch: 28, train_loss: 0.9988, test_loss: 1.1839, test_f1: 0.4655
 epoch: 29, train_loss: 0.9972, test_loss: 1.1855, test_f1: 0.4836
 epoch: 30, train_loss: 0.9915, test_loss: 1.1879, test_f1: 0.4688
 epoch: 31, train_loss: 0.9879, test_loss: 1.1959, test_f1: 0.4567
 epoch: 32, train_loss: 0.9655, test_loss: 1.1834, test_f1: 0.4748
 epoch: 33, train_loss: 0.9674, test_loss: 1.1721, test_f1: 0.4852
 epoch: 34, train_loss: 0.9440, test_loss: 1.1888, test_f1: 0.5113
 epoch: 35, train_loss: 0.9382, test_loss: 1.1828, test_f1: 0.5036
 epoch: 36, train_loss: 0.9426, test_loss: 1.1674, test_f1: 0.5134
 epoch: 37, train_loss: 0.9309, test_loss: 1.1945, test_f1: 0.5132
 epoch: 38, train_loss: 0.9157, test_loss: 1.1731, test_f1: 0.5327
 epoch: 39, train_loss: 0.9187, test_loss: 1.1789, test_f1: 0.5175
 epoch: 40, train_loss: 0.9035, test_loss: 1.1736, test_f1: 0.5356
 epoch: 41, train_loss: 0.8952, test_loss: 1.1913, test_f1: 0.5433
 epoch: 42, train_loss: 0.8967, test_loss: 1.1904, test_f1: 0.5373
 epoch: 43, train_loss: 0.8831, test_loss: 1.1948, test_f1: 0.5345
 epoch: 44, train_loss: 0.8794, test_loss: 1.2002, test_f1: 0.5432
 epoch: 45, train_loss: 0.8756, test_loss: 1.1761, test_f1: 0.5547
 epoch: 46, train_loss: 0.8642, test_loss: 1.2295, test_f1: 0.5251
 epoch: 47, train_loss: 0.8643, test_loss: 1.2195, test_f1: 0.5157
 epoch: 48, train_loss: 0.8596, test_loss: 1.2066, test_f1: 0.5410
 epoch: 49, train_loss: 0.8398, test_loss: 1.2329, test_f1: 0.5362
 epoch: 50, train_loss: 0.8359, test_loss: 1.2041, test_f1: 0.5456
 epoch: 51, train_loss: 0.8224, test_loss: 1.2166, test_f1: 0.5273
 epoch: 52, train_loss: 0.8280, test_loss: 1.2177, test_f1: 0.5267
 epoch: 53, train_loss: 0.8282, test_loss: 1.2180, test_f1: 0.5102
 epoch: 54, train_loss: 0.8271, test_loss: 1.2247, test_f1: 0.5264
 epoch: 55, train_loss: 0.8118, test_loss: 1.1981, test_f1: 0.5250
 epoch: 56, train_loss: 0.8084, test_loss: 1.2233, test_f1: 0.5297
 epoch: 57, train_loss: 0.8146, test_loss: 1.2021, test_f1: 0.5249
 epoch: 58, train_loss: 0.7991, test_loss: 1.2115, test_f1: 0.5424
 epoch: 59, train_loss: 0.8084, test_loss: 1.2153, test_f1: 0.5208
 epoch: 60, train_loss: 0.7930, test_loss: 1.2258, test_f1: 0.5161
 epoch: 61, train_loss: 0.8088, test_loss: 1.2038, test_f1: 0.5187
 epoch: 62, train_loss: 0.7838, test_loss: 1.2143, test_f1: 0.5187
 epoch: 63, train_loss: 0.7898, test_loss: 1.2287, test_f1: 0.5430
 epoch: 64, train_loss: 0.7875, test_loss: 1.2153, test_f1: 0.5304
 epoch: 65, train_loss: 0.7920, test_loss: 1.2161, test_f1: 0.5399
 epoch: 66, train_loss: 0.7834, test_loss: 1.2531, test_f1: 0.5390
 epoch: 67, train_loss: 0.7965, test_loss: 1.2368, test_f1: 0.5199
 epoch: 68, train_loss: 0.7750, test_loss: 1.2274, test_f1: 0.5284
 epoch: 69, train_loss: 0.7752, test_loss: 1.2414, test_f1: 0.5466
 epoch: 70, train_loss: 0.7800, test_loss: 1.2374, test_f1: 0.5323
 epoch: 71, train_loss: 0.7801, test_loss: 1.2094, test_f1: 0.5422
 epoch: 72, train_loss: 0.7720, test_loss: 1.2341, test_f1: 0.5331
 epoch: 73, train_loss: 0.7711, test_loss: 1.2589, test_f1: 0.5181
 epoch: 74, train_loss: 0.7728, test_loss: 1.2547, test_f1: 0.5217
 epoch: 75, train_loss: 0.7571, test_loss: 1.2268, test_f1: 0.5244
 epoch: 76, train_loss: 0.7440, test_loss: 1.2285, test_f1: 0.5425
 epoch: 77, train_loss: 0.7474, test_loss: 1.2465, test_f1: 0.5392
 epoch: 78, train_loss: 0.7633, test_loss: 1.2321, test_f1: 0.5453
 epoch: 79, train_loss: 0.7423, test_loss: 1.2311, test_f1: 0.5327
 epoch: 80, train_loss: 0.7506, test_loss: 1.2498, test_f1: 0.5384
 epoch: 81, train_loss: 0.7510, test_loss: 1.2579, test_f1: 0.5438
 epoch: 82, train_loss: 0.7303, test_loss: 1.2491, test_f1: 0.5432
 epoch: 83, train_loss: 0.7569, test_loss: 1.2417, test_f1: 0.5399
 epoch: 84, train_loss: 0.7304, test_loss: 1.2066, test_f1: 0.5391
 epoch: 85, train_loss: 0.7294, test_loss: 1.2248, test_f1: 0.5468
 epoch: 86, train_loss: 0.7167, test_loss: 1.2525, test_f1: 0.5568
 epoch: 87, train_loss: 0.7273, test_loss: 1.2743, test_f1: 0.5454
 epoch: 88, train_loss: 0.7330, test_loss: 1.2750, test_f1: 0.5445
 epoch: 89, train_loss: 0.7240, test_loss: 1.2893, test_f1: 0.5449
 epoch: 90, train_loss: 0.7359, test_loss: 1.2817, test_f1: 0.5425
 epoch: 91, train_loss: 0.7185, test_loss: 1.2704, test_f1: 0.5596
 epoch: 92, train_loss: 0.7179, test_loss: 1.3137, test_f1: 0.5381
 epoch: 93, train_loss: 0.7346, test_loss: 1.2789, test_f1: 0.5468
 epoch: 94, train_loss: 0.7089, test_loss: 1.3091, test_f1: 0.5399
 epoch: 95, train_loss: 0.7208, test_loss: 1.2914, test_f1: 0.5435
 epoch: 96, train_loss: 0.7174, test_loss: 1.3198, test_f1: 0.5521
 epoch: 97, train_loss: 0.7328, test_loss: 1.2918, test_f1: 0.5386
 epoch: 98, train_loss: 0.6981, test_loss: 1.2984, test_f1: 0.5322
 epoch: 99, train_loss: 0.6998, test_loss: 1.3006, test_f1: 0.5458
##################ITERATION #2 ****************************************
 epoch: 0, train_loss: 1.3307, test_loss: 1.3908, test_f1: 0.1582
 epoch: 1, train_loss: 1.2849, test_loss: 1.3440, test_f1: 0.3415
 epoch: 2, train_loss: 1.2526, test_loss: 1.3483, test_f1: 0.3544
 epoch: 3, train_loss: 1.2340, test_loss: 1.3459, test_f1: 0.3460
 epoch: 4, train_loss: 1.2214, test_loss: 1.3477, test_f1: 0.3427
 epoch: 5, train_loss: 1.2015, test_loss: 1.3204, test_f1: 0.3323
 epoch: 6, train_loss: 1.1926, test_loss: 1.3117, test_f1: 0.3392
 epoch: 7, train_loss: 1.1888, test_loss: 1.2933, test_f1: 0.3369
 epoch: 8, train_loss: 1.1798, test_loss: 1.2943, test_f1: 0.3331
 epoch: 9, train_loss: 1.1796, test_loss: 1.2904, test_f1: 0.3498
 epoch: 10, train_loss: 1.1621, test_loss: 1.2860, test_f1: 0.3543
 epoch: 11, train_loss: 1.1640, test_loss: 1.2845, test_f1: 0.3779
 epoch: 12, train_loss: 1.1496, test_loss: 1.2917, test_f1: 0.3788
 epoch: 13, train_loss: 1.1316, test_loss: 1.2846, test_f1: 0.3894
 epoch: 14, train_loss: 1.1329, test_loss: 1.2605, test_f1: 0.4004
 epoch: 15, train_loss: 1.1310, test_loss: 1.2551, test_f1: 0.4051
 epoch: 16, train_loss: 1.1205, test_loss: 1.2686, test_f1: 0.4055
 epoch: 17, train_loss: 1.1028, test_loss: 1.2518, test_f1: 0.4161
 epoch: 18, train_loss: 1.1023, test_loss: 1.2675, test_f1: 0.4193
 epoch: 19, train_loss: 1.0949, test_loss: 1.2582, test_f1: 0.4382
 epoch: 20, train_loss: 1.0877, test_loss: 1.2530, test_f1: 0.4326
 epoch: 21, train_loss: 1.0758, test_loss: 1.2517, test_f1: 0.4490
 epoch: 22, train_loss: 1.0691, test_loss: 1.2643, test_f1: 0.4525
 epoch: 23, train_loss: 1.0580, test_loss: 1.2349, test_f1: 0.4510
 epoch: 24, train_loss: 1.0534, test_loss: 1.2425, test_f1: 0.4638
 epoch: 25, train_loss: 1.0449, test_loss: 1.2670, test_f1: 0.4856
 epoch: 26, train_loss: 1.0348, test_loss: 1.2637, test_f1: 0.4732
 epoch: 27, train_loss: 1.0183, test_loss: 1.2446, test_f1: 0.5034
 epoch: 28, train_loss: 1.0265, test_loss: 1.2329, test_f1: 0.4930
 epoch: 29, train_loss: 1.0172, test_loss: 1.2713, test_f1: 0.4979
 epoch: 30, train_loss: 1.0074, test_loss: 1.2544, test_f1: 0.4960
 epoch: 31, train_loss: 0.9839, test_loss: 1.2952, test_f1: 0.4888
 epoch: 32, train_loss: 0.9886, test_loss: 1.2522, test_f1: 0.4858
 epoch: 33, train_loss: 0.9788, test_loss: 1.2393, test_f1: 0.4840
 epoch: 34, train_loss: 0.9543, test_loss: 1.2560, test_f1: 0.5014
 epoch: 35, train_loss: 0.9569, test_loss: 1.2712, test_f1: 0.5196
 epoch: 36, train_loss: 0.9391, test_loss: 1.2670, test_f1: 0.5115
 epoch: 37, train_loss: 0.9255, test_loss: 1.2817, test_f1: 0.5212
 epoch: 38, train_loss: 0.9301, test_loss: 1.3028, test_f1: 0.5295
 epoch: 39, train_loss: 0.9328, test_loss: 1.3215, test_f1: 0.5007
 epoch: 40, train_loss: 0.9098, test_loss: 1.2940, test_f1: 0.5170
 epoch: 41, train_loss: 0.9158, test_loss: 1.3406, test_f1: 0.5179
 epoch: 42, train_loss: 0.9088, test_loss: 1.2885, test_f1: 0.5023
 epoch: 43, train_loss: 0.8970, test_loss: 1.2884, test_f1: 0.5140
 epoch: 44, train_loss: 0.8952, test_loss: 1.2512, test_f1: 0.4913
 epoch: 45, train_loss: 0.8779, test_loss: 1.2298, test_f1: 0.5370
 epoch: 46, train_loss: 0.8754, test_loss: 1.2594, test_f1: 0.5184
 epoch: 47, train_loss: 0.8658, test_loss: 1.2948, test_f1: 0.4981
 epoch: 48, train_loss: 0.8543, test_loss: 1.3638, test_f1: 0.5280
 epoch: 49, train_loss: 0.8471, test_loss: 1.2967, test_f1: 0.5033
 epoch: 50, train_loss: 0.8504, test_loss: 1.3433, test_f1: 0.4946
 epoch: 51, train_loss: 0.8535, test_loss: 1.3646, test_f1: 0.5104
 epoch: 52, train_loss: 0.8363, test_loss: 1.3328, test_f1: 0.4881
 epoch: 53, train_loss: 0.8170, test_loss: 1.3658, test_f1: 0.5085
 epoch: 54, train_loss: 0.8297, test_loss: 1.3537, test_f1: 0.4874
 epoch: 55, train_loss: 0.8238, test_loss: 1.3225, test_f1: 0.5051
 epoch: 56, train_loss: 0.8215, test_loss: 1.3779, test_f1: 0.4904
 epoch: 57, train_loss: 0.8179, test_loss: 1.3608, test_f1: 0.5189
 epoch: 58, train_loss: 0.8058, test_loss: 1.3574, test_f1: 0.5189
 epoch: 59, train_loss: 0.8058, test_loss: 1.3793, test_f1: 0.5035
 epoch: 60, train_loss: 0.8069, test_loss: 1.3479, test_f1: 0.5001
 epoch: 61, train_loss: 0.7913, test_loss: 1.3717, test_f1: 0.5104
 epoch: 62, train_loss: 0.8205, test_loss: 1.4025, test_f1: 0.4952
 epoch: 63, train_loss: 0.8041, test_loss: 1.4272, test_f1: 0.4951
 epoch: 64, train_loss: 0.8002, test_loss: 1.4297, test_f1: 0.5059
 epoch: 65, train_loss: 0.7876, test_loss: 1.3854, test_f1: 0.5055
 epoch: 66, train_loss: 0.7880, test_loss: 1.4374, test_f1: 0.5084
 epoch: 67, train_loss: 0.7756, test_loss: 1.4304, test_f1: 0.5086
 epoch: 68, train_loss: 0.7857, test_loss: 1.4631, test_f1: 0.4947
 epoch: 69, train_loss: 0.7852, test_loss: 1.4492, test_f1: 0.4980
 epoch: 70, train_loss: 0.7929, test_loss: 1.4808, test_f1: 0.4995
 epoch: 71, train_loss: 0.7810, test_loss: 1.4536, test_f1: 0.5010
 epoch: 72, train_loss: 0.7746, test_loss: 1.4356, test_f1: 0.5025
 epoch: 73, train_loss: 0.7747, test_loss: 1.4799, test_f1: 0.5052
 epoch: 74, train_loss: 0.7747, test_loss: 1.5181, test_f1: 0.5090
 epoch: 75, train_loss: 0.7644, test_loss: 1.4946, test_f1: 0.5141
 epoch: 76, train_loss: 0.7779, test_loss: 1.5007, test_f1: 0.5088
 epoch: 77, train_loss: 0.7638, test_loss: 1.5478, test_f1: 0.5009
 epoch: 78, train_loss: 0.7481, test_loss: 1.5341, test_f1: 0.5215
 epoch: 79, train_loss: 0.7631, test_loss: 1.5556, test_f1: 0.4908
 epoch: 80, train_loss: 0.7446, test_loss: 1.5401, test_f1: 0.5060
 epoch: 81, train_loss: 0.7525, test_loss: 1.4917, test_f1: 0.5001
 epoch: 82, train_loss: 0.7346, test_loss: 1.5049, test_f1: 0.5166
 epoch: 83, train_loss: 0.7514, test_loss: 1.5340, test_f1: 0.5010
 epoch: 84, train_loss: 0.7743, test_loss: 1.5113, test_f1: 0.5190
 epoch: 85, train_loss: 0.7332, test_loss: 1.5661, test_f1: 0.5007
 epoch: 86, train_loss: 0.7316, test_loss: 1.5250, test_f1: 0.5143
 epoch: 87, train_loss: 0.7334, test_loss: 1.6009, test_f1: 0.5026
 epoch: 88, train_loss: 0.7303, test_loss: 1.5989, test_f1: 0.5068
 epoch: 89, train_loss: 0.7201, test_loss: 1.6002, test_f1: 0.5057
 epoch: 90, train_loss: 0.7288, test_loss: 1.5718, test_f1: 0.4901
 epoch: 91, train_loss: 0.7218, test_loss: 1.6183, test_f1: 0.5117
 epoch: 92, train_loss: 0.7100, test_loss: 1.5885, test_f1: 0.4934
 epoch: 93, train_loss: 0.7284, test_loss: 1.6643, test_f1: 0.5092
 epoch: 94, train_loss: 0.7240, test_loss: 1.5751, test_f1: 0.5277
 epoch: 95, train_loss: 0.7177, test_loss: 1.6429, test_f1: 0.5227
 epoch: 96, train_loss: 0.7138, test_loss: 1.6571, test_f1: 0.5150
 epoch: 97, train_loss: 0.7044, test_loss: 1.6991, test_f1: 0.5139
 epoch: 98, train_loss: 0.6918, test_loss: 1.6403, test_f1: 0.4888
 epoch: 99, train_loss: 0.6937, test_loss: 1.6350, test_f1: 0.5284
##################ITERATION #3 ****************************************
 epoch: 0, train_loss: 1.2834, test_loss: 1.3257, test_f1: 0.2281
 epoch: 1, train_loss: 1.2386, test_loss: 1.2858, test_f1: 0.3232
 epoch: 2, train_loss: 1.2092, test_loss: 1.2832, test_f1: 0.3252
 epoch: 3, train_loss: 1.1999, test_loss: 1.2779, test_f1: 0.3651
 epoch: 4, train_loss: 1.1750, test_loss: 1.2632, test_f1: 0.3652
 epoch: 5, train_loss: 1.1694, test_loss: 1.2541, test_f1: 0.3702
 epoch: 6, train_loss: 1.1610, test_loss: 1.2563, test_f1: 0.3981
 epoch: 7, train_loss: 1.1475, test_loss: 1.2442, test_f1: 0.3958
 epoch: 8, train_loss: 1.1307, test_loss: 1.2323, test_f1: 0.3931
 epoch: 9, train_loss: 1.1256, test_loss: 1.2460, test_f1: 0.3956
 epoch: 10, train_loss: 1.1116, test_loss: 1.2324, test_f1: 0.3920
 epoch: 11, train_loss: 1.1040, test_loss: 1.2389, test_f1: 0.4006
 epoch: 12, train_loss: 1.0983, test_loss: 1.2361, test_f1: 0.4250
 epoch: 13, train_loss: 1.0850, test_loss: 1.2431, test_f1: 0.4046
 epoch: 14, train_loss: 1.0796, test_loss: 1.2504, test_f1: 0.4137
 epoch: 15, train_loss: 1.0752, test_loss: 1.2561, test_f1: 0.4396
 epoch: 16, train_loss: 1.0676, test_loss: 1.2532, test_f1: 0.4228
 epoch: 17, train_loss: 1.0630, test_loss: 1.2185, test_f1: 0.4461
 epoch: 18, train_loss: 1.0463, test_loss: 1.2149, test_f1: 0.4615
 epoch: 19, train_loss: 1.0403, test_loss: 1.2175, test_f1: 0.4640
 epoch: 20, train_loss: 1.0313, test_loss: 1.2256, test_f1: 0.4672
 epoch: 21, train_loss: 1.0256, test_loss: 1.2362, test_f1: 0.4706
 epoch: 22, train_loss: 1.0209, test_loss: 1.2460, test_f1: 0.4709
 epoch: 23, train_loss: 1.0022, test_loss: 1.2748, test_f1: 0.4822
 epoch: 24, train_loss: 1.0029, test_loss: 1.3288, test_f1: 0.4937
 epoch: 25, train_loss: 0.9992, test_loss: 1.2679, test_f1: 0.4801
 epoch: 26, train_loss: 0.9934, test_loss: 1.3967, test_f1: 0.4679
 epoch: 27, train_loss: 0.9820, test_loss: 1.3610, test_f1: 0.4719
 epoch: 28, train_loss: 0.9693, test_loss: 1.2922, test_f1: 0.4613
 epoch: 29, train_loss: 0.9665, test_loss: 1.4579, test_f1: 0.4846
 epoch: 30, train_loss: 0.9567, test_loss: 1.4913, test_f1: 0.4770
 epoch: 31, train_loss: 0.9504, test_loss: 1.4016, test_f1: 0.5017
 epoch: 32, train_loss: 0.9448, test_loss: 1.3724, test_f1: 0.4841
 epoch: 33, train_loss: 0.9360, test_loss: 1.4665, test_f1: 0.4853
 epoch: 34, train_loss: 0.9221, test_loss: 1.3350, test_f1: 0.4825
 epoch: 35, train_loss: 0.9272, test_loss: 1.2998, test_f1: 0.4927
 epoch: 36, train_loss: 0.9194, test_loss: 1.3468, test_f1: 0.5069
 epoch: 37, train_loss: 0.9085, test_loss: 1.3335, test_f1: 0.5133
 epoch: 38, train_loss: 0.9143, test_loss: 1.4087, test_f1: 0.5146
 epoch: 39, train_loss: 0.8957, test_loss: 1.3342, test_f1: 0.5252
 epoch: 40, train_loss: 0.8874, test_loss: 1.3820, test_f1: 0.5330
 epoch: 41, train_loss: 0.8814, test_loss: 1.3249, test_f1: 0.5257
 epoch: 42, train_loss: 0.8863, test_loss: 1.3067, test_f1: 0.5383
 epoch: 43, train_loss: 0.8761, test_loss: 1.2920, test_f1: 0.5411
 epoch: 44, train_loss: 0.8782, test_loss: 1.3256, test_f1: 0.5313
 epoch: 45, train_loss: 0.8566, test_loss: 1.2600, test_f1: 0.5322
 epoch: 46, train_loss: 0.8463, test_loss: 1.2588, test_f1: 0.5301
 epoch: 47, train_loss: 0.8435, test_loss: 1.2855, test_f1: 0.5346
 epoch: 48, train_loss: 0.8499, test_loss: 1.2536, test_f1: 0.5461
 epoch: 49, train_loss: 0.8356, test_loss: 1.2663, test_f1: 0.5207
 epoch: 50, train_loss: 0.8343, test_loss: 1.2483, test_f1: 0.5185
 epoch: 51, train_loss: 0.8436, test_loss: 1.2858, test_f1: 0.5418
 epoch: 52, train_loss: 0.8261, test_loss: 1.2795, test_f1: 0.5132
 epoch: 53, train_loss: 0.8291, test_loss: 1.2705, test_f1: 0.5142
 epoch: 54, train_loss: 0.8050, test_loss: 1.2997, test_f1: 0.5280
 epoch: 55, train_loss: 0.8008, test_loss: 1.2682, test_f1: 0.5316
 epoch: 56, train_loss: 0.8023, test_loss: 1.2987, test_f1: 0.5260
 epoch: 57, train_loss: 0.8034, test_loss: 1.2884, test_f1: 0.5231
 epoch: 58, train_loss: 0.8140, test_loss: 1.2626, test_f1: 0.5417
 epoch: 59, train_loss: 0.8017, test_loss: 1.2691, test_f1: 0.5437
 epoch: 60, train_loss: 0.7931, test_loss: 1.2723, test_f1: 0.5439
 epoch: 61, train_loss: 0.7839, test_loss: 1.3005, test_f1: 0.5359
 epoch: 62, train_loss: 0.7961, test_loss: 1.2754, test_f1: 0.5116
 epoch: 63, train_loss: 0.7861, test_loss: 1.2892, test_f1: 0.5198
 epoch: 64, train_loss: 0.7846, test_loss: 1.2866, test_f1: 0.5161
 epoch: 65, train_loss: 0.7770, test_loss: 1.2725, test_f1: 0.5389
 epoch: 66, train_loss: 0.7657, test_loss: 1.3003, test_f1: 0.5421
 epoch: 67, train_loss: 0.7800, test_loss: 1.2950, test_f1: 0.5348
 epoch: 68, train_loss: 0.7667, test_loss: 1.2990, test_f1: 0.5389
 epoch: 69, train_loss: 0.7686, test_loss: 1.3459, test_f1: 0.5272
 epoch: 70, train_loss: 0.7750, test_loss: 1.3387, test_f1: 0.5329
 epoch: 71, train_loss: 0.7893, test_loss: 1.3278, test_f1: 0.5363
 epoch: 72, train_loss: 0.7445, test_loss: 1.3603, test_f1: 0.5271
 epoch: 73, train_loss: 0.7629, test_loss: 1.3175, test_f1: 0.5622
 epoch: 74, train_loss: 0.7435, test_loss: 1.3230, test_f1: 0.5461
 epoch: 75, train_loss: 0.7424, test_loss: 1.3647, test_f1: 0.5450
 epoch: 76, train_loss: 0.7619, test_loss: 1.3348, test_f1: 0.5448
 epoch: 77, train_loss: 0.7466, test_loss: 1.3396, test_f1: 0.5454
 epoch: 78, train_loss: 0.7491, test_loss: 1.3567, test_f1: 0.5429
 epoch: 79, train_loss: 0.7299, test_loss: 1.3544, test_f1: 0.5450
 epoch: 80, train_loss: 0.7406, test_loss: 1.3407, test_f1: 0.5418
 epoch: 81, train_loss: 0.7267, test_loss: 1.3539, test_f1: 0.5507
 epoch: 82, train_loss: 0.7404, test_loss: 1.3336, test_f1: 0.5599
 epoch: 83, train_loss: 0.7376, test_loss: 1.3776, test_f1: 0.5343
 epoch: 84, train_loss: 0.7366, test_loss: 1.3685, test_f1: 0.5554
 epoch: 85, train_loss: 0.7143, test_loss: 1.3817, test_f1: 0.5785
 epoch: 86, train_loss: 0.7341, test_loss: 1.4157, test_f1: 0.5765
 epoch: 87, train_loss: 0.7205, test_loss: 1.3958, test_f1: 0.5583
 epoch: 88, train_loss: 0.7317, test_loss: 1.4176, test_f1: 0.5655
 epoch: 89, train_loss: 0.7148, test_loss: 1.4501, test_f1: 0.5639
 epoch: 90, train_loss: 0.7156, test_loss: 1.3999, test_f1: 0.5678
 epoch: 91, train_loss: 0.7148, test_loss: 1.4749, test_f1: 0.5635
 epoch: 92, train_loss: 0.7048, test_loss: 1.4661, test_f1: 0.5511
 epoch: 93, train_loss: 0.7103, test_loss: 1.4462, test_f1: 0.5497
 epoch: 94, train_loss: 0.7031, test_loss: 1.4499, test_f1: 0.5561
 epoch: 95, train_loss: 0.6873, test_loss: 1.4574, test_f1: 0.5429
 epoch: 96, train_loss: 0.6945, test_loss: 1.4547, test_f1: 0.5522
 epoch: 97, train_loss: 0.6995, test_loss: 1.4036, test_f1: 0.5811
 epoch: 98, train_loss: 0.7074, test_loss: 1.4241, test_f1: 0.5642
 epoch: 99, train_loss: 0.6880, test_loss: 1.4046, test_f1: 0.5668
##################ITERATION #4 ****************************************
 epoch: 0, train_loss: 1.2685, test_loss: 1.3236, test_f1: 0.2281
 epoch: 1, train_loss: 1.2361, test_loss: 1.3255, test_f1: 0.3104
 epoch: 2, train_loss: 1.2125, test_loss: 1.3465, test_f1: 0.3342
 epoch: 3, train_loss: 1.2112, test_loss: 1.3236, test_f1: 0.3711
 epoch: 4, train_loss: 1.1784, test_loss: 1.3075, test_f1: 0.3635
 epoch: 5, train_loss: 1.1758, test_loss: 1.2909, test_f1: 0.3680
 epoch: 6, train_loss: 1.1575, test_loss: 1.2899, test_f1: 0.3782
 epoch: 7, train_loss: 1.1450, test_loss: 1.2664, test_f1: 0.4121
 epoch: 8, train_loss: 1.1360, test_loss: 1.2415, test_f1: 0.4072
 epoch: 9, train_loss: 1.1290, test_loss: 1.2389, test_f1: 0.4160
 epoch: 10, train_loss: 1.1185, test_loss: 1.2350, test_f1: 0.4245
 epoch: 11, train_loss: 1.1004, test_loss: 1.2145, test_f1: 0.4723
 epoch: 12, train_loss: 1.1033, test_loss: 1.2261, test_f1: 0.4877
 epoch: 13, train_loss: 1.0812, test_loss: 1.2064, test_f1: 0.4968
 epoch: 14, train_loss: 1.0733, test_loss: 1.2002, test_f1: 0.5093
 epoch: 15, train_loss: 1.0675, test_loss: 1.2152, test_f1: 0.5287
 epoch: 16, train_loss: 1.0562, test_loss: 1.2366, test_f1: 0.5078
 epoch: 17, train_loss: 1.0481, test_loss: 1.2314, test_f1: 0.5186
 epoch: 18, train_loss: 1.0317, test_loss: 1.2385, test_f1: 0.5241
 epoch: 19, train_loss: 1.0382, test_loss: 1.2297, test_f1: 0.5147
 epoch: 20, train_loss: 1.0213, test_loss: 1.2390, test_f1: 0.5164
 epoch: 21, train_loss: 1.0184, test_loss: 1.2129, test_f1: 0.5210
 epoch: 22, train_loss: 1.0086, test_loss: 1.2068, test_f1: 0.5305
 epoch: 23, train_loss: 0.9993, test_loss: 1.2062, test_f1: 0.5171
 epoch: 24, train_loss: 0.9890, test_loss: 1.2385, test_f1: 0.5190
 epoch: 25, train_loss: 0.9909, test_loss: 1.2413, test_f1: 0.4967
 epoch: 26, train_loss: 0.9780, test_loss: 1.2427, test_f1: 0.5148
 epoch: 27, train_loss: 0.9751, test_loss: 1.2922, test_f1: 0.5227
 epoch: 28, train_loss: 0.9610, test_loss: 1.2468, test_f1: 0.5117
 epoch: 29, train_loss: 0.9660, test_loss: 1.2465, test_f1: 0.4890
 epoch: 30, train_loss: 0.9518, test_loss: 1.2308, test_f1: 0.5070
 epoch: 31, train_loss: 0.9369, test_loss: 1.2558, test_f1: 0.4976
 epoch: 32, train_loss: 0.9522, test_loss: 1.2478, test_f1: 0.5026
 epoch: 33, train_loss: 0.9337, test_loss: 1.2693, test_f1: 0.5018
 epoch: 34, train_loss: 0.9199, test_loss: 1.2510, test_f1: 0.5379
 epoch: 35, train_loss: 0.9118, test_loss: 1.3060, test_f1: 0.5204
 epoch: 36, train_loss: 0.9098, test_loss: 1.2828, test_f1: 0.5270
 epoch: 37, train_loss: 0.8930, test_loss: 1.3552, test_f1: 0.5076
 epoch: 38, train_loss: 0.8889, test_loss: 1.2803, test_f1: 0.5538
 epoch: 39, train_loss: 0.8951, test_loss: 1.3098, test_f1: 0.4904
 epoch: 40, train_loss: 0.8794, test_loss: 1.2828, test_f1: 0.5400
 epoch: 41, train_loss: 0.8923, test_loss: 1.2851, test_f1: 0.5670
 epoch: 42, train_loss: 0.8748, test_loss: 1.3281, test_f1: 0.5150
 epoch: 43, train_loss: 0.8738, test_loss: 1.3538, test_f1: 0.5274
 epoch: 44, train_loss: 0.8735, test_loss: 1.3312, test_f1: 0.5588
 epoch: 45, train_loss: 0.8455, test_loss: 1.4011, test_f1: 0.5399
 epoch: 46, train_loss: 0.8495, test_loss: 1.3796, test_f1: 0.5267
 epoch: 47, train_loss: 0.8451, test_loss: 1.3555, test_f1: 0.5123
 epoch: 48, train_loss: 0.8491, test_loss: 1.3567, test_f1: 0.5684
 epoch: 49, train_loss: 0.8442, test_loss: 1.4018, test_f1: 0.5456
 epoch: 50, train_loss: 0.8242, test_loss: 1.4257, test_f1: 0.5692
 epoch: 51, train_loss: 0.8383, test_loss: 1.4599, test_f1: 0.5399
 epoch: 52, train_loss: 0.8211, test_loss: 1.4116, test_f1: 0.5450
 epoch: 53, train_loss: 0.8190, test_loss: 1.4601, test_f1: 0.5526
 epoch: 54, train_loss: 0.8215, test_loss: 1.4505, test_f1: 0.5537
 epoch: 55, train_loss: 0.8097, test_loss: 1.4806, test_f1: 0.5637
 epoch: 56, train_loss: 0.8063, test_loss: 1.4411, test_f1: 0.5529
 epoch: 57, train_loss: 0.8149, test_loss: 1.4325, test_f1: 0.5465
 epoch: 58, train_loss: 0.8134, test_loss: 1.4090, test_f1: 0.5516
 epoch: 59, train_loss: 0.7960, test_loss: 1.4523, test_f1: 0.5464
 epoch: 60, train_loss: 0.8087, test_loss: 1.4490, test_f1: 0.5698
 epoch: 61, train_loss: 0.8055, test_loss: 1.4127, test_f1: 0.5316
 epoch: 62, train_loss: 0.8127, test_loss: 1.4068, test_f1: 0.5517
 epoch: 63, train_loss: 0.7915, test_loss: 1.4167, test_f1: 0.5538
 epoch: 64, train_loss: 0.7810, test_loss: 1.4509, test_f1: 0.5700
 epoch: 65, train_loss: 0.7996, test_loss: 1.4460, test_f1: 0.5569
 epoch: 66, train_loss: 0.7859, test_loss: 1.4364, test_f1: 0.5571
 epoch: 67, train_loss: 0.7883, test_loss: 1.4268, test_f1: 0.5520
 epoch: 68, train_loss: 0.7747, test_loss: 1.4191, test_f1: 0.5549
 epoch: 69, train_loss: 0.7649, test_loss: 1.4424, test_f1: 0.5573
 epoch: 70, train_loss: 0.7635, test_loss: 1.4490, test_f1: 0.5652
 epoch: 71, train_loss: 0.7694, test_loss: 1.4152, test_f1: 0.5656
 epoch: 72, train_loss: 0.7925, test_loss: 1.4402, test_f1: 0.5513
 epoch: 73, train_loss: 0.7772, test_loss: 1.4777, test_f1: 0.5418
 epoch: 74, train_loss: 0.7747, test_loss: 1.4622, test_f1: 0.5468
 epoch: 75, train_loss: 0.7697, test_loss: 1.4254, test_f1: 0.5622
 epoch: 76, train_loss: 0.7589, test_loss: 1.4521, test_f1: 0.5515
 epoch: 77, train_loss: 0.7588, test_loss: 1.4753, test_f1: 0.5516
 epoch: 78, train_loss: 0.7491, test_loss: 1.4601, test_f1: 0.5621
 epoch: 79, train_loss: 0.7713, test_loss: 1.4724, test_f1: 0.5731
 epoch: 80, train_loss: 0.7700, test_loss: 1.4957, test_f1: 0.5520
 epoch: 81, train_loss: 0.7632, test_loss: 1.5186, test_f1: 0.5683
 epoch: 82, train_loss: 0.7487, test_loss: 1.5177, test_f1: 0.5569
 epoch: 83, train_loss: 0.7587, test_loss: 1.5233, test_f1: 0.5493
 epoch: 84, train_loss: 0.7482, test_loss: 1.5497, test_f1: 0.5569
 epoch: 85, train_loss: 0.7526, test_loss: 1.5237, test_f1: 0.5569
 epoch: 86, train_loss: 0.7464, test_loss: 1.5303, test_f1: 0.5518
 epoch: 87, train_loss: 0.7386, test_loss: 1.5398, test_f1: 0.5518
 epoch: 88, train_loss: 0.7391, test_loss: 1.4806, test_f1: 0.5601
 epoch: 89, train_loss: 0.7365, test_loss: 1.5199, test_f1: 0.5571
 epoch: 90, train_loss: 0.7302, test_loss: 1.5564, test_f1: 0.5279
 epoch: 91, train_loss: 0.7391, test_loss: 1.4973, test_f1: 0.5486
 epoch: 92, train_loss: 0.7292, test_loss: 1.5343, test_f1: 0.5464
 epoch: 93, train_loss: 0.7281, test_loss: 1.5781, test_f1: 0.5495
 epoch: 94, train_loss: 0.7264, test_loss: 1.5247, test_f1: 0.5623
 epoch: 95, train_loss: 0.7326, test_loss: 1.5205, test_f1: 0.5786
 epoch: 96, train_loss: 0.7017, test_loss: 1.5736, test_f1: 0.5438
 epoch: 97, train_loss: 0.7185, test_loss: 1.5507, test_f1: 0.5435
 epoch: 98, train_loss: 0.7124, test_loss: 1.5650, test_f1: 0.5458
 epoch: 99, train_loss: 0.7290, test_loss: 1.5766, test_f1: 0.5646
##################ITERATION #5 ****************************************
 epoch: 0, train_loss: 1.2822, test_loss: 1.3671, test_f1: 0.2201
 epoch: 1, train_loss: 1.2169, test_loss: 1.3155, test_f1: 0.3940
 epoch: 2, train_loss: 1.1911, test_loss: 1.2904, test_f1: 0.4294
 epoch: 3, train_loss: 1.1838, test_loss: 1.2702, test_f1: 0.4286
 epoch: 4, train_loss: 1.1732, test_loss: 1.2620, test_f1: 0.4490
 epoch: 5, train_loss: 1.1490, test_loss: 1.2642, test_f1: 0.4337
 epoch: 6, train_loss: 1.1383, test_loss: 1.2391, test_f1: 0.4437
 epoch: 7, train_loss: 1.1171, test_loss: 1.2345, test_f1: 0.4440
 epoch: 8, train_loss: 1.1176, test_loss: 1.2333, test_f1: 0.4346
 epoch: 9, train_loss: 1.1003, test_loss: 1.2371, test_f1: 0.4323
 epoch: 10, train_loss: 1.1071, test_loss: 1.2347, test_f1: 0.4443
 epoch: 11, train_loss: 1.0911, test_loss: 1.2330, test_f1: 0.4420
 epoch: 12, train_loss: 1.0749, test_loss: 1.2175, test_f1: 0.4605
 epoch: 13, train_loss: 1.0732, test_loss: 1.2198, test_f1: 0.4764
 epoch: 14, train_loss: 1.0558, test_loss: 1.2341, test_f1: 0.4978
 epoch: 15, train_loss: 1.0455, test_loss: 1.2435, test_f1: 0.4666
 epoch: 16, train_loss: 1.0412, test_loss: 1.2401, test_f1: 0.4814
 epoch: 17, train_loss: 1.0362, test_loss: 1.2292, test_f1: 0.4945
 epoch: 18, train_loss: 1.0294, test_loss: 1.2235, test_f1: 0.5147
 epoch: 19, train_loss: 1.0148, test_loss: 1.2244, test_f1: 0.5098
 epoch: 20, train_loss: 1.0055, test_loss: 1.2130, test_f1: 0.4946
 epoch: 21, train_loss: 1.0047, test_loss: 1.2227, test_f1: 0.5186
 epoch: 22, train_loss: 0.9940, test_loss: 1.1949, test_f1: 0.5195
 epoch: 23, train_loss: 0.9806, test_loss: 1.2105, test_f1: 0.5282
 epoch: 24, train_loss: 0.9888, test_loss: 1.1782, test_f1: 0.5173
 epoch: 25, train_loss: 0.9904, test_loss: 1.1910, test_f1: 0.5174
 epoch: 26, train_loss: 0.9660, test_loss: 1.1933, test_f1: 0.5344
 epoch: 27, train_loss: 0.9610, test_loss: 1.1873, test_f1: 0.5162
 epoch: 28, train_loss: 0.9635, test_loss: 1.1911, test_f1: 0.5178
 epoch: 29, train_loss: 0.9464, test_loss: 1.2070, test_f1: 0.5105
 epoch: 30, train_loss: 0.9573, test_loss: 1.2146, test_f1: 0.4877
 epoch: 31, train_loss: 0.9387, test_loss: 1.1754, test_f1: 0.5163
 epoch: 32, train_loss: 0.9429, test_loss: 1.2109, test_f1: 0.5119
 epoch: 33, train_loss: 0.9382, test_loss: 1.2070, test_f1: 0.4917
 epoch: 34, train_loss: 0.9459, test_loss: 1.1920, test_f1: 0.5358
 epoch: 35, train_loss: 0.9279, test_loss: 1.2110, test_f1: 0.5288
 epoch: 36, train_loss: 0.9174, test_loss: 1.1685, test_f1: 0.5145
 epoch: 37, train_loss: 0.9113, test_loss: 1.2126, test_f1: 0.5147
 epoch: 38, train_loss: 0.8914, test_loss: 1.2119, test_f1: 0.5174
 epoch: 39, train_loss: 0.8941, test_loss: 1.2219, test_f1: 0.5170
 epoch: 40, train_loss: 0.8887, test_loss: 1.2021, test_f1: 0.5304
 epoch: 41, train_loss: 0.8941, test_loss: 1.2038, test_f1: 0.5295
 epoch: 42, train_loss: 0.8859, test_loss: 1.2115, test_f1: 0.5175
 epoch: 43, train_loss: 0.8861, test_loss: 1.2134, test_f1: 0.5213
 epoch: 44, train_loss: 0.8646, test_loss: 1.2284, test_f1: 0.5072
 epoch: 45, train_loss: 0.8802, test_loss: 1.2278, test_f1: 0.5044
 epoch: 46, train_loss: 0.8704, test_loss: 1.2163, test_f1: 0.5203
 epoch: 47, train_loss: 0.8622, test_loss: 1.1993, test_f1: 0.5390
 epoch: 48, train_loss: 0.8575, test_loss: 1.2308, test_f1: 0.5258
 epoch: 49, train_loss: 0.8603, test_loss: 1.2130, test_f1: 0.5505
 epoch: 50, train_loss: 0.8505, test_loss: 1.2446, test_f1: 0.5333
 epoch: 51, train_loss: 0.8487, test_loss: 1.2257, test_f1: 0.5362
 epoch: 52, train_loss: 0.8248, test_loss: 1.2334, test_f1: 0.5476
 epoch: 53, train_loss: 0.8228, test_loss: 1.2537, test_f1: 0.5576
 epoch: 54, train_loss: 0.8390, test_loss: 1.2438, test_f1: 0.5487
 epoch: 55, train_loss: 0.8560, test_loss: 1.2698, test_f1: 0.5484
 epoch: 56, train_loss: 0.8230, test_loss: 1.2455, test_f1: 0.5447
 epoch: 57, train_loss: 0.8244, test_loss: 1.2530, test_f1: 0.5399
 epoch: 58, train_loss: 0.8045, test_loss: 1.2712, test_f1: 0.5402
 epoch: 59, train_loss: 0.8113, test_loss: 1.2729, test_f1: 0.5528
 epoch: 60, train_loss: 0.8231, test_loss: 1.2746, test_f1: 0.5618
 epoch: 61, train_loss: 0.8170, test_loss: 1.2782, test_f1: 0.5464
 epoch: 62, train_loss: 0.8074, test_loss: 1.2835, test_f1: 0.5500
 epoch: 63, train_loss: 0.8085, test_loss: 1.3074, test_f1: 0.5648
 epoch: 64, train_loss: 0.7873, test_loss: 1.2858, test_f1: 0.5600
 epoch: 65, train_loss: 0.8000, test_loss: 1.2865, test_f1: 0.5713
 epoch: 66, train_loss: 0.8175, test_loss: 1.2856, test_f1: 0.5582
 epoch: 67, train_loss: 0.8017, test_loss: 1.2858, test_f1: 0.5538
 epoch: 68, train_loss: 0.7930, test_loss: 1.2719, test_f1: 0.5699
 epoch: 69, train_loss: 0.7842, test_loss: 1.2601, test_f1: 0.5603
 epoch: 70, train_loss: 0.8090, test_loss: 1.2909, test_f1: 0.5562
 epoch: 71, train_loss: 0.7715, test_loss: 1.2930, test_f1: 0.5680
 epoch: 72, train_loss: 0.7905, test_loss: 1.2785, test_f1: 0.5633
 epoch: 73, train_loss: 0.7742, test_loss: 1.3171, test_f1: 0.5317
 epoch: 74, train_loss: 0.7842, test_loss: 1.2921, test_f1: 0.5724
 epoch: 75, train_loss: 0.7745, test_loss: 1.2954, test_f1: 0.5627
 epoch: 76, train_loss: 0.7707, test_loss: 1.3152, test_f1: 0.5464
 epoch: 77, train_loss: 0.7870, test_loss: 1.3129, test_f1: 0.5616
 epoch: 78, train_loss: 0.7833, test_loss: 1.3358, test_f1: 0.5570
 epoch: 79, train_loss: 0.7747, test_loss: 1.3308, test_f1: 0.5557
 epoch: 80, train_loss: 0.7725, test_loss: 1.3121, test_f1: 0.5626
 epoch: 81, train_loss: 0.7786, test_loss: 1.3386, test_f1: 0.5594
 epoch: 82, train_loss: 0.7716, test_loss: 1.3328, test_f1: 0.5551
 epoch: 83, train_loss: 0.7549, test_loss: 1.3569, test_f1: 0.5358
 epoch: 84, train_loss: 0.7522, test_loss: 1.3690, test_f1: 0.5242
 epoch: 85, train_loss: 0.7539, test_loss: 1.3736, test_f1: 0.5542
 epoch: 86, train_loss: 0.7447, test_loss: 1.3651, test_f1: 0.5740
 epoch: 87, train_loss: 0.7609, test_loss: 1.3917, test_f1: 0.5410
 epoch: 88, train_loss: 0.7483, test_loss: 1.3436, test_f1: 0.5706
 epoch: 89, train_loss: 0.7507, test_loss: 1.3610, test_f1: 0.5632
 epoch: 90, train_loss: 0.7543, test_loss: 1.3556, test_f1: 0.5617
 epoch: 91, train_loss: 0.7629, test_loss: 1.3693, test_f1: 0.5667
 epoch: 92, train_loss: 0.7362, test_loss: 1.3772, test_f1: 0.5356
 epoch: 93, train_loss: 0.7527, test_loss: 1.3989, test_f1: 0.5402
 epoch: 94, train_loss: 0.7485, test_loss: 1.4147, test_f1: 0.5382
 epoch: 95, train_loss: 0.7277, test_loss: 1.4303, test_f1: 0.5469
 epoch: 96, train_loss: 0.7267, test_loss: 1.4194, test_f1: 0.5631
 epoch: 97, train_loss: 0.7504, test_loss: 1.4205, test_f1: 0.5547
 epoch: 98, train_loss: 0.7249, test_loss: 1.4018, test_f1: 0.5409
 epoch: 99, train_loss: 0.7531, test_loss: 1.4003, test_f1: 0.5501
##################ITERATION #6 ****************************************
 epoch: 0, train_loss: 1.2766, test_loss: 1.3137, test_f1: 0.2931
 epoch: 1, train_loss: 1.2186, test_loss: 1.2495, test_f1: 0.3884
 epoch: 2, train_loss: 1.2038, test_loss: 1.2738, test_f1: 0.4020
 epoch: 3, train_loss: 1.1919, test_loss: 1.5472, test_f1: 0.4520
 epoch: 4, train_loss: 1.1617, test_loss: 1.9815, test_f1: 0.4467
 epoch: 5, train_loss: 1.1590, test_loss: 2.0026, test_f1: 0.4500
 epoch: 6, train_loss: 1.1371, test_loss: 2.4325, test_f1: 0.4440
 epoch: 7, train_loss: 1.1303, test_loss: 2.6627, test_f1: 0.4520
 epoch: 8, train_loss: 1.1133, test_loss: 2.2485, test_f1: 0.4618
 epoch: 9, train_loss: 1.1034, test_loss: 2.0569, test_f1: 0.4476
 epoch: 10, train_loss: 1.1063, test_loss: 2.0996, test_f1: 0.5051
 epoch: 11, train_loss: 1.0898, test_loss: 2.0157, test_f1: 0.5056
 epoch: 12, train_loss: 1.0916, test_loss: 2.1674, test_f1: 0.5129
 epoch: 13, train_loss: 1.0756, test_loss: 2.2898, test_f1: 0.5052
 epoch: 14, train_loss: 1.0576, test_loss: 2.3582, test_f1: 0.5081
 epoch: 15, train_loss: 1.0500, test_loss: 2.3491, test_f1: 0.5177
 epoch: 16, train_loss: 1.0442, test_loss: 2.5513, test_f1: 0.5207
 epoch: 17, train_loss: 1.0425, test_loss: 2.3196, test_f1: 0.5221
 epoch: 18, train_loss: 1.0441, test_loss: 2.2716, test_f1: 0.5133
 epoch: 19, train_loss: 1.0262, test_loss: 2.4048, test_f1: 0.5011
 epoch: 20, train_loss: 1.0112, test_loss: 2.5136, test_f1: 0.5289
 epoch: 21, train_loss: 1.0153, test_loss: 2.5128, test_f1: 0.5239
 epoch: 22, train_loss: 1.0171, test_loss: 2.5712, test_f1: 0.5061
 epoch: 23, train_loss: 1.0031, test_loss: 2.5424, test_f1: 0.5130
 epoch: 24, train_loss: 0.9935, test_loss: 2.6282, test_f1: 0.5069
 epoch: 25, train_loss: 0.9746, test_loss: 2.5765, test_f1: 0.4867
 epoch: 26, train_loss: 0.9778, test_loss: 2.5842, test_f1: 0.5061
 epoch: 27, train_loss: 0.9681, test_loss: 2.5664, test_f1: 0.5075
 epoch: 28, train_loss: 0.9531, test_loss: 2.6466, test_f1: 0.4914
 epoch: 29, train_loss: 0.9590, test_loss: 2.6384, test_f1: 0.4990
 epoch: 30, train_loss: 0.9443, test_loss: 2.6994, test_f1: 0.4960
 epoch: 31, train_loss: 0.9450, test_loss: 2.7665, test_f1: 0.4949
 epoch: 32, train_loss: 0.9220, test_loss: 2.9578, test_f1: 0.5007
 epoch: 33, train_loss: 0.9358, test_loss: 3.1307, test_f1: 0.5130
 epoch: 34, train_loss: 0.9145, test_loss: 3.2655, test_f1: 0.4910
 epoch: 35, train_loss: 0.9246, test_loss: 3.1896, test_f1: 0.4974
 epoch: 36, train_loss: 0.9013, test_loss: 3.3272, test_f1: 0.4954
 epoch: 37, train_loss: 0.8942, test_loss: 3.2188, test_f1: 0.5074
 epoch: 38, train_loss: 0.8935, test_loss: 3.4912, test_f1: 0.5172
 epoch: 39, train_loss: 0.8981, test_loss: 3.6128, test_f1: 0.4929
 epoch: 40, train_loss: 0.8888, test_loss: 3.7637, test_f1: 0.4873
 epoch: 41, train_loss: 0.8964, test_loss: 3.9246, test_f1: 0.4744
 epoch: 42, train_loss: 0.8608, test_loss: 4.0757, test_f1: 0.4913
 epoch: 43, train_loss: 0.8720, test_loss: 4.1670, test_f1: 0.4954
 epoch: 44, train_loss: 0.8520, test_loss: 4.2592, test_f1: 0.5035
 epoch: 45, train_loss: 0.8537, test_loss: 4.0166, test_f1: 0.4937
 epoch: 46, train_loss: 0.8558, test_loss: 3.9586, test_f1: 0.5062
 epoch: 47, train_loss: 0.8507, test_loss: 5.0807, test_f1: 0.5002
 epoch: 48, train_loss: 0.8292, test_loss: 4.1188, test_f1: 0.4971
 epoch: 49, train_loss: 0.8505, test_loss: 4.5769, test_f1: 0.5029
 epoch: 50, train_loss: 0.8267, test_loss: 4.6128, test_f1: 0.5040
 epoch: 51, train_loss: 0.8244, test_loss: 4.4929, test_f1: 0.5234
 epoch: 52, train_loss: 0.8214, test_loss: 4.4472, test_f1: 0.5187
 epoch: 53, train_loss: 0.8256, test_loss: 4.2250, test_f1: 0.5106
 epoch: 54, train_loss: 0.8185, test_loss: 4.1812, test_f1: 0.5194
 epoch: 55, train_loss: 0.8166, test_loss: 4.2610, test_f1: 0.5030
 epoch: 56, train_loss: 0.7939, test_loss: 4.2955, test_f1: 0.5143
 epoch: 57, train_loss: 0.8018, test_loss: 4.6076, test_f1: 0.5183
 epoch: 58, train_loss: 0.8068, test_loss: 4.4731, test_f1: 0.5181
 epoch: 59, train_loss: 0.8120, test_loss: 4.3276, test_f1: 0.5090
 epoch: 60, train_loss: 0.8150, test_loss: 4.1991, test_f1: 0.5100
 epoch: 61, train_loss: 0.8164, test_loss: 4.5120, test_f1: 0.5189
 epoch: 62, train_loss: 0.7930, test_loss: 4.5900, test_f1: 0.5016
 epoch: 63, train_loss: 0.8200, test_loss: 4.6654, test_f1: 0.5321
 epoch: 64, train_loss: 0.7931, test_loss: 4.1984, test_f1: 0.5196
 epoch: 65, train_loss: 0.7864, test_loss: 4.2097, test_f1: 0.5127
 epoch: 66, train_loss: 0.7983, test_loss: 4.1511, test_f1: 0.5165
 epoch: 67, train_loss: 0.7711, test_loss: 4.4193, test_f1: 0.5305
 epoch: 68, train_loss: 0.7940, test_loss: 4.6611, test_f1: 0.5275
 epoch: 69, train_loss: 0.7958, test_loss: 4.5158, test_f1: 0.5163
 epoch: 70, train_loss: 0.7807, test_loss: 4.8871, test_f1: 0.5082
 epoch: 71, train_loss: 0.7645, test_loss: 4.7496, test_f1: 0.5169
 epoch: 72, train_loss: 0.7662, test_loss: 4.5276, test_f1: 0.5123
 epoch: 73, train_loss: 0.7665, test_loss: 4.8048, test_f1: 0.5240
 epoch: 74, train_loss: 0.7575, test_loss: 4.7226, test_f1: 0.5202
 epoch: 75, train_loss: 0.7626, test_loss: 5.0443, test_f1: 0.5093
 epoch: 76, train_loss: 0.7546, test_loss: 4.8108, test_f1: 0.5131
 epoch: 77, train_loss: 0.7336, test_loss: 4.6379, test_f1: 0.5170
 epoch: 78, train_loss: 0.7694, test_loss: 4.5915, test_f1: 0.5144
 epoch: 79, train_loss: 0.7604, test_loss: 4.9347, test_f1: 0.5306
 epoch: 80, train_loss: 0.7672, test_loss: 4.7088, test_f1: 0.5297
 epoch: 81, train_loss: 0.7483, test_loss: 4.7368, test_f1: 0.5235
 epoch: 82, train_loss: 0.7523, test_loss: 4.9742, test_f1: 0.5309
 epoch: 83, train_loss: 0.7395, test_loss: 5.1459, test_f1: 0.5171
 epoch: 84, train_loss: 0.7466, test_loss: 4.9161, test_f1: 0.5303
 epoch: 85, train_loss: 0.7736, test_loss: 5.2202, test_f1: 0.5281
 epoch: 86, train_loss: 0.7580, test_loss: 5.1936, test_f1: 0.5206
 epoch: 87, train_loss: 0.7323, test_loss: 4.9530, test_f1: 0.5104
 epoch: 88, train_loss: 0.7624, test_loss: 4.9008, test_f1: 0.5243
 epoch: 89, train_loss: 0.7369, test_loss: 4.9337, test_f1: 0.5184
 epoch: 90, train_loss: 0.7353, test_loss: 4.8681, test_f1: 0.5324
 epoch: 91, train_loss: 0.7484, test_loss: 4.9448, test_f1: 0.5074
 epoch: 92, train_loss: 0.7182, test_loss: 5.1659, test_f1: 0.5236
 epoch: 93, train_loss: 0.7267, test_loss: 5.1262, test_f1: 0.5307
 epoch: 94, train_loss: 0.7382, test_loss: 5.1193, test_f1: 0.5262
 epoch: 95, train_loss: 0.7277, test_loss: 5.5796, test_f1: 0.5357
 epoch: 96, train_loss: 0.7074, test_loss: 5.2892, test_f1: 0.5366
 epoch: 97, train_loss: 0.7186, test_loss: 4.8838, test_f1: 0.5322
 epoch: 98, train_loss: 0.7198, test_loss: 5.3845, test_f1: 0.5378
 epoch: 99, train_loss: 0.7154, test_loss: 5.2318, test_f1: 0.5127
##################ITERATION #7 ****************************************
 epoch: 0, train_loss: 1.3437, test_loss: 1.3551, test_f1: 0.2850
 epoch: 1, train_loss: 1.2534, test_loss: 1.3529, test_f1: 0.3466
 epoch: 2, train_loss: 1.2266, test_loss: 1.3524, test_f1: 0.4626
 epoch: 3, train_loss: 1.1938, test_loss: 1.3547, test_f1: 0.4749
 epoch: 4, train_loss: 1.1719, test_loss: 1.3145, test_f1: 0.5048
 epoch: 5, train_loss: 1.1518, test_loss: 1.3075, test_f1: 0.4857
 epoch: 6, train_loss: 1.1346, test_loss: 1.3264, test_f1: 0.5089
 epoch: 7, train_loss: 1.1233, test_loss: 1.2934, test_f1: 0.5110
 epoch: 8, train_loss: 1.1116, test_loss: 1.2825, test_f1: 0.5058
 epoch: 9, train_loss: 1.0860, test_loss: 1.2968, test_f1: 0.5111
 epoch: 10, train_loss: 1.0695, test_loss: 1.2894, test_f1: 0.5193
 epoch: 11, train_loss: 1.0628, test_loss: 1.2669, test_f1: 0.5265
 epoch: 12, train_loss: 1.0577, test_loss: 1.2456, test_f1: 0.5281
 epoch: 13, train_loss: 1.0306, test_loss: 1.3039, test_f1: 0.4955
 epoch: 14, train_loss: 1.0465, test_loss: 1.2491, test_f1: 0.5259
 epoch: 15, train_loss: 1.0261, test_loss: 1.2965, test_f1: 0.5125
 epoch: 16, train_loss: 1.0204, test_loss: 1.2838, test_f1: 0.5222
 epoch: 17, train_loss: 0.9978, test_loss: 1.2966, test_f1: 0.5288
 epoch: 18, train_loss: 0.9897, test_loss: 1.3206, test_f1: 0.5132
 epoch: 19, train_loss: 0.9912, test_loss: 1.2817, test_f1: 0.5103
 epoch: 20, train_loss: 0.9916, test_loss: 1.2802, test_f1: 0.5175
 epoch: 21, train_loss: 0.9759, test_loss: 1.2548, test_f1: 0.5116
 epoch: 22, train_loss: 0.9641, test_loss: 1.2756, test_f1: 0.5071
 epoch: 23, train_loss: 0.9701, test_loss: 1.2409, test_f1: 0.5118
 epoch: 24, train_loss: 0.9626, test_loss: 1.2725, test_f1: 0.5058
 epoch: 25, train_loss: 0.9532, test_loss: 1.2352, test_f1: 0.5077
 epoch: 26, train_loss: 0.9409, test_loss: 1.2716, test_f1: 0.5230
 epoch: 27, train_loss: 0.9423, test_loss: 1.2483, test_f1: 0.5120
 epoch: 28, train_loss: 0.9315, test_loss: 1.2348, test_f1: 0.5220
 epoch: 29, train_loss: 0.9185, test_loss: 1.2271, test_f1: 0.5155
 epoch: 30, train_loss: 0.9274, test_loss: 1.2760, test_f1: 0.5223
 epoch: 31, train_loss: 0.9050, test_loss: 1.2639, test_f1: 0.5297
 epoch: 32, train_loss: 0.9055, test_loss: 1.2650, test_f1: 0.5272
 epoch: 33, train_loss: 0.8940, test_loss: 1.2632, test_f1: 0.5370
 epoch: 34, train_loss: 0.9004, test_loss: 1.2904, test_f1: 0.5249
 epoch: 35, train_loss: 0.8827, test_loss: 1.3116, test_f1: 0.5312
 epoch: 36, train_loss: 0.8772, test_loss: 1.3020, test_f1: 0.5421
 epoch: 37, train_loss: 0.8689, test_loss: 1.2874, test_f1: 0.5348
 epoch: 38, train_loss: 0.8565, test_loss: 1.3039, test_f1: 0.5315
 epoch: 39, train_loss: 0.8938, test_loss: 1.2931, test_f1: 0.5410
 epoch: 40, train_loss: 0.8682, test_loss: 1.2756, test_f1: 0.5444
 epoch: 41, train_loss: 0.8535, test_loss: 1.2588, test_f1: 0.5448
 epoch: 42, train_loss: 0.8451, test_loss: 1.2909, test_f1: 0.5284
 epoch: 43, train_loss: 0.8506, test_loss: 1.3411, test_f1: 0.5432
 epoch: 44, train_loss: 0.8604, test_loss: 1.2872, test_f1: 0.5478
 epoch: 45, train_loss: 0.8267, test_loss: 1.3573, test_f1: 0.5509
 epoch: 46, train_loss: 0.8488, test_loss: 1.3669, test_f1: 0.5447
 epoch: 47, train_loss: 0.8222, test_loss: 1.3685, test_f1: 0.5351
 epoch: 48, train_loss: 0.8180, test_loss: 1.3750, test_f1: 0.5340
 epoch: 49, train_loss: 0.8233, test_loss: 1.3497, test_f1: 0.5412
 epoch: 50, train_loss: 0.8240, test_loss: 1.3401, test_f1: 0.5428
 epoch: 51, train_loss: 0.8222, test_loss: 1.3584, test_f1: 0.5463
 epoch: 52, train_loss: 0.7908, test_loss: 1.3797, test_f1: 0.5513
 epoch: 53, train_loss: 0.8112, test_loss: 1.3258, test_f1: 0.5545
 epoch: 54, train_loss: 0.8112, test_loss: 1.3813, test_f1: 0.5468
 epoch: 55, train_loss: 0.8018, test_loss: 1.3627, test_f1: 0.5540
 epoch: 56, train_loss: 0.7875, test_loss: 1.3734, test_f1: 0.5538
 epoch: 57, train_loss: 0.7923, test_loss: 1.3703, test_f1: 0.5558
 epoch: 58, train_loss: 0.7855, test_loss: 1.3879, test_f1: 0.5562
 epoch: 59, train_loss: 0.7805, test_loss: 1.3357, test_f1: 0.5569
 epoch: 60, train_loss: 0.7805, test_loss: 1.4173, test_f1: 0.5616
 epoch: 61, train_loss: 0.8018, test_loss: 1.3881, test_f1: 0.5537
 epoch: 62, train_loss: 0.7904, test_loss: 1.3532, test_f1: 0.5542
 epoch: 63, train_loss: 0.7878, test_loss: 1.4762, test_f1: 0.5485
 epoch: 64, train_loss: 0.7807, test_loss: 1.3508, test_f1: 0.5588
 epoch: 65, train_loss: 0.7806, test_loss: 1.3982, test_f1: 0.5510
 epoch: 66, train_loss: 0.7682, test_loss: 1.3666, test_f1: 0.5690
 epoch: 67, train_loss: 0.7710, test_loss: 1.3374, test_f1: 0.5611
 epoch: 68, train_loss: 0.7628, test_loss: 1.3645, test_f1: 0.5432
 epoch: 69, train_loss: 0.7759, test_loss: 1.3849, test_f1: 0.5484
 epoch: 70, train_loss: 0.7609, test_loss: 1.3802, test_f1: 0.5609
 epoch: 71, train_loss: 0.7678, test_loss: 1.3775, test_f1: 0.5509
 epoch: 72, train_loss: 0.7446, test_loss: 1.4419, test_f1: 0.5584
 epoch: 73, train_loss: 0.7592, test_loss: 1.4929, test_f1: 0.5588
 epoch: 74, train_loss: 0.7691, test_loss: 1.3430, test_f1: 0.5458
 epoch: 75, train_loss: 0.7557, test_loss: 1.3803, test_f1: 0.5457
 epoch: 76, train_loss: 0.7835, test_loss: 1.3828, test_f1: 0.5538
 epoch: 77, train_loss: 0.7603, test_loss: 1.4222, test_f1: 0.5511
 epoch: 78, train_loss: 0.7485, test_loss: 1.3430, test_f1: 0.5587
 epoch: 79, train_loss: 0.7388, test_loss: 1.3690, test_f1: 0.5540
 epoch: 80, train_loss: 0.7453, test_loss: 1.4011, test_f1: 0.5436
 epoch: 81, train_loss: 0.7388, test_loss: 1.3937, test_f1: 0.5615
 epoch: 82, train_loss: 0.7374, test_loss: 1.3720, test_f1: 0.5642
 epoch: 83, train_loss: 0.7347, test_loss: 1.3913, test_f1: 0.5510
 epoch: 84, train_loss: 0.7488, test_loss: 1.4244, test_f1: 0.5462
 epoch: 85, train_loss: 0.7269, test_loss: 1.4133, test_f1: 0.5458
 epoch: 86, train_loss: 0.7418, test_loss: 1.4484, test_f1: 0.5508
 epoch: 87, train_loss: 0.7251, test_loss: 1.4062, test_f1: 0.5591
 epoch: 88, train_loss: 0.7427, test_loss: 1.3917, test_f1: 0.5539
 epoch: 89, train_loss: 0.7279, test_loss: 1.3979, test_f1: 0.5380
 epoch: 90, train_loss: 0.7444, test_loss: 1.3858, test_f1: 0.5615
 epoch: 91, train_loss: 0.7452, test_loss: 1.3992, test_f1: 0.5592
 epoch: 92, train_loss: 0.7290, test_loss: 1.4241, test_f1: 0.5536
 epoch: 93, train_loss: 0.7258, test_loss: 1.4607, test_f1: 0.5399
 epoch: 94, train_loss: 0.7239, test_loss: 1.3621, test_f1: 0.5666
 epoch: 95, train_loss: 0.7318, test_loss: 1.4764, test_f1: 0.5331
 epoch: 96, train_loss: 0.7162, test_loss: 1.5165, test_f1: 0.5380
 epoch: 97, train_loss: 0.7234, test_loss: 1.4429, test_f1: 0.5516
 epoch: 98, train_loss: 0.7195, test_loss: 1.4811, test_f1: 0.5459
 epoch: 99, train_loss: 0.6992, test_loss: 1.4174, test_f1: 0.5461
##################ITERATION #8 ****************************************
 epoch: 0, train_loss: 1.3188, test_loss: 1.3754, test_f1: 0.2799
 epoch: 1, train_loss: 1.2354, test_loss: 1.3519, test_f1: 0.3005
 epoch: 2, train_loss: 1.2314, test_loss: 1.3070, test_f1: 0.3784
 epoch: 3, train_loss: 1.2138, test_loss: 1.2960, test_f1: 0.3909
 epoch: 4, train_loss: 1.1885, test_loss: 1.2758, test_f1: 0.4147
 epoch: 5, train_loss: 1.1668, test_loss: 1.2610, test_f1: 0.4202
 epoch: 6, train_loss: 1.1578, test_loss: 1.2441, test_f1: 0.4642
 epoch: 7, train_loss: 1.1355, test_loss: 1.2289, test_f1: 0.4591
 epoch: 8, train_loss: 1.1314, test_loss: 1.2338, test_f1: 0.4773
 epoch: 9, train_loss: 1.1186, test_loss: 1.2196, test_f1: 0.4891
 epoch: 10, train_loss: 1.1203, test_loss: 1.2106, test_f1: 0.5002
 epoch: 11, train_loss: 1.0826, test_loss: 1.2056, test_f1: 0.4834
 epoch: 12, train_loss: 1.0995, test_loss: 1.2066, test_f1: 0.4911
 epoch: 13, train_loss: 1.0783, test_loss: 1.1950, test_f1: 0.4924
 epoch: 14, train_loss: 1.0678, test_loss: 1.1940, test_f1: 0.5243
 epoch: 15, train_loss: 1.0769, test_loss: 1.1960, test_f1: 0.5115
 epoch: 16, train_loss: 1.0305, test_loss: 1.1934, test_f1: 0.4852
 epoch: 17, train_loss: 1.0408, test_loss: 1.1902, test_f1: 0.4946
 epoch: 18, train_loss: 1.0320, test_loss: 1.1981, test_f1: 0.4876
 epoch: 19, train_loss: 1.0301, test_loss: 1.2145, test_f1: 0.4928
 epoch: 20, train_loss: 1.0114, test_loss: 1.1927, test_f1: 0.5144
 epoch: 21, train_loss: 1.0052, test_loss: 1.1838, test_f1: 0.5200
 epoch: 22, train_loss: 1.0096, test_loss: 1.1756, test_f1: 0.5218
 epoch: 23, train_loss: 0.9949, test_loss: 1.1659, test_f1: 0.5332
 epoch: 24, train_loss: 0.9737, test_loss: 1.1678, test_f1: 0.5100
 epoch: 25, train_loss: 0.9875, test_loss: 1.1594, test_f1: 0.5325
 epoch: 26, train_loss: 0.9648, test_loss: 1.1673, test_f1: 0.5324
 epoch: 27, train_loss: 0.9797, test_loss: 1.1988, test_f1: 0.5353
 epoch: 28, train_loss: 0.9566, test_loss: 1.1874, test_f1: 0.5413
 epoch: 29, train_loss: 0.9452, test_loss: 1.1975, test_f1: 0.5330
 epoch: 30, train_loss: 0.9494, test_loss: 1.2119, test_f1: 0.5253
 epoch: 31, train_loss: 0.9432, test_loss: 1.1891, test_f1: 0.5232
 epoch: 32, train_loss: 0.9403, test_loss: 1.1611, test_f1: 0.5596
 epoch: 33, train_loss: 0.9243, test_loss: 1.1726, test_f1: 0.5615
 epoch: 34, train_loss: 0.9282, test_loss: 1.1902, test_f1: 0.5345
 epoch: 35, train_loss: 0.8954, test_loss: 1.2049, test_f1: 0.5327
 epoch: 36, train_loss: 0.8999, test_loss: 1.1877, test_f1: 0.5352
 epoch: 37, train_loss: 0.9034, test_loss: 1.2037, test_f1: 0.5460
 epoch: 38, train_loss: 0.9078, test_loss: 1.1964, test_f1: 0.5517
 epoch: 39, train_loss: 0.8821, test_loss: 1.1894, test_f1: 0.5519
 epoch: 40, train_loss: 0.8832, test_loss: 1.1896, test_f1: 0.5436
 epoch: 41, train_loss: 0.8829, test_loss: 1.1891, test_f1: 0.5558
 epoch: 42, train_loss: 0.8666, test_loss: 1.2164, test_f1: 0.5401
 epoch: 43, train_loss: 0.8466, test_loss: 1.2262, test_f1: 0.5464
 epoch: 44, train_loss: 0.8653, test_loss: 1.2280, test_f1: 0.5627
 epoch: 45, train_loss: 0.8570, test_loss: 1.2339, test_f1: 0.5616
 epoch: 46, train_loss: 0.8523, test_loss: 1.2486, test_f1: 0.5594
 epoch: 47, train_loss: 0.8473, test_loss: 1.2321, test_f1: 0.5547
 epoch: 48, train_loss: 0.8362, test_loss: 1.2071, test_f1: 0.5771
 epoch: 49, train_loss: 0.8284, test_loss: 1.2003, test_f1: 0.5810
 epoch: 50, train_loss: 0.8377, test_loss: 1.2199, test_f1: 0.5646
 epoch: 51, train_loss: 0.8254, test_loss: 1.1949, test_f1: 0.5620
 epoch: 52, train_loss: 0.8257, test_loss: 1.2075, test_f1: 0.5830
 epoch: 53, train_loss: 0.8164, test_loss: 1.2163, test_f1: 0.5592
 epoch: 54, train_loss: 0.8129, test_loss: 1.2161, test_f1: 0.5822
 epoch: 55, train_loss: 0.8111, test_loss: 1.2221, test_f1: 0.5666
 epoch: 56, train_loss: 0.8120, test_loss: 1.2179, test_f1: 0.5543
 epoch: 57, train_loss: 0.8119, test_loss: 1.2250, test_f1: 0.5629
 epoch: 58, train_loss: 0.7847, test_loss: 1.2484, test_f1: 0.5571
 epoch: 59, train_loss: 0.8032, test_loss: 1.2386, test_f1: 0.5671
 epoch: 60, train_loss: 0.8296, test_loss: 1.2357, test_f1: 0.5723
 epoch: 61, train_loss: 0.8094, test_loss: 1.1969, test_f1: 0.5952
 epoch: 62, train_loss: 0.8033, test_loss: 1.2187, test_f1: 0.5911
 epoch: 63, train_loss: 0.8058, test_loss: 1.2420, test_f1: 0.5764
 epoch: 64, train_loss: 0.7954, test_loss: 1.2423, test_f1: 0.5645
 epoch: 65, train_loss: 0.8015, test_loss: 1.2714, test_f1: 0.5783
 epoch: 66, train_loss: 0.7772, test_loss: 1.2330, test_f1: 0.5781
 epoch: 67, train_loss: 0.7898, test_loss: 1.2450, test_f1: 0.5991
 epoch: 68, train_loss: 0.7779, test_loss: 1.2499, test_f1: 0.5810
 epoch: 69, train_loss: 0.7797, test_loss: 1.2573, test_f1: 0.5803
 epoch: 70, train_loss: 0.7857, test_loss: 1.2672, test_f1: 0.5857
 epoch: 71, train_loss: 0.7802, test_loss: 1.2938, test_f1: 0.5810
 epoch: 72, train_loss: 0.7719, test_loss: 1.3053, test_f1: 0.5629
 epoch: 73, train_loss: 0.7609, test_loss: 1.2678, test_f1: 0.5815
 epoch: 74, train_loss: 0.7565, test_loss: 1.2736, test_f1: 0.5915
 epoch: 75, train_loss: 0.7532, test_loss: 1.3125, test_f1: 0.5622
 epoch: 76, train_loss: 0.7814, test_loss: 1.3454, test_f1: 0.5600
 epoch: 77, train_loss: 0.7587, test_loss: 1.3050, test_f1: 0.5676
 epoch: 78, train_loss: 0.7721, test_loss: 1.3129, test_f1: 0.5594
 epoch: 79, train_loss: 0.7647, test_loss: 1.3375, test_f1: 0.5502
 epoch: 80, train_loss: 0.7485, test_loss: 1.3222, test_f1: 0.5568
 epoch: 81, train_loss: 0.7427, test_loss: 1.3346, test_f1: 0.5489
 epoch: 82, train_loss: 0.7554, test_loss: 1.3344, test_f1: 0.5621
 epoch: 83, train_loss: 0.7388, test_loss: 1.3233, test_f1: 0.5497
 epoch: 84, train_loss: 0.7467, test_loss: 1.3331, test_f1: 0.5436
 epoch: 85, train_loss: 0.7572, test_loss: 1.3063, test_f1: 0.5257
 epoch: 86, train_loss: 0.7663, test_loss: 1.3345, test_f1: 0.5408
 epoch: 87, train_loss: 0.7446, test_loss: 1.3239, test_f1: 0.5569
 epoch: 88, train_loss: 0.7427, test_loss: 1.3295, test_f1: 0.5514
 epoch: 89, train_loss: 0.7397, test_loss: 1.3471, test_f1: 0.5696
 epoch: 90, train_loss: 0.7315, test_loss: 1.3561, test_f1: 0.5537
 epoch: 91, train_loss: 0.7187, test_loss: 1.3665, test_f1: 0.5674
 epoch: 92, train_loss: 0.7277, test_loss: 1.3796, test_f1: 0.5577
 epoch: 93, train_loss: 0.7223, test_loss: 1.3619, test_f1: 0.5672
 epoch: 94, train_loss: 0.7387, test_loss: 1.3830, test_f1: 0.5576
 epoch: 95, train_loss: 0.7211, test_loss: 1.3753, test_f1: 0.5645
 epoch: 96, train_loss: 0.7301, test_loss: 1.3816, test_f1: 0.5542
 epoch: 97, train_loss: 0.7258, test_loss: 1.3747, test_f1: 0.5569
 epoch: 98, train_loss: 0.7177, test_loss: 1.3633, test_f1: 0.5512
 epoch: 99, train_loss: 0.7255, test_loss: 1.3787, test_f1: 0.5413
##################ITERATION #9 ****************************************
 epoch: 0, train_loss: 1.3551, test_loss: 1.2977, test_f1: 0.2697
 epoch: 1, train_loss: 1.2532, test_loss: 1.3064, test_f1: 0.3177
 epoch: 2, train_loss: 1.2213, test_loss: 1.2773, test_f1: 0.3333
 epoch: 3, train_loss: 1.2080, test_loss: 1.2925, test_f1: 0.3421
 epoch: 4, train_loss: 1.1797, test_loss: 1.2799, test_f1: 0.3500
 epoch: 5, train_loss: 1.1740, test_loss: 1.2679, test_f1: 0.3597
 epoch: 6, train_loss: 1.1580, test_loss: 1.2895, test_f1: 0.3809
 epoch: 7, train_loss: 1.1600, test_loss: 1.2671, test_f1: 0.3965
 epoch: 8, train_loss: 1.1568, test_loss: 1.2717, test_f1: 0.4183
 epoch: 9, train_loss: 1.1135, test_loss: 1.2674, test_f1: 0.4452
 epoch: 10, train_loss: 1.1072, test_loss: 1.2463, test_f1: 0.4485
 epoch: 11, train_loss: 1.1154, test_loss: 1.2354, test_f1: 0.4586
 epoch: 12, train_loss: 1.1104, test_loss: 1.2398, test_f1: 0.4503
 epoch: 13, train_loss: 1.0951, test_loss: 1.2329, test_f1: 0.4659
 epoch: 14, train_loss: 1.0933, test_loss: 1.2088, test_f1: 0.4548
 epoch: 15, train_loss: 1.0795, test_loss: 1.2179, test_f1: 0.4592
 epoch: 16, train_loss: 1.0759, test_loss: 1.2036, test_f1: 0.4710
 epoch: 17, train_loss: 1.0742, test_loss: 1.1954, test_f1: 0.4792
 epoch: 18, train_loss: 1.0554, test_loss: 1.1977, test_f1: 0.4784
 epoch: 19, train_loss: 1.0350, test_loss: 1.2081, test_f1: 0.4951
 epoch: 20, train_loss: 1.0454, test_loss: 1.1942, test_f1: 0.5067
 epoch: 21, train_loss: 1.0345, test_loss: 1.2094, test_f1: 0.5160
 epoch: 22, train_loss: 1.0282, test_loss: 1.1980, test_f1: 0.5284
 epoch: 23, train_loss: 1.0231, test_loss: 1.2069, test_f1: 0.5235
 epoch: 24, train_loss: 1.0231, test_loss: 1.2072, test_f1: 0.5338
 epoch: 25, train_loss: 0.9986, test_loss: 1.1825, test_f1: 0.5334
 epoch: 26, train_loss: 1.0066, test_loss: 1.1861, test_f1: 0.5454
 epoch: 27, train_loss: 0.9846, test_loss: 1.2209, test_f1: 0.5295
 epoch: 28, train_loss: 0.9829, test_loss: 1.1968, test_f1: 0.5468
 epoch: 29, train_loss: 0.9784, test_loss: 1.2089, test_f1: 0.5238
 epoch: 30, train_loss: 0.9935, test_loss: 1.2018, test_f1: 0.5123
 epoch: 31, train_loss: 0.9595, test_loss: 1.2206, test_f1: 0.5120
 epoch: 32, train_loss: 0.9751, test_loss: 1.2077, test_f1: 0.5269
 epoch: 33, train_loss: 0.9579, test_loss: 1.1951, test_f1: 0.5359
 epoch: 34, train_loss: 0.9379, test_loss: 1.2030, test_f1: 0.5308
 epoch: 35, train_loss: 0.9319, test_loss: 1.2143, test_f1: 0.5082
 epoch: 36, train_loss: 0.9249, test_loss: 1.1970, test_f1: 0.5120
 epoch: 37, train_loss: 0.9160, test_loss: 1.1976, test_f1: 0.5314
 epoch: 38, train_loss: 0.9010, test_loss: 1.2195, test_f1: 0.5346
 epoch: 39, train_loss: 0.9097, test_loss: 1.2066, test_f1: 0.5375
 epoch: 40, train_loss: 0.9168, test_loss: 1.1982, test_f1: 0.5573
 epoch: 41, train_loss: 0.8870, test_loss: 1.1879, test_f1: 0.5513
 epoch: 42, train_loss: 0.8988, test_loss: 1.2195, test_f1: 0.5557
 epoch: 43, train_loss: 0.8892, test_loss: 1.2082, test_f1: 0.5184
 epoch: 44, train_loss: 0.8904, test_loss: 1.2095, test_f1: 0.5270
 epoch: 45, train_loss: 0.8739, test_loss: 1.2226, test_f1: 0.5181
 epoch: 46, train_loss: 0.8593, test_loss: 1.2478, test_f1: 0.5235
 epoch: 47, train_loss: 0.8583, test_loss: 1.2207, test_f1: 0.5401
 epoch: 48, train_loss: 0.8619, test_loss: 1.2333, test_f1: 0.5250
 epoch: 49, train_loss: 0.8718, test_loss: 1.2193, test_f1: 0.5460
 epoch: 50, train_loss: 0.8669, test_loss: 1.2670, test_f1: 0.5268
 epoch: 51, train_loss: 0.8529, test_loss: 1.2831, test_f1: 0.5301
 epoch: 52, train_loss: 0.8344, test_loss: 1.2679, test_f1: 0.5312
 epoch: 53, train_loss: 0.8640, test_loss: 1.2925, test_f1: 0.5236
 epoch: 54, train_loss: 0.8314, test_loss: 1.2584, test_f1: 0.5367
 epoch: 55, train_loss: 0.8558, test_loss: 1.2907, test_f1: 0.5288
 epoch: 56, train_loss: 0.8459, test_loss: 1.2659, test_f1: 0.5330
 epoch: 57, train_loss: 0.8449, test_loss: 1.2852, test_f1: 0.5438
 epoch: 58, train_loss: 0.8283, test_loss: 1.3029, test_f1: 0.5306
 epoch: 59, train_loss: 0.8217, test_loss: 1.2985, test_f1: 0.5255
 epoch: 60, train_loss: 0.8309, test_loss: 1.2884, test_f1: 0.5465
 epoch: 61, train_loss: 0.8188, test_loss: 1.3013, test_f1: 0.5521
 epoch: 62, train_loss: 0.8112, test_loss: 1.2927, test_f1: 0.5285
 epoch: 63, train_loss: 0.8324, test_loss: 1.2818, test_f1: 0.5447
 epoch: 64, train_loss: 0.8186, test_loss: 1.3010, test_f1: 0.5376
 epoch: 65, train_loss: 0.8207, test_loss: 1.2993, test_f1: 0.5511
 epoch: 66, train_loss: 0.8094, test_loss: 1.2827, test_f1: 0.5542
 epoch: 67, train_loss: 0.8034, test_loss: 1.3168, test_f1: 0.5403
 epoch: 68, train_loss: 0.8023, test_loss: 1.2946, test_f1: 0.5399
 epoch: 69, train_loss: 0.7878, test_loss: 1.2815, test_f1: 0.5529
 epoch: 70, train_loss: 0.8012, test_loss: 1.3131, test_f1: 0.5576
 epoch: 71, train_loss: 0.7970, test_loss: 1.3151, test_f1: 0.5418
 epoch: 72, train_loss: 0.7948, test_loss: 1.3148, test_f1: 0.5405
 epoch: 73, train_loss: 0.7847, test_loss: 1.3024, test_f1: 0.5322
 epoch: 74, train_loss: 0.7874, test_loss: 1.3397, test_f1: 0.5512
 epoch: 75, train_loss: 0.7943, test_loss: 1.3560, test_f1: 0.5295
 epoch: 76, train_loss: 0.7933, test_loss: 1.3306, test_f1: 0.5430
 epoch: 77, train_loss: 0.7806, test_loss: 1.3352, test_f1: 0.5308
 epoch: 78, train_loss: 0.7814, test_loss: 1.3144, test_f1: 0.5300
 epoch: 79, train_loss: 0.7705, test_loss: 1.3475, test_f1: 0.5311
 epoch: 80, train_loss: 0.7738, test_loss: 1.3621, test_f1: 0.5172
 epoch: 81, train_loss: 0.7879, test_loss: 1.3391, test_f1: 0.5335
 epoch: 82, train_loss: 0.7589, test_loss: 1.3355, test_f1: 0.5368
 epoch: 83, train_loss: 0.7675, test_loss: 1.3520, test_f1: 0.5311
 epoch: 84, train_loss: 0.7629, test_loss: 1.3545, test_f1: 0.5262
 epoch: 85, train_loss: 0.7658, test_loss: 1.3693, test_f1: 0.5158
 epoch: 86, train_loss: 0.7588, test_loss: 1.3787, test_f1: 0.5309
 epoch: 87, train_loss: 0.7587, test_loss: 1.3626, test_f1: 0.5334
 epoch: 88, train_loss: 0.7514, test_loss: 1.3525, test_f1: 0.5369
 epoch: 89, train_loss: 0.7694, test_loss: 1.3661, test_f1: 0.5389
 epoch: 90, train_loss: 0.7473, test_loss: 1.3590, test_f1: 0.5395
 epoch: 91, train_loss: 0.7562, test_loss: 1.3730, test_f1: 0.5340
 epoch: 92, train_loss: 0.7568, test_loss: 1.3510, test_f1: 0.5264
 epoch: 93, train_loss: 0.7375, test_loss: 1.3753, test_f1: 0.5331
 epoch: 94, train_loss: 0.7577, test_loss: 1.3761, test_f1: 0.5263
 epoch: 95, train_loss: 0.7463, test_loss: 1.3585, test_f1: 0.5393
 epoch: 96, train_loss: 0.7466, test_loss: 1.3835, test_f1: 0.5412
 epoch: 97, train_loss: 0.7554, test_loss: 1.3620, test_f1: 0.5452
 epoch: 98, train_loss: 0.7381, test_loss: 1.4344, test_f1: 0.5236
 epoch: 99, train_loss: 0.7383, test_loss: 1.4063, test_f1: 0.5466

Training completed in 446.13 seconds
Best F1: 0.5991 at epoch 67
Mean F1 across iterations: 0.5636  0.0195
========================FINAL RESULTS================================
FEGIN weighted F1: 0.5991  0.0195
python main.py --data ltspice_demos --representation component_component --model FEGIN --layers 4 --hiddens 64 --batch_size 64 --lr 0.0001 --emb_size 250 --epochs 100 --save_appendix component_component_L4_H64_BS64_LR0.0001_E250 --no_val
-----



STDERR:
  File "main.py", line 370, in <module>
    main()
  File "main.py", line 254, in main
    dataset = dataset_class(
  File "/home/philip/projects/ltspice_examples_code_repo/Circuit-Completion-Using-GNNs/component_classification_with_link_prediction_head/evaluation/FEGIN/kernel/circuit_datasets.py", line 15, in __init__
    self.data, self.slices = torch.load(self.processed_paths[0])
  File "/home/philip/.local/lib/python3.8/site-packages/torch/serialization.py", line 1040, in load
    warnings.warn(
  File "/usr/lib/python3.8/warnings.py", line 109, in _showwarnmsg
    sw(msg.message, msg.category, msg.filename, msg.lineno,
  File "main.py", line 47, in warn_with_traceback
    traceback.print_stack(file=log)
/home/philip/projects/ltspice_examples_code_repo/Circuit-Completion-Using-GNNs/component_classification_with_link_prediction_head/evaluation/FEGIN/kernel/circuit_datasets.py:15: FutureWarning: You are using `torch.load` with `weights_only=False` (the current default value), which uses the default pickle module implicitly. It is possible to construct malicious pickle data which will execute arbitrary code during unpickling (See https://github.com/pytorch/pytorch/blob/main/SECURITY.md#untrusted-models for more details). In a future release, the default value for `weights_only` will be flipped to `True`. This limits the functions that could be executed during unpickling. Arbitrary objects will no longer be allowed to be loaded via this mode unless they are explicitly allowlisted by the user via `torch.serialization.add_safe_globals`. We recommend you start setting `weights_only=True` for any use case where you don't have full control of the loaded file. Please open an issue on GitHub for any issues related to this experimental feature.
  self.data, self.slices = torch.load(self.processed_paths[0])
