STDOUT:
Results will be saved in /home/philip/projects/ltspice_examples_code_repo/Circuit-Completion-Using-GNNs/component_classification_with_link_prediction_head/evaluation/FEGIN/results/model_FEGIN_dataset_ltspice_demos
Command line input: python main.py --data ltspice_demos --representation component_pin_net --model FEGIN --layers 4 --hiddens 64 --batch_size 64 --lr 0.001 --emb_size 128 --epochs 100 --save_appendix component_pin_net_L4_H64_BS64_LR0.001_E128 --no_val
 is saved.
-----
ltspice_demos - FEGIN
Using 4 layers, 64 hidden units, h = 2
Loading component_pin_net representation dataset
ENTERED
Training FEGIN on component_pin_net representation
Train: 1565, Test: 383
##################ITERATION #0 ****************************************
 epoch: 0, train_loss: 1.2781, test_loss: 1.3111, test_f1: 0.3232
 epoch: 1, train_loss: 1.0866, test_loss: 1.2238, test_f1: 0.4166
 epoch: 2, train_loss: 1.0209, test_loss: 1.1388, test_f1: 0.4453
 epoch: 3, train_loss: 0.9880, test_loss: 1.0891, test_f1: 0.4520
 epoch: 4, train_loss: 0.9609, test_loss: 1.0485, test_f1: 0.4905
 epoch: 5, train_loss: 0.9445, test_loss: 1.0909, test_f1: 0.4935
 epoch: 6, train_loss: 0.9387, test_loss: 1.0717, test_f1: 0.5589
 epoch: 7, train_loss: 0.9194, test_loss: 1.1699, test_f1: 0.5158
 epoch: 8, train_loss: 0.8937, test_loss: 1.0475, test_f1: 0.5591
 epoch: 9, train_loss: 0.8926, test_loss: 1.0317, test_f1: 0.5911
 epoch: 10, train_loss: 0.8759, test_loss: 1.0677, test_f1: 0.5319
 epoch: 11, train_loss: 0.8470, test_loss: 1.0356, test_f1: 0.6076
 epoch: 12, train_loss: 0.8349, test_loss: 1.0547, test_f1: 0.5656
 epoch: 13, train_loss: 0.8072, test_loss: 1.1575, test_f1: 0.5558
 epoch: 14, train_loss: 0.7917, test_loss: 1.0161, test_f1: 0.6156
 epoch: 15, train_loss: 0.7637, test_loss: 0.9901, test_f1: 0.6161
 epoch: 16, train_loss: 0.7535, test_loss: 1.0291, test_f1: 0.5682
 epoch: 17, train_loss: 0.7117, test_loss: 0.9785, test_f1: 0.6208
 epoch: 18, train_loss: 0.6969, test_loss: 1.0970, test_f1: 0.6070
 epoch: 19, train_loss: 0.6948, test_loss: 1.1828, test_f1: 0.5834
 epoch: 20, train_loss: 0.6748, test_loss: 1.0192, test_f1: 0.6013
 epoch: 21, train_loss: 0.6606, test_loss: 1.0327, test_f1: 0.6138
 epoch: 22, train_loss: 0.6129, test_loss: 1.0834, test_f1: 0.6171
 epoch: 23, train_loss: 0.6024, test_loss: 1.0003, test_f1: 0.6388
 epoch: 24, train_loss: 0.5891, test_loss: 1.0246, test_f1: 0.6322
 epoch: 25, train_loss: 0.5942, test_loss: 1.1021, test_f1: 0.6516
 epoch: 26, train_loss: 0.5936, test_loss: 1.1201, test_f1: 0.6407
 epoch: 27, train_loss: 0.5581, test_loss: 1.2395, test_f1: 0.6157
 epoch: 28, train_loss: 0.5364, test_loss: 1.1345, test_f1: 0.6548
 epoch: 29, train_loss: 0.5349, test_loss: 1.1192, test_f1: 0.6353
 epoch: 30, train_loss: 0.5244, test_loss: 1.4030, test_f1: 0.5987
 epoch: 31, train_loss: 0.5106, test_loss: 1.2438, test_f1: 0.6261
 epoch: 32, train_loss: 0.4995, test_loss: 1.2676, test_f1: 0.5901
 epoch: 33, train_loss: 0.5132, test_loss: 1.2231, test_f1: 0.5721
 epoch: 34, train_loss: 0.4905, test_loss: 1.4138, test_f1: 0.5441
 epoch: 35, train_loss: 0.4606, test_loss: 1.3395, test_f1: 0.6319
 epoch: 36, train_loss: 0.4467, test_loss: 1.8346, test_f1: 0.4987
 epoch: 37, train_loss: 0.4275, test_loss: 1.4913, test_f1: 0.6200
 epoch: 38, train_loss: 0.4794, test_loss: 1.6265, test_f1: 0.5540
 epoch: 39, train_loss: 0.4381, test_loss: 1.5292, test_f1: 0.5813
 epoch: 40, train_loss: 0.4279, test_loss: 1.5445, test_f1: 0.6102
 epoch: 41, train_loss: 0.4200, test_loss: 1.5579, test_f1: 0.5890
 epoch: 42, train_loss: 0.3807, test_loss: 1.5974, test_f1: 0.6100
 epoch: 43, train_loss: 0.3646, test_loss: 1.6912, test_f1: 0.6005
 epoch: 44, train_loss: 0.3792, test_loss: 1.8711, test_f1: 0.5714
 epoch: 45, train_loss: 0.3629, test_loss: 1.8064, test_f1: 0.6333
 epoch: 46, train_loss: 0.4006, test_loss: 1.6570, test_f1: 0.6306
 epoch: 47, train_loss: 0.3464, test_loss: 1.7919, test_f1: 0.6111
 epoch: 48, train_loss: 0.3368, test_loss: 1.7455, test_f1: 0.6355
 epoch: 49, train_loss: 0.3065, test_loss: 2.0076, test_f1: 0.5997
 epoch: 50, train_loss: 0.3378, test_loss: 1.9510, test_f1: 0.5971
 epoch: 51, train_loss: 0.2831, test_loss: 1.9269, test_f1: 0.6129
 epoch: 52, train_loss: 0.2695, test_loss: 2.0796, test_f1: 0.6040
 epoch: 53, train_loss: 0.2610, test_loss: 2.0509, test_f1: 0.6312
 epoch: 54, train_loss: 0.2366, test_loss: 2.0072, test_f1: 0.6177
 epoch: 55, train_loss: 0.2517, test_loss: 2.1015, test_f1: 0.5980
 epoch: 56, train_loss: 0.2354, test_loss: 2.2770, test_f1: 0.5949
 epoch: 57, train_loss: 0.2248, test_loss: 2.1975, test_f1: 0.6253
 epoch: 58, train_loss: 0.2106, test_loss: 2.1787, test_f1: 0.6145
 epoch: 59, train_loss: 0.2431, test_loss: 2.3376, test_f1: 0.5828
 epoch: 60, train_loss: 0.2461, test_loss: 2.1929, test_f1: 0.6129
 epoch: 61, train_loss: 0.2200, test_loss: 2.5282, test_f1: 0.5851
 epoch: 62, train_loss: 0.2144, test_loss: 2.2743, test_f1: 0.5986
 epoch: 63, train_loss: 0.2063, test_loss: 2.2980, test_f1: 0.6238
 epoch: 64, train_loss: 0.1809, test_loss: 2.4819, test_f1: 0.6135
 epoch: 65, train_loss: 0.1860, test_loss: 2.2663, test_f1: 0.6299
 epoch: 66, train_loss: 0.1893, test_loss: 2.5302, test_f1: 0.6227
 epoch: 67, train_loss: 0.1819, test_loss: 2.4761, test_f1: 0.6059
 epoch: 68, train_loss: 0.1722, test_loss: 2.5105, test_f1: 0.6311
 epoch: 69, train_loss: 0.2040, test_loss: 2.6855, test_f1: 0.6217
 epoch: 70, train_loss: 0.2325, test_loss: 2.4965, test_f1: 0.6448
 epoch: 71, train_loss: 0.1834, test_loss: 2.4833, test_f1: 0.6057
 epoch: 72, train_loss: 0.1804, test_loss: 2.4414, test_f1: 0.6022
 epoch: 73, train_loss: 0.1855, test_loss: 2.8291, test_f1: 0.6103
 epoch: 74, train_loss: 0.1912, test_loss: 2.6811, test_f1: 0.6198
 epoch: 75, train_loss: 0.1631, test_loss: 2.5535, test_f1: 0.6299
 epoch: 76, train_loss: 0.1600, test_loss: 2.6111, test_f1: 0.6026
 epoch: 77, train_loss: 0.1477, test_loss: 2.8921, test_f1: 0.6208
 epoch: 78, train_loss: 0.1525, test_loss: 2.8092, test_f1: 0.6365
 epoch: 79, train_loss: 0.1761, test_loss: 2.6795, test_f1: 0.6261
 epoch: 80, train_loss: 0.1724, test_loss: 2.8370, test_f1: 0.6077
 epoch: 81, train_loss: 0.1699, test_loss: 2.9017, test_f1: 0.6141
 epoch: 82, train_loss: 0.1394, test_loss: 2.7034, test_f1: 0.6131
 epoch: 83, train_loss: 0.1282, test_loss: 2.9644, test_f1: 0.6171
 epoch: 84, train_loss: 0.1629, test_loss: 2.9786, test_f1: 0.6111
 epoch: 85, train_loss: 0.1885, test_loss: 2.7528, test_f1: 0.6108
 epoch: 86, train_loss: 0.1562, test_loss: 2.8141, test_f1: 0.6359
 epoch: 87, train_loss: 0.1388, test_loss: 2.8636, test_f1: 0.6224
 epoch: 88, train_loss: 0.1243, test_loss: 2.9170, test_f1: 0.6322
 epoch: 89, train_loss: 0.1245, test_loss: 3.1669, test_f1: 0.6104
 epoch: 90, train_loss: 0.1349, test_loss: 3.0669, test_f1: 0.6266
 epoch: 91, train_loss: 0.1516, test_loss: 2.9414, test_f1: 0.6285
 epoch: 92, train_loss: 0.1221, test_loss: 2.9756, test_f1: 0.6169
 epoch: 93, train_loss: 0.1598, test_loss: 3.2441, test_f1: 0.6216
 epoch: 94, train_loss: 0.1548, test_loss: 3.2358, test_f1: 0.5928
 epoch: 95, train_loss: 0.1369, test_loss: 3.1334, test_f1: 0.6423
 epoch: 96, train_loss: 0.1248, test_loss: 2.9820, test_f1: 0.6353
 epoch: 97, train_loss: 0.1216, test_loss: 3.2424, test_f1: 0.6177
 epoch: 98, train_loss: 0.1191, test_loss: 3.1750, test_f1: 0.6160
 epoch: 99, train_loss: 0.1295, test_loss: 3.1211, test_f1: 0.6220
##################ITERATION #1 ****************************************
 epoch: 0, train_loss: 1.1191, test_loss: 2.1979, test_f1: 0.0301
 epoch: 1, train_loss: 0.9982, test_loss: 2.1798, test_f1: 0.1151
 epoch: 2, train_loss: 0.9609, test_loss: 1.1109, test_f1: 0.4574
 epoch: 3, train_loss: 0.9342, test_loss: 1.0186, test_f1: 0.5598
 epoch: 4, train_loss: 0.9086, test_loss: 1.0250, test_f1: 0.5441
 epoch: 5, train_loss: 0.8861, test_loss: 1.0129, test_f1: 0.5471
 epoch: 6, train_loss: 0.8460, test_loss: 1.0339, test_f1: 0.5285
 epoch: 7, train_loss: 0.8461, test_loss: 0.9900, test_f1: 0.5548
 epoch: 8, train_loss: 0.8148, test_loss: 1.0964, test_f1: 0.5814
 epoch: 9, train_loss: 0.7992, test_loss: 1.0621, test_f1: 0.5400
 epoch: 10, train_loss: 0.7961, test_loss: 1.0783, test_f1: 0.5485
 epoch: 11, train_loss: 0.7661, test_loss: 1.0559, test_f1: 0.5647
 epoch: 12, train_loss: 0.7416, test_loss: 0.9966, test_f1: 0.6124
 epoch: 13, train_loss: 0.7168, test_loss: 1.0403, test_f1: 0.5621
 epoch: 14, train_loss: 0.7096, test_loss: 1.0944, test_f1: 0.5558
 epoch: 15, train_loss: 0.6673, test_loss: 1.0236, test_f1: 0.5940
 epoch: 16, train_loss: 0.6576, test_loss: 1.1160, test_f1: 0.5991
 epoch: 17, train_loss: 0.6419, test_loss: 1.1670, test_f1: 0.6133
 epoch: 18, train_loss: 0.6218, test_loss: 1.1874, test_f1: 0.5796
 epoch: 19, train_loss: 0.6111, test_loss: 1.0652, test_f1: 0.6001
 epoch: 20, train_loss: 0.6197, test_loss: 1.0582, test_f1: 0.6438
 epoch: 21, train_loss: 0.5787, test_loss: 1.1517, test_f1: 0.5884
 epoch: 22, train_loss: 0.5716, test_loss: 1.2197, test_f1: 0.5477
 epoch: 23, train_loss: 0.5272, test_loss: 1.2312, test_f1: 0.6315
 epoch: 24, train_loss: 0.5306, test_loss: 1.1681, test_f1: 0.6541
 epoch: 25, train_loss: 0.5527, test_loss: 1.1134, test_f1: 0.5871
 epoch: 26, train_loss: 0.5078, test_loss: 1.2361, test_f1: 0.6239
 epoch: 27, train_loss: 0.4866, test_loss: 1.2651, test_f1: 0.6402
 epoch: 28, train_loss: 0.4819, test_loss: 1.1656, test_f1: 0.6451
 epoch: 29, train_loss: 0.4589, test_loss: 1.4521, test_f1: 0.6139
 epoch: 30, train_loss: 0.4469, test_loss: 1.2913, test_f1: 0.6220
 epoch: 31, train_loss: 0.4620, test_loss: 1.4360, test_f1: 0.5934
 epoch: 32, train_loss: 0.4571, test_loss: 1.3381, test_f1: 0.5921
 epoch: 33, train_loss: 0.4674, test_loss: 1.3101, test_f1: 0.6411
 epoch: 34, train_loss: 0.4196, test_loss: 1.3447, test_f1: 0.6238
 epoch: 35, train_loss: 0.4103, test_loss: 1.3693, test_f1: 0.6561
 epoch: 36, train_loss: 0.4426, test_loss: 1.3650, test_f1: 0.6297
 epoch: 37, train_loss: 0.4220, test_loss: 1.5613, test_f1: 0.5970
 epoch: 38, train_loss: 0.4116, test_loss: 1.4313, test_f1: 0.6513
 epoch: 39, train_loss: 0.3662, test_loss: 1.5100, test_f1: 0.6612
 epoch: 40, train_loss: 0.3714, test_loss: 1.5887, test_f1: 0.6389
 epoch: 41, train_loss: 0.3432, test_loss: 1.5562, test_f1: 0.6195
 epoch: 42, train_loss: 0.3987, test_loss: 1.6200, test_f1: 0.6685
 epoch: 43, train_loss: 0.3301, test_loss: 1.7332, test_f1: 0.6329
 epoch: 44, train_loss: 0.3292, test_loss: 1.7297, test_f1: 0.6178
 epoch: 45, train_loss: 0.3388, test_loss: 1.7923, test_f1: 0.5938
 epoch: 46, train_loss: 0.3310, test_loss: 1.8684, test_f1: 0.6037
 epoch: 47, train_loss: 0.3302, test_loss: 1.9631, test_f1: 0.5690
 epoch: 48, train_loss: 0.2984, test_loss: 1.8548, test_f1: 0.6319
 epoch: 49, train_loss: 0.3147, test_loss: 1.8828, test_f1: 0.6460
 epoch: 50, train_loss: 0.2941, test_loss: 2.0597, test_f1: 0.6190
 epoch: 51, train_loss: 0.2390, test_loss: 1.9394, test_f1: 0.6145
 epoch: 52, train_loss: 0.2319, test_loss: 1.9887, test_f1: 0.6460
 epoch: 53, train_loss: 0.2589, test_loss: 2.0110, test_f1: 0.6209
 epoch: 54, train_loss: 0.2132, test_loss: 2.0951, test_f1: 0.6381
 epoch: 55, train_loss: 0.2165, test_loss: 2.1133, test_f1: 0.6348
 epoch: 56, train_loss: 0.2011, test_loss: 2.2446, test_f1: 0.6321
 epoch: 57, train_loss: 0.1975, test_loss: 2.1883, test_f1: 0.6544
 epoch: 58, train_loss: 0.1963, test_loss: 2.2367, test_f1: 0.6108
 epoch: 59, train_loss: 0.1788, test_loss: 2.3278, test_f1: 0.6246
 epoch: 60, train_loss: 0.2011, test_loss: 2.4026, test_f1: 0.6013
 epoch: 61, train_loss: 0.1601, test_loss: 2.4168, test_f1: 0.6257
 epoch: 62, train_loss: 0.2008, test_loss: 2.4336, test_f1: 0.5711
 epoch: 63, train_loss: 0.2011, test_loss: 2.2634, test_f1: 0.6233
 epoch: 64, train_loss: 0.2072, test_loss: 2.6026, test_f1: 0.5873
 epoch: 65, train_loss: 0.2065, test_loss: 2.3098, test_f1: 0.6220
 epoch: 66, train_loss: 0.1702, test_loss: 2.5941, test_f1: 0.6205
 epoch: 67, train_loss: 0.1573, test_loss: 2.4607, test_f1: 0.6331
 epoch: 68, train_loss: 0.1823, test_loss: 2.5889, test_f1: 0.6121
 epoch: 69, train_loss: 0.1742, test_loss: 2.5404, test_f1: 0.6016
 epoch: 70, train_loss: 0.1465, test_loss: 2.4725, test_f1: 0.6127
 epoch: 71, train_loss: 0.1539, test_loss: 2.6605, test_f1: 0.6200
 epoch: 72, train_loss: 0.1500, test_loss: 2.6056, test_f1: 0.6050
 epoch: 73, train_loss: 0.1738, test_loss: 2.7526, test_f1: 0.5876
 epoch: 74, train_loss: 0.1675, test_loss: 2.5692, test_f1: 0.6009
 epoch: 75, train_loss: 0.1686, test_loss: 2.6587, test_f1: 0.6316
 epoch: 76, train_loss: 0.1687, test_loss: 2.6980, test_f1: 0.6234
 epoch: 77, train_loss: 0.1302, test_loss: 2.8183, test_f1: 0.6198
 epoch: 78, train_loss: 0.1531, test_loss: 2.7967, test_f1: 0.6175
 epoch: 79, train_loss: 0.1561, test_loss: 2.7396, test_f1: 0.6127
 epoch: 80, train_loss: 0.1483, test_loss: 2.9523, test_f1: 0.6271
 epoch: 81, train_loss: 0.1516, test_loss: 2.8758, test_f1: 0.6030
 epoch: 82, train_loss: 0.1808, test_loss: 2.7516, test_f1: 0.6305
 epoch: 83, train_loss: 0.1576, test_loss: 2.6719, test_f1: 0.6239
 epoch: 84, train_loss: 0.1286, test_loss: 2.7691, test_f1: 0.6303
 epoch: 85, train_loss: 0.1315, test_loss: 2.9587, test_f1: 0.6054
 epoch: 86, train_loss: 0.1378, test_loss: 3.0503, test_f1: 0.6276
 epoch: 87, train_loss: 0.1183, test_loss: 3.1673, test_f1: 0.6150
 epoch: 88, train_loss: 0.1182, test_loss: 3.1261, test_f1: 0.6226
 epoch: 89, train_loss: 0.1242, test_loss: 3.1429, test_f1: 0.5960
 epoch: 90, train_loss: 0.1816, test_loss: 3.1577, test_f1: 0.6137
 epoch: 91, train_loss: 0.1467, test_loss: 2.9551, test_f1: 0.6341
 epoch: 92, train_loss: 0.1192, test_loss: 3.1081, test_f1: 0.6149
 epoch: 93, train_loss: 0.1072, test_loss: 2.9471, test_f1: 0.6209
 epoch: 94, train_loss: 0.1256, test_loss: 2.9602, test_f1: 0.6260
 epoch: 95, train_loss: 0.1311, test_loss: 3.1623, test_f1: 0.6233
 epoch: 96, train_loss: 0.1274, test_loss: 3.1701, test_f1: 0.6064
 epoch: 97, train_loss: 0.1177, test_loss: 2.9759, test_f1: 0.6214
 epoch: 98, train_loss: 0.1424, test_loss: 3.2078, test_f1: 0.5973
 epoch: 99, train_loss: 0.0957, test_loss: 3.2326, test_f1: 0.6317
##################ITERATION #2 ****************************************
 epoch: 0, train_loss: 1.1497, test_loss: 1.3365, test_f1: 0.1365
 epoch: 1, train_loss: 0.9785, test_loss: 1.1564, test_f1: 0.2432
 epoch: 2, train_loss: 0.9363, test_loss: 1.0662, test_f1: 0.4704
 epoch: 3, train_loss: 0.8750, test_loss: 1.0429, test_f1: 0.5370
 epoch: 4, train_loss: 0.8478, test_loss: 1.0008, test_f1: 0.5525
 epoch: 5, train_loss: 0.8339, test_loss: 1.0323, test_f1: 0.5571
 epoch: 6, train_loss: 0.8180, test_loss: 1.0066, test_f1: 0.6024
 epoch: 7, train_loss: 0.7725, test_loss: 1.0278, test_f1: 0.5658
 epoch: 8, train_loss: 0.7536, test_loss: 1.0519, test_f1: 0.5543
 epoch: 9, train_loss: 0.7452, test_loss: 1.0696, test_f1: 0.5621
 epoch: 10, train_loss: 0.7072, test_loss: 1.0720, test_f1: 0.5333
 epoch: 11, train_loss: 0.7036, test_loss: 1.1389, test_f1: 0.5707
 epoch: 12, train_loss: 0.6870, test_loss: 1.1161, test_f1: 0.5988
 epoch: 13, train_loss: 0.6625, test_loss: 1.1132, test_f1: 0.5737
 epoch: 14, train_loss: 0.6533, test_loss: 1.1564, test_f1: 0.5707
 epoch: 15, train_loss: 0.6280, test_loss: 1.0676, test_f1: 0.6168
 epoch: 16, train_loss: 0.5900, test_loss: 1.1083, test_f1: 0.6503
 epoch: 17, train_loss: 0.5962, test_loss: 1.2267, test_f1: 0.6312
 epoch: 18, train_loss: 0.5497, test_loss: 1.3117, test_f1: 0.6029
 epoch: 19, train_loss: 0.5658, test_loss: 1.1948, test_f1: 0.6261
 epoch: 20, train_loss: 0.5511, test_loss: 1.2943, test_f1: 0.6087
 epoch: 21, train_loss: 0.5294, test_loss: 1.3095, test_f1: 0.5674
 epoch: 22, train_loss: 0.5354, test_loss: 1.4008, test_f1: 0.5765
 epoch: 23, train_loss: 0.5281, test_loss: 1.2240, test_f1: 0.6166
 epoch: 24, train_loss: 0.5217, test_loss: 1.2733, test_f1: 0.6428
 epoch: 25, train_loss: 0.5248, test_loss: 1.3916, test_f1: 0.5582
 epoch: 26, train_loss: 0.4916, test_loss: 1.4667, test_f1: 0.6020
 epoch: 27, train_loss: 0.4606, test_loss: 1.2939, test_f1: 0.6166
 epoch: 28, train_loss: 0.4661, test_loss: 1.4675, test_f1: 0.5817
 epoch: 29, train_loss: 0.4408, test_loss: 1.4608, test_f1: 0.6312
 epoch: 30, train_loss: 0.4418, test_loss: 1.5643, test_f1: 0.5982
 epoch: 31, train_loss: 0.4339, test_loss: 1.5237, test_f1: 0.6113
 epoch: 32, train_loss: 0.4376, test_loss: 2.0482, test_f1: 0.5043
 epoch: 33, train_loss: 0.4244, test_loss: 1.6880, test_f1: 0.6170
 epoch: 34, train_loss: 0.4126, test_loss: 1.6481, test_f1: 0.6050
 epoch: 35, train_loss: 0.3829, test_loss: 1.6022, test_f1: 0.6244
 epoch: 36, train_loss: 0.4099, test_loss: 1.6467, test_f1: 0.6366
 epoch: 37, train_loss: 0.3511, test_loss: 1.7604, test_f1: 0.5718
 epoch: 38, train_loss: 0.3740, test_loss: 1.8693, test_f1: 0.6182
 epoch: 39, train_loss: 0.3660, test_loss: 1.7807, test_f1: 0.6222
 epoch: 40, train_loss: 0.3784, test_loss: 1.8645, test_f1: 0.5759
 epoch: 41, train_loss: 0.3571, test_loss: 2.2280, test_f1: 0.5331
 epoch: 42, train_loss: 0.3371, test_loss: 1.7490, test_f1: 0.6295
 epoch: 43, train_loss: 0.3658, test_loss: 1.9660, test_f1: 0.5939
 epoch: 44, train_loss: 0.3816, test_loss: 1.6107, test_f1: 0.6315
 epoch: 45, train_loss: 0.3267, test_loss: 1.6819, test_f1: 0.6420
 epoch: 46, train_loss: 0.3024, test_loss: 1.7934, test_f1: 0.6428
 epoch: 47, train_loss: 0.3132, test_loss: 2.0200, test_f1: 0.6020
 epoch: 48, train_loss: 0.2964, test_loss: 2.1020, test_f1: 0.6093
 epoch: 49, train_loss: 0.2758, test_loss: 2.0492, test_f1: 0.6300
 epoch: 50, train_loss: 0.3016, test_loss: 2.1844, test_f1: 0.6101
 epoch: 51, train_loss: 0.2414, test_loss: 2.1725, test_f1: 0.6101
 epoch: 52, train_loss: 0.2345, test_loss: 2.1796, test_f1: 0.6191
 epoch: 53, train_loss: 0.2268, test_loss: 2.0685, test_f1: 0.6344
 epoch: 54, train_loss: 0.2316, test_loss: 2.2947, test_f1: 0.6152
 epoch: 55, train_loss: 0.2123, test_loss: 2.1374, test_f1: 0.6365
 epoch: 56, train_loss: 0.2024, test_loss: 2.2881, test_f1: 0.6220
 epoch: 57, train_loss: 0.1759, test_loss: 2.2697, test_f1: 0.6439
 epoch: 58, train_loss: 0.1802, test_loss: 2.3926, test_f1: 0.6421
 epoch: 59, train_loss: 0.1917, test_loss: 2.3565, test_f1: 0.6321
 epoch: 60, train_loss: 0.1958, test_loss: 2.3565, test_f1: 0.6499
 epoch: 61, train_loss: 0.1768, test_loss: 2.4491, test_f1: 0.6572
 epoch: 62, train_loss: 0.1865, test_loss: 2.6752, test_f1: 0.6406
 epoch: 63, train_loss: 0.1788, test_loss: 2.5948, test_f1: 0.6251
 epoch: 64, train_loss: 0.1560, test_loss: 2.3708, test_f1: 0.6394
 epoch: 65, train_loss: 0.1611, test_loss: 2.6066, test_f1: 0.6186
 epoch: 66, train_loss: 0.1690, test_loss: 2.4515, test_f1: 0.6303
 epoch: 67, train_loss: 0.1536, test_loss: 2.5923, test_f1: 0.6390
 epoch: 68, train_loss: 0.1468, test_loss: 2.7338, test_f1: 0.6143
 epoch: 69, train_loss: 0.1520, test_loss: 2.8903, test_f1: 0.6167
 epoch: 70, train_loss: 0.1629, test_loss: 2.7514, test_f1: 0.5940
 epoch: 71, train_loss: 0.1496, test_loss: 2.6026, test_f1: 0.6400
 epoch: 72, train_loss: 0.1636, test_loss: 2.8434, test_f1: 0.6233
 epoch: 73, train_loss: 0.1632, test_loss: 2.6500, test_f1: 0.6416
 epoch: 74, train_loss: 0.1657, test_loss: 2.7682, test_f1: 0.6191
 epoch: 75, train_loss: 0.1538, test_loss: 3.2933, test_f1: 0.5815
 epoch: 76, train_loss: 0.1760, test_loss: 2.6786, test_f1: 0.6483
 epoch: 77, train_loss: 0.1756, test_loss: 2.7926, test_f1: 0.6277
 epoch: 78, train_loss: 0.1704, test_loss: 2.6589, test_f1: 0.6506
 epoch: 79, train_loss: 0.1442, test_loss: 2.7858, test_f1: 0.6567
 epoch: 80, train_loss: 0.1781, test_loss: 2.8252, test_f1: 0.6541
 epoch: 81, train_loss: 0.1640, test_loss: 2.8174, test_f1: 0.6461
 epoch: 82, train_loss: 0.1646, test_loss: 2.9558, test_f1: 0.6284
 epoch: 83, train_loss: 0.1238, test_loss: 2.9843, test_f1: 0.6337
 epoch: 84, train_loss: 0.1200, test_loss: 2.8389, test_f1: 0.6371
 epoch: 85, train_loss: 0.1459, test_loss: 2.9066, test_f1: 0.6277
 epoch: 86, train_loss: 0.1523, test_loss: 2.9473, test_f1: 0.6205
 epoch: 87, train_loss: 0.1435, test_loss: 3.2309, test_f1: 0.6139
 epoch: 88, train_loss: 0.1076, test_loss: 3.0233, test_f1: 0.6357
 epoch: 89, train_loss: 0.1119, test_loss: 3.2201, test_f1: 0.6297
 epoch: 90, train_loss: 0.1084, test_loss: 3.1953, test_f1: 0.6356
 epoch: 91, train_loss: 0.1275, test_loss: 3.0094, test_f1: 0.6621
 epoch: 92, train_loss: 0.1207, test_loss: 3.1474, test_f1: 0.6433
 epoch: 93, train_loss: 0.1101, test_loss: 3.2015, test_f1: 0.6469
 epoch: 94, train_loss: 0.1122, test_loss: 3.1315, test_f1: 0.6393
 epoch: 95, train_loss: 0.1154, test_loss: 3.3956, test_f1: 0.6103
 epoch: 96, train_loss: 0.1275, test_loss: 3.0910, test_f1: 0.6410
 epoch: 97, train_loss: 0.1248, test_loss: 3.0916, test_f1: 0.6402
 epoch: 98, train_loss: 0.1287, test_loss: 3.2902, test_f1: 0.6117
 epoch: 99, train_loss: 0.1140, test_loss: 3.2858, test_f1: 0.6377
##################ITERATION #3 ****************************************
 epoch: 0, train_loss: 1.1493, test_loss: 1.2520, test_f1: 0.2281
 epoch: 1, train_loss: 0.9834, test_loss: 1.1450, test_f1: 0.4649
 epoch: 2, train_loss: 0.9318, test_loss: 1.0119, test_f1: 0.5477
 epoch: 3, train_loss: 0.8763, test_loss: 1.0002, test_f1: 0.5757
 epoch: 4, train_loss: 0.8630, test_loss: 1.0147, test_f1: 0.6014
 epoch: 5, train_loss: 0.8103, test_loss: 0.9909, test_f1: 0.6258
 epoch: 6, train_loss: 0.8000, test_loss: 1.0089, test_f1: 0.5984
 epoch: 7, train_loss: 0.7853, test_loss: 1.0288, test_f1: 0.5826
 epoch: 8, train_loss: 0.7410, test_loss: 1.0398, test_f1: 0.5988
 epoch: 9, train_loss: 0.7216, test_loss: 1.0161, test_f1: 0.6120
 epoch: 10, train_loss: 0.7005, test_loss: 0.9715, test_f1: 0.6338
 epoch: 11, train_loss: 0.7167, test_loss: 1.0879, test_f1: 0.6393
 epoch: 12, train_loss: 0.6619, test_loss: 1.0524, test_f1: 0.5764
 epoch: 13, train_loss: 0.6684, test_loss: 1.0472, test_f1: 0.6014
 epoch: 14, train_loss: 0.6333, test_loss: 1.0440, test_f1: 0.6307
 epoch: 15, train_loss: 0.6038, test_loss: 1.0501, test_f1: 0.6236
 epoch: 16, train_loss: 0.6081, test_loss: 1.1561, test_f1: 0.5948
 epoch: 17, train_loss: 0.6009, test_loss: 1.0993, test_f1: 0.6509
 epoch: 18, train_loss: 0.5640, test_loss: 1.1089, test_f1: 0.6447
 epoch: 19, train_loss: 0.5627, test_loss: 1.1775, test_f1: 0.6473
 epoch: 20, train_loss: 0.5835, test_loss: 1.1188, test_f1: 0.6360
 epoch: 21, train_loss: 0.5544, test_loss: 1.1208, test_f1: 0.6121
 epoch: 22, train_loss: 0.5306, test_loss: 1.1244, test_f1: 0.6648
 epoch: 23, train_loss: 0.5238, test_loss: 1.2773, test_f1: 0.6194
 epoch: 24, train_loss: 0.5187, test_loss: 1.1725, test_f1: 0.6598
 epoch: 25, train_loss: 0.4978, test_loss: 1.1554, test_f1: 0.6690
 epoch: 26, train_loss: 0.4890, test_loss: 1.2325, test_f1: 0.6562
 epoch: 27, train_loss: 0.4828, test_loss: 1.3706, test_f1: 0.6112
 epoch: 28, train_loss: 0.4749, test_loss: 1.2219, test_f1: 0.6516
 epoch: 29, train_loss: 0.4517, test_loss: 1.4396, test_f1: 0.5820
 epoch: 30, train_loss: 0.4552, test_loss: 1.3549, test_f1: 0.6170
 epoch: 31, train_loss: 0.4777, test_loss: 1.3013, test_f1: 0.6263
 epoch: 32, train_loss: 0.4518, test_loss: 1.3309, test_f1: 0.6286
 epoch: 33, train_loss: 0.4227, test_loss: 1.2796, test_f1: 0.6494
 epoch: 34, train_loss: 0.3964, test_loss: 1.5189, test_f1: 0.6116
 epoch: 35, train_loss: 0.4129, test_loss: 1.5581, test_f1: 0.5748
 epoch: 36, train_loss: 0.3885, test_loss: 1.5029, test_f1: 0.6186
 epoch: 37, train_loss: 0.4181, test_loss: 1.3830, test_f1: 0.6285
 epoch: 38, train_loss: 0.4403, test_loss: 1.5049, test_f1: 0.6058
 epoch: 39, train_loss: 0.3586, test_loss: 1.5091, test_f1: 0.6207
 epoch: 40, train_loss: 0.3709, test_loss: 1.7584, test_f1: 0.5462
 epoch: 41, train_loss: 0.3558, test_loss: 1.4931, test_f1: 0.6219
 epoch: 42, train_loss: 0.3717, test_loss: 1.6069, test_f1: 0.6114
 epoch: 43, train_loss: 0.3386, test_loss: 1.7852, test_f1: 0.6220
 epoch: 44, train_loss: 0.3490, test_loss: 1.5270, test_f1: 0.6189
 epoch: 45, train_loss: 0.3609, test_loss: 1.7189, test_f1: 0.6358
 epoch: 46, train_loss: 0.3890, test_loss: 1.6738, test_f1: 0.6119
 epoch: 47, train_loss: 0.3648, test_loss: 1.7696, test_f1: 0.6034
 epoch: 48, train_loss: 0.3396, test_loss: 1.6631, test_f1: 0.6069
 epoch: 49, train_loss: 0.3216, test_loss: 1.6310, test_f1: 0.6230
 epoch: 50, train_loss: 0.3140, test_loss: 1.7120, test_f1: 0.6436
 epoch: 51, train_loss: 0.2782, test_loss: 1.6847, test_f1: 0.6065
 epoch: 52, train_loss: 0.2515, test_loss: 1.7443, test_f1: 0.6222
 epoch: 53, train_loss: 0.2387, test_loss: 1.8298, test_f1: 0.6193
 epoch: 54, train_loss: 0.2338, test_loss: 1.8479, test_f1: 0.6210
 epoch: 55, train_loss: 0.2384, test_loss: 2.0607, test_f1: 0.6159
 epoch: 56, train_loss: 0.2349, test_loss: 1.9391, test_f1: 0.6232
 epoch: 57, train_loss: 0.2290, test_loss: 1.7670, test_f1: 0.6591
 epoch: 58, train_loss: 0.2216, test_loss: 2.0892, test_f1: 0.5945
 epoch: 59, train_loss: 0.2127, test_loss: 1.9808, test_f1: 0.6111
 epoch: 60, train_loss: 0.2021, test_loss: 2.0041, test_f1: 0.6429
 epoch: 61, train_loss: 0.2193, test_loss: 1.9345, test_f1: 0.6488
 epoch: 62, train_loss: 0.2087, test_loss: 2.1735, test_f1: 0.5716
 epoch: 63, train_loss: 0.2064, test_loss: 2.0113, test_f1: 0.6325
 epoch: 64, train_loss: 0.1771, test_loss: 2.1552, test_f1: 0.6311
 epoch: 65, train_loss: 0.2121, test_loss: 2.1381, test_f1: 0.6267
 epoch: 66, train_loss: 0.1815, test_loss: 2.0880, test_f1: 0.6374
 epoch: 67, train_loss: 0.1710, test_loss: 2.1632, test_f1: 0.6087
 epoch: 68, train_loss: 0.1979, test_loss: 2.1183, test_f1: 0.6128
 epoch: 69, train_loss: 0.2096, test_loss: 2.1943, test_f1: 0.6128
 epoch: 70, train_loss: 0.1870, test_loss: 2.0624, test_f1: 0.6214
 epoch: 71, train_loss: 0.1759, test_loss: 2.1615, test_f1: 0.6396
 epoch: 72, train_loss: 0.1637, test_loss: 2.3101, test_f1: 0.6360
 epoch: 73, train_loss: 0.1751, test_loss: 2.1443, test_f1: 0.6358
 epoch: 74, train_loss: 0.1677, test_loss: 2.3016, test_f1: 0.6484
 epoch: 75, train_loss: 0.1770, test_loss: 2.2600, test_f1: 0.6247
 epoch: 76, train_loss: 0.1781, test_loss: 2.2407, test_f1: 0.6306
 epoch: 77, train_loss: 0.1788, test_loss: 2.2696, test_f1: 0.6020
 epoch: 78, train_loss: 0.1708, test_loss: 2.4311, test_f1: 0.6228
 epoch: 79, train_loss: 0.1749, test_loss: 2.2203, test_f1: 0.6128
 epoch: 80, train_loss: 0.1623, test_loss: 2.2131, test_f1: 0.6405
 epoch: 81, train_loss: 0.1753, test_loss: 2.5721, test_f1: 0.5905
 epoch: 82, train_loss: 0.1677, test_loss: 2.4263, test_f1: 0.6173
 epoch: 83, train_loss: 0.2104, test_loss: 2.4580, test_f1: 0.6407
 epoch: 84, train_loss: 0.1893, test_loss: 2.3310, test_f1: 0.6345
 epoch: 85, train_loss: 0.1581, test_loss: 2.3187, test_f1: 0.6531
 epoch: 86, train_loss: 0.1494, test_loss: 2.3289, test_f1: 0.6138
 epoch: 87, train_loss: 0.1267, test_loss: 2.4946, test_f1: 0.6139
 epoch: 88, train_loss: 0.1472, test_loss: 2.6498, test_f1: 0.6251
 epoch: 89, train_loss: 0.1580, test_loss: 2.6788, test_f1: 0.6096
 epoch: 90, train_loss: 0.1286, test_loss: 2.6157, test_f1: 0.6287
 epoch: 91, train_loss: 0.1571, test_loss: 2.6519, test_f1: 0.6254
 epoch: 92, train_loss: 0.1464, test_loss: 2.6772, test_f1: 0.6024
 epoch: 93, train_loss: 0.1457, test_loss: 2.5855, test_f1: 0.5989
 epoch: 94, train_loss: 0.1267, test_loss: 2.6492, test_f1: 0.6170
 epoch: 95, train_loss: 0.1226, test_loss: 2.7153, test_f1: 0.6194
 epoch: 96, train_loss: 0.1175, test_loss: 2.8907, test_f1: 0.6237
 epoch: 97, train_loss: 0.1311, test_loss: 2.7677, test_f1: 0.6167
 epoch: 98, train_loss: 0.1333, test_loss: 2.8609, test_f1: 0.5915
 epoch: 99, train_loss: 0.1064, test_loss: 3.0440, test_f1: 0.5661
##################ITERATION #4 ****************************************
 epoch: 0, train_loss: 1.1934, test_loss: 1.4821, test_f1: 0.1443
 epoch: 1, train_loss: 1.0190, test_loss: 1.1976, test_f1: 0.4547
 epoch: 2, train_loss: 0.9535, test_loss: 1.0508, test_f1: 0.5155
 epoch: 3, train_loss: 0.8920, test_loss: 1.0376, test_f1: 0.5770
 epoch: 4, train_loss: 0.8898, test_loss: 1.0533, test_f1: 0.5861
 epoch: 5, train_loss: 0.8415, test_loss: 1.0599, test_f1: 0.5285
 epoch: 6, train_loss: 0.8065, test_loss: 1.0435, test_f1: 0.5650
 epoch: 7, train_loss: 0.8086, test_loss: 1.0936, test_f1: 0.5899
 epoch: 8, train_loss: 0.7799, test_loss: 1.1310, test_f1: 0.5675
 epoch: 9, train_loss: 0.7527, test_loss: 1.0822, test_f1: 0.5438
 epoch: 10, train_loss: 0.7605, test_loss: 1.0707, test_f1: 0.6209
 epoch: 11, train_loss: 0.7093, test_loss: 1.0729, test_f1: 0.6186
 epoch: 12, train_loss: 0.6941, test_loss: 1.1554, test_f1: 0.5768
 epoch: 13, train_loss: 0.6696, test_loss: 1.1381, test_f1: 0.5984
 epoch: 14, train_loss: 0.6602, test_loss: 1.2803, test_f1: 0.5597
 epoch: 15, train_loss: 0.6605, test_loss: 1.2127, test_f1: 0.5387
 epoch: 16, train_loss: 0.6164, test_loss: 1.1813, test_f1: 0.6168
 epoch: 17, train_loss: 0.5859, test_loss: 1.1520, test_f1: 0.6012
 epoch: 18, train_loss: 0.6056, test_loss: 1.1634, test_f1: 0.6030
 epoch: 19, train_loss: 0.5987, test_loss: 1.2138, test_f1: 0.6079
 epoch: 20, train_loss: 0.5845, test_loss: 1.3111, test_f1: 0.5692
 epoch: 21, train_loss: 0.5709, test_loss: 1.2828, test_f1: 0.5830
 epoch: 22, train_loss: 0.5636, test_loss: 1.2811, test_f1: 0.6216
 epoch: 23, train_loss: 0.5499, test_loss: 1.3052, test_f1: 0.5804
 epoch: 24, train_loss: 0.5219, test_loss: 1.2310, test_f1: 0.6013
 epoch: 25, train_loss: 0.5053, test_loss: 1.3094, test_f1: 0.5980
 epoch: 26, train_loss: 0.4858, test_loss: 1.4528, test_f1: 0.5829
 epoch: 27, train_loss: 0.5240, test_loss: 1.4349, test_f1: 0.5815
 epoch: 28, train_loss: 0.4615, test_loss: 1.4734, test_f1: 0.5981
 epoch: 29, train_loss: 0.4683, test_loss: 1.3832, test_f1: 0.5840
 epoch: 30, train_loss: 0.4663, test_loss: 1.5413, test_f1: 0.5809
 epoch: 31, train_loss: 0.4786, test_loss: 1.5392, test_f1: 0.6318
 epoch: 32, train_loss: 0.4459, test_loss: 1.4389, test_f1: 0.6250
 epoch: 33, train_loss: 0.3977, test_loss: 1.6527, test_f1: 0.5918
 epoch: 34, train_loss: 0.4169, test_loss: 1.4333, test_f1: 0.6075
 epoch: 35, train_loss: 0.4095, test_loss: 1.4857, test_f1: 0.6241
 epoch: 36, train_loss: 0.3844, test_loss: 1.6120, test_f1: 0.5805
 epoch: 37, train_loss: 0.3682, test_loss: 1.7352, test_f1: 0.6247
 epoch: 38, train_loss: 0.4160, test_loss: 1.6773, test_f1: 0.6157
 epoch: 39, train_loss: 0.3804, test_loss: 1.6577, test_f1: 0.6124
 epoch: 40, train_loss: 0.3756, test_loss: 1.6418, test_f1: 0.5833
 epoch: 41, train_loss: 0.3754, test_loss: 1.6433, test_f1: 0.6630
 epoch: 42, train_loss: 0.3673, test_loss: 1.6424, test_f1: 0.6043
 epoch: 43, train_loss: 0.3547, test_loss: 1.6425, test_f1: 0.5991
 epoch: 44, train_loss: 0.3425, test_loss: 1.8188, test_f1: 0.6431
 epoch: 45, train_loss: 0.3413, test_loss: 1.7847, test_f1: 0.6179
 epoch: 46, train_loss: 0.3230, test_loss: 1.8675, test_f1: 0.6085
 epoch: 47, train_loss: 0.3249, test_loss: 1.9258, test_f1: 0.5810
 epoch: 48, train_loss: 0.3127, test_loss: 2.1476, test_f1: 0.5937
 epoch: 49, train_loss: 0.3104, test_loss: 1.9055, test_f1: 0.6185
 epoch: 50, train_loss: 0.3124, test_loss: 1.9730, test_f1: 0.6057
 epoch: 51, train_loss: 0.2892, test_loss: 1.8868, test_f1: 0.6279
 epoch: 52, train_loss: 0.2436, test_loss: 2.0479, test_f1: 0.6236
 epoch: 53, train_loss: 0.2143, test_loss: 2.1565, test_f1: 0.6361
 epoch: 54, train_loss: 0.2176, test_loss: 2.0590, test_f1: 0.6091
 epoch: 55, train_loss: 0.1892, test_loss: 2.2019, test_f1: 0.6251
 epoch: 56, train_loss: 0.1932, test_loss: 2.1852, test_f1: 0.6044
 epoch: 57, train_loss: 0.1849, test_loss: 2.2366, test_f1: 0.6243
 epoch: 58, train_loss: 0.2069, test_loss: 2.3339, test_f1: 0.6031
 epoch: 59, train_loss: 0.1982, test_loss: 2.3034, test_f1: 0.5967
 epoch: 60, train_loss: 0.1889, test_loss: 2.2296, test_f1: 0.6232
 epoch: 61, train_loss: 0.1802, test_loss: 2.2668, test_f1: 0.6227
 epoch: 62, train_loss: 0.1827, test_loss: 2.4187, test_f1: 0.6055
 epoch: 63, train_loss: 0.1760, test_loss: 2.3517, test_f1: 0.6338
 epoch: 64, train_loss: 0.1814, test_loss: 2.2995, test_f1: 0.6243
 epoch: 65, train_loss: 0.1925, test_loss: 2.4080, test_f1: 0.6148
 epoch: 66, train_loss: 0.1711, test_loss: 2.4332, test_f1: 0.6173
 epoch: 67, train_loss: 0.1504, test_loss: 2.4443, test_f1: 0.6049
 epoch: 68, train_loss: 0.1890, test_loss: 2.4315, test_f1: 0.6057
 epoch: 69, train_loss: 0.1666, test_loss: 2.4830, test_f1: 0.6218
 epoch: 70, train_loss: 0.1669, test_loss: 2.4522, test_f1: 0.6216
 epoch: 71, train_loss: 0.1886, test_loss: 2.4619, test_f1: 0.6202
 epoch: 72, train_loss: 0.1566, test_loss: 2.4906, test_f1: 0.6105
 epoch: 73, train_loss: 0.1404, test_loss: 2.6245, test_f1: 0.5904
 epoch: 74, train_loss: 0.1850, test_loss: 2.3342, test_f1: 0.6391
 epoch: 75, train_loss: 0.1559, test_loss: 2.5636, test_f1: 0.5971
 epoch: 76, train_loss: 0.1374, test_loss: 2.6550, test_f1: 0.6242
 epoch: 77, train_loss: 0.1561, test_loss: 2.8340, test_f1: 0.6116
 epoch: 78, train_loss: 0.1596, test_loss: 2.6214, test_f1: 0.6163
 epoch: 79, train_loss: 0.1640, test_loss: 2.6244, test_f1: 0.6077
 epoch: 80, train_loss: 0.1799, test_loss: 2.7927, test_f1: 0.5853
 epoch: 81, train_loss: 0.1308, test_loss: 2.6195, test_f1: 0.6086
 epoch: 82, train_loss: 0.1464, test_loss: 2.6968, test_f1: 0.6169
 epoch: 83, train_loss: 0.1315, test_loss: 2.9580, test_f1: 0.6040
 epoch: 84, train_loss: 0.1436, test_loss: 2.6718, test_f1: 0.6439
 epoch: 85, train_loss: 0.1466, test_loss: 2.7120, test_f1: 0.5840
 epoch: 86, train_loss: 0.1407, test_loss: 2.9186, test_f1: 0.5919
 epoch: 87, train_loss: 0.1533, test_loss: 2.6816, test_f1: 0.6019
 epoch: 88, train_loss: 0.1391, test_loss: 3.0118, test_f1: 0.6018
 epoch: 89, train_loss: 0.1792, test_loss: 2.7984, test_f1: 0.6224
 epoch: 90, train_loss: 0.1562, test_loss: 2.6285, test_f1: 0.6260
 epoch: 91, train_loss: 0.1352, test_loss: 2.6736, test_f1: 0.6245
 epoch: 92, train_loss: 0.1595, test_loss: 2.8427, test_f1: 0.6144
 epoch: 93, train_loss: 0.1372, test_loss: 2.8202, test_f1: 0.6107
 epoch: 94, train_loss: 0.1248, test_loss: 3.0185, test_f1: 0.6039
 epoch: 95, train_loss: 0.1227, test_loss: 3.0886, test_f1: 0.6097
 epoch: 96, train_loss: 0.1354, test_loss: 3.0112, test_f1: 0.5998
 epoch: 97, train_loss: 0.1170, test_loss: 2.8092, test_f1: 0.6065
 epoch: 98, train_loss: 0.1058, test_loss: 3.0458, test_f1: 0.6165
 epoch: 99, train_loss: 0.1230, test_loss: 3.1860, test_f1: 0.5852
##################ITERATION #5 ****************************************
 epoch: 0, train_loss: 1.3508, test_loss: 1.2543, test_f1: 0.2583
 epoch: 1, train_loss: 1.0633, test_loss: 1.2651, test_f1: 0.3524
 epoch: 2, train_loss: 0.9975, test_loss: 1.0763, test_f1: 0.5251
 epoch: 3, train_loss: 0.9594, test_loss: 1.0637, test_f1: 0.5154
 epoch: 4, train_loss: 0.9223, test_loss: 1.1049, test_f1: 0.5252
 epoch: 5, train_loss: 0.8758, test_loss: 1.0888, test_f1: 0.5130
 epoch: 6, train_loss: 0.8718, test_loss: 1.0031, test_f1: 0.5760
 epoch: 7, train_loss: 0.8364, test_loss: 1.0468, test_f1: 0.5579
 epoch: 8, train_loss: 0.8051, test_loss: 1.0938, test_f1: 0.5421
 epoch: 9, train_loss: 0.7667, test_loss: 1.1306, test_f1: 0.5562
 epoch: 10, train_loss: 0.7613, test_loss: 1.0811, test_f1: 0.5631
 epoch: 11, train_loss: 0.7508, test_loss: 1.1282, test_f1: 0.5896
 epoch: 12, train_loss: 0.7279, test_loss: 1.0997, test_f1: 0.5584
 epoch: 13, train_loss: 0.7090, test_loss: 1.0303, test_f1: 0.6222
 epoch: 14, train_loss: 0.7011, test_loss: 1.1020, test_f1: 0.6038
 epoch: 15, train_loss: 0.6634, test_loss: 1.1973, test_f1: 0.6067
 epoch: 16, train_loss: 0.6800, test_loss: 1.1512, test_f1: 0.5956
 epoch: 17, train_loss: 0.6538, test_loss: 1.1431, test_f1: 0.5772
 epoch: 18, train_loss: 0.6522, test_loss: 1.1816, test_f1: 0.5671
 epoch: 19, train_loss: 0.6422, test_loss: 1.2075, test_f1: 0.6011
 epoch: 20, train_loss: 0.6104, test_loss: 1.1815, test_f1: 0.5935
 epoch: 21, train_loss: 0.5938, test_loss: 1.2512, test_f1: 0.6172
 epoch: 22, train_loss: 0.5565, test_loss: 1.2609, test_f1: 0.5636
 epoch: 23, train_loss: 0.6030, test_loss: 1.2520, test_f1: 0.5939
 epoch: 24, train_loss: 0.5725, test_loss: 1.2015, test_f1: 0.5934
 epoch: 25, train_loss: 0.5337, test_loss: 1.2543, test_f1: 0.6097
 epoch: 26, train_loss: 0.5333, test_loss: 1.2747, test_f1: 0.6119
 epoch: 27, train_loss: 0.5431, test_loss: 1.3701, test_f1: 0.5651
 epoch: 28, train_loss: 0.5089, test_loss: 1.3374, test_f1: 0.6239
 epoch: 29, train_loss: 0.5052, test_loss: 1.2737, test_f1: 0.6202
 epoch: 30, train_loss: 0.5475, test_loss: 1.3239, test_f1: 0.5969
 epoch: 31, train_loss: 0.5232, test_loss: 1.2542, test_f1: 0.6254
 epoch: 32, train_loss: 0.5120, test_loss: 1.3757, test_f1: 0.6045
 epoch: 33, train_loss: 0.4836, test_loss: 1.4186, test_f1: 0.6181
 epoch: 34, train_loss: 0.4697, test_loss: 1.3990, test_f1: 0.6360
 epoch: 35, train_loss: 0.4458, test_loss: 1.3723, test_f1: 0.6378
 epoch: 36, train_loss: 0.4541, test_loss: 1.4379, test_f1: 0.6021
 epoch: 37, train_loss: 0.4329, test_loss: 1.5507, test_f1: 0.6163
 epoch: 38, train_loss: 0.4373, test_loss: 1.3707, test_f1: 0.5920
 epoch: 39, train_loss: 0.4323, test_loss: 1.5109, test_f1: 0.5998
 epoch: 40, train_loss: 0.4317, test_loss: 1.5175, test_f1: 0.6150
 epoch: 41, train_loss: 0.4341, test_loss: 1.5103, test_f1: 0.5885
 epoch: 42, train_loss: 0.3971, test_loss: 1.4780, test_f1: 0.6473
 epoch: 43, train_loss: 0.3852, test_loss: 1.4889, test_f1: 0.6266
 epoch: 44, train_loss: 0.3929, test_loss: 1.8114, test_f1: 0.6141
 epoch: 45, train_loss: 0.3491, test_loss: 1.7037, test_f1: 0.5958
 epoch: 46, train_loss: 0.3759, test_loss: 1.6039, test_f1: 0.6368
 epoch: 47, train_loss: 0.3731, test_loss: 1.6137, test_f1: 0.6307
 epoch: 48, train_loss: 0.3829, test_loss: 1.6486, test_f1: 0.5858
 epoch: 49, train_loss: 0.4040, test_loss: 1.7216, test_f1: 0.5846
 epoch: 50, train_loss: 0.3675, test_loss: 1.6140, test_f1: 0.6145
 epoch: 51, train_loss: 0.2940, test_loss: 1.6908, test_f1: 0.6099
 epoch: 52, train_loss: 0.2972, test_loss: 1.7215, test_f1: 0.6247
 epoch: 53, train_loss: 0.2639, test_loss: 1.7756, test_f1: 0.6365
 epoch: 54, train_loss: 0.2797, test_loss: 1.8422, test_f1: 0.6181
 epoch: 55, train_loss: 0.2532, test_loss: 1.9713, test_f1: 0.6105
 epoch: 56, train_loss: 0.2462, test_loss: 1.8669, test_f1: 0.6319
 epoch: 57, train_loss: 0.2490, test_loss: 1.8433, test_f1: 0.6147
 epoch: 58, train_loss: 0.2377, test_loss: 1.8367, test_f1: 0.6413
 epoch: 59, train_loss: 0.2418, test_loss: 2.0786, test_f1: 0.6102
 epoch: 60, train_loss: 0.2528, test_loss: 2.0842, test_f1: 0.5820
 epoch: 61, train_loss: 0.2530, test_loss: 2.1801, test_f1: 0.6033
 epoch: 62, train_loss: 0.2284, test_loss: 2.0409, test_f1: 0.6070
 epoch: 63, train_loss: 0.2306, test_loss: 2.0715, test_f1: 0.6200
 epoch: 64, train_loss: 0.2289, test_loss: 2.1054, test_f1: 0.5765
 epoch: 65, train_loss: 0.2343, test_loss: 1.9435, test_f1: 0.6521
 epoch: 66, train_loss: 0.2137, test_loss: 2.2149, test_f1: 0.5803
 epoch: 67, train_loss: 0.2215, test_loss: 2.1182, test_f1: 0.6103
 epoch: 68, train_loss: 0.2009, test_loss: 2.1664, test_f1: 0.6243
 epoch: 69, train_loss: 0.2138, test_loss: 2.1948, test_f1: 0.6109
 epoch: 70, train_loss: 0.1948, test_loss: 2.1865, test_f1: 0.6171
 epoch: 71, train_loss: 0.1876, test_loss: 2.1836, test_f1: 0.5861
 epoch: 72, train_loss: 0.1947, test_loss: 2.3116, test_f1: 0.6210
 epoch: 73, train_loss: 0.1921, test_loss: 2.3010, test_f1: 0.6071
 epoch: 74, train_loss: 0.1973, test_loss: 2.1997, test_f1: 0.6090
 epoch: 75, train_loss: 0.1922, test_loss: 2.4632, test_f1: 0.6031
 epoch: 76, train_loss: 0.1984, test_loss: 2.3279, test_f1: 0.6127
 epoch: 77, train_loss: 0.2000, test_loss: 2.3664, test_f1: 0.6068
 epoch: 78, train_loss: 0.1952, test_loss: 2.3582, test_f1: 0.6443
 epoch: 79, train_loss: 0.1917, test_loss: 2.5040, test_f1: 0.5863
 epoch: 80, train_loss: 0.1625, test_loss: 2.4329, test_f1: 0.6156
 epoch: 81, train_loss: 0.1881, test_loss: 2.4162, test_f1: 0.6218
 epoch: 82, train_loss: 0.1861, test_loss: 2.4892, test_f1: 0.5913
 epoch: 83, train_loss: 0.1683, test_loss: 2.3973, test_f1: 0.6052
 epoch: 84, train_loss: 0.1717, test_loss: 2.4963, test_f1: 0.5994
 epoch: 85, train_loss: 0.1683, test_loss: 2.5444, test_f1: 0.6200
 epoch: 86, train_loss: 0.1578, test_loss: 2.7833, test_f1: 0.5564
 epoch: 87, train_loss: 0.1648, test_loss: 2.4734, test_f1: 0.5957
 epoch: 88, train_loss: 0.1455, test_loss: 2.7976, test_f1: 0.5689
 epoch: 89, train_loss: 0.1599, test_loss: 2.5398, test_f1: 0.6222
 epoch: 90, train_loss: 0.1563, test_loss: 2.8166, test_f1: 0.5724
 epoch: 91, train_loss: 0.1826, test_loss: 2.6321, test_f1: 0.6050
 epoch: 92, train_loss: 0.1656, test_loss: 3.0233, test_f1: 0.5621
 epoch: 93, train_loss: 0.1668, test_loss: 2.6816, test_f1: 0.6280
 epoch: 94, train_loss: 0.1934, test_loss: 2.7311, test_f1: 0.5743
 epoch: 95, train_loss: 0.1779, test_loss: 2.5509, test_f1: 0.6081
 epoch: 96, train_loss: 0.1574, test_loss: 2.5488, test_f1: 0.6070
 epoch: 97, train_loss: 0.1469, test_loss: 2.5522, test_f1: 0.6174
 epoch: 98, train_loss: 0.1526, test_loss: 2.6931, test_f1: 0.6028
 epoch: 99, train_loss: 0.1624, test_loss: 2.6370, test_f1: 0.6064
##################ITERATION #6 ****************************************
 epoch: 0, train_loss: 1.3290, test_loss: 1.3135, test_f1: 0.2384
 epoch: 1, train_loss: 1.0507, test_loss: 1.4048, test_f1: 0.2568
 epoch: 2, train_loss: 0.9578, test_loss: 1.0880, test_f1: 0.5308
 epoch: 3, train_loss: 0.9042, test_loss: 1.1015, test_f1: 0.5026
 epoch: 4, train_loss: 0.9035, test_loss: 1.1209, test_f1: 0.4991
 epoch: 5, train_loss: 0.8705, test_loss: 1.1429, test_f1: 0.4877
 epoch: 6, train_loss: 0.8306, test_loss: 1.1042, test_f1: 0.5550
 epoch: 7, train_loss: 0.8224, test_loss: 1.1322, test_f1: 0.5610
 epoch: 8, train_loss: 0.7949, test_loss: 1.0723, test_f1: 0.5418
 epoch: 9, train_loss: 0.7689, test_loss: 1.1296, test_f1: 0.5542
 epoch: 10, train_loss: 0.7464, test_loss: 1.1115, test_f1: 0.5422
 epoch: 11, train_loss: 0.7362, test_loss: 1.1331, test_f1: 0.5902
 epoch: 12, train_loss: 0.7026, test_loss: 1.1284, test_f1: 0.5686
 epoch: 13, train_loss: 0.6891, test_loss: 1.1715, test_f1: 0.5771
 epoch: 14, train_loss: 0.6868, test_loss: 1.1679, test_f1: 0.5576
 epoch: 15, train_loss: 0.6687, test_loss: 1.1783, test_f1: 0.6086
 epoch: 16, train_loss: 0.6615, test_loss: 1.1471, test_f1: 0.5682
 epoch: 17, train_loss: 0.6393, test_loss: 1.1932, test_f1: 0.5671
 epoch: 18, train_loss: 0.6420, test_loss: 1.1719, test_f1: 0.5723
 epoch: 19, train_loss: 0.6408, test_loss: 1.2637, test_f1: 0.5719
 epoch: 20, train_loss: 0.5881, test_loss: 1.3602, test_f1: 0.5592
 epoch: 21, train_loss: 0.5790, test_loss: 1.2713, test_f1: 0.5900
 epoch: 22, train_loss: 0.5692, test_loss: 1.4019, test_f1: 0.5504
 epoch: 23, train_loss: 0.5723, test_loss: 1.4127, test_f1: 0.5707
 epoch: 24, train_loss: 0.5570, test_loss: 1.4202, test_f1: 0.5742
 epoch: 25, train_loss: 0.5360, test_loss: 1.3632, test_f1: 0.5581
 epoch: 26, train_loss: 0.5311, test_loss: 1.4636, test_f1: 0.5687
 epoch: 27, train_loss: 0.5197, test_loss: 1.4533, test_f1: 0.5587
 epoch: 28, train_loss: 0.5220, test_loss: 1.5072, test_f1: 0.5828
 epoch: 29, train_loss: 0.5168, test_loss: 1.3471, test_f1: 0.5887
 epoch: 30, train_loss: 0.4928, test_loss: 1.4045, test_f1: 0.5565
 epoch: 31, train_loss: 0.5189, test_loss: 1.4520, test_f1: 0.5688
 epoch: 32, train_loss: 0.4875, test_loss: 1.4982, test_f1: 0.6109
 epoch: 33, train_loss: 0.4630, test_loss: 1.5133, test_f1: 0.5464
 epoch: 34, train_loss: 0.4306, test_loss: 1.5983, test_f1: 0.5639
 epoch: 35, train_loss: 0.4516, test_loss: 1.3459, test_f1: 0.5917
 epoch: 36, train_loss: 0.4480, test_loss: 1.4135, test_f1: 0.6229
 epoch: 37, train_loss: 0.4804, test_loss: 1.5630, test_f1: 0.5778
 epoch: 38, train_loss: 0.4257, test_loss: 1.5570, test_f1: 0.5860
 epoch: 39, train_loss: 0.4009, test_loss: 1.4921, test_f1: 0.5969
 epoch: 40, train_loss: 0.3918, test_loss: 1.5583, test_f1: 0.5775
 epoch: 41, train_loss: 0.3913, test_loss: 1.4767, test_f1: 0.6312
 epoch: 42, train_loss: 0.3724, test_loss: 1.7523, test_f1: 0.5703
 epoch: 43, train_loss: 0.3954, test_loss: 1.6791, test_f1: 0.5873
 epoch: 44, train_loss: 0.3833, test_loss: 1.6197, test_f1: 0.6118
 epoch: 45, train_loss: 0.3654, test_loss: 1.6689, test_f1: 0.5932
 epoch: 46, train_loss: 0.3816, test_loss: 1.7931, test_f1: 0.5971
 epoch: 47, train_loss: 0.3670, test_loss: 1.8381, test_f1: 0.5356
 epoch: 48, train_loss: 0.3530, test_loss: 1.8387, test_f1: 0.5985
 epoch: 49, train_loss: 0.3476, test_loss: 1.8480, test_f1: 0.5791
 epoch: 50, train_loss: 0.3732, test_loss: 1.6209, test_f1: 0.5831
 epoch: 51, train_loss: 0.3161, test_loss: 1.6550, test_f1: 0.6071
 epoch: 52, train_loss: 0.2820, test_loss: 1.8341, test_f1: 0.5785
 epoch: 53, train_loss: 0.2628, test_loss: 1.7617, test_f1: 0.5905
 epoch: 54, train_loss: 0.2511, test_loss: 1.7256, test_f1: 0.6287
 epoch: 55, train_loss: 0.2449, test_loss: 1.8152, test_f1: 0.6188
 epoch: 56, train_loss: 0.2357, test_loss: 1.8394, test_f1: 0.6255
 epoch: 57, train_loss: 0.2443, test_loss: 1.9044, test_f1: 0.5800
 epoch: 58, train_loss: 0.2376, test_loss: 2.0241, test_f1: 0.5872
 epoch: 59, train_loss: 0.2250, test_loss: 2.0114, test_f1: 0.5802
 epoch: 60, train_loss: 0.2302, test_loss: 2.0175, test_f1: 0.5928
 epoch: 61, train_loss: 0.2292, test_loss: 1.9829, test_f1: 0.6112
 epoch: 62, train_loss: 0.2095, test_loss: 2.0118, test_f1: 0.6164
 epoch: 63, train_loss: 0.2369, test_loss: 2.1617, test_f1: 0.6038
 epoch: 64, train_loss: 0.2324, test_loss: 2.2781, test_f1: 0.5646
 epoch: 65, train_loss: 0.2100, test_loss: 2.1169, test_f1: 0.5874
 epoch: 66, train_loss: 0.2250, test_loss: 1.9595, test_f1: 0.5872
 epoch: 67, train_loss: 0.1962, test_loss: 1.9958, test_f1: 0.6138
 epoch: 68, train_loss: 0.2017, test_loss: 2.3517, test_f1: 0.5672
 epoch: 69, train_loss: 0.1986, test_loss: 2.2144, test_f1: 0.5757
 epoch: 70, train_loss: 0.1871, test_loss: 2.0898, test_f1: 0.5891
 epoch: 71, train_loss: 0.1807, test_loss: 1.9956, test_f1: 0.6351
 epoch: 72, train_loss: 0.2100, test_loss: 2.2677, test_f1: 0.5924
 epoch: 73, train_loss: 0.1910, test_loss: 2.0991, test_f1: 0.6184
 epoch: 74, train_loss: 0.1873, test_loss: 2.1612, test_f1: 0.6124
 epoch: 75, train_loss: 0.1885, test_loss: 2.2977, test_f1: 0.6045
 epoch: 76, train_loss: 0.2110, test_loss: 2.4305, test_f1: 0.5667
 epoch: 77, train_loss: 0.1866, test_loss: 2.1678, test_f1: 0.6235
 epoch: 78, train_loss: 0.1762, test_loss: 2.2719, test_f1: 0.5956
 epoch: 79, train_loss: 0.1661, test_loss: 2.2344, test_f1: 0.6055
 epoch: 80, train_loss: 0.1675, test_loss: 2.3345, test_f1: 0.6071
 epoch: 81, train_loss: 0.1664, test_loss: 2.6139, test_f1: 0.5720
 epoch: 82, train_loss: 0.2031, test_loss: 2.4209, test_f1: 0.6064
 epoch: 83, train_loss: 0.1846, test_loss: 2.3346, test_f1: 0.5960
 epoch: 84, train_loss: 0.1763, test_loss: 2.4857, test_f1: 0.5728
 epoch: 85, train_loss: 0.1819, test_loss: 2.4454, test_f1: 0.5994
 epoch: 86, train_loss: 0.1636, test_loss: 2.4502, test_f1: 0.5867
 epoch: 87, train_loss: 0.1625, test_loss: 2.3776, test_f1: 0.6185
 epoch: 88, train_loss: 0.1485, test_loss: 2.5687, test_f1: 0.5728
 epoch: 89, train_loss: 0.1652, test_loss: 2.4026, test_f1: 0.6036
 epoch: 90, train_loss: 0.1392, test_loss: 2.5209, test_f1: 0.5977
 epoch: 91, train_loss: 0.1507, test_loss: 2.7937, test_f1: 0.5787
 epoch: 92, train_loss: 0.1267, test_loss: 2.5322, test_f1: 0.6206
 epoch: 93, train_loss: 0.1296, test_loss: 2.6019, test_f1: 0.5897
 epoch: 94, train_loss: 0.1577, test_loss: 2.5684, test_f1: 0.5932
 epoch: 95, train_loss: 0.1650, test_loss: 2.6316, test_f1: 0.5782
 epoch: 96, train_loss: 0.1553, test_loss: 2.6551, test_f1: 0.5912
 epoch: 97, train_loss: 0.1405, test_loss: 2.5106, test_f1: 0.6210
 epoch: 98, train_loss: 0.1349, test_loss: 2.9661, test_f1: 0.5703
 epoch: 99, train_loss: 0.1306, test_loss: 2.5861, test_f1: 0.6247
##################ITERATION #7 ****************************************
 epoch: 0, train_loss: 1.5144, test_loss: 2.4522, test_f1: 0.1365
 epoch: 1, train_loss: 1.0788, test_loss: 1.7803, test_f1: 0.2169
 epoch: 2, train_loss: 0.9792, test_loss: 1.0972, test_f1: 0.5181
 epoch: 3, train_loss: 0.9113, test_loss: 1.0535, test_f1: 0.5678
 epoch: 4, train_loss: 0.8820, test_loss: 1.0292, test_f1: 0.5564
 epoch: 5, train_loss: 0.8714, test_loss: 1.0804, test_f1: 0.5141
 epoch: 6, train_loss: 0.8167, test_loss: 1.0759, test_f1: 0.5596
 epoch: 7, train_loss: 0.8431, test_loss: 1.0302, test_f1: 0.5880
 epoch: 8, train_loss: 0.8023, test_loss: 1.0680, test_f1: 0.5836
 epoch: 9, train_loss: 0.7629, test_loss: 1.0553, test_f1: 0.5691
 epoch: 10, train_loss: 0.7527, test_loss: 1.0571, test_f1: 0.5948
 epoch: 11, train_loss: 0.7379, test_loss: 1.1009, test_f1: 0.5997
 epoch: 12, train_loss: 0.7470, test_loss: 1.0686, test_f1: 0.6050
 epoch: 13, train_loss: 0.7093, test_loss: 1.1075, test_f1: 0.6022
 epoch: 14, train_loss: 0.7011, test_loss: 1.1895, test_f1: 0.5597
 epoch: 15, train_loss: 0.6700, test_loss: 1.1681, test_f1: 0.5730
 epoch: 16, train_loss: 0.6640, test_loss: 1.2302, test_f1: 0.5805
 epoch: 17, train_loss: 0.6718, test_loss: 1.1605, test_f1: 0.5991
 epoch: 18, train_loss: 0.6464, test_loss: 1.2145, test_f1: 0.5857
 epoch: 19, train_loss: 0.6167, test_loss: 1.1644, test_f1: 0.6398
 epoch: 20, train_loss: 0.6152, test_loss: 1.3372, test_f1: 0.5656
 epoch: 21, train_loss: 0.5909, test_loss: 1.2738, test_f1: 0.5711
 epoch: 22, train_loss: 0.6120, test_loss: 1.3057, test_f1: 0.5711
 epoch: 23, train_loss: 0.5831, test_loss: 1.2088, test_f1: 0.5679
 epoch: 24, train_loss: 0.5737, test_loss: 1.2954, test_f1: 0.5420
 epoch: 25, train_loss: 0.5575, test_loss: 1.3702, test_f1: 0.5490
 epoch: 26, train_loss: 0.5479, test_loss: 1.2463, test_f1: 0.6230
 epoch: 27, train_loss: 0.5377, test_loss: 1.3307, test_f1: 0.6043
 epoch: 28, train_loss: 0.5360, test_loss: 1.3711, test_f1: 0.5893
 epoch: 29, train_loss: 0.5191, test_loss: 1.5140, test_f1: 0.5593
 epoch: 30, train_loss: 0.5508, test_loss: 1.2914, test_f1: 0.6473
 epoch: 31, train_loss: 0.5016, test_loss: 1.3276, test_f1: 0.6020
 epoch: 32, train_loss: 0.4653, test_loss: 1.4763, test_f1: 0.5433
 epoch: 33, train_loss: 0.4449, test_loss: 1.5819, test_f1: 0.5613
 epoch: 34, train_loss: 0.4379, test_loss: 1.4799, test_f1: 0.5949
 epoch: 35, train_loss: 0.4325, test_loss: 1.5389, test_f1: 0.5902
 epoch: 36, train_loss: 0.4412, test_loss: 1.7449, test_f1: 0.5459
 epoch: 37, train_loss: 0.4184, test_loss: 1.4611, test_f1: 0.6219
 epoch: 38, train_loss: 0.4060, test_loss: 1.8349, test_f1: 0.5639
 epoch: 39, train_loss: 0.3994, test_loss: 1.8676, test_f1: 0.5492
 epoch: 40, train_loss: 0.3807, test_loss: 1.8914, test_f1: 0.5531
 epoch: 41, train_loss: 0.3980, test_loss: 1.8706, test_f1: 0.5620
 epoch: 42, train_loss: 0.4288, test_loss: 1.6076, test_f1: 0.5591
 epoch: 43, train_loss: 0.4415, test_loss: 1.7840, test_f1: 0.5617
 epoch: 44, train_loss: 0.3772, test_loss: 1.7096, test_f1: 0.5958
 epoch: 45, train_loss: 0.3474, test_loss: 1.8771, test_f1: 0.5822
 epoch: 46, train_loss: 0.3393, test_loss: 1.8832, test_f1: 0.5736
 epoch: 47, train_loss: 0.3376, test_loss: 2.0258, test_f1: 0.5673
 epoch: 48, train_loss: 0.3538, test_loss: 1.8241, test_f1: 0.5815
 epoch: 49, train_loss: 0.3554, test_loss: 2.1308, test_f1: 0.5616
 epoch: 50, train_loss: 0.3281, test_loss: 2.2286, test_f1: 0.5785
 epoch: 51, train_loss: 0.3026, test_loss: 2.1221, test_f1: 0.5941
 epoch: 52, train_loss: 0.2547, test_loss: 2.1513, test_f1: 0.5945
 epoch: 53, train_loss: 0.2538, test_loss: 2.1175, test_f1: 0.5700
 epoch: 54, train_loss: 0.2595, test_loss: 2.2749, test_f1: 0.5778
 epoch: 55, train_loss: 0.2406, test_loss: 2.3249, test_f1: 0.5911
 epoch: 56, train_loss: 0.2337, test_loss: 2.2678, test_f1: 0.5735
 epoch: 57, train_loss: 0.2393, test_loss: 2.2445, test_f1: 0.5790
 epoch: 58, train_loss: 0.2243, test_loss: 2.3538, test_f1: 0.5661
 epoch: 59, train_loss: 0.2237, test_loss: 2.4607, test_f1: 0.5626
 epoch: 60, train_loss: 0.2367, test_loss: 2.2394, test_f1: 0.5995
 epoch: 61, train_loss: 0.2319, test_loss: 2.3673, test_f1: 0.5901
 epoch: 62, train_loss: 0.2293, test_loss: 2.3420, test_f1: 0.6011
 epoch: 63, train_loss: 0.2145, test_loss: 2.4719, test_f1: 0.5759
 epoch: 64, train_loss: 0.2216, test_loss: 2.2190, test_f1: 0.5779
 epoch: 65, train_loss: 0.2325, test_loss: 2.5198, test_f1: 0.5563
 epoch: 66, train_loss: 0.1864, test_loss: 2.4102, test_f1: 0.5816
 epoch: 67, train_loss: 0.2086, test_loss: 2.6629, test_f1: 0.5550
 epoch: 68, train_loss: 0.1771, test_loss: 2.6309, test_f1: 0.5683
 epoch: 69, train_loss: 0.2060, test_loss: 2.6179, test_f1: 0.5825
 epoch: 70, train_loss: 0.2039, test_loss: 2.5498, test_f1: 0.5720
 epoch: 71, train_loss: 0.2004, test_loss: 2.7065, test_f1: 0.5741
 epoch: 72, train_loss: 0.1898, test_loss: 2.9417, test_f1: 0.5632
 epoch: 73, train_loss: 0.1865, test_loss: 2.7106, test_f1: 0.5594
 epoch: 74, train_loss: 0.2131, test_loss: 2.7366, test_f1: 0.5730
 epoch: 75, train_loss: 0.1963, test_loss: 2.8165, test_f1: 0.5666
 epoch: 76, train_loss: 0.1845, test_loss: 2.5949, test_f1: 0.5591
 epoch: 77, train_loss: 0.2195, test_loss: 2.4541, test_f1: 0.5643
 epoch: 78, train_loss: 0.1860, test_loss: 2.6574, test_f1: 0.5710
 epoch: 79, train_loss: 0.1677, test_loss: 2.8398, test_f1: 0.5659
 epoch: 80, train_loss: 0.1689, test_loss: 2.7994, test_f1: 0.5672
 epoch: 81, train_loss: 0.1793, test_loss: 2.6666, test_f1: 0.5727
 epoch: 82, train_loss: 0.2081, test_loss: 2.6917, test_f1: 0.5761
 epoch: 83, train_loss: 0.1586, test_loss: 2.6702, test_f1: 0.5614
 epoch: 84, train_loss: 0.1633, test_loss: 2.6973, test_f1: 0.5720
 epoch: 85, train_loss: 0.1590, test_loss: 2.7699, test_f1: 0.5593
 epoch: 86, train_loss: 0.2001, test_loss: 2.7663, test_f1: 0.5685
 epoch: 87, train_loss: 0.2075, test_loss: 3.0204, test_f1: 0.5745
 epoch: 88, train_loss: 0.1786, test_loss: 2.7953, test_f1: 0.5506
 epoch: 89, train_loss: 0.1763, test_loss: 2.8110, test_f1: 0.5781
 epoch: 90, train_loss: 0.1432, test_loss: 2.9277, test_f1: 0.5717
 epoch: 91, train_loss: 0.1482, test_loss: 2.6238, test_f1: 0.5614
 epoch: 92, train_loss: 0.1352, test_loss: 3.0007, test_f1: 0.5560
 epoch: 93, train_loss: 0.1553, test_loss: 2.8290, test_f1: 0.5618
 epoch: 94, train_loss: 0.1493, test_loss: 2.7608, test_f1: 0.5689
 epoch: 95, train_loss: 0.1683, test_loss: 3.0209, test_f1: 0.5659
 epoch: 96, train_loss: 0.1589, test_loss: 2.9107, test_f1: 0.5565
 epoch: 97, train_loss: 0.1436, test_loss: 3.0372, test_f1: 0.5693
 epoch: 98, train_loss: 0.1558, test_loss: 2.9906, test_f1: 0.5744
 epoch: 99, train_loss: 0.1418, test_loss: 2.8801, test_f1: 0.5822
##################ITERATION #8 ****************************************
 epoch: 0, train_loss: 1.4929, test_loss: 1.4058, test_f1: 0.2281
 epoch: 1, train_loss: 1.1565, test_loss: 1.2285, test_f1: 0.4075
 epoch: 2, train_loss: 1.0479, test_loss: 1.1095, test_f1: 0.5182
 epoch: 3, train_loss: 0.9491, test_loss: 1.1192, test_f1: 0.4902
 epoch: 4, train_loss: 0.9046, test_loss: 1.0995, test_f1: 0.5487
 epoch: 5, train_loss: 0.8736, test_loss: 1.0677, test_f1: 0.5661
 epoch: 6, train_loss: 0.8336, test_loss: 1.1277, test_f1: 0.5354
 epoch: 7, train_loss: 0.8334, test_loss: 1.1125, test_f1: 0.5200
 epoch: 8, train_loss: 0.8047, test_loss: 1.0874, test_f1: 0.6096
 epoch: 9, train_loss: 0.7740, test_loss: 1.0845, test_f1: 0.5856
 epoch: 10, train_loss: 0.7468, test_loss: 1.1307, test_f1: 0.5661
 epoch: 11, train_loss: 0.7647, test_loss: 1.1083, test_f1: 0.5585
 epoch: 12, train_loss: 0.7391, test_loss: 1.0769, test_f1: 0.6205
 epoch: 13, train_loss: 0.7072, test_loss: 1.1190, test_f1: 0.5679
 epoch: 14, train_loss: 0.6937, test_loss: 1.1734, test_f1: 0.5856
 epoch: 15, train_loss: 0.7100, test_loss: 1.1167, test_f1: 0.5691
 epoch: 16, train_loss: 0.6704, test_loss: 1.1348, test_f1: 0.6071
 epoch: 17, train_loss: 0.6614, test_loss: 1.1302, test_f1: 0.5766
 epoch: 18, train_loss: 0.6551, test_loss: 1.2704, test_f1: 0.6030
 epoch: 19, train_loss: 0.6568, test_loss: 1.2125, test_f1: 0.6337
 epoch: 20, train_loss: 0.5877, test_loss: 1.2021, test_f1: 0.5951
 epoch: 21, train_loss: 0.6107, test_loss: 1.2476, test_f1: 0.5868
 epoch: 22, train_loss: 0.5999, test_loss: 1.2025, test_f1: 0.5919
 epoch: 23, train_loss: 0.5786, test_loss: 1.2754, test_f1: 0.5914
 epoch: 24, train_loss: 0.5586, test_loss: 1.2010, test_f1: 0.6003
 epoch: 25, train_loss: 0.5822, test_loss: 1.2322, test_f1: 0.6215
 epoch: 26, train_loss: 0.5528, test_loss: 1.3150, test_f1: 0.6219
 epoch: 27, train_loss: 0.5339, test_loss: 1.3199, test_f1: 0.6231
 epoch: 28, train_loss: 0.5258, test_loss: 1.3383, test_f1: 0.6064
 epoch: 29, train_loss: 0.5184, test_loss: 1.2850, test_f1: 0.6263
 epoch: 30, train_loss: 0.5483, test_loss: 1.2664, test_f1: 0.6106
 epoch: 31, train_loss: 0.5010, test_loss: 1.3632, test_f1: 0.6291
 epoch: 32, train_loss: 0.5023, test_loss: 1.3524, test_f1: 0.5428
 epoch: 33, train_loss: 0.4496, test_loss: 1.4633, test_f1: 0.6322
 epoch: 34, train_loss: 0.4620, test_loss: 1.4097, test_f1: 0.6531
 epoch: 35, train_loss: 0.4464, test_loss: 1.4871, test_f1: 0.6152
 epoch: 36, train_loss: 0.4617, test_loss: 1.6037, test_f1: 0.5415
 epoch: 37, train_loss: 0.4478, test_loss: 1.5054, test_f1: 0.6628
 epoch: 38, train_loss: 0.4279, test_loss: 1.4284, test_f1: 0.5963
 epoch: 39, train_loss: 0.4346, test_loss: 1.5369, test_f1: 0.6277
 epoch: 40, train_loss: 0.4367, test_loss: 1.6518, test_f1: 0.6057
 epoch: 41, train_loss: 0.4343, test_loss: 1.5555, test_f1: 0.6327
 epoch: 42, train_loss: 0.4197, test_loss: 1.5368, test_f1: 0.6363
 epoch: 43, train_loss: 0.3831, test_loss: 1.5966, test_f1: 0.6150
 epoch: 44, train_loss: 0.3857, test_loss: 1.6047, test_f1: 0.5966
 epoch: 45, train_loss: 0.3847, test_loss: 1.6080, test_f1: 0.6216
 epoch: 46, train_loss: 0.3820, test_loss: 1.8574, test_f1: 0.5957
 epoch: 47, train_loss: 0.3503, test_loss: 1.8803, test_f1: 0.6055
 epoch: 48, train_loss: 0.3554, test_loss: 1.8117, test_f1: 0.6192
 epoch: 49, train_loss: 0.3516, test_loss: 1.7221, test_f1: 0.6064
 epoch: 50, train_loss: 0.3535, test_loss: 1.8857, test_f1: 0.5998
 epoch: 51, train_loss: 0.3171, test_loss: 1.9524, test_f1: 0.6311
 epoch: 52, train_loss: 0.2728, test_loss: 1.9906, test_f1: 0.6228
 epoch: 53, train_loss: 0.2738, test_loss: 1.9446, test_f1: 0.6176
 epoch: 54, train_loss: 0.2460, test_loss: 1.9766, test_f1: 0.6385
 epoch: 55, train_loss: 0.2650, test_loss: 2.0329, test_f1: 0.6192
 epoch: 56, train_loss: 0.2353, test_loss: 2.1238, test_f1: 0.6257
 epoch: 57, train_loss: 0.2388, test_loss: 2.1781, test_f1: 0.6139
 epoch: 58, train_loss: 0.2223, test_loss: 2.1554, test_f1: 0.5964
 epoch: 59, train_loss: 0.2602, test_loss: 2.3148, test_f1: 0.5797
 epoch: 60, train_loss: 0.2481, test_loss: 2.2151, test_f1: 0.5924
 epoch: 61, train_loss: 0.2336, test_loss: 2.0978, test_f1: 0.6001
 epoch: 62, train_loss: 0.2362, test_loss: 2.2887, test_f1: 0.6316
 epoch: 63, train_loss: 0.2428, test_loss: 2.2040, test_f1: 0.5925
 epoch: 64, train_loss: 0.2398, test_loss: 2.1821, test_f1: 0.6104
 epoch: 65, train_loss: 0.2282, test_loss: 2.2888, test_f1: 0.6378
 epoch: 66, train_loss: 0.2081, test_loss: 2.2448, test_f1: 0.6213
 epoch: 67, train_loss: 0.2226, test_loss: 2.2763, test_f1: 0.6017
 epoch: 68, train_loss: 0.2031, test_loss: 2.2904, test_f1: 0.6067
 epoch: 69, train_loss: 0.2224, test_loss: 2.3282, test_f1: 0.6105
 epoch: 70, train_loss: 0.2028, test_loss: 2.3833, test_f1: 0.6205
 epoch: 71, train_loss: 0.1981, test_loss: 2.4882, test_f1: 0.6182
 epoch: 72, train_loss: 0.2085, test_loss: 2.5351, test_f1: 0.6099
 epoch: 73, train_loss: 0.2157, test_loss: 2.6298, test_f1: 0.5776
 epoch: 74, train_loss: 0.1946, test_loss: 2.4436, test_f1: 0.5894
 epoch: 75, train_loss: 0.1936, test_loss: 2.4673, test_f1: 0.6204
 epoch: 76, train_loss: 0.1947, test_loss: 2.4589, test_f1: 0.6029
 epoch: 77, train_loss: 0.1847, test_loss: 2.5993, test_f1: 0.6168
 epoch: 78, train_loss: 0.1831, test_loss: 2.7060, test_f1: 0.6252
 epoch: 79, train_loss: 0.2002, test_loss: 2.5365, test_f1: 0.5987
 epoch: 80, train_loss: 0.2067, test_loss: 2.5128, test_f1: 0.6060
 epoch: 81, train_loss: 0.1850, test_loss: 2.6987, test_f1: 0.6246
 epoch: 82, train_loss: 0.1758, test_loss: 2.5190, test_f1: 0.6252
 epoch: 83, train_loss: 0.1697, test_loss: 2.6334, test_f1: 0.6248
 epoch: 84, train_loss: 0.1970, test_loss: 2.7073, test_f1: 0.6250
 epoch: 85, train_loss: 0.1745, test_loss: 2.8109, test_f1: 0.6193
 epoch: 86, train_loss: 0.1715, test_loss: 2.7738, test_f1: 0.6581
 epoch: 87, train_loss: 0.1620, test_loss: 2.9846, test_f1: 0.6189
 epoch: 88, train_loss: 0.1888, test_loss: 2.7268, test_f1: 0.6214
 epoch: 89, train_loss: 0.1899, test_loss: 2.9855, test_f1: 0.5972
 epoch: 90, train_loss: 0.1719, test_loss: 2.7449, test_f1: 0.5956
 epoch: 91, train_loss: 0.1770, test_loss: 2.7947, test_f1: 0.6255
 epoch: 92, train_loss: 0.1795, test_loss: 2.7517, test_f1: 0.6175
 epoch: 93, train_loss: 0.1637, test_loss: 2.9185, test_f1: 0.6046
 epoch: 94, train_loss: 0.1875, test_loss: 2.8294, test_f1: 0.6526
 epoch: 95, train_loss: 0.1793, test_loss: 2.8964, test_f1: 0.6146
 epoch: 96, train_loss: 0.1637, test_loss: 2.8724, test_f1: 0.6015
 epoch: 97, train_loss: 0.1521, test_loss: 2.8916, test_f1: 0.6359
 epoch: 98, train_loss: 0.1484, test_loss: 2.9318, test_f1: 0.6112
 epoch: 99, train_loss: 0.1803, test_loss: 2.9944, test_f1: 0.6203
##################ITERATION #9 ****************************************
 epoch: 0, train_loss: 1.4629, test_loss: 1.4230, test_f1: 0.2403
 epoch: 1, train_loss: 1.1041, test_loss: 1.2547, test_f1: 0.3478
 epoch: 2, train_loss: 0.9935, test_loss: 1.1685, test_f1: 0.4479
 epoch: 3, train_loss: 0.9514, test_loss: 1.0751, test_f1: 0.5739
 epoch: 4, train_loss: 0.8970, test_loss: 1.1214, test_f1: 0.5441
 epoch: 5, train_loss: 0.8671, test_loss: 1.0862, test_f1: 0.5972
 epoch: 6, train_loss: 0.8385, test_loss: 1.0613, test_f1: 0.6019
 epoch: 7, train_loss: 0.8365, test_loss: 1.1283, test_f1: 0.5793
 epoch: 8, train_loss: 0.8042, test_loss: 1.1485, test_f1: 0.5415
 epoch: 9, train_loss: 0.7954, test_loss: 1.1951, test_f1: 0.5653
 epoch: 10, train_loss: 0.7818, test_loss: 1.2052, test_f1: 0.5749
 epoch: 11, train_loss: 0.7385, test_loss: 1.1894, test_f1: 0.5600
 epoch: 12, train_loss: 0.7096, test_loss: 1.2697, test_f1: 0.5823
 epoch: 13, train_loss: 0.7148, test_loss: 1.1414, test_f1: 0.5954
 epoch: 14, train_loss: 0.6882, test_loss: 1.2061, test_f1: 0.6217
 epoch: 15, train_loss: 0.6781, test_loss: 1.2471, test_f1: 0.5942
 epoch: 16, train_loss: 0.6525, test_loss: 1.2029, test_f1: 0.5892
 epoch: 17, train_loss: 0.6315, test_loss: 1.2700, test_f1: 0.5834
 epoch: 18, train_loss: 0.6189, test_loss: 1.3482, test_f1: 0.5185
 epoch: 19, train_loss: 0.6371, test_loss: 1.2448, test_f1: 0.6041
 epoch: 20, train_loss: 0.6252, test_loss: 1.2568, test_f1: 0.6252
 epoch: 21, train_loss: 0.5860, test_loss: 1.3435, test_f1: 0.5756
 epoch: 22, train_loss: 0.5806, test_loss: 1.3402, test_f1: 0.5637
 epoch: 23, train_loss: 0.5861, test_loss: 1.2650, test_f1: 0.6222
 epoch: 24, train_loss: 0.5936, test_loss: 1.4001, test_f1: 0.5579
 epoch: 25, train_loss: 0.6086, test_loss: 1.3194, test_f1: 0.5982
 epoch: 26, train_loss: 0.5514, test_loss: 1.3148, test_f1: 0.5808
 epoch: 27, train_loss: 0.5354, test_loss: 1.3452, test_f1: 0.6136
 epoch: 28, train_loss: 0.5153, test_loss: 1.3982, test_f1: 0.5692
 epoch: 29, train_loss: 0.5299, test_loss: 1.3941, test_f1: 0.6071
 epoch: 30, train_loss: 0.5342, test_loss: 1.3398, test_f1: 0.6066
 epoch: 31, train_loss: 0.5173, test_loss: 1.3416, test_f1: 0.6020
 epoch: 32, train_loss: 0.4914, test_loss: 1.4634, test_f1: 0.6049
 epoch: 33, train_loss: 0.4896, test_loss: 1.3315, test_f1: 0.6231
 epoch: 34, train_loss: 0.4388, test_loss: 1.3814, test_f1: 0.5993
 epoch: 35, train_loss: 0.4526, test_loss: 1.4943, test_f1: 0.6090
 epoch: 36, train_loss: 0.4355, test_loss: 1.5946, test_f1: 0.5746
 epoch: 37, train_loss: 0.4354, test_loss: 1.5239, test_f1: 0.5728
 epoch: 38, train_loss: 0.4499, test_loss: 1.7001, test_f1: 0.6022
 epoch: 39, train_loss: 0.4382, test_loss: 1.3727, test_f1: 0.6385
 epoch: 40, train_loss: 0.4487, test_loss: 1.7758, test_f1: 0.5669
 epoch: 41, train_loss: 0.4267, test_loss: 1.5043, test_f1: 0.5500
 epoch: 42, train_loss: 0.3841, test_loss: 1.4880, test_f1: 0.6460
 epoch: 43, train_loss: 0.3923, test_loss: 1.4911, test_f1: 0.6779
 epoch: 44, train_loss: 0.3840, test_loss: 1.7682, test_f1: 0.5632
 epoch: 45, train_loss: 0.3857, test_loss: 1.4926, test_f1: 0.6332
 epoch: 46, train_loss: 0.3832, test_loss: 1.5658, test_f1: 0.6028
 epoch: 47, train_loss: 0.3915, test_loss: 1.6340, test_f1: 0.5994
 epoch: 48, train_loss: 0.3926, test_loss: 1.7411, test_f1: 0.5980
 epoch: 49, train_loss: 0.3439, test_loss: 1.6088, test_f1: 0.6282
 epoch: 50, train_loss: 0.3532, test_loss: 1.7783, test_f1: 0.5936
 epoch: 51, train_loss: 0.3263, test_loss: 1.6508, test_f1: 0.6104
 epoch: 52, train_loss: 0.2747, test_loss: 1.6492, test_f1: 0.6246
 epoch: 53, train_loss: 0.2572, test_loss: 1.7118, test_f1: 0.6250
 epoch: 54, train_loss: 0.2517, test_loss: 1.8502, test_f1: 0.5849
 epoch: 55, train_loss: 0.2929, test_loss: 1.7078, test_f1: 0.6270
 epoch: 56, train_loss: 0.2738, test_loss: 1.9383, test_f1: 0.5985
 epoch: 57, train_loss: 0.2716, test_loss: 1.8206, test_f1: 0.6101
 epoch: 58, train_loss: 0.2626, test_loss: 1.8179, test_f1: 0.5880
 epoch: 59, train_loss: 0.2505, test_loss: 1.9522, test_f1: 0.6110
 epoch: 60, train_loss: 0.2520, test_loss: 1.8577, test_f1: 0.6138
 epoch: 61, train_loss: 0.2566, test_loss: 1.9373, test_f1: 0.6365
 epoch: 62, train_loss: 0.2483, test_loss: 1.8727, test_f1: 0.5841
 epoch: 63, train_loss: 0.2337, test_loss: 1.9079, test_f1: 0.6266
 epoch: 64, train_loss: 0.2246, test_loss: 1.9783, test_f1: 0.6218
 epoch: 65, train_loss: 0.2398, test_loss: 1.8577, test_f1: 0.6420
 epoch: 66, train_loss: 0.2157, test_loss: 2.0783, test_f1: 0.6110
 epoch: 67, train_loss: 0.2155, test_loss: 1.8849, test_f1: 0.6555
 epoch: 68, train_loss: 0.2175, test_loss: 1.9178, test_f1: 0.6014
 epoch: 69, train_loss: 0.2246, test_loss: 2.0740, test_f1: 0.6306
 epoch: 70, train_loss: 0.2502, test_loss: 2.0995, test_f1: 0.5892
 epoch: 71, train_loss: 0.2038, test_loss: 2.0889, test_f1: 0.6099
 epoch: 72, train_loss: 0.2104, test_loss: 2.1165, test_f1: 0.6036
 epoch: 73, train_loss: 0.1883, test_loss: 2.1179, test_f1: 0.6134
 epoch: 74, train_loss: 0.1900, test_loss: 2.1462, test_f1: 0.6031
 epoch: 75, train_loss: 0.2068, test_loss: 2.1462, test_f1: 0.6428
 epoch: 76, train_loss: 0.1909, test_loss: 2.2007, test_f1: 0.6052
 epoch: 77, train_loss: 0.2103, test_loss: 2.0565, test_f1: 0.6165
 epoch: 78, train_loss: 0.1997, test_loss: 2.1857, test_f1: 0.6164
 epoch: 79, train_loss: 0.1688, test_loss: 2.1925, test_f1: 0.6166
 epoch: 80, train_loss: 0.1781, test_loss: 2.2640, test_f1: 0.5971
 epoch: 81, train_loss: 0.1957, test_loss: 2.1567, test_f1: 0.6330
 epoch: 82, train_loss: 0.1834, test_loss: 2.2122, test_f1: 0.6127
 epoch: 83, train_loss: 0.1698, test_loss: 2.4033, test_f1: 0.6130
 epoch: 84, train_loss: 0.1668, test_loss: 2.3081, test_f1: 0.6120
 epoch: 85, train_loss: 0.1846, test_loss: 2.3177, test_f1: 0.6211
 epoch: 86, train_loss: 0.1678, test_loss: 2.3273, test_f1: 0.6102
 epoch: 87, train_loss: 0.1730, test_loss: 2.3609, test_f1: 0.6141
 epoch: 88, train_loss: 0.2142, test_loss: 2.1012, test_f1: 0.6226
 epoch: 89, train_loss: 0.1726, test_loss: 2.2689, test_f1: 0.5913
 epoch: 90, train_loss: 0.1820, test_loss: 2.3965, test_f1: 0.6004
 epoch: 91, train_loss: 0.1733, test_loss: 2.3288, test_f1: 0.6472
 epoch: 92, train_loss: 0.2015, test_loss: 2.4122, test_f1: 0.6181
 epoch: 93, train_loss: 0.1930, test_loss: 2.2617, test_f1: 0.6329
 epoch: 94, train_loss: 0.1581, test_loss: 2.3063, test_f1: 0.6555
 epoch: 95, train_loss: 0.1563, test_loss: 2.3201, test_f1: 0.6087
 epoch: 96, train_loss: 0.1393, test_loss: 2.3456, test_f1: 0.6588
 epoch: 97, train_loss: 0.1536, test_loss: 2.5064, test_f1: 0.5987
 epoch: 98, train_loss: 0.1478, test_loss: 2.4819, test_f1: 0.6257
 epoch: 99, train_loss: 0.1667, test_loss: 2.2345, test_f1: 0.6317

Training completed in 460.88 seconds
Best F1: 0.6779 at epoch 43
Mean F1 across iterations: 0.6593  0.0117
========================FINAL RESULTS================================
FEGIN weighted F1: 0.6779  0.0117
python main.py --data ltspice_demos --representation component_pin_net --model FEGIN --layers 4 --hiddens 64 --batch_size 64 --lr 0.001 --emb_size 128 --epochs 100 --save_appendix component_pin_net_L4_H64_BS64_LR0.001_E128 --no_val
-----



STDERR:
  File "main.py", line 370, in <module>
    main()
  File "main.py", line 254, in main
    dataset = dataset_class(
  File "/home/philip/projects/ltspice_examples_code_repo/Circuit-Completion-Using-GNNs/component_classification_with_link_prediction_head/evaluation/FEGIN/kernel/circuit_datasets.py", line 15, in __init__
    self.data, self.slices = torch.load(self.processed_paths[0])
  File "/home/philip/.local/lib/python3.8/site-packages/torch/serialization.py", line 1040, in load
    warnings.warn(
  File "/usr/lib/python3.8/warnings.py", line 109, in _showwarnmsg
    sw(msg.message, msg.category, msg.filename, msg.lineno,
  File "main.py", line 47, in warn_with_traceback
    traceback.print_stack(file=log)
/home/philip/projects/ltspice_examples_code_repo/Circuit-Completion-Using-GNNs/component_classification_with_link_prediction_head/evaluation/FEGIN/kernel/circuit_datasets.py:15: FutureWarning: You are using `torch.load` with `weights_only=False` (the current default value), which uses the default pickle module implicitly. It is possible to construct malicious pickle data which will execute arbitrary code during unpickling (See https://github.com/pytorch/pytorch/blob/main/SECURITY.md#untrusted-models for more details). In a future release, the default value for `weights_only` will be flipped to `True`. This limits the functions that could be executed during unpickling. Arbitrary objects will no longer be allowed to be loaded via this mode unless they are explicitly allowlisted by the user via `torch.serialization.add_safe_globals`. We recommend you start setting `weights_only=True` for any use case where you don't have full control of the loaded file. Please open an issue on GitHub for any issues related to this experimental feature.
  self.data, self.slices = torch.load(self.processed_paths[0])
