STDOUT:
Results will be saved in /home/philip/projects/ltspice_examples_code_repo/Circuit-Completion-Using-GNNs/component_classification_with_link_prediction_head/evaluation/FEGIN/results/model_FEGIN_dataset_ltspice_examples
Command line input: python main.py --data ltspice_examples --representation component_pin --model FEGIN --layers 6 --hiddens 128 --batch_size 64 --lr 0.0001 --emb_size 512 --epochs 100 --save_appendix component_pin_L6_H128_BS64_LR0.0001_E512 --no_val
 is saved.
-----
ltspice_examples - FEGIN
Using 6 layers, 128 hidden units, h = 2
Loading component_pin representation dataset
ENTERED
Training FEGIN on component_pin representation
Train: 3560, Test: 848
##################ITERATION #0 ****************************************
 epoch: 0, train_loss: 1.3537, test_loss: 1.3282, test_f1: 0.2260
 epoch: 1, train_loss: 1.2752, test_loss: 1.2369, test_f1: 0.2260
 epoch: 2, train_loss: 1.2079, test_loss: 1.1617, test_f1: 0.3400
 epoch: 3, train_loss: 1.1369, test_loss: 1.0998, test_f1: 0.3350
 epoch: 4, train_loss: 1.0724, test_loss: 1.0601, test_f1: 0.3570
 epoch: 5, train_loss: 1.0290, test_loss: 1.0561, test_f1: 0.3582
 epoch: 6, train_loss: 1.0078, test_loss: 1.0177, test_f1: 0.3762
 epoch: 7, train_loss: 0.9866, test_loss: 1.0136, test_f1: 0.4447
 epoch: 8, train_loss: 0.9668, test_loss: 1.0087, test_f1: 0.4296
 epoch: 9, train_loss: 0.9499, test_loss: 1.0108, test_f1: 0.4577
 epoch: 10, train_loss: 0.9295, test_loss: 0.9795, test_f1: 0.4995
 epoch: 11, train_loss: 0.9185, test_loss: 0.9514, test_f1: 0.5107
 epoch: 12, train_loss: 0.8994, test_loss: 0.9431, test_f1: 0.5067
 epoch: 13, train_loss: 0.8978, test_loss: 0.9657, test_f1: 0.5209
 epoch: 14, train_loss: 0.8728, test_loss: 0.9400, test_f1: 0.5092
 epoch: 15, train_loss: 0.8565, test_loss: 0.9368, test_f1: 0.5117
 epoch: 16, train_loss: 0.8468, test_loss: 0.9660, test_f1: 0.5305
 epoch: 17, train_loss: 0.8281, test_loss: 0.9434, test_f1: 0.5321
 epoch: 18, train_loss: 0.8192, test_loss: 0.9334, test_f1: 0.5633
 epoch: 19, train_loss: 0.8077, test_loss: 0.9150, test_f1: 0.5509
 epoch: 20, train_loss: 0.7978, test_loss: 0.9031, test_f1: 0.5667
 epoch: 21, train_loss: 0.7960, test_loss: 0.9747, test_f1: 0.5381
 epoch: 22, train_loss: 0.7840, test_loss: 0.9148, test_f1: 0.5507
 epoch: 23, train_loss: 0.7544, test_loss: 0.8834, test_f1: 0.5637
 epoch: 24, train_loss: 0.7667, test_loss: 0.9223, test_f1: 0.5654
 epoch: 25, train_loss: 0.7483, test_loss: 0.9479, test_f1: 0.5534
 epoch: 26, train_loss: 0.7554, test_loss: 0.9719, test_f1: 0.5451
 epoch: 27, train_loss: 0.7340, test_loss: 0.9062, test_f1: 0.5741
 epoch: 28, train_loss: 0.7264, test_loss: 0.9492, test_f1: 0.5622
 epoch: 29, train_loss: 0.7234, test_loss: 0.9181, test_f1: 0.5561
 epoch: 30, train_loss: 0.6997, test_loss: 0.8991, test_f1: 0.5588
 epoch: 31, train_loss: 0.6985, test_loss: 0.9168, test_f1: 0.5894
 epoch: 32, train_loss: 0.7001, test_loss: 0.9077, test_f1: 0.5592
 epoch: 33, train_loss: 0.6812, test_loss: 0.9364, test_f1: 0.5534
 epoch: 34, train_loss: 0.6722, test_loss: 0.9274, test_f1: 0.5659
 epoch: 35, train_loss: 0.6581, test_loss: 0.9694, test_f1: 0.5675
 epoch: 36, train_loss: 0.6657, test_loss: 0.9441, test_f1: 0.5584
 epoch: 37, train_loss: 0.6510, test_loss: 0.9213, test_f1: 0.5598
 epoch: 38, train_loss: 0.6414, test_loss: 0.9455, test_f1: 0.5629
 epoch: 39, train_loss: 0.6487, test_loss: 0.9658, test_f1: 0.5617
 epoch: 40, train_loss: 0.6359, test_loss: 0.9523, test_f1: 0.5733
 epoch: 41, train_loss: 0.6235, test_loss: 1.0022, test_f1: 0.5380
 epoch: 42, train_loss: 0.6263, test_loss: 0.9875, test_f1: 0.5618
 epoch: 43, train_loss: 0.6139, test_loss: 0.9802, test_f1: 0.5654
 epoch: 44, train_loss: 0.6138, test_loss: 0.9919, test_f1: 0.5527
 epoch: 45, train_loss: 0.6046, test_loss: 0.9765, test_f1: 0.5989
 epoch: 46, train_loss: 0.5906, test_loss: 0.9938, test_f1: 0.5689
 epoch: 47, train_loss: 0.5822, test_loss: 0.9688, test_f1: 0.5856
 epoch: 48, train_loss: 0.5796, test_loss: 0.9918, test_f1: 0.5706
 epoch: 49, train_loss: 0.5817, test_loss: 0.9643, test_f1: 0.5834
 epoch: 50, train_loss: 0.5793, test_loss: 0.9756, test_f1: 0.5918
 epoch: 51, train_loss: 0.5478, test_loss: 0.9952, test_f1: 0.5696
 epoch: 52, train_loss: 0.5552, test_loss: 0.9970, test_f1: 0.5790
 epoch: 53, train_loss: 0.5358, test_loss: 1.0437, test_f1: 0.5746
 epoch: 54, train_loss: 0.5347, test_loss: 1.0436, test_f1: 0.5776
 epoch: 55, train_loss: 0.5273, test_loss: 1.0105, test_f1: 0.5718
 epoch: 56, train_loss: 0.5317, test_loss: 1.0439, test_f1: 0.5679
 epoch: 57, train_loss: 0.5286, test_loss: 1.0375, test_f1: 0.5837
 epoch: 58, train_loss: 0.5127, test_loss: 1.0530, test_f1: 0.5778
 epoch: 59, train_loss: 0.5117, test_loss: 1.0463, test_f1: 0.5826
 epoch: 60, train_loss: 0.5080, test_loss: 1.0890, test_f1: 0.5816
 epoch: 61, train_loss: 0.5155, test_loss: 1.0477, test_f1: 0.5893
 epoch: 62, train_loss: 0.4990, test_loss: 1.0917, test_f1: 0.5798
 epoch: 63, train_loss: 0.5091, test_loss: 1.0397, test_f1: 0.5805
 epoch: 64, train_loss: 0.5081, test_loss: 1.0713, test_f1: 0.5758
 epoch: 65, train_loss: 0.5124, test_loss: 1.0777, test_f1: 0.5841
 epoch: 66, train_loss: 0.5058, test_loss: 1.1352, test_f1: 0.5785
 epoch: 67, train_loss: 0.5004, test_loss: 1.0910, test_f1: 0.5786
 epoch: 68, train_loss: 0.4963, test_loss: 1.1564, test_f1: 0.5892
 epoch: 69, train_loss: 0.4898, test_loss: 1.1208, test_f1: 0.5753
 epoch: 70, train_loss: 0.4855, test_loss: 1.1079, test_f1: 0.6016
 epoch: 71, train_loss: 0.4799, test_loss: 1.1248, test_f1: 0.5911
 epoch: 72, train_loss: 0.4999, test_loss: 1.1524, test_f1: 0.5897
 epoch: 73, train_loss: 0.4828, test_loss: 1.1340, test_f1: 0.5947
 epoch: 74, train_loss: 0.4740, test_loss: 1.1396, test_f1: 0.5937
 epoch: 75, train_loss: 0.4870, test_loss: 1.2163, test_f1: 0.5855
 epoch: 76, train_loss: 0.4633, test_loss: 1.1524, test_f1: 0.5909
 epoch: 77, train_loss: 0.4728, test_loss: 1.2111, test_f1: 0.6063
 epoch: 78, train_loss: 0.4821, test_loss: 1.1722, test_f1: 0.5968
 epoch: 79, train_loss: 0.4611, test_loss: 1.1648, test_f1: 0.6008
 epoch: 80, train_loss: 0.4548, test_loss: 1.2507, test_f1: 0.5920
 epoch: 81, train_loss: 0.4495, test_loss: 1.2248, test_f1: 0.5909
 epoch: 82, train_loss: 0.4626, test_loss: 1.2234, test_f1: 0.6060
 epoch: 83, train_loss: 0.4573, test_loss: 1.2080, test_f1: 0.5855
 epoch: 84, train_loss: 0.4338, test_loss: 1.2389, test_f1: 0.5982
 epoch: 85, train_loss: 0.4485, test_loss: 1.2591, test_f1: 0.6024
 epoch: 86, train_loss: 0.4516, test_loss: 1.2119, test_f1: 0.5843
 epoch: 87, train_loss: 0.4418, test_loss: 1.2706, test_f1: 0.6040
 epoch: 88, train_loss: 0.4482, test_loss: 1.2169, test_f1: 0.5864
 epoch: 89, train_loss: 0.4414, test_loss: 1.2676, test_f1: 0.6065
 epoch: 90, train_loss: 0.4250, test_loss: 1.3068, test_f1: 0.6081
 epoch: 91, train_loss: 0.4129, test_loss: 1.3066, test_f1: 0.6003
 epoch: 92, train_loss: 0.4284, test_loss: 1.2550, test_f1: 0.6101
 epoch: 93, train_loss: 0.4249, test_loss: 1.3525, test_f1: 0.6166
 epoch: 94, train_loss: 0.4357, test_loss: 1.4721, test_f1: 0.5969
 epoch: 95, train_loss: 0.4304, test_loss: 1.3034, test_f1: 0.5912
 epoch: 96, train_loss: 0.4301, test_loss: 1.3098, test_f1: 0.5920
 epoch: 97, train_loss: 0.4303, test_loss: 1.2916, test_f1: 0.6029
 epoch: 98, train_loss: 0.4080, test_loss: 1.3643, test_f1: 0.5961
 epoch: 99, train_loss: 0.4186, test_loss: 1.3696, test_f1: 0.6149
##################ITERATION #1 ****************************************
 epoch: 0, train_loss: 1.2661, test_loss: 1.2086, test_f1: 0.2429
 epoch: 1, train_loss: 1.1249, test_loss: 1.0630, test_f1: 0.4314
 epoch: 2, train_loss: 1.0514, test_loss: 1.0243, test_f1: 0.4895
 epoch: 3, train_loss: 1.0014, test_loss: 1.0091, test_f1: 0.4835
 epoch: 4, train_loss: 0.9716, test_loss: 0.9861, test_f1: 0.5017
 epoch: 5, train_loss: 0.9424, test_loss: 0.9559, test_f1: 0.4858
 epoch: 6, train_loss: 0.9223, test_loss: 0.9693, test_f1: 0.5284
 epoch: 7, train_loss: 0.9063, test_loss: 0.9725, test_f1: 0.5298
 epoch: 8, train_loss: 0.8893, test_loss: 0.9636, test_f1: 0.5147
 epoch: 9, train_loss: 0.8632, test_loss: 0.9555, test_f1: 0.5320
 epoch: 10, train_loss: 0.8609, test_loss: 0.9617, test_f1: 0.5329
 epoch: 11, train_loss: 0.8452, test_loss: 0.9205, test_f1: 0.5442
 epoch: 12, train_loss: 0.8373, test_loss: 0.9382, test_f1: 0.5484
 epoch: 13, train_loss: 0.8126, test_loss: 0.9450, test_f1: 0.5388
 epoch: 14, train_loss: 0.7983, test_loss: 0.9439, test_f1: 0.5596
 epoch: 15, train_loss: 0.7926, test_loss: 0.9972, test_f1: 0.5117
 epoch: 16, train_loss: 0.7806, test_loss: 0.9499, test_f1: 0.5576
 epoch: 17, train_loss: 0.7772, test_loss: 0.9449, test_f1: 0.5380
 epoch: 18, train_loss: 0.7541, test_loss: 0.9409, test_f1: 0.5600
 epoch: 19, train_loss: 0.7551, test_loss: 0.9229, test_f1: 0.5645
 epoch: 20, train_loss: 0.7311, test_loss: 0.9253, test_f1: 0.5533
 epoch: 21, train_loss: 0.7297, test_loss: 0.9235, test_f1: 0.5650
 epoch: 22, train_loss: 0.7273, test_loss: 0.8919, test_f1: 0.5394
 epoch: 23, train_loss: 0.7067, test_loss: 0.8830, test_f1: 0.5741
 epoch: 24, train_loss: 0.7111, test_loss: 0.9417, test_f1: 0.5602
 epoch: 25, train_loss: 0.7051, test_loss: 0.9247, test_f1: 0.5783
 epoch: 26, train_loss: 0.6806, test_loss: 0.9478, test_f1: 0.5680
 epoch: 27, train_loss: 0.6722, test_loss: 0.9239, test_f1: 0.5632
 epoch: 28, train_loss: 0.6733, test_loss: 0.9278, test_f1: 0.5542
 epoch: 29, train_loss: 0.6618, test_loss: 0.9160, test_f1: 0.5843
 epoch: 30, train_loss: 0.6488, test_loss: 0.9831, test_f1: 0.5619
 epoch: 31, train_loss: 0.6558, test_loss: 0.9458, test_f1: 0.5638
 epoch: 32, train_loss: 0.6433, test_loss: 0.9553, test_f1: 0.5689
 epoch: 33, train_loss: 0.6334, test_loss: 0.9283, test_f1: 0.5849
 epoch: 34, train_loss: 0.6244, test_loss: 0.8805, test_f1: 0.6017
 epoch: 35, train_loss: 0.6108, test_loss: 0.9209, test_f1: 0.5945
 epoch: 36, train_loss: 0.6100, test_loss: 0.9651, test_f1: 0.5826
 epoch: 37, train_loss: 0.6161, test_loss: 0.9281, test_f1: 0.5929
 epoch: 38, train_loss: 0.5997, test_loss: 0.8557, test_f1: 0.6063
 epoch: 39, train_loss: 0.6144, test_loss: 0.9903, test_f1: 0.5909
 epoch: 40, train_loss: 0.5925, test_loss: 1.0049, test_f1: 0.6054
 epoch: 41, train_loss: 0.5784, test_loss: 0.9850, test_f1: 0.5918
 epoch: 42, train_loss: 0.5872, test_loss: 0.9158, test_f1: 0.6393
 epoch: 43, train_loss: 0.5703, test_loss: 0.9711, test_f1: 0.6346
 epoch: 44, train_loss: 0.5669, test_loss: 0.9966, test_f1: 0.5968
 epoch: 45, train_loss: 0.5601, test_loss: 0.9450, test_f1: 0.6474
 epoch: 46, train_loss: 0.5600, test_loss: 1.1105, test_f1: 0.5923
 epoch: 47, train_loss: 0.5478, test_loss: 1.0252, test_f1: 0.6108
 epoch: 48, train_loss: 0.5306, test_loss: 1.0578, test_f1: 0.6166
 epoch: 49, train_loss: 0.5325, test_loss: 0.9066, test_f1: 0.6313
 epoch: 50, train_loss: 0.5263, test_loss: 1.0385, test_f1: 0.6197
 epoch: 51, train_loss: 0.5116, test_loss: 1.0794, test_f1: 0.6217
 epoch: 52, train_loss: 0.4927, test_loss: 1.0613, test_f1: 0.6265
 epoch: 53, train_loss: 0.4916, test_loss: 1.0804, test_f1: 0.6254
 epoch: 54, train_loss: 0.4750, test_loss: 1.1347, test_f1: 0.6205
 epoch: 55, train_loss: 0.4757, test_loss: 1.0964, test_f1: 0.6414
 epoch: 56, train_loss: 0.4635, test_loss: 1.0807, test_f1: 0.6114
 epoch: 57, train_loss: 0.4701, test_loss: 1.1043, test_f1: 0.6351
 epoch: 58, train_loss: 0.4582, test_loss: 1.1676, test_f1: 0.6311
 epoch: 59, train_loss: 0.4692, test_loss: 1.1732, test_f1: 0.6469
 epoch: 60, train_loss: 0.4577, test_loss: 1.1250, test_f1: 0.6474
 epoch: 61, train_loss: 0.4494, test_loss: 1.1581, test_f1: 0.6331
 epoch: 62, train_loss: 0.4621, test_loss: 1.1757, test_f1: 0.6336
 epoch: 63, train_loss: 0.4525, test_loss: 1.2088, test_f1: 0.6592
 epoch: 64, train_loss: 0.4421, test_loss: 1.1646, test_f1: 0.6541
 epoch: 65, train_loss: 0.4592, test_loss: 1.1100, test_f1: 0.6394
 epoch: 66, train_loss: 0.4448, test_loss: 1.1725, test_f1: 0.6397
 epoch: 67, train_loss: 0.4436, test_loss: 1.1523, test_f1: 0.6468
 epoch: 68, train_loss: 0.4390, test_loss: 1.1920, test_f1: 0.6493
 epoch: 69, train_loss: 0.4300, test_loss: 1.2187, test_f1: 0.6405
 epoch: 70, train_loss: 0.4329, test_loss: 1.1711, test_f1: 0.6520
 epoch: 71, train_loss: 0.4310, test_loss: 1.2581, test_f1: 0.6408
 epoch: 72, train_loss: 0.4160, test_loss: 1.2419, test_f1: 0.6596
 epoch: 73, train_loss: 0.4307, test_loss: 1.2055, test_f1: 0.6499
 epoch: 74, train_loss: 0.4401, test_loss: 1.1911, test_f1: 0.6497
 epoch: 75, train_loss: 0.4377, test_loss: 1.1851, test_f1: 0.6553
 epoch: 76, train_loss: 0.4248, test_loss: 1.2557, test_f1: 0.6523
 epoch: 77, train_loss: 0.4211, test_loss: 1.2594, test_f1: 0.6530
 epoch: 78, train_loss: 0.4138, test_loss: 1.2316, test_f1: 0.6495
 epoch: 79, train_loss: 0.4203, test_loss: 1.2710, test_f1: 0.6579
 epoch: 80, train_loss: 0.4103, test_loss: 1.2683, test_f1: 0.6565
 epoch: 81, train_loss: 0.4239, test_loss: 1.2691, test_f1: 0.6433
 epoch: 82, train_loss: 0.4037, test_loss: 1.2964, test_f1: 0.6478
 epoch: 83, train_loss: 0.3939, test_loss: 1.2214, test_f1: 0.6673
 epoch: 84, train_loss: 0.3865, test_loss: 1.2541, test_f1: 0.6657
 epoch: 85, train_loss: 0.3971, test_loss: 1.3029, test_f1: 0.6569
 epoch: 86, train_loss: 0.3830, test_loss: 1.3621, test_f1: 0.6559
 epoch: 87, train_loss: 0.3842, test_loss: 1.2772, test_f1: 0.6562
 epoch: 88, train_loss: 0.3850, test_loss: 1.3166, test_f1: 0.6507
 epoch: 89, train_loss: 0.3672, test_loss: 1.3210, test_f1: 0.6462
 epoch: 90, train_loss: 0.3848, test_loss: 1.2709, test_f1: 0.6562
 epoch: 91, train_loss: 0.3719, test_loss: 1.3347, test_f1: 0.6512
 epoch: 92, train_loss: 0.3759, test_loss: 1.3689, test_f1: 0.6610
 epoch: 93, train_loss: 0.3790, test_loss: 1.3171, test_f1: 0.6520
 epoch: 94, train_loss: 0.3779, test_loss: 1.3984, test_f1: 0.6368
 epoch: 95, train_loss: 0.3852, test_loss: 1.3218, test_f1: 0.6285
 epoch: 96, train_loss: 0.3665, test_loss: 1.3228, test_f1: 0.6496
 epoch: 97, train_loss: 0.3713, test_loss: 1.3678, test_f1: 0.6694
 epoch: 98, train_loss: 0.3599, test_loss: 1.3347, test_f1: 0.6658
 epoch: 99, train_loss: 0.3679, test_loss: 1.4100, test_f1: 0.6696
##################ITERATION #2 ****************************************
 epoch: 0, train_loss: 1.2275, test_loss: 1.1828, test_f1: 0.3380
 epoch: 1, train_loss: 1.1120, test_loss: 1.0600, test_f1: 0.4282
 epoch: 2, train_loss: 1.0509, test_loss: 1.0321, test_f1: 0.4834
 epoch: 3, train_loss: 1.0163, test_loss: 1.0132, test_f1: 0.4988
 epoch: 4, train_loss: 0.9886, test_loss: 0.9938, test_f1: 0.5031
 epoch: 5, train_loss: 0.9634, test_loss: 0.9774, test_f1: 0.5113
 epoch: 6, train_loss: 0.9365, test_loss: 0.9830, test_f1: 0.5279
 epoch: 7, train_loss: 0.9282, test_loss: 0.9697, test_f1: 0.5023
 epoch: 8, train_loss: 0.9071, test_loss: 0.9518, test_f1: 0.5292
 epoch: 9, train_loss: 0.8861, test_loss: 0.9552, test_f1: 0.5436
 epoch: 10, train_loss: 0.8630, test_loss: 0.9450, test_f1: 0.5107
 epoch: 11, train_loss: 0.8401, test_loss: 0.9442, test_f1: 0.5414
 epoch: 12, train_loss: 0.8244, test_loss: 0.9481, test_f1: 0.5491
 epoch: 13, train_loss: 0.8215, test_loss: 0.9356, test_f1: 0.5479
 epoch: 14, train_loss: 0.8045, test_loss: 0.8767, test_f1: 0.5727
 epoch: 15, train_loss: 0.7914, test_loss: 0.9239, test_f1: 0.5564
 epoch: 16, train_loss: 0.7722, test_loss: 0.9064, test_f1: 0.5737
 epoch: 17, train_loss: 0.7696, test_loss: 0.8842, test_f1: 0.5602
 epoch: 18, train_loss: 0.7468, test_loss: 0.9496, test_f1: 0.5427
 epoch: 19, train_loss: 0.7406, test_loss: 1.0197, test_f1: 0.5437
 epoch: 20, train_loss: 0.7250, test_loss: 0.8880, test_f1: 0.5617
 epoch: 21, train_loss: 0.7193, test_loss: 0.8992, test_f1: 0.5920
 epoch: 22, train_loss: 0.7020, test_loss: 0.9292, test_f1: 0.5631
 epoch: 23, train_loss: 0.7191, test_loss: 0.8408, test_f1: 0.5940
 epoch: 24, train_loss: 0.6994, test_loss: 0.8866, test_f1: 0.5944
 epoch: 25, train_loss: 0.6832, test_loss: 0.9048, test_f1: 0.5897
 epoch: 26, train_loss: 0.6784, test_loss: 0.8720, test_f1: 0.5906
 epoch: 27, train_loss: 0.6663, test_loss: 0.8727, test_f1: 0.5978
 epoch: 28, train_loss: 0.6671, test_loss: 0.8374, test_f1: 0.5945
 epoch: 29, train_loss: 0.6422, test_loss: 0.8609, test_f1: 0.6171
 epoch: 30, train_loss: 0.6281, test_loss: 0.8920, test_f1: 0.5905
 epoch: 31, train_loss: 0.6427, test_loss: 0.8364, test_f1: 0.6174
 epoch: 32, train_loss: 0.6228, test_loss: 0.8097, test_f1: 0.6337
 epoch: 33, train_loss: 0.6151, test_loss: 0.8514, test_f1: 0.6226
 epoch: 34, train_loss: 0.6015, test_loss: 0.8007, test_f1: 0.6185
 epoch: 35, train_loss: 0.6155, test_loss: 0.8596, test_f1: 0.6328
 epoch: 36, train_loss: 0.5996, test_loss: 0.8530, test_f1: 0.6271
 epoch: 37, train_loss: 0.6028, test_loss: 0.8389, test_f1: 0.6348
 epoch: 38, train_loss: 0.5899, test_loss: 0.8605, test_f1: 0.6325
 epoch: 39, train_loss: 0.5792, test_loss: 0.8680, test_f1: 0.6109
 epoch: 40, train_loss: 0.5712, test_loss: 0.8429, test_f1: 0.5928
 epoch: 41, train_loss: 0.5644, test_loss: 0.8538, test_f1: 0.6437
 epoch: 42, train_loss: 0.5478, test_loss: 0.8727, test_f1: 0.6180
 epoch: 43, train_loss: 0.5571, test_loss: 0.8714, test_f1: 0.6450
 epoch: 44, train_loss: 0.5473, test_loss: 0.8684, test_f1: 0.6207
 epoch: 45, train_loss: 0.5352, test_loss: 0.8608, test_f1: 0.6196
 epoch: 46, train_loss: 0.5228, test_loss: 0.9277, test_f1: 0.6212
 epoch: 47, train_loss: 0.5287, test_loss: 0.9207, test_f1: 0.6256
 epoch: 48, train_loss: 0.5227, test_loss: 0.9514, test_f1: 0.6059
 epoch: 49, train_loss: 0.5336, test_loss: 0.8409, test_f1: 0.6559
 epoch: 50, train_loss: 0.5047, test_loss: 0.9290, test_f1: 0.6409
 epoch: 51, train_loss: 0.4963, test_loss: 0.9160, test_f1: 0.6295
 epoch: 52, train_loss: 0.4833, test_loss: 0.9260, test_f1: 0.6245
 epoch: 53, train_loss: 0.4901, test_loss: 0.9020, test_f1: 0.6391
 epoch: 54, train_loss: 0.4677, test_loss: 0.8834, test_f1: 0.6278
 epoch: 55, train_loss: 0.4704, test_loss: 0.9039, test_f1: 0.6410
 epoch: 56, train_loss: 0.4667, test_loss: 0.8942, test_f1: 0.6485
 epoch: 57, train_loss: 0.4533, test_loss: 0.9315, test_f1: 0.6457
 epoch: 58, train_loss: 0.4476, test_loss: 0.9592, test_f1: 0.6256
 epoch: 59, train_loss: 0.4504, test_loss: 0.9902, test_f1: 0.6380
 epoch: 60, train_loss: 0.4579, test_loss: 0.9091, test_f1: 0.6451
 epoch: 61, train_loss: 0.4504, test_loss: 0.9213, test_f1: 0.6549
 epoch: 62, train_loss: 0.4305, test_loss: 0.9364, test_f1: 0.6670
 epoch: 63, train_loss: 0.4387, test_loss: 0.9146, test_f1: 0.6491
 epoch: 64, train_loss: 0.4346, test_loss: 0.9319, test_f1: 0.6491
 epoch: 65, train_loss: 0.4243, test_loss: 0.9435, test_f1: 0.6535
 epoch: 66, train_loss: 0.4166, test_loss: 0.9323, test_f1: 0.6712
 epoch: 67, train_loss: 0.4236, test_loss: 0.9391, test_f1: 0.6424
 epoch: 68, train_loss: 0.4282, test_loss: 0.9372, test_f1: 0.6483
 epoch: 69, train_loss: 0.4202, test_loss: 1.0651, test_f1: 0.6254
 epoch: 70, train_loss: 0.4122, test_loss: 0.9448, test_f1: 0.6703
 epoch: 71, train_loss: 0.4172, test_loss: 0.9305, test_f1: 0.6728
 epoch: 72, train_loss: 0.4137, test_loss: 0.9313, test_f1: 0.6574
 epoch: 73, train_loss: 0.3969, test_loss: 0.9923, test_f1: 0.6607
 epoch: 74, train_loss: 0.3996, test_loss: 1.0341, test_f1: 0.6535
 epoch: 75, train_loss: 0.3963, test_loss: 1.0008, test_f1: 0.6574
 epoch: 76, train_loss: 0.4019, test_loss: 1.0320, test_f1: 0.6494
 epoch: 77, train_loss: 0.4029, test_loss: 1.0259, test_f1: 0.6432
 epoch: 78, train_loss: 0.3908, test_loss: 1.0165, test_f1: 0.6523
 epoch: 79, train_loss: 0.3956, test_loss: 1.0833, test_f1: 0.6449
 epoch: 80, train_loss: 0.3884, test_loss: 1.1132, test_f1: 0.6483
 epoch: 81, train_loss: 0.4002, test_loss: 0.9893, test_f1: 0.6631
 epoch: 82, train_loss: 0.3864, test_loss: 0.9581, test_f1: 0.6587
 epoch: 83, train_loss: 0.3868, test_loss: 1.1217, test_f1: 0.6656
 epoch: 84, train_loss: 0.3896, test_loss: 1.0670, test_f1: 0.6695
 epoch: 85, train_loss: 0.3744, test_loss: 1.1438, test_f1: 0.6558
 epoch: 86, train_loss: 0.3564, test_loss: 1.1284, test_f1: 0.6569
 epoch: 87, train_loss: 0.3749, test_loss: 1.1249, test_f1: 0.6416
 epoch: 88, train_loss: 0.3715, test_loss: 1.0874, test_f1: 0.6540
 epoch: 89, train_loss: 0.3618, test_loss: 1.0033, test_f1: 0.6795
 epoch: 90, train_loss: 0.3734, test_loss: 1.0802, test_f1: 0.6626
 epoch: 91, train_loss: 0.3649, test_loss: 1.1432, test_f1: 0.6607
 epoch: 92, train_loss: 0.3458, test_loss: 1.0805, test_f1: 0.6585
 epoch: 93, train_loss: 0.3704, test_loss: 1.1473, test_f1: 0.6554
 epoch: 94, train_loss: 0.3579, test_loss: 1.1554, test_f1: 0.6539
 epoch: 95, train_loss: 0.3556, test_loss: 1.1024, test_f1: 0.6688
 epoch: 96, train_loss: 0.3573, test_loss: 1.1148, test_f1: 0.6676
 epoch: 97, train_loss: 0.3395, test_loss: 1.0955, test_f1: 0.6601
 epoch: 98, train_loss: 0.3421, test_loss: 1.0362, test_f1: 0.6675
 epoch: 99, train_loss: 0.3335, test_loss: 1.1998, test_f1: 0.6459
##################ITERATION #3 ****************************************
 epoch: 0, train_loss: 1.2262, test_loss: 1.2131, test_f1: 0.2673
 epoch: 1, train_loss: 1.0967, test_loss: 1.0321, test_f1: 0.4757
 epoch: 2, train_loss: 1.0407, test_loss: 0.9969, test_f1: 0.5262
 epoch: 3, train_loss: 1.0046, test_loss: 0.9728, test_f1: 0.5169
 epoch: 4, train_loss: 0.9711, test_loss: 0.9630, test_f1: 0.5247
 epoch: 5, train_loss: 0.9558, test_loss: 0.9476, test_f1: 0.5135
 epoch: 6, train_loss: 0.9375, test_loss: 0.9382, test_f1: 0.5308
 epoch: 7, train_loss: 0.9108, test_loss: 0.9326, test_f1: 0.5537
 epoch: 8, train_loss: 0.8874, test_loss: 0.9350, test_f1: 0.5278
 epoch: 9, train_loss: 0.8604, test_loss: 0.9384, test_f1: 0.5400
 epoch: 10, train_loss: 0.8568, test_loss: 0.9248, test_f1: 0.5519
 epoch: 11, train_loss: 0.8387, test_loss: 0.9321, test_f1: 0.5651
 epoch: 12, train_loss: 0.8097, test_loss: 0.9396, test_f1: 0.5655
 epoch: 13, train_loss: 0.8178, test_loss: 0.9101, test_f1: 0.5780
 epoch: 14, train_loss: 0.7931, test_loss: 0.9203, test_f1: 0.5890
 epoch: 15, train_loss: 0.7806, test_loss: 0.9111, test_f1: 0.5887
 epoch: 16, train_loss: 0.7665, test_loss: 0.9234, test_f1: 0.5766
 epoch: 17, train_loss: 0.7540, test_loss: 0.9251, test_f1: 0.5648
 epoch: 18, train_loss: 0.7521, test_loss: 0.9215, test_f1: 0.5714
 epoch: 19, train_loss: 0.7272, test_loss: 0.9543, test_f1: 0.5872
 epoch: 20, train_loss: 0.7247, test_loss: 0.9823, test_f1: 0.5532
 epoch: 21, train_loss: 0.7208, test_loss: 0.9481, test_f1: 0.5820
 epoch: 22, train_loss: 0.7123, test_loss: 0.9996, test_f1: 0.5597
 epoch: 23, train_loss: 0.6971, test_loss: 0.9578, test_f1: 0.5765
 epoch: 24, train_loss: 0.6694, test_loss: 0.9447, test_f1: 0.5855
 epoch: 25, train_loss: 0.6791, test_loss: 0.9466, test_f1: 0.5988
 epoch: 26, train_loss: 0.6669, test_loss: 0.9448, test_f1: 0.5903
 epoch: 27, train_loss: 0.6493, test_loss: 0.9358, test_f1: 0.6214
 epoch: 28, train_loss: 0.6603, test_loss: 0.9299, test_f1: 0.5948
 epoch: 29, train_loss: 0.6410, test_loss: 0.9778, test_f1: 0.6041
 epoch: 30, train_loss: 0.6256, test_loss: 0.9652, test_f1: 0.5918
 epoch: 31, train_loss: 0.6182, test_loss: 0.9545, test_f1: 0.5945
 epoch: 32, train_loss: 0.6114, test_loss: 0.9710, test_f1: 0.5906
 epoch: 33, train_loss: 0.6051, test_loss: 0.9791, test_f1: 0.6262
 epoch: 34, train_loss: 0.5875, test_loss: 0.9972, test_f1: 0.5909
 epoch: 35, train_loss: 0.5833, test_loss: 0.9698, test_f1: 0.6042
 epoch: 36, train_loss: 0.5752, test_loss: 1.0376, test_f1: 0.6038
 epoch: 37, train_loss: 0.5738, test_loss: 0.9658, test_f1: 0.6205
 epoch: 38, train_loss: 0.5759, test_loss: 0.9475, test_f1: 0.6327
 epoch: 39, train_loss: 0.5679, test_loss: 1.0340, test_f1: 0.6149
 epoch: 40, train_loss: 0.5534, test_loss: 1.0381, test_f1: 0.6089
 epoch: 41, train_loss: 0.5468, test_loss: 1.0395, test_f1: 0.6028
 epoch: 42, train_loss: 0.5275, test_loss: 1.0774, test_f1: 0.5846
 epoch: 43, train_loss: 0.5408, test_loss: 1.0202, test_f1: 0.6294
 epoch: 44, train_loss: 0.5129, test_loss: 1.1722, test_f1: 0.6153
 epoch: 45, train_loss: 0.5166, test_loss: 1.0782, test_f1: 0.6241
 epoch: 46, train_loss: 0.5081, test_loss: 1.1006, test_f1: 0.6312
 epoch: 47, train_loss: 0.4989, test_loss: 1.0779, test_f1: 0.6411
 epoch: 48, train_loss: 0.4911, test_loss: 1.0625, test_f1: 0.6326
 epoch: 49, train_loss: 0.5031, test_loss: 1.0905, test_f1: 0.6370
 epoch: 50, train_loss: 0.5000, test_loss: 1.0875, test_f1: 0.6370
 epoch: 51, train_loss: 0.4661, test_loss: 1.0379, test_f1: 0.6533
 epoch: 52, train_loss: 0.4592, test_loss: 1.0769, test_f1: 0.6410
 epoch: 53, train_loss: 0.4461, test_loss: 1.0752, test_f1: 0.6212
 epoch: 54, train_loss: 0.4455, test_loss: 1.0905, test_f1: 0.6436
 epoch: 55, train_loss: 0.4449, test_loss: 1.1302, test_f1: 0.6380
 epoch: 56, train_loss: 0.4330, test_loss: 1.0944, test_f1: 0.6395
 epoch: 57, train_loss: 0.4417, test_loss: 1.1713, test_f1: 0.6316
 epoch: 58, train_loss: 0.4318, test_loss: 1.0838, test_f1: 0.6420
 epoch: 59, train_loss: 0.4381, test_loss: 1.1117, test_f1: 0.6227
 epoch: 60, train_loss: 0.4173, test_loss: 1.1167, test_f1: 0.6441
 epoch: 61, train_loss: 0.4274, test_loss: 1.1218, test_f1: 0.6386
 epoch: 62, train_loss: 0.4093, test_loss: 1.1591, test_f1: 0.6367
 epoch: 63, train_loss: 0.4236, test_loss: 1.1458, test_f1: 0.6481
 epoch: 64, train_loss: 0.4086, test_loss: 1.1754, test_f1: 0.6358
 epoch: 65, train_loss: 0.4154, test_loss: 1.1859, test_f1: 0.6355
 epoch: 66, train_loss: 0.3995, test_loss: 1.1775, test_f1: 0.6486
 epoch: 67, train_loss: 0.3949, test_loss: 1.1957, test_f1: 0.6324
 epoch: 68, train_loss: 0.4106, test_loss: 1.2223, test_f1: 0.6275
 epoch: 69, train_loss: 0.4113, test_loss: 1.1880, test_f1: 0.6461
 epoch: 70, train_loss: 0.3949, test_loss: 1.1711, test_f1: 0.6423
 epoch: 71, train_loss: 0.3963, test_loss: 1.1878, test_f1: 0.6470
 epoch: 72, train_loss: 0.3936, test_loss: 1.2565, test_f1: 0.6346
 epoch: 73, train_loss: 0.3902, test_loss: 1.2633, test_f1: 0.6554
 epoch: 74, train_loss: 0.3831, test_loss: 1.2435, test_f1: 0.6320
 epoch: 75, train_loss: 0.3751, test_loss: 1.2217, test_f1: 0.6479
 epoch: 76, train_loss: 0.3736, test_loss: 1.2589, test_f1: 0.6407
 epoch: 77, train_loss: 0.3772, test_loss: 1.2710, test_f1: 0.6265
 epoch: 78, train_loss: 0.3762, test_loss: 1.3495, test_f1: 0.6279
 epoch: 79, train_loss: 0.3870, test_loss: 1.2887, test_f1: 0.6199
 epoch: 80, train_loss: 0.3598, test_loss: 1.3038, test_f1: 0.6401
 epoch: 81, train_loss: 0.3686, test_loss: 1.2760, test_f1: 0.6415
 epoch: 82, train_loss: 0.3748, test_loss: 1.3087, test_f1: 0.6209
 epoch: 83, train_loss: 0.3563, test_loss: 1.3065, test_f1: 0.6337
 epoch: 84, train_loss: 0.3602, test_loss: 1.3279, test_f1: 0.6409
 epoch: 85, train_loss: 0.3567, test_loss: 1.2408, test_f1: 0.6581
 epoch: 86, train_loss: 0.3619, test_loss: 1.3238, test_f1: 0.6397
 epoch: 87, train_loss: 0.3457, test_loss: 1.3418, test_f1: 0.6202
 epoch: 88, train_loss: 0.3679, test_loss: 1.4455, test_f1: 0.6368
 epoch: 89, train_loss: 0.3422, test_loss: 1.3588, test_f1: 0.6468
 epoch: 90, train_loss: 0.3582, test_loss: 1.2965, test_f1: 0.6370
 epoch: 91, train_loss: 0.3347, test_loss: 1.3996, test_f1: 0.6255
 epoch: 92, train_loss: 0.3438, test_loss: 1.3764, test_f1: 0.6267
 epoch: 93, train_loss: 0.3512, test_loss: 1.3603, test_f1: 0.6401
 epoch: 94, train_loss: 0.3444, test_loss: 1.4556, test_f1: 0.6187
 epoch: 95, train_loss: 0.3425, test_loss: 1.4941, test_f1: 0.6397
 epoch: 96, train_loss: 0.3247, test_loss: 1.4032, test_f1: 0.6211
 epoch: 97, train_loss: 0.3297, test_loss: 1.4264, test_f1: 0.6270
 epoch: 98, train_loss: 0.3311, test_loss: 1.4846, test_f1: 0.6463
 epoch: 99, train_loss: 0.3212, test_loss: 1.4660, test_f1: 0.6367
##################ITERATION #4 ****************************************
 epoch: 0, train_loss: 1.1878, test_loss: 1.1350, test_f1: 0.4307
 epoch: 1, train_loss: 1.0670, test_loss: 1.0120, test_f1: 0.4656
 epoch: 2, train_loss: 1.0343, test_loss: 0.9760, test_f1: 0.5108
 epoch: 3, train_loss: 0.9960, test_loss: 0.9678, test_f1: 0.5237
 epoch: 4, train_loss: 0.9696, test_loss: 0.9519, test_f1: 0.5360
 epoch: 5, train_loss: 0.9423, test_loss: 0.9452, test_f1: 0.5291
 epoch: 6, train_loss: 0.9250, test_loss: 0.9357, test_f1: 0.5248
 epoch: 7, train_loss: 0.8997, test_loss: 0.9322, test_f1: 0.5343
 epoch: 8, train_loss: 0.8821, test_loss: 0.9163, test_f1: 0.5258
 epoch: 9, train_loss: 0.8748, test_loss: 0.9544, test_f1: 0.5333
 epoch: 10, train_loss: 0.8547, test_loss: 0.9125, test_f1: 0.5369
 epoch: 11, train_loss: 0.8316, test_loss: 0.9270, test_f1: 0.5539
 epoch: 12, train_loss: 0.8144, test_loss: 0.9148, test_f1: 0.5676
 epoch: 13, train_loss: 0.8063, test_loss: 0.9160, test_f1: 0.5654
 epoch: 14, train_loss: 0.7941, test_loss: 0.9025, test_f1: 0.5652
 epoch: 15, train_loss: 0.7784, test_loss: 0.9337, test_f1: 0.5634
 epoch: 16, train_loss: 0.7691, test_loss: 0.9606, test_f1: 0.5581
 epoch: 17, train_loss: 0.7521, test_loss: 0.9331, test_f1: 0.5849
 epoch: 18, train_loss: 0.7360, test_loss: 0.9241, test_f1: 0.5762
 epoch: 19, train_loss: 0.7298, test_loss: 0.9296, test_f1: 0.5863
 epoch: 20, train_loss: 0.7317, test_loss: 0.9002, test_f1: 0.5831
 epoch: 21, train_loss: 0.7028, test_loss: 0.9268, test_f1: 0.5754
 epoch: 22, train_loss: 0.6959, test_loss: 0.9043, test_f1: 0.5989
 epoch: 23, train_loss: 0.6962, test_loss: 0.9491, test_f1: 0.5806
 epoch: 24, train_loss: 0.6815, test_loss: 0.9126, test_f1: 0.5682
 epoch: 25, train_loss: 0.6745, test_loss: 0.9696, test_f1: 0.5859
 epoch: 26, train_loss: 0.6609, test_loss: 0.9378, test_f1: 0.5968
 epoch: 27, train_loss: 0.6680, test_loss: 0.9438, test_f1: 0.5854
 epoch: 28, train_loss: 0.6528, test_loss: 0.8997, test_f1: 0.5966
 epoch: 29, train_loss: 0.6476, test_loss: 0.8823, test_f1: 0.6065
 epoch: 30, train_loss: 0.6263, test_loss: 0.8752, test_f1: 0.6233
 epoch: 31, train_loss: 0.6171, test_loss: 0.9052, test_f1: 0.5983
 epoch: 32, train_loss: 0.6015, test_loss: 0.9202, test_f1: 0.6297
 epoch: 33, train_loss: 0.6143, test_loss: 0.9639, test_f1: 0.6056
 epoch: 34, train_loss: 0.6033, test_loss: 0.9365, test_f1: 0.6182
 epoch: 35, train_loss: 0.5943, test_loss: 0.9373, test_f1: 0.5943
 epoch: 36, train_loss: 0.5843, test_loss: 0.9398, test_f1: 0.5942
 epoch: 37, train_loss: 0.5873, test_loss: 0.9303, test_f1: 0.6210
 epoch: 38, train_loss: 0.5659, test_loss: 0.9398, test_f1: 0.6139
 epoch: 39, train_loss: 0.5634, test_loss: 0.9257, test_f1: 0.6323
 epoch: 40, train_loss: 0.5546, test_loss: 0.9129, test_f1: 0.6009
 epoch: 41, train_loss: 0.5589, test_loss: 0.9239, test_f1: 0.6136
 epoch: 42, train_loss: 0.5461, test_loss: 0.9296, test_f1: 0.6028
 epoch: 43, train_loss: 0.5448, test_loss: 0.9621, test_f1: 0.6197
 epoch: 44, train_loss: 0.5276, test_loss: 0.9482, test_f1: 0.6101
 epoch: 45, train_loss: 0.5259, test_loss: 0.9859, test_f1: 0.6254
 epoch: 46, train_loss: 0.5290, test_loss: 0.9987, test_f1: 0.5978
 epoch: 47, train_loss: 0.5038, test_loss: 0.9316, test_f1: 0.6176
 epoch: 48, train_loss: 0.5177, test_loss: 0.9754, test_f1: 0.6147
 epoch: 49, train_loss: 0.5107, test_loss: 0.9874, test_f1: 0.6407
 epoch: 50, train_loss: 0.4989, test_loss: 0.9706, test_f1: 0.6150
 epoch: 51, train_loss: 0.4825, test_loss: 0.9696, test_f1: 0.6355
 epoch: 52, train_loss: 0.4605, test_loss: 0.9565, test_f1: 0.6255
 epoch: 53, train_loss: 0.4668, test_loss: 1.0100, test_f1: 0.6105
 epoch: 54, train_loss: 0.4621, test_loss: 0.9662, test_f1: 0.6408
 epoch: 55, train_loss: 0.4678, test_loss: 0.9531, test_f1: 0.6549
 epoch: 56, train_loss: 0.4593, test_loss: 0.9269, test_f1: 0.6415
 epoch: 57, train_loss: 0.4540, test_loss: 0.9566, test_f1: 0.6353
 epoch: 58, train_loss: 0.4473, test_loss: 0.9712, test_f1: 0.6134
 epoch: 59, train_loss: 0.4351, test_loss: 0.9482, test_f1: 0.6522
 epoch: 60, train_loss: 0.4406, test_loss: 0.9801, test_f1: 0.6358
 epoch: 61, train_loss: 0.4304, test_loss: 1.0376, test_f1: 0.6021
 epoch: 62, train_loss: 0.4278, test_loss: 0.9651, test_f1: 0.6466
 epoch: 63, train_loss: 0.4274, test_loss: 0.9738, test_f1: 0.6271
 epoch: 64, train_loss: 0.4232, test_loss: 0.9609, test_f1: 0.6480
 epoch: 65, train_loss: 0.4267, test_loss: 0.9947, test_f1: 0.6405
 epoch: 66, train_loss: 0.4266, test_loss: 0.9676, test_f1: 0.6441
 epoch: 67, train_loss: 0.4271, test_loss: 1.0354, test_f1: 0.6303
 epoch: 68, train_loss: 0.4184, test_loss: 1.0213, test_f1: 0.6245
 epoch: 69, train_loss: 0.4080, test_loss: 1.0107, test_f1: 0.6375
 epoch: 70, train_loss: 0.3994, test_loss: 1.0205, test_f1: 0.6240
 epoch: 71, train_loss: 0.4093, test_loss: 1.0359, test_f1: 0.6226
 epoch: 72, train_loss: 0.4106, test_loss: 1.0219, test_f1: 0.6359
 epoch: 73, train_loss: 0.3908, test_loss: 1.0223, test_f1: 0.6531
 epoch: 74, train_loss: 0.4105, test_loss: 1.0410, test_f1: 0.6422
 epoch: 75, train_loss: 0.4035, test_loss: 1.0284, test_f1: 0.6309
 epoch: 76, train_loss: 0.3958, test_loss: 0.9675, test_f1: 0.6470
 epoch: 77, train_loss: 0.3886, test_loss: 1.0095, test_f1: 0.6459
 epoch: 78, train_loss: 0.3886, test_loss: 1.0685, test_f1: 0.6406
 epoch: 79, train_loss: 0.3818, test_loss: 1.0098, test_f1: 0.6254
 epoch: 80, train_loss: 0.3891, test_loss: 1.0186, test_f1: 0.6440
 epoch: 81, train_loss: 0.3864, test_loss: 1.0886, test_f1: 0.6280
 epoch: 82, train_loss: 0.3945, test_loss: 1.0380, test_f1: 0.6430
 epoch: 83, train_loss: 0.3724, test_loss: 1.0688, test_f1: 0.6415
 epoch: 84, train_loss: 0.3594, test_loss: 1.0875, test_f1: 0.6361
 epoch: 85, train_loss: 0.3752, test_loss: 1.1297, test_f1: 0.6400
 epoch: 86, train_loss: 0.3630, test_loss: 1.0834, test_f1: 0.6581
 epoch: 87, train_loss: 0.3750, test_loss: 1.1035, test_f1: 0.6440
 epoch: 88, train_loss: 0.3516, test_loss: 1.1412, test_f1: 0.6379
 epoch: 89, train_loss: 0.3615, test_loss: 1.1259, test_f1: 0.6534
 epoch: 90, train_loss: 0.3563, test_loss: 1.1400, test_f1: 0.6295
 epoch: 91, train_loss: 0.3546, test_loss: 1.0989, test_f1: 0.6431
 epoch: 92, train_loss: 0.3489, test_loss: 1.1319, test_f1: 0.6285
 epoch: 93, train_loss: 0.3448, test_loss: 1.1185, test_f1: 0.6420
 epoch: 94, train_loss: 0.3326, test_loss: 1.1317, test_f1: 0.6373
 epoch: 95, train_loss: 0.3441, test_loss: 1.1309, test_f1: 0.6441
 epoch: 96, train_loss: 0.3497, test_loss: 1.1298, test_f1: 0.6570
 epoch: 97, train_loss: 0.3350, test_loss: 1.2079, test_f1: 0.6260
 epoch: 98, train_loss: 0.3292, test_loss: 1.0751, test_f1: 0.6611
 epoch: 99, train_loss: 0.3376, test_loss: 1.1770, test_f1: 0.6646
##################ITERATION #5 ****************************************
 epoch: 0, train_loss: 1.2089, test_loss: 1.1394, test_f1: 0.3772
 epoch: 1, train_loss: 1.0721, test_loss: 1.0109, test_f1: 0.4725
 epoch: 2, train_loss: 1.0217, test_loss: 0.9714, test_f1: 0.4977
 epoch: 3, train_loss: 0.9952, test_loss: 0.9563, test_f1: 0.4761
 epoch: 4, train_loss: 0.9654, test_loss: 0.9290, test_f1: 0.5397
 epoch: 5, train_loss: 0.9433, test_loss: 0.9222, test_f1: 0.5458
 epoch: 6, train_loss: 0.9273, test_loss: 0.9172, test_f1: 0.5417
 epoch: 7, train_loss: 0.9056, test_loss: 0.8965, test_f1: 0.5277
 epoch: 8, train_loss: 0.8973, test_loss: 0.8931, test_f1: 0.5494
 epoch: 9, train_loss: 0.8792, test_loss: 0.9113, test_f1: 0.5509
 epoch: 10, train_loss: 0.8564, test_loss: 0.9008, test_f1: 0.5790
 epoch: 11, train_loss: 0.8404, test_loss: 0.8897, test_f1: 0.5570
 epoch: 12, train_loss: 0.8369, test_loss: 0.8667, test_f1: 0.5805
 epoch: 13, train_loss: 0.8261, test_loss: 0.8410, test_f1: 0.5926
 epoch: 14, train_loss: 0.8177, test_loss: 0.8988, test_f1: 0.5939
 epoch: 15, train_loss: 0.8023, test_loss: 0.8523, test_f1: 0.5904
 epoch: 16, train_loss: 0.7850, test_loss: 0.8695, test_f1: 0.5747
 epoch: 17, train_loss: 0.7716, test_loss: 0.8541, test_f1: 0.5838
 epoch: 18, train_loss: 0.7586, test_loss: 0.8463, test_f1: 0.5857
 epoch: 19, train_loss: 0.7528, test_loss: 0.8915, test_f1: 0.6068
 epoch: 20, train_loss: 0.7493, test_loss: 0.8350, test_f1: 0.6093
 epoch: 21, train_loss: 0.7363, test_loss: 0.8845, test_f1: 0.5899
 epoch: 22, train_loss: 0.7196, test_loss: 0.8726, test_f1: 0.6308
 epoch: 23, train_loss: 0.7130, test_loss: 0.8994, test_f1: 0.5804
 epoch: 24, train_loss: 0.7151, test_loss: 0.8694, test_f1: 0.5976
 epoch: 25, train_loss: 0.6977, test_loss: 0.8595, test_f1: 0.5886
 epoch: 26, train_loss: 0.6999, test_loss: 0.8638, test_f1: 0.5883
 epoch: 27, train_loss: 0.6955, test_loss: 0.9090, test_f1: 0.5818
 epoch: 28, train_loss: 0.6753, test_loss: 0.9546, test_f1: 0.5588
 epoch: 29, train_loss: 0.6700, test_loss: 0.9247, test_f1: 0.5736
 epoch: 30, train_loss: 0.6630, test_loss: 0.8765, test_f1: 0.5969
 epoch: 31, train_loss: 0.6507, test_loss: 0.9064, test_f1: 0.6076
 epoch: 32, train_loss: 0.6526, test_loss: 0.8820, test_f1: 0.6128
 epoch: 33, train_loss: 0.6326, test_loss: 0.8791, test_f1: 0.6068
 epoch: 34, train_loss: 0.6462, test_loss: 0.9435, test_f1: 0.5726
 epoch: 35, train_loss: 0.6387, test_loss: 0.9014, test_f1: 0.6008
 epoch: 36, train_loss: 0.6268, test_loss: 0.8387, test_f1: 0.6055
 epoch: 37, train_loss: 0.6051, test_loss: 0.8958, test_f1: 0.6156
 epoch: 38, train_loss: 0.5952, test_loss: 0.8357, test_f1: 0.6295
 epoch: 39, train_loss: 0.6013, test_loss: 0.8777, test_f1: 0.6049
 epoch: 40, train_loss: 0.6012, test_loss: 0.9060, test_f1: 0.5880
 epoch: 41, train_loss: 0.5909, test_loss: 0.8982, test_f1: 0.6252
 epoch: 42, train_loss: 0.5790, test_loss: 0.8933, test_f1: 0.6157
 epoch: 43, train_loss: 0.5902, test_loss: 0.9117, test_f1: 0.6181
 epoch: 44, train_loss: 0.5711, test_loss: 0.9274, test_f1: 0.6257
 epoch: 45, train_loss: 0.5692, test_loss: 0.8772, test_f1: 0.6369
 epoch: 46, train_loss: 0.5699, test_loss: 0.8846, test_f1: 0.6333
 epoch: 47, train_loss: 0.5525, test_loss: 0.8867, test_f1: 0.6432
 epoch: 48, train_loss: 0.5380, test_loss: 0.8893, test_f1: 0.6117
 epoch: 49, train_loss: 0.5381, test_loss: 0.8894, test_f1: 0.6187
 epoch: 50, train_loss: 0.5378, test_loss: 0.8607, test_f1: 0.6395
 epoch: 51, train_loss: 0.4999, test_loss: 0.9160, test_f1: 0.6544
 epoch: 52, train_loss: 0.4975, test_loss: 0.9125, test_f1: 0.6452
 epoch: 53, train_loss: 0.4943, test_loss: 0.9415, test_f1: 0.6203
 epoch: 54, train_loss: 0.4801, test_loss: 0.8874, test_f1: 0.6403
 epoch: 55, train_loss: 0.4784, test_loss: 0.9286, test_f1: 0.6540
 epoch: 56, train_loss: 0.4826, test_loss: 0.9582, test_f1: 0.6418
 epoch: 57, train_loss: 0.4716, test_loss: 0.9250, test_f1: 0.6323
 epoch: 58, train_loss: 0.4651, test_loss: 0.9473, test_f1: 0.6439
 epoch: 59, train_loss: 0.4821, test_loss: 0.9695, test_f1: 0.6310
 epoch: 60, train_loss: 0.4663, test_loss: 0.9439, test_f1: 0.6342
 epoch: 61, train_loss: 0.4623, test_loss: 0.9565, test_f1: 0.6458
 epoch: 62, train_loss: 0.4581, test_loss: 0.9534, test_f1: 0.6352
 epoch: 63, train_loss: 0.4609, test_loss: 1.0100, test_f1: 0.6059
 epoch: 64, train_loss: 0.4550, test_loss: 0.9668, test_f1: 0.6094
 epoch: 65, train_loss: 0.4640, test_loss: 1.0434, test_f1: 0.6173
 epoch: 66, train_loss: 0.4497, test_loss: 0.9471, test_f1: 0.6208
 epoch: 67, train_loss: 0.4306, test_loss: 0.9922, test_f1: 0.6458
 epoch: 68, train_loss: 0.4377, test_loss: 0.9751, test_f1: 0.6374
 epoch: 69, train_loss: 0.4417, test_loss: 0.9445, test_f1: 0.6288
 epoch: 70, train_loss: 0.4350, test_loss: 1.0073, test_f1: 0.6130
 epoch: 71, train_loss: 0.4193, test_loss: 0.9901, test_f1: 0.6454
 epoch: 72, train_loss: 0.4295, test_loss: 1.0116, test_f1: 0.6310
 epoch: 73, train_loss: 0.4338, test_loss: 0.9828, test_f1: 0.6465
 epoch: 74, train_loss: 0.4166, test_loss: 0.9850, test_f1: 0.6195
 epoch: 75, train_loss: 0.4074, test_loss: 0.9561, test_f1: 0.6386
 epoch: 76, train_loss: 0.4062, test_loss: 0.9776, test_f1: 0.6413
 epoch: 77, train_loss: 0.4273, test_loss: 0.9588, test_f1: 0.6561
 epoch: 78, train_loss: 0.4151, test_loss: 1.0105, test_f1: 0.6425
 epoch: 79, train_loss: 0.4158, test_loss: 1.0348, test_f1: 0.6544
 epoch: 80, train_loss: 0.4227, test_loss: 0.9863, test_f1: 0.6488
 epoch: 81, train_loss: 0.4016, test_loss: 0.9784, test_f1: 0.6446
 epoch: 82, train_loss: 0.4044, test_loss: 0.9736, test_f1: 0.6551
 epoch: 83, train_loss: 0.4045, test_loss: 1.0512, test_f1: 0.6465
 epoch: 84, train_loss: 0.4003, test_loss: 1.0534, test_f1: 0.6321
 epoch: 85, train_loss: 0.4036, test_loss: 0.9732, test_f1: 0.6429
 epoch: 86, train_loss: 0.3889, test_loss: 0.9605, test_f1: 0.6513
 epoch: 87, train_loss: 0.3771, test_loss: 1.0410, test_f1: 0.6419
 epoch: 88, train_loss: 0.3707, test_loss: 1.0651, test_f1: 0.6376
 epoch: 89, train_loss: 0.3802, test_loss: 1.0258, test_f1: 0.6349
 epoch: 90, train_loss: 0.3871, test_loss: 1.0680, test_f1: 0.6377
 epoch: 91, train_loss: 0.3831, test_loss: 1.0378, test_f1: 0.6379
 epoch: 92, train_loss: 0.3791, test_loss: 1.0732, test_f1: 0.6482
 epoch: 93, train_loss: 0.3781, test_loss: 1.0412, test_f1: 0.6405
 epoch: 94, train_loss: 0.3622, test_loss: 0.9964, test_f1: 0.6766
 epoch: 95, train_loss: 0.3609, test_loss: 1.0478, test_f1: 0.6422
 epoch: 96, train_loss: 0.3563, test_loss: 1.0605, test_f1: 0.6345
 epoch: 97, train_loss: 0.3651, test_loss: 1.0635, test_f1: 0.6416
 epoch: 98, train_loss: 0.3598, test_loss: 1.0593, test_f1: 0.6661
 epoch: 99, train_loss: 0.3556, test_loss: 1.1293, test_f1: 0.6258
##################ITERATION #6 ****************************************
 epoch: 0, train_loss: 1.2054, test_loss: 1.0981, test_f1: 0.4301
 epoch: 1, train_loss: 1.0713, test_loss: 0.9849, test_f1: 0.4956
 epoch: 2, train_loss: 1.0290, test_loss: 0.9700, test_f1: 0.4859
 epoch: 3, train_loss: 0.9972, test_loss: 0.9515, test_f1: 0.5341
 epoch: 4, train_loss: 0.9682, test_loss: 0.9441, test_f1: 0.5224
 epoch: 5, train_loss: 0.9584, test_loss: 0.9376, test_f1: 0.5460
 epoch: 6, train_loss: 0.9368, test_loss: 0.9533, test_f1: 0.5023
 epoch: 7, train_loss: 0.9179, test_loss: 0.9105, test_f1: 0.5453
 epoch: 8, train_loss: 0.9078, test_loss: 0.9215, test_f1: 0.5340
 epoch: 9, train_loss: 0.8927, test_loss: 0.9050, test_f1: 0.5332
 epoch: 10, train_loss: 0.8907, test_loss: 0.9072, test_f1: 0.5341
 epoch: 11, train_loss: 0.8790, test_loss: 0.9046, test_f1: 0.5816
 epoch: 12, train_loss: 0.8557, test_loss: 0.9335, test_f1: 0.5474
 epoch: 13, train_loss: 0.8485, test_loss: 0.8805, test_f1: 0.5692
 epoch: 14, train_loss: 0.8253, test_loss: 0.8931, test_f1: 0.5695
 epoch: 15, train_loss: 0.8239, test_loss: 0.9143, test_f1: 0.5849
 epoch: 16, train_loss: 0.8125, test_loss: 0.8888, test_f1: 0.5857
 epoch: 17, train_loss: 0.8024, test_loss: 0.8987, test_f1: 0.5844
 epoch: 18, train_loss: 0.7813, test_loss: 0.9411, test_f1: 0.5597
 epoch: 19, train_loss: 0.7729, test_loss: 0.9438, test_f1: 0.5613
 epoch: 20, train_loss: 0.7650, test_loss: 0.8742, test_f1: 0.5830
 epoch: 21, train_loss: 0.7613, test_loss: 0.9045, test_f1: 0.5845
 epoch: 22, train_loss: 0.7552, test_loss: 0.8956, test_f1: 0.5668
 epoch: 23, train_loss: 0.7387, test_loss: 0.8803, test_f1: 0.6071
 epoch: 24, train_loss: 0.7283, test_loss: 0.8753, test_f1: 0.5967
 epoch: 25, train_loss: 0.7210, test_loss: 0.9282, test_f1: 0.6045
 epoch: 26, train_loss: 0.7231, test_loss: 0.8705, test_f1: 0.6065
 epoch: 27, train_loss: 0.6985, test_loss: 0.9803, test_f1: 0.5830
 epoch: 28, train_loss: 0.6990, test_loss: 1.0170, test_f1: 0.5787
 epoch: 29, train_loss: 0.6908, test_loss: 0.9542, test_f1: 0.5897
 epoch: 30, train_loss: 0.6748, test_loss: 0.9387, test_f1: 0.5959
 epoch: 31, train_loss: 0.6631, test_loss: 0.9627, test_f1: 0.5953
 epoch: 32, train_loss: 0.6415, test_loss: 0.9181, test_f1: 0.6182
 epoch: 33, train_loss: 0.6647, test_loss: 0.9166, test_f1: 0.6111
 epoch: 34, train_loss: 0.6476, test_loss: 0.9795, test_f1: 0.6003
 epoch: 35, train_loss: 0.6545, test_loss: 1.0738, test_f1: 0.6135
 epoch: 36, train_loss: 0.6446, test_loss: 0.9788, test_f1: 0.5994
 epoch: 37, train_loss: 0.6179, test_loss: 0.9045, test_f1: 0.6218
 epoch: 38, train_loss: 0.6138, test_loss: 0.9233, test_f1: 0.6204
 epoch: 39, train_loss: 0.6149, test_loss: 0.9208, test_f1: 0.6286
 epoch: 40, train_loss: 0.6058, test_loss: 0.8877, test_f1: 0.6271
 epoch: 41, train_loss: 0.6151, test_loss: 0.9352, test_f1: 0.6016
 epoch: 42, train_loss: 0.6026, test_loss: 1.0228, test_f1: 0.6076
 epoch: 43, train_loss: 0.5974, test_loss: 0.8847, test_f1: 0.6154
 epoch: 44, train_loss: 0.5848, test_loss: 0.9063, test_f1: 0.6165
 epoch: 45, train_loss: 0.5750, test_loss: 0.8998, test_f1: 0.6330
 epoch: 46, train_loss: 0.5665, test_loss: 0.8891, test_f1: 0.6267
 epoch: 47, train_loss: 0.5571, test_loss: 0.9339, test_f1: 0.6425
 epoch: 48, train_loss: 0.5563, test_loss: 0.9208, test_f1: 0.6227
 epoch: 49, train_loss: 0.5666, test_loss: 0.9987, test_f1: 0.6344
 epoch: 50, train_loss: 0.5538, test_loss: 0.9444, test_f1: 0.6270
 epoch: 51, train_loss: 0.5257, test_loss: 0.8908, test_f1: 0.6333
 epoch: 52, train_loss: 0.5115, test_loss: 0.8858, test_f1: 0.6484
 epoch: 53, train_loss: 0.4899, test_loss: 0.9901, test_f1: 0.6568
 epoch: 54, train_loss: 0.5037, test_loss: 1.0361, test_f1: 0.6326
 epoch: 55, train_loss: 0.4919, test_loss: 0.9308, test_f1: 0.6431
 epoch: 56, train_loss: 0.4886, test_loss: 0.9533, test_f1: 0.6261
 epoch: 57, train_loss: 0.4870, test_loss: 1.0524, test_f1: 0.6319
 epoch: 58, train_loss: 0.4815, test_loss: 0.9424, test_f1: 0.6420
 epoch: 59, train_loss: 0.4818, test_loss: 0.9378, test_f1: 0.6629
 epoch: 60, train_loss: 0.4863, test_loss: 0.9581, test_f1: 0.6398
 epoch: 61, train_loss: 0.4702, test_loss: 0.8973, test_f1: 0.6370
 epoch: 62, train_loss: 0.4646, test_loss: 1.0652, test_f1: 0.6553
 epoch: 63, train_loss: 0.4756, test_loss: 0.9807, test_f1: 0.6253
 epoch: 64, train_loss: 0.4665, test_loss: 0.9587, test_f1: 0.6626
 epoch: 65, train_loss: 0.4543, test_loss: 0.9654, test_f1: 0.6493
 epoch: 66, train_loss: 0.4612, test_loss: 1.0460, test_f1: 0.6422
 epoch: 67, train_loss: 0.4592, test_loss: 1.0251, test_f1: 0.6298
 epoch: 68, train_loss: 0.4546, test_loss: 1.0665, test_f1: 0.6350
 epoch: 69, train_loss: 0.4440, test_loss: 1.0340, test_f1: 0.6380
 epoch: 70, train_loss: 0.4546, test_loss: 1.0240, test_f1: 0.6446
 epoch: 71, train_loss: 0.4465, test_loss: 1.0601, test_f1: 0.6472
 epoch: 72, train_loss: 0.4511, test_loss: 1.0578, test_f1: 0.6527
 epoch: 73, train_loss: 0.4391, test_loss: 1.0526, test_f1: 0.6532
 epoch: 74, train_loss: 0.4232, test_loss: 1.1391, test_f1: 0.6444
 epoch: 75, train_loss: 0.4164, test_loss: 1.2392, test_f1: 0.6551
 epoch: 76, train_loss: 0.4223, test_loss: 1.0357, test_f1: 0.6487
 epoch: 77, train_loss: 0.4147, test_loss: 1.1032, test_f1: 0.6400
 epoch: 78, train_loss: 0.4211, test_loss: 0.9964, test_f1: 0.6551
 epoch: 79, train_loss: 0.4109, test_loss: 1.1203, test_f1: 0.6362
 epoch: 80, train_loss: 0.4201, test_loss: 1.2136, test_f1: 0.6359
 epoch: 81, train_loss: 0.4257, test_loss: 1.1127, test_f1: 0.6219
 epoch: 82, train_loss: 0.4121, test_loss: 1.0786, test_f1: 0.6405
 epoch: 83, train_loss: 0.3990, test_loss: 1.1672, test_f1: 0.6470
 epoch: 84, train_loss: 0.3931, test_loss: 1.1679, test_f1: 0.6303
 epoch: 85, train_loss: 0.3996, test_loss: 1.0321, test_f1: 0.6489
 epoch: 86, train_loss: 0.3926, test_loss: 1.1052, test_f1: 0.6466
 epoch: 87, train_loss: 0.3888, test_loss: 1.2562, test_f1: 0.6426
 epoch: 88, train_loss: 0.4030, test_loss: 1.2887, test_f1: 0.6581
 epoch: 89, train_loss: 0.4038, test_loss: 1.0982, test_f1: 0.6599
 epoch: 90, train_loss: 0.3877, test_loss: 1.1392, test_f1: 0.6517
 epoch: 91, train_loss: 0.3892, test_loss: 1.0520, test_f1: 0.6559
 epoch: 92, train_loss: 0.3791, test_loss: 1.0389, test_f1: 0.6471
 epoch: 93, train_loss: 0.3704, test_loss: 1.1797, test_f1: 0.6373
 epoch: 94, train_loss: 0.3772, test_loss: 1.1523, test_f1: 0.6462
 epoch: 95, train_loss: 0.4015, test_loss: 1.1488, test_f1: 0.6541
 epoch: 96, train_loss: 0.3744, test_loss: 1.2907, test_f1: 0.6402
 epoch: 97, train_loss: 0.3840, test_loss: 1.2864, test_f1: 0.6578
 epoch: 98, train_loss: 0.3731, test_loss: 1.2145, test_f1: 0.6405
 epoch: 99, train_loss: 0.3728, test_loss: 1.1385, test_f1: 0.6389
##################ITERATION #7 ****************************************
 epoch: 0, train_loss: 1.2116, test_loss: 1.1170, test_f1: 0.3931
 epoch: 1, train_loss: 1.0759, test_loss: 0.9837, test_f1: 0.4731
 epoch: 2, train_loss: 1.0332, test_loss: 0.9747, test_f1: 0.4871
 epoch: 3, train_loss: 0.9939, test_loss: 0.9463, test_f1: 0.4612
 epoch: 4, train_loss: 0.9843, test_loss: 0.9465, test_f1: 0.5040
 epoch: 5, train_loss: 0.9478, test_loss: 0.9344, test_f1: 0.4882
 epoch: 6, train_loss: 0.9383, test_loss: 0.9358, test_f1: 0.5334
 epoch: 7, train_loss: 0.9149, test_loss: 0.9241, test_f1: 0.5164
 epoch: 8, train_loss: 0.8915, test_loss: 0.9233, test_f1: 0.5544
 epoch: 9, train_loss: 0.8820, test_loss: 0.8937, test_f1: 0.5767
 epoch: 10, train_loss: 0.8737, test_loss: 0.9338, test_f1: 0.5310
 epoch: 11, train_loss: 0.8540, test_loss: 0.9146, test_f1: 0.5481
 epoch: 12, train_loss: 0.8502, test_loss: 0.9103, test_f1: 0.5669
 epoch: 13, train_loss: 0.8196, test_loss: 0.8937, test_f1: 0.5665
 epoch: 14, train_loss: 0.8151, test_loss: 0.9075, test_f1: 0.5709
 epoch: 15, train_loss: 0.8068, test_loss: 0.9314, test_f1: 0.5409
 epoch: 16, train_loss: 0.7850, test_loss: 0.9316, test_f1: 0.5763
 epoch: 17, train_loss: 0.7948, test_loss: 0.8982, test_f1: 0.5736
 epoch: 18, train_loss: 0.7778, test_loss: 0.9024, test_f1: 0.5433
 epoch: 19, train_loss: 0.7503, test_loss: 0.8865, test_f1: 0.5864
 epoch: 20, train_loss: 0.7566, test_loss: 0.8983, test_f1: 0.5949
 epoch: 21, train_loss: 0.7408, test_loss: 0.9236, test_f1: 0.5816
 epoch: 22, train_loss: 0.7316, test_loss: 0.8894, test_f1: 0.5952
 epoch: 23, train_loss: 0.7199, test_loss: 0.8840, test_f1: 0.5864
 epoch: 24, train_loss: 0.7112, test_loss: 0.9015, test_f1: 0.6132
 epoch: 25, train_loss: 0.7044, test_loss: 0.8744, test_f1: 0.5990
 epoch: 26, train_loss: 0.6969, test_loss: 0.8684, test_f1: 0.5858
 epoch: 27, train_loss: 0.6891, test_loss: 0.8867, test_f1: 0.6113
 epoch: 28, train_loss: 0.6868, test_loss: 0.8390, test_f1: 0.6181
 epoch: 29, train_loss: 0.6626, test_loss: 0.8828, test_f1: 0.5915
 epoch: 30, train_loss: 0.6469, test_loss: 0.8897, test_f1: 0.5913
 epoch: 31, train_loss: 0.6627, test_loss: 0.9325, test_f1: 0.5976
 epoch: 32, train_loss: 0.6461, test_loss: 0.8930, test_f1: 0.5890
 epoch: 33, train_loss: 0.6387, test_loss: 0.9049, test_f1: 0.5918
 epoch: 34, train_loss: 0.6387, test_loss: 0.8931, test_f1: 0.6101
 epoch: 35, train_loss: 0.6369, test_loss: 0.8691, test_f1: 0.5959
 epoch: 36, train_loss: 0.6185, test_loss: 0.8181, test_f1: 0.6086
 epoch: 37, train_loss: 0.6121, test_loss: 0.8502, test_f1: 0.6101
 epoch: 38, train_loss: 0.6029, test_loss: 0.9093, test_f1: 0.5820
 epoch: 39, train_loss: 0.6063, test_loss: 0.8935, test_f1: 0.6031
 epoch: 40, train_loss: 0.5932, test_loss: 0.8308, test_f1: 0.6083
 epoch: 41, train_loss: 0.5814, test_loss: 0.8664, test_f1: 0.6255
 epoch: 42, train_loss: 0.5757, test_loss: 0.9040, test_f1: 0.6124
 epoch: 43, train_loss: 0.5849, test_loss: 0.8923, test_f1: 0.6078
 epoch: 44, train_loss: 0.5715, test_loss: 0.8396, test_f1: 0.6259
 epoch: 45, train_loss: 0.5569, test_loss: 0.8763, test_f1: 0.6167
 epoch: 46, train_loss: 0.5635, test_loss: 0.8680, test_f1: 0.6087
 epoch: 47, train_loss: 0.5538, test_loss: 0.9173, test_f1: 0.5890
 epoch: 48, train_loss: 0.5427, test_loss: 0.8807, test_f1: 0.6222
 epoch: 49, train_loss: 0.5322, test_loss: 0.8525, test_f1: 0.6145
 epoch: 50, train_loss: 0.5386, test_loss: 0.8936, test_f1: 0.6278
 epoch: 51, train_loss: 0.5088, test_loss: 0.9000, test_f1: 0.6106
 epoch: 52, train_loss: 0.5058, test_loss: 0.9118, test_f1: 0.6226
 epoch: 53, train_loss: 0.5043, test_loss: 0.9153, test_f1: 0.6062
 epoch: 54, train_loss: 0.4818, test_loss: 0.9029, test_f1: 0.6184
 epoch: 55, train_loss: 0.4887, test_loss: 0.8955, test_f1: 0.6160
 epoch: 56, train_loss: 0.4745, test_loss: 0.9067, test_f1: 0.6281
 epoch: 57, train_loss: 0.4797, test_loss: 0.9458, test_f1: 0.6226
 epoch: 58, train_loss: 0.4763, test_loss: 0.9135, test_f1: 0.6151
 epoch: 59, train_loss: 0.4865, test_loss: 0.8713, test_f1: 0.6362
 epoch: 60, train_loss: 0.4640, test_loss: 0.9209, test_f1: 0.6246
 epoch: 61, train_loss: 0.4685, test_loss: 0.9585, test_f1: 0.6224
 epoch: 62, train_loss: 0.4752, test_loss: 0.9487, test_f1: 0.6045
 epoch: 63, train_loss: 0.4607, test_loss: 0.9262, test_f1: 0.6417
 epoch: 64, train_loss: 0.4676, test_loss: 0.9966, test_f1: 0.6345
 epoch: 65, train_loss: 0.4574, test_loss: 0.9829, test_f1: 0.6154
 epoch: 66, train_loss: 0.4487, test_loss: 0.9128, test_f1: 0.6192
 epoch: 67, train_loss: 0.4478, test_loss: 0.9861, test_f1: 0.6149
 epoch: 68, train_loss: 0.4334, test_loss: 0.9791, test_f1: 0.6181
 epoch: 69, train_loss: 0.4367, test_loss: 0.9606, test_f1: 0.6166
 epoch: 70, train_loss: 0.4272, test_loss: 1.0093, test_f1: 0.6183
 epoch: 71, train_loss: 0.4494, test_loss: 1.0579, test_f1: 0.6134
 epoch: 72, train_loss: 0.4503, test_loss: 0.9953, test_f1: 0.6275
 epoch: 73, train_loss: 0.4245, test_loss: 1.0303, test_f1: 0.6282
 epoch: 74, train_loss: 0.4237, test_loss: 0.9592, test_f1: 0.6418
 epoch: 75, train_loss: 0.4446, test_loss: 1.0083, test_f1: 0.6481
 epoch: 76, train_loss: 0.4136, test_loss: 1.0636, test_f1: 0.6205
 epoch: 77, train_loss: 0.4298, test_loss: 0.9985, test_f1: 0.6357
 epoch: 78, train_loss: 0.4265, test_loss: 0.9484, test_f1: 0.6278
 epoch: 79, train_loss: 0.4066, test_loss: 1.0503, test_f1: 0.6296
 epoch: 80, train_loss: 0.4154, test_loss: 0.9811, test_f1: 0.6342
 epoch: 81, train_loss: 0.4108, test_loss: 1.0169, test_f1: 0.6213
 epoch: 82, train_loss: 0.4146, test_loss: 1.0541, test_f1: 0.6427
 epoch: 83, train_loss: 0.4013, test_loss: 0.9946, test_f1: 0.6431
 epoch: 84, train_loss: 0.4054, test_loss: 1.0392, test_f1: 0.6294
 epoch: 85, train_loss: 0.4158, test_loss: 1.0055, test_f1: 0.6270
 epoch: 86, train_loss: 0.4012, test_loss: 1.0236, test_f1: 0.6331
 epoch: 87, train_loss: 0.4009, test_loss: 0.9942, test_f1: 0.6519
 epoch: 88, train_loss: 0.3806, test_loss: 1.0776, test_f1: 0.6185
 epoch: 89, train_loss: 0.3935, test_loss: 1.1195, test_f1: 0.6451
 epoch: 90, train_loss: 0.3924, test_loss: 1.0840, test_f1: 0.6405
 epoch: 91, train_loss: 0.3929, test_loss: 1.1114, test_f1: 0.6344
 epoch: 92, train_loss: 0.3830, test_loss: 1.1074, test_f1: 0.6332
 epoch: 93, train_loss: 0.3793, test_loss: 1.0769, test_f1: 0.6206
 epoch: 94, train_loss: 0.3792, test_loss: 1.0439, test_f1: 0.6397
 epoch: 95, train_loss: 0.3826, test_loss: 1.1089, test_f1: 0.6209
 epoch: 96, train_loss: 0.3726, test_loss: 1.0596, test_f1: 0.6281
 epoch: 97, train_loss: 0.3752, test_loss: 1.0566, test_f1: 0.6217
 epoch: 98, train_loss: 0.3734, test_loss: 1.0670, test_f1: 0.6441
 epoch: 99, train_loss: 0.3687, test_loss: 1.0531, test_f1: 0.6290
##################ITERATION #8 ****************************************
 epoch: 0, train_loss: 1.2178, test_loss: 1.1088, test_f1: 0.4073
 epoch: 1, train_loss: 1.0729, test_loss: 0.9728, test_f1: 0.5166
 epoch: 2, train_loss: 1.0237, test_loss: 0.9709, test_f1: 0.4872
 epoch: 3, train_loss: 0.9997, test_loss: 0.9400, test_f1: 0.5052
 epoch: 4, train_loss: 0.9805, test_loss: 0.9349, test_f1: 0.5370
 epoch: 5, train_loss: 0.9542, test_loss: 0.9177, test_f1: 0.5410
 epoch: 6, train_loss: 0.9278, test_loss: 0.9191, test_f1: 0.5356
 epoch: 7, train_loss: 0.9136, test_loss: 0.9174, test_f1: 0.5400
 epoch: 8, train_loss: 0.8977, test_loss: 0.8925, test_f1: 0.5549
 epoch: 9, train_loss: 0.8896, test_loss: 0.8602, test_f1: 0.5839
 epoch: 10, train_loss: 0.8699, test_loss: 0.8898, test_f1: 0.5541
 epoch: 11, train_loss: 0.8497, test_loss: 0.8761, test_f1: 0.5711
 epoch: 12, train_loss: 0.8489, test_loss: 0.8637, test_f1: 0.5668
 epoch: 13, train_loss: 0.8402, test_loss: 0.8379, test_f1: 0.5884
 epoch: 14, train_loss: 0.8186, test_loss: 0.8225, test_f1: 0.5705
 epoch: 15, train_loss: 0.8088, test_loss: 0.8301, test_f1: 0.5688
 epoch: 16, train_loss: 0.7927, test_loss: 0.8275, test_f1: 0.6053
 epoch: 17, train_loss: 0.7950, test_loss: 0.8508, test_f1: 0.5880
 epoch: 18, train_loss: 0.7844, test_loss: 0.8133, test_f1: 0.5974
 epoch: 19, train_loss: 0.7702, test_loss: 0.8001, test_f1: 0.5781
 epoch: 20, train_loss: 0.7683, test_loss: 0.8193, test_f1: 0.5952
 epoch: 21, train_loss: 0.7524, test_loss: 0.8545, test_f1: 0.5944
 epoch: 22, train_loss: 0.7391, test_loss: 0.8441, test_f1: 0.5851
 epoch: 23, train_loss: 0.7319, test_loss: 0.8418, test_f1: 0.5831
 epoch: 24, train_loss: 0.7153, test_loss: 0.8517, test_f1: 0.5883
 epoch: 25, train_loss: 0.7263, test_loss: 0.7949, test_f1: 0.5813
 epoch: 26, train_loss: 0.7267, test_loss: 0.8011, test_f1: 0.6118
 epoch: 27, train_loss: 0.7016, test_loss: 0.8336, test_f1: 0.6251
 epoch: 28, train_loss: 0.6900, test_loss: 0.8462, test_f1: 0.6037
 epoch: 29, train_loss: 0.6822, test_loss: 0.8518, test_f1: 0.6131
 epoch: 30, train_loss: 0.6988, test_loss: 0.8143, test_f1: 0.6302
 epoch: 31, train_loss: 0.6684, test_loss: 0.8203, test_f1: 0.5920
 epoch: 32, train_loss: 0.6897, test_loss: 0.8024, test_f1: 0.6125
 epoch: 33, train_loss: 0.6603, test_loss: 0.8196, test_f1: 0.6030
 epoch: 34, train_loss: 0.6524, test_loss: 0.8304, test_f1: 0.6183
 epoch: 35, train_loss: 0.6479, test_loss: 0.8336, test_f1: 0.6072
 epoch: 36, train_loss: 0.6539, test_loss: 0.8662, test_f1: 0.6333
 epoch: 37, train_loss: 0.6340, test_loss: 0.8710, test_f1: 0.6021
 epoch: 38, train_loss: 0.6392, test_loss: 0.8574, test_f1: 0.6136
 epoch: 39, train_loss: 0.6299, test_loss: 0.8635, test_f1: 0.6252
 epoch: 40, train_loss: 0.6110, test_loss: 0.8703, test_f1: 0.5952
 epoch: 41, train_loss: 0.6161, test_loss: 0.8248, test_f1: 0.5904
 epoch: 42, train_loss: 0.6159, test_loss: 0.7844, test_f1: 0.6116
 epoch: 43, train_loss: 0.6050, test_loss: 0.8516, test_f1: 0.6184
 epoch: 44, train_loss: 0.5843, test_loss: 0.8566, test_f1: 0.6000
 epoch: 45, train_loss: 0.5943, test_loss: 0.8389, test_f1: 0.5959
 epoch: 46, train_loss: 0.5869, test_loss: 0.8255, test_f1: 0.6181
 epoch: 47, train_loss: 0.5705, test_loss: 0.9099, test_f1: 0.6080
 epoch: 48, train_loss: 0.5773, test_loss: 0.8347, test_f1: 0.6181
 epoch: 49, train_loss: 0.5618, test_loss: 0.8791, test_f1: 0.6066
 epoch: 50, train_loss: 0.5701, test_loss: 0.8613, test_f1: 0.6183
 epoch: 51, train_loss: 0.5584, test_loss: 0.8664, test_f1: 0.6224
 epoch: 52, train_loss: 0.5283, test_loss: 0.8757, test_f1: 0.6001
 epoch: 53, train_loss: 0.5242, test_loss: 0.8473, test_f1: 0.6236
 epoch: 54, train_loss: 0.5234, test_loss: 0.8614, test_f1: 0.6309
 epoch: 55, train_loss: 0.5280, test_loss: 0.8637, test_f1: 0.6181
 epoch: 56, train_loss: 0.5171, test_loss: 0.8883, test_f1: 0.6186
 epoch: 57, train_loss: 0.5144, test_loss: 0.8956, test_f1: 0.6088
 epoch: 58, train_loss: 0.5013, test_loss: 0.9052, test_f1: 0.6050
 epoch: 59, train_loss: 0.4868, test_loss: 0.8497, test_f1: 0.6167
 epoch: 60, train_loss: 0.5019, test_loss: 0.8574, test_f1: 0.6332
 epoch: 61, train_loss: 0.4948, test_loss: 0.9474, test_f1: 0.6048
 epoch: 62, train_loss: 0.5013, test_loss: 0.9026, test_f1: 0.6210
 epoch: 63, train_loss: 0.4975, test_loss: 0.9281, test_f1: 0.6188
 epoch: 64, train_loss: 0.4782, test_loss: 0.8735, test_f1: 0.6415
 epoch: 65, train_loss: 0.4890, test_loss: 0.9070, test_f1: 0.6158
 epoch: 66, train_loss: 0.4771, test_loss: 0.8791, test_f1: 0.6147
 epoch: 67, train_loss: 0.4696, test_loss: 0.8953, test_f1: 0.6254
 epoch: 68, train_loss: 0.4615, test_loss: 0.8977, test_f1: 0.6170
 epoch: 69, train_loss: 0.4656, test_loss: 0.9229, test_f1: 0.6131
 epoch: 70, train_loss: 0.4592, test_loss: 0.9471, test_f1: 0.6172
 epoch: 71, train_loss: 0.4711, test_loss: 0.9547, test_f1: 0.6249
 epoch: 72, train_loss: 0.4726, test_loss: 0.8695, test_f1: 0.6360
 epoch: 73, train_loss: 0.4673, test_loss: 0.9169, test_f1: 0.6133
 epoch: 74, train_loss: 0.4597, test_loss: 0.9147, test_f1: 0.6286
 epoch: 75, train_loss: 0.4628, test_loss: 0.9380, test_f1: 0.6496
 epoch: 76, train_loss: 0.4569, test_loss: 0.9161, test_f1: 0.6295
 epoch: 77, train_loss: 0.4541, test_loss: 0.8427, test_f1: 0.6348
 epoch: 78, train_loss: 0.4414, test_loss: 0.9093, test_f1: 0.6172
 epoch: 79, train_loss: 0.4365, test_loss: 0.9403, test_f1: 0.6338
 epoch: 80, train_loss: 0.4407, test_loss: 0.9178, test_f1: 0.6167
 epoch: 81, train_loss: 0.4552, test_loss: 1.0082, test_f1: 0.6211
 epoch: 82, train_loss: 0.4432, test_loss: 1.0051, test_f1: 0.6318
 epoch: 83, train_loss: 0.4479, test_loss: 0.9708, test_f1: 0.6374
 epoch: 84, train_loss: 0.4258, test_loss: 1.0470, test_f1: 0.6143
 epoch: 85, train_loss: 0.4246, test_loss: 0.9675, test_f1: 0.6351
 epoch: 86, train_loss: 0.4237, test_loss: 0.9897, test_f1: 0.6363
 epoch: 87, train_loss: 0.4178, test_loss: 1.0099, test_f1: 0.6396
 epoch: 88, train_loss: 0.4069, test_loss: 1.0511, test_f1: 0.6347
 epoch: 89, train_loss: 0.4212, test_loss: 0.9378, test_f1: 0.6478
 epoch: 90, train_loss: 0.4146, test_loss: 1.0567, test_f1: 0.6300
 epoch: 91, train_loss: 0.4112, test_loss: 1.0188, test_f1: 0.6412
 epoch: 92, train_loss: 0.4063, test_loss: 0.9470, test_f1: 0.6477
 epoch: 93, train_loss: 0.4103, test_loss: 1.0671, test_f1: 0.6463
 epoch: 94, train_loss: 0.4098, test_loss: 1.0721, test_f1: 0.6286
 epoch: 95, train_loss: 0.3955, test_loss: 1.0073, test_f1: 0.6379
 epoch: 96, train_loss: 0.3981, test_loss: 1.1236, test_f1: 0.6155
 epoch: 97, train_loss: 0.4187, test_loss: 1.0568, test_f1: 0.6231
 epoch: 98, train_loss: 0.3857, test_loss: 1.0129, test_f1: 0.6177
 epoch: 99, train_loss: 0.3888, test_loss: 1.0196, test_f1: 0.6287
##################ITERATION #9 ****************************************
 epoch: 0, train_loss: 1.1932, test_loss: 1.0874, test_f1: 0.4455
 epoch: 1, train_loss: 1.0215, test_loss: 0.9694, test_f1: 0.5416
 epoch: 2, train_loss: 0.9849, test_loss: 0.9706, test_f1: 0.5348
 epoch: 3, train_loss: 0.9470, test_loss: 0.9456, test_f1: 0.5602
 epoch: 4, train_loss: 0.9381, test_loss: 0.9653, test_f1: 0.5251
 epoch: 5, train_loss: 0.9172, test_loss: 0.9591, test_f1: 0.5395
 epoch: 6, train_loss: 0.9048, test_loss: 0.9418, test_f1: 0.5490
 epoch: 7, train_loss: 0.8903, test_loss: 0.9243, test_f1: 0.5681
 epoch: 8, train_loss: 0.8805, test_loss: 0.9403, test_f1: 0.5691
 epoch: 9, train_loss: 0.8638, test_loss: 0.9471, test_f1: 0.5843
 epoch: 10, train_loss: 0.8547, test_loss: 0.9198, test_f1: 0.5680
 epoch: 11, train_loss: 0.8153, test_loss: 0.9168, test_f1: 0.5809
 epoch: 12, train_loss: 0.8180, test_loss: 0.9407, test_f1: 0.5631
 epoch: 13, train_loss: 0.8103, test_loss: 0.9097, test_f1: 0.5911
 epoch: 14, train_loss: 0.8077, test_loss: 0.9439, test_f1: 0.5961
 epoch: 15, train_loss: 0.8046, test_loss: 0.9388, test_f1: 0.5552
 epoch: 16, train_loss: 0.7760, test_loss: 0.9074, test_f1: 0.5853
 epoch: 17, train_loss: 0.7618, test_loss: 0.9424, test_f1: 0.5787
 epoch: 18, train_loss: 0.7573, test_loss: 0.9176, test_f1: 0.5708
 epoch: 19, train_loss: 0.7486, test_loss: 0.9449, test_f1: 0.5768
 epoch: 20, train_loss: 0.7406, test_loss: 0.8892, test_f1: 0.6172
 epoch: 21, train_loss: 0.7298, test_loss: 0.9204, test_f1: 0.6005
 epoch: 22, train_loss: 0.7176, test_loss: 0.9057, test_f1: 0.6188
 epoch: 23, train_loss: 0.7008, test_loss: 0.9588, test_f1: 0.6025
 epoch: 24, train_loss: 0.6982, test_loss: 0.9091, test_f1: 0.6058
 epoch: 25, train_loss: 0.6949, test_loss: 0.9632, test_f1: 0.5942
 epoch: 26, train_loss: 0.6848, test_loss: 0.9186, test_f1: 0.5983
 epoch: 27, train_loss: 0.6789, test_loss: 0.8972, test_f1: 0.6223
 epoch: 28, train_loss: 0.6515, test_loss: 0.9165, test_f1: 0.6094
 epoch: 29, train_loss: 0.6603, test_loss: 0.9126, test_f1: 0.5991
 epoch: 30, train_loss: 0.6516, test_loss: 0.8946, test_f1: 0.6262
 epoch: 31, train_loss: 0.6463, test_loss: 0.8997, test_f1: 0.6085
 epoch: 32, train_loss: 0.6341, test_loss: 0.8887, test_f1: 0.6364
 epoch: 33, train_loss: 0.6364, test_loss: 0.8831, test_f1: 0.6329
 epoch: 34, train_loss: 0.6128, test_loss: 0.8959, test_f1: 0.6296
 epoch: 35, train_loss: 0.6224, test_loss: 0.8799, test_f1: 0.6422
 epoch: 36, train_loss: 0.6023, test_loss: 0.9121, test_f1: 0.6411
 epoch: 37, train_loss: 0.5871, test_loss: 0.9297, test_f1: 0.6287
 epoch: 38, train_loss: 0.5970, test_loss: 0.9005, test_f1: 0.6286
 epoch: 39, train_loss: 0.5974, test_loss: 0.9468, test_f1: 0.6146
 epoch: 40, train_loss: 0.5803, test_loss: 0.8865, test_f1: 0.6314
 epoch: 41, train_loss: 0.5772, test_loss: 0.8826, test_f1: 0.6195
 epoch: 42, train_loss: 0.5727, test_loss: 0.8834, test_f1: 0.6533
 epoch: 43, train_loss: 0.5611, test_loss: 0.8866, test_f1: 0.6448
 epoch: 44, train_loss: 0.5674, test_loss: 0.8920, test_f1: 0.6396
 epoch: 45, train_loss: 0.5439, test_loss: 0.8914, test_f1: 0.6447
 epoch: 46, train_loss: 0.5492, test_loss: 0.8966, test_f1: 0.6585
 epoch: 47, train_loss: 0.5392, test_loss: 0.9389, test_f1: 0.6431
 epoch: 48, train_loss: 0.5258, test_loss: 0.9425, test_f1: 0.6281
 epoch: 49, train_loss: 0.5312, test_loss: 0.9110, test_f1: 0.6625
 epoch: 50, train_loss: 0.5261, test_loss: 0.9513, test_f1: 0.6501
 epoch: 51, train_loss: 0.4965, test_loss: 0.9125, test_f1: 0.6586
 epoch: 52, train_loss: 0.4822, test_loss: 0.9155, test_f1: 0.6631
 epoch: 53, train_loss: 0.4865, test_loss: 0.9240, test_f1: 0.6707
 epoch: 54, train_loss: 0.4720, test_loss: 0.9543, test_f1: 0.6487
 epoch: 55, train_loss: 0.4745, test_loss: 0.8978, test_f1: 0.6619
 epoch: 56, train_loss: 0.4706, test_loss: 0.9469, test_f1: 0.6635
 epoch: 57, train_loss: 0.4582, test_loss: 0.9817, test_f1: 0.6399
 epoch: 58, train_loss: 0.4639, test_loss: 0.9177, test_f1: 0.6792
 epoch: 59, train_loss: 0.4588, test_loss: 0.9573, test_f1: 0.6715
 epoch: 60, train_loss: 0.4633, test_loss: 0.9445, test_f1: 0.6278
 epoch: 61, train_loss: 0.4414, test_loss: 0.9431, test_f1: 0.6679
 epoch: 62, train_loss: 0.4590, test_loss: 0.9546, test_f1: 0.6619
 epoch: 63, train_loss: 0.4437, test_loss: 0.9391, test_f1: 0.6718
 epoch: 64, train_loss: 0.4500, test_loss: 0.9408, test_f1: 0.6783
 epoch: 65, train_loss: 0.4406, test_loss: 0.9294, test_f1: 0.6755
 epoch: 66, train_loss: 0.4387, test_loss: 0.9785, test_f1: 0.6560
 epoch: 67, train_loss: 0.4368, test_loss: 0.9723, test_f1: 0.6784
 epoch: 68, train_loss: 0.4201, test_loss: 1.0132, test_f1: 0.6472
 epoch: 69, train_loss: 0.4327, test_loss: 0.9562, test_f1: 0.6659
 epoch: 70, train_loss: 0.4328, test_loss: 0.9944, test_f1: 0.6886
 epoch: 71, train_loss: 0.4193, test_loss: 0.9912, test_f1: 0.6635
 epoch: 72, train_loss: 0.4182, test_loss: 1.0067, test_f1: 0.6616
 epoch: 73, train_loss: 0.4049, test_loss: 0.9607, test_f1: 0.6563
 epoch: 74, train_loss: 0.4004, test_loss: 0.9718, test_f1: 0.6738
 epoch: 75, train_loss: 0.4125, test_loss: 0.9931, test_f1: 0.6618
 epoch: 76, train_loss: 0.4106, test_loss: 0.9795, test_f1: 0.6666
 epoch: 77, train_loss: 0.4046, test_loss: 1.0009, test_f1: 0.6745
 epoch: 78, train_loss: 0.3781, test_loss: 0.9849, test_f1: 0.6688
 epoch: 79, train_loss: 0.3821, test_loss: 1.0168, test_f1: 0.6474
 epoch: 80, train_loss: 0.3880, test_loss: 1.0002, test_f1: 0.6625
 epoch: 81, train_loss: 0.3792, test_loss: 1.0067, test_f1: 0.6712
 epoch: 82, train_loss: 0.3955, test_loss: 1.0450, test_f1: 0.6678
 epoch: 83, train_loss: 0.3846, test_loss: 1.0773, test_f1: 0.6531
 epoch: 84, train_loss: 0.3757, test_loss: 1.0238, test_f1: 0.6764
 epoch: 85, train_loss: 0.3779, test_loss: 1.0589, test_f1: 0.6572
 epoch: 86, train_loss: 0.3783, test_loss: 1.0946, test_f1: 0.6579
 epoch: 87, train_loss: 0.3748, test_loss: 1.0636, test_f1: 0.6646
 epoch: 88, train_loss: 0.3859, test_loss: 1.0942, test_f1: 0.6671
 epoch: 89, train_loss: 0.3663, test_loss: 1.0407, test_f1: 0.6837
 epoch: 90, train_loss: 0.3609, test_loss: 1.0610, test_f1: 0.6689
 epoch: 91, train_loss: 0.3457, test_loss: 1.0632, test_f1: 0.6668
 epoch: 92, train_loss: 0.3603, test_loss: 1.1003, test_f1: 0.6650
 epoch: 93, train_loss: 0.3499, test_loss: 1.0714, test_f1: 0.6645
 epoch: 94, train_loss: 0.3643, test_loss: 1.1485, test_f1: 0.6691
 epoch: 95, train_loss: 0.3559, test_loss: 1.0610, test_f1: 0.6803
 epoch: 96, train_loss: 0.3513, test_loss: 1.1210, test_f1: 0.6655
 epoch: 97, train_loss: 0.3446, test_loss: 1.0762, test_f1: 0.6616
 epoch: 98, train_loss: 0.3436, test_loss: 1.0853, test_f1: 0.6559
 epoch: 99, train_loss: 0.3437, test_loss: 1.0895, test_f1: 0.6788

Training completed in 898.11 seconds
Best F1: 0.6886 at epoch 70
Mean F1 across iterations: 0.6618  0.0190
========================FINAL RESULTS================================
FEGIN weighted F1: 0.6886  0.0190
python main.py --data ltspice_examples --representation component_pin --model FEGIN --layers 6 --hiddens 128 --batch_size 64 --lr 0.0001 --emb_size 512 --epochs 100 --save_appendix component_pin_L6_H128_BS64_LR0.0001_E512 --no_val
-----



STDERR:
  File "main.py", line 370, in <module>
    main()
  File "main.py", line 254, in main
    dataset = dataset_class(
  File "/home/philip/projects/ltspice_examples_code_repo/Circuit-Completion-Using-GNNs/component_classification_with_link_prediction_head/evaluation/FEGIN/kernel/circuit_datasets.py", line 15, in __init__
    self.data, self.slices = torch.load(self.processed_paths[0])
  File "/home/philip/.local/lib/python3.8/site-packages/torch/serialization.py", line 1040, in load
    warnings.warn(
  File "/usr/lib/python3.8/warnings.py", line 109, in _showwarnmsg
    sw(msg.message, msg.category, msg.filename, msg.lineno,
  File "main.py", line 47, in warn_with_traceback
    traceback.print_stack(file=log)
/home/philip/projects/ltspice_examples_code_repo/Circuit-Completion-Using-GNNs/component_classification_with_link_prediction_head/evaluation/FEGIN/kernel/circuit_datasets.py:15: FutureWarning: You are using `torch.load` with `weights_only=False` (the current default value), which uses the default pickle module implicitly. It is possible to construct malicious pickle data which will execute arbitrary code during unpickling (See https://github.com/pytorch/pytorch/blob/main/SECURITY.md#untrusted-models for more details). In a future release, the default value for `weights_only` will be flipped to `True`. This limits the functions that could be executed during unpickling. Arbitrary objects will no longer be allowed to be loaded via this mode unless they are explicitly allowlisted by the user via `torch.serialization.add_safe_globals`. We recommend you start setting `weights_only=True` for any use case where you don't have full control of the loaded file. Please open an issue on GitHub for any issues related to this experimental feature.
  self.data, self.slices = torch.load(self.processed_paths[0])
