STDOUT:
Results will be saved in /home/philip/projects/ltspice_examples_code_repo/Circuit-Completion-Using-GNNs/component_classification_with_link_prediction_head/evaluation/FEGIN/results/model_FEGIN_dataset_ltspice_examples
Command line input: python main.py --data ltspice_examples --representation component_component --model FEGIN --layers 2 --hiddens 64 --batch_size 32 --lr 0.01 --emb_size 512 --epochs 100 --save_appendix component_component_L2_H64_BS32_LR0.01_E512 --no_val
 is saved.
-----
ltspice_examples - FEGIN
Using 2 layers, 64 hidden units, h = 2
Loading component_component representation dataset
ENTERED
Training FEGIN on component_component representation
Train: 3556, Test: 845
##################ITERATION #0 ****************************************
 epoch: 0, train_loss: 1.2413, test_loss: 1.1905, test_f1: 0.3156
 epoch: 1, train_loss: 1.0891, test_loss: 1.0400, test_f1: 0.4593
 epoch: 2, train_loss: 1.0274, test_loss: 1.0915, test_f1: 0.4174
 epoch: 3, train_loss: 1.0087, test_loss: 1.0026, test_f1: 0.4814
 epoch: 4, train_loss: 0.9844, test_loss: 1.1530, test_f1: 0.4015
 epoch: 5, train_loss: 0.9883, test_loss: 1.0133, test_f1: 0.5492
 epoch: 6, train_loss: 0.9665, test_loss: 0.9427, test_f1: 0.5424
 epoch: 7, train_loss: 0.9555, test_loss: 1.0550, test_f1: 0.5190
 epoch: 8, train_loss: 0.9602, test_loss: 1.0029, test_f1: 0.4634
 epoch: 9, train_loss: 0.9369, test_loss: 1.0401, test_f1: 0.4914
 epoch: 10, train_loss: 0.9230, test_loss: 1.0705, test_f1: 0.5276
 epoch: 11, train_loss: 0.9283, test_loss: 1.0374, test_f1: 0.5035
 epoch: 12, train_loss: 0.9138, test_loss: 1.0857, test_f1: 0.4851
 epoch: 13, train_loss: 0.9228, test_loss: 1.0309, test_f1: 0.5217
 epoch: 14, train_loss: 0.8986, test_loss: 1.1682, test_f1: 0.4905
 epoch: 15, train_loss: 0.9012, test_loss: 1.0363, test_f1: 0.5530
 epoch: 16, train_loss: 0.8981, test_loss: 1.1199, test_f1: 0.5249
 epoch: 17, train_loss: 0.8781, test_loss: 1.0346, test_f1: 0.5070
 epoch: 18, train_loss: 0.8862, test_loss: 1.0214, test_f1: 0.5116
 epoch: 19, train_loss: 0.8894, test_loss: 1.1193, test_f1: 0.4458
 epoch: 20, train_loss: 0.8846, test_loss: 0.9703, test_f1: 0.5360
 epoch: 21, train_loss: 0.8751, test_loss: 0.9818, test_f1: 0.5293
 epoch: 22, train_loss: 0.8816, test_loss: 1.0713, test_f1: 0.5195
 epoch: 23, train_loss: 0.8757, test_loss: 1.0066, test_f1: 0.5670
 epoch: 24, train_loss: 0.8644, test_loss: 1.0934, test_f1: 0.5264
 epoch: 25, train_loss: 0.8981, test_loss: 1.0164, test_f1: 0.5340
 epoch: 26, train_loss: 0.8921, test_loss: 1.1354, test_f1: 0.5050
 epoch: 27, train_loss: 0.8562, test_loss: 1.0214, test_f1: 0.5645
 epoch: 28, train_loss: 0.8595, test_loss: 0.9728, test_f1: 0.5269
 epoch: 29, train_loss: 0.8395, test_loss: 1.0798, test_f1: 0.5661
 epoch: 30, train_loss: 0.8392, test_loss: 0.9704, test_f1: 0.5635
 epoch: 31, train_loss: 0.8782, test_loss: 1.0953, test_f1: 0.5649
 epoch: 32, train_loss: 0.8694, test_loss: 1.1955, test_f1: 0.5334
 epoch: 33, train_loss: 0.8593, test_loss: 1.1726, test_f1: 0.5590
 epoch: 34, train_loss: 0.8401, test_loss: 1.0417, test_f1: 0.5263
 epoch: 35, train_loss: 0.8321, test_loss: 1.1171, test_f1: 0.5115
 epoch: 36, train_loss: 0.8441, test_loss: 1.0200, test_f1: 0.5588
 epoch: 37, train_loss: 0.8488, test_loss: 1.0951, test_f1: 0.5274
 epoch: 38, train_loss: 0.8165, test_loss: 0.9356, test_f1: 0.5535
 epoch: 39, train_loss: 0.8381, test_loss: 1.0401, test_f1: 0.5452
 epoch: 40, train_loss: 0.8337, test_loss: 1.1107, test_f1: 0.5311
 epoch: 41, train_loss: 0.8085, test_loss: 1.1417, test_f1: 0.5471
 epoch: 42, train_loss: 0.8218, test_loss: 0.9790, test_f1: 0.5570
 epoch: 43, train_loss: 0.8133, test_loss: 1.3957, test_f1: 0.5226
 epoch: 44, train_loss: 0.8207, test_loss: 1.1196, test_f1: 0.5475
 epoch: 45, train_loss: 0.8049, test_loss: 1.0148, test_f1: 0.5544
 epoch: 46, train_loss: 0.8023, test_loss: 0.9524, test_f1: 0.5584
 epoch: 47, train_loss: 0.8255, test_loss: 1.1497, test_f1: 0.5567
 epoch: 48, train_loss: 0.8547, test_loss: 1.0527, test_f1: 0.4997
 epoch: 49, train_loss: 0.8115, test_loss: 1.0050, test_f1: 0.5306
 epoch: 50, train_loss: 0.7914, test_loss: 1.0810, test_f1: 0.5154
 epoch: 51, train_loss: 0.7855, test_loss: 1.0848, test_f1: 0.5213
 epoch: 52, train_loss: 0.7530, test_loss: 0.9531, test_f1: 0.5696
 epoch: 53, train_loss: 0.7428, test_loss: 1.0514, test_f1: 0.5540
 epoch: 54, train_loss: 0.7425, test_loss: 0.9728, test_f1: 0.5699
 epoch: 55, train_loss: 0.7429, test_loss: 0.9993, test_f1: 0.5471
 epoch: 56, train_loss: 0.7260, test_loss: 1.0319, test_f1: 0.5692
 epoch: 57, train_loss: 0.7432, test_loss: 1.0265, test_f1: 0.5543
 epoch: 58, train_loss: 0.7322, test_loss: 1.0507, test_f1: 0.5779
 epoch: 59, train_loss: 0.7133, test_loss: 1.1241, test_f1: 0.5550
 epoch: 60, train_loss: 0.7159, test_loss: 1.1492, test_f1: 0.5438
 epoch: 61, train_loss: 0.7207, test_loss: 1.0619, test_f1: 0.5905
 epoch: 62, train_loss: 0.7325, test_loss: 0.9962, test_f1: 0.5628
 epoch: 63, train_loss: 0.7226, test_loss: 1.0202, test_f1: 0.5680
 epoch: 64, train_loss: 0.7052, test_loss: 1.0519, test_f1: 0.5721
 epoch: 65, train_loss: 0.7021, test_loss: 0.9963, test_f1: 0.5609
 epoch: 66, train_loss: 0.7127, test_loss: 1.1493, test_f1: 0.5295
 epoch: 67, train_loss: 0.7068, test_loss: 1.0504, test_f1: 0.5238
 epoch: 68, train_loss: 0.6890, test_loss: 1.1417, test_f1: 0.5355
 epoch: 69, train_loss: 0.6875, test_loss: 1.0602, test_f1: 0.5621
 epoch: 70, train_loss: 0.6999, test_loss: 1.0688, test_f1: 0.5801
 epoch: 71, train_loss: 0.6987, test_loss: 1.0541, test_f1: 0.5711
 epoch: 72, train_loss: 0.6872, test_loss: 1.2279, test_f1: 0.5361
 epoch: 73, train_loss: 0.7018, test_loss: 1.1742, test_f1: 0.5347
 epoch: 74, train_loss: 0.6696, test_loss: 1.1510, test_f1: 0.5838
 epoch: 75, train_loss: 0.6716, test_loss: 1.1137, test_f1: 0.5600
 epoch: 76, train_loss: 0.6606, test_loss: 0.9983, test_f1: 0.5930
 epoch: 77, train_loss: 0.6612, test_loss: 1.2676, test_f1: 0.5711
 epoch: 78, train_loss: 0.6902, test_loss: 1.0905, test_f1: 0.5315
 epoch: 79, train_loss: 0.6678, test_loss: 1.2187, test_f1: 0.5305
 epoch: 80, train_loss: 0.6706, test_loss: 1.1345, test_f1: 0.5340
 epoch: 81, train_loss: 0.6574, test_loss: 1.0930, test_f1: 0.5663
 epoch: 82, train_loss: 0.6738, test_loss: 1.1658, test_f1: 0.5539
 epoch: 83, train_loss: 0.6674, test_loss: 1.2716, test_f1: 0.5641
 epoch: 84, train_loss: 0.6665, test_loss: 1.2925, test_f1: 0.5466
 epoch: 85, train_loss: 0.6674, test_loss: 1.0366, test_f1: 0.5644
 epoch: 86, train_loss: 0.6507, test_loss: 1.0172, test_f1: 0.6102
 epoch: 87, train_loss: 0.6622, test_loss: 1.2562, test_f1: 0.5636
 epoch: 88, train_loss: 0.6658, test_loss: 1.0987, test_f1: 0.5507
 epoch: 89, train_loss: 0.6501, test_loss: 1.1417, test_f1: 0.5950
 epoch: 90, train_loss: 0.6364, test_loss: 1.2343, test_f1: 0.5278
 epoch: 91, train_loss: 0.6737, test_loss: 1.2917, test_f1: 0.5665
 epoch: 92, train_loss: 0.6515, test_loss: 1.2594, test_f1: 0.5571
 epoch: 93, train_loss: 0.6312, test_loss: 1.4002, test_f1: 0.5644
 epoch: 94, train_loss: 0.6418, test_loss: 1.1695, test_f1: 0.5854
 epoch: 95, train_loss: 0.6348, test_loss: 1.1229, test_f1: 0.5489
 epoch: 96, train_loss: 0.6219, test_loss: 1.4528, test_f1: 0.5504
 epoch: 97, train_loss: 0.6430, test_loss: 1.1829, test_f1: 0.5490
 epoch: 98, train_loss: 0.6360, test_loss: 1.4423, test_f1: 0.5445
 epoch: 99, train_loss: 0.6300, test_loss: 1.1098, test_f1: 0.5425
##################ITERATION #1 ****************************************
 epoch: 0, train_loss: 1.2412, test_loss: 1.1004, test_f1: 0.4585
 epoch: 1, train_loss: 1.1137, test_loss: 1.0470, test_f1: 0.4599
 epoch: 2, train_loss: 1.0276, test_loss: 1.0849, test_f1: 0.4896
 epoch: 3, train_loss: 1.0159, test_loss: 1.0772, test_f1: 0.4836
 epoch: 4, train_loss: 1.0008, test_loss: 1.0774, test_f1: 0.4769
 epoch: 5, train_loss: 0.9959, test_loss: 1.1738, test_f1: 0.4508
 epoch: 6, train_loss: 1.0040, test_loss: 1.0424, test_f1: 0.4611
 epoch: 7, train_loss: 0.9734, test_loss: 1.0064, test_f1: 0.4486
 epoch: 8, train_loss: 1.0068, test_loss: 1.0680, test_f1: 0.4777
 epoch: 9, train_loss: 0.9757, test_loss: 1.1192, test_f1: 0.5190
 epoch: 10, train_loss: 0.9565, test_loss: 1.1559, test_f1: 0.5151
 epoch: 11, train_loss: 0.9451, test_loss: 1.0135, test_f1: 0.5200
 epoch: 12, train_loss: 0.9405, test_loss: 1.0954, test_f1: 0.5366
 epoch: 13, train_loss: 0.9321, test_loss: 0.9890, test_f1: 0.5126
 epoch: 14, train_loss: 0.9204, test_loss: 1.0641, test_f1: 0.4588
 epoch: 15, train_loss: 0.9134, test_loss: 1.0062, test_f1: 0.5043
 epoch: 16, train_loss: 0.9039, test_loss: 1.0394, test_f1: 0.4921
 epoch: 17, train_loss: 0.9136, test_loss: 0.9958, test_f1: 0.5184
 epoch: 18, train_loss: 0.9075, test_loss: 0.9775, test_f1: 0.5033
 epoch: 19, train_loss: 0.8966, test_loss: 0.9807, test_f1: 0.5106
 epoch: 20, train_loss: 0.8849, test_loss: 1.0943, test_f1: 0.4853
 epoch: 21, train_loss: 0.9448, test_loss: 0.8964, test_f1: 0.4946
 epoch: 22, train_loss: 0.9197, test_loss: 1.1025, test_f1: 0.4987
 epoch: 23, train_loss: 0.8979, test_loss: 1.1229, test_f1: 0.5009
 epoch: 24, train_loss: 0.9097, test_loss: 1.0641, test_f1: 0.5189
 epoch: 25, train_loss: 0.8970, test_loss: 0.9610, test_f1: 0.5271
 epoch: 26, train_loss: 0.8732, test_loss: 1.0443, test_f1: 0.5143
 epoch: 27, train_loss: 0.9265, test_loss: 0.9417, test_f1: 0.5408
 epoch: 28, train_loss: 0.8855, test_loss: 0.9315, test_f1: 0.5113
 epoch: 29, train_loss: 0.8775, test_loss: 0.9787, test_f1: 0.4992
 epoch: 30, train_loss: 0.8682, test_loss: 0.9467, test_f1: 0.4983
 epoch: 31, train_loss: 0.8903, test_loss: 1.2121, test_f1: 0.4696
 epoch: 32, train_loss: 0.8687, test_loss: 0.9516, test_f1: 0.5222
 epoch: 33, train_loss: 0.8629, test_loss: 1.0729, test_f1: 0.5183
 epoch: 34, train_loss: 0.8677, test_loss: 1.0015, test_f1: 0.5232
 epoch: 35, train_loss: 0.8641, test_loss: 1.1060, test_f1: 0.4946
 epoch: 36, train_loss: 0.8498, test_loss: 1.0454, test_f1: 0.5638
 epoch: 37, train_loss: 0.8558, test_loss: 1.2275, test_f1: 0.5158
 epoch: 38, train_loss: 0.8410, test_loss: 1.0729, test_f1: 0.5414
 epoch: 39, train_loss: 0.8551, test_loss: 1.0027, test_f1: 0.4800
 epoch: 40, train_loss: 0.8534, test_loss: 1.0865, test_f1: 0.4888
 epoch: 41, train_loss: 0.8471, test_loss: 1.0389, test_f1: 0.5037
 epoch: 42, train_loss: 0.8394, test_loss: 0.9286, test_f1: 0.5401
 epoch: 43, train_loss: 0.8377, test_loss: 1.1554, test_f1: 0.5414
 epoch: 44, train_loss: 0.8268, test_loss: 1.1380, test_f1: 0.5229
 epoch: 45, train_loss: 0.8393, test_loss: 1.0112, test_f1: 0.5230
 epoch: 46, train_loss: 0.8247, test_loss: 1.0736, test_f1: 0.5122
 epoch: 47, train_loss: 0.8413, test_loss: 1.0290, test_f1: 0.5091
 epoch: 48, train_loss: 0.8436, test_loss: 1.0099, test_f1: 0.5114
 epoch: 49, train_loss: 0.8829, test_loss: 1.0217, test_f1: 0.5009
 epoch: 50, train_loss: 0.8459, test_loss: 1.1777, test_f1: 0.4950
 epoch: 51, train_loss: 0.8103, test_loss: 1.1611, test_f1: 0.5553
 epoch: 52, train_loss: 0.7910, test_loss: 1.2774, test_f1: 0.5402
 epoch: 53, train_loss: 0.7937, test_loss: 1.1222, test_f1: 0.5539
 epoch: 54, train_loss: 0.7799, test_loss: 1.2004, test_f1: 0.5552
 epoch: 55, train_loss: 0.7578, test_loss: 1.3367, test_f1: 0.5557
 epoch: 56, train_loss: 0.7675, test_loss: 1.0947, test_f1: 0.5585
 epoch: 57, train_loss: 0.7645, test_loss: 1.3949, test_f1: 0.5365
 epoch: 58, train_loss: 0.7640, test_loss: 1.4105, test_f1: 0.5382
 epoch: 59, train_loss: 0.7659, test_loss: 1.2705, test_f1: 0.5281
 epoch: 60, train_loss: 0.7594, test_loss: 1.1917, test_f1: 0.5421
 epoch: 61, train_loss: 0.7613, test_loss: 1.1649, test_f1: 0.5548
 epoch: 62, train_loss: 0.7642, test_loss: 1.2813, test_f1: 0.5427
 epoch: 63, train_loss: 0.7515, test_loss: 1.1615, test_f1: 0.5181
 epoch: 64, train_loss: 0.7516, test_loss: 1.0643, test_f1: 0.5531
 epoch: 65, train_loss: 0.7584, test_loss: 1.2035, test_f1: 0.5385
 epoch: 66, train_loss: 0.7457, test_loss: 1.1905, test_f1: 0.5526
 epoch: 67, train_loss: 0.7282, test_loss: 1.1422, test_f1: 0.5502
 epoch: 68, train_loss: 0.7352, test_loss: 1.4062, test_f1: 0.5395
 epoch: 69, train_loss: 0.7379, test_loss: 1.2509, test_f1: 0.5674
 epoch: 70, train_loss: 0.7265, test_loss: 1.2464, test_f1: 0.5345
 epoch: 71, train_loss: 0.7383, test_loss: 1.1326, test_f1: 0.5412
 epoch: 72, train_loss: 0.7327, test_loss: 1.3350, test_f1: 0.5342
 epoch: 73, train_loss: 0.7280, test_loss: 1.0633, test_f1: 0.5449
 epoch: 74, train_loss: 0.7263, test_loss: 1.6049, test_f1: 0.5480
 epoch: 75, train_loss: 0.7353, test_loss: 1.4178, test_f1: 0.5340
 epoch: 76, train_loss: 0.7131, test_loss: 1.1307, test_f1: 0.5744
 epoch: 77, train_loss: 0.7264, test_loss: 1.3325, test_f1: 0.5419
 epoch: 78, train_loss: 0.7307, test_loss: 1.4556, test_f1: 0.5437
 epoch: 79, train_loss: 0.7286, test_loss: 1.3658, test_f1: 0.5559
 epoch: 80, train_loss: 0.7046, test_loss: 1.3430, test_f1: 0.5571
 epoch: 81, train_loss: 0.7006, test_loss: 1.1990, test_f1: 0.5523
 epoch: 82, train_loss: 0.7064, test_loss: 1.2879, test_f1: 0.5644
 epoch: 83, train_loss: 0.6987, test_loss: 1.1462, test_f1: 0.5698
 epoch: 84, train_loss: 0.7152, test_loss: 1.1868, test_f1: 0.5514
 epoch: 85, train_loss: 0.6852, test_loss: 1.1246, test_f1: 0.5502
 epoch: 86, train_loss: 0.7142, test_loss: 1.0926, test_f1: 0.5749
 epoch: 87, train_loss: 0.7077, test_loss: 1.1582, test_f1: 0.5549
 epoch: 88, train_loss: 0.6971, test_loss: 1.1569, test_f1: 0.5646
 epoch: 89, train_loss: 0.6875, test_loss: 1.1115, test_f1: 0.5933
 epoch: 90, train_loss: 0.6962, test_loss: 1.1169, test_f1: 0.5705
 epoch: 91, train_loss: 0.6961, test_loss: 1.2203, test_f1: 0.5451
 epoch: 92, train_loss: 0.6893, test_loss: 1.2686, test_f1: 0.5697
 epoch: 93, train_loss: 0.6920, test_loss: 1.4322, test_f1: 0.5657
 epoch: 94, train_loss: 0.6887, test_loss: 1.1259, test_f1: 0.5954
 epoch: 95, train_loss: 0.6971, test_loss: 1.1573, test_f1: 0.5436
 epoch: 96, train_loss: 0.6913, test_loss: 1.0947, test_f1: 0.5798
 epoch: 97, train_loss: 0.6856, test_loss: 1.1522, test_f1: 0.5664
 epoch: 98, train_loss: 0.7307, test_loss: 1.1792, test_f1: 0.5595
 epoch: 99, train_loss: 0.6661, test_loss: 1.3144, test_f1: 0.5793
##################ITERATION #2 ****************************************
 epoch: 0, train_loss: 1.2859, test_loss: 1.2122, test_f1: 0.3446
 epoch: 1, train_loss: 1.1609, test_loss: 1.0904, test_f1: 0.4149
 epoch: 2, train_loss: 1.0976, test_loss: 1.0520, test_f1: 0.4455
 epoch: 3, train_loss: 1.0490, test_loss: 0.9722, test_f1: 0.4416
 epoch: 4, train_loss: 1.0458, test_loss: 1.0229, test_f1: 0.4709
 epoch: 5, train_loss: 1.0338, test_loss: 1.1126, test_f1: 0.4722
 epoch: 6, train_loss: 1.0170, test_loss: 0.9752, test_f1: 0.5296
 epoch: 7, train_loss: 0.9835, test_loss: 0.9871, test_f1: 0.5003
 epoch: 8, train_loss: 0.9636, test_loss: 1.0159, test_f1: 0.5050
 epoch: 9, train_loss: 0.9526, test_loss: 0.9807, test_f1: 0.5373
 epoch: 10, train_loss: 0.9504, test_loss: 1.0680, test_f1: 0.5300
 epoch: 11, train_loss: 0.9279, test_loss: 0.9662, test_f1: 0.4865
 epoch: 12, train_loss: 0.9368, test_loss: 0.9534, test_f1: 0.5300
 epoch: 13, train_loss: 0.9146, test_loss: 1.2060, test_f1: 0.4893
 epoch: 14, train_loss: 0.9226, test_loss: 1.0399, test_f1: 0.4795
 epoch: 15, train_loss: 0.9164, test_loss: 0.9906, test_f1: 0.5865
 epoch: 16, train_loss: 0.9144, test_loss: 0.9790, test_f1: 0.5534
 epoch: 17, train_loss: 0.9056, test_loss: 1.0237, test_f1: 0.4450
 epoch: 18, train_loss: 0.9641, test_loss: 0.9910, test_f1: 0.5546
 epoch: 19, train_loss: 0.9019, test_loss: 1.0354, test_f1: 0.5293
 epoch: 20, train_loss: 0.9011, test_loss: 0.9552, test_f1: 0.5244
 epoch: 21, train_loss: 0.8976, test_loss: 1.0477, test_f1: 0.5288
 epoch: 22, train_loss: 0.8952, test_loss: 1.0536, test_f1: 0.5210
 epoch: 23, train_loss: 0.8812, test_loss: 0.9337, test_f1: 0.5484
 epoch: 24, train_loss: 0.8853, test_loss: 1.0523, test_f1: 0.4533
 epoch: 25, train_loss: 0.8784, test_loss: 0.9629, test_f1: 0.5382
 epoch: 26, train_loss: 0.8629, test_loss: 0.9272, test_f1: 0.5452
 epoch: 27, train_loss: 0.8587, test_loss: 1.2720, test_f1: 0.5145
 epoch: 28, train_loss: 0.8611, test_loss: 1.0985, test_f1: 0.5363
 epoch: 29, train_loss: 0.8450, test_loss: 0.9831, test_f1: 0.5426
 epoch: 30, train_loss: 0.8560, test_loss: 1.0480, test_f1: 0.5224
 epoch: 31, train_loss: 0.8615, test_loss: 1.0786, test_f1: 0.5196
 epoch: 32, train_loss: 0.8438, test_loss: 1.2491, test_f1: 0.4947
 epoch: 33, train_loss: 0.8646, test_loss: 0.9660, test_f1: 0.5012
 epoch: 34, train_loss: 0.8573, test_loss: 0.9293, test_f1: 0.5410
 epoch: 35, train_loss: 0.8491, test_loss: 1.1585, test_f1: 0.5335
 epoch: 36, train_loss: 0.8381, test_loss: 0.9864, test_f1: 0.5362
 epoch: 37, train_loss: 0.8865, test_loss: 1.0881, test_f1: 0.5179
 epoch: 38, train_loss: 0.8619, test_loss: 0.9714, test_f1: 0.5316
 epoch: 39, train_loss: 0.8368, test_loss: 0.9813, test_f1: 0.5504
 epoch: 40, train_loss: 0.8260, test_loss: 1.0822, test_f1: 0.5155
 epoch: 41, train_loss: 0.8271, test_loss: 1.0242, test_f1: 0.5584
 epoch: 42, train_loss: 0.8174, test_loss: 1.0110, test_f1: 0.5555
 epoch: 43, train_loss: 0.8365, test_loss: 0.9907, test_f1: 0.5348
 epoch: 44, train_loss: 0.8131, test_loss: 1.1536, test_f1: 0.5167
 epoch: 45, train_loss: 0.8183, test_loss: 1.2001, test_f1: 0.5272
 epoch: 46, train_loss: 0.7905, test_loss: 1.0279, test_f1: 0.5275
 epoch: 47, train_loss: 0.8195, test_loss: 1.0996, test_f1: 0.5314
 epoch: 48, train_loss: 0.8068, test_loss: 1.0782, test_f1: 0.5659
 epoch: 49, train_loss: 0.8005, test_loss: 1.1391, test_f1: 0.5421
 epoch: 50, train_loss: 0.7954, test_loss: 0.9901, test_f1: 0.5452
 epoch: 51, train_loss: 0.7720, test_loss: 1.1178, test_f1: 0.5252
 epoch: 52, train_loss: 0.7440, test_loss: 1.0448, test_f1: 0.5199
 epoch: 53, train_loss: 0.7370, test_loss: 1.2374, test_f1: 0.5377
 epoch: 54, train_loss: 0.7426, test_loss: 1.0467, test_f1: 0.5142
 epoch: 55, train_loss: 0.7402, test_loss: 1.0062, test_f1: 0.5537
 epoch: 56, train_loss: 0.7265, test_loss: 1.0691, test_f1: 0.5376
 epoch: 57, train_loss: 0.7324, test_loss: 1.1002, test_f1: 0.5346
 epoch: 58, train_loss: 0.7690, test_loss: 1.0720, test_f1: 0.5572
 epoch: 59, train_loss: 0.7222, test_loss: 1.1383, test_f1: 0.5539
 epoch: 60, train_loss: 0.7162, test_loss: 1.2350, test_f1: 0.5265
 epoch: 61, train_loss: 0.7330, test_loss: 1.1085, test_f1: 0.5209
 epoch: 62, train_loss: 0.7228, test_loss: 1.0328, test_f1: 0.5549
 epoch: 63, train_loss: 0.7053, test_loss: 0.9284, test_f1: 0.5755
 epoch: 64, train_loss: 0.7025, test_loss: 1.0895, test_f1: 0.5401
 epoch: 65, train_loss: 0.7054, test_loss: 1.0886, test_f1: 0.5403
 epoch: 66, train_loss: 0.7512, test_loss: 0.9434, test_f1: 0.5447
 epoch: 67, train_loss: 0.7083, test_loss: 0.9872, test_f1: 0.5708
 epoch: 68, train_loss: 0.6927, test_loss: 1.0624, test_f1: 0.5352
 epoch: 69, train_loss: 0.6983, test_loss: 0.9496, test_f1: 0.5677
 epoch: 70, train_loss: 0.6888, test_loss: 1.1834, test_f1: 0.5481
 epoch: 71, train_loss: 0.6892, test_loss: 1.0583, test_f1: 0.5434
 epoch: 72, train_loss: 0.6816, test_loss: 1.2071, test_f1: 0.5334
 epoch: 73, train_loss: 0.6752, test_loss: 1.2291, test_f1: 0.5372
 epoch: 74, train_loss: 0.6780, test_loss: 1.1605, test_f1: 0.5311
 epoch: 75, train_loss: 0.6591, test_loss: 1.1703, test_f1: 0.5456
 epoch: 76, train_loss: 0.6722, test_loss: 1.3161, test_f1: 0.5460
 epoch: 77, train_loss: 0.6653, test_loss: 1.2538, test_f1: 0.5336
 epoch: 78, train_loss: 0.6595, test_loss: 1.0793, test_f1: 0.5680
 epoch: 79, train_loss: 0.6732, test_loss: 1.2079, test_f1: 0.5391
 epoch: 80, train_loss: 0.6756, test_loss: 1.1300, test_f1: 0.5644
 epoch: 81, train_loss: 0.6637, test_loss: 1.2824, test_f1: 0.5456
 epoch: 82, train_loss: 0.6309, test_loss: 1.2463, test_f1: 0.5380
 epoch: 83, train_loss: 0.6511, test_loss: 1.2321, test_f1: 0.5421
 epoch: 84, train_loss: 0.6422, test_loss: 1.2974, test_f1: 0.5370
 epoch: 85, train_loss: 0.6432, test_loss: 1.2475, test_f1: 0.5303
 epoch: 86, train_loss: 0.6510, test_loss: 1.2333, test_f1: 0.5543
 epoch: 87, train_loss: 0.6348, test_loss: 1.2752, test_f1: 0.5277
 epoch: 88, train_loss: 0.6881, test_loss: 1.0254, test_f1: 0.5609
 epoch: 89, train_loss: 0.6442, test_loss: 1.1862, test_f1: 0.5644
 epoch: 90, train_loss: 0.6295, test_loss: 1.1404, test_f1: 0.5870
 epoch: 91, train_loss: 0.6214, test_loss: 1.3204, test_f1: 0.5392
 epoch: 92, train_loss: 0.6089, test_loss: 1.2269, test_f1: 0.5394
 epoch: 93, train_loss: 0.6318, test_loss: 1.2507, test_f1: 0.5553
 epoch: 94, train_loss: 0.6309, test_loss: 1.2660, test_f1: 0.5360
 epoch: 95, train_loss: 0.6270, test_loss: 1.1908, test_f1: 0.5617
 epoch: 96, train_loss: 0.6371, test_loss: 1.2449, test_f1: 0.5351
 epoch: 97, train_loss: 0.6112, test_loss: 1.3029, test_f1: 0.5732
 epoch: 98, train_loss: 0.6111, test_loss: 1.3577, test_f1: 0.5580
 epoch: 99, train_loss: 0.6205, test_loss: 1.3970, test_f1: 0.5367
##################ITERATION #3 ****************************************
 epoch: 0, train_loss: 1.2565, test_loss: 1.1493, test_f1: 0.3600
 epoch: 1, train_loss: 1.1122, test_loss: 1.1735, test_f1: 0.3921
 epoch: 2, train_loss: 1.0649, test_loss: 1.0116, test_f1: 0.4652
 epoch: 3, train_loss: 1.0236, test_loss: 0.9253, test_f1: 0.4700
 epoch: 4, train_loss: 0.9935, test_loss: 1.1247, test_f1: 0.4680
 epoch: 5, train_loss: 0.9952, test_loss: 1.0442, test_f1: 0.4969
 epoch: 6, train_loss: 0.9751, test_loss: 0.9786, test_f1: 0.5136
 epoch: 7, train_loss: 0.9556, test_loss: 0.9437, test_f1: 0.4789
 epoch: 8, train_loss: 0.9522, test_loss: 0.9599, test_f1: 0.5149
 epoch: 9, train_loss: 0.9595, test_loss: 0.9548, test_f1: 0.5583
 epoch: 10, train_loss: 0.9329, test_loss: 0.9551, test_f1: 0.5046
 epoch: 11, train_loss: 0.9068, test_loss: 0.9533, test_f1: 0.5103
 epoch: 12, train_loss: 0.9158, test_loss: 0.9364, test_f1: 0.5249
 epoch: 13, train_loss: 0.9179, test_loss: 0.9481, test_f1: 0.5280
 epoch: 14, train_loss: 0.8923, test_loss: 0.9754, test_f1: 0.4951
 epoch: 15, train_loss: 0.9005, test_loss: 1.0053, test_f1: 0.5249
 epoch: 16, train_loss: 0.9074, test_loss: 0.9900, test_f1: 0.5136
 epoch: 17, train_loss: 0.8966, test_loss: 1.0395, test_f1: 0.5178
 epoch: 18, train_loss: 0.8926, test_loss: 1.0535, test_f1: 0.4996
 epoch: 19, train_loss: 0.8742, test_loss: 1.0707, test_f1: 0.5418
 epoch: 20, train_loss: 0.8805, test_loss: 1.0002, test_f1: 0.5067
 epoch: 21, train_loss: 0.8819, test_loss: 0.9272, test_f1: 0.5182
 epoch: 22, train_loss: 0.8687, test_loss: 0.9574, test_f1: 0.5259
 epoch: 23, train_loss: 0.9805, test_loss: 0.9152, test_f1: 0.5231
 epoch: 24, train_loss: 0.9259, test_loss: 0.9827, test_f1: 0.5262
 epoch: 25, train_loss: 0.9302, test_loss: 1.0250, test_f1: 0.5279
 epoch: 26, train_loss: 0.8943, test_loss: 1.1940, test_f1: 0.4908
 epoch: 27, train_loss: 0.8786, test_loss: 1.0473, test_f1: 0.4870
 epoch: 28, train_loss: 0.8868, test_loss: 1.1020, test_f1: 0.4866
 epoch: 29, train_loss: 0.8620, test_loss: 1.2975, test_f1: 0.4721
 epoch: 30, train_loss: 0.8699, test_loss: 1.2240, test_f1: 0.4899
 epoch: 31, train_loss: 0.8439, test_loss: 1.2016, test_f1: 0.4929
 epoch: 32, train_loss: 0.8637, test_loss: 1.1788, test_f1: 0.5002
 epoch: 33, train_loss: 0.8456, test_loss: 1.1485, test_f1: 0.4997
 epoch: 34, train_loss: 0.8356, test_loss: 1.3146, test_f1: 0.4998
 epoch: 35, train_loss: 0.8409, test_loss: 1.1526, test_f1: 0.4968
 epoch: 36, train_loss: 0.8328, test_loss: 1.2800, test_f1: 0.5206
 epoch: 37, train_loss: 0.8490, test_loss: 1.0585, test_f1: 0.4959
 epoch: 38, train_loss: 0.8711, test_loss: 1.1041, test_f1: 0.4955
 epoch: 39, train_loss: 0.8544, test_loss: 1.3679, test_f1: 0.5023
 epoch: 40, train_loss: 0.8351, test_loss: 1.0065, test_f1: 0.5623
 epoch: 41, train_loss: 0.8619, test_loss: 1.2413, test_f1: 0.5116
 epoch: 42, train_loss: 0.8430, test_loss: 1.2588, test_f1: 0.5252
 epoch: 43, train_loss: 0.8298, test_loss: 1.1483, test_f1: 0.5195
 epoch: 44, train_loss: 0.8161, test_loss: 1.0015, test_f1: 0.4968
 epoch: 45, train_loss: 0.8299, test_loss: 1.2404, test_f1: 0.5399
 epoch: 46, train_loss: 0.8170, test_loss: 1.0704, test_f1: 0.5033
 epoch: 47, train_loss: 0.8062, test_loss: 1.2216, test_f1: 0.5061
 epoch: 48, train_loss: 0.8118, test_loss: 1.1520, test_f1: 0.4951
 epoch: 49, train_loss: 0.8251, test_loss: 1.6119, test_f1: 0.4957
 epoch: 50, train_loss: 0.8129, test_loss: 1.3439, test_f1: 0.5496
 epoch: 51, train_loss: 0.7960, test_loss: 1.0869, test_f1: 0.5610
 epoch: 52, train_loss: 0.7687, test_loss: 1.0887, test_f1: 0.5411
 epoch: 53, train_loss: 0.7697, test_loss: 1.3785, test_f1: 0.5313
 epoch: 54, train_loss: 0.7665, test_loss: 1.1098, test_f1: 0.5287
 epoch: 55, train_loss: 0.7644, test_loss: 1.0978, test_f1: 0.5406
 epoch: 56, train_loss: 0.7518, test_loss: 1.0538, test_f1: 0.5141
 epoch: 57, train_loss: 0.7567, test_loss: 1.1384, test_f1: 0.5519
 epoch: 58, train_loss: 0.7478, test_loss: 1.1447, test_f1: 0.5406
 epoch: 59, train_loss: 0.7567, test_loss: 1.1117, test_f1: 0.5856
 epoch: 60, train_loss: 0.7448, test_loss: 1.3043, test_f1: 0.5688
 epoch: 61, train_loss: 0.7234, test_loss: 1.1889, test_f1: 0.6057
 epoch: 62, train_loss: 0.7219, test_loss: 1.3832, test_f1: 0.5494
 epoch: 63, train_loss: 0.7256, test_loss: 0.9530, test_f1: 0.5940
 epoch: 64, train_loss: 0.7294, test_loss: 1.3069, test_f1: 0.5724
 epoch: 65, train_loss: 0.7320, test_loss: 1.0689, test_f1: 0.5908
 epoch: 66, train_loss: 0.7202, test_loss: 0.9518, test_f1: 0.5810
 epoch: 67, train_loss: 0.7362, test_loss: 1.1324, test_f1: 0.5757
 epoch: 68, train_loss: 0.7197, test_loss: 1.2044, test_f1: 0.5535
 epoch: 69, train_loss: 0.7291, test_loss: 1.3201, test_f1: 0.5471
 epoch: 70, train_loss: 0.7099, test_loss: 2.2003, test_f1: 0.5237
 epoch: 71, train_loss: 0.7152, test_loss: 1.1761, test_f1: 0.5827
 epoch: 72, train_loss: 0.7151, test_loss: 1.1551, test_f1: 0.5799
 epoch: 73, train_loss: 0.7100, test_loss: 1.4878, test_f1: 0.5542
 epoch: 74, train_loss: 0.7000, test_loss: 1.5371, test_f1: 0.5508
 epoch: 75, train_loss: 0.7129, test_loss: 1.3863, test_f1: 0.5459
 epoch: 76, train_loss: 0.6976, test_loss: 1.3770, test_f1: 0.5398
 epoch: 77, train_loss: 0.7066, test_loss: 1.3075, test_f1: 0.5576
 epoch: 78, train_loss: 0.6996, test_loss: 1.1984, test_f1: 0.5711
 epoch: 79, train_loss: 0.7128, test_loss: 1.2301, test_f1: 0.5438
 epoch: 80, train_loss: 0.6823, test_loss: 1.2533, test_f1: 0.5745
 epoch: 81, train_loss: 0.6791, test_loss: 1.0923, test_f1: 0.6110
 epoch: 82, train_loss: 0.6792, test_loss: 1.2684, test_f1: 0.5808
 epoch: 83, train_loss: 0.6780, test_loss: 1.1187, test_f1: 0.6017
 epoch: 84, train_loss: 0.6732, test_loss: 1.4869, test_f1: 0.5694
 epoch: 85, train_loss: 0.6689, test_loss: 1.0886, test_f1: 0.5849
 epoch: 86, train_loss: 0.6693, test_loss: 1.2103, test_f1: 0.5939
 epoch: 87, train_loss: 0.6583, test_loss: 1.2286, test_f1: 0.5773
 epoch: 88, train_loss: 0.7020, test_loss: 1.0428, test_f1: 0.5853
 epoch: 89, train_loss: 0.6770, test_loss: 1.1155, test_f1: 0.5615
 epoch: 90, train_loss: 0.6607, test_loss: 1.0845, test_f1: 0.6006
 epoch: 91, train_loss: 0.6510, test_loss: 1.2036, test_f1: 0.5661
 epoch: 92, train_loss: 0.6506, test_loss: 1.2762, test_f1: 0.5974
 epoch: 93, train_loss: 0.6344, test_loss: 1.2222, test_f1: 0.5820
 epoch: 94, train_loss: 0.6593, test_loss: 1.6409, test_f1: 0.5510
 epoch: 95, train_loss: 0.6488, test_loss: 1.4250, test_f1: 0.5992
 epoch: 96, train_loss: 0.6413, test_loss: 1.1586, test_f1: 0.6036
 epoch: 97, train_loss: 0.6549, test_loss: 1.6150, test_f1: 0.5740
 epoch: 98, train_loss: 0.6539, test_loss: 1.4021, test_f1: 0.5533
 epoch: 99, train_loss: 0.6571, test_loss: 1.2369, test_f1: 0.5773
##################ITERATION #4 ****************************************
 epoch: 0, train_loss: 1.2543, test_loss: 1.1132, test_f1: 0.3915
 epoch: 1, train_loss: 1.1236, test_loss: 1.0188, test_f1: 0.4563
 epoch: 2, train_loss: 1.0652, test_loss: 1.0085, test_f1: 0.4920
 epoch: 3, train_loss: 1.0308, test_loss: 0.9811, test_f1: 0.4773
 epoch: 4, train_loss: 0.9979, test_loss: 1.0279, test_f1: 0.4595
 epoch: 5, train_loss: 0.9963, test_loss: 0.9913, test_f1: 0.4872
 epoch: 6, train_loss: 0.9668, test_loss: 1.0325, test_f1: 0.4848
 epoch: 7, train_loss: 0.9645, test_loss: 0.9973, test_f1: 0.4994
 epoch: 8, train_loss: 0.9652, test_loss: 0.9135, test_f1: 0.5412
 epoch: 9, train_loss: 0.9742, test_loss: 0.9673, test_f1: 0.5374
 epoch: 10, train_loss: 0.9414, test_loss: 0.9775, test_f1: 0.5059
 epoch: 11, train_loss: 0.9375, test_loss: 1.1190, test_f1: 0.5127
 epoch: 12, train_loss: 0.9289, test_loss: 0.9660, test_f1: 0.5235
 epoch: 13, train_loss: 0.9163, test_loss: 1.0309, test_f1: 0.5238
 epoch: 14, train_loss: 0.9131, test_loss: 1.0696, test_f1: 0.5130
 epoch: 15, train_loss: 0.9028, test_loss: 0.9819, test_f1: 0.4997
 epoch: 16, train_loss: 0.8942, test_loss: 0.9967, test_f1: 0.4920
 epoch: 17, train_loss: 0.9149, test_loss: 0.9884, test_f1: 0.5097
 epoch: 18, train_loss: 0.9093, test_loss: 1.0033, test_f1: 0.5114
 epoch: 19, train_loss: 0.8835, test_loss: 0.9970, test_f1: 0.5357
 epoch: 20, train_loss: 0.8936, test_loss: 0.9384, test_f1: 0.5467
 epoch: 21, train_loss: 0.8692, test_loss: 0.9801, test_f1: 0.5080
 epoch: 22, train_loss: 0.8898, test_loss: 0.9426, test_f1: 0.5335
 epoch: 23, train_loss: 0.8775, test_loss: 0.8950, test_f1: 0.5573
 epoch: 24, train_loss: 0.8647, test_loss: 0.9116, test_f1: 0.5488
 epoch: 25, train_loss: 0.8661, test_loss: 0.9518, test_f1: 0.5318
 epoch: 26, train_loss: 0.8522, test_loss: 0.9667, test_f1: 0.5497
 epoch: 27, train_loss: 0.8677, test_loss: 1.1277, test_f1: 0.5229
 epoch: 28, train_loss: 0.8766, test_loss: 0.9188, test_f1: 0.5301
 epoch: 29, train_loss: 0.8562, test_loss: 0.9131, test_f1: 0.5520
 epoch: 30, train_loss: 0.8434, test_loss: 0.9855, test_f1: 0.5284
 epoch: 31, train_loss: 0.8464, test_loss: 1.0330, test_f1: 0.5216
 epoch: 32, train_loss: 0.8671, test_loss: 0.9133, test_f1: 0.5504
 epoch: 33, train_loss: 0.8720, test_loss: 0.9910, test_f1: 0.5577
 epoch: 34, train_loss: 0.8422, test_loss: 0.9860, test_f1: 0.5562
 epoch: 35, train_loss: 0.8262, test_loss: 1.2867, test_f1: 0.4890
 epoch: 36, train_loss: 0.9321, test_loss: 0.9940, test_f1: 0.5602
 epoch: 37, train_loss: 0.8663, test_loss: 0.9687, test_f1: 0.5606
 epoch: 38, train_loss: 0.8405, test_loss: 0.9527, test_f1: 0.5450
 epoch: 39, train_loss: 0.8351, test_loss: 1.2176, test_f1: 0.5123
 epoch: 40, train_loss: 0.8273, test_loss: 0.9623, test_f1: 0.5423
 epoch: 41, train_loss: 0.8218, test_loss: 1.0237, test_f1: 0.5395
 epoch: 42, train_loss: 0.8170, test_loss: 0.9543, test_f1: 0.5622
 epoch: 43, train_loss: 0.8410, test_loss: 0.9989, test_f1: 0.5508
 epoch: 44, train_loss: 0.8234, test_loss: 0.9521, test_f1: 0.5550
 epoch: 45, train_loss: 0.8113, test_loss: 0.8740, test_f1: 0.5686
 epoch: 46, train_loss: 0.8391, test_loss: 0.9803, test_f1: 0.5201
 epoch: 47, train_loss: 0.8012, test_loss: 0.9347, test_f1: 0.5482
 epoch: 48, train_loss: 0.8068, test_loss: 1.0492, test_f1: 0.5200
 epoch: 49, train_loss: 0.7902, test_loss: 0.9952, test_f1: 0.5324
 epoch: 50, train_loss: 0.8161, test_loss: 1.0138, test_f1: 0.5695
 epoch: 51, train_loss: 0.7658, test_loss: 0.9184, test_f1: 0.5587
 epoch: 52, train_loss: 0.7722, test_loss: 0.9813, test_f1: 0.5309
 epoch: 53, train_loss: 0.7342, test_loss: 1.1354, test_f1: 0.5424
 epoch: 54, train_loss: 0.7510, test_loss: 0.9487, test_f1: 0.5809
 epoch: 55, train_loss: 0.7391, test_loss: 0.9651, test_f1: 0.5693
 epoch: 56, train_loss: 0.7186, test_loss: 0.8923, test_f1: 0.5713
 epoch: 57, train_loss: 0.7320, test_loss: 0.9398, test_f1: 0.5752
 epoch: 58, train_loss: 0.7223, test_loss: 0.9605, test_f1: 0.5831
 epoch: 59, train_loss: 0.7089, test_loss: 0.9699, test_f1: 0.5584
 epoch: 60, train_loss: 0.7092, test_loss: 1.0088, test_f1: 0.5373
 epoch: 61, train_loss: 0.7128, test_loss: 0.9840, test_f1: 0.5536
 epoch: 62, train_loss: 0.7039, test_loss: 1.0208, test_f1: 0.5672
 epoch: 63, train_loss: 0.7294, test_loss: 0.9825, test_f1: 0.5666
 epoch: 64, train_loss: 0.7063, test_loss: 1.0372, test_f1: 0.5843
 epoch: 65, train_loss: 0.7074, test_loss: 1.0689, test_f1: 0.5561
 epoch: 66, train_loss: 0.7032, test_loss: 1.0611, test_f1: 0.5510
 epoch: 67, train_loss: 0.6978, test_loss: 0.9768, test_f1: 0.5892
 epoch: 68, train_loss: 0.6917, test_loss: 1.0758, test_f1: 0.5463
 epoch: 69, train_loss: 0.6752, test_loss: 1.3606, test_f1: 0.5670
 epoch: 70, train_loss: 0.6835, test_loss: 1.1590, test_f1: 0.5592
 epoch: 71, train_loss: 0.6909, test_loss: 0.9777, test_f1: 0.5681
 epoch: 72, train_loss: 0.6792, test_loss: 1.0207, test_f1: 0.5624
 epoch: 73, train_loss: 0.6936, test_loss: 1.0023, test_f1: 0.5927
 epoch: 74, train_loss: 0.6873, test_loss: 1.0774, test_f1: 0.5548
 epoch: 75, train_loss: 0.6720, test_loss: 1.2508, test_f1: 0.5647
 epoch: 76, train_loss: 0.6603, test_loss: 1.2670, test_f1: 0.5401
 epoch: 77, train_loss: 0.6779, test_loss: 1.2468, test_f1: 0.5524
 epoch: 78, train_loss: 0.6617, test_loss: 1.2634, test_f1: 0.5450
 epoch: 79, train_loss: 0.6772, test_loss: 1.2848, test_f1: 0.5679
 epoch: 80, train_loss: 0.6569, test_loss: 1.0704, test_f1: 0.5667
 epoch: 81, train_loss: 0.6495, test_loss: 1.1358, test_f1: 0.5731
 epoch: 82, train_loss: 0.6490, test_loss: 1.2424, test_f1: 0.5611
 epoch: 83, train_loss: 0.6484, test_loss: 1.0661, test_f1: 0.5484
 epoch: 84, train_loss: 0.6864, test_loss: 1.0241, test_f1: 0.5749
 epoch: 85, train_loss: 0.6437, test_loss: 1.3339, test_f1: 0.5843
 epoch: 86, train_loss: 0.6574, test_loss: 1.1246, test_f1: 0.5689
 epoch: 87, train_loss: 0.6336, test_loss: 1.2659, test_f1: 0.5439
 epoch: 88, train_loss: 0.6514, test_loss: 1.2452, test_f1: 0.5722
 epoch: 89, train_loss: 0.6731, test_loss: 1.3153, test_f1: 0.5686
 epoch: 90, train_loss: 0.6545, test_loss: 1.2036, test_f1: 0.5814
 epoch: 91, train_loss: 0.6499, test_loss: 1.1425, test_f1: 0.5557
 epoch: 92, train_loss: 0.6439, test_loss: 1.1481, test_f1: 0.5404
 epoch: 93, train_loss: 0.6411, test_loss: 1.2265, test_f1: 0.5685
 epoch: 94, train_loss: 0.6577, test_loss: 1.3605, test_f1: 0.5447
 epoch: 95, train_loss: 0.6251, test_loss: 1.2347, test_f1: 0.5748
 epoch: 96, train_loss: 0.6375, test_loss: 1.1684, test_f1: 0.5616
 epoch: 97, train_loss: 0.6561, test_loss: 1.3241, test_f1: 0.5408
 epoch: 98, train_loss: 0.6261, test_loss: 1.1558, test_f1: 0.5733
 epoch: 99, train_loss: 0.6307, test_loss: 1.1476, test_f1: 0.5800
##################ITERATION #5 ****************************************
 epoch: 0, train_loss: 1.2669, test_loss: 1.0943, test_f1: 0.4268
 epoch: 1, train_loss: 1.1239, test_loss: 1.0253, test_f1: 0.4268
 epoch: 2, train_loss: 1.0612, test_loss: 0.9349, test_f1: 0.4741
 epoch: 3, train_loss: 1.0318, test_loss: 1.0022, test_f1: 0.4753
 epoch: 4, train_loss: 1.0011, test_loss: 1.0135, test_f1: 0.4713
 epoch: 5, train_loss: 0.9851, test_loss: 0.9704, test_f1: 0.5010
 epoch: 6, train_loss: 0.9546, test_loss: 1.0440, test_f1: 0.4550
 epoch: 7, train_loss: 0.9531, test_loss: 0.9732, test_f1: 0.5121
 epoch: 8, train_loss: 0.9493, test_loss: 0.9888, test_f1: 0.4773
 epoch: 9, train_loss: 0.9581, test_loss: 0.9290, test_f1: 0.4970
 epoch: 10, train_loss: 0.9287, test_loss: 0.9843, test_f1: 0.5032
 epoch: 11, train_loss: 0.9302, test_loss: 1.0187, test_f1: 0.4956
 epoch: 12, train_loss: 0.8991, test_loss: 0.9797, test_f1: 0.5333
 epoch: 13, train_loss: 0.9084, test_loss: 1.0045, test_f1: 0.4934
 epoch: 14, train_loss: 0.9126, test_loss: 1.0167, test_f1: 0.5597
 epoch: 15, train_loss: 0.8977, test_loss: 1.0673, test_f1: 0.5108
 epoch: 16, train_loss: 0.8952, test_loss: 1.0428, test_f1: 0.5213
 epoch: 17, train_loss: 0.8969, test_loss: 0.9921, test_f1: 0.5234
 epoch: 18, train_loss: 0.8828, test_loss: 0.9329, test_f1: 0.5522
 epoch: 19, train_loss: 0.8811, test_loss: 1.0281, test_f1: 0.5057
 epoch: 20, train_loss: 0.8788, test_loss: 1.0898, test_f1: 0.5200
 epoch: 21, train_loss: 0.8652, test_loss: 1.0321, test_f1: 0.5194
 epoch: 22, train_loss: 0.8617, test_loss: 0.9993, test_f1: 0.5734
 epoch: 23, train_loss: 0.8730, test_loss: 0.9947, test_f1: 0.5421
 epoch: 24, train_loss: 0.8673, test_loss: 0.9833, test_f1: 0.5171
 epoch: 25, train_loss: 0.8737, test_loss: 0.9825, test_f1: 0.5351
 epoch: 26, train_loss: 0.8563, test_loss: 0.9909, test_f1: 0.5812
 epoch: 27, train_loss: 0.8593, test_loss: 0.9822, test_f1: 0.5245
 epoch: 28, train_loss: 0.8492, test_loss: 1.0513, test_f1: 0.4939
 epoch: 29, train_loss: 0.8758, test_loss: 0.9192, test_f1: 0.5535
 epoch: 30, train_loss: 0.8858, test_loss: 1.0214, test_f1: 0.5408
 epoch: 31, train_loss: 0.8368, test_loss: 1.0870, test_f1: 0.5395
 epoch: 32, train_loss: 0.8314, test_loss: 1.0023, test_f1: 0.5092
 epoch: 33, train_loss: 0.8481, test_loss: 0.9530, test_f1: 0.5535
 epoch: 34, train_loss: 0.8413, test_loss: 0.9004, test_f1: 0.5428
 epoch: 35, train_loss: 0.8283, test_loss: 1.0024, test_f1: 0.5660
 epoch: 36, train_loss: 0.8153, test_loss: 0.9565, test_f1: 0.5515
 epoch: 37, train_loss: 0.8210, test_loss: 0.9549, test_f1: 0.5282
 epoch: 38, train_loss: 0.8110, test_loss: 0.9741, test_f1: 0.5734
 epoch: 39, train_loss: 0.8232, test_loss: 0.9968, test_f1: 0.5607
 epoch: 40, train_loss: 0.8324, test_loss: 0.9625, test_f1: 0.5604
 epoch: 41, train_loss: 0.7957, test_loss: 0.9153, test_f1: 0.5312
 epoch: 42, train_loss: 0.8114, test_loss: 0.9760, test_f1: 0.5602
 epoch: 43, train_loss: 0.8015, test_loss: 0.9553, test_f1: 0.5510
 epoch: 44, train_loss: 0.8057, test_loss: 0.9648, test_f1: 0.5693
 epoch: 45, train_loss: 0.8085, test_loss: 0.9827, test_f1: 0.5597
 epoch: 46, train_loss: 0.7814, test_loss: 1.0073, test_f1: 0.5525
 epoch: 47, train_loss: 0.7868, test_loss: 0.9928, test_f1: 0.5657
 epoch: 48, train_loss: 0.7882, test_loss: 1.0300, test_f1: 0.5324
 epoch: 49, train_loss: 0.7814, test_loss: 1.0573, test_f1: 0.5202
 epoch: 50, train_loss: 0.7778, test_loss: 0.9869, test_f1: 0.5314
 epoch: 51, train_loss: 0.7432, test_loss: 1.0176, test_f1: 0.5751
 epoch: 52, train_loss: 0.7178, test_loss: 0.9329, test_f1: 0.5702
 epoch: 53, train_loss: 0.7221, test_loss: 0.9811, test_f1: 0.5565
 epoch: 54, train_loss: 0.7208, test_loss: 1.1074, test_f1: 0.5852
 epoch: 55, train_loss: 0.7127, test_loss: 1.0167, test_f1: 0.5570
 epoch: 56, train_loss: 0.7080, test_loss: 1.1726, test_f1: 0.5582
 epoch: 57, train_loss: 0.7167, test_loss: 1.0558, test_f1: 0.5830
 epoch: 58, train_loss: 0.7077, test_loss: 1.0697, test_f1: 0.5775
 epoch: 59, train_loss: 0.6972, test_loss: 1.0844, test_f1: 0.5648
 epoch: 60, train_loss: 0.7013, test_loss: 1.0850, test_f1: 0.5741
 epoch: 61, train_loss: 0.6966, test_loss: 0.9548, test_f1: 0.6007
 epoch: 62, train_loss: 0.6847, test_loss: 0.9888, test_f1: 0.5806
 epoch: 63, train_loss: 0.6985, test_loss: 1.0952, test_f1: 0.5752
 epoch: 64, train_loss: 0.6867, test_loss: 1.0706, test_f1: 0.5549
 epoch: 65, train_loss: 0.6987, test_loss: 1.0506, test_f1: 0.5910
 epoch: 66, train_loss: 0.6807, test_loss: 1.0677, test_f1: 0.5824
 epoch: 67, train_loss: 0.6808, test_loss: 1.0211, test_f1: 0.5942
 epoch: 68, train_loss: 0.6727, test_loss: 1.1671, test_f1: 0.5935
 epoch: 69, train_loss: 0.7080, test_loss: 1.0408, test_f1: 0.5833
 epoch: 70, train_loss: 0.6653, test_loss: 1.0520, test_f1: 0.6002
 epoch: 71, train_loss: 0.7119, test_loss: 1.1251, test_f1: 0.5636
 epoch: 72, train_loss: 0.6739, test_loss: 1.0885, test_f1: 0.5805
 epoch: 73, train_loss: 0.6689, test_loss: 1.2129, test_f1: 0.5333
 epoch: 74, train_loss: 0.6482, test_loss: 1.1091, test_f1: 0.5897
 epoch: 75, train_loss: 0.6534, test_loss: 1.1547, test_f1: 0.5721
 epoch: 76, train_loss: 0.6438, test_loss: 1.1349, test_f1: 0.5927
 epoch: 77, train_loss: 0.6511, test_loss: 1.0212, test_f1: 0.5892
 epoch: 78, train_loss: 0.6423, test_loss: 1.1201, test_f1: 0.5949
 epoch: 79, train_loss: 0.6583, test_loss: 1.1264, test_f1: 0.5876
 epoch: 80, train_loss: 0.6521, test_loss: 1.2770, test_f1: 0.5819
 epoch: 81, train_loss: 0.6484, test_loss: 1.1651, test_f1: 0.5890
 epoch: 82, train_loss: 0.6357, test_loss: 1.1756, test_f1: 0.5767
 epoch: 83, train_loss: 0.6365, test_loss: 1.2204, test_f1: 0.5822
 epoch: 84, train_loss: 0.6247, test_loss: 1.3029, test_f1: 0.6058
 epoch: 85, train_loss: 0.6472, test_loss: 1.2197, test_f1: 0.5775
 epoch: 86, train_loss: 0.6336, test_loss: 1.3858, test_f1: 0.5300
 epoch: 87, train_loss: 0.6487, test_loss: 1.1256, test_f1: 0.5864
 epoch: 88, train_loss: 0.6368, test_loss: 1.1454, test_f1: 0.6061
 epoch: 89, train_loss: 0.6200, test_loss: 1.3161, test_f1: 0.5872
 epoch: 90, train_loss: 0.6291, test_loss: 1.1095, test_f1: 0.5932
 epoch: 91, train_loss: 0.6055, test_loss: 1.1769, test_f1: 0.5834
 epoch: 92, train_loss: 0.6155, test_loss: 1.2852, test_f1: 0.5673
 epoch: 93, train_loss: 0.6269, test_loss: 1.2189, test_f1: 0.5588
 epoch: 94, train_loss: 0.5951, test_loss: 1.3503, test_f1: 0.5839
 epoch: 95, train_loss: 0.6128, test_loss: 1.1399, test_f1: 0.5837
 epoch: 96, train_loss: 0.5957, test_loss: 1.4312, test_f1: 0.5463
 epoch: 97, train_loss: 0.5902, test_loss: 1.3479, test_f1: 0.5655
 epoch: 98, train_loss: 0.6101, test_loss: 1.3546, test_f1: 0.5398
 epoch: 99, train_loss: 0.5793, test_loss: 1.3255, test_f1: 0.5780
##################ITERATION #6 ****************************************
 epoch: 0, train_loss: 1.2793, test_loss: 1.1877, test_f1: 0.3946
 epoch: 1, train_loss: 1.1382, test_loss: 1.0394, test_f1: 0.4587
 epoch: 2, train_loss: 1.0950, test_loss: 1.1064, test_f1: 0.4274
 epoch: 3, train_loss: 1.0514, test_loss: 0.9383, test_f1: 0.4784
 epoch: 4, train_loss: 1.0436, test_loss: 1.0117, test_f1: 0.5248
 epoch: 5, train_loss: 1.0097, test_loss: 0.9854, test_f1: 0.5136
 epoch: 6, train_loss: 0.9994, test_loss: 0.9915, test_f1: 0.4548
 epoch: 7, train_loss: 0.9670, test_loss: 1.0411, test_f1: 0.5038
 epoch: 8, train_loss: 0.9679, test_loss: 1.0604, test_f1: 0.5015
 epoch: 9, train_loss: 0.9709, test_loss: 1.0580, test_f1: 0.5215
 epoch: 10, train_loss: 0.9517, test_loss: 1.0180, test_f1: 0.5127
 epoch: 11, train_loss: 0.9260, test_loss: 1.0255, test_f1: 0.4837
 epoch: 12, train_loss: 0.9335, test_loss: 0.9885, test_f1: 0.5132
 epoch: 13, train_loss: 0.9257, test_loss: 0.9421, test_f1: 0.5087
 epoch: 14, train_loss: 0.9164, test_loss: 1.0803, test_f1: 0.5048
 epoch: 15, train_loss: 0.9166, test_loss: 1.0109, test_f1: 0.4825
 epoch: 16, train_loss: 0.9182, test_loss: 1.0529, test_f1: 0.5049
 epoch: 17, train_loss: 0.8959, test_loss: 0.9898, test_f1: 0.4886
 epoch: 18, train_loss: 0.8818, test_loss: 0.9727, test_f1: 0.5606
 epoch: 19, train_loss: 0.8865, test_loss: 1.0029, test_f1: 0.5120
 epoch: 20, train_loss: 0.8991, test_loss: 0.9780, test_f1: 0.5049
 epoch: 21, train_loss: 0.8937, test_loss: 0.9628, test_f1: 0.5411
 epoch: 22, train_loss: 0.8838, test_loss: 1.0114, test_f1: 0.5023
 epoch: 23, train_loss: 0.8798, test_loss: 0.9445, test_f1: 0.5496
 epoch: 24, train_loss: 0.8659, test_loss: 1.0110, test_f1: 0.5202
 epoch: 25, train_loss: 0.8622, test_loss: 1.0630, test_f1: 0.5356
 epoch: 26, train_loss: 0.8605, test_loss: 1.0099, test_f1: 0.5028
 epoch: 27, train_loss: 0.8474, test_loss: 1.0184, test_f1: 0.4984
 epoch: 28, train_loss: 0.8487, test_loss: 1.0192, test_f1: 0.4930
 epoch: 29, train_loss: 0.8512, test_loss: 1.0444, test_f1: 0.5239
 epoch: 30, train_loss: 0.8583, test_loss: 1.0166, test_f1: 0.5394
 epoch: 31, train_loss: 0.8615, test_loss: 0.9594, test_f1: 0.5624
 epoch: 32, train_loss: 0.8477, test_loss: 0.9785, test_f1: 0.5294
 epoch: 33, train_loss: 0.8349, test_loss: 1.1723, test_f1: 0.5622
 epoch: 34, train_loss: 0.8206, test_loss: 1.1830, test_f1: 0.5100
 epoch: 35, train_loss: 0.8424, test_loss: 1.2740, test_f1: 0.4959
 epoch: 36, train_loss: 0.8317, test_loss: 1.0184, test_f1: 0.5518
 epoch: 37, train_loss: 0.8357, test_loss: 0.9906, test_f1: 0.5602
 epoch: 38, train_loss: 0.8288, test_loss: 1.2653, test_f1: 0.5450
 epoch: 39, train_loss: 0.8168, test_loss: 1.0663, test_f1: 0.5608
 epoch: 40, train_loss: 0.8199, test_loss: 1.0378, test_f1: 0.5132
 epoch: 41, train_loss: 0.8189, test_loss: 1.1570, test_f1: 0.5305
 epoch: 42, train_loss: 0.8264, test_loss: 1.2687, test_f1: 0.5138
 epoch: 43, train_loss: 0.8257, test_loss: 1.2297, test_f1: 0.5487
 epoch: 44, train_loss: 0.8214, test_loss: 1.1030, test_f1: 0.5535
 epoch: 45, train_loss: 0.7937, test_loss: 1.1982, test_f1: 0.5162
 epoch: 46, train_loss: 0.8149, test_loss: 1.0344, test_f1: 0.5482
 epoch: 47, train_loss: 0.7918, test_loss: 1.2178, test_f1: 0.5520
 epoch: 48, train_loss: 0.8076, test_loss: 0.9991, test_f1: 0.5436
 epoch: 49, train_loss: 0.8075, test_loss: 1.1345, test_f1: 0.5587
 epoch: 50, train_loss: 0.7831, test_loss: 1.0604, test_f1: 0.5570
 epoch: 51, train_loss: 0.7505, test_loss: 1.0557, test_f1: 0.5568
 epoch: 52, train_loss: 0.7312, test_loss: 1.0056, test_f1: 0.5763
 epoch: 53, train_loss: 0.7256, test_loss: 1.0936, test_f1: 0.5428
 epoch: 54, train_loss: 0.7389, test_loss: 1.1451, test_f1: 0.5730
 epoch: 55, train_loss: 0.7336, test_loss: 1.0707, test_f1: 0.5378
 epoch: 56, train_loss: 0.7137, test_loss: 1.0870, test_f1: 0.5347
 epoch: 57, train_loss: 0.7107, test_loss: 1.0929, test_f1: 0.5661
 epoch: 58, train_loss: 0.7206, test_loss: 1.1513, test_f1: 0.5494
 epoch: 59, train_loss: 0.7047, test_loss: 1.3171, test_f1: 0.5123
 epoch: 60, train_loss: 0.7060, test_loss: 1.2145, test_f1: 0.5304
 epoch: 61, train_loss: 0.7047, test_loss: 1.1433, test_f1: 0.5731
 epoch: 62, train_loss: 0.6891, test_loss: 1.2755, test_f1: 0.5455
 epoch: 63, train_loss: 0.6941, test_loss: 1.3232, test_f1: 0.5476
 epoch: 64, train_loss: 0.6933, test_loss: 1.2899, test_f1: 0.5509
 epoch: 65, train_loss: 0.6843, test_loss: 1.3828, test_f1: 0.5382
 epoch: 66, train_loss: 0.7449, test_loss: 1.1152, test_f1: 0.5783
 epoch: 67, train_loss: 0.7238, test_loss: 1.1534, test_f1: 0.5384
 epoch: 68, train_loss: 0.7313, test_loss: 1.1480, test_f1: 0.5699
 epoch: 69, train_loss: 0.6996, test_loss: 1.1589, test_f1: 0.5561
 epoch: 70, train_loss: 0.6816, test_loss: 1.3059, test_f1: 0.5464
 epoch: 71, train_loss: 0.7034, test_loss: 1.0361, test_f1: 0.5554
 epoch: 72, train_loss: 0.6832, test_loss: 1.1734, test_f1: 0.5473
 epoch: 73, train_loss: 0.6699, test_loss: 1.1320, test_f1: 0.5500
 epoch: 74, train_loss: 0.6797, test_loss: 1.1156, test_f1: 0.5303
 epoch: 75, train_loss: 0.6913, test_loss: 1.0775, test_f1: 0.5665
 epoch: 76, train_loss: 0.6628, test_loss: 1.1340, test_f1: 0.5623
 epoch: 77, train_loss: 0.6575, test_loss: 1.2578, test_f1: 0.5586
 epoch: 78, train_loss: 0.6520, test_loss: 1.1202, test_f1: 0.5485
 epoch: 79, train_loss: 0.6850, test_loss: 1.1013, test_f1: 0.5773
 epoch: 80, train_loss: 0.6347, test_loss: 1.1100, test_f1: 0.5904
 epoch: 81, train_loss: 0.6558, test_loss: 1.0954, test_f1: 0.5703
 epoch: 82, train_loss: 0.6590, test_loss: 1.3055, test_f1: 0.5509
 epoch: 83, train_loss: 0.6618, test_loss: 1.2345, test_f1: 0.5549
 epoch: 84, train_loss: 0.6466, test_loss: 1.1833, test_f1: 0.5662
 epoch: 85, train_loss: 0.6585, test_loss: 1.2609, test_f1: 0.5631
 epoch: 86, train_loss: 0.6409, test_loss: 1.2784, test_f1: 0.5595
 epoch: 87, train_loss: 0.6349, test_loss: 1.2549, test_f1: 0.5730
 epoch: 88, train_loss: 0.6496, test_loss: 1.2159, test_f1: 0.5612
 epoch: 89, train_loss: 0.6472, test_loss: 1.1568, test_f1: 0.5646
 epoch: 90, train_loss: 0.6304, test_loss: 1.2406, test_f1: 0.5594
 epoch: 91, train_loss: 0.6273, test_loss: 1.3504, test_f1: 0.5488
 epoch: 92, train_loss: 0.6278, test_loss: 1.2955, test_f1: 0.5966
 epoch: 93, train_loss: 0.6401, test_loss: 1.3530, test_f1: 0.5306
 epoch: 94, train_loss: 0.6400, test_loss: 1.2348, test_f1: 0.5734
 epoch: 95, train_loss: 0.6392, test_loss: 1.2832, test_f1: 0.5665
 epoch: 96, train_loss: 0.6230, test_loss: 1.2395, test_f1: 0.5752
 epoch: 97, train_loss: 0.6283, test_loss: 1.1205, test_f1: 0.5719
 epoch: 98, train_loss: 0.6239, test_loss: 1.0877, test_f1: 0.5690
 epoch: 99, train_loss: 0.6058, test_loss: 1.3026, test_f1: 0.5526
##################ITERATION #7 ****************************************
 epoch: 0, train_loss: 1.2773, test_loss: 1.1963, test_f1: 0.3384
 epoch: 1, train_loss: 1.1488, test_loss: 1.0960, test_f1: 0.4181
 epoch: 2, train_loss: 1.0786, test_loss: 0.9854, test_f1: 0.4782
 epoch: 3, train_loss: 1.0401, test_loss: 1.0012, test_f1: 0.4880
 epoch: 4, train_loss: 1.0083, test_loss: 1.0095, test_f1: 0.4863
 epoch: 5, train_loss: 0.9774, test_loss: 0.9003, test_f1: 0.5152
 epoch: 6, train_loss: 0.9798, test_loss: 0.9956, test_f1: 0.4672
 epoch: 7, train_loss: 0.9816, test_loss: 1.2310, test_f1: 0.4467
 epoch: 8, train_loss: 0.9550, test_loss: 1.0374, test_f1: 0.4802
 epoch: 9, train_loss: 0.9414, test_loss: 0.9945, test_f1: 0.5265
 epoch: 10, train_loss: 0.9529, test_loss: 1.1123, test_f1: 0.4782
 epoch: 11, train_loss: 0.9371, test_loss: 1.0354, test_f1: 0.4998
 epoch: 12, train_loss: 0.9310, test_loss: 1.0135, test_f1: 0.4721
 epoch: 13, train_loss: 0.9232, test_loss: 0.9737, test_f1: 0.5033
 epoch: 14, train_loss: 0.9070, test_loss: 1.1252, test_f1: 0.4696
 epoch: 15, train_loss: 0.9299, test_loss: 1.1079, test_f1: 0.4771
 epoch: 16, train_loss: 0.9044, test_loss: 1.0405, test_f1: 0.4977
 epoch: 17, train_loss: 0.8997, test_loss: 1.0198, test_f1: 0.4840
 epoch: 18, train_loss: 0.8729, test_loss: 1.0323, test_f1: 0.5516
 epoch: 19, train_loss: 0.8821, test_loss: 0.9970, test_f1: 0.5004
 epoch: 20, train_loss: 0.8816, test_loss: 1.0138, test_f1: 0.5299
 epoch: 21, train_loss: 0.8737, test_loss: 1.0366, test_f1: 0.5270
 epoch: 22, train_loss: 0.8666, test_loss: 1.0204, test_f1: 0.5165
 epoch: 23, train_loss: 0.8814, test_loss: 1.0308, test_f1: 0.5184
 epoch: 24, train_loss: 0.8600, test_loss: 1.0589, test_f1: 0.4972
 epoch: 25, train_loss: 0.8547, test_loss: 1.0380, test_f1: 0.5090
 epoch: 26, train_loss: 0.8948, test_loss: 1.0349, test_f1: 0.5362
 epoch: 27, train_loss: 0.8647, test_loss: 0.9779, test_f1: 0.5552
 epoch: 28, train_loss: 0.8632, test_loss: 0.9428, test_f1: 0.5311
 epoch: 29, train_loss: 0.8554, test_loss: 1.0175, test_f1: 0.5245
 epoch: 30, train_loss: 0.8465, test_loss: 1.0265, test_f1: 0.5210
 epoch: 31, train_loss: 0.8437, test_loss: 1.0364, test_f1: 0.5368
 epoch: 32, train_loss: 0.8445, test_loss: 1.0121, test_f1: 0.5381
 epoch: 33, train_loss: 0.8289, test_loss: 1.0790, test_f1: 0.5150
 epoch: 34, train_loss: 0.8309, test_loss: 1.0354, test_f1: 0.5135
 epoch: 35, train_loss: 0.8168, test_loss: 1.0955, test_f1: 0.5633
 epoch: 36, train_loss: 0.8348, test_loss: 0.9695, test_f1: 0.5447
 epoch: 37, train_loss: 0.8019, test_loss: 1.0387, test_f1: 0.5723
 epoch: 38, train_loss: 0.8123, test_loss: 0.9974, test_f1: 0.5202
 epoch: 39, train_loss: 0.8074, test_loss: 1.1027, test_f1: 0.5523
 epoch: 40, train_loss: 0.8063, test_loss: 1.1096, test_f1: 0.5146
 epoch: 41, train_loss: 0.8141, test_loss: 0.9737, test_f1: 0.5666
 epoch: 42, train_loss: 0.7947, test_loss: 1.0738, test_f1: 0.5238
 epoch: 43, train_loss: 0.8433, test_loss: 1.0504, test_f1: 0.5684
 epoch: 44, train_loss: 0.8035, test_loss: 1.1318, test_f1: 0.5360
 epoch: 45, train_loss: 0.8099, test_loss: 1.0415, test_f1: 0.5789
 epoch: 46, train_loss: 0.7786, test_loss: 0.9790, test_f1: 0.5405
 epoch: 47, train_loss: 0.7877, test_loss: 1.1444, test_f1: 0.5726
 epoch: 48, train_loss: 0.7588, test_loss: 1.4052, test_f1: 0.5777
 epoch: 49, train_loss: 1.0498, test_loss: 0.9423, test_f1: 0.5098
 epoch: 50, train_loss: 0.8992, test_loss: 0.9304, test_f1: 0.5390
 epoch: 51, train_loss: 0.8109, test_loss: 0.9796, test_f1: 0.5366
 epoch: 52, train_loss: 0.7907, test_loss: 0.9585, test_f1: 0.5491
 epoch: 53, train_loss: 0.7742, test_loss: 1.0804, test_f1: 0.5639
 epoch: 54, train_loss: 0.7765, test_loss: 1.0652, test_f1: 0.5443
 epoch: 55, train_loss: 0.7514, test_loss: 0.9742, test_f1: 0.5386
 epoch: 56, train_loss: 0.7526, test_loss: 1.0141, test_f1: 0.5666
 epoch: 57, train_loss: 0.7389, test_loss: 1.1359, test_f1: 0.5649
 epoch: 58, train_loss: 0.7438, test_loss: 1.0803, test_f1: 0.5898
 epoch: 59, train_loss: 0.7347, test_loss: 1.0525, test_f1: 0.5832
 epoch: 60, train_loss: 0.7334, test_loss: 1.0836, test_f1: 0.5671
 epoch: 61, train_loss: 0.7572, test_loss: 1.0396, test_f1: 0.5614
 epoch: 62, train_loss: 0.7282, test_loss: 1.0156, test_f1: 0.5653
 epoch: 63, train_loss: 0.7174, test_loss: 1.0438, test_f1: 0.5644
 epoch: 64, train_loss: 0.7113, test_loss: 0.9875, test_f1: 0.5774
 epoch: 65, train_loss: 0.6988, test_loss: 1.0585, test_f1: 0.5845
 epoch: 66, train_loss: 0.7148, test_loss: 1.1785, test_f1: 0.5679
 epoch: 67, train_loss: 0.7052, test_loss: 1.0529, test_f1: 0.5842
 epoch: 68, train_loss: 0.6984, test_loss: 1.0566, test_f1: 0.5745
 epoch: 69, train_loss: 0.6952, test_loss: 1.1516, test_f1: 0.5714
 epoch: 70, train_loss: 0.6893, test_loss: 1.2122, test_f1: 0.5882
 epoch: 71, train_loss: 0.6794, test_loss: 1.1482, test_f1: 0.5601
 epoch: 72, train_loss: 0.6841, test_loss: 1.1366, test_f1: 0.5724
 epoch: 73, train_loss: 0.6840, test_loss: 1.1283, test_f1: 0.5659
 epoch: 74, train_loss: 0.6782, test_loss: 1.1960, test_f1: 0.6056
 epoch: 75, train_loss: 0.6931, test_loss: 1.1140, test_f1: 0.5791
 epoch: 76, train_loss: 0.6688, test_loss: 1.1185, test_f1: 0.5551
 epoch: 77, train_loss: 0.6789, test_loss: 1.0824, test_f1: 0.5632
 epoch: 78, train_loss: 0.6560, test_loss: 1.1869, test_f1: 0.5714
 epoch: 79, train_loss: 0.6620, test_loss: 1.1900, test_f1: 0.5650
 epoch: 80, train_loss: 0.6803, test_loss: 1.0512, test_f1: 0.5779
 epoch: 81, train_loss: 0.6498, test_loss: 1.1423, test_f1: 0.5632
 epoch: 82, train_loss: 0.6572, test_loss: 1.0990, test_f1: 0.5934
 epoch: 83, train_loss: 0.6554, test_loss: 1.1150, test_f1: 0.5820
 epoch: 84, train_loss: 0.6360, test_loss: 1.1754, test_f1: 0.5511
 epoch: 85, train_loss: 0.6470, test_loss: 1.1377, test_f1: 0.5693
 epoch: 86, train_loss: 0.6563, test_loss: 1.1762, test_f1: 0.5705
 epoch: 87, train_loss: 0.6528, test_loss: 1.0686, test_f1: 0.5906
 epoch: 88, train_loss: 0.6605, test_loss: 1.1591, test_f1: 0.5702
 epoch: 89, train_loss: 0.6441, test_loss: 1.1866, test_f1: 0.5924
 epoch: 90, train_loss: 0.6364, test_loss: 1.2109, test_f1: 0.5832
 epoch: 91, train_loss: 0.6338, test_loss: 1.0763, test_f1: 0.5847
 epoch: 92, train_loss: 0.6374, test_loss: 1.2445, test_f1: 0.5750
 epoch: 93, train_loss: 0.6322, test_loss: 1.2606, test_f1: 0.5791
 epoch: 94, train_loss: 0.6601, test_loss: 1.2802, test_f1: 0.5907
 epoch: 95, train_loss: 0.6522, test_loss: 1.2141, test_f1: 0.6055
 epoch: 96, train_loss: 0.6242, test_loss: 1.2764, test_f1: 0.5830
 epoch: 97, train_loss: 0.6224, test_loss: 1.4063, test_f1: 0.5545
 epoch: 98, train_loss: 0.6210, test_loss: 1.2591, test_f1: 0.5863
 epoch: 99, train_loss: 0.5994, test_loss: 1.1722, test_f1: 0.5852
##################ITERATION #8 ****************************************
 epoch: 0, train_loss: 1.2680, test_loss: 1.1820, test_f1: 0.4523
 epoch: 1, train_loss: 1.1319, test_loss: 0.9875, test_f1: 0.5297
 epoch: 2, train_loss: 1.0560, test_loss: 1.5829, test_f1: 0.3912
 epoch: 3, train_loss: 1.0611, test_loss: 0.9677, test_f1: 0.4693
 epoch: 4, train_loss: 0.9960, test_loss: 1.0445, test_f1: 0.4693
 epoch: 5, train_loss: 0.9808, test_loss: 0.9107, test_f1: 0.5104
 epoch: 6, train_loss: 0.9739, test_loss: 0.9544, test_f1: 0.5011
 epoch: 7, train_loss: 0.9411, test_loss: 0.9581, test_f1: 0.5025
 epoch: 8, train_loss: 0.9480, test_loss: 0.9385, test_f1: 0.4922
 epoch: 9, train_loss: 0.9492, test_loss: 0.9834, test_f1: 0.4894
 epoch: 10, train_loss: 0.9471, test_loss: 0.9193, test_f1: 0.4754
 epoch: 11, train_loss: 0.9301, test_loss: 0.9537, test_f1: 0.5018
 epoch: 12, train_loss: 0.9207, test_loss: 0.9529, test_f1: 0.5322
 epoch: 13, train_loss: 0.9317, test_loss: 0.9623, test_f1: 0.5018
 epoch: 14, train_loss: 0.9015, test_loss: 1.0243, test_f1: 0.5370
 epoch: 15, train_loss: 0.8829, test_loss: 0.9187, test_f1: 0.5094
 epoch: 16, train_loss: 0.8714, test_loss: 1.1905, test_f1: 0.4860
 epoch: 17, train_loss: 0.8851, test_loss: 0.8790, test_f1: 0.5519
 epoch: 18, train_loss: 0.8773, test_loss: 0.9964, test_f1: 0.5364
 epoch: 19, train_loss: 0.8816, test_loss: 0.9218, test_f1: 0.5417
 epoch: 20, train_loss: 0.9033, test_loss: 1.0625, test_f1: 0.5100
 epoch: 21, train_loss: 0.9106, test_loss: 0.9282, test_f1: 0.5152
 epoch: 22, train_loss: 0.8827, test_loss: 0.9942, test_f1: 0.5145
 epoch: 23, train_loss: 0.8669, test_loss: 1.0402, test_f1: 0.5212
 epoch: 24, train_loss: 0.8862, test_loss: 1.0200, test_f1: 0.4921
 epoch: 25, train_loss: 0.8668, test_loss: 0.9441, test_f1: 0.5133
 epoch: 26, train_loss: 0.8636, test_loss: 1.0196, test_f1: 0.5146
 epoch: 27, train_loss: 0.8585, test_loss: 0.9546, test_f1: 0.5252
 epoch: 28, train_loss: 0.8416, test_loss: 0.9586, test_f1: 0.5379
 epoch: 29, train_loss: 0.8514, test_loss: 0.9126, test_f1: 0.5527
 epoch: 30, train_loss: 0.8357, test_loss: 0.9076, test_f1: 0.5500
 epoch: 31, train_loss: 0.8220, test_loss: 0.9709, test_f1: 0.5569
 epoch: 32, train_loss: 0.8283, test_loss: 0.9843, test_f1: 0.5453
 epoch: 33, train_loss: 0.8139, test_loss: 1.0082, test_f1: 0.5080
 epoch: 34, train_loss: 0.8416, test_loss: 0.9994, test_f1: 0.5183
 epoch: 35, train_loss: 0.8318, test_loss: 0.9801, test_f1: 0.5365
 epoch: 36, train_loss: 0.8250, test_loss: 0.9974, test_f1: 0.5181
 epoch: 37, train_loss: 0.8418, test_loss: 1.0057, test_f1: 0.5394
 epoch: 38, train_loss: 0.8138, test_loss: 0.9807, test_f1: 0.5407
 epoch: 39, train_loss: 0.8033, test_loss: 0.9058, test_f1: 0.5647
 epoch: 40, train_loss: 0.8137, test_loss: 0.9351, test_f1: 0.5692
 epoch: 41, train_loss: 0.8155, test_loss: 1.0338, test_f1: 0.5508
 epoch: 42, train_loss: 0.8148, test_loss: 1.0343, test_f1: 0.5424
 epoch: 43, train_loss: 0.7750, test_loss: 0.9172, test_f1: 0.5405
 epoch: 44, train_loss: 0.7852, test_loss: 1.0579, test_f1: 0.5250
 epoch: 45, train_loss: 0.7815, test_loss: 1.0317, test_f1: 0.5594
 epoch: 46, train_loss: 0.8192, test_loss: 0.9924, test_f1: 0.5439
 epoch: 47, train_loss: 0.7913, test_loss: 1.0478, test_f1: 0.5690
 epoch: 48, train_loss: 0.7684, test_loss: 1.0519, test_f1: 0.5450
 epoch: 49, train_loss: 0.7748, test_loss: 1.1278, test_f1: 0.5153
 epoch: 50, train_loss: 0.7540, test_loss: 1.0534, test_f1: 0.5491
 epoch: 51, train_loss: 0.8072, test_loss: 1.0079, test_f1: 0.5420
 epoch: 52, train_loss: 0.7473, test_loss: 0.9898, test_f1: 0.5395
 epoch: 53, train_loss: 0.7513, test_loss: 0.9999, test_f1: 0.5637
 epoch: 54, train_loss: 0.7253, test_loss: 0.9842, test_f1: 0.5635
 epoch: 55, train_loss: 0.7133, test_loss: 1.0262, test_f1: 0.5868
 epoch: 56, train_loss: 0.7093, test_loss: 1.0172, test_f1: 0.5710
 epoch: 57, train_loss: 0.6989, test_loss: 0.9951, test_f1: 0.5914
 epoch: 58, train_loss: 0.6881, test_loss: 1.0251, test_f1: 0.5840
 epoch: 59, train_loss: 0.7249, test_loss: 0.9942, test_f1: 0.5944
 epoch: 60, train_loss: 0.6962, test_loss: 1.0330, test_f1: 0.5854
 epoch: 61, train_loss: 0.6910, test_loss: 0.9661, test_f1: 0.5785
 epoch: 62, train_loss: 0.6834, test_loss: 1.0452, test_f1: 0.5794
 epoch: 63, train_loss: 0.6769, test_loss: 1.0264, test_f1: 0.5768
 epoch: 64, train_loss: 0.6841, test_loss: 1.0242, test_f1: 0.5942
 epoch: 65, train_loss: 0.6850, test_loss: 1.0309, test_f1: 0.5793
 epoch: 66, train_loss: 0.6715, test_loss: 1.0248, test_f1: 0.5709
 epoch: 67, train_loss: 0.6724, test_loss: 1.0902, test_f1: 0.5746
 epoch: 68, train_loss: 0.6880, test_loss: 1.0303, test_f1: 0.6027
 epoch: 69, train_loss: 0.6686, test_loss: 1.3635, test_f1: 0.5829
 epoch: 70, train_loss: 0.6753, test_loss: 1.3035, test_f1: 0.5683
 epoch: 71, train_loss: 0.6488, test_loss: 1.0241, test_f1: 0.6121
 epoch: 72, train_loss: 0.6376, test_loss: 0.9916, test_f1: 0.6113
 epoch: 73, train_loss: 0.6809, test_loss: 1.0686, test_f1: 0.5859
 epoch: 74, train_loss: 0.6618, test_loss: 1.1465, test_f1: 0.5892
 epoch: 75, train_loss: 0.6532, test_loss: 1.1679, test_f1: 0.5871
 epoch: 76, train_loss: 0.6794, test_loss: 0.9674, test_f1: 0.5725
 epoch: 77, train_loss: 0.6470, test_loss: 0.9823, test_f1: 0.5796
 epoch: 78, train_loss: 0.6391, test_loss: 1.0464, test_f1: 0.5856
 epoch: 79, train_loss: 0.6327, test_loss: 1.0910, test_f1: 0.6127
 epoch: 80, train_loss: 0.6375, test_loss: 1.0141, test_f1: 0.5943
 epoch: 81, train_loss: 0.6479, test_loss: 1.0619, test_f1: 0.6049
 epoch: 82, train_loss: 0.6414, test_loss: 1.1086, test_f1: 0.5886
 epoch: 83, train_loss: 0.6444, test_loss: 1.1216, test_f1: 0.5856
 epoch: 84, train_loss: 0.6246, test_loss: 1.5324, test_f1: 0.5762
 epoch: 85, train_loss: 0.6167, test_loss: 1.4602, test_f1: 0.5719
 epoch: 86, train_loss: 0.6379, test_loss: 1.3042, test_f1: 0.5570
 epoch: 87, train_loss: 0.6364, test_loss: 1.2602, test_f1: 0.5665
 epoch: 88, train_loss: 0.5975, test_loss: 1.1457, test_f1: 0.5767
 epoch: 89, train_loss: 0.6125, test_loss: 1.1359, test_f1: 0.6125
 epoch: 90, train_loss: 0.6178, test_loss: 1.1957, test_f1: 0.5808
 epoch: 91, train_loss: 0.6133, test_loss: 1.0939, test_f1: 0.5903
 epoch: 92, train_loss: 0.6235, test_loss: 1.4281, test_f1: 0.5791
 epoch: 93, train_loss: 0.5908, test_loss: 1.1804, test_f1: 0.6187
 epoch: 94, train_loss: 0.6115, test_loss: 1.2042, test_f1: 0.5850
 epoch: 95, train_loss: 0.5987, test_loss: 1.0825, test_f1: 0.6061
 epoch: 96, train_loss: 0.6080, test_loss: 1.1592, test_f1: 0.6120
 epoch: 97, train_loss: 0.5905, test_loss: 1.2764, test_f1: 0.6076
 epoch: 98, train_loss: 0.5936, test_loss: 1.1350, test_f1: 0.6017
 epoch: 99, train_loss: 0.6070, test_loss: 1.2674, test_f1: 0.5726
##################ITERATION #9 ****************************************
 epoch: 0, train_loss: 1.2791, test_loss: 1.1733, test_f1: 0.4498
 epoch: 1, train_loss: 1.1340, test_loss: 1.0878, test_f1: 0.4245
 epoch: 2, train_loss: 1.0755, test_loss: 0.9955, test_f1: 0.4436
 epoch: 3, train_loss: 1.0414, test_loss: 1.0582, test_f1: 0.4513
 epoch: 4, train_loss: 1.0124, test_loss: 1.0434, test_f1: 0.4565
 epoch: 5, train_loss: 1.0004, test_loss: 0.9617, test_f1: 0.5032
 epoch: 6, train_loss: 0.9789, test_loss: 0.9375, test_f1: 0.4932
 epoch: 7, train_loss: 0.9839, test_loss: 1.0425, test_f1: 0.4883
 epoch: 8, train_loss: 0.9760, test_loss: 1.0402, test_f1: 0.4973
 epoch: 9, train_loss: 0.9552, test_loss: 0.9423, test_f1: 0.5007
 epoch: 10, train_loss: 0.9566, test_loss: 0.9595, test_f1: 0.5032
 epoch: 11, train_loss: 0.9394, test_loss: 0.9802, test_f1: 0.5064
 epoch: 12, train_loss: 0.9353, test_loss: 1.0632, test_f1: 0.4951
 epoch: 13, train_loss: 0.9260, test_loss: 1.1797, test_f1: 0.4601
 epoch: 14, train_loss: 0.9358, test_loss: 0.9797, test_f1: 0.5023
 epoch: 15, train_loss: 0.9227, test_loss: 1.0243, test_f1: 0.5065
 epoch: 16, train_loss: 0.9264, test_loss: 0.9887, test_f1: 0.5208
 epoch: 17, train_loss: 0.9282, test_loss: 1.0638, test_f1: 0.4653
 epoch: 18, train_loss: 0.9288, test_loss: 0.9357, test_f1: 0.5113
 epoch: 19, train_loss: 0.8906, test_loss: 1.0154, test_f1: 0.4845
 epoch: 20, train_loss: 0.8975, test_loss: 0.9978, test_f1: 0.4916
 epoch: 21, train_loss: 0.8993, test_loss: 0.9993, test_f1: 0.5086
 epoch: 22, train_loss: 0.8874, test_loss: 0.9815, test_f1: 0.5028
 epoch: 23, train_loss: 0.8828, test_loss: 0.9616, test_f1: 0.5150
 epoch: 24, train_loss: 0.8859, test_loss: 1.0484, test_f1: 0.4958
 epoch: 25, train_loss: 0.8790, test_loss: 1.0597, test_f1: 0.4953
 epoch: 26, train_loss: 0.8759, test_loss: 1.0200, test_f1: 0.5348
 epoch: 27, train_loss: 0.8695, test_loss: 1.0110, test_f1: 0.5026
 epoch: 28, train_loss: 0.8673, test_loss: 1.0245, test_f1: 0.5299
 epoch: 29, train_loss: 0.8506, test_loss: 1.0601, test_f1: 0.5040
 epoch: 30, train_loss: 0.8614, test_loss: 1.0859, test_f1: 0.4956
 epoch: 31, train_loss: 0.8614, test_loss: 1.0350, test_f1: 0.5208
 epoch: 32, train_loss: 0.8876, test_loss: 1.1125, test_f1: 0.4994
 epoch: 33, train_loss: 0.8615, test_loss: 1.0386, test_f1: 0.5444
 epoch: 34, train_loss: 0.8664, test_loss: 1.0162, test_f1: 0.5364
 epoch: 35, train_loss: 0.8591, test_loss: 1.0281, test_f1: 0.5028
 epoch: 36, train_loss: 0.8369, test_loss: 1.1503, test_f1: 0.5376
 epoch: 37, train_loss: 0.8338, test_loss: 1.0238, test_f1: 0.5809
 epoch: 38, train_loss: 0.8347, test_loss: 1.0698, test_f1: 0.5431
 epoch: 39, train_loss: 0.8517, test_loss: 1.0136, test_f1: 0.4911
 epoch: 40, train_loss: 0.8524, test_loss: 0.9843, test_f1: 0.5205
 epoch: 41, train_loss: 0.8397, test_loss: 1.0611, test_f1: 0.5945
 epoch: 42, train_loss: 0.8384, test_loss: 0.9828, test_f1: 0.5570
 epoch: 43, train_loss: 0.8298, test_loss: 1.0660, test_f1: 0.5369
 epoch: 44, train_loss: 0.8223, test_loss: 1.3683, test_f1: 0.5078
 epoch: 45, train_loss: 0.8307, test_loss: 1.3028, test_f1: 0.5665
 epoch: 46, train_loss: 0.8362, test_loss: 1.1907, test_f1: 0.5127
 epoch: 47, train_loss: 0.8334, test_loss: 1.1262, test_f1: 0.5324
 epoch: 48, train_loss: 0.8177, test_loss: 1.1801, test_f1: 0.5091
 epoch: 49, train_loss: 0.8093, test_loss: 1.1697, test_f1: 0.5409
 epoch: 50, train_loss: 0.8189, test_loss: 1.0059, test_f1: 0.5532
 epoch: 51, train_loss: 0.7742, test_loss: 1.1666, test_f1: 0.5729
 epoch: 52, train_loss: 0.7735, test_loss: 1.2694, test_f1: 0.5513
 epoch: 53, train_loss: 0.7563, test_loss: 1.1865, test_f1: 0.5758
 epoch: 54, train_loss: 0.7494, test_loss: 1.2664, test_f1: 0.5750
 epoch: 55, train_loss: 0.7388, test_loss: 1.2884, test_f1: 0.5560
 epoch: 56, train_loss: 0.7565, test_loss: 1.3215, test_f1: 0.5323
 epoch: 57, train_loss: 0.7574, test_loss: 1.1600, test_f1: 0.5698
 epoch: 58, train_loss: 0.7487, test_loss: 1.2611, test_f1: 0.5786
 epoch: 59, train_loss: 0.7498, test_loss: 1.1892, test_f1: 0.5509
 epoch: 60, train_loss: 0.7457, test_loss: 1.2534, test_f1: 0.5505
 epoch: 61, train_loss: 0.7278, test_loss: 1.0935, test_f1: 0.5779
 epoch: 62, train_loss: 0.7351, test_loss: 1.1149, test_f1: 0.5785
 epoch: 63, train_loss: 0.7450, test_loss: 1.2750, test_f1: 0.5680
 epoch: 64, train_loss: 0.7289, test_loss: 1.1647, test_f1: 0.5688
 epoch: 65, train_loss: 0.7206, test_loss: 1.1987, test_f1: 0.5712
 epoch: 66, train_loss: 0.7236, test_loss: 1.2927, test_f1: 0.5574
 epoch: 67, train_loss: 0.7321, test_loss: 1.2120, test_f1: 0.5962
 epoch: 68, train_loss: 0.7305, test_loss: 1.2407, test_f1: 0.5440
 epoch: 69, train_loss: 0.7107, test_loss: 1.4014, test_f1: 0.5617
 epoch: 70, train_loss: 0.7107, test_loss: 1.3061, test_f1: 0.5516
 epoch: 71, train_loss: 0.7017, test_loss: 1.1741, test_f1: 0.5838
 epoch: 72, train_loss: 0.7039, test_loss: 1.0947, test_f1: 0.5706
 epoch: 73, train_loss: 0.6861, test_loss: 1.1534, test_f1: 0.5463
 epoch: 74, train_loss: 0.7066, test_loss: 1.2897, test_f1: 0.5382
 epoch: 75, train_loss: 0.6900, test_loss: 1.2496, test_f1: 0.5278
 epoch: 76, train_loss: 0.6981, test_loss: 1.1311, test_f1: 0.5658
 epoch: 77, train_loss: 0.6908, test_loss: 1.3034, test_f1: 0.5455
 epoch: 78, train_loss: 0.7136, test_loss: 1.1364, test_f1: 0.5526
 epoch: 79, train_loss: 0.6945, test_loss: 1.2863, test_f1: 0.5413
 epoch: 80, train_loss: 0.6789, test_loss: 1.0607, test_f1: 0.5683
 epoch: 81, train_loss: 0.7048, test_loss: 1.2142, test_f1: 0.5444
 epoch: 82, train_loss: 0.6805, test_loss: 1.2944, test_f1: 0.5367
 epoch: 83, train_loss: 0.6756, test_loss: 1.1650, test_f1: 0.5693
 epoch: 84, train_loss: 0.6730, test_loss: 1.4430, test_f1: 0.5396
 epoch: 85, train_loss: 0.6815, test_loss: 1.2737, test_f1: 0.5604
 epoch: 86, train_loss: 0.6547, test_loss: 1.3187, test_f1: 0.5115
 epoch: 87, train_loss: 0.6919, test_loss: 1.2640, test_f1: 0.5249
 epoch: 88, train_loss: 0.6723, test_loss: 1.2431, test_f1: 0.5430
 epoch: 89, train_loss: 0.6735, test_loss: 1.2157, test_f1: 0.5481
 epoch: 90, train_loss: 0.6534, test_loss: 1.2894, test_f1: 0.5354
 epoch: 91, train_loss: 0.6623, test_loss: 1.2340, test_f1: 0.5311
 epoch: 92, train_loss: 0.6629, test_loss: 1.0702, test_f1: 0.5705
 epoch: 93, train_loss: 0.6507, test_loss: 1.1577, test_f1: 0.5518
 epoch: 94, train_loss: 0.6485, test_loss: 1.0558, test_f1: 0.5672
 epoch: 95, train_loss: 0.6615, test_loss: 1.1528, test_f1: 0.5846
 epoch: 96, train_loss: 0.6434, test_loss: 1.1656, test_f1: 0.5452
 epoch: 97, train_loss: 0.6402, test_loss: 1.2319, test_f1: 0.5498
 epoch: 98, train_loss: 0.6597, test_loss: 1.3849, test_f1: 0.5526
 epoch: 99, train_loss: 0.6337, test_loss: 1.4600, test_f1: 0.5223

Training completed in 811.54 seconds
Best F1: 0.6187 at epoch 93
Mean F1 across iterations: 0.6020  0.0094
========================FINAL RESULTS================================
FEGIN weighted F1: 0.6187  0.0094
python main.py --data ltspice_examples --representation component_component --model FEGIN --layers 2 --hiddens 64 --batch_size 32 --lr 0.01 --emb_size 512 --epochs 100 --save_appendix component_component_L2_H64_BS32_LR0.01_E512 --no_val
-----



STDERR:
  File "main.py", line 370, in <module>
    main()
  File "main.py", line 254, in main
    dataset = dataset_class(
  File "/home/philip/projects/ltspice_examples_code_repo/Circuit-Completion-Using-GNNs/component_classification_with_link_prediction_head/evaluation/FEGIN/kernel/circuit_datasets.py", line 15, in __init__
    self.data, self.slices = torch.load(self.processed_paths[0])
  File "/home/philip/.local/lib/python3.8/site-packages/torch/serialization.py", line 1040, in load
    warnings.warn(
  File "/usr/lib/python3.8/warnings.py", line 109, in _showwarnmsg
    sw(msg.message, msg.category, msg.filename, msg.lineno,
  File "main.py", line 47, in warn_with_traceback
    traceback.print_stack(file=log)
/home/philip/projects/ltspice_examples_code_repo/Circuit-Completion-Using-GNNs/component_classification_with_link_prediction_head/evaluation/FEGIN/kernel/circuit_datasets.py:15: FutureWarning: You are using `torch.load` with `weights_only=False` (the current default value), which uses the default pickle module implicitly. It is possible to construct malicious pickle data which will execute arbitrary code during unpickling (See https://github.com/pytorch/pytorch/blob/main/SECURITY.md#untrusted-models for more details). In a future release, the default value for `weights_only` will be flipped to `True`. This limits the functions that could be executed during unpickling. Arbitrary objects will no longer be allowed to be loaded via this mode unless they are explicitly allowlisted by the user via `torch.serialization.add_safe_globals`. We recommend you start setting `weights_only=True` for any use case where you don't have full control of the loaded file. Please open an issue on GitHub for any issues related to this experimental feature.
  self.data, self.slices = torch.load(self.processed_paths[0])
