STDOUT:
Results will be saved in /home/philip/projects/llm_inference_code_repo/Circuit-Completion-Using-GNNs/component_classification_with_link_prediction_head/evaluation/FEGIN/results/model_FEGIN_dataset_ltspice_examples
Command line input: python main.py --data ltspice_examples --representation component_net --model FEGIN --layers 2 --hiddens 16 --batch_size 256 --lr 0.001 --emb_size 250 --epochs 100 --save_appendix component_net_L2_H16_BS256_LR0.001_E250 --no_val
 is saved.
-----
ltspice_examples - FEGIN
Using 2 layers, 16 hidden units, h = 2
Loading component_net representation dataset
ENTERED
Training FEGIN on component_net representation
Train: 3558, Test: 846
##################ITERATION #0 ****************************************
 epoch: 0, train_loss: 1.4015, test_loss: 1.3875, test_f1: 0.1004
 epoch: 1, train_loss: 1.3820, test_loss: 1.3766, test_f1: 0.1144
 epoch: 2, train_loss: 1.3671, test_loss: 1.3622, test_f1: 0.1691
 epoch: 3, train_loss: 1.3493, test_loss: 1.3354, test_f1: 0.1834
 epoch: 4, train_loss: 1.3299, test_loss: 1.3034, test_f1: 0.3113
 epoch: 5, train_loss: 1.3100, test_loss: 1.2797, test_f1: 0.3119
 epoch: 6, train_loss: 1.2932, test_loss: 1.2501, test_f1: 0.2622
 epoch: 7, train_loss: 1.2726, test_loss: 1.2379, test_f1: 0.2472
 epoch: 8, train_loss: 1.2567, test_loss: 1.2256, test_f1: 0.2368
 epoch: 9, train_loss: 1.2442, test_loss: 1.2202, test_f1: 0.2561
 epoch: 10, train_loss: 1.2321, test_loss: 1.2018, test_f1: 0.2954
 epoch: 11, train_loss: 1.2162, test_loss: 1.1969, test_f1: 0.3073
 epoch: 12, train_loss: 1.2038, test_loss: 1.1824, test_f1: 0.3122
 epoch: 13, train_loss: 1.1971, test_loss: 1.1797, test_f1: 0.3176
 epoch: 14, train_loss: 1.1873, test_loss: 1.1766, test_f1: 0.3307
 epoch: 15, train_loss: 1.1819, test_loss: 1.1635, test_f1: 0.3220
 epoch: 16, train_loss: 1.1701, test_loss: 1.1632, test_f1: 0.3238
 epoch: 17, train_loss: 1.1659, test_loss: 1.1357, test_f1: 0.3138
 epoch: 18, train_loss: 1.1528, test_loss: 1.1359, test_f1: 0.3708
 epoch: 19, train_loss: 1.1441, test_loss: 1.1157, test_f1: 0.3928
 epoch: 20, train_loss: 1.1377, test_loss: 1.1291, test_f1: 0.4096
 epoch: 21, train_loss: 1.1249, test_loss: 1.0986, test_f1: 0.4066
 epoch: 22, train_loss: 1.1157, test_loss: 1.0832, test_f1: 0.3963
 epoch: 23, train_loss: 1.1110, test_loss: 1.0944, test_f1: 0.3991
 epoch: 24, train_loss: 1.0949, test_loss: 1.0659, test_f1: 0.4145
 epoch: 25, train_loss: 1.0901, test_loss: 1.0583, test_f1: 0.3990
 epoch: 26, train_loss: 1.0784, test_loss: 1.0359, test_f1: 0.3964
 epoch: 27, train_loss: 1.0688, test_loss: 1.0643, test_f1: 0.3945
 epoch: 28, train_loss: 1.0540, test_loss: 1.0215, test_f1: 0.4109
 epoch: 29, train_loss: 1.0577, test_loss: 1.0349, test_f1: 0.3608
 epoch: 30, train_loss: 1.0512, test_loss: 1.0353, test_f1: 0.4049
 epoch: 31, train_loss: 1.0497, test_loss: 1.0177, test_f1: 0.3814
 epoch: 32, train_loss: 1.0343, test_loss: 1.0036, test_f1: 0.4077
 epoch: 33, train_loss: 1.0283, test_loss: 1.0084, test_f1: 0.4079
 epoch: 34, train_loss: 1.0310, test_loss: 1.0020, test_f1: 0.3935
 epoch: 35, train_loss: 1.0326, test_loss: 1.0083, test_f1: 0.3853
 epoch: 36, train_loss: 1.0265, test_loss: 1.0008, test_f1: 0.4139
 epoch: 37, train_loss: 1.0211, test_loss: 1.0275, test_f1: 0.4235
 epoch: 38, train_loss: 1.0117, test_loss: 0.9741, test_f1: 0.4322
 epoch: 39, train_loss: 1.0090, test_loss: 0.9762, test_f1: 0.4249
 epoch: 40, train_loss: 1.0060, test_loss: 0.9788, test_f1: 0.4245
 epoch: 41, train_loss: 1.0021, test_loss: 0.9660, test_f1: 0.4433
 epoch: 42, train_loss: 0.9980, test_loss: 0.9586, test_f1: 0.4507
 epoch: 43, train_loss: 0.9960, test_loss: 0.9790, test_f1: 0.4334
 epoch: 44, train_loss: 0.9907, test_loss: 0.9638, test_f1: 0.4580
 epoch: 45, train_loss: 0.9861, test_loss: 1.0060, test_f1: 0.4303
 epoch: 46, train_loss: 0.9892, test_loss: 0.9633, test_f1: 0.4580
 epoch: 47, train_loss: 0.9840, test_loss: 0.9481, test_f1: 0.4739
 epoch: 48, train_loss: 0.9849, test_loss: 0.9674, test_f1: 0.4522
 epoch: 49, train_loss: 0.9808, test_loss: 0.9605, test_f1: 0.4574
 epoch: 50, train_loss: 0.9787, test_loss: 0.9439, test_f1: 0.4664
 epoch: 51, train_loss: 0.9717, test_loss: 0.9523, test_f1: 0.4650
 epoch: 52, train_loss: 0.9693, test_loss: 0.9649, test_f1: 0.4503
 epoch: 53, train_loss: 0.9673, test_loss: 0.9385, test_f1: 0.4627
 epoch: 54, train_loss: 0.9749, test_loss: 0.9458, test_f1: 0.4666
 epoch: 55, train_loss: 0.9687, test_loss: 0.9466, test_f1: 0.4699
 epoch: 56, train_loss: 0.9642, test_loss: 0.9440, test_f1: 0.4644
 epoch: 57, train_loss: 0.9653, test_loss: 0.9298, test_f1: 0.4704
 epoch: 58, train_loss: 0.9603, test_loss: 0.9444, test_f1: 0.4701
 epoch: 59, train_loss: 0.9585, test_loss: 0.9598, test_f1: 0.4572
 epoch: 60, train_loss: 0.9613, test_loss: 0.9330, test_f1: 0.4688
 epoch: 61, train_loss: 0.9553, test_loss: 0.9490, test_f1: 0.4581
 epoch: 62, train_loss: 0.9674, test_loss: 0.9281, test_f1: 0.4697
 epoch: 63, train_loss: 0.9558, test_loss: 0.9308, test_f1: 0.4772
 epoch: 64, train_loss: 0.9543, test_loss: 0.9293, test_f1: 0.4761
 epoch: 65, train_loss: 0.9611, test_loss: 0.9468, test_f1: 0.4592
 epoch: 66, train_loss: 0.9455, test_loss: 0.9775, test_f1: 0.4606
 epoch: 67, train_loss: 0.9578, test_loss: 0.9345, test_f1: 0.4787
 epoch: 68, train_loss: 0.9494, test_loss: 0.9273, test_f1: 0.4786
 epoch: 69, train_loss: 0.9515, test_loss: 0.9484, test_f1: 0.4703
 epoch: 70, train_loss: 0.9490, test_loss: 0.9418, test_f1: 0.4671
 epoch: 71, train_loss: 0.9482, test_loss: 0.9567, test_f1: 0.4611
 epoch: 72, train_loss: 0.9424, test_loss: 0.9313, test_f1: 0.4777
 epoch: 73, train_loss: 0.9471, test_loss: 0.9379, test_f1: 0.4701
 epoch: 74, train_loss: 0.9492, test_loss: 0.9386, test_f1: 0.4727
 epoch: 75, train_loss: 0.9448, test_loss: 0.9412, test_f1: 0.4681
 epoch: 76, train_loss: 0.9407, test_loss: 0.9321, test_f1: 0.4724
 epoch: 77, train_loss: 0.9472, test_loss: 0.9306, test_f1: 0.4713
 epoch: 78, train_loss: 0.9488, test_loss: 0.9307, test_f1: 0.4756
 epoch: 79, train_loss: 0.9431, test_loss: 0.9479, test_f1: 0.4656
 epoch: 80, train_loss: 0.9408, test_loss: 0.9291, test_f1: 0.4713
 epoch: 81, train_loss: 0.9447, test_loss: 0.9379, test_f1: 0.4665
 epoch: 82, train_loss: 0.9457, test_loss: 0.9570, test_f1: 0.4602
 epoch: 83, train_loss: 0.9377, test_loss: 0.9579, test_f1: 0.4611
 epoch: 84, train_loss: 0.9444, test_loss: 0.9277, test_f1: 0.4776
 epoch: 85, train_loss: 0.9343, test_loss: 0.9400, test_f1: 0.4705
 epoch: 86, train_loss: 0.9384, test_loss: 0.9358, test_f1: 0.4735
 epoch: 87, train_loss: 0.9397, test_loss: 0.9364, test_f1: 0.4774
 epoch: 88, train_loss: 0.9404, test_loss: 0.9904, test_f1: 0.4575
 epoch: 89, train_loss: 0.9406, test_loss: 0.9180, test_f1: 0.4851
 epoch: 90, train_loss: 0.9431, test_loss: 0.9682, test_f1: 0.4608
 epoch: 91, train_loss: 0.9438, test_loss: 0.9617, test_f1: 0.4643
 epoch: 92, train_loss: 0.9351, test_loss: 0.9585, test_f1: 0.4628
 epoch: 93, train_loss: 0.9337, test_loss: 0.9247, test_f1: 0.4796
 epoch: 94, train_loss: 0.9309, test_loss: 0.9968, test_f1: 0.4480
 epoch: 95, train_loss: 0.9328, test_loss: 0.9334, test_f1: 0.4758
 epoch: 96, train_loss: 0.9353, test_loss: 0.9560, test_f1: 0.4624
 epoch: 97, train_loss: 0.9442, test_loss: 0.9413, test_f1: 0.4740
 epoch: 98, train_loss: 0.9278, test_loss: 0.9510, test_f1: 0.4644
 epoch: 99, train_loss: 0.9326, test_loss: 0.9668, test_f1: 0.4575
##################ITERATION #1 ****************************************
 epoch: 0, train_loss: 1.3511, test_loss: 1.3427, test_f1: 0.2270
 epoch: 1, train_loss: 1.2844, test_loss: 1.3126, test_f1: 0.2270
 epoch: 2, train_loss: 1.2566, test_loss: 1.2826, test_f1: 0.2270
 epoch: 3, train_loss: 1.2369, test_loss: 1.2455, test_f1: 0.2270
 epoch: 4, train_loss: 1.2160, test_loss: 1.2072, test_f1: 0.3265
 epoch: 5, train_loss: 1.1930, test_loss: 1.1657, test_f1: 0.3540
 epoch: 6, train_loss: 1.1732, test_loss: 1.1476, test_f1: 0.3386
 epoch: 7, train_loss: 1.1500, test_loss: 1.1253, test_f1: 0.3433
 epoch: 8, train_loss: 1.1328, test_loss: 1.0985, test_f1: 0.3416
 epoch: 9, train_loss: 1.1147, test_loss: 1.0849, test_f1: 0.3427
 epoch: 10, train_loss: 1.0988, test_loss: 1.0744, test_f1: 0.3464
 epoch: 11, train_loss: 1.0884, test_loss: 1.0951, test_f1: 0.3359
 epoch: 12, train_loss: 1.0824, test_loss: 1.0488, test_f1: 0.3460
 epoch: 13, train_loss: 1.0692, test_loss: 1.0583, test_f1: 0.3488
 epoch: 14, train_loss: 1.0566, test_loss: 1.0338, test_f1: 0.3467
 epoch: 15, train_loss: 1.0521, test_loss: 1.0366, test_f1: 0.3465
 epoch: 16, train_loss: 1.0452, test_loss: 1.0503, test_f1: 0.3495
 epoch: 17, train_loss: 1.0426, test_loss: 1.0205, test_f1: 0.3590
 epoch: 18, train_loss: 1.0316, test_loss: 1.0381, test_f1: 0.3613
 epoch: 19, train_loss: 1.0282, test_loss: 1.0154, test_f1: 0.3709
 epoch: 20, train_loss: 1.0188, test_loss: 1.0177, test_f1: 0.3717
 epoch: 21, train_loss: 1.0158, test_loss: 1.0086, test_f1: 0.3821
 epoch: 22, train_loss: 1.0117, test_loss: 1.0127, test_f1: 0.3994
 epoch: 23, train_loss: 1.0043, test_loss: 1.0146, test_f1: 0.3971
 epoch: 24, train_loss: 0.9966, test_loss: 1.0032, test_f1: 0.4203
 epoch: 25, train_loss: 0.9955, test_loss: 1.0054, test_f1: 0.4338
 epoch: 26, train_loss: 0.9847, test_loss: 0.9815, test_f1: 0.4324
 epoch: 27, train_loss: 0.9846, test_loss: 1.0144, test_f1: 0.4491
 epoch: 28, train_loss: 0.9751, test_loss: 0.9885, test_f1: 0.4456
 epoch: 29, train_loss: 0.9764, test_loss: 0.9721, test_f1: 0.4661
 epoch: 30, train_loss: 0.9800, test_loss: 0.9764, test_f1: 0.4540
 epoch: 31, train_loss: 0.9732, test_loss: 0.9878, test_f1: 0.4818
 epoch: 32, train_loss: 0.9579, test_loss: 0.9729, test_f1: 0.4655
 epoch: 33, train_loss: 0.9590, test_loss: 0.9710, test_f1: 0.4811
 epoch: 34, train_loss: 0.9512, test_loss: 1.0254, test_f1: 0.4667
 epoch: 35, train_loss: 0.9638, test_loss: 1.0181, test_f1: 0.4846
 epoch: 36, train_loss: 0.9546, test_loss: 0.9532, test_f1: 0.4608
 epoch: 37, train_loss: 0.9512, test_loss: 1.0307, test_f1: 0.4867
 epoch: 38, train_loss: 0.9479, test_loss: 0.9760, test_f1: 0.4831
 epoch: 39, train_loss: 0.9479, test_loss: 1.0576, test_f1: 0.4596
 epoch: 40, train_loss: 0.9443, test_loss: 0.9717, test_f1: 0.4983
 epoch: 41, train_loss: 0.9492, test_loss: 0.9703, test_f1: 0.4819
 epoch: 42, train_loss: 0.9401, test_loss: 1.0220, test_f1: 0.4918
 epoch: 43, train_loss: 0.9354, test_loss: 0.9839, test_f1: 0.4855
 epoch: 44, train_loss: 0.9449, test_loss: 0.9833, test_f1: 0.4815
 epoch: 45, train_loss: 0.9408, test_loss: 0.9582, test_f1: 0.4957
 epoch: 46, train_loss: 0.9406, test_loss: 0.9807, test_f1: 0.4994
 epoch: 47, train_loss: 0.9286, test_loss: 0.9742, test_f1: 0.4894
 epoch: 48, train_loss: 0.9300, test_loss: 1.0217, test_f1: 0.4884
 epoch: 49, train_loss: 0.9223, test_loss: 1.0097, test_f1: 0.4837
 epoch: 50, train_loss: 0.9245, test_loss: 0.9593, test_f1: 0.5008
 epoch: 51, train_loss: 0.9259, test_loss: 0.9896, test_f1: 0.4925
 epoch: 52, train_loss: 0.9162, test_loss: 0.9905, test_f1: 0.4924
 epoch: 53, train_loss: 0.9161, test_loss: 0.9858, test_f1: 0.4918
 epoch: 54, train_loss: 0.9174, test_loss: 0.9865, test_f1: 0.4911
 epoch: 55, train_loss: 0.9251, test_loss: 0.9931, test_f1: 0.4899
 epoch: 56, train_loss: 0.9127, test_loss: 0.9899, test_f1: 0.4957
 epoch: 57, train_loss: 0.9174, test_loss: 0.9886, test_f1: 0.4899
 epoch: 58, train_loss: 0.9142, test_loss: 1.0002, test_f1: 0.4918
 epoch: 59, train_loss: 0.9241, test_loss: 0.9890, test_f1: 0.4989
 epoch: 60, train_loss: 0.9164, test_loss: 0.9964, test_f1: 0.4954
 epoch: 61, train_loss: 0.9149, test_loss: 0.9792, test_f1: 0.4975
 epoch: 62, train_loss: 0.9069, test_loss: 0.9769, test_f1: 0.4926
 epoch: 63, train_loss: 0.9173, test_loss: 1.0145, test_f1: 0.4796
 epoch: 64, train_loss: 0.9101, test_loss: 0.9897, test_f1: 0.4964
 epoch: 65, train_loss: 0.9057, test_loss: 0.9926, test_f1: 0.4938
 epoch: 66, train_loss: 0.9123, test_loss: 0.9906, test_f1: 0.5031
 epoch: 67, train_loss: 0.9107, test_loss: 1.0005, test_f1: 0.4944
 epoch: 68, train_loss: 0.9070, test_loss: 0.9820, test_f1: 0.5003
 epoch: 69, train_loss: 0.9063, test_loss: 1.0130, test_f1: 0.4931
 epoch: 70, train_loss: 0.9095, test_loss: 1.0071, test_f1: 0.4855
 epoch: 71, train_loss: 0.9020, test_loss: 0.9942, test_f1: 0.4970
 epoch: 72, train_loss: 0.8979, test_loss: 0.9961, test_f1: 0.4953
 epoch: 73, train_loss: 0.9005, test_loss: 0.9849, test_f1: 0.5026
 epoch: 74, train_loss: 0.9077, test_loss: 1.0486, test_f1: 0.4896
 epoch: 75, train_loss: 0.9057, test_loss: 0.9932, test_f1: 0.4934
 epoch: 76, train_loss: 0.8949, test_loss: 0.9814, test_f1: 0.4941
 epoch: 77, train_loss: 0.9007, test_loss: 0.9856, test_f1: 0.4986
 epoch: 78, train_loss: 0.9123, test_loss: 1.0061, test_f1: 0.4896
 epoch: 79, train_loss: 0.8975, test_loss: 0.9784, test_f1: 0.5013
 epoch: 80, train_loss: 0.9063, test_loss: 0.9901, test_f1: 0.5052
 epoch: 81, train_loss: 0.8958, test_loss: 1.0017, test_f1: 0.4974
 epoch: 82, train_loss: 0.9004, test_loss: 0.9877, test_f1: 0.4994
 epoch: 83, train_loss: 0.8990, test_loss: 1.0074, test_f1: 0.4984
 epoch: 84, train_loss: 0.9012, test_loss: 0.9841, test_f1: 0.5018
 epoch: 85, train_loss: 0.8966, test_loss: 0.9889, test_f1: 0.4989
 epoch: 86, train_loss: 0.8933, test_loss: 0.9910, test_f1: 0.5042
 epoch: 87, train_loss: 0.9048, test_loss: 0.9885, test_f1: 0.5085
 epoch: 88, train_loss: 0.8819, test_loss: 0.9943, test_f1: 0.4987
 epoch: 89, train_loss: 0.8954, test_loss: 1.0043, test_f1: 0.4936
 epoch: 90, train_loss: 0.8956, test_loss: 0.9882, test_f1: 0.5148
 epoch: 91, train_loss: 0.8910, test_loss: 1.0196, test_f1: 0.4920
 epoch: 92, train_loss: 0.8883, test_loss: 0.9870, test_f1: 0.5071
 epoch: 93, train_loss: 0.8853, test_loss: 1.0215, test_f1: 0.4984
 epoch: 94, train_loss: 0.8830, test_loss: 1.0068, test_f1: 0.4992
 epoch: 95, train_loss: 0.8875, test_loss: 0.9859, test_f1: 0.5001
 epoch: 96, train_loss: 0.8851, test_loss: 1.0012, test_f1: 0.5031
 epoch: 97, train_loss: 0.8899, test_loss: 0.9932, test_f1: 0.5105
 epoch: 98, train_loss: 0.8864, test_loss: 1.0052, test_f1: 0.4902
 epoch: 99, train_loss: 0.8904, test_loss: 0.9875, test_f1: 0.4976
##################ITERATION #2 ****************************************
 epoch: 0, train_loss: 1.2853, test_loss: 1.3056, test_f1: 0.2270
 epoch: 1, train_loss: 1.2216, test_loss: 1.2781, test_f1: 0.2270
 epoch: 2, train_loss: 1.1960, test_loss: 1.2238, test_f1: 0.2295
 epoch: 3, train_loss: 1.1730, test_loss: 1.1601, test_f1: 0.3284
 epoch: 4, train_loss: 1.1546, test_loss: 1.1204, test_f1: 0.3354
 epoch: 5, train_loss: 1.1337, test_loss: 1.1013, test_f1: 0.3414
 epoch: 6, train_loss: 1.1208, test_loss: 1.0792, test_f1: 0.3441
 epoch: 7, train_loss: 1.1030, test_loss: 1.0678, test_f1: 0.3419
 epoch: 8, train_loss: 1.0877, test_loss: 1.0546, test_f1: 0.3528
 epoch: 9, train_loss: 1.0834, test_loss: 1.0547, test_f1: 0.3634
 epoch: 10, train_loss: 1.0682, test_loss: 1.0484, test_f1: 0.3653
 epoch: 11, train_loss: 1.0647, test_loss: 1.0474, test_f1: 0.3904
 epoch: 12, train_loss: 1.0475, test_loss: 1.0406, test_f1: 0.3964
 epoch: 13, train_loss: 1.0416, test_loss: 1.0328, test_f1: 0.4008
 epoch: 14, train_loss: 1.0331, test_loss: 1.0301, test_f1: 0.4256
 epoch: 15, train_loss: 1.0264, test_loss: 1.0213, test_f1: 0.4380
 epoch: 16, train_loss: 1.0188, test_loss: 1.0090, test_f1: 0.4312
 epoch: 17, train_loss: 1.0161, test_loss: 1.0057, test_f1: 0.4516
 epoch: 18, train_loss: 1.0102, test_loss: 1.0044, test_f1: 0.4402
 epoch: 19, train_loss: 0.9970, test_loss: 0.9834, test_f1: 0.4491
 epoch: 20, train_loss: 0.9940, test_loss: 0.9761, test_f1: 0.4596
 epoch: 21, train_loss: 0.9867, test_loss: 0.9658, test_f1: 0.4740
 epoch: 22, train_loss: 0.9819, test_loss: 0.9831, test_f1: 0.4647
 epoch: 23, train_loss: 0.9779, test_loss: 0.9516, test_f1: 0.4754
 epoch: 24, train_loss: 0.9782, test_loss: 0.9627, test_f1: 0.4764
 epoch: 25, train_loss: 0.9666, test_loss: 0.9311, test_f1: 0.4888
 epoch: 26, train_loss: 0.9682, test_loss: 0.9487, test_f1: 0.4823
 epoch: 27, train_loss: 0.9586, test_loss: 0.9482, test_f1: 0.4678
 epoch: 28, train_loss: 0.9566, test_loss: 0.9443, test_f1: 0.4803
 epoch: 29, train_loss: 0.9526, test_loss: 0.9245, test_f1: 0.5060
 epoch: 30, train_loss: 0.9566, test_loss: 0.9384, test_f1: 0.4799
 epoch: 31, train_loss: 0.9557, test_loss: 0.9422, test_f1: 0.4758
 epoch: 32, train_loss: 0.9447, test_loss: 0.9313, test_f1: 0.5040
 epoch: 33, train_loss: 0.9387, test_loss: 0.9141, test_f1: 0.5047
 epoch: 34, train_loss: 0.9395, test_loss: 0.9641, test_f1: 0.4703
 epoch: 35, train_loss: 0.9383, test_loss: 0.9456, test_f1: 0.4708
 epoch: 36, train_loss: 0.9416, test_loss: 0.9829, test_f1: 0.4554
 epoch: 37, train_loss: 0.9447, test_loss: 0.9171, test_f1: 0.4920
 epoch: 38, train_loss: 0.9414, test_loss: 0.9765, test_f1: 0.4697
 epoch: 39, train_loss: 0.9307, test_loss: 0.9213, test_f1: 0.4918
 epoch: 40, train_loss: 0.9218, test_loss: 0.9545, test_f1: 0.4757
 epoch: 41, train_loss: 0.9302, test_loss: 0.9296, test_f1: 0.5032
 epoch: 42, train_loss: 0.9251, test_loss: 0.9285, test_f1: 0.4862
 epoch: 43, train_loss: 0.9255, test_loss: 0.9810, test_f1: 0.4654
 epoch: 44, train_loss: 0.9199, test_loss: 0.9180, test_f1: 0.5045
 epoch: 45, train_loss: 0.9231, test_loss: 0.9606, test_f1: 0.4808
 epoch: 46, train_loss: 0.9187, test_loss: 0.9239, test_f1: 0.4902
 epoch: 47, train_loss: 0.9188, test_loss: 0.9609, test_f1: 0.4695
 epoch: 48, train_loss: 0.9231, test_loss: 0.9676, test_f1: 0.4819
 epoch: 49, train_loss: 0.9194, test_loss: 0.9634, test_f1: 0.4806
 epoch: 50, train_loss: 0.9210, test_loss: 0.9353, test_f1: 0.4775
 epoch: 51, train_loss: 0.9215, test_loss: 0.9349, test_f1: 0.4854
 epoch: 52, train_loss: 0.9083, test_loss: 0.9175, test_f1: 0.4879
 epoch: 53, train_loss: 0.9129, test_loss: 0.9376, test_f1: 0.4799
 epoch: 54, train_loss: 0.9139, test_loss: 0.9316, test_f1: 0.4856
 epoch: 55, train_loss: 0.9064, test_loss: 0.9204, test_f1: 0.5003
 epoch: 56, train_loss: 0.9123, test_loss: 0.9268, test_f1: 0.4960
 epoch: 57, train_loss: 0.9143, test_loss: 0.9029, test_f1: 0.5082
 epoch: 58, train_loss: 0.9138, test_loss: 0.9382, test_f1: 0.4893
 epoch: 59, train_loss: 0.9050, test_loss: 0.9360, test_f1: 0.4969
 epoch: 60, train_loss: 0.9042, test_loss: 0.9424, test_f1: 0.4840
 epoch: 61, train_loss: 0.9071, test_loss: 0.9418, test_f1: 0.4804
 epoch: 62, train_loss: 0.9041, test_loss: 0.9288, test_f1: 0.4971
 epoch: 63, train_loss: 0.9072, test_loss: 0.9217, test_f1: 0.4935
 epoch: 64, train_loss: 0.9007, test_loss: 0.9111, test_f1: 0.4971
 epoch: 65, train_loss: 0.8999, test_loss: 0.9459, test_f1: 0.4826
 epoch: 66, train_loss: 0.8971, test_loss: 0.9583, test_f1: 0.4828
 epoch: 67, train_loss: 0.8955, test_loss: 0.9299, test_f1: 0.4912
 epoch: 68, train_loss: 0.8995, test_loss: 0.9246, test_f1: 0.5047
 epoch: 69, train_loss: 0.9099, test_loss: 0.9260, test_f1: 0.5004
 epoch: 70, train_loss: 0.8943, test_loss: 0.9353, test_f1: 0.4979
 epoch: 71, train_loss: 0.8913, test_loss: 0.9318, test_f1: 0.4909
 epoch: 72, train_loss: 0.8990, test_loss: 0.9440, test_f1: 0.4848
 epoch: 73, train_loss: 0.8936, test_loss: 0.9521, test_f1: 0.4885
 epoch: 74, train_loss: 0.8955, test_loss: 0.9414, test_f1: 0.4959
 epoch: 75, train_loss: 0.8946, test_loss: 0.9344, test_f1: 0.4855
 epoch: 76, train_loss: 0.8951, test_loss: 0.9129, test_f1: 0.4931
 epoch: 77, train_loss: 0.8901, test_loss: 0.9105, test_f1: 0.4941
 epoch: 78, train_loss: 0.8977, test_loss: 0.9558, test_f1: 0.4838
 epoch: 79, train_loss: 0.9038, test_loss: 0.9455, test_f1: 0.4848
 epoch: 80, train_loss: 0.8880, test_loss: 0.9249, test_f1: 0.4909
 epoch: 81, train_loss: 0.8916, test_loss: 0.9672, test_f1: 0.4866
 epoch: 82, train_loss: 0.8910, test_loss: 0.9207, test_f1: 0.4960
 epoch: 83, train_loss: 0.8863, test_loss: 0.9126, test_f1: 0.5077
 epoch: 84, train_loss: 0.8927, test_loss: 0.9368, test_f1: 0.4919
 epoch: 85, train_loss: 0.8899, test_loss: 0.9402, test_f1: 0.4814
 epoch: 86, train_loss: 0.8839, test_loss: 0.9453, test_f1: 0.4898
 epoch: 87, train_loss: 0.8901, test_loss: 0.9326, test_f1: 0.4841
 epoch: 88, train_loss: 0.8848, test_loss: 0.9248, test_f1: 0.4995
 epoch: 89, train_loss: 0.8849, test_loss: 0.9393, test_f1: 0.4822
 epoch: 90, train_loss: 0.8820, test_loss: 0.9388, test_f1: 0.4889
 epoch: 91, train_loss: 0.8815, test_loss: 0.9457, test_f1: 0.4787
 epoch: 92, train_loss: 0.8846, test_loss: 0.9232, test_f1: 0.4881
 epoch: 93, train_loss: 0.8875, test_loss: 0.9580, test_f1: 0.4869
 epoch: 94, train_loss: 0.8760, test_loss: 0.9736, test_f1: 0.4889
 epoch: 95, train_loss: 0.8881, test_loss: 0.9018, test_f1: 0.5122
 epoch: 96, train_loss: 0.8812, test_loss: 0.8958, test_f1: 0.5287
 epoch: 97, train_loss: 0.8729, test_loss: 0.9936, test_f1: 0.4849
 epoch: 98, train_loss: 0.8774, test_loss: 0.9266, test_f1: 0.4986
 epoch: 99, train_loss: 0.8744, test_loss: 0.9250, test_f1: 0.4930
##################ITERATION #3 ****************************************
 epoch: 0, train_loss: 1.3185, test_loss: 1.3192, test_f1: 0.2270
 epoch: 1, train_loss: 1.2482, test_loss: 1.2977, test_f1: 0.2270
 epoch: 2, train_loss: 1.2299, test_loss: 1.2606, test_f1: 0.2270
 epoch: 3, train_loss: 1.2053, test_loss: 1.1968, test_f1: 0.3014
 epoch: 4, train_loss: 1.1885, test_loss: 1.1479, test_f1: 0.3374
 epoch: 5, train_loss: 1.1632, test_loss: 1.1180, test_f1: 0.3392
 epoch: 6, train_loss: 1.1419, test_loss: 1.1006, test_f1: 0.3567
 epoch: 7, train_loss: 1.1246, test_loss: 1.0889, test_f1: 0.3548
 epoch: 8, train_loss: 1.1126, test_loss: 1.0668, test_f1: 0.3590
 epoch: 9, train_loss: 1.0986, test_loss: 1.0679, test_f1: 0.3582
 epoch: 10, train_loss: 1.0836, test_loss: 1.0633, test_f1: 0.3606
 epoch: 11, train_loss: 1.0719, test_loss: 1.0508, test_f1: 0.3599
 epoch: 12, train_loss: 1.0659, test_loss: 1.0502, test_f1: 0.3592
 epoch: 13, train_loss: 1.0613, test_loss: 1.0493, test_f1: 0.3624
 epoch: 14, train_loss: 1.0467, test_loss: 1.0476, test_f1: 0.3602
 epoch: 15, train_loss: 1.0388, test_loss: 1.0449, test_f1: 0.3602
 epoch: 16, train_loss: 1.0334, test_loss: 1.0440, test_f1: 0.3618
 epoch: 17, train_loss: 1.0306, test_loss: 1.0414, test_f1: 0.3653
 epoch: 18, train_loss: 1.0245, test_loss: 1.0372, test_f1: 0.3784
 epoch: 19, train_loss: 1.0156, test_loss: 1.0350, test_f1: 0.3922
 epoch: 20, train_loss: 1.0131, test_loss: 1.0314, test_f1: 0.4397
 epoch: 21, train_loss: 1.0033, test_loss: 1.0230, test_f1: 0.4438
 epoch: 22, train_loss: 1.0039, test_loss: 1.0120, test_f1: 0.4407
 epoch: 23, train_loss: 0.9995, test_loss: 1.0042, test_f1: 0.4471
 epoch: 24, train_loss: 0.9917, test_loss: 1.0073, test_f1: 0.4640
 epoch: 25, train_loss: 0.9983, test_loss: 1.0072, test_f1: 0.4619
 epoch: 26, train_loss: 0.9832, test_loss: 1.0124, test_f1: 0.4551
 epoch: 27, train_loss: 0.9895, test_loss: 0.9915, test_f1: 0.4803
 epoch: 28, train_loss: 0.9706, test_loss: 0.9988, test_f1: 0.4835
 epoch: 29, train_loss: 0.9785, test_loss: 1.0102, test_f1: 0.4606
 epoch: 30, train_loss: 0.9766, test_loss: 1.0051, test_f1: 0.4883
 epoch: 31, train_loss: 0.9614, test_loss: 0.9879, test_f1: 0.4889
 epoch: 32, train_loss: 0.9620, test_loss: 0.9878, test_f1: 0.4880
 epoch: 33, train_loss: 0.9719, test_loss: 0.9934, test_f1: 0.4909
 epoch: 34, train_loss: 0.9596, test_loss: 0.9889, test_f1: 0.4752
 epoch: 35, train_loss: 0.9608, test_loss: 0.9996, test_f1: 0.4641
 epoch: 36, train_loss: 0.9646, test_loss: 0.9917, test_f1: 0.4777
 epoch: 37, train_loss: 0.9594, test_loss: 0.9807, test_f1: 0.4891
 epoch: 38, train_loss: 0.9607, test_loss: 0.9887, test_f1: 0.4709
 epoch: 39, train_loss: 0.9515, test_loss: 0.9962, test_f1: 0.4909
 epoch: 40, train_loss: 0.9493, test_loss: 0.9812, test_f1: 0.4825
 epoch: 41, train_loss: 0.9447, test_loss: 0.9849, test_f1: 0.4835
 epoch: 42, train_loss: 0.9435, test_loss: 0.9842, test_f1: 0.4981
 epoch: 43, train_loss: 0.9439, test_loss: 0.9787, test_f1: 0.4847
 epoch: 44, train_loss: 0.9371, test_loss: 0.9692, test_f1: 0.4851
 epoch: 45, train_loss: 0.9476, test_loss: 0.9714, test_f1: 0.4906
 epoch: 46, train_loss: 0.9357, test_loss: 0.9741, test_f1: 0.4909
 epoch: 47, train_loss: 0.9453, test_loss: 0.9736, test_f1: 0.4876
 epoch: 48, train_loss: 0.9408, test_loss: 0.9750, test_f1: 0.4707
 epoch: 49, train_loss: 0.9340, test_loss: 0.9862, test_f1: 0.4944
 epoch: 50, train_loss: 0.9302, test_loss: 0.9749, test_f1: 0.4931
 epoch: 51, train_loss: 0.9327, test_loss: 0.9664, test_f1: 0.4963
 epoch: 52, train_loss: 0.9313, test_loss: 0.9808, test_f1: 0.4814
 epoch: 53, train_loss: 0.9232, test_loss: 0.9703, test_f1: 0.4944
 epoch: 54, train_loss: 0.9222, test_loss: 0.9640, test_f1: 0.4967
 epoch: 55, train_loss: 0.9221, test_loss: 0.9759, test_f1: 0.5059
 epoch: 56, train_loss: 0.9276, test_loss: 0.9751, test_f1: 0.4922
 epoch: 57, train_loss: 0.9316, test_loss: 0.9667, test_f1: 0.4919
 epoch: 58, train_loss: 0.9247, test_loss: 0.9617, test_f1: 0.4946
 epoch: 59, train_loss: 0.9176, test_loss: 0.9922, test_f1: 0.4836
 epoch: 60, train_loss: 0.9222, test_loss: 0.9688, test_f1: 0.4990
 epoch: 61, train_loss: 0.9198, test_loss: 0.9639, test_f1: 0.4942
 epoch: 62, train_loss: 0.9139, test_loss: 0.9775, test_f1: 0.4959
 epoch: 63, train_loss: 0.9120, test_loss: 0.9602, test_f1: 0.4921
 epoch: 64, train_loss: 0.9193, test_loss: 0.9632, test_f1: 0.4960
 epoch: 65, train_loss: 0.9239, test_loss: 0.9771, test_f1: 0.4981
 epoch: 66, train_loss: 0.9160, test_loss: 0.9660, test_f1: 0.4960
 epoch: 67, train_loss: 0.9139, test_loss: 0.9696, test_f1: 0.4917
 epoch: 68, train_loss: 0.9130, test_loss: 0.9704, test_f1: 0.4903
 epoch: 69, train_loss: 0.9171, test_loss: 0.9746, test_f1: 0.4902
 epoch: 70, train_loss: 0.9217, test_loss: 0.9693, test_f1: 0.4916
 epoch: 71, train_loss: 0.9081, test_loss: 0.9632, test_f1: 0.4950
 epoch: 72, train_loss: 0.9190, test_loss: 0.9516, test_f1: 0.4953
 epoch: 73, train_loss: 0.9179, test_loss: 0.9570, test_f1: 0.4993
 epoch: 74, train_loss: 0.9192, test_loss: 0.9700, test_f1: 0.4973
 epoch: 75, train_loss: 0.9057, test_loss: 0.9581, test_f1: 0.4997
 epoch: 76, train_loss: 0.9212, test_loss: 0.9635, test_f1: 0.4922
 epoch: 77, train_loss: 0.9111, test_loss: 0.9663, test_f1: 0.4977
 epoch: 78, train_loss: 0.9134, test_loss: 0.9665, test_f1: 0.4998
 epoch: 79, train_loss: 0.9037, test_loss: 0.9590, test_f1: 0.4930
 epoch: 80, train_loss: 0.9084, test_loss: 0.9642, test_f1: 0.4977
 epoch: 81, train_loss: 0.9021, test_loss: 0.9548, test_f1: 0.4979
 epoch: 82, train_loss: 0.8997, test_loss: 0.9612, test_f1: 0.5026
 epoch: 83, train_loss: 0.9070, test_loss: 0.9515, test_f1: 0.4964
 epoch: 84, train_loss: 0.9075, test_loss: 0.9609, test_f1: 0.4934
 epoch: 85, train_loss: 0.9043, test_loss: 0.9672, test_f1: 0.4993
 epoch: 86, train_loss: 0.8990, test_loss: 0.9551, test_f1: 0.4964
 epoch: 87, train_loss: 0.9039, test_loss: 0.9474, test_f1: 0.5226
 epoch: 88, train_loss: 0.9054, test_loss: 0.9575, test_f1: 0.5024
 epoch: 89, train_loss: 0.8972, test_loss: 0.9493, test_f1: 0.5298
 epoch: 90, train_loss: 0.8988, test_loss: 0.9534, test_f1: 0.5040
 epoch: 91, train_loss: 0.9000, test_loss: 0.9603, test_f1: 0.5103
 epoch: 92, train_loss: 0.9020, test_loss: 0.9600, test_f1: 0.4932
 epoch: 93, train_loss: 0.9041, test_loss: 0.9572, test_f1: 0.5212
 epoch: 94, train_loss: 0.9018, test_loss: 0.9598, test_f1: 0.5336
 epoch: 95, train_loss: 0.8938, test_loss: 0.9707, test_f1: 0.5257
 epoch: 96, train_loss: 0.8979, test_loss: 0.9533, test_f1: 0.5272
 epoch: 97, train_loss: 0.8997, test_loss: 0.9526, test_f1: 0.5146
 epoch: 98, train_loss: 0.8918, test_loss: 0.9550, test_f1: 0.5063
 epoch: 99, train_loss: 0.9036, test_loss: 0.9564, test_f1: 0.5180
##################ITERATION #4 ****************************************
 epoch: 0, train_loss: 1.3348, test_loss: 1.3249, test_f1: 0.2270
 epoch: 1, train_loss: 1.2390, test_loss: 1.2886, test_f1: 0.2270
 epoch: 2, train_loss: 1.2120, test_loss: 1.2317, test_f1: 0.2270
 epoch: 3, train_loss: 1.1842, test_loss: 1.1643, test_f1: 0.3396
 epoch: 4, train_loss: 1.1501, test_loss: 1.1204, test_f1: 0.3430
 epoch: 5, train_loss: 1.1196, test_loss: 1.0799, test_f1: 0.3569
 epoch: 6, train_loss: 1.1027, test_loss: 1.0582, test_f1: 0.3684
 epoch: 7, train_loss: 1.0819, test_loss: 1.0666, test_f1: 0.3505
 epoch: 8, train_loss: 1.0608, test_loss: 1.0474, test_f1: 0.3601
 epoch: 9, train_loss: 1.0533, test_loss: 1.0333, test_f1: 0.3752
 epoch: 10, train_loss: 1.0458, test_loss: 1.0191, test_f1: 0.3964
 epoch: 11, train_loss: 1.0364, test_loss: 1.0130, test_f1: 0.4090
 epoch: 12, train_loss: 1.0282, test_loss: 1.0032, test_f1: 0.4127
 epoch: 13, train_loss: 1.0217, test_loss: 0.9977, test_f1: 0.4027
 epoch: 14, train_loss: 1.0069, test_loss: 0.9807, test_f1: 0.4403
 epoch: 15, train_loss: 1.0107, test_loss: 0.9926, test_f1: 0.4189
 epoch: 16, train_loss: 1.0030, test_loss: 0.9858, test_f1: 0.4365
 epoch: 17, train_loss: 0.9940, test_loss: 0.9722, test_f1: 0.4559
 epoch: 18, train_loss: 0.9925, test_loss: 0.9755, test_f1: 0.4558
 epoch: 19, train_loss: 0.9890, test_loss: 0.9760, test_f1: 0.4516
 epoch: 20, train_loss: 0.9880, test_loss: 0.9659, test_f1: 0.4621
 epoch: 21, train_loss: 0.9840, test_loss: 0.9989, test_f1: 0.4385
 epoch: 22, train_loss: 0.9813, test_loss: 0.9907, test_f1: 0.4482
 epoch: 23, train_loss: 0.9803, test_loss: 0.9530, test_f1: 0.4776
 epoch: 24, train_loss: 0.9720, test_loss: 0.9548, test_f1: 0.4558
 epoch: 25, train_loss: 0.9705, test_loss: 0.9793, test_f1: 0.4778
 epoch: 26, train_loss: 0.9692, test_loss: 0.9507, test_f1: 0.4836
 epoch: 27, train_loss: 0.9667, test_loss: 1.0087, test_f1: 0.4552
 epoch: 28, train_loss: 0.9586, test_loss: 0.9593, test_f1: 0.4960
 epoch: 29, train_loss: 0.9596, test_loss: 0.9815, test_f1: 0.4722
 epoch: 30, train_loss: 0.9570, test_loss: 0.9811, test_f1: 0.4688
 epoch: 31, train_loss: 0.9638, test_loss: 0.9658, test_f1: 0.4857
 epoch: 32, train_loss: 0.9521, test_loss: 0.9638, test_f1: 0.4764
 epoch: 33, train_loss: 0.9470, test_loss: 0.9495, test_f1: 0.4801
 epoch: 34, train_loss: 0.9544, test_loss: 0.9550, test_f1: 0.4806
 epoch: 35, train_loss: 0.9581, test_loss: 0.9619, test_f1: 0.4806
 epoch: 36, train_loss: 0.9400, test_loss: 0.9345, test_f1: 0.4832
 epoch: 37, train_loss: 0.9476, test_loss: 0.9794, test_f1: 0.4614
 epoch: 38, train_loss: 0.9425, test_loss: 1.0014, test_f1: 0.4558
 epoch: 39, train_loss: 0.9360, test_loss: 0.9806, test_f1: 0.4504
 epoch: 40, train_loss: 0.9433, test_loss: 0.9802, test_f1: 0.4678
 epoch: 41, train_loss: 0.9324, test_loss: 0.9599, test_f1: 0.4623
 epoch: 42, train_loss: 0.9297, test_loss: 0.9685, test_f1: 0.4591
 epoch: 43, train_loss: 0.9263, test_loss: 0.9751, test_f1: 0.4544
 epoch: 44, train_loss: 0.9247, test_loss: 0.9913, test_f1: 0.4559
 epoch: 45, train_loss: 0.9293, test_loss: 0.9990, test_f1: 0.4668
 epoch: 46, train_loss: 0.9333, test_loss: 0.9618, test_f1: 0.4569
 epoch: 47, train_loss: 0.9170, test_loss: 0.9391, test_f1: 0.4623
 epoch: 48, train_loss: 0.9265, test_loss: 0.9652, test_f1: 0.4724
 epoch: 49, train_loss: 0.9214, test_loss: 1.0111, test_f1: 0.4668
 epoch: 50, train_loss: 0.9144, test_loss: 0.9196, test_f1: 0.4938
 epoch: 51, train_loss: 0.9121, test_loss: 0.9435, test_f1: 0.4777
 epoch: 52, train_loss: 0.9130, test_loss: 0.9423, test_f1: 0.4674
 epoch: 53, train_loss: 0.9145, test_loss: 0.9851, test_f1: 0.4642
 epoch: 54, train_loss: 0.9068, test_loss: 0.9529, test_f1: 0.4709
 epoch: 55, train_loss: 0.9127, test_loss: 0.9596, test_f1: 0.4791
 epoch: 56, train_loss: 0.9096, test_loss: 0.9528, test_f1: 0.4634
 epoch: 57, train_loss: 0.9040, test_loss: 0.9709, test_f1: 0.4777
 epoch: 58, train_loss: 0.9064, test_loss: 0.9527, test_f1: 0.4776
 epoch: 59, train_loss: 0.8994, test_loss: 0.9778, test_f1: 0.4759
 epoch: 60, train_loss: 0.9071, test_loss: 0.9480, test_f1: 0.4704
 epoch: 61, train_loss: 0.8952, test_loss: 0.9794, test_f1: 0.4721
 epoch: 62, train_loss: 0.8948, test_loss: 0.9778, test_f1: 0.4666
 epoch: 63, train_loss: 0.9000, test_loss: 0.9755, test_f1: 0.4772
 epoch: 64, train_loss: 0.8997, test_loss: 0.9953, test_f1: 0.4815
 epoch: 65, train_loss: 0.8970, test_loss: 0.9546, test_f1: 0.4938
 epoch: 66, train_loss: 0.9082, test_loss: 1.0031, test_f1: 0.4817
 epoch: 67, train_loss: 0.9018, test_loss: 0.9756, test_f1: 0.4799
 epoch: 68, train_loss: 0.9003, test_loss: 0.9619, test_f1: 0.4765
 epoch: 69, train_loss: 0.9009, test_loss: 0.9838, test_f1: 0.4807
 epoch: 70, train_loss: 0.8994, test_loss: 0.9876, test_f1: 0.4793
 epoch: 71, train_loss: 0.9059, test_loss: 0.9676, test_f1: 0.4811
 epoch: 72, train_loss: 0.8931, test_loss: 0.9703, test_f1: 0.4770
 epoch: 73, train_loss: 0.8979, test_loss: 0.9772, test_f1: 0.4650
 epoch: 74, train_loss: 0.8961, test_loss: 0.9738, test_f1: 0.4780
 epoch: 75, train_loss: 0.8859, test_loss: 0.9715, test_f1: 0.4805
 epoch: 76, train_loss: 0.8884, test_loss: 0.9914, test_f1: 0.4757
 epoch: 77, train_loss: 0.8921, test_loss: 0.9991, test_f1: 0.4766
 epoch: 78, train_loss: 0.8985, test_loss: 1.0066, test_f1: 0.4796
 epoch: 79, train_loss: 0.8935, test_loss: 0.9684, test_f1: 0.4799
 epoch: 80, train_loss: 0.8807, test_loss: 0.9742, test_f1: 0.4875
 epoch: 81, train_loss: 0.8944, test_loss: 0.9783, test_f1: 0.4683
 epoch: 82, train_loss: 0.8925, test_loss: 0.9415, test_f1: 0.4795
 epoch: 83, train_loss: 0.8814, test_loss: 0.9709, test_f1: 0.4712
 epoch: 84, train_loss: 0.8903, test_loss: 0.9526, test_f1: 0.4736
 epoch: 85, train_loss: 0.8869, test_loss: 0.9849, test_f1: 0.4952
 epoch: 86, train_loss: 0.8820, test_loss: 0.9416, test_f1: 0.4754
 epoch: 87, train_loss: 0.8908, test_loss: 0.9646, test_f1: 0.4860
 epoch: 88, train_loss: 0.8838, test_loss: 0.9780, test_f1: 0.4803
 epoch: 89, train_loss: 0.8917, test_loss: 0.9950, test_f1: 0.4793
 epoch: 90, train_loss: 0.8808, test_loss: 0.9330, test_f1: 0.4919
 epoch: 91, train_loss: 0.8819, test_loss: 0.9743, test_f1: 0.4857
 epoch: 92, train_loss: 0.8873, test_loss: 1.0066, test_f1: 0.4910
 epoch: 93, train_loss: 0.8848, test_loss: 0.9852, test_f1: 0.4868
 epoch: 94, train_loss: 0.8828, test_loss: 1.0001, test_f1: 0.4993
 epoch: 95, train_loss: 0.8802, test_loss: 0.9815, test_f1: 0.4926
 epoch: 96, train_loss: 0.8868, test_loss: 0.9434, test_f1: 0.4893
 epoch: 97, train_loss: 0.8851, test_loss: 0.9734, test_f1: 0.4923
 epoch: 98, train_loss: 0.8819, test_loss: 0.9651, test_f1: 0.4937
 epoch: 99, train_loss: 0.8738, test_loss: 0.9403, test_f1: 0.4968
##################ITERATION #5 ****************************************
 epoch: 0, train_loss: 1.5402, test_loss: 1.4234, test_f1: 0.2270
 epoch: 1, train_loss: 1.3132, test_loss: 1.3207, test_f1: 0.2270
 epoch: 2, train_loss: 1.2727, test_loss: 1.2467, test_f1: 0.2270
 epoch: 3, train_loss: 1.2413, test_loss: 1.2045, test_f1: 0.2433
 epoch: 4, train_loss: 1.2231, test_loss: 1.1785, test_f1: 0.2902
 epoch: 5, train_loss: 1.2115, test_loss: 1.1574, test_f1: 0.3206
 epoch: 6, train_loss: 1.2075, test_loss: 1.1415, test_f1: 0.3209
 epoch: 7, train_loss: 1.1831, test_loss: 1.1181, test_f1: 0.3398
 epoch: 8, train_loss: 1.1627, test_loss: 1.1076, test_f1: 0.3404
 epoch: 9, train_loss: 1.1467, test_loss: 1.0896, test_f1: 0.3386
 epoch: 10, train_loss: 1.1229, test_loss: 1.0823, test_f1: 0.3377
 epoch: 11, train_loss: 1.1159, test_loss: 1.0775, test_f1: 0.3412
 epoch: 12, train_loss: 1.0987, test_loss: 1.0732, test_f1: 0.3488
 epoch: 13, train_loss: 1.0887, test_loss: 1.0706, test_f1: 0.3495
 epoch: 14, train_loss: 1.0882, test_loss: 1.0753, test_f1: 0.3520
 epoch: 15, train_loss: 1.0867, test_loss: 1.0637, test_f1: 0.3677
 epoch: 16, train_loss: 1.0690, test_loss: 1.0600, test_f1: 0.3745
 epoch: 17, train_loss: 1.0655, test_loss: 1.0579, test_f1: 0.3745
 epoch: 18, train_loss: 1.0566, test_loss: 1.0591, test_f1: 0.3785
 epoch: 19, train_loss: 1.0545, test_loss: 1.0583, test_f1: 0.3950
 epoch: 20, train_loss: 1.0470, test_loss: 1.0575, test_f1: 0.4136
 epoch: 21, train_loss: 1.0427, test_loss: 1.0503, test_f1: 0.4165
 epoch: 22, train_loss: 1.0484, test_loss: 1.0512, test_f1: 0.4175
 epoch: 23, train_loss: 1.0352, test_loss: 1.0462, test_f1: 0.4259
 epoch: 24, train_loss: 1.0266, test_loss: 1.0486, test_f1: 0.4240
 epoch: 25, train_loss: 1.0248, test_loss: 1.0484, test_f1: 0.4515
 epoch: 26, train_loss: 1.0270, test_loss: 1.0412, test_f1: 0.4299
 epoch: 27, train_loss: 1.0230, test_loss: 1.0452, test_f1: 0.4863
 epoch: 28, train_loss: 1.0171, test_loss: 1.0415, test_f1: 0.4389
 epoch: 29, train_loss: 1.0159, test_loss: 1.0321, test_f1: 0.4598
 epoch: 30, train_loss: 1.0101, test_loss: 1.0262, test_f1: 0.4462
 epoch: 31, train_loss: 0.9984, test_loss: 1.0241, test_f1: 0.4613
 epoch: 32, train_loss: 1.0058, test_loss: 1.0235, test_f1: 0.4657
 epoch: 33, train_loss: 0.9981, test_loss: 1.0269, test_f1: 0.4519
 epoch: 34, train_loss: 0.9931, test_loss: 1.0255, test_f1: 0.4690
 epoch: 35, train_loss: 0.9893, test_loss: 1.0168, test_f1: 0.4632
 epoch: 36, train_loss: 0.9848, test_loss: 1.0169, test_f1: 0.4660
 epoch: 37, train_loss: 0.9807, test_loss: 1.0284, test_f1: 0.4602
 epoch: 38, train_loss: 0.9722, test_loss: 1.0193, test_f1: 0.4712
 epoch: 39, train_loss: 0.9747, test_loss: 1.0157, test_f1: 0.4829
 epoch: 40, train_loss: 0.9670, test_loss: 1.0113, test_f1: 0.4871
 epoch: 41, train_loss: 0.9646, test_loss: 1.0138, test_f1: 0.4881
 epoch: 42, train_loss: 0.9635, test_loss: 1.0059, test_f1: 0.4882
 epoch: 43, train_loss: 0.9620, test_loss: 1.0091, test_f1: 0.4858
 epoch: 44, train_loss: 0.9549, test_loss: 0.9926, test_f1: 0.4948
 epoch: 45, train_loss: 0.9524, test_loss: 1.0004, test_f1: 0.4930
 epoch: 46, train_loss: 0.9573, test_loss: 0.9993, test_f1: 0.5014
 epoch: 47, train_loss: 0.9456, test_loss: 1.0000, test_f1: 0.4848
 epoch: 48, train_loss: 0.9459, test_loss: 1.0040, test_f1: 0.4841
 epoch: 49, train_loss: 0.9502, test_loss: 0.9808, test_f1: 0.4830
 epoch: 50, train_loss: 0.9393, test_loss: 0.9788, test_f1: 0.4866
 epoch: 51, train_loss: 0.9402, test_loss: 0.9870, test_f1: 0.4873
 epoch: 52, train_loss: 0.9433, test_loss: 1.0056, test_f1: 0.4717
 epoch: 53, train_loss: 0.9327, test_loss: 0.9877, test_f1: 0.4943
 epoch: 54, train_loss: 0.9449, test_loss: 0.9880, test_f1: 0.4914
 epoch: 55, train_loss: 0.9324, test_loss: 0.9958, test_f1: 0.4976
 epoch: 56, train_loss: 0.9357, test_loss: 0.9786, test_f1: 0.5027
 epoch: 57, train_loss: 0.9359, test_loss: 0.9845, test_f1: 0.4993
 epoch: 58, train_loss: 0.9334, test_loss: 0.9883, test_f1: 0.5060
 epoch: 59, train_loss: 0.9320, test_loss: 0.9853, test_f1: 0.4919
 epoch: 60, train_loss: 0.9243, test_loss: 0.9833, test_f1: 0.5019
 epoch: 61, train_loss: 0.9268, test_loss: 0.9858, test_f1: 0.5054
 epoch: 62, train_loss: 0.9231, test_loss: 0.9895, test_f1: 0.4948
 epoch: 63, train_loss: 0.9152, test_loss: 0.9928, test_f1: 0.5049
 epoch: 64, train_loss: 0.9230, test_loss: 0.9782, test_f1: 0.5071
 epoch: 65, train_loss: 0.9162, test_loss: 0.9772, test_f1: 0.5071
 epoch: 66, train_loss: 0.9233, test_loss: 0.9898, test_f1: 0.5001
 epoch: 67, train_loss: 0.9169, test_loss: 0.9873, test_f1: 0.5100
 epoch: 68, train_loss: 0.9256, test_loss: 0.9931, test_f1: 0.5097
 epoch: 69, train_loss: 0.9154, test_loss: 0.9850, test_f1: 0.5081
 epoch: 70, train_loss: 0.9174, test_loss: 1.0242, test_f1: 0.4917
 epoch: 71, train_loss: 0.9136, test_loss: 0.9778, test_f1: 0.5097
 epoch: 72, train_loss: 0.9202, test_loss: 0.9857, test_f1: 0.5111
 epoch: 73, train_loss: 0.9135, test_loss: 0.9835, test_f1: 0.5014
 epoch: 74, train_loss: 0.9136, test_loss: 0.9950, test_f1: 0.5023
 epoch: 75, train_loss: 0.9177, test_loss: 0.9826, test_f1: 0.5037
 epoch: 76, train_loss: 0.9134, test_loss: 0.9760, test_f1: 0.5109
 epoch: 77, train_loss: 0.9158, test_loss: 0.9898, test_f1: 0.5102
 epoch: 78, train_loss: 0.9083, test_loss: 0.9883, test_f1: 0.5067
 epoch: 79, train_loss: 0.9071, test_loss: 0.9791, test_f1: 0.5068
 epoch: 80, train_loss: 0.9123, test_loss: 0.9686, test_f1: 0.5117
 epoch: 81, train_loss: 0.9116, test_loss: 0.9916, test_f1: 0.5024
 epoch: 82, train_loss: 0.8982, test_loss: 0.9786, test_f1: 0.5125
 epoch: 83, train_loss: 0.9134, test_loss: 0.9690, test_f1: 0.5161
 epoch: 84, train_loss: 0.9021, test_loss: 0.9807, test_f1: 0.5142
 epoch: 85, train_loss: 0.9039, test_loss: 0.9788, test_f1: 0.5102
 epoch: 86, train_loss: 0.9054, test_loss: 0.9845, test_f1: 0.5101
 epoch: 87, train_loss: 0.8988, test_loss: 0.9817, test_f1: 0.5084
 epoch: 88, train_loss: 0.8961, test_loss: 0.9851, test_f1: 0.5073
 epoch: 89, train_loss: 0.9042, test_loss: 0.9757, test_f1: 0.5144
 epoch: 90, train_loss: 0.9005, test_loss: 1.0031, test_f1: 0.5092
 epoch: 91, train_loss: 0.9030, test_loss: 0.9867, test_f1: 0.5017
 epoch: 92, train_loss: 0.9037, test_loss: 0.9827, test_f1: 0.5058
 epoch: 93, train_loss: 0.8891, test_loss: 0.9944, test_f1: 0.5000
 epoch: 94, train_loss: 0.9088, test_loss: 0.9538, test_f1: 0.5034
 epoch: 95, train_loss: 0.8990, test_loss: 1.0187, test_f1: 0.4952
 epoch: 96, train_loss: 0.9005, test_loss: 0.9646, test_f1: 0.5087
 epoch: 97, train_loss: 0.8997, test_loss: 1.0031, test_f1: 0.5012
 epoch: 98, train_loss: 0.8993, test_loss: 1.0004, test_f1: 0.4805
 epoch: 99, train_loss: 0.8920, test_loss: 0.9687, test_f1: 0.5068
##################ITERATION #6 ****************************************
 epoch: 0, train_loss: 1.5232, test_loss: 1.3382, test_f1: 0.2270
 epoch: 1, train_loss: 1.2593, test_loss: 1.3206, test_f1: 0.2270
 epoch: 2, train_loss: 1.2201, test_loss: 1.2120, test_f1: 0.2690
 epoch: 3, train_loss: 1.1927, test_loss: 1.1474, test_f1: 0.3049
 epoch: 4, train_loss: 1.1647, test_loss: 1.1162, test_f1: 0.3556
 epoch: 5, train_loss: 1.1542, test_loss: 1.0955, test_f1: 0.3690
 epoch: 6, train_loss: 1.1442, test_loss: 1.0861, test_f1: 0.3747
 epoch: 7, train_loss: 1.1207, test_loss: 1.0643, test_f1: 0.3963
 epoch: 8, train_loss: 1.1128, test_loss: 1.0538, test_f1: 0.3995
 epoch: 9, train_loss: 1.1056, test_loss: 1.0420, test_f1: 0.4050
 epoch: 10, train_loss: 1.0999, test_loss: 1.0352, test_f1: 0.3860
 epoch: 11, train_loss: 1.0867, test_loss: 1.0311, test_f1: 0.3943
 epoch: 12, train_loss: 1.0740, test_loss: 1.0219, test_f1: 0.3937
 epoch: 13, train_loss: 1.0620, test_loss: 1.0136, test_f1: 0.4239
 epoch: 14, train_loss: 1.0509, test_loss: 1.0053, test_f1: 0.4287
 epoch: 15, train_loss: 1.0538, test_loss: 0.9941, test_f1: 0.4115
 epoch: 16, train_loss: 1.0494, test_loss: 0.9919, test_f1: 0.4302
 epoch: 17, train_loss: 1.0390, test_loss: 0.9894, test_f1: 0.4546
 epoch: 18, train_loss: 1.0245, test_loss: 0.9838, test_f1: 0.4669
 epoch: 19, train_loss: 1.0256, test_loss: 0.9851, test_f1: 0.4597
 epoch: 20, train_loss: 1.0187, test_loss: 0.9876, test_f1: 0.4709
 epoch: 21, train_loss: 1.0174, test_loss: 0.9731, test_f1: 0.4710
 epoch: 22, train_loss: 1.0062, test_loss: 0.9682, test_f1: 0.4776
 epoch: 23, train_loss: 1.0078, test_loss: 0.9766, test_f1: 0.4766
 epoch: 24, train_loss: 1.0045, test_loss: 0.9741, test_f1: 0.4825
 epoch: 25, train_loss: 0.9944, test_loss: 0.9627, test_f1: 0.4964
 epoch: 26, train_loss: 0.9987, test_loss: 0.9575, test_f1: 0.5001
 epoch: 27, train_loss: 0.9892, test_loss: 0.9487, test_f1: 0.4896
 epoch: 28, train_loss: 0.9893, test_loss: 0.9450, test_f1: 0.4926
 epoch: 29, train_loss: 0.9760, test_loss: 0.9598, test_f1: 0.5019
 epoch: 30, train_loss: 0.9699, test_loss: 0.9581, test_f1: 0.4960
 epoch: 31, train_loss: 0.9740, test_loss: 0.9472, test_f1: 0.4996
 epoch: 32, train_loss: 0.9570, test_loss: 0.9642, test_f1: 0.4891
 epoch: 33, train_loss: 0.9729, test_loss: 0.9370, test_f1: 0.5094
 epoch: 34, train_loss: 0.9582, test_loss: 0.9425, test_f1: 0.5161
 epoch: 35, train_loss: 0.9607, test_loss: 0.9455, test_f1: 0.5072
 epoch: 36, train_loss: 0.9587, test_loss: 0.9315, test_f1: 0.5119
 epoch: 37, train_loss: 0.9522, test_loss: 0.9473, test_f1: 0.5125
 epoch: 38, train_loss: 0.9503, test_loss: 0.9329, test_f1: 0.5218
 epoch: 39, train_loss: 0.9545, test_loss: 0.9413, test_f1: 0.5073
 epoch: 40, train_loss: 0.9521, test_loss: 0.9342, test_f1: 0.5210
 epoch: 41, train_loss: 0.9449, test_loss: 0.9888, test_f1: 0.5049
 epoch: 42, train_loss: 0.9277, test_loss: 0.9424, test_f1: 0.5074
 epoch: 43, train_loss: 0.9360, test_loss: 1.0292, test_f1: 0.5164
 epoch: 44, train_loss: 0.9318, test_loss: 0.9664, test_f1: 0.4970
 epoch: 45, train_loss: 0.9351, test_loss: 0.9379, test_f1: 0.5152
 epoch: 46, train_loss: 0.9271, test_loss: 1.0402, test_f1: 0.4962
 epoch: 47, train_loss: 0.9261, test_loss: 0.9216, test_f1: 0.5140
 epoch: 48, train_loss: 0.9242, test_loss: 0.9176, test_f1: 0.5129
 epoch: 49, train_loss: 0.9195, test_loss: 0.9258, test_f1: 0.5327
 epoch: 50, train_loss: 0.9098, test_loss: 0.9113, test_f1: 0.5182
 epoch: 51, train_loss: 0.9157, test_loss: 0.9000, test_f1: 0.5327
 epoch: 52, train_loss: 0.9183, test_loss: 0.8972, test_f1: 0.5373
 epoch: 53, train_loss: 0.8993, test_loss: 0.8994, test_f1: 0.5248
 epoch: 54, train_loss: 0.9136, test_loss: 0.9028, test_f1: 0.5215
 epoch: 55, train_loss: 0.9155, test_loss: 0.8800, test_f1: 0.5281
 epoch: 56, train_loss: 0.9183, test_loss: 0.8889, test_f1: 0.5229
 epoch: 57, train_loss: 0.9051, test_loss: 0.8963, test_f1: 0.5245
 epoch: 58, train_loss: 0.9168, test_loss: 0.9099, test_f1: 0.5279
 epoch: 59, train_loss: 0.8982, test_loss: 0.8920, test_f1: 0.5247
 epoch: 60, train_loss: 0.9023, test_loss: 0.8992, test_f1: 0.5194
 epoch: 61, train_loss: 0.9056, test_loss: 0.8912, test_f1: 0.5318
 epoch: 62, train_loss: 0.9062, test_loss: 0.8992, test_f1: 0.5237
 epoch: 63, train_loss: 0.9022, test_loss: 0.8981, test_f1: 0.5278
 epoch: 64, train_loss: 0.9048, test_loss: 0.9027, test_f1: 0.5222
 epoch: 65, train_loss: 0.9084, test_loss: 0.8956, test_f1: 0.5287
 epoch: 66, train_loss: 0.9079, test_loss: 0.8980, test_f1: 0.5350
 epoch: 67, train_loss: 0.8993, test_loss: 0.8976, test_f1: 0.5375
 epoch: 68, train_loss: 0.8990, test_loss: 0.8976, test_f1: 0.5286
 epoch: 69, train_loss: 0.9069, test_loss: 0.8895, test_f1: 0.5370
 epoch: 70, train_loss: 0.8882, test_loss: 0.8927, test_f1: 0.5302
 epoch: 71, train_loss: 0.8953, test_loss: 0.9014, test_f1: 0.5176
 epoch: 72, train_loss: 0.8931, test_loss: 0.9011, test_f1: 0.5360
 epoch: 73, train_loss: 0.8988, test_loss: 0.9096, test_f1: 0.5280
 epoch: 74, train_loss: 0.8987, test_loss: 0.8971, test_f1: 0.5388
 epoch: 75, train_loss: 0.8910, test_loss: 0.9035, test_f1: 0.5265
 epoch: 76, train_loss: 0.8973, test_loss: 0.9082, test_f1: 0.5262
 epoch: 77, train_loss: 0.8946, test_loss: 0.8932, test_f1: 0.5407
 epoch: 78, train_loss: 0.8935, test_loss: 0.9034, test_f1: 0.5378
 epoch: 79, train_loss: 0.8890, test_loss: 0.8936, test_f1: 0.5389
 epoch: 80, train_loss: 0.8860, test_loss: 0.8968, test_f1: 0.5306
 epoch: 81, train_loss: 0.8799, test_loss: 0.8913, test_f1: 0.5425
 epoch: 82, train_loss: 0.8865, test_loss: 0.8934, test_f1: 0.5346
 epoch: 83, train_loss: 0.8946, test_loss: 0.9061, test_f1: 0.5336
 epoch: 84, train_loss: 0.8881, test_loss: 0.8968, test_f1: 0.5383
 epoch: 85, train_loss: 0.8887, test_loss: 0.9104, test_f1: 0.5436
 epoch: 86, train_loss: 0.8853, test_loss: 0.8830, test_f1: 0.5342
 epoch: 87, train_loss: 0.8794, test_loss: 0.9079, test_f1: 0.5245
 epoch: 88, train_loss: 0.8926, test_loss: 0.8988, test_f1: 0.5368
 epoch: 89, train_loss: 0.8840, test_loss: 0.9119, test_f1: 0.5262
 epoch: 90, train_loss: 0.8793, test_loss: 0.9126, test_f1: 0.5302
 epoch: 91, train_loss: 0.8750, test_loss: 0.9008, test_f1: 0.5398
 epoch: 92, train_loss: 0.8878, test_loss: 0.9081, test_f1: 0.5335
 epoch: 93, train_loss: 0.8776, test_loss: 0.9012, test_f1: 0.5337
 epoch: 94, train_loss: 0.8726, test_loss: 0.9082, test_f1: 0.5340
 epoch: 95, train_loss: 0.8836, test_loss: 0.9206, test_f1: 0.5326
 epoch: 96, train_loss: 0.8812, test_loss: 0.9110, test_f1: 0.5306
 epoch: 97, train_loss: 0.8805, test_loss: 0.9155, test_f1: 0.5184
 epoch: 98, train_loss: 0.8779, test_loss: 0.9027, test_f1: 0.5373
 epoch: 99, train_loss: 0.8693, test_loss: 0.9240, test_f1: 0.5328
##################ITERATION #7 ****************************************
 epoch: 0, train_loss: 1.3175, test_loss: 1.3702, test_f1: 0.2270
 epoch: 1, train_loss: 1.2220, test_loss: 1.2939, test_f1: 0.2270
 epoch: 2, train_loss: 1.2017, test_loss: 1.2328, test_f1: 0.2270
 epoch: 3, train_loss: 1.1812, test_loss: 1.1634, test_f1: 0.2808
 epoch: 4, train_loss: 1.1675, test_loss: 1.1016, test_f1: 0.3717
 epoch: 5, train_loss: 1.1417, test_loss: 1.0802, test_f1: 0.3978
 epoch: 6, train_loss: 1.1343, test_loss: 1.0637, test_f1: 0.4031
 epoch: 7, train_loss: 1.1210, test_loss: 1.0543, test_f1: 0.4071
 epoch: 8, train_loss: 1.1024, test_loss: 1.0418, test_f1: 0.4111
 epoch: 9, train_loss: 1.0969, test_loss: 1.0375, test_f1: 0.4114
 epoch: 10, train_loss: 1.0724, test_loss: 1.0301, test_f1: 0.4205
 epoch: 11, train_loss: 1.0694, test_loss: 1.0205, test_f1: 0.4287
 epoch: 12, train_loss: 1.0608, test_loss: 1.0248, test_f1: 0.4250
 epoch: 13, train_loss: 1.0503, test_loss: 1.0185, test_f1: 0.4306
 epoch: 14, train_loss: 1.0362, test_loss: 1.0165, test_f1: 0.4341
 epoch: 15, train_loss: 1.0338, test_loss: 1.0057, test_f1: 0.4352
 epoch: 16, train_loss: 1.0321, test_loss: 1.0069, test_f1: 0.4459
 epoch: 17, train_loss: 1.0208, test_loss: 1.0123, test_f1: 0.4458
 epoch: 18, train_loss: 1.0173, test_loss: 1.0054, test_f1: 0.4518
 epoch: 19, train_loss: 1.0121, test_loss: 1.0048, test_f1: 0.4473
 epoch: 20, train_loss: 1.0073, test_loss: 1.0092, test_f1: 0.4432
 epoch: 21, train_loss: 0.9900, test_loss: 1.0052, test_f1: 0.4460
 epoch: 22, train_loss: 0.9865, test_loss: 1.0037, test_f1: 0.4464
 epoch: 23, train_loss: 0.9881, test_loss: 1.0034, test_f1: 0.4535
 epoch: 24, train_loss: 0.9795, test_loss: 0.9953, test_f1: 0.4587
 epoch: 25, train_loss: 0.9822, test_loss: 1.0015, test_f1: 0.4635
 epoch: 26, train_loss: 0.9738, test_loss: 1.0044, test_f1: 0.4598
 epoch: 27, train_loss: 0.9743, test_loss: 0.9928, test_f1: 0.4679
 epoch: 28, train_loss: 0.9679, test_loss: 1.0074, test_f1: 0.4609
 epoch: 29, train_loss: 0.9662, test_loss: 0.9971, test_f1: 0.4590
 epoch: 30, train_loss: 0.9565, test_loss: 0.9992, test_f1: 0.4609
 epoch: 31, train_loss: 0.9476, test_loss: 0.9985, test_f1: 0.4669
 epoch: 32, train_loss: 0.9438, test_loss: 0.9928, test_f1: 0.4692
 epoch: 33, train_loss: 0.9469, test_loss: 0.9879, test_f1: 0.4721
 epoch: 34, train_loss: 0.9399, test_loss: 0.9914, test_f1: 0.4703
 epoch: 35, train_loss: 0.9406, test_loss: 0.9889, test_f1: 0.4668
 epoch: 36, train_loss: 0.9306, test_loss: 0.9917, test_f1: 0.4725
 epoch: 37, train_loss: 0.9358, test_loss: 0.9967, test_f1: 0.4688
 epoch: 38, train_loss: 0.9371, test_loss: 0.9820, test_f1: 0.4825
 epoch: 39, train_loss: 0.9347, test_loss: 0.9940, test_f1: 0.4723
 epoch: 40, train_loss: 0.9302, test_loss: 0.9835, test_f1: 0.4787
 epoch: 41, train_loss: 0.9203, test_loss: 0.9891, test_f1: 0.4754
 epoch: 42, train_loss: 0.9181, test_loss: 0.9983, test_f1: 0.4755
 epoch: 43, train_loss: 0.9227, test_loss: 0.9888, test_f1: 0.4819
 epoch: 44, train_loss: 0.9226, test_loss: 0.9958, test_f1: 0.4791
 epoch: 45, train_loss: 0.9221, test_loss: 0.9891, test_f1: 0.4824
 epoch: 46, train_loss: 0.9147, test_loss: 0.9967, test_f1: 0.4794
 epoch: 47, train_loss: 0.9035, test_loss: 0.9954, test_f1: 0.4832
 epoch: 48, train_loss: 0.9190, test_loss: 0.9866, test_f1: 0.4895
 epoch: 49, train_loss: 0.9031, test_loss: 0.9806, test_f1: 0.4853
 epoch: 50, train_loss: 0.9039, test_loss: 0.9947, test_f1: 0.4863
 epoch: 51, train_loss: 0.8976, test_loss: 0.9869, test_f1: 0.4859
 epoch: 52, train_loss: 0.8916, test_loss: 0.9936, test_f1: 0.4904
 epoch: 53, train_loss: 0.8895, test_loss: 0.9829, test_f1: 0.4908
 epoch: 54, train_loss: 0.8979, test_loss: 0.9919, test_f1: 0.4886
 epoch: 55, train_loss: 0.8922, test_loss: 0.9802, test_f1: 0.4932
 epoch: 56, train_loss: 0.8974, test_loss: 0.9869, test_f1: 0.4928
 epoch: 57, train_loss: 0.8856, test_loss: 0.9940, test_f1: 0.4905
 epoch: 58, train_loss: 0.9020, test_loss: 0.9854, test_f1: 0.4948
 epoch: 59, train_loss: 0.8895, test_loss: 0.9844, test_f1: 0.4966
 epoch: 60, train_loss: 0.8855, test_loss: 0.9885, test_f1: 0.4984
 epoch: 61, train_loss: 0.8859, test_loss: 0.9887, test_f1: 0.4945
 epoch: 62, train_loss: 0.8845, test_loss: 0.9891, test_f1: 0.4948
 epoch: 63, train_loss: 0.8909, test_loss: 0.9856, test_f1: 0.4962
 epoch: 64, train_loss: 0.8774, test_loss: 0.9879, test_f1: 0.4903
 epoch: 65, train_loss: 0.8904, test_loss: 0.9948, test_f1: 0.4918
 epoch: 66, train_loss: 0.8849, test_loss: 0.9849, test_f1: 0.5017
 epoch: 67, train_loss: 0.8878, test_loss: 0.9916, test_f1: 0.4961
 epoch: 68, train_loss: 0.8884, test_loss: 0.9793, test_f1: 0.5026
 epoch: 69, train_loss: 0.8782, test_loss: 0.9843, test_f1: 0.4964
 epoch: 70, train_loss: 0.8779, test_loss: 0.9833, test_f1: 0.4953
 epoch: 71, train_loss: 0.8785, test_loss: 1.0020, test_f1: 0.4905
 epoch: 72, train_loss: 0.8767, test_loss: 0.9775, test_f1: 0.5004
 epoch: 73, train_loss: 0.8845, test_loss: 0.9823, test_f1: 0.5011
 epoch: 74, train_loss: 0.8791, test_loss: 0.9879, test_f1: 0.4933
 epoch: 75, train_loss: 0.8654, test_loss: 0.9780, test_f1: 0.5031
 epoch: 76, train_loss: 0.8858, test_loss: 0.9873, test_f1: 0.5058
 epoch: 77, train_loss: 0.8732, test_loss: 0.9805, test_f1: 0.5034
 epoch: 78, train_loss: 0.8746, test_loss: 0.9910, test_f1: 0.5037
 epoch: 79, train_loss: 0.8681, test_loss: 0.9850, test_f1: 0.4996
 epoch: 80, train_loss: 0.8714, test_loss: 0.9936, test_f1: 0.4978
 epoch: 81, train_loss: 0.8699, test_loss: 0.9838, test_f1: 0.5009
 epoch: 82, train_loss: 0.8672, test_loss: 0.9841, test_f1: 0.5005
 epoch: 83, train_loss: 0.8622, test_loss: 0.9820, test_f1: 0.5094
 epoch: 84, train_loss: 0.8660, test_loss: 0.9902, test_f1: 0.5057
 epoch: 85, train_loss: 0.8635, test_loss: 0.9860, test_f1: 0.4970
 epoch: 86, train_loss: 0.8690, test_loss: 0.9829, test_f1: 0.5081
 epoch: 87, train_loss: 0.8641, test_loss: 0.9788, test_f1: 0.5030
 epoch: 88, train_loss: 0.8657, test_loss: 1.0022, test_f1: 0.4903
 epoch: 89, train_loss: 0.8600, test_loss: 0.9819, test_f1: 0.5063
 epoch: 90, train_loss: 0.8740, test_loss: 0.9857, test_f1: 0.5059
 epoch: 91, train_loss: 0.8646, test_loss: 0.9973, test_f1: 0.5002
 epoch: 92, train_loss: 0.8660, test_loss: 0.9917, test_f1: 0.5086
 epoch: 93, train_loss: 0.8608, test_loss: 0.9830, test_f1: 0.5036
 epoch: 94, train_loss: 0.8545, test_loss: 0.9807, test_f1: 0.5048
 epoch: 95, train_loss: 0.8529, test_loss: 0.9808, test_f1: 0.5051
 epoch: 96, train_loss: 0.8603, test_loss: 0.9904, test_f1: 0.5017
 epoch: 97, train_loss: 0.8617, test_loss: 0.9799, test_f1: 0.5038
 epoch: 98, train_loss: 0.8596, test_loss: 0.9906, test_f1: 0.5069
 epoch: 99, train_loss: 0.8544, test_loss: 0.9842, test_f1: 0.5094
##################ITERATION #8 ****************************************
 epoch: 0, train_loss: 1.4825, test_loss: 1.3641, test_f1: 0.2270
 epoch: 1, train_loss: 1.2805, test_loss: 1.3805, test_f1: 0.2270
 epoch: 2, train_loss: 1.2253, test_loss: 1.2955, test_f1: 0.2270
 epoch: 3, train_loss: 1.1961, test_loss: 1.1906, test_f1: 0.2833
 epoch: 4, train_loss: 1.1681, test_loss: 1.1027, test_f1: 0.3956
 epoch: 5, train_loss: 1.1309, test_loss: 1.0665, test_f1: 0.4352
 epoch: 6, train_loss: 1.1054, test_loss: 1.0454, test_f1: 0.4142
 epoch: 7, train_loss: 1.0960, test_loss: 1.0433, test_f1: 0.4358
 epoch: 8, train_loss: 1.0817, test_loss: 1.0216, test_f1: 0.4193
 epoch: 9, train_loss: 1.0664, test_loss: 1.0237, test_f1: 0.4368
 epoch: 10, train_loss: 1.0476, test_loss: 1.0134, test_f1: 0.4422
 epoch: 11, train_loss: 1.0455, test_loss: 1.0084, test_f1: 0.4432
 epoch: 12, train_loss: 1.0296, test_loss: 0.9945, test_f1: 0.4502
 epoch: 13, train_loss: 1.0257, test_loss: 1.0006, test_f1: 0.4523
 epoch: 14, train_loss: 1.0209, test_loss: 0.9744, test_f1: 0.4604
 epoch: 15, train_loss: 1.0173, test_loss: 0.9822, test_f1: 0.4523
 epoch: 16, train_loss: 0.9974, test_loss: 0.9936, test_f1: 0.4465
 epoch: 17, train_loss: 1.0010, test_loss: 0.9779, test_f1: 0.4596
 epoch: 18, train_loss: 0.9933, test_loss: 0.9819, test_f1: 0.4697
 epoch: 19, train_loss: 0.9940, test_loss: 0.9712, test_f1: 0.4578
 epoch: 20, train_loss: 0.9874, test_loss: 0.9859, test_f1: 0.4718
 epoch: 21, train_loss: 0.9943, test_loss: 0.9795, test_f1: 0.4564
 epoch: 22, train_loss: 0.9777, test_loss: 0.9754, test_f1: 0.4615
 epoch: 23, train_loss: 0.9747, test_loss: 0.9745, test_f1: 0.4689
 epoch: 24, train_loss: 0.9803, test_loss: 0.9979, test_f1: 0.4897
 epoch: 25, train_loss: 0.9666, test_loss: 0.9948, test_f1: 0.4483
 epoch: 26, train_loss: 0.9675, test_loss: 0.9991, test_f1: 0.4709
 epoch: 27, train_loss: 0.9552, test_loss: 1.0011, test_f1: 0.4667
 epoch: 28, train_loss: 0.9529, test_loss: 0.9906, test_f1: 0.4824
 epoch: 29, train_loss: 0.9633, test_loss: 1.0009, test_f1: 0.4722
 epoch: 30, train_loss: 0.9527, test_loss: 1.0085, test_f1: 0.4976
 epoch: 31, train_loss: 0.9550, test_loss: 1.0043, test_f1: 0.4593
 epoch: 32, train_loss: 0.9538, test_loss: 0.9686, test_f1: 0.4916
 epoch: 33, train_loss: 0.9562, test_loss: 0.9930, test_f1: 0.4682
 epoch: 34, train_loss: 0.9464, test_loss: 1.0040, test_f1: 0.4648
 epoch: 35, train_loss: 0.9309, test_loss: 0.9913, test_f1: 0.4729
 epoch: 36, train_loss: 0.9425, test_loss: 0.9849, test_f1: 0.4837
 epoch: 37, train_loss: 0.9376, test_loss: 1.0009, test_f1: 0.4590
 epoch: 38, train_loss: 0.9408, test_loss: 0.9796, test_f1: 0.4856
 epoch: 39, train_loss: 0.9356, test_loss: 0.9690, test_f1: 0.4786
 epoch: 40, train_loss: 0.9371, test_loss: 0.9792, test_f1: 0.4956
 epoch: 41, train_loss: 0.9244, test_loss: 0.9828, test_f1: 0.4827
 epoch: 42, train_loss: 0.9259, test_loss: 1.0006, test_f1: 0.4741
 epoch: 43, train_loss: 0.9366, test_loss: 0.9970, test_f1: 0.4824
 epoch: 44, train_loss: 0.9348, test_loss: 0.9862, test_f1: 0.4851
 epoch: 45, train_loss: 0.9217, test_loss: 0.9807, test_f1: 0.5053
 epoch: 46, train_loss: 0.9244, test_loss: 0.9790, test_f1: 0.4747
 epoch: 47, train_loss: 0.9206, test_loss: 0.9797, test_f1: 0.4909
 epoch: 48, train_loss: 0.9216, test_loss: 0.9828, test_f1: 0.4994
 epoch: 49, train_loss: 0.9225, test_loss: 0.9585, test_f1: 0.4974
 epoch: 50, train_loss: 0.9150, test_loss: 0.9772, test_f1: 0.4879
 epoch: 51, train_loss: 0.9169, test_loss: 0.9750, test_f1: 0.4882
 epoch: 52, train_loss: 0.9111, test_loss: 0.9712, test_f1: 0.4884
 epoch: 53, train_loss: 0.9038, test_loss: 0.9727, test_f1: 0.4885
 epoch: 54, train_loss: 0.9172, test_loss: 0.9647, test_f1: 0.5056
 epoch: 55, train_loss: 0.9026, test_loss: 0.9670, test_f1: 0.4963
 epoch: 56, train_loss: 0.9090, test_loss: 0.9752, test_f1: 0.4862
 epoch: 57, train_loss: 0.9110, test_loss: 0.9801, test_f1: 0.4991
 epoch: 58, train_loss: 0.8890, test_loss: 0.9867, test_f1: 0.4907
 epoch: 59, train_loss: 0.9020, test_loss: 0.9911, test_f1: 0.4899
 epoch: 60, train_loss: 0.8982, test_loss: 0.9885, test_f1: 0.4904
 epoch: 61, train_loss: 0.9034, test_loss: 0.9744, test_f1: 0.4945
 epoch: 62, train_loss: 0.9061, test_loss: 0.9883, test_f1: 0.4904
 epoch: 63, train_loss: 0.8936, test_loss: 0.9745, test_f1: 0.4905
 epoch: 64, train_loss: 0.9036, test_loss: 0.9687, test_f1: 0.4877
 epoch: 65, train_loss: 0.9049, test_loss: 0.9768, test_f1: 0.4954
 epoch: 66, train_loss: 0.8949, test_loss: 0.9775, test_f1: 0.4921
 epoch: 67, train_loss: 0.8999, test_loss: 0.9956, test_f1: 0.4856
 epoch: 68, train_loss: 0.8878, test_loss: 0.9856, test_f1: 0.4917
 epoch: 69, train_loss: 0.8897, test_loss: 0.9773, test_f1: 0.5043
 epoch: 70, train_loss: 0.9032, test_loss: 0.9691, test_f1: 0.5067
 epoch: 71, train_loss: 0.8917, test_loss: 0.9727, test_f1: 0.4930
 epoch: 72, train_loss: 0.9014, test_loss: 0.9779, test_f1: 0.4898
 epoch: 73, train_loss: 0.8885, test_loss: 0.9766, test_f1: 0.4934
 epoch: 74, train_loss: 0.8787, test_loss: 0.9928, test_f1: 0.4983
 epoch: 75, train_loss: 0.8882, test_loss: 0.9942, test_f1: 0.4911
 epoch: 76, train_loss: 0.8763, test_loss: 0.9791, test_f1: 0.4956
 epoch: 77, train_loss: 0.8769, test_loss: 0.9765, test_f1: 0.4989
 epoch: 78, train_loss: 0.8868, test_loss: 0.9839, test_f1: 0.4968
 epoch: 79, train_loss: 0.8831, test_loss: 0.9799, test_f1: 0.5005
 epoch: 80, train_loss: 0.8847, test_loss: 0.9763, test_f1: 0.5011
 epoch: 81, train_loss: 0.8848, test_loss: 0.9788, test_f1: 0.4951
 epoch: 82, train_loss: 0.8815, test_loss: 0.9862, test_f1: 0.4979
 epoch: 83, train_loss: 0.8774, test_loss: 0.9640, test_f1: 0.4931
 epoch: 84, train_loss: 0.8775, test_loss: 0.9751, test_f1: 0.5016
 epoch: 85, train_loss: 0.8765, test_loss: 0.9797, test_f1: 0.4894
 epoch: 86, train_loss: 0.8870, test_loss: 0.9803, test_f1: 0.4941
 epoch: 87, train_loss: 0.8849, test_loss: 0.9895, test_f1: 0.4915
 epoch: 88, train_loss: 0.8740, test_loss: 0.9784, test_f1: 0.4997
 epoch: 89, train_loss: 0.8772, test_loss: 0.9746, test_f1: 0.4985
 epoch: 90, train_loss: 0.8731, test_loss: 0.9781, test_f1: 0.4989
 epoch: 91, train_loss: 0.8708, test_loss: 0.9831, test_f1: 0.5019
 epoch: 92, train_loss: 0.8745, test_loss: 0.9877, test_f1: 0.4945
 epoch: 93, train_loss: 0.8835, test_loss: 0.9893, test_f1: 0.4921
 epoch: 94, train_loss: 0.8713, test_loss: 0.9802, test_f1: 0.4943
 epoch: 95, train_loss: 0.8791, test_loss: 0.9753, test_f1: 0.5003
 epoch: 96, train_loss: 0.8772, test_loss: 0.9775, test_f1: 0.5008
 epoch: 97, train_loss: 0.8714, test_loss: 0.9755, test_f1: 0.5058
 epoch: 98, train_loss: 0.8744, test_loss: 0.9869, test_f1: 0.4937
 epoch: 99, train_loss: 0.8713, test_loss: 0.9850, test_f1: 0.5001
##################ITERATION #9 ****************************************
 epoch: 0, train_loss: 1.5028, test_loss: 1.3303, test_f1: 0.2270
 epoch: 1, train_loss: 1.3152, test_loss: 1.3115, test_f1: 0.2270
 epoch: 2, train_loss: 1.2792, test_loss: 1.2733, test_f1: 0.2292
 epoch: 3, train_loss: 1.2442, test_loss: 1.2313, test_f1: 0.2307
 epoch: 4, train_loss: 1.2265, test_loss: 1.2058, test_f1: 0.2392
 epoch: 5, train_loss: 1.2148, test_loss: 1.1737, test_f1: 0.2561
 epoch: 6, train_loss: 1.1882, test_loss: 1.1482, test_f1: 0.3026
 epoch: 7, train_loss: 1.1632, test_loss: 1.1189, test_f1: 0.3253
 epoch: 8, train_loss: 1.1409, test_loss: 1.0919, test_f1: 0.3636
 epoch: 9, train_loss: 1.1270, test_loss: 1.0693, test_f1: 0.3677
 epoch: 10, train_loss: 1.1190, test_loss: 1.0594, test_f1: 0.3663
 epoch: 11, train_loss: 1.0997, test_loss: 1.0474, test_f1: 0.3592
 epoch: 12, train_loss: 1.0857, test_loss: 1.0407, test_f1: 0.3627
 epoch: 13, train_loss: 1.0787, test_loss: 1.0418, test_f1: 0.3678
 epoch: 14, train_loss: 1.0786, test_loss: 1.0394, test_f1: 0.3670
 epoch: 15, train_loss: 1.0707, test_loss: 1.0359, test_f1: 0.3578
 epoch: 16, train_loss: 1.0609, test_loss: 1.0327, test_f1: 0.3634
 epoch: 17, train_loss: 1.0480, test_loss: 1.0390, test_f1: 0.3734
 epoch: 18, train_loss: 1.0499, test_loss: 1.0340, test_f1: 0.3636
 epoch: 19, train_loss: 1.0427, test_loss: 1.0187, test_f1: 0.3514
 epoch: 20, train_loss: 1.0378, test_loss: 1.0354, test_f1: 0.3527
 epoch: 21, train_loss: 1.0332, test_loss: 1.0233, test_f1: 0.3532
 epoch: 22, train_loss: 1.0228, test_loss: 1.0122, test_f1: 0.3655
 epoch: 23, train_loss: 1.0224, test_loss: 1.0124, test_f1: 0.3666
 epoch: 24, train_loss: 1.0211, test_loss: 1.0211, test_f1: 0.3595
 epoch: 25, train_loss: 1.0142, test_loss: 1.0116, test_f1: 0.3759
 epoch: 26, train_loss: 1.0141, test_loss: 1.0214, test_f1: 0.3846
 epoch: 27, train_loss: 1.0060, test_loss: 1.0090, test_f1: 0.3873
 epoch: 28, train_loss: 1.0102, test_loss: 0.9940, test_f1: 0.3848
 epoch: 29, train_loss: 1.0102, test_loss: 0.9794, test_f1: 0.4182
 epoch: 30, train_loss: 0.9997, test_loss: 0.9982, test_f1: 0.3981
 epoch: 31, train_loss: 1.0012, test_loss: 0.9782, test_f1: 0.3883
 epoch: 32, train_loss: 0.9878, test_loss: 0.9710, test_f1: 0.4400
 epoch: 33, train_loss: 0.9918, test_loss: 0.9714, test_f1: 0.4390
 epoch: 34, train_loss: 0.9860, test_loss: 0.9715, test_f1: 0.4371
 epoch: 35, train_loss: 0.9797, test_loss: 0.9559, test_f1: 0.4599
 epoch: 36, train_loss: 0.9766, test_loss: 0.9629, test_f1: 0.4596
 epoch: 37, train_loss: 0.9766, test_loss: 0.9683, test_f1: 0.4709
 epoch: 38, train_loss: 0.9692, test_loss: 0.9495, test_f1: 0.4957
 epoch: 39, train_loss: 0.9692, test_loss: 0.9681, test_f1: 0.4805
 epoch: 40, train_loss: 0.9661, test_loss: 0.9656, test_f1: 0.4880
 epoch: 41, train_loss: 0.9588, test_loss: 0.9584, test_f1: 0.4871
 epoch: 42, train_loss: 0.9497, test_loss: 0.9747, test_f1: 0.4936
 epoch: 43, train_loss: 0.9542, test_loss: 0.9721, test_f1: 0.4958
 epoch: 44, train_loss: 0.9537, test_loss: 0.9648, test_f1: 0.4964
 epoch: 45, train_loss: 0.9546, test_loss: 0.9664, test_f1: 0.4899
 epoch: 46, train_loss: 0.9401, test_loss: 0.9565, test_f1: 0.4892
 epoch: 47, train_loss: 0.9413, test_loss: 0.9577, test_f1: 0.5010
 epoch: 48, train_loss: 0.9415, test_loss: 0.9402, test_f1: 0.5066
 epoch: 49, train_loss: 0.9350, test_loss: 0.9384, test_f1: 0.5063
 epoch: 50, train_loss: 0.9306, test_loss: 0.9392, test_f1: 0.5134
 epoch: 51, train_loss: 0.9312, test_loss: 0.9464, test_f1: 0.4978
 epoch: 52, train_loss: 0.9284, test_loss: 0.9304, test_f1: 0.5143
 epoch: 53, train_loss: 0.9245, test_loss: 0.9581, test_f1: 0.4946
 epoch: 54, train_loss: 0.9197, test_loss: 0.9402, test_f1: 0.5051
 epoch: 55, train_loss: 0.9260, test_loss: 0.9427, test_f1: 0.5037
 epoch: 56, train_loss: 0.9262, test_loss: 0.9351, test_f1: 0.5112
 epoch: 57, train_loss: 0.9264, test_loss: 0.9365, test_f1: 0.5049
 epoch: 58, train_loss: 0.9312, test_loss: 0.9394, test_f1: 0.5017
 epoch: 59, train_loss: 0.9204, test_loss: 0.9371, test_f1: 0.5083
 epoch: 60, train_loss: 0.9223, test_loss: 0.9441, test_f1: 0.5066
 epoch: 61, train_loss: 0.9192, test_loss: 0.9413, test_f1: 0.4993
 epoch: 62, train_loss: 0.9159, test_loss: 0.9449, test_f1: 0.4906
 epoch: 63, train_loss: 0.9168, test_loss: 0.9518, test_f1: 0.5016
 epoch: 64, train_loss: 0.9237, test_loss: 0.9504, test_f1: 0.4999
 epoch: 65, train_loss: 0.9129, test_loss: 0.9515, test_f1: 0.5047
 epoch: 66, train_loss: 0.9114, test_loss: 0.9469, test_f1: 0.5030
 epoch: 67, train_loss: 0.9110, test_loss: 0.9423, test_f1: 0.5004
 epoch: 68, train_loss: 0.9204, test_loss: 0.9431, test_f1: 0.5116
 epoch: 69, train_loss: 0.9188, test_loss: 0.9429, test_f1: 0.5079
 epoch: 70, train_loss: 0.9064, test_loss: 0.9428, test_f1: 0.5063
 epoch: 71, train_loss: 0.9115, test_loss: 0.9422, test_f1: 0.4964
 epoch: 72, train_loss: 0.9156, test_loss: 0.9365, test_f1: 0.4954
 epoch: 73, train_loss: 0.9182, test_loss: 0.9331, test_f1: 0.5055
 epoch: 74, train_loss: 0.9192, test_loss: 0.9378, test_f1: 0.5038
 epoch: 75, train_loss: 0.9072, test_loss: 0.9296, test_f1: 0.5057
 epoch: 76, train_loss: 0.9078, test_loss: 0.9257, test_f1: 0.5155
 epoch: 77, train_loss: 0.9089, test_loss: 0.9352, test_f1: 0.5147
 epoch: 78, train_loss: 0.9066, test_loss: 0.9518, test_f1: 0.5029
 epoch: 79, train_loss: 0.8994, test_loss: 0.9428, test_f1: 0.5050
 epoch: 80, train_loss: 0.9047, test_loss: 0.9288, test_f1: 0.5092
 epoch: 81, train_loss: 0.9118, test_loss: 0.9320, test_f1: 0.5043
 epoch: 82, train_loss: 0.9060, test_loss: 0.9302, test_f1: 0.4987
 epoch: 83, train_loss: 0.9003, test_loss: 0.9453, test_f1: 0.5029
 epoch: 84, train_loss: 0.9003, test_loss: 0.9404, test_f1: 0.5018
 epoch: 85, train_loss: 0.9063, test_loss: 0.9432, test_f1: 0.4995
 epoch: 86, train_loss: 0.8984, test_loss: 0.9333, test_f1: 0.5122
 epoch: 87, train_loss: 0.9025, test_loss: 0.9481, test_f1: 0.5059
 epoch: 88, train_loss: 0.9035, test_loss: 0.9491, test_f1: 0.5086
 epoch: 89, train_loss: 0.8959, test_loss: 0.9348, test_f1: 0.4993
 epoch: 90, train_loss: 0.9021, test_loss: 0.9311, test_f1: 0.4977
 epoch: 91, train_loss: 0.9059, test_loss: 0.9478, test_f1: 0.5048
 epoch: 92, train_loss: 0.8992, test_loss: 0.9560, test_f1: 0.5073
 epoch: 93, train_loss: 0.8958, test_loss: 0.9444, test_f1: 0.5046
 epoch: 94, train_loss: 0.8979, test_loss: 0.9543, test_f1: 0.5000
 epoch: 95, train_loss: 0.8869, test_loss: 0.9472, test_f1: 0.5012
 epoch: 96, train_loss: 0.8979, test_loss: 0.9349, test_f1: 0.5100
 epoch: 97, train_loss: 0.9015, test_loss: 0.9384, test_f1: 0.5123
 epoch: 98, train_loss: 0.8931, test_loss: 0.9429, test_f1: 0.5064
 epoch: 99, train_loss: 0.8991, test_loss: 0.9546, test_f1: 0.5093

Training completed in 465.75 seconds
Best F1: 0.5436 at epoch 85
Mean F1 across iterations: 0.5153  0.0161
========================FINAL RESULTS================================
FEGIN weighted F1: 0.5436  0.0161
python main.py --data ltspice_examples --representation component_net --model FEGIN --layers 2 --hiddens 16 --batch_size 256 --lr 0.001 --emb_size 250 --epochs 100 --save_appendix component_net_L2_H16_BS256_LR0.001_E250 --no_val
-----



STDERR:
  File "main.py", line 370, in <module>
    main()
  File "main.py", line 254, in main
    dataset = dataset_class(
  File "/home/philip/projects/llm_inference_code_repo/Circuit-Completion-Using-GNNs/component_classification_with_link_prediction_head/evaluation/FEGIN/kernel/circuit_datasets.py", line 15, in __init__
    self.data, self.slices = torch.load(self.processed_paths[0])
  File "/home/philip/.local/lib/python3.8/site-packages/torch/serialization.py", line 1040, in load
    warnings.warn(
  File "/usr/lib/python3.8/warnings.py", line 109, in _showwarnmsg
    sw(msg.message, msg.category, msg.filename, msg.lineno,
  File "main.py", line 47, in warn_with_traceback
    traceback.print_stack(file=log)
/home/philip/projects/llm_inference_code_repo/Circuit-Completion-Using-GNNs/component_classification_with_link_prediction_head/evaluation/FEGIN/kernel/circuit_datasets.py:15: FutureWarning: You are using `torch.load` with `weights_only=False` (the current default value), which uses the default pickle module implicitly. It is possible to construct malicious pickle data which will execute arbitrary code during unpickling (See https://github.com/pytorch/pytorch/blob/main/SECURITY.md#untrusted-models for more details). In a future release, the default value for `weights_only` will be flipped to `True`. This limits the functions that could be executed during unpickling. Arbitrary objects will no longer be allowed to be loaded via this mode unless they are explicitly allowlisted by the user via `torch.serialization.add_safe_globals`. We recommend you start setting `weights_only=True` for any use case where you don't have full control of the loaded file. Please open an issue on GitHub for any issues related to this experimental feature.
  self.data, self.slices = torch.load(self.processed_paths[0])
