STDOUT:
Results will be saved in /home/philip/projects/ltspice_examples_code_repo/Circuit-Completion-Using-GNNs/component_classification_with_link_prediction_head/evaluation/FEGIN/results/model_FEGIN_dataset_ltspice_examples
Command line input: python main.py --data ltspice_examples --representation component_component --model FEGIN --layers 5 --hiddens 128 --batch_size 256 --lr 0.0001 --emb_size 250 --epochs 100 --save_appendix component_component_L5_H128_BS256_LR0.0001_E250 --no_val
 is saved.
-----
ltspice_examples - FEGIN
Using 5 layers, 128 hidden units, h = 2
Loading component_component representation dataset
ENTERED
Training FEGIN on component_component representation
Train: 3556, Test: 845
##################ITERATION #0 ****************************************
 epoch: 0, train_loss: 1.3908, test_loss: 1.3850, test_f1: 0.0794
 epoch: 1, train_loss: 1.3730, test_loss: 1.3757, test_f1: 0.2827
 epoch: 2, train_loss: 1.3600, test_loss: 1.3590, test_f1: 0.3149
 epoch: 3, train_loss: 1.3433, test_loss: 1.3372, test_f1: 0.3031
 epoch: 4, train_loss: 1.3231, test_loss: 1.3119, test_f1: 0.2837
 epoch: 5, train_loss: 1.3002, test_loss: 1.2840, test_f1: 0.2877
 epoch: 6, train_loss: 1.2745, test_loss: 1.2566, test_f1: 0.2909
 epoch: 7, train_loss: 1.2547, test_loss: 1.2307, test_f1: 0.2959
 epoch: 8, train_loss: 1.2337, test_loss: 1.2114, test_f1: 0.3291
 epoch: 9, train_loss: 1.2173, test_loss: 1.1933, test_f1: 0.3432
 epoch: 10, train_loss: 1.1981, test_loss: 1.1750, test_f1: 0.3491
 epoch: 11, train_loss: 1.1830, test_loss: 1.1609, test_f1: 0.3613
 epoch: 12, train_loss: 1.1634, test_loss: 1.1469, test_f1: 0.3580
 epoch: 13, train_loss: 1.1498, test_loss: 1.1311, test_f1: 0.3873
 epoch: 14, train_loss: 1.1292, test_loss: 1.1302, test_f1: 0.4138
 epoch: 15, train_loss: 1.1120, test_loss: 1.1118, test_f1: 0.4215
 epoch: 16, train_loss: 1.1008, test_loss: 1.1079, test_f1: 0.4421
 epoch: 17, train_loss: 1.0855, test_loss: 1.0928, test_f1: 0.4481
 epoch: 18, train_loss: 1.0665, test_loss: 1.0900, test_f1: 0.4547
 epoch: 19, train_loss: 1.0455, test_loss: 1.0741, test_f1: 0.4612
 epoch: 20, train_loss: 1.0376, test_loss: 1.0663, test_f1: 0.4559
 epoch: 21, train_loss: 1.0199, test_loss: 1.0694, test_f1: 0.4691
 epoch: 22, train_loss: 1.0051, test_loss: 1.0524, test_f1: 0.4717
 epoch: 23, train_loss: 0.9867, test_loss: 1.0408, test_f1: 0.4765
 epoch: 24, train_loss: 0.9736, test_loss: 1.0498, test_f1: 0.4693
 epoch: 25, train_loss: 0.9576, test_loss: 1.0911, test_f1: 0.4575
 epoch: 26, train_loss: 0.9437, test_loss: 1.0443, test_f1: 0.4780
 epoch: 27, train_loss: 0.9406, test_loss: 1.0588, test_f1: 0.4704
 epoch: 28, train_loss: 0.9287, test_loss: 1.0965, test_f1: 0.4793
 epoch: 29, train_loss: 0.9056, test_loss: 1.0578, test_f1: 0.4714
 epoch: 30, train_loss: 0.9015, test_loss: 1.0547, test_f1: 0.4866
 epoch: 31, train_loss: 0.8933, test_loss: 1.0582, test_f1: 0.4871
 epoch: 32, train_loss: 0.8803, test_loss: 1.1001, test_f1: 0.4863
 epoch: 33, train_loss: 0.8795, test_loss: 1.0542, test_f1: 0.4838
 epoch: 34, train_loss: 0.8635, test_loss: 1.1244, test_f1: 0.4888
 epoch: 35, train_loss: 0.8557, test_loss: 1.0975, test_f1: 0.4674
 epoch: 36, train_loss: 0.8424, test_loss: 1.1426, test_f1: 0.4814
 epoch: 37, train_loss: 0.8338, test_loss: 1.1172, test_f1: 0.4794
 epoch: 38, train_loss: 0.8347, test_loss: 1.1398, test_f1: 0.4887
 epoch: 39, train_loss: 0.8245, test_loss: 1.1579, test_f1: 0.4815
 epoch: 40, train_loss: 0.8135, test_loss: 1.1293, test_f1: 0.4803
 epoch: 41, train_loss: 0.7852, test_loss: 1.1050, test_f1: 0.4810
 epoch: 42, train_loss: 0.7872, test_loss: 1.1443, test_f1: 0.4892
 epoch: 43, train_loss: 0.7837, test_loss: 1.1654, test_f1: 0.4961
 epoch: 44, train_loss: 0.7886, test_loss: 1.1981, test_f1: 0.4827
 epoch: 45, train_loss: 0.7778, test_loss: 1.1408, test_f1: 0.4958
 epoch: 46, train_loss: 0.7824, test_loss: 1.1355, test_f1: 0.4787
 epoch: 47, train_loss: 0.7621, test_loss: 1.1490, test_f1: 0.4687
 epoch: 48, train_loss: 0.7576, test_loss: 1.1624, test_f1: 0.4896
 epoch: 49, train_loss: 0.7309, test_loss: 1.1542, test_f1: 0.4956
 epoch: 50, train_loss: 0.7341, test_loss: 1.2123, test_f1: 0.4846
 epoch: 51, train_loss: 0.7273, test_loss: 1.1837, test_f1: 0.4898
 epoch: 52, train_loss: 0.7171, test_loss: 1.1650, test_f1: 0.5033
 epoch: 53, train_loss: 0.7082, test_loss: 1.1758, test_f1: 0.5010
 epoch: 54, train_loss: 0.7169, test_loss: 1.2040, test_f1: 0.4860
 epoch: 55, train_loss: 0.7071, test_loss: 1.1796, test_f1: 0.5004
 epoch: 56, train_loss: 0.6881, test_loss: 1.1888, test_f1: 0.4938
 epoch: 57, train_loss: 0.6970, test_loss: 1.1954, test_f1: 0.5016
 epoch: 58, train_loss: 0.6871, test_loss: 1.2284, test_f1: 0.4943
 epoch: 59, train_loss: 0.6808, test_loss: 1.2365, test_f1: 0.4971
 epoch: 60, train_loss: 0.6755, test_loss: 1.2013, test_f1: 0.5070
 epoch: 61, train_loss: 0.6663, test_loss: 1.2491, test_f1: 0.5143
 epoch: 62, train_loss: 0.6617, test_loss: 1.2587, test_f1: 0.5070
 epoch: 63, train_loss: 0.6772, test_loss: 1.2450, test_f1: 0.5016
 epoch: 64, train_loss: 0.6553, test_loss: 1.2820, test_f1: 0.4916
 epoch: 65, train_loss: 0.6607, test_loss: 1.2907, test_f1: 0.5005
 epoch: 66, train_loss: 0.6532, test_loss: 1.2128, test_f1: 0.5128
 epoch: 67, train_loss: 0.6739, test_loss: 1.2527, test_f1: 0.5249
 epoch: 68, train_loss: 0.6508, test_loss: 1.2362, test_f1: 0.5184
 epoch: 69, train_loss: 0.6629, test_loss: 1.2329, test_f1: 0.5200
 epoch: 70, train_loss: 0.6707, test_loss: 1.2678, test_f1: 0.5181
 epoch: 71, train_loss: 0.6599, test_loss: 1.2906, test_f1: 0.5084
 epoch: 72, train_loss: 0.6500, test_loss: 1.2848, test_f1: 0.5016
 epoch: 73, train_loss: 0.6428, test_loss: 1.2541, test_f1: 0.5158
 epoch: 74, train_loss: 0.6434, test_loss: 1.3314, test_f1: 0.5090
 epoch: 75, train_loss: 0.6340, test_loss: 1.2921, test_f1: 0.5231
 epoch: 76, train_loss: 0.6402, test_loss: 1.2688, test_f1: 0.5292
 epoch: 77, train_loss: 0.6248, test_loss: 1.2779, test_f1: 0.5202
 epoch: 78, train_loss: 0.6346, test_loss: 1.2921, test_f1: 0.5113
 epoch: 79, train_loss: 0.6151, test_loss: 1.2956, test_f1: 0.5127
 epoch: 80, train_loss: 0.6244, test_loss: 1.3061, test_f1: 0.5189
 epoch: 81, train_loss: 0.6218, test_loss: 1.2855, test_f1: 0.5145
 epoch: 82, train_loss: 0.6097, test_loss: 1.3154, test_f1: 0.5296
 epoch: 83, train_loss: 0.6262, test_loss: 1.2950, test_f1: 0.5327
 epoch: 84, train_loss: 0.6075, test_loss: 1.3075, test_f1: 0.5255
 epoch: 85, train_loss: 0.5954, test_loss: 1.3186, test_f1: 0.5203
 epoch: 86, train_loss: 0.5897, test_loss: 1.3133, test_f1: 0.5307
 epoch: 87, train_loss: 0.5957, test_loss: 1.3147, test_f1: 0.5193
 epoch: 88, train_loss: 0.5929, test_loss: 1.3174, test_f1: 0.5267
 epoch: 89, train_loss: 0.5972, test_loss: 1.3556, test_f1: 0.5209
 epoch: 90, train_loss: 0.5805, test_loss: 1.3838, test_f1: 0.5115
 epoch: 91, train_loss: 0.5863, test_loss: 1.3568, test_f1: 0.5219
 epoch: 92, train_loss: 0.5811, test_loss: 1.3704, test_f1: 0.5206
 epoch: 93, train_loss: 0.5698, test_loss: 1.3883, test_f1: 0.5244
 epoch: 94, train_loss: 0.5669, test_loss: 1.3666, test_f1: 0.5182
 epoch: 95, train_loss: 0.5750, test_loss: 1.3959, test_f1: 0.5283
 epoch: 96, train_loss: 0.5800, test_loss: 1.3578, test_f1: 0.5256
 epoch: 97, train_loss: 0.5625, test_loss: 1.4035, test_f1: 0.5262
 epoch: 98, train_loss: 0.5769, test_loss: 1.4313, test_f1: 0.5213
 epoch: 99, train_loss: 0.5630, test_loss: 1.4309, test_f1: 0.5095
##################ITERATION #1 ****************************************
 epoch: 0, train_loss: 1.3400, test_loss: 1.3498, test_f1: 0.2274
 epoch: 1, train_loss: 1.2835, test_loss: 1.3174, test_f1: 0.2274
 epoch: 2, train_loss: 1.2568, test_loss: 1.2825, test_f1: 0.2670
 epoch: 3, train_loss: 1.2329, test_loss: 1.2429, test_f1: 0.3047
 epoch: 4, train_loss: 1.2114, test_loss: 1.2064, test_f1: 0.3461
 epoch: 5, train_loss: 1.1909, test_loss: 1.1775, test_f1: 0.4077
 epoch: 6, train_loss: 1.1757, test_loss: 1.1568, test_f1: 0.4125
 epoch: 7, train_loss: 1.1570, test_loss: 1.1405, test_f1: 0.4353
 epoch: 8, train_loss: 1.1422, test_loss: 1.1276, test_f1: 0.4535
 epoch: 9, train_loss: 1.1190, test_loss: 1.1161, test_f1: 0.4529
 epoch: 10, train_loss: 1.1067, test_loss: 1.1015, test_f1: 0.4693
 epoch: 11, train_loss: 1.0906, test_loss: 1.0948, test_f1: 0.4602
 epoch: 12, train_loss: 1.0699, test_loss: 1.0829, test_f1: 0.4678
 epoch: 13, train_loss: 1.0550, test_loss: 1.0689, test_f1: 0.4551
 epoch: 14, train_loss: 1.0391, test_loss: 1.0641, test_f1: 0.4498
 epoch: 15, train_loss: 1.0237, test_loss: 1.0498, test_f1: 0.4646
 epoch: 16, train_loss: 1.0032, test_loss: 1.0435, test_f1: 0.4607
 epoch: 17, train_loss: 0.9972, test_loss: 1.0246, test_f1: 0.4827
 epoch: 18, train_loss: 0.9782, test_loss: 1.0506, test_f1: 0.4856
 epoch: 19, train_loss: 0.9651, test_loss: 1.0261, test_f1: 0.4803
 epoch: 20, train_loss: 0.9372, test_loss: 1.0245, test_f1: 0.4727
 epoch: 21, train_loss: 0.9193, test_loss: 1.0394, test_f1: 0.4849
 epoch: 22, train_loss: 0.9005, test_loss: 1.0408, test_f1: 0.4955
 epoch: 23, train_loss: 0.9017, test_loss: 1.0303, test_f1: 0.4722
 epoch: 24, train_loss: 0.8864, test_loss: 1.0444, test_f1: 0.4764
 epoch: 25, train_loss: 0.8608, test_loss: 1.0332, test_f1: 0.4838
 epoch: 26, train_loss: 0.8634, test_loss: 1.0570, test_f1: 0.4912
 epoch: 27, train_loss: 0.8279, test_loss: 1.1023, test_f1: 0.4623
 epoch: 28, train_loss: 0.8303, test_loss: 1.0650, test_f1: 0.4788
 epoch: 29, train_loss: 0.8054, test_loss: 1.0584, test_f1: 0.4707
 epoch: 30, train_loss: 0.8066, test_loss: 1.0790, test_f1: 0.4755
 epoch: 31, train_loss: 0.7849, test_loss: 1.0884, test_f1: 0.4807
 epoch: 32, train_loss: 0.7809, test_loss: 1.1050, test_f1: 0.4754
 epoch: 33, train_loss: 0.7822, test_loss: 1.1363, test_f1: 0.4730
 epoch: 34, train_loss: 0.7555, test_loss: 1.1000, test_f1: 0.4745
 epoch: 35, train_loss: 0.7553, test_loss: 1.1142, test_f1: 0.4874
 epoch: 36, train_loss: 0.7360, test_loss: 1.1207, test_f1: 0.4841
 epoch: 37, train_loss: 0.7131, test_loss: 1.1860, test_f1: 0.4771
 epoch: 38, train_loss: 0.7190, test_loss: 1.1802, test_f1: 0.4916
 epoch: 39, train_loss: 0.7102, test_loss: 1.1994, test_f1: 0.4853
 epoch: 40, train_loss: 0.6982, test_loss: 1.2375, test_f1: 0.4785
 epoch: 41, train_loss: 0.7067, test_loss: 1.2050, test_f1: 0.4811
 epoch: 42, train_loss: 0.6898, test_loss: 1.2143, test_f1: 0.4901
 epoch: 43, train_loss: 0.6729, test_loss: 1.2203, test_f1: 0.4811
 epoch: 44, train_loss: 0.6695, test_loss: 1.2814, test_f1: 0.4860
 epoch: 45, train_loss: 0.6810, test_loss: 1.2950, test_f1: 0.4849
 epoch: 46, train_loss: 0.6704, test_loss: 1.2646, test_f1: 0.4852
 epoch: 47, train_loss: 0.6543, test_loss: 1.2789, test_f1: 0.4946
 epoch: 48, train_loss: 0.6571, test_loss: 1.2699, test_f1: 0.4979
 epoch: 49, train_loss: 0.6273, test_loss: 1.2948, test_f1: 0.4996
 epoch: 50, train_loss: 0.6251, test_loss: 1.3166, test_f1: 0.4929
 epoch: 51, train_loss: 0.6195, test_loss: 1.3174, test_f1: 0.4891
 epoch: 52, train_loss: 0.6116, test_loss: 1.3098, test_f1: 0.4884
 epoch: 53, train_loss: 0.6074, test_loss: 1.3245, test_f1: 0.5024
 epoch: 54, train_loss: 0.6063, test_loss: 1.3440, test_f1: 0.4976
 epoch: 55, train_loss: 0.5945, test_loss: 1.3722, test_f1: 0.4892
 epoch: 56, train_loss: 0.5906, test_loss: 1.3736, test_f1: 0.4991
 epoch: 57, train_loss: 0.5878, test_loss: 1.3842, test_f1: 0.4905
 epoch: 58, train_loss: 0.5799, test_loss: 1.3722, test_f1: 0.4943
 epoch: 59, train_loss: 0.5754, test_loss: 1.3834, test_f1: 0.4913
 epoch: 60, train_loss: 0.5895, test_loss: 1.3896, test_f1: 0.4997
 epoch: 61, train_loss: 0.5645, test_loss: 1.4154, test_f1: 0.4964
 epoch: 62, train_loss: 0.5704, test_loss: 1.4275, test_f1: 0.4909
 epoch: 63, train_loss: 0.5665, test_loss: 1.4379, test_f1: 0.4939
 epoch: 64, train_loss: 0.5709, test_loss: 1.4515, test_f1: 0.4873
 epoch: 65, train_loss: 0.5615, test_loss: 1.4483, test_f1: 0.4975
 epoch: 66, train_loss: 0.5711, test_loss: 1.4385, test_f1: 0.4894
 epoch: 67, train_loss: 0.5732, test_loss: 1.4477, test_f1: 0.4827
 epoch: 68, train_loss: 0.5553, test_loss: 1.4476, test_f1: 0.4994
 epoch: 69, train_loss: 0.5546, test_loss: 1.4547, test_f1: 0.4903
 epoch: 70, train_loss: 0.5645, test_loss: 1.4529, test_f1: 0.4939
 epoch: 71, train_loss: 0.5650, test_loss: 1.4535, test_f1: 0.4988
 epoch: 72, train_loss: 0.5531, test_loss: 1.4707, test_f1: 0.4874
 epoch: 73, train_loss: 0.5644, test_loss: 1.4758, test_f1: 0.4976
 epoch: 74, train_loss: 0.5343, test_loss: 1.4840, test_f1: 0.4988
 epoch: 75, train_loss: 0.5549, test_loss: 1.4870, test_f1: 0.5118
 epoch: 76, train_loss: 0.5325, test_loss: 1.4767, test_f1: 0.4981
 epoch: 77, train_loss: 0.5298, test_loss: 1.4836, test_f1: 0.4891
 epoch: 78, train_loss: 0.5375, test_loss: 1.4999, test_f1: 0.5018
 epoch: 79, train_loss: 0.5246, test_loss: 1.5141, test_f1: 0.5013
 epoch: 80, train_loss: 0.5371, test_loss: 1.5593, test_f1: 0.4819
 epoch: 81, train_loss: 0.5222, test_loss: 1.5095, test_f1: 0.4887
 epoch: 82, train_loss: 0.5139, test_loss: 1.5226, test_f1: 0.4856
 epoch: 83, train_loss: 0.5264, test_loss: 1.5370, test_f1: 0.5087
 epoch: 84, train_loss: 0.5237, test_loss: 1.5662, test_f1: 0.4831
 epoch: 85, train_loss: 0.5129, test_loss: 1.5889, test_f1: 0.4979
 epoch: 86, train_loss: 0.5157, test_loss: 1.5532, test_f1: 0.4990
 epoch: 87, train_loss: 0.5126, test_loss: 1.5130, test_f1: 0.5050
 epoch: 88, train_loss: 0.5161, test_loss: 1.5701, test_f1: 0.4936
 epoch: 89, train_loss: 0.4944, test_loss: 1.5775, test_f1: 0.4973
 epoch: 90, train_loss: 0.5100, test_loss: 1.5423, test_f1: 0.4858
 epoch: 91, train_loss: 0.4938, test_loss: 1.5867, test_f1: 0.4874
 epoch: 92, train_loss: 0.4986, test_loss: 1.5950, test_f1: 0.4945
 epoch: 93, train_loss: 0.5091, test_loss: 1.5539, test_f1: 0.4961
 epoch: 94, train_loss: 0.4977, test_loss: 1.6465, test_f1: 0.4938
 epoch: 95, train_loss: 0.4839, test_loss: 1.6202, test_f1: 0.5021
 epoch: 96, train_loss: 0.4928, test_loss: 1.6205, test_f1: 0.5015
 epoch: 97, train_loss: 0.4896, test_loss: 1.5965, test_f1: 0.4973
 epoch: 98, train_loss: 0.4991, test_loss: 1.5731, test_f1: 0.5032
 epoch: 99, train_loss: 0.5015, test_loss: 1.6048, test_f1: 0.4993
##################ITERATION #2 ****************************************
 epoch: 0, train_loss: 1.3422, test_loss: 1.3332, test_f1: 0.2565
 epoch: 1, train_loss: 1.2603, test_loss: 1.2900, test_f1: 0.3157
 epoch: 2, train_loss: 1.2272, test_loss: 1.2399, test_f1: 0.3385
 epoch: 3, train_loss: 1.2053, test_loss: 1.1961, test_f1: 0.4384
 epoch: 4, train_loss: 1.1803, test_loss: 1.1606, test_f1: 0.4506
 epoch: 5, train_loss: 1.1581, test_loss: 1.1396, test_f1: 0.4542
 epoch: 6, train_loss: 1.1403, test_loss: 1.1246, test_f1: 0.4600
 epoch: 7, train_loss: 1.1270, test_loss: 1.1107, test_f1: 0.4637
 epoch: 8, train_loss: 1.1090, test_loss: 1.0954, test_f1: 0.4653
 epoch: 9, train_loss: 1.0949, test_loss: 1.0821, test_f1: 0.4648
 epoch: 10, train_loss: 1.0775, test_loss: 1.0725, test_f1: 0.4670
 epoch: 11, train_loss: 1.0624, test_loss: 1.0621, test_f1: 0.4735
 epoch: 12, train_loss: 1.0383, test_loss: 1.0500, test_f1: 0.4598
 epoch: 13, train_loss: 1.0314, test_loss: 1.0382, test_f1: 0.4823
 epoch: 14, train_loss: 1.0150, test_loss: 1.0370, test_f1: 0.4790
 epoch: 15, train_loss: 1.0011, test_loss: 1.0209, test_f1: 0.4788
 epoch: 16, train_loss: 0.9940, test_loss: 1.0217, test_f1: 0.4877
 epoch: 17, train_loss: 0.9764, test_loss: 1.0127, test_f1: 0.4912
 epoch: 18, train_loss: 0.9597, test_loss: 1.0164, test_f1: 0.4929
 epoch: 19, train_loss: 0.9478, test_loss: 1.0039, test_f1: 0.5015
 epoch: 20, train_loss: 0.9315, test_loss: 1.0225, test_f1: 0.4885
 epoch: 21, train_loss: 0.9292, test_loss: 1.0171, test_f1: 0.4837
 epoch: 22, train_loss: 0.9016, test_loss: 1.0202, test_f1: 0.4850
 epoch: 23, train_loss: 0.8959, test_loss: 0.9984, test_f1: 0.4811
 epoch: 24, train_loss: 0.8898, test_loss: 1.0297, test_f1: 0.4896
 epoch: 25, train_loss: 0.8709, test_loss: 1.0068, test_f1: 0.4992
 epoch: 26, train_loss: 0.8595, test_loss: 1.0234, test_f1: 0.4851
 epoch: 27, train_loss: 0.8574, test_loss: 1.0255, test_f1: 0.4973
 epoch: 28, train_loss: 0.8366, test_loss: 1.0129, test_f1: 0.5167
 epoch: 29, train_loss: 0.8305, test_loss: 1.0127, test_f1: 0.4893
 epoch: 30, train_loss: 0.8229, test_loss: 1.0362, test_f1: 0.4782
 epoch: 31, train_loss: 0.8122, test_loss: 1.0511, test_f1: 0.4994
 epoch: 32, train_loss: 0.8078, test_loss: 1.0476, test_f1: 0.5174
 epoch: 33, train_loss: 0.7854, test_loss: 1.0345, test_f1: 0.5199
 epoch: 34, train_loss: 0.7831, test_loss: 1.0600, test_f1: 0.5252
 epoch: 35, train_loss: 0.7676, test_loss: 1.0376, test_f1: 0.5176
 epoch: 36, train_loss: 0.7632, test_loss: 1.0855, test_f1: 0.5054
 epoch: 37, train_loss: 0.7566, test_loss: 1.0692, test_f1: 0.5056
 epoch: 38, train_loss: 0.7512, test_loss: 1.0346, test_f1: 0.5363
 epoch: 39, train_loss: 0.7496, test_loss: 1.1078, test_f1: 0.5161
 epoch: 40, train_loss: 0.7425, test_loss: 1.0909, test_f1: 0.5231
 epoch: 41, train_loss: 0.7115, test_loss: 1.0725, test_f1: 0.5236
 epoch: 42, train_loss: 0.7175, test_loss: 1.1262, test_f1: 0.5191
 epoch: 43, train_loss: 0.7132, test_loss: 1.1259, test_f1: 0.5067
 epoch: 44, train_loss: 0.7000, test_loss: 1.1246, test_f1: 0.5043
 epoch: 45, train_loss: 0.7036, test_loss: 1.0911, test_f1: 0.5297
 epoch: 46, train_loss: 0.7077, test_loss: 1.1250, test_f1: 0.5318
 epoch: 47, train_loss: 0.6950, test_loss: 1.1588, test_f1: 0.5362
 epoch: 48, train_loss: 0.6830, test_loss: 1.1296, test_f1: 0.5334
 epoch: 49, train_loss: 0.6620, test_loss: 1.1982, test_f1: 0.5156
 epoch: 50, train_loss: 0.6621, test_loss: 1.2074, test_f1: 0.5216
 epoch: 51, train_loss: 0.6530, test_loss: 1.1442, test_f1: 0.5360
 epoch: 52, train_loss: 0.6442, test_loss: 1.1839, test_f1: 0.5367
 epoch: 53, train_loss: 0.6425, test_loss: 1.1384, test_f1: 0.5470
 epoch: 54, train_loss: 0.6382, test_loss: 1.1261, test_f1: 0.5367
 epoch: 55, train_loss: 0.6250, test_loss: 1.1609, test_f1: 0.5307
 epoch: 56, train_loss: 0.6237, test_loss: 1.2252, test_f1: 0.5288
 epoch: 57, train_loss: 0.6103, test_loss: 1.1758, test_f1: 0.5325
 epoch: 58, train_loss: 0.6147, test_loss: 1.2049, test_f1: 0.5215
 epoch: 59, train_loss: 0.6277, test_loss: 1.2078, test_f1: 0.5477
 epoch: 60, train_loss: 0.6107, test_loss: 1.2620, test_f1: 0.5332
 epoch: 61, train_loss: 0.6061, test_loss: 1.2590, test_f1: 0.5314
 epoch: 62, train_loss: 0.5935, test_loss: 1.1758, test_f1: 0.5344
 epoch: 63, train_loss: 0.6053, test_loss: 1.2117, test_f1: 0.5394
 epoch: 64, train_loss: 0.5950, test_loss: 1.1912, test_f1: 0.5294
 epoch: 65, train_loss: 0.5857, test_loss: 1.2155, test_f1: 0.5346
 epoch: 66, train_loss: 0.5907, test_loss: 1.2268, test_f1: 0.5331
 epoch: 67, train_loss: 0.5915, test_loss: 1.2207, test_f1: 0.5432
 epoch: 68, train_loss: 0.5909, test_loss: 1.2559, test_f1: 0.5324
 epoch: 69, train_loss: 0.5810, test_loss: 1.2189, test_f1: 0.5526
 epoch: 70, train_loss: 0.5783, test_loss: 1.2586, test_f1: 0.5491
 epoch: 71, train_loss: 0.5756, test_loss: 1.2924, test_f1: 0.5401
 epoch: 72, train_loss: 0.5680, test_loss: 1.2938, test_f1: 0.5308
 epoch: 73, train_loss: 0.5797, test_loss: 1.3307, test_f1: 0.5295
 epoch: 74, train_loss: 0.5658, test_loss: 1.3494, test_f1: 0.5411
 epoch: 75, train_loss: 0.5691, test_loss: 1.2927, test_f1: 0.5355
 epoch: 76, train_loss: 0.5539, test_loss: 1.2880, test_f1: 0.5384
 epoch: 77, train_loss: 0.5634, test_loss: 1.3074, test_f1: 0.5395
 epoch: 78, train_loss: 0.5618, test_loss: 1.3022, test_f1: 0.5338
 epoch: 79, train_loss: 0.5564, test_loss: 1.3213, test_f1: 0.5325
 epoch: 80, train_loss: 0.5758, test_loss: 1.3153, test_f1: 0.5438
 epoch: 81, train_loss: 0.5515, test_loss: 1.3199, test_f1: 0.5345
 epoch: 82, train_loss: 0.5611, test_loss: 1.3159, test_f1: 0.5324
 epoch: 83, train_loss: 0.5472, test_loss: 1.3430, test_f1: 0.5292
 epoch: 84, train_loss: 0.5356, test_loss: 1.3115, test_f1: 0.5353
 epoch: 85, train_loss: 0.5357, test_loss: 1.3436, test_f1: 0.5285
 epoch: 86, train_loss: 0.5344, test_loss: 1.3467, test_f1: 0.5372
 epoch: 87, train_loss: 0.5306, test_loss: 1.3528, test_f1: 0.5402
 epoch: 88, train_loss: 0.5383, test_loss: 1.3552, test_f1: 0.5397
 epoch: 89, train_loss: 0.5354, test_loss: 1.3426, test_f1: 0.5389
 epoch: 90, train_loss: 0.5143, test_loss: 1.3733, test_f1: 0.5312
 epoch: 91, train_loss: 0.5303, test_loss: 1.3521, test_f1: 0.5307
 epoch: 92, train_loss: 0.5208, test_loss: 1.3671, test_f1: 0.5485
 epoch: 93, train_loss: 0.5357, test_loss: 1.3871, test_f1: 0.5338
 epoch: 94, train_loss: 0.5209, test_loss: 1.3856, test_f1: 0.5307
 epoch: 95, train_loss: 0.5217, test_loss: 1.3832, test_f1: 0.5423
 epoch: 96, train_loss: 0.5214, test_loss: 1.3978, test_f1: 0.5399
 epoch: 97, train_loss: 0.5240, test_loss: 1.3836, test_f1: 0.5408
 epoch: 98, train_loss: 0.5062, test_loss: 1.3882, test_f1: 0.5416
 epoch: 99, train_loss: 0.5163, test_loss: 1.3928, test_f1: 0.5208
##################ITERATION #3 ****************************************
 epoch: 0, train_loss: 1.2897, test_loss: 1.3133, test_f1: 0.2433
 epoch: 1, train_loss: 1.2294, test_loss: 1.2709, test_f1: 0.3175
 epoch: 2, train_loss: 1.2104, test_loss: 1.2315, test_f1: 0.4197
 epoch: 3, train_loss: 1.1857, test_loss: 1.2075, test_f1: 0.3989
 epoch: 4, train_loss: 1.1624, test_loss: 1.1798, test_f1: 0.4170
 epoch: 5, train_loss: 1.1497, test_loss: 1.1583, test_f1: 0.4205
 epoch: 6, train_loss: 1.1343, test_loss: 1.1548, test_f1: 0.4311
 epoch: 7, train_loss: 1.1106, test_loss: 1.1449, test_f1: 0.4347
 epoch: 8, train_loss: 1.0969, test_loss: 1.1424, test_f1: 0.4270
 epoch: 9, train_loss: 1.0837, test_loss: 1.1292, test_f1: 0.4372
 epoch: 10, train_loss: 1.0671, test_loss: 1.1046, test_f1: 0.4385
 epoch: 11, train_loss: 1.0532, test_loss: 1.1027, test_f1: 0.4354
 epoch: 12, train_loss: 1.0317, test_loss: 1.0932, test_f1: 0.4429
 epoch: 13, train_loss: 1.0137, test_loss: 1.1062, test_f1: 0.4538
 epoch: 14, train_loss: 1.0075, test_loss: 1.0898, test_f1: 0.4328
 epoch: 15, train_loss: 0.9866, test_loss: 1.0965, test_f1: 0.4311
 epoch: 16, train_loss: 0.9745, test_loss: 1.0842, test_f1: 0.4326
 epoch: 17, train_loss: 0.9500, test_loss: 1.0847, test_f1: 0.4426
 epoch: 18, train_loss: 0.9422, test_loss: 1.0816, test_f1: 0.4472
 epoch: 19, train_loss: 0.9326, test_loss: 1.1107, test_f1: 0.4481
 epoch: 20, train_loss: 0.9262, test_loss: 1.1029, test_f1: 0.4466
 epoch: 21, train_loss: 0.9206, test_loss: 1.1182, test_f1: 0.4569
 epoch: 22, train_loss: 0.8912, test_loss: 1.1018, test_f1: 0.4532
 epoch: 23, train_loss: 0.8898, test_loss: 1.1072, test_f1: 0.4533
 epoch: 24, train_loss: 0.8763, test_loss: 1.1219, test_f1: 0.4576
 epoch: 25, train_loss: 0.8691, test_loss: 1.1104, test_f1: 0.4644
 epoch: 26, train_loss: 0.8602, test_loss: 1.1221, test_f1: 0.4661
 epoch: 27, train_loss: 0.8487, test_loss: 1.1025, test_f1: 0.4670
 epoch: 28, train_loss: 0.8402, test_loss: 1.1439, test_f1: 0.4696
 epoch: 29, train_loss: 0.8246, test_loss: 1.1453, test_f1: 0.4811
 epoch: 30, train_loss: 0.8202, test_loss: 1.1455, test_f1: 0.4946
 epoch: 31, train_loss: 0.8121, test_loss: 1.1605, test_f1: 0.4729
 epoch: 32, train_loss: 0.8022, test_loss: 1.1711, test_f1: 0.4862
 epoch: 33, train_loss: 0.7897, test_loss: 1.1415, test_f1: 0.4873
 epoch: 34, train_loss: 0.7830, test_loss: 1.1801, test_f1: 0.4784
 epoch: 35, train_loss: 0.7802, test_loss: 1.1764, test_f1: 0.4951
 epoch: 36, train_loss: 0.7658, test_loss: 1.2660, test_f1: 0.4830
 epoch: 37, train_loss: 0.7740, test_loss: 1.2398, test_f1: 0.4792
 epoch: 38, train_loss: 0.7451, test_loss: 1.2402, test_f1: 0.4885
 epoch: 39, train_loss: 0.7464, test_loss: 1.2384, test_f1: 0.4918
 epoch: 40, train_loss: 0.7516, test_loss: 1.2985, test_f1: 0.4865
 epoch: 41, train_loss: 0.7425, test_loss: 1.2482, test_f1: 0.4918
 epoch: 42, train_loss: 0.7331, test_loss: 1.2095, test_f1: 0.4939
 epoch: 43, train_loss: 0.7201, test_loss: 1.2725, test_f1: 0.4974
 epoch: 44, train_loss: 0.7190, test_loss: 1.3284, test_f1: 0.4875
 epoch: 45, train_loss: 0.6987, test_loss: 1.3578, test_f1: 0.4937
 epoch: 46, train_loss: 0.7000, test_loss: 1.3271, test_f1: 0.4976
 epoch: 47, train_loss: 0.6809, test_loss: 1.3401, test_f1: 0.4973
 epoch: 48, train_loss: 0.6856, test_loss: 1.3940, test_f1: 0.4909
 epoch: 49, train_loss: 0.6823, test_loss: 1.3913, test_f1: 0.5009
 epoch: 50, train_loss: 0.6724, test_loss: 1.4175, test_f1: 0.4970
 epoch: 51, train_loss: 0.6586, test_loss: 1.4048, test_f1: 0.5056
 epoch: 52, train_loss: 0.6440, test_loss: 1.4242, test_f1: 0.4994
 epoch: 53, train_loss: 0.6329, test_loss: 1.4071, test_f1: 0.4968
 epoch: 54, train_loss: 0.6386, test_loss: 1.4017, test_f1: 0.5051
 epoch: 55, train_loss: 0.6323, test_loss: 1.4861, test_f1: 0.5010
 epoch: 56, train_loss: 0.6269, test_loss: 1.4511, test_f1: 0.4987
 epoch: 57, train_loss: 0.6352, test_loss: 1.4632, test_f1: 0.5005
 epoch: 58, train_loss: 0.6416, test_loss: 1.4397, test_f1: 0.5026
 epoch: 59, train_loss: 0.6138, test_loss: 1.4577, test_f1: 0.5003
 epoch: 60, train_loss: 0.6180, test_loss: 1.4613, test_f1: 0.4956
 epoch: 61, train_loss: 0.6175, test_loss: 1.4909, test_f1: 0.5000
 epoch: 62, train_loss: 0.6079, test_loss: 1.5290, test_f1: 0.5051
 epoch: 63, train_loss: 0.6135, test_loss: 1.5259, test_f1: 0.5012
 epoch: 64, train_loss: 0.6151, test_loss: 1.5149, test_f1: 0.5005
 epoch: 65, train_loss: 0.6058, test_loss: 1.5284, test_f1: 0.4937
 epoch: 66, train_loss: 0.6076, test_loss: 1.5035, test_f1: 0.4997
 epoch: 67, train_loss: 0.5906, test_loss: 1.5175, test_f1: 0.5045
 epoch: 68, train_loss: 0.6012, test_loss: 1.5575, test_f1: 0.5045
 epoch: 69, train_loss: 0.5948, test_loss: 1.5901, test_f1: 0.4898
 epoch: 70, train_loss: 0.5840, test_loss: 1.5760, test_f1: 0.4959
 epoch: 71, train_loss: 0.6000, test_loss: 1.5900, test_f1: 0.5000
 epoch: 72, train_loss: 0.5762, test_loss: 1.6193, test_f1: 0.5020
 epoch: 73, train_loss: 0.5837, test_loss: 1.6208, test_f1: 0.5067
 epoch: 74, train_loss: 0.5696, test_loss: 1.5607, test_f1: 0.5016
 epoch: 75, train_loss: 0.5786, test_loss: 1.5906, test_f1: 0.5028
 epoch: 76, train_loss: 0.5625, test_loss: 1.6017, test_f1: 0.4999
 epoch: 77, train_loss: 0.5604, test_loss: 1.6459, test_f1: 0.4969
 epoch: 78, train_loss: 0.5677, test_loss: 1.6105, test_f1: 0.5087
 epoch: 79, train_loss: 0.5654, test_loss: 1.6444, test_f1: 0.5017
 epoch: 80, train_loss: 0.5484, test_loss: 1.6712, test_f1: 0.4966
 epoch: 81, train_loss: 0.5718, test_loss: 1.6178, test_f1: 0.5046
 epoch: 82, train_loss: 0.5507, test_loss: 1.6194, test_f1: 0.5102
 epoch: 83, train_loss: 0.5516, test_loss: 1.6433, test_f1: 0.5043
 epoch: 84, train_loss: 0.5472, test_loss: 1.6740, test_f1: 0.5011
 epoch: 85, train_loss: 0.5345, test_loss: 1.6541, test_f1: 0.5063
 epoch: 86, train_loss: 0.5345, test_loss: 1.7010, test_f1: 0.5033
 epoch: 87, train_loss: 0.5296, test_loss: 1.6677, test_f1: 0.4999
 epoch: 88, train_loss: 0.5493, test_loss: 1.6575, test_f1: 0.5044
 epoch: 89, train_loss: 0.5386, test_loss: 1.6823, test_f1: 0.5048
 epoch: 90, train_loss: 0.5317, test_loss: 1.7307, test_f1: 0.5188
 epoch: 91, train_loss: 0.5158, test_loss: 1.6943, test_f1: 0.5022
 epoch: 92, train_loss: 0.5308, test_loss: 1.6765, test_f1: 0.5139
 epoch: 93, train_loss: 0.5159, test_loss: 1.7407, test_f1: 0.5034
 epoch: 94, train_loss: 0.5029, test_loss: 1.7213, test_f1: 0.5134
 epoch: 95, train_loss: 0.5136, test_loss: 1.7537, test_f1: 0.5203
 epoch: 96, train_loss: 0.5144, test_loss: 1.7368, test_f1: 0.5080
 epoch: 97, train_loss: 0.5124, test_loss: 1.7743, test_f1: 0.5083
 epoch: 98, train_loss: 0.5084, test_loss: 1.7881, test_f1: 0.5130
 epoch: 99, train_loss: 0.5102, test_loss: 1.7452, test_f1: 0.5169
##################ITERATION #4 ****************************************
 epoch: 0, train_loss: 1.2984, test_loss: 1.3213, test_f1: 0.2274
 epoch: 1, train_loss: 1.2249, test_loss: 1.2673, test_f1: 0.2800
 epoch: 2, train_loss: 1.2004, test_loss: 1.2166, test_f1: 0.3822
 epoch: 3, train_loss: 1.1780, test_loss: 1.1783, test_f1: 0.4091
 epoch: 4, train_loss: 1.1525, test_loss: 1.1543, test_f1: 0.4523
 epoch: 5, train_loss: 1.1472, test_loss: 1.1282, test_f1: 0.4543
 epoch: 6, train_loss: 1.1263, test_loss: 1.1156, test_f1: 0.4635
 epoch: 7, train_loss: 1.1159, test_loss: 1.1011, test_f1: 0.4709
 epoch: 8, train_loss: 1.0996, test_loss: 1.0927, test_f1: 0.4610
 epoch: 9, train_loss: 1.0775, test_loss: 1.0829, test_f1: 0.4569
 epoch: 10, train_loss: 1.0791, test_loss: 1.0835, test_f1: 0.4514
 epoch: 11, train_loss: 1.0514, test_loss: 1.0762, test_f1: 0.4321
 epoch: 12, train_loss: 1.0473, test_loss: 1.0734, test_f1: 0.4252
 epoch: 13, train_loss: 1.0239, test_loss: 1.0670, test_f1: 0.4431
 epoch: 14, train_loss: 1.0278, test_loss: 1.0557, test_f1: 0.4337
 epoch: 15, train_loss: 1.0124, test_loss: 1.0448, test_f1: 0.4407
 epoch: 16, train_loss: 1.0000, test_loss: 1.0590, test_f1: 0.4559
 epoch: 17, train_loss: 0.9883, test_loss: 1.0464, test_f1: 0.4539
 epoch: 18, train_loss: 0.9797, test_loss: 1.0378, test_f1: 0.4329
 epoch: 19, train_loss: 0.9647, test_loss: 1.0233, test_f1: 0.4430
 epoch: 20, train_loss: 0.9544, test_loss: 1.0340, test_f1: 0.4404
 epoch: 21, train_loss: 0.9290, test_loss: 1.0364, test_f1: 0.4487
 epoch: 22, train_loss: 0.9367, test_loss: 1.0684, test_f1: 0.4525
 epoch: 23, train_loss: 0.9168, test_loss: 1.0622, test_f1: 0.4458
 epoch: 24, train_loss: 0.9042, test_loss: 1.0332, test_f1: 0.4554
 epoch: 25, train_loss: 0.9016, test_loss: 1.0536, test_f1: 0.4512
 epoch: 26, train_loss: 0.8945, test_loss: 1.0399, test_f1: 0.4626
 epoch: 27, train_loss: 0.8727, test_loss: 1.0644, test_f1: 0.4804
 epoch: 28, train_loss: 0.8727, test_loss: 1.0401, test_f1: 0.4835
 epoch: 29, train_loss: 0.8570, test_loss: 1.0526, test_f1: 0.4809
 epoch: 30, train_loss: 0.8504, test_loss: 1.0870, test_f1: 0.4818
 epoch: 31, train_loss: 0.8391, test_loss: 1.1421, test_f1: 0.4580
 epoch: 32, train_loss: 0.8293, test_loss: 1.1488, test_f1: 0.4549
 epoch: 33, train_loss: 0.8342, test_loss: 1.0591, test_f1: 0.4951
 epoch: 34, train_loss: 0.8193, test_loss: 1.0722, test_f1: 0.4764
 epoch: 35, train_loss: 0.8183, test_loss: 1.0618, test_f1: 0.4677
 epoch: 36, train_loss: 0.8089, test_loss: 1.1206, test_f1: 0.4754
 epoch: 37, train_loss: 0.7860, test_loss: 1.1151, test_f1: 0.4787
 epoch: 38, train_loss: 0.7894, test_loss: 1.0929, test_f1: 0.4898
 epoch: 39, train_loss: 0.7792, test_loss: 1.1006, test_f1: 0.4935
 epoch: 40, train_loss: 0.7632, test_loss: 1.2589, test_f1: 0.4783
 epoch: 41, train_loss: 0.7546, test_loss: 1.2188, test_f1: 0.4764
 epoch: 42, train_loss: 0.7714, test_loss: 1.1166, test_f1: 0.4941
 epoch: 43, train_loss: 0.7398, test_loss: 1.2151, test_f1: 0.4696
 epoch: 44, train_loss: 0.7333, test_loss: 1.2386, test_f1: 0.4785
 epoch: 45, train_loss: 0.7345, test_loss: 1.1935, test_f1: 0.4929
 epoch: 46, train_loss: 0.7397, test_loss: 1.2176, test_f1: 0.4918
 epoch: 47, train_loss: 0.7356, test_loss: 1.2276, test_f1: 0.4932
 epoch: 48, train_loss: 0.7136, test_loss: 1.2551, test_f1: 0.4818
 epoch: 49, train_loss: 0.7081, test_loss: 1.2612, test_f1: 0.4760
 epoch: 50, train_loss: 0.6904, test_loss: 1.1905, test_f1: 0.4959
 epoch: 51, train_loss: 0.6909, test_loss: 1.2545, test_f1: 0.4931
 epoch: 52, train_loss: 0.6629, test_loss: 1.2840, test_f1: 0.4804
 epoch: 53, train_loss: 0.6714, test_loss: 1.3492, test_f1: 0.4896
 epoch: 54, train_loss: 0.6756, test_loss: 1.2715, test_f1: 0.4781
 epoch: 55, train_loss: 0.6674, test_loss: 1.2638, test_f1: 0.5011
 epoch: 56, train_loss: 0.6674, test_loss: 1.2435, test_f1: 0.5026
 epoch: 57, train_loss: 0.6639, test_loss: 1.2568, test_f1: 0.5041
 epoch: 58, train_loss: 0.6547, test_loss: 1.2814, test_f1: 0.4934
 epoch: 59, train_loss: 0.6501, test_loss: 1.3288, test_f1: 0.4916
 epoch: 60, train_loss: 0.6602, test_loss: 1.3085, test_f1: 0.5033
 epoch: 61, train_loss: 0.6512, test_loss: 1.2751, test_f1: 0.5083
 epoch: 62, train_loss: 0.6495, test_loss: 1.2676, test_f1: 0.4999
 epoch: 63, train_loss: 0.6355, test_loss: 1.3151, test_f1: 0.4973
 epoch: 64, train_loss: 0.6433, test_loss: 1.4073, test_f1: 0.4891
 epoch: 65, train_loss: 0.6285, test_loss: 1.4082, test_f1: 0.4786
 epoch: 66, train_loss: 0.6272, test_loss: 1.4293, test_f1: 0.4870
 epoch: 67, train_loss: 0.6177, test_loss: 1.3840, test_f1: 0.4987
 epoch: 68, train_loss: 0.6191, test_loss: 1.3334, test_f1: 0.4876
 epoch: 69, train_loss: 0.6105, test_loss: 1.3408, test_f1: 0.4970
 epoch: 70, train_loss: 0.5989, test_loss: 1.4375, test_f1: 0.5026
 epoch: 71, train_loss: 0.6170, test_loss: 1.3527, test_f1: 0.4912
 epoch: 72, train_loss: 0.6084, test_loss: 1.4011, test_f1: 0.4978
 epoch: 73, train_loss: 0.6038, test_loss: 1.3753, test_f1: 0.4778
 epoch: 74, train_loss: 0.6086, test_loss: 1.3750, test_f1: 0.5094
 epoch: 75, train_loss: 0.6029, test_loss: 1.4359, test_f1: 0.4914
 epoch: 76, train_loss: 0.5929, test_loss: 1.3806, test_f1: 0.5035
 epoch: 77, train_loss: 0.6012, test_loss: 1.4535, test_f1: 0.5020
 epoch: 78, train_loss: 0.5981, test_loss: 1.3767, test_f1: 0.5106
 epoch: 79, train_loss: 0.5875, test_loss: 1.3971, test_f1: 0.5075
 epoch: 80, train_loss: 0.5823, test_loss: 1.4954, test_f1: 0.5048
 epoch: 81, train_loss: 0.5701, test_loss: 1.4372, test_f1: 0.5114
 epoch: 82, train_loss: 0.5876, test_loss: 1.4655, test_f1: 0.4920
 epoch: 83, train_loss: 0.5881, test_loss: 1.5437, test_f1: 0.4969
 epoch: 84, train_loss: 0.5837, test_loss: 1.4953, test_f1: 0.5038
 epoch: 85, train_loss: 0.5759, test_loss: 1.5032, test_f1: 0.4952
 epoch: 86, train_loss: 0.5600, test_loss: 1.5371, test_f1: 0.4974
 epoch: 87, train_loss: 0.5876, test_loss: 1.4234, test_f1: 0.5141
 epoch: 88, train_loss: 0.5523, test_loss: 1.4641, test_f1: 0.5078
 epoch: 89, train_loss: 0.5551, test_loss: 1.4784, test_f1: 0.5034
 epoch: 90, train_loss: 0.5600, test_loss: 1.4571, test_f1: 0.5014
 epoch: 91, train_loss: 0.5455, test_loss: 1.4294, test_f1: 0.5131
 epoch: 92, train_loss: 0.5630, test_loss: 1.5871, test_f1: 0.5099
 epoch: 93, train_loss: 0.5418, test_loss: 1.5311, test_f1: 0.5062
 epoch: 94, train_loss: 0.5606, test_loss: 1.5264, test_f1: 0.4954
 epoch: 95, train_loss: 0.5539, test_loss: 1.4656, test_f1: 0.5122
 epoch: 96, train_loss: 0.5350, test_loss: 1.5114, test_f1: 0.4981
 epoch: 97, train_loss: 0.5346, test_loss: 1.6075, test_f1: 0.5034
 epoch: 98, train_loss: 0.5333, test_loss: 1.5334, test_f1: 0.5154
 epoch: 99, train_loss: 0.5342, test_loss: 1.4845, test_f1: 0.5038
##################ITERATION #5 ****************************************
 epoch: 0, train_loss: 1.3156, test_loss: 1.3084, test_f1: 0.2512
 epoch: 1, train_loss: 1.2254, test_loss: 1.2666, test_f1: 0.2581
 epoch: 2, train_loss: 1.1982, test_loss: 1.2146, test_f1: 0.2967
 epoch: 3, train_loss: 1.1740, test_loss: 1.1774, test_f1: 0.3542
 epoch: 4, train_loss: 1.1573, test_loss: 1.1464, test_f1: 0.4276
 epoch: 5, train_loss: 1.1379, test_loss: 1.1340, test_f1: 0.4257
 epoch: 6, train_loss: 1.1224, test_loss: 1.1124, test_f1: 0.4324
 epoch: 7, train_loss: 1.1115, test_loss: 1.1169, test_f1: 0.4168
 epoch: 8, train_loss: 1.1026, test_loss: 1.1162, test_f1: 0.4157
 epoch: 9, train_loss: 1.0853, test_loss: 1.0884, test_f1: 0.4304
 epoch: 10, train_loss: 1.0660, test_loss: 1.0808, test_f1: 0.4419
 epoch: 11, train_loss: 1.0638, test_loss: 1.0688, test_f1: 0.4532
 epoch: 12, train_loss: 1.0434, test_loss: 1.0740, test_f1: 0.4382
 epoch: 13, train_loss: 1.0323, test_loss: 1.0702, test_f1: 0.4453
 epoch: 14, train_loss: 1.0224, test_loss: 1.0515, test_f1: 0.4563
 epoch: 15, train_loss: 1.0104, test_loss: 1.0607, test_f1: 0.4631
 epoch: 16, train_loss: 0.9970, test_loss: 1.0702, test_f1: 0.4419
 epoch: 17, train_loss: 0.9905, test_loss: 1.0574, test_f1: 0.4564
 epoch: 18, train_loss: 0.9694, test_loss: 1.0412, test_f1: 0.4629
 epoch: 19, train_loss: 0.9596, test_loss: 1.0400, test_f1: 0.4589
 epoch: 20, train_loss: 0.9557, test_loss: 1.0136, test_f1: 0.4824
 epoch: 21, train_loss: 0.9312, test_loss: 1.0202, test_f1: 0.4829
 epoch: 22, train_loss: 0.9183, test_loss: 0.9937, test_f1: 0.4817
 epoch: 23, train_loss: 0.9157, test_loss: 1.0270, test_f1: 0.4717
 epoch: 24, train_loss: 0.9005, test_loss: 1.0054, test_f1: 0.4756
 epoch: 25, train_loss: 0.8930, test_loss: 1.0254, test_f1: 0.4638
 epoch: 26, train_loss: 0.8921, test_loss: 1.0150, test_f1: 0.4885
 epoch: 27, train_loss: 0.8727, test_loss: 1.0219, test_f1: 0.4836
 epoch: 28, train_loss: 0.8660, test_loss: 1.0404, test_f1: 0.4630
 epoch: 29, train_loss: 0.8486, test_loss: 1.0208, test_f1: 0.4787
 epoch: 30, train_loss: 0.8436, test_loss: 1.0233, test_f1: 0.5022
 epoch: 31, train_loss: 0.8357, test_loss: 1.0363, test_f1: 0.4994
 epoch: 32, train_loss: 0.8279, test_loss: 1.0430, test_f1: 0.4949
 epoch: 33, train_loss: 0.8129, test_loss: 1.0187, test_f1: 0.5021
 epoch: 34, train_loss: 0.8133, test_loss: 1.0734, test_f1: 0.4968
 epoch: 35, train_loss: 0.8009, test_loss: 1.0738, test_f1: 0.4979
 epoch: 36, train_loss: 0.7939, test_loss: 1.0637, test_f1: 0.4812
 epoch: 37, train_loss: 0.7823, test_loss: 1.0880, test_f1: 0.4844
 epoch: 38, train_loss: 0.7753, test_loss: 1.0977, test_f1: 0.4902
 epoch: 39, train_loss: 0.7807, test_loss: 1.0818, test_f1: 0.4879
 epoch: 40, train_loss: 0.7648, test_loss: 1.1084, test_f1: 0.4811
 epoch: 41, train_loss: 0.7445, test_loss: 1.1152, test_f1: 0.4955
 epoch: 42, train_loss: 0.7419, test_loss: 1.0902, test_f1: 0.5055
 epoch: 43, train_loss: 0.7244, test_loss: 1.1171, test_f1: 0.5010
 epoch: 44, train_loss: 0.7402, test_loss: 1.1814, test_f1: 0.4986
 epoch: 45, train_loss: 0.7290, test_loss: 1.1219, test_f1: 0.5152
 epoch: 46, train_loss: 0.7251, test_loss: 1.1115, test_f1: 0.5100
 epoch: 47, train_loss: 0.7118, test_loss: 1.1542, test_f1: 0.5063
 epoch: 48, train_loss: 0.6915, test_loss: 1.1671, test_f1: 0.4779
 epoch: 49, train_loss: 0.7086, test_loss: 1.1967, test_f1: 0.5021
 epoch: 50, train_loss: 0.6836, test_loss: 1.1554, test_f1: 0.5111
 epoch: 51, train_loss: 0.6618, test_loss: 1.1656, test_f1: 0.5079
 epoch: 52, train_loss: 0.6641, test_loss: 1.1607, test_f1: 0.5145
 epoch: 53, train_loss: 0.6684, test_loss: 1.1663, test_f1: 0.5171
 epoch: 54, train_loss: 0.6589, test_loss: 1.1881, test_f1: 0.5153
 epoch: 55, train_loss: 0.6567, test_loss: 1.1792, test_f1: 0.5094
 epoch: 56, train_loss: 0.6448, test_loss: 1.1781, test_f1: 0.5169
 epoch: 57, train_loss: 0.6306, test_loss: 1.1762, test_f1: 0.5289
 epoch: 58, train_loss: 0.6397, test_loss: 1.1905, test_f1: 0.5130
 epoch: 59, train_loss: 0.6344, test_loss: 1.1945, test_f1: 0.5168
 epoch: 60, train_loss: 0.6200, test_loss: 1.1951, test_f1: 0.5158
 epoch: 61, train_loss: 0.6404, test_loss: 1.2002, test_f1: 0.5078
 epoch: 62, train_loss: 0.6290, test_loss: 1.2463, test_f1: 0.5122
 epoch: 63, train_loss: 0.6326, test_loss: 1.2490, test_f1: 0.5165
 epoch: 64, train_loss: 0.6213, test_loss: 1.2389, test_f1: 0.5165
 epoch: 65, train_loss: 0.6223, test_loss: 1.2323, test_f1: 0.5102
 epoch: 66, train_loss: 0.6110, test_loss: 1.2639, test_f1: 0.5111
 epoch: 67, train_loss: 0.6091, test_loss: 1.2893, test_f1: 0.5148
 epoch: 68, train_loss: 0.6134, test_loss: 1.2596, test_f1: 0.5232
 epoch: 69, train_loss: 0.6151, test_loss: 1.2531, test_f1: 0.5221
 epoch: 70, train_loss: 0.6055, test_loss: 1.2632, test_f1: 0.5117
 epoch: 71, train_loss: 0.6167, test_loss: 1.2903, test_f1: 0.5163
 epoch: 72, train_loss: 0.5953, test_loss: 1.2870, test_f1: 0.5333
 epoch: 73, train_loss: 0.5987, test_loss: 1.2835, test_f1: 0.5253
 epoch: 74, train_loss: 0.5838, test_loss: 1.2957, test_f1: 0.5110
 epoch: 75, train_loss: 0.5752, test_loss: 1.2830, test_f1: 0.5097
 epoch: 76, train_loss: 0.5893, test_loss: 1.2688, test_f1: 0.5270
 epoch: 77, train_loss: 0.5744, test_loss: 1.3051, test_f1: 0.5077
 epoch: 78, train_loss: 0.5904, test_loss: 1.3331, test_f1: 0.5113
 epoch: 79, train_loss: 0.5832, test_loss: 1.3494, test_f1: 0.5113
 epoch: 80, train_loss: 0.5788, test_loss: 1.3439, test_f1: 0.5175
 epoch: 81, train_loss: 0.5661, test_loss: 1.3600, test_f1: 0.5067
 epoch: 82, train_loss: 0.5732, test_loss: 1.3641, test_f1: 0.5084
 epoch: 83, train_loss: 0.5637, test_loss: 1.3339, test_f1: 0.5114
 epoch: 84, train_loss: 0.5749, test_loss: 1.3327, test_f1: 0.5289
 epoch: 85, train_loss: 0.5586, test_loss: 1.3598, test_f1: 0.5213
 epoch: 86, train_loss: 0.5502, test_loss: 1.3875, test_f1: 0.5001
 epoch: 87, train_loss: 0.5642, test_loss: 1.3867, test_f1: 0.5108
 epoch: 88, train_loss: 0.5634, test_loss: 1.3860, test_f1: 0.5143
 epoch: 89, train_loss: 0.5470, test_loss: 1.4189, test_f1: 0.5124
 epoch: 90, train_loss: 0.5390, test_loss: 1.4233, test_f1: 0.5156
 epoch: 91, train_loss: 0.5281, test_loss: 1.3755, test_f1: 0.5191
 epoch: 92, train_loss: 0.5295, test_loss: 1.3735, test_f1: 0.5218
 epoch: 93, train_loss: 0.5454, test_loss: 1.4057, test_f1: 0.5277
 epoch: 94, train_loss: 0.5556, test_loss: 1.4123, test_f1: 0.5196
 epoch: 95, train_loss: 0.5209, test_loss: 1.4126, test_f1: 0.5097
 epoch: 96, train_loss: 0.5342, test_loss: 1.4333, test_f1: 0.5242
 epoch: 97, train_loss: 0.5236, test_loss: 1.4347, test_f1: 0.5179
 epoch: 98, train_loss: 0.5229, test_loss: 1.4152, test_f1: 0.5251
 epoch: 99, train_loss: 0.5261, test_loss: 1.4326, test_f1: 0.5213
##################ITERATION #6 ****************************************
 epoch: 0, train_loss: 1.3262, test_loss: 1.3159, test_f1: 0.2701
 epoch: 1, train_loss: 1.2127, test_loss: 1.2406, test_f1: 0.4123
 epoch: 2, train_loss: 1.1843, test_loss: 1.1785, test_f1: 0.4414
 epoch: 3, train_loss: 1.1552, test_loss: 1.1437, test_f1: 0.4283
 epoch: 4, train_loss: 1.1390, test_loss: 1.1244, test_f1: 0.4282
 epoch: 5, train_loss: 1.1192, test_loss: 1.1084, test_f1: 0.4483
 epoch: 6, train_loss: 1.1080, test_loss: 1.0928, test_f1: 0.4573
 epoch: 7, train_loss: 1.0933, test_loss: 1.0787, test_f1: 0.4720
 epoch: 8, train_loss: 1.0780, test_loss: 1.0642, test_f1: 0.4756
 epoch: 9, train_loss: 1.0718, test_loss: 1.0600, test_f1: 0.4710
 epoch: 10, train_loss: 1.0569, test_loss: 1.0600, test_f1: 0.4715
 epoch: 11, train_loss: 1.0365, test_loss: 1.0469, test_f1: 0.4452
 epoch: 12, train_loss: 1.0260, test_loss: 1.0351, test_f1: 0.4684
 epoch: 13, train_loss: 1.0104, test_loss: 1.0306, test_f1: 0.4801
 epoch: 14, train_loss: 1.0077, test_loss: 1.0250, test_f1: 0.4816
 epoch: 15, train_loss: 0.9945, test_loss: 1.0306, test_f1: 0.4597
 epoch: 16, train_loss: 0.9862, test_loss: 1.0270, test_f1: 0.4724
 epoch: 17, train_loss: 0.9821, test_loss: 1.0225, test_f1: 0.4802
 epoch: 18, train_loss: 0.9789, test_loss: 1.0227, test_f1: 0.4837
 epoch: 19, train_loss: 0.9528, test_loss: 1.0288, test_f1: 0.4814
 epoch: 20, train_loss: 0.9466, test_loss: 1.0266, test_f1: 0.4723
 epoch: 21, train_loss: 0.9483, test_loss: 1.0307, test_f1: 0.4834
 epoch: 22, train_loss: 0.9179, test_loss: 1.0260, test_f1: 0.4823
 epoch: 23, train_loss: 0.9198, test_loss: 1.0107, test_f1: 0.4733
 epoch: 24, train_loss: 0.9121, test_loss: 1.0348, test_f1: 0.4813
 epoch: 25, train_loss: 0.9125, test_loss: 1.0090, test_f1: 0.4815
 epoch: 26, train_loss: 0.8918, test_loss: 1.0281, test_f1: 0.4834
 epoch: 27, train_loss: 0.8754, test_loss: 1.0299, test_f1: 0.4757
 epoch: 28, train_loss: 0.8752, test_loss: 1.0241, test_f1: 0.4932
 epoch: 29, train_loss: 0.8785, test_loss: 1.0272, test_f1: 0.4799
 epoch: 30, train_loss: 0.8570, test_loss: 1.0415, test_f1: 0.4917
 epoch: 31, train_loss: 0.8565, test_loss: 1.0392, test_f1: 0.4912
 epoch: 32, train_loss: 0.8420, test_loss: 1.0510, test_f1: 0.4982
 epoch: 33, train_loss: 0.8413, test_loss: 1.0454, test_f1: 0.4943
 epoch: 34, train_loss: 0.8320, test_loss: 1.0599, test_f1: 0.4888
 epoch: 35, train_loss: 0.8193, test_loss: 1.0602, test_f1: 0.5162
 epoch: 36, train_loss: 0.8212, test_loss: 1.0858, test_f1: 0.5020
 epoch: 37, train_loss: 0.8168, test_loss: 1.0906, test_f1: 0.5104
 epoch: 38, train_loss: 0.7976, test_loss: 1.0828, test_f1: 0.5020
 epoch: 39, train_loss: 0.7772, test_loss: 1.0803, test_f1: 0.5122
 epoch: 40, train_loss: 0.7785, test_loss: 1.0794, test_f1: 0.5242
 epoch: 41, train_loss: 0.7788, test_loss: 1.0952, test_f1: 0.5093
 epoch: 42, train_loss: 0.7737, test_loss: 1.0983, test_f1: 0.5144
 epoch: 43, train_loss: 0.7586, test_loss: 1.0945, test_f1: 0.5191
 epoch: 44, train_loss: 0.7483, test_loss: 1.1365, test_f1: 0.4953
 epoch: 45, train_loss: 0.7389, test_loss: 1.1628, test_f1: 0.5025
 epoch: 46, train_loss: 0.7455, test_loss: 1.1515, test_f1: 0.5043
 epoch: 47, train_loss: 0.7302, test_loss: 1.1542, test_f1: 0.5144
 epoch: 48, train_loss: 0.7184, test_loss: 1.2119, test_f1: 0.4952
 epoch: 49, train_loss: 0.7265, test_loss: 1.1963, test_f1: 0.5260
 epoch: 50, train_loss: 0.7100, test_loss: 1.2155, test_f1: 0.5098
 epoch: 51, train_loss: 0.6967, test_loss: 1.1989, test_f1: 0.5198
 epoch: 52, train_loss: 0.7065, test_loss: 1.1893, test_f1: 0.5211
 epoch: 53, train_loss: 0.6851, test_loss: 1.1928, test_f1: 0.5368
 epoch: 54, train_loss: 0.6800, test_loss: 1.2154, test_f1: 0.5170
 epoch: 55, train_loss: 0.6802, test_loss: 1.2398, test_f1: 0.5253
 epoch: 56, train_loss: 0.6803, test_loss: 1.2046, test_f1: 0.5085
 epoch: 57, train_loss: 0.6677, test_loss: 1.2227, test_f1: 0.5175
 epoch: 58, train_loss: 0.6691, test_loss: 1.2037, test_f1: 0.5188
 epoch: 59, train_loss: 0.6572, test_loss: 1.2311, test_f1: 0.5281
 epoch: 60, train_loss: 0.6539, test_loss: 1.2416, test_f1: 0.5143
 epoch: 61, train_loss: 0.6466, test_loss: 1.2428, test_f1: 0.5219
 epoch: 62, train_loss: 0.6564, test_loss: 1.2516, test_f1: 0.5189
 epoch: 63, train_loss: 0.6513, test_loss: 1.2506, test_f1: 0.5270
 epoch: 64, train_loss: 0.6480, test_loss: 1.2894, test_f1: 0.5158
 epoch: 65, train_loss: 0.6413, test_loss: 1.2587, test_f1: 0.5318
 epoch: 66, train_loss: 0.6530, test_loss: 1.2694, test_f1: 0.5169
 epoch: 67, train_loss: 0.6373, test_loss: 1.2995, test_f1: 0.4968
 epoch: 68, train_loss: 0.6415, test_loss: 1.2733, test_f1: 0.5034
 epoch: 69, train_loss: 0.6396, test_loss: 1.2907, test_f1: 0.4988
 epoch: 70, train_loss: 0.6271, test_loss: 1.2930, test_f1: 0.5134
 epoch: 71, train_loss: 0.6365, test_loss: 1.2957, test_f1: 0.5164
 epoch: 72, train_loss: 0.6321, test_loss: 1.3222, test_f1: 0.5225
 epoch: 73, train_loss: 0.6193, test_loss: 1.2976, test_f1: 0.5318
 epoch: 74, train_loss: 0.6235, test_loss: 1.3480, test_f1: 0.4929
 epoch: 75, train_loss: 0.6262, test_loss: 1.3405, test_f1: 0.5069
 epoch: 76, train_loss: 0.6059, test_loss: 1.3052, test_f1: 0.5093
 epoch: 77, train_loss: 0.5944, test_loss: 1.3518, test_f1: 0.5170
 epoch: 78, train_loss: 0.5965, test_loss: 1.3806, test_f1: 0.5075
 epoch: 79, train_loss: 0.6095, test_loss: 1.3942, test_f1: 0.5246
 epoch: 80, train_loss: 0.5965, test_loss: 1.3674, test_f1: 0.5150
 epoch: 81, train_loss: 0.5946, test_loss: 1.3492, test_f1: 0.5141
 epoch: 82, train_loss: 0.5860, test_loss: 1.4028, test_f1: 0.5085
 epoch: 83, train_loss: 0.5810, test_loss: 1.4232, test_f1: 0.5157
 epoch: 84, train_loss: 0.5799, test_loss: 1.3689, test_f1: 0.5140
 epoch: 85, train_loss: 0.5706, test_loss: 1.4080, test_f1: 0.5031
 epoch: 86, train_loss: 0.5799, test_loss: 1.4259, test_f1: 0.5186
 epoch: 87, train_loss: 0.5716, test_loss: 1.4103, test_f1: 0.5108
 epoch: 88, train_loss: 0.5692, test_loss: 1.4527, test_f1: 0.5209
 epoch: 89, train_loss: 0.5622, test_loss: 1.4629, test_f1: 0.5080
 epoch: 90, train_loss: 0.5642, test_loss: 1.4175, test_f1: 0.5142
 epoch: 91, train_loss: 0.5701, test_loss: 1.4794, test_f1: 0.5094
 epoch: 92, train_loss: 0.5627, test_loss: 1.4432, test_f1: 0.5078
 epoch: 93, train_loss: 0.5555, test_loss: 1.4254, test_f1: 0.5200
 epoch: 94, train_loss: 0.5675, test_loss: 1.4705, test_f1: 0.5180
 epoch: 95, train_loss: 0.5787, test_loss: 1.5497, test_f1: 0.5150
 epoch: 96, train_loss: 0.5481, test_loss: 1.4777, test_f1: 0.5117
 epoch: 97, train_loss: 0.5593, test_loss: 1.4490, test_f1: 0.5048
 epoch: 98, train_loss: 0.5592, test_loss: 1.5101, test_f1: 0.5040
 epoch: 99, train_loss: 0.5520, test_loss: 1.4691, test_f1: 0.4964
##################ITERATION #7 ****************************************
 epoch: 0, train_loss: 1.3186, test_loss: 1.3094, test_f1: 0.2274
 epoch: 1, train_loss: 1.2283, test_loss: 1.2629, test_f1: 0.2885
 epoch: 2, train_loss: 1.1945, test_loss: 1.2082, test_f1: 0.3783
 epoch: 3, train_loss: 1.1713, test_loss: 1.1419, test_f1: 0.4558
 epoch: 4, train_loss: 1.1509, test_loss: 1.1142, test_f1: 0.4686
 epoch: 5, train_loss: 1.1385, test_loss: 1.0929, test_f1: 0.4391
 epoch: 6, train_loss: 1.1055, test_loss: 1.0837, test_f1: 0.4588
 epoch: 7, train_loss: 1.1130, test_loss: 1.0795, test_f1: 0.4653
 epoch: 8, train_loss: 1.0870, test_loss: 1.0759, test_f1: 0.4664
 epoch: 9, train_loss: 1.0676, test_loss: 1.0700, test_f1: 0.4632
 epoch: 10, train_loss: 1.0600, test_loss: 1.0628, test_f1: 0.4527
 epoch: 11, train_loss: 1.0598, test_loss: 1.0563, test_f1: 0.4557
 epoch: 12, train_loss: 1.0349, test_loss: 1.0552, test_f1: 0.4736
 epoch: 13, train_loss: 1.0147, test_loss: 1.0478, test_f1: 0.4440
 epoch: 14, train_loss: 1.0124, test_loss: 1.0352, test_f1: 0.4767
 epoch: 15, train_loss: 1.0009, test_loss: 1.0363, test_f1: 0.4871
 epoch: 16, train_loss: 0.9945, test_loss: 1.0326, test_f1: 0.4730
 epoch: 17, train_loss: 0.9744, test_loss: 1.0121, test_f1: 0.4830
 epoch: 18, train_loss: 0.9719, test_loss: 1.0241, test_f1: 0.4746
 epoch: 19, train_loss: 0.9657, test_loss: 1.0144, test_f1: 0.4927
 epoch: 20, train_loss: 0.9518, test_loss: 1.0119, test_f1: 0.4884
 epoch: 21, train_loss: 0.9461, test_loss: 1.0176, test_f1: 0.5093
 epoch: 22, train_loss: 0.9339, test_loss: 1.0199, test_f1: 0.4822
 epoch: 23, train_loss: 0.9275, test_loss: 1.0081, test_f1: 0.4994
 epoch: 24, train_loss: 0.9024, test_loss: 1.0032, test_f1: 0.5101
 epoch: 25, train_loss: 0.9007, test_loss: 0.9999, test_f1: 0.4849
 epoch: 26, train_loss: 0.8925, test_loss: 1.0051, test_f1: 0.5041
 epoch: 27, train_loss: 0.8934, test_loss: 1.0138, test_f1: 0.4931
 epoch: 28, train_loss: 0.8767, test_loss: 1.0070, test_f1: 0.4928
 epoch: 29, train_loss: 0.8692, test_loss: 0.9978, test_f1: 0.5146
 epoch: 30, train_loss: 0.8631, test_loss: 1.0301, test_f1: 0.5066
 epoch: 31, train_loss: 0.8463, test_loss: 1.0245, test_f1: 0.4944
 epoch: 32, train_loss: 0.8389, test_loss: 1.0197, test_f1: 0.5052
 epoch: 33, train_loss: 0.8221, test_loss: 1.0103, test_f1: 0.5125
 epoch: 34, train_loss: 0.8250, test_loss: 1.0146, test_f1: 0.5139
 epoch: 35, train_loss: 0.8117, test_loss: 1.0524, test_f1: 0.4882
 epoch: 36, train_loss: 0.8097, test_loss: 1.0144, test_f1: 0.4885
 epoch: 37, train_loss: 0.8053, test_loss: 1.0251, test_f1: 0.5037
 epoch: 38, train_loss: 0.8012, test_loss: 1.0457, test_f1: 0.5227
 epoch: 39, train_loss: 0.7878, test_loss: 1.0309, test_f1: 0.5033
 epoch: 40, train_loss: 0.7706, test_loss: 1.0407, test_f1: 0.5193
 epoch: 41, train_loss: 0.7753, test_loss: 1.0232, test_f1: 0.5056
 epoch: 42, train_loss: 0.7769, test_loss: 1.0806, test_f1: 0.4999
 epoch: 43, train_loss: 0.7583, test_loss: 1.0448, test_f1: 0.5169
 epoch: 44, train_loss: 0.7584, test_loss: 1.0765, test_f1: 0.4880
 epoch: 45, train_loss: 0.7518, test_loss: 1.0717, test_f1: 0.5016
 epoch: 46, train_loss: 0.7388, test_loss: 1.0830, test_f1: 0.4863
 epoch: 47, train_loss: 0.7294, test_loss: 1.0833, test_f1: 0.4962
 epoch: 48, train_loss: 0.7354, test_loss: 1.0977, test_f1: 0.5163
 epoch: 49, train_loss: 0.7316, test_loss: 1.1284, test_f1: 0.4891
 epoch: 50, train_loss: 0.7049, test_loss: 1.1190, test_f1: 0.5066
 epoch: 51, train_loss: 0.6859, test_loss: 1.1171, test_f1: 0.5054
 epoch: 52, train_loss: 0.6946, test_loss: 1.1198, test_f1: 0.5114
 epoch: 53, train_loss: 0.6817, test_loss: 1.1291, test_f1: 0.5076
 epoch: 54, train_loss: 0.6623, test_loss: 1.1343, test_f1: 0.5081
 epoch: 55, train_loss: 0.6699, test_loss: 1.1510, test_f1: 0.5072
 epoch: 56, train_loss: 0.6753, test_loss: 1.1379, test_f1: 0.5101
 epoch: 57, train_loss: 0.6620, test_loss: 1.1570, test_f1: 0.5047
 epoch: 58, train_loss: 0.6660, test_loss: 1.1729, test_f1: 0.4962
 epoch: 59, train_loss: 0.6335, test_loss: 1.1750, test_f1: 0.5175
 epoch: 60, train_loss: 0.6440, test_loss: 1.1874, test_f1: 0.5251
 epoch: 61, train_loss: 0.6557, test_loss: 1.1893, test_f1: 0.5152
 epoch: 62, train_loss: 0.6368, test_loss: 1.2031, test_f1: 0.5115
 epoch: 63, train_loss: 0.6564, test_loss: 1.1884, test_f1: 0.5126
 epoch: 64, train_loss: 0.6502, test_loss: 1.1739, test_f1: 0.5286
 epoch: 65, train_loss: 0.6386, test_loss: 1.1962, test_f1: 0.5147
 epoch: 66, train_loss: 0.6325, test_loss: 1.1995, test_f1: 0.5220
 epoch: 67, train_loss: 0.6288, test_loss: 1.1868, test_f1: 0.5416
 epoch: 68, train_loss: 0.6342, test_loss: 1.2055, test_f1: 0.5255
 epoch: 69, train_loss: 0.6212, test_loss: 1.2112, test_f1: 0.5316
 epoch: 70, train_loss: 0.6140, test_loss: 1.2077, test_f1: 0.5147
 epoch: 71, train_loss: 0.6266, test_loss: 1.2170, test_f1: 0.5183
 epoch: 72, train_loss: 0.6172, test_loss: 1.2465, test_f1: 0.5380
 epoch: 73, train_loss: 0.6111, test_loss: 1.2305, test_f1: 0.5478
 epoch: 74, train_loss: 0.5905, test_loss: 1.2354, test_f1: 0.5316
 epoch: 75, train_loss: 0.6121, test_loss: 1.2265, test_f1: 0.5362
 epoch: 76, train_loss: 0.5892, test_loss: 1.2471, test_f1: 0.5292
 epoch: 77, train_loss: 0.5995, test_loss: 1.2474, test_f1: 0.5437
 epoch: 78, train_loss: 0.5986, test_loss: 1.2798, test_f1: 0.5312
 epoch: 79, train_loss: 0.6027, test_loss: 1.2762, test_f1: 0.5319
 epoch: 80, train_loss: 0.5833, test_loss: 1.2794, test_f1: 0.5381
 epoch: 81, train_loss: 0.5883, test_loss: 1.2906, test_f1: 0.5346
 epoch: 82, train_loss: 0.5698, test_loss: 1.2886, test_f1: 0.5481
 epoch: 83, train_loss: 0.5821, test_loss: 1.2859, test_f1: 0.5411
 epoch: 84, train_loss: 0.5707, test_loss: 1.3009, test_f1: 0.5359
 epoch: 85, train_loss: 0.5666, test_loss: 1.3304, test_f1: 0.5308
 epoch: 86, train_loss: 0.5723, test_loss: 1.3442, test_f1: 0.5342
 epoch: 87, train_loss: 0.5649, test_loss: 1.3267, test_f1: 0.5207
 epoch: 88, train_loss: 0.5761, test_loss: 1.2957, test_f1: 0.5269
 epoch: 89, train_loss: 0.5678, test_loss: 1.3107, test_f1: 0.5370
 epoch: 90, train_loss: 0.5700, test_loss: 1.3242, test_f1: 0.5289
 epoch: 91, train_loss: 0.5707, test_loss: 1.3351, test_f1: 0.5359
 epoch: 92, train_loss: 0.5417, test_loss: 1.3689, test_f1: 0.5416
 epoch: 93, train_loss: 0.5709, test_loss: 1.3504, test_f1: 0.5382
 epoch: 94, train_loss: 0.5505, test_loss: 1.3290, test_f1: 0.5400
 epoch: 95, train_loss: 0.5441, test_loss: 1.3256, test_f1: 0.5402
 epoch: 96, train_loss: 0.5491, test_loss: 1.3238, test_f1: 0.5391
 epoch: 97, train_loss: 0.5617, test_loss: 1.3579, test_f1: 0.5405
 epoch: 98, train_loss: 0.5383, test_loss: 1.3681, test_f1: 0.5408
 epoch: 99, train_loss: 0.5406, test_loss: 1.3857, test_f1: 0.5428
##################ITERATION #8 ****************************************
 epoch: 0, train_loss: 1.3662, test_loss: 1.3060, test_f1: 0.2646
 epoch: 1, train_loss: 1.2597, test_loss: 1.2481, test_f1: 0.2764
 epoch: 2, train_loss: 1.2305, test_loss: 1.1985, test_f1: 0.3577
 epoch: 3, train_loss: 1.2042, test_loss: 1.1575, test_f1: 0.4052
 epoch: 4, train_loss: 1.1798, test_loss: 1.1370, test_f1: 0.4574
 epoch: 5, train_loss: 1.1631, test_loss: 1.1253, test_f1: 0.4609
 epoch: 6, train_loss: 1.1336, test_loss: 1.1131, test_f1: 0.4599
 epoch: 7, train_loss: 1.1337, test_loss: 1.0997, test_f1: 0.4601
 epoch: 8, train_loss: 1.1139, test_loss: 1.0970, test_f1: 0.4550
 epoch: 9, train_loss: 1.1063, test_loss: 1.0853, test_f1: 0.4709
 epoch: 10, train_loss: 1.0879, test_loss: 1.0695, test_f1: 0.4704
 epoch: 11, train_loss: 1.0873, test_loss: 1.0715, test_f1: 0.4634
 epoch: 12, train_loss: 1.0720, test_loss: 1.0577, test_f1: 0.4785
 epoch: 13, train_loss: 1.0515, test_loss: 1.0505, test_f1: 0.4801
 epoch: 14, train_loss: 1.0409, test_loss: 1.0412, test_f1: 0.4998
 epoch: 15, train_loss: 1.0392, test_loss: 1.0351, test_f1: 0.4864
 epoch: 16, train_loss: 1.0224, test_loss: 1.0313, test_f1: 0.4841
 epoch: 17, train_loss: 1.0189, test_loss: 1.0248, test_f1: 0.4950
 epoch: 18, train_loss: 1.0183, test_loss: 1.0211, test_f1: 0.4915
 epoch: 19, train_loss: 0.9863, test_loss: 1.0167, test_f1: 0.4818
 epoch: 20, train_loss: 0.9792, test_loss: 1.0150, test_f1: 0.4864
 epoch: 21, train_loss: 0.9766, test_loss: 1.0126, test_f1: 0.4866
 epoch: 22, train_loss: 0.9731, test_loss: 1.0091, test_f1: 0.4888
 epoch: 23, train_loss: 0.9604, test_loss: 1.0173, test_f1: 0.4607
 epoch: 24, train_loss: 0.9524, test_loss: 1.0077, test_f1: 0.4850
 epoch: 25, train_loss: 0.9351, test_loss: 0.9965, test_f1: 0.4967
 epoch: 26, train_loss: 0.9361, test_loss: 0.9963, test_f1: 0.4999
 epoch: 27, train_loss: 0.9187, test_loss: 0.9952, test_f1: 0.4995
 epoch: 28, train_loss: 0.9134, test_loss: 1.0091, test_f1: 0.5015
 epoch: 29, train_loss: 0.9059, test_loss: 1.0060, test_f1: 0.4993
 epoch: 30, train_loss: 0.9071, test_loss: 0.9875, test_f1: 0.4938
 epoch: 31, train_loss: 0.8808, test_loss: 1.0077, test_f1: 0.4945
 epoch: 32, train_loss: 0.8703, test_loss: 1.0094, test_f1: 0.5033
 epoch: 33, train_loss: 0.8788, test_loss: 1.0154, test_f1: 0.4860
 epoch: 34, train_loss: 0.8521, test_loss: 1.0166, test_f1: 0.4979
 epoch: 35, train_loss: 0.8528, test_loss: 1.0092, test_f1: 0.5056
 epoch: 36, train_loss: 0.8374, test_loss: 1.0159, test_f1: 0.4971
 epoch: 37, train_loss: 0.8253, test_loss: 1.0097, test_f1: 0.5148
 epoch: 38, train_loss: 0.8259, test_loss: 1.0334, test_f1: 0.4923
 epoch: 39, train_loss: 0.8329, test_loss: 1.0345, test_f1: 0.5059
 epoch: 40, train_loss: 0.8195, test_loss: 1.0227, test_f1: 0.5068
 epoch: 41, train_loss: 0.8195, test_loss: 1.0517, test_f1: 0.4936
 epoch: 42, train_loss: 0.8028, test_loss: 1.0264, test_f1: 0.5162
 epoch: 43, train_loss: 0.7942, test_loss: 1.0373, test_f1: 0.5088
 epoch: 44, train_loss: 0.7905, test_loss: 1.0460, test_f1: 0.5260
 epoch: 45, train_loss: 0.7828, test_loss: 1.0627, test_f1: 0.5143
 epoch: 46, train_loss: 0.7734, test_loss: 1.0885, test_f1: 0.5032
 epoch: 47, train_loss: 0.7839, test_loss: 1.0510, test_f1: 0.5249
 epoch: 48, train_loss: 0.7627, test_loss: 1.0699, test_f1: 0.5224
 epoch: 49, train_loss: 0.7583, test_loss: 1.0757, test_f1: 0.5123
 epoch: 50, train_loss: 0.7521, test_loss: 1.0708, test_f1: 0.5304
 epoch: 51, train_loss: 0.7354, test_loss: 1.0777, test_f1: 0.4903
 epoch: 52, train_loss: 0.7177, test_loss: 1.0755, test_f1: 0.5107
 epoch: 53, train_loss: 0.7067, test_loss: 1.0843, test_f1: 0.5164
 epoch: 54, train_loss: 0.7123, test_loss: 1.1036, test_f1: 0.5200
 epoch: 55, train_loss: 0.7005, test_loss: 1.1024, test_f1: 0.5266
 epoch: 56, train_loss: 0.7163, test_loss: 1.1033, test_f1: 0.5335
 epoch: 57, train_loss: 0.6964, test_loss: 1.0965, test_f1: 0.5402
 epoch: 58, train_loss: 0.7078, test_loss: 1.1149, test_f1: 0.5276
 epoch: 59, train_loss: 0.6881, test_loss: 1.1109, test_f1: 0.5224
 epoch: 60, train_loss: 0.6924, test_loss: 1.1071, test_f1: 0.5239
 epoch: 61, train_loss: 0.6906, test_loss: 1.1214, test_f1: 0.5300
 epoch: 62, train_loss: 0.6808, test_loss: 1.1353, test_f1: 0.5341
 epoch: 63, train_loss: 0.6870, test_loss: 1.1376, test_f1: 0.5266
 epoch: 64, train_loss: 0.6932, test_loss: 1.1208, test_f1: 0.5290
 epoch: 65, train_loss: 0.6820, test_loss: 1.1266, test_f1: 0.5374
 epoch: 66, train_loss: 0.6698, test_loss: 1.1266, test_f1: 0.5221
 epoch: 67, train_loss: 0.6575, test_loss: 1.1337, test_f1: 0.5321
 epoch: 68, train_loss: 0.6752, test_loss: 1.1305, test_f1: 0.5312
 epoch: 69, train_loss: 0.6632, test_loss: 1.1525, test_f1: 0.5297
 epoch: 70, train_loss: 0.6554, test_loss: 1.1615, test_f1: 0.5351
 epoch: 71, train_loss: 0.6569, test_loss: 1.1703, test_f1: 0.5305
 epoch: 72, train_loss: 0.6558, test_loss: 1.1810, test_f1: 0.5301
 epoch: 73, train_loss: 0.6347, test_loss: 1.1621, test_f1: 0.5381
 epoch: 74, train_loss: 0.6453, test_loss: 1.1790, test_f1: 0.5272
 epoch: 75, train_loss: 0.6382, test_loss: 1.2060, test_f1: 0.5288
 epoch: 76, train_loss: 0.6317, test_loss: 1.1948, test_f1: 0.5399
 epoch: 77, train_loss: 0.6218, test_loss: 1.1914, test_f1: 0.5350
 epoch: 78, train_loss: 0.6283, test_loss: 1.1985, test_f1: 0.5368
 epoch: 79, train_loss: 0.6306, test_loss: 1.1714, test_f1: 0.5470
 epoch: 80, train_loss: 0.6388, test_loss: 1.2163, test_f1: 0.5296
 epoch: 81, train_loss: 0.6151, test_loss: 1.1917, test_f1: 0.5454
 epoch: 82, train_loss: 0.6240, test_loss: 1.2275, test_f1: 0.5265
 epoch: 83, train_loss: 0.6111, test_loss: 1.2251, test_f1: 0.5378
 epoch: 84, train_loss: 0.6177, test_loss: 1.2014, test_f1: 0.5308
 epoch: 85, train_loss: 0.6117, test_loss: 1.1990, test_f1: 0.5351
 epoch: 86, train_loss: 0.6238, test_loss: 1.2218, test_f1: 0.5219
 epoch: 87, train_loss: 0.6093, test_loss: 1.2295, test_f1: 0.5408
 epoch: 88, train_loss: 0.5959, test_loss: 1.2482, test_f1: 0.5400
 epoch: 89, train_loss: 0.5951, test_loss: 1.2547, test_f1: 0.5312
 epoch: 90, train_loss: 0.5982, test_loss: 1.2349, test_f1: 0.5281
 epoch: 91, train_loss: 0.6016, test_loss: 1.2073, test_f1: 0.5434
 epoch: 92, train_loss: 0.6034, test_loss: 1.2211, test_f1: 0.5380
 epoch: 93, train_loss: 0.5875, test_loss: 1.2631, test_f1: 0.5391
 epoch: 94, train_loss: 0.5902, test_loss: 1.2643, test_f1: 0.5291
 epoch: 95, train_loss: 0.5766, test_loss: 1.2673, test_f1: 0.5304
 epoch: 96, train_loss: 0.5695, test_loss: 1.2763, test_f1: 0.5394
 epoch: 97, train_loss: 0.5958, test_loss: 1.2863, test_f1: 0.5344
 epoch: 98, train_loss: 0.5674, test_loss: 1.2897, test_f1: 0.5277
 epoch: 99, train_loss: 0.5839, test_loss: 1.3052, test_f1: 0.5316
##################ITERATION #9 ****************************************
 epoch: 0, train_loss: 1.3621, test_loss: 1.2979, test_f1: 0.2580
 epoch: 1, train_loss: 1.2542, test_loss: 1.2775, test_f1: 0.2509
 epoch: 2, train_loss: 1.2154, test_loss: 1.2342, test_f1: 0.3092
 epoch: 3, train_loss: 1.1964, test_loss: 1.2085, test_f1: 0.3774
 epoch: 4, train_loss: 1.1778, test_loss: 1.1593, test_f1: 0.4374
 epoch: 5, train_loss: 1.1638, test_loss: 1.1352, test_f1: 0.4421
 epoch: 6, train_loss: 1.1382, test_loss: 1.1179, test_f1: 0.4503
 epoch: 7, train_loss: 1.1153, test_loss: 1.1403, test_f1: 0.4174
 epoch: 8, train_loss: 1.1181, test_loss: 1.1082, test_f1: 0.4128
 epoch: 9, train_loss: 1.0922, test_loss: 1.0961, test_f1: 0.4389
 epoch: 10, train_loss: 1.0761, test_loss: 1.1309, test_f1: 0.4324
 epoch: 11, train_loss: 1.0758, test_loss: 1.0819, test_f1: 0.4559
 epoch: 12, train_loss: 1.0624, test_loss: 1.0660, test_f1: 0.4673
 epoch: 13, train_loss: 1.0451, test_loss: 1.0508, test_f1: 0.4640
 epoch: 14, train_loss: 1.0387, test_loss: 1.0559, test_f1: 0.4602
 epoch: 15, train_loss: 1.0258, test_loss: 1.0516, test_f1: 0.4700
 epoch: 16, train_loss: 1.0198, test_loss: 1.0690, test_f1: 0.4567
 epoch: 17, train_loss: 1.0014, test_loss: 1.0735, test_f1: 0.4602
 epoch: 18, train_loss: 0.9961, test_loss: 1.0616, test_f1: 0.4726
 epoch: 19, train_loss: 0.9847, test_loss: 1.0514, test_f1: 0.4592
 epoch: 20, train_loss: 0.9741, test_loss: 1.0456, test_f1: 0.4881
 epoch: 21, train_loss: 0.9686, test_loss: 1.0423, test_f1: 0.4785
 epoch: 22, train_loss: 0.9652, test_loss: 1.0342, test_f1: 0.4822
 epoch: 23, train_loss: 0.9425, test_loss: 1.0466, test_f1: 0.4833
 epoch: 24, train_loss: 0.9396, test_loss: 1.0466, test_f1: 0.4656
 epoch: 25, train_loss: 0.9291, test_loss: 1.0425, test_f1: 0.4739
 epoch: 26, train_loss: 0.9130, test_loss: 1.0550, test_f1: 0.4607
 epoch: 27, train_loss: 0.9025, test_loss: 1.0494, test_f1: 0.4713
 epoch: 28, train_loss: 0.9018, test_loss: 1.0389, test_f1: 0.4935
 epoch: 29, train_loss: 0.8793, test_loss: 1.0300, test_f1: 0.4997
 epoch: 30, train_loss: 0.8860, test_loss: 1.0635, test_f1: 0.4902
 epoch: 31, train_loss: 0.8751, test_loss: 1.0446, test_f1: 0.5080
 epoch: 32, train_loss: 0.8764, test_loss: 1.0605, test_f1: 0.4991
 epoch: 33, train_loss: 0.8597, test_loss: 1.1279, test_f1: 0.4864
 epoch: 34, train_loss: 0.8514, test_loss: 1.0640, test_f1: 0.4878
 epoch: 35, train_loss: 0.8463, test_loss: 1.0698, test_f1: 0.5023
 epoch: 36, train_loss: 0.8578, test_loss: 1.0954, test_f1: 0.4814
 epoch: 37, train_loss: 0.8442, test_loss: 1.1117, test_f1: 0.4936
 epoch: 38, train_loss: 0.8163, test_loss: 1.2049, test_f1: 0.4770
 epoch: 39, train_loss: 0.8308, test_loss: 1.0871, test_f1: 0.5028
 epoch: 40, train_loss: 0.8092, test_loss: 1.0910, test_f1: 0.5124
 epoch: 41, train_loss: 0.8041, test_loss: 1.0990, test_f1: 0.4951
 epoch: 42, train_loss: 0.7882, test_loss: 1.1271, test_f1: 0.4888
 epoch: 43, train_loss: 0.7808, test_loss: 1.1221, test_f1: 0.5045
 epoch: 44, train_loss: 0.7788, test_loss: 1.1662, test_f1: 0.4986
 epoch: 45, train_loss: 0.7778, test_loss: 1.1650, test_f1: 0.5251
 epoch: 46, train_loss: 0.7778, test_loss: 1.1589, test_f1: 0.4950
 epoch: 47, train_loss: 0.7686, test_loss: 1.1854, test_f1: 0.4939
 epoch: 48, train_loss: 0.7385, test_loss: 1.2245, test_f1: 0.5024
 epoch: 49, train_loss: 0.7369, test_loss: 1.1733, test_f1: 0.4995
 epoch: 50, train_loss: 0.7337, test_loss: 1.1801, test_f1: 0.5278
 epoch: 51, train_loss: 0.7405, test_loss: 1.1945, test_f1: 0.5284
 epoch: 52, train_loss: 0.7266, test_loss: 1.1995, test_f1: 0.5148
 epoch: 53, train_loss: 0.7149, test_loss: 1.2000, test_f1: 0.5065
 epoch: 54, train_loss: 0.6892, test_loss: 1.1927, test_f1: 0.5151
 epoch: 55, train_loss: 0.7133, test_loss: 1.1933, test_f1: 0.5300
 epoch: 56, train_loss: 0.7062, test_loss: 1.2105, test_f1: 0.5208
 epoch: 57, train_loss: 0.7058, test_loss: 1.1774, test_f1: 0.5114
 epoch: 58, train_loss: 0.6853, test_loss: 1.1786, test_f1: 0.5245
 epoch: 59, train_loss: 0.6959, test_loss: 1.2007, test_f1: 0.5240
 epoch: 60, train_loss: 0.6878, test_loss: 1.2500, test_f1: 0.5057
 epoch: 61, train_loss: 0.6838, test_loss: 1.3126, test_f1: 0.5052
 epoch: 62, train_loss: 0.6777, test_loss: 1.3097, test_f1: 0.5061
 epoch: 63, train_loss: 0.6807, test_loss: 1.2528, test_f1: 0.5177
 epoch: 64, train_loss: 0.6743, test_loss: 1.2453, test_f1: 0.5226
 epoch: 65, train_loss: 0.6652, test_loss: 1.2509, test_f1: 0.5275
 epoch: 66, train_loss: 0.6552, test_loss: 1.2902, test_f1: 0.5187
 epoch: 67, train_loss: 0.6542, test_loss: 1.3498, test_f1: 0.4965
 epoch: 68, train_loss: 0.6593, test_loss: 1.2654, test_f1: 0.5304
 epoch: 69, train_loss: 0.6666, test_loss: 1.2940, test_f1: 0.5187
 epoch: 70, train_loss: 0.6520, test_loss: 1.2989, test_f1: 0.5280
 epoch: 71, train_loss: 0.6632, test_loss: 1.2562, test_f1: 0.5440
 epoch: 72, train_loss: 0.6578, test_loss: 1.3181, test_f1: 0.5253
 epoch: 73, train_loss: 0.6526, test_loss: 1.3218, test_f1: 0.5267
 epoch: 74, train_loss: 0.6437, test_loss: 1.3499, test_f1: 0.5200
 epoch: 75, train_loss: 0.6412, test_loss: 1.3202, test_f1: 0.5315
 epoch: 76, train_loss: 0.6338, test_loss: 1.3323, test_f1: 0.5279
 epoch: 77, train_loss: 0.6356, test_loss: 1.3190, test_f1: 0.5252
 epoch: 78, train_loss: 0.6266, test_loss: 1.3144, test_f1: 0.5250
 epoch: 79, train_loss: 0.6240, test_loss: 1.3239, test_f1: 0.5380
 epoch: 80, train_loss: 0.6255, test_loss: 1.3485, test_f1: 0.5192
 epoch: 81, train_loss: 0.6116, test_loss: 1.3356, test_f1: 0.5280
 epoch: 82, train_loss: 0.6197, test_loss: 1.3587, test_f1: 0.5365
 epoch: 83, train_loss: 0.6257, test_loss: 1.3542, test_f1: 0.5395
 epoch: 84, train_loss: 0.6140, test_loss: 1.3422, test_f1: 0.5383
 epoch: 85, train_loss: 0.6105, test_loss: 1.3475, test_f1: 0.5278
 epoch: 86, train_loss: 0.6124, test_loss: 1.3847, test_f1: 0.5309
 epoch: 87, train_loss: 0.6097, test_loss: 1.4011, test_f1: 0.5236
 epoch: 88, train_loss: 0.6234, test_loss: 1.3945, test_f1: 0.5260
 epoch: 89, train_loss: 0.6058, test_loss: 1.3759, test_f1: 0.5234
 epoch: 90, train_loss: 0.6053, test_loss: 1.4004, test_f1: 0.5424
 epoch: 91, train_loss: 0.5925, test_loss: 1.4091, test_f1: 0.5273
 epoch: 92, train_loss: 0.5960, test_loss: 1.4334, test_f1: 0.5372
 epoch: 93, train_loss: 0.5949, test_loss: 1.4270, test_f1: 0.5340
 epoch: 94, train_loss: 0.5983, test_loss: 1.4532, test_f1: 0.5223
 epoch: 95, train_loss: 0.5814, test_loss: 1.4563, test_f1: 0.5302
 epoch: 96, train_loss: 0.5843, test_loss: 1.4321, test_f1: 0.5447
 epoch: 97, train_loss: 0.5607, test_loss: 1.4390, test_f1: 0.5405
 epoch: 98, train_loss: 0.5901, test_loss: 1.4459, test_f1: 0.5351
 epoch: 99, train_loss: 0.5634, test_loss: 1.4675, test_f1: 0.5455

Training completed in 415.16 seconds
Best F1: 0.5526 at epoch 69
Mean F1 across iterations: 0.5344  0.0137
========================FINAL RESULTS================================
FEGIN weighted F1: 0.5526  0.0137
python main.py --data ltspice_examples --representation component_component --model FEGIN --layers 5 --hiddens 128 --batch_size 256 --lr 0.0001 --emb_size 250 --epochs 100 --save_appendix component_component_L5_H128_BS256_LR0.0001_E250 --no_val
-----



STDERR:
  File "main.py", line 370, in <module>
    main()
  File "main.py", line 254, in main
    dataset = dataset_class(
  File "/home/philip/projects/ltspice_examples_code_repo/Circuit-Completion-Using-GNNs/component_classification_with_link_prediction_head/evaluation/FEGIN/kernel/circuit_datasets.py", line 15, in __init__
    self.data, self.slices = torch.load(self.processed_paths[0])
  File "/home/philip/.local/lib/python3.8/site-packages/torch/serialization.py", line 1040, in load
    warnings.warn(
  File "/usr/lib/python3.8/warnings.py", line 109, in _showwarnmsg
    sw(msg.message, msg.category, msg.filename, msg.lineno,
  File "main.py", line 47, in warn_with_traceback
    traceback.print_stack(file=log)
/home/philip/projects/ltspice_examples_code_repo/Circuit-Completion-Using-GNNs/component_classification_with_link_prediction_head/evaluation/FEGIN/kernel/circuit_datasets.py:15: FutureWarning: You are using `torch.load` with `weights_only=False` (the current default value), which uses the default pickle module implicitly. It is possible to construct malicious pickle data which will execute arbitrary code during unpickling (See https://github.com/pytorch/pytorch/blob/main/SECURITY.md#untrusted-models for more details). In a future release, the default value for `weights_only` will be flipped to `True`. This limits the functions that could be executed during unpickling. Arbitrary objects will no longer be allowed to be loaded via this mode unless they are explicitly allowlisted by the user via `torch.serialization.add_safe_globals`. We recommend you start setting `weights_only=True` for any use case where you don't have full control of the loaded file. Please open an issue on GitHub for any issues related to this experimental feature.
  self.data, self.slices = torch.load(self.processed_paths[0])
