STDOUT:
Results will be saved in /home/philip/projects/ltspice_examples_code_repo/Circuit-Completion-Using-GNNs/component_classification_with_link_prediction_head/evaluation/FEGIN/results/model_FEGIN_dataset_ltspice_examples
Command line input: python main.py --data ltspice_examples --representation component_pin --model FEGIN --layers 3 --hiddens 64 --batch_size 256 --lr 0.01 --emb_size 250 --epochs 100 --save_appendix component_pin_L3_H64_BS256_LR0.01_E250 --no_val
 is saved.
-----
ltspice_examples - FEGIN
Using 3 layers, 64 hidden units, h = 2
Loading component_pin representation dataset
ENTERED
Training FEGIN on component_pin representation
Train: 3560, Test: 848
##################ITERATION #0 ****************************************
 epoch: 0, train_loss: 1.2566, test_loss: 1.4285, test_f1: 0.2260
 epoch: 1, train_loss: 1.0529, test_loss: 1.4353, test_f1: 0.2313
 epoch: 2, train_loss: 0.9894, test_loss: 0.9851, test_f1: 0.4891
 epoch: 3, train_loss: 0.9615, test_loss: 1.0819, test_f1: 0.4641
 epoch: 4, train_loss: 0.9207, test_loss: 1.0500, test_f1: 0.4282
 epoch: 5, train_loss: 0.8771, test_loss: 0.9029, test_f1: 0.5074
 epoch: 6, train_loss: 0.8820, test_loss: 1.0118, test_f1: 0.4739
 epoch: 7, train_loss: 0.8451, test_loss: 0.8280, test_f1: 0.5875
 epoch: 8, train_loss: 0.8430, test_loss: 0.8779, test_f1: 0.5628
 epoch: 9, train_loss: 0.8078, test_loss: 0.9736, test_f1: 0.5187
 epoch: 10, train_loss: 0.7939, test_loss: 1.3580, test_f1: 0.4081
 epoch: 11, train_loss: 0.7822, test_loss: 0.9678, test_f1: 0.5235
 epoch: 12, train_loss: 0.7874, test_loss: 0.9697, test_f1: 0.5337
 epoch: 13, train_loss: 0.7619, test_loss: 1.0126, test_f1: 0.5268
 epoch: 14, train_loss: 0.7473, test_loss: 0.9181, test_f1: 0.5274
 epoch: 15, train_loss: 0.7602, test_loss: 1.0266, test_f1: 0.5216
 epoch: 16, train_loss: 0.7563, test_loss: 0.9941, test_f1: 0.5085
 epoch: 17, train_loss: 0.7410, test_loss: 0.9030, test_f1: 0.5612
 epoch: 18, train_loss: 0.7588, test_loss: 0.9176, test_f1: 0.5951
 epoch: 19, train_loss: 0.7187, test_loss: 1.1443, test_f1: 0.5247
 epoch: 20, train_loss: 0.6978, test_loss: 0.9466, test_f1: 0.5718
 epoch: 21, train_loss: 0.7002, test_loss: 1.1684, test_f1: 0.4782
 epoch: 22, train_loss: 0.6904, test_loss: 1.1185, test_f1: 0.4748
 epoch: 23, train_loss: 0.6685, test_loss: 0.8643, test_f1: 0.5757
 epoch: 24, train_loss: 0.6805, test_loss: 0.9736, test_f1: 0.5813
 epoch: 25, train_loss: 0.6661, test_loss: 1.0220, test_f1: 0.5905
 epoch: 26, train_loss: 0.6483, test_loss: 0.9171, test_f1: 0.6006
 epoch: 27, train_loss: 0.6610, test_loss: 0.9011, test_f1: 0.6196
 epoch: 28, train_loss: 0.6453, test_loss: 1.0673, test_f1: 0.5793
 epoch: 29, train_loss: 0.6451, test_loss: 1.0977, test_f1: 0.5298
 epoch: 30, train_loss: 0.6216, test_loss: 1.0896, test_f1: 0.5707
 epoch: 31, train_loss: 0.6629, test_loss: 1.0572, test_f1: 0.5994
 epoch: 32, train_loss: 0.6311, test_loss: 0.9864, test_f1: 0.5898
 epoch: 33, train_loss: 0.6111, test_loss: 1.1081, test_f1: 0.5538
 epoch: 34, train_loss: 0.5975, test_loss: 1.0303, test_f1: 0.6478
 epoch: 35, train_loss: 0.6070, test_loss: 0.9564, test_f1: 0.6216
 epoch: 36, train_loss: 0.5897, test_loss: 1.1548, test_f1: 0.6012
 epoch: 37, train_loss: 0.5820, test_loss: 1.0441, test_f1: 0.6359
 epoch: 38, train_loss: 0.5770, test_loss: 1.1247, test_f1: 0.6285
 epoch: 39, train_loss: 0.5938, test_loss: 1.2394, test_f1: 0.5613
 epoch: 40, train_loss: 0.5731, test_loss: 1.0996, test_f1: 0.6158
 epoch: 41, train_loss: 0.5718, test_loss: 1.2135, test_f1: 0.6300
 epoch: 42, train_loss: 0.5671, test_loss: 1.1051, test_f1: 0.6206
 epoch: 43, train_loss: 0.5516, test_loss: 1.0624, test_f1: 0.6114
 epoch: 44, train_loss: 0.5615, test_loss: 1.1300, test_f1: 0.5545
 epoch: 45, train_loss: 0.5356, test_loss: 1.1689, test_f1: 0.6089
 epoch: 46, train_loss: 0.5499, test_loss: 1.0150, test_f1: 0.6601
 epoch: 47, train_loss: 0.5107, test_loss: 1.0981, test_f1: 0.6350
 epoch: 48, train_loss: 0.4886, test_loss: 1.1046, test_f1: 0.6103
 epoch: 49, train_loss: 0.5179, test_loss: 1.2272, test_f1: 0.5805
 epoch: 50, train_loss: 0.5133, test_loss: 1.0738, test_f1: 0.5832
 epoch: 51, train_loss: 0.4953, test_loss: 1.1236, test_f1: 0.6722
 epoch: 52, train_loss: 0.4650, test_loss: 1.1184, test_f1: 0.6231
 epoch: 53, train_loss: 0.4344, test_loss: 1.1349, test_f1: 0.6622
 epoch: 54, train_loss: 0.4286, test_loss: 1.1561, test_f1: 0.6486
 epoch: 55, train_loss: 0.4192, test_loss: 1.1945, test_f1: 0.6290
 epoch: 56, train_loss: 0.4112, test_loss: 1.1857, test_f1: 0.6567
 epoch: 57, train_loss: 0.4115, test_loss: 1.2666, test_f1: 0.6207
 epoch: 58, train_loss: 0.4095, test_loss: 1.1772, test_f1: 0.6433
 epoch: 59, train_loss: 0.4019, test_loss: 1.2741, test_f1: 0.6256
 epoch: 60, train_loss: 0.3931, test_loss: 1.1879, test_f1: 0.6059
 epoch: 61, train_loss: 0.4119, test_loss: 1.2301, test_f1: 0.6072
 epoch: 62, train_loss: 0.3867, test_loss: 1.2688, test_f1: 0.6538
 epoch: 63, train_loss: 0.3923, test_loss: 1.2384, test_f1: 0.6841
 epoch: 64, train_loss: 0.3859, test_loss: 1.2704, test_f1: 0.6153
 epoch: 65, train_loss: 0.3919, test_loss: 1.3870, test_f1: 0.6033
 epoch: 66, train_loss: 0.3596, test_loss: 1.2849, test_f1: 0.6629
 epoch: 67, train_loss: 0.3810, test_loss: 1.3304, test_f1: 0.6328
 epoch: 68, train_loss: 0.3849, test_loss: 1.3189, test_f1: 0.6505
 epoch: 69, train_loss: 0.3688, test_loss: 1.3458, test_f1: 0.6380
 epoch: 70, train_loss: 0.3744, test_loss: 1.3868, test_f1: 0.6142
 epoch: 71, train_loss: 0.3643, test_loss: 1.3701, test_f1: 0.6183
 epoch: 72, train_loss: 0.3485, test_loss: 1.3761, test_f1: 0.6520
 epoch: 73, train_loss: 0.3465, test_loss: 1.5573, test_f1: 0.6124
 epoch: 74, train_loss: 0.3763, test_loss: 1.1816, test_f1: 0.6472
 epoch: 75, train_loss: 0.3809, test_loss: 1.4354, test_f1: 0.6162
 epoch: 76, train_loss: 0.3467, test_loss: 1.4192, test_f1: 0.6382
 epoch: 77, train_loss: 0.3409, test_loss: 1.4500, test_f1: 0.6022
 epoch: 78, train_loss: 0.3335, test_loss: 1.5862, test_f1: 0.5635
 epoch: 79, train_loss: 0.3421, test_loss: 1.5257, test_f1: 0.6484
 epoch: 80, train_loss: 0.3349, test_loss: 1.4624, test_f1: 0.5666
 epoch: 81, train_loss: 0.3250, test_loss: 1.4904, test_f1: 0.5951
 epoch: 82, train_loss: 0.3231, test_loss: 1.4951, test_f1: 0.6393
 epoch: 83, train_loss: 0.3204, test_loss: 1.3900, test_f1: 0.6429
 epoch: 84, train_loss: 0.3155, test_loss: 1.3537, test_f1: 0.6444
 epoch: 85, train_loss: 0.3069, test_loss: 1.5093, test_f1: 0.6755
 epoch: 86, train_loss: 0.3150, test_loss: 1.5111, test_f1: 0.6653
 epoch: 87, train_loss: 0.3016, test_loss: 1.5961, test_f1: 0.6535
 epoch: 88, train_loss: 0.3308, test_loss: 1.6343, test_f1: 0.6034
 epoch: 89, train_loss: 0.3013, test_loss: 1.6501, test_f1: 0.6396
 epoch: 90, train_loss: 0.2976, test_loss: 1.8978, test_f1: 0.6108
 epoch: 91, train_loss: 0.3069, test_loss: 1.6317, test_f1: 0.6111
 epoch: 92, train_loss: 0.2982, test_loss: 1.4455, test_f1: 0.6385
 epoch: 93, train_loss: 0.2981, test_loss: 1.6439, test_f1: 0.6049
 epoch: 94, train_loss: 0.2947, test_loss: 1.5802, test_f1: 0.6171
 epoch: 95, train_loss: 0.3037, test_loss: 1.5481, test_f1: 0.6437
 epoch: 96, train_loss: 0.2871, test_loss: 1.7388, test_f1: 0.6434
 epoch: 97, train_loss: 0.2887, test_loss: 1.6213, test_f1: 0.6105
 epoch: 98, train_loss: 0.2779, test_loss: 1.6761, test_f1: 0.6450
 epoch: 99, train_loss: 0.2688, test_loss: 1.7256, test_f1: 0.6146
##################ITERATION #1 ****************************************
 epoch: 0, train_loss: 1.2087, test_loss: 1.3372, test_f1: 0.2762
 epoch: 1, train_loss: 1.0364, test_loss: 1.0601, test_f1: 0.3591
 epoch: 2, train_loss: 1.0102, test_loss: 1.0596, test_f1: 0.3775
 epoch: 3, train_loss: 0.9656, test_loss: 1.0038, test_f1: 0.4778
 epoch: 4, train_loss: 0.9466, test_loss: 0.9951, test_f1: 0.5020
 epoch: 5, train_loss: 0.9188, test_loss: 0.9854, test_f1: 0.4986
 epoch: 6, train_loss: 0.8836, test_loss: 0.9231, test_f1: 0.4984
 epoch: 7, train_loss: 0.8937, test_loss: 1.0099, test_f1: 0.5105
 epoch: 8, train_loss: 0.8666, test_loss: 0.8855, test_f1: 0.5370
 epoch: 9, train_loss: 0.8307, test_loss: 0.8328, test_f1: 0.5883
 epoch: 10, train_loss: 0.8302, test_loss: 0.8554, test_f1: 0.5786
 epoch: 11, train_loss: 0.7911, test_loss: 0.9414, test_f1: 0.5442
 epoch: 12, train_loss: 0.8087, test_loss: 0.8430, test_f1: 0.6063
 epoch: 13, train_loss: 0.7754, test_loss: 1.0018, test_f1: 0.5568
 epoch: 14, train_loss: 0.7495, test_loss: 0.8886, test_f1: 0.5288
 epoch: 15, train_loss: 0.7443, test_loss: 0.8673, test_f1: 0.5886
 epoch: 16, train_loss: 0.7617, test_loss: 0.7488, test_f1: 0.6220
 epoch: 17, train_loss: 0.7399, test_loss: 0.8199, test_f1: 0.5724
 epoch: 18, train_loss: 0.7286, test_loss: 0.8511, test_f1: 0.5525
 epoch: 19, train_loss: 0.7052, test_loss: 0.7901, test_f1: 0.5847
 epoch: 20, train_loss: 0.6683, test_loss: 0.8221, test_f1: 0.6192
 epoch: 21, train_loss: 0.6746, test_loss: 0.9864, test_f1: 0.5077
 epoch: 22, train_loss: 0.6767, test_loss: 1.0689, test_f1: 0.5368
 epoch: 23, train_loss: 0.6695, test_loss: 0.7793, test_f1: 0.6129
 epoch: 24, train_loss: 0.6626, test_loss: 0.8362, test_f1: 0.6214
 epoch: 25, train_loss: 0.6429, test_loss: 0.9295, test_f1: 0.5784
 epoch: 26, train_loss: 0.6544, test_loss: 0.9189, test_f1: 0.5902
 epoch: 27, train_loss: 0.6283, test_loss: 1.0526, test_f1: 0.5600
 epoch: 28, train_loss: 0.6205, test_loss: 1.0833, test_f1: 0.5252
 epoch: 29, train_loss: 0.6156, test_loss: 0.9074, test_f1: 0.5953
 epoch: 30, train_loss: 0.6390, test_loss: 0.9849, test_f1: 0.5334
 epoch: 31, train_loss: 0.6298, test_loss: 1.1193, test_f1: 0.5344
 epoch: 32, train_loss: 0.6347, test_loss: 1.1871, test_f1: 0.4787
 epoch: 33, train_loss: 0.6074, test_loss: 0.8303, test_f1: 0.6176
 epoch: 34, train_loss: 0.6034, test_loss: 0.8197, test_f1: 0.6173
 epoch: 35, train_loss: 0.5848, test_loss: 0.9324, test_f1: 0.6003
 epoch: 36, train_loss: 0.5745, test_loss: 1.1199, test_f1: 0.5649
 epoch: 37, train_loss: 0.5864, test_loss: 0.8795, test_f1: 0.6041
 epoch: 38, train_loss: 0.5682, test_loss: 0.9316, test_f1: 0.6121
 epoch: 39, train_loss: 0.5392, test_loss: 0.8868, test_f1: 0.6126
 epoch: 40, train_loss: 0.5165, test_loss: 0.8816, test_f1: 0.6110
 epoch: 41, train_loss: 0.5456, test_loss: 0.8512, test_f1: 0.6418
 epoch: 42, train_loss: 0.5182, test_loss: 0.9075, test_f1: 0.6295
 epoch: 43, train_loss: 0.5316, test_loss: 0.8510, test_f1: 0.6241
 epoch: 44, train_loss: 0.5176, test_loss: 0.8596, test_f1: 0.6392
 epoch: 45, train_loss: 0.5028, test_loss: 0.7911, test_f1: 0.6520
 epoch: 46, train_loss: 0.5271, test_loss: 0.8725, test_f1: 0.6283
 epoch: 47, train_loss: 0.5345, test_loss: 0.8517, test_f1: 0.6501
 epoch: 48, train_loss: 0.5087, test_loss: 0.8732, test_f1: 0.6416
 epoch: 49, train_loss: 0.5049, test_loss: 1.0922, test_f1: 0.5573
 epoch: 50, train_loss: 0.4703, test_loss: 0.8565, test_f1: 0.6673
 epoch: 51, train_loss: 0.4573, test_loss: 0.9283, test_f1: 0.6373
 epoch: 52, train_loss: 0.4374, test_loss: 0.8434, test_f1: 0.6483
 epoch: 53, train_loss: 0.4006, test_loss: 0.9080, test_f1: 0.6507
 epoch: 54, train_loss: 0.4138, test_loss: 0.8806, test_f1: 0.6721
 epoch: 55, train_loss: 0.3960, test_loss: 0.9755, test_f1: 0.6825
 epoch: 56, train_loss: 0.4179, test_loss: 0.9661, test_f1: 0.6704
 epoch: 57, train_loss: 0.4107, test_loss: 1.0437, test_f1: 0.6479
 epoch: 58, train_loss: 0.3839, test_loss: 1.0316, test_f1: 0.6165
 epoch: 59, train_loss: 0.3952, test_loss: 1.0818, test_f1: 0.6606
 epoch: 60, train_loss: 0.3900, test_loss: 0.9888, test_f1: 0.6782
 epoch: 61, train_loss: 0.3862, test_loss: 0.9559, test_f1: 0.6387
 epoch: 62, train_loss: 0.3769, test_loss: 0.9720, test_f1: 0.6644
 epoch: 63, train_loss: 0.3685, test_loss: 1.0287, test_f1: 0.6717
 epoch: 64, train_loss: 0.3649, test_loss: 1.0348, test_f1: 0.6694
 epoch: 65, train_loss: 0.3716, test_loss: 1.0863, test_f1: 0.6433
 epoch: 66, train_loss: 0.3669, test_loss: 1.2373, test_f1: 0.5991
 epoch: 67, train_loss: 0.3795, test_loss: 1.0563, test_f1: 0.6271
 epoch: 68, train_loss: 0.3595, test_loss: 1.0541, test_f1: 0.6562
 epoch: 69, train_loss: 0.3776, test_loss: 0.9791, test_f1: 0.6808
 epoch: 70, train_loss: 0.3505, test_loss: 1.0838, test_f1: 0.6153
 epoch: 71, train_loss: 0.3555, test_loss: 1.1336, test_f1: 0.6452
 epoch: 72, train_loss: 0.3391, test_loss: 1.0235, test_f1: 0.6600
 epoch: 73, train_loss: 0.3351, test_loss: 0.9450, test_f1: 0.6614
 epoch: 74, train_loss: 0.3516, test_loss: 1.1613, test_f1: 0.6582
 epoch: 75, train_loss: 0.3524, test_loss: 0.9746, test_f1: 0.6765
 epoch: 76, train_loss: 0.3690, test_loss: 1.0901, test_f1: 0.6511
 epoch: 77, train_loss: 0.3528, test_loss: 0.9962, test_f1: 0.6781
 epoch: 78, train_loss: 0.3310, test_loss: 1.1056, test_f1: 0.6544
 epoch: 79, train_loss: 0.3278, test_loss: 1.1238, test_f1: 0.6763
 epoch: 80, train_loss: 0.3274, test_loss: 0.9461, test_f1: 0.6710
 epoch: 81, train_loss: 0.3264, test_loss: 0.9719, test_f1: 0.6519
 epoch: 82, train_loss: 0.3328, test_loss: 1.1913, test_f1: 0.6446
 epoch: 83, train_loss: 0.3349, test_loss: 0.9903, test_f1: 0.6610
 epoch: 84, train_loss: 0.3080, test_loss: 1.1705, test_f1: 0.6682
 epoch: 85, train_loss: 0.3159, test_loss: 1.1188, test_f1: 0.6518
 epoch: 86, train_loss: 0.3183, test_loss: 1.1804, test_f1: 0.6476
 epoch: 87, train_loss: 0.3174, test_loss: 1.0901, test_f1: 0.6645
 epoch: 88, train_loss: 0.3342, test_loss: 1.0872, test_f1: 0.6481
 epoch: 89, train_loss: 0.3263, test_loss: 1.0282, test_f1: 0.6383
 epoch: 90, train_loss: 0.3109, test_loss: 0.9819, test_f1: 0.6789
 epoch: 91, train_loss: 0.3181, test_loss: 1.0866, test_f1: 0.6536
 epoch: 92, train_loss: 0.2961, test_loss: 1.1583, test_f1: 0.6468
 epoch: 93, train_loss: 0.2820, test_loss: 1.0540, test_f1: 0.6663
 epoch: 94, train_loss: 0.2927, test_loss: 1.1592, test_f1: 0.6728
 epoch: 95, train_loss: 0.2951, test_loss: 1.1155, test_f1: 0.6546
 epoch: 96, train_loss: 0.2751, test_loss: 1.0968, test_f1: 0.6889
 epoch: 97, train_loss: 0.2934, test_loss: 1.1937, test_f1: 0.6755
 epoch: 98, train_loss: 0.3144, test_loss: 1.1341, test_f1: 0.6476
 epoch: 99, train_loss: 0.3025, test_loss: 1.1574, test_f1: 0.6336
##################ITERATION #2 ****************************************
 epoch: 0, train_loss: 1.4870, test_loss: 1.3463, test_f1: 0.2785
 epoch: 1, train_loss: 1.0414, test_loss: 1.0286, test_f1: 0.4202
 epoch: 2, train_loss: 0.9892, test_loss: 1.0578, test_f1: 0.4586
 epoch: 3, train_loss: 0.9418, test_loss: 1.0954, test_f1: 0.4912
 epoch: 4, train_loss: 0.9136, test_loss: 1.0538, test_f1: 0.4746
 epoch: 5, train_loss: 0.9008, test_loss: 0.9724, test_f1: 0.5160
 epoch: 6, train_loss: 0.8821, test_loss: 1.0401, test_f1: 0.4990
 epoch: 7, train_loss: 0.8430, test_loss: 1.0568, test_f1: 0.4927
 epoch: 8, train_loss: 0.8162, test_loss: 1.1579, test_f1: 0.4743
 epoch: 9, train_loss: 0.8195, test_loss: 0.9159, test_f1: 0.5605
 epoch: 10, train_loss: 0.7955, test_loss: 1.1415, test_f1: 0.4728
 epoch: 11, train_loss: 0.7851, test_loss: 0.8584, test_f1: 0.5811
 epoch: 12, train_loss: 0.7671, test_loss: 1.0797, test_f1: 0.4927
 epoch: 13, train_loss: 0.7609, test_loss: 0.9446, test_f1: 0.5925
 epoch: 14, train_loss: 0.7511, test_loss: 0.9270, test_f1: 0.5424
 epoch: 15, train_loss: 0.7268, test_loss: 0.9343, test_f1: 0.6047
 epoch: 16, train_loss: 0.7350, test_loss: 0.8082, test_f1: 0.5666
 epoch: 17, train_loss: 0.7298, test_loss: 1.3684, test_f1: 0.4754
 epoch: 18, train_loss: 0.7304, test_loss: 0.8820, test_f1: 0.6091
 epoch: 19, train_loss: 0.6947, test_loss: 0.8889, test_f1: 0.6156
 epoch: 20, train_loss: 0.6916, test_loss: 0.8721, test_f1: 0.6254
 epoch: 21, train_loss: 0.6847, test_loss: 1.0203, test_f1: 0.5465
 epoch: 22, train_loss: 0.6808, test_loss: 0.9262, test_f1: 0.6411
 epoch: 23, train_loss: 0.6678, test_loss: 0.9775, test_f1: 0.5836
 epoch: 24, train_loss: 0.6627, test_loss: 0.8797, test_f1: 0.5894
 epoch: 25, train_loss: 0.6754, test_loss: 0.8770, test_f1: 0.6096
 epoch: 26, train_loss: 0.6601, test_loss: 0.9707, test_f1: 0.6127
 epoch: 27, train_loss: 0.6180, test_loss: 1.0285, test_f1: 0.5995
 epoch: 28, train_loss: 0.6117, test_loss: 0.9774, test_f1: 0.6076
 epoch: 29, train_loss: 0.6224, test_loss: 0.9245, test_f1: 0.5916
 epoch: 30, train_loss: 0.6248, test_loss: 0.9989, test_f1: 0.6013
 epoch: 31, train_loss: 0.6423, test_loss: 1.4773, test_f1: 0.5200
 epoch: 32, train_loss: 0.6176, test_loss: 0.9233, test_f1: 0.5932
 epoch: 33, train_loss: 0.6100, test_loss: 1.0285, test_f1: 0.6028
 epoch: 34, train_loss: 0.5994, test_loss: 0.8696, test_f1: 0.6144
 epoch: 35, train_loss: 0.6149, test_loss: 0.8989, test_f1: 0.6226
 epoch: 36, train_loss: 0.5986, test_loss: 1.0114, test_f1: 0.5839
 epoch: 37, train_loss: 0.5875, test_loss: 1.0003, test_f1: 0.5723
 epoch: 38, train_loss: 0.5759, test_loss: 1.0234, test_f1: 0.6082
 epoch: 39, train_loss: 0.5580, test_loss: 1.0056, test_f1: 0.6008
 epoch: 40, train_loss: 0.5364, test_loss: 1.2047, test_f1: 0.6127
 epoch: 41, train_loss: 0.5263, test_loss: 1.0679, test_f1: 0.5795
 epoch: 42, train_loss: 0.5336, test_loss: 1.1487, test_f1: 0.5868
 epoch: 43, train_loss: 0.5370, test_loss: 0.8736, test_f1: 0.6277
 epoch: 44, train_loss: 0.5343, test_loss: 1.1462, test_f1: 0.6058
 epoch: 45, train_loss: 0.5093, test_loss: 0.9392, test_f1: 0.6483
 epoch: 46, train_loss: 0.5243, test_loss: 0.9258, test_f1: 0.6269
 epoch: 47, train_loss: 0.5378, test_loss: 0.9688, test_f1: 0.6328
 epoch: 48, train_loss: 0.5195, test_loss: 1.1084, test_f1: 0.5566
 epoch: 49, train_loss: 0.5079, test_loss: 0.9751, test_f1: 0.6226
 epoch: 50, train_loss: 0.5035, test_loss: 1.1095, test_f1: 0.6150
 epoch: 51, train_loss: 0.4652, test_loss: 1.0207, test_f1: 0.6390
 epoch: 52, train_loss: 0.4502, test_loss: 1.1153, test_f1: 0.6294
 epoch: 53, train_loss: 0.4135, test_loss: 0.9828, test_f1: 0.6367
 epoch: 54, train_loss: 0.4149, test_loss: 1.0610, test_f1: 0.6317
 epoch: 55, train_loss: 0.4007, test_loss: 0.9644, test_f1: 0.6322
 epoch: 56, train_loss: 0.3866, test_loss: 1.0790, test_f1: 0.6503
 epoch: 57, train_loss: 0.3928, test_loss: 1.1028, test_f1: 0.6490
 epoch: 58, train_loss: 0.4166, test_loss: 1.0352, test_f1: 0.6358
 epoch: 59, train_loss: 0.3831, test_loss: 1.1469, test_f1: 0.6224
 epoch: 60, train_loss: 0.3803, test_loss: 1.1825, test_f1: 0.6067
 epoch: 61, train_loss: 0.4124, test_loss: 1.0608, test_f1: 0.6283
 epoch: 62, train_loss: 0.3668, test_loss: 1.1111, test_f1: 0.6400
 epoch: 63, train_loss: 0.3576, test_loss: 1.0550, test_f1: 0.6595
 epoch: 64, train_loss: 0.3621, test_loss: 1.1548, test_f1: 0.6132
 epoch: 65, train_loss: 0.3619, test_loss: 1.1280, test_f1: 0.6388
 epoch: 66, train_loss: 0.3574, test_loss: 1.1832, test_f1: 0.6242
 epoch: 67, train_loss: 0.3696, test_loss: 1.0590, test_f1: 0.6438
 epoch: 68, train_loss: 0.3541, test_loss: 1.2250, test_f1: 0.6058
 epoch: 69, train_loss: 0.3505, test_loss: 1.1015, test_f1: 0.6614
 epoch: 70, train_loss: 0.3556, test_loss: 1.1045, test_f1: 0.6185
 epoch: 71, train_loss: 0.3501, test_loss: 1.3084, test_f1: 0.6037
 epoch: 72, train_loss: 0.3546, test_loss: 1.1663, test_f1: 0.6476
 epoch: 73, train_loss: 0.3519, test_loss: 1.2323, test_f1: 0.6450
 epoch: 74, train_loss: 0.3347, test_loss: 1.2539, test_f1: 0.6268
 epoch: 75, train_loss: 0.3414, test_loss: 1.1157, test_f1: 0.6408
 epoch: 76, train_loss: 0.3746, test_loss: 1.1041, test_f1: 0.6187
 epoch: 77, train_loss: 0.3554, test_loss: 1.1684, test_f1: 0.6300
 epoch: 78, train_loss: 0.3579, test_loss: 1.0581, test_f1: 0.6420
 epoch: 79, train_loss: 0.3557, test_loss: 1.2533, test_f1: 0.6102
 epoch: 80, train_loss: 0.3390, test_loss: 1.1364, test_f1: 0.6366
 epoch: 81, train_loss: 0.3281, test_loss: 1.2779, test_f1: 0.6221
 epoch: 82, train_loss: 0.3185, test_loss: 1.1847, test_f1: 0.6586
 epoch: 83, train_loss: 0.3235, test_loss: 1.1943, test_f1: 0.6509
 epoch: 84, train_loss: 0.3027, test_loss: 1.2504, test_f1: 0.6446
 epoch: 85, train_loss: 0.3028, test_loss: 1.2920, test_f1: 0.6127
 epoch: 86, train_loss: 0.2955, test_loss: 1.3105, test_f1: 0.6403
 epoch: 87, train_loss: 0.3059, test_loss: 1.2667, test_f1: 0.6442
 epoch: 88, train_loss: 0.3315, test_loss: 1.2113, test_f1: 0.6291
 epoch: 89, train_loss: 0.3131, test_loss: 1.2206, test_f1: 0.6311
 epoch: 90, train_loss: 0.2965, test_loss: 1.3517, test_f1: 0.6024
 epoch: 91, train_loss: 0.3101, test_loss: 1.1901, test_f1: 0.6541
 epoch: 92, train_loss: 0.3399, test_loss: 1.2368, test_f1: 0.6270
 epoch: 93, train_loss: 0.3112, test_loss: 1.3460, test_f1: 0.6412
 epoch: 94, train_loss: 0.3012, test_loss: 1.0527, test_f1: 0.6627
 epoch: 95, train_loss: 0.2958, test_loss: 1.4059, test_f1: 0.6513
 epoch: 96, train_loss: 0.2896, test_loss: 1.3078, test_f1: 0.6360
 epoch: 97, train_loss: 0.2879, test_loss: 1.3274, test_f1: 0.6536
 epoch: 98, train_loss: 0.2870, test_loss: 1.3407, test_f1: 0.6359
 epoch: 99, train_loss: 0.2905, test_loss: 1.3561, test_f1: 0.6391
##################ITERATION #3 ****************************************
 epoch: 0, train_loss: 1.4824, test_loss: 1.2077, test_f1: 0.2616
 epoch: 1, train_loss: 1.0535, test_loss: 1.0673, test_f1: 0.3943
 epoch: 2, train_loss: 1.0067, test_loss: 1.0782, test_f1: 0.4477
 epoch: 3, train_loss: 0.9716, test_loss: 1.0379, test_f1: 0.4526
 epoch: 4, train_loss: 0.9512, test_loss: 1.0011, test_f1: 0.4909
 epoch: 5, train_loss: 0.9300, test_loss: 1.1820, test_f1: 0.5179
 epoch: 6, train_loss: 0.9045, test_loss: 0.9812, test_f1: 0.4941
 epoch: 7, train_loss: 0.8897, test_loss: 0.9996, test_f1: 0.4847
 epoch: 8, train_loss: 0.8570, test_loss: 1.0198, test_f1: 0.4608
 epoch: 9, train_loss: 0.8353, test_loss: 1.0537, test_f1: 0.4707
 epoch: 10, train_loss: 0.8307, test_loss: 0.9827, test_f1: 0.5662
 epoch: 11, train_loss: 0.8127, test_loss: 0.9522, test_f1: 0.5274
 epoch: 12, train_loss: 0.8185, test_loss: 0.8711, test_f1: 0.5294
 epoch: 13, train_loss: 0.8049, test_loss: 0.9193, test_f1: 0.5589
 epoch: 14, train_loss: 0.7882, test_loss: 0.9530, test_f1: 0.5105
 epoch: 15, train_loss: 0.7662, test_loss: 1.0199, test_f1: 0.5405
 epoch: 16, train_loss: 0.7506, test_loss: 0.9357, test_f1: 0.5335
 epoch: 17, train_loss: 0.7468, test_loss: 0.8853, test_f1: 0.5604
 epoch: 18, train_loss: 0.7437, test_loss: 0.9885, test_f1: 0.5099
 epoch: 19, train_loss: 0.7345, test_loss: 0.9174, test_f1: 0.5616
 epoch: 20, train_loss: 0.7370, test_loss: 0.9240, test_f1: 0.5171
 epoch: 21, train_loss: 0.7258, test_loss: 1.0436, test_f1: 0.5431
 epoch: 22, train_loss: 0.7051, test_loss: 0.9068, test_f1: 0.5556
 epoch: 23, train_loss: 0.6950, test_loss: 1.0526, test_f1: 0.5188
 epoch: 24, train_loss: 0.6917, test_loss: 1.2988, test_f1: 0.4653
 epoch: 25, train_loss: 0.6773, test_loss: 0.9836, test_f1: 0.5816
 epoch: 26, train_loss: 0.6927, test_loss: 1.0092, test_f1: 0.5065
 epoch: 27, train_loss: 0.6465, test_loss: 1.0248, test_f1: 0.5320
 epoch: 28, train_loss: 0.6720, test_loss: 1.7852, test_f1: 0.5134
 epoch: 29, train_loss: 0.6540, test_loss: 1.1647, test_f1: 0.5213
 epoch: 30, train_loss: 0.6535, test_loss: 1.0312, test_f1: 0.5517
 epoch: 31, train_loss: 0.6451, test_loss: 0.8595, test_f1: 0.5764
 epoch: 32, train_loss: 0.6301, test_loss: 0.8851, test_f1: 0.5985
 epoch: 33, train_loss: 0.6182, test_loss: 1.1192, test_f1: 0.5231
 epoch: 34, train_loss: 0.6151, test_loss: 1.0675, test_f1: 0.5610
 epoch: 35, train_loss: 0.5914, test_loss: 0.9112, test_f1: 0.6015
 epoch: 36, train_loss: 0.5971, test_loss: 0.9694, test_f1: 0.5554
 epoch: 37, train_loss: 0.5950, test_loss: 0.8887, test_f1: 0.5823
 epoch: 38, train_loss: 0.5629, test_loss: 0.9792, test_f1: 0.5862
 epoch: 39, train_loss: 0.5600, test_loss: 1.0389, test_f1: 0.5632
 epoch: 40, train_loss: 0.5956, test_loss: 1.1385, test_f1: 0.5231
 epoch: 41, train_loss: 0.6187, test_loss: 1.0282, test_f1: 0.5783
 epoch: 42, train_loss: 0.6041, test_loss: 1.0482, test_f1: 0.5580
 epoch: 43, train_loss: 0.5628, test_loss: 0.9852, test_f1: 0.6184
 epoch: 44, train_loss: 0.5553, test_loss: 1.0816, test_f1: 0.5532
 epoch: 45, train_loss: 0.5432, test_loss: 0.9277, test_f1: 0.6201
 epoch: 46, train_loss: 0.5312, test_loss: 1.0848, test_f1: 0.5529
 epoch: 47, train_loss: 0.5348, test_loss: 0.9671, test_f1: 0.6164
 epoch: 48, train_loss: 0.5245, test_loss: 0.9743, test_f1: 0.5792
 epoch: 49, train_loss: 0.5185, test_loss: 1.2326, test_f1: 0.5660
 epoch: 50, train_loss: 0.5277, test_loss: 1.3947, test_f1: 0.5442
 epoch: 51, train_loss: 0.5114, test_loss: 1.1228, test_f1: 0.6009
 epoch: 52, train_loss: 0.4828, test_loss: 1.0410, test_f1: 0.6197
 epoch: 53, train_loss: 0.4521, test_loss: 1.0870, test_f1: 0.5952
 epoch: 54, train_loss: 0.4326, test_loss: 0.9977, test_f1: 0.6241
 epoch: 55, train_loss: 0.4310, test_loss: 1.0434, test_f1: 0.6193
 epoch: 56, train_loss: 0.4258, test_loss: 1.1442, test_f1: 0.6122
 epoch: 57, train_loss: 0.4376, test_loss: 1.0934, test_f1: 0.5940
 epoch: 58, train_loss: 0.4566, test_loss: 1.0999, test_f1: 0.5841
 epoch: 59, train_loss: 0.4391, test_loss: 1.0760, test_f1: 0.5906
 epoch: 60, train_loss: 0.4193, test_loss: 1.1689, test_f1: 0.5998
 epoch: 61, train_loss: 0.3956, test_loss: 1.1205, test_f1: 0.6516
 epoch: 62, train_loss: 0.3719, test_loss: 1.1867, test_f1: 0.6322
 epoch: 63, train_loss: 0.3854, test_loss: 1.2698, test_f1: 0.6130
 epoch: 64, train_loss: 0.3777, test_loss: 1.1395, test_f1: 0.6382
 epoch: 65, train_loss: 0.3837, test_loss: 1.1438, test_f1: 0.6565
 epoch: 66, train_loss: 0.3723, test_loss: 1.2441, test_f1: 0.6183
 epoch: 67, train_loss: 0.3700, test_loss: 1.1087, test_f1: 0.6361
 epoch: 68, train_loss: 0.3677, test_loss: 1.2969, test_f1: 0.6026
 epoch: 69, train_loss: 0.4213, test_loss: 1.1139, test_f1: 0.6404
 epoch: 70, train_loss: 0.3678, test_loss: 1.1694, test_f1: 0.6319
 epoch: 71, train_loss: 0.3686, test_loss: 1.1461, test_f1: 0.6353
 epoch: 72, train_loss: 0.3823, test_loss: 1.0948, test_f1: 0.6251
 epoch: 73, train_loss: 0.3765, test_loss: 1.2304, test_f1: 0.6262
 epoch: 74, train_loss: 0.3579, test_loss: 1.1339, test_f1: 0.6444
 epoch: 75, train_loss: 0.3745, test_loss: 1.3374, test_f1: 0.5767
 epoch: 76, train_loss: 0.3877, test_loss: 1.1153, test_f1: 0.6373
 epoch: 77, train_loss: 0.3828, test_loss: 1.3523, test_f1: 0.6133
 epoch: 78, train_loss: 0.3645, test_loss: 1.1080, test_f1: 0.6653
 epoch: 79, train_loss: 0.3550, test_loss: 1.2380, test_f1: 0.6133
 epoch: 80, train_loss: 0.3507, test_loss: 1.1809, test_f1: 0.6402
 epoch: 81, train_loss: 0.3387, test_loss: 1.3919, test_f1: 0.6159
 epoch: 82, train_loss: 0.3540, test_loss: 1.3683, test_f1: 0.5847
 epoch: 83, train_loss: 0.3658, test_loss: 1.2176, test_f1: 0.6156
 epoch: 84, train_loss: 0.3498, test_loss: 1.2674, test_f1: 0.6354
 epoch: 85, train_loss: 0.3316, test_loss: 1.1809, test_f1: 0.6473
 epoch: 86, train_loss: 0.3199, test_loss: 1.3665, test_f1: 0.6364
 epoch: 87, train_loss: 0.3322, test_loss: 1.1168, test_f1: 0.6483
 epoch: 88, train_loss: 0.3089, test_loss: 1.2542, test_f1: 0.6604
 epoch: 89, train_loss: 0.2981, test_loss: 1.4604, test_f1: 0.6394
 epoch: 90, train_loss: 0.3303, test_loss: 1.3351, test_f1: 0.6325
 epoch: 91, train_loss: 0.3258, test_loss: 1.2942, test_f1: 0.6316
 epoch: 92, train_loss: 0.3347, test_loss: 1.1484, test_f1: 0.6566
 epoch: 93, train_loss: 0.3288, test_loss: 1.2241, test_f1: 0.6409
 epoch: 94, train_loss: 0.3544, test_loss: 1.3963, test_f1: 0.6348
 epoch: 95, train_loss: 0.3586, test_loss: 1.3092, test_f1: 0.6213
 epoch: 96, train_loss: 0.3478, test_loss: 1.1910, test_f1: 0.6676
 epoch: 97, train_loss: 0.3179, test_loss: 1.1669, test_f1: 0.6401
 epoch: 98, train_loss: 0.3050, test_loss: 1.3766, test_f1: 0.6420
 epoch: 99, train_loss: 0.3097, test_loss: 1.3667, test_f1: 0.6275
##################ITERATION #4 ****************************************
 epoch: 0, train_loss: 1.4103, test_loss: 1.1585, test_f1: 0.3299
 epoch: 1, train_loss: 1.0174, test_loss: 1.1044, test_f1: 0.3615
 epoch: 2, train_loss: 0.9485, test_loss: 1.0844, test_f1: 0.4211
 epoch: 3, train_loss: 0.9076, test_loss: 0.9975, test_f1: 0.4901
 epoch: 4, train_loss: 0.8897, test_loss: 0.9211, test_f1: 0.5642
 epoch: 5, train_loss: 0.8686, test_loss: 1.3513, test_f1: 0.3983
 epoch: 6, train_loss: 0.8600, test_loss: 0.9819, test_f1: 0.4793
 epoch: 7, train_loss: 0.8512, test_loss: 0.9873, test_f1: 0.5263
 epoch: 8, train_loss: 0.8048, test_loss: 1.0768, test_f1: 0.4254
 epoch: 9, train_loss: 0.7944, test_loss: 0.8738, test_f1: 0.5626
 epoch: 10, train_loss: 0.7778, test_loss: 0.9406, test_f1: 0.5298
 epoch: 11, train_loss: 0.7564, test_loss: 0.9259, test_f1: 0.5466
 epoch: 12, train_loss: 0.7673, test_loss: 0.8491, test_f1: 0.5701
 epoch: 13, train_loss: 0.7366, test_loss: 0.8519, test_f1: 0.5274
 epoch: 14, train_loss: 0.7260, test_loss: 0.9786, test_f1: 0.5687
 epoch: 15, train_loss: 0.7141, test_loss: 0.7804, test_f1: 0.6169
 epoch: 16, train_loss: 0.7269, test_loss: 0.8699, test_f1: 0.5324
 epoch: 17, train_loss: 0.7104, test_loss: 0.8717, test_f1: 0.5666
 epoch: 18, train_loss: 0.7070, test_loss: 0.9706, test_f1: 0.5586
 epoch: 19, train_loss: 0.6702, test_loss: 0.8725, test_f1: 0.6301
 epoch: 20, train_loss: 0.6662, test_loss: 0.8042, test_f1: 0.6160
 epoch: 21, train_loss: 0.6642, test_loss: 0.8174, test_f1: 0.6389
 epoch: 22, train_loss: 0.6661, test_loss: 1.2698, test_f1: 0.5917
 epoch: 23, train_loss: 0.6493, test_loss: 1.1902, test_f1: 0.5426
 epoch: 24, train_loss: 0.6460, test_loss: 0.8565, test_f1: 0.6106
 epoch: 25, train_loss: 0.6479, test_loss: 1.0554, test_f1: 0.5715
 epoch: 26, train_loss: 0.6227, test_loss: 1.1346, test_f1: 0.5714
 epoch: 27, train_loss: 0.6364, test_loss: 0.9501, test_f1: 0.6104
 epoch: 28, train_loss: 0.6166, test_loss: 0.8773, test_f1: 0.5974
 epoch: 29, train_loss: 0.5985, test_loss: 1.1082, test_f1: 0.5967
 epoch: 30, train_loss: 0.6126, test_loss: 0.9769, test_f1: 0.5651
 epoch: 31, train_loss: 0.6194, test_loss: 0.9228, test_f1: 0.5831
 epoch: 32, train_loss: 0.5884, test_loss: 0.9596, test_f1: 0.5878
 epoch: 33, train_loss: 0.5840, test_loss: 0.8209, test_f1: 0.6194
 epoch: 34, train_loss: 0.5864, test_loss: 1.0106, test_f1: 0.5738
 epoch: 35, train_loss: 0.5682, test_loss: 0.8888, test_f1: 0.6168
 epoch: 36, train_loss: 0.5781, test_loss: 0.8996, test_f1: 0.6206
 epoch: 37, train_loss: 0.5729, test_loss: 0.8734, test_f1: 0.6145
 epoch: 38, train_loss: 0.5435, test_loss: 0.7191, test_f1: 0.6639
 epoch: 39, train_loss: 0.5346, test_loss: 0.8465, test_f1: 0.6104
 epoch: 40, train_loss: 0.5431, test_loss: 1.3721, test_f1: 0.5567
 epoch: 41, train_loss: 0.5547, test_loss: 0.7554, test_f1: 0.6291
 epoch: 42, train_loss: 0.5260, test_loss: 0.8595, test_f1: 0.6335
 epoch: 43, train_loss: 0.5119, test_loss: 0.8062, test_f1: 0.6382
 epoch: 44, train_loss: 0.5266, test_loss: 0.8247, test_f1: 0.6305
 epoch: 45, train_loss: 0.5304, test_loss: 0.8528, test_f1: 0.6388
 epoch: 46, train_loss: 0.5371, test_loss: 0.9420, test_f1: 0.6177
 epoch: 47, train_loss: 0.5300, test_loss: 0.8475, test_f1: 0.6153
 epoch: 48, train_loss: 0.5323, test_loss: 1.3462, test_f1: 0.5931
 epoch: 49, train_loss: 0.5084, test_loss: 0.8148, test_f1: 0.6473
 epoch: 50, train_loss: 0.4876, test_loss: 1.1467, test_f1: 0.5776
 epoch: 51, train_loss: 0.4734, test_loss: 1.1058, test_f1: 0.5965
 epoch: 52, train_loss: 0.4480, test_loss: 0.8321, test_f1: 0.6556
 epoch: 53, train_loss: 0.4041, test_loss: 0.8632, test_f1: 0.6689
 epoch: 54, train_loss: 0.3848, test_loss: 0.9621, test_f1: 0.6408
 epoch: 55, train_loss: 0.4056, test_loss: 0.9562, test_f1: 0.6523
 epoch: 56, train_loss: 0.3908, test_loss: 0.9276, test_f1: 0.6301
 epoch: 57, train_loss: 0.3989, test_loss: 1.0014, test_f1: 0.6242
 epoch: 58, train_loss: 0.3835, test_loss: 0.9819, test_f1: 0.6514
 epoch: 59, train_loss: 0.3764, test_loss: 0.8885, test_f1: 0.6616
 epoch: 60, train_loss: 0.3805, test_loss: 0.9308, test_f1: 0.6473
 epoch: 61, train_loss: 0.3772, test_loss: 1.0031, test_f1: 0.6661
 epoch: 62, train_loss: 0.3584, test_loss: 0.9123, test_f1: 0.6630
 epoch: 63, train_loss: 0.3627, test_loss: 0.9926, test_f1: 0.6789
 epoch: 64, train_loss: 0.3466, test_loss: 0.9527, test_f1: 0.6534
 epoch: 65, train_loss: 0.3642, test_loss: 0.9042, test_f1: 0.6658
 epoch: 66, train_loss: 0.3784, test_loss: 0.8904, test_f1: 0.6421
 epoch: 67, train_loss: 0.3798, test_loss: 0.9875, test_f1: 0.6493
 epoch: 68, train_loss: 0.3574, test_loss: 0.9681, test_f1: 0.6347
 epoch: 69, train_loss: 0.3605, test_loss: 1.0279, test_f1: 0.6452
 epoch: 70, train_loss: 0.3605, test_loss: 0.9625, test_f1: 0.6555
 epoch: 71, train_loss: 0.3456, test_loss: 1.0689, test_f1: 0.5978
 epoch: 72, train_loss: 0.3490, test_loss: 1.0003, test_f1: 0.6700
 epoch: 73, train_loss: 0.3365, test_loss: 1.2095, test_f1: 0.6568
 epoch: 74, train_loss: 0.3322, test_loss: 0.9996, test_f1: 0.6551
 epoch: 75, train_loss: 0.3453, test_loss: 1.1636, test_f1: 0.6463
 epoch: 76, train_loss: 0.3465, test_loss: 1.1954, test_f1: 0.6183
 epoch: 77, train_loss: 0.3587, test_loss: 1.0659, test_f1: 0.6529
 epoch: 78, train_loss: 0.3658, test_loss: 0.9247, test_f1: 0.6683
 epoch: 79, train_loss: 0.3313, test_loss: 1.0085, test_f1: 0.6398
 epoch: 80, train_loss: 0.3312, test_loss: 0.9581, test_f1: 0.6682
 epoch: 81, train_loss: 0.3279, test_loss: 1.1243, test_f1: 0.6482
 epoch: 82, train_loss: 0.3432, test_loss: 1.1129, test_f1: 0.6488
 epoch: 83, train_loss: 0.3587, test_loss: 1.0885, test_f1: 0.6528
 epoch: 84, train_loss: 0.3197, test_loss: 0.9016, test_f1: 0.6868
 epoch: 85, train_loss: 0.3235, test_loss: 1.0815, test_f1: 0.6588
 epoch: 86, train_loss: 0.3175, test_loss: 1.0166, test_f1: 0.6535
 epoch: 87, train_loss: 0.3236, test_loss: 1.0728, test_f1: 0.6658
 epoch: 88, train_loss: 0.3331, test_loss: 1.0635, test_f1: 0.6665
 epoch: 89, train_loss: 0.3064, test_loss: 0.9614, test_f1: 0.6817
 epoch: 90, train_loss: 0.2973, test_loss: 1.1812, test_f1: 0.6524
 epoch: 91, train_loss: 0.3055, test_loss: 0.9302, test_f1: 0.6768
 epoch: 92, train_loss: 0.2918, test_loss: 1.0049, test_f1: 0.6596
 epoch: 93, train_loss: 0.2770, test_loss: 1.1430, test_f1: 0.6545
 epoch: 94, train_loss: 0.2992, test_loss: 1.1413, test_f1: 0.6480
 epoch: 95, train_loss: 0.3033, test_loss: 1.0780, test_f1: 0.6708
 epoch: 96, train_loss: 0.2918, test_loss: 1.2047, test_f1: 0.6793
 epoch: 97, train_loss: 0.2923, test_loss: 1.1356, test_f1: 0.6550
 epoch: 98, train_loss: 0.3029, test_loss: 1.2904, test_f1: 0.6203
 epoch: 99, train_loss: 0.2907, test_loss: 1.0555, test_f1: 0.6635
##################ITERATION #5 ****************************************
 epoch: 0, train_loss: 1.6877, test_loss: 1.5559, test_f1: 0.2350
 epoch: 1, train_loss: 1.0372, test_loss: 1.4848, test_f1: 0.2710
 epoch: 2, train_loss: 0.9691, test_loss: 1.3187, test_f1: 0.4203
 epoch: 3, train_loss: 0.9416, test_loss: 1.1144, test_f1: 0.4169
 epoch: 4, train_loss: 0.9350, test_loss: 0.9731, test_f1: 0.5053
 epoch: 5, train_loss: 0.9062, test_loss: 0.8949, test_f1: 0.5437
 epoch: 6, train_loss: 0.8932, test_loss: 0.9605, test_f1: 0.5190
 epoch: 7, train_loss: 0.8803, test_loss: 0.9559, test_f1: 0.5266
 epoch: 8, train_loss: 0.8376, test_loss: 0.9523, test_f1: 0.5287
 epoch: 9, train_loss: 0.8274, test_loss: 0.8616, test_f1: 0.5932
 epoch: 10, train_loss: 0.7920, test_loss: 0.8670, test_f1: 0.5838
 epoch: 11, train_loss: 0.7956, test_loss: 0.8966, test_f1: 0.5889
 epoch: 12, train_loss: 0.7788, test_loss: 0.8952, test_f1: 0.5566
 epoch: 13, train_loss: 0.7314, test_loss: 0.9378, test_f1: 0.5434
 epoch: 14, train_loss: 0.7446, test_loss: 0.8127, test_f1: 0.5533
 epoch: 15, train_loss: 0.7329, test_loss: 0.8503, test_f1: 0.6264
 epoch: 16, train_loss: 0.7166, test_loss: 0.9104, test_f1: 0.5916
 epoch: 17, train_loss: 0.7106, test_loss: 0.9403, test_f1: 0.5503
 epoch: 18, train_loss: 0.7070, test_loss: 0.8903, test_f1: 0.5891
 epoch: 19, train_loss: 0.6835, test_loss: 0.7916, test_f1: 0.6489
 epoch: 20, train_loss: 0.6725, test_loss: 0.9979, test_f1: 0.5110
 epoch: 21, train_loss: 0.6622, test_loss: 0.8211, test_f1: 0.6230
 epoch: 22, train_loss: 0.6677, test_loss: 1.1512, test_f1: 0.4841
 epoch: 23, train_loss: 0.6560, test_loss: 0.8554, test_f1: 0.6410
 epoch: 24, train_loss: 0.6686, test_loss: 0.9052, test_f1: 0.6167
 epoch: 25, train_loss: 0.6702, test_loss: 0.8812, test_f1: 0.5774
 epoch: 26, train_loss: 0.6459, test_loss: 0.7773, test_f1: 0.6444
 epoch: 27, train_loss: 0.6360, test_loss: 0.8562, test_f1: 0.6328
 epoch: 28, train_loss: 0.6082, test_loss: 0.8361, test_f1: 0.6629
 epoch: 29, train_loss: 0.6114, test_loss: 1.0384, test_f1: 0.5737
 epoch: 30, train_loss: 0.5902, test_loss: 0.8953, test_f1: 0.6388
 epoch: 31, train_loss: 0.6306, test_loss: 0.8901, test_f1: 0.6066
 epoch: 32, train_loss: 0.6021, test_loss: 0.7293, test_f1: 0.6714
 epoch: 33, train_loss: 0.5946, test_loss: 0.8645, test_f1: 0.6597
 epoch: 34, train_loss: 0.5826, test_loss: 0.9731, test_f1: 0.6120
 epoch: 35, train_loss: 0.5711, test_loss: 0.8879, test_f1: 0.5917
 epoch: 36, train_loss: 0.5731, test_loss: 1.0851, test_f1: 0.5805
 epoch: 37, train_loss: 0.5761, test_loss: 1.0259, test_f1: 0.6137
 epoch: 38, train_loss: 0.5838, test_loss: 0.8171, test_f1: 0.6609
 epoch: 39, train_loss: 0.5536, test_loss: 0.8687, test_f1: 0.6415
 epoch: 40, train_loss: 0.5312, test_loss: 0.8338, test_f1: 0.6461
 epoch: 41, train_loss: 0.5149, test_loss: 1.1102, test_f1: 0.5796
 epoch: 42, train_loss: 0.5432, test_loss: 1.0013, test_f1: 0.6466
 epoch: 43, train_loss: 0.5203, test_loss: 0.9044, test_f1: 0.6579
 epoch: 44, train_loss: 0.5293, test_loss: 0.8899, test_f1: 0.6422
 epoch: 45, train_loss: 0.4930, test_loss: 0.8957, test_f1: 0.6509
 epoch: 46, train_loss: 0.5065, test_loss: 0.8273, test_f1: 0.6752
 epoch: 47, train_loss: 0.4921, test_loss: 0.9998, test_f1: 0.6212
 epoch: 48, train_loss: 0.4947, test_loss: 0.9364, test_f1: 0.6389
 epoch: 49, train_loss: 0.4920, test_loss: 0.8209, test_f1: 0.6582
 epoch: 50, train_loss: 0.5155, test_loss: 0.9296, test_f1: 0.6754
 epoch: 51, train_loss: 0.4546, test_loss: 0.9140, test_f1: 0.6809
 epoch: 52, train_loss: 0.4247, test_loss: 0.8404, test_f1: 0.6779
 epoch: 53, train_loss: 0.3984, test_loss: 0.9995, test_f1: 0.6543
 epoch: 54, train_loss: 0.4140, test_loss: 1.0864, test_f1: 0.6462
 epoch: 55, train_loss: 0.3995, test_loss: 0.9485, test_f1: 0.6659
 epoch: 56, train_loss: 0.3887, test_loss: 0.8915, test_f1: 0.6831
 epoch: 57, train_loss: 0.3770, test_loss: 0.9716, test_f1: 0.6911
 epoch: 58, train_loss: 0.3903, test_loss: 1.0756, test_f1: 0.6343
 epoch: 59, train_loss: 0.3873, test_loss: 0.9734, test_f1: 0.6643
 epoch: 60, train_loss: 0.3798, test_loss: 0.9486, test_f1: 0.6631
 epoch: 61, train_loss: 0.3745, test_loss: 1.0177, test_f1: 0.6738
 epoch: 62, train_loss: 0.3703, test_loss: 0.9647, test_f1: 0.6536
 epoch: 63, train_loss: 0.3762, test_loss: 1.0856, test_f1: 0.6444
 epoch: 64, train_loss: 0.3573, test_loss: 0.9821, test_f1: 0.6593
 epoch: 65, train_loss: 0.3617, test_loss: 0.9626, test_f1: 0.6687
 epoch: 66, train_loss: 0.3489, test_loss: 0.9298, test_f1: 0.6734
 epoch: 67, train_loss: 0.3341, test_loss: 1.2475, test_f1: 0.6371
 epoch: 68, train_loss: 0.3459, test_loss: 0.9903, test_f1: 0.6671
 epoch: 69, train_loss: 0.3654, test_loss: 1.1084, test_f1: 0.6466
 epoch: 70, train_loss: 0.3690, test_loss: 1.0872, test_f1: 0.6459
 epoch: 71, train_loss: 0.3346, test_loss: 1.2314, test_f1: 0.6174
 epoch: 72, train_loss: 0.3444, test_loss: 0.9907, test_f1: 0.6785
 epoch: 73, train_loss: 0.3492, test_loss: 0.8951, test_f1: 0.6652
 epoch: 74, train_loss: 0.3292, test_loss: 1.0134, test_f1: 0.6612
 epoch: 75, train_loss: 0.3319, test_loss: 0.9217, test_f1: 0.6824
 epoch: 76, train_loss: 0.3382, test_loss: 0.9328, test_f1: 0.6855
 epoch: 77, train_loss: 0.3330, test_loss: 1.0447, test_f1: 0.6659
 epoch: 78, train_loss: 0.3325, test_loss: 0.9673, test_f1: 0.6715
 epoch: 79, train_loss: 0.3304, test_loss: 1.1548, test_f1: 0.6549
 epoch: 80, train_loss: 0.3173, test_loss: 0.9419, test_f1: 0.6854
 epoch: 81, train_loss: 0.3315, test_loss: 0.9887, test_f1: 0.6844
 epoch: 82, train_loss: 0.3153, test_loss: 1.1333, test_f1: 0.6462
 epoch: 83, train_loss: 0.3009, test_loss: 0.9137, test_f1: 0.6626
 epoch: 84, train_loss: 0.3239, test_loss: 0.9240, test_f1: 0.6810
 epoch: 85, train_loss: 0.3069, test_loss: 1.1752, test_f1: 0.6513
 epoch: 86, train_loss: 0.3188, test_loss: 1.2765, test_f1: 0.6472
 epoch: 87, train_loss: 0.3127, test_loss: 1.0731, test_f1: 0.6603
 epoch: 88, train_loss: 0.2936, test_loss: 1.0428, test_f1: 0.6603
 epoch: 89, train_loss: 0.3074, test_loss: 1.0588, test_f1: 0.6638
 epoch: 90, train_loss: 0.3107, test_loss: 1.1685, test_f1: 0.6573
 epoch: 91, train_loss: 0.2849, test_loss: 1.2490, test_f1: 0.6293
 epoch: 92, train_loss: 0.2740, test_loss: 1.0861, test_f1: 0.6517
 epoch: 93, train_loss: 0.2831, test_loss: 0.9955, test_f1: 0.6662
 epoch: 94, train_loss: 0.2673, test_loss: 1.1247, test_f1: 0.6416
 epoch: 95, train_loss: 0.2663, test_loss: 1.2268, test_f1: 0.6429
 epoch: 96, train_loss: 0.3022, test_loss: 1.0219, test_f1: 0.6729
 epoch: 97, train_loss: 0.3133, test_loss: 1.2184, test_f1: 0.6576
 epoch: 98, train_loss: 0.3215, test_loss: 1.2475, test_f1: 0.6267
 epoch: 99, train_loss: 0.3036, test_loss: 0.9642, test_f1: 0.6864
##################ITERATION #6 ****************************************
 epoch: 0, train_loss: 1.4715, test_loss: 1.3846, test_f1: 0.2609
 epoch: 1, train_loss: 1.0569, test_loss: 1.0696, test_f1: 0.4769
 epoch: 2, train_loss: 0.9906, test_loss: 1.0317, test_f1: 0.4810
 epoch: 3, train_loss: 0.9475, test_loss: 1.0433, test_f1: 0.4482
 epoch: 4, train_loss: 0.9111, test_loss: 1.0266, test_f1: 0.4755
 epoch: 5, train_loss: 0.8966, test_loss: 0.9354, test_f1: 0.5146
 epoch: 6, train_loss: 0.8613, test_loss: 1.0359, test_f1: 0.4627
 epoch: 7, train_loss: 0.8625, test_loss: 0.9317, test_f1: 0.5162
 epoch: 8, train_loss: 0.8341, test_loss: 0.9095, test_f1: 0.5331
 epoch: 9, train_loss: 0.8332, test_loss: 1.1657, test_f1: 0.5245
 epoch: 10, train_loss: 0.8220, test_loss: 1.1951, test_f1: 0.4589
 epoch: 11, train_loss: 0.8253, test_loss: 0.9707, test_f1: 0.5483
 epoch: 12, train_loss: 0.8065, test_loss: 1.4419, test_f1: 0.4522
 epoch: 13, train_loss: 0.7892, test_loss: 0.9079, test_f1: 0.5888
 epoch: 14, train_loss: 0.7612, test_loss: 0.9699, test_f1: 0.5863
 epoch: 15, train_loss: 0.7643, test_loss: 0.8407, test_f1: 0.5897
 epoch: 16, train_loss: 0.7662, test_loss: 1.1651, test_f1: 0.5054
 epoch: 17, train_loss: 0.7546, test_loss: 0.8910, test_f1: 0.5602
 epoch: 18, train_loss: 0.7227, test_loss: 0.9309, test_f1: 0.5687
 epoch: 19, train_loss: 0.7253, test_loss: 1.3717, test_f1: 0.4382
 epoch: 20, train_loss: 0.7221, test_loss: 0.8770, test_f1: 0.5826
 epoch: 21, train_loss: 0.6852, test_loss: 0.9241, test_f1: 0.6213
 epoch: 22, train_loss: 0.6749, test_loss: 0.7467, test_f1: 0.6352
 epoch: 23, train_loss: 0.6717, test_loss: 1.0246, test_f1: 0.6048
 epoch: 24, train_loss: 0.6530, test_loss: 0.9110, test_f1: 0.5994
 epoch: 25, train_loss: 0.6932, test_loss: 0.9739, test_f1: 0.5871
 epoch: 26, train_loss: 0.6799, test_loss: 0.9976, test_f1: 0.5918
 epoch: 27, train_loss: 0.6559, test_loss: 0.9076, test_f1: 0.6387
 epoch: 28, train_loss: 0.6399, test_loss: 0.9863, test_f1: 0.6229
 epoch: 29, train_loss: 0.6139, test_loss: 1.0493, test_f1: 0.5955
 epoch: 30, train_loss: 0.6105, test_loss: 0.9768, test_f1: 0.6213
 epoch: 31, train_loss: 0.6090, test_loss: 1.0486, test_f1: 0.5961
 epoch: 32, train_loss: 0.6063, test_loss: 0.8941, test_f1: 0.6573
 epoch: 33, train_loss: 0.6021, test_loss: 1.0335, test_f1: 0.6557
 epoch: 34, train_loss: 0.6038, test_loss: 0.9276, test_f1: 0.6186
 epoch: 35, train_loss: 0.5800, test_loss: 0.9446, test_f1: 0.6733
 epoch: 36, train_loss: 0.5628, test_loss: 0.9906, test_f1: 0.6341
 epoch: 37, train_loss: 0.5630, test_loss: 1.0087, test_f1: 0.6493
 epoch: 38, train_loss: 0.5710, test_loss: 1.4157, test_f1: 0.5181
 epoch: 39, train_loss: 0.5710, test_loss: 1.0510, test_f1: 0.6296
 epoch: 40, train_loss: 0.5534, test_loss: 0.9066, test_f1: 0.6547
 epoch: 41, train_loss: 0.5722, test_loss: 1.3157, test_f1: 0.5838
 epoch: 42, train_loss: 0.5621, test_loss: 1.0691, test_f1: 0.5858
 epoch: 43, train_loss: 0.5735, test_loss: 1.1683, test_f1: 0.6139
 epoch: 44, train_loss: 0.5288, test_loss: 0.9747, test_f1: 0.6373
 epoch: 45, train_loss: 0.5365, test_loss: 1.1467, test_f1: 0.5747
 epoch: 46, train_loss: 0.5095, test_loss: 1.2163, test_f1: 0.6103
 epoch: 47, train_loss: 0.5285, test_loss: 0.8862, test_f1: 0.6604
 epoch: 48, train_loss: 0.5287, test_loss: 0.9181, test_f1: 0.6450
 epoch: 49, train_loss: 0.5109, test_loss: 1.2110, test_f1: 0.6260
 epoch: 50, train_loss: 0.5222, test_loss: 1.1393, test_f1: 0.6105
 epoch: 51, train_loss: 0.5054, test_loss: 1.1791, test_f1: 0.6148
 epoch: 52, train_loss: 0.4575, test_loss: 1.0565, test_f1: 0.6593
 epoch: 53, train_loss: 0.4443, test_loss: 1.0581, test_f1: 0.6636
 epoch: 54, train_loss: 0.4162, test_loss: 1.0075, test_f1: 0.6793
 epoch: 55, train_loss: 0.4227, test_loss: 1.1327, test_f1: 0.6571
 epoch: 56, train_loss: 0.3983, test_loss: 1.0733, test_f1: 0.6671
 epoch: 57, train_loss: 0.4045, test_loss: 1.0841, test_f1: 0.6861
 epoch: 58, train_loss: 0.4359, test_loss: 1.1663, test_f1: 0.6268
 epoch: 59, train_loss: 0.4366, test_loss: 1.1197, test_f1: 0.6467
 epoch: 60, train_loss: 0.4203, test_loss: 1.0982, test_f1: 0.6824
 epoch: 61, train_loss: 0.3990, test_loss: 1.0031, test_f1: 0.6574
 epoch: 62, train_loss: 0.4099, test_loss: 1.1624, test_f1: 0.6656
 epoch: 63, train_loss: 0.4043, test_loss: 1.0932, test_f1: 0.6712
 epoch: 64, train_loss: 0.3877, test_loss: 1.0679, test_f1: 0.6696
 epoch: 65, train_loss: 0.3814, test_loss: 1.3869, test_f1: 0.6275
 epoch: 66, train_loss: 0.3980, test_loss: 1.0320, test_f1: 0.6899
 epoch: 67, train_loss: 0.3799, test_loss: 1.3898, test_f1: 0.6698
 epoch: 68, train_loss: 0.3666, test_loss: 1.2523, test_f1: 0.6600
 epoch: 69, train_loss: 0.3818, test_loss: 1.4845, test_f1: 0.6317
 epoch: 70, train_loss: 0.3627, test_loss: 1.2271, test_f1: 0.6816
 epoch: 71, train_loss: 0.3521, test_loss: 1.1711, test_f1: 0.6708
 epoch: 72, train_loss: 0.3544, test_loss: 1.4000, test_f1: 0.6546
 epoch: 73, train_loss: 0.3428, test_loss: 1.3671, test_f1: 0.6449
 epoch: 74, train_loss: 0.3648, test_loss: 1.4022, test_f1: 0.6486
 epoch: 75, train_loss: 0.3607, test_loss: 1.2880, test_f1: 0.6780
 epoch: 76, train_loss: 0.3534, test_loss: 1.2040, test_f1: 0.6764
 epoch: 77, train_loss: 0.3670, test_loss: 1.3619, test_f1: 0.6582
 epoch: 78, train_loss: 0.3707, test_loss: 1.2230, test_f1: 0.6487
 epoch: 79, train_loss: 0.3609, test_loss: 1.9622, test_f1: 0.5934
 epoch: 80, train_loss: 0.3538, test_loss: 1.3356, test_f1: 0.6742
 epoch: 81, train_loss: 0.3510, test_loss: 1.0991, test_f1: 0.7016
 epoch: 82, train_loss: 0.3396, test_loss: 1.4601, test_f1: 0.6413
 epoch: 83, train_loss: 0.3417, test_loss: 1.2619, test_f1: 0.6484
 epoch: 84, train_loss: 0.3579, test_loss: 1.2968, test_f1: 0.6910
 epoch: 85, train_loss: 0.3244, test_loss: 1.6606, test_f1: 0.6372
 epoch: 86, train_loss: 0.3534, test_loss: 1.2221, test_f1: 0.6706
 epoch: 87, train_loss: 0.3328, test_loss: 1.4007, test_f1: 0.6762
 epoch: 88, train_loss: 0.3347, test_loss: 1.2653, test_f1: 0.6549
 epoch: 89, train_loss: 0.3271, test_loss: 1.2953, test_f1: 0.6875
 epoch: 90, train_loss: 0.3109, test_loss: 1.7375, test_f1: 0.6484
 epoch: 91, train_loss: 0.3388, test_loss: 1.4506, test_f1: 0.6370
 epoch: 92, train_loss: 0.3248, test_loss: 1.5826, test_f1: 0.6288
 epoch: 93, train_loss: 0.3275, test_loss: 1.2857, test_f1: 0.6762
 epoch: 94, train_loss: 0.3222, test_loss: 1.6916, test_f1: 0.6330
 epoch: 95, train_loss: 0.3127, test_loss: 1.5072, test_f1: 0.6270
 epoch: 96, train_loss: 0.3172, test_loss: 1.3974, test_f1: 0.6465
 epoch: 97, train_loss: 0.2900, test_loss: 1.6355, test_f1: 0.6168
 epoch: 98, train_loss: 0.2869, test_loss: 1.5401, test_f1: 0.6724
 epoch: 99, train_loss: 0.2884, test_loss: 1.4039, test_f1: 0.6521
##################ITERATION #7 ****************************************
 epoch: 0, train_loss: 1.7733, test_loss: 1.5332, test_f1: 0.2262
 epoch: 1, train_loss: 1.0283, test_loss: 1.4075, test_f1: 0.2286
 epoch: 2, train_loss: 0.9506, test_loss: 1.2127, test_f1: 0.3360
 epoch: 3, train_loss: 0.8960, test_loss: 1.0299, test_f1: 0.4211
 epoch: 4, train_loss: 0.8759, test_loss: 0.9771, test_f1: 0.4617
 epoch: 5, train_loss: 0.8683, test_loss: 1.0493, test_f1: 0.4419
 epoch: 6, train_loss: 0.8440, test_loss: 0.9079, test_f1: 0.5434
 epoch: 7, train_loss: 0.8179, test_loss: 0.9432, test_f1: 0.5094
 epoch: 8, train_loss: 0.8004, test_loss: 0.8642, test_f1: 0.5472
 epoch: 9, train_loss: 0.7870, test_loss: 0.8532, test_f1: 0.5245
 epoch: 10, train_loss: 0.7632, test_loss: 0.8623, test_f1: 0.5191
 epoch: 11, train_loss: 0.7372, test_loss: 0.9307, test_f1: 0.5353
 epoch: 12, train_loss: 0.7333, test_loss: 0.9708, test_f1: 0.4926
 epoch: 13, train_loss: 0.7431, test_loss: 0.9357, test_f1: 0.5306
 epoch: 14, train_loss: 0.7088, test_loss: 1.1633, test_f1: 0.4861
 epoch: 15, train_loss: 0.7062, test_loss: 0.8427, test_f1: 0.5761
 epoch: 16, train_loss: 0.7008, test_loss: 0.9919, test_f1: 0.5355
 epoch: 17, train_loss: 0.7114, test_loss: 1.2957, test_f1: 0.5036
 epoch: 18, train_loss: 0.6789, test_loss: 0.8460, test_f1: 0.5898
 epoch: 19, train_loss: 0.6656, test_loss: 1.0021, test_f1: 0.5238
 epoch: 20, train_loss: 0.6679, test_loss: 0.8613, test_f1: 0.5852
 epoch: 21, train_loss: 0.6733, test_loss: 0.9183, test_f1: 0.5753
 epoch: 22, train_loss: 0.6639, test_loss: 0.9701, test_f1: 0.5601
 epoch: 23, train_loss: 0.6490, test_loss: 0.9268, test_f1: 0.5893
 epoch: 24, train_loss: 0.6422, test_loss: 0.7843, test_f1: 0.6158
 epoch: 25, train_loss: 0.6635, test_loss: 0.8465, test_f1: 0.5988
 epoch: 26, train_loss: 0.6432, test_loss: 0.8247, test_f1: 0.6163
 epoch: 27, train_loss: 0.6247, test_loss: 0.8578, test_f1: 0.5782
 epoch: 28, train_loss: 0.6058, test_loss: 0.8354, test_f1: 0.6166
 epoch: 29, train_loss: 0.6133, test_loss: 0.9999, test_f1: 0.5733
 epoch: 30, train_loss: 0.5953, test_loss: 0.8357, test_f1: 0.6137
 epoch: 31, train_loss: 0.5857, test_loss: 1.2090, test_f1: 0.5149
 epoch: 32, train_loss: 0.5801, test_loss: 0.9352, test_f1: 0.5955
 epoch: 33, train_loss: 0.5677, test_loss: 0.8062, test_f1: 0.6119
 epoch: 34, train_loss: 0.5682, test_loss: 1.0186, test_f1: 0.5835
 epoch: 35, train_loss: 0.5452, test_loss: 0.9262, test_f1: 0.5870
 epoch: 36, train_loss: 0.5620, test_loss: 0.8747, test_f1: 0.5951
 epoch: 37, train_loss: 0.5798, test_loss: 0.9795, test_f1: 0.5973
 epoch: 38, train_loss: 0.5923, test_loss: 0.9825, test_f1: 0.5744
 epoch: 39, train_loss: 0.5775, test_loss: 1.0309, test_f1: 0.5656
 epoch: 40, train_loss: 0.5541, test_loss: 0.8500, test_f1: 0.6302
 epoch: 41, train_loss: 0.5410, test_loss: 0.9721, test_f1: 0.5978
 epoch: 42, train_loss: 0.5309, test_loss: 0.8551, test_f1: 0.6298
 epoch: 43, train_loss: 0.5266, test_loss: 0.9264, test_f1: 0.6280
 epoch: 44, train_loss: 0.5236, test_loss: 0.8900, test_f1: 0.6175
 epoch: 45, train_loss: 0.5141, test_loss: 0.8529, test_f1: 0.6233
 epoch: 46, train_loss: 0.5132, test_loss: 1.0401, test_f1: 0.5761
 epoch: 47, train_loss: 0.5236, test_loss: 0.9492, test_f1: 0.6198
 epoch: 48, train_loss: 0.5271, test_loss: 0.8483, test_f1: 0.6216
 epoch: 49, train_loss: 0.5094, test_loss: 0.9646, test_f1: 0.5916
 epoch: 50, train_loss: 0.4981, test_loss: 0.8940, test_f1: 0.6187
 epoch: 51, train_loss: 0.4652, test_loss: 0.8209, test_f1: 0.6469
 epoch: 52, train_loss: 0.4197, test_loss: 0.8721, test_f1: 0.6385
 epoch: 53, train_loss: 0.3879, test_loss: 0.9821, test_f1: 0.6199
 epoch: 54, train_loss: 0.3862, test_loss: 0.9443, test_f1: 0.6394
 epoch: 55, train_loss: 0.3812, test_loss: 0.8693, test_f1: 0.6514
 epoch: 56, train_loss: 0.3785, test_loss: 0.9286, test_f1: 0.6530
 epoch: 57, train_loss: 0.3716, test_loss: 0.9639, test_f1: 0.6437
 epoch: 58, train_loss: 0.3899, test_loss: 0.9514, test_f1: 0.6257
 epoch: 59, train_loss: 0.3651, test_loss: 0.8495, test_f1: 0.6586
 epoch: 60, train_loss: 0.3699, test_loss: 1.1272, test_f1: 0.6005
 epoch: 61, train_loss: 0.3781, test_loss: 1.0124, test_f1: 0.6281
 epoch: 62, train_loss: 0.3730, test_loss: 1.0109, test_f1: 0.6417
 epoch: 63, train_loss: 0.3505, test_loss: 1.0790, test_f1: 0.6266
 epoch: 64, train_loss: 0.3484, test_loss: 1.0065, test_f1: 0.6261
 epoch: 65, train_loss: 0.3607, test_loss: 1.0533, test_f1: 0.6545
 epoch: 66, train_loss: 0.3434, test_loss: 1.1233, test_f1: 0.6514
 epoch: 67, train_loss: 0.3403, test_loss: 1.0719, test_f1: 0.6663
 epoch: 68, train_loss: 0.3422, test_loss: 1.0173, test_f1: 0.6651
 epoch: 69, train_loss: 0.3501, test_loss: 1.1343, test_f1: 0.6343
 epoch: 70, train_loss: 0.3485, test_loss: 1.1503, test_f1: 0.6017
 epoch: 71, train_loss: 0.3603, test_loss: 1.0733, test_f1: 0.6639
 epoch: 72, train_loss: 0.3415, test_loss: 1.0655, test_f1: 0.6545
 epoch: 73, train_loss: 0.3283, test_loss: 1.0103, test_f1: 0.6423
 epoch: 74, train_loss: 0.3607, test_loss: 1.1972, test_f1: 0.6258
 epoch: 75, train_loss: 0.3445, test_loss: 1.0913, test_f1: 0.6333
 epoch: 76, train_loss: 0.3266, test_loss: 1.1707, test_f1: 0.6414
 epoch: 77, train_loss: 0.3164, test_loss: 1.1456, test_f1: 0.6487
 epoch: 78, train_loss: 0.3177, test_loss: 1.0750, test_f1: 0.6285
 epoch: 79, train_loss: 0.3375, test_loss: 1.1134, test_f1: 0.6513
 epoch: 80, train_loss: 0.3411, test_loss: 1.0955, test_f1: 0.6301
 epoch: 81, train_loss: 0.3047, test_loss: 1.0143, test_f1: 0.6660
 epoch: 82, train_loss: 0.3011, test_loss: 1.2683, test_f1: 0.6154
 epoch: 83, train_loss: 0.2971, test_loss: 1.0118, test_f1: 0.6478
 epoch: 84, train_loss: 0.3088, test_loss: 1.0920, test_f1: 0.6336
 epoch: 85, train_loss: 0.2946, test_loss: 1.2097, test_f1: 0.6414
 epoch: 86, train_loss: 0.2999, test_loss: 1.3889, test_f1: 0.6199
 epoch: 87, train_loss: 0.3039, test_loss: 1.2370, test_f1: 0.6091
 epoch: 88, train_loss: 0.3049, test_loss: 1.1134, test_f1: 0.6496
 epoch: 89, train_loss: 0.2900, test_loss: 1.5483, test_f1: 0.6074
 epoch: 90, train_loss: 0.2847, test_loss: 1.1752, test_f1: 0.6336
 epoch: 91, train_loss: 0.2754, test_loss: 1.2461, test_f1: 0.6597
 epoch: 92, train_loss: 0.3041, test_loss: 1.2946, test_f1: 0.6073
 epoch: 93, train_loss: 0.2949, test_loss: 1.0811, test_f1: 0.6570
 epoch: 94, train_loss: 0.3196, test_loss: 1.1522, test_f1: 0.6500
 epoch: 95, train_loss: 0.2984, test_loss: 1.2760, test_f1: 0.6306
 epoch: 96, train_loss: 0.2897, test_loss: 1.0793, test_f1: 0.6315
 epoch: 97, train_loss: 0.2838, test_loss: 1.2169, test_f1: 0.6346
 epoch: 98, train_loss: 0.2724, test_loss: 1.2509, test_f1: 0.6421
 epoch: 99, train_loss: 0.2633, test_loss: 1.3567, test_f1: 0.6197
##################ITERATION #8 ****************************************
 epoch: 0, train_loss: 1.6555, test_loss: 1.4963, test_f1: 0.2260
 epoch: 1, train_loss: 1.0522, test_loss: 1.2099, test_f1: 0.3863
 epoch: 2, train_loss: 1.0091, test_loss: 1.0956, test_f1: 0.4265
 epoch: 3, train_loss: 0.9583, test_loss: 1.0188, test_f1: 0.4800
 epoch: 4, train_loss: 0.9428, test_loss: 0.9966, test_f1: 0.5320
 epoch: 5, train_loss: 0.9375, test_loss: 0.9913, test_f1: 0.5347
 epoch: 6, train_loss: 0.8876, test_loss: 0.9786, test_f1: 0.5093
 epoch: 7, train_loss: 0.8625, test_loss: 0.9784, test_f1: 0.5304
 epoch: 8, train_loss: 0.8401, test_loss: 0.9596, test_f1: 0.5762
 epoch: 9, train_loss: 0.8233, test_loss: 0.8882, test_f1: 0.5494
 epoch: 10, train_loss: 0.8323, test_loss: 0.9546, test_f1: 0.5112
 epoch: 11, train_loss: 0.8397, test_loss: 0.9702, test_f1: 0.5054
 epoch: 12, train_loss: 0.8201, test_loss: 0.9423, test_f1: 0.5389
 epoch: 13, train_loss: 0.7999, test_loss: 0.8993, test_f1: 0.5478
 epoch: 14, train_loss: 0.8093, test_loss: 0.9507, test_f1: 0.5238
 epoch: 15, train_loss: 0.7805, test_loss: 0.9410, test_f1: 0.5795
 epoch: 16, train_loss: 0.7694, test_loss: 1.0164, test_f1: 0.5351
 epoch: 17, train_loss: 0.7479, test_loss: 0.9352, test_f1: 0.5701
 epoch: 18, train_loss: 0.7269, test_loss: 1.0069, test_f1: 0.5185
 epoch: 19, train_loss: 0.7252, test_loss: 0.9416, test_f1: 0.5434
 epoch: 20, train_loss: 0.7203, test_loss: 0.9203, test_f1: 0.5643
 epoch: 21, train_loss: 0.7073, test_loss: 0.9733, test_f1: 0.5689
 epoch: 22, train_loss: 0.7020, test_loss: 1.0921, test_f1: 0.5005
 epoch: 23, train_loss: 0.7258, test_loss: 1.0293, test_f1: 0.5502
 epoch: 24, train_loss: 0.6811, test_loss: 0.9534, test_f1: 0.5577
 epoch: 25, train_loss: 0.6670, test_loss: 0.9552, test_f1: 0.6026
 epoch: 26, train_loss: 0.6768, test_loss: 1.0770, test_f1: 0.5162
 epoch: 27, train_loss: 0.6612, test_loss: 0.9192, test_f1: 0.5731
 epoch: 28, train_loss: 0.6501, test_loss: 0.9469, test_f1: 0.5980
 epoch: 29, train_loss: 0.6884, test_loss: 0.9261, test_f1: 0.6023
 epoch: 30, train_loss: 0.6638, test_loss: 1.1421, test_f1: 0.5004
 epoch: 31, train_loss: 0.6568, test_loss: 0.8659, test_f1: 0.6226
 epoch: 32, train_loss: 0.6407, test_loss: 0.9863, test_f1: 0.5741
 epoch: 33, train_loss: 0.6515, test_loss: 1.0479, test_f1: 0.5286
 epoch: 34, train_loss: 0.6255, test_loss: 0.8937, test_f1: 0.5929
 epoch: 35, train_loss: 0.6010, test_loss: 1.0122, test_f1: 0.5615
 epoch: 36, train_loss: 0.5950, test_loss: 0.9124, test_f1: 0.5535
 epoch: 37, train_loss: 0.5891, test_loss: 0.9582, test_f1: 0.5901
 epoch: 38, train_loss: 0.6002, test_loss: 1.4146, test_f1: 0.5250
 epoch: 39, train_loss: 0.6057, test_loss: 0.9255, test_f1: 0.6138
 epoch: 40, train_loss: 0.5874, test_loss: 1.3348, test_f1: 0.5116
 epoch: 41, train_loss: 0.5786, test_loss: 0.9091, test_f1: 0.6145
 epoch: 42, train_loss: 0.5859, test_loss: 0.9258, test_f1: 0.5947
 epoch: 43, train_loss: 0.5649, test_loss: 0.9658, test_f1: 0.5809
 epoch: 44, train_loss: 0.5757, test_loss: 0.9561, test_f1: 0.5763
 epoch: 45, train_loss: 0.5888, test_loss: 0.9415, test_f1: 0.5558
 epoch: 46, train_loss: 0.5659, test_loss: 0.8930, test_f1: 0.6165
 epoch: 47, train_loss: 0.5746, test_loss: 0.8807, test_f1: 0.6198
 epoch: 48, train_loss: 0.5692, test_loss: 1.0541, test_f1: 0.5755
 epoch: 49, train_loss: 0.5283, test_loss: 0.9030, test_f1: 0.6013
 epoch: 50, train_loss: 0.5296, test_loss: 0.9128, test_f1: 0.6172
 epoch: 51, train_loss: 0.5095, test_loss: 0.9742, test_f1: 0.6008
 epoch: 52, train_loss: 0.4755, test_loss: 0.8296, test_f1: 0.6360
 epoch: 53, train_loss: 0.4708, test_loss: 0.8667, test_f1: 0.6492
 epoch: 54, train_loss: 0.4560, test_loss: 0.9554, test_f1: 0.5995
 epoch: 55, train_loss: 0.4350, test_loss: 0.8848, test_f1: 0.6193
 epoch: 56, train_loss: 0.4559, test_loss: 0.8332, test_f1: 0.6419
 epoch: 57, train_loss: 0.4436, test_loss: 0.9067, test_f1: 0.6110
 epoch: 58, train_loss: 0.4426, test_loss: 0.9967, test_f1: 0.5733
 epoch: 59, train_loss: 0.4523, test_loss: 0.8641, test_f1: 0.6376
 epoch: 60, train_loss: 0.4370, test_loss: 0.9351, test_f1: 0.6207
 epoch: 61, train_loss: 0.4463, test_loss: 0.9609, test_f1: 0.5952
 epoch: 62, train_loss: 0.4266, test_loss: 0.9289, test_f1: 0.6396
 epoch: 63, train_loss: 0.4175, test_loss: 0.9399, test_f1: 0.6093
 epoch: 64, train_loss: 0.4200, test_loss: 0.9891, test_f1: 0.6322
 epoch: 65, train_loss: 0.4440, test_loss: 0.9545, test_f1: 0.6160
 epoch: 66, train_loss: 0.4265, test_loss: 1.0476, test_f1: 0.6179
 epoch: 67, train_loss: 0.4121, test_loss: 0.9935, test_f1: 0.6521
 epoch: 68, train_loss: 0.4115, test_loss: 0.9735, test_f1: 0.6087
 epoch: 69, train_loss: 0.4438, test_loss: 0.9274, test_f1: 0.6454
 epoch: 70, train_loss: 0.4145, test_loss: 0.9178, test_f1: 0.6189
 epoch: 71, train_loss: 0.4204, test_loss: 1.0148, test_f1: 0.6188
 epoch: 72, train_loss: 0.4029, test_loss: 0.9284, test_f1: 0.6106
 epoch: 73, train_loss: 0.3941, test_loss: 1.0150, test_f1: 0.6338
 epoch: 74, train_loss: 0.3935, test_loss: 1.1207, test_f1: 0.5877
 epoch: 75, train_loss: 0.3937, test_loss: 1.0118, test_f1: 0.6386
 epoch: 76, train_loss: 0.3910, test_loss: 0.9217, test_f1: 0.6573
 epoch: 77, train_loss: 0.3644, test_loss: 1.0837, test_f1: 0.6119
 epoch: 78, train_loss: 0.3758, test_loss: 1.0737, test_f1: 0.6165
 epoch: 79, train_loss: 0.3669, test_loss: 1.0191, test_f1: 0.6241
 epoch: 80, train_loss: 0.3726, test_loss: 1.1541, test_f1: 0.5866
 epoch: 81, train_loss: 0.3750, test_loss: 1.0932, test_f1: 0.6238
 epoch: 82, train_loss: 0.3719, test_loss: 1.2441, test_f1: 0.5648
 epoch: 83, train_loss: 0.3812, test_loss: 1.1673, test_f1: 0.6280
 epoch: 84, train_loss: 0.3755, test_loss: 1.2316, test_f1: 0.5991
 epoch: 85, train_loss: 0.3676, test_loss: 1.0169, test_f1: 0.6424
 epoch: 86, train_loss: 0.3565, test_loss: 1.0759, test_f1: 0.6294
 epoch: 87, train_loss: 0.3517, test_loss: 1.1161, test_f1: 0.6069
 epoch: 88, train_loss: 0.3771, test_loss: 0.9744, test_f1: 0.6375
 epoch: 89, train_loss: 0.3808, test_loss: 1.0611, test_f1: 0.6262
 epoch: 90, train_loss: 0.3442, test_loss: 1.1285, test_f1: 0.6056
 epoch: 91, train_loss: 0.3544, test_loss: 1.0589, test_f1: 0.6274
 epoch: 92, train_loss: 0.3340, test_loss: 1.2275, test_f1: 0.5910
 epoch: 93, train_loss: 0.3260, test_loss: 1.0835, test_f1: 0.6194
 epoch: 94, train_loss: 0.3527, test_loss: 1.0978, test_f1: 0.6369
 epoch: 95, train_loss: 0.3530, test_loss: 1.0832, test_f1: 0.6273
 epoch: 96, train_loss: 0.3534, test_loss: 1.1584, test_f1: 0.6142
 epoch: 97, train_loss: 0.3237, test_loss: 1.2962, test_f1: 0.6019
 epoch: 98, train_loss: 0.3337, test_loss: 1.1233, test_f1: 0.6363
 epoch: 99, train_loss: 0.3590, test_loss: 1.4015, test_f1: 0.5751
##################ITERATION #9 ****************************************
 epoch: 0, train_loss: 1.7519, test_loss: 1.3195, test_f1: 0.2871
 epoch: 1, train_loss: 1.0821, test_loss: 1.1371, test_f1: 0.4336
 epoch: 2, train_loss: 1.0078, test_loss: 1.0938, test_f1: 0.4838
 epoch: 3, train_loss: 0.9604, test_loss: 1.0438, test_f1: 0.4979
 epoch: 4, train_loss: 0.9320, test_loss: 1.0553, test_f1: 0.4852
 epoch: 5, train_loss: 0.9151, test_loss: 0.9980, test_f1: 0.5103
 epoch: 6, train_loss: 0.8751, test_loss: 1.2273, test_f1: 0.4252
 epoch: 7, train_loss: 0.8646, test_loss: 0.9684, test_f1: 0.5212
 epoch: 8, train_loss: 0.8506, test_loss: 0.9676, test_f1: 0.5465
 epoch: 9, train_loss: 0.8339, test_loss: 0.9228, test_f1: 0.5446
 epoch: 10, train_loss: 0.8321, test_loss: 0.9574, test_f1: 0.5623
 epoch: 11, train_loss: 0.8227, test_loss: 0.9594, test_f1: 0.5174
 epoch: 12, train_loss: 0.8022, test_loss: 1.0355, test_f1: 0.5002
 epoch: 13, train_loss: 0.7977, test_loss: 0.8551, test_f1: 0.6119
 epoch: 14, train_loss: 0.7659, test_loss: 0.8711, test_f1: 0.5877
 epoch: 15, train_loss: 0.7610, test_loss: 0.9848, test_f1: 0.5134
 epoch: 16, train_loss: 0.7633, test_loss: 0.8582, test_f1: 0.5698
 epoch: 17, train_loss: 0.7270, test_loss: 0.9055, test_f1: 0.5765
 epoch: 18, train_loss: 0.7334, test_loss: 0.9045, test_f1: 0.5805
 epoch: 19, train_loss: 0.7136, test_loss: 0.8996, test_f1: 0.5630
 epoch: 20, train_loss: 0.7044, test_loss: 0.8952, test_f1: 0.5894
 epoch: 21, train_loss: 0.6966, test_loss: 0.9053, test_f1: 0.5243
 epoch: 22, train_loss: 0.6918, test_loss: 0.8032, test_f1: 0.5879
 epoch: 23, train_loss: 0.6947, test_loss: 1.1546, test_f1: 0.5388
 epoch: 24, train_loss: 0.6778, test_loss: 0.8333, test_f1: 0.6143
 epoch: 25, train_loss: 0.6700, test_loss: 0.8945, test_f1: 0.5893
 epoch: 26, train_loss: 0.6671, test_loss: 1.0667, test_f1: 0.5363
 epoch: 27, train_loss: 0.6473, test_loss: 0.8270, test_f1: 0.6305
 epoch: 28, train_loss: 0.6543, test_loss: 0.8981, test_f1: 0.6001
 epoch: 29, train_loss: 0.6609, test_loss: 0.9472, test_f1: 0.5557
 epoch: 30, train_loss: 0.6463, test_loss: 0.9624, test_f1: 0.5821
 epoch: 31, train_loss: 0.6596, test_loss: 0.8511, test_f1: 0.6081
 epoch: 32, train_loss: 0.6569, test_loss: 0.9447, test_f1: 0.5635
 epoch: 33, train_loss: 0.6350, test_loss: 0.8256, test_f1: 0.6081
 epoch: 34, train_loss: 0.6024, test_loss: 0.8660, test_f1: 0.6038
 epoch: 35, train_loss: 0.6083, test_loss: 0.9128, test_f1: 0.6078
 epoch: 36, train_loss: 0.5913, test_loss: 0.8477, test_f1: 0.6091
 epoch: 37, train_loss: 0.5963, test_loss: 0.7937, test_f1: 0.6321
 epoch: 38, train_loss: 0.5843, test_loss: 0.8594, test_f1: 0.6400
 epoch: 39, train_loss: 0.5754, test_loss: 0.8767, test_f1: 0.6136
 epoch: 40, train_loss: 0.5701, test_loss: 0.9043, test_f1: 0.6332
 epoch: 41, train_loss: 0.5551, test_loss: 0.9821, test_f1: 0.5829
 epoch: 42, train_loss: 0.5662, test_loss: 0.9001, test_f1: 0.5820
 epoch: 43, train_loss: 0.5794, test_loss: 0.8830, test_f1: 0.6025
 epoch: 44, train_loss: 0.5658, test_loss: 0.9661, test_f1: 0.5700
 epoch: 45, train_loss: 0.5725, test_loss: 0.9599, test_f1: 0.5894
 epoch: 46, train_loss: 0.5902, test_loss: 1.1111, test_f1: 0.5744
 epoch: 47, train_loss: 0.5725, test_loss: 0.8399, test_f1: 0.6339
 epoch: 48, train_loss: 0.5810, test_loss: 0.9377, test_f1: 0.6225
 epoch: 49, train_loss: 0.5464, test_loss: 0.8622, test_f1: 0.5983
 epoch: 50, train_loss: 0.5554, test_loss: 0.8926, test_f1: 0.6418
 epoch: 51, train_loss: 0.5291, test_loss: 0.8165, test_f1: 0.6731
 epoch: 52, train_loss: 0.4775, test_loss: 0.8908, test_f1: 0.6439
 epoch: 53, train_loss: 0.4713, test_loss: 0.8290, test_f1: 0.6681
 epoch: 54, train_loss: 0.4701, test_loss: 1.1489, test_f1: 0.6064
 epoch: 55, train_loss: 0.4464, test_loss: 0.8490, test_f1: 0.6765
 epoch: 56, train_loss: 0.4528, test_loss: 0.8928, test_f1: 0.6656
 epoch: 57, train_loss: 0.4662, test_loss: 0.8978, test_f1: 0.6581
 epoch: 58, train_loss: 0.4533, test_loss: 0.8637, test_f1: 0.6726
 epoch: 59, train_loss: 0.4348, test_loss: 0.9223, test_f1: 0.6403
 epoch: 60, train_loss: 0.4393, test_loss: 0.8265, test_f1: 0.6829
 epoch: 61, train_loss: 0.4287, test_loss: 0.8970, test_f1: 0.6579
 epoch: 62, train_loss: 0.4168, test_loss: 0.9065, test_f1: 0.6914
 epoch: 63, train_loss: 0.4187, test_loss: 0.8621, test_f1: 0.6805
 epoch: 64, train_loss: 0.4344, test_loss: 0.9096, test_f1: 0.6381
 epoch: 65, train_loss: 0.4314, test_loss: 1.0481, test_f1: 0.6156
 epoch: 66, train_loss: 0.4191, test_loss: 0.9997, test_f1: 0.6172
 epoch: 67, train_loss: 0.3902, test_loss: 0.9281, test_f1: 0.6616
 epoch: 68, train_loss: 0.4038, test_loss: 1.0617, test_f1: 0.6308
 epoch: 69, train_loss: 0.4013, test_loss: 1.0413, test_f1: 0.6396
 epoch: 70, train_loss: 0.4066, test_loss: 1.1243, test_f1: 0.6426
 epoch: 71, train_loss: 0.3983, test_loss: 1.3332, test_f1: 0.6170
 epoch: 72, train_loss: 0.4003, test_loss: 1.0450, test_f1: 0.6163
 epoch: 73, train_loss: 0.3959, test_loss: 1.1093, test_f1: 0.6416
 epoch: 74, train_loss: 0.3802, test_loss: 1.0229, test_f1: 0.6670
 epoch: 75, train_loss: 0.3871, test_loss: 1.0112, test_f1: 0.6585
 epoch: 76, train_loss: 0.3707, test_loss: 1.1564, test_f1: 0.6429
 epoch: 77, train_loss: 0.3848, test_loss: 1.0208, test_f1: 0.6467
 epoch: 78, train_loss: 0.3773, test_loss: 1.1044, test_f1: 0.6640
 epoch: 79, train_loss: 0.3756, test_loss: 1.2603, test_f1: 0.6490
 epoch: 80, train_loss: 0.3852, test_loss: 1.1153, test_f1: 0.6501
 epoch: 81, train_loss: 0.3747, test_loss: 1.0724, test_f1: 0.6609
 epoch: 82, train_loss: 0.3983, test_loss: 1.0859, test_f1: 0.6369
 epoch: 83, train_loss: 0.4004, test_loss: 1.4568, test_f1: 0.6004
 epoch: 84, train_loss: 0.3729, test_loss: 1.1101, test_f1: 0.6626
 epoch: 85, train_loss: 0.3896, test_loss: 1.0843, test_f1: 0.6729
 epoch: 86, train_loss: 0.3830, test_loss: 1.2213, test_f1: 0.6492
 epoch: 87, train_loss: 0.3648, test_loss: 1.1986, test_f1: 0.6480
 epoch: 88, train_loss: 0.3462, test_loss: 1.1841, test_f1: 0.6645
 epoch: 89, train_loss: 0.3478, test_loss: 1.2528, test_f1: 0.6320
 epoch: 90, train_loss: 0.3469, test_loss: 1.3862, test_f1: 0.6377
 epoch: 91, train_loss: 0.3472, test_loss: 1.0775, test_f1: 0.6818
 epoch: 92, train_loss: 0.3443, test_loss: 1.4117, test_f1: 0.6282
 epoch: 93, train_loss: 0.3535, test_loss: 1.1576, test_f1: 0.6367
 epoch: 94, train_loss: 0.3501, test_loss: 1.2092, test_f1: 0.6641
 epoch: 95, train_loss: 0.3584, test_loss: 1.2110, test_f1: 0.6468
 epoch: 96, train_loss: 0.3448, test_loss: 1.3311, test_f1: 0.6492
 epoch: 97, train_loss: 0.3420, test_loss: 1.1070, test_f1: 0.6485
 epoch: 98, train_loss: 0.3435, test_loss: 1.4773, test_f1: 0.6328
 epoch: 99, train_loss: 0.3377, test_loss: 1.2694, test_f1: 0.6556

Training completed in 420.23 seconds
Best F1: 0.7016 at epoch 81
Mean F1 across iterations: 0.6798  0.0142
========================FINAL RESULTS================================
FEGIN weighted F1: 0.7016  0.0142
python main.py --data ltspice_examples --representation component_pin --model FEGIN --layers 3 --hiddens 64 --batch_size 256 --lr 0.01 --emb_size 250 --epochs 100 --save_appendix component_pin_L3_H64_BS256_LR0.01_E250 --no_val
-----



STDERR:
  File "main.py", line 370, in <module>
    main()
  File "main.py", line 254, in main
    dataset = dataset_class(
  File "/home/philip/projects/ltspice_examples_code_repo/Circuit-Completion-Using-GNNs/component_classification_with_link_prediction_head/evaluation/FEGIN/kernel/circuit_datasets.py", line 15, in __init__
    self.data, self.slices = torch.load(self.processed_paths[0])
  File "/home/philip/.local/lib/python3.8/site-packages/torch/serialization.py", line 1040, in load
    warnings.warn(
  File "/usr/lib/python3.8/warnings.py", line 109, in _showwarnmsg
    sw(msg.message, msg.category, msg.filename, msg.lineno,
  File "main.py", line 47, in warn_with_traceback
    traceback.print_stack(file=log)
/home/philip/projects/ltspice_examples_code_repo/Circuit-Completion-Using-GNNs/component_classification_with_link_prediction_head/evaluation/FEGIN/kernel/circuit_datasets.py:15: FutureWarning: You are using `torch.load` with `weights_only=False` (the current default value), which uses the default pickle module implicitly. It is possible to construct malicious pickle data which will execute arbitrary code during unpickling (See https://github.com/pytorch/pytorch/blob/main/SECURITY.md#untrusted-models for more details). In a future release, the default value for `weights_only` will be flipped to `True`. This limits the functions that could be executed during unpickling. Arbitrary objects will no longer be allowed to be loaded via this mode unless they are explicitly allowlisted by the user via `torch.serialization.add_safe_globals`. We recommend you start setting `weights_only=True` for any use case where you don't have full control of the loaded file. Please open an issue on GitHub for any issues related to this experimental feature.
  self.data, self.slices = torch.load(self.processed_paths[0])
