STDOUT:
Results will be saved in /home/philip/projects/ltspice_examples_code_repo/Circuit-Completion-Using-GNNs/component_classification_with_link_prediction_head/evaluation/FEGIN/results/model_FEGIN_dataset_ltspice_examples
Command line input: python main.py --data ltspice_examples --representation component_component --model FEGIN --layers 4 --hiddens 128 --batch_size 128 --lr 0.0001 --emb_size 128 --epochs 100 --save_appendix component_component_L4_H128_BS128_LR0.0001_E128 --no_val
 is saved.
-----
ltspice_examples - FEGIN
Using 4 layers, 128 hidden units, h = 2
Loading component_component representation dataset
ENTERED
Training FEGIN on component_component representation
Train: 3556, Test: 845
##################ITERATION #0 ****************************************
 epoch: 0, train_loss: 1.3581, test_loss: 1.3532, test_f1: 0.2274
 epoch: 1, train_loss: 1.3280, test_loss: 1.3258, test_f1: 0.2555
 epoch: 2, train_loss: 1.3010, test_loss: 1.2929, test_f1: 0.2555
 epoch: 3, train_loss: 1.2740, test_loss: 1.2560, test_f1: 0.2971
 epoch: 4, train_loss: 1.2460, test_loss: 1.2238, test_f1: 0.3042
 epoch: 5, train_loss: 1.2224, test_loss: 1.1964, test_f1: 0.3377
 epoch: 6, train_loss: 1.1994, test_loss: 1.1752, test_f1: 0.3578
 epoch: 7, train_loss: 1.1782, test_loss: 1.1548, test_f1: 0.3709
 epoch: 8, train_loss: 1.1595, test_loss: 1.1313, test_f1: 0.3656
 epoch: 9, train_loss: 1.1419, test_loss: 1.1162, test_f1: 0.4113
 epoch: 10, train_loss: 1.1265, test_loss: 1.1005, test_f1: 0.4207
 epoch: 11, train_loss: 1.1044, test_loss: 1.0908, test_f1: 0.4292
 epoch: 12, train_loss: 1.0866, test_loss: 1.0743, test_f1: 0.4282
 epoch: 13, train_loss: 1.0724, test_loss: 1.0608, test_f1: 0.4389
 epoch: 14, train_loss: 1.0599, test_loss: 1.0426, test_f1: 0.4792
 epoch: 15, train_loss: 1.0380, test_loss: 1.0410, test_f1: 0.4610
 epoch: 16, train_loss: 1.0195, test_loss: 1.0334, test_f1: 0.4430
 epoch: 17, train_loss: 1.0156, test_loss: 1.0313, test_f1: 0.4540
 epoch: 18, train_loss: 1.0003, test_loss: 1.0217, test_f1: 0.4561
 epoch: 19, train_loss: 0.9837, test_loss: 1.0151, test_f1: 0.4760
 epoch: 20, train_loss: 0.9691, test_loss: 1.0153, test_f1: 0.4562
 epoch: 21, train_loss: 0.9482, test_loss: 1.0071, test_f1: 0.4811
 epoch: 22, train_loss: 0.9297, test_loss: 1.0260, test_f1: 0.4752
 epoch: 23, train_loss: 0.9243, test_loss: 1.0084, test_f1: 0.4950
 epoch: 24, train_loss: 0.9087, test_loss: 1.0471, test_f1: 0.4985
 epoch: 25, train_loss: 0.8907, test_loss: 1.0306, test_f1: 0.4933
 epoch: 26, train_loss: 0.8884, test_loss: 1.0138, test_f1: 0.4993
 epoch: 27, train_loss: 0.8693, test_loss: 1.0617, test_f1: 0.4819
 epoch: 28, train_loss: 0.8640, test_loss: 1.0524, test_f1: 0.5042
 epoch: 29, train_loss: 0.8445, test_loss: 1.1189, test_f1: 0.4952
 epoch: 30, train_loss: 0.8321, test_loss: 1.0719, test_f1: 0.4884
 epoch: 31, train_loss: 0.8289, test_loss: 1.0593, test_f1: 0.4950
 epoch: 32, train_loss: 0.8146, test_loss: 1.0675, test_f1: 0.4948
 epoch: 33, train_loss: 0.8046, test_loss: 1.1066, test_f1: 0.4797
 epoch: 34, train_loss: 0.7948, test_loss: 1.0797, test_f1: 0.5115
 epoch: 35, train_loss: 0.7829, test_loss: 1.0831, test_f1: 0.5011
 epoch: 36, train_loss: 0.7763, test_loss: 1.1159, test_f1: 0.5162
 epoch: 37, train_loss: 0.7809, test_loss: 1.1002, test_f1: 0.5064
 epoch: 38, train_loss: 0.7581, test_loss: 1.1199, test_f1: 0.4965
 epoch: 39, train_loss: 0.7482, test_loss: 1.1592, test_f1: 0.5121
 epoch: 40, train_loss: 0.7416, test_loss: 1.1491, test_f1: 0.4897
 epoch: 41, train_loss: 0.7499, test_loss: 1.2117, test_f1: 0.4983
 epoch: 42, train_loss: 0.7440, test_loss: 1.1486, test_f1: 0.5000
 epoch: 43, train_loss: 0.7251, test_loss: 1.1711, test_f1: 0.4854
 epoch: 44, train_loss: 0.7154, test_loss: 1.2036, test_f1: 0.4983
 epoch: 45, train_loss: 0.7025, test_loss: 1.1976, test_f1: 0.5187
 epoch: 46, train_loss: 0.7227, test_loss: 1.2316, test_f1: 0.4769
 epoch: 47, train_loss: 0.6969, test_loss: 1.2026, test_f1: 0.5126
 epoch: 48, train_loss: 0.6745, test_loss: 1.1686, test_f1: 0.5336
 epoch: 49, train_loss: 0.7001, test_loss: 1.2046, test_f1: 0.5248
 epoch: 50, train_loss: 0.6630, test_loss: 1.2243, test_f1: 0.5241
 epoch: 51, train_loss: 0.6616, test_loss: 1.1713, test_f1: 0.5284
 epoch: 52, train_loss: 0.6404, test_loss: 1.2365, test_f1: 0.5107
 epoch: 53, train_loss: 0.6415, test_loss: 1.2168, test_f1: 0.5107
 epoch: 54, train_loss: 0.6381, test_loss: 1.1979, test_f1: 0.5377
 epoch: 55, train_loss: 0.6314, test_loss: 1.2843, test_f1: 0.5090
 epoch: 56, train_loss: 0.6370, test_loss: 1.2456, test_f1: 0.5165
 epoch: 57, train_loss: 0.6367, test_loss: 1.2593, test_f1: 0.5112
 epoch: 58, train_loss: 0.6246, test_loss: 1.2562, test_f1: 0.5234
 epoch: 59, train_loss: 0.6176, test_loss: 1.2745, test_f1: 0.5233
 epoch: 60, train_loss: 0.6323, test_loss: 1.2507, test_f1: 0.5370
 epoch: 61, train_loss: 0.6171, test_loss: 1.3053, test_f1: 0.5262
 epoch: 62, train_loss: 0.6251, test_loss: 1.2967, test_f1: 0.5096
 epoch: 63, train_loss: 0.6308, test_loss: 1.2858, test_f1: 0.5298
 epoch: 64, train_loss: 0.6176, test_loss: 1.3063, test_f1: 0.5267
 epoch: 65, train_loss: 0.6213, test_loss: 1.3009, test_f1: 0.5311
 epoch: 66, train_loss: 0.6093, test_loss: 1.3082, test_f1: 0.5301
 epoch: 67, train_loss: 0.6001, test_loss: 1.3132, test_f1: 0.5248
 epoch: 68, train_loss: 0.6002, test_loss: 1.2880, test_f1: 0.5431
 epoch: 69, train_loss: 0.5934, test_loss: 1.3042, test_f1: 0.5229
 epoch: 70, train_loss: 0.5935, test_loss: 1.2870, test_f1: 0.5376
 epoch: 71, train_loss: 0.5881, test_loss: 1.2876, test_f1: 0.5340
 epoch: 72, train_loss: 0.5891, test_loss: 1.2501, test_f1: 0.5370
 epoch: 73, train_loss: 0.5896, test_loss: 1.2872, test_f1: 0.5358
 epoch: 74, train_loss: 0.5918, test_loss: 1.3189, test_f1: 0.5555
 epoch: 75, train_loss: 0.5753, test_loss: 1.3076, test_f1: 0.5322
 epoch: 76, train_loss: 0.5753, test_loss: 1.3702, test_f1: 0.5446
 epoch: 77, train_loss: 0.5847, test_loss: 1.3112, test_f1: 0.5309
 epoch: 78, train_loss: 0.5847, test_loss: 1.3670, test_f1: 0.5358
 epoch: 79, train_loss: 0.5637, test_loss: 1.3384, test_f1: 0.5477
 epoch: 80, train_loss: 0.5616, test_loss: 1.3248, test_f1: 0.5456
 epoch: 81, train_loss: 0.5646, test_loss: 1.3432, test_f1: 0.5322
 epoch: 82, train_loss: 0.5634, test_loss: 1.3525, test_f1: 0.5570
 epoch: 83, train_loss: 0.5520, test_loss: 1.3254, test_f1: 0.5422
 epoch: 84, train_loss: 0.5666, test_loss: 1.3501, test_f1: 0.5472
 epoch: 85, train_loss: 0.5518, test_loss: 1.3856, test_f1: 0.5352
 epoch: 86, train_loss: 0.5522, test_loss: 1.3489, test_f1: 0.5515
 epoch: 87, train_loss: 0.5563, test_loss: 1.4046, test_f1: 0.5364
 epoch: 88, train_loss: 0.5561, test_loss: 1.3747, test_f1: 0.5390
 epoch: 89, train_loss: 0.5432, test_loss: 1.3520, test_f1: 0.5431
 epoch: 90, train_loss: 0.5294, test_loss: 1.3407, test_f1: 0.5598
 epoch: 91, train_loss: 0.5435, test_loss: 1.3442, test_f1: 0.5442
 epoch: 92, train_loss: 0.5289, test_loss: 1.3592, test_f1: 0.5556
 epoch: 93, train_loss: 0.5327, test_loss: 1.3800, test_f1: 0.5438
 epoch: 94, train_loss: 0.5457, test_loss: 1.4126, test_f1: 0.5437
 epoch: 95, train_loss: 0.5406, test_loss: 1.3836, test_f1: 0.5503
 epoch: 96, train_loss: 0.5218, test_loss: 1.4259, test_f1: 0.5390
 epoch: 97, train_loss: 0.5304, test_loss: 1.4295, test_f1: 0.5523
 epoch: 98, train_loss: 0.5297, test_loss: 1.4191, test_f1: 0.5432
 epoch: 99, train_loss: 0.5225, test_loss: 1.4065, test_f1: 0.5488
##################ITERATION #1 ****************************************
 epoch: 0, train_loss: 1.3089, test_loss: 1.3010, test_f1: 0.2274
 epoch: 1, train_loss: 1.2464, test_loss: 1.2444, test_f1: 0.2555
 epoch: 2, train_loss: 1.2144, test_loss: 1.1991, test_f1: 0.3378
 epoch: 3, train_loss: 1.1887, test_loss: 1.1904, test_f1: 0.3978
 epoch: 4, train_loss: 1.1652, test_loss: 1.1960, test_f1: 0.4174
 epoch: 5, train_loss: 1.1501, test_loss: 1.1795, test_f1: 0.4116
 epoch: 6, train_loss: 1.1238, test_loss: 1.1800, test_f1: 0.4362
 epoch: 7, train_loss: 1.1133, test_loss: 1.2081, test_f1: 0.4375
 epoch: 8, train_loss: 1.0943, test_loss: 1.1851, test_f1: 0.4410
 epoch: 9, train_loss: 1.0740, test_loss: 1.2047, test_f1: 0.4424
 epoch: 10, train_loss: 1.0542, test_loss: 1.2163, test_f1: 0.4555
 epoch: 11, train_loss: 1.0336, test_loss: 1.2110, test_f1: 0.4612
 epoch: 12, train_loss: 1.0115, test_loss: 1.2290, test_f1: 0.4633
 epoch: 13, train_loss: 0.9994, test_loss: 1.2261, test_f1: 0.4702
 epoch: 14, train_loss: 0.9805, test_loss: 1.7179, test_f1: 0.4767
 epoch: 15, train_loss: 0.9556, test_loss: 1.0281, test_f1: 0.4487
 epoch: 16, train_loss: 0.9443, test_loss: 1.0207, test_f1: 0.4665
 epoch: 17, train_loss: 0.9209, test_loss: 1.0272, test_f1: 0.4607
 epoch: 18, train_loss: 0.9072, test_loss: 1.0503, test_f1: 0.4735
 epoch: 19, train_loss: 0.8909, test_loss: 1.0166, test_f1: 0.4687
 epoch: 20, train_loss: 0.8857, test_loss: 1.0444, test_f1: 0.4368
 epoch: 21, train_loss: 0.8620, test_loss: 1.0352, test_f1: 0.4658
 epoch: 22, train_loss: 0.8538, test_loss: 1.0506, test_f1: 0.4674
 epoch: 23, train_loss: 0.8546, test_loss: 1.0488, test_f1: 0.4875
 epoch: 24, train_loss: 0.8328, test_loss: 1.0623, test_f1: 0.4746
 epoch: 25, train_loss: 0.8294, test_loss: 1.0610, test_f1: 0.4812
 epoch: 26, train_loss: 0.8096, test_loss: 1.0039, test_f1: 0.5100
 epoch: 27, train_loss: 0.8022, test_loss: 1.0256, test_f1: 0.5057
 epoch: 28, train_loss: 0.7864, test_loss: 1.0583, test_f1: 0.4977
 epoch: 29, train_loss: 0.7821, test_loss: 1.0772, test_f1: 0.4721
 epoch: 30, train_loss: 0.7844, test_loss: 1.1016, test_f1: 0.4643
 epoch: 31, train_loss: 0.7571, test_loss: 1.0684, test_f1: 0.4979
 epoch: 32, train_loss: 0.7601, test_loss: 1.0902, test_f1: 0.4994
 epoch: 33, train_loss: 0.7465, test_loss: 1.0887, test_f1: 0.4831
 epoch: 34, train_loss: 0.7411, test_loss: 1.0758, test_f1: 0.4973
 epoch: 35, train_loss: 0.7221, test_loss: 1.1110, test_f1: 0.4874
 epoch: 36, train_loss: 0.7219, test_loss: 1.1107, test_f1: 0.4935
 epoch: 37, train_loss: 0.7046, test_loss: 1.1381, test_f1: 0.4815
 epoch: 38, train_loss: 0.7063, test_loss: 1.1256, test_f1: 0.5027
 epoch: 39, train_loss: 0.6847, test_loss: 1.1525, test_f1: 0.4943
 epoch: 40, train_loss: 0.6881, test_loss: 1.1453, test_f1: 0.5164
 epoch: 41, train_loss: 0.6695, test_loss: 1.1707, test_f1: 0.5134
 epoch: 42, train_loss: 0.6778, test_loss: 1.1674, test_f1: 0.5135
 epoch: 43, train_loss: 0.6680, test_loss: 1.1784, test_f1: 0.5094
 epoch: 44, train_loss: 0.6630, test_loss: 1.2248, test_f1: 0.5051
 epoch: 45, train_loss: 0.6620, test_loss: 1.1818, test_f1: 0.5032
 epoch: 46, train_loss: 0.6450, test_loss: 1.2115, test_f1: 0.5182
 epoch: 47, train_loss: 0.6454, test_loss: 1.3256, test_f1: 0.5065
 epoch: 48, train_loss: 0.6388, test_loss: 1.2817, test_f1: 0.5085
 epoch: 49, train_loss: 0.6458, test_loss: 1.2935, test_f1: 0.4872
 epoch: 50, train_loss: 0.6188, test_loss: 1.2569, test_f1: 0.5050
 epoch: 51, train_loss: 0.5956, test_loss: 1.2886, test_f1: 0.5107
 epoch: 52, train_loss: 0.5927, test_loss: 1.2876, test_f1: 0.5102
 epoch: 53, train_loss: 0.5969, test_loss: 1.3076, test_f1: 0.5142
 epoch: 54, train_loss: 0.5888, test_loss: 1.2744, test_f1: 0.5119
 epoch: 55, train_loss: 0.5792, test_loss: 1.3376, test_f1: 0.5076
 epoch: 56, train_loss: 0.5899, test_loss: 1.3252, test_f1: 0.5222
 epoch: 57, train_loss: 0.5765, test_loss: 1.3444, test_f1: 0.5091
 epoch: 58, train_loss: 0.5720, test_loss: 1.3326, test_f1: 0.5152
 epoch: 59, train_loss: 0.5812, test_loss: 1.3619, test_f1: 0.5250
 epoch: 60, train_loss: 0.5749, test_loss: 1.3539, test_f1: 0.5183
 epoch: 61, train_loss: 0.5654, test_loss: 1.3361, test_f1: 0.5335
 epoch: 62, train_loss: 0.5782, test_loss: 1.3510, test_f1: 0.5229
 epoch: 63, train_loss: 0.5605, test_loss: 1.3517, test_f1: 0.5276
 epoch: 64, train_loss: 0.5578, test_loss: 1.3415, test_f1: 0.5216
 epoch: 65, train_loss: 0.5657, test_loss: 1.3712, test_f1: 0.5262
 epoch: 66, train_loss: 0.5469, test_loss: 1.3513, test_f1: 0.5296
 epoch: 67, train_loss: 0.5504, test_loss: 1.3568, test_f1: 0.5382
 epoch: 68, train_loss: 0.5511, test_loss: 1.3874, test_f1: 0.5255
 epoch: 69, train_loss: 0.5442, test_loss: 1.4022, test_f1: 0.5226
 epoch: 70, train_loss: 0.5290, test_loss: 1.4036, test_f1: 0.5262
 epoch: 71, train_loss: 0.5504, test_loss: 1.4054, test_f1: 0.5343
 epoch: 72, train_loss: 0.5388, test_loss: 1.4193, test_f1: 0.5293
 epoch: 73, train_loss: 0.5403, test_loss: 1.4078, test_f1: 0.5383
 epoch: 74, train_loss: 0.5218, test_loss: 1.3942, test_f1: 0.5374
 epoch: 75, train_loss: 0.5297, test_loss: 1.4015, test_f1: 0.5395
 epoch: 76, train_loss: 0.5264, test_loss: 1.4434, test_f1: 0.5325
 epoch: 77, train_loss: 0.5185, test_loss: 1.5044, test_f1: 0.5170
 epoch: 78, train_loss: 0.5150, test_loss: 1.4864, test_f1: 0.5156
 epoch: 79, train_loss: 0.5019, test_loss: 1.4582, test_f1: 0.5425
 epoch: 80, train_loss: 0.5203, test_loss: 1.5147, test_f1: 0.5184
 epoch: 81, train_loss: 0.5110, test_loss: 1.4492, test_f1: 0.5189
 epoch: 82, train_loss: 0.5013, test_loss: 1.5101, test_f1: 0.5245
 epoch: 83, train_loss: 0.5089, test_loss: 1.5104, test_f1: 0.5086
 epoch: 84, train_loss: 0.5039, test_loss: 1.4712, test_f1: 0.5354
 epoch: 85, train_loss: 0.4876, test_loss: 1.5189, test_f1: 0.5402
 epoch: 86, train_loss: 0.4914, test_loss: 1.5089, test_f1: 0.5374
 epoch: 87, train_loss: 0.4890, test_loss: 1.5297, test_f1: 0.5290
 epoch: 88, train_loss: 0.5076, test_loss: 1.5822, test_f1: 0.5321
 epoch: 89, train_loss: 0.4964, test_loss: 1.5088, test_f1: 0.5278
 epoch: 90, train_loss: 0.4967, test_loss: 1.5293, test_f1: 0.5264
 epoch: 91, train_loss: 0.4986, test_loss: 1.5493, test_f1: 0.5200
 epoch: 92, train_loss: 0.4876, test_loss: 1.5844, test_f1: 0.5199
 epoch: 93, train_loss: 0.4794, test_loss: 1.5675, test_f1: 0.5272
 epoch: 94, train_loss: 0.4754, test_loss: 1.6154, test_f1: 0.5164
 epoch: 95, train_loss: 0.4683, test_loss: 1.6011, test_f1: 0.5199
 epoch: 96, train_loss: 0.4803, test_loss: 1.6243, test_f1: 0.5373
 epoch: 97, train_loss: 0.4664, test_loss: 1.5746, test_f1: 0.5154
 epoch: 98, train_loss: 0.4824, test_loss: 1.5886, test_f1: 0.5268
 epoch: 99, train_loss: 0.4734, test_loss: 1.6129, test_f1: 0.5359
##################ITERATION #2 ****************************************
 epoch: 0, train_loss: 1.3066, test_loss: 1.2799, test_f1: 0.2555
 epoch: 1, train_loss: 1.2165, test_loss: 1.2075, test_f1: 0.3027
 epoch: 2, train_loss: 1.1866, test_loss: 1.1513, test_f1: 0.4587
 epoch: 3, train_loss: 1.1662, test_loss: 1.1226, test_f1: 0.4555
 epoch: 4, train_loss: 1.1366, test_loss: 1.1032, test_f1: 0.4428
 epoch: 5, train_loss: 1.1253, test_loss: 1.0918, test_f1: 0.4435
 epoch: 6, train_loss: 1.1035, test_loss: 1.0739, test_f1: 0.4479
 epoch: 7, train_loss: 1.0840, test_loss: 1.0624, test_f1: 0.4506
 epoch: 8, train_loss: 1.0749, test_loss: 1.0595, test_f1: 0.4649
 epoch: 9, train_loss: 1.0623, test_loss: 1.0434, test_f1: 0.4619
 epoch: 10, train_loss: 1.0455, test_loss: 1.0367, test_f1: 0.4534
 epoch: 11, train_loss: 1.0350, test_loss: 1.0231, test_f1: 0.4727
 epoch: 12, train_loss: 1.0182, test_loss: 1.0253, test_f1: 0.4562
 epoch: 13, train_loss: 1.0082, test_loss: 1.0133, test_f1: 0.4675
 epoch: 14, train_loss: 0.9869, test_loss: 1.0187, test_f1: 0.4608
 epoch: 15, train_loss: 0.9757, test_loss: 0.9944, test_f1: 0.4785
 epoch: 16, train_loss: 0.9697, test_loss: 0.9871, test_f1: 0.4872
 epoch: 17, train_loss: 0.9615, test_loss: 0.9825, test_f1: 0.4961
 epoch: 18, train_loss: 0.9423, test_loss: 1.0079, test_f1: 0.4882
 epoch: 19, train_loss: 0.9320, test_loss: 0.9832, test_f1: 0.4938
 epoch: 20, train_loss: 0.9225, test_loss: 0.9888, test_f1: 0.4992
 epoch: 21, train_loss: 0.9102, test_loss: 0.9789, test_f1: 0.4964
 epoch: 22, train_loss: 0.8915, test_loss: 1.0013, test_f1: 0.4786
 epoch: 23, train_loss: 0.8781, test_loss: 0.9738, test_f1: 0.5108
 epoch: 24, train_loss: 0.8772, test_loss: 1.0139, test_f1: 0.4977
 epoch: 25, train_loss: 0.8687, test_loss: 0.9890, test_f1: 0.5050
 epoch: 26, train_loss: 0.8546, test_loss: 0.9912, test_f1: 0.5361
 epoch: 27, train_loss: 0.8458, test_loss: 0.9918, test_f1: 0.5164
 epoch: 28, train_loss: 0.8278, test_loss: 0.9874, test_f1: 0.5191
 epoch: 29, train_loss: 0.8248, test_loss: 0.9943, test_f1: 0.5197
 epoch: 30, train_loss: 0.8122, test_loss: 1.0006, test_f1: 0.5083
 epoch: 31, train_loss: 0.7951, test_loss: 1.0156, test_f1: 0.5176
 epoch: 32, train_loss: 0.8009, test_loss: 1.0293, test_f1: 0.5268
 epoch: 33, train_loss: 0.7912, test_loss: 1.0288, test_f1: 0.5161
 epoch: 34, train_loss: 0.7646, test_loss: 1.0239, test_f1: 0.5188
 epoch: 35, train_loss: 0.7532, test_loss: 1.0408, test_f1: 0.5134
 epoch: 36, train_loss: 0.7459, test_loss: 1.0425, test_f1: 0.5151
 epoch: 37, train_loss: 0.7467, test_loss: 1.0432, test_f1: 0.5341
 epoch: 38, train_loss: 0.7352, test_loss: 1.0854, test_f1: 0.5200
 epoch: 39, train_loss: 0.7228, test_loss: 1.0665, test_f1: 0.5289
 epoch: 40, train_loss: 0.7146, test_loss: 1.0631, test_f1: 0.5250
 epoch: 41, train_loss: 0.7146, test_loss: 1.0481, test_f1: 0.5164
 epoch: 42, train_loss: 0.7108, test_loss: 1.1103, test_f1: 0.5176
 epoch: 43, train_loss: 0.6978, test_loss: 1.1419, test_f1: 0.5104
 epoch: 44, train_loss: 0.6992, test_loss: 1.1047, test_f1: 0.5201
 epoch: 45, train_loss: 0.6863, test_loss: 1.1398, test_f1: 0.5349
 epoch: 46, train_loss: 0.6739, test_loss: 1.1367, test_f1: 0.5212
 epoch: 47, train_loss: 0.6706, test_loss: 1.1317, test_f1: 0.5286
 epoch: 48, train_loss: 0.6732, test_loss: 1.1581, test_f1: 0.5161
 epoch: 49, train_loss: 0.6664, test_loss: 1.1226, test_f1: 0.5234
 epoch: 50, train_loss: 0.6534, test_loss: 1.2217, test_f1: 0.5230
 epoch: 51, train_loss: 0.6287, test_loss: 1.1875, test_f1: 0.5121
 epoch: 52, train_loss: 0.6292, test_loss: 1.1840, test_f1: 0.5215
 epoch: 53, train_loss: 0.6205, test_loss: 1.2084, test_f1: 0.5159
 epoch: 54, train_loss: 0.6138, test_loss: 1.2303, test_f1: 0.5167
 epoch: 55, train_loss: 0.6160, test_loss: 1.1903, test_f1: 0.5219
 epoch: 56, train_loss: 0.5906, test_loss: 1.2001, test_f1: 0.5163
 epoch: 57, train_loss: 0.5932, test_loss: 1.2156, test_f1: 0.5175
 epoch: 58, train_loss: 0.5888, test_loss: 1.2069, test_f1: 0.5290
 epoch: 59, train_loss: 0.5975, test_loss: 1.2480, test_f1: 0.5213
 epoch: 60, train_loss: 0.5874, test_loss: 1.2285, test_f1: 0.5314
 epoch: 61, train_loss: 0.5957, test_loss: 1.2671, test_f1: 0.5200
 epoch: 62, train_loss: 0.5813, test_loss: 1.2496, test_f1: 0.5221
 epoch: 63, train_loss: 0.5787, test_loss: 1.2520, test_f1: 0.5229
 epoch: 64, train_loss: 0.5612, test_loss: 1.3039, test_f1: 0.5203
 epoch: 65, train_loss: 0.5704, test_loss: 1.2843, test_f1: 0.5292
 epoch: 66, train_loss: 0.5494, test_loss: 1.3004, test_f1: 0.5208
 epoch: 67, train_loss: 0.5687, test_loss: 1.2707, test_f1: 0.5339
 epoch: 68, train_loss: 0.5605, test_loss: 1.3039, test_f1: 0.5264
 epoch: 69, train_loss: 0.5438, test_loss: 1.3167, test_f1: 0.5198
 epoch: 70, train_loss: 0.5586, test_loss: 1.3272, test_f1: 0.5115
 epoch: 71, train_loss: 0.5555, test_loss: 1.3225, test_f1: 0.5332
 epoch: 72, train_loss: 0.5750, test_loss: 1.3133, test_f1: 0.5247
 epoch: 73, train_loss: 0.5411, test_loss: 1.3308, test_f1: 0.5248
 epoch: 74, train_loss: 0.5240, test_loss: 1.2897, test_f1: 0.5280
 epoch: 75, train_loss: 0.5455, test_loss: 1.3236, test_f1: 0.5273
 epoch: 76, train_loss: 0.5263, test_loss: 1.3163, test_f1: 0.5379
 epoch: 77, train_loss: 0.5432, test_loss: 1.3063, test_f1: 0.5386
 epoch: 78, train_loss: 0.5289, test_loss: 1.3237, test_f1: 0.5286
 epoch: 79, train_loss: 0.5232, test_loss: 1.3524, test_f1: 0.5246
 epoch: 80, train_loss: 0.5197, test_loss: 1.3128, test_f1: 0.5157
 epoch: 81, train_loss: 0.5186, test_loss: 1.3211, test_f1: 0.5276
 epoch: 82, train_loss: 0.5184, test_loss: 1.3622, test_f1: 0.5318
 epoch: 83, train_loss: 0.5202, test_loss: 1.3662, test_f1: 0.5368
 epoch: 84, train_loss: 0.5333, test_loss: 1.3535, test_f1: 0.5341
 epoch: 85, train_loss: 0.4993, test_loss: 1.3934, test_f1: 0.5345
 epoch: 86, train_loss: 0.5062, test_loss: 1.3753, test_f1: 0.5377
 epoch: 87, train_loss: 0.5039, test_loss: 1.4020, test_f1: 0.5234
 epoch: 88, train_loss: 0.5099, test_loss: 1.3935, test_f1: 0.5251
 epoch: 89, train_loss: 0.5145, test_loss: 1.3858, test_f1: 0.5373
 epoch: 90, train_loss: 0.5028, test_loss: 1.3860, test_f1: 0.5339
 epoch: 91, train_loss: 0.4736, test_loss: 1.4386, test_f1: 0.5196
 epoch: 92, train_loss: 0.4854, test_loss: 1.4044, test_f1: 0.5452
 epoch: 93, train_loss: 0.4933, test_loss: 1.4163, test_f1: 0.5273
 epoch: 94, train_loss: 0.4965, test_loss: 1.4356, test_f1: 0.5251
 epoch: 95, train_loss: 0.4904, test_loss: 1.3860, test_f1: 0.5315
 epoch: 96, train_loss: 0.4722, test_loss: 1.4387, test_f1: 0.5367
 epoch: 97, train_loss: 0.4806, test_loss: 1.4161, test_f1: 0.5307
 epoch: 98, train_loss: 0.4722, test_loss: 1.4443, test_f1: 0.5388
 epoch: 99, train_loss: 0.4742, test_loss: 1.4714, test_f1: 0.5375
##################ITERATION #3 ****************************************
 epoch: 0, train_loss: 1.2784, test_loss: 1.2667, test_f1: 0.3036
 epoch: 1, train_loss: 1.2007, test_loss: 1.1885, test_f1: 0.4375
 epoch: 2, train_loss: 1.1655, test_loss: 1.1415, test_f1: 0.4318
 epoch: 3, train_loss: 1.1500, test_loss: 1.1150, test_f1: 0.4483
 epoch: 4, train_loss: 1.1252, test_loss: 1.0997, test_f1: 0.4557
 epoch: 5, train_loss: 1.1101, test_loss: 1.0905, test_f1: 0.4378
 epoch: 6, train_loss: 1.0981, test_loss: 1.0813, test_f1: 0.4471
 epoch: 7, train_loss: 1.0798, test_loss: 1.0718, test_f1: 0.4399
 epoch: 8, train_loss: 1.0643, test_loss: 1.0547, test_f1: 0.4420
 epoch: 9, train_loss: 1.0453, test_loss: 1.0520, test_f1: 0.4407
 epoch: 10, train_loss: 1.0339, test_loss: 1.0447, test_f1: 0.4678
 epoch: 11, train_loss: 1.0238, test_loss: 1.0367, test_f1: 0.4826
 epoch: 12, train_loss: 1.0012, test_loss: 1.0232, test_f1: 0.4703
 epoch: 13, train_loss: 0.9932, test_loss: 1.0144, test_f1: 0.4887
 epoch: 14, train_loss: 0.9799, test_loss: 1.0126, test_f1: 0.4818
 epoch: 15, train_loss: 0.9675, test_loss: 1.0074, test_f1: 0.4884
 epoch: 16, train_loss: 0.9554, test_loss: 1.0207, test_f1: 0.4784
 epoch: 17, train_loss: 0.9366, test_loss: 0.9924, test_f1: 0.4869
 epoch: 18, train_loss: 0.9183, test_loss: 1.0060, test_f1: 0.4916
 epoch: 19, train_loss: 0.9099, test_loss: 1.0080, test_f1: 0.4900
 epoch: 20, train_loss: 0.9005, test_loss: 1.0145, test_f1: 0.4936
 epoch: 21, train_loss: 0.8925, test_loss: 1.0163, test_f1: 0.4862
 epoch: 22, train_loss: 0.8797, test_loss: 1.0008, test_f1: 0.4836
 epoch: 23, train_loss: 0.8628, test_loss: 1.0023, test_f1: 0.4888
 epoch: 24, train_loss: 0.8513, test_loss: 0.9999, test_f1: 0.5039
 epoch: 25, train_loss: 0.8351, test_loss: 1.0259, test_f1: 0.4985
 epoch: 26, train_loss: 0.8311, test_loss: 0.9909, test_f1: 0.5188
 epoch: 27, train_loss: 0.8187, test_loss: 1.0044, test_f1: 0.5244
 epoch: 28, train_loss: 0.8223, test_loss: 1.0310, test_f1: 0.5110
 epoch: 29, train_loss: 0.8060, test_loss: 1.0407, test_f1: 0.5070
 epoch: 30, train_loss: 0.7953, test_loss: 1.0340, test_f1: 0.5017
 epoch: 31, train_loss: 0.7940, test_loss: 1.0329, test_f1: 0.5235
 epoch: 32, train_loss: 0.7675, test_loss: 1.0582, test_f1: 0.5011
 epoch: 33, train_loss: 0.7667, test_loss: 1.0757, test_f1: 0.5072
 epoch: 34, train_loss: 0.7682, test_loss: 1.0789, test_f1: 0.5152
 epoch: 35, train_loss: 0.7586, test_loss: 1.0846, test_f1: 0.5086
 epoch: 36, train_loss: 0.7614, test_loss: 1.0618, test_f1: 0.5221
 epoch: 37, train_loss: 0.7432, test_loss: 1.1039, test_f1: 0.5068
 epoch: 38, train_loss: 0.7414, test_loss: 1.0983, test_f1: 0.5120
 epoch: 39, train_loss: 0.7115, test_loss: 1.1077, test_f1: 0.5085
 epoch: 40, train_loss: 0.7157, test_loss: 1.1085, test_f1: 0.5154
 epoch: 41, train_loss: 0.7194, test_loss: 1.1002, test_f1: 0.5373
 epoch: 42, train_loss: 0.6952, test_loss: 1.1231, test_f1: 0.5200
 epoch: 43, train_loss: 0.6771, test_loss: 1.1625, test_f1: 0.5147
 epoch: 44, train_loss: 0.6876, test_loss: 1.1730, test_f1: 0.5179
 epoch: 45, train_loss: 0.6780, test_loss: 1.1737, test_f1: 0.5406
 epoch: 46, train_loss: 0.6850, test_loss: 1.1822, test_f1: 0.5224
 epoch: 47, train_loss: 0.6543, test_loss: 1.2095, test_f1: 0.5069
 epoch: 48, train_loss: 0.6599, test_loss: 1.1603, test_f1: 0.5362
 epoch: 49, train_loss: 0.6598, test_loss: 1.1767, test_f1: 0.5337
 epoch: 50, train_loss: 0.6598, test_loss: 1.1858, test_f1: 0.5300
 epoch: 51, train_loss: 0.6396, test_loss: 1.2101, test_f1: 0.5254
 epoch: 52, train_loss: 0.6273, test_loss: 1.2139, test_f1: 0.5359
 epoch: 53, train_loss: 0.6131, test_loss: 1.2177, test_f1: 0.5334
 epoch: 54, train_loss: 0.6241, test_loss: 1.2109, test_f1: 0.5231
 epoch: 55, train_loss: 0.6062, test_loss: 1.2327, test_f1: 0.5371
 epoch: 56, train_loss: 0.6014, test_loss: 1.2373, test_f1: 0.5465
 epoch: 57, train_loss: 0.6032, test_loss: 1.2371, test_f1: 0.5385
 epoch: 58, train_loss: 0.6007, test_loss: 1.2549, test_f1: 0.5341
 epoch: 59, train_loss: 0.5962, test_loss: 1.2557, test_f1: 0.5462
 epoch: 60, train_loss: 0.5915, test_loss: 1.2534, test_f1: 0.5465
 epoch: 61, train_loss: 0.5773, test_loss: 1.2572, test_f1: 0.5314
 epoch: 62, train_loss: 0.5853, test_loss: 1.2704, test_f1: 0.5304
 epoch: 63, train_loss: 0.5691, test_loss: 1.2805, test_f1: 0.5522
 epoch: 64, train_loss: 0.5954, test_loss: 1.2774, test_f1: 0.5440
 epoch: 65, train_loss: 0.5716, test_loss: 1.3188, test_f1: 0.5332
 epoch: 66, train_loss: 0.5869, test_loss: 1.3164, test_f1: 0.5361
 epoch: 67, train_loss: 0.5694, test_loss: 1.3002, test_f1: 0.5450
 epoch: 68, train_loss: 0.5658, test_loss: 1.3381, test_f1: 0.5332
 epoch: 69, train_loss: 0.5578, test_loss: 1.3264, test_f1: 0.5360
 epoch: 70, train_loss: 0.5586, test_loss: 1.3245, test_f1: 0.5389
 epoch: 71, train_loss: 0.5573, test_loss: 1.3209, test_f1: 0.5409
 epoch: 72, train_loss: 0.5653, test_loss: 1.3316, test_f1: 0.5526
 epoch: 73, train_loss: 0.5589, test_loss: 1.2980, test_f1: 0.5309
 epoch: 74, train_loss: 0.5444, test_loss: 1.3390, test_f1: 0.5459
 epoch: 75, train_loss: 0.5486, test_loss: 1.3182, test_f1: 0.5385
 epoch: 76, train_loss: 0.5511, test_loss: 1.3660, test_f1: 0.5374
 epoch: 77, train_loss: 0.5388, test_loss: 1.3822, test_f1: 0.5279
 epoch: 78, train_loss: 0.5514, test_loss: 1.3517, test_f1: 0.5354
 epoch: 79, train_loss: 0.5270, test_loss: 1.3766, test_f1: 0.5370
 epoch: 80, train_loss: 0.5420, test_loss: 1.3743, test_f1: 0.5448
 epoch: 81, train_loss: 0.5311, test_loss: 1.4063, test_f1: 0.5260
 epoch: 82, train_loss: 0.5223, test_loss: 1.3711, test_f1: 0.5466
 epoch: 83, train_loss: 0.5282, test_loss: 1.3908, test_f1: 0.5439
 epoch: 84, train_loss: 0.5138, test_loss: 1.4060, test_f1: 0.5345
 epoch: 85, train_loss: 0.5051, test_loss: 1.4366, test_f1: 0.5417
 epoch: 86, train_loss: 0.5211, test_loss: 1.4326, test_f1: 0.5377
 epoch: 87, train_loss: 0.5168, test_loss: 1.4389, test_f1: 0.5361
 epoch: 88, train_loss: 0.5229, test_loss: 1.4381, test_f1: 0.5371
 epoch: 89, train_loss: 0.5223, test_loss: 1.4709, test_f1: 0.5290
 epoch: 90, train_loss: 0.4944, test_loss: 1.4501, test_f1: 0.5440
 epoch: 91, train_loss: 0.4942, test_loss: 1.4877, test_f1: 0.5359
 epoch: 92, train_loss: 0.5039, test_loss: 1.4657, test_f1: 0.5269
 epoch: 93, train_loss: 0.5004, test_loss: 1.4697, test_f1: 0.5341
 epoch: 94, train_loss: 0.5064, test_loss: 1.4631, test_f1: 0.5404
 epoch: 95, train_loss: 0.4930, test_loss: 1.4858, test_f1: 0.5431
 epoch: 96, train_loss: 0.4890, test_loss: 1.4895, test_f1: 0.5452
 epoch: 97, train_loss: 0.4968, test_loss: 1.5036, test_f1: 0.5338
 epoch: 98, train_loss: 0.4838, test_loss: 1.5295, test_f1: 0.5376
 epoch: 99, train_loss: 0.4742, test_loss: 1.5406, test_f1: 0.5349
##################ITERATION #4 ****************************************
 epoch: 0, train_loss: 1.2889, test_loss: 1.2399, test_f1: 0.2274
 epoch: 1, train_loss: 1.2116, test_loss: 1.1807, test_f1: 0.3239
 epoch: 2, train_loss: 1.1832, test_loss: 1.1468, test_f1: 0.4586
 epoch: 3, train_loss: 1.1639, test_loss: 1.1237, test_f1: 0.4558
 epoch: 4, train_loss: 1.1412, test_loss: 1.1049, test_f1: 0.4561
 epoch: 5, train_loss: 1.1267, test_loss: 1.0880, test_f1: 0.4700
 epoch: 6, train_loss: 1.1090, test_loss: 1.0671, test_f1: 0.4630
 epoch: 7, train_loss: 1.0865, test_loss: 1.0524, test_f1: 0.4657
 epoch: 8, train_loss: 1.0818, test_loss: 1.0433, test_f1: 0.4676
 epoch: 9, train_loss: 1.0576, test_loss: 1.0270, test_f1: 0.4753
 epoch: 10, train_loss: 1.0494, test_loss: 1.0214, test_f1: 0.4769
 epoch: 11, train_loss: 1.0365, test_loss: 1.0118, test_f1: 0.4832
 epoch: 12, train_loss: 1.0209, test_loss: 0.9919, test_f1: 0.4821
 epoch: 13, train_loss: 1.0138, test_loss: 0.9870, test_f1: 0.5002
 epoch: 14, train_loss: 0.9972, test_loss: 0.9759, test_f1: 0.5250
 epoch: 15, train_loss: 0.9958, test_loss: 0.9674, test_f1: 0.5186
 epoch: 16, train_loss: 0.9782, test_loss: 0.9634, test_f1: 0.5159
 epoch: 17, train_loss: 0.9612, test_loss: 0.9513, test_f1: 0.5238
 epoch: 18, train_loss: 0.9551, test_loss: 0.9521, test_f1: 0.5093
 epoch: 19, train_loss: 0.9417, test_loss: 0.9593, test_f1: 0.5169
 epoch: 20, train_loss: 0.9283, test_loss: 0.9616, test_f1: 0.5295
 epoch: 21, train_loss: 0.9212, test_loss: 0.9453, test_f1: 0.5444
 epoch: 22, train_loss: 0.9125, test_loss: 0.9619, test_f1: 0.5248
 epoch: 23, train_loss: 0.9038, test_loss: 0.9579, test_f1: 0.5272
 epoch: 24, train_loss: 0.8944, test_loss: 0.9577, test_f1: 0.5245
 epoch: 25, train_loss: 0.8779, test_loss: 0.9535, test_f1: 0.5228
 epoch: 26, train_loss: 0.8641, test_loss: 0.9605, test_f1: 0.5074
 epoch: 27, train_loss: 0.8550, test_loss: 0.9423, test_f1: 0.5496
 epoch: 28, train_loss: 0.8419, test_loss: 0.9708, test_f1: 0.5350
 epoch: 29, train_loss: 0.8493, test_loss: 0.9648, test_f1: 0.5313
 epoch: 30, train_loss: 0.8280, test_loss: 0.9751, test_f1: 0.5263
 epoch: 31, train_loss: 0.8330, test_loss: 0.9734, test_f1: 0.5195
 epoch: 32, train_loss: 0.8157, test_loss: 0.9733, test_f1: 0.5376
 epoch: 33, train_loss: 0.8129, test_loss: 0.9867, test_f1: 0.5243
 epoch: 34, train_loss: 0.7963, test_loss: 0.9692, test_f1: 0.5401
 epoch: 35, train_loss: 0.7941, test_loss: 1.0179, test_f1: 0.5255
 epoch: 36, train_loss: 0.7781, test_loss: 0.9962, test_f1: 0.5268
 epoch: 37, train_loss: 0.7616, test_loss: 1.0165, test_f1: 0.5428
 epoch: 38, train_loss: 0.7616, test_loss: 0.9987, test_f1: 0.5459
 epoch: 39, train_loss: 0.7547, test_loss: 1.0423, test_f1: 0.5386
 epoch: 40, train_loss: 0.7457, test_loss: 1.0567, test_f1: 0.5366
 epoch: 41, train_loss: 0.7576, test_loss: 1.0222, test_f1: 0.5431
 epoch: 42, train_loss: 0.7238, test_loss: 1.0481, test_f1: 0.5341
 epoch: 43, train_loss: 0.7128, test_loss: 1.0225, test_f1: 0.5329
 epoch: 44, train_loss: 0.7201, test_loss: 1.0575, test_f1: 0.5335
 epoch: 45, train_loss: 0.7114, test_loss: 1.0664, test_f1: 0.5484
 epoch: 46, train_loss: 0.7149, test_loss: 1.0622, test_f1: 0.5495
 epoch: 47, train_loss: 0.6993, test_loss: 1.1203, test_f1: 0.5494
 epoch: 48, train_loss: 0.7007, test_loss: 1.1289, test_f1: 0.5311
 epoch: 49, train_loss: 0.6818, test_loss: 1.0980, test_f1: 0.5451
 epoch: 50, train_loss: 0.6810, test_loss: 1.1220, test_f1: 0.5346
 epoch: 51, train_loss: 0.6690, test_loss: 1.1250, test_f1: 0.5466
 epoch: 52, train_loss: 0.6476, test_loss: 1.1281, test_f1: 0.5378
 epoch: 53, train_loss: 0.6521, test_loss: 1.1529, test_f1: 0.5147
 epoch: 54, train_loss: 0.6449, test_loss: 1.1489, test_f1: 0.5291
 epoch: 55, train_loss: 0.6431, test_loss: 1.1668, test_f1: 0.5164
 epoch: 56, train_loss: 0.6411, test_loss: 1.1757, test_f1: 0.5343
 epoch: 57, train_loss: 0.6439, test_loss: 1.1523, test_f1: 0.5434
 epoch: 58, train_loss: 0.6436, test_loss: 1.2103, test_f1: 0.5268
 epoch: 59, train_loss: 0.6340, test_loss: 1.1717, test_f1: 0.5400
 epoch: 60, train_loss: 0.6245, test_loss: 1.1903, test_f1: 0.5389
 epoch: 61, train_loss: 0.6231, test_loss: 1.2107, test_f1: 0.5226
 epoch: 62, train_loss: 0.6152, test_loss: 1.2039, test_f1: 0.5389
 epoch: 63, train_loss: 0.6166, test_loss: 1.2454, test_f1: 0.5306
 epoch: 64, train_loss: 0.6206, test_loss: 1.1938, test_f1: 0.5359
 epoch: 65, train_loss: 0.6168, test_loss: 1.2203, test_f1: 0.5355
 epoch: 66, train_loss: 0.6114, test_loss: 1.2081, test_f1: 0.5332
 epoch: 67, train_loss: 0.6029, test_loss: 1.2241, test_f1: 0.5310
 epoch: 68, train_loss: 0.6052, test_loss: 1.1953, test_f1: 0.5473
 epoch: 69, train_loss: 0.6058, test_loss: 1.2343, test_f1: 0.5351
 epoch: 70, train_loss: 0.5911, test_loss: 1.2396, test_f1: 0.5467
 epoch: 71, train_loss: 0.5970, test_loss: 1.2557, test_f1: 0.5277
 epoch: 72, train_loss: 0.5890, test_loss: 1.2296, test_f1: 0.5416
 epoch: 73, train_loss: 0.6039, test_loss: 1.2665, test_f1: 0.5251
 epoch: 74, train_loss: 0.5991, test_loss: 1.2650, test_f1: 0.5360
 epoch: 75, train_loss: 0.5868, test_loss: 1.2735, test_f1: 0.5431
 epoch: 76, train_loss: 0.5698, test_loss: 1.2743, test_f1: 0.5422
 epoch: 77, train_loss: 0.5787, test_loss: 1.2656, test_f1: 0.5292
 epoch: 78, train_loss: 0.5705, test_loss: 1.2498, test_f1: 0.5295
 epoch: 79, train_loss: 0.5690, test_loss: 1.2754, test_f1: 0.5458
 epoch: 80, train_loss: 0.5582, test_loss: 1.2934, test_f1: 0.5365
 epoch: 81, train_loss: 0.5647, test_loss: 1.2882, test_f1: 0.5267
 epoch: 82, train_loss: 0.5560, test_loss: 1.3190, test_f1: 0.5273
 epoch: 83, train_loss: 0.5707, test_loss: 1.3239, test_f1: 0.5163
 epoch: 84, train_loss: 0.5593, test_loss: 1.2693, test_f1: 0.5309
 epoch: 85, train_loss: 0.5524, test_loss: 1.2954, test_f1: 0.5424
 epoch: 86, train_loss: 0.5445, test_loss: 1.3154, test_f1: 0.5378
 epoch: 87, train_loss: 0.5445, test_loss: 1.3235, test_f1: 0.5492
 epoch: 88, train_loss: 0.5414, test_loss: 1.3507, test_f1: 0.5258
 epoch: 89, train_loss: 0.5490, test_loss: 1.3682, test_f1: 0.5227
 epoch: 90, train_loss: 0.5423, test_loss: 1.3762, test_f1: 0.5208
 epoch: 91, train_loss: 0.5401, test_loss: 1.3286, test_f1: 0.5215
 epoch: 92, train_loss: 0.5418, test_loss: 1.3655, test_f1: 0.5467
 epoch: 93, train_loss: 0.5184, test_loss: 1.3576, test_f1: 0.5318
 epoch: 94, train_loss: 0.5185, test_loss: 1.3633, test_f1: 0.5412
 epoch: 95, train_loss: 0.5274, test_loss: 1.3630, test_f1: 0.5377
 epoch: 96, train_loss: 0.5343, test_loss: 1.3557, test_f1: 0.5379
 epoch: 97, train_loss: 0.5198, test_loss: 1.3882, test_f1: 0.5230
 epoch: 98, train_loss: 0.5162, test_loss: 1.4022, test_f1: 0.5319
 epoch: 99, train_loss: 0.5275, test_loss: 1.4064, test_f1: 0.5363
##################ITERATION #5 ****************************************
 epoch: 0, train_loss: 1.3406, test_loss: 1.2675, test_f1: 0.2781
 epoch: 1, train_loss: 1.2181, test_loss: 1.1802, test_f1: 0.4324
 epoch: 2, train_loss: 1.1864, test_loss: 1.1427, test_f1: 0.4528
 epoch: 3, train_loss: 1.1607, test_loss: 1.1260, test_f1: 0.4358
 epoch: 4, train_loss: 1.1348, test_loss: 1.1042, test_f1: 0.4453
 epoch: 5, train_loss: 1.1098, test_loss: 1.0929, test_f1: 0.4673
 epoch: 6, train_loss: 1.0950, test_loss: 1.0745, test_f1: 0.4588
 epoch: 7, train_loss: 1.0775, test_loss: 1.0592, test_f1: 0.4586
 epoch: 8, train_loss: 1.0668, test_loss: 1.0469, test_f1: 0.4812
 epoch: 9, train_loss: 1.0583, test_loss: 1.0249, test_f1: 0.4644
 epoch: 10, train_loss: 1.0385, test_loss: 1.0281, test_f1: 0.4698
 epoch: 11, train_loss: 1.0212, test_loss: 1.0232, test_f1: 0.4688
 epoch: 12, train_loss: 1.0108, test_loss: 1.0277, test_f1: 0.4718
 epoch: 13, train_loss: 0.9925, test_loss: 1.0221, test_f1: 0.4727
 epoch: 14, train_loss: 0.9835, test_loss: 0.9971, test_f1: 0.5121
 epoch: 15, train_loss: 0.9641, test_loss: 0.9794, test_f1: 0.4819
 epoch: 16, train_loss: 0.9671, test_loss: 0.9775, test_f1: 0.5055
 epoch: 17, train_loss: 0.9416, test_loss: 0.9692, test_f1: 0.5054
 epoch: 18, train_loss: 0.9333, test_loss: 0.9960, test_f1: 0.4829
 epoch: 19, train_loss: 0.9290, test_loss: 0.9741, test_f1: 0.4759
 epoch: 20, train_loss: 0.9155, test_loss: 0.9951, test_f1: 0.4876
 epoch: 21, train_loss: 0.9019, test_loss: 0.9692, test_f1: 0.5023
 epoch: 22, train_loss: 0.8994, test_loss: 0.9749, test_f1: 0.4940
 epoch: 23, train_loss: 0.8905, test_loss: 0.9631, test_f1: 0.4969
 epoch: 24, train_loss: 0.8711, test_loss: 0.9961, test_f1: 0.4908
 epoch: 25, train_loss: 0.8681, test_loss: 0.9862, test_f1: 0.4930
 epoch: 26, train_loss: 0.8620, test_loss: 0.9735, test_f1: 0.5110
 epoch: 27, train_loss: 0.8469, test_loss: 0.9827, test_f1: 0.5036
 epoch: 28, train_loss: 0.8370, test_loss: 1.0150, test_f1: 0.4979
 epoch: 29, train_loss: 0.8251, test_loss: 1.0182, test_f1: 0.4987
 epoch: 30, train_loss: 0.8213, test_loss: 0.9889, test_f1: 0.4952
 epoch: 31, train_loss: 0.8071, test_loss: 0.9924, test_f1: 0.4954
 epoch: 32, train_loss: 0.7956, test_loss: 1.0064, test_f1: 0.5089
 epoch: 33, train_loss: 0.7888, test_loss: 1.0185, test_f1: 0.4953
 epoch: 34, train_loss: 0.7861, test_loss: 0.9992, test_f1: 0.5078
 epoch: 35, train_loss: 0.7683, test_loss: 1.0122, test_f1: 0.5126
 epoch: 36, train_loss: 0.7612, test_loss: 1.0397, test_f1: 0.5191
 epoch: 37, train_loss: 0.7575, test_loss: 0.9949, test_f1: 0.5238
 epoch: 38, train_loss: 0.7432, test_loss: 1.0884, test_f1: 0.5066
 epoch: 39, train_loss: 0.7406, test_loss: 1.1013, test_f1: 0.5096
 epoch: 40, train_loss: 0.7437, test_loss: 1.0842, test_f1: 0.4994
 epoch: 41, train_loss: 0.7340, test_loss: 1.0726, test_f1: 0.5139
 epoch: 42, train_loss: 0.7102, test_loss: 1.1147, test_f1: 0.4781
 epoch: 43, train_loss: 0.7028, test_loss: 1.1009, test_f1: 0.5131
 epoch: 44, train_loss: 0.7158, test_loss: 1.0749, test_f1: 0.5020
 epoch: 45, train_loss: 0.6968, test_loss: 1.1038, test_f1: 0.5089
 epoch: 46, train_loss: 0.6924, test_loss: 1.1345, test_f1: 0.5075
 epoch: 47, train_loss: 0.6720, test_loss: 1.1885, test_f1: 0.4957
 epoch: 48, train_loss: 0.6743, test_loss: 1.2347, test_f1: 0.4944
 epoch: 49, train_loss: 0.6603, test_loss: 1.3055, test_f1: 0.4877
 epoch: 50, train_loss: 0.6591, test_loss: 1.2015, test_f1: 0.5159
 epoch: 51, train_loss: 0.6268, test_loss: 1.1942, test_f1: 0.5159
 epoch: 52, train_loss: 0.6495, test_loss: 1.2608, test_f1: 0.5002
 epoch: 53, train_loss: 0.6332, test_loss: 1.2489, test_f1: 0.5060
 epoch: 54, train_loss: 0.6278, test_loss: 1.2731, test_f1: 0.5069
 epoch: 55, train_loss: 0.6185, test_loss: 1.2272, test_f1: 0.5052
 epoch: 56, train_loss: 0.6272, test_loss: 1.2230, test_f1: 0.5166
 epoch: 57, train_loss: 0.6190, test_loss: 1.2419, test_f1: 0.5133
 epoch: 58, train_loss: 0.6081, test_loss: 1.2737, test_f1: 0.4985
 epoch: 59, train_loss: 0.6046, test_loss: 1.3262, test_f1: 0.4931
 epoch: 60, train_loss: 0.6149, test_loss: 1.2451, test_f1: 0.5221
 epoch: 61, train_loss: 0.6016, test_loss: 1.2644, test_f1: 0.5157
 epoch: 62, train_loss: 0.5869, test_loss: 1.2510, test_f1: 0.5162
 epoch: 63, train_loss: 0.5879, test_loss: 1.2824, test_f1: 0.5207
 epoch: 64, train_loss: 0.6011, test_loss: 1.3171, test_f1: 0.5179
 epoch: 65, train_loss: 0.5761, test_loss: 1.2696, test_f1: 0.5270
 epoch: 66, train_loss: 0.5963, test_loss: 1.2932, test_f1: 0.5263
 epoch: 67, train_loss: 0.5801, test_loss: 1.3382, test_f1: 0.5132
 epoch: 68, train_loss: 0.5720, test_loss: 1.3238, test_f1: 0.5080
 epoch: 69, train_loss: 0.5681, test_loss: 1.3275, test_f1: 0.5173
 epoch: 70, train_loss: 0.5650, test_loss: 1.2811, test_f1: 0.5092
 epoch: 71, train_loss: 0.5709, test_loss: 1.3657, test_f1: 0.5092
 epoch: 72, train_loss: 0.5635, test_loss: 1.2895, test_f1: 0.5125
 epoch: 73, train_loss: 0.5511, test_loss: 1.3603, test_f1: 0.5221
 epoch: 74, train_loss: 0.5506, test_loss: 1.3502, test_f1: 0.5218
 epoch: 75, train_loss: 0.5559, test_loss: 1.3545, test_f1: 0.5292
 epoch: 76, train_loss: 0.5453, test_loss: 1.3858, test_f1: 0.5228
 epoch: 77, train_loss: 0.5537, test_loss: 1.3870, test_f1: 0.5089
 epoch: 78, train_loss: 0.5404, test_loss: 1.4178, test_f1: 0.5135
 epoch: 79, train_loss: 0.5459, test_loss: 1.3996, test_f1: 0.5125
 epoch: 80, train_loss: 0.5360, test_loss: 1.4578, test_f1: 0.5125
 epoch: 81, train_loss: 0.5448, test_loss: 1.4035, test_f1: 0.5137
 epoch: 82, train_loss: 0.5409, test_loss: 1.4123, test_f1: 0.5302
 epoch: 83, train_loss: 0.5444, test_loss: 1.4385, test_f1: 0.5046
 epoch: 84, train_loss: 0.5255, test_loss: 1.4340, test_f1: 0.5094
 epoch: 85, train_loss: 0.5252, test_loss: 1.4232, test_f1: 0.5234
 epoch: 86, train_loss: 0.5056, test_loss: 1.4035, test_f1: 0.5355
 epoch: 87, train_loss: 0.5123, test_loss: 1.4940, test_f1: 0.5313
 epoch: 88, train_loss: 0.5165, test_loss: 1.4727, test_f1: 0.5205
 epoch: 89, train_loss: 0.5291, test_loss: 1.4682, test_f1: 0.5078
 epoch: 90, train_loss: 0.5150, test_loss: 1.4323, test_f1: 0.5354
 epoch: 91, train_loss: 0.5124, test_loss: 1.4236, test_f1: 0.5233
 epoch: 92, train_loss: 0.5081, test_loss: 1.5034, test_f1: 0.5223
 epoch: 93, train_loss: 0.5295, test_loss: 1.5430, test_f1: 0.5184
 epoch: 94, train_loss: 0.4977, test_loss: 1.5901, test_f1: 0.5052
 epoch: 95, train_loss: 0.4918, test_loss: 1.5682, test_f1: 0.5057
 epoch: 96, train_loss: 0.5089, test_loss: 1.4973, test_f1: 0.5178
 epoch: 97, train_loss: 0.4983, test_loss: 1.5478, test_f1: 0.5190
 epoch: 98, train_loss: 0.4768, test_loss: 1.5466, test_f1: 0.5179
 epoch: 99, train_loss: 0.4868, test_loss: 1.5190, test_f1: 0.5157
##################ITERATION #6 ****************************************
 epoch: 0, train_loss: 1.3293, test_loss: 1.2669, test_f1: 0.2656
 epoch: 1, train_loss: 1.2181, test_loss: 1.1931, test_f1: 0.3741
 epoch: 2, train_loss: 1.1902, test_loss: 1.1593, test_f1: 0.4414
 epoch: 3, train_loss: 1.1534, test_loss: 1.1403, test_f1: 0.4499
 epoch: 4, train_loss: 1.1410, test_loss: 1.1197, test_f1: 0.4383
 epoch: 5, train_loss: 1.1279, test_loss: 1.1112, test_f1: 0.4405
 epoch: 6, train_loss: 1.1097, test_loss: 1.0957, test_f1: 0.4395
 epoch: 7, train_loss: 1.0920, test_loss: 1.0888, test_f1: 0.4636
 epoch: 8, train_loss: 1.0778, test_loss: 1.0776, test_f1: 0.4560
 epoch: 9, train_loss: 1.0534, test_loss: 1.0767, test_f1: 0.4573
 epoch: 10, train_loss: 1.0521, test_loss: 1.0730, test_f1: 0.4553
 epoch: 11, train_loss: 1.0346, test_loss: 1.0505, test_f1: 0.4535
 epoch: 12, train_loss: 1.0270, test_loss: 1.0574, test_f1: 0.4593
 epoch: 13, train_loss: 1.0181, test_loss: 1.0454, test_f1: 0.4499
 epoch: 14, train_loss: 1.0035, test_loss: 1.0515, test_f1: 0.4678
 epoch: 15, train_loss: 0.9886, test_loss: 1.0356, test_f1: 0.4801
 epoch: 16, train_loss: 0.9801, test_loss: 1.0297, test_f1: 0.4720
 epoch: 17, train_loss: 0.9615, test_loss: 1.0414, test_f1: 0.4596
 epoch: 18, train_loss: 0.9580, test_loss: 1.0069, test_f1: 0.4779
 epoch: 19, train_loss: 0.9447, test_loss: 1.0442, test_f1: 0.4738
 epoch: 20, train_loss: 0.9431, test_loss: 1.0342, test_f1: 0.4834
 epoch: 21, train_loss: 0.9330, test_loss: 1.0430, test_f1: 0.4895
 epoch: 22, train_loss: 0.9289, test_loss: 1.0350, test_f1: 0.4759
 epoch: 23, train_loss: 0.9195, test_loss: 1.0397, test_f1: 0.4756
 epoch: 24, train_loss: 0.8976, test_loss: 1.0431, test_f1: 0.4834
 epoch: 25, train_loss: 0.8966, test_loss: 1.0468, test_f1: 0.4770
 epoch: 26, train_loss: 0.8915, test_loss: 1.0655, test_f1: 0.4739
 epoch: 27, train_loss: 0.8846, test_loss: 1.0474, test_f1: 0.4908
 epoch: 28, train_loss: 0.8720, test_loss: 1.0656, test_f1: 0.4828
 epoch: 29, train_loss: 0.8605, test_loss: 1.0452, test_f1: 0.4898
 epoch: 30, train_loss: 0.8521, test_loss: 1.0525, test_f1: 0.4951
 epoch: 31, train_loss: 0.8482, test_loss: 1.0465, test_f1: 0.5139
 epoch: 32, train_loss: 0.8359, test_loss: 1.0376, test_f1: 0.4875
 epoch: 33, train_loss: 0.8157, test_loss: 1.0932, test_f1: 0.4886
 epoch: 34, train_loss: 0.8175, test_loss: 1.0698, test_f1: 0.4915
 epoch: 35, train_loss: 0.8082, test_loss: 1.0707, test_f1: 0.5000
 epoch: 36, train_loss: 0.8124, test_loss: 1.0975, test_f1: 0.4786
 epoch: 37, train_loss: 0.7979, test_loss: 1.0566, test_f1: 0.5086
 epoch: 38, train_loss: 0.7703, test_loss: 1.0679, test_f1: 0.5090
 epoch: 39, train_loss: 0.7924, test_loss: 1.0805, test_f1: 0.5052
 epoch: 40, train_loss: 0.7844, test_loss: 1.0963, test_f1: 0.4927
 epoch: 41, train_loss: 0.7731, test_loss: 1.0761, test_f1: 0.5079
 epoch: 42, train_loss: 0.7528, test_loss: 1.0688, test_f1: 0.5150
 epoch: 43, train_loss: 0.7505, test_loss: 1.0786, test_f1: 0.5202
 epoch: 44, train_loss: 0.7348, test_loss: 1.0608, test_f1: 0.5011
 epoch: 45, train_loss: 0.7298, test_loss: 1.1255, test_f1: 0.5070
 epoch: 46, train_loss: 0.7316, test_loss: 1.1200, test_f1: 0.5171
 epoch: 47, train_loss: 0.7185, test_loss: 1.1390, test_f1: 0.5296
 epoch: 48, train_loss: 0.7194, test_loss: 1.1261, test_f1: 0.5169
 epoch: 49, train_loss: 0.7033, test_loss: 1.1122, test_f1: 0.5272
 epoch: 50, train_loss: 0.7179, test_loss: 1.1608, test_f1: 0.5162
 epoch: 51, train_loss: 0.6880, test_loss: 1.1648, test_f1: 0.5148
 epoch: 52, train_loss: 0.6890, test_loss: 1.1619, test_f1: 0.5366
 epoch: 53, train_loss: 0.6733, test_loss: 1.1553, test_f1: 0.5103
 epoch: 54, train_loss: 0.6741, test_loss: 1.1692, test_f1: 0.5088
 epoch: 55, train_loss: 0.6710, test_loss: 1.1944, test_f1: 0.5230
 epoch: 56, train_loss: 0.6543, test_loss: 1.2060, test_f1: 0.5227
 epoch: 57, train_loss: 0.6563, test_loss: 1.1836, test_f1: 0.5211
 epoch: 58, train_loss: 0.6535, test_loss: 1.2119, test_f1: 0.5017
 epoch: 59, train_loss: 0.6538, test_loss: 1.2094, test_f1: 0.5163
 epoch: 60, train_loss: 0.6413, test_loss: 1.2463, test_f1: 0.5178
 epoch: 61, train_loss: 0.6448, test_loss: 1.2130, test_f1: 0.5425
 epoch: 62, train_loss: 0.6461, test_loss: 1.2320, test_f1: 0.5324
 epoch: 63, train_loss: 0.6495, test_loss: 1.2457, test_f1: 0.5385
 epoch: 64, train_loss: 0.6288, test_loss: 1.2337, test_f1: 0.5304
 epoch: 65, train_loss: 0.6467, test_loss: 1.2356, test_f1: 0.5240
 epoch: 66, train_loss: 0.6243, test_loss: 1.2590, test_f1: 0.5342
 epoch: 67, train_loss: 0.6184, test_loss: 1.2103, test_f1: 0.5454
 epoch: 68, train_loss: 0.6166, test_loss: 1.2549, test_f1: 0.5385
 epoch: 69, train_loss: 0.6377, test_loss: 1.2587, test_f1: 0.5405
 epoch: 70, train_loss: 0.6136, test_loss: 1.2673, test_f1: 0.5253
 epoch: 71, train_loss: 0.6218, test_loss: 1.2768, test_f1: 0.5238
 epoch: 72, train_loss: 0.6224, test_loss: 1.3324, test_f1: 0.5390
 epoch: 73, train_loss: 0.6220, test_loss: 1.2836, test_f1: 0.5427
 epoch: 74, train_loss: 0.5878, test_loss: 1.2747, test_f1: 0.5518
 epoch: 75, train_loss: 0.6017, test_loss: 1.2959, test_f1: 0.5449
 epoch: 76, train_loss: 0.6169, test_loss: 1.2743, test_f1: 0.5236
 epoch: 77, train_loss: 0.5767, test_loss: 1.3192, test_f1: 0.5434
 epoch: 78, train_loss: 0.6128, test_loss: 1.3227, test_f1: 0.5318
 epoch: 79, train_loss: 0.5976, test_loss: 1.3250, test_f1: 0.5367
 epoch: 80, train_loss: 0.5875, test_loss: 1.2997, test_f1: 0.5412
 epoch: 81, train_loss: 0.5819, test_loss: 1.2762, test_f1: 0.5409
 epoch: 82, train_loss: 0.5955, test_loss: 1.2906, test_f1: 0.5343
 epoch: 83, train_loss: 0.5789, test_loss: 1.3479, test_f1: 0.5209
 epoch: 84, train_loss: 0.5755, test_loss: 1.3409, test_f1: 0.5372
 epoch: 85, train_loss: 0.5728, test_loss: 1.3262, test_f1: 0.5250
 epoch: 86, train_loss: 0.5665, test_loss: 1.3361, test_f1: 0.5340
 epoch: 87, train_loss: 0.5817, test_loss: 1.3521, test_f1: 0.5293
 epoch: 88, train_loss: 0.5739, test_loss: 1.3745, test_f1: 0.5262
 epoch: 89, train_loss: 0.5606, test_loss: 1.3602, test_f1: 0.5327
 epoch: 90, train_loss: 0.5745, test_loss: 1.3809, test_f1: 0.5340
 epoch: 91, train_loss: 0.5723, test_loss: 1.3669, test_f1: 0.5379
 epoch: 92, train_loss: 0.5754, test_loss: 1.3676, test_f1: 0.5411
 epoch: 93, train_loss: 0.5507, test_loss: 1.3981, test_f1: 0.5288
 epoch: 94, train_loss: 0.5540, test_loss: 1.3398, test_f1: 0.5334
 epoch: 95, train_loss: 0.5662, test_loss: 1.3656, test_f1: 0.5405
 epoch: 96, train_loss: 0.5355, test_loss: 1.3665, test_f1: 0.5290
 epoch: 97, train_loss: 0.5418, test_loss: 1.3657, test_f1: 0.5350
 epoch: 98, train_loss: 0.5505, test_loss: 1.3407, test_f1: 0.5364
 epoch: 99, train_loss: 0.5435, test_loss: 1.3760, test_f1: 0.5348
##################ITERATION #7 ****************************************
 epoch: 0, train_loss: 1.3323, test_loss: 1.2700, test_f1: 0.2863
 epoch: 1, train_loss: 1.2495, test_loss: 1.2064, test_f1: 0.4124
 epoch: 2, train_loss: 1.2185, test_loss: 1.1721, test_f1: 0.4686
 epoch: 3, train_loss: 1.1839, test_loss: 1.1345, test_f1: 0.4700
 epoch: 4, train_loss: 1.1691, test_loss: 1.1165, test_f1: 0.4594
 epoch: 5, train_loss: 1.1521, test_loss: 1.1009, test_f1: 0.4796
 epoch: 6, train_loss: 1.1271, test_loss: 1.0938, test_f1: 0.4680
 epoch: 7, train_loss: 1.1249, test_loss: 1.0808, test_f1: 0.4768
 epoch: 8, train_loss: 1.1136, test_loss: 1.0673, test_f1: 0.4632
 epoch: 9, train_loss: 1.0918, test_loss: 1.0719, test_f1: 0.4542
 epoch: 10, train_loss: 1.0918, test_loss: 1.0608, test_f1: 0.4564
 epoch: 11, train_loss: 1.0733, test_loss: 1.0568, test_f1: 0.4661
 epoch: 12, train_loss: 1.0709, test_loss: 1.0480, test_f1: 0.4605
 epoch: 13, train_loss: 1.0673, test_loss: 1.0363, test_f1: 0.4668
 epoch: 14, train_loss: 1.0551, test_loss: 1.0334, test_f1: 0.4806
 epoch: 15, train_loss: 1.0311, test_loss: 1.0351, test_f1: 0.4656
 epoch: 16, train_loss: 1.0220, test_loss: 1.0316, test_f1: 0.4703
 epoch: 17, train_loss: 1.0209, test_loss: 1.0252, test_f1: 0.4705
 epoch: 18, train_loss: 1.0005, test_loss: 1.0257, test_f1: 0.4609
 epoch: 19, train_loss: 1.0067, test_loss: 1.0076, test_f1: 0.4773
 epoch: 20, train_loss: 0.9869, test_loss: 1.0086, test_f1: 0.4743
 epoch: 21, train_loss: 0.9795, test_loss: 1.0179, test_f1: 0.4806
 epoch: 22, train_loss: 0.9811, test_loss: 1.0091, test_f1: 0.4814
 epoch: 23, train_loss: 0.9640, test_loss: 1.0001, test_f1: 0.4971
 epoch: 24, train_loss: 0.9524, test_loss: 1.0208, test_f1: 0.4778
 epoch: 25, train_loss: 0.9500, test_loss: 1.0100, test_f1: 0.4942
 epoch: 26, train_loss: 0.9474, test_loss: 1.0010, test_f1: 0.4951
 epoch: 27, train_loss: 0.9237, test_loss: 0.9951, test_f1: 0.4936
 epoch: 28, train_loss: 0.9147, test_loss: 1.0095, test_f1: 0.4808
 epoch: 29, train_loss: 0.9036, test_loss: 1.0215, test_f1: 0.4765
 epoch: 30, train_loss: 0.8977, test_loss: 1.0278, test_f1: 0.4906
 epoch: 31, train_loss: 0.8908, test_loss: 1.0495, test_f1: 0.5028
 epoch: 32, train_loss: 0.8947, test_loss: 1.0175, test_f1: 0.4992
 epoch: 33, train_loss: 0.8795, test_loss: 1.0239, test_f1: 0.5104
 epoch: 34, train_loss: 0.8792, test_loss: 1.0493, test_f1: 0.5139
 epoch: 35, train_loss: 0.8538, test_loss: 1.0616, test_f1: 0.5117
 epoch: 36, train_loss: 0.8553, test_loss: 1.0492, test_f1: 0.4963
 epoch: 37, train_loss: 0.8579, test_loss: 1.0594, test_f1: 0.4977
 epoch: 38, train_loss: 0.8579, test_loss: 1.0637, test_f1: 0.4837
 epoch: 39, train_loss: 0.8356, test_loss: 1.0571, test_f1: 0.4891
 epoch: 40, train_loss: 0.8283, test_loss: 1.0626, test_f1: 0.5081
 epoch: 41, train_loss: 0.8249, test_loss: 1.0642, test_f1: 0.5248
 epoch: 42, train_loss: 0.8136, test_loss: 1.0783, test_f1: 0.4952
 epoch: 43, train_loss: 0.8141, test_loss: 1.0474, test_f1: 0.5220
 epoch: 44, train_loss: 0.8027, test_loss: 1.0926, test_f1: 0.4935
 epoch: 45, train_loss: 0.7864, test_loss: 1.0883, test_f1: 0.5071
 epoch: 46, train_loss: 0.8007, test_loss: 1.0871, test_f1: 0.4971
 epoch: 47, train_loss: 0.7774, test_loss: 1.1219, test_f1: 0.5096
 epoch: 48, train_loss: 0.7694, test_loss: 1.1274, test_f1: 0.4910
 epoch: 49, train_loss: 0.7710, test_loss: 1.1245, test_f1: 0.5190
 epoch: 50, train_loss: 0.7606, test_loss: 1.1437, test_f1: 0.4823
 epoch: 51, train_loss: 0.7526, test_loss: 1.1326, test_f1: 0.5073
 epoch: 52, train_loss: 0.7453, test_loss: 1.1374, test_f1: 0.5015
 epoch: 53, train_loss: 0.7447, test_loss: 1.1380, test_f1: 0.5058
 epoch: 54, train_loss: 0.7366, test_loss: 1.1593, test_f1: 0.4970
 epoch: 55, train_loss: 0.7154, test_loss: 1.1502, test_f1: 0.5029
 epoch: 56, train_loss: 0.7240, test_loss: 1.1461, test_f1: 0.5010
 epoch: 57, train_loss: 0.7203, test_loss: 1.1602, test_f1: 0.5056
 epoch: 58, train_loss: 0.7251, test_loss: 1.1727, test_f1: 0.5021
 epoch: 59, train_loss: 0.7089, test_loss: 1.1933, test_f1: 0.4914
 epoch: 60, train_loss: 0.7145, test_loss: 1.2083, test_f1: 0.4960
 epoch: 61, train_loss: 0.7079, test_loss: 1.1958, test_f1: 0.4953
 epoch: 62, train_loss: 0.7061, test_loss: 1.1976, test_f1: 0.5124
 epoch: 63, train_loss: 0.6956, test_loss: 1.1944, test_f1: 0.5185
 epoch: 64, train_loss: 0.6916, test_loss: 1.2048, test_f1: 0.5114
 epoch: 65, train_loss: 0.6821, test_loss: 1.2694, test_f1: 0.5084
 epoch: 66, train_loss: 0.6771, test_loss: 1.2236, test_f1: 0.5135
 epoch: 67, train_loss: 0.6863, test_loss: 1.2537, test_f1: 0.5016
 epoch: 68, train_loss: 0.6671, test_loss: 1.2244, test_f1: 0.5185
 epoch: 69, train_loss: 0.6798, test_loss: 1.2432, test_f1: 0.5096
 epoch: 70, train_loss: 0.6681, test_loss: 1.2233, test_f1: 0.5120
 epoch: 71, train_loss: 0.6649, test_loss: 1.2535, test_f1: 0.5086
 epoch: 72, train_loss: 0.6688, test_loss: 1.2430, test_f1: 0.5140
 epoch: 73, train_loss: 0.6606, test_loss: 1.2754, test_f1: 0.5229
 epoch: 74, train_loss: 0.6652, test_loss: 1.2969, test_f1: 0.5047
 epoch: 75, train_loss: 0.6586, test_loss: 1.3161, test_f1: 0.5099
 epoch: 76, train_loss: 0.6382, test_loss: 1.2758, test_f1: 0.5258
 epoch: 77, train_loss: 0.6486, test_loss: 1.2774, test_f1: 0.5250
 epoch: 78, train_loss: 0.6462, test_loss: 1.2989, test_f1: 0.5193
 epoch: 79, train_loss: 0.6442, test_loss: 1.3139, test_f1: 0.5214
 epoch: 80, train_loss: 0.6231, test_loss: 1.3105, test_f1: 0.5181
 epoch: 81, train_loss: 0.6388, test_loss: 1.3529, test_f1: 0.5225
 epoch: 82, train_loss: 0.6293, test_loss: 1.3286, test_f1: 0.5175
 epoch: 83, train_loss: 0.6457, test_loss: 1.3149, test_f1: 0.5218
 epoch: 84, train_loss: 0.6191, test_loss: 1.3889, test_f1: 0.5022
 epoch: 85, train_loss: 0.6130, test_loss: 1.3222, test_f1: 0.5218
 epoch: 86, train_loss: 0.6196, test_loss: 1.3598, test_f1: 0.5185
 epoch: 87, train_loss: 0.6219, test_loss: 1.3596, test_f1: 0.5208
 epoch: 88, train_loss: 0.6283, test_loss: 1.4009, test_f1: 0.5139
 epoch: 89, train_loss: 0.6136, test_loss: 1.4041, test_f1: 0.5246
 epoch: 90, train_loss: 0.6027, test_loss: 1.3916, test_f1: 0.5214
 epoch: 91, train_loss: 0.6125, test_loss: 1.4449, test_f1: 0.5212
 epoch: 92, train_loss: 0.5947, test_loss: 1.4198, test_f1: 0.5298
 epoch: 93, train_loss: 0.5908, test_loss: 1.4252, test_f1: 0.5175
 epoch: 94, train_loss: 0.5850, test_loss: 1.4179, test_f1: 0.5355
 epoch: 95, train_loss: 0.6064, test_loss: 1.4325, test_f1: 0.5213
 epoch: 96, train_loss: 0.6068, test_loss: 1.4387, test_f1: 0.5183
 epoch: 97, train_loss: 0.5869, test_loss: 1.4557, test_f1: 0.5301
 epoch: 98, train_loss: 0.5798, test_loss: 1.4304, test_f1: 0.5250
 epoch: 99, train_loss: 0.5750, test_loss: 1.4704, test_f1: 0.5231
##################ITERATION #8 ****************************************
 epoch: 0, train_loss: 1.3508, test_loss: 1.2420, test_f1: 0.3565
 epoch: 1, train_loss: 1.2231, test_loss: 1.1702, test_f1: 0.4545
 epoch: 2, train_loss: 1.1911, test_loss: 1.1354, test_f1: 0.4376
 epoch: 3, train_loss: 1.1565, test_loss: 1.1235, test_f1: 0.4550
 epoch: 4, train_loss: 1.1317, test_loss: 1.1113, test_f1: 0.4518
 epoch: 5, train_loss: 1.1250, test_loss: 1.0866, test_f1: 0.4384
 epoch: 6, train_loss: 1.1217, test_loss: 1.0765, test_f1: 0.4318
 epoch: 7, train_loss: 1.0879, test_loss: 1.0809, test_f1: 0.4332
 epoch: 8, train_loss: 1.0763, test_loss: 1.0872, test_f1: 0.4232
 epoch: 9, train_loss: 1.0541, test_loss: 1.0580, test_f1: 0.4349
 epoch: 10, train_loss: 1.0482, test_loss: 1.0398, test_f1: 0.4682
 epoch: 11, train_loss: 1.0400, test_loss: 1.0491, test_f1: 0.4353
 epoch: 12, train_loss: 1.0144, test_loss: 1.0484, test_f1: 0.4447
 epoch: 13, train_loss: 1.0146, test_loss: 1.0366, test_f1: 0.4488
 epoch: 14, train_loss: 1.0018, test_loss: 1.0386, test_f1: 0.4574
 epoch: 15, train_loss: 0.9955, test_loss: 1.0214, test_f1: 0.4369
 epoch: 16, train_loss: 0.9691, test_loss: 1.0208, test_f1: 0.4611
 epoch: 17, train_loss: 0.9801, test_loss: 1.0265, test_f1: 0.4504
 epoch: 18, train_loss: 0.9683, test_loss: 0.9984, test_f1: 0.4757
 epoch: 19, train_loss: 0.9499, test_loss: 1.0279, test_f1: 0.4599
 epoch: 20, train_loss: 0.9499, test_loss: 1.0188, test_f1: 0.4614
 epoch: 21, train_loss: 0.9361, test_loss: 1.0131, test_f1: 0.4743
 epoch: 22, train_loss: 0.9391, test_loss: 0.9905, test_f1: 0.4799
 epoch: 23, train_loss: 0.9237, test_loss: 1.0399, test_f1: 0.4629
 epoch: 24, train_loss: 0.9196, test_loss: 1.0032, test_f1: 0.4854
 epoch: 25, train_loss: 0.9071, test_loss: 1.0257, test_f1: 0.4812
 epoch: 26, train_loss: 0.9062, test_loss: 1.0218, test_f1: 0.4717
 epoch: 27, train_loss: 0.8866, test_loss: 1.0230, test_f1: 0.4589
 epoch: 28, train_loss: 0.8781, test_loss: 1.0455, test_f1: 0.4897
 epoch: 29, train_loss: 0.8754, test_loss: 1.0297, test_f1: 0.4831
 epoch: 30, train_loss: 0.8563, test_loss: 1.0284, test_f1: 0.4894
 epoch: 31, train_loss: 0.8644, test_loss: 1.0162, test_f1: 0.4926
 epoch: 32, train_loss: 0.8524, test_loss: 1.0252, test_f1: 0.4890
 epoch: 33, train_loss: 0.8359, test_loss: 1.0390, test_f1: 0.4934
 epoch: 34, train_loss: 0.8269, test_loss: 1.0590, test_f1: 0.4836
 epoch: 35, train_loss: 0.8256, test_loss: 1.0311, test_f1: 0.4887
 epoch: 36, train_loss: 0.8191, test_loss: 1.0335, test_f1: 0.4937
 epoch: 37, train_loss: 0.8115, test_loss: 1.0321, test_f1: 0.4896
 epoch: 38, train_loss: 0.7972, test_loss: 1.0176, test_f1: 0.4928
 epoch: 39, train_loss: 0.7868, test_loss: 1.0330, test_f1: 0.4774
 epoch: 40, train_loss: 0.8042, test_loss: 1.0506, test_f1: 0.4881
 epoch: 41, train_loss: 0.7754, test_loss: 1.0520, test_f1: 0.5057
 epoch: 42, train_loss: 0.7836, test_loss: 1.0638, test_f1: 0.4937
 epoch: 43, train_loss: 0.7690, test_loss: 1.0371, test_f1: 0.5154
 epoch: 44, train_loss: 0.7669, test_loss: 1.0824, test_f1: 0.5056
 epoch: 45, train_loss: 0.7529, test_loss: 1.0460, test_f1: 0.5139
 epoch: 46, train_loss: 0.7304, test_loss: 1.0737, test_f1: 0.5062
 epoch: 47, train_loss: 0.7366, test_loss: 1.0754, test_f1: 0.5055
 epoch: 48, train_loss: 0.7511, test_loss: 1.0799, test_f1: 0.5156
 epoch: 49, train_loss: 0.7501, test_loss: 1.1134, test_f1: 0.5089
 epoch: 50, train_loss: 0.7191, test_loss: 1.0780, test_f1: 0.4854
 epoch: 51, train_loss: 0.7232, test_loss: 1.0924, test_f1: 0.5216
 epoch: 52, train_loss: 0.7000, test_loss: 1.0988, test_f1: 0.4990
 epoch: 53, train_loss: 0.7175, test_loss: 1.0882, test_f1: 0.5087
 epoch: 54, train_loss: 0.6901, test_loss: 1.1231, test_f1: 0.5030
 epoch: 55, train_loss: 0.6882, test_loss: 1.1351, test_f1: 0.4999
 epoch: 56, train_loss: 0.6963, test_loss: 1.1218, test_f1: 0.5107
 epoch: 57, train_loss: 0.6848, test_loss: 1.1237, test_f1: 0.5196
 epoch: 58, train_loss: 0.6859, test_loss: 1.1437, test_f1: 0.5095
 epoch: 59, train_loss: 0.6800, test_loss: 1.1564, test_f1: 0.5057
 epoch: 60, train_loss: 0.6734, test_loss: 1.1584, test_f1: 0.5094
 epoch: 61, train_loss: 0.6698, test_loss: 1.1391, test_f1: 0.5122
 epoch: 62, train_loss: 0.6650, test_loss: 1.1240, test_f1: 0.5214
 epoch: 63, train_loss: 0.6635, test_loss: 1.1363, test_f1: 0.5380
 epoch: 64, train_loss: 0.6643, test_loss: 1.1680, test_f1: 0.5103
 epoch: 65, train_loss: 0.6825, test_loss: 1.1421, test_f1: 0.5150
 epoch: 66, train_loss: 0.6640, test_loss: 1.1521, test_f1: 0.5087
 epoch: 67, train_loss: 0.6487, test_loss: 1.1612, test_f1: 0.5226
 epoch: 68, train_loss: 0.6379, test_loss: 1.1535, test_f1: 0.5245
 epoch: 69, train_loss: 0.6415, test_loss: 1.1388, test_f1: 0.5316
 epoch: 70, train_loss: 0.6439, test_loss: 1.1628, test_f1: 0.5326
 epoch: 71, train_loss: 0.6326, test_loss: 1.1725, test_f1: 0.5314
 epoch: 72, train_loss: 0.6576, test_loss: 1.1631, test_f1: 0.5007
 epoch: 73, train_loss: 0.6394, test_loss: 1.1489, test_f1: 0.5263
 epoch: 74, train_loss: 0.6220, test_loss: 1.1649, test_f1: 0.5254
 epoch: 75, train_loss: 0.6489, test_loss: 1.2065, test_f1: 0.5058
 epoch: 76, train_loss: 0.6301, test_loss: 1.1979, test_f1: 0.5264
 epoch: 77, train_loss: 0.6141, test_loss: 1.2221, test_f1: 0.5267
 epoch: 78, train_loss: 0.6295, test_loss: 1.1819, test_f1: 0.5278
 epoch: 79, train_loss: 0.6165, test_loss: 1.1927, test_f1: 0.5309
 epoch: 80, train_loss: 0.6318, test_loss: 1.2298, test_f1: 0.5162
 epoch: 81, train_loss: 0.6170, test_loss: 1.2007, test_f1: 0.5288
 epoch: 82, train_loss: 0.6291, test_loss: 1.2162, test_f1: 0.5090
 epoch: 83, train_loss: 0.6125, test_loss: 1.2110, test_f1: 0.5251
 epoch: 84, train_loss: 0.6137, test_loss: 1.1916, test_f1: 0.5352
 epoch: 85, train_loss: 0.5942, test_loss: 1.2275, test_f1: 0.5191
 epoch: 86, train_loss: 0.6083, test_loss: 1.2174, test_f1: 0.5165
 epoch: 87, train_loss: 0.5967, test_loss: 1.1926, test_f1: 0.5285
 epoch: 88, train_loss: 0.5939, test_loss: 1.2168, test_f1: 0.5316
 epoch: 89, train_loss: 0.5995, test_loss: 1.2292, test_f1: 0.5184
 epoch: 90, train_loss: 0.6000, test_loss: 1.2303, test_f1: 0.5165
 epoch: 91, train_loss: 0.5992, test_loss: 1.2282, test_f1: 0.5314
 epoch: 92, train_loss: 0.5978, test_loss: 1.2190, test_f1: 0.5230
 epoch: 93, train_loss: 0.5733, test_loss: 1.2618, test_f1: 0.5119
 epoch: 94, train_loss: 0.5831, test_loss: 1.2358, test_f1: 0.5202
 epoch: 95, train_loss: 0.5793, test_loss: 1.2099, test_f1: 0.5450
 epoch: 96, train_loss: 0.5851, test_loss: 1.2715, test_f1: 0.5120
 epoch: 97, train_loss: 0.5667, test_loss: 1.2839, test_f1: 0.5254
 epoch: 98, train_loss: 0.5719, test_loss: 1.2521, test_f1: 0.5266
 epoch: 99, train_loss: 0.5865, test_loss: 1.2872, test_f1: 0.5175
##################ITERATION #9 ****************************************
 epoch: 0, train_loss: 1.3498, test_loss: 1.2952, test_f1: 0.3272
 epoch: 1, train_loss: 1.2409, test_loss: 1.2107, test_f1: 0.3952
 epoch: 2, train_loss: 1.2091, test_loss: 1.1560, test_f1: 0.4641
 epoch: 3, train_loss: 1.1756, test_loss: 1.1214, test_f1: 0.4535
 epoch: 4, train_loss: 1.1586, test_loss: 1.0869, test_f1: 0.4843
 epoch: 5, train_loss: 1.1344, test_loss: 1.0929, test_f1: 0.4526
 epoch: 6, train_loss: 1.1109, test_loss: 1.0745, test_f1: 0.4789
 epoch: 7, train_loss: 1.0894, test_loss: 1.0631, test_f1: 0.4769
 epoch: 8, train_loss: 1.0920, test_loss: 1.0456, test_f1: 0.4879
 epoch: 9, train_loss: 1.0839, test_loss: 1.0604, test_f1: 0.4440
 epoch: 10, train_loss: 1.0516, test_loss: 1.0308, test_f1: 0.4642
 epoch: 11, train_loss: 1.0523, test_loss: 1.0301, test_f1: 0.4661
 epoch: 12, train_loss: 1.0464, test_loss: 1.0236, test_f1: 0.4848
 epoch: 13, train_loss: 1.0392, test_loss: 1.0083, test_f1: 0.4774
 epoch: 14, train_loss: 1.0431, test_loss: 0.9977, test_f1: 0.4824
 epoch: 15, train_loss: 1.0032, test_loss: 1.0071, test_f1: 0.4540
 epoch: 16, train_loss: 0.9954, test_loss: 1.0024, test_f1: 0.4607
 epoch: 17, train_loss: 0.9776, test_loss: 0.9846, test_f1: 0.4828
 epoch: 18, train_loss: 0.9685, test_loss: 1.0008, test_f1: 0.4821
 epoch: 19, train_loss: 0.9723, test_loss: 1.0110, test_f1: 0.4616
 epoch: 20, train_loss: 0.9567, test_loss: 0.9984, test_f1: 0.4880
 epoch: 21, train_loss: 0.9530, test_loss: 0.9975, test_f1: 0.4943
 epoch: 22, train_loss: 0.9398, test_loss: 1.0092, test_f1: 0.4893
 epoch: 23, train_loss: 0.9378, test_loss: 1.0044, test_f1: 0.4983
 epoch: 24, train_loss: 0.9248, test_loss: 0.9847, test_f1: 0.4912
 epoch: 25, train_loss: 0.9062, test_loss: 1.0538, test_f1: 0.4877
 epoch: 26, train_loss: 0.9078, test_loss: 0.9948, test_f1: 0.5064
 epoch: 27, train_loss: 0.8888, test_loss: 1.0070, test_f1: 0.4793
 epoch: 28, train_loss: 0.8844, test_loss: 0.9838, test_f1: 0.5346
 epoch: 29, train_loss: 0.8556, test_loss: 0.9674, test_f1: 0.5268
 epoch: 30, train_loss: 0.8781, test_loss: 0.9869, test_f1: 0.4979
 epoch: 31, train_loss: 0.8609, test_loss: 1.0128, test_f1: 0.5103
 epoch: 32, train_loss: 0.8580, test_loss: 0.9923, test_f1: 0.5153
 epoch: 33, train_loss: 0.8615, test_loss: 0.9593, test_f1: 0.5206
 epoch: 34, train_loss: 0.8351, test_loss: 0.9634, test_f1: 0.5150
 epoch: 35, train_loss: 0.8274, test_loss: 0.9743, test_f1: 0.5388
 epoch: 36, train_loss: 0.8271, test_loss: 0.9925, test_f1: 0.5077
 epoch: 37, train_loss: 0.8222, test_loss: 1.0039, test_f1: 0.5060
 epoch: 38, train_loss: 0.8048, test_loss: 1.0190, test_f1: 0.5052
 epoch: 39, train_loss: 0.8067, test_loss: 1.0605, test_f1: 0.4804
 epoch: 40, train_loss: 0.7866, test_loss: 1.0118, test_f1: 0.5126
 epoch: 41, train_loss: 0.7752, test_loss: 1.0681, test_f1: 0.5018
 epoch: 42, train_loss: 0.7843, test_loss: 1.0488, test_f1: 0.5101
 epoch: 43, train_loss: 0.7640, test_loss: 1.0145, test_f1: 0.5238
 epoch: 44, train_loss: 0.7646, test_loss: 1.0419, test_f1: 0.5123
 epoch: 45, train_loss: 0.7481, test_loss: 1.0548, test_f1: 0.5260
 epoch: 46, train_loss: 0.7564, test_loss: 1.0131, test_f1: 0.5384
 epoch: 47, train_loss: 0.7396, test_loss: 1.0700, test_f1: 0.5079
 epoch: 48, train_loss: 0.7338, test_loss: 1.0593, test_f1: 0.5120
 epoch: 49, train_loss: 0.7343, test_loss: 1.0299, test_f1: 0.5340
 epoch: 50, train_loss: 0.7182, test_loss: 1.0607, test_f1: 0.5276
 epoch: 51, train_loss: 0.7203, test_loss: 1.0594, test_f1: 0.5165
 epoch: 52, train_loss: 0.7017, test_loss: 1.0587, test_f1: 0.5306
 epoch: 53, train_loss: 0.6900, test_loss: 1.0510, test_f1: 0.5399
 epoch: 54, train_loss: 0.6917, test_loss: 1.0905, test_f1: 0.5248
 epoch: 55, train_loss: 0.6860, test_loss: 1.0878, test_f1: 0.5211
 epoch: 56, train_loss: 0.6790, test_loss: 1.0676, test_f1: 0.5163
 epoch: 57, train_loss: 0.6874, test_loss: 1.0735, test_f1: 0.5328
 epoch: 58, train_loss: 0.6905, test_loss: 1.0769, test_f1: 0.5315
 epoch: 59, train_loss: 0.6733, test_loss: 1.0858, test_f1: 0.5288
 epoch: 60, train_loss: 0.6790, test_loss: 1.0806, test_f1: 0.5376
 epoch: 61, train_loss: 0.6764, test_loss: 1.0813, test_f1: 0.5499
 epoch: 62, train_loss: 0.6695, test_loss: 1.0873, test_f1: 0.5438
 epoch: 63, train_loss: 0.6741, test_loss: 1.1058, test_f1: 0.5402
 epoch: 64, train_loss: 0.6606, test_loss: 1.1058, test_f1: 0.5381
 epoch: 65, train_loss: 0.6439, test_loss: 1.1077, test_f1: 0.5343
 epoch: 66, train_loss: 0.6556, test_loss: 1.1313, test_f1: 0.5386
 epoch: 67, train_loss: 0.6526, test_loss: 1.1232, test_f1: 0.5316
 epoch: 68, train_loss: 0.6566, test_loss: 1.1348, test_f1: 0.5370
 epoch: 69, train_loss: 0.6423, test_loss: 1.1515, test_f1: 0.5192
 epoch: 70, train_loss: 0.6527, test_loss: 1.1238, test_f1: 0.5280
 epoch: 71, train_loss: 0.6598, test_loss: 1.2101, test_f1: 0.5211
 epoch: 72, train_loss: 0.6423, test_loss: 1.1785, test_f1: 0.5150
 epoch: 73, train_loss: 0.6559, test_loss: 1.1646, test_f1: 0.5196
 epoch: 74, train_loss: 0.6320, test_loss: 1.1606, test_f1: 0.5231
 epoch: 75, train_loss: 0.6302, test_loss: 1.1683, test_f1: 0.5280
 epoch: 76, train_loss: 0.6201, test_loss: 1.1811, test_f1: 0.5408
 epoch: 77, train_loss: 0.6199, test_loss: 1.1592, test_f1: 0.5330
 epoch: 78, train_loss: 0.6204, test_loss: 1.1722, test_f1: 0.5272
 epoch: 79, train_loss: 0.6190, test_loss: 1.1803, test_f1: 0.5141
 epoch: 80, train_loss: 0.6194, test_loss: 1.1694, test_f1: 0.5193
 epoch: 81, train_loss: 0.6141, test_loss: 1.1737, test_f1: 0.5334
 epoch: 82, train_loss: 0.6136, test_loss: 1.2073, test_f1: 0.5390
 epoch: 83, train_loss: 0.6126, test_loss: 1.2647, test_f1: 0.5384
 epoch: 84, train_loss: 0.5922, test_loss: 1.1815, test_f1: 0.5348
 epoch: 85, train_loss: 0.6026, test_loss: 1.2277, test_f1: 0.5246
 epoch: 86, train_loss: 0.6026, test_loss: 1.2611, test_f1: 0.5266
 epoch: 87, train_loss: 0.5973, test_loss: 1.2606, test_f1: 0.5423
 epoch: 88, train_loss: 0.5807, test_loss: 1.2651, test_f1: 0.5280
 epoch: 89, train_loss: 0.5847, test_loss: 1.2135, test_f1: 0.5472
 epoch: 90, train_loss: 0.5765, test_loss: 1.2301, test_f1: 0.5221
 epoch: 91, train_loss: 0.5885, test_loss: 1.2382, test_f1: 0.5309
 epoch: 92, train_loss: 0.5795, test_loss: 1.2742, test_f1: 0.5266
 epoch: 93, train_loss: 0.5818, test_loss: 1.2622, test_f1: 0.5435
 epoch: 94, train_loss: 0.5708, test_loss: 1.2659, test_f1: 0.5340
 epoch: 95, train_loss: 0.5631, test_loss: 1.2535, test_f1: 0.5319
 epoch: 96, train_loss: 0.5550, test_loss: 1.2851, test_f1: 0.5471
 epoch: 97, train_loss: 0.5627, test_loss: 1.2960, test_f1: 0.5293
 epoch: 98, train_loss: 0.5691, test_loss: 1.2655, test_f1: 0.5346
 epoch: 99, train_loss: 0.5732, test_loss: 1.2703, test_f1: 0.5405

Training completed in 489.35 seconds
Best F1: 0.5598 at epoch 90
Mean F1 across iterations: 0.5467  0.0073
========================FINAL RESULTS================================
FEGIN weighted F1: 0.5598  0.0073
python main.py --data ltspice_examples --representation component_component --model FEGIN --layers 4 --hiddens 128 --batch_size 128 --lr 0.0001 --emb_size 128 --epochs 100 --save_appendix component_component_L4_H128_BS128_LR0.0001_E128 --no_val
-----



STDERR:
  File "main.py", line 370, in <module>
    main()
  File "main.py", line 254, in main
    dataset = dataset_class(
  File "/home/philip/projects/ltspice_examples_code_repo/Circuit-Completion-Using-GNNs/component_classification_with_link_prediction_head/evaluation/FEGIN/kernel/circuit_datasets.py", line 15, in __init__
    self.data, self.slices = torch.load(self.processed_paths[0])
  File "/home/philip/.local/lib/python3.8/site-packages/torch/serialization.py", line 1040, in load
    warnings.warn(
  File "/usr/lib/python3.8/warnings.py", line 109, in _showwarnmsg
    sw(msg.message, msg.category, msg.filename, msg.lineno,
  File "main.py", line 47, in warn_with_traceback
    traceback.print_stack(file=log)
/home/philip/projects/ltspice_examples_code_repo/Circuit-Completion-Using-GNNs/component_classification_with_link_prediction_head/evaluation/FEGIN/kernel/circuit_datasets.py:15: FutureWarning: You are using `torch.load` with `weights_only=False` (the current default value), which uses the default pickle module implicitly. It is possible to construct malicious pickle data which will execute arbitrary code during unpickling (See https://github.com/pytorch/pytorch/blob/main/SECURITY.md#untrusted-models for more details). In a future release, the default value for `weights_only` will be flipped to `True`. This limits the functions that could be executed during unpickling. Arbitrary objects will no longer be allowed to be loaded via this mode unless they are explicitly allowlisted by the user via `torch.serialization.add_safe_globals`. We recommend you start setting `weights_only=True` for any use case where you don't have full control of the loaded file. Please open an issue on GitHub for any issues related to this experimental feature.
  self.data, self.slices = torch.load(self.processed_paths[0])
