STDOUT:
Results will be saved in /home/philip/projects/ltspice_examples_code_repo/Circuit-Completion-Using-GNNs/component_classification_with_link_prediction_head/evaluation/FEGIN/results/model_FEGIN_dataset_ltspice_examples
Command line input: python main.py --data ltspice_examples --representation component_net --model FEGIN --layers 2 --hiddens 64 --batch_size 128 --lr 0.0001 --emb_size 512 --epochs 100 --save_appendix component_net_L2_H64_BS128_LR0.0001_E512 --no_val
 is saved.
-----
ltspice_examples - FEGIN
Using 2 layers, 64 hidden units, h = 2
Loading component_net representation dataset
ENTERED
Training FEGIN on component_net representation
Train: 3558, Test: 846
##################ITERATION #0 ****************************************
 epoch: 0, train_loss: 1.3645, test_loss: 1.3617, test_f1: 0.2270
 epoch: 1, train_loss: 1.3549, test_loss: 1.3554, test_f1: 0.2270
 epoch: 2, train_loss: 1.3486, test_loss: 1.3487, test_f1: 0.2270
 epoch: 3, train_loss: 1.3414, test_loss: 1.3414, test_f1: 0.2270
 epoch: 4, train_loss: 1.3329, test_loss: 1.3315, test_f1: 0.2270
 epoch: 5, train_loss: 1.3214, test_loss: 1.3189, test_f1: 0.2271
 epoch: 6, train_loss: 1.3075, test_loss: 1.3036, test_f1: 0.2271
 epoch: 7, train_loss: 1.2909, test_loss: 1.2847, test_f1: 0.2270
 epoch: 8, train_loss: 1.2739, test_loss: 1.2663, test_f1: 0.2275
 epoch: 9, train_loss: 1.2572, test_loss: 1.2491, test_f1: 0.2611
 epoch: 10, train_loss: 1.2394, test_loss: 1.2319, test_f1: 0.2709
 epoch: 11, train_loss: 1.2270, test_loss: 1.2149, test_f1: 0.2928
 epoch: 12, train_loss: 1.2155, test_loss: 1.1973, test_f1: 0.3182
 epoch: 13, train_loss: 1.1981, test_loss: 1.1795, test_f1: 0.3525
 epoch: 14, train_loss: 1.1844, test_loss: 1.1609, test_f1: 0.3667
 epoch: 15, train_loss: 1.1694, test_loss: 1.1437, test_f1: 0.3714
 epoch: 16, train_loss: 1.1507, test_loss: 1.1248, test_f1: 0.3899
 epoch: 17, train_loss: 1.1386, test_loss: 1.1061, test_f1: 0.4083
 epoch: 18, train_loss: 1.1244, test_loss: 1.0876, test_f1: 0.4293
 epoch: 19, train_loss: 1.1036, test_loss: 1.0712, test_f1: 0.4365
 epoch: 20, train_loss: 1.0887, test_loss: 1.0544, test_f1: 0.4448
 epoch: 21, train_loss: 1.0712, test_loss: 1.0367, test_f1: 0.4568
 epoch: 22, train_loss: 1.0549, test_loss: 1.0175, test_f1: 0.4656
 epoch: 23, train_loss: 1.0389, test_loss: 1.0071, test_f1: 0.4444
 epoch: 24, train_loss: 1.0306, test_loss: 0.9928, test_f1: 0.4652
 epoch: 25, train_loss: 1.0246, test_loss: 0.9858, test_f1: 0.4584
 epoch: 26, train_loss: 1.0090, test_loss: 0.9762, test_f1: 0.4688
 epoch: 27, train_loss: 1.0000, test_loss: 0.9700, test_f1: 0.4668
 epoch: 28, train_loss: 0.9873, test_loss: 0.9667, test_f1: 0.4643
 epoch: 29, train_loss: 0.9835, test_loss: 0.9621, test_f1: 0.4672
 epoch: 30, train_loss: 0.9720, test_loss: 0.9515, test_f1: 0.4740
 epoch: 31, train_loss: 0.9619, test_loss: 0.9517, test_f1: 0.4745
 epoch: 32, train_loss: 0.9556, test_loss: 0.9474, test_f1: 0.4828
 epoch: 33, train_loss: 0.9553, test_loss: 0.9387, test_f1: 0.4818
 epoch: 34, train_loss: 0.9491, test_loss: 0.9338, test_f1: 0.4827
 epoch: 35, train_loss: 0.9496, test_loss: 0.9345, test_f1: 0.4809
 epoch: 36, train_loss: 0.9478, test_loss: 0.9287, test_f1: 0.4996
 epoch: 37, train_loss: 0.9388, test_loss: 0.9263, test_f1: 0.4853
 epoch: 38, train_loss: 0.9350, test_loss: 0.9284, test_f1: 0.4896
 epoch: 39, train_loss: 0.9265, test_loss: 0.9185, test_f1: 0.5005
 epoch: 40, train_loss: 0.9258, test_loss: 0.9203, test_f1: 0.4906
 epoch: 41, train_loss: 0.9146, test_loss: 0.9283, test_f1: 0.4995
 epoch: 42, train_loss: 0.9181, test_loss: 0.9115, test_f1: 0.5040
 epoch: 43, train_loss: 0.9135, test_loss: 0.9157, test_f1: 0.4991
 epoch: 44, train_loss: 0.9129, test_loss: 0.9138, test_f1: 0.5060
 epoch: 45, train_loss: 0.9123, test_loss: 0.9117, test_f1: 0.5158
 epoch: 46, train_loss: 0.9088, test_loss: 0.9082, test_f1: 0.5106
 epoch: 47, train_loss: 0.8979, test_loss: 0.9157, test_f1: 0.5093
 epoch: 48, train_loss: 0.8997, test_loss: 0.9099, test_f1: 0.5146
 epoch: 49, train_loss: 0.8995, test_loss: 0.9042, test_f1: 0.5129
 epoch: 50, train_loss: 0.8969, test_loss: 0.9045, test_f1: 0.5276
 epoch: 51, train_loss: 0.8964, test_loss: 0.9067, test_f1: 0.5135
 epoch: 52, train_loss: 0.8896, test_loss: 0.9057, test_f1: 0.5130
 epoch: 53, train_loss: 0.8925, test_loss: 0.9072, test_f1: 0.5152
 epoch: 54, train_loss: 0.8905, test_loss: 0.9011, test_f1: 0.5221
 epoch: 55, train_loss: 0.8900, test_loss: 0.8969, test_f1: 0.5165
 epoch: 56, train_loss: 0.8925, test_loss: 0.8974, test_f1: 0.5184
 epoch: 57, train_loss: 0.8789, test_loss: 0.8981, test_f1: 0.5218
 epoch: 58, train_loss: 0.8858, test_loss: 0.9034, test_f1: 0.5189
 epoch: 59, train_loss: 0.8801, test_loss: 0.9037, test_f1: 0.5181
 epoch: 60, train_loss: 0.8745, test_loss: 0.8993, test_f1: 0.5163
 epoch: 61, train_loss: 0.8796, test_loss: 0.9031, test_f1: 0.5117
 epoch: 62, train_loss: 0.8814, test_loss: 0.8964, test_f1: 0.5198
 epoch: 63, train_loss: 0.8766, test_loss: 0.8931, test_f1: 0.5221
 epoch: 64, train_loss: 0.8748, test_loss: 0.8984, test_f1: 0.5156
 epoch: 65, train_loss: 0.8815, test_loss: 0.9001, test_f1: 0.5175
 epoch: 66, train_loss: 0.8672, test_loss: 0.8899, test_f1: 0.5222
 epoch: 67, train_loss: 0.8777, test_loss: 0.9030, test_f1: 0.5198
 epoch: 68, train_loss: 0.8702, test_loss: 0.8952, test_f1: 0.5178
 epoch: 69, train_loss: 0.8706, test_loss: 0.9041, test_f1: 0.5114
 epoch: 70, train_loss: 0.8705, test_loss: 0.8916, test_f1: 0.5208
 epoch: 71, train_loss: 0.8661, test_loss: 0.8974, test_f1: 0.5125
 epoch: 72, train_loss: 0.8686, test_loss: 0.9013, test_f1: 0.5107
 epoch: 73, train_loss: 0.8648, test_loss: 0.8903, test_f1: 0.5259
 epoch: 74, train_loss: 0.8700, test_loss: 0.8992, test_f1: 0.5167
 epoch: 75, train_loss: 0.8584, test_loss: 0.8965, test_f1: 0.5172
 epoch: 76, train_loss: 0.8636, test_loss: 0.9037, test_f1: 0.5120
 epoch: 77, train_loss: 0.8593, test_loss: 0.8912, test_f1: 0.5258
 epoch: 78, train_loss: 0.8627, test_loss: 0.8960, test_f1: 0.5158
 epoch: 79, train_loss: 0.8571, test_loss: 0.9000, test_f1: 0.5140
 epoch: 80, train_loss: 0.8550, test_loss: 0.8928, test_f1: 0.5209
 epoch: 81, train_loss: 0.8556, test_loss: 0.8959, test_f1: 0.5244
 epoch: 82, train_loss: 0.8640, test_loss: 0.8950, test_f1: 0.5222
 epoch: 83, train_loss: 0.8587, test_loss: 0.9016, test_f1: 0.5149
 epoch: 84, train_loss: 0.8555, test_loss: 0.9012, test_f1: 0.5195
 epoch: 85, train_loss: 0.8513, test_loss: 0.8926, test_f1: 0.5189
 epoch: 86, train_loss: 0.8499, test_loss: 0.9039, test_f1: 0.5191
 epoch: 87, train_loss: 0.8508, test_loss: 0.8868, test_f1: 0.5228
 epoch: 88, train_loss: 0.8463, test_loss: 0.9072, test_f1: 0.5109
 epoch: 89, train_loss: 0.8561, test_loss: 0.8980, test_f1: 0.5163
 epoch: 90, train_loss: 0.8516, test_loss: 0.9000, test_f1: 0.5221
 epoch: 91, train_loss: 0.8523, test_loss: 0.9018, test_f1: 0.5237
 epoch: 92, train_loss: 0.8494, test_loss: 0.9127, test_f1: 0.5124
 epoch: 93, train_loss: 0.8439, test_loss: 0.9026, test_f1: 0.5180
 epoch: 94, train_loss: 0.8427, test_loss: 0.9043, test_f1: 0.5204
 epoch: 95, train_loss: 0.8449, test_loss: 0.8954, test_f1: 0.5290
 epoch: 96, train_loss: 0.8456, test_loss: 0.8939, test_f1: 0.5224
 epoch: 97, train_loss: 0.8495, test_loss: 0.9105, test_f1: 0.5130
 epoch: 98, train_loss: 0.8407, test_loss: 0.8974, test_f1: 0.5257
 epoch: 99, train_loss: 0.8445, test_loss: 0.9014, test_f1: 0.5217
##################ITERATION #1 ****************************************
 epoch: 0, train_loss: 1.3192, test_loss: 1.3294, test_f1: 0.2270
 epoch: 1, train_loss: 1.2897, test_loss: 1.2959, test_f1: 0.2320
 epoch: 2, train_loss: 1.2695, test_loss: 1.2609, test_f1: 0.2836
 epoch: 3, train_loss: 1.2519, test_loss: 1.2379, test_f1: 0.2851
 epoch: 4, train_loss: 1.2374, test_loss: 1.2198, test_f1: 0.2936
 epoch: 5, train_loss: 1.2196, test_loss: 1.2018, test_f1: 0.2970
 epoch: 6, train_loss: 1.2028, test_loss: 1.1845, test_f1: 0.3049
 epoch: 7, train_loss: 1.1900, test_loss: 1.1670, test_f1: 0.3145
 epoch: 8, train_loss: 1.1775, test_loss: 1.1495, test_f1: 0.3411
 epoch: 9, train_loss: 1.1585, test_loss: 1.1305, test_f1: 0.3632
 epoch: 10, train_loss: 1.1413, test_loss: 1.1120, test_f1: 0.3857
 epoch: 11, train_loss: 1.1301, test_loss: 1.0938, test_f1: 0.3934
 epoch: 12, train_loss: 1.1123, test_loss: 1.0770, test_f1: 0.3940
 epoch: 13, train_loss: 1.0983, test_loss: 1.0626, test_f1: 0.3991
 epoch: 14, train_loss: 1.0796, test_loss: 1.0439, test_f1: 0.4208
 epoch: 15, train_loss: 1.0614, test_loss: 1.0324, test_f1: 0.4294
 epoch: 16, train_loss: 1.0501, test_loss: 1.0211, test_f1: 0.4317
 epoch: 17, train_loss: 1.0351, test_loss: 1.0101, test_f1: 0.4423
 epoch: 18, train_loss: 1.0254, test_loss: 0.9977, test_f1: 0.4427
 epoch: 19, train_loss: 1.0213, test_loss: 0.9932, test_f1: 0.4491
 epoch: 20, train_loss: 1.0090, test_loss: 0.9806, test_f1: 0.4630
 epoch: 21, train_loss: 1.0051, test_loss: 0.9802, test_f1: 0.4637
 epoch: 22, train_loss: 0.9892, test_loss: 0.9713, test_f1: 0.4707
 epoch: 23, train_loss: 0.9837, test_loss: 0.9762, test_f1: 0.4715
 epoch: 24, train_loss: 0.9785, test_loss: 0.9682, test_f1: 0.4713
 epoch: 25, train_loss: 0.9746, test_loss: 0.9682, test_f1: 0.4742
 epoch: 26, train_loss: 0.9704, test_loss: 0.9549, test_f1: 0.4845
 epoch: 27, train_loss: 0.9613, test_loss: 0.9550, test_f1: 0.4778
 epoch: 28, train_loss: 0.9554, test_loss: 0.9575, test_f1: 0.4914
 epoch: 29, train_loss: 0.9534, test_loss: 0.9477, test_f1: 0.4797
 epoch: 30, train_loss: 0.9467, test_loss: 0.9499, test_f1: 0.4769
 epoch: 31, train_loss: 0.9424, test_loss: 0.9451, test_f1: 0.4844
 epoch: 32, train_loss: 0.9413, test_loss: 0.9543, test_f1: 0.4807
 epoch: 33, train_loss: 0.9322, test_loss: 0.9442, test_f1: 0.4713
 epoch: 34, train_loss: 0.9357, test_loss: 0.9482, test_f1: 0.4831
 epoch: 35, train_loss: 0.9316, test_loss: 0.9488, test_f1: 0.4812
 epoch: 36, train_loss: 0.9215, test_loss: 0.9453, test_f1: 0.4767
 epoch: 37, train_loss: 0.9200, test_loss: 0.9449, test_f1: 0.5048
 epoch: 38, train_loss: 0.9162, test_loss: 0.9402, test_f1: 0.4840
 epoch: 39, train_loss: 0.9151, test_loss: 0.9477, test_f1: 0.4839
 epoch: 40, train_loss: 0.9096, test_loss: 0.9478, test_f1: 0.4875
 epoch: 41, train_loss: 0.9025, test_loss: 0.9431, test_f1: 0.4983
 epoch: 42, train_loss: 0.9131, test_loss: 0.9445, test_f1: 0.4878
 epoch: 43, train_loss: 0.8979, test_loss: 0.9423, test_f1: 0.4838
 epoch: 44, train_loss: 0.8947, test_loss: 0.9517, test_f1: 0.4894
 epoch: 45, train_loss: 0.8918, test_loss: 0.9329, test_f1: 0.5018
 epoch: 46, train_loss: 0.8949, test_loss: 0.9453, test_f1: 0.4874
 epoch: 47, train_loss: 0.8859, test_loss: 0.9605, test_f1: 0.4842
 epoch: 48, train_loss: 0.8882, test_loss: 0.9383, test_f1: 0.4881
 epoch: 49, train_loss: 0.8780, test_loss: 0.9460, test_f1: 0.4973
 epoch: 50, train_loss: 0.8798, test_loss: 0.9657, test_f1: 0.4977
 epoch: 51, train_loss: 0.8778, test_loss: 0.9523, test_f1: 0.5024
 epoch: 52, train_loss: 0.8770, test_loss: 0.9566, test_f1: 0.4992
 epoch: 53, train_loss: 0.8746, test_loss: 0.9463, test_f1: 0.4956
 epoch: 54, train_loss: 0.8728, test_loss: 0.9520, test_f1: 0.4854
 epoch: 55, train_loss: 0.8765, test_loss: 0.9527, test_f1: 0.4880
 epoch: 56, train_loss: 0.8705, test_loss: 0.9451, test_f1: 0.4991
 epoch: 57, train_loss: 0.8705, test_loss: 0.9477, test_f1: 0.4956
 epoch: 58, train_loss: 0.8699, test_loss: 0.9432, test_f1: 0.5004
 epoch: 59, train_loss: 0.8686, test_loss: 0.9477, test_f1: 0.5099
 epoch: 60, train_loss: 0.8640, test_loss: 0.9482, test_f1: 0.4967
 epoch: 61, train_loss: 0.8646, test_loss: 0.9441, test_f1: 0.5017
 epoch: 62, train_loss: 0.8610, test_loss: 0.9420, test_f1: 0.4978
 epoch: 63, train_loss: 0.8630, test_loss: 0.9503, test_f1: 0.5059
 epoch: 64, train_loss: 0.8589, test_loss: 0.9479, test_f1: 0.5064
 epoch: 65, train_loss: 0.8550, test_loss: 0.9496, test_f1: 0.5138
 epoch: 66, train_loss: 0.8527, test_loss: 0.9472, test_f1: 0.5084
 epoch: 67, train_loss: 0.8550, test_loss: 0.9472, test_f1: 0.5108
 epoch: 68, train_loss: 0.8555, test_loss: 0.9478, test_f1: 0.5094
 epoch: 69, train_loss: 0.8493, test_loss: 0.9549, test_f1: 0.5004
 epoch: 70, train_loss: 0.8513, test_loss: 0.9432, test_f1: 0.5005
 epoch: 71, train_loss: 0.8500, test_loss: 0.9481, test_f1: 0.5056
 epoch: 72, train_loss: 0.8483, test_loss: 0.9467, test_f1: 0.4989
 epoch: 73, train_loss: 0.8556, test_loss: 0.9491, test_f1: 0.5069
 epoch: 74, train_loss: 0.8418, test_loss: 0.9556, test_f1: 0.5024
 epoch: 75, train_loss: 0.8442, test_loss: 0.9511, test_f1: 0.5117
 epoch: 76, train_loss: 0.8533, test_loss: 0.9508, test_f1: 0.5077
 epoch: 77, train_loss: 0.8536, test_loss: 0.9443, test_f1: 0.5183
 epoch: 78, train_loss: 0.8439, test_loss: 0.9516, test_f1: 0.5149
 epoch: 79, train_loss: 0.8413, test_loss: 0.9388, test_f1: 0.5102
 epoch: 80, train_loss: 0.8430, test_loss: 0.9509, test_f1: 0.5100
 epoch: 81, train_loss: 0.8379, test_loss: 0.9601, test_f1: 0.5073
 epoch: 82, train_loss: 0.8448, test_loss: 0.9530, test_f1: 0.5146
 epoch: 83, train_loss: 0.8389, test_loss: 0.9607, test_f1: 0.5093
 epoch: 84, train_loss: 0.8358, test_loss: 0.9550, test_f1: 0.5124
 epoch: 85, train_loss: 0.8413, test_loss: 0.9533, test_f1: 0.5115
 epoch: 86, train_loss: 0.8312, test_loss: 0.9532, test_f1: 0.5095
 epoch: 87, train_loss: 0.8385, test_loss: 0.9456, test_f1: 0.5105
 epoch: 88, train_loss: 0.8383, test_loss: 0.9630, test_f1: 0.5169
 epoch: 89, train_loss: 0.8283, test_loss: 0.9499, test_f1: 0.5228
 epoch: 90, train_loss: 0.8411, test_loss: 0.9422, test_f1: 0.5179
 epoch: 91, train_loss: 0.8283, test_loss: 0.9506, test_f1: 0.5224
 epoch: 92, train_loss: 0.8298, test_loss: 0.9599, test_f1: 0.5115
 epoch: 93, train_loss: 0.8339, test_loss: 0.9620, test_f1: 0.5142
 epoch: 94, train_loss: 0.8317, test_loss: 0.9624, test_f1: 0.5171
 epoch: 95, train_loss: 0.8306, test_loss: 0.9606, test_f1: 0.5204
 epoch: 96, train_loss: 0.8362, test_loss: 0.9495, test_f1: 0.5060
 epoch: 97, train_loss: 0.8335, test_loss: 0.9562, test_f1: 0.5105
 epoch: 98, train_loss: 0.8296, test_loss: 0.9655, test_f1: 0.5106
 epoch: 99, train_loss: 0.8237, test_loss: 0.9670, test_f1: 0.5103
##################ITERATION #2 ****************************************
 epoch: 0, train_loss: 1.2808, test_loss: 1.3066, test_f1: 0.2270
 epoch: 1, train_loss: 1.2323, test_loss: 1.2525, test_f1: 0.2270
 epoch: 2, train_loss: 1.2104, test_loss: 1.1935, test_f1: 0.3115
 epoch: 3, train_loss: 1.1905, test_loss: 1.1641, test_f1: 0.3326
 epoch: 4, train_loss: 1.1743, test_loss: 1.1452, test_f1: 0.3394
 epoch: 5, train_loss: 1.1560, test_loss: 1.1231, test_f1: 0.3529
 epoch: 6, train_loss: 1.1358, test_loss: 1.1037, test_f1: 0.3551
 epoch: 7, train_loss: 1.1205, test_loss: 1.0828, test_f1: 0.3716
 epoch: 8, train_loss: 1.0984, test_loss: 1.0660, test_f1: 0.3886
 epoch: 9, train_loss: 1.0802, test_loss: 1.0499, test_f1: 0.3984
 epoch: 10, train_loss: 1.0638, test_loss: 1.0292, test_f1: 0.4079
 epoch: 11, train_loss: 1.0448, test_loss: 1.0216, test_f1: 0.4170
 epoch: 12, train_loss: 1.0320, test_loss: 1.0065, test_f1: 0.4342
 epoch: 13, train_loss: 1.0192, test_loss: 0.9979, test_f1: 0.4356
 epoch: 14, train_loss: 1.0067, test_loss: 0.9876, test_f1: 0.4368
 epoch: 15, train_loss: 1.0016, test_loss: 0.9853, test_f1: 0.4610
 epoch: 16, train_loss: 0.9889, test_loss: 0.9762, test_f1: 0.4682
 epoch: 17, train_loss: 0.9885, test_loss: 0.9711, test_f1: 0.4705
 epoch: 18, train_loss: 0.9736, test_loss: 0.9822, test_f1: 0.4655
 epoch: 19, train_loss: 0.9651, test_loss: 0.9854, test_f1: 0.4616
 epoch: 20, train_loss: 0.9658, test_loss: 0.9698, test_f1: 0.4698
 epoch: 21, train_loss: 0.9596, test_loss: 0.9602, test_f1: 0.4843
 epoch: 22, train_loss: 0.9497, test_loss: 0.9538, test_f1: 0.4918
 epoch: 23, train_loss: 0.9448, test_loss: 0.9584, test_f1: 0.4817
 epoch: 24, train_loss: 0.9436, test_loss: 0.9440, test_f1: 0.4872
 epoch: 25, train_loss: 0.9299, test_loss: 0.9442, test_f1: 0.4831
 epoch: 26, train_loss: 0.9253, test_loss: 0.9638, test_f1: 0.4806
 epoch: 27, train_loss: 0.9190, test_loss: 0.9525, test_f1: 0.4860
 epoch: 28, train_loss: 0.9254, test_loss: 0.9488, test_f1: 0.4922
 epoch: 29, train_loss: 0.9104, test_loss: 0.9368, test_f1: 0.4922
 epoch: 30, train_loss: 0.9110, test_loss: 0.9363, test_f1: 0.5092
 epoch: 31, train_loss: 0.9020, test_loss: 0.9548, test_f1: 0.5062
 epoch: 32, train_loss: 0.8996, test_loss: 0.9527, test_f1: 0.5039
 epoch: 33, train_loss: 0.8939, test_loss: 0.9454, test_f1: 0.5047
 epoch: 34, train_loss: 0.8928, test_loss: 0.9523, test_f1: 0.5164
 epoch: 35, train_loss: 0.8873, test_loss: 0.9459, test_f1: 0.5127
 epoch: 36, train_loss: 0.8884, test_loss: 0.9615, test_f1: 0.5086
 epoch: 37, train_loss: 0.8822, test_loss: 0.9306, test_f1: 0.5164
 epoch: 38, train_loss: 0.8721, test_loss: 0.9426, test_f1: 0.5209
 epoch: 39, train_loss: 0.8747, test_loss: 0.9547, test_f1: 0.5195
 epoch: 40, train_loss: 0.8725, test_loss: 0.9491, test_f1: 0.5228
 epoch: 41, train_loss: 0.8692, test_loss: 0.9696, test_f1: 0.5190
 epoch: 42, train_loss: 0.8650, test_loss: 0.9508, test_f1: 0.5236
 epoch: 43, train_loss: 0.8585, test_loss: 0.9489, test_f1: 0.5227
 epoch: 44, train_loss: 0.8548, test_loss: 0.9444, test_f1: 0.5213
 epoch: 45, train_loss: 0.8559, test_loss: 0.9542, test_f1: 0.5161
 epoch: 46, train_loss: 0.8570, test_loss: 0.9539, test_f1: 0.5280
 epoch: 47, train_loss: 0.8477, test_loss: 0.9656, test_f1: 0.5179
 epoch: 48, train_loss: 0.8434, test_loss: 0.9455, test_f1: 0.5258
 epoch: 49, train_loss: 0.8394, test_loss: 0.9632, test_f1: 0.5267
 epoch: 50, train_loss: 0.8340, test_loss: 0.9560, test_f1: 0.5284
 epoch: 51, train_loss: 0.8435, test_loss: 0.9633, test_f1: 0.5272
 epoch: 52, train_loss: 0.8361, test_loss: 0.9469, test_f1: 0.5325
 epoch: 53, train_loss: 0.8290, test_loss: 0.9691, test_f1: 0.5306
 epoch: 54, train_loss: 0.8379, test_loss: 0.9605, test_f1: 0.5249
 epoch: 55, train_loss: 0.8352, test_loss: 0.9392, test_f1: 0.5370
 epoch: 56, train_loss: 0.8241, test_loss: 0.9603, test_f1: 0.5260
 epoch: 57, train_loss: 0.8239, test_loss: 0.9493, test_f1: 0.5285
 epoch: 58, train_loss: 0.8274, test_loss: 0.9471, test_f1: 0.5334
 epoch: 59, train_loss: 0.8222, test_loss: 0.9697, test_f1: 0.5261
 epoch: 60, train_loss: 0.8190, test_loss: 0.9589, test_f1: 0.5231
 epoch: 61, train_loss: 0.8239, test_loss: 0.9564, test_f1: 0.5279
 epoch: 62, train_loss: 0.8271, test_loss: 0.9696, test_f1: 0.5261
 epoch: 63, train_loss: 0.8206, test_loss: 0.9677, test_f1: 0.5303
 epoch: 64, train_loss: 0.8132, test_loss: 0.9582, test_f1: 0.5387
 epoch: 65, train_loss: 0.8230, test_loss: 0.9686, test_f1: 0.5347
 epoch: 66, train_loss: 0.8151, test_loss: 0.9545, test_f1: 0.5375
 epoch: 67, train_loss: 0.8065, test_loss: 0.9641, test_f1: 0.5271
 epoch: 68, train_loss: 0.8145, test_loss: 0.9653, test_f1: 0.5300
 epoch: 69, train_loss: 0.8059, test_loss: 0.9577, test_f1: 0.5328
 epoch: 70, train_loss: 0.8115, test_loss: 0.9640, test_f1: 0.5351
 epoch: 71, train_loss: 0.8121, test_loss: 0.9670, test_f1: 0.5291
 epoch: 72, train_loss: 0.8066, test_loss: 0.9564, test_f1: 0.5317
 epoch: 73, train_loss: 0.8060, test_loss: 0.9641, test_f1: 0.5340
 epoch: 74, train_loss: 0.8161, test_loss: 0.9496, test_f1: 0.5326
 epoch: 75, train_loss: 0.8104, test_loss: 0.9620, test_f1: 0.5311
 epoch: 76, train_loss: 0.8030, test_loss: 0.9607, test_f1: 0.5293
 epoch: 77, train_loss: 0.8066, test_loss: 0.9807, test_f1: 0.5358
 epoch: 78, train_loss: 0.7996, test_loss: 0.9591, test_f1: 0.5296
 epoch: 79, train_loss: 0.8007, test_loss: 0.9750, test_f1: 0.5203
 epoch: 80, train_loss: 0.8014, test_loss: 0.9608, test_f1: 0.5210
 epoch: 81, train_loss: 0.7964, test_loss: 0.9711, test_f1: 0.5324
 epoch: 82, train_loss: 0.7905, test_loss: 0.9733, test_f1: 0.5247
 epoch: 83, train_loss: 0.7900, test_loss: 0.9727, test_f1: 0.5277
 epoch: 84, train_loss: 0.7931, test_loss: 0.9761, test_f1: 0.5294
 epoch: 85, train_loss: 0.7916, test_loss: 0.9719, test_f1: 0.5221
 epoch: 86, train_loss: 0.7966, test_loss: 0.9738, test_f1: 0.5314
 epoch: 87, train_loss: 0.7900, test_loss: 0.9773, test_f1: 0.5255
 epoch: 88, train_loss: 0.7881, test_loss: 0.9668, test_f1: 0.5334
 epoch: 89, train_loss: 0.7879, test_loss: 0.9799, test_f1: 0.5245
 epoch: 90, train_loss: 0.7951, test_loss: 0.9824, test_f1: 0.5259
 epoch: 91, train_loss: 0.7839, test_loss: 0.9758, test_f1: 0.5247
 epoch: 92, train_loss: 0.7870, test_loss: 0.9685, test_f1: 0.5322
 epoch: 93, train_loss: 0.7901, test_loss: 0.9699, test_f1: 0.5249
 epoch: 94, train_loss: 0.7977, test_loss: 0.9660, test_f1: 0.5260
 epoch: 95, train_loss: 0.7818, test_loss: 0.9811, test_f1: 0.5299
 epoch: 96, train_loss: 0.7867, test_loss: 0.9772, test_f1: 0.5210
 epoch: 97, train_loss: 0.7717, test_loss: 0.9712, test_f1: 0.5354
 epoch: 98, train_loss: 0.7738, test_loss: 0.9750, test_f1: 0.5287
 epoch: 99, train_loss: 0.7827, test_loss: 0.9780, test_f1: 0.5214
##################ITERATION #3 ****************************************
 epoch: 0, train_loss: 1.2870, test_loss: 1.2931, test_f1: 0.2270
 epoch: 1, train_loss: 1.2247, test_loss: 1.2378, test_f1: 0.2270
 epoch: 2, train_loss: 1.2048, test_loss: 1.1808, test_f1: 0.3073
 epoch: 3, train_loss: 1.1813, test_loss: 1.1497, test_f1: 0.3310
 epoch: 4, train_loss: 1.1593, test_loss: 1.1275, test_f1: 0.3389
 epoch: 5, train_loss: 1.1446, test_loss: 1.1053, test_f1: 0.3473
 epoch: 6, train_loss: 1.1229, test_loss: 1.0846, test_f1: 0.3501
 epoch: 7, train_loss: 1.1039, test_loss: 1.0684, test_f1: 0.3671
 epoch: 8, train_loss: 1.0957, test_loss: 1.0503, test_f1: 0.3770
 epoch: 9, train_loss: 1.0760, test_loss: 1.0370, test_f1: 0.4047
 epoch: 10, train_loss: 1.0577, test_loss: 1.0219, test_f1: 0.4136
 epoch: 11, train_loss: 1.0451, test_loss: 1.0114, test_f1: 0.4191
 epoch: 12, train_loss: 1.0351, test_loss: 1.0056, test_f1: 0.4348
 epoch: 13, train_loss: 1.0273, test_loss: 0.9990, test_f1: 0.4372
 epoch: 14, train_loss: 1.0107, test_loss: 0.9837, test_f1: 0.4443
 epoch: 15, train_loss: 1.0024, test_loss: 0.9745, test_f1: 0.4565
 epoch: 16, train_loss: 0.9918, test_loss: 0.9694, test_f1: 0.4576
 epoch: 17, train_loss: 0.9850, test_loss: 0.9597, test_f1: 0.4694
 epoch: 18, train_loss: 0.9879, test_loss: 0.9576, test_f1: 0.4661
 epoch: 19, train_loss: 0.9697, test_loss: 0.9537, test_f1: 0.4767
 epoch: 20, train_loss: 0.9693, test_loss: 0.9435, test_f1: 0.4815
 epoch: 21, train_loss: 0.9555, test_loss: 0.9371, test_f1: 0.4939
 epoch: 22, train_loss: 0.9532, test_loss: 0.9436, test_f1: 0.4936
 epoch: 23, train_loss: 0.9492, test_loss: 0.9320, test_f1: 0.4945
 epoch: 24, train_loss: 0.9391, test_loss: 0.9246, test_f1: 0.5101
 epoch: 25, train_loss: 0.9380, test_loss: 0.9223, test_f1: 0.4946
 epoch: 26, train_loss: 0.9314, test_loss: 0.9181, test_f1: 0.5050
 epoch: 27, train_loss: 0.9263, test_loss: 0.9231, test_f1: 0.5058
 epoch: 28, train_loss: 0.9230, test_loss: 0.9230, test_f1: 0.5041
 epoch: 29, train_loss: 0.9242, test_loss: 0.9135, test_f1: 0.5113
 epoch: 30, train_loss: 0.9143, test_loss: 0.9110, test_f1: 0.5079
 epoch: 31, train_loss: 0.9134, test_loss: 0.9145, test_f1: 0.5082
 epoch: 32, train_loss: 0.9131, test_loss: 0.9093, test_f1: 0.5169
 epoch: 33, train_loss: 0.9006, test_loss: 0.9058, test_f1: 0.5152
 epoch: 34, train_loss: 0.9007, test_loss: 0.9072, test_f1: 0.5200
 epoch: 35, train_loss: 0.8982, test_loss: 0.9004, test_f1: 0.5286
 epoch: 36, train_loss: 0.8917, test_loss: 0.9056, test_f1: 0.5088
 epoch: 37, train_loss: 0.8829, test_loss: 0.8942, test_f1: 0.5357
 epoch: 38, train_loss: 0.8915, test_loss: 0.8963, test_f1: 0.5335
 epoch: 39, train_loss: 0.8853, test_loss: 0.8945, test_f1: 0.5349
 epoch: 40, train_loss: 0.8783, test_loss: 0.8961, test_f1: 0.5143
 epoch: 41, train_loss: 0.8830, test_loss: 0.8939, test_f1: 0.5306
 epoch: 42, train_loss: 0.8777, test_loss: 0.8910, test_f1: 0.5323
 epoch: 43, train_loss: 0.8735, test_loss: 0.8972, test_f1: 0.5265
 epoch: 44, train_loss: 0.8677, test_loss: 0.8997, test_f1: 0.5149
 epoch: 45, train_loss: 0.8579, test_loss: 0.8930, test_f1: 0.5337
 epoch: 46, train_loss: 0.8668, test_loss: 0.8929, test_f1: 0.5331
 epoch: 47, train_loss: 0.8644, test_loss: 0.8911, test_f1: 0.5302
 epoch: 48, train_loss: 0.8631, test_loss: 0.8902, test_f1: 0.5328
 epoch: 49, train_loss: 0.8569, test_loss: 0.8936, test_f1: 0.5429
 epoch: 50, train_loss: 0.8609, test_loss: 0.9002, test_f1: 0.5297
 epoch: 51, train_loss: 0.8575, test_loss: 0.9013, test_f1: 0.5289
 epoch: 52, train_loss: 0.8542, test_loss: 0.8976, test_f1: 0.5355
 epoch: 53, train_loss: 0.8469, test_loss: 0.9025, test_f1: 0.5389
 epoch: 54, train_loss: 0.8353, test_loss: 0.8903, test_f1: 0.5373
 epoch: 55, train_loss: 0.8443, test_loss: 0.8936, test_f1: 0.5477
 epoch: 56, train_loss: 0.8426, test_loss: 0.8884, test_f1: 0.5508
 epoch: 57, train_loss: 0.8375, test_loss: 0.8929, test_f1: 0.5475
 epoch: 58, train_loss: 0.8384, test_loss: 0.8934, test_f1: 0.5380
 epoch: 59, train_loss: 0.8367, test_loss: 0.8976, test_f1: 0.5255
 epoch: 60, train_loss: 0.8381, test_loss: 0.8922, test_f1: 0.5403
 epoch: 61, train_loss: 0.8405, test_loss: 0.8928, test_f1: 0.5430
 epoch: 62, train_loss: 0.8322, test_loss: 0.8860, test_f1: 0.5422
 epoch: 63, train_loss: 0.8290, test_loss: 0.8917, test_f1: 0.5403
 epoch: 64, train_loss: 0.8384, test_loss: 0.8962, test_f1: 0.5513
 epoch: 65, train_loss: 0.8189, test_loss: 0.8926, test_f1: 0.5435
 epoch: 66, train_loss: 0.8397, test_loss: 0.8887, test_f1: 0.5418
 epoch: 67, train_loss: 0.8281, test_loss: 0.8943, test_f1: 0.5536
 epoch: 68, train_loss: 0.8288, test_loss: 0.8962, test_f1: 0.5463
 epoch: 69, train_loss: 0.8317, test_loss: 0.8869, test_f1: 0.5415
 epoch: 70, train_loss: 0.8283, test_loss: 0.8920, test_f1: 0.5386
 epoch: 71, train_loss: 0.8239, test_loss: 0.9008, test_f1: 0.5411
 epoch: 72, train_loss: 0.8314, test_loss: 0.8908, test_f1: 0.5402
 epoch: 73, train_loss: 0.8188, test_loss: 0.8902, test_f1: 0.5434
 epoch: 74, train_loss: 0.8127, test_loss: 0.8868, test_f1: 0.5434
 epoch: 75, train_loss: 0.8270, test_loss: 0.8911, test_f1: 0.5512
 epoch: 76, train_loss: 0.8124, test_loss: 0.8967, test_f1: 0.5561
 epoch: 77, train_loss: 0.8198, test_loss: 0.8944, test_f1: 0.5450
 epoch: 78, train_loss: 0.8131, test_loss: 0.8885, test_f1: 0.5413
 epoch: 79, train_loss: 0.8181, test_loss: 0.8968, test_f1: 0.5509
 epoch: 80, train_loss: 0.8123, test_loss: 0.8963, test_f1: 0.5455
 epoch: 81, train_loss: 0.8197, test_loss: 0.8946, test_f1: 0.5510
 epoch: 82, train_loss: 0.8121, test_loss: 0.8895, test_f1: 0.5427
 epoch: 83, train_loss: 0.8101, test_loss: 0.8995, test_f1: 0.5438
 epoch: 84, train_loss: 0.8084, test_loss: 0.8961, test_f1: 0.5454
 epoch: 85, train_loss: 0.8082, test_loss: 0.8908, test_f1: 0.5424
 epoch: 86, train_loss: 0.8052, test_loss: 0.8851, test_f1: 0.5469
 epoch: 87, train_loss: 0.8139, test_loss: 0.9004, test_f1: 0.5578
 epoch: 88, train_loss: 0.8108, test_loss: 0.8876, test_f1: 0.5464
 epoch: 89, train_loss: 0.8120, test_loss: 0.8972, test_f1: 0.5471
 epoch: 90, train_loss: 0.8028, test_loss: 0.8927, test_f1: 0.5496
 epoch: 91, train_loss: 0.8031, test_loss: 0.8849, test_f1: 0.5504
 epoch: 92, train_loss: 0.8010, test_loss: 0.9088, test_f1: 0.5545
 epoch: 93, train_loss: 0.8092, test_loss: 0.8961, test_f1: 0.5490
 epoch: 94, train_loss: 0.8027, test_loss: 0.9009, test_f1: 0.5438
 epoch: 95, train_loss: 0.8091, test_loss: 0.8920, test_f1: 0.5539
 epoch: 96, train_loss: 0.8067, test_loss: 0.8917, test_f1: 0.5565
 epoch: 97, train_loss: 0.8008, test_loss: 0.8956, test_f1: 0.5448
 epoch: 98, train_loss: 0.7984, test_loss: 0.8948, test_f1: 0.5493
 epoch: 99, train_loss: 0.7926, test_loss: 0.8939, test_f1: 0.5502
##################ITERATION #4 ****************************************
 epoch: 0, train_loss: 1.2799, test_loss: 1.2911, test_f1: 0.2270
 epoch: 1, train_loss: 1.2061, test_loss: 1.2064, test_f1: 0.3300
 epoch: 2, train_loss: 1.1848, test_loss: 1.1498, test_f1: 0.3691
 epoch: 3, train_loss: 1.1612, test_loss: 1.1186, test_f1: 0.3935
 epoch: 4, train_loss: 1.1420, test_loss: 1.0982, test_f1: 0.4112
 epoch: 5, train_loss: 1.1319, test_loss: 1.0821, test_f1: 0.4099
 epoch: 6, train_loss: 1.1040, test_loss: 1.0704, test_f1: 0.4244
 epoch: 7, train_loss: 1.0908, test_loss: 1.0504, test_f1: 0.4255
 epoch: 8, train_loss: 1.0769, test_loss: 1.0382, test_f1: 0.4296
 epoch: 9, train_loss: 1.0708, test_loss: 1.0267, test_f1: 0.4471
 epoch: 10, train_loss: 1.0525, test_loss: 1.0159, test_f1: 0.4482
 epoch: 11, train_loss: 1.0449, test_loss: 1.0022, test_f1: 0.4533
 epoch: 12, train_loss: 1.0279, test_loss: 0.9885, test_f1: 0.4727
 epoch: 13, train_loss: 1.0214, test_loss: 0.9851, test_f1: 0.4638
 epoch: 14, train_loss: 1.0110, test_loss: 0.9829, test_f1: 0.4689
 epoch: 15, train_loss: 0.9969, test_loss: 0.9685, test_f1: 0.4792
 epoch: 16, train_loss: 0.9919, test_loss: 0.9542, test_f1: 0.4891
 epoch: 17, train_loss: 0.9840, test_loss: 0.9541, test_f1: 0.4910
 epoch: 18, train_loss: 0.9725, test_loss: 0.9505, test_f1: 0.4913
 epoch: 19, train_loss: 0.9680, test_loss: 0.9443, test_f1: 0.4970
 epoch: 20, train_loss: 0.9575, test_loss: 0.9370, test_f1: 0.4936
 epoch: 21, train_loss: 0.9555, test_loss: 0.9371, test_f1: 0.4999
 epoch: 22, train_loss: 0.9477, test_loss: 0.9292, test_f1: 0.5005
 epoch: 23, train_loss: 0.9460, test_loss: 0.9254, test_f1: 0.5053
 epoch: 24, train_loss: 0.9349, test_loss: 0.9290, test_f1: 0.5106
 epoch: 25, train_loss: 0.9389, test_loss: 0.9185, test_f1: 0.5082
 epoch: 26, train_loss: 0.9284, test_loss: 0.9166, test_f1: 0.5129
 epoch: 27, train_loss: 0.9234, test_loss: 0.9089, test_f1: 0.5131
 epoch: 28, train_loss: 0.9270, test_loss: 0.9120, test_f1: 0.5170
 epoch: 29, train_loss: 0.9215, test_loss: 0.9054, test_f1: 0.5145
 epoch: 30, train_loss: 0.9094, test_loss: 0.9104, test_f1: 0.5105
 epoch: 31, train_loss: 0.9063, test_loss: 0.8951, test_f1: 0.5239
 epoch: 32, train_loss: 0.9079, test_loss: 0.9012, test_f1: 0.5287
 epoch: 33, train_loss: 0.8964, test_loss: 0.8953, test_f1: 0.5269
 epoch: 34, train_loss: 0.8986, test_loss: 0.8989, test_f1: 0.5257
 epoch: 35, train_loss: 0.8934, test_loss: 0.8874, test_f1: 0.5266
 epoch: 36, train_loss: 0.8914, test_loss: 0.8886, test_f1: 0.5279
 epoch: 37, train_loss: 0.8951, test_loss: 0.8848, test_f1: 0.5287
 epoch: 38, train_loss: 0.8952, test_loss: 0.8874, test_f1: 0.5289
 epoch: 39, train_loss: 0.8840, test_loss: 0.8860, test_f1: 0.5285
 epoch: 40, train_loss: 0.8787, test_loss: 0.8790, test_f1: 0.5298
 epoch: 41, train_loss: 0.8742, test_loss: 0.8778, test_f1: 0.5356
 epoch: 42, train_loss: 0.8670, test_loss: 0.8781, test_f1: 0.5332
 epoch: 43, train_loss: 0.8665, test_loss: 0.8758, test_f1: 0.5259
 epoch: 44, train_loss: 0.8613, test_loss: 0.8900, test_f1: 0.5302
 epoch: 45, train_loss: 0.8692, test_loss: 0.8777, test_f1: 0.5305
 epoch: 46, train_loss: 0.8683, test_loss: 0.8703, test_f1: 0.5324
 epoch: 47, train_loss: 0.8568, test_loss: 0.8677, test_f1: 0.5311
 epoch: 48, train_loss: 0.8583, test_loss: 0.8708, test_f1: 0.5300
 epoch: 49, train_loss: 0.8640, test_loss: 0.8682, test_f1: 0.5283
 epoch: 50, train_loss: 0.8511, test_loss: 0.8651, test_f1: 0.5331
 epoch: 51, train_loss: 0.8490, test_loss: 0.8657, test_f1: 0.5296
 epoch: 52, train_loss: 0.8450, test_loss: 0.8686, test_f1: 0.5341
 epoch: 53, train_loss: 0.8523, test_loss: 0.8649, test_f1: 0.5341
 epoch: 54, train_loss: 0.8449, test_loss: 0.8648, test_f1: 0.5360
 epoch: 55, train_loss: 0.8414, test_loss: 0.8653, test_f1: 0.5303
 epoch: 56, train_loss: 0.8499, test_loss: 0.8707, test_f1: 0.5415
 epoch: 57, train_loss: 0.8316, test_loss: 0.8654, test_f1: 0.5359
 epoch: 58, train_loss: 0.8464, test_loss: 0.8702, test_f1: 0.5451
 epoch: 59, train_loss: 0.8383, test_loss: 0.8710, test_f1: 0.5438
 epoch: 60, train_loss: 0.8416, test_loss: 0.8679, test_f1: 0.5459
 epoch: 61, train_loss: 0.8359, test_loss: 0.8690, test_f1: 0.5345
 epoch: 62, train_loss: 0.8424, test_loss: 0.8654, test_f1: 0.5313
 epoch: 63, train_loss: 0.8303, test_loss: 0.8601, test_f1: 0.5373
 epoch: 64, train_loss: 0.8374, test_loss: 0.8590, test_f1: 0.5316
 epoch: 65, train_loss: 0.8360, test_loss: 0.8617, test_f1: 0.5447
 epoch: 66, train_loss: 0.8273, test_loss: 0.8657, test_f1: 0.5314
 epoch: 67, train_loss: 0.8261, test_loss: 0.8607, test_f1: 0.5428
 epoch: 68, train_loss: 0.8255, test_loss: 0.8614, test_f1: 0.5431
 epoch: 69, train_loss: 0.8299, test_loss: 0.8685, test_f1: 0.5396
 epoch: 70, train_loss: 0.8370, test_loss: 0.8662, test_f1: 0.5471
 epoch: 71, train_loss: 0.8300, test_loss: 0.8613, test_f1: 0.5463
 epoch: 72, train_loss: 0.8221, test_loss: 0.8637, test_f1: 0.5402
 epoch: 73, train_loss: 0.8276, test_loss: 0.8617, test_f1: 0.5415
 epoch: 74, train_loss: 0.8206, test_loss: 0.8602, test_f1: 0.5430
 epoch: 75, train_loss: 0.8214, test_loss: 0.8590, test_f1: 0.5453
 epoch: 76, train_loss: 0.8180, test_loss: 0.8616, test_f1: 0.5438
 epoch: 77, train_loss: 0.8293, test_loss: 0.8599, test_f1: 0.5476
 epoch: 78, train_loss: 0.8168, test_loss: 0.8575, test_f1: 0.5418
 epoch: 79, train_loss: 0.8198, test_loss: 0.8673, test_f1: 0.5431
 epoch: 80, train_loss: 0.8186, test_loss: 0.8584, test_f1: 0.5447
 epoch: 81, train_loss: 0.8205, test_loss: 0.8722, test_f1: 0.5419
 epoch: 82, train_loss: 0.8205, test_loss: 0.8572, test_f1: 0.5433
 epoch: 83, train_loss: 0.8172, test_loss: 0.8569, test_f1: 0.5420
 epoch: 84, train_loss: 0.8118, test_loss: 0.8648, test_f1: 0.5461
 epoch: 85, train_loss: 0.8109, test_loss: 0.8597, test_f1: 0.5497
 epoch: 86, train_loss: 0.8108, test_loss: 0.8545, test_f1: 0.5419
 epoch: 87, train_loss: 0.8094, test_loss: 0.8567, test_f1: 0.5400
 epoch: 88, train_loss: 0.8088, test_loss: 0.8622, test_f1: 0.5442
 epoch: 89, train_loss: 0.8103, test_loss: 0.8565, test_f1: 0.5416
 epoch: 90, train_loss: 0.8150, test_loss: 0.8513, test_f1: 0.5413
 epoch: 91, train_loss: 0.8081, test_loss: 0.8626, test_f1: 0.5460
 epoch: 92, train_loss: 0.8098, test_loss: 0.8579, test_f1: 0.5385
 epoch: 93, train_loss: 0.8031, test_loss: 0.8578, test_f1: 0.5478
 epoch: 94, train_loss: 0.8075, test_loss: 0.8594, test_f1: 0.5482
 epoch: 95, train_loss: 0.7996, test_loss: 0.8650, test_f1: 0.5422
 epoch: 96, train_loss: 0.8086, test_loss: 0.8698, test_f1: 0.5407
 epoch: 97, train_loss: 0.7980, test_loss: 0.8650, test_f1: 0.5461
 epoch: 98, train_loss: 0.8039, test_loss: 0.8574, test_f1: 0.5423
 epoch: 99, train_loss: 0.8010, test_loss: 0.8568, test_f1: 0.5490
##################ITERATION #5 ****************************************
 epoch: 0, train_loss: 1.2768, test_loss: 1.2457, test_f1: 0.2270
 epoch: 1, train_loss: 1.2030, test_loss: 1.1664, test_f1: 0.3360
 epoch: 2, train_loss: 1.1682, test_loss: 1.1171, test_f1: 0.3714
 epoch: 3, train_loss: 1.1482, test_loss: 1.0938, test_f1: 0.3852
 epoch: 4, train_loss: 1.1343, test_loss: 1.0760, test_f1: 0.4136
 epoch: 5, train_loss: 1.1092, test_loss: 1.0610, test_f1: 0.4286
 epoch: 6, train_loss: 1.0969, test_loss: 1.0453, test_f1: 0.4438
 epoch: 7, train_loss: 1.0778, test_loss: 1.0366, test_f1: 0.4478
 epoch: 8, train_loss: 1.0638, test_loss: 1.0203, test_f1: 0.4624
 epoch: 9, train_loss: 1.0513, test_loss: 1.0089, test_f1: 0.4577
 epoch: 10, train_loss: 1.0392, test_loss: 0.9971, test_f1: 0.4656
 epoch: 11, train_loss: 1.0296, test_loss: 0.9865, test_f1: 0.4686
 epoch: 12, train_loss: 1.0192, test_loss: 0.9826, test_f1: 0.4724
 epoch: 13, train_loss: 1.0041, test_loss: 0.9715, test_f1: 0.4708
 epoch: 14, train_loss: 0.9894, test_loss: 0.9623, test_f1: 0.4810
 epoch: 15, train_loss: 0.9917, test_loss: 0.9638, test_f1: 0.4787
 epoch: 16, train_loss: 0.9861, test_loss: 0.9552, test_f1: 0.4821
 epoch: 17, train_loss: 0.9812, test_loss: 0.9510, test_f1: 0.4813
 epoch: 18, train_loss: 0.9736, test_loss: 0.9450, test_f1: 0.4867
 epoch: 19, train_loss: 0.9661, test_loss: 0.9430, test_f1: 0.4878
 epoch: 20, train_loss: 0.9600, test_loss: 0.9383, test_f1: 0.4965
 epoch: 21, train_loss: 0.9610, test_loss: 0.9388, test_f1: 0.4875
 epoch: 22, train_loss: 0.9509, test_loss: 0.9355, test_f1: 0.4838
 epoch: 23, train_loss: 0.9476, test_loss: 0.9315, test_f1: 0.4901
 epoch: 24, train_loss: 0.9465, test_loss: 0.9361, test_f1: 0.4962
 epoch: 25, train_loss: 0.9348, test_loss: 0.9352, test_f1: 0.4903
 epoch: 26, train_loss: 0.9393, test_loss: 0.9357, test_f1: 0.5060
 epoch: 27, train_loss: 0.9348, test_loss: 0.9326, test_f1: 0.4982
 epoch: 28, train_loss: 0.9332, test_loss: 0.9209, test_f1: 0.5040
 epoch: 29, train_loss: 0.9204, test_loss: 0.9223, test_f1: 0.5018
 epoch: 30, train_loss: 0.9174, test_loss: 0.9261, test_f1: 0.5083
 epoch: 31, train_loss: 0.9164, test_loss: 0.9196, test_f1: 0.5100
 epoch: 32, train_loss: 0.9210, test_loss: 0.9212, test_f1: 0.4895
 epoch: 33, train_loss: 0.9239, test_loss: 0.9263, test_f1: 0.5163
 epoch: 34, train_loss: 0.9167, test_loss: 0.9165, test_f1: 0.5093
 epoch: 35, train_loss: 0.9034, test_loss: 0.9222, test_f1: 0.5106
 epoch: 36, train_loss: 0.9036, test_loss: 0.9176, test_f1: 0.5201
 epoch: 37, train_loss: 0.9045, test_loss: 0.9194, test_f1: 0.5145
 epoch: 38, train_loss: 0.8986, test_loss: 0.9157, test_f1: 0.5229
 epoch: 39, train_loss: 0.8972, test_loss: 0.9050, test_f1: 0.5244
 epoch: 40, train_loss: 0.8997, test_loss: 0.9158, test_f1: 0.5094
 epoch: 41, train_loss: 0.8893, test_loss: 0.9191, test_f1: 0.5104
 epoch: 42, train_loss: 0.8918, test_loss: 0.9061, test_f1: 0.5277
 epoch: 43, train_loss: 0.8927, test_loss: 0.9228, test_f1: 0.5068
 epoch: 44, train_loss: 0.8840, test_loss: 0.9149, test_f1: 0.5094
 epoch: 45, train_loss: 0.8748, test_loss: 0.9149, test_f1: 0.5155
 epoch: 46, train_loss: 0.8767, test_loss: 0.9177, test_f1: 0.5088
 epoch: 47, train_loss: 0.8707, test_loss: 0.9120, test_f1: 0.5036
 epoch: 48, train_loss: 0.8784, test_loss: 0.9076, test_f1: 0.5194
 epoch: 49, train_loss: 0.8780, test_loss: 0.9133, test_f1: 0.5168
 epoch: 50, train_loss: 0.8699, test_loss: 0.9139, test_f1: 0.5238
 epoch: 51, train_loss: 0.8715, test_loss: 0.9038, test_f1: 0.5210
 epoch: 52, train_loss: 0.8668, test_loss: 0.9082, test_f1: 0.5171
 epoch: 53, train_loss: 0.8651, test_loss: 0.9097, test_f1: 0.5256
 epoch: 54, train_loss: 0.8588, test_loss: 0.9212, test_f1: 0.5153
 epoch: 55, train_loss: 0.8552, test_loss: 0.9222, test_f1: 0.5134
 epoch: 56, train_loss: 0.8511, test_loss: 0.9099, test_f1: 0.5242
 epoch: 57, train_loss: 0.8540, test_loss: 0.9154, test_f1: 0.5297
 epoch: 58, train_loss: 0.8565, test_loss: 0.9193, test_f1: 0.5341
 epoch: 59, train_loss: 0.8459, test_loss: 0.9110, test_f1: 0.5249
 epoch: 60, train_loss: 0.8533, test_loss: 0.9104, test_f1: 0.5322
 epoch: 61, train_loss: 0.8538, test_loss: 0.9142, test_f1: 0.5280
 epoch: 62, train_loss: 0.8561, test_loss: 0.9189, test_f1: 0.5336
 epoch: 63, train_loss: 0.8569, test_loss: 0.9079, test_f1: 0.5350
 epoch: 64, train_loss: 0.8550, test_loss: 0.9181, test_f1: 0.5251
 epoch: 65, train_loss: 0.8463, test_loss: 0.9117, test_f1: 0.5152
 epoch: 66, train_loss: 0.8454, test_loss: 0.9144, test_f1: 0.5259
 epoch: 67, train_loss: 0.8458, test_loss: 0.9160, test_f1: 0.5207
 epoch: 68, train_loss: 0.8463, test_loss: 0.9132, test_f1: 0.5273
 epoch: 69, train_loss: 0.8401, test_loss: 0.9140, test_f1: 0.5293
 epoch: 70, train_loss: 0.8402, test_loss: 0.9100, test_f1: 0.5212
 epoch: 71, train_loss: 0.8433, test_loss: 0.9138, test_f1: 0.5252
 epoch: 72, train_loss: 0.8470, test_loss: 0.9160, test_f1: 0.5167
 epoch: 73, train_loss: 0.8403, test_loss: 0.9164, test_f1: 0.5174
 epoch: 74, train_loss: 0.8369, test_loss: 0.9150, test_f1: 0.5217
 epoch: 75, train_loss: 0.8391, test_loss: 0.9155, test_f1: 0.5277
 epoch: 76, train_loss: 0.8352, test_loss: 0.9180, test_f1: 0.5321
 epoch: 77, train_loss: 0.8364, test_loss: 0.9214, test_f1: 0.5310
 epoch: 78, train_loss: 0.8329, test_loss: 0.9149, test_f1: 0.5274
 epoch: 79, train_loss: 0.8350, test_loss: 0.9140, test_f1: 0.5264
 epoch: 80, train_loss: 0.8324, test_loss: 0.9237, test_f1: 0.5200
 epoch: 81, train_loss: 0.8312, test_loss: 0.9237, test_f1: 0.5179
 epoch: 82, train_loss: 0.8403, test_loss: 0.9222, test_f1: 0.5200
 epoch: 83, train_loss: 0.8323, test_loss: 0.9174, test_f1: 0.5224
 epoch: 84, train_loss: 0.8219, test_loss: 0.9245, test_f1: 0.5284
 epoch: 85, train_loss: 0.8170, test_loss: 0.9246, test_f1: 0.5270
 epoch: 86, train_loss: 0.8257, test_loss: 0.9172, test_f1: 0.5287
 epoch: 87, train_loss: 0.8346, test_loss: 0.9266, test_f1: 0.5331
 epoch: 88, train_loss: 0.8310, test_loss: 0.9256, test_f1: 0.5284
 epoch: 89, train_loss: 0.8292, test_loss: 0.9169, test_f1: 0.5284
 epoch: 90, train_loss: 0.8235, test_loss: 0.9219, test_f1: 0.5377
 epoch: 91, train_loss: 0.8234, test_loss: 0.9283, test_f1: 0.5270
 epoch: 92, train_loss: 0.8235, test_loss: 0.9170, test_f1: 0.5284
 epoch: 93, train_loss: 0.8139, test_loss: 0.9235, test_f1: 0.5331
 epoch: 94, train_loss: 0.8207, test_loss: 0.9290, test_f1: 0.5259
 epoch: 95, train_loss: 0.8119, test_loss: 0.9303, test_f1: 0.5280
 epoch: 96, train_loss: 0.8159, test_loss: 0.9317, test_f1: 0.5346
 epoch: 97, train_loss: 0.8202, test_loss: 0.9158, test_f1: 0.5234
 epoch: 98, train_loss: 0.8159, test_loss: 0.9223, test_f1: 0.5277
 epoch: 99, train_loss: 0.8108, test_loss: 0.9354, test_f1: 0.5224
##################ITERATION #6 ****************************************
 epoch: 0, train_loss: 1.3178, test_loss: 1.3134, test_f1: 0.2270
 epoch: 1, train_loss: 1.2106, test_loss: 1.2129, test_f1: 0.2569
 epoch: 2, train_loss: 1.1805, test_loss: 1.1379, test_f1: 0.3411
 epoch: 3, train_loss: 1.1537, test_loss: 1.1021, test_f1: 0.3578
 epoch: 4, train_loss: 1.1371, test_loss: 1.0805, test_f1: 0.3893
 epoch: 5, train_loss: 1.1076, test_loss: 1.0647, test_f1: 0.4069
 epoch: 6, train_loss: 1.0920, test_loss: 1.0518, test_f1: 0.4236
 epoch: 7, train_loss: 1.0748, test_loss: 1.0386, test_f1: 0.4358
 epoch: 8, train_loss: 1.0574, test_loss: 1.0254, test_f1: 0.4389
 epoch: 9, train_loss: 1.0442, test_loss: 1.0205, test_f1: 0.4684
 epoch: 10, train_loss: 1.0293, test_loss: 1.0185, test_f1: 0.4609
 epoch: 11, train_loss: 1.0236, test_loss: 1.0052, test_f1: 0.4768
 epoch: 12, train_loss: 1.0126, test_loss: 1.0093, test_f1: 0.4638
 epoch: 13, train_loss: 1.0040, test_loss: 1.0060, test_f1: 0.4689
 epoch: 14, train_loss: 0.9948, test_loss: 0.9950, test_f1: 0.4814
 epoch: 15, train_loss: 0.9874, test_loss: 0.9998, test_f1: 0.4848
 epoch: 16, train_loss: 0.9841, test_loss: 0.9976, test_f1: 0.4812
 epoch: 17, train_loss: 0.9792, test_loss: 0.9903, test_f1: 0.4853
 epoch: 18, train_loss: 0.9704, test_loss: 0.9873, test_f1: 0.4895
 epoch: 19, train_loss: 0.9657, test_loss: 0.9840, test_f1: 0.4864
 epoch: 20, train_loss: 0.9554, test_loss: 0.9772, test_f1: 0.4978
 epoch: 21, train_loss: 0.9538, test_loss: 0.9872, test_f1: 0.4993
 epoch: 22, train_loss: 0.9396, test_loss: 0.9866, test_f1: 0.5067
 epoch: 23, train_loss: 0.9413, test_loss: 0.9757, test_f1: 0.5060
 epoch: 24, train_loss: 0.9344, test_loss: 0.9877, test_f1: 0.5161
 epoch: 25, train_loss: 0.9321, test_loss: 0.9863, test_f1: 0.5098
 epoch: 26, train_loss: 0.9308, test_loss: 0.9807, test_f1: 0.5073
 epoch: 27, train_loss: 0.9272, test_loss: 0.9809, test_f1: 0.5255
 epoch: 28, train_loss: 0.9186, test_loss: 0.9755, test_f1: 0.5129
 epoch: 29, train_loss: 0.9210, test_loss: 0.9890, test_f1: 0.5237
 epoch: 30, train_loss: 0.9213, test_loss: 0.9828, test_f1: 0.5275
 epoch: 31, train_loss: 0.9082, test_loss: 0.9885, test_f1: 0.5169
 epoch: 32, train_loss: 0.9068, test_loss: 0.9817, test_f1: 0.5196
 epoch: 33, train_loss: 0.9022, test_loss: 0.9695, test_f1: 0.5307
 epoch: 34, train_loss: 0.8968, test_loss: 0.9811, test_f1: 0.5093
 epoch: 35, train_loss: 0.9058, test_loss: 0.9806, test_f1: 0.5383
 epoch: 36, train_loss: 0.8986, test_loss: 0.9706, test_f1: 0.5352
 epoch: 37, train_loss: 0.8845, test_loss: 0.9751, test_f1: 0.5251
 epoch: 38, train_loss: 0.8814, test_loss: 0.9778, test_f1: 0.5382
 epoch: 39, train_loss: 0.8897, test_loss: 0.9830, test_f1: 0.5267
 epoch: 40, train_loss: 0.8816, test_loss: 0.9844, test_f1: 0.5279
 epoch: 41, train_loss: 0.8723, test_loss: 0.9768, test_f1: 0.5371
 epoch: 42, train_loss: 0.8725, test_loss: 0.9779, test_f1: 0.5394
 epoch: 43, train_loss: 0.8739, test_loss: 0.9853, test_f1: 0.5412
 epoch: 44, train_loss: 0.8691, test_loss: 0.9753, test_f1: 0.5360
 epoch: 45, train_loss: 0.8691, test_loss: 0.9860, test_f1: 0.5388
 epoch: 46, train_loss: 0.8625, test_loss: 0.9804, test_f1: 0.5269
 epoch: 47, train_loss: 0.8628, test_loss: 0.9777, test_f1: 0.5445
 epoch: 48, train_loss: 0.8543, test_loss: 0.9770, test_f1: 0.5393
 epoch: 49, train_loss: 0.8536, test_loss: 0.9847, test_f1: 0.5432
 epoch: 50, train_loss: 0.8539, test_loss: 0.9777, test_f1: 0.5387
 epoch: 51, train_loss: 0.8552, test_loss: 0.9829, test_f1: 0.5302
 epoch: 52, train_loss: 0.8442, test_loss: 0.9816, test_f1: 0.5408
 epoch: 53, train_loss: 0.8424, test_loss: 0.9818, test_f1: 0.5448
 epoch: 54, train_loss: 0.8463, test_loss: 0.9809, test_f1: 0.5431
 epoch: 55, train_loss: 0.8474, test_loss: 0.9808, test_f1: 0.5389
 epoch: 56, train_loss: 0.8430, test_loss: 0.9777, test_f1: 0.5414
 epoch: 57, train_loss: 0.8458, test_loss: 0.9852, test_f1: 0.5424
 epoch: 58, train_loss: 0.8371, test_loss: 0.9866, test_f1: 0.5426
 epoch: 59, train_loss: 0.8429, test_loss: 0.9883, test_f1: 0.5450
 epoch: 60, train_loss: 0.8386, test_loss: 0.9813, test_f1: 0.5432
 epoch: 61, train_loss: 0.8401, test_loss: 0.9876, test_f1: 0.5453
 epoch: 62, train_loss: 0.8325, test_loss: 0.9870, test_f1: 0.5476
 epoch: 63, train_loss: 0.8322, test_loss: 0.9897, test_f1: 0.5536
 epoch: 64, train_loss: 0.8320, test_loss: 0.9848, test_f1: 0.5474
 epoch: 65, train_loss: 0.8394, test_loss: 0.9862, test_f1: 0.5517
 epoch: 66, train_loss: 0.8338, test_loss: 0.9834, test_f1: 0.5545
 epoch: 67, train_loss: 0.8268, test_loss: 0.9881, test_f1: 0.5500
 epoch: 68, train_loss: 0.8304, test_loss: 0.9877, test_f1: 0.5594
 epoch: 69, train_loss: 0.8192, test_loss: 0.9849, test_f1: 0.5586
 epoch: 70, train_loss: 0.8296, test_loss: 0.9852, test_f1: 0.5542
 epoch: 71, train_loss: 0.8274, test_loss: 0.9938, test_f1: 0.5535
 epoch: 72, train_loss: 0.8245, test_loss: 0.9854, test_f1: 0.5581
 epoch: 73, train_loss: 0.8272, test_loss: 0.9923, test_f1: 0.5522
 epoch: 74, train_loss: 0.8282, test_loss: 0.9842, test_f1: 0.5570
 epoch: 75, train_loss: 0.8268, test_loss: 0.9938, test_f1: 0.5564
 epoch: 76, train_loss: 0.8254, test_loss: 0.9942, test_f1: 0.5511
 epoch: 77, train_loss: 0.8294, test_loss: 0.9891, test_f1: 0.5608
 epoch: 78, train_loss: 0.8162, test_loss: 0.9906, test_f1: 0.5637
 epoch: 79, train_loss: 0.8241, test_loss: 0.9876, test_f1: 0.5568
 epoch: 80, train_loss: 0.8202, test_loss: 0.9820, test_f1: 0.5636
 epoch: 81, train_loss: 0.8121, test_loss: 0.9955, test_f1: 0.5611
 epoch: 82, train_loss: 0.8046, test_loss: 0.9882, test_f1: 0.5662
 epoch: 83, train_loss: 0.8222, test_loss: 0.9890, test_f1: 0.5619
 epoch: 84, train_loss: 0.8163, test_loss: 0.9939, test_f1: 0.5691
 epoch: 85, train_loss: 0.8122, test_loss: 0.9901, test_f1: 0.5578
 epoch: 86, train_loss: 0.8135, test_loss: 0.9908, test_f1: 0.5699
 epoch: 87, train_loss: 0.8119, test_loss: 0.9882, test_f1: 0.5677
 epoch: 88, train_loss: 0.8086, test_loss: 0.9895, test_f1: 0.5652
 epoch: 89, train_loss: 0.8019, test_loss: 0.9915, test_f1: 0.5668
 epoch: 90, train_loss: 0.8072, test_loss: 0.9917, test_f1: 0.5607
 epoch: 91, train_loss: 0.8169, test_loss: 0.9953, test_f1: 0.5702
 epoch: 92, train_loss: 0.8027, test_loss: 0.9948, test_f1: 0.5650
 epoch: 93, train_loss: 0.8006, test_loss: 0.9886, test_f1: 0.5636
 epoch: 94, train_loss: 0.8063, test_loss: 0.9832, test_f1: 0.5645
 epoch: 95, train_loss: 0.8018, test_loss: 0.9916, test_f1: 0.5720
 epoch: 96, train_loss: 0.8000, test_loss: 0.9827, test_f1: 0.5649
 epoch: 97, train_loss: 0.8064, test_loss: 0.9853, test_f1: 0.5728
 epoch: 98, train_loss: 0.7979, test_loss: 0.9958, test_f1: 0.5622
 epoch: 99, train_loss: 0.7991, test_loss: 0.9909, test_f1: 0.5683
##################ITERATION #7 ****************************************
 epoch: 0, train_loss: 1.3408, test_loss: 1.3190, test_f1: 0.2270
 epoch: 1, train_loss: 1.2122, test_loss: 1.2111, test_f1: 0.2320
 epoch: 2, train_loss: 1.1831, test_loss: 1.1182, test_f1: 0.3491
 epoch: 3, train_loss: 1.1594, test_loss: 1.0855, test_f1: 0.3853
 epoch: 4, train_loss: 1.1343, test_loss: 1.0660, test_f1: 0.4033
 epoch: 5, train_loss: 1.1152, test_loss: 1.0536, test_f1: 0.4207
 epoch: 6, train_loss: 1.0981, test_loss: 1.0404, test_f1: 0.4460
 epoch: 7, train_loss: 1.0809, test_loss: 1.0280, test_f1: 0.4522
 epoch: 8, train_loss: 1.0691, test_loss: 1.0205, test_f1: 0.4504
 epoch: 9, train_loss: 1.0540, test_loss: 1.0088, test_f1: 0.4545
 epoch: 10, train_loss: 1.0586, test_loss: 1.0026, test_f1: 0.4523
 epoch: 11, train_loss: 1.0346, test_loss: 1.0029, test_f1: 0.4557
 epoch: 12, train_loss: 1.0211, test_loss: 0.9933, test_f1: 0.4586
 epoch: 13, train_loss: 1.0217, test_loss: 0.9887, test_f1: 0.4606
 epoch: 14, train_loss: 1.0074, test_loss: 0.9875, test_f1: 0.4592
 epoch: 15, train_loss: 1.0047, test_loss: 0.9779, test_f1: 0.4669
 epoch: 16, train_loss: 0.9865, test_loss: 0.9780, test_f1: 0.4652
 epoch: 17, train_loss: 0.9927, test_loss: 0.9731, test_f1: 0.4724
 epoch: 18, train_loss: 0.9816, test_loss: 0.9677, test_f1: 0.4712
 epoch: 19, train_loss: 0.9779, test_loss: 0.9694, test_f1: 0.4727
 epoch: 20, train_loss: 0.9732, test_loss: 0.9656, test_f1: 0.4819
 epoch: 21, train_loss: 0.9656, test_loss: 0.9672, test_f1: 0.4843
 epoch: 22, train_loss: 0.9610, test_loss: 0.9659, test_f1: 0.4866
 epoch: 23, train_loss: 0.9659, test_loss: 0.9559, test_f1: 0.4945
 epoch: 24, train_loss: 0.9460, test_loss: 0.9521, test_f1: 0.4977
 epoch: 25, train_loss: 0.9445, test_loss: 0.9521, test_f1: 0.4932
 epoch: 26, train_loss: 0.9428, test_loss: 0.9504, test_f1: 0.4967
 epoch: 27, train_loss: 0.9426, test_loss: 0.9474, test_f1: 0.4996
 epoch: 28, train_loss: 0.9332, test_loss: 0.9468, test_f1: 0.5081
 epoch: 29, train_loss: 0.9314, test_loss: 0.9418, test_f1: 0.5090
 epoch: 30, train_loss: 0.9293, test_loss: 0.9416, test_f1: 0.5142
 epoch: 31, train_loss: 0.9364, test_loss: 0.9364, test_f1: 0.5177
 epoch: 32, train_loss: 0.9186, test_loss: 0.9406, test_f1: 0.5311
 epoch: 33, train_loss: 0.9141, test_loss: 0.9353, test_f1: 0.5232
 epoch: 34, train_loss: 0.9126, test_loss: 0.9362, test_f1: 0.5173
 epoch: 35, train_loss: 0.9119, test_loss: 0.9274, test_f1: 0.5280
 epoch: 36, train_loss: 0.9050, test_loss: 0.9180, test_f1: 0.5350
 epoch: 37, train_loss: 0.9155, test_loss: 0.9271, test_f1: 0.5350
 epoch: 38, train_loss: 0.9019, test_loss: 0.9249, test_f1: 0.5282
 epoch: 39, train_loss: 0.9011, test_loss: 0.9297, test_f1: 0.5289
 epoch: 40, train_loss: 0.8974, test_loss: 0.9239, test_f1: 0.5350
 epoch: 41, train_loss: 0.8976, test_loss: 0.9192, test_f1: 0.5324
 epoch: 42, train_loss: 0.8878, test_loss: 0.9137, test_f1: 0.5381
 epoch: 43, train_loss: 0.8852, test_loss: 0.9239, test_f1: 0.5323
 epoch: 44, train_loss: 0.8830, test_loss: 0.9230, test_f1: 0.5293
 epoch: 45, train_loss: 0.8825, test_loss: 0.9191, test_f1: 0.5266
 epoch: 46, train_loss: 0.8851, test_loss: 0.9232, test_f1: 0.5363
 epoch: 47, train_loss: 0.8863, test_loss: 0.9092, test_f1: 0.5456
 epoch: 48, train_loss: 0.8695, test_loss: 0.9188, test_f1: 0.5407
 epoch: 49, train_loss: 0.8748, test_loss: 0.9319, test_f1: 0.5396
 epoch: 50, train_loss: 0.8712, test_loss: 0.9167, test_f1: 0.5368
 epoch: 51, train_loss: 0.8691, test_loss: 0.9093, test_f1: 0.5360
 epoch: 52, train_loss: 0.8606, test_loss: 0.9174, test_f1: 0.5367
 epoch: 53, train_loss: 0.8677, test_loss: 0.9148, test_f1: 0.5441
 epoch: 54, train_loss: 0.8640, test_loss: 0.9204, test_f1: 0.5406
 epoch: 55, train_loss: 0.8660, test_loss: 0.9186, test_f1: 0.5335
 epoch: 56, train_loss: 0.8573, test_loss: 0.9114, test_f1: 0.5394
 epoch: 57, train_loss: 0.8643, test_loss: 0.9142, test_f1: 0.5378
 epoch: 58, train_loss: 0.8618, test_loss: 0.9324, test_f1: 0.5392
 epoch: 59, train_loss: 0.8521, test_loss: 0.9058, test_f1: 0.5428
 epoch: 60, train_loss: 0.8559, test_loss: 0.9178, test_f1: 0.5458
 epoch: 61, train_loss: 0.8638, test_loss: 0.9209, test_f1: 0.5367
 epoch: 62, train_loss: 0.8544, test_loss: 0.9152, test_f1: 0.5481
 epoch: 63, train_loss: 0.8621, test_loss: 0.9112, test_f1: 0.5383
 epoch: 64, train_loss: 0.8495, test_loss: 0.9085, test_f1: 0.5341
 epoch: 65, train_loss: 0.8575, test_loss: 0.9142, test_f1: 0.5471
 epoch: 66, train_loss: 0.8433, test_loss: 0.9084, test_f1: 0.5403
 epoch: 67, train_loss: 0.8553, test_loss: 0.9084, test_f1: 0.5428
 epoch: 68, train_loss: 0.8491, test_loss: 0.9139, test_f1: 0.5378
 epoch: 69, train_loss: 0.8461, test_loss: 0.9099, test_f1: 0.5437
 epoch: 70, train_loss: 0.8477, test_loss: 0.9186, test_f1: 0.5443
 epoch: 71, train_loss: 0.8542, test_loss: 0.9164, test_f1: 0.5410
 epoch: 72, train_loss: 0.8471, test_loss: 0.9182, test_f1: 0.5454
 epoch: 73, train_loss: 0.8437, test_loss: 0.9191, test_f1: 0.5416
 epoch: 74, train_loss: 0.8437, test_loss: 0.9202, test_f1: 0.5432
 epoch: 75, train_loss: 0.8436, test_loss: 0.9112, test_f1: 0.5461
 epoch: 76, train_loss: 0.8428, test_loss: 0.9129, test_f1: 0.5464
 epoch: 77, train_loss: 0.8430, test_loss: 0.9134, test_f1: 0.5457
 epoch: 78, train_loss: 0.8405, test_loss: 0.9121, test_f1: 0.5469
 epoch: 79, train_loss: 0.8393, test_loss: 0.9058, test_f1: 0.5471
 epoch: 80, train_loss: 0.8419, test_loss: 0.9123, test_f1: 0.5470
 epoch: 81, train_loss: 0.8356, test_loss: 0.9033, test_f1: 0.5414
 epoch: 82, train_loss: 0.8324, test_loss: 0.9050, test_f1: 0.5445
 epoch: 83, train_loss: 0.8331, test_loss: 0.9028, test_f1: 0.5484
 epoch: 84, train_loss: 0.8332, test_loss: 0.9063, test_f1: 0.5371
 epoch: 85, train_loss: 0.8283, test_loss: 0.9098, test_f1: 0.5461
 epoch: 86, train_loss: 0.8400, test_loss: 0.9050, test_f1: 0.5519
 epoch: 87, train_loss: 0.8299, test_loss: 0.9029, test_f1: 0.5497
 epoch: 88, train_loss: 0.8271, test_loss: 0.9061, test_f1: 0.5407
 epoch: 89, train_loss: 0.8287, test_loss: 0.9052, test_f1: 0.5321
 epoch: 90, train_loss: 0.8274, test_loss: 0.9082, test_f1: 0.5441
 epoch: 91, train_loss: 0.8360, test_loss: 0.9096, test_f1: 0.5407
 epoch: 92, train_loss: 0.8375, test_loss: 0.9128, test_f1: 0.5354
 epoch: 93, train_loss: 0.8250, test_loss: 0.9109, test_f1: 0.5464
 epoch: 94, train_loss: 0.8240, test_loss: 0.9005, test_f1: 0.5395
 epoch: 95, train_loss: 0.8235, test_loss: 0.9099, test_f1: 0.5324
 epoch: 96, train_loss: 0.8223, test_loss: 0.9121, test_f1: 0.5298
 epoch: 97, train_loss: 0.8235, test_loss: 0.9108, test_f1: 0.5308
 epoch: 98, train_loss: 0.8092, test_loss: 0.9126, test_f1: 0.5311
 epoch: 99, train_loss: 0.8151, test_loss: 0.9083, test_f1: 0.5398
##################ITERATION #8 ****************************************
 epoch: 0, train_loss: 1.2862, test_loss: 1.2398, test_f1: 0.2295
 epoch: 1, train_loss: 1.1928, test_loss: 1.1653, test_f1: 0.3087
 epoch: 2, train_loss: 1.1693, test_loss: 1.0979, test_f1: 0.3729
 epoch: 3, train_loss: 1.1456, test_loss: 1.0765, test_f1: 0.3949
 epoch: 4, train_loss: 1.1084, test_loss: 1.0536, test_f1: 0.4058
 epoch: 5, train_loss: 1.1059, test_loss: 1.0350, test_f1: 0.4177
 epoch: 6, train_loss: 1.0748, test_loss: 1.0198, test_f1: 0.4251
 epoch: 7, train_loss: 1.0645, test_loss: 1.0095, test_f1: 0.4307
 epoch: 8, train_loss: 1.0446, test_loss: 0.9985, test_f1: 0.4431
 epoch: 9, train_loss: 1.0334, test_loss: 0.9918, test_f1: 0.4479
 epoch: 10, train_loss: 1.0282, test_loss: 0.9864, test_f1: 0.4542
 epoch: 11, train_loss: 1.0173, test_loss: 0.9769, test_f1: 0.4681
 epoch: 12, train_loss: 1.0011, test_loss: 0.9709, test_f1: 0.4629
 epoch: 13, train_loss: 0.9939, test_loss: 0.9626, test_f1: 0.4954
 epoch: 14, train_loss: 0.9889, test_loss: 0.9697, test_f1: 0.4699
 epoch: 15, train_loss: 0.9823, test_loss: 0.9639, test_f1: 0.4983
 epoch: 16, train_loss: 0.9759, test_loss: 0.9606, test_f1: 0.5041
 epoch: 17, train_loss: 0.9741, test_loss: 0.9602, test_f1: 0.5046
 epoch: 18, train_loss: 0.9683, test_loss: 0.9548, test_f1: 0.5049
 epoch: 19, train_loss: 0.9676, test_loss: 0.9539, test_f1: 0.5021
 epoch: 20, train_loss: 0.9534, test_loss: 0.9540, test_f1: 0.5166
 epoch: 21, train_loss: 0.9496, test_loss: 0.9486, test_f1: 0.5119
 epoch: 22, train_loss: 0.9483, test_loss: 0.9495, test_f1: 0.5096
 epoch: 23, train_loss: 0.9466, test_loss: 0.9567, test_f1: 0.5067
 epoch: 24, train_loss: 0.9364, test_loss: 0.9459, test_f1: 0.5074
 epoch: 25, train_loss: 0.9293, test_loss: 0.9454, test_f1: 0.5183
 epoch: 26, train_loss: 0.9338, test_loss: 0.9450, test_f1: 0.5266
 epoch: 27, train_loss: 0.9223, test_loss: 0.9609, test_f1: 0.5047
 epoch: 28, train_loss: 0.9200, test_loss: 0.9493, test_f1: 0.5052
 epoch: 29, train_loss: 0.9305, test_loss: 0.9447, test_f1: 0.5337
 epoch: 30, train_loss: 0.9172, test_loss: 0.9427, test_f1: 0.5285
 epoch: 31, train_loss: 0.9241, test_loss: 0.9495, test_f1: 0.5116
 epoch: 32, train_loss: 0.9115, test_loss: 0.9463, test_f1: 0.5216
 epoch: 33, train_loss: 0.9147, test_loss: 0.9410, test_f1: 0.5106
 epoch: 34, train_loss: 0.9054, test_loss: 0.9515, test_f1: 0.5105
 epoch: 35, train_loss: 0.9016, test_loss: 0.9433, test_f1: 0.5265
 epoch: 36, train_loss: 0.9094, test_loss: 0.9445, test_f1: 0.5211
 epoch: 37, train_loss: 0.9038, test_loss: 0.9519, test_f1: 0.5235
 epoch: 38, train_loss: 0.8917, test_loss: 0.9465, test_f1: 0.5291
 epoch: 39, train_loss: 0.8956, test_loss: 0.9459, test_f1: 0.5219
 epoch: 40, train_loss: 0.8889, test_loss: 0.9517, test_f1: 0.5289
 epoch: 41, train_loss: 0.8942, test_loss: 0.9442, test_f1: 0.5355
 epoch: 42, train_loss: 0.8879, test_loss: 0.9376, test_f1: 0.5280
 epoch: 43, train_loss: 0.8919, test_loss: 0.9578, test_f1: 0.5192
 epoch: 44, train_loss: 0.8864, test_loss: 0.9398, test_f1: 0.5287
 epoch: 45, train_loss: 0.8830, test_loss: 0.9389, test_f1: 0.5307
 epoch: 46, train_loss: 0.8807, test_loss: 0.9468, test_f1: 0.5314
 epoch: 47, train_loss: 0.8756, test_loss: 0.9460, test_f1: 0.5250
 epoch: 48, train_loss: 0.8759, test_loss: 0.9380, test_f1: 0.5247
 epoch: 49, train_loss: 0.8768, test_loss: 0.9457, test_f1: 0.5203
 epoch: 50, train_loss: 0.8706, test_loss: 0.9471, test_f1: 0.5276
 epoch: 51, train_loss: 0.8605, test_loss: 0.9392, test_f1: 0.5230
 epoch: 52, train_loss: 0.8758, test_loss: 0.9375, test_f1: 0.5378
 epoch: 53, train_loss: 0.8580, test_loss: 0.9461, test_f1: 0.5291
 epoch: 54, train_loss: 0.8600, test_loss: 0.9406, test_f1: 0.5347
 epoch: 55, train_loss: 0.8609, test_loss: 0.9414, test_f1: 0.5235
 epoch: 56, train_loss: 0.8638, test_loss: 0.9454, test_f1: 0.5325
 epoch: 57, train_loss: 0.8570, test_loss: 0.9480, test_f1: 0.5251
 epoch: 58, train_loss: 0.8542, test_loss: 0.9438, test_f1: 0.5253
 epoch: 59, train_loss: 0.8575, test_loss: 0.9442, test_f1: 0.5346
 epoch: 60, train_loss: 0.8529, test_loss: 0.9449, test_f1: 0.5256
 epoch: 61, train_loss: 0.8547, test_loss: 0.9486, test_f1: 0.5373
 epoch: 62, train_loss: 0.8560, test_loss: 0.9491, test_f1: 0.5235
 epoch: 63, train_loss: 0.8556, test_loss: 0.9500, test_f1: 0.5229
 epoch: 64, train_loss: 0.8530, test_loss: 0.9455, test_f1: 0.5241
 epoch: 65, train_loss: 0.8485, test_loss: 0.9460, test_f1: 0.5234
 epoch: 66, train_loss: 0.8546, test_loss: 0.9348, test_f1: 0.5183
 epoch: 67, train_loss: 0.8473, test_loss: 0.9435, test_f1: 0.5225
 epoch: 68, train_loss: 0.8492, test_loss: 0.9435, test_f1: 0.5244
 epoch: 69, train_loss: 0.8470, test_loss: 0.9412, test_f1: 0.5167
 epoch: 70, train_loss: 0.8413, test_loss: 0.9485, test_f1: 0.5219
 epoch: 71, train_loss: 0.8461, test_loss: 0.9486, test_f1: 0.5345
 epoch: 72, train_loss: 0.8424, test_loss: 0.9454, test_f1: 0.5348
 epoch: 73, train_loss: 0.8399, test_loss: 0.9415, test_f1: 0.5239
 epoch: 74, train_loss: 0.8516, test_loss: 0.9525, test_f1: 0.5201
 epoch: 75, train_loss: 0.8442, test_loss: 0.9517, test_f1: 0.5216
 epoch: 76, train_loss: 0.8391, test_loss: 0.9454, test_f1: 0.5227
 epoch: 77, train_loss: 0.8360, test_loss: 0.9479, test_f1: 0.5194
 epoch: 78, train_loss: 0.8457, test_loss: 0.9499, test_f1: 0.5207
 epoch: 79, train_loss: 0.8411, test_loss: 0.9487, test_f1: 0.5235
 epoch: 80, train_loss: 0.8356, test_loss: 0.9460, test_f1: 0.5240
 epoch: 81, train_loss: 0.8384, test_loss: 0.9464, test_f1: 0.5217
 epoch: 82, train_loss: 0.8359, test_loss: 0.9508, test_f1: 0.5273
 epoch: 83, train_loss: 0.8320, test_loss: 0.9553, test_f1: 0.5173
 epoch: 84, train_loss: 0.8430, test_loss: 0.9549, test_f1: 0.5183
 epoch: 85, train_loss: 0.8337, test_loss: 0.9497, test_f1: 0.5197
 epoch: 86, train_loss: 0.8327, test_loss: 0.9450, test_f1: 0.5251
 epoch: 87, train_loss: 0.8300, test_loss: 0.9525, test_f1: 0.5195
 epoch: 88, train_loss: 0.8310, test_loss: 0.9528, test_f1: 0.5181
 epoch: 89, train_loss: 0.8221, test_loss: 0.9506, test_f1: 0.5194
 epoch: 90, train_loss: 0.8318, test_loss: 0.9498, test_f1: 0.5214
 epoch: 91, train_loss: 0.8252, test_loss: 0.9573, test_f1: 0.5225
 epoch: 92, train_loss: 0.8204, test_loss: 0.9469, test_f1: 0.5243
 epoch: 93, train_loss: 0.8164, test_loss: 0.9474, test_f1: 0.5218
 epoch: 94, train_loss: 0.8366, test_loss: 0.9483, test_f1: 0.5253
 epoch: 95, train_loss: 0.8225, test_loss: 0.9557, test_f1: 0.5226
 epoch: 96, train_loss: 0.8215, test_loss: 0.9528, test_f1: 0.5225
 epoch: 97, train_loss: 0.8172, test_loss: 0.9533, test_f1: 0.5225
 epoch: 98, train_loss: 0.8199, test_loss: 0.9575, test_f1: 0.5191
 epoch: 99, train_loss: 0.8159, test_loss: 0.9490, test_f1: 0.5206
##################ITERATION #9 ****************************************
 epoch: 0, train_loss: 1.3752, test_loss: 1.2934, test_f1: 0.2270
 epoch: 1, train_loss: 1.2394, test_loss: 1.1584, test_f1: 0.3232
 epoch: 2, train_loss: 1.2006, test_loss: 1.1023, test_f1: 0.3772
 epoch: 3, train_loss: 1.1709, test_loss: 1.0694, test_f1: 0.3829
 epoch: 4, train_loss: 1.1438, test_loss: 1.0532, test_f1: 0.3989
 epoch: 5, train_loss: 1.1255, test_loss: 1.0379, test_f1: 0.4053
 epoch: 6, train_loss: 1.0962, test_loss: 1.0273, test_f1: 0.4082
 epoch: 7, train_loss: 1.0851, test_loss: 1.0139, test_f1: 0.4264
 epoch: 8, train_loss: 1.0764, test_loss: 1.0095, test_f1: 0.4381
 epoch: 9, train_loss: 1.0673, test_loss: 1.0025, test_f1: 0.4453
 epoch: 10, train_loss: 1.0529, test_loss: 0.9913, test_f1: 0.4552
 epoch: 11, train_loss: 1.0374, test_loss: 0.9899, test_f1: 0.4555
 epoch: 12, train_loss: 1.0374, test_loss: 0.9830, test_f1: 0.4600
 epoch: 13, train_loss: 1.0184, test_loss: 0.9777, test_f1: 0.4590
 epoch: 14, train_loss: 1.0110, test_loss: 0.9732, test_f1: 0.4624
 epoch: 15, train_loss: 1.0156, test_loss: 0.9662, test_f1: 0.4615
 epoch: 16, train_loss: 0.9941, test_loss: 0.9594, test_f1: 0.4608
 epoch: 17, train_loss: 1.0030, test_loss: 0.9624, test_f1: 0.4650
 epoch: 18, train_loss: 0.9855, test_loss: 0.9585, test_f1: 0.4746
 epoch: 19, train_loss: 0.9925, test_loss: 0.9592, test_f1: 0.4725
 epoch: 20, train_loss: 0.9789, test_loss: 0.9482, test_f1: 0.4728
 epoch: 21, train_loss: 0.9793, test_loss: 0.9530, test_f1: 0.4710
 epoch: 22, train_loss: 0.9682, test_loss: 0.9461, test_f1: 0.4784
 epoch: 23, train_loss: 0.9581, test_loss: 0.9430, test_f1: 0.4825
 epoch: 24, train_loss: 0.9656, test_loss: 0.9491, test_f1: 0.4796
 epoch: 25, train_loss: 0.9550, test_loss: 0.9399, test_f1: 0.4902
 epoch: 26, train_loss: 0.9537, test_loss: 0.9405, test_f1: 0.4857
 epoch: 27, train_loss: 0.9457, test_loss: 0.9368, test_f1: 0.4903
 epoch: 28, train_loss: 0.9450, test_loss: 0.9351, test_f1: 0.4943
 epoch: 29, train_loss: 0.9408, test_loss: 0.9260, test_f1: 0.4887
 epoch: 30, train_loss: 0.9355, test_loss: 0.9301, test_f1: 0.4963
 epoch: 31, train_loss: 0.9262, test_loss: 0.9300, test_f1: 0.4961
 epoch: 32, train_loss: 0.9196, test_loss: 0.9275, test_f1: 0.4990
 epoch: 33, train_loss: 0.9198, test_loss: 0.9277, test_f1: 0.5009
 epoch: 34, train_loss: 0.9293, test_loss: 0.9258, test_f1: 0.5064
 epoch: 35, train_loss: 0.9175, test_loss: 0.9284, test_f1: 0.5059
 epoch: 36, train_loss: 0.9238, test_loss: 0.9337, test_f1: 0.5101
 epoch: 37, train_loss: 0.9114, test_loss: 0.9240, test_f1: 0.5129
 epoch: 38, train_loss: 0.9110, test_loss: 0.9229, test_f1: 0.5116
 epoch: 39, train_loss: 0.9095, test_loss: 0.9160, test_f1: 0.5159
 epoch: 40, train_loss: 0.9029, test_loss: 0.9215, test_f1: 0.5143
 epoch: 41, train_loss: 0.9003, test_loss: 0.9117, test_f1: 0.5087
 epoch: 42, train_loss: 0.9054, test_loss: 0.9144, test_f1: 0.5213
 epoch: 43, train_loss: 0.8961, test_loss: 0.9165, test_f1: 0.5165
 epoch: 44, train_loss: 0.8929, test_loss: 0.9245, test_f1: 0.5120
 epoch: 45, train_loss: 0.8969, test_loss: 0.9130, test_f1: 0.5155
 epoch: 46, train_loss: 0.8889, test_loss: 0.9260, test_f1: 0.5184
 epoch: 47, train_loss: 0.8848, test_loss: 0.9230, test_f1: 0.5293
 epoch: 48, train_loss: 0.8808, test_loss: 0.9060, test_f1: 0.5252
 epoch: 49, train_loss: 0.8827, test_loss: 0.9067, test_f1: 0.5227
 epoch: 50, train_loss: 0.8772, test_loss: 0.9124, test_f1: 0.5192
 epoch: 51, train_loss: 0.8693, test_loss: 0.9103, test_f1: 0.5226
 epoch: 52, train_loss: 0.8717, test_loss: 0.9124, test_f1: 0.5264
 epoch: 53, train_loss: 0.8742, test_loss: 0.9120, test_f1: 0.5340
 epoch: 54, train_loss: 0.8715, test_loss: 0.9084, test_f1: 0.5252
 epoch: 55, train_loss: 0.8746, test_loss: 0.9157, test_f1: 0.5240
 epoch: 56, train_loss: 0.8644, test_loss: 0.9063, test_f1: 0.5265
 epoch: 57, train_loss: 0.8766, test_loss: 0.9105, test_f1: 0.5236
 epoch: 58, train_loss: 0.8636, test_loss: 0.9131, test_f1: 0.5264
 epoch: 59, train_loss: 0.8635, test_loss: 0.9194, test_f1: 0.5281
 epoch: 60, train_loss: 0.8599, test_loss: 0.9024, test_f1: 0.5240
 epoch: 61, train_loss: 0.8661, test_loss: 0.9029, test_f1: 0.5260
 epoch: 62, train_loss: 0.8526, test_loss: 0.9174, test_f1: 0.5315
 epoch: 63, train_loss: 0.8651, test_loss: 0.9105, test_f1: 0.5272
 epoch: 64, train_loss: 0.8681, test_loss: 0.9085, test_f1: 0.5334
 epoch: 65, train_loss: 0.8606, test_loss: 0.9143, test_f1: 0.5325
 epoch: 66, train_loss: 0.8538, test_loss: 0.9179, test_f1: 0.5251
 epoch: 67, train_loss: 0.8502, test_loss: 0.9107, test_f1: 0.5226
 epoch: 68, train_loss: 0.8523, test_loss: 0.9032, test_f1: 0.5256
 epoch: 69, train_loss: 0.8470, test_loss: 0.9084, test_f1: 0.5340
 epoch: 70, train_loss: 0.8453, test_loss: 0.9094, test_f1: 0.5323
 epoch: 71, train_loss: 0.8504, test_loss: 0.9157, test_f1: 0.5293
 epoch: 72, train_loss: 0.8521, test_loss: 0.9097, test_f1: 0.5248
 epoch: 73, train_loss: 0.8587, test_loss: 0.9233, test_f1: 0.5336
 epoch: 74, train_loss: 0.8514, test_loss: 0.9124, test_f1: 0.5244
 epoch: 75, train_loss: 0.8492, test_loss: 0.9079, test_f1: 0.5309
 epoch: 76, train_loss: 0.8463, test_loss: 0.9089, test_f1: 0.5294
 epoch: 77, train_loss: 0.8542, test_loss: 0.9111, test_f1: 0.5323
 epoch: 78, train_loss: 0.8476, test_loss: 0.9190, test_f1: 0.5276
 epoch: 79, train_loss: 0.8481, test_loss: 0.9229, test_f1: 0.5408
 epoch: 80, train_loss: 0.8416, test_loss: 0.9119, test_f1: 0.5263
 epoch: 81, train_loss: 0.8307, test_loss: 0.9124, test_f1: 0.5242
 epoch: 82, train_loss: 0.8478, test_loss: 0.9212, test_f1: 0.5240
 epoch: 83, train_loss: 0.8369, test_loss: 0.9208, test_f1: 0.5278
 epoch: 84, train_loss: 0.8439, test_loss: 0.9232, test_f1: 0.5299
 epoch: 85, train_loss: 0.8390, test_loss: 0.9173, test_f1: 0.5347
 epoch: 86, train_loss: 0.8423, test_loss: 0.9230, test_f1: 0.5272
 epoch: 87, train_loss: 0.8384, test_loss: 0.9249, test_f1: 0.5334
 epoch: 88, train_loss: 0.8352, test_loss: 0.9164, test_f1: 0.5329
 epoch: 89, train_loss: 0.8359, test_loss: 0.9243, test_f1: 0.5306
 epoch: 90, train_loss: 0.8257, test_loss: 0.9185, test_f1: 0.5268
 epoch: 91, train_loss: 0.8407, test_loss: 0.9231, test_f1: 0.5281
 epoch: 92, train_loss: 0.8356, test_loss: 0.9169, test_f1: 0.5334
 epoch: 93, train_loss: 0.8247, test_loss: 0.9232, test_f1: 0.5300
 epoch: 94, train_loss: 0.8323, test_loss: 0.9258, test_f1: 0.5264
 epoch: 95, train_loss: 0.8265, test_loss: 0.9144, test_f1: 0.5347
 epoch: 96, train_loss: 0.8288, test_loss: 0.9184, test_f1: 0.5291
 epoch: 97, train_loss: 0.8367, test_loss: 0.9215, test_f1: 0.5416
 epoch: 98, train_loss: 0.8358, test_loss: 0.9103, test_f1: 0.5359
 epoch: 99, train_loss: 0.8282, test_loss: 0.9237, test_f1: 0.5347

Training completed in 431.21 seconds
Best F1: 0.5728 at epoch 97
Mean F1 across iterations: 0.5440  0.0138
========================FINAL RESULTS================================
FEGIN weighted F1: 0.5728  0.0138
python main.py --data ltspice_examples --representation component_net --model FEGIN --layers 2 --hiddens 64 --batch_size 128 --lr 0.0001 --emb_size 512 --epochs 100 --save_appendix component_net_L2_H64_BS128_LR0.0001_E512 --no_val
-----



STDERR:
  File "main.py", line 370, in <module>
    main()
  File "main.py", line 254, in main
    dataset = dataset_class(
  File "/home/philip/projects/ltspice_examples_code_repo/Circuit-Completion-Using-GNNs/component_classification_with_link_prediction_head/evaluation/FEGIN/kernel/circuit_datasets.py", line 15, in __init__
    self.data, self.slices = torch.load(self.processed_paths[0])
  File "/home/philip/.local/lib/python3.8/site-packages/torch/serialization.py", line 1040, in load
    warnings.warn(
  File "/usr/lib/python3.8/warnings.py", line 109, in _showwarnmsg
    sw(msg.message, msg.category, msg.filename, msg.lineno,
  File "main.py", line 47, in warn_with_traceback
    traceback.print_stack(file=log)
/home/philip/projects/ltspice_examples_code_repo/Circuit-Completion-Using-GNNs/component_classification_with_link_prediction_head/evaluation/FEGIN/kernel/circuit_datasets.py:15: FutureWarning: You are using `torch.load` with `weights_only=False` (the current default value), which uses the default pickle module implicitly. It is possible to construct malicious pickle data which will execute arbitrary code during unpickling (See https://github.com/pytorch/pytorch/blob/main/SECURITY.md#untrusted-models for more details). In a future release, the default value for `weights_only` will be flipped to `True`. This limits the functions that could be executed during unpickling. Arbitrary objects will no longer be allowed to be loaded via this mode unless they are explicitly allowlisted by the user via `torch.serialization.add_safe_globals`. We recommend you start setting `weights_only=True` for any use case where you don't have full control of the loaded file. Please open an issue on GitHub for any issues related to this experimental feature.
  self.data, self.slices = torch.load(self.processed_paths[0])
