STDOUT:
Results will be saved in /home/philip/projects/ltspice_examples_code_repo/Circuit-Completion-Using-GNNs/component_classification_with_link_prediction_head/evaluation/FEGIN/results/model_FEGIN_dataset_ltspice_examples
Command line input: python main.py --data ltspice_examples --representation component_pin --model FEGIN --layers 3 --hiddens 16 --batch_size 64 --lr 0.001 --emb_size 250 --epochs 100 --save_appendix component_pin_L3_H16_BS64_LR0.001_E250 --no_val
 is saved.
-----
ltspice_examples - FEGIN
Using 3 layers, 16 hidden units, h = 2
Loading component_pin representation dataset
ENTERED
Training FEGIN on component_pin representation
Train: 3560, Test: 848
##################ITERATION #0 ****************************************
 epoch: 0, train_loss: 1.3315, test_loss: 1.3089, test_f1: 0.2260
 epoch: 1, train_loss: 1.2642, test_loss: 1.2134, test_f1: 0.3392
 epoch: 2, train_loss: 1.1633, test_loss: 1.0928, test_f1: 0.3402
 epoch: 3, train_loss: 1.0876, test_loss: 1.0518, test_f1: 0.3445
 epoch: 4, train_loss: 1.0572, test_loss: 1.0389, test_f1: 0.3410
 epoch: 5, train_loss: 1.0375, test_loss: 1.0291, test_f1: 0.3410
 epoch: 6, train_loss: 1.0230, test_loss: 1.0256, test_f1: 0.3478
 epoch: 7, train_loss: 1.0035, test_loss: 1.1109, test_f1: 0.3293
 epoch: 8, train_loss: 0.9938, test_loss: 1.0078, test_f1: 0.3932
 epoch: 9, train_loss: 0.9811, test_loss: 1.0176, test_f1: 0.4294
 epoch: 10, train_loss: 0.9768, test_loss: 0.9991, test_f1: 0.4097
 epoch: 11, train_loss: 0.9750, test_loss: 0.9598, test_f1: 0.4422
 epoch: 12, train_loss: 0.9703, test_loss: 0.9932, test_f1: 0.4507
 epoch: 13, train_loss: 0.9536, test_loss: 1.0442, test_f1: 0.4556
 epoch: 14, train_loss: 0.9534, test_loss: 0.9711, test_f1: 0.4657
 epoch: 15, train_loss: 0.9460, test_loss: 0.9571, test_f1: 0.4671
 epoch: 16, train_loss: 0.9383, test_loss: 1.1118, test_f1: 0.4370
 epoch: 17, train_loss: 0.9399, test_loss: 1.0149, test_f1: 0.4542
 epoch: 18, train_loss: 0.9287, test_loss: 1.0092, test_f1: 0.4563
 epoch: 19, train_loss: 0.9205, test_loss: 1.1373, test_f1: 0.4345
 epoch: 20, train_loss: 0.9329, test_loss: 0.9565, test_f1: 0.4730
 epoch: 21, train_loss: 0.9119, test_loss: 0.9451, test_f1: 0.4981
 epoch: 22, train_loss: 0.9198, test_loss: 1.0152, test_f1: 0.4773
 epoch: 23, train_loss: 0.9020, test_loss: 1.0178, test_f1: 0.4837
 epoch: 24, train_loss: 0.9061, test_loss: 1.0685, test_f1: 0.4594
 epoch: 25, train_loss: 0.9027, test_loss: 0.9498, test_f1: 0.5010
 epoch: 26, train_loss: 0.8846, test_loss: 0.9725, test_f1: 0.5034
 epoch: 27, train_loss: 0.8866, test_loss: 0.9739, test_f1: 0.4869
 epoch: 28, train_loss: 0.8906, test_loss: 0.9458, test_f1: 0.4939
 epoch: 29, train_loss: 0.8780, test_loss: 0.9667, test_f1: 0.4825
 epoch: 30, train_loss: 0.8817, test_loss: 0.9286, test_f1: 0.4958
 epoch: 31, train_loss: 0.8662, test_loss: 0.9459, test_f1: 0.5109
 epoch: 32, train_loss: 0.8578, test_loss: 0.9579, test_f1: 0.5025
 epoch: 33, train_loss: 0.8586, test_loss: 0.9639, test_f1: 0.5054
 epoch: 34, train_loss: 0.8567, test_loss: 0.9311, test_f1: 0.5123
 epoch: 35, train_loss: 0.8513, test_loss: 0.9823, test_f1: 0.4881
 epoch: 36, train_loss: 0.8376, test_loss: 0.9733, test_f1: 0.5191
 epoch: 37, train_loss: 0.8308, test_loss: 0.9182, test_f1: 0.5147
 epoch: 38, train_loss: 0.8356, test_loss: 0.9596, test_f1: 0.5178
 epoch: 39, train_loss: 0.8284, test_loss: 0.9428, test_f1: 0.5096
 epoch: 40, train_loss: 0.8175, test_loss: 0.9308, test_f1: 0.5139
 epoch: 41, train_loss: 0.8161, test_loss: 0.9414, test_f1: 0.5013
 epoch: 42, train_loss: 0.8282, test_loss: 1.0081, test_f1: 0.5009
 epoch: 43, train_loss: 0.8144, test_loss: 0.9259, test_f1: 0.5289
 epoch: 44, train_loss: 0.7996, test_loss: 0.9011, test_f1: 0.5185
 epoch: 45, train_loss: 0.8063, test_loss: 0.9304, test_f1: 0.5259
 epoch: 46, train_loss: 0.7993, test_loss: 0.9548, test_f1: 0.5134
 epoch: 47, train_loss: 0.8022, test_loss: 0.9496, test_f1: 0.5135
 epoch: 48, train_loss: 0.7937, test_loss: 0.9408, test_f1: 0.5166
 epoch: 49, train_loss: 0.7864, test_loss: 0.9494, test_f1: 0.5310
 epoch: 50, train_loss: 0.8088, test_loss: 0.9194, test_f1: 0.5159
 epoch: 51, train_loss: 0.7800, test_loss: 0.9379, test_f1: 0.5222
 epoch: 52, train_loss: 0.7851, test_loss: 0.9340, test_f1: 0.5355
 epoch: 53, train_loss: 0.7686, test_loss: 0.9208, test_f1: 0.5400
 epoch: 54, train_loss: 0.7628, test_loss: 0.9287, test_f1: 0.5397
 epoch: 55, train_loss: 0.7633, test_loss: 0.9632, test_f1: 0.5217
 epoch: 56, train_loss: 0.7600, test_loss: 0.9285, test_f1: 0.5449
 epoch: 57, train_loss: 0.7650, test_loss: 0.9440, test_f1: 0.5330
 epoch: 58, train_loss: 0.7557, test_loss: 0.9665, test_f1: 0.5306
 epoch: 59, train_loss: 0.7651, test_loss: 0.9446, test_f1: 0.5418
 epoch: 60, train_loss: 0.7573, test_loss: 0.9205, test_f1: 0.5291
 epoch: 61, train_loss: 0.7598, test_loss: 0.9444, test_f1: 0.5296
 epoch: 62, train_loss: 0.7650, test_loss: 0.9557, test_f1: 0.5330
 epoch: 63, train_loss: 0.7560, test_loss: 0.9405, test_f1: 0.5215
 epoch: 64, train_loss: 0.7528, test_loss: 0.9551, test_f1: 0.5332
 epoch: 65, train_loss: 0.7568, test_loss: 0.9396, test_f1: 0.5233
 epoch: 66, train_loss: 0.7541, test_loss: 0.9362, test_f1: 0.5305
 epoch: 67, train_loss: 0.7528, test_loss: 0.9404, test_f1: 0.5271
 epoch: 68, train_loss: 0.7433, test_loss: 0.9400, test_f1: 0.5425
 epoch: 69, train_loss: 0.7405, test_loss: 0.9634, test_f1: 0.5329
 epoch: 70, train_loss: 0.7451, test_loss: 0.9446, test_f1: 0.5235
 epoch: 71, train_loss: 0.7508, test_loss: 0.9152, test_f1: 0.5395
 epoch: 72, train_loss: 0.7374, test_loss: 0.9736, test_f1: 0.5268
 epoch: 73, train_loss: 0.7506, test_loss: 0.9511, test_f1: 0.5413
 epoch: 74, train_loss: 0.7473, test_loss: 0.9568, test_f1: 0.5266
 epoch: 75, train_loss: 0.7452, test_loss: 0.9096, test_f1: 0.5363
 epoch: 76, train_loss: 0.7454, test_loss: 0.9801, test_f1: 0.5456
 epoch: 77, train_loss: 0.7365, test_loss: 0.9577, test_f1: 0.5347
 epoch: 78, train_loss: 0.7425, test_loss: 0.9554, test_f1: 0.5325
 epoch: 79, train_loss: 0.7346, test_loss: 0.9273, test_f1: 0.5311
 epoch: 80, train_loss: 0.7423, test_loss: 0.9656, test_f1: 0.5288
 epoch: 81, train_loss: 0.7430, test_loss: 0.9603, test_f1: 0.5402
 epoch: 82, train_loss: 0.7432, test_loss: 0.9460, test_f1: 0.5369
 epoch: 83, train_loss: 0.7367, test_loss: 0.9562, test_f1: 0.5320
 epoch: 84, train_loss: 0.7306, test_loss: 0.9255, test_f1: 0.5297
 epoch: 85, train_loss: 0.7320, test_loss: 0.9379, test_f1: 0.5328
 epoch: 86, train_loss: 0.7394, test_loss: 0.9789, test_f1: 0.5448
 epoch: 87, train_loss: 0.7482, test_loss: 0.9370, test_f1: 0.5491
 epoch: 88, train_loss: 0.7232, test_loss: 1.0263, test_f1: 0.5134
 epoch: 89, train_loss: 0.7260, test_loss: 0.9634, test_f1: 0.5298
 epoch: 90, train_loss: 0.7216, test_loss: 0.9731, test_f1: 0.5299
 epoch: 91, train_loss: 0.7218, test_loss: 0.9609, test_f1: 0.5457
 epoch: 92, train_loss: 0.7283, test_loss: 0.9589, test_f1: 0.5571
 epoch: 93, train_loss: 0.7247, test_loss: 0.9512, test_f1: 0.5497
 epoch: 94, train_loss: 0.7322, test_loss: 0.9752, test_f1: 0.5508
 epoch: 95, train_loss: 0.7211, test_loss: 0.9509, test_f1: 0.5546
 epoch: 96, train_loss: 0.7275, test_loss: 0.9518, test_f1: 0.5348
 epoch: 97, train_loss: 0.7227, test_loss: 0.9508, test_f1: 0.5376
 epoch: 98, train_loss: 0.7209, test_loss: 1.0616, test_f1: 0.5378
 epoch: 99, train_loss: 0.7322, test_loss: 0.9758, test_f1: 0.5378
##################ITERATION #1 ****************************************
 epoch: 0, train_loss: 1.2700, test_loss: 1.1964, test_f1: 0.2893
 epoch: 1, train_loss: 1.1528, test_loss: 1.0853, test_f1: 0.3388
 epoch: 2, train_loss: 1.0650, test_loss: 1.0467, test_f1: 0.3466
 epoch: 3, train_loss: 1.0352, test_loss: 1.0217, test_f1: 0.3464
 epoch: 4, train_loss: 1.0307, test_loss: 1.0085, test_f1: 0.3541
 epoch: 5, train_loss: 1.0117, test_loss: 1.0080, test_f1: 0.3567
 epoch: 6, train_loss: 1.0006, test_loss: 0.9830, test_f1: 0.4028
 epoch: 7, train_loss: 0.9993, test_loss: 0.9975, test_f1: 0.3900
 epoch: 8, train_loss: 0.9866, test_loss: 0.9958, test_f1: 0.4226
 epoch: 9, train_loss: 0.9764, test_loss: 0.9841, test_f1: 0.4027
 epoch: 10, train_loss: 0.9702, test_loss: 0.9739, test_f1: 0.4363
 epoch: 11, train_loss: 0.9585, test_loss: 0.9516, test_f1: 0.4701
 epoch: 12, train_loss: 0.9516, test_loss: 0.9675, test_f1: 0.4847
 epoch: 13, train_loss: 0.9406, test_loss: 0.9306, test_f1: 0.4884
 epoch: 14, train_loss: 0.9334, test_loss: 0.9093, test_f1: 0.4876
 epoch: 15, train_loss: 0.9203, test_loss: 0.8880, test_f1: 0.5111
 epoch: 16, train_loss: 0.9122, test_loss: 0.9918, test_f1: 0.4784
 epoch: 17, train_loss: 0.9049, test_loss: 0.9127, test_f1: 0.4943
 epoch: 18, train_loss: 0.9068, test_loss: 0.9578, test_f1: 0.4910
 epoch: 19, train_loss: 0.8934, test_loss: 0.9174, test_f1: 0.4975
 epoch: 20, train_loss: 0.8902, test_loss: 0.8916, test_f1: 0.5138
 epoch: 21, train_loss: 0.8812, test_loss: 0.9304, test_f1: 0.4891
 epoch: 22, train_loss: 0.8737, test_loss: 0.9100, test_f1: 0.5122
 epoch: 23, train_loss: 0.8766, test_loss: 0.8928, test_f1: 0.5162
 epoch: 24, train_loss: 0.8726, test_loss: 0.8807, test_f1: 0.5114
 epoch: 25, train_loss: 0.8658, test_loss: 0.8937, test_f1: 0.5161
 epoch: 26, train_loss: 0.8584, test_loss: 1.0256, test_f1: 0.4874
 epoch: 27, train_loss: 0.8612, test_loss: 0.8695, test_f1: 0.5300
 epoch: 28, train_loss: 0.8550, test_loss: 0.8721, test_f1: 0.5091
 epoch: 29, train_loss: 0.8496, test_loss: 0.8857, test_f1: 0.5143
 epoch: 30, train_loss: 0.8599, test_loss: 0.9300, test_f1: 0.5070
 epoch: 31, train_loss: 0.8478, test_loss: 0.8504, test_f1: 0.5221
 epoch: 32, train_loss: 0.8408, test_loss: 0.8525, test_f1: 0.5213
 epoch: 33, train_loss: 0.8401, test_loss: 0.8651, test_f1: 0.5238
 epoch: 34, train_loss: 0.8357, test_loss: 0.8842, test_f1: 0.5267
 epoch: 35, train_loss: 0.8341, test_loss: 0.9074, test_f1: 0.5028
 epoch: 36, train_loss: 0.8355, test_loss: 0.8869, test_f1: 0.5261
 epoch: 37, train_loss: 0.8198, test_loss: 0.8783, test_f1: 0.5288
 epoch: 38, train_loss: 0.8323, test_loss: 0.8723, test_f1: 0.5222
 epoch: 39, train_loss: 0.8259, test_loss: 0.9201, test_f1: 0.5224
 epoch: 40, train_loss: 0.8336, test_loss: 0.8735, test_f1: 0.5097
 epoch: 41, train_loss: 0.8299, test_loss: 0.8637, test_f1: 0.5245
 epoch: 42, train_loss: 0.8227, test_loss: 0.8625, test_f1: 0.5217
 epoch: 43, train_loss: 0.8176, test_loss: 0.8726, test_f1: 0.5294
 epoch: 44, train_loss: 0.8123, test_loss: 0.8406, test_f1: 0.5324
 epoch: 45, train_loss: 0.8045, test_loss: 0.8436, test_f1: 0.5372
 epoch: 46, train_loss: 0.8114, test_loss: 0.8484, test_f1: 0.5332
 epoch: 47, train_loss: 0.8009, test_loss: 0.8549, test_f1: 0.5202
 epoch: 48, train_loss: 0.8056, test_loss: 0.8564, test_f1: 0.5228
 epoch: 49, train_loss: 0.8012, test_loss: 0.8608, test_f1: 0.5395
 epoch: 50, train_loss: 0.7961, test_loss: 0.8531, test_f1: 0.5448
 epoch: 51, train_loss: 0.7966, test_loss: 0.8613, test_f1: 0.5528
 epoch: 52, train_loss: 0.7861, test_loss: 0.8620, test_f1: 0.5363
 epoch: 53, train_loss: 0.7835, test_loss: 0.8498, test_f1: 0.5498
 epoch: 54, train_loss: 0.7877, test_loss: 0.8610, test_f1: 0.5504
 epoch: 55, train_loss: 0.7838, test_loss: 0.8446, test_f1: 0.5353
 epoch: 56, train_loss: 0.7712, test_loss: 0.8515, test_f1: 0.5574
 epoch: 57, train_loss: 0.7720, test_loss: 0.8590, test_f1: 0.5511
 epoch: 58, train_loss: 0.7878, test_loss: 0.8482, test_f1: 0.5586
 epoch: 59, train_loss: 0.7796, test_loss: 0.8473, test_f1: 0.5378
 epoch: 60, train_loss: 0.7875, test_loss: 0.8569, test_f1: 0.5470
 epoch: 61, train_loss: 0.7735, test_loss: 0.8691, test_f1: 0.5471
 epoch: 62, train_loss: 0.7747, test_loss: 0.8591, test_f1: 0.5506
 epoch: 63, train_loss: 0.7809, test_loss: 0.8728, test_f1: 0.5409
 epoch: 64, train_loss: 0.7747, test_loss: 0.8590, test_f1: 0.5429
 epoch: 65, train_loss: 0.7652, test_loss: 0.8723, test_f1: 0.5367
 epoch: 66, train_loss: 0.7746, test_loss: 0.8422, test_f1: 0.5508
 epoch: 67, train_loss: 0.7685, test_loss: 0.8459, test_f1: 0.5480
 epoch: 68, train_loss: 0.7719, test_loss: 0.8381, test_f1: 0.5686
 epoch: 69, train_loss: 0.7631, test_loss: 0.8436, test_f1: 0.5664
 epoch: 70, train_loss: 0.7581, test_loss: 0.8518, test_f1: 0.5468
 epoch: 71, train_loss: 0.7729, test_loss: 0.8711, test_f1: 0.5590
 epoch: 72, train_loss: 0.7664, test_loss: 0.8590, test_f1: 0.5650
 epoch: 73, train_loss: 0.7663, test_loss: 0.8644, test_f1: 0.5574
 epoch: 74, train_loss: 0.7604, test_loss: 0.8650, test_f1: 0.5552
 epoch: 75, train_loss: 0.7643, test_loss: 0.8532, test_f1: 0.5585
 epoch: 76, train_loss: 0.7605, test_loss: 0.8723, test_f1: 0.5527
 epoch: 77, train_loss: 0.7570, test_loss: 0.8561, test_f1: 0.5602
 epoch: 78, train_loss: 0.7701, test_loss: 0.8797, test_f1: 0.5518
 epoch: 79, train_loss: 0.7536, test_loss: 0.8608, test_f1: 0.5554
 epoch: 80, train_loss: 0.7638, test_loss: 0.8491, test_f1: 0.5586
 epoch: 81, train_loss: 0.7473, test_loss: 0.8674, test_f1: 0.5616
 epoch: 82, train_loss: 0.7592, test_loss: 0.8696, test_f1: 0.5538
 epoch: 83, train_loss: 0.7545, test_loss: 0.8505, test_f1: 0.5587
 epoch: 84, train_loss: 0.7585, test_loss: 0.8741, test_f1: 0.5574
 epoch: 85, train_loss: 0.7577, test_loss: 0.8946, test_f1: 0.5571
 epoch: 86, train_loss: 0.7488, test_loss: 0.8545, test_f1: 0.5590
 epoch: 87, train_loss: 0.7460, test_loss: 0.8910, test_f1: 0.5507
 epoch: 88, train_loss: 0.7486, test_loss: 0.8598, test_f1: 0.5598
 epoch: 89, train_loss: 0.7483, test_loss: 0.8586, test_f1: 0.5546
 epoch: 90, train_loss: 0.7489, test_loss: 0.8676, test_f1: 0.5581
 epoch: 91, train_loss: 0.7550, test_loss: 0.8604, test_f1: 0.5587
 epoch: 92, train_loss: 0.7448, test_loss: 0.8930, test_f1: 0.5556
 epoch: 93, train_loss: 0.7579, test_loss: 0.8691, test_f1: 0.5558
 epoch: 94, train_loss: 0.7448, test_loss: 0.8585, test_f1: 0.5568
 epoch: 95, train_loss: 0.7533, test_loss: 0.8717, test_f1: 0.5590
 epoch: 96, train_loss: 0.7352, test_loss: 0.8761, test_f1: 0.5597
 epoch: 97, train_loss: 0.7463, test_loss: 0.8658, test_f1: 0.5569
 epoch: 98, train_loss: 0.7477, test_loss: 0.8727, test_f1: 0.5599
 epoch: 99, train_loss: 0.7353, test_loss: 0.8467, test_f1: 0.5596
##################ITERATION #2 ****************************************
 epoch: 0, train_loss: 1.2383, test_loss: 1.1626, test_f1: 0.3091
 epoch: 1, train_loss: 1.1253, test_loss: 1.0812, test_f1: 0.3391
 epoch: 2, train_loss: 1.0731, test_loss: 1.0668, test_f1: 0.3565
 epoch: 3, train_loss: 1.0344, test_loss: 1.0475, test_f1: 0.4007
 epoch: 4, train_loss: 1.0188, test_loss: 1.0486, test_f1: 0.3999
 epoch: 5, train_loss: 1.0085, test_loss: 1.0597, test_f1: 0.4409
 epoch: 6, train_loss: 0.9975, test_loss: 1.0583, test_f1: 0.4930
 epoch: 7, train_loss: 0.9805, test_loss: 1.0319, test_f1: 0.4718
 epoch: 8, train_loss: 0.9767, test_loss: 1.0412, test_f1: 0.4864
 epoch: 9, train_loss: 0.9668, test_loss: 1.0354, test_f1: 0.4813
 epoch: 10, train_loss: 0.9649, test_loss: 1.0349, test_f1: 0.4782
 epoch: 11, train_loss: 0.9451, test_loss: 1.0287, test_f1: 0.5019
 epoch: 12, train_loss: 0.9347, test_loss: 1.0301, test_f1: 0.4874
 epoch: 13, train_loss: 0.9215, test_loss: 1.0304, test_f1: 0.4867
 epoch: 14, train_loss: 0.9342, test_loss: 1.0120, test_f1: 0.4919
 epoch: 15, train_loss: 0.9214, test_loss: 1.0291, test_f1: 0.4828
 epoch: 16, train_loss: 0.9084, test_loss: 1.0092, test_f1: 0.5060
 epoch: 17, train_loss: 0.8989, test_loss: 1.0170, test_f1: 0.5009
 epoch: 18, train_loss: 0.9039, test_loss: 0.9610, test_f1: 0.5184
 epoch: 19, train_loss: 0.8967, test_loss: 0.9737, test_f1: 0.5247
 epoch: 20, train_loss: 0.8886, test_loss: 0.9608, test_f1: 0.5098
 epoch: 21, train_loss: 0.8724, test_loss: 0.9951, test_f1: 0.5349
 epoch: 22, train_loss: 0.8646, test_loss: 0.9919, test_f1: 0.5170
 epoch: 23, train_loss: 0.8739, test_loss: 1.0101, test_f1: 0.5432
 epoch: 24, train_loss: 0.8626, test_loss: 0.9465, test_f1: 0.5355
 epoch: 25, train_loss: 0.8544, test_loss: 1.0331, test_f1: 0.5042
 epoch: 26, train_loss: 0.8537, test_loss: 0.9583, test_f1: 0.5321
 epoch: 27, train_loss: 0.8410, test_loss: 1.0328, test_f1: 0.5340
 epoch: 28, train_loss: 0.8430, test_loss: 0.9670, test_f1: 0.5245
 epoch: 29, train_loss: 0.8357, test_loss: 0.9792, test_f1: 0.5207
 epoch: 30, train_loss: 0.8324, test_loss: 1.0184, test_f1: 0.5348
 epoch: 31, train_loss: 0.8291, test_loss: 0.9822, test_f1: 0.5437
 epoch: 32, train_loss: 0.8223, test_loss: 0.9579, test_f1: 0.5280
 epoch: 33, train_loss: 0.8218, test_loss: 1.0167, test_f1: 0.5147
 epoch: 34, train_loss: 0.8114, test_loss: 0.9797, test_f1: 0.5359
 epoch: 35, train_loss: 0.8012, test_loss: 0.9451, test_f1: 0.5383
 epoch: 36, train_loss: 0.8088, test_loss: 0.9815, test_f1: 0.5569
 epoch: 37, train_loss: 0.8151, test_loss: 0.9534, test_f1: 0.5429
 epoch: 38, train_loss: 0.8055, test_loss: 0.9750, test_f1: 0.5249
 epoch: 39, train_loss: 0.8016, test_loss: 1.0385, test_f1: 0.5192
 epoch: 40, train_loss: 0.7978, test_loss: 0.9747, test_f1: 0.5161
 epoch: 41, train_loss: 0.7816, test_loss: 0.9756, test_f1: 0.5292
 epoch: 42, train_loss: 0.7998, test_loss: 0.9813, test_f1: 0.5225
 epoch: 43, train_loss: 0.7869, test_loss: 0.9820, test_f1: 0.5245
 epoch: 44, train_loss: 0.7966, test_loss: 1.0442, test_f1: 0.5192
 epoch: 45, train_loss: 0.7976, test_loss: 0.9375, test_f1: 0.5528
 epoch: 46, train_loss: 0.7900, test_loss: 1.0194, test_f1: 0.5161
 epoch: 47, train_loss: 0.7734, test_loss: 0.9816, test_f1: 0.5254
 epoch: 48, train_loss: 0.7770, test_loss: 0.9966, test_f1: 0.5570
 epoch: 49, train_loss: 0.7801, test_loss: 1.0456, test_f1: 0.5177
 epoch: 50, train_loss: 0.7798, test_loss: 0.9966, test_f1: 0.5393
 epoch: 51, train_loss: 0.7687, test_loss: 0.9685, test_f1: 0.5197
 epoch: 52, train_loss: 0.7447, test_loss: 1.0137, test_f1: 0.5349
 epoch: 53, train_loss: 0.7615, test_loss: 0.9787, test_f1: 0.5390
 epoch: 54, train_loss: 0.7520, test_loss: 0.9791, test_f1: 0.5418
 epoch: 55, train_loss: 0.7494, test_loss: 0.9754, test_f1: 0.5336
 epoch: 56, train_loss: 0.7547, test_loss: 0.9662, test_f1: 0.5383
 epoch: 57, train_loss: 0.7530, test_loss: 0.9865, test_f1: 0.5377
 epoch: 58, train_loss: 0.7495, test_loss: 1.0114, test_f1: 0.5394
 epoch: 59, train_loss: 0.7451, test_loss: 0.9563, test_f1: 0.5523
 epoch: 60, train_loss: 0.7522, test_loss: 0.9755, test_f1: 0.5442
 epoch: 61, train_loss: 0.7464, test_loss: 0.9926, test_f1: 0.5463
 epoch: 62, train_loss: 0.7409, test_loss: 1.0010, test_f1: 0.5321
 epoch: 63, train_loss: 0.7466, test_loss: 1.0128, test_f1: 0.5339
 epoch: 64, train_loss: 0.7482, test_loss: 0.9703, test_f1: 0.5381
 epoch: 65, train_loss: 0.7366, test_loss: 1.0149, test_f1: 0.5224
 epoch: 66, train_loss: 0.7388, test_loss: 0.9776, test_f1: 0.5391
 epoch: 67, train_loss: 0.7463, test_loss: 0.9839, test_f1: 0.5425
 epoch: 68, train_loss: 0.7421, test_loss: 0.9660, test_f1: 0.5582
 epoch: 69, train_loss: 0.7366, test_loss: 0.9534, test_f1: 0.5379
 epoch: 70, train_loss: 0.7317, test_loss: 0.9692, test_f1: 0.5413
 epoch: 71, train_loss: 0.7437, test_loss: 0.9769, test_f1: 0.5335
 epoch: 72, train_loss: 0.7295, test_loss: 1.0112, test_f1: 0.5351
 epoch: 73, train_loss: 0.7421, test_loss: 1.0422, test_f1: 0.5411
 epoch: 74, train_loss: 0.7340, test_loss: 0.9837, test_f1: 0.5424
 epoch: 75, train_loss: 0.7298, test_loss: 0.9735, test_f1: 0.5402
 epoch: 76, train_loss: 0.7247, test_loss: 1.0180, test_f1: 0.5388
 epoch: 77, train_loss: 0.7283, test_loss: 0.9740, test_f1: 0.5446
 epoch: 78, train_loss: 0.7237, test_loss: 0.9756, test_f1: 0.5403
 epoch: 79, train_loss: 0.7319, test_loss: 0.9679, test_f1: 0.5439
 epoch: 80, train_loss: 0.7342, test_loss: 0.9675, test_f1: 0.5291
 epoch: 81, train_loss: 0.7232, test_loss: 0.9872, test_f1: 0.5432
 epoch: 82, train_loss: 0.7367, test_loss: 1.0145, test_f1: 0.5337
 epoch: 83, train_loss: 0.7292, test_loss: 1.0152, test_f1: 0.5421
 epoch: 84, train_loss: 0.7279, test_loss: 0.9992, test_f1: 0.5437
 epoch: 85, train_loss: 0.7252, test_loss: 0.9889, test_f1: 0.5484
 epoch: 86, train_loss: 0.7123, test_loss: 0.9556, test_f1: 0.5495
 epoch: 87, train_loss: 0.7207, test_loss: 1.0108, test_f1: 0.5280
 epoch: 88, train_loss: 0.7288, test_loss: 0.9897, test_f1: 0.5398
 epoch: 89, train_loss: 0.7180, test_loss: 0.9515, test_f1: 0.5482
 epoch: 90, train_loss: 0.7280, test_loss: 0.9723, test_f1: 0.5401
 epoch: 91, train_loss: 0.7111, test_loss: 0.9557, test_f1: 0.5353
 epoch: 92, train_loss: 0.7184, test_loss: 0.9601, test_f1: 0.5495
 epoch: 93, train_loss: 0.7218, test_loss: 0.9952, test_f1: 0.5279
 epoch: 94, train_loss: 0.7079, test_loss: 1.0003, test_f1: 0.5276
 epoch: 95, train_loss: 0.7108, test_loss: 1.0184, test_f1: 0.5252
 epoch: 96, train_loss: 0.7095, test_loss: 1.0001, test_f1: 0.5377
 epoch: 97, train_loss: 0.7180, test_loss: 0.9673, test_f1: 0.5403
 epoch: 98, train_loss: 0.7111, test_loss: 0.9691, test_f1: 0.5454
 epoch: 99, train_loss: 0.7122, test_loss: 0.9637, test_f1: 0.5448
##################ITERATION #3 ****************************************
 epoch: 0, train_loss: 1.3018, test_loss: 1.1523, test_f1: 0.3526
 epoch: 1, train_loss: 1.1524, test_loss: 1.0486, test_f1: 0.4522
 epoch: 2, train_loss: 1.0994, test_loss: 0.9955, test_f1: 0.4787
 epoch: 3, train_loss: 1.0520, test_loss: 0.9781, test_f1: 0.4773
 epoch: 4, train_loss: 1.0290, test_loss: 0.9878, test_f1: 0.4794
 epoch: 5, train_loss: 1.0050, test_loss: 0.9625, test_f1: 0.4987
 epoch: 6, train_loss: 0.9963, test_loss: 0.9658, test_f1: 0.4920
 epoch: 7, train_loss: 0.9902, test_loss: 0.9638, test_f1: 0.4931
 epoch: 8, train_loss: 0.9675, test_loss: 0.9586, test_f1: 0.4925
 epoch: 9, train_loss: 0.9662, test_loss: 0.9600, test_f1: 0.4781
 epoch: 10, train_loss: 0.9550, test_loss: 0.9617, test_f1: 0.5008
 epoch: 11, train_loss: 0.9463, test_loss: 0.9516, test_f1: 0.4968
 epoch: 12, train_loss: 0.9471, test_loss: 0.9569, test_f1: 0.4946
 epoch: 13, train_loss: 0.9327, test_loss: 0.9745, test_f1: 0.4981
 epoch: 14, train_loss: 0.9337, test_loss: 0.9780, test_f1: 0.4932
 epoch: 15, train_loss: 0.9197, test_loss: 0.9272, test_f1: 0.5181
 epoch: 16, train_loss: 0.9242, test_loss: 0.9233, test_f1: 0.5203
 epoch: 17, train_loss: 0.9175, test_loss: 0.9151, test_f1: 0.5299
 epoch: 18, train_loss: 0.9188, test_loss: 0.9594, test_f1: 0.5120
 epoch: 19, train_loss: 0.9053, test_loss: 0.9348, test_f1: 0.5310
 epoch: 20, train_loss: 0.9021, test_loss: 0.9380, test_f1: 0.5204
 epoch: 21, train_loss: 0.9093, test_loss: 0.9690, test_f1: 0.4994
 epoch: 22, train_loss: 0.8942, test_loss: 0.9370, test_f1: 0.5143
 epoch: 23, train_loss: 0.8896, test_loss: 0.9198, test_f1: 0.5230
 epoch: 24, train_loss: 0.8941, test_loss: 0.9371, test_f1: 0.5219
 epoch: 25, train_loss: 0.8835, test_loss: 0.9220, test_f1: 0.5208
 epoch: 26, train_loss: 0.8850, test_loss: 0.9956, test_f1: 0.4952
 epoch: 27, train_loss: 0.8781, test_loss: 0.9582, test_f1: 0.5239
 epoch: 28, train_loss: 0.8816, test_loss: 0.9468, test_f1: 0.5175
 epoch: 29, train_loss: 0.8729, test_loss: 0.9111, test_f1: 0.5287
 epoch: 30, train_loss: 0.8542, test_loss: 0.9435, test_f1: 0.5168
 epoch: 31, train_loss: 0.8522, test_loss: 0.9802, test_f1: 0.5142
 epoch: 32, train_loss: 0.8590, test_loss: 0.9351, test_f1: 0.5307
 epoch: 33, train_loss: 0.8578, test_loss: 1.0909, test_f1: 0.4535
 epoch: 34, train_loss: 0.8496, test_loss: 0.9533, test_f1: 0.5292
 epoch: 35, train_loss: 0.8618, test_loss: 0.9242, test_f1: 0.5365
 epoch: 36, train_loss: 0.8633, test_loss: 0.9311, test_f1: 0.5355
 epoch: 37, train_loss: 0.8457, test_loss: 0.9111, test_f1: 0.5599
 epoch: 38, train_loss: 0.8494, test_loss: 0.9457, test_f1: 0.5165
 epoch: 39, train_loss: 0.8465, test_loss: 0.9152, test_f1: 0.5402
 epoch: 40, train_loss: 0.8388, test_loss: 0.9142, test_f1: 0.5471
 epoch: 41, train_loss: 0.8432, test_loss: 0.9176, test_f1: 0.5256
 epoch: 42, train_loss: 0.8495, test_loss: 0.9437, test_f1: 0.5434
 epoch: 43, train_loss: 0.8294, test_loss: 0.9288, test_f1: 0.5335
 epoch: 44, train_loss: 0.8315, test_loss: 0.9036, test_f1: 0.5656
 epoch: 45, train_loss: 0.8241, test_loss: 0.9100, test_f1: 0.5425
 epoch: 46, train_loss: 0.8227, test_loss: 0.9617, test_f1: 0.5239
 epoch: 47, train_loss: 0.8305, test_loss: 0.9024, test_f1: 0.5508
 epoch: 48, train_loss: 0.8296, test_loss: 1.0140, test_f1: 0.4808
 epoch: 49, train_loss: 0.8149, test_loss: 0.9145, test_f1: 0.5553
 epoch: 50, train_loss: 0.8293, test_loss: 0.8926, test_f1: 0.5568
 epoch: 51, train_loss: 0.8029, test_loss: 0.9066, test_f1: 0.5488
 epoch: 52, train_loss: 0.8091, test_loss: 0.9036, test_f1: 0.5573
 epoch: 53, train_loss: 0.7976, test_loss: 0.9100, test_f1: 0.5490
 epoch: 54, train_loss: 0.7987, test_loss: 0.9203, test_f1: 0.5437
 epoch: 55, train_loss: 0.7957, test_loss: 0.8963, test_f1: 0.5548
 epoch: 56, train_loss: 0.8133, test_loss: 0.8990, test_f1: 0.5608
 epoch: 57, train_loss: 0.7938, test_loss: 0.8878, test_f1: 0.5581
 epoch: 58, train_loss: 0.7994, test_loss: 0.9067, test_f1: 0.5442
 epoch: 59, train_loss: 0.7896, test_loss: 0.9082, test_f1: 0.5565
 epoch: 60, train_loss: 0.8016, test_loss: 0.8977, test_f1: 0.5503
 epoch: 61, train_loss: 0.7921, test_loss: 0.9178, test_f1: 0.5491
 epoch: 62, train_loss: 0.7972, test_loss: 0.9262, test_f1: 0.5494
 epoch: 63, train_loss: 0.7967, test_loss: 0.9234, test_f1: 0.5470
 epoch: 64, train_loss: 0.7882, test_loss: 0.9158, test_f1: 0.5500
 epoch: 65, train_loss: 0.7850, test_loss: 0.9122, test_f1: 0.5645
 epoch: 66, train_loss: 0.7956, test_loss: 0.9139, test_f1: 0.5394
 epoch: 67, train_loss: 0.7801, test_loss: 0.9278, test_f1: 0.5473
 epoch: 68, train_loss: 0.7819, test_loss: 0.9198, test_f1: 0.5459
 epoch: 69, train_loss: 0.7814, test_loss: 0.9157, test_f1: 0.5594
 epoch: 70, train_loss: 0.7799, test_loss: 0.8988, test_f1: 0.5463
 epoch: 71, train_loss: 0.7789, test_loss: 0.9256, test_f1: 0.5348
 epoch: 72, train_loss: 0.7738, test_loss: 0.9144, test_f1: 0.5406
 epoch: 73, train_loss: 0.7877, test_loss: 0.9015, test_f1: 0.5491
 epoch: 74, train_loss: 0.7747, test_loss: 0.9376, test_f1: 0.5320
 epoch: 75, train_loss: 0.7848, test_loss: 0.9147, test_f1: 0.5518
 epoch: 76, train_loss: 0.7711, test_loss: 0.9338, test_f1: 0.5353
 epoch: 77, train_loss: 0.7720, test_loss: 0.9188, test_f1: 0.5399
 epoch: 78, train_loss: 0.7698, test_loss: 0.9073, test_f1: 0.5588
 epoch: 79, train_loss: 0.7739, test_loss: 0.9186, test_f1: 0.5623
 epoch: 80, train_loss: 0.7709, test_loss: 0.9237, test_f1: 0.5405
 epoch: 81, train_loss: 0.7705, test_loss: 0.9187, test_f1: 0.5525
 epoch: 82, train_loss: 0.7614, test_loss: 0.9426, test_f1: 0.5410
 epoch: 83, train_loss: 0.7738, test_loss: 0.9238, test_f1: 0.5528
 epoch: 84, train_loss: 0.7834, test_loss: 0.9163, test_f1: 0.5545
 epoch: 85, train_loss: 0.7617, test_loss: 0.9282, test_f1: 0.5467
 epoch: 86, train_loss: 0.7581, test_loss: 0.9211, test_f1: 0.5515
 epoch: 87, train_loss: 0.7787, test_loss: 0.9100, test_f1: 0.5606
 epoch: 88, train_loss: 0.7701, test_loss: 0.9417, test_f1: 0.5281
 epoch: 89, train_loss: 0.7744, test_loss: 0.9577, test_f1: 0.5218
 epoch: 90, train_loss: 0.7843, test_loss: 0.9388, test_f1: 0.5447
 epoch: 91, train_loss: 0.7561, test_loss: 0.9282, test_f1: 0.5521
 epoch: 92, train_loss: 0.7740, test_loss: 0.9266, test_f1: 0.5429
 epoch: 93, train_loss: 0.7540, test_loss: 0.9360, test_f1: 0.5417
 epoch: 94, train_loss: 0.7601, test_loss: 0.9244, test_f1: 0.5555
 epoch: 95, train_loss: 0.7688, test_loss: 0.9675, test_f1: 0.5395
 epoch: 96, train_loss: 0.7610, test_loss: 0.9219, test_f1: 0.5460
 epoch: 97, train_loss: 0.7682, test_loss: 0.8964, test_f1: 0.5627
 epoch: 98, train_loss: 0.7591, test_loss: 0.8996, test_f1: 0.5414
 epoch: 99, train_loss: 0.7451, test_loss: 0.9215, test_f1: 0.5570
##################ITERATION #4 ****************************************
 epoch: 0, train_loss: 1.2407, test_loss: 1.0994, test_f1: 0.3776
 epoch: 1, train_loss: 1.1063, test_loss: 1.0485, test_f1: 0.4099
 epoch: 2, train_loss: 1.0710, test_loss: 1.0323, test_f1: 0.4390
 epoch: 3, train_loss: 1.0498, test_loss: 1.0337, test_f1: 0.4035
 epoch: 4, train_loss: 1.0424, test_loss: 1.0321, test_f1: 0.4789
 epoch: 5, train_loss: 1.0266, test_loss: 1.0178, test_f1: 0.4979
 epoch: 6, train_loss: 1.0183, test_loss: 1.0208, test_f1: 0.4750
 epoch: 7, train_loss: 1.0045, test_loss: 1.0093, test_f1: 0.4818
 epoch: 8, train_loss: 0.9938, test_loss: 1.0240, test_f1: 0.4631
 epoch: 9, train_loss: 0.9907, test_loss: 1.0084, test_f1: 0.4758
 epoch: 10, train_loss: 0.9725, test_loss: 0.9868, test_f1: 0.4708
 epoch: 11, train_loss: 0.9751, test_loss: 0.9896, test_f1: 0.5311
 epoch: 12, train_loss: 0.9668, test_loss: 0.9814, test_f1: 0.4940
 epoch: 13, train_loss: 0.9536, test_loss: 0.9652, test_f1: 0.5196
 epoch: 14, train_loss: 0.9538, test_loss: 0.9549, test_f1: 0.5051
 epoch: 15, train_loss: 0.9450, test_loss: 0.9773, test_f1: 0.5102
 epoch: 16, train_loss: 0.9401, test_loss: 0.9612, test_f1: 0.5036
 epoch: 17, train_loss: 0.9331, test_loss: 0.9584, test_f1: 0.5206
 epoch: 18, train_loss: 0.9409, test_loss: 0.9663, test_f1: 0.5034
 epoch: 19, train_loss: 0.9146, test_loss: 0.9414, test_f1: 0.5232
 epoch: 20, train_loss: 0.9094, test_loss: 0.9856, test_f1: 0.5186
 epoch: 21, train_loss: 0.9104, test_loss: 0.9709, test_f1: 0.5387
 epoch: 22, train_loss: 0.9168, test_loss: 0.9212, test_f1: 0.5266
 epoch: 23, train_loss: 0.9060, test_loss: 0.9308, test_f1: 0.5384
 epoch: 24, train_loss: 0.9027, test_loss: 0.9780, test_f1: 0.5282
 epoch: 25, train_loss: 0.9009, test_loss: 0.9038, test_f1: 0.5273
 epoch: 26, train_loss: 0.8950, test_loss: 0.9848, test_f1: 0.5139
 epoch: 27, train_loss: 0.8971, test_loss: 0.9338, test_f1: 0.5370
 epoch: 28, train_loss: 0.8941, test_loss: 0.9157, test_f1: 0.5245
 epoch: 29, train_loss: 0.8912, test_loss: 0.9377, test_f1: 0.5285
 epoch: 30, train_loss: 0.8757, test_loss: 0.9175, test_f1: 0.5449
 epoch: 31, train_loss: 0.8875, test_loss: 0.9195, test_f1: 0.5276
 epoch: 32, train_loss: 0.8599, test_loss: 0.9331, test_f1: 0.5097
 epoch: 33, train_loss: 0.8578, test_loss: 0.9133, test_f1: 0.5544
 epoch: 34, train_loss: 0.8629, test_loss: 0.9447, test_f1: 0.5325
 epoch: 35, train_loss: 0.8629, test_loss: 0.9222, test_f1: 0.5373
 epoch: 36, train_loss: 0.8605, test_loss: 0.8985, test_f1: 0.5432
 epoch: 37, train_loss: 0.8535, test_loss: 0.9352, test_f1: 0.5149
 epoch: 38, train_loss: 0.8459, test_loss: 0.9369, test_f1: 0.5383
 epoch: 39, train_loss: 0.8454, test_loss: 0.9020, test_f1: 0.5345
 epoch: 40, train_loss: 0.8486, test_loss: 0.8956, test_f1: 0.5301
 epoch: 41, train_loss: 0.8552, test_loss: 0.9102, test_f1: 0.5107
 epoch: 42, train_loss: 0.8387, test_loss: 0.8974, test_f1: 0.5607
 epoch: 43, train_loss: 0.8346, test_loss: 0.8980, test_f1: 0.5363
 epoch: 44, train_loss: 0.8545, test_loss: 0.9197, test_f1: 0.5471
 epoch: 45, train_loss: 0.8380, test_loss: 0.9459, test_f1: 0.5252
 epoch: 46, train_loss: 0.8337, test_loss: 0.9229, test_f1: 0.5340
 epoch: 47, train_loss: 0.8325, test_loss: 0.9055, test_f1: 0.5018
 epoch: 48, train_loss: 0.8341, test_loss: 0.8937, test_f1: 0.5334
 epoch: 49, train_loss: 0.8219, test_loss: 0.9162, test_f1: 0.5457
 epoch: 50, train_loss: 0.8523, test_loss: 0.9038, test_f1: 0.5409
 epoch: 51, train_loss: 0.8153, test_loss: 0.9012, test_f1: 0.5465
 epoch: 52, train_loss: 0.8156, test_loss: 0.8820, test_f1: 0.5326
 epoch: 53, train_loss: 0.8211, test_loss: 0.9021, test_f1: 0.5494
 epoch: 54, train_loss: 0.8147, test_loss: 0.8913, test_f1: 0.5480
 epoch: 55, train_loss: 0.8104, test_loss: 0.9042, test_f1: 0.5533
 epoch: 56, train_loss: 0.8072, test_loss: 0.8888, test_f1: 0.5323
 epoch: 57, train_loss: 0.8094, test_loss: 0.8919, test_f1: 0.5529
 epoch: 58, train_loss: 0.8045, test_loss: 0.9118, test_f1: 0.5431
 epoch: 59, train_loss: 0.8025, test_loss: 0.8866, test_f1: 0.5647
 epoch: 60, train_loss: 0.8045, test_loss: 0.8640, test_f1: 0.5472
 epoch: 61, train_loss: 0.7996, test_loss: 0.8756, test_f1: 0.5480
 epoch: 62, train_loss: 0.7987, test_loss: 0.9085, test_f1: 0.5327
 epoch: 63, train_loss: 0.7988, test_loss: 0.8849, test_f1: 0.5447
 epoch: 64, train_loss: 0.7943, test_loss: 0.9040, test_f1: 0.5392
 epoch: 65, train_loss: 0.7855, test_loss: 0.8999, test_f1: 0.5379
 epoch: 66, train_loss: 0.7930, test_loss: 0.9253, test_f1: 0.5425
 epoch: 67, train_loss: 0.7912, test_loss: 0.9114, test_f1: 0.5281
 epoch: 68, train_loss: 0.7895, test_loss: 0.9108, test_f1: 0.5466
 epoch: 69, train_loss: 0.7808, test_loss: 0.8929, test_f1: 0.5297
 epoch: 70, train_loss: 0.7898, test_loss: 0.9149, test_f1: 0.5525
 epoch: 71, train_loss: 0.7874, test_loss: 0.9007, test_f1: 0.5399
 epoch: 72, train_loss: 0.7996, test_loss: 0.9141, test_f1: 0.5500
 epoch: 73, train_loss: 0.7894, test_loss: 0.8980, test_f1: 0.5433
 epoch: 74, train_loss: 0.7930, test_loss: 0.9353, test_f1: 0.5410
 epoch: 75, train_loss: 0.7785, test_loss: 0.9605, test_f1: 0.5258
 epoch: 76, train_loss: 0.7837, test_loss: 0.9389, test_f1: 0.5426
 epoch: 77, train_loss: 0.7882, test_loss: 0.9298, test_f1: 0.5349
 epoch: 78, train_loss: 0.7796, test_loss: 0.9077, test_f1: 0.5320
 epoch: 79, train_loss: 0.7730, test_loss: 0.9158, test_f1: 0.5343
 epoch: 80, train_loss: 0.8058, test_loss: 0.8896, test_f1: 0.5418
 epoch: 81, train_loss: 0.7829, test_loss: 0.9344, test_f1: 0.5396
 epoch: 82, train_loss: 0.7780, test_loss: 0.9591, test_f1: 0.5319
 epoch: 83, train_loss: 0.7810, test_loss: 0.9056, test_f1: 0.5387
 epoch: 84, train_loss: 0.7803, test_loss: 0.9016, test_f1: 0.5437
 epoch: 85, train_loss: 0.7736, test_loss: 0.9269, test_f1: 0.5447
 epoch: 86, train_loss: 0.7753, test_loss: 0.9046, test_f1: 0.5431
 epoch: 87, train_loss: 0.7636, test_loss: 0.9041, test_f1: 0.5479
 epoch: 88, train_loss: 0.7764, test_loss: 0.9241, test_f1: 0.5294
 epoch: 89, train_loss: 0.7788, test_loss: 0.9203, test_f1: 0.5410
 epoch: 90, train_loss: 0.7779, test_loss: 0.9574, test_f1: 0.5265
 epoch: 91, train_loss: 0.7661, test_loss: 0.9200, test_f1: 0.5396
 epoch: 92, train_loss: 0.7720, test_loss: 0.9534, test_f1: 0.5366
 epoch: 93, train_loss: 0.7766, test_loss: 0.9440, test_f1: 0.5341
 epoch: 94, train_loss: 0.7728, test_loss: 0.9401, test_f1: 0.5430
 epoch: 95, train_loss: 0.7691, test_loss: 0.9043, test_f1: 0.5366
 epoch: 96, train_loss: 0.7701, test_loss: 0.9222, test_f1: 0.5287
 epoch: 97, train_loss: 0.7612, test_loss: 0.9625, test_f1: 0.5158
 epoch: 98, train_loss: 0.7615, test_loss: 0.9590, test_f1: 0.5343
 epoch: 99, train_loss: 0.7569, test_loss: 0.9206, test_f1: 0.5424
##################ITERATION #5 ****************************************
 epoch: 0, train_loss: 1.2738, test_loss: 1.2026, test_f1: 0.2359
 epoch: 1, train_loss: 1.1357, test_loss: 1.1368, test_f1: 0.3207
 epoch: 2, train_loss: 1.0785, test_loss: 1.0826, test_f1: 0.3544
 epoch: 3, train_loss: 1.0564, test_loss: 1.0553, test_f1: 0.3798
 epoch: 4, train_loss: 1.0279, test_loss: 1.1825, test_f1: 0.3602
 epoch: 5, train_loss: 1.0188, test_loss: 1.0439, test_f1: 0.4459
 epoch: 6, train_loss: 1.0090, test_loss: 1.0926, test_f1: 0.3988
 epoch: 7, train_loss: 1.0025, test_loss: 1.0476, test_f1: 0.4508
 epoch: 8, train_loss: 0.9899, test_loss: 1.0153, test_f1: 0.3898
 epoch: 9, train_loss: 0.9845, test_loss: 0.9775, test_f1: 0.4984
 epoch: 10, train_loss: 0.9586, test_loss: 1.0171, test_f1: 0.4893
 epoch: 11, train_loss: 0.9592, test_loss: 0.9707, test_f1: 0.4874
 epoch: 12, train_loss: 0.9519, test_loss: 1.0032, test_f1: 0.4906
 epoch: 13, train_loss: 0.9448, test_loss: 0.9587, test_f1: 0.4964
 epoch: 14, train_loss: 0.9282, test_loss: 0.9362, test_f1: 0.4902
 epoch: 15, train_loss: 0.9203, test_loss: 0.9285, test_f1: 0.4933
 epoch: 16, train_loss: 0.9141, test_loss: 0.9073, test_f1: 0.5181
 epoch: 17, train_loss: 0.9121, test_loss: 1.0386, test_f1: 0.4844
 epoch: 18, train_loss: 0.9024, test_loss: 0.8677, test_f1: 0.5167
 epoch: 19, train_loss: 0.8960, test_loss: 0.9068, test_f1: 0.5060
 epoch: 20, train_loss: 0.8770, test_loss: 0.8951, test_f1: 0.5279
 epoch: 21, train_loss: 0.8926, test_loss: 1.0079, test_f1: 0.5161
 epoch: 22, train_loss: 0.8810, test_loss: 0.9492, test_f1: 0.5300
 epoch: 23, train_loss: 0.8734, test_loss: 0.9932, test_f1: 0.5063
 epoch: 24, train_loss: 0.8771, test_loss: 0.9264, test_f1: 0.5314
 epoch: 25, train_loss: 0.8573, test_loss: 0.9235, test_f1: 0.5162
 epoch: 26, train_loss: 0.8639, test_loss: 0.8978, test_f1: 0.5358
 epoch: 27, train_loss: 0.8659, test_loss: 0.9039, test_f1: 0.5431
 epoch: 28, train_loss: 0.8673, test_loss: 0.9395, test_f1: 0.5225
 epoch: 29, train_loss: 0.8447, test_loss: 0.9290, test_f1: 0.5259
 epoch: 30, train_loss: 0.8438, test_loss: 0.8870, test_f1: 0.5378
 epoch: 31, train_loss: 0.8449, test_loss: 0.8932, test_f1: 0.5484
 epoch: 32, train_loss: 0.8441, test_loss: 0.8370, test_f1: 0.5484
 epoch: 33, train_loss: 0.8295, test_loss: 0.8739, test_f1: 0.5477
 epoch: 34, train_loss: 0.8345, test_loss: 0.8296, test_f1: 0.5625
 epoch: 35, train_loss: 0.8463, test_loss: 0.8288, test_f1: 0.5511
 epoch: 36, train_loss: 0.8340, test_loss: 0.9181, test_f1: 0.5514
 epoch: 37, train_loss: 0.8163, test_loss: 0.8896, test_f1: 0.5480
 epoch: 38, train_loss: 0.8091, test_loss: 0.8710, test_f1: 0.5444
 epoch: 39, train_loss: 0.8196, test_loss: 0.8029, test_f1: 0.5492
 epoch: 40, train_loss: 0.8162, test_loss: 0.9934, test_f1: 0.5196
 epoch: 41, train_loss: 0.8336, test_loss: 0.9171, test_f1: 0.5268
 epoch: 42, train_loss: 0.8236, test_loss: 0.8335, test_f1: 0.5455
 epoch: 43, train_loss: 0.8131, test_loss: 0.8694, test_f1: 0.5515
 epoch: 44, train_loss: 0.8113, test_loss: 1.0166, test_f1: 0.5122
 epoch: 45, train_loss: 0.8043, test_loss: 0.8579, test_f1: 0.5594
 epoch: 46, train_loss: 0.8106, test_loss: 0.8064, test_f1: 0.5692
 epoch: 47, train_loss: 0.8071, test_loss: 0.8465, test_f1: 0.5361
 epoch: 48, train_loss: 0.8104, test_loss: 0.8410, test_f1: 0.5493
 epoch: 49, train_loss: 0.8044, test_loss: 0.9740, test_f1: 0.5302
 epoch: 50, train_loss: 0.8065, test_loss: 0.8161, test_f1: 0.5459
 epoch: 51, train_loss: 0.7712, test_loss: 0.8661, test_f1: 0.5457
 epoch: 52, train_loss: 0.7708, test_loss: 0.8049, test_f1: 0.5513
 epoch: 53, train_loss: 0.7758, test_loss: 0.8215, test_f1: 0.5589
 epoch: 54, train_loss: 0.7782, test_loss: 0.8281, test_f1: 0.5591
 epoch: 55, train_loss: 0.7802, test_loss: 0.8331, test_f1: 0.5540
 epoch: 56, train_loss: 0.7799, test_loss: 0.8329, test_f1: 0.5491
 epoch: 57, train_loss: 0.7764, test_loss: 0.8234, test_f1: 0.5597
 epoch: 58, train_loss: 0.7731, test_loss: 0.7839, test_f1: 0.5657
 epoch: 59, train_loss: 0.7615, test_loss: 0.8269, test_f1: 0.5602
 epoch: 60, train_loss: 0.7690, test_loss: 0.8299, test_f1: 0.5621
 epoch: 61, train_loss: 0.7770, test_loss: 0.8309, test_f1: 0.5632
 epoch: 62, train_loss: 0.7757, test_loss: 0.8288, test_f1: 0.5621
 epoch: 63, train_loss: 0.7745, test_loss: 0.8481, test_f1: 0.5531
 epoch: 64, train_loss: 0.7635, test_loss: 0.8531, test_f1: 0.5487
 epoch: 65, train_loss: 0.7683, test_loss: 0.8197, test_f1: 0.5844
 epoch: 66, train_loss: 0.7736, test_loss: 0.8394, test_f1: 0.5670
 epoch: 67, train_loss: 0.7632, test_loss: 0.8494, test_f1: 0.5573
 epoch: 68, train_loss: 0.7532, test_loss: 0.8573, test_f1: 0.5573
 epoch: 69, train_loss: 0.7707, test_loss: 0.8717, test_f1: 0.5538
 epoch: 70, train_loss: 0.7645, test_loss: 0.8176, test_f1: 0.5673
 epoch: 71, train_loss: 0.7552, test_loss: 0.8542, test_f1: 0.5573
 epoch: 72, train_loss: 0.7700, test_loss: 0.8317, test_f1: 0.5642
 epoch: 73, train_loss: 0.7553, test_loss: 0.8053, test_f1: 0.5751
 epoch: 74, train_loss: 0.7718, test_loss: 0.8212, test_f1: 0.5691
 epoch: 75, train_loss: 0.7483, test_loss: 0.8402, test_f1: 0.5580
 epoch: 76, train_loss: 0.7532, test_loss: 0.8120, test_f1: 0.5621
 epoch: 77, train_loss: 0.7632, test_loss: 0.7979, test_f1: 0.5663
 epoch: 78, train_loss: 0.7592, test_loss: 0.8151, test_f1: 0.5636
 epoch: 79, train_loss: 0.7474, test_loss: 0.8401, test_f1: 0.5581
 epoch: 80, train_loss: 0.7523, test_loss: 0.8251, test_f1: 0.5615
 epoch: 81, train_loss: 0.7489, test_loss: 0.8323, test_f1: 0.5605
 epoch: 82, train_loss: 0.7527, test_loss: 0.8586, test_f1: 0.5531
 epoch: 83, train_loss: 0.7504, test_loss: 0.8612, test_f1: 0.5522
 epoch: 84, train_loss: 0.7526, test_loss: 0.8438, test_f1: 0.5590
 epoch: 85, train_loss: 0.7418, test_loss: 0.8294, test_f1: 0.5564
 epoch: 86, train_loss: 0.7478, test_loss: 0.8547, test_f1: 0.5577
 epoch: 87, train_loss: 0.7491, test_loss: 0.8422, test_f1: 0.5534
 epoch: 88, train_loss: 0.7511, test_loss: 0.8043, test_f1: 0.5551
 epoch: 89, train_loss: 0.7507, test_loss: 0.8388, test_f1: 0.5593
 epoch: 90, train_loss: 0.7381, test_loss: 0.8359, test_f1: 0.5607
 epoch: 91, train_loss: 0.7424, test_loss: 0.8482, test_f1: 0.5565
 epoch: 92, train_loss: 0.7456, test_loss: 0.8314, test_f1: 0.5618
 epoch: 93, train_loss: 0.7383, test_loss: 0.8074, test_f1: 0.5677
 epoch: 94, train_loss: 0.7426, test_loss: 0.8238, test_f1: 0.5640
 epoch: 95, train_loss: 0.7354, test_loss: 0.7936, test_f1: 0.5635
 epoch: 96, train_loss: 0.7441, test_loss: 0.7900, test_f1: 0.5680
 epoch: 97, train_loss: 0.7386, test_loss: 0.8192, test_f1: 0.5642
 epoch: 98, train_loss: 0.7617, test_loss: 0.8303, test_f1: 0.5629
 epoch: 99, train_loss: 0.7211, test_loss: 0.8292, test_f1: 0.5582
##################ITERATION #6 ****************************************
 epoch: 0, train_loss: 1.2405, test_loss: 1.2855, test_f1: 0.2370
 epoch: 1, train_loss: 1.0747, test_loss: 1.0259, test_f1: 0.4458
 epoch: 2, train_loss: 1.0429, test_loss: 1.0043, test_f1: 0.4447
 epoch: 3, train_loss: 1.0262, test_loss: 0.9965, test_f1: 0.4686
 epoch: 4, train_loss: 0.9895, test_loss: 1.0400, test_f1: 0.4346
 epoch: 5, train_loss: 0.9766, test_loss: 0.9646, test_f1: 0.4744
 epoch: 6, train_loss: 0.9737, test_loss: 0.9818, test_f1: 0.4761
 epoch: 7, train_loss: 0.9543, test_loss: 1.0087, test_f1: 0.4342
 epoch: 8, train_loss: 0.9410, test_loss: 0.9539, test_f1: 0.4639
 epoch: 9, train_loss: 0.9495, test_loss: 0.9630, test_f1: 0.4710
 epoch: 10, train_loss: 0.9265, test_loss: 0.9323, test_f1: 0.4977
 epoch: 11, train_loss: 0.9343, test_loss: 0.9994, test_f1: 0.4268
 epoch: 12, train_loss: 0.9176, test_loss: 0.9713, test_f1: 0.4799
 epoch: 13, train_loss: 0.9084, test_loss: 0.9871, test_f1: 0.4628
 epoch: 14, train_loss: 0.8953, test_loss: 1.0254, test_f1: 0.4561
 epoch: 15, train_loss: 0.8966, test_loss: 0.9687, test_f1: 0.4608
 epoch: 16, train_loss: 0.8702, test_loss: 0.9495, test_f1: 0.4963
 epoch: 17, train_loss: 0.8924, test_loss: 0.9772, test_f1: 0.4552
 epoch: 18, train_loss: 0.8774, test_loss: 0.9968, test_f1: 0.4429
 epoch: 19, train_loss: 0.8761, test_loss: 0.9759, test_f1: 0.5052
 epoch: 20, train_loss: 0.8749, test_loss: 1.0061, test_f1: 0.4802
 epoch: 21, train_loss: 0.8571, test_loss: 0.9840, test_f1: 0.4957
 epoch: 22, train_loss: 0.8498, test_loss: 0.9474, test_f1: 0.4908
 epoch: 23, train_loss: 0.8568, test_loss: 0.8974, test_f1: 0.5120
 epoch: 24, train_loss: 0.8489, test_loss: 0.9160, test_f1: 0.5203
 epoch: 25, train_loss: 0.8531, test_loss: 0.9413, test_f1: 0.4616
 epoch: 26, train_loss: 0.8511, test_loss: 0.9038, test_f1: 0.5060
 epoch: 27, train_loss: 0.8393, test_loss: 0.8810, test_f1: 0.5113
 epoch: 28, train_loss: 0.8241, test_loss: 0.9101, test_f1: 0.5129
 epoch: 29, train_loss: 0.8232, test_loss: 0.9531, test_f1: 0.4929
 epoch: 30, train_loss: 0.8249, test_loss: 0.9450, test_f1: 0.5029
 epoch: 31, train_loss: 0.8175, test_loss: 0.9101, test_f1: 0.5106
 epoch: 32, train_loss: 0.8139, test_loss: 0.9687, test_f1: 0.4768
 epoch: 33, train_loss: 0.8055, test_loss: 0.9507, test_f1: 0.4928
 epoch: 34, train_loss: 0.8116, test_loss: 0.9880, test_f1: 0.4875
 epoch: 35, train_loss: 0.8067, test_loss: 0.9231, test_f1: 0.5267
 epoch: 36, train_loss: 0.7985, test_loss: 0.9371, test_f1: 0.5172
 epoch: 37, train_loss: 0.8117, test_loss: 0.8813, test_f1: 0.5170
 epoch: 38, train_loss: 0.8072, test_loss: 0.8835, test_f1: 0.5423
 epoch: 39, train_loss: 0.7887, test_loss: 0.9400, test_f1: 0.5221
 epoch: 40, train_loss: 0.7974, test_loss: 0.9237, test_f1: 0.5006
 epoch: 41, train_loss: 0.7916, test_loss: 0.9010, test_f1: 0.5158
 epoch: 42, train_loss: 0.7998, test_loss: 0.9436, test_f1: 0.4889
 epoch: 43, train_loss: 0.8004, test_loss: 0.9155, test_f1: 0.5233
 epoch: 44, train_loss: 0.7903, test_loss: 0.8964, test_f1: 0.5363
 epoch: 45, train_loss: 0.7686, test_loss: 0.8971, test_f1: 0.5298
 epoch: 46, train_loss: 0.7799, test_loss: 0.9515, test_f1: 0.5108
 epoch: 47, train_loss: 0.7754, test_loss: 0.9240, test_f1: 0.5013
 epoch: 48, train_loss: 0.7757, test_loss: 0.9181, test_f1: 0.5316
 epoch: 49, train_loss: 0.7684, test_loss: 0.9682, test_f1: 0.5055
 epoch: 50, train_loss: 0.7744, test_loss: 0.8863, test_f1: 0.5332
 epoch: 51, train_loss: 0.7618, test_loss: 0.9095, test_f1: 0.5316
 epoch: 52, train_loss: 0.7600, test_loss: 0.9071, test_f1: 0.5221
 epoch: 53, train_loss: 0.7687, test_loss: 0.8844, test_f1: 0.5314
 epoch: 54, train_loss: 0.7476, test_loss: 0.8812, test_f1: 0.5270
 epoch: 55, train_loss: 0.7577, test_loss: 0.9049, test_f1: 0.5261
 epoch: 56, train_loss: 0.7476, test_loss: 0.8770, test_f1: 0.5487
 epoch: 57, train_loss: 0.7466, test_loss: 0.8797, test_f1: 0.5403
 epoch: 58, train_loss: 0.7549, test_loss: 0.8866, test_f1: 0.5262
 epoch: 59, train_loss: 0.7465, test_loss: 0.9289, test_f1: 0.5297
 epoch: 60, train_loss: 0.7431, test_loss: 0.8939, test_f1: 0.5278
 epoch: 61, train_loss: 0.7409, test_loss: 0.9070, test_f1: 0.5326
 epoch: 62, train_loss: 0.7461, test_loss: 0.9322, test_f1: 0.5253
 epoch: 63, train_loss: 0.7437, test_loss: 0.8793, test_f1: 0.5416
 epoch: 64, train_loss: 0.7543, test_loss: 0.9058, test_f1: 0.5309
 epoch: 65, train_loss: 0.7496, test_loss: 0.8940, test_f1: 0.5349
 epoch: 66, train_loss: 0.7321, test_loss: 0.9181, test_f1: 0.5305
 epoch: 67, train_loss: 0.7454, test_loss: 0.8903, test_f1: 0.5329
 epoch: 68, train_loss: 0.7370, test_loss: 0.8984, test_f1: 0.5375
 epoch: 69, train_loss: 0.7323, test_loss: 0.8878, test_f1: 0.5516
 epoch: 70, train_loss: 0.7449, test_loss: 0.9129, test_f1: 0.5341
 epoch: 71, train_loss: 0.7443, test_loss: 0.9550, test_f1: 0.5261
 epoch: 72, train_loss: 0.7299, test_loss: 0.9186, test_f1: 0.5407
 epoch: 73, train_loss: 0.7430, test_loss: 0.9012, test_f1: 0.5325
 epoch: 74, train_loss: 0.7308, test_loss: 0.8939, test_f1: 0.5532
 epoch: 75, train_loss: 0.7300, test_loss: 0.9328, test_f1: 0.5417
 epoch: 76, train_loss: 0.7294, test_loss: 0.8819, test_f1: 0.5457
 epoch: 77, train_loss: 0.7440, test_loss: 0.9196, test_f1: 0.5372
 epoch: 78, train_loss: 0.7203, test_loss: 0.8953, test_f1: 0.5499
 epoch: 79, train_loss: 0.7253, test_loss: 0.8939, test_f1: 0.5491
 epoch: 80, train_loss: 0.7257, test_loss: 0.8806, test_f1: 0.5368
 epoch: 81, train_loss: 0.7372, test_loss: 0.8995, test_f1: 0.5326
 epoch: 82, train_loss: 0.7267, test_loss: 0.8833, test_f1: 0.5408
 epoch: 83, train_loss: 0.7255, test_loss: 0.8999, test_f1: 0.5404
 epoch: 84, train_loss: 0.7148, test_loss: 0.8730, test_f1: 0.5458
 epoch: 85, train_loss: 0.7314, test_loss: 0.8896, test_f1: 0.5356
 epoch: 86, train_loss: 0.7296, test_loss: 0.8580, test_f1: 0.5417
 epoch: 87, train_loss: 0.7091, test_loss: 0.9087, test_f1: 0.5395
 epoch: 88, train_loss: 0.7155, test_loss: 0.9345, test_f1: 0.5387
 epoch: 89, train_loss: 0.7184, test_loss: 0.9334, test_f1: 0.5360
 epoch: 90, train_loss: 0.7269, test_loss: 0.8644, test_f1: 0.5529
 epoch: 91, train_loss: 0.7132, test_loss: 0.9191, test_f1: 0.5578
 epoch: 92, train_loss: 0.7192, test_loss: 0.9366, test_f1: 0.5392
 epoch: 93, train_loss: 0.7071, test_loss: 0.8899, test_f1: 0.5448
 epoch: 94, train_loss: 0.7080, test_loss: 0.9135, test_f1: 0.5431
 epoch: 95, train_loss: 0.7194, test_loss: 0.8807, test_f1: 0.5464
 epoch: 96, train_loss: 0.7073, test_loss: 0.8949, test_f1: 0.5507
 epoch: 97, train_loss: 0.7178, test_loss: 0.8834, test_f1: 0.5414
 epoch: 98, train_loss: 0.7177, test_loss: 0.8862, test_f1: 0.5390
 epoch: 99, train_loss: 0.7076, test_loss: 0.8888, test_f1: 0.5426
##################ITERATION #7 ****************************************
 epoch: 0, train_loss: 1.3149, test_loss: 1.3113, test_f1: 0.2671
 epoch: 1, train_loss: 1.1275, test_loss: 1.0420, test_f1: 0.3997
 epoch: 2, train_loss: 1.0937, test_loss: 1.0314, test_f1: 0.4012
 epoch: 3, train_loss: 1.0681, test_loss: 1.0370, test_f1: 0.4042
 epoch: 4, train_loss: 1.0556, test_loss: 1.0315, test_f1: 0.4082
 epoch: 5, train_loss: 1.0507, test_loss: 1.0257, test_f1: 0.4063
 epoch: 6, train_loss: 1.0420, test_loss: 1.0407, test_f1: 0.4212
 epoch: 7, train_loss: 1.0247, test_loss: 1.0279, test_f1: 0.4416
 epoch: 8, train_loss: 1.0294, test_loss: 1.0284, test_f1: 0.4518
 epoch: 9, train_loss: 1.0169, test_loss: 1.0265, test_f1: 0.4546
 epoch: 10, train_loss: 1.0053, test_loss: 1.0450, test_f1: 0.4587
 epoch: 11, train_loss: 0.9928, test_loss: 1.0231, test_f1: 0.4765
 epoch: 12, train_loss: 1.0023, test_loss: 1.0372, test_f1: 0.4824
 epoch: 13, train_loss: 0.9906, test_loss: 1.0171, test_f1: 0.4720
 epoch: 14, train_loss: 0.9832, test_loss: 1.0325, test_f1: 0.4462
 epoch: 15, train_loss: 0.9741, test_loss: 1.0123, test_f1: 0.4800
 epoch: 16, train_loss: 0.9722, test_loss: 1.0368, test_f1: 0.4600
 epoch: 17, train_loss: 0.9730, test_loss: 1.0061, test_f1: 0.4868
 epoch: 18, train_loss: 0.9622, test_loss: 0.9900, test_f1: 0.4874
 epoch: 19, train_loss: 0.9486, test_loss: 0.9907, test_f1: 0.5049
 epoch: 20, train_loss: 0.9478, test_loss: 1.0245, test_f1: 0.4758
 epoch: 21, train_loss: 0.9458, test_loss: 0.9739, test_f1: 0.5248
 epoch: 22, train_loss: 0.9376, test_loss: 0.9796, test_f1: 0.5046
 epoch: 23, train_loss: 0.9296, test_loss: 0.9702, test_f1: 0.5160
 epoch: 24, train_loss: 0.9310, test_loss: 0.9670, test_f1: 0.5013
 epoch: 25, train_loss: 0.9308, test_loss: 1.0177, test_f1: 0.4733
 epoch: 26, train_loss: 0.9197, test_loss: 0.9742, test_f1: 0.5030
 epoch: 27, train_loss: 0.9103, test_loss: 0.9553, test_f1: 0.5119
 epoch: 28, train_loss: 0.9007, test_loss: 0.9790, test_f1: 0.5017
 epoch: 29, train_loss: 0.9061, test_loss: 0.9468, test_f1: 0.5270
 epoch: 30, train_loss: 0.9069, test_loss: 0.9759, test_f1: 0.4934
 epoch: 31, train_loss: 0.9061, test_loss: 0.9177, test_f1: 0.5390
 epoch: 32, train_loss: 0.8805, test_loss: 0.9652, test_f1: 0.5073
 epoch: 33, train_loss: 0.8877, test_loss: 0.9809, test_f1: 0.5072
 epoch: 34, train_loss: 0.8810, test_loss: 0.9106, test_f1: 0.5146
 epoch: 35, train_loss: 0.8832, test_loss: 0.9328, test_f1: 0.5182
 epoch: 36, train_loss: 0.8676, test_loss: 0.9443, test_f1: 0.5098
 epoch: 37, train_loss: 0.8676, test_loss: 0.9288, test_f1: 0.5449
 epoch: 38, train_loss: 0.8856, test_loss: 0.9370, test_f1: 0.4952
 epoch: 39, train_loss: 0.8709, test_loss: 0.9173, test_f1: 0.5233
 epoch: 40, train_loss: 0.8709, test_loss: 0.9586, test_f1: 0.4794
 epoch: 41, train_loss: 0.8605, test_loss: 0.9538, test_f1: 0.5123
 epoch: 42, train_loss: 0.8546, test_loss: 0.9069, test_f1: 0.5372
 epoch: 43, train_loss: 0.8564, test_loss: 0.9106, test_f1: 0.5370
 epoch: 44, train_loss: 0.8597, test_loss: 0.9289, test_f1: 0.5182
 epoch: 45, train_loss: 0.8511, test_loss: 0.9216, test_f1: 0.5120
 epoch: 46, train_loss: 0.8514, test_loss: 0.8985, test_f1: 0.5313
 epoch: 47, train_loss: 0.8473, test_loss: 0.9288, test_f1: 0.5079
 epoch: 48, train_loss: 0.8438, test_loss: 0.9482, test_f1: 0.5048
 epoch: 49, train_loss: 0.8449, test_loss: 0.8883, test_f1: 0.5404
 epoch: 50, train_loss: 0.8289, test_loss: 0.8821, test_f1: 0.5331
 epoch: 51, train_loss: 0.8131, test_loss: 0.9245, test_f1: 0.5205
 epoch: 52, train_loss: 0.8281, test_loss: 0.8918, test_f1: 0.5334
 epoch: 53, train_loss: 0.8190, test_loss: 0.9064, test_f1: 0.5322
 epoch: 54, train_loss: 0.8103, test_loss: 0.9039, test_f1: 0.5264
 epoch: 55, train_loss: 0.8188, test_loss: 0.9209, test_f1: 0.5285
 epoch: 56, train_loss: 0.8139, test_loss: 0.8779, test_f1: 0.5465
 epoch: 57, train_loss: 0.8133, test_loss: 0.9049, test_f1: 0.5459
 epoch: 58, train_loss: 0.8107, test_loss: 0.8963, test_f1: 0.5463
 epoch: 59, train_loss: 0.8108, test_loss: 0.9361, test_f1: 0.5316
 epoch: 60, train_loss: 0.8083, test_loss: 0.8942, test_f1: 0.5364
 epoch: 61, train_loss: 0.8008, test_loss: 0.9004, test_f1: 0.5416
 epoch: 62, train_loss: 0.8047, test_loss: 0.9062, test_f1: 0.5268
 epoch: 63, train_loss: 0.8057, test_loss: 0.9160, test_f1: 0.5335
 epoch: 64, train_loss: 0.8028, test_loss: 0.9095, test_f1: 0.5373
 epoch: 65, train_loss: 0.7959, test_loss: 0.8930, test_f1: 0.5532
 epoch: 66, train_loss: 0.7904, test_loss: 0.9303, test_f1: 0.5441
 epoch: 67, train_loss: 0.8044, test_loss: 0.9065, test_f1: 0.5423
 epoch: 68, train_loss: 0.7965, test_loss: 0.8749, test_f1: 0.5609
 epoch: 69, train_loss: 0.8103, test_loss: 0.9254, test_f1: 0.5348
 epoch: 70, train_loss: 0.7825, test_loss: 0.8760, test_f1: 0.5489
 epoch: 71, train_loss: 0.8010, test_loss: 0.9361, test_f1: 0.5223
 epoch: 72, train_loss: 0.7894, test_loss: 0.9003, test_f1: 0.5356
 epoch: 73, train_loss: 0.7989, test_loss: 0.9061, test_f1: 0.5335
 epoch: 74, train_loss: 0.8006, test_loss: 0.9039, test_f1: 0.5447
 epoch: 75, train_loss: 0.7982, test_loss: 0.9206, test_f1: 0.5262
 epoch: 76, train_loss: 0.7863, test_loss: 0.8814, test_f1: 0.5342
 epoch: 77, train_loss: 0.7769, test_loss: 0.9039, test_f1: 0.5215
 epoch: 78, train_loss: 0.7789, test_loss: 0.9396, test_f1: 0.5110
 epoch: 79, train_loss: 0.7728, test_loss: 0.8844, test_f1: 0.5550
 epoch: 80, train_loss: 0.7754, test_loss: 0.9076, test_f1: 0.5421
 epoch: 81, train_loss: 0.7840, test_loss: 0.8839, test_f1: 0.5321
 epoch: 82, train_loss: 0.7766, test_loss: 0.9329, test_f1: 0.5381
 epoch: 83, train_loss: 0.7782, test_loss: 0.9301, test_f1: 0.5266
 epoch: 84, train_loss: 0.7800, test_loss: 0.8889, test_f1: 0.5521
 epoch: 85, train_loss: 0.7785, test_loss: 0.8915, test_f1: 0.5308
 epoch: 86, train_loss: 0.7824, test_loss: 0.9011, test_f1: 0.5415
 epoch: 87, train_loss: 0.7794, test_loss: 0.8805, test_f1: 0.5659
 epoch: 88, train_loss: 0.7792, test_loss: 0.8976, test_f1: 0.5405
 epoch: 89, train_loss: 0.7617, test_loss: 0.9034, test_f1: 0.5481
 epoch: 90, train_loss: 0.7709, test_loss: 0.9138, test_f1: 0.5310
 epoch: 91, train_loss: 0.7789, test_loss: 0.9054, test_f1: 0.5541
 epoch: 92, train_loss: 0.7703, test_loss: 0.9141, test_f1: 0.5326
 epoch: 93, train_loss: 0.7614, test_loss: 0.8861, test_f1: 0.5628
 epoch: 94, train_loss: 0.7702, test_loss: 0.9138, test_f1: 0.5400
 epoch: 95, train_loss: 0.7668, test_loss: 0.9086, test_f1: 0.5331
 epoch: 96, train_loss: 0.7765, test_loss: 0.8799, test_f1: 0.5675
 epoch: 97, train_loss: 0.7692, test_loss: 0.8818, test_f1: 0.5592
 epoch: 98, train_loss: 0.7773, test_loss: 0.9245, test_f1: 0.5243
 epoch: 99, train_loss: 0.7694, test_loss: 0.9130, test_f1: 0.5389
##################ITERATION #8 ****************************************
 epoch: 0, train_loss: 1.2806, test_loss: 1.3100, test_f1: 0.2892
 epoch: 1, train_loss: 1.1255, test_loss: 1.0469, test_f1: 0.4163
 epoch: 2, train_loss: 1.0870, test_loss: 1.0310, test_f1: 0.3821
 epoch: 3, train_loss: 1.0643, test_loss: 1.0411, test_f1: 0.4121
 epoch: 4, train_loss: 1.0532, test_loss: 1.0098, test_f1: 0.4383
 epoch: 5, train_loss: 1.0362, test_loss: 1.0217, test_f1: 0.4354
 epoch: 6, train_loss: 1.0219, test_loss: 1.0194, test_f1: 0.4790
 epoch: 7, train_loss: 0.9992, test_loss: 1.0091, test_f1: 0.4731
 epoch: 8, train_loss: 0.9928, test_loss: 1.0164, test_f1: 0.4542
 epoch: 9, train_loss: 0.9850, test_loss: 1.0138, test_f1: 0.4833
 epoch: 10, train_loss: 0.9705, test_loss: 1.0009, test_f1: 0.4899
 epoch: 11, train_loss: 0.9714, test_loss: 1.0217, test_f1: 0.4734
 epoch: 12, train_loss: 0.9647, test_loss: 1.0275, test_f1: 0.4744
 epoch: 13, train_loss: 0.9660, test_loss: 0.9941, test_f1: 0.5023
 epoch: 14, train_loss: 0.9571, test_loss: 1.0111, test_f1: 0.4803
 epoch: 15, train_loss: 0.9475, test_loss: 0.9754, test_f1: 0.4962
 epoch: 16, train_loss: 0.9416, test_loss: 1.0106, test_f1: 0.5011
 epoch: 17, train_loss: 0.9363, test_loss: 1.0351, test_f1: 0.4527
 epoch: 18, train_loss: 0.9282, test_loss: 1.0255, test_f1: 0.4794
 epoch: 19, train_loss: 0.9397, test_loss: 0.9726, test_f1: 0.5036
 epoch: 20, train_loss: 0.9228, test_loss: 0.9769, test_f1: 0.4916
 epoch: 21, train_loss: 0.9266, test_loss: 1.0267, test_f1: 0.4866
 epoch: 22, train_loss: 0.9206, test_loss: 1.0094, test_f1: 0.5032
 epoch: 23, train_loss: 0.9114, test_loss: 0.9740, test_f1: 0.4974
 epoch: 24, train_loss: 0.9004, test_loss: 0.9609, test_f1: 0.5029
 epoch: 25, train_loss: 0.9127, test_loss: 0.9762, test_f1: 0.5123
 epoch: 26, train_loss: 0.9021, test_loss: 0.9546, test_f1: 0.5176
 epoch: 27, train_loss: 0.9059, test_loss: 0.9790, test_f1: 0.4818
 epoch: 28, train_loss: 0.8941, test_loss: 0.9578, test_f1: 0.5234
 epoch: 29, train_loss: 0.8982, test_loss: 1.0196, test_f1: 0.4966
 epoch: 30, train_loss: 0.8901, test_loss: 0.9613, test_f1: 0.5120
 epoch: 31, train_loss: 0.8911, test_loss: 0.9837, test_f1: 0.5061
 epoch: 32, train_loss: 0.8947, test_loss: 0.9477, test_f1: 0.5195
 epoch: 33, train_loss: 0.8845, test_loss: 0.9743, test_f1: 0.5078
 epoch: 34, train_loss: 0.8791, test_loss: 0.9335, test_f1: 0.5239
 epoch: 35, train_loss: 0.8882, test_loss: 0.9347, test_f1: 0.5297
 epoch: 36, train_loss: 0.8788, test_loss: 0.9270, test_f1: 0.5183
 epoch: 37, train_loss: 0.8912, test_loss: 0.9659, test_f1: 0.4980
 epoch: 38, train_loss: 0.8685, test_loss: 0.9352, test_f1: 0.5210
 epoch: 39, train_loss: 0.8674, test_loss: 0.9899, test_f1: 0.5024
 epoch: 40, train_loss: 0.8648, test_loss: 0.9302, test_f1: 0.5246
 epoch: 41, train_loss: 0.8587, test_loss: 0.9014, test_f1: 0.5158
 epoch: 42, train_loss: 0.8655, test_loss: 0.9376, test_f1: 0.5185
 epoch: 43, train_loss: 0.8586, test_loss: 0.9117, test_f1: 0.5106
 epoch: 44, train_loss: 0.8668, test_loss: 0.9037, test_f1: 0.5233
 epoch: 45, train_loss: 0.8517, test_loss: 0.9191, test_f1: 0.5127
 epoch: 46, train_loss: 0.8585, test_loss: 0.9519, test_f1: 0.5130
 epoch: 47, train_loss: 0.8504, test_loss: 0.9275, test_f1: 0.5089
 epoch: 48, train_loss: 0.8528, test_loss: 0.9613, test_f1: 0.5118
 epoch: 49, train_loss: 0.8451, test_loss: 0.9111, test_f1: 0.5238
 epoch: 50, train_loss: 0.8359, test_loss: 0.8995, test_f1: 0.5323
 epoch: 51, train_loss: 0.8299, test_loss: 0.8897, test_f1: 0.5185
 epoch: 52, train_loss: 0.8302, test_loss: 0.9183, test_f1: 0.5231
 epoch: 53, train_loss: 0.8218, test_loss: 0.8965, test_f1: 0.5201
 epoch: 54, train_loss: 0.8364, test_loss: 0.9015, test_f1: 0.5259
 epoch: 55, train_loss: 0.8309, test_loss: 0.9118, test_f1: 0.5239
 epoch: 56, train_loss: 0.8250, test_loss: 0.9110, test_f1: 0.5301
 epoch: 57, train_loss: 0.8219, test_loss: 0.8977, test_f1: 0.5374
 epoch: 58, train_loss: 0.8260, test_loss: 0.8956, test_f1: 0.5232
 epoch: 59, train_loss: 0.8193, test_loss: 0.9024, test_f1: 0.5506
 epoch: 60, train_loss: 0.8194, test_loss: 0.9035, test_f1: 0.5302
 epoch: 61, train_loss: 0.8249, test_loss: 0.8990, test_f1: 0.5345
 epoch: 62, train_loss: 0.8183, test_loss: 0.9014, test_f1: 0.5258
 epoch: 63, train_loss: 0.8142, test_loss: 0.9262, test_f1: 0.5275
 epoch: 64, train_loss: 0.8114, test_loss: 0.9045, test_f1: 0.5554
 epoch: 65, train_loss: 0.8194, test_loss: 0.8834, test_f1: 0.5234
 epoch: 66, train_loss: 0.8250, test_loss: 0.8943, test_f1: 0.5316
 epoch: 67, train_loss: 0.8198, test_loss: 0.8937, test_f1: 0.5349
 epoch: 68, train_loss: 0.8061, test_loss: 0.8909, test_f1: 0.5448
 epoch: 69, train_loss: 0.8170, test_loss: 0.9098, test_f1: 0.5245
 epoch: 70, train_loss: 0.8124, test_loss: 0.9043, test_f1: 0.5336
 epoch: 71, train_loss: 0.8081, test_loss: 0.9189, test_f1: 0.5293
 epoch: 72, train_loss: 0.8136, test_loss: 0.9065, test_f1: 0.5224
 epoch: 73, train_loss: 0.8049, test_loss: 0.9090, test_f1: 0.5351
 epoch: 74, train_loss: 0.8066, test_loss: 0.8907, test_f1: 0.5515
 epoch: 75, train_loss: 0.8094, test_loss: 0.9121, test_f1: 0.5308
 epoch: 76, train_loss: 0.8139, test_loss: 0.9036, test_f1: 0.5460
 epoch: 77, train_loss: 0.8170, test_loss: 0.9148, test_f1: 0.5230
 epoch: 78, train_loss: 0.8088, test_loss: 0.8853, test_f1: 0.5347
 epoch: 79, train_loss: 0.7971, test_loss: 0.9023, test_f1: 0.5441
 epoch: 80, train_loss: 0.8022, test_loss: 0.8729, test_f1: 0.5483
 epoch: 81, train_loss: 0.7927, test_loss: 0.8907, test_f1: 0.5416
 epoch: 82, train_loss: 0.8086, test_loss: 0.9024, test_f1: 0.5575
 epoch: 83, train_loss: 0.7995, test_loss: 0.9039, test_f1: 0.5411
 epoch: 84, train_loss: 0.8100, test_loss: 0.8790, test_f1: 0.5499
 epoch: 85, train_loss: 0.8121, test_loss: 0.8975, test_f1: 0.5509
 epoch: 86, train_loss: 0.7972, test_loss: 0.8954, test_f1: 0.5455
 epoch: 87, train_loss: 0.7961, test_loss: 0.8734, test_f1: 0.5678
 epoch: 88, train_loss: 0.7931, test_loss: 0.9231, test_f1: 0.5210
 epoch: 89, train_loss: 0.8000, test_loss: 0.8911, test_f1: 0.5393
 epoch: 90, train_loss: 0.7901, test_loss: 0.9259, test_f1: 0.5310
 epoch: 91, train_loss: 0.8058, test_loss: 0.8937, test_f1: 0.5317
 epoch: 92, train_loss: 0.7926, test_loss: 0.9120, test_f1: 0.5401
 epoch: 93, train_loss: 0.7964, test_loss: 0.9111, test_f1: 0.5765
 epoch: 94, train_loss: 0.7999, test_loss: 0.9128, test_f1: 0.5437
 epoch: 95, train_loss: 0.7975, test_loss: 0.9133, test_f1: 0.5431
 epoch: 96, train_loss: 0.7869, test_loss: 0.8920, test_f1: 0.5631
 epoch: 97, train_loss: 0.7888, test_loss: 0.8903, test_f1: 0.5718
 epoch: 98, train_loss: 0.7918, test_loss: 0.9116, test_f1: 0.5528
 epoch: 99, train_loss: 0.7892, test_loss: 0.8984, test_f1: 0.5420
##################ITERATION #9 ****************************************
 epoch: 0, train_loss: 1.4553, test_loss: 1.2103, test_f1: 0.2650
 epoch: 1, train_loss: 1.1786, test_loss: 1.1215, test_f1: 0.3687
 epoch: 2, train_loss: 1.1146, test_loss: 1.0924, test_f1: 0.4063
 epoch: 3, train_loss: 1.0961, test_loss: 1.0741, test_f1: 0.4504
 epoch: 4, train_loss: 1.0583, test_loss: 1.0385, test_f1: 0.4023
 epoch: 5, train_loss: 1.0350, test_loss: 1.0121, test_f1: 0.4232
 epoch: 6, train_loss: 1.0207, test_loss: 0.9841, test_f1: 0.4745
 epoch: 7, train_loss: 0.9923, test_loss: 0.9661, test_f1: 0.5013
 epoch: 8, train_loss: 0.9837, test_loss: 0.9718, test_f1: 0.4680
 epoch: 9, train_loss: 0.9664, test_loss: 0.9418, test_f1: 0.4937
 epoch: 10, train_loss: 0.9632, test_loss: 0.9319, test_f1: 0.5226
 epoch: 11, train_loss: 0.9534, test_loss: 0.9505, test_f1: 0.5011
 epoch: 12, train_loss: 0.9577, test_loss: 0.9933, test_f1: 0.5094
 epoch: 13, train_loss: 0.9401, test_loss: 0.9223, test_f1: 0.5042
 epoch: 14, train_loss: 0.9221, test_loss: 0.9386, test_f1: 0.5009
 epoch: 15, train_loss: 0.9345, test_loss: 0.9633, test_f1: 0.4969
 epoch: 16, train_loss: 0.9182, test_loss: 0.9162, test_f1: 0.5234
 epoch: 17, train_loss: 0.9193, test_loss: 0.9193, test_f1: 0.5033
 epoch: 18, train_loss: 0.8966, test_loss: 0.8879, test_f1: 0.5284
 epoch: 19, train_loss: 0.8868, test_loss: 0.8790, test_f1: 0.5197
 epoch: 20, train_loss: 0.8812, test_loss: 0.9339, test_f1: 0.5062
 epoch: 21, train_loss: 0.8925, test_loss: 0.9099, test_f1: 0.5144
 epoch: 22, train_loss: 0.8898, test_loss: 0.9160, test_f1: 0.5297
 epoch: 23, train_loss: 0.8788, test_loss: 0.8815, test_f1: 0.5176
 epoch: 24, train_loss: 0.8808, test_loss: 0.9113, test_f1: 0.5249
 epoch: 25, train_loss: 0.8678, test_loss: 0.8611, test_f1: 0.5163
 epoch: 26, train_loss: 0.8656, test_loss: 0.8716, test_f1: 0.5465
 epoch: 27, train_loss: 0.8554, test_loss: 0.8824, test_f1: 0.5239
 epoch: 28, train_loss: 0.8622, test_loss: 0.9122, test_f1: 0.5015
 epoch: 29, train_loss: 0.8642, test_loss: 0.8861, test_f1: 0.5201
 epoch: 30, train_loss: 0.8554, test_loss: 0.8819, test_f1: 0.5357
 epoch: 31, train_loss: 0.8455, test_loss: 0.8895, test_f1: 0.5269
 epoch: 32, train_loss: 0.8434, test_loss: 0.9152, test_f1: 0.4978
 epoch: 33, train_loss: 0.8411, test_loss: 0.9045, test_f1: 0.4983
 epoch: 34, train_loss: 0.8438, test_loss: 0.8755, test_f1: 0.5154
 epoch: 35, train_loss: 0.8194, test_loss: 0.8951, test_f1: 0.5177
 epoch: 36, train_loss: 0.8229, test_loss: 0.9057, test_f1: 0.5281
 epoch: 37, train_loss: 0.8452, test_loss: 0.8964, test_f1: 0.5250
 epoch: 38, train_loss: 0.8308, test_loss: 0.9101, test_f1: 0.5249
 epoch: 39, train_loss: 0.8174, test_loss: 0.8670, test_f1: 0.5365
 epoch: 40, train_loss: 0.8194, test_loss: 0.8925, test_f1: 0.5283
 epoch: 41, train_loss: 0.8214, test_loss: 0.8999, test_f1: 0.5325
 epoch: 42, train_loss: 0.8167, test_loss: 0.8955, test_f1: 0.5215
 epoch: 43, train_loss: 0.8197, test_loss: 0.8788, test_f1: 0.5454
 epoch: 44, train_loss: 0.8111, test_loss: 0.9834, test_f1: 0.5000
 epoch: 45, train_loss: 0.8216, test_loss: 0.8821, test_f1: 0.5598
 epoch: 46, train_loss: 0.8092, test_loss: 0.8951, test_f1: 0.5356
 epoch: 47, train_loss: 0.8105, test_loss: 0.9228, test_f1: 0.5451
 epoch: 48, train_loss: 0.8061, test_loss: 0.8782, test_f1: 0.5367
 epoch: 49, train_loss: 0.8080, test_loss: 0.8788, test_f1: 0.5361
 epoch: 50, train_loss: 0.7963, test_loss: 0.8859, test_f1: 0.5359
 epoch: 51, train_loss: 0.7978, test_loss: 0.8826, test_f1: 0.5291
 epoch: 52, train_loss: 0.7862, test_loss: 0.8635, test_f1: 0.5497
 epoch: 53, train_loss: 0.7818, test_loss: 0.8626, test_f1: 0.5469
 epoch: 54, train_loss: 0.7837, test_loss: 0.8688, test_f1: 0.5400
 epoch: 55, train_loss: 0.7842, test_loss: 0.8819, test_f1: 0.5323
 epoch: 56, train_loss: 0.7876, test_loss: 0.8738, test_f1: 0.5471
 epoch: 57, train_loss: 0.7794, test_loss: 0.8884, test_f1: 0.5243
 epoch: 58, train_loss: 0.7718, test_loss: 0.8909, test_f1: 0.5239
 epoch: 59, train_loss: 0.7860, test_loss: 0.9000, test_f1: 0.5200
 epoch: 60, train_loss: 0.7758, test_loss: 0.8773, test_f1: 0.5280
 epoch: 61, train_loss: 0.7775, test_loss: 0.8759, test_f1: 0.5400
 epoch: 62, train_loss: 0.7695, test_loss: 0.8757, test_f1: 0.5302
 epoch: 63, train_loss: 0.7881, test_loss: 0.8954, test_f1: 0.5156
 epoch: 64, train_loss: 0.7682, test_loss: 0.8609, test_f1: 0.5351
 epoch: 65, train_loss: 0.7728, test_loss: 0.8763, test_f1: 0.5626
 epoch: 66, train_loss: 0.7657, test_loss: 0.8913, test_f1: 0.5287
 epoch: 67, train_loss: 0.7834, test_loss: 0.8930, test_f1: 0.5479
 epoch: 68, train_loss: 0.7677, test_loss: 0.8802, test_f1: 0.5365
 epoch: 69, train_loss: 0.7631, test_loss: 0.8972, test_f1: 0.5336
 epoch: 70, train_loss: 0.7702, test_loss: 0.8742, test_f1: 0.5411
 epoch: 71, train_loss: 0.7606, test_loss: 0.8814, test_f1: 0.5405
 epoch: 72, train_loss: 0.7631, test_loss: 0.8991, test_f1: 0.5272
 epoch: 73, train_loss: 0.7667, test_loss: 0.8817, test_f1: 0.5378
 epoch: 74, train_loss: 0.7586, test_loss: 0.8723, test_f1: 0.5392
 epoch: 75, train_loss: 0.7635, test_loss: 0.8772, test_f1: 0.5293
 epoch: 76, train_loss: 0.7568, test_loss: 0.9311, test_f1: 0.5120
 epoch: 77, train_loss: 0.7641, test_loss: 0.8639, test_f1: 0.5490
 epoch: 78, train_loss: 0.7585, test_loss: 0.8825, test_f1: 0.5336
 epoch: 79, train_loss: 0.7510, test_loss: 0.8775, test_f1: 0.5403
 epoch: 80, train_loss: 0.7577, test_loss: 0.8734, test_f1: 0.5630
 epoch: 81, train_loss: 0.7639, test_loss: 0.8655, test_f1: 0.5580
 epoch: 82, train_loss: 0.7660, test_loss: 0.9188, test_f1: 0.5119
 epoch: 83, train_loss: 0.7572, test_loss: 0.9120, test_f1: 0.5179
 epoch: 84, train_loss: 0.7587, test_loss: 0.8748, test_f1: 0.5595
 epoch: 85, train_loss: 0.7612, test_loss: 0.8920, test_f1: 0.5611
 epoch: 86, train_loss: 0.7518, test_loss: 0.8590, test_f1: 0.5473
 epoch: 87, train_loss: 0.7429, test_loss: 0.8823, test_f1: 0.5378
 epoch: 88, train_loss: 0.7524, test_loss: 0.8786, test_f1: 0.5350
 epoch: 89, train_loss: 0.7416, test_loss: 0.8953, test_f1: 0.5169
 epoch: 90, train_loss: 0.7429, test_loss: 0.8993, test_f1: 0.5300
 epoch: 91, train_loss: 0.7447, test_loss: 0.8915, test_f1: 0.5259
 epoch: 92, train_loss: 0.7526, test_loss: 0.8725, test_f1: 0.5463
 epoch: 93, train_loss: 0.7582, test_loss: 0.8640, test_f1: 0.5528
 epoch: 94, train_loss: 0.7508, test_loss: 0.8888, test_f1: 0.5424
 epoch: 95, train_loss: 0.7433, test_loss: 0.8648, test_f1: 0.5671
 epoch: 96, train_loss: 0.7449, test_loss: 0.8797, test_f1: 0.5373
 epoch: 97, train_loss: 0.7559, test_loss: 0.8575, test_f1: 0.5523
 epoch: 98, train_loss: 0.7422, test_loss: 0.8585, test_f1: 0.5479
 epoch: 99, train_loss: 0.7449, test_loss: 0.8578, test_f1: 0.5438

Training completed in 627.46 seconds
Best F1: 0.5844 at epoch 65
Mean F1 across iterations: 0.5668  0.0081
========================FINAL RESULTS================================
FEGIN weighted F1: 0.5844  0.0081
python main.py --data ltspice_examples --representation component_pin --model FEGIN --layers 3 --hiddens 16 --batch_size 64 --lr 0.001 --emb_size 250 --epochs 100 --save_appendix component_pin_L3_H16_BS64_LR0.001_E250 --no_val
-----



STDERR:
  File "main.py", line 370, in <module>
    main()
  File "main.py", line 254, in main
    dataset = dataset_class(
  File "/home/philip/projects/ltspice_examples_code_repo/Circuit-Completion-Using-GNNs/component_classification_with_link_prediction_head/evaluation/FEGIN/kernel/circuit_datasets.py", line 15, in __init__
    self.data, self.slices = torch.load(self.processed_paths[0])
  File "/home/philip/.local/lib/python3.8/site-packages/torch/serialization.py", line 1040, in load
    warnings.warn(
  File "/usr/lib/python3.8/warnings.py", line 109, in _showwarnmsg
    sw(msg.message, msg.category, msg.filename, msg.lineno,
  File "main.py", line 47, in warn_with_traceback
    traceback.print_stack(file=log)
/home/philip/projects/ltspice_examples_code_repo/Circuit-Completion-Using-GNNs/component_classification_with_link_prediction_head/evaluation/FEGIN/kernel/circuit_datasets.py:15: FutureWarning: You are using `torch.load` with `weights_only=False` (the current default value), which uses the default pickle module implicitly. It is possible to construct malicious pickle data which will execute arbitrary code during unpickling (See https://github.com/pytorch/pytorch/blob/main/SECURITY.md#untrusted-models for more details). In a future release, the default value for `weights_only` will be flipped to `True`. This limits the functions that could be executed during unpickling. Arbitrary objects will no longer be allowed to be loaded via this mode unless they are explicitly allowlisted by the user via `torch.serialization.add_safe_globals`. We recommend you start setting `weights_only=True` for any use case where you don't have full control of the loaded file. Please open an issue on GitHub for any issues related to this experimental feature.
  self.data, self.slices = torch.load(self.processed_paths[0])
