STDOUT:
Results will be saved in /home/philip/projects/ltspice_examples_code_repo/Circuit-Completion-Using-GNNs/component_classification_with_link_prediction_head/evaluation/FEGIN/results/model_FEGIN_dataset_ltspice_examples
Command line input: python main.py --data ltspice_examples --representation component_net --model FEGIN --layers 3 --hiddens 32 --batch_size 64 --lr 0.001 --emb_size 128 --epochs 100 --save_appendix component_net_L3_H32_BS64_LR0.001_E128 --no_val
 is saved.
-----
ltspice_examples - FEGIN
Using 3 layers, 32 hidden units, h = 2
Loading component_net representation dataset
ENTERED
Training FEGIN on component_net representation
Train: 3558, Test: 846
##################ITERATION #0 ****************************************
 epoch: 0, train_loss: 1.3112, test_loss: 1.2347, test_f1: 0.2381
 epoch: 1, train_loss: 1.1908, test_loss: 1.1236, test_f1: 0.3776
 epoch: 2, train_loss: 1.1167, test_loss: 1.0502, test_f1: 0.4574
 epoch: 3, train_loss: 1.0655, test_loss: 1.0564, test_f1: 0.4480
 epoch: 4, train_loss: 1.0064, test_loss: 1.0341, test_f1: 0.4458
 epoch: 5, train_loss: 0.9847, test_loss: 0.9450, test_f1: 0.4962
 epoch: 6, train_loss: 0.9624, test_loss: 1.0235, test_f1: 0.4576
 epoch: 7, train_loss: 0.9504, test_loss: 0.9382, test_f1: 0.5040
 epoch: 8, train_loss: 0.9303, test_loss: 0.9535, test_f1: 0.5147
 epoch: 9, train_loss: 0.9217, test_loss: 0.9512, test_f1: 0.5154
 epoch: 10, train_loss: 0.9206, test_loss: 0.9578, test_f1: 0.5164
 epoch: 11, train_loss: 0.9119, test_loss: 0.9289, test_f1: 0.5276
 epoch: 12, train_loss: 0.9008, test_loss: 0.9305, test_f1: 0.5179
 epoch: 13, train_loss: 0.8995, test_loss: 0.9582, test_f1: 0.5057
 epoch: 14, train_loss: 0.8820, test_loss: 0.9601, test_f1: 0.5176
 epoch: 15, train_loss: 0.8738, test_loss: 0.9779, test_f1: 0.4759
 epoch: 16, train_loss: 0.8634, test_loss: 0.9191, test_f1: 0.5109
 epoch: 17, train_loss: 0.8692, test_loss: 0.9319, test_f1: 0.5154
 epoch: 18, train_loss: 0.8554, test_loss: 0.9270, test_f1: 0.5231
 epoch: 19, train_loss: 0.8522, test_loss: 0.9863, test_f1: 0.4860
 epoch: 20, train_loss: 0.8437, test_loss: 0.9319, test_f1: 0.5520
 epoch: 21, train_loss: 0.8491, test_loss: 0.9823, test_f1: 0.5449
 epoch: 22, train_loss: 0.8255, test_loss: 0.9676, test_f1: 0.5731
 epoch: 23, train_loss: 0.8419, test_loss: 0.8898, test_f1: 0.5296
 epoch: 24, train_loss: 0.8180, test_loss: 0.9074, test_f1: 0.5452
 epoch: 25, train_loss: 0.8085, test_loss: 0.9921, test_f1: 0.5119
 epoch: 26, train_loss: 0.8162, test_loss: 0.9311, test_f1: 0.5711
 epoch: 27, train_loss: 0.8037, test_loss: 0.9330, test_f1: 0.5359
 epoch: 28, train_loss: 0.8166, test_loss: 0.9491, test_f1: 0.5392
 epoch: 29, train_loss: 0.7941, test_loss: 0.9040, test_f1: 0.5349
 epoch: 30, train_loss: 0.8006, test_loss: 1.0056, test_f1: 0.5267
 epoch: 31, train_loss: 0.7868, test_loss: 0.9605, test_f1: 0.5472
 epoch: 32, train_loss: 0.7877, test_loss: 0.9904, test_f1: 0.5616
 epoch: 33, train_loss: 0.7825, test_loss: 0.9662, test_f1: 0.5440
 epoch: 34, train_loss: 0.7997, test_loss: 0.9720, test_f1: 0.5176
 epoch: 35, train_loss: 0.7717, test_loss: 0.9205, test_f1: 0.5532
 epoch: 36, train_loss: 0.7691, test_loss: 0.9602, test_f1: 0.5243
 epoch: 37, train_loss: 0.7804, test_loss: 0.9434, test_f1: 0.5410
 epoch: 38, train_loss: 0.7684, test_loss: 0.9299, test_f1: 0.5475
 epoch: 39, train_loss: 0.7630, test_loss: 0.9492, test_f1: 0.5613
 epoch: 40, train_loss: 0.7502, test_loss: 0.9506, test_f1: 0.6013
 epoch: 41, train_loss: 0.7504, test_loss: 0.9494, test_f1: 0.5720
 epoch: 42, train_loss: 0.7492, test_loss: 0.9425, test_f1: 0.5448
 epoch: 43, train_loss: 0.7582, test_loss: 0.9670, test_f1: 0.5905
 epoch: 44, train_loss: 0.7561, test_loss: 0.9003, test_f1: 0.5623
 epoch: 45, train_loss: 0.7490, test_loss: 0.8946, test_f1: 0.5778
 epoch: 46, train_loss: 0.7456, test_loss: 0.8909, test_f1: 0.5853
 epoch: 47, train_loss: 0.7467, test_loss: 0.9939, test_f1: 0.5533
 epoch: 48, train_loss: 0.7270, test_loss: 0.9229, test_f1: 0.5800
 epoch: 49, train_loss: 0.7159, test_loss: 0.8913, test_f1: 0.5850
 epoch: 50, train_loss: 0.7166, test_loss: 0.9209, test_f1: 0.5774
 epoch: 51, train_loss: 0.7053, test_loss: 0.9142, test_f1: 0.5874
 epoch: 52, train_loss: 0.6880, test_loss: 0.9250, test_f1: 0.6014
 epoch: 53, train_loss: 0.6892, test_loss: 0.9634, test_f1: 0.5867
 epoch: 54, train_loss: 0.7019, test_loss: 0.9540, test_f1: 0.5768
 epoch: 55, train_loss: 0.6874, test_loss: 0.9557, test_f1: 0.5719
 epoch: 56, train_loss: 0.6939, test_loss: 0.9386, test_f1: 0.6075
 epoch: 57, train_loss: 0.6819, test_loss: 0.9176, test_f1: 0.5989
 epoch: 58, train_loss: 0.6816, test_loss: 0.9381, test_f1: 0.5915
 epoch: 59, train_loss: 0.6839, test_loss: 0.9729, test_f1: 0.5886
 epoch: 60, train_loss: 0.6782, test_loss: 0.9492, test_f1: 0.6149
 epoch: 61, train_loss: 0.6747, test_loss: 0.9480, test_f1: 0.5939
 epoch: 62, train_loss: 0.6713, test_loss: 0.9349, test_f1: 0.5842
 epoch: 63, train_loss: 0.6553, test_loss: 0.9308, test_f1: 0.6137
 epoch: 64, train_loss: 0.6898, test_loss: 0.9684, test_f1: 0.6063
 epoch: 65, train_loss: 0.6706, test_loss: 0.9096, test_f1: 0.6104
 epoch: 66, train_loss: 0.6716, test_loss: 0.9082, test_f1: 0.6082
 epoch: 67, train_loss: 0.6712, test_loss: 0.9450, test_f1: 0.5860
 epoch: 68, train_loss: 0.6731, test_loss: 0.8997, test_f1: 0.6299
 epoch: 69, train_loss: 0.6544, test_loss: 0.9764, test_f1: 0.6077
 epoch: 70, train_loss: 0.6631, test_loss: 0.9358, test_f1: 0.6053
 epoch: 71, train_loss: 0.6727, test_loss: 0.9446, test_f1: 0.6031
 epoch: 72, train_loss: 0.6505, test_loss: 0.9707, test_f1: 0.6154
 epoch: 73, train_loss: 0.6575, test_loss: 0.9460, test_f1: 0.6181
 epoch: 74, train_loss: 0.6622, test_loss: 0.9894, test_f1: 0.5976
 epoch: 75, train_loss: 0.6366, test_loss: 0.9414, test_f1: 0.6131
 epoch: 76, train_loss: 0.6401, test_loss: 0.9544, test_f1: 0.6022
 epoch: 77, train_loss: 0.6490, test_loss: 0.9597, test_f1: 0.6163
 epoch: 78, train_loss: 0.6436, test_loss: 0.9590, test_f1: 0.6107
 epoch: 79, train_loss: 0.6364, test_loss: 0.9363, test_f1: 0.6336
 epoch: 80, train_loss: 0.6414, test_loss: 1.0117, test_f1: 0.5990
 epoch: 81, train_loss: 0.6380, test_loss: 0.9516, test_f1: 0.6012
 epoch: 82, train_loss: 0.6442, test_loss: 0.9486, test_f1: 0.6088
 epoch: 83, train_loss: 0.6332, test_loss: 0.9993, test_f1: 0.5895
 epoch: 84, train_loss: 0.6423, test_loss: 0.9287, test_f1: 0.6377
 epoch: 85, train_loss: 0.6338, test_loss: 0.9668, test_f1: 0.6263
 epoch: 86, train_loss: 0.6404, test_loss: 0.9501, test_f1: 0.6061
 epoch: 87, train_loss: 0.6293, test_loss: 0.9657, test_f1: 0.6225
 epoch: 88, train_loss: 0.6284, test_loss: 0.9510, test_f1: 0.6143
 epoch: 89, train_loss: 0.6239, test_loss: 0.9907, test_f1: 0.6079
 epoch: 90, train_loss: 0.6256, test_loss: 0.9066, test_f1: 0.6345
 epoch: 91, train_loss: 0.6255, test_loss: 0.9691, test_f1: 0.6278
 epoch: 92, train_loss: 0.6114, test_loss: 0.9816, test_f1: 0.6262
 epoch: 93, train_loss: 0.6115, test_loss: 0.9887, test_f1: 0.6026
 epoch: 94, train_loss: 0.6177, test_loss: 0.9886, test_f1: 0.6215
 epoch: 95, train_loss: 0.6190, test_loss: 0.9830, test_f1: 0.6334
 epoch: 96, train_loss: 0.5977, test_loss: 1.0030, test_f1: 0.6213
 epoch: 97, train_loss: 0.6108, test_loss: 0.9631, test_f1: 0.6270
 epoch: 98, train_loss: 0.6046, test_loss: 1.0210, test_f1: 0.6179
 epoch: 99, train_loss: 0.5983, test_loss: 0.9675, test_f1: 0.6231
##################ITERATION #1 ****************************************
 epoch: 0, train_loss: 1.2149, test_loss: 1.1677, test_f1: 0.4069
 epoch: 1, train_loss: 1.0777, test_loss: 0.9983, test_f1: 0.4767
 epoch: 2, train_loss: 1.0235, test_loss: 0.9838, test_f1: 0.4583
 epoch: 3, train_loss: 0.9887, test_loss: 0.9830, test_f1: 0.4748
 epoch: 4, train_loss: 0.9742, test_loss: 0.9376, test_f1: 0.5019
 epoch: 5, train_loss: 0.9589, test_loss: 0.9199, test_f1: 0.5115
 epoch: 6, train_loss: 0.9460, test_loss: 0.9351, test_f1: 0.5027
 epoch: 7, train_loss: 0.9405, test_loss: 0.9543, test_f1: 0.4792
 epoch: 8, train_loss: 0.9324, test_loss: 0.9044, test_f1: 0.5045
 epoch: 9, train_loss: 0.9287, test_loss: 0.9283, test_f1: 0.5174
 epoch: 10, train_loss: 0.9112, test_loss: 0.9153, test_f1: 0.5042
 epoch: 11, train_loss: 0.9165, test_loss: 0.9296, test_f1: 0.4866
 epoch: 12, train_loss: 0.8996, test_loss: 0.9419, test_f1: 0.5138
 epoch: 13, train_loss: 0.8912, test_loss: 0.9139, test_f1: 0.5040
 epoch: 14, train_loss: 0.8827, test_loss: 0.9689, test_f1: 0.5120
 epoch: 15, train_loss: 0.8893, test_loss: 1.0075, test_f1: 0.4768
 epoch: 16, train_loss: 0.8807, test_loss: 0.9225, test_f1: 0.5419
 epoch: 17, train_loss: 0.8724, test_loss: 0.9227, test_f1: 0.5293
 epoch: 18, train_loss: 0.8657, test_loss: 0.9537, test_f1: 0.5380
 epoch: 19, train_loss: 0.8640, test_loss: 0.8770, test_f1: 0.5428
 epoch: 20, train_loss: 0.8618, test_loss: 0.9068, test_f1: 0.5422
 epoch: 21, train_loss: 0.8534, test_loss: 0.9352, test_f1: 0.5475
 epoch: 22, train_loss: 0.8474, test_loss: 0.9215, test_f1: 0.5628
 epoch: 23, train_loss: 0.8336, test_loss: 0.9526, test_f1: 0.5468
 epoch: 24, train_loss: 0.8414, test_loss: 0.9235, test_f1: 0.5910
 epoch: 25, train_loss: 0.8402, test_loss: 0.9832, test_f1: 0.5309
 epoch: 26, train_loss: 0.8273, test_loss: 0.9568, test_f1: 0.5837
 epoch: 27, train_loss: 0.8236, test_loss: 0.9250, test_f1: 0.5721
 epoch: 28, train_loss: 0.8225, test_loss: 0.9530, test_f1: 0.5518
 epoch: 29, train_loss: 0.8139, test_loss: 0.8369, test_f1: 0.5796
 epoch: 30, train_loss: 0.8280, test_loss: 0.9334, test_f1: 0.5668
 epoch: 31, train_loss: 0.8241, test_loss: 0.9328, test_f1: 0.5927
 epoch: 32, train_loss: 0.7949, test_loss: 0.9591, test_f1: 0.5494
 epoch: 33, train_loss: 0.8036, test_loss: 0.9737, test_f1: 0.5396
 epoch: 34, train_loss: 0.7962, test_loss: 0.9175, test_f1: 0.5873
 epoch: 35, train_loss: 0.7915, test_loss: 0.9048, test_f1: 0.5635
 epoch: 36, train_loss: 0.7983, test_loss: 0.9600, test_f1: 0.5882
 epoch: 37, train_loss: 0.7877, test_loss: 0.9149, test_f1: 0.5874
 epoch: 38, train_loss: 0.7858, test_loss: 0.9111, test_f1: 0.5617
 epoch: 39, train_loss: 0.7788, test_loss: 0.9669, test_f1: 0.5734
 epoch: 40, train_loss: 0.7739, test_loss: 1.0022, test_f1: 0.5548
 epoch: 41, train_loss: 0.7666, test_loss: 0.9453, test_f1: 0.5973
 epoch: 42, train_loss: 0.7833, test_loss: 0.9152, test_f1: 0.5902
 epoch: 43, train_loss: 0.7737, test_loss: 0.9645, test_f1: 0.5890
 epoch: 44, train_loss: 0.7629, test_loss: 0.9553, test_f1: 0.5870
 epoch: 45, train_loss: 0.7568, test_loss: 0.9414, test_f1: 0.6141
 epoch: 46, train_loss: 0.7675, test_loss: 0.9526, test_f1: 0.5702
 epoch: 47, train_loss: 0.7535, test_loss: 0.9991, test_f1: 0.5837
 epoch: 48, train_loss: 0.7573, test_loss: 0.9750, test_f1: 0.5804
 epoch: 49, train_loss: 0.7472, test_loss: 0.9369, test_f1: 0.5975
 epoch: 50, train_loss: 0.7415, test_loss: 0.9507, test_f1: 0.5762
 epoch: 51, train_loss: 0.7214, test_loss: 0.9630, test_f1: 0.5929
 epoch: 52, train_loss: 0.7243, test_loss: 0.9604, test_f1: 0.6163
 epoch: 53, train_loss: 0.7251, test_loss: 0.9484, test_f1: 0.5846
 epoch: 54, train_loss: 0.7215, test_loss: 0.9193, test_f1: 0.5989
 epoch: 55, train_loss: 0.7125, test_loss: 0.9184, test_f1: 0.6170
 epoch: 56, train_loss: 0.7075, test_loss: 0.9375, test_f1: 0.6210
 epoch: 57, train_loss: 0.7124, test_loss: 0.9138, test_f1: 0.6200
 epoch: 58, train_loss: 0.6953, test_loss: 0.9048, test_f1: 0.6329
 epoch: 59, train_loss: 0.7022, test_loss: 0.9136, test_f1: 0.6480
 epoch: 60, train_loss: 0.7025, test_loss: 0.9183, test_f1: 0.6146
 epoch: 61, train_loss: 0.7032, test_loss: 0.9075, test_f1: 0.6264
 epoch: 62, train_loss: 0.7018, test_loss: 0.9554, test_f1: 0.6272
 epoch: 63, train_loss: 0.6886, test_loss: 0.9322, test_f1: 0.6176
 epoch: 64, train_loss: 0.7042, test_loss: 0.9233, test_f1: 0.6346
 epoch: 65, train_loss: 0.7048, test_loss: 0.9410, test_f1: 0.6094
 epoch: 66, train_loss: 0.6982, test_loss: 0.9613, test_f1: 0.6226
 epoch: 67, train_loss: 0.6915, test_loss: 0.9169, test_f1: 0.6431
 epoch: 68, train_loss: 0.6901, test_loss: 0.9303, test_f1: 0.6470
 epoch: 69, train_loss: 0.6867, test_loss: 0.9375, test_f1: 0.6273
 epoch: 70, train_loss: 0.6769, test_loss: 0.9397, test_f1: 0.6372
 epoch: 71, train_loss: 0.6857, test_loss: 0.9126, test_f1: 0.6582
 epoch: 72, train_loss: 0.6804, test_loss: 0.9311, test_f1: 0.6189
 epoch: 73, train_loss: 0.6730, test_loss: 0.9419, test_f1: 0.6169
 epoch: 74, train_loss: 0.6750, test_loss: 0.9192, test_f1: 0.6350
 epoch: 75, train_loss: 0.6731, test_loss: 0.9025, test_f1: 0.6486
 epoch: 76, train_loss: 0.6711, test_loss: 0.8968, test_f1: 0.6471
 epoch: 77, train_loss: 0.6529, test_loss: 0.9089, test_f1: 0.6519
 epoch: 78, train_loss: 0.6694, test_loss: 0.9048, test_f1: 0.6537
 epoch: 79, train_loss: 0.6583, test_loss: 0.9235, test_f1: 0.6071
 epoch: 80, train_loss: 0.6649, test_loss: 0.9015, test_f1: 0.6584
 epoch: 81, train_loss: 0.6616, test_loss: 0.9329, test_f1: 0.6312
 epoch: 82, train_loss: 0.6619, test_loss: 0.9086, test_f1: 0.6652
 epoch: 83, train_loss: 0.6591, test_loss: 0.9221, test_f1: 0.6411
 epoch: 84, train_loss: 0.6635, test_loss: 0.9252, test_f1: 0.6449
 epoch: 85, train_loss: 0.6421, test_loss: 0.9505, test_f1: 0.6500
 epoch: 86, train_loss: 0.6552, test_loss: 0.9811, test_f1: 0.6131
 epoch: 87, train_loss: 0.6619, test_loss: 0.9365, test_f1: 0.6354
 epoch: 88, train_loss: 0.6696, test_loss: 0.9080, test_f1: 0.6648
 epoch: 89, train_loss: 0.6549, test_loss: 0.9045, test_f1: 0.6468
 epoch: 90, train_loss: 0.6488, test_loss: 0.9079, test_f1: 0.6444
 epoch: 91, train_loss: 0.6589, test_loss: 0.9044, test_f1: 0.6662
 epoch: 92, train_loss: 0.6471, test_loss: 0.9284, test_f1: 0.6654
 epoch: 93, train_loss: 0.6346, test_loss: 0.9192, test_f1: 0.6568
 epoch: 94, train_loss: 0.6527, test_loss: 0.9046, test_f1: 0.6602
 epoch: 95, train_loss: 0.6429, test_loss: 0.8917, test_f1: 0.6500
 epoch: 96, train_loss: 0.6363, test_loss: 0.9186, test_f1: 0.6522
 epoch: 97, train_loss: 0.6404, test_loss: 0.9202, test_f1: 0.6292
 epoch: 98, train_loss: 0.6390, test_loss: 0.9297, test_f1: 0.6513
 epoch: 99, train_loss: 0.6285, test_loss: 0.9119, test_f1: 0.6514
##################ITERATION #2 ****************************************
 epoch: 0, train_loss: 1.1754, test_loss: 1.1094, test_f1: 0.4251
 epoch: 1, train_loss: 1.0309, test_loss: 1.0072, test_f1: 0.4531
 epoch: 2, train_loss: 1.0008, test_loss: 0.9659, test_f1: 0.4914
 epoch: 3, train_loss: 0.9695, test_loss: 0.9724, test_f1: 0.4916
 epoch: 4, train_loss: 0.9463, test_loss: 0.9541, test_f1: 0.5338
 epoch: 5, train_loss: 0.9255, test_loss: 0.9650, test_f1: 0.5126
 epoch: 6, train_loss: 0.9311, test_loss: 0.9294, test_f1: 0.5284
 epoch: 7, train_loss: 0.9090, test_loss: 0.9167, test_f1: 0.5613
 epoch: 8, train_loss: 0.9078, test_loss: 0.9147, test_f1: 0.5498
 epoch: 9, train_loss: 0.8870, test_loss: 0.9428, test_f1: 0.5195
 epoch: 10, train_loss: 0.8845, test_loss: 0.9151, test_f1: 0.5548
 epoch: 11, train_loss: 0.8719, test_loss: 0.9167, test_f1: 0.5828
 epoch: 12, train_loss: 0.8661, test_loss: 0.9250, test_f1: 0.5514
 epoch: 13, train_loss: 0.8495, test_loss: 0.9465, test_f1: 0.5311
 epoch: 14, train_loss: 0.8412, test_loss: 0.8971, test_f1: 0.5784
 epoch: 15, train_loss: 0.8423, test_loss: 0.9310, test_f1: 0.5767
 epoch: 16, train_loss: 0.8412, test_loss: 0.8975, test_f1: 0.5708
 epoch: 17, train_loss: 0.8259, test_loss: 0.9110, test_f1: 0.5915
 epoch: 18, train_loss: 0.8310, test_loss: 0.8928, test_f1: 0.5786
 epoch: 19, train_loss: 0.8301, test_loss: 0.9079, test_f1: 0.5816
 epoch: 20, train_loss: 0.8273, test_loss: 0.9173, test_f1: 0.6043
 epoch: 21, train_loss: 0.8112, test_loss: 0.8938, test_f1: 0.6038
 epoch: 22, train_loss: 0.7998, test_loss: 0.8805, test_f1: 0.6030
 epoch: 23, train_loss: 0.8078, test_loss: 0.9035, test_f1: 0.5934
 epoch: 24, train_loss: 0.8042, test_loss: 0.8972, test_f1: 0.5906
 epoch: 25, train_loss: 0.7878, test_loss: 0.9082, test_f1: 0.5838
 epoch: 26, train_loss: 0.7875, test_loss: 0.9047, test_f1: 0.6111
 epoch: 27, train_loss: 0.7832, test_loss: 0.8963, test_f1: 0.5837
 epoch: 28, train_loss: 0.7697, test_loss: 0.9037, test_f1: 0.6131
 epoch: 29, train_loss: 0.7700, test_loss: 0.9010, test_f1: 0.5943
 epoch: 30, train_loss: 0.7738, test_loss: 0.8789, test_f1: 0.5924
 epoch: 31, train_loss: 0.7599, test_loss: 0.9063, test_f1: 0.6097
 epoch: 32, train_loss: 0.7586, test_loss: 0.9036, test_f1: 0.6227
 epoch: 33, train_loss: 0.7609, test_loss: 0.9325, test_f1: 0.6091
 epoch: 34, train_loss: 0.7412, test_loss: 0.8792, test_f1: 0.6086
 epoch: 35, train_loss: 0.7444, test_loss: 0.9020, test_f1: 0.6075
 epoch: 36, train_loss: 0.7369, test_loss: 0.9120, test_f1: 0.6284
 epoch: 37, train_loss: 0.7341, test_loss: 0.9501, test_f1: 0.6044
 epoch: 38, train_loss: 0.7347, test_loss: 0.9574, test_f1: 0.5780
 epoch: 39, train_loss: 0.7358, test_loss: 0.9117, test_f1: 0.6132
 epoch: 40, train_loss: 0.7393, test_loss: 0.9207, test_f1: 0.5878
 epoch: 41, train_loss: 0.7219, test_loss: 0.9012, test_f1: 0.6237
 epoch: 42, train_loss: 0.7185, test_loss: 0.9309, test_f1: 0.6364
 epoch: 43, train_loss: 0.7192, test_loss: 0.9134, test_f1: 0.6169
 epoch: 44, train_loss: 0.7153, test_loss: 0.9285, test_f1: 0.6554
 epoch: 45, train_loss: 0.7282, test_loss: 0.9471, test_f1: 0.6276
 epoch: 46, train_loss: 0.7175, test_loss: 0.9003, test_f1: 0.5954
 epoch: 47, train_loss: 0.7056, test_loss: 0.9065, test_f1: 0.6308
 epoch: 48, train_loss: 0.7022, test_loss: 0.9242, test_f1: 0.6366
 epoch: 49, train_loss: 0.7034, test_loss: 0.9178, test_f1: 0.6083
 epoch: 50, train_loss: 0.6842, test_loss: 0.9584, test_f1: 0.6171
 epoch: 51, train_loss: 0.6803, test_loss: 0.9170, test_f1: 0.6494
 epoch: 52, train_loss: 0.6693, test_loss: 0.9121, test_f1: 0.6209
 epoch: 53, train_loss: 0.6702, test_loss: 0.9239, test_f1: 0.6406
 epoch: 54, train_loss: 0.6723, test_loss: 0.9332, test_f1: 0.6382
 epoch: 55, train_loss: 0.6540, test_loss: 0.9502, test_f1: 0.6177
 epoch: 56, train_loss: 0.6514, test_loss: 0.9194, test_f1: 0.6359
 epoch: 57, train_loss: 0.6587, test_loss: 0.9151, test_f1: 0.6389
 epoch: 58, train_loss: 0.6442, test_loss: 0.9471, test_f1: 0.6030
 epoch: 59, train_loss: 0.6492, test_loss: 0.9579, test_f1: 0.6174
 epoch: 60, train_loss: 0.6399, test_loss: 0.9246, test_f1: 0.6457
 epoch: 61, train_loss: 0.6475, test_loss: 0.9350, test_f1: 0.6403
 epoch: 62, train_loss: 0.6560, test_loss: 0.9390, test_f1: 0.6269
 epoch: 63, train_loss: 0.6408, test_loss: 0.9495, test_f1: 0.6440
 epoch: 64, train_loss: 0.6367, test_loss: 0.9468, test_f1: 0.6587
 epoch: 65, train_loss: 0.6308, test_loss: 0.9568, test_f1: 0.6237
 epoch: 66, train_loss: 0.6288, test_loss: 0.9655, test_f1: 0.6610
 epoch: 67, train_loss: 0.6348, test_loss: 0.9449, test_f1: 0.6569
 epoch: 68, train_loss: 0.6146, test_loss: 0.9365, test_f1: 0.6537
 epoch: 69, train_loss: 0.6485, test_loss: 0.9247, test_f1: 0.6675
 epoch: 70, train_loss: 0.6441, test_loss: 0.9404, test_f1: 0.6612
 epoch: 71, train_loss: 0.6346, test_loss: 0.9498, test_f1: 0.6420
 epoch: 72, train_loss: 0.6123, test_loss: 0.9377, test_f1: 0.6306
 epoch: 73, train_loss: 0.6160, test_loss: 0.9412, test_f1: 0.6816
 epoch: 74, train_loss: 0.6169, test_loss: 0.9726, test_f1: 0.6463
 epoch: 75, train_loss: 0.6177, test_loss: 0.9649, test_f1: 0.6011
 epoch: 76, train_loss: 0.6243, test_loss: 0.9322, test_f1: 0.6575
 epoch: 77, train_loss: 0.6142, test_loss: 0.9416, test_f1: 0.6426
 epoch: 78, train_loss: 0.6101, test_loss: 0.9423, test_f1: 0.6364
 epoch: 79, train_loss: 0.6153, test_loss: 0.9591, test_f1: 0.6293
 epoch: 80, train_loss: 0.6231, test_loss: 0.9604, test_f1: 0.6440
 epoch: 81, train_loss: 0.5998, test_loss: 0.9692, test_f1: 0.6474
 epoch: 82, train_loss: 0.6104, test_loss: 0.9487, test_f1: 0.6522
 epoch: 83, train_loss: 0.6140, test_loss: 0.9458, test_f1: 0.6764
 epoch: 84, train_loss: 0.5991, test_loss: 0.9351, test_f1: 0.6767
 epoch: 85, train_loss: 0.6109, test_loss: 0.9626, test_f1: 0.6548
 epoch: 86, train_loss: 0.6025, test_loss: 1.0006, test_f1: 0.6390
 epoch: 87, train_loss: 0.6067, test_loss: 0.9582, test_f1: 0.6600
 epoch: 88, train_loss: 0.6016, test_loss: 0.9495, test_f1: 0.6822
 epoch: 89, train_loss: 0.6048, test_loss: 0.9690, test_f1: 0.6446
 epoch: 90, train_loss: 0.6051, test_loss: 0.9575, test_f1: 0.6700
 epoch: 91, train_loss: 0.5834, test_loss: 0.9606, test_f1: 0.6637
 epoch: 92, train_loss: 0.5913, test_loss: 0.9936, test_f1: 0.6489
 epoch: 93, train_loss: 0.6134, test_loss: 0.9661, test_f1: 0.6703
 epoch: 94, train_loss: 0.5806, test_loss: 0.9951, test_f1: 0.6493
 epoch: 95, train_loss: 0.5878, test_loss: 0.9812, test_f1: 0.6478
 epoch: 96, train_loss: 0.5884, test_loss: 0.9543, test_f1: 0.6760
 epoch: 97, train_loss: 0.5929, test_loss: 0.9685, test_f1: 0.6463
 epoch: 98, train_loss: 0.5798, test_loss: 1.0004, test_f1: 0.6630
 epoch: 99, train_loss: 0.5848, test_loss: 0.9668, test_f1: 0.6690
##################ITERATION #3 ****************************************
 epoch: 0, train_loss: 1.2391, test_loss: 1.0792, test_f1: 0.4746
 epoch: 1, train_loss: 1.0922, test_loss: 0.9880, test_f1: 0.4587
 epoch: 2, train_loss: 1.0545, test_loss: 0.9690, test_f1: 0.4677
 epoch: 3, train_loss: 1.0032, test_loss: 0.9318, test_f1: 0.4800
 epoch: 4, train_loss: 0.9796, test_loss: 0.9352, test_f1: 0.4710
 epoch: 5, train_loss: 0.9684, test_loss: 0.9115, test_f1: 0.5444
 epoch: 6, train_loss: 0.9506, test_loss: 0.9131, test_f1: 0.5056
 epoch: 7, train_loss: 0.9415, test_loss: 0.9249, test_f1: 0.5236
 epoch: 8, train_loss: 0.9308, test_loss: 0.9323, test_f1: 0.5087
 epoch: 9, train_loss: 0.9186, test_loss: 0.9387, test_f1: 0.5148
 epoch: 10, train_loss: 0.9088, test_loss: 0.9602, test_f1: 0.5382
 epoch: 11, train_loss: 0.9027, test_loss: 0.9192, test_f1: 0.5188
 epoch: 12, train_loss: 0.8909, test_loss: 0.8872, test_f1: 0.5460
 epoch: 13, train_loss: 0.9018, test_loss: 0.9172, test_f1: 0.5235
 epoch: 14, train_loss: 0.8916, test_loss: 0.9401, test_f1: 0.4968
 epoch: 15, train_loss: 0.8680, test_loss: 0.9202, test_f1: 0.5419
 epoch: 16, train_loss: 0.8619, test_loss: 0.8925, test_f1: 0.5297
 epoch: 17, train_loss: 0.8620, test_loss: 0.9386, test_f1: 0.5184
 epoch: 18, train_loss: 0.8578, test_loss: 0.9155, test_f1: 0.5431
 epoch: 19, train_loss: 0.8499, test_loss: 0.9080, test_f1: 0.5342
 epoch: 20, train_loss: 0.8479, test_loss: 0.9206, test_f1: 0.5591
 epoch: 21, train_loss: 0.8373, test_loss: 0.9157, test_f1: 0.5302
 epoch: 22, train_loss: 0.8307, test_loss: 0.9456, test_f1: 0.5297
 epoch: 23, train_loss: 0.8307, test_loss: 0.9476, test_f1: 0.5400
 epoch: 24, train_loss: 0.8317, test_loss: 0.9276, test_f1: 0.5401
 epoch: 25, train_loss: 0.8221, test_loss: 0.9056, test_f1: 0.5447
 epoch: 26, train_loss: 0.8168, test_loss: 0.9347, test_f1: 0.5726
 epoch: 27, train_loss: 0.8230, test_loss: 0.9530, test_f1: 0.5462
 epoch: 28, train_loss: 0.8064, test_loss: 0.9250, test_f1: 0.5483
 epoch: 29, train_loss: 0.8092, test_loss: 0.9780, test_f1: 0.5417
 epoch: 30, train_loss: 0.8017, test_loss: 0.8983, test_f1: 0.5639
 epoch: 31, train_loss: 0.8019, test_loss: 0.8806, test_f1: 0.5811
 epoch: 32, train_loss: 0.7932, test_loss: 0.9372, test_f1: 0.5800
 epoch: 33, train_loss: 0.7897, test_loss: 0.8726, test_f1: 0.6041
 epoch: 34, train_loss: 0.7860, test_loss: 0.9106, test_f1: 0.5650
 epoch: 35, train_loss: 0.7888, test_loss: 0.8813, test_f1: 0.5716
 epoch: 36, train_loss: 0.7802, test_loss: 0.9773, test_f1: 0.5429
 epoch: 37, train_loss: 0.7803, test_loss: 0.9183, test_f1: 0.5585
 epoch: 38, train_loss: 0.7740, test_loss: 0.9566, test_f1: 0.5588
 epoch: 39, train_loss: 0.7672, test_loss: 0.8941, test_f1: 0.6023
 epoch: 40, train_loss: 0.7564, test_loss: 0.9131, test_f1: 0.5858
 epoch: 41, train_loss: 0.7571, test_loss: 0.8979, test_f1: 0.5842
 epoch: 42, train_loss: 0.7617, test_loss: 0.8923, test_f1: 0.6065
 epoch: 43, train_loss: 0.7624, test_loss: 0.9529, test_f1: 0.5842
 epoch: 44, train_loss: 0.7497, test_loss: 0.8845, test_f1: 0.5879
 epoch: 45, train_loss: 0.7327, test_loss: 0.8842, test_f1: 0.5759
 epoch: 46, train_loss: 0.7342, test_loss: 0.9415, test_f1: 0.5659
 epoch: 47, train_loss: 0.7415, test_loss: 0.9265, test_f1: 0.6027
 epoch: 48, train_loss: 0.7385, test_loss: 0.9020, test_f1: 0.5864
 epoch: 49, train_loss: 0.7298, test_loss: 0.9619, test_f1: 0.5591
 epoch: 50, train_loss: 0.7331, test_loss: 0.8644, test_f1: 0.6138
 epoch: 51, train_loss: 0.7202, test_loss: 0.9005, test_f1: 0.5975
 epoch: 52, train_loss: 0.7003, test_loss: 0.9198, test_f1: 0.6168
 epoch: 53, train_loss: 0.7024, test_loss: 0.9094, test_f1: 0.5945
 epoch: 54, train_loss: 0.6932, test_loss: 0.9044, test_f1: 0.6151
 epoch: 55, train_loss: 0.6916, test_loss: 0.9260, test_f1: 0.6012
 epoch: 56, train_loss: 0.6903, test_loss: 0.8927, test_f1: 0.6187
 epoch: 57, train_loss: 0.6849, test_loss: 0.8733, test_f1: 0.6319
 epoch: 58, train_loss: 0.6836, test_loss: 0.8903, test_f1: 0.6250
 epoch: 59, train_loss: 0.6928, test_loss: 0.8941, test_f1: 0.5983
 epoch: 60, train_loss: 0.6875, test_loss: 0.9099, test_f1: 0.6316
 epoch: 61, train_loss: 0.6770, test_loss: 0.8964, test_f1: 0.6238
 epoch: 62, train_loss: 0.6640, test_loss: 0.8840, test_f1: 0.6195
 epoch: 63, train_loss: 0.6666, test_loss: 0.9052, test_f1: 0.6248
 epoch: 64, train_loss: 0.6828, test_loss: 0.9013, test_f1: 0.6245
 epoch: 65, train_loss: 0.6566, test_loss: 0.9008, test_f1: 0.5955
 epoch: 66, train_loss: 0.6562, test_loss: 0.9085, test_f1: 0.6204
 epoch: 67, train_loss: 0.6730, test_loss: 0.9264, test_f1: 0.6184
 epoch: 68, train_loss: 0.6681, test_loss: 0.9353, test_f1: 0.6270
 epoch: 69, train_loss: 0.6690, test_loss: 0.9179, test_f1: 0.6206
 epoch: 70, train_loss: 0.6595, test_loss: 0.8982, test_f1: 0.6233
 epoch: 71, train_loss: 0.6466, test_loss: 0.9113, test_f1: 0.6084
 epoch: 72, train_loss: 0.6594, test_loss: 0.8993, test_f1: 0.6255
 epoch: 73, train_loss: 0.6476, test_loss: 0.9029, test_f1: 0.6392
 epoch: 74, train_loss: 0.6461, test_loss: 0.9084, test_f1: 0.6375
 epoch: 75, train_loss: 0.6298, test_loss: 0.8950, test_f1: 0.6288
 epoch: 76, train_loss: 0.6359, test_loss: 0.9211, test_f1: 0.6200
 epoch: 77, train_loss: 0.6504, test_loss: 0.9001, test_f1: 0.6276
 epoch: 78, train_loss: 0.6387, test_loss: 0.9192, test_f1: 0.6547
 epoch: 79, train_loss: 0.6181, test_loss: 0.9262, test_f1: 0.6436
 epoch: 80, train_loss: 0.6291, test_loss: 0.9465, test_f1: 0.6382
 epoch: 81, train_loss: 0.6359, test_loss: 0.9563, test_f1: 0.6505
 epoch: 82, train_loss: 0.6238, test_loss: 0.9147, test_f1: 0.6414
 epoch: 83, train_loss: 0.6195, test_loss: 0.9615, test_f1: 0.6439
 epoch: 84, train_loss: 0.6331, test_loss: 0.9460, test_f1: 0.6349
 epoch: 85, train_loss: 0.6360, test_loss: 0.9800, test_f1: 0.6064
 epoch: 86, train_loss: 0.6236, test_loss: 0.9344, test_f1: 0.6231
 epoch: 87, train_loss: 0.6160, test_loss: 0.9494, test_f1: 0.6321
 epoch: 88, train_loss: 0.6223, test_loss: 0.9388, test_f1: 0.6337
 epoch: 89, train_loss: 0.6151, test_loss: 0.9141, test_f1: 0.6596
 epoch: 90, train_loss: 0.6022, test_loss: 0.9575, test_f1: 0.6399
 epoch: 91, train_loss: 0.6043, test_loss: 0.9641, test_f1: 0.6428
 epoch: 92, train_loss: 0.6015, test_loss: 0.9492, test_f1: 0.6233
 epoch: 93, train_loss: 0.6108, test_loss: 0.9291, test_f1: 0.6571
 epoch: 94, train_loss: 0.6104, test_loss: 0.9256, test_f1: 0.6347
 epoch: 95, train_loss: 0.5995, test_loss: 0.9395, test_f1: 0.6567
 epoch: 96, train_loss: 0.6072, test_loss: 0.9351, test_f1: 0.6343
 epoch: 97, train_loss: 0.5902, test_loss: 0.9213, test_f1: 0.6577
 epoch: 98, train_loss: 0.5829, test_loss: 0.9097, test_f1: 0.6536
 epoch: 99, train_loss: 0.6037, test_loss: 0.9647, test_f1: 0.6351
##################ITERATION #4 ****************************************
 epoch: 0, train_loss: 1.2594, test_loss: 1.1173, test_f1: 0.4487
 epoch: 1, train_loss: 1.1013, test_loss: 0.9852, test_f1: 0.5166
 epoch: 2, train_loss: 1.0474, test_loss: 0.9543, test_f1: 0.4992
 epoch: 3, train_loss: 1.0091, test_loss: 0.9502, test_f1: 0.5148
 epoch: 4, train_loss: 0.9811, test_loss: 0.9544, test_f1: 0.4979
 epoch: 5, train_loss: 0.9707, test_loss: 0.9527, test_f1: 0.5178
 epoch: 6, train_loss: 0.9591, test_loss: 0.9482, test_f1: 0.5167
 epoch: 7, train_loss: 0.9454, test_loss: 0.9641, test_f1: 0.5227
 epoch: 8, train_loss: 0.9211, test_loss: 0.9373, test_f1: 0.5247
 epoch: 9, train_loss: 0.9013, test_loss: 0.9422, test_f1: 0.5091
 epoch: 10, train_loss: 0.8956, test_loss: 1.0251, test_f1: 0.4950
 epoch: 11, train_loss: 0.8956, test_loss: 0.9068, test_f1: 0.5480
 epoch: 12, train_loss: 0.8847, test_loss: 0.9430, test_f1: 0.5056
 epoch: 13, train_loss: 0.8706, test_loss: 0.9568, test_f1: 0.5326
 epoch: 14, train_loss: 0.8831, test_loss: 0.9315, test_f1: 0.5226
 epoch: 15, train_loss: 0.8480, test_loss: 0.9187, test_f1: 0.5285
 epoch: 16, train_loss: 0.8539, test_loss: 0.8970, test_f1: 0.5438
 epoch: 17, train_loss: 0.8439, test_loss: 0.9398, test_f1: 0.5272
 epoch: 18, train_loss: 0.8239, test_loss: 0.9018, test_f1: 0.5489
 epoch: 19, train_loss: 0.8230, test_loss: 0.9338, test_f1: 0.5686
 epoch: 20, train_loss: 0.8303, test_loss: 0.9112, test_f1: 0.5192
 epoch: 21, train_loss: 0.8275, test_loss: 0.9186, test_f1: 0.5307
 epoch: 22, train_loss: 0.8131, test_loss: 0.9270, test_f1: 0.5584
 epoch: 23, train_loss: 0.8216, test_loss: 0.9683, test_f1: 0.5454
 epoch: 24, train_loss: 0.8033, test_loss: 0.9112, test_f1: 0.5490
 epoch: 25, train_loss: 0.8014, test_loss: 0.9464, test_f1: 0.5549
 epoch: 26, train_loss: 0.8019, test_loss: 0.9673, test_f1: 0.5586
 epoch: 27, train_loss: 0.7880, test_loss: 0.9210, test_f1: 0.5548
 epoch: 28, train_loss: 0.7925, test_loss: 0.9535, test_f1: 0.5853
 epoch: 29, train_loss: 0.7947, test_loss: 0.9648, test_f1: 0.5590
 epoch: 30, train_loss: 0.7831, test_loss: 0.9129, test_f1: 0.5810
 epoch: 31, train_loss: 0.7682, test_loss: 0.9137, test_f1: 0.6022
 epoch: 32, train_loss: 0.7681, test_loss: 0.9060, test_f1: 0.5779
 epoch: 33, train_loss: 0.7717, test_loss: 0.8840, test_f1: 0.6019
 epoch: 34, train_loss: 0.7634, test_loss: 0.9161, test_f1: 0.5852
 epoch: 35, train_loss: 0.7529, test_loss: 1.0109, test_f1: 0.5225
 epoch: 36, train_loss: 0.7598, test_loss: 0.9579, test_f1: 0.5808
 epoch: 37, train_loss: 0.7579, test_loss: 0.9213, test_f1: 0.5767
 epoch: 38, train_loss: 0.7479, test_loss: 0.9610, test_f1: 0.5893
 epoch: 39, train_loss: 0.7349, test_loss: 0.9546, test_f1: 0.5724
 epoch: 40, train_loss: 0.7430, test_loss: 0.9032, test_f1: 0.5748
 epoch: 41, train_loss: 0.7450, test_loss: 0.9734, test_f1: 0.5805
 epoch: 42, train_loss: 0.7407, test_loss: 0.9227, test_f1: 0.6043
 epoch: 43, train_loss: 0.7380, test_loss: 0.9836, test_f1: 0.5522
 epoch: 44, train_loss: 0.7379, test_loss: 1.0004, test_f1: 0.6161
 epoch: 45, train_loss: 0.7275, test_loss: 0.9441, test_f1: 0.5873
 epoch: 46, train_loss: 0.7256, test_loss: 1.0804, test_f1: 0.5630
 epoch: 47, train_loss: 0.7208, test_loss: 0.9443, test_f1: 0.6137
 epoch: 48, train_loss: 0.7149, test_loss: 0.9925, test_f1: 0.6155
 epoch: 49, train_loss: 0.7056, test_loss: 0.9378, test_f1: 0.5924
 epoch: 50, train_loss: 0.7067, test_loss: 1.0323, test_f1: 0.5658
 epoch: 51, train_loss: 0.6923, test_loss: 0.9191, test_f1: 0.6431
 epoch: 52, train_loss: 0.6866, test_loss: 0.9219, test_f1: 0.6202
 epoch: 53, train_loss: 0.6691, test_loss: 0.9656, test_f1: 0.5938
 epoch: 54, train_loss: 0.6652, test_loss: 0.9213, test_f1: 0.6183
 epoch: 55, train_loss: 0.6539, test_loss: 0.9583, test_f1: 0.6166
 epoch: 56, train_loss: 0.6509, test_loss: 0.9619, test_f1: 0.6368
 epoch: 57, train_loss: 0.6587, test_loss: 0.9685, test_f1: 0.6040
 epoch: 58, train_loss: 0.6579, test_loss: 0.9470, test_f1: 0.6125
 epoch: 59, train_loss: 0.6671, test_loss: 0.9613, test_f1: 0.6061
 epoch: 60, train_loss: 0.6524, test_loss: 0.9221, test_f1: 0.6328
 epoch: 61, train_loss: 0.6516, test_loss: 0.9781, test_f1: 0.6145
 epoch: 62, train_loss: 0.6510, test_loss: 1.0051, test_f1: 0.6207
 epoch: 63, train_loss: 0.6682, test_loss: 0.9303, test_f1: 0.6280
 epoch: 64, train_loss: 0.6564, test_loss: 0.9848, test_f1: 0.6307
 epoch: 65, train_loss: 0.6498, test_loss: 0.9521, test_f1: 0.6193
 epoch: 66, train_loss: 0.6536, test_loss: 0.9444, test_f1: 0.6351
 epoch: 67, train_loss: 0.6417, test_loss: 0.9998, test_f1: 0.6172
 epoch: 68, train_loss: 0.6352, test_loss: 0.9881, test_f1: 0.6271
 epoch: 69, train_loss: 0.6343, test_loss: 0.9767, test_f1: 0.6486
 epoch: 70, train_loss: 0.6388, test_loss: 0.9893, test_f1: 0.6310
 epoch: 71, train_loss: 0.6341, test_loss: 1.1445, test_f1: 0.6232
 epoch: 72, train_loss: 0.6326, test_loss: 0.9854, test_f1: 0.6260
 epoch: 73, train_loss: 0.6369, test_loss: 0.9589, test_f1: 0.6249
 epoch: 74, train_loss: 0.6282, test_loss: 0.9522, test_f1: 0.6428
 epoch: 75, train_loss: 0.6379, test_loss: 1.0285, test_f1: 0.6268
 epoch: 76, train_loss: 0.6302, test_loss: 0.9970, test_f1: 0.6289
 epoch: 77, train_loss: 0.6228, test_loss: 0.9640, test_f1: 0.6422
 epoch: 78, train_loss: 0.6173, test_loss: 0.9709, test_f1: 0.6326
 epoch: 79, train_loss: 0.6117, test_loss: 0.9590, test_f1: 0.6524
 epoch: 80, train_loss: 0.6204, test_loss: 0.9971, test_f1: 0.6322
 epoch: 81, train_loss: 0.6139, test_loss: 1.1981, test_f1: 0.6004
 epoch: 82, train_loss: 0.6266, test_loss: 1.0103, test_f1: 0.6090
 epoch: 83, train_loss: 0.6142, test_loss: 0.9867, test_f1: 0.6377
 epoch: 84, train_loss: 0.6090, test_loss: 1.0093, test_f1: 0.6225
 epoch: 85, train_loss: 0.6027, test_loss: 1.0128, test_f1: 0.6302
 epoch: 86, train_loss: 0.6024, test_loss: 1.0337, test_f1: 0.6483
 epoch: 87, train_loss: 0.6162, test_loss: 1.0428, test_f1: 0.6175
 epoch: 88, train_loss: 0.6198, test_loss: 0.9942, test_f1: 0.6786
 epoch: 89, train_loss: 0.6103, test_loss: 0.9472, test_f1: 0.6289
 epoch: 90, train_loss: 0.6111, test_loss: 0.9895, test_f1: 0.6388
 epoch: 91, train_loss: 0.6008, test_loss: 1.0281, test_f1: 0.6384
 epoch: 92, train_loss: 0.6111, test_loss: 1.0113, test_f1: 0.6599
 epoch: 93, train_loss: 0.5867, test_loss: 0.9995, test_f1: 0.6407
 epoch: 94, train_loss: 0.5977, test_loss: 1.0208, test_f1: 0.6350
 epoch: 95, train_loss: 0.5925, test_loss: 1.0448, test_f1: 0.6451
 epoch: 96, train_loss: 0.6020, test_loss: 1.0638, test_f1: 0.6230
 epoch: 97, train_loss: 0.5991, test_loss: 1.0341, test_f1: 0.6325
 epoch: 98, train_loss: 0.5918, test_loss: 1.0108, test_f1: 0.6305
 epoch: 99, train_loss: 0.5943, test_loss: 0.9972, test_f1: 0.6416
##################ITERATION #5 ****************************************
 epoch: 0, train_loss: 1.2578, test_loss: 1.0957, test_f1: 0.4613
 epoch: 1, train_loss: 1.0675, test_loss: 0.9697, test_f1: 0.5065
 epoch: 2, train_loss: 1.0241, test_loss: 0.9442, test_f1: 0.4853
 epoch: 3, train_loss: 0.9880, test_loss: 0.9266, test_f1: 0.5067
 epoch: 4, train_loss: 0.9702, test_loss: 0.9180, test_f1: 0.5067
 epoch: 5, train_loss: 0.9506, test_loss: 0.9272, test_f1: 0.5511
 epoch: 6, train_loss: 0.9325, test_loss: 0.9064, test_f1: 0.5465
 epoch: 7, train_loss: 0.9168, test_loss: 0.8901, test_f1: 0.5501
 epoch: 8, train_loss: 0.9262, test_loss: 0.8762, test_f1: 0.5334
 epoch: 9, train_loss: 0.9049, test_loss: 0.9201, test_f1: 0.5259
 epoch: 10, train_loss: 0.8968, test_loss: 0.8914, test_f1: 0.5268
 epoch: 11, train_loss: 0.8810, test_loss: 0.9014, test_f1: 0.5371
 epoch: 12, train_loss: 0.8749, test_loss: 0.9188, test_f1: 0.5318
 epoch: 13, train_loss: 0.8698, test_loss: 0.9121, test_f1: 0.5539
 epoch: 14, train_loss: 0.8591, test_loss: 0.9038, test_f1: 0.5369
 epoch: 15, train_loss: 0.8515, test_loss: 0.8869, test_f1: 0.5370
 epoch: 16, train_loss: 0.8559, test_loss: 0.8902, test_f1: 0.5445
 epoch: 17, train_loss: 0.8498, test_loss: 0.8856, test_f1: 0.5529
 epoch: 18, train_loss: 0.8390, test_loss: 0.8840, test_f1: 0.5445
 epoch: 19, train_loss: 0.8391, test_loss: 0.8845, test_f1: 0.5429
 epoch: 20, train_loss: 0.8296, test_loss: 0.9350, test_f1: 0.5419
 epoch: 21, train_loss: 0.8226, test_loss: 0.9127, test_f1: 0.5805
 epoch: 22, train_loss: 0.8128, test_loss: 0.8739, test_f1: 0.5801
 epoch: 23, train_loss: 0.8178, test_loss: 0.8937, test_f1: 0.5367
 epoch: 24, train_loss: 0.8161, test_loss: 0.8653, test_f1: 0.5990
 epoch: 25, train_loss: 0.8023, test_loss: 0.8732, test_f1: 0.5671
 epoch: 26, train_loss: 0.8024, test_loss: 0.8682, test_f1: 0.5788
 epoch: 27, train_loss: 0.8065, test_loss: 0.8768, test_f1: 0.5432
 epoch: 28, train_loss: 0.7940, test_loss: 0.9201, test_f1: 0.5675
 epoch: 29, train_loss: 0.7983, test_loss: 0.8748, test_f1: 0.5762
 epoch: 30, train_loss: 0.8002, test_loss: 0.8860, test_f1: 0.5761
 epoch: 31, train_loss: 0.7932, test_loss: 0.8883, test_f1: 0.5780
 epoch: 32, train_loss: 0.7898, test_loss: 0.8837, test_f1: 0.5728
 epoch: 33, train_loss: 0.7766, test_loss: 0.8679, test_f1: 0.5708
 epoch: 34, train_loss: 0.7627, test_loss: 0.8873, test_f1: 0.5807
 epoch: 35, train_loss: 0.7709, test_loss: 0.8654, test_f1: 0.6089
 epoch: 36, train_loss: 0.7673, test_loss: 0.8425, test_f1: 0.6179
 epoch: 37, train_loss: 0.7608, test_loss: 0.9051, test_f1: 0.5732
 epoch: 38, train_loss: 0.7588, test_loss: 0.8586, test_f1: 0.5917
 epoch: 39, train_loss: 0.7613, test_loss: 0.8682, test_f1: 0.6097
 epoch: 40, train_loss: 0.7371, test_loss: 0.8416, test_f1: 0.6070
 epoch: 41, train_loss: 0.7483, test_loss: 0.8401, test_f1: 0.6283
 epoch: 42, train_loss: 0.7390, test_loss: 0.8786, test_f1: 0.6443
 epoch: 43, train_loss: 0.7457, test_loss: 0.8693, test_f1: 0.6018
 epoch: 44, train_loss: 0.7341, test_loss: 0.8661, test_f1: 0.6361
 epoch: 45, train_loss: 0.7356, test_loss: 0.8638, test_f1: 0.6047
 epoch: 46, train_loss: 0.7375, test_loss: 0.8615, test_f1: 0.6285
 epoch: 47, train_loss: 0.7372, test_loss: 0.8588, test_f1: 0.6327
 epoch: 48, train_loss: 0.7177, test_loss: 0.8734, test_f1: 0.6079
 epoch: 49, train_loss: 0.7175, test_loss: 0.8652, test_f1: 0.6493
 epoch: 50, train_loss: 0.7147, test_loss: 0.8504, test_f1: 0.6231
 epoch: 51, train_loss: 0.7135, test_loss: 0.8887, test_f1: 0.6196
 epoch: 52, train_loss: 0.6901, test_loss: 0.8623, test_f1: 0.6285
 epoch: 53, train_loss: 0.6831, test_loss: 0.8670, test_f1: 0.6307
 epoch: 54, train_loss: 0.6859, test_loss: 0.8607, test_f1: 0.6332
 epoch: 55, train_loss: 0.6870, test_loss: 0.8699, test_f1: 0.6784
 epoch: 56, train_loss: 0.6765, test_loss: 0.8486, test_f1: 0.6438
 epoch: 57, train_loss: 0.6774, test_loss: 0.8739, test_f1: 0.6257
 epoch: 58, train_loss: 0.6730, test_loss: 0.8767, test_f1: 0.6385
 epoch: 59, train_loss: 0.6873, test_loss: 0.8784, test_f1: 0.6231
 epoch: 60, train_loss: 0.6668, test_loss: 0.8755, test_f1: 0.6287
 epoch: 61, train_loss: 0.6728, test_loss: 0.8519, test_f1: 0.6575
 epoch: 62, train_loss: 0.6808, test_loss: 0.8581, test_f1: 0.6502
 epoch: 63, train_loss: 0.6689, test_loss: 0.8657, test_f1: 0.6363
 epoch: 64, train_loss: 0.6620, test_loss: 0.8927, test_f1: 0.6316
 epoch: 65, train_loss: 0.6750, test_loss: 0.8708, test_f1: 0.6281
 epoch: 66, train_loss: 0.6471, test_loss: 0.8944, test_f1: 0.6240
 epoch: 67, train_loss: 0.6704, test_loss: 0.8570, test_f1: 0.6400
 epoch: 68, train_loss: 0.6558, test_loss: 0.8646, test_f1: 0.6554
 epoch: 69, train_loss: 0.6656, test_loss: 0.8707, test_f1: 0.6406
 epoch: 70, train_loss: 0.6606, test_loss: 0.8435, test_f1: 0.6325
 epoch: 71, train_loss: 0.6533, test_loss: 0.8441, test_f1: 0.6261
 epoch: 72, train_loss: 0.6458, test_loss: 0.8765, test_f1: 0.6252
 epoch: 73, train_loss: 0.6401, test_loss: 0.8901, test_f1: 0.6387
 epoch: 74, train_loss: 0.6433, test_loss: 0.8501, test_f1: 0.6431
 epoch: 75, train_loss: 0.6382, test_loss: 0.8341, test_f1: 0.6938
 epoch: 76, train_loss: 0.6548, test_loss: 0.8522, test_f1: 0.6548
 epoch: 77, train_loss: 0.6383, test_loss: 0.8489, test_f1: 0.6570
 epoch: 78, train_loss: 0.6379, test_loss: 0.8613, test_f1: 0.6734
 epoch: 79, train_loss: 0.6289, test_loss: 0.8637, test_f1: 0.6348
 epoch: 80, train_loss: 0.6315, test_loss: 0.8641, test_f1: 0.6509
 epoch: 81, train_loss: 0.6442, test_loss: 0.8372, test_f1: 0.6690
 epoch: 82, train_loss: 0.6433, test_loss: 0.8701, test_f1: 0.6419
 epoch: 83, train_loss: 0.6220, test_loss: 0.8679, test_f1: 0.6389
 epoch: 84, train_loss: 0.6315, test_loss: 0.8627, test_f1: 0.6385
 epoch: 85, train_loss: 0.6116, test_loss: 0.8881, test_f1: 0.6110
 epoch: 86, train_loss: 0.6159, test_loss: 0.8877, test_f1: 0.6442
 epoch: 87, train_loss: 0.6223, test_loss: 0.8829, test_f1: 0.6658
 epoch: 88, train_loss: 0.6212, test_loss: 0.8960, test_f1: 0.6279
 epoch: 89, train_loss: 0.6213, test_loss: 0.8799, test_f1: 0.6462
 epoch: 90, train_loss: 0.6079, test_loss: 0.8660, test_f1: 0.6538
 epoch: 91, train_loss: 0.5992, test_loss: 0.8794, test_f1: 0.6710
 epoch: 92, train_loss: 0.6219, test_loss: 0.8840, test_f1: 0.6485
 epoch: 93, train_loss: 0.6109, test_loss: 0.8811, test_f1: 0.6296
 epoch: 94, train_loss: 0.6211, test_loss: 0.8780, test_f1: 0.6358
 epoch: 95, train_loss: 0.6065, test_loss: 0.8672, test_f1: 0.6557
 epoch: 96, train_loss: 0.6137, test_loss: 0.8596, test_f1: 0.6633
 epoch: 97, train_loss: 0.6067, test_loss: 0.8769, test_f1: 0.6354
 epoch: 98, train_loss: 0.6075, test_loss: 0.8968, test_f1: 0.6813
 epoch: 99, train_loss: 0.5980, test_loss: 0.8595, test_f1: 0.6491
##################ITERATION #6 ****************************************
 epoch: 0, train_loss: 1.3391, test_loss: 1.1778, test_f1: 0.3306
 epoch: 1, train_loss: 1.1170, test_loss: 1.0459, test_f1: 0.4437
 epoch: 2, train_loss: 1.0719, test_loss: 0.9986, test_f1: 0.4636
 epoch: 3, train_loss: 1.0271, test_loss: 1.0108, test_f1: 0.4911
 epoch: 4, train_loss: 1.0089, test_loss: 1.0045, test_f1: 0.4732
 epoch: 5, train_loss: 0.9923, test_loss: 1.0071, test_f1: 0.5037
 epoch: 6, train_loss: 0.9876, test_loss: 1.0174, test_f1: 0.4924
 epoch: 7, train_loss: 0.9729, test_loss: 1.0059, test_f1: 0.4740
 epoch: 8, train_loss: 0.9482, test_loss: 1.0088, test_f1: 0.5015
 epoch: 9, train_loss: 0.9487, test_loss: 1.0032, test_f1: 0.4940
 epoch: 10, train_loss: 0.9185, test_loss: 0.9948, test_f1: 0.5124
 epoch: 11, train_loss: 0.9241, test_loss: 0.9785, test_f1: 0.5422
 epoch: 12, train_loss: 0.9089, test_loss: 0.9763, test_f1: 0.5301
 epoch: 13, train_loss: 0.8924, test_loss: 0.9728, test_f1: 0.5297
 epoch: 14, train_loss: 0.8957, test_loss: 0.9817, test_f1: 0.5156
 epoch: 15, train_loss: 0.8828, test_loss: 0.9783, test_f1: 0.5423
 epoch: 16, train_loss: 0.8686, test_loss: 0.9908, test_f1: 0.5159
 epoch: 17, train_loss: 0.8696, test_loss: 0.9748, test_f1: 0.5158
 epoch: 18, train_loss: 0.8680, test_loss: 1.0052, test_f1: 0.5423
 epoch: 19, train_loss: 0.8563, test_loss: 0.9345, test_f1: 0.5688
 epoch: 20, train_loss: 0.8531, test_loss: 0.9790, test_f1: 0.5637
 epoch: 21, train_loss: 0.8345, test_loss: 0.9807, test_f1: 0.5592
 epoch: 22, train_loss: 0.8313, test_loss: 0.9375, test_f1: 0.5619
 epoch: 23, train_loss: 0.8306, test_loss: 0.9907, test_f1: 0.5186
 epoch: 24, train_loss: 0.8176, test_loss: 0.9738, test_f1: 0.5364
 epoch: 25, train_loss: 0.8154, test_loss: 1.0191, test_f1: 0.5486
 epoch: 26, train_loss: 0.8142, test_loss: 0.9784, test_f1: 0.5413
 epoch: 27, train_loss: 0.8023, test_loss: 1.0021, test_f1: 0.5598
 epoch: 28, train_loss: 0.7973, test_loss: 1.0257, test_f1: 0.5465
 epoch: 29, train_loss: 0.8016, test_loss: 0.9381, test_f1: 0.5744
 epoch: 30, train_loss: 0.7944, test_loss: 0.9719, test_f1: 0.5721
 epoch: 31, train_loss: 0.7909, test_loss: 0.9696, test_f1: 0.5689
 epoch: 32, train_loss: 0.7832, test_loss: 0.9839, test_f1: 0.5716
 epoch: 33, train_loss: 0.7825, test_loss: 0.9727, test_f1: 0.5537
 epoch: 34, train_loss: 0.7696, test_loss: 0.9494, test_f1: 0.5692
 epoch: 35, train_loss: 0.7824, test_loss: 1.0336, test_f1: 0.5520
 epoch: 36, train_loss: 0.7718, test_loss: 0.9792, test_f1: 0.5942
 epoch: 37, train_loss: 0.7493, test_loss: 0.9888, test_f1: 0.5505
 epoch: 38, train_loss: 0.7638, test_loss: 0.9960, test_f1: 0.5632
 epoch: 39, train_loss: 0.7528, test_loss: 0.9948, test_f1: 0.5695
 epoch: 40, train_loss: 0.7543, test_loss: 1.0072, test_f1: 0.6012
 epoch: 41, train_loss: 0.7291, test_loss: 0.9765, test_f1: 0.5772
 epoch: 42, train_loss: 0.7376, test_loss: 0.9626, test_f1: 0.5851
 epoch: 43, train_loss: 0.7469, test_loss: 0.9761, test_f1: 0.5894
 epoch: 44, train_loss: 0.7314, test_loss: 1.0419, test_f1: 0.6123
 epoch: 45, train_loss: 0.7401, test_loss: 0.9553, test_f1: 0.5855
 epoch: 46, train_loss: 0.7427, test_loss: 0.9676, test_f1: 0.5866
 epoch: 47, train_loss: 0.7295, test_loss: 1.0059, test_f1: 0.6121
 epoch: 48, train_loss: 0.7384, test_loss: 0.9969, test_f1: 0.5681
 epoch: 49, train_loss: 0.7211, test_loss: 0.9586, test_f1: 0.5773
 epoch: 50, train_loss: 0.7197, test_loss: 0.9745, test_f1: 0.5968
 epoch: 51, train_loss: 0.6826, test_loss: 0.9787, test_f1: 0.6055
 epoch: 52, train_loss: 0.6822, test_loss: 0.9716, test_f1: 0.6097
 epoch: 53, train_loss: 0.6751, test_loss: 0.9700, test_f1: 0.6053
 epoch: 54, train_loss: 0.6882, test_loss: 0.9735, test_f1: 0.6077
 epoch: 55, train_loss: 0.6881, test_loss: 0.9564, test_f1: 0.6273
 epoch: 56, train_loss: 0.6642, test_loss: 0.9785, test_f1: 0.6121
 epoch: 57, train_loss: 0.6728, test_loss: 0.9942, test_f1: 0.6297
 epoch: 58, train_loss: 0.6677, test_loss: 0.9778, test_f1: 0.6131
 epoch: 59, train_loss: 0.6509, test_loss: 1.0293, test_f1: 0.5980
 epoch: 60, train_loss: 0.6492, test_loss: 1.0147, test_f1: 0.6164
 epoch: 61, train_loss: 0.6535, test_loss: 1.0378, test_f1: 0.6149
 epoch: 62, train_loss: 0.6500, test_loss: 0.9992, test_f1: 0.6334
 epoch: 63, train_loss: 0.6576, test_loss: 1.0193, test_f1: 0.6249
 epoch: 64, train_loss: 0.6273, test_loss: 0.9928, test_f1: 0.6298
 epoch: 65, train_loss: 0.6534, test_loss: 1.0002, test_f1: 0.6050
 epoch: 66, train_loss: 0.6450, test_loss: 0.9914, test_f1: 0.6210
 epoch: 67, train_loss: 0.6306, test_loss: 1.0330, test_f1: 0.6206
 epoch: 68, train_loss: 0.6475, test_loss: 1.0091, test_f1: 0.6297
 epoch: 69, train_loss: 0.6390, test_loss: 1.0174, test_f1: 0.6290
 epoch: 70, train_loss: 0.6360, test_loss: 0.9983, test_f1: 0.6262
 epoch: 71, train_loss: 0.6278, test_loss: 0.9640, test_f1: 0.6380
 epoch: 72, train_loss: 0.6451, test_loss: 1.0252, test_f1: 0.6368
 epoch: 73, train_loss: 0.6276, test_loss: 0.9925, test_f1: 0.6455
 epoch: 74, train_loss: 0.6352, test_loss: 1.0279, test_f1: 0.6297
 epoch: 75, train_loss: 0.6242, test_loss: 0.9893, test_f1: 0.6508
 epoch: 76, train_loss: 0.6388, test_loss: 1.0165, test_f1: 0.6472
 epoch: 77, train_loss: 0.6244, test_loss: 1.0236, test_f1: 0.6629
 epoch: 78, train_loss: 0.6260, test_loss: 1.0193, test_f1: 0.6296
 epoch: 79, train_loss: 0.6146, test_loss: 0.9962, test_f1: 0.6593
 epoch: 80, train_loss: 0.6008, test_loss: 1.0120, test_f1: 0.6500
 epoch: 81, train_loss: 0.6248, test_loss: 1.0612, test_f1: 0.6552
 epoch: 82, train_loss: 0.6295, test_loss: 0.9931, test_f1: 0.6458
 epoch: 83, train_loss: 0.6151, test_loss: 1.0396, test_f1: 0.6636
 epoch: 84, train_loss: 0.6163, test_loss: 1.0299, test_f1: 0.6586
 epoch: 85, train_loss: 0.6134, test_loss: 1.0806, test_f1: 0.6379
 epoch: 86, train_loss: 0.6163, test_loss: 1.0344, test_f1: 0.6455
 epoch: 87, train_loss: 0.6134, test_loss: 1.0750, test_f1: 0.6534
 epoch: 88, train_loss: 0.6078, test_loss: 1.0534, test_f1: 0.6635
 epoch: 89, train_loss: 0.6121, test_loss: 1.0592, test_f1: 0.6484
 epoch: 90, train_loss: 0.5946, test_loss: 1.0682, test_f1: 0.6561
 epoch: 91, train_loss: 0.6107, test_loss: 1.0477, test_f1: 0.6650
 epoch: 92, train_loss: 0.6131, test_loss: 1.0461, test_f1: 0.6544
 epoch: 93, train_loss: 0.6023, test_loss: 1.0016, test_f1: 0.6696
 epoch: 94, train_loss: 0.5977, test_loss: 1.0131, test_f1: 0.6571
 epoch: 95, train_loss: 0.5819, test_loss: 1.0757, test_f1: 0.6426
 epoch: 96, train_loss: 0.5832, test_loss: 1.0355, test_f1: 0.6537
 epoch: 97, train_loss: 0.5813, test_loss: 1.0902, test_f1: 0.6609
 epoch: 98, train_loss: 0.5973, test_loss: 1.0500, test_f1: 0.6683
 epoch: 99, train_loss: 0.5847, test_loss: 1.0716, test_f1: 0.6653
##################ITERATION #7 ****************************************
 epoch: 0, train_loss: 1.4370, test_loss: 1.1413, test_f1: 0.4080
 epoch: 1, train_loss: 1.1411, test_loss: 1.0283, test_f1: 0.5101
 epoch: 2, train_loss: 1.0762, test_loss: 0.9924, test_f1: 0.4732
 epoch: 3, train_loss: 1.0315, test_loss: 0.9751, test_f1: 0.5085
 epoch: 4, train_loss: 0.9968, test_loss: 0.9782, test_f1: 0.4996
 epoch: 5, train_loss: 0.9830, test_loss: 0.9554, test_f1: 0.5300
 epoch: 6, train_loss: 0.9678, test_loss: 1.0033, test_f1: 0.5116
 epoch: 7, train_loss: 0.9541, test_loss: 0.9841, test_f1: 0.4843
 epoch: 8, train_loss: 0.9482, test_loss: 0.9301, test_f1: 0.5045
 epoch: 9, train_loss: 0.9226, test_loss: 0.9549, test_f1: 0.4983
 epoch: 10, train_loss: 0.9234, test_loss: 0.9469, test_f1: 0.5048
 epoch: 11, train_loss: 0.9077, test_loss: 0.9362, test_f1: 0.5283
 epoch: 12, train_loss: 0.9031, test_loss: 0.9261, test_f1: 0.5260
 epoch: 13, train_loss: 0.8914, test_loss: 0.9760, test_f1: 0.5094
 epoch: 14, train_loss: 0.8765, test_loss: 0.9249, test_f1: 0.5543
 epoch: 15, train_loss: 0.8868, test_loss: 0.9475, test_f1: 0.5313
 epoch: 16, train_loss: 0.8635, test_loss: 0.9574, test_f1: 0.5284
 epoch: 17, train_loss: 0.8804, test_loss: 0.9310, test_f1: 0.5307
 epoch: 18, train_loss: 0.8485, test_loss: 0.9287, test_f1: 0.5303
 epoch: 19, train_loss: 0.8519, test_loss: 0.9475, test_f1: 0.5058
 epoch: 20, train_loss: 0.8454, test_loss: 0.9452, test_f1: 0.5193
 epoch: 21, train_loss: 0.8494, test_loss: 0.9042, test_f1: 0.5583
 epoch: 22, train_loss: 0.8325, test_loss: 0.9232, test_f1: 0.5464
 epoch: 23, train_loss: 0.8459, test_loss: 0.9106, test_f1: 0.5591
 epoch: 24, train_loss: 0.8291, test_loss: 0.9528, test_f1: 0.5379
 epoch: 25, train_loss: 0.8192, test_loss: 0.9731, test_f1: 0.5189
 epoch: 26, train_loss: 0.8295, test_loss: 0.9381, test_f1: 0.5399
 epoch: 27, train_loss: 0.8166, test_loss: 0.9277, test_f1: 0.5382
 epoch: 28, train_loss: 0.8174, test_loss: 0.9562, test_f1: 0.5486
 epoch: 29, train_loss: 0.8178, test_loss: 0.9545, test_f1: 0.5628
 epoch: 30, train_loss: 0.8104, test_loss: 0.9756, test_f1: 0.5392
 epoch: 31, train_loss: 0.8032, test_loss: 0.9627, test_f1: 0.5821
 epoch: 32, train_loss: 0.7961, test_loss: 0.9413, test_f1: 0.5555
 epoch: 33, train_loss: 0.7963, test_loss: 0.9252, test_f1: 0.5627
 epoch: 34, train_loss: 0.7833, test_loss: 0.9308, test_f1: 0.5582
 epoch: 35, train_loss: 0.7779, test_loss: 0.9323, test_f1: 0.5755
 epoch: 36, train_loss: 0.7906, test_loss: 0.9312, test_f1: 0.5621
 epoch: 37, train_loss: 0.7733, test_loss: 0.9464, test_f1: 0.5590
 epoch: 38, train_loss: 0.7835, test_loss: 0.9497, test_f1: 0.5915
 epoch: 39, train_loss: 0.7841, test_loss: 0.9480, test_f1: 0.5514
 epoch: 40, train_loss: 0.7691, test_loss: 0.9313, test_f1: 0.5447
 epoch: 41, train_loss: 0.7705, test_loss: 0.9510, test_f1: 0.5905
 epoch: 42, train_loss: 0.7680, test_loss: 0.9835, test_f1: 0.5442
 epoch: 43, train_loss: 0.7766, test_loss: 0.9604, test_f1: 0.5887
 epoch: 44, train_loss: 0.7523, test_loss: 0.9520, test_f1: 0.5723
 epoch: 45, train_loss: 0.7614, test_loss: 0.9185, test_f1: 0.6126
 epoch: 46, train_loss: 0.7531, test_loss: 0.9812, test_f1: 0.5504
 epoch: 47, train_loss: 0.7522, test_loss: 0.9757, test_f1: 0.5947
 epoch: 48, train_loss: 0.7496, test_loss: 1.0071, test_f1: 0.5507
 epoch: 49, train_loss: 0.7530, test_loss: 0.9741, test_f1: 0.6200
 epoch: 50, train_loss: 0.7382, test_loss: 1.0189, test_f1: 0.5843
 epoch: 51, train_loss: 0.7278, test_loss: 0.9332, test_f1: 0.6211
 epoch: 52, train_loss: 0.7219, test_loss: 0.9510, test_f1: 0.6183
 epoch: 53, train_loss: 0.7135, test_loss: 0.9573, test_f1: 0.6343
 epoch: 54, train_loss: 0.6964, test_loss: 0.9753, test_f1: 0.6031
 epoch: 55, train_loss: 0.6974, test_loss: 0.9468, test_f1: 0.6340
 epoch: 56, train_loss: 0.7021, test_loss: 0.9794, test_f1: 0.6171
 epoch: 57, train_loss: 0.7043, test_loss: 0.9686, test_f1: 0.6209
 epoch: 58, train_loss: 0.7086, test_loss: 0.9576, test_f1: 0.6203
 epoch: 59, train_loss: 0.7004, test_loss: 0.9507, test_f1: 0.6477
 epoch: 60, train_loss: 0.6978, test_loss: 0.9991, test_f1: 0.6114
 epoch: 61, train_loss: 0.7000, test_loss: 0.9298, test_f1: 0.6541
 epoch: 62, train_loss: 0.6915, test_loss: 0.9384, test_f1: 0.6100
 epoch: 63, train_loss: 0.6876, test_loss: 0.9657, test_f1: 0.6581
 epoch: 64, train_loss: 0.6793, test_loss: 0.9526, test_f1: 0.6280
 epoch: 65, train_loss: 0.6833, test_loss: 0.9839, test_f1: 0.6131
 epoch: 66, train_loss: 0.6995, test_loss: 0.9717, test_f1: 0.6176
 epoch: 67, train_loss: 0.6780, test_loss: 0.9985, test_f1: 0.6264
 epoch: 68, train_loss: 0.6799, test_loss: 0.9707, test_f1: 0.6120
 epoch: 69, train_loss: 0.6805, test_loss: 0.9853, test_f1: 0.6163
 epoch: 70, train_loss: 0.6778, test_loss: 1.0345, test_f1: 0.5994
 epoch: 71, train_loss: 0.6861, test_loss: 0.9526, test_f1: 0.6109
 epoch: 72, train_loss: 0.6746, test_loss: 0.9889, test_f1: 0.6202
 epoch: 73, train_loss: 0.6758, test_loss: 0.9785, test_f1: 0.6194
 epoch: 74, train_loss: 0.6682, test_loss: 1.0182, test_f1: 0.6161
 epoch: 75, train_loss: 0.6632, test_loss: 1.0169, test_f1: 0.6251
 epoch: 76, train_loss: 0.6650, test_loss: 0.9930, test_f1: 0.6331
 epoch: 77, train_loss: 0.6620, test_loss: 1.0359, test_f1: 0.6114
 epoch: 78, train_loss: 0.6475, test_loss: 0.9891, test_f1: 0.6422
 epoch: 79, train_loss: 0.6605, test_loss: 0.9956, test_f1: 0.5983
 epoch: 80, train_loss: 0.6538, test_loss: 0.9526, test_f1: 0.6165
 epoch: 81, train_loss: 0.6457, test_loss: 0.9951, test_f1: 0.6356
 epoch: 82, train_loss: 0.6525, test_loss: 1.0134, test_f1: 0.6320
 epoch: 83, train_loss: 0.6365, test_loss: 0.9826, test_f1: 0.6116
 epoch: 84, train_loss: 0.6582, test_loss: 1.0337, test_f1: 0.6331
 epoch: 85, train_loss: 0.6374, test_loss: 1.0498, test_f1: 0.6534
 epoch: 86, train_loss: 0.6545, test_loss: 1.0288, test_f1: 0.6319
 epoch: 87, train_loss: 0.6240, test_loss: 1.0520, test_f1: 0.6151
 epoch: 88, train_loss: 0.6385, test_loss: 1.0076, test_f1: 0.6240
 epoch: 89, train_loss: 0.6420, test_loss: 1.0079, test_f1: 0.6234
 epoch: 90, train_loss: 0.6334, test_loss: 1.0139, test_f1: 0.6446
 epoch: 91, train_loss: 0.6338, test_loss: 1.0476, test_f1: 0.6096
 epoch: 92, train_loss: 0.6379, test_loss: 0.9797, test_f1: 0.6142
 epoch: 93, train_loss: 0.6281, test_loss: 1.0295, test_f1: 0.5939
 epoch: 94, train_loss: 0.6268, test_loss: 1.0452, test_f1: 0.6240
 epoch: 95, train_loss: 0.6273, test_loss: 1.0121, test_f1: 0.6353
 epoch: 96, train_loss: 0.6318, test_loss: 1.0123, test_f1: 0.6130
 epoch: 97, train_loss: 0.6230, test_loss: 1.0330, test_f1: 0.6296
 epoch: 98, train_loss: 0.6171, test_loss: 1.0238, test_f1: 0.6143
 epoch: 99, train_loss: 0.6154, test_loss: 1.0262, test_f1: 0.6526
##################ITERATION #8 ****************************************
 epoch: 0, train_loss: 1.3385, test_loss: 1.1135, test_f1: 0.4292
 epoch: 1, train_loss: 1.0844, test_loss: 0.9455, test_f1: 0.4893
 epoch: 2, train_loss: 1.0148, test_loss: 0.9503, test_f1: 0.4543
 epoch: 3, train_loss: 0.9820, test_loss: 0.9165, test_f1: 0.4845
 epoch: 4, train_loss: 0.9656, test_loss: 0.9309, test_f1: 0.4863
 epoch: 5, train_loss: 0.9486, test_loss: 0.9178, test_f1: 0.4887
 epoch: 6, train_loss: 0.9383, test_loss: 0.9189, test_f1: 0.4931
 epoch: 7, train_loss: 0.9232, test_loss: 0.9313, test_f1: 0.5151
 epoch: 8, train_loss: 0.9121, test_loss: 0.9235, test_f1: 0.5001
 epoch: 9, train_loss: 0.9014, test_loss: 0.9085, test_f1: 0.5095
 epoch: 10, train_loss: 0.8854, test_loss: 0.8902, test_f1: 0.5083
 epoch: 11, train_loss: 0.8956, test_loss: 0.8893, test_f1: 0.5454
 epoch: 12, train_loss: 0.8685, test_loss: 0.9230, test_f1: 0.5090
 epoch: 13, train_loss: 0.8686, test_loss: 0.9130, test_f1: 0.5259
 epoch: 14, train_loss: 0.8676, test_loss: 0.9174, test_f1: 0.5184
 epoch: 15, train_loss: 0.8609, test_loss: 0.9291, test_f1: 0.5295
 epoch: 16, train_loss: 0.8413, test_loss: 0.9108, test_f1: 0.5218
 epoch: 17, train_loss: 0.8325, test_loss: 0.8873, test_f1: 0.5312
 epoch: 18, train_loss: 0.8315, test_loss: 0.9018, test_f1: 0.5484
 epoch: 19, train_loss: 0.8255, test_loss: 0.9062, test_f1: 0.5293
 epoch: 20, train_loss: 0.8132, test_loss: 0.9149, test_f1: 0.5308
 epoch: 21, train_loss: 0.8176, test_loss: 0.8847, test_f1: 0.5778
 epoch: 22, train_loss: 0.7943, test_loss: 0.8867, test_f1: 0.5430
 epoch: 23, train_loss: 0.8073, test_loss: 0.8676, test_f1: 0.5728
 epoch: 24, train_loss: 0.7946, test_loss: 0.8789, test_f1: 0.5947
 epoch: 25, train_loss: 0.7893, test_loss: 0.9064, test_f1: 0.5877
 epoch: 26, train_loss: 0.8001, test_loss: 0.9031, test_f1: 0.5802
 epoch: 27, train_loss: 0.7778, test_loss: 0.8655, test_f1: 0.5782
 epoch: 28, train_loss: 0.7748, test_loss: 0.8898, test_f1: 0.5859
 epoch: 29, train_loss: 0.7711, test_loss: 0.8894, test_f1: 0.5840
 epoch: 30, train_loss: 0.7683, test_loss: 0.8904, test_f1: 0.5855
 epoch: 31, train_loss: 0.7647, test_loss: 0.8588, test_f1: 0.5927
 epoch: 32, train_loss: 0.7613, test_loss: 0.8868, test_f1: 0.6045
 epoch: 33, train_loss: 0.7641, test_loss: 0.8683, test_f1: 0.5988
 epoch: 34, train_loss: 0.7516, test_loss: 0.8927, test_f1: 0.6032
 epoch: 35, train_loss: 0.7435, test_loss: 0.9065, test_f1: 0.5992
 epoch: 36, train_loss: 0.7389, test_loss: 0.8853, test_f1: 0.5993
 epoch: 37, train_loss: 0.7415, test_loss: 0.9172, test_f1: 0.5860
 epoch: 38, train_loss: 0.7196, test_loss: 0.8639, test_f1: 0.5932
 epoch: 39, train_loss: 0.7319, test_loss: 0.8750, test_f1: 0.5955
 epoch: 40, train_loss: 0.7324, test_loss: 0.9014, test_f1: 0.6082
 epoch: 41, train_loss: 0.7358, test_loss: 0.8833, test_f1: 0.6050
 epoch: 42, train_loss: 0.7353, test_loss: 0.8943, test_f1: 0.6110
 epoch: 43, train_loss: 0.7226, test_loss: 0.8510, test_f1: 0.6188
 epoch: 44, train_loss: 0.7082, test_loss: 0.8770, test_f1: 0.6205
 epoch: 45, train_loss: 0.7134, test_loss: 0.8616, test_f1: 0.6047
 epoch: 46, train_loss: 0.7079, test_loss: 1.0235, test_f1: 0.5790
 epoch: 47, train_loss: 0.7129, test_loss: 0.8758, test_f1: 0.6212
 epoch: 48, train_loss: 0.6982, test_loss: 0.9055, test_f1: 0.6016
 epoch: 49, train_loss: 0.7115, test_loss: 0.8709, test_f1: 0.6000
 epoch: 50, train_loss: 0.7073, test_loss: 0.8556, test_f1: 0.6130
 epoch: 51, train_loss: 0.6772, test_loss: 0.8687, test_f1: 0.6265
 epoch: 52, train_loss: 0.6662, test_loss: 0.8549, test_f1: 0.6211
 epoch: 53, train_loss: 0.6684, test_loss: 0.8562, test_f1: 0.6465
 epoch: 54, train_loss: 0.6500, test_loss: 0.8571, test_f1: 0.6388
 epoch: 55, train_loss: 0.6706, test_loss: 0.8762, test_f1: 0.6393
 epoch: 56, train_loss: 0.6477, test_loss: 0.8752, test_f1: 0.6286
 epoch: 57, train_loss: 0.6544, test_loss: 0.8720, test_f1: 0.6449
 epoch: 58, train_loss: 0.6583, test_loss: 0.8774, test_f1: 0.6438
 epoch: 59, train_loss: 0.6486, test_loss: 0.8725, test_f1: 0.6351
 epoch: 60, train_loss: 0.6448, test_loss: 0.8739, test_f1: 0.6328
 epoch: 61, train_loss: 0.6434, test_loss: 0.8713, test_f1: 0.6361
 epoch: 62, train_loss: 0.6503, test_loss: 0.9183, test_f1: 0.6254
 epoch: 63, train_loss: 0.6566, test_loss: 0.9062, test_f1: 0.6519
 epoch: 64, train_loss: 0.6507, test_loss: 0.8939, test_f1: 0.6344
 epoch: 65, train_loss: 0.6346, test_loss: 0.8733, test_f1: 0.6399
 epoch: 66, train_loss: 0.6253, test_loss: 0.8737, test_f1: 0.6429
 epoch: 67, train_loss: 0.6265, test_loss: 0.8941, test_f1: 0.6402
 epoch: 68, train_loss: 0.6359, test_loss: 0.8784, test_f1: 0.6316
 epoch: 69, train_loss: 0.6199, test_loss: 0.8930, test_f1: 0.6354
 epoch: 70, train_loss: 0.6131, test_loss: 0.8899, test_f1: 0.6376
 epoch: 71, train_loss: 0.6174, test_loss: 0.9380, test_f1: 0.6359
 epoch: 72, train_loss: 0.6323, test_loss: 0.8856, test_f1: 0.6334
 epoch: 73, train_loss: 0.6252, test_loss: 0.9002, test_f1: 0.6479
 epoch: 74, train_loss: 0.6297, test_loss: 0.8754, test_f1: 0.6590
 epoch: 75, train_loss: 0.6243, test_loss: 0.8870, test_f1: 0.6478
 epoch: 76, train_loss: 0.6270, test_loss: 0.9099, test_f1: 0.6289
 epoch: 77, train_loss: 0.6245, test_loss: 0.9061, test_f1: 0.6327
 epoch: 78, train_loss: 0.6191, test_loss: 0.9108, test_f1: 0.6584
 epoch: 79, train_loss: 0.6116, test_loss: 0.8906, test_f1: 0.6614
 epoch: 80, train_loss: 0.6061, test_loss: 0.9106, test_f1: 0.6576
 epoch: 81, train_loss: 0.6059, test_loss: 0.9160, test_f1: 0.6441
 epoch: 82, train_loss: 0.6208, test_loss: 0.9134, test_f1: 0.6523
 epoch: 83, train_loss: 0.5981, test_loss: 0.9246, test_f1: 0.6433
 epoch: 84, train_loss: 0.6145, test_loss: 0.8970, test_f1: 0.6433
 epoch: 85, train_loss: 0.5979, test_loss: 0.9021, test_f1: 0.6336
 epoch: 86, train_loss: 0.5990, test_loss: 0.9002, test_f1: 0.6566
 epoch: 87, train_loss: 0.5935, test_loss: 0.8782, test_f1: 0.6583
 epoch: 88, train_loss: 0.5992, test_loss: 0.9158, test_f1: 0.6751
 epoch: 89, train_loss: 0.6074, test_loss: 0.8943, test_f1: 0.6399
 epoch: 90, train_loss: 0.5983, test_loss: 0.9233, test_f1: 0.6505
 epoch: 91, train_loss: 0.6037, test_loss: 0.9145, test_f1: 0.6441
 epoch: 92, train_loss: 0.5804, test_loss: 0.9101, test_f1: 0.6578
 epoch: 93, train_loss: 0.5919, test_loss: 0.8930, test_f1: 0.6824
 epoch: 94, train_loss: 0.5885, test_loss: 0.9083, test_f1: 0.6730
 epoch: 95, train_loss: 0.5907, test_loss: 0.8991, test_f1: 0.6508
 epoch: 96, train_loss: 0.5887, test_loss: 0.9290, test_f1: 0.6858
 epoch: 97, train_loss: 0.5786, test_loss: 0.9513, test_f1: 0.6508
 epoch: 98, train_loss: 0.5832, test_loss: 0.9201, test_f1: 0.6699
 epoch: 99, train_loss: 0.5743, test_loss: 0.9257, test_f1: 0.6555
##################ITERATION #9 ****************************************
 epoch: 0, train_loss: 1.3834, test_loss: 1.0958, test_f1: 0.4462
 epoch: 1, train_loss: 1.0869, test_loss: 1.0072, test_f1: 0.5368
 epoch: 2, train_loss: 1.0356, test_loss: 0.9862, test_f1: 0.5219
 epoch: 3, train_loss: 1.0022, test_loss: 0.9880, test_f1: 0.5059
 epoch: 4, train_loss: 0.9819, test_loss: 0.9771, test_f1: 0.4852
 epoch: 5, train_loss: 0.9747, test_loss: 0.9684, test_f1: 0.4942
 epoch: 6, train_loss: 0.9458, test_loss: 0.9696, test_f1: 0.4988
 epoch: 7, train_loss: 0.9515, test_loss: 0.9605, test_f1: 0.5034
 epoch: 8, train_loss: 0.9373, test_loss: 0.9532, test_f1: 0.5175
 epoch: 9, train_loss: 0.9231, test_loss: 0.9585, test_f1: 0.5286
 epoch: 10, train_loss: 0.9163, test_loss: 0.9675, test_f1: 0.5194
 epoch: 11, train_loss: 0.9015, test_loss: 0.9656, test_f1: 0.5089
 epoch: 12, train_loss: 0.8953, test_loss: 0.9940, test_f1: 0.5099
 epoch: 13, train_loss: 0.9011, test_loss: 0.9709, test_f1: 0.5173
 epoch: 14, train_loss: 0.8809, test_loss: 0.9670, test_f1: 0.5322
 epoch: 15, train_loss: 0.8699, test_loss: 0.9474, test_f1: 0.5098
 epoch: 16, train_loss: 0.8780, test_loss: 0.9594, test_f1: 0.5179
 epoch: 17, train_loss: 0.8735, test_loss: 0.9530, test_f1: 0.5141
 epoch: 18, train_loss: 0.8651, test_loss: 0.9591, test_f1: 0.5698
 epoch: 19, train_loss: 0.8448, test_loss: 0.9555, test_f1: 0.5509
 epoch: 20, train_loss: 0.8387, test_loss: 0.9424, test_f1: 0.5358
 epoch: 21, train_loss: 0.8376, test_loss: 0.9257, test_f1: 0.5522
 epoch: 22, train_loss: 0.8281, test_loss: 0.9477, test_f1: 0.5473
 epoch: 23, train_loss: 0.8187, test_loss: 0.9722, test_f1: 0.5485
 epoch: 24, train_loss: 0.8281, test_loss: 0.9796, test_f1: 0.5412
 epoch: 25, train_loss: 0.8258, test_loss: 0.9476, test_f1: 0.5639
 epoch: 26, train_loss: 0.8216, test_loss: 0.9802, test_f1: 0.5480
 epoch: 27, train_loss: 0.8104, test_loss: 0.9641, test_f1: 0.5593
 epoch: 28, train_loss: 0.8066, test_loss: 0.9650, test_f1: 0.5721
 epoch: 29, train_loss: 0.7953, test_loss: 0.9963, test_f1: 0.5700
 epoch: 30, train_loss: 0.7807, test_loss: 0.9948, test_f1: 0.5418
 epoch: 31, train_loss: 0.7901, test_loss: 0.9845, test_f1: 0.5657
 epoch: 32, train_loss: 0.7952, test_loss: 0.9670, test_f1: 0.5431
 epoch: 33, train_loss: 0.7733, test_loss: 0.9892, test_f1: 0.5606
 epoch: 34, train_loss: 0.7754, test_loss: 0.9974, test_f1: 0.5701
 epoch: 35, train_loss: 0.7678, test_loss: 1.0145, test_f1: 0.5560
 epoch: 36, train_loss: 0.7607, test_loss: 1.0366, test_f1: 0.5417
 epoch: 37, train_loss: 0.7647, test_loss: 1.0451, test_f1: 0.5889
 epoch: 38, train_loss: 0.7567, test_loss: 0.9895, test_f1: 0.5767
 epoch: 39, train_loss: 0.7483, test_loss: 1.0033, test_f1: 0.5837
 epoch: 40, train_loss: 0.7523, test_loss: 0.9953, test_f1: 0.5619
 epoch: 41, train_loss: 0.7464, test_loss: 1.0263, test_f1: 0.5764
 epoch: 42, train_loss: 0.7390, test_loss: 1.0030, test_f1: 0.5936
 epoch: 43, train_loss: 0.7434, test_loss: 1.0227, test_f1: 0.5598
 epoch: 44, train_loss: 0.7315, test_loss: 0.9897, test_f1: 0.5690
 epoch: 45, train_loss: 0.7430, test_loss: 0.9599, test_f1: 0.5900
 epoch: 46, train_loss: 0.7270, test_loss: 1.0043, test_f1: 0.6035
 epoch: 47, train_loss: 0.7351, test_loss: 1.0093, test_f1: 0.5966
 epoch: 48, train_loss: 0.7131, test_loss: 1.0438, test_f1: 0.6145
 epoch: 49, train_loss: 0.6967, test_loss: 1.0224, test_f1: 0.5923
 epoch: 50, train_loss: 0.7116, test_loss: 0.9932, test_f1: 0.5931
 epoch: 51, train_loss: 0.7013, test_loss: 1.0208, test_f1: 0.6238
 epoch: 52, train_loss: 0.6881, test_loss: 0.9708, test_f1: 0.6355
 epoch: 53, train_loss: 0.6787, test_loss: 1.0021, test_f1: 0.6262
 epoch: 54, train_loss: 0.6891, test_loss: 1.0417, test_f1: 0.6095
 epoch: 55, train_loss: 0.6917, test_loss: 0.9945, test_f1: 0.6164
 epoch: 56, train_loss: 0.6858, test_loss: 1.0176, test_f1: 0.6049
 epoch: 57, train_loss: 0.6785, test_loss: 1.0100, test_f1: 0.6139
 epoch: 58, train_loss: 0.6651, test_loss: 1.0271, test_f1: 0.6194
 epoch: 59, train_loss: 0.6580, test_loss: 0.9987, test_f1: 0.6199
 epoch: 60, train_loss: 0.6643, test_loss: 1.0398, test_f1: 0.6129
 epoch: 61, train_loss: 0.6597, test_loss: 1.0295, test_f1: 0.6261
 epoch: 62, train_loss: 0.6590, test_loss: 1.0415, test_f1: 0.6461
 epoch: 63, train_loss: 0.6488, test_loss: 1.0560, test_f1: 0.6274
 epoch: 64, train_loss: 0.6570, test_loss: 1.0111, test_f1: 0.6260
 epoch: 65, train_loss: 0.6449, test_loss: 1.0476, test_f1: 0.6511
 epoch: 66, train_loss: 0.6512, test_loss: 1.0110, test_f1: 0.6213
 epoch: 67, train_loss: 0.6467, test_loss: 1.0353, test_f1: 0.6484
 epoch: 68, train_loss: 0.6479, test_loss: 1.0243, test_f1: 0.6329
 epoch: 69, train_loss: 0.6395, test_loss: 1.0696, test_f1: 0.6112
 epoch: 70, train_loss: 0.6395, test_loss: 1.0450, test_f1: 0.6212
 epoch: 71, train_loss: 0.6420, test_loss: 1.0192, test_f1: 0.6397
 epoch: 72, train_loss: 0.6396, test_loss: 1.0860, test_f1: 0.6263
 epoch: 73, train_loss: 0.6362, test_loss: 1.0757, test_f1: 0.6153
 epoch: 74, train_loss: 0.6423, test_loss: 1.0152, test_f1: 0.6458
 epoch: 75, train_loss: 0.6140, test_loss: 1.0577, test_f1: 0.6223
 epoch: 76, train_loss: 0.6230, test_loss: 1.0746, test_f1: 0.6687
 epoch: 77, train_loss: 0.6230, test_loss: 1.0852, test_f1: 0.6568
 epoch: 78, train_loss: 0.6141, test_loss: 1.0138, test_f1: 0.6837
 epoch: 79, train_loss: 0.6170, test_loss: 1.0859, test_f1: 0.6291
 epoch: 80, train_loss: 0.6162, test_loss: 1.0623, test_f1: 0.6178
 epoch: 81, train_loss: 0.6159, test_loss: 1.0405, test_f1: 0.6945
 epoch: 82, train_loss: 0.6204, test_loss: 1.0438, test_f1: 0.6892
 epoch: 83, train_loss: 0.6129, test_loss: 1.0701, test_f1: 0.6573
 epoch: 84, train_loss: 0.6084, test_loss: 1.0443, test_f1: 0.6504
 epoch: 85, train_loss: 0.6053, test_loss: 1.0597, test_f1: 0.6186
 epoch: 86, train_loss: 0.6104, test_loss: 1.0228, test_f1: 0.6423
 epoch: 87, train_loss: 0.6069, test_loss: 1.0402, test_f1: 0.6444
 epoch: 88, train_loss: 0.6135, test_loss: 1.0411, test_f1: 0.6739
 epoch: 89, train_loss: 0.6103, test_loss: 1.0702, test_f1: 0.6549
 epoch: 90, train_loss: 0.6114, test_loss: 1.0455, test_f1: 0.6290
 epoch: 91, train_loss: 0.6047, test_loss: 1.0778, test_f1: 0.6696
 epoch: 92, train_loss: 0.6065, test_loss: 1.0434, test_f1: 0.6655
 epoch: 93, train_loss: 0.6037, test_loss: 1.0685, test_f1: 0.6744
 epoch: 94, train_loss: 0.5912, test_loss: 1.1024, test_f1: 0.6567
 epoch: 95, train_loss: 0.5963, test_loss: 1.0468, test_f1: 0.6976
 epoch: 96, train_loss: 0.5946, test_loss: 1.0644, test_f1: 0.6649
 epoch: 97, train_loss: 0.5955, test_loss: 1.1245, test_f1: 0.6743
 epoch: 98, train_loss: 0.5894, test_loss: 1.1006, test_f1: 0.6681
 epoch: 99, train_loss: 0.5822, test_loss: 1.0943, test_f1: 0.6508

Training completed in 609.58 seconds
Best F1: 0.6976 at epoch 95
Mean F1 across iterations: 0.6729  0.0174
========================FINAL RESULTS================================
FEGIN weighted F1: 0.6976  0.0174
python main.py --data ltspice_examples --representation component_net --model FEGIN --layers 3 --hiddens 32 --batch_size 64 --lr 0.001 --emb_size 128 --epochs 100 --save_appendix component_net_L3_H32_BS64_LR0.001_E128 --no_val
-----



STDERR:
  File "main.py", line 370, in <module>
    main()
  File "main.py", line 254, in main
    dataset = dataset_class(
  File "/home/philip/projects/ltspice_examples_code_repo/Circuit-Completion-Using-GNNs/component_classification_with_link_prediction_head/evaluation/FEGIN/kernel/circuit_datasets.py", line 15, in __init__
    self.data, self.slices = torch.load(self.processed_paths[0])
  File "/home/philip/.local/lib/python3.8/site-packages/torch/serialization.py", line 1040, in load
    warnings.warn(
  File "/usr/lib/python3.8/warnings.py", line 109, in _showwarnmsg
    sw(msg.message, msg.category, msg.filename, msg.lineno,
  File "main.py", line 47, in warn_with_traceback
    traceback.print_stack(file=log)
/home/philip/projects/ltspice_examples_code_repo/Circuit-Completion-Using-GNNs/component_classification_with_link_prediction_head/evaluation/FEGIN/kernel/circuit_datasets.py:15: FutureWarning: You are using `torch.load` with `weights_only=False` (the current default value), which uses the default pickle module implicitly. It is possible to construct malicious pickle data which will execute arbitrary code during unpickling (See https://github.com/pytorch/pytorch/blob/main/SECURITY.md#untrusted-models for more details). In a future release, the default value for `weights_only` will be flipped to `True`. This limits the functions that could be executed during unpickling. Arbitrary objects will no longer be allowed to be loaded via this mode unless they are explicitly allowlisted by the user via `torch.serialization.add_safe_globals`. We recommend you start setting `weights_only=True` for any use case where you don't have full control of the loaded file. Please open an issue on GitHub for any issues related to this experimental feature.
  self.data, self.slices = torch.load(self.processed_paths[0])
