STDOUT:
Results will be saved in /home/philip/projects/ltspice_examples_code_repo/Circuit-Completion-Using-GNNs/component_classification_with_link_prediction_head/evaluation/FEGIN/results/model_FEGIN_dataset_ltspice_demos
Command line input: python main.py --data ltspice_demos --representation component_pin_net --model FEGIN --layers 3 --hiddens 16 --batch_size 128 --lr 0.001 --emb_size 128 --epochs 100 --save_appendix component_pin_net_L3_H16_BS128_LR0.001_E128 --no_val
 is saved.
-----
ltspice_demos - FEGIN
Using 3 layers, 16 hidden units, h = 2
Loading component_pin_net representation dataset
ENTERED
Training FEGIN on component_pin_net representation
Train: 1565, Test: 383
##################ITERATION #0 ****************************************
 epoch: 0, train_loss: 1.3673, test_loss: 1.3598, test_f1: 0.2281
 epoch: 1, train_loss: 1.3508, test_loss: 1.3531, test_f1: 0.2281
 epoch: 2, train_loss: 1.3393, test_loss: 1.3460, test_f1: 0.2281
 epoch: 3, train_loss: 1.3249, test_loss: 1.3370, test_f1: 0.2281
 epoch: 4, train_loss: 1.3094, test_loss: 1.3166, test_f1: 0.2281
 epoch: 5, train_loss: 1.2878, test_loss: 1.2912, test_f1: 0.2285
 epoch: 6, train_loss: 1.2618, test_loss: 1.2685, test_f1: 0.2320
 epoch: 7, train_loss: 1.2313, test_loss: 1.2468, test_f1: 0.2378
 epoch: 8, train_loss: 1.1966, test_loss: 1.2242, test_f1: 0.2786
 epoch: 9, train_loss: 1.1686, test_loss: 1.1934, test_f1: 0.3451
 epoch: 10, train_loss: 1.1324, test_loss: 1.1604, test_f1: 0.3506
 epoch: 11, train_loss: 1.1022, test_loss: 1.1342, test_f1: 0.3562
 epoch: 12, train_loss: 1.0651, test_loss: 1.1156, test_f1: 0.3577
 epoch: 13, train_loss: 1.0566, test_loss: 1.1055, test_f1: 0.3551
 epoch: 14, train_loss: 1.0313, test_loss: 1.0925, test_f1: 0.3523
 epoch: 15, train_loss: 1.0268, test_loss: 1.0980, test_f1: 0.3574
 epoch: 16, train_loss: 1.0271, test_loss: 1.0833, test_f1: 0.3581
 epoch: 17, train_loss: 1.0081, test_loss: 1.0859, test_f1: 0.3569
 epoch: 18, train_loss: 0.9929, test_loss: 1.0878, test_f1: 0.4175
 epoch: 19, train_loss: 0.9915, test_loss: 1.0714, test_f1: 0.4280
 epoch: 20, train_loss: 0.9916, test_loss: 1.0658, test_f1: 0.4278
 epoch: 21, train_loss: 0.9843, test_loss: 1.0702, test_f1: 0.3822
 epoch: 22, train_loss: 0.9812, test_loss: 1.0696, test_f1: 0.4166
 epoch: 23, train_loss: 0.9733, test_loss: 1.0704, test_f1: 0.3890
 epoch: 24, train_loss: 0.9729, test_loss: 1.0650, test_f1: 0.4153
 epoch: 25, train_loss: 0.9683, test_loss: 1.0707, test_f1: 0.4046
 epoch: 26, train_loss: 0.9670, test_loss: 1.0659, test_f1: 0.4033
 epoch: 27, train_loss: 0.9565, test_loss: 1.0588, test_f1: 0.4629
 epoch: 28, train_loss: 0.9573, test_loss: 1.0849, test_f1: 0.4484
 epoch: 29, train_loss: 0.9543, test_loss: 1.0749, test_f1: 0.4597
 epoch: 30, train_loss: 0.9499, test_loss: 1.0712, test_f1: 0.4193
 epoch: 31, train_loss: 0.9552, test_loss: 1.0636, test_f1: 0.4536
 epoch: 32, train_loss: 0.9532, test_loss: 1.0830, test_f1: 0.4755
 epoch: 33, train_loss: 0.9420, test_loss: 1.0503, test_f1: 0.4548
 epoch: 34, train_loss: 0.9539, test_loss: 1.0512, test_f1: 0.4209
 epoch: 35, train_loss: 0.9414, test_loss: 1.0919, test_f1: 0.4502
 epoch: 36, train_loss: 0.9296, test_loss: 1.0583, test_f1: 0.4398
 epoch: 37, train_loss: 0.9385, test_loss: 1.0657, test_f1: 0.4658
 epoch: 38, train_loss: 0.9326, test_loss: 1.0912, test_f1: 0.4418
 epoch: 39, train_loss: 0.9250, test_loss: 1.0966, test_f1: 0.4700
 epoch: 40, train_loss: 0.9398, test_loss: 1.0720, test_f1: 0.4871
 epoch: 41, train_loss: 0.9151, test_loss: 1.0638, test_f1: 0.4978
 epoch: 42, train_loss: 0.9133, test_loss: 1.0873, test_f1: 0.5003
 epoch: 43, train_loss: 0.9074, test_loss: 1.0736, test_f1: 0.5018
 epoch: 44, train_loss: 0.9087, test_loss: 1.0640, test_f1: 0.4833
 epoch: 45, train_loss: 0.9013, test_loss: 1.0751, test_f1: 0.4637
 epoch: 46, train_loss: 0.8966, test_loss: 1.1021, test_f1: 0.5217
 epoch: 47, train_loss: 0.9217, test_loss: 1.0560, test_f1: 0.5218
 epoch: 48, train_loss: 0.9003, test_loss: 1.1295, test_f1: 0.5296
 epoch: 49, train_loss: 0.8990, test_loss: 1.0497, test_f1: 0.5406
 epoch: 50, train_loss: 0.8930, test_loss: 1.1186, test_f1: 0.5419
 epoch: 51, train_loss: 0.8897, test_loss: 1.0780, test_f1: 0.5537
 epoch: 52, train_loss: 0.8778, test_loss: 1.0742, test_f1: 0.5227
 epoch: 53, train_loss: 0.8917, test_loss: 1.0468, test_f1: 0.5527
 epoch: 54, train_loss: 0.8818, test_loss: 1.0886, test_f1: 0.5559
 epoch: 55, train_loss: 0.8852, test_loss: 1.0614, test_f1: 0.5509
 epoch: 56, train_loss: 0.8699, test_loss: 1.0772, test_f1: 0.5366
 epoch: 57, train_loss: 0.8733, test_loss: 1.0783, test_f1: 0.5437
 epoch: 58, train_loss: 0.8746, test_loss: 1.0631, test_f1: 0.5343
 epoch: 59, train_loss: 0.8686, test_loss: 1.1090, test_f1: 0.5324
 epoch: 60, train_loss: 0.8686, test_loss: 1.0973, test_f1: 0.5453
 epoch: 61, train_loss: 0.8676, test_loss: 1.0666, test_f1: 0.5470
 epoch: 62, train_loss: 0.8618, test_loss: 1.0720, test_f1: 0.5531
 epoch: 63, train_loss: 0.8677, test_loss: 1.0866, test_f1: 0.5268
 epoch: 64, train_loss: 0.8605, test_loss: 1.1815, test_f1: 0.5478
 epoch: 65, train_loss: 0.8689, test_loss: 1.0502, test_f1: 0.5469
 epoch: 66, train_loss: 0.8594, test_loss: 1.0768, test_f1: 0.5714
 epoch: 67, train_loss: 0.8582, test_loss: 1.0929, test_f1: 0.5645
 epoch: 68, train_loss: 0.8456, test_loss: 1.0736, test_f1: 0.5795
 epoch: 69, train_loss: 0.8536, test_loss: 1.0515, test_f1: 0.5800
 epoch: 70, train_loss: 0.8615, test_loss: 1.0784, test_f1: 0.5800
 epoch: 71, train_loss: 0.8416, test_loss: 1.0621, test_f1: 0.5789
 epoch: 72, train_loss: 0.8326, test_loss: 1.0598, test_f1: 0.5520
 epoch: 73, train_loss: 0.8452, test_loss: 1.0978, test_f1: 0.5501
 epoch: 74, train_loss: 0.8380, test_loss: 1.0742, test_f1: 0.5528
 epoch: 75, train_loss: 0.8379, test_loss: 1.0830, test_f1: 0.5802
 epoch: 76, train_loss: 0.8320, test_loss: 1.0814, test_f1: 0.5844
 epoch: 77, train_loss: 0.8252, test_loss: 1.1204, test_f1: 0.5801
 epoch: 78, train_loss: 0.8346, test_loss: 1.0941, test_f1: 0.5805
 epoch: 79, train_loss: 0.8438, test_loss: 1.0954, test_f1: 0.5826
 epoch: 80, train_loss: 0.8270, test_loss: 1.0863, test_f1: 0.5731
 epoch: 81, train_loss: 0.8244, test_loss: 1.1008, test_f1: 0.5808
 epoch: 82, train_loss: 0.8138, test_loss: 1.0995, test_f1: 0.5798
 epoch: 83, train_loss: 0.8087, test_loss: 1.0925, test_f1: 0.5732
 epoch: 84, train_loss: 0.8131, test_loss: 1.0623, test_f1: 0.5709
 epoch: 85, train_loss: 0.8290, test_loss: 1.0656, test_f1: 0.5797
 epoch: 86, train_loss: 0.8130, test_loss: 1.0797, test_f1: 0.5853
 epoch: 87, train_loss: 0.8069, test_loss: 1.0529, test_f1: 0.5729
 epoch: 88, train_loss: 0.8224, test_loss: 1.0856, test_f1: 0.5674
 epoch: 89, train_loss: 0.8043, test_loss: 1.0873, test_f1: 0.5907
 epoch: 90, train_loss: 0.8056, test_loss: 1.0520, test_f1: 0.5912
 epoch: 91, train_loss: 0.7947, test_loss: 1.0685, test_f1: 0.5946
 epoch: 92, train_loss: 0.7921, test_loss: 1.0773, test_f1: 0.5818
 epoch: 93, train_loss: 0.7966, test_loss: 1.0951, test_f1: 0.5830
 epoch: 94, train_loss: 0.8096, test_loss: 1.0741, test_f1: 0.5939
 epoch: 95, train_loss: 0.7842, test_loss: 1.0464, test_f1: 0.5918
 epoch: 96, train_loss: 0.7811, test_loss: 1.0650, test_f1: 0.6142
 epoch: 97, train_loss: 0.8003, test_loss: 1.0790, test_f1: 0.6022
 epoch: 98, train_loss: 0.7792, test_loss: 1.1278, test_f1: 0.5867
 epoch: 99, train_loss: 0.7868, test_loss: 1.0683, test_f1: 0.5771
##################ITERATION #1 ****************************************
 epoch: 0, train_loss: 1.3701, test_loss: 1.3582, test_f1: 0.0507
 epoch: 1, train_loss: 1.2983, test_loss: 1.3339, test_f1: 0.2281
 epoch: 2, train_loss: 1.2552, test_loss: 1.3003, test_f1: 0.2281
 epoch: 3, train_loss: 1.2242, test_loss: 1.2710, test_f1: 0.2281
 epoch: 4, train_loss: 1.1912, test_loss: 1.2402, test_f1: 0.2633
 epoch: 5, train_loss: 1.1640, test_loss: 1.2085, test_f1: 0.3041
 epoch: 6, train_loss: 1.1296, test_loss: 1.1867, test_f1: 0.3556
 epoch: 7, train_loss: 1.1143, test_loss: 1.1709, test_f1: 0.3915
 epoch: 8, train_loss: 1.0956, test_loss: 1.1537, test_f1: 0.3712
 epoch: 9, train_loss: 1.0846, test_loss: 1.1449, test_f1: 0.4115
 epoch: 10, train_loss: 1.0718, test_loss: 1.1462, test_f1: 0.3858
 epoch: 11, train_loss: 1.0591, test_loss: 1.1169, test_f1: 0.3964
 epoch: 12, train_loss: 1.0526, test_loss: 1.1059, test_f1: 0.3949
 epoch: 13, train_loss: 1.0364, test_loss: 1.0961, test_f1: 0.3959
 epoch: 14, train_loss: 1.0198, test_loss: 1.0813, test_f1: 0.3964
 epoch: 15, train_loss: 1.0181, test_loss: 1.0796, test_f1: 0.4257
 epoch: 16, train_loss: 1.0122, test_loss: 1.0728, test_f1: 0.4238
 epoch: 17, train_loss: 1.0080, test_loss: 1.0701, test_f1: 0.4295
 epoch: 18, train_loss: 1.0075, test_loss: 1.0666, test_f1: 0.4283
 epoch: 19, train_loss: 0.9953, test_loss: 1.0610, test_f1: 0.4333
 epoch: 20, train_loss: 0.9837, test_loss: 1.0614, test_f1: 0.4436
 epoch: 21, train_loss: 0.9795, test_loss: 1.0596, test_f1: 0.4388
 epoch: 22, train_loss: 0.9757, test_loss: 1.0594, test_f1: 0.4160
 epoch: 23, train_loss: 0.9811, test_loss: 1.0491, test_f1: 0.4207
 epoch: 24, train_loss: 0.9729, test_loss: 1.0617, test_f1: 0.4407
 epoch: 25, train_loss: 0.9591, test_loss: 1.0505, test_f1: 0.4815
 epoch: 26, train_loss: 0.9621, test_loss: 1.0530, test_f1: 0.4734
 epoch: 27, train_loss: 0.9595, test_loss: 1.0458, test_f1: 0.5027
 epoch: 28, train_loss: 0.9537, test_loss: 1.0422, test_f1: 0.4937
 epoch: 29, train_loss: 0.9479, test_loss: 1.0434, test_f1: 0.5052
 epoch: 30, train_loss: 0.9441, test_loss: 1.0567, test_f1: 0.5108
 epoch: 31, train_loss: 0.9447, test_loss: 1.0395, test_f1: 0.4990
 epoch: 32, train_loss: 0.9377, test_loss: 1.0302, test_f1: 0.5090
 epoch: 33, train_loss: 0.9347, test_loss: 1.0163, test_f1: 0.5052
 epoch: 34, train_loss: 0.9335, test_loss: 1.0484, test_f1: 0.5182
 epoch: 35, train_loss: 0.9281, test_loss: 1.0478, test_f1: 0.5348
 epoch: 36, train_loss: 0.9284, test_loss: 1.0320, test_f1: 0.5225
 epoch: 37, train_loss: 0.9271, test_loss: 1.0216, test_f1: 0.5244
 epoch: 38, train_loss: 0.9245, test_loss: 1.0247, test_f1: 0.5059
 epoch: 39, train_loss: 0.9239, test_loss: 1.0169, test_f1: 0.5451
 epoch: 40, train_loss: 0.9143, test_loss: 1.0219, test_f1: 0.5227
 epoch: 41, train_loss: 0.9083, test_loss: 1.0354, test_f1: 0.5115
 epoch: 42, train_loss: 0.9069, test_loss: 1.0156, test_f1: 0.5237
 epoch: 43, train_loss: 0.9073, test_loss: 1.0362, test_f1: 0.5369
 epoch: 44, train_loss: 0.9061, test_loss: 1.0223, test_f1: 0.5324
 epoch: 45, train_loss: 0.8980, test_loss: 1.0370, test_f1: 0.5290
 epoch: 46, train_loss: 0.8922, test_loss: 1.0284, test_f1: 0.5473
 epoch: 47, train_loss: 0.8870, test_loss: 1.0215, test_f1: 0.5357
 epoch: 48, train_loss: 0.8911, test_loss: 1.0557, test_f1: 0.5497
 epoch: 49, train_loss: 0.8785, test_loss: 1.0196, test_f1: 0.5486
 epoch: 50, train_loss: 0.8811, test_loss: 1.0203, test_f1: 0.5357
 epoch: 51, train_loss: 0.8732, test_loss: 1.0150, test_f1: 0.5493
 epoch: 52, train_loss: 0.8740, test_loss: 1.0175, test_f1: 0.5552
 epoch: 53, train_loss: 0.8651, test_loss: 1.0213, test_f1: 0.5589
 epoch: 54, train_loss: 0.8631, test_loss: 1.0268, test_f1: 0.5628
 epoch: 55, train_loss: 0.8688, test_loss: 1.0281, test_f1: 0.5536
 epoch: 56, train_loss: 0.8605, test_loss: 1.0119, test_f1: 0.5503
 epoch: 57, train_loss: 0.8520, test_loss: 1.0176, test_f1: 0.5587
 epoch: 58, train_loss: 0.8588, test_loss: 1.0140, test_f1: 0.5706
 epoch: 59, train_loss: 0.8635, test_loss: 1.0138, test_f1: 0.5642
 epoch: 60, train_loss: 0.8659, test_loss: 1.0151, test_f1: 0.5683
 epoch: 61, train_loss: 0.8472, test_loss: 1.0092, test_f1: 0.5983
 epoch: 62, train_loss: 0.8586, test_loss: 1.0135, test_f1: 0.5890
 epoch: 63, train_loss: 0.8512, test_loss: 1.0099, test_f1: 0.5737
 epoch: 64, train_loss: 0.8474, test_loss: 1.0115, test_f1: 0.5804
 epoch: 65, train_loss: 0.8458, test_loss: 1.0119, test_f1: 0.5623
 epoch: 66, train_loss: 0.8537, test_loss: 1.0110, test_f1: 0.5943
 epoch: 67, train_loss: 0.8450, test_loss: 1.0242, test_f1: 0.5873
 epoch: 68, train_loss: 0.8424, test_loss: 1.0177, test_f1: 0.5617
 epoch: 69, train_loss: 0.8584, test_loss: 0.9951, test_f1: 0.5636
 epoch: 70, train_loss: 0.8418, test_loss: 1.0020, test_f1: 0.5578
 epoch: 71, train_loss: 0.8433, test_loss: 1.0047, test_f1: 0.5762
 epoch: 72, train_loss: 0.8313, test_loss: 0.9953, test_f1: 0.5844
 epoch: 73, train_loss: 0.8373, test_loss: 0.9986, test_f1: 0.5671
 epoch: 74, train_loss: 0.8352, test_loss: 1.0060, test_f1: 0.5833
 epoch: 75, train_loss: 0.8421, test_loss: 0.9976, test_f1: 0.5712
 epoch: 76, train_loss: 0.8372, test_loss: 0.9991, test_f1: 0.5605
 epoch: 77, train_loss: 0.8336, test_loss: 1.0041, test_f1: 0.5616
 epoch: 78, train_loss: 0.8176, test_loss: 1.0010, test_f1: 0.5663
 epoch: 79, train_loss: 0.8258, test_loss: 0.9898, test_f1: 0.5947
 epoch: 80, train_loss: 0.8238, test_loss: 1.0014, test_f1: 0.5867
 epoch: 81, train_loss: 0.8255, test_loss: 1.0128, test_f1: 0.5588
 epoch: 82, train_loss: 0.8284, test_loss: 1.0026, test_f1: 0.5607
 epoch: 83, train_loss: 0.8204, test_loss: 1.0017, test_f1: 0.5608
 epoch: 84, train_loss: 0.8155, test_loss: 1.0074, test_f1: 0.5929
 epoch: 85, train_loss: 0.8107, test_loss: 1.0026, test_f1: 0.5615
 epoch: 86, train_loss: 0.8217, test_loss: 1.0096, test_f1: 0.5865
 epoch: 87, train_loss: 0.8168, test_loss: 1.0092, test_f1: 0.5796
 epoch: 88, train_loss: 0.8038, test_loss: 1.0120, test_f1: 0.5923
 epoch: 89, train_loss: 0.8046, test_loss: 1.0149, test_f1: 0.5708
 epoch: 90, train_loss: 0.8089, test_loss: 1.0168, test_f1: 0.5747
 epoch: 91, train_loss: 0.7915, test_loss: 1.0092, test_f1: 0.5870
 epoch: 92, train_loss: 0.7981, test_loss: 1.0108, test_f1: 0.5888
 epoch: 93, train_loss: 0.8021, test_loss: 1.0266, test_f1: 0.5684
 epoch: 94, train_loss: 0.7908, test_loss: 1.0163, test_f1: 0.5873
 epoch: 95, train_loss: 0.7924, test_loss: 1.0171, test_f1: 0.5789
 epoch: 96, train_loss: 0.7969, test_loss: 1.0100, test_f1: 0.5722
 epoch: 97, train_loss: 0.7994, test_loss: 1.0152, test_f1: 0.6115
 epoch: 98, train_loss: 0.8020, test_loss: 1.0242, test_f1: 0.5984
 epoch: 99, train_loss: 0.7946, test_loss: 1.0137, test_f1: 0.5977
##################ITERATION #2 ****************************************
 epoch: 0, train_loss: 1.3912, test_loss: 1.3865, test_f1: 0.0507
 epoch: 1, train_loss: 1.2544, test_loss: 1.3342, test_f1: 0.2281
 epoch: 2, train_loss: 1.2085, test_loss: 1.3257, test_f1: 0.2281
 epoch: 3, train_loss: 1.1602, test_loss: 1.3001, test_f1: 0.2281
 epoch: 4, train_loss: 1.1300, test_loss: 1.2027, test_f1: 0.2631
 epoch: 5, train_loss: 1.0943, test_loss: 1.1281, test_f1: 0.3317
 epoch: 6, train_loss: 1.0660, test_loss: 1.1009, test_f1: 0.3370
 epoch: 7, train_loss: 1.0397, test_loss: 1.0937, test_f1: 0.3372
 epoch: 8, train_loss: 1.0312, test_loss: 1.0866, test_f1: 0.3384
 epoch: 9, train_loss: 1.0206, test_loss: 1.0744, test_f1: 0.3474
 epoch: 10, train_loss: 1.0132, test_loss: 1.0735, test_f1: 0.4084
 epoch: 11, train_loss: 0.9899, test_loss: 1.0874, test_f1: 0.4254
 epoch: 12, train_loss: 0.9808, test_loss: 1.0611, test_f1: 0.4743
 epoch: 13, train_loss: 0.9816, test_loss: 1.0595, test_f1: 0.4826
 epoch: 14, train_loss: 0.9784, test_loss: 1.0548, test_f1: 0.4653
 epoch: 15, train_loss: 0.9648, test_loss: 1.0521, test_f1: 0.4736
 epoch: 16, train_loss: 0.9600, test_loss: 1.0695, test_f1: 0.4964
 epoch: 17, train_loss: 0.9591, test_loss: 1.0660, test_f1: 0.4504
 epoch: 18, train_loss: 0.9550, test_loss: 1.0594, test_f1: 0.5218
 epoch: 19, train_loss: 0.9501, test_loss: 1.0803, test_f1: 0.5199
 epoch: 20, train_loss: 0.9452, test_loss: 1.0372, test_f1: 0.4585
 epoch: 21, train_loss: 0.9408, test_loss: 1.0482, test_f1: 0.5148
 epoch: 22, train_loss: 0.9308, test_loss: 1.0686, test_f1: 0.5067
 epoch: 23, train_loss: 0.9364, test_loss: 1.0492, test_f1: 0.5093
 epoch: 24, train_loss: 0.9362, test_loss: 1.0581, test_f1: 0.5253
 epoch: 25, train_loss: 0.9338, test_loss: 1.0447, test_f1: 0.5164
 epoch: 26, train_loss: 0.9213, test_loss: 1.0507, test_f1: 0.4956
 epoch: 27, train_loss: 0.9251, test_loss: 1.0576, test_f1: 0.5042
 epoch: 28, train_loss: 0.9165, test_loss: 1.0485, test_f1: 0.5216
 epoch: 29, train_loss: 0.9092, test_loss: 1.0630, test_f1: 0.5241
 epoch: 30, train_loss: 0.9067, test_loss: 1.0454, test_f1: 0.5157
 epoch: 31, train_loss: 0.8997, test_loss: 1.0575, test_f1: 0.5022
 epoch: 32, train_loss: 0.9087, test_loss: 1.0457, test_f1: 0.4728
 epoch: 33, train_loss: 0.8941, test_loss: 1.0441, test_f1: 0.4707
 epoch: 34, train_loss: 0.8959, test_loss: 1.0372, test_f1: 0.5424
 epoch: 35, train_loss: 0.8845, test_loss: 1.0661, test_f1: 0.5318
 epoch: 36, train_loss: 0.8929, test_loss: 1.0896, test_f1: 0.5148
 epoch: 37, train_loss: 0.8733, test_loss: 1.0561, test_f1: 0.5389
 epoch: 38, train_loss: 0.8732, test_loss: 1.0539, test_f1: 0.5438
 epoch: 39, train_loss: 0.8714, test_loss: 1.0755, test_f1: 0.5492
 epoch: 40, train_loss: 0.8775, test_loss: 1.0589, test_f1: 0.5768
 epoch: 41, train_loss: 0.8578, test_loss: 1.0318, test_f1: 0.5129
 epoch: 42, train_loss: 0.8531, test_loss: 1.0351, test_f1: 0.5197
 epoch: 43, train_loss: 0.8387, test_loss: 1.0267, test_f1: 0.5778
 epoch: 44, train_loss: 0.8443, test_loss: 1.0375, test_f1: 0.5748
 epoch: 45, train_loss: 0.8496, test_loss: 1.0105, test_f1: 0.5614
 epoch: 46, train_loss: 0.8355, test_loss: 1.0286, test_f1: 0.5676
 epoch: 47, train_loss: 0.8399, test_loss: 1.0217, test_f1: 0.5971
 epoch: 48, train_loss: 0.8341, test_loss: 1.0408, test_f1: 0.4983
 epoch: 49, train_loss: 0.8265, test_loss: 1.0258, test_f1: 0.5429
 epoch: 50, train_loss: 0.8306, test_loss: 1.0425, test_f1: 0.5106
 epoch: 51, train_loss: 0.8051, test_loss: 1.0102, test_f1: 0.5851
 epoch: 52, train_loss: 0.8072, test_loss: 1.0162, test_f1: 0.5919
 epoch: 53, train_loss: 0.8053, test_loss: 1.0332, test_f1: 0.5700
 epoch: 54, train_loss: 0.7991, test_loss: 1.0242, test_f1: 0.5633
 epoch: 55, train_loss: 0.8131, test_loss: 1.0209, test_f1: 0.5965
 epoch: 56, train_loss: 0.7998, test_loss: 1.0229, test_f1: 0.5676
 epoch: 57, train_loss: 0.7914, test_loss: 1.0193, test_f1: 0.5632
 epoch: 58, train_loss: 0.7825, test_loss: 1.0214, test_f1: 0.5679
 epoch: 59, train_loss: 0.8052, test_loss: 1.0389, test_f1: 0.5690
 epoch: 60, train_loss: 0.7916, test_loss: 1.0368, test_f1: 0.6039
 epoch: 61, train_loss: 0.7906, test_loss: 1.0207, test_f1: 0.5707
 epoch: 62, train_loss: 0.7875, test_loss: 1.0128, test_f1: 0.6009
 epoch: 63, train_loss: 0.7697, test_loss: 1.0324, test_f1: 0.5980
 epoch: 64, train_loss: 0.7877, test_loss: 1.0295, test_f1: 0.5989
 epoch: 65, train_loss: 0.7740, test_loss: 1.0390, test_f1: 0.5705
 epoch: 66, train_loss: 0.7691, test_loss: 1.0186, test_f1: 0.5568
 epoch: 67, train_loss: 0.7762, test_loss: 1.0176, test_f1: 0.5850
 epoch: 68, train_loss: 0.7761, test_loss: 1.0203, test_f1: 0.5865
 epoch: 69, train_loss: 0.7608, test_loss: 1.0406, test_f1: 0.5581
 epoch: 70, train_loss: 0.7614, test_loss: 1.0239, test_f1: 0.5587
 epoch: 71, train_loss: 0.7577, test_loss: 1.0143, test_f1: 0.5521
 epoch: 72, train_loss: 0.7606, test_loss: 1.0090, test_f1: 0.5674
 epoch: 73, train_loss: 0.7582, test_loss: 0.9986, test_f1: 0.5673
 epoch: 74, train_loss: 0.7670, test_loss: 1.0005, test_f1: 0.5426
 epoch: 75, train_loss: 0.7497, test_loss: 1.0112, test_f1: 0.5586
 epoch: 76, train_loss: 0.7542, test_loss: 1.0010, test_f1: 0.5901
 epoch: 77, train_loss: 0.7509, test_loss: 1.0175, test_f1: 0.5640
 epoch: 78, train_loss: 0.7536, test_loss: 1.0365, test_f1: 0.6194
 epoch: 79, train_loss: 0.7446, test_loss: 1.0119, test_f1: 0.5808
 epoch: 80, train_loss: 0.7375, test_loss: 1.0169, test_f1: 0.5895
 epoch: 81, train_loss: 0.7525, test_loss: 1.0183, test_f1: 0.5762
 epoch: 82, train_loss: 0.7368, test_loss: 1.0223, test_f1: 0.5966
 epoch: 83, train_loss: 0.7409, test_loss: 1.0293, test_f1: 0.5900
 epoch: 84, train_loss: 0.7450, test_loss: 1.0212, test_f1: 0.5882
 epoch: 85, train_loss: 0.7415, test_loss: 1.0159, test_f1: 0.5830
 epoch: 86, train_loss: 0.7466, test_loss: 1.0160, test_f1: 0.6090
 epoch: 87, train_loss: 0.7282, test_loss: 1.0039, test_f1: 0.6014
 epoch: 88, train_loss: 0.7340, test_loss: 1.0121, test_f1: 0.6243
 epoch: 89, train_loss: 0.7391, test_loss: 1.0279, test_f1: 0.6048
 epoch: 90, train_loss: 0.7414, test_loss: 1.0054, test_f1: 0.5540
 epoch: 91, train_loss: 0.7315, test_loss: 1.0364, test_f1: 0.6167
 epoch: 92, train_loss: 0.7360, test_loss: 1.0258, test_f1: 0.6197
 epoch: 93, train_loss: 0.7145, test_loss: 1.0246, test_f1: 0.5530
 epoch: 94, train_loss: 0.7259, test_loss: 1.0218, test_f1: 0.5821
 epoch: 95, train_loss: 0.7147, test_loss: 1.0315, test_f1: 0.5943
 epoch: 96, train_loss: 0.7339, test_loss: 1.0136, test_f1: 0.5699
 epoch: 97, train_loss: 0.7397, test_loss: 1.0379, test_f1: 0.5661
 epoch: 98, train_loss: 0.7323, test_loss: 1.0163, test_f1: 0.6108
 epoch: 99, train_loss: 0.7226, test_loss: 1.0120, test_f1: 0.5799
##################ITERATION #3 ****************************************
 epoch: 0, train_loss: 1.3399, test_loss: 1.2946, test_f1: 0.2281
 epoch: 1, train_loss: 1.2080, test_loss: 1.3078, test_f1: 0.2281
 epoch: 2, train_loss: 1.1696, test_loss: 1.3275, test_f1: 0.2281
 epoch: 3, train_loss: 1.1581, test_loss: 1.2713, test_f1: 0.2270
 epoch: 4, train_loss: 1.1140, test_loss: 1.2172, test_f1: 0.3682
 epoch: 5, train_loss: 1.1082, test_loss: 1.1706, test_f1: 0.4229
 epoch: 6, train_loss: 1.0809, test_loss: 1.1315, test_f1: 0.4614
 epoch: 7, train_loss: 1.0776, test_loss: 1.1150, test_f1: 0.4606
 epoch: 8, train_loss: 1.0443, test_loss: 1.1027, test_f1: 0.4817
 epoch: 9, train_loss: 1.0449, test_loss: 1.0953, test_f1: 0.4962
 epoch: 10, train_loss: 1.0281, test_loss: 1.0778, test_f1: 0.5117
 epoch: 11, train_loss: 1.0155, test_loss: 1.0757, test_f1: 0.5084
 epoch: 12, train_loss: 0.9913, test_loss: 1.0713, test_f1: 0.5065
 epoch: 13, train_loss: 0.9850, test_loss: 1.0659, test_f1: 0.5120
 epoch: 14, train_loss: 0.9874, test_loss: 1.0645, test_f1: 0.5010
 epoch: 15, train_loss: 0.9782, test_loss: 1.0661, test_f1: 0.5222
 epoch: 16, train_loss: 0.9711, test_loss: 1.0595, test_f1: 0.5105
 epoch: 17, train_loss: 0.9723, test_loss: 1.0610, test_f1: 0.5049
 epoch: 18, train_loss: 0.9618, test_loss: 1.0678, test_f1: 0.5098
 epoch: 19, train_loss: 0.9500, test_loss: 1.0519, test_f1: 0.5231
 epoch: 20, train_loss: 0.9515, test_loss: 1.0375, test_f1: 0.5266
 epoch: 21, train_loss: 0.9432, test_loss: 1.0377, test_f1: 0.5277
 epoch: 22, train_loss: 0.9405, test_loss: 1.0343, test_f1: 0.5292
 epoch: 23, train_loss: 0.9265, test_loss: 1.0245, test_f1: 0.5141
 epoch: 24, train_loss: 0.9306, test_loss: 1.0301, test_f1: 0.5239
 epoch: 25, train_loss: 0.9292, test_loss: 1.0311, test_f1: 0.5443
 epoch: 26, train_loss: 0.9186, test_loss: 1.0297, test_f1: 0.5456
 epoch: 27, train_loss: 0.9066, test_loss: 1.0157, test_f1: 0.5540
 epoch: 28, train_loss: 0.9151, test_loss: 1.0161, test_f1: 0.5291
 epoch: 29, train_loss: 0.9115, test_loss: 1.0257, test_f1: 0.5278
 epoch: 30, train_loss: 0.9074, test_loss: 1.0066, test_f1: 0.5407
 epoch: 31, train_loss: 0.8942, test_loss: 1.0120, test_f1: 0.5445
 epoch: 32, train_loss: 0.8917, test_loss: 1.0096, test_f1: 0.5355
 epoch: 33, train_loss: 0.8970, test_loss: 1.0057, test_f1: 0.5500
 epoch: 34, train_loss: 0.8786, test_loss: 1.0038, test_f1: 0.5546
 epoch: 35, train_loss: 0.8855, test_loss: 1.0090, test_f1: 0.5563
 epoch: 36, train_loss: 0.8826, test_loss: 0.9982, test_f1: 0.5291
 epoch: 37, train_loss: 0.8748, test_loss: 0.9925, test_f1: 0.5577
 epoch: 38, train_loss: 0.8860, test_loss: 0.9971, test_f1: 0.5581
 epoch: 39, train_loss: 0.8641, test_loss: 1.0026, test_f1: 0.5678
 epoch: 40, train_loss: 0.8635, test_loss: 1.0090, test_f1: 0.5467
 epoch: 41, train_loss: 0.8672, test_loss: 0.9971, test_f1: 0.5518
 epoch: 42, train_loss: 0.8560, test_loss: 0.9963, test_f1: 0.5423
 epoch: 43, train_loss: 0.8575, test_loss: 0.9965, test_f1: 0.5882
 epoch: 44, train_loss: 0.8533, test_loss: 0.9855, test_f1: 0.5720
 epoch: 45, train_loss: 0.8664, test_loss: 0.9917, test_f1: 0.5715
 epoch: 46, train_loss: 0.8493, test_loss: 1.0084, test_f1: 0.5759
 epoch: 47, train_loss: 0.8444, test_loss: 0.9951, test_f1: 0.5855
 epoch: 48, train_loss: 0.8470, test_loss: 0.9788, test_f1: 0.5992
 epoch: 49, train_loss: 0.8451, test_loss: 0.9931, test_f1: 0.5869
 epoch: 50, train_loss: 0.8369, test_loss: 0.9941, test_f1: 0.5666
 epoch: 51, train_loss: 0.8262, test_loss: 0.9963, test_f1: 0.5870
 epoch: 52, train_loss: 0.8278, test_loss: 0.9928, test_f1: 0.6029
 epoch: 53, train_loss: 0.8210, test_loss: 0.9886, test_f1: 0.6082
 epoch: 54, train_loss: 0.8081, test_loss: 0.9871, test_f1: 0.5937
 epoch: 55, train_loss: 0.8081, test_loss: 0.9833, test_f1: 0.5942
 epoch: 56, train_loss: 0.8195, test_loss: 0.9910, test_f1: 0.5982
 epoch: 57, train_loss: 0.8126, test_loss: 1.0010, test_f1: 0.5930
 epoch: 58, train_loss: 0.8082, test_loss: 0.9813, test_f1: 0.6020
 epoch: 59, train_loss: 0.8140, test_loss: 0.9810, test_f1: 0.6134
 epoch: 60, train_loss: 0.8023, test_loss: 0.9782, test_f1: 0.5997
 epoch: 61, train_loss: 0.8048, test_loss: 0.9911, test_f1: 0.5842
 epoch: 62, train_loss: 0.8081, test_loss: 0.9760, test_f1: 0.6000
 epoch: 63, train_loss: 0.8052, test_loss: 0.9751, test_f1: 0.6027
 epoch: 64, train_loss: 0.8039, test_loss: 0.9736, test_f1: 0.6049
 epoch: 65, train_loss: 0.7967, test_loss: 0.9927, test_f1: 0.5979
 epoch: 66, train_loss: 0.8122, test_loss: 0.9944, test_f1: 0.6100
 epoch: 67, train_loss: 0.7964, test_loss: 0.9829, test_f1: 0.6215
 epoch: 68, train_loss: 0.7987, test_loss: 0.9800, test_f1: 0.6069
 epoch: 69, train_loss: 0.7901, test_loss: 0.9975, test_f1: 0.5911
 epoch: 70, train_loss: 0.7841, test_loss: 0.9859, test_f1: 0.6051
 epoch: 71, train_loss: 0.7722, test_loss: 0.9921, test_f1: 0.5889
 epoch: 72, train_loss: 0.7871, test_loss: 0.9990, test_f1: 0.6065
 epoch: 73, train_loss: 0.7854, test_loss: 0.9849, test_f1: 0.6035
 epoch: 74, train_loss: 0.7780, test_loss: 1.0116, test_f1: 0.6007
 epoch: 75, train_loss: 0.7677, test_loss: 0.9966, test_f1: 0.5772
 epoch: 76, train_loss: 0.7651, test_loss: 0.9950, test_f1: 0.5901
 epoch: 77, train_loss: 0.7711, test_loss: 0.9935, test_f1: 0.5916
 epoch: 78, train_loss: 0.7691, test_loss: 0.9932, test_f1: 0.5963
 epoch: 79, train_loss: 0.7800, test_loss: 1.0025, test_f1: 0.6023
 epoch: 80, train_loss: 0.7621, test_loss: 0.9826, test_f1: 0.5850
 epoch: 81, train_loss: 0.7752, test_loss: 0.9897, test_f1: 0.5931
 epoch: 82, train_loss: 0.7604, test_loss: 0.9841, test_f1: 0.5994
 epoch: 83, train_loss: 0.7525, test_loss: 0.9834, test_f1: 0.6055
 epoch: 84, train_loss: 0.7599, test_loss: 1.0034, test_f1: 0.5847
 epoch: 85, train_loss: 0.7608, test_loss: 1.0002, test_f1: 0.5839
 epoch: 86, train_loss: 0.7630, test_loss: 1.0002, test_f1: 0.5968
 epoch: 87, train_loss: 0.7878, test_loss: 1.0829, test_f1: 0.5612
 epoch: 88, train_loss: 0.7613, test_loss: 1.0300, test_f1: 0.6014
 epoch: 89, train_loss: 0.7634, test_loss: 1.0219, test_f1: 0.5785
 epoch: 90, train_loss: 0.7535, test_loss: 1.0302, test_f1: 0.5665
 epoch: 91, train_loss: 0.7415, test_loss: 1.0031, test_f1: 0.6024
 epoch: 92, train_loss: 0.7544, test_loss: 1.0180, test_f1: 0.5999
 epoch: 93, train_loss: 0.7518, test_loss: 1.0360, test_f1: 0.5792
 epoch: 94, train_loss: 0.7364, test_loss: 1.0376, test_f1: 0.5885
 epoch: 95, train_loss: 0.7469, test_loss: 1.0207, test_f1: 0.6084
 epoch: 96, train_loss: 0.7471, test_loss: 1.0562, test_f1: 0.5837
 epoch: 97, train_loss: 0.7538, test_loss: 1.0287, test_f1: 0.5916
 epoch: 98, train_loss: 0.7319, test_loss: 1.0338, test_f1: 0.5919
 epoch: 99, train_loss: 0.7532, test_loss: 1.0758, test_f1: 0.5765
##################ITERATION #4 ****************************************
 epoch: 0, train_loss: 1.2332, test_loss: 1.3210, test_f1: 0.2281
 epoch: 1, train_loss: 1.1514, test_loss: 1.3294, test_f1: 0.2281
 epoch: 2, train_loss: 1.1085, test_loss: 1.2818, test_f1: 0.2281
 epoch: 3, train_loss: 1.0866, test_loss: 1.1974, test_f1: 0.2718
 epoch: 4, train_loss: 1.0682, test_loss: 1.1626, test_f1: 0.3322
 epoch: 5, train_loss: 1.0561, test_loss: 1.1525, test_f1: 0.3614
 epoch: 6, train_loss: 1.0463, test_loss: 1.1347, test_f1: 0.3833
 epoch: 7, train_loss: 1.0347, test_loss: 1.1087, test_f1: 0.4560
 epoch: 8, train_loss: 1.0195, test_loss: 1.1070, test_f1: 0.4532
 epoch: 9, train_loss: 0.9996, test_loss: 1.0991, test_f1: 0.4641
 epoch: 10, train_loss: 1.0039, test_loss: 1.0899, test_f1: 0.5017
 epoch: 11, train_loss: 0.9902, test_loss: 1.0879, test_f1: 0.5157
 epoch: 12, train_loss: 0.9859, test_loss: 1.0710, test_f1: 0.5067
 epoch: 13, train_loss: 0.9737, test_loss: 1.0713, test_f1: 0.5102
 epoch: 14, train_loss: 0.9668, test_loss: 1.0694, test_f1: 0.5088
 epoch: 15, train_loss: 0.9663, test_loss: 1.0669, test_f1: 0.5117
 epoch: 16, train_loss: 0.9694, test_loss: 1.0674, test_f1: 0.5239
 epoch: 17, train_loss: 0.9594, test_loss: 1.0532, test_f1: 0.5229
 epoch: 18, train_loss: 0.9459, test_loss: 1.0570, test_f1: 0.5519
 epoch: 19, train_loss: 0.9619, test_loss: 1.0687, test_f1: 0.5386
 epoch: 20, train_loss: 0.9446, test_loss: 1.0440, test_f1: 0.5282
 epoch: 21, train_loss: 0.9399, test_loss: 1.0411, test_f1: 0.5391
 epoch: 22, train_loss: 0.9341, test_loss: 1.0415, test_f1: 0.5421
 epoch: 23, train_loss: 0.9353, test_loss: 1.0432, test_f1: 0.5230
 epoch: 24, train_loss: 0.9320, test_loss: 1.0424, test_f1: 0.5492
 epoch: 25, train_loss: 0.9358, test_loss: 1.0453, test_f1: 0.5438
 epoch: 26, train_loss: 0.9373, test_loss: 1.0592, test_f1: 0.5558
 epoch: 27, train_loss: 0.9350, test_loss: 1.0505, test_f1: 0.5224
 epoch: 28, train_loss: 0.9235, test_loss: 1.0493, test_f1: 0.5414
 epoch: 29, train_loss: 0.9237, test_loss: 1.0416, test_f1: 0.5529
 epoch: 30, train_loss: 0.9098, test_loss: 1.0426, test_f1: 0.5541
 epoch: 31, train_loss: 0.9173, test_loss: 1.0436, test_f1: 0.5462
 epoch: 32, train_loss: 0.9092, test_loss: 1.0370, test_f1: 0.5487
 epoch: 33, train_loss: 0.9154, test_loss: 1.0409, test_f1: 0.5636
 epoch: 34, train_loss: 0.9114, test_loss: 1.0521, test_f1: 0.5449
 epoch: 35, train_loss: 0.9095, test_loss: 1.0541, test_f1: 0.5373
 epoch: 36, train_loss: 0.9207, test_loss: 1.0336, test_f1: 0.5582
 epoch: 37, train_loss: 0.9201, test_loss: 1.0416, test_f1: 0.5472
 epoch: 38, train_loss: 0.9039, test_loss: 1.0369, test_f1: 0.5421
 epoch: 39, train_loss: 0.9000, test_loss: 1.0419, test_f1: 0.5551
 epoch: 40, train_loss: 0.8984, test_loss: 1.0426, test_f1: 0.5461
 epoch: 41, train_loss: 0.8900, test_loss: 1.0476, test_f1: 0.5564
 epoch: 42, train_loss: 0.8850, test_loss: 1.0399, test_f1: 0.5580
 epoch: 43, train_loss: 0.8811, test_loss: 1.0331, test_f1: 0.5580
 epoch: 44, train_loss: 0.8825, test_loss: 1.0259, test_f1: 0.5555
 epoch: 45, train_loss: 0.8753, test_loss: 1.0227, test_f1: 0.5481
 epoch: 46, train_loss: 0.8729, test_loss: 1.0570, test_f1: 0.5418
 epoch: 47, train_loss: 0.8817, test_loss: 1.0600, test_f1: 0.5252
 epoch: 48, train_loss: 0.8730, test_loss: 1.0196, test_f1: 0.5565
 epoch: 49, train_loss: 0.8701, test_loss: 1.0218, test_f1: 0.5614
 epoch: 50, train_loss: 0.8762, test_loss: 1.0638, test_f1: 0.5294
 epoch: 51, train_loss: 0.8833, test_loss: 1.0322, test_f1: 0.5524
 epoch: 52, train_loss: 0.8637, test_loss: 1.0349, test_f1: 0.5475
 epoch: 53, train_loss: 0.8630, test_loss: 1.0318, test_f1: 0.5549
 epoch: 54, train_loss: 0.8539, test_loss: 1.0457, test_f1: 0.5535
 epoch: 55, train_loss: 0.8471, test_loss: 1.0271, test_f1: 0.5661
 epoch: 56, train_loss: 0.8549, test_loss: 1.0318, test_f1: 0.5655
 epoch: 57, train_loss: 0.8585, test_loss: 1.0501, test_f1: 0.5696
 epoch: 58, train_loss: 0.8581, test_loss: 1.0412, test_f1: 0.5519
 epoch: 59, train_loss: 0.8445, test_loss: 1.0346, test_f1: 0.5549
 epoch: 60, train_loss: 0.8373, test_loss: 1.0831, test_f1: 0.5587
 epoch: 61, train_loss: 0.8598, test_loss: 1.0613, test_f1: 0.5522
 epoch: 62, train_loss: 0.8443, test_loss: 1.0315, test_f1: 0.5716
 epoch: 63, train_loss: 0.8433, test_loss: 1.0509, test_f1: 0.5426
 epoch: 64, train_loss: 0.8458, test_loss: 1.0530, test_f1: 0.5340
 epoch: 65, train_loss: 0.8562, test_loss: 1.0278, test_f1: 0.5504
 epoch: 66, train_loss: 0.8428, test_loss: 1.0396, test_f1: 0.5445
 epoch: 67, train_loss: 0.8450, test_loss: 1.0337, test_f1: 0.5425
 epoch: 68, train_loss: 0.8275, test_loss: 1.0419, test_f1: 0.5638
 epoch: 69, train_loss: 0.8369, test_loss: 1.0380, test_f1: 0.5547
 epoch: 70, train_loss: 0.8410, test_loss: 1.0345, test_f1: 0.5532
 epoch: 71, train_loss: 0.8344, test_loss: 1.0346, test_f1: 0.5593
 epoch: 72, train_loss: 0.8239, test_loss: 1.0686, test_f1: 0.5498
 epoch: 73, train_loss: 0.8371, test_loss: 1.0289, test_f1: 0.5566
 epoch: 74, train_loss: 0.8237, test_loss: 1.0197, test_f1: 0.5428
 epoch: 75, train_loss: 0.8405, test_loss: 1.0096, test_f1: 0.5592
 epoch: 76, train_loss: 0.8257, test_loss: 1.0133, test_f1: 0.5513
 epoch: 77, train_loss: 0.8309, test_loss: 1.0377, test_f1: 0.5393
 epoch: 78, train_loss: 0.8195, test_loss: 1.0342, test_f1: 0.5674
 epoch: 79, train_loss: 0.8379, test_loss: 1.0368, test_f1: 0.5621
 epoch: 80, train_loss: 0.8234, test_loss: 1.0278, test_f1: 0.5504
 epoch: 81, train_loss: 0.8263, test_loss: 1.0326, test_f1: 0.5611
 epoch: 82, train_loss: 0.8267, test_loss: 1.0125, test_f1: 0.5667
 epoch: 83, train_loss: 0.8254, test_loss: 1.0226, test_f1: 0.5653
 epoch: 84, train_loss: 0.8129, test_loss: 1.0351, test_f1: 0.5539
 epoch: 85, train_loss: 0.8141, test_loss: 1.0514, test_f1: 0.5503
 epoch: 86, train_loss: 0.8067, test_loss: 1.0246, test_f1: 0.5724
 epoch: 87, train_loss: 0.8114, test_loss: 1.0342, test_f1: 0.5732
 epoch: 88, train_loss: 0.8147, test_loss: 1.0343, test_f1: 0.5649
 epoch: 89, train_loss: 0.8219, test_loss: 1.0180, test_f1: 0.5649
 epoch: 90, train_loss: 0.8078, test_loss: 1.0529, test_f1: 0.5488
 epoch: 91, train_loss: 0.8133, test_loss: 1.0180, test_f1: 0.5620
 epoch: 92, train_loss: 0.8098, test_loss: 1.0250, test_f1: 0.5781
 epoch: 93, train_loss: 0.8156, test_loss: 1.0100, test_f1: 0.5819
 epoch: 94, train_loss: 0.8017, test_loss: 1.0062, test_f1: 0.5848
 epoch: 95, train_loss: 0.8032, test_loss: 1.0166, test_f1: 0.5553
 epoch: 96, train_loss: 0.7945, test_loss: 1.0432, test_f1: 0.5573
 epoch: 97, train_loss: 0.7960, test_loss: 1.0482, test_f1: 0.5543
 epoch: 98, train_loss: 0.8051, test_loss: 1.0260, test_f1: 0.5526
 epoch: 99, train_loss: 0.8004, test_loss: 1.0253, test_f1: 0.5683
##################ITERATION #5 ****************************************
 epoch: 0, train_loss: 1.4834, test_loss: 1.6072, test_f1: 0.0507
 epoch: 1, train_loss: 1.2609, test_loss: 1.5247, test_f1: 0.0507
 epoch: 2, train_loss: 1.1907, test_loss: 1.4051, test_f1: 0.2375
 epoch: 3, train_loss: 1.1555, test_loss: 1.3549, test_f1: 0.2371
 epoch: 4, train_loss: 1.1025, test_loss: 1.2637, test_f1: 0.2514
 epoch: 5, train_loss: 1.0963, test_loss: 1.1812, test_f1: 0.3603
 epoch: 6, train_loss: 1.0635, test_loss: 1.1197, test_f1: 0.3966
 epoch: 7, train_loss: 1.0434, test_loss: 1.0983, test_f1: 0.3971
 epoch: 8, train_loss: 1.0317, test_loss: 1.0968, test_f1: 0.4424
 epoch: 9, train_loss: 1.0270, test_loss: 1.0921, test_f1: 0.4685
 epoch: 10, train_loss: 1.0137, test_loss: 1.0770, test_f1: 0.4757
 epoch: 11, train_loss: 1.0155, test_loss: 1.0738, test_f1: 0.4717
 epoch: 12, train_loss: 1.0060, test_loss: 1.0767, test_f1: 0.4797
 epoch: 13, train_loss: 0.9927, test_loss: 1.0683, test_f1: 0.4785
 epoch: 14, train_loss: 0.9925, test_loss: 1.0673, test_f1: 0.4878
 epoch: 15, train_loss: 0.9852, test_loss: 1.0641, test_f1: 0.4850
 epoch: 16, train_loss: 0.9808, test_loss: 1.0738, test_f1: 0.4908
 epoch: 17, train_loss: 0.9699, test_loss: 1.0681, test_f1: 0.4911
 epoch: 18, train_loss: 0.9720, test_loss: 1.0698, test_f1: 0.4984
 epoch: 19, train_loss: 0.9649, test_loss: 1.0456, test_f1: 0.5186
 epoch: 20, train_loss: 0.9538, test_loss: 1.0535, test_f1: 0.5114
 epoch: 21, train_loss: 0.9407, test_loss: 1.0484, test_f1: 0.4906
 epoch: 22, train_loss: 0.9531, test_loss: 1.0564, test_f1: 0.5268
 epoch: 23, train_loss: 0.9361, test_loss: 1.0572, test_f1: 0.5065
 epoch: 24, train_loss: 0.9321, test_loss: 1.0564, test_f1: 0.5108
 epoch: 25, train_loss: 0.9326, test_loss: 1.0456, test_f1: 0.5319
 epoch: 26, train_loss: 0.9219, test_loss: 1.0491, test_f1: 0.5205
 epoch: 27, train_loss: 0.9299, test_loss: 1.0513, test_f1: 0.5288
 epoch: 28, train_loss: 0.9054, test_loss: 1.0621, test_f1: 0.5223
 epoch: 29, train_loss: 0.9158, test_loss: 1.0560, test_f1: 0.5132
 epoch: 30, train_loss: 0.8930, test_loss: 1.0503, test_f1: 0.5291
 epoch: 31, train_loss: 0.9087, test_loss: 1.0364, test_f1: 0.5099
 epoch: 32, train_loss: 0.9091, test_loss: 1.0357, test_f1: 0.5188
 epoch: 33, train_loss: 0.9072, test_loss: 1.0240, test_f1: 0.5199
 epoch: 34, train_loss: 0.9101, test_loss: 1.0299, test_f1: 0.5614
 epoch: 35, train_loss: 0.8869, test_loss: 1.0345, test_f1: 0.5531
 epoch: 36, train_loss: 0.8862, test_loss: 1.0521, test_f1: 0.5396
 epoch: 37, train_loss: 0.8873, test_loss: 1.0561, test_f1: 0.5429
 epoch: 38, train_loss: 0.8871, test_loss: 1.0279, test_f1: 0.5407
 epoch: 39, train_loss: 0.8761, test_loss: 1.0327, test_f1: 0.5102
 epoch: 40, train_loss: 0.8688, test_loss: 1.0382, test_f1: 0.5295
 epoch: 41, train_loss: 0.8698, test_loss: 1.0394, test_f1: 0.5596
 epoch: 42, train_loss: 0.8776, test_loss: 1.0369, test_f1: 0.5476
 epoch: 43, train_loss: 0.8619, test_loss: 1.0249, test_f1: 0.5426
 epoch: 44, train_loss: 0.8598, test_loss: 1.0311, test_f1: 0.5323
 epoch: 45, train_loss: 0.8583, test_loss: 1.0241, test_f1: 0.5495
 epoch: 46, train_loss: 0.8424, test_loss: 1.0298, test_f1: 0.5386
 epoch: 47, train_loss: 0.8750, test_loss: 1.2126, test_f1: 0.5200
 epoch: 48, train_loss: 0.8522, test_loss: 1.0205, test_f1: 0.5496
 epoch: 49, train_loss: 0.8426, test_loss: 1.0662, test_f1: 0.5126
 epoch: 50, train_loss: 0.8410, test_loss: 1.0417, test_f1: 0.5311
 epoch: 51, train_loss: 0.8363, test_loss: 1.0443, test_f1: 0.5470
 epoch: 52, train_loss: 0.8255, test_loss: 1.0333, test_f1: 0.5400
 epoch: 53, train_loss: 0.8156, test_loss: 1.0391, test_f1: 0.5308
 epoch: 54, train_loss: 0.8105, test_loss: 1.0643, test_f1: 0.5193
 epoch: 55, train_loss: 0.8196, test_loss: 1.0319, test_f1: 0.5478
 epoch: 56, train_loss: 0.8119, test_loss: 1.0288, test_f1: 0.5365
 epoch: 57, train_loss: 0.8274, test_loss: 1.0317, test_f1: 0.5372
 epoch: 58, train_loss: 0.8178, test_loss: 1.0373, test_f1: 0.5316
 epoch: 59, train_loss: 0.8114, test_loss: 1.0271, test_f1: 0.5381
 epoch: 60, train_loss: 0.7975, test_loss: 1.0304, test_f1: 0.5200
 epoch: 61, train_loss: 0.7921, test_loss: 1.0516, test_f1: 0.5063
 epoch: 62, train_loss: 0.7891, test_loss: 1.0239, test_f1: 0.5469
 epoch: 63, train_loss: 0.7914, test_loss: 1.0294, test_f1: 0.5728
 epoch: 64, train_loss: 0.7811, test_loss: 1.0304, test_f1: 0.5299
 epoch: 65, train_loss: 0.7851, test_loss: 1.0201, test_f1: 0.5365
 epoch: 66, train_loss: 0.7744, test_loss: 1.0399, test_f1: 0.5661
 epoch: 67, train_loss: 0.7738, test_loss: 1.0487, test_f1: 0.5258
 epoch: 68, train_loss: 0.7680, test_loss: 1.0225, test_f1: 0.5494
 epoch: 69, train_loss: 0.7728, test_loss: 1.0270, test_f1: 0.5369
 epoch: 70, train_loss: 0.7753, test_loss: 1.0434, test_f1: 0.5465
 epoch: 71, train_loss: 0.7877, test_loss: 1.0485, test_f1: 0.5505
 epoch: 72, train_loss: 0.7710, test_loss: 1.0202, test_f1: 0.5696
 epoch: 73, train_loss: 0.7592, test_loss: 1.0605, test_f1: 0.5475
 epoch: 74, train_loss: 0.7525, test_loss: 1.0178, test_f1: 0.5642
 epoch: 75, train_loss: 0.7452, test_loss: 1.0251, test_f1: 0.5546
 epoch: 76, train_loss: 0.7589, test_loss: 1.0390, test_f1: 0.5532
 epoch: 77, train_loss: 0.7401, test_loss: 1.0268, test_f1: 0.5853
 epoch: 78, train_loss: 0.7353, test_loss: 1.0408, test_f1: 0.5438
 epoch: 79, train_loss: 0.7481, test_loss: 1.0600, test_f1: 0.5483
 epoch: 80, train_loss: 0.7449, test_loss: 1.0507, test_f1: 0.5545
 epoch: 81, train_loss: 0.7409, test_loss: 1.0617, test_f1: 0.5157
 epoch: 82, train_loss: 0.7408, test_loss: 1.0187, test_f1: 0.5815
 epoch: 83, train_loss: 0.7349, test_loss: 1.0177, test_f1: 0.5687
 epoch: 84, train_loss: 0.7242, test_loss: 1.0342, test_f1: 0.5626
 epoch: 85, train_loss: 0.7190, test_loss: 1.0333, test_f1: 0.5591
 epoch: 86, train_loss: 0.7425, test_loss: 1.0133, test_f1: 0.5641
 epoch: 87, train_loss: 0.7362, test_loss: 1.0658, test_f1: 0.5494
 epoch: 88, train_loss: 0.7478, test_loss: 1.0256, test_f1: 0.5532
 epoch: 89, train_loss: 0.7230, test_loss: 1.0049, test_f1: 0.5448
 epoch: 90, train_loss: 0.7179, test_loss: 1.0314, test_f1: 0.5526
 epoch: 91, train_loss: 0.7250, test_loss: 1.0352, test_f1: 0.5492
 epoch: 92, train_loss: 0.7413, test_loss: 1.0159, test_f1: 0.5440
 epoch: 93, train_loss: 0.7259, test_loss: 1.0069, test_f1: 0.5682
 epoch: 94, train_loss: 0.7147, test_loss: 1.0063, test_f1: 0.5768
 epoch: 95, train_loss: 0.7086, test_loss: 1.0087, test_f1: 0.5821
 epoch: 96, train_loss: 0.7170, test_loss: 1.0383, test_f1: 0.5711
 epoch: 97, train_loss: 0.7078, test_loss: 1.0054, test_f1: 0.5687
 epoch: 98, train_loss: 0.6955, test_loss: 1.0430, test_f1: 0.5924
 epoch: 99, train_loss: 0.6866, test_loss: 1.0445, test_f1: 0.5645
##################ITERATION #6 ****************************************
 epoch: 0, train_loss: 1.3124, test_loss: 1.3442, test_f1: 0.2281
 epoch: 1, train_loss: 1.1780, test_loss: 1.3412, test_f1: 0.2281
 epoch: 2, train_loss: 1.1305, test_loss: 1.3615, test_f1: 0.2816
 epoch: 3, train_loss: 1.1045, test_loss: 1.2891, test_f1: 0.2826
 epoch: 4, train_loss: 1.0787, test_loss: 1.2017, test_f1: 0.3796
 epoch: 5, train_loss: 1.0604, test_loss: 1.1492, test_f1: 0.4486
 epoch: 6, train_loss: 1.0473, test_loss: 1.1105, test_f1: 0.4553
 epoch: 7, train_loss: 1.0258, test_loss: 1.1042, test_f1: 0.4794
 epoch: 8, train_loss: 1.0369, test_loss: 1.0893, test_f1: 0.4947
 epoch: 9, train_loss: 1.0052, test_loss: 1.0906, test_f1: 0.4900
 epoch: 10, train_loss: 1.0053, test_loss: 1.0769, test_f1: 0.5115
 epoch: 11, train_loss: 0.9930, test_loss: 1.0733, test_f1: 0.5138
 epoch: 12, train_loss: 0.9859, test_loss: 1.0705, test_f1: 0.5122
 epoch: 13, train_loss: 0.9800, test_loss: 1.0513, test_f1: 0.5073
 epoch: 14, train_loss: 0.9820, test_loss: 1.0450, test_f1: 0.5138
 epoch: 15, train_loss: 0.9732, test_loss: 1.0500, test_f1: 0.4982
 epoch: 16, train_loss: 0.9759, test_loss: 1.0514, test_f1: 0.5004
 epoch: 17, train_loss: 0.9576, test_loss: 1.0488, test_f1: 0.5174
 epoch: 18, train_loss: 0.9672, test_loss: 1.0321, test_f1: 0.5308
 epoch: 19, train_loss: 0.9705, test_loss: 1.0397, test_f1: 0.5153
 epoch: 20, train_loss: 0.9688, test_loss: 1.0345, test_f1: 0.5156
 epoch: 21, train_loss: 0.9431, test_loss: 1.0286, test_f1: 0.5210
 epoch: 22, train_loss: 0.9446, test_loss: 1.0329, test_f1: 0.5129
 epoch: 23, train_loss: 0.9403, test_loss: 1.0263, test_f1: 0.5136
 epoch: 24, train_loss: 0.9346, test_loss: 1.0331, test_f1: 0.5082
 epoch: 25, train_loss: 0.9359, test_loss: 1.0442, test_f1: 0.4952
 epoch: 26, train_loss: 0.9331, test_loss: 1.0221, test_f1: 0.5249
 epoch: 27, train_loss: 0.9354, test_loss: 1.0288, test_f1: 0.5395
 epoch: 28, train_loss: 0.9268, test_loss: 1.0181, test_f1: 0.5459
 epoch: 29, train_loss: 0.9227, test_loss: 1.0392, test_f1: 0.5189
 epoch: 30, train_loss: 0.9107, test_loss: 1.0132, test_f1: 0.5465
 epoch: 31, train_loss: 0.9157, test_loss: 1.0225, test_f1: 0.5408
 epoch: 32, train_loss: 0.9208, test_loss: 1.0033, test_f1: 0.5287
 epoch: 33, train_loss: 0.9131, test_loss: 0.9985, test_f1: 0.5376
 epoch: 34, train_loss: 0.8929, test_loss: 0.9905, test_f1: 0.5546
 epoch: 35, train_loss: 0.9043, test_loss: 1.0073, test_f1: 0.5477
 epoch: 36, train_loss: 0.8872, test_loss: 0.9972, test_f1: 0.5288
 epoch: 37, train_loss: 0.8970, test_loss: 0.9918, test_f1: 0.5374
 epoch: 38, train_loss: 0.8810, test_loss: 0.9985, test_f1: 0.5386
 epoch: 39, train_loss: 0.8916, test_loss: 0.9851, test_f1: 0.5610
 epoch: 40, train_loss: 0.8778, test_loss: 0.9853, test_f1: 0.5393
 epoch: 41, train_loss: 0.8866, test_loss: 0.9980, test_f1: 0.5585
 epoch: 42, train_loss: 0.8701, test_loss: 0.9856, test_f1: 0.5586
 epoch: 43, train_loss: 0.8668, test_loss: 1.0020, test_f1: 0.5288
 epoch: 44, train_loss: 0.8618, test_loss: 0.9865, test_f1: 0.5636
 epoch: 45, train_loss: 0.8582, test_loss: 0.9791, test_f1: 0.5619
 epoch: 46, train_loss: 0.8499, test_loss: 0.9981, test_f1: 0.5365
 epoch: 47, train_loss: 0.8569, test_loss: 0.9757, test_f1: 0.5981
 epoch: 48, train_loss: 0.8573, test_loss: 0.9825, test_f1: 0.5794
 epoch: 49, train_loss: 0.8481, test_loss: 0.9932, test_f1: 0.5647
 epoch: 50, train_loss: 0.8352, test_loss: 1.0288, test_f1: 0.5451
 epoch: 51, train_loss: 0.8377, test_loss: 0.9795, test_f1: 0.5662
 epoch: 52, train_loss: 0.8288, test_loss: 0.9807, test_f1: 0.5666
 epoch: 53, train_loss: 0.8171, test_loss: 0.9865, test_f1: 0.5820
 epoch: 54, train_loss: 0.8203, test_loss: 0.9767, test_f1: 0.5770
 epoch: 55, train_loss: 0.8087, test_loss: 0.9774, test_f1: 0.5764
 epoch: 56, train_loss: 0.8252, test_loss: 0.9927, test_f1: 0.5726
 epoch: 57, train_loss: 0.8202, test_loss: 0.9890, test_f1: 0.5820
 epoch: 58, train_loss: 0.8052, test_loss: 0.9770, test_f1: 0.5911
 epoch: 59, train_loss: 0.8118, test_loss: 0.9823, test_f1: 0.5780
 epoch: 60, train_loss: 0.8132, test_loss: 0.9826, test_f1: 0.5915
 epoch: 61, train_loss: 0.8000, test_loss: 0.9909, test_f1: 0.5837
 epoch: 62, train_loss: 0.8031, test_loss: 0.9867, test_f1: 0.5740
 epoch: 63, train_loss: 0.8085, test_loss: 0.9843, test_f1: 0.5836
 epoch: 64, train_loss: 0.8093, test_loss: 0.9967, test_f1: 0.5791
 epoch: 65, train_loss: 0.8122, test_loss: 0.9986, test_f1: 0.5461
 epoch: 66, train_loss: 0.7972, test_loss: 0.9874, test_f1: 0.5883
 epoch: 67, train_loss: 0.7980, test_loss: 0.9861, test_f1: 0.5901
 epoch: 68, train_loss: 0.7971, test_loss: 0.9807, test_f1: 0.6013
 epoch: 69, train_loss: 0.7938, test_loss: 0.9984, test_f1: 0.5847
 epoch: 70, train_loss: 0.8053, test_loss: 0.9953, test_f1: 0.5971
 epoch: 71, train_loss: 0.7885, test_loss: 0.9724, test_f1: 0.5691
 epoch: 72, train_loss: 0.7885, test_loss: 0.9838, test_f1: 0.5884
 epoch: 73, train_loss: 0.7917, test_loss: 0.9870, test_f1: 0.6026
 epoch: 74, train_loss: 0.7786, test_loss: 0.9874, test_f1: 0.5957
 epoch: 75, train_loss: 0.7909, test_loss: 0.9829, test_f1: 0.5854
 epoch: 76, train_loss: 0.7800, test_loss: 0.9930, test_f1: 0.5996
 epoch: 77, train_loss: 0.7955, test_loss: 0.9900, test_f1: 0.6044
 epoch: 78, train_loss: 0.7765, test_loss: 0.9867, test_f1: 0.5885
 epoch: 79, train_loss: 0.7657, test_loss: 0.9905, test_f1: 0.6050
 epoch: 80, train_loss: 0.7907, test_loss: 1.0013, test_f1: 0.5715
 epoch: 81, train_loss: 0.7641, test_loss: 1.0132, test_f1: 0.5831
 epoch: 82, train_loss: 0.7873, test_loss: 0.9913, test_f1: 0.5913
 epoch: 83, train_loss: 0.7707, test_loss: 0.9866, test_f1: 0.5925
 epoch: 84, train_loss: 0.7643, test_loss: 0.9944, test_f1: 0.5809
 epoch: 85, train_loss: 0.7597, test_loss: 1.0022, test_f1: 0.5875
 epoch: 86, train_loss: 0.7790, test_loss: 1.0053, test_f1: 0.5869
 epoch: 87, train_loss: 0.7659, test_loss: 0.9994, test_f1: 0.5991
 epoch: 88, train_loss: 0.7579, test_loss: 0.9921, test_f1: 0.6060
 epoch: 89, train_loss: 0.7743, test_loss: 0.9843, test_f1: 0.5890
 epoch: 90, train_loss: 0.7466, test_loss: 1.0007, test_f1: 0.5767
 epoch: 91, train_loss: 0.7660, test_loss: 1.0039, test_f1: 0.5560
 epoch: 92, train_loss: 0.7610, test_loss: 0.9904, test_f1: 0.5640
 epoch: 93, train_loss: 0.7532, test_loss: 0.9931, test_f1: 0.5958
 epoch: 94, train_loss: 0.7539, test_loss: 1.0075, test_f1: 0.5406
 epoch: 95, train_loss: 0.7501, test_loss: 1.0061, test_f1: 0.5253
 epoch: 96, train_loss: 0.7582, test_loss: 1.0072, test_f1: 0.5825
 epoch: 97, train_loss: 0.7548, test_loss: 1.0004, test_f1: 0.5792
 epoch: 98, train_loss: 0.7498, test_loss: 1.0039, test_f1: 0.5922
 epoch: 99, train_loss: 0.7461, test_loss: 0.9981, test_f1: 0.5871
##################ITERATION #7 ****************************************
 epoch: 0, train_loss: 1.3370, test_loss: 1.3458, test_f1: 0.2281
 epoch: 1, train_loss: 1.1837, test_loss: 1.3761, test_f1: 0.2281
 epoch: 2, train_loss: 1.1412, test_loss: 1.3334, test_f1: 0.3294
 epoch: 3, train_loss: 1.1301, test_loss: 1.2296, test_f1: 0.3333
 epoch: 4, train_loss: 1.0956, test_loss: 1.1877, test_f1: 0.4246
 epoch: 5, train_loss: 1.0877, test_loss: 1.1747, test_f1: 0.4183
 epoch: 6, train_loss: 1.0756, test_loss: 1.1417, test_f1: 0.4274
 epoch: 7, train_loss: 1.0660, test_loss: 1.1330, test_f1: 0.4196
 epoch: 8, train_loss: 1.0473, test_loss: 1.1404, test_f1: 0.4353
 epoch: 9, train_loss: 1.0454, test_loss: 1.1293, test_f1: 0.4300
 epoch: 10, train_loss: 1.0410, test_loss: 1.1092, test_f1: 0.4459
 epoch: 11, train_loss: 1.0303, test_loss: 1.1183, test_f1: 0.4285
 epoch: 12, train_loss: 1.0247, test_loss: 1.1112, test_f1: 0.4252
 epoch: 13, train_loss: 1.0045, test_loss: 1.1087, test_f1: 0.4365
 epoch: 14, train_loss: 0.9945, test_loss: 1.1141, test_f1: 0.4297
 epoch: 15, train_loss: 0.9930, test_loss: 1.0953, test_f1: 0.4428
 epoch: 16, train_loss: 0.9899, test_loss: 1.0807, test_f1: 0.4706
 epoch: 17, train_loss: 0.9854, test_loss: 1.0965, test_f1: 0.4505
 epoch: 18, train_loss: 0.9595, test_loss: 1.0736, test_f1: 0.4890
 epoch: 19, train_loss: 0.9607, test_loss: 1.0693, test_f1: 0.5016
 epoch: 20, train_loss: 0.9540, test_loss: 1.0799, test_f1: 0.5050
 epoch: 21, train_loss: 0.9481, test_loss: 1.0405, test_f1: 0.5219
 epoch: 22, train_loss: 0.9379, test_loss: 1.0557, test_f1: 0.5176
 epoch: 23, train_loss: 0.9351, test_loss: 1.0527, test_f1: 0.5089
 epoch: 24, train_loss: 0.9293, test_loss: 1.0476, test_f1: 0.5144
 epoch: 25, train_loss: 0.9337, test_loss: 1.0441, test_f1: 0.5404
 epoch: 26, train_loss: 0.9091, test_loss: 1.0488, test_f1: 0.5255
 epoch: 27, train_loss: 0.9103, test_loss: 1.0470, test_f1: 0.5386
 epoch: 28, train_loss: 0.9179, test_loss: 1.0477, test_f1: 0.5356
 epoch: 29, train_loss: 0.9201, test_loss: 1.0494, test_f1: 0.5285
 epoch: 30, train_loss: 0.8975, test_loss: 1.0586, test_f1: 0.5060
 epoch: 31, train_loss: 0.9032, test_loss: 1.0513, test_f1: 0.5543
 epoch: 32, train_loss: 0.9121, test_loss: 1.0356, test_f1: 0.5478
 epoch: 33, train_loss: 0.8961, test_loss: 1.0004, test_f1: 0.5558
 epoch: 34, train_loss: 0.8943, test_loss: 1.0119, test_f1: 0.5611
 epoch: 35, train_loss: 0.8819, test_loss: 1.0472, test_f1: 0.5279
 epoch: 36, train_loss: 0.8828, test_loss: 0.9918, test_f1: 0.5358
 epoch: 37, train_loss: 0.8702, test_loss: 0.9993, test_f1: 0.5774
 epoch: 38, train_loss: 0.8735, test_loss: 1.0067, test_f1: 0.6079
 epoch: 39, train_loss: 0.8827, test_loss: 0.9937, test_f1: 0.5739
 epoch: 40, train_loss: 0.8699, test_loss: 1.0153, test_f1: 0.5448
 epoch: 41, train_loss: 0.8699, test_loss: 0.9949, test_f1: 0.5779
 epoch: 42, train_loss: 0.8560, test_loss: 0.9869, test_f1: 0.5529
 epoch: 43, train_loss: 0.8514, test_loss: 1.0091, test_f1: 0.5667
 epoch: 44, train_loss: 0.8418, test_loss: 0.9892, test_f1: 0.5291
 epoch: 45, train_loss: 0.8479, test_loss: 0.9995, test_f1: 0.5533
 epoch: 46, train_loss: 0.8547, test_loss: 0.9550, test_f1: 0.5657
 epoch: 47, train_loss: 0.8457, test_loss: 0.9942, test_f1: 0.5598
 epoch: 48, train_loss: 0.8381, test_loss: 0.9732, test_f1: 0.5796
 epoch: 49, train_loss: 0.8331, test_loss: 1.0031, test_f1: 0.5866
 epoch: 50, train_loss: 0.8364, test_loss: 0.9677, test_f1: 0.5976
 epoch: 51, train_loss: 0.8320, test_loss: 1.0366, test_f1: 0.5732
 epoch: 52, train_loss: 0.8177, test_loss: 0.9904, test_f1: 0.5712
 epoch: 53, train_loss: 0.8158, test_loss: 0.9694, test_f1: 0.5840
 epoch: 54, train_loss: 0.8308, test_loss: 0.9716, test_f1: 0.6116
 epoch: 55, train_loss: 0.8130, test_loss: 0.9775, test_f1: 0.5954
 epoch: 56, train_loss: 0.8058, test_loss: 0.9683, test_f1: 0.6031
 epoch: 57, train_loss: 0.8087, test_loss: 0.9597, test_f1: 0.6134
 epoch: 58, train_loss: 0.7972, test_loss: 0.9843, test_f1: 0.6028
 epoch: 59, train_loss: 0.7964, test_loss: 0.9779, test_f1: 0.6123
 epoch: 60, train_loss: 0.7950, test_loss: 0.9825, test_f1: 0.6126
 epoch: 61, train_loss: 0.7993, test_loss: 0.9797, test_f1: 0.5987
 epoch: 62, train_loss: 0.7908, test_loss: 0.9655, test_f1: 0.6194
 epoch: 63, train_loss: 0.7799, test_loss: 0.9774, test_f1: 0.5857
 epoch: 64, train_loss: 0.7955, test_loss: 0.9702, test_f1: 0.6120
 epoch: 65, train_loss: 0.7779, test_loss: 0.9897, test_f1: 0.6064
 epoch: 66, train_loss: 0.7757, test_loss: 1.0088, test_f1: 0.6047
 epoch: 67, train_loss: 0.7710, test_loss: 0.9691, test_f1: 0.6162
 epoch: 68, train_loss: 0.7888, test_loss: 0.9680, test_f1: 0.6193
 epoch: 69, train_loss: 0.7784, test_loss: 0.9730, test_f1: 0.6050
 epoch: 70, train_loss: 0.7768, test_loss: 0.9849, test_f1: 0.6259
 epoch: 71, train_loss: 0.7737, test_loss: 0.9888, test_f1: 0.6144
 epoch: 72, train_loss: 0.7659, test_loss: 0.9926, test_f1: 0.5942
 epoch: 73, train_loss: 0.7660, test_loss: 0.9951, test_f1: 0.5878
 epoch: 74, train_loss: 0.7672, test_loss: 0.9789, test_f1: 0.6123
 epoch: 75, train_loss: 0.7713, test_loss: 1.0036, test_f1: 0.6099
 epoch: 76, train_loss: 0.7740, test_loss: 0.9752, test_f1: 0.6301
 epoch: 77, train_loss: 0.7637, test_loss: 0.9903, test_f1: 0.6276
 epoch: 78, train_loss: 0.7646, test_loss: 0.9842, test_f1: 0.6096
 epoch: 79, train_loss: 0.7513, test_loss: 0.9832, test_f1: 0.6250
 epoch: 80, train_loss: 0.7421, test_loss: 1.0274, test_f1: 0.5948
 epoch: 81, train_loss: 0.7671, test_loss: 1.0249, test_f1: 0.5612
 epoch: 82, train_loss: 0.7564, test_loss: 1.0064, test_f1: 0.6054
 epoch: 83, train_loss: 0.7667, test_loss: 1.0045, test_f1: 0.5980
 epoch: 84, train_loss: 0.7598, test_loss: 0.9959, test_f1: 0.6050
 epoch: 85, train_loss: 0.7528, test_loss: 1.0029, test_f1: 0.5848
 epoch: 86, train_loss: 0.7416, test_loss: 1.0412, test_f1: 0.5751
 epoch: 87, train_loss: 0.7618, test_loss: 1.0197, test_f1: 0.6038
 epoch: 88, train_loss: 0.7379, test_loss: 1.0282, test_f1: 0.6097
 epoch: 89, train_loss: 0.7390, test_loss: 0.9974, test_f1: 0.6047
 epoch: 90, train_loss: 0.7223, test_loss: 1.0301, test_f1: 0.5887
 epoch: 91, train_loss: 0.7512, test_loss: 1.0515, test_f1: 0.5798
 epoch: 92, train_loss: 0.7374, test_loss: 1.0089, test_f1: 0.6041
 epoch: 93, train_loss: 0.7480, test_loss: 1.0284, test_f1: 0.6036
 epoch: 94, train_loss: 0.7313, test_loss: 1.0137, test_f1: 0.6128
 epoch: 95, train_loss: 0.7213, test_loss: 1.0247, test_f1: 0.6110
 epoch: 96, train_loss: 0.7305, test_loss: 0.9984, test_f1: 0.6180
 epoch: 97, train_loss: 0.7516, test_loss: 1.0062, test_f1: 0.6191
 epoch: 98, train_loss: 0.7210, test_loss: 1.0386, test_f1: 0.6300
 epoch: 99, train_loss: 0.7218, test_loss: 1.0369, test_f1: 0.5929
##################ITERATION #8 ****************************************
 epoch: 0, train_loss: 1.4463, test_loss: 1.4854, test_f1: 0.1436
 epoch: 1, train_loss: 1.2397, test_loss: 1.4917, test_f1: 0.1365
 epoch: 2, train_loss: 1.1845, test_loss: 1.4203, test_f1: 0.2814
 epoch: 3, train_loss: 1.1249, test_loss: 1.3637, test_f1: 0.3110
 epoch: 4, train_loss: 1.1055, test_loss: 1.2899, test_f1: 0.3499
 epoch: 5, train_loss: 1.0977, test_loss: 1.1941, test_f1: 0.3976
 epoch: 6, train_loss: 1.0685, test_loss: 1.1551, test_f1: 0.4141
 epoch: 7, train_loss: 1.0564, test_loss: 1.1469, test_f1: 0.4285
 epoch: 8, train_loss: 1.0447, test_loss: 1.1488, test_f1: 0.4679
 epoch: 9, train_loss: 1.0246, test_loss: 1.0994, test_f1: 0.4833
 epoch: 10, train_loss: 1.0268, test_loss: 1.1080, test_f1: 0.4758
 epoch: 11, train_loss: 1.0011, test_loss: 1.1236, test_f1: 0.4822
 epoch: 12, train_loss: 1.0070, test_loss: 1.1164, test_f1: 0.5057
 epoch: 13, train_loss: 1.0021, test_loss: 1.1005, test_f1: 0.4819
 epoch: 14, train_loss: 0.9929, test_loss: 1.1128, test_f1: 0.4864
 epoch: 15, train_loss: 0.9818, test_loss: 1.1132, test_f1: 0.4734
 epoch: 16, train_loss: 0.9737, test_loss: 1.1048, test_f1: 0.4809
 epoch: 17, train_loss: 0.9721, test_loss: 1.0895, test_f1: 0.4682
 epoch: 18, train_loss: 0.9712, test_loss: 1.0955, test_f1: 0.4826
 epoch: 19, train_loss: 0.9790, test_loss: 1.0842, test_f1: 0.4852
 epoch: 20, train_loss: 0.9474, test_loss: 1.0678, test_f1: 0.5010
 epoch: 21, train_loss: 0.9517, test_loss: 1.0746, test_f1: 0.4889
 epoch: 22, train_loss: 0.9424, test_loss: 1.0769, test_f1: 0.4714
 epoch: 23, train_loss: 0.9366, test_loss: 1.0650, test_f1: 0.4876
 epoch: 24, train_loss: 0.9391, test_loss: 1.0593, test_f1: 0.5090
 epoch: 25, train_loss: 0.9224, test_loss: 1.0627, test_f1: 0.5196
 epoch: 26, train_loss: 0.9400, test_loss: 1.0587, test_f1: 0.5049
 epoch: 27, train_loss: 0.9255, test_loss: 1.0454, test_f1: 0.5094
 epoch: 28, train_loss: 0.9317, test_loss: 1.0530, test_f1: 0.5090
 epoch: 29, train_loss: 0.9211, test_loss: 1.0448, test_f1: 0.5152
 epoch: 30, train_loss: 0.9255, test_loss: 1.0507, test_f1: 0.5080
 epoch: 31, train_loss: 0.9124, test_loss: 1.0267, test_f1: 0.5228
 epoch: 32, train_loss: 0.9091, test_loss: 1.0295, test_f1: 0.5282
 epoch: 33, train_loss: 0.9014, test_loss: 1.0301, test_f1: 0.5211
 epoch: 34, train_loss: 0.9141, test_loss: 1.0243, test_f1: 0.5333
 epoch: 35, train_loss: 0.8983, test_loss: 1.0185, test_f1: 0.5251
 epoch: 36, train_loss: 0.8984, test_loss: 1.0231, test_f1: 0.5106
 epoch: 37, train_loss: 0.8861, test_loss: 1.0156, test_f1: 0.5364
 epoch: 38, train_loss: 0.8937, test_loss: 1.0197, test_f1: 0.5358
 epoch: 39, train_loss: 0.8846, test_loss: 1.0206, test_f1: 0.5410
 epoch: 40, train_loss: 0.8743, test_loss: 1.0232, test_f1: 0.5489
 epoch: 41, train_loss: 0.8748, test_loss: 1.0061, test_f1: 0.5407
 epoch: 42, train_loss: 0.8674, test_loss: 1.0018, test_f1: 0.5355
 epoch: 43, train_loss: 0.8617, test_loss: 0.9916, test_f1: 0.5403
 epoch: 44, train_loss: 0.8608, test_loss: 0.9974, test_f1: 0.5605
 epoch: 45, train_loss: 0.8642, test_loss: 1.0039, test_f1: 0.5469
 epoch: 46, train_loss: 0.8667, test_loss: 0.9971, test_f1: 0.5489
 epoch: 47, train_loss: 0.8696, test_loss: 1.0031, test_f1: 0.5443
 epoch: 48, train_loss: 0.8481, test_loss: 0.9858, test_f1: 0.5482
 epoch: 49, train_loss: 0.8424, test_loss: 0.9944, test_f1: 0.5647
 epoch: 50, train_loss: 0.8264, test_loss: 0.9947, test_f1: 0.5537
 epoch: 51, train_loss: 0.8388, test_loss: 0.9832, test_f1: 0.5467
 epoch: 52, train_loss: 0.8258, test_loss: 0.9795, test_f1: 0.5867
 epoch: 53, train_loss: 0.8285, test_loss: 0.9771, test_f1: 0.5631
 epoch: 54, train_loss: 0.8159, test_loss: 0.9761, test_f1: 0.5684
 epoch: 55, train_loss: 0.8374, test_loss: 0.9825, test_f1: 0.5743
 epoch: 56, train_loss: 0.8226, test_loss: 0.9739, test_f1: 0.5752
 epoch: 57, train_loss: 0.8204, test_loss: 0.9720, test_f1: 0.5951
 epoch: 58, train_loss: 0.7968, test_loss: 0.9760, test_f1: 0.5662
 epoch: 59, train_loss: 0.8132, test_loss: 0.9712, test_f1: 0.5594
 epoch: 60, train_loss: 0.8071, test_loss: 0.9710, test_f1: 0.5617
 epoch: 61, train_loss: 0.8118, test_loss: 0.9792, test_f1: 0.5996
 epoch: 62, train_loss: 0.8143, test_loss: 0.9653, test_f1: 0.5724
 epoch: 63, train_loss: 0.7946, test_loss: 0.9624, test_f1: 0.5657
 epoch: 64, train_loss: 0.8016, test_loss: 0.9561, test_f1: 0.6043
 epoch: 65, train_loss: 0.8021, test_loss: 0.9545, test_f1: 0.5826
 epoch: 66, train_loss: 0.8016, test_loss: 0.9696, test_f1: 0.5518
 epoch: 67, train_loss: 0.7926, test_loss: 0.9563, test_f1: 0.5772
 epoch: 68, train_loss: 0.7864, test_loss: 0.9482, test_f1: 0.5832
 epoch: 69, train_loss: 0.7831, test_loss: 0.9536, test_f1: 0.5637
 epoch: 70, train_loss: 0.7837, test_loss: 0.9534, test_f1: 0.5802
 epoch: 71, train_loss: 0.7959, test_loss: 0.9421, test_f1: 0.5758
 epoch: 72, train_loss: 0.7806, test_loss: 0.9445, test_f1: 0.5798
 epoch: 73, train_loss: 0.7895, test_loss: 0.9515, test_f1: 0.5550
 epoch: 74, train_loss: 0.7824, test_loss: 0.9564, test_f1: 0.5662
 epoch: 75, train_loss: 0.7666, test_loss: 0.9617, test_f1: 0.5816
 epoch: 76, train_loss: 0.7939, test_loss: 0.9441, test_f1: 0.5698
 epoch: 77, train_loss: 0.7689, test_loss: 0.9404, test_f1: 0.5854
 epoch: 78, train_loss: 0.7692, test_loss: 0.9593, test_f1: 0.5661
 epoch: 79, train_loss: 0.7586, test_loss: 0.9533, test_f1: 0.5623
 epoch: 80, train_loss: 0.7648, test_loss: 0.9395, test_f1: 0.5779
 epoch: 81, train_loss: 0.7801, test_loss: 0.9414, test_f1: 0.5981
 epoch: 82, train_loss: 0.7610, test_loss: 0.9646, test_f1: 0.5673
 epoch: 83, train_loss: 0.7842, test_loss: 0.9421, test_f1: 0.5842
 epoch: 84, train_loss: 0.7813, test_loss: 0.9344, test_f1: 0.5952
 epoch: 85, train_loss: 0.7623, test_loss: 0.9314, test_f1: 0.5844
 epoch: 86, train_loss: 0.7651, test_loss: 0.9421, test_f1: 0.5703
 epoch: 87, train_loss: 0.7512, test_loss: 0.9366, test_f1: 0.5668
 epoch: 88, train_loss: 0.7624, test_loss: 0.9385, test_f1: 0.5913
 epoch: 89, train_loss: 0.7639, test_loss: 0.9221, test_f1: 0.5907
 epoch: 90, train_loss: 0.7752, test_loss: 0.9443, test_f1: 0.5853
 epoch: 91, train_loss: 0.7418, test_loss: 0.9420, test_f1: 0.5895
 epoch: 92, train_loss: 0.7719, test_loss: 0.9435, test_f1: 0.5847
 epoch: 93, train_loss: 0.7631, test_loss: 0.9539, test_f1: 0.5774
 epoch: 94, train_loss: 0.7470, test_loss: 0.9362, test_f1: 0.5780
 epoch: 95, train_loss: 0.7495, test_loss: 0.9546, test_f1: 0.5745
 epoch: 96, train_loss: 0.7419, test_loss: 0.9411, test_f1: 0.5817
 epoch: 97, train_loss: 0.7498, test_loss: 0.9350, test_f1: 0.5801
 epoch: 98, train_loss: 0.7482, test_loss: 0.9314, test_f1: 0.5944
 epoch: 99, train_loss: 0.7464, test_loss: 0.9464, test_f1: 0.5849
##################ITERATION #9 ****************************************
 epoch: 0, train_loss: 1.2891, test_loss: 1.4474, test_f1: 0.2570
 epoch: 1, train_loss: 1.1448, test_loss: 1.3074, test_f1: 0.2281
 epoch: 2, train_loss: 1.0920, test_loss: 1.2125, test_f1: 0.3276
 epoch: 3, train_loss: 1.0804, test_loss: 1.2096, test_f1: 0.4170
 epoch: 4, train_loss: 1.0444, test_loss: 1.1892, test_f1: 0.4207
 epoch: 5, train_loss: 1.0338, test_loss: 1.1401, test_f1: 0.4563
 epoch: 6, train_loss: 1.0202, test_loss: 1.0850, test_f1: 0.4863
 epoch: 7, train_loss: 0.9937, test_loss: 1.0655, test_f1: 0.5103
 epoch: 8, train_loss: 1.0013, test_loss: 1.0447, test_f1: 0.5158
 epoch: 9, train_loss: 0.9662, test_loss: 1.0515, test_f1: 0.5502
 epoch: 10, train_loss: 0.9675, test_loss: 1.0599, test_f1: 0.5462
 epoch: 11, train_loss: 0.9659, test_loss: 1.0407, test_f1: 0.5240
 epoch: 12, train_loss: 0.9579, test_loss: 1.0206, test_f1: 0.5400
 epoch: 13, train_loss: 0.9334, test_loss: 1.0149, test_f1: 0.5341
 epoch: 14, train_loss: 0.9349, test_loss: 1.0246, test_f1: 0.5133
 epoch: 15, train_loss: 0.9287, test_loss: 1.0241, test_f1: 0.5237
 epoch: 16, train_loss: 0.9096, test_loss: 1.0459, test_f1: 0.5442
 epoch: 17, train_loss: 0.9108, test_loss: 1.0315, test_f1: 0.5604
 epoch: 18, train_loss: 0.8996, test_loss: 1.0362, test_f1: 0.5557
 epoch: 19, train_loss: 0.9084, test_loss: 1.0017, test_f1: 0.5706
 epoch: 20, train_loss: 0.8912, test_loss: 1.0153, test_f1: 0.5444
 epoch: 21, train_loss: 0.8834, test_loss: 0.9960, test_f1: 0.5571
 epoch: 22, train_loss: 0.8756, test_loss: 0.9986, test_f1: 0.5657
 epoch: 23, train_loss: 0.8780, test_loss: 1.0715, test_f1: 0.5151
 epoch: 24, train_loss: 0.8757, test_loss: 1.0055, test_f1: 0.5452
 epoch: 25, train_loss: 0.8720, test_loss: 0.9753, test_f1: 0.5633
 epoch: 26, train_loss: 0.8605, test_loss: 0.9974, test_f1: 0.5508
 epoch: 27, train_loss: 0.8557, test_loss: 1.0058, test_f1: 0.5238
 epoch: 28, train_loss: 0.8489, test_loss: 0.9954, test_f1: 0.5570
 epoch: 29, train_loss: 0.8418, test_loss: 1.0285, test_f1: 0.5543
 epoch: 30, train_loss: 0.8434, test_loss: 1.0042, test_f1: 0.5730
 epoch: 31, train_loss: 0.8247, test_loss: 1.0172, test_f1: 0.5219
 epoch: 32, train_loss: 0.8324, test_loss: 0.9927, test_f1: 0.5803
 epoch: 33, train_loss: 0.8259, test_loss: 1.0112, test_f1: 0.5537
 epoch: 34, train_loss: 0.8331, test_loss: 1.0038, test_f1: 0.5336
 epoch: 35, train_loss: 0.8469, test_loss: 1.0212, test_f1: 0.5556
 epoch: 36, train_loss: 0.8104, test_loss: 0.9823, test_f1: 0.5879
 epoch: 37, train_loss: 0.8164, test_loss: 1.0180, test_f1: 0.5632
 epoch: 38, train_loss: 0.8016, test_loss: 0.9843, test_f1: 0.5800
 epoch: 39, train_loss: 0.8231, test_loss: 1.0282, test_f1: 0.5559
 epoch: 40, train_loss: 0.8149, test_loss: 0.9671, test_f1: 0.5656
 epoch: 41, train_loss: 0.8043, test_loss: 0.9807, test_f1: 0.5687
 epoch: 42, train_loss: 0.8091, test_loss: 1.0128, test_f1: 0.5605
 epoch: 43, train_loss: 0.7985, test_loss: 0.9714, test_f1: 0.5538
 epoch: 44, train_loss: 0.7957, test_loss: 0.9833, test_f1: 0.5585
 epoch: 45, train_loss: 0.7842, test_loss: 0.9880, test_f1: 0.5372
 epoch: 46, train_loss: 0.7840, test_loss: 0.9358, test_f1: 0.5875
 epoch: 47, train_loss: 0.7893, test_loss: 1.0610, test_f1: 0.5375
 epoch: 48, train_loss: 0.7831, test_loss: 0.9485, test_f1: 0.5691
 epoch: 49, train_loss: 0.7698, test_loss: 1.0039, test_f1: 0.5470
 epoch: 50, train_loss: 0.7575, test_loss: 0.9539, test_f1: 0.5920
 epoch: 51, train_loss: 0.7686, test_loss: 0.9832, test_f1: 0.5855
 epoch: 52, train_loss: 0.7562, test_loss: 0.9823, test_f1: 0.5672
 epoch: 53, train_loss: 0.7429, test_loss: 0.9476, test_f1: 0.5779
 epoch: 54, train_loss: 0.7545, test_loss: 0.9523, test_f1: 0.5852
 epoch: 55, train_loss: 0.7471, test_loss: 0.9532, test_f1: 0.5772
 epoch: 56, train_loss: 0.7534, test_loss: 0.9573, test_f1: 0.5780
 epoch: 57, train_loss: 0.7448, test_loss: 0.9562, test_f1: 0.5675
 epoch: 58, train_loss: 0.7527, test_loss: 0.9486, test_f1: 0.5792
 epoch: 59, train_loss: 0.7560, test_loss: 0.9600, test_f1: 0.5956
 epoch: 60, train_loss: 0.7509, test_loss: 0.9562, test_f1: 0.5974
 epoch: 61, train_loss: 0.7472, test_loss: 0.9387, test_f1: 0.5918
 epoch: 62, train_loss: 0.7336, test_loss: 0.9736, test_f1: 0.5760
 epoch: 63, train_loss: 0.7277, test_loss: 0.9528, test_f1: 0.5950
 epoch: 64, train_loss: 0.7344, test_loss: 0.9475, test_f1: 0.6012
 epoch: 65, train_loss: 0.7295, test_loss: 0.9596, test_f1: 0.5754
 epoch: 66, train_loss: 0.7366, test_loss: 0.9472, test_f1: 0.5851
 epoch: 67, train_loss: 0.7213, test_loss: 0.9609, test_f1: 0.5856
 epoch: 68, train_loss: 0.7335, test_loss: 0.9499, test_f1: 0.5842
 epoch: 69, train_loss: 0.7175, test_loss: 0.9427, test_f1: 0.5877
 epoch: 70, train_loss: 0.7186, test_loss: 0.9423, test_f1: 0.5857
 epoch: 71, train_loss: 0.7150, test_loss: 0.9355, test_f1: 0.5777
 epoch: 72, train_loss: 0.7270, test_loss: 0.9422, test_f1: 0.5757
 epoch: 73, train_loss: 0.7256, test_loss: 0.9707, test_f1: 0.5759
 epoch: 74, train_loss: 0.7090, test_loss: 0.9332, test_f1: 0.5890
 epoch: 75, train_loss: 0.7131, test_loss: 0.9437, test_f1: 0.5967
 epoch: 76, train_loss: 0.7083, test_loss: 0.9484, test_f1: 0.5986
 epoch: 77, train_loss: 0.7266, test_loss: 0.9557, test_f1: 0.5621
 epoch: 78, train_loss: 0.7076, test_loss: 0.9856, test_f1: 0.5723
 epoch: 79, train_loss: 0.7102, test_loss: 0.9443, test_f1: 0.5679
 epoch: 80, train_loss: 0.7047, test_loss: 0.9525, test_f1: 0.5879
 epoch: 81, train_loss: 0.7062, test_loss: 0.9418, test_f1: 0.5890
 epoch: 82, train_loss: 0.7128, test_loss: 0.9585, test_f1: 0.5746
 epoch: 83, train_loss: 0.7267, test_loss: 0.9486, test_f1: 0.5877
 epoch: 84, train_loss: 0.7041, test_loss: 0.9389, test_f1: 0.5699
 epoch: 85, train_loss: 0.7098, test_loss: 0.9405, test_f1: 0.5834
 epoch: 86, train_loss: 0.6937, test_loss: 0.9580, test_f1: 0.5752
 epoch: 87, train_loss: 0.7019, test_loss: 0.9358, test_f1: 0.6042
 epoch: 88, train_loss: 0.7058, test_loss: 0.9370, test_f1: 0.5859
 epoch: 89, train_loss: 0.6922, test_loss: 0.9330, test_f1: 0.5648
 epoch: 90, train_loss: 0.7010, test_loss: 0.9423, test_f1: 0.5965
 epoch: 91, train_loss: 0.6864, test_loss: 0.9481, test_f1: 0.6059
 epoch: 92, train_loss: 0.6837, test_loss: 0.9352, test_f1: 0.5956
 epoch: 93, train_loss: 0.6887, test_loss: 0.9370, test_f1: 0.5950
 epoch: 94, train_loss: 0.6866, test_loss: 0.9330, test_f1: 0.5963
 epoch: 95, train_loss: 0.6670, test_loss: 0.9519, test_f1: 0.6057
 epoch: 96, train_loss: 0.6919, test_loss: 0.9114, test_f1: 0.5896
 epoch: 97, train_loss: 0.6885, test_loss: 0.9381, test_f1: 0.5897
 epoch: 98, train_loss: 0.6812, test_loss: 0.9462, test_f1: 0.5902
 epoch: 99, train_loss: 0.6744, test_loss: 0.9407, test_f1: 0.5960

Training completed in 346.82 seconds
Best F1: 0.6301 at epoch 76
Mean F1 across iterations: 0.6095  0.0133
========================FINAL RESULTS================================
FEGIN weighted F1: 0.6301  0.0133
python main.py --data ltspice_demos --representation component_pin_net --model FEGIN --layers 3 --hiddens 16 --batch_size 128 --lr 0.001 --emb_size 128 --epochs 100 --save_appendix component_pin_net_L3_H16_BS128_LR0.001_E128 --no_val
-----



STDERR:
  File "main.py", line 370, in <module>
    main()
  File "main.py", line 254, in main
    dataset = dataset_class(
  File "/home/philip/projects/ltspice_examples_code_repo/Circuit-Completion-Using-GNNs/component_classification_with_link_prediction_head/evaluation/FEGIN/kernel/circuit_datasets.py", line 15, in __init__
    self.data, self.slices = torch.load(self.processed_paths[0])
  File "/home/philip/.local/lib/python3.8/site-packages/torch/serialization.py", line 1040, in load
    warnings.warn(
  File "/usr/lib/python3.8/warnings.py", line 109, in _showwarnmsg
    sw(msg.message, msg.category, msg.filename, msg.lineno,
  File "main.py", line 47, in warn_with_traceback
    traceback.print_stack(file=log)
/home/philip/projects/ltspice_examples_code_repo/Circuit-Completion-Using-GNNs/component_classification_with_link_prediction_head/evaluation/FEGIN/kernel/circuit_datasets.py:15: FutureWarning: You are using `torch.load` with `weights_only=False` (the current default value), which uses the default pickle module implicitly. It is possible to construct malicious pickle data which will execute arbitrary code during unpickling (See https://github.com/pytorch/pytorch/blob/main/SECURITY.md#untrusted-models for more details). In a future release, the default value for `weights_only` will be flipped to `True`. This limits the functions that could be executed during unpickling. Arbitrary objects will no longer be allowed to be loaded via this mode unless they are explicitly allowlisted by the user via `torch.serialization.add_safe_globals`. We recommend you start setting `weights_only=True` for any use case where you don't have full control of the loaded file. Please open an issue on GitHub for any issues related to this experimental feature.
  self.data, self.slices = torch.load(self.processed_paths[0])
