STDOUT:
Results will be saved in /home/philip/projects/ltspice_examples_code_repo/Circuit-Completion-Using-GNNs/component_classification_with_link_prediction_head/evaluation/FEGIN/results/model_FEGIN_dataset_ltspice_demos
Command line input: python main.py --data ltspice_demos --representation component_pin_net --model FEGIN --layers 3 --hiddens 16 --batch_size 128 --lr 0.001 --emb_size 128 --epochs 100 --save_appendix component_pin_net_L3_H16_BS128_LR0.001_E128 --no_val
 is saved.
-----
ltspice_demos - FEGIN
Using 3 layers, 16 hidden units, h = 2
Loading component_pin_net representation dataset
ENTERED
Training FEGIN on component_pin_net representation
Train: 1565, Test: 383
##################ITERATION #0 ****************************************
 epoch: 0, train_loss: 1.3673, test_loss: 1.3598, test_f1: 0.2281
 epoch: 1, train_loss: 1.3508, test_loss: 1.3531, test_f1: 0.2281
 epoch: 2, train_loss: 1.3393, test_loss: 1.3460, test_f1: 0.2281
 epoch: 3, train_loss: 1.3249, test_loss: 1.3371, test_f1: 0.2281
 epoch: 4, train_loss: 1.3093, test_loss: 1.3163, test_f1: 0.2281
 epoch: 5, train_loss: 1.2878, test_loss: 1.2917, test_f1: 0.2285
 epoch: 6, train_loss: 1.2617, test_loss: 1.2679, test_f1: 0.2302
 epoch: 7, train_loss: 1.2313, test_loss: 1.2462, test_f1: 0.2346
 epoch: 8, train_loss: 1.1970, test_loss: 1.2253, test_f1: 0.2685
 epoch: 9, train_loss: 1.1674, test_loss: 1.1938, test_f1: 0.3137
 epoch: 10, train_loss: 1.1327, test_loss: 1.1646, test_f1: 0.3500
 epoch: 11, train_loss: 1.1007, test_loss: 1.1369, test_f1: 0.3919
 epoch: 12, train_loss: 1.0661, test_loss: 1.1175, test_f1: 0.3830
 epoch: 13, train_loss: 1.0578, test_loss: 1.1039, test_f1: 0.3850
 epoch: 14, train_loss: 1.0333, test_loss: 1.0892, test_f1: 0.3540
 epoch: 15, train_loss: 1.0274, test_loss: 1.0899, test_f1: 0.3595
 epoch: 16, train_loss: 1.0274, test_loss: 1.0821, test_f1: 0.3568
 epoch: 17, train_loss: 1.0083, test_loss: 1.0841, test_f1: 0.3520
 epoch: 18, train_loss: 0.9948, test_loss: 1.0861, test_f1: 0.4132
 epoch: 19, train_loss: 0.9941, test_loss: 1.0686, test_f1: 0.4132
 epoch: 20, train_loss: 0.9952, test_loss: 1.0629, test_f1: 0.4157
 epoch: 21, train_loss: 0.9866, test_loss: 1.0580, test_f1: 0.4157
 epoch: 22, train_loss: 0.9855, test_loss: 1.0654, test_f1: 0.4175
 epoch: 23, train_loss: 0.9771, test_loss: 1.0611, test_f1: 0.3603
 epoch: 24, train_loss: 0.9753, test_loss: 1.0701, test_f1: 0.4384
 epoch: 25, train_loss: 0.9732, test_loss: 1.0791, test_f1: 0.4106
 epoch: 26, train_loss: 0.9725, test_loss: 1.0625, test_f1: 0.3578
 epoch: 27, train_loss: 0.9599, test_loss: 1.0549, test_f1: 0.3988
 epoch: 28, train_loss: 0.9624, test_loss: 1.0721, test_f1: 0.3911
 epoch: 29, train_loss: 0.9554, test_loss: 1.0601, test_f1: 0.4574
 epoch: 30, train_loss: 0.9534, test_loss: 1.0667, test_f1: 0.3865
 epoch: 31, train_loss: 0.9611, test_loss: 1.0528, test_f1: 0.4272
 epoch: 32, train_loss: 0.9512, test_loss: 1.0752, test_f1: 0.4555
 epoch: 33, train_loss: 0.9431, test_loss: 1.0575, test_f1: 0.4342
 epoch: 34, train_loss: 0.9538, test_loss: 1.0508, test_f1: 0.4321
 epoch: 35, train_loss: 0.9405, test_loss: 1.0816, test_f1: 0.3972
 epoch: 36, train_loss: 0.9302, test_loss: 1.0869, test_f1: 0.4387
 epoch: 37, train_loss: 0.9361, test_loss: 1.0431, test_f1: 0.4730
 epoch: 38, train_loss: 0.9317, test_loss: 1.0609, test_f1: 0.3712
 epoch: 39, train_loss: 0.9324, test_loss: 1.0304, test_f1: 0.4995
 epoch: 40, train_loss: 0.9424, test_loss: 1.0835, test_f1: 0.4169
 epoch: 41, train_loss: 0.9201, test_loss: 1.0653, test_f1: 0.4640
 epoch: 42, train_loss: 0.9203, test_loss: 1.0761, test_f1: 0.4948
 epoch: 43, train_loss: 0.9111, test_loss: 1.0806, test_f1: 0.5250
 epoch: 44, train_loss: 0.9120, test_loss: 1.0740, test_f1: 0.4694
 epoch: 45, train_loss: 0.9020, test_loss: 1.0452, test_f1: 0.5006
 epoch: 46, train_loss: 0.9005, test_loss: 1.0582, test_f1: 0.5256
 epoch: 47, train_loss: 0.9206, test_loss: 1.0855, test_f1: 0.5323
 epoch: 48, train_loss: 0.9016, test_loss: 1.1217, test_f1: 0.5374
 epoch: 49, train_loss: 0.8958, test_loss: 1.1177, test_f1: 0.5518
 epoch: 50, train_loss: 0.8953, test_loss: 1.0293, test_f1: 0.5304
 epoch: 51, train_loss: 0.8903, test_loss: 1.0795, test_f1: 0.5465
 epoch: 52, train_loss: 0.8813, test_loss: 1.0748, test_f1: 0.5086
 epoch: 53, train_loss: 0.8920, test_loss: 1.0525, test_f1: 0.5442
 epoch: 54, train_loss: 0.8817, test_loss: 1.0703, test_f1: 0.5482
 epoch: 55, train_loss: 0.8871, test_loss: 1.0986, test_f1: 0.5545
 epoch: 56, train_loss: 0.8769, test_loss: 1.0746, test_f1: 0.5408
 epoch: 57, train_loss: 0.8801, test_loss: 1.0794, test_f1: 0.5537
 epoch: 58, train_loss: 0.8795, test_loss: 1.0345, test_f1: 0.5452
 epoch: 59, train_loss: 0.8700, test_loss: 1.0778, test_f1: 0.5105
 epoch: 60, train_loss: 0.8728, test_loss: 1.0605, test_f1: 0.5226
 epoch: 61, train_loss: 0.8752, test_loss: 1.0512, test_f1: 0.5324
 epoch: 62, train_loss: 0.8668, test_loss: 1.0784, test_f1: 0.5372
 epoch: 63, train_loss: 0.8723, test_loss: 1.0576, test_f1: 0.4906
 epoch: 64, train_loss: 0.8669, test_loss: 1.0746, test_f1: 0.5011
 epoch: 65, train_loss: 0.8702, test_loss: 1.1146, test_f1: 0.5407
 epoch: 66, train_loss: 0.8665, test_loss: 1.0723, test_f1: 0.5587
 epoch: 67, train_loss: 0.8618, test_loss: 1.0617, test_f1: 0.5410
 epoch: 68, train_loss: 0.8527, test_loss: 1.0882, test_f1: 0.5557
 epoch: 69, train_loss: 0.8588, test_loss: 1.0730, test_f1: 0.5661
 epoch: 70, train_loss: 0.8598, test_loss: 1.0668, test_f1: 0.5606
 epoch: 71, train_loss: 0.8468, test_loss: 1.0836, test_f1: 0.5372
 epoch: 72, train_loss: 0.8356, test_loss: 1.1478, test_f1: 0.5299
 epoch: 73, train_loss: 0.8548, test_loss: 1.0765, test_f1: 0.5515
 epoch: 74, train_loss: 0.8442, test_loss: 1.0745, test_f1: 0.4990
 epoch: 75, train_loss: 0.8487, test_loss: 1.0791, test_f1: 0.5550
 epoch: 76, train_loss: 0.8488, test_loss: 1.0828, test_f1: 0.5397
 epoch: 77, train_loss: 0.8462, test_loss: 1.1436, test_f1: 0.5418
 epoch: 78, train_loss: 0.8418, test_loss: 1.0819, test_f1: 0.5747
 epoch: 79, train_loss: 0.8426, test_loss: 1.0766, test_f1: 0.5785
 epoch: 80, train_loss: 0.8387, test_loss: 1.0947, test_f1: 0.5557
 epoch: 81, train_loss: 0.8423, test_loss: 1.1435, test_f1: 0.5762
 epoch: 82, train_loss: 0.8253, test_loss: 1.1130, test_f1: 0.5658
 epoch: 83, train_loss: 0.8238, test_loss: 1.0648, test_f1: 0.5475
 epoch: 84, train_loss: 0.8224, test_loss: 1.1290, test_f1: 0.5532
 epoch: 85, train_loss: 0.8428, test_loss: 1.1004, test_f1: 0.5527
 epoch: 86, train_loss: 0.8229, test_loss: 1.1469, test_f1: 0.5903
 epoch: 87, train_loss: 0.8272, test_loss: 1.0673, test_f1: 0.5539
 epoch: 88, train_loss: 0.8331, test_loss: 1.0778, test_f1: 0.5774
 epoch: 89, train_loss: 0.8265, test_loss: 1.1015, test_f1: 0.5686
 epoch: 90, train_loss: 0.8217, test_loss: 1.1220, test_f1: 0.5591
 epoch: 91, train_loss: 0.8108, test_loss: 1.0601, test_f1: 0.5506
 epoch: 92, train_loss: 0.8124, test_loss: 1.1144, test_f1: 0.5768
 epoch: 93, train_loss: 0.8218, test_loss: 1.0854, test_f1: 0.5576
 epoch: 94, train_loss: 0.8162, test_loss: 1.1047, test_f1: 0.5967
 epoch: 95, train_loss: 0.8143, test_loss: 1.1075, test_f1: 0.5829
 epoch: 96, train_loss: 0.8010, test_loss: 1.0826, test_f1: 0.5716
 epoch: 97, train_loss: 0.8197, test_loss: 1.1320, test_f1: 0.5916
 epoch: 98, train_loss: 0.8047, test_loss: 1.1010, test_f1: 0.5917
 epoch: 99, train_loss: 0.8129, test_loss: 1.0954, test_f1: 0.5639
##################ITERATION #1 ****************************************
 epoch: 0, train_loss: 1.3737, test_loss: 1.3591, test_f1: 0.0507
 epoch: 1, train_loss: 1.3022, test_loss: 1.3349, test_f1: 0.2281
 epoch: 2, train_loss: 1.2571, test_loss: 1.3013, test_f1: 0.2281
 epoch: 3, train_loss: 1.2235, test_loss: 1.2711, test_f1: 0.2281
 epoch: 4, train_loss: 1.1922, test_loss: 1.2414, test_f1: 0.2720
 epoch: 5, train_loss: 1.1639, test_loss: 1.2126, test_f1: 0.3130
 epoch: 6, train_loss: 1.1312, test_loss: 1.1891, test_f1: 0.3876
 epoch: 7, train_loss: 1.1157, test_loss: 1.1905, test_f1: 0.3605
 epoch: 8, train_loss: 1.0997, test_loss: 1.1649, test_f1: 0.3656
 epoch: 9, train_loss: 1.0883, test_loss: 1.1622, test_f1: 0.3839
 epoch: 10, train_loss: 1.0751, test_loss: 1.1451, test_f1: 0.4178
 epoch: 11, train_loss: 1.0655, test_loss: 1.1441, test_f1: 0.4178
 epoch: 12, train_loss: 1.0558, test_loss: 1.1390, test_f1: 0.4117
 epoch: 13, train_loss: 1.0441, test_loss: 1.1302, test_f1: 0.4009
 epoch: 14, train_loss: 1.0284, test_loss: 1.1159, test_f1: 0.4200
 epoch: 15, train_loss: 1.0292, test_loss: 1.1264, test_f1: 0.4105
 epoch: 16, train_loss: 1.0259, test_loss: 1.1109, test_f1: 0.4205
 epoch: 17, train_loss: 1.0189, test_loss: 1.1112, test_f1: 0.4242
 epoch: 18, train_loss: 1.0166, test_loss: 1.1125, test_f1: 0.4198
 epoch: 19, train_loss: 1.0021, test_loss: 1.1204, test_f1: 0.4142
 epoch: 20, train_loss: 0.9908, test_loss: 1.0799, test_f1: 0.4271
 epoch: 21, train_loss: 0.9864, test_loss: 1.0888, test_f1: 0.4361
 epoch: 22, train_loss: 0.9795, test_loss: 1.0885, test_f1: 0.4293
 epoch: 23, train_loss: 0.9849, test_loss: 1.0832, test_f1: 0.4299
 epoch: 24, train_loss: 0.9762, test_loss: 1.0743, test_f1: 0.4401
 epoch: 25, train_loss: 0.9669, test_loss: 1.0817, test_f1: 0.4573
 epoch: 26, train_loss: 0.9650, test_loss: 1.0877, test_f1: 0.4668
 epoch: 27, train_loss: 0.9593, test_loss: 1.0718, test_f1: 0.4895
 epoch: 28, train_loss: 0.9557, test_loss: 1.0752, test_f1: 0.4871
 epoch: 29, train_loss: 0.9502, test_loss: 1.0702, test_f1: 0.4896
 epoch: 30, train_loss: 0.9428, test_loss: 1.0738, test_f1: 0.4907
 epoch: 31, train_loss: 0.9458, test_loss: 1.0614, test_f1: 0.5193
 epoch: 32, train_loss: 0.9389, test_loss: 1.0548, test_f1: 0.5105
 epoch: 33, train_loss: 0.9360, test_loss: 1.0510, test_f1: 0.5051
 epoch: 34, train_loss: 0.9396, test_loss: 1.0512, test_f1: 0.5240
 epoch: 35, train_loss: 0.9262, test_loss: 1.0469, test_f1: 0.5275
 epoch: 36, train_loss: 0.9273, test_loss: 1.0355, test_f1: 0.5234
 epoch: 37, train_loss: 0.9169, test_loss: 1.0384, test_f1: 0.5196
 epoch: 38, train_loss: 0.9193, test_loss: 1.0296, test_f1: 0.5295
 epoch: 39, train_loss: 0.9194, test_loss: 1.0244, test_f1: 0.5212
 epoch: 40, train_loss: 0.9068, test_loss: 1.0293, test_f1: 0.5278
 epoch: 41, train_loss: 0.9020, test_loss: 1.0128, test_f1: 0.5294
 epoch: 42, train_loss: 0.8897, test_loss: 1.0211, test_f1: 0.5272
 epoch: 43, train_loss: 0.8943, test_loss: 1.0065, test_f1: 0.5274
 epoch: 44, train_loss: 0.8910, test_loss: 1.0077, test_f1: 0.5433
 epoch: 45, train_loss: 0.8762, test_loss: 1.0072, test_f1: 0.5330
 epoch: 46, train_loss: 0.8808, test_loss: 1.0230, test_f1: 0.5182
 epoch: 47, train_loss: 0.8719, test_loss: 0.9933, test_f1: 0.5450
 epoch: 48, train_loss: 0.8772, test_loss: 0.9909, test_f1: 0.5487
 epoch: 49, train_loss: 0.8564, test_loss: 0.9884, test_f1: 0.5329
 epoch: 50, train_loss: 0.8690, test_loss: 1.0036, test_f1: 0.5576
 epoch: 51, train_loss: 0.8507, test_loss: 0.9918, test_f1: 0.5608
 epoch: 52, train_loss: 0.8483, test_loss: 0.9931, test_f1: 0.5627
 epoch: 53, train_loss: 0.8366, test_loss: 1.0078, test_f1: 0.5650
 epoch: 54, train_loss: 0.8460, test_loss: 1.0106, test_f1: 0.5327
 epoch: 55, train_loss: 0.8506, test_loss: 1.0022, test_f1: 0.5506
 epoch: 56, train_loss: 0.8362, test_loss: 0.9861, test_f1: 0.5688
 epoch: 57, train_loss: 0.8342, test_loss: 0.9971, test_f1: 0.5587
 epoch: 58, train_loss: 0.8293, test_loss: 0.9820, test_f1: 0.5679
 epoch: 59, train_loss: 0.8393, test_loss: 0.9796, test_f1: 0.5518
 epoch: 60, train_loss: 0.8516, test_loss: 0.9929, test_f1: 0.5483
 epoch: 61, train_loss: 0.8190, test_loss: 0.9952, test_f1: 0.5555
 epoch: 62, train_loss: 0.8263, test_loss: 0.9940, test_f1: 0.5584
 epoch: 63, train_loss: 0.8165, test_loss: 1.0013, test_f1: 0.5418
 epoch: 64, train_loss: 0.8225, test_loss: 0.9965, test_f1: 0.5583
 epoch: 65, train_loss: 0.8170, test_loss: 1.0048, test_f1: 0.5464
 epoch: 66, train_loss: 0.8265, test_loss: 0.9964, test_f1: 0.5581
 epoch: 67, train_loss: 0.8150, test_loss: 0.9978, test_f1: 0.5562
 epoch: 68, train_loss: 0.8080, test_loss: 0.9989, test_f1: 0.5516
 epoch: 69, train_loss: 0.8299, test_loss: 0.9902, test_f1: 0.5711
 epoch: 70, train_loss: 0.8133, test_loss: 0.9992, test_f1: 0.5603
 epoch: 71, train_loss: 0.8076, test_loss: 0.9986, test_f1: 0.5511
 epoch: 72, train_loss: 0.8000, test_loss: 0.9874, test_f1: 0.5538
 epoch: 73, train_loss: 0.8056, test_loss: 0.9836, test_f1: 0.5483
 epoch: 74, train_loss: 0.8120, test_loss: 1.0063, test_f1: 0.5509
 epoch: 75, train_loss: 0.8155, test_loss: 0.9948, test_f1: 0.5456
 epoch: 76, train_loss: 0.8077, test_loss: 0.9828, test_f1: 0.5440
 epoch: 77, train_loss: 0.8013, test_loss: 0.9921, test_f1: 0.5571
 epoch: 78, train_loss: 0.7798, test_loss: 1.0063, test_f1: 0.5695
 epoch: 79, train_loss: 0.8051, test_loss: 0.9877, test_f1: 0.5628
 epoch: 80, train_loss: 0.7978, test_loss: 0.9953, test_f1: 0.5553
 epoch: 81, train_loss: 0.7936, test_loss: 1.0146, test_f1: 0.5523
 epoch: 82, train_loss: 0.8011, test_loss: 1.0191, test_f1: 0.5292
 epoch: 83, train_loss: 0.7901, test_loss: 1.0083, test_f1: 0.5509
 epoch: 84, train_loss: 0.7840, test_loss: 1.0013, test_f1: 0.5543
 epoch: 85, train_loss: 0.7796, test_loss: 0.9956, test_f1: 0.5607
 epoch: 86, train_loss: 0.7977, test_loss: 0.9885, test_f1: 0.5789
 epoch: 87, train_loss: 0.7829, test_loss: 0.9987, test_f1: 0.5762
 epoch: 88, train_loss: 0.7804, test_loss: 1.0108, test_f1: 0.5667
 epoch: 89, train_loss: 0.7839, test_loss: 1.0072, test_f1: 0.5596
 epoch: 90, train_loss: 0.7723, test_loss: 1.0054, test_f1: 0.5599
 epoch: 91, train_loss: 0.7643, test_loss: 1.0018, test_f1: 0.5709
 epoch: 92, train_loss: 0.7780, test_loss: 0.9883, test_f1: 0.5622
 epoch: 93, train_loss: 0.7706, test_loss: 1.0137, test_f1: 0.5539
 epoch: 94, train_loss: 0.7632, test_loss: 1.0228, test_f1: 0.5534
 epoch: 95, train_loss: 0.7731, test_loss: 1.0225, test_f1: 0.5622
 epoch: 96, train_loss: 0.7714, test_loss: 1.0171, test_f1: 0.5445
 epoch: 97, train_loss: 0.7633, test_loss: 1.0112, test_f1: 0.5664
 epoch: 98, train_loss: 0.7718, test_loss: 1.0295, test_f1: 0.5598
 epoch: 99, train_loss: 0.7678, test_loss: 1.0174, test_f1: 0.5682
##################ITERATION #2 ****************************************
 epoch: 0, train_loss: 1.4011, test_loss: 1.3874, test_f1: 0.0507
 epoch: 1, train_loss: 1.2560, test_loss: 1.3286, test_f1: 0.2281
 epoch: 2, train_loss: 1.2070, test_loss: 1.3206, test_f1: 0.2281
 epoch: 3, train_loss: 1.1507, test_loss: 1.2970, test_f1: 0.2281
 epoch: 4, train_loss: 1.1161, test_loss: 1.1861, test_f1: 0.3051
 epoch: 5, train_loss: 1.0812, test_loss: 1.1390, test_f1: 0.3317
 epoch: 6, train_loss: 1.0597, test_loss: 1.1102, test_f1: 0.3346
 epoch: 7, train_loss: 1.0331, test_loss: 1.0883, test_f1: 0.3602
 epoch: 8, train_loss: 1.0201, test_loss: 1.0841, test_f1: 0.3786
 epoch: 9, train_loss: 1.0190, test_loss: 1.0663, test_f1: 0.4021
 epoch: 10, train_loss: 1.0045, test_loss: 1.0744, test_f1: 0.4353
 epoch: 11, train_loss: 0.9813, test_loss: 1.0680, test_f1: 0.4521
 epoch: 12, train_loss: 0.9776, test_loss: 1.0501, test_f1: 0.4693
 epoch: 13, train_loss: 0.9736, test_loss: 1.0717, test_f1: 0.4783
 epoch: 14, train_loss: 0.9746, test_loss: 1.0589, test_f1: 0.4743
 epoch: 15, train_loss: 0.9601, test_loss: 1.0464, test_f1: 0.4937
 epoch: 16, train_loss: 0.9564, test_loss: 1.0420, test_f1: 0.4584
 epoch: 17, train_loss: 0.9536, test_loss: 1.0401, test_f1: 0.4667
 epoch: 18, train_loss: 0.9531, test_loss: 1.0685, test_f1: 0.4969
 epoch: 19, train_loss: 0.9496, test_loss: 1.0576, test_f1: 0.5157
 epoch: 20, train_loss: 0.9444, test_loss: 1.0356, test_f1: 0.4756
 epoch: 21, train_loss: 0.9423, test_loss: 1.0303, test_f1: 0.4535
 epoch: 22, train_loss: 0.9359, test_loss: 1.0374, test_f1: 0.5123
 epoch: 23, train_loss: 0.9333, test_loss: 1.0637, test_f1: 0.5083
 epoch: 24, train_loss: 0.9360, test_loss: 1.0323, test_f1: 0.5301
 epoch: 25, train_loss: 0.9355, test_loss: 1.0578, test_f1: 0.5104
 epoch: 26, train_loss: 0.9207, test_loss: 1.0349, test_f1: 0.5199
 epoch: 27, train_loss: 0.9213, test_loss: 1.0422, test_f1: 0.5004
 epoch: 28, train_loss: 0.9135, test_loss: 1.0430, test_f1: 0.5199
 epoch: 29, train_loss: 0.9132, test_loss: 1.0320, test_f1: 0.5208
 epoch: 30, train_loss: 0.9096, test_loss: 1.0564, test_f1: 0.5303
 epoch: 31, train_loss: 0.9028, test_loss: 1.0563, test_f1: 0.5326
 epoch: 32, train_loss: 0.9091, test_loss: 1.0377, test_f1: 0.5372
 epoch: 33, train_loss: 0.8950, test_loss: 1.0338, test_f1: 0.5376
 epoch: 34, train_loss: 0.8983, test_loss: 1.0318, test_f1: 0.5231
 epoch: 35, train_loss: 0.8833, test_loss: 1.0647, test_f1: 0.5205
 epoch: 36, train_loss: 0.8978, test_loss: 1.0509, test_f1: 0.5250
 epoch: 37, train_loss: 0.8824, test_loss: 1.0562, test_f1: 0.5357
 epoch: 38, train_loss: 0.8786, test_loss: 1.0480, test_f1: 0.5218
 epoch: 39, train_loss: 0.8790, test_loss: 1.0292, test_f1: 0.5214
 epoch: 40, train_loss: 0.8795, test_loss: 1.0517, test_f1: 0.5346
 epoch: 41, train_loss: 0.8631, test_loss: 1.0467, test_f1: 0.5192
 epoch: 42, train_loss: 0.8662, test_loss: 1.0508, test_f1: 0.5183
 epoch: 43, train_loss: 0.8444, test_loss: 1.0375, test_f1: 0.5588
 epoch: 44, train_loss: 0.8551, test_loss: 1.0476, test_f1: 0.5838
 epoch: 45, train_loss: 0.8416, test_loss: 1.0475, test_f1: 0.5620
 epoch: 46, train_loss: 0.8365, test_loss: 1.0362, test_f1: 0.5675
 epoch: 47, train_loss: 0.8438, test_loss: 1.0454, test_f1: 0.5750
 epoch: 48, train_loss: 0.8422, test_loss: 1.0249, test_f1: 0.5630
 epoch: 49, train_loss: 0.8294, test_loss: 1.0304, test_f1: 0.5621
 epoch: 50, train_loss: 0.8392, test_loss: 1.0215, test_f1: 0.5598
 epoch: 51, train_loss: 0.8163, test_loss: 1.0255, test_f1: 0.5849
 epoch: 52, train_loss: 0.8145, test_loss: 1.0278, test_f1: 0.5785
 epoch: 53, train_loss: 0.8178, test_loss: 1.0337, test_f1: 0.5649
 epoch: 54, train_loss: 0.8103, test_loss: 1.0239, test_f1: 0.5695
 epoch: 55, train_loss: 0.8138, test_loss: 1.0304, test_f1: 0.5697
 epoch: 56, train_loss: 0.8094, test_loss: 1.0186, test_f1: 0.5774
 epoch: 57, train_loss: 0.8044, test_loss: 1.0368, test_f1: 0.5808
 epoch: 58, train_loss: 0.7982, test_loss: 1.0226, test_f1: 0.5711
 epoch: 59, train_loss: 0.8103, test_loss: 1.0225, test_f1: 0.5619
 epoch: 60, train_loss: 0.7918, test_loss: 1.0288, test_f1: 0.5742
 epoch: 61, train_loss: 0.7974, test_loss: 1.0298, test_f1: 0.5711
 epoch: 62, train_loss: 0.7927, test_loss: 1.0112, test_f1: 0.5725
 epoch: 63, train_loss: 0.7756, test_loss: 1.0279, test_f1: 0.5854
 epoch: 64, train_loss: 0.7984, test_loss: 1.0477, test_f1: 0.5900
 epoch: 65, train_loss: 0.7863, test_loss: 1.0460, test_f1: 0.5857
 epoch: 66, train_loss: 0.7849, test_loss: 1.0172, test_f1: 0.5740
 epoch: 67, train_loss: 0.7780, test_loss: 1.0406, test_f1: 0.5809
 epoch: 68, train_loss: 0.7850, test_loss: 1.0212, test_f1: 0.5723
 epoch: 69, train_loss: 0.7699, test_loss: 1.0166, test_f1: 0.5761
 epoch: 70, train_loss: 0.7684, test_loss: 1.0311, test_f1: 0.5932
 epoch: 71, train_loss: 0.7695, test_loss: 1.0317, test_f1: 0.5899
 epoch: 72, train_loss: 0.7648, test_loss: 1.0215, test_f1: 0.5730
 epoch: 73, train_loss: 0.7800, test_loss: 1.0072, test_f1: 0.5830
 epoch: 74, train_loss: 0.7746, test_loss: 1.0300, test_f1: 0.5970
 epoch: 75, train_loss: 0.7605, test_loss: 1.0178, test_f1: 0.5855
 epoch: 76, train_loss: 0.7573, test_loss: 1.0356, test_f1: 0.5928
 epoch: 77, train_loss: 0.7614, test_loss: 1.0529, test_f1: 0.5977
 epoch: 78, train_loss: 0.7662, test_loss: 1.0529, test_f1: 0.5945
 epoch: 79, train_loss: 0.7538, test_loss: 1.0377, test_f1: 0.6016
 epoch: 80, train_loss: 0.7580, test_loss: 1.0348, test_f1: 0.6060
 epoch: 81, train_loss: 0.7555, test_loss: 1.0741, test_f1: 0.6134
 epoch: 82, train_loss: 0.7457, test_loss: 1.0278, test_f1: 0.6216
 epoch: 83, train_loss: 0.7490, test_loss: 1.0533, test_f1: 0.6080
 epoch: 84, train_loss: 0.7499, test_loss: 1.0443, test_f1: 0.6105
 epoch: 85, train_loss: 0.7536, test_loss: 1.0540, test_f1: 0.6302
 epoch: 86, train_loss: 0.7436, test_loss: 1.0384, test_f1: 0.6195
 epoch: 87, train_loss: 0.7379, test_loss: 1.0647, test_f1: 0.5954
 epoch: 88, train_loss: 0.7474, test_loss: 1.0473, test_f1: 0.6124
 epoch: 89, train_loss: 0.7676, test_loss: 1.0687, test_f1: 0.5868
 epoch: 90, train_loss: 0.7512, test_loss: 1.0412, test_f1: 0.6127
 epoch: 91, train_loss: 0.7292, test_loss: 1.0909, test_f1: 0.6041
 epoch: 92, train_loss: 0.7419, test_loss: 1.0412, test_f1: 0.6083
 epoch: 93, train_loss: 0.7248, test_loss: 1.0528, test_f1: 0.6295
 epoch: 94, train_loss: 0.7402, test_loss: 1.0452, test_f1: 0.6193
 epoch: 95, train_loss: 0.7269, test_loss: 1.0863, test_f1: 0.6169
 epoch: 96, train_loss: 0.7381, test_loss: 1.0601, test_f1: 0.6117
 epoch: 97, train_loss: 0.7392, test_loss: 1.1026, test_f1: 0.5970
 epoch: 98, train_loss: 0.7330, test_loss: 1.0744, test_f1: 0.6034
 epoch: 99, train_loss: 0.7304, test_loss: 1.0530, test_f1: 0.6170
##################ITERATION #3 ****************************************
 epoch: 0, train_loss: 1.3818, test_loss: 1.3048, test_f1: 0.2281
 epoch: 1, train_loss: 1.2010, test_loss: 1.2981, test_f1: 0.2281
 epoch: 2, train_loss: 1.1681, test_loss: 1.3002, test_f1: 0.2281
 epoch: 3, train_loss: 1.1562, test_loss: 1.2442, test_f1: 0.2270
 epoch: 4, train_loss: 1.1129, test_loss: 1.1913, test_f1: 0.3548
 epoch: 5, train_loss: 1.1068, test_loss: 1.1521, test_f1: 0.3781
 epoch: 6, train_loss: 1.0772, test_loss: 1.1249, test_f1: 0.4378
 epoch: 7, train_loss: 1.0812, test_loss: 1.0995, test_f1: 0.4470
 epoch: 8, train_loss: 1.0591, test_loss: 1.0888, test_f1: 0.4626
 epoch: 9, train_loss: 1.0535, test_loss: 1.0790, test_f1: 0.4545
 epoch: 10, train_loss: 1.0383, test_loss: 1.0708, test_f1: 0.4663
 epoch: 11, train_loss: 1.0282, test_loss: 1.0701, test_f1: 0.4688
 epoch: 12, train_loss: 1.0046, test_loss: 1.0616, test_f1: 0.4667
 epoch: 13, train_loss: 1.0046, test_loss: 1.0692, test_f1: 0.4727
 epoch: 14, train_loss: 0.9984, test_loss: 1.0462, test_f1: 0.5006
 epoch: 15, train_loss: 0.9935, test_loss: 1.0414, test_f1: 0.5041
 epoch: 16, train_loss: 0.9778, test_loss: 1.0489, test_f1: 0.4869
 epoch: 17, train_loss: 0.9836, test_loss: 1.0404, test_f1: 0.5260
 epoch: 18, train_loss: 0.9672, test_loss: 1.0536, test_f1: 0.5318
 epoch: 19, train_loss: 0.9558, test_loss: 1.0390, test_f1: 0.5082
 epoch: 20, train_loss: 0.9526, test_loss: 1.0215, test_f1: 0.5173
 epoch: 21, train_loss: 0.9455, test_loss: 1.0373, test_f1: 0.5564
 epoch: 22, train_loss: 0.9449, test_loss: 1.0545, test_f1: 0.5449
 epoch: 23, train_loss: 0.9291, test_loss: 1.0380, test_f1: 0.5555
 epoch: 24, train_loss: 0.9311, test_loss: 1.0346, test_f1: 0.5006
 epoch: 25, train_loss: 0.9267, test_loss: 1.0249, test_f1: 0.5599
 epoch: 26, train_loss: 0.9229, test_loss: 1.0304, test_f1: 0.5284
 epoch: 27, train_loss: 0.9050, test_loss: 1.0339, test_f1: 0.5481
 epoch: 28, train_loss: 0.9063, test_loss: 1.0281, test_f1: 0.5575
 epoch: 29, train_loss: 0.8996, test_loss: 1.0239, test_f1: 0.5359
 epoch: 30, train_loss: 0.8984, test_loss: 1.0224, test_f1: 0.5233
 epoch: 31, train_loss: 0.8964, test_loss: 1.0296, test_f1: 0.5200
 epoch: 32, train_loss: 0.8797, test_loss: 1.0242, test_f1: 0.5479
 epoch: 33, train_loss: 0.8813, test_loss: 1.0326, test_f1: 0.5423
 epoch: 34, train_loss: 0.8779, test_loss: 1.0094, test_f1: 0.5428
 epoch: 35, train_loss: 0.8724, test_loss: 1.0359, test_f1: 0.5153
 epoch: 36, train_loss: 0.8713, test_loss: 1.0329, test_f1: 0.4958
 epoch: 37, train_loss: 0.8642, test_loss: 1.0243, test_f1: 0.5476
 epoch: 38, train_loss: 0.8730, test_loss: 1.0247, test_f1: 0.5221
 epoch: 39, train_loss: 0.8634, test_loss: 1.0304, test_f1: 0.5215
 epoch: 40, train_loss: 0.8512, test_loss: 1.0252, test_f1: 0.5274
 epoch: 41, train_loss: 0.8558, test_loss: 1.0722, test_f1: 0.5020
 epoch: 42, train_loss: 0.8543, test_loss: 1.0380, test_f1: 0.5661
 epoch: 43, train_loss: 0.8374, test_loss: 1.0390, test_f1: 0.5252
 epoch: 44, train_loss: 0.8401, test_loss: 1.0382, test_f1: 0.5257
 epoch: 45, train_loss: 0.8567, test_loss: 1.0361, test_f1: 0.5450
 epoch: 46, train_loss: 0.8464, test_loss: 1.0342, test_f1: 0.5027
 epoch: 47, train_loss: 0.8327, test_loss: 1.0174, test_f1: 0.5439
 epoch: 48, train_loss: 0.8373, test_loss: 1.0483, test_f1: 0.5163
 epoch: 49, train_loss: 0.8261, test_loss: 1.0472, test_f1: 0.5077
 epoch: 50, train_loss: 0.8195, test_loss: 1.0278, test_f1: 0.5300
 epoch: 51, train_loss: 0.8226, test_loss: 1.0363, test_f1: 0.5327
 epoch: 52, train_loss: 0.8128, test_loss: 1.0537, test_f1: 0.5097
 epoch: 53, train_loss: 0.8049, test_loss: 1.0386, test_f1: 0.5298
 epoch: 54, train_loss: 0.7994, test_loss: 1.0508, test_f1: 0.5122
 epoch: 55, train_loss: 0.7992, test_loss: 1.0414, test_f1: 0.5220
 epoch: 56, train_loss: 0.8090, test_loss: 1.0577, test_f1: 0.5384
 epoch: 57, train_loss: 0.8021, test_loss: 1.0619, test_f1: 0.5282
 epoch: 58, train_loss: 0.7962, test_loss: 1.0370, test_f1: 0.5484
 epoch: 59, train_loss: 0.7958, test_loss: 1.0573, test_f1: 0.5239
 epoch: 60, train_loss: 0.7888, test_loss: 1.0592, test_f1: 0.5425
 epoch: 61, train_loss: 0.7944, test_loss: 1.0603, test_f1: 0.5211
 epoch: 62, train_loss: 0.7926, test_loss: 1.0626, test_f1: 0.5191
 epoch: 63, train_loss: 0.7932, test_loss: 1.0533, test_f1: 0.5437
 epoch: 64, train_loss: 0.7979, test_loss: 1.0633, test_f1: 0.5181
 epoch: 65, train_loss: 0.7897, test_loss: 1.0626, test_f1: 0.5361
 epoch: 66, train_loss: 0.7933, test_loss: 1.0491, test_f1: 0.5375
 epoch: 67, train_loss: 0.7966, test_loss: 1.0720, test_f1: 0.5376
 epoch: 68, train_loss: 0.7967, test_loss: 1.0814, test_f1: 0.5195
 epoch: 69, train_loss: 0.7904, test_loss: 1.0703, test_f1: 0.5235
 epoch: 70, train_loss: 0.7811, test_loss: 1.0747, test_f1: 0.5323
 epoch: 71, train_loss: 0.7733, test_loss: 1.0692, test_f1: 0.5435
 epoch: 72, train_loss: 0.7817, test_loss: 1.0559, test_f1: 0.5379
 epoch: 73, train_loss: 0.7933, test_loss: 1.0599, test_f1: 0.5535
 epoch: 74, train_loss: 0.7664, test_loss: 1.0717, test_f1: 0.5357
 epoch: 75, train_loss: 0.7700, test_loss: 1.0811, test_f1: 0.5262
 epoch: 76, train_loss: 0.7733, test_loss: 1.0779, test_f1: 0.5335
 epoch: 77, train_loss: 0.7588, test_loss: 1.0706, test_f1: 0.5421
 epoch: 78, train_loss: 0.7569, test_loss: 1.0903, test_f1: 0.5271
 epoch: 79, train_loss: 0.7742, test_loss: 1.0846, test_f1: 0.5283
 epoch: 80, train_loss: 0.7544, test_loss: 1.0808, test_f1: 0.5314
 epoch: 81, train_loss: 0.7768, test_loss: 1.1075, test_f1: 0.5179
 epoch: 82, train_loss: 0.7583, test_loss: 1.0890, test_f1: 0.5396
 epoch: 83, train_loss: 0.7526, test_loss: 1.1072, test_f1: 0.5311
 epoch: 84, train_loss: 0.7670, test_loss: 1.0719, test_f1: 0.5294
 epoch: 85, train_loss: 0.7647, test_loss: 1.0562, test_f1: 0.5591
 epoch: 86, train_loss: 0.7677, test_loss: 1.0579, test_f1: 0.5234
 epoch: 87, train_loss: 0.7789, test_loss: 1.0818, test_f1: 0.5252
 epoch: 88, train_loss: 0.7702, test_loss: 1.0838, test_f1: 0.5474
 epoch: 89, train_loss: 0.7646, test_loss: 1.0841, test_f1: 0.5329
 epoch: 90, train_loss: 0.7587, test_loss: 1.0893, test_f1: 0.5339
 epoch: 91, train_loss: 0.7454, test_loss: 1.1077, test_f1: 0.5321
 epoch: 92, train_loss: 0.7490, test_loss: 1.0866, test_f1: 0.5214
 epoch: 93, train_loss: 0.7524, test_loss: 1.0789, test_f1: 0.5328
 epoch: 94, train_loss: 0.7394, test_loss: 1.0955, test_f1: 0.5416
 epoch: 95, train_loss: 0.7435, test_loss: 1.0940, test_f1: 0.5377
 epoch: 96, train_loss: 0.7466, test_loss: 1.0968, test_f1: 0.5305
 epoch: 97, train_loss: 0.7518, test_loss: 1.1240, test_f1: 0.5353
 epoch: 98, train_loss: 0.7473, test_loss: 1.0974, test_f1: 0.5301
 epoch: 99, train_loss: 0.7627, test_loss: 1.1064, test_f1: 0.5262
##################ITERATION #4 ****************************************
 epoch: 0, train_loss: 1.2274, test_loss: 1.3116, test_f1: 0.2281
 epoch: 1, train_loss: 1.1473, test_loss: 1.3270, test_f1: 0.2281
 epoch: 2, train_loss: 1.1079, test_loss: 1.2840, test_f1: 0.2281
 epoch: 3, train_loss: 1.0876, test_loss: 1.2061, test_f1: 0.2441
 epoch: 4, train_loss: 1.0619, test_loss: 1.1739, test_f1: 0.3487
 epoch: 5, train_loss: 1.0468, test_loss: 1.1467, test_f1: 0.4007
 epoch: 6, train_loss: 1.0457, test_loss: 1.1322, test_f1: 0.4117
 epoch: 7, train_loss: 1.0335, test_loss: 1.1076, test_f1: 0.4073
 epoch: 8, train_loss: 1.0201, test_loss: 1.1010, test_f1: 0.4350
 epoch: 9, train_loss: 1.0021, test_loss: 1.0813, test_f1: 0.4148
 epoch: 10, train_loss: 1.0126, test_loss: 1.0867, test_f1: 0.4552
 epoch: 11, train_loss: 0.9970, test_loss: 1.0817, test_f1: 0.4780
 epoch: 12, train_loss: 0.9849, test_loss: 1.0765, test_f1: 0.4651
 epoch: 13, train_loss: 0.9814, test_loss: 1.0558, test_f1: 0.5068
 epoch: 14, train_loss: 0.9701, test_loss: 1.0519, test_f1: 0.5056
 epoch: 15, train_loss: 0.9664, test_loss: 1.0555, test_f1: 0.5177
 epoch: 16, train_loss: 0.9747, test_loss: 1.0547, test_f1: 0.5099
 epoch: 17, train_loss: 0.9605, test_loss: 1.0454, test_f1: 0.5031
 epoch: 18, train_loss: 0.9501, test_loss: 1.0468, test_f1: 0.5241
 epoch: 19, train_loss: 0.9580, test_loss: 1.0452, test_f1: 0.5227
 epoch: 20, train_loss: 0.9457, test_loss: 1.0355, test_f1: 0.5138
 epoch: 21, train_loss: 0.9449, test_loss: 1.0359, test_f1: 0.5339
 epoch: 22, train_loss: 0.9332, test_loss: 1.0222, test_f1: 0.5263
 epoch: 23, train_loss: 0.9353, test_loss: 1.0270, test_f1: 0.5286
 epoch: 24, train_loss: 0.9364, test_loss: 1.0220, test_f1: 0.5495
 epoch: 25, train_loss: 0.9384, test_loss: 1.0234, test_f1: 0.5402
 epoch: 26, train_loss: 0.9353, test_loss: 1.0284, test_f1: 0.5364
 epoch: 27, train_loss: 0.9372, test_loss: 1.0219, test_f1: 0.5450
 epoch: 28, train_loss: 0.9290, test_loss: 1.0182, test_f1: 0.5451
 epoch: 29, train_loss: 0.9276, test_loss: 1.0138, test_f1: 0.5280
 epoch: 30, train_loss: 0.9095, test_loss: 1.0210, test_f1: 0.5412
 epoch: 31, train_loss: 0.9214, test_loss: 1.0309, test_f1: 0.5242
 epoch: 32, train_loss: 0.9081, test_loss: 1.0206, test_f1: 0.5347
 epoch: 33, train_loss: 0.9125, test_loss: 1.0220, test_f1: 0.5497
 epoch: 34, train_loss: 0.9156, test_loss: 1.0179, test_f1: 0.5514
 epoch: 35, train_loss: 0.8983, test_loss: 1.0110, test_f1: 0.5624
 epoch: 36, train_loss: 0.9048, test_loss: 1.0047, test_f1: 0.5503
 epoch: 37, train_loss: 0.9036, test_loss: 1.0143, test_f1: 0.5487
 epoch: 38, train_loss: 0.8994, test_loss: 1.0067, test_f1: 0.5558
 epoch: 39, train_loss: 0.8973, test_loss: 0.9983, test_f1: 0.5510
 epoch: 40, train_loss: 0.8849, test_loss: 1.0020, test_f1: 0.5770
 epoch: 41, train_loss: 0.8870, test_loss: 0.9978, test_f1: 0.5507
 epoch: 42, train_loss: 0.8747, test_loss: 1.0054, test_f1: 0.5455
 epoch: 43, train_loss: 0.8788, test_loss: 0.9932, test_f1: 0.5496
 epoch: 44, train_loss: 0.8769, test_loss: 0.9902, test_f1: 0.5318
 epoch: 45, train_loss: 0.8668, test_loss: 0.9805, test_f1: 0.5735
 epoch: 46, train_loss: 0.8655, test_loss: 1.0142, test_f1: 0.5487
 epoch: 47, train_loss: 0.8667, test_loss: 0.9877, test_f1: 0.5653
 epoch: 48, train_loss: 0.8614, test_loss: 0.9808, test_f1: 0.5771
 epoch: 49, train_loss: 0.8602, test_loss: 0.9826, test_f1: 0.5719
 epoch: 50, train_loss: 0.8652, test_loss: 0.9960, test_f1: 0.5278
 epoch: 51, train_loss: 0.8494, test_loss: 0.9768, test_f1: 0.5783
 epoch: 52, train_loss: 0.8470, test_loss: 0.9775, test_f1: 0.5684
 epoch: 53, train_loss: 0.8475, test_loss: 0.9899, test_f1: 0.5554
 epoch: 54, train_loss: 0.8527, test_loss: 0.9916, test_f1: 0.5622
 epoch: 55, train_loss: 0.8347, test_loss: 0.9817, test_f1: 0.5864
 epoch: 56, train_loss: 0.8316, test_loss: 0.9744, test_f1: 0.5928
 epoch: 57, train_loss: 0.8418, test_loss: 0.9795, test_f1: 0.5933
 epoch: 58, train_loss: 0.8341, test_loss: 0.9684, test_f1: 0.5864
 epoch: 59, train_loss: 0.8351, test_loss: 0.9672, test_f1: 0.5919
 epoch: 60, train_loss: 0.8254, test_loss: 0.9717, test_f1: 0.5761
 epoch: 61, train_loss: 0.8430, test_loss: 0.9761, test_f1: 0.5879
 epoch: 62, train_loss: 0.8355, test_loss: 0.9686, test_f1: 0.5922
 epoch: 63, train_loss: 0.8300, test_loss: 0.9809, test_f1: 0.5811
 epoch: 64, train_loss: 0.8277, test_loss: 0.9758, test_f1: 0.5743
 epoch: 65, train_loss: 0.8216, test_loss: 0.9758, test_f1: 0.5853
 epoch: 66, train_loss: 0.8297, test_loss: 0.9616, test_f1: 0.5930
 epoch: 67, train_loss: 0.8255, test_loss: 0.9644, test_f1: 0.5945
 epoch: 68, train_loss: 0.8072, test_loss: 0.9699, test_f1: 0.5714
 epoch: 69, train_loss: 0.8158, test_loss: 0.9721, test_f1: 0.5770
 epoch: 70, train_loss: 0.8151, test_loss: 0.9813, test_f1: 0.5548
 epoch: 71, train_loss: 0.8241, test_loss: 0.9781, test_f1: 0.5594
 epoch: 72, train_loss: 0.8052, test_loss: 0.9835, test_f1: 0.5778
 epoch: 73, train_loss: 0.8176, test_loss: 0.9729, test_f1: 0.5793
 epoch: 74, train_loss: 0.7906, test_loss: 0.9618, test_f1: 0.5796
 epoch: 75, train_loss: 0.8172, test_loss: 0.9706, test_f1: 0.5773
 epoch: 76, train_loss: 0.8041, test_loss: 0.9696, test_f1: 0.5909
 epoch: 77, train_loss: 0.8086, test_loss: 0.9752, test_f1: 0.5642
 epoch: 78, train_loss: 0.7998, test_loss: 0.9749, test_f1: 0.5754
 epoch: 79, train_loss: 0.8092, test_loss: 0.9944, test_f1: 0.5410
 epoch: 80, train_loss: 0.8043, test_loss: 0.9829, test_f1: 0.5910
 epoch: 81, train_loss: 0.8074, test_loss: 0.9831, test_f1: 0.5644
 epoch: 82, train_loss: 0.8006, test_loss: 0.9752, test_f1: 0.5726
 epoch: 83, train_loss: 0.8122, test_loss: 0.9736, test_f1: 0.5904
 epoch: 84, train_loss: 0.7867, test_loss: 0.9794, test_f1: 0.5743
 epoch: 85, train_loss: 0.7910, test_loss: 1.0000, test_f1: 0.5419
 epoch: 86, train_loss: 0.7932, test_loss: 0.9765, test_f1: 0.5510
 epoch: 87, train_loss: 0.7836, test_loss: 0.9839, test_f1: 0.5588
 epoch: 88, train_loss: 0.7960, test_loss: 0.9777, test_f1: 0.5775
 epoch: 89, train_loss: 0.7950, test_loss: 0.9714, test_f1: 0.5781
 epoch: 90, train_loss: 0.7694, test_loss: 0.9696, test_f1: 0.5577
 epoch: 91, train_loss: 0.7772, test_loss: 0.9698, test_f1: 0.5756
 epoch: 92, train_loss: 0.7782, test_loss: 0.9675, test_f1: 0.5634
 epoch: 93, train_loss: 0.7770, test_loss: 0.9665, test_f1: 0.5736
 epoch: 94, train_loss: 0.7688, test_loss: 0.9777, test_f1: 0.5572
 epoch: 95, train_loss: 0.7773, test_loss: 0.9700, test_f1: 0.5571
 epoch: 96, train_loss: 0.7659, test_loss: 0.9729, test_f1: 0.5582
 epoch: 97, train_loss: 0.7731, test_loss: 0.9872, test_f1: 0.5793
 epoch: 98, train_loss: 0.7646, test_loss: 0.9741, test_f1: 0.5775
 epoch: 99, train_loss: 0.7790, test_loss: 0.9684, test_f1: 0.5651
##################ITERATION #5 ****************************************
 epoch: 0, train_loss: 1.4375, test_loss: 1.5355, test_f1: 0.0507
 epoch: 1, train_loss: 1.2464, test_loss: 1.4864, test_f1: 0.0507
 epoch: 2, train_loss: 1.1869, test_loss: 1.4046, test_f1: 0.2398
 epoch: 3, train_loss: 1.1381, test_loss: 1.3105, test_f1: 0.2438
 epoch: 4, train_loss: 1.0935, test_loss: 1.2126, test_f1: 0.3083
 epoch: 5, train_loss: 1.0956, test_loss: 1.1415, test_f1: 0.3811
 epoch: 6, train_loss: 1.0646, test_loss: 1.0988, test_f1: 0.4134
 epoch: 7, train_loss: 1.0489, test_loss: 1.0966, test_f1: 0.4035
 epoch: 8, train_loss: 1.0385, test_loss: 1.0884, test_f1: 0.4767
 epoch: 9, train_loss: 1.0288, test_loss: 1.0739, test_f1: 0.4860
 epoch: 10, train_loss: 1.0117, test_loss: 1.0652, test_f1: 0.4899
 epoch: 11, train_loss: 1.0111, test_loss: 1.0660, test_f1: 0.4859
 epoch: 12, train_loss: 1.0058, test_loss: 1.0677, test_f1: 0.4848
 epoch: 13, train_loss: 0.9983, test_loss: 1.0609, test_f1: 0.4982
 epoch: 14, train_loss: 0.9915, test_loss: 1.0533, test_f1: 0.4989
 epoch: 15, train_loss: 0.9763, test_loss: 1.0425, test_f1: 0.5065
 epoch: 16, train_loss: 0.9760, test_loss: 1.0521, test_f1: 0.4906
 epoch: 17, train_loss: 0.9647, test_loss: 1.0516, test_f1: 0.5008
 epoch: 18, train_loss: 0.9659, test_loss: 1.0424, test_f1: 0.5156
 epoch: 19, train_loss: 0.9605, test_loss: 1.0340, test_f1: 0.5192
 epoch: 20, train_loss: 0.9509, test_loss: 1.0277, test_f1: 0.5391
 epoch: 21, train_loss: 0.9426, test_loss: 1.0380, test_f1: 0.5211
 epoch: 22, train_loss: 0.9575, test_loss: 1.0321, test_f1: 0.5363
 epoch: 23, train_loss: 0.9451, test_loss: 1.0235, test_f1: 0.5300
 epoch: 24, train_loss: 0.9320, test_loss: 1.0227, test_f1: 0.5304
 epoch: 25, train_loss: 0.9295, test_loss: 1.0292, test_f1: 0.5117
 epoch: 26, train_loss: 0.9269, test_loss: 1.0216, test_f1: 0.5491
 epoch: 27, train_loss: 0.9117, test_loss: 1.0230, test_f1: 0.5133
 epoch: 28, train_loss: 0.9178, test_loss: 1.0266, test_f1: 0.5207
 epoch: 29, train_loss: 0.9091, test_loss: 1.0118, test_f1: 0.5280
 epoch: 30, train_loss: 0.9016, test_loss: 1.0143, test_f1: 0.5391
 epoch: 31, train_loss: 0.9141, test_loss: 1.0108, test_f1: 0.5385
 epoch: 32, train_loss: 0.9052, test_loss: 1.0186, test_f1: 0.5443
 epoch: 33, train_loss: 0.8930, test_loss: 0.9952, test_f1: 0.5501
 epoch: 34, train_loss: 0.8985, test_loss: 1.0075, test_f1: 0.5306
 epoch: 35, train_loss: 0.8824, test_loss: 1.0069, test_f1: 0.5474
 epoch: 36, train_loss: 0.8860, test_loss: 1.0025, test_f1: 0.5718
 epoch: 37, train_loss: 0.8926, test_loss: 1.0011, test_f1: 0.5712
 epoch: 38, train_loss: 0.8846, test_loss: 1.0056, test_f1: 0.5843
 epoch: 39, train_loss: 0.8769, test_loss: 1.0076, test_f1: 0.5558
 epoch: 40, train_loss: 0.8730, test_loss: 0.9964, test_f1: 0.5858
 epoch: 41, train_loss: 0.8780, test_loss: 0.9908, test_f1: 0.5684
 epoch: 42, train_loss: 0.8676, test_loss: 1.0066, test_f1: 0.5582
 epoch: 43, train_loss: 0.8627, test_loss: 0.9823, test_f1: 0.5636
 epoch: 44, train_loss: 0.8420, test_loss: 0.9778, test_f1: 0.5617
 epoch: 45, train_loss: 0.8558, test_loss: 0.9874, test_f1: 0.5702
 epoch: 46, train_loss: 0.8421, test_loss: 0.9938, test_f1: 0.5743
 epoch: 47, train_loss: 0.8609, test_loss: 0.9881, test_f1: 0.5807
 epoch: 48, train_loss: 0.8287, test_loss: 0.9819, test_f1: 0.5786
 epoch: 49, train_loss: 0.8230, test_loss: 0.9761, test_f1: 0.5614
 epoch: 50, train_loss: 0.8284, test_loss: 0.9815, test_f1: 0.5702
 epoch: 51, train_loss: 0.8284, test_loss: 0.9871, test_f1: 0.5877
 epoch: 52, train_loss: 0.8185, test_loss: 0.9782, test_f1: 0.5867
 epoch: 53, train_loss: 0.8189, test_loss: 0.9686, test_f1: 0.5754
 epoch: 54, train_loss: 0.8139, test_loss: 0.9668, test_f1: 0.5619
 epoch: 55, train_loss: 0.8211, test_loss: 0.9704, test_f1: 0.5803
 epoch: 56, train_loss: 0.8081, test_loss: 0.9728, test_f1: 0.5692
 epoch: 57, train_loss: 0.8227, test_loss: 0.9827, test_f1: 0.5697
 epoch: 58, train_loss: 0.8148, test_loss: 0.9738, test_f1: 0.5877
 epoch: 59, train_loss: 0.8084, test_loss: 0.9617, test_f1: 0.5791
 epoch: 60, train_loss: 0.7954, test_loss: 0.9709, test_f1: 0.5831
 epoch: 61, train_loss: 0.7942, test_loss: 0.9594, test_f1: 0.5636
 epoch: 62, train_loss: 0.7943, test_loss: 0.9718, test_f1: 0.5730
 epoch: 63, train_loss: 0.8060, test_loss: 0.9808, test_f1: 0.6051
 epoch: 64, train_loss: 0.7896, test_loss: 0.9705, test_f1: 0.5924
 epoch: 65, train_loss: 0.7930, test_loss: 0.9779, test_f1: 0.6017
 epoch: 66, train_loss: 0.7893, test_loss: 0.9710, test_f1: 0.6229
 epoch: 67, train_loss: 0.7832, test_loss: 0.9686, test_f1: 0.6124
 epoch: 68, train_loss: 0.7771, test_loss: 0.9794, test_f1: 0.6153
 epoch: 69, train_loss: 0.7863, test_loss: 0.9564, test_f1: 0.6115
 epoch: 70, train_loss: 0.7797, test_loss: 0.9561, test_f1: 0.6138
 epoch: 71, train_loss: 0.7836, test_loss: 0.9567, test_f1: 0.6106
 epoch: 72, train_loss: 0.7806, test_loss: 0.9590, test_f1: 0.6044
 epoch: 73, train_loss: 0.7671, test_loss: 0.9686, test_f1: 0.6175
 epoch: 74, train_loss: 0.7731, test_loss: 0.9557, test_f1: 0.6039
 epoch: 75, train_loss: 0.7700, test_loss: 0.9493, test_f1: 0.6128
 epoch: 76, train_loss: 0.7778, test_loss: 0.9501, test_f1: 0.6225
 epoch: 77, train_loss: 0.7580, test_loss: 0.9460, test_f1: 0.6154
 epoch: 78, train_loss: 0.7573, test_loss: 0.9465, test_f1: 0.6184
 epoch: 79, train_loss: 0.7725, test_loss: 0.9562, test_f1: 0.6107
 epoch: 80, train_loss: 0.7548, test_loss: 0.9733, test_f1: 0.6281
 epoch: 81, train_loss: 0.7551, test_loss: 0.9528, test_f1: 0.6227
 epoch: 82, train_loss: 0.7488, test_loss: 0.9503, test_f1: 0.6178
 epoch: 83, train_loss: 0.7535, test_loss: 0.9688, test_f1: 0.6115
 epoch: 84, train_loss: 0.7566, test_loss: 0.9638, test_f1: 0.6136
 epoch: 85, train_loss: 0.7424, test_loss: 0.9420, test_f1: 0.6045
 epoch: 86, train_loss: 0.7576, test_loss: 0.9470, test_f1: 0.6109
 epoch: 87, train_loss: 0.7509, test_loss: 0.9445, test_f1: 0.6344
 epoch: 88, train_loss: 0.7594, test_loss: 0.9438, test_f1: 0.6082
 epoch: 89, train_loss: 0.7429, test_loss: 0.9502, test_f1: 0.6265
 epoch: 90, train_loss: 0.7368, test_loss: 0.9623, test_f1: 0.6356
 epoch: 91, train_loss: 0.7280, test_loss: 0.9906, test_f1: 0.5988
 epoch: 92, train_loss: 0.7576, test_loss: 0.9670, test_f1: 0.6337
 epoch: 93, train_loss: 0.7360, test_loss: 0.9449, test_f1: 0.6337
 epoch: 94, train_loss: 0.7361, test_loss: 0.9641, test_f1: 0.6248
 epoch: 95, train_loss: 0.7310, test_loss: 0.9509, test_f1: 0.6100
 epoch: 96, train_loss: 0.7432, test_loss: 0.9773, test_f1: 0.6093
 epoch: 97, train_loss: 0.7377, test_loss: 0.9594, test_f1: 0.6361
 epoch: 98, train_loss: 0.7391, test_loss: 0.9575, test_f1: 0.6131
 epoch: 99, train_loss: 0.7187, test_loss: 0.9508, test_f1: 0.6238
##################ITERATION #6 ****************************************
 epoch: 0, train_loss: 1.3016, test_loss: 1.3343, test_f1: 0.2281
 epoch: 1, train_loss: 1.1795, test_loss: 1.3285, test_f1: 0.2281
 epoch: 2, train_loss: 1.1383, test_loss: 1.3523, test_f1: 0.3061
 epoch: 3, train_loss: 1.1161, test_loss: 1.2625, test_f1: 0.2662
 epoch: 4, train_loss: 1.0892, test_loss: 1.1615, test_f1: 0.4153
 epoch: 5, train_loss: 1.0670, test_loss: 1.1284, test_f1: 0.4245
 epoch: 6, train_loss: 1.0564, test_loss: 1.1053, test_f1: 0.4236
 epoch: 7, train_loss: 1.0318, test_loss: 1.0994, test_f1: 0.4377
 epoch: 8, train_loss: 1.0447, test_loss: 1.0912, test_f1: 0.4751
 epoch: 9, train_loss: 1.0172, test_loss: 1.0831, test_f1: 0.4617
 epoch: 10, train_loss: 1.0136, test_loss: 1.0822, test_f1: 0.4779
 epoch: 11, train_loss: 1.0061, test_loss: 1.0728, test_f1: 0.4963
 epoch: 12, train_loss: 0.9950, test_loss: 1.0714, test_f1: 0.4926
 epoch: 13, train_loss: 0.9897, test_loss: 1.0767, test_f1: 0.4927
 epoch: 14, train_loss: 0.9836, test_loss: 1.0668, test_f1: 0.5023
 epoch: 15, train_loss: 0.9851, test_loss: 1.0710, test_f1: 0.4922
 epoch: 16, train_loss: 0.9848, test_loss: 1.0624, test_f1: 0.5009
 epoch: 17, train_loss: 0.9631, test_loss: 1.0612, test_f1: 0.5002
 epoch: 18, train_loss: 0.9757, test_loss: 1.0585, test_f1: 0.5046
 epoch: 19, train_loss: 0.9778, test_loss: 1.0569, test_f1: 0.4972
 epoch: 20, train_loss: 0.9777, test_loss: 1.0520, test_f1: 0.5076
 epoch: 21, train_loss: 0.9549, test_loss: 1.0447, test_f1: 0.4960
 epoch: 22, train_loss: 0.9570, test_loss: 1.0403, test_f1: 0.5134
 epoch: 23, train_loss: 0.9574, test_loss: 1.0455, test_f1: 0.5102
 epoch: 24, train_loss: 0.9468, test_loss: 1.0386, test_f1: 0.5183
 epoch: 25, train_loss: 0.9466, test_loss: 1.0503, test_f1: 0.5100
 epoch: 26, train_loss: 0.9492, test_loss: 1.0355, test_f1: 0.5316
 epoch: 27, train_loss: 0.9492, test_loss: 1.0241, test_f1: 0.5425
 epoch: 28, train_loss: 0.9485, test_loss: 1.0227, test_f1: 0.5513
 epoch: 29, train_loss: 0.9372, test_loss: 1.0303, test_f1: 0.5412
 epoch: 30, train_loss: 0.9277, test_loss: 1.0255, test_f1: 0.5374
 epoch: 31, train_loss: 0.9223, test_loss: 1.0143, test_f1: 0.5309
 epoch: 32, train_loss: 0.9320, test_loss: 1.0193, test_f1: 0.5194
 epoch: 33, train_loss: 0.9276, test_loss: 1.0086, test_f1: 0.5381
 epoch: 34, train_loss: 0.9076, test_loss: 1.0108, test_f1: 0.5507
 epoch: 35, train_loss: 0.9194, test_loss: 1.0139, test_f1: 0.5241
 epoch: 36, train_loss: 0.9017, test_loss: 1.0125, test_f1: 0.5479
 epoch: 37, train_loss: 0.9126, test_loss: 1.0107, test_f1: 0.5312
 epoch: 38, train_loss: 0.8982, test_loss: 1.0119, test_f1: 0.5386
 epoch: 39, train_loss: 0.9059, test_loss: 1.0161, test_f1: 0.5539
 epoch: 40, train_loss: 0.8941, test_loss: 0.9975, test_f1: 0.5518
 epoch: 41, train_loss: 0.8990, test_loss: 1.0025, test_f1: 0.5571
 epoch: 42, train_loss: 0.8879, test_loss: 0.9976, test_f1: 0.5810
 epoch: 43, train_loss: 0.8750, test_loss: 1.0016, test_f1: 0.5546
 epoch: 44, train_loss: 0.8789, test_loss: 1.0080, test_f1: 0.5585
 epoch: 45, train_loss: 0.8686, test_loss: 0.9903, test_f1: 0.5624
 epoch: 46, train_loss: 0.8677, test_loss: 1.0662, test_f1: 0.5179
 epoch: 47, train_loss: 0.8601, test_loss: 1.0272, test_f1: 0.5570
 epoch: 48, train_loss: 0.8606, test_loss: 1.0041, test_f1: 0.5736
 epoch: 49, train_loss: 0.8539, test_loss: 1.0010, test_f1: 0.5725
 epoch: 50, train_loss: 0.8385, test_loss: 0.9855, test_f1: 0.5693
 epoch: 51, train_loss: 0.8334, test_loss: 0.9908, test_f1: 0.5860
 epoch: 52, train_loss: 0.8362, test_loss: 1.0094, test_f1: 0.5936
 epoch: 53, train_loss: 0.8219, test_loss: 1.0090, test_f1: 0.5834
 epoch: 54, train_loss: 0.8221, test_loss: 0.9963, test_f1: 0.5943
 epoch: 55, train_loss: 0.8186, test_loss: 0.9936, test_f1: 0.6045
 epoch: 56, train_loss: 0.8309, test_loss: 0.9976, test_f1: 0.5833
 epoch: 57, train_loss: 0.8155, test_loss: 1.0061, test_f1: 0.5586
 epoch: 58, train_loss: 0.8161, test_loss: 1.0083, test_f1: 0.5921
 epoch: 59, train_loss: 0.8055, test_loss: 1.0009, test_f1: 0.5806
 epoch: 60, train_loss: 0.8147, test_loss: 1.0107, test_f1: 0.5885
 epoch: 61, train_loss: 0.8014, test_loss: 1.0035, test_f1: 0.5630
 epoch: 62, train_loss: 0.8116, test_loss: 0.9947, test_f1: 0.5734
 epoch: 63, train_loss: 0.8173, test_loss: 1.0066, test_f1: 0.6084
 epoch: 64, train_loss: 0.8148, test_loss: 0.9777, test_f1: 0.6024
 epoch: 65, train_loss: 0.8074, test_loss: 0.9830, test_f1: 0.5828
 epoch: 66, train_loss: 0.7901, test_loss: 1.0076, test_f1: 0.5734
 epoch: 67, train_loss: 0.7978, test_loss: 0.9882, test_f1: 0.5747
 epoch: 68, train_loss: 0.8083, test_loss: 1.0065, test_f1: 0.5765
 epoch: 69, train_loss: 0.7979, test_loss: 1.0001, test_f1: 0.6064
 epoch: 70, train_loss: 0.8065, test_loss: 0.9788, test_f1: 0.6123
 epoch: 71, train_loss: 0.7917, test_loss: 0.9753, test_f1: 0.5957
 epoch: 72, train_loss: 0.7918, test_loss: 0.9795, test_f1: 0.5841
 epoch: 73, train_loss: 0.7849, test_loss: 0.9964, test_f1: 0.5691
 epoch: 74, train_loss: 0.7805, test_loss: 0.9959, test_f1: 0.5888
 epoch: 75, train_loss: 0.7904, test_loss: 0.9830, test_f1: 0.5883
 epoch: 76, train_loss: 0.7924, test_loss: 0.9850, test_f1: 0.6072
 epoch: 77, train_loss: 0.8090, test_loss: 0.9913, test_f1: 0.5713
 epoch: 78, train_loss: 0.7832, test_loss: 0.9908, test_f1: 0.6026
 epoch: 79, train_loss: 0.7756, test_loss: 0.9777, test_f1: 0.5860
 epoch: 80, train_loss: 0.7932, test_loss: 1.0082, test_f1: 0.5812
 epoch: 81, train_loss: 0.7706, test_loss: 1.0090, test_f1: 0.5932
 epoch: 82, train_loss: 0.7907, test_loss: 1.0048, test_f1: 0.5817
 epoch: 83, train_loss: 0.7830, test_loss: 1.0029, test_f1: 0.6211
 epoch: 84, train_loss: 0.7563, test_loss: 0.9907, test_f1: 0.5883
 epoch: 85, train_loss: 0.7680, test_loss: 0.9987, test_f1: 0.6069
 epoch: 86, train_loss: 0.7721, test_loss: 1.0237, test_f1: 0.6004
 epoch: 87, train_loss: 0.7775, test_loss: 0.9871, test_f1: 0.6057
 epoch: 88, train_loss: 0.7635, test_loss: 0.9828, test_f1: 0.6134
 epoch: 89, train_loss: 0.7717, test_loss: 0.9952, test_f1: 0.6050
 epoch: 90, train_loss: 0.7517, test_loss: 1.0273, test_f1: 0.6054
 epoch: 91, train_loss: 0.7647, test_loss: 1.0160, test_f1: 0.6110
 epoch: 92, train_loss: 0.7634, test_loss: 0.9872, test_f1: 0.5965
 epoch: 93, train_loss: 0.7710, test_loss: 0.9905, test_f1: 0.6041
 epoch: 94, train_loss: 0.7618, test_loss: 0.9758, test_f1: 0.5882
 epoch: 95, train_loss: 0.7579, test_loss: 1.0263, test_f1: 0.5961
 epoch: 96, train_loss: 0.7629, test_loss: 0.9873, test_f1: 0.5912
 epoch: 97, train_loss: 0.7588, test_loss: 0.9937, test_f1: 0.6057
 epoch: 98, train_loss: 0.7471, test_loss: 1.0436, test_f1: 0.6079
 epoch: 99, train_loss: 0.7576, test_loss: 1.0202, test_f1: 0.5955
##################ITERATION #7 ****************************************
 epoch: 0, train_loss: 1.3410, test_loss: 1.3523, test_f1: 0.2281
 epoch: 1, train_loss: 1.1938, test_loss: 1.3866, test_f1: 0.2281
 epoch: 2, train_loss: 1.1402, test_loss: 1.3493, test_f1: 0.2720
 epoch: 3, train_loss: 1.1283, test_loss: 1.2456, test_f1: 0.3306
 epoch: 4, train_loss: 1.0988, test_loss: 1.1876, test_f1: 0.4316
 epoch: 5, train_loss: 1.0865, test_loss: 1.1605, test_f1: 0.4405
 epoch: 6, train_loss: 1.0737, test_loss: 1.1482, test_f1: 0.4425
 epoch: 7, train_loss: 1.0688, test_loss: 1.1374, test_f1: 0.4481
 epoch: 8, train_loss: 1.0432, test_loss: 1.1284, test_f1: 0.4538
 epoch: 9, train_loss: 1.0434, test_loss: 1.1318, test_f1: 0.4494
 epoch: 10, train_loss: 1.0456, test_loss: 1.1207, test_f1: 0.4345
 epoch: 11, train_loss: 1.0263, test_loss: 1.1195, test_f1: 0.4466
 epoch: 12, train_loss: 1.0176, test_loss: 1.1205, test_f1: 0.4405
 epoch: 13, train_loss: 0.9991, test_loss: 1.1070, test_f1: 0.4499
 epoch: 14, train_loss: 0.9880, test_loss: 1.1264, test_f1: 0.4473
 epoch: 15, train_loss: 0.9882, test_loss: 1.0919, test_f1: 0.4520
 epoch: 16, train_loss: 0.9775, test_loss: 1.0816, test_f1: 0.4440
 epoch: 17, train_loss: 0.9733, test_loss: 1.1000, test_f1: 0.4794
 epoch: 18, train_loss: 0.9536, test_loss: 1.0741, test_f1: 0.5055
 epoch: 19, train_loss: 0.9653, test_loss: 1.1203, test_f1: 0.4707
 epoch: 20, train_loss: 0.9526, test_loss: 1.0842, test_f1: 0.4828
 epoch: 21, train_loss: 0.9472, test_loss: 1.0587, test_f1: 0.5175
 epoch: 22, train_loss: 0.9371, test_loss: 1.0826, test_f1: 0.4907
 epoch: 23, train_loss: 0.9326, test_loss: 1.0488, test_f1: 0.5257
 epoch: 24, train_loss: 0.9265, test_loss: 1.0690, test_f1: 0.5661
 epoch: 25, train_loss: 0.9257, test_loss: 1.0931, test_f1: 0.5202
 epoch: 26, train_loss: 0.9094, test_loss: 1.0682, test_f1: 0.5556
 epoch: 27, train_loss: 0.9047, test_loss: 1.0572, test_f1: 0.5656
 epoch: 28, train_loss: 0.9139, test_loss: 1.0346, test_f1: 0.5390
 epoch: 29, train_loss: 0.9053, test_loss: 1.0536, test_f1: 0.5340
 epoch: 30, train_loss: 0.8963, test_loss: 1.0865, test_f1: 0.5382
 epoch: 31, train_loss: 0.8888, test_loss: 1.1006, test_f1: 0.5489
 epoch: 32, train_loss: 0.9047, test_loss: 1.0420, test_f1: 0.5602
 epoch: 33, train_loss: 0.8859, test_loss: 1.0180, test_f1: 0.6109
 epoch: 34, train_loss: 0.8872, test_loss: 1.0116, test_f1: 0.5819
 epoch: 35, train_loss: 0.8757, test_loss: 1.0076, test_f1: 0.5773
 epoch: 36, train_loss: 0.8712, test_loss: 1.0334, test_f1: 0.5586
 epoch: 37, train_loss: 0.8568, test_loss: 1.0085, test_f1: 0.5959
 epoch: 38, train_loss: 0.8617, test_loss: 1.0265, test_f1: 0.5855
 epoch: 39, train_loss: 0.8715, test_loss: 1.0138, test_f1: 0.5686
 epoch: 40, train_loss: 0.8622, test_loss: 0.9740, test_f1: 0.5878
 epoch: 41, train_loss: 0.8438, test_loss: 0.9970, test_f1: 0.5930
 epoch: 42, train_loss: 0.8333, test_loss: 1.0084, test_f1: 0.5849
 epoch: 43, train_loss: 0.8355, test_loss: 1.0028, test_f1: 0.5788
 epoch: 44, train_loss: 0.8318, test_loss: 1.0359, test_f1: 0.5995
 epoch: 45, train_loss: 0.8377, test_loss: 1.0649, test_f1: 0.5618
 epoch: 46, train_loss: 0.8429, test_loss: 1.0011, test_f1: 0.6000
 epoch: 47, train_loss: 0.8219, test_loss: 1.0671, test_f1: 0.6050
 epoch: 48, train_loss: 0.8170, test_loss: 1.0065, test_f1: 0.6060
 epoch: 49, train_loss: 0.8156, test_loss: 1.0129, test_f1: 0.6010
 epoch: 50, train_loss: 0.8069, test_loss: 1.0295, test_f1: 0.6003
 epoch: 51, train_loss: 0.8131, test_loss: 0.9842, test_f1: 0.6109
 epoch: 52, train_loss: 0.7976, test_loss: 0.9763, test_f1: 0.6046
 epoch: 53, train_loss: 0.7947, test_loss: 0.9969, test_f1: 0.6060
 epoch: 54, train_loss: 0.8117, test_loss: 0.9845, test_f1: 0.6129
 epoch: 55, train_loss: 0.7821, test_loss: 0.9873, test_f1: 0.6009
 epoch: 56, train_loss: 0.7844, test_loss: 0.9789, test_f1: 0.6143
 epoch: 57, train_loss: 0.7928, test_loss: 1.0215, test_f1: 0.6190
 epoch: 58, train_loss: 0.7818, test_loss: 0.9972, test_f1: 0.6189
 epoch: 59, train_loss: 0.7826, test_loss: 0.9889, test_f1: 0.6072
 epoch: 60, train_loss: 0.7796, test_loss: 1.0016, test_f1: 0.6084
 epoch: 61, train_loss: 0.7826, test_loss: 1.0158, test_f1: 0.6158
 epoch: 62, train_loss: 0.7685, test_loss: 0.9947, test_f1: 0.6150
 epoch: 63, train_loss: 0.7727, test_loss: 0.9944, test_f1: 0.6156
 epoch: 64, train_loss: 0.7709, test_loss: 0.9808, test_f1: 0.6132
 epoch: 65, train_loss: 0.7602, test_loss: 1.0103, test_f1: 0.6220
 epoch: 66, train_loss: 0.7720, test_loss: 0.9977, test_f1: 0.6225
 epoch: 67, train_loss: 0.7678, test_loss: 1.0020, test_f1: 0.6145
 epoch: 68, train_loss: 0.7728, test_loss: 0.9913, test_f1: 0.6064
 epoch: 69, train_loss: 0.7614, test_loss: 0.9921, test_f1: 0.6180
 epoch: 70, train_loss: 0.7550, test_loss: 0.9610, test_f1: 0.6209
 epoch: 71, train_loss: 0.7603, test_loss: 0.9723, test_f1: 0.6301
 epoch: 72, train_loss: 0.7593, test_loss: 1.0057, test_f1: 0.6057
 epoch: 73, train_loss: 0.7693, test_loss: 0.9828, test_f1: 0.6060
 epoch: 74, train_loss: 0.7594, test_loss: 1.0057, test_f1: 0.6053
 epoch: 75, train_loss: 0.7699, test_loss: 0.9864, test_f1: 0.6057
 epoch: 76, train_loss: 0.7636, test_loss: 0.9859, test_f1: 0.6204
 epoch: 77, train_loss: 0.7506, test_loss: 0.9697, test_f1: 0.6090
 epoch: 78, train_loss: 0.7538, test_loss: 1.0174, test_f1: 0.5925
 epoch: 79, train_loss: 0.7389, test_loss: 0.9904, test_f1: 0.6165
 epoch: 80, train_loss: 0.7246, test_loss: 1.0050, test_f1: 0.6008
 epoch: 81, train_loss: 0.7397, test_loss: 1.0295, test_f1: 0.5971
 epoch: 82, train_loss: 0.7314, test_loss: 1.0284, test_f1: 0.6028
 epoch: 83, train_loss: 0.7474, test_loss: 0.9744, test_f1: 0.6230
 epoch: 84, train_loss: 0.7375, test_loss: 0.9895, test_f1: 0.6013
 epoch: 85, train_loss: 0.7309, test_loss: 0.9693, test_f1: 0.6254
 epoch: 86, train_loss: 0.7199, test_loss: 1.0387, test_f1: 0.6052
 epoch: 87, train_loss: 0.7433, test_loss: 1.0016, test_f1: 0.6095
 epoch: 88, train_loss: 0.7171, test_loss: 0.9718, test_f1: 0.6132
 epoch: 89, train_loss: 0.7138, test_loss: 0.9540, test_f1: 0.6266
 epoch: 90, train_loss: 0.7277, test_loss: 0.9795, test_f1: 0.6271
 epoch: 91, train_loss: 0.7353, test_loss: 0.9381, test_f1: 0.6325
 epoch: 92, train_loss: 0.7277, test_loss: 0.9468, test_f1: 0.6238
 epoch: 93, train_loss: 0.7385, test_loss: 0.9732, test_f1: 0.6072
 epoch: 94, train_loss: 0.7123, test_loss: 1.0075, test_f1: 0.5817
 epoch: 95, train_loss: 0.7214, test_loss: 0.9941, test_f1: 0.6216
 epoch: 96, train_loss: 0.7190, test_loss: 1.0175, test_f1: 0.6441
 epoch: 97, train_loss: 0.7278, test_loss: 0.9701, test_f1: 0.6225
 epoch: 98, train_loss: 0.7129, test_loss: 0.9935, test_f1: 0.6063
 epoch: 99, train_loss: 0.7076, test_loss: 0.9982, test_f1: 0.6135
##################ITERATION #8 ****************************************
 epoch: 0, train_loss: 1.4766, test_loss: 1.4730, test_f1: 0.0507
 epoch: 1, train_loss: 1.2437, test_loss: 1.4425, test_f1: 0.2281
 epoch: 2, train_loss: 1.1880, test_loss: 1.3976, test_f1: 0.3235
 epoch: 3, train_loss: 1.1273, test_loss: 1.3408, test_f1: 0.3190
 epoch: 4, train_loss: 1.1058, test_loss: 1.2455, test_f1: 0.3251
 epoch: 5, train_loss: 1.0951, test_loss: 1.1773, test_f1: 0.3934
 epoch: 6, train_loss: 1.0735, test_loss: 1.1464, test_f1: 0.4109
 epoch: 7, train_loss: 1.0583, test_loss: 1.1295, test_f1: 0.4576
 epoch: 8, train_loss: 1.0451, test_loss: 1.1252, test_f1: 0.4640
 epoch: 9, train_loss: 1.0212, test_loss: 1.0962, test_f1: 0.4956
 epoch: 10, train_loss: 1.0170, test_loss: 1.1098, test_f1: 0.5009
 epoch: 11, train_loss: 0.9986, test_loss: 1.1134, test_f1: 0.4969
 epoch: 12, train_loss: 1.0002, test_loss: 1.0891, test_f1: 0.4808
 epoch: 13, train_loss: 0.9962, test_loss: 1.0912, test_f1: 0.4925
 epoch: 14, train_loss: 0.9948, test_loss: 1.0895, test_f1: 0.4875
 epoch: 15, train_loss: 0.9769, test_loss: 1.0916, test_f1: 0.5100
 epoch: 16, train_loss: 0.9728, test_loss: 1.0788, test_f1: 0.4908
 epoch: 17, train_loss: 0.9691, test_loss: 1.0752, test_f1: 0.4771
 epoch: 18, train_loss: 0.9681, test_loss: 1.0806, test_f1: 0.4829
 epoch: 19, train_loss: 0.9774, test_loss: 1.0619, test_f1: 0.4870
 epoch: 20, train_loss: 0.9478, test_loss: 1.0541, test_f1: 0.4921
 epoch: 21, train_loss: 0.9505, test_loss: 1.0723, test_f1: 0.4925
 epoch: 22, train_loss: 0.9427, test_loss: 1.0577, test_f1: 0.4988
 epoch: 23, train_loss: 0.9318, test_loss: 1.0532, test_f1: 0.5048
 epoch: 24, train_loss: 0.9277, test_loss: 1.0527, test_f1: 0.5122
 epoch: 25, train_loss: 0.9207, test_loss: 1.0461, test_f1: 0.5005
 epoch: 26, train_loss: 0.9276, test_loss: 1.0426, test_f1: 0.5277
 epoch: 27, train_loss: 0.9218, test_loss: 1.0432, test_f1: 0.5020
 epoch: 28, train_loss: 0.9300, test_loss: 1.0444, test_f1: 0.5060
 epoch: 29, train_loss: 0.9154, test_loss: 1.0416, test_f1: 0.5064
 epoch: 30, train_loss: 0.9177, test_loss: 1.0392, test_f1: 0.5146
 epoch: 31, train_loss: 0.9101, test_loss: 1.0257, test_f1: 0.5444
 epoch: 32, train_loss: 0.9119, test_loss: 1.0203, test_f1: 0.5355
 epoch: 33, train_loss: 0.8938, test_loss: 1.0185, test_f1: 0.5338
 epoch: 34, train_loss: 0.9164, test_loss: 1.0140, test_f1: 0.5296
 epoch: 35, train_loss: 0.8952, test_loss: 1.0041, test_f1: 0.5328
 epoch: 36, train_loss: 0.8908, test_loss: 1.0078, test_f1: 0.5435
 epoch: 37, train_loss: 0.8860, test_loss: 1.0258, test_f1: 0.5207
 epoch: 38, train_loss: 0.8883, test_loss: 1.0041, test_f1: 0.5299
 epoch: 39, train_loss: 0.8735, test_loss: 0.9954, test_f1: 0.5386
 epoch: 40, train_loss: 0.8578, test_loss: 0.9956, test_f1: 0.5575
 epoch: 41, train_loss: 0.8665, test_loss: 0.9808, test_f1: 0.5386
 epoch: 42, train_loss: 0.8643, test_loss: 1.0119, test_f1: 0.5304
 epoch: 43, train_loss: 0.8613, test_loss: 0.9902, test_f1: 0.5470
 epoch: 44, train_loss: 0.8581, test_loss: 0.9810, test_f1: 0.5670
 epoch: 45, train_loss: 0.8620, test_loss: 1.0001, test_f1: 0.5476
 epoch: 46, train_loss: 0.8679, test_loss: 0.9699, test_f1: 0.5620
 epoch: 47, train_loss: 0.8438, test_loss: 0.9823, test_f1: 0.5373
 epoch: 48, train_loss: 0.8388, test_loss: 0.9592, test_f1: 0.5743
 epoch: 49, train_loss: 0.8293, test_loss: 0.9578, test_f1: 0.5823
 epoch: 50, train_loss: 0.8157, test_loss: 0.9649, test_f1: 0.5672
 epoch: 51, train_loss: 0.8293, test_loss: 0.9712, test_f1: 0.5781
 epoch: 52, train_loss: 0.8220, test_loss: 0.9459, test_f1: 0.6016
 epoch: 53, train_loss: 0.8170, test_loss: 0.9639, test_f1: 0.5751
 epoch: 54, train_loss: 0.8080, test_loss: 0.9560, test_f1: 0.5944
 epoch: 55, train_loss: 0.8291, test_loss: 0.9642, test_f1: 0.5759
 epoch: 56, train_loss: 0.8147, test_loss: 0.9628, test_f1: 0.5814
 epoch: 57, train_loss: 0.8025, test_loss: 0.9647, test_f1: 0.5818
 epoch: 58, train_loss: 0.7970, test_loss: 0.9585, test_f1: 0.5710
 epoch: 59, train_loss: 0.8095, test_loss: 0.9390, test_f1: 0.5963
 epoch: 60, train_loss: 0.7926, test_loss: 0.9454, test_f1: 0.5884
 epoch: 61, train_loss: 0.8043, test_loss: 0.9483, test_f1: 0.6059
 epoch: 62, train_loss: 0.7982, test_loss: 0.9388, test_f1: 0.5907
 epoch: 63, train_loss: 0.7855, test_loss: 0.9364, test_f1: 0.5968
 epoch: 64, train_loss: 0.7962, test_loss: 0.9546, test_f1: 0.5794
 epoch: 65, train_loss: 0.7864, test_loss: 0.9270, test_f1: 0.6176
 epoch: 66, train_loss: 0.7998, test_loss: 0.9472, test_f1: 0.6022
 epoch: 67, train_loss: 0.7827, test_loss: 0.9345, test_f1: 0.6090
 epoch: 68, train_loss: 0.7796, test_loss: 0.9386, test_f1: 0.6014
 epoch: 69, train_loss: 0.7731, test_loss: 0.9346, test_f1: 0.5972
 epoch: 70, train_loss: 0.7768, test_loss: 0.9321, test_f1: 0.5931
 epoch: 71, train_loss: 0.7893, test_loss: 0.9348, test_f1: 0.5906
 epoch: 72, train_loss: 0.7714, test_loss: 0.9341, test_f1: 0.5944
 epoch: 73, train_loss: 0.7620, test_loss: 0.9333, test_f1: 0.5986
 epoch: 74, train_loss: 0.7705, test_loss: 0.9317, test_f1: 0.5949
 epoch: 75, train_loss: 0.7574, test_loss: 0.9316, test_f1: 0.5943
 epoch: 76, train_loss: 0.7746, test_loss: 0.9234, test_f1: 0.6050
 epoch: 77, train_loss: 0.7689, test_loss: 0.9260, test_f1: 0.5827
 epoch: 78, train_loss: 0.7634, test_loss: 0.9216, test_f1: 0.6197
 epoch: 79, train_loss: 0.7591, test_loss: 0.9439, test_f1: 0.5970
 epoch: 80, train_loss: 0.7550, test_loss: 0.9093, test_f1: 0.6077
 epoch: 81, train_loss: 0.7651, test_loss: 0.9001, test_f1: 0.6092
 epoch: 82, train_loss: 0.7660, test_loss: 0.9464, test_f1: 0.5871
 epoch: 83, train_loss: 0.7707, test_loss: 0.9228, test_f1: 0.6088
 epoch: 84, train_loss: 0.7654, test_loss: 0.9376, test_f1: 0.5779
 epoch: 85, train_loss: 0.7629, test_loss: 0.9173, test_f1: 0.6084
 epoch: 86, train_loss: 0.7568, test_loss: 0.9119, test_f1: 0.6018
 epoch: 87, train_loss: 0.7353, test_loss: 0.9095, test_f1: 0.6078
 epoch: 88, train_loss: 0.7539, test_loss: 0.9151, test_f1: 0.6151
 epoch: 89, train_loss: 0.7387, test_loss: 0.8959, test_f1: 0.6114
 epoch: 90, train_loss: 0.7667, test_loss: 0.9336, test_f1: 0.5907
 epoch: 91, train_loss: 0.7340, test_loss: 0.9061, test_f1: 0.5967
 epoch: 92, train_loss: 0.7513, test_loss: 0.9155, test_f1: 0.6016
 epoch: 93, train_loss: 0.7462, test_loss: 0.9101, test_f1: 0.6113
 epoch: 94, train_loss: 0.7307, test_loss: 0.9075, test_f1: 0.6007
 epoch: 95, train_loss: 0.7298, test_loss: 0.9267, test_f1: 0.6093
 epoch: 96, train_loss: 0.7336, test_loss: 0.8953, test_f1: 0.5932
 epoch: 97, train_loss: 0.7366, test_loss: 0.9293, test_f1: 0.6041
 epoch: 98, train_loss: 0.7424, test_loss: 0.8997, test_f1: 0.6184
 epoch: 99, train_loss: 0.7256, test_loss: 0.9110, test_f1: 0.6233
##################ITERATION #9 ****************************************
 epoch: 0, train_loss: 1.3074, test_loss: 1.4293, test_f1: 0.2281
 epoch: 1, train_loss: 1.1488, test_loss: 1.2956, test_f1: 0.2281
 epoch: 2, train_loss: 1.0969, test_loss: 1.2167, test_f1: 0.2336
 epoch: 3, train_loss: 1.0784, test_loss: 1.1444, test_f1: 0.4380
 epoch: 4, train_loss: 1.0434, test_loss: 1.1358, test_f1: 0.4195
 epoch: 5, train_loss: 1.0322, test_loss: 1.1264, test_f1: 0.4773
 epoch: 6, train_loss: 1.0158, test_loss: 1.0819, test_f1: 0.5046
 epoch: 7, train_loss: 1.0000, test_loss: 1.0643, test_f1: 0.5114
 epoch: 8, train_loss: 0.9994, test_loss: 1.0663, test_f1: 0.5076
 epoch: 9, train_loss: 0.9679, test_loss: 1.0684, test_f1: 0.5095
 epoch: 10, train_loss: 0.9700, test_loss: 1.0706, test_f1: 0.5272
 epoch: 11, train_loss: 0.9718, test_loss: 1.0534, test_f1: 0.5300
 epoch: 12, train_loss: 0.9644, test_loss: 1.0330, test_f1: 0.5497
 epoch: 13, train_loss: 0.9330, test_loss: 1.0242, test_f1: 0.5416
 epoch: 14, train_loss: 0.9376, test_loss: 1.0379, test_f1: 0.5483
 epoch: 15, train_loss: 0.9366, test_loss: 1.0460, test_f1: 0.5296
 epoch: 16, train_loss: 0.9112, test_loss: 1.0225, test_f1: 0.5627
 epoch: 17, train_loss: 0.9120, test_loss: 1.0160, test_f1: 0.5493
 epoch: 18, train_loss: 0.9024, test_loss: 1.0449, test_f1: 0.5241
 epoch: 19, train_loss: 0.9047, test_loss: 1.0238, test_f1: 0.5351
 epoch: 20, train_loss: 0.8948, test_loss: 1.0232, test_f1: 0.5635
 epoch: 21, train_loss: 0.8875, test_loss: 1.0485, test_f1: 0.5509
 epoch: 22, train_loss: 0.8860, test_loss: 1.0059, test_f1: 0.5499
 epoch: 23, train_loss: 0.8808, test_loss: 1.0171, test_f1: 0.5368
 epoch: 24, train_loss: 0.8633, test_loss: 1.0045, test_f1: 0.5651
 epoch: 25, train_loss: 0.8645, test_loss: 1.0210, test_f1: 0.5344
 epoch: 26, train_loss: 0.8664, test_loss: 1.0260, test_f1: 0.5394
 epoch: 27, train_loss: 0.8621, test_loss: 1.0041, test_f1: 0.5457
 epoch: 28, train_loss: 0.8463, test_loss: 1.0135, test_f1: 0.5332
 epoch: 29, train_loss: 0.8472, test_loss: 1.0345, test_f1: 0.5422
 epoch: 30, train_loss: 0.8397, test_loss: 1.0469, test_f1: 0.5407
 epoch: 31, train_loss: 0.8316, test_loss: 1.0237, test_f1: 0.5390
 epoch: 32, train_loss: 0.8370, test_loss: 1.0044, test_f1: 0.5632
 epoch: 33, train_loss: 0.8301, test_loss: 1.0077, test_f1: 0.5568
 epoch: 34, train_loss: 0.8367, test_loss: 1.0099, test_f1: 0.5356
 epoch: 35, train_loss: 0.8297, test_loss: 1.0545, test_f1: 0.5655
 epoch: 36, train_loss: 0.8229, test_loss: 1.0066, test_f1: 0.5370
 epoch: 37, train_loss: 0.8077, test_loss: 1.0239, test_f1: 0.5593
 epoch: 38, train_loss: 0.8014, test_loss: 1.0253, test_f1: 0.5486
 epoch: 39, train_loss: 0.8268, test_loss: 1.0244, test_f1: 0.5634
 epoch: 40, train_loss: 0.8134, test_loss: 0.9753, test_f1: 0.5682
 epoch: 41, train_loss: 0.8031, test_loss: 1.0084, test_f1: 0.5591
 epoch: 42, train_loss: 0.8065, test_loss: 1.0467, test_f1: 0.5569
 epoch: 43, train_loss: 0.8032, test_loss: 1.0413, test_f1: 0.5237
 epoch: 44, train_loss: 0.8006, test_loss: 1.0571, test_f1: 0.5298
 epoch: 45, train_loss: 0.7969, test_loss: 1.0205, test_f1: 0.5349
 epoch: 46, train_loss: 0.7956, test_loss: 0.9911, test_f1: 0.5735
 epoch: 47, train_loss: 0.7948, test_loss: 1.0552, test_f1: 0.5522
 epoch: 48, train_loss: 0.8018, test_loss: 0.9811, test_f1: 0.5708
 epoch: 49, train_loss: 0.7742, test_loss: 0.9866, test_f1: 0.5846
 epoch: 50, train_loss: 0.7647, test_loss: 1.0040, test_f1: 0.5663
 epoch: 51, train_loss: 0.7721, test_loss: 1.0057, test_f1: 0.5550
 epoch: 52, train_loss: 0.7568, test_loss: 1.0088, test_f1: 0.5681
 epoch: 53, train_loss: 0.7475, test_loss: 0.9837, test_f1: 0.5918
 epoch: 54, train_loss: 0.7578, test_loss: 0.9963, test_f1: 0.5908
 epoch: 55, train_loss: 0.7505, test_loss: 1.0035, test_f1: 0.5600
 epoch: 56, train_loss: 0.7627, test_loss: 0.9893, test_f1: 0.5876
 epoch: 57, train_loss: 0.7568, test_loss: 0.9828, test_f1: 0.5716
 epoch: 58, train_loss: 0.7463, test_loss: 0.9769, test_f1: 0.5909
 epoch: 59, train_loss: 0.7528, test_loss: 0.9673, test_f1: 0.5943
 epoch: 60, train_loss: 0.7522, test_loss: 0.9749, test_f1: 0.5884
 epoch: 61, train_loss: 0.7510, test_loss: 0.9655, test_f1: 0.5901
 epoch: 62, train_loss: 0.7389, test_loss: 0.9881, test_f1: 0.5940
 epoch: 63, train_loss: 0.7317, test_loss: 0.9718, test_f1: 0.5889
 epoch: 64, train_loss: 0.7339, test_loss: 0.9806, test_f1: 0.6004
 epoch: 65, train_loss: 0.7355, test_loss: 0.9820, test_f1: 0.5933
 epoch: 66, train_loss: 0.7333, test_loss: 0.9740, test_f1: 0.5839
 epoch: 67, train_loss: 0.7399, test_loss: 0.9933, test_f1: 0.5893
 epoch: 68, train_loss: 0.7317, test_loss: 0.9784, test_f1: 0.5955
 epoch: 69, train_loss: 0.7208, test_loss: 0.9836, test_f1: 0.5729
 epoch: 70, train_loss: 0.7280, test_loss: 0.9846, test_f1: 0.5991
 epoch: 71, train_loss: 0.7144, test_loss: 0.9803, test_f1: 0.5920
 epoch: 72, train_loss: 0.7263, test_loss: 0.9757, test_f1: 0.5979
 epoch: 73, train_loss: 0.7211, test_loss: 0.9879, test_f1: 0.5832
 epoch: 74, train_loss: 0.7141, test_loss: 0.9780, test_f1: 0.6031
 epoch: 75, train_loss: 0.7234, test_loss: 0.9794, test_f1: 0.5844
 epoch: 76, train_loss: 0.7061, test_loss: 0.9719, test_f1: 0.5802
 epoch: 77, train_loss: 0.7207, test_loss: 0.9703, test_f1: 0.6002
 epoch: 78, train_loss: 0.7033, test_loss: 0.9888, test_f1: 0.5897
 epoch: 79, train_loss: 0.7060, test_loss: 0.9757, test_f1: 0.6122
 epoch: 80, train_loss: 0.7030, test_loss: 0.9754, test_f1: 0.5882
 epoch: 81, train_loss: 0.7112, test_loss: 0.9648, test_f1: 0.5987
 epoch: 82, train_loss: 0.7167, test_loss: 0.9716, test_f1: 0.5973
 epoch: 83, train_loss: 0.7166, test_loss: 0.9774, test_f1: 0.5693
 epoch: 84, train_loss: 0.7043, test_loss: 0.9895, test_f1: 0.5960
 epoch: 85, train_loss: 0.7041, test_loss: 0.9677, test_f1: 0.6327
 epoch: 86, train_loss: 0.6964, test_loss: 0.9772, test_f1: 0.5976
 epoch: 87, train_loss: 0.6966, test_loss: 0.9805, test_f1: 0.6132
 epoch: 88, train_loss: 0.7113, test_loss: 0.9892, test_f1: 0.5957
 epoch: 89, train_loss: 0.7029, test_loss: 0.9931, test_f1: 0.6007
 epoch: 90, train_loss: 0.7037, test_loss: 0.9728, test_f1: 0.5899
 epoch: 91, train_loss: 0.7018, test_loss: 0.9866, test_f1: 0.5922
 epoch: 92, train_loss: 0.6906, test_loss: 0.9854, test_f1: 0.5796
 epoch: 93, train_loss: 0.6880, test_loss: 0.9802, test_f1: 0.6041
 epoch: 94, train_loss: 0.6747, test_loss: 0.9812, test_f1: 0.6018
 epoch: 95, train_loss: 0.6783, test_loss: 0.9910, test_f1: 0.5899
 epoch: 96, train_loss: 0.6941, test_loss: 0.9896, test_f1: 0.5759
 epoch: 97, train_loss: 0.6803, test_loss: 0.9908, test_f1: 0.5886
 epoch: 98, train_loss: 0.6910, test_loss: 1.0265, test_f1: 0.6102
 epoch: 99, train_loss: 0.6941, test_loss: 0.9977, test_f1: 0.5856

Training completed in 341.20 seconds
Best F1: 0.6441 at epoch 96
Mean F1 across iterations: 0.6124  0.0251
========================FINAL RESULTS================================
FEGIN weighted F1: 0.6441  0.0251
python main.py --data ltspice_demos --representation component_pin_net --model FEGIN --layers 3 --hiddens 16 --batch_size 128 --lr 0.001 --emb_size 128 --epochs 100 --save_appendix component_pin_net_L3_H16_BS128_LR0.001_E128 --no_val
-----



STDERR:
  File "main.py", line 370, in <module>
    main()
  File "main.py", line 254, in main
    dataset = dataset_class(
  File "/home/philip/projects/ltspice_examples_code_repo/Circuit-Completion-Using-GNNs/component_classification_with_link_prediction_head/evaluation/FEGIN/kernel/circuit_datasets.py", line 15, in __init__
    self.data, self.slices = torch.load(self.processed_paths[0])
  File "/home/philip/.local/lib/python3.8/site-packages/torch/serialization.py", line 1040, in load
    warnings.warn(
  File "/usr/lib/python3.8/warnings.py", line 109, in _showwarnmsg
    sw(msg.message, msg.category, msg.filename, msg.lineno,
  File "main.py", line 47, in warn_with_traceback
    traceback.print_stack(file=log)
/home/philip/projects/ltspice_examples_code_repo/Circuit-Completion-Using-GNNs/component_classification_with_link_prediction_head/evaluation/FEGIN/kernel/circuit_datasets.py:15: FutureWarning: You are using `torch.load` with `weights_only=False` (the current default value), which uses the default pickle module implicitly. It is possible to construct malicious pickle data which will execute arbitrary code during unpickling (See https://github.com/pytorch/pytorch/blob/main/SECURITY.md#untrusted-models for more details). In a future release, the default value for `weights_only` will be flipped to `True`. This limits the functions that could be executed during unpickling. Arbitrary objects will no longer be allowed to be loaded via this mode unless they are explicitly allowlisted by the user via `torch.serialization.add_safe_globals`. We recommend you start setting `weights_only=True` for any use case where you don't have full control of the loaded file. Please open an issue on GitHub for any issues related to this experimental feature.
  self.data, self.slices = torch.load(self.processed_paths[0])
