STDOUT:
Results will be saved in /home/philip/projects/ltspice_examples_code_repo/Circuit-Completion-Using-GNNs/component_classification_with_link_prediction_head/evaluation/FEGIN/results/model_FEGIN_dataset_ltspice_examples
Command line input: python main.py --data ltspice_examples --representation component_pin --model FEGIN --layers 2 --hiddens 32 --batch_size 32 --lr 0.001 --emb_size 512 --epochs 100 --save_appendix component_pin_L2_H32_BS32_LR0.001_E512 --no_val
 is saved.
-----
ltspice_examples - FEGIN
Using 2 layers, 32 hidden units, h = 2
Loading component_pin representation dataset
ENTERED
Training FEGIN on component_pin representation
Train: 3560, Test: 848
##################ITERATION #0 ****************************************
 epoch: 0, train_loss: 1.2471, test_loss: 1.6677, test_f1: 0.2850
 epoch: 1, train_loss: 1.0609, test_loss: 1.0446, test_f1: 0.3577
 epoch: 2, train_loss: 1.0231, test_loss: 1.0524, test_f1: 0.4404
 epoch: 3, train_loss: 1.0125, test_loss: 1.0353, test_f1: 0.4761
 epoch: 4, train_loss: 0.9933, test_loss: 1.0204, test_f1: 0.4965
 epoch: 5, train_loss: 0.9553, test_loss: 0.9714, test_f1: 0.5360
 epoch: 6, train_loss: 0.9402, test_loss: 0.9717, test_f1: 0.4772
 epoch: 7, train_loss: 0.9255, test_loss: 0.9257, test_f1: 0.5213
 epoch: 8, train_loss: 0.9139, test_loss: 0.9218, test_f1: 0.5209
 epoch: 9, train_loss: 0.8894, test_loss: 0.9371, test_f1: 0.5206
 epoch: 10, train_loss: 0.8728, test_loss: 0.8851, test_f1: 0.6188
 epoch: 11, train_loss: 0.8733, test_loss: 0.9072, test_f1: 0.5365
 epoch: 12, train_loss: 0.8462, test_loss: 0.9053, test_f1: 0.5418
 epoch: 13, train_loss: 0.8336, test_loss: 0.8835, test_f1: 0.5857
 epoch: 14, train_loss: 0.8303, test_loss: 0.9346, test_f1: 0.5110
 epoch: 15, train_loss: 0.8199, test_loss: 0.8630, test_f1: 0.5445
 epoch: 16, train_loss: 0.8172, test_loss: 0.8249, test_f1: 0.5365
 epoch: 17, train_loss: 0.7990, test_loss: 0.8713, test_f1: 0.5381
 epoch: 18, train_loss: 0.7909, test_loss: 0.8800, test_f1: 0.5396
 epoch: 19, train_loss: 0.7878, test_loss: 0.8742, test_f1: 0.5589
 epoch: 20, train_loss: 0.7830, test_loss: 0.8689, test_f1: 0.5423
 epoch: 21, train_loss: 0.7695, test_loss: 0.8971, test_f1: 0.5444
 epoch: 22, train_loss: 0.7681, test_loss: 0.8623, test_f1: 0.5445
 epoch: 23, train_loss: 0.7636, test_loss: 0.8791, test_f1: 0.5691
 epoch: 24, train_loss: 0.7442, test_loss: 0.8512, test_f1: 0.5533
 epoch: 25, train_loss: 0.7584, test_loss: 0.8600, test_f1: 0.5718
 epoch: 26, train_loss: 0.7339, test_loss: 0.8369, test_f1: 0.5542
 epoch: 27, train_loss: 0.7487, test_loss: 0.8182, test_f1: 0.5762
 epoch: 28, train_loss: 0.7321, test_loss: 0.8223, test_f1: 0.5635
 epoch: 29, train_loss: 0.7360, test_loss: 0.8075, test_f1: 0.5805
 epoch: 30, train_loss: 0.7339, test_loss: 0.8032, test_f1: 0.5814
 epoch: 31, train_loss: 0.7174, test_loss: 0.8622, test_f1: 0.5668
 epoch: 32, train_loss: 0.7100, test_loss: 0.8108, test_f1: 0.5968
 epoch: 33, train_loss: 0.7177, test_loss: 0.8617, test_f1: 0.6177
 epoch: 34, train_loss: 0.7203, test_loss: 0.7611, test_f1: 0.6182
 epoch: 35, train_loss: 0.7166, test_loss: 0.7787, test_f1: 0.5864
 epoch: 36, train_loss: 0.7083, test_loss: 0.7752, test_f1: 0.5766
 epoch: 37, train_loss: 0.7008, test_loss: 0.8234, test_f1: 0.5859
 epoch: 38, train_loss: 0.6875, test_loss: 0.8332, test_f1: 0.5561
 epoch: 39, train_loss: 0.6861, test_loss: 0.8223, test_f1: 0.5648
 epoch: 40, train_loss: 0.6915, test_loss: 0.7673, test_f1: 0.5924
 epoch: 41, train_loss: 0.6831, test_loss: 0.7416, test_f1: 0.6213
 epoch: 42, train_loss: 0.6794, test_loss: 0.7863, test_f1: 0.5830
 epoch: 43, train_loss: 0.6831, test_loss: 0.6885, test_f1: 0.6779
 epoch: 44, train_loss: 0.6784, test_loss: 0.7534, test_f1: 0.5774
 epoch: 45, train_loss: 0.6816, test_loss: 0.7686, test_f1: 0.6328
 epoch: 46, train_loss: 0.6605, test_loss: 0.8178, test_f1: 0.6169
 epoch: 47, train_loss: 0.6614, test_loss: 0.7951, test_f1: 0.6023
 epoch: 48, train_loss: 0.6628, test_loss: 0.7263, test_f1: 0.6355
 epoch: 49, train_loss: 0.6667, test_loss: 0.7225, test_f1: 0.6495
 epoch: 50, train_loss: 0.6598, test_loss: 0.7182, test_f1: 0.6214
 epoch: 51, train_loss: 0.6282, test_loss: 0.7092, test_f1: 0.6441
 epoch: 52, train_loss: 0.6382, test_loss: 0.7177, test_f1: 0.6244
 epoch: 53, train_loss: 0.6377, test_loss: 0.7599, test_f1: 0.6378
 epoch: 54, train_loss: 0.6352, test_loss: 0.7349, test_f1: 0.6216
 epoch: 55, train_loss: 0.6334, test_loss: 0.7682, test_f1: 0.6294
 epoch: 56, train_loss: 0.6309, test_loss: 0.7222, test_f1: 0.6473
 epoch: 57, train_loss: 0.6250, test_loss: 0.7112, test_f1: 0.6415
 epoch: 58, train_loss: 0.6150, test_loss: 0.7266, test_f1: 0.6311
 epoch: 59, train_loss: 0.6253, test_loss: 0.7343, test_f1: 0.6201
 epoch: 60, train_loss: 0.6308, test_loss: 0.7666, test_f1: 0.6339
 epoch: 61, train_loss: 0.6259, test_loss: 0.7855, test_f1: 0.6288
 epoch: 62, train_loss: 0.6242, test_loss: 0.7248, test_f1: 0.6606
 epoch: 63, train_loss: 0.6077, test_loss: 0.8117, test_f1: 0.6308
 epoch: 64, train_loss: 0.6172, test_loss: 0.7046, test_f1: 0.6700
 epoch: 65, train_loss: 0.6217, test_loss: 0.7589, test_f1: 0.6423
 epoch: 66, train_loss: 0.6199, test_loss: 0.7050, test_f1: 0.6543
 epoch: 67, train_loss: 0.6024, test_loss: 0.6814, test_f1: 0.6876
 epoch: 68, train_loss: 0.6136, test_loss: 0.7898, test_f1: 0.6396
 epoch: 69, train_loss: 0.5936, test_loss: 0.7646, test_f1: 0.6185
 epoch: 70, train_loss: 0.6085, test_loss: 0.7391, test_f1: 0.6644
 epoch: 71, train_loss: 0.5951, test_loss: 0.7548, test_f1: 0.6793
 epoch: 72, train_loss: 0.6000, test_loss: 0.8121, test_f1: 0.6147
 epoch: 73, train_loss: 0.6060, test_loss: 0.7732, test_f1: 0.6597
 epoch: 74, train_loss: 0.6005, test_loss: 0.7477, test_f1: 0.6515
 epoch: 75, train_loss: 0.5846, test_loss: 0.7420, test_f1: 0.6460
 epoch: 76, train_loss: 0.5894, test_loss: 0.7759, test_f1: 0.6678
 epoch: 77, train_loss: 0.5920, test_loss: 0.8310, test_f1: 0.6211
 epoch: 78, train_loss: 0.5873, test_loss: 0.7863, test_f1: 0.6434
 epoch: 79, train_loss: 0.6005, test_loss: 0.7605, test_f1: 0.6477
 epoch: 80, train_loss: 0.5822, test_loss: 0.8111, test_f1: 0.6348
 epoch: 81, train_loss: 0.5855, test_loss: 0.7658, test_f1: 0.6309
 epoch: 82, train_loss: 0.5904, test_loss: 0.7618, test_f1: 0.6614
 epoch: 83, train_loss: 0.5932, test_loss: 0.7825, test_f1: 0.6636
 epoch: 84, train_loss: 0.5877, test_loss: 0.7361, test_f1: 0.6757
 epoch: 85, train_loss: 0.5868, test_loss: 0.7697, test_f1: 0.6505
 epoch: 86, train_loss: 0.5739, test_loss: 0.7678, test_f1: 0.6527
 epoch: 87, train_loss: 0.5821, test_loss: 0.7980, test_f1: 0.6746
 epoch: 88, train_loss: 0.5811, test_loss: 0.8232, test_f1: 0.6399
 epoch: 89, train_loss: 0.5797, test_loss: 0.7652, test_f1: 0.6719
 epoch: 90, train_loss: 0.5594, test_loss: 0.7889, test_f1: 0.6640
 epoch: 91, train_loss: 0.5657, test_loss: 0.7513, test_f1: 0.6865
 epoch: 92, train_loss: 0.5858, test_loss: 0.8286, test_f1: 0.6388
 epoch: 93, train_loss: 0.5685, test_loss: 0.8259, test_f1: 0.6564
 epoch: 94, train_loss: 0.5649, test_loss: 0.7917, test_f1: 0.6559
 epoch: 95, train_loss: 0.5809, test_loss: 0.8589, test_f1: 0.6362
 epoch: 96, train_loss: 0.5737, test_loss: 0.7899, test_f1: 0.6511
 epoch: 97, train_loss: 0.5603, test_loss: 0.9354, test_f1: 0.6300
 epoch: 98, train_loss: 0.5665, test_loss: 0.8155, test_f1: 0.6443
 epoch: 99, train_loss: 0.5657, test_loss: 0.8646, test_f1: 0.6400
##################ITERATION #1 ****************************************
 epoch: 0, train_loss: 1.1461, test_loss: 1.0580, test_f1: 0.4289
 epoch: 1, train_loss: 1.0094, test_loss: 0.9868, test_f1: 0.4811
 epoch: 2, train_loss: 0.9718, test_loss: 0.9952, test_f1: 0.4776
 epoch: 3, train_loss: 0.9400, test_loss: 0.9239, test_f1: 0.5043
 epoch: 4, train_loss: 0.9255, test_loss: 0.9256, test_f1: 0.5254
 epoch: 5, train_loss: 0.9048, test_loss: 0.9252, test_f1: 0.5173
 epoch: 6, train_loss: 0.8877, test_loss: 0.8733, test_f1: 0.5558
 epoch: 7, train_loss: 0.8687, test_loss: 0.8916, test_f1: 0.5489
 epoch: 8, train_loss: 0.8585, test_loss: 0.8812, test_f1: 0.5182
 epoch: 9, train_loss: 0.8474, test_loss: 0.8411, test_f1: 0.5555
 epoch: 10, train_loss: 0.8458, test_loss: 0.9450, test_f1: 0.5049
 epoch: 11, train_loss: 0.8238, test_loss: 0.9119, test_f1: 0.5164
 epoch: 12, train_loss: 0.8313, test_loss: 0.8757, test_f1: 0.5753
 epoch: 13, train_loss: 0.8050, test_loss: 0.8737, test_f1: 0.5494
 epoch: 14, train_loss: 0.8001, test_loss: 0.9104, test_f1: 0.5366
 epoch: 15, train_loss: 0.7882, test_loss: 0.8666, test_f1: 0.5363
 epoch: 16, train_loss: 0.7879, test_loss: 0.8050, test_f1: 0.5918
 epoch: 17, train_loss: 0.7690, test_loss: 0.8724, test_f1: 0.5350
 epoch: 18, train_loss: 0.7799, test_loss: 0.8709, test_f1: 0.5622
 epoch: 19, train_loss: 0.7624, test_loss: 0.8798, test_f1: 0.5320
 epoch: 20, train_loss: 0.7488, test_loss: 0.8834, test_f1: 0.5306
 epoch: 21, train_loss: 0.7613, test_loss: 0.9739, test_f1: 0.5028
 epoch: 22, train_loss: 0.7477, test_loss: 0.8070, test_f1: 0.5816
 epoch: 23, train_loss: 0.7456, test_loss: 0.9162, test_f1: 0.5355
 epoch: 24, train_loss: 0.7385, test_loss: 0.9986, test_f1: 0.5584
 epoch: 25, train_loss: 0.7310, test_loss: 0.8368, test_f1: 0.6062
 epoch: 26, train_loss: 0.7281, test_loss: 0.7844, test_f1: 0.5746
 epoch: 27, train_loss: 0.7130, test_loss: 0.8410, test_f1: 0.5591
 epoch: 28, train_loss: 0.7208, test_loss: 0.8103, test_f1: 0.6156
 epoch: 29, train_loss: 0.7167, test_loss: 0.8727, test_f1: 0.6078
 epoch: 30, train_loss: 0.7078, test_loss: 1.0361, test_f1: 0.5560
 epoch: 31, train_loss: 0.6912, test_loss: 0.9104, test_f1: 0.5674
 epoch: 32, train_loss: 0.7017, test_loss: 0.9000, test_f1: 0.5728
 epoch: 33, train_loss: 0.6947, test_loss: 1.0142, test_f1: 0.5483
 epoch: 34, train_loss: 0.6879, test_loss: 0.8664, test_f1: 0.5967
 epoch: 35, train_loss: 0.6830, test_loss: 0.9253, test_f1: 0.5561
 epoch: 36, train_loss: 0.6940, test_loss: 0.9659, test_f1: 0.5861
 epoch: 37, train_loss: 0.6823, test_loss: 0.8220, test_f1: 0.6099
 epoch: 38, train_loss: 0.6629, test_loss: 0.9358, test_f1: 0.5584
 epoch: 39, train_loss: 0.6706, test_loss: 0.9354, test_f1: 0.5866
 epoch: 40, train_loss: 0.6600, test_loss: 0.9097, test_f1: 0.6169
 epoch: 41, train_loss: 0.6584, test_loss: 0.8848, test_f1: 0.6032
 epoch: 42, train_loss: 0.6633, test_loss: 0.9583, test_f1: 0.5581
 epoch: 43, train_loss: 0.6718, test_loss: 0.8606, test_f1: 0.5729
 epoch: 44, train_loss: 0.6603, test_loss: 0.9389, test_f1: 0.5918
 epoch: 45, train_loss: 0.6356, test_loss: 0.8822, test_f1: 0.6235
 epoch: 46, train_loss: 0.6434, test_loss: 0.9189, test_f1: 0.6052
 epoch: 47, train_loss: 0.6406, test_loss: 1.0160, test_f1: 0.5989
 epoch: 48, train_loss: 0.6642, test_loss: 0.9339, test_f1: 0.6008
 epoch: 49, train_loss: 0.6558, test_loss: 0.8127, test_f1: 0.6414
 epoch: 50, train_loss: 0.6328, test_loss: 0.8012, test_f1: 0.6184
 epoch: 51, train_loss: 0.6043, test_loss: 0.9101, test_f1: 0.6164
 epoch: 52, train_loss: 0.6161, test_loss: 0.8393, test_f1: 0.6020
 epoch: 53, train_loss: 0.6135, test_loss: 0.9395, test_f1: 0.6036
 epoch: 54, train_loss: 0.5949, test_loss: 0.9679, test_f1: 0.6170
 epoch: 55, train_loss: 0.5893, test_loss: 0.9002, test_f1: 0.6032
 epoch: 56, train_loss: 0.5935, test_loss: 0.9054, test_f1: 0.6120
 epoch: 57, train_loss: 0.5983, test_loss: 0.9787, test_f1: 0.6427
 epoch: 58, train_loss: 0.5894, test_loss: 0.9008, test_f1: 0.6604
 epoch: 59, train_loss: 0.5941, test_loss: 0.9913, test_f1: 0.6240
 epoch: 60, train_loss: 0.5862, test_loss: 1.0316, test_f1: 0.6255
 epoch: 61, train_loss: 0.5895, test_loss: 1.0278, test_f1: 0.5986
 epoch: 62, train_loss: 0.5867, test_loss: 1.0807, test_f1: 0.6230
 epoch: 63, train_loss: 0.5821, test_loss: 0.9725, test_f1: 0.6292
 epoch: 64, train_loss: 0.5689, test_loss: 0.9933, test_f1: 0.6221
 epoch: 65, train_loss: 0.5786, test_loss: 0.9801, test_f1: 0.6157
 epoch: 66, train_loss: 0.5827, test_loss: 0.9257, test_f1: 0.6008
 epoch: 67, train_loss: 0.5660, test_loss: 1.0167, test_f1: 0.6040
 epoch: 68, train_loss: 0.5733, test_loss: 0.9860, test_f1: 0.6267
 epoch: 69, train_loss: 0.5821, test_loss: 0.9014, test_f1: 0.6267
 epoch: 70, train_loss: 0.5632, test_loss: 1.0081, test_f1: 0.6100
 epoch: 71, train_loss: 0.5670, test_loss: 1.1221, test_f1: 0.6216
 epoch: 72, train_loss: 0.5564, test_loss: 1.0158, test_f1: 0.6318
 epoch: 73, train_loss: 0.5632, test_loss: 0.9870, test_f1: 0.6252
 epoch: 74, train_loss: 0.5673, test_loss: 1.0375, test_f1: 0.6114
 epoch: 75, train_loss: 0.5560, test_loss: 1.0182, test_f1: 0.5912
 epoch: 76, train_loss: 0.5647, test_loss: 1.0439, test_f1: 0.6245
 epoch: 77, train_loss: 0.5689, test_loss: 1.1080, test_f1: 0.6221
 epoch: 78, train_loss: 0.5565, test_loss: 0.9636, test_f1: 0.6536
 epoch: 79, train_loss: 0.5598, test_loss: 1.0652, test_f1: 0.6051
 epoch: 80, train_loss: 0.5557, test_loss: 1.1183, test_f1: 0.6223
 epoch: 81, train_loss: 0.5560, test_loss: 1.1147, test_f1: 0.6225
 epoch: 82, train_loss: 0.5647, test_loss: 1.0301, test_f1: 0.6358
 epoch: 83, train_loss: 0.5457, test_loss: 1.1347, test_f1: 0.6398
 epoch: 84, train_loss: 0.5444, test_loss: 1.2132, test_f1: 0.6019
 epoch: 85, train_loss: 0.5417, test_loss: 1.1055, test_f1: 0.6168
 epoch: 86, train_loss: 0.5317, test_loss: 1.0926, test_f1: 0.6073
 epoch: 87, train_loss: 0.5583, test_loss: 1.2034, test_f1: 0.6313
 epoch: 88, train_loss: 0.5492, test_loss: 1.1896, test_f1: 0.6007
 epoch: 89, train_loss: 0.5535, test_loss: 1.1733, test_f1: 0.6125
 epoch: 90, train_loss: 0.5329, test_loss: 1.1857, test_f1: 0.6225
 epoch: 91, train_loss: 0.5442, test_loss: 1.1205, test_f1: 0.6287
 epoch: 92, train_loss: 0.5324, test_loss: 1.2493, test_f1: 0.6032
 epoch: 93, train_loss: 0.5355, test_loss: 1.1760, test_f1: 0.6130
 epoch: 94, train_loss: 0.5245, test_loss: 1.1136, test_f1: 0.6448
 epoch: 95, train_loss: 0.5421, test_loss: 1.1994, test_f1: 0.6296
 epoch: 96, train_loss: 0.5180, test_loss: 1.2692, test_f1: 0.6241
 epoch: 97, train_loss: 0.5448, test_loss: 1.2795, test_f1: 0.6172
 epoch: 98, train_loss: 0.5373, test_loss: 1.1799, test_f1: 0.6201
 epoch: 99, train_loss: 0.5418, test_loss: 1.0559, test_f1: 0.6160
##################ITERATION #2 ****************************************
 epoch: 0, train_loss: 1.1042, test_loss: 1.0596, test_f1: 0.3672
 epoch: 1, train_loss: 0.9924, test_loss: 0.9670, test_f1: 0.5220
 epoch: 2, train_loss: 0.9675, test_loss: 0.9736, test_f1: 0.4828
 epoch: 3, train_loss: 0.9417, test_loss: 0.9310, test_f1: 0.5388
 epoch: 4, train_loss: 0.9240, test_loss: 0.9516, test_f1: 0.5411
 epoch: 5, train_loss: 0.9067, test_loss: 0.9802, test_f1: 0.5433
 epoch: 6, train_loss: 0.8916, test_loss: 0.9365, test_f1: 0.5168
 epoch: 7, train_loss: 0.8837, test_loss: 0.9511, test_f1: 0.5527
 epoch: 8, train_loss: 0.8837, test_loss: 0.8419, test_f1: 0.5761
 epoch: 9, train_loss: 0.8705, test_loss: 0.9390, test_f1: 0.5013
 epoch: 10, train_loss: 0.8572, test_loss: 0.8956, test_f1: 0.5233
 epoch: 11, train_loss: 0.8497, test_loss: 0.8983, test_f1: 0.5683
 epoch: 12, train_loss: 0.8562, test_loss: 1.0151, test_f1: 0.4903
 epoch: 13, train_loss: 0.8387, test_loss: 0.8915, test_f1: 0.5239
 epoch: 14, train_loss: 0.8306, test_loss: 0.8567, test_f1: 0.5426
 epoch: 15, train_loss: 0.8327, test_loss: 0.8816, test_f1: 0.4990
 epoch: 16, train_loss: 0.8256, test_loss: 0.8889, test_f1: 0.5062
 epoch: 17, train_loss: 0.8075, test_loss: 0.8275, test_f1: 0.5780
 epoch: 18, train_loss: 0.8040, test_loss: 0.8339, test_f1: 0.5814
 epoch: 19, train_loss: 0.8004, test_loss: 0.7820, test_f1: 0.5860
 epoch: 20, train_loss: 0.8017, test_loss: 0.8078, test_f1: 0.5767
 epoch: 21, train_loss: 0.7942, test_loss: 0.8301, test_f1: 0.5136
 epoch: 22, train_loss: 0.7947, test_loss: 0.8349, test_f1: 0.5567
 epoch: 23, train_loss: 0.7844, test_loss: 0.8160, test_f1: 0.5691
 epoch: 24, train_loss: 0.7828, test_loss: 0.7811, test_f1: 0.5960
 epoch: 25, train_loss: 0.7711, test_loss: 0.8026, test_f1: 0.5945
 epoch: 26, train_loss: 0.7639, test_loss: 0.8991, test_f1: 0.5209
 epoch: 27, train_loss: 0.7641, test_loss: 0.7702, test_f1: 0.5899
 epoch: 28, train_loss: 0.7545, test_loss: 0.8194, test_f1: 0.5420
 epoch: 29, train_loss: 0.7728, test_loss: 0.8775, test_f1: 0.5202
 epoch: 30, train_loss: 0.7618, test_loss: 0.7907, test_f1: 0.5791
 epoch: 31, train_loss: 0.7379, test_loss: 0.7897, test_f1: 0.5763
 epoch: 32, train_loss: 0.7595, test_loss: 0.8161, test_f1: 0.5774
 epoch: 33, train_loss: 0.7388, test_loss: 0.7181, test_f1: 0.6388
 epoch: 34, train_loss: 0.7357, test_loss: 0.8489, test_f1: 0.5757
 epoch: 35, train_loss: 0.7269, test_loss: 0.8181, test_f1: 0.6002
 epoch: 36, train_loss: 0.7225, test_loss: 0.8735, test_f1: 0.5834
 epoch: 37, train_loss: 0.7399, test_loss: 0.7871, test_f1: 0.5816
 epoch: 38, train_loss: 0.7260, test_loss: 0.8288, test_f1: 0.5920
 epoch: 39, train_loss: 0.7280, test_loss: 0.7816, test_f1: 0.5749
 epoch: 40, train_loss: 0.7282, test_loss: 0.8575, test_f1: 0.5736
 epoch: 41, train_loss: 0.7071, test_loss: 0.7451, test_f1: 0.6277
 epoch: 42, train_loss: 0.7138, test_loss: 0.7929, test_f1: 0.5934
 epoch: 43, train_loss: 0.7158, test_loss: 0.7967, test_f1: 0.6303
 epoch: 44, train_loss: 0.7026, test_loss: 0.7835, test_f1: 0.6011
 epoch: 45, train_loss: 0.7048, test_loss: 0.8790, test_f1: 0.5786
 epoch: 46, train_loss: 0.7014, test_loss: 0.8342, test_f1: 0.6055
 epoch: 47, train_loss: 0.6897, test_loss: 0.9128, test_f1: 0.5740
 epoch: 48, train_loss: 0.6884, test_loss: 0.8394, test_f1: 0.5947
 epoch: 49, train_loss: 0.6795, test_loss: 0.7482, test_f1: 0.6332
 epoch: 50, train_loss: 0.6842, test_loss: 0.8672, test_f1: 0.5576
 epoch: 51, train_loss: 0.6640, test_loss: 0.7470, test_f1: 0.6114
 epoch: 52, train_loss: 0.6579, test_loss: 0.7434, test_f1: 0.6132
 epoch: 53, train_loss: 0.6533, test_loss: 0.8394, test_f1: 0.5984
 epoch: 54, train_loss: 0.6564, test_loss: 0.7621, test_f1: 0.6140
 epoch: 55, train_loss: 0.6576, test_loss: 0.7982, test_f1: 0.6121
 epoch: 56, train_loss: 0.6565, test_loss: 0.7289, test_f1: 0.6230
 epoch: 57, train_loss: 0.6472, test_loss: 0.7434, test_f1: 0.6194
 epoch: 58, train_loss: 0.6407, test_loss: 0.7720, test_f1: 0.6150
 epoch: 59, train_loss: 0.6594, test_loss: 0.7284, test_f1: 0.6284
 epoch: 60, train_loss: 0.6347, test_loss: 0.7620, test_f1: 0.6034
 epoch: 61, train_loss: 0.6468, test_loss: 0.7317, test_f1: 0.6300
 epoch: 62, train_loss: 0.6394, test_loss: 0.7334, test_f1: 0.6271
 epoch: 63, train_loss: 0.6252, test_loss: 0.8391, test_f1: 0.6167
 epoch: 64, train_loss: 0.6570, test_loss: 0.7659, test_f1: 0.6204
 epoch: 65, train_loss: 0.6407, test_loss: 0.7637, test_f1: 0.6203
 epoch: 66, train_loss: 0.6424, test_loss: 0.7887, test_f1: 0.6259
 epoch: 67, train_loss: 0.6238, test_loss: 0.8293, test_f1: 0.6153
 epoch: 68, train_loss: 0.6197, test_loss: 0.8311, test_f1: 0.6189
 epoch: 69, train_loss: 0.6354, test_loss: 0.8205, test_f1: 0.6196
 epoch: 70, train_loss: 0.6099, test_loss: 0.8941, test_f1: 0.6034
 epoch: 71, train_loss: 0.6174, test_loss: 0.7845, test_f1: 0.6319
 epoch: 72, train_loss: 0.6095, test_loss: 0.7936, test_f1: 0.6289
 epoch: 73, train_loss: 0.6315, test_loss: 0.8477, test_f1: 0.6041
 epoch: 74, train_loss: 0.6060, test_loss: 0.7734, test_f1: 0.6254
 epoch: 75, train_loss: 0.6162, test_loss: 0.8440, test_f1: 0.6019
 epoch: 76, train_loss: 0.6217, test_loss: 0.8258, test_f1: 0.6397
 epoch: 77, train_loss: 0.6214, test_loss: 0.7806, test_f1: 0.6323
 epoch: 78, train_loss: 0.6015, test_loss: 0.7849, test_f1: 0.6394
 epoch: 79, train_loss: 0.6112, test_loss: 0.7899, test_f1: 0.6226
 epoch: 80, train_loss: 0.6061, test_loss: 0.7859, test_f1: 0.6363
 epoch: 81, train_loss: 0.6109, test_loss: 0.7982, test_f1: 0.6275
 epoch: 82, train_loss: 0.5968, test_loss: 0.7892, test_f1: 0.6183
 epoch: 83, train_loss: 0.5945, test_loss: 0.8345, test_f1: 0.6157
 epoch: 84, train_loss: 0.6120, test_loss: 0.8442, test_f1: 0.6305
 epoch: 85, train_loss: 0.6046, test_loss: 0.8118, test_f1: 0.6441
 epoch: 86, train_loss: 0.6021, test_loss: 0.7592, test_f1: 0.6397
 epoch: 87, train_loss: 0.6106, test_loss: 0.9019, test_f1: 0.6041
 epoch: 88, train_loss: 0.5973, test_loss: 0.7978, test_f1: 0.6506
 epoch: 89, train_loss: 0.5884, test_loss: 0.8253, test_f1: 0.6248
 epoch: 90, train_loss: 0.5774, test_loss: 0.7942, test_f1: 0.6473
 epoch: 91, train_loss: 0.6065, test_loss: 0.8447, test_f1: 0.6400
 epoch: 92, train_loss: 0.5962, test_loss: 0.8352, test_f1: 0.6103
 epoch: 93, train_loss: 0.5855, test_loss: 0.8326, test_f1: 0.6411
 epoch: 94, train_loss: 0.5850, test_loss: 0.8458, test_f1: 0.6314
 epoch: 95, train_loss: 0.5861, test_loss: 0.8771, test_f1: 0.6201
 epoch: 96, train_loss: 0.5742, test_loss: 0.8712, test_f1: 0.6336
 epoch: 97, train_loss: 0.5867, test_loss: 0.8448, test_f1: 0.6180
 epoch: 98, train_loss: 0.5774, test_loss: 0.7995, test_f1: 0.6562
 epoch: 99, train_loss: 0.5751, test_loss: 0.9247, test_f1: 0.6009
##################ITERATION #3 ****************************************
 epoch: 0, train_loss: 1.1473, test_loss: 1.0125, test_f1: 0.5046
 epoch: 1, train_loss: 1.0416, test_loss: 0.9968, test_f1: 0.5259
 epoch: 2, train_loss: 1.0052, test_loss: 0.9844, test_f1: 0.5219
 epoch: 3, train_loss: 0.9825, test_loss: 0.9307, test_f1: 0.5184
 epoch: 4, train_loss: 0.9646, test_loss: 1.0122, test_f1: 0.4907
 epoch: 5, train_loss: 0.9458, test_loss: 0.9120, test_f1: 0.5339
 epoch: 6, train_loss: 0.9294, test_loss: 0.8992, test_f1: 0.5191
 epoch: 7, train_loss: 0.9199, test_loss: 0.8965, test_f1: 0.5337
 epoch: 8, train_loss: 0.9095, test_loss: 0.9003, test_f1: 0.5420
 epoch: 9, train_loss: 0.8957, test_loss: 0.8597, test_f1: 0.5522
 epoch: 10, train_loss: 0.8992, test_loss: 0.9186, test_f1: 0.5290
 epoch: 11, train_loss: 0.8627, test_loss: 0.8867, test_f1: 0.5165
 epoch: 12, train_loss: 0.8706, test_loss: 0.8841, test_f1: 0.5581
 epoch: 13, train_loss: 0.8535, test_loss: 0.8865, test_f1: 0.5658
 epoch: 14, train_loss: 0.8528, test_loss: 0.8666, test_f1: 0.5751
 epoch: 15, train_loss: 0.8420, test_loss: 0.8506, test_f1: 0.5974
 epoch: 16, train_loss: 0.8310, test_loss: 0.8348, test_f1: 0.5982
 epoch: 17, train_loss: 0.8225, test_loss: 0.8387, test_f1: 0.5854
 epoch: 18, train_loss: 0.8232, test_loss: 0.8423, test_f1: 0.5980
 epoch: 19, train_loss: 0.7954, test_loss: 0.7941, test_f1: 0.6250
 epoch: 20, train_loss: 0.8178, test_loss: 0.8095, test_f1: 0.6114
 epoch: 21, train_loss: 0.8045, test_loss: 0.7917, test_f1: 0.6042
 epoch: 22, train_loss: 0.8039, test_loss: 0.8017, test_f1: 0.6276
 epoch: 23, train_loss: 0.7818, test_loss: 0.9122, test_f1: 0.5494
 epoch: 24, train_loss: 0.7901, test_loss: 0.8169, test_f1: 0.5887
 epoch: 25, train_loss: 0.7751, test_loss: 0.8696, test_f1: 0.5907
 epoch: 26, train_loss: 0.7795, test_loss: 0.8308, test_f1: 0.5904
 epoch: 27, train_loss: 0.7560, test_loss: 0.8603, test_f1: 0.5889
 epoch: 28, train_loss: 0.7528, test_loss: 0.9256, test_f1: 0.5640
 epoch: 29, train_loss: 0.7566, test_loss: 0.7565, test_f1: 0.6079
 epoch: 30, train_loss: 0.7614, test_loss: 0.7916, test_f1: 0.6056
 epoch: 31, train_loss: 0.7389, test_loss: 0.8220, test_f1: 0.6002
 epoch: 32, train_loss: 0.7431, test_loss: 0.7984, test_f1: 0.6613
 epoch: 33, train_loss: 0.7249, test_loss: 0.7233, test_f1: 0.6286
 epoch: 34, train_loss: 0.7322, test_loss: 0.7061, test_f1: 0.6552
 epoch: 35, train_loss: 0.7279, test_loss: 0.7610, test_f1: 0.6249
 epoch: 36, train_loss: 0.7367, test_loss: 0.8359, test_f1: 0.6133
 epoch: 37, train_loss: 0.7232, test_loss: 0.8253, test_f1: 0.6007
 epoch: 38, train_loss: 0.7287, test_loss: 0.7643, test_f1: 0.6591
 epoch: 39, train_loss: 0.7239, test_loss: 0.7615, test_f1: 0.6132
 epoch: 40, train_loss: 0.7116, test_loss: 0.8237, test_f1: 0.6112
 epoch: 41, train_loss: 0.6976, test_loss: 0.8328, test_f1: 0.6197
 epoch: 42, train_loss: 0.7120, test_loss: 0.8108, test_f1: 0.6506
 epoch: 43, train_loss: 0.6990, test_loss: 0.7317, test_f1: 0.6253
 epoch: 44, train_loss: 0.6884, test_loss: 0.7865, test_f1: 0.6015
 epoch: 45, train_loss: 0.7055, test_loss: 0.7624, test_f1: 0.6317
 epoch: 46, train_loss: 0.6776, test_loss: 0.7426, test_f1: 0.6205
 epoch: 47, train_loss: 0.6781, test_loss: 0.8362, test_f1: 0.6065
 epoch: 48, train_loss: 0.6918, test_loss: 0.7416, test_f1: 0.6396
 epoch: 49, train_loss: 0.6798, test_loss: 0.8748, test_f1: 0.6268
 epoch: 50, train_loss: 0.6879, test_loss: 0.6854, test_f1: 0.6674
 epoch: 51, train_loss: 0.6452, test_loss: 0.7071, test_f1: 0.6673
 epoch: 52, train_loss: 0.6551, test_loss: 0.7162, test_f1: 0.6383
 epoch: 53, train_loss: 0.6454, test_loss: 0.7568, test_f1: 0.6298
 epoch: 54, train_loss: 0.6525, test_loss: 0.7014, test_f1: 0.6666
 epoch: 55, train_loss: 0.6356, test_loss: 0.7095, test_f1: 0.6517
 epoch: 56, train_loss: 0.6369, test_loss: 0.7181, test_f1: 0.6425
 epoch: 57, train_loss: 0.6342, test_loss: 0.6901, test_f1: 0.6472
 epoch: 58, train_loss: 0.6238, test_loss: 0.7241, test_f1: 0.6369
 epoch: 59, train_loss: 0.6320, test_loss: 0.6952, test_f1: 0.6568
 epoch: 60, train_loss: 0.6357, test_loss: 0.7231, test_f1: 0.6397
 epoch: 61, train_loss: 0.6275, test_loss: 0.6992, test_f1: 0.6719
 epoch: 62, train_loss: 0.6225, test_loss: 0.6952, test_f1: 0.6674
 epoch: 63, train_loss: 0.6104, test_loss: 0.6880, test_f1: 0.6639
 epoch: 64, train_loss: 0.6185, test_loss: 0.6942, test_f1: 0.6599
 epoch: 65, train_loss: 0.6133, test_loss: 0.6943, test_f1: 0.6616
 epoch: 66, train_loss: 0.6042, test_loss: 0.7886, test_f1: 0.6294
 epoch: 67, train_loss: 0.6140, test_loss: 0.7006, test_f1: 0.6776
 epoch: 68, train_loss: 0.5953, test_loss: 0.7160, test_f1: 0.6356
 epoch: 69, train_loss: 0.6038, test_loss: 0.7105, test_f1: 0.6328
 epoch: 70, train_loss: 0.6021, test_loss: 0.7239, test_f1: 0.6449
 epoch: 71, train_loss: 0.5928, test_loss: 0.8316, test_f1: 0.6234
 epoch: 72, train_loss: 0.6082, test_loss: 0.7504, test_f1: 0.6376
 epoch: 73, train_loss: 0.5962, test_loss: 0.7477, test_f1: 0.6365
 epoch: 74, train_loss: 0.6008, test_loss: 0.7436, test_f1: 0.6627
 epoch: 75, train_loss: 0.5976, test_loss: 0.6904, test_f1: 0.6734
 epoch: 76, train_loss: 0.5866, test_loss: 0.6946, test_f1: 0.6479
 epoch: 77, train_loss: 0.5862, test_loss: 0.7377, test_f1: 0.6442
 epoch: 78, train_loss: 0.5870, test_loss: 0.7339, test_f1: 0.6543
 epoch: 79, train_loss: 0.5835, test_loss: 0.7557, test_f1: 0.6359
 epoch: 80, train_loss: 0.5881, test_loss: 0.7313, test_f1: 0.6771
 epoch: 81, train_loss: 0.5896, test_loss: 0.8583, test_f1: 0.6351
 epoch: 82, train_loss: 0.5760, test_loss: 0.7634, test_f1: 0.6527
 epoch: 83, train_loss: 0.5772, test_loss: 0.7246, test_f1: 0.6751
 epoch: 84, train_loss: 0.5892, test_loss: 0.7206, test_f1: 0.6669
 epoch: 85, train_loss: 0.5809, test_loss: 0.7188, test_f1: 0.6630
 epoch: 86, train_loss: 0.5933, test_loss: 0.7333, test_f1: 0.6374
 epoch: 87, train_loss: 0.5699, test_loss: 0.7411, test_f1: 0.6373
 epoch: 88, train_loss: 0.5878, test_loss: 0.7031, test_f1: 0.6777
 epoch: 89, train_loss: 0.5738, test_loss: 0.7699, test_f1: 0.6596
 epoch: 90, train_loss: 0.5782, test_loss: 0.7276, test_f1: 0.6691
 epoch: 91, train_loss: 0.5610, test_loss: 0.6962, test_f1: 0.6604
 epoch: 92, train_loss: 0.5686, test_loss: 0.7249, test_f1: 0.6854
 epoch: 93, train_loss: 0.5669, test_loss: 0.7147, test_f1: 0.6604
 epoch: 94, train_loss: 0.5429, test_loss: 0.7293, test_f1: 0.6649
 epoch: 95, train_loss: 0.5570, test_loss: 0.7070, test_f1: 0.6766
 epoch: 96, train_loss: 0.5706, test_loss: 0.7074, test_f1: 0.6542
 epoch: 97, train_loss: 0.5793, test_loss: 0.7672, test_f1: 0.6555
 epoch: 98, train_loss: 0.5535, test_loss: 0.8002, test_f1: 0.6799
 epoch: 99, train_loss: 0.5673, test_loss: 0.7589, test_f1: 0.6509
##################ITERATION #4 ****************************************
 epoch: 0, train_loss: 1.1644, test_loss: 1.0502, test_f1: 0.4910
 epoch: 1, train_loss: 1.0111, test_loss: 0.9366, test_f1: 0.5175
 epoch: 2, train_loss: 0.9865, test_loss: 0.9413, test_f1: 0.4786
 epoch: 3, train_loss: 0.9591, test_loss: 0.9213, test_f1: 0.5174
 epoch: 4, train_loss: 0.9389, test_loss: 0.9276, test_f1: 0.5335
 epoch: 5, train_loss: 0.9343, test_loss: 0.9361, test_f1: 0.5114
 epoch: 6, train_loss: 0.9003, test_loss: 0.9052, test_f1: 0.5438
 epoch: 7, train_loss: 0.9040, test_loss: 1.0702, test_f1: 0.4553
 epoch: 8, train_loss: 0.9046, test_loss: 0.8513, test_f1: 0.5531
 epoch: 9, train_loss: 0.8802, test_loss: 0.8236, test_f1: 0.5654
 epoch: 10, train_loss: 0.8814, test_loss: 0.8131, test_f1: 0.5675
 epoch: 11, train_loss: 0.8609, test_loss: 0.9013, test_f1: 0.5240
 epoch: 12, train_loss: 0.8603, test_loss: 0.8585, test_f1: 0.5523
 epoch: 13, train_loss: 0.8564, test_loss: 0.8672, test_f1: 0.5832
 epoch: 14, train_loss: 0.8524, test_loss: 0.8494, test_f1: 0.5585
 epoch: 15, train_loss: 0.8412, test_loss: 0.8872, test_f1: 0.5376
 epoch: 16, train_loss: 0.8414, test_loss: 0.7871, test_f1: 0.5687
 epoch: 17, train_loss: 0.8129, test_loss: 0.7857, test_f1: 0.5889
 epoch: 18, train_loss: 0.8183, test_loss: 0.8499, test_f1: 0.5609
 epoch: 19, train_loss: 0.7978, test_loss: 0.8387, test_f1: 0.5526
 epoch: 20, train_loss: 0.8007, test_loss: 0.8561, test_f1: 0.5868
 epoch: 21, train_loss: 0.7812, test_loss: 0.8461, test_f1: 0.5684
 epoch: 22, train_loss: 0.7889, test_loss: 0.8316, test_f1: 0.5626
 epoch: 23, train_loss: 0.7906, test_loss: 0.9293, test_f1: 0.5393
 epoch: 24, train_loss: 0.7631, test_loss: 0.9357, test_f1: 0.5319
 epoch: 25, train_loss: 0.7699, test_loss: 0.9102, test_f1: 0.5418
 epoch: 26, train_loss: 0.7622, test_loss: 0.9052, test_f1: 0.5582
 epoch: 27, train_loss: 0.7694, test_loss: 0.8554, test_f1: 0.5657
 epoch: 28, train_loss: 0.7693, test_loss: 0.9285, test_f1: 0.5789
 epoch: 29, train_loss: 0.7580, test_loss: 0.8144, test_f1: 0.6022
 epoch: 30, train_loss: 0.7436, test_loss: 0.8044, test_f1: 0.5872
 epoch: 31, train_loss: 0.7587, test_loss: 0.8159, test_f1: 0.5988
 epoch: 32, train_loss: 0.7489, test_loss: 0.7764, test_f1: 0.5738
 epoch: 33, train_loss: 0.7502, test_loss: 0.7190, test_f1: 0.6379
 epoch: 34, train_loss: 0.7489, test_loss: 0.8184, test_f1: 0.5883
 epoch: 35, train_loss: 0.7399, test_loss: 0.7780, test_f1: 0.6074
 epoch: 36, train_loss: 0.7390, test_loss: 0.7808, test_f1: 0.5949
 epoch: 37, train_loss: 0.7380, test_loss: 0.9162, test_f1: 0.5577
 epoch: 38, train_loss: 0.7170, test_loss: 0.8435, test_f1: 0.5779
 epoch: 39, train_loss: 0.7178, test_loss: 0.7701, test_f1: 0.5795
 epoch: 40, train_loss: 0.7205, test_loss: 0.8921, test_f1: 0.5781
 epoch: 41, train_loss: 0.7229, test_loss: 0.8531, test_f1: 0.5986
 epoch: 42, train_loss: 0.7276, test_loss: 0.8034, test_f1: 0.5966
 epoch: 43, train_loss: 0.7105, test_loss: 0.8145, test_f1: 0.6029
 epoch: 44, train_loss: 0.6957, test_loss: 0.8091, test_f1: 0.5680
 epoch: 45, train_loss: 0.7095, test_loss: 0.7779, test_f1: 0.6198
 epoch: 46, train_loss: 0.7104, test_loss: 0.8011, test_f1: 0.5973
 epoch: 47, train_loss: 0.6894, test_loss: 0.7572, test_f1: 0.5804
 epoch: 48, train_loss: 0.6948, test_loss: 0.7636, test_f1: 0.6351
 epoch: 49, train_loss: 0.7059, test_loss: 0.7360, test_f1: 0.6291
 epoch: 50, train_loss: 0.6768, test_loss: 0.7375, test_f1: 0.6052
 epoch: 51, train_loss: 0.6800, test_loss: 0.7768, test_f1: 0.6177
 epoch: 52, train_loss: 0.6618, test_loss: 0.8089, test_f1: 0.6155
 epoch: 53, train_loss: 0.6622, test_loss: 0.8264, test_f1: 0.6323
 epoch: 54, train_loss: 0.6488, test_loss: 0.7755, test_f1: 0.6333
 epoch: 55, train_loss: 0.6651, test_loss: 0.7634, test_f1: 0.6357
 epoch: 56, train_loss: 0.6526, test_loss: 0.7516, test_f1: 0.6368
 epoch: 57, train_loss: 0.6582, test_loss: 0.8283, test_f1: 0.6045
 epoch: 58, train_loss: 0.6628, test_loss: 0.7892, test_f1: 0.6279
 epoch: 59, train_loss: 0.6606, test_loss: 0.7623, test_f1: 0.6208
 epoch: 60, train_loss: 0.6461, test_loss: 0.7690, test_f1: 0.6233
 epoch: 61, train_loss: 0.6478, test_loss: 0.7307, test_f1: 0.6426
 epoch: 62, train_loss: 0.6541, test_loss: 0.7591, test_f1: 0.6360
 epoch: 63, train_loss: 0.6526, test_loss: 0.7467, test_f1: 0.6168
 epoch: 64, train_loss: 0.6392, test_loss: 0.7245, test_f1: 0.6349
 epoch: 65, train_loss: 0.6420, test_loss: 0.7737, test_f1: 0.6253
 epoch: 66, train_loss: 0.6497, test_loss: 0.8086, test_f1: 0.6191
 epoch: 67, train_loss: 0.6391, test_loss: 0.7400, test_f1: 0.6452
 epoch: 68, train_loss: 0.6368, test_loss: 0.7078, test_f1: 0.6472
 epoch: 69, train_loss: 0.6359, test_loss: 0.7306, test_f1: 0.6192
 epoch: 70, train_loss: 0.6377, test_loss: 0.7632, test_f1: 0.6358
 epoch: 71, train_loss: 0.6330, test_loss: 0.7042, test_f1: 0.6327
 epoch: 72, train_loss: 0.6370, test_loss: 0.7318, test_f1: 0.6360
 epoch: 73, train_loss: 0.6276, test_loss: 0.7520, test_f1: 0.6260
 epoch: 74, train_loss: 0.6257, test_loss: 0.7479, test_f1: 0.6310
 epoch: 75, train_loss: 0.6336, test_loss: 0.7245, test_f1: 0.6484
 epoch: 76, train_loss: 0.6285, test_loss: 0.7395, test_f1: 0.6200
 epoch: 77, train_loss: 0.6092, test_loss: 0.7867, test_f1: 0.6135
 epoch: 78, train_loss: 0.6169, test_loss: 0.7939, test_f1: 0.6264
 epoch: 79, train_loss: 0.6317, test_loss: 0.7363, test_f1: 0.6291
 epoch: 80, train_loss: 0.6185, test_loss: 0.7008, test_f1: 0.6352
 epoch: 81, train_loss: 0.6237, test_loss: 0.7201, test_f1: 0.6324
 epoch: 82, train_loss: 0.6193, test_loss: 0.7867, test_f1: 0.6326
 epoch: 83, train_loss: 0.6297, test_loss: 0.7405, test_f1: 0.6318
 epoch: 84, train_loss: 0.6268, test_loss: 0.7216, test_f1: 0.6390
 epoch: 85, train_loss: 0.6049, test_loss: 0.6942, test_f1: 0.6547
 epoch: 86, train_loss: 0.6055, test_loss: 0.8072, test_f1: 0.6044
 epoch: 87, train_loss: 0.6071, test_loss: 0.7640, test_f1: 0.6410
 epoch: 88, train_loss: 0.5979, test_loss: 0.8087, test_f1: 0.6297
 epoch: 89, train_loss: 0.6277, test_loss: 0.7931, test_f1: 0.6244
 epoch: 90, train_loss: 0.6122, test_loss: 0.8165, test_f1: 0.6220
 epoch: 91, train_loss: 0.6050, test_loss: 0.7725, test_f1: 0.6352
 epoch: 92, train_loss: 0.6122, test_loss: 0.7218, test_f1: 0.6238
 epoch: 93, train_loss: 0.6050, test_loss: 0.6830, test_f1: 0.6420
 epoch: 94, train_loss: 0.5923, test_loss: 0.8079, test_f1: 0.6338
 epoch: 95, train_loss: 0.6127, test_loss: 0.7368, test_f1: 0.6412
 epoch: 96, train_loss: 0.6033, test_loss: 0.7471, test_f1: 0.6329
 epoch: 97, train_loss: 0.5992, test_loss: 0.7070, test_f1: 0.6683
 epoch: 98, train_loss: 0.5885, test_loss: 0.7473, test_f1: 0.6445
 epoch: 99, train_loss: 0.6137, test_loss: 0.7500, test_f1: 0.6421
##################ITERATION #5 ****************************************
 epoch: 0, train_loss: 1.1524, test_loss: 0.9835, test_f1: 0.4823
 epoch: 1, train_loss: 1.0083, test_loss: 0.9793, test_f1: 0.4822
 epoch: 2, train_loss: 0.9866, test_loss: 0.9500, test_f1: 0.5118
 epoch: 3, train_loss: 0.9592, test_loss: 0.9329, test_f1: 0.5475
 epoch: 4, train_loss: 0.9480, test_loss: 0.8963, test_f1: 0.4970
 epoch: 5, train_loss: 0.9236, test_loss: 0.9243, test_f1: 0.5206
 epoch: 6, train_loss: 0.9242, test_loss: 1.1102, test_f1: 0.5016
 epoch: 7, train_loss: 0.9232, test_loss: 0.8291, test_f1: 0.5784
 epoch: 8, train_loss: 0.8932, test_loss: 0.8528, test_f1: 0.5705
 epoch: 9, train_loss: 0.8893, test_loss: 0.9887, test_f1: 0.5118
 epoch: 10, train_loss: 0.8726, test_loss: 0.8071, test_f1: 0.5266
 epoch: 11, train_loss: 0.8636, test_loss: 0.7928, test_f1: 0.5492
 epoch: 12, train_loss: 0.8606, test_loss: 0.8267, test_f1: 0.5459
 epoch: 13, train_loss: 0.8558, test_loss: 0.8640, test_f1: 0.5394
 epoch: 14, train_loss: 0.8303, test_loss: 0.7990, test_f1: 0.5665
 epoch: 15, train_loss: 0.8392, test_loss: 0.7791, test_f1: 0.5474
 epoch: 16, train_loss: 0.8328, test_loss: 0.8389, test_f1: 0.5820
 epoch: 17, train_loss: 0.8201, test_loss: 0.8330, test_f1: 0.5913
 epoch: 18, train_loss: 0.8182, test_loss: 0.7928, test_f1: 0.5773
 epoch: 19, train_loss: 0.8180, test_loss: 0.8006, test_f1: 0.5680
 epoch: 20, train_loss: 0.8004, test_loss: 0.8619, test_f1: 0.5741
 epoch: 21, train_loss: 0.7944, test_loss: 0.8372, test_f1: 0.5737
 epoch: 22, train_loss: 0.7908, test_loss: 0.7953, test_f1: 0.6516
 epoch: 23, train_loss: 0.7793, test_loss: 0.8506, test_f1: 0.5759
 epoch: 24, train_loss: 0.7734, test_loss: 0.8093, test_f1: 0.6191
 epoch: 25, train_loss: 0.7886, test_loss: 0.8581, test_f1: 0.5948
 epoch: 26, train_loss: 0.7655, test_loss: 0.8675, test_f1: 0.6048
 epoch: 27, train_loss: 0.7571, test_loss: 0.8482, test_f1: 0.5814
 epoch: 28, train_loss: 0.7645, test_loss: 0.8679, test_f1: 0.6061
 epoch: 29, train_loss: 0.7510, test_loss: 0.8478, test_f1: 0.6061
 epoch: 30, train_loss: 0.7404, test_loss: 0.8670, test_f1: 0.5846
 epoch: 31, train_loss: 0.7482, test_loss: 0.8286, test_f1: 0.6283
 epoch: 32, train_loss: 0.7515, test_loss: 0.8621, test_f1: 0.5551
 epoch: 33, train_loss: 0.7308, test_loss: 0.7657, test_f1: 0.6217
 epoch: 34, train_loss: 0.7301, test_loss: 0.8591, test_f1: 0.6117
 epoch: 35, train_loss: 0.7311, test_loss: 0.8110, test_f1: 0.6278
 epoch: 36, train_loss: 0.7212, test_loss: 0.8347, test_f1: 0.6292
 epoch: 37, train_loss: 0.7177, test_loss: 0.8499, test_f1: 0.5774
 epoch: 38, train_loss: 0.7212, test_loss: 0.7892, test_f1: 0.6340
 epoch: 39, train_loss: 0.7183, test_loss: 0.8763, test_f1: 0.5896
 epoch: 40, train_loss: 0.7011, test_loss: 0.8048, test_f1: 0.6357
 epoch: 41, train_loss: 0.7079, test_loss: 0.9083, test_f1: 0.5960
 epoch: 42, train_loss: 0.7114, test_loss: 0.8485, test_f1: 0.6094
 epoch: 43, train_loss: 0.6829, test_loss: 0.8393, test_f1: 0.6209
 epoch: 44, train_loss: 0.6906, test_loss: 0.8635, test_f1: 0.5982
 epoch: 45, train_loss: 0.7166, test_loss: 0.7975, test_f1: 0.6466
 epoch: 46, train_loss: 0.6894, test_loss: 0.8791, test_f1: 0.5895
 epoch: 47, train_loss: 0.6889, test_loss: 0.7857, test_f1: 0.6257
 epoch: 48, train_loss: 0.6848, test_loss: 0.8519, test_f1: 0.6285
 epoch: 49, train_loss: 0.6774, test_loss: 0.8616, test_f1: 0.5980
 epoch: 50, train_loss: 0.6756, test_loss: 0.8589, test_f1: 0.6149
 epoch: 51, train_loss: 0.6509, test_loss: 0.8414, test_f1: 0.6321
 epoch: 52, train_loss: 0.6560, test_loss: 0.8721, test_f1: 0.6208
 epoch: 53, train_loss: 0.6496, test_loss: 0.8192, test_f1: 0.6523
 epoch: 54, train_loss: 0.6348, test_loss: 0.8617, test_f1: 0.6263
 epoch: 55, train_loss: 0.6397, test_loss: 0.8396, test_f1: 0.6301
 epoch: 56, train_loss: 0.6493, test_loss: 0.8321, test_f1: 0.6658
 epoch: 57, train_loss: 0.6279, test_loss: 0.8288, test_f1: 0.6283
 epoch: 58, train_loss: 0.6383, test_loss: 0.8175, test_f1: 0.6609
 epoch: 59, train_loss: 0.6237, test_loss: 0.8465, test_f1: 0.6277
 epoch: 60, train_loss: 0.6518, test_loss: 0.8363, test_f1: 0.6581
 epoch: 61, train_loss: 0.6358, test_loss: 0.8575, test_f1: 0.6355
 epoch: 62, train_loss: 0.6138, test_loss: 0.8519, test_f1: 0.6408
 epoch: 63, train_loss: 0.6279, test_loss: 0.8283, test_f1: 0.6379
 epoch: 64, train_loss: 0.6138, test_loss: 0.8290, test_f1: 0.6557
 epoch: 65, train_loss: 0.6066, test_loss: 0.8543, test_f1: 0.6365
 epoch: 66, train_loss: 0.6197, test_loss: 0.8886, test_f1: 0.6306
 epoch: 67, train_loss: 0.6164, test_loss: 0.8568, test_f1: 0.6292
 epoch: 68, train_loss: 0.6139, test_loss: 0.8970, test_f1: 0.6393
 epoch: 69, train_loss: 0.6064, test_loss: 0.9086, test_f1: 0.6376
 epoch: 70, train_loss: 0.6109, test_loss: 0.8479, test_f1: 0.6558
 epoch: 71, train_loss: 0.6172, test_loss: 0.8637, test_f1: 0.6341
 epoch: 72, train_loss: 0.6186, test_loss: 0.8503, test_f1: 0.6460
 epoch: 73, train_loss: 0.6179, test_loss: 0.8607, test_f1: 0.6355
 epoch: 74, train_loss: 0.6150, test_loss: 0.9321, test_f1: 0.6199
 epoch: 75, train_loss: 0.6073, test_loss: 0.8522, test_f1: 0.6635
 epoch: 76, train_loss: 0.5945, test_loss: 0.8350, test_f1: 0.6545
 epoch: 77, train_loss: 0.5984, test_loss: 0.8394, test_f1: 0.6467
 epoch: 78, train_loss: 0.5993, test_loss: 0.8835, test_f1: 0.6559
 epoch: 79, train_loss: 0.5896, test_loss: 0.8081, test_f1: 0.6572
 epoch: 80, train_loss: 0.5986, test_loss: 0.8695, test_f1: 0.6715
 epoch: 81, train_loss: 0.5966, test_loss: 0.8430, test_f1: 0.6744
 epoch: 82, train_loss: 0.5878, test_loss: 0.8536, test_f1: 0.6615
 epoch: 83, train_loss: 0.5829, test_loss: 0.8632, test_f1: 0.6425
 epoch: 84, train_loss: 0.6010, test_loss: 0.8557, test_f1: 0.6524
 epoch: 85, train_loss: 0.5800, test_loss: 0.9274, test_f1: 0.6443
 epoch: 86, train_loss: 0.5947, test_loss: 0.8377, test_f1: 0.6831
 epoch: 87, train_loss: 0.6032, test_loss: 0.9082, test_f1: 0.6335
 epoch: 88, train_loss: 0.5876, test_loss: 0.8786, test_f1: 0.6323
 epoch: 89, train_loss: 0.5799, test_loss: 0.9228, test_f1: 0.6512
 epoch: 90, train_loss: 0.5742, test_loss: 0.8773, test_f1: 0.6492
 epoch: 91, train_loss: 0.5758, test_loss: 0.8924, test_f1: 0.6537
 epoch: 92, train_loss: 0.5741, test_loss: 0.8995, test_f1: 0.6358
 epoch: 93, train_loss: 0.5710, test_loss: 0.8665, test_f1: 0.6555
 epoch: 94, train_loss: 0.5774, test_loss: 0.8698, test_f1: 0.6616
 epoch: 95, train_loss: 0.5778, test_loss: 0.8831, test_f1: 0.6662
 epoch: 96, train_loss: 0.5610, test_loss: 0.8986, test_f1: 0.6555
 epoch: 97, train_loss: 0.5785, test_loss: 0.8855, test_f1: 0.6518
 epoch: 98, train_loss: 0.5806, test_loss: 0.8734, test_f1: 0.6422
 epoch: 99, train_loss: 0.5722, test_loss: 0.9509, test_f1: 0.6523
##################ITERATION #6 ****************************************
 epoch: 0, train_loss: 1.2229, test_loss: 1.0077, test_f1: 0.4795
 epoch: 1, train_loss: 1.0501, test_loss: 0.9978, test_f1: 0.4959
 epoch: 2, train_loss: 1.0132, test_loss: 0.9558, test_f1: 0.5060
 epoch: 3, train_loss: 0.9904, test_loss: 0.9462, test_f1: 0.5150
 epoch: 4, train_loss: 0.9733, test_loss: 0.9198, test_f1: 0.5052
 epoch: 5, train_loss: 0.9577, test_loss: 0.8796, test_f1: 0.5431
 epoch: 6, train_loss: 0.9292, test_loss: 0.8842, test_f1: 0.5580
 epoch: 7, train_loss: 0.9229, test_loss: 0.9194, test_f1: 0.5384
 epoch: 8, train_loss: 0.9222, test_loss: 0.8578, test_f1: 0.5553
 epoch: 9, train_loss: 0.9119, test_loss: 0.8892, test_f1: 0.5382
 epoch: 10, train_loss: 0.9017, test_loss: 0.9134, test_f1: 0.5449
 epoch: 11, train_loss: 0.8871, test_loss: 0.8763, test_f1: 0.5911
 epoch: 12, train_loss: 0.8883, test_loss: 0.9418, test_f1: 0.5295
 epoch: 13, train_loss: 0.8752, test_loss: 0.8423, test_f1: 0.5460
 epoch: 14, train_loss: 0.8610, test_loss: 0.8538, test_f1: 0.5712
 epoch: 15, train_loss: 0.8537, test_loss: 0.9200, test_f1: 0.5620
 epoch: 16, train_loss: 0.8422, test_loss: 0.8811, test_f1: 0.5777
 epoch: 17, train_loss: 0.8434, test_loss: 0.8171, test_f1: 0.6065
 epoch: 18, train_loss: 0.8304, test_loss: 0.9329, test_f1: 0.5190
 epoch: 19, train_loss: 0.8163, test_loss: 0.8100, test_f1: 0.5777
 epoch: 20, train_loss: 0.8265, test_loss: 0.7924, test_f1: 0.6113
 epoch: 21, train_loss: 0.8216, test_loss: 0.8643, test_f1: 0.5620
 epoch: 22, train_loss: 0.8074, test_loss: 0.8131, test_f1: 0.5850
 epoch: 23, train_loss: 0.7980, test_loss: 0.8248, test_f1: 0.6104
 epoch: 24, train_loss: 0.7988, test_loss: 0.7894, test_f1: 0.5963
 epoch: 25, train_loss: 0.7899, test_loss: 0.8341, test_f1: 0.5828
 epoch: 26, train_loss: 0.7832, test_loss: 0.8516, test_f1: 0.5834
 epoch: 27, train_loss: 0.7870, test_loss: 0.8605, test_f1: 0.5557
 epoch: 28, train_loss: 0.7830, test_loss: 0.8451, test_f1: 0.5657
 epoch: 29, train_loss: 0.7740, test_loss: 0.8668, test_f1: 0.5766
 epoch: 30, train_loss: 0.7645, test_loss: 0.8008, test_f1: 0.5891
 epoch: 31, train_loss: 0.7639, test_loss: 0.8497, test_f1: 0.5824
 epoch: 32, train_loss: 0.7706, test_loss: 0.7684, test_f1: 0.5827
 epoch: 33, train_loss: 0.7592, test_loss: 0.8247, test_f1: 0.5655
 epoch: 34, train_loss: 0.7444, test_loss: 0.8263, test_f1: 0.5975
 epoch: 35, train_loss: 0.7612, test_loss: 0.8386, test_f1: 0.5684
 epoch: 36, train_loss: 0.7603, test_loss: 0.8126, test_f1: 0.5586
 epoch: 37, train_loss: 0.7411, test_loss: 0.8149, test_f1: 0.5760
 epoch: 38, train_loss: 0.7249, test_loss: 0.8009, test_f1: 0.6023
 epoch: 39, train_loss: 0.7385, test_loss: 0.8610, test_f1: 0.5480
 epoch: 40, train_loss: 0.7465, test_loss: 0.8241, test_f1: 0.5862
 epoch: 41, train_loss: 0.7255, test_loss: 0.8046, test_f1: 0.5772
 epoch: 42, train_loss: 0.7362, test_loss: 0.8571, test_f1: 0.6207
 epoch: 43, train_loss: 0.7216, test_loss: 0.7993, test_f1: 0.5838
 epoch: 44, train_loss: 0.7192, test_loss: 0.7975, test_f1: 0.5968
 epoch: 45, train_loss: 0.7150, test_loss: 0.8417, test_f1: 0.6048
 epoch: 46, train_loss: 0.6959, test_loss: 0.7698, test_f1: 0.5990
 epoch: 47, train_loss: 0.7105, test_loss: 0.8183, test_f1: 0.5978
 epoch: 48, train_loss: 0.7151, test_loss: 0.8570, test_f1: 0.5827
 epoch: 49, train_loss: 0.7026, test_loss: 0.7648, test_f1: 0.6201
 epoch: 50, train_loss: 0.7007, test_loss: 0.8541, test_f1: 0.5865
 epoch: 51, train_loss: 0.6740, test_loss: 0.8461, test_f1: 0.5843
 epoch: 52, train_loss: 0.6717, test_loss: 0.8303, test_f1: 0.6069
 epoch: 53, train_loss: 0.6680, test_loss: 0.7866, test_f1: 0.6039
 epoch: 54, train_loss: 0.6609, test_loss: 0.8317, test_f1: 0.6185
 epoch: 55, train_loss: 0.6656, test_loss: 0.7975, test_f1: 0.6002
 epoch: 56, train_loss: 0.6568, test_loss: 0.7728, test_f1: 0.6110
 epoch: 57, train_loss: 0.6432, test_loss: 0.7644, test_f1: 0.6376
 epoch: 58, train_loss: 0.6524, test_loss: 0.8378, test_f1: 0.6333
 epoch: 59, train_loss: 0.6661, test_loss: 0.7889, test_f1: 0.6201
 epoch: 60, train_loss: 0.6736, test_loss: 0.8320, test_f1: 0.6050
 epoch: 61, train_loss: 0.6551, test_loss: 0.7838, test_f1: 0.6320
 epoch: 62, train_loss: 0.6408, test_loss: 0.8283, test_f1: 0.6327
 epoch: 63, train_loss: 0.6376, test_loss: 0.7797, test_f1: 0.6150
 epoch: 64, train_loss: 0.6429, test_loss: 0.7765, test_f1: 0.6576
 epoch: 65, train_loss: 0.6473, test_loss: 0.8803, test_f1: 0.6060
 epoch: 66, train_loss: 0.6453, test_loss: 0.7528, test_f1: 0.6440
 epoch: 67, train_loss: 0.6519, test_loss: 0.7600, test_f1: 0.6640
 epoch: 68, train_loss: 0.6359, test_loss: 0.8765, test_f1: 0.6110
 epoch: 69, train_loss: 0.6411, test_loss: 0.7712, test_f1: 0.6676
 epoch: 70, train_loss: 0.6433, test_loss: 0.7568, test_f1: 0.6435
 epoch: 71, train_loss: 0.6451, test_loss: 0.7712, test_f1: 0.6307
 epoch: 72, train_loss: 0.6379, test_loss: 0.7840, test_f1: 0.6333
 epoch: 73, train_loss: 0.6321, test_loss: 0.8086, test_f1: 0.6135
 epoch: 74, train_loss: 0.6335, test_loss: 0.7900, test_f1: 0.6115
 epoch: 75, train_loss: 0.6256, test_loss: 0.7853, test_f1: 0.6355
 epoch: 76, train_loss: 0.6242, test_loss: 0.8516, test_f1: 0.6474
 epoch: 77, train_loss: 0.6270, test_loss: 0.7707, test_f1: 0.6527
 epoch: 78, train_loss: 0.6201, test_loss: 0.7808, test_f1: 0.6390
 epoch: 79, train_loss: 0.6252, test_loss: 0.7992, test_f1: 0.6298
 epoch: 80, train_loss: 0.6092, test_loss: 0.8083, test_f1: 0.6293
 epoch: 81, train_loss: 0.6177, test_loss: 0.8120, test_f1: 0.6360
 epoch: 82, train_loss: 0.6137, test_loss: 0.8021, test_f1: 0.6276
 epoch: 83, train_loss: 0.6311, test_loss: 0.8420, test_f1: 0.6120
 epoch: 84, train_loss: 0.6300, test_loss: 0.8895, test_f1: 0.5973
 epoch: 85, train_loss: 0.6313, test_loss: 0.8221, test_f1: 0.6449
 epoch: 86, train_loss: 0.6261, test_loss: 0.8067, test_f1: 0.6375
 epoch: 87, train_loss: 0.6247, test_loss: 0.8678, test_f1: 0.6235
 epoch: 88, train_loss: 0.6061, test_loss: 0.8606, test_f1: 0.6256
 epoch: 89, train_loss: 0.6130, test_loss: 0.7751, test_f1: 0.6675
 epoch: 90, train_loss: 0.6092, test_loss: 0.7795, test_f1: 0.6586
 epoch: 91, train_loss: 0.6135, test_loss: 0.7836, test_f1: 0.6526
 epoch: 92, train_loss: 0.6064, test_loss: 0.7738, test_f1: 0.6562
 epoch: 93, train_loss: 0.5927, test_loss: 0.7767, test_f1: 0.6482
 epoch: 94, train_loss: 0.6146, test_loss: 0.8233, test_f1: 0.6391
 epoch: 95, train_loss: 0.6099, test_loss: 0.7700, test_f1: 0.6511
 epoch: 96, train_loss: 0.6078, test_loss: 0.7761, test_f1: 0.6412
 epoch: 97, train_loss: 0.5947, test_loss: 0.7992, test_f1: 0.6461
 epoch: 98, train_loss: 0.5980, test_loss: 0.7784, test_f1: 0.6569
 epoch: 99, train_loss: 0.6025, test_loss: 0.8173, test_f1: 0.6219
##################ITERATION #7 ****************************************
 epoch: 0, train_loss: 1.2123, test_loss: 0.9885, test_f1: 0.4967
 epoch: 1, train_loss: 1.0317, test_loss: 1.0108, test_f1: 0.4900
 epoch: 2, train_loss: 0.9973, test_loss: 1.0278, test_f1: 0.4769
 epoch: 3, train_loss: 0.9814, test_loss: 1.0039, test_f1: 0.5169
 epoch: 4, train_loss: 0.9555, test_loss: 1.0252, test_f1: 0.4746
 epoch: 5, train_loss: 0.9339, test_loss: 0.9862, test_f1: 0.5246
 epoch: 6, train_loss: 0.9286, test_loss: 0.9624, test_f1: 0.5309
 epoch: 7, train_loss: 0.9083, test_loss: 0.9329, test_f1: 0.5191
 epoch: 8, train_loss: 0.9049, test_loss: 0.9949, test_f1: 0.4998
 epoch: 9, train_loss: 0.8861, test_loss: 0.9630, test_f1: 0.5258
 epoch: 10, train_loss: 0.8837, test_loss: 0.9013, test_f1: 0.5229
 epoch: 11, train_loss: 0.8638, test_loss: 0.9420, test_f1: 0.5201
 epoch: 12, train_loss: 0.8646, test_loss: 0.9320, test_f1: 0.5283
 epoch: 13, train_loss: 0.8615, test_loss: 0.9168, test_f1: 0.5527
 epoch: 14, train_loss: 0.8382, test_loss: 0.9390, test_f1: 0.5366
 epoch: 15, train_loss: 0.8600, test_loss: 0.9078, test_f1: 0.5245
 epoch: 16, train_loss: 0.8272, test_loss: 0.9138, test_f1: 0.5108
 epoch: 17, train_loss: 0.8210, test_loss: 0.8736, test_f1: 0.5642
 epoch: 18, train_loss: 0.8169, test_loss: 0.8897, test_f1: 0.5486
 epoch: 19, train_loss: 0.8063, test_loss: 0.8887, test_f1: 0.5502
 epoch: 20, train_loss: 0.8052, test_loss: 0.8951, test_f1: 0.5255
 epoch: 21, train_loss: 0.7957, test_loss: 0.8825, test_f1: 0.5640
 epoch: 22, train_loss: 0.8018, test_loss: 0.8834, test_f1: 0.5618
 epoch: 23, train_loss: 0.7829, test_loss: 0.8919, test_f1: 0.5677
 epoch: 24, train_loss: 0.7941, test_loss: 0.9522, test_f1: 0.5333
 epoch: 25, train_loss: 0.7759, test_loss: 0.8647, test_f1: 0.5957
 epoch: 26, train_loss: 0.7681, test_loss: 0.9477, test_f1: 0.5429
 epoch: 27, train_loss: 0.7624, test_loss: 0.9189, test_f1: 0.5599
 epoch: 28, train_loss: 0.7698, test_loss: 0.9134, test_f1: 0.5738
 epoch: 29, train_loss: 0.7557, test_loss: 0.9838, test_f1: 0.5604
 epoch: 30, train_loss: 0.7614, test_loss: 0.9366, test_f1: 0.5316
 epoch: 31, train_loss: 0.7551, test_loss: 0.9593, test_f1: 0.5494
 epoch: 32, train_loss: 0.7495, test_loss: 0.9135, test_f1: 0.5684
 epoch: 33, train_loss: 0.7455, test_loss: 0.9330, test_f1: 0.5657
 epoch: 34, train_loss: 0.7407, test_loss: 0.8945, test_f1: 0.5696
 epoch: 35, train_loss: 0.7406, test_loss: 0.9085, test_f1: 0.5592
 epoch: 36, train_loss: 0.7337, test_loss: 0.8683, test_f1: 0.5700
 epoch: 37, train_loss: 0.7205, test_loss: 0.8743, test_f1: 0.5959
 epoch: 38, train_loss: 0.7477, test_loss: 0.9279, test_f1: 0.5694
 epoch: 39, train_loss: 0.7344, test_loss: 0.8931, test_f1: 0.5650
 epoch: 40, train_loss: 0.7265, test_loss: 0.8382, test_f1: 0.5853
 epoch: 41, train_loss: 0.7140, test_loss: 0.9647, test_f1: 0.5878
 epoch: 42, train_loss: 0.7141, test_loss: 0.8796, test_f1: 0.6012
 epoch: 43, train_loss: 0.7039, test_loss: 0.8686, test_f1: 0.6000
 epoch: 44, train_loss: 0.7035, test_loss: 0.8618, test_f1: 0.6100
 epoch: 45, train_loss: 0.6961, test_loss: 0.8310, test_f1: 0.5650
 epoch: 46, train_loss: 0.6993, test_loss: 0.9120, test_f1: 0.5859
 epoch: 47, train_loss: 0.7107, test_loss: 0.8446, test_f1: 0.6090
 epoch: 48, train_loss: 0.6907, test_loss: 0.8421, test_f1: 0.6032
 epoch: 49, train_loss: 0.6909, test_loss: 0.9395, test_f1: 0.5916
 epoch: 50, train_loss: 0.7013, test_loss: 0.8451, test_f1: 0.6269
 epoch: 51, train_loss: 0.6598, test_loss: 0.8496, test_f1: 0.6116
 epoch: 52, train_loss: 0.6608, test_loss: 0.8761, test_f1: 0.6056
 epoch: 53, train_loss: 0.6629, test_loss: 0.8392, test_f1: 0.6180
 epoch: 54, train_loss: 0.6533, test_loss: 0.8938, test_f1: 0.5795
 epoch: 55, train_loss: 0.6549, test_loss: 0.9175, test_f1: 0.5985
 epoch: 56, train_loss: 0.6506, test_loss: 0.9205, test_f1: 0.5768
 epoch: 57, train_loss: 0.6631, test_loss: 0.8476, test_f1: 0.6076
 epoch: 58, train_loss: 0.6513, test_loss: 0.8789, test_f1: 0.6242
 epoch: 59, train_loss: 0.6406, test_loss: 0.8642, test_f1: 0.6127
 epoch: 60, train_loss: 0.6418, test_loss: 0.8542, test_f1: 0.5920
 epoch: 61, train_loss: 0.6469, test_loss: 0.8811, test_f1: 0.5859
 epoch: 62, train_loss: 0.6419, test_loss: 0.8682, test_f1: 0.5916
 epoch: 63, train_loss: 0.6342, test_loss: 0.9102, test_f1: 0.5937
 epoch: 64, train_loss: 0.6345, test_loss: 0.8404, test_f1: 0.6159
 epoch: 65, train_loss: 0.6443, test_loss: 0.9242, test_f1: 0.5907
 epoch: 66, train_loss: 0.6302, test_loss: 0.9082, test_f1: 0.6046
 epoch: 67, train_loss: 0.6340, test_loss: 0.8953, test_f1: 0.6049
 epoch: 68, train_loss: 0.6266, test_loss: 0.9011, test_f1: 0.6227
 epoch: 69, train_loss: 0.6398, test_loss: 0.8936, test_f1: 0.6026
 epoch: 70, train_loss: 0.6277, test_loss: 0.9416, test_f1: 0.5893
 epoch: 71, train_loss: 0.6448, test_loss: 0.8758, test_f1: 0.6200
 epoch: 72, train_loss: 0.6294, test_loss: 0.9044, test_f1: 0.6109
 epoch: 73, train_loss: 0.6244, test_loss: 0.8677, test_f1: 0.6139
 epoch: 74, train_loss: 0.6228, test_loss: 0.8755, test_f1: 0.6162
 epoch: 75, train_loss: 0.6252, test_loss: 0.8937, test_f1: 0.6146
 epoch: 76, train_loss: 0.6075, test_loss: 0.9079, test_f1: 0.6090
 epoch: 77, train_loss: 0.6252, test_loss: 0.8857, test_f1: 0.6201
 epoch: 78, train_loss: 0.6295, test_loss: 0.8729, test_f1: 0.6215
 epoch: 79, train_loss: 0.6151, test_loss: 0.9530, test_f1: 0.6314
 epoch: 80, train_loss: 0.6183, test_loss: 0.8331, test_f1: 0.6293
 epoch: 81, train_loss: 0.6134, test_loss: 0.8353, test_f1: 0.6329
 epoch: 82, train_loss: 0.6040, test_loss: 0.8960, test_f1: 0.6142
 epoch: 83, train_loss: 0.6024, test_loss: 0.8596, test_f1: 0.6210
 epoch: 84, train_loss: 0.6290, test_loss: 0.8524, test_f1: 0.6343
 epoch: 85, train_loss: 0.5897, test_loss: 0.9338, test_f1: 0.6121
 epoch: 86, train_loss: 0.6053, test_loss: 0.8805, test_f1: 0.6305
 epoch: 87, train_loss: 0.6079, test_loss: 0.8590, test_f1: 0.6322
 epoch: 88, train_loss: 0.5999, test_loss: 0.8581, test_f1: 0.6487
 epoch: 89, train_loss: 0.5952, test_loss: 0.8302, test_f1: 0.6456
 epoch: 90, train_loss: 0.6033, test_loss: 0.9205, test_f1: 0.5939
 epoch: 91, train_loss: 0.6026, test_loss: 0.9045, test_f1: 0.6118
 epoch: 92, train_loss: 0.6014, test_loss: 0.8325, test_f1: 0.6220
 epoch: 93, train_loss: 0.6011, test_loss: 0.9009, test_f1: 0.6230
 epoch: 94, train_loss: 0.5825, test_loss: 0.8700, test_f1: 0.6372
 epoch: 95, train_loss: 0.6024, test_loss: 0.8948, test_f1: 0.6240
 epoch: 96, train_loss: 0.6013, test_loss: 0.8330, test_f1: 0.6266
 epoch: 97, train_loss: 0.5972, test_loss: 0.8443, test_f1: 0.6410
 epoch: 98, train_loss: 0.5854, test_loss: 0.8858, test_f1: 0.6187
 epoch: 99, train_loss: 0.5899, test_loss: 0.8128, test_f1: 0.6476
##################ITERATION #8 ****************************************
 epoch: 0, train_loss: 1.1416, test_loss: 1.0309, test_f1: 0.4917
 epoch: 1, train_loss: 1.0374, test_loss: 1.0500, test_f1: 0.4581
 epoch: 2, train_loss: 1.0033, test_loss: 1.0179, test_f1: 0.4750
 epoch: 3, train_loss: 0.9754, test_loss: 1.0302, test_f1: 0.4588
 epoch: 4, train_loss: 0.9620, test_loss: 1.0171, test_f1: 0.4729
 epoch: 5, train_loss: 0.9512, test_loss: 0.9480, test_f1: 0.4976
 epoch: 6, train_loss: 0.9330, test_loss: 0.9596, test_f1: 0.5484
 epoch: 7, train_loss: 0.9295, test_loss: 0.9746, test_f1: 0.5141
 epoch: 8, train_loss: 0.9078, test_loss: 0.9632, test_f1: 0.4882
 epoch: 9, train_loss: 0.8984, test_loss: 0.9035, test_f1: 0.5519
 epoch: 10, train_loss: 0.8857, test_loss: 0.9057, test_f1: 0.5435
 epoch: 11, train_loss: 0.8639, test_loss: 0.8984, test_f1: 0.5490
 epoch: 12, train_loss: 0.8758, test_loss: 0.9467, test_f1: 0.4696
 epoch: 13, train_loss: 0.8539, test_loss: 0.8595, test_f1: 0.5613
 epoch: 14, train_loss: 0.8523, test_loss: 0.8882, test_f1: 0.5250
 epoch: 15, train_loss: 0.8519, test_loss: 0.9258, test_f1: 0.5278
 epoch: 16, train_loss: 0.8378, test_loss: 0.8503, test_f1: 0.5415
 epoch: 17, train_loss: 0.8143, test_loss: 0.8866, test_f1: 0.5916
 epoch: 18, train_loss: 0.8227, test_loss: 0.8621, test_f1: 0.5743
 epoch: 19, train_loss: 0.8188, test_loss: 0.8073, test_f1: 0.5903
 epoch: 20, train_loss: 0.8031, test_loss: 0.8738, test_f1: 0.5845
 epoch: 21, train_loss: 0.8008, test_loss: 0.8516, test_f1: 0.6045
 epoch: 22, train_loss: 0.7972, test_loss: 0.8373, test_f1: 0.5534
 epoch: 23, train_loss: 0.8045, test_loss: 0.8904, test_f1: 0.5327
 epoch: 24, train_loss: 0.7883, test_loss: 0.8354, test_f1: 0.5635
 epoch: 25, train_loss: 0.7799, test_loss: 1.0305, test_f1: 0.5415
 epoch: 26, train_loss: 0.7787, test_loss: 0.8673, test_f1: 0.5784
 epoch: 27, train_loss: 0.7776, test_loss: 0.8045, test_f1: 0.6174
 epoch: 28, train_loss: 0.7666, test_loss: 0.8223, test_f1: 0.5316
 epoch: 29, train_loss: 0.7716, test_loss: 0.8749, test_f1: 0.5768
 epoch: 30, train_loss: 0.7533, test_loss: 0.9176, test_f1: 0.5425
 epoch: 31, train_loss: 0.7610, test_loss: 0.8530, test_f1: 0.5728
 epoch: 32, train_loss: 0.7648, test_loss: 0.8224, test_f1: 0.5790
 epoch: 33, train_loss: 0.7714, test_loss: 0.8070, test_f1: 0.5802
 epoch: 34, train_loss: 0.7426, test_loss: 0.8596, test_f1: 0.5928
 epoch: 35, train_loss: 0.7587, test_loss: 0.8943, test_f1: 0.5936
 epoch: 36, train_loss: 0.7533, test_loss: 0.8023, test_f1: 0.6130
 epoch: 37, train_loss: 0.7358, test_loss: 0.8128, test_f1: 0.5863
 epoch: 38, train_loss: 0.7357, test_loss: 0.8496, test_f1: 0.5881
 epoch: 39, train_loss: 0.7267, test_loss: 0.8698, test_f1: 0.6078
 epoch: 40, train_loss: 0.7298, test_loss: 0.9636, test_f1: 0.5975
 epoch: 41, train_loss: 0.7245, test_loss: 0.7776, test_f1: 0.6459
 epoch: 42, train_loss: 0.7300, test_loss: 0.8358, test_f1: 0.5466
 epoch: 43, train_loss: 0.7275, test_loss: 0.8232, test_f1: 0.5974
 epoch: 44, train_loss: 0.7391, test_loss: 0.8769, test_f1: 0.6154
 epoch: 45, train_loss: 0.7177, test_loss: 0.8393, test_f1: 0.5924
 epoch: 46, train_loss: 0.7192, test_loss: 0.8759, test_f1: 0.5822
 epoch: 47, train_loss: 0.7125, test_loss: 0.8345, test_f1: 0.6174
 epoch: 48, train_loss: 0.7103, test_loss: 0.8523, test_f1: 0.6170
 epoch: 49, train_loss: 0.7110, test_loss: 0.8208, test_f1: 0.5980
 epoch: 50, train_loss: 0.7084, test_loss: 0.9846, test_f1: 0.5404
 epoch: 51, train_loss: 0.6942, test_loss: 0.8922, test_f1: 0.5919
 epoch: 52, train_loss: 0.6883, test_loss: 0.7839, test_f1: 0.6464
 epoch: 53, train_loss: 0.6851, test_loss: 0.8025, test_f1: 0.6157
 epoch: 54, train_loss: 0.6624, test_loss: 0.8123, test_f1: 0.6102
 epoch: 55, train_loss: 0.6789, test_loss: 0.8524, test_f1: 0.6169
 epoch: 56, train_loss: 0.6827, test_loss: 0.7870, test_f1: 0.6376
 epoch: 57, train_loss: 0.6672, test_loss: 0.7956, test_f1: 0.6316
 epoch: 58, train_loss: 0.6707, test_loss: 0.8555, test_f1: 0.6095
 epoch: 59, train_loss: 0.6745, test_loss: 0.8179, test_f1: 0.6206
 epoch: 60, train_loss: 0.6686, test_loss: 0.8356, test_f1: 0.6074
 epoch: 61, train_loss: 0.6695, test_loss: 0.8350, test_f1: 0.6108
 epoch: 62, train_loss: 0.6589, test_loss: 0.8322, test_f1: 0.6280
 epoch: 63, train_loss: 0.6550, test_loss: 0.7879, test_f1: 0.6321
 epoch: 64, train_loss: 0.6582, test_loss: 0.9147, test_f1: 0.6040
 epoch: 65, train_loss: 0.6641, test_loss: 0.8321, test_f1: 0.5921
 epoch: 66, train_loss: 0.6528, test_loss: 0.8515, test_f1: 0.5847
 epoch: 67, train_loss: 0.6558, test_loss: 0.8805, test_f1: 0.5852
 epoch: 68, train_loss: 0.6519, test_loss: 0.7945, test_f1: 0.6270
 epoch: 69, train_loss: 0.6571, test_loss: 0.8731, test_f1: 0.5941
 epoch: 70, train_loss: 0.6494, test_loss: 0.8435, test_f1: 0.6029
 epoch: 71, train_loss: 0.6561, test_loss: 0.7977, test_f1: 0.6698
 epoch: 72, train_loss: 0.6618, test_loss: 0.8070, test_f1: 0.6342
 epoch: 73, train_loss: 0.6420, test_loss: 0.8597, test_f1: 0.6441
 epoch: 74, train_loss: 0.6507, test_loss: 0.7946, test_f1: 0.6554
 epoch: 75, train_loss: 0.6403, test_loss: 0.8829, test_f1: 0.6071
 epoch: 76, train_loss: 0.6451, test_loss: 0.8365, test_f1: 0.6394
 epoch: 77, train_loss: 0.6665, test_loss: 0.9059, test_f1: 0.5940
 epoch: 78, train_loss: 0.6520, test_loss: 0.8605, test_f1: 0.6099
 epoch: 79, train_loss: 0.6490, test_loss: 0.8101, test_f1: 0.6521
 epoch: 80, train_loss: 0.6498, test_loss: 0.7746, test_f1: 0.6553
 epoch: 81, train_loss: 0.6506, test_loss: 0.8280, test_f1: 0.6471
 epoch: 82, train_loss: 0.6346, test_loss: 0.8120, test_f1: 0.6555
 epoch: 83, train_loss: 0.6395, test_loss: 0.8309, test_f1: 0.6334
 epoch: 84, train_loss: 0.6547, test_loss: 0.7800, test_f1: 0.6396
 epoch: 85, train_loss: 0.6289, test_loss: 0.8636, test_f1: 0.6281
 epoch: 86, train_loss: 0.6302, test_loss: 0.8916, test_f1: 0.5971
 epoch: 87, train_loss: 0.6397, test_loss: 0.8239, test_f1: 0.6158
 epoch: 88, train_loss: 0.6244, test_loss: 0.9713, test_f1: 0.6079
 epoch: 89, train_loss: 0.6441, test_loss: 0.8589, test_f1: 0.6008
 epoch: 90, train_loss: 0.6261, test_loss: 0.7898, test_f1: 0.6525
 epoch: 91, train_loss: 0.6384, test_loss: 0.8857, test_f1: 0.6323
 epoch: 92, train_loss: 0.6229, test_loss: 0.8803, test_f1: 0.6301
 epoch: 93, train_loss: 0.6257, test_loss: 1.0023, test_f1: 0.5784
 epoch: 94, train_loss: 0.6311, test_loss: 0.8597, test_f1: 0.6212
 epoch: 95, train_loss: 0.6353, test_loss: 0.8677, test_f1: 0.6408
 epoch: 96, train_loss: 0.6193, test_loss: 0.8662, test_f1: 0.6393
 epoch: 97, train_loss: 0.6238, test_loss: 0.8512, test_f1: 0.6380
 epoch: 98, train_loss: 0.6291, test_loss: 0.8874, test_f1: 0.6043
 epoch: 99, train_loss: 0.6269, test_loss: 0.7833, test_f1: 0.6466
##################ITERATION #9 ****************************************
 epoch: 0, train_loss: 1.2367, test_loss: 1.0849, test_f1: 0.4371
 epoch: 1, train_loss: 1.0269, test_loss: 1.0157, test_f1: 0.4949
 epoch: 2, train_loss: 1.0046, test_loss: 1.0195, test_f1: 0.5346
 epoch: 3, train_loss: 0.9894, test_loss: 1.0320, test_f1: 0.4956
 epoch: 4, train_loss: 0.9750, test_loss: 1.0882, test_f1: 0.4761
 epoch: 5, train_loss: 0.9568, test_loss: 1.0252, test_f1: 0.5265
 epoch: 6, train_loss: 0.9502, test_loss: 0.9608, test_f1: 0.5519
 epoch: 7, train_loss: 0.9310, test_loss: 0.9893, test_f1: 0.5531
 epoch: 8, train_loss: 0.9256, test_loss: 0.9546, test_f1: 0.5537
 epoch: 9, train_loss: 0.8924, test_loss: 0.9851, test_f1: 0.5248
 epoch: 10, train_loss: 0.8981, test_loss: 0.9224, test_f1: 0.5780
 epoch: 11, train_loss: 0.8904, test_loss: 0.9381, test_f1: 0.5596
 epoch: 12, train_loss: 0.8589, test_loss: 0.9260, test_f1: 0.5817
 epoch: 13, train_loss: 0.8530, test_loss: 0.9141, test_f1: 0.5524
 epoch: 14, train_loss: 0.8431, test_loss: 0.9758, test_f1: 0.5534
 epoch: 15, train_loss: 0.8566, test_loss: 0.9157, test_f1: 0.5516
 epoch: 16, train_loss: 0.8329, test_loss: 0.9031, test_f1: 0.5781
 epoch: 17, train_loss: 0.8397, test_loss: 0.9217, test_f1: 0.5263
 epoch: 18, train_loss: 0.8283, test_loss: 0.8858, test_f1: 0.5722
 epoch: 19, train_loss: 0.8398, test_loss: 0.8864, test_f1: 0.5584
 epoch: 20, train_loss: 0.8369, test_loss: 0.9116, test_f1: 0.5211
 epoch: 21, train_loss: 0.8339, test_loss: 0.9689, test_f1: 0.5001
 epoch: 22, train_loss: 0.8164, test_loss: 0.8937, test_f1: 0.5625
 epoch: 23, train_loss: 0.8078, test_loss: 0.8934, test_f1: 0.5532
 epoch: 24, train_loss: 0.8047, test_loss: 0.8330, test_f1: 0.5848
 epoch: 25, train_loss: 0.7867, test_loss: 0.8668, test_f1: 0.5605
 epoch: 26, train_loss: 0.7855, test_loss: 0.8913, test_f1: 0.5421
 epoch: 27, train_loss: 0.7638, test_loss: 0.9061, test_f1: 0.5803
 epoch: 28, train_loss: 0.7700, test_loss: 0.8566, test_f1: 0.5575
 epoch: 29, train_loss: 0.7648, test_loss: 0.8411, test_f1: 0.5647
 epoch: 30, train_loss: 0.7595, test_loss: 0.8700, test_f1: 0.5725
 epoch: 31, train_loss: 0.7429, test_loss: 0.9380, test_f1: 0.5744
 epoch: 32, train_loss: 0.7456, test_loss: 0.8266, test_f1: 0.6280
 epoch: 33, train_loss: 0.7409, test_loss: 0.8117, test_f1: 0.6287
 epoch: 34, train_loss: 0.7463, test_loss: 0.9623, test_f1: 0.5448
 epoch: 35, train_loss: 0.7490, test_loss: 0.8446, test_f1: 0.6036
 epoch: 36, train_loss: 0.7418, test_loss: 0.8452, test_f1: 0.5937
 epoch: 37, train_loss: 0.7396, test_loss: 0.8726, test_f1: 0.5989
 epoch: 38, train_loss: 0.7216, test_loss: 0.7747, test_f1: 0.6345
 epoch: 39, train_loss: 0.7227, test_loss: 0.8669, test_f1: 0.6101
 epoch: 40, train_loss: 0.7174, test_loss: 0.8766, test_f1: 0.5716
 epoch: 41, train_loss: 0.7243, test_loss: 0.8180, test_f1: 0.6318
 epoch: 42, train_loss: 0.7164, test_loss: 0.8782, test_f1: 0.5833
 epoch: 43, train_loss: 0.7107, test_loss: 0.8207, test_f1: 0.6145
 epoch: 44, train_loss: 0.7149, test_loss: 0.8567, test_f1: 0.6043
 epoch: 45, train_loss: 0.6993, test_loss: 0.8846, test_f1: 0.6240
 epoch: 46, train_loss: 0.6989, test_loss: 0.8752, test_f1: 0.6289
 epoch: 47, train_loss: 0.6928, test_loss: 0.8533, test_f1: 0.6157
 epoch: 48, train_loss: 0.7016, test_loss: 0.8470, test_f1: 0.5915
 epoch: 49, train_loss: 0.6961, test_loss: 0.8086, test_f1: 0.6305
 epoch: 50, train_loss: 0.6867, test_loss: 0.7695, test_f1: 0.6513
 epoch: 51, train_loss: 0.6627, test_loss: 0.8672, test_f1: 0.6052
 epoch: 52, train_loss: 0.6567, test_loss: 0.8209, test_f1: 0.6290
 epoch: 53, train_loss: 0.6716, test_loss: 0.8357, test_f1: 0.6320
 epoch: 54, train_loss: 0.6504, test_loss: 0.8279, test_f1: 0.6302
 epoch: 55, train_loss: 0.6496, test_loss: 0.8387, test_f1: 0.6169
 epoch: 56, train_loss: 0.6600, test_loss: 0.8369, test_f1: 0.6345
 epoch: 57, train_loss: 0.6341, test_loss: 0.7915, test_f1: 0.6459
 epoch: 58, train_loss: 0.6505, test_loss: 0.8288, test_f1: 0.6308
 epoch: 59, train_loss: 0.6439, test_loss: 0.8378, test_f1: 0.6307
 epoch: 60, train_loss: 0.6517, test_loss: 0.8269, test_f1: 0.6308
 epoch: 61, train_loss: 0.6429, test_loss: 0.8691, test_f1: 0.6196
 epoch: 62, train_loss: 0.6295, test_loss: 0.7769, test_f1: 0.6713
 epoch: 63, train_loss: 0.6322, test_loss: 0.8392, test_f1: 0.6316
 epoch: 64, train_loss: 0.6299, test_loss: 0.8714, test_f1: 0.6367
 epoch: 65, train_loss: 0.6275, test_loss: 0.8551, test_f1: 0.6434
 epoch: 66, train_loss: 0.6241, test_loss: 0.8103, test_f1: 0.6447
 epoch: 67, train_loss: 0.6316, test_loss: 0.8208, test_f1: 0.6304
 epoch: 68, train_loss: 0.6463, test_loss: 0.8041, test_f1: 0.6521
 epoch: 69, train_loss: 0.6265, test_loss: 0.8298, test_f1: 0.6463
 epoch: 70, train_loss: 0.6285, test_loss: 0.8312, test_f1: 0.6543
 epoch: 71, train_loss: 0.6259, test_loss: 0.7908, test_f1: 0.6593
 epoch: 72, train_loss: 0.6126, test_loss: 0.8407, test_f1: 0.6702
 epoch: 73, train_loss: 0.6177, test_loss: 0.8149, test_f1: 0.6491
 epoch: 74, train_loss: 0.6337, test_loss: 0.7910, test_f1: 0.6330
 epoch: 75, train_loss: 0.6168, test_loss: 0.8367, test_f1: 0.6409
 epoch: 76, train_loss: 0.6170, test_loss: 0.8092, test_f1: 0.6472
 epoch: 77, train_loss: 0.6075, test_loss: 0.8617, test_f1: 0.6194
 epoch: 78, train_loss: 0.6051, test_loss: 0.8013, test_f1: 0.6502
 epoch: 79, train_loss: 0.6175, test_loss: 0.8109, test_f1: 0.6500
 epoch: 80, train_loss: 0.6187, test_loss: 0.8847, test_f1: 0.6311
 epoch: 81, train_loss: 0.6109, test_loss: 0.8252, test_f1: 0.6410
 epoch: 82, train_loss: 0.6363, test_loss: 0.8312, test_f1: 0.6307
 epoch: 83, train_loss: 0.6211, test_loss: 0.8384, test_f1: 0.6463
 epoch: 84, train_loss: 0.6048, test_loss: 0.8817, test_f1: 0.6351
 epoch: 85, train_loss: 0.5986, test_loss: 0.8379, test_f1: 0.6368
 epoch: 86, train_loss: 0.6066, test_loss: 0.8780, test_f1: 0.6339
 epoch: 87, train_loss: 0.6024, test_loss: 0.8527, test_f1: 0.6449
 epoch: 88, train_loss: 0.6085, test_loss: 0.8655, test_f1: 0.6451
 epoch: 89, train_loss: 0.6140, test_loss: 0.8758, test_f1: 0.6096
 epoch: 90, train_loss: 0.5893, test_loss: 0.8235, test_f1: 0.6513
 epoch: 91, train_loss: 0.6132, test_loss: 0.8478, test_f1: 0.6490
 epoch: 92, train_loss: 0.5925, test_loss: 0.8841, test_f1: 0.6419
 epoch: 93, train_loss: 0.5992, test_loss: 0.8195, test_f1: 0.6570
 epoch: 94, train_loss: 0.6010, test_loss: 0.8740, test_f1: 0.6395
 epoch: 95, train_loss: 0.6129, test_loss: 0.8243, test_f1: 0.6498
 epoch: 96, train_loss: 0.6030, test_loss: 0.8928, test_f1: 0.6305
 epoch: 97, train_loss: 0.5927, test_loss: 0.8778, test_f1: 0.6599
 epoch: 98, train_loss: 0.5888, test_loss: 0.8829, test_f1: 0.6544
 epoch: 99, train_loss: 0.5952, test_loss: 0.8805, test_f1: 0.6388

Training completed in 815.66 seconds
Best F1: 0.6876 at epoch 67
Mean F1 across iterations: 0.6698  0.0121
========================FINAL RESULTS================================
FEGIN weighted F1: 0.6876  0.0121
python main.py --data ltspice_examples --representation component_pin --model FEGIN --layers 2 --hiddens 32 --batch_size 32 --lr 0.001 --emb_size 512 --epochs 100 --save_appendix component_pin_L2_H32_BS32_LR0.001_E512 --no_val
-----



STDERR:
  File "main.py", line 370, in <module>
    main()
  File "main.py", line 254, in main
    dataset = dataset_class(
  File "/home/philip/projects/ltspice_examples_code_repo/Circuit-Completion-Using-GNNs/component_classification_with_link_prediction_head/evaluation/FEGIN/kernel/circuit_datasets.py", line 15, in __init__
    self.data, self.slices = torch.load(self.processed_paths[0])
  File "/home/philip/.local/lib/python3.8/site-packages/torch/serialization.py", line 1040, in load
    warnings.warn(
  File "/usr/lib/python3.8/warnings.py", line 109, in _showwarnmsg
    sw(msg.message, msg.category, msg.filename, msg.lineno,
  File "main.py", line 47, in warn_with_traceback
    traceback.print_stack(file=log)
/home/philip/projects/ltspice_examples_code_repo/Circuit-Completion-Using-GNNs/component_classification_with_link_prediction_head/evaluation/FEGIN/kernel/circuit_datasets.py:15: FutureWarning: You are using `torch.load` with `weights_only=False` (the current default value), which uses the default pickle module implicitly. It is possible to construct malicious pickle data which will execute arbitrary code during unpickling (See https://github.com/pytorch/pytorch/blob/main/SECURITY.md#untrusted-models for more details). In a future release, the default value for `weights_only` will be flipped to `True`. This limits the functions that could be executed during unpickling. Arbitrary objects will no longer be allowed to be loaded via this mode unless they are explicitly allowlisted by the user via `torch.serialization.add_safe_globals`. We recommend you start setting `weights_only=True` for any use case where you don't have full control of the loaded file. Please open an issue on GitHub for any issues related to this experimental feature.
  self.data, self.slices = torch.load(self.processed_paths[0])
