STDOUT:
Results will be saved in /home/philip/projects/llm_inference_code_repo/Circuit-Completion-Using-GNNs/component_classification_with_link_prediction_head/evaluation/FEGIN/results/model_FEGIN_dataset_ltspice_examples
Command line input: python main.py --data ltspice_examples --representation component_pin_net --model FEGIN --layers 3 --hiddens 16 --batch_size 128 --lr 0.001 --emb_size 128 --epochs 100 --save_appendix component_pin_net_L3_H16_BS128_LR0.001_E128 --no_val
 is saved.
-----
ltspice_examples - FEGIN
Using 3 layers, 16 hidden units, h = 2
Loading component_pin_net representation dataset
ENTERED
Training FEGIN on component_pin_net representation
Train: 3558, Test: 846
##################ITERATION #0 ****************************************
 epoch: 0, train_loss: 1.3485, test_loss: 1.3482, test_f1: 0.2270
 epoch: 1, train_loss: 1.3243, test_loss: 1.3232, test_f1: 0.2270
 epoch: 2, train_loss: 1.2841, test_loss: 1.2446, test_f1: 0.3460
 epoch: 3, train_loss: 1.2105, test_loss: 1.1742, test_f1: 0.3431
 epoch: 4, train_loss: 1.1408, test_loss: 1.1186, test_f1: 0.3460
 epoch: 5, train_loss: 1.0977, test_loss: 1.1032, test_f1: 0.3428
 epoch: 6, train_loss: 1.0763, test_loss: 1.0857, test_f1: 0.3460
 epoch: 7, train_loss: 1.0689, test_loss: 1.1007, test_f1: 0.3548
 epoch: 8, train_loss: 1.0603, test_loss: 1.0881, test_f1: 0.3557
 epoch: 9, train_loss: 1.0511, test_loss: 1.1105, test_f1: 0.3411
 epoch: 10, train_loss: 1.0442, test_loss: 1.0856, test_f1: 0.3596
 epoch: 11, train_loss: 1.0406, test_loss: 1.0583, test_f1: 0.3556
 epoch: 12, train_loss: 1.0362, test_loss: 1.0731, test_f1: 0.3498
 epoch: 13, train_loss: 1.0318, test_loss: 1.0638, test_f1: 0.3808
 epoch: 14, train_loss: 1.0205, test_loss: 1.0470, test_f1: 0.4032
 epoch: 15, train_loss: 1.0155, test_loss: 1.0579, test_f1: 0.3884
 epoch: 16, train_loss: 1.0059, test_loss: 1.0396, test_f1: 0.4786
 epoch: 17, train_loss: 0.9968, test_loss: 1.0349, test_f1: 0.4638
 epoch: 18, train_loss: 0.9929, test_loss: 1.1701, test_f1: 0.3829
 epoch: 19, train_loss: 0.9779, test_loss: 1.0101, test_f1: 0.4740
 epoch: 20, train_loss: 0.9734, test_loss: 0.9878, test_f1: 0.5053
 epoch: 21, train_loss: 0.9765, test_loss: 1.0101, test_f1: 0.4699
 epoch: 22, train_loss: 0.9619, test_loss: 0.9845, test_f1: 0.4971
 epoch: 23, train_loss: 0.9594, test_loss: 0.9820, test_f1: 0.4906
 epoch: 24, train_loss: 0.9435, test_loss: 0.9730, test_f1: 0.4933
 epoch: 25, train_loss: 0.9421, test_loss: 0.9745, test_f1: 0.4798
 epoch: 26, train_loss: 0.9416, test_loss: 0.9614, test_f1: 0.4963
 epoch: 27, train_loss: 0.9325, test_loss: 0.9947, test_f1: 0.4778
 epoch: 28, train_loss: 0.9268, test_loss: 0.9408, test_f1: 0.4978
 epoch: 29, train_loss: 0.9280, test_loss: 0.9805, test_f1: 0.4762
 epoch: 30, train_loss: 0.9259, test_loss: 0.9726, test_f1: 0.4865
 epoch: 31, train_loss: 0.9239, test_loss: 0.9562, test_f1: 0.4904
 epoch: 32, train_loss: 0.9115, test_loss: 0.9456, test_f1: 0.4991
 epoch: 33, train_loss: 0.9076, test_loss: 0.9331, test_f1: 0.5008
 epoch: 34, train_loss: 0.9059, test_loss: 0.9587, test_f1: 0.5083
 epoch: 35, train_loss: 0.9117, test_loss: 0.9567, test_f1: 0.4927
 epoch: 36, train_loss: 0.9011, test_loss: 0.9582, test_f1: 0.5144
 epoch: 37, train_loss: 0.8979, test_loss: 0.9369, test_f1: 0.5106
 epoch: 38, train_loss: 0.8965, test_loss: 0.9207, test_f1: 0.5286
 epoch: 39, train_loss: 0.8954, test_loss: 0.9490, test_f1: 0.5085
 epoch: 40, train_loss: 0.8920, test_loss: 1.0005, test_f1: 0.4732
 epoch: 41, train_loss: 0.9038, test_loss: 0.9466, test_f1: 0.4988
 epoch: 42, train_loss: 0.8914, test_loss: 0.9485, test_f1: 0.5238
 epoch: 43, train_loss: 0.8750, test_loss: 0.9386, test_f1: 0.5176
 epoch: 44, train_loss: 0.8800, test_loss: 0.9342, test_f1: 0.5084
 epoch: 45, train_loss: 0.8667, test_loss: 0.9964, test_f1: 0.4983
 epoch: 46, train_loss: 0.8864, test_loss: 0.9780, test_f1: 0.5218
 epoch: 47, train_loss: 0.8785, test_loss: 0.9519, test_f1: 0.5002
 epoch: 48, train_loss: 0.8753, test_loss: 0.9309, test_f1: 0.5169
 epoch: 49, train_loss: 0.8627, test_loss: 1.0101, test_f1: 0.4717
 epoch: 50, train_loss: 0.8597, test_loss: 0.9347, test_f1: 0.5159
 epoch: 51, train_loss: 0.8620, test_loss: 0.9541, test_f1: 0.5089
 epoch: 52, train_loss: 0.8567, test_loss: 0.9371, test_f1: 0.5317
 epoch: 53, train_loss: 0.8542, test_loss: 0.9372, test_f1: 0.5110
 epoch: 54, train_loss: 0.8588, test_loss: 0.9229, test_f1: 0.5295
 epoch: 55, train_loss: 0.8450, test_loss: 0.9240, test_f1: 0.5192
 epoch: 56, train_loss: 0.8441, test_loss: 0.9383, test_f1: 0.5068
 epoch: 57, train_loss: 0.8557, test_loss: 0.9396, test_f1: 0.5200
 epoch: 58, train_loss: 0.8604, test_loss: 0.9178, test_f1: 0.5309
 epoch: 59, train_loss: 0.8518, test_loss: 0.9343, test_f1: 0.5282
 epoch: 60, train_loss: 0.8469, test_loss: 0.9231, test_f1: 0.5337
 epoch: 61, train_loss: 0.8431, test_loss: 0.9256, test_f1: 0.5235
 epoch: 62, train_loss: 0.8385, test_loss: 0.9128, test_f1: 0.5271
 epoch: 63, train_loss: 0.8440, test_loss: 0.9594, test_f1: 0.5115
 epoch: 64, train_loss: 0.8360, test_loss: 0.9428, test_f1: 0.5011
 epoch: 65, train_loss: 0.8343, test_loss: 0.9484, test_f1: 0.5356
 epoch: 66, train_loss: 0.8389, test_loss: 0.9304, test_f1: 0.5262
 epoch: 67, train_loss: 0.8437, test_loss: 0.9362, test_f1: 0.5279
 epoch: 68, train_loss: 0.8311, test_loss: 0.9098, test_f1: 0.5346
 epoch: 69, train_loss: 0.8256, test_loss: 0.9355, test_f1: 0.5196
 epoch: 70, train_loss: 0.8281, test_loss: 0.9271, test_f1: 0.5215
 epoch: 71, train_loss: 0.8329, test_loss: 0.9265, test_f1: 0.5301
 epoch: 72, train_loss: 0.8380, test_loss: 0.9472, test_f1: 0.5287
 epoch: 73, train_loss: 0.8220, test_loss: 0.9300, test_f1: 0.5401
 epoch: 74, train_loss: 0.8292, test_loss: 0.9222, test_f1: 0.5209
 epoch: 75, train_loss: 0.8413, test_loss: 0.9094, test_f1: 0.5266
 epoch: 76, train_loss: 0.8274, test_loss: 0.9211, test_f1: 0.5299
 epoch: 77, train_loss: 0.8285, test_loss: 0.9180, test_f1: 0.5226
 epoch: 78, train_loss: 0.8227, test_loss: 0.9311, test_f1: 0.5266
 epoch: 79, train_loss: 0.8295, test_loss: 0.9370, test_f1: 0.5159
 epoch: 80, train_loss: 0.8137, test_loss: 0.9188, test_f1: 0.5472
 epoch: 81, train_loss: 0.8184, test_loss: 0.9304, test_f1: 0.5333
 epoch: 82, train_loss: 0.8193, test_loss: 0.9151, test_f1: 0.5373
 epoch: 83, train_loss: 0.8217, test_loss: 0.9284, test_f1: 0.5373
 epoch: 84, train_loss: 0.8171, test_loss: 0.9507, test_f1: 0.5360
 epoch: 85, train_loss: 0.8131, test_loss: 0.9222, test_f1: 0.5279
 epoch: 86, train_loss: 0.8122, test_loss: 0.9263, test_f1: 0.5208
 epoch: 87, train_loss: 0.8169, test_loss: 0.9143, test_f1: 0.5339
 epoch: 88, train_loss: 0.8159, test_loss: 0.9166, test_f1: 0.5277
 epoch: 89, train_loss: 0.8120, test_loss: 0.9475, test_f1: 0.5198
 epoch: 90, train_loss: 0.8101, test_loss: 0.9191, test_f1: 0.5298
 epoch: 91, train_loss: 0.8121, test_loss: 0.9468, test_f1: 0.5329
 epoch: 92, train_loss: 0.8183, test_loss: 0.9282, test_f1: 0.5188
 epoch: 93, train_loss: 0.8120, test_loss: 0.9242, test_f1: 0.5228
 epoch: 94, train_loss: 0.8104, test_loss: 0.9136, test_f1: 0.5349
 epoch: 95, train_loss: 0.8071, test_loss: 0.9151, test_f1: 0.5356
 epoch: 96, train_loss: 0.8066, test_loss: 0.9422, test_f1: 0.5331
 epoch: 97, train_loss: 0.8113, test_loss: 0.9166, test_f1: 0.5311
 epoch: 98, train_loss: 0.8111, test_loss: 0.9241, test_f1: 0.5351
 epoch: 99, train_loss: 0.8012, test_loss: 0.9425, test_f1: 0.5249
##################ITERATION #1 ****************************************
 epoch: 0, train_loss: 1.2813, test_loss: 1.3097, test_f1: 0.2270
 epoch: 1, train_loss: 1.2276, test_loss: 1.2363, test_f1: 0.2270
 epoch: 2, train_loss: 1.1697, test_loss: 1.1452, test_f1: 0.3068
 epoch: 3, train_loss: 1.1215, test_loss: 1.0901, test_f1: 0.3343
 epoch: 4, train_loss: 1.0877, test_loss: 1.0740, test_f1: 0.3346
 epoch: 5, train_loss: 1.0677, test_loss: 1.0482, test_f1: 0.3503
 epoch: 6, train_loss: 1.0609, test_loss: 1.0611, test_f1: 0.3545
 epoch: 7, train_loss: 1.0460, test_loss: 1.0229, test_f1: 0.3856
 epoch: 8, train_loss: 1.0418, test_loss: 1.0599, test_f1: 0.3925
 epoch: 9, train_loss: 1.0251, test_loss: 1.0108, test_f1: 0.4422
 epoch: 10, train_loss: 1.0202, test_loss: 1.0247, test_f1: 0.4285
 epoch: 11, train_loss: 1.0134, test_loss: 0.9976, test_f1: 0.4835
 epoch: 12, train_loss: 1.0090, test_loss: 1.0044, test_f1: 0.4551
 epoch: 13, train_loss: 0.9912, test_loss: 0.9840, test_f1: 0.4796
 epoch: 14, train_loss: 0.9859, test_loss: 0.9656, test_f1: 0.4936
 epoch: 15, train_loss: 0.9834, test_loss: 0.9634, test_f1: 0.4854
 epoch: 16, train_loss: 0.9660, test_loss: 0.9746, test_f1: 0.5000
 epoch: 17, train_loss: 0.9580, test_loss: 0.9578, test_f1: 0.5192
 epoch: 18, train_loss: 0.9511, test_loss: 0.9421, test_f1: 0.5168
 epoch: 19, train_loss: 0.9535, test_loss: 0.9648, test_f1: 0.5050
 epoch: 20, train_loss: 0.9446, test_loss: 0.9713, test_f1: 0.4916
 epoch: 21, train_loss: 0.9409, test_loss: 0.9454, test_f1: 0.4960
 epoch: 22, train_loss: 0.9381, test_loss: 0.9284, test_f1: 0.5188
 epoch: 23, train_loss: 0.9313, test_loss: 0.9406, test_f1: 0.5173
 epoch: 24, train_loss: 0.9391, test_loss: 0.9361, test_f1: 0.4974
 epoch: 25, train_loss: 0.9274, test_loss: 0.9202, test_f1: 0.5144
 epoch: 26, train_loss: 0.9115, test_loss: 0.9239, test_f1: 0.5127
 epoch: 27, train_loss: 0.9108, test_loss: 0.9129, test_f1: 0.5168
 epoch: 28, train_loss: 0.9064, test_loss: 0.9317, test_f1: 0.5071
 epoch: 29, train_loss: 0.9054, test_loss: 0.9016, test_f1: 0.5181
 epoch: 30, train_loss: 0.9129, test_loss: 0.9144, test_f1: 0.5073
 epoch: 31, train_loss: 0.9003, test_loss: 0.8873, test_f1: 0.5128
 epoch: 32, train_loss: 0.8994, test_loss: 0.9059, test_f1: 0.5258
 epoch: 33, train_loss: 0.8999, test_loss: 0.9000, test_f1: 0.5284
 epoch: 34, train_loss: 0.9002, test_loss: 0.9060, test_f1: 0.5195
 epoch: 35, train_loss: 0.8918, test_loss: 0.9481, test_f1: 0.4897
 epoch: 36, train_loss: 0.9002, test_loss: 0.9111, test_f1: 0.5133
 epoch: 37, train_loss: 0.8854, test_loss: 0.9438, test_f1: 0.5148
 epoch: 38, train_loss: 0.8807, test_loss: 0.9179, test_f1: 0.5152
 epoch: 39, train_loss: 0.8780, test_loss: 0.9284, test_f1: 0.5274
 epoch: 40, train_loss: 0.8713, test_loss: 0.8901, test_f1: 0.5225
 epoch: 41, train_loss: 0.8757, test_loss: 0.9365, test_f1: 0.5012
 epoch: 42, train_loss: 0.8636, test_loss: 0.9491, test_f1: 0.5018
 epoch: 43, train_loss: 0.8711, test_loss: 0.9630, test_f1: 0.5131
 epoch: 44, train_loss: 0.8729, test_loss: 0.9204, test_f1: 0.5221
 epoch: 45, train_loss: 0.8627, test_loss: 0.9491, test_f1: 0.5098
 epoch: 46, train_loss: 0.8624, test_loss: 0.9288, test_f1: 0.5241
 epoch: 47, train_loss: 0.8638, test_loss: 0.9615, test_f1: 0.5413
 epoch: 48, train_loss: 0.8452, test_loss: 0.8835, test_f1: 0.5140
 epoch: 49, train_loss: 0.8467, test_loss: 0.9291, test_f1: 0.5329
 epoch: 50, train_loss: 0.8447, test_loss: 0.9084, test_f1: 0.5293
 epoch: 51, train_loss: 0.8477, test_loss: 0.8930, test_f1: 0.5209
 epoch: 52, train_loss: 0.8329, test_loss: 0.9180, test_f1: 0.5232
 epoch: 53, train_loss: 0.8303, test_loss: 0.8872, test_f1: 0.5382
 epoch: 54, train_loss: 0.8449, test_loss: 0.9015, test_f1: 0.5224
 epoch: 55, train_loss: 0.8301, test_loss: 0.8841, test_f1: 0.5298
 epoch: 56, train_loss: 0.8344, test_loss: 0.9160, test_f1: 0.5321
 epoch: 57, train_loss: 0.8217, test_loss: 0.8982, test_f1: 0.5308
 epoch: 58, train_loss: 0.8221, test_loss: 0.8803, test_f1: 0.5410
 epoch: 59, train_loss: 0.8209, test_loss: 0.9435, test_f1: 0.5234
 epoch: 60, train_loss: 0.8312, test_loss: 0.8902, test_f1: 0.5378
 epoch: 61, train_loss: 0.8293, test_loss: 0.8886, test_f1: 0.5492
 epoch: 62, train_loss: 0.8236, test_loss: 0.9236, test_f1: 0.5692
 epoch: 63, train_loss: 0.8191, test_loss: 0.9566, test_f1: 0.5435
 epoch: 64, train_loss: 0.8225, test_loss: 0.9447, test_f1: 0.5504
 epoch: 65, train_loss: 0.8277, test_loss: 0.9608, test_f1: 0.5309
 epoch: 66, train_loss: 0.8117, test_loss: 0.8950, test_f1: 0.5670
 epoch: 67, train_loss: 0.8173, test_loss: 0.9095, test_f1: 0.5531
 epoch: 68, train_loss: 0.8080, test_loss: 0.9120, test_f1: 0.5487
 epoch: 69, train_loss: 0.8019, test_loss: 0.9287, test_f1: 0.5643
 epoch: 70, train_loss: 0.8050, test_loss: 0.9075, test_f1: 0.5460
 epoch: 71, train_loss: 0.8116, test_loss: 0.9355, test_f1: 0.5519
 epoch: 72, train_loss: 0.8057, test_loss: 0.9321, test_f1: 0.5644
 epoch: 73, train_loss: 0.8041, test_loss: 0.9110, test_f1: 0.5605
 epoch: 74, train_loss: 0.7984, test_loss: 0.9068, test_f1: 0.5696
 epoch: 75, train_loss: 0.8059, test_loss: 0.9384, test_f1: 0.5684
 epoch: 76, train_loss: 0.8040, test_loss: 0.9375, test_f1: 0.5768
 epoch: 77, train_loss: 0.8046, test_loss: 0.9037, test_f1: 0.5722
 epoch: 78, train_loss: 0.7945, test_loss: 0.9237, test_f1: 0.5756
 epoch: 79, train_loss: 0.8108, test_loss: 0.9259, test_f1: 0.5719
 epoch: 80, train_loss: 0.7956, test_loss: 0.9471, test_f1: 0.5711
 epoch: 81, train_loss: 0.8028, test_loss: 0.9371, test_f1: 0.5710
 epoch: 82, train_loss: 0.7897, test_loss: 0.9229, test_f1: 0.5950
 epoch: 83, train_loss: 0.7913, test_loss: 0.9760, test_f1: 0.5537
 epoch: 84, train_loss: 0.7857, test_loss: 1.0114, test_f1: 0.5567
 epoch: 85, train_loss: 0.7892, test_loss: 0.9469, test_f1: 0.5726
 epoch: 86, train_loss: 0.7919, test_loss: 0.9484, test_f1: 0.5686
 epoch: 87, train_loss: 0.7911, test_loss: 0.8858, test_f1: 0.5788
 epoch: 88, train_loss: 0.7900, test_loss: 0.9715, test_f1: 0.5558
 epoch: 89, train_loss: 0.7793, test_loss: 0.9392, test_f1: 0.5726
 epoch: 90, train_loss: 0.7910, test_loss: 0.9535, test_f1: 0.5727
 epoch: 91, train_loss: 0.7769, test_loss: 0.9551, test_f1: 0.5807
 epoch: 92, train_loss: 0.7962, test_loss: 0.9862, test_f1: 0.5662
 epoch: 93, train_loss: 0.7923, test_loss: 0.9600, test_f1: 0.5870
 epoch: 94, train_loss: 0.7851, test_loss: 0.9595, test_f1: 0.5809
 epoch: 95, train_loss: 0.7812, test_loss: 0.9394, test_f1: 0.5884
 epoch: 96, train_loss: 0.7921, test_loss: 0.9339, test_f1: 0.5889
 epoch: 97, train_loss: 0.7683, test_loss: 0.9529, test_f1: 0.5755
 epoch: 98, train_loss: 0.7872, test_loss: 0.9063, test_f1: 0.5805
 epoch: 99, train_loss: 0.7825, test_loss: 0.9338, test_f1: 0.5898
##################ITERATION #2 ****************************************
 epoch: 0, train_loss: 1.2605, test_loss: 1.2840, test_f1: 0.2270
 epoch: 1, train_loss: 1.1769, test_loss: 1.1814, test_f1: 0.2549
 epoch: 2, train_loss: 1.1227, test_loss: 1.0734, test_f1: 0.3403
 epoch: 3, train_loss: 1.0801, test_loss: 1.0673, test_f1: 0.3471
 epoch: 4, train_loss: 1.0562, test_loss: 1.0588, test_f1: 0.3832
 epoch: 5, train_loss: 1.0476, test_loss: 1.0494, test_f1: 0.4098
 epoch: 6, train_loss: 1.0325, test_loss: 1.0376, test_f1: 0.4480
 epoch: 7, train_loss: 1.0070, test_loss: 1.0262, test_f1: 0.4319
 epoch: 8, train_loss: 1.0058, test_loss: 1.0012, test_f1: 0.4536
 epoch: 9, train_loss: 0.9894, test_loss: 0.9871, test_f1: 0.4871
 epoch: 10, train_loss: 0.9861, test_loss: 1.0262, test_f1: 0.4653
 epoch: 11, train_loss: 0.9737, test_loss: 0.9858, test_f1: 0.4730
 epoch: 12, train_loss: 0.9628, test_loss: 1.0062, test_f1: 0.4779
 epoch: 13, train_loss: 0.9716, test_loss: 0.9723, test_f1: 0.4922
 epoch: 14, train_loss: 0.9569, test_loss: 0.9761, test_f1: 0.4872
 epoch: 15, train_loss: 0.9485, test_loss: 0.9500, test_f1: 0.5058
 epoch: 16, train_loss: 0.9386, test_loss: 0.9133, test_f1: 0.5021
 epoch: 17, train_loss: 0.9301, test_loss: 0.9652, test_f1: 0.5033
 epoch: 18, train_loss: 0.9332, test_loss: 0.9694, test_f1: 0.5058
 epoch: 19, train_loss: 0.9199, test_loss: 0.9474, test_f1: 0.5206
 epoch: 20, train_loss: 0.9382, test_loss: 0.9065, test_f1: 0.5025
 epoch: 21, train_loss: 0.9148, test_loss: 0.8833, test_f1: 0.5117
 epoch: 22, train_loss: 0.9135, test_loss: 0.9326, test_f1: 0.5189
 epoch: 23, train_loss: 0.9023, test_loss: 0.9301, test_f1: 0.5356
 epoch: 24, train_loss: 0.9103, test_loss: 0.8887, test_f1: 0.5217
 epoch: 25, train_loss: 0.8954, test_loss: 0.9477, test_f1: 0.5268
 epoch: 26, train_loss: 0.9055, test_loss: 0.9775, test_f1: 0.5126
 epoch: 27, train_loss: 0.8893, test_loss: 0.9009, test_f1: 0.5077
 epoch: 28, train_loss: 0.8869, test_loss: 0.9573, test_f1: 0.5034
 epoch: 29, train_loss: 0.8879, test_loss: 0.9113, test_f1: 0.4984
 epoch: 30, train_loss: 0.8869, test_loss: 0.9520, test_f1: 0.5285
 epoch: 31, train_loss: 0.8808, test_loss: 0.9595, test_f1: 0.5118
 epoch: 32, train_loss: 0.8815, test_loss: 0.9580, test_f1: 0.5130
 epoch: 33, train_loss: 0.8719, test_loss: 0.9383, test_f1: 0.5097
 epoch: 34, train_loss: 0.8563, test_loss: 0.9477, test_f1: 0.5125
 epoch: 35, train_loss: 0.8728, test_loss: 0.9066, test_f1: 0.5278
 epoch: 36, train_loss: 0.8728, test_loss: 0.9009, test_f1: 0.5076
 epoch: 37, train_loss: 0.8653, test_loss: 0.8529, test_f1: 0.5244
 epoch: 38, train_loss: 0.8700, test_loss: 0.8665, test_f1: 0.5250
 epoch: 39, train_loss: 0.8647, test_loss: 0.9428, test_f1: 0.5276
 epoch: 40, train_loss: 0.8606, test_loss: 0.8774, test_f1: 0.5258
 epoch: 41, train_loss: 0.8611, test_loss: 0.8712, test_f1: 0.5181
 epoch: 42, train_loss: 0.8486, test_loss: 0.9025, test_f1: 0.5050
 epoch: 43, train_loss: 0.8500, test_loss: 0.8557, test_f1: 0.5115
 epoch: 44, train_loss: 0.8496, test_loss: 0.8589, test_f1: 0.5203
 epoch: 45, train_loss: 0.8420, test_loss: 0.9148, test_f1: 0.5168
 epoch: 46, train_loss: 0.8422, test_loss: 0.8607, test_f1: 0.5209
 epoch: 47, train_loss: 0.8390, test_loss: 0.9340, test_f1: 0.5325
 epoch: 48, train_loss: 0.8364, test_loss: 0.8955, test_f1: 0.4986
 epoch: 49, train_loss: 0.8273, test_loss: 0.8592, test_f1: 0.5369
 epoch: 50, train_loss: 0.8371, test_loss: 0.9014, test_f1: 0.5295
 epoch: 51, train_loss: 0.8174, test_loss: 0.8804, test_f1: 0.5175
 epoch: 52, train_loss: 0.8233, test_loss: 0.8320, test_f1: 0.5377
 epoch: 53, train_loss: 0.8076, test_loss: 0.8197, test_f1: 0.5444
 epoch: 54, train_loss: 0.8039, test_loss: 0.8651, test_f1: 0.5317
 epoch: 55, train_loss: 0.8136, test_loss: 0.8758, test_f1: 0.5191
 epoch: 56, train_loss: 0.8079, test_loss: 0.8903, test_f1: 0.5399
 epoch: 57, train_loss: 0.8089, test_loss: 0.8829, test_f1: 0.5174
 epoch: 58, train_loss: 0.7973, test_loss: 0.8654, test_f1: 0.5357
 epoch: 59, train_loss: 0.8045, test_loss: 0.8942, test_f1: 0.5353
 epoch: 60, train_loss: 0.7972, test_loss: 0.8417, test_f1: 0.5258
 epoch: 61, train_loss: 0.7911, test_loss: 0.8529, test_f1: 0.5340
 epoch: 62, train_loss: 0.7964, test_loss: 0.8518, test_f1: 0.5245
 epoch: 63, train_loss: 0.7948, test_loss: 0.8639, test_f1: 0.5215
 epoch: 64, train_loss: 0.7856, test_loss: 0.8741, test_f1: 0.5337
 epoch: 65, train_loss: 0.7951, test_loss: 0.8299, test_f1: 0.5293
 epoch: 66, train_loss: 0.8011, test_loss: 0.8897, test_f1: 0.5280
 epoch: 67, train_loss: 0.7841, test_loss: 0.8769, test_f1: 0.5381
 epoch: 68, train_loss: 0.7905, test_loss: 0.8285, test_f1: 0.5235
 epoch: 69, train_loss: 0.7923, test_loss: 0.8689, test_f1: 0.5298
 epoch: 70, train_loss: 0.7844, test_loss: 0.8369, test_f1: 0.5325
 epoch: 71, train_loss: 0.7808, test_loss: 0.8900, test_f1: 0.5271
 epoch: 72, train_loss: 0.7879, test_loss: 0.8595, test_f1: 0.5305
 epoch: 73, train_loss: 0.7857, test_loss: 0.8706, test_f1: 0.5295
 epoch: 74, train_loss: 0.7908, test_loss: 0.8430, test_f1: 0.5235
 epoch: 75, train_loss: 0.7759, test_loss: 0.9218, test_f1: 0.5362
 epoch: 76, train_loss: 0.7839, test_loss: 0.8314, test_f1: 0.5435
 epoch: 77, train_loss: 0.7818, test_loss: 0.8597, test_f1: 0.5317
 epoch: 78, train_loss: 0.7762, test_loss: 0.8260, test_f1: 0.5485
 epoch: 79, train_loss: 0.7812, test_loss: 0.8458, test_f1: 0.5300
 epoch: 80, train_loss: 0.7773, test_loss: 0.8701, test_f1: 0.5292
 epoch: 81, train_loss: 0.7807, test_loss: 0.8208, test_f1: 0.5403
 epoch: 82, train_loss: 0.7696, test_loss: 0.8644, test_f1: 0.5295
 epoch: 83, train_loss: 0.7785, test_loss: 0.8512, test_f1: 0.5286
 epoch: 84, train_loss: 0.7824, test_loss: 0.8627, test_f1: 0.5282
 epoch: 85, train_loss: 0.7770, test_loss: 0.8318, test_f1: 0.5635
 epoch: 86, train_loss: 0.7550, test_loss: 0.8707, test_f1: 0.5537
 epoch: 87, train_loss: 0.7586, test_loss: 0.8247, test_f1: 0.5625
 epoch: 88, train_loss: 0.7582, test_loss: 0.8525, test_f1: 0.5499
 epoch: 89, train_loss: 0.7625, test_loss: 0.8679, test_f1: 0.5577
 epoch: 90, train_loss: 0.7549, test_loss: 0.8934, test_f1: 0.5355
 epoch: 91, train_loss: 0.7571, test_loss: 0.8932, test_f1: 0.5632
 epoch: 92, train_loss: 0.7577, test_loss: 0.8826, test_f1: 0.5289
 epoch: 93, train_loss: 0.7664, test_loss: 0.8708, test_f1: 0.5600
 epoch: 94, train_loss: 0.7533, test_loss: 0.8206, test_f1: 0.5447
 epoch: 95, train_loss: 0.7470, test_loss: 0.8676, test_f1: 0.5395
 epoch: 96, train_loss: 0.7445, test_loss: 0.8425, test_f1: 0.5532
 epoch: 97, train_loss: 0.7466, test_loss: 0.8638, test_f1: 0.5472
 epoch: 98, train_loss: 0.7564, test_loss: 0.9112, test_f1: 0.4992
 epoch: 99, train_loss: 0.7540, test_loss: 0.8323, test_f1: 0.5453
##################ITERATION #3 ****************************************
 epoch: 0, train_loss: 1.2280, test_loss: 1.3436, test_f1: 0.2270
 epoch: 1, train_loss: 1.1010, test_loss: 1.0970, test_f1: 0.3469
 epoch: 2, train_loss: 1.0616, test_loss: 1.0412, test_f1: 0.4374
 epoch: 3, train_loss: 1.0337, test_loss: 1.0239, test_f1: 0.4663
 epoch: 4, train_loss: 1.0178, test_loss: 1.0047, test_f1: 0.4647
 epoch: 5, train_loss: 0.9952, test_loss: 0.9916, test_f1: 0.4837
 epoch: 6, train_loss: 0.9856, test_loss: 0.9908, test_f1: 0.4924
 epoch: 7, train_loss: 0.9711, test_loss: 0.9912, test_f1: 0.4756
 epoch: 8, train_loss: 0.9675, test_loss: 0.9814, test_f1: 0.4816
 epoch: 9, train_loss: 0.9638, test_loss: 0.9822, test_f1: 0.4881
 epoch: 10, train_loss: 0.9397, test_loss: 0.9504, test_f1: 0.4908
 epoch: 11, train_loss: 0.9358, test_loss: 0.9816, test_f1: 0.5056
 epoch: 12, train_loss: 0.9275, test_loss: 0.9433, test_f1: 0.5140
 epoch: 13, train_loss: 0.9283, test_loss: 0.9368, test_f1: 0.5030
 epoch: 14, train_loss: 0.9110, test_loss: 0.9381, test_f1: 0.5047
 epoch: 15, train_loss: 0.9023, test_loss: 0.9682, test_f1: 0.4997
 epoch: 16, train_loss: 0.9031, test_loss: 0.9483, test_f1: 0.5035
 epoch: 17, train_loss: 0.8894, test_loss: 0.9265, test_f1: 0.5051
 epoch: 18, train_loss: 0.8859, test_loss: 0.9282, test_f1: 0.5367
 epoch: 19, train_loss: 0.8842, test_loss: 0.9389, test_f1: 0.5295
 epoch: 20, train_loss: 0.8959, test_loss: 0.9844, test_f1: 0.5164
 epoch: 21, train_loss: 0.8749, test_loss: 0.9289, test_f1: 0.5164
 epoch: 22, train_loss: 0.8795, test_loss: 0.8974, test_f1: 0.5453
 epoch: 23, train_loss: 0.8714, test_loss: 0.9132, test_f1: 0.5208
 epoch: 24, train_loss: 0.8631, test_loss: 0.9101, test_f1: 0.5352
 epoch: 25, train_loss: 0.8665, test_loss: 0.8843, test_f1: 0.5357
 epoch: 26, train_loss: 0.8502, test_loss: 0.9469, test_f1: 0.5075
 epoch: 27, train_loss: 0.8585, test_loss: 0.9119, test_f1: 0.5377
 epoch: 28, train_loss: 0.8481, test_loss: 0.9919, test_f1: 0.4997
 epoch: 29, train_loss: 0.8428, test_loss: 0.9023, test_f1: 0.5152
 epoch: 30, train_loss: 0.8440, test_loss: 0.9338, test_f1: 0.5057
 epoch: 31, train_loss: 0.8429, test_loss: 0.8978, test_f1: 0.5542
 epoch: 32, train_loss: 0.8293, test_loss: 0.8918, test_f1: 0.5483
 epoch: 33, train_loss: 0.8258, test_loss: 0.9132, test_f1: 0.5163
 epoch: 34, train_loss: 0.8241, test_loss: 0.8718, test_f1: 0.5604
 epoch: 35, train_loss: 0.8208, test_loss: 0.8593, test_f1: 0.5422
 epoch: 36, train_loss: 0.8222, test_loss: 0.9317, test_f1: 0.5203
 epoch: 37, train_loss: 0.8148, test_loss: 0.8678, test_f1: 0.5554
 epoch: 38, train_loss: 0.8083, test_loss: 0.8762, test_f1: 0.5575
 epoch: 39, train_loss: 0.8234, test_loss: 0.9094, test_f1: 0.5561
 epoch: 40, train_loss: 0.8186, test_loss: 0.9522, test_f1: 0.5403
 epoch: 41, train_loss: 0.8134, test_loss: 0.9061, test_f1: 0.5453
 epoch: 42, train_loss: 0.8043, test_loss: 0.8869, test_f1: 0.5473
 epoch: 43, train_loss: 0.8036, test_loss: 0.8401, test_f1: 0.5837
 epoch: 44, train_loss: 0.8047, test_loss: 0.8825, test_f1: 0.5454
 epoch: 45, train_loss: 0.8023, test_loss: 0.9027, test_f1: 0.5234
 epoch: 46, train_loss: 0.7950, test_loss: 0.9296, test_f1: 0.5613
 epoch: 47, train_loss: 0.7947, test_loss: 0.8647, test_f1: 0.5890
 epoch: 48, train_loss: 0.7897, test_loss: 0.8800, test_f1: 0.5570
 epoch: 49, train_loss: 0.7855, test_loss: 0.8545, test_f1: 0.5612
 epoch: 50, train_loss: 0.7845, test_loss: 0.8338, test_f1: 0.5507
 epoch: 51, train_loss: 0.7816, test_loss: 0.8427, test_f1: 0.5672
 epoch: 52, train_loss: 0.7725, test_loss: 0.8344, test_f1: 0.5797
 epoch: 53, train_loss: 0.7642, test_loss: 0.8391, test_f1: 0.5501
 epoch: 54, train_loss: 0.7734, test_loss: 0.8389, test_f1: 0.5776
 epoch: 55, train_loss: 0.7681, test_loss: 0.8375, test_f1: 0.5488
 epoch: 56, train_loss: 0.7588, test_loss: 0.8456, test_f1: 0.5689
 epoch: 57, train_loss: 0.7650, test_loss: 0.8769, test_f1: 0.5569
 epoch: 58, train_loss: 0.7603, test_loss: 0.8152, test_f1: 0.5651
 epoch: 59, train_loss: 0.7604, test_loss: 0.8275, test_f1: 0.5617
 epoch: 60, train_loss: 0.7648, test_loss: 0.8043, test_f1: 0.5662
 epoch: 61, train_loss: 0.7539, test_loss: 0.8596, test_f1: 0.5540
 epoch: 62, train_loss: 0.7482, test_loss: 0.8768, test_f1: 0.5529
 epoch: 63, train_loss: 0.7697, test_loss: 0.8190, test_f1: 0.5436
 epoch: 64, train_loss: 0.7577, test_loss: 0.8684, test_f1: 0.5335
 epoch: 65, train_loss: 0.7468, test_loss: 0.8979, test_f1: 0.5410
 epoch: 66, train_loss: 0.7554, test_loss: 0.8281, test_f1: 0.5630
 epoch: 67, train_loss: 0.7545, test_loss: 0.8493, test_f1: 0.5463
 epoch: 68, train_loss: 0.7506, test_loss: 0.8417, test_f1: 0.5724
 epoch: 69, train_loss: 0.7482, test_loss: 0.8338, test_f1: 0.5637
 epoch: 70, train_loss: 0.7596, test_loss: 0.8555, test_f1: 0.5338
 epoch: 71, train_loss: 0.7526, test_loss: 0.8248, test_f1: 0.5508
 epoch: 72, train_loss: 0.7485, test_loss: 0.8564, test_f1: 0.5571
 epoch: 73, train_loss: 0.7508, test_loss: 0.8427, test_f1: 0.5598
 epoch: 74, train_loss: 0.7454, test_loss: 0.8388, test_f1: 0.5834
 epoch: 75, train_loss: 0.7487, test_loss: 0.8404, test_f1: 0.5598
 epoch: 76, train_loss: 0.7342, test_loss: 0.8432, test_f1: 0.5803
 epoch: 77, train_loss: 0.7452, test_loss: 0.8349, test_f1: 0.5685
 epoch: 78, train_loss: 0.7432, test_loss: 0.8253, test_f1: 0.5750
 epoch: 79, train_loss: 0.7362, test_loss: 0.8788, test_f1: 0.5644
 epoch: 80, train_loss: 0.7310, test_loss: 0.8477, test_f1: 0.5739
 epoch: 81, train_loss: 0.7359, test_loss: 0.8433, test_f1: 0.5701
 epoch: 82, train_loss: 0.7452, test_loss: 0.8355, test_f1: 0.5613
 epoch: 83, train_loss: 0.7372, test_loss: 0.8343, test_f1: 0.5697
 epoch: 84, train_loss: 0.7380, test_loss: 0.8584, test_f1: 0.5715
 epoch: 85, train_loss: 0.7318, test_loss: 0.8624, test_f1: 0.5672
 epoch: 86, train_loss: 0.7356, test_loss: 0.8544, test_f1: 0.5612
 epoch: 87, train_loss: 0.7373, test_loss: 0.8405, test_f1: 0.5699
 epoch: 88, train_loss: 0.7316, test_loss: 0.8236, test_f1: 0.5720
 epoch: 89, train_loss: 0.7375, test_loss: 0.8479, test_f1: 0.5563
 epoch: 90, train_loss: 0.7278, test_loss: 0.8540, test_f1: 0.5641
 epoch: 91, train_loss: 0.7437, test_loss: 0.8522, test_f1: 0.5486
 epoch: 92, train_loss: 0.7345, test_loss: 0.8384, test_f1: 0.5680
 epoch: 93, train_loss: 0.7213, test_loss: 0.8380, test_f1: 0.5823
 epoch: 94, train_loss: 0.7273, test_loss: 0.8239, test_f1: 0.5837
 epoch: 95, train_loss: 0.7177, test_loss: 0.8652, test_f1: 0.5759
 epoch: 96, train_loss: 0.7309, test_loss: 0.8398, test_f1: 0.5779
 epoch: 97, train_loss: 0.7205, test_loss: 0.8690, test_f1: 0.5617
 epoch: 98, train_loss: 0.7288, test_loss: 0.8738, test_f1: 0.5586
 epoch: 99, train_loss: 0.7261, test_loss: 0.8473, test_f1: 0.5867
##################ITERATION #4 ****************************************
 epoch: 0, train_loss: 1.2563, test_loss: 1.3331, test_f1: 0.2270
 epoch: 1, train_loss: 1.1325, test_loss: 1.1736, test_f1: 0.2818
 epoch: 2, train_loss: 1.0987, test_loss: 1.0453, test_f1: 0.4104
 epoch: 3, train_loss: 1.0723, test_loss: 1.0231, test_f1: 0.4137
 epoch: 4, train_loss: 1.0496, test_loss: 1.0077, test_f1: 0.4481
 epoch: 5, train_loss: 1.0202, test_loss: 1.0128, test_f1: 0.4916
 epoch: 6, train_loss: 1.0121, test_loss: 0.9860, test_f1: 0.4456
 epoch: 7, train_loss: 1.0043, test_loss: 0.9785, test_f1: 0.4883
 epoch: 8, train_loss: 0.9918, test_loss: 0.9657, test_f1: 0.4778
 epoch: 9, train_loss: 0.9843, test_loss: 0.9684, test_f1: 0.4758
 epoch: 10, train_loss: 0.9738, test_loss: 0.9592, test_f1: 0.4916
 epoch: 11, train_loss: 0.9675, test_loss: 0.9437, test_f1: 0.4844
 epoch: 12, train_loss: 0.9553, test_loss: 0.9515, test_f1: 0.4927
 epoch: 13, train_loss: 0.9448, test_loss: 0.9299, test_f1: 0.4933
 epoch: 14, train_loss: 0.9542, test_loss: 0.9326, test_f1: 0.4898
 epoch: 15, train_loss: 0.9490, test_loss: 0.9450, test_f1: 0.5172
 epoch: 16, train_loss: 0.9438, test_loss: 0.9418, test_f1: 0.5275
 epoch: 17, train_loss: 0.9428, test_loss: 0.9215, test_f1: 0.5143
 epoch: 18, train_loss: 0.9316, test_loss: 0.9245, test_f1: 0.5004
 epoch: 19, train_loss: 0.9384, test_loss: 0.9063, test_f1: 0.5161
 epoch: 20, train_loss: 0.9225, test_loss: 0.9144, test_f1: 0.5347
 epoch: 21, train_loss: 0.9204, test_loss: 0.9021, test_f1: 0.5197
 epoch: 22, train_loss: 0.9088, test_loss: 0.9114, test_f1: 0.5171
 epoch: 23, train_loss: 0.9173, test_loss: 0.9201, test_f1: 0.5140
 epoch: 24, train_loss: 0.9276, test_loss: 0.8955, test_f1: 0.5062
 epoch: 25, train_loss: 0.9155, test_loss: 0.9340, test_f1: 0.5228
 epoch: 26, train_loss: 0.9128, test_loss: 0.8789, test_f1: 0.5226
 epoch: 27, train_loss: 0.9064, test_loss: 0.9110, test_f1: 0.5085
 epoch: 28, train_loss: 0.9159, test_loss: 0.9031, test_f1: 0.5080
 epoch: 29, train_loss: 0.9181, test_loss: 0.8888, test_f1: 0.5249
 epoch: 30, train_loss: 0.9120, test_loss: 0.8857, test_f1: 0.5183
 epoch: 31, train_loss: 0.8950, test_loss: 0.9000, test_f1: 0.5210
 epoch: 32, train_loss: 0.9038, test_loss: 0.9027, test_f1: 0.5281
 epoch: 33, train_loss: 0.9003, test_loss: 0.8995, test_f1: 0.5105
 epoch: 34, train_loss: 0.8918, test_loss: 0.8803, test_f1: 0.5211
 epoch: 35, train_loss: 0.8879, test_loss: 0.8745, test_f1: 0.5395
 epoch: 36, train_loss: 0.8870, test_loss: 0.8746, test_f1: 0.5151
 epoch: 37, train_loss: 0.8921, test_loss: 0.8638, test_f1: 0.5220
 epoch: 38, train_loss: 0.8883, test_loss: 0.8983, test_f1: 0.5192
 epoch: 39, train_loss: 0.8851, test_loss: 0.8628, test_f1: 0.5296
 epoch: 40, train_loss: 0.8841, test_loss: 0.8836, test_f1: 0.5282
 epoch: 41, train_loss: 0.8726, test_loss: 0.8684, test_f1: 0.5479
 epoch: 42, train_loss: 0.8838, test_loss: 0.8547, test_f1: 0.5254
 epoch: 43, train_loss: 0.8727, test_loss: 0.8500, test_f1: 0.5418
 epoch: 44, train_loss: 0.8730, test_loss: 0.8968, test_f1: 0.5156
 epoch: 45, train_loss: 0.8596, test_loss: 0.8582, test_f1: 0.5388
 epoch: 46, train_loss: 0.8595, test_loss: 0.8411, test_f1: 0.5363
 epoch: 47, train_loss: 0.8665, test_loss: 0.8754, test_f1: 0.5319
 epoch: 48, train_loss: 0.8578, test_loss: 0.8718, test_f1: 0.5215
 epoch: 49, train_loss: 0.8594, test_loss: 0.8469, test_f1: 0.5320
 epoch: 50, train_loss: 0.8590, test_loss: 0.8391, test_f1: 0.5460
 epoch: 51, train_loss: 0.8456, test_loss: 0.8333, test_f1: 0.5374
 epoch: 52, train_loss: 0.8496, test_loss: 0.8435, test_f1: 0.5404
 epoch: 53, train_loss: 0.8456, test_loss: 0.8415, test_f1: 0.5328
 epoch: 54, train_loss: 0.8339, test_loss: 0.8312, test_f1: 0.5407
 epoch: 55, train_loss: 0.8427, test_loss: 0.8412, test_f1: 0.5478
 epoch: 56, train_loss: 0.8407, test_loss: 0.8406, test_f1: 0.5368
 epoch: 57, train_loss: 0.8433, test_loss: 0.8365, test_f1: 0.5357
 epoch: 58, train_loss: 0.8374, test_loss: 0.8284, test_f1: 0.5414
 epoch: 59, train_loss: 0.8244, test_loss: 0.8257, test_f1: 0.5428
 epoch: 60, train_loss: 0.8304, test_loss: 0.8342, test_f1: 0.5409
 epoch: 61, train_loss: 0.8296, test_loss: 0.8565, test_f1: 0.5395
 epoch: 62, train_loss: 0.8326, test_loss: 0.8325, test_f1: 0.5409
 epoch: 63, train_loss: 0.8403, test_loss: 0.8039, test_f1: 0.5396
 epoch: 64, train_loss: 0.8289, test_loss: 0.8379, test_f1: 0.5488
 epoch: 65, train_loss: 0.8226, test_loss: 0.8202, test_f1: 0.5397
 epoch: 66, train_loss: 0.8339, test_loss: 0.8318, test_f1: 0.5572
 epoch: 67, train_loss: 0.8299, test_loss: 0.8343, test_f1: 0.5460
 epoch: 68, train_loss: 0.8199, test_loss: 0.8261, test_f1: 0.5437
 epoch: 69, train_loss: 0.8144, test_loss: 0.8202, test_f1: 0.5420
 epoch: 70, train_loss: 0.8139, test_loss: 0.8174, test_f1: 0.5415
 epoch: 71, train_loss: 0.8249, test_loss: 0.8154, test_f1: 0.5456
 epoch: 72, train_loss: 0.8214, test_loss: 0.8189, test_f1: 0.5314
 epoch: 73, train_loss: 0.8212, test_loss: 0.8378, test_f1: 0.5500
 epoch: 74, train_loss: 0.8193, test_loss: 0.8122, test_f1: 0.5344
 epoch: 75, train_loss: 0.8175, test_loss: 0.8341, test_f1: 0.5385
 epoch: 76, train_loss: 0.8107, test_loss: 0.8339, test_f1: 0.5465
 epoch: 77, train_loss: 0.8229, test_loss: 0.8384, test_f1: 0.5343
 epoch: 78, train_loss: 0.8193, test_loss: 0.8344, test_f1: 0.5435
 epoch: 79, train_loss: 0.8207, test_loss: 0.8174, test_f1: 0.5386
 epoch: 80, train_loss: 0.8116, test_loss: 0.8366, test_f1: 0.5397
 epoch: 81, train_loss: 0.8143, test_loss: 0.8263, test_f1: 0.5463
 epoch: 82, train_loss: 0.8027, test_loss: 0.8119, test_f1: 0.5423
 epoch: 83, train_loss: 0.8151, test_loss: 0.8475, test_f1: 0.5453
 epoch: 84, train_loss: 0.8091, test_loss: 0.8144, test_f1: 0.5432
 epoch: 85, train_loss: 0.8062, test_loss: 0.8335, test_f1: 0.5392
 epoch: 86, train_loss: 0.8037, test_loss: 0.8437, test_f1: 0.5473
 epoch: 87, train_loss: 0.8032, test_loss: 0.8099, test_f1: 0.5528
 epoch: 88, train_loss: 0.8110, test_loss: 0.7962, test_f1: 0.5461
 epoch: 89, train_loss: 0.7988, test_loss: 0.8204, test_f1: 0.5388
 epoch: 90, train_loss: 0.8007, test_loss: 0.8128, test_f1: 0.5392
 epoch: 91, train_loss: 0.7932, test_loss: 0.8142, test_f1: 0.5412
 epoch: 92, train_loss: 0.8013, test_loss: 0.8204, test_f1: 0.5368
 epoch: 93, train_loss: 0.7900, test_loss: 0.8129, test_f1: 0.5429
 epoch: 94, train_loss: 0.8007, test_loss: 0.8171, test_f1: 0.5553
 epoch: 95, train_loss: 0.7950, test_loss: 0.8317, test_f1: 0.5596
 epoch: 96, train_loss: 0.7926, test_loss: 0.8081, test_f1: 0.5483
 epoch: 97, train_loss: 0.7900, test_loss: 0.8342, test_f1: 0.5483
 epoch: 98, train_loss: 0.8059, test_loss: 0.8302, test_f1: 0.5466
 epoch: 99, train_loss: 0.7751, test_loss: 0.8248, test_f1: 0.5518
##################ITERATION #5 ****************************************
 epoch: 0, train_loss: 1.3062, test_loss: 1.3484, test_f1: 0.2270
 epoch: 1, train_loss: 1.1196, test_loss: 1.1296, test_f1: 0.3429
 epoch: 2, train_loss: 1.0753, test_loss: 1.0691, test_f1: 0.3830
 epoch: 3, train_loss: 1.0562, test_loss: 1.0396, test_f1: 0.4221
 epoch: 4, train_loss: 1.0436, test_loss: 1.0347, test_f1: 0.4343
 epoch: 5, train_loss: 1.0324, test_loss: 1.0314, test_f1: 0.4410
 epoch: 6, train_loss: 1.0126, test_loss: 1.0322, test_f1: 0.4182
 epoch: 7, train_loss: 0.9997, test_loss: 1.0059, test_f1: 0.4702
 epoch: 8, train_loss: 0.9967, test_loss: 0.9874, test_f1: 0.4579
 epoch: 9, train_loss: 0.9965, test_loss: 0.9607, test_f1: 0.4976
 epoch: 10, train_loss: 0.9870, test_loss: 0.9948, test_f1: 0.4650
 epoch: 11, train_loss: 0.9697, test_loss: 0.9524, test_f1: 0.4918
 epoch: 12, train_loss: 0.9647, test_loss: 0.9840, test_f1: 0.4620
 epoch: 13, train_loss: 0.9584, test_loss: 0.9682, test_f1: 0.5013
 epoch: 14, train_loss: 0.9436, test_loss: 0.9448, test_f1: 0.4939
 epoch: 15, train_loss: 0.9473, test_loss: 0.9362, test_f1: 0.4854
 epoch: 16, train_loss: 0.9350, test_loss: 0.9325, test_f1: 0.5036
 epoch: 17, train_loss: 0.9334, test_loss: 0.9568, test_f1: 0.4924
 epoch: 18, train_loss: 0.9360, test_loss: 0.9395, test_f1: 0.5026
 epoch: 19, train_loss: 0.9317, test_loss: 0.9382, test_f1: 0.5096
 epoch: 20, train_loss: 0.9185, test_loss: 0.9465, test_f1: 0.4858
 epoch: 21, train_loss: 0.9199, test_loss: 1.0058, test_f1: 0.4883
 epoch: 22, train_loss: 0.9095, test_loss: 1.0243, test_f1: 0.4823
 epoch: 23, train_loss: 0.9106, test_loss: 0.9468, test_f1: 0.4969
 epoch: 24, train_loss: 0.9023, test_loss: 0.9268, test_f1: 0.5129
 epoch: 25, train_loss: 0.9163, test_loss: 0.9531, test_f1: 0.4877
 epoch: 26, train_loss: 0.8990, test_loss: 0.9116, test_f1: 0.5182
 epoch: 27, train_loss: 0.9006, test_loss: 0.9513, test_f1: 0.4903
 epoch: 28, train_loss: 0.8967, test_loss: 0.9175, test_f1: 0.5193
 epoch: 29, train_loss: 0.8944, test_loss: 0.9170, test_f1: 0.5165
 epoch: 30, train_loss: 0.8920, test_loss: 0.9004, test_f1: 0.5222
 epoch: 31, train_loss: 0.8873, test_loss: 0.9594, test_f1: 0.5130
 epoch: 32, train_loss: 0.8796, test_loss: 0.9123, test_f1: 0.5229
 epoch: 33, train_loss: 0.8740, test_loss: 0.9657, test_f1: 0.4961
 epoch: 34, train_loss: 0.8813, test_loss: 0.9291, test_f1: 0.5196
 epoch: 35, train_loss: 0.8728, test_loss: 0.9747, test_f1: 0.4968
 epoch: 36, train_loss: 0.8676, test_loss: 0.9189, test_f1: 0.4968
 epoch: 37, train_loss: 0.8720, test_loss: 1.0147, test_f1: 0.4847
 epoch: 38, train_loss: 0.8670, test_loss: 0.9310, test_f1: 0.5202
 epoch: 39, train_loss: 0.8599, test_loss: 0.8924, test_f1: 0.5311
 epoch: 40, train_loss: 0.8523, test_loss: 0.9312, test_f1: 0.5205
 epoch: 41, train_loss: 0.8616, test_loss: 0.9178, test_f1: 0.5186
 epoch: 42, train_loss: 0.8534, test_loss: 0.9437, test_f1: 0.5136
 epoch: 43, train_loss: 0.8625, test_loss: 0.8608, test_f1: 0.5447
 epoch: 44, train_loss: 0.8603, test_loss: 0.9317, test_f1: 0.5320
 epoch: 45, train_loss: 0.8483, test_loss: 0.8673, test_f1: 0.5447
 epoch: 46, train_loss: 0.8430, test_loss: 0.9074, test_f1: 0.5223
 epoch: 47, train_loss: 0.8322, test_loss: 0.9541, test_f1: 0.5196
 epoch: 48, train_loss: 0.8401, test_loss: 0.8598, test_f1: 0.5344
 epoch: 49, train_loss: 0.8519, test_loss: 1.1328, test_f1: 0.4859
 epoch: 50, train_loss: 0.8369, test_loss: 0.8642, test_f1: 0.5349
 epoch: 51, train_loss: 0.8310, test_loss: 0.9124, test_f1: 0.5360
 epoch: 52, train_loss: 0.8323, test_loss: 0.8956, test_f1: 0.5252
 epoch: 53, train_loss: 0.8167, test_loss: 0.9033, test_f1: 0.5300
 epoch: 54, train_loss: 0.8217, test_loss: 0.8926, test_f1: 0.5268
 epoch: 55, train_loss: 0.8239, test_loss: 0.9189, test_f1: 0.5258
 epoch: 56, train_loss: 0.8197, test_loss: 0.9147, test_f1: 0.5387
 epoch: 57, train_loss: 0.8222, test_loss: 0.9361, test_f1: 0.5250
 epoch: 58, train_loss: 0.8146, test_loss: 0.8790, test_f1: 0.5287
 epoch: 59, train_loss: 0.8172, test_loss: 0.8683, test_f1: 0.5496
 epoch: 60, train_loss: 0.8128, test_loss: 0.9258, test_f1: 0.5429
 epoch: 61, train_loss: 0.8167, test_loss: 0.9480, test_f1: 0.5229
 epoch: 62, train_loss: 0.8086, test_loss: 0.9170, test_f1: 0.5370
 epoch: 63, train_loss: 0.8097, test_loss: 0.9007, test_f1: 0.5331
 epoch: 64, train_loss: 0.8042, test_loss: 0.9356, test_f1: 0.5374
 epoch: 65, train_loss: 0.8003, test_loss: 0.9453, test_f1: 0.5321
 epoch: 66, train_loss: 0.8095, test_loss: 0.9754, test_f1: 0.5257
 epoch: 67, train_loss: 0.8058, test_loss: 0.9279, test_f1: 0.5401
 epoch: 68, train_loss: 0.8148, test_loss: 0.9152, test_f1: 0.5352
 epoch: 69, train_loss: 0.7990, test_loss: 0.9147, test_f1: 0.5341
 epoch: 70, train_loss: 0.8030, test_loss: 0.9216, test_f1: 0.5417
 epoch: 71, train_loss: 0.7969, test_loss: 0.9141, test_f1: 0.5246
 epoch: 72, train_loss: 0.8092, test_loss: 0.9233, test_f1: 0.5332
 epoch: 73, train_loss: 0.8002, test_loss: 0.9226, test_f1: 0.5342
 epoch: 74, train_loss: 0.7834, test_loss: 0.9030, test_f1: 0.5466
 epoch: 75, train_loss: 0.8020, test_loss: 0.9371, test_f1: 0.5285
 epoch: 76, train_loss: 0.7998, test_loss: 0.9357, test_f1: 0.5334
 epoch: 77, train_loss: 0.7943, test_loss: 0.9279, test_f1: 0.5494
 epoch: 78, train_loss: 0.7950, test_loss: 0.9356, test_f1: 0.5333
 epoch: 79, train_loss: 0.7887, test_loss: 0.9295, test_f1: 0.5476
 epoch: 80, train_loss: 0.7988, test_loss: 0.9289, test_f1: 0.5384
 epoch: 81, train_loss: 0.7972, test_loss: 0.9062, test_f1: 0.5405
 epoch: 82, train_loss: 0.7850, test_loss: 0.8861, test_f1: 0.5538
 epoch: 83, train_loss: 0.7758, test_loss: 0.9647, test_f1: 0.5280
 epoch: 84, train_loss: 0.7894, test_loss: 0.9378, test_f1: 0.5369
 epoch: 85, train_loss: 0.7859, test_loss: 0.8988, test_f1: 0.5496
 epoch: 86, train_loss: 0.7921, test_loss: 0.9416, test_f1: 0.5375
 epoch: 87, train_loss: 0.7891, test_loss: 0.9844, test_f1: 0.5306
 epoch: 88, train_loss: 0.7814, test_loss: 0.9123, test_f1: 0.5496
 epoch: 89, train_loss: 0.7806, test_loss: 0.9074, test_f1: 0.5412
 epoch: 90, train_loss: 0.7682, test_loss: 0.9304, test_f1: 0.5439
 epoch: 91, train_loss: 0.7791, test_loss: 0.9105, test_f1: 0.5362
 epoch: 92, train_loss: 0.7823, test_loss: 0.8677, test_f1: 0.5404
 epoch: 93, train_loss: 0.7823, test_loss: 0.9111, test_f1: 0.5423
 epoch: 94, train_loss: 0.7770, test_loss: 0.8857, test_f1: 0.5365
 epoch: 95, train_loss: 0.7703, test_loss: 0.8908, test_f1: 0.5551
 epoch: 96, train_loss: 0.7817, test_loss: 0.9028, test_f1: 0.5535
 epoch: 97, train_loss: 0.7867, test_loss: 0.8808, test_f1: 0.5481
 epoch: 98, train_loss: 0.7669, test_loss: 0.8713, test_f1: 0.5453
 epoch: 99, train_loss: 0.7831, test_loss: 0.8809, test_f1: 0.5425
##################ITERATION #6 ****************************************
 epoch: 0, train_loss: 1.2494, test_loss: 1.4919, test_f1: 0.2270
 epoch: 1, train_loss: 1.1029, test_loss: 1.1332, test_f1: 0.3348
 epoch: 2, train_loss: 1.0547, test_loss: 1.0175, test_f1: 0.4428
 epoch: 3, train_loss: 1.0412, test_loss: 1.0125, test_f1: 0.4358
 epoch: 4, train_loss: 1.0322, test_loss: 1.0299, test_f1: 0.4630
 epoch: 5, train_loss: 1.0026, test_loss: 0.9942, test_f1: 0.4613
 epoch: 6, train_loss: 1.0098, test_loss: 0.9977, test_f1: 0.4674
 epoch: 7, train_loss: 0.9979, test_loss: 0.9663, test_f1: 0.4689
 epoch: 8, train_loss: 0.9865, test_loss: 0.9863, test_f1: 0.4770
 epoch: 9, train_loss: 0.9802, test_loss: 0.9604, test_f1: 0.4725
 epoch: 10, train_loss: 0.9637, test_loss: 0.9753, test_f1: 0.4896
 epoch: 11, train_loss: 0.9629, test_loss: 0.9507, test_f1: 0.4819
 epoch: 12, train_loss: 0.9577, test_loss: 0.9379, test_f1: 0.4875
 epoch: 13, train_loss: 0.9579, test_loss: 0.9182, test_f1: 0.4981
 epoch: 14, train_loss: 0.9519, test_loss: 0.9677, test_f1: 0.4849
 epoch: 15, train_loss: 0.9476, test_loss: 0.9397, test_f1: 0.4905
 epoch: 16, train_loss: 0.9417, test_loss: 0.9455, test_f1: 0.4879
 epoch: 17, train_loss: 0.9382, test_loss: 0.9055, test_f1: 0.5013
 epoch: 18, train_loss: 0.9413, test_loss: 0.9170, test_f1: 0.5007
 epoch: 19, train_loss: 0.9279, test_loss: 0.9137, test_f1: 0.4943
 epoch: 20, train_loss: 0.9285, test_loss: 0.8754, test_f1: 0.5313
 epoch: 21, train_loss: 0.9332, test_loss: 0.8863, test_f1: 0.5231
 epoch: 22, train_loss: 0.9140, test_loss: 0.8779, test_f1: 0.5363
 epoch: 23, train_loss: 0.9217, test_loss: 0.8920, test_f1: 0.5061
 epoch: 24, train_loss: 0.9185, test_loss: 0.8838, test_f1: 0.5050
 epoch: 25, train_loss: 0.9179, test_loss: 0.8623, test_f1: 0.5391
 epoch: 26, train_loss: 0.9037, test_loss: 0.8617, test_f1: 0.5358
 epoch: 27, train_loss: 0.8978, test_loss: 0.8656, test_f1: 0.5286
 epoch: 28, train_loss: 0.8986, test_loss: 0.8607, test_f1: 0.5343
 epoch: 29, train_loss: 0.8966, test_loss: 0.8525, test_f1: 0.5355
 epoch: 30, train_loss: 0.8981, test_loss: 0.8553, test_f1: 0.5326
 epoch: 31, train_loss: 0.8986, test_loss: 0.8440, test_f1: 0.5345
 epoch: 32, train_loss: 0.8934, test_loss: 0.8825, test_f1: 0.5319
 epoch: 33, train_loss: 0.8897, test_loss: 0.8481, test_f1: 0.5363
 epoch: 34, train_loss: 0.8753, test_loss: 0.8703, test_f1: 0.5267
 epoch: 35, train_loss: 0.8806, test_loss: 0.8568, test_f1: 0.5247
 epoch: 36, train_loss: 0.8820, test_loss: 0.8351, test_f1: 0.5435
 epoch: 37, train_loss: 0.8693, test_loss: 0.8504, test_f1: 0.5429
 epoch: 38, train_loss: 0.8784, test_loss: 0.8817, test_f1: 0.4979
 epoch: 39, train_loss: 0.8563, test_loss: 0.8232, test_f1: 0.5426
 epoch: 40, train_loss: 0.8682, test_loss: 0.8324, test_f1: 0.5365
 epoch: 41, train_loss: 0.8500, test_loss: 0.8723, test_f1: 0.5302
 epoch: 42, train_loss: 0.8552, test_loss: 0.8171, test_f1: 0.5455
 epoch: 43, train_loss: 0.8509, test_loss: 0.8133, test_f1: 0.5475
 epoch: 44, train_loss: 0.8440, test_loss: 0.8223, test_f1: 0.5524
 epoch: 45, train_loss: 0.8441, test_loss: 0.8496, test_f1: 0.5031
 epoch: 46, train_loss: 0.8486, test_loss: 0.8383, test_f1: 0.5345
 epoch: 47, train_loss: 0.8402, test_loss: 0.8488, test_f1: 0.5405
 epoch: 48, train_loss: 0.8478, test_loss: 0.8102, test_f1: 0.5396
 epoch: 49, train_loss: 0.8354, test_loss: 0.7966, test_f1: 0.5700
 epoch: 50, train_loss: 0.8353, test_loss: 0.8331, test_f1: 0.5462
 epoch: 51, train_loss: 0.8183, test_loss: 0.7793, test_f1: 0.5634
 epoch: 52, train_loss: 0.8045, test_loss: 0.7754, test_f1: 0.5576
 epoch: 53, train_loss: 0.8205, test_loss: 0.7793, test_f1: 0.5612
 epoch: 54, train_loss: 0.8132, test_loss: 0.7955, test_f1: 0.5513
 epoch: 55, train_loss: 0.8128, test_loss: 0.7802, test_f1: 0.5655
 epoch: 56, train_loss: 0.7982, test_loss: 0.7829, test_f1: 0.5784
 epoch: 57, train_loss: 0.7984, test_loss: 0.7826, test_f1: 0.5659
 epoch: 58, train_loss: 0.8096, test_loss: 0.7953, test_f1: 0.5594
 epoch: 59, train_loss: 0.8122, test_loss: 0.7871, test_f1: 0.5615
 epoch: 60, train_loss: 0.7967, test_loss: 0.7793, test_f1: 0.5719
 epoch: 61, train_loss: 0.8046, test_loss: 0.7909, test_f1: 0.5578
 epoch: 62, train_loss: 0.8051, test_loss: 0.7740, test_f1: 0.5663
 epoch: 63, train_loss: 0.8017, test_loss: 0.7778, test_f1: 0.5680
 epoch: 64, train_loss: 0.7964, test_loss: 0.7707, test_f1: 0.5638
 epoch: 65, train_loss: 0.7900, test_loss: 0.7828, test_f1: 0.5684
 epoch: 66, train_loss: 0.7981, test_loss: 0.7863, test_f1: 0.5591
 epoch: 67, train_loss: 0.7980, test_loss: 0.7986, test_f1: 0.5596
 epoch: 68, train_loss: 0.7994, test_loss: 0.7870, test_f1: 0.5584
 epoch: 69, train_loss: 0.7954, test_loss: 0.7803, test_f1: 0.5753
 epoch: 70, train_loss: 0.7948, test_loss: 0.7747, test_f1: 0.5676
 epoch: 71, train_loss: 0.7888, test_loss: 0.7509, test_f1: 0.5750
 epoch: 72, train_loss: 0.7920, test_loss: 0.7662, test_f1: 0.5704
 epoch: 73, train_loss: 0.7856, test_loss: 0.7906, test_f1: 0.5663
 epoch: 74, train_loss: 0.7765, test_loss: 0.7717, test_f1: 0.5826
 epoch: 75, train_loss: 0.7985, test_loss: 0.7893, test_f1: 0.5701
 epoch: 76, train_loss: 0.7764, test_loss: 0.7745, test_f1: 0.5757
 epoch: 77, train_loss: 0.7839, test_loss: 0.7701, test_f1: 0.5734
 epoch: 78, train_loss: 0.7833, test_loss: 0.7788, test_f1: 0.5706
 epoch: 79, train_loss: 0.7852, test_loss: 0.7858, test_f1: 0.5667
 epoch: 80, train_loss: 0.7919, test_loss: 0.7784, test_f1: 0.5753
 epoch: 81, train_loss: 0.7768, test_loss: 0.7905, test_f1: 0.5689
 epoch: 82, train_loss: 0.7805, test_loss: 0.7655, test_f1: 0.5813
 epoch: 83, train_loss: 0.7635, test_loss: 0.7619, test_f1: 0.5633
 epoch: 84, train_loss: 0.7628, test_loss: 0.7880, test_f1: 0.5683
 epoch: 85, train_loss: 0.7789, test_loss: 0.7763, test_f1: 0.5723
 epoch: 86, train_loss: 0.7744, test_loss: 0.7884, test_f1: 0.5877
 epoch: 87, train_loss: 0.7823, test_loss: 0.7880, test_f1: 0.6001
 epoch: 88, train_loss: 0.7733, test_loss: 0.7863, test_f1: 0.5882
 epoch: 89, train_loss: 0.7662, test_loss: 0.7505, test_f1: 0.5881
 epoch: 90, train_loss: 0.7677, test_loss: 0.7499, test_f1: 0.5882
 epoch: 91, train_loss: 0.7677, test_loss: 0.7693, test_f1: 0.5833
 epoch: 92, train_loss: 0.7650, test_loss: 0.7860, test_f1: 0.5898
 epoch: 93, train_loss: 0.7768, test_loss: 0.7662, test_f1: 0.5640
 epoch: 94, train_loss: 0.7719, test_loss: 0.7591, test_f1: 0.5906
 epoch: 95, train_loss: 0.7660, test_loss: 0.7495, test_f1: 0.5936
 epoch: 96, train_loss: 0.7684, test_loss: 0.7428, test_f1: 0.5907
 epoch: 97, train_loss: 0.7669, test_loss: 0.7784, test_f1: 0.5877
 epoch: 98, train_loss: 0.7676, test_loss: 0.8067, test_f1: 0.5614
 epoch: 99, train_loss: 0.7682, test_loss: 0.7857, test_f1: 0.5840
##################ITERATION #7 ****************************************
 epoch: 0, train_loss: 1.2456, test_loss: 1.4521, test_f1: 0.2270
 epoch: 1, train_loss: 1.1197, test_loss: 1.1254, test_f1: 0.3238
 epoch: 2, train_loss: 1.0715, test_loss: 1.0104, test_f1: 0.4269
 epoch: 3, train_loss: 1.0637, test_loss: 1.0041, test_f1: 0.4406
 epoch: 4, train_loss: 1.0395, test_loss: 1.0001, test_f1: 0.4518
 epoch: 5, train_loss: 1.0280, test_loss: 1.0063, test_f1: 0.4414
 epoch: 6, train_loss: 1.0134, test_loss: 0.9859, test_f1: 0.4577
 epoch: 7, train_loss: 1.0078, test_loss: 1.0000, test_f1: 0.4626
 epoch: 8, train_loss: 1.0010, test_loss: 0.9853, test_f1: 0.4790
 epoch: 9, train_loss: 0.9924, test_loss: 0.9582, test_f1: 0.4777
 epoch: 10, train_loss: 0.9713, test_loss: 0.9626, test_f1: 0.4781
 epoch: 11, train_loss: 0.9721, test_loss: 0.9727, test_f1: 0.4750
 epoch: 12, train_loss: 0.9711, test_loss: 0.9686, test_f1: 0.4803
 epoch: 13, train_loss: 0.9593, test_loss: 0.9491, test_f1: 0.4847
 epoch: 14, train_loss: 0.9459, test_loss: 0.9626, test_f1: 0.4955
 epoch: 15, train_loss: 0.9446, test_loss: 0.9184, test_f1: 0.4836
 epoch: 16, train_loss: 0.9299, test_loss: 0.9495, test_f1: 0.4991
 epoch: 17, train_loss: 0.9232, test_loss: 0.9243, test_f1: 0.4767
 epoch: 18, train_loss: 0.9192, test_loss: 0.9693, test_f1: 0.5093
 epoch: 19, train_loss: 0.9270, test_loss: 0.9681, test_f1: 0.4908
 epoch: 20, train_loss: 0.9283, test_loss: 0.9832, test_f1: 0.4885
 epoch: 21, train_loss: 0.9141, test_loss: 0.9433, test_f1: 0.5115
 epoch: 22, train_loss: 0.9152, test_loss: 0.9260, test_f1: 0.5036
 epoch: 23, train_loss: 0.9055, test_loss: 0.9460, test_f1: 0.5053
 epoch: 24, train_loss: 0.8989, test_loss: 0.9361, test_f1: 0.4667
 epoch: 25, train_loss: 0.8879, test_loss: 0.9458, test_f1: 0.5134
 epoch: 26, train_loss: 0.8795, test_loss: 0.9228, test_f1: 0.5073
 epoch: 27, train_loss: 0.8823, test_loss: 0.9112, test_f1: 0.5030
 epoch: 28, train_loss: 0.8740, test_loss: 0.9050, test_f1: 0.5121
 epoch: 29, train_loss: 0.8630, test_loss: 0.8706, test_f1: 0.5153
 epoch: 30, train_loss: 0.8678, test_loss: 0.8921, test_f1: 0.5145
 epoch: 31, train_loss: 0.8669, test_loss: 0.8977, test_f1: 0.5218
 epoch: 32, train_loss: 0.8582, test_loss: 0.8906, test_f1: 0.5461
 epoch: 33, train_loss: 0.8558, test_loss: 0.9723, test_f1: 0.4840
 epoch: 34, train_loss: 0.8540, test_loss: 0.8778, test_f1: 0.5058
 epoch: 35, train_loss: 0.8514, test_loss: 0.8630, test_f1: 0.5255
 epoch: 36, train_loss: 0.8425, test_loss: 0.8716, test_f1: 0.5126
 epoch: 37, train_loss: 0.8450, test_loss: 0.8941, test_f1: 0.5332
 epoch: 38, train_loss: 0.8396, test_loss: 0.8792, test_f1: 0.5147
 epoch: 39, train_loss: 0.8270, test_loss: 0.9027, test_f1: 0.5138
 epoch: 40, train_loss: 0.8342, test_loss: 0.8861, test_f1: 0.5385
 epoch: 41, train_loss: 0.8246, test_loss: 0.8736, test_f1: 0.5253
 epoch: 42, train_loss: 0.8312, test_loss: 0.8707, test_f1: 0.5328
 epoch: 43, train_loss: 0.8192, test_loss: 0.9040, test_f1: 0.5141
 epoch: 44, train_loss: 0.8253, test_loss: 0.8648, test_f1: 0.5416
 epoch: 45, train_loss: 0.8192, test_loss: 0.8443, test_f1: 0.5266
 epoch: 46, train_loss: 0.8054, test_loss: 0.8717, test_f1: 0.5356
 epoch: 47, train_loss: 0.7988, test_loss: 0.8190, test_f1: 0.5352
 epoch: 48, train_loss: 0.8128, test_loss: 0.8861, test_f1: 0.5476
 epoch: 49, train_loss: 0.8090, test_loss: 0.8400, test_f1: 0.5424
 epoch: 50, train_loss: 0.8070, test_loss: 0.8399, test_f1: 0.5553
 epoch: 51, train_loss: 0.7938, test_loss: 0.8417, test_f1: 0.5431
 epoch: 52, train_loss: 0.7869, test_loss: 0.8152, test_f1: 0.5491
 epoch: 53, train_loss: 0.7919, test_loss: 0.8267, test_f1: 0.5446
 epoch: 54, train_loss: 0.7768, test_loss: 0.8418, test_f1: 0.5406
 epoch: 55, train_loss: 0.7816, test_loss: 0.8929, test_f1: 0.5365
 epoch: 56, train_loss: 0.7742, test_loss: 0.8221, test_f1: 0.5567
 epoch: 57, train_loss: 0.7883, test_loss: 0.8510, test_f1: 0.5412
 epoch: 58, train_loss: 0.7766, test_loss: 0.8287, test_f1: 0.5372
 epoch: 59, train_loss: 0.7683, test_loss: 0.8514, test_f1: 0.5405
 epoch: 60, train_loss: 0.7697, test_loss: 0.8692, test_f1: 0.5439
 epoch: 61, train_loss: 0.7662, test_loss: 0.8201, test_f1: 0.5469
 epoch: 62, train_loss: 0.7684, test_loss: 0.8151, test_f1: 0.5547
 epoch: 63, train_loss: 0.7665, test_loss: 0.8446, test_f1: 0.5360
 epoch: 64, train_loss: 0.7784, test_loss: 0.8093, test_f1: 0.5777
 epoch: 65, train_loss: 0.7671, test_loss: 0.8318, test_f1: 0.5388
 epoch: 66, train_loss: 0.7723, test_loss: 0.8170, test_f1: 0.5611
 epoch: 67, train_loss: 0.7711, test_loss: 0.8297, test_f1: 0.5400
 epoch: 68, train_loss: 0.7617, test_loss: 0.8201, test_f1: 0.5494
 epoch: 69, train_loss: 0.7666, test_loss: 0.8347, test_f1: 0.5706
 epoch: 70, train_loss: 0.7619, test_loss: 0.8278, test_f1: 0.5649
 epoch: 71, train_loss: 0.7570, test_loss: 0.8309, test_f1: 0.5584
 epoch: 72, train_loss: 0.7582, test_loss: 0.8251, test_f1: 0.5468
 epoch: 73, train_loss: 0.7617, test_loss: 0.8368, test_f1: 0.5525
 epoch: 74, train_loss: 0.7608, test_loss: 0.8384, test_f1: 0.5366
 epoch: 75, train_loss: 0.7470, test_loss: 0.8382, test_f1: 0.5457
 epoch: 76, train_loss: 0.7502, test_loss: 0.8338, test_f1: 0.5450
 epoch: 77, train_loss: 0.7551, test_loss: 0.8426, test_f1: 0.5506
 epoch: 78, train_loss: 0.7536, test_loss: 0.8196, test_f1: 0.5639
 epoch: 79, train_loss: 0.7428, test_loss: 0.8682, test_f1: 0.5347
 epoch: 80, train_loss: 0.7496, test_loss: 0.8279, test_f1: 0.5626
 epoch: 81, train_loss: 0.7503, test_loss: 0.8055, test_f1: 0.5660
 epoch: 82, train_loss: 0.7479, test_loss: 0.8216, test_f1: 0.5631
 epoch: 83, train_loss: 0.7551, test_loss: 0.8611, test_f1: 0.5665
 epoch: 84, train_loss: 0.7394, test_loss: 0.8221, test_f1: 0.5466
 epoch: 85, train_loss: 0.7452, test_loss: 0.8186, test_f1: 0.5671
 epoch: 86, train_loss: 0.7338, test_loss: 0.8347, test_f1: 0.5525
 epoch: 87, train_loss: 0.7545, test_loss: 0.8017, test_f1: 0.5765
 epoch: 88, train_loss: 0.7485, test_loss: 0.8389, test_f1: 0.5617
 epoch: 89, train_loss: 0.7422, test_loss: 0.8104, test_f1: 0.5603
 epoch: 90, train_loss: 0.7476, test_loss: 0.8253, test_f1: 0.5636
 epoch: 91, train_loss: 0.7352, test_loss: 0.8082, test_f1: 0.5755
 epoch: 92, train_loss: 0.7374, test_loss: 0.7869, test_f1: 0.5774
 epoch: 93, train_loss: 0.7336, test_loss: 0.8098, test_f1: 0.5607
 epoch: 94, train_loss: 0.7319, test_loss: 0.8305, test_f1: 0.5682
 epoch: 95, train_loss: 0.7421, test_loss: 0.8068, test_f1: 0.5598
 epoch: 96, train_loss: 0.7333, test_loss: 0.8107, test_f1: 0.5814
 epoch: 97, train_loss: 0.7220, test_loss: 0.8107, test_f1: 0.5764
 epoch: 98, train_loss: 0.7317, test_loss: 0.8525, test_f1: 0.5459
 epoch: 99, train_loss: 0.7319, test_loss: 0.8562, test_f1: 0.5633
##################ITERATION #8 ****************************************
 epoch: 0, train_loss: 1.4413, test_loss: 1.4310, test_f1: 0.2173
 epoch: 1, train_loss: 1.1741, test_loss: 1.5542, test_f1: 0.2017
 epoch: 2, train_loss: 1.1063, test_loss: 1.0738, test_f1: 0.4193
 epoch: 3, train_loss: 1.0753, test_loss: 1.0049, test_f1: 0.4457
 epoch: 4, train_loss: 1.0604, test_loss: 0.9844, test_f1: 0.4510
 epoch: 5, train_loss: 1.0430, test_loss: 0.9812, test_f1: 0.4708
 epoch: 6, train_loss: 1.0269, test_loss: 0.9662, test_f1: 0.4551
 epoch: 7, train_loss: 1.0128, test_loss: 0.9607, test_f1: 0.4810
 epoch: 8, train_loss: 0.9984, test_loss: 0.9603, test_f1: 0.4945
 epoch: 9, train_loss: 0.9912, test_loss: 0.9681, test_f1: 0.4854
 epoch: 10, train_loss: 0.9728, test_loss: 0.9589, test_f1: 0.4875
 epoch: 11, train_loss: 0.9680, test_loss: 0.9354, test_f1: 0.5023
 epoch: 12, train_loss: 0.9615, test_loss: 0.9344, test_f1: 0.4992
 epoch: 13, train_loss: 0.9561, test_loss: 0.9225, test_f1: 0.4834
 epoch: 14, train_loss: 0.9469, test_loss: 0.9076, test_f1: 0.4801
 epoch: 15, train_loss: 0.9494, test_loss: 0.9156, test_f1: 0.4834
 epoch: 16, train_loss: 0.9379, test_loss: 0.9329, test_f1: 0.5188
 epoch: 17, train_loss: 0.9317, test_loss: 0.9056, test_f1: 0.5137
 epoch: 18, train_loss: 0.9360, test_loss: 0.9095, test_f1: 0.5181
 epoch: 19, train_loss: 0.9140, test_loss: 0.9094, test_f1: 0.5144
 epoch: 20, train_loss: 0.9336, test_loss: 0.9186, test_f1: 0.5107
 epoch: 21, train_loss: 0.9208, test_loss: 0.9040, test_f1: 0.5219
 epoch: 22, train_loss: 0.9156, test_loss: 0.8793, test_f1: 0.5124
 epoch: 23, train_loss: 0.9157, test_loss: 0.9019, test_f1: 0.5229
 epoch: 24, train_loss: 0.9016, test_loss: 0.8874, test_f1: 0.5286
 epoch: 25, train_loss: 0.9005, test_loss: 0.9200, test_f1: 0.5158
 epoch: 26, train_loss: 0.8982, test_loss: 0.8704, test_f1: 0.5071
 epoch: 27, train_loss: 0.8862, test_loss: 0.8576, test_f1: 0.5309
 epoch: 28, train_loss: 0.8865, test_loss: 0.8985, test_f1: 0.5235
 epoch: 29, train_loss: 0.8925, test_loss: 0.8898, test_f1: 0.5393
 epoch: 30, train_loss: 0.8918, test_loss: 0.8673, test_f1: 0.5139
 epoch: 31, train_loss: 0.8782, test_loss: 0.8575, test_f1: 0.5311
 epoch: 32, train_loss: 0.8831, test_loss: 0.8552, test_f1: 0.5185
 epoch: 33, train_loss: 0.8697, test_loss: 0.8572, test_f1: 0.5250
 epoch: 34, train_loss: 0.8780, test_loss: 0.8690, test_f1: 0.5294
 epoch: 35, train_loss: 0.8730, test_loss: 0.8251, test_f1: 0.5297
 epoch: 36, train_loss: 0.8773, test_loss: 0.8308, test_f1: 0.5308
 epoch: 37, train_loss: 0.8695, test_loss: 0.8201, test_f1: 0.5329
 epoch: 38, train_loss: 0.8647, test_loss: 0.8615, test_f1: 0.5186
 epoch: 39, train_loss: 0.8607, test_loss: 0.8384, test_f1: 0.5224
 epoch: 40, train_loss: 0.8611, test_loss: 0.8658, test_f1: 0.5273
 epoch: 41, train_loss: 0.8415, test_loss: 0.8470, test_f1: 0.5349
 epoch: 42, train_loss: 0.8518, test_loss: 0.8304, test_f1: 0.5396
 epoch: 43, train_loss: 0.8592, test_loss: 0.8361, test_f1: 0.5335
 epoch: 44, train_loss: 0.8292, test_loss: 0.8274, test_f1: 0.5375
 epoch: 45, train_loss: 0.8299, test_loss: 0.8293, test_f1: 0.5440
 epoch: 46, train_loss: 0.8394, test_loss: 0.8299, test_f1: 0.5504
 epoch: 47, train_loss: 0.8322, test_loss: 0.8324, test_f1: 0.5466
 epoch: 48, train_loss: 0.8308, test_loss: 0.8200, test_f1: 0.5478
 epoch: 49, train_loss: 0.8353, test_loss: 0.8503, test_f1: 0.5406
 epoch: 50, train_loss: 0.8327, test_loss: 0.8432, test_f1: 0.5457
 epoch: 51, train_loss: 0.8184, test_loss: 0.8176, test_f1: 0.5404
 epoch: 52, train_loss: 0.8181, test_loss: 0.8114, test_f1: 0.5463
 epoch: 53, train_loss: 0.8167, test_loss: 0.8089, test_f1: 0.5432
 epoch: 54, train_loss: 0.8099, test_loss: 0.8037, test_f1: 0.5510
 epoch: 55, train_loss: 0.8086, test_loss: 0.8063, test_f1: 0.5501
 epoch: 56, train_loss: 0.8135, test_loss: 0.7921, test_f1: 0.5626
 epoch: 57, train_loss: 0.8002, test_loss: 0.7933, test_f1: 0.5572
 epoch: 58, train_loss: 0.8024, test_loss: 0.8102, test_f1: 0.5517
 epoch: 59, train_loss: 0.8006, test_loss: 0.7902, test_f1: 0.5556
 epoch: 60, train_loss: 0.8033, test_loss: 0.7932, test_f1: 0.5639
 epoch: 61, train_loss: 0.8019, test_loss: 0.7795, test_f1: 0.5473
 epoch: 62, train_loss: 0.7908, test_loss: 0.7883, test_f1: 0.5445
 epoch: 63, train_loss: 0.8028, test_loss: 0.7974, test_f1: 0.5749
 epoch: 64, train_loss: 0.7966, test_loss: 0.7916, test_f1: 0.5431
 epoch: 65, train_loss: 0.8012, test_loss: 0.7958, test_f1: 0.5565
 epoch: 66, train_loss: 0.7875, test_loss: 0.7865, test_f1: 0.5541
 epoch: 67, train_loss: 0.7963, test_loss: 0.7898, test_f1: 0.5500
 epoch: 68, train_loss: 0.7948, test_loss: 0.7931, test_f1: 0.5589
 epoch: 69, train_loss: 0.7944, test_loss: 0.8026, test_f1: 0.5539
 epoch: 70, train_loss: 0.7907, test_loss: 0.7821, test_f1: 0.5670
 epoch: 71, train_loss: 0.7880, test_loss: 0.7724, test_f1: 0.5660
 epoch: 72, train_loss: 0.7869, test_loss: 0.7583, test_f1: 0.5636
 epoch: 73, train_loss: 0.8040, test_loss: 0.7745, test_f1: 0.5826
 epoch: 74, train_loss: 0.7831, test_loss: 0.7765, test_f1: 0.5700
 epoch: 75, train_loss: 0.7891, test_loss: 0.7664, test_f1: 0.5526
 epoch: 76, train_loss: 0.7753, test_loss: 0.7668, test_f1: 0.5778
 epoch: 77, train_loss: 0.7807, test_loss: 0.7688, test_f1: 0.5768
 epoch: 78, train_loss: 0.7888, test_loss: 0.7793, test_f1: 0.5588
 epoch: 79, train_loss: 0.7767, test_loss: 0.7826, test_f1: 0.5748
 epoch: 80, train_loss: 0.7784, test_loss: 0.7842, test_f1: 0.5634
 epoch: 81, train_loss: 0.7702, test_loss: 0.7805, test_f1: 0.5567
 epoch: 82, train_loss: 0.7835, test_loss: 0.7984, test_f1: 0.5598
 epoch: 83, train_loss: 0.7729, test_loss: 0.7888, test_f1: 0.5530
 epoch: 84, train_loss: 0.7788, test_loss: 0.7741, test_f1: 0.5764
 epoch: 85, train_loss: 0.7717, test_loss: 0.7759, test_f1: 0.5563
 epoch: 86, train_loss: 0.7692, test_loss: 0.7621, test_f1: 0.5644
 epoch: 87, train_loss: 0.7737, test_loss: 0.7757, test_f1: 0.5629
 epoch: 88, train_loss: 0.7724, test_loss: 0.7754, test_f1: 0.5881
 epoch: 89, train_loss: 0.7720, test_loss: 0.8053, test_f1: 0.5629
 epoch: 90, train_loss: 0.7698, test_loss: 0.7814, test_f1: 0.5748
 epoch: 91, train_loss: 0.7625, test_loss: 0.7975, test_f1: 0.5642
 epoch: 92, train_loss: 0.7651, test_loss: 0.7647, test_f1: 0.5704
 epoch: 93, train_loss: 0.7552, test_loss: 0.7693, test_f1: 0.5785
 epoch: 94, train_loss: 0.7518, test_loss: 0.7684, test_f1: 0.5664
 epoch: 95, train_loss: 0.7560, test_loss: 0.7777, test_f1: 0.5657
 epoch: 96, train_loss: 0.7580, test_loss: 0.7951, test_f1: 0.5659
 epoch: 97, train_loss: 0.7478, test_loss: 0.7689, test_f1: 0.5752
 epoch: 98, train_loss: 0.7586, test_loss: 0.7699, test_f1: 0.5691
 epoch: 99, train_loss: 0.7482, test_loss: 0.7869, test_f1: 0.5662
##################ITERATION #9 ****************************************
 epoch: 0, train_loss: 1.4359, test_loss: 1.2404, test_f1: 0.2843
 epoch: 1, train_loss: 1.1306, test_loss: 1.4056, test_f1: 0.2837
 epoch: 2, train_loss: 1.1038, test_loss: 1.0461, test_f1: 0.4066
 epoch: 3, train_loss: 1.0703, test_loss: 1.0144, test_f1: 0.4236
 epoch: 4, train_loss: 1.0468, test_loss: 1.0255, test_f1: 0.4308
 epoch: 5, train_loss: 1.0366, test_loss: 1.0045, test_f1: 0.4233
 epoch: 6, train_loss: 1.0193, test_loss: 0.9984, test_f1: 0.4471
 epoch: 7, train_loss: 1.0199, test_loss: 0.9756, test_f1: 0.4320
 epoch: 8, train_loss: 1.0094, test_loss: 0.9666, test_f1: 0.4677
 epoch: 9, train_loss: 0.9945, test_loss: 0.9953, test_f1: 0.4413
 epoch: 10, train_loss: 0.9878, test_loss: 1.0006, test_f1: 0.4340
 epoch: 11, train_loss: 0.9836, test_loss: 0.9738, test_f1: 0.4688
 epoch: 12, train_loss: 0.9870, test_loss: 0.9760, test_f1: 0.4763
 epoch: 13, train_loss: 0.9746, test_loss: 0.9988, test_f1: 0.4749
 epoch: 14, train_loss: 0.9683, test_loss: 1.0022, test_f1: 0.4981
 epoch: 15, train_loss: 0.9658, test_loss: 0.9190, test_f1: 0.4866
 epoch: 16, train_loss: 0.9595, test_loss: 0.9317, test_f1: 0.4645
 epoch: 17, train_loss: 0.9523, test_loss: 0.9277, test_f1: 0.4775
 epoch: 18, train_loss: 0.9521, test_loss: 0.9388, test_f1: 0.4754
 epoch: 19, train_loss: 0.9484, test_loss: 0.9215, test_f1: 0.4765
 epoch: 20, train_loss: 0.9385, test_loss: 0.9195, test_f1: 0.5228
 epoch: 21, train_loss: 0.9335, test_loss: 0.9134, test_f1: 0.5100
 epoch: 22, train_loss: 0.9371, test_loss: 0.9031, test_f1: 0.4979
 epoch: 23, train_loss: 0.9270, test_loss: 0.9243, test_f1: 0.5186
 epoch: 24, train_loss: 0.9315, test_loss: 0.9784, test_f1: 0.4782
 epoch: 25, train_loss: 0.9152, test_loss: 0.9177, test_f1: 0.5148
 epoch: 26, train_loss: 0.9111, test_loss: 0.8847, test_f1: 0.4921
 epoch: 27, train_loss: 0.9119, test_loss: 0.8758, test_f1: 0.5092
 epoch: 28, train_loss: 0.9055, test_loss: 0.8975, test_f1: 0.4852
 epoch: 29, train_loss: 0.9024, test_loss: 0.8733, test_f1: 0.5185
 epoch: 30, train_loss: 0.8986, test_loss: 0.8881, test_f1: 0.4945
 epoch: 31, train_loss: 0.9068, test_loss: 0.8964, test_f1: 0.5243
 epoch: 32, train_loss: 0.8974, test_loss: 0.9588, test_f1: 0.5069
 epoch: 33, train_loss: 0.8866, test_loss: 0.8819, test_f1: 0.5477
 epoch: 34, train_loss: 0.8871, test_loss: 0.9806, test_f1: 0.5179
 epoch: 35, train_loss: 0.8886, test_loss: 0.9061, test_f1: 0.4887
 epoch: 36, train_loss: 0.8886, test_loss: 0.8456, test_f1: 0.5476
 epoch: 37, train_loss: 0.8703, test_loss: 0.8784, test_f1: 0.5156
 epoch: 38, train_loss: 0.8749, test_loss: 0.8984, test_f1: 0.5222
 epoch: 39, train_loss: 0.8698, test_loss: 0.8726, test_f1: 0.5262
 epoch: 40, train_loss: 0.8725, test_loss: 0.9021, test_f1: 0.5414
 epoch: 41, train_loss: 0.8702, test_loss: 0.8944, test_f1: 0.4913
 epoch: 42, train_loss: 0.8741, test_loss: 0.9189, test_f1: 0.5295
 epoch: 43, train_loss: 0.8643, test_loss: 0.8594, test_f1: 0.5240
 epoch: 44, train_loss: 0.8656, test_loss: 0.8778, test_f1: 0.5214
 epoch: 45, train_loss: 0.8614, test_loss: 0.9111, test_f1: 0.5414
 epoch: 46, train_loss: 0.8540, test_loss: 0.8618, test_f1: 0.5342
 epoch: 47, train_loss: 0.8499, test_loss: 0.8947, test_f1: 0.5305
 epoch: 48, train_loss: 0.8394, test_loss: 0.8620, test_f1: 0.5517
 epoch: 49, train_loss: 0.8526, test_loss: 0.9233, test_f1: 0.5188
 epoch: 50, train_loss: 0.8443, test_loss: 0.9117, test_f1: 0.4857
 epoch: 51, train_loss: 0.8354, test_loss: 0.8670, test_f1: 0.5438
 epoch: 52, train_loss: 0.8189, test_loss: 0.8747, test_f1: 0.5428
 epoch: 53, train_loss: 0.8284, test_loss: 0.8628, test_f1: 0.5404
 epoch: 54, train_loss: 0.8229, test_loss: 0.8597, test_f1: 0.5339
 epoch: 55, train_loss: 0.8222, test_loss: 0.8548, test_f1: 0.5401
 epoch: 56, train_loss: 0.8155, test_loss: 0.8506, test_f1: 0.5532
 epoch: 57, train_loss: 0.8185, test_loss: 0.8461, test_f1: 0.5383
 epoch: 58, train_loss: 0.8171, test_loss: 0.8505, test_f1: 0.5338
 epoch: 59, train_loss: 0.8191, test_loss: 0.8698, test_f1: 0.5135
 epoch: 60, train_loss: 0.8075, test_loss: 0.8383, test_f1: 0.5486
 epoch: 61, train_loss: 0.8101, test_loss: 0.8392, test_f1: 0.5391
 epoch: 62, train_loss: 0.8063, test_loss: 0.8301, test_f1: 0.5289
 epoch: 63, train_loss: 0.8077, test_loss: 0.8540, test_f1: 0.5435
 epoch: 64, train_loss: 0.8079, test_loss: 0.8575, test_f1: 0.5440
 epoch: 65, train_loss: 0.7928, test_loss: 0.8262, test_f1: 0.5489
 epoch: 66, train_loss: 0.8096, test_loss: 0.8465, test_f1: 0.5433
 epoch: 67, train_loss: 0.8049, test_loss: 0.8408, test_f1: 0.5611
 epoch: 68, train_loss: 0.8102, test_loss: 0.8352, test_f1: 0.5291
 epoch: 69, train_loss: 0.8032, test_loss: 0.8475, test_f1: 0.5619
 epoch: 70, train_loss: 0.7908, test_loss: 0.8413, test_f1: 0.5296
 epoch: 71, train_loss: 0.8047, test_loss: 0.8243, test_f1: 0.5368
 epoch: 72, train_loss: 0.7917, test_loss: 0.8273, test_f1: 0.5344
 epoch: 73, train_loss: 0.7919, test_loss: 0.8197, test_f1: 0.5447
 epoch: 74, train_loss: 0.7892, test_loss: 0.8321, test_f1: 0.5475
 epoch: 75, train_loss: 0.8021, test_loss: 0.8354, test_f1: 0.5416
 epoch: 76, train_loss: 0.7902, test_loss: 0.8454, test_f1: 0.5391
 epoch: 77, train_loss: 0.7835, test_loss: 0.8428, test_f1: 0.5365
 epoch: 78, train_loss: 0.7911, test_loss: 0.8320, test_f1: 0.5551
 epoch: 79, train_loss: 0.7895, test_loss: 0.8265, test_f1: 0.5578
 epoch: 80, train_loss: 0.7892, test_loss: 0.8436, test_f1: 0.5178
 epoch: 81, train_loss: 0.7900, test_loss: 0.8323, test_f1: 0.5465
 epoch: 82, train_loss: 0.7806, test_loss: 0.8277, test_f1: 0.5534
 epoch: 83, train_loss: 0.7936, test_loss: 0.8329, test_f1: 0.5364
 epoch: 84, train_loss: 0.7898, test_loss: 0.8290, test_f1: 0.5553
 epoch: 85, train_loss: 0.7998, test_loss: 0.8420, test_f1: 0.5477
 epoch: 86, train_loss: 0.7890, test_loss: 0.8220, test_f1: 0.5456
 epoch: 87, train_loss: 0.7809, test_loss: 0.8142, test_f1: 0.5662
 epoch: 88, train_loss: 0.7889, test_loss: 0.8184, test_f1: 0.5306
 epoch: 89, train_loss: 0.7813, test_loss: 0.8415, test_f1: 0.5409
 epoch: 90, train_loss: 0.7864, test_loss: 0.8276, test_f1: 0.5484
 epoch: 91, train_loss: 0.7687, test_loss: 0.8372, test_f1: 0.5430
 epoch: 92, train_loss: 0.7771, test_loss: 0.8213, test_f1: 0.5292
 epoch: 93, train_loss: 0.7838, test_loss: 0.8146, test_f1: 0.5651
 epoch: 94, train_loss: 0.7876, test_loss: 0.8498, test_f1: 0.5449
 epoch: 95, train_loss: 0.7703, test_loss: 0.8546, test_f1: 0.5441
 epoch: 96, train_loss: 0.7729, test_loss: 0.8171, test_f1: 0.5165
 epoch: 97, train_loss: 0.7720, test_loss: 0.8323, test_f1: 0.5680
 epoch: 98, train_loss: 0.7721, test_loss: 0.8190, test_f1: 0.5504
 epoch: 99, train_loss: 0.7674, test_loss: 0.8399, test_f1: 0.5452

Training completed in 620.57 seconds
Best F1: 0.6001 at epoch 87
Mean F1 across iterations: 0.5747  0.0174
========================FINAL RESULTS================================
FEGIN weighted F1: 0.6001  0.0174
python main.py --data ltspice_examples --representation component_pin_net --model FEGIN --layers 3 --hiddens 16 --batch_size 128 --lr 0.001 --emb_size 128 --epochs 100 --save_appendix component_pin_net_L3_H16_BS128_LR0.001_E128 --no_val
-----



STDERR:
  File "main.py", line 370, in <module>
    main()
  File "main.py", line 254, in main
    dataset = dataset_class(
  File "/home/philip/projects/llm_inference_code_repo/Circuit-Completion-Using-GNNs/component_classification_with_link_prediction_head/evaluation/FEGIN/kernel/circuit_datasets.py", line 15, in __init__
    self.data, self.slices = torch.load(self.processed_paths[0])
  File "/home/philip/.local/lib/python3.8/site-packages/torch/serialization.py", line 1040, in load
    warnings.warn(
  File "/usr/lib/python3.8/warnings.py", line 109, in _showwarnmsg
    sw(msg.message, msg.category, msg.filename, msg.lineno,
  File "main.py", line 47, in warn_with_traceback
    traceback.print_stack(file=log)
/home/philip/projects/llm_inference_code_repo/Circuit-Completion-Using-GNNs/component_classification_with_link_prediction_head/evaluation/FEGIN/kernel/circuit_datasets.py:15: FutureWarning: You are using `torch.load` with `weights_only=False` (the current default value), which uses the default pickle module implicitly. It is possible to construct malicious pickle data which will execute arbitrary code during unpickling (See https://github.com/pytorch/pytorch/blob/main/SECURITY.md#untrusted-models for more details). In a future release, the default value for `weights_only` will be flipped to `True`. This limits the functions that could be executed during unpickling. Arbitrary objects will no longer be allowed to be loaded via this mode unless they are explicitly allowlisted by the user via `torch.serialization.add_safe_globals`. We recommend you start setting `weights_only=True` for any use case where you don't have full control of the loaded file. Please open an issue on GitHub for any issues related to this experimental feature.
  self.data, self.slices = torch.load(self.processed_paths[0])
