STDOUT:
Results will be saved in /home/philip/projects/ltspice_examples_code_repo/Circuit-Completion-Using-GNNs/component_classification_with_link_prediction_head/evaluation/FEGIN/results/model_FEGIN_dataset_ltspice_demos
Command line input: python main.py --data ltspice_demos --representation component_net --model FEGIN --layers 3 --hiddens 16 --batch_size 256 --lr 0.01 --emb_size 250 --epochs 100 --save_appendix component_net_L3_H16_BS256_LR0.01_E250 --no_val
 is saved.
-----
ltspice_demos - FEGIN
Using 3 layers, 16 hidden units, h = 2
Loading component_net representation dataset
ENTERED
Training FEGIN on component_net representation
Train: 1565, Test: 383
##################ITERATION #0 ****************************************
 epoch: 0, train_loss: 1.3166, test_loss: 1.3121, test_f1: 0.1365
 epoch: 1, train_loss: 1.1898, test_loss: 1.3463, test_f1: 0.1365
 epoch: 2, train_loss: 1.1599, test_loss: 1.3550, test_f1: 0.2281
 epoch: 3, train_loss: 1.1500, test_loss: 1.3359, test_f1: 0.3246
 epoch: 4, train_loss: 1.1253, test_loss: 1.3295, test_f1: 0.3317
 epoch: 5, train_loss: 1.1118, test_loss: 1.2301, test_f1: 0.3042
 epoch: 6, train_loss: 1.0956, test_loss: 1.2195, test_f1: 0.3340
 epoch: 7, train_loss: 1.0686, test_loss: 1.1706, test_f1: 0.4074
 epoch: 8, train_loss: 1.0466, test_loss: 1.1483, test_f1: 0.3455
 epoch: 9, train_loss: 1.0373, test_loss: 1.1565, test_f1: 0.4523
 epoch: 10, train_loss: 1.0249, test_loss: 1.2303, test_f1: 0.4013
 epoch: 11, train_loss: 1.0085, test_loss: 1.1837, test_f1: 0.4315
 epoch: 12, train_loss: 0.9920, test_loss: 1.1691, test_f1: 0.4369
 epoch: 13, train_loss: 0.9675, test_loss: 1.1020, test_f1: 0.4940
 epoch: 14, train_loss: 0.9842, test_loss: 1.1275, test_f1: 0.5075
 epoch: 15, train_loss: 0.9623, test_loss: 1.2565, test_f1: 0.4610
 epoch: 16, train_loss: 0.9591, test_loss: 1.1168, test_f1: 0.4684
 epoch: 17, train_loss: 0.9463, test_loss: 1.0763, test_f1: 0.5467
 epoch: 18, train_loss: 0.9434, test_loss: 1.0992, test_f1: 0.4872
 epoch: 19, train_loss: 0.9443, test_loss: 1.1880, test_f1: 0.5130
 epoch: 20, train_loss: 0.9309, test_loss: 1.2029, test_f1: 0.4649
 epoch: 21, train_loss: 0.9292, test_loss: 1.1497, test_f1: 0.5509
 epoch: 22, train_loss: 0.9196, test_loss: 1.3078, test_f1: 0.4597
 epoch: 23, train_loss: 0.9025, test_loss: 1.2222, test_f1: 0.4745
 epoch: 24, train_loss: 0.9212, test_loss: 1.1547, test_f1: 0.4912
 epoch: 25, train_loss: 0.9167, test_loss: 1.0974, test_f1: 0.4898
 epoch: 26, train_loss: 0.9083, test_loss: 1.0876, test_f1: 0.4291
 epoch: 27, train_loss: 0.8974, test_loss: 1.3414, test_f1: 0.4824
 epoch: 28, train_loss: 0.9235, test_loss: 1.1152, test_f1: 0.5408
 epoch: 29, train_loss: 0.8835, test_loss: 1.1358, test_f1: 0.4306
 epoch: 30, train_loss: 0.8935, test_loss: 1.1537, test_f1: 0.4812
 epoch: 31, train_loss: 0.9303, test_loss: 1.0321, test_f1: 0.5150
 epoch: 32, train_loss: 0.9353, test_loss: 1.1456, test_f1: 0.5068
 epoch: 33, train_loss: 0.9435, test_loss: 1.1218, test_f1: 0.4252
 epoch: 34, train_loss: 0.9410, test_loss: 1.0641, test_f1: 0.5297
 epoch: 35, train_loss: 0.9278, test_loss: 1.1484, test_f1: 0.4575
 epoch: 36, train_loss: 0.9221, test_loss: 1.1359, test_f1: 0.4762
 epoch: 37, train_loss: 0.9012, test_loss: 1.0537, test_f1: 0.5156
 epoch: 38, train_loss: 0.9137, test_loss: 1.0155, test_f1: 0.5322
 epoch: 39, train_loss: 0.9074, test_loss: 1.1694, test_f1: 0.4612
 epoch: 40, train_loss: 0.9036, test_loss: 1.0609, test_f1: 0.4956
 epoch: 41, train_loss: 0.8977, test_loss: 1.0723, test_f1: 0.5273
 epoch: 42, train_loss: 0.8919, test_loss: 1.1683, test_f1: 0.5326
 epoch: 43, train_loss: 0.8751, test_loss: 1.1283, test_f1: 0.5842
 epoch: 44, train_loss: 0.8657, test_loss: 1.1139, test_f1: 0.5637
 epoch: 45, train_loss: 0.9523, test_loss: 1.2266, test_f1: 0.3865
 epoch: 46, train_loss: 0.9603, test_loss: 1.0659, test_f1: 0.4500
 epoch: 47, train_loss: 0.9104, test_loss: 1.1463, test_f1: 0.5376
 epoch: 48, train_loss: 0.9182, test_loss: 1.1002, test_f1: 0.5264
 epoch: 49, train_loss: 0.8971, test_loss: 1.0927, test_f1: 0.5211
 epoch: 50, train_loss: 0.8745, test_loss: 1.0746, test_f1: 0.5207
 epoch: 51, train_loss: 0.8765, test_loss: 1.1044, test_f1: 0.5562
 epoch: 52, train_loss: 0.8600, test_loss: 1.1226, test_f1: 0.5460
 epoch: 53, train_loss: 0.8614, test_loss: 1.0891, test_f1: 0.5473
 epoch: 54, train_loss: 0.8604, test_loss: 1.1137, test_f1: 0.5498
 epoch: 55, train_loss: 0.8521, test_loss: 1.1157, test_f1: 0.5540
 epoch: 56, train_loss: 0.8521, test_loss: 1.0601, test_f1: 0.5328
 epoch: 57, train_loss: 0.8659, test_loss: 1.0687, test_f1: 0.5378
 epoch: 58, train_loss: 0.8524, test_loss: 1.0532, test_f1: 0.5176
 epoch: 59, train_loss: 0.8626, test_loss: 1.1171, test_f1: 0.5274
 epoch: 60, train_loss: 0.8421, test_loss: 1.0432, test_f1: 0.5279
 epoch: 61, train_loss: 0.8580, test_loss: 1.0483, test_f1: 0.5298
 epoch: 62, train_loss: 0.8481, test_loss: 1.0758, test_f1: 0.5431
 epoch: 63, train_loss: 0.8426, test_loss: 1.1243, test_f1: 0.5537
 epoch: 64, train_loss: 0.8331, test_loss: 1.0743, test_f1: 0.5804
 epoch: 65, train_loss: 0.8357, test_loss: 1.0144, test_f1: 0.5352
 epoch: 66, train_loss: 0.8360, test_loss: 1.0269, test_f1: 0.5642
 epoch: 67, train_loss: 0.8310, test_loss: 1.1500, test_f1: 0.5493
 epoch: 68, train_loss: 0.8345, test_loss: 1.1420, test_f1: 0.5523
 epoch: 69, train_loss: 0.8327, test_loss: 1.0684, test_f1: 0.5728
 epoch: 70, train_loss: 0.8277, test_loss: 1.0856, test_f1: 0.5529
 epoch: 71, train_loss: 0.8272, test_loss: 1.1450, test_f1: 0.5814
 epoch: 72, train_loss: 0.8386, test_loss: 1.2106, test_f1: 0.5645
 epoch: 73, train_loss: 0.8312, test_loss: 1.1850, test_f1: 0.5555
 epoch: 74, train_loss: 0.8221, test_loss: 1.1735, test_f1: 0.5508
 epoch: 75, train_loss: 0.8189, test_loss: 1.1074, test_f1: 0.5636
 epoch: 76, train_loss: 0.8121, test_loss: 1.0912, test_f1: 0.5833
 epoch: 77, train_loss: 0.8150, test_loss: 1.2176, test_f1: 0.5512
 epoch: 78, train_loss: 0.8462, test_loss: 1.1781, test_f1: 0.5514
 epoch: 79, train_loss: 0.8317, test_loss: 1.1814, test_f1: 0.5761
 epoch: 80, train_loss: 0.8224, test_loss: 1.1753, test_f1: 0.5711
 epoch: 81, train_loss: 0.8135, test_loss: 1.0946, test_f1: 0.5815
 epoch: 82, train_loss: 0.8166, test_loss: 1.0800, test_f1: 0.5758
 epoch: 83, train_loss: 0.8181, test_loss: 1.0716, test_f1: 0.5864
 epoch: 84, train_loss: 0.8209, test_loss: 1.0866, test_f1: 0.5787
 epoch: 85, train_loss: 0.8226, test_loss: 1.0936, test_f1: 0.5773
 epoch: 86, train_loss: 0.8314, test_loss: 1.0980, test_f1: 0.5815
 epoch: 87, train_loss: 0.8083, test_loss: 1.1211, test_f1: 0.5753
 epoch: 88, train_loss: 0.8143, test_loss: 1.0702, test_f1: 0.5589
 epoch: 89, train_loss: 0.8288, test_loss: 1.0627, test_f1: 0.5677
 epoch: 90, train_loss: 0.8164, test_loss: 1.0791, test_f1: 0.5584
 epoch: 91, train_loss: 0.8154, test_loss: 1.0928, test_f1: 0.5841
 epoch: 92, train_loss: 0.7927, test_loss: 1.0668, test_f1: 0.5964
 epoch: 93, train_loss: 0.8081, test_loss: 1.0705, test_f1: 0.6023
 epoch: 94, train_loss: 0.7975, test_loss: 1.1122, test_f1: 0.5776
 epoch: 95, train_loss: 0.7833, test_loss: 1.1079, test_f1: 0.5978
 epoch: 96, train_loss: 0.7951, test_loss: 1.0927, test_f1: 0.5568
 epoch: 97, train_loss: 0.8036, test_loss: 1.0937, test_f1: 0.5396
 epoch: 98, train_loss: 0.7952, test_loss: 1.1934, test_f1: 0.5596
 epoch: 99, train_loss: 0.8000, test_loss: 1.1527, test_f1: 0.5482
##################ITERATION #1 ****************************************
 epoch: 0, train_loss: 1.3145, test_loss: 1.3121, test_f1: 0.2281
 epoch: 1, train_loss: 1.1879, test_loss: 1.3252, test_f1: 0.2281
 epoch: 2, train_loss: 1.1316, test_loss: 1.3620, test_f1: 0.2281
 epoch: 3, train_loss: 1.0963, test_loss: 1.4437, test_f1: 0.3361
 epoch: 4, train_loss: 1.0685, test_loss: 1.4925, test_f1: 0.3377
 epoch: 5, train_loss: 1.0536, test_loss: 1.3921, test_f1: 0.3511
 epoch: 6, train_loss: 1.0300, test_loss: 1.1596, test_f1: 0.4642
 epoch: 7, train_loss: 1.0179, test_loss: 1.1546, test_f1: 0.3904
 epoch: 8, train_loss: 1.0091, test_loss: 1.0810, test_f1: 0.4155
 epoch: 9, train_loss: 1.0009, test_loss: 1.0995, test_f1: 0.5017
 epoch: 10, train_loss: 0.9665, test_loss: 1.1671, test_f1: 0.4746
 epoch: 11, train_loss: 0.9686, test_loss: 1.1256, test_f1: 0.3303
 epoch: 12, train_loss: 0.9501, test_loss: 1.1643, test_f1: 0.4957
 epoch: 13, train_loss: 0.9505, test_loss: 1.1816, test_f1: 0.4903
 epoch: 14, train_loss: 0.9310, test_loss: 1.2760, test_f1: 0.3956
 epoch: 15, train_loss: 0.9487, test_loss: 1.4725, test_f1: 0.3637
 epoch: 16, train_loss: 0.9482, test_loss: 1.4332, test_f1: 0.4744
 epoch: 17, train_loss: 0.9398, test_loss: 1.2008, test_f1: 0.3847
 epoch: 18, train_loss: 0.9184, test_loss: 1.2746, test_f1: 0.5010
 epoch: 19, train_loss: 0.9079, test_loss: 1.4312, test_f1: 0.4485
 epoch: 20, train_loss: 0.9044, test_loss: 1.2393, test_f1: 0.4432
 epoch: 21, train_loss: 0.8959, test_loss: 1.2189, test_f1: 0.4665
 epoch: 22, train_loss: 0.9079, test_loss: 1.1496, test_f1: 0.4791
 epoch: 23, train_loss: 0.9246, test_loss: 1.1944, test_f1: 0.4557
 epoch: 24, train_loss: 0.9298, test_loss: 1.0666, test_f1: 0.4768
 epoch: 25, train_loss: 0.9339, test_loss: 1.0440, test_f1: 0.4763
 epoch: 26, train_loss: 0.9390, test_loss: 1.1012, test_f1: 0.4540
 epoch: 27, train_loss: 0.8949, test_loss: 1.1510, test_f1: 0.4192
 epoch: 28, train_loss: 0.9029, test_loss: 1.1553, test_f1: 0.4830
 epoch: 29, train_loss: 0.8912, test_loss: 1.1670, test_f1: 0.5336
 epoch: 30, train_loss: 0.8807, test_loss: 1.1163, test_f1: 0.4213
 epoch: 31, train_loss: 0.8811, test_loss: 1.0212, test_f1: 0.5138
 epoch: 32, train_loss: 0.8877, test_loss: 1.0727, test_f1: 0.5722
 epoch: 33, train_loss: 0.8602, test_loss: 1.0558, test_f1: 0.5268
 epoch: 34, train_loss: 0.8657, test_loss: 1.1672, test_f1: 0.5220
 epoch: 35, train_loss: 0.8530, test_loss: 1.1754, test_f1: 0.4373
 epoch: 36, train_loss: 0.8486, test_loss: 1.0928, test_f1: 0.5087
 epoch: 37, train_loss: 0.8602, test_loss: 1.1937, test_f1: 0.3899
 epoch: 38, train_loss: 0.8574, test_loss: 1.0886, test_f1: 0.5191
 epoch: 39, train_loss: 0.8442, test_loss: 1.2727, test_f1: 0.4530
 epoch: 40, train_loss: 0.8489, test_loss: 1.0654, test_f1: 0.5597
 epoch: 41, train_loss: 0.8875, test_loss: 2.7221, test_f1: 0.3703
 epoch: 42, train_loss: 0.8727, test_loss: 1.5470, test_f1: 0.4124
 epoch: 43, train_loss: 0.8915, test_loss: 1.0259, test_f1: 0.4706
 epoch: 44, train_loss: 0.8927, test_loss: 1.1481, test_f1: 0.4286
 epoch: 45, train_loss: 0.8999, test_loss: 1.1266, test_f1: 0.5593
 epoch: 46, train_loss: 0.8776, test_loss: 1.0936, test_f1: 0.5335
 epoch: 47, train_loss: 0.8491, test_loss: 1.1625, test_f1: 0.5326
 epoch: 48, train_loss: 0.8510, test_loss: 1.3020, test_f1: 0.4634
 epoch: 49, train_loss: 0.8470, test_loss: 1.0909, test_f1: 0.5027
 epoch: 50, train_loss: 0.8516, test_loss: 0.9957, test_f1: 0.5771
 epoch: 51, train_loss: 0.8456, test_loss: 1.0122, test_f1: 0.5988
 epoch: 52, train_loss: 0.8196, test_loss: 1.0279, test_f1: 0.5459
 epoch: 53, train_loss: 0.8142, test_loss: 1.0059, test_f1: 0.5695
 epoch: 54, train_loss: 0.8098, test_loss: 0.9882, test_f1: 0.6102
 epoch: 55, train_loss: 0.7992, test_loss: 1.0134, test_f1: 0.5844
 epoch: 56, train_loss: 0.8100, test_loss: 1.0231, test_f1: 0.6324
 epoch: 57, train_loss: 0.8008, test_loss: 1.0354, test_f1: 0.5233
 epoch: 58, train_loss: 0.8106, test_loss: 1.0329, test_f1: 0.5124
 epoch: 59, train_loss: 0.8162, test_loss: 1.0402, test_f1: 0.5288
 epoch: 60, train_loss: 0.7973, test_loss: 0.9900, test_f1: 0.5855
 epoch: 61, train_loss: 0.8090, test_loss: 1.0439, test_f1: 0.5632
 epoch: 62, train_loss: 0.8005, test_loss: 1.0983, test_f1: 0.5452
 epoch: 63, train_loss: 0.8250, test_loss: 1.1653, test_f1: 0.5674
 epoch: 64, train_loss: 0.8246, test_loss: 0.9784, test_f1: 0.6013
 epoch: 65, train_loss: 0.7893, test_loss: 1.0088, test_f1: 0.6021
 epoch: 66, train_loss: 0.8119, test_loss: 1.0554, test_f1: 0.5983
 epoch: 67, train_loss: 0.7815, test_loss: 1.0378, test_f1: 0.5311
 epoch: 68, train_loss: 0.7758, test_loss: 1.0623, test_f1: 0.5408
 epoch: 69, train_loss: 0.7853, test_loss: 1.0959, test_f1: 0.5195
 epoch: 70, train_loss: 0.7652, test_loss: 1.0416, test_f1: 0.5962
 epoch: 71, train_loss: 0.7530, test_loss: 1.0265, test_f1: 0.5523
 epoch: 72, train_loss: 0.7569, test_loss: 0.9885, test_f1: 0.5808
 epoch: 73, train_loss: 0.7593, test_loss: 1.0339, test_f1: 0.5616
 epoch: 74, train_loss: 0.7654, test_loss: 1.0246, test_f1: 0.6200
 epoch: 75, train_loss: 0.7389, test_loss: 0.9729, test_f1: 0.5808
 epoch: 76, train_loss: 0.7521, test_loss: 1.0000, test_f1: 0.5573
 epoch: 77, train_loss: 0.7530, test_loss: 0.9593, test_f1: 0.5513
 epoch: 78, train_loss: 0.7482, test_loss: 1.1605, test_f1: 0.5008
 epoch: 79, train_loss: 0.7803, test_loss: 1.0645, test_f1: 0.6019
 epoch: 80, train_loss: 0.7855, test_loss: 1.0421, test_f1: 0.5753
 epoch: 81, train_loss: 0.7587, test_loss: 0.9977, test_f1: 0.5795
 epoch: 82, train_loss: 0.7554, test_loss: 1.0207, test_f1: 0.5700
 epoch: 83, train_loss: 0.7385, test_loss: 0.9490, test_f1: 0.6206
 epoch: 84, train_loss: 0.7197, test_loss: 1.0853, test_f1: 0.5798
 epoch: 85, train_loss: 0.7415, test_loss: 1.0773, test_f1: 0.6018
 epoch: 86, train_loss: 0.8376, test_loss: 1.1916, test_f1: 0.5064
 epoch: 87, train_loss: 0.8014, test_loss: 1.2333, test_f1: 0.5438
 epoch: 88, train_loss: 0.7752, test_loss: 1.1499, test_f1: 0.5361
 epoch: 89, train_loss: 0.7701, test_loss: 0.9755, test_f1: 0.5833
 epoch: 90, train_loss: 0.7514, test_loss: 0.9451, test_f1: 0.5932
 epoch: 91, train_loss: 0.7347, test_loss: 0.9821, test_f1: 0.6110
 epoch: 92, train_loss: 0.7237, test_loss: 0.9565, test_f1: 0.6093
 epoch: 93, train_loss: 0.7155, test_loss: 0.9940, test_f1: 0.6192
 epoch: 94, train_loss: 0.7170, test_loss: 1.0812, test_f1: 0.5988
 epoch: 95, train_loss: 0.7398, test_loss: 1.0642, test_f1: 0.5864
 epoch: 96, train_loss: 0.7221, test_loss: 1.1626, test_f1: 0.5428
 epoch: 97, train_loss: 0.7158, test_loss: 1.1090, test_f1: 0.5284
 epoch: 98, train_loss: 0.7140, test_loss: 1.0371, test_f1: 0.5441
 epoch: 99, train_loss: 0.7122, test_loss: 0.9708, test_f1: 0.5558
##################ITERATION #2 ****************************************
 epoch: 0, train_loss: 1.2290, test_loss: 1.3791, test_f1: 0.3096
 epoch: 1, train_loss: 1.1447, test_loss: 1.3247, test_f1: 0.2281
 epoch: 2, train_loss: 1.0960, test_loss: 1.2573, test_f1: 0.2281
 epoch: 3, train_loss: 1.0708, test_loss: 1.2172, test_f1: 0.3153
 epoch: 4, train_loss: 1.0505, test_loss: 1.2135, test_f1: 0.4006
 epoch: 5, train_loss: 1.0332, test_loss: 1.1733, test_f1: 0.3815
 epoch: 6, train_loss: 1.0105, test_loss: 1.1728, test_f1: 0.3536
 epoch: 7, train_loss: 0.9925, test_loss: 1.1486, test_f1: 0.4036
 epoch: 8, train_loss: 0.9980, test_loss: 1.2016, test_f1: 0.3967
 epoch: 9, train_loss: 0.9906, test_loss: 1.1659, test_f1: 0.4606
 epoch: 10, train_loss: 0.9760, test_loss: 1.2021, test_f1: 0.4996
 epoch: 11, train_loss: 0.9537, test_loss: 1.2074, test_f1: 0.4564
 epoch: 12, train_loss: 0.9468, test_loss: 1.0910, test_f1: 0.4531
 epoch: 13, train_loss: 0.9248, test_loss: 1.0815, test_f1: 0.5232
 epoch: 14, train_loss: 0.9283, test_loss: 1.0813, test_f1: 0.5312
 epoch: 15, train_loss: 0.9328, test_loss: 1.0744, test_f1: 0.4749
 epoch: 16, train_loss: 0.9093, test_loss: 1.0540, test_f1: 0.4834
 epoch: 17, train_loss: 0.9278, test_loss: 1.0230, test_f1: 0.4964
 epoch: 18, train_loss: 0.9095, test_loss: 1.1270, test_f1: 0.5069
 epoch: 19, train_loss: 0.9119, test_loss: 1.2771, test_f1: 0.4954
 epoch: 20, train_loss: 0.9068, test_loss: 1.1365, test_f1: 0.5022
 epoch: 21, train_loss: 0.8910, test_loss: 1.1344, test_f1: 0.4639
 epoch: 22, train_loss: 0.8889, test_loss: 1.0711, test_f1: 0.4749
 epoch: 23, train_loss: 0.8721, test_loss: 1.0624, test_f1: 0.5193
 epoch: 24, train_loss: 0.8741, test_loss: 1.4307, test_f1: 0.4787
 epoch: 25, train_loss: 0.8707, test_loss: 1.3489, test_f1: 0.4546
 epoch: 26, train_loss: 0.8732, test_loss: 1.0898, test_f1: 0.5027
 epoch: 27, train_loss: 0.8605, test_loss: 1.2060, test_f1: 0.5022
 epoch: 28, train_loss: 0.8666, test_loss: 1.2283, test_f1: 0.5021
 epoch: 29, train_loss: 0.8818, test_loss: 1.1884, test_f1: 0.5049
 epoch: 30, train_loss: 0.8777, test_loss: 1.2281, test_f1: 0.4298
 epoch: 31, train_loss: 0.8675, test_loss: 1.0699, test_f1: 0.5308
 epoch: 32, train_loss: 0.8385, test_loss: 1.1317, test_f1: 0.5333
 epoch: 33, train_loss: 0.8553, test_loss: 1.0997, test_f1: 0.5032
 epoch: 34, train_loss: 0.8654, test_loss: 1.1062, test_f1: 0.4972
 epoch: 35, train_loss: 0.8705, test_loss: 1.1280, test_f1: 0.4473
 epoch: 36, train_loss: 0.8521, test_loss: 1.0995, test_f1: 0.5060
 epoch: 37, train_loss: 0.8479, test_loss: 1.4125, test_f1: 0.5017
 epoch: 38, train_loss: 0.8642, test_loss: 1.1768, test_f1: 0.4644
 epoch: 39, train_loss: 0.8510, test_loss: 1.1901, test_f1: 0.5189
 epoch: 40, train_loss: 0.8346, test_loss: 1.1361, test_f1: 0.5384
 epoch: 41, train_loss: 0.8218, test_loss: 1.3015, test_f1: 0.4811
 epoch: 42, train_loss: 0.8437, test_loss: 1.3353, test_f1: 0.5256
 epoch: 43, train_loss: 0.8340, test_loss: 1.1334, test_f1: 0.5176
 epoch: 44, train_loss: 0.8461, test_loss: 1.2347, test_f1: 0.5476
 epoch: 45, train_loss: 0.8663, test_loss: 1.2381, test_f1: 0.5011
 epoch: 46, train_loss: 0.8496, test_loss: 1.0385, test_f1: 0.5335
 epoch: 47, train_loss: 0.8394, test_loss: 1.0393, test_f1: 0.5207
 epoch: 48, train_loss: 0.8440, test_loss: 1.1822, test_f1: 0.5075
 epoch: 49, train_loss: 0.8358, test_loss: 1.0273, test_f1: 0.5255
 epoch: 50, train_loss: 0.8464, test_loss: 1.1337, test_f1: 0.5182
 epoch: 51, train_loss: 0.8344, test_loss: 1.0814, test_f1: 0.5343
 epoch: 52, train_loss: 0.8284, test_loss: 1.0488, test_f1: 0.5439
 epoch: 53, train_loss: 0.8056, test_loss: 1.0481, test_f1: 0.5296
 epoch: 54, train_loss: 0.8063, test_loss: 1.0615, test_f1: 0.5368
 epoch: 55, train_loss: 0.7979, test_loss: 1.0559, test_f1: 0.5861
 epoch: 56, train_loss: 0.7925, test_loss: 1.0893, test_f1: 0.5452
 epoch: 57, train_loss: 0.7860, test_loss: 1.0670, test_f1: 0.5657
 epoch: 58, train_loss: 0.7599, test_loss: 1.0817, test_f1: 0.5965
 epoch: 59, train_loss: 0.7682, test_loss: 1.0591, test_f1: 0.5712
 epoch: 60, train_loss: 0.7702, test_loss: 1.0768, test_f1: 0.5926
 epoch: 61, train_loss: 0.7589, test_loss: 1.0395, test_f1: 0.5622
 epoch: 62, train_loss: 0.7618, test_loss: 1.0785, test_f1: 0.6040
 epoch: 63, train_loss: 0.7447, test_loss: 1.1175, test_f1: 0.5790
 epoch: 64, train_loss: 0.7631, test_loss: 1.1133, test_f1: 0.5786
 epoch: 65, train_loss: 0.7820, test_loss: 1.1239, test_f1: 0.5324
 epoch: 66, train_loss: 0.7513, test_loss: 1.0862, test_f1: 0.5492
 epoch: 67, train_loss: 0.7625, test_loss: 1.0937, test_f1: 0.5719
 epoch: 68, train_loss: 0.7683, test_loss: 1.0637, test_f1: 0.5608
 epoch: 69, train_loss: 0.7520, test_loss: 1.0663, test_f1: 0.5863
 epoch: 70, train_loss: 0.7606, test_loss: 1.1258, test_f1: 0.6067
 epoch: 71, train_loss: 0.7569, test_loss: 1.0979, test_f1: 0.5964
 epoch: 72, train_loss: 0.7582, test_loss: 1.1527, test_f1: 0.5481
 epoch: 73, train_loss: 0.7938, test_loss: 1.0870, test_f1: 0.5258
 epoch: 74, train_loss: 0.7699, test_loss: 1.1210, test_f1: 0.5717
 epoch: 75, train_loss: 0.7519, test_loss: 1.0131, test_f1: 0.6182
 epoch: 76, train_loss: 0.7355, test_loss: 1.0506, test_f1: 0.6362
 epoch: 77, train_loss: 0.7271, test_loss: 1.1072, test_f1: 0.5992
 epoch: 78, train_loss: 0.7547, test_loss: 1.0717, test_f1: 0.5834
 epoch: 79, train_loss: 0.7658, test_loss: 1.1290, test_f1: 0.5765
 epoch: 80, train_loss: 0.7718, test_loss: 1.2719, test_f1: 0.4854
 epoch: 81, train_loss: 0.7728, test_loss: 1.1213, test_f1: 0.5501
 epoch: 82, train_loss: 0.7694, test_loss: 1.0720, test_f1: 0.6020
 epoch: 83, train_loss: 0.7845, test_loss: 1.0582, test_f1: 0.5381
 epoch: 84, train_loss: 0.7503, test_loss: 1.0672, test_f1: 0.5879
 epoch: 85, train_loss: 0.7604, test_loss: 1.0941, test_f1: 0.5770
 epoch: 86, train_loss: 0.7421, test_loss: 1.0698, test_f1: 0.4838
 epoch: 87, train_loss: 0.7515, test_loss: 0.9943, test_f1: 0.5147
 epoch: 88, train_loss: 0.7233, test_loss: 1.0043, test_f1: 0.6006
 epoch: 89, train_loss: 0.7257, test_loss: 1.1068, test_f1: 0.5958
 epoch: 90, train_loss: 0.7157, test_loss: 1.1159, test_f1: 0.5781
 epoch: 91, train_loss: 0.7242, test_loss: 1.0896, test_f1: 0.5762
 epoch: 92, train_loss: 0.7203, test_loss: 1.1104, test_f1: 0.5604
 epoch: 93, train_loss: 0.7072, test_loss: 1.0127, test_f1: 0.5969
 epoch: 94, train_loss: 0.7002, test_loss: 1.0682, test_f1: 0.5849
 epoch: 95, train_loss: 0.7025, test_loss: 1.0978, test_f1: 0.5722
 epoch: 96, train_loss: 0.6934, test_loss: 1.1077, test_f1: 0.5719
 epoch: 97, train_loss: 0.6846, test_loss: 1.1657, test_f1: 0.5947
 epoch: 98, train_loss: 0.6767, test_loss: 1.1789, test_f1: 0.5353
 epoch: 99, train_loss: 0.6698, test_loss: 1.1828, test_f1: 0.5587
##################ITERATION #3 ****************************************
 epoch: 0, train_loss: 1.2620, test_loss: 1.5079, test_f1: 0.2281
 epoch: 1, train_loss: 1.1456, test_loss: 1.4089, test_f1: 0.2281
 epoch: 2, train_loss: 1.0695, test_loss: 1.2563, test_f1: 0.2281
 epoch: 3, train_loss: 1.0685, test_loss: 1.1626, test_f1: 0.3421
 epoch: 4, train_loss: 1.0417, test_loss: 1.2588, test_f1: 0.2774
 epoch: 5, train_loss: 1.0327, test_loss: 1.2419, test_f1: 0.3410
 epoch: 6, train_loss: 1.0125, test_loss: 1.2700, test_f1: 0.3343
 epoch: 7, train_loss: 0.9957, test_loss: 1.4343, test_f1: 0.3250
 epoch: 8, train_loss: 0.9959, test_loss: 1.1098, test_f1: 0.3801
 epoch: 9, train_loss: 0.9867, test_loss: 1.1479, test_f1: 0.3370
 epoch: 10, train_loss: 0.9852, test_loss: 1.1252, test_f1: 0.3468
 epoch: 11, train_loss: 0.9722, test_loss: 1.1223, test_f1: 0.4426
 epoch: 12, train_loss: 0.9757, test_loss: 1.1423, test_f1: 0.3391
 epoch: 13, train_loss: 0.9734, test_loss: 1.1693, test_f1: 0.3826
 epoch: 14, train_loss: 0.9632, test_loss: 1.1584, test_f1: 0.3924
 epoch: 15, train_loss: 0.9778, test_loss: 1.1362, test_f1: 0.4731
 epoch: 16, train_loss: 0.9636, test_loss: 1.1020, test_f1: 0.4777
 epoch: 17, train_loss: 0.9462, test_loss: 1.0923, test_f1: 0.4807
 epoch: 18, train_loss: 0.9495, test_loss: 1.1374, test_f1: 0.4720
 epoch: 19, train_loss: 0.9509, test_loss: 1.1936, test_f1: 0.4361
 epoch: 20, train_loss: 0.9741, test_loss: 1.1010, test_f1: 0.3966
 epoch: 21, train_loss: 0.9518, test_loss: 1.1425, test_f1: 0.3610
 epoch: 22, train_loss: 0.9492, test_loss: 1.1684, test_f1: 0.4447
 epoch: 23, train_loss: 0.9486, test_loss: 1.0521, test_f1: 0.4680
 epoch: 24, train_loss: 0.9243, test_loss: 1.0517, test_f1: 0.5223
 epoch: 25, train_loss: 0.9119, test_loss: 1.0859, test_f1: 0.5056
 epoch: 26, train_loss: 0.9127, test_loss: 1.0520, test_f1: 0.4996
 epoch: 27, train_loss: 0.8860, test_loss: 1.0090, test_f1: 0.5514
 epoch: 28, train_loss: 0.9012, test_loss: 1.2726, test_f1: 0.4557
 epoch: 29, train_loss: 0.9009, test_loss: 1.0146, test_f1: 0.5251
 epoch: 30, train_loss: 0.9129, test_loss: 1.0945, test_f1: 0.4843
 epoch: 31, train_loss: 0.8878, test_loss: 1.0768, test_f1: 0.4491
 epoch: 32, train_loss: 0.8761, test_loss: 1.0191, test_f1: 0.4255
 epoch: 33, train_loss: 0.8891, test_loss: 1.0958, test_f1: 0.4509
 epoch: 34, train_loss: 0.8824, test_loss: 1.1692, test_f1: 0.4529
 epoch: 35, train_loss: 0.8912, test_loss: 1.0249, test_f1: 0.5585
 epoch: 36, train_loss: 0.8757, test_loss: 1.4125, test_f1: 0.3963
 epoch: 37, train_loss: 0.8685, test_loss: 1.0613, test_f1: 0.4639
 epoch: 38, train_loss: 0.8746, test_loss: 0.9841, test_f1: 0.5549
 epoch: 39, train_loss: 0.8610, test_loss: 1.0900, test_f1: 0.5305
 epoch: 40, train_loss: 0.8524, test_loss: 1.2828, test_f1: 0.4780
 epoch: 41, train_loss: 0.8552, test_loss: 1.2684, test_f1: 0.4732
 epoch: 42, train_loss: 0.8413, test_loss: 1.2245, test_f1: 0.4987
 epoch: 43, train_loss: 0.8426, test_loss: 1.1368, test_f1: 0.5013
 epoch: 44, train_loss: 0.8354, test_loss: 1.0751, test_f1: 0.4962
 epoch: 45, train_loss: 0.8410, test_loss: 1.0211, test_f1: 0.5712
 epoch: 46, train_loss: 0.8460, test_loss: 1.1310, test_f1: 0.5475
 epoch: 47, train_loss: 0.8435, test_loss: 1.2294, test_f1: 0.5227
 epoch: 48, train_loss: 0.8530, test_loss: 1.1449, test_f1: 0.4899
 epoch: 49, train_loss: 0.8288, test_loss: 1.0999, test_f1: 0.5066
 epoch: 50, train_loss: 0.8241, test_loss: 1.0510, test_f1: 0.5351
 epoch: 51, train_loss: 0.8161, test_loss: 1.0808, test_f1: 0.5235
 epoch: 52, train_loss: 0.7933, test_loss: 1.0140, test_f1: 0.5728
 epoch: 53, train_loss: 0.7796, test_loss: 1.0512, test_f1: 0.5486
 epoch: 54, train_loss: 0.7867, test_loss: 1.2022, test_f1: 0.5190
 epoch: 55, train_loss: 0.7759, test_loss: 1.1043, test_f1: 0.5895
 epoch: 56, train_loss: 0.7797, test_loss: 1.0547, test_f1: 0.5927
 epoch: 57, train_loss: 0.7709, test_loss: 1.0538, test_f1: 0.5443
 epoch: 58, train_loss: 0.7788, test_loss: 1.0219, test_f1: 0.5385
 epoch: 59, train_loss: 0.7610, test_loss: 1.0305, test_f1: 0.5573
 epoch: 60, train_loss: 0.7719, test_loss: 1.0732, test_f1: 0.5556
 epoch: 61, train_loss: 0.7442, test_loss: 1.1509, test_f1: 0.5291
 epoch: 62, train_loss: 0.7267, test_loss: 1.0728, test_f1: 0.5870
 epoch: 63, train_loss: 0.7445, test_loss: 1.0384, test_f1: 0.5812
 epoch: 64, train_loss: 0.7512, test_loss: 1.0551, test_f1: 0.5623
 epoch: 65, train_loss: 0.7505, test_loss: 1.1484, test_f1: 0.5567
 epoch: 66, train_loss: 0.7326, test_loss: 1.1071, test_f1: 0.5488
 epoch: 67, train_loss: 0.7412, test_loss: 1.0441, test_f1: 0.5762
 epoch: 68, train_loss: 0.7431, test_loss: 1.0220, test_f1: 0.5865
 epoch: 69, train_loss: 0.7360, test_loss: 1.1208, test_f1: 0.5257
 epoch: 70, train_loss: 0.7284, test_loss: 1.0518, test_f1: 0.5719
 epoch: 71, train_loss: 0.7428, test_loss: 1.1673, test_f1: 0.5802
 epoch: 72, train_loss: 0.7425, test_loss: 1.2087, test_f1: 0.5388
 epoch: 73, train_loss: 0.7139, test_loss: 1.0934, test_f1: 0.5693
 epoch: 74, train_loss: 0.7376, test_loss: 1.2408, test_f1: 0.5294
 epoch: 75, train_loss: 0.7458, test_loss: 1.0504, test_f1: 0.5626
 epoch: 76, train_loss: 0.7447, test_loss: 1.0544, test_f1: 0.5724
 epoch: 77, train_loss: 0.7291, test_loss: 1.1132, test_f1: 0.5316
 epoch: 78, train_loss: 0.7167, test_loss: 1.1141, test_f1: 0.5314
 epoch: 79, train_loss: 0.7232, test_loss: 1.1442, test_f1: 0.6142
 epoch: 80, train_loss: 0.7106, test_loss: 1.0633, test_f1: 0.6259
 epoch: 81, train_loss: 0.7399, test_loss: 1.1436, test_f1: 0.5307
 epoch: 82, train_loss: 0.7185, test_loss: 1.2865, test_f1: 0.4953
 epoch: 83, train_loss: 0.7215, test_loss: 1.2089, test_f1: 0.5236
 epoch: 84, train_loss: 0.7584, test_loss: 1.1259, test_f1: 0.5361
 epoch: 85, train_loss: 0.7668, test_loss: 1.2172, test_f1: 0.4993
 epoch: 86, train_loss: 0.7358, test_loss: 1.1018, test_f1: 0.5920
 epoch: 87, train_loss: 0.7051, test_loss: 1.0409, test_f1: 0.6267
 epoch: 88, train_loss: 0.7132, test_loss: 1.0605, test_f1: 0.5887
 epoch: 89, train_loss: 0.6957, test_loss: 1.2378, test_f1: 0.5925
 epoch: 90, train_loss: 0.7030, test_loss: 1.1140, test_f1: 0.5910
 epoch: 91, train_loss: 0.7057, test_loss: 1.0544, test_f1: 0.6251
 epoch: 92, train_loss: 0.7127, test_loss: 1.2104, test_f1: 0.5401
 epoch: 93, train_loss: 0.7028, test_loss: 1.2206, test_f1: 0.5614
 epoch: 94, train_loss: 0.7023, test_loss: 1.3234, test_f1: 0.5844
 epoch: 95, train_loss: 0.7103, test_loss: 1.1613, test_f1: 0.6189
 epoch: 96, train_loss: 0.6968, test_loss: 1.1367, test_f1: 0.6197
 epoch: 97, train_loss: 0.7053, test_loss: 1.1432, test_f1: 0.5935
 epoch: 98, train_loss: 0.7115, test_loss: 1.1689, test_f1: 0.5797
 epoch: 99, train_loss: 0.6890, test_loss: 1.1719, test_f1: 0.5787
##################ITERATION #4 ****************************************
 epoch: 0, train_loss: 1.2513, test_loss: 1.2791, test_f1: 0.2281
 epoch: 1, train_loss: 1.1042, test_loss: 1.2866, test_f1: 0.2828
 epoch: 2, train_loss: 1.0678, test_loss: 1.2804, test_f1: 0.2815
 epoch: 3, train_loss: 1.0558, test_loss: 1.2981, test_f1: 0.3601
 epoch: 4, train_loss: 1.0464, test_loss: 1.2528, test_f1: 0.3919
 epoch: 5, train_loss: 1.0429, test_loss: 1.1495, test_f1: 0.4813
 epoch: 6, train_loss: 1.0024, test_loss: 1.1184, test_f1: 0.4925
 epoch: 7, train_loss: 0.9862, test_loss: 1.0600, test_f1: 0.5338
 epoch: 8, train_loss: 0.9765, test_loss: 1.0573, test_f1: 0.5236
 epoch: 9, train_loss: 0.9648, test_loss: 1.1037, test_f1: 0.5322
 epoch: 10, train_loss: 0.9802, test_loss: 1.1835, test_f1: 0.4805
 epoch: 11, train_loss: 0.9808, test_loss: 1.0784, test_f1: 0.5223
 epoch: 12, train_loss: 0.9594, test_loss: 1.1299, test_f1: 0.5130
 epoch: 13, train_loss: 0.9455, test_loss: 1.1913, test_f1: 0.5256
 epoch: 14, train_loss: 0.9340, test_loss: 1.1995, test_f1: 0.5140
 epoch: 15, train_loss: 0.9261, test_loss: 1.1157, test_f1: 0.5352
 epoch: 16, train_loss: 0.9569, test_loss: 1.1913, test_f1: 0.4458
 epoch: 17, train_loss: 0.9123, test_loss: 1.1219, test_f1: 0.5403
 epoch: 18, train_loss: 0.9065, test_loss: 1.1910, test_f1: 0.3752
 epoch: 19, train_loss: 0.8966, test_loss: 1.1513, test_f1: 0.5405
 epoch: 20, train_loss: 0.9042, test_loss: 1.1789, test_f1: 0.5102
 epoch: 21, train_loss: 0.9005, test_loss: 1.1208, test_f1: 0.5110
 epoch: 22, train_loss: 0.8820, test_loss: 1.0526, test_f1: 0.5149
 epoch: 23, train_loss: 0.9071, test_loss: 1.1748, test_f1: 0.5883
 epoch: 24, train_loss: 0.8853, test_loss: 1.3306, test_f1: 0.5214
 epoch: 25, train_loss: 0.8850, test_loss: 1.2477, test_f1: 0.4283
 epoch: 26, train_loss: 0.8762, test_loss: 1.1382, test_f1: 0.5537
 epoch: 27, train_loss: 0.8694, test_loss: 1.1326, test_f1: 0.5369
 epoch: 28, train_loss: 0.8484, test_loss: 1.1718, test_f1: 0.4597
 epoch: 29, train_loss: 0.8693, test_loss: 1.1320, test_f1: 0.5377
 epoch: 30, train_loss: 0.8675, test_loss: 1.1015, test_f1: 0.5592
 epoch: 31, train_loss: 0.8674, test_loss: 1.0752, test_f1: 0.5381
 epoch: 32, train_loss: 0.8684, test_loss: 1.1968, test_f1: 0.4945
 epoch: 33, train_loss: 0.8782, test_loss: 1.2300, test_f1: 0.4618
 epoch: 34, train_loss: 0.8364, test_loss: 1.1341, test_f1: 0.4970
 epoch: 35, train_loss: 0.8462, test_loss: 1.2436, test_f1: 0.4941
 epoch: 36, train_loss: 0.8580, test_loss: 1.0907, test_f1: 0.5620
 epoch: 37, train_loss: 0.8513, test_loss: 1.0144, test_f1: 0.6089
 epoch: 38, train_loss: 0.8371, test_loss: 0.9925, test_f1: 0.6019
 epoch: 39, train_loss: 0.8711, test_loss: 1.1390, test_f1: 0.4702
 epoch: 40, train_loss: 0.8530, test_loss: 1.0882, test_f1: 0.5279
 epoch: 41, train_loss: 0.8179, test_loss: 0.9992, test_f1: 0.5774
 epoch: 42, train_loss: 0.8468, test_loss: 1.1602, test_f1: 0.5374
 epoch: 43, train_loss: 0.8324, test_loss: 1.1967, test_f1: 0.5443
 epoch: 44, train_loss: 0.8450, test_loss: 1.1989, test_f1: 0.5935
 epoch: 45, train_loss: 0.8319, test_loss: 1.0059, test_f1: 0.5587
 epoch: 46, train_loss: 0.8136, test_loss: 1.0801, test_f1: 0.5813
 epoch: 47, train_loss: 0.8348, test_loss: 1.1664, test_f1: 0.5490
 epoch: 48, train_loss: 0.8084, test_loss: 0.9623, test_f1: 0.6041
 epoch: 49, train_loss: 0.8031, test_loss: 1.0100, test_f1: 0.5785
 epoch: 50, train_loss: 0.8429, test_loss: 1.0078, test_f1: 0.6034
 epoch: 51, train_loss: 0.8058, test_loss: 1.0969, test_f1: 0.5368
 epoch: 52, train_loss: 0.8052, test_loss: 1.2691, test_f1: 0.5219
 epoch: 53, train_loss: 0.8223, test_loss: 1.1407, test_f1: 0.5509
 epoch: 54, train_loss: 0.7977, test_loss: 1.0409, test_f1: 0.5529
 epoch: 55, train_loss: 0.7877, test_loss: 1.0190, test_f1: 0.5636
 epoch: 56, train_loss: 0.7707, test_loss: 1.0000, test_f1: 0.6036
 epoch: 57, train_loss: 0.7601, test_loss: 1.0105, test_f1: 0.5969
 epoch: 58, train_loss: 0.7423, test_loss: 1.0227, test_f1: 0.6314
 epoch: 59, train_loss: 0.7527, test_loss: 1.0155, test_f1: 0.6240
 epoch: 60, train_loss: 0.7410, test_loss: 0.9695, test_f1: 0.5982
 epoch: 61, train_loss: 0.7219, test_loss: 0.9890, test_f1: 0.6345
 epoch: 62, train_loss: 0.7099, test_loss: 0.9929, test_f1: 0.5800
 epoch: 63, train_loss: 0.7738, test_loss: 1.0808, test_f1: 0.4948
 epoch: 64, train_loss: 0.7633, test_loss: 1.0400, test_f1: 0.5459
 epoch: 65, train_loss: 0.7871, test_loss: 1.0147, test_f1: 0.5902
 epoch: 66, train_loss: 0.7672, test_loss: 0.9915, test_f1: 0.6298
 epoch: 67, train_loss: 0.7465, test_loss: 1.0959, test_f1: 0.5667
 epoch: 68, train_loss: 0.7403, test_loss: 1.1458, test_f1: 0.6232
 epoch: 69, train_loss: 0.7396, test_loss: 1.0251, test_f1: 0.6247
 epoch: 70, train_loss: 0.7339, test_loss: 1.0264, test_f1: 0.6283
 epoch: 71, train_loss: 0.7085, test_loss: 0.9355, test_f1: 0.6158
 epoch: 72, train_loss: 0.7122, test_loss: 1.0132, test_f1: 0.5945
 epoch: 73, train_loss: 0.7033, test_loss: 1.1022, test_f1: 0.5486
 epoch: 74, train_loss: 0.7234, test_loss: 1.0217, test_f1: 0.6358
 epoch: 75, train_loss: 0.7048, test_loss: 0.9923, test_f1: 0.6403
 epoch: 76, train_loss: 0.7119, test_loss: 1.0815, test_f1: 0.5873
 epoch: 77, train_loss: 0.7024, test_loss: 1.1044, test_f1: 0.6130
 epoch: 78, train_loss: 0.7017, test_loss: 1.1081, test_f1: 0.6157
 epoch: 79, train_loss: 0.7034, test_loss: 1.0677, test_f1: 0.6304
 epoch: 80, train_loss: 0.7014, test_loss: 1.1167, test_f1: 0.6032
 epoch: 81, train_loss: 0.7224, test_loss: 1.0446, test_f1: 0.6265
 epoch: 82, train_loss: 0.7258, test_loss: 1.2068, test_f1: 0.5912
 epoch: 83, train_loss: 0.7098, test_loss: 1.1155, test_f1: 0.5753
 epoch: 84, train_loss: 0.6887, test_loss: 1.1848, test_f1: 0.5684
 epoch: 85, train_loss: 0.6981, test_loss: 1.0638, test_f1: 0.6007
 epoch: 86, train_loss: 0.6940, test_loss: 1.1709, test_f1: 0.5787
 epoch: 87, train_loss: 0.6714, test_loss: 1.2559, test_f1: 0.5876
 epoch: 88, train_loss: 0.6865, test_loss: 1.1483, test_f1: 0.5922
 epoch: 89, train_loss: 0.7045, test_loss: 1.0818, test_f1: 0.5805
 epoch: 90, train_loss: 0.6564, test_loss: 1.1864, test_f1: 0.6007
 epoch: 91, train_loss: 0.6738, test_loss: 1.2572, test_f1: 0.5763
 epoch: 92, train_loss: 0.6797, test_loss: 1.3526, test_f1: 0.5024
 epoch: 93, train_loss: 0.6902, test_loss: 1.1608, test_f1: 0.5677
 epoch: 94, train_loss: 0.6726, test_loss: 1.0691, test_f1: 0.5628
 epoch: 95, train_loss: 0.6922, test_loss: 1.0635, test_f1: 0.6114
 epoch: 96, train_loss: 0.6790, test_loss: 1.1401, test_f1: 0.5905
 epoch: 97, train_loss: 0.6597, test_loss: 1.1452, test_f1: 0.6014
 epoch: 98, train_loss: 0.6882, test_loss: 1.2426, test_f1: 0.5705
 epoch: 99, train_loss: 0.6785, test_loss: 1.0134, test_f1: 0.6233
##################ITERATION #5 ****************************************
 epoch: 0, train_loss: 1.5397, test_loss: 1.4278, test_f1: 0.2281
 epoch: 1, train_loss: 1.1857, test_loss: 1.3239, test_f1: 0.2583
 epoch: 2, train_loss: 1.1125, test_loss: 1.2847, test_f1: 0.3232
 epoch: 3, train_loss: 1.0652, test_loss: 1.2277, test_f1: 0.4244
 epoch: 4, train_loss: 1.0306, test_loss: 1.1617, test_f1: 0.4604
 epoch: 5, train_loss: 1.0050, test_loss: 1.1080, test_f1: 0.4810
 epoch: 6, train_loss: 1.0106, test_loss: 1.1657, test_f1: 0.4461
 epoch: 7, train_loss: 1.0094, test_loss: 1.1608, test_f1: 0.4212
 epoch: 8, train_loss: 0.9879, test_loss: 1.1389, test_f1: 0.4697
 epoch: 9, train_loss: 0.9771, test_loss: 1.0870, test_f1: 0.5023
 epoch: 10, train_loss: 0.9512, test_loss: 1.0679, test_f1: 0.5188
 epoch: 11, train_loss: 0.9720, test_loss: 1.0732, test_f1: 0.5078
 epoch: 12, train_loss: 0.9582, test_loss: 1.0612, test_f1: 0.4569
 epoch: 13, train_loss: 0.9647, test_loss: 1.0773, test_f1: 0.5149
 epoch: 14, train_loss: 0.9455, test_loss: 1.0318, test_f1: 0.5267
 epoch: 15, train_loss: 0.9340, test_loss: 1.0227, test_f1: 0.5687
 epoch: 16, train_loss: 0.9116, test_loss: 1.0825, test_f1: 0.5153
 epoch: 17, train_loss: 0.9011, test_loss: 1.0665, test_f1: 0.5214
 epoch: 18, train_loss: 0.9176, test_loss: 1.1100, test_f1: 0.5513
 epoch: 19, train_loss: 0.9110, test_loss: 1.1224, test_f1: 0.5166
 epoch: 20, train_loss: 0.9096, test_loss: 1.1176, test_f1: 0.5204
 epoch: 21, train_loss: 0.9003, test_loss: 1.2194, test_f1: 0.4626
 epoch: 22, train_loss: 0.9002, test_loss: 1.0860, test_f1: 0.5337
 epoch: 23, train_loss: 0.8955, test_loss: 1.0556, test_f1: 0.5176
 epoch: 24, train_loss: 0.8857, test_loss: 1.1351, test_f1: 0.4796
 epoch: 25, train_loss: 0.8845, test_loss: 1.0455, test_f1: 0.5687
 epoch: 26, train_loss: 0.8750, test_loss: 1.0530, test_f1: 0.5611
 epoch: 27, train_loss: 0.8785, test_loss: 1.0173, test_f1: 0.5256
 epoch: 28, train_loss: 0.8879, test_loss: 1.0475, test_f1: 0.5525
 epoch: 29, train_loss: 0.8632, test_loss: 1.1194, test_f1: 0.5451
 epoch: 30, train_loss: 0.8527, test_loss: 1.0673, test_f1: 0.5492
 epoch: 31, train_loss: 0.8885, test_loss: 1.1878, test_f1: 0.5025
 epoch: 32, train_loss: 0.8522, test_loss: 1.0211, test_f1: 0.5668
 epoch: 33, train_loss: 0.8555, test_loss: 1.0771, test_f1: 0.5786
 epoch: 34, train_loss: 0.8460, test_loss: 1.1585, test_f1: 0.5354
 epoch: 35, train_loss: 0.8252, test_loss: 1.1475, test_f1: 0.5404
 epoch: 36, train_loss: 0.8657, test_loss: 1.1866, test_f1: 0.5509
 epoch: 37, train_loss: 0.8717, test_loss: 1.1142, test_f1: 0.5370
 epoch: 38, train_loss: 0.8463, test_loss: 1.0044, test_f1: 0.5416
 epoch: 39, train_loss: 0.8382, test_loss: 1.1386, test_f1: 0.5166
 epoch: 40, train_loss: 0.8319, test_loss: 1.0127, test_f1: 0.5378
 epoch: 41, train_loss: 0.8307, test_loss: 1.0802, test_f1: 0.5701
 epoch: 42, train_loss: 0.8076, test_loss: 1.1199, test_f1: 0.5531
 epoch: 43, train_loss: 0.8201, test_loss: 1.1192, test_f1: 0.5282
 epoch: 44, train_loss: 0.8520, test_loss: 1.1151, test_f1: 0.5600
 epoch: 45, train_loss: 0.8568, test_loss: 1.0669, test_f1: 0.4747
 epoch: 46, train_loss: 0.8010, test_loss: 1.2447, test_f1: 0.4997
 epoch: 47, train_loss: 0.7918, test_loss: 1.1448, test_f1: 0.5560
 epoch: 48, train_loss: 0.7833, test_loss: 1.2892, test_f1: 0.5296
 epoch: 49, train_loss: 0.7838, test_loss: 1.1886, test_f1: 0.5609
 epoch: 50, train_loss: 0.7908, test_loss: 1.0777, test_f1: 0.5477
 epoch: 51, train_loss: 0.8174, test_loss: 1.0368, test_f1: 0.5732
 epoch: 52, train_loss: 0.8027, test_loss: 1.0679, test_f1: 0.5648
 epoch: 53, train_loss: 0.7784, test_loss: 1.0626, test_f1: 0.5873
 epoch: 54, train_loss: 0.7610, test_loss: 1.0961, test_f1: 0.5645
 epoch: 55, train_loss: 0.7504, test_loss: 1.2834, test_f1: 0.5397
 epoch: 56, train_loss: 0.7608, test_loss: 1.3004, test_f1: 0.5333
 epoch: 57, train_loss: 0.7466, test_loss: 1.1815, test_f1: 0.5545
 epoch: 58, train_loss: 0.7405, test_loss: 1.2451, test_f1: 0.5743
 epoch: 59, train_loss: 0.7354, test_loss: 1.2902, test_f1: 0.5781
 epoch: 60, train_loss: 0.7369, test_loss: 1.2032, test_f1: 0.5602
 epoch: 61, train_loss: 0.7312, test_loss: 1.1915, test_f1: 0.5454
 epoch: 62, train_loss: 0.7413, test_loss: 1.2585, test_f1: 0.5494
 epoch: 63, train_loss: 0.7422, test_loss: 1.5242, test_f1: 0.5435
 epoch: 64, train_loss: 0.7136, test_loss: 1.2328, test_f1: 0.5482
 epoch: 65, train_loss: 0.7196, test_loss: 1.2547, test_f1: 0.5502
 epoch: 66, train_loss: 0.7110, test_loss: 1.2621, test_f1: 0.5742
 epoch: 67, train_loss: 0.7100, test_loss: 1.3787, test_f1: 0.5608
 epoch: 68, train_loss: 0.7020, test_loss: 1.3332, test_f1: 0.5653
 epoch: 69, train_loss: 0.7047, test_loss: 1.2993, test_f1: 0.5705
 epoch: 70, train_loss: 0.7250, test_loss: 1.3174, test_f1: 0.5586
 epoch: 71, train_loss: 0.7426, test_loss: 1.2985, test_f1: 0.5607
 epoch: 72, train_loss: 0.7382, test_loss: 1.0969, test_f1: 0.5764
 epoch: 73, train_loss: 0.7223, test_loss: 1.1857, test_f1: 0.5870
 epoch: 74, train_loss: 0.7244, test_loss: 1.2171, test_f1: 0.5597
 epoch: 75, train_loss: 0.7103, test_loss: 1.3341, test_f1: 0.5407
 epoch: 76, train_loss: 0.6941, test_loss: 1.3732, test_f1: 0.5595
 epoch: 77, train_loss: 0.7081, test_loss: 1.3624, test_f1: 0.5059
 epoch: 78, train_loss: 0.6871, test_loss: 1.3009, test_f1: 0.5408
 epoch: 79, train_loss: 0.7227, test_loss: 1.4009, test_f1: 0.5415
 epoch: 80, train_loss: 0.7401, test_loss: 1.2355, test_f1: 0.5714
 epoch: 81, train_loss: 0.7244, test_loss: 1.2509, test_f1: 0.5550
 epoch: 82, train_loss: 0.7088, test_loss: 1.1799, test_f1: 0.5693
 epoch: 83, train_loss: 0.6986, test_loss: 1.1898, test_f1: 0.5572
 epoch: 84, train_loss: 0.7088, test_loss: 1.2216, test_f1: 0.5100
 epoch: 85, train_loss: 0.6926, test_loss: 1.2983, test_f1: 0.5663
 epoch: 86, train_loss: 0.6951, test_loss: 1.2929, test_f1: 0.5789
 epoch: 87, train_loss: 0.6815, test_loss: 1.2694, test_f1: 0.5786
 epoch: 88, train_loss: 0.6926, test_loss: 1.4244, test_f1: 0.5813
 epoch: 89, train_loss: 0.7307, test_loss: 1.2287, test_f1: 0.5850
 epoch: 90, train_loss: 0.7163, test_loss: 1.2587, test_f1: 0.5310
 epoch: 91, train_loss: 0.7141, test_loss: 1.3620, test_f1: 0.4980
 epoch: 92, train_loss: 0.7001, test_loss: 1.2454, test_f1: 0.5685
 epoch: 93, train_loss: 0.6964, test_loss: 1.4668, test_f1: 0.5562
 epoch: 94, train_loss: 0.6913, test_loss: 1.2678, test_f1: 0.5363
 epoch: 95, train_loss: 0.6962, test_loss: 1.3104, test_f1: 0.5539
 epoch: 96, train_loss: 0.6735, test_loss: 1.3435, test_f1: 0.5600
 epoch: 97, train_loss: 0.6800, test_loss: 1.3842, test_f1: 0.4726
 epoch: 98, train_loss: 0.7018, test_loss: 1.2219, test_f1: 0.5072
 epoch: 99, train_loss: 0.7685, test_loss: 1.1695, test_f1: 0.5829
##################ITERATION #6 ****************************************
 epoch: 0, train_loss: 1.3314, test_loss: 1.4025, test_f1: 0.3146
 epoch: 1, train_loss: 1.2078, test_loss: 1.2601, test_f1: 0.2722
 epoch: 2, train_loss: 1.1256, test_loss: 1.2908, test_f1: 0.2720
 epoch: 3, train_loss: 1.0793, test_loss: 1.2856, test_f1: 0.2775
 epoch: 4, train_loss: 1.0554, test_loss: 1.2784, test_f1: 0.2937
 epoch: 5, train_loss: 1.0261, test_loss: 1.2000, test_f1: 0.3871
 epoch: 6, train_loss: 0.9859, test_loss: 1.1778, test_f1: 0.4850
 epoch: 7, train_loss: 0.9961, test_loss: 1.1230, test_f1: 0.4898
 epoch: 8, train_loss: 0.9878, test_loss: 1.1128, test_f1: 0.4334
 epoch: 9, train_loss: 0.9797, test_loss: 1.0768, test_f1: 0.4684
 epoch: 10, train_loss: 0.9489, test_loss: 1.1746, test_f1: 0.3905
 epoch: 11, train_loss: 0.9998, test_loss: 1.1575, test_f1: 0.4669
 epoch: 12, train_loss: 0.9780, test_loss: 1.1923, test_f1: 0.4817
 epoch: 13, train_loss: 0.9554, test_loss: 1.1054, test_f1: 0.5094
 epoch: 14, train_loss: 0.9613, test_loss: 0.9978, test_f1: 0.4872
 epoch: 15, train_loss: 0.9529, test_loss: 1.1329, test_f1: 0.5024
 epoch: 16, train_loss: 0.9332, test_loss: 1.0941, test_f1: 0.4951
 epoch: 17, train_loss: 0.9310, test_loss: 1.0500, test_f1: 0.5516
 epoch: 18, train_loss: 0.9241, test_loss: 1.0973, test_f1: 0.5198
 epoch: 19, train_loss: 0.9180, test_loss: 1.0876, test_f1: 0.5494
 epoch: 20, train_loss: 0.9343, test_loss: 1.0802, test_f1: 0.5167
 epoch: 21, train_loss: 0.9331, test_loss: 1.0603, test_f1: 0.5537
 epoch: 22, train_loss: 0.9250, test_loss: 1.1901, test_f1: 0.4654
 epoch: 23, train_loss: 0.9258, test_loss: 1.1399, test_f1: 0.5092
 epoch: 24, train_loss: 0.9284, test_loss: 1.0602, test_f1: 0.5356
 epoch: 25, train_loss: 0.9133, test_loss: 1.0741, test_f1: 0.5154
 epoch: 26, train_loss: 0.9155, test_loss: 1.0911, test_f1: 0.5123
 epoch: 27, train_loss: 0.9394, test_loss: 1.0984, test_f1: 0.5042
 epoch: 28, train_loss: 0.9279, test_loss: 1.0339, test_f1: 0.5016
 epoch: 29, train_loss: 0.9227, test_loss: 1.0244, test_f1: 0.5379
 epoch: 30, train_loss: 0.9099, test_loss: 1.0539, test_f1: 0.5502
 epoch: 31, train_loss: 0.9020, test_loss: 1.0765, test_f1: 0.5256
 epoch: 32, train_loss: 0.9025, test_loss: 1.1224, test_f1: 0.5111
 epoch: 33, train_loss: 0.8895, test_loss: 1.1030, test_f1: 0.5371
 epoch: 34, train_loss: 0.8756, test_loss: 1.1033, test_f1: 0.5039
 epoch: 35, train_loss: 0.8814, test_loss: 1.0408, test_f1: 0.5716
 epoch: 36, train_loss: 0.8763, test_loss: 1.1794, test_f1: 0.5157
 epoch: 37, train_loss: 0.8552, test_loss: 1.2871, test_f1: 0.4355
 epoch: 38, train_loss: 0.8906, test_loss: 1.0083, test_f1: 0.5386
 epoch: 39, train_loss: 0.8610, test_loss: 1.1845, test_f1: 0.5045
 epoch: 40, train_loss: 0.8534, test_loss: 1.2015, test_f1: 0.5272
 epoch: 41, train_loss: 0.8998, test_loss: 1.1818, test_f1: 0.5028
 epoch: 42, train_loss: 0.8997, test_loss: 1.1452, test_f1: 0.5250
 epoch: 43, train_loss: 0.8812, test_loss: 1.1072, test_f1: 0.5521
 epoch: 44, train_loss: 0.8473, test_loss: 1.1126, test_f1: 0.5181
 epoch: 45, train_loss: 0.8511, test_loss: 1.1089, test_f1: 0.5769
 epoch: 46, train_loss: 0.8484, test_loss: 1.2044, test_f1: 0.5644
 epoch: 47, train_loss: 0.8682, test_loss: 1.1027, test_f1: 0.5448
 epoch: 48, train_loss: 0.8418, test_loss: 1.0876, test_f1: 0.5287
 epoch: 49, train_loss: 0.8391, test_loss: 1.0113, test_f1: 0.5503
 epoch: 50, train_loss: 0.8236, test_loss: 1.1590, test_f1: 0.5349
 epoch: 51, train_loss: 0.8167, test_loss: 1.0779, test_f1: 0.5433
 epoch: 52, train_loss: 0.8289, test_loss: 1.0979, test_f1: 0.5292
 epoch: 53, train_loss: 0.8105, test_loss: 1.1724, test_f1: 0.4478
 epoch: 54, train_loss: 0.8185, test_loss: 1.0674, test_f1: 0.5825
 epoch: 55, train_loss: 0.8088, test_loss: 1.1672, test_f1: 0.5472
 epoch: 56, train_loss: 0.8009, test_loss: 1.1078, test_f1: 0.5387
 epoch: 57, train_loss: 0.8094, test_loss: 1.1162, test_f1: 0.5317
 epoch: 58, train_loss: 0.7944, test_loss: 1.1005, test_f1: 0.5113
 epoch: 59, train_loss: 0.8080, test_loss: 1.1124, test_f1: 0.5321
 epoch: 60, train_loss: 0.7902, test_loss: 1.1936, test_f1: 0.5267
 epoch: 61, train_loss: 0.7898, test_loss: 1.1842, test_f1: 0.5581
 epoch: 62, train_loss: 0.7880, test_loss: 1.2508, test_f1: 0.5669
 epoch: 63, train_loss: 0.7813, test_loss: 1.2913, test_f1: 0.5293
 epoch: 64, train_loss: 0.7758, test_loss: 1.1420, test_f1: 0.5502
 epoch: 65, train_loss: 0.7721, test_loss: 1.1072, test_f1: 0.5265
 epoch: 66, train_loss: 0.7726, test_loss: 1.0714, test_f1: 0.5591
 epoch: 67, train_loss: 0.7554, test_loss: 1.1562, test_f1: 0.5621
 epoch: 68, train_loss: 0.7620, test_loss: 1.1767, test_f1: 0.5638
 epoch: 69, train_loss: 0.7590, test_loss: 1.1760, test_f1: 0.5351
 epoch: 70, train_loss: 0.7796, test_loss: 1.1247, test_f1: 0.5516
 epoch: 71, train_loss: 0.7600, test_loss: 1.0683, test_f1: 0.5594
 epoch: 72, train_loss: 0.7580, test_loss: 1.1960, test_f1: 0.5085
 epoch: 73, train_loss: 0.7545, test_loss: 1.2237, test_f1: 0.5551
 epoch: 74, train_loss: 0.7454, test_loss: 1.1860, test_f1: 0.5554
 epoch: 75, train_loss: 0.7450, test_loss: 1.2017, test_f1: 0.5357
 epoch: 76, train_loss: 0.7610, test_loss: 1.3111, test_f1: 0.5167
 epoch: 77, train_loss: 0.7501, test_loss: 1.2504, test_f1: 0.5512
 epoch: 78, train_loss: 0.7402, test_loss: 1.1563, test_f1: 0.5492
 epoch: 79, train_loss: 0.7676, test_loss: 1.2225, test_f1: 0.5351
 epoch: 80, train_loss: 0.7585, test_loss: 1.2101, test_f1: 0.5566
 epoch: 81, train_loss: 0.7679, test_loss: 1.2270, test_f1: 0.5777
 epoch: 82, train_loss: 0.7405, test_loss: 1.2153, test_f1: 0.5688
 epoch: 83, train_loss: 0.7526, test_loss: 1.1441, test_f1: 0.5816
 epoch: 84, train_loss: 0.7374, test_loss: 1.1815, test_f1: 0.5629
 epoch: 85, train_loss: 0.7342, test_loss: 1.2308, test_f1: 0.5813
 epoch: 86, train_loss: 0.7322, test_loss: 1.1677, test_f1: 0.5525
 epoch: 87, train_loss: 0.7303, test_loss: 1.1434, test_f1: 0.5967
 epoch: 88, train_loss: 0.7362, test_loss: 1.1777, test_f1: 0.5917
 epoch: 89, train_loss: 0.7364, test_loss: 1.2430, test_f1: 0.5699
 epoch: 90, train_loss: 0.7348, test_loss: 1.2626, test_f1: 0.5753
 epoch: 91, train_loss: 0.7196, test_loss: 1.2717, test_f1: 0.5346
 epoch: 92, train_loss: 0.7424, test_loss: 1.1365, test_f1: 0.5786
 epoch: 93, train_loss: 0.7303, test_loss: 1.0910, test_f1: 0.5649
 epoch: 94, train_loss: 0.7286, test_loss: 1.1236, test_f1: 0.5648
 epoch: 95, train_loss: 0.7773, test_loss: 1.1586, test_f1: 0.5457
 epoch: 96, train_loss: 0.7566, test_loss: 1.2085, test_f1: 0.5308
 epoch: 97, train_loss: 0.7468, test_loss: 1.1730, test_f1: 0.5427
 epoch: 98, train_loss: 0.7219, test_loss: 1.1774, test_f1: 0.5446
 epoch: 99, train_loss: 0.7373, test_loss: 1.2356, test_f1: 0.5416
##################ITERATION #7 ****************************************
 epoch: 0, train_loss: 1.3207, test_loss: 1.3329, test_f1: 0.2281
 epoch: 1, train_loss: 1.1871, test_loss: 1.2979, test_f1: 0.2259
 epoch: 2, train_loss: 1.1482, test_loss: 1.2853, test_f1: 0.2676
 epoch: 3, train_loss: 1.1051, test_loss: 1.2375, test_f1: 0.2980
 epoch: 4, train_loss: 1.0743, test_loss: 1.1942, test_f1: 0.3709
 epoch: 5, train_loss: 1.0549, test_loss: 1.1691, test_f1: 0.3733
 epoch: 6, train_loss: 1.0270, test_loss: 1.1129, test_f1: 0.4254
 epoch: 7, train_loss: 1.0220, test_loss: 1.0444, test_f1: 0.5127
 epoch: 8, train_loss: 1.0101, test_loss: 1.0294, test_f1: 0.5338
 epoch: 9, train_loss: 0.9774, test_loss: 1.0530, test_f1: 0.5445
 epoch: 10, train_loss: 0.9777, test_loss: 1.0683, test_f1: 0.5449
 epoch: 11, train_loss: 0.9547, test_loss: 1.1067, test_f1: 0.5166
 epoch: 12, train_loss: 0.9417, test_loss: 1.1313, test_f1: 0.5081
 epoch: 13, train_loss: 0.9430, test_loss: 1.1373, test_f1: 0.5239
 epoch: 14, train_loss: 0.9260, test_loss: 1.1537, test_f1: 0.5015
 epoch: 15, train_loss: 0.9283, test_loss: 1.0647, test_f1: 0.5304
 epoch: 16, train_loss: 0.9439, test_loss: 1.1475, test_f1: 0.5241
 epoch: 17, train_loss: 0.9189, test_loss: 1.0436, test_f1: 0.5558
 epoch: 18, train_loss: 0.9260, test_loss: 1.0927, test_f1: 0.5518
 epoch: 19, train_loss: 0.9034, test_loss: 1.0451, test_f1: 0.5597
 epoch: 20, train_loss: 0.8950, test_loss: 1.0709, test_f1: 0.5215
 epoch: 21, train_loss: 0.8857, test_loss: 1.1219, test_f1: 0.4914
 epoch: 22, train_loss: 0.9051, test_loss: 0.9925, test_f1: 0.5607
 epoch: 23, train_loss: 0.8778, test_loss: 1.0082, test_f1: 0.5210
 epoch: 24, train_loss: 0.9039, test_loss: 1.0902, test_f1: 0.5278
 epoch: 25, train_loss: 0.9234, test_loss: 1.1115, test_f1: 0.5230
 epoch: 26, train_loss: 0.9373, test_loss: 1.2171, test_f1: 0.3486
 epoch: 27, train_loss: 0.9164, test_loss: 1.2444, test_f1: 0.4458
 epoch: 28, train_loss: 0.9276, test_loss: 1.1791, test_f1: 0.5272
 epoch: 29, train_loss: 0.9186, test_loss: 1.1325, test_f1: 0.4944
 epoch: 30, train_loss: 0.8954, test_loss: 1.0091, test_f1: 0.5822
 epoch: 31, train_loss: 0.8904, test_loss: 1.0420, test_f1: 0.5859
 epoch: 32, train_loss: 0.8829, test_loss: 1.1241, test_f1: 0.5135
 epoch: 33, train_loss: 0.8895, test_loss: 1.1296, test_f1: 0.5301
 epoch: 34, train_loss: 0.8890, test_loss: 1.1103, test_f1: 0.4846
 epoch: 35, train_loss: 0.8747, test_loss: 1.0113, test_f1: 0.5857
 epoch: 36, train_loss: 0.8940, test_loss: 1.0023, test_f1: 0.5716
 epoch: 37, train_loss: 0.8797, test_loss: 1.0294, test_f1: 0.5449
 epoch: 38, train_loss: 0.8583, test_loss: 1.0343, test_f1: 0.6054
 epoch: 39, train_loss: 0.8568, test_loss: 1.0101, test_f1: 0.5835
 epoch: 40, train_loss: 0.8424, test_loss: 0.9931, test_f1: 0.5989
 epoch: 41, train_loss: 0.8497, test_loss: 1.0252, test_f1: 0.5928
 epoch: 42, train_loss: 0.8198, test_loss: 1.0504, test_f1: 0.5276
 epoch: 43, train_loss: 0.8504, test_loss: 1.0687, test_f1: 0.5647
 epoch: 44, train_loss: 0.8233, test_loss: 0.9838, test_f1: 0.5906
 epoch: 45, train_loss: 0.8214, test_loss: 1.3129, test_f1: 0.5432
 epoch: 46, train_loss: 0.8309, test_loss: 1.0113, test_f1: 0.6010
 epoch: 47, train_loss: 0.8056, test_loss: 0.9660, test_f1: 0.5797
 epoch: 48, train_loss: 0.8084, test_loss: 1.0496, test_f1: 0.5775
 epoch: 49, train_loss: 0.8251, test_loss: 1.1838, test_f1: 0.5608
 epoch: 50, train_loss: 0.8248, test_loss: 1.1850, test_f1: 0.4878
 epoch: 51, train_loss: 0.8460, test_loss: 1.8580, test_f1: 0.3894
 epoch: 52, train_loss: 0.8908, test_loss: 1.4303, test_f1: 0.4226
 epoch: 53, train_loss: 0.8601, test_loss: 1.3871, test_f1: 0.4360
 epoch: 54, train_loss: 0.8510, test_loss: 1.2416, test_f1: 0.5179
 epoch: 55, train_loss: 0.8398, test_loss: 1.0511, test_f1: 0.5646
 epoch: 56, train_loss: 0.8336, test_loss: 1.0145, test_f1: 0.5859
 epoch: 57, train_loss: 0.8045, test_loss: 1.0075, test_f1: 0.5781
 epoch: 58, train_loss: 0.8084, test_loss: 1.0051, test_f1: 0.5757
 epoch: 59, train_loss: 0.8018, test_loss: 1.0948, test_f1: 0.5848
 epoch: 60, train_loss: 0.8011, test_loss: 1.0996, test_f1: 0.5623
 epoch: 61, train_loss: 0.7844, test_loss: 1.0306, test_f1: 0.5868
 epoch: 62, train_loss: 0.7689, test_loss: 0.9907, test_f1: 0.5715
 epoch: 63, train_loss: 0.7702, test_loss: 1.0169, test_f1: 0.5549
 epoch: 64, train_loss: 0.7700, test_loss: 0.9874, test_f1: 0.5860
 epoch: 65, train_loss: 0.7663, test_loss: 0.9899, test_f1: 0.6018
 epoch: 66, train_loss: 0.7806, test_loss: 1.0567, test_f1: 0.5730
 epoch: 67, train_loss: 0.7777, test_loss: 1.0302, test_f1: 0.5705
 epoch: 68, train_loss: 0.7554, test_loss: 1.0615, test_f1: 0.5650
 epoch: 69, train_loss: 0.7876, test_loss: 1.0258, test_f1: 0.5506
 epoch: 70, train_loss: 0.7913, test_loss: 0.9925, test_f1: 0.5824
 epoch: 71, train_loss: 0.7575, test_loss: 1.0934, test_f1: 0.5478
 epoch: 72, train_loss: 0.7633, test_loss: 1.0382, test_f1: 0.5853
 epoch: 73, train_loss: 0.7325, test_loss: 1.1157, test_f1: 0.5542
 epoch: 74, train_loss: 0.7461, test_loss: 1.0459, test_f1: 0.5735
 epoch: 75, train_loss: 0.7346, test_loss: 1.1179, test_f1: 0.5634
 epoch: 76, train_loss: 0.7478, test_loss: 1.1423, test_f1: 0.5551
 epoch: 77, train_loss: 0.7690, test_loss: 1.1050, test_f1: 0.5626
 epoch: 78, train_loss: 0.7578, test_loss: 1.0950, test_f1: 0.5945
 epoch: 79, train_loss: 0.7475, test_loss: 1.0709, test_f1: 0.5823
 epoch: 80, train_loss: 0.7520, test_loss: 1.0803, test_f1: 0.5844
 epoch: 81, train_loss: 0.7159, test_loss: 1.0743, test_f1: 0.5574
 epoch: 82, train_loss: 0.7237, test_loss: 1.0439, test_f1: 0.5882
 epoch: 83, train_loss: 0.7260, test_loss: 1.1014, test_f1: 0.5487
 epoch: 84, train_loss: 0.7180, test_loss: 0.9881, test_f1: 0.5773
 epoch: 85, train_loss: 0.7390, test_loss: 1.0141, test_f1: 0.5896
 epoch: 86, train_loss: 0.7328, test_loss: 1.0309, test_f1: 0.5873
 epoch: 87, train_loss: 0.7460, test_loss: 1.0654, test_f1: 0.5700
 epoch: 88, train_loss: 0.7131, test_loss: 1.0095, test_f1: 0.5831
 epoch: 89, train_loss: 0.7138, test_loss: 0.9781, test_f1: 0.5716
 epoch: 90, train_loss: 0.7240, test_loss: 0.9928, test_f1: 0.5799
 epoch: 91, train_loss: 0.7061, test_loss: 1.0491, test_f1: 0.5820
 epoch: 92, train_loss: 0.7135, test_loss: 1.0482, test_f1: 0.5882
 epoch: 93, train_loss: 0.7014, test_loss: 1.0881, test_f1: 0.5798
 epoch: 94, train_loss: 0.7175, test_loss: 1.0635, test_f1: 0.5610
 epoch: 95, train_loss: 0.6981, test_loss: 1.1005, test_f1: 0.5782
 epoch: 96, train_loss: 0.6978, test_loss: 1.1038, test_f1: 0.5556
 epoch: 97, train_loss: 0.6936, test_loss: 1.1384, test_f1: 0.5731
 epoch: 98, train_loss: 0.6973, test_loss: 1.0706, test_f1: 0.5728
 epoch: 99, train_loss: 0.6953, test_loss: 1.2307, test_f1: 0.5537
##################ITERATION #8 ****************************************
 epoch: 0, train_loss: 1.4260, test_loss: 1.3031, test_f1: 0.2281
 epoch: 1, train_loss: 1.1879, test_loss: 1.3091, test_f1: 0.2281
 epoch: 2, train_loss: 1.1512, test_loss: 1.3100, test_f1: 0.2599
 epoch: 3, train_loss: 1.1060, test_loss: 1.3086, test_f1: 0.3867
 epoch: 4, train_loss: 1.0999, test_loss: 1.2681, test_f1: 0.3338
 epoch: 5, train_loss: 1.0661, test_loss: 1.1679, test_f1: 0.4473
 epoch: 6, train_loss: 1.0700, test_loss: 1.1437, test_f1: 0.3839
 epoch: 7, train_loss: 1.0345, test_loss: 1.1757, test_f1: 0.4293
 epoch: 8, train_loss: 1.0273, test_loss: 1.1909, test_f1: 0.4086
 epoch: 9, train_loss: 1.0241, test_loss: 1.1309, test_f1: 0.5026
 epoch: 10, train_loss: 1.0077, test_loss: 1.0862, test_f1: 0.4864
 epoch: 11, train_loss: 1.0109, test_loss: 1.1222, test_f1: 0.4582
 epoch: 12, train_loss: 0.9948, test_loss: 1.1168, test_f1: 0.5029
 epoch: 13, train_loss: 0.9843, test_loss: 1.1220, test_f1: 0.4740
 epoch: 14, train_loss: 0.9640, test_loss: 1.0665, test_f1: 0.4782
 epoch: 15, train_loss: 0.9516, test_loss: 1.1183, test_f1: 0.5145
 epoch: 16, train_loss: 0.9363, test_loss: 1.0650, test_f1: 0.4999
 epoch: 17, train_loss: 0.9087, test_loss: 1.0561, test_f1: 0.5276
 epoch: 18, train_loss: 0.9082, test_loss: 1.1213, test_f1: 0.5051
 epoch: 19, train_loss: 0.8990, test_loss: 1.1442, test_f1: 0.5504
 epoch: 20, train_loss: 0.9158, test_loss: 1.3047, test_f1: 0.4866
 epoch: 21, train_loss: 0.9202, test_loss: 1.0373, test_f1: 0.5431
 epoch: 22, train_loss: 0.8997, test_loss: 1.1003, test_f1: 0.3976
 epoch: 23, train_loss: 0.8998, test_loss: 1.0503, test_f1: 0.5077
 epoch: 24, train_loss: 0.8852, test_loss: 1.0823, test_f1: 0.5151
 epoch: 25, train_loss: 0.9050, test_loss: 1.0808, test_f1: 0.5154
 epoch: 26, train_loss: 0.8917, test_loss: 1.1357, test_f1: 0.4717
 epoch: 27, train_loss: 0.8635, test_loss: 1.1368, test_f1: 0.4938
 epoch: 28, train_loss: 0.8643, test_loss: 1.1453, test_f1: 0.5138
 epoch: 29, train_loss: 0.8598, test_loss: 1.0534, test_f1: 0.5418
 epoch: 30, train_loss: 0.8838, test_loss: 1.1752, test_f1: 0.5239
 epoch: 31, train_loss: 0.8734, test_loss: 1.2902, test_f1: 0.4963
 epoch: 32, train_loss: 0.8811, test_loss: 1.2875, test_f1: 0.5222
 epoch: 33, train_loss: 0.8925, test_loss: 1.2320, test_f1: 0.5013
 epoch: 34, train_loss: 0.8597, test_loss: 1.1010, test_f1: 0.5329
 epoch: 35, train_loss: 0.8314, test_loss: 1.0108, test_f1: 0.5483
 epoch: 36, train_loss: 0.8345, test_loss: 1.0114, test_f1: 0.5671
 epoch: 37, train_loss: 0.8268, test_loss: 0.9717, test_f1: 0.5666
 epoch: 38, train_loss: 0.8295, test_loss: 1.0045, test_f1: 0.5836
 epoch: 39, train_loss: 0.8031, test_loss: 1.0573, test_f1: 0.4912
 epoch: 40, train_loss: 0.8278, test_loss: 1.0577, test_f1: 0.5781
 epoch: 41, train_loss: 0.8074, test_loss: 1.0228, test_f1: 0.5615
 epoch: 42, train_loss: 0.8207, test_loss: 1.0461, test_f1: 0.5683
 epoch: 43, train_loss: 0.7729, test_loss: 1.0543, test_f1: 0.5148
 epoch: 44, train_loss: 0.7810, test_loss: 1.1149, test_f1: 0.5609
 epoch: 45, train_loss: 0.7982, test_loss: 1.0914, test_f1: 0.5903
 epoch: 46, train_loss: 0.8271, test_loss: 1.0512, test_f1: 0.5666
 epoch: 47, train_loss: 0.8150, test_loss: 1.0712, test_f1: 0.5785
 epoch: 48, train_loss: 0.8320, test_loss: 1.1746, test_f1: 0.5816
 epoch: 49, train_loss: 0.8136, test_loss: 1.1369, test_f1: 0.5573
 epoch: 50, train_loss: 0.7933, test_loss: 1.0606, test_f1: 0.6008
 epoch: 51, train_loss: 0.7819, test_loss: 1.0374, test_f1: 0.5620
 epoch: 52, train_loss: 0.7633, test_loss: 1.0912, test_f1: 0.5432
 epoch: 53, train_loss: 0.7592, test_loss: 1.1388, test_f1: 0.5655
 epoch: 54, train_loss: 0.7506, test_loss: 1.2453, test_f1: 0.5448
 epoch: 55, train_loss: 0.7596, test_loss: 1.1465, test_f1: 0.5511
 epoch: 56, train_loss: 0.7515, test_loss: 1.0383, test_f1: 0.6000
 epoch: 57, train_loss: 0.7502, test_loss: 1.1164, test_f1: 0.5934
 epoch: 58, train_loss: 0.7507, test_loss: 1.1809, test_f1: 0.5628
 epoch: 59, train_loss: 0.7433, test_loss: 1.2578, test_f1: 0.5249
 epoch: 60, train_loss: 0.7421, test_loss: 1.2701, test_f1: 0.5193
 epoch: 61, train_loss: 0.7399, test_loss: 1.1615, test_f1: 0.5627
 epoch: 62, train_loss: 0.7195, test_loss: 1.1224, test_f1: 0.5740
 epoch: 63, train_loss: 0.7233, test_loss: 1.1900, test_f1: 0.5793
 epoch: 64, train_loss: 0.7189, test_loss: 1.1060, test_f1: 0.5804
 epoch: 65, train_loss: 0.7306, test_loss: 1.1442, test_f1: 0.5837
 epoch: 66, train_loss: 0.7094, test_loss: 1.2008, test_f1: 0.5776
 epoch: 67, train_loss: 0.7072, test_loss: 1.1437, test_f1: 0.5733
 epoch: 68, train_loss: 0.7026, test_loss: 1.2511, test_f1: 0.5696
 epoch: 69, train_loss: 0.7200, test_loss: 1.1992, test_f1: 0.5617
 epoch: 70, train_loss: 0.7160, test_loss: 1.1646, test_f1: 0.5746
 epoch: 71, train_loss: 0.7147, test_loss: 1.1989, test_f1: 0.5663
 epoch: 72, train_loss: 0.7057, test_loss: 1.2992, test_f1: 0.5126
 epoch: 73, train_loss: 0.7377, test_loss: 1.3122, test_f1: 0.5391
 epoch: 74, train_loss: 0.7136, test_loss: 1.2242, test_f1: 0.5804
 epoch: 75, train_loss: 0.7226, test_loss: 1.3368, test_f1: 0.5063
 epoch: 76, train_loss: 0.7249, test_loss: 1.4336, test_f1: 0.4983
 epoch: 77, train_loss: 0.7137, test_loss: 1.2356, test_f1: 0.5578
 epoch: 78, train_loss: 0.7244, test_loss: 1.1747, test_f1: 0.5632
 epoch: 79, train_loss: 0.7217, test_loss: 1.2011, test_f1: 0.5635
 epoch: 80, train_loss: 0.6981, test_loss: 1.2320, test_f1: 0.5585
 epoch: 81, train_loss: 0.6995, test_loss: 1.2209, test_f1: 0.5867
 epoch: 82, train_loss: 0.7360, test_loss: 1.1246, test_f1: 0.5742
 epoch: 83, train_loss: 0.7321, test_loss: 1.2152, test_f1: 0.5484
 epoch: 84, train_loss: 0.7178, test_loss: 1.1780, test_f1: 0.5827
 epoch: 85, train_loss: 0.6938, test_loss: 1.1725, test_f1: 0.5410
 epoch: 86, train_loss: 0.6955, test_loss: 1.2248, test_f1: 0.5732
 epoch: 87, train_loss: 0.6940, test_loss: 1.4381, test_f1: 0.5020
 epoch: 88, train_loss: 0.7132, test_loss: 1.3837, test_f1: 0.5226
 epoch: 89, train_loss: 0.7159, test_loss: 1.3089, test_f1: 0.5549
 epoch: 90, train_loss: 0.7155, test_loss: 1.2524, test_f1: 0.5959
 epoch: 91, train_loss: 0.7009, test_loss: 1.3484, test_f1: 0.5461
 epoch: 92, train_loss: 0.7628, test_loss: 1.3437, test_f1: 0.5575
 epoch: 93, train_loss: 0.7339, test_loss: 1.1293, test_f1: 0.5648
 epoch: 94, train_loss: 0.7099, test_loss: 1.2397, test_f1: 0.5448
 epoch: 95, train_loss: 0.7249, test_loss: 1.1776, test_f1: 0.5583
 epoch: 96, train_loss: 0.7090, test_loss: 1.1942, test_f1: 0.5672
 epoch: 97, train_loss: 0.7051, test_loss: 1.1795, test_f1: 0.5762
 epoch: 98, train_loss: 0.6917, test_loss: 1.1709, test_f1: 0.5710
 epoch: 99, train_loss: 0.6793, test_loss: 1.2067, test_f1: 0.5669
##################ITERATION #9 ****************************************
 epoch: 0, train_loss: 1.4498, test_loss: 1.5350, test_f1: 0.2281
 epoch: 1, train_loss: 1.1838, test_loss: 1.4321, test_f1: 0.2583
 epoch: 2, train_loss: 1.1533, test_loss: 1.4406, test_f1: 0.3382
 epoch: 3, train_loss: 1.1254, test_loss: 1.3850, test_f1: 0.2722
 epoch: 4, train_loss: 1.0764, test_loss: 1.2341, test_f1: 0.2786
 epoch: 5, train_loss: 1.0543, test_loss: 1.1824, test_f1: 0.3264
 epoch: 6, train_loss: 1.0298, test_loss: 1.1319, test_f1: 0.4137
 epoch: 7, train_loss: 1.0420, test_loss: 1.1071, test_f1: 0.4341
 epoch: 8, train_loss: 0.9869, test_loss: 1.0929, test_f1: 0.4469
 epoch: 9, train_loss: 1.0119, test_loss: 1.0823, test_f1: 0.4625
 epoch: 10, train_loss: 0.9883, test_loss: 1.0417, test_f1: 0.4963
 epoch: 11, train_loss: 0.9770, test_loss: 1.0125, test_f1: 0.5044
 epoch: 12, train_loss: 0.9586, test_loss: 1.0139, test_f1: 0.5101
 epoch: 13, train_loss: 0.9566, test_loss: 1.1176, test_f1: 0.4879
 epoch: 14, train_loss: 0.9453, test_loss: 1.0223, test_f1: 0.5117
 epoch: 15, train_loss: 0.9407, test_loss: 1.0409, test_f1: 0.4822
 epoch: 16, train_loss: 0.9532, test_loss: 1.0454, test_f1: 0.5026
 epoch: 17, train_loss: 0.9419, test_loss: 1.0420, test_f1: 0.5256
 epoch: 18, train_loss: 0.9382, test_loss: 1.0474, test_f1: 0.4922
 epoch: 19, train_loss: 0.9283, test_loss: 1.1390, test_f1: 0.5038
 epoch: 20, train_loss: 0.9208, test_loss: 1.2232, test_f1: 0.4511
 epoch: 21, train_loss: 0.8983, test_loss: 1.1307, test_f1: 0.5128
 epoch: 22, train_loss: 0.8859, test_loss: 1.0894, test_f1: 0.5411
 epoch: 23, train_loss: 0.8930, test_loss: 1.0509, test_f1: 0.5420
 epoch: 24, train_loss: 0.8826, test_loss: 1.0131, test_f1: 0.5545
 epoch: 25, train_loss: 0.9041, test_loss: 1.0363, test_f1: 0.5416
 epoch: 26, train_loss: 0.9100, test_loss: 1.0391, test_f1: 0.5085
 epoch: 27, train_loss: 0.9187, test_loss: 1.0848, test_f1: 0.4787
 epoch: 28, train_loss: 0.9035, test_loss: 1.0945, test_f1: 0.5048
 epoch: 29, train_loss: 0.8996, test_loss: 1.1184, test_f1: 0.5120
 epoch: 30, train_loss: 0.9124, test_loss: 1.0870, test_f1: 0.5432
 epoch: 31, train_loss: 0.8685, test_loss: 1.0867, test_f1: 0.5299
 epoch: 32, train_loss: 0.8681, test_loss: 1.0916, test_f1: 0.5415
 epoch: 33, train_loss: 0.8927, test_loss: 1.3623, test_f1: 0.4879
 epoch: 34, train_loss: 0.8868, test_loss: 1.2035, test_f1: 0.5313
 epoch: 35, train_loss: 0.8835, test_loss: 1.2058, test_f1: 0.5267
 epoch: 36, train_loss: 0.8707, test_loss: 1.2262, test_f1: 0.5230
 epoch: 37, train_loss: 0.8700, test_loss: 1.1461, test_f1: 0.5164
 epoch: 38, train_loss: 0.8532, test_loss: 1.1367, test_f1: 0.5402
 epoch: 39, train_loss: 0.8611, test_loss: 1.1159, test_f1: 0.5331
 epoch: 40, train_loss: 0.8459, test_loss: 1.1607, test_f1: 0.5136
 epoch: 41, train_loss: 0.8540, test_loss: 1.1241, test_f1: 0.5236
 epoch: 42, train_loss: 0.8543, test_loss: 1.1805, test_f1: 0.5114
 epoch: 43, train_loss: 0.8936, test_loss: 1.1208, test_f1: 0.5124
 epoch: 44, train_loss: 0.8624, test_loss: 1.2084, test_f1: 0.5011
 epoch: 45, train_loss: 0.8448, test_loss: 1.1759, test_f1: 0.5306
 epoch: 46, train_loss: 0.8619, test_loss: 1.1198, test_f1: 0.5273
 epoch: 47, train_loss: 0.8561, test_loss: 1.0971, test_f1: 0.5352
 epoch: 48, train_loss: 0.9112, test_loss: 1.1666, test_f1: 0.5088
 epoch: 49, train_loss: 0.8608, test_loss: 1.2079, test_f1: 0.4898
 epoch: 50, train_loss: 0.8513, test_loss: 1.0939, test_f1: 0.5284
 epoch: 51, train_loss: 0.8344, test_loss: 1.0623, test_f1: 0.5411
 epoch: 52, train_loss: 0.8330, test_loss: 1.0870, test_f1: 0.5381
 epoch: 53, train_loss: 0.8337, test_loss: 1.2288, test_f1: 0.4924
 epoch: 54, train_loss: 0.8460, test_loss: 1.1564, test_f1: 0.5394
 epoch: 55, train_loss: 0.8292, test_loss: 1.1027, test_f1: 0.5366
 epoch: 56, train_loss: 0.8333, test_loss: 1.0960, test_f1: 0.5359
 epoch: 57, train_loss: 0.8220, test_loss: 1.1013, test_f1: 0.5315
 epoch: 58, train_loss: 0.8250, test_loss: 1.1545, test_f1: 0.5364
 epoch: 59, train_loss: 0.8097, test_loss: 1.1323, test_f1: 0.5364
 epoch: 60, train_loss: 0.8150, test_loss: 1.0837, test_f1: 0.5533
 epoch: 61, train_loss: 0.7965, test_loss: 1.1056, test_f1: 0.5038
 epoch: 62, train_loss: 0.8068, test_loss: 1.1427, test_f1: 0.5256
 epoch: 63, train_loss: 0.7969, test_loss: 1.1346, test_f1: 0.5434
 epoch: 64, train_loss: 0.7997, test_loss: 1.1378, test_f1: 0.5154
 epoch: 65, train_loss: 0.7999, test_loss: 1.1633, test_f1: 0.5060
 epoch: 66, train_loss: 0.7787, test_loss: 1.1566, test_f1: 0.5614
 epoch: 67, train_loss: 0.7795, test_loss: 1.1426, test_f1: 0.5256
 epoch: 68, train_loss: 0.7923, test_loss: 1.2236, test_f1: 0.5151
 epoch: 69, train_loss: 0.8242, test_loss: 1.3127, test_f1: 0.5200
 epoch: 70, train_loss: 0.8100, test_loss: 1.2377, test_f1: 0.5116
 epoch: 71, train_loss: 0.7930, test_loss: 1.1925, test_f1: 0.5268
 epoch: 72, train_loss: 0.8032, test_loss: 1.1912, test_f1: 0.5396
 epoch: 73, train_loss: 0.7826, test_loss: 1.2050, test_f1: 0.5422
 epoch: 74, train_loss: 0.7780, test_loss: 1.2699, test_f1: 0.5275
 epoch: 75, train_loss: 0.7744, test_loss: 1.1997, test_f1: 0.5216
 epoch: 76, train_loss: 0.7851, test_loss: 1.2205, test_f1: 0.5279
 epoch: 77, train_loss: 0.7738, test_loss: 1.2070, test_f1: 0.5355
 epoch: 78, train_loss: 0.7658, test_loss: 1.2377, test_f1: 0.5207
 epoch: 79, train_loss: 0.7585, test_loss: 1.2947, test_f1: 0.5340
 epoch: 80, train_loss: 0.7655, test_loss: 1.2433, test_f1: 0.5338
 epoch: 81, train_loss: 0.7531, test_loss: 1.2124, test_f1: 0.5380
 epoch: 82, train_loss: 0.7425, test_loss: 1.2375, test_f1: 0.5625
 epoch: 83, train_loss: 0.7739, test_loss: 1.2870, test_f1: 0.5032
 epoch: 84, train_loss: 0.7701, test_loss: 1.1959, test_f1: 0.5331
 epoch: 85, train_loss: 0.7472, test_loss: 1.2267, test_f1: 0.5489
 epoch: 86, train_loss: 0.7467, test_loss: 1.3421, test_f1: 0.5444
 epoch: 87, train_loss: 0.7665, test_loss: 1.2975, test_f1: 0.5546
 epoch: 88, train_loss: 0.7591, test_loss: 1.3240, test_f1: 0.5109
 epoch: 89, train_loss: 0.7703, test_loss: 1.3577, test_f1: 0.5186
 epoch: 90, train_loss: 0.7619, test_loss: 1.1964, test_f1: 0.5331
 epoch: 91, train_loss: 0.7801, test_loss: 1.3192, test_f1: 0.5338
 epoch: 92, train_loss: 0.7644, test_loss: 1.3154, test_f1: 0.5390
 epoch: 93, train_loss: 0.7614, test_loss: 1.2958, test_f1: 0.5163
 epoch: 94, train_loss: 0.7521, test_loss: 1.2386, test_f1: 0.5507
 epoch: 95, train_loss: 0.7488, test_loss: 1.1890, test_f1: 0.5159
 epoch: 96, train_loss: 0.7428, test_loss: 1.1867, test_f1: 0.5222
 epoch: 97, train_loss: 0.7491, test_loss: 1.1900, test_f1: 0.5320
 epoch: 98, train_loss: 0.7416, test_loss: 1.1806, test_f1: 0.5590
 epoch: 99, train_loss: 0.7550, test_loss: 1.1950, test_f1: 0.5391

Training completed in 289.63 seconds
Best F1: 0.6403 at epoch 75
Mean F1 across iterations: 0.6091  0.0234
========================FINAL RESULTS================================
FEGIN weighted F1: 0.6403  0.0234
python main.py --data ltspice_demos --representation component_net --model FEGIN --layers 3 --hiddens 16 --batch_size 256 --lr 0.01 --emb_size 250 --epochs 100 --save_appendix component_net_L3_H16_BS256_LR0.01_E250 --no_val
-----



STDERR:
  File "main.py", line 370, in <module>
    main()
  File "main.py", line 254, in main
    dataset = dataset_class(
  File "/home/philip/projects/ltspice_examples_code_repo/Circuit-Completion-Using-GNNs/component_classification_with_link_prediction_head/evaluation/FEGIN/kernel/circuit_datasets.py", line 15, in __init__
    self.data, self.slices = torch.load(self.processed_paths[0])
  File "/home/philip/.local/lib/python3.8/site-packages/torch/serialization.py", line 1040, in load
    warnings.warn(
  File "/usr/lib/python3.8/warnings.py", line 109, in _showwarnmsg
    sw(msg.message, msg.category, msg.filename, msg.lineno,
  File "main.py", line 47, in warn_with_traceback
    traceback.print_stack(file=log)
/home/philip/projects/ltspice_examples_code_repo/Circuit-Completion-Using-GNNs/component_classification_with_link_prediction_head/evaluation/FEGIN/kernel/circuit_datasets.py:15: FutureWarning: You are using `torch.load` with `weights_only=False` (the current default value), which uses the default pickle module implicitly. It is possible to construct malicious pickle data which will execute arbitrary code during unpickling (See https://github.com/pytorch/pytorch/blob/main/SECURITY.md#untrusted-models for more details). In a future release, the default value for `weights_only` will be flipped to `True`. This limits the functions that could be executed during unpickling. Arbitrary objects will no longer be allowed to be loaded via this mode unless they are explicitly allowlisted by the user via `torch.serialization.add_safe_globals`. We recommend you start setting `weights_only=True` for any use case where you don't have full control of the loaded file. Please open an issue on GitHub for any issues related to this experimental feature.
  self.data, self.slices = torch.load(self.processed_paths[0])
