STDOUT:
Results will be saved in /home/philip/projects/ltspice_examples_code_repo/Circuit-Completion-Using-GNNs/component_classification_with_link_prediction_head/evaluation/FEGIN/results/model_FEGIN_dataset_ltspice_demos
Command line input: python main.py --data ltspice_demos --representation component_net --model FEGIN --layers 2 --hiddens 128 --batch_size 32 --lr 0.0001 --emb_size 128 --epochs 100 --save_appendix component_net_L2_H128_BS32_LR0.0001_E128 --no_val
 is saved.
-----
ltspice_demos - FEGIN
Using 2 layers, 128 hidden units, h = 2
Loading component_net representation dataset
ENTERED
Training FEGIN on component_net representation
Train: 1565, Test: 383
##################ITERATION #0 ****************************************
 epoch: 0, train_loss: 1.3545, test_loss: 1.3498, test_f1: 0.2281
 epoch: 1, train_loss: 1.2905, test_loss: 1.2972, test_f1: 0.2281
 epoch: 2, train_loss: 1.2279, test_loss: 1.2566, test_f1: 0.2281
 epoch: 3, train_loss: 1.1856, test_loss: 1.2340, test_f1: 0.2833
 epoch: 4, train_loss: 1.1555, test_loss: 1.2168, test_f1: 0.2936
 epoch: 5, train_loss: 1.1282, test_loss: 1.2004, test_f1: 0.3482
 epoch: 6, train_loss: 1.1040, test_loss: 1.1934, test_f1: 0.3943
 epoch: 7, train_loss: 1.0818, test_loss: 1.1707, test_f1: 0.4022
 epoch: 8, train_loss: 1.0634, test_loss: 1.1615, test_f1: 0.4021
 epoch: 9, train_loss: 1.0396, test_loss: 1.1436, test_f1: 0.4138
 epoch: 10, train_loss: 1.0145, test_loss: 1.1286, test_f1: 0.4283
 epoch: 11, train_loss: 1.0009, test_loss: 1.0968, test_f1: 0.4441
 epoch: 12, train_loss: 0.9799, test_loss: 1.0856, test_f1: 0.4591
 epoch: 13, train_loss: 0.9689, test_loss: 1.0780, test_f1: 0.4589
 epoch: 14, train_loss: 0.9468, test_loss: 1.0713, test_f1: 0.4736
 epoch: 15, train_loss: 0.9337, test_loss: 1.0586, test_f1: 0.4660
 epoch: 16, train_loss: 0.9274, test_loss: 1.0792, test_f1: 0.4997
 epoch: 17, train_loss: 0.9171, test_loss: 1.0563, test_f1: 0.4905
 epoch: 18, train_loss: 0.9084, test_loss: 1.0521, test_f1: 0.5069
 epoch: 19, train_loss: 0.8994, test_loss: 1.0720, test_f1: 0.5183
 epoch: 20, train_loss: 0.8905, test_loss: 1.0763, test_f1: 0.5241
 epoch: 21, train_loss: 0.8807, test_loss: 1.0416, test_f1: 0.5344
 epoch: 22, train_loss: 0.8824, test_loss: 1.0446, test_f1: 0.5237
 epoch: 23, train_loss: 0.8708, test_loss: 1.0352, test_f1: 0.5517
 epoch: 24, train_loss: 0.8559, test_loss: 1.1015, test_f1: 0.5449
 epoch: 25, train_loss: 0.8502, test_loss: 1.0837, test_f1: 0.5572
 epoch: 26, train_loss: 0.8513, test_loss: 1.0739, test_f1: 0.5657
 epoch: 27, train_loss: 0.8374, test_loss: 1.0514, test_f1: 0.5552
 epoch: 28, train_loss: 0.8413, test_loss: 1.0575, test_f1: 0.5538
 epoch: 29, train_loss: 0.8280, test_loss: 1.0584, test_f1: 0.5643
 epoch: 30, train_loss: 0.8226, test_loss: 1.0592, test_f1: 0.5624
 epoch: 31, train_loss: 0.8167, test_loss: 1.0515, test_f1: 0.5805
 epoch: 32, train_loss: 0.8164, test_loss: 1.0469, test_f1: 0.5942
 epoch: 33, train_loss: 0.8006, test_loss: 1.0484, test_f1: 0.5756
 epoch: 34, train_loss: 0.8061, test_loss: 1.0375, test_f1: 0.5739
 epoch: 35, train_loss: 0.7874, test_loss: 1.0516, test_f1: 0.5771
 epoch: 36, train_loss: 0.7857, test_loss: 1.0642, test_f1: 0.5696
 epoch: 37, train_loss: 0.7841, test_loss: 1.0570, test_f1: 0.5695
 epoch: 38, train_loss: 0.7800, test_loss: 1.0586, test_f1: 0.5691
 epoch: 39, train_loss: 0.7538, test_loss: 1.0384, test_f1: 0.5725
 epoch: 40, train_loss: 0.7652, test_loss: 1.0476, test_f1: 0.5963
 epoch: 41, train_loss: 0.7545, test_loss: 1.0563, test_f1: 0.5995
 epoch: 42, train_loss: 0.7530, test_loss: 1.0432, test_f1: 0.5797
 epoch: 43, train_loss: 0.7358, test_loss: 1.0856, test_f1: 0.5641
 epoch: 44, train_loss: 0.7254, test_loss: 1.0840, test_f1: 0.5545
 epoch: 45, train_loss: 0.7262, test_loss: 1.0401, test_f1: 0.5668
 epoch: 46, train_loss: 0.7250, test_loss: 1.1194, test_f1: 0.5757
 epoch: 47, train_loss: 0.7072, test_loss: 1.0870, test_f1: 0.5955
 epoch: 48, train_loss: 0.7162, test_loss: 1.0555, test_f1: 0.5712
 epoch: 49, train_loss: 0.6999, test_loss: 1.0604, test_f1: 0.6092
 epoch: 50, train_loss: 0.6918, test_loss: 1.0266, test_f1: 0.5828
 epoch: 51, train_loss: 0.6918, test_loss: 1.0596, test_f1: 0.5731
 epoch: 52, train_loss: 0.6739, test_loss: 1.0301, test_f1: 0.6027
 epoch: 53, train_loss: 0.6690, test_loss: 1.0422, test_f1: 0.6122
 epoch: 54, train_loss: 0.6691, test_loss: 1.0256, test_f1: 0.6104
 epoch: 55, train_loss: 0.6484, test_loss: 1.0648, test_f1: 0.6024
 epoch: 56, train_loss: 0.6538, test_loss: 1.0652, test_f1: 0.5990
 epoch: 57, train_loss: 0.6675, test_loss: 1.0399, test_f1: 0.6070
 epoch: 58, train_loss: 0.6524, test_loss: 1.0601, test_f1: 0.6267
 epoch: 59, train_loss: 0.6569, test_loss: 1.0821, test_f1: 0.6073
 epoch: 60, train_loss: 0.6467, test_loss: 1.0539, test_f1: 0.6032
 epoch: 61, train_loss: 0.6488, test_loss: 1.0773, test_f1: 0.6156
 epoch: 62, train_loss: 0.6297, test_loss: 1.0735, test_f1: 0.6040
 epoch: 63, train_loss: 0.6538, test_loss: 1.0253, test_f1: 0.6245
 epoch: 64, train_loss: 0.6345, test_loss: 1.0532, test_f1: 0.6237
 epoch: 65, train_loss: 0.6290, test_loss: 1.1376, test_f1: 0.6079
 epoch: 66, train_loss: 0.6108, test_loss: 1.0672, test_f1: 0.6142
 epoch: 67, train_loss: 0.6194, test_loss: 1.0825, test_f1: 0.6173
 epoch: 68, train_loss: 0.6138, test_loss: 1.0951, test_f1: 0.6202
 epoch: 69, train_loss: 0.6105, test_loss: 1.0698, test_f1: 0.6220
 epoch: 70, train_loss: 0.6113, test_loss: 1.0991, test_f1: 0.6135
 epoch: 71, train_loss: 0.6188, test_loss: 1.0775, test_f1: 0.6216
 epoch: 72, train_loss: 0.6044, test_loss: 1.0907, test_f1: 0.6246
 epoch: 73, train_loss: 0.6137, test_loss: 1.1163, test_f1: 0.6229
 epoch: 74, train_loss: 0.6076, test_loss: 1.1299, test_f1: 0.6163
 epoch: 75, train_loss: 0.5849, test_loss: 1.0948, test_f1: 0.6166
 epoch: 76, train_loss: 0.6054, test_loss: 1.1020, test_f1: 0.6137
 epoch: 77, train_loss: 0.5781, test_loss: 1.1761, test_f1: 0.6251
 epoch: 78, train_loss: 0.5870, test_loss: 1.1118, test_f1: 0.6198
 epoch: 79, train_loss: 0.5956, test_loss: 1.1497, test_f1: 0.6267
 epoch: 80, train_loss: 0.5682, test_loss: 1.1146, test_f1: 0.6224
 epoch: 81, train_loss: 0.5843, test_loss: 1.1416, test_f1: 0.6328
 epoch: 82, train_loss: 0.5799, test_loss: 1.1634, test_f1: 0.6075
 epoch: 83, train_loss: 0.5795, test_loss: 1.1471, test_f1: 0.6295
 epoch: 84, train_loss: 0.5803, test_loss: 1.1279, test_f1: 0.6213
 epoch: 85, train_loss: 0.5576, test_loss: 1.1782, test_f1: 0.6172
 epoch: 86, train_loss: 0.5728, test_loss: 1.1791, test_f1: 0.6320
 epoch: 87, train_loss: 0.5593, test_loss: 1.2236, test_f1: 0.6184
 epoch: 88, train_loss: 0.5541, test_loss: 1.2004, test_f1: 0.6218
 epoch: 89, train_loss: 0.5543, test_loss: 1.2080, test_f1: 0.6058
 epoch: 90, train_loss: 0.5465, test_loss: 1.2131, test_f1: 0.6277
 epoch: 91, train_loss: 0.5460, test_loss: 1.2069, test_f1: 0.6272
 epoch: 92, train_loss: 0.5441, test_loss: 1.1795, test_f1: 0.6253
 epoch: 93, train_loss: 0.5434, test_loss: 1.1905, test_f1: 0.6167
 epoch: 94, train_loss: 0.5488, test_loss: 1.1764, test_f1: 0.6120
 epoch: 95, train_loss: 0.5438, test_loss: 1.1847, test_f1: 0.6149
 epoch: 96, train_loss: 0.5287, test_loss: 1.1900, test_f1: 0.6204
 epoch: 97, train_loss: 0.5243, test_loss: 1.2467, test_f1: 0.6175
 epoch: 98, train_loss: 0.5232, test_loss: 1.1805, test_f1: 0.6025
 epoch: 99, train_loss: 0.5094, test_loss: 1.2268, test_f1: 0.6277
##################ITERATION #1 ****************************************
 epoch: 0, train_loss: 1.2643, test_loss: 1.2769, test_f1: 0.2900
 epoch: 1, train_loss: 1.1570, test_loss: 1.2152, test_f1: 0.3316
 epoch: 2, train_loss: 1.1158, test_loss: 1.1816, test_f1: 0.3420
 epoch: 3, train_loss: 1.0914, test_loss: 1.1555, test_f1: 0.4045
 epoch: 4, train_loss: 1.0541, test_loss: 1.1329, test_f1: 0.4528
 epoch: 5, train_loss: 1.0301, test_loss: 1.1057, test_f1: 0.4734
 epoch: 6, train_loss: 1.0125, test_loss: 1.0845, test_f1: 0.4966
 epoch: 7, train_loss: 0.9806, test_loss: 1.0834, test_f1: 0.4938
 epoch: 8, train_loss: 0.9606, test_loss: 1.0566, test_f1: 0.5064
 epoch: 9, train_loss: 0.9384, test_loss: 1.0472, test_f1: 0.5153
 epoch: 10, train_loss: 0.9227, test_loss: 1.0395, test_f1: 0.5320
 epoch: 11, train_loss: 0.9197, test_loss: 1.0454, test_f1: 0.5290
 epoch: 12, train_loss: 0.9036, test_loss: 1.0420, test_f1: 0.5138
 epoch: 13, train_loss: 0.8911, test_loss: 1.0227, test_f1: 0.5356
 epoch: 14, train_loss: 0.8723, test_loss: 1.0288, test_f1: 0.5462
 epoch: 15, train_loss: 0.8649, test_loss: 1.0242, test_f1: 0.5397
 epoch: 16, train_loss: 0.8622, test_loss: 1.0343, test_f1: 0.5441
 epoch: 17, train_loss: 0.8352, test_loss: 1.0381, test_f1: 0.5333
 epoch: 18, train_loss: 0.8445, test_loss: 1.0337, test_f1: 0.5670
 epoch: 19, train_loss: 0.8290, test_loss: 1.0127, test_f1: 0.5875
 epoch: 20, train_loss: 0.8117, test_loss: 1.0224, test_f1: 0.5809
 epoch: 21, train_loss: 0.8139, test_loss: 1.0070, test_f1: 0.5670
 epoch: 22, train_loss: 0.8135, test_loss: 1.0167, test_f1: 0.5910
 epoch: 23, train_loss: 0.8111, test_loss: 1.0254, test_f1: 0.5555
 epoch: 24, train_loss: 0.7829, test_loss: 1.0251, test_f1: 0.5776
 epoch: 25, train_loss: 0.7696, test_loss: 1.0278, test_f1: 0.5756
 epoch: 26, train_loss: 0.7753, test_loss: 1.0283, test_f1: 0.5842
 epoch: 27, train_loss: 0.7577, test_loss: 1.0059, test_f1: 0.6081
 epoch: 28, train_loss: 0.7556, test_loss: 1.0092, test_f1: 0.6434
 epoch: 29, train_loss: 0.7473, test_loss: 0.9985, test_f1: 0.6359
 epoch: 30, train_loss: 0.7422, test_loss: 1.0336, test_f1: 0.6183
 epoch: 31, train_loss: 0.7419, test_loss: 1.0308, test_f1: 0.6135
 epoch: 32, train_loss: 0.7374, test_loss: 1.0601, test_f1: 0.6033
 epoch: 33, train_loss: 0.7165, test_loss: 1.0020, test_f1: 0.6114
 epoch: 34, train_loss: 0.7057, test_loss: 1.0195, test_f1: 0.5974
 epoch: 35, train_loss: 0.6963, test_loss: 1.0220, test_f1: 0.6351
 epoch: 36, train_loss: 0.7086, test_loss: 1.0929, test_f1: 0.6150
 epoch: 37, train_loss: 0.7050, test_loss: 1.0395, test_f1: 0.6032
 epoch: 38, train_loss: 0.6866, test_loss: 1.0441, test_f1: 0.6173
 epoch: 39, train_loss: 0.6840, test_loss: 1.0484, test_f1: 0.6389
 epoch: 40, train_loss: 0.6651, test_loss: 1.0291, test_f1: 0.6210
 epoch: 41, train_loss: 0.6587, test_loss: 1.0382, test_f1: 0.6413
 epoch: 42, train_loss: 0.6619, test_loss: 1.0023, test_f1: 0.6509
 epoch: 43, train_loss: 0.6412, test_loss: 1.0723, test_f1: 0.6330
 epoch: 44, train_loss: 0.6457, test_loss: 1.0355, test_f1: 0.6132
 epoch: 45, train_loss: 0.6381, test_loss: 1.1066, test_f1: 0.6118
 epoch: 46, train_loss: 0.6551, test_loss: 1.0972, test_f1: 0.6326
 epoch: 47, train_loss: 0.6206, test_loss: 1.1038, test_f1: 0.6132
 epoch: 48, train_loss: 0.6393, test_loss: 1.0149, test_f1: 0.6331
 epoch: 49, train_loss: 0.6219, test_loss: 1.0729, test_f1: 0.6347
 epoch: 50, train_loss: 0.6228, test_loss: 1.0670, test_f1: 0.6487
 epoch: 51, train_loss: 0.5990, test_loss: 1.0536, test_f1: 0.6476
 epoch: 52, train_loss: 0.5934, test_loss: 1.0994, test_f1: 0.6483
 epoch: 53, train_loss: 0.5919, test_loss: 1.0766, test_f1: 0.6308
 epoch: 54, train_loss: 0.5786, test_loss: 1.0910, test_f1: 0.6315
 epoch: 55, train_loss: 0.5760, test_loss: 1.0428, test_f1: 0.6566
 epoch: 56, train_loss: 0.5798, test_loss: 1.1055, test_f1: 0.6356
 epoch: 57, train_loss: 0.5697, test_loss: 1.0638, test_f1: 0.6509
 epoch: 58, train_loss: 0.5713, test_loss: 1.0977, test_f1: 0.6239
 epoch: 59, train_loss: 0.5677, test_loss: 1.0938, test_f1: 0.6382
 epoch: 60, train_loss: 0.5674, test_loss: 1.0932, test_f1: 0.6488
 epoch: 61, train_loss: 0.5579, test_loss: 1.1249, test_f1: 0.6348
 epoch: 62, train_loss: 0.5528, test_loss: 1.0910, test_f1: 0.6319
 epoch: 63, train_loss: 0.5519, test_loss: 1.1112, test_f1: 0.6456
 epoch: 64, train_loss: 0.5393, test_loss: 1.1108, test_f1: 0.6592
 epoch: 65, train_loss: 0.5485, test_loss: 1.0874, test_f1: 0.6530
 epoch: 66, train_loss: 0.5418, test_loss: 1.1272, test_f1: 0.6451
 epoch: 67, train_loss: 0.5355, test_loss: 1.0835, test_f1: 0.6656
 epoch: 68, train_loss: 0.5348, test_loss: 1.1410, test_f1: 0.6476
 epoch: 69, train_loss: 0.5420, test_loss: 1.1427, test_f1: 0.6667
 epoch: 70, train_loss: 0.5402, test_loss: 1.1184, test_f1: 0.6571
 epoch: 71, train_loss: 0.5194, test_loss: 1.1686, test_f1: 0.6487
 epoch: 72, train_loss: 0.5283, test_loss: 1.1546, test_f1: 0.6517
 epoch: 73, train_loss: 0.5134, test_loss: 1.1361, test_f1: 0.6565
 epoch: 74, train_loss: 0.5018, test_loss: 1.1102, test_f1: 0.6652
 epoch: 75, train_loss: 0.5221, test_loss: 1.1343, test_f1: 0.6642
 epoch: 76, train_loss: 0.5232, test_loss: 1.1924, test_f1: 0.6675
 epoch: 77, train_loss: 0.5316, test_loss: 1.1393, test_f1: 0.6654
 epoch: 78, train_loss: 0.5150, test_loss: 1.2115, test_f1: 0.6314
 epoch: 79, train_loss: 0.5038, test_loss: 1.1752, test_f1: 0.6666
 epoch: 80, train_loss: 0.5116, test_loss: 1.1535, test_f1: 0.6663
 epoch: 81, train_loss: 0.4977, test_loss: 1.1839, test_f1: 0.6617
 epoch: 82, train_loss: 0.4980, test_loss: 1.1865, test_f1: 0.6764
 epoch: 83, train_loss: 0.4930, test_loss: 1.1752, test_f1: 0.6682
 epoch: 84, train_loss: 0.5061, test_loss: 1.1803, test_f1: 0.6580
 epoch: 85, train_loss: 0.4903, test_loss: 1.2417, test_f1: 0.6396
 epoch: 86, train_loss: 0.5084, test_loss: 1.1776, test_f1: 0.6558
 epoch: 87, train_loss: 0.4856, test_loss: 1.1919, test_f1: 0.6420
 epoch: 88, train_loss: 0.4660, test_loss: 1.2825, test_f1: 0.6497
 epoch: 89, train_loss: 0.4947, test_loss: 1.1960, test_f1: 0.6495
 epoch: 90, train_loss: 0.4751, test_loss: 1.2267, test_f1: 0.6581
 epoch: 91, train_loss: 0.4653, test_loss: 1.1804, test_f1: 0.6663
 epoch: 92, train_loss: 0.4665, test_loss: 1.2501, test_f1: 0.6661
 epoch: 93, train_loss: 0.4691, test_loss: 1.2543, test_f1: 0.6496
 epoch: 94, train_loss: 0.4545, test_loss: 1.2833, test_f1: 0.6733
 epoch: 95, train_loss: 0.4569, test_loss: 1.2328, test_f1: 0.6514
 epoch: 96, train_loss: 0.4802, test_loss: 1.2372, test_f1: 0.6736
 epoch: 97, train_loss: 0.4621, test_loss: 1.1840, test_f1: 0.6611
 epoch: 98, train_loss: 0.4724, test_loss: 1.2822, test_f1: 0.6439
 epoch: 99, train_loss: 0.4635, test_loss: 1.2945, test_f1: 0.6577
##################ITERATION #2 ****************************************
 epoch: 0, train_loss: 1.2157, test_loss: 1.2376, test_f1: 0.3562
 epoch: 1, train_loss: 1.1078, test_loss: 1.1695, test_f1: 0.4487
 epoch: 2, train_loss: 1.0671, test_loss: 1.1385, test_f1: 0.4732
 epoch: 3, train_loss: 1.0316, test_loss: 1.1180, test_f1: 0.4851
 epoch: 4, train_loss: 1.0208, test_loss: 1.1011, test_f1: 0.4950
 epoch: 5, train_loss: 1.0008, test_loss: 1.0929, test_f1: 0.5085
 epoch: 6, train_loss: 0.9759, test_loss: 1.0882, test_f1: 0.5058
 epoch: 7, train_loss: 0.9611, test_loss: 1.0832, test_f1: 0.5158
 epoch: 8, train_loss: 0.9523, test_loss: 1.0687, test_f1: 0.5180
 epoch: 9, train_loss: 0.9408, test_loss: 1.0600, test_f1: 0.4992
 epoch: 10, train_loss: 0.9212, test_loss: 1.0537, test_f1: 0.5096
 epoch: 11, train_loss: 0.9111, test_loss: 1.0583, test_f1: 0.5171
 epoch: 12, train_loss: 0.8915, test_loss: 1.0439, test_f1: 0.5459
 epoch: 13, train_loss: 0.8863, test_loss: 1.0632, test_f1: 0.5290
 epoch: 14, train_loss: 0.8749, test_loss: 1.0599, test_f1: 0.5435
 epoch: 15, train_loss: 0.8749, test_loss: 1.0550, test_f1: 0.5442
 epoch: 16, train_loss: 0.8507, test_loss: 1.0742, test_f1: 0.5418
 epoch: 17, train_loss: 0.8509, test_loss: 1.0628, test_f1: 0.5571
 epoch: 18, train_loss: 0.8334, test_loss: 1.0725, test_f1: 0.5620
 epoch: 19, train_loss: 0.8266, test_loss: 1.0968, test_f1: 0.5589
 epoch: 20, train_loss: 0.8239, test_loss: 1.0752, test_f1: 0.5558
 epoch: 21, train_loss: 0.8107, test_loss: 1.0565, test_f1: 0.5592
 epoch: 22, train_loss: 0.7914, test_loss: 1.0649, test_f1: 0.5667
 epoch: 23, train_loss: 0.7842, test_loss: 1.0961, test_f1: 0.5819
 epoch: 24, train_loss: 0.7729, test_loss: 1.0826, test_f1: 0.5934
 epoch: 25, train_loss: 0.7746, test_loss: 1.0711, test_f1: 0.5991
 epoch: 26, train_loss: 0.7611, test_loss: 1.1018, test_f1: 0.5757
 epoch: 27, train_loss: 0.7602, test_loss: 1.0781, test_f1: 0.6018
 epoch: 28, train_loss: 0.7489, test_loss: 1.0831, test_f1: 0.5963
 epoch: 29, train_loss: 0.7460, test_loss: 1.0586, test_f1: 0.6052
 epoch: 30, train_loss: 0.7243, test_loss: 1.0792, test_f1: 0.6035
 epoch: 31, train_loss: 0.7400, test_loss: 1.0839, test_f1: 0.5957
 epoch: 32, train_loss: 0.7340, test_loss: 1.1266, test_f1: 0.5453
 epoch: 33, train_loss: 0.7201, test_loss: 1.0317, test_f1: 0.6289
 epoch: 34, train_loss: 0.7006, test_loss: 1.0802, test_f1: 0.5825
 epoch: 35, train_loss: 0.6804, test_loss: 1.0938, test_f1: 0.6015
 epoch: 36, train_loss: 0.6703, test_loss: 1.0859, test_f1: 0.6253
 epoch: 37, train_loss: 0.6884, test_loss: 1.1026, test_f1: 0.6195
 epoch: 38, train_loss: 0.6703, test_loss: 1.1002, test_f1: 0.5927
 epoch: 39, train_loss: 0.6677, test_loss: 1.0884, test_f1: 0.5820
 epoch: 40, train_loss: 0.6537, test_loss: 1.0573, test_f1: 0.5863
 epoch: 41, train_loss: 0.6361, test_loss: 1.0861, test_f1: 0.6350
 epoch: 42, train_loss: 0.6479, test_loss: 1.1524, test_f1: 0.5741
 epoch: 43, train_loss: 0.6295, test_loss: 1.1543, test_f1: 0.6115
 epoch: 44, train_loss: 0.6229, test_loss: 1.1203, test_f1: 0.6117
 epoch: 45, train_loss: 0.6241, test_loss: 1.0866, test_f1: 0.6551
 epoch: 46, train_loss: 0.6265, test_loss: 1.1760, test_f1: 0.5807
 epoch: 47, train_loss: 0.5990, test_loss: 1.1161, test_f1: 0.6122
 epoch: 48, train_loss: 0.6034, test_loss: 1.1438, test_f1: 0.6323
 epoch: 49, train_loss: 0.5855, test_loss: 1.1317, test_f1: 0.5721
 epoch: 50, train_loss: 0.5920, test_loss: 1.1621, test_f1: 0.6152
 epoch: 51, train_loss: 0.5611, test_loss: 1.1414, test_f1: 0.6001
 epoch: 52, train_loss: 0.5583, test_loss: 1.1606, test_f1: 0.6009
 epoch: 53, train_loss: 0.5666, test_loss: 1.1770, test_f1: 0.6125
 epoch: 54, train_loss: 0.5519, test_loss: 1.1923, test_f1: 0.6154
 epoch: 55, train_loss: 0.5527, test_loss: 1.2385, test_f1: 0.5911
 epoch: 56, train_loss: 0.5602, test_loss: 1.1985, test_f1: 0.6123
 epoch: 57, train_loss: 0.5368, test_loss: 1.1931, test_f1: 0.6248
 epoch: 58, train_loss: 0.5083, test_loss: 1.2032, test_f1: 0.6271
 epoch: 59, train_loss: 0.5341, test_loss: 1.2150, test_f1: 0.6098
 epoch: 60, train_loss: 0.5219, test_loss: 1.2291, test_f1: 0.6101
 epoch: 61, train_loss: 0.5115, test_loss: 1.2309, test_f1: 0.5999
 epoch: 62, train_loss: 0.5109, test_loss: 1.2777, test_f1: 0.6129
 epoch: 63, train_loss: 0.5063, test_loss: 1.2554, test_f1: 0.6021
 epoch: 64, train_loss: 0.5287, test_loss: 1.2632, test_f1: 0.5849
 epoch: 65, train_loss: 0.4887, test_loss: 1.2681, test_f1: 0.5952
 epoch: 66, train_loss: 0.5069, test_loss: 1.2541, test_f1: 0.5994
 epoch: 67, train_loss: 0.4831, test_loss: 1.2827, test_f1: 0.6033
 epoch: 68, train_loss: 0.5037, test_loss: 1.2991, test_f1: 0.6279
 epoch: 69, train_loss: 0.5013, test_loss: 1.3225, test_f1: 0.6090
 epoch: 70, train_loss: 0.5071, test_loss: 1.3051, test_f1: 0.5881
 epoch: 71, train_loss: 0.4915, test_loss: 1.2791, test_f1: 0.6277
 epoch: 72, train_loss: 0.5052, test_loss: 1.2957, test_f1: 0.6095
 epoch: 73, train_loss: 0.4929, test_loss: 1.3051, test_f1: 0.6087
 epoch: 74, train_loss: 0.4735, test_loss: 1.3213, test_f1: 0.6339
 epoch: 75, train_loss: 0.4910, test_loss: 1.3449, test_f1: 0.6189
 epoch: 76, train_loss: 0.4644, test_loss: 1.3223, test_f1: 0.6114
 epoch: 77, train_loss: 0.4650, test_loss: 1.3369, test_f1: 0.6263
 epoch: 78, train_loss: 0.4667, test_loss: 1.3502, test_f1: 0.6214
 epoch: 79, train_loss: 0.4677, test_loss: 1.3328, test_f1: 0.6333
 epoch: 80, train_loss: 0.4677, test_loss: 1.4129, test_f1: 0.6189
 epoch: 81, train_loss: 0.4732, test_loss: 1.3685, test_f1: 0.6283
 epoch: 82, train_loss: 0.4588, test_loss: 1.4196, test_f1: 0.6091
 epoch: 83, train_loss: 0.4577, test_loss: 1.4166, test_f1: 0.6235
 epoch: 84, train_loss: 0.4402, test_loss: 1.3513, test_f1: 0.6370
 epoch: 85, train_loss: 0.4522, test_loss: 1.4358, test_f1: 0.6180
 epoch: 86, train_loss: 0.4453, test_loss: 1.4165, test_f1: 0.6370
 epoch: 87, train_loss: 0.4593, test_loss: 1.4741, test_f1: 0.6242
 epoch: 88, train_loss: 0.4446, test_loss: 1.4720, test_f1: 0.6028
 epoch: 89, train_loss: 0.4264, test_loss: 1.4482, test_f1: 0.6190
 epoch: 90, train_loss: 0.4469, test_loss: 1.4544, test_f1: 0.6267
 epoch: 91, train_loss: 0.4348, test_loss: 1.4613, test_f1: 0.6105
 epoch: 92, train_loss: 0.4426, test_loss: 1.4301, test_f1: 0.6368
 epoch: 93, train_loss: 0.4176, test_loss: 1.4855, test_f1: 0.6163
 epoch: 94, train_loss: 0.3851, test_loss: 1.4598, test_f1: 0.6190
 epoch: 95, train_loss: 0.3937, test_loss: 1.4926, test_f1: 0.6216
 epoch: 96, train_loss: 0.4252, test_loss: 1.4979, test_f1: 0.6222
 epoch: 97, train_loss: 0.4087, test_loss: 1.5041, test_f1: 0.6281
 epoch: 98, train_loss: 0.4145, test_loss: 1.4940, test_f1: 0.6137
 epoch: 99, train_loss: 0.4184, test_loss: 1.5687, test_f1: 0.6237
##################ITERATION #3 ****************************************
 epoch: 0, train_loss: 1.1710, test_loss: 1.2233, test_f1: 0.3851
 epoch: 1, train_loss: 1.0831, test_loss: 1.1283, test_f1: 0.4569
 epoch: 2, train_loss: 1.0436, test_loss: 1.1038, test_f1: 0.4693
 epoch: 3, train_loss: 1.0240, test_loss: 1.0885, test_f1: 0.4763
 epoch: 4, train_loss: 0.9982, test_loss: 1.0664, test_f1: 0.4963
 epoch: 5, train_loss: 0.9827, test_loss: 1.0571, test_f1: 0.4981
 epoch: 6, train_loss: 0.9755, test_loss: 1.0427, test_f1: 0.5049
 epoch: 7, train_loss: 0.9464, test_loss: 1.0472, test_f1: 0.5080
 epoch: 8, train_loss: 0.9170, test_loss: 1.0343, test_f1: 0.5187
 epoch: 9, train_loss: 0.9235, test_loss: 1.0464, test_f1: 0.5312
 epoch: 10, train_loss: 0.9027, test_loss: 1.0323, test_f1: 0.5217
 epoch: 11, train_loss: 0.8907, test_loss: 1.0334, test_f1: 0.5296
 epoch: 12, train_loss: 0.8897, test_loss: 1.0350, test_f1: 0.5176
 epoch: 13, train_loss: 0.8832, test_loss: 1.0241, test_f1: 0.5357
 epoch: 14, train_loss: 0.8687, test_loss: 1.0506, test_f1: 0.5799
 epoch: 15, train_loss: 0.8483, test_loss: 1.0280, test_f1: 0.5510
 epoch: 16, train_loss: 0.8469, test_loss: 1.0379, test_f1: 0.5768
 epoch: 17, train_loss: 0.8421, test_loss: 1.0290, test_f1: 0.5865
 epoch: 18, train_loss: 0.8313, test_loss: 1.0347, test_f1: 0.5764
 epoch: 19, train_loss: 0.8182, test_loss: 1.0306, test_f1: 0.5746
 epoch: 20, train_loss: 0.8221, test_loss: 1.0576, test_f1: 0.5845
 epoch: 21, train_loss: 0.8178, test_loss: 1.0458, test_f1: 0.5980
 epoch: 22, train_loss: 0.8004, test_loss: 1.0550, test_f1: 0.6076
 epoch: 23, train_loss: 0.7759, test_loss: 1.0650, test_f1: 0.5729
 epoch: 24, train_loss: 0.7886, test_loss: 1.0731, test_f1: 0.5718
 epoch: 25, train_loss: 0.7787, test_loss: 1.0554, test_f1: 0.5948
 epoch: 26, train_loss: 0.7712, test_loss: 1.0777, test_f1: 0.5953
 epoch: 27, train_loss: 0.7589, test_loss: 1.0881, test_f1: 0.6244
 epoch: 28, train_loss: 0.7711, test_loss: 1.0924, test_f1: 0.5932
 epoch: 29, train_loss: 0.7650, test_loss: 1.0769, test_f1: 0.5871
 epoch: 30, train_loss: 0.7465, test_loss: 1.0684, test_f1: 0.5946
 epoch: 31, train_loss: 0.7385, test_loss: 1.0726, test_f1: 0.5997
 epoch: 32, train_loss: 0.7282, test_loss: 1.0854, test_f1: 0.5944
 epoch: 33, train_loss: 0.7354, test_loss: 1.0797, test_f1: 0.6312
 epoch: 34, train_loss: 0.7387, test_loss: 1.1315, test_f1: 0.5906
 epoch: 35, train_loss: 0.7147, test_loss: 1.0935, test_f1: 0.6047
 epoch: 36, train_loss: 0.7174, test_loss: 1.1273, test_f1: 0.5588
 epoch: 37, train_loss: 0.7081, test_loss: 1.1400, test_f1: 0.6090
 epoch: 38, train_loss: 0.6979, test_loss: 1.0979, test_f1: 0.6221
 epoch: 39, train_loss: 0.7008, test_loss: 1.1663, test_f1: 0.5828
 epoch: 40, train_loss: 0.6753, test_loss: 1.1352, test_f1: 0.5808
 epoch: 41, train_loss: 0.6902, test_loss: 1.1385, test_f1: 0.6301
 epoch: 42, train_loss: 0.6710, test_loss: 1.1979, test_f1: 0.5760
 epoch: 43, train_loss: 0.6615, test_loss: 1.1608, test_f1: 0.6036
 epoch: 44, train_loss: 0.6746, test_loss: 1.1597, test_f1: 0.6186
 epoch: 45, train_loss: 0.6747, test_loss: 1.1919, test_f1: 0.6045
 epoch: 46, train_loss: 0.6576, test_loss: 1.1684, test_f1: 0.6052
 epoch: 47, train_loss: 0.6523, test_loss: 1.2211, test_f1: 0.5577
 epoch: 48, train_loss: 0.6356, test_loss: 1.1881, test_f1: 0.6077
 epoch: 49, train_loss: 0.6458, test_loss: 1.1959, test_f1: 0.5918
 epoch: 50, train_loss: 0.6431, test_loss: 1.2160, test_f1: 0.5771
 epoch: 51, train_loss: 0.6109, test_loss: 1.2095, test_f1: 0.5874
 epoch: 52, train_loss: 0.6005, test_loss: 1.2276, test_f1: 0.5821
 epoch: 53, train_loss: 0.6005, test_loss: 1.2327, test_f1: 0.5892
 epoch: 54, train_loss: 0.6176, test_loss: 1.2043, test_f1: 0.6025
 epoch: 55, train_loss: 0.5942, test_loss: 1.2124, test_f1: 0.5827
 epoch: 56, train_loss: 0.6122, test_loss: 1.2645, test_f1: 0.5657
 epoch: 57, train_loss: 0.5957, test_loss: 1.2432, test_f1: 0.5979
 epoch: 58, train_loss: 0.6109, test_loss: 1.2411, test_f1: 0.6002
 epoch: 59, train_loss: 0.5909, test_loss: 1.2503, test_f1: 0.6026
 epoch: 60, train_loss: 0.5890, test_loss: 1.2637, test_f1: 0.5999
 epoch: 61, train_loss: 0.5803, test_loss: 1.2429, test_f1: 0.6055
 epoch: 62, train_loss: 0.5935, test_loss: 1.2465, test_f1: 0.5907
 epoch: 63, train_loss: 0.5811, test_loss: 1.2396, test_f1: 0.5893
 epoch: 64, train_loss: 0.5864, test_loss: 1.2507, test_f1: 0.6261
 epoch: 65, train_loss: 0.5707, test_loss: 1.2566, test_f1: 0.5821
 epoch: 66, train_loss: 0.5604, test_loss: 1.2577, test_f1: 0.6105
 epoch: 67, train_loss: 0.5592, test_loss: 1.3151, test_f1: 0.5930
 epoch: 68, train_loss: 0.5555, test_loss: 1.3071, test_f1: 0.5840
 epoch: 69, train_loss: 0.5494, test_loss: 1.2951, test_f1: 0.5849
 epoch: 70, train_loss: 0.5655, test_loss: 1.3247, test_f1: 0.6046
 epoch: 71, train_loss: 0.5456, test_loss: 1.2978, test_f1: 0.6045
 epoch: 72, train_loss: 0.5612, test_loss: 1.3161, test_f1: 0.6153
 epoch: 73, train_loss: 0.5448, test_loss: 1.3204, test_f1: 0.6029
 epoch: 74, train_loss: 0.5522, test_loss: 1.2703, test_f1: 0.5978
 epoch: 75, train_loss: 0.5416, test_loss: 1.3500, test_f1: 0.6031
 epoch: 76, train_loss: 0.5446, test_loss: 1.3495, test_f1: 0.5949
 epoch: 77, train_loss: 0.5368, test_loss: 1.3484, test_f1: 0.5943
 epoch: 78, train_loss: 0.5361, test_loss: 1.3478, test_f1: 0.6130
 epoch: 79, train_loss: 0.5350, test_loss: 1.3534, test_f1: 0.6240
 epoch: 80, train_loss: 0.5399, test_loss: 1.3751, test_f1: 0.5844
 epoch: 81, train_loss: 0.5249, test_loss: 1.3753, test_f1: 0.5929
 epoch: 82, train_loss: 0.5202, test_loss: 1.4107, test_f1: 0.6024
 epoch: 83, train_loss: 0.5329, test_loss: 1.4108, test_f1: 0.6050
 epoch: 84, train_loss: 0.5181, test_loss: 1.4055, test_f1: 0.5825
 epoch: 85, train_loss: 0.4952, test_loss: 1.3949, test_f1: 0.5999
 epoch: 86, train_loss: 0.5321, test_loss: 1.3890, test_f1: 0.5705
 epoch: 87, train_loss: 0.5018, test_loss: 1.3714, test_f1: 0.6173
 epoch: 88, train_loss: 0.4872, test_loss: 1.4261, test_f1: 0.6226
 epoch: 89, train_loss: 0.5002, test_loss: 1.4769, test_f1: 0.5906
 epoch: 90, train_loss: 0.4951, test_loss: 1.4680, test_f1: 0.5812
 epoch: 91, train_loss: 0.5131, test_loss: 1.4490, test_f1: 0.5997
 epoch: 92, train_loss: 0.4974, test_loss: 1.4802, test_f1: 0.5792
 epoch: 93, train_loss: 0.5032, test_loss: 1.4207, test_f1: 0.6116
 epoch: 94, train_loss: 0.4974, test_loss: 1.4677, test_f1: 0.6081
 epoch: 95, train_loss: 0.4608, test_loss: 1.4329, test_f1: 0.6141
 epoch: 96, train_loss: 0.4970, test_loss: 1.4752, test_f1: 0.5991
 epoch: 97, train_loss: 0.4910, test_loss: 1.4318, test_f1: 0.6090
 epoch: 98, train_loss: 0.4827, test_loss: 1.4603, test_f1: 0.5952
 epoch: 99, train_loss: 0.5071, test_loss: 1.4743, test_f1: 0.6085
##################ITERATION #4 ****************************************
 epoch: 0, train_loss: 1.1897, test_loss: 1.1944, test_f1: 0.3490
 epoch: 1, train_loss: 1.0860, test_loss: 1.0976, test_f1: 0.4712
 epoch: 2, train_loss: 1.0293, test_loss: 1.0768, test_f1: 0.4944
 epoch: 3, train_loss: 1.0189, test_loss: 1.0580, test_f1: 0.5035
 epoch: 4, train_loss: 0.9929, test_loss: 1.0605, test_f1: 0.5026
 epoch: 5, train_loss: 0.9517, test_loss: 1.0404, test_f1: 0.5243
 epoch: 6, train_loss: 0.9704, test_loss: 1.0186, test_f1: 0.5362
 epoch: 7, train_loss: 0.9438, test_loss: 1.0204, test_f1: 0.5319
 epoch: 8, train_loss: 0.9280, test_loss: 1.0077, test_f1: 0.5620
 epoch: 9, train_loss: 0.9031, test_loss: 1.0113, test_f1: 0.5438
 epoch: 10, train_loss: 0.8890, test_loss: 1.0104, test_f1: 0.5438
 epoch: 11, train_loss: 0.8723, test_loss: 1.0155, test_f1: 0.5552
 epoch: 12, train_loss: 0.8767, test_loss: 1.0147, test_f1: 0.5506
 epoch: 13, train_loss: 0.8418, test_loss: 1.0220, test_f1: 0.5648
 epoch: 14, train_loss: 0.8591, test_loss: 0.9790, test_f1: 0.5922
 epoch: 15, train_loss: 0.8349, test_loss: 0.9913, test_f1: 0.5665
 epoch: 16, train_loss: 0.8367, test_loss: 0.9926, test_f1: 0.5758
 epoch: 17, train_loss: 0.8152, test_loss: 0.9969, test_f1: 0.5986
 epoch: 18, train_loss: 0.8144, test_loss: 0.9975, test_f1: 0.6069
 epoch: 19, train_loss: 0.8003, test_loss: 0.9772, test_f1: 0.6254
 epoch: 20, train_loss: 0.8045, test_loss: 0.9953, test_f1: 0.6357
 epoch: 21, train_loss: 0.7908, test_loss: 0.9931, test_f1: 0.6461
 epoch: 22, train_loss: 0.7803, test_loss: 0.9930, test_f1: 0.6400
 epoch: 23, train_loss: 0.7809, test_loss: 0.9978, test_f1: 0.6199
 epoch: 24, train_loss: 0.7771, test_loss: 1.0047, test_f1: 0.6160
 epoch: 25, train_loss: 0.7729, test_loss: 1.0229, test_f1: 0.6102
 epoch: 26, train_loss: 0.7434, test_loss: 1.0104, test_f1: 0.6045
 epoch: 27, train_loss: 0.7474, test_loss: 1.0098, test_f1: 0.6055
 epoch: 28, train_loss: 0.7283, test_loss: 0.9880, test_f1: 0.6405
 epoch: 29, train_loss: 0.7335, test_loss: 1.0358, test_f1: 0.6264
 epoch: 30, train_loss: 0.7333, test_loss: 1.0298, test_f1: 0.6294
 epoch: 31, train_loss: 0.7043, test_loss: 1.0587, test_f1: 0.6134
 epoch: 32, train_loss: 0.7030, test_loss: 1.0475, test_f1: 0.6280
 epoch: 33, train_loss: 0.6970, test_loss: 1.0092, test_f1: 0.6237
 epoch: 34, train_loss: 0.6880, test_loss: 1.0502, test_f1: 0.6328
 epoch: 35, train_loss: 0.6896, test_loss: 1.0641, test_f1: 0.6072
 epoch: 36, train_loss: 0.6712, test_loss: 1.0791, test_f1: 0.6203
 epoch: 37, train_loss: 0.6800, test_loss: 1.0553, test_f1: 0.6193
 epoch: 38, train_loss: 0.6572, test_loss: 1.0429, test_f1: 0.6232
 epoch: 39, train_loss: 0.6610, test_loss: 1.0447, test_f1: 0.6235
 epoch: 40, train_loss: 0.6400, test_loss: 1.0579, test_f1: 0.6206
 epoch: 41, train_loss: 0.6413, test_loss: 1.0815, test_f1: 0.6389
 epoch: 42, train_loss: 0.6418, test_loss: 1.0913, test_f1: 0.6367
 epoch: 43, train_loss: 0.6281, test_loss: 1.0600, test_f1: 0.6343
 epoch: 44, train_loss: 0.6525, test_loss: 1.1177, test_f1: 0.6266
 epoch: 45, train_loss: 0.6199, test_loss: 1.1281, test_f1: 0.6583
 epoch: 46, train_loss: 0.6250, test_loss: 1.0950, test_f1: 0.6232
 epoch: 47, train_loss: 0.5952, test_loss: 1.1646, test_f1: 0.6216
 epoch: 48, train_loss: 0.5891, test_loss: 1.1847, test_f1: 0.6649
 epoch: 49, train_loss: 0.6107, test_loss: 1.1656, test_f1: 0.6393
 epoch: 50, train_loss: 0.6064, test_loss: 1.1269, test_f1: 0.6500
 epoch: 51, train_loss: 0.5842, test_loss: 1.1368, test_f1: 0.6505
 epoch: 52, train_loss: 0.5720, test_loss: 1.1626, test_f1: 0.6637
 epoch: 53, train_loss: 0.5767, test_loss: 1.1749, test_f1: 0.6331
 epoch: 54, train_loss: 0.5802, test_loss: 1.1808, test_f1: 0.6597
 epoch: 55, train_loss: 0.5661, test_loss: 1.1589, test_f1: 0.6506
 epoch: 56, train_loss: 0.5653, test_loss: 1.1566, test_f1: 0.6217
 epoch: 57, train_loss: 0.5537, test_loss: 1.1961, test_f1: 0.6544
 epoch: 58, train_loss: 0.5632, test_loss: 1.2032, test_f1: 0.6233
 epoch: 59, train_loss: 0.5707, test_loss: 1.1674, test_f1: 0.6503
 epoch: 60, train_loss: 0.5433, test_loss: 1.1534, test_f1: 0.6484
 epoch: 61, train_loss: 0.5487, test_loss: 1.1747, test_f1: 0.6306
 epoch: 62, train_loss: 0.5415, test_loss: 1.2036, test_f1: 0.6257
 epoch: 63, train_loss: 0.5475, test_loss: 1.1965, test_f1: 0.6516
 epoch: 64, train_loss: 0.5435, test_loss: 1.1689, test_f1: 0.6603
 epoch: 65, train_loss: 0.5409, test_loss: 1.1996, test_f1: 0.6663
 epoch: 66, train_loss: 0.5282, test_loss: 1.2023, test_f1: 0.6521
 epoch: 67, train_loss: 0.5258, test_loss: 1.1920, test_f1: 0.6397
 epoch: 68, train_loss: 0.5408, test_loss: 1.1949, test_f1: 0.6587
 epoch: 69, train_loss: 0.5167, test_loss: 1.2383, test_f1: 0.6469
 epoch: 70, train_loss: 0.5025, test_loss: 1.2505, test_f1: 0.6426
 epoch: 71, train_loss: 0.5068, test_loss: 1.2031, test_f1: 0.6582
 epoch: 72, train_loss: 0.4907, test_loss: 1.2365, test_f1: 0.6517
 epoch: 73, train_loss: 0.5109, test_loss: 1.2165, test_f1: 0.6728
 epoch: 74, train_loss: 0.5198, test_loss: 1.2320, test_f1: 0.6501
 epoch: 75, train_loss: 0.5067, test_loss: 1.3008, test_f1: 0.6541
 epoch: 76, train_loss: 0.5192, test_loss: 1.2382, test_f1: 0.6484
 epoch: 77, train_loss: 0.5159, test_loss: 1.2273, test_f1: 0.6573
 epoch: 78, train_loss: 0.4925, test_loss: 1.2668, test_f1: 0.6396
 epoch: 79, train_loss: 0.4764, test_loss: 1.3212, test_f1: 0.6383
 epoch: 80, train_loss: 0.4722, test_loss: 1.2722, test_f1: 0.6729
 epoch: 81, train_loss: 0.4974, test_loss: 1.2765, test_f1: 0.6499
 epoch: 82, train_loss: 0.4800, test_loss: 1.3038, test_f1: 0.6611
 epoch: 83, train_loss: 0.4985, test_loss: 1.3423, test_f1: 0.6456
 epoch: 84, train_loss: 0.4797, test_loss: 1.2751, test_f1: 0.6552
 epoch: 85, train_loss: 0.4926, test_loss: 1.2746, test_f1: 0.6526
 epoch: 86, train_loss: 0.4804, test_loss: 1.3124, test_f1: 0.6536
 epoch: 87, train_loss: 0.4971, test_loss: 1.3141, test_f1: 0.6609
 epoch: 88, train_loss: 0.4702, test_loss: 1.3452, test_f1: 0.6575
 epoch: 89, train_loss: 0.4727, test_loss: 1.3495, test_f1: 0.6722
 epoch: 90, train_loss: 0.4444, test_loss: 1.3457, test_f1: 0.6703
 epoch: 91, train_loss: 0.4771, test_loss: 1.3614, test_f1: 0.6630
 epoch: 92, train_loss: 0.4661, test_loss: 1.3260, test_f1: 0.6475
 epoch: 93, train_loss: 0.4730, test_loss: 1.3395, test_f1: 0.6620
 epoch: 94, train_loss: 0.4559, test_loss: 1.3343, test_f1: 0.6667
 epoch: 95, train_loss: 0.4347, test_loss: 1.3633, test_f1: 0.6823
 epoch: 96, train_loss: 0.4581, test_loss: 1.3545, test_f1: 0.6599
 epoch: 97, train_loss: 0.4612, test_loss: 1.4029, test_f1: 0.6586
 epoch: 98, train_loss: 0.4483, test_loss: 1.3420, test_f1: 0.6525
 epoch: 99, train_loss: 0.4545, test_loss: 1.4000, test_f1: 0.6681
##################ITERATION #5 ****************************************
 epoch: 0, train_loss: 1.2010, test_loss: 1.2036, test_f1: 0.4625
 epoch: 1, train_loss: 1.0986, test_loss: 1.1331, test_f1: 0.4617
 epoch: 2, train_loss: 1.0649, test_loss: 1.1054, test_f1: 0.4716
 epoch: 3, train_loss: 1.0379, test_loss: 1.0867, test_f1: 0.4815
 epoch: 4, train_loss: 0.9993, test_loss: 1.0958, test_f1: 0.4846
 epoch: 5, train_loss: 0.9939, test_loss: 1.0933, test_f1: 0.4738
 epoch: 6, train_loss: 0.9775, test_loss: 1.0664, test_f1: 0.4938
 epoch: 7, train_loss: 0.9428, test_loss: 1.0427, test_f1: 0.5209
 epoch: 8, train_loss: 0.9496, test_loss: 1.0452, test_f1: 0.5071
 epoch: 9, train_loss: 0.9203, test_loss: 1.0320, test_f1: 0.5254
 epoch: 10, train_loss: 0.9176, test_loss: 1.0243, test_f1: 0.5355
 epoch: 11, train_loss: 0.9120, test_loss: 1.0148, test_f1: 0.5452
 epoch: 12, train_loss: 0.8960, test_loss: 1.0307, test_f1: 0.5371
 epoch: 13, train_loss: 0.8667, test_loss: 1.0119, test_f1: 0.5638
 epoch: 14, train_loss: 0.8667, test_loss: 1.0218, test_f1: 0.5584
 epoch: 15, train_loss: 0.8659, test_loss: 1.0130, test_f1: 0.5449
 epoch: 16, train_loss: 0.8441, test_loss: 1.0216, test_f1: 0.5428
 epoch: 17, train_loss: 0.8430, test_loss: 1.0157, test_f1: 0.5805
 epoch: 18, train_loss: 0.8437, test_loss: 1.0281, test_f1: 0.6023
 epoch: 19, train_loss: 0.8289, test_loss: 1.0035, test_f1: 0.5684
 epoch: 20, train_loss: 0.8161, test_loss: 1.0089, test_f1: 0.5569
 epoch: 21, train_loss: 0.8198, test_loss: 1.0216, test_f1: 0.5755
 epoch: 22, train_loss: 0.8107, test_loss: 1.0230, test_f1: 0.5666
 epoch: 23, train_loss: 0.7801, test_loss: 1.0350, test_f1: 0.5956
 epoch: 24, train_loss: 0.7990, test_loss: 1.0168, test_f1: 0.5739
 epoch: 25, train_loss: 0.7961, test_loss: 1.0042, test_f1: 0.5742
 epoch: 26, train_loss: 0.7905, test_loss: 1.0194, test_f1: 0.6084
 epoch: 27, train_loss: 0.7767, test_loss: 1.0369, test_f1: 0.5797
 epoch: 28, train_loss: 0.7802, test_loss: 0.9997, test_f1: 0.6122
 epoch: 29, train_loss: 0.7712, test_loss: 1.0295, test_f1: 0.6021
 epoch: 30, train_loss: 0.7569, test_loss: 1.0325, test_f1: 0.6107
 epoch: 31, train_loss: 0.7367, test_loss: 1.0536, test_f1: 0.5924
 epoch: 32, train_loss: 0.7410, test_loss: 1.0080, test_f1: 0.6248
 epoch: 33, train_loss: 0.7286, test_loss: 1.0210, test_f1: 0.6214
 epoch: 34, train_loss: 0.7182, test_loss: 1.0329, test_f1: 0.6204
 epoch: 35, train_loss: 0.7254, test_loss: 1.0385, test_f1: 0.6052
 epoch: 36, train_loss: 0.7068, test_loss: 1.0368, test_f1: 0.6193
 epoch: 37, train_loss: 0.7056, test_loss: 1.0279, test_f1: 0.6390
 epoch: 38, train_loss: 0.6979, test_loss: 1.0298, test_f1: 0.6112
 epoch: 39, train_loss: 0.7055, test_loss: 1.0325, test_f1: 0.6214
 epoch: 40, train_loss: 0.6808, test_loss: 1.0207, test_f1: 0.6279
 epoch: 41, train_loss: 0.6934, test_loss: 1.0417, test_f1: 0.6416
 epoch: 42, train_loss: 0.6844, test_loss: 1.0383, test_f1: 0.5959
 epoch: 43, train_loss: 0.6684, test_loss: 1.0927, test_f1: 0.6234
 epoch: 44, train_loss: 0.6771, test_loss: 1.0820, test_f1: 0.6342
 epoch: 45, train_loss: 0.6967, test_loss: 1.0923, test_f1: 0.6248
 epoch: 46, train_loss: 0.6756, test_loss: 1.1102, test_f1: 0.6051
 epoch: 47, train_loss: 0.6447, test_loss: 1.0616, test_f1: 0.6479
 epoch: 48, train_loss: 0.6583, test_loss: 1.1333, test_f1: 0.6304
 epoch: 49, train_loss: 0.6607, test_loss: 1.0655, test_f1: 0.6274
 epoch: 50, train_loss: 0.6455, test_loss: 1.0483, test_f1: 0.6341
 epoch: 51, train_loss: 0.6376, test_loss: 1.0761, test_f1: 0.6272
 epoch: 52, train_loss: 0.6222, test_loss: 1.1048, test_f1: 0.6501
 epoch: 53, train_loss: 0.6231, test_loss: 1.0934, test_f1: 0.6525
 epoch: 54, train_loss: 0.6139, test_loss: 1.0828, test_f1: 0.6381
 epoch: 55, train_loss: 0.6165, test_loss: 1.0897, test_f1: 0.6404
 epoch: 56, train_loss: 0.6095, test_loss: 1.0969, test_f1: 0.6440
 epoch: 57, train_loss: 0.6119, test_loss: 1.0685, test_f1: 0.6605
 epoch: 58, train_loss: 0.6073, test_loss: 1.0846, test_f1: 0.6435
 epoch: 59, train_loss: 0.5951, test_loss: 1.0850, test_f1: 0.6477
 epoch: 60, train_loss: 0.5976, test_loss: 1.1327, test_f1: 0.6349
 epoch: 61, train_loss: 0.5935, test_loss: 1.1065, test_f1: 0.6367
 epoch: 62, train_loss: 0.5961, test_loss: 1.1123, test_f1: 0.6298
 epoch: 63, train_loss: 0.5907, test_loss: 1.0822, test_f1: 0.6430
 epoch: 64, train_loss: 0.5756, test_loss: 1.1862, test_f1: 0.6233
 epoch: 65, train_loss: 0.5913, test_loss: 1.1497, test_f1: 0.6141
 epoch: 66, train_loss: 0.5792, test_loss: 1.1238, test_f1: 0.6152
 epoch: 67, train_loss: 0.5729, test_loss: 1.1080, test_f1: 0.6367
 epoch: 68, train_loss: 0.5766, test_loss: 1.1363, test_f1: 0.6546
 epoch: 69, train_loss: 0.5805, test_loss: 1.1876, test_f1: 0.6196
 epoch: 70, train_loss: 0.5641, test_loss: 1.1373, test_f1: 0.6564
 epoch: 71, train_loss: 0.5603, test_loss: 1.1563, test_f1: 0.6182
 epoch: 72, train_loss: 0.5802, test_loss: 1.1411, test_f1: 0.6552
 epoch: 73, train_loss: 0.5616, test_loss: 1.1290, test_f1: 0.6416
 epoch: 74, train_loss: 0.5594, test_loss: 1.1675, test_f1: 0.6342
 epoch: 75, train_loss: 0.5503, test_loss: 1.1830, test_f1: 0.6162
 epoch: 76, train_loss: 0.5522, test_loss: 1.1461, test_f1: 0.6301
 epoch: 77, train_loss: 0.5508, test_loss: 1.1334, test_f1: 0.6593
 epoch: 78, train_loss: 0.5460, test_loss: 1.1360, test_f1: 0.6495
 epoch: 79, train_loss: 0.5558, test_loss: 1.1565, test_f1: 0.6326
 epoch: 80, train_loss: 0.5510, test_loss: 1.1501, test_f1: 0.6493
 epoch: 81, train_loss: 0.5518, test_loss: 1.1476, test_f1: 0.6557
 epoch: 82, train_loss: 0.5544, test_loss: 1.1717, test_f1: 0.6410
 epoch: 83, train_loss: 0.5448, test_loss: 1.1512, test_f1: 0.6309
 epoch: 84, train_loss: 0.5297, test_loss: 1.1755, test_f1: 0.6476
 epoch: 85, train_loss: 0.5341, test_loss: 1.1996, test_f1: 0.6236
 epoch: 86, train_loss: 0.5416, test_loss: 1.1756, test_f1: 0.6560
 epoch: 87, train_loss: 0.5209, test_loss: 1.1861, test_f1: 0.6406
 epoch: 88, train_loss: 0.5228, test_loss: 1.1842, test_f1: 0.6428
 epoch: 89, train_loss: 0.5325, test_loss: 1.2523, test_f1: 0.6471
 epoch: 90, train_loss: 0.5201, test_loss: 1.1934, test_f1: 0.6379
 epoch: 91, train_loss: 0.5125, test_loss: 1.2090, test_f1: 0.6517
 epoch: 92, train_loss: 0.5037, test_loss: 1.2059, test_f1: 0.6330
 epoch: 93, train_loss: 0.5140, test_loss: 1.2030, test_f1: 0.6318
 epoch: 94, train_loss: 0.5204, test_loss: 1.2781, test_f1: 0.6200
 epoch: 95, train_loss: 0.5091, test_loss: 1.2605, test_f1: 0.6514
 epoch: 96, train_loss: 0.5134, test_loss: 1.3223, test_f1: 0.6084
 epoch: 97, train_loss: 0.5118, test_loss: 1.2561, test_f1: 0.6599
 epoch: 98, train_loss: 0.5034, test_loss: 1.2343, test_f1: 0.6507
 epoch: 99, train_loss: 0.5021, test_loss: 1.2457, test_f1: 0.6379
##################ITERATION #6 ****************************************
 epoch: 0, train_loss: 1.2345, test_loss: 1.2122, test_f1: 0.3331
 epoch: 1, train_loss: 1.0879, test_loss: 1.1500, test_f1: 0.4786
 epoch: 2, train_loss: 1.0507, test_loss: 1.1311, test_f1: 0.4781
 epoch: 3, train_loss: 1.0290, test_loss: 1.1307, test_f1: 0.5077
 epoch: 4, train_loss: 0.9995, test_loss: 1.1245, test_f1: 0.5032
 epoch: 5, train_loss: 0.9981, test_loss: 1.1149, test_f1: 0.4861
 epoch: 6, train_loss: 0.9693, test_loss: 1.0972, test_f1: 0.5052
 epoch: 7, train_loss: 0.9376, test_loss: 1.1053, test_f1: 0.5303
 epoch: 8, train_loss: 0.9184, test_loss: 1.0720, test_f1: 0.5395
 epoch: 9, train_loss: 0.9287, test_loss: 1.0923, test_f1: 0.5237
 epoch: 10, train_loss: 0.9086, test_loss: 1.0761, test_f1: 0.5465
 epoch: 11, train_loss: 0.8903, test_loss: 1.0586, test_f1: 0.5644
 epoch: 12, train_loss: 0.8797, test_loss: 1.0584, test_f1: 0.5533
 epoch: 13, train_loss: 0.8800, test_loss: 1.0727, test_f1: 0.5442
 epoch: 14, train_loss: 0.8667, test_loss: 1.0779, test_f1: 0.5701
 epoch: 15, train_loss: 0.8551, test_loss: 1.0642, test_f1: 0.5668
 epoch: 16, train_loss: 0.8550, test_loss: 1.0563, test_f1: 0.5908
 epoch: 17, train_loss: 0.8264, test_loss: 1.0763, test_f1: 0.5567
 epoch: 18, train_loss: 0.8349, test_loss: 1.0423, test_f1: 0.5914
 epoch: 19, train_loss: 0.8255, test_loss: 1.0537, test_f1: 0.6035
 epoch: 20, train_loss: 0.8267, test_loss: 1.0469, test_f1: 0.5934
 epoch: 21, train_loss: 0.7970, test_loss: 1.0483, test_f1: 0.6266
 epoch: 22, train_loss: 0.8063, test_loss: 1.0469, test_f1: 0.5823
 epoch: 23, train_loss: 0.8000, test_loss: 1.0462, test_f1: 0.5954
 epoch: 24, train_loss: 0.7764, test_loss: 1.0504, test_f1: 0.5928
 epoch: 25, train_loss: 0.7673, test_loss: 1.0407, test_f1: 0.5861
 epoch: 26, train_loss: 0.7620, test_loss: 1.0220, test_f1: 0.6190
 epoch: 27, train_loss: 0.7598, test_loss: 1.0347, test_f1: 0.6120
 epoch: 28, train_loss: 0.7478, test_loss: 1.0153, test_f1: 0.6495
 epoch: 29, train_loss: 0.7523, test_loss: 1.0361, test_f1: 0.6161
 epoch: 30, train_loss: 0.7380, test_loss: 1.0396, test_f1: 0.6387
 epoch: 31, train_loss: 0.7300, test_loss: 1.0542, test_f1: 0.6499
 epoch: 32, train_loss: 0.7266, test_loss: 1.0464, test_f1: 0.6211
 epoch: 33, train_loss: 0.7174, test_loss: 1.0272, test_f1: 0.6167
 epoch: 34, train_loss: 0.7137, test_loss: 1.0491, test_f1: 0.6285
 epoch: 35, train_loss: 0.7156, test_loss: 1.0602, test_f1: 0.6192
 epoch: 36, train_loss: 0.6979, test_loss: 1.0581, test_f1: 0.6262
 epoch: 37, train_loss: 0.7163, test_loss: 1.0411, test_f1: 0.6422
 epoch: 38, train_loss: 0.6803, test_loss: 1.0617, test_f1: 0.6282
 epoch: 39, train_loss: 0.6968, test_loss: 1.0732, test_f1: 0.6401
 epoch: 40, train_loss: 0.6690, test_loss: 1.0303, test_f1: 0.6583
 epoch: 41, train_loss: 0.6660, test_loss: 1.0553, test_f1: 0.6555
 epoch: 42, train_loss: 0.6624, test_loss: 1.0918, test_f1: 0.6205
 epoch: 43, train_loss: 0.6554, test_loss: 1.0674, test_f1: 0.6634
 epoch: 44, train_loss: 0.6405, test_loss: 1.0433, test_f1: 0.6518
 epoch: 45, train_loss: 0.6557, test_loss: 1.0881, test_f1: 0.6631
 epoch: 46, train_loss: 0.6263, test_loss: 1.1079, test_f1: 0.6671
 epoch: 47, train_loss: 0.6265, test_loss: 1.0993, test_f1: 0.6341
 epoch: 48, train_loss: 0.6391, test_loss: 1.1576, test_f1: 0.6438
 epoch: 49, train_loss: 0.6264, test_loss: 1.1075, test_f1: 0.6502
 epoch: 50, train_loss: 0.6081, test_loss: 1.1319, test_f1: 0.6267
 epoch: 51, train_loss: 0.5871, test_loss: 1.1039, test_f1: 0.6298
 epoch: 52, train_loss: 0.5855, test_loss: 1.1231, test_f1: 0.6521
 epoch: 53, train_loss: 0.5826, test_loss: 1.1358, test_f1: 0.6408
 epoch: 54, train_loss: 0.5930, test_loss: 1.1614, test_f1: 0.6475
 epoch: 55, train_loss: 0.5769, test_loss: 1.1259, test_f1: 0.6321
 epoch: 56, train_loss: 0.5866, test_loss: 1.1557, test_f1: 0.6538
 epoch: 57, train_loss: 0.5724, test_loss: 1.1555, test_f1: 0.6529
 epoch: 58, train_loss: 0.5710, test_loss: 1.1553, test_f1: 0.6626
 epoch: 59, train_loss: 0.5666, test_loss: 1.1545, test_f1: 0.6436
 epoch: 60, train_loss: 0.5683, test_loss: 1.1656, test_f1: 0.6512
 epoch: 61, train_loss: 0.5803, test_loss: 1.1846, test_f1: 0.6320
 epoch: 62, train_loss: 0.5572, test_loss: 1.1866, test_f1: 0.6404
 epoch: 63, train_loss: 0.5717, test_loss: 1.1704, test_f1: 0.6403
 epoch: 64, train_loss: 0.5451, test_loss: 1.1866, test_f1: 0.6414
 epoch: 65, train_loss: 0.5546, test_loss: 1.1884, test_f1: 0.6378
 epoch: 66, train_loss: 0.5308, test_loss: 1.2091, test_f1: 0.6493
 epoch: 67, train_loss: 0.5568, test_loss: 1.1674, test_f1: 0.6386
 epoch: 68, train_loss: 0.5502, test_loss: 1.1821, test_f1: 0.6526
 epoch: 69, train_loss: 0.5400, test_loss: 1.1618, test_f1: 0.6466
 epoch: 70, train_loss: 0.5522, test_loss: 1.1863, test_f1: 0.6734
 epoch: 71, train_loss: 0.5124, test_loss: 1.2380, test_f1: 0.6256
 epoch: 72, train_loss: 0.5314, test_loss: 1.2339, test_f1: 0.6266
 epoch: 73, train_loss: 0.5272, test_loss: 1.2033, test_f1: 0.6403
 epoch: 74, train_loss: 0.5021, test_loss: 1.2068, test_f1: 0.6514
 epoch: 75, train_loss: 0.5298, test_loss: 1.2294, test_f1: 0.6431
 epoch: 76, train_loss: 0.5197, test_loss: 1.2474, test_f1: 0.6518
 epoch: 77, train_loss: 0.5169, test_loss: 1.2650, test_f1: 0.6563
 epoch: 78, train_loss: 0.4910, test_loss: 1.2427, test_f1: 0.6463
 epoch: 79, train_loss: 0.4968, test_loss: 1.2533, test_f1: 0.6456
 epoch: 80, train_loss: 0.4966, test_loss: 1.2302, test_f1: 0.6373
 epoch: 81, train_loss: 0.5062, test_loss: 1.2919, test_f1: 0.6409
 epoch: 82, train_loss: 0.4954, test_loss: 1.2729, test_f1: 0.6608
 epoch: 83, train_loss: 0.5082, test_loss: 1.2434, test_f1: 0.6591
 epoch: 84, train_loss: 0.4853, test_loss: 1.2715, test_f1: 0.6294
 epoch: 85, train_loss: 0.4756, test_loss: 1.2901, test_f1: 0.6321
 epoch: 86, train_loss: 0.4904, test_loss: 1.2766, test_f1: 0.6403
 epoch: 87, train_loss: 0.5018, test_loss: 1.3404, test_f1: 0.6379
 epoch: 88, train_loss: 0.5016, test_loss: 1.3138, test_f1: 0.6222
 epoch: 89, train_loss: 0.4678, test_loss: 1.3453, test_f1: 0.6323
 epoch: 90, train_loss: 0.4663, test_loss: 1.3600, test_f1: 0.6241
 epoch: 91, train_loss: 0.4636, test_loss: 1.3495, test_f1: 0.6180
 epoch: 92, train_loss: 0.4679, test_loss: 1.3368, test_f1: 0.6427
 epoch: 93, train_loss: 0.4716, test_loss: 1.3803, test_f1: 0.6364
 epoch: 94, train_loss: 0.4733, test_loss: 1.3644, test_f1: 0.6381
 epoch: 95, train_loss: 0.4680, test_loss: 1.3822, test_f1: 0.6117
 epoch: 96, train_loss: 0.4631, test_loss: 1.3861, test_f1: 0.6365
 epoch: 97, train_loss: 0.4593, test_loss: 1.4348, test_f1: 0.6357
 epoch: 98, train_loss: 0.4547, test_loss: 1.4386, test_f1: 0.6276
 epoch: 99, train_loss: 0.4599, test_loss: 1.4359, test_f1: 0.6219
##################ITERATION #7 ****************************************
 epoch: 0, train_loss: 1.2768, test_loss: 1.2185, test_f1: 0.3208
 epoch: 1, train_loss: 1.0993, test_loss: 1.1491, test_f1: 0.4896
 epoch: 2, train_loss: 1.0443, test_loss: 1.1253, test_f1: 0.5283
 epoch: 3, train_loss: 1.0298, test_loss: 1.1347, test_f1: 0.5191
 epoch: 4, train_loss: 1.0322, test_loss: 1.1154, test_f1: 0.5107
 epoch: 5, train_loss: 0.9795, test_loss: 1.1101, test_f1: 0.5043
 epoch: 6, train_loss: 0.9882, test_loss: 1.0827, test_f1: 0.5296
 epoch: 7, train_loss: 0.9552, test_loss: 1.0684, test_f1: 0.5480
 epoch: 8, train_loss: 0.9629, test_loss: 1.0571, test_f1: 0.5484
 epoch: 9, train_loss: 0.9408, test_loss: 1.0794, test_f1: 0.5412
 epoch: 10, train_loss: 0.9261, test_loss: 1.0520, test_f1: 0.5589
 epoch: 11, train_loss: 0.9191, test_loss: 1.0347, test_f1: 0.5341
 epoch: 12, train_loss: 0.9062, test_loss: 1.0425, test_f1: 0.5699
 epoch: 13, train_loss: 0.8836, test_loss: 1.0457, test_f1: 0.5670
 epoch: 14, train_loss: 0.8696, test_loss: 1.0323, test_f1: 0.5746
 epoch: 15, train_loss: 0.8591, test_loss: 1.0363, test_f1: 0.5766
 epoch: 16, train_loss: 0.8641, test_loss: 1.0210, test_f1: 0.5821
 epoch: 17, train_loss: 0.8427, test_loss: 1.0099, test_f1: 0.5954
 epoch: 18, train_loss: 0.8549, test_loss: 1.0112, test_f1: 0.5771
 epoch: 19, train_loss: 0.8387, test_loss: 1.0093, test_f1: 0.5878
 epoch: 20, train_loss: 0.8444, test_loss: 1.0166, test_f1: 0.5949
 epoch: 21, train_loss: 0.8206, test_loss: 1.0271, test_f1: 0.5827
 epoch: 22, train_loss: 0.8410, test_loss: 1.0139, test_f1: 0.5988
 epoch: 23, train_loss: 0.8075, test_loss: 1.0199, test_f1: 0.6076
 epoch: 24, train_loss: 0.8077, test_loss: 1.0298, test_f1: 0.5996
 epoch: 25, train_loss: 0.8013, test_loss: 1.0033, test_f1: 0.5965
 epoch: 26, train_loss: 0.8096, test_loss: 0.9952, test_f1: 0.6015
 epoch: 27, train_loss: 0.7754, test_loss: 1.0220, test_f1: 0.6005
 epoch: 28, train_loss: 0.7842, test_loss: 1.0285, test_f1: 0.6030
 epoch: 29, train_loss: 0.7665, test_loss: 1.0356, test_f1: 0.6089
 epoch: 30, train_loss: 0.7850, test_loss: 1.0427, test_f1: 0.6089
 epoch: 31, train_loss: 0.7642, test_loss: 1.0534, test_f1: 0.5899
 epoch: 32, train_loss: 0.7512, test_loss: 1.0507, test_f1: 0.6025
 epoch: 33, train_loss: 0.7539, test_loss: 1.0588, test_f1: 0.5967
 epoch: 34, train_loss: 0.7452, test_loss: 1.0652, test_f1: 0.5898
 epoch: 35, train_loss: 0.7219, test_loss: 1.0676, test_f1: 0.6143
 epoch: 36, train_loss: 0.7411, test_loss: 1.0409, test_f1: 0.6069
 epoch: 37, train_loss: 0.7206, test_loss: 1.0522, test_f1: 0.6090
 epoch: 38, train_loss: 0.7311, test_loss: 1.0503, test_f1: 0.6276
 epoch: 39, train_loss: 0.7311, test_loss: 1.0860, test_f1: 0.6222
 epoch: 40, train_loss: 0.7034, test_loss: 1.0873, test_f1: 0.6139
 epoch: 41, train_loss: 0.6931, test_loss: 1.1157, test_f1: 0.5986
 epoch: 42, train_loss: 0.6875, test_loss: 1.0818, test_f1: 0.5879
 epoch: 43, train_loss: 0.6839, test_loss: 1.0337, test_f1: 0.6175
 epoch: 44, train_loss: 0.6779, test_loss: 1.0763, test_f1: 0.6263
 epoch: 45, train_loss: 0.6727, test_loss: 1.1013, test_f1: 0.6019
 epoch: 46, train_loss: 0.6562, test_loss: 1.0996, test_f1: 0.6070
 epoch: 47, train_loss: 0.6620, test_loss: 1.0819, test_f1: 0.6123
 epoch: 48, train_loss: 0.6421, test_loss: 1.0939, test_f1: 0.6015
 epoch: 49, train_loss: 0.6475, test_loss: 1.1097, test_f1: 0.6043
 epoch: 50, train_loss: 0.6191, test_loss: 1.0857, test_f1: 0.6073
 epoch: 51, train_loss: 0.6206, test_loss: 1.0948, test_f1: 0.6120
 epoch: 52, train_loss: 0.6354, test_loss: 1.1244, test_f1: 0.5918
 epoch: 53, train_loss: 0.6037, test_loss: 1.1330, test_f1: 0.6068
 epoch: 54, train_loss: 0.6030, test_loss: 1.1374, test_f1: 0.6177
 epoch: 55, train_loss: 0.6086, test_loss: 1.1575, test_f1: 0.6016
 epoch: 56, train_loss: 0.5975, test_loss: 1.1520, test_f1: 0.6008
 epoch: 57, train_loss: 0.5916, test_loss: 1.1721, test_f1: 0.6070
 epoch: 58, train_loss: 0.5965, test_loss: 1.1814, test_f1: 0.6087
 epoch: 59, train_loss: 0.5891, test_loss: 1.2170, test_f1: 0.5864
 epoch: 60, train_loss: 0.5959, test_loss: 1.2204, test_f1: 0.6116
 epoch: 61, train_loss: 0.5840, test_loss: 1.1716, test_f1: 0.5966
 epoch: 62, train_loss: 0.5832, test_loss: 1.1970, test_f1: 0.6088
 epoch: 63, train_loss: 0.5997, test_loss: 1.2077, test_f1: 0.6039
 epoch: 64, train_loss: 0.6045, test_loss: 1.1861, test_f1: 0.5919
 epoch: 65, train_loss: 0.5829, test_loss: 1.2076, test_f1: 0.6167
 epoch: 66, train_loss: 0.5614, test_loss: 1.1974, test_f1: 0.6247
 epoch: 67, train_loss: 0.5828, test_loss: 1.2018, test_f1: 0.6197
 epoch: 68, train_loss: 0.5727, test_loss: 1.1961, test_f1: 0.6115
 epoch: 69, train_loss: 0.5749, test_loss: 1.2221, test_f1: 0.5986
 epoch: 70, train_loss: 0.5698, test_loss: 1.2039, test_f1: 0.6045
 epoch: 71, train_loss: 0.5773, test_loss: 1.2142, test_f1: 0.6099
 epoch: 72, train_loss: 0.5549, test_loss: 1.2266, test_f1: 0.6057
 epoch: 73, train_loss: 0.5629, test_loss: 1.2228, test_f1: 0.6299
 epoch: 74, train_loss: 0.5471, test_loss: 1.1966, test_f1: 0.6147
 epoch: 75, train_loss: 0.5653, test_loss: 1.2117, test_f1: 0.6239
 epoch: 76, train_loss: 0.5464, test_loss: 1.2381, test_f1: 0.6218
 epoch: 77, train_loss: 0.5412, test_loss: 1.2387, test_f1: 0.6146
 epoch: 78, train_loss: 0.5628, test_loss: 1.2633, test_f1: 0.5971
 epoch: 79, train_loss: 0.5595, test_loss: 1.2604, test_f1: 0.6095
 epoch: 80, train_loss: 0.5546, test_loss: 1.2991, test_f1: 0.6148
 epoch: 81, train_loss: 0.5443, test_loss: 1.2605, test_f1: 0.6093
 epoch: 82, train_loss: 0.5450, test_loss: 1.3038, test_f1: 0.6147
 epoch: 83, train_loss: 0.5258, test_loss: 1.3000, test_f1: 0.6136
 epoch: 84, train_loss: 0.5140, test_loss: 1.2778, test_f1: 0.6247
 epoch: 85, train_loss: 0.5247, test_loss: 1.3221, test_f1: 0.6123
 epoch: 86, train_loss: 0.5341, test_loss: 1.3156, test_f1: 0.6121
 epoch: 87, train_loss: 0.5061, test_loss: 1.2759, test_f1: 0.6122
 epoch: 88, train_loss: 0.5088, test_loss: 1.2877, test_f1: 0.6122
 epoch: 89, train_loss: 0.5071, test_loss: 1.3114, test_f1: 0.6093
 epoch: 90, train_loss: 0.5150, test_loss: 1.2721, test_f1: 0.6404
 epoch: 91, train_loss: 0.5065, test_loss: 1.3488, test_f1: 0.6170
 epoch: 92, train_loss: 0.5053, test_loss: 1.3327, test_f1: 0.6223
 epoch: 93, train_loss: 0.5034, test_loss: 1.3882, test_f1: 0.6220
 epoch: 94, train_loss: 0.5002, test_loss: 1.3644, test_f1: 0.6221
 epoch: 95, train_loss: 0.4889, test_loss: 1.3349, test_f1: 0.6050
 epoch: 96, train_loss: 0.5052, test_loss: 1.3792, test_f1: 0.6119
 epoch: 97, train_loss: 0.4954, test_loss: 1.3549, test_f1: 0.6142
 epoch: 98, train_loss: 0.4863, test_loss: 1.3416, test_f1: 0.6097
 epoch: 99, train_loss: 0.4665, test_loss: 1.3760, test_f1: 0.6144
##################ITERATION #8 ****************************************
 epoch: 0, train_loss: 1.2835, test_loss: 1.2092, test_f1: 0.3974
 epoch: 1, train_loss: 1.1039, test_loss: 1.1026, test_f1: 0.5042
 epoch: 2, train_loss: 1.0818, test_loss: 1.0993, test_f1: 0.5208
 epoch: 3, train_loss: 1.0400, test_loss: 1.0785, test_f1: 0.5267
 epoch: 4, train_loss: 1.0155, test_loss: 1.0586, test_f1: 0.5362
 epoch: 5, train_loss: 0.9935, test_loss: 1.0552, test_f1: 0.5442
 epoch: 6, train_loss: 0.9724, test_loss: 1.0481, test_f1: 0.5335
 epoch: 7, train_loss: 0.9491, test_loss: 1.0523, test_f1: 0.5411
 epoch: 8, train_loss: 0.9403, test_loss: 1.0406, test_f1: 0.5638
 epoch: 9, train_loss: 0.9366, test_loss: 1.0364, test_f1: 0.5536
 epoch: 10, train_loss: 0.9117, test_loss: 1.0383, test_f1: 0.5578
 epoch: 11, train_loss: 0.8997, test_loss: 1.0272, test_f1: 0.5731
 epoch: 12, train_loss: 0.9019, test_loss: 1.0249, test_f1: 0.6140
 epoch: 13, train_loss: 0.8876, test_loss: 1.0088, test_f1: 0.5681
 epoch: 14, train_loss: 0.8795, test_loss: 1.0315, test_f1: 0.5899
 epoch: 15, train_loss: 0.8504, test_loss: 1.0311, test_f1: 0.6010
 epoch: 16, train_loss: 0.8577, test_loss: 1.0428, test_f1: 0.5995
 epoch: 17, train_loss: 0.8324, test_loss: 1.0088, test_f1: 0.5806
 epoch: 18, train_loss: 0.8310, test_loss: 1.0197, test_f1: 0.6181
 epoch: 19, train_loss: 0.8160, test_loss: 1.0289, test_f1: 0.5916
 epoch: 20, train_loss: 0.8124, test_loss: 0.9959, test_f1: 0.5943
 epoch: 21, train_loss: 0.7870, test_loss: 1.0114, test_f1: 0.6052
 epoch: 22, train_loss: 0.7895, test_loss: 1.0157, test_f1: 0.5992
 epoch: 23, train_loss: 0.7978, test_loss: 1.0360, test_f1: 0.6180
 epoch: 24, train_loss: 0.7863, test_loss: 1.0049, test_f1: 0.6237
 epoch: 25, train_loss: 0.7829, test_loss: 1.0289, test_f1: 0.6074
 epoch: 26, train_loss: 0.7677, test_loss: 1.0092, test_f1: 0.6449
 epoch: 27, train_loss: 0.7611, test_loss: 1.0124, test_f1: 0.6216
 epoch: 28, train_loss: 0.7581, test_loss: 1.0798, test_f1: 0.6193
 epoch: 29, train_loss: 0.7525, test_loss: 1.0136, test_f1: 0.6105
 epoch: 30, train_loss: 0.7418, test_loss: 1.0160, test_f1: 0.6183
 epoch: 31, train_loss: 0.7389, test_loss: 0.9946, test_f1: 0.6294
 epoch: 32, train_loss: 0.7276, test_loss: 1.0030, test_f1: 0.6123
 epoch: 33, train_loss: 0.7355, test_loss: 1.0229, test_f1: 0.6069
 epoch: 34, train_loss: 0.7140, test_loss: 1.0567, test_f1: 0.6281
 epoch: 35, train_loss: 0.6957, test_loss: 1.0767, test_f1: 0.6028
 epoch: 36, train_loss: 0.7038, test_loss: 1.0571, test_f1: 0.6423
 epoch: 37, train_loss: 0.7078, test_loss: 1.0669, test_f1: 0.6309
 epoch: 38, train_loss: 0.7012, test_loss: 1.0673, test_f1: 0.6530
 epoch: 39, train_loss: 0.6846, test_loss: 1.0683, test_f1: 0.6104
 epoch: 40, train_loss: 0.6845, test_loss: 1.0145, test_f1: 0.6382
 epoch: 41, train_loss: 0.6900, test_loss: 1.0500, test_f1: 0.6236
 epoch: 42, train_loss: 0.6742, test_loss: 1.0742, test_f1: 0.6160
 epoch: 43, train_loss: 0.6686, test_loss: 1.1040, test_f1: 0.6222
 epoch: 44, train_loss: 0.6694, test_loss: 1.0314, test_f1: 0.6475
 epoch: 45, train_loss: 0.6593, test_loss: 1.0769, test_f1: 0.6325
 epoch: 46, train_loss: 0.6546, test_loss: 1.0365, test_f1: 0.6436
 epoch: 47, train_loss: 0.6491, test_loss: 1.0861, test_f1: 0.6101
 epoch: 48, train_loss: 0.6517, test_loss: 1.0577, test_f1: 0.6099
 epoch: 49, train_loss: 0.6250, test_loss: 1.0942, test_f1: 0.6330
 epoch: 50, train_loss: 0.6271, test_loss: 1.1012, test_f1: 0.6513
 epoch: 51, train_loss: 0.6185, test_loss: 1.1232, test_f1: 0.6331
 epoch: 52, train_loss: 0.5940, test_loss: 1.0868, test_f1: 0.6393
 epoch: 53, train_loss: 0.6017, test_loss: 1.1105, test_f1: 0.6321
 epoch: 54, train_loss: 0.5947, test_loss: 1.1186, test_f1: 0.6307
 epoch: 55, train_loss: 0.5899, test_loss: 1.1343, test_f1: 0.6265
 epoch: 56, train_loss: 0.5730, test_loss: 1.1380, test_f1: 0.6167
 epoch: 57, train_loss: 0.5864, test_loss: 1.1517, test_f1: 0.6221
 epoch: 58, train_loss: 0.5707, test_loss: 1.1631, test_f1: 0.6010
 epoch: 59, train_loss: 0.5841, test_loss: 1.1606, test_f1: 0.6344
 epoch: 60, train_loss: 0.5744, test_loss: 1.1691, test_f1: 0.6171
 epoch: 61, train_loss: 0.5936, test_loss: 1.1243, test_f1: 0.6299
 epoch: 62, train_loss: 0.5597, test_loss: 1.1981, test_f1: 0.6124
 epoch: 63, train_loss: 0.5875, test_loss: 1.1688, test_f1: 0.6362
 epoch: 64, train_loss: 0.5782, test_loss: 1.1938, test_f1: 0.6241
 epoch: 65, train_loss: 0.5660, test_loss: 1.1952, test_f1: 0.6146
 epoch: 66, train_loss: 0.5497, test_loss: 1.1937, test_f1: 0.6268
 epoch: 67, train_loss: 0.5846, test_loss: 1.1879, test_f1: 0.6375
 epoch: 68, train_loss: 0.5427, test_loss: 1.1524, test_f1: 0.6313
 epoch: 69, train_loss: 0.5521, test_loss: 1.2363, test_f1: 0.6105
 epoch: 70, train_loss: 0.5535, test_loss: 1.1799, test_f1: 0.6341
 epoch: 71, train_loss: 0.5742, test_loss: 1.2522, test_f1: 0.6132
 epoch: 72, train_loss: 0.5451, test_loss: 1.1950, test_f1: 0.6305
 epoch: 73, train_loss: 0.5266, test_loss: 1.2276, test_f1: 0.6206
 epoch: 74, train_loss: 0.5324, test_loss: 1.2337, test_f1: 0.6245
 epoch: 75, train_loss: 0.5489, test_loss: 1.2519, test_f1: 0.6169
 epoch: 76, train_loss: 0.5367, test_loss: 1.2353, test_f1: 0.6305
 epoch: 77, train_loss: 0.5247, test_loss: 1.2503, test_f1: 0.6271
 epoch: 78, train_loss: 0.5236, test_loss: 1.2756, test_f1: 0.6212
 epoch: 79, train_loss: 0.5084, test_loss: 1.2456, test_f1: 0.6227
 epoch: 80, train_loss: 0.5107, test_loss: 1.2799, test_f1: 0.6179
 epoch: 81, train_loss: 0.5301, test_loss: 1.2572, test_f1: 0.6487
 epoch: 82, train_loss: 0.5048, test_loss: 1.2524, test_f1: 0.6423
 epoch: 83, train_loss: 0.5068, test_loss: 1.2928, test_f1: 0.6273
 epoch: 84, train_loss: 0.5057, test_loss: 1.2669, test_f1: 0.6361
 epoch: 85, train_loss: 0.5141, test_loss: 1.2936, test_f1: 0.6196
 epoch: 86, train_loss: 0.5012, test_loss: 1.2953, test_f1: 0.6407
 epoch: 87, train_loss: 0.5237, test_loss: 1.2859, test_f1: 0.6310
 epoch: 88, train_loss: 0.5154, test_loss: 1.2989, test_f1: 0.6484
 epoch: 89, train_loss: 0.4991, test_loss: 1.3571, test_f1: 0.6272
 epoch: 90, train_loss: 0.4904, test_loss: 1.3108, test_f1: 0.6432
 epoch: 91, train_loss: 0.5008, test_loss: 1.2908, test_f1: 0.6513
 epoch: 92, train_loss: 0.4910, test_loss: 1.3151, test_f1: 0.6350
 epoch: 93, train_loss: 0.4934, test_loss: 1.3794, test_f1: 0.5806
 epoch: 94, train_loss: 0.4850, test_loss: 1.3533, test_f1: 0.6178
 epoch: 95, train_loss: 0.4821, test_loss: 1.3459, test_f1: 0.6283
 epoch: 96, train_loss: 0.4899, test_loss: 1.3611, test_f1: 0.6368
 epoch: 97, train_loss: 0.4915, test_loss: 1.3695, test_f1: 0.6308
 epoch: 98, train_loss: 0.4757, test_loss: 1.3121, test_f1: 0.6404
 epoch: 99, train_loss: 0.4893, test_loss: 1.3463, test_f1: 0.6438
##################ITERATION #9 ****************************************
 epoch: 0, train_loss: 1.2831, test_loss: 1.2111, test_f1: 0.4025
 epoch: 1, train_loss: 1.0910, test_loss: 1.1292, test_f1: 0.4885
 epoch: 2, train_loss: 1.0649, test_loss: 1.1066, test_f1: 0.5233
 epoch: 3, train_loss: 1.0103, test_loss: 1.1021, test_f1: 0.5421
 epoch: 4, train_loss: 1.0225, test_loss: 1.0703, test_f1: 0.5547
 epoch: 5, train_loss: 0.9889, test_loss: 1.0573, test_f1: 0.5502
 epoch: 6, train_loss: 0.9560, test_loss: 1.0704, test_f1: 0.5698
 epoch: 7, train_loss: 0.9580, test_loss: 1.0425, test_f1: 0.5659
 epoch: 8, train_loss: 0.9265, test_loss: 1.0445, test_f1: 0.5786
 epoch: 9, train_loss: 0.9196, test_loss: 1.0488, test_f1: 0.5412
 epoch: 10, train_loss: 0.8988, test_loss: 1.0312, test_f1: 0.5719
 epoch: 11, train_loss: 0.9066, test_loss: 1.0528, test_f1: 0.5656
 epoch: 12, train_loss: 0.8963, test_loss: 1.0229, test_f1: 0.5737
 epoch: 13, train_loss: 0.8828, test_loss: 1.0250, test_f1: 0.5904
 epoch: 14, train_loss: 0.8672, test_loss: 1.0222, test_f1: 0.5891
 epoch: 15, train_loss: 0.8623, test_loss: 1.0229, test_f1: 0.6023
 epoch: 16, train_loss: 0.8354, test_loss: 1.0179, test_f1: 0.5838
 epoch: 17, train_loss: 0.8520, test_loss: 1.0167, test_f1: 0.5958
 epoch: 18, train_loss: 0.8345, test_loss: 1.0151, test_f1: 0.5862
 epoch: 19, train_loss: 0.8328, test_loss: 1.0160, test_f1: 0.5866
 epoch: 20, train_loss: 0.7974, test_loss: 0.9985, test_f1: 0.6071
 epoch: 21, train_loss: 0.8321, test_loss: 1.0323, test_f1: 0.5840
 epoch: 22, train_loss: 0.7863, test_loss: 1.0103, test_f1: 0.6147
 epoch: 23, train_loss: 0.8088, test_loss: 1.0254, test_f1: 0.6182
 epoch: 24, train_loss: 0.7927, test_loss: 0.9972, test_f1: 0.6227
 epoch: 25, train_loss: 0.8022, test_loss: 1.0002, test_f1: 0.6182
 epoch: 26, train_loss: 0.7640, test_loss: 0.9788, test_f1: 0.6153
 epoch: 27, train_loss: 0.7702, test_loss: 0.9840, test_f1: 0.6179
 epoch: 28, train_loss: 0.7728, test_loss: 1.0040, test_f1: 0.5998
 epoch: 29, train_loss: 0.7528, test_loss: 0.9868, test_f1: 0.6076
 epoch: 30, train_loss: 0.7434, test_loss: 0.9631, test_f1: 0.6354
 epoch: 31, train_loss: 0.7440, test_loss: 1.0178, test_f1: 0.6148
 epoch: 32, train_loss: 0.7217, test_loss: 1.0047, test_f1: 0.6328
 epoch: 33, train_loss: 0.7370, test_loss: 0.9998, test_f1: 0.6259
 epoch: 34, train_loss: 0.7187, test_loss: 0.9711, test_f1: 0.6335
 epoch: 35, train_loss: 0.7184, test_loss: 1.0228, test_f1: 0.6312
 epoch: 36, train_loss: 0.7083, test_loss: 1.0135, test_f1: 0.6160
 epoch: 37, train_loss: 0.6994, test_loss: 1.0172, test_f1: 0.6004
 epoch: 38, train_loss: 0.7057, test_loss: 1.0223, test_f1: 0.6112
 epoch: 39, train_loss: 0.6885, test_loss: 1.0346, test_f1: 0.6165
 epoch: 40, train_loss: 0.6727, test_loss: 1.0168, test_f1: 0.6434
 epoch: 41, train_loss: 0.6805, test_loss: 1.0228, test_f1: 0.6309
 epoch: 42, train_loss: 0.6611, test_loss: 1.0520, test_f1: 0.6373
 epoch: 43, train_loss: 0.6673, test_loss: 1.0251, test_f1: 0.6324
 epoch: 44, train_loss: 0.6518, test_loss: 1.0059, test_f1: 0.6320
 epoch: 45, train_loss: 0.6361, test_loss: 1.0515, test_f1: 0.6303
 epoch: 46, train_loss: 0.6628, test_loss: 1.0354, test_f1: 0.6317
 epoch: 47, train_loss: 0.6341, test_loss: 1.0240, test_f1: 0.6434
 epoch: 48, train_loss: 0.6394, test_loss: 1.0491, test_f1: 0.6203
 epoch: 49, train_loss: 0.6481, test_loss: 1.0465, test_f1: 0.6249
 epoch: 50, train_loss: 0.6182, test_loss: 1.0634, test_f1: 0.6264
 epoch: 51, train_loss: 0.6075, test_loss: 1.0334, test_f1: 0.6382
 epoch: 52, train_loss: 0.6258, test_loss: 1.0507, test_f1: 0.6353
 epoch: 53, train_loss: 0.6144, test_loss: 1.0640, test_f1: 0.6603
 epoch: 54, train_loss: 0.5888, test_loss: 1.0900, test_f1: 0.6410
 epoch: 55, train_loss: 0.5880, test_loss: 1.0612, test_f1: 0.6226
 epoch: 56, train_loss: 0.5869, test_loss: 1.0781, test_f1: 0.6475
 epoch: 57, train_loss: 0.5827, test_loss: 1.0618, test_f1: 0.6429
 epoch: 58, train_loss: 0.5865, test_loss: 1.0765, test_f1: 0.6393
 epoch: 59, train_loss: 0.6029, test_loss: 1.0628, test_f1: 0.6515
 epoch: 60, train_loss: 0.5868, test_loss: 1.0514, test_f1: 0.6581
 epoch: 61, train_loss: 0.5882, test_loss: 1.0818, test_f1: 0.6257
 epoch: 62, train_loss: 0.5644, test_loss: 1.0961, test_f1: 0.6247
 epoch: 63, train_loss: 0.5875, test_loss: 1.0797, test_f1: 0.6342
 epoch: 64, train_loss: 0.5619, test_loss: 1.0960, test_f1: 0.6293
 epoch: 65, train_loss: 0.5467, test_loss: 1.0773, test_f1: 0.6448
 epoch: 66, train_loss: 0.5471, test_loss: 1.1141, test_f1: 0.6512
 epoch: 67, train_loss: 0.5494, test_loss: 1.1182, test_f1: 0.6508
 epoch: 68, train_loss: 0.5420, test_loss: 1.1265, test_f1: 0.6304
 epoch: 69, train_loss: 0.5534, test_loss: 1.1188, test_f1: 0.6264
 epoch: 70, train_loss: 0.5492, test_loss: 1.1471, test_f1: 0.6479
 epoch: 71, train_loss: 0.5416, test_loss: 1.1187, test_f1: 0.6375
 epoch: 72, train_loss: 0.5500, test_loss: 1.1229, test_f1: 0.6488
 epoch: 73, train_loss: 0.5502, test_loss: 1.1676, test_f1: 0.6296
 epoch: 74, train_loss: 0.5457, test_loss: 1.1512, test_f1: 0.6311
 epoch: 75, train_loss: 0.5394, test_loss: 1.1549, test_f1: 0.6377
 epoch: 76, train_loss: 0.5293, test_loss: 1.1452, test_f1: 0.6448
 epoch: 77, train_loss: 0.5501, test_loss: 1.1479, test_f1: 0.6397
 epoch: 78, train_loss: 0.5172, test_loss: 1.2147, test_f1: 0.6379
 epoch: 79, train_loss: 0.5363, test_loss: 1.1545, test_f1: 0.6376
 epoch: 80, train_loss: 0.5370, test_loss: 1.2053, test_f1: 0.6323
 epoch: 81, train_loss: 0.5238, test_loss: 1.1616, test_f1: 0.6415
 epoch: 82, train_loss: 0.5207, test_loss: 1.1454, test_f1: 0.6619
 epoch: 83, train_loss: 0.5192, test_loss: 1.1871, test_f1: 0.6503
 epoch: 84, train_loss: 0.5104, test_loss: 1.2156, test_f1: 0.6344
 epoch: 85, train_loss: 0.5128, test_loss: 1.2078, test_f1: 0.6437
 epoch: 86, train_loss: 0.5057, test_loss: 1.1889, test_f1: 0.6402
 epoch: 87, train_loss: 0.4887, test_loss: 1.1898, test_f1: 0.6562
 epoch: 88, train_loss: 0.5071, test_loss: 1.1785, test_f1: 0.6471
 epoch: 89, train_loss: 0.5052, test_loss: 1.2318, test_f1: 0.6216
 epoch: 90, train_loss: 0.5060, test_loss: 1.2863, test_f1: 0.6238
 epoch: 91, train_loss: 0.5065, test_loss: 1.2007, test_f1: 0.6528
 epoch: 92, train_loss: 0.4819, test_loss: 1.1527, test_f1: 0.6623
 epoch: 93, train_loss: 0.4867, test_loss: 1.2566, test_f1: 0.6405
 epoch: 94, train_loss: 0.4801, test_loss: 1.1787, test_f1: 0.6429
 epoch: 95, train_loss: 0.4929, test_loss: 1.2178, test_f1: 0.6424
 epoch: 96, train_loss: 0.4929, test_loss: 1.2633, test_f1: 0.6389
 epoch: 97, train_loss: 0.4694, test_loss: 1.2618, test_f1: 0.6429
 epoch: 98, train_loss: 0.4819, test_loss: 1.2285, test_f1: 0.6447
 epoch: 99, train_loss: 0.4653, test_loss: 1.2416, test_f1: 0.6451

Training completed in 781.44 seconds
Best F1: 0.6823 at epoch 95
Mean F1 across iterations: 0.6567  0.0170
========================FINAL RESULTS================================
FEGIN weighted F1: 0.6823  0.0170
python main.py --data ltspice_demos --representation component_net --model FEGIN --layers 2 --hiddens 128 --batch_size 32 --lr 0.0001 --emb_size 128 --epochs 100 --save_appendix component_net_L2_H128_BS32_LR0.0001_E128 --no_val
-----



STDERR:
  File "main.py", line 370, in <module>
    main()
  File "main.py", line 254, in main
    dataset = dataset_class(
  File "/home/philip/projects/ltspice_examples_code_repo/Circuit-Completion-Using-GNNs/component_classification_with_link_prediction_head/evaluation/FEGIN/kernel/circuit_datasets.py", line 15, in __init__
    self.data, self.slices = torch.load(self.processed_paths[0])
  File "/home/philip/.local/lib/python3.8/site-packages/torch/serialization.py", line 1040, in load
    warnings.warn(
  File "/usr/lib/python3.8/warnings.py", line 109, in _showwarnmsg
    sw(msg.message, msg.category, msg.filename, msg.lineno,
  File "main.py", line 47, in warn_with_traceback
    traceback.print_stack(file=log)
/home/philip/projects/ltspice_examples_code_repo/Circuit-Completion-Using-GNNs/component_classification_with_link_prediction_head/evaluation/FEGIN/kernel/circuit_datasets.py:15: FutureWarning: You are using `torch.load` with `weights_only=False` (the current default value), which uses the default pickle module implicitly. It is possible to construct malicious pickle data which will execute arbitrary code during unpickling (See https://github.com/pytorch/pytorch/blob/main/SECURITY.md#untrusted-models for more details). In a future release, the default value for `weights_only` will be flipped to `True`. This limits the functions that could be executed during unpickling. Arbitrary objects will no longer be allowed to be loaded via this mode unless they are explicitly allowlisted by the user via `torch.serialization.add_safe_globals`. We recommend you start setting `weights_only=True` for any use case where you don't have full control of the loaded file. Please open an issue on GitHub for any issues related to this experimental feature.
  self.data, self.slices = torch.load(self.processed_paths[0])
