STDOUT:
Results will be saved in /home/philip/projects/ltspice_examples_code_repo/Circuit-Completion-Using-GNNs/component_classification_with_link_prediction_head/evaluation/FEGIN/results/model_FEGIN_dataset_ltspice_demos
Command line input: python main.py --data ltspice_demos --representation component_pin_net --model FEGIN --layers 2 --hiddens 64 --batch_size 256 --lr 0.01 --emb_size 128 --epochs 100 --save_appendix component_pin_net_L2_H64_BS256_LR0.01_E128 --no_val
 is saved.
-----
ltspice_demos - FEGIN
Using 2 layers, 64 hidden units, h = 2
Loading component_pin_net representation dataset
ENTERED
Training FEGIN on component_pin_net representation
Train: 1565, Test: 383
##################ITERATION #0 ****************************************
 epoch: 0, train_loss: 1.2459, test_loss: 1.3358, test_f1: 0.3136
 epoch: 1, train_loss: 1.0930, test_loss: 1.7132, test_f1: 0.1365
 epoch: 2, train_loss: 1.0320, test_loss: 1.4933, test_f1: 0.3286
 epoch: 3, train_loss: 0.9916, test_loss: 1.4367, test_f1: 0.1684
 epoch: 4, train_loss: 0.9669, test_loss: 1.3502, test_f1: 0.3079
 epoch: 5, train_loss: 0.9387, test_loss: 1.2053, test_f1: 0.3177
 epoch: 6, train_loss: 0.9229, test_loss: 1.1943, test_f1: 0.4001
 epoch: 7, train_loss: 0.9192, test_loss: 1.1214, test_f1: 0.3205
 epoch: 8, train_loss: 0.8918, test_loss: 1.0601, test_f1: 0.5324
 epoch: 9, train_loss: 0.8848, test_loss: 1.0673, test_f1: 0.5234
 epoch: 10, train_loss: 0.8512, test_loss: 1.0719, test_f1: 0.4353
 epoch: 11, train_loss: 0.8738, test_loss: 1.0751, test_f1: 0.5313
 epoch: 12, train_loss: 0.8581, test_loss: 1.0682, test_f1: 0.5095
 epoch: 13, train_loss: 0.8599, test_loss: 1.0074, test_f1: 0.4827
 epoch: 14, train_loss: 0.8544, test_loss: 1.1816, test_f1: 0.4310
 epoch: 15, train_loss: 0.8041, test_loss: 1.0922, test_f1: 0.4260
 epoch: 16, train_loss: 0.7802, test_loss: 0.9240, test_f1: 0.5654
 epoch: 17, train_loss: 0.7605, test_loss: 0.9348, test_f1: 0.5971
 epoch: 18, train_loss: 0.7651, test_loss: 1.0813, test_f1: 0.4679
 epoch: 19, train_loss: 0.7486, test_loss: 1.7927, test_f1: 0.3675
 epoch: 20, train_loss: 0.7425, test_loss: 1.7405, test_f1: 0.3256
 epoch: 21, train_loss: 0.7326, test_loss: 0.9499, test_f1: 0.5816
 epoch: 22, train_loss: 0.7095, test_loss: 1.2303, test_f1: 0.4803
 epoch: 23, train_loss: 0.7205, test_loss: 1.1961, test_f1: 0.5344
 epoch: 24, train_loss: 0.7086, test_loss: 0.9460, test_f1: 0.6118
 epoch: 25, train_loss: 0.6747, test_loss: 0.9903, test_f1: 0.6323
 epoch: 26, train_loss: 0.7073, test_loss: 1.4798, test_f1: 0.5031
 epoch: 27, train_loss: 0.6870, test_loss: 1.1875, test_f1: 0.5523
 epoch: 28, train_loss: 0.6634, test_loss: 0.9606, test_f1: 0.6294
 epoch: 29, train_loss: 0.6532, test_loss: 1.0563, test_f1: 0.5575
 epoch: 30, train_loss: 0.6313, test_loss: 1.1556, test_f1: 0.5652
 epoch: 31, train_loss: 0.7076, test_loss: 1.2850, test_f1: 0.5553
 epoch: 32, train_loss: 0.6974, test_loss: 1.3938, test_f1: 0.4551
 epoch: 33, train_loss: 0.6918, test_loss: 0.9404, test_f1: 0.6064
 epoch: 34, train_loss: 0.6452, test_loss: 1.0220, test_f1: 0.6220
 epoch: 35, train_loss: 0.6383, test_loss: 0.9881, test_f1: 0.6105
 epoch: 36, train_loss: 0.6274, test_loss: 1.0415, test_f1: 0.5944
 epoch: 37, train_loss: 0.5845, test_loss: 1.0553, test_f1: 0.6345
 epoch: 38, train_loss: 0.5745, test_loss: 1.0003, test_f1: 0.6276
 epoch: 39, train_loss: 0.5823, test_loss: 1.0245, test_f1: 0.6156
 epoch: 40, train_loss: 0.6030, test_loss: 1.2280, test_f1: 0.6342
 epoch: 41, train_loss: 0.6323, test_loss: 1.5903, test_f1: 0.4180
 epoch: 42, train_loss: 0.6271, test_loss: 0.9785, test_f1: 0.5504
 epoch: 43, train_loss: 0.6005, test_loss: 1.0185, test_f1: 0.6287
 epoch: 44, train_loss: 0.5647, test_loss: 1.0090, test_f1: 0.6719
 epoch: 45, train_loss: 0.5792, test_loss: 1.1428, test_f1: 0.5959
 epoch: 46, train_loss: 0.5898, test_loss: 0.9941, test_f1: 0.6096
 epoch: 47, train_loss: 0.5404, test_loss: 1.0002, test_f1: 0.6068
 epoch: 48, train_loss: 0.5917, test_loss: 1.0625, test_f1: 0.5525
 epoch: 49, train_loss: 0.5747, test_loss: 0.9868, test_f1: 0.6204
 epoch: 50, train_loss: 0.5502, test_loss: 1.1432, test_f1: 0.5768
 epoch: 51, train_loss: 0.5779, test_loss: 0.9840, test_f1: 0.5965
 epoch: 52, train_loss: 0.5309, test_loss: 0.9315, test_f1: 0.6362
 epoch: 53, train_loss: 0.5100, test_loss: 0.9802, test_f1: 0.6558
 epoch: 54, train_loss: 0.4805, test_loss: 1.0396, test_f1: 0.6565
 epoch: 55, train_loss: 0.4805, test_loss: 1.0565, test_f1: 0.6554
 epoch: 56, train_loss: 0.4516, test_loss: 1.0379, test_f1: 0.6202
 epoch: 57, train_loss: 0.4438, test_loss: 1.1635, test_f1: 0.5840
 epoch: 58, train_loss: 0.4223, test_loss: 1.2089, test_f1: 0.6157
 epoch: 59, train_loss: 0.4576, test_loss: 1.1765, test_f1: 0.6233
 epoch: 60, train_loss: 0.4279, test_loss: 1.1045, test_f1: 0.6267
 epoch: 61, train_loss: 0.4083, test_loss: 1.1927, test_f1: 0.6375
 epoch: 62, train_loss: 0.3848, test_loss: 1.2077, test_f1: 0.6250
 epoch: 63, train_loss: 0.3807, test_loss: 1.3552, test_f1: 0.6126
 epoch: 64, train_loss: 0.3958, test_loss: 1.3892, test_f1: 0.6077
 epoch: 65, train_loss: 0.4545, test_loss: 1.3198, test_f1: 0.5999
 epoch: 66, train_loss: 0.4442, test_loss: 1.1355, test_f1: 0.6083
 epoch: 67, train_loss: 0.4087, test_loss: 1.0927, test_f1: 0.6527
 epoch: 68, train_loss: 0.4312, test_loss: 1.2287, test_f1: 0.6306
 epoch: 69, train_loss: 0.4417, test_loss: 1.1162, test_f1: 0.6123
 epoch: 70, train_loss: 0.4082, test_loss: 1.2170, test_f1: 0.6079
 epoch: 71, train_loss: 0.4058, test_loss: 1.3103, test_f1: 0.6385
 epoch: 72, train_loss: 0.3611, test_loss: 1.4227, test_f1: 0.6381
 epoch: 73, train_loss: 0.3852, test_loss: 1.6182, test_f1: 0.6033
 epoch: 74, train_loss: 0.4139, test_loss: 1.2179, test_f1: 0.6240
 epoch: 75, train_loss: 0.4085, test_loss: 1.2709, test_f1: 0.6146
 epoch: 76, train_loss: 0.3980, test_loss: 1.2906, test_f1: 0.6285
 epoch: 77, train_loss: 0.3993, test_loss: 1.2954, test_f1: 0.6214
 epoch: 78, train_loss: 0.3496, test_loss: 1.2827, test_f1: 0.6163
 epoch: 79, train_loss: 0.3431, test_loss: 1.2797, test_f1: 0.6361
 epoch: 80, train_loss: 0.3578, test_loss: 1.2813, test_f1: 0.6069
 epoch: 81, train_loss: 0.3679, test_loss: 1.6254, test_f1: 0.6213
 epoch: 82, train_loss: 0.3718, test_loss: 1.2767, test_f1: 0.6189
 epoch: 83, train_loss: 0.3996, test_loss: 1.2137, test_f1: 0.6365
 epoch: 84, train_loss: 0.3682, test_loss: 1.2166, test_f1: 0.6245
 epoch: 85, train_loss: 0.4005, test_loss: 1.5465, test_f1: 0.5422
 epoch: 86, train_loss: 0.3954, test_loss: 1.3397, test_f1: 0.6105
 epoch: 87, train_loss: 0.3658, test_loss: 1.2903, test_f1: 0.6457
 epoch: 88, train_loss: 0.3824, test_loss: 1.4953, test_f1: 0.6100
 epoch: 89, train_loss: 0.3721, test_loss: 1.2277, test_f1: 0.6463
 epoch: 90, train_loss: 0.3474, test_loss: 1.3210, test_f1: 0.6224
 epoch: 91, train_loss: 0.3517, test_loss: 1.3750, test_f1: 0.6199
 epoch: 92, train_loss: 0.3343, test_loss: 1.2526, test_f1: 0.6419
 epoch: 93, train_loss: 0.3392, test_loss: 1.5806, test_f1: 0.5558
 epoch: 94, train_loss: 0.3539, test_loss: 1.7159, test_f1: 0.5317
 epoch: 95, train_loss: 0.3463, test_loss: 1.5441, test_f1: 0.6304
 epoch: 96, train_loss: 0.3487, test_loss: 1.3633, test_f1: 0.6541
 epoch: 97, train_loss: 0.3648, test_loss: 1.4133, test_f1: 0.6640
 epoch: 98, train_loss: 0.3370, test_loss: 1.3003, test_f1: 0.6562
 epoch: 99, train_loss: 0.3508, test_loss: 1.2945, test_f1: 0.6693
##################ITERATION #1 ****************************************
 epoch: 0, train_loss: 1.2125, test_loss: 1.3219, test_f1: 0.2281
 epoch: 1, train_loss: 1.0213, test_loss: 1.3804, test_f1: 0.3144
 epoch: 2, train_loss: 0.9900, test_loss: 1.4840, test_f1: 0.1377
 epoch: 3, train_loss: 0.9489, test_loss: 1.4160, test_f1: 0.1675
 epoch: 4, train_loss: 0.9064, test_loss: 1.3599, test_f1: 0.2094
 epoch: 5, train_loss: 0.8840, test_loss: 1.3293, test_f1: 0.2557
 epoch: 6, train_loss: 0.8629, test_loss: 1.0832, test_f1: 0.5288
 epoch: 7, train_loss: 0.8822, test_loss: 1.0834, test_f1: 0.4917
 epoch: 8, train_loss: 0.8606, test_loss: 1.0955, test_f1: 0.5420
 epoch: 9, train_loss: 0.8296, test_loss: 1.0928, test_f1: 0.5046
 epoch: 10, train_loss: 0.8089, test_loss: 0.9934, test_f1: 0.5823
 epoch: 11, train_loss: 0.8004, test_loss: 1.0504, test_f1: 0.5475
 epoch: 12, train_loss: 0.7882, test_loss: 1.0264, test_f1: 0.5258
 epoch: 13, train_loss: 0.7854, test_loss: 1.0650, test_f1: 0.5025
 epoch: 14, train_loss: 0.7637, test_loss: 0.9791, test_f1: 0.5549
 epoch: 15, train_loss: 0.7587, test_loss: 0.9808, test_f1: 0.6040
 epoch: 16, train_loss: 0.7413, test_loss: 1.0199, test_f1: 0.5901
 epoch: 17, train_loss: 0.7462, test_loss: 1.1932, test_f1: 0.4987
 epoch: 18, train_loss: 0.7275, test_loss: 0.9897, test_f1: 0.5839
 epoch: 19, train_loss: 0.7277, test_loss: 1.0844, test_f1: 0.5738
 epoch: 20, train_loss: 0.6947, test_loss: 1.0967, test_f1: 0.4884
 epoch: 21, train_loss: 0.6926, test_loss: 1.0245, test_f1: 0.5709
 epoch: 22, train_loss: 0.6967, test_loss: 1.0342, test_f1: 0.6077
 epoch: 23, train_loss: 0.6953, test_loss: 0.9909, test_f1: 0.6273
 epoch: 24, train_loss: 0.6640, test_loss: 1.0709, test_f1: 0.5532
 epoch: 25, train_loss: 0.6546, test_loss: 1.1780, test_f1: 0.6022
 epoch: 26, train_loss: 0.7210, test_loss: 1.1590, test_f1: 0.4999
 epoch: 27, train_loss: 0.6701, test_loss: 1.6466, test_f1: 0.5105
 epoch: 28, train_loss: 0.6764, test_loss: 1.3653, test_f1: 0.5059
 epoch: 29, train_loss: 0.6645, test_loss: 1.3827, test_f1: 0.5526
 epoch: 30, train_loss: 0.6415, test_loss: 1.3741, test_f1: 0.4457
 epoch: 31, train_loss: 0.6875, test_loss: 1.3073, test_f1: 0.5243
 epoch: 32, train_loss: 0.6712, test_loss: 1.1655, test_f1: 0.5842
 epoch: 33, train_loss: 0.6390, test_loss: 1.0819, test_f1: 0.5696
 epoch: 34, train_loss: 0.6024, test_loss: 1.1884, test_f1: 0.6477
 epoch: 35, train_loss: 0.6149, test_loss: 1.1721, test_f1: 0.6068
 epoch: 36, train_loss: 0.5902, test_loss: 1.8473, test_f1: 0.5446
 epoch: 37, train_loss: 0.6162, test_loss: 1.1064, test_f1: 0.6099
 epoch: 38, train_loss: 0.5958, test_loss: 1.9150, test_f1: 0.5590
 epoch: 39, train_loss: 0.5769, test_loss: 2.3147, test_f1: 0.4905
 epoch: 40, train_loss: 0.5899, test_loss: 1.5279, test_f1: 0.5284
 epoch: 41, train_loss: 0.5401, test_loss: 1.1953, test_f1: 0.6340
 epoch: 42, train_loss: 0.5281, test_loss: 1.1904, test_f1: 0.6562
 epoch: 43, train_loss: 0.5410, test_loss: 1.1926, test_f1: 0.6312
 epoch: 44, train_loss: 0.5725, test_loss: 1.2815, test_f1: 0.5658
 epoch: 45, train_loss: 0.5678, test_loss: 1.3484, test_f1: 0.6306
 epoch: 46, train_loss: 0.5822, test_loss: 2.1264, test_f1: 0.5457
 epoch: 47, train_loss: 0.5552, test_loss: 1.3499, test_f1: 0.6429
 epoch: 48, train_loss: 0.5386, test_loss: 1.6422, test_f1: 0.5830
 epoch: 49, train_loss: 0.5877, test_loss: 1.7043, test_f1: 0.5714
 epoch: 50, train_loss: 0.5249, test_loss: 1.4839, test_f1: 0.5672
 epoch: 51, train_loss: 0.5182, test_loss: 1.3418, test_f1: 0.6239
 epoch: 52, train_loss: 0.4879, test_loss: 1.3922, test_f1: 0.6324
 epoch: 53, train_loss: 0.4748, test_loss: 1.4577, test_f1: 0.6094
 epoch: 54, train_loss: 0.4323, test_loss: 1.6982, test_f1: 0.5532
 epoch: 55, train_loss: 0.4403, test_loss: 1.5142, test_f1: 0.6097
 epoch: 56, train_loss: 0.5019, test_loss: 1.5619, test_f1: 0.5677
 epoch: 57, train_loss: 0.4732, test_loss: 1.7779, test_f1: 0.5526
 epoch: 58, train_loss: 0.4253, test_loss: 1.7701, test_f1: 0.6079
 epoch: 59, train_loss: 0.4083, test_loss: 1.7437, test_f1: 0.5413
 epoch: 60, train_loss: 0.4386, test_loss: 1.5961, test_f1: 0.6249
 epoch: 61, train_loss: 0.4263, test_loss: 1.6551, test_f1: 0.6652
 epoch: 62, train_loss: 0.3875, test_loss: 1.4556, test_f1: 0.6042
 epoch: 63, train_loss: 0.4311, test_loss: 1.9024, test_f1: 0.5900
 epoch: 64, train_loss: 0.4498, test_loss: 1.4487, test_f1: 0.6206
 epoch: 65, train_loss: 0.3997, test_loss: 1.4813, test_f1: 0.6380
 epoch: 66, train_loss: 0.3735, test_loss: 1.7841, test_f1: 0.5911
 epoch: 67, train_loss: 0.3822, test_loss: 1.9372, test_f1: 0.6185
 epoch: 68, train_loss: 0.3789, test_loss: 1.8388, test_f1: 0.5838
 epoch: 69, train_loss: 0.3713, test_loss: 1.8962, test_f1: 0.6071
 epoch: 70, train_loss: 0.3883, test_loss: 1.7223, test_f1: 0.6247
 epoch: 71, train_loss: 0.3701, test_loss: 1.4956, test_f1: 0.6398
 epoch: 72, train_loss: 0.3217, test_loss: 1.5860, test_f1: 0.6670
 epoch: 73, train_loss: 0.3719, test_loss: 1.7080, test_f1: 0.6448
 epoch: 74, train_loss: 0.3659, test_loss: 1.8114, test_f1: 0.5902
 epoch: 75, train_loss: 0.3568, test_loss: 1.7807, test_f1: 0.6207
 epoch: 76, train_loss: 0.4289, test_loss: 1.7059, test_f1: 0.6324
 epoch: 77, train_loss: 0.4633, test_loss: 1.8350, test_f1: 0.5034
 epoch: 78, train_loss: 0.4298, test_loss: 1.6436, test_f1: 0.5618
 epoch: 79, train_loss: 0.4086, test_loss: 1.6773, test_f1: 0.5542
 epoch: 80, train_loss: 0.3871, test_loss: 1.5619, test_f1: 0.6245
 epoch: 81, train_loss: 0.3873, test_loss: 1.7590, test_f1: 0.6047
 epoch: 82, train_loss: 0.3679, test_loss: 1.9281, test_f1: 0.5853
 epoch: 83, train_loss: 0.3304, test_loss: 1.6776, test_f1: 0.6707
 epoch: 84, train_loss: 0.3670, test_loss: 1.5311, test_f1: 0.6783
 epoch: 85, train_loss: 0.3362, test_loss: 1.5403, test_f1: 0.6406
 epoch: 86, train_loss: 0.3317, test_loss: 1.6181, test_f1: 0.6114
 epoch: 87, train_loss: 0.3046, test_loss: 1.7162, test_f1: 0.6245
 epoch: 88, train_loss: 0.3236, test_loss: 1.8284, test_f1: 0.6522
 epoch: 89, train_loss: 0.2803, test_loss: 1.7043, test_f1: 0.6396
 epoch: 90, train_loss: 0.2929, test_loss: 2.0627, test_f1: 0.6359
 epoch: 91, train_loss: 0.3024, test_loss: 1.8822, test_f1: 0.6250
 epoch: 92, train_loss: 0.2838, test_loss: 1.6805, test_f1: 0.6714
 epoch: 93, train_loss: 0.2872, test_loss: 2.3775, test_f1: 0.6045
 epoch: 94, train_loss: 0.3093, test_loss: 2.1922, test_f1: 0.6253
 epoch: 95, train_loss: 0.2926, test_loss: 1.9833, test_f1: 0.6171
 epoch: 96, train_loss: 0.3029, test_loss: 1.8805, test_f1: 0.6124
 epoch: 97, train_loss: 0.2980, test_loss: 1.9590, test_f1: 0.6130
 epoch: 98, train_loss: 0.3184, test_loss: 2.0324, test_f1: 0.6097
 epoch: 99, train_loss: 0.2796, test_loss: 2.1304, test_f1: 0.6123
##################ITERATION #2 ****************************************
 epoch: 0, train_loss: 1.3089, test_loss: 1.3418, test_f1: 0.2583
 epoch: 1, train_loss: 1.0145, test_loss: 1.2540, test_f1: 0.2720
 epoch: 2, train_loss: 0.9751, test_loss: 1.1707, test_f1: 0.4158
 epoch: 3, train_loss: 0.9349, test_loss: 1.1565, test_f1: 0.2540
 epoch: 4, train_loss: 0.8975, test_loss: 1.1372, test_f1: 0.3183
 epoch: 5, train_loss: 0.9029, test_loss: 1.0396, test_f1: 0.5223
 epoch: 6, train_loss: 0.8600, test_loss: 1.0339, test_f1: 0.5284
 epoch: 7, train_loss: 0.8650, test_loss: 1.0100, test_f1: 0.5221
 epoch: 8, train_loss: 0.8680, test_loss: 1.0252, test_f1: 0.5637
 epoch: 9, train_loss: 0.8467, test_loss: 1.0414, test_f1: 0.5717
 epoch: 10, train_loss: 0.8180, test_loss: 1.0235, test_f1: 0.5631
 epoch: 11, train_loss: 0.8020, test_loss: 0.9920, test_f1: 0.5734
 epoch: 12, train_loss: 0.7886, test_loss: 1.0228, test_f1: 0.5333
 epoch: 13, train_loss: 0.7785, test_loss: 0.9948, test_f1: 0.5254
 epoch: 14, train_loss: 0.7842, test_loss: 1.0250, test_f1: 0.5035
 epoch: 15, train_loss: 0.7869, test_loss: 1.4963, test_f1: 0.4280
 epoch: 16, train_loss: 0.7882, test_loss: 1.0292, test_f1: 0.5072
 epoch: 17, train_loss: 0.7509, test_loss: 1.0542, test_f1: 0.4615
 epoch: 18, train_loss: 0.7570, test_loss: 1.1345, test_f1: 0.5105
 epoch: 19, train_loss: 0.7473, test_loss: 1.2318, test_f1: 0.4481
 epoch: 20, train_loss: 0.7611, test_loss: 1.0533, test_f1: 0.4414
 epoch: 21, train_loss: 0.7376, test_loss: 0.9657, test_f1: 0.6239
 epoch: 22, train_loss: 0.7295, test_loss: 1.2323, test_f1: 0.5264
 epoch: 23, train_loss: 0.7205, test_loss: 1.2578, test_f1: 0.4700
 epoch: 24, train_loss: 0.6879, test_loss: 1.2742, test_f1: 0.5182
 epoch: 25, train_loss: 0.7056, test_loss: 1.1882, test_f1: 0.5038
 epoch: 26, train_loss: 0.7020, test_loss: 1.0647, test_f1: 0.6077
 epoch: 27, train_loss: 0.6849, test_loss: 1.0197, test_f1: 0.5501
 epoch: 28, train_loss: 0.6982, test_loss: 1.1722, test_f1: 0.4718
 epoch: 29, train_loss: 0.6870, test_loss: 1.1341, test_f1: 0.5680
 epoch: 30, train_loss: 0.6759, test_loss: 1.2770, test_f1: 0.5673
 epoch: 31, train_loss: 0.6308, test_loss: 1.3393, test_f1: 0.5093
 epoch: 32, train_loss: 0.6271, test_loss: 1.2676, test_f1: 0.5322
 epoch: 33, train_loss: 0.6663, test_loss: 1.9613, test_f1: 0.3640
 epoch: 34, train_loss: 0.6562, test_loss: 1.3345, test_f1: 0.5935
 epoch: 35, train_loss: 0.6497, test_loss: 1.9915, test_f1: 0.4457
 epoch: 36, train_loss: 0.6347, test_loss: 1.4620, test_f1: 0.5413
 epoch: 37, train_loss: 0.6097, test_loss: 1.6227, test_f1: 0.5939
 epoch: 38, train_loss: 0.6170, test_loss: 1.8863, test_f1: 0.5262
 epoch: 39, train_loss: 0.5962, test_loss: 1.4868, test_f1: 0.5591
 epoch: 40, train_loss: 0.5848, test_loss: 1.2910, test_f1: 0.5660
 epoch: 41, train_loss: 0.6043, test_loss: 1.3481, test_f1: 0.4414
 epoch: 42, train_loss: 0.6671, test_loss: 1.2015, test_f1: 0.4486
 epoch: 43, train_loss: 0.6412, test_loss: 1.1358, test_f1: 0.6202
 epoch: 44, train_loss: 0.5935, test_loss: 1.2454, test_f1: 0.5568
 epoch: 45, train_loss: 0.6084, test_loss: 1.4038, test_f1: 0.5936
 epoch: 46, train_loss: 0.5900, test_loss: 1.5543, test_f1: 0.5350
 epoch: 47, train_loss: 0.5550, test_loss: 1.9110, test_f1: 0.5113
 epoch: 48, train_loss: 0.5788, test_loss: 1.3578, test_f1: 0.5822
 epoch: 49, train_loss: 0.5559, test_loss: 1.4152, test_f1: 0.5664
 epoch: 50, train_loss: 0.5823, test_loss: 1.3747, test_f1: 0.5641
 epoch: 51, train_loss: 0.5222, test_loss: 1.5255, test_f1: 0.5575
 epoch: 52, train_loss: 0.4824, test_loss: 1.3766, test_f1: 0.6167
 epoch: 53, train_loss: 0.4781, test_loss: 1.4625, test_f1: 0.6316
 epoch: 54, train_loss: 0.4741, test_loss: 1.5090, test_f1: 0.5986
 epoch: 55, train_loss: 0.4704, test_loss: 1.5413, test_f1: 0.5891
 epoch: 56, train_loss: 0.4505, test_loss: 1.4258, test_f1: 0.5764
 epoch: 57, train_loss: 0.4546, test_loss: 1.5069, test_f1: 0.5844
 epoch: 58, train_loss: 0.4337, test_loss: 1.6573, test_f1: 0.5925
 epoch: 59, train_loss: 0.4537, test_loss: 1.4852, test_f1: 0.6024
 epoch: 60, train_loss: 0.4433, test_loss: 1.3821, test_f1: 0.6022
 epoch: 61, train_loss: 0.4244, test_loss: 1.7481, test_f1: 0.6064
 epoch: 62, train_loss: 0.4202, test_loss: 1.6653, test_f1: 0.6007
 epoch: 63, train_loss: 0.4682, test_loss: 1.6720, test_f1: 0.6145
 epoch: 64, train_loss: 0.4336, test_loss: 1.6922, test_f1: 0.5898
 epoch: 65, train_loss: 0.4620, test_loss: 1.5163, test_f1: 0.6119
 epoch: 66, train_loss: 0.4411, test_loss: 1.7047, test_f1: 0.6300
 epoch: 67, train_loss: 0.4172, test_loss: 1.9072, test_f1: 0.5941
 epoch: 68, train_loss: 0.3829, test_loss: 1.4618, test_f1: 0.6193
 epoch: 69, train_loss: 0.3835, test_loss: 1.6825, test_f1: 0.6391
 epoch: 70, train_loss: 0.3878, test_loss: 1.4522, test_f1: 0.6441
 epoch: 71, train_loss: 0.3747, test_loss: 1.6711, test_f1: 0.5856
 epoch: 72, train_loss: 0.3960, test_loss: 1.5710, test_f1: 0.6296
 epoch: 73, train_loss: 0.4207, test_loss: 1.8636, test_f1: 0.5723
 epoch: 74, train_loss: 0.3904, test_loss: 1.5768, test_f1: 0.6201
 epoch: 75, train_loss: 0.3939, test_loss: 1.7186, test_f1: 0.6268
 epoch: 76, train_loss: 0.3929, test_loss: 1.6631, test_f1: 0.6286
 epoch: 77, train_loss: 0.3862, test_loss: 1.7616, test_f1: 0.6209
 epoch: 78, train_loss: 0.3631, test_loss: 1.6982, test_f1: 0.6061
 epoch: 79, train_loss: 0.4011, test_loss: 2.0601, test_f1: 0.5399
 epoch: 80, train_loss: 0.4465, test_loss: 2.0558, test_f1: 0.5575
 epoch: 81, train_loss: 0.3829, test_loss: 2.0001, test_f1: 0.6300
 epoch: 82, train_loss: 0.3624, test_loss: 2.2228, test_f1: 0.6436
 epoch: 83, train_loss: 0.3625, test_loss: 2.1512, test_f1: 0.6254
 epoch: 84, train_loss: 0.3511, test_loss: 2.0776, test_f1: 0.6011
 epoch: 85, train_loss: 0.3597, test_loss: 1.9941, test_f1: 0.5511
 epoch: 86, train_loss: 0.3632, test_loss: 2.0807, test_f1: 0.5221
 epoch: 87, train_loss: 0.3553, test_loss: 2.0107, test_f1: 0.5939
 epoch: 88, train_loss: 0.3218, test_loss: 2.1258, test_f1: 0.5686
 epoch: 89, train_loss: 0.3570, test_loss: 1.9252, test_f1: 0.5962
 epoch: 90, train_loss: 0.3178, test_loss: 1.9644, test_f1: 0.6060
 epoch: 91, train_loss: 0.3724, test_loss: 1.8323, test_f1: 0.6249
 epoch: 92, train_loss: 0.3417, test_loss: 2.1988, test_f1: 0.5993
 epoch: 93, train_loss: 0.3577, test_loss: 1.9269, test_f1: 0.5723
 epoch: 94, train_loss: 0.3539, test_loss: 2.3008, test_f1: 0.5757
 epoch: 95, train_loss: 0.3608, test_loss: 2.4450, test_f1: 0.5556
 epoch: 96, train_loss: 0.3620, test_loss: 2.4144, test_f1: 0.5495
 epoch: 97, train_loss: 0.3662, test_loss: 1.9083, test_f1: 0.5830
 epoch: 98, train_loss: 0.3734, test_loss: 2.2408, test_f1: 0.5430
 epoch: 99, train_loss: 0.3330, test_loss: 1.8944, test_f1: 0.6269
##################ITERATION #3 ****************************************
 epoch: 0, train_loss: 1.3401, test_loss: 1.5258, test_f1: 0.2281
 epoch: 1, train_loss: 1.0430, test_loss: 1.4535, test_f1: 0.2705
 epoch: 2, train_loss: 0.9924, test_loss: 1.2926, test_f1: 0.2285
 epoch: 3, train_loss: 0.9555, test_loss: 1.2359, test_f1: 0.3972
 epoch: 4, train_loss: 0.9285, test_loss: 1.1228, test_f1: 0.5105
 epoch: 5, train_loss: 0.8979, test_loss: 1.0278, test_f1: 0.5178
 epoch: 6, train_loss: 0.8668, test_loss: 1.0555, test_f1: 0.5018
 epoch: 7, train_loss: 0.8406, test_loss: 1.1783, test_f1: 0.4212
 epoch: 8, train_loss: 0.8130, test_loss: 1.0824, test_f1: 0.4513
 epoch: 9, train_loss: 0.8253, test_loss: 1.3219, test_f1: 0.3872
 epoch: 10, train_loss: 0.8050, test_loss: 1.0578, test_f1: 0.4872
 epoch: 11, train_loss: 0.7952, test_loss: 1.0461, test_f1: 0.5522
 epoch: 12, train_loss: 0.7711, test_loss: 1.4467, test_f1: 0.4827
 epoch: 13, train_loss: 0.7912, test_loss: 1.6873, test_f1: 0.4319
 epoch: 14, train_loss: 0.7624, test_loss: 1.0858, test_f1: 0.5794
 epoch: 15, train_loss: 0.7530, test_loss: 1.1699, test_f1: 0.5163
 epoch: 16, train_loss: 0.7469, test_loss: 1.0890, test_f1: 0.5529
 epoch: 17, train_loss: 0.7234, test_loss: 1.0801, test_f1: 0.5244
 epoch: 18, train_loss: 0.7353, test_loss: 1.3544, test_f1: 0.4178
 epoch: 19, train_loss: 0.7341, test_loss: 1.1955, test_f1: 0.4736
 epoch: 20, train_loss: 0.7365, test_loss: 1.1473, test_f1: 0.5818
 epoch: 21, train_loss: 0.7360, test_loss: 1.3038, test_f1: 0.4844
 epoch: 22, train_loss: 0.7133, test_loss: 1.1111, test_f1: 0.5134
 epoch: 23, train_loss: 0.7380, test_loss: 1.1367, test_f1: 0.5084
 epoch: 24, train_loss: 0.6833, test_loss: 1.0079, test_f1: 0.5738
 epoch: 25, train_loss: 0.6864, test_loss: 1.2615, test_f1: 0.5328
 epoch: 26, train_loss: 0.6901, test_loss: 1.1564, test_f1: 0.5772
 epoch: 27, train_loss: 0.6796, test_loss: 1.1997, test_f1: 0.5387
 epoch: 28, train_loss: 0.6876, test_loss: 1.5691, test_f1: 0.5209
 epoch: 29, train_loss: 0.6797, test_loss: 1.0528, test_f1: 0.6179
 epoch: 30, train_loss: 0.6737, test_loss: 1.3952, test_f1: 0.5274
 epoch: 31, train_loss: 0.6906, test_loss: 1.1286, test_f1: 0.5716
 epoch: 32, train_loss: 0.6957, test_loss: 1.1888, test_f1: 0.5054
 epoch: 33, train_loss: 0.6736, test_loss: 1.0732, test_f1: 0.5195
 epoch: 34, train_loss: 0.6735, test_loss: 1.4633, test_f1: 0.5122
 epoch: 35, train_loss: 0.6434, test_loss: 2.6847, test_f1: 0.4251
 epoch: 36, train_loss: 0.6302, test_loss: 1.1196, test_f1: 0.5706
 epoch: 37, train_loss: 0.6262, test_loss: 1.2477, test_f1: 0.4502
 epoch: 38, train_loss: 0.6158, test_loss: 1.2818, test_f1: 0.4531
 epoch: 39, train_loss: 0.5796, test_loss: 1.2950, test_f1: 0.5044
 epoch: 40, train_loss: 0.5731, test_loss: 1.1835, test_f1: 0.5552
 epoch: 41, train_loss: 0.5783, test_loss: 1.5676, test_f1: 0.5559
 epoch: 42, train_loss: 0.5513, test_loss: 1.3074, test_f1: 0.6070
 epoch: 43, train_loss: 0.5975, test_loss: 1.1611, test_f1: 0.5341
 epoch: 44, train_loss: 0.5997, test_loss: 1.3513, test_f1: 0.5698
 epoch: 45, train_loss: 0.5574, test_loss: 1.4743, test_f1: 0.5975
 epoch: 46, train_loss: 0.5472, test_loss: 1.3454, test_f1: 0.6009
 epoch: 47, train_loss: 0.5234, test_loss: 1.5395, test_f1: 0.5622
 epoch: 48, train_loss: 0.5223, test_loss: 1.1603, test_f1: 0.6264
 epoch: 49, train_loss: 0.5294, test_loss: 1.4319, test_f1: 0.5411
 epoch: 50, train_loss: 0.5109, test_loss: 1.1917, test_f1: 0.6077
 epoch: 51, train_loss: 0.5054, test_loss: 1.2127, test_f1: 0.6320
 epoch: 52, train_loss: 0.5098, test_loss: 1.2192, test_f1: 0.6361
 epoch: 53, train_loss: 0.4893, test_loss: 1.2124, test_f1: 0.6128
 epoch: 54, train_loss: 0.5016, test_loss: 1.1667, test_f1: 0.6539
 epoch: 55, train_loss: 0.4874, test_loss: 1.1610, test_f1: 0.6307
 epoch: 56, train_loss: 0.4515, test_loss: 1.3789, test_f1: 0.5926
 epoch: 57, train_loss: 0.4273, test_loss: 1.7983, test_f1: 0.5994
 epoch: 58, train_loss: 0.4183, test_loss: 1.5655, test_f1: 0.6406
 epoch: 59, train_loss: 0.4308, test_loss: 1.3622, test_f1: 0.6563
 epoch: 60, train_loss: 0.4192, test_loss: 1.4835, test_f1: 0.5814
 epoch: 61, train_loss: 0.4112, test_loss: 1.6484, test_f1: 0.5975
 epoch: 62, train_loss: 0.3855, test_loss: 1.6250, test_f1: 0.6299
 epoch: 63, train_loss: 0.4573, test_loss: 1.4552, test_f1: 0.6218
 epoch: 64, train_loss: 0.4656, test_loss: 1.9425, test_f1: 0.6097
 epoch: 65, train_loss: 0.4702, test_loss: 1.5979, test_f1: 0.5782
 epoch: 66, train_loss: 0.4554, test_loss: 1.2524, test_f1: 0.5840
 epoch: 67, train_loss: 0.4017, test_loss: 1.4387, test_f1: 0.5872
 epoch: 68, train_loss: 0.3754, test_loss: 1.8792, test_f1: 0.5661
 epoch: 69, train_loss: 0.3659, test_loss: 1.7397, test_f1: 0.5984
 epoch: 70, train_loss: 0.4126, test_loss: 1.7105, test_f1: 0.5587
 epoch: 71, train_loss: 0.3945, test_loss: 1.6292, test_f1: 0.5534
 epoch: 72, train_loss: 0.3997, test_loss: 1.6148, test_f1: 0.5733
 epoch: 73, train_loss: 0.3761, test_loss: 1.5136, test_f1: 0.5854
 epoch: 74, train_loss: 0.3804, test_loss: 1.4692, test_f1: 0.6508
 epoch: 75, train_loss: 0.3961, test_loss: 1.4687, test_f1: 0.6312
 epoch: 76, train_loss: 0.4075, test_loss: 1.3027, test_f1: 0.6148
 epoch: 77, train_loss: 0.4118, test_loss: 1.2031, test_f1: 0.6255
 epoch: 78, train_loss: 0.3693, test_loss: 1.2644, test_f1: 0.6215
 epoch: 79, train_loss: 0.3671, test_loss: 1.2978, test_f1: 0.6335
 epoch: 80, train_loss: 0.4058, test_loss: 1.5050, test_f1: 0.5940
 epoch: 81, train_loss: 0.3714, test_loss: 1.5885, test_f1: 0.5723
 epoch: 82, train_loss: 0.3552, test_loss: 1.3412, test_f1: 0.6054
 epoch: 83, train_loss: 0.3638, test_loss: 1.3070, test_f1: 0.6265
 epoch: 84, train_loss: 0.3546, test_loss: 1.4577, test_f1: 0.5925
 epoch: 85, train_loss: 0.3376, test_loss: 1.8823, test_f1: 0.5736
 epoch: 86, train_loss: 0.3226, test_loss: 1.8983, test_f1: 0.5744
 epoch: 87, train_loss: 0.2987, test_loss: 1.7612, test_f1: 0.6118
 epoch: 88, train_loss: 0.3039, test_loss: 1.7673, test_f1: 0.5929
 epoch: 89, train_loss: 0.3175, test_loss: 1.7699, test_f1: 0.6096
 epoch: 90, train_loss: 0.3377, test_loss: 1.4529, test_f1: 0.6216
 epoch: 91, train_loss: 0.3136, test_loss: 1.5227, test_f1: 0.6378
 epoch: 92, train_loss: 0.3190, test_loss: 1.5055, test_f1: 0.6018
 epoch: 93, train_loss: 0.3214, test_loss: 1.5183, test_f1: 0.6105
 epoch: 94, train_loss: 0.3708, test_loss: 1.5922, test_f1: 0.6203
 epoch: 95, train_loss: 0.3915, test_loss: 1.6658, test_f1: 0.5882
 epoch: 96, train_loss: 0.3710, test_loss: 1.5809, test_f1: 0.5708
 epoch: 97, train_loss: 0.3426, test_loss: 1.7153, test_f1: 0.6363
 epoch: 98, train_loss: 0.3709, test_loss: 1.7863, test_f1: 0.5825
 epoch: 99, train_loss: 0.4360, test_loss: 1.6661, test_f1: 0.6055
##################ITERATION #4 ****************************************
 epoch: 0, train_loss: 1.3952, test_loss: 1.5875, test_f1: 0.2281
 epoch: 1, train_loss: 1.0497, test_loss: 1.5757, test_f1: 0.1365
 epoch: 2, train_loss: 0.9909, test_loss: 1.5180, test_f1: 0.1379
 epoch: 3, train_loss: 0.9293, test_loss: 1.4790, test_f1: 0.3163
 epoch: 4, train_loss: 0.9156, test_loss: 1.2320, test_f1: 0.4485
 epoch: 5, train_loss: 0.8781, test_loss: 1.0955, test_f1: 0.5318
 epoch: 6, train_loss: 0.8703, test_loss: 1.1072, test_f1: 0.4978
 epoch: 7, train_loss: 0.8269, test_loss: 1.0632, test_f1: 0.5669
 epoch: 8, train_loss: 0.8275, test_loss: 1.0208, test_f1: 0.5244
 epoch: 9, train_loss: 0.7951, test_loss: 1.1994, test_f1: 0.4756
 epoch: 10, train_loss: 0.7965, test_loss: 1.3985, test_f1: 0.4067
 epoch: 11, train_loss: 0.8022, test_loss: 1.2618, test_f1: 0.4728
 epoch: 12, train_loss: 0.7730, test_loss: 1.0918, test_f1: 0.5391
 epoch: 13, train_loss: 0.7808, test_loss: 1.0976, test_f1: 0.5379
 epoch: 14, train_loss: 0.7452, test_loss: 1.0657, test_f1: 0.4779
 epoch: 15, train_loss: 0.7252, test_loss: 1.1023, test_f1: 0.5400
 epoch: 16, train_loss: 0.7261, test_loss: 1.2734, test_f1: 0.3893
 epoch: 17, train_loss: 0.7170, test_loss: 0.9965, test_f1: 0.5479
 epoch: 18, train_loss: 0.7075, test_loss: 1.1077, test_f1: 0.5379
 epoch: 19, train_loss: 0.7027, test_loss: 1.5981, test_f1: 0.4718
 epoch: 20, train_loss: 0.6946, test_loss: 1.6304, test_f1: 0.4354
 epoch: 21, train_loss: 0.6674, test_loss: 1.5009, test_f1: 0.5268
 epoch: 22, train_loss: 0.6751, test_loss: 1.9670, test_f1: 0.2781
 epoch: 23, train_loss: 0.6722, test_loss: 1.5621, test_f1: 0.3958
 epoch: 24, train_loss: 0.6825, test_loss: 1.3938, test_f1: 0.4485
 epoch: 25, train_loss: 0.6478, test_loss: 1.1397, test_f1: 0.5049
 epoch: 26, train_loss: 0.6556, test_loss: 1.3308, test_f1: 0.4548
 epoch: 27, train_loss: 0.6140, test_loss: 1.1528, test_f1: 0.5025
 epoch: 28, train_loss: 0.6170, test_loss: 1.1190, test_f1: 0.5311
 epoch: 29, train_loss: 0.6289, test_loss: 1.1097, test_f1: 0.5815
 epoch: 30, train_loss: 0.6542, test_loss: 1.0988, test_f1: 0.5529
 epoch: 31, train_loss: 0.6164, test_loss: 1.1505, test_f1: 0.5842
 epoch: 32, train_loss: 0.6034, test_loss: 1.3021, test_f1: 0.5759
 epoch: 33, train_loss: 0.5571, test_loss: 1.3554, test_f1: 0.5871
 epoch: 34, train_loss: 0.5768, test_loss: 1.6949, test_f1: 0.4486
 epoch: 35, train_loss: 0.6100, test_loss: 1.2704, test_f1: 0.5810
 epoch: 36, train_loss: 0.6706, test_loss: 1.1326, test_f1: 0.5733
 epoch: 37, train_loss: 0.6692, test_loss: 1.6199, test_f1: 0.4412
 epoch: 38, train_loss: 0.6624, test_loss: 1.3881, test_f1: 0.4907
 epoch: 39, train_loss: 0.6170, test_loss: 1.1297, test_f1: 0.5695
 epoch: 40, train_loss: 0.5949, test_loss: 1.1849, test_f1: 0.4718
 epoch: 41, train_loss: 0.5725, test_loss: 1.1051, test_f1: 0.5692
 epoch: 42, train_loss: 0.6243, test_loss: 1.3237, test_f1: 0.6031
 epoch: 43, train_loss: 0.5899, test_loss: 1.5384, test_f1: 0.4579
 epoch: 44, train_loss: 0.5628, test_loss: 1.6963, test_f1: 0.4692
 epoch: 45, train_loss: 0.5221, test_loss: 1.3662, test_f1: 0.5474
 epoch: 46, train_loss: 0.5324, test_loss: 1.2082, test_f1: 0.5431
 epoch: 47, train_loss: 0.5368, test_loss: 1.3217, test_f1: 0.5298
 epoch: 48, train_loss: 0.5307, test_loss: 1.2550, test_f1: 0.5950
 epoch: 49, train_loss: 0.5121, test_loss: 1.6333, test_f1: 0.5168
 epoch: 50, train_loss: 0.5348, test_loss: 1.2635, test_f1: 0.6165
 epoch: 51, train_loss: 0.4828, test_loss: 1.2740, test_f1: 0.6220
 epoch: 52, train_loss: 0.4724, test_loss: 1.2704, test_f1: 0.5852
 epoch: 53, train_loss: 0.4420, test_loss: 1.3380, test_f1: 0.5713
 epoch: 54, train_loss: 0.4621, test_loss: 1.5496, test_f1: 0.5850
 epoch: 55, train_loss: 0.4322, test_loss: 1.3373, test_f1: 0.6156
 epoch: 56, train_loss: 0.4204, test_loss: 1.3681, test_f1: 0.6153
 epoch: 57, train_loss: 0.4137, test_loss: 1.4047, test_f1: 0.5614
 epoch: 58, train_loss: 0.4163, test_loss: 1.5242, test_f1: 0.6059
 epoch: 59, train_loss: 0.4015, test_loss: 1.3875, test_f1: 0.5999
 epoch: 60, train_loss: 0.4103, test_loss: 1.5939, test_f1: 0.5891
 epoch: 61, train_loss: 0.4248, test_loss: 1.5879, test_f1: 0.6121
 epoch: 62, train_loss: 0.4321, test_loss: 1.7429, test_f1: 0.5472
 epoch: 63, train_loss: 0.3955, test_loss: 1.8267, test_f1: 0.5989
 epoch: 64, train_loss: 0.3959, test_loss: 1.7496, test_f1: 0.5997
 epoch: 65, train_loss: 0.4023, test_loss: 1.7348, test_f1: 0.5356
 epoch: 66, train_loss: 0.3891, test_loss: 1.6499, test_f1: 0.6175
 epoch: 67, train_loss: 0.3818, test_loss: 1.5233, test_f1: 0.6362
 epoch: 68, train_loss: 0.3877, test_loss: 1.6679, test_f1: 0.6028
 epoch: 69, train_loss: 0.3728, test_loss: 1.5827, test_f1: 0.6247
 epoch: 70, train_loss: 0.3736, test_loss: 1.6159, test_f1: 0.5949
 epoch: 71, train_loss: 0.3738, test_loss: 1.7104, test_f1: 0.6251
 epoch: 72, train_loss: 0.3367, test_loss: 1.6926, test_f1: 0.6358
 epoch: 73, train_loss: 0.3585, test_loss: 1.4750, test_f1: 0.6101
 epoch: 74, train_loss: 0.4080, test_loss: 1.4516, test_f1: 0.6140
 epoch: 75, train_loss: 0.3596, test_loss: 1.7640, test_f1: 0.5790
 epoch: 76, train_loss: 0.3843, test_loss: 2.1654, test_f1: 0.5387
 epoch: 77, train_loss: 0.3687, test_loss: 2.0968, test_f1: 0.5762
 epoch: 78, train_loss: 0.3569, test_loss: 1.6856, test_f1: 0.5766
 epoch: 79, train_loss: 0.3494, test_loss: 1.5543, test_f1: 0.6137
 epoch: 80, train_loss: 0.3812, test_loss: 2.0975, test_f1: 0.5987
 epoch: 81, train_loss: 0.3499, test_loss: 1.5786, test_f1: 0.6033
 epoch: 82, train_loss: 0.3356, test_loss: 1.7936, test_f1: 0.5881
 epoch: 83, train_loss: 0.3416, test_loss: 1.8692, test_f1: 0.6161
 epoch: 84, train_loss: 0.3367, test_loss: 1.7581, test_f1: 0.5496
 epoch: 85, train_loss: 0.3111, test_loss: 1.6812, test_f1: 0.5751
 epoch: 86, train_loss: 0.3429, test_loss: 2.1585, test_f1: 0.6120
 epoch: 87, train_loss: 0.3467, test_loss: 1.9581, test_f1: 0.6200
 epoch: 88, train_loss: 0.3430, test_loss: 2.5536, test_f1: 0.5391
 epoch: 89, train_loss: 0.3400, test_loss: 2.1369, test_f1: 0.5704
 epoch: 90, train_loss: 0.3560, test_loss: 1.7855, test_f1: 0.5888
 epoch: 91, train_loss: 0.3291, test_loss: 1.7979, test_f1: 0.6082
 epoch: 92, train_loss: 0.3232, test_loss: 1.7306, test_f1: 0.5827
 epoch: 93, train_loss: 0.3157, test_loss: 2.0927, test_f1: 0.6102
 epoch: 94, train_loss: 0.3144, test_loss: 1.9967, test_f1: 0.6297
 epoch: 95, train_loss: 0.2992, test_loss: 1.7859, test_f1: 0.6300
 epoch: 96, train_loss: 0.2753, test_loss: 1.6835, test_f1: 0.6213
 epoch: 97, train_loss: 0.3163, test_loss: 1.5862, test_f1: 0.6116
 epoch: 98, train_loss: 0.3438, test_loss: 1.5133, test_f1: 0.6420
 epoch: 99, train_loss: 0.3026, test_loss: 1.7998, test_f1: 0.6171
##################ITERATION #5 ****************************************
 epoch: 0, train_loss: 1.4870, test_loss: 1.7141, test_f1: 0.1456
 epoch: 1, train_loss: 0.9916, test_loss: 1.6680, test_f1: 0.1368
 epoch: 2, train_loss: 0.9421, test_loss: 1.4828, test_f1: 0.1441
 epoch: 3, train_loss: 0.9171, test_loss: 1.4060, test_f1: 0.1593
 epoch: 4, train_loss: 0.8776, test_loss: 1.2144, test_f1: 0.4170
 epoch: 5, train_loss: 0.8380, test_loss: 1.0345, test_f1: 0.5340
 epoch: 6, train_loss: 0.8090, test_loss: 1.0914, test_f1: 0.5179
 epoch: 7, train_loss: 0.7961, test_loss: 1.0145, test_f1: 0.5647
 epoch: 8, train_loss: 0.7981, test_loss: 1.0140, test_f1: 0.5275
 epoch: 9, train_loss: 0.7913, test_loss: 1.0457, test_f1: 0.5302
 epoch: 10, train_loss: 0.7756, test_loss: 1.1956, test_f1: 0.4333
 epoch: 11, train_loss: 0.7788, test_loss: 1.0528, test_f1: 0.5624
 epoch: 12, train_loss: 0.7715, test_loss: 1.1396, test_f1: 0.5138
 epoch: 13, train_loss: 0.7587, test_loss: 1.1051, test_f1: 0.5610
 epoch: 14, train_loss: 0.7442, test_loss: 1.6967, test_f1: 0.4332
 epoch: 15, train_loss: 0.7287, test_loss: 1.3517, test_f1: 0.4471
 epoch: 16, train_loss: 0.7080, test_loss: 1.0245, test_f1: 0.5368
 epoch: 17, train_loss: 0.7322, test_loss: 1.2997, test_f1: 0.4799
 epoch: 18, train_loss: 0.7253, test_loss: 1.3406, test_f1: 0.4570
 epoch: 19, train_loss: 0.7121, test_loss: 1.1602, test_f1: 0.5173
 epoch: 20, train_loss: 0.6880, test_loss: 1.0491, test_f1: 0.5375
 epoch: 21, train_loss: 0.6802, test_loss: 1.0791, test_f1: 0.5116
 epoch: 22, train_loss: 0.7107, test_loss: 1.1601, test_f1: 0.4693
 epoch: 23, train_loss: 0.6902, test_loss: 1.3406, test_f1: 0.3936
 epoch: 24, train_loss: 0.7143, test_loss: 1.1368, test_f1: 0.5241
 epoch: 25, train_loss: 0.6840, test_loss: 1.1872, test_f1: 0.5195
 epoch: 26, train_loss: 0.6569, test_loss: 1.1260, test_f1: 0.5590
 epoch: 27, train_loss: 0.6495, test_loss: 1.0142, test_f1: 0.5955
 epoch: 28, train_loss: 0.6374, test_loss: 1.3842, test_f1: 0.4708
 epoch: 29, train_loss: 0.6680, test_loss: 1.2818, test_f1: 0.5102
 epoch: 30, train_loss: 0.6280, test_loss: 1.1798, test_f1: 0.5492
 epoch: 31, train_loss: 0.6325, test_loss: 1.2995, test_f1: 0.5496
 epoch: 32, train_loss: 0.6244, test_loss: 1.2527, test_f1: 0.5343
 epoch: 33, train_loss: 0.6354, test_loss: 1.0747, test_f1: 0.5648
 epoch: 34, train_loss: 0.6512, test_loss: 1.1914, test_f1: 0.5917
 epoch: 35, train_loss: 0.6139, test_loss: 1.2476, test_f1: 0.5571
 epoch: 36, train_loss: 0.6121, test_loss: 1.1126, test_f1: 0.5739
 epoch: 37, train_loss: 0.6026, test_loss: 1.3611, test_f1: 0.4977
 epoch: 38, train_loss: 0.6041, test_loss: 1.2746, test_f1: 0.4759
 epoch: 39, train_loss: 0.6248, test_loss: 1.1137, test_f1: 0.5658
 epoch: 40, train_loss: 0.5722, test_loss: 1.1154, test_f1: 0.5723
 epoch: 41, train_loss: 0.5664, test_loss: 1.1621, test_f1: 0.5396
 epoch: 42, train_loss: 0.5166, test_loss: 1.2523, test_f1: 0.5376
 epoch: 43, train_loss: 0.5803, test_loss: 1.3041, test_f1: 0.5016
 epoch: 44, train_loss: 0.6170, test_loss: 1.1753, test_f1: 0.5419
 epoch: 45, train_loss: 0.5684, test_loss: 1.3586, test_f1: 0.5048
 epoch: 46, train_loss: 0.5418, test_loss: 1.2326, test_f1: 0.5091
 epoch: 47, train_loss: 0.5653, test_loss: 1.1261, test_f1: 0.5890
 epoch: 48, train_loss: 0.5303, test_loss: 1.2829, test_f1: 0.5312
 epoch: 49, train_loss: 0.5529, test_loss: 1.0883, test_f1: 0.6320
 epoch: 50, train_loss: 0.5029, test_loss: 1.2820, test_f1: 0.5981
 epoch: 51, train_loss: 0.5035, test_loss: 1.2105, test_f1: 0.5801
 epoch: 52, train_loss: 0.4676, test_loss: 1.2233, test_f1: 0.5544
 epoch: 53, train_loss: 0.4514, test_loss: 1.2577, test_f1: 0.5615
 epoch: 54, train_loss: 0.4592, test_loss: 1.3092, test_f1: 0.5727
 epoch: 55, train_loss: 0.4549, test_loss: 1.3271, test_f1: 0.6037
 epoch: 56, train_loss: 0.4174, test_loss: 1.3258, test_f1: 0.5899
 epoch: 57, train_loss: 0.4165, test_loss: 1.3555, test_f1: 0.6430
 epoch: 58, train_loss: 0.4167, test_loss: 1.2742, test_f1: 0.6616
 epoch: 59, train_loss: 0.4030, test_loss: 1.2486, test_f1: 0.6427
 epoch: 60, train_loss: 0.4015, test_loss: 1.2222, test_f1: 0.6383
 epoch: 61, train_loss: 0.4210, test_loss: 1.3977, test_f1: 0.6188
 epoch: 62, train_loss: 0.4051, test_loss: 1.6285, test_f1: 0.5445
 epoch: 63, train_loss: 0.4180, test_loss: 1.5962, test_f1: 0.5276
 epoch: 64, train_loss: 0.4132, test_loss: 1.4605, test_f1: 0.5844
 epoch: 65, train_loss: 0.4198, test_loss: 1.2314, test_f1: 0.6188
 epoch: 66, train_loss: 0.4035, test_loss: 1.2614, test_f1: 0.6255
 epoch: 67, train_loss: 0.4117, test_loss: 1.3126, test_f1: 0.5861
 epoch: 68, train_loss: 0.4227, test_loss: 1.3305, test_f1: 0.5907
 epoch: 69, train_loss: 0.4194, test_loss: 1.7627, test_f1: 0.5359
 epoch: 70, train_loss: 0.4028, test_loss: 1.9707, test_f1: 0.4951
 epoch: 71, train_loss: 0.3993, test_loss: 1.8208, test_f1: 0.6389
 epoch: 72, train_loss: 0.3791, test_loss: 1.8962, test_f1: 0.5548
 epoch: 73, train_loss: 0.3851, test_loss: 1.8763, test_f1: 0.5830
 epoch: 74, train_loss: 0.3677, test_loss: 1.4712, test_f1: 0.6381
 epoch: 75, train_loss: 0.3794, test_loss: 1.3247, test_f1: 0.6483
 epoch: 76, train_loss: 0.3216, test_loss: 1.3038, test_f1: 0.6204
 epoch: 77, train_loss: 0.3144, test_loss: 1.3358, test_f1: 0.6218
 epoch: 78, train_loss: 0.3435, test_loss: 1.5544, test_f1: 0.6201
 epoch: 79, train_loss: 0.3629, test_loss: 1.5927, test_f1: 0.6317
 epoch: 80, train_loss: 0.4193, test_loss: 1.4522, test_f1: 0.6039
 epoch: 81, train_loss: 0.4587, test_loss: 1.5051, test_f1: 0.5605
 epoch: 82, train_loss: 0.4456, test_loss: 1.3671, test_f1: 0.6183
 epoch: 83, train_loss: 0.4199, test_loss: 1.3909, test_f1: 0.6215
 epoch: 84, train_loss: 0.3697, test_loss: 1.3802, test_f1: 0.6117
 epoch: 85, train_loss: 0.3497, test_loss: 1.4402, test_f1: 0.6149
 epoch: 86, train_loss: 0.3229, test_loss: 1.3092, test_f1: 0.6231
 epoch: 87, train_loss: 0.3268, test_loss: 1.5185, test_f1: 0.6042
 epoch: 88, train_loss: 0.3205, test_loss: 1.7512, test_f1: 0.4928
 epoch: 89, train_loss: 0.2994, test_loss: 1.4809, test_f1: 0.5605
 epoch: 90, train_loss: 0.3490, test_loss: 1.6655, test_f1: 0.6111
 epoch: 91, train_loss: 0.3146, test_loss: 1.5774, test_f1: 0.5950
 epoch: 92, train_loss: 0.2964, test_loss: 1.5371, test_f1: 0.5843
 epoch: 93, train_loss: 0.3053, test_loss: 1.7215, test_f1: 0.5886
 epoch: 94, train_loss: 0.3034, test_loss: 1.5887, test_f1: 0.6198
 epoch: 95, train_loss: 0.3124, test_loss: 1.5365, test_f1: 0.6223
 epoch: 96, train_loss: 0.3071, test_loss: 1.7326, test_f1: 0.5537
 epoch: 97, train_loss: 0.3133, test_loss: 1.6240, test_f1: 0.5715
 epoch: 98, train_loss: 0.3252, test_loss: 1.8382, test_f1: 0.5486
 epoch: 99, train_loss: 0.2833, test_loss: 1.9325, test_f1: 0.5466
##################ITERATION #6 ****************************************
 epoch: 0, train_loss: 1.7514, test_loss: 1.6087, test_f1: 0.1365
 epoch: 1, train_loss: 1.0376, test_loss: 1.5212, test_f1: 0.1365
 epoch: 2, train_loss: 0.9808, test_loss: 1.5358, test_f1: 0.1382
 epoch: 3, train_loss: 0.9410, test_loss: 1.4879, test_f1: 0.1633
 epoch: 4, train_loss: 0.9028, test_loss: 1.3143, test_f1: 0.2983
 epoch: 5, train_loss: 0.8752, test_loss: 1.2737, test_f1: 0.3045
 epoch: 6, train_loss: 0.8520, test_loss: 1.1015, test_f1: 0.4733
 epoch: 7, train_loss: 0.8409, test_loss: 1.1155, test_f1: 0.5045
 epoch: 8, train_loss: 0.8270, test_loss: 1.0074, test_f1: 0.5927
 epoch: 9, train_loss: 0.8277, test_loss: 1.0163, test_f1: 0.5028
 epoch: 10, train_loss: 0.8286, test_loss: 1.0810, test_f1: 0.4991
 epoch: 11, train_loss: 0.7958, test_loss: 1.1350, test_f1: 0.5104
 epoch: 12, train_loss: 0.7977, test_loss: 1.6456, test_f1: 0.4631
 epoch: 13, train_loss: 0.7843, test_loss: 1.3242, test_f1: 0.4374
 epoch: 14, train_loss: 0.7798, test_loss: 1.0548, test_f1: 0.5577
 epoch: 15, train_loss: 0.7512, test_loss: 1.2888, test_f1: 0.4878
 epoch: 16, train_loss: 0.7628, test_loss: 1.3870, test_f1: 0.4618
 epoch: 17, train_loss: 0.7844, test_loss: 1.6738, test_f1: 0.3936
 epoch: 18, train_loss: 0.7767, test_loss: 1.0199, test_f1: 0.6174
 epoch: 19, train_loss: 0.7423, test_loss: 1.0408, test_f1: 0.5872
 epoch: 20, train_loss: 0.7105, test_loss: 1.0777, test_f1: 0.4718
 epoch: 21, train_loss: 0.7275, test_loss: 1.1311, test_f1: 0.4769
 epoch: 22, train_loss: 0.8003, test_loss: 1.2631, test_f1: 0.5011
 epoch: 23, train_loss: 0.8145, test_loss: 1.7305, test_f1: 0.4176
 epoch: 24, train_loss: 0.7579, test_loss: 1.1277, test_f1: 0.5023
 epoch: 25, train_loss: 0.7422, test_loss: 1.3875, test_f1: 0.5065
 epoch: 26, train_loss: 0.7560, test_loss: 1.0787, test_f1: 0.5391
 epoch: 27, train_loss: 0.7388, test_loss: 1.1133, test_f1: 0.5534
 epoch: 28, train_loss: 0.7085, test_loss: 1.1342, test_f1: 0.5303
 epoch: 29, train_loss: 0.6848, test_loss: 1.0948, test_f1: 0.5292
 epoch: 30, train_loss: 0.6669, test_loss: 1.0955, test_f1: 0.5462
 epoch: 31, train_loss: 0.6516, test_loss: 1.1304, test_f1: 0.5443
 epoch: 32, train_loss: 0.6670, test_loss: 1.0305, test_f1: 0.5916
 epoch: 33, train_loss: 0.6556, test_loss: 1.3468, test_f1: 0.5698
 epoch: 34, train_loss: 0.6450, test_loss: 1.3704, test_f1: 0.5630
 epoch: 35, train_loss: 0.6259, test_loss: 1.2928, test_f1: 0.5090
 epoch: 36, train_loss: 0.6119, test_loss: 1.2874, test_f1: 0.5357
 epoch: 37, train_loss: 0.6458, test_loss: 1.1565, test_f1: 0.5300
 epoch: 38, train_loss: 0.6126, test_loss: 1.4072, test_f1: 0.5450
 epoch: 39, train_loss: 0.6041, test_loss: 1.4763, test_f1: 0.5474
 epoch: 40, train_loss: 0.5946, test_loss: 1.3259, test_f1: 0.5512
 epoch: 41, train_loss: 0.6645, test_loss: 1.7125, test_f1: 0.4685
 epoch: 42, train_loss: 0.6288, test_loss: 1.3220, test_f1: 0.5267
 epoch: 43, train_loss: 0.6297, test_loss: 1.2109, test_f1: 0.5671
 epoch: 44, train_loss: 0.6272, test_loss: 1.9352, test_f1: 0.4645
 epoch: 45, train_loss: 0.6029, test_loss: 1.1083, test_f1: 0.5291
 epoch: 46, train_loss: 0.5813, test_loss: 1.1677, test_f1: 0.5695
 epoch: 47, train_loss: 0.5801, test_loss: 1.5319, test_f1: 0.5050
 epoch: 48, train_loss: 0.5733, test_loss: 1.1629, test_f1: 0.5629
 epoch: 49, train_loss: 0.6196, test_loss: 1.1299, test_f1: 0.5346
 epoch: 50, train_loss: 0.5843, test_loss: 1.3470, test_f1: 0.5698
 epoch: 51, train_loss: 0.5777, test_loss: 1.2502, test_f1: 0.6024
 epoch: 52, train_loss: 0.5322, test_loss: 1.2487, test_f1: 0.5599
 epoch: 53, train_loss: 0.5193, test_loss: 1.2810, test_f1: 0.5846
 epoch: 54, train_loss: 0.5001, test_loss: 1.2253, test_f1: 0.5713
 epoch: 55, train_loss: 0.4799, test_loss: 1.3900, test_f1: 0.5430
 epoch: 56, train_loss: 0.5029, test_loss: 1.4469, test_f1: 0.5756
 epoch: 57, train_loss: 0.4869, test_loss: 1.2063, test_f1: 0.5918
 epoch: 58, train_loss: 0.4527, test_loss: 1.3103, test_f1: 0.6066
 epoch: 59, train_loss: 0.4541, test_loss: 1.3138, test_f1: 0.6036
 epoch: 60, train_loss: 0.4514, test_loss: 1.2693, test_f1: 0.6087
 epoch: 61, train_loss: 0.4778, test_loss: 1.2409, test_f1: 0.5869
 epoch: 62, train_loss: 0.4491, test_loss: 1.4544, test_f1: 0.5327
 epoch: 63, train_loss: 0.4545, test_loss: 1.3091, test_f1: 0.6034
 epoch: 64, train_loss: 0.4486, test_loss: 1.2929, test_f1: 0.5727
 epoch: 65, train_loss: 0.4416, test_loss: 1.7401, test_f1: 0.5538
 epoch: 66, train_loss: 0.5013, test_loss: 1.5336, test_f1: 0.5668
 epoch: 67, train_loss: 0.4640, test_loss: 1.4014, test_f1: 0.5950
 epoch: 68, train_loss: 0.4520, test_loss: 1.3845, test_f1: 0.5297
 epoch: 69, train_loss: 0.4745, test_loss: 1.3629, test_f1: 0.5904
 epoch: 70, train_loss: 0.4604, test_loss: 1.5663, test_f1: 0.5424
 epoch: 71, train_loss: 0.4385, test_loss: 1.6828, test_f1: 0.5319
 epoch: 72, train_loss: 0.4589, test_loss: 1.5641, test_f1: 0.5666
 epoch: 73, train_loss: 0.4079, test_loss: 1.4916, test_f1: 0.5473
 epoch: 74, train_loss: 0.4027, test_loss: 1.6886, test_f1: 0.5695
 epoch: 75, train_loss: 0.4252, test_loss: 1.8450, test_f1: 0.6217
 epoch: 76, train_loss: 0.4124, test_loss: 1.5593, test_f1: 0.5774
 epoch: 77, train_loss: 0.4275, test_loss: 1.7027, test_f1: 0.5525
 epoch: 78, train_loss: 0.3966, test_loss: 1.5697, test_f1: 0.5765
 epoch: 79, train_loss: 0.4253, test_loss: 1.4580, test_f1: 0.5206
 epoch: 80, train_loss: 0.3875, test_loss: 1.5287, test_f1: 0.5689
 epoch: 81, train_loss: 0.4240, test_loss: 1.5491, test_f1: 0.5848
 epoch: 82, train_loss: 0.4181, test_loss: 1.6188, test_f1: 0.5972
 epoch: 83, train_loss: 0.3954, test_loss: 1.6145, test_f1: 0.6196
 epoch: 84, train_loss: 0.4044, test_loss: 1.6787, test_f1: 0.6027
 epoch: 85, train_loss: 0.3930, test_loss: 1.5033, test_f1: 0.5348
 epoch: 86, train_loss: 0.4242, test_loss: 1.2900, test_f1: 0.5821
 epoch: 87, train_loss: 0.4341, test_loss: 1.6475, test_f1: 0.5383
 epoch: 88, train_loss: 0.3959, test_loss: 1.8291, test_f1: 0.5681
 epoch: 89, train_loss: 0.3940, test_loss: 1.8702, test_f1: 0.5570
 epoch: 90, train_loss: 0.4058, test_loss: 1.9636, test_f1: 0.5537
 epoch: 91, train_loss: 0.3717, test_loss: 1.6726, test_f1: 0.5813
 epoch: 92, train_loss: 0.3757, test_loss: 1.8348, test_f1: 0.5617
 epoch: 93, train_loss: 0.3871, test_loss: 1.5617, test_f1: 0.6126
 epoch: 94, train_loss: 0.4369, test_loss: 1.7554, test_f1: 0.5876
 epoch: 95, train_loss: 0.4036, test_loss: 1.9936, test_f1: 0.5940
 epoch: 96, train_loss: 0.4217, test_loss: 1.6182, test_f1: 0.5937
 epoch: 97, train_loss: 0.3924, test_loss: 1.7141, test_f1: 0.6051
 epoch: 98, train_loss: 0.4169, test_loss: 1.6647, test_f1: 0.5740
 epoch: 99, train_loss: 0.3846, test_loss: 2.3997, test_f1: 0.5430
##################ITERATION #7 ****************************************
 epoch: 0, train_loss: 1.7372, test_loss: 1.7250, test_f1: 0.1382
 epoch: 1, train_loss: 1.0631, test_loss: 1.6308, test_f1: 0.1365
 epoch: 2, train_loss: 0.9965, test_loss: 1.5240, test_f1: 0.1655
 epoch: 3, train_loss: 0.9754, test_loss: 1.3831, test_f1: 0.3099
 epoch: 4, train_loss: 0.9316, test_loss: 1.3097, test_f1: 0.3775
 epoch: 5, train_loss: 0.9136, test_loss: 1.2572, test_f1: 0.4836
 epoch: 6, train_loss: 0.9059, test_loss: 1.0497, test_f1: 0.5728
 epoch: 7, train_loss: 0.8555, test_loss: 1.2272, test_f1: 0.4736
 epoch: 8, train_loss: 0.8412, test_loss: 1.0589, test_f1: 0.5769
 epoch: 9, train_loss: 0.8520, test_loss: 1.1012, test_f1: 0.5109
 epoch: 10, train_loss: 0.8158, test_loss: 1.1537, test_f1: 0.4699
 epoch: 11, train_loss: 0.8073, test_loss: 1.2765, test_f1: 0.4766
 epoch: 12, train_loss: 0.7996, test_loss: 1.0985, test_f1: 0.5094
 epoch: 13, train_loss: 0.7856, test_loss: 1.1376, test_f1: 0.5233
 epoch: 14, train_loss: 0.7733, test_loss: 1.3252, test_f1: 0.4780
 epoch: 15, train_loss: 0.7541, test_loss: 1.9067, test_f1: 0.4123
 epoch: 16, train_loss: 0.7959, test_loss: 1.2358, test_f1: 0.4533
 epoch: 17, train_loss: 0.7845, test_loss: 1.4060, test_f1: 0.4867
 epoch: 18, train_loss: 0.7786, test_loss: 1.3681, test_f1: 0.4817
 epoch: 19, train_loss: 0.7471, test_loss: 1.8322, test_f1: 0.4274
 epoch: 20, train_loss: 0.7698, test_loss: 1.1073, test_f1: 0.5155
 epoch: 21, train_loss: 0.7608, test_loss: 1.0464, test_f1: 0.5341
 epoch: 22, train_loss: 0.7470, test_loss: 1.0620, test_f1: 0.5507
 epoch: 23, train_loss: 0.7283, test_loss: 1.0588, test_f1: 0.6094
 epoch: 24, train_loss: 0.7133, test_loss: 1.0379, test_f1: 0.5693
 epoch: 25, train_loss: 0.7222, test_loss: 1.1911, test_f1: 0.5089
 epoch: 26, train_loss: 0.6743, test_loss: 1.0802, test_f1: 0.5209
 epoch: 27, train_loss: 0.7363, test_loss: 1.4117, test_f1: 0.4142
 epoch: 28, train_loss: 0.7322, test_loss: 1.8298, test_f1: 0.3968
 epoch: 29, train_loss: 0.6753, test_loss: 1.2509, test_f1: 0.5470
 epoch: 30, train_loss: 0.6898, test_loss: 1.0053, test_f1: 0.6030
 epoch: 31, train_loss: 0.6961, test_loss: 1.0110, test_f1: 0.6018
 epoch: 32, train_loss: 0.6677, test_loss: 1.0143, test_f1: 0.6265
 epoch: 33, train_loss: 0.6534, test_loss: 1.2265, test_f1: 0.4959
 epoch: 34, train_loss: 0.6556, test_loss: 1.2267, test_f1: 0.4917
 epoch: 35, train_loss: 0.6508, test_loss: 1.0575, test_f1: 0.5516
 epoch: 36, train_loss: 0.6260, test_loss: 1.0428, test_f1: 0.6211
 epoch: 37, train_loss: 0.6038, test_loss: 1.0674, test_f1: 0.6005
 epoch: 38, train_loss: 0.6192, test_loss: 1.2457, test_f1: 0.5610
 epoch: 39, train_loss: 0.6181, test_loss: 1.3644, test_f1: 0.5452
 epoch: 40, train_loss: 0.6214, test_loss: 1.2007, test_f1: 0.5438
 epoch: 41, train_loss: 0.6103, test_loss: 1.2325, test_f1: 0.6202
 epoch: 42, train_loss: 0.5959, test_loss: 1.4619, test_f1: 0.5201
 epoch: 43, train_loss: 0.6068, test_loss: 1.1727, test_f1: 0.6013
 epoch: 44, train_loss: 0.6131, test_loss: 1.2152, test_f1: 0.5476
 epoch: 45, train_loss: 0.6176, test_loss: 1.1453, test_f1: 0.5592
 epoch: 46, train_loss: 0.6059, test_loss: 1.0073, test_f1: 0.6355
 epoch: 47, train_loss: 0.5605, test_loss: 1.3160, test_f1: 0.5104
 epoch: 48, train_loss: 0.5838, test_loss: 2.4072, test_f1: 0.4222
 epoch: 49, train_loss: 0.6120, test_loss: 1.3558, test_f1: 0.5041
 epoch: 50, train_loss: 0.6042, test_loss: 1.3087, test_f1: 0.5174
 epoch: 51, train_loss: 0.6325, test_loss: 1.1917, test_f1: 0.5437
 epoch: 52, train_loss: 0.5847, test_loss: 1.1037, test_f1: 0.5463
 epoch: 53, train_loss: 0.5555, test_loss: 1.2694, test_f1: 0.5412
 epoch: 54, train_loss: 0.5512, test_loss: 1.1705, test_f1: 0.6151
 epoch: 55, train_loss: 0.5587, test_loss: 1.1488, test_f1: 0.5338
 epoch: 56, train_loss: 0.5573, test_loss: 1.1209, test_f1: 0.6188
 epoch: 57, train_loss: 0.5345, test_loss: 1.0962, test_f1: 0.6123
 epoch: 58, train_loss: 0.4921, test_loss: 1.1476, test_f1: 0.5563
 epoch: 59, train_loss: 0.5064, test_loss: 1.3052, test_f1: 0.5676
 epoch: 60, train_loss: 0.5177, test_loss: 1.4388, test_f1: 0.5456
 epoch: 61, train_loss: 0.5118, test_loss: 1.3257, test_f1: 0.6010
 epoch: 62, train_loss: 0.4801, test_loss: 1.2983, test_f1: 0.6172
 epoch: 63, train_loss: 0.4842, test_loss: 1.4233, test_f1: 0.6357
 epoch: 64, train_loss: 0.4746, test_loss: 1.3980, test_f1: 0.6371
 epoch: 65, train_loss: 0.4745, test_loss: 1.4390, test_f1: 0.6307
 epoch: 66, train_loss: 0.4433, test_loss: 1.4226, test_f1: 0.6212
 epoch: 67, train_loss: 0.4300, test_loss: 1.2749, test_f1: 0.6204
 epoch: 68, train_loss: 0.4184, test_loss: 1.3267, test_f1: 0.6422
 epoch: 69, train_loss: 0.4249, test_loss: 1.5597, test_f1: 0.6121
 epoch: 70, train_loss: 0.4699, test_loss: 1.4920, test_f1: 0.6188
 epoch: 71, train_loss: 0.4727, test_loss: 1.4874, test_f1: 0.4695
 epoch: 72, train_loss: 0.4496, test_loss: 1.4392, test_f1: 0.5373
 epoch: 73, train_loss: 0.4486, test_loss: 1.3178, test_f1: 0.6227
 epoch: 74, train_loss: 0.4295, test_loss: 1.2125, test_f1: 0.5803
 epoch: 75, train_loss: 0.4306, test_loss: 1.2654, test_f1: 0.5789
 epoch: 76, train_loss: 0.4410, test_loss: 1.2810, test_f1: 0.6415
 epoch: 77, train_loss: 0.4610, test_loss: 1.5136, test_f1: 0.5895
 epoch: 78, train_loss: 0.4281, test_loss: 1.9505, test_f1: 0.5681
 epoch: 79, train_loss: 0.4023, test_loss: 1.7915, test_f1: 0.6345
 epoch: 80, train_loss: 0.4050, test_loss: 2.1010, test_f1: 0.5649
 epoch: 81, train_loss: 0.3906, test_loss: 2.3609, test_f1: 0.5431
 epoch: 82, train_loss: 0.4019, test_loss: 1.6485, test_f1: 0.5951
 epoch: 83, train_loss: 0.3878, test_loss: 1.4906, test_f1: 0.5887
 epoch: 84, train_loss: 0.3753, test_loss: 1.6955, test_f1: 0.6070
 epoch: 85, train_loss: 0.4725, test_loss: 2.2955, test_f1: 0.5325
 epoch: 86, train_loss: 0.4552, test_loss: 2.3855, test_f1: 0.4857
 epoch: 87, train_loss: 0.4253, test_loss: 1.7158, test_f1: 0.5767
 epoch: 88, train_loss: 0.4341, test_loss: 1.6541, test_f1: 0.5800
 epoch: 89, train_loss: 0.4292, test_loss: 1.4201, test_f1: 0.5776
 epoch: 90, train_loss: 0.3776, test_loss: 1.5473, test_f1: 0.6007
 epoch: 91, train_loss: 0.3990, test_loss: 1.5938, test_f1: 0.6053
 epoch: 92, train_loss: 0.3911, test_loss: 1.5238, test_f1: 0.5921
 epoch: 93, train_loss: 0.3620, test_loss: 1.3498, test_f1: 0.6286
 epoch: 94, train_loss: 0.3908, test_loss: 1.4327, test_f1: 0.6044
 epoch: 95, train_loss: 0.3731, test_loss: 1.7125, test_f1: 0.5684
 epoch: 96, train_loss: 0.3967, test_loss: 1.8514, test_f1: 0.5589
 epoch: 97, train_loss: 0.3802, test_loss: 1.8396, test_f1: 0.5321
 epoch: 98, train_loss: 0.3643, test_loss: 1.6920, test_f1: 0.6012
 epoch: 99, train_loss: 0.3728, test_loss: 1.7817, test_f1: 0.5829
##################ITERATION #8 ****************************************
 epoch: 0, train_loss: 1.5852, test_loss: 1.3363, test_f1: 0.2281
 epoch: 1, train_loss: 1.0420, test_loss: 1.3128, test_f1: 0.2973
 epoch: 2, train_loss: 0.9647, test_loss: 1.2591, test_f1: 0.3438
 epoch: 3, train_loss: 0.9293, test_loss: 1.1890, test_f1: 0.3915
 epoch: 4, train_loss: 0.9108, test_loss: 1.1618, test_f1: 0.4780
 epoch: 5, train_loss: 0.9070, test_loss: 1.0606, test_f1: 0.5129
 epoch: 6, train_loss: 0.8784, test_loss: 1.0535, test_f1: 0.4633
 epoch: 7, train_loss: 0.8633, test_loss: 1.0277, test_f1: 0.5584
 epoch: 8, train_loss: 0.8353, test_loss: 1.0148, test_f1: 0.5440
 epoch: 9, train_loss: 0.8092, test_loss: 1.1244, test_f1: 0.5128
 epoch: 10, train_loss: 0.8317, test_loss: 1.1087, test_f1: 0.5509
 epoch: 11, train_loss: 0.8030, test_loss: 1.2292, test_f1: 0.4000
 epoch: 12, train_loss: 0.8103, test_loss: 1.0587, test_f1: 0.5208
 epoch: 13, train_loss: 0.7776, test_loss: 1.0630, test_f1: 0.5424
 epoch: 14, train_loss: 0.7759, test_loss: 1.4314, test_f1: 0.4852
 epoch: 15, train_loss: 0.7484, test_loss: 1.6105, test_f1: 0.5086
 epoch: 16, train_loss: 0.7653, test_loss: 1.1183, test_f1: 0.5632
 epoch: 17, train_loss: 0.7702, test_loss: 1.1577, test_f1: 0.5693
 epoch: 18, train_loss: 0.7669, test_loss: 1.3060, test_f1: 0.4637
 epoch: 19, train_loss: 0.7525, test_loss: 1.5108, test_f1: 0.4692
 epoch: 20, train_loss: 0.7343, test_loss: 1.1725, test_f1: 0.5382
 epoch: 21, train_loss: 0.7207, test_loss: 1.2516, test_f1: 0.5698
 epoch: 22, train_loss: 0.7174, test_loss: 1.6878, test_f1: 0.5587
 epoch: 23, train_loss: 0.7548, test_loss: 1.2463, test_f1: 0.5206
 epoch: 24, train_loss: 0.7393, test_loss: 1.5223, test_f1: 0.5171
 epoch: 25, train_loss: 0.7292, test_loss: 1.2805, test_f1: 0.5555
 epoch: 26, train_loss: 0.7365, test_loss: 1.3767, test_f1: 0.5115
 epoch: 27, train_loss: 0.7689, test_loss: 2.1008, test_f1: 0.3749
 epoch: 28, train_loss: 0.7777, test_loss: 1.6513, test_f1: 0.4685
 epoch: 29, train_loss: 0.7227, test_loss: 1.2874, test_f1: 0.4872
 epoch: 30, train_loss: 0.6929, test_loss: 1.0594, test_f1: 0.5418
 epoch: 31, train_loss: 0.6814, test_loss: 1.0749, test_f1: 0.5948
 epoch: 32, train_loss: 0.6698, test_loss: 1.1103, test_f1: 0.5567
 epoch: 33, train_loss: 0.6497, test_loss: 1.2073, test_f1: 0.5144
 epoch: 34, train_loss: 0.6526, test_loss: 1.1484, test_f1: 0.5362
 epoch: 35, train_loss: 0.6474, test_loss: 1.1106, test_f1: 0.6162
 epoch: 36, train_loss: 0.6595, test_loss: 1.0542, test_f1: 0.5708
 epoch: 37, train_loss: 0.6169, test_loss: 1.2598, test_f1: 0.4885
 epoch: 38, train_loss: 0.6334, test_loss: 1.0559, test_f1: 0.5915
 epoch: 39, train_loss: 0.6435, test_loss: 1.0998, test_f1: 0.5106
 epoch: 40, train_loss: 0.6600, test_loss: 1.4021, test_f1: 0.4542
 epoch: 41, train_loss: 0.6205, test_loss: 1.7669, test_f1: 0.4520
 epoch: 42, train_loss: 0.6258, test_loss: 1.2964, test_f1: 0.5537
 epoch: 43, train_loss: 0.5859, test_loss: 1.2209, test_f1: 0.6061
 epoch: 44, train_loss: 0.6142, test_loss: 1.2486, test_f1: 0.6191
 epoch: 45, train_loss: 0.5900, test_loss: 1.2908, test_f1: 0.6159
 epoch: 46, train_loss: 0.5674, test_loss: 1.1200, test_f1: 0.6076
 epoch: 47, train_loss: 0.6118, test_loss: 1.0491, test_f1: 0.6319
 epoch: 48, train_loss: 0.5919, test_loss: 1.0603, test_f1: 0.6221
 epoch: 49, train_loss: 0.5668, test_loss: 1.0839, test_f1: 0.6113
 epoch: 50, train_loss: 0.5526, test_loss: 1.5517, test_f1: 0.5598
 epoch: 51, train_loss: 0.5731, test_loss: 1.7408, test_f1: 0.5226
 epoch: 52, train_loss: 0.5382, test_loss: 1.3955, test_f1: 0.5894
 epoch: 53, train_loss: 0.5580, test_loss: 1.2768, test_f1: 0.6194
 epoch: 54, train_loss: 0.5105, test_loss: 1.2914, test_f1: 0.6161
 epoch: 55, train_loss: 0.5029, test_loss: 1.5255, test_f1: 0.5098
 epoch: 56, train_loss: 0.5001, test_loss: 1.2586, test_f1: 0.6383
 epoch: 57, train_loss: 0.5178, test_loss: 1.3311, test_f1: 0.5809
 epoch: 58, train_loss: 0.4960, test_loss: 1.5727, test_f1: 0.6290
 epoch: 59, train_loss: 0.4886, test_loss: 1.6083, test_f1: 0.6609
 epoch: 60, train_loss: 0.4735, test_loss: 1.3357, test_f1: 0.6334
 epoch: 61, train_loss: 0.4645, test_loss: 1.2268, test_f1: 0.6455
 epoch: 62, train_loss: 0.5137, test_loss: 1.4101, test_f1: 0.6244
 epoch: 63, train_loss: 0.5015, test_loss: 1.4668, test_f1: 0.5398
 epoch: 64, train_loss: 0.4818, test_loss: 1.1982, test_f1: 0.6765
 epoch: 65, train_loss: 0.4817, test_loss: 1.1579, test_f1: 0.6692
 epoch: 66, train_loss: 0.4607, test_loss: 1.2655, test_f1: 0.6545
 epoch: 67, train_loss: 0.4550, test_loss: 1.4424, test_f1: 0.6365
 epoch: 68, train_loss: 0.4445, test_loss: 1.2284, test_f1: 0.6875
 epoch: 69, train_loss: 0.4426, test_loss: 1.2893, test_f1: 0.5988
 epoch: 70, train_loss: 0.4525, test_loss: 1.3727, test_f1: 0.5526
 epoch: 71, train_loss: 0.4408, test_loss: 1.3284, test_f1: 0.5945
 epoch: 72, train_loss: 0.4261, test_loss: 1.5801, test_f1: 0.5975
 epoch: 73, train_loss: 0.4217, test_loss: 1.3382, test_f1: 0.6243
 epoch: 74, train_loss: 0.3836, test_loss: 1.3523, test_f1: 0.6794
 epoch: 75, train_loss: 0.3922, test_loss: 1.5767, test_f1: 0.6111
 epoch: 76, train_loss: 0.3870, test_loss: 1.4805, test_f1: 0.6286
 epoch: 77, train_loss: 0.3956, test_loss: 1.4802, test_f1: 0.6151
 epoch: 78, train_loss: 0.3725, test_loss: 1.5328, test_f1: 0.6453
 epoch: 79, train_loss: 0.4025, test_loss: 1.4325, test_f1: 0.6273
 epoch: 80, train_loss: 0.4364, test_loss: 1.5478, test_f1: 0.6253
 epoch: 81, train_loss: 0.3838, test_loss: 1.5438, test_f1: 0.6311
 epoch: 82, train_loss: 0.4011, test_loss: 1.2996, test_f1: 0.6243
 epoch: 83, train_loss: 0.3687, test_loss: 1.4273, test_f1: 0.6483
 epoch: 84, train_loss: 0.3781, test_loss: 1.5036, test_f1: 0.6459
 epoch: 85, train_loss: 0.3565, test_loss: 1.4682, test_f1: 0.5867
 epoch: 86, train_loss: 0.3699, test_loss: 1.3293, test_f1: 0.6689
 epoch: 87, train_loss: 0.4168, test_loss: 1.2874, test_f1: 0.6395
 epoch: 88, train_loss: 0.3692, test_loss: 1.2456, test_f1: 0.6460
 epoch: 89, train_loss: 0.3706, test_loss: 1.3130, test_f1: 0.6104
 epoch: 90, train_loss: 0.3621, test_loss: 1.4067, test_f1: 0.6191
 epoch: 91, train_loss: 0.3984, test_loss: 1.5772, test_f1: 0.6256
 epoch: 92, train_loss: 0.3618, test_loss: 2.3499, test_f1: 0.5598
 epoch: 93, train_loss: 0.3436, test_loss: 2.0113, test_f1: 0.6121
 epoch: 94, train_loss: 0.3475, test_loss: 1.6592, test_f1: 0.6101
 epoch: 95, train_loss: 0.3411, test_loss: 1.2353, test_f1: 0.5837
 epoch: 96, train_loss: 0.3421, test_loss: 1.1502, test_f1: 0.6829
 epoch: 97, train_loss: 0.3391, test_loss: 1.6976, test_f1: 0.5626
 epoch: 98, train_loss: 0.3174, test_loss: 1.3657, test_f1: 0.6444
 epoch: 99, train_loss: 0.3531, test_loss: 1.1901, test_f1: 0.6409
##################ITERATION #9 ****************************************
 epoch: 0, train_loss: 1.2467, test_loss: 1.6035, test_f1: 0.2281
 epoch: 1, train_loss: 1.0562, test_loss: 1.6480, test_f1: 0.1365
 epoch: 2, train_loss: 0.9675, test_loss: 1.4356, test_f1: 0.2281
 epoch: 3, train_loss: 0.9356, test_loss: 1.4615, test_f1: 0.2358
 epoch: 4, train_loss: 0.9014, test_loss: 1.4307, test_f1: 0.1897
 epoch: 5, train_loss: 0.8572, test_loss: 1.2311, test_f1: 0.3758
 epoch: 6, train_loss: 0.8455, test_loss: 1.2052, test_f1: 0.4714
 epoch: 7, train_loss: 0.8117, test_loss: 1.0679, test_f1: 0.5308
 epoch: 8, train_loss: 0.8133, test_loss: 1.0380, test_f1: 0.5313
 epoch: 9, train_loss: 0.8342, test_loss: 1.2220, test_f1: 0.5018
 epoch: 10, train_loss: 0.8110, test_loss: 1.1171, test_f1: 0.5605
 epoch: 11, train_loss: 0.7897, test_loss: 1.3117, test_f1: 0.4249
 epoch: 12, train_loss: 0.7890, test_loss: 1.7640, test_f1: 0.4605
 epoch: 13, train_loss: 0.7559, test_loss: 1.5376, test_f1: 0.4961
 epoch: 14, train_loss: 0.7374, test_loss: 1.3435, test_f1: 0.4790
 epoch: 15, train_loss: 0.7229, test_loss: 1.1353, test_f1: 0.5318
 epoch: 16, train_loss: 0.7114, test_loss: 1.4742, test_f1: 0.4673
 epoch: 17, train_loss: 0.7295, test_loss: 1.4538, test_f1: 0.4688
 epoch: 18, train_loss: 0.7068, test_loss: 1.1310, test_f1: 0.5069
 epoch: 19, train_loss: 0.7418, test_loss: 1.2998, test_f1: 0.5118
 epoch: 20, train_loss: 0.7189, test_loss: 1.5145, test_f1: 0.4693
 epoch: 21, train_loss: 0.6925, test_loss: 1.4756, test_f1: 0.5159
 epoch: 22, train_loss: 0.6957, test_loss: 1.5031, test_f1: 0.4984
 epoch: 23, train_loss: 0.6485, test_loss: 1.3403, test_f1: 0.4945
 epoch: 24, train_loss: 0.6402, test_loss: 1.3637, test_f1: 0.5613
 epoch: 25, train_loss: 0.6717, test_loss: 1.5622, test_f1: 0.4789
 epoch: 26, train_loss: 0.6453, test_loss: 2.3542, test_f1: 0.3987
 epoch: 27, train_loss: 0.6436, test_loss: 1.1401, test_f1: 0.5597
 epoch: 28, train_loss: 0.6223, test_loss: 1.2347, test_f1: 0.5042
 epoch: 29, train_loss: 0.6322, test_loss: 1.5599, test_f1: 0.5583
 epoch: 30, train_loss: 0.6177, test_loss: 1.2106, test_f1: 0.5741
 epoch: 31, train_loss: 0.6099, test_loss: 1.6098, test_f1: 0.5080
 epoch: 32, train_loss: 0.6287, test_loss: 1.7848, test_f1: 0.3847
 epoch: 33, train_loss: 0.6242, test_loss: 1.4375, test_f1: 0.4456
 epoch: 34, train_loss: 0.6150, test_loss: 2.6431, test_f1: 0.4453
 epoch: 35, train_loss: 0.5922, test_loss: 1.2236, test_f1: 0.5045
 epoch: 36, train_loss: 0.6291, test_loss: 1.3852, test_f1: 0.5185
 epoch: 37, train_loss: 0.6196, test_loss: 1.3559, test_f1: 0.5241
 epoch: 38, train_loss: 0.6290, test_loss: 1.9681, test_f1: 0.4662
 epoch: 39, train_loss: 0.6480, test_loss: 1.7248, test_f1: 0.4832
 epoch: 40, train_loss: 0.5942, test_loss: 1.5469, test_f1: 0.4713
 epoch: 41, train_loss: 0.6162, test_loss: 1.5554, test_f1: 0.5458
 epoch: 42, train_loss: 0.6023, test_loss: 1.8802, test_f1: 0.4925
 epoch: 43, train_loss: 0.5819, test_loss: 1.4833, test_f1: 0.5278
 epoch: 44, train_loss: 0.5881, test_loss: 1.8472, test_f1: 0.5252
 epoch: 45, train_loss: 0.5636, test_loss: 1.3936, test_f1: 0.5857
 epoch: 46, train_loss: 0.5778, test_loss: 1.3604, test_f1: 0.5834
 epoch: 47, train_loss: 0.5166, test_loss: 1.8153, test_f1: 0.5934
 epoch: 48, train_loss: 0.5727, test_loss: 2.2043, test_f1: 0.4953
 epoch: 49, train_loss: 0.5666, test_loss: 1.8774, test_f1: 0.5945
 epoch: 50, train_loss: 0.5295, test_loss: 3.1477, test_f1: 0.4995
 epoch: 51, train_loss: 0.5695, test_loss: 2.3777, test_f1: 0.5837
 epoch: 52, train_loss: 0.5359, test_loss: 1.5094, test_f1: 0.6363
 epoch: 53, train_loss: 0.4935, test_loss: 1.3722, test_f1: 0.6174
 epoch: 54, train_loss: 0.4676, test_loss: 1.4909, test_f1: 0.6206
 epoch: 55, train_loss: 0.4560, test_loss: 1.5865, test_f1: 0.6127
 epoch: 56, train_loss: 0.4508, test_loss: 1.5625, test_f1: 0.6016
 epoch: 57, train_loss: 0.4639, test_loss: 1.4819, test_f1: 0.6021
 epoch: 58, train_loss: 0.4593, test_loss: 1.3503, test_f1: 0.6357
 epoch: 59, train_loss: 0.4278, test_loss: 1.5939, test_f1: 0.6104
 epoch: 60, train_loss: 0.4248, test_loss: 1.7364, test_f1: 0.5679
 epoch: 61, train_loss: 0.4276, test_loss: 1.9788, test_f1: 0.5215
 epoch: 62, train_loss: 0.4019, test_loss: 1.7150, test_f1: 0.6318
 epoch: 63, train_loss: 0.4355, test_loss: 1.7632, test_f1: 0.6199
 epoch: 64, train_loss: 0.3864, test_loss: 1.7127, test_f1: 0.5627
 epoch: 65, train_loss: 0.4007, test_loss: 1.8871, test_f1: 0.6186
 epoch: 66, train_loss: 0.4034, test_loss: 2.5365, test_f1: 0.5146
 epoch: 67, train_loss: 0.4541, test_loss: 2.1784, test_f1: 0.5641
 epoch: 68, train_loss: 0.4398, test_loss: 1.7180, test_f1: 0.5776
 epoch: 69, train_loss: 0.4146, test_loss: 1.7139, test_f1: 0.6025
 epoch: 70, train_loss: 0.4546, test_loss: 1.8173, test_f1: 0.4788
 epoch: 71, train_loss: 0.4958, test_loss: 1.5281, test_f1: 0.5468
 epoch: 72, train_loss: 0.4252, test_loss: 1.5120, test_f1: 0.6581
 epoch: 73, train_loss: 0.4020, test_loss: 1.6989, test_f1: 0.6480
 epoch: 74, train_loss: 0.4076, test_loss: 1.7425, test_f1: 0.5815
 epoch: 75, train_loss: 0.4005, test_loss: 2.1008, test_f1: 0.5887
 epoch: 76, train_loss: 0.3824, test_loss: 2.3916, test_f1: 0.6015
 epoch: 77, train_loss: 0.3668, test_loss: 2.3866, test_f1: 0.5942
 epoch: 78, train_loss: 0.3845, test_loss: 2.0185, test_f1: 0.6009
 epoch: 79, train_loss: 0.3864, test_loss: 2.0921, test_f1: 0.5900
 epoch: 80, train_loss: 0.3944, test_loss: 1.7332, test_f1: 0.6474
 epoch: 81, train_loss: 0.3943, test_loss: 1.8773, test_f1: 0.5952
 epoch: 82, train_loss: 0.3781, test_loss: 1.9334, test_f1: 0.5739
 epoch: 83, train_loss: 0.3953, test_loss: 2.1250, test_f1: 0.5769
 epoch: 84, train_loss: 0.3903, test_loss: 2.4024, test_f1: 0.6070
 epoch: 85, train_loss: 0.3740, test_loss: 2.7721, test_f1: 0.5578
 epoch: 86, train_loss: 0.3847, test_loss: 2.6161, test_f1: 0.5606
 epoch: 87, train_loss: 0.3572, test_loss: 2.3420, test_f1: 0.5549
 epoch: 88, train_loss: 0.4089, test_loss: 2.1214, test_f1: 0.6140
 epoch: 89, train_loss: 0.3721, test_loss: 2.1536, test_f1: 0.6543
 epoch: 90, train_loss: 0.3393, test_loss: 2.0385, test_f1: 0.5501
 epoch: 91, train_loss: 0.3323, test_loss: 2.4398, test_f1: 0.5046
 epoch: 92, train_loss: 0.3637, test_loss: 2.4432, test_f1: 0.5294
 epoch: 93, train_loss: 0.4038, test_loss: 3.1412, test_f1: 0.5840
 epoch: 94, train_loss: 0.3911, test_loss: 3.0294, test_f1: 0.5203
 epoch: 95, train_loss: 0.3724, test_loss: 1.7235, test_f1: 0.6035
 epoch: 96, train_loss: 0.3967, test_loss: 1.6185, test_f1: 0.6289
 epoch: 97, train_loss: 0.3555, test_loss: 1.7414, test_f1: 0.6079
 epoch: 98, train_loss: 0.3593, test_loss: 1.7652, test_f1: 0.5913
 epoch: 99, train_loss: 0.3570, test_loss: 1.6645, test_f1: 0.6164

Training completed in 365.13 seconds
Best F1: 0.6875 at epoch 68
Mean F1 across iterations: 0.6564  0.0187
========================FINAL RESULTS================================
FEGIN weighted F1: 0.6875  0.0187
python main.py --data ltspice_demos --representation component_pin_net --model FEGIN --layers 2 --hiddens 64 --batch_size 256 --lr 0.01 --emb_size 128 --epochs 100 --save_appendix component_pin_net_L2_H64_BS256_LR0.01_E128 --no_val
-----



STDERR:
  File "main.py", line 370, in <module>
    main()
  File "main.py", line 254, in main
    dataset = dataset_class(
  File "/home/philip/projects/ltspice_examples_code_repo/Circuit-Completion-Using-GNNs/component_classification_with_link_prediction_head/evaluation/FEGIN/kernel/circuit_datasets.py", line 15, in __init__
    self.data, self.slices = torch.load(self.processed_paths[0])
  File "/home/philip/.local/lib/python3.8/site-packages/torch/serialization.py", line 1040, in load
    warnings.warn(
  File "/usr/lib/python3.8/warnings.py", line 109, in _showwarnmsg
    sw(msg.message, msg.category, msg.filename, msg.lineno,
  File "main.py", line 47, in warn_with_traceback
    traceback.print_stack(file=log)
/home/philip/projects/ltspice_examples_code_repo/Circuit-Completion-Using-GNNs/component_classification_with_link_prediction_head/evaluation/FEGIN/kernel/circuit_datasets.py:15: FutureWarning: You are using `torch.load` with `weights_only=False` (the current default value), which uses the default pickle module implicitly. It is possible to construct malicious pickle data which will execute arbitrary code during unpickling (See https://github.com/pytorch/pytorch/blob/main/SECURITY.md#untrusted-models for more details). In a future release, the default value for `weights_only` will be flipped to `True`. This limits the functions that could be executed during unpickling. Arbitrary objects will no longer be allowed to be loaded via this mode unless they are explicitly allowlisted by the user via `torch.serialization.add_safe_globals`. We recommend you start setting `weights_only=True` for any use case where you don't have full control of the loaded file. Please open an issue on GitHub for any issues related to this experimental feature.
  self.data, self.slices = torch.load(self.processed_paths[0])
