STDOUT:
Results will be saved in /home/philip/projects/llm_inference_code_repo/Circuit-Completion-Using-GNNs/component_classification_with_link_prediction_head/evaluation/FEGIN/results/model_FEGIN_dataset_ltspice_examples
Command line input: python main.py --data ltspice_examples --representation component_component --model FEGIN --layers 5 --hiddens 128 --batch_size 256 --lr 0.0001 --emb_size 250 --epochs 100 --save_appendix component_component_L5_H128_BS256_LR0.0001_E250 --no_val
 is saved.
-----
ltspice_examples - FEGIN
Using 5 layers, 128 hidden units, h = 2
Loading component_component representation dataset
ENTERED
Training FEGIN on component_component representation
Train: 3556, Test: 845
##################ITERATION #0 ****************************************
 epoch: 0, train_loss: 1.3925, test_loss: 1.3859, test_f1: 0.1885
 epoch: 1, train_loss: 1.3760, test_loss: 1.3744, test_f1: 0.1943
 epoch: 2, train_loss: 1.3630, test_loss: 1.3571, test_f1: 0.3586
 epoch: 3, train_loss: 1.3474, test_loss: 1.3370, test_f1: 0.3738
 epoch: 4, train_loss: 1.3273, test_loss: 1.3105, test_f1: 0.3456
 epoch: 5, train_loss: 1.3021, test_loss: 1.2805, test_f1: 0.3152
 epoch: 6, train_loss: 1.2776, test_loss: 1.2503, test_f1: 0.3151
 epoch: 7, train_loss: 1.2531, test_loss: 1.2254, test_f1: 0.3159
 epoch: 8, train_loss: 1.2307, test_loss: 1.2030, test_f1: 0.3414
 epoch: 9, train_loss: 1.2125, test_loss: 1.1847, test_f1: 0.3456
 epoch: 10, train_loss: 1.1948, test_loss: 1.1687, test_f1: 0.3489
 epoch: 11, train_loss: 1.1826, test_loss: 1.1561, test_f1: 0.3591
 epoch: 12, train_loss: 1.1638, test_loss: 1.1448, test_f1: 0.3572
 epoch: 13, train_loss: 1.1458, test_loss: 1.1308, test_f1: 0.3756
 epoch: 14, train_loss: 1.1359, test_loss: 1.1098, test_f1: 0.4045
 epoch: 15, train_loss: 1.1124, test_loss: 1.1135, test_f1: 0.3945
 epoch: 16, train_loss: 1.0969, test_loss: 1.0994, test_f1: 0.4643
 epoch: 17, train_loss: 1.0789, test_loss: 1.0750, test_f1: 0.4963
 epoch: 18, train_loss: 1.0626, test_loss: 1.0852, test_f1: 0.4744
 epoch: 19, train_loss: 1.0397, test_loss: 1.0584, test_f1: 0.4898
 epoch: 20, train_loss: 1.0200, test_loss: 1.0640, test_f1: 0.4890
 epoch: 21, train_loss: 1.0112, test_loss: 1.0657, test_f1: 0.4709
 epoch: 22, train_loss: 0.9900, test_loss: 1.0642, test_f1: 0.4798
 epoch: 23, train_loss: 0.9726, test_loss: 1.0577, test_f1: 0.4903
 epoch: 24, train_loss: 0.9668, test_loss: 1.0772, test_f1: 0.4655
 epoch: 25, train_loss: 0.9436, test_loss: 1.0771, test_f1: 0.4735
 epoch: 26, train_loss: 0.9361, test_loss: 1.0696, test_f1: 0.4884
 epoch: 27, train_loss: 0.9175, test_loss: 1.0735, test_f1: 0.4876
 epoch: 28, train_loss: 0.9079, test_loss: 1.0784, test_f1: 0.4751
 epoch: 29, train_loss: 0.9001, test_loss: 1.0945, test_f1: 0.4758
 epoch: 30, train_loss: 0.8783, test_loss: 1.0666, test_f1: 0.4761
 epoch: 31, train_loss: 0.8766, test_loss: 1.0978, test_f1: 0.4948
 epoch: 32, train_loss: 0.8703, test_loss: 1.1022, test_f1: 0.4768
 epoch: 33, train_loss: 0.8491, test_loss: 1.0785, test_f1: 0.4908
 epoch: 34, train_loss: 0.8421, test_loss: 1.1264, test_f1: 0.4890
 epoch: 35, train_loss: 0.8359, test_loss: 1.1063, test_f1: 0.4940
 epoch: 36, train_loss: 0.8304, test_loss: 1.1228, test_f1: 0.4833
 epoch: 37, train_loss: 0.8253, test_loss: 1.1593, test_f1: 0.4942
 epoch: 38, train_loss: 0.8091, test_loss: 1.1095, test_f1: 0.4834
 epoch: 39, train_loss: 0.8066, test_loss: 1.1204, test_f1: 0.4960
 epoch: 40, train_loss: 0.7984, test_loss: 1.1614, test_f1: 0.4874
 epoch: 41, train_loss: 0.7861, test_loss: 1.1712, test_f1: 0.4853
 epoch: 42, train_loss: 0.7793, test_loss: 1.1849, test_f1: 0.4895
 epoch: 43, train_loss: 0.7740, test_loss: 1.1738, test_f1: 0.4888
 epoch: 44, train_loss: 0.7629, test_loss: 1.1972, test_f1: 0.4933
 epoch: 45, train_loss: 0.7609, test_loss: 1.1753, test_f1: 0.4967
 epoch: 46, train_loss: 0.7463, test_loss: 1.2049, test_f1: 0.5044
 epoch: 47, train_loss: 0.7502, test_loss: 1.2073, test_f1: 0.4957
 epoch: 48, train_loss: 0.7364, test_loss: 1.2454, test_f1: 0.4790
 epoch: 49, train_loss: 0.7298, test_loss: 1.2743, test_f1: 0.4796
 epoch: 50, train_loss: 0.7302, test_loss: 1.2033, test_f1: 0.5019
 epoch: 51, train_loss: 0.7213, test_loss: 1.2105, test_f1: 0.4978
 epoch: 52, train_loss: 0.7066, test_loss: 1.2349, test_f1: 0.5050
 epoch: 53, train_loss: 0.6920, test_loss: 1.2475, test_f1: 0.5106
 epoch: 54, train_loss: 0.6980, test_loss: 1.2650, test_f1: 0.5115
 epoch: 55, train_loss: 0.6832, test_loss: 1.2642, test_f1: 0.5057
 epoch: 56, train_loss: 0.6917, test_loss: 1.2588, test_f1: 0.5165
 epoch: 57, train_loss: 0.6858, test_loss: 1.2594, test_f1: 0.5098
 epoch: 58, train_loss: 0.6759, test_loss: 1.2753, test_f1: 0.5062
 epoch: 59, train_loss: 0.6770, test_loss: 1.2706, test_f1: 0.4937
 epoch: 60, train_loss: 0.6719, test_loss: 1.3213, test_f1: 0.5133
 epoch: 61, train_loss: 0.6567, test_loss: 1.2969, test_f1: 0.4956
 epoch: 62, train_loss: 0.6655, test_loss: 1.3159, test_f1: 0.4978
 epoch: 63, train_loss: 0.6617, test_loss: 1.2894, test_f1: 0.5043
 epoch: 64, train_loss: 0.6623, test_loss: 1.3484, test_f1: 0.4911
 epoch: 65, train_loss: 0.6487, test_loss: 1.3276, test_f1: 0.5047
 epoch: 66, train_loss: 0.6603, test_loss: 1.3128, test_f1: 0.5006
 epoch: 67, train_loss: 0.6451, test_loss: 1.3332, test_f1: 0.5093
 epoch: 68, train_loss: 0.6476, test_loss: 1.3312, test_f1: 0.4927
 epoch: 69, train_loss: 0.6403, test_loss: 1.3055, test_f1: 0.4965
 epoch: 70, train_loss: 0.6417, test_loss: 1.3055, test_f1: 0.5135
 epoch: 71, train_loss: 0.6319, test_loss: 1.3356, test_f1: 0.4998
 epoch: 72, train_loss: 0.6418, test_loss: 1.3164, test_f1: 0.5004
 epoch: 73, train_loss: 0.6332, test_loss: 1.3743, test_f1: 0.5011
 epoch: 74, train_loss: 0.6220, test_loss: 1.3173, test_f1: 0.4946
 epoch: 75, train_loss: 0.6246, test_loss: 1.3372, test_f1: 0.5144
 epoch: 76, train_loss: 0.6238, test_loss: 1.3711, test_f1: 0.4980
 epoch: 77, train_loss: 0.6334, test_loss: 1.3321, test_f1: 0.5156
 epoch: 78, train_loss: 0.6182, test_loss: 1.3679, test_f1: 0.5122
 epoch: 79, train_loss: 0.6188, test_loss: 1.3531, test_f1: 0.5056
 epoch: 80, train_loss: 0.6089, test_loss: 1.3528, test_f1: 0.4981
 epoch: 81, train_loss: 0.6079, test_loss: 1.3500, test_f1: 0.5090
 epoch: 82, train_loss: 0.6093, test_loss: 1.3854, test_f1: 0.4967
 epoch: 83, train_loss: 0.6025, test_loss: 1.4131, test_f1: 0.5035
 epoch: 84, train_loss: 0.5942, test_loss: 1.3747, test_f1: 0.5080
 epoch: 85, train_loss: 0.6002, test_loss: 1.3868, test_f1: 0.4961
 epoch: 86, train_loss: 0.5831, test_loss: 1.3533, test_f1: 0.5162
 epoch: 87, train_loss: 0.5930, test_loss: 1.3633, test_f1: 0.4993
 epoch: 88, train_loss: 0.6030, test_loss: 1.3959, test_f1: 0.5063
 epoch: 89, train_loss: 0.5988, test_loss: 1.3546, test_f1: 0.5186
 epoch: 90, train_loss: 0.5836, test_loss: 1.3785, test_f1: 0.5031
 epoch: 91, train_loss: 0.5961, test_loss: 1.3972, test_f1: 0.5099
 epoch: 92, train_loss: 0.5919, test_loss: 1.4516, test_f1: 0.5002
 epoch: 93, train_loss: 0.5824, test_loss: 1.4398, test_f1: 0.5229
 epoch: 94, train_loss: 0.5763, test_loss: 1.4152, test_f1: 0.5122
 epoch: 95, train_loss: 0.5876, test_loss: 1.4458, test_f1: 0.5074
 epoch: 96, train_loss: 0.5707, test_loss: 1.4431, test_f1: 0.5076
 epoch: 97, train_loss: 0.5812, test_loss: 1.4311, test_f1: 0.5159
 epoch: 98, train_loss: 0.5835, test_loss: 1.4306, test_f1: 0.5067
 epoch: 99, train_loss: 0.5638, test_loss: 1.4245, test_f1: 0.5194
##################ITERATION #1 ****************************************
 epoch: 0, train_loss: 1.3522, test_loss: 1.3501, test_f1: 0.2282
 epoch: 1, train_loss: 1.3024, test_loss: 1.3180, test_f1: 0.2274
 epoch: 2, train_loss: 1.2763, test_loss: 1.2856, test_f1: 0.2274
 epoch: 3, train_loss: 1.2497, test_loss: 1.2573, test_f1: 0.2300
 epoch: 4, train_loss: 1.2313, test_loss: 1.2317, test_f1: 0.2621
 epoch: 5, train_loss: 1.2141, test_loss: 1.2003, test_f1: 0.3343
 epoch: 6, train_loss: 1.1898, test_loss: 1.1768, test_f1: 0.3985
 epoch: 7, train_loss: 1.1751, test_loss: 1.1608, test_f1: 0.4206
 epoch: 8, train_loss: 1.1526, test_loss: 1.1461, test_f1: 0.4457
 epoch: 9, train_loss: 1.1379, test_loss: 1.1355, test_f1: 0.4472
 epoch: 10, train_loss: 1.1147, test_loss: 1.1145, test_f1: 0.4559
 epoch: 11, train_loss: 1.0969, test_loss: 1.0964, test_f1: 0.4632
 epoch: 12, train_loss: 1.0835, test_loss: 1.0834, test_f1: 0.4464
 epoch: 13, train_loss: 1.0684, test_loss: 1.0767, test_f1: 0.4677
 epoch: 14, train_loss: 1.0462, test_loss: 1.0557, test_f1: 0.4660
 epoch: 15, train_loss: 1.0221, test_loss: 1.0461, test_f1: 0.4727
 epoch: 16, train_loss: 1.0128, test_loss: 1.0592, test_f1: 0.4677
 epoch: 17, train_loss: 0.9968, test_loss: 1.0435, test_f1: 0.4649
 epoch: 18, train_loss: 0.9797, test_loss: 1.0361, test_f1: 0.4703
 epoch: 19, train_loss: 0.9636, test_loss: 1.0535, test_f1: 0.4838
 epoch: 20, train_loss: 0.9439, test_loss: 1.0602, test_f1: 0.4802
 epoch: 21, train_loss: 0.9314, test_loss: 1.0701, test_f1: 0.4859
 epoch: 22, train_loss: 0.9179, test_loss: 1.0632, test_f1: 0.4603
 epoch: 23, train_loss: 0.9119, test_loss: 1.0765, test_f1: 0.4658
 epoch: 24, train_loss: 0.8883, test_loss: 1.0700, test_f1: 0.4833
 epoch: 25, train_loss: 0.8823, test_loss: 1.1145, test_f1: 0.4631
 epoch: 26, train_loss: 0.8627, test_loss: 1.1080, test_f1: 0.4757
 epoch: 27, train_loss: 0.8546, test_loss: 1.1240, test_f1: 0.4707
 epoch: 28, train_loss: 0.8330, test_loss: 1.1486, test_f1: 0.4667
 epoch: 29, train_loss: 0.8357, test_loss: 1.1136, test_f1: 0.4760
 epoch: 30, train_loss: 0.8262, test_loss: 1.2216, test_f1: 0.4475
 epoch: 31, train_loss: 0.8111, test_loss: 1.1667, test_f1: 0.4753
 epoch: 32, train_loss: 0.8062, test_loss: 1.1774, test_f1: 0.4855
 epoch: 33, train_loss: 0.7874, test_loss: 1.1818, test_f1: 0.4814
 epoch: 34, train_loss: 0.7912, test_loss: 1.2115, test_f1: 0.4905
 epoch: 35, train_loss: 0.7900, test_loss: 1.2621, test_f1: 0.4674
 epoch: 36, train_loss: 0.7770, test_loss: 1.2457, test_f1: 0.4668
 epoch: 37, train_loss: 0.7652, test_loss: 1.2379, test_f1: 0.4862
 epoch: 38, train_loss: 0.7621, test_loss: 1.2059, test_f1: 0.4879
 epoch: 39, train_loss: 0.7564, test_loss: 1.2403, test_f1: 0.4790
 epoch: 40, train_loss: 0.7376, test_loss: 1.2765, test_f1: 0.4754
 epoch: 41, train_loss: 0.7377, test_loss: 1.2793, test_f1: 0.4799
 epoch: 42, train_loss: 0.7228, test_loss: 1.2802, test_f1: 0.4974
 epoch: 43, train_loss: 0.7146, test_loss: 1.3227, test_f1: 0.4759
 epoch: 44, train_loss: 0.7135, test_loss: 1.3217, test_f1: 0.4710
 epoch: 45, train_loss: 0.7177, test_loss: 1.3498, test_f1: 0.4732
 epoch: 46, train_loss: 0.6984, test_loss: 1.3352, test_f1: 0.4867
 epoch: 47, train_loss: 0.6952, test_loss: 1.3640, test_f1: 0.4842
 epoch: 48, train_loss: 0.6820, test_loss: 1.3391, test_f1: 0.4775
 epoch: 49, train_loss: 0.6825, test_loss: 1.3705, test_f1: 0.4810
 epoch: 50, train_loss: 0.6784, test_loss: 1.3908, test_f1: 0.4923
 epoch: 51, train_loss: 0.6648, test_loss: 1.3540, test_f1: 0.5025
 epoch: 52, train_loss: 0.6580, test_loss: 1.3834, test_f1: 0.4905
 epoch: 53, train_loss: 0.6606, test_loss: 1.3881, test_f1: 0.4816
 epoch: 54, train_loss: 0.6468, test_loss: 1.4146, test_f1: 0.4809
 epoch: 55, train_loss: 0.6463, test_loss: 1.3993, test_f1: 0.4794
 epoch: 56, train_loss: 0.6372, test_loss: 1.4487, test_f1: 0.4893
 epoch: 57, train_loss: 0.6279, test_loss: 1.4294, test_f1: 0.4740
 epoch: 58, train_loss: 0.6278, test_loss: 1.4537, test_f1: 0.4769
 epoch: 59, train_loss: 0.6203, test_loss: 1.4244, test_f1: 0.4866
 epoch: 60, train_loss: 0.6258, test_loss: 1.4209, test_f1: 0.4827
 epoch: 61, train_loss: 0.6121, test_loss: 1.4445, test_f1: 0.4754
 epoch: 62, train_loss: 0.6160, test_loss: 1.4508, test_f1: 0.4816
 epoch: 63, train_loss: 0.6072, test_loss: 1.4759, test_f1: 0.4802
 epoch: 64, train_loss: 0.6159, test_loss: 1.5185, test_f1: 0.4742
 epoch: 65, train_loss: 0.6210, test_loss: 1.5020, test_f1: 0.4817
 epoch: 66, train_loss: 0.6038, test_loss: 1.4946, test_f1: 0.4803
 epoch: 67, train_loss: 0.6127, test_loss: 1.5159, test_f1: 0.4791
 epoch: 68, train_loss: 0.5999, test_loss: 1.5089, test_f1: 0.4667
 epoch: 69, train_loss: 0.5841, test_loss: 1.5613, test_f1: 0.4734
 epoch: 70, train_loss: 0.5960, test_loss: 1.5734, test_f1: 0.4779
 epoch: 71, train_loss: 0.5768, test_loss: 1.5645, test_f1: 0.4718
 epoch: 72, train_loss: 0.5954, test_loss: 1.5499, test_f1: 0.4816
 epoch: 73, train_loss: 0.5907, test_loss: 1.5496, test_f1: 0.4924
 epoch: 74, train_loss: 0.5738, test_loss: 1.5499, test_f1: 0.4719
 epoch: 75, train_loss: 0.5845, test_loss: 1.5852, test_f1: 0.4697
 epoch: 76, train_loss: 0.5827, test_loss: 1.5530, test_f1: 0.4760
 epoch: 77, train_loss: 0.5816, test_loss: 1.5775, test_f1: 0.4766
 epoch: 78, train_loss: 0.5699, test_loss: 1.5615, test_f1: 0.4920
 epoch: 79, train_loss: 0.5681, test_loss: 1.5912, test_f1: 0.5008
 epoch: 80, train_loss: 0.5714, test_loss: 1.5996, test_f1: 0.4757
 epoch: 81, train_loss: 0.5820, test_loss: 1.5629, test_f1: 0.4888
 epoch: 82, train_loss: 0.5827, test_loss: 1.5839, test_f1: 0.4932
 epoch: 83, train_loss: 0.5642, test_loss: 1.5936, test_f1: 0.5025
 epoch: 84, train_loss: 0.5775, test_loss: 1.5804, test_f1: 0.4961
 epoch: 85, train_loss: 0.5521, test_loss: 1.6563, test_f1: 0.4831
 epoch: 86, train_loss: 0.5394, test_loss: 1.6947, test_f1: 0.4782
 epoch: 87, train_loss: 0.5642, test_loss: 1.6413, test_f1: 0.4867
 epoch: 88, train_loss: 0.5569, test_loss: 1.6737, test_f1: 0.4927
 epoch: 89, train_loss: 0.5546, test_loss: 1.6757, test_f1: 0.4932
 epoch: 90, train_loss: 0.5454, test_loss: 1.6662, test_f1: 0.4960
 epoch: 91, train_loss: 0.5470, test_loss: 1.6304, test_f1: 0.4970
 epoch: 92, train_loss: 0.5428, test_loss: 1.6520, test_f1: 0.4926
 epoch: 93, train_loss: 0.5258, test_loss: 1.6763, test_f1: 0.4993
 epoch: 94, train_loss: 0.5410, test_loss: 1.7173, test_f1: 0.4935
 epoch: 95, train_loss: 0.5403, test_loss: 1.6482, test_f1: 0.4964
 epoch: 96, train_loss: 0.5331, test_loss: 1.6636, test_f1: 0.4874
 epoch: 97, train_loss: 0.5284, test_loss: 1.6665, test_f1: 0.4955
 epoch: 98, train_loss: 0.5214, test_loss: 1.6828, test_f1: 0.4887
 epoch: 99, train_loss: 0.5357, test_loss: 1.7439, test_f1: 0.4923
##################ITERATION #2 ****************************************
 epoch: 0, train_loss: 1.3226, test_loss: 1.3342, test_f1: 0.2339
 epoch: 1, train_loss: 1.2506, test_loss: 1.2922, test_f1: 0.2269
 epoch: 2, train_loss: 1.2236, test_loss: 1.2405, test_f1: 0.2857
 epoch: 3, train_loss: 1.1992, test_loss: 1.1995, test_f1: 0.4026
 epoch: 4, train_loss: 1.1793, test_loss: 1.1752, test_f1: 0.3996
 epoch: 5, train_loss: 1.1623, test_loss: 1.1506, test_f1: 0.4292
 epoch: 6, train_loss: 1.1451, test_loss: 1.1374, test_f1: 0.4405
 epoch: 7, train_loss: 1.1244, test_loss: 1.1236, test_f1: 0.4371
 epoch: 8, train_loss: 1.1158, test_loss: 1.1129, test_f1: 0.4284
 epoch: 9, train_loss: 1.0915, test_loss: 1.0986, test_f1: 0.4368
 epoch: 10, train_loss: 1.0792, test_loss: 1.0885, test_f1: 0.4316
 epoch: 11, train_loss: 1.0606, test_loss: 1.0753, test_f1: 0.4371
 epoch: 12, train_loss: 1.0506, test_loss: 1.0665, test_f1: 0.4400
 epoch: 13, train_loss: 1.0417, test_loss: 1.0611, test_f1: 0.4395
 epoch: 14, train_loss: 1.0244, test_loss: 1.0604, test_f1: 0.4430
 epoch: 15, train_loss: 1.0022, test_loss: 1.0650, test_f1: 0.4455
 epoch: 16, train_loss: 0.9989, test_loss: 1.0559, test_f1: 0.4460
 epoch: 17, train_loss: 0.9754, test_loss: 1.0432, test_f1: 0.4505
 epoch: 18, train_loss: 0.9614, test_loss: 1.0505, test_f1: 0.4613
 epoch: 19, train_loss: 0.9606, test_loss: 1.0530, test_f1: 0.4489
 epoch: 20, train_loss: 0.9504, test_loss: 1.0647, test_f1: 0.4368
 epoch: 21, train_loss: 0.9353, test_loss: 1.0571, test_f1: 0.4528
 epoch: 22, train_loss: 0.9298, test_loss: 1.0746, test_f1: 0.4401
 epoch: 23, train_loss: 0.9060, test_loss: 1.0516, test_f1: 0.4595
 epoch: 24, train_loss: 0.8973, test_loss: 1.0678, test_f1: 0.4617
 epoch: 25, train_loss: 0.8915, test_loss: 1.1000, test_f1: 0.4469
 epoch: 26, train_loss: 0.8708, test_loss: 1.0912, test_f1: 0.4630
 epoch: 27, train_loss: 0.8778, test_loss: 1.1218, test_f1: 0.4622
 epoch: 28, train_loss: 0.8499, test_loss: 1.0537, test_f1: 0.4898
 epoch: 29, train_loss: 0.8479, test_loss: 1.1246, test_f1: 0.4574
 epoch: 30, train_loss: 0.8313, test_loss: 1.0406, test_f1: 0.5102
 epoch: 31, train_loss: 0.8325, test_loss: 1.1770, test_f1: 0.4634
 epoch: 32, train_loss: 0.8165, test_loss: 1.0642, test_f1: 0.4904
 epoch: 33, train_loss: 0.7953, test_loss: 1.1809, test_f1: 0.4583
 epoch: 34, train_loss: 0.7870, test_loss: 1.0843, test_f1: 0.4799
 epoch: 35, train_loss: 0.7824, test_loss: 1.1836, test_f1: 0.4710
 epoch: 36, train_loss: 0.7771, test_loss: 1.1094, test_f1: 0.4899
 epoch: 37, train_loss: 0.7655, test_loss: 1.1233, test_f1: 0.4951
 epoch: 38, train_loss: 0.7610, test_loss: 1.1442, test_f1: 0.4753
 epoch: 39, train_loss: 0.7558, test_loss: 1.2536, test_f1: 0.4489
 epoch: 40, train_loss: 0.7429, test_loss: 1.1315, test_f1: 0.4870
 epoch: 41, train_loss: 0.7419, test_loss: 1.2091, test_f1: 0.4746
 epoch: 42, train_loss: 0.7301, test_loss: 1.1926, test_f1: 0.4884
 epoch: 43, train_loss: 0.7207, test_loss: 1.1445, test_f1: 0.5011
 epoch: 44, train_loss: 0.7124, test_loss: 1.2083, test_f1: 0.4889
 epoch: 45, train_loss: 0.7048, test_loss: 1.2161, test_f1: 0.5012
 epoch: 46, train_loss: 0.7084, test_loss: 1.1943, test_f1: 0.4797
 epoch: 47, train_loss: 0.6971, test_loss: 1.2044, test_f1: 0.4783
 epoch: 48, train_loss: 0.6913, test_loss: 1.2622, test_f1: 0.4934
 epoch: 49, train_loss: 0.6730, test_loss: 1.2045, test_f1: 0.4854
 epoch: 50, train_loss: 0.6778, test_loss: 1.2132, test_f1: 0.4890
 epoch: 51, train_loss: 0.6594, test_loss: 1.2890, test_f1: 0.4804
 epoch: 52, train_loss: 0.6477, test_loss: 1.2041, test_f1: 0.5045
 epoch: 53, train_loss: 0.6438, test_loss: 1.3323, test_f1: 0.4839
 epoch: 54, train_loss: 0.6444, test_loss: 1.2514, test_f1: 0.4866
 epoch: 55, train_loss: 0.6323, test_loss: 1.2821, test_f1: 0.4954
 epoch: 56, train_loss: 0.6316, test_loss: 1.3118, test_f1: 0.4887
 epoch: 57, train_loss: 0.6205, test_loss: 1.3092, test_f1: 0.4909
 epoch: 58, train_loss: 0.6152, test_loss: 1.3281, test_f1: 0.4720
 epoch: 59, train_loss: 0.6297, test_loss: 1.3242, test_f1: 0.4846
 epoch: 60, train_loss: 0.6252, test_loss: 1.2883, test_f1: 0.4814
 epoch: 61, train_loss: 0.6203, test_loss: 1.3447, test_f1: 0.4822
 epoch: 62, train_loss: 0.6194, test_loss: 1.3393, test_f1: 0.4854
 epoch: 63, train_loss: 0.6041, test_loss: 1.3404, test_f1: 0.4740
 epoch: 64, train_loss: 0.6266, test_loss: 1.3245, test_f1: 0.4840
 epoch: 65, train_loss: 0.5862, test_loss: 1.3713, test_f1: 0.4794
 epoch: 66, train_loss: 0.6070, test_loss: 1.3040, test_f1: 0.4802
 epoch: 67, train_loss: 0.6123, test_loss: 1.3791, test_f1: 0.4710
 epoch: 68, train_loss: 0.5756, test_loss: 1.3446, test_f1: 0.4846
 epoch: 69, train_loss: 0.5942, test_loss: 1.4344, test_f1: 0.4890
 epoch: 70, train_loss: 0.5837, test_loss: 1.3744, test_f1: 0.4970
 epoch: 71, train_loss: 0.5928, test_loss: 1.3634, test_f1: 0.4860
 epoch: 72, train_loss: 0.5906, test_loss: 1.4115, test_f1: 0.4868
 epoch: 73, train_loss: 0.5728, test_loss: 1.3673, test_f1: 0.4968
 epoch: 74, train_loss: 0.5657, test_loss: 1.4721, test_f1: 0.4802
 epoch: 75, train_loss: 0.5696, test_loss: 1.5054, test_f1: 0.4850
 epoch: 76, train_loss: 0.5774, test_loss: 1.4944, test_f1: 0.4778
 epoch: 77, train_loss: 0.5703, test_loss: 1.3852, test_f1: 0.4972
 epoch: 78, train_loss: 0.5771, test_loss: 1.4079, test_f1: 0.5015
 epoch: 79, train_loss: 0.5710, test_loss: 1.4136, test_f1: 0.4958
 epoch: 80, train_loss: 0.5634, test_loss: 1.4316, test_f1: 0.4756
 epoch: 81, train_loss: 0.5613, test_loss: 1.4878, test_f1: 0.4864
 epoch: 82, train_loss: 0.5579, test_loss: 1.4230, test_f1: 0.4984
 epoch: 83, train_loss: 0.5535, test_loss: 1.4819, test_f1: 0.4777
 epoch: 84, train_loss: 0.5375, test_loss: 1.4511, test_f1: 0.4861
 epoch: 85, train_loss: 0.5626, test_loss: 1.5053, test_f1: 0.4834
 epoch: 86, train_loss: 0.5352, test_loss: 1.4977, test_f1: 0.5035
 epoch: 87, train_loss: 0.5569, test_loss: 1.5117, test_f1: 0.4794
 epoch: 88, train_loss: 0.5427, test_loss: 1.4955, test_f1: 0.5036
 epoch: 89, train_loss: 0.5371, test_loss: 1.4675, test_f1: 0.4969
 epoch: 90, train_loss: 0.5537, test_loss: 1.4498, test_f1: 0.4898
 epoch: 91, train_loss: 0.5322, test_loss: 1.4923, test_f1: 0.4916
 epoch: 92, train_loss: 0.5379, test_loss: 1.5310, test_f1: 0.4923
 epoch: 93, train_loss: 0.5422, test_loss: 1.4923, test_f1: 0.4992
 epoch: 94, train_loss: 0.5216, test_loss: 1.4326, test_f1: 0.5144
 epoch: 95, train_loss: 0.5251, test_loss: 1.5785, test_f1: 0.4764
 epoch: 96, train_loss: 0.5325, test_loss: 1.5259, test_f1: 0.4925
 epoch: 97, train_loss: 0.5234, test_loss: 1.4698, test_f1: 0.5108
 epoch: 98, train_loss: 0.5176, test_loss: 1.5374, test_f1: 0.4739
 epoch: 99, train_loss: 0.5114, test_loss: 1.5742, test_f1: 0.4705
##################ITERATION #3 ****************************************
 epoch: 0, train_loss: 1.3072, test_loss: 1.3088, test_f1: 0.2274
 epoch: 1, train_loss: 1.2430, test_loss: 1.2626, test_f1: 0.2313
 epoch: 2, train_loss: 1.2197, test_loss: 1.2378, test_f1: 0.2688
 epoch: 3, train_loss: 1.1924, test_loss: 1.2057, test_f1: 0.3250
 epoch: 4, train_loss: 1.1730, test_loss: 1.1755, test_f1: 0.4249
 epoch: 5, train_loss: 1.1610, test_loss: 1.1515, test_f1: 0.4602
 epoch: 6, train_loss: 1.1436, test_loss: 1.1375, test_f1: 0.4577
 epoch: 7, train_loss: 1.1291, test_loss: 1.1239, test_f1: 0.4469
 epoch: 8, train_loss: 1.1130, test_loss: 1.1065, test_f1: 0.4552
 epoch: 9, train_loss: 1.0913, test_loss: 1.0926, test_f1: 0.4818
 epoch: 10, train_loss: 1.0798, test_loss: 1.0807, test_f1: 0.4795
 epoch: 11, train_loss: 1.0654, test_loss: 1.0719, test_f1: 0.4718
 epoch: 12, train_loss: 1.0561, test_loss: 1.0666, test_f1: 0.4753
 epoch: 13, train_loss: 1.0380, test_loss: 1.0414, test_f1: 0.4682
 epoch: 14, train_loss: 1.0173, test_loss: 1.0500, test_f1: 0.4918
 epoch: 15, train_loss: 1.0019, test_loss: 1.0455, test_f1: 0.4986
 epoch: 16, train_loss: 0.9859, test_loss: 1.0516, test_f1: 0.4699
 epoch: 17, train_loss: 0.9777, test_loss: 1.0371, test_f1: 0.5064
 epoch: 18, train_loss: 0.9549, test_loss: 1.0328, test_f1: 0.5105
 epoch: 19, train_loss: 0.9343, test_loss: 1.0377, test_f1: 0.4809
 epoch: 20, train_loss: 0.9245, test_loss: 1.0529, test_f1: 0.4820
 epoch: 21, train_loss: 0.9223, test_loss: 1.0199, test_f1: 0.4799
 epoch: 22, train_loss: 0.9027, test_loss: 1.0486, test_f1: 0.4770
 epoch: 23, train_loss: 0.8919, test_loss: 1.0469, test_f1: 0.4937
 epoch: 24, train_loss: 0.8700, test_loss: 1.0742, test_f1: 0.4854
 epoch: 25, train_loss: 0.8811, test_loss: 1.0849, test_f1: 0.4711
 epoch: 26, train_loss: 0.8553, test_loss: 1.0908, test_f1: 0.4752
 epoch: 27, train_loss: 0.8486, test_loss: 1.0895, test_f1: 0.4659
 epoch: 28, train_loss: 0.8308, test_loss: 1.0815, test_f1: 0.4847
 epoch: 29, train_loss: 0.8277, test_loss: 1.0728, test_f1: 0.4700
 epoch: 30, train_loss: 0.8082, test_loss: 1.0817, test_f1: 0.4537
 epoch: 31, train_loss: 0.8139, test_loss: 1.0985, test_f1: 0.4582
 epoch: 32, train_loss: 0.7964, test_loss: 1.0955, test_f1: 0.4963
 epoch: 33, train_loss: 0.7872, test_loss: 1.1452, test_f1: 0.4537
 epoch: 34, train_loss: 0.7785, test_loss: 1.0960, test_f1: 0.4790
 epoch: 35, train_loss: 0.7796, test_loss: 1.1493, test_f1: 0.4641
 epoch: 36, train_loss: 0.7607, test_loss: 1.1558, test_f1: 0.4804
 epoch: 37, train_loss: 0.7396, test_loss: 1.1248, test_f1: 0.4831
 epoch: 38, train_loss: 0.7519, test_loss: 1.1457, test_f1: 0.4674
 epoch: 39, train_loss: 0.7435, test_loss: 1.1389, test_f1: 0.4992
 epoch: 40, train_loss: 0.7248, test_loss: 1.1683, test_f1: 0.4793
 epoch: 41, train_loss: 0.7240, test_loss: 1.2007, test_f1: 0.4867
 epoch: 42, train_loss: 0.7261, test_loss: 1.2066, test_f1: 0.4935
 epoch: 43, train_loss: 0.7093, test_loss: 1.2297, test_f1: 0.4805
 epoch: 44, train_loss: 0.7112, test_loss: 1.1995, test_f1: 0.4916
 epoch: 45, train_loss: 0.7094, test_loss: 1.2601, test_f1: 0.4781
 epoch: 46, train_loss: 0.6879, test_loss: 1.2202, test_f1: 0.4976
 epoch: 47, train_loss: 0.6952, test_loss: 1.2479, test_f1: 0.4862
 epoch: 48, train_loss: 0.6880, test_loss: 1.2622, test_f1: 0.4823
 epoch: 49, train_loss: 0.6659, test_loss: 1.2611, test_f1: 0.4981
 epoch: 50, train_loss: 0.6657, test_loss: 1.2305, test_f1: 0.5088
 epoch: 51, train_loss: 0.6495, test_loss: 1.2602, test_f1: 0.5115
 epoch: 52, train_loss: 0.6426, test_loss: 1.3012, test_f1: 0.4882
 epoch: 53, train_loss: 0.6496, test_loss: 1.2863, test_f1: 0.5005
 epoch: 54, train_loss: 0.6422, test_loss: 1.3110, test_f1: 0.4977
 epoch: 55, train_loss: 0.6321, test_loss: 1.3152, test_f1: 0.5001
 epoch: 56, train_loss: 0.6444, test_loss: 1.3068, test_f1: 0.5035
 epoch: 57, train_loss: 0.6341, test_loss: 1.3188, test_f1: 0.5036
 epoch: 58, train_loss: 0.6311, test_loss: 1.3181, test_f1: 0.4893
 epoch: 59, train_loss: 0.6326, test_loss: 1.3462, test_f1: 0.5022
 epoch: 60, train_loss: 0.6108, test_loss: 1.3415, test_f1: 0.5121
 epoch: 61, train_loss: 0.6086, test_loss: 1.3255, test_f1: 0.5011
 epoch: 62, train_loss: 0.6198, test_loss: 1.3236, test_f1: 0.5053
 epoch: 63, train_loss: 0.6025, test_loss: 1.3494, test_f1: 0.5161
 epoch: 64, train_loss: 0.6038, test_loss: 1.3810, test_f1: 0.4898
 epoch: 65, train_loss: 0.5992, test_loss: 1.4097, test_f1: 0.4943
 epoch: 66, train_loss: 0.6128, test_loss: 1.3704, test_f1: 0.5148
 epoch: 67, train_loss: 0.5940, test_loss: 1.3807, test_f1: 0.5110
 epoch: 68, train_loss: 0.5979, test_loss: 1.3751, test_f1: 0.5117
 epoch: 69, train_loss: 0.5759, test_loss: 1.4258, test_f1: 0.4890
 epoch: 70, train_loss: 0.5895, test_loss: 1.4317, test_f1: 0.5138
 epoch: 71, train_loss: 0.5830, test_loss: 1.4530, test_f1: 0.5004
 epoch: 72, train_loss: 0.5823, test_loss: 1.4685, test_f1: 0.5017
 epoch: 73, train_loss: 0.5705, test_loss: 1.3865, test_f1: 0.5101
 epoch: 74, train_loss: 0.5727, test_loss: 1.4525, test_f1: 0.5052
 epoch: 75, train_loss: 0.5755, test_loss: 1.4358, test_f1: 0.5085
 epoch: 76, train_loss: 0.5678, test_loss: 1.4421, test_f1: 0.5201
 epoch: 77, train_loss: 0.5703, test_loss: 1.4304, test_f1: 0.4921
 epoch: 78, train_loss: 0.5629, test_loss: 1.4476, test_f1: 0.4935
 epoch: 79, train_loss: 0.5602, test_loss: 1.4998, test_f1: 0.4942
 epoch: 80, train_loss: 0.5504, test_loss: 1.4600, test_f1: 0.5187
 epoch: 81, train_loss: 0.5674, test_loss: 1.4724, test_f1: 0.5026
 epoch: 82, train_loss: 0.5693, test_loss: 1.4655, test_f1: 0.5048
 epoch: 83, train_loss: 0.5591, test_loss: 1.5087, test_f1: 0.5085
 epoch: 84, train_loss: 0.5442, test_loss: 1.4582, test_f1: 0.5218
 epoch: 85, train_loss: 0.5514, test_loss: 1.5249, test_f1: 0.5165
 epoch: 86, train_loss: 0.5495, test_loss: 1.5380, test_f1: 0.5027
 epoch: 87, train_loss: 0.5572, test_loss: 1.5419, test_f1: 0.4998
 epoch: 88, train_loss: 0.5299, test_loss: 1.5022, test_f1: 0.5162
 epoch: 89, train_loss: 0.5415, test_loss: 1.5183, test_f1: 0.5132
 epoch: 90, train_loss: 0.5399, test_loss: 1.5418, test_f1: 0.4897
 epoch: 91, train_loss: 0.5359, test_loss: 1.5458, test_f1: 0.4987
 epoch: 92, train_loss: 0.5433, test_loss: 1.5497, test_f1: 0.4908
 epoch: 93, train_loss: 0.5329, test_loss: 1.5659, test_f1: 0.4952
 epoch: 94, train_loss: 0.5351, test_loss: 1.5917, test_f1: 0.4899
 epoch: 95, train_loss: 0.5222, test_loss: 1.5621, test_f1: 0.4901
 epoch: 96, train_loss: 0.5105, test_loss: 1.5532, test_f1: 0.4943
 epoch: 97, train_loss: 0.5174, test_loss: 1.5654, test_f1: 0.5163
 epoch: 98, train_loss: 0.5207, test_loss: 1.5906, test_f1: 0.5069
 epoch: 99, train_loss: 0.5141, test_loss: 1.5990, test_f1: 0.5075
##################ITERATION #4 ****************************************
 epoch: 0, train_loss: 1.2985, test_loss: 1.2984, test_f1: 0.2274
 epoch: 1, train_loss: 1.2196, test_loss: 1.2523, test_f1: 0.2617
 epoch: 2, train_loss: 1.1863, test_loss: 1.2076, test_f1: 0.3138
 epoch: 3, train_loss: 1.1587, test_loss: 1.1664, test_f1: 0.3988
 epoch: 4, train_loss: 1.1517, test_loss: 1.1321, test_f1: 0.4443
 epoch: 5, train_loss: 1.1321, test_loss: 1.1093, test_f1: 0.4460
 epoch: 6, train_loss: 1.1106, test_loss: 1.0994, test_f1: 0.4441
 epoch: 7, train_loss: 1.0969, test_loss: 1.0868, test_f1: 0.4361
 epoch: 8, train_loss: 1.0859, test_loss: 1.0785, test_f1: 0.4274
 epoch: 9, train_loss: 1.0753, test_loss: 1.0644, test_f1: 0.4360
 epoch: 10, train_loss: 1.0561, test_loss: 1.0691, test_f1: 0.4494
 epoch: 11, train_loss: 1.0412, test_loss: 1.0542, test_f1: 0.4589
 epoch: 12, train_loss: 1.0276, test_loss: 1.0489, test_f1: 0.4588
 epoch: 13, train_loss: 1.0192, test_loss: 1.0417, test_f1: 0.4732
 epoch: 14, train_loss: 1.0022, test_loss: 1.0516, test_f1: 0.4697
 epoch: 15, train_loss: 0.9941, test_loss: 1.0325, test_f1: 0.4835
 epoch: 16, train_loss: 0.9779, test_loss: 1.0247, test_f1: 0.4938
 epoch: 17, train_loss: 0.9572, test_loss: 1.0337, test_f1: 0.4866
 epoch: 18, train_loss: 0.9565, test_loss: 1.0290, test_f1: 0.5003
 epoch: 19, train_loss: 0.9485, test_loss: 1.0337, test_f1: 0.4842
 epoch: 20, train_loss: 0.9417, test_loss: 1.0503, test_f1: 0.4644
 epoch: 21, train_loss: 0.9241, test_loss: 1.0732, test_f1: 0.4843
 epoch: 22, train_loss: 0.9046, test_loss: 1.0514, test_f1: 0.4786
 epoch: 23, train_loss: 0.8877, test_loss: 1.0764, test_f1: 0.4886
 epoch: 24, train_loss: 0.8947, test_loss: 1.0432, test_f1: 0.4925
 epoch: 25, train_loss: 0.8831, test_loss: 1.0913, test_f1: 0.4902
 epoch: 26, train_loss: 0.8649, test_loss: 1.0564, test_f1: 0.4842
 epoch: 27, train_loss: 0.8533, test_loss: 1.0692, test_f1: 0.4838
 epoch: 28, train_loss: 0.8488, test_loss: 1.0691, test_f1: 0.4723
 epoch: 29, train_loss: 0.8327, test_loss: 1.0752, test_f1: 0.4934
 epoch: 30, train_loss: 0.8220, test_loss: 1.1266, test_f1: 0.4910
 epoch: 31, train_loss: 0.8135, test_loss: 1.1005, test_f1: 0.4789
 epoch: 32, train_loss: 0.8106, test_loss: 1.1065, test_f1: 0.4800
 epoch: 33, train_loss: 0.8040, test_loss: 1.1225, test_f1: 0.4918
 epoch: 34, train_loss: 0.7864, test_loss: 1.0971, test_f1: 0.4821
 epoch: 35, train_loss: 0.7919, test_loss: 1.1016, test_f1: 0.4947
 epoch: 36, train_loss: 0.7648, test_loss: 1.1404, test_f1: 0.4819
 epoch: 37, train_loss: 0.7627, test_loss: 1.1791, test_f1: 0.4878
 epoch: 38, train_loss: 0.7463, test_loss: 1.1666, test_f1: 0.4877
 epoch: 39, train_loss: 0.7575, test_loss: 1.1350, test_f1: 0.4991
 epoch: 40, train_loss: 0.7532, test_loss: 1.1732, test_f1: 0.4913
 epoch: 41, train_loss: 0.7406, test_loss: 1.1319, test_f1: 0.4828
 epoch: 42, train_loss: 0.7253, test_loss: 1.1677, test_f1: 0.4885
 epoch: 43, train_loss: 0.7165, test_loss: 1.2124, test_f1: 0.4972
 epoch: 44, train_loss: 0.7131, test_loss: 1.1932, test_f1: 0.4805
 epoch: 45, train_loss: 0.6921, test_loss: 1.2018, test_f1: 0.5001
 epoch: 46, train_loss: 0.6824, test_loss: 1.2077, test_f1: 0.4998
 epoch: 47, train_loss: 0.6975, test_loss: 1.2706, test_f1: 0.4895
 epoch: 48, train_loss: 0.6681, test_loss: 1.1976, test_f1: 0.5062
 epoch: 49, train_loss: 0.6740, test_loss: 1.3034, test_f1: 0.4794
 epoch: 50, train_loss: 0.6732, test_loss: 1.2148, test_f1: 0.4951
 epoch: 51, train_loss: 0.6556, test_loss: 1.2196, test_f1: 0.5019
 epoch: 52, train_loss: 0.6408, test_loss: 1.2478, test_f1: 0.5003
 epoch: 53, train_loss: 0.6370, test_loss: 1.2549, test_f1: 0.5006
 epoch: 54, train_loss: 0.6322, test_loss: 1.2514, test_f1: 0.5006
 epoch: 55, train_loss: 0.6417, test_loss: 1.2945, test_f1: 0.5002
 epoch: 56, train_loss: 0.6352, test_loss: 1.2715, test_f1: 0.5001
 epoch: 57, train_loss: 0.6251, test_loss: 1.2850, test_f1: 0.5059
 epoch: 58, train_loss: 0.6163, test_loss: 1.3156, test_f1: 0.5003
 epoch: 59, train_loss: 0.6222, test_loss: 1.3153, test_f1: 0.5057
 epoch: 60, train_loss: 0.6225, test_loss: 1.2979, test_f1: 0.4976
 epoch: 61, train_loss: 0.6001, test_loss: 1.3122, test_f1: 0.5040
 epoch: 62, train_loss: 0.6096, test_loss: 1.2885, test_f1: 0.5130
 epoch: 63, train_loss: 0.6018, test_loss: 1.3455, test_f1: 0.5033
 epoch: 64, train_loss: 0.5991, test_loss: 1.3048, test_f1: 0.5142
 epoch: 65, train_loss: 0.5958, test_loss: 1.3156, test_f1: 0.5059
 epoch: 66, train_loss: 0.5945, test_loss: 1.3628, test_f1: 0.5096
 epoch: 67, train_loss: 0.5921, test_loss: 1.3137, test_f1: 0.5174
 epoch: 68, train_loss: 0.5841, test_loss: 1.3165, test_f1: 0.5267
 epoch: 69, train_loss: 0.5791, test_loss: 1.3602, test_f1: 0.5190
 epoch: 70, train_loss: 0.5810, test_loss: 1.3697, test_f1: 0.5136
 epoch: 71, train_loss: 0.5856, test_loss: 1.3855, test_f1: 0.5185
 epoch: 72, train_loss: 0.5847, test_loss: 1.3620, test_f1: 0.5146
 epoch: 73, train_loss: 0.5753, test_loss: 1.4072, test_f1: 0.5123
 epoch: 74, train_loss: 0.5705, test_loss: 1.4114, test_f1: 0.5062
 epoch: 75, train_loss: 0.5691, test_loss: 1.3992, test_f1: 0.5087
 epoch: 76, train_loss: 0.5607, test_loss: 1.3602, test_f1: 0.5083
 epoch: 77, train_loss: 0.5608, test_loss: 1.3960, test_f1: 0.5103
 epoch: 78, train_loss: 0.5619, test_loss: 1.3680, test_f1: 0.5232
 epoch: 79, train_loss: 0.5605, test_loss: 1.3950, test_f1: 0.5176
 epoch: 80, train_loss: 0.5514, test_loss: 1.4121, test_f1: 0.5174
 epoch: 81, train_loss: 0.5570, test_loss: 1.4112, test_f1: 0.5192
 epoch: 82, train_loss: 0.5549, test_loss: 1.4536, test_f1: 0.5255
 epoch: 83, train_loss: 0.5392, test_loss: 1.4266, test_f1: 0.5218
 epoch: 84, train_loss: 0.5546, test_loss: 1.3853, test_f1: 0.5215
 epoch: 85, train_loss: 0.5582, test_loss: 1.4631, test_f1: 0.5271
 epoch: 86, train_loss: 0.5436, test_loss: 1.4417, test_f1: 0.5294
 epoch: 87, train_loss: 0.5340, test_loss: 1.4401, test_f1: 0.5213
 epoch: 88, train_loss: 0.5348, test_loss: 1.4489, test_f1: 0.5118
 epoch: 89, train_loss: 0.5333, test_loss: 1.4280, test_f1: 0.5315
 epoch: 90, train_loss: 0.5324, test_loss: 1.4385, test_f1: 0.5225
 epoch: 91, train_loss: 0.5264, test_loss: 1.4323, test_f1: 0.5284
 epoch: 92, train_loss: 0.5242, test_loss: 1.4531, test_f1: 0.5256
 epoch: 93, train_loss: 0.5150, test_loss: 1.4886, test_f1: 0.5104
 epoch: 94, train_loss: 0.5396, test_loss: 1.4555, test_f1: 0.5242
 epoch: 95, train_loss: 0.5244, test_loss: 1.4638, test_f1: 0.5372
 epoch: 96, train_loss: 0.5091, test_loss: 1.4894, test_f1: 0.5337
 epoch: 97, train_loss: 0.5176, test_loss: 1.5226, test_f1: 0.5250
 epoch: 98, train_loss: 0.5067, test_loss: 1.4903, test_f1: 0.5254
 epoch: 99, train_loss: 0.5072, test_loss: 1.4998, test_f1: 0.5144
##################ITERATION #5 ****************************************
 epoch: 0, train_loss: 1.2921, test_loss: 1.3020, test_f1: 0.2755
 epoch: 1, train_loss: 1.2160, test_loss: 1.2608, test_f1: 0.2869
 epoch: 2, train_loss: 1.1884, test_loss: 1.2094, test_f1: 0.3616
 epoch: 3, train_loss: 1.1658, test_loss: 1.1671, test_f1: 0.4348
 epoch: 4, train_loss: 1.1476, test_loss: 1.1354, test_f1: 0.4828
 epoch: 5, train_loss: 1.1263, test_loss: 1.1018, test_f1: 0.4913
 epoch: 6, train_loss: 1.1054, test_loss: 1.0877, test_f1: 0.4715
 epoch: 7, train_loss: 1.0960, test_loss: 1.0679, test_f1: 0.4793
 epoch: 8, train_loss: 1.0824, test_loss: 1.0720, test_f1: 0.4706
 epoch: 9, train_loss: 1.0599, test_loss: 1.0618, test_f1: 0.4737
 epoch: 10, train_loss: 1.0524, test_loss: 1.0613, test_f1: 0.4583
 epoch: 11, train_loss: 1.0398, test_loss: 1.0518, test_f1: 0.4584
 epoch: 12, train_loss: 1.0301, test_loss: 1.0479, test_f1: 0.4619
 epoch: 13, train_loss: 1.0249, test_loss: 1.0439, test_f1: 0.4645
 epoch: 14, train_loss: 1.0115, test_loss: 1.0608, test_f1: 0.4470
 epoch: 15, train_loss: 0.9893, test_loss: 1.0355, test_f1: 0.4768
 epoch: 16, train_loss: 0.9834, test_loss: 1.0290, test_f1: 0.4768
 epoch: 17, train_loss: 0.9811, test_loss: 1.0310, test_f1: 0.4822
 epoch: 18, train_loss: 0.9698, test_loss: 1.0382, test_f1: 0.4721
 epoch: 19, train_loss: 0.9447, test_loss: 1.0304, test_f1: 0.4886
 epoch: 20, train_loss: 0.9375, test_loss: 1.0332, test_f1: 0.4944
 epoch: 21, train_loss: 0.9421, test_loss: 1.0379, test_f1: 0.4871
 epoch: 22, train_loss: 0.9196, test_loss: 1.0367, test_f1: 0.4702
 epoch: 23, train_loss: 0.9052, test_loss: 1.0155, test_f1: 0.4950
 epoch: 24, train_loss: 0.8920, test_loss: 1.0310, test_f1: 0.4838
 epoch: 25, train_loss: 0.8843, test_loss: 1.0246, test_f1: 0.4877
 epoch: 26, train_loss: 0.8692, test_loss: 1.0226, test_f1: 0.4807
 epoch: 27, train_loss: 0.8622, test_loss: 1.0440, test_f1: 0.4803
 epoch: 28, train_loss: 0.8438, test_loss: 1.0459, test_f1: 0.4739
 epoch: 29, train_loss: 0.8508, test_loss: 1.0612, test_f1: 0.4830
 epoch: 30, train_loss: 0.8398, test_loss: 1.0597, test_f1: 0.4824
 epoch: 31, train_loss: 0.8495, test_loss: 1.0689, test_f1: 0.4894
 epoch: 32, train_loss: 0.8231, test_loss: 1.0839, test_f1: 0.4785
 epoch: 33, train_loss: 0.8094, test_loss: 1.0678, test_f1: 0.4866
 epoch: 34, train_loss: 0.8009, test_loss: 1.0619, test_f1: 0.4777
 epoch: 35, train_loss: 0.8003, test_loss: 1.1165, test_f1: 0.5146
 epoch: 36, train_loss: 0.7872, test_loss: 1.1161, test_f1: 0.4956
 epoch: 37, train_loss: 0.7618, test_loss: 1.1170, test_f1: 0.4986
 epoch: 38, train_loss: 0.7648, test_loss: 1.1351, test_f1: 0.4749
 epoch: 39, train_loss: 0.7711, test_loss: 1.1576, test_f1: 0.4920
 epoch: 40, train_loss: 0.7443, test_loss: 1.1601, test_f1: 0.4900
 epoch: 41, train_loss: 0.7450, test_loss: 1.1643, test_f1: 0.4960
 epoch: 42, train_loss: 0.7356, test_loss: 1.1870, test_f1: 0.5022
 epoch: 43, train_loss: 0.7302, test_loss: 1.2117, test_f1: 0.5003
 epoch: 44, train_loss: 0.7045, test_loss: 1.2140, test_f1: 0.5010
 epoch: 45, train_loss: 0.7091, test_loss: 1.2486, test_f1: 0.4953
 epoch: 46, train_loss: 0.7071, test_loss: 1.2031, test_f1: 0.5001
 epoch: 47, train_loss: 0.7056, test_loss: 1.2421, test_f1: 0.5024
 epoch: 48, train_loss: 0.7124, test_loss: 1.1996, test_f1: 0.4862
 epoch: 49, train_loss: 0.6948, test_loss: 1.2263, test_f1: 0.5040
 epoch: 50, train_loss: 0.6720, test_loss: 1.3039, test_f1: 0.4981
 epoch: 51, train_loss: 0.6639, test_loss: 1.2527, test_f1: 0.5089
 epoch: 52, train_loss: 0.6525, test_loss: 1.2959, test_f1: 0.5199
 epoch: 53, train_loss: 0.6470, test_loss: 1.2860, test_f1: 0.5109
 epoch: 54, train_loss: 0.6330, test_loss: 1.2947, test_f1: 0.5156
 epoch: 55, train_loss: 0.6463, test_loss: 1.2895, test_f1: 0.5150
 epoch: 56, train_loss: 0.6182, test_loss: 1.2820, test_f1: 0.5152
 epoch: 57, train_loss: 0.6258, test_loss: 1.2865, test_f1: 0.5202
 epoch: 58, train_loss: 0.6183, test_loss: 1.3004, test_f1: 0.5160
 epoch: 59, train_loss: 0.6222, test_loss: 1.3308, test_f1: 0.4988
 epoch: 60, train_loss: 0.6244, test_loss: 1.3247, test_f1: 0.5082
 epoch: 61, train_loss: 0.6259, test_loss: 1.3272, test_f1: 0.5077
 epoch: 62, train_loss: 0.6197, test_loss: 1.3655, test_f1: 0.4964
 epoch: 63, train_loss: 0.6056, test_loss: 1.3127, test_f1: 0.5004
 epoch: 64, train_loss: 0.5980, test_loss: 1.3090, test_f1: 0.5047
 epoch: 65, train_loss: 0.6046, test_loss: 1.3429, test_f1: 0.5072
 epoch: 66, train_loss: 0.5945, test_loss: 1.3310, test_f1: 0.5040
 epoch: 67, train_loss: 0.6057, test_loss: 1.3798, test_f1: 0.5080
 epoch: 68, train_loss: 0.6047, test_loss: 1.3420, test_f1: 0.5080
 epoch: 69, train_loss: 0.5910, test_loss: 1.3702, test_f1: 0.5079
 epoch: 70, train_loss: 0.5927, test_loss: 1.3803, test_f1: 0.5070
 epoch: 71, train_loss: 0.5995, test_loss: 1.4192, test_f1: 0.5152
 epoch: 72, train_loss: 0.5878, test_loss: 1.4217, test_f1: 0.5046
 epoch: 73, train_loss: 0.5879, test_loss: 1.4368, test_f1: 0.5190
 epoch: 74, train_loss: 0.5716, test_loss: 1.4450, test_f1: 0.5040
 epoch: 75, train_loss: 0.5685, test_loss: 1.4202, test_f1: 0.4978
 epoch: 76, train_loss: 0.5667, test_loss: 1.4627, test_f1: 0.5024
 epoch: 77, train_loss: 0.5667, test_loss: 1.4372, test_f1: 0.5115
 epoch: 78, train_loss: 0.5568, test_loss: 1.4753, test_f1: 0.5039
 epoch: 79, train_loss: 0.5570, test_loss: 1.4638, test_f1: 0.5035
 epoch: 80, train_loss: 0.5690, test_loss: 1.5000, test_f1: 0.5009
 epoch: 81, train_loss: 0.5502, test_loss: 1.4477, test_f1: 0.5029
 epoch: 82, train_loss: 0.5553, test_loss: 1.4199, test_f1: 0.5215
 epoch: 83, train_loss: 0.5513, test_loss: 1.4466, test_f1: 0.5031
 epoch: 84, train_loss: 0.5538, test_loss: 1.4154, test_f1: 0.5066
 epoch: 85, train_loss: 0.5402, test_loss: 1.4423, test_f1: 0.5018
 epoch: 86, train_loss: 0.5344, test_loss: 1.4982, test_f1: 0.5022
 epoch: 87, train_loss: 0.5359, test_loss: 1.5069, test_f1: 0.5045
 epoch: 88, train_loss: 0.5332, test_loss: 1.5507, test_f1: 0.4950
 epoch: 89, train_loss: 0.5377, test_loss: 1.5639, test_f1: 0.4963
 epoch: 90, train_loss: 0.5404, test_loss: 1.4960, test_f1: 0.5037
 epoch: 91, train_loss: 0.5331, test_loss: 1.5117, test_f1: 0.5237
 epoch: 92, train_loss: 0.5291, test_loss: 1.5239, test_f1: 0.5020
 epoch: 93, train_loss: 0.5323, test_loss: 1.5516, test_f1: 0.5060
 epoch: 94, train_loss: 0.5140, test_loss: 1.5828, test_f1: 0.4949
 epoch: 95, train_loss: 0.5258, test_loss: 1.5570, test_f1: 0.4941
 epoch: 96, train_loss: 0.5091, test_loss: 1.5469, test_f1: 0.5078
 epoch: 97, train_loss: 0.5116, test_loss: 1.5585, test_f1: 0.5078
 epoch: 98, train_loss: 0.5219, test_loss: 1.5860, test_f1: 0.5031
 epoch: 99, train_loss: 0.5128, test_loss: 1.5704, test_f1: 0.5120
##################ITERATION #6 ****************************************
 epoch: 0, train_loss: 1.3438, test_loss: 1.3194, test_f1: 0.3644
 epoch: 1, train_loss: 1.2285, test_loss: 1.2694, test_f1: 0.3807
 epoch: 2, train_loss: 1.1992, test_loss: 1.2014, test_f1: 0.4523
 epoch: 3, train_loss: 1.1712, test_loss: 1.1468, test_f1: 0.4630
 epoch: 4, train_loss: 1.1473, test_loss: 1.1236, test_f1: 0.4698
 epoch: 5, train_loss: 1.1276, test_loss: 1.1080, test_f1: 0.4633
 epoch: 6, train_loss: 1.1121, test_loss: 1.0953, test_f1: 0.4620
 epoch: 7, train_loss: 1.1038, test_loss: 1.0867, test_f1: 0.4566
 epoch: 8, train_loss: 1.0922, test_loss: 1.0671, test_f1: 0.4775
 epoch: 9, train_loss: 1.0699, test_loss: 1.0717, test_f1: 0.4585
 epoch: 10, train_loss: 1.0593, test_loss: 1.0672, test_f1: 0.4649
 epoch: 11, train_loss: 1.0495, test_loss: 1.0564, test_f1: 0.4727
 epoch: 12, train_loss: 1.0403, test_loss: 1.0579, test_f1: 0.4590
 epoch: 13, train_loss: 1.0299, test_loss: 1.0512, test_f1: 0.4636
 epoch: 14, train_loss: 1.0078, test_loss: 1.0286, test_f1: 0.4850
 epoch: 15, train_loss: 0.9938, test_loss: 1.0376, test_f1: 0.4745
 epoch: 16, train_loss: 0.9828, test_loss: 1.0383, test_f1: 0.4839
 epoch: 17, train_loss: 0.9737, test_loss: 1.0373, test_f1: 0.4992
 epoch: 18, train_loss: 0.9610, test_loss: 1.0411, test_f1: 0.4979
 epoch: 19, train_loss: 0.9540, test_loss: 1.0362, test_f1: 0.4941
 epoch: 20, train_loss: 0.9378, test_loss: 1.0297, test_f1: 0.5065
 epoch: 21, train_loss: 0.9295, test_loss: 1.0338, test_f1: 0.5138
 epoch: 22, train_loss: 0.9165, test_loss: 1.0479, test_f1: 0.4824
 epoch: 23, train_loss: 0.9087, test_loss: 1.0381, test_f1: 0.5010
 epoch: 24, train_loss: 0.9110, test_loss: 1.0494, test_f1: 0.4868
 epoch: 25, train_loss: 0.8922, test_loss: 1.0391, test_f1: 0.5013
 epoch: 26, train_loss: 0.8881, test_loss: 1.0325, test_f1: 0.5011
 epoch: 27, train_loss: 0.8765, test_loss: 1.0501, test_f1: 0.4919
 epoch: 28, train_loss: 0.8705, test_loss: 1.0705, test_f1: 0.5028
 epoch: 29, train_loss: 0.8613, test_loss: 1.0453, test_f1: 0.5143
 epoch: 30, train_loss: 0.8502, test_loss: 1.0547, test_f1: 0.5048
 epoch: 31, train_loss: 0.8213, test_loss: 1.0983, test_f1: 0.4996
 epoch: 32, train_loss: 0.8251, test_loss: 1.0883, test_f1: 0.5024
 epoch: 33, train_loss: 0.8165, test_loss: 1.0824, test_f1: 0.4888
 epoch: 34, train_loss: 0.8189, test_loss: 1.0855, test_f1: 0.4792
 epoch: 35, train_loss: 0.8054, test_loss: 1.0922, test_f1: 0.5139
 epoch: 36, train_loss: 0.7961, test_loss: 1.1116, test_f1: 0.4855
 epoch: 37, train_loss: 0.7978, test_loss: 1.1199, test_f1: 0.5105
 epoch: 38, train_loss: 0.7776, test_loss: 1.1439, test_f1: 0.4999
 epoch: 39, train_loss: 0.7902, test_loss: 1.1388, test_f1: 0.5001
 epoch: 40, train_loss: 0.7671, test_loss: 1.1698, test_f1: 0.4971
 epoch: 41, train_loss: 0.7612, test_loss: 1.1383, test_f1: 0.5239
 epoch: 42, train_loss: 0.7586, test_loss: 1.1692, test_f1: 0.4892
 epoch: 43, train_loss: 0.7333, test_loss: 1.1567, test_f1: 0.4926
 epoch: 44, train_loss: 0.7275, test_loss: 1.1925, test_f1: 0.5008
 epoch: 45, train_loss: 0.7231, test_loss: 1.1940, test_f1: 0.5208
 epoch: 46, train_loss: 0.7314, test_loss: 1.2102, test_f1: 0.5195
 epoch: 47, train_loss: 0.7233, test_loss: 1.2171, test_f1: 0.5084
 epoch: 48, train_loss: 0.7068, test_loss: 1.2208, test_f1: 0.5195
 epoch: 49, train_loss: 0.6924, test_loss: 1.2189, test_f1: 0.5142
 epoch: 50, train_loss: 0.6922, test_loss: 1.2855, test_f1: 0.5123
 epoch: 51, train_loss: 0.6910, test_loss: 1.2378, test_f1: 0.5175
 epoch: 52, train_loss: 0.6626, test_loss: 1.2732, test_f1: 0.5090
 epoch: 53, train_loss: 0.6696, test_loss: 1.2835, test_f1: 0.5104
 epoch: 54, train_loss: 0.6617, test_loss: 1.2875, test_f1: 0.5227
 epoch: 55, train_loss: 0.6684, test_loss: 1.3030, test_f1: 0.5234
 epoch: 56, train_loss: 0.6497, test_loss: 1.2921, test_f1: 0.5291
 epoch: 57, train_loss: 0.6477, test_loss: 1.3194, test_f1: 0.5185
 epoch: 58, train_loss: 0.6480, test_loss: 1.3180, test_f1: 0.5210
 epoch: 59, train_loss: 0.6451, test_loss: 1.3086, test_f1: 0.5291
 epoch: 60, train_loss: 0.6441, test_loss: 1.3299, test_f1: 0.5266
 epoch: 61, train_loss: 0.6416, test_loss: 1.3233, test_f1: 0.5331
 epoch: 62, train_loss: 0.6255, test_loss: 1.3276, test_f1: 0.5259
 epoch: 63, train_loss: 0.6330, test_loss: 1.3469, test_f1: 0.5188
 epoch: 64, train_loss: 0.6228, test_loss: 1.3783, test_f1: 0.5254
 epoch: 65, train_loss: 0.6202, test_loss: 1.3826, test_f1: 0.5221
 epoch: 66, train_loss: 0.6234, test_loss: 1.3613, test_f1: 0.5190
 epoch: 67, train_loss: 0.6261, test_loss: 1.3735, test_f1: 0.5281
 epoch: 68, train_loss: 0.6152, test_loss: 1.3924, test_f1: 0.5257
 epoch: 69, train_loss: 0.6256, test_loss: 1.3954, test_f1: 0.5313
 epoch: 70, train_loss: 0.6099, test_loss: 1.4023, test_f1: 0.5187
 epoch: 71, train_loss: 0.6002, test_loss: 1.4255, test_f1: 0.5233
 epoch: 72, train_loss: 0.5845, test_loss: 1.4156, test_f1: 0.5216
 epoch: 73, train_loss: 0.6094, test_loss: 1.3924, test_f1: 0.5192
 epoch: 74, train_loss: 0.5894, test_loss: 1.4158, test_f1: 0.5217
 epoch: 75, train_loss: 0.5906, test_loss: 1.4321, test_f1: 0.5355
 epoch: 76, train_loss: 0.5827, test_loss: 1.4250, test_f1: 0.5361
 epoch: 77, train_loss: 0.5685, test_loss: 1.4714, test_f1: 0.5310
 epoch: 78, train_loss: 0.5869, test_loss: 1.4475, test_f1: 0.5293
 epoch: 79, train_loss: 0.5700, test_loss: 1.4869, test_f1: 0.5183
 epoch: 80, train_loss: 0.5601, test_loss: 1.4672, test_f1: 0.5240
 epoch: 81, train_loss: 0.5697, test_loss: 1.4612, test_f1: 0.5329
 epoch: 82, train_loss: 0.5766, test_loss: 1.4673, test_f1: 0.5373
 epoch: 83, train_loss: 0.5584, test_loss: 1.5064, test_f1: 0.5143
 epoch: 84, train_loss: 0.5677, test_loss: 1.5224, test_f1: 0.5345
 epoch: 85, train_loss: 0.5600, test_loss: 1.5363, test_f1: 0.5250
 epoch: 86, train_loss: 0.5649, test_loss: 1.5556, test_f1: 0.5220
 epoch: 87, train_loss: 0.5440, test_loss: 1.5070, test_f1: 0.5307
 epoch: 88, train_loss: 0.5527, test_loss: 1.5413, test_f1: 0.5229
 epoch: 89, train_loss: 0.5459, test_loss: 1.5732, test_f1: 0.5119
 epoch: 90, train_loss: 0.5416, test_loss: 1.5235, test_f1: 0.5179
 epoch: 91, train_loss: 0.5399, test_loss: 1.5454, test_f1: 0.5247
 epoch: 92, train_loss: 0.5335, test_loss: 1.5509, test_f1: 0.5336
 epoch: 93, train_loss: 0.5244, test_loss: 1.6017, test_f1: 0.5191
 epoch: 94, train_loss: 0.5378, test_loss: 1.6208, test_f1: 0.5191
 epoch: 95, train_loss: 0.5229, test_loss: 1.5701, test_f1: 0.5291
 epoch: 96, train_loss: 0.5456, test_loss: 1.5778, test_f1: 0.5452
 epoch: 97, train_loss: 0.5190, test_loss: 1.6204, test_f1: 0.5319
 epoch: 98, train_loss: 0.5216, test_loss: 1.6397, test_f1: 0.5206
 epoch: 99, train_loss: 0.5470, test_loss: 1.5909, test_f1: 0.5225
##################ITERATION #7 ****************************************
 epoch: 0, train_loss: 1.3386, test_loss: 1.3065, test_f1: 0.2274
 epoch: 1, train_loss: 1.2240, test_loss: 1.2447, test_f1: 0.2810
 epoch: 2, train_loss: 1.2056, test_loss: 1.2037, test_f1: 0.3442
 epoch: 3, train_loss: 1.1777, test_loss: 1.1745, test_f1: 0.4325
 epoch: 4, train_loss: 1.1500, test_loss: 1.1505, test_f1: 0.4237
 epoch: 5, train_loss: 1.1411, test_loss: 1.1291, test_f1: 0.4253
 epoch: 6, train_loss: 1.1317, test_loss: 1.1180, test_f1: 0.4295
 epoch: 7, train_loss: 1.1143, test_loss: 1.1092, test_f1: 0.4236
 epoch: 8, train_loss: 1.0963, test_loss: 1.0987, test_f1: 0.4246
 epoch: 9, train_loss: 1.0864, test_loss: 1.0878, test_f1: 0.4372
 epoch: 10, train_loss: 1.0725, test_loss: 1.0820, test_f1: 0.4461
 epoch: 11, train_loss: 1.0498, test_loss: 1.0789, test_f1: 0.4373
 epoch: 12, train_loss: 1.0506, test_loss: 1.0756, test_f1: 0.4430
 epoch: 13, train_loss: 1.0319, test_loss: 1.0596, test_f1: 0.4498
 epoch: 14, train_loss: 1.0229, test_loss: 1.0584, test_f1: 0.4510
 epoch: 15, train_loss: 1.0223, test_loss: 1.0527, test_f1: 0.4653
 epoch: 16, train_loss: 1.0023, test_loss: 1.0488, test_f1: 0.4613
 epoch: 17, train_loss: 0.9886, test_loss: 1.0476, test_f1: 0.4733
 epoch: 18, train_loss: 0.9764, test_loss: 1.0489, test_f1: 0.4659
 epoch: 19, train_loss: 0.9820, test_loss: 1.0314, test_f1: 0.4561
 epoch: 20, train_loss: 0.9533, test_loss: 1.0345, test_f1: 0.4488
 epoch: 21, train_loss: 0.9583, test_loss: 1.0277, test_f1: 0.4768
 epoch: 22, train_loss: 0.9375, test_loss: 1.0342, test_f1: 0.4718
 epoch: 23, train_loss: 0.9247, test_loss: 1.0235, test_f1: 0.4683
 epoch: 24, train_loss: 0.9381, test_loss: 1.0200, test_f1: 0.4756
 epoch: 25, train_loss: 0.9119, test_loss: 1.0193, test_f1: 0.4779
 epoch: 26, train_loss: 0.8942, test_loss: 1.0295, test_f1: 0.4679
 epoch: 27, train_loss: 0.9033, test_loss: 1.0236, test_f1: 0.4674
 epoch: 28, train_loss: 0.8799, test_loss: 1.0380, test_f1: 0.4706
 epoch: 29, train_loss: 0.8775, test_loss: 1.0175, test_f1: 0.4810
 epoch: 30, train_loss: 0.8600, test_loss: 1.0426, test_f1: 0.4871
 epoch: 31, train_loss: 0.8427, test_loss: 1.0473, test_f1: 0.4718
 epoch: 32, train_loss: 0.8439, test_loss: 1.0428, test_f1: 0.4919
 epoch: 33, train_loss: 0.8414, test_loss: 1.0306, test_f1: 0.4827
 epoch: 34, train_loss: 0.8237, test_loss: 1.0424, test_f1: 0.4839
 epoch: 35, train_loss: 0.8206, test_loss: 1.0577, test_f1: 0.4992
 epoch: 36, train_loss: 0.8164, test_loss: 1.0844, test_f1: 0.4921
 epoch: 37, train_loss: 0.8054, test_loss: 1.0463, test_f1: 0.5000
 epoch: 38, train_loss: 0.7907, test_loss: 1.0710, test_f1: 0.5076
 epoch: 39, train_loss: 0.7899, test_loss: 1.0856, test_f1: 0.5053
 epoch: 40, train_loss: 0.7648, test_loss: 1.0939, test_f1: 0.5122
 epoch: 41, train_loss: 0.7607, test_loss: 1.0613, test_f1: 0.5130
 epoch: 42, train_loss: 0.7652, test_loss: 1.1251, test_f1: 0.5038
 epoch: 43, train_loss: 0.7573, test_loss: 1.1128, test_f1: 0.5129
 epoch: 44, train_loss: 0.7394, test_loss: 1.0985, test_f1: 0.5167
 epoch: 45, train_loss: 0.7340, test_loss: 1.1291, test_f1: 0.4960
 epoch: 46, train_loss: 0.7306, test_loss: 1.1205, test_f1: 0.5138
 epoch: 47, train_loss: 0.7336, test_loss: 1.1695, test_f1: 0.5050
 epoch: 48, train_loss: 0.7160, test_loss: 1.1536, test_f1: 0.5084
 epoch: 49, train_loss: 0.7126, test_loss: 1.1654, test_f1: 0.5029
 epoch: 50, train_loss: 0.7059, test_loss: 1.1462, test_f1: 0.5074
 epoch: 51, train_loss: 0.6888, test_loss: 1.1500, test_f1: 0.5192
 epoch: 52, train_loss: 0.6853, test_loss: 1.1640, test_f1: 0.5147
 epoch: 53, train_loss: 0.6807, test_loss: 1.1517, test_f1: 0.5226
 epoch: 54, train_loss: 0.6782, test_loss: 1.1640, test_f1: 0.5114
 epoch: 55, train_loss: 0.6590, test_loss: 1.1782, test_f1: 0.5204
 epoch: 56, train_loss: 0.6661, test_loss: 1.1715, test_f1: 0.5257
 epoch: 57, train_loss: 0.6725, test_loss: 1.2020, test_f1: 0.5192
 epoch: 58, train_loss: 0.6712, test_loss: 1.2026, test_f1: 0.5135
 epoch: 59, train_loss: 0.6586, test_loss: 1.2012, test_f1: 0.5093
 epoch: 60, train_loss: 0.6497, test_loss: 1.1977, test_f1: 0.5122
 epoch: 61, train_loss: 0.6411, test_loss: 1.2049, test_f1: 0.5262
 epoch: 62, train_loss: 0.6325, test_loss: 1.2045, test_f1: 0.5115
 epoch: 63, train_loss: 0.6376, test_loss: 1.2410, test_f1: 0.5094
 epoch: 64, train_loss: 0.6463, test_loss: 1.2336, test_f1: 0.5204
 epoch: 65, train_loss: 0.6327, test_loss: 1.2279, test_f1: 0.5145
 epoch: 66, train_loss: 0.6356, test_loss: 1.2008, test_f1: 0.5126
 epoch: 67, train_loss: 0.6185, test_loss: 1.2173, test_f1: 0.5160
 epoch: 68, train_loss: 0.6235, test_loss: 1.2057, test_f1: 0.5197
 epoch: 69, train_loss: 0.6351, test_loss: 1.2215, test_f1: 0.5207
 epoch: 70, train_loss: 0.6318, test_loss: 1.2591, test_f1: 0.5220
 epoch: 71, train_loss: 0.6124, test_loss: 1.2533, test_f1: 0.5209
 epoch: 72, train_loss: 0.6022, test_loss: 1.2584, test_f1: 0.5258
 epoch: 73, train_loss: 0.6110, test_loss: 1.2485, test_f1: 0.5377
 epoch: 74, train_loss: 0.6076, test_loss: 1.2762, test_f1: 0.5169
 epoch: 75, train_loss: 0.6005, test_loss: 1.2849, test_f1: 0.5161
 epoch: 76, train_loss: 0.5982, test_loss: 1.2968, test_f1: 0.5101
 epoch: 77, train_loss: 0.6057, test_loss: 1.3134, test_f1: 0.5071
 epoch: 78, train_loss: 0.5965, test_loss: 1.3050, test_f1: 0.5032
 epoch: 79, train_loss: 0.5926, test_loss: 1.3039, test_f1: 0.5173
 epoch: 80, train_loss: 0.6027, test_loss: 1.2821, test_f1: 0.5300
 epoch: 81, train_loss: 0.5853, test_loss: 1.3286, test_f1: 0.5261
 epoch: 82, train_loss: 0.5868, test_loss: 1.3332, test_f1: 0.5217
 epoch: 83, train_loss: 0.5727, test_loss: 1.2982, test_f1: 0.5282
 epoch: 84, train_loss: 0.5687, test_loss: 1.3200, test_f1: 0.5224
 epoch: 85, train_loss: 0.5816, test_loss: 1.3159, test_f1: 0.5181
 epoch: 86, train_loss: 0.5786, test_loss: 1.3302, test_f1: 0.5239
 epoch: 87, train_loss: 0.5756, test_loss: 1.3347, test_f1: 0.5269
 epoch: 88, train_loss: 0.5717, test_loss: 1.3549, test_f1: 0.5142
 epoch: 89, train_loss: 0.5613, test_loss: 1.3424, test_f1: 0.5237
 epoch: 90, train_loss: 0.5570, test_loss: 1.3516, test_f1: 0.5194
 epoch: 91, train_loss: 0.5680, test_loss: 1.3486, test_f1: 0.5176
 epoch: 92, train_loss: 0.5569, test_loss: 1.3442, test_f1: 0.5212
 epoch: 93, train_loss: 0.5317, test_loss: 1.3372, test_f1: 0.5319
 epoch: 94, train_loss: 0.5474, test_loss: 1.3592, test_f1: 0.5250
 epoch: 95, train_loss: 0.5327, test_loss: 1.3664, test_f1: 0.5206
 epoch: 96, train_loss: 0.5396, test_loss: 1.3559, test_f1: 0.5179
 epoch: 97, train_loss: 0.5325, test_loss: 1.3828, test_f1: 0.5321
 epoch: 98, train_loss: 0.5490, test_loss: 1.3693, test_f1: 0.5227
 epoch: 99, train_loss: 0.5386, test_loss: 1.3766, test_f1: 0.5397
##################ITERATION #8 ****************************************
 epoch: 0, train_loss: 1.3798, test_loss: 1.2985, test_f1: 0.2582
 epoch: 1, train_loss: 1.2430, test_loss: 1.2483, test_f1: 0.3511
 epoch: 2, train_loss: 1.2067, test_loss: 1.2068, test_f1: 0.4003
 epoch: 3, train_loss: 1.1790, test_loss: 1.1860, test_f1: 0.4429
 epoch: 4, train_loss: 1.1538, test_loss: 1.1442, test_f1: 0.4647
 epoch: 5, train_loss: 1.1359, test_loss: 1.1180, test_f1: 0.4477
 epoch: 6, train_loss: 1.1258, test_loss: 1.1068, test_f1: 0.4664
 epoch: 7, train_loss: 1.1069, test_loss: 1.0904, test_f1: 0.4517
 epoch: 8, train_loss: 1.0812, test_loss: 1.0699, test_f1: 0.4727
 epoch: 9, train_loss: 1.0857, test_loss: 1.0696, test_f1: 0.4617
 epoch: 10, train_loss: 1.0683, test_loss: 1.0637, test_f1: 0.4462
 epoch: 11, train_loss: 1.0451, test_loss: 1.0539, test_f1: 0.4547
 epoch: 12, train_loss: 1.0461, test_loss: 1.0348, test_f1: 0.4679
 epoch: 13, train_loss: 1.0261, test_loss: 1.0407, test_f1: 0.4789
 epoch: 14, train_loss: 1.0136, test_loss: 1.0328, test_f1: 0.4736
 epoch: 15, train_loss: 1.0164, test_loss: 1.0331, test_f1: 0.4829
 epoch: 16, train_loss: 0.9966, test_loss: 1.0206, test_f1: 0.4853
 epoch: 17, train_loss: 0.9970, test_loss: 1.0230, test_f1: 0.4916
 epoch: 18, train_loss: 0.9819, test_loss: 1.0160, test_f1: 0.5020
 epoch: 19, train_loss: 0.9638, test_loss: 1.0148, test_f1: 0.4957
 epoch: 20, train_loss: 0.9565, test_loss: 1.0133, test_f1: 0.4897
 epoch: 21, train_loss: 0.9434, test_loss: 1.0044, test_f1: 0.5028
 epoch: 22, train_loss: 0.9544, test_loss: 1.0214, test_f1: 0.4943
 epoch: 23, train_loss: 0.9254, test_loss: 1.0137, test_f1: 0.4848
 epoch: 24, train_loss: 0.9191, test_loss: 1.0013, test_f1: 0.4948
 epoch: 25, train_loss: 0.9142, test_loss: 1.0006, test_f1: 0.5190
 epoch: 26, train_loss: 0.9071, test_loss: 0.9892, test_f1: 0.5321
 epoch: 27, train_loss: 0.8951, test_loss: 1.0178, test_f1: 0.5014
 epoch: 28, train_loss: 0.8893, test_loss: 0.9998, test_f1: 0.5044
 epoch: 29, train_loss: 0.8820, test_loss: 1.0087, test_f1: 0.5244
 epoch: 30, train_loss: 0.8635, test_loss: 1.0016, test_f1: 0.5126
 epoch: 31, train_loss: 0.8560, test_loss: 1.0072, test_f1: 0.5186
 epoch: 32, train_loss: 0.8592, test_loss: 0.9944, test_f1: 0.5228
 epoch: 33, train_loss: 0.8541, test_loss: 1.0403, test_f1: 0.5061
 epoch: 34, train_loss: 0.8348, test_loss: 1.0145, test_f1: 0.5130
 epoch: 35, train_loss: 0.8227, test_loss: 1.0501, test_f1: 0.5151
 epoch: 36, train_loss: 0.8089, test_loss: 1.0387, test_f1: 0.5238
 epoch: 37, train_loss: 0.8050, test_loss: 1.0518, test_f1: 0.4943
 epoch: 38, train_loss: 0.7878, test_loss: 1.0396, test_f1: 0.5136
 epoch: 39, train_loss: 0.7821, test_loss: 1.0559, test_f1: 0.5168
 epoch: 40, train_loss: 0.7746, test_loss: 1.0169, test_f1: 0.5393
 epoch: 41, train_loss: 0.7785, test_loss: 1.0505, test_f1: 0.5136
 epoch: 42, train_loss: 0.7543, test_loss: 1.0377, test_f1: 0.5156
 epoch: 43, train_loss: 0.7448, test_loss: 1.0624, test_f1: 0.5133
 epoch: 44, train_loss: 0.7471, test_loss: 1.1024, test_f1: 0.5138
 epoch: 45, train_loss: 0.7380, test_loss: 1.0776, test_f1: 0.5125
 epoch: 46, train_loss: 0.7171, test_loss: 1.0784, test_f1: 0.5182
 epoch: 47, train_loss: 0.7251, test_loss: 1.0869, test_f1: 0.5229
 epoch: 48, train_loss: 0.7293, test_loss: 1.0880, test_f1: 0.5182
 epoch: 49, train_loss: 0.7219, test_loss: 1.0879, test_f1: 0.5087
 epoch: 50, train_loss: 0.7028, test_loss: 1.1156, test_f1: 0.5208
 epoch: 51, train_loss: 0.6882, test_loss: 1.1110, test_f1: 0.5133
 epoch: 52, train_loss: 0.6738, test_loss: 1.0968, test_f1: 0.5153
 epoch: 53, train_loss: 0.6922, test_loss: 1.0991, test_f1: 0.5245
 epoch: 54, train_loss: 0.6674, test_loss: 1.1004, test_f1: 0.5148
 epoch: 55, train_loss: 0.6682, test_loss: 1.1281, test_f1: 0.5181
 epoch: 56, train_loss: 0.6636, test_loss: 1.1215, test_f1: 0.5167
 epoch: 57, train_loss: 0.6680, test_loss: 1.1121, test_f1: 0.5314
 epoch: 58, train_loss: 0.6428, test_loss: 1.1202, test_f1: 0.5335
 epoch: 59, train_loss: 0.6575, test_loss: 1.0940, test_f1: 0.5331
 epoch: 60, train_loss: 0.6450, test_loss: 1.1271, test_f1: 0.5253
 epoch: 61, train_loss: 0.6508, test_loss: 1.1203, test_f1: 0.5187
 epoch: 62, train_loss: 0.6213, test_loss: 1.1095, test_f1: 0.5323
 epoch: 63, train_loss: 0.6408, test_loss: 1.1145, test_f1: 0.5399
 epoch: 64, train_loss: 0.6312, test_loss: 1.1241, test_f1: 0.5273
 epoch: 65, train_loss: 0.6319, test_loss: 1.1347, test_f1: 0.5299
 epoch: 66, train_loss: 0.6362, test_loss: 1.1721, test_f1: 0.5197
 epoch: 67, train_loss: 0.6214, test_loss: 1.1645, test_f1: 0.5181
 epoch: 68, train_loss: 0.6214, test_loss: 1.1765, test_f1: 0.5276
 epoch: 69, train_loss: 0.6114, test_loss: 1.1859, test_f1: 0.5198
 epoch: 70, train_loss: 0.6146, test_loss: 1.1753, test_f1: 0.5266
 epoch: 71, train_loss: 0.6026, test_loss: 1.1927, test_f1: 0.5144
 epoch: 72, train_loss: 0.6122, test_loss: 1.1585, test_f1: 0.5105
 epoch: 73, train_loss: 0.6060, test_loss: 1.1789, test_f1: 0.5249
 epoch: 74, train_loss: 0.6071, test_loss: 1.1887, test_f1: 0.5358
 epoch: 75, train_loss: 0.5903, test_loss: 1.1879, test_f1: 0.5215
 epoch: 76, train_loss: 0.5999, test_loss: 1.2163, test_f1: 0.5261
 epoch: 77, train_loss: 0.5802, test_loss: 1.2113, test_f1: 0.5381
 epoch: 78, train_loss: 0.5810, test_loss: 1.2188, test_f1: 0.5208
 epoch: 79, train_loss: 0.5826, test_loss: 1.2207, test_f1: 0.5262
 epoch: 80, train_loss: 0.5816, test_loss: 1.2071, test_f1: 0.5412
 epoch: 81, train_loss: 0.5790, test_loss: 1.2131, test_f1: 0.5243
 epoch: 82, train_loss: 0.5861, test_loss: 1.1925, test_f1: 0.5399
 epoch: 83, train_loss: 0.5817, test_loss: 1.2027, test_f1: 0.5294
 epoch: 84, train_loss: 0.5843, test_loss: 1.1962, test_f1: 0.5362
 epoch: 85, train_loss: 0.5865, test_loss: 1.2037, test_f1: 0.5361
 epoch: 86, train_loss: 0.5616, test_loss: 1.2557, test_f1: 0.5302
 epoch: 87, train_loss: 0.5635, test_loss: 1.2725, test_f1: 0.5132
 epoch: 88, train_loss: 0.5616, test_loss: 1.2611, test_f1: 0.5330
 epoch: 89, train_loss: 0.5614, test_loss: 1.2618, test_f1: 0.5280
 epoch: 90, train_loss: 0.5451, test_loss: 1.2486, test_f1: 0.5290
 epoch: 91, train_loss: 0.5597, test_loss: 1.2397, test_f1: 0.5319
 epoch: 92, train_loss: 0.5437, test_loss: 1.2702, test_f1: 0.5351
 epoch: 93, train_loss: 0.5639, test_loss: 1.2606, test_f1: 0.5424
 epoch: 94, train_loss: 0.5550, test_loss: 1.2676, test_f1: 0.5380
 epoch: 95, train_loss: 0.5509, test_loss: 1.2644, test_f1: 0.5367
 epoch: 96, train_loss: 0.5387, test_loss: 1.3176, test_f1: 0.5344
 epoch: 97, train_loss: 0.5353, test_loss: 1.2980, test_f1: 0.5414
 epoch: 98, train_loss: 0.5308, test_loss: 1.3134, test_f1: 0.5331
 epoch: 99, train_loss: 0.5595, test_loss: 1.2950, test_f1: 0.5309
##################ITERATION #9 ****************************************
 epoch: 0, train_loss: 1.3506, test_loss: 1.2793, test_f1: 0.2274
 epoch: 1, train_loss: 1.2332, test_loss: 1.2348, test_f1: 0.2695
 epoch: 2, train_loss: 1.1986, test_loss: 1.1834, test_f1: 0.4115
 epoch: 3, train_loss: 1.1817, test_loss: 1.1477, test_f1: 0.4438
 epoch: 4, train_loss: 1.1542, test_loss: 1.1196, test_f1: 0.4281
 epoch: 5, train_loss: 1.1242, test_loss: 1.1082, test_f1: 0.4401
 epoch: 6, train_loss: 1.1156, test_loss: 1.0981, test_f1: 0.4322
 epoch: 7, train_loss: 1.0998, test_loss: 1.0878, test_f1: 0.4380
 epoch: 8, train_loss: 1.0854, test_loss: 1.0769, test_f1: 0.4299
 epoch: 9, train_loss: 1.0697, test_loss: 1.0756, test_f1: 0.4330
 epoch: 10, train_loss: 1.0591, test_loss: 1.0681, test_f1: 0.4588
 epoch: 11, train_loss: 1.0450, test_loss: 1.0648, test_f1: 0.4419
 epoch: 12, train_loss: 1.0281, test_loss: 1.0600, test_f1: 0.4426
 epoch: 13, train_loss: 1.0208, test_loss: 1.0526, test_f1: 0.4391
 epoch: 14, train_loss: 1.0031, test_loss: 1.0468, test_f1: 0.4483
 epoch: 15, train_loss: 0.9928, test_loss: 1.0443, test_f1: 0.4597
 epoch: 16, train_loss: 0.9804, test_loss: 1.0405, test_f1: 0.4734
 epoch: 17, train_loss: 0.9732, test_loss: 1.0452, test_f1: 0.4676
 epoch: 18, train_loss: 0.9654, test_loss: 1.0440, test_f1: 0.4544
 epoch: 19, train_loss: 0.9543, test_loss: 1.0452, test_f1: 0.4485
 epoch: 20, train_loss: 0.9520, test_loss: 1.0368, test_f1: 0.4592
 epoch: 21, train_loss: 0.9301, test_loss: 1.0419, test_f1: 0.4578
 epoch: 22, train_loss: 0.9185, test_loss: 1.0545, test_f1: 0.4655
 epoch: 23, train_loss: 0.9104, test_loss: 1.0223, test_f1: 0.4833
 epoch: 24, train_loss: 0.9070, test_loss: 1.0464, test_f1: 0.4569
 epoch: 25, train_loss: 0.8932, test_loss: 1.0236, test_f1: 0.4821
 epoch: 26, train_loss: 0.8745, test_loss: 1.0400, test_f1: 0.4814
 epoch: 27, train_loss: 0.8638, test_loss: 1.0370, test_f1: 0.4928
 epoch: 28, train_loss: 0.8533, test_loss: 1.0507, test_f1: 0.4910
 epoch: 29, train_loss: 0.8472, test_loss: 1.0241, test_f1: 0.4786
 epoch: 30, train_loss: 0.8435, test_loss: 1.0417, test_f1: 0.4640
 epoch: 31, train_loss: 0.8301, test_loss: 1.0532, test_f1: 0.4731
 epoch: 32, train_loss: 0.8209, test_loss: 1.0717, test_f1: 0.4779
 epoch: 33, train_loss: 0.8121, test_loss: 1.0495, test_f1: 0.4754
 epoch: 34, train_loss: 0.8061, test_loss: 1.0615, test_f1: 0.4649
 epoch: 35, train_loss: 0.8055, test_loss: 1.0606, test_f1: 0.4928
 epoch: 36, train_loss: 0.7944, test_loss: 1.0884, test_f1: 0.4945
 epoch: 37, train_loss: 0.7769, test_loss: 1.0752, test_f1: 0.4833
 epoch: 38, train_loss: 0.7671, test_loss: 1.0731, test_f1: 0.4832
 epoch: 39, train_loss: 0.7487, test_loss: 1.0819, test_f1: 0.4996
 epoch: 40, train_loss: 0.7320, test_loss: 1.0987, test_f1: 0.4814
 epoch: 41, train_loss: 0.7496, test_loss: 1.1046, test_f1: 0.4805
 epoch: 42, train_loss: 0.7382, test_loss: 1.1034, test_f1: 0.4762
 epoch: 43, train_loss: 0.7273, test_loss: 1.1185, test_f1: 0.4750
 epoch: 44, train_loss: 0.7141, test_loss: 1.1371, test_f1: 0.4929
 epoch: 45, train_loss: 0.7079, test_loss: 1.1186, test_f1: 0.4918
 epoch: 46, train_loss: 0.7237, test_loss: 1.1025, test_f1: 0.4870
 epoch: 47, train_loss: 0.7106, test_loss: 1.1344, test_f1: 0.5023
 epoch: 48, train_loss: 0.6916, test_loss: 1.1453, test_f1: 0.4964
 epoch: 49, train_loss: 0.6902, test_loss: 1.1999, test_f1: 0.4759
 epoch: 50, train_loss: 0.6715, test_loss: 1.2031, test_f1: 0.4836
 epoch: 51, train_loss: 0.6784, test_loss: 1.1880, test_f1: 0.4867
 epoch: 52, train_loss: 0.6680, test_loss: 1.1679, test_f1: 0.4959
 epoch: 53, train_loss: 0.6429, test_loss: 1.1876, test_f1: 0.4770
 epoch: 54, train_loss: 0.6382, test_loss: 1.2154, test_f1: 0.4847
 epoch: 55, train_loss: 0.6478, test_loss: 1.1857, test_f1: 0.4879
 epoch: 56, train_loss: 0.6461, test_loss: 1.1819, test_f1: 0.4863
 epoch: 57, train_loss: 0.6516, test_loss: 1.2108, test_f1: 0.4916
 epoch: 58, train_loss: 0.6496, test_loss: 1.1887, test_f1: 0.4921
 epoch: 59, train_loss: 0.6260, test_loss: 1.2217, test_f1: 0.4915
 epoch: 60, train_loss: 0.6356, test_loss: 1.2365, test_f1: 0.4787
 epoch: 61, train_loss: 0.6170, test_loss: 1.2533, test_f1: 0.4915
 epoch: 62, train_loss: 0.6113, test_loss: 1.2717, test_f1: 0.4881
 epoch: 63, train_loss: 0.6213, test_loss: 1.2147, test_f1: 0.5032
 epoch: 64, train_loss: 0.6173, test_loss: 1.2657, test_f1: 0.4851
 epoch: 65, train_loss: 0.6148, test_loss: 1.2504, test_f1: 0.4939
 epoch: 66, train_loss: 0.6062, test_loss: 1.2742, test_f1: 0.4843
 epoch: 67, train_loss: 0.6141, test_loss: 1.2663, test_f1: 0.4839
 epoch: 68, train_loss: 0.6253, test_loss: 1.2563, test_f1: 0.5016
 epoch: 69, train_loss: 0.6092, test_loss: 1.2703, test_f1: 0.5124
 epoch: 70, train_loss: 0.6002, test_loss: 1.2837, test_f1: 0.4901
 epoch: 71, train_loss: 0.6022, test_loss: 1.3006, test_f1: 0.4956
 epoch: 72, train_loss: 0.5919, test_loss: 1.2902, test_f1: 0.4854
 epoch: 73, train_loss: 0.5910, test_loss: 1.3052, test_f1: 0.4881
 epoch: 74, train_loss: 0.5832, test_loss: 1.2940, test_f1: 0.4937
 epoch: 75, train_loss: 0.5917, test_loss: 1.3089, test_f1: 0.5038
 epoch: 76, train_loss: 0.5802, test_loss: 1.2808, test_f1: 0.4955
 epoch: 77, train_loss: 0.5779, test_loss: 1.3085, test_f1: 0.5024
 epoch: 78, train_loss: 0.5673, test_loss: 1.3117, test_f1: 0.5010
 epoch: 79, train_loss: 0.5804, test_loss: 1.3365, test_f1: 0.4886
 epoch: 80, train_loss: 0.5568, test_loss: 1.3393, test_f1: 0.5012
 epoch: 81, train_loss: 0.5616, test_loss: 1.3223, test_f1: 0.4998
 epoch: 82, train_loss: 0.5672, test_loss: 1.3259, test_f1: 0.5008
 epoch: 83, train_loss: 0.5691, test_loss: 1.3457, test_f1: 0.5000
 epoch: 84, train_loss: 0.5628, test_loss: 1.3643, test_f1: 0.4937
 epoch: 85, train_loss: 0.5565, test_loss: 1.3610, test_f1: 0.5003
 epoch: 86, train_loss: 0.5676, test_loss: 1.3671, test_f1: 0.5062
 epoch: 87, train_loss: 0.5490, test_loss: 1.3763, test_f1: 0.5072
 epoch: 88, train_loss: 0.5702, test_loss: 1.3773, test_f1: 0.5028
 epoch: 89, train_loss: 0.5334, test_loss: 1.4141, test_f1: 0.5024
 epoch: 90, train_loss: 0.5518, test_loss: 1.3828, test_f1: 0.5008
 epoch: 91, train_loss: 0.5384, test_loss: 1.4207, test_f1: 0.4989
 epoch: 92, train_loss: 0.5438, test_loss: 1.4084, test_f1: 0.5047
 epoch: 93, train_loss: 0.5308, test_loss: 1.3832, test_f1: 0.5266
 epoch: 94, train_loss: 0.5157, test_loss: 1.3972, test_f1: 0.5193
 epoch: 95, train_loss: 0.5251, test_loss: 1.3940, test_f1: 0.5203
 epoch: 96, train_loss: 0.5244, test_loss: 1.3892, test_f1: 0.5316
 epoch: 97, train_loss: 0.5194, test_loss: 1.4069, test_f1: 0.5158
 epoch: 98, train_loss: 0.5170, test_loss: 1.4680, test_f1: 0.5111
 epoch: 99, train_loss: 0.5224, test_loss: 1.4430, test_f1: 0.5229

Training completed in 728.93 seconds
Best F1: 0.5452 at epoch 96
Mean F1 across iterations: 0.5282  0.0129
========================FINAL RESULTS================================
FEGIN weighted F1: 0.5452  0.0129
python main.py --data ltspice_examples --representation component_component --model FEGIN --layers 5 --hiddens 128 --batch_size 256 --lr 0.0001 --emb_size 250 --epochs 100 --save_appendix component_component_L5_H128_BS256_LR0.0001_E250 --no_val
-----



STDERR:
  File "main.py", line 370, in <module>
    main()
  File "main.py", line 254, in main
    dataset = dataset_class(
  File "/home/philip/projects/llm_inference_code_repo/Circuit-Completion-Using-GNNs/component_classification_with_link_prediction_head/evaluation/FEGIN/kernel/circuit_datasets.py", line 15, in __init__
    self.data, self.slices = torch.load(self.processed_paths[0])
  File "/home/philip/.local/lib/python3.8/site-packages/torch/serialization.py", line 1040, in load
    warnings.warn(
  File "/usr/lib/python3.8/warnings.py", line 109, in _showwarnmsg
    sw(msg.message, msg.category, msg.filename, msg.lineno,
  File "main.py", line 47, in warn_with_traceback
    traceback.print_stack(file=log)
/home/philip/projects/llm_inference_code_repo/Circuit-Completion-Using-GNNs/component_classification_with_link_prediction_head/evaluation/FEGIN/kernel/circuit_datasets.py:15: FutureWarning: You are using `torch.load` with `weights_only=False` (the current default value), which uses the default pickle module implicitly. It is possible to construct malicious pickle data which will execute arbitrary code during unpickling (See https://github.com/pytorch/pytorch/blob/main/SECURITY.md#untrusted-models for more details). In a future release, the default value for `weights_only` will be flipped to `True`. This limits the functions that could be executed during unpickling. Arbitrary objects will no longer be allowed to be loaded via this mode unless they are explicitly allowlisted by the user via `torch.serialization.add_safe_globals`. We recommend you start setting `weights_only=True` for any use case where you don't have full control of the loaded file. Please open an issue on GitHub for any issues related to this experimental feature.
  self.data, self.slices = torch.load(self.processed_paths[0])
