STDOUT:
Results will be saved in /home/philip/projects/ltspice_examples_code_repo/Circuit-Completion-Using-GNNs/component_classification_with_link_prediction_head/evaluation/FEGIN/results/model_FEGIN_dataset_ltspice_examples
Command line input: python main.py --data ltspice_examples --representation component_net --model FEGIN --layers 4 --hiddens 32 --batch_size 256 --lr 0.0001 --emb_size 128 --epochs 100 --save_appendix component_net_L4_H32_BS256_LR0.0001_E128 --no_val
 is saved.
-----
ltspice_examples - FEGIN
Using 4 layers, 32 hidden units, h = 2
Loading component_net representation dataset
ENTERED
Training FEGIN on component_net representation
Train: 3558, Test: 846
##################ITERATION #0 ****************************************
 epoch: 0, train_loss: 1.3614, test_loss: 1.3607, test_f1: 0.2270
 epoch: 1, train_loss: 1.3572, test_loss: 1.3602, test_f1: 0.2270
 epoch: 2, train_loss: 1.3549, test_loss: 1.3598, test_f1: 0.2270
 epoch: 3, train_loss: 1.3517, test_loss: 1.3572, test_f1: 0.2270
 epoch: 4, train_loss: 1.3491, test_loss: 1.3531, test_f1: 0.2270
 epoch: 5, train_loss: 1.3460, test_loss: 1.3481, test_f1: 0.2270
 epoch: 6, train_loss: 1.3440, test_loss: 1.3440, test_f1: 0.2270
 epoch: 7, train_loss: 1.3393, test_loss: 1.3403, test_f1: 0.2270
 epoch: 8, train_loss: 1.3358, test_loss: 1.3360, test_f1: 0.2270
 epoch: 9, train_loss: 1.3326, test_loss: 1.3314, test_f1: 0.2270
 epoch: 10, train_loss: 1.3284, test_loss: 1.3275, test_f1: 0.2270
 epoch: 11, train_loss: 1.3250, test_loss: 1.3240, test_f1: 0.2270
 epoch: 12, train_loss: 1.3210, test_loss: 1.3195, test_f1: 0.2270
 epoch: 13, train_loss: 1.3173, test_loss: 1.3154, test_f1: 0.2270
 epoch: 14, train_loss: 1.3134, test_loss: 1.3109, test_f1: 0.2270
 epoch: 15, train_loss: 1.3086, test_loss: 1.3072, test_f1: 0.2320
 epoch: 16, train_loss: 1.3054, test_loss: 1.3040, test_f1: 0.2320
 epoch: 17, train_loss: 1.3001, test_loss: 1.3001, test_f1: 0.2392
 epoch: 18, train_loss: 1.2970, test_loss: 1.2956, test_f1: 0.2461
 epoch: 19, train_loss: 1.2935, test_loss: 1.2918, test_f1: 0.2506
 epoch: 20, train_loss: 1.2891, test_loss: 1.2881, test_f1: 0.2549
 epoch: 21, train_loss: 1.2826, test_loss: 1.2845, test_f1: 0.2611
 epoch: 22, train_loss: 1.2810, test_loss: 1.2807, test_f1: 0.2651
 epoch: 23, train_loss: 1.2760, test_loss: 1.2754, test_f1: 0.2735
 epoch: 24, train_loss: 1.2708, test_loss: 1.2712, test_f1: 0.2806
 epoch: 25, train_loss: 1.2665, test_loss: 1.2672, test_f1: 0.2841
 epoch: 26, train_loss: 1.2605, test_loss: 1.2620, test_f1: 0.2915
 epoch: 27, train_loss: 1.2585, test_loss: 1.2572, test_f1: 0.2956
 epoch: 28, train_loss: 1.2538, test_loss: 1.2526, test_f1: 0.3027
 epoch: 29, train_loss: 1.2461, test_loss: 1.2473, test_f1: 0.3171
 epoch: 30, train_loss: 1.2425, test_loss: 1.2408, test_f1: 0.3250
 epoch: 31, train_loss: 1.2366, test_loss: 1.2342, test_f1: 0.3405
 epoch: 32, train_loss: 1.2308, test_loss: 1.2295, test_f1: 0.3445
 epoch: 33, train_loss: 1.2275, test_loss: 1.2232, test_f1: 0.3423
 epoch: 34, train_loss: 1.2209, test_loss: 1.2160, test_f1: 0.3541
 epoch: 35, train_loss: 1.2158, test_loss: 1.2095, test_f1: 0.3658
 epoch: 36, train_loss: 1.2133, test_loss: 1.2020, test_f1: 0.3726
 epoch: 37, train_loss: 1.2032, test_loss: 1.1942, test_f1: 0.3770
 epoch: 38, train_loss: 1.1973, test_loss: 1.1863, test_f1: 0.3857
 epoch: 39, train_loss: 1.1918, test_loss: 1.1789, test_f1: 0.3857
 epoch: 40, train_loss: 1.1855, test_loss: 1.1722, test_f1: 0.3974
 epoch: 41, train_loss: 1.1763, test_loss: 1.1643, test_f1: 0.3915
 epoch: 42, train_loss: 1.1702, test_loss: 1.1562, test_f1: 0.3947
 epoch: 43, train_loss: 1.1595, test_loss: 1.1492, test_f1: 0.4063
 epoch: 44, train_loss: 1.1534, test_loss: 1.1418, test_f1: 0.4121
 epoch: 45, train_loss: 1.1458, test_loss: 1.1318, test_f1: 0.4185
 epoch: 46, train_loss: 1.1446, test_loss: 1.1255, test_f1: 0.4220
 epoch: 47, train_loss: 1.1314, test_loss: 1.1165, test_f1: 0.4245
 epoch: 48, train_loss: 1.1248, test_loss: 1.1103, test_f1: 0.4312
 epoch: 49, train_loss: 1.1227, test_loss: 1.1028, test_f1: 0.4308
 epoch: 50, train_loss: 1.1149, test_loss: 1.0957, test_f1: 0.4334
 epoch: 51, train_loss: 1.1143, test_loss: 1.0923, test_f1: 0.4403
 epoch: 52, train_loss: 1.1085, test_loss: 1.0892, test_f1: 0.4461
 epoch: 53, train_loss: 1.1026, test_loss: 1.0838, test_f1: 0.4420
 epoch: 54, train_loss: 1.0990, test_loss: 1.0793, test_f1: 0.4403
 epoch: 55, train_loss: 1.1008, test_loss: 1.0763, test_f1: 0.4532
 epoch: 56, train_loss: 1.0946, test_loss: 1.0733, test_f1: 0.4504
 epoch: 57, train_loss: 1.0905, test_loss: 1.0702, test_f1: 0.4582
 epoch: 58, train_loss: 1.0839, test_loss: 1.0683, test_f1: 0.4587
 epoch: 59, train_loss: 1.0832, test_loss: 1.0631, test_f1: 0.4584
 epoch: 60, train_loss: 1.0791, test_loss: 1.0607, test_f1: 0.4649
 epoch: 61, train_loss: 1.0790, test_loss: 1.0561, test_f1: 0.4795
 epoch: 62, train_loss: 1.0728, test_loss: 1.0527, test_f1: 0.4758
 epoch: 63, train_loss: 1.0734, test_loss: 1.0494, test_f1: 0.4756
 epoch: 64, train_loss: 1.0706, test_loss: 1.0454, test_f1: 0.4821
 epoch: 65, train_loss: 1.0611, test_loss: 1.0428, test_f1: 0.4922
 epoch: 66, train_loss: 1.0554, test_loss: 1.0390, test_f1: 0.4843
 epoch: 67, train_loss: 1.0611, test_loss: 1.0372, test_f1: 0.4908
 epoch: 68, train_loss: 1.0603, test_loss: 1.0357, test_f1: 0.4937
 epoch: 69, train_loss: 1.0553, test_loss: 1.0300, test_f1: 0.4971
 epoch: 70, train_loss: 1.0546, test_loss: 1.0291, test_f1: 0.4966
 epoch: 71, train_loss: 1.0521, test_loss: 1.0258, test_f1: 0.4955
 epoch: 72, train_loss: 1.0512, test_loss: 1.0230, test_f1: 0.4936
 epoch: 73, train_loss: 1.0414, test_loss: 1.0201, test_f1: 0.5007
 epoch: 74, train_loss: 1.0396, test_loss: 1.0170, test_f1: 0.4969
 epoch: 75, train_loss: 1.0391, test_loss: 1.0154, test_f1: 0.5041
 epoch: 76, train_loss: 1.0381, test_loss: 1.0109, test_f1: 0.5005
 epoch: 77, train_loss: 1.0329, test_loss: 1.0077, test_f1: 0.5030
 epoch: 78, train_loss: 1.0292, test_loss: 1.0053, test_f1: 0.5014
 epoch: 79, train_loss: 1.0244, test_loss: 1.0030, test_f1: 0.5024
 epoch: 80, train_loss: 1.0249, test_loss: 1.0028, test_f1: 0.5007
 epoch: 81, train_loss: 1.0274, test_loss: 0.9993, test_f1: 0.4991
 epoch: 82, train_loss: 1.0212, test_loss: 0.9961, test_f1: 0.4980
 epoch: 83, train_loss: 1.0183, test_loss: 0.9916, test_f1: 0.5120
 epoch: 84, train_loss: 1.0135, test_loss: 0.9886, test_f1: 0.5135
 epoch: 85, train_loss: 1.0150, test_loss: 0.9867, test_f1: 0.5093
 epoch: 86, train_loss: 1.0048, test_loss: 0.9841, test_f1: 0.5123
 epoch: 87, train_loss: 1.0119, test_loss: 0.9809, test_f1: 0.5199
 epoch: 88, train_loss: 1.0062, test_loss: 0.9788, test_f1: 0.5199
 epoch: 89, train_loss: 1.0095, test_loss: 0.9792, test_f1: 0.5031
 epoch: 90, train_loss: 0.9984, test_loss: 0.9775, test_f1: 0.5034
 epoch: 91, train_loss: 0.9968, test_loss: 0.9744, test_f1: 0.4918
 epoch: 92, train_loss: 0.9969, test_loss: 0.9737, test_f1: 0.4939
 epoch: 93, train_loss: 0.9926, test_loss: 0.9708, test_f1: 0.5104
 epoch: 94, train_loss: 0.9954, test_loss: 0.9710, test_f1: 0.5094
 epoch: 95, train_loss: 0.9880, test_loss: 0.9674, test_f1: 0.4947
 epoch: 96, train_loss: 0.9880, test_loss: 0.9614, test_f1: 0.4998
 epoch: 97, train_loss: 0.9801, test_loss: 0.9619, test_f1: 0.5057
 epoch: 98, train_loss: 0.9841, test_loss: 0.9591, test_f1: 0.5026
 epoch: 99, train_loss: 0.9803, test_loss: 0.9589, test_f1: 0.5047
##################ITERATION #1 ****************************************
 epoch: 0, train_loss: 1.3272, test_loss: 1.3359, test_f1: 0.2270
 epoch: 1, train_loss: 1.3199, test_loss: 1.3310, test_f1: 0.2270
 epoch: 2, train_loss: 1.3162, test_loss: 1.3251, test_f1: 0.2270
 epoch: 3, train_loss: 1.3113, test_loss: 1.3187, test_f1: 0.2270
 epoch: 4, train_loss: 1.3065, test_loss: 1.3134, test_f1: 0.2270
 epoch: 5, train_loss: 1.3007, test_loss: 1.3072, test_f1: 0.2270
 epoch: 6, train_loss: 1.2968, test_loss: 1.3014, test_f1: 0.2270
 epoch: 7, train_loss: 1.2909, test_loss: 1.2954, test_f1: 0.2270
 epoch: 8, train_loss: 1.2837, test_loss: 1.2894, test_f1: 0.2270
 epoch: 9, train_loss: 1.2803, test_loss: 1.2836, test_f1: 0.2270
 epoch: 10, train_loss: 1.2757, test_loss: 1.2782, test_f1: 0.2270
 epoch: 11, train_loss: 1.2678, test_loss: 1.2721, test_f1: 0.2270
 epoch: 12, train_loss: 1.2655, test_loss: 1.2660, test_f1: 0.2270
 epoch: 13, train_loss: 1.2602, test_loss: 1.2602, test_f1: 0.2270
 epoch: 14, train_loss: 1.2539, test_loss: 1.2542, test_f1: 0.2270
 epoch: 15, train_loss: 1.2499, test_loss: 1.2481, test_f1: 0.2270
 epoch: 16, train_loss: 1.2422, test_loss: 1.2421, test_f1: 0.2270
 epoch: 17, train_loss: 1.2376, test_loss: 1.2360, test_f1: 0.2484
 epoch: 18, train_loss: 1.2351, test_loss: 1.2299, test_f1: 0.2549
 epoch: 19, train_loss: 1.2272, test_loss: 1.2242, test_f1: 0.2728
 epoch: 20, train_loss: 1.2267, test_loss: 1.2191, test_f1: 0.2747
 epoch: 21, train_loss: 1.2209, test_loss: 1.2138, test_f1: 0.2801
 epoch: 22, train_loss: 1.2167, test_loss: 1.2079, test_f1: 0.2819
 epoch: 23, train_loss: 1.2119, test_loss: 1.2030, test_f1: 0.2879
 epoch: 24, train_loss: 1.2023, test_loss: 1.1961, test_f1: 0.2979
 epoch: 25, train_loss: 1.1977, test_loss: 1.1906, test_f1: 0.3359
 epoch: 26, train_loss: 1.1952, test_loss: 1.1848, test_f1: 0.3437
 epoch: 27, train_loss: 1.1921, test_loss: 1.1787, test_f1: 0.3500
 epoch: 28, train_loss: 1.1853, test_loss: 1.1718, test_f1: 0.3700
 epoch: 29, train_loss: 1.1813, test_loss: 1.1656, test_f1: 0.3877
 epoch: 30, train_loss: 1.1715, test_loss: 1.1590, test_f1: 0.4080
 epoch: 31, train_loss: 1.1658, test_loss: 1.1519, test_f1: 0.4077
 epoch: 32, train_loss: 1.1626, test_loss: 1.1452, test_f1: 0.4139
 epoch: 33, train_loss: 1.1604, test_loss: 1.1369, test_f1: 0.4223
 epoch: 34, train_loss: 1.1545, test_loss: 1.1296, test_f1: 0.4290
 epoch: 35, train_loss: 1.1398, test_loss: 1.1226, test_f1: 0.4470
 epoch: 36, train_loss: 1.1365, test_loss: 1.1157, test_f1: 0.4590
 epoch: 37, train_loss: 1.1343, test_loss: 1.1083, test_f1: 0.4613
 epoch: 38, train_loss: 1.1232, test_loss: 1.1009, test_f1: 0.4649
 epoch: 39, train_loss: 1.1170, test_loss: 1.0937, test_f1: 0.4678
 epoch: 40, train_loss: 1.1088, test_loss: 1.0851, test_f1: 0.4720
 epoch: 41, train_loss: 1.1122, test_loss: 1.0836, test_f1: 0.4655
 epoch: 42, train_loss: 1.1004, test_loss: 1.0714, test_f1: 0.4763
 epoch: 43, train_loss: 1.0925, test_loss: 1.0649, test_f1: 0.4786
 epoch: 44, train_loss: 1.0865, test_loss: 1.0609, test_f1: 0.4767
 epoch: 45, train_loss: 1.0796, test_loss: 1.0538, test_f1: 0.4848
 epoch: 46, train_loss: 1.0749, test_loss: 1.0464, test_f1: 0.4831
 epoch: 47, train_loss: 1.0655, test_loss: 1.0445, test_f1: 0.4881
 epoch: 48, train_loss: 1.0611, test_loss: 1.0335, test_f1: 0.4852
 epoch: 49, train_loss: 1.0543, test_loss: 1.0328, test_f1: 0.4734
 epoch: 50, train_loss: 1.0502, test_loss: 1.0247, test_f1: 0.4802
 epoch: 51, train_loss: 1.0431, test_loss: 1.0207, test_f1: 0.4792
 epoch: 52, train_loss: 1.0382, test_loss: 1.0197, test_f1: 0.4855
 epoch: 53, train_loss: 1.0351, test_loss: 1.0178, test_f1: 0.4833
 epoch: 54, train_loss: 1.0360, test_loss: 1.0134, test_f1: 0.4793
 epoch: 55, train_loss: 1.0279, test_loss: 1.0123, test_f1: 0.4859
 epoch: 56, train_loss: 1.0294, test_loss: 1.0115, test_f1: 0.4782
 epoch: 57, train_loss: 1.0286, test_loss: 1.0104, test_f1: 0.4784
 epoch: 58, train_loss: 1.0210, test_loss: 1.0060, test_f1: 0.4849
 epoch: 59, train_loss: 1.0200, test_loss: 1.0036, test_f1: 0.4820
 epoch: 60, train_loss: 1.0104, test_loss: 1.0010, test_f1: 0.4810
 epoch: 61, train_loss: 1.0107, test_loss: 0.9966, test_f1: 0.4782
 epoch: 62, train_loss: 1.0134, test_loss: 0.9986, test_f1: 0.4822
 epoch: 63, train_loss: 1.0007, test_loss: 0.9987, test_f1: 0.4825
 epoch: 64, train_loss: 1.0064, test_loss: 0.9936, test_f1: 0.4842
 epoch: 65, train_loss: 0.9963, test_loss: 0.9894, test_f1: 0.4902
 epoch: 66, train_loss: 0.9980, test_loss: 0.9901, test_f1: 0.4869
 epoch: 67, train_loss: 0.9988, test_loss: 0.9870, test_f1: 0.4808
 epoch: 68, train_loss: 0.9990, test_loss: 0.9895, test_f1: 0.4845
 epoch: 69, train_loss: 0.9958, test_loss: 0.9886, test_f1: 0.4814
 epoch: 70, train_loss: 0.9925, test_loss: 0.9846, test_f1: 0.4792
 epoch: 71, train_loss: 0.9890, test_loss: 0.9844, test_f1: 0.4805
 epoch: 72, train_loss: 0.9866, test_loss: 0.9880, test_f1: 0.4923
 epoch: 73, train_loss: 0.9794, test_loss: 0.9828, test_f1: 0.4830
 epoch: 74, train_loss: 0.9770, test_loss: 0.9816, test_f1: 0.4784
 epoch: 75, train_loss: 0.9862, test_loss: 0.9834, test_f1: 0.4788
 epoch: 76, train_loss: 0.9750, test_loss: 0.9780, test_f1: 0.4839
 epoch: 77, train_loss: 0.9787, test_loss: 0.9764, test_f1: 0.4880
 epoch: 78, train_loss: 0.9814, test_loss: 0.9797, test_f1: 0.4843
 epoch: 79, train_loss: 0.9711, test_loss: 0.9731, test_f1: 0.4825
 epoch: 80, train_loss: 0.9771, test_loss: 0.9709, test_f1: 0.4855
 epoch: 81, train_loss: 0.9693, test_loss: 0.9735, test_f1: 0.4794
 epoch: 82, train_loss: 0.9684, test_loss: 0.9699, test_f1: 0.4817
 epoch: 83, train_loss: 0.9568, test_loss: 0.9753, test_f1: 0.4865
 epoch: 84, train_loss: 0.9675, test_loss: 0.9729, test_f1: 0.4874
 epoch: 85, train_loss: 0.9662, test_loss: 0.9731, test_f1: 0.4851
 epoch: 86, train_loss: 0.9598, test_loss: 0.9719, test_f1: 0.4798
 epoch: 87, train_loss: 0.9644, test_loss: 0.9661, test_f1: 0.4815
 epoch: 88, train_loss: 0.9577, test_loss: 0.9640, test_f1: 0.4827
 epoch: 89, train_loss: 0.9568, test_loss: 0.9691, test_f1: 0.4866
 epoch: 90, train_loss: 0.9504, test_loss: 0.9645, test_f1: 0.4806
 epoch: 91, train_loss: 0.9543, test_loss: 0.9615, test_f1: 0.4833
 epoch: 92, train_loss: 0.9430, test_loss: 0.9693, test_f1: 0.4786
 epoch: 93, train_loss: 0.9536, test_loss: 0.9718, test_f1: 0.4837
 epoch: 94, train_loss: 0.9486, test_loss: 0.9666, test_f1: 0.4804
 epoch: 95, train_loss: 0.9422, test_loss: 0.9573, test_f1: 0.4868
 epoch: 96, train_loss: 0.9443, test_loss: 0.9556, test_f1: 0.4886
 epoch: 97, train_loss: 0.9460, test_loss: 0.9530, test_f1: 0.4870
 epoch: 98, train_loss: 0.9388, test_loss: 0.9548, test_f1: 0.4916
 epoch: 99, train_loss: 0.9389, test_loss: 0.9581, test_f1: 0.4876
##################ITERATION #2 ****************************************
 epoch: 0, train_loss: 1.3193, test_loss: 1.3270, test_f1: 0.2270
 epoch: 1, train_loss: 1.3086, test_loss: 1.3251, test_f1: 0.2270
 epoch: 2, train_loss: 1.2995, test_loss: 1.3164, test_f1: 0.2270
 epoch: 3, train_loss: 1.2881, test_loss: 1.3046, test_f1: 0.2270
 epoch: 4, train_loss: 1.2847, test_loss: 1.2934, test_f1: 0.2270
 epoch: 5, train_loss: 1.2775, test_loss: 1.2819, test_f1: 0.2764
 epoch: 6, train_loss: 1.2709, test_loss: 1.2626, test_f1: 0.3149
 epoch: 7, train_loss: 1.2610, test_loss: 1.2464, test_f1: 0.3237
 epoch: 8, train_loss: 1.2565, test_loss: 1.2372, test_f1: 0.3274
 epoch: 9, train_loss: 1.2472, test_loss: 1.2309, test_f1: 0.3373
 epoch: 10, train_loss: 1.2399, test_loss: 1.2204, test_f1: 0.3374
 epoch: 11, train_loss: 1.2368, test_loss: 1.2124, test_f1: 0.3434
 epoch: 12, train_loss: 1.2309, test_loss: 1.2060, test_f1: 0.3508
 epoch: 13, train_loss: 1.2244, test_loss: 1.1996, test_f1: 0.3601
 epoch: 14, train_loss: 1.2179, test_loss: 1.1944, test_f1: 0.3619
 epoch: 15, train_loss: 1.2180, test_loss: 1.1902, test_f1: 0.3636
 epoch: 16, train_loss: 1.2090, test_loss: 1.1857, test_f1: 0.3604
 epoch: 17, train_loss: 1.2042, test_loss: 1.1781, test_f1: 0.3662
 epoch: 18, train_loss: 1.1956, test_loss: 1.1733, test_f1: 0.3678
 epoch: 19, train_loss: 1.1967, test_loss: 1.1698, test_f1: 0.3661
 epoch: 20, train_loss: 1.1868, test_loss: 1.1647, test_f1: 0.3719
 epoch: 21, train_loss: 1.1812, test_loss: 1.1569, test_f1: 0.3757
 epoch: 22, train_loss: 1.1831, test_loss: 1.1533, test_f1: 0.3797
 epoch: 23, train_loss: 1.1728, test_loss: 1.1486, test_f1: 0.3804
 epoch: 24, train_loss: 1.1717, test_loss: 1.1438, test_f1: 0.3857
 epoch: 25, train_loss: 1.1624, test_loss: 1.1386, test_f1: 0.3940
 epoch: 26, train_loss: 1.1607, test_loss: 1.1332, test_f1: 0.4107
 epoch: 27, train_loss: 1.1557, test_loss: 1.1289, test_f1: 0.4108
 epoch: 28, train_loss: 1.1517, test_loss: 1.1245, test_f1: 0.4153
 epoch: 29, train_loss: 1.1522, test_loss: 1.1198, test_f1: 0.4187
 epoch: 30, train_loss: 1.1406, test_loss: 1.1142, test_f1: 0.4266
 epoch: 31, train_loss: 1.1388, test_loss: 1.1090, test_f1: 0.4337
 epoch: 32, train_loss: 1.1306, test_loss: 1.1050, test_f1: 0.4356
 epoch: 33, train_loss: 1.1234, test_loss: 1.1022, test_f1: 0.4398
 epoch: 34, train_loss: 1.1219, test_loss: 1.0985, test_f1: 0.4377
 epoch: 35, train_loss: 1.1211, test_loss: 1.0938, test_f1: 0.4506
 epoch: 36, train_loss: 1.1208, test_loss: 1.0901, test_f1: 0.4538
 epoch: 37, train_loss: 1.1163, test_loss: 1.0819, test_f1: 0.4574
 epoch: 38, train_loss: 1.1117, test_loss: 1.0781, test_f1: 0.4643
 epoch: 39, train_loss: 1.1074, test_loss: 1.0765, test_f1: 0.4570
 epoch: 40, train_loss: 1.1001, test_loss: 1.0707, test_f1: 0.4626
 epoch: 41, train_loss: 1.0941, test_loss: 1.0658, test_f1: 0.4680
 epoch: 42, train_loss: 1.0869, test_loss: 1.0610, test_f1: 0.4717
 epoch: 43, train_loss: 1.0819, test_loss: 1.0567, test_f1: 0.4720
 epoch: 44, train_loss: 1.0812, test_loss: 1.0530, test_f1: 0.4736
 epoch: 45, train_loss: 1.0780, test_loss: 1.0470, test_f1: 0.4705
 epoch: 46, train_loss: 1.0695, test_loss: 1.0437, test_f1: 0.4749
 epoch: 47, train_loss: 1.0702, test_loss: 1.0440, test_f1: 0.4725
 epoch: 48, train_loss: 1.0604, test_loss: 1.0398, test_f1: 0.4704
 epoch: 49, train_loss: 1.0571, test_loss: 1.0360, test_f1: 0.4709
 epoch: 50, train_loss: 1.0579, test_loss: 1.0336, test_f1: 0.4643
 epoch: 51, train_loss: 1.0478, test_loss: 1.0299, test_f1: 0.4645
 epoch: 52, train_loss: 1.0518, test_loss: 1.0289, test_f1: 0.4675
 epoch: 53, train_loss: 1.0471, test_loss: 1.0279, test_f1: 0.4684
 epoch: 54, train_loss: 1.0438, test_loss: 1.0263, test_f1: 0.4750
 epoch: 55, train_loss: 1.0451, test_loss: 1.0249, test_f1: 0.4764
 epoch: 56, train_loss: 1.0393, test_loss: 1.0239, test_f1: 0.4753
 epoch: 57, train_loss: 1.0354, test_loss: 1.0217, test_f1: 0.4724
 epoch: 58, train_loss: 1.0376, test_loss: 1.0208, test_f1: 0.4763
 epoch: 59, train_loss: 1.0365, test_loss: 1.0204, test_f1: 0.4786
 epoch: 60, train_loss: 1.0308, test_loss: 1.0184, test_f1: 0.4766
 epoch: 61, train_loss: 1.0292, test_loss: 1.0178, test_f1: 0.4771
 epoch: 62, train_loss: 1.0286, test_loss: 1.0172, test_f1: 0.4810
 epoch: 63, train_loss: 1.0314, test_loss: 1.0162, test_f1: 0.4807
 epoch: 64, train_loss: 1.0242, test_loss: 1.0153, test_f1: 0.4770
 epoch: 65, train_loss: 1.0196, test_loss: 1.0132, test_f1: 0.4737
 epoch: 66, train_loss: 1.0197, test_loss: 1.0129, test_f1: 0.4731
 epoch: 67, train_loss: 1.0171, test_loss: 1.0116, test_f1: 0.4794
 epoch: 68, train_loss: 1.0172, test_loss: 1.0094, test_f1: 0.4815
 epoch: 69, train_loss: 1.0198, test_loss: 1.0086, test_f1: 0.4876
 epoch: 70, train_loss: 1.0136, test_loss: 1.0066, test_f1: 0.4859
 epoch: 71, train_loss: 1.0069, test_loss: 1.0050, test_f1: 0.4787
 epoch: 72, train_loss: 1.0114, test_loss: 1.0050, test_f1: 0.4807
 epoch: 73, train_loss: 1.0061, test_loss: 1.0036, test_f1: 0.4836
 epoch: 74, train_loss: 1.0053, test_loss: 1.0028, test_f1: 0.4906
 epoch: 75, train_loss: 1.0053, test_loss: 1.0027, test_f1: 0.4862
 epoch: 76, train_loss: 1.0039, test_loss: 1.0022, test_f1: 0.4812
 epoch: 77, train_loss: 1.0051, test_loss: 1.0013, test_f1: 0.4744
 epoch: 78, train_loss: 0.9982, test_loss: 0.9999, test_f1: 0.4845
 epoch: 79, train_loss: 1.0080, test_loss: 0.9974, test_f1: 0.4876
 epoch: 80, train_loss: 0.9948, test_loss: 0.9970, test_f1: 0.4909
 epoch: 81, train_loss: 0.9955, test_loss: 0.9971, test_f1: 0.4875
 epoch: 82, train_loss: 0.9968, test_loss: 0.9973, test_f1: 0.4883
 epoch: 83, train_loss: 0.9889, test_loss: 0.9972, test_f1: 0.4832
 epoch: 84, train_loss: 0.9939, test_loss: 0.9955, test_f1: 0.4831
 epoch: 85, train_loss: 0.9811, test_loss: 0.9938, test_f1: 0.4896
 epoch: 86, train_loss: 0.9934, test_loss: 0.9934, test_f1: 0.4866
 epoch: 87, train_loss: 0.9873, test_loss: 0.9928, test_f1: 0.4869
 epoch: 88, train_loss: 0.9883, test_loss: 0.9917, test_f1: 0.4877
 epoch: 89, train_loss: 0.9850, test_loss: 0.9909, test_f1: 0.4931
 epoch: 90, train_loss: 0.9793, test_loss: 0.9905, test_f1: 0.4831
 epoch: 91, train_loss: 0.9829, test_loss: 0.9912, test_f1: 0.4808
 epoch: 92, train_loss: 0.9824, test_loss: 0.9897, test_f1: 0.4855
 epoch: 93, train_loss: 0.9842, test_loss: 0.9880, test_f1: 0.4921
 epoch: 94, train_loss: 0.9792, test_loss: 0.9855, test_f1: 0.4925
 epoch: 95, train_loss: 0.9794, test_loss: 0.9852, test_f1: 0.4915
 epoch: 96, train_loss: 0.9837, test_loss: 0.9849, test_f1: 0.4864
 epoch: 97, train_loss: 0.9742, test_loss: 0.9840, test_f1: 0.4888
 epoch: 98, train_loss: 0.9731, test_loss: 0.9844, test_f1: 0.4911
 epoch: 99, train_loss: 0.9732, test_loss: 0.9830, test_f1: 0.4948
##################ITERATION #3 ****************************************
 epoch: 0, train_loss: 1.3125, test_loss: 1.3199, test_f1: 0.2270
 epoch: 1, train_loss: 1.2946, test_loss: 1.3191, test_f1: 0.2270
 epoch: 2, train_loss: 1.2857, test_loss: 1.3096, test_f1: 0.2270
 epoch: 3, train_loss: 1.2770, test_loss: 1.2910, test_f1: 0.2270
 epoch: 4, train_loss: 1.2671, test_loss: 1.2721, test_f1: 0.2270
 epoch: 5, train_loss: 1.2610, test_loss: 1.2533, test_f1: 0.2295
 epoch: 6, train_loss: 1.2517, test_loss: 1.2387, test_f1: 0.2441
 epoch: 7, train_loss: 1.2430, test_loss: 1.2283, test_f1: 0.2698
 epoch: 8, train_loss: 1.2373, test_loss: 1.2212, test_f1: 0.2737
 epoch: 9, train_loss: 1.2299, test_loss: 1.2134, test_f1: 0.2849
 epoch: 10, train_loss: 1.2225, test_loss: 1.2068, test_f1: 0.3079
 epoch: 11, train_loss: 1.2144, test_loss: 1.1985, test_f1: 0.3272
 epoch: 12, train_loss: 1.2084, test_loss: 1.1918, test_f1: 0.3522
 epoch: 13, train_loss: 1.2038, test_loss: 1.1820, test_f1: 0.3681
 epoch: 14, train_loss: 1.1925, test_loss: 1.1733, test_f1: 0.3829
 epoch: 15, train_loss: 1.1862, test_loss: 1.1659, test_f1: 0.3969
 epoch: 16, train_loss: 1.1777, test_loss: 1.1574, test_f1: 0.4119
 epoch: 17, train_loss: 1.1688, test_loss: 1.1509, test_f1: 0.4151
 epoch: 18, train_loss: 1.1653, test_loss: 1.1419, test_f1: 0.4162
 epoch: 19, train_loss: 1.1625, test_loss: 1.1348, test_f1: 0.4246
 epoch: 20, train_loss: 1.1535, test_loss: 1.1278, test_f1: 0.4251
 epoch: 21, train_loss: 1.1458, test_loss: 1.1224, test_f1: 0.4296
 epoch: 22, train_loss: 1.1348, test_loss: 1.1136, test_f1: 0.4400
 epoch: 23, train_loss: 1.1306, test_loss: 1.1059, test_f1: 0.4485
 epoch: 24, train_loss: 1.1204, test_loss: 1.0962, test_f1: 0.4514
 epoch: 25, train_loss: 1.1164, test_loss: 1.0879, test_f1: 0.4476
 epoch: 26, train_loss: 1.1098, test_loss: 1.0814, test_f1: 0.4456
 epoch: 27, train_loss: 1.1026, test_loss: 1.0744, test_f1: 0.4473
 epoch: 28, train_loss: 1.0983, test_loss: 1.0686, test_f1: 0.4315
 epoch: 29, train_loss: 1.0891, test_loss: 1.0625, test_f1: 0.4377
 epoch: 30, train_loss: 1.0837, test_loss: 1.0560, test_f1: 0.4386
 epoch: 31, train_loss: 1.0751, test_loss: 1.0492, test_f1: 0.4399
 epoch: 32, train_loss: 1.0698, test_loss: 1.0448, test_f1: 0.4405
 epoch: 33, train_loss: 1.0673, test_loss: 1.0399, test_f1: 0.4416
 epoch: 34, train_loss: 1.0576, test_loss: 1.0333, test_f1: 0.4451
 epoch: 35, train_loss: 1.0529, test_loss: 1.0218, test_f1: 0.4507
 epoch: 36, train_loss: 1.0428, test_loss: 1.0224, test_f1: 0.4571
 epoch: 37, train_loss: 1.0407, test_loss: 1.0193, test_f1: 0.4571
 epoch: 38, train_loss: 1.0249, test_loss: 1.0113, test_f1: 0.4593
 epoch: 39, train_loss: 1.0244, test_loss: 1.0055, test_f1: 0.4556
 epoch: 40, train_loss: 1.0205, test_loss: 1.0075, test_f1: 0.4644
 epoch: 41, train_loss: 1.0105, test_loss: 1.0026, test_f1: 0.4618
 epoch: 42, train_loss: 1.0137, test_loss: 0.9930, test_f1: 0.4665
 epoch: 43, train_loss: 1.0107, test_loss: 0.9930, test_f1: 0.4783
 epoch: 44, train_loss: 0.9956, test_loss: 0.9901, test_f1: 0.4666
 epoch: 45, train_loss: 0.9996, test_loss: 0.9857, test_f1: 0.4708
 epoch: 46, train_loss: 0.9905, test_loss: 0.9852, test_f1: 0.4701
 epoch: 47, train_loss: 0.9903, test_loss: 0.9805, test_f1: 0.4770
 epoch: 48, train_loss: 0.9913, test_loss: 0.9767, test_f1: 0.4735
 epoch: 49, train_loss: 0.9795, test_loss: 0.9755, test_f1: 0.4781
 epoch: 50, train_loss: 0.9775, test_loss: 0.9737, test_f1: 0.4777
 epoch: 51, train_loss: 0.9772, test_loss: 0.9720, test_f1: 0.4814
 epoch: 52, train_loss: 0.9715, test_loss: 0.9727, test_f1: 0.4814
 epoch: 53, train_loss: 0.9701, test_loss: 0.9713, test_f1: 0.4836
 epoch: 54, train_loss: 0.9633, test_loss: 0.9750, test_f1: 0.4830
 epoch: 55, train_loss: 0.9613, test_loss: 0.9705, test_f1: 0.4829
 epoch: 56, train_loss: 0.9745, test_loss: 0.9697, test_f1: 0.4810
 epoch: 57, train_loss: 0.9620, test_loss: 0.9704, test_f1: 0.4798
 epoch: 58, train_loss: 0.9670, test_loss: 0.9687, test_f1: 0.4799
 epoch: 59, train_loss: 0.9612, test_loss: 0.9653, test_f1: 0.4798
 epoch: 60, train_loss: 0.9614, test_loss: 0.9649, test_f1: 0.4853
 epoch: 61, train_loss: 0.9599, test_loss: 0.9661, test_f1: 0.4860
 epoch: 62, train_loss: 0.9620, test_loss: 0.9624, test_f1: 0.4770
 epoch: 63, train_loss: 0.9551, test_loss: 0.9675, test_f1: 0.4811
 epoch: 64, train_loss: 0.9511, test_loss: 0.9665, test_f1: 0.4862
 epoch: 65, train_loss: 0.9485, test_loss: 0.9641, test_f1: 0.4816
 epoch: 66, train_loss: 0.9526, test_loss: 0.9612, test_f1: 0.4835
 epoch: 67, train_loss: 0.9471, test_loss: 0.9565, test_f1: 0.4841
 epoch: 68, train_loss: 0.9523, test_loss: 0.9635, test_f1: 0.4843
 epoch: 69, train_loss: 0.9411, test_loss: 0.9655, test_f1: 0.4850
 epoch: 70, train_loss: 0.9453, test_loss: 0.9588, test_f1: 0.4851
 epoch: 71, train_loss: 0.9376, test_loss: 0.9551, test_f1: 0.4879
 epoch: 72, train_loss: 0.9425, test_loss: 0.9617, test_f1: 0.4905
 epoch: 73, train_loss: 0.9401, test_loss: 0.9599, test_f1: 0.4870
 epoch: 74, train_loss: 0.9422, test_loss: 0.9659, test_f1: 0.4907
 epoch: 75, train_loss: 0.9432, test_loss: 0.9586, test_f1: 0.4898
 epoch: 76, train_loss: 0.9401, test_loss: 0.9612, test_f1: 0.4928
 epoch: 77, train_loss: 0.9329, test_loss: 0.9588, test_f1: 0.4902
 epoch: 78, train_loss: 0.9388, test_loss: 0.9588, test_f1: 0.4933
 epoch: 79, train_loss: 0.9331, test_loss: 0.9616, test_f1: 0.4918
 epoch: 80, train_loss: 0.9297, test_loss: 0.9565, test_f1: 0.4923
 epoch: 81, train_loss: 0.9333, test_loss: 0.9574, test_f1: 0.4909
 epoch: 82, train_loss: 0.9253, test_loss: 0.9503, test_f1: 0.4984
 epoch: 83, train_loss: 0.9321, test_loss: 0.9546, test_f1: 0.4922
 epoch: 84, train_loss: 0.9248, test_loss: 0.9551, test_f1: 0.4922
 epoch: 85, train_loss: 0.9184, test_loss: 0.9582, test_f1: 0.4924
 epoch: 86, train_loss: 0.9165, test_loss: 0.9522, test_f1: 0.4922
 epoch: 87, train_loss: 0.9170, test_loss: 0.9510, test_f1: 0.5006
 epoch: 88, train_loss: 0.9241, test_loss: 0.9515, test_f1: 0.5016
 epoch: 89, train_loss: 0.9160, test_loss: 0.9483, test_f1: 0.5007
 epoch: 90, train_loss: 0.9171, test_loss: 0.9529, test_f1: 0.5054
 epoch: 91, train_loss: 0.9247, test_loss: 0.9568, test_f1: 0.5036
 epoch: 92, train_loss: 0.9173, test_loss: 0.9563, test_f1: 0.5043
 epoch: 93, train_loss: 0.9177, test_loss: 0.9525, test_f1: 0.5079
 epoch: 94, train_loss: 0.9138, test_loss: 0.9511, test_f1: 0.5044
 epoch: 95, train_loss: 0.9154, test_loss: 0.9548, test_f1: 0.5091
 epoch: 96, train_loss: 0.9073, test_loss: 0.9523, test_f1: 0.5066
 epoch: 97, train_loss: 0.9086, test_loss: 0.9510, test_f1: 0.5078
 epoch: 98, train_loss: 0.9071, test_loss: 0.9539, test_f1: 0.5068
 epoch: 99, train_loss: 0.9091, test_loss: 0.9515, test_f1: 0.5102
##################ITERATION #4 ****************************************
 epoch: 0, train_loss: 1.3039, test_loss: 1.3166, test_f1: 0.2270
 epoch: 1, train_loss: 1.2784, test_loss: 1.3073, test_f1: 0.2270
 epoch: 2, train_loss: 1.2653, test_loss: 1.2900, test_f1: 0.2270
 epoch: 3, train_loss: 1.2575, test_loss: 1.2657, test_f1: 0.2270
 epoch: 4, train_loss: 1.2469, test_loss: 1.2436, test_f1: 0.2374
 epoch: 5, train_loss: 1.2409, test_loss: 1.2206, test_f1: 0.2721
 epoch: 6, train_loss: 1.2363, test_loss: 1.2053, test_f1: 0.2912
 epoch: 7, train_loss: 1.2261, test_loss: 1.1956, test_f1: 0.3044
 epoch: 8, train_loss: 1.2206, test_loss: 1.1874, test_f1: 0.3059
 epoch: 9, train_loss: 1.2155, test_loss: 1.1788, test_f1: 0.3115
 epoch: 10, train_loss: 1.2095, test_loss: 1.1707, test_f1: 0.3240
 epoch: 11, train_loss: 1.2055, test_loss: 1.1627, test_f1: 0.3368
 epoch: 12, train_loss: 1.1932, test_loss: 1.1573, test_f1: 0.3477
 epoch: 13, train_loss: 1.1911, test_loss: 1.1498, test_f1: 0.3714
 epoch: 14, train_loss: 1.1852, test_loss: 1.1412, test_f1: 0.3896
 epoch: 15, train_loss: 1.1710, test_loss: 1.1338, test_f1: 0.3923
 epoch: 16, train_loss: 1.1600, test_loss: 1.1298, test_f1: 0.4052
 epoch: 17, train_loss: 1.1594, test_loss: 1.1228, test_f1: 0.4121
 epoch: 18, train_loss: 1.1566, test_loss: 1.1149, test_f1: 0.4093
 epoch: 19, train_loss: 1.1427, test_loss: 1.1064, test_f1: 0.4147
 epoch: 20, train_loss: 1.1420, test_loss: 1.0990, test_f1: 0.4194
 epoch: 21, train_loss: 1.1357, test_loss: 1.0912, test_f1: 0.4266
 epoch: 22, train_loss: 1.1264, test_loss: 1.0863, test_f1: 0.4348
 epoch: 23, train_loss: 1.1205, test_loss: 1.0786, test_f1: 0.4444
 epoch: 24, train_loss: 1.1153, test_loss: 1.0718, test_f1: 0.4506
 epoch: 25, train_loss: 1.1116, test_loss: 1.0667, test_f1: 0.4551
 epoch: 26, train_loss: 1.0969, test_loss: 1.0597, test_f1: 0.4489
 epoch: 27, train_loss: 1.0915, test_loss: 1.0561, test_f1: 0.4511
 epoch: 28, train_loss: 1.0917, test_loss: 1.0487, test_f1: 0.4516
 epoch: 29, train_loss: 1.0818, test_loss: 1.0435, test_f1: 0.4540
 epoch: 30, train_loss: 1.0778, test_loss: 1.0367, test_f1: 0.4629
 epoch: 31, train_loss: 1.0613, test_loss: 1.0315, test_f1: 0.4593
 epoch: 32, train_loss: 1.0587, test_loss: 1.0213, test_f1: 0.4659
 epoch: 33, train_loss: 1.0541, test_loss: 1.0175, test_f1: 0.4662
 epoch: 34, train_loss: 1.0450, test_loss: 1.0158, test_f1: 0.4610
 epoch: 35, train_loss: 1.0389, test_loss: 1.0084, test_f1: 0.4639
 epoch: 36, train_loss: 1.0390, test_loss: 1.0028, test_f1: 0.4678
 epoch: 37, train_loss: 1.0304, test_loss: 0.9984, test_f1: 0.4625
 epoch: 38, train_loss: 1.0280, test_loss: 0.9935, test_f1: 0.4667
 epoch: 39, train_loss: 1.0220, test_loss: 0.9888, test_f1: 0.4695
 epoch: 40, train_loss: 1.0215, test_loss: 0.9885, test_f1: 0.4768
 epoch: 41, train_loss: 1.0192, test_loss: 0.9831, test_f1: 0.4763
 epoch: 42, train_loss: 1.0114, test_loss: 0.9769, test_f1: 0.4772
 epoch: 43, train_loss: 0.9982, test_loss: 0.9739, test_f1: 0.4778
 epoch: 44, train_loss: 1.0019, test_loss: 0.9682, test_f1: 0.4833
 epoch: 45, train_loss: 0.9994, test_loss: 0.9673, test_f1: 0.4758
 epoch: 46, train_loss: 0.9933, test_loss: 0.9672, test_f1: 0.4817
 epoch: 47, train_loss: 0.9813, test_loss: 0.9626, test_f1: 0.4866
 epoch: 48, train_loss: 0.9872, test_loss: 0.9590, test_f1: 0.4833
 epoch: 49, train_loss: 0.9773, test_loss: 0.9595, test_f1: 0.4875
 epoch: 50, train_loss: 0.9760, test_loss: 0.9612, test_f1: 0.4866
 epoch: 51, train_loss: 0.9720, test_loss: 0.9521, test_f1: 0.4901
 epoch: 52, train_loss: 0.9781, test_loss: 0.9534, test_f1: 0.4929
 epoch: 53, train_loss: 0.9673, test_loss: 0.9529, test_f1: 0.4914
 epoch: 54, train_loss: 0.9548, test_loss: 0.9512, test_f1: 0.4897
 epoch: 55, train_loss: 0.9716, test_loss: 0.9479, test_f1: 0.4919
 epoch: 56, train_loss: 0.9697, test_loss: 0.9459, test_f1: 0.4946
 epoch: 57, train_loss: 0.9622, test_loss: 0.9446, test_f1: 0.4940
 epoch: 58, train_loss: 0.9610, test_loss: 0.9487, test_f1: 0.4977
 epoch: 59, train_loss: 0.9564, test_loss: 0.9468, test_f1: 0.4951
 epoch: 60, train_loss: 0.9540, test_loss: 0.9459, test_f1: 0.4933
 epoch: 61, train_loss: 0.9560, test_loss: 0.9501, test_f1: 0.4916
 epoch: 62, train_loss: 0.9553, test_loss: 0.9490, test_f1: 0.4969
 epoch: 63, train_loss: 0.9610, test_loss: 0.9489, test_f1: 0.4940
 epoch: 64, train_loss: 0.9495, test_loss: 0.9444, test_f1: 0.4955
 epoch: 65, train_loss: 0.9486, test_loss: 0.9483, test_f1: 0.4978
 epoch: 66, train_loss: 0.9474, test_loss: 0.9415, test_f1: 0.5018
 epoch: 67, train_loss: 0.9442, test_loss: 0.9403, test_f1: 0.4997
 epoch: 68, train_loss: 0.9521, test_loss: 0.9437, test_f1: 0.4979
 epoch: 69, train_loss: 0.9490, test_loss: 0.9443, test_f1: 0.4997
 epoch: 70, train_loss: 0.9337, test_loss: 0.9418, test_f1: 0.4995
 epoch: 71, train_loss: 0.9426, test_loss: 0.9431, test_f1: 0.5005
 epoch: 72, train_loss: 0.9388, test_loss: 0.9424, test_f1: 0.5008
 epoch: 73, train_loss: 0.9379, test_loss: 0.9382, test_f1: 0.5073
 epoch: 74, train_loss: 0.9430, test_loss: 0.9426, test_f1: 0.4972
 epoch: 75, train_loss: 0.9310, test_loss: 0.9406, test_f1: 0.5038
 epoch: 76, train_loss: 0.9431, test_loss: 0.9364, test_f1: 0.5062
 epoch: 77, train_loss: 0.9281, test_loss: 0.9371, test_f1: 0.5043
 epoch: 78, train_loss: 0.9329, test_loss: 0.9406, test_f1: 0.4960
 epoch: 79, train_loss: 0.9258, test_loss: 0.9402, test_f1: 0.4955
 epoch: 80, train_loss: 0.9330, test_loss: 0.9413, test_f1: 0.4987
 epoch: 81, train_loss: 0.9333, test_loss: 0.9420, test_f1: 0.4963
 epoch: 82, train_loss: 0.9248, test_loss: 0.9394, test_f1: 0.5009
 epoch: 83, train_loss: 0.9252, test_loss: 0.9400, test_f1: 0.5036
 epoch: 84, train_loss: 0.9289, test_loss: 0.9379, test_f1: 0.5046
 epoch: 85, train_loss: 0.9217, test_loss: 0.9428, test_f1: 0.4988
 epoch: 86, train_loss: 0.9218, test_loss: 0.9469, test_f1: 0.4979
 epoch: 87, train_loss: 0.9173, test_loss: 0.9421, test_f1: 0.5039
 epoch: 88, train_loss: 0.9123, test_loss: 0.9387, test_f1: 0.5011
 epoch: 89, train_loss: 0.9210, test_loss: 0.9403, test_f1: 0.5000
 epoch: 90, train_loss: 0.9210, test_loss: 0.9485, test_f1: 0.4866
 epoch: 91, train_loss: 0.9125, test_loss: 0.9466, test_f1: 0.5047
 epoch: 92, train_loss: 0.9177, test_loss: 0.9412, test_f1: 0.5168
 epoch: 93, train_loss: 0.9158, test_loss: 0.9396, test_f1: 0.5159
 epoch: 94, train_loss: 0.9104, test_loss: 0.9398, test_f1: 0.5180
 epoch: 95, train_loss: 0.9044, test_loss: 0.9400, test_f1: 0.5156
 epoch: 96, train_loss: 0.9188, test_loss: 0.9374, test_f1: 0.5211
 epoch: 97, train_loss: 0.9148, test_loss: 0.9436, test_f1: 0.5165
 epoch: 98, train_loss: 0.9054, test_loss: 0.9459, test_f1: 0.5167
 epoch: 99, train_loss: 0.9067, test_loss: 0.9467, test_f1: 0.5136
##################ITERATION #5 ****************************************
 epoch: 0, train_loss: 1.3072, test_loss: 1.3308, test_f1: 0.2270
 epoch: 1, train_loss: 1.2759, test_loss: 1.3313, test_f1: 0.2270
 epoch: 2, train_loss: 1.2660, test_loss: 1.3277, test_f1: 0.2270
 epoch: 3, train_loss: 1.2503, test_loss: 1.3276, test_f1: 0.2270
 epoch: 4, train_loss: 1.2355, test_loss: 1.3075, test_f1: 0.2526
 epoch: 5, train_loss: 1.2270, test_loss: 1.2417, test_f1: 0.2582
 epoch: 6, train_loss: 1.2193, test_loss: 1.1954, test_f1: 0.3005
 epoch: 7, train_loss: 1.2145, test_loss: 1.1778, test_f1: 0.3071
 epoch: 8, train_loss: 1.2021, test_loss: 1.1679, test_f1: 0.3128
 epoch: 9, train_loss: 1.1930, test_loss: 1.1591, test_f1: 0.3323
 epoch: 10, train_loss: 1.1862, test_loss: 1.1516, test_f1: 0.3516
 epoch: 11, train_loss: 1.1853, test_loss: 1.1426, test_f1: 0.3605
 epoch: 12, train_loss: 1.1705, test_loss: 1.1338, test_f1: 0.3771
 epoch: 13, train_loss: 1.1726, test_loss: 1.1283, test_f1: 0.3958
 epoch: 14, train_loss: 1.1570, test_loss: 1.1210, test_f1: 0.4121
 epoch: 15, train_loss: 1.1546, test_loss: 1.1094, test_f1: 0.4164
 epoch: 16, train_loss: 1.1470, test_loss: 1.1060, test_f1: 0.4253
 epoch: 17, train_loss: 1.1427, test_loss: 1.0987, test_f1: 0.4273
 epoch: 18, train_loss: 1.1370, test_loss: 1.0935, test_f1: 0.4387
 epoch: 19, train_loss: 1.1304, test_loss: 1.0859, test_f1: 0.4526
 epoch: 20, train_loss: 1.1260, test_loss: 1.0813, test_f1: 0.4499
 epoch: 21, train_loss: 1.1162, test_loss: 1.0723, test_f1: 0.4685
 epoch: 22, train_loss: 1.1099, test_loss: 1.0659, test_f1: 0.4694
 epoch: 23, train_loss: 1.1094, test_loss: 1.0621, test_f1: 0.4520
 epoch: 24, train_loss: 1.1025, test_loss: 1.0578, test_f1: 0.4551
 epoch: 25, train_loss: 1.1021, test_loss: 1.0547, test_f1: 0.4553
 epoch: 26, train_loss: 1.0987, test_loss: 1.0469, test_f1: 0.4592
 epoch: 27, train_loss: 1.0828, test_loss: 1.0445, test_f1: 0.4542
 epoch: 28, train_loss: 1.0816, test_loss: 1.0346, test_f1: 0.4665
 epoch: 29, train_loss: 1.0800, test_loss: 1.0306, test_f1: 0.4702
 epoch: 30, train_loss: 1.0744, test_loss: 1.0283, test_f1: 0.4673
 epoch: 31, train_loss: 1.0682, test_loss: 1.0209, test_f1: 0.4738
 epoch: 32, train_loss: 1.0665, test_loss: 1.0196, test_f1: 0.4568
 epoch: 33, train_loss: 1.0565, test_loss: 1.0163, test_f1: 0.4618
 epoch: 34, train_loss: 1.0519, test_loss: 1.0067, test_f1: 0.4783
 epoch: 35, train_loss: 1.0467, test_loss: 1.0073, test_f1: 0.4727
 epoch: 36, train_loss: 1.0410, test_loss: 1.0035, test_f1: 0.4675
 epoch: 37, train_loss: 1.0393, test_loss: 0.9962, test_f1: 0.4696
 epoch: 38, train_loss: 1.0363, test_loss: 0.9930, test_f1: 0.4767
 epoch: 39, train_loss: 1.0379, test_loss: 0.9921, test_f1: 0.4747
 epoch: 40, train_loss: 1.0319, test_loss: 0.9898, test_f1: 0.4659
 epoch: 41, train_loss: 1.0236, test_loss: 0.9864, test_f1: 0.4770
 epoch: 42, train_loss: 1.0256, test_loss: 0.9858, test_f1: 0.4710
 epoch: 43, train_loss: 1.0273, test_loss: 0.9822, test_f1: 0.4846
 epoch: 44, train_loss: 1.0116, test_loss: 0.9799, test_f1: 0.4743
 epoch: 45, train_loss: 1.0054, test_loss: 0.9780, test_f1: 0.4840
 epoch: 46, train_loss: 1.0042, test_loss: 0.9729, test_f1: 0.4818
 epoch: 47, train_loss: 0.9987, test_loss: 0.9724, test_f1: 0.4892
 epoch: 48, train_loss: 1.0054, test_loss: 0.9659, test_f1: 0.4796
 epoch: 49, train_loss: 1.0034, test_loss: 0.9668, test_f1: 0.4834
 epoch: 50, train_loss: 0.9921, test_loss: 0.9715, test_f1: 0.4808
 epoch: 51, train_loss: 0.9903, test_loss: 0.9686, test_f1: 0.4921
 epoch: 52, train_loss: 0.9904, test_loss: 0.9653, test_f1: 0.4917
 epoch: 53, train_loss: 0.9857, test_loss: 0.9617, test_f1: 0.4988
 epoch: 54, train_loss: 0.9849, test_loss: 0.9677, test_f1: 0.4901
 epoch: 55, train_loss: 0.9943, test_loss: 0.9669, test_f1: 0.4894
 epoch: 56, train_loss: 0.9677, test_loss: 0.9634, test_f1: 0.4972
 epoch: 57, train_loss: 0.9861, test_loss: 0.9620, test_f1: 0.5013
 epoch: 58, train_loss: 0.9817, test_loss: 0.9629, test_f1: 0.4994
 epoch: 59, train_loss: 0.9663, test_loss: 0.9617, test_f1: 0.5016
 epoch: 60, train_loss: 0.9803, test_loss: 0.9584, test_f1: 0.5015
 epoch: 61, train_loss: 0.9746, test_loss: 0.9586, test_f1: 0.4975
 epoch: 62, train_loss: 0.9707, test_loss: 0.9583, test_f1: 0.5027
 epoch: 63, train_loss: 0.9653, test_loss: 0.9593, test_f1: 0.5020
 epoch: 64, train_loss: 0.9634, test_loss: 0.9599, test_f1: 0.5026
 epoch: 65, train_loss: 0.9683, test_loss: 0.9566, test_f1: 0.5040
 epoch: 66, train_loss: 0.9676, test_loss: 0.9603, test_f1: 0.4948
 epoch: 67, train_loss: 0.9701, test_loss: 0.9552, test_f1: 0.5003
 epoch: 68, train_loss: 0.9593, test_loss: 0.9538, test_f1: 0.4976
 epoch: 69, train_loss: 0.9668, test_loss: 0.9603, test_f1: 0.4844
 epoch: 70, train_loss: 0.9608, test_loss: 0.9524, test_f1: 0.4998
 epoch: 71, train_loss: 0.9723, test_loss: 0.9533, test_f1: 0.4970
 epoch: 72, train_loss: 0.9568, test_loss: 0.9553, test_f1: 0.4923
 epoch: 73, train_loss: 0.9555, test_loss: 0.9519, test_f1: 0.5009
 epoch: 74, train_loss: 0.9572, test_loss: 0.9508, test_f1: 0.4997
 epoch: 75, train_loss: 0.9508, test_loss: 0.9521, test_f1: 0.4975
 epoch: 76, train_loss: 0.9470, test_loss: 0.9500, test_f1: 0.4969
 epoch: 77, train_loss: 0.9430, test_loss: 0.9496, test_f1: 0.5030
 epoch: 78, train_loss: 0.9527, test_loss: 0.9589, test_f1: 0.4924
 epoch: 79, train_loss: 0.9471, test_loss: 0.9550, test_f1: 0.4991
 epoch: 80, train_loss: 0.9502, test_loss: 0.9583, test_f1: 0.4974
 epoch: 81, train_loss: 0.9509, test_loss: 0.9566, test_f1: 0.4960
 epoch: 82, train_loss: 0.9485, test_loss: 0.9555, test_f1: 0.4981
 epoch: 83, train_loss: 0.9455, test_loss: 0.9547, test_f1: 0.4918
 epoch: 84, train_loss: 0.9407, test_loss: 0.9521, test_f1: 0.4966
 epoch: 85, train_loss: 0.9425, test_loss: 0.9514, test_f1: 0.4933
 epoch: 86, train_loss: 0.9415, test_loss: 0.9468, test_f1: 0.4956
 epoch: 87, train_loss: 0.9406, test_loss: 0.9570, test_f1: 0.5014
 epoch: 88, train_loss: 0.9389, test_loss: 0.9535, test_f1: 0.4914
 epoch: 89, train_loss: 0.9358, test_loss: 0.9486, test_f1: 0.4990
 epoch: 90, train_loss: 0.9415, test_loss: 0.9517, test_f1: 0.4959
 epoch: 91, train_loss: 0.9373, test_loss: 0.9575, test_f1: 0.4881
 epoch: 92, train_loss: 0.9346, test_loss: 0.9546, test_f1: 0.4956
 epoch: 93, train_loss: 0.9309, test_loss: 0.9584, test_f1: 0.4884
 epoch: 94, train_loss: 0.9403, test_loss: 0.9457, test_f1: 0.4988
 epoch: 95, train_loss: 0.9298, test_loss: 0.9540, test_f1: 0.4958
 epoch: 96, train_loss: 0.9393, test_loss: 0.9531, test_f1: 0.4955
 epoch: 97, train_loss: 0.9311, test_loss: 0.9536, test_f1: 0.4946
 epoch: 98, train_loss: 0.9318, test_loss: 0.9483, test_f1: 0.4988
 epoch: 99, train_loss: 0.9265, test_loss: 0.9544, test_f1: 0.4956
##################ITERATION #6 ****************************************
 epoch: 0, train_loss: 1.3255, test_loss: 1.3127, test_f1: 0.2270
 epoch: 1, train_loss: 1.2820, test_loss: 1.3126, test_f1: 0.2270
 epoch: 2, train_loss: 1.2677, test_loss: 1.2957, test_f1: 0.2270
 epoch: 3, train_loss: 1.2447, test_loss: 1.2660, test_f1: 0.2270
 epoch: 4, train_loss: 1.2348, test_loss: 1.2228, test_f1: 0.2690
 epoch: 5, train_loss: 1.2291, test_loss: 1.1939, test_f1: 0.2783
 epoch: 6, train_loss: 1.2161, test_loss: 1.1769, test_f1: 0.2954
 epoch: 7, train_loss: 1.2064, test_loss: 1.1673, test_f1: 0.3004
 epoch: 8, train_loss: 1.1958, test_loss: 1.1572, test_f1: 0.3175
 epoch: 9, train_loss: 1.1902, test_loss: 1.1485, test_f1: 0.3311
 epoch: 10, train_loss: 1.1840, test_loss: 1.1408, test_f1: 0.3453
 epoch: 11, train_loss: 1.1773, test_loss: 1.1333, test_f1: 0.3566
 epoch: 12, train_loss: 1.1688, test_loss: 1.1249, test_f1: 0.3607
 epoch: 13, train_loss: 1.1618, test_loss: 1.1171, test_f1: 0.3746
 epoch: 14, train_loss: 1.1504, test_loss: 1.1085, test_f1: 0.3875
 epoch: 15, train_loss: 1.1454, test_loss: 1.0991, test_f1: 0.3964
 epoch: 16, train_loss: 1.1441, test_loss: 1.0932, test_f1: 0.4119
 epoch: 17, train_loss: 1.1374, test_loss: 1.0863, test_f1: 0.4249
 epoch: 18, train_loss: 1.1263, test_loss: 1.0795, test_f1: 0.4272
 epoch: 19, train_loss: 1.1218, test_loss: 1.0744, test_f1: 0.4295
 epoch: 20, train_loss: 1.1260, test_loss: 1.0633, test_f1: 0.4299
 epoch: 21, train_loss: 1.1068, test_loss: 1.0577, test_f1: 0.4454
 epoch: 22, train_loss: 1.1080, test_loss: 1.0519, test_f1: 0.4462
 epoch: 23, train_loss: 1.1056, test_loss: 1.0455, test_f1: 0.4463
 epoch: 24, train_loss: 1.0913, test_loss: 1.0401, test_f1: 0.4521
 epoch: 25, train_loss: 1.0903, test_loss: 1.0354, test_f1: 0.4574
 epoch: 26, train_loss: 1.0795, test_loss: 1.0309, test_f1: 0.4595
 epoch: 27, train_loss: 1.0864, test_loss: 1.0273, test_f1: 0.4580
 epoch: 28, train_loss: 1.0819, test_loss: 1.0231, test_f1: 0.4603
 epoch: 29, train_loss: 1.0680, test_loss: 1.0179, test_f1: 0.4597
 epoch: 30, train_loss: 1.0617, test_loss: 1.0095, test_f1: 0.4765
 epoch: 31, train_loss: 1.0605, test_loss: 1.0077, test_f1: 0.4586
 epoch: 32, train_loss: 1.0520, test_loss: 1.0074, test_f1: 0.4547
 epoch: 33, train_loss: 1.0539, test_loss: 1.0039, test_f1: 0.4603
 epoch: 34, train_loss: 1.0488, test_loss: 1.0000, test_f1: 0.4579
 epoch: 35, train_loss: 1.0547, test_loss: 0.9980, test_f1: 0.4609
 epoch: 36, train_loss: 1.0407, test_loss: 0.9918, test_f1: 0.4628
 epoch: 37, train_loss: 1.0353, test_loss: 0.9867, test_f1: 0.4643
 epoch: 38, train_loss: 1.0373, test_loss: 0.9856, test_f1: 0.4626
 epoch: 39, train_loss: 1.0282, test_loss: 0.9845, test_f1: 0.4671
 epoch: 40, train_loss: 1.0259, test_loss: 0.9786, test_f1: 0.4657
 epoch: 41, train_loss: 1.0201, test_loss: 0.9761, test_f1: 0.4674
 epoch: 42, train_loss: 1.0145, test_loss: 0.9746, test_f1: 0.4569
 epoch: 43, train_loss: 1.0166, test_loss: 0.9706, test_f1: 0.4634
 epoch: 44, train_loss: 1.0067, test_loss: 0.9677, test_f1: 0.4638
 epoch: 45, train_loss: 1.0065, test_loss: 0.9647, test_f1: 0.4660
 epoch: 46, train_loss: 0.9951, test_loss: 0.9616, test_f1: 0.4700
 epoch: 47, train_loss: 0.9951, test_loss: 0.9595, test_f1: 0.4726
 epoch: 48, train_loss: 0.9915, test_loss: 0.9520, test_f1: 0.4940
 epoch: 49, train_loss: 0.9990, test_loss: 0.9521, test_f1: 0.5029
 epoch: 50, train_loss: 0.9888, test_loss: 0.9475, test_f1: 0.5039
 epoch: 51, train_loss: 0.9928, test_loss: 0.9465, test_f1: 0.5023
 epoch: 52, train_loss: 0.9794, test_loss: 0.9452, test_f1: 0.5110
 epoch: 53, train_loss: 0.9804, test_loss: 0.9473, test_f1: 0.5068
 epoch: 54, train_loss: 0.9829, test_loss: 0.9441, test_f1: 0.5034
 epoch: 55, train_loss: 0.9838, test_loss: 0.9444, test_f1: 0.5021
 epoch: 56, train_loss: 0.9763, test_loss: 0.9419, test_f1: 0.5119
 epoch: 57, train_loss: 0.9800, test_loss: 0.9430, test_f1: 0.5043
 epoch: 58, train_loss: 0.9787, test_loss: 0.9393, test_f1: 0.5031
 epoch: 59, train_loss: 0.9781, test_loss: 0.9397, test_f1: 0.5090
 epoch: 60, train_loss: 0.9811, test_loss: 0.9384, test_f1: 0.5151
 epoch: 61, train_loss: 0.9833, test_loss: 0.9398, test_f1: 0.5065
 epoch: 62, train_loss: 0.9743, test_loss: 0.9374, test_f1: 0.5046
 epoch: 63, train_loss: 0.9665, test_loss: 0.9358, test_f1: 0.5120
 epoch: 64, train_loss: 0.9665, test_loss: 0.9342, test_f1: 0.5143
 epoch: 65, train_loss: 0.9651, test_loss: 0.9322, test_f1: 0.5164
 epoch: 66, train_loss: 0.9648, test_loss: 0.9316, test_f1: 0.5191
 epoch: 67, train_loss: 0.9619, test_loss: 0.9299, test_f1: 0.5177
 epoch: 68, train_loss: 0.9612, test_loss: 0.9300, test_f1: 0.5147
 epoch: 69, train_loss: 0.9584, test_loss: 0.9319, test_f1: 0.5060
 epoch: 70, train_loss: 0.9693, test_loss: 0.9314, test_f1: 0.5104
 epoch: 71, train_loss: 0.9662, test_loss: 0.9308, test_f1: 0.5058
 epoch: 72, train_loss: 0.9596, test_loss: 0.9254, test_f1: 0.5165
 epoch: 73, train_loss: 0.9616, test_loss: 0.9240, test_f1: 0.5189
 epoch: 74, train_loss: 0.9609, test_loss: 0.9239, test_f1: 0.5136
 epoch: 75, train_loss: 0.9537, test_loss: 0.9238, test_f1: 0.5170
 epoch: 76, train_loss: 0.9633, test_loss: 0.9217, test_f1: 0.5245
 epoch: 77, train_loss: 0.9497, test_loss: 0.9207, test_f1: 0.5208
 epoch: 78, train_loss: 0.9535, test_loss: 0.9204, test_f1: 0.5217
 epoch: 79, train_loss: 0.9513, test_loss: 0.9181, test_f1: 0.5248
 epoch: 80, train_loss: 0.9434, test_loss: 0.9175, test_f1: 0.5175
 epoch: 81, train_loss: 0.9460, test_loss: 0.9137, test_f1: 0.5262
 epoch: 82, train_loss: 0.9449, test_loss: 0.9127, test_f1: 0.5228
 epoch: 83, train_loss: 0.9469, test_loss: 0.9123, test_f1: 0.5212
 epoch: 84, train_loss: 0.9508, test_loss: 0.9095, test_f1: 0.5259
 epoch: 85, train_loss: 0.9456, test_loss: 0.9122, test_f1: 0.5227
 epoch: 86, train_loss: 0.9451, test_loss: 0.9115, test_f1: 0.5233
 epoch: 87, train_loss: 0.9464, test_loss: 0.9118, test_f1: 0.5259
 epoch: 88, train_loss: 0.9395, test_loss: 0.9095, test_f1: 0.5264
 epoch: 89, train_loss: 0.9356, test_loss: 0.9103, test_f1: 0.5268
 epoch: 90, train_loss: 0.9477, test_loss: 0.9111, test_f1: 0.5216
 epoch: 91, train_loss: 0.9366, test_loss: 0.9085, test_f1: 0.5256
 epoch: 92, train_loss: 0.9392, test_loss: 0.9070, test_f1: 0.5219
 epoch: 93, train_loss: 0.9351, test_loss: 0.9066, test_f1: 0.5233
 epoch: 94, train_loss: 0.9419, test_loss: 0.9101, test_f1: 0.5224
 epoch: 95, train_loss: 0.9330, test_loss: 0.9102, test_f1: 0.5186
 epoch: 96, train_loss: 0.9283, test_loss: 0.9115, test_f1: 0.5136
 epoch: 97, train_loss: 0.9333, test_loss: 0.9082, test_f1: 0.5138
 epoch: 98, train_loss: 0.9304, test_loss: 0.9057, test_f1: 0.5205
 epoch: 99, train_loss: 0.9244, test_loss: 0.9065, test_f1: 0.5148
##################ITERATION #7 ****************************************
 epoch: 0, train_loss: 1.3623, test_loss: 1.3357, test_f1: 0.2270
 epoch: 1, train_loss: 1.3120, test_loss: 1.3195, test_f1: 0.2270
 epoch: 2, train_loss: 1.2804, test_loss: 1.3112, test_f1: 0.2270
 epoch: 3, train_loss: 1.2730, test_loss: 1.2839, test_f1: 0.2270
 epoch: 4, train_loss: 1.2519, test_loss: 1.2431, test_f1: 0.2270
 epoch: 5, train_loss: 1.2363, test_loss: 1.2192, test_f1: 0.2439
 epoch: 6, train_loss: 1.2286, test_loss: 1.2071, test_f1: 0.2621
 epoch: 7, train_loss: 1.2215, test_loss: 1.1955, test_f1: 0.2788
 epoch: 8, train_loss: 1.2112, test_loss: 1.1847, test_f1: 0.3214
 epoch: 9, train_loss: 1.1966, test_loss: 1.1757, test_f1: 0.3363
 epoch: 10, train_loss: 1.1913, test_loss: 1.1665, test_f1: 0.3531
 epoch: 11, train_loss: 1.1842, test_loss: 1.1555, test_f1: 0.3691
 epoch: 12, train_loss: 1.1801, test_loss: 1.1465, test_f1: 0.3853
 epoch: 13, train_loss: 1.1781, test_loss: 1.1377, test_f1: 0.4070
 epoch: 14, train_loss: 1.1602, test_loss: 1.1306, test_f1: 0.4165
 epoch: 15, train_loss: 1.1550, test_loss: 1.1226, test_f1: 0.4168
 epoch: 16, train_loss: 1.1468, test_loss: 1.1138, test_f1: 0.4277
 epoch: 17, train_loss: 1.1326, test_loss: 1.1041, test_f1: 0.4358
 epoch: 18, train_loss: 1.1256, test_loss: 1.0939, test_f1: 0.4380
 epoch: 19, train_loss: 1.1171, test_loss: 1.0854, test_f1: 0.4410
 epoch: 20, train_loss: 1.1141, test_loss: 1.0775, test_f1: 0.4436
 epoch: 21, train_loss: 1.1042, test_loss: 1.0707, test_f1: 0.4429
 epoch: 22, train_loss: 1.0958, test_loss: 1.0633, test_f1: 0.4502
 epoch: 23, train_loss: 1.0839, test_loss: 1.0547, test_f1: 0.4583
 epoch: 24, train_loss: 1.0860, test_loss: 1.0460, test_f1: 0.4607
 epoch: 25, train_loss: 1.0826, test_loss: 1.0393, test_f1: 0.4618
 epoch: 26, train_loss: 1.0723, test_loss: 1.0305, test_f1: 0.4662
 epoch: 27, train_loss: 1.0689, test_loss: 1.0247, test_f1: 0.4691
 epoch: 28, train_loss: 1.0584, test_loss: 1.0180, test_f1: 0.4685
 epoch: 29, train_loss: 1.0568, test_loss: 1.0122, test_f1: 0.4694
 epoch: 30, train_loss: 1.0474, test_loss: 1.0071, test_f1: 0.4694
 epoch: 31, train_loss: 1.0495, test_loss: 1.0033, test_f1: 0.4723
 epoch: 32, train_loss: 1.0380, test_loss: 0.9989, test_f1: 0.4747
 epoch: 33, train_loss: 1.0307, test_loss: 0.9932, test_f1: 0.4738
 epoch: 34, train_loss: 1.0250, test_loss: 0.9912, test_f1: 0.4747
 epoch: 35, train_loss: 1.0258, test_loss: 0.9873, test_f1: 0.4769
 epoch: 36, train_loss: 1.0129, test_loss: 0.9870, test_f1: 0.4816
 epoch: 37, train_loss: 1.0144, test_loss: 0.9866, test_f1: 0.4796
 epoch: 38, train_loss: 1.0083, test_loss: 0.9808, test_f1: 0.4807
 epoch: 39, train_loss: 1.0010, test_loss: 0.9757, test_f1: 0.4808
 epoch: 40, train_loss: 1.0054, test_loss: 0.9750, test_f1: 0.4807
 epoch: 41, train_loss: 0.9907, test_loss: 0.9764, test_f1: 0.4814
 epoch: 42, train_loss: 1.0004, test_loss: 0.9733, test_f1: 0.4788
 epoch: 43, train_loss: 0.9874, test_loss: 0.9748, test_f1: 0.4818
 epoch: 44, train_loss: 0.9842, test_loss: 0.9756, test_f1: 0.4790
 epoch: 45, train_loss: 0.9802, test_loss: 0.9712, test_f1: 0.4846
 epoch: 46, train_loss: 0.9805, test_loss: 0.9656, test_f1: 0.4860
 epoch: 47, train_loss: 0.9764, test_loss: 0.9654, test_f1: 0.4929
 epoch: 48, train_loss: 0.9723, test_loss: 0.9622, test_f1: 0.4947
 epoch: 49, train_loss: 0.9716, test_loss: 0.9569, test_f1: 0.5004
 epoch: 50, train_loss: 0.9643, test_loss: 0.9577, test_f1: 0.5110
 epoch: 51, train_loss: 0.9591, test_loss: 0.9569, test_f1: 0.5058
 epoch: 52, train_loss: 0.9700, test_loss: 0.9608, test_f1: 0.5078
 epoch: 53, train_loss: 0.9697, test_loss: 0.9636, test_f1: 0.4948
 epoch: 54, train_loss: 0.9614, test_loss: 0.9650, test_f1: 0.5009
 epoch: 55, train_loss: 0.9582, test_loss: 0.9641, test_f1: 0.5038
 epoch: 56, train_loss: 0.9543, test_loss: 0.9587, test_f1: 0.5041
 epoch: 57, train_loss: 0.9576, test_loss: 0.9563, test_f1: 0.5037
 epoch: 58, train_loss: 0.9477, test_loss: 0.9557, test_f1: 0.5034
 epoch: 59, train_loss: 0.9552, test_loss: 0.9594, test_f1: 0.5021
 epoch: 60, train_loss: 0.9574, test_loss: 0.9620, test_f1: 0.5013
 epoch: 61, train_loss: 0.9522, test_loss: 0.9599, test_f1: 0.5039
 epoch: 62, train_loss: 0.9535, test_loss: 0.9597, test_f1: 0.5092
 epoch: 63, train_loss: 0.9611, test_loss: 0.9586, test_f1: 0.5032
 epoch: 64, train_loss: 0.9571, test_loss: 0.9661, test_f1: 0.5025
 epoch: 65, train_loss: 0.9540, test_loss: 0.9666, test_f1: 0.5054
 epoch: 66, train_loss: 0.9498, test_loss: 0.9605, test_f1: 0.5122
 epoch: 67, train_loss: 0.9505, test_loss: 0.9563, test_f1: 0.5074
 epoch: 68, train_loss: 0.9458, test_loss: 0.9554, test_f1: 0.5028
 epoch: 69, train_loss: 0.9471, test_loss: 0.9570, test_f1: 0.5012
 epoch: 70, train_loss: 0.9410, test_loss: 0.9659, test_f1: 0.5013
 epoch: 71, train_loss: 0.9472, test_loss: 0.9604, test_f1: 0.5023
 epoch: 72, train_loss: 0.9401, test_loss: 0.9614, test_f1: 0.5001
 epoch: 73, train_loss: 0.9425, test_loss: 0.9655, test_f1: 0.4956
 epoch: 74, train_loss: 0.9425, test_loss: 0.9614, test_f1: 0.5092
 epoch: 75, train_loss: 0.9423, test_loss: 0.9565, test_f1: 0.5060
 epoch: 76, train_loss: 0.9335, test_loss: 0.9618, test_f1: 0.5020
 epoch: 77, train_loss: 0.9365, test_loss: 0.9642, test_f1: 0.5004
 epoch: 78, train_loss: 0.9324, test_loss: 0.9580, test_f1: 0.4976
 epoch: 79, train_loss: 0.9353, test_loss: 0.9571, test_f1: 0.5006
 epoch: 80, train_loss: 0.9306, test_loss: 0.9620, test_f1: 0.4989
 epoch: 81, train_loss: 0.9386, test_loss: 0.9629, test_f1: 0.5001
 epoch: 82, train_loss: 0.9353, test_loss: 0.9612, test_f1: 0.4972
 epoch: 83, train_loss: 0.9318, test_loss: 0.9604, test_f1: 0.4953
 epoch: 84, train_loss: 0.9320, test_loss: 0.9603, test_f1: 0.4956
 epoch: 85, train_loss: 0.9322, test_loss: 0.9573, test_f1: 0.4977
 epoch: 86, train_loss: 0.9319, test_loss: 0.9590, test_f1: 0.4977
 epoch: 87, train_loss: 0.9222, test_loss: 0.9638, test_f1: 0.4991
 epoch: 88, train_loss: 0.9193, test_loss: 0.9648, test_f1: 0.5032
 epoch: 89, train_loss: 0.9375, test_loss: 0.9601, test_f1: 0.4973
 epoch: 90, train_loss: 0.9308, test_loss: 0.9617, test_f1: 0.5006
 epoch: 91, train_loss: 0.9197, test_loss: 0.9629, test_f1: 0.5044
 epoch: 92, train_loss: 0.9300, test_loss: 0.9608, test_f1: 0.5016
 epoch: 93, train_loss: 0.9307, test_loss: 0.9688, test_f1: 0.5004
 epoch: 94, train_loss: 0.9244, test_loss: 0.9655, test_f1: 0.5036
 epoch: 95, train_loss: 0.9222, test_loss: 0.9679, test_f1: 0.4962
 epoch: 96, train_loss: 0.9180, test_loss: 0.9680, test_f1: 0.5023
 epoch: 97, train_loss: 0.9164, test_loss: 0.9669, test_f1: 0.5006
 epoch: 98, train_loss: 0.9128, test_loss: 0.9633, test_f1: 0.4969
 epoch: 99, train_loss: 0.9176, test_loss: 0.9589, test_f1: 0.4979
##################ITERATION #8 ****************************************
 epoch: 0, train_loss: 1.3432, test_loss: 1.3129, test_f1: 0.2270
 epoch: 1, train_loss: 1.2747, test_loss: 1.2967, test_f1: 0.2270
 epoch: 2, train_loss: 1.2503, test_loss: 1.2832, test_f1: 0.2270
 epoch: 3, train_loss: 1.2288, test_loss: 1.2535, test_f1: 0.2521
 epoch: 4, train_loss: 1.2203, test_loss: 1.2117, test_f1: 0.2587
 epoch: 5, train_loss: 1.2083, test_loss: 1.1717, test_f1: 0.3347
 epoch: 6, train_loss: 1.2026, test_loss: 1.1536, test_f1: 0.3512
 epoch: 7, train_loss: 1.1889, test_loss: 1.1391, test_f1: 0.3682
 epoch: 8, train_loss: 1.1772, test_loss: 1.1297, test_f1: 0.3797
 epoch: 9, train_loss: 1.1752, test_loss: 1.1216, test_f1: 0.3974
 epoch: 10, train_loss: 1.1617, test_loss: 1.1132, test_f1: 0.4117
 epoch: 11, train_loss: 1.1573, test_loss: 1.1055, test_f1: 0.4246
 epoch: 12, train_loss: 1.1491, test_loss: 1.0978, test_f1: 0.4351
 epoch: 13, train_loss: 1.1381, test_loss: 1.0933, test_f1: 0.4383
 epoch: 14, train_loss: 1.1320, test_loss: 1.0858, test_f1: 0.4386
 epoch: 15, train_loss: 1.1380, test_loss: 1.0796, test_f1: 0.4551
 epoch: 16, train_loss: 1.1262, test_loss: 1.0711, test_f1: 0.4531
 epoch: 17, train_loss: 1.1148, test_loss: 1.0654, test_f1: 0.4583
 epoch: 18, train_loss: 1.1078, test_loss: 1.0580, test_f1: 0.4578
 epoch: 19, train_loss: 1.0976, test_loss: 1.0515, test_f1: 0.4633
 epoch: 20, train_loss: 1.1001, test_loss: 1.0456, test_f1: 0.4593
 epoch: 21, train_loss: 1.0823, test_loss: 1.0396, test_f1: 0.4620
 epoch: 22, train_loss: 1.0874, test_loss: 1.0325, test_f1: 0.4745
 epoch: 23, train_loss: 1.0887, test_loss: 1.0277, test_f1: 0.4699
 epoch: 24, train_loss: 1.0746, test_loss: 1.0211, test_f1: 0.4778
 epoch: 25, train_loss: 1.0591, test_loss: 1.0143, test_f1: 0.4756
 epoch: 26, train_loss: 1.0647, test_loss: 1.0101, test_f1: 0.4747
 epoch: 27, train_loss: 1.0579, test_loss: 1.0059, test_f1: 0.4772
 epoch: 28, train_loss: 1.0520, test_loss: 1.0009, test_f1: 0.4806
 epoch: 29, train_loss: 1.0463, test_loss: 0.9954, test_f1: 0.4833
 epoch: 30, train_loss: 1.0409, test_loss: 0.9920, test_f1: 0.4843
 epoch: 31, train_loss: 1.0313, test_loss: 0.9880, test_f1: 0.4816
 epoch: 32, train_loss: 1.0352, test_loss: 0.9840, test_f1: 0.4832
 epoch: 33, train_loss: 1.0249, test_loss: 0.9790, test_f1: 0.4876
 epoch: 34, train_loss: 1.0216, test_loss: 0.9757, test_f1: 0.4902
 epoch: 35, train_loss: 1.0174, test_loss: 0.9700, test_f1: 0.4889
 epoch: 36, train_loss: 1.0092, test_loss: 0.9698, test_f1: 0.4876
 epoch: 37, train_loss: 1.0018, test_loss: 0.9690, test_f1: 0.4814
 epoch: 38, train_loss: 1.0025, test_loss: 0.9660, test_f1: 0.4840
 epoch: 39, train_loss: 1.0008, test_loss: 0.9616, test_f1: 0.4819
 epoch: 40, train_loss: 1.0007, test_loss: 0.9584, test_f1: 0.4896
 epoch: 41, train_loss: 0.9872, test_loss: 0.9567, test_f1: 0.4824
 epoch: 42, train_loss: 0.9888, test_loss: 0.9566, test_f1: 0.4821
 epoch: 43, train_loss: 0.9865, test_loss: 0.9568, test_f1: 0.4845
 epoch: 44, train_loss: 0.9878, test_loss: 0.9527, test_f1: 0.4873
 epoch: 45, train_loss: 0.9795, test_loss: 0.9532, test_f1: 0.4848
 epoch: 46, train_loss: 0.9884, test_loss: 0.9499, test_f1: 0.4886
 epoch: 47, train_loss: 0.9737, test_loss: 0.9527, test_f1: 0.4875
 epoch: 48, train_loss: 0.9683, test_loss: 0.9518, test_f1: 0.4877
 epoch: 49, train_loss: 0.9744, test_loss: 0.9549, test_f1: 0.4999
 epoch: 50, train_loss: 0.9624, test_loss: 0.9531, test_f1: 0.4977
 epoch: 51, train_loss: 0.9663, test_loss: 0.9536, test_f1: 0.4964
 epoch: 52, train_loss: 0.9616, test_loss: 0.9517, test_f1: 0.5017
 epoch: 53, train_loss: 0.9492, test_loss: 0.9501, test_f1: 0.4993
 epoch: 54, train_loss: 0.9603, test_loss: 0.9474, test_f1: 0.4962
 epoch: 55, train_loss: 0.9550, test_loss: 0.9459, test_f1: 0.5004
 epoch: 56, train_loss: 0.9561, test_loss: 0.9482, test_f1: 0.5016
 epoch: 57, train_loss: 0.9608, test_loss: 0.9494, test_f1: 0.5042
 epoch: 58, train_loss: 0.9523, test_loss: 0.9474, test_f1: 0.5022
 epoch: 59, train_loss: 0.9440, test_loss: 0.9476, test_f1: 0.5041
 epoch: 60, train_loss: 0.9489, test_loss: 0.9442, test_f1: 0.4992
 epoch: 61, train_loss: 0.9505, test_loss: 0.9428, test_f1: 0.5029
 epoch: 62, train_loss: 0.9418, test_loss: 0.9451, test_f1: 0.5017
 epoch: 63, train_loss: 0.9522, test_loss: 0.9456, test_f1: 0.5023
 epoch: 64, train_loss: 0.9437, test_loss: 0.9505, test_f1: 0.5065
 epoch: 65, train_loss: 0.9454, test_loss: 0.9502, test_f1: 0.5053
 epoch: 66, train_loss: 0.9425, test_loss: 0.9428, test_f1: 0.5051
 epoch: 67, train_loss: 0.9472, test_loss: 0.9409, test_f1: 0.5044
 epoch: 68, train_loss: 0.9413, test_loss: 0.9431, test_f1: 0.5059
 epoch: 69, train_loss: 0.9512, test_loss: 0.9425, test_f1: 0.5053
 epoch: 70, train_loss: 0.9373, test_loss: 0.9476, test_f1: 0.5074
 epoch: 71, train_loss: 0.9376, test_loss: 0.9471, test_f1: 0.5075
 epoch: 72, train_loss: 0.9416, test_loss: 0.9426, test_f1: 0.5085
 epoch: 73, train_loss: 0.9302, test_loss: 0.9480, test_f1: 0.5087
 epoch: 74, train_loss: 0.9298, test_loss: 0.9408, test_f1: 0.5081
 epoch: 75, train_loss: 0.9319, test_loss: 0.9423, test_f1: 0.5115
 epoch: 76, train_loss: 0.9261, test_loss: 0.9423, test_f1: 0.5078
 epoch: 77, train_loss: 0.9295, test_loss: 0.9478, test_f1: 0.5129
 epoch: 78, train_loss: 0.9311, test_loss: 0.9474, test_f1: 0.5114
 epoch: 79, train_loss: 0.9333, test_loss: 0.9520, test_f1: 0.5122
 epoch: 80, train_loss: 0.9305, test_loss: 0.9469, test_f1: 0.5131
 epoch: 81, train_loss: 0.9271, test_loss: 0.9430, test_f1: 0.5135
 epoch: 82, train_loss: 0.9320, test_loss: 0.9444, test_f1: 0.5122
 epoch: 83, train_loss: 0.9197, test_loss: 0.9438, test_f1: 0.5125
 epoch: 84, train_loss: 0.9234, test_loss: 0.9424, test_f1: 0.5138
 epoch: 85, train_loss: 0.9248, test_loss: 0.9442, test_f1: 0.5110
 epoch: 86, train_loss: 0.9182, test_loss: 0.9442, test_f1: 0.5082
 epoch: 87, train_loss: 0.9269, test_loss: 0.9391, test_f1: 0.5118
 epoch: 88, train_loss: 0.9193, test_loss: 0.9347, test_f1: 0.5115
 epoch: 89, train_loss: 0.9202, test_loss: 0.9398, test_f1: 0.5144
 epoch: 90, train_loss: 0.9161, test_loss: 0.9363, test_f1: 0.5090
 epoch: 91, train_loss: 0.9145, test_loss: 0.9357, test_f1: 0.5093
 epoch: 92, train_loss: 0.9178, test_loss: 0.9381, test_f1: 0.5101
 epoch: 93, train_loss: 0.9126, test_loss: 0.9395, test_f1: 0.5141
 epoch: 94, train_loss: 0.9232, test_loss: 0.9404, test_f1: 0.5122
 epoch: 95, train_loss: 0.9159, test_loss: 0.9425, test_f1: 0.5093
 epoch: 96, train_loss: 0.9149, test_loss: 0.9440, test_f1: 0.5077
 epoch: 97, train_loss: 0.9077, test_loss: 0.9417, test_f1: 0.5098
 epoch: 98, train_loss: 0.9098, test_loss: 0.9401, test_f1: 0.5130
 epoch: 99, train_loss: 0.9113, test_loss: 0.9423, test_f1: 0.5101
##################ITERATION #9 ****************************************
 epoch: 0, train_loss: 1.4074, test_loss: 1.3743, test_f1: 0.2270
 epoch: 1, train_loss: 1.3296, test_loss: 1.3603, test_f1: 0.2270
 epoch: 2, train_loss: 1.2860, test_loss: 1.3306, test_f1: 0.2270
 epoch: 3, train_loss: 1.2634, test_loss: 1.2702, test_f1: 0.2561
 epoch: 4, train_loss: 1.2494, test_loss: 1.2186, test_f1: 0.3238
 epoch: 5, train_loss: 1.2320, test_loss: 1.1916, test_f1: 0.3447
 epoch: 6, train_loss: 1.2185, test_loss: 1.1757, test_f1: 0.3483
 epoch: 7, train_loss: 1.2068, test_loss: 1.1654, test_f1: 0.3608
 epoch: 8, train_loss: 1.1928, test_loss: 1.1548, test_f1: 0.3622
 epoch: 9, train_loss: 1.1868, test_loss: 1.1453, test_f1: 0.3637
 epoch: 10, train_loss: 1.1759, test_loss: 1.1360, test_f1: 0.3622
 epoch: 11, train_loss: 1.1651, test_loss: 1.1266, test_f1: 0.3926
 epoch: 12, train_loss: 1.1554, test_loss: 1.1157, test_f1: 0.4066
 epoch: 13, train_loss: 1.1547, test_loss: 1.1046, test_f1: 0.4258
 epoch: 14, train_loss: 1.1449, test_loss: 1.0963, test_f1: 0.4250
 epoch: 15, train_loss: 1.1331, test_loss: 1.0868, test_f1: 0.4307
 epoch: 16, train_loss: 1.1249, test_loss: 1.0803, test_f1: 0.4383
 epoch: 17, train_loss: 1.1136, test_loss: 1.0715, test_f1: 0.4399
 epoch: 18, train_loss: 1.1107, test_loss: 1.0648, test_f1: 0.4412
 epoch: 19, train_loss: 1.1047, test_loss: 1.0566, test_f1: 0.4447
 epoch: 20, train_loss: 1.0950, test_loss: 1.0502, test_f1: 0.4497
 epoch: 21, train_loss: 1.0923, test_loss: 1.0429, test_f1: 0.4463
 epoch: 22, train_loss: 1.0780, test_loss: 1.0372, test_f1: 0.4569
 epoch: 23, train_loss: 1.0742, test_loss: 1.0333, test_f1: 0.4516
 epoch: 24, train_loss: 1.0641, test_loss: 1.0286, test_f1: 0.4432
 epoch: 25, train_loss: 1.0645, test_loss: 1.0211, test_f1: 0.4608
 epoch: 26, train_loss: 1.0585, test_loss: 1.0201, test_f1: 0.4602
 epoch: 27, train_loss: 1.0558, test_loss: 1.0136, test_f1: 0.4615
 epoch: 28, train_loss: 1.0537, test_loss: 1.0095, test_f1: 0.4608
 epoch: 29, train_loss: 1.0373, test_loss: 1.0053, test_f1: 0.4637
 epoch: 30, train_loss: 1.0292, test_loss: 1.0019, test_f1: 0.4649
 epoch: 31, train_loss: 1.0284, test_loss: 0.9985, test_f1: 0.4712
 epoch: 32, train_loss: 1.0253, test_loss: 0.9960, test_f1: 0.4757
 epoch: 33, train_loss: 1.0298, test_loss: 0.9929, test_f1: 0.4845
 epoch: 34, train_loss: 1.0149, test_loss: 0.9915, test_f1: 0.4774
 epoch: 35, train_loss: 1.0114, test_loss: 0.9849, test_f1: 0.4793
 epoch: 36, train_loss: 1.0076, test_loss: 0.9855, test_f1: 0.4866
 epoch: 37, train_loss: 1.0068, test_loss: 0.9835, test_f1: 0.4821
 epoch: 38, train_loss: 1.0074, test_loss: 0.9781, test_f1: 0.4842
 epoch: 39, train_loss: 1.0013, test_loss: 0.9788, test_f1: 0.4850
 epoch: 40, train_loss: 0.9978, test_loss: 0.9776, test_f1: 0.4991
 epoch: 41, train_loss: 0.9926, test_loss: 0.9777, test_f1: 0.4725
 epoch: 42, train_loss: 0.9876, test_loss: 0.9745, test_f1: 0.4768
 epoch: 43, train_loss: 0.9918, test_loss: 0.9717, test_f1: 0.4916
 epoch: 44, train_loss: 0.9854, test_loss: 0.9736, test_f1: 0.4946
 epoch: 45, train_loss: 0.9732, test_loss: 0.9705, test_f1: 0.4997
 epoch: 46, train_loss: 0.9872, test_loss: 0.9719, test_f1: 0.4943
 epoch: 47, train_loss: 0.9699, test_loss: 0.9707, test_f1: 0.5064
 epoch: 48, train_loss: 0.9724, test_loss: 0.9685, test_f1: 0.4949
 epoch: 49, train_loss: 0.9711, test_loss: 0.9667, test_f1: 0.4924
 epoch: 50, train_loss: 0.9593, test_loss: 0.9658, test_f1: 0.4962
 epoch: 51, train_loss: 0.9618, test_loss: 0.9645, test_f1: 0.4990
 epoch: 52, train_loss: 0.9636, test_loss: 0.9634, test_f1: 0.4877
 epoch: 53, train_loss: 0.9583, test_loss: 0.9618, test_f1: 0.4908
 epoch: 54, train_loss: 0.9580, test_loss: 0.9606, test_f1: 0.4974
 epoch: 55, train_loss: 0.9549, test_loss: 0.9592, test_f1: 0.4918
 epoch: 56, train_loss: 0.9552, test_loss: 0.9596, test_f1: 0.4924
 epoch: 57, train_loss: 0.9492, test_loss: 0.9571, test_f1: 0.5046
 epoch: 58, train_loss: 0.9500, test_loss: 0.9566, test_f1: 0.4980
 epoch: 59, train_loss: 0.9445, test_loss: 0.9584, test_f1: 0.4968
 epoch: 60, train_loss: 0.9436, test_loss: 0.9550, test_f1: 0.4956
 epoch: 61, train_loss: 0.9438, test_loss: 0.9539, test_f1: 0.5016
 epoch: 62, train_loss: 0.9521, test_loss: 0.9546, test_f1: 0.5066
 epoch: 63, train_loss: 0.9485, test_loss: 0.9538, test_f1: 0.5036
 epoch: 64, train_loss: 0.9427, test_loss: 0.9547, test_f1: 0.5011
 epoch: 65, train_loss: 0.9421, test_loss: 0.9555, test_f1: 0.5003
 epoch: 66, train_loss: 0.9339, test_loss: 0.9556, test_f1: 0.4871
 epoch: 67, train_loss: 0.9414, test_loss: 0.9523, test_f1: 0.4965
 epoch: 68, train_loss: 0.9338, test_loss: 0.9527, test_f1: 0.4961
 epoch: 69, train_loss: 0.9359, test_loss: 0.9521, test_f1: 0.4867
 epoch: 70, train_loss: 0.9377, test_loss: 0.9531, test_f1: 0.4779
 epoch: 71, train_loss: 0.9323, test_loss: 0.9518, test_f1: 0.4828
 epoch: 72, train_loss: 0.9294, test_loss: 0.9514, test_f1: 0.4874
 epoch: 73, train_loss: 0.9345, test_loss: 0.9528, test_f1: 0.4962
 epoch: 74, train_loss: 0.9292, test_loss: 0.9534, test_f1: 0.4828
 epoch: 75, train_loss: 0.9302, test_loss: 0.9541, test_f1: 0.4860
 epoch: 76, train_loss: 0.9315, test_loss: 0.9533, test_f1: 0.4889
 epoch: 77, train_loss: 0.9210, test_loss: 0.9520, test_f1: 0.4934
 epoch: 78, train_loss: 0.9327, test_loss: 0.9498, test_f1: 0.4993
 epoch: 79, train_loss: 0.9202, test_loss: 0.9510, test_f1: 0.4913
 epoch: 80, train_loss: 0.9229, test_loss: 0.9492, test_f1: 0.4997
 epoch: 81, train_loss: 0.9146, test_loss: 0.9484, test_f1: 0.5077
 epoch: 82, train_loss: 0.9206, test_loss: 0.9492, test_f1: 0.4886
 epoch: 83, train_loss: 0.9199, test_loss: 0.9493, test_f1: 0.4821
 epoch: 84, train_loss: 0.9197, test_loss: 0.9446, test_f1: 0.4920
 epoch: 85, train_loss: 0.9204, test_loss: 0.9488, test_f1: 0.4974
 epoch: 86, train_loss: 0.9173, test_loss: 0.9454, test_f1: 0.4949
 epoch: 87, train_loss: 0.9193, test_loss: 0.9433, test_f1: 0.4827
 epoch: 88, train_loss: 0.9172, test_loss: 0.9445, test_f1: 0.4919
 epoch: 89, train_loss: 0.9092, test_loss: 0.9431, test_f1: 0.4871
 epoch: 90, train_loss: 0.9131, test_loss: 0.9437, test_f1: 0.5034
 epoch: 91, train_loss: 0.9113, test_loss: 0.9419, test_f1: 0.5031
 epoch: 92, train_loss: 0.9040, test_loss: 0.9416, test_f1: 0.5018
 epoch: 93, train_loss: 0.9120, test_loss: 0.9437, test_f1: 0.5015
 epoch: 94, train_loss: 0.9028, test_loss: 0.9431, test_f1: 0.4928
 epoch: 95, train_loss: 0.9025, test_loss: 0.9450, test_f1: 0.5133
 epoch: 96, train_loss: 0.9184, test_loss: 0.9438, test_f1: 0.4997
 epoch: 97, train_loss: 0.9033, test_loss: 0.9434, test_f1: 0.5177
 epoch: 98, train_loss: 0.9084, test_loss: 0.9448, test_f1: 0.5147
 epoch: 99, train_loss: 0.9048, test_loss: 0.9425, test_f1: 0.5170

Training completed in 397.55 seconds
Best F1: 0.5268 at epoch 89
Mean F1 across iterations: 0.5113  0.0107
========================FINAL RESULTS================================
FEGIN weighted F1: 0.5268  0.0107
python main.py --data ltspice_examples --representation component_net --model FEGIN --layers 4 --hiddens 32 --batch_size 256 --lr 0.0001 --emb_size 128 --epochs 100 --save_appendix component_net_L4_H32_BS256_LR0.0001_E128 --no_val
-----



STDERR:
  File "main.py", line 370, in <module>
    main()
  File "main.py", line 254, in main
    dataset = dataset_class(
  File "/home/philip/projects/ltspice_examples_code_repo/Circuit-Completion-Using-GNNs/component_classification_with_link_prediction_head/evaluation/FEGIN/kernel/circuit_datasets.py", line 15, in __init__
    self.data, self.slices = torch.load(self.processed_paths[0])
  File "/home/philip/.local/lib/python3.8/site-packages/torch/serialization.py", line 1040, in load
    warnings.warn(
  File "/usr/lib/python3.8/warnings.py", line 109, in _showwarnmsg
    sw(msg.message, msg.category, msg.filename, msg.lineno,
  File "main.py", line 47, in warn_with_traceback
    traceback.print_stack(file=log)
/home/philip/projects/ltspice_examples_code_repo/Circuit-Completion-Using-GNNs/component_classification_with_link_prediction_head/evaluation/FEGIN/kernel/circuit_datasets.py:15: FutureWarning: You are using `torch.load` with `weights_only=False` (the current default value), which uses the default pickle module implicitly. It is possible to construct malicious pickle data which will execute arbitrary code during unpickling (See https://github.com/pytorch/pytorch/blob/main/SECURITY.md#untrusted-models for more details). In a future release, the default value for `weights_only` will be flipped to `True`. This limits the functions that could be executed during unpickling. Arbitrary objects will no longer be allowed to be loaded via this mode unless they are explicitly allowlisted by the user via `torch.serialization.add_safe_globals`. We recommend you start setting `weights_only=True` for any use case where you don't have full control of the loaded file. Please open an issue on GitHub for any issues related to this experimental feature.
  self.data, self.slices = torch.load(self.processed_paths[0])
