STDOUT:
Results will be saved in /home/philip/projects/ltspice_examples_code_repo/Circuit-Completion-Using-GNNs/component_classification_with_link_prediction_head/evaluation/FEGIN/results/model_FEGIN_dataset_ltspice_examples
Command line input: python main.py --data ltspice_examples --representation component_pin --model FEGIN --layers 2 --hiddens 128 --batch_size 64 --lr 0.01 --emb_size 512 --epochs 100 --save_appendix component_pin_L2_H128_BS64_LR0.01_E512 --no_val
 is saved.
-----
ltspice_examples - FEGIN
Using 2 layers, 128 hidden units, h = 2
Loading component_pin representation dataset
ENTERED
Training FEGIN on component_pin representation
Train: 3560, Test: 848
##################ITERATION #0 ****************************************
 epoch: 0, train_loss: 1.1792, test_loss: 2.1068, test_f1: 0.2469
 epoch: 1, train_loss: 1.0443, test_loss: 1.0125, test_f1: 0.5131
 epoch: 2, train_loss: 0.9790, test_loss: 1.0123, test_f1: 0.4643
 epoch: 3, train_loss: 0.9508, test_loss: 1.1508, test_f1: 0.4369
 epoch: 4, train_loss: 0.9293, test_loss: 1.1497, test_f1: 0.5005
 epoch: 5, train_loss: 0.9095, test_loss: 1.0867, test_f1: 0.4126
 epoch: 6, train_loss: 0.8841, test_loss: 0.8995, test_f1: 0.5144
 epoch: 7, train_loss: 0.8789, test_loss: 0.8970, test_f1: 0.5778
 epoch: 8, train_loss: 0.8722, test_loss: 1.5099, test_f1: 0.4010
 epoch: 9, train_loss: 0.8400, test_loss: 0.9877, test_f1: 0.5643
 epoch: 10, train_loss: 0.8374, test_loss: 0.9195, test_f1: 0.5932
 epoch: 11, train_loss: 0.8064, test_loss: 1.0128, test_f1: 0.5150
 epoch: 12, train_loss: 0.8020, test_loss: 1.0462, test_f1: 0.4987
 epoch: 13, train_loss: 0.8071, test_loss: 0.8936, test_f1: 0.5581
 epoch: 14, train_loss: 0.7875, test_loss: 1.0111, test_f1: 0.5587
 epoch: 15, train_loss: 0.7592, test_loss: 1.1028, test_f1: 0.5334
 epoch: 16, train_loss: 0.7603, test_loss: 0.9476, test_f1: 0.5679
 epoch: 17, train_loss: 0.7632, test_loss: 1.0041, test_f1: 0.5762
 epoch: 18, train_loss: 0.7491, test_loss: 0.8742, test_f1: 0.5815
 epoch: 19, train_loss: 0.7474, test_loss: 0.9969, test_f1: 0.5925
 epoch: 20, train_loss: 0.7094, test_loss: 1.1026, test_f1: 0.5497
 epoch: 21, train_loss: 0.7179, test_loss: 0.9252, test_f1: 0.5615
 epoch: 22, train_loss: 0.7002, test_loss: 0.9470, test_f1: 0.6000
 epoch: 23, train_loss: 0.7043, test_loss: 0.8585, test_f1: 0.6095
 epoch: 24, train_loss: 0.6756, test_loss: 1.0641, test_f1: 0.6350
 epoch: 25, train_loss: 0.6898, test_loss: 0.9792, test_f1: 0.6435
 epoch: 26, train_loss: 0.6486, test_loss: 0.9152, test_f1: 0.6344
 epoch: 27, train_loss: 0.6530, test_loss: 1.0279, test_f1: 0.6520
 epoch: 28, train_loss: 0.6658, test_loss: 1.0159, test_f1: 0.6330
 epoch: 29, train_loss: 0.6489, test_loss: 0.9983, test_f1: 0.6465
 epoch: 30, train_loss: 0.6948, test_loss: 0.8873, test_f1: 0.6136
 epoch: 31, train_loss: 0.6577, test_loss: 0.8128, test_f1: 0.6755
 epoch: 32, train_loss: 0.6251, test_loss: 0.9347, test_f1: 0.5961
 epoch: 33, train_loss: 0.6245, test_loss: 1.0047, test_f1: 0.6279
 epoch: 34, train_loss: 0.6207, test_loss: 0.8622, test_f1: 0.6329
 epoch: 35, train_loss: 0.5983, test_loss: 1.0534, test_f1: 0.6368
 epoch: 36, train_loss: 0.6074, test_loss: 0.9381, test_f1: 0.6612
 epoch: 37, train_loss: 0.5886, test_loss: 0.9982, test_f1: 0.6763
 epoch: 38, train_loss: 0.6350, test_loss: 0.9611, test_f1: 0.6112
 epoch: 39, train_loss: 0.5994, test_loss: 1.1240, test_f1: 0.6172
 epoch: 40, train_loss: 0.5771, test_loss: 1.4810, test_f1: 0.6286
 epoch: 41, train_loss: 0.5936, test_loss: 1.0856, test_f1: 0.6622
 epoch: 42, train_loss: 0.5733, test_loss: 0.9838, test_f1: 0.6344
 epoch: 43, train_loss: 0.5798, test_loss: 1.1777, test_f1: 0.6145
 epoch: 44, train_loss: 0.5630, test_loss: 1.2892, test_f1: 0.6424
 epoch: 45, train_loss: 0.5653, test_loss: 1.1440, test_f1: 0.6709
 epoch: 46, train_loss: 0.5554, test_loss: 1.0382, test_f1: 0.6485
 epoch: 47, train_loss: 0.5403, test_loss: 1.0542, test_f1: 0.6425
 epoch: 48, train_loss: 0.5729, test_loss: 1.0058, test_f1: 0.6492
 epoch: 49, train_loss: 0.5553, test_loss: 0.9731, test_f1: 0.6548
 epoch: 50, train_loss: 0.5487, test_loss: 0.9461, test_f1: 0.6098
 epoch: 51, train_loss: 0.4960, test_loss: 1.0768, test_f1: 0.6771
 epoch: 52, train_loss: 0.4632, test_loss: 1.1034, test_f1: 0.6984
 epoch: 53, train_loss: 0.4856, test_loss: 1.1451, test_f1: 0.6716
 epoch: 54, train_loss: 0.4528, test_loss: 1.1325, test_f1: 0.6739
 epoch: 55, train_loss: 0.4442, test_loss: 1.1415, test_f1: 0.6728
 epoch: 56, train_loss: 0.4331, test_loss: 1.1330, test_f1: 0.6736
 epoch: 57, train_loss: 0.4293, test_loss: 0.9969, test_f1: 0.6940
 epoch: 58, train_loss: 0.4310, test_loss: 1.0818, test_f1: 0.6774
 epoch: 59, train_loss: 0.4160, test_loss: 0.9844, test_f1: 0.6753
 epoch: 60, train_loss: 0.4199, test_loss: 1.1314, test_f1: 0.6733
 epoch: 61, train_loss: 0.4252, test_loss: 1.0138, test_f1: 0.6669
 epoch: 62, train_loss: 0.4150, test_loss: 1.1493, test_f1: 0.6465
 epoch: 63, train_loss: 0.4001, test_loss: 1.2079, test_f1: 0.6764
 epoch: 64, train_loss: 0.4103, test_loss: 1.0194, test_f1: 0.6650
 epoch: 65, train_loss: 0.3857, test_loss: 1.2328, test_f1: 0.6785
 epoch: 66, train_loss: 0.3736, test_loss: 1.1818, test_f1: 0.6493
 epoch: 67, train_loss: 0.3790, test_loss: 1.1455, test_f1: 0.6681
 epoch: 68, train_loss: 0.4233, test_loss: 1.0955, test_f1: 0.6614
 epoch: 69, train_loss: 0.3589, test_loss: 1.0413, test_f1: 0.6717
 epoch: 70, train_loss: 0.3854, test_loss: 1.1833, test_f1: 0.6659
 epoch: 71, train_loss: 0.3743, test_loss: 1.0416, test_f1: 0.6642
 epoch: 72, train_loss: 0.3697, test_loss: 1.1619, test_f1: 0.6484
 epoch: 73, train_loss: 0.3722, test_loss: 1.2825, test_f1: 0.6623
 epoch: 74, train_loss: 0.3862, test_loss: 1.2781, test_f1: 0.6531
 epoch: 75, train_loss: 0.3692, test_loss: 0.9727, test_f1: 0.6489
 epoch: 76, train_loss: 0.3447, test_loss: 1.4180, test_f1: 0.6636
 epoch: 77, train_loss: 0.3551, test_loss: 1.4014, test_f1: 0.6350
 epoch: 78, train_loss: 0.3526, test_loss: 1.3336, test_f1: 0.6575
 epoch: 79, train_loss: 0.3532, test_loss: 1.3149, test_f1: 0.6491
 epoch: 80, train_loss: 0.3399, test_loss: 1.2653, test_f1: 0.6454
 epoch: 81, train_loss: 0.3453, test_loss: 1.2551, test_f1: 0.6901
 epoch: 82, train_loss: 0.3264, test_loss: 1.2618, test_f1: 0.6801
 epoch: 83, train_loss: 0.3346, test_loss: 1.2938, test_f1: 0.6765
 epoch: 84, train_loss: 0.3329, test_loss: 1.2545, test_f1: 0.6555
 epoch: 85, train_loss: 0.3243, test_loss: 1.4479, test_f1: 0.6545
 epoch: 86, train_loss: 0.3616, test_loss: 1.2908, test_f1: 0.6476
 epoch: 87, train_loss: 0.3249, test_loss: 1.6038, test_f1: 0.6409
 epoch: 88, train_loss: 0.3335, test_loss: 1.1308, test_f1: 0.6764
 epoch: 89, train_loss: 0.3384, test_loss: 1.2961, test_f1: 0.6288
 epoch: 90, train_loss: 0.3275, test_loss: 1.3499, test_f1: 0.6665
 epoch: 91, train_loss: 0.3461, test_loss: 1.3772, test_f1: 0.6385
 epoch: 92, train_loss: 0.3285, test_loss: 1.3109, test_f1: 0.6820
 epoch: 93, train_loss: 0.3227, test_loss: 1.4976, test_f1: 0.6347
 epoch: 94, train_loss: 0.3214, test_loss: 1.5080, test_f1: 0.6454
 epoch: 95, train_loss: 0.3191, test_loss: 1.5938, test_f1: 0.6640
 epoch: 96, train_loss: 0.2986, test_loss: 1.4349, test_f1: 0.6565
 epoch: 97, train_loss: 0.3039, test_loss: 1.2910, test_f1: 0.6504
 epoch: 98, train_loss: 0.3211, test_loss: 1.5483, test_f1: 0.6274
 epoch: 99, train_loss: 0.3160, test_loss: 1.3535, test_f1: 0.6604
##################ITERATION #1 ****************************************
 epoch: 0, train_loss: 1.1706, test_loss: 1.0483, test_f1: 0.3448
 epoch: 1, train_loss: 1.0188, test_loss: 1.0355, test_f1: 0.4737
 epoch: 2, train_loss: 0.9525, test_loss: 0.9185, test_f1: 0.5282
 epoch: 3, train_loss: 0.9189, test_loss: 1.0551, test_f1: 0.4350
 epoch: 4, train_loss: 0.8976, test_loss: 1.0819, test_f1: 0.5052
 epoch: 5, train_loss: 0.8822, test_loss: 0.9466, test_f1: 0.4885
 epoch: 6, train_loss: 0.8629, test_loss: 0.9614, test_f1: 0.5662
 epoch: 7, train_loss: 0.8568, test_loss: 0.8017, test_f1: 0.5390
 epoch: 8, train_loss: 0.8298, test_loss: 0.8184, test_f1: 0.5327
 epoch: 9, train_loss: 0.8182, test_loss: 0.8136, test_f1: 0.5278
 epoch: 10, train_loss: 0.8086, test_loss: 0.8735, test_f1: 0.5418
 epoch: 11, train_loss: 0.8032, test_loss: 0.9140, test_f1: 0.5357
 epoch: 12, train_loss: 0.7916, test_loss: 0.8613, test_f1: 0.5292
 epoch: 13, train_loss: 0.7704, test_loss: 0.7741, test_f1: 0.6117
 epoch: 14, train_loss: 0.7751, test_loss: 0.8437, test_f1: 0.5423
 epoch: 15, train_loss: 0.7448, test_loss: 0.8915, test_f1: 0.5714
 epoch: 16, train_loss: 0.7442, test_loss: 0.7439, test_f1: 0.5777
 epoch: 17, train_loss: 0.7331, test_loss: 0.7801, test_f1: 0.5573
 epoch: 18, train_loss: 0.7167, test_loss: 0.8132, test_f1: 0.6197
 epoch: 19, train_loss: 0.7275, test_loss: 0.8755, test_f1: 0.5811
 epoch: 20, train_loss: 0.7085, test_loss: 0.9951, test_f1: 0.5130
 epoch: 21, train_loss: 0.6995, test_loss: 0.7529, test_f1: 0.5787
 epoch: 22, train_loss: 0.6920, test_loss: 0.8597, test_f1: 0.5160
 epoch: 23, train_loss: 0.6740, test_loss: 0.7924, test_f1: 0.5287
 epoch: 24, train_loss: 0.6858, test_loss: 0.9411, test_f1: 0.5557
 epoch: 25, train_loss: 0.6687, test_loss: 0.6987, test_f1: 0.6594
 epoch: 26, train_loss: 0.6542, test_loss: 0.6973, test_f1: 0.6167
 epoch: 27, train_loss: 0.6488, test_loss: 0.7857, test_f1: 0.6510
 epoch: 28, train_loss: 0.6371, test_loss: 0.8717, test_f1: 0.5816
 epoch: 29, train_loss: 0.6467, test_loss: 0.7558, test_f1: 0.6197
 epoch: 30, train_loss: 0.6363, test_loss: 0.8004, test_f1: 0.6297
 epoch: 31, train_loss: 0.6481, test_loss: 0.8945, test_f1: 0.6019
 epoch: 32, train_loss: 0.6201, test_loss: 0.8714, test_f1: 0.6185
 epoch: 33, train_loss: 0.6146, test_loss: 0.9135, test_f1: 0.6129
 epoch: 34, train_loss: 0.6204, test_loss: 0.8631, test_f1: 0.6354
 epoch: 35, train_loss: 0.6165, test_loss: 0.9085, test_f1: 0.6129
 epoch: 36, train_loss: 0.6040, test_loss: 0.8254, test_f1: 0.6198
 epoch: 37, train_loss: 0.5998, test_loss: 0.7428, test_f1: 0.6189
 epoch: 38, train_loss: 0.5954, test_loss: 0.8735, test_f1: 0.6099
 epoch: 39, train_loss: 0.5778, test_loss: 0.8917, test_f1: 0.6064
 epoch: 40, train_loss: 0.5781, test_loss: 0.7505, test_f1: 0.6129
 epoch: 41, train_loss: 0.5625, test_loss: 0.8789, test_f1: 0.6634
 epoch: 42, train_loss: 0.5638, test_loss: 0.9061, test_f1: 0.6409
 epoch: 43, train_loss: 0.5592, test_loss: 0.8591, test_f1: 0.6836
 epoch: 44, train_loss: 0.5844, test_loss: 0.7694, test_f1: 0.6137
 epoch: 45, train_loss: 0.5514, test_loss: 0.8265, test_f1: 0.6501
 epoch: 46, train_loss: 0.5292, test_loss: 0.9048, test_f1: 0.6137
 epoch: 47, train_loss: 0.5177, test_loss: 0.9757, test_f1: 0.6471
 epoch: 48, train_loss: 0.5301, test_loss: 0.7921, test_f1: 0.5987
 epoch: 49, train_loss: 0.5154, test_loss: 0.8730, test_f1: 0.6645
 epoch: 50, train_loss: 0.5144, test_loss: 0.8901, test_f1: 0.6549
 epoch: 51, train_loss: 0.4834, test_loss: 0.7498, test_f1: 0.7041
 epoch: 52, train_loss: 0.4124, test_loss: 0.9859, test_f1: 0.6825
 epoch: 53, train_loss: 0.4386, test_loss: 0.9948, test_f1: 0.6593
 epoch: 54, train_loss: 0.4279, test_loss: 1.0036, test_f1: 0.6540
 epoch: 55, train_loss: 0.4060, test_loss: 0.8659, test_f1: 0.7011
 epoch: 56, train_loss: 0.3946, test_loss: 0.8749, test_f1: 0.6628
 epoch: 57, train_loss: 0.4020, test_loss: 0.8097, test_f1: 0.6824
 epoch: 58, train_loss: 0.4155, test_loss: 0.9608, test_f1: 0.6950
 epoch: 59, train_loss: 0.3989, test_loss: 0.9252, test_f1: 0.6726
 epoch: 60, train_loss: 0.3922, test_loss: 0.9288, test_f1: 0.6834
 epoch: 61, train_loss: 0.3841, test_loss: 0.9484, test_f1: 0.6597
 epoch: 62, train_loss: 0.3814, test_loss: 0.8529, test_f1: 0.6806
 epoch: 63, train_loss: 0.3777, test_loss: 0.8815, test_f1: 0.6659
 epoch: 64, train_loss: 0.3448, test_loss: 1.0114, test_f1: 0.6535
 epoch: 65, train_loss: 0.3877, test_loss: 1.0651, test_f1: 0.6920
 epoch: 66, train_loss: 0.3449, test_loss: 0.9892, test_f1: 0.6950
 epoch: 67, train_loss: 0.3456, test_loss: 1.0136, test_f1: 0.6663
 epoch: 68, train_loss: 0.3670, test_loss: 0.9799, test_f1: 0.7162
 epoch: 69, train_loss: 0.3437, test_loss: 1.0590, test_f1: 0.6909
 epoch: 70, train_loss: 0.3434, test_loss: 1.1386, test_f1: 0.6691
 epoch: 71, train_loss: 0.3325, test_loss: 1.1589, test_f1: 0.6803
 epoch: 72, train_loss: 0.3249, test_loss: 1.2930, test_f1: 0.6337
 epoch: 73, train_loss: 0.3381, test_loss: 0.9871, test_f1: 0.6770
 epoch: 74, train_loss: 0.3331, test_loss: 1.1445, test_f1: 0.6645
 epoch: 75, train_loss: 0.3152, test_loss: 1.0432, test_f1: 0.6763
 epoch: 76, train_loss: 0.3254, test_loss: 0.9651, test_f1: 0.6956
 epoch: 77, train_loss: 0.3310, test_loss: 0.9597, test_f1: 0.6475
 epoch: 78, train_loss: 0.3205, test_loss: 1.0426, test_f1: 0.6482
 epoch: 79, train_loss: 0.3351, test_loss: 1.0119, test_f1: 0.6651
 epoch: 80, train_loss: 0.3013, test_loss: 1.4081, test_f1: 0.6501
 epoch: 81, train_loss: 0.2925, test_loss: 1.0108, test_f1: 0.6795
 epoch: 82, train_loss: 0.3274, test_loss: 1.1218, test_f1: 0.6929
 epoch: 83, train_loss: 0.2927, test_loss: 1.0939, test_f1: 0.6872
 epoch: 84, train_loss: 0.2871, test_loss: 1.0143, test_f1: 0.6702
 epoch: 85, train_loss: 0.2795, test_loss: 1.1366, test_f1: 0.6413
 epoch: 86, train_loss: 0.2935, test_loss: 1.0329, test_f1: 0.6473
 epoch: 87, train_loss: 0.2971, test_loss: 1.0351, test_f1: 0.6620
 epoch: 88, train_loss: 0.2733, test_loss: 1.0193, test_f1: 0.6710
 epoch: 89, train_loss: 0.2573, test_loss: 1.1421, test_f1: 0.6584
 epoch: 90, train_loss: 0.2649, test_loss: 1.0906, test_f1: 0.6728
 epoch: 91, train_loss: 0.2934, test_loss: 1.0587, test_f1: 0.6569
 epoch: 92, train_loss: 0.2586, test_loss: 1.0653, test_f1: 0.6616
 epoch: 93, train_loss: 0.2596, test_loss: 1.1157, test_f1: 0.6873
 epoch: 94, train_loss: 0.2566, test_loss: 1.0254, test_f1: 0.6888
 epoch: 95, train_loss: 0.2698, test_loss: 1.0420, test_f1: 0.6866
 epoch: 96, train_loss: 0.2730, test_loss: 1.1053, test_f1: 0.6782
 epoch: 97, train_loss: 0.2724, test_loss: 0.9663, test_f1: 0.6871
 epoch: 98, train_loss: 0.2730, test_loss: 1.0994, test_f1: 0.6821
 epoch: 99, train_loss: 0.2433, test_loss: 1.2085, test_f1: 0.6579
##################ITERATION #2 ****************************************
 epoch: 0, train_loss: 1.1909, test_loss: 1.1636, test_f1: 0.4095
 epoch: 1, train_loss: 1.0502, test_loss: 1.1293, test_f1: 0.4383
 epoch: 2, train_loss: 1.0126, test_loss: 1.0675, test_f1: 0.4876
 epoch: 3, train_loss: 0.9682, test_loss: 1.0372, test_f1: 0.5059
 epoch: 4, train_loss: 0.9418, test_loss: 0.9969, test_f1: 0.4895
 epoch: 5, train_loss: 0.9253, test_loss: 1.0425, test_f1: 0.4659
 epoch: 6, train_loss: 0.9122, test_loss: 1.0045, test_f1: 0.5614
 epoch: 7, train_loss: 0.8912, test_loss: 0.8769, test_f1: 0.5142
 epoch: 8, train_loss: 0.8947, test_loss: 0.9986, test_f1: 0.5020
 epoch: 9, train_loss: 0.8695, test_loss: 1.1590, test_f1: 0.4869
 epoch: 10, train_loss: 0.8627, test_loss: 1.0206, test_f1: 0.5116
 epoch: 11, train_loss: 0.8562, test_loss: 1.0124, test_f1: 0.4884
 epoch: 12, train_loss: 0.8440, test_loss: 0.9036, test_f1: 0.5557
 epoch: 13, train_loss: 0.8244, test_loss: 1.0121, test_f1: 0.4928
 epoch: 14, train_loss: 0.8303, test_loss: 0.9883, test_f1: 0.5205
 epoch: 15, train_loss: 0.8090, test_loss: 0.9202, test_f1: 0.5763
 epoch: 16, train_loss: 0.7924, test_loss: 0.9872, test_f1: 0.5311
 epoch: 17, train_loss: 0.8067, test_loss: 0.8761, test_f1: 0.5520
 epoch: 18, train_loss: 0.7935, test_loss: 0.9677, test_f1: 0.5150
 epoch: 19, train_loss: 0.7897, test_loss: 0.8776, test_f1: 0.6157
 epoch: 20, train_loss: 0.7867, test_loss: 0.9466, test_f1: 0.5266
 epoch: 21, train_loss: 0.7636, test_loss: 0.9099, test_f1: 0.6295
 epoch: 22, train_loss: 0.7555, test_loss: 0.7864, test_f1: 0.5896
 epoch: 23, train_loss: 0.7609, test_loss: 1.0118, test_f1: 0.5490
 epoch: 24, train_loss: 0.7430, test_loss: 0.8832, test_f1: 0.6154
 epoch: 25, train_loss: 0.7312, test_loss: 0.8989, test_f1: 0.5777
 epoch: 26, train_loss: 0.7430, test_loss: 0.9605, test_f1: 0.6387
 epoch: 27, train_loss: 0.7329, test_loss: 0.8482, test_f1: 0.6559
 epoch: 28, train_loss: 0.7131, test_loss: 0.9737, test_f1: 0.5852
 epoch: 29, train_loss: 0.6975, test_loss: 0.8512, test_f1: 0.6089
 epoch: 30, train_loss: 0.7023, test_loss: 0.9254, test_f1: 0.5642
 epoch: 31, train_loss: 0.6923, test_loss: 0.9451, test_f1: 0.5462
 epoch: 32, train_loss: 0.6939, test_loss: 0.8881, test_f1: 0.6201
 epoch: 33, train_loss: 0.6773, test_loss: 1.2952, test_f1: 0.4689
 epoch: 34, train_loss: 0.6596, test_loss: 0.8087, test_f1: 0.6164
 epoch: 35, train_loss: 0.6693, test_loss: 0.9630, test_f1: 0.5928
 epoch: 36, train_loss: 0.6683, test_loss: 0.9068, test_f1: 0.6311
 epoch: 37, train_loss: 0.6654, test_loss: 0.9059, test_f1: 0.6489
 epoch: 38, train_loss: 0.6364, test_loss: 0.9512, test_f1: 0.6246
 epoch: 39, train_loss: 0.6575, test_loss: 1.0858, test_f1: 0.5922
 epoch: 40, train_loss: 0.6557, test_loss: 0.8768, test_f1: 0.6589
 epoch: 41, train_loss: 0.6353, test_loss: 1.1473, test_f1: 0.5611
 epoch: 42, train_loss: 0.6334, test_loss: 0.9856, test_f1: 0.6522
 epoch: 43, train_loss: 0.6171, test_loss: 1.0441, test_f1: 0.6022
 epoch: 44, train_loss: 0.6383, test_loss: 1.1005, test_f1: 0.5778
 epoch: 45, train_loss: 0.6257, test_loss: 0.9151, test_f1: 0.6591
 epoch: 46, train_loss: 0.6294, test_loss: 1.0665, test_f1: 0.6269
 epoch: 47, train_loss: 0.6067, test_loss: 1.0012, test_f1: 0.6180
 epoch: 48, train_loss: 0.5907, test_loss: 1.0764, test_f1: 0.6311
 epoch: 49, train_loss: 0.5947, test_loss: 0.8874, test_f1: 0.6958
 epoch: 50, train_loss: 0.6047, test_loss: 0.9617, test_f1: 0.6563
 epoch: 51, train_loss: 0.5440, test_loss: 1.1185, test_f1: 0.6385
 epoch: 52, train_loss: 0.5426, test_loss: 0.9543, test_f1: 0.6510
 epoch: 53, train_loss: 0.5080, test_loss: 1.0667, test_f1: 0.6504
 epoch: 54, train_loss: 0.4957, test_loss: 1.1272, test_f1: 0.6654
 epoch: 55, train_loss: 0.4886, test_loss: 1.1675, test_f1: 0.6444
 epoch: 56, train_loss: 0.4998, test_loss: 1.1535, test_f1: 0.6536
 epoch: 57, train_loss: 0.4776, test_loss: 1.2004, test_f1: 0.6557
 epoch: 58, train_loss: 0.4724, test_loss: 1.1662, test_f1: 0.6717
 epoch: 59, train_loss: 0.4848, test_loss: 1.0583, test_f1: 0.6656
 epoch: 60, train_loss: 0.4795, test_loss: 1.1461, test_f1: 0.6789
 epoch: 61, train_loss: 0.4769, test_loss: 1.0498, test_f1: 0.6452
 epoch: 62, train_loss: 0.4782, test_loss: 1.2030, test_f1: 0.6702
 epoch: 63, train_loss: 0.4511, test_loss: 1.1919, test_f1: 0.6586
 epoch: 64, train_loss: 0.4748, test_loss: 1.2473, test_f1: 0.6355
 epoch: 65, train_loss: 0.4470, test_loss: 1.2353, test_f1: 0.6529
 epoch: 66, train_loss: 0.4459, test_loss: 1.2930, test_f1: 0.6520
 epoch: 67, train_loss: 0.4397, test_loss: 1.0887, test_f1: 0.6808
 epoch: 68, train_loss: 0.4262, test_loss: 1.1218, test_f1: 0.6755
 epoch: 69, train_loss: 0.4221, test_loss: 1.1553, test_f1: 0.6981
 epoch: 70, train_loss: 0.4432, test_loss: 1.1946, test_f1: 0.6499
 epoch: 71, train_loss: 0.4163, test_loss: 1.2803, test_f1: 0.6510
 epoch: 72, train_loss: 0.4209, test_loss: 1.4314, test_f1: 0.6480
 epoch: 73, train_loss: 0.4117, test_loss: 1.2576, test_f1: 0.6646
 epoch: 74, train_loss: 0.4175, test_loss: 1.3845, test_f1: 0.6437
 epoch: 75, train_loss: 0.4146, test_loss: 1.1804, test_f1: 0.6460
 epoch: 76, train_loss: 0.3979, test_loss: 1.2192, test_f1: 0.6795
 epoch: 77, train_loss: 0.4190, test_loss: 1.1968, test_f1: 0.6484
 epoch: 78, train_loss: 0.4164, test_loss: 1.2588, test_f1: 0.6656
 epoch: 79, train_loss: 0.4009, test_loss: 1.2673, test_f1: 0.6569
 epoch: 80, train_loss: 0.4097, test_loss: 1.0942, test_f1: 0.6597
 epoch: 81, train_loss: 0.4031, test_loss: 1.2203, test_f1: 0.6628
 epoch: 82, train_loss: 0.3984, test_loss: 1.2251, test_f1: 0.6802
 epoch: 83, train_loss: 0.3745, test_loss: 1.3579, test_f1: 0.6621
 epoch: 84, train_loss: 0.3752, test_loss: 1.3231, test_f1: 0.6556
 epoch: 85, train_loss: 0.3878, test_loss: 1.1878, test_f1: 0.6669
 epoch: 86, train_loss: 0.3832, test_loss: 1.3923, test_f1: 0.6431
 epoch: 87, train_loss: 0.3747, test_loss: 1.2731, test_f1: 0.6722
 epoch: 88, train_loss: 0.3490, test_loss: 1.4562, test_f1: 0.6711
 epoch: 89, train_loss: 0.3553, test_loss: 1.3191, test_f1: 0.6773
 epoch: 90, train_loss: 0.3708, test_loss: 1.3113, test_f1: 0.6324
 epoch: 91, train_loss: 0.3736, test_loss: 1.2946, test_f1: 0.6831
 epoch: 92, train_loss: 0.3505, test_loss: 1.3601, test_f1: 0.6487
 epoch: 93, train_loss: 0.3429, test_loss: 1.3240, test_f1: 0.6837
 epoch: 94, train_loss: 0.3687, test_loss: 1.4415, test_f1: 0.6683
 epoch: 95, train_loss: 0.3327, test_loss: 1.3678, test_f1: 0.7116
 epoch: 96, train_loss: 0.3453, test_loss: 1.2269, test_f1: 0.7031
 epoch: 97, train_loss: 0.3359, test_loss: 1.2565, test_f1: 0.6708
 epoch: 98, train_loss: 0.3283, test_loss: 1.3717, test_f1: 0.6764
 epoch: 99, train_loss: 0.3325, test_loss: 1.2474, test_f1: 0.6685
##################ITERATION #3 ****************************************
 epoch: 0, train_loss: 1.2026, test_loss: 1.0515, test_f1: 0.4698
 epoch: 1, train_loss: 0.9888, test_loss: 1.0860, test_f1: 0.4368
 epoch: 2, train_loss: 0.9741, test_loss: 1.0929, test_f1: 0.4871
 epoch: 3, train_loss: 0.9307, test_loss: 1.0789, test_f1: 0.4722
 epoch: 4, train_loss: 0.9123, test_loss: 0.9255, test_f1: 0.5579
 epoch: 5, train_loss: 0.8967, test_loss: 0.9146, test_f1: 0.5687
 epoch: 6, train_loss: 0.8781, test_loss: 0.8354, test_f1: 0.5657
 epoch: 7, train_loss: 0.8681, test_loss: 1.1041, test_f1: 0.5018
 epoch: 8, train_loss: 0.8541, test_loss: 0.9281, test_f1: 0.4942
 epoch: 9, train_loss: 0.8512, test_loss: 0.8315, test_f1: 0.6395
 epoch: 10, train_loss: 0.8298, test_loss: 0.8278, test_f1: 0.6052
 epoch: 11, train_loss: 0.8114, test_loss: 0.9013, test_f1: 0.5635
 epoch: 12, train_loss: 0.8089, test_loss: 0.8614, test_f1: 0.6335
 epoch: 13, train_loss: 0.7880, test_loss: 0.8215, test_f1: 0.6126
 epoch: 14, train_loss: 0.7834, test_loss: 0.9223, test_f1: 0.5792
 epoch: 15, train_loss: 0.7752, test_loss: 1.0158, test_f1: 0.5849
 epoch: 16, train_loss: 0.7629, test_loss: 1.1792, test_f1: 0.5333
 epoch: 17, train_loss: 0.7566, test_loss: 1.2087, test_f1: 0.5027
 epoch: 18, train_loss: 0.7342, test_loss: 0.9518, test_f1: 0.5623
 epoch: 19, train_loss: 0.7225, test_loss: 0.9515, test_f1: 0.5970
 epoch: 20, train_loss: 0.7240, test_loss: 0.8861, test_f1: 0.5775
 epoch: 21, train_loss: 0.7111, test_loss: 1.0865, test_f1: 0.6150
 epoch: 22, train_loss: 0.7323, test_loss: 0.9414, test_f1: 0.6138
 epoch: 23, train_loss: 0.7108, test_loss: 0.9362, test_f1: 0.6280
 epoch: 24, train_loss: 0.7085, test_loss: 0.8808, test_f1: 0.6646
 epoch: 25, train_loss: 0.6730, test_loss: 1.1386, test_f1: 0.5623
 epoch: 26, train_loss: 0.6773, test_loss: 1.0397, test_f1: 0.5943
 epoch: 27, train_loss: 0.6643, test_loss: 0.8423, test_f1: 0.5949
 epoch: 28, train_loss: 0.6448, test_loss: 0.9718, test_f1: 0.6453
 epoch: 29, train_loss: 0.6528, test_loss: 1.0036, test_f1: 0.6270
 epoch: 30, train_loss: 0.6430, test_loss: 0.9493, test_f1: 0.6127
 epoch: 31, train_loss: 0.6160, test_loss: 0.8892, test_f1: 0.6057
 epoch: 32, train_loss: 0.6385, test_loss: 0.8630, test_f1: 0.6452
 epoch: 33, train_loss: 0.6046, test_loss: 0.8395, test_f1: 0.6677
 epoch: 34, train_loss: 0.6132, test_loss: 0.9576, test_f1: 0.6250
 epoch: 35, train_loss: 0.6025, test_loss: 0.8609, test_f1: 0.6407
 epoch: 36, train_loss: 0.5782, test_loss: 0.9245, test_f1: 0.6311
 epoch: 37, train_loss: 0.5709, test_loss: 0.9397, test_f1: 0.6139
 epoch: 38, train_loss: 0.5660, test_loss: 0.8565, test_f1: 0.6634
 epoch: 39, train_loss: 0.5951, test_loss: 0.9671, test_f1: 0.6735
 epoch: 40, train_loss: 0.6113, test_loss: 0.9330, test_f1: 0.6681
 epoch: 41, train_loss: 0.5764, test_loss: 0.8539, test_f1: 0.6672
 epoch: 42, train_loss: 0.5502, test_loss: 0.8242, test_f1: 0.6685
 epoch: 43, train_loss: 0.5494, test_loss: 0.9457, test_f1: 0.6595
 epoch: 44, train_loss: 0.5887, test_loss: 0.8326, test_f1: 0.6746
 epoch: 45, train_loss: 0.5756, test_loss: 0.9346, test_f1: 0.6177
 epoch: 46, train_loss: 0.5634, test_loss: 0.8575, test_f1: 0.6377
 epoch: 47, train_loss: 0.5502, test_loss: 0.9146, test_f1: 0.6433
 epoch: 48, train_loss: 0.5481, test_loss: 0.9003, test_f1: 0.6601
 epoch: 49, train_loss: 0.5352, test_loss: 0.8831, test_f1: 0.6468
 epoch: 50, train_loss: 0.5521, test_loss: 0.9398, test_f1: 0.6403
 epoch: 51, train_loss: 0.4773, test_loss: 0.9131, test_f1: 0.6966
 epoch: 52, train_loss: 0.4369, test_loss: 1.0075, test_f1: 0.6755
 epoch: 53, train_loss: 0.4503, test_loss: 0.8899, test_f1: 0.6964
 epoch: 54, train_loss: 0.4307, test_loss: 1.0771, test_f1: 0.6785
 epoch: 55, train_loss: 0.4242, test_loss: 0.8963, test_f1: 0.7078
 epoch: 56, train_loss: 0.4108, test_loss: 0.9448, test_f1: 0.6715
 epoch: 57, train_loss: 0.4303, test_loss: 0.9971, test_f1: 0.6721
 epoch: 58, train_loss: 0.4259, test_loss: 0.9636, test_f1: 0.6531
 epoch: 59, train_loss: 0.4120, test_loss: 0.9921, test_f1: 0.6879
 epoch: 60, train_loss: 0.4065, test_loss: 0.9800, test_f1: 0.7036
 epoch: 61, train_loss: 0.3978, test_loss: 0.9803, test_f1: 0.6806
 epoch: 62, train_loss: 0.4023, test_loss: 1.0334, test_f1: 0.6804
 epoch: 63, train_loss: 0.3887, test_loss: 1.0941, test_f1: 0.6779
 epoch: 64, train_loss: 0.3838, test_loss: 1.0414, test_f1: 0.6899
 epoch: 65, train_loss: 0.3696, test_loss: 1.1946, test_f1: 0.6984
 epoch: 66, train_loss: 0.3838, test_loss: 1.0535, test_f1: 0.6898
 epoch: 67, train_loss: 0.3699, test_loss: 1.1370, test_f1: 0.6769
 epoch: 68, train_loss: 0.3579, test_loss: 1.1547, test_f1: 0.6975
 epoch: 69, train_loss: 0.3651, test_loss: 1.1122, test_f1: 0.6830
 epoch: 70, train_loss: 0.3590, test_loss: 1.2253, test_f1: 0.6596
 epoch: 71, train_loss: 0.3509, test_loss: 1.2359, test_f1: 0.6746
 epoch: 72, train_loss: 0.3496, test_loss: 1.1936, test_f1: 0.6889
 epoch: 73, train_loss: 0.3638, test_loss: 1.2011, test_f1: 0.6568
 epoch: 74, train_loss: 0.3356, test_loss: 1.2916, test_f1: 0.6861
 epoch: 75, train_loss: 0.3735, test_loss: 1.3292, test_f1: 0.6837
 epoch: 76, train_loss: 0.3698, test_loss: 1.4341, test_f1: 0.6700
 epoch: 77, train_loss: 0.3463, test_loss: 1.3436, test_f1: 0.6959
 epoch: 78, train_loss: 0.3246, test_loss: 1.1151, test_f1: 0.7102
 epoch: 79, train_loss: 0.3213, test_loss: 1.2611, test_f1: 0.6844
 epoch: 80, train_loss: 0.3090, test_loss: 1.2829, test_f1: 0.6764
 epoch: 81, train_loss: 0.3155, test_loss: 1.2131, test_f1: 0.6919
 epoch: 82, train_loss: 0.3021, test_loss: 1.5681, test_f1: 0.6627
 epoch: 83, train_loss: 0.3197, test_loss: 1.4785, test_f1: 0.7014
 epoch: 84, train_loss: 0.3322, test_loss: 1.3682, test_f1: 0.6434
 epoch: 85, train_loss: 0.3428, test_loss: 1.4394, test_f1: 0.6722
 epoch: 86, train_loss: 0.2995, test_loss: 1.4798, test_f1: 0.6770
 epoch: 87, train_loss: 0.3041, test_loss: 1.3146, test_f1: 0.6604
 epoch: 88, train_loss: 0.3091, test_loss: 1.1110, test_f1: 0.6932
 epoch: 89, train_loss: 0.3142, test_loss: 1.1977, test_f1: 0.6782
 epoch: 90, train_loss: 0.3008, test_loss: 1.2454, test_f1: 0.6743
 epoch: 91, train_loss: 0.3021, test_loss: 1.3119, test_f1: 0.6726
 epoch: 92, train_loss: 0.2865, test_loss: 1.3085, test_f1: 0.6807
 epoch: 93, train_loss: 0.3035, test_loss: 1.0723, test_f1: 0.6896
 epoch: 94, train_loss: 0.2988, test_loss: 1.1982, test_f1: 0.6793
 epoch: 95, train_loss: 0.2980, test_loss: 1.0992, test_f1: 0.6885
 epoch: 96, train_loss: 0.3083, test_loss: 1.4228, test_f1: 0.6540
 epoch: 97, train_loss: 0.2869, test_loss: 1.4424, test_f1: 0.6623
 epoch: 98, train_loss: 0.2815, test_loss: 1.2351, test_f1: 0.7004
 epoch: 99, train_loss: 0.2867, test_loss: 1.1429, test_f1: 0.6769
##################ITERATION #4 ****************************************
 epoch: 0, train_loss: 1.2090, test_loss: 1.1568, test_f1: 0.4309
 epoch: 1, train_loss: 0.9978, test_loss: 1.1109, test_f1: 0.4569
 epoch: 2, train_loss: 0.9629, test_loss: 1.0066, test_f1: 0.4810
 epoch: 3, train_loss: 0.9400, test_loss: 1.0325, test_f1: 0.4562
 epoch: 4, train_loss: 0.9137, test_loss: 0.9285, test_f1: 0.5069
 epoch: 5, train_loss: 0.9033, test_loss: 0.9578, test_f1: 0.5655
 epoch: 6, train_loss: 0.8934, test_loss: 0.8505, test_f1: 0.5160
 epoch: 7, train_loss: 0.8694, test_loss: 0.9375, test_f1: 0.5200
 epoch: 8, train_loss: 0.8648, test_loss: 0.8706, test_f1: 0.5341
 epoch: 9, train_loss: 0.8578, test_loss: 1.0254, test_f1: 0.4809
 epoch: 10, train_loss: 0.8459, test_loss: 0.8711, test_f1: 0.6002
 epoch: 11, train_loss: 0.8329, test_loss: 0.8819, test_f1: 0.5657
 epoch: 12, train_loss: 0.8100, test_loss: 0.8350, test_f1: 0.5623
 epoch: 13, train_loss: 0.8019, test_loss: 0.9255, test_f1: 0.5566
 epoch: 14, train_loss: 0.7916, test_loss: 0.9030, test_f1: 0.5355
 epoch: 15, train_loss: 0.7941, test_loss: 0.9865, test_f1: 0.5092
 epoch: 16, train_loss: 0.7741, test_loss: 0.8653, test_f1: 0.6034
 epoch: 17, train_loss: 0.7723, test_loss: 0.8673, test_f1: 0.5646
 epoch: 18, train_loss: 0.7655, test_loss: 0.9264, test_f1: 0.6036
 epoch: 19, train_loss: 0.7569, test_loss: 0.8920, test_f1: 0.5513
 epoch: 20, train_loss: 0.7257, test_loss: 0.7346, test_f1: 0.6030
 epoch: 21, train_loss: 0.7321, test_loss: 0.8045, test_f1: 0.6197
 epoch: 22, train_loss: 0.7135, test_loss: 1.0954, test_f1: 0.5568
 epoch: 23, train_loss: 0.7049, test_loss: 0.8870, test_f1: 0.6023
 epoch: 24, train_loss: 0.7027, test_loss: 0.9409, test_f1: 0.5967
 epoch: 25, train_loss: 0.6810, test_loss: 0.8035, test_f1: 0.6265
 epoch: 26, train_loss: 0.6769, test_loss: 0.9797, test_f1: 0.5711
 epoch: 27, train_loss: 0.6659, test_loss: 0.9061, test_f1: 0.5903
 epoch: 28, train_loss: 0.6715, test_loss: 0.8781, test_f1: 0.5762
 epoch: 29, train_loss: 0.6397, test_loss: 0.8922, test_f1: 0.6105
 epoch: 30, train_loss: 0.6496, test_loss: 0.9380, test_f1: 0.5741
 epoch: 31, train_loss: 0.6479, test_loss: 0.8872, test_f1: 0.6413
 epoch: 32, train_loss: 0.6493, test_loss: 0.8941, test_f1: 0.6374
 epoch: 33, train_loss: 0.6058, test_loss: 0.9053, test_f1: 0.6253
 epoch: 34, train_loss: 0.6147, test_loss: 0.9559, test_f1: 0.5863
 epoch: 35, train_loss: 0.6245, test_loss: 0.9044, test_f1: 0.6620
 epoch: 36, train_loss: 0.5892, test_loss: 0.8913, test_f1: 0.6474
 epoch: 37, train_loss: 0.6265, test_loss: 0.8632, test_f1: 0.6424
 epoch: 38, train_loss: 0.5848, test_loss: 0.8978, test_f1: 0.6607
 epoch: 39, train_loss: 0.5886, test_loss: 0.9591, test_f1: 0.6272
 epoch: 40, train_loss: 0.6066, test_loss: 0.8383, test_f1: 0.6712
 epoch: 41, train_loss: 0.5737, test_loss: 0.9276, test_f1: 0.6078
 epoch: 42, train_loss: 0.6031, test_loss: 0.9145, test_f1: 0.6368
 epoch: 43, train_loss: 0.5627, test_loss: 0.9521, test_f1: 0.6326
 epoch: 44, train_loss: 0.5735, test_loss: 0.8828, test_f1: 0.6623
 epoch: 45, train_loss: 0.5514, test_loss: 0.9897, test_f1: 0.6157
 epoch: 46, train_loss: 0.5372, test_loss: 0.8880, test_f1: 0.6153
 epoch: 47, train_loss: 0.5356, test_loss: 1.0201, test_f1: 0.6199
 epoch: 48, train_loss: 0.5453, test_loss: 0.7752, test_f1: 0.6447
 epoch: 49, train_loss: 0.5201, test_loss: 0.8542, test_f1: 0.6395
 epoch: 50, train_loss: 0.5234, test_loss: 0.9820, test_f1: 0.6495
 epoch: 51, train_loss: 0.4505, test_loss: 0.9753, test_f1: 0.6509
 epoch: 52, train_loss: 0.4269, test_loss: 1.1033, test_f1: 0.6515
 epoch: 53, train_loss: 0.4291, test_loss: 0.9437, test_f1: 0.6654
 epoch: 54, train_loss: 0.4308, test_loss: 0.9785, test_f1: 0.6613
 epoch: 55, train_loss: 0.4438, test_loss: 1.0389, test_f1: 0.6487
 epoch: 56, train_loss: 0.4404, test_loss: 0.9748, test_f1: 0.6651
 epoch: 57, train_loss: 0.4080, test_loss: 0.9145, test_f1: 0.6844
 epoch: 58, train_loss: 0.4160, test_loss: 0.8676, test_f1: 0.6706
 epoch: 59, train_loss: 0.4180, test_loss: 0.8574, test_f1: 0.6452
 epoch: 60, train_loss: 0.3975, test_loss: 0.9774, test_f1: 0.6751
 epoch: 61, train_loss: 0.3905, test_loss: 1.0624, test_f1: 0.6383
 epoch: 62, train_loss: 0.3895, test_loss: 1.0355, test_f1: 0.6753
 epoch: 63, train_loss: 0.4030, test_loss: 1.0795, test_f1: 0.6708
 epoch: 64, train_loss: 0.3998, test_loss: 1.1387, test_f1: 0.6318
 epoch: 65, train_loss: 0.3705, test_loss: 1.0526, test_f1: 0.6835
 epoch: 66, train_loss: 0.3874, test_loss: 1.1166, test_f1: 0.6550
 epoch: 67, train_loss: 0.3932, test_loss: 1.0682, test_f1: 0.6603
 epoch: 68, train_loss: 0.3706, test_loss: 1.0495, test_f1: 0.6711
 epoch: 69, train_loss: 0.3683, test_loss: 1.0072, test_f1: 0.6751
 epoch: 70, train_loss: 0.3799, test_loss: 1.0100, test_f1: 0.6725
 epoch: 71, train_loss: 0.3505, test_loss: 1.0793, test_f1: 0.6762
 epoch: 72, train_loss: 0.3748, test_loss: 0.9870, test_f1: 0.7125
 epoch: 73, train_loss: 0.3529, test_loss: 1.1115, test_f1: 0.6756
 epoch: 74, train_loss: 0.3474, test_loss: 1.3057, test_f1: 0.6697
 epoch: 75, train_loss: 0.3445, test_loss: 1.1110, test_f1: 0.6761
 epoch: 76, train_loss: 0.3387, test_loss: 1.2881, test_f1: 0.6645
 epoch: 77, train_loss: 0.3478, test_loss: 1.1918, test_f1: 0.6527
 epoch: 78, train_loss: 0.3324, test_loss: 1.1681, test_f1: 0.6754
 epoch: 79, train_loss: 0.3315, test_loss: 1.2815, test_f1: 0.6520
 epoch: 80, train_loss: 0.3145, test_loss: 1.3574, test_f1: 0.6563
 epoch: 81, train_loss: 0.3222, test_loss: 1.1082, test_f1: 0.6508
 epoch: 82, train_loss: 0.3204, test_loss: 1.2394, test_f1: 0.6726
 epoch: 83, train_loss: 0.3029, test_loss: 1.2268, test_f1: 0.6660
 epoch: 84, train_loss: 0.3073, test_loss: 1.1331, test_f1: 0.6626
 epoch: 85, train_loss: 0.3198, test_loss: 1.2820, test_f1: 0.6592
 epoch: 86, train_loss: 0.3138, test_loss: 1.2170, test_f1: 0.6857
 epoch: 87, train_loss: 0.3211, test_loss: 1.2461, test_f1: 0.6467
 epoch: 88, train_loss: 0.3023, test_loss: 1.2886, test_f1: 0.6577
 epoch: 89, train_loss: 0.3062, test_loss: 1.1817, test_f1: 0.6895
 epoch: 90, train_loss: 0.2999, test_loss: 1.4106, test_f1: 0.6400
 epoch: 91, train_loss: 0.3259, test_loss: 1.2142, test_f1: 0.6561
 epoch: 92, train_loss: 0.3033, test_loss: 1.2248, test_f1: 0.6699
 epoch: 93, train_loss: 0.2816, test_loss: 1.3112, test_f1: 0.6113
 epoch: 94, train_loss: 0.2920, test_loss: 1.1799, test_f1: 0.6648
 epoch: 95, train_loss: 0.3131, test_loss: 1.1074, test_f1: 0.6541
 epoch: 96, train_loss: 0.2640, test_loss: 1.1604, test_f1: 0.6462
 epoch: 97, train_loss: 0.2876, test_loss: 1.0715, test_f1: 0.6609
 epoch: 98, train_loss: 0.2821, test_loss: 1.1051, test_f1: 0.7070
 epoch: 99, train_loss: 0.2973, test_loss: 1.2575, test_f1: 0.6469
##################ITERATION #5 ****************************************
 epoch: 0, train_loss: 1.2165, test_loss: 1.1361, test_f1: 0.3963
 epoch: 1, train_loss: 1.0532, test_loss: 1.2041, test_f1: 0.4467
 epoch: 2, train_loss: 1.0169, test_loss: 1.1928, test_f1: 0.4306
 epoch: 3, train_loss: 0.9782, test_loss: 1.0113, test_f1: 0.4972
 epoch: 4, train_loss: 0.9377, test_loss: 1.1183, test_f1: 0.4505
 epoch: 5, train_loss: 0.9481, test_loss: 1.0156, test_f1: 0.4272
 epoch: 6, train_loss: 0.9086, test_loss: 0.9491, test_f1: 0.5436
 epoch: 7, train_loss: 0.8935, test_loss: 0.8774, test_f1: 0.5164
 epoch: 8, train_loss: 0.8578, test_loss: 0.9998, test_f1: 0.4791
 epoch: 9, train_loss: 0.8757, test_loss: 0.9291, test_f1: 0.5462
 epoch: 10, train_loss: 0.8311, test_loss: 0.8164, test_f1: 0.5524
 epoch: 11, train_loss: 0.8409, test_loss: 0.9785, test_f1: 0.5715
 epoch: 12, train_loss: 0.8263, test_loss: 0.8607, test_f1: 0.5492
 epoch: 13, train_loss: 0.8187, test_loss: 0.9197, test_f1: 0.5357
 epoch: 14, train_loss: 0.8021, test_loss: 0.8295, test_f1: 0.5452
 epoch: 15, train_loss: 0.8137, test_loss: 0.8670, test_f1: 0.5672
 epoch: 16, train_loss: 0.7903, test_loss: 1.0956, test_f1: 0.5283
 epoch: 17, train_loss: 0.7601, test_loss: 1.0347, test_f1: 0.5341
 epoch: 18, train_loss: 0.7702, test_loss: 1.0082, test_f1: 0.5613
 epoch: 19, train_loss: 0.7783, test_loss: 0.9541, test_f1: 0.5467
 epoch: 20, train_loss: 0.7543, test_loss: 1.0158, test_f1: 0.5769
 epoch: 21, train_loss: 0.7443, test_loss: 0.9482, test_f1: 0.5189
 epoch: 22, train_loss: 0.7286, test_loss: 0.7857, test_f1: 0.5657
 epoch: 23, train_loss: 0.7324, test_loss: 0.9790, test_f1: 0.6162
 epoch: 24, train_loss: 0.7388, test_loss: 0.9848, test_f1: 0.5789
 epoch: 25, train_loss: 0.7191, test_loss: 0.8357, test_f1: 0.6142
 epoch: 26, train_loss: 0.7147, test_loss: 0.8996, test_f1: 0.6348
 epoch: 27, train_loss: 0.6944, test_loss: 0.9196, test_f1: 0.5234
 epoch: 28, train_loss: 0.6790, test_loss: 0.8612, test_f1: 0.5879
 epoch: 29, train_loss: 0.6651, test_loss: 1.2294, test_f1: 0.4717
 epoch: 30, train_loss: 0.6815, test_loss: 0.9105, test_f1: 0.6111
 epoch: 31, train_loss: 0.6623, test_loss: 0.9458, test_f1: 0.6015
 epoch: 32, train_loss: 0.6644, test_loss: 1.0332, test_f1: 0.5835
 epoch: 33, train_loss: 0.6591, test_loss: 1.2641, test_f1: 0.5601
 epoch: 34, train_loss: 0.6564, test_loss: 1.0826, test_f1: 0.5882
 epoch: 35, train_loss: 0.6212, test_loss: 1.0312, test_f1: 0.5895
 epoch: 36, train_loss: 0.6329, test_loss: 1.1496, test_f1: 0.5322
 epoch: 37, train_loss: 0.6297, test_loss: 1.0126, test_f1: 0.6773
 epoch: 38, train_loss: 0.6032, test_loss: 1.0434, test_f1: 0.6457
 epoch: 39, train_loss: 0.6225, test_loss: 0.8223, test_f1: 0.6484
 epoch: 40, train_loss: 0.6080, test_loss: 1.0379, test_f1: 0.6518
 epoch: 41, train_loss: 0.6127, test_loss: 1.1654, test_f1: 0.5831
 epoch: 42, train_loss: 0.6323, test_loss: 0.9268, test_f1: 0.6263
 epoch: 43, train_loss: 0.6053, test_loss: 1.1508, test_f1: 0.6053
 epoch: 44, train_loss: 0.5887, test_loss: 1.1078, test_f1: 0.6149
 epoch: 45, train_loss: 0.5621, test_loss: 1.1301, test_f1: 0.6448
 epoch: 46, train_loss: 0.5762, test_loss: 0.9818, test_f1: 0.6571
 epoch: 47, train_loss: 0.5696, test_loss: 1.1278, test_f1: 0.6146
 epoch: 48, train_loss: 0.5736, test_loss: 0.9795, test_f1: 0.6237
 epoch: 49, train_loss: 0.6003, test_loss: 0.9978, test_f1: 0.6405
 epoch: 50, train_loss: 0.5547, test_loss: 0.9718, test_f1: 0.6275
 epoch: 51, train_loss: 0.5186, test_loss: 0.9823, test_f1: 0.6824
 epoch: 52, train_loss: 0.4799, test_loss: 0.9364, test_f1: 0.6551
 epoch: 53, train_loss: 0.4745, test_loss: 1.0499, test_f1: 0.6877
 epoch: 54, train_loss: 0.4934, test_loss: 1.0818, test_f1: 0.6636
 epoch: 55, train_loss: 0.4656, test_loss: 1.1169, test_f1: 0.6802
 epoch: 56, train_loss: 0.4475, test_loss: 1.0659, test_f1: 0.6407
 epoch: 57, train_loss: 0.4736, test_loss: 1.1220, test_f1: 0.6684
 epoch: 58, train_loss: 0.4545, test_loss: 1.1429, test_f1: 0.6555
 epoch: 59, train_loss: 0.4558, test_loss: 1.0991, test_f1: 0.6381
 epoch: 60, train_loss: 0.4410, test_loss: 1.0803, test_f1: 0.6599
 epoch: 61, train_loss: 0.4486, test_loss: 1.2070, test_f1: 0.6516
 epoch: 62, train_loss: 0.4379, test_loss: 0.9983, test_f1: 0.6395
 epoch: 63, train_loss: 0.4366, test_loss: 1.4134, test_f1: 0.6446
 epoch: 64, train_loss: 0.4313, test_loss: 1.2930, test_f1: 0.6547
 epoch: 65, train_loss: 0.4034, test_loss: 1.2257, test_f1: 0.6521
 epoch: 66, train_loss: 0.4224, test_loss: 1.1801, test_f1: 0.6291
 epoch: 67, train_loss: 0.4437, test_loss: 1.1533, test_f1: 0.6383
 epoch: 68, train_loss: 0.4243, test_loss: 1.0310, test_f1: 0.6594
 epoch: 69, train_loss: 0.4271, test_loss: 1.1073, test_f1: 0.6584
 epoch: 70, train_loss: 0.4184, test_loss: 1.1417, test_f1: 0.6400
 epoch: 71, train_loss: 0.4092, test_loss: 1.2537, test_f1: 0.6551
 epoch: 72, train_loss: 0.4250, test_loss: 1.0788, test_f1: 0.6676
 epoch: 73, train_loss: 0.4094, test_loss: 1.0170, test_f1: 0.6533
 epoch: 74, train_loss: 0.3965, test_loss: 1.1276, test_f1: 0.6601
 epoch: 75, train_loss: 0.3676, test_loss: 1.2409, test_f1: 0.6599
 epoch: 76, train_loss: 0.3776, test_loss: 1.2531, test_f1: 0.6283
 epoch: 77, train_loss: 0.3888, test_loss: 1.2049, test_f1: 0.6561
 epoch: 78, train_loss: 0.3883, test_loss: 1.1752, test_f1: 0.6522
 epoch: 79, train_loss: 0.3656, test_loss: 1.3113, test_f1: 0.6571
 epoch: 80, train_loss: 0.3741, test_loss: 1.2856, test_f1: 0.6428
 epoch: 81, train_loss: 0.3795, test_loss: 1.2423, test_f1: 0.6547
 epoch: 82, train_loss: 0.3728, test_loss: 1.1380, test_f1: 0.6101
 epoch: 83, train_loss: 0.3765, test_loss: 1.1699, test_f1: 0.6325
 epoch: 84, train_loss: 0.3677, test_loss: 1.1504, test_f1: 0.6452
 epoch: 85, train_loss: 0.3487, test_loss: 1.2504, test_f1: 0.6762
 epoch: 86, train_loss: 0.3564, test_loss: 1.3188, test_f1: 0.6305
 epoch: 87, train_loss: 0.3573, test_loss: 1.2805, test_f1: 0.6467
 epoch: 88, train_loss: 0.3436, test_loss: 1.2700, test_f1: 0.6453
 epoch: 89, train_loss: 0.3590, test_loss: 1.5362, test_f1: 0.6395
 epoch: 90, train_loss: 0.3602, test_loss: 1.4440, test_f1: 0.6259
 epoch: 91, train_loss: 0.3365, test_loss: 1.1741, test_f1: 0.6612
 epoch: 92, train_loss: 0.3422, test_loss: 1.1996, test_f1: 0.6587
 epoch: 93, train_loss: 0.3285, test_loss: 1.4494, test_f1: 0.6518
 epoch: 94, train_loss: 0.3181, test_loss: 1.3736, test_f1: 0.6490
 epoch: 95, train_loss: 0.3477, test_loss: 1.2914, test_f1: 0.6530
 epoch: 96, train_loss: 0.3246, test_loss: 1.2998, test_f1: 0.6490
 epoch: 97, train_loss: 0.3403, test_loss: 1.4035, test_f1: 0.6564
 epoch: 98, train_loss: 0.3252, test_loss: 1.3035, test_f1: 0.6408
 epoch: 99, train_loss: 0.3260, test_loss: 1.5935, test_f1: 0.6558
##################ITERATION #6 ****************************************
 epoch: 0, train_loss: 1.2023, test_loss: 1.4783, test_f1: 0.3106
 epoch: 1, train_loss: 0.9960, test_loss: 1.0884, test_f1: 0.4740
 epoch: 2, train_loss: 0.9595, test_loss: 1.2191, test_f1: 0.4562
 epoch: 3, train_loss: 0.9276, test_loss: 1.2908, test_f1: 0.4203
 epoch: 4, train_loss: 0.9291, test_loss: 0.9804, test_f1: 0.5023
 epoch: 5, train_loss: 0.9214, test_loss: 0.9833, test_f1: 0.5445
 epoch: 6, train_loss: 0.9084, test_loss: 1.1072, test_f1: 0.5028
 epoch: 7, train_loss: 0.8765, test_loss: 0.9735, test_f1: 0.5656
 epoch: 8, train_loss: 0.8620, test_loss: 1.0844, test_f1: 0.4705
 epoch: 9, train_loss: 0.8446, test_loss: 0.8900, test_f1: 0.5427
 epoch: 10, train_loss: 0.8391, test_loss: 0.8504, test_f1: 0.5148
 epoch: 11, train_loss: 0.8219, test_loss: 0.9401, test_f1: 0.5046
 epoch: 12, train_loss: 0.8320, test_loss: 0.9266, test_f1: 0.5827
 epoch: 13, train_loss: 0.7991, test_loss: 1.6748, test_f1: 0.4065
 epoch: 14, train_loss: 0.8151, test_loss: 0.9308, test_f1: 0.5386
 epoch: 15, train_loss: 0.7924, test_loss: 0.9286, test_f1: 0.5335
 epoch: 16, train_loss: 0.7852, test_loss: 0.8814, test_f1: 0.5974
 epoch: 17, train_loss: 0.7662, test_loss: 0.8411, test_f1: 0.6090
 epoch: 18, train_loss: 0.7592, test_loss: 0.9728, test_f1: 0.5341
 epoch: 19, train_loss: 0.7340, test_loss: 0.9062, test_f1: 0.6101
 epoch: 20, train_loss: 0.7727, test_loss: 0.8419, test_f1: 0.5628
 epoch: 21, train_loss: 0.7244, test_loss: 0.9107, test_f1: 0.6157
 epoch: 22, train_loss: 0.7260, test_loss: 0.9778, test_f1: 0.5994
 epoch: 23, train_loss: 0.7199, test_loss: 0.9011, test_f1: 0.5756
 epoch: 24, train_loss: 0.7029, test_loss: 0.9461, test_f1: 0.6102
 epoch: 25, train_loss: 0.6995, test_loss: 0.9109, test_f1: 0.5993
 epoch: 26, train_loss: 0.6914, test_loss: 1.0593, test_f1: 0.5705
 epoch: 27, train_loss: 0.6986, test_loss: 1.0499, test_f1: 0.6062
 epoch: 28, train_loss: 0.6769, test_loss: 1.0118, test_f1: 0.6044
 epoch: 29, train_loss: 0.6541, test_loss: 0.7419, test_f1: 0.5829
 epoch: 30, train_loss: 0.6923, test_loss: 0.8761, test_f1: 0.5606
 epoch: 31, train_loss: 0.6654, test_loss: 0.9278, test_f1: 0.6081
 epoch: 32, train_loss: 0.6650, test_loss: 1.2395, test_f1: 0.5289
 epoch: 33, train_loss: 0.6790, test_loss: 0.9479, test_f1: 0.5224
 epoch: 34, train_loss: 0.6592, test_loss: 0.7868, test_f1: 0.5546
 epoch: 35, train_loss: 0.6517, test_loss: 0.9118, test_f1: 0.5889
 epoch: 36, train_loss: 0.6296, test_loss: 0.8812, test_f1: 0.6208
 epoch: 37, train_loss: 0.6183, test_loss: 0.9608, test_f1: 0.5642
 epoch: 38, train_loss: 0.6401, test_loss: 0.9893, test_f1: 0.5884
 epoch: 39, train_loss: 0.6118, test_loss: 0.9130, test_f1: 0.5827
 epoch: 40, train_loss: 0.6138, test_loss: 0.9580, test_f1: 0.5855
 epoch: 41, train_loss: 0.6075, test_loss: 0.9695, test_f1: 0.5825
 epoch: 42, train_loss: 0.5950, test_loss: 1.2330, test_f1: 0.5750
 epoch: 43, train_loss: 0.5719, test_loss: 1.2203, test_f1: 0.5847
 epoch: 44, train_loss: 0.6085, test_loss: 1.0272, test_f1: 0.6200
 epoch: 45, train_loss: 0.6085, test_loss: 0.8724, test_f1: 0.5880
 epoch: 46, train_loss: 0.5902, test_loss: 0.9713, test_f1: 0.6238
 epoch: 47, train_loss: 0.5753, test_loss: 0.9241, test_f1: 0.6092
 epoch: 48, train_loss: 0.5692, test_loss: 0.9151, test_f1: 0.6283
 epoch: 49, train_loss: 0.5593, test_loss: 1.1486, test_f1: 0.5336
 epoch: 50, train_loss: 0.5527, test_loss: 1.1520, test_f1: 0.6203
 epoch: 51, train_loss: 0.5055, test_loss: 0.9943, test_f1: 0.6441
 epoch: 52, train_loss: 0.4862, test_loss: 1.0206, test_f1: 0.6456
 epoch: 53, train_loss: 0.4717, test_loss: 1.0812, test_f1: 0.6338
 epoch: 54, train_loss: 0.4661, test_loss: 1.0520, test_f1: 0.6555
 epoch: 55, train_loss: 0.4613, test_loss: 1.2068, test_f1: 0.6434
 epoch: 56, train_loss: 0.4665, test_loss: 1.0376, test_f1: 0.6548
 epoch: 57, train_loss: 0.4685, test_loss: 1.0827, test_f1: 0.6431
 epoch: 58, train_loss: 0.4406, test_loss: 1.0691, test_f1: 0.6337
 epoch: 59, train_loss: 0.4397, test_loss: 1.0131, test_f1: 0.6317
 epoch: 60, train_loss: 0.4554, test_loss: 1.0180, test_f1: 0.6257
 epoch: 61, train_loss: 0.4094, test_loss: 1.0223, test_f1: 0.6554
 epoch: 62, train_loss: 0.4223, test_loss: 0.9905, test_f1: 0.6544
 epoch: 63, train_loss: 0.4202, test_loss: 0.9527, test_f1: 0.6412
 epoch: 64, train_loss: 0.4356, test_loss: 1.1829, test_f1: 0.6491
 epoch: 65, train_loss: 0.4192, test_loss: 1.1744, test_f1: 0.6440
 epoch: 66, train_loss: 0.4275, test_loss: 1.1498, test_f1: 0.6430
 epoch: 67, train_loss: 0.4205, test_loss: 1.1156, test_f1: 0.6457
 epoch: 68, train_loss: 0.4315, test_loss: 0.9249, test_f1: 0.6383
 epoch: 69, train_loss: 0.4034, test_loss: 1.1130, test_f1: 0.6426
 epoch: 70, train_loss: 0.3971, test_loss: 1.0677, test_f1: 0.6549
 epoch: 71, train_loss: 0.3947, test_loss: 1.0849, test_f1: 0.6446
 epoch: 72, train_loss: 0.3908, test_loss: 1.0316, test_f1: 0.6560
 epoch: 73, train_loss: 0.3857, test_loss: 1.1443, test_f1: 0.6666
 epoch: 74, train_loss: 0.3755, test_loss: 1.1107, test_f1: 0.6345
 epoch: 75, train_loss: 0.4104, test_loss: 1.1742, test_f1: 0.6330
 epoch: 76, train_loss: 0.3692, test_loss: 1.1656, test_f1: 0.6501
 epoch: 77, train_loss: 0.3813, test_loss: 1.0608, test_f1: 0.6492
 epoch: 78, train_loss: 0.3902, test_loss: 1.1768, test_f1: 0.6500
 epoch: 79, train_loss: 0.3636, test_loss: 1.3746, test_f1: 0.6353
 epoch: 80, train_loss: 0.3715, test_loss: 1.2567, test_f1: 0.6388
 epoch: 81, train_loss: 0.3634, test_loss: 1.1076, test_f1: 0.6582
 epoch: 82, train_loss: 0.3721, test_loss: 1.1342, test_f1: 0.6687
 epoch: 83, train_loss: 0.3701, test_loss: 1.1724, test_f1: 0.6310
 epoch: 84, train_loss: 0.3649, test_loss: 1.3435, test_f1: 0.6378
 epoch: 85, train_loss: 0.3641, test_loss: 1.0634, test_f1: 0.6547
 epoch: 86, train_loss: 0.3644, test_loss: 1.1137, test_f1: 0.6747
 epoch: 87, train_loss: 0.3624, test_loss: 1.0914, test_f1: 0.6537
 epoch: 88, train_loss: 0.3431, test_loss: 1.2801, test_f1: 0.6293
 epoch: 89, train_loss: 0.3393, test_loss: 1.0820, test_f1: 0.6660
 epoch: 90, train_loss: 0.3511, test_loss: 1.2248, test_f1: 0.6506
 epoch: 91, train_loss: 0.3669, test_loss: 1.1565, test_f1: 0.6571
 epoch: 92, train_loss: 0.3492, test_loss: 1.1359, test_f1: 0.6732
 epoch: 93, train_loss: 0.3384, test_loss: 1.1060, test_f1: 0.6445
 epoch: 94, train_loss: 0.3373, test_loss: 1.0933, test_f1: 0.6752
 epoch: 95, train_loss: 0.3285, test_loss: 1.2587, test_f1: 0.6601
 epoch: 96, train_loss: 0.3283, test_loss: 1.1813, test_f1: 0.6737
 epoch: 97, train_loss: 0.3176, test_loss: 1.2260, test_f1: 0.6398
 epoch: 98, train_loss: 0.3005, test_loss: 1.2201, test_f1: 0.6535
 epoch: 99, train_loss: 0.3023, test_loss: 1.1536, test_f1: 0.6590
##################ITERATION #7 ****************************************
 epoch: 0, train_loss: 1.2584, test_loss: 1.1467, test_f1: 0.3955
 epoch: 1, train_loss: 1.0282, test_loss: 1.2900, test_f1: 0.3955
 epoch: 2, train_loss: 0.9845, test_loss: 1.1440, test_f1: 0.3866
 epoch: 3, train_loss: 0.9522, test_loss: 0.9510, test_f1: 0.5227
 epoch: 4, train_loss: 0.9306, test_loss: 1.0006, test_f1: 0.4190
 epoch: 5, train_loss: 0.9148, test_loss: 1.0198, test_f1: 0.4984
 epoch: 6, train_loss: 0.9027, test_loss: 0.9244, test_f1: 0.5146
 epoch: 7, train_loss: 0.8698, test_loss: 0.9289, test_f1: 0.5158
 epoch: 8, train_loss: 0.8806, test_loss: 0.9174, test_f1: 0.5084
 epoch: 9, train_loss: 0.8594, test_loss: 0.9204, test_f1: 0.5320
 epoch: 10, train_loss: 0.8565, test_loss: 1.3828, test_f1: 0.3927
 epoch: 11, train_loss: 0.8430, test_loss: 0.8336, test_f1: 0.5332
 epoch: 12, train_loss: 0.8532, test_loss: 0.8311, test_f1: 0.5216
 epoch: 13, train_loss: 0.8063, test_loss: 0.8472, test_f1: 0.5360
 epoch: 14, train_loss: 0.7945, test_loss: 0.8270, test_f1: 0.5520
 epoch: 15, train_loss: 0.7859, test_loss: 0.9327, test_f1: 0.5073
 epoch: 16, train_loss: 0.7950, test_loss: 0.9263, test_f1: 0.5055
 epoch: 17, train_loss: 0.7948, test_loss: 0.8510, test_f1: 0.5415
 epoch: 18, train_loss: 0.7669, test_loss: 0.8470, test_f1: 0.5513
 epoch: 19, train_loss: 0.7571, test_loss: 0.8535, test_f1: 0.5724
 epoch: 20, train_loss: 0.7542, test_loss: 0.7917, test_f1: 0.5707
 epoch: 21, train_loss: 0.7543, test_loss: 0.8350, test_f1: 0.5251
 epoch: 22, train_loss: 0.7419, test_loss: 0.9071, test_f1: 0.5405
 epoch: 23, train_loss: 0.7268, test_loss: 0.9917, test_f1: 0.5450
 epoch: 24, train_loss: 0.7359, test_loss: 0.9125, test_f1: 0.5744
 epoch: 25, train_loss: 0.6967, test_loss: 0.8438, test_f1: 0.5691
 epoch: 26, train_loss: 0.6805, test_loss: 0.8183, test_f1: 0.5580
 epoch: 27, train_loss: 0.6896, test_loss: 0.8311, test_f1: 0.6107
 epoch: 28, train_loss: 0.6756, test_loss: 1.0291, test_f1: 0.6354
 epoch: 29, train_loss: 0.6659, test_loss: 0.8134, test_f1: 0.5294
 epoch: 30, train_loss: 0.6706, test_loss: 0.9751, test_f1: 0.5634
 epoch: 31, train_loss: 0.6511, test_loss: 1.1526, test_f1: 0.5267
 epoch: 32, train_loss: 0.6537, test_loss: 0.9064, test_f1: 0.6398
 epoch: 33, train_loss: 0.6374, test_loss: 0.8987, test_f1: 0.5995
 epoch: 34, train_loss: 0.6420, test_loss: 0.7404, test_f1: 0.6656
 epoch: 35, train_loss: 0.6199, test_loss: 0.8014, test_f1: 0.5827
 epoch: 36, train_loss: 0.6164, test_loss: 0.7389, test_f1: 0.5870
 epoch: 37, train_loss: 0.6219, test_loss: 0.8388, test_f1: 0.5936
 epoch: 38, train_loss: 0.6306, test_loss: 0.7789, test_f1: 0.6379
 epoch: 39, train_loss: 0.6119, test_loss: 0.7250, test_f1: 0.6510
 epoch: 40, train_loss: 0.6206, test_loss: 0.7951, test_f1: 0.6914
 epoch: 41, train_loss: 0.5955, test_loss: 0.7729, test_f1: 0.6465
 epoch: 42, train_loss: 0.5923, test_loss: 0.7793, test_f1: 0.6065
 epoch: 43, train_loss: 0.5938, test_loss: 0.8167, test_f1: 0.6708
 epoch: 44, train_loss: 0.5670, test_loss: 0.8731, test_f1: 0.6618
 epoch: 45, train_loss: 0.5759, test_loss: 1.0448, test_f1: 0.6235
 epoch: 46, train_loss: 0.5662, test_loss: 0.8954, test_f1: 0.6285
 epoch: 47, train_loss: 0.5512, test_loss: 0.8436, test_f1: 0.6753
 epoch: 48, train_loss: 0.5525, test_loss: 0.7943, test_f1: 0.6396
 epoch: 49, train_loss: 0.5878, test_loss: 0.8610, test_f1: 0.6536
 epoch: 50, train_loss: 0.5297, test_loss: 0.8156, test_f1: 0.6633
 epoch: 51, train_loss: 0.4876, test_loss: 0.7799, test_f1: 0.7010
 epoch: 52, train_loss: 0.4721, test_loss: 0.7384, test_f1: 0.6864
 epoch: 53, train_loss: 0.4739, test_loss: 0.7398, test_f1: 0.6738
 epoch: 54, train_loss: 0.4497, test_loss: 0.8621, test_f1: 0.6796
 epoch: 55, train_loss: 0.4510, test_loss: 0.8323, test_f1: 0.6735
 epoch: 56, train_loss: 0.4425, test_loss: 0.7944, test_f1: 0.7043
 epoch: 57, train_loss: 0.4518, test_loss: 0.8851, test_f1: 0.6742
 epoch: 58, train_loss: 0.4383, test_loss: 0.8544, test_f1: 0.6864
 epoch: 59, train_loss: 0.4276, test_loss: 0.9286, test_f1: 0.6714
 epoch: 60, train_loss: 0.4233, test_loss: 0.8255, test_f1: 0.6856
 epoch: 61, train_loss: 0.4341, test_loss: 0.8999, test_f1: 0.6589
 epoch: 62, train_loss: 0.4146, test_loss: 0.9053, test_f1: 0.6659
 epoch: 63, train_loss: 0.4189, test_loss: 0.7845, test_f1: 0.6785
 epoch: 64, train_loss: 0.4059, test_loss: 0.9318, test_f1: 0.6531
 epoch: 65, train_loss: 0.3988, test_loss: 0.8272, test_f1: 0.6679
 epoch: 66, train_loss: 0.4147, test_loss: 0.8333, test_f1: 0.6895
 epoch: 67, train_loss: 0.4176, test_loss: 0.8697, test_f1: 0.6739
 epoch: 68, train_loss: 0.4357, test_loss: 0.6891, test_f1: 0.6957
 epoch: 69, train_loss: 0.3994, test_loss: 0.7779, test_f1: 0.6823
 epoch: 70, train_loss: 0.4070, test_loss: 0.9289, test_f1: 0.6728
 epoch: 71, train_loss: 0.4092, test_loss: 0.9130, test_f1: 0.6967
 epoch: 72, train_loss: 0.3803, test_loss: 0.9116, test_f1: 0.7031
 epoch: 73, train_loss: 0.3750, test_loss: 0.9537, test_f1: 0.6729
 epoch: 74, train_loss: 0.3838, test_loss: 0.9761, test_f1: 0.6814
 epoch: 75, train_loss: 0.4075, test_loss: 0.9783, test_f1: 0.6531
 epoch: 76, train_loss: 0.3793, test_loss: 1.0132, test_f1: 0.6927
 epoch: 77, train_loss: 0.3735, test_loss: 0.8626, test_f1: 0.7145
 epoch: 78, train_loss: 0.3861, test_loss: 1.1235, test_f1: 0.6529
 epoch: 79, train_loss: 0.3608, test_loss: 1.0159, test_f1: 0.6904
 epoch: 80, train_loss: 0.3863, test_loss: 1.0804, test_f1: 0.6472
 epoch: 81, train_loss: 0.3650, test_loss: 1.0266, test_f1: 0.6828
 epoch: 82, train_loss: 0.3738, test_loss: 1.0077, test_f1: 0.6636
 epoch: 83, train_loss: 0.3650, test_loss: 0.9830, test_f1: 0.6709
 epoch: 84, train_loss: 0.3699, test_loss: 1.0319, test_f1: 0.6751
 epoch: 85, train_loss: 0.3466, test_loss: 1.0230, test_f1: 0.6900
 epoch: 86, train_loss: 0.3528, test_loss: 1.0826, test_f1: 0.6408
 epoch: 87, train_loss: 0.3588, test_loss: 1.0829, test_f1: 0.6570
 epoch: 88, train_loss: 0.3572, test_loss: 1.0029, test_f1: 0.6663
 epoch: 89, train_loss: 0.3410, test_loss: 0.9542, test_f1: 0.6751
 epoch: 90, train_loss: 0.3468, test_loss: 0.9600, test_f1: 0.6968
 epoch: 91, train_loss: 0.3465, test_loss: 0.9168, test_f1: 0.6576
 epoch: 92, train_loss: 0.3437, test_loss: 1.1239, test_f1: 0.6643
 epoch: 93, train_loss: 0.3702, test_loss: 0.9492, test_f1: 0.6437
 epoch: 94, train_loss: 0.3574, test_loss: 1.0187, test_f1: 0.6596
 epoch: 95, train_loss: 0.3249, test_loss: 1.0280, test_f1: 0.6595
 epoch: 96, train_loss: 0.3295, test_loss: 1.0221, test_f1: 0.6595
 epoch: 97, train_loss: 0.3219, test_loss: 1.0046, test_f1: 0.6611
 epoch: 98, train_loss: 0.3018, test_loss: 0.9257, test_f1: 0.6764
 epoch: 99, train_loss: 0.3151, test_loss: 1.2189, test_f1: 0.6625
##################ITERATION #8 ****************************************
 epoch: 0, train_loss: 1.2244, test_loss: 1.2478, test_f1: 0.4519
 epoch: 1, train_loss: 0.9977, test_loss: 1.1146, test_f1: 0.4949
 epoch: 2, train_loss: 0.9635, test_loss: 1.0190, test_f1: 0.5029
 epoch: 3, train_loss: 0.9504, test_loss: 0.9977, test_f1: 0.5549
 epoch: 4, train_loss: 0.9234, test_loss: 0.9189, test_f1: 0.5664
 epoch: 5, train_loss: 0.9028, test_loss: 1.0444, test_f1: 0.4822
 epoch: 6, train_loss: 0.9022, test_loss: 1.1487, test_f1: 0.4882
 epoch: 7, train_loss: 0.8841, test_loss: 1.1763, test_f1: 0.4486
 epoch: 8, train_loss: 0.8753, test_loss: 0.9902, test_f1: 0.5479
 epoch: 9, train_loss: 0.8694, test_loss: 1.0489, test_f1: 0.4556
 epoch: 10, train_loss: 0.8694, test_loss: 1.0065, test_f1: 0.5385
 epoch: 11, train_loss: 0.8514, test_loss: 0.9234, test_f1: 0.5793
 epoch: 12, train_loss: 0.8368, test_loss: 1.0485, test_f1: 0.5501
 epoch: 13, train_loss: 0.8266, test_loss: 0.8580, test_f1: 0.5305
 epoch: 14, train_loss: 0.8139, test_loss: 0.8790, test_f1: 0.5490
 epoch: 15, train_loss: 0.7849, test_loss: 0.9019, test_f1: 0.5793
 epoch: 16, train_loss: 0.7929, test_loss: 0.9126, test_f1: 0.6098
 epoch: 17, train_loss: 0.8099, test_loss: 0.8805, test_f1: 0.5748
 epoch: 18, train_loss: 0.8105, test_loss: 0.8782, test_f1: 0.5412
 epoch: 19, train_loss: 0.7911, test_loss: 1.0753, test_f1: 0.5300
 epoch: 20, train_loss: 0.7664, test_loss: 0.8032, test_f1: 0.6185
 epoch: 21, train_loss: 0.7544, test_loss: 0.9802, test_f1: 0.5609
 epoch: 22, train_loss: 0.7389, test_loss: 0.9953, test_f1: 0.5343
 epoch: 23, train_loss: 0.7335, test_loss: 0.9735, test_f1: 0.6177
 epoch: 24, train_loss: 0.7397, test_loss: 0.8140, test_f1: 0.6028
 epoch: 25, train_loss: 0.7159, test_loss: 0.8755, test_f1: 0.5987
 epoch: 26, train_loss: 0.7253, test_loss: 0.8890, test_f1: 0.5763
 epoch: 27, train_loss: 0.7055, test_loss: 0.9847, test_f1: 0.5799
 epoch: 28, train_loss: 0.6830, test_loss: 1.0273, test_f1: 0.6199
 epoch: 29, train_loss: 0.7151, test_loss: 0.9509, test_f1: 0.6248
 epoch: 30, train_loss: 0.6736, test_loss: 0.8144, test_f1: 0.6603
 epoch: 31, train_loss: 0.6492, test_loss: 0.9954, test_f1: 0.6412
 epoch: 32, train_loss: 0.7044, test_loss: 0.9991, test_f1: 0.5876
 epoch: 33, train_loss: 0.6671, test_loss: 0.9027, test_f1: 0.6454
 epoch: 34, train_loss: 0.6545, test_loss: 0.8814, test_f1: 0.6358
 epoch: 35, train_loss: 0.6519, test_loss: 0.8114, test_f1: 0.6476
 epoch: 36, train_loss: 0.6401, test_loss: 0.9640, test_f1: 0.6003
 epoch: 37, train_loss: 0.6509, test_loss: 0.9501, test_f1: 0.6084
 epoch: 38, train_loss: 0.6407, test_loss: 0.8899, test_f1: 0.6239
 epoch: 39, train_loss: 0.6356, test_loss: 0.9344, test_f1: 0.6091
 epoch: 40, train_loss: 0.5993, test_loss: 0.9674, test_f1: 0.6353
 epoch: 41, train_loss: 0.5942, test_loss: 0.8899, test_f1: 0.6672
 epoch: 42, train_loss: 0.6038, test_loss: 0.9031, test_f1: 0.6347
 epoch: 43, train_loss: 0.5939, test_loss: 0.8766, test_f1: 0.6366
 epoch: 44, train_loss: 0.5788, test_loss: 0.8824, test_f1: 0.6372
 epoch: 45, train_loss: 0.6308, test_loss: 0.9171, test_f1: 0.6278
 epoch: 46, train_loss: 0.5915, test_loss: 1.0007, test_f1: 0.6095
 epoch: 47, train_loss: 0.5634, test_loss: 1.0301, test_f1: 0.6108
 epoch: 48, train_loss: 0.5837, test_loss: 1.1291, test_f1: 0.6156
 epoch: 49, train_loss: 0.5626, test_loss: 0.9144, test_f1: 0.6522
 epoch: 50, train_loss: 0.5634, test_loss: 0.9868, test_f1: 0.6600
 epoch: 51, train_loss: 0.5134, test_loss: 1.0778, test_f1: 0.6495
 epoch: 52, train_loss: 0.4995, test_loss: 1.0345, test_f1: 0.6530
 epoch: 53, train_loss: 0.4911, test_loss: 0.9572, test_f1: 0.6623
 epoch: 54, train_loss: 0.4916, test_loss: 0.9407, test_f1: 0.6428
 epoch: 55, train_loss: 0.4675, test_loss: 1.0071, test_f1: 0.6645
 epoch: 56, train_loss: 0.4499, test_loss: 0.9771, test_f1: 0.6586
 epoch: 57, train_loss: 0.4533, test_loss: 1.0593, test_f1: 0.6444
 epoch: 58, train_loss: 0.4409, test_loss: 1.0219, test_f1: 0.6440
 epoch: 59, train_loss: 0.4282, test_loss: 1.0177, test_f1: 0.6329
 epoch: 60, train_loss: 0.4248, test_loss: 0.9766, test_f1: 0.6639
 epoch: 61, train_loss: 0.4392, test_loss: 0.9621, test_f1: 0.6553
 epoch: 62, train_loss: 0.4559, test_loss: 0.9949, test_f1: 0.6681
 epoch: 63, train_loss: 0.4242, test_loss: 1.0685, test_f1: 0.6357
 epoch: 64, train_loss: 0.4342, test_loss: 0.9601, test_f1: 0.6557
 epoch: 65, train_loss: 0.4413, test_loss: 0.9468, test_f1: 0.6625
 epoch: 66, train_loss: 0.3995, test_loss: 1.0309, test_f1: 0.6665
 epoch: 67, train_loss: 0.4292, test_loss: 0.8649, test_f1: 0.6767
 epoch: 68, train_loss: 0.4170, test_loss: 1.0208, test_f1: 0.6404
 epoch: 69, train_loss: 0.3976, test_loss: 1.0137, test_f1: 0.6662
 epoch: 70, train_loss: 0.4165, test_loss: 1.0103, test_f1: 0.6183
 epoch: 71, train_loss: 0.3985, test_loss: 1.0578, test_f1: 0.6552
 epoch: 72, train_loss: 0.3879, test_loss: 1.1071, test_f1: 0.6352
 epoch: 73, train_loss: 0.3841, test_loss: 1.0464, test_f1: 0.6559
 epoch: 74, train_loss: 0.3884, test_loss: 1.0115, test_f1: 0.6482
 epoch: 75, train_loss: 0.4085, test_loss: 1.0445, test_f1: 0.6546
 epoch: 76, train_loss: 0.3837, test_loss: 1.0091, test_f1: 0.6607
 epoch: 77, train_loss: 0.3894, test_loss: 0.9875, test_f1: 0.6651
 epoch: 78, train_loss: 0.3796, test_loss: 1.0487, test_f1: 0.6335
 epoch: 79, train_loss: 0.3737, test_loss: 1.0549, test_f1: 0.6648
 epoch: 80, train_loss: 0.3584, test_loss: 1.1993, test_f1: 0.6584
 epoch: 81, train_loss: 0.3782, test_loss: 1.2338, test_f1: 0.6417
 epoch: 82, train_loss: 0.3554, test_loss: 1.1036, test_f1: 0.6683
 epoch: 83, train_loss: 0.3519, test_loss: 1.2857, test_f1: 0.6403
 epoch: 84, train_loss: 0.3716, test_loss: 1.0401, test_f1: 0.6357
 epoch: 85, train_loss: 0.3739, test_loss: 1.0492, test_f1: 0.6396
 epoch: 86, train_loss: 0.3692, test_loss: 1.0322, test_f1: 0.6671
 epoch: 87, train_loss: 0.3590, test_loss: 1.1086, test_f1: 0.6446
 epoch: 88, train_loss: 0.3902, test_loss: 1.2379, test_f1: 0.6720
 epoch: 89, train_loss: 0.3504, test_loss: 1.2923, test_f1: 0.6368
 epoch: 90, train_loss: 0.3539, test_loss: 1.0954, test_f1: 0.6843
 epoch: 91, train_loss: 0.3249, test_loss: 1.1197, test_f1: 0.6806
 epoch: 92, train_loss: 0.3211, test_loss: 1.2472, test_f1: 0.6678
 epoch: 93, train_loss: 0.3333, test_loss: 1.4627, test_f1: 0.5918
 epoch: 94, train_loss: 0.3588, test_loss: 1.0937, test_f1: 0.7022
 epoch: 95, train_loss: 0.3192, test_loss: 1.2136, test_f1: 0.6551
 epoch: 96, train_loss: 0.3356, test_loss: 1.2286, test_f1: 0.6482
 epoch: 97, train_loss: 0.3594, test_loss: 1.0840, test_f1: 0.6782
 epoch: 98, train_loss: 0.3341, test_loss: 1.2485, test_f1: 0.6562
 epoch: 99, train_loss: 0.3297, test_loss: 1.0763, test_f1: 0.6695
##################ITERATION #9 ****************************************
 epoch: 0, train_loss: 1.2289, test_loss: 1.1273, test_f1: 0.4476
 epoch: 1, train_loss: 1.0219, test_loss: 1.0094, test_f1: 0.5118
 epoch: 2, train_loss: 0.9815, test_loss: 1.0520, test_f1: 0.5208
 epoch: 3, train_loss: 0.9577, test_loss: 1.0438, test_f1: 0.4639
 epoch: 4, train_loss: 0.9327, test_loss: 1.0567, test_f1: 0.4428
 epoch: 5, train_loss: 0.9287, test_loss: 0.9340, test_f1: 0.5015
 epoch: 6, train_loss: 0.9002, test_loss: 1.0062, test_f1: 0.5114
 epoch: 7, train_loss: 0.8890, test_loss: 1.0443, test_f1: 0.4320
 epoch: 8, train_loss: 0.8645, test_loss: 0.9946, test_f1: 0.5370
 epoch: 9, train_loss: 0.8553, test_loss: 0.9197, test_f1: 0.5403
 epoch: 10, train_loss: 0.8571, test_loss: 0.9582, test_f1: 0.4729
 epoch: 11, train_loss: 0.8378, test_loss: 1.0328, test_f1: 0.4828
 epoch: 12, train_loss: 0.8350, test_loss: 0.8779, test_f1: 0.5693
 epoch: 13, train_loss: 0.8054, test_loss: 0.9392, test_f1: 0.5624
 epoch: 14, train_loss: 0.8074, test_loss: 1.0988, test_f1: 0.5250
 epoch: 15, train_loss: 0.8062, test_loss: 0.9427, test_f1: 0.5639
 epoch: 16, train_loss: 0.7976, test_loss: 1.0494, test_f1: 0.4771
 epoch: 17, train_loss: 0.8092, test_loss: 0.8765, test_f1: 0.5396
 epoch: 18, train_loss: 0.8004, test_loss: 0.8235, test_f1: 0.5588
 epoch: 19, train_loss: 0.7680, test_loss: 0.8281, test_f1: 0.5651
 epoch: 20, train_loss: 0.7734, test_loss: 0.9748, test_f1: 0.5449
 epoch: 21, train_loss: 0.7491, test_loss: 0.8382, test_f1: 0.6419
 epoch: 22, train_loss: 0.7461, test_loss: 0.8099, test_f1: 0.5875
 epoch: 23, train_loss: 0.7314, test_loss: 0.9286, test_f1: 0.5623
 epoch: 24, train_loss: 0.7276, test_loss: 0.8542, test_f1: 0.6215
 epoch: 25, train_loss: 0.7572, test_loss: 0.8533, test_f1: 0.5325
 epoch: 26, train_loss: 0.7393, test_loss: 0.8565, test_f1: 0.5880
 epoch: 27, train_loss: 0.7008, test_loss: 1.0442, test_f1: 0.5860
 epoch: 28, train_loss: 0.7184, test_loss: 0.9588, test_f1: 0.5686
 epoch: 29, train_loss: 0.7000, test_loss: 0.9289, test_f1: 0.5846
 epoch: 30, train_loss: 0.6732, test_loss: 0.7782, test_f1: 0.6401
 epoch: 31, train_loss: 0.6863, test_loss: 0.7798, test_f1: 0.5957
 epoch: 32, train_loss: 0.6502, test_loss: 0.8129, test_f1: 0.6326
 epoch: 33, train_loss: 0.6731, test_loss: 0.8385, test_f1: 0.6027
 epoch: 34, train_loss: 0.6772, test_loss: 0.8496, test_f1: 0.5736
 epoch: 35, train_loss: 0.6597, test_loss: 0.8151, test_f1: 0.6248
 epoch: 36, train_loss: 0.6638, test_loss: 0.7286, test_f1: 0.6384
 epoch: 37, train_loss: 0.6663, test_loss: 0.8058, test_f1: 0.5767
 epoch: 38, train_loss: 0.6372, test_loss: 0.7915, test_f1: 0.6067
 epoch: 39, train_loss: 0.6439, test_loss: 0.7892, test_f1: 0.6243
 epoch: 40, train_loss: 0.6304, test_loss: 0.8143, test_f1: 0.6214
 epoch: 41, train_loss: 0.6113, test_loss: 0.7762, test_f1: 0.6540
 epoch: 42, train_loss: 0.6219, test_loss: 0.8090, test_f1: 0.5566
 epoch: 43, train_loss: 0.6291, test_loss: 0.7487, test_f1: 0.6568
 epoch: 44, train_loss: 0.6185, test_loss: 0.8432, test_f1: 0.5996
 epoch: 45, train_loss: 0.6058, test_loss: 0.7915, test_f1: 0.6358
 epoch: 46, train_loss: 0.5823, test_loss: 0.8841, test_f1: 0.6076
 epoch: 47, train_loss: 0.6038, test_loss: 0.8046, test_f1: 0.6276
 epoch: 48, train_loss: 0.5811, test_loss: 0.8302, test_f1: 0.6609
 epoch: 49, train_loss: 0.5959, test_loss: 0.8318, test_f1: 0.6438
 epoch: 50, train_loss: 0.5832, test_loss: 0.8806, test_f1: 0.6293
 epoch: 51, train_loss: 0.5400, test_loss: 0.8145, test_f1: 0.6612
 epoch: 52, train_loss: 0.5075, test_loss: 0.8012, test_f1: 0.6763
 epoch: 53, train_loss: 0.5056, test_loss: 0.7908, test_f1: 0.6820
 epoch: 54, train_loss: 0.4866, test_loss: 0.7856, test_f1: 0.6692
 epoch: 55, train_loss: 0.4819, test_loss: 0.7014, test_f1: 0.6856
 epoch: 56, train_loss: 0.4895, test_loss: 0.7420, test_f1: 0.6532
 epoch: 57, train_loss: 0.4934, test_loss: 0.8258, test_f1: 0.6355
 epoch: 58, train_loss: 0.4707, test_loss: 0.8033, test_f1: 0.6662
 epoch: 59, train_loss: 0.4416, test_loss: 0.8394, test_f1: 0.6924
 epoch: 60, train_loss: 0.4490, test_loss: 0.7626, test_f1: 0.6945
 epoch: 61, train_loss: 0.4526, test_loss: 0.8419, test_f1: 0.6604
 epoch: 62, train_loss: 0.4412, test_loss: 0.7865, test_f1: 0.6693
 epoch: 63, train_loss: 0.4516, test_loss: 0.7682, test_f1: 0.6680
 epoch: 64, train_loss: 0.4473, test_loss: 0.8332, test_f1: 0.6288
 epoch: 65, train_loss: 0.4444, test_loss: 0.8315, test_f1: 0.6571
 epoch: 66, train_loss: 0.4573, test_loss: 0.7685, test_f1: 0.6445
 epoch: 67, train_loss: 0.4454, test_loss: 0.8675, test_f1: 0.6597
 epoch: 68, train_loss: 0.4324, test_loss: 0.9311, test_f1: 0.6529
 epoch: 69, train_loss: 0.4286, test_loss: 0.7316, test_f1: 0.6808
 epoch: 70, train_loss: 0.4114, test_loss: 0.8343, test_f1: 0.6939
 epoch: 71, train_loss: 0.4201, test_loss: 0.7657, test_f1: 0.6468
 epoch: 72, train_loss: 0.4014, test_loss: 0.7739, test_f1: 0.6870
 epoch: 73, train_loss: 0.4316, test_loss: 0.8959, test_f1: 0.6758
 epoch: 74, train_loss: 0.4158, test_loss: 0.8630, test_f1: 0.6828
 epoch: 75, train_loss: 0.3970, test_loss: 0.9006, test_f1: 0.6582
 epoch: 76, train_loss: 0.4339, test_loss: 0.9148, test_f1: 0.6755
 epoch: 77, train_loss: 0.4051, test_loss: 0.7529, test_f1: 0.7081
 epoch: 78, train_loss: 0.4163, test_loss: 0.8665, test_f1: 0.6903
 epoch: 79, train_loss: 0.4207, test_loss: 0.8246, test_f1: 0.6795
 epoch: 80, train_loss: 0.3850, test_loss: 0.8057, test_f1: 0.6942
 epoch: 81, train_loss: 0.3818, test_loss: 0.7937, test_f1: 0.6935
 epoch: 82, train_loss: 0.3719, test_loss: 0.8685, test_f1: 0.6800
 epoch: 83, train_loss: 0.3963, test_loss: 0.7566, test_f1: 0.6636
 epoch: 84, train_loss: 0.3815, test_loss: 0.9955, test_f1: 0.6707
 epoch: 85, train_loss: 0.4065, test_loss: 0.8605, test_f1: 0.6777
 epoch: 86, train_loss: 0.3674, test_loss: 1.0188, test_f1: 0.6605
 epoch: 87, train_loss: 0.3555, test_loss: 0.8933, test_f1: 0.6702
 epoch: 88, train_loss: 0.3708, test_loss: 0.8529, test_f1: 0.6842
 epoch: 89, train_loss: 0.3696, test_loss: 0.8676, test_f1: 0.6919
 epoch: 90, train_loss: 0.3570, test_loss: 0.8370, test_f1: 0.6987
 epoch: 91, train_loss: 0.3541, test_loss: 0.9189, test_f1: 0.7048
 epoch: 92, train_loss: 0.3384, test_loss: 0.9825, test_f1: 0.6680
 epoch: 93, train_loss: 0.3411, test_loss: 1.0337, test_f1: 0.6785
 epoch: 94, train_loss: 0.3464, test_loss: 0.9539, test_f1: 0.6729
 epoch: 95, train_loss: 0.3650, test_loss: 0.8373, test_f1: 0.6957
 epoch: 96, train_loss: 0.3478, test_loss: 0.9688, test_f1: 0.6754
 epoch: 97, train_loss: 0.3502, test_loss: 0.9159, test_f1: 0.6725
 epoch: 98, train_loss: 0.3276, test_loss: 0.8380, test_f1: 0.6816
 epoch: 99, train_loss: 0.3378, test_loss: 0.9707, test_f1: 0.6465

Training completed in 594.30 seconds
Best F1: 0.7162 at epoch 68
Mean F1 across iterations: 0.7037  0.0125
========================FINAL RESULTS================================
FEGIN weighted F1: 0.7162  0.0125
python main.py --data ltspice_examples --representation component_pin --model FEGIN --layers 2 --hiddens 128 --batch_size 64 --lr 0.01 --emb_size 512 --epochs 100 --save_appendix component_pin_L2_H128_BS64_LR0.01_E512 --no_val
-----



STDERR:
  File "main.py", line 370, in <module>
    main()
  File "main.py", line 254, in main
    dataset = dataset_class(
  File "/home/philip/projects/ltspice_examples_code_repo/Circuit-Completion-Using-GNNs/component_classification_with_link_prediction_head/evaluation/FEGIN/kernel/circuit_datasets.py", line 15, in __init__
    self.data, self.slices = torch.load(self.processed_paths[0])
  File "/home/philip/.local/lib/python3.8/site-packages/torch/serialization.py", line 1040, in load
    warnings.warn(
  File "/usr/lib/python3.8/warnings.py", line 109, in _showwarnmsg
    sw(msg.message, msg.category, msg.filename, msg.lineno,
  File "main.py", line 47, in warn_with_traceback
    traceback.print_stack(file=log)
/home/philip/projects/ltspice_examples_code_repo/Circuit-Completion-Using-GNNs/component_classification_with_link_prediction_head/evaluation/FEGIN/kernel/circuit_datasets.py:15: FutureWarning: You are using `torch.load` with `weights_only=False` (the current default value), which uses the default pickle module implicitly. It is possible to construct malicious pickle data which will execute arbitrary code during unpickling (See https://github.com/pytorch/pytorch/blob/main/SECURITY.md#untrusted-models for more details). In a future release, the default value for `weights_only` will be flipped to `True`. This limits the functions that could be executed during unpickling. Arbitrary objects will no longer be allowed to be loaded via this mode unless they are explicitly allowlisted by the user via `torch.serialization.add_safe_globals`. We recommend you start setting `weights_only=True` for any use case where you don't have full control of the loaded file. Please open an issue on GitHub for any issues related to this experimental feature.
  self.data, self.slices = torch.load(self.processed_paths[0])
