STDOUT:
Results will be saved in /home/philip/projects/ltspice_examples_code_repo/Circuit-Completion-Using-GNNs/component_classification_with_link_prediction_head/evaluation/FEGIN/results/model_FEGIN_dataset_ltspice_examples
Command line input: python main.py --data ltspice_examples --representation component_pin --model FEGIN --layers 3 --hiddens 64 --batch_size 128 --lr 0.01 --emb_size 250 --epochs 100 --save_appendix component_pin_L3_H64_BS128_LR0.01_E250 --no_val
 is saved.
-----
ltspice_examples - FEGIN
Using 3 layers, 64 hidden units, h = 2
Loading component_pin representation dataset
ENTERED
Training FEGIN on component_pin representation
Train: 3560, Test: 848
##################ITERATION #0 ****************************************
 epoch: 0, train_loss: 1.1817, test_loss: 2.2819, test_f1: 0.2610
 epoch: 1, train_loss: 1.0175, test_loss: 1.0477, test_f1: 0.4497
 epoch: 2, train_loss: 0.9741, test_loss: 1.0658, test_f1: 0.4951
 epoch: 3, train_loss: 0.9396, test_loss: 0.9347, test_f1: 0.5468
 epoch: 4, train_loss: 0.8938, test_loss: 1.0009, test_f1: 0.4964
 epoch: 5, train_loss: 0.8857, test_loss: 1.0504, test_f1: 0.4258
 epoch: 6, train_loss: 0.8751, test_loss: 0.9506, test_f1: 0.5190
 epoch: 7, train_loss: 0.8517, test_loss: 0.9957, test_f1: 0.5270
 epoch: 8, train_loss: 0.8379, test_loss: 0.8905, test_f1: 0.5221
 epoch: 9, train_loss: 0.8094, test_loss: 0.9432, test_f1: 0.4990
 epoch: 10, train_loss: 0.7972, test_loss: 0.8656, test_f1: 0.5343
 epoch: 11, train_loss: 0.8030, test_loss: 1.2084, test_f1: 0.4338
 epoch: 12, train_loss: 0.7833, test_loss: 0.8814, test_f1: 0.5619
 epoch: 13, train_loss: 0.7790, test_loss: 0.9116, test_f1: 0.5545
 epoch: 14, train_loss: 0.7535, test_loss: 0.8271, test_f1: 0.5572
 epoch: 15, train_loss: 0.7549, test_loss: 0.7795, test_f1: 0.5431
 epoch: 16, train_loss: 0.7396, test_loss: 0.8197, test_f1: 0.5421
 epoch: 17, train_loss: 0.7590, test_loss: 0.8239, test_f1: 0.5340
 epoch: 18, train_loss: 0.7376, test_loss: 0.8381, test_f1: 0.5964
 epoch: 19, train_loss: 0.7191, test_loss: 0.8947, test_f1: 0.5460
 epoch: 20, train_loss: 0.7133, test_loss: 0.8838, test_f1: 0.5824
 epoch: 21, train_loss: 0.7098, test_loss: 1.0681, test_f1: 0.4986
 epoch: 22, train_loss: 0.6922, test_loss: 0.8824, test_f1: 0.5921
 epoch: 23, train_loss: 0.6772, test_loss: 0.8424, test_f1: 0.6374
 epoch: 24, train_loss: 0.6659, test_loss: 0.8765, test_f1: 0.6186
 epoch: 25, train_loss: 0.6654, test_loss: 0.9184, test_f1: 0.5569
 epoch: 26, train_loss: 0.6729, test_loss: 0.7570, test_f1: 0.6444
 epoch: 27, train_loss: 0.6323, test_loss: 0.6927, test_f1: 0.6405
 epoch: 28, train_loss: 0.6459, test_loss: 0.9099, test_f1: 0.5351
 epoch: 29, train_loss: 0.6539, test_loss: 0.9348, test_f1: 0.5626
 epoch: 30, train_loss: 0.6267, test_loss: 0.8303, test_f1: 0.6283
 epoch: 31, train_loss: 0.6400, test_loss: 1.0287, test_f1: 0.5286
 epoch: 32, train_loss: 0.6360, test_loss: 0.8729, test_f1: 0.6176
 epoch: 33, train_loss: 0.6253, test_loss: 0.9264, test_f1: 0.5648
 epoch: 34, train_loss: 0.5931, test_loss: 0.7991, test_f1: 0.6200
 epoch: 35, train_loss: 0.5720, test_loss: 0.8747, test_f1: 0.6405
 epoch: 36, train_loss: 0.5914, test_loss: 0.9103, test_f1: 0.6055
 epoch: 37, train_loss: 0.6021, test_loss: 0.9302, test_f1: 0.6174
 epoch: 38, train_loss: 0.5967, test_loss: 1.0350, test_f1: 0.6691
 epoch: 39, train_loss: 0.5887, test_loss: 0.8802, test_f1: 0.6208
 epoch: 40, train_loss: 0.5544, test_loss: 0.8981, test_f1: 0.6368
 epoch: 41, train_loss: 0.5631, test_loss: 0.7353, test_f1: 0.6678
 epoch: 42, train_loss: 0.5586, test_loss: 1.0447, test_f1: 0.5520
 epoch: 43, train_loss: 0.5402, test_loss: 0.9267, test_f1: 0.6459
 epoch: 44, train_loss: 0.5505, test_loss: 0.8068, test_f1: 0.6275
 epoch: 45, train_loss: 0.5428, test_loss: 0.9232, test_f1: 0.6467
 epoch: 46, train_loss: 0.5382, test_loss: 0.9054, test_f1: 0.6535
 epoch: 47, train_loss: 0.5132, test_loss: 0.8721, test_f1: 0.6322
 epoch: 48, train_loss: 0.5214, test_loss: 0.9032, test_f1: 0.6419
 epoch: 49, train_loss: 0.5114, test_loss: 0.7945, test_f1: 0.6457
 epoch: 50, train_loss: 0.5156, test_loss: 0.7324, test_f1: 0.6575
 epoch: 51, train_loss: 0.4936, test_loss: 0.9679, test_f1: 0.6575
 epoch: 52, train_loss: 0.4601, test_loss: 0.7902, test_f1: 0.6809
 epoch: 53, train_loss: 0.4346, test_loss: 0.9931, test_f1: 0.6605
 epoch: 54, train_loss: 0.4380, test_loss: 0.9057, test_f1: 0.6764
 epoch: 55, train_loss: 0.4370, test_loss: 0.9527, test_f1: 0.6463
 epoch: 56, train_loss: 0.4338, test_loss: 0.9958, test_f1: 0.6863
 epoch: 57, train_loss: 0.4199, test_loss: 0.8538, test_f1: 0.6812
 epoch: 58, train_loss: 0.4456, test_loss: 1.0109, test_f1: 0.6584
 epoch: 59, train_loss: 0.4048, test_loss: 0.9580, test_f1: 0.6593
 epoch: 60, train_loss: 0.3986, test_loss: 1.0297, test_f1: 0.6908
 epoch: 61, train_loss: 0.4019, test_loss: 1.0137, test_f1: 0.6801
 epoch: 62, train_loss: 0.4121, test_loss: 1.1266, test_f1: 0.6802
 epoch: 63, train_loss: 0.3957, test_loss: 1.0177, test_f1: 0.6823
 epoch: 64, train_loss: 0.3995, test_loss: 1.0713, test_f1: 0.6965
 epoch: 65, train_loss: 0.3977, test_loss: 1.1316, test_f1: 0.6635
 epoch: 66, train_loss: 0.3803, test_loss: 1.2034, test_f1: 0.6667
 epoch: 67, train_loss: 0.3988, test_loss: 0.9669, test_f1: 0.6826
 epoch: 68, train_loss: 0.3922, test_loss: 1.1228, test_f1: 0.7086
 epoch: 69, train_loss: 0.3678, test_loss: 0.9941, test_f1: 0.6654
 epoch: 70, train_loss: 0.3848, test_loss: 0.9720, test_f1: 0.6810
 epoch: 71, train_loss: 0.3771, test_loss: 1.0314, test_f1: 0.6695
 epoch: 72, train_loss: 0.3670, test_loss: 1.1704, test_f1: 0.6838
 epoch: 73, train_loss: 0.3771, test_loss: 1.1934, test_f1: 0.6572
 epoch: 74, train_loss: 0.3781, test_loss: 0.9171, test_f1: 0.6621
 epoch: 75, train_loss: 0.3847, test_loss: 1.0559, test_f1: 0.6869
 epoch: 76, train_loss: 0.3534, test_loss: 1.1917, test_f1: 0.6677
 epoch: 77, train_loss: 0.3775, test_loss: 1.0257, test_f1: 0.6735
 epoch: 78, train_loss: 0.3694, test_loss: 1.1116, test_f1: 0.6755
 epoch: 79, train_loss: 0.3312, test_loss: 1.3113, test_f1: 0.6924
 epoch: 80, train_loss: 0.3324, test_loss: 1.0650, test_f1: 0.6736
 epoch: 81, train_loss: 0.3376, test_loss: 1.2970, test_f1: 0.6550
 epoch: 82, train_loss: 0.3285, test_loss: 1.3211, test_f1: 0.6629
 epoch: 83, train_loss: 0.3357, test_loss: 1.3201, test_f1: 0.6519
 epoch: 84, train_loss: 0.3400, test_loss: 0.9565, test_f1: 0.6841
 epoch: 85, train_loss: 0.3562, test_loss: 1.2513, test_f1: 0.6586
 epoch: 86, train_loss: 0.3696, test_loss: 0.9993, test_f1: 0.6845
 epoch: 87, train_loss: 0.3492, test_loss: 1.1114, test_f1: 0.6780
 epoch: 88, train_loss: 0.3228, test_loss: 1.0941, test_f1: 0.6627
 epoch: 89, train_loss: 0.3243, test_loss: 1.1115, test_f1: 0.6608
 epoch: 90, train_loss: 0.3203, test_loss: 1.1774, test_f1: 0.6747
 epoch: 91, train_loss: 0.3165, test_loss: 1.1861, test_f1: 0.6611
 epoch: 92, train_loss: 0.3193, test_loss: 1.1208, test_f1: 0.7015
 epoch: 93, train_loss: 0.3393, test_loss: 1.1805, test_f1: 0.6624
 epoch: 94, train_loss: 0.3260, test_loss: 1.1982, test_f1: 0.6780
 epoch: 95, train_loss: 0.3155, test_loss: 1.1566, test_f1: 0.6912
 epoch: 96, train_loss: 0.3044, test_loss: 1.0376, test_f1: 0.6582
 epoch: 97, train_loss: 0.3155, test_loss: 1.1508, test_f1: 0.6740
 epoch: 98, train_loss: 0.3053, test_loss: 1.2932, test_f1: 0.6686
 epoch: 99, train_loss: 0.2968, test_loss: 1.0016, test_f1: 0.6669
##################ITERATION #1 ****************************************
 epoch: 0, train_loss: 1.1109, test_loss: 1.0840, test_f1: 0.3438
 epoch: 1, train_loss: 0.9681, test_loss: 1.0055, test_f1: 0.4974
 epoch: 2, train_loss: 0.9339, test_loss: 0.9623, test_f1: 0.4855
 epoch: 3, train_loss: 0.9026, test_loss: 0.9101, test_f1: 0.5007
 epoch: 4, train_loss: 0.9076, test_loss: 1.1821, test_f1: 0.4448
 epoch: 5, train_loss: 0.8803, test_loss: 0.8791, test_f1: 0.5707
 epoch: 6, train_loss: 0.8511, test_loss: 0.8481, test_f1: 0.5032
 epoch: 7, train_loss: 0.8438, test_loss: 0.9087, test_f1: 0.5338
 epoch: 8, train_loss: 0.8111, test_loss: 0.8606, test_f1: 0.5984
 epoch: 9, train_loss: 0.8158, test_loss: 0.9051, test_f1: 0.5493
 epoch: 10, train_loss: 0.8061, test_loss: 0.8920, test_f1: 0.5509
 epoch: 11, train_loss: 0.7894, test_loss: 0.9204, test_f1: 0.5395
 epoch: 12, train_loss: 0.7706, test_loss: 0.8772, test_f1: 0.6023
 epoch: 13, train_loss: 0.7556, test_loss: 0.9247, test_f1: 0.5600
 epoch: 14, train_loss: 0.7571, test_loss: 1.0781, test_f1: 0.5025
 epoch: 15, train_loss: 0.7232, test_loss: 0.9494, test_f1: 0.5744
 epoch: 16, train_loss: 0.7226, test_loss: 1.1610, test_f1: 0.5195
 epoch: 17, train_loss: 0.7368, test_loss: 0.8886, test_f1: 0.5761
 epoch: 18, train_loss: 0.7195, test_loss: 0.7727, test_f1: 0.6493
 epoch: 19, train_loss: 0.7187, test_loss: 0.8114, test_f1: 0.5932
 epoch: 20, train_loss: 0.6895, test_loss: 1.0774, test_f1: 0.4965
 epoch: 21, train_loss: 0.7126, test_loss: 1.0004, test_f1: 0.5839
 epoch: 22, train_loss: 0.6861, test_loss: 0.8211, test_f1: 0.6360
 epoch: 23, train_loss: 0.6466, test_loss: 0.8768, test_f1: 0.5785
 epoch: 24, train_loss: 0.6457, test_loss: 1.0053, test_f1: 0.6262
 epoch: 25, train_loss: 0.6465, test_loss: 1.2583, test_f1: 0.5250
 epoch: 26, train_loss: 0.6511, test_loss: 0.9068, test_f1: 0.6130
 epoch: 27, train_loss: 0.6422, test_loss: 0.8990, test_f1: 0.6506
 epoch: 28, train_loss: 0.6188, test_loss: 0.8958, test_f1: 0.6508
 epoch: 29, train_loss: 0.6315, test_loss: 0.9503, test_f1: 0.6377
 epoch: 30, train_loss: 0.6184, test_loss: 0.8653, test_f1: 0.6270
 epoch: 31, train_loss: 0.6110, test_loss: 1.1009, test_f1: 0.5992
 epoch: 32, train_loss: 0.6081, test_loss: 0.8803, test_f1: 0.6255
 epoch: 33, train_loss: 0.5945, test_loss: 1.1304, test_f1: 0.5821
 epoch: 34, train_loss: 0.6069, test_loss: 0.8713, test_f1: 0.6320
 epoch: 35, train_loss: 0.5991, test_loss: 0.9062, test_f1: 0.6226
 epoch: 36, train_loss: 0.5907, test_loss: 0.8488, test_f1: 0.6228
 epoch: 37, train_loss: 0.5687, test_loss: 1.0730, test_f1: 0.5752
 epoch: 38, train_loss: 0.5915, test_loss: 0.9257, test_f1: 0.5888
 epoch: 39, train_loss: 0.5429, test_loss: 1.5673, test_f1: 0.5064
 epoch: 40, train_loss: 0.5568, test_loss: 0.9993, test_f1: 0.6425
 epoch: 41, train_loss: 0.5689, test_loss: 0.8979, test_f1: 0.6375
 epoch: 42, train_loss: 0.5746, test_loss: 1.0713, test_f1: 0.6353
 epoch: 43, train_loss: 0.5628, test_loss: 1.0709, test_f1: 0.6328
 epoch: 44, train_loss: 0.5456, test_loss: 0.8935, test_f1: 0.6451
 epoch: 45, train_loss: 0.5222, test_loss: 1.0379, test_f1: 0.6398
 epoch: 46, train_loss: 0.5447, test_loss: 1.0437, test_f1: 0.6543
 epoch: 47, train_loss: 0.5666, test_loss: 0.8818, test_f1: 0.6152
 epoch: 48, train_loss: 0.5407, test_loss: 1.0571, test_f1: 0.6362
 epoch: 49, train_loss: 0.5038, test_loss: 1.0970, test_f1: 0.6422
 epoch: 50, train_loss: 0.5130, test_loss: 1.1201, test_f1: 0.5790
 epoch: 51, train_loss: 0.4825, test_loss: 0.8994, test_f1: 0.6684
 epoch: 52, train_loss: 0.4426, test_loss: 0.9438, test_f1: 0.6860
 epoch: 53, train_loss: 0.4316, test_loss: 1.0482, test_f1: 0.6697
 epoch: 54, train_loss: 0.4307, test_loss: 1.0721, test_f1: 0.6623
 epoch: 55, train_loss: 0.4321, test_loss: 1.0424, test_f1: 0.6657
 epoch: 56, train_loss: 0.4304, test_loss: 1.0054, test_f1: 0.6688
 epoch: 57, train_loss: 0.4196, test_loss: 1.1057, test_f1: 0.6604
 epoch: 58, train_loss: 0.4059, test_loss: 1.0174, test_f1: 0.6360
 epoch: 59, train_loss: 0.4153, test_loss: 1.1132, test_f1: 0.6443
 epoch: 60, train_loss: 0.4148, test_loss: 1.0429, test_f1: 0.6889
 epoch: 61, train_loss: 0.4283, test_loss: 1.1235, test_f1: 0.6717
 epoch: 62, train_loss: 0.4115, test_loss: 1.1709, test_f1: 0.6221
 epoch: 63, train_loss: 0.4189, test_loss: 1.0487, test_f1: 0.6701
 epoch: 64, train_loss: 0.4156, test_loss: 1.1300, test_f1: 0.6272
 epoch: 65, train_loss: 0.3808, test_loss: 1.1657, test_f1: 0.6657
 epoch: 66, train_loss: 0.3896, test_loss: 1.0517, test_f1: 0.6819
 epoch: 67, train_loss: 0.3805, test_loss: 1.0815, test_f1: 0.6642
 epoch: 68, train_loss: 0.3672, test_loss: 1.1089, test_f1: 0.6639
 epoch: 69, train_loss: 0.3998, test_loss: 1.0315, test_f1: 0.6750
 epoch: 70, train_loss: 0.3857, test_loss: 0.9376, test_f1: 0.6530
 epoch: 71, train_loss: 0.3751, test_loss: 1.1322, test_f1: 0.6439
 epoch: 72, train_loss: 0.3910, test_loss: 1.0151, test_f1: 0.6736
 epoch: 73, train_loss: 0.3702, test_loss: 1.0446, test_f1: 0.6624
 epoch: 74, train_loss: 0.3811, test_loss: 1.0570, test_f1: 0.6689
 epoch: 75, train_loss: 0.3706, test_loss: 1.0454, test_f1: 0.6449
 epoch: 76, train_loss: 0.3811, test_loss: 0.9747, test_f1: 0.6932
 epoch: 77, train_loss: 0.3792, test_loss: 0.9710, test_f1: 0.6728
 epoch: 78, train_loss: 0.3407, test_loss: 1.3037, test_f1: 0.6541
 epoch: 79, train_loss: 0.3615, test_loss: 1.2179, test_f1: 0.6507
 epoch: 80, train_loss: 0.3825, test_loss: 1.3079, test_f1: 0.6421
 epoch: 81, train_loss: 0.3396, test_loss: 1.1563, test_f1: 0.6919
 epoch: 82, train_loss: 0.3776, test_loss: 1.2408, test_f1: 0.6492
 epoch: 83, train_loss: 0.3607, test_loss: 1.1336, test_f1: 0.6630
 epoch: 84, train_loss: 0.3429, test_loss: 1.2396, test_f1: 0.6569
 epoch: 85, train_loss: 0.3555, test_loss: 1.1335, test_f1: 0.6706
 epoch: 86, train_loss: 0.3784, test_loss: 1.0724, test_f1: 0.6660
 epoch: 87, train_loss: 0.3431, test_loss: 1.1499, test_f1: 0.6520
 epoch: 88, train_loss: 0.3453, test_loss: 1.1624, test_f1: 0.6477
 epoch: 89, train_loss: 0.3233, test_loss: 1.1677, test_f1: 0.6907
 epoch: 90, train_loss: 0.3353, test_loss: 1.2963, test_f1: 0.6589
 epoch: 91, train_loss: 0.3375, test_loss: 1.1883, test_f1: 0.6597
 epoch: 92, train_loss: 0.3405, test_loss: 1.0893, test_f1: 0.6747
 epoch: 93, train_loss: 0.3119, test_loss: 1.2676, test_f1: 0.6533
 epoch: 94, train_loss: 0.3310, test_loss: 1.3945, test_f1: 0.6496
 epoch: 95, train_loss: 0.3534, test_loss: 1.4944, test_f1: 0.6294
 epoch: 96, train_loss: 0.3432, test_loss: 1.2940, test_f1: 0.6712
 epoch: 97, train_loss: 0.3509, test_loss: 1.3181, test_f1: 0.6483
 epoch: 98, train_loss: 0.3304, test_loss: 1.3290, test_f1: 0.6300
 epoch: 99, train_loss: 0.3089, test_loss: 1.2237, test_f1: 0.6645
##################ITERATION #2 ****************************************
 epoch: 0, train_loss: 1.1917, test_loss: 1.0704, test_f1: 0.4365
 epoch: 1, train_loss: 1.0089, test_loss: 1.0800, test_f1: 0.4601
 epoch: 2, train_loss: 0.9422, test_loss: 1.0013, test_f1: 0.5119
 epoch: 3, train_loss: 0.9246, test_loss: 0.9613, test_f1: 0.5279
 epoch: 4, train_loss: 0.9006, test_loss: 0.9245, test_f1: 0.5275
 epoch: 5, train_loss: 0.8760, test_loss: 1.1330, test_f1: 0.4297
 epoch: 6, train_loss: 0.8584, test_loss: 0.9853, test_f1: 0.5024
 epoch: 7, train_loss: 0.8500, test_loss: 0.9453, test_f1: 0.5140
 epoch: 8, train_loss: 0.8122, test_loss: 0.9609, test_f1: 0.5489
 epoch: 9, train_loss: 0.8057, test_loss: 1.1290, test_f1: 0.4493
 epoch: 10, train_loss: 0.7909, test_loss: 0.8466, test_f1: 0.5463
 epoch: 11, train_loss: 0.7728, test_loss: 0.9956, test_f1: 0.5293
 epoch: 12, train_loss: 0.7605, test_loss: 0.8913, test_f1: 0.5584
 epoch: 13, train_loss: 0.7867, test_loss: 0.9311, test_f1: 0.5478
 epoch: 14, train_loss: 0.7466, test_loss: 0.9228, test_f1: 0.5683
 epoch: 15, train_loss: 0.7454, test_loss: 0.9389, test_f1: 0.5984
 epoch: 16, train_loss: 0.7203, test_loss: 1.0482, test_f1: 0.5344
 epoch: 17, train_loss: 0.7037, test_loss: 0.9695, test_f1: 0.5851
 epoch: 18, train_loss: 0.7126, test_loss: 0.9896, test_f1: 0.5207
 epoch: 19, train_loss: 0.7194, test_loss: 1.0931, test_f1: 0.5289
 epoch: 20, train_loss: 0.7028, test_loss: 1.1499, test_f1: 0.5318
 epoch: 21, train_loss: 0.6993, test_loss: 1.1145, test_f1: 0.5681
 epoch: 22, train_loss: 0.6922, test_loss: 0.9551, test_f1: 0.5991
 epoch: 23, train_loss: 0.6858, test_loss: 1.0185, test_f1: 0.5638
 epoch: 24, train_loss: 0.6933, test_loss: 1.0091, test_f1: 0.5299
 epoch: 25, train_loss: 0.6799, test_loss: 1.3283, test_f1: 0.4923
 epoch: 26, train_loss: 0.6781, test_loss: 1.1660, test_f1: 0.6353
 epoch: 27, train_loss: 0.6735, test_loss: 1.0469, test_f1: 0.6041
 epoch: 28, train_loss: 0.6461, test_loss: 0.9485, test_f1: 0.5877
 epoch: 29, train_loss: 0.6418, test_loss: 0.9733, test_f1: 0.6071
 epoch: 30, train_loss: 0.6250, test_loss: 1.0432, test_f1: 0.6496
 epoch: 31, train_loss: 0.6370, test_loss: 0.9551, test_f1: 0.6215
 epoch: 32, train_loss: 0.6128, test_loss: 1.0977, test_f1: 0.5950
 epoch: 33, train_loss: 0.5952, test_loss: 1.0423, test_f1: 0.6076
 epoch: 34, train_loss: 0.6118, test_loss: 0.9922, test_f1: 0.6191
 epoch: 35, train_loss: 0.5960, test_loss: 0.9854, test_f1: 0.6146
 epoch: 36, train_loss: 0.6022, test_loss: 0.9176, test_f1: 0.6446
 epoch: 37, train_loss: 0.5840, test_loss: 1.1058, test_f1: 0.5496
 epoch: 38, train_loss: 0.5930, test_loss: 1.0153, test_f1: 0.6257
 epoch: 39, train_loss: 0.5900, test_loss: 0.8732, test_f1: 0.6278
 epoch: 40, train_loss: 0.5735, test_loss: 1.1917, test_f1: 0.5992
 epoch: 41, train_loss: 0.5669, test_loss: 1.2667, test_f1: 0.6186
 epoch: 42, train_loss: 0.5652, test_loss: 1.0337, test_f1: 0.6485
 epoch: 43, train_loss: 0.5303, test_loss: 1.0563, test_f1: 0.6266
 epoch: 44, train_loss: 0.5676, test_loss: 1.0997, test_f1: 0.6559
 epoch: 45, train_loss: 0.5422, test_loss: 0.8614, test_f1: 0.6374
 epoch: 46, train_loss: 0.5505, test_loss: 1.0673, test_f1: 0.6050
 epoch: 47, train_loss: 0.5592, test_loss: 1.1833, test_f1: 0.6067
 epoch: 48, train_loss: 0.5440, test_loss: 0.9823, test_f1: 0.5976
 epoch: 49, train_loss: 0.5533, test_loss: 1.0149, test_f1: 0.6389
 epoch: 50, train_loss: 0.5155, test_loss: 0.9576, test_f1: 0.6089
 epoch: 51, train_loss: 0.4747, test_loss: 0.9291, test_f1: 0.6481
 epoch: 52, train_loss: 0.4605, test_loss: 1.0630, test_f1: 0.6569
 epoch: 53, train_loss: 0.4374, test_loss: 1.0292, test_f1: 0.6707
 epoch: 54, train_loss: 0.4539, test_loss: 1.0707, test_f1: 0.6775
 epoch: 55, train_loss: 0.4560, test_loss: 1.0004, test_f1: 0.6593
 epoch: 56, train_loss: 0.4433, test_loss: 1.1009, test_f1: 0.6332
 epoch: 57, train_loss: 0.4351, test_loss: 1.3115, test_f1: 0.6850
 epoch: 58, train_loss: 0.4666, test_loss: 1.2972, test_f1: 0.6615
 epoch: 59, train_loss: 0.4448, test_loss: 1.2867, test_f1: 0.6325
 epoch: 60, train_loss: 0.4262, test_loss: 1.2591, test_f1: 0.6506
 epoch: 61, train_loss: 0.4243, test_loss: 1.1709, test_f1: 0.6710
 epoch: 62, train_loss: 0.4160, test_loss: 1.1862, test_f1: 0.6974
 epoch: 63, train_loss: 0.4032, test_loss: 1.0367, test_f1: 0.6754
 epoch: 64, train_loss: 0.4170, test_loss: 1.3194, test_f1: 0.6632
 epoch: 65, train_loss: 0.4322, test_loss: 1.1048, test_f1: 0.6636
 epoch: 66, train_loss: 0.4171, test_loss: 0.9853, test_f1: 0.6903
 epoch: 67, train_loss: 0.3896, test_loss: 1.0687, test_f1: 0.6941
 epoch: 68, train_loss: 0.3815, test_loss: 1.1542, test_f1: 0.6686
 epoch: 69, train_loss: 0.3999, test_loss: 1.4038, test_f1: 0.6846
 epoch: 70, train_loss: 0.3870, test_loss: 1.1241, test_f1: 0.6542
 epoch: 71, train_loss: 0.4025, test_loss: 1.2269, test_f1: 0.6766
 epoch: 72, train_loss: 0.3857, test_loss: 1.1759, test_f1: 0.6760
 epoch: 73, train_loss: 0.3559, test_loss: 1.3463, test_f1: 0.6601
 epoch: 74, train_loss: 0.3974, test_loss: 1.4281, test_f1: 0.6751
 epoch: 75, train_loss: 0.3892, test_loss: 1.2165, test_f1: 0.6691
 epoch: 76, train_loss: 0.3719, test_loss: 1.5281, test_f1: 0.6253
 epoch: 77, train_loss: 0.3656, test_loss: 1.3692, test_f1: 0.6917
 epoch: 78, train_loss: 0.3813, test_loss: 1.3761, test_f1: 0.6826
 epoch: 79, train_loss: 0.3895, test_loss: 1.4363, test_f1: 0.6555
 epoch: 80, train_loss: 0.3549, test_loss: 1.6310, test_f1: 0.6685
 epoch: 81, train_loss: 0.3539, test_loss: 1.4102, test_f1: 0.6545
 epoch: 82, train_loss: 0.3450, test_loss: 1.4304, test_f1: 0.6715
 epoch: 83, train_loss: 0.3525, test_loss: 1.2599, test_f1: 0.7230
 epoch: 84, train_loss: 0.3475, test_loss: 1.4815, test_f1: 0.6361
 epoch: 85, train_loss: 0.3348, test_loss: 1.2598, test_f1: 0.6642
 epoch: 86, train_loss: 0.3529, test_loss: 1.2562, test_f1: 0.6441
 epoch: 87, train_loss: 0.3482, test_loss: 1.4154, test_f1: 0.6687
 epoch: 88, train_loss: 0.3568, test_loss: 1.2776, test_f1: 0.6998
 epoch: 89, train_loss: 0.3458, test_loss: 1.1045, test_f1: 0.6690
 epoch: 90, train_loss: 0.3562, test_loss: 1.3091, test_f1: 0.6658
 epoch: 91, train_loss: 0.3334, test_loss: 1.4357, test_f1: 0.6759
 epoch: 92, train_loss: 0.3343, test_loss: 1.5034, test_f1: 0.6689
 epoch: 93, train_loss: 0.3514, test_loss: 1.1294, test_f1: 0.6473
 epoch: 94, train_loss: 0.3450, test_loss: 1.2179, test_f1: 0.7024
 epoch: 95, train_loss: 0.3410, test_loss: 1.3886, test_f1: 0.6373
 epoch: 96, train_loss: 0.3381, test_loss: 1.6351, test_f1: 0.6418
 epoch: 97, train_loss: 0.3088, test_loss: 1.3955, test_f1: 0.6566
 epoch: 98, train_loss: 0.3197, test_loss: 1.3865, test_f1: 0.6754
 epoch: 99, train_loss: 0.3373, test_loss: 1.3235, test_f1: 0.6591
##################ITERATION #3 ****************************************
 epoch: 0, train_loss: 1.2655, test_loss: 1.1028, test_f1: 0.4829
 epoch: 1, train_loss: 1.0296, test_loss: 1.0365, test_f1: 0.3991
 epoch: 2, train_loss: 0.9740, test_loss: 1.0235, test_f1: 0.4940
 epoch: 3, train_loss: 0.9280, test_loss: 1.0109, test_f1: 0.5391
 epoch: 4, train_loss: 0.9095, test_loss: 1.1955, test_f1: 0.4194
 epoch: 5, train_loss: 0.8930, test_loss: 0.9294, test_f1: 0.5700
 epoch: 6, train_loss: 0.8845, test_loss: 0.8746, test_f1: 0.5777
 epoch: 7, train_loss: 0.8617, test_loss: 0.8402, test_f1: 0.5675
 epoch: 8, train_loss: 0.8450, test_loss: 1.3523, test_f1: 0.4081
 epoch: 9, train_loss: 0.8354, test_loss: 1.0053, test_f1: 0.4972
 epoch: 10, train_loss: 0.8205, test_loss: 0.8742, test_f1: 0.5635
 epoch: 11, train_loss: 0.7891, test_loss: 0.9747, test_f1: 0.5866
 epoch: 12, train_loss: 0.7953, test_loss: 0.8727, test_f1: 0.5533
 epoch: 13, train_loss: 0.7811, test_loss: 0.9494, test_f1: 0.5507
 epoch: 14, train_loss: 0.7625, test_loss: 0.9291, test_f1: 0.5764
 epoch: 15, train_loss: 0.7406, test_loss: 0.9192, test_f1: 0.5744
 epoch: 16, train_loss: 0.7444, test_loss: 1.0141, test_f1: 0.5752
 epoch: 17, train_loss: 0.7519, test_loss: 0.9254, test_f1: 0.5829
 epoch: 18, train_loss: 0.7425, test_loss: 0.8405, test_f1: 0.5734
 epoch: 19, train_loss: 0.7524, test_loss: 0.8896, test_f1: 0.6205
 epoch: 20, train_loss: 0.7355, test_loss: 0.9448, test_f1: 0.5188
 epoch: 21, train_loss: 0.7397, test_loss: 1.9123, test_f1: 0.2785
 epoch: 22, train_loss: 0.7223, test_loss: 0.9764, test_f1: 0.5650
 epoch: 23, train_loss: 0.7127, test_loss: 0.8743, test_f1: 0.5664
 epoch: 24, train_loss: 0.6836, test_loss: 0.9229, test_f1: 0.5932
 epoch: 25, train_loss: 0.6837, test_loss: 0.8931, test_f1: 0.5985
 epoch: 26, train_loss: 0.6828, test_loss: 0.9302, test_f1: 0.6169
 epoch: 27, train_loss: 0.6818, test_loss: 1.0972, test_f1: 0.5779
 epoch: 28, train_loss: 0.6728, test_loss: 0.8784, test_f1: 0.6085
 epoch: 29, train_loss: 0.6812, test_loss: 0.9275, test_f1: 0.5515
 epoch: 30, train_loss: 0.6683, test_loss: 0.9717, test_f1: 0.5785
 epoch: 31, train_loss: 0.6484, test_loss: 0.9125, test_f1: 0.5649
 epoch: 32, train_loss: 0.6310, test_loss: 0.9409, test_f1: 0.5962
 epoch: 33, train_loss: 0.6221, test_loss: 0.9682, test_f1: 0.5651
 epoch: 34, train_loss: 0.6330, test_loss: 0.9173, test_f1: 0.6272
 epoch: 35, train_loss: 0.6127, test_loss: 0.9452, test_f1: 0.5812
 epoch: 36, train_loss: 0.6336, test_loss: 1.0261, test_f1: 0.6300
 epoch: 37, train_loss: 0.6124, test_loss: 0.8893, test_f1: 0.6221
 epoch: 38, train_loss: 0.6288, test_loss: 0.8403, test_f1: 0.6441
 epoch: 39, train_loss: 0.6036, test_loss: 0.8359, test_f1: 0.6427
 epoch: 40, train_loss: 0.6104, test_loss: 0.9774, test_f1: 0.5980
 epoch: 41, train_loss: 0.5703, test_loss: 0.9681, test_f1: 0.6044
 epoch: 42, train_loss: 0.5659, test_loss: 0.9280, test_f1: 0.6302
 epoch: 43, train_loss: 0.5623, test_loss: 1.0893, test_f1: 0.5928
 epoch: 44, train_loss: 0.5855, test_loss: 0.9956, test_f1: 0.5894
 epoch: 45, train_loss: 0.5714, test_loss: 1.1223, test_f1: 0.6090
 epoch: 46, train_loss: 0.6119, test_loss: 0.8942, test_f1: 0.6514
 epoch: 47, train_loss: 0.5631, test_loss: 1.0167, test_f1: 0.6151
 epoch: 48, train_loss: 0.5471, test_loss: 0.8784, test_f1: 0.6066
 epoch: 49, train_loss: 0.5490, test_loss: 0.9934, test_f1: 0.6097
 epoch: 50, train_loss: 0.5642, test_loss: 1.1944, test_f1: 0.5607
 epoch: 51, train_loss: 0.5334, test_loss: 0.9536, test_f1: 0.6325
 epoch: 52, train_loss: 0.4989, test_loss: 0.9565, test_f1: 0.6302
 epoch: 53, train_loss: 0.4960, test_loss: 0.9555, test_f1: 0.6683
 epoch: 54, train_loss: 0.4673, test_loss: 0.9790, test_f1: 0.6470
 epoch: 55, train_loss: 0.4628, test_loss: 0.9791, test_f1: 0.6386
 epoch: 56, train_loss: 0.4588, test_loss: 1.0548, test_f1: 0.6136
 epoch: 57, train_loss: 0.4612, test_loss: 0.9652, test_f1: 0.6447
 epoch: 58, train_loss: 0.4522, test_loss: 0.9256, test_f1: 0.6701
 epoch: 59, train_loss: 0.4568, test_loss: 1.0249, test_f1: 0.6407
 epoch: 60, train_loss: 0.4385, test_loss: 1.1282, test_f1: 0.5962
 epoch: 61, train_loss: 0.4353, test_loss: 0.9856, test_f1: 0.6618
 epoch: 62, train_loss: 0.4446, test_loss: 1.0337, test_f1: 0.6306
 epoch: 63, train_loss: 0.4368, test_loss: 1.0789, test_f1: 0.6220
 epoch: 64, train_loss: 0.4362, test_loss: 1.0139, test_f1: 0.6442
 epoch: 65, train_loss: 0.4362, test_loss: 1.0601, test_f1: 0.6734
 epoch: 66, train_loss: 0.4120, test_loss: 0.9918, test_f1: 0.6677
 epoch: 67, train_loss: 0.4377, test_loss: 1.0394, test_f1: 0.6464
 epoch: 68, train_loss: 0.4316, test_loss: 1.1176, test_f1: 0.6582
 epoch: 69, train_loss: 0.4131, test_loss: 1.0435, test_f1: 0.6398
 epoch: 70, train_loss: 0.4271, test_loss: 1.2157, test_f1: 0.6415
 epoch: 71, train_loss: 0.4129, test_loss: 0.9334, test_f1: 0.6722
 epoch: 72, train_loss: 0.4134, test_loss: 1.1605, test_f1: 0.6300
 epoch: 73, train_loss: 0.4151, test_loss: 1.0148, test_f1: 0.6325
 epoch: 74, train_loss: 0.4103, test_loss: 0.9928, test_f1: 0.6720
 epoch: 75, train_loss: 0.3939, test_loss: 1.0847, test_f1: 0.6481
 epoch: 76, train_loss: 0.4039, test_loss: 1.1064, test_f1: 0.6813
 epoch: 77, train_loss: 0.4011, test_loss: 0.9965, test_f1: 0.6653
 epoch: 78, train_loss: 0.3849, test_loss: 1.1201, test_f1: 0.6168
 epoch: 79, train_loss: 0.3887, test_loss: 1.1132, test_f1: 0.6546
 epoch: 80, train_loss: 0.4051, test_loss: 1.1650, test_f1: 0.6447
 epoch: 81, train_loss: 0.3583, test_loss: 1.2388, test_f1: 0.6296
 epoch: 82, train_loss: 0.4082, test_loss: 1.0720, test_f1: 0.6476
 epoch: 83, train_loss: 0.3804, test_loss: 1.1664, test_f1: 0.6534
 epoch: 84, train_loss: 0.3986, test_loss: 1.0480, test_f1: 0.6524
 epoch: 85, train_loss: 0.3744, test_loss: 1.0538, test_f1: 0.6498
 epoch: 86, train_loss: 0.3515, test_loss: 1.2809, test_f1: 0.6065
 epoch: 87, train_loss: 0.3646, test_loss: 1.1941, test_f1: 0.6131
 epoch: 88, train_loss: 0.3842, test_loss: 0.9434, test_f1: 0.6812
 epoch: 89, train_loss: 0.3665, test_loss: 1.0968, test_f1: 0.6195
 epoch: 90, train_loss: 0.3751, test_loss: 1.0833, test_f1: 0.6675
 epoch: 91, train_loss: 0.3476, test_loss: 1.0899, test_f1: 0.6485
 epoch: 92, train_loss: 0.3715, test_loss: 0.9993, test_f1: 0.6715
 epoch: 93, train_loss: 0.3441, test_loss: 1.1396, test_f1: 0.6786
 epoch: 94, train_loss: 0.3640, test_loss: 1.0036, test_f1: 0.6787
 epoch: 95, train_loss: 0.3828, test_loss: 1.0872, test_f1: 0.6906
 epoch: 96, train_loss: 0.3686, test_loss: 1.0754, test_f1: 0.6606
 epoch: 97, train_loss: 0.3370, test_loss: 1.0227, test_f1: 0.6706
 epoch: 98, train_loss: 0.3272, test_loss: 1.1005, test_f1: 0.6462
 epoch: 99, train_loss: 0.3591, test_loss: 1.2517, test_f1: 0.6447
##################ITERATION #4 ****************************************
 epoch: 0, train_loss: 1.3464, test_loss: 1.1194, test_f1: 0.3686
 epoch: 1, train_loss: 0.9871, test_loss: 1.0341, test_f1: 0.4455
 epoch: 2, train_loss: 0.9352, test_loss: 0.9774, test_f1: 0.5086
 epoch: 3, train_loss: 0.9073, test_loss: 0.9742, test_f1: 0.5154
 epoch: 4, train_loss: 0.8927, test_loss: 0.9668, test_f1: 0.5522
 epoch: 5, train_loss: 0.8602, test_loss: 1.0345, test_f1: 0.4303
 epoch: 6, train_loss: 0.8446, test_loss: 0.9683, test_f1: 0.5036
 epoch: 7, train_loss: 0.8421, test_loss: 1.4458, test_f1: 0.3951
 epoch: 8, train_loss: 0.8208, test_loss: 0.9386, test_f1: 0.5187
 epoch: 9, train_loss: 0.8144, test_loss: 0.9346, test_f1: 0.5096
 epoch: 10, train_loss: 0.8169, test_loss: 0.9976, test_f1: 0.4511
 epoch: 11, train_loss: 0.7650, test_loss: 0.9399, test_f1: 0.5050
 epoch: 12, train_loss: 0.7591, test_loss: 0.8649, test_f1: 0.5467
 epoch: 13, train_loss: 0.7715, test_loss: 0.9454, test_f1: 0.5709
 epoch: 14, train_loss: 0.7377, test_loss: 0.8989, test_f1: 0.5884
 epoch: 15, train_loss: 0.7197, test_loss: 0.9938, test_f1: 0.5151
 epoch: 16, train_loss: 0.7195, test_loss: 0.8723, test_f1: 0.6142
 epoch: 17, train_loss: 0.7089, test_loss: 0.9138, test_f1: 0.5457
 epoch: 18, train_loss: 0.6863, test_loss: 0.9104, test_f1: 0.5735
 epoch: 19, train_loss: 0.6650, test_loss: 0.8819, test_f1: 0.5817
 epoch: 20, train_loss: 0.6926, test_loss: 0.8832, test_f1: 0.5960
 epoch: 21, train_loss: 0.6720, test_loss: 0.9798, test_f1: 0.5572
 epoch: 22, train_loss: 0.6946, test_loss: 0.9191, test_f1: 0.5404
 epoch: 23, train_loss: 0.6867, test_loss: 0.8834, test_f1: 0.6301
 epoch: 24, train_loss: 0.6536, test_loss: 0.9571, test_f1: 0.5095
 epoch: 25, train_loss: 0.6524, test_loss: 0.8750, test_f1: 0.6033
 epoch: 26, train_loss: 0.6640, test_loss: 1.0621, test_f1: 0.5275
 epoch: 27, train_loss: 0.6316, test_loss: 1.0137, test_f1: 0.5638
 epoch: 28, train_loss: 0.6383, test_loss: 0.8501, test_f1: 0.6140
 epoch: 29, train_loss: 0.6671, test_loss: 0.7483, test_f1: 0.6228
 epoch: 30, train_loss: 0.6227, test_loss: 0.9479, test_f1: 0.6129
 epoch: 31, train_loss: 0.6352, test_loss: 1.0330, test_f1: 0.5938
 epoch: 32, train_loss: 0.6098, test_loss: 0.8461, test_f1: 0.6391
 epoch: 33, train_loss: 0.6056, test_loss: 0.7951, test_f1: 0.6331
 epoch: 34, train_loss: 0.6058, test_loss: 0.9009, test_f1: 0.5906
 epoch: 35, train_loss: 0.5908, test_loss: 0.8910, test_f1: 0.6104
 epoch: 36, train_loss: 0.5882, test_loss: 0.7601, test_f1: 0.6142
 epoch: 37, train_loss: 0.6097, test_loss: 0.9708, test_f1: 0.5967
 epoch: 38, train_loss: 0.6032, test_loss: 0.7601, test_f1: 0.6576
 epoch: 39, train_loss: 0.5729, test_loss: 0.9910, test_f1: 0.6062
 epoch: 40, train_loss: 0.5580, test_loss: 0.8699, test_f1: 0.6383
 epoch: 41, train_loss: 0.5728, test_loss: 0.8341, test_f1: 0.6337
 epoch: 42, train_loss: 0.5973, test_loss: 0.9768, test_f1: 0.6093
 epoch: 43, train_loss: 0.5517, test_loss: 0.8802, test_f1: 0.6453
 epoch: 44, train_loss: 0.5688, test_loss: 0.7851, test_f1: 0.6092
 epoch: 45, train_loss: 0.5561, test_loss: 0.8723, test_f1: 0.6577
 epoch: 46, train_loss: 0.5480, test_loss: 0.9531, test_f1: 0.6342
 epoch: 47, train_loss: 0.5376, test_loss: 0.8940, test_f1: 0.6142
 epoch: 48, train_loss: 0.5562, test_loss: 1.0111, test_f1: 0.6105
 epoch: 49, train_loss: 0.5703, test_loss: 0.7950, test_f1: 0.6477
 epoch: 50, train_loss: 0.5395, test_loss: 0.8797, test_f1: 0.6484
 epoch: 51, train_loss: 0.5138, test_loss: 0.8104, test_f1: 0.6446
 epoch: 52, train_loss: 0.4833, test_loss: 0.8145, test_f1: 0.6609
 epoch: 53, train_loss: 0.4622, test_loss: 0.8363, test_f1: 0.6849
 epoch: 54, train_loss: 0.4488, test_loss: 0.8462, test_f1: 0.6442
 epoch: 55, train_loss: 0.4520, test_loss: 0.8084, test_f1: 0.6498
 epoch: 56, train_loss: 0.4243, test_loss: 0.9235, test_f1: 0.6305
 epoch: 57, train_loss: 0.4283, test_loss: 0.8211, test_f1: 0.6608
 epoch: 58, train_loss: 0.4232, test_loss: 1.0712, test_f1: 0.6162
 epoch: 59, train_loss: 0.4431, test_loss: 0.8184, test_f1: 0.6744
 epoch: 60, train_loss: 0.4425, test_loss: 0.8491, test_f1: 0.6874
 epoch: 61, train_loss: 0.4370, test_loss: 0.8264, test_f1: 0.6577
 epoch: 62, train_loss: 0.4217, test_loss: 0.8034, test_f1: 0.6959
 epoch: 63, train_loss: 0.4221, test_loss: 0.9651, test_f1: 0.6365
 epoch: 64, train_loss: 0.4312, test_loss: 0.8349, test_f1: 0.6463
 epoch: 65, train_loss: 0.4150, test_loss: 0.8558, test_f1: 0.6598
 epoch: 66, train_loss: 0.4232, test_loss: 1.2234, test_f1: 0.6307
 epoch: 67, train_loss: 0.4036, test_loss: 0.8596, test_f1: 0.6513
 epoch: 68, train_loss: 0.4011, test_loss: 0.7199, test_f1: 0.6949
 epoch: 69, train_loss: 0.3875, test_loss: 1.0542, test_f1: 0.6593
 epoch: 70, train_loss: 0.3999, test_loss: 0.8451, test_f1: 0.6496
 epoch: 71, train_loss: 0.4034, test_loss: 0.9719, test_f1: 0.6245
 epoch: 72, train_loss: 0.4064, test_loss: 0.9537, test_f1: 0.6367
 epoch: 73, train_loss: 0.3977, test_loss: 1.0235, test_f1: 0.6400
 epoch: 74, train_loss: 0.3920, test_loss: 0.8445, test_f1: 0.6713
 epoch: 75, train_loss: 0.4071, test_loss: 0.9321, test_f1: 0.6671
 epoch: 76, train_loss: 0.3878, test_loss: 0.9569, test_f1: 0.6381
 epoch: 77, train_loss: 0.3785, test_loss: 0.9690, test_f1: 0.6575
 epoch: 78, train_loss: 0.4273, test_loss: 0.9309, test_f1: 0.6609
 epoch: 79, train_loss: 0.3743, test_loss: 0.9508, test_f1: 0.6379
 epoch: 80, train_loss: 0.3670, test_loss: 1.0018, test_f1: 0.6662
 epoch: 81, train_loss: 0.3795, test_loss: 0.9726, test_f1: 0.6443
 epoch: 82, train_loss: 0.3707, test_loss: 0.9769, test_f1: 0.6429
 epoch: 83, train_loss: 0.3676, test_loss: 1.0278, test_f1: 0.6679
 epoch: 84, train_loss: 0.3812, test_loss: 1.0731, test_f1: 0.6532
 epoch: 85, train_loss: 0.3719, test_loss: 1.0886, test_f1: 0.6268
 epoch: 86, train_loss: 0.3588, test_loss: 1.0230, test_f1: 0.6598
 epoch: 87, train_loss: 0.3652, test_loss: 1.1033, test_f1: 0.6448
 epoch: 88, train_loss: 0.3713, test_loss: 1.2077, test_f1: 0.6559
 epoch: 89, train_loss: 0.3577, test_loss: 1.1536, test_f1: 0.6097
 epoch: 90, train_loss: 0.3563, test_loss: 0.9989, test_f1: 0.6483
 epoch: 91, train_loss: 0.3654, test_loss: 1.1018, test_f1: 0.6552
 epoch: 92, train_loss: 0.3636, test_loss: 0.9353, test_f1: 0.6147
 epoch: 93, train_loss: 0.3547, test_loss: 1.0939, test_f1: 0.6354
 epoch: 94, train_loss: 0.3440, test_loss: 0.9870, test_f1: 0.6488
 epoch: 95, train_loss: 0.3634, test_loss: 1.1310, test_f1: 0.6729
 epoch: 96, train_loss: 0.3567, test_loss: 1.1368, test_f1: 0.6596
 epoch: 97, train_loss: 0.3262, test_loss: 1.0319, test_f1: 0.6433
 epoch: 98, train_loss: 0.3333, test_loss: 1.1203, test_f1: 0.6468
 epoch: 99, train_loss: 0.3583, test_loss: 0.9401, test_f1: 0.6467
##################ITERATION #5 ****************************************
 epoch: 0, train_loss: 1.2362, test_loss: 1.0529, test_f1: 0.4420
 epoch: 1, train_loss: 0.9970, test_loss: 1.0655, test_f1: 0.4388
 epoch: 2, train_loss: 0.9601, test_loss: 1.0205, test_f1: 0.5151
 epoch: 3, train_loss: 0.9378, test_loss: 1.1893, test_f1: 0.3878
 epoch: 4, train_loss: 0.9606, test_loss: 1.0248, test_f1: 0.4886
 epoch: 5, train_loss: 0.9308, test_loss: 0.9789, test_f1: 0.5092
 epoch: 6, train_loss: 0.8954, test_loss: 1.1861, test_f1: 0.4576
 epoch: 7, train_loss: 0.8872, test_loss: 0.9547, test_f1: 0.4866
 epoch: 8, train_loss: 0.8566, test_loss: 0.9303, test_f1: 0.5513
 epoch: 9, train_loss: 0.8524, test_loss: 0.9310, test_f1: 0.5305
 epoch: 10, train_loss: 0.8546, test_loss: 0.9194, test_f1: 0.5679
 epoch: 11, train_loss: 0.8301, test_loss: 1.0639, test_f1: 0.4574
 epoch: 12, train_loss: 0.8093, test_loss: 0.9963, test_f1: 0.5597
 epoch: 13, train_loss: 0.8198, test_loss: 0.9695, test_f1: 0.4889
 epoch: 14, train_loss: 0.7961, test_loss: 1.1341, test_f1: 0.4833
 epoch: 15, train_loss: 0.8187, test_loss: 0.9470, test_f1: 0.5324
 epoch: 16, train_loss: 0.7880, test_loss: 0.9310, test_f1: 0.5787
 epoch: 17, train_loss: 0.7578, test_loss: 0.9718, test_f1: 0.5837
 epoch: 18, train_loss: 0.7696, test_loss: 1.0812, test_f1: 0.5068
 epoch: 19, train_loss: 0.7659, test_loss: 0.9495, test_f1: 0.5598
 epoch: 20, train_loss: 0.7599, test_loss: 0.9284, test_f1: 0.5671
 epoch: 21, train_loss: 0.7341, test_loss: 1.0107, test_f1: 0.5507
 epoch: 22, train_loss: 0.7387, test_loss: 1.1626, test_f1: 0.5138
 epoch: 23, train_loss: 0.7164, test_loss: 1.0253, test_f1: 0.5842
 epoch: 24, train_loss: 0.7051, test_loss: 0.9756, test_f1: 0.5693
 epoch: 25, train_loss: 0.7257, test_loss: 0.9661, test_f1: 0.5752
 epoch: 26, train_loss: 0.6936, test_loss: 0.9800, test_f1: 0.5879
 epoch: 27, train_loss: 0.6983, test_loss: 1.0175, test_f1: 0.6139
 epoch: 28, train_loss: 0.6828, test_loss: 1.0539, test_f1: 0.6017
 epoch: 29, train_loss: 0.6720, test_loss: 1.0284, test_f1: 0.5966
 epoch: 30, train_loss: 0.6554, test_loss: 1.0242, test_f1: 0.6374
 epoch: 31, train_loss: 0.6691, test_loss: 1.0221, test_f1: 0.5617
 epoch: 32, train_loss: 0.6779, test_loss: 0.9310, test_f1: 0.5806
 epoch: 33, train_loss: 0.6732, test_loss: 0.9053, test_f1: 0.6488
 epoch: 34, train_loss: 0.6648, test_loss: 1.0441, test_f1: 0.5747
 epoch: 35, train_loss: 0.6295, test_loss: 0.9448, test_f1: 0.6313
 epoch: 36, train_loss: 0.6677, test_loss: 0.9157, test_f1: 0.6474
 epoch: 37, train_loss: 0.6258, test_loss: 1.0248, test_f1: 0.6320
 epoch: 38, train_loss: 0.6469, test_loss: 1.0496, test_f1: 0.5926
 epoch: 39, train_loss: 0.6300, test_loss: 0.9725, test_f1: 0.6567
 epoch: 40, train_loss: 0.6254, test_loss: 1.0882, test_f1: 0.5798
 epoch: 41, train_loss: 0.6236, test_loss: 0.9806, test_f1: 0.6364
 epoch: 42, train_loss: 0.6365, test_loss: 0.8668, test_f1: 0.6065
 epoch: 43, train_loss: 0.6206, test_loss: 0.8351, test_f1: 0.6630
 epoch: 44, train_loss: 0.6123, test_loss: 1.0441, test_f1: 0.6135
 epoch: 45, train_loss: 0.5952, test_loss: 0.9423, test_f1: 0.6455
 epoch: 46, train_loss: 0.5962, test_loss: 0.9056, test_f1: 0.6148
 epoch: 47, train_loss: 0.5872, test_loss: 0.9222, test_f1: 0.6453
 epoch: 48, train_loss: 0.6034, test_loss: 1.0572, test_f1: 0.5962
 epoch: 49, train_loss: 0.5949, test_loss: 1.0757, test_f1: 0.6108
 epoch: 50, train_loss: 0.5696, test_loss: 1.1523, test_f1: 0.5998
 epoch: 51, train_loss: 0.5472, test_loss: 0.9681, test_f1: 0.6724
 epoch: 52, train_loss: 0.5161, test_loss: 1.0502, test_f1: 0.6295
 epoch: 53, train_loss: 0.5072, test_loss: 1.0662, test_f1: 0.6432
 epoch: 54, train_loss: 0.5009, test_loss: 1.0989, test_f1: 0.6403
 epoch: 55, train_loss: 0.4929, test_loss: 1.1328, test_f1: 0.6058
 epoch: 56, train_loss: 0.5083, test_loss: 1.1255, test_f1: 0.6437
 epoch: 57, train_loss: 0.5007, test_loss: 1.1550, test_f1: 0.6335
 epoch: 58, train_loss: 0.5093, test_loss: 1.0102, test_f1: 0.6344
 epoch: 59, train_loss: 0.4914, test_loss: 0.9811, test_f1: 0.6691
 epoch: 60, train_loss: 0.4791, test_loss: 1.0921, test_f1: 0.6443
 epoch: 61, train_loss: 0.4761, test_loss: 1.2183, test_f1: 0.6227
 epoch: 62, train_loss: 0.4755, test_loss: 1.0908, test_f1: 0.6492
 epoch: 63, train_loss: 0.4609, test_loss: 0.9979, test_f1: 0.6641
 epoch: 64, train_loss: 0.4631, test_loss: 1.0177, test_f1: 0.6599
 epoch: 65, train_loss: 0.4725, test_loss: 1.0323, test_f1: 0.6491
 epoch: 66, train_loss: 0.4513, test_loss: 1.1567, test_f1: 0.6642
 epoch: 67, train_loss: 0.4504, test_loss: 1.0379, test_f1: 0.6573
 epoch: 68, train_loss: 0.4329, test_loss: 1.1163, test_f1: 0.6280
 epoch: 69, train_loss: 0.4670, test_loss: 1.1516, test_f1: 0.6249
 epoch: 70, train_loss: 0.4454, test_loss: 1.1085, test_f1: 0.6263
 epoch: 71, train_loss: 0.4628, test_loss: 1.0709, test_f1: 0.6350
 epoch: 72, train_loss: 0.4441, test_loss: 1.0622, test_f1: 0.6549
 epoch: 73, train_loss: 0.4377, test_loss: 1.5285, test_f1: 0.5885
 epoch: 74, train_loss: 0.4321, test_loss: 1.1791, test_f1: 0.6528
 epoch: 75, train_loss: 0.4147, test_loss: 1.1863, test_f1: 0.6501
 epoch: 76, train_loss: 0.4501, test_loss: 1.1949, test_f1: 0.6311
 epoch: 77, train_loss: 0.4353, test_loss: 1.2048, test_f1: 0.6217
 epoch: 78, train_loss: 0.4350, test_loss: 1.1105, test_f1: 0.6301
 epoch: 79, train_loss: 0.4202, test_loss: 1.3681, test_f1: 0.6093
 epoch: 80, train_loss: 0.4194, test_loss: 1.3803, test_f1: 0.5819
 epoch: 81, train_loss: 0.4172, test_loss: 1.1247, test_f1: 0.6474
 epoch: 82, train_loss: 0.4194, test_loss: 1.3745, test_f1: 0.6412
 epoch: 83, train_loss: 0.4020, test_loss: 1.1513, test_f1: 0.6823
 epoch: 84, train_loss: 0.4068, test_loss: 1.1683, test_f1: 0.6686
 epoch: 85, train_loss: 0.4187, test_loss: 1.1185, test_f1: 0.6439
 epoch: 86, train_loss: 0.4374, test_loss: 1.1381, test_f1: 0.6277
 epoch: 87, train_loss: 0.4243, test_loss: 1.1736, test_f1: 0.6155
 epoch: 88, train_loss: 0.4028, test_loss: 1.2142, test_f1: 0.6573
 epoch: 89, train_loss: 0.3981, test_loss: 1.2016, test_f1: 0.6308
 epoch: 90, train_loss: 0.4205, test_loss: 1.0200, test_f1: 0.6677
 epoch: 91, train_loss: 0.4010, test_loss: 1.1931, test_f1: 0.6709
 epoch: 92, train_loss: 0.3765, test_loss: 1.1629, test_f1: 0.6683
 epoch: 93, train_loss: 0.3924, test_loss: 1.2853, test_f1: 0.6192
 epoch: 94, train_loss: 0.3809, test_loss: 1.1002, test_f1: 0.6631
 epoch: 95, train_loss: 0.3937, test_loss: 1.3197, test_f1: 0.6084
 epoch: 96, train_loss: 0.3897, test_loss: 1.0834, test_f1: 0.6523
 epoch: 97, train_loss: 0.3965, test_loss: 1.2382, test_f1: 0.6436
 epoch: 98, train_loss: 0.3798, test_loss: 1.2505, test_f1: 0.6571
 epoch: 99, train_loss: 0.3878, test_loss: 1.2680, test_f1: 0.6673
##################ITERATION #6 ****************************************
 epoch: 0, train_loss: 1.2838, test_loss: 1.1022, test_f1: 0.3619
 epoch: 1, train_loss: 1.0137, test_loss: 0.9922, test_f1: 0.4380
 epoch: 2, train_loss: 0.9702, test_loss: 0.9758, test_f1: 0.4953
 epoch: 3, train_loss: 0.9246, test_loss: 1.0551, test_f1: 0.4617
 epoch: 4, train_loss: 0.9147, test_loss: 0.9810, test_f1: 0.4883
 epoch: 5, train_loss: 0.8881, test_loss: 1.0737, test_f1: 0.4648
 epoch: 6, train_loss: 0.8555, test_loss: 0.9584, test_f1: 0.5271
 epoch: 7, train_loss: 0.8623, test_loss: 0.9976, test_f1: 0.5168
 epoch: 8, train_loss: 0.8288, test_loss: 0.9725, test_f1: 0.5146
 epoch: 9, train_loss: 0.8157, test_loss: 0.9204, test_f1: 0.5811
 epoch: 10, train_loss: 0.7990, test_loss: 0.9373, test_f1: 0.5284
 epoch: 11, train_loss: 0.7911, test_loss: 0.8719, test_f1: 0.5445
 epoch: 12, train_loss: 0.7886, test_loss: 1.2697, test_f1: 0.4406
 epoch: 13, train_loss: 0.7952, test_loss: 0.9840, test_f1: 0.5468
 epoch: 14, train_loss: 0.7814, test_loss: 1.0819, test_f1: 0.5538
 epoch: 15, train_loss: 0.7459, test_loss: 0.9422, test_f1: 0.5936
 epoch: 16, train_loss: 0.7417, test_loss: 0.9729, test_f1: 0.5551
 epoch: 17, train_loss: 0.7350, test_loss: 1.1576, test_f1: 0.5467
 epoch: 18, train_loss: 0.7233, test_loss: 0.9041, test_f1: 0.5814
 epoch: 19, train_loss: 0.7146, test_loss: 0.9990, test_f1: 0.5727
 epoch: 20, train_loss: 0.6991, test_loss: 1.0146, test_f1: 0.5428
 epoch: 21, train_loss: 0.6822, test_loss: 1.0247, test_f1: 0.5616
 epoch: 22, train_loss: 0.6734, test_loss: 1.0245, test_f1: 0.5727
 epoch: 23, train_loss: 0.6793, test_loss: 0.8986, test_f1: 0.6111
 epoch: 24, train_loss: 0.6839, test_loss: 0.9451, test_f1: 0.6115
 epoch: 25, train_loss: 0.6735, test_loss: 1.0935, test_f1: 0.5564
 epoch: 26, train_loss: 0.6563, test_loss: 0.9050, test_f1: 0.6488
 epoch: 27, train_loss: 0.6427, test_loss: 1.0749, test_f1: 0.6059
 epoch: 28, train_loss: 0.6669, test_loss: 1.0762, test_f1: 0.5602
 epoch: 29, train_loss: 0.6688, test_loss: 1.1093, test_f1: 0.5821
 epoch: 30, train_loss: 0.6405, test_loss: 0.9631, test_f1: 0.5945
 epoch: 31, train_loss: 0.6375, test_loss: 0.9317, test_f1: 0.6324
 epoch: 32, train_loss: 0.6285, test_loss: 1.0018, test_f1: 0.5985
 epoch: 33, train_loss: 0.6165, test_loss: 0.9558, test_f1: 0.6569
 epoch: 34, train_loss: 0.5984, test_loss: 1.0947, test_f1: 0.5576
 epoch: 35, train_loss: 0.6080, test_loss: 0.9349, test_f1: 0.6373
 epoch: 36, train_loss: 0.5960, test_loss: 1.0300, test_f1: 0.5627
 epoch: 37, train_loss: 0.5778, test_loss: 1.1122, test_f1: 0.5764
 epoch: 38, train_loss: 0.6151, test_loss: 1.0193, test_f1: 0.6289
 epoch: 39, train_loss: 0.6103, test_loss: 0.9783, test_f1: 0.6290
 epoch: 40, train_loss: 0.5817, test_loss: 1.0444, test_f1: 0.5909
 epoch: 41, train_loss: 0.5993, test_loss: 0.9424, test_f1: 0.6399
 epoch: 42, train_loss: 0.5747, test_loss: 1.0291, test_f1: 0.6265
 epoch: 43, train_loss: 0.5541, test_loss: 1.0508, test_f1: 0.6271
 epoch: 44, train_loss: 0.5640, test_loss: 1.2598, test_f1: 0.5594
 epoch: 45, train_loss: 0.5465, test_loss: 1.0736, test_f1: 0.6120
 epoch: 46, train_loss: 0.5415, test_loss: 1.2868, test_f1: 0.5857
 epoch: 47, train_loss: 0.5704, test_loss: 1.0006, test_f1: 0.6265
 epoch: 48, train_loss: 0.5639, test_loss: 1.1431, test_f1: 0.5979
 epoch: 49, train_loss: 0.5644, test_loss: 1.1491, test_f1: 0.6060
 epoch: 50, train_loss: 0.5429, test_loss: 1.0483, test_f1: 0.6024
 epoch: 51, train_loss: 0.4928, test_loss: 0.9446, test_f1: 0.6426
 epoch: 52, train_loss: 0.4668, test_loss: 0.9624, test_f1: 0.6338
 epoch: 53, train_loss: 0.4505, test_loss: 1.0628, test_f1: 0.6349
 epoch: 54, train_loss: 0.4527, test_loss: 1.2043, test_f1: 0.5916
 epoch: 55, train_loss: 0.4318, test_loss: 0.9640, test_f1: 0.6573
 epoch: 56, train_loss: 0.4162, test_loss: 1.0510, test_f1: 0.6349
 epoch: 57, train_loss: 0.4267, test_loss: 1.0401, test_f1: 0.6282
 epoch: 58, train_loss: 0.4241, test_loss: 1.1485, test_f1: 0.6118
 epoch: 59, train_loss: 0.4274, test_loss: 1.0596, test_f1: 0.6280
 epoch: 60, train_loss: 0.4149, test_loss: 1.3326, test_f1: 0.5983
 epoch: 61, train_loss: 0.4101, test_loss: 1.1120, test_f1: 0.6150
 epoch: 62, train_loss: 0.4148, test_loss: 1.1555, test_f1: 0.6211
 epoch: 63, train_loss: 0.4039, test_loss: 1.0649, test_f1: 0.6188
 epoch: 64, train_loss: 0.4176, test_loss: 1.1011, test_f1: 0.6170
 epoch: 65, train_loss: 0.3982, test_loss: 1.4593, test_f1: 0.5644
 epoch: 66, train_loss: 0.4008, test_loss: 1.1412, test_f1: 0.6224
 epoch: 67, train_loss: 0.3998, test_loss: 1.0224, test_f1: 0.6552
 epoch: 68, train_loss: 0.3665, test_loss: 1.3147, test_f1: 0.6033
 epoch: 69, train_loss: 0.3733, test_loss: 1.2343, test_f1: 0.6126
 epoch: 70, train_loss: 0.3843, test_loss: 1.1138, test_f1: 0.6418
 epoch: 71, train_loss: 0.3617, test_loss: 1.3029, test_f1: 0.6149
 epoch: 72, train_loss: 0.3768, test_loss: 1.1445, test_f1: 0.6349
 epoch: 73, train_loss: 0.3646, test_loss: 1.1292, test_f1: 0.6325
 epoch: 74, train_loss: 0.3788, test_loss: 1.4962, test_f1: 0.6133
 epoch: 75, train_loss: 0.3868, test_loss: 1.2337, test_f1: 0.6278
 epoch: 76, train_loss: 0.3542, test_loss: 1.1453, test_f1: 0.6359
 epoch: 77, train_loss: 0.3800, test_loss: 1.4819, test_f1: 0.5927
 epoch: 78, train_loss: 0.3607, test_loss: 1.4044, test_f1: 0.6121
 epoch: 79, train_loss: 0.3433, test_loss: 1.4278, test_f1: 0.5968
 epoch: 80, train_loss: 0.3415, test_loss: 1.2454, test_f1: 0.6174
 epoch: 81, train_loss: 0.3638, test_loss: 1.2178, test_f1: 0.5971
 epoch: 82, train_loss: 0.3553, test_loss: 1.4246, test_f1: 0.6022
 epoch: 83, train_loss: 0.3466, test_loss: 1.3322, test_f1: 0.5952
 epoch: 84, train_loss: 0.3516, test_loss: 1.6518, test_f1: 0.5717
 epoch: 85, train_loss: 0.3542, test_loss: 1.1485, test_f1: 0.6579
 epoch: 86, train_loss: 0.3379, test_loss: 1.4953, test_f1: 0.5893
 epoch: 87, train_loss: 0.3390, test_loss: 1.1944, test_f1: 0.6329
 epoch: 88, train_loss: 0.3542, test_loss: 1.1942, test_f1: 0.6348
 epoch: 89, train_loss: 0.3348, test_loss: 1.1536, test_f1: 0.6552
 epoch: 90, train_loss: 0.3242, test_loss: 1.4704, test_f1: 0.6260
 epoch: 91, train_loss: 0.3339, test_loss: 1.2785, test_f1: 0.6242
 epoch: 92, train_loss: 0.3509, test_loss: 1.2890, test_f1: 0.6502
 epoch: 93, train_loss: 0.3385, test_loss: 1.4843, test_f1: 0.5938
 epoch: 94, train_loss: 0.3293, test_loss: 1.1581, test_f1: 0.6478
 epoch: 95, train_loss: 0.3032, test_loss: 1.4225, test_f1: 0.6250
 epoch: 96, train_loss: 0.3143, test_loss: 1.2690, test_f1: 0.6251
 epoch: 97, train_loss: 0.3025, test_loss: 1.4660, test_f1: 0.6238
 epoch: 98, train_loss: 0.3392, test_loss: 1.4372, test_f1: 0.6238
 epoch: 99, train_loss: 0.3188, test_loss: 1.3595, test_f1: 0.6204
##################ITERATION #7 ****************************************
 epoch: 0, train_loss: 1.3283, test_loss: 1.1121, test_f1: 0.4589
 epoch: 1, train_loss: 1.0084, test_loss: 1.0566, test_f1: 0.5385
 epoch: 2, train_loss: 0.9587, test_loss: 1.0915, test_f1: 0.5076
 epoch: 3, train_loss: 0.9417, test_loss: 1.4406, test_f1: 0.3461
 epoch: 4, train_loss: 0.9201, test_loss: 1.3322, test_f1: 0.3673
 epoch: 5, train_loss: 0.8955, test_loss: 0.9564, test_f1: 0.4910
 epoch: 6, train_loss: 0.8690, test_loss: 1.0306, test_f1: 0.5496
 epoch: 7, train_loss: 0.8594, test_loss: 0.9735, test_f1: 0.5380
 epoch: 8, train_loss: 0.8537, test_loss: 1.0539, test_f1: 0.5126
 epoch: 9, train_loss: 0.8464, test_loss: 0.9051, test_f1: 0.5406
 epoch: 10, train_loss: 0.8203, test_loss: 0.9520, test_f1: 0.5537
 epoch: 11, train_loss: 0.8179, test_loss: 0.9485, test_f1: 0.5669
 epoch: 12, train_loss: 0.8054, test_loss: 0.9716, test_f1: 0.5430
 epoch: 13, train_loss: 0.7783, test_loss: 0.9939, test_f1: 0.5422
 epoch: 14, train_loss: 0.7957, test_loss: 1.1070, test_f1: 0.5059
 epoch: 15, train_loss: 0.7696, test_loss: 0.9447, test_f1: 0.6186
 epoch: 16, train_loss: 0.7418, test_loss: 0.9530, test_f1: 0.5760
 epoch: 17, train_loss: 0.7413, test_loss: 0.9699, test_f1: 0.5333
 epoch: 18, train_loss: 0.7403, test_loss: 0.9086, test_f1: 0.5666
 epoch: 19, train_loss: 0.7537, test_loss: 0.9878, test_f1: 0.5198
 epoch: 20, train_loss: 0.7560, test_loss: 1.0488, test_f1: 0.5909
 epoch: 21, train_loss: 0.7409, test_loss: 0.8583, test_f1: 0.6198
 epoch: 22, train_loss: 0.7212, test_loss: 1.0295, test_f1: 0.5843
 epoch: 23, train_loss: 0.7020, test_loss: 1.0427, test_f1: 0.6076
 epoch: 24, train_loss: 0.6837, test_loss: 1.2225, test_f1: 0.6005
 epoch: 25, train_loss: 0.7025, test_loss: 1.1696, test_f1: 0.4280
 epoch: 26, train_loss: 0.6861, test_loss: 1.0259, test_f1: 0.5739
 epoch: 27, train_loss: 0.6769, test_loss: 1.1469, test_f1: 0.5116
 epoch: 28, train_loss: 0.6576, test_loss: 0.9462, test_f1: 0.6031
 epoch: 29, train_loss: 0.6435, test_loss: 1.0152, test_f1: 0.6021
 epoch: 30, train_loss: 0.6587, test_loss: 1.4105, test_f1: 0.4822
 epoch: 31, train_loss: 0.6523, test_loss: 0.9383, test_f1: 0.5988
 epoch: 32, train_loss: 0.6416, test_loss: 0.9065, test_f1: 0.6070
 epoch: 33, train_loss: 0.6306, test_loss: 0.8894, test_f1: 0.6054
 epoch: 34, train_loss: 0.6188, test_loss: 0.9722, test_f1: 0.6159
 epoch: 35, train_loss: 0.6266, test_loss: 1.0580, test_f1: 0.5922
 epoch: 36, train_loss: 0.6139, test_loss: 1.0604, test_f1: 0.5722
 epoch: 37, train_loss: 0.6246, test_loss: 0.8586, test_f1: 0.6533
 epoch: 38, train_loss: 0.5993, test_loss: 1.0683, test_f1: 0.6036
 epoch: 39, train_loss: 0.6383, test_loss: 1.0855, test_f1: 0.6069
 epoch: 40, train_loss: 0.5945, test_loss: 1.0365, test_f1: 0.6262
 epoch: 41, train_loss: 0.5927, test_loss: 1.0101, test_f1: 0.6129
 epoch: 42, train_loss: 0.6083, test_loss: 1.1525, test_f1: 0.6233
 epoch: 43, train_loss: 0.5613, test_loss: 1.0266, test_f1: 0.6218
 epoch: 44, train_loss: 0.5665, test_loss: 0.9634, test_f1: 0.5907
 epoch: 45, train_loss: 0.5818, test_loss: 1.0367, test_f1: 0.6262
 epoch: 46, train_loss: 0.5867, test_loss: 1.0654, test_f1: 0.5927
 epoch: 47, train_loss: 0.5666, test_loss: 1.0844, test_f1: 0.6122
 epoch: 48, train_loss: 0.5540, test_loss: 1.0415, test_f1: 0.6378
 epoch: 49, train_loss: 0.5463, test_loss: 1.1681, test_f1: 0.6461
 epoch: 50, train_loss: 0.5436, test_loss: 1.2314, test_f1: 0.6310
 epoch: 51, train_loss: 0.5133, test_loss: 1.0275, test_f1: 0.6453
 epoch: 52, train_loss: 0.4780, test_loss: 1.0935, test_f1: 0.6418
 epoch: 53, train_loss: 0.4646, test_loss: 1.1016, test_f1: 0.6307
 epoch: 54, train_loss: 0.4558, test_loss: 1.1045, test_f1: 0.6215
 epoch: 55, train_loss: 0.4532, test_loss: 1.1749, test_f1: 0.6347
 epoch: 56, train_loss: 0.4308, test_loss: 0.9977, test_f1: 0.6481
 epoch: 57, train_loss: 0.4614, test_loss: 1.1610, test_f1: 0.6304
 epoch: 58, train_loss: 0.4848, test_loss: 1.1583, test_f1: 0.6388
 epoch: 59, train_loss: 0.4354, test_loss: 1.1908, test_f1: 0.6538
 epoch: 60, train_loss: 0.4429, test_loss: 1.1402, test_f1: 0.6470
 epoch: 61, train_loss: 0.4282, test_loss: 1.1961, test_f1: 0.6416
 epoch: 62, train_loss: 0.4419, test_loss: 1.2049, test_f1: 0.6439
 epoch: 63, train_loss: 0.4246, test_loss: 1.2030, test_f1: 0.6697
 epoch: 64, train_loss: 0.4373, test_loss: 1.2470, test_f1: 0.6506
 epoch: 65, train_loss: 0.4166, test_loss: 1.1968, test_f1: 0.6536
 epoch: 66, train_loss: 0.4451, test_loss: 1.1619, test_f1: 0.6442
 epoch: 67, train_loss: 0.4117, test_loss: 1.0967, test_f1: 0.6702
 epoch: 68, train_loss: 0.4057, test_loss: 1.2900, test_f1: 0.6233
 epoch: 69, train_loss: 0.4195, test_loss: 1.1912, test_f1: 0.6428
 epoch: 70, train_loss: 0.4308, test_loss: 1.2464, test_f1: 0.6514
 epoch: 71, train_loss: 0.4246, test_loss: 1.2166, test_f1: 0.6566
 epoch: 72, train_loss: 0.4027, test_loss: 1.2189, test_f1: 0.6433
 epoch: 73, train_loss: 0.4084, test_loss: 1.2924, test_f1: 0.6549
 epoch: 74, train_loss: 0.4161, test_loss: 1.2215, test_f1: 0.6393
 epoch: 75, train_loss: 0.4138, test_loss: 1.2404, test_f1: 0.6524
 epoch: 76, train_loss: 0.3959, test_loss: 1.2749, test_f1: 0.6786
 epoch: 77, train_loss: 0.4013, test_loss: 1.1134, test_f1: 0.6845
 epoch: 78, train_loss: 0.3898, test_loss: 1.3175, test_f1: 0.6650
 epoch: 79, train_loss: 0.4146, test_loss: 1.2195, test_f1: 0.6721
 epoch: 80, train_loss: 0.4218, test_loss: 1.2491, test_f1: 0.6289
 epoch: 81, train_loss: 0.3780, test_loss: 1.3376, test_f1: 0.6415
 epoch: 82, train_loss: 0.3698, test_loss: 1.3677, test_f1: 0.6332
 epoch: 83, train_loss: 0.3764, test_loss: 1.4354, test_f1: 0.6453
 epoch: 84, train_loss: 0.3619, test_loss: 1.3518, test_f1: 0.6386
 epoch: 85, train_loss: 0.3653, test_loss: 1.3144, test_f1: 0.6329
 epoch: 86, train_loss: 0.3888, test_loss: 1.3588, test_f1: 0.6310
 epoch: 87, train_loss: 0.3821, test_loss: 1.4169, test_f1: 0.6506
 epoch: 88, train_loss: 0.3907, test_loss: 1.2674, test_f1: 0.6542
 epoch: 89, train_loss: 0.3530, test_loss: 1.2979, test_f1: 0.6699
 epoch: 90, train_loss: 0.3565, test_loss: 1.3195, test_f1: 0.6781
 epoch: 91, train_loss: 0.3757, test_loss: 1.3033, test_f1: 0.6585
 epoch: 92, train_loss: 0.3596, test_loss: 1.3922, test_f1: 0.6440
 epoch: 93, train_loss: 0.3400, test_loss: 1.4985, test_f1: 0.6128
 epoch: 94, train_loss: 0.3472, test_loss: 1.3964, test_f1: 0.6576
 epoch: 95, train_loss: 0.3306, test_loss: 1.4562, test_f1: 0.6376
 epoch: 96, train_loss: 0.3566, test_loss: 1.4003, test_f1: 0.6800
 epoch: 97, train_loss: 0.3485, test_loss: 1.3565, test_f1: 0.6641
 epoch: 98, train_loss: 0.3404, test_loss: 1.3340, test_f1: 0.6700
 epoch: 99, train_loss: 0.3627, test_loss: 1.3803, test_f1: 0.6521
##################ITERATION #8 ****************************************
 epoch: 0, train_loss: 1.2846, test_loss: 1.1573, test_f1: 0.3590
 epoch: 1, train_loss: 1.0270, test_loss: 1.0878, test_f1: 0.4560
 epoch: 2, train_loss: 0.9944, test_loss: 1.0178, test_f1: 0.4985
 epoch: 3, train_loss: 0.9608, test_loss: 1.2370, test_f1: 0.4397
 epoch: 4, train_loss: 0.9244, test_loss: 1.0268, test_f1: 0.5491
 epoch: 5, train_loss: 0.8904, test_loss: 0.9777, test_f1: 0.5069
 epoch: 6, train_loss: 0.8817, test_loss: 0.8595, test_f1: 0.5850
 epoch: 7, train_loss: 0.8433, test_loss: 1.0531, test_f1: 0.5296
 epoch: 8, train_loss: 0.8390, test_loss: 0.9843, test_f1: 0.5869
 epoch: 9, train_loss: 0.8092, test_loss: 1.0818, test_f1: 0.4926
 epoch: 10, train_loss: 0.8041, test_loss: 1.0401, test_f1: 0.5738
 epoch: 11, train_loss: 0.7851, test_loss: 0.9910, test_f1: 0.5313
 epoch: 12, train_loss: 0.7878, test_loss: 0.9762, test_f1: 0.5363
 epoch: 13, train_loss: 0.7632, test_loss: 1.0441, test_f1: 0.5588
 epoch: 14, train_loss: 0.7590, test_loss: 1.0979, test_f1: 0.5287
 epoch: 15, train_loss: 0.7496, test_loss: 1.0500, test_f1: 0.5741
 epoch: 16, train_loss: 0.7444, test_loss: 1.2706, test_f1: 0.5363
 epoch: 17, train_loss: 0.7408, test_loss: 0.9707, test_f1: 0.6009
 epoch: 18, train_loss: 0.7480, test_loss: 0.9390, test_f1: 0.5829
 epoch: 19, train_loss: 0.7141, test_loss: 1.0285, test_f1: 0.5598
 epoch: 20, train_loss: 0.6820, test_loss: 1.0337, test_f1: 0.5694
 epoch: 21, train_loss: 0.7024, test_loss: 0.8570, test_f1: 0.5966
 epoch: 22, train_loss: 0.6897, test_loss: 0.9645, test_f1: 0.5718
 epoch: 23, train_loss: 0.7014, test_loss: 0.8828, test_f1: 0.5917
 epoch: 24, train_loss: 0.6700, test_loss: 0.8975, test_f1: 0.5637
 epoch: 25, train_loss: 0.6651, test_loss: 0.7937, test_f1: 0.6417
 epoch: 26, train_loss: 0.6479, test_loss: 0.8304, test_f1: 0.6319
 epoch: 27, train_loss: 0.6508, test_loss: 0.9594, test_f1: 0.5513
 epoch: 28, train_loss: 0.6468, test_loss: 0.8511, test_f1: 0.6333
 epoch: 29, train_loss: 0.6444, test_loss: 0.9884, test_f1: 0.5871
 epoch: 30, train_loss: 0.6542, test_loss: 1.0760, test_f1: 0.6186
 epoch: 31, train_loss: 0.6337, test_loss: 0.8655, test_f1: 0.6585
 epoch: 32, train_loss: 0.5984, test_loss: 1.0950, test_f1: 0.6009
 epoch: 33, train_loss: 0.6070, test_loss: 0.9871, test_f1: 0.5895
 epoch: 34, train_loss: 0.6054, test_loss: 0.8354, test_f1: 0.6115
 epoch: 35, train_loss: 0.6086, test_loss: 1.1729, test_f1: 0.5346
 epoch: 36, train_loss: 0.6000, test_loss: 1.2021, test_f1: 0.5565
 epoch: 37, train_loss: 0.6043, test_loss: 0.9755, test_f1: 0.5979
 epoch: 38, train_loss: 0.6076, test_loss: 1.0136, test_f1: 0.5989
 epoch: 39, train_loss: 0.5982, test_loss: 1.0925, test_f1: 0.6040
 epoch: 40, train_loss: 0.5753, test_loss: 1.0461, test_f1: 0.5813
 epoch: 41, train_loss: 0.5853, test_loss: 1.0550, test_f1: 0.5858
 epoch: 42, train_loss: 0.5833, test_loss: 1.2034, test_f1: 0.6056
 epoch: 43, train_loss: 0.5973, test_loss: 1.0524, test_f1: 0.6256
 epoch: 44, train_loss: 0.5705, test_loss: 0.9216, test_f1: 0.6406
 epoch: 45, train_loss: 0.5734, test_loss: 0.9788, test_f1: 0.6414
 epoch: 46, train_loss: 0.5482, test_loss: 1.0408, test_f1: 0.6203
 epoch: 47, train_loss: 0.5459, test_loss: 1.0364, test_f1: 0.6321
 epoch: 48, train_loss: 0.5279, test_loss: 1.1886, test_f1: 0.6083
 epoch: 49, train_loss: 0.5283, test_loss: 0.8762, test_f1: 0.6150
 epoch: 50, train_loss: 0.5495, test_loss: 0.9494, test_f1: 0.6379
 epoch: 51, train_loss: 0.5067, test_loss: 0.9832, test_f1: 0.6597
 epoch: 52, train_loss: 0.4665, test_loss: 1.0445, test_f1: 0.6503
 epoch: 53, train_loss: 0.4603, test_loss: 1.0167, test_f1: 0.6544
 epoch: 54, train_loss: 0.4408, test_loss: 0.9979, test_f1: 0.6667
 epoch: 55, train_loss: 0.4432, test_loss: 1.0733, test_f1: 0.6713
 epoch: 56, train_loss: 0.4601, test_loss: 1.0129, test_f1: 0.6525
 epoch: 57, train_loss: 0.4507, test_loss: 1.0174, test_f1: 0.6580
 epoch: 58, train_loss: 0.4480, test_loss: 1.0072, test_f1: 0.6670
 epoch: 59, train_loss: 0.4326, test_loss: 1.0346, test_f1: 0.6579
 epoch: 60, train_loss: 0.4200, test_loss: 1.0814, test_f1: 0.6374
 epoch: 61, train_loss: 0.4346, test_loss: 1.1895, test_f1: 0.6333
 epoch: 62, train_loss: 0.4192, test_loss: 1.1454, test_f1: 0.6516
 epoch: 63, train_loss: 0.4169, test_loss: 1.0550, test_f1: 0.6641
 epoch: 64, train_loss: 0.4242, test_loss: 1.0315, test_f1: 0.6720
 epoch: 65, train_loss: 0.4068, test_loss: 1.0606, test_f1: 0.6742
 epoch: 66, train_loss: 0.4193, test_loss: 1.0989, test_f1: 0.6619
 epoch: 67, train_loss: 0.4135, test_loss: 1.0182, test_f1: 0.6464
 epoch: 68, train_loss: 0.4056, test_loss: 1.0735, test_f1: 0.6583
 epoch: 69, train_loss: 0.3923, test_loss: 1.0957, test_f1: 0.6617
 epoch: 70, train_loss: 0.4030, test_loss: 1.1328, test_f1: 0.6358
 epoch: 71, train_loss: 0.4208, test_loss: 1.1389, test_f1: 0.6541
 epoch: 72, train_loss: 0.4154, test_loss: 1.2913, test_f1: 0.6334
 epoch: 73, train_loss: 0.4031, test_loss: 1.0686, test_f1: 0.6290
 epoch: 74, train_loss: 0.3882, test_loss: 1.0982, test_f1: 0.6638
 epoch: 75, train_loss: 0.3781, test_loss: 1.1337, test_f1: 0.6401
 epoch: 76, train_loss: 0.3900, test_loss: 1.1000, test_f1: 0.6593
 epoch: 77, train_loss: 0.3935, test_loss: 1.3128, test_f1: 0.6230
 epoch: 78, train_loss: 0.3930, test_loss: 1.0870, test_f1: 0.6696
 epoch: 79, train_loss: 0.3893, test_loss: 1.2513, test_f1: 0.6431
 epoch: 80, train_loss: 0.3699, test_loss: 1.1456, test_f1: 0.6500
 epoch: 81, train_loss: 0.3791, test_loss: 1.2020, test_f1: 0.6563
 epoch: 82, train_loss: 0.3773, test_loss: 1.1526, test_f1: 0.6185
 epoch: 83, train_loss: 0.3909, test_loss: 1.1294, test_f1: 0.6716
 epoch: 84, train_loss: 0.3850, test_loss: 1.1900, test_f1: 0.6655
 epoch: 85, train_loss: 0.3746, test_loss: 1.2766, test_f1: 0.6300
 epoch: 86, train_loss: 0.3636, test_loss: 1.2948, test_f1: 0.6175
 epoch: 87, train_loss: 0.3563, test_loss: 1.1278, test_f1: 0.6340
 epoch: 88, train_loss: 0.3896, test_loss: 1.1457, test_f1: 0.6565
 epoch: 89, train_loss: 0.3437, test_loss: 1.2025, test_f1: 0.6528
 epoch: 90, train_loss: 0.3423, test_loss: 1.4480, test_f1: 0.6096
 epoch: 91, train_loss: 0.3483, test_loss: 1.2297, test_f1: 0.6572
 epoch: 92, train_loss: 0.3751, test_loss: 1.2715, test_f1: 0.6653
 epoch: 93, train_loss: 0.3508, test_loss: 1.3595, test_f1: 0.6339
 epoch: 94, train_loss: 0.3439, test_loss: 1.2114, test_f1: 0.6724
 epoch: 95, train_loss: 0.3602, test_loss: 1.2959, test_f1: 0.6554
 epoch: 96, train_loss: 0.3446, test_loss: 1.3604, test_f1: 0.6197
 epoch: 97, train_loss: 0.3475, test_loss: 1.4427, test_f1: 0.6358
 epoch: 98, train_loss: 0.3426, test_loss: 1.2811, test_f1: 0.6560
 epoch: 99, train_loss: 0.3328, test_loss: 1.6622, test_f1: 0.6010
##################ITERATION #9 ****************************************
 epoch: 0, train_loss: 1.3389, test_loss: 1.1429, test_f1: 0.4496
 epoch: 1, train_loss: 1.0341, test_loss: 1.0817, test_f1: 0.4018
 epoch: 2, train_loss: 0.9796, test_loss: 1.0926, test_f1: 0.4987
 epoch: 3, train_loss: 0.9368, test_loss: 1.0391, test_f1: 0.4868
 epoch: 4, train_loss: 0.9433, test_loss: 2.6359, test_f1: 0.2827
 epoch: 5, train_loss: 0.9216, test_loss: 0.9950, test_f1: 0.5277
 epoch: 6, train_loss: 0.9060, test_loss: 1.0282, test_f1: 0.5245
 epoch: 7, train_loss: 0.8889, test_loss: 1.0290, test_f1: 0.5386
 epoch: 8, train_loss: 0.8457, test_loss: 0.9698, test_f1: 0.5027
 epoch: 9, train_loss: 0.8383, test_loss: 0.9463, test_f1: 0.5641
 epoch: 10, train_loss: 0.8283, test_loss: 1.4390, test_f1: 0.4637
 epoch: 11, train_loss: 0.8220, test_loss: 0.9282, test_f1: 0.5346
 epoch: 12, train_loss: 0.7972, test_loss: 0.8821, test_f1: 0.5941
 epoch: 13, train_loss: 0.8165, test_loss: 1.0400, test_f1: 0.5017
 epoch: 14, train_loss: 0.8038, test_loss: 0.8018, test_f1: 0.5492
 epoch: 15, train_loss: 0.7868, test_loss: 0.8347, test_f1: 0.5552
 epoch: 16, train_loss: 0.7805, test_loss: 0.9611, test_f1: 0.5270
 epoch: 17, train_loss: 0.7636, test_loss: 1.2819, test_f1: 0.4794
 epoch: 18, train_loss: 0.7615, test_loss: 0.7914, test_f1: 0.5626
 epoch: 19, train_loss: 0.7644, test_loss: 1.0528, test_f1: 0.4853
 epoch: 20, train_loss: 0.7471, test_loss: 1.0291, test_f1: 0.5483
 epoch: 21, train_loss: 0.7241, test_loss: 0.7605, test_f1: 0.5718
 epoch: 22, train_loss: 0.7288, test_loss: 0.8545, test_f1: 0.5951
 epoch: 23, train_loss: 0.7389, test_loss: 1.0376, test_f1: 0.5862
 epoch: 24, train_loss: 0.7158, test_loss: 0.9418, test_f1: 0.5410
 epoch: 25, train_loss: 0.7133, test_loss: 0.8861, test_f1: 0.5628
 epoch: 26, train_loss: 0.7004, test_loss: 0.9165, test_f1: 0.6020
 epoch: 27, train_loss: 0.6993, test_loss: 0.8562, test_f1: 0.6260
 epoch: 28, train_loss: 0.6843, test_loss: 0.9588, test_f1: 0.5609
 epoch: 29, train_loss: 0.6804, test_loss: 0.9273, test_f1: 0.6233
 epoch: 30, train_loss: 0.7016, test_loss: 0.8690, test_f1: 0.5609
 epoch: 31, train_loss: 0.6901, test_loss: 1.0401, test_f1: 0.5456
 epoch: 32, train_loss: 0.6737, test_loss: 1.0713, test_f1: 0.5781
 epoch: 33, train_loss: 0.6739, test_loss: 0.7885, test_f1: 0.6362
 epoch: 34, train_loss: 0.6579, test_loss: 0.9061, test_f1: 0.6117
 epoch: 35, train_loss: 0.6350, test_loss: 0.8722, test_f1: 0.6360
 epoch: 36, train_loss: 0.6399, test_loss: 0.8500, test_f1: 0.6398
 epoch: 37, train_loss: 0.6450, test_loss: 0.8782, test_f1: 0.6011
 epoch: 38, train_loss: 0.6189, test_loss: 1.0691, test_f1: 0.5857
 epoch: 39, train_loss: 0.6430, test_loss: 1.0369, test_f1: 0.5817
 epoch: 40, train_loss: 0.6435, test_loss: 0.8439, test_f1: 0.6352
 epoch: 41, train_loss: 0.6332, test_loss: 0.9302, test_f1: 0.6066
 epoch: 42, train_loss: 0.6237, test_loss: 1.1071, test_f1: 0.5963
 epoch: 43, train_loss: 0.6180, test_loss: 0.9301, test_f1: 0.5947
 epoch: 44, train_loss: 0.6086, test_loss: 0.9133, test_f1: 0.5980
 epoch: 45, train_loss: 0.6231, test_loss: 0.9394, test_f1: 0.6063
 epoch: 46, train_loss: 0.6195, test_loss: 1.1567, test_f1: 0.5849
 epoch: 47, train_loss: 0.5997, test_loss: 0.9869, test_f1: 0.5864
 epoch: 48, train_loss: 0.6154, test_loss: 1.0547, test_f1: 0.5492
 epoch: 49, train_loss: 0.6073, test_loss: 0.9245, test_f1: 0.5865
 epoch: 50, train_loss: 0.6044, test_loss: 0.8538, test_f1: 0.5867
 epoch: 51, train_loss: 0.5745, test_loss: 0.8102, test_f1: 0.6472
 epoch: 52, train_loss: 0.5453, test_loss: 0.8802, test_f1: 0.6254
 epoch: 53, train_loss: 0.5179, test_loss: 0.9783, test_f1: 0.6237
 epoch: 54, train_loss: 0.5132, test_loss: 0.9510, test_f1: 0.6157
 epoch: 55, train_loss: 0.5052, test_loss: 1.0193, test_f1: 0.6141
 epoch: 56, train_loss: 0.5077, test_loss: 1.0621, test_f1: 0.6157
 epoch: 57, train_loss: 0.4989, test_loss: 0.9363, test_f1: 0.6227
 epoch: 58, train_loss: 0.4984, test_loss: 0.8573, test_f1: 0.6541
 epoch: 59, train_loss: 0.4978, test_loss: 0.8852, test_f1: 0.6592
 epoch: 60, train_loss: 0.5014, test_loss: 0.9548, test_f1: 0.6246
 epoch: 61, train_loss: 0.4714, test_loss: 0.9853, test_f1: 0.6493
 epoch: 62, train_loss: 0.4698, test_loss: 1.0232, test_f1: 0.6073
 epoch: 63, train_loss: 0.4624, test_loss: 1.0520, test_f1: 0.6480
 epoch: 64, train_loss: 0.4719, test_loss: 1.0141, test_f1: 0.6331
 epoch: 65, train_loss: 0.4675, test_loss: 1.0241, test_f1: 0.6481
 epoch: 66, train_loss: 0.4478, test_loss: 1.0252, test_f1: 0.6385
 epoch: 67, train_loss: 0.4526, test_loss: 1.2276, test_f1: 0.5996
 epoch: 68, train_loss: 0.4494, test_loss: 1.0686, test_f1: 0.6254
 epoch: 69, train_loss: 0.4437, test_loss: 1.1856, test_f1: 0.6136
 epoch: 70, train_loss: 0.4514, test_loss: 1.1051, test_f1: 0.6227
 epoch: 71, train_loss: 0.4474, test_loss: 0.9992, test_f1: 0.6231
 epoch: 72, train_loss: 0.4523, test_loss: 1.0500, test_f1: 0.6275
 epoch: 73, train_loss: 0.4592, test_loss: 1.0579, test_f1: 0.6366
 epoch: 74, train_loss: 0.4559, test_loss: 1.2059, test_f1: 0.5875
 epoch: 75, train_loss: 0.4584, test_loss: 1.1177, test_f1: 0.6167
 epoch: 76, train_loss: 0.4675, test_loss: 1.0295, test_f1: 0.6011
 epoch: 77, train_loss: 0.4388, test_loss: 0.9686, test_f1: 0.6497
 epoch: 78, train_loss: 0.4488, test_loss: 1.0644, test_f1: 0.6270
 epoch: 79, train_loss: 0.4314, test_loss: 1.2006, test_f1: 0.6031
 epoch: 80, train_loss: 0.4128, test_loss: 0.9764, test_f1: 0.6428
 epoch: 81, train_loss: 0.4220, test_loss: 1.0552, test_f1: 0.5962
 epoch: 82, train_loss: 0.4607, test_loss: 1.2105, test_f1: 0.6149
 epoch: 83, train_loss: 0.4427, test_loss: 1.0566, test_f1: 0.6297
 epoch: 84, train_loss: 0.3960, test_loss: 1.1752, test_f1: 0.6202
 epoch: 85, train_loss: 0.4283, test_loss: 0.9480, test_f1: 0.6472
 epoch: 86, train_loss: 0.4167, test_loss: 1.1709, test_f1: 0.6417
 epoch: 87, train_loss: 0.4077, test_loss: 1.1134, test_f1: 0.6420
 epoch: 88, train_loss: 0.4043, test_loss: 1.1222, test_f1: 0.6534
 epoch: 89, train_loss: 0.4151, test_loss: 1.1368, test_f1: 0.6164
 epoch: 90, train_loss: 0.4160, test_loss: 1.0857, test_f1: 0.6329
 epoch: 91, train_loss: 0.4028, test_loss: 1.1240, test_f1: 0.6472
 epoch: 92, train_loss: 0.3808, test_loss: 1.3086, test_f1: 0.6333
 epoch: 93, train_loss: 0.4231, test_loss: 0.9883, test_f1: 0.6688
 epoch: 94, train_loss: 0.4085, test_loss: 1.1213, test_f1: 0.6428
 epoch: 95, train_loss: 0.3906, test_loss: 1.2681, test_f1: 0.6388
 epoch: 96, train_loss: 0.4047, test_loss: 1.1311, test_f1: 0.6360
 epoch: 97, train_loss: 0.3814, test_loss: 1.1435, test_f1: 0.6444
 epoch: 98, train_loss: 0.3772, test_loss: 1.1249, test_f1: 0.6482
 epoch: 99, train_loss: 0.3856, test_loss: 1.1086, test_f1: 0.6423

Training completed in 486.36 seconds
Best F1: 0.7230 at epoch 83
Mean F1 across iterations: 0.6879  0.0180
========================FINAL RESULTS================================
FEGIN weighted F1: 0.7230  0.0180
python main.py --data ltspice_examples --representation component_pin --model FEGIN --layers 3 --hiddens 64 --batch_size 128 --lr 0.01 --emb_size 250 --epochs 100 --save_appendix component_pin_L3_H64_BS128_LR0.01_E250 --no_val
-----



STDERR:
  File "main.py", line 370, in <module>
    main()
  File "main.py", line 254, in main
    dataset = dataset_class(
  File "/home/philip/projects/ltspice_examples_code_repo/Circuit-Completion-Using-GNNs/component_classification_with_link_prediction_head/evaluation/FEGIN/kernel/circuit_datasets.py", line 15, in __init__
    self.data, self.slices = torch.load(self.processed_paths[0])
  File "/home/philip/.local/lib/python3.8/site-packages/torch/serialization.py", line 1040, in load
    warnings.warn(
  File "/usr/lib/python3.8/warnings.py", line 109, in _showwarnmsg
    sw(msg.message, msg.category, msg.filename, msg.lineno,
  File "main.py", line 47, in warn_with_traceback
    traceback.print_stack(file=log)
/home/philip/projects/ltspice_examples_code_repo/Circuit-Completion-Using-GNNs/component_classification_with_link_prediction_head/evaluation/FEGIN/kernel/circuit_datasets.py:15: FutureWarning: You are using `torch.load` with `weights_only=False` (the current default value), which uses the default pickle module implicitly. It is possible to construct malicious pickle data which will execute arbitrary code during unpickling (See https://github.com/pytorch/pytorch/blob/main/SECURITY.md#untrusted-models for more details). In a future release, the default value for `weights_only` will be flipped to `True`. This limits the functions that could be executed during unpickling. Arbitrary objects will no longer be allowed to be loaded via this mode unless they are explicitly allowlisted by the user via `torch.serialization.add_safe_globals`. We recommend you start setting `weights_only=True` for any use case where you don't have full control of the loaded file. Please open an issue on GitHub for any issues related to this experimental feature.
  self.data, self.slices = torch.load(self.processed_paths[0])
