STDOUT:
Results will be saved in /home/philip/projects/ltspice_examples_code_repo/Circuit-Completion-Using-GNNs/component_classification_with_link_prediction_head/evaluation/FEGIN/results/model_FEGIN_dataset_ltspice_demos
Command line input: python main.py --data ltspice_demos --representation component_component --model FEGIN --layers 2 --hiddens 64 --batch_size 64 --lr 0.0001 --emb_size 128 --epochs 100 --save_appendix component_component_L2_H64_BS64_LR0.0001_E128 --no_val
 is saved.
-----
ltspice_demos - FEGIN
Using 2 layers, 64 hidden units, h = 2
Loading component_component representation dataset
ENTERED
Training FEGIN on component_component representation
Train: 1565, Test: 383
##################ITERATION #0 ****************************************
 epoch: 0, train_loss: 1.4045, test_loss: 1.3969, test_f1: 0.0457
 epoch: 1, train_loss: 1.3904, test_loss: 1.3866, test_f1: 0.1077
 epoch: 2, train_loss: 1.3808, test_loss: 1.3766, test_f1: 0.2686
 epoch: 3, train_loss: 1.3696, test_loss: 1.3659, test_f1: 0.2331
 epoch: 4, train_loss: 1.3538, test_loss: 1.3545, test_f1: 0.2281
 epoch: 5, train_loss: 1.3373, test_loss: 1.3416, test_f1: 0.2614
 epoch: 6, train_loss: 1.3159, test_loss: 1.3276, test_f1: 0.2587
 epoch: 7, train_loss: 1.2920, test_loss: 1.3127, test_f1: 0.2596
 epoch: 8, train_loss: 1.2684, test_loss: 1.3007, test_f1: 0.2634
 epoch: 9, train_loss: 1.2460, test_loss: 1.2912, test_f1: 0.2602
 epoch: 10, train_loss: 1.2250, test_loss: 1.2850, test_f1: 0.2604
 epoch: 11, train_loss: 1.2077, test_loss: 1.2791, test_f1: 0.2612
 epoch: 12, train_loss: 1.1961, test_loss: 1.2788, test_f1: 0.2613
 epoch: 13, train_loss: 1.1860, test_loss: 1.2805, test_f1: 0.2599
 epoch: 14, train_loss: 1.1736, test_loss: 1.2728, test_f1: 0.2653
 epoch: 15, train_loss: 1.1629, test_loss: 1.2749, test_f1: 0.2747
 epoch: 16, train_loss: 1.1570, test_loss: 1.2741, test_f1: 0.3386
 epoch: 17, train_loss: 1.1499, test_loss: 1.2780, test_f1: 0.3173
 epoch: 18, train_loss: 1.1468, test_loss: 1.2691, test_f1: 0.3753
 epoch: 19, train_loss: 1.1423, test_loss: 1.2696, test_f1: 0.4003
 epoch: 20, train_loss: 1.1255, test_loss: 1.2716, test_f1: 0.4089
 epoch: 21, train_loss: 1.1256, test_loss: 1.2665, test_f1: 0.4021
 epoch: 22, train_loss: 1.1149, test_loss: 1.2645, test_f1: 0.3976
 epoch: 23, train_loss: 1.1073, test_loss: 1.2455, test_f1: 0.3909
 epoch: 24, train_loss: 1.1027, test_loss: 1.2423, test_f1: 0.3885
 epoch: 25, train_loss: 1.0889, test_loss: 1.2386, test_f1: 0.3843
 epoch: 26, train_loss: 1.0772, test_loss: 1.2331, test_f1: 0.3896
 epoch: 27, train_loss: 1.0744, test_loss: 1.2321, test_f1: 0.3930
 epoch: 28, train_loss: 1.0628, test_loss: 1.2242, test_f1: 0.4004
 epoch: 29, train_loss: 1.0564, test_loss: 1.2331, test_f1: 0.4207
 epoch: 30, train_loss: 1.0515, test_loss: 1.2270, test_f1: 0.4111
 epoch: 31, train_loss: 1.0358, test_loss: 1.2279, test_f1: 0.4240
 epoch: 32, train_loss: 1.0257, test_loss: 1.2272, test_f1: 0.4337
 epoch: 33, train_loss: 1.0245, test_loss: 1.2219, test_f1: 0.4238
 epoch: 34, train_loss: 1.0091, test_loss: 1.2343, test_f1: 0.4196
 epoch: 35, train_loss: 1.0062, test_loss: 1.2215, test_f1: 0.4299
 epoch: 36, train_loss: 0.9976, test_loss: 1.2188, test_f1: 0.4284
 epoch: 37, train_loss: 0.9993, test_loss: 1.2316, test_f1: 0.4417
 epoch: 38, train_loss: 1.0010, test_loss: 1.2310, test_f1: 0.4359
 epoch: 39, train_loss: 0.9892, test_loss: 1.2349, test_f1: 0.4359
 epoch: 40, train_loss: 0.9811, test_loss: 1.2379, test_f1: 0.4270
 epoch: 41, train_loss: 0.9675, test_loss: 1.2488, test_f1: 0.4378
 epoch: 42, train_loss: 0.9799, test_loss: 1.2522, test_f1: 0.4408
 epoch: 43, train_loss: 0.9738, test_loss: 1.2638, test_f1: 0.4492
 epoch: 44, train_loss: 0.9644, test_loss: 1.2702, test_f1: 0.4460
 epoch: 45, train_loss: 0.9619, test_loss: 1.2817, test_f1: 0.4511
 epoch: 46, train_loss: 0.9598, test_loss: 1.2858, test_f1: 0.4577
 epoch: 47, train_loss: 0.9462, test_loss: 1.2849, test_f1: 0.4685
 epoch: 48, train_loss: 0.9454, test_loss: 1.3067, test_f1: 0.4498
 epoch: 49, train_loss: 0.9555, test_loss: 1.3153, test_f1: 0.4716
 epoch: 50, train_loss: 0.9359, test_loss: 1.2982, test_f1: 0.4572
 epoch: 51, train_loss: 0.9192, test_loss: 1.3273, test_f1: 0.4669
 epoch: 52, train_loss: 0.9273, test_loss: 1.3390, test_f1: 0.4698
 epoch: 53, train_loss: 0.9190, test_loss: 1.3419, test_f1: 0.4742
 epoch: 54, train_loss: 0.9186, test_loss: 1.3308, test_f1: 0.4587
 epoch: 55, train_loss: 0.9237, test_loss: 1.3420, test_f1: 0.4828
 epoch: 56, train_loss: 0.9190, test_loss: 1.3377, test_f1: 0.4736
 epoch: 57, train_loss: 0.9105, test_loss: 1.3360, test_f1: 0.4780
 epoch: 58, train_loss: 0.9179, test_loss: 1.3440, test_f1: 0.4840
 epoch: 59, train_loss: 0.9181, test_loss: 1.3428, test_f1: 0.4664
 epoch: 60, train_loss: 0.9101, test_loss: 1.3549, test_f1: 0.4997
 epoch: 61, train_loss: 0.9009, test_loss: 1.3600, test_f1: 0.4940
 epoch: 62, train_loss: 0.9078, test_loss: 1.3585, test_f1: 0.4938
 epoch: 63, train_loss: 0.9052, test_loss: 1.3674, test_f1: 0.5021
 epoch: 64, train_loss: 0.9011, test_loss: 1.3732, test_f1: 0.4829
 epoch: 65, train_loss: 0.9061, test_loss: 1.3812, test_f1: 0.5089
 epoch: 66, train_loss: 0.8940, test_loss: 1.3780, test_f1: 0.5075
 epoch: 67, train_loss: 0.8977, test_loss: 1.3796, test_f1: 0.5021
 epoch: 68, train_loss: 0.8998, test_loss: 1.3888, test_f1: 0.5171
 epoch: 69, train_loss: 0.8912, test_loss: 1.3761, test_f1: 0.5142
 epoch: 70, train_loss: 0.8944, test_loss: 1.3859, test_f1: 0.5167
 epoch: 71, train_loss: 0.8911, test_loss: 1.3766, test_f1: 0.5142
 epoch: 72, train_loss: 0.8783, test_loss: 1.4093, test_f1: 0.5162
 epoch: 73, train_loss: 0.8933, test_loss: 1.4391, test_f1: 0.5233
 epoch: 74, train_loss: 0.8923, test_loss: 1.4341, test_f1: 0.5117
 epoch: 75, train_loss: 0.8839, test_loss: 1.4316, test_f1: 0.5184
 epoch: 76, train_loss: 0.8826, test_loss: 1.4287, test_f1: 0.5064
 epoch: 77, train_loss: 0.8843, test_loss: 1.4133, test_f1: 0.5029
 epoch: 78, train_loss: 0.8826, test_loss: 1.4443, test_f1: 0.5178
 epoch: 79, train_loss: 0.8721, test_loss: 1.4667, test_f1: 0.5268
 epoch: 80, train_loss: 0.8741, test_loss: 1.4438, test_f1: 0.5266
 epoch: 81, train_loss: 0.8619, test_loss: 1.4328, test_f1: 0.5275
 epoch: 82, train_loss: 0.8646, test_loss: 1.4359, test_f1: 0.5331
 epoch: 83, train_loss: 0.8728, test_loss: 1.4436, test_f1: 0.5204
 epoch: 84, train_loss: 0.8589, test_loss: 1.4827, test_f1: 0.5398
 epoch: 85, train_loss: 0.8635, test_loss: 1.5014, test_f1: 0.5407
 epoch: 86, train_loss: 0.8553, test_loss: 1.4741, test_f1: 0.5323
 epoch: 87, train_loss: 0.8595, test_loss: 1.4944, test_f1: 0.5297
 epoch: 88, train_loss: 0.8564, test_loss: 1.4916, test_f1: 0.5370
 epoch: 89, train_loss: 0.8580, test_loss: 1.4628, test_f1: 0.5372
 epoch: 90, train_loss: 0.8637, test_loss: 1.4724, test_f1: 0.5411
 epoch: 91, train_loss: 0.8584, test_loss: 1.4965, test_f1: 0.5438
 epoch: 92, train_loss: 0.8456, test_loss: 1.4969, test_f1: 0.5460
 epoch: 93, train_loss: 0.8459, test_loss: 1.5237, test_f1: 0.5431
 epoch: 94, train_loss: 0.8437, test_loss: 1.5082, test_f1: 0.5481
 epoch: 95, train_loss: 0.8512, test_loss: 1.5079, test_f1: 0.5450
 epoch: 96, train_loss: 0.8448, test_loss: 1.4881, test_f1: 0.5363
 epoch: 97, train_loss: 0.8270, test_loss: 1.5184, test_f1: 0.5404
 epoch: 98, train_loss: 0.8337, test_loss: 1.5404, test_f1: 0.5457
 epoch: 99, train_loss: 0.8414, test_loss: 1.5552, test_f1: 0.5345
##################ITERATION #1 ****************************************
 epoch: 0, train_loss: 1.3771, test_loss: 1.3753, test_f1: 0.2082
 epoch: 1, train_loss: 1.3331, test_loss: 1.3529, test_f1: 0.2336
 epoch: 2, train_loss: 1.3024, test_loss: 1.3323, test_f1: 0.2281
 epoch: 3, train_loss: 1.2791, test_loss: 1.3146, test_f1: 0.2289
 epoch: 4, train_loss: 1.2549, test_loss: 1.3058, test_f1: 0.2281
 epoch: 5, train_loss: 1.2352, test_loss: 1.2920, test_f1: 0.2281
 epoch: 6, train_loss: 1.2195, test_loss: 1.2889, test_f1: 0.2281
 epoch: 7, train_loss: 1.2025, test_loss: 1.2794, test_f1: 0.2611
 epoch: 8, train_loss: 1.1963, test_loss: 1.2723, test_f1: 0.2974
 epoch: 9, train_loss: 1.1762, test_loss: 1.2593, test_f1: 0.3072
 epoch: 10, train_loss: 1.1711, test_loss: 1.2506, test_f1: 0.3639
 epoch: 11, train_loss: 1.1506, test_loss: 1.2471, test_f1: 0.3708
 epoch: 12, train_loss: 1.1460, test_loss: 1.2449, test_f1: 0.3927
 epoch: 13, train_loss: 1.1293, test_loss: 1.2366, test_f1: 0.4051
 epoch: 14, train_loss: 1.1208, test_loss: 1.2228, test_f1: 0.4190
 epoch: 15, train_loss: 1.1102, test_loss: 1.2169, test_f1: 0.4084
 epoch: 16, train_loss: 1.1077, test_loss: 1.2222, test_f1: 0.4458
 epoch: 17, train_loss: 1.0914, test_loss: 1.2019, test_f1: 0.4421
 epoch: 18, train_loss: 1.0816, test_loss: 1.2013, test_f1: 0.4396
 epoch: 19, train_loss: 1.0743, test_loss: 1.1921, test_f1: 0.4391
 epoch: 20, train_loss: 1.0608, test_loss: 1.1775, test_f1: 0.4420
 epoch: 21, train_loss: 1.0433, test_loss: 1.1757, test_f1: 0.4504
 epoch: 22, train_loss: 1.0391, test_loss: 1.1706, test_f1: 0.4522
 epoch: 23, train_loss: 1.0268, test_loss: 1.1629, test_f1: 0.4447
 epoch: 24, train_loss: 1.0279, test_loss: 1.1666, test_f1: 0.4421
 epoch: 25, train_loss: 1.0133, test_loss: 1.1533, test_f1: 0.4540
 epoch: 26, train_loss: 1.0095, test_loss: 1.1541, test_f1: 0.4581
 epoch: 27, train_loss: 1.0043, test_loss: 1.1501, test_f1: 0.4791
 epoch: 28, train_loss: 0.9945, test_loss: 1.1498, test_f1: 0.4880
 epoch: 29, train_loss: 0.9757, test_loss: 1.1485, test_f1: 0.4994
 epoch: 30, train_loss: 0.9721, test_loss: 1.1486, test_f1: 0.5036
 epoch: 31, train_loss: 0.9637, test_loss: 1.1472, test_f1: 0.5085
 epoch: 32, train_loss: 0.9639, test_loss: 1.1607, test_f1: 0.4998
 epoch: 33, train_loss: 0.9575, test_loss: 1.1572, test_f1: 0.5234
 epoch: 34, train_loss: 0.9521, test_loss: 1.1443, test_f1: 0.5205
 epoch: 35, train_loss: 0.9524, test_loss: 1.1575, test_f1: 0.5305
 epoch: 36, train_loss: 0.9366, test_loss: 1.1618, test_f1: 0.5214
 epoch: 37, train_loss: 0.9269, test_loss: 1.1832, test_f1: 0.5429
 epoch: 38, train_loss: 0.9231, test_loss: 1.1655, test_f1: 0.5490
 epoch: 39, train_loss: 0.9184, test_loss: 1.1479, test_f1: 0.5584
 epoch: 40, train_loss: 0.9052, test_loss: 1.1308, test_f1: 0.5623
 epoch: 41, train_loss: 0.9036, test_loss: 1.1632, test_f1: 0.5746
 epoch: 42, train_loss: 0.8943, test_loss: 1.1659, test_f1: 0.5735
 epoch: 43, train_loss: 0.8906, test_loss: 1.2014, test_f1: 0.5295
 epoch: 44, train_loss: 0.9033, test_loss: 1.1854, test_f1: 0.5576
 epoch: 45, train_loss: 0.8796, test_loss: 1.2153, test_f1: 0.5275
 epoch: 46, train_loss: 0.8905, test_loss: 1.2207, test_f1: 0.5427
 epoch: 47, train_loss: 0.8792, test_loss: 1.1875, test_f1: 0.5481
 epoch: 48, train_loss: 0.8816, test_loss: 1.1995, test_f1: 0.5467
 epoch: 49, train_loss: 0.8659, test_loss: 1.1841, test_f1: 0.5747
 epoch: 50, train_loss: 0.8493, test_loss: 1.1612, test_f1: 0.5608
 epoch: 51, train_loss: 0.8569, test_loss: 1.1863, test_f1: 0.5680
 epoch: 52, train_loss: 0.8492, test_loss: 1.2009, test_f1: 0.5627
 epoch: 53, train_loss: 0.8576, test_loss: 1.1960, test_f1: 0.5588
 epoch: 54, train_loss: 0.8435, test_loss: 1.1888, test_f1: 0.5640
 epoch: 55, train_loss: 0.8560, test_loss: 1.2034, test_f1: 0.5630
 epoch: 56, train_loss: 0.8475, test_loss: 1.2087, test_f1: 0.5729
 epoch: 57, train_loss: 0.8385, test_loss: 1.2205, test_f1: 0.5580
 epoch: 58, train_loss: 0.8335, test_loss: 1.2330, test_f1: 0.5804
 epoch: 59, train_loss: 0.8449, test_loss: 1.2626, test_f1: 0.5618
 epoch: 60, train_loss: 0.8384, test_loss: 1.2444, test_f1: 0.5755
 epoch: 61, train_loss: 0.8288, test_loss: 1.2195, test_f1: 0.5477
 epoch: 62, train_loss: 0.8269, test_loss: 1.2404, test_f1: 0.5450
 epoch: 63, train_loss: 0.8202, test_loss: 1.2370, test_f1: 0.5692
 epoch: 64, train_loss: 0.8327, test_loss: 1.2334, test_f1: 0.5700
 epoch: 65, train_loss: 0.8162, test_loss: 1.2416, test_f1: 0.5381
 epoch: 66, train_loss: 0.8235, test_loss: 1.2533, test_f1: 0.5403
 epoch: 67, train_loss: 0.8234, test_loss: 1.2630, test_f1: 0.5649
 epoch: 68, train_loss: 0.8281, test_loss: 1.2730, test_f1: 0.5832
 epoch: 69, train_loss: 0.8106, test_loss: 1.2917, test_f1: 0.5528
 epoch: 70, train_loss: 0.8184, test_loss: 1.2902, test_f1: 0.5422
 epoch: 71, train_loss: 0.8172, test_loss: 1.2818, test_f1: 0.5602
 epoch: 72, train_loss: 0.8004, test_loss: 1.2745, test_f1: 0.5813
 epoch: 73, train_loss: 0.8153, test_loss: 1.2928, test_f1: 0.5422
 epoch: 74, train_loss: 0.8113, test_loss: 1.2896, test_f1: 0.5393
 epoch: 75, train_loss: 0.8013, test_loss: 1.2840, test_f1: 0.5385
 epoch: 76, train_loss: 0.7992, test_loss: 1.2671, test_f1: 0.5534
 epoch: 77, train_loss: 0.7979, test_loss: 1.2863, test_f1: 0.5547
 epoch: 78, train_loss: 0.8121, test_loss: 1.2725, test_f1: 0.5447
 epoch: 79, train_loss: 0.7947, test_loss: 1.2891, test_f1: 0.5483
 epoch: 80, train_loss: 0.8052, test_loss: 1.2930, test_f1: 0.5453
 epoch: 81, train_loss: 0.7952, test_loss: 1.3046, test_f1: 0.5460
 epoch: 82, train_loss: 0.7796, test_loss: 1.3104, test_f1: 0.5506
 epoch: 83, train_loss: 0.7819, test_loss: 1.3401, test_f1: 0.5521
 epoch: 84, train_loss: 0.7901, test_loss: 1.3402, test_f1: 0.5570
 epoch: 85, train_loss: 0.7904, test_loss: 1.3366, test_f1: 0.5603
 epoch: 86, train_loss: 0.7922, test_loss: 1.3348, test_f1: 0.5587
 epoch: 87, train_loss: 0.7741, test_loss: 1.3686, test_f1: 0.5547
 epoch: 88, train_loss: 0.7991, test_loss: 1.3394, test_f1: 0.5484
 epoch: 89, train_loss: 0.7838, test_loss: 1.3318, test_f1: 0.5571
 epoch: 90, train_loss: 0.7686, test_loss: 1.3294, test_f1: 0.5547
 epoch: 91, train_loss: 0.7795, test_loss: 1.3425, test_f1: 0.5687
 epoch: 92, train_loss: 0.7837, test_loss: 1.3236, test_f1: 0.5627
 epoch: 93, train_loss: 0.7851, test_loss: 1.3159, test_f1: 0.5610
 epoch: 94, train_loss: 0.7705, test_loss: 1.3368, test_f1: 0.5619
 epoch: 95, train_loss: 0.7563, test_loss: 1.3489, test_f1: 0.5583
 epoch: 96, train_loss: 0.7924, test_loss: 1.3654, test_f1: 0.5580
 epoch: 97, train_loss: 0.7677, test_loss: 1.3713, test_f1: 0.5595
 epoch: 98, train_loss: 0.7582, test_loss: 1.3876, test_f1: 0.5489
 epoch: 99, train_loss: 0.7638, test_loss: 1.3937, test_f1: 0.5751
##################ITERATION #2 ****************************************
 epoch: 0, train_loss: 1.3162, test_loss: 1.3606, test_f1: 0.2383
 epoch: 1, train_loss: 1.2783, test_loss: 1.3407, test_f1: 0.2867
 epoch: 2, train_loss: 1.2587, test_loss: 1.3257, test_f1: 0.3028
 epoch: 3, train_loss: 1.2411, test_loss: 1.3214, test_f1: 0.3155
 epoch: 4, train_loss: 1.2220, test_loss: 1.3186, test_f1: 0.3188
 epoch: 5, train_loss: 1.2097, test_loss: 1.2975, test_f1: 0.3433
 epoch: 6, train_loss: 1.1952, test_loss: 1.2876, test_f1: 0.3438
 epoch: 7, train_loss: 1.1807, test_loss: 1.2808, test_f1: 0.3672
 epoch: 8, train_loss: 1.1653, test_loss: 1.2755, test_f1: 0.3975
 epoch: 9, train_loss: 1.1559, test_loss: 1.2612, test_f1: 0.4267
 epoch: 10, train_loss: 1.1401, test_loss: 1.2514, test_f1: 0.4383
 epoch: 11, train_loss: 1.1300, test_loss: 1.2432, test_f1: 0.4452
 epoch: 12, train_loss: 1.1147, test_loss: 1.2346, test_f1: 0.4452
 epoch: 13, train_loss: 1.1062, test_loss: 1.2290, test_f1: 0.4505
 epoch: 14, train_loss: 1.0837, test_loss: 1.2199, test_f1: 0.4498
 epoch: 15, train_loss: 1.0732, test_loss: 1.2178, test_f1: 0.4533
 epoch: 16, train_loss: 1.0654, test_loss: 1.2028, test_f1: 0.4607
 epoch: 17, train_loss: 1.0583, test_loss: 1.1977, test_f1: 0.4522
 epoch: 18, train_loss: 1.0469, test_loss: 1.2060, test_f1: 0.4610
 epoch: 19, train_loss: 1.0485, test_loss: 1.1947, test_f1: 0.4661
 epoch: 20, train_loss: 1.0292, test_loss: 1.1903, test_f1: 0.4638
 epoch: 21, train_loss: 1.0237, test_loss: 1.1729, test_f1: 0.4793
 epoch: 22, train_loss: 1.0166, test_loss: 1.1840, test_f1: 0.4718
 epoch: 23, train_loss: 1.0115, test_loss: 1.1927, test_f1: 0.4824
 epoch: 24, train_loss: 1.0066, test_loss: 1.1946, test_f1: 0.4702
 epoch: 25, train_loss: 1.0069, test_loss: 1.1940, test_f1: 0.5016
 epoch: 26, train_loss: 1.0017, test_loss: 1.1933, test_f1: 0.4753
 epoch: 27, train_loss: 0.9851, test_loss: 1.1923, test_f1: 0.4830
 epoch: 28, train_loss: 0.9876, test_loss: 1.1828, test_f1: 0.4813
 epoch: 29, train_loss: 0.9772, test_loss: 1.1882, test_f1: 0.4776
 epoch: 30, train_loss: 0.9694, test_loss: 1.1858, test_f1: 0.4803
 epoch: 31, train_loss: 0.9846, test_loss: 1.1788, test_f1: 0.4828
 epoch: 32, train_loss: 0.9724, test_loss: 1.1929, test_f1: 0.4950
 epoch: 33, train_loss: 0.9598, test_loss: 1.1856, test_f1: 0.4921
 epoch: 34, train_loss: 0.9631, test_loss: 1.1925, test_f1: 0.4910
 epoch: 35, train_loss: 0.9540, test_loss: 1.1888, test_f1: 0.4831
 epoch: 36, train_loss: 0.9420, test_loss: 1.1947, test_f1: 0.5022
 epoch: 37, train_loss: 0.9466, test_loss: 1.1903, test_f1: 0.5000
 epoch: 38, train_loss: 0.9477, test_loss: 1.1969, test_f1: 0.4994
 epoch: 39, train_loss: 0.9269, test_loss: 1.1907, test_f1: 0.4947
 epoch: 40, train_loss: 0.9325, test_loss: 1.1877, test_f1: 0.4976
 epoch: 41, train_loss: 0.9321, test_loss: 1.1902, test_f1: 0.4981
 epoch: 42, train_loss: 0.9286, test_loss: 1.2000, test_f1: 0.5014
 epoch: 43, train_loss: 0.9238, test_loss: 1.2136, test_f1: 0.5051
 epoch: 44, train_loss: 0.9136, test_loss: 1.1866, test_f1: 0.5042
 epoch: 45, train_loss: 0.9117, test_loss: 1.2082, test_f1: 0.5122
 epoch: 46, train_loss: 0.9002, test_loss: 1.2081, test_f1: 0.5066
 epoch: 47, train_loss: 0.9133, test_loss: 1.2179, test_f1: 0.4993
 epoch: 48, train_loss: 0.9151, test_loss: 1.2070, test_f1: 0.4900
 epoch: 49, train_loss: 0.9018, test_loss: 1.2090, test_f1: 0.5152
 epoch: 50, train_loss: 0.8919, test_loss: 1.2104, test_f1: 0.5074
 epoch: 51, train_loss: 0.8875, test_loss: 1.2225, test_f1: 0.5178
 epoch: 52, train_loss: 0.8882, test_loss: 1.2281, test_f1: 0.4961
 epoch: 53, train_loss: 0.8913, test_loss: 1.2253, test_f1: 0.4986
 epoch: 54, train_loss: 0.8905, test_loss: 1.2126, test_f1: 0.5154
 epoch: 55, train_loss: 0.8827, test_loss: 1.2110, test_f1: 0.5016
 epoch: 56, train_loss: 0.8740, test_loss: 1.2114, test_f1: 0.5045
 epoch: 57, train_loss: 0.8723, test_loss: 1.2162, test_f1: 0.5074
 epoch: 58, train_loss: 0.8832, test_loss: 1.2241, test_f1: 0.5077
 epoch: 59, train_loss: 0.8762, test_loss: 1.2116, test_f1: 0.5048
 epoch: 60, train_loss: 0.8689, test_loss: 1.2374, test_f1: 0.4942
 epoch: 61, train_loss: 0.8746, test_loss: 1.2202, test_f1: 0.5074
 epoch: 62, train_loss: 0.8692, test_loss: 1.2221, test_f1: 0.4991
 epoch: 63, train_loss: 0.8813, test_loss: 1.2234, test_f1: 0.5128
 epoch: 64, train_loss: 0.8672, test_loss: 1.2166, test_f1: 0.5128
 epoch: 65, train_loss: 0.8668, test_loss: 1.2297, test_f1: 0.5129
 epoch: 66, train_loss: 0.8643, test_loss: 1.2350, test_f1: 0.5258
 epoch: 67, train_loss: 0.8577, test_loss: 1.2102, test_f1: 0.5330
 epoch: 68, train_loss: 0.8587, test_loss: 1.2286, test_f1: 0.5236
 epoch: 69, train_loss: 0.8641, test_loss: 1.2289, test_f1: 0.5258
 epoch: 70, train_loss: 0.8457, test_loss: 1.2196, test_f1: 0.5172
 epoch: 71, train_loss: 0.8634, test_loss: 1.2307, test_f1: 0.5102
 epoch: 72, train_loss: 0.8504, test_loss: 1.2320, test_f1: 0.5023
 epoch: 73, train_loss: 0.8624, test_loss: 1.2159, test_f1: 0.5388
 epoch: 74, train_loss: 0.8551, test_loss: 1.2370, test_f1: 0.5174
 epoch: 75, train_loss: 0.8513, test_loss: 1.2435, test_f1: 0.5102
 epoch: 76, train_loss: 0.8590, test_loss: 1.2433, test_f1: 0.5256
 epoch: 77, train_loss: 0.8419, test_loss: 1.2312, test_f1: 0.5437
 epoch: 78, train_loss: 0.8492, test_loss: 1.2478, test_f1: 0.5308
 epoch: 79, train_loss: 0.8481, test_loss: 1.2496, test_f1: 0.5287
 epoch: 80, train_loss: 0.8459, test_loss: 1.2348, test_f1: 0.5283
 epoch: 81, train_loss: 0.8303, test_loss: 1.2458, test_f1: 0.5333
 epoch: 82, train_loss: 0.8351, test_loss: 1.2362, test_f1: 0.5411
 epoch: 83, train_loss: 0.8414, test_loss: 1.2510, test_f1: 0.5312
 epoch: 84, train_loss: 0.8338, test_loss: 1.2504, test_f1: 0.5331
 epoch: 85, train_loss: 0.8356, test_loss: 1.2463, test_f1: 0.5355
 epoch: 86, train_loss: 0.8375, test_loss: 1.2516, test_f1: 0.5330
 epoch: 87, train_loss: 0.8397, test_loss: 1.2757, test_f1: 0.5232
 epoch: 88, train_loss: 0.8324, test_loss: 1.2644, test_f1: 0.5307
 epoch: 89, train_loss: 0.8561, test_loss: 1.2617, test_f1: 0.5253
 epoch: 90, train_loss: 0.8321, test_loss: 1.2451, test_f1: 0.5413
 epoch: 91, train_loss: 0.8286, test_loss: 1.2457, test_f1: 0.5329
 epoch: 92, train_loss: 0.8240, test_loss: 1.2355, test_f1: 0.5433
 epoch: 93, train_loss: 0.8324, test_loss: 1.2475, test_f1: 0.5437
 epoch: 94, train_loss: 0.8187, test_loss: 1.2505, test_f1: 0.5361
 epoch: 95, train_loss: 0.8145, test_loss: 1.2608, test_f1: 0.5237
 epoch: 96, train_loss: 0.8228, test_loss: 1.2551, test_f1: 0.5335
 epoch: 97, train_loss: 0.8134, test_loss: 1.2444, test_f1: 0.5386
 epoch: 98, train_loss: 0.8271, test_loss: 1.2730, test_f1: 0.5278
 epoch: 99, train_loss: 0.8173, test_loss: 1.2516, test_f1: 0.5394
##################ITERATION #3 ****************************************
 epoch: 0, train_loss: 1.2914, test_loss: 1.3342, test_f1: 0.2285
 epoch: 1, train_loss: 1.2362, test_loss: 1.3071, test_f1: 0.2630
 epoch: 2, train_loss: 1.2265, test_loss: 1.2865, test_f1: 0.3278
 epoch: 3, train_loss: 1.1964, test_loss: 1.2699, test_f1: 0.3800
 epoch: 4, train_loss: 1.1765, test_loss: 1.2507, test_f1: 0.3718
 epoch: 5, train_loss: 1.1653, test_loss: 1.2380, test_f1: 0.4049
 epoch: 6, train_loss: 1.1473, test_loss: 1.2255, test_f1: 0.4400
 epoch: 7, train_loss: 1.1369, test_loss: 1.2141, test_f1: 0.4319
 epoch: 8, train_loss: 1.1222, test_loss: 1.2086, test_f1: 0.4664
 epoch: 9, train_loss: 1.1023, test_loss: 1.2012, test_f1: 0.4655
 epoch: 10, train_loss: 1.1019, test_loss: 1.1907, test_f1: 0.4800
 epoch: 11, train_loss: 1.0890, test_loss: 1.1865, test_f1: 0.4836
 epoch: 12, train_loss: 1.0707, test_loss: 1.1826, test_f1: 0.4914
 epoch: 13, train_loss: 1.0639, test_loss: 1.1829, test_f1: 0.4821
 epoch: 14, train_loss: 1.0575, test_loss: 1.1805, test_f1: 0.4882
 epoch: 15, train_loss: 1.0517, test_loss: 1.1797, test_f1: 0.4920
 epoch: 16, train_loss: 1.0406, test_loss: 1.1807, test_f1: 0.5057
 epoch: 17, train_loss: 1.0320, test_loss: 1.1777, test_f1: 0.5128
 epoch: 18, train_loss: 1.0295, test_loss: 1.1736, test_f1: 0.5260
 epoch: 19, train_loss: 1.0186, test_loss: 1.1711, test_f1: 0.5347
 epoch: 20, train_loss: 1.0132, test_loss: 1.1661, test_f1: 0.5396
 epoch: 21, train_loss: 1.0068, test_loss: 1.1689, test_f1: 0.5490
 epoch: 22, train_loss: 1.0089, test_loss: 1.1664, test_f1: 0.5487
 epoch: 23, train_loss: 0.9957, test_loss: 1.1674, test_f1: 0.5429
 epoch: 24, train_loss: 0.9802, test_loss: 1.1649, test_f1: 0.5609
 epoch: 25, train_loss: 0.9756, test_loss: 1.1710, test_f1: 0.5527
 epoch: 26, train_loss: 0.9702, test_loss: 1.1657, test_f1: 0.5589
 epoch: 27, train_loss: 0.9636, test_loss: 1.1588, test_f1: 0.5614
 epoch: 28, train_loss: 0.9568, test_loss: 1.1657, test_f1: 0.5622
 epoch: 29, train_loss: 0.9661, test_loss: 1.1655, test_f1: 0.5640
 epoch: 30, train_loss: 0.9458, test_loss: 1.1723, test_f1: 0.5521
 epoch: 31, train_loss: 0.9441, test_loss: 1.1802, test_f1: 0.5475
 epoch: 32, train_loss: 0.9429, test_loss: 1.1719, test_f1: 0.5466
 epoch: 33, train_loss: 0.9251, test_loss: 1.1744, test_f1: 0.5483
 epoch: 34, train_loss: 0.9129, test_loss: 1.1581, test_f1: 0.5582
 epoch: 35, train_loss: 0.9125, test_loss: 1.1609, test_f1: 0.5697
 epoch: 36, train_loss: 0.9194, test_loss: 1.1620, test_f1: 0.5667
 epoch: 37, train_loss: 0.9082, test_loss: 1.1677, test_f1: 0.5495
 epoch: 38, train_loss: 0.9056, test_loss: 1.1598, test_f1: 0.5776
 epoch: 39, train_loss: 0.8954, test_loss: 1.1668, test_f1: 0.5569
 epoch: 40, train_loss: 0.8969, test_loss: 1.1659, test_f1: 0.5438
 epoch: 41, train_loss: 0.8928, test_loss: 1.1617, test_f1: 0.5295
 epoch: 42, train_loss: 0.8892, test_loss: 1.1893, test_f1: 0.5541
 epoch: 43, train_loss: 0.8838, test_loss: 1.1766, test_f1: 0.5490
 epoch: 44, train_loss: 0.8802, test_loss: 1.1718, test_f1: 0.5543
 epoch: 45, train_loss: 0.8694, test_loss: 1.1693, test_f1: 0.5548
 epoch: 46, train_loss: 0.8597, test_loss: 1.1910, test_f1: 0.5525
 epoch: 47, train_loss: 0.8589, test_loss: 1.1912, test_f1: 0.5525
 epoch: 48, train_loss: 0.8585, test_loss: 1.2022, test_f1: 0.5409
 epoch: 49, train_loss: 0.8531, test_loss: 1.2029, test_f1: 0.5405
 epoch: 50, train_loss: 0.8520, test_loss: 1.1892, test_f1: 0.5507
 epoch: 51, train_loss: 0.8513, test_loss: 1.1812, test_f1: 0.5355
 epoch: 52, train_loss: 0.8243, test_loss: 1.1833, test_f1: 0.5489
 epoch: 53, train_loss: 0.8352, test_loss: 1.1992, test_f1: 0.5581
 epoch: 54, train_loss: 0.8447, test_loss: 1.2051, test_f1: 0.5374
 epoch: 55, train_loss: 0.8313, test_loss: 1.1831, test_f1: 0.5418
 epoch: 56, train_loss: 0.8355, test_loss: 1.2001, test_f1: 0.5466
 epoch: 57, train_loss: 0.8290, test_loss: 1.1898, test_f1: 0.5445
 epoch: 58, train_loss: 0.8361, test_loss: 1.2058, test_f1: 0.5428
 epoch: 59, train_loss: 0.8371, test_loss: 1.2068, test_f1: 0.5390
 epoch: 60, train_loss: 0.8134, test_loss: 1.2161, test_f1: 0.5418
 epoch: 61, train_loss: 0.8239, test_loss: 1.2166, test_f1: 0.5437
 epoch: 62, train_loss: 0.8170, test_loss: 1.2046, test_f1: 0.5426
 epoch: 63, train_loss: 0.8119, test_loss: 1.2102, test_f1: 0.5446
 epoch: 64, train_loss: 0.8138, test_loss: 1.2199, test_f1: 0.5420
 epoch: 65, train_loss: 0.8184, test_loss: 1.2206, test_f1: 0.5549
 epoch: 66, train_loss: 0.8134, test_loss: 1.2276, test_f1: 0.5585
 epoch: 67, train_loss: 0.8007, test_loss: 1.2175, test_f1: 0.5585
 epoch: 68, train_loss: 0.8044, test_loss: 1.2166, test_f1: 0.5562
 epoch: 69, train_loss: 0.8257, test_loss: 1.2269, test_f1: 0.5314
 epoch: 70, train_loss: 0.8019, test_loss: 1.2287, test_f1: 0.5374
 epoch: 71, train_loss: 0.7818, test_loss: 1.2416, test_f1: 0.5350
 epoch: 72, train_loss: 0.7924, test_loss: 1.2333, test_f1: 0.5266
 epoch: 73, train_loss: 0.7985, test_loss: 1.2246, test_f1: 0.5448
 epoch: 74, train_loss: 0.7993, test_loss: 1.2387, test_f1: 0.5393
 epoch: 75, train_loss: 0.7905, test_loss: 1.2326, test_f1: 0.5431
 epoch: 76, train_loss: 0.8027, test_loss: 1.2477, test_f1: 0.5458
 epoch: 77, train_loss: 0.7862, test_loss: 1.2501, test_f1: 0.5509
 epoch: 78, train_loss: 0.7889, test_loss: 1.2382, test_f1: 0.5454
 epoch: 79, train_loss: 0.7751, test_loss: 1.2389, test_f1: 0.5372
 epoch: 80, train_loss: 0.7749, test_loss: 1.2345, test_f1: 0.5389
 epoch: 81, train_loss: 0.7798, test_loss: 1.2611, test_f1: 0.5295
 epoch: 82, train_loss: 0.7791, test_loss: 1.2489, test_f1: 0.5348
 epoch: 83, train_loss: 0.7750, test_loss: 1.2476, test_f1: 0.5422
 epoch: 84, train_loss: 0.7828, test_loss: 1.2463, test_f1: 0.5495
 epoch: 85, train_loss: 0.7735, test_loss: 1.2588, test_f1: 0.5508
 epoch: 86, train_loss: 0.7611, test_loss: 1.2488, test_f1: 0.5472
 epoch: 87, train_loss: 0.7626, test_loss: 1.2295, test_f1: 0.5552
 epoch: 88, train_loss: 0.7598, test_loss: 1.2575, test_f1: 0.5397
 epoch: 89, train_loss: 0.7717, test_loss: 1.2837, test_f1: 0.5428
 epoch: 90, train_loss: 0.7659, test_loss: 1.2597, test_f1: 0.5402
 epoch: 91, train_loss: 0.7606, test_loss: 1.2763, test_f1: 0.5356
 epoch: 92, train_loss: 0.7557, test_loss: 1.2752, test_f1: 0.5510
 epoch: 93, train_loss: 0.7526, test_loss: 1.2876, test_f1: 0.5317
 epoch: 94, train_loss: 0.7495, test_loss: 1.2983, test_f1: 0.5137
 epoch: 95, train_loss: 0.7629, test_loss: 1.3132, test_f1: 0.5075
 epoch: 96, train_loss: 0.7534, test_loss: 1.2958, test_f1: 0.5222
 epoch: 97, train_loss: 0.7652, test_loss: 1.2878, test_f1: 0.5398
 epoch: 98, train_loss: 0.7488, test_loss: 1.3056, test_f1: 0.5171
 epoch: 99, train_loss: 0.7531, test_loss: 1.3174, test_f1: 0.5202
##################ITERATION #4 ****************************************
 epoch: 0, train_loss: 1.3014, test_loss: 1.3483, test_f1: 0.2976
 epoch: 1, train_loss: 1.2478, test_loss: 1.3240, test_f1: 0.3256
 epoch: 2, train_loss: 1.2211, test_loss: 1.3017, test_f1: 0.3473
 epoch: 3, train_loss: 1.1886, test_loss: 1.2943, test_f1: 0.3847
 epoch: 4, train_loss: 1.1771, test_loss: 1.2731, test_f1: 0.4187
 epoch: 5, train_loss: 1.1499, test_loss: 1.2689, test_f1: 0.4387
 epoch: 6, train_loss: 1.1362, test_loss: 1.2536, test_f1: 0.4418
 epoch: 7, train_loss: 1.1241, test_loss: 1.2370, test_f1: 0.4640
 epoch: 8, train_loss: 1.1081, test_loss: 1.2372, test_f1: 0.4779
 epoch: 9, train_loss: 1.0952, test_loss: 1.2039, test_f1: 0.4920
 epoch: 10, train_loss: 1.0718, test_loss: 1.1990, test_f1: 0.5041
 epoch: 11, train_loss: 1.0737, test_loss: 1.1929, test_f1: 0.5154
 epoch: 12, train_loss: 1.0640, test_loss: 1.1868, test_f1: 0.5186
 epoch: 13, train_loss: 1.0525, test_loss: 1.1887, test_f1: 0.5417
 epoch: 14, train_loss: 1.0367, test_loss: 1.1893, test_f1: 0.5423
 epoch: 15, train_loss: 1.0301, test_loss: 1.1892, test_f1: 0.5200
 epoch: 16, train_loss: 1.0212, test_loss: 1.1850, test_f1: 0.5480
 epoch: 17, train_loss: 1.0197, test_loss: 1.1876, test_f1: 0.5097
 epoch: 18, train_loss: 1.0079, test_loss: 1.1834, test_f1: 0.5099
 epoch: 19, train_loss: 1.0097, test_loss: 1.1789, test_f1: 0.5414
 epoch: 20, train_loss: 0.9956, test_loss: 1.1628, test_f1: 0.5579
 epoch: 21, train_loss: 0.9856, test_loss: 1.1678, test_f1: 0.5494
 epoch: 22, train_loss: 0.9756, test_loss: 1.1720, test_f1: 0.5331
 epoch: 23, train_loss: 0.9764, test_loss: 1.1699, test_f1: 0.5536
 epoch: 24, train_loss: 0.9758, test_loss: 1.1763, test_f1: 0.5200
 epoch: 25, train_loss: 0.9547, test_loss: 1.1784, test_f1: 0.5303
 epoch: 26, train_loss: 0.9672, test_loss: 1.1674, test_f1: 0.5325
 epoch: 27, train_loss: 0.9517, test_loss: 1.1561, test_f1: 0.5592
 epoch: 28, train_loss: 0.9470, test_loss: 1.1429, test_f1: 0.5618
 epoch: 29, train_loss: 0.9542, test_loss: 1.1497, test_f1: 0.5673
 epoch: 30, train_loss: 0.9472, test_loss: 1.1823, test_f1: 0.5330
 epoch: 31, train_loss: 0.9331, test_loss: 1.1742, test_f1: 0.5512
 epoch: 32, train_loss: 0.9291, test_loss: 1.1668, test_f1: 0.5494
 epoch: 33, train_loss: 0.9373, test_loss: 1.1690, test_f1: 0.5595
 epoch: 34, train_loss: 0.9262, test_loss: 1.1672, test_f1: 0.5720
 epoch: 35, train_loss: 0.9108, test_loss: 1.1630, test_f1: 0.5644
 epoch: 36, train_loss: 0.9173, test_loss: 1.1559, test_f1: 0.5767
 epoch: 37, train_loss: 0.9197, test_loss: 1.1836, test_f1: 0.5318
 epoch: 38, train_loss: 0.9043, test_loss: 1.1659, test_f1: 0.5850
 epoch: 39, train_loss: 0.8977, test_loss: 1.1540, test_f1: 0.5882
 epoch: 40, train_loss: 0.8948, test_loss: 1.1576, test_f1: 0.5722
 epoch: 41, train_loss: 0.8992, test_loss: 1.1728, test_f1: 0.5876
 epoch: 42, train_loss: 0.9064, test_loss: 1.1602, test_f1: 0.5679
 epoch: 43, train_loss: 0.8940, test_loss: 1.1807, test_f1: 0.5803
 epoch: 44, train_loss: 0.8857, test_loss: 1.1921, test_f1: 0.5804
 epoch: 45, train_loss: 0.8857, test_loss: 1.1804, test_f1: 0.5876
 epoch: 46, train_loss: 0.8740, test_loss: 1.2009, test_f1: 0.5627
 epoch: 47, train_loss: 0.8687, test_loss: 1.1840, test_f1: 0.5924
 epoch: 48, train_loss: 0.8728, test_loss: 1.2187, test_f1: 0.5662
 epoch: 49, train_loss: 0.8612, test_loss: 1.1937, test_f1: 0.5823
 epoch: 50, train_loss: 0.8550, test_loss: 1.2011, test_f1: 0.5822
 epoch: 51, train_loss: 0.8484, test_loss: 1.2053, test_f1: 0.5640
 epoch: 52, train_loss: 0.8561, test_loss: 1.1945, test_f1: 0.5934
 epoch: 53, train_loss: 0.8445, test_loss: 1.1821, test_f1: 0.5898
 epoch: 54, train_loss: 0.8546, test_loss: 1.2024, test_f1: 0.5776
 epoch: 55, train_loss: 0.8424, test_loss: 1.1939, test_f1: 0.5775
 epoch: 56, train_loss: 0.8424, test_loss: 1.1898, test_f1: 0.5695
 epoch: 57, train_loss: 0.8300, test_loss: 1.1814, test_f1: 0.5924
 epoch: 58, train_loss: 0.8398, test_loss: 1.1881, test_f1: 0.5643
 epoch: 59, train_loss: 0.8465, test_loss: 1.1783, test_f1: 0.5749
 epoch: 60, train_loss: 0.8399, test_loss: 1.1960, test_f1: 0.5751
 epoch: 61, train_loss: 0.8414, test_loss: 1.1939, test_f1: 0.5697
 epoch: 62, train_loss: 0.8375, test_loss: 1.1987, test_f1: 0.5801
 epoch: 63, train_loss: 0.8415, test_loss: 1.1928, test_f1: 0.5738
 epoch: 64, train_loss: 0.8252, test_loss: 1.1891, test_f1: 0.5822
 epoch: 65, train_loss: 0.8330, test_loss: 1.1954, test_f1: 0.5796
 epoch: 66, train_loss: 0.8208, test_loss: 1.1809, test_f1: 0.5883
 epoch: 67, train_loss: 0.8363, test_loss: 1.1942, test_f1: 0.5775
 epoch: 68, train_loss: 0.8270, test_loss: 1.2163, test_f1: 0.5800
 epoch: 69, train_loss: 0.8086, test_loss: 1.2182, test_f1: 0.5824
 epoch: 70, train_loss: 0.8063, test_loss: 1.2022, test_f1: 0.5751
 epoch: 71, train_loss: 0.8176, test_loss: 1.2337, test_f1: 0.5701
 epoch: 72, train_loss: 0.8146, test_loss: 1.2301, test_f1: 0.5569
 epoch: 73, train_loss: 0.8189, test_loss: 1.2044, test_f1: 0.5780
 epoch: 74, train_loss: 0.8156, test_loss: 1.2224, test_f1: 0.5802
 epoch: 75, train_loss: 0.8181, test_loss: 1.2183, test_f1: 0.5779
 epoch: 76, train_loss: 0.8032, test_loss: 1.2254, test_f1: 0.5699
 epoch: 77, train_loss: 0.8092, test_loss: 1.2063, test_f1: 0.5671
 epoch: 78, train_loss: 0.8066, test_loss: 1.2127, test_f1: 0.5804
 epoch: 79, train_loss: 0.8079, test_loss: 1.2176, test_f1: 0.5751
 epoch: 80, train_loss: 0.7888, test_loss: 1.2301, test_f1: 0.5830
 epoch: 81, train_loss: 0.8024, test_loss: 1.2210, test_f1: 0.5697
 epoch: 82, train_loss: 0.7906, test_loss: 1.2037, test_f1: 0.5854
 epoch: 83, train_loss: 0.8009, test_loss: 1.2180, test_f1: 0.5768
 epoch: 84, train_loss: 0.7982, test_loss: 1.2039, test_f1: 0.5776
 epoch: 85, train_loss: 0.7853, test_loss: 1.2143, test_f1: 0.5936
 epoch: 86, train_loss: 0.7783, test_loss: 1.2189, test_f1: 0.5804
 epoch: 87, train_loss: 0.7809, test_loss: 1.2234, test_f1: 0.5945
 epoch: 88, train_loss: 0.7949, test_loss: 1.2144, test_f1: 0.5723
 epoch: 89, train_loss: 0.7744, test_loss: 1.2244, test_f1: 0.5754
 epoch: 90, train_loss: 0.7892, test_loss: 1.2288, test_f1: 0.5723
 epoch: 91, train_loss: 0.7941, test_loss: 1.2154, test_f1: 0.5780
 epoch: 92, train_loss: 0.7803, test_loss: 1.2292, test_f1: 0.5732
 epoch: 93, train_loss: 0.7744, test_loss: 1.2386, test_f1: 0.5728
 epoch: 94, train_loss: 0.7835, test_loss: 1.2313, test_f1: 0.5807
 epoch: 95, train_loss: 0.7760, test_loss: 1.2383, test_f1: 0.5707
 epoch: 96, train_loss: 0.7712, test_loss: 1.2404, test_f1: 0.5855
 epoch: 97, train_loss: 0.7802, test_loss: 1.2352, test_f1: 0.5671
 epoch: 98, train_loss: 0.7797, test_loss: 1.2545, test_f1: 0.5804
 epoch: 99, train_loss: 0.7771, test_loss: 1.2519, test_f1: 0.5778
##################ITERATION #5 ****************************************
 epoch: 0, train_loss: 1.3140, test_loss: 1.3481, test_f1: 0.2456
 epoch: 1, train_loss: 1.2448, test_loss: 1.3273, test_f1: 0.2897
 epoch: 2, train_loss: 1.2205, test_loss: 1.2860, test_f1: 0.3782
 epoch: 3, train_loss: 1.1870, test_loss: 1.2715, test_f1: 0.4099
 epoch: 4, train_loss: 1.1841, test_loss: 1.2494, test_f1: 0.4349
 epoch: 5, train_loss: 1.1524, test_loss: 1.2338, test_f1: 0.4349
 epoch: 6, train_loss: 1.1425, test_loss: 1.2253, test_f1: 0.4405
 epoch: 7, train_loss: 1.1267, test_loss: 1.2198, test_f1: 0.4491
 epoch: 8, train_loss: 1.1119, test_loss: 1.2034, test_f1: 0.4327
 epoch: 9, train_loss: 1.1089, test_loss: 1.1972, test_f1: 0.4192
 epoch: 10, train_loss: 1.0820, test_loss: 1.1805, test_f1: 0.4395
 epoch: 11, train_loss: 1.0698, test_loss: 1.1755, test_f1: 0.4690
 epoch: 12, train_loss: 1.0593, test_loss: 1.1682, test_f1: 0.4774
 epoch: 13, train_loss: 1.0497, test_loss: 1.1779, test_f1: 0.4848
 epoch: 14, train_loss: 1.0384, test_loss: 1.1679, test_f1: 0.4815
 epoch: 15, train_loss: 1.0415, test_loss: 1.1668, test_f1: 0.4623
 epoch: 16, train_loss: 1.0252, test_loss: 1.1683, test_f1: 0.4982
 epoch: 17, train_loss: 1.0187, test_loss: 1.1713, test_f1: 0.4634
 epoch: 18, train_loss: 1.0105, test_loss: 1.1589, test_f1: 0.4983
 epoch: 19, train_loss: 1.0165, test_loss: 1.1606, test_f1: 0.4869
 epoch: 20, train_loss: 1.0027, test_loss: 1.1599, test_f1: 0.5187
 epoch: 21, train_loss: 0.9925, test_loss: 1.1636, test_f1: 0.5196
 epoch: 22, train_loss: 0.9901, test_loss: 1.1629, test_f1: 0.5212
 epoch: 23, train_loss: 0.9784, test_loss: 1.1845, test_f1: 0.4882
 epoch: 24, train_loss: 0.9573, test_loss: 1.1631, test_f1: 0.5053
 epoch: 25, train_loss: 0.9804, test_loss: 1.1599, test_f1: 0.5145
 epoch: 26, train_loss: 0.9646, test_loss: 1.1688, test_f1: 0.4955
 epoch: 27, train_loss: 0.9867, test_loss: 1.1587, test_f1: 0.4940
 epoch: 28, train_loss: 0.9624, test_loss: 1.1545, test_f1: 0.4779
 epoch: 29, train_loss: 0.9460, test_loss: 1.1668, test_f1: 0.4839
 epoch: 30, train_loss: 0.9413, test_loss: 1.1495, test_f1: 0.5027
 epoch: 31, train_loss: 0.9414, test_loss: 1.1634, test_f1: 0.4882
 epoch: 32, train_loss: 0.9296, test_loss: 1.1815, test_f1: 0.4918
 epoch: 33, train_loss: 0.9338, test_loss: 1.1533, test_f1: 0.5095
 epoch: 34, train_loss: 0.9304, test_loss: 1.1344, test_f1: 0.5393
 epoch: 35, train_loss: 0.9295, test_loss: 1.1435, test_f1: 0.5238
 epoch: 36, train_loss: 0.9235, test_loss: 1.1633, test_f1: 0.5099
 epoch: 37, train_loss: 0.9070, test_loss: 1.1305, test_f1: 0.5553
 epoch: 38, train_loss: 0.9061, test_loss: 1.1513, test_f1: 0.5156
 epoch: 39, train_loss: 0.9093, test_loss: 1.1387, test_f1: 0.5151
 epoch: 40, train_loss: 0.9140, test_loss: 1.1571, test_f1: 0.5218
 epoch: 41, train_loss: 0.8904, test_loss: 1.1590, test_f1: 0.4828
 epoch: 42, train_loss: 0.8867, test_loss: 1.1678, test_f1: 0.5094
 epoch: 43, train_loss: 0.8945, test_loss: 1.1312, test_f1: 0.5038
 epoch: 44, train_loss: 0.8808, test_loss: 1.1467, test_f1: 0.5098
 epoch: 45, train_loss: 0.8849, test_loss: 1.1318, test_f1: 0.5218
 epoch: 46, train_loss: 0.8807, test_loss: 1.1253, test_f1: 0.5395
 epoch: 47, train_loss: 0.8652, test_loss: 1.1496, test_f1: 0.5138
 epoch: 48, train_loss: 0.8652, test_loss: 1.1363, test_f1: 0.5296
 epoch: 49, train_loss: 0.8611, test_loss: 1.1575, test_f1: 0.5162
 epoch: 50, train_loss: 0.8636, test_loss: 1.1281, test_f1: 0.5451
 epoch: 51, train_loss: 0.8588, test_loss: 1.1335, test_f1: 0.5395
 epoch: 52, train_loss: 0.8517, test_loss: 1.1404, test_f1: 0.5162
 epoch: 53, train_loss: 0.8501, test_loss: 1.1377, test_f1: 0.5235
 epoch: 54, train_loss: 0.8432, test_loss: 1.1428, test_f1: 0.5306
 epoch: 55, train_loss: 0.8541, test_loss: 1.1440, test_f1: 0.5342
 epoch: 56, train_loss: 0.8294, test_loss: 1.1698, test_f1: 0.5233
 epoch: 57, train_loss: 0.8484, test_loss: 1.1277, test_f1: 0.5308
 epoch: 58, train_loss: 0.8312, test_loss: 1.1199, test_f1: 0.5414
 epoch: 59, train_loss: 0.8489, test_loss: 1.1306, test_f1: 0.5306
 epoch: 60, train_loss: 0.8390, test_loss: 1.1582, test_f1: 0.5313
 epoch: 61, train_loss: 0.8325, test_loss: 1.1312, test_f1: 0.5562
 epoch: 62, train_loss: 0.8238, test_loss: 1.1536, test_f1: 0.5370
 epoch: 63, train_loss: 0.8345, test_loss: 1.1872, test_f1: 0.5368
 epoch: 64, train_loss: 0.8201, test_loss: 1.1916, test_f1: 0.5310
 epoch: 65, train_loss: 0.8276, test_loss: 1.1688, test_f1: 0.5396
 epoch: 66, train_loss: 0.8416, test_loss: 1.1799, test_f1: 0.5287
 epoch: 67, train_loss: 0.8276, test_loss: 1.1430, test_f1: 0.5439
 epoch: 68, train_loss: 0.8165, test_loss: 1.1482, test_f1: 0.5345
 epoch: 69, train_loss: 0.8131, test_loss: 1.1633, test_f1: 0.5447
 epoch: 70, train_loss: 0.8126, test_loss: 1.1676, test_f1: 0.5429
 epoch: 71, train_loss: 0.8229, test_loss: 1.1687, test_f1: 0.5482
 epoch: 72, train_loss: 0.8285, test_loss: 1.1516, test_f1: 0.5420
 epoch: 73, train_loss: 0.8156, test_loss: 1.1563, test_f1: 0.5346
 epoch: 74, train_loss: 0.8208, test_loss: 1.1704, test_f1: 0.5400
 epoch: 75, train_loss: 0.8030, test_loss: 1.1392, test_f1: 0.5587
 epoch: 76, train_loss: 0.8065, test_loss: 1.1321, test_f1: 0.5459
 epoch: 77, train_loss: 0.7918, test_loss: 1.1653, test_f1: 0.5457
 epoch: 78, train_loss: 0.8056, test_loss: 1.1801, test_f1: 0.5552
 epoch: 79, train_loss: 0.8134, test_loss: 1.1631, test_f1: 0.5531
 epoch: 80, train_loss: 0.7952, test_loss: 1.1459, test_f1: 0.5424
 epoch: 81, train_loss: 0.7959, test_loss: 1.1992, test_f1: 0.5531
 epoch: 82, train_loss: 0.7986, test_loss: 1.1658, test_f1: 0.5391
 epoch: 83, train_loss: 0.7946, test_loss: 1.1664, test_f1: 0.5322
 epoch: 84, train_loss: 0.7974, test_loss: 1.1452, test_f1: 0.5563
 epoch: 85, train_loss: 0.8010, test_loss: 1.1980, test_f1: 0.5336
 epoch: 86, train_loss: 0.7934, test_loss: 1.1392, test_f1: 0.5516
 epoch: 87, train_loss: 0.7886, test_loss: 1.2153, test_f1: 0.5337
 epoch: 88, train_loss: 0.7830, test_loss: 1.2023, test_f1: 0.5345
 epoch: 89, train_loss: 0.7776, test_loss: 1.2057, test_f1: 0.5425
 epoch: 90, train_loss: 0.7705, test_loss: 1.1541, test_f1: 0.5482
 epoch: 91, train_loss: 0.7729, test_loss: 1.1650, test_f1: 0.5614
 epoch: 92, train_loss: 0.7818, test_loss: 1.1948, test_f1: 0.5590
 epoch: 93, train_loss: 0.7786, test_loss: 1.1341, test_f1: 0.5615
 epoch: 94, train_loss: 0.7829, test_loss: 1.1863, test_f1: 0.5504
 epoch: 95, train_loss: 0.7789, test_loss: 1.1565, test_f1: 0.5556
 epoch: 96, train_loss: 0.7822, test_loss: 1.1363, test_f1: 0.5698
 epoch: 97, train_loss: 0.7830, test_loss: 1.1516, test_f1: 0.5609
 epoch: 98, train_loss: 0.7892, test_loss: 1.1430, test_f1: 0.5670
 epoch: 99, train_loss: 0.7811, test_loss: 1.1551, test_f1: 0.5486
##################ITERATION #6 ****************************************
 epoch: 0, train_loss: 1.2954, test_loss: 1.3345, test_f1: 0.2556
 epoch: 1, train_loss: 1.2363, test_loss: 1.3039, test_f1: 0.2979
 epoch: 2, train_loss: 1.2015, test_loss: 1.2904, test_f1: 0.3423
 epoch: 3, train_loss: 1.1886, test_loss: 1.2748, test_f1: 0.3777
 epoch: 4, train_loss: 1.1722, test_loss: 1.2612, test_f1: 0.3863
 epoch: 5, train_loss: 1.1625, test_loss: 1.2485, test_f1: 0.3907
 epoch: 6, train_loss: 1.1445, test_loss: 1.2385, test_f1: 0.3939
 epoch: 7, train_loss: 1.1435, test_loss: 1.2164, test_f1: 0.3980
 epoch: 8, train_loss: 1.1171, test_loss: 1.2062, test_f1: 0.4174
 epoch: 9, train_loss: 1.1179, test_loss: 1.2016, test_f1: 0.4393
 epoch: 10, train_loss: 1.1011, test_loss: 1.1933, test_f1: 0.4613
 epoch: 11, train_loss: 1.0925, test_loss: 1.1900, test_f1: 0.4800
 epoch: 12, train_loss: 1.0632, test_loss: 1.1811, test_f1: 0.4783
 epoch: 13, train_loss: 1.0776, test_loss: 1.1663, test_f1: 0.4854
 epoch: 14, train_loss: 1.0524, test_loss: 1.1638, test_f1: 0.4922
 epoch: 15, train_loss: 1.0428, test_loss: 1.1518, test_f1: 0.5064
 epoch: 16, train_loss: 1.0337, test_loss: 1.1508, test_f1: 0.5068
 epoch: 17, train_loss: 1.0362, test_loss: 1.1539, test_f1: 0.5213
 epoch: 18, train_loss: 1.0221, test_loss: 1.1390, test_f1: 0.5155
 epoch: 19, train_loss: 1.0198, test_loss: 1.1344, test_f1: 0.5185
 epoch: 20, train_loss: 1.0099, test_loss: 1.1327, test_f1: 0.5057
 epoch: 21, train_loss: 0.9913, test_loss: 1.1328, test_f1: 0.4852
 epoch: 22, train_loss: 0.9949, test_loss: 1.1310, test_f1: 0.5100
 epoch: 23, train_loss: 1.0000, test_loss: 1.1282, test_f1: 0.5013
 epoch: 24, train_loss: 0.9838, test_loss: 1.1288, test_f1: 0.4990
 epoch: 25, train_loss: 0.9790, test_loss: 1.1243, test_f1: 0.5015
 epoch: 26, train_loss: 0.9656, test_loss: 1.1228, test_f1: 0.5026
 epoch: 27, train_loss: 0.9608, test_loss: 1.1119, test_f1: 0.5273
 epoch: 28, train_loss: 0.9509, test_loss: 1.1199, test_f1: 0.5168
 epoch: 29, train_loss: 0.9442, test_loss: 1.1274, test_f1: 0.5036
 epoch: 30, train_loss: 0.9466, test_loss: 1.1239, test_f1: 0.5090
 epoch: 31, train_loss: 0.9379, test_loss: 1.1169, test_f1: 0.5057
 epoch: 32, train_loss: 0.9339, test_loss: 1.1280, test_f1: 0.5013
 epoch: 33, train_loss: 0.9405, test_loss: 1.1357, test_f1: 0.4995
 epoch: 34, train_loss: 0.9411, test_loss: 1.1432, test_f1: 0.5022
 epoch: 35, train_loss: 0.9320, test_loss: 1.1315, test_f1: 0.5014
 epoch: 36, train_loss: 0.9313, test_loss: 1.1300, test_f1: 0.5099
 epoch: 37, train_loss: 0.9103, test_loss: 1.1526, test_f1: 0.5117
 epoch: 38, train_loss: 0.9158, test_loss: 1.1536, test_f1: 0.5033
 epoch: 39, train_loss: 0.9093, test_loss: 1.1755, test_f1: 0.5119
 epoch: 40, train_loss: 0.8986, test_loss: 1.1669, test_f1: 0.5236
 epoch: 41, train_loss: 0.8921, test_loss: 1.1480, test_f1: 0.5232
 epoch: 42, train_loss: 0.9046, test_loss: 1.1690, test_f1: 0.5214
 epoch: 43, train_loss: 0.8919, test_loss: 1.1734, test_f1: 0.5152
 epoch: 44, train_loss: 0.8813, test_loss: 1.1586, test_f1: 0.5408
 epoch: 45, train_loss: 0.8771, test_loss: 1.1567, test_f1: 0.5147
 epoch: 46, train_loss: 0.8736, test_loss: 1.1547, test_f1: 0.5222
 epoch: 47, train_loss: 0.8733, test_loss: 1.1617, test_f1: 0.5175
 epoch: 48, train_loss: 0.8660, test_loss: 1.1441, test_f1: 0.5331
 epoch: 49, train_loss: 0.8657, test_loss: 1.1669, test_f1: 0.5102
 epoch: 50, train_loss: 0.8658, test_loss: 1.1623, test_f1: 0.5435
 epoch: 51, train_loss: 0.8499, test_loss: 1.1719, test_f1: 0.5545
 epoch: 52, train_loss: 0.8429, test_loss: 1.1612, test_f1: 0.5300
 epoch: 53, train_loss: 0.8357, test_loss: 1.1803, test_f1: 0.5270
 epoch: 54, train_loss: 0.8547, test_loss: 1.1732, test_f1: 0.5540
 epoch: 55, train_loss: 0.8435, test_loss: 1.1682, test_f1: 0.5281
 epoch: 56, train_loss: 0.8319, test_loss: 1.1691, test_f1: 0.5489
 epoch: 57, train_loss: 0.8400, test_loss: 1.1762, test_f1: 0.5642
 epoch: 58, train_loss: 0.8303, test_loss: 1.1678, test_f1: 0.5353
 epoch: 59, train_loss: 0.8368, test_loss: 1.1671, test_f1: 0.5689
 epoch: 60, train_loss: 0.8319, test_loss: 1.1955, test_f1: 0.5431
 epoch: 61, train_loss: 0.8316, test_loss: 1.1871, test_f1: 0.5645
 epoch: 62, train_loss: 0.8413, test_loss: 1.1895, test_f1: 0.5522
 epoch: 63, train_loss: 0.8304, test_loss: 1.1703, test_f1: 0.5745
 epoch: 64, train_loss: 0.8390, test_loss: 1.1989, test_f1: 0.5516
 epoch: 65, train_loss: 0.8196, test_loss: 1.1773, test_f1: 0.5561
 epoch: 66, train_loss: 0.8271, test_loss: 1.1995, test_f1: 0.5622
 epoch: 67, train_loss: 0.8407, test_loss: 1.2013, test_f1: 0.5523
 epoch: 68, train_loss: 0.8137, test_loss: 1.1880, test_f1: 0.5613
 epoch: 69, train_loss: 0.8214, test_loss: 1.1956, test_f1: 0.5658
 epoch: 70, train_loss: 0.8266, test_loss: 1.2062, test_f1: 0.5398
 epoch: 71, train_loss: 0.8195, test_loss: 1.1779, test_f1: 0.5695
 epoch: 72, train_loss: 0.8259, test_loss: 1.2113, test_f1: 0.5377
 epoch: 73, train_loss: 0.8117, test_loss: 1.1952, test_f1: 0.5551
 epoch: 74, train_loss: 0.8081, test_loss: 1.2214, test_f1: 0.5309
 epoch: 75, train_loss: 0.8263, test_loss: 1.1961, test_f1: 0.5735
 epoch: 76, train_loss: 0.8092, test_loss: 1.2200, test_f1: 0.5404
 epoch: 77, train_loss: 0.8104, test_loss: 1.1894, test_f1: 0.5639
 epoch: 78, train_loss: 0.8202, test_loss: 1.2202, test_f1: 0.5465
 epoch: 79, train_loss: 0.8097, test_loss: 1.2312, test_f1: 0.5600
 epoch: 80, train_loss: 0.8082, test_loss: 1.2461, test_f1: 0.5348
 epoch: 81, train_loss: 0.8050, test_loss: 1.2256, test_f1: 0.5537
 epoch: 82, train_loss: 0.7955, test_loss: 1.2608, test_f1: 0.5432
 epoch: 83, train_loss: 0.7961, test_loss: 1.1704, test_f1: 0.5673
 epoch: 84, train_loss: 0.7976, test_loss: 1.2240, test_f1: 0.5464
 epoch: 85, train_loss: 0.8021, test_loss: 1.2879, test_f1: 0.5379
 epoch: 86, train_loss: 0.7834, test_loss: 1.2266, test_f1: 0.5478
 epoch: 87, train_loss: 0.7956, test_loss: 1.2348, test_f1: 0.5412
 epoch: 88, train_loss: 0.7876, test_loss: 1.2159, test_f1: 0.5466
 epoch: 89, train_loss: 0.7873, test_loss: 1.2249, test_f1: 0.5653
 epoch: 90, train_loss: 0.7853, test_loss: 1.2726, test_f1: 0.5430
 epoch: 91, train_loss: 0.7928, test_loss: 1.2536, test_f1: 0.5535
 epoch: 92, train_loss: 0.7945, test_loss: 1.2608, test_f1: 0.5480
 epoch: 93, train_loss: 0.7771, test_loss: 1.2340, test_f1: 0.5401
 epoch: 94, train_loss: 0.7768, test_loss: 1.2736, test_f1: 0.5457
 epoch: 95, train_loss: 0.7811, test_loss: 1.2395, test_f1: 0.5491
 epoch: 96, train_loss: 0.7708, test_loss: 1.2502, test_f1: 0.5480
 epoch: 97, train_loss: 0.7732, test_loss: 1.2326, test_f1: 0.5639
 epoch: 98, train_loss: 0.7769, test_loss: 1.2556, test_f1: 0.5622
 epoch: 99, train_loss: 0.7786, test_loss: 1.2414, test_f1: 0.5648
##################ITERATION #7 ****************************************
 epoch: 0, train_loss: 1.3049, test_loss: 1.3721, test_f1: 0.2899
 epoch: 1, train_loss: 1.2422, test_loss: 1.3204, test_f1: 0.3273
 epoch: 2, train_loss: 1.2002, test_loss: 1.2906, test_f1: 0.3552
 epoch: 3, train_loss: 1.1978, test_loss: 1.2656, test_f1: 0.3823
 epoch: 4, train_loss: 1.1785, test_loss: 1.2431, test_f1: 0.3804
 epoch: 5, train_loss: 1.1636, test_loss: 1.2378, test_f1: 0.3813
 epoch: 6, train_loss: 1.1475, test_loss: 1.2216, test_f1: 0.3928
 epoch: 7, train_loss: 1.1261, test_loss: 1.2163, test_f1: 0.3935
 epoch: 8, train_loss: 1.1343, test_loss: 1.1999, test_f1: 0.3999
 epoch: 9, train_loss: 1.1225, test_loss: 1.1947, test_f1: 0.4050
 epoch: 10, train_loss: 1.1090, test_loss: 1.1924, test_f1: 0.4206
 epoch: 11, train_loss: 1.0936, test_loss: 1.1794, test_f1: 0.4234
 epoch: 12, train_loss: 1.0860, test_loss: 1.1688, test_f1: 0.4255
 epoch: 13, train_loss: 1.0851, test_loss: 1.1636, test_f1: 0.4382
 epoch: 14, train_loss: 1.0618, test_loss: 1.1564, test_f1: 0.4392
 epoch: 15, train_loss: 1.0636, test_loss: 1.1516, test_f1: 0.4563
 epoch: 16, train_loss: 1.0532, test_loss: 1.1535, test_f1: 0.4614
 epoch: 17, train_loss: 1.0491, test_loss: 1.1459, test_f1: 0.4764
 epoch: 18, train_loss: 1.0403, test_loss: 1.1450, test_f1: 0.4727
 epoch: 19, train_loss: 1.0092, test_loss: 1.1462, test_f1: 0.4720
 epoch: 20, train_loss: 1.0081, test_loss: 1.1499, test_f1: 0.4798
 epoch: 21, train_loss: 0.9988, test_loss: 1.1374, test_f1: 0.4863
 epoch: 22, train_loss: 1.0218, test_loss: 1.1349, test_f1: 0.4810
 epoch: 23, train_loss: 0.9939, test_loss: 1.1401, test_f1: 0.4994
 epoch: 24, train_loss: 1.0044, test_loss: 1.1379, test_f1: 0.4915
 epoch: 25, train_loss: 0.9921, test_loss: 1.1172, test_f1: 0.4864
 epoch: 26, train_loss: 0.9613, test_loss: 1.1337, test_f1: 0.4860
 epoch: 27, train_loss: 0.9713, test_loss: 1.1215, test_f1: 0.4920
 epoch: 28, train_loss: 0.9613, test_loss: 1.1296, test_f1: 0.4941
 epoch: 29, train_loss: 0.9592, test_loss: 1.1225, test_f1: 0.5023
 epoch: 30, train_loss: 0.9448, test_loss: 1.1170, test_f1: 0.5053
 epoch: 31, train_loss: 0.9593, test_loss: 1.1227, test_f1: 0.5068
 epoch: 32, train_loss: 0.9471, test_loss: 1.1112, test_f1: 0.5074
 epoch: 33, train_loss: 0.9230, test_loss: 1.1206, test_f1: 0.5052
 epoch: 34, train_loss: 0.9252, test_loss: 1.1345, test_f1: 0.4956
 epoch: 35, train_loss: 0.9023, test_loss: 1.1225, test_f1: 0.5095
 epoch: 36, train_loss: 0.9340, test_loss: 1.1203, test_f1: 0.4997
 epoch: 37, train_loss: 0.9186, test_loss: 1.1241, test_f1: 0.5152
 epoch: 38, train_loss: 0.9215, test_loss: 1.1144, test_f1: 0.5035
 epoch: 39, train_loss: 0.8970, test_loss: 1.1345, test_f1: 0.4774
 epoch: 40, train_loss: 0.9187, test_loss: 1.1064, test_f1: 0.5187
 epoch: 41, train_loss: 0.9028, test_loss: 1.1347, test_f1: 0.5163
 epoch: 42, train_loss: 0.8913, test_loss: 1.1095, test_f1: 0.5192
 epoch: 43, train_loss: 0.8831, test_loss: 1.1236, test_f1: 0.5251
 epoch: 44, train_loss: 0.8905, test_loss: 1.1172, test_f1: 0.5313
 epoch: 45, train_loss: 0.8763, test_loss: 1.1295, test_f1: 0.5355
 epoch: 46, train_loss: 0.8826, test_loss: 1.1101, test_f1: 0.5330
 epoch: 47, train_loss: 0.8714, test_loss: 1.1314, test_f1: 0.5284
 epoch: 48, train_loss: 0.8661, test_loss: 1.1161, test_f1: 0.5197
 epoch: 49, train_loss: 0.8597, test_loss: 1.1159, test_f1: 0.5295
 epoch: 50, train_loss: 0.8742, test_loss: 1.1470, test_f1: 0.5231
 epoch: 51, train_loss: 0.8618, test_loss: 1.1139, test_f1: 0.5455
 epoch: 52, train_loss: 0.8566, test_loss: 1.1257, test_f1: 0.5297
 epoch: 53, train_loss: 0.8514, test_loss: 1.1235, test_f1: 0.5343
 epoch: 54, train_loss: 0.8543, test_loss: 1.1288, test_f1: 0.5169
 epoch: 55, train_loss: 0.8460, test_loss: 1.1188, test_f1: 0.5475
 epoch: 56, train_loss: 0.8603, test_loss: 1.1417, test_f1: 0.5077
 epoch: 57, train_loss: 0.8491, test_loss: 1.1262, test_f1: 0.5527
 epoch: 58, train_loss: 0.8533, test_loss: 1.1312, test_f1: 0.5228
 epoch: 59, train_loss: 0.8434, test_loss: 1.1261, test_f1: 0.5468
 epoch: 60, train_loss: 0.8487, test_loss: 1.1388, test_f1: 0.5439
 epoch: 61, train_loss: 0.8347, test_loss: 1.1500, test_f1: 0.5302
 epoch: 62, train_loss: 0.8389, test_loss: 1.1307, test_f1: 0.5493
 epoch: 63, train_loss: 0.8420, test_loss: 1.1265, test_f1: 0.5412
 epoch: 64, train_loss: 0.8456, test_loss: 1.1238, test_f1: 0.5666
 epoch: 65, train_loss: 0.8455, test_loss: 1.1317, test_f1: 0.5589
 epoch: 66, train_loss: 0.8359, test_loss: 1.1295, test_f1: 0.5593
 epoch: 67, train_loss: 0.8267, test_loss: 1.1291, test_f1: 0.5637
 epoch: 68, train_loss: 0.8199, test_loss: 1.1286, test_f1: 0.5636
 epoch: 69, train_loss: 0.8292, test_loss: 1.1466, test_f1: 0.5817
 epoch: 70, train_loss: 0.8243, test_loss: 1.1438, test_f1: 0.5737
 epoch: 71, train_loss: 0.8230, test_loss: 1.1361, test_f1: 0.5740
 epoch: 72, train_loss: 0.8384, test_loss: 1.1402, test_f1: 0.5805
 epoch: 73, train_loss: 0.8174, test_loss: 1.1219, test_f1: 0.5891
 epoch: 74, train_loss: 0.8175, test_loss: 1.1398, test_f1: 0.5867
 epoch: 75, train_loss: 0.8226, test_loss: 1.1341, test_f1: 0.5787
 epoch: 76, train_loss: 0.8205, test_loss: 1.1297, test_f1: 0.5973
 epoch: 77, train_loss: 0.8150, test_loss: 1.1300, test_f1: 0.5972
 epoch: 78, train_loss: 0.8236, test_loss: 1.1298, test_f1: 0.5636
 epoch: 79, train_loss: 0.8178, test_loss: 1.1433, test_f1: 0.5865
 epoch: 80, train_loss: 0.8096, test_loss: 1.1413, test_f1: 0.5897
 epoch: 81, train_loss: 0.8135, test_loss: 1.1524, test_f1: 0.5711
 epoch: 82, train_loss: 0.8054, test_loss: 1.1401, test_f1: 0.5832
 epoch: 83, train_loss: 0.8132, test_loss: 1.1438, test_f1: 0.5945
 epoch: 84, train_loss: 0.8131, test_loss: 1.1214, test_f1: 0.6159
 epoch: 85, train_loss: 0.8154, test_loss: 1.1421, test_f1: 0.5892
 epoch: 86, train_loss: 0.7972, test_loss: 1.1324, test_f1: 0.5991
 epoch: 87, train_loss: 0.8117, test_loss: 1.1542, test_f1: 0.5887
 epoch: 88, train_loss: 0.7872, test_loss: 1.1562, test_f1: 0.5882
 epoch: 89, train_loss: 0.8009, test_loss: 1.1620, test_f1: 0.5886
 epoch: 90, train_loss: 0.7800, test_loss: 1.1484, test_f1: 0.5861
 epoch: 91, train_loss: 0.7964, test_loss: 1.1494, test_f1: 0.5996
 epoch: 92, train_loss: 0.7887, test_loss: 1.1591, test_f1: 0.6074
 epoch: 93, train_loss: 0.7891, test_loss: 1.1586, test_f1: 0.5883
 epoch: 94, train_loss: 0.7872, test_loss: 1.1598, test_f1: 0.5789
 epoch: 95, train_loss: 0.7997, test_loss: 1.1473, test_f1: 0.5995
 epoch: 96, train_loss: 0.7951, test_loss: 1.1506, test_f1: 0.6023
 epoch: 97, train_loss: 0.7783, test_loss: 1.1613, test_f1: 0.5963
 epoch: 98, train_loss: 0.7665, test_loss: 1.1587, test_f1: 0.5941
 epoch: 99, train_loss: 0.8000, test_loss: 1.1765, test_f1: 0.5732
##################ITERATION #8 ****************************************
 epoch: 0, train_loss: 1.3075, test_loss: 1.3300, test_f1: 0.2584
 epoch: 1, train_loss: 1.2533, test_loss: 1.2922, test_f1: 0.2899
 epoch: 2, train_loss: 1.2291, test_loss: 1.2777, test_f1: 0.3424
 epoch: 3, train_loss: 1.2110, test_loss: 1.2608, test_f1: 0.3355
 epoch: 4, train_loss: 1.1807, test_loss: 1.2597, test_f1: 0.3748
 epoch: 5, train_loss: 1.1843, test_loss: 1.2466, test_f1: 0.3795
 epoch: 6, train_loss: 1.1717, test_loss: 1.2570, test_f1: 0.3912
 epoch: 7, train_loss: 1.1515, test_loss: 1.2396, test_f1: 0.4127
 epoch: 8, train_loss: 1.1417, test_loss: 1.2322, test_f1: 0.4127
 epoch: 9, train_loss: 1.1328, test_loss: 1.2288, test_f1: 0.4397
 epoch: 10, train_loss: 1.1238, test_loss: 1.2420, test_f1: 0.4757
 epoch: 11, train_loss: 1.1145, test_loss: 1.2071, test_f1: 0.4563
 epoch: 12, train_loss: 1.0939, test_loss: 1.2111, test_f1: 0.4736
 epoch: 13, train_loss: 1.0824, test_loss: 1.2078, test_f1: 0.4980
 epoch: 14, train_loss: 1.0765, test_loss: 1.2057, test_f1: 0.4976
 epoch: 15, train_loss: 1.0665, test_loss: 1.2089, test_f1: 0.5060
 epoch: 16, train_loss: 1.0564, test_loss: 1.1984, test_f1: 0.4935
 epoch: 17, train_loss: 1.0516, test_loss: 1.1946, test_f1: 0.4985
 epoch: 18, train_loss: 1.0442, test_loss: 1.2272, test_f1: 0.5028
 epoch: 19, train_loss: 1.0267, test_loss: 1.2571, test_f1: 0.4914
 epoch: 20, train_loss: 1.0211, test_loss: 1.2447, test_f1: 0.4896
 epoch: 21, train_loss: 1.0136, test_loss: 1.2087, test_f1: 0.4846
 epoch: 22, train_loss: 1.0082, test_loss: 1.2100, test_f1: 0.4956
 epoch: 23, train_loss: 1.0000, test_loss: 1.2014, test_f1: 0.4981
 epoch: 24, train_loss: 0.9970, test_loss: 1.1919, test_f1: 0.5011
 epoch: 25, train_loss: 0.9822, test_loss: 1.1990, test_f1: 0.4975
 epoch: 26, train_loss: 0.9804, test_loss: 1.2131, test_f1: 0.5077
 epoch: 27, train_loss: 0.9631, test_loss: 1.2299, test_f1: 0.5238
 epoch: 28, train_loss: 0.9585, test_loss: 1.2302, test_f1: 0.5344
 epoch: 29, train_loss: 0.9495, test_loss: 1.2687, test_f1: 0.5202
 epoch: 30, train_loss: 0.9567, test_loss: 1.2541, test_f1: 0.5298
 epoch: 31, train_loss: 0.9535, test_loss: 1.2349, test_f1: 0.5371
 epoch: 32, train_loss: 0.9588, test_loss: 1.2478, test_f1: 0.5345
 epoch: 33, train_loss: 0.9422, test_loss: 1.2660, test_f1: 0.5371
 epoch: 34, train_loss: 0.9182, test_loss: 1.2800, test_f1: 0.5316
 epoch: 35, train_loss: 0.9275, test_loss: 1.2808, test_f1: 0.5167
 epoch: 36, train_loss: 0.9088, test_loss: 1.2782, test_f1: 0.5197
 epoch: 37, train_loss: 0.9099, test_loss: 1.2669, test_f1: 0.5188
 epoch: 38, train_loss: 0.9093, test_loss: 1.2569, test_f1: 0.5228
 epoch: 39, train_loss: 0.8933, test_loss: 1.2683, test_f1: 0.5177
 epoch: 40, train_loss: 0.8893, test_loss: 1.2547, test_f1: 0.5277
 epoch: 41, train_loss: 0.9002, test_loss: 1.2688, test_f1: 0.5249
 epoch: 42, train_loss: 0.8862, test_loss: 1.2696, test_f1: 0.5202
 epoch: 43, train_loss: 0.8948, test_loss: 1.2580, test_f1: 0.5165
 epoch: 44, train_loss: 0.8716, test_loss: 1.2480, test_f1: 0.5067
 epoch: 45, train_loss: 0.8804, test_loss: 1.2655, test_f1: 0.5226
 epoch: 46, train_loss: 0.8747, test_loss: 1.2607, test_f1: 0.5375
 epoch: 47, train_loss: 0.8703, test_loss: 1.2642, test_f1: 0.5196
 epoch: 48, train_loss: 0.8712, test_loss: 1.2909, test_f1: 0.5229
 epoch: 49, train_loss: 0.8649, test_loss: 1.2830, test_f1: 0.5281
 epoch: 50, train_loss: 0.8513, test_loss: 1.2780, test_f1: 0.5254
 epoch: 51, train_loss: 0.8520, test_loss: 1.3017, test_f1: 0.5249
 epoch: 52, train_loss: 0.8457, test_loss: 1.3031, test_f1: 0.5176
 epoch: 53, train_loss: 0.8478, test_loss: 1.2968, test_f1: 0.5378
 epoch: 54, train_loss: 0.8361, test_loss: 1.3154, test_f1: 0.5382
 epoch: 55, train_loss: 0.8314, test_loss: 1.3103, test_f1: 0.5332
 epoch: 56, train_loss: 0.8352, test_loss: 1.3172, test_f1: 0.5415
 epoch: 57, train_loss: 0.8480, test_loss: 1.3162, test_f1: 0.5304
 epoch: 58, train_loss: 0.8390, test_loss: 1.2950, test_f1: 0.5440
 epoch: 59, train_loss: 0.8326, test_loss: 1.3097, test_f1: 0.5306
 epoch: 60, train_loss: 0.8317, test_loss: 1.3061, test_f1: 0.5304
 epoch: 61, train_loss: 0.8259, test_loss: 1.3302, test_f1: 0.5465
 epoch: 62, train_loss: 0.8342, test_loss: 1.2999, test_f1: 0.5437
 epoch: 63, train_loss: 0.8309, test_loss: 1.3033, test_f1: 0.5541
 epoch: 64, train_loss: 0.8390, test_loss: 1.3214, test_f1: 0.5278
 epoch: 65, train_loss: 0.8200, test_loss: 1.3329, test_f1: 0.5304
 epoch: 66, train_loss: 0.8095, test_loss: 1.3234, test_f1: 0.5550
 epoch: 67, train_loss: 0.8207, test_loss: 1.3523, test_f1: 0.5332
 epoch: 68, train_loss: 0.8253, test_loss: 1.3212, test_f1: 0.5358
 epoch: 69, train_loss: 0.8115, test_loss: 1.3226, test_f1: 0.5545
 epoch: 70, train_loss: 0.8166, test_loss: 1.3390, test_f1: 0.5582
 epoch: 71, train_loss: 0.8202, test_loss: 1.3577, test_f1: 0.5468
 epoch: 72, train_loss: 0.8121, test_loss: 1.3545, test_f1: 0.5542
 epoch: 73, train_loss: 0.7999, test_loss: 1.3741, test_f1: 0.5469
 epoch: 74, train_loss: 0.7972, test_loss: 1.3432, test_f1: 0.5548
 epoch: 75, train_loss: 0.8001, test_loss: 1.3413, test_f1: 0.5569
 epoch: 76, train_loss: 0.7954, test_loss: 1.3444, test_f1: 0.5726
 epoch: 77, train_loss: 0.7948, test_loss: 1.3793, test_f1: 0.5441
 epoch: 78, train_loss: 0.8096, test_loss: 1.3928, test_f1: 0.5438
 epoch: 79, train_loss: 0.7934, test_loss: 1.3697, test_f1: 0.5541
 epoch: 80, train_loss: 0.8002, test_loss: 1.3633, test_f1: 0.5599
 epoch: 81, train_loss: 0.7987, test_loss: 1.3819, test_f1: 0.5602
 epoch: 82, train_loss: 0.7936, test_loss: 1.4207, test_f1: 0.5471
 epoch: 83, train_loss: 0.7923, test_loss: 1.3789, test_f1: 0.5599
 epoch: 84, train_loss: 0.8009, test_loss: 1.3945, test_f1: 0.5645
 epoch: 85, train_loss: 0.7865, test_loss: 1.3530, test_f1: 0.5543
 epoch: 86, train_loss: 0.7936, test_loss: 1.3790, test_f1: 0.5600
 epoch: 87, train_loss: 0.8021, test_loss: 1.4172, test_f1: 0.5411
 epoch: 88, train_loss: 0.7735, test_loss: 1.3623, test_f1: 0.5466
 epoch: 89, train_loss: 0.7886, test_loss: 1.4223, test_f1: 0.5518
 epoch: 90, train_loss: 0.7884, test_loss: 1.4505, test_f1: 0.5477
 epoch: 91, train_loss: 0.7716, test_loss: 1.4227, test_f1: 0.5467
 epoch: 92, train_loss: 0.7966, test_loss: 1.4273, test_f1: 0.5549
 epoch: 93, train_loss: 0.7719, test_loss: 1.4284, test_f1: 0.5441
 epoch: 94, train_loss: 0.7863, test_loss: 1.4179, test_f1: 0.5447
 epoch: 95, train_loss: 0.7733, test_loss: 1.4437, test_f1: 0.5444
 epoch: 96, train_loss: 0.7709, test_loss: 1.4388, test_f1: 0.5426
 epoch: 97, train_loss: 0.7712, test_loss: 1.4051, test_f1: 0.5358
 epoch: 98, train_loss: 0.7866, test_loss: 1.4280, test_f1: 0.5438
 epoch: 99, train_loss: 0.7663, test_loss: 1.4182, test_f1: 0.5517
##################ITERATION #9 ****************************************
 epoch: 0, train_loss: 1.3567, test_loss: 1.3585, test_f1: 0.2480
 epoch: 1, train_loss: 1.2705, test_loss: 1.3235, test_f1: 0.3491
 epoch: 2, train_loss: 1.2300, test_loss: 1.3113, test_f1: 0.3656
 epoch: 3, train_loss: 1.2089, test_loss: 1.3097, test_f1: 0.4011
 epoch: 4, train_loss: 1.2090, test_loss: 1.2892, test_f1: 0.4007
 epoch: 5, train_loss: 1.1746, test_loss: 1.2788, test_f1: 0.4251
 epoch: 6, train_loss: 1.1641, test_loss: 1.2610, test_f1: 0.4638
 epoch: 7, train_loss: 1.1448, test_loss: 1.2383, test_f1: 0.4751
 epoch: 8, train_loss: 1.1505, test_loss: 1.2376, test_f1: 0.4673
 epoch: 9, train_loss: 1.1008, test_loss: 1.2445, test_f1: 0.4492
 epoch: 10, train_loss: 1.0984, test_loss: 1.2311, test_f1: 0.4600
 epoch: 11, train_loss: 1.1010, test_loss: 1.2318, test_f1: 0.4708
 epoch: 12, train_loss: 1.0934, test_loss: 1.2196, test_f1: 0.4736
 epoch: 13, train_loss: 1.0538, test_loss: 1.2076, test_f1: 0.4868
 epoch: 14, train_loss: 1.0591, test_loss: 1.1970, test_f1: 0.4865
 epoch: 15, train_loss: 1.0563, test_loss: 1.2011, test_f1: 0.4965
 epoch: 16, train_loss: 1.0473, test_loss: 1.2048, test_f1: 0.5081
 epoch: 17, train_loss: 1.0276, test_loss: 1.1963, test_f1: 0.4925
 epoch: 18, train_loss: 1.0099, test_loss: 1.1983, test_f1: 0.4981
 epoch: 19, train_loss: 1.0020, test_loss: 1.1981, test_f1: 0.4801
 epoch: 20, train_loss: 0.9999, test_loss: 1.1895, test_f1: 0.4903
 epoch: 21, train_loss: 1.0024, test_loss: 1.2051, test_f1: 0.4653
 epoch: 22, train_loss: 0.9895, test_loss: 1.1672, test_f1: 0.4954
 epoch: 23, train_loss: 0.9784, test_loss: 1.1768, test_f1: 0.4983
 epoch: 24, train_loss: 0.9860, test_loss: 1.1713, test_f1: 0.5040
 epoch: 25, train_loss: 0.9473, test_loss: 1.1675, test_f1: 0.4989
 epoch: 26, train_loss: 0.9540, test_loss: 1.1623, test_f1: 0.5064
 epoch: 27, train_loss: 0.9652, test_loss: 1.1521, test_f1: 0.4937
 epoch: 28, train_loss: 0.9568, test_loss: 1.1703, test_f1: 0.4840
 epoch: 29, train_loss: 0.9418, test_loss: 1.1605, test_f1: 0.4885
 epoch: 30, train_loss: 0.9470, test_loss: 1.1584, test_f1: 0.4776
 epoch: 31, train_loss: 0.9439, test_loss: 1.1863, test_f1: 0.4521
 epoch: 32, train_loss: 0.9282, test_loss: 1.1751, test_f1: 0.4986
 epoch: 33, train_loss: 0.9290, test_loss: 1.1739, test_f1: 0.4989
 epoch: 34, train_loss: 0.9215, test_loss: 1.1868, test_f1: 0.4801
 epoch: 35, train_loss: 0.9064, test_loss: 1.1610, test_f1: 0.4769
 epoch: 36, train_loss: 0.9202, test_loss: 1.1675, test_f1: 0.4980
 epoch: 37, train_loss: 0.9176, test_loss: 1.1480, test_f1: 0.5035
 epoch: 38, train_loss: 0.9147, test_loss: 1.1444, test_f1: 0.4951
 epoch: 39, train_loss: 0.8934, test_loss: 1.1470, test_f1: 0.4963
 epoch: 40, train_loss: 0.8934, test_loss: 1.1615, test_f1: 0.4855
 epoch: 41, train_loss: 0.8929, test_loss: 1.1459, test_f1: 0.4956
 epoch: 42, train_loss: 0.8907, test_loss: 1.1947, test_f1: 0.4556
 epoch: 43, train_loss: 0.8971, test_loss: 1.1447, test_f1: 0.4715
 epoch: 44, train_loss: 0.8722, test_loss: 1.1680, test_f1: 0.4701
 epoch: 45, train_loss: 0.8638, test_loss: 1.1773, test_f1: 0.5079
 epoch: 46, train_loss: 0.8716, test_loss: 1.1527, test_f1: 0.4885
 epoch: 47, train_loss: 0.8784, test_loss: 1.1782, test_f1: 0.4716
 epoch: 48, train_loss: 0.8583, test_loss: 1.1652, test_f1: 0.4739
 epoch: 49, train_loss: 0.8547, test_loss: 1.2172, test_f1: 0.4468
 epoch: 50, train_loss: 0.8526, test_loss: 1.1764, test_f1: 0.4678
 epoch: 51, train_loss: 0.8474, test_loss: 1.1713, test_f1: 0.4819
 epoch: 52, train_loss: 0.8543, test_loss: 1.2102, test_f1: 0.4732
 epoch: 53, train_loss: 0.8382, test_loss: 1.2256, test_f1: 0.4712
 epoch: 54, train_loss: 0.8440, test_loss: 1.2040, test_f1: 0.4664
 epoch: 55, train_loss: 0.8440, test_loss: 1.2209, test_f1: 0.4752
 epoch: 56, train_loss: 0.8461, test_loss: 1.2260, test_f1: 0.4576
 epoch: 57, train_loss: 0.8371, test_loss: 1.2331, test_f1: 0.4744
 epoch: 58, train_loss: 0.8432, test_loss: 1.2524, test_f1: 0.4568
 epoch: 59, train_loss: 0.8431, test_loss: 1.2374, test_f1: 0.4706
 epoch: 60, train_loss: 0.8307, test_loss: 1.2486, test_f1: 0.4734
 epoch: 61, train_loss: 0.8331, test_loss: 1.2268, test_f1: 0.4769
 epoch: 62, train_loss: 0.8236, test_loss: 1.2312, test_f1: 0.4784
 epoch: 63, train_loss: 0.8346, test_loss: 1.2294, test_f1: 0.4697
 epoch: 64, train_loss: 0.8249, test_loss: 1.2561, test_f1: 0.4664
 epoch: 65, train_loss: 0.8348, test_loss: 1.2040, test_f1: 0.4893
 epoch: 66, train_loss: 0.8291, test_loss: 1.2094, test_f1: 0.4873
 epoch: 67, train_loss: 0.8286, test_loss: 1.2439, test_f1: 0.4612
 epoch: 68, train_loss: 0.8223, test_loss: 1.2344, test_f1: 0.4624
 epoch: 69, train_loss: 0.8288, test_loss: 1.2394, test_f1: 0.4667
 epoch: 70, train_loss: 0.8268, test_loss: 1.2882, test_f1: 0.4660
 epoch: 71, train_loss: 0.8238, test_loss: 1.2483, test_f1: 0.4696
 epoch: 72, train_loss: 0.8222, test_loss: 1.2675, test_f1: 0.4616
 epoch: 73, train_loss: 0.8294, test_loss: 1.2416, test_f1: 0.4724
 epoch: 74, train_loss: 0.8175, test_loss: 1.2959, test_f1: 0.4626
 epoch: 75, train_loss: 0.8001, test_loss: 1.2814, test_f1: 0.4669
 epoch: 76, train_loss: 0.8098, test_loss: 1.3273, test_f1: 0.4749
 epoch: 77, train_loss: 0.8212, test_loss: 1.3224, test_f1: 0.4595
 epoch: 78, train_loss: 0.8124, test_loss: 1.2436, test_f1: 0.4846
 epoch: 79, train_loss: 0.8107, test_loss: 1.3015, test_f1: 0.4742
 epoch: 80, train_loss: 0.8167, test_loss: 1.3319, test_f1: 0.4607
 epoch: 81, train_loss: 0.8065, test_loss: 1.3346, test_f1: 0.4500
 epoch: 82, train_loss: 0.8009, test_loss: 1.3006, test_f1: 0.4626
 epoch: 83, train_loss: 0.8069, test_loss: 1.3247, test_f1: 0.4717
 epoch: 84, train_loss: 0.8012, test_loss: 1.3249, test_f1: 0.4593
 epoch: 85, train_loss: 0.7869, test_loss: 1.3429, test_f1: 0.4782
 epoch: 86, train_loss: 0.7965, test_loss: 1.3567, test_f1: 0.4625
 epoch: 87, train_loss: 0.7884, test_loss: 1.3068, test_f1: 0.4842
 epoch: 88, train_loss: 0.8040, test_loss: 1.3232, test_f1: 0.4770
 epoch: 89, train_loss: 0.7887, test_loss: 1.3036, test_f1: 0.4714
 epoch: 90, train_loss: 0.7917, test_loss: 1.3432, test_f1: 0.4584
 epoch: 91, train_loss: 0.7738, test_loss: 1.3443, test_f1: 0.4595
 epoch: 92, train_loss: 0.7837, test_loss: 1.3465, test_f1: 0.4736
 epoch: 93, train_loss: 0.7895, test_loss: 1.3142, test_f1: 0.4834
 epoch: 94, train_loss: 0.7864, test_loss: 1.3556, test_f1: 0.4918
 epoch: 95, train_loss: 0.7817, test_loss: 1.3774, test_f1: 0.4834
 epoch: 96, train_loss: 0.8049, test_loss: 1.3174, test_f1: 0.4768
 epoch: 97, train_loss: 0.7735, test_loss: 1.3320, test_f1: 0.4759
 epoch: 98, train_loss: 0.7767, test_loss: 1.3509, test_f1: 0.4788
 epoch: 99, train_loss: 0.7806, test_loss: 1.3196, test_f1: 0.4779

Training completed in 504.17 seconds
Best F1: 0.6159 at epoch 84
Mean F1 across iterations: 0.5688  0.0282
========================FINAL RESULTS================================
FEGIN weighted F1: 0.6159  0.0282
python main.py --data ltspice_demos --representation component_component --model FEGIN --layers 2 --hiddens 64 --batch_size 64 --lr 0.0001 --emb_size 128 --epochs 100 --save_appendix component_component_L2_H64_BS64_LR0.0001_E128 --no_val
-----



STDERR:
  File "main.py", line 370, in <module>
    main()
  File "main.py", line 254, in main
    dataset = dataset_class(
  File "/home/philip/projects/ltspice_examples_code_repo/Circuit-Completion-Using-GNNs/component_classification_with_link_prediction_head/evaluation/FEGIN/kernel/circuit_datasets.py", line 15, in __init__
    self.data, self.slices = torch.load(self.processed_paths[0])
  File "/home/philip/.local/lib/python3.8/site-packages/torch/serialization.py", line 1040, in load
    warnings.warn(
  File "/usr/lib/python3.8/warnings.py", line 109, in _showwarnmsg
    sw(msg.message, msg.category, msg.filename, msg.lineno,
  File "main.py", line 47, in warn_with_traceback
    traceback.print_stack(file=log)
/home/philip/projects/ltspice_examples_code_repo/Circuit-Completion-Using-GNNs/component_classification_with_link_prediction_head/evaluation/FEGIN/kernel/circuit_datasets.py:15: FutureWarning: You are using `torch.load` with `weights_only=False` (the current default value), which uses the default pickle module implicitly. It is possible to construct malicious pickle data which will execute arbitrary code during unpickling (See https://github.com/pytorch/pytorch/blob/main/SECURITY.md#untrusted-models for more details). In a future release, the default value for `weights_only` will be flipped to `True`. This limits the functions that could be executed during unpickling. Arbitrary objects will no longer be allowed to be loaded via this mode unless they are explicitly allowlisted by the user via `torch.serialization.add_safe_globals`. We recommend you start setting `weights_only=True` for any use case where you don't have full control of the loaded file. Please open an issue on GitHub for any issues related to this experimental feature.
  self.data, self.slices = torch.load(self.processed_paths[0])
