STDOUT:
Results will be saved in /home/philip/projects/ltspice_examples_code_repo/Circuit-Completion-Using-GNNs/component_classification_with_link_prediction_head/evaluation/FEGIN/results/model_FEGIN_dataset_ltspice_examples
Command line input: python main.py --data ltspice_examples --representation component_component --model FEGIN --layers 5 --hiddens 128 --batch_size 256 --lr 0.0001 --emb_size 250 --epochs 100 --save_appendix component_component_L5_H128_BS256_LR0.0001_E250 --no_val
 is saved.
-----
ltspice_examples - FEGIN
Using 5 layers, 128 hidden units, h = 2
Loading component_component representation dataset
ENTERED
Training FEGIN on component_component representation
Train: 3556, Test: 845
##################ITERATION #0 ****************************************
 epoch: 0, train_loss: 1.3908, test_loss: 1.3850, test_f1: 0.0794
 epoch: 1, train_loss: 1.3731, test_loss: 1.3756, test_f1: 0.2818
 epoch: 2, train_loss: 1.3601, test_loss: 1.3590, test_f1: 0.3082
 epoch: 3, train_loss: 1.3435, test_loss: 1.3381, test_f1: 0.2991
 epoch: 4, train_loss: 1.3236, test_loss: 1.3128, test_f1: 0.2804
 epoch: 5, train_loss: 1.3009, test_loss: 1.2850, test_f1: 0.2857
 epoch: 6, train_loss: 1.2753, test_loss: 1.2570, test_f1: 0.2872
 epoch: 7, train_loss: 1.2556, test_loss: 1.2320, test_f1: 0.2971
 epoch: 8, train_loss: 1.2340, test_loss: 1.2111, test_f1: 0.3373
 epoch: 9, train_loss: 1.2175, test_loss: 1.1909, test_f1: 0.3463
 epoch: 10, train_loss: 1.1968, test_loss: 1.1754, test_f1: 0.3435
 epoch: 11, train_loss: 1.1817, test_loss: 1.1603, test_f1: 0.3472
 epoch: 12, train_loss: 1.1624, test_loss: 1.1443, test_f1: 0.3559
 epoch: 13, train_loss: 1.1480, test_loss: 1.1288, test_f1: 0.4050
 epoch: 14, train_loss: 1.1279, test_loss: 1.1278, test_f1: 0.4297
 epoch: 15, train_loss: 1.1104, test_loss: 1.1115, test_f1: 0.4375
 epoch: 16, train_loss: 1.0999, test_loss: 1.1080, test_f1: 0.4347
 epoch: 17, train_loss: 1.0821, test_loss: 1.0905, test_f1: 0.4606
 epoch: 18, train_loss: 1.0642, test_loss: 1.0859, test_f1: 0.4562
 epoch: 19, train_loss: 1.0441, test_loss: 1.0691, test_f1: 0.4555
 epoch: 20, train_loss: 1.0334, test_loss: 1.0713, test_f1: 0.4665
 epoch: 21, train_loss: 1.0172, test_loss: 1.0659, test_f1: 0.4732
 epoch: 22, train_loss: 0.9999, test_loss: 1.0557, test_f1: 0.4674
 epoch: 23, train_loss: 0.9818, test_loss: 1.0556, test_f1: 0.4705
 epoch: 24, train_loss: 0.9743, test_loss: 1.0599, test_f1: 0.4722
 epoch: 25, train_loss: 0.9561, test_loss: 1.0764, test_f1: 0.4579
 epoch: 26, train_loss: 0.9478, test_loss: 1.0455, test_f1: 0.4987
 epoch: 27, train_loss: 0.9358, test_loss: 1.0578, test_f1: 0.4996
 epoch: 28, train_loss: 0.9330, test_loss: 1.1005, test_f1: 0.4723
 epoch: 29, train_loss: 0.9074, test_loss: 1.0782, test_f1: 0.4848
 epoch: 30, train_loss: 0.9036, test_loss: 1.1368, test_f1: 0.4947
 epoch: 31, train_loss: 0.8903, test_loss: 1.0538, test_f1: 0.4940
 epoch: 32, train_loss: 0.8837, test_loss: 1.1051, test_f1: 0.4890
 epoch: 33, train_loss: 0.8724, test_loss: 1.1006, test_f1: 0.4832
 epoch: 34, train_loss: 0.8574, test_loss: 1.0851, test_f1: 0.4918
 epoch: 35, train_loss: 0.8512, test_loss: 1.1157, test_f1: 0.4756
 epoch: 36, train_loss: 0.8380, test_loss: 1.1314, test_f1: 0.4929
 epoch: 37, train_loss: 0.8338, test_loss: 1.1249, test_f1: 0.4847
 epoch: 38, train_loss: 0.8274, test_loss: 1.1942, test_f1: 0.4833
 epoch: 39, train_loss: 0.8197, test_loss: 1.1411, test_f1: 0.4993
 epoch: 40, train_loss: 0.8063, test_loss: 1.1419, test_f1: 0.4879
 epoch: 41, train_loss: 0.7885, test_loss: 1.2093, test_f1: 0.4840
 epoch: 42, train_loss: 0.7940, test_loss: 1.1780, test_f1: 0.4865
 epoch: 43, train_loss: 0.7813, test_loss: 1.2211, test_f1: 0.4838
 epoch: 44, train_loss: 0.7723, test_loss: 1.2148, test_f1: 0.4819
 epoch: 45, train_loss: 0.7605, test_loss: 1.2587, test_f1: 0.5004
 epoch: 46, train_loss: 0.7683, test_loss: 1.2594, test_f1: 0.4779
 epoch: 47, train_loss: 0.7558, test_loss: 1.2392, test_f1: 0.4946
 epoch: 48, train_loss: 0.7552, test_loss: 1.2398, test_f1: 0.4892
 epoch: 49, train_loss: 0.7299, test_loss: 1.3025, test_f1: 0.5013
 epoch: 50, train_loss: 0.7319, test_loss: 1.3183, test_f1: 0.5102
 epoch: 51, train_loss: 0.7246, test_loss: 1.3074, test_f1: 0.5008
 epoch: 52, train_loss: 0.7149, test_loss: 1.2727, test_f1: 0.5023
 epoch: 53, train_loss: 0.6998, test_loss: 1.2313, test_f1: 0.4921
 epoch: 54, train_loss: 0.7103, test_loss: 1.3024, test_f1: 0.5027
 epoch: 55, train_loss: 0.6981, test_loss: 1.3024, test_f1: 0.4953
 epoch: 56, train_loss: 0.6752, test_loss: 1.2767, test_f1: 0.4900
 epoch: 57, train_loss: 0.6938, test_loss: 1.3344, test_f1: 0.4934
 epoch: 58, train_loss: 0.6843, test_loss: 1.3876, test_f1: 0.4904
 epoch: 59, train_loss: 0.6742, test_loss: 1.3799, test_f1: 0.4952
 epoch: 60, train_loss: 0.6652, test_loss: 1.3532, test_f1: 0.4912
 epoch: 61, train_loss: 0.6609, test_loss: 1.3825, test_f1: 0.5004
 epoch: 62, train_loss: 0.6606, test_loss: 1.3741, test_f1: 0.4987
 epoch: 63, train_loss: 0.6741, test_loss: 1.3567, test_f1: 0.4938
 epoch: 64, train_loss: 0.6621, test_loss: 1.3849, test_f1: 0.4943
 epoch: 65, train_loss: 0.6481, test_loss: 1.3772, test_f1: 0.5050
 epoch: 66, train_loss: 0.6599, test_loss: 1.3308, test_f1: 0.5033
 epoch: 67, train_loss: 0.6622, test_loss: 1.3838, test_f1: 0.5022
 epoch: 68, train_loss: 0.6491, test_loss: 1.3842, test_f1: 0.4996
 epoch: 69, train_loss: 0.6603, test_loss: 1.3997, test_f1: 0.5001
 epoch: 70, train_loss: 0.6632, test_loss: 1.3916, test_f1: 0.5076
 epoch: 71, train_loss: 0.6515, test_loss: 1.4318, test_f1: 0.4996
 epoch: 72, train_loss: 0.6451, test_loss: 1.4314, test_f1: 0.4907
 epoch: 73, train_loss: 0.6347, test_loss: 1.3990, test_f1: 0.5097
 epoch: 74, train_loss: 0.6288, test_loss: 1.4359, test_f1: 0.5088
 epoch: 75, train_loss: 0.6316, test_loss: 1.4367, test_f1: 0.5031
 epoch: 76, train_loss: 0.6250, test_loss: 1.4256, test_f1: 0.5113
 epoch: 77, train_loss: 0.6197, test_loss: 1.4686, test_f1: 0.5180
 epoch: 78, train_loss: 0.6294, test_loss: 1.4371, test_f1: 0.5036
 epoch: 79, train_loss: 0.6036, test_loss: 1.4964, test_f1: 0.5028
 epoch: 80, train_loss: 0.6121, test_loss: 1.4794, test_f1: 0.5189
 epoch: 81, train_loss: 0.6151, test_loss: 1.4892, test_f1: 0.5141
 epoch: 82, train_loss: 0.6133, test_loss: 1.4564, test_f1: 0.5048
 epoch: 83, train_loss: 0.6130, test_loss: 1.4452, test_f1: 0.5014
 epoch: 84, train_loss: 0.6052, test_loss: 1.4737, test_f1: 0.5156
 epoch: 85, train_loss: 0.5843, test_loss: 1.4696, test_f1: 0.5157
 epoch: 86, train_loss: 0.5820, test_loss: 1.4934, test_f1: 0.5183
 epoch: 87, train_loss: 0.5857, test_loss: 1.4812, test_f1: 0.5244
 epoch: 88, train_loss: 0.6005, test_loss: 1.4857, test_f1: 0.5078
 epoch: 89, train_loss: 0.5876, test_loss: 1.5329, test_f1: 0.5192
 epoch: 90, train_loss: 0.5891, test_loss: 1.5223, test_f1: 0.5102
 epoch: 91, train_loss: 0.5880, test_loss: 1.4956, test_f1: 0.5118
 epoch: 92, train_loss: 0.5811, test_loss: 1.5033, test_f1: 0.5228
 epoch: 93, train_loss: 0.5698, test_loss: 1.5466, test_f1: 0.5250
 epoch: 94, train_loss: 0.5707, test_loss: 1.5257, test_f1: 0.5232
 epoch: 95, train_loss: 0.5832, test_loss: 1.5057, test_f1: 0.5150
 epoch: 96, train_loss: 0.5664, test_loss: 1.4450, test_f1: 0.5112
 epoch: 97, train_loss: 0.5783, test_loss: 1.4704, test_f1: 0.5069
 epoch: 98, train_loss: 0.5784, test_loss: 1.5356, test_f1: 0.5162
 epoch: 99, train_loss: 0.5519, test_loss: 1.5519, test_f1: 0.5127
##################ITERATION #1 ****************************************
 epoch: 0, train_loss: 1.3398, test_loss: 1.3503, test_f1: 0.2274
 epoch: 1, train_loss: 1.2836, test_loss: 1.3182, test_f1: 0.2274
 epoch: 2, train_loss: 1.2574, test_loss: 1.2824, test_f1: 0.2670
 epoch: 3, train_loss: 1.2331, test_loss: 1.2428, test_f1: 0.2989
 epoch: 4, train_loss: 1.2107, test_loss: 1.2036, test_f1: 0.3451
 epoch: 5, train_loss: 1.1899, test_loss: 1.1777, test_f1: 0.4117
 epoch: 6, train_loss: 1.1739, test_loss: 1.1584, test_f1: 0.4130
 epoch: 7, train_loss: 1.1562, test_loss: 1.1442, test_f1: 0.4394
 epoch: 8, train_loss: 1.1410, test_loss: 1.1310, test_f1: 0.4520
 epoch: 9, train_loss: 1.1174, test_loss: 1.1181, test_f1: 0.4484
 epoch: 10, train_loss: 1.1077, test_loss: 1.1074, test_f1: 0.4511
 epoch: 11, train_loss: 1.0925, test_loss: 1.0976, test_f1: 0.4545
 epoch: 12, train_loss: 1.0714, test_loss: 1.0877, test_f1: 0.4682
 epoch: 13, train_loss: 1.0540, test_loss: 1.0720, test_f1: 0.4648
 epoch: 14, train_loss: 1.0415, test_loss: 1.0642, test_f1: 0.4658
 epoch: 15, train_loss: 1.0241, test_loss: 1.0594, test_f1: 0.4762
 epoch: 16, train_loss: 1.0067, test_loss: 1.0420, test_f1: 0.4775
 epoch: 17, train_loss: 0.9969, test_loss: 1.0343, test_f1: 0.4854
 epoch: 18, train_loss: 0.9769, test_loss: 1.0679, test_f1: 0.4814
 epoch: 19, train_loss: 0.9648, test_loss: 1.0386, test_f1: 0.4973
 epoch: 20, train_loss: 0.9419, test_loss: 1.0403, test_f1: 0.4867
 epoch: 21, train_loss: 0.9253, test_loss: 1.0383, test_f1: 0.4874
 epoch: 22, train_loss: 0.9098, test_loss: 1.0569, test_f1: 0.4817
 epoch: 23, train_loss: 0.9059, test_loss: 1.0658, test_f1: 0.4682
 epoch: 24, train_loss: 0.8885, test_loss: 1.0588, test_f1: 0.4734
 epoch: 25, train_loss: 0.8642, test_loss: 1.0480, test_f1: 0.4558
 epoch: 26, train_loss: 0.8609, test_loss: 1.0846, test_f1: 0.4784
 epoch: 27, train_loss: 0.8356, test_loss: 1.1133, test_f1: 0.4717
 epoch: 28, train_loss: 0.8374, test_loss: 1.1008, test_f1: 0.4712
 epoch: 29, train_loss: 0.8122, test_loss: 1.1082, test_f1: 0.4727
 epoch: 30, train_loss: 0.8146, test_loss: 1.0988, test_f1: 0.4685
 epoch: 31, train_loss: 0.7907, test_loss: 1.1177, test_f1: 0.4725
 epoch: 32, train_loss: 0.7875, test_loss: 1.1443, test_f1: 0.4730
 epoch: 33, train_loss: 0.7837, test_loss: 1.1061, test_f1: 0.4734
 epoch: 34, train_loss: 0.7637, test_loss: 1.1486, test_f1: 0.4695
 epoch: 35, train_loss: 0.7544, test_loss: 1.1742, test_f1: 0.4683
 epoch: 36, train_loss: 0.7510, test_loss: 1.1165, test_f1: 0.4914
 epoch: 37, train_loss: 0.7243, test_loss: 1.2484, test_f1: 0.4602
 epoch: 38, train_loss: 0.7228, test_loss: 1.1768, test_f1: 0.4744
 epoch: 39, train_loss: 0.7097, test_loss: 1.2266, test_f1: 0.4667
 epoch: 40, train_loss: 0.7039, test_loss: 1.2484, test_f1: 0.4669
 epoch: 41, train_loss: 0.7054, test_loss: 1.2790, test_f1: 0.4588
 epoch: 42, train_loss: 0.6987, test_loss: 1.2431, test_f1: 0.4746
 epoch: 43, train_loss: 0.6813, test_loss: 1.2853, test_f1: 0.4743
 epoch: 44, train_loss: 0.6651, test_loss: 1.2472, test_f1: 0.4899
 epoch: 45, train_loss: 0.6882, test_loss: 1.3349, test_f1: 0.4715
 epoch: 46, train_loss: 0.6633, test_loss: 1.2574, test_f1: 0.4800
 epoch: 47, train_loss: 0.6737, test_loss: 1.3081, test_f1: 0.4939
 epoch: 48, train_loss: 0.6569, test_loss: 1.3164, test_f1: 0.4693
 epoch: 49, train_loss: 0.6359, test_loss: 1.2956, test_f1: 0.4929
 epoch: 50, train_loss: 0.6317, test_loss: 1.3270, test_f1: 0.5092
 epoch: 51, train_loss: 0.6158, test_loss: 1.2984, test_f1: 0.4908
 epoch: 52, train_loss: 0.6113, test_loss: 1.3241, test_f1: 0.4881
 epoch: 53, train_loss: 0.6040, test_loss: 1.3667, test_f1: 0.4840
 epoch: 54, train_loss: 0.6015, test_loss: 1.3588, test_f1: 0.5027
 epoch: 55, train_loss: 0.5984, test_loss: 1.3812, test_f1: 0.4897
 epoch: 56, train_loss: 0.5976, test_loss: 1.3773, test_f1: 0.4947
 epoch: 57, train_loss: 0.5880, test_loss: 1.3892, test_f1: 0.4874
 epoch: 58, train_loss: 0.5781, test_loss: 1.3716, test_f1: 0.4964
 epoch: 59, train_loss: 0.5748, test_loss: 1.3947, test_f1: 0.4870
 epoch: 60, train_loss: 0.5879, test_loss: 1.4271, test_f1: 0.4946
 epoch: 61, train_loss: 0.5661, test_loss: 1.4066, test_f1: 0.4967
 epoch: 62, train_loss: 0.5733, test_loss: 1.4611, test_f1: 0.4781
 epoch: 63, train_loss: 0.5648, test_loss: 1.4588, test_f1: 0.4751
 epoch: 64, train_loss: 0.5674, test_loss: 1.4558, test_f1: 0.4900
 epoch: 65, train_loss: 0.5597, test_loss: 1.4872, test_f1: 0.4946
 epoch: 66, train_loss: 0.5670, test_loss: 1.4587, test_f1: 0.4900
 epoch: 67, train_loss: 0.5642, test_loss: 1.4469, test_f1: 0.4902
 epoch: 68, train_loss: 0.5650, test_loss: 1.4595, test_f1: 0.4862
 epoch: 69, train_loss: 0.5622, test_loss: 1.4586, test_f1: 0.5003
 epoch: 70, train_loss: 0.5771, test_loss: 1.4686, test_f1: 0.4958
 epoch: 71, train_loss: 0.5705, test_loss: 1.4509, test_f1: 0.4864
 epoch: 72, train_loss: 0.5489, test_loss: 1.4317, test_f1: 0.4929
 epoch: 73, train_loss: 0.5531, test_loss: 1.4830, test_f1: 0.4904
 epoch: 74, train_loss: 0.5324, test_loss: 1.4876, test_f1: 0.4854
 epoch: 75, train_loss: 0.5394, test_loss: 1.5028, test_f1: 0.4998
 epoch: 76, train_loss: 0.5271, test_loss: 1.5415, test_f1: 0.4832
 epoch: 77, train_loss: 0.5192, test_loss: 1.5420, test_f1: 0.4920
 epoch: 78, train_loss: 0.5321, test_loss: 1.5542, test_f1: 0.4930
 epoch: 79, train_loss: 0.5185, test_loss: 1.5142, test_f1: 0.5025
 epoch: 80, train_loss: 0.5368, test_loss: 1.5131, test_f1: 0.5082
 epoch: 81, train_loss: 0.5119, test_loss: 1.4796, test_f1: 0.4993
 epoch: 82, train_loss: 0.5121, test_loss: 1.4873, test_f1: 0.4971
 epoch: 83, train_loss: 0.5224, test_loss: 1.5447, test_f1: 0.4875
 epoch: 84, train_loss: 0.5083, test_loss: 1.5199, test_f1: 0.4909
 epoch: 85, train_loss: 0.5096, test_loss: 1.5353, test_f1: 0.5019
 epoch: 86, train_loss: 0.5034, test_loss: 1.5333, test_f1: 0.5048
 epoch: 87, train_loss: 0.5032, test_loss: 1.5442, test_f1: 0.5017
 epoch: 88, train_loss: 0.5083, test_loss: 1.5652, test_f1: 0.5147
 epoch: 89, train_loss: 0.4792, test_loss: 1.5806, test_f1: 0.4967
 epoch: 90, train_loss: 0.5074, test_loss: 1.5404, test_f1: 0.5008
 epoch: 91, train_loss: 0.4894, test_loss: 1.5806, test_f1: 0.4884
 epoch: 92, train_loss: 0.5079, test_loss: 1.5816, test_f1: 0.5066
 epoch: 93, train_loss: 0.4979, test_loss: 1.5739, test_f1: 0.5028
 epoch: 94, train_loss: 0.5024, test_loss: 1.5994, test_f1: 0.4900
 epoch: 95, train_loss: 0.4817, test_loss: 1.5941, test_f1: 0.4918
 epoch: 96, train_loss: 0.4879, test_loss: 1.6404, test_f1: 0.4940
 epoch: 97, train_loss: 0.4728, test_loss: 1.6028, test_f1: 0.5067
 epoch: 98, train_loss: 0.4803, test_loss: 1.5753, test_f1: 0.5215
 epoch: 99, train_loss: 0.4884, test_loss: 1.6142, test_f1: 0.5132
##################ITERATION #2 ****************************************
 epoch: 0, train_loss: 1.3432, test_loss: 1.3325, test_f1: 0.2278
 epoch: 1, train_loss: 1.2616, test_loss: 1.2907, test_f1: 0.3260
 epoch: 2, train_loss: 1.2299, test_loss: 1.2410, test_f1: 0.3276
 epoch: 3, train_loss: 1.2062, test_loss: 1.1967, test_f1: 0.4403
 epoch: 4, train_loss: 1.1809, test_loss: 1.1624, test_f1: 0.4626
 epoch: 5, train_loss: 1.1588, test_loss: 1.1420, test_f1: 0.4541
 epoch: 6, train_loss: 1.1422, test_loss: 1.1262, test_f1: 0.4578
 epoch: 7, train_loss: 1.1292, test_loss: 1.1099, test_f1: 0.4612
 epoch: 8, train_loss: 1.1119, test_loss: 1.0952, test_f1: 0.4512
 epoch: 9, train_loss: 1.0976, test_loss: 1.0818, test_f1: 0.4619
 epoch: 10, train_loss: 1.0828, test_loss: 1.0736, test_f1: 0.4516
 epoch: 11, train_loss: 1.0630, test_loss: 1.0598, test_f1: 0.4715
 epoch: 12, train_loss: 1.0428, test_loss: 1.0502, test_f1: 0.4721
 epoch: 13, train_loss: 1.0345, test_loss: 1.0434, test_f1: 0.4721
 epoch: 14, train_loss: 1.0195, test_loss: 1.0341, test_f1: 0.4695
 epoch: 15, train_loss: 1.0087, test_loss: 1.0243, test_f1: 0.4833
 epoch: 16, train_loss: 0.9971, test_loss: 1.0191, test_f1: 0.4963
 epoch: 17, train_loss: 0.9839, test_loss: 1.0080, test_f1: 0.4977
 epoch: 18, train_loss: 0.9673, test_loss: 1.0064, test_f1: 0.4980
 epoch: 19, train_loss: 0.9552, test_loss: 1.0003, test_f1: 0.4844
 epoch: 20, train_loss: 0.9404, test_loss: 1.0161, test_f1: 0.4780
 epoch: 21, train_loss: 0.9325, test_loss: 0.9958, test_f1: 0.4834
 epoch: 22, train_loss: 0.9095, test_loss: 0.9948, test_f1: 0.4945
 epoch: 23, train_loss: 0.9029, test_loss: 0.9882, test_f1: 0.4899
 epoch: 24, train_loss: 0.8958, test_loss: 1.0047, test_f1: 0.4996
 epoch: 25, train_loss: 0.8780, test_loss: 0.9871, test_f1: 0.5081
 epoch: 26, train_loss: 0.8643, test_loss: 0.9959, test_f1: 0.5096
 epoch: 27, train_loss: 0.8560, test_loss: 0.9924, test_f1: 0.5016
 epoch: 28, train_loss: 0.8416, test_loss: 0.9796, test_f1: 0.5170
 epoch: 29, train_loss: 0.8339, test_loss: 0.9823, test_f1: 0.4959
 epoch: 30, train_loss: 0.8263, test_loss: 0.9984, test_f1: 0.5127
 epoch: 31, train_loss: 0.8110, test_loss: 1.0128, test_f1: 0.5028
 epoch: 32, train_loss: 0.8098, test_loss: 1.0166, test_f1: 0.5012
 epoch: 33, train_loss: 0.7868, test_loss: 1.0177, test_f1: 0.5088
 epoch: 34, train_loss: 0.7854, test_loss: 1.0268, test_f1: 0.5087
 epoch: 35, train_loss: 0.7678, test_loss: 1.0294, test_f1: 0.5083
 epoch: 36, train_loss: 0.7585, test_loss: 1.0499, test_f1: 0.5059
 epoch: 37, train_loss: 0.7514, test_loss: 1.0191, test_f1: 0.5173
 epoch: 38, train_loss: 0.7501, test_loss: 1.0281, test_f1: 0.5096
 epoch: 39, train_loss: 0.7316, test_loss: 1.0753, test_f1: 0.5020
 epoch: 40, train_loss: 0.7294, test_loss: 1.0758, test_f1: 0.5265
 epoch: 41, train_loss: 0.7072, test_loss: 1.0541, test_f1: 0.5277
 epoch: 42, train_loss: 0.7207, test_loss: 1.1096, test_f1: 0.5111
 epoch: 43, train_loss: 0.7135, test_loss: 1.0663, test_f1: 0.5218
 epoch: 44, train_loss: 0.6980, test_loss: 1.0671, test_f1: 0.5276
 epoch: 45, train_loss: 0.6907, test_loss: 1.0924, test_f1: 0.5215
 epoch: 46, train_loss: 0.6985, test_loss: 1.1093, test_f1: 0.5344
 epoch: 47, train_loss: 0.6906, test_loss: 1.1049, test_f1: 0.5212
 epoch: 48, train_loss: 0.6827, test_loss: 1.1497, test_f1: 0.5332
 epoch: 49, train_loss: 0.6585, test_loss: 1.1584, test_f1: 0.5336
 epoch: 50, train_loss: 0.6532, test_loss: 1.1404, test_f1: 0.5280
 epoch: 51, train_loss: 0.6472, test_loss: 1.1289, test_f1: 0.5360
 epoch: 52, train_loss: 0.6439, test_loss: 1.1484, test_f1: 0.5263
 epoch: 53, train_loss: 0.6465, test_loss: 1.1328, test_f1: 0.5429
 epoch: 54, train_loss: 0.6404, test_loss: 1.1361, test_f1: 0.5219
 epoch: 55, train_loss: 0.6285, test_loss: 1.1344, test_f1: 0.5412
 epoch: 56, train_loss: 0.6230, test_loss: 1.1466, test_f1: 0.5376
 epoch: 57, train_loss: 0.6130, test_loss: 1.1395, test_f1: 0.5182
 epoch: 58, train_loss: 0.6091, test_loss: 1.1500, test_f1: 0.5294
 epoch: 59, train_loss: 0.6311, test_loss: 1.1773, test_f1: 0.5317
 epoch: 60, train_loss: 0.6144, test_loss: 1.1965, test_f1: 0.5274
 epoch: 61, train_loss: 0.6025, test_loss: 1.2115, test_f1: 0.5163
 epoch: 62, train_loss: 0.6004, test_loss: 1.1745, test_f1: 0.5273
 epoch: 63, train_loss: 0.6070, test_loss: 1.2255, test_f1: 0.5375
 epoch: 64, train_loss: 0.5964, test_loss: 1.1840, test_f1: 0.5350
 epoch: 65, train_loss: 0.5819, test_loss: 1.1847, test_f1: 0.5319
 epoch: 66, train_loss: 0.5892, test_loss: 1.2225, test_f1: 0.5295
 epoch: 67, train_loss: 0.5962, test_loss: 1.2415, test_f1: 0.5312
 epoch: 68, train_loss: 0.5941, test_loss: 1.2628, test_f1: 0.5314
 epoch: 69, train_loss: 0.5728, test_loss: 1.2692, test_f1: 0.5401
 epoch: 70, train_loss: 0.5803, test_loss: 1.2612, test_f1: 0.5343
 epoch: 71, train_loss: 0.5741, test_loss: 1.2804, test_f1: 0.5372
 epoch: 72, train_loss: 0.5749, test_loss: 1.2696, test_f1: 0.5221
 epoch: 73, train_loss: 0.5713, test_loss: 1.2771, test_f1: 0.5370
 epoch: 74, train_loss: 0.5676, test_loss: 1.2674, test_f1: 0.5342
 epoch: 75, train_loss: 0.5724, test_loss: 1.2670, test_f1: 0.5255
 epoch: 76, train_loss: 0.5595, test_loss: 1.2769, test_f1: 0.5290
 epoch: 77, train_loss: 0.5591, test_loss: 1.2551, test_f1: 0.5364
 epoch: 78, train_loss: 0.5637, test_loss: 1.2449, test_f1: 0.5374
 epoch: 79, train_loss: 0.5579, test_loss: 1.3111, test_f1: 0.5290
 epoch: 80, train_loss: 0.5637, test_loss: 1.2850, test_f1: 0.5345
 epoch: 81, train_loss: 0.5539, test_loss: 1.3109, test_f1: 0.5257
 epoch: 82, train_loss: 0.5632, test_loss: 1.2854, test_f1: 0.5463
 epoch: 83, train_loss: 0.5442, test_loss: 1.3318, test_f1: 0.5478
 epoch: 84, train_loss: 0.5402, test_loss: 1.2943, test_f1: 0.5362
 epoch: 85, train_loss: 0.5367, test_loss: 1.3137, test_f1: 0.5419
 epoch: 86, train_loss: 0.5330, test_loss: 1.3604, test_f1: 0.5403
 epoch: 87, train_loss: 0.5252, test_loss: 1.3705, test_f1: 0.5375
 epoch: 88, train_loss: 0.5321, test_loss: 1.3536, test_f1: 0.5400
 epoch: 89, train_loss: 0.5327, test_loss: 1.3374, test_f1: 0.5464
 epoch: 90, train_loss: 0.5074, test_loss: 1.3623, test_f1: 0.5437
 epoch: 91, train_loss: 0.5268, test_loss: 1.3784, test_f1: 0.5241
 epoch: 92, train_loss: 0.5237, test_loss: 1.3971, test_f1: 0.5337
 epoch: 93, train_loss: 0.5414, test_loss: 1.3509, test_f1: 0.5463
 epoch: 94, train_loss: 0.5283, test_loss: 1.4008, test_f1: 0.5357
 epoch: 95, train_loss: 0.5136, test_loss: 1.4385, test_f1: 0.5485
 epoch: 96, train_loss: 0.5214, test_loss: 1.3627, test_f1: 0.5346
 epoch: 97, train_loss: 0.5209, test_loss: 1.3969, test_f1: 0.5324
 epoch: 98, train_loss: 0.5098, test_loss: 1.3906, test_f1: 0.5420
 epoch: 99, train_loss: 0.5176, test_loss: 1.4266, test_f1: 0.5202
##################ITERATION #3 ****************************************
 epoch: 0, train_loss: 1.2873, test_loss: 1.3121, test_f1: 0.2268
 epoch: 1, train_loss: 1.2266, test_loss: 1.2706, test_f1: 0.2958
 epoch: 2, train_loss: 1.2108, test_loss: 1.2322, test_f1: 0.4035
 epoch: 3, train_loss: 1.1874, test_loss: 1.2038, test_f1: 0.3985
 epoch: 4, train_loss: 1.1625, test_loss: 1.1743, test_f1: 0.4224
 epoch: 5, train_loss: 1.1495, test_loss: 1.1478, test_f1: 0.4245
 epoch: 6, train_loss: 1.1317, test_loss: 1.1368, test_f1: 0.4280
 epoch: 7, train_loss: 1.1120, test_loss: 1.1171, test_f1: 0.4418
 epoch: 8, train_loss: 1.1004, test_loss: 1.1025, test_f1: 0.4391
 epoch: 9, train_loss: 1.0848, test_loss: 1.0854, test_f1: 0.4485
 epoch: 10, train_loss: 1.0686, test_loss: 1.0739, test_f1: 0.4476
 epoch: 11, train_loss: 1.0569, test_loss: 1.0647, test_f1: 0.4566
 epoch: 12, train_loss: 1.0354, test_loss: 1.0508, test_f1: 0.4658
 epoch: 13, train_loss: 1.0163, test_loss: 1.0405, test_f1: 0.4628
 epoch: 14, train_loss: 1.0093, test_loss: 1.0389, test_f1: 0.4827
 epoch: 15, train_loss: 0.9880, test_loss: 1.0216, test_f1: 0.4785
 epoch: 16, train_loss: 0.9719, test_loss: 1.0144, test_f1: 0.4757
 epoch: 17, train_loss: 0.9525, test_loss: 1.0151, test_f1: 0.4820
 epoch: 18, train_loss: 0.9439, test_loss: 1.0110, test_f1: 0.4812
 epoch: 19, train_loss: 0.9359, test_loss: 1.0269, test_f1: 0.4685
 epoch: 20, train_loss: 0.9248, test_loss: 1.0135, test_f1: 0.4678
 epoch: 21, train_loss: 0.9218, test_loss: 1.0031, test_f1: 0.4808
 epoch: 22, train_loss: 0.8921, test_loss: 1.0208, test_f1: 0.4767
 epoch: 23, train_loss: 0.8953, test_loss: 1.0444, test_f1: 0.4724
 epoch: 24, train_loss: 0.8861, test_loss: 1.0315, test_f1: 0.4798
 epoch: 25, train_loss: 0.8724, test_loss: 1.0284, test_f1: 0.4871
 epoch: 26, train_loss: 0.8695, test_loss: 1.0321, test_f1: 0.4879
 epoch: 27, train_loss: 0.8504, test_loss: 1.0335, test_f1: 0.4943
 epoch: 28, train_loss: 0.8412, test_loss: 1.0624, test_f1: 0.4891
 epoch: 29, train_loss: 0.8315, test_loss: 1.0590, test_f1: 0.4896
 epoch: 30, train_loss: 0.8219, test_loss: 1.0733, test_f1: 0.4743
 epoch: 31, train_loss: 0.8089, test_loss: 1.0652, test_f1: 0.4935
 epoch: 32, train_loss: 0.8029, test_loss: 1.0788, test_f1: 0.4962
 epoch: 33, train_loss: 0.7874, test_loss: 1.0636, test_f1: 0.4977
 epoch: 34, train_loss: 0.7839, test_loss: 1.1045, test_f1: 0.4943
 epoch: 35, train_loss: 0.7734, test_loss: 1.1170, test_f1: 0.4881
 epoch: 36, train_loss: 0.7665, test_loss: 1.1339, test_f1: 0.4950
 epoch: 37, train_loss: 0.7746, test_loss: 1.0996, test_f1: 0.4877
 epoch: 38, train_loss: 0.7510, test_loss: 1.1506, test_f1: 0.4960
 epoch: 39, train_loss: 0.7522, test_loss: 1.1388, test_f1: 0.5000
 epoch: 40, train_loss: 0.7433, test_loss: 1.1519, test_f1: 0.4875
 epoch: 41, train_loss: 0.7390, test_loss: 1.1649, test_f1: 0.4931
 epoch: 42, train_loss: 0.7289, test_loss: 1.1238, test_f1: 0.5013
 epoch: 43, train_loss: 0.7259, test_loss: 1.1302, test_f1: 0.5105
 epoch: 44, train_loss: 0.7107, test_loss: 1.1846, test_f1: 0.5001
 epoch: 45, train_loss: 0.6943, test_loss: 1.2056, test_f1: 0.4964
 epoch: 46, train_loss: 0.6905, test_loss: 1.1833, test_f1: 0.5080
 epoch: 47, train_loss: 0.6777, test_loss: 1.1893, test_f1: 0.5011
 epoch: 48, train_loss: 0.6835, test_loss: 1.2383, test_f1: 0.5054
 epoch: 49, train_loss: 0.6711, test_loss: 1.2004, test_f1: 0.5074
 epoch: 50, train_loss: 0.6720, test_loss: 1.2489, test_f1: 0.5115
 epoch: 51, train_loss: 0.6546, test_loss: 1.2183, test_f1: 0.5096
 epoch: 52, train_loss: 0.6403, test_loss: 1.2134, test_f1: 0.4977
 epoch: 53, train_loss: 0.6326, test_loss: 1.2207, test_f1: 0.5058
 epoch: 54, train_loss: 0.6314, test_loss: 1.2426, test_f1: 0.5089
 epoch: 55, train_loss: 0.6300, test_loss: 1.2647, test_f1: 0.5078
 epoch: 56, train_loss: 0.6099, test_loss: 1.2586, test_f1: 0.5069
 epoch: 57, train_loss: 0.6304, test_loss: 1.2510, test_f1: 0.5203
 epoch: 58, train_loss: 0.6350, test_loss: 1.2635, test_f1: 0.5063
 epoch: 59, train_loss: 0.6127, test_loss: 1.2555, test_f1: 0.5184
 epoch: 60, train_loss: 0.6154, test_loss: 1.2893, test_f1: 0.5112
 epoch: 61, train_loss: 0.6120, test_loss: 1.2818, test_f1: 0.5101
 epoch: 62, train_loss: 0.5998, test_loss: 1.3175, test_f1: 0.5121
 epoch: 63, train_loss: 0.6003, test_loss: 1.3429, test_f1: 0.5141
 epoch: 64, train_loss: 0.6103, test_loss: 1.2901, test_f1: 0.5188
 epoch: 65, train_loss: 0.5953, test_loss: 1.3266, test_f1: 0.5188
 epoch: 66, train_loss: 0.6005, test_loss: 1.3145, test_f1: 0.5271
 epoch: 67, train_loss: 0.5875, test_loss: 1.3233, test_f1: 0.5181
 epoch: 68, train_loss: 0.5947, test_loss: 1.3347, test_f1: 0.5155
 epoch: 69, train_loss: 0.5786, test_loss: 1.3600, test_f1: 0.5235
 epoch: 70, train_loss: 0.5724, test_loss: 1.3835, test_f1: 0.5096
 epoch: 71, train_loss: 0.5876, test_loss: 1.3581, test_f1: 0.5155
 epoch: 72, train_loss: 0.5599, test_loss: 1.3398, test_f1: 0.5186
 epoch: 73, train_loss: 0.5763, test_loss: 1.3722, test_f1: 0.5275
 epoch: 74, train_loss: 0.5559, test_loss: 1.4019, test_f1: 0.5090
 epoch: 75, train_loss: 0.5623, test_loss: 1.4112, test_f1: 0.5254
 epoch: 76, train_loss: 0.5531, test_loss: 1.4336, test_f1: 0.5153
 epoch: 77, train_loss: 0.5547, test_loss: 1.4232, test_f1: 0.5144
 epoch: 78, train_loss: 0.5448, test_loss: 1.4173, test_f1: 0.5151
 epoch: 79, train_loss: 0.5620, test_loss: 1.4344, test_f1: 0.5182
 epoch: 80, train_loss: 0.5406, test_loss: 1.4600, test_f1: 0.5186
 epoch: 81, train_loss: 0.5575, test_loss: 1.4280, test_f1: 0.5255
 epoch: 82, train_loss: 0.5426, test_loss: 1.4143, test_f1: 0.5229
 epoch: 83, train_loss: 0.5424, test_loss: 1.4448, test_f1: 0.5226
 epoch: 84, train_loss: 0.5388, test_loss: 1.4349, test_f1: 0.5234
 epoch: 85, train_loss: 0.5189, test_loss: 1.4315, test_f1: 0.5249
 epoch: 86, train_loss: 0.5316, test_loss: 1.4433, test_f1: 0.5301
 epoch: 87, train_loss: 0.5156, test_loss: 1.4616, test_f1: 0.5113
 epoch: 88, train_loss: 0.5437, test_loss: 1.4673, test_f1: 0.5196
 epoch: 89, train_loss: 0.5293, test_loss: 1.4551, test_f1: 0.5136
 epoch: 90, train_loss: 0.5191, test_loss: 1.5022, test_f1: 0.5229
 epoch: 91, train_loss: 0.5047, test_loss: 1.5103, test_f1: 0.5311
 epoch: 92, train_loss: 0.5182, test_loss: 1.4914, test_f1: 0.5311
 epoch: 93, train_loss: 0.4992, test_loss: 1.5475, test_f1: 0.5300
 epoch: 94, train_loss: 0.5039, test_loss: 1.5124, test_f1: 0.5213
 epoch: 95, train_loss: 0.5079, test_loss: 1.4958, test_f1: 0.5430
 epoch: 96, train_loss: 0.5054, test_loss: 1.5724, test_f1: 0.5195
 epoch: 97, train_loss: 0.5113, test_loss: 1.5150, test_f1: 0.5385
 epoch: 98, train_loss: 0.5031, test_loss: 1.5852, test_f1: 0.5245
 epoch: 99, train_loss: 0.4950, test_loss: 1.5142, test_f1: 0.5238
##################ITERATION #4 ****************************************
 epoch: 0, train_loss: 1.2996, test_loss: 1.3230, test_f1: 0.2274
 epoch: 1, train_loss: 1.2242, test_loss: 1.2657, test_f1: 0.2444
 epoch: 2, train_loss: 1.2008, test_loss: 1.2142, test_f1: 0.3786
 epoch: 3, train_loss: 1.1784, test_loss: 1.1722, test_f1: 0.4188
 epoch: 4, train_loss: 1.1561, test_loss: 1.1502, test_f1: 0.4614
 epoch: 5, train_loss: 1.1474, test_loss: 1.1245, test_f1: 0.4664
 epoch: 6, train_loss: 1.1284, test_loss: 1.1115, test_f1: 0.4711
 epoch: 7, train_loss: 1.1197, test_loss: 1.0977, test_f1: 0.4689
 epoch: 8, train_loss: 1.0970, test_loss: 1.0872, test_f1: 0.4757
 epoch: 9, train_loss: 1.0770, test_loss: 1.0777, test_f1: 0.4579
 epoch: 10, train_loss: 1.0796, test_loss: 1.0716, test_f1: 0.4480
 epoch: 11, train_loss: 1.0513, test_loss: 1.0636, test_f1: 0.4608
 epoch: 12, train_loss: 1.0447, test_loss: 1.0552, test_f1: 0.4410
 epoch: 13, train_loss: 1.0216, test_loss: 1.0525, test_f1: 0.4557
 epoch: 14, train_loss: 1.0269, test_loss: 1.0473, test_f1: 0.4403
 epoch: 15, train_loss: 1.0117, test_loss: 1.0414, test_f1: 0.4415
 epoch: 16, train_loss: 0.9976, test_loss: 1.0406, test_f1: 0.4601
 epoch: 17, train_loss: 0.9850, test_loss: 1.0368, test_f1: 0.4564
 epoch: 18, train_loss: 0.9799, test_loss: 1.0369, test_f1: 0.4451
 epoch: 19, train_loss: 0.9651, test_loss: 1.0302, test_f1: 0.4717
 epoch: 20, train_loss: 0.9553, test_loss: 1.0385, test_f1: 0.4456
 epoch: 21, train_loss: 0.9316, test_loss: 1.0462, test_f1: 0.4571
 epoch: 22, train_loss: 0.9324, test_loss: 1.0316, test_f1: 0.4640
 epoch: 23, train_loss: 0.9128, test_loss: 1.0302, test_f1: 0.4531
 epoch: 24, train_loss: 0.9016, test_loss: 1.0404, test_f1: 0.4462
 epoch: 25, train_loss: 0.8971, test_loss: 1.0547, test_f1: 0.4430
 epoch: 26, train_loss: 0.8891, test_loss: 1.0572, test_f1: 0.4516
 epoch: 27, train_loss: 0.8751, test_loss: 1.0894, test_f1: 0.4465
 epoch: 28, train_loss: 0.8748, test_loss: 1.0676, test_f1: 0.4491
 epoch: 29, train_loss: 0.8549, test_loss: 1.0661, test_f1: 0.4843
 epoch: 30, train_loss: 0.8451, test_loss: 1.0804, test_f1: 0.4520
 epoch: 31, train_loss: 0.8418, test_loss: 1.1113, test_f1: 0.4518
 epoch: 32, train_loss: 0.8327, test_loss: 1.1005, test_f1: 0.4617
 epoch: 33, train_loss: 0.8355, test_loss: 1.0726, test_f1: 0.4664
 epoch: 34, train_loss: 0.8216, test_loss: 1.0812, test_f1: 0.4549
 epoch: 35, train_loss: 0.8211, test_loss: 1.1055, test_f1: 0.4785
 epoch: 36, train_loss: 0.8065, test_loss: 1.1411, test_f1: 0.4598
 epoch: 37, train_loss: 0.7851, test_loss: 1.0928, test_f1: 0.4663
 epoch: 38, train_loss: 0.7887, test_loss: 1.1509, test_f1: 0.4543
 epoch: 39, train_loss: 0.7781, test_loss: 1.1032, test_f1: 0.4735
 epoch: 40, train_loss: 0.7725, test_loss: 1.1761, test_f1: 0.4693
 epoch: 41, train_loss: 0.7566, test_loss: 1.1674, test_f1: 0.4658
 epoch: 42, train_loss: 0.7687, test_loss: 1.1037, test_f1: 0.4965
 epoch: 43, train_loss: 0.7463, test_loss: 1.2014, test_f1: 0.4687
 epoch: 44, train_loss: 0.7358, test_loss: 1.1613, test_f1: 0.4695
 epoch: 45, train_loss: 0.7469, test_loss: 1.2088, test_f1: 0.4862
 epoch: 46, train_loss: 0.7373, test_loss: 1.1827, test_f1: 0.4823
 epoch: 47, train_loss: 0.7348, test_loss: 1.2233, test_f1: 0.4716
 epoch: 48, train_loss: 0.7160, test_loss: 1.2477, test_f1: 0.4649
 epoch: 49, train_loss: 0.7000, test_loss: 1.1963, test_f1: 0.4761
 epoch: 50, train_loss: 0.6927, test_loss: 1.2454, test_f1: 0.4783
 epoch: 51, train_loss: 0.6930, test_loss: 1.2415, test_f1: 0.4824
 epoch: 52, train_loss: 0.6707, test_loss: 1.2242, test_f1: 0.4917
 epoch: 53, train_loss: 0.6752, test_loss: 1.2600, test_f1: 0.4732
 epoch: 54, train_loss: 0.6829, test_loss: 1.2755, test_f1: 0.4623
 epoch: 55, train_loss: 0.6752, test_loss: 1.2491, test_f1: 0.4900
 epoch: 56, train_loss: 0.6705, test_loss: 1.2544, test_f1: 0.4829
 epoch: 57, train_loss: 0.6578, test_loss: 1.2625, test_f1: 0.4834
 epoch: 58, train_loss: 0.6541, test_loss: 1.2833, test_f1: 0.4728
 epoch: 59, train_loss: 0.6576, test_loss: 1.2466, test_f1: 0.4887
 epoch: 60, train_loss: 0.6635, test_loss: 1.2542, test_f1: 0.4966
 epoch: 61, train_loss: 0.6609, test_loss: 1.2800, test_f1: 0.4832
 epoch: 62, train_loss: 0.6496, test_loss: 1.3087, test_f1: 0.4837
 epoch: 63, train_loss: 0.6362, test_loss: 1.3069, test_f1: 0.4922
 epoch: 64, train_loss: 0.6507, test_loss: 1.3688, test_f1: 0.4682
 epoch: 65, train_loss: 0.6340, test_loss: 1.3570, test_f1: 0.4786
 epoch: 66, train_loss: 0.6354, test_loss: 1.3069, test_f1: 0.4913
 epoch: 67, train_loss: 0.6202, test_loss: 1.3241, test_f1: 0.4805
 epoch: 68, train_loss: 0.6196, test_loss: 1.3476, test_f1: 0.4895
 epoch: 69, train_loss: 0.6086, test_loss: 1.3624, test_f1: 0.4793
 epoch: 70, train_loss: 0.5970, test_loss: 1.3422, test_f1: 0.4751
 epoch: 71, train_loss: 0.6189, test_loss: 1.3613, test_f1: 0.4850
 epoch: 72, train_loss: 0.6214, test_loss: 1.3813, test_f1: 0.4957
 epoch: 73, train_loss: 0.5985, test_loss: 1.3304, test_f1: 0.4927
 epoch: 74, train_loss: 0.6067, test_loss: 1.3691, test_f1: 0.4921
 epoch: 75, train_loss: 0.6093, test_loss: 1.4006, test_f1: 0.4954
 epoch: 76, train_loss: 0.6001, test_loss: 1.3562, test_f1: 0.5104
 epoch: 77, train_loss: 0.6120, test_loss: 1.4069, test_f1: 0.4999
 epoch: 78, train_loss: 0.6026, test_loss: 1.3743, test_f1: 0.4745
 epoch: 79, train_loss: 0.5861, test_loss: 1.4206, test_f1: 0.4803
 epoch: 80, train_loss: 0.5851, test_loss: 1.4078, test_f1: 0.4817
 epoch: 81, train_loss: 0.5832, test_loss: 1.4224, test_f1: 0.4882
 epoch: 82, train_loss: 0.6067, test_loss: 1.3843, test_f1: 0.4941
 epoch: 83, train_loss: 0.5983, test_loss: 1.4031, test_f1: 0.4852
 epoch: 84, train_loss: 0.5851, test_loss: 1.3958, test_f1: 0.4933
 epoch: 85, train_loss: 0.5718, test_loss: 1.3902, test_f1: 0.5030
 epoch: 86, train_loss: 0.5590, test_loss: 1.4239, test_f1: 0.4921
 epoch: 87, train_loss: 0.5912, test_loss: 1.4067, test_f1: 0.4960
 epoch: 88, train_loss: 0.5527, test_loss: 1.4526, test_f1: 0.4982
 epoch: 89, train_loss: 0.5624, test_loss: 1.4374, test_f1: 0.5041
 epoch: 90, train_loss: 0.5535, test_loss: 1.5079, test_f1: 0.4895
 epoch: 91, train_loss: 0.5546, test_loss: 1.5165, test_f1: 0.4894
 epoch: 92, train_loss: 0.5655, test_loss: 1.4910, test_f1: 0.4974
 epoch: 93, train_loss: 0.5494, test_loss: 1.4604, test_f1: 0.4874
 epoch: 94, train_loss: 0.5589, test_loss: 1.5193, test_f1: 0.4930
 epoch: 95, train_loss: 0.5639, test_loss: 1.4745, test_f1: 0.4943
 epoch: 96, train_loss: 0.5506, test_loss: 1.4989, test_f1: 0.4973
 epoch: 97, train_loss: 0.5419, test_loss: 1.5186, test_f1: 0.4814
 epoch: 98, train_loss: 0.5441, test_loss: 1.4965, test_f1: 0.5095
 epoch: 99, train_loss: 0.5412, test_loss: 1.4680, test_f1: 0.5009
##################ITERATION #5 ****************************************
 epoch: 0, train_loss: 1.3152, test_loss: 1.3075, test_f1: 0.2331
 epoch: 1, train_loss: 1.2239, test_loss: 1.2724, test_f1: 0.2571
 epoch: 2, train_loss: 1.2004, test_loss: 1.2216, test_f1: 0.3084
 epoch: 3, train_loss: 1.1732, test_loss: 1.1808, test_f1: 0.3771
 epoch: 4, train_loss: 1.1602, test_loss: 1.1443, test_f1: 0.4370
 epoch: 5, train_loss: 1.1404, test_loss: 1.1256, test_f1: 0.4284
 epoch: 6, train_loss: 1.1296, test_loss: 1.1151, test_f1: 0.4292
 epoch: 7, train_loss: 1.1162, test_loss: 1.1157, test_f1: 0.4201
 epoch: 8, train_loss: 1.1054, test_loss: 1.1044, test_f1: 0.4286
 epoch: 9, train_loss: 1.0924, test_loss: 1.0904, test_f1: 0.4308
 epoch: 10, train_loss: 1.0704, test_loss: 1.0897, test_f1: 0.4495
 epoch: 11, train_loss: 1.0685, test_loss: 1.0769, test_f1: 0.4482
 epoch: 12, train_loss: 1.0518, test_loss: 1.0736, test_f1: 0.4454
 epoch: 13, train_loss: 1.0370, test_loss: 1.0698, test_f1: 0.4390
 epoch: 14, train_loss: 1.0314, test_loss: 1.0567, test_f1: 0.4424
 epoch: 15, train_loss: 1.0213, test_loss: 1.0477, test_f1: 0.4603
 epoch: 16, train_loss: 1.0055, test_loss: 1.0557, test_f1: 0.4520
 epoch: 17, train_loss: 1.0014, test_loss: 1.0492, test_f1: 0.4475
 epoch: 18, train_loss: 0.9846, test_loss: 1.0431, test_f1: 0.4533
 epoch: 19, train_loss: 0.9742, test_loss: 1.0548, test_f1: 0.4540
 epoch: 20, train_loss: 0.9597, test_loss: 1.0555, test_f1: 0.4423
 epoch: 21, train_loss: 0.9440, test_loss: 1.0653, test_f1: 0.4391
 epoch: 22, train_loss: 0.9332, test_loss: 1.0467, test_f1: 0.4453
 epoch: 23, train_loss: 0.9331, test_loss: 1.0695, test_f1: 0.4458
 epoch: 24, train_loss: 0.9144, test_loss: 1.0358, test_f1: 0.4841
 epoch: 25, train_loss: 0.8988, test_loss: 1.0688, test_f1: 0.4613
 epoch: 26, train_loss: 0.9009, test_loss: 1.0559, test_f1: 0.4730
 epoch: 27, train_loss: 0.8777, test_loss: 1.0811, test_f1: 0.4797
 epoch: 28, train_loss: 0.8697, test_loss: 1.0808, test_f1: 0.4581
 epoch: 29, train_loss: 0.8597, test_loss: 1.0869, test_f1: 0.4617
 epoch: 30, train_loss: 0.8489, test_loss: 1.0695, test_f1: 0.4569
 epoch: 31, train_loss: 0.8332, test_loss: 1.1084, test_f1: 0.4553
 epoch: 32, train_loss: 0.8346, test_loss: 1.0827, test_f1: 0.4762
 epoch: 33, train_loss: 0.8125, test_loss: 1.0798, test_f1: 0.4757
 epoch: 34, train_loss: 0.8226, test_loss: 1.1172, test_f1: 0.4583
 epoch: 35, train_loss: 0.8059, test_loss: 1.1105, test_f1: 0.4847
 epoch: 36, train_loss: 0.8013, test_loss: 1.0722, test_f1: 0.4820
 epoch: 37, train_loss: 0.7811, test_loss: 1.1194, test_f1: 0.4821
 epoch: 38, train_loss: 0.7769, test_loss: 1.1391, test_f1: 0.4779
 epoch: 39, train_loss: 0.7829, test_loss: 1.1029, test_f1: 0.5010
 epoch: 40, train_loss: 0.7757, test_loss: 1.1315, test_f1: 0.4959
 epoch: 41, train_loss: 0.7571, test_loss: 1.1393, test_f1: 0.4824
 epoch: 42, train_loss: 0.7482, test_loss: 1.1494, test_f1: 0.4778
 epoch: 43, train_loss: 0.7344, test_loss: 1.1415, test_f1: 0.4884
 epoch: 44, train_loss: 0.7504, test_loss: 1.1716, test_f1: 0.4745
 epoch: 45, train_loss: 0.7291, test_loss: 1.1529, test_f1: 0.5023
 epoch: 46, train_loss: 0.7239, test_loss: 1.1615, test_f1: 0.4945
 epoch: 47, train_loss: 0.7280, test_loss: 1.1583, test_f1: 0.4963
 epoch: 48, train_loss: 0.7041, test_loss: 1.1458, test_f1: 0.5072
 epoch: 49, train_loss: 0.7165, test_loss: 1.1434, test_f1: 0.4878
 epoch: 50, train_loss: 0.6966, test_loss: 1.1408, test_f1: 0.4891
 epoch: 51, train_loss: 0.6733, test_loss: 1.1686, test_f1: 0.5013
 epoch: 52, train_loss: 0.6755, test_loss: 1.1874, test_f1: 0.5067
 epoch: 53, train_loss: 0.6720, test_loss: 1.1980, test_f1: 0.5042
 epoch: 54, train_loss: 0.6635, test_loss: 1.2064, test_f1: 0.5022
 epoch: 55, train_loss: 0.6615, test_loss: 1.2139, test_f1: 0.4961
 epoch: 56, train_loss: 0.6421, test_loss: 1.2139, test_f1: 0.5109
 epoch: 57, train_loss: 0.6377, test_loss: 1.2402, test_f1: 0.4850
 epoch: 58, train_loss: 0.6489, test_loss: 1.2648, test_f1: 0.4929
 epoch: 59, train_loss: 0.6437, test_loss: 1.2450, test_f1: 0.4951
 epoch: 60, train_loss: 0.6274, test_loss: 1.2545, test_f1: 0.5157
 epoch: 61, train_loss: 0.6499, test_loss: 1.2132, test_f1: 0.5030
 epoch: 62, train_loss: 0.6353, test_loss: 1.2395, test_f1: 0.5067
 epoch: 63, train_loss: 0.6468, test_loss: 1.2580, test_f1: 0.5064
 epoch: 64, train_loss: 0.6265, test_loss: 1.2724, test_f1: 0.5034
 epoch: 65, train_loss: 0.6295, test_loss: 1.2637, test_f1: 0.5122
 epoch: 66, train_loss: 0.6246, test_loss: 1.2725, test_f1: 0.5101
 epoch: 67, train_loss: 0.6201, test_loss: 1.2576, test_f1: 0.5110
 epoch: 68, train_loss: 0.6157, test_loss: 1.2675, test_f1: 0.5117
 epoch: 69, train_loss: 0.6209, test_loss: 1.2771, test_f1: 0.5075
 epoch: 70, train_loss: 0.6073, test_loss: 1.2490, test_f1: 0.5038
 epoch: 71, train_loss: 0.6081, test_loss: 1.2850, test_f1: 0.5041
 epoch: 72, train_loss: 0.6104, test_loss: 1.2711, test_f1: 0.5141
 epoch: 73, train_loss: 0.5951, test_loss: 1.3105, test_f1: 0.5020
 epoch: 74, train_loss: 0.5888, test_loss: 1.3059, test_f1: 0.5072
 epoch: 75, train_loss: 0.5827, test_loss: 1.3315, test_f1: 0.5001
 epoch: 76, train_loss: 0.5888, test_loss: 1.3337, test_f1: 0.5076
 epoch: 77, train_loss: 0.5813, test_loss: 1.3353, test_f1: 0.5133
 epoch: 78, train_loss: 0.5824, test_loss: 1.3389, test_f1: 0.5140
 epoch: 79, train_loss: 0.5889, test_loss: 1.3987, test_f1: 0.5027
 epoch: 80, train_loss: 0.5802, test_loss: 1.3853, test_f1: 0.5150
 epoch: 81, train_loss: 0.5629, test_loss: 1.3897, test_f1: 0.5156
 epoch: 82, train_loss: 0.5701, test_loss: 1.3860, test_f1: 0.5059
 epoch: 83, train_loss: 0.5707, test_loss: 1.3838, test_f1: 0.5166
 epoch: 84, train_loss: 0.5782, test_loss: 1.3735, test_f1: 0.5025
 epoch: 85, train_loss: 0.5578, test_loss: 1.4390, test_f1: 0.4993
 epoch: 86, train_loss: 0.5568, test_loss: 1.4409, test_f1: 0.5070
 epoch: 87, train_loss: 0.5574, test_loss: 1.3725, test_f1: 0.5177
 epoch: 88, train_loss: 0.5600, test_loss: 1.3921, test_f1: 0.5186
 epoch: 89, train_loss: 0.5451, test_loss: 1.4524, test_f1: 0.5018
 epoch: 90, train_loss: 0.5398, test_loss: 1.4335, test_f1: 0.4982
 epoch: 91, train_loss: 0.5382, test_loss: 1.4338, test_f1: 0.5231
 epoch: 92, train_loss: 0.5395, test_loss: 1.4183, test_f1: 0.5176
 epoch: 93, train_loss: 0.5521, test_loss: 1.4167, test_f1: 0.5186
 epoch: 94, train_loss: 0.5515, test_loss: 1.4241, test_f1: 0.5204
 epoch: 95, train_loss: 0.5110, test_loss: 1.4199, test_f1: 0.5250
 epoch: 96, train_loss: 0.5272, test_loss: 1.4506, test_f1: 0.5183
 epoch: 97, train_loss: 0.5298, test_loss: 1.4449, test_f1: 0.5104
 epoch: 98, train_loss: 0.5247, test_loss: 1.4266, test_f1: 0.5180
 epoch: 99, train_loss: 0.5268, test_loss: 1.4586, test_f1: 0.5130
##################ITERATION #6 ****************************************
 epoch: 0, train_loss: 1.3256, test_loss: 1.3159, test_f1: 0.2657
 epoch: 1, train_loss: 1.2130, test_loss: 1.2425, test_f1: 0.4096
 epoch: 2, train_loss: 1.1858, test_loss: 1.1805, test_f1: 0.4560
 epoch: 3, train_loss: 1.1538, test_loss: 1.1419, test_f1: 0.4420
 epoch: 4, train_loss: 1.1417, test_loss: 1.1268, test_f1: 0.4604
 epoch: 5, train_loss: 1.1194, test_loss: 1.1106, test_f1: 0.4730
 epoch: 6, train_loss: 1.1053, test_loss: 1.0952, test_f1: 0.4609
 epoch: 7, train_loss: 1.0931, test_loss: 1.0849, test_f1: 0.4587
 epoch: 8, train_loss: 1.0748, test_loss: 1.0705, test_f1: 0.4656
 epoch: 9, train_loss: 1.0682, test_loss: 1.0583, test_f1: 0.4716
 epoch: 10, train_loss: 1.0528, test_loss: 1.0528, test_f1: 0.4683
 epoch: 11, train_loss: 1.0337, test_loss: 1.0500, test_f1: 0.4549
 epoch: 12, train_loss: 1.0259, test_loss: 1.0514, test_f1: 0.4541
 epoch: 13, train_loss: 1.0079, test_loss: 1.0312, test_f1: 0.4587
 epoch: 14, train_loss: 1.0080, test_loss: 1.0372, test_f1: 0.4572
 epoch: 15, train_loss: 0.9906, test_loss: 1.0336, test_f1: 0.4609
 epoch: 16, train_loss: 0.9864, test_loss: 1.0434, test_f1: 0.4619
 epoch: 17, train_loss: 0.9789, test_loss: 1.0339, test_f1: 0.4691
 epoch: 18, train_loss: 0.9723, test_loss: 1.0276, test_f1: 0.4853
 epoch: 19, train_loss: 0.9482, test_loss: 1.0325, test_f1: 0.4767
 epoch: 20, train_loss: 0.9478, test_loss: 1.0405, test_f1: 0.4754
 epoch: 21, train_loss: 0.9396, test_loss: 1.0321, test_f1: 0.4898
 epoch: 22, train_loss: 0.9189, test_loss: 1.0372, test_f1: 0.4767
 epoch: 23, train_loss: 0.9195, test_loss: 1.0209, test_f1: 0.4808
 epoch: 24, train_loss: 0.9094, test_loss: 1.0354, test_f1: 0.4801
 epoch: 25, train_loss: 0.9078, test_loss: 1.0153, test_f1: 0.4828
 epoch: 26, train_loss: 0.8918, test_loss: 1.0294, test_f1: 0.4835
 epoch: 27, train_loss: 0.8707, test_loss: 1.0362, test_f1: 0.4954
 epoch: 28, train_loss: 0.8724, test_loss: 1.0324, test_f1: 0.4930
 epoch: 29, train_loss: 0.8728, test_loss: 1.0443, test_f1: 0.4854
 epoch: 30, train_loss: 0.8516, test_loss: 1.0312, test_f1: 0.5045
 epoch: 31, train_loss: 0.8530, test_loss: 1.0399, test_f1: 0.4845
 epoch: 32, train_loss: 0.8323, test_loss: 1.0488, test_f1: 0.4996
 epoch: 33, train_loss: 0.8303, test_loss: 1.0616, test_f1: 0.5032
 epoch: 34, train_loss: 0.8273, test_loss: 1.0794, test_f1: 0.4845
 epoch: 35, train_loss: 0.8110, test_loss: 1.0505, test_f1: 0.5023
 epoch: 36, train_loss: 0.8125, test_loss: 1.0520, test_f1: 0.5096
 epoch: 37, train_loss: 0.8175, test_loss: 1.0975, test_f1: 0.4959
 epoch: 38, train_loss: 0.8010, test_loss: 1.0756, test_f1: 0.4954
 epoch: 39, train_loss: 0.7796, test_loss: 1.0805, test_f1: 0.4969
 epoch: 40, train_loss: 0.7729, test_loss: 1.0768, test_f1: 0.4992
 epoch: 41, train_loss: 0.7653, test_loss: 1.1069, test_f1: 0.5075
 epoch: 42, train_loss: 0.7618, test_loss: 1.1248, test_f1: 0.5047
 epoch: 43, train_loss: 0.7539, test_loss: 1.0995, test_f1: 0.5090
 epoch: 44, train_loss: 0.7439, test_loss: 1.1549, test_f1: 0.5059
 epoch: 45, train_loss: 0.7407, test_loss: 1.1483, test_f1: 0.5051
 epoch: 46, train_loss: 0.7424, test_loss: 1.1153, test_f1: 0.4959
 epoch: 47, train_loss: 0.7274, test_loss: 1.1179, test_f1: 0.5075
 epoch: 48, train_loss: 0.7171, test_loss: 1.1672, test_f1: 0.4970
 epoch: 49, train_loss: 0.7221, test_loss: 1.2074, test_f1: 0.5003
 epoch: 50, train_loss: 0.7073, test_loss: 1.1955, test_f1: 0.5111
 epoch: 51, train_loss: 0.6953, test_loss: 1.1698, test_f1: 0.4945
 epoch: 52, train_loss: 0.6918, test_loss: 1.1933, test_f1: 0.5054
 epoch: 53, train_loss: 0.6776, test_loss: 1.1923, test_f1: 0.5055
 epoch: 54, train_loss: 0.6763, test_loss: 1.1937, test_f1: 0.4999
 epoch: 55, train_loss: 0.6790, test_loss: 1.2120, test_f1: 0.5039
 epoch: 56, train_loss: 0.6696, test_loss: 1.1955, test_f1: 0.5113
 epoch: 57, train_loss: 0.6671, test_loss: 1.2127, test_f1: 0.5198
 epoch: 58, train_loss: 0.6680, test_loss: 1.2522, test_f1: 0.4922
 epoch: 59, train_loss: 0.6532, test_loss: 1.2443, test_f1: 0.5090
 epoch: 60, train_loss: 0.6479, test_loss: 1.2430, test_f1: 0.5095
 epoch: 61, train_loss: 0.6444, test_loss: 1.2441, test_f1: 0.4921
 epoch: 62, train_loss: 0.6558, test_loss: 1.2728, test_f1: 0.4988
 epoch: 63, train_loss: 0.6539, test_loss: 1.2813, test_f1: 0.5038
 epoch: 64, train_loss: 0.6417, test_loss: 1.2811, test_f1: 0.5105
 epoch: 65, train_loss: 0.6338, test_loss: 1.2795, test_f1: 0.5045
 epoch: 66, train_loss: 0.6526, test_loss: 1.2855, test_f1: 0.5091
 epoch: 67, train_loss: 0.6469, test_loss: 1.2791, test_f1: 0.5094
 epoch: 68, train_loss: 0.6364, test_loss: 1.2787, test_f1: 0.5162
 epoch: 69, train_loss: 0.6426, test_loss: 1.2856, test_f1: 0.5069
 epoch: 70, train_loss: 0.6276, test_loss: 1.2750, test_f1: 0.5188
 epoch: 71, train_loss: 0.6274, test_loss: 1.3170, test_f1: 0.5098
 epoch: 72, train_loss: 0.6379, test_loss: 1.3026, test_f1: 0.5160
 epoch: 73, train_loss: 0.6114, test_loss: 1.3154, test_f1: 0.5252
 epoch: 74, train_loss: 0.6188, test_loss: 1.3334, test_f1: 0.5216
 epoch: 75, train_loss: 0.6176, test_loss: 1.3405, test_f1: 0.5138
 epoch: 76, train_loss: 0.6074, test_loss: 1.3152, test_f1: 0.5203
 epoch: 77, train_loss: 0.5912, test_loss: 1.3645, test_f1: 0.5184
 epoch: 78, train_loss: 0.5976, test_loss: 1.3531, test_f1: 0.5174
 epoch: 79, train_loss: 0.6120, test_loss: 1.3071, test_f1: 0.5192
 epoch: 80, train_loss: 0.5991, test_loss: 1.3642, test_f1: 0.5018
 epoch: 81, train_loss: 0.5945, test_loss: 1.3701, test_f1: 0.5229
 epoch: 82, train_loss: 0.5857, test_loss: 1.3666, test_f1: 0.5104
 epoch: 83, train_loss: 0.5764, test_loss: 1.3556, test_f1: 0.5178
 epoch: 84, train_loss: 0.5768, test_loss: 1.3277, test_f1: 0.5434
 epoch: 85, train_loss: 0.5757, test_loss: 1.3780, test_f1: 0.5288
 epoch: 86, train_loss: 0.5770, test_loss: 1.3736, test_f1: 0.5243
 epoch: 87, train_loss: 0.5737, test_loss: 1.3621, test_f1: 0.5306
 epoch: 88, train_loss: 0.5710, test_loss: 1.3895, test_f1: 0.5246
 epoch: 89, train_loss: 0.5595, test_loss: 1.4032, test_f1: 0.5204
 epoch: 90, train_loss: 0.5683, test_loss: 1.4582, test_f1: 0.5202
 epoch: 91, train_loss: 0.5641, test_loss: 1.4214, test_f1: 0.5219
 epoch: 92, train_loss: 0.5661, test_loss: 1.3839, test_f1: 0.5273
 epoch: 93, train_loss: 0.5566, test_loss: 1.4086, test_f1: 0.5316
 epoch: 94, train_loss: 0.5676, test_loss: 1.4535, test_f1: 0.5147
 epoch: 95, train_loss: 0.5725, test_loss: 1.4513, test_f1: 0.5202
 epoch: 96, train_loss: 0.5473, test_loss: 1.3833, test_f1: 0.5252
 epoch: 97, train_loss: 0.5616, test_loss: 1.4291, test_f1: 0.5291
 epoch: 98, train_loss: 0.5659, test_loss: 1.4296, test_f1: 0.5150
 epoch: 99, train_loss: 0.5559, test_loss: 1.4307, test_f1: 0.5159
##################ITERATION #7 ****************************************
 epoch: 0, train_loss: 1.3220, test_loss: 1.3102, test_f1: 0.2301
 epoch: 1, train_loss: 1.2272, test_loss: 1.2619, test_f1: 0.3000
 epoch: 2, train_loss: 1.1930, test_loss: 1.2067, test_f1: 0.3895
 epoch: 3, train_loss: 1.1707, test_loss: 1.1447, test_f1: 0.4683
 epoch: 4, train_loss: 1.1483, test_loss: 1.1207, test_f1: 0.4727
 epoch: 5, train_loss: 1.1392, test_loss: 1.0979, test_f1: 0.4692
 epoch: 6, train_loss: 1.1045, test_loss: 1.0873, test_f1: 0.4792
 epoch: 7, train_loss: 1.1115, test_loss: 1.0892, test_f1: 0.4708
 epoch: 8, train_loss: 1.0871, test_loss: 1.0737, test_f1: 0.4600
 epoch: 9, train_loss: 1.0717, test_loss: 1.0614, test_f1: 0.4654
 epoch: 10, train_loss: 1.0569, test_loss: 1.0519, test_f1: 0.4740
 epoch: 11, train_loss: 1.0586, test_loss: 1.0484, test_f1: 0.4665
 epoch: 12, train_loss: 1.0347, test_loss: 1.0356, test_f1: 0.4747
 epoch: 13, train_loss: 1.0144, test_loss: 1.0297, test_f1: 0.4830
 epoch: 14, train_loss: 1.0139, test_loss: 1.0341, test_f1: 0.4798
 epoch: 15, train_loss: 0.9995, test_loss: 1.0344, test_f1: 0.4775
 epoch: 16, train_loss: 0.9945, test_loss: 1.0233, test_f1: 0.4879
 epoch: 17, train_loss: 0.9764, test_loss: 1.0226, test_f1: 0.4835
 epoch: 18, train_loss: 0.9700, test_loss: 1.0213, test_f1: 0.4695
 epoch: 19, train_loss: 0.9615, test_loss: 1.0136, test_f1: 0.4830
 epoch: 20, train_loss: 0.9467, test_loss: 1.0196, test_f1: 0.4723
 epoch: 21, train_loss: 0.9449, test_loss: 0.9999, test_f1: 0.5035
 epoch: 22, train_loss: 0.9344, test_loss: 1.0127, test_f1: 0.4791
 epoch: 23, train_loss: 0.9223, test_loss: 0.9988, test_f1: 0.5128
 epoch: 24, train_loss: 0.8998, test_loss: 1.0098, test_f1: 0.4756
 epoch: 25, train_loss: 0.8975, test_loss: 1.0072, test_f1: 0.4742
 epoch: 26, train_loss: 0.8915, test_loss: 1.0252, test_f1: 0.4794
 epoch: 27, train_loss: 0.8828, test_loss: 1.0031, test_f1: 0.4940
 epoch: 28, train_loss: 0.8730, test_loss: 1.0080, test_f1: 0.4852
 epoch: 29, train_loss: 0.8630, test_loss: 0.9916, test_f1: 0.5006
 epoch: 30, train_loss: 0.8561, test_loss: 1.0260, test_f1: 0.4990
 epoch: 31, train_loss: 0.8402, test_loss: 1.0184, test_f1: 0.4793
 epoch: 32, train_loss: 0.8280, test_loss: 1.0318, test_f1: 0.4928
 epoch: 33, train_loss: 0.8128, test_loss: 1.0399, test_f1: 0.4772
 epoch: 34, train_loss: 0.8135, test_loss: 1.0345, test_f1: 0.4793
 epoch: 35, train_loss: 0.7991, test_loss: 1.0526, test_f1: 0.5092
 epoch: 36, train_loss: 0.7997, test_loss: 1.0279, test_f1: 0.4963
 epoch: 37, train_loss: 0.7931, test_loss: 1.0292, test_f1: 0.4827
 epoch: 38, train_loss: 0.7952, test_loss: 1.0482, test_f1: 0.5008
 epoch: 39, train_loss: 0.7752, test_loss: 1.0487, test_f1: 0.4947
 epoch: 40, train_loss: 0.7560, test_loss: 1.0461, test_f1: 0.5028
 epoch: 41, train_loss: 0.7652, test_loss: 1.0551, test_f1: 0.5048
 epoch: 42, train_loss: 0.7605, test_loss: 1.0593, test_f1: 0.4880
 epoch: 43, train_loss: 0.7406, test_loss: 1.0665, test_f1: 0.4872
 epoch: 44, train_loss: 0.7363, test_loss: 1.0593, test_f1: 0.5010
 epoch: 45, train_loss: 0.7296, test_loss: 1.0750, test_f1: 0.4831
 epoch: 46, train_loss: 0.7236, test_loss: 1.0922, test_f1: 0.4910
 epoch: 47, train_loss: 0.7064, test_loss: 1.0931, test_f1: 0.5105
 epoch: 48, train_loss: 0.7111, test_loss: 1.1298, test_f1: 0.5071
 epoch: 49, train_loss: 0.7088, test_loss: 1.0876, test_f1: 0.5136
 epoch: 50, train_loss: 0.6889, test_loss: 1.1147, test_f1: 0.5142
 epoch: 51, train_loss: 0.6737, test_loss: 1.1046, test_f1: 0.5107
 epoch: 52, train_loss: 0.6702, test_loss: 1.1294, test_f1: 0.5198
 epoch: 53, train_loss: 0.6591, test_loss: 1.1397, test_f1: 0.5130
 epoch: 54, train_loss: 0.6392, test_loss: 1.1420, test_f1: 0.5218
 epoch: 55, train_loss: 0.6370, test_loss: 1.1556, test_f1: 0.5282
 epoch: 56, train_loss: 0.6519, test_loss: 1.1307, test_f1: 0.5124
 epoch: 57, train_loss: 0.6518, test_loss: 1.1724, test_f1: 0.5127
 epoch: 58, train_loss: 0.6486, test_loss: 1.1718, test_f1: 0.5083
 epoch: 59, train_loss: 0.6226, test_loss: 1.1690, test_f1: 0.5127
 epoch: 60, train_loss: 0.6234, test_loss: 1.1820, test_f1: 0.5120
 epoch: 61, train_loss: 0.6353, test_loss: 1.1903, test_f1: 0.5210
 epoch: 62, train_loss: 0.6243, test_loss: 1.1954, test_f1: 0.5117
 epoch: 63, train_loss: 0.6298, test_loss: 1.1915, test_f1: 0.5165
 epoch: 64, train_loss: 0.6370, test_loss: 1.1724, test_f1: 0.5036
 epoch: 65, train_loss: 0.6139, test_loss: 1.1915, test_f1: 0.5199
 epoch: 66, train_loss: 0.6106, test_loss: 1.1867, test_f1: 0.5295
 epoch: 67, train_loss: 0.6161, test_loss: 1.1955, test_f1: 0.5183
 epoch: 68, train_loss: 0.6172, test_loss: 1.2059, test_f1: 0.5242
 epoch: 69, train_loss: 0.6012, test_loss: 1.2406, test_f1: 0.5242
 epoch: 70, train_loss: 0.6006, test_loss: 1.2333, test_f1: 0.5103
 epoch: 71, train_loss: 0.6096, test_loss: 1.2383, test_f1: 0.5092
 epoch: 72, train_loss: 0.5948, test_loss: 1.2578, test_f1: 0.5100
 epoch: 73, train_loss: 0.5944, test_loss: 1.2374, test_f1: 0.5249
 epoch: 74, train_loss: 0.5650, test_loss: 1.2063, test_f1: 0.5313
 epoch: 75, train_loss: 0.5895, test_loss: 1.2117, test_f1: 0.5234
 epoch: 76, train_loss: 0.5689, test_loss: 1.2611, test_f1: 0.5214
 epoch: 77, train_loss: 0.5830, test_loss: 1.2398, test_f1: 0.5206
 epoch: 78, train_loss: 0.5807, test_loss: 1.2630, test_f1: 0.5326
 epoch: 79, train_loss: 0.5889, test_loss: 1.2950, test_f1: 0.5080
 epoch: 80, train_loss: 0.5775, test_loss: 1.2435, test_f1: 0.5202
 epoch: 81, train_loss: 0.5809, test_loss: 1.2833, test_f1: 0.5097
 epoch: 82, train_loss: 0.5567, test_loss: 1.2668, test_f1: 0.5331
 epoch: 83, train_loss: 0.5616, test_loss: 1.2981, test_f1: 0.5063
 epoch: 84, train_loss: 0.5608, test_loss: 1.3186, test_f1: 0.5025
 epoch: 85, train_loss: 0.5493, test_loss: 1.2929, test_f1: 0.5483
 epoch: 86, train_loss: 0.5688, test_loss: 1.3436, test_f1: 0.5258
 epoch: 87, train_loss: 0.5486, test_loss: 1.3258, test_f1: 0.5249
 epoch: 88, train_loss: 0.5548, test_loss: 1.3182, test_f1: 0.5232
 epoch: 89, train_loss: 0.5513, test_loss: 1.3308, test_f1: 0.5229
 epoch: 90, train_loss: 0.5566, test_loss: 1.3143, test_f1: 0.5240
 epoch: 91, train_loss: 0.5384, test_loss: 1.3173, test_f1: 0.5296
 epoch: 92, train_loss: 0.5215, test_loss: 1.3856, test_f1: 0.5157
 epoch: 93, train_loss: 0.5494, test_loss: 1.3243, test_f1: 0.5273
 epoch: 94, train_loss: 0.5371, test_loss: 1.3281, test_f1: 0.5162
 epoch: 95, train_loss: 0.5296, test_loss: 1.3586, test_f1: 0.5239
 epoch: 96, train_loss: 0.5301, test_loss: 1.3263, test_f1: 0.5255
 epoch: 97, train_loss: 0.5379, test_loss: 1.3738, test_f1: 0.5261
 epoch: 98, train_loss: 0.5209, test_loss: 1.3496, test_f1: 0.5445
 epoch: 99, train_loss: 0.5308, test_loss: 1.3738, test_f1: 0.5252
##################ITERATION #8 ****************************************
 epoch: 0, train_loss: 1.3658, test_loss: 1.3040, test_f1: 0.2600
 epoch: 1, train_loss: 1.2551, test_loss: 1.2484, test_f1: 0.2830
 epoch: 2, train_loss: 1.2227, test_loss: 1.1892, test_f1: 0.3646
 epoch: 3, train_loss: 1.1977, test_loss: 1.1552, test_f1: 0.4084
 epoch: 4, train_loss: 1.1747, test_loss: 1.1303, test_f1: 0.4381
 epoch: 5, train_loss: 1.1587, test_loss: 1.1165, test_f1: 0.4636
 epoch: 6, train_loss: 1.1243, test_loss: 1.1041, test_f1: 0.4411
 epoch: 7, train_loss: 1.1306, test_loss: 1.0828, test_f1: 0.4485
 epoch: 8, train_loss: 1.1054, test_loss: 1.0807, test_f1: 0.4391
 epoch: 9, train_loss: 1.1020, test_loss: 1.0727, test_f1: 0.4529
 epoch: 10, train_loss: 1.0828, test_loss: 1.0600, test_f1: 0.4773
 epoch: 11, train_loss: 1.0799, test_loss: 1.0601, test_f1: 0.4688
 epoch: 12, train_loss: 1.0660, test_loss: 1.0435, test_f1: 0.4767
 epoch: 13, train_loss: 1.0441, test_loss: 1.0489, test_f1: 0.4654
 epoch: 14, train_loss: 1.0322, test_loss: 1.0269, test_f1: 0.4730
 epoch: 15, train_loss: 1.0376, test_loss: 1.0248, test_f1: 0.4916
 epoch: 16, train_loss: 1.0180, test_loss: 1.0248, test_f1: 0.4770
 epoch: 17, train_loss: 1.0144, test_loss: 1.0191, test_f1: 0.4933
 epoch: 18, train_loss: 1.0108, test_loss: 1.0124, test_f1: 0.4792
 epoch: 19, train_loss: 0.9867, test_loss: 1.0090, test_f1: 0.4748
 epoch: 20, train_loss: 0.9696, test_loss: 1.0005, test_f1: 0.4965
 epoch: 21, train_loss: 0.9748, test_loss: 0.9990, test_f1: 0.4908
 epoch: 22, train_loss: 0.9684, test_loss: 1.0020, test_f1: 0.4858
 epoch: 23, train_loss: 0.9557, test_loss: 0.9983, test_f1: 0.4772
 epoch: 24, train_loss: 0.9466, test_loss: 1.0006, test_f1: 0.4903
 epoch: 25, train_loss: 0.9276, test_loss: 0.9903, test_f1: 0.5145
 epoch: 26, train_loss: 0.9358, test_loss: 0.9867, test_f1: 0.5181
 epoch: 27, train_loss: 0.9218, test_loss: 0.9932, test_f1: 0.4862
 epoch: 28, train_loss: 0.9170, test_loss: 0.9926, test_f1: 0.4892
 epoch: 29, train_loss: 0.9048, test_loss: 1.0045, test_f1: 0.4914
 epoch: 30, train_loss: 0.8991, test_loss: 0.9921, test_f1: 0.5056
 epoch: 31, train_loss: 0.8806, test_loss: 1.0097, test_f1: 0.4922
 epoch: 32, train_loss: 0.8832, test_loss: 0.9851, test_f1: 0.5007
 epoch: 33, train_loss: 0.8694, test_loss: 1.0122, test_f1: 0.4781
 epoch: 34, train_loss: 0.8548, test_loss: 1.0110, test_f1: 0.4909
 epoch: 35, train_loss: 0.8489, test_loss: 1.0080, test_f1: 0.4926
 epoch: 36, train_loss: 0.8266, test_loss: 1.0466, test_f1: 0.4780
 epoch: 37, train_loss: 0.8270, test_loss: 1.0151, test_f1: 0.4890
 epoch: 38, train_loss: 0.8210, test_loss: 1.0291, test_f1: 0.4811
 epoch: 39, train_loss: 0.8334, test_loss: 1.0237, test_f1: 0.4898
 epoch: 40, train_loss: 0.8205, test_loss: 1.0290, test_f1: 0.4867
 epoch: 41, train_loss: 0.8248, test_loss: 1.0271, test_f1: 0.5088
 epoch: 42, train_loss: 0.8028, test_loss: 1.0236, test_f1: 0.4983
 epoch: 43, train_loss: 0.7891, test_loss: 1.0307, test_f1: 0.4862
 epoch: 44, train_loss: 0.7924, test_loss: 1.0626, test_f1: 0.4876
 epoch: 45, train_loss: 0.7806, test_loss: 1.0845, test_f1: 0.4962
 epoch: 46, train_loss: 0.7652, test_loss: 1.1267, test_f1: 0.4804
 epoch: 47, train_loss: 0.7691, test_loss: 1.0852, test_f1: 0.5048
 epoch: 48, train_loss: 0.7569, test_loss: 1.0595, test_f1: 0.4996
 epoch: 49, train_loss: 0.7538, test_loss: 1.0867, test_f1: 0.5039
 epoch: 50, train_loss: 0.7479, test_loss: 1.0913, test_f1: 0.5003
 epoch: 51, train_loss: 0.7220, test_loss: 1.0979, test_f1: 0.4872
 epoch: 52, train_loss: 0.7130, test_loss: 1.1028, test_f1: 0.4856
 epoch: 53, train_loss: 0.7096, test_loss: 1.1152, test_f1: 0.4863
 epoch: 54, train_loss: 0.7059, test_loss: 1.1278, test_f1: 0.5060
 epoch: 55, train_loss: 0.7007, test_loss: 1.1709, test_f1: 0.4985
 epoch: 56, train_loss: 0.7120, test_loss: 1.1207, test_f1: 0.4986
 epoch: 57, train_loss: 0.6823, test_loss: 1.1289, test_f1: 0.5119
 epoch: 58, train_loss: 0.7026, test_loss: 1.1411, test_f1: 0.4912
 epoch: 59, train_loss: 0.6727, test_loss: 1.1431, test_f1: 0.5066
 epoch: 60, train_loss: 0.6784, test_loss: 1.1330, test_f1: 0.4986
 epoch: 61, train_loss: 0.6953, test_loss: 1.1685, test_f1: 0.4938
 epoch: 62, train_loss: 0.6810, test_loss: 1.1486, test_f1: 0.5075
 epoch: 63, train_loss: 0.6836, test_loss: 1.1885, test_f1: 0.5125
 epoch: 64, train_loss: 0.6878, test_loss: 1.1927, test_f1: 0.4932
 epoch: 65, train_loss: 0.6712, test_loss: 1.2309, test_f1: 0.4925
 epoch: 66, train_loss: 0.6717, test_loss: 1.2379, test_f1: 0.4949
 epoch: 67, train_loss: 0.6535, test_loss: 1.2175, test_f1: 0.5089
 epoch: 68, train_loss: 0.6668, test_loss: 1.2308, test_f1: 0.5071
 epoch: 69, train_loss: 0.6642, test_loss: 1.2247, test_f1: 0.4929
 epoch: 70, train_loss: 0.6615, test_loss: 1.2316, test_f1: 0.5122
 epoch: 71, train_loss: 0.6447, test_loss: 1.2837, test_f1: 0.4916
 epoch: 72, train_loss: 0.6500, test_loss: 1.2563, test_f1: 0.4959
 epoch: 73, train_loss: 0.6363, test_loss: 1.1873, test_f1: 0.5092
 epoch: 74, train_loss: 0.6432, test_loss: 1.2506, test_f1: 0.5062
 epoch: 75, train_loss: 0.6317, test_loss: 1.2017, test_f1: 0.5276
 epoch: 76, train_loss: 0.6270, test_loss: 1.2045, test_f1: 0.5128
 epoch: 77, train_loss: 0.6176, test_loss: 1.2225, test_f1: 0.5115
 epoch: 78, train_loss: 0.6299, test_loss: 1.2508, test_f1: 0.5150
 epoch: 79, train_loss: 0.6119, test_loss: 1.2054, test_f1: 0.5199
 epoch: 80, train_loss: 0.6256, test_loss: 1.2316, test_f1: 0.5161
 epoch: 81, train_loss: 0.5978, test_loss: 1.2461, test_f1: 0.5054
 epoch: 82, train_loss: 0.6175, test_loss: 1.2501, test_f1: 0.5180
 epoch: 83, train_loss: 0.6064, test_loss: 1.2341, test_f1: 0.5225
 epoch: 84, train_loss: 0.6099, test_loss: 1.2565, test_f1: 0.5176
 epoch: 85, train_loss: 0.6176, test_loss: 1.2678, test_f1: 0.5072
 epoch: 86, train_loss: 0.6121, test_loss: 1.3499, test_f1: 0.4996
 epoch: 87, train_loss: 0.5936, test_loss: 1.2588, test_f1: 0.5332
 epoch: 88, train_loss: 0.5883, test_loss: 1.2613, test_f1: 0.5229
 epoch: 89, train_loss: 0.5838, test_loss: 1.2749, test_f1: 0.5359
 epoch: 90, train_loss: 0.5824, test_loss: 1.3032, test_f1: 0.5211
 epoch: 91, train_loss: 0.5807, test_loss: 1.3141, test_f1: 0.5333
 epoch: 92, train_loss: 0.6003, test_loss: 1.3001, test_f1: 0.5092
 epoch: 93, train_loss: 0.5802, test_loss: 1.3155, test_f1: 0.5317
 epoch: 94, train_loss: 0.5812, test_loss: 1.3574, test_f1: 0.5169
 epoch: 95, train_loss: 0.5679, test_loss: 1.3143, test_f1: 0.5346
 epoch: 96, train_loss: 0.5556, test_loss: 1.3037, test_f1: 0.5269
 epoch: 97, train_loss: 0.5781, test_loss: 1.4144, test_f1: 0.5246
 epoch: 98, train_loss: 0.5652, test_loss: 1.4399, test_f1: 0.5197
 epoch: 99, train_loss: 0.5712, test_loss: 1.4308, test_f1: 0.5157
##################ITERATION #9 ****************************************
 epoch: 0, train_loss: 1.3646, test_loss: 1.2990, test_f1: 0.2580
 epoch: 1, train_loss: 1.2537, test_loss: 1.2755, test_f1: 0.2531
 epoch: 2, train_loss: 1.2219, test_loss: 1.2299, test_f1: 0.3049
 epoch: 3, train_loss: 1.1992, test_loss: 1.1926, test_f1: 0.3972
 epoch: 4, train_loss: 1.1740, test_loss: 1.1482, test_f1: 0.4264
 epoch: 5, train_loss: 1.1682, test_loss: 1.1254, test_f1: 0.4064
 epoch: 6, train_loss: 1.1330, test_loss: 1.1145, test_f1: 0.4285
 epoch: 7, train_loss: 1.1152, test_loss: 1.1116, test_f1: 0.4143
 epoch: 8, train_loss: 1.1177, test_loss: 1.0984, test_f1: 0.4252
 epoch: 9, train_loss: 1.0922, test_loss: 1.0979, test_f1: 0.4170
 epoch: 10, train_loss: 1.0759, test_loss: 1.0993, test_f1: 0.4187
 epoch: 11, train_loss: 1.0736, test_loss: 1.0791, test_f1: 0.4312
 epoch: 12, train_loss: 1.0578, test_loss: 1.0784, test_f1: 0.4342
 epoch: 13, train_loss: 1.0468, test_loss: 1.0789, test_f1: 0.4401
 epoch: 14, train_loss: 1.0341, test_loss: 1.0751, test_f1: 0.4385
 epoch: 15, train_loss: 1.0286, test_loss: 1.0783, test_f1: 0.4535
 epoch: 16, train_loss: 1.0112, test_loss: 1.0659, test_f1: 0.4595
 epoch: 17, train_loss: 1.0028, test_loss: 1.0656, test_f1: 0.4642
 epoch: 18, train_loss: 0.9897, test_loss: 1.0553, test_f1: 0.4549
 epoch: 19, train_loss: 0.9869, test_loss: 1.0571, test_f1: 0.4696
 epoch: 20, train_loss: 0.9759, test_loss: 1.0627, test_f1: 0.4924
 epoch: 21, train_loss: 0.9692, test_loss: 1.0486, test_f1: 0.4835
 epoch: 22, train_loss: 0.9648, test_loss: 1.0387, test_f1: 0.4842
 epoch: 23, train_loss: 0.9488, test_loss: 1.0443, test_f1: 0.4907
 epoch: 24, train_loss: 0.9410, test_loss: 1.0517, test_f1: 0.4840
 epoch: 25, train_loss: 0.9384, test_loss: 1.0629, test_f1: 0.4737
 epoch: 26, train_loss: 0.9189, test_loss: 1.0569, test_f1: 0.4764
 epoch: 27, train_loss: 0.9069, test_loss: 1.0556, test_f1: 0.4947
 epoch: 28, train_loss: 0.9041, test_loss: 1.0457, test_f1: 0.4947
 epoch: 29, train_loss: 0.8813, test_loss: 1.0544, test_f1: 0.5064
 epoch: 30, train_loss: 0.8883, test_loss: 1.0854, test_f1: 0.5008
 epoch: 31, train_loss: 0.8846, test_loss: 1.0575, test_f1: 0.5096
 epoch: 32, train_loss: 0.8825, test_loss: 1.0630, test_f1: 0.5177
 epoch: 33, train_loss: 0.8599, test_loss: 1.0616, test_f1: 0.4884
 epoch: 34, train_loss: 0.8594, test_loss: 1.0687, test_f1: 0.5059
 epoch: 35, train_loss: 0.8469, test_loss: 1.1005, test_f1: 0.4901
 epoch: 36, train_loss: 0.8599, test_loss: 1.0735, test_f1: 0.4955
 epoch: 37, train_loss: 0.8470, test_loss: 1.0872, test_f1: 0.5042
 epoch: 38, train_loss: 0.8157, test_loss: 1.0947, test_f1: 0.4996
 epoch: 39, train_loss: 0.8262, test_loss: 1.1004, test_f1: 0.4966
 epoch: 40, train_loss: 0.8042, test_loss: 1.0990, test_f1: 0.5055
 epoch: 41, train_loss: 0.8067, test_loss: 1.1186, test_f1: 0.4998
 epoch: 42, train_loss: 0.7979, test_loss: 1.1338, test_f1: 0.4833
 epoch: 43, train_loss: 0.7794, test_loss: 1.1478, test_f1: 0.4923
 epoch: 44, train_loss: 0.7776, test_loss: 1.1328, test_f1: 0.4914
 epoch: 45, train_loss: 0.7760, test_loss: 1.1563, test_f1: 0.4942
 epoch: 46, train_loss: 0.7746, test_loss: 1.1545, test_f1: 0.5004
 epoch: 47, train_loss: 0.7604, test_loss: 1.1554, test_f1: 0.4944
 epoch: 48, train_loss: 0.7416, test_loss: 1.1531, test_f1: 0.4947
 epoch: 49, train_loss: 0.7347, test_loss: 1.1772, test_f1: 0.5030
 epoch: 50, train_loss: 0.7412, test_loss: 1.1683, test_f1: 0.4961
 epoch: 51, train_loss: 0.7433, test_loss: 1.1810, test_f1: 0.5040
 epoch: 52, train_loss: 0.7237, test_loss: 1.1997, test_f1: 0.4987
 epoch: 53, train_loss: 0.7107, test_loss: 1.2089, test_f1: 0.4911
 epoch: 54, train_loss: 0.6964, test_loss: 1.2002, test_f1: 0.4837
 epoch: 55, train_loss: 0.7190, test_loss: 1.2011, test_f1: 0.4915
 epoch: 56, train_loss: 0.7119, test_loss: 1.2169, test_f1: 0.4926
 epoch: 57, train_loss: 0.7020, test_loss: 1.2124, test_f1: 0.4853
 epoch: 58, train_loss: 0.6850, test_loss: 1.2306, test_f1: 0.4876
 epoch: 59, train_loss: 0.7120, test_loss: 1.2279, test_f1: 0.4863
 epoch: 60, train_loss: 0.7014, test_loss: 1.2169, test_f1: 0.5029
 epoch: 61, train_loss: 0.6880, test_loss: 1.2158, test_f1: 0.4946
 epoch: 62, train_loss: 0.6825, test_loss: 1.2415, test_f1: 0.4946
 epoch: 63, train_loss: 0.6817, test_loss: 1.2559, test_f1: 0.4767
 epoch: 64, train_loss: 0.6864, test_loss: 1.2638, test_f1: 0.4699
 epoch: 65, train_loss: 0.6747, test_loss: 1.2565, test_f1: 0.4842
 epoch: 66, train_loss: 0.6626, test_loss: 1.2783, test_f1: 0.4806
 epoch: 67, train_loss: 0.6613, test_loss: 1.2639, test_f1: 0.4946
 epoch: 68, train_loss: 0.6684, test_loss: 1.2447, test_f1: 0.4958
 epoch: 69, train_loss: 0.6674, test_loss: 1.2509, test_f1: 0.4923
 epoch: 70, train_loss: 0.6555, test_loss: 1.2787, test_f1: 0.4956
 epoch: 71, train_loss: 0.6572, test_loss: 1.2683, test_f1: 0.5000
 epoch: 72, train_loss: 0.6566, test_loss: 1.2972, test_f1: 0.4838
 epoch: 73, train_loss: 0.6514, test_loss: 1.3232, test_f1: 0.4810
 epoch: 74, train_loss: 0.6416, test_loss: 1.3106, test_f1: 0.4795
 epoch: 75, train_loss: 0.6456, test_loss: 1.2842, test_f1: 0.4860
 epoch: 76, train_loss: 0.6403, test_loss: 1.3229, test_f1: 0.4882
 epoch: 77, train_loss: 0.6433, test_loss: 1.3412, test_f1: 0.4855
 epoch: 78, train_loss: 0.6369, test_loss: 1.3161, test_f1: 0.4851
 epoch: 79, train_loss: 0.6262, test_loss: 1.3210, test_f1: 0.4824
 epoch: 80, train_loss: 0.6385, test_loss: 1.3326, test_f1: 0.4814
 epoch: 81, train_loss: 0.6217, test_loss: 1.3971, test_f1: 0.4765
 epoch: 82, train_loss: 0.6206, test_loss: 1.4272, test_f1: 0.4738
 epoch: 83, train_loss: 0.6307, test_loss: 1.3867, test_f1: 0.4756
 epoch: 84, train_loss: 0.6116, test_loss: 1.3554, test_f1: 0.4767
 epoch: 85, train_loss: 0.6237, test_loss: 1.3640, test_f1: 0.4826
 epoch: 86, train_loss: 0.6090, test_loss: 1.3629, test_f1: 0.4946
 epoch: 87, train_loss: 0.6144, test_loss: 1.3953, test_f1: 0.4783
 epoch: 88, train_loss: 0.6281, test_loss: 1.3871, test_f1: 0.4766
 epoch: 89, train_loss: 0.6108, test_loss: 1.3764, test_f1: 0.4820
 epoch: 90, train_loss: 0.5983, test_loss: 1.3501, test_f1: 0.4952
 epoch: 91, train_loss: 0.5975, test_loss: 1.3677, test_f1: 0.4799
 epoch: 92, train_loss: 0.6042, test_loss: 1.4089, test_f1: 0.4752
 epoch: 93, train_loss: 0.5950, test_loss: 1.3698, test_f1: 0.4897
 epoch: 94, train_loss: 0.6051, test_loss: 1.3796, test_f1: 0.5000
 epoch: 95, train_loss: 0.5870, test_loss: 1.3766, test_f1: 0.4963
 epoch: 96, train_loss: 0.5963, test_loss: 1.3767, test_f1: 0.5109
 epoch: 97, train_loss: 0.5789, test_loss: 1.3838, test_f1: 0.4889
 epoch: 98, train_loss: 0.5969, test_loss: 1.4006, test_f1: 0.4827
 epoch: 99, train_loss: 0.5612, test_loss: 1.4010, test_f1: 0.5105

Training completed in 414.80 seconds
Best F1: 0.5485 at epoch 95
Mean F1 across iterations: 0.5319  0.0130
========================FINAL RESULTS================================
FEGIN weighted F1: 0.5485  0.0130
python main.py --data ltspice_examples --representation component_component --model FEGIN --layers 5 --hiddens 128 --batch_size 256 --lr 0.0001 --emb_size 250 --epochs 100 --save_appendix component_component_L5_H128_BS256_LR0.0001_E250 --no_val
-----



STDERR:
  File "main.py", line 370, in <module>
    main()
  File "main.py", line 254, in main
    dataset = dataset_class(
  File "/home/philip/projects/ltspice_examples_code_repo/Circuit-Completion-Using-GNNs/component_classification_with_link_prediction_head/evaluation/FEGIN/kernel/circuit_datasets.py", line 15, in __init__
    self.data, self.slices = torch.load(self.processed_paths[0])
  File "/home/philip/.local/lib/python3.8/site-packages/torch/serialization.py", line 1040, in load
    warnings.warn(
  File "/usr/lib/python3.8/warnings.py", line 109, in _showwarnmsg
    sw(msg.message, msg.category, msg.filename, msg.lineno,
  File "main.py", line 47, in warn_with_traceback
    traceback.print_stack(file=log)
/home/philip/projects/ltspice_examples_code_repo/Circuit-Completion-Using-GNNs/component_classification_with_link_prediction_head/evaluation/FEGIN/kernel/circuit_datasets.py:15: FutureWarning: You are using `torch.load` with `weights_only=False` (the current default value), which uses the default pickle module implicitly. It is possible to construct malicious pickle data which will execute arbitrary code during unpickling (See https://github.com/pytorch/pytorch/blob/main/SECURITY.md#untrusted-models for more details). In a future release, the default value for `weights_only` will be flipped to `True`. This limits the functions that could be executed during unpickling. Arbitrary objects will no longer be allowed to be loaded via this mode unless they are explicitly allowlisted by the user via `torch.serialization.add_safe_globals`. We recommend you start setting `weights_only=True` for any use case where you don't have full control of the loaded file. Please open an issue on GitHub for any issues related to this experimental feature.
  self.data, self.slices = torch.load(self.processed_paths[0])
