STDOUT:
Results will be saved in /home/philip/projects/llm_inference_code_repo/Circuit-Completion-Using-GNNs/component_classification_with_link_prediction_head/evaluation/FEGIN/results/model_FEGIN_dataset_ltspice_examples
Command line input: python main.py --data ltspice_examples --representation component_pin --model FEGIN --layers 3 --hiddens 128 --batch_size 128 --lr 0.001 --emb_size 250 --epochs 100 --save_appendix component_pin_L3_H128_BS128_LR0.001_E250 --no_val
 is saved.
-----
ltspice_examples - FEGIN
Using 3 layers, 128 hidden units, h = 2
Loading component_pin representation dataset
ENTERED
Training FEGIN on component_pin representation
Train: 3560, Test: 848
##################ITERATION #0 ****************************************
 epoch: 0, train_loss: 1.2323, test_loss: 1.2007, test_f1: 0.2260
 epoch: 1, train_loss: 1.0264, test_loss: 1.0574, test_f1: 0.3699
 epoch: 2, train_loss: 0.9436, test_loss: 0.9102, test_f1: 0.5424
 epoch: 3, train_loss: 0.8945, test_loss: 0.8963, test_f1: 0.4992
 epoch: 4, train_loss: 0.8673, test_loss: 0.9813, test_f1: 0.5251
 epoch: 5, train_loss: 0.8209, test_loss: 0.9400, test_f1: 0.5077
 epoch: 6, train_loss: 0.7850, test_loss: 0.7966, test_f1: 0.5661
 epoch: 7, train_loss: 0.7632, test_loss: 0.8363, test_f1: 0.5791
 epoch: 8, train_loss: 0.7401, test_loss: 0.7943, test_f1: 0.5605
 epoch: 9, train_loss: 0.7094, test_loss: 0.7545, test_f1: 0.6230
 epoch: 10, train_loss: 0.6939, test_loss: 0.8150, test_f1: 0.5335
 epoch: 11, train_loss: 0.6889, test_loss: 0.9206, test_f1: 0.6098
 epoch: 12, train_loss: 0.6460, test_loss: 0.8340, test_f1: 0.6017
 epoch: 13, train_loss: 0.6413, test_loss: 1.0073, test_f1: 0.6054
 epoch: 14, train_loss: 0.6214, test_loss: 0.8274, test_f1: 0.6311
 epoch: 15, train_loss: 0.6177, test_loss: 0.9451, test_f1: 0.5635
 epoch: 16, train_loss: 0.6129, test_loss: 0.8601, test_f1: 0.5945
 epoch: 17, train_loss: 0.5953, test_loss: 0.8759, test_f1: 0.5823
 epoch: 18, train_loss: 0.5910, test_loss: 0.9529, test_f1: 0.6305
 epoch: 19, train_loss: 0.5477, test_loss: 0.7801, test_f1: 0.6424
 epoch: 20, train_loss: 0.5407, test_loss: 0.8232, test_f1: 0.6197
 epoch: 21, train_loss: 0.5366, test_loss: 0.8716, test_f1: 0.6313
 epoch: 22, train_loss: 0.5313, test_loss: 0.8360, test_f1: 0.6405
 epoch: 23, train_loss: 0.5305, test_loss: 0.8564, test_f1: 0.6148
 epoch: 24, train_loss: 0.5055, test_loss: 1.1561, test_f1: 0.6028
 epoch: 25, train_loss: 0.4944, test_loss: 1.0393, test_f1: 0.6370
 epoch: 26, train_loss: 0.4880, test_loss: 0.9996, test_f1: 0.6392
 epoch: 27, train_loss: 0.4560, test_loss: 0.7853, test_f1: 0.6362
 epoch: 28, train_loss: 0.4598, test_loss: 1.2094, test_f1: 0.6211
 epoch: 29, train_loss: 0.4601, test_loss: 0.9805, test_f1: 0.6461
 epoch: 30, train_loss: 0.4438, test_loss: 0.8594, test_f1: 0.6512
 epoch: 31, train_loss: 0.4228, test_loss: 1.0038, test_f1: 0.6111
 epoch: 32, train_loss: 0.4287, test_loss: 0.9240, test_f1: 0.6386
 epoch: 33, train_loss: 0.4116, test_loss: 0.9631, test_f1: 0.6418
 epoch: 34, train_loss: 0.4114, test_loss: 1.0135, test_f1: 0.6107
 epoch: 35, train_loss: 0.3879, test_loss: 0.9768, test_f1: 0.6147
 epoch: 36, train_loss: 0.3833, test_loss: 0.9425, test_f1: 0.6846
 epoch: 37, train_loss: 0.3752, test_loss: 0.9328, test_f1: 0.6526
 epoch: 38, train_loss: 0.3808, test_loss: 0.8400, test_f1: 0.6865
 epoch: 39, train_loss: 0.3589, test_loss: 1.3362, test_f1: 0.5954
 epoch: 40, train_loss: 0.3365, test_loss: 1.1120, test_f1: 0.6488
 epoch: 41, train_loss: 0.3458, test_loss: 0.9565, test_f1: 0.6727
 epoch: 42, train_loss: 0.3270, test_loss: 1.0603, test_f1: 0.6299
 epoch: 43, train_loss: 0.3321, test_loss: 0.9943, test_f1: 0.6755
 epoch: 44, train_loss: 0.3065, test_loss: 1.1014, test_f1: 0.6430
 epoch: 45, train_loss: 0.2908, test_loss: 1.2561, test_f1: 0.6223
 epoch: 46, train_loss: 0.2972, test_loss: 1.1240, test_f1: 0.6774
 epoch: 47, train_loss: 0.3140, test_loss: 1.0511, test_f1: 0.6746
 epoch: 48, train_loss: 0.3087, test_loss: 1.1130, test_f1: 0.6728
 epoch: 49, train_loss: 0.2804, test_loss: 1.1631, test_f1: 0.6506
 epoch: 50, train_loss: 0.2672, test_loss: 1.1087, test_f1: 0.6631
 epoch: 51, train_loss: 0.2345, test_loss: 1.2021, test_f1: 0.6623
 epoch: 52, train_loss: 0.2120, test_loss: 1.1882, test_f1: 0.6864
 epoch: 53, train_loss: 0.2089, test_loss: 1.2468, test_f1: 0.6637
 epoch: 54, train_loss: 0.1938, test_loss: 1.3523, test_f1: 0.6596
 epoch: 55, train_loss: 0.1975, test_loss: 1.4089, test_f1: 0.6437
 epoch: 56, train_loss: 0.1807, test_loss: 1.3685, test_f1: 0.6780
 epoch: 57, train_loss: 0.1668, test_loss: 1.3725, test_f1: 0.6587
 epoch: 58, train_loss: 0.1797, test_loss: 1.4233, test_f1: 0.6716
 epoch: 59, train_loss: 0.1812, test_loss: 1.4820, test_f1: 0.6579
 epoch: 60, train_loss: 0.1677, test_loss: 1.4477, test_f1: 0.6666
 epoch: 61, train_loss: 0.1711, test_loss: 1.4340, test_f1: 0.6940
 epoch: 62, train_loss: 0.1780, test_loss: 1.5048, test_f1: 0.6599
 epoch: 63, train_loss: 0.1725, test_loss: 1.3876, test_f1: 0.6746
 epoch: 64, train_loss: 0.1598, test_loss: 1.4323, test_f1: 0.6779
 epoch: 65, train_loss: 0.1465, test_loss: 1.5460, test_f1: 0.6742
 epoch: 66, train_loss: 0.1459, test_loss: 1.5398, test_f1: 0.6506
 epoch: 67, train_loss: 0.1456, test_loss: 1.3396, test_f1: 0.6907
 epoch: 68, train_loss: 0.1468, test_loss: 1.4798, test_f1: 0.6670
 epoch: 69, train_loss: 0.1626, test_loss: 1.6089, test_f1: 0.6633
 epoch: 70, train_loss: 0.1333, test_loss: 1.8953, test_f1: 0.6387
 epoch: 71, train_loss: 0.1496, test_loss: 1.6236, test_f1: 0.6633
 epoch: 72, train_loss: 0.1365, test_loss: 1.6052, test_f1: 0.6732
 epoch: 73, train_loss: 0.1357, test_loss: 1.5702, test_f1: 0.6753
 epoch: 74, train_loss: 0.1399, test_loss: 1.6602, test_f1: 0.6748
 epoch: 75, train_loss: 0.1378, test_loss: 1.5697, test_f1: 0.6623
 epoch: 76, train_loss: 0.1311, test_loss: 1.5558, test_f1: 0.6806
 epoch: 77, train_loss: 0.1294, test_loss: 1.5798, test_f1: 0.6843
 epoch: 78, train_loss: 0.1299, test_loss: 1.6006, test_f1: 0.6783
 epoch: 79, train_loss: 0.1341, test_loss: 1.7108, test_f1: 0.6454
 epoch: 80, train_loss: 0.1133, test_loss: 1.7138, test_f1: 0.6774
 epoch: 81, train_loss: 0.1508, test_loss: 1.7044, test_f1: 0.6687
 epoch: 82, train_loss: 0.1304, test_loss: 1.9045, test_f1: 0.6611
 epoch: 83, train_loss: 0.1240, test_loss: 1.7126, test_f1: 0.6738
 epoch: 84, train_loss: 0.1194, test_loss: 1.7473, test_f1: 0.6724
 epoch: 85, train_loss: 0.1203, test_loss: 1.9840, test_f1: 0.6446
 epoch: 86, train_loss: 0.1132, test_loss: 2.0645, test_f1: 0.6610
 epoch: 87, train_loss: 0.1222, test_loss: 2.0296, test_f1: 0.6578
 epoch: 88, train_loss: 0.1078, test_loss: 1.7424, test_f1: 0.6710
 epoch: 89, train_loss: 0.1116, test_loss: 1.8165, test_f1: 0.6546
 epoch: 90, train_loss: 0.1185, test_loss: 2.0556, test_f1: 0.6536
 epoch: 91, train_loss: 0.1011, test_loss: 1.9874, test_f1: 0.6402
 epoch: 92, train_loss: 0.0979, test_loss: 1.8306, test_f1: 0.6789
 epoch: 93, train_loss: 0.1122, test_loss: 2.0093, test_f1: 0.6444
 epoch: 94, train_loss: 0.1000, test_loss: 2.0569, test_f1: 0.6858
 epoch: 95, train_loss: 0.0971, test_loss: 2.0368, test_f1: 0.6521
 epoch: 96, train_loss: 0.1085, test_loss: 2.1180, test_f1: 0.6398
 epoch: 97, train_loss: 0.1165, test_loss: 2.1132, test_f1: 0.6504
 epoch: 98, train_loss: 0.1166, test_loss: 1.8904, test_f1: 0.6894
 epoch: 99, train_loss: 0.1143, test_loss: 2.0168, test_f1: 0.6444
##################ITERATION #1 ****************************************
 epoch: 0, train_loss: 1.0986, test_loss: 1.0950, test_f1: 0.3808
 epoch: 1, train_loss: 0.9336, test_loss: 0.9966, test_f1: 0.5109
 epoch: 2, train_loss: 0.8774, test_loss: 0.8960, test_f1: 0.5565
 epoch: 3, train_loss: 0.8305, test_loss: 0.8785, test_f1: 0.5573
 epoch: 4, train_loss: 0.7963, test_loss: 0.9033, test_f1: 0.5535
 epoch: 5, train_loss: 0.7641, test_loss: 0.8549, test_f1: 0.6072
 epoch: 6, train_loss: 0.7456, test_loss: 0.9370, test_f1: 0.5504
 epoch: 7, train_loss: 0.7400, test_loss: 0.9272, test_f1: 0.5669
 epoch: 8, train_loss: 0.7037, test_loss: 0.9260, test_f1: 0.6005
 epoch: 9, train_loss: 0.6966, test_loss: 0.7833, test_f1: 0.6091
 epoch: 10, train_loss: 0.6787, test_loss: 0.9693, test_f1: 0.5797
 epoch: 11, train_loss: 0.6576, test_loss: 0.8572, test_f1: 0.6198
 epoch: 12, train_loss: 0.6444, test_loss: 0.8451, test_f1: 0.6323
 epoch: 13, train_loss: 0.6172, test_loss: 0.9301, test_f1: 0.5945
 epoch: 14, train_loss: 0.6263, test_loss: 0.7907, test_f1: 0.6403
 epoch: 15, train_loss: 0.5936, test_loss: 0.9093, test_f1: 0.6416
 epoch: 16, train_loss: 0.6005, test_loss: 0.8126, test_f1: 0.6451
 epoch: 17, train_loss: 0.5581, test_loss: 1.0022, test_f1: 0.5554
 epoch: 18, train_loss: 0.5411, test_loss: 0.9081, test_f1: 0.6347
 epoch: 19, train_loss: 0.5455, test_loss: 0.9196, test_f1: 0.6259
 epoch: 20, train_loss: 0.5505, test_loss: 0.9008, test_f1: 0.6350
 epoch: 21, train_loss: 0.5168, test_loss: 0.9292, test_f1: 0.6346
 epoch: 22, train_loss: 0.4841, test_loss: 0.8358, test_f1: 0.6627
 epoch: 23, train_loss: 0.4913, test_loss: 0.8828, test_f1: 0.6524
 epoch: 24, train_loss: 0.4789, test_loss: 1.0520, test_f1: 0.6022
 epoch: 25, train_loss: 0.4584, test_loss: 0.9157, test_f1: 0.6415
 epoch: 26, train_loss: 0.4357, test_loss: 1.0069, test_f1: 0.6190
 epoch: 27, train_loss: 0.4245, test_loss: 1.1397, test_f1: 0.6226
 epoch: 28, train_loss: 0.4337, test_loss: 0.9609, test_f1: 0.6337
 epoch: 29, train_loss: 0.4046, test_loss: 0.9449, test_f1: 0.6644
 epoch: 30, train_loss: 0.4101, test_loss: 1.0186, test_f1: 0.6430
 epoch: 31, train_loss: 0.4108, test_loss: 1.1387, test_f1: 0.6123
 epoch: 32, train_loss: 0.3838, test_loss: 1.1739, test_f1: 0.5845
 epoch: 33, train_loss: 0.3917, test_loss: 0.8965, test_f1: 0.6514
 epoch: 34, train_loss: 0.3558, test_loss: 1.2320, test_f1: 0.6268
 epoch: 35, train_loss: 0.3768, test_loss: 1.1675, test_f1: 0.6280
 epoch: 36, train_loss: 0.3504, test_loss: 0.9791, test_f1: 0.6795
 epoch: 37, train_loss: 0.3208, test_loss: 1.0747, test_f1: 0.6840
 epoch: 38, train_loss: 0.3099, test_loss: 1.0754, test_f1: 0.6577
 epoch: 39, train_loss: 0.3148, test_loss: 1.1024, test_f1: 0.6425
 epoch: 40, train_loss: 0.3212, test_loss: 1.3117, test_f1: 0.6330
 epoch: 41, train_loss: 0.3204, test_loss: 1.1497, test_f1: 0.6458
 epoch: 42, train_loss: 0.3235, test_loss: 1.1779, test_f1: 0.6281
 epoch: 43, train_loss: 0.3107, test_loss: 1.2208, test_f1: 0.6504
 epoch: 44, train_loss: 0.2794, test_loss: 1.0925, test_f1: 0.6995
 epoch: 45, train_loss: 0.2778, test_loss: 1.2305, test_f1: 0.6347
 epoch: 46, train_loss: 0.3128, test_loss: 1.1356, test_f1: 0.6351
 epoch: 47, train_loss: 0.2665, test_loss: 1.1262, test_f1: 0.6682
 epoch: 48, train_loss: 0.2488, test_loss: 1.3277, test_f1: 0.6573
 epoch: 49, train_loss: 0.2717, test_loss: 1.2397, test_f1: 0.6586
 epoch: 50, train_loss: 0.2539, test_loss: 1.3401, test_f1: 0.6348
 epoch: 51, train_loss: 0.2320, test_loss: 1.2280, test_f1: 0.6735
 epoch: 52, train_loss: 0.1924, test_loss: 1.2226, test_f1: 0.6811
 epoch: 53, train_loss: 0.1861, test_loss: 1.3124, test_f1: 0.6722
 epoch: 54, train_loss: 0.1965, test_loss: 1.2632, test_f1: 0.7055
 epoch: 55, train_loss: 0.1592, test_loss: 1.3934, test_f1: 0.6814
 epoch: 56, train_loss: 0.1513, test_loss: 1.3463, test_f1: 0.6875
 epoch: 57, train_loss: 0.1614, test_loss: 1.6236, test_f1: 0.6701
 epoch: 58, train_loss: 0.1777, test_loss: 1.5179, test_f1: 0.6677
 epoch: 59, train_loss: 0.1508, test_loss: 1.6303, test_f1: 0.6701
 epoch: 60, train_loss: 0.1496, test_loss: 1.7493, test_f1: 0.6550
 epoch: 61, train_loss: 0.1365, test_loss: 1.5404, test_f1: 0.6744
 epoch: 62, train_loss: 0.1475, test_loss: 1.6335, test_f1: 0.6770
 epoch: 63, train_loss: 0.1490, test_loss: 1.5716, test_f1: 0.6648
 epoch: 64, train_loss: 0.1505, test_loss: 1.6669, test_f1: 0.6524
 epoch: 65, train_loss: 0.1525, test_loss: 1.5788, test_f1: 0.6527
 epoch: 66, train_loss: 0.1576, test_loss: 1.6622, test_f1: 0.6461
 epoch: 67, train_loss: 0.1431, test_loss: 1.8227, test_f1: 0.6615
 epoch: 68, train_loss: 0.1287, test_loss: 1.8424, test_f1: 0.6599
 epoch: 69, train_loss: 0.1329, test_loss: 1.9900, test_f1: 0.6477
 epoch: 70, train_loss: 0.1250, test_loss: 1.7317, test_f1: 0.6624
 epoch: 71, train_loss: 0.1129, test_loss: 2.0575, test_f1: 0.6569
 epoch: 72, train_loss: 0.1408, test_loss: 1.9925, test_f1: 0.6415
 epoch: 73, train_loss: 0.1296, test_loss: 1.9279, test_f1: 0.6652
 epoch: 74, train_loss: 0.1130, test_loss: 1.7748, test_f1: 0.6813
 epoch: 75, train_loss: 0.1198, test_loss: 1.8323, test_f1: 0.6800
 epoch: 76, train_loss: 0.1262, test_loss: 2.1922, test_f1: 0.6420
 epoch: 77, train_loss: 0.1109, test_loss: 1.8675, test_f1: 0.6643
 epoch: 78, train_loss: 0.1233, test_loss: 1.9466, test_f1: 0.6915
 epoch: 79, train_loss: 0.1290, test_loss: 1.9851, test_f1: 0.6724
 epoch: 80, train_loss: 0.1198, test_loss: 1.9099, test_f1: 0.6615
 epoch: 81, train_loss: 0.1265, test_loss: 1.8768, test_f1: 0.6676
 epoch: 82, train_loss: 0.1266, test_loss: 1.9922, test_f1: 0.6672
 epoch: 83, train_loss: 0.1106, test_loss: 2.0176, test_f1: 0.6672
 epoch: 84, train_loss: 0.0976, test_loss: 2.0462, test_f1: 0.6771
 epoch: 85, train_loss: 0.1056, test_loss: 2.1682, test_f1: 0.6709
 epoch: 86, train_loss: 0.1048, test_loss: 2.2390, test_f1: 0.6537
 epoch: 87, train_loss: 0.1117, test_loss: 1.9762, test_f1: 0.6583
 epoch: 88, train_loss: 0.1063, test_loss: 2.0801, test_f1: 0.6812
 epoch: 89, train_loss: 0.0892, test_loss: 2.1278, test_f1: 0.6483
 epoch: 90, train_loss: 0.1111, test_loss: 2.1128, test_f1: 0.6635
 epoch: 91, train_loss: 0.1007, test_loss: 2.2346, test_f1: 0.6883
 epoch: 92, train_loss: 0.1093, test_loss: 2.1537, test_f1: 0.6540
 epoch: 93, train_loss: 0.0979, test_loss: 2.2290, test_f1: 0.6605
 epoch: 94, train_loss: 0.0908, test_loss: 2.1351, test_f1: 0.6680
 epoch: 95, train_loss: 0.0920, test_loss: 2.2470, test_f1: 0.6556
 epoch: 96, train_loss: 0.0971, test_loss: 2.2451, test_f1: 0.6678
 epoch: 97, train_loss: 0.0913, test_loss: 2.2746, test_f1: 0.6254
 epoch: 98, train_loss: 0.0731, test_loss: 2.3097, test_f1: 0.6533
 epoch: 99, train_loss: 0.0961, test_loss: 2.0724, test_f1: 0.6861
##################ITERATION #2 ****************************************
 epoch: 0, train_loss: 1.1301, test_loss: 1.1761, test_f1: 0.3649
 epoch: 1, train_loss: 0.9762, test_loss: 0.9439, test_f1: 0.5026
 epoch: 2, train_loss: 0.9074, test_loss: 0.9183, test_f1: 0.5453
 epoch: 3, train_loss: 0.8825, test_loss: 0.8828, test_f1: 0.5611
 epoch: 4, train_loss: 0.8513, test_loss: 0.9237, test_f1: 0.5733
 epoch: 5, train_loss: 0.8152, test_loss: 0.8875, test_f1: 0.5576
 epoch: 6, train_loss: 0.8100, test_loss: 0.9890, test_f1: 0.5687
 epoch: 7, train_loss: 0.7946, test_loss: 0.9545, test_f1: 0.5458
 epoch: 8, train_loss: 0.7714, test_loss: 0.8669, test_f1: 0.5994
 epoch: 9, train_loss: 0.7404, test_loss: 0.8399, test_f1: 0.6128
 epoch: 10, train_loss: 0.7262, test_loss: 0.8979, test_f1: 0.6093
 epoch: 11, train_loss: 0.7073, test_loss: 0.8748, test_f1: 0.5912
 epoch: 12, train_loss: 0.6968, test_loss: 0.8867, test_f1: 0.5978
 epoch: 13, train_loss: 0.6766, test_loss: 0.9368, test_f1: 0.5766
 epoch: 14, train_loss: 0.6415, test_loss: 0.8830, test_f1: 0.6346
 epoch: 15, train_loss: 0.6475, test_loss: 0.9130, test_f1: 0.6233
 epoch: 16, train_loss: 0.6243, test_loss: 0.8915, test_f1: 0.6080
 epoch: 17, train_loss: 0.6144, test_loss: 0.8297, test_f1: 0.6348
 epoch: 18, train_loss: 0.5746, test_loss: 0.8935, test_f1: 0.6343
 epoch: 19, train_loss: 0.5620, test_loss: 0.8330, test_f1: 0.6219
 epoch: 20, train_loss: 0.5903, test_loss: 0.9512, test_f1: 0.6031
 epoch: 21, train_loss: 0.5520, test_loss: 0.9557, test_f1: 0.6445
 epoch: 22, train_loss: 0.5302, test_loss: 1.0345, test_f1: 0.5849
 epoch: 23, train_loss: 0.5299, test_loss: 0.8563, test_f1: 0.6357
 epoch: 24, train_loss: 0.5210, test_loss: 0.8671, test_f1: 0.6519
 epoch: 25, train_loss: 0.5021, test_loss: 1.0190, test_f1: 0.6294
 epoch: 26, train_loss: 0.4788, test_loss: 0.9607, test_f1: 0.6175
 epoch: 27, train_loss: 0.4672, test_loss: 1.0364, test_f1: 0.6369
 epoch: 28, train_loss: 0.4678, test_loss: 0.9738, test_f1: 0.6385
 epoch: 29, train_loss: 0.4529, test_loss: 1.1920, test_f1: 0.6053
 epoch: 30, train_loss: 0.4310, test_loss: 1.0189, test_f1: 0.6519
 epoch: 31, train_loss: 0.4280, test_loss: 1.1417, test_f1: 0.6461
 epoch: 32, train_loss: 0.4140, test_loss: 1.0367, test_f1: 0.6443
 epoch: 33, train_loss: 0.3937, test_loss: 1.0306, test_f1: 0.6691
 epoch: 34, train_loss: 0.3683, test_loss: 1.1586, test_f1: 0.6406
 epoch: 35, train_loss: 0.3754, test_loss: 1.1298, test_f1: 0.6321
 epoch: 36, train_loss: 0.3676, test_loss: 1.0731, test_f1: 0.6588
 epoch: 37, train_loss: 0.3851, test_loss: 1.0922, test_f1: 0.6640
 epoch: 38, train_loss: 0.3590, test_loss: 1.0612, test_f1: 0.6547
 epoch: 39, train_loss: 0.3303, test_loss: 1.0964, test_f1: 0.6507
 epoch: 40, train_loss: 0.3510, test_loss: 1.2665, test_f1: 0.6286
 epoch: 41, train_loss: 0.3282, test_loss: 1.2572, test_f1: 0.6365
 epoch: 42, train_loss: 0.3353, test_loss: 1.2197, test_f1: 0.6444
 epoch: 43, train_loss: 0.3593, test_loss: 1.2878, test_f1: 0.6387
 epoch: 44, train_loss: 0.3320, test_loss: 1.1902, test_f1: 0.6590
 epoch: 45, train_loss: 0.3079, test_loss: 1.3443, test_f1: 0.6299
 epoch: 46, train_loss: 0.2861, test_loss: 1.3736, test_f1: 0.6316
 epoch: 47, train_loss: 0.2811, test_loss: 1.1187, test_f1: 0.6823
 epoch: 48, train_loss: 0.3054, test_loss: 1.3158, test_f1: 0.6525
 epoch: 49, train_loss: 0.2900, test_loss: 1.2269, test_f1: 0.6384
 epoch: 50, train_loss: 0.2738, test_loss: 1.4235, test_f1: 0.6487
 epoch: 51, train_loss: 0.2344, test_loss: 1.3069, test_f1: 0.6739
 epoch: 52, train_loss: 0.2082, test_loss: 1.3932, test_f1: 0.6623
 epoch: 53, train_loss: 0.1881, test_loss: 1.4221, test_f1: 0.6840
 epoch: 54, train_loss: 0.1894, test_loss: 1.4079, test_f1: 0.6928
 epoch: 55, train_loss: 0.1870, test_loss: 1.4725, test_f1: 0.6632
 epoch: 56, train_loss: 0.1773, test_loss: 1.4867, test_f1: 0.6559
 epoch: 57, train_loss: 0.1843, test_loss: 1.6603, test_f1: 0.6821
 epoch: 58, train_loss: 0.1664, test_loss: 1.5216, test_f1: 0.6888
 epoch: 59, train_loss: 0.1793, test_loss: 1.5185, test_f1: 0.6666
 epoch: 60, train_loss: 0.1835, test_loss: 1.4556, test_f1: 0.6799
 epoch: 61, train_loss: 0.1695, test_loss: 1.5763, test_f1: 0.6710
 epoch: 62, train_loss: 0.1427, test_loss: 1.5498, test_f1: 0.6543
 epoch: 63, train_loss: 0.1628, test_loss: 1.6366, test_f1: 0.6678
 epoch: 64, train_loss: 0.1544, test_loss: 1.7141, test_f1: 0.6481
 epoch: 65, train_loss: 0.1563, test_loss: 1.6101, test_f1: 0.6956
 epoch: 66, train_loss: 0.1435, test_loss: 1.5194, test_f1: 0.7038
 epoch: 67, train_loss: 0.1416, test_loss: 1.6369, test_f1: 0.6783
 epoch: 68, train_loss: 0.1595, test_loss: 1.6683, test_f1: 0.6905
 epoch: 69, train_loss: 0.1519, test_loss: 1.6463, test_f1: 0.6758
 epoch: 70, train_loss: 0.1374, test_loss: 1.6644, test_f1: 0.6704
 epoch: 71, train_loss: 0.1395, test_loss: 1.7269, test_f1: 0.6746
 epoch: 72, train_loss: 0.1409, test_loss: 1.6523, test_f1: 0.7093
 epoch: 73, train_loss: 0.1241, test_loss: 1.7013, test_f1: 0.6777
 epoch: 74, train_loss: 0.1282, test_loss: 1.8072, test_f1: 0.6535
 epoch: 75, train_loss: 0.1521, test_loss: 1.7527, test_f1: 0.6670
 epoch: 76, train_loss: 0.1472, test_loss: 1.8433, test_f1: 0.6590
 epoch: 77, train_loss: 0.1401, test_loss: 1.6143, test_f1: 0.6835
 epoch: 78, train_loss: 0.1348, test_loss: 1.7564, test_f1: 0.6807
 epoch: 79, train_loss: 0.1262, test_loss: 1.7632, test_f1: 0.6530
 epoch: 80, train_loss: 0.1351, test_loss: 1.6178, test_f1: 0.6788
 epoch: 81, train_loss: 0.1264, test_loss: 1.7130, test_f1: 0.6651
 epoch: 82, train_loss: 0.1281, test_loss: 1.8901, test_f1: 0.6779
 epoch: 83, train_loss: 0.1375, test_loss: 1.7721, test_f1: 0.6796
 epoch: 84, train_loss: 0.1220, test_loss: 1.8013, test_f1: 0.6745
 epoch: 85, train_loss: 0.1178, test_loss: 1.7968, test_f1: 0.6593
 epoch: 86, train_loss: 0.1182, test_loss: 1.9387, test_f1: 0.6571
 epoch: 87, train_loss: 0.1204, test_loss: 1.9100, test_f1: 0.6223
 epoch: 88, train_loss: 0.1218, test_loss: 1.7255, test_f1: 0.6971
 epoch: 89, train_loss: 0.1204, test_loss: 1.8705, test_f1: 0.6669
 epoch: 90, train_loss: 0.1186, test_loss: 2.0484, test_f1: 0.6387
 epoch: 91, train_loss: 0.1019, test_loss: 1.8487, test_f1: 0.6864
 epoch: 92, train_loss: 0.1089, test_loss: 2.0342, test_f1: 0.6394
 epoch: 93, train_loss: 0.1163, test_loss: 1.7600, test_f1: 0.6501
 epoch: 94, train_loss: 0.1093, test_loss: 1.8017, test_f1: 0.6940
 epoch: 95, train_loss: 0.1062, test_loss: 2.0726, test_f1: 0.6493
 epoch: 96, train_loss: 0.1326, test_loss: 1.9531, test_f1: 0.6629
 epoch: 97, train_loss: 0.1159, test_loss: 1.9507, test_f1: 0.6651
 epoch: 98, train_loss: 0.1193, test_loss: 1.9897, test_f1: 0.6353
 epoch: 99, train_loss: 0.1255, test_loss: 1.9113, test_f1: 0.6931
##################ITERATION #3 ****************************************
 epoch: 0, train_loss: 1.1907, test_loss: 1.3525, test_f1: 0.2556
 epoch: 1, train_loss: 0.9859, test_loss: 1.0437, test_f1: 0.4308
 epoch: 2, train_loss: 0.9192, test_loss: 0.9857, test_f1: 0.5390
 epoch: 3, train_loss: 0.8873, test_loss: 0.9486, test_f1: 0.5336
 epoch: 4, train_loss: 0.8542, test_loss: 0.9262, test_f1: 0.5420
 epoch: 5, train_loss: 0.8157, test_loss: 0.9627, test_f1: 0.5277
 epoch: 6, train_loss: 0.8162, test_loss: 0.8731, test_f1: 0.5573
 epoch: 7, train_loss: 0.7852, test_loss: 0.9043, test_f1: 0.5638
 epoch: 8, train_loss: 0.7583, test_loss: 0.8335, test_f1: 0.6182
 epoch: 9, train_loss: 0.7371, test_loss: 0.9303, test_f1: 0.5424
 epoch: 10, train_loss: 0.7353, test_loss: 0.8724, test_f1: 0.5895
 epoch: 11, train_loss: 0.7053, test_loss: 0.8484, test_f1: 0.6175
 epoch: 12, train_loss: 0.6882, test_loss: 0.8743, test_f1: 0.6098
 epoch: 13, train_loss: 0.6715, test_loss: 0.9112, test_f1: 0.6040
 epoch: 14, train_loss: 0.6686, test_loss: 0.8159, test_f1: 0.6188
 epoch: 15, train_loss: 0.6359, test_loss: 0.8839, test_f1: 0.6185
 epoch: 16, train_loss: 0.6341, test_loss: 0.8510, test_f1: 0.6129
 epoch: 17, train_loss: 0.6237, test_loss: 0.8487, test_f1: 0.6510
 epoch: 18, train_loss: 0.6001, test_loss: 0.8977, test_f1: 0.6278
 epoch: 19, train_loss: 0.5774, test_loss: 0.8775, test_f1: 0.6116
 epoch: 20, train_loss: 0.5704, test_loss: 0.8958, test_f1: 0.6263
 epoch: 21, train_loss: 0.5564, test_loss: 0.9683, test_f1: 0.5841
 epoch: 22, train_loss: 0.5595, test_loss: 0.8905, test_f1: 0.6460
 epoch: 23, train_loss: 0.5432, test_loss: 0.9900, test_f1: 0.6158
 epoch: 24, train_loss: 0.5353, test_loss: 0.8727, test_f1: 0.6453
 epoch: 25, train_loss: 0.4957, test_loss: 0.8734, test_f1: 0.6267
 epoch: 26, train_loss: 0.4945, test_loss: 0.8576, test_f1: 0.6598
 epoch: 27, train_loss: 0.4849, test_loss: 0.8463, test_f1: 0.6718
 epoch: 28, train_loss: 0.4428, test_loss: 0.8971, test_f1: 0.6424
 epoch: 29, train_loss: 0.4488, test_loss: 0.8685, test_f1: 0.6803
 epoch: 30, train_loss: 0.4515, test_loss: 0.9787, test_f1: 0.6538
 epoch: 31, train_loss: 0.4388, test_loss: 1.0137, test_f1: 0.5865
 epoch: 32, train_loss: 0.4322, test_loss: 1.3316, test_f1: 0.5780
 epoch: 33, train_loss: 0.4382, test_loss: 0.9182, test_f1: 0.6750
 epoch: 34, train_loss: 0.4146, test_loss: 0.9631, test_f1: 0.6569
 epoch: 35, train_loss: 0.4030, test_loss: 1.0256, test_f1: 0.6301
 epoch: 36, train_loss: 0.4052, test_loss: 0.9433, test_f1: 0.6118
 epoch: 37, train_loss: 0.3922, test_loss: 0.9148, test_f1: 0.6342
 epoch: 38, train_loss: 0.3606, test_loss: 1.1024, test_f1: 0.6314
 epoch: 39, train_loss: 0.3811, test_loss: 1.0861, test_f1: 0.6432
 epoch: 40, train_loss: 0.4000, test_loss: 1.0787, test_f1: 0.6333
 epoch: 41, train_loss: 0.3658, test_loss: 1.0533, test_f1: 0.6592
 epoch: 42, train_loss: 0.3613, test_loss: 0.9907, test_f1: 0.6718
 epoch: 43, train_loss: 0.3298, test_loss: 1.0751, test_f1: 0.6468
 epoch: 44, train_loss: 0.3217, test_loss: 1.3655, test_f1: 0.6014
 epoch: 45, train_loss: 0.3321, test_loss: 1.0712, test_f1: 0.6607
 epoch: 46, train_loss: 0.3361, test_loss: 1.1288, test_f1: 0.6577
 epoch: 47, train_loss: 0.3334, test_loss: 1.3110, test_f1: 0.6294
 epoch: 48, train_loss: 0.3076, test_loss: 1.1390, test_f1: 0.6380
 epoch: 49, train_loss: 0.2943, test_loss: 1.0545, test_f1: 0.6405
 epoch: 50, train_loss: 0.2771, test_loss: 1.3421, test_f1: 0.6333
 epoch: 51, train_loss: 0.2415, test_loss: 1.2139, test_f1: 0.6506
 epoch: 52, train_loss: 0.2180, test_loss: 1.1479, test_f1: 0.6323
 epoch: 53, train_loss: 0.2125, test_loss: 1.2799, test_f1: 0.6202
 epoch: 54, train_loss: 0.2147, test_loss: 1.2527, test_f1: 0.6590
 epoch: 55, train_loss: 0.2135, test_loss: 1.3127, test_f1: 0.6521
 epoch: 56, train_loss: 0.1860, test_loss: 1.2964, test_f1: 0.6414
 epoch: 57, train_loss: 0.1993, test_loss: 1.4184, test_f1: 0.6477
 epoch: 58, train_loss: 0.1879, test_loss: 1.3135, test_f1: 0.6425
 epoch: 59, train_loss: 0.1871, test_loss: 1.4150, test_f1: 0.6316
 epoch: 60, train_loss: 0.1945, test_loss: 1.3791, test_f1: 0.6364
 epoch: 61, train_loss: 0.1708, test_loss: 1.4401, test_f1: 0.6198
 epoch: 62, train_loss: 0.1769, test_loss: 1.3336, test_f1: 0.6489
 epoch: 63, train_loss: 0.1740, test_loss: 1.5605, test_f1: 0.6175
 epoch: 64, train_loss: 0.1727, test_loss: 1.5051, test_f1: 0.6338
 epoch: 65, train_loss: 0.1571, test_loss: 1.4217, test_f1: 0.6483
 epoch: 66, train_loss: 0.1710, test_loss: 1.5438, test_f1: 0.6200
 epoch: 67, train_loss: 0.1662, test_loss: 1.5633, test_f1: 0.6199
 epoch: 68, train_loss: 0.1572, test_loss: 1.5714, test_f1: 0.6424
 epoch: 69, train_loss: 0.1462, test_loss: 1.5461, test_f1: 0.6660
 epoch: 70, train_loss: 0.1428, test_loss: 1.4689, test_f1: 0.6768
 epoch: 71, train_loss: 0.1462, test_loss: 1.6095, test_f1: 0.6160
 epoch: 72, train_loss: 0.1359, test_loss: 1.7366, test_f1: 0.6455
 epoch: 73, train_loss: 0.1616, test_loss: 1.6917, test_f1: 0.6036
 epoch: 74, train_loss: 0.1496, test_loss: 1.7080, test_f1: 0.6330
 epoch: 75, train_loss: 0.1490, test_loss: 1.6408, test_f1: 0.6442
 epoch: 76, train_loss: 0.1608, test_loss: 1.6667, test_f1: 0.6128
 epoch: 77, train_loss: 0.1663, test_loss: 1.6769, test_f1: 0.6431
 epoch: 78, train_loss: 0.1490, test_loss: 1.5818, test_f1: 0.6277
 epoch: 79, train_loss: 0.1459, test_loss: 1.6899, test_f1: 0.6405
 epoch: 80, train_loss: 0.1557, test_loss: 1.6347, test_f1: 0.6308
 epoch: 81, train_loss: 0.1637, test_loss: 1.6621, test_f1: 0.6164
 epoch: 82, train_loss: 0.1416, test_loss: 1.5989, test_f1: 0.6635
 epoch: 83, train_loss: 0.1545, test_loss: 1.7040, test_f1: 0.6311
 epoch: 84, train_loss: 0.1501, test_loss: 1.7647, test_f1: 0.6367
 epoch: 85, train_loss: 0.1314, test_loss: 1.7073, test_f1: 0.6109
 epoch: 86, train_loss: 0.1545, test_loss: 2.2320, test_f1: 0.5936
 epoch: 87, train_loss: 0.1426, test_loss: 1.5782, test_f1: 0.6514
 epoch: 88, train_loss: 0.1271, test_loss: 1.7718, test_f1: 0.6232
 epoch: 89, train_loss: 0.1299, test_loss: 1.7887, test_f1: 0.6107
 epoch: 90, train_loss: 0.1285, test_loss: 1.8880, test_f1: 0.6089
 epoch: 91, train_loss: 0.1192, test_loss: 1.8480, test_f1: 0.6037
 epoch: 92, train_loss: 0.1093, test_loss: 2.0564, test_f1: 0.5992
 epoch: 93, train_loss: 0.1056, test_loss: 1.7841, test_f1: 0.6588
 epoch: 94, train_loss: 0.1156, test_loss: 1.8482, test_f1: 0.6538
 epoch: 95, train_loss: 0.1155, test_loss: 1.8710, test_f1: 0.6330
 epoch: 96, train_loss: 0.1214, test_loss: 1.8570, test_f1: 0.6385
 epoch: 97, train_loss: 0.1264, test_loss: 1.9381, test_f1: 0.6383
 epoch: 98, train_loss: 0.1260, test_loss: 1.8096, test_f1: 0.6436
 epoch: 99, train_loss: 0.1377, test_loss: 2.2243, test_f1: 0.6171
##################ITERATION #4 ****************************************
 epoch: 0, train_loss: 1.2997, test_loss: 1.2986, test_f1: 0.2361
 epoch: 1, train_loss: 0.9997, test_loss: 0.9694, test_f1: 0.5100
 epoch: 2, train_loss: 0.9324, test_loss: 0.9140, test_f1: 0.5731
 epoch: 3, train_loss: 0.8812, test_loss: 0.9378, test_f1: 0.5760
 epoch: 4, train_loss: 0.8647, test_loss: 1.0340, test_f1: 0.5448
 epoch: 5, train_loss: 0.8207, test_loss: 1.0031, test_f1: 0.5477
 epoch: 6, train_loss: 0.7965, test_loss: 0.8851, test_f1: 0.6143
 epoch: 7, train_loss: 0.7733, test_loss: 0.7990, test_f1: 0.6440
 epoch: 8, train_loss: 0.7647, test_loss: 0.8265, test_f1: 0.6197
 epoch: 9, train_loss: 0.7599, test_loss: 0.9021, test_f1: 0.6294
 epoch: 10, train_loss: 0.7290, test_loss: 0.8909, test_f1: 0.5705
 epoch: 11, train_loss: 0.6992, test_loss: 0.8751, test_f1: 0.5992
 epoch: 12, train_loss: 0.6924, test_loss: 0.7773, test_f1: 0.6340
 epoch: 13, train_loss: 0.6749, test_loss: 0.7749, test_f1: 0.6604
 epoch: 14, train_loss: 0.6456, test_loss: 0.8802, test_f1: 0.6297
 epoch: 15, train_loss: 0.6494, test_loss: 0.8121, test_f1: 0.6256
 epoch: 16, train_loss: 0.6418, test_loss: 0.8270, test_f1: 0.6421
 epoch: 17, train_loss: 0.6248, test_loss: 0.8515, test_f1: 0.6358
 epoch: 18, train_loss: 0.6302, test_loss: 0.9366, test_f1: 0.6132
 epoch: 19, train_loss: 0.5911, test_loss: 0.8752, test_f1: 0.6367
 epoch: 20, train_loss: 0.5759, test_loss: 0.7989, test_f1: 0.6534
 epoch: 21, train_loss: 0.5700, test_loss: 1.0147, test_f1: 0.6075
 epoch: 22, train_loss: 0.5435, test_loss: 0.9081, test_f1: 0.6472
 epoch: 23, train_loss: 0.5442, test_loss: 0.8098, test_f1: 0.6469
 epoch: 24, train_loss: 0.5403, test_loss: 0.8269, test_f1: 0.6430
 epoch: 25, train_loss: 0.5271, test_loss: 0.9298, test_f1: 0.6248
 epoch: 26, train_loss: 0.5005, test_loss: 1.0292, test_f1: 0.6408
 epoch: 27, train_loss: 0.5282, test_loss: 0.7902, test_f1: 0.6591
 epoch: 28, train_loss: 0.4825, test_loss: 0.9734, test_f1: 0.6104
 epoch: 29, train_loss: 0.4604, test_loss: 1.0374, test_f1: 0.6394
 epoch: 30, train_loss: 0.4653, test_loss: 0.8749, test_f1: 0.6682
 epoch: 31, train_loss: 0.4678, test_loss: 1.0730, test_f1: 0.6237
 epoch: 32, train_loss: 0.4314, test_loss: 0.9831, test_f1: 0.6690
 epoch: 33, train_loss: 0.4482, test_loss: 0.9482, test_f1: 0.6533
 epoch: 34, train_loss: 0.4326, test_loss: 0.9539, test_f1: 0.6503
 epoch: 35, train_loss: 0.4317, test_loss: 1.1461, test_f1: 0.6041
 epoch: 36, train_loss: 0.4244, test_loss: 1.0650, test_f1: 0.6283
 epoch: 37, train_loss: 0.3990, test_loss: 1.1484, test_f1: 0.6379
 epoch: 38, train_loss: 0.3902, test_loss: 0.9472, test_f1: 0.6663
 epoch: 39, train_loss: 0.3772, test_loss: 0.9696, test_f1: 0.6504
 epoch: 40, train_loss: 0.3612, test_loss: 1.1349, test_f1: 0.6328
 epoch: 41, train_loss: 0.3904, test_loss: 1.4351, test_f1: 0.5809
 epoch: 42, train_loss: 0.3845, test_loss: 1.1449, test_f1: 0.6426
 epoch: 43, train_loss: 0.3651, test_loss: 1.2122, test_f1: 0.6107
 epoch: 44, train_loss: 0.3716, test_loss: 1.1574, test_f1: 0.6424
 epoch: 45, train_loss: 0.3313, test_loss: 1.0212, test_f1: 0.6603
 epoch: 46, train_loss: 0.3228, test_loss: 1.3420, test_f1: 0.6095
 epoch: 47, train_loss: 0.3213, test_loss: 1.5147, test_f1: 0.5833
 epoch: 48, train_loss: 0.3410, test_loss: 1.2884, test_f1: 0.6486
 epoch: 49, train_loss: 0.3151, test_loss: 1.2708, test_f1: 0.6436
 epoch: 50, train_loss: 0.3336, test_loss: 1.3550, test_f1: 0.6140
 epoch: 51, train_loss: 0.2883, test_loss: 1.0531, test_f1: 0.6668
 epoch: 52, train_loss: 0.2305, test_loss: 1.1239, test_f1: 0.6792
 epoch: 53, train_loss: 0.2301, test_loss: 1.2428, test_f1: 0.6550
 epoch: 54, train_loss: 0.2148, test_loss: 1.2358, test_f1: 0.6645
 epoch: 55, train_loss: 0.2202, test_loss: 1.2516, test_f1: 0.6671
 epoch: 56, train_loss: 0.2112, test_loss: 1.3261, test_f1: 0.6424
 epoch: 57, train_loss: 0.2038, test_loss: 1.2443, test_f1: 0.6428
 epoch: 58, train_loss: 0.2219, test_loss: 1.4392, test_f1: 0.6210
 epoch: 59, train_loss: 0.1947, test_loss: 1.2851, test_f1: 0.6451
 epoch: 60, train_loss: 0.1946, test_loss: 1.2808, test_f1: 0.6541
 epoch: 61, train_loss: 0.1962, test_loss: 1.3715, test_f1: 0.6492
 epoch: 62, train_loss: 0.1887, test_loss: 1.4619, test_f1: 0.6552
 epoch: 63, train_loss: 0.1936, test_loss: 1.4482, test_f1: 0.6395
 epoch: 64, train_loss: 0.1867, test_loss: 1.5467, test_f1: 0.6082
 epoch: 65, train_loss: 0.1990, test_loss: 1.4252, test_f1: 0.6449
 epoch: 66, train_loss: 0.1696, test_loss: 1.7588, test_f1: 0.6059
 epoch: 67, train_loss: 0.1878, test_loss: 1.5961, test_f1: 0.6284
 epoch: 68, train_loss: 0.1859, test_loss: 1.5074, test_f1: 0.6305
 epoch: 69, train_loss: 0.1687, test_loss: 1.5093, test_f1: 0.6243
 epoch: 70, train_loss: 0.1673, test_loss: 1.5467, test_f1: 0.6465
 epoch: 71, train_loss: 0.1732, test_loss: 1.3828, test_f1: 0.6719
 epoch: 72, train_loss: 0.1690, test_loss: 2.0022, test_f1: 0.6275
 epoch: 73, train_loss: 0.1598, test_loss: 1.5625, test_f1: 0.6559
 epoch: 74, train_loss: 0.1635, test_loss: 1.6757, test_f1: 0.6247
 epoch: 75, train_loss: 0.1583, test_loss: 1.6853, test_f1: 0.6170
 epoch: 76, train_loss: 0.1584, test_loss: 1.6575, test_f1: 0.6504
 epoch: 77, train_loss: 0.1563, test_loss: 1.6228, test_f1: 0.6217
 epoch: 78, train_loss: 0.1536, test_loss: 1.5378, test_f1: 0.6377
 epoch: 79, train_loss: 0.1594, test_loss: 1.8090, test_f1: 0.6366
 epoch: 80, train_loss: 0.1516, test_loss: 1.7060, test_f1: 0.6277
 epoch: 81, train_loss: 0.1317, test_loss: 1.6048, test_f1: 0.6694
 epoch: 82, train_loss: 0.1447, test_loss: 1.6644, test_f1: 0.6189
 epoch: 83, train_loss: 0.1518, test_loss: 1.6095, test_f1: 0.6444
 epoch: 84, train_loss: 0.1486, test_loss: 1.6287, test_f1: 0.6392
 epoch: 85, train_loss: 0.1411, test_loss: 1.7046, test_f1: 0.6476
 epoch: 86, train_loss: 0.1599, test_loss: 1.5914, test_f1: 0.6265
 epoch: 87, train_loss: 0.1452, test_loss: 1.9128, test_f1: 0.6288
 epoch: 88, train_loss: 0.1375, test_loss: 1.7729, test_f1: 0.6328
 epoch: 89, train_loss: 0.1363, test_loss: 1.8456, test_f1: 0.6177
 epoch: 90, train_loss: 0.1341, test_loss: 1.6956, test_f1: 0.6353
 epoch: 91, train_loss: 0.1225, test_loss: 1.7296, test_f1: 0.6429
 epoch: 92, train_loss: 0.1310, test_loss: 1.7563, test_f1: 0.6238
 epoch: 93, train_loss: 0.1223, test_loss: 1.8757, test_f1: 0.6225
 epoch: 94, train_loss: 0.1212, test_loss: 1.8882, test_f1: 0.6377
 epoch: 95, train_loss: 0.1264, test_loss: 1.8884, test_f1: 0.6147
 epoch: 96, train_loss: 0.1277, test_loss: 1.8250, test_f1: 0.6487
 epoch: 97, train_loss: 0.1200, test_loss: 1.9616, test_f1: 0.6141
 epoch: 98, train_loss: 0.1299, test_loss: 1.7417, test_f1: 0.6628
 epoch: 99, train_loss: 0.1337, test_loss: 1.9093, test_f1: 0.6148
##################ITERATION #5 ****************************************
 epoch: 0, train_loss: 1.4024, test_loss: 1.2931, test_f1: 0.2946
 epoch: 1, train_loss: 1.0124, test_loss: 0.9854, test_f1: 0.5212
 epoch: 2, train_loss: 0.9488, test_loss: 1.0274, test_f1: 0.5702
 epoch: 3, train_loss: 0.9205, test_loss: 0.9860, test_f1: 0.5938
 epoch: 4, train_loss: 0.8919, test_loss: 0.9918, test_f1: 0.5621
 epoch: 5, train_loss: 0.8689, test_loss: 0.9444, test_f1: 0.6001
 epoch: 6, train_loss: 0.8303, test_loss: 0.9702, test_f1: 0.5789
 epoch: 7, train_loss: 0.8078, test_loss: 0.9154, test_f1: 0.5799
 epoch: 8, train_loss: 0.7861, test_loss: 0.9625, test_f1: 0.6190
 epoch: 9, train_loss: 0.7770, test_loss: 0.9547, test_f1: 0.5986
 epoch: 10, train_loss: 0.7534, test_loss: 0.9802, test_f1: 0.6050
 epoch: 11, train_loss: 0.7417, test_loss: 0.9628, test_f1: 0.6162
 epoch: 12, train_loss: 0.7125, test_loss: 0.9087, test_f1: 0.6260
 epoch: 13, train_loss: 0.6962, test_loss: 0.9134, test_f1: 0.6243
 epoch: 14, train_loss: 0.6675, test_loss: 0.8854, test_f1: 0.6398
 epoch: 15, train_loss: 0.6778, test_loss: 0.8860, test_f1: 0.6447
 epoch: 16, train_loss: 0.6392, test_loss: 0.9421, test_f1: 0.6279
 epoch: 17, train_loss: 0.6205, test_loss: 0.9215, test_f1: 0.6569
 epoch: 18, train_loss: 0.6172, test_loss: 1.0740, test_f1: 0.6269
 epoch: 19, train_loss: 0.6135, test_loss: 0.9882, test_f1: 0.6161
 epoch: 20, train_loss: 0.6050, test_loss: 0.9307, test_f1: 0.6431
 epoch: 21, train_loss: 0.5953, test_loss: 0.9433, test_f1: 0.6300
 epoch: 22, train_loss: 0.5555, test_loss: 1.0351, test_f1: 0.6201
 epoch: 23, train_loss: 0.5478, test_loss: 0.9867, test_f1: 0.6552
 epoch: 24, train_loss: 0.5528, test_loss: 1.0712, test_f1: 0.6243
 epoch: 25, train_loss: 0.5278, test_loss: 0.8709, test_f1: 0.6593
 epoch: 26, train_loss: 0.4929, test_loss: 0.9714, test_f1: 0.6640
 epoch: 27, train_loss: 0.4904, test_loss: 1.0044, test_f1: 0.6455
 epoch: 28, train_loss: 0.4886, test_loss: 0.9895, test_f1: 0.6752
 epoch: 29, train_loss: 0.4792, test_loss: 1.0526, test_f1: 0.6608
 epoch: 30, train_loss: 0.4929, test_loss: 1.0483, test_f1: 0.6689
 epoch: 31, train_loss: 0.4521, test_loss: 0.9459, test_f1: 0.6602
 epoch: 32, train_loss: 0.4373, test_loss: 1.0111, test_f1: 0.6629
 epoch: 33, train_loss: 0.4343, test_loss: 0.9668, test_f1: 0.6536
 epoch: 34, train_loss: 0.4123, test_loss: 1.1108, test_f1: 0.6345
 epoch: 35, train_loss: 0.4161, test_loss: 1.0941, test_f1: 0.6533
 epoch: 36, train_loss: 0.4292, test_loss: 1.0804, test_f1: 0.6689
 epoch: 37, train_loss: 0.4082, test_loss: 0.9610, test_f1: 0.6604
 epoch: 38, train_loss: 0.3867, test_loss: 1.0166, test_f1: 0.6601
 epoch: 39, train_loss: 0.4324, test_loss: 1.0742, test_f1: 0.6568
 epoch: 40, train_loss: 0.3730, test_loss: 1.1272, test_f1: 0.6458
 epoch: 41, train_loss: 0.3647, test_loss: 1.0651, test_f1: 0.6532
 epoch: 42, train_loss: 0.3636, test_loss: 1.0933, test_f1: 0.6752
 epoch: 43, train_loss: 0.3388, test_loss: 1.1323, test_f1: 0.6565
 epoch: 44, train_loss: 0.3568, test_loss: 1.1375, test_f1: 0.6576
 epoch: 45, train_loss: 0.3706, test_loss: 1.0784, test_f1: 0.6584
 epoch: 46, train_loss: 0.3187, test_loss: 1.2549, test_f1: 0.6285
 epoch: 47, train_loss: 0.3161, test_loss: 1.1678, test_f1: 0.6688
 epoch: 48, train_loss: 0.3021, test_loss: 1.1014, test_f1: 0.6725
 epoch: 49, train_loss: 0.3134, test_loss: 1.3282, test_f1: 0.6361
 epoch: 50, train_loss: 0.3083, test_loss: 1.3008, test_f1: 0.6621
 epoch: 51, train_loss: 0.2531, test_loss: 1.2555, test_f1: 0.6638
 epoch: 52, train_loss: 0.2449, test_loss: 1.2731, test_f1: 0.6741
 epoch: 53, train_loss: 0.2203, test_loss: 1.4003, test_f1: 0.6760
 epoch: 54, train_loss: 0.2209, test_loss: 1.3393, test_f1: 0.6689
 epoch: 55, train_loss: 0.2098, test_loss: 1.3997, test_f1: 0.6520
 epoch: 56, train_loss: 0.2090, test_loss: 1.4158, test_f1: 0.6479
 epoch: 57, train_loss: 0.1985, test_loss: 1.3836, test_f1: 0.6551
 epoch: 58, train_loss: 0.1972, test_loss: 1.3818, test_f1: 0.6698
 epoch: 59, train_loss: 0.2096, test_loss: 1.3954, test_f1: 0.6806
 epoch: 60, train_loss: 0.2070, test_loss: 1.4494, test_f1: 0.6703
 epoch: 61, train_loss: 0.1923, test_loss: 1.3702, test_f1: 0.6803
 epoch: 62, train_loss: 0.1946, test_loss: 1.4029, test_f1: 0.6854
 epoch: 63, train_loss: 0.1885, test_loss: 1.4740, test_f1: 0.6401
 epoch: 64, train_loss: 0.1826, test_loss: 1.3906, test_f1: 0.6731
 epoch: 65, train_loss: 0.1675, test_loss: 1.5107, test_f1: 0.6682
 epoch: 66, train_loss: 0.1719, test_loss: 1.4891, test_f1: 0.6623
 epoch: 67, train_loss: 0.1751, test_loss: 1.5146, test_f1: 0.6725
 epoch: 68, train_loss: 0.1897, test_loss: 1.4908, test_f1: 0.6811
 epoch: 69, train_loss: 0.1955, test_loss: 1.4576, test_f1: 0.6843
 epoch: 70, train_loss: 0.1715, test_loss: 1.5233, test_f1: 0.6841
 epoch: 71, train_loss: 0.1504, test_loss: 1.5811, test_f1: 0.6812
 epoch: 72, train_loss: 0.1628, test_loss: 1.7190, test_f1: 0.6443
 epoch: 73, train_loss: 0.1487, test_loss: 1.6149, test_f1: 0.6668
 epoch: 74, train_loss: 0.1556, test_loss: 1.6380, test_f1: 0.6439
 epoch: 75, train_loss: 0.1441, test_loss: 1.6695, test_f1: 0.6456
 epoch: 76, train_loss: 0.1605, test_loss: 1.6607, test_f1: 0.6705
 epoch: 77, train_loss: 0.1767, test_loss: 1.6682, test_f1: 0.6432
 epoch: 78, train_loss: 0.1719, test_loss: 1.6827, test_f1: 0.6632
 epoch: 79, train_loss: 0.1598, test_loss: 1.6816, test_f1: 0.6810
 epoch: 80, train_loss: 0.1495, test_loss: 1.6401, test_f1: 0.6586
 epoch: 81, train_loss: 0.1421, test_loss: 1.6557, test_f1: 0.6494
 epoch: 82, train_loss: 0.1223, test_loss: 1.7411, test_f1: 0.6600
 epoch: 83, train_loss: 0.1289, test_loss: 1.6807, test_f1: 0.6597
 epoch: 84, train_loss: 0.1332, test_loss: 1.7427, test_f1: 0.6668
 epoch: 85, train_loss: 0.1425, test_loss: 1.8141, test_f1: 0.6732
 epoch: 86, train_loss: 0.1393, test_loss: 1.7019, test_f1: 0.6491
 epoch: 87, train_loss: 0.1413, test_loss: 1.7614, test_f1: 0.6559
 epoch: 88, train_loss: 0.1408, test_loss: 1.8614, test_f1: 0.6949
 epoch: 89, train_loss: 0.1315, test_loss: 1.7150, test_f1: 0.6716
 epoch: 90, train_loss: 0.1205, test_loss: 1.7929, test_f1: 0.6439
 epoch: 91, train_loss: 0.1379, test_loss: 1.7317, test_f1: 0.6738
 epoch: 92, train_loss: 0.1377, test_loss: 1.8725, test_f1: 0.6570
 epoch: 93, train_loss: 0.1326, test_loss: 1.8996, test_f1: 0.6541
 epoch: 94, train_loss: 0.1201, test_loss: 1.8112, test_f1: 0.6684
 epoch: 95, train_loss: 0.1193, test_loss: 1.9761, test_f1: 0.6685
 epoch: 96, train_loss: 0.1366, test_loss: 1.8577, test_f1: 0.6512
 epoch: 97, train_loss: 0.1146, test_loss: 1.9124, test_f1: 0.6588
 epoch: 98, train_loss: 0.1073, test_loss: 2.0008, test_f1: 0.6796
 epoch: 99, train_loss: 0.1170, test_loss: 2.0122, test_f1: 0.6373
##################ITERATION #6 ****************************************
 epoch: 0, train_loss: 1.3945, test_loss: 1.3582, test_f1: 0.3020
 epoch: 1, train_loss: 1.0204, test_loss: 1.0300, test_f1: 0.4114
 epoch: 2, train_loss: 0.9434, test_loss: 1.0488, test_f1: 0.4831
 epoch: 3, train_loss: 0.9149, test_loss: 1.0143, test_f1: 0.5330
 epoch: 4, train_loss: 0.8890, test_loss: 0.9842, test_f1: 0.5844
 epoch: 5, train_loss: 0.8520, test_loss: 0.9727, test_f1: 0.5651
 epoch: 6, train_loss: 0.8231, test_loss: 0.9397, test_f1: 0.5588
 epoch: 7, train_loss: 0.8103, test_loss: 0.9418, test_f1: 0.5808
 epoch: 8, train_loss: 0.7894, test_loss: 0.9844, test_f1: 0.5960
 epoch: 9, train_loss: 0.7642, test_loss: 0.9802, test_f1: 0.5677
 epoch: 10, train_loss: 0.7354, test_loss: 0.9031, test_f1: 0.5806
 epoch: 11, train_loss: 0.7174, test_loss: 0.8535, test_f1: 0.6235
 epoch: 12, train_loss: 0.6970, test_loss: 0.9496, test_f1: 0.5847
 epoch: 13, train_loss: 0.6919, test_loss: 0.8816, test_f1: 0.6154
 epoch: 14, train_loss: 0.6840, test_loss: 0.9360, test_f1: 0.5980
 epoch: 15, train_loss: 0.6640, test_loss: 0.9661, test_f1: 0.6020
 epoch: 16, train_loss: 0.6294, test_loss: 0.9191, test_f1: 0.6453
 epoch: 17, train_loss: 0.6409, test_loss: 0.9961, test_f1: 0.6080
 epoch: 18, train_loss: 0.6393, test_loss: 0.9218, test_f1: 0.6208
 epoch: 19, train_loss: 0.5988, test_loss: 0.9885, test_f1: 0.5996
 epoch: 20, train_loss: 0.5944, test_loss: 1.0640, test_f1: 0.5960
 epoch: 21, train_loss: 0.5848, test_loss: 0.9468, test_f1: 0.5939
 epoch: 22, train_loss: 0.5472, test_loss: 0.9660, test_f1: 0.6664
 epoch: 23, train_loss: 0.5388, test_loss: 1.0000, test_f1: 0.6180
 epoch: 24, train_loss: 0.5564, test_loss: 0.9288, test_f1: 0.6347
 epoch: 25, train_loss: 0.5365, test_loss: 1.0250, test_f1: 0.6125
 epoch: 26, train_loss: 0.5122, test_loss: 0.9739, test_f1: 0.6383
 epoch: 27, train_loss: 0.5102, test_loss: 0.9619, test_f1: 0.6376
 epoch: 28, train_loss: 0.4988, test_loss: 1.0420, test_f1: 0.6506
 epoch: 29, train_loss: 0.5114, test_loss: 0.9382, test_f1: 0.6172
 epoch: 30, train_loss: 0.4992, test_loss: 0.9866, test_f1: 0.6403
 epoch: 31, train_loss: 0.4846, test_loss: 0.9451, test_f1: 0.6295
 epoch: 32, train_loss: 0.4825, test_loss: 0.9998, test_f1: 0.6276
 epoch: 33, train_loss: 0.4758, test_loss: 0.9764, test_f1: 0.6180
 epoch: 34, train_loss: 0.4674, test_loss: 0.9996, test_f1: 0.6363
 epoch: 35, train_loss: 0.4440, test_loss: 0.9677, test_f1: 0.6433
 epoch: 36, train_loss: 0.4149, test_loss: 1.0949, test_f1: 0.6226
 epoch: 37, train_loss: 0.4097, test_loss: 0.9597, test_f1: 0.6599
 epoch: 38, train_loss: 0.4222, test_loss: 1.0332, test_f1: 0.6384
 epoch: 39, train_loss: 0.3845, test_loss: 1.0328, test_f1: 0.6114
 epoch: 40, train_loss: 0.4026, test_loss: 0.8655, test_f1: 0.6639
 epoch: 41, train_loss: 0.4201, test_loss: 0.9101, test_f1: 0.6384
 epoch: 42, train_loss: 0.3853, test_loss: 1.0215, test_f1: 0.6483
 epoch: 43, train_loss: 0.3828, test_loss: 1.0110, test_f1: 0.6555
 epoch: 44, train_loss: 0.3679, test_loss: 1.1404, test_f1: 0.6445
 epoch: 45, train_loss: 0.3623, test_loss: 1.0166, test_f1: 0.6370
 epoch: 46, train_loss: 0.3648, test_loss: 1.0813, test_f1: 0.6336
 epoch: 47, train_loss: 0.3438, test_loss: 1.1653, test_f1: 0.6291
 epoch: 48, train_loss: 0.3453, test_loss: 1.1419, test_f1: 0.6517
 epoch: 49, train_loss: 0.3443, test_loss: 1.0906, test_f1: 0.6315
 epoch: 50, train_loss: 0.3174, test_loss: 1.1920, test_f1: 0.6268
 epoch: 51, train_loss: 0.2741, test_loss: 1.1305, test_f1: 0.6612
 epoch: 52, train_loss: 0.2556, test_loss: 1.2136, test_f1: 0.6475
 epoch: 53, train_loss: 0.2662, test_loss: 1.1793, test_f1: 0.6587
 epoch: 54, train_loss: 0.2395, test_loss: 1.2904, test_f1: 0.6287
 epoch: 55, train_loss: 0.2397, test_loss: 1.2562, test_f1: 0.6296
 epoch: 56, train_loss: 0.2461, test_loss: 1.2223, test_f1: 0.6342
 epoch: 57, train_loss: 0.2244, test_loss: 1.2059, test_f1: 0.6634
 epoch: 58, train_loss: 0.2291, test_loss: 1.2342, test_f1: 0.6641
 epoch: 59, train_loss: 0.2210, test_loss: 1.3487, test_f1: 0.6441
 epoch: 60, train_loss: 0.2103, test_loss: 1.3166, test_f1: 0.6449
 epoch: 61, train_loss: 0.2102, test_loss: 1.3273, test_f1: 0.6361
 epoch: 62, train_loss: 0.2101, test_loss: 1.3024, test_f1: 0.6585
 epoch: 63, train_loss: 0.2056, test_loss: 1.4135, test_f1: 0.6525
 epoch: 64, train_loss: 0.2174, test_loss: 1.4611, test_f1: 0.6453
 epoch: 65, train_loss: 0.2106, test_loss: 1.4588, test_f1: 0.6342
 epoch: 66, train_loss: 0.1926, test_loss: 1.4692, test_f1: 0.6476
 epoch: 67, train_loss: 0.1916, test_loss: 1.5125, test_f1: 0.6692
 epoch: 68, train_loss: 0.1930, test_loss: 1.4905, test_f1: 0.6637
 epoch: 69, train_loss: 0.1837, test_loss: 1.5347, test_f1: 0.6419
 epoch: 70, train_loss: 0.1760, test_loss: 1.6294, test_f1: 0.6177
 epoch: 71, train_loss: 0.2056, test_loss: 1.5907, test_f1: 0.6606
 epoch: 72, train_loss: 0.2021, test_loss: 1.5049, test_f1: 0.6215
 epoch: 73, train_loss: 0.1929, test_loss: 1.5210, test_f1: 0.6536
 epoch: 74, train_loss: 0.1777, test_loss: 1.5063, test_f1: 0.6158
 epoch: 75, train_loss: 0.1733, test_loss: 1.5753, test_f1: 0.6366
 epoch: 76, train_loss: 0.1713, test_loss: 1.6509, test_f1: 0.6390
 epoch: 77, train_loss: 0.1449, test_loss: 1.5274, test_f1: 0.6224
 epoch: 78, train_loss: 0.1862, test_loss: 1.5321, test_f1: 0.6656
 epoch: 79, train_loss: 0.1884, test_loss: 1.2857, test_f1: 0.6554
 epoch: 80, train_loss: 0.1732, test_loss: 1.6897, test_f1: 0.6096
 epoch: 81, train_loss: 0.1634, test_loss: 1.6547, test_f1: 0.6212
 epoch: 82, train_loss: 0.1599, test_loss: 1.4353, test_f1: 0.6466
 epoch: 83, train_loss: 0.1488, test_loss: 1.6522, test_f1: 0.6452
 epoch: 84, train_loss: 0.1533, test_loss: 1.5415, test_f1: 0.6658
 epoch: 85, train_loss: 0.1473, test_loss: 1.6511, test_f1: 0.6417
 epoch: 86, train_loss: 0.1518, test_loss: 1.6650, test_f1: 0.6411
 epoch: 87, train_loss: 0.1596, test_loss: 1.6829, test_f1: 0.6529
 epoch: 88, train_loss: 0.1284, test_loss: 1.8056, test_f1: 0.6359
 epoch: 89, train_loss: 0.1460, test_loss: 1.8786, test_f1: 0.6264
 epoch: 90, train_loss: 0.1361, test_loss: 1.5772, test_f1: 0.6653
 epoch: 91, train_loss: 0.1384, test_loss: 1.6700, test_f1: 0.6381
 epoch: 92, train_loss: 0.1395, test_loss: 1.8640, test_f1: 0.6404
 epoch: 93, train_loss: 0.1410, test_loss: 1.5584, test_f1: 0.6306
 epoch: 94, train_loss: 0.1342, test_loss: 1.9401, test_f1: 0.6302
 epoch: 95, train_loss: 0.1500, test_loss: 1.7196, test_f1: 0.6346
 epoch: 96, train_loss: 0.1490, test_loss: 1.7349, test_f1: 0.6405
 epoch: 97, train_loss: 0.1243, test_loss: 1.7565, test_f1: 0.6442
 epoch: 98, train_loss: 0.1377, test_loss: 1.8162, test_f1: 0.6326
 epoch: 99, train_loss: 0.1271, test_loss: 1.8350, test_f1: 0.6419
##################ITERATION #7 ****************************************
 epoch: 0, train_loss: 1.4486, test_loss: 1.3137, test_f1: 0.2359
 epoch: 1, train_loss: 1.0031, test_loss: 1.0409, test_f1: 0.4459
 epoch: 2, train_loss: 0.9357, test_loss: 0.9872, test_f1: 0.5163
 epoch: 3, train_loss: 0.9002, test_loss: 0.9269, test_f1: 0.5703
 epoch: 4, train_loss: 0.8666, test_loss: 0.9522, test_f1: 0.5757
 epoch: 5, train_loss: 0.8064, test_loss: 0.8421, test_f1: 0.5700
 epoch: 6, train_loss: 0.8039, test_loss: 0.8756, test_f1: 0.6117
 epoch: 7, train_loss: 0.7967, test_loss: 0.9317, test_f1: 0.5778
 epoch: 8, train_loss: 0.7558, test_loss: 0.8037, test_f1: 0.5955
 epoch: 9, train_loss: 0.7431, test_loss: 0.8653, test_f1: 0.6120
 epoch: 10, train_loss: 0.7207, test_loss: 0.8542, test_f1: 0.5950
 epoch: 11, train_loss: 0.6982, test_loss: 0.8585, test_f1: 0.6108
 epoch: 12, train_loss: 0.6957, test_loss: 0.8933, test_f1: 0.6197
 epoch: 13, train_loss: 0.6965, test_loss: 0.8563, test_f1: 0.6140
 epoch: 14, train_loss: 0.6889, test_loss: 0.8946, test_f1: 0.6233
 epoch: 15, train_loss: 0.6599, test_loss: 0.8612, test_f1: 0.6026
 epoch: 16, train_loss: 0.6477, test_loss: 0.8902, test_f1: 0.6017
 epoch: 17, train_loss: 0.6437, test_loss: 0.8807, test_f1: 0.6402
 epoch: 18, train_loss: 0.6234, test_loss: 0.8880, test_f1: 0.6075
 epoch: 19, train_loss: 0.6067, test_loss: 0.7993, test_f1: 0.6276
 epoch: 20, train_loss: 0.5932, test_loss: 0.8641, test_f1: 0.6349
 epoch: 21, train_loss: 0.5682, test_loss: 0.9235, test_f1: 0.5956
 epoch: 22, train_loss: 0.5558, test_loss: 0.8724, test_f1: 0.6504
 epoch: 23, train_loss: 0.5542, test_loss: 0.8772, test_f1: 0.6235
 epoch: 24, train_loss: 0.5561, test_loss: 0.8816, test_f1: 0.6306
 epoch: 25, train_loss: 0.5634, test_loss: 0.9227, test_f1: 0.6330
 epoch: 26, train_loss: 0.5223, test_loss: 0.8527, test_f1: 0.6343
 epoch: 27, train_loss: 0.4995, test_loss: 0.8937, test_f1: 0.6202
 epoch: 28, train_loss: 0.5030, test_loss: 0.8670, test_f1: 0.6447
 epoch: 29, train_loss: 0.4882, test_loss: 0.9455, test_f1: 0.6426
 epoch: 30, train_loss: 0.5123, test_loss: 0.9856, test_f1: 0.6255
 epoch: 31, train_loss: 0.4806, test_loss: 0.9388, test_f1: 0.6059
 epoch: 32, train_loss: 0.4638, test_loss: 0.8815, test_f1: 0.6496
 epoch: 33, train_loss: 0.4619, test_loss: 1.0254, test_f1: 0.6344
 epoch: 34, train_loss: 0.4721, test_loss: 1.0155, test_f1: 0.5981
 epoch: 35, train_loss: 0.4368, test_loss: 0.8585, test_f1: 0.6563
 epoch: 36, train_loss: 0.4165, test_loss: 1.0142, test_f1: 0.6296
 epoch: 37, train_loss: 0.4350, test_loss: 1.0980, test_f1: 0.5914
 epoch: 38, train_loss: 0.4530, test_loss: 0.9232, test_f1: 0.6169
 epoch: 39, train_loss: 0.4342, test_loss: 1.0205, test_f1: 0.6346
 epoch: 40, train_loss: 0.4071, test_loss: 1.0147, test_f1: 0.6256
 epoch: 41, train_loss: 0.3886, test_loss: 1.0383, test_f1: 0.6391
 epoch: 42, train_loss: 0.3868, test_loss: 0.9783, test_f1: 0.6417
 epoch: 43, train_loss: 0.3669, test_loss: 1.0394, test_f1: 0.6230
 epoch: 44, train_loss: 0.3692, test_loss: 1.0587, test_f1: 0.6187
 epoch: 45, train_loss: 0.3919, test_loss: 1.1023, test_f1: 0.6115
 epoch: 46, train_loss: 0.3687, test_loss: 1.0857, test_f1: 0.6164
 epoch: 47, train_loss: 0.3865, test_loss: 1.0034, test_f1: 0.6393
 epoch: 48, train_loss: 0.3593, test_loss: 1.0648, test_f1: 0.6556
 epoch: 49, train_loss: 0.3254, test_loss: 1.1392, test_f1: 0.6372
 epoch: 50, train_loss: 0.3413, test_loss: 0.9907, test_f1: 0.6557
 epoch: 51, train_loss: 0.3172, test_loss: 1.0798, test_f1: 0.6439
 epoch: 52, train_loss: 0.2853, test_loss: 1.0372, test_f1: 0.6680
 epoch: 53, train_loss: 0.2675, test_loss: 1.0813, test_f1: 0.6627
 epoch: 54, train_loss: 0.2478, test_loss: 1.1936, test_f1: 0.6560
 epoch: 55, train_loss: 0.2538, test_loss: 1.3291, test_f1: 0.6341
 epoch: 56, train_loss: 0.2537, test_loss: 1.2461, test_f1: 0.6271
 epoch: 57, train_loss: 0.2533, test_loss: 1.1820, test_f1: 0.6642
 epoch: 58, train_loss: 0.2362, test_loss: 1.1560, test_f1: 0.6552
 epoch: 59, train_loss: 0.2287, test_loss: 1.1277, test_f1: 0.6772
 epoch: 60, train_loss: 0.2368, test_loss: 1.3917, test_f1: 0.6251
 epoch: 61, train_loss: 0.2388, test_loss: 1.1683, test_f1: 0.6571
 epoch: 62, train_loss: 0.2247, test_loss: 1.3007, test_f1: 0.6448
 epoch: 63, train_loss: 0.2109, test_loss: 1.4401, test_f1: 0.6547
 epoch: 64, train_loss: 0.2182, test_loss: 1.2691, test_f1: 0.6507
 epoch: 65, train_loss: 0.2074, test_loss: 1.4618, test_f1: 0.6565
 epoch: 66, train_loss: 0.2172, test_loss: 1.1752, test_f1: 0.6557
 epoch: 67, train_loss: 0.2176, test_loss: 1.3168, test_f1: 0.6647
 epoch: 68, train_loss: 0.1935, test_loss: 1.3364, test_f1: 0.6457
 epoch: 69, train_loss: 0.2025, test_loss: 1.5107, test_f1: 0.6559
 epoch: 70, train_loss: 0.2241, test_loss: 1.3621, test_f1: 0.6364
 epoch: 71, train_loss: 0.2133, test_loss: 1.4007, test_f1: 0.6667
 epoch: 72, train_loss: 0.2089, test_loss: 1.4324, test_f1: 0.6633
 epoch: 73, train_loss: 0.1980, test_loss: 1.4757, test_f1: 0.6545
 epoch: 74, train_loss: 0.2029, test_loss: 1.9235, test_f1: 0.5917
 epoch: 75, train_loss: 0.1958, test_loss: 1.3697, test_f1: 0.6443
 epoch: 76, train_loss: 0.1900, test_loss: 1.5565, test_f1: 0.6507
 epoch: 77, train_loss: 0.1819, test_loss: 1.5830, test_f1: 0.6388
 epoch: 78, train_loss: 0.1854, test_loss: 1.5705, test_f1: 0.6565
 epoch: 79, train_loss: 0.1771, test_loss: 1.4033, test_f1: 0.6748
 epoch: 80, train_loss: 0.1943, test_loss: 1.6795, test_f1: 0.6234
 epoch: 81, train_loss: 0.1775, test_loss: 1.5037, test_f1: 0.6662
 epoch: 82, train_loss: 0.1680, test_loss: 1.4223, test_f1: 0.6654
 epoch: 83, train_loss: 0.1862, test_loss: 1.4550, test_f1: 0.6421
 epoch: 84, train_loss: 0.1810, test_loss: 1.7361, test_f1: 0.6342
 epoch: 85, train_loss: 0.1619, test_loss: 1.6278, test_f1: 0.6766
 epoch: 86, train_loss: 0.1671, test_loss: 1.7084, test_f1: 0.6638
 epoch: 87, train_loss: 0.1626, test_loss: 1.5538, test_f1: 0.6542
 epoch: 88, train_loss: 0.1628, test_loss: 1.4357, test_f1: 0.6443
 epoch: 89, train_loss: 0.1613, test_loss: 1.6853, test_f1: 0.6407
 epoch: 90, train_loss: 0.1535, test_loss: 1.5745, test_f1: 0.6560
 epoch: 91, train_loss: 0.1516, test_loss: 1.5998, test_f1: 0.6239
 epoch: 92, train_loss: 0.1437, test_loss: 1.6319, test_f1: 0.6523
 epoch: 93, train_loss: 0.1448, test_loss: 1.7386, test_f1: 0.6608
 epoch: 94, train_loss: 0.1525, test_loss: 1.6036, test_f1: 0.6724
 epoch: 95, train_loss: 0.1547, test_loss: 1.7113, test_f1: 0.6329
 epoch: 96, train_loss: 0.1459, test_loss: 1.6508, test_f1: 0.6627
 epoch: 97, train_loss: 0.1355, test_loss: 1.6138, test_f1: 0.6532
 epoch: 98, train_loss: 0.1474, test_loss: 1.8204, test_f1: 0.6351
 epoch: 99, train_loss: 0.1317, test_loss: 1.6799, test_f1: 0.6474
##################ITERATION #8 ****************************************
 epoch: 0, train_loss: 1.4623, test_loss: 1.4581, test_f1: 0.2688
 epoch: 1, train_loss: 1.0048, test_loss: 1.1156, test_f1: 0.4409
 epoch: 2, train_loss: 0.9285, test_loss: 0.9199, test_f1: 0.5618
 epoch: 3, train_loss: 0.8902, test_loss: 0.9519, test_f1: 0.5324
 epoch: 4, train_loss: 0.8411, test_loss: 0.9162, test_f1: 0.5190
 epoch: 5, train_loss: 0.8290, test_loss: 0.8378, test_f1: 0.5868
 epoch: 6, train_loss: 0.7932, test_loss: 0.8547, test_f1: 0.5895
 epoch: 7, train_loss: 0.7576, test_loss: 0.8784, test_f1: 0.5839
 epoch: 8, train_loss: 0.7613, test_loss: 0.7938, test_f1: 0.6337
 epoch: 9, train_loss: 0.7212, test_loss: 0.8583, test_f1: 0.5557
 epoch: 10, train_loss: 0.7185, test_loss: 0.9129, test_f1: 0.6119
 epoch: 11, train_loss: 0.7036, test_loss: 0.8659, test_f1: 0.5810
 epoch: 12, train_loss: 0.7048, test_loss: 0.8760, test_f1: 0.5866
 epoch: 13, train_loss: 0.6641, test_loss: 0.9165, test_f1: 0.6063
 epoch: 14, train_loss: 0.6513, test_loss: 0.7858, test_f1: 0.6251
 epoch: 15, train_loss: 0.6390, test_loss: 0.9096, test_f1: 0.6094
 epoch: 16, train_loss: 0.6096, test_loss: 0.7965, test_f1: 0.6611
 epoch: 17, train_loss: 0.5967, test_loss: 0.8303, test_f1: 0.6379
 epoch: 18, train_loss: 0.5929, test_loss: 1.0075, test_f1: 0.6195
 epoch: 19, train_loss: 0.5830, test_loss: 0.8366, test_f1: 0.5916
 epoch: 20, train_loss: 0.5678, test_loss: 0.8229, test_f1: 0.6490
 epoch: 21, train_loss: 0.5617, test_loss: 0.7729, test_f1: 0.6610
 epoch: 22, train_loss: 0.5540, test_loss: 0.8433, test_f1: 0.6540
 epoch: 23, train_loss: 0.5325, test_loss: 0.8587, test_f1: 0.6564
 epoch: 24, train_loss: 0.5210, test_loss: 0.8174, test_f1: 0.6547
 epoch: 25, train_loss: 0.5019, test_loss: 0.7904, test_f1: 0.6513
 epoch: 26, train_loss: 0.4871, test_loss: 1.0978, test_f1: 0.5985
 epoch: 27, train_loss: 0.5055, test_loss: 0.8585, test_f1: 0.6286
 epoch: 28, train_loss: 0.5082, test_loss: 0.8025, test_f1: 0.6455
 epoch: 29, train_loss: 0.4855, test_loss: 0.9300, test_f1: 0.6309
 epoch: 30, train_loss: 0.4780, test_loss: 0.8329, test_f1: 0.6460
 epoch: 31, train_loss: 0.4585, test_loss: 0.8472, test_f1: 0.6566
 epoch: 32, train_loss: 0.4564, test_loss: 0.9319, test_f1: 0.6503
 epoch: 33, train_loss: 0.4477, test_loss: 0.8541, test_f1: 0.6519
 epoch: 34, train_loss: 0.4180, test_loss: 1.0371, test_f1: 0.6310
 epoch: 35, train_loss: 0.4199, test_loss: 0.9837, test_f1: 0.6124
 epoch: 36, train_loss: 0.4231, test_loss: 0.9475, test_f1: 0.6629
 epoch: 37, train_loss: 0.4282, test_loss: 1.1391, test_f1: 0.6154
 epoch: 38, train_loss: 0.4220, test_loss: 1.1198, test_f1: 0.5768
 epoch: 39, train_loss: 0.4168, test_loss: 1.0111, test_f1: 0.6411
 epoch: 40, train_loss: 0.3753, test_loss: 0.9499, test_f1: 0.6523
 epoch: 41, train_loss: 0.3841, test_loss: 1.0442, test_f1: 0.6451
 epoch: 42, train_loss: 0.3635, test_loss: 1.0631, test_f1: 0.6471
 epoch: 43, train_loss: 0.3553, test_loss: 0.9425, test_f1: 0.6896
 epoch: 44, train_loss: 0.3518, test_loss: 1.0519, test_f1: 0.6490
 epoch: 45, train_loss: 0.3519, test_loss: 1.0484, test_f1: 0.6489
 epoch: 46, train_loss: 0.3601, test_loss: 1.1180, test_f1: 0.6496
 epoch: 47, train_loss: 0.3378, test_loss: 1.0017, test_f1: 0.6579
 epoch: 48, train_loss: 0.3433, test_loss: 1.2027, test_f1: 0.6352
 epoch: 49, train_loss: 0.3514, test_loss: 1.0550, test_f1: 0.6378
 epoch: 50, train_loss: 0.3374, test_loss: 1.0773, test_f1: 0.6441
 epoch: 51, train_loss: 0.2968, test_loss: 1.0492, test_f1: 0.6657
 epoch: 52, train_loss: 0.2740, test_loss: 1.1027, test_f1: 0.6667
 epoch: 53, train_loss: 0.2458, test_loss: 1.1582, test_f1: 0.6447
 epoch: 54, train_loss: 0.2398, test_loss: 1.2769, test_f1: 0.6436
 epoch: 55, train_loss: 0.2361, test_loss: 1.2520, test_f1: 0.6693
 epoch: 56, train_loss: 0.2084, test_loss: 1.3042, test_f1: 0.6557
 epoch: 57, train_loss: 0.2320, test_loss: 1.3008, test_f1: 0.6395
 epoch: 58, train_loss: 0.2037, test_loss: 1.3451, test_f1: 0.6383
 epoch: 59, train_loss: 0.2188, test_loss: 1.2893, test_f1: 0.6833
 epoch: 60, train_loss: 0.2059, test_loss: 1.3107, test_f1: 0.6554
 epoch: 61, train_loss: 0.2158, test_loss: 1.2527, test_f1: 0.6898
 epoch: 62, train_loss: 0.2035, test_loss: 1.4313, test_f1: 0.6453
 epoch: 63, train_loss: 0.2286, test_loss: 1.4163, test_f1: 0.6375
 epoch: 64, train_loss: 0.2037, test_loss: 1.3190, test_f1: 0.6725
 epoch: 65, train_loss: 0.2230, test_loss: 1.4096, test_f1: 0.6266
 epoch: 66, train_loss: 0.1932, test_loss: 1.3895, test_f1: 0.6640
 epoch: 67, train_loss: 0.1976, test_loss: 1.3613, test_f1: 0.6598
 epoch: 68, train_loss: 0.1795, test_loss: 1.4570, test_f1: 0.6567
 epoch: 69, train_loss: 0.1979, test_loss: 1.4297, test_f1: 0.6657
 epoch: 70, train_loss: 0.1928, test_loss: 1.4289, test_f1: 0.6957
 epoch: 71, train_loss: 0.1693, test_loss: 1.5480, test_f1: 0.6428
 epoch: 72, train_loss: 0.1908, test_loss: 1.3953, test_f1: 0.6256
 epoch: 73, train_loss: 0.1851, test_loss: 1.4346, test_f1: 0.6543
 epoch: 74, train_loss: 0.1743, test_loss: 1.5390, test_f1: 0.6566
 epoch: 75, train_loss: 0.1675, test_loss: 1.4801, test_f1: 0.6494
 epoch: 76, train_loss: 0.1757, test_loss: 1.4632, test_f1: 0.6392
 epoch: 77, train_loss: 0.1572, test_loss: 1.5297, test_f1: 0.6491
 epoch: 78, train_loss: 0.1682, test_loss: 1.5930, test_f1: 0.6303
 epoch: 79, train_loss: 0.1883, test_loss: 1.5126, test_f1: 0.6543
 epoch: 80, train_loss: 0.1537, test_loss: 1.5729, test_f1: 0.6627
 epoch: 81, train_loss: 0.1574, test_loss: 1.6266, test_f1: 0.6548
 epoch: 82, train_loss: 0.1648, test_loss: 1.5411, test_f1: 0.6498
 epoch: 83, train_loss: 0.1783, test_loss: 1.5663, test_f1: 0.6634
 epoch: 84, train_loss: 0.1714, test_loss: 1.4995, test_f1: 0.6267
 epoch: 85, train_loss: 0.1616, test_loss: 1.5788, test_f1: 0.6647
 epoch: 86, train_loss: 0.1657, test_loss: 1.6748, test_f1: 0.6544
 epoch: 87, train_loss: 0.1620, test_loss: 1.5343, test_f1: 0.6787
 epoch: 88, train_loss: 0.1538, test_loss: 1.7095, test_f1: 0.6650
 epoch: 89, train_loss: 0.1563, test_loss: 1.6584, test_f1: 0.6540
 epoch: 90, train_loss: 0.1535, test_loss: 1.8111, test_f1: 0.6519
 epoch: 91, train_loss: 0.1527, test_loss: 1.7280, test_f1: 0.6537
 epoch: 92, train_loss: 0.1362, test_loss: 1.6267, test_f1: 0.6641
 epoch: 93, train_loss: 0.1329, test_loss: 1.7070, test_f1: 0.6716
 epoch: 94, train_loss: 0.1260, test_loss: 1.8936, test_f1: 0.6619
 epoch: 95, train_loss: 0.1436, test_loss: 1.9576, test_f1: 0.6176
 epoch: 96, train_loss: 0.1559, test_loss: 1.7869, test_f1: 0.6684
 epoch: 97, train_loss: 0.1361, test_loss: 1.5520, test_f1: 0.6874
 epoch: 98, train_loss: 0.1327, test_loss: 1.8180, test_f1: 0.6667
 epoch: 99, train_loss: 0.1406, test_loss: 1.7210, test_f1: 0.6740
##################ITERATION #9 ****************************************
 epoch: 0, train_loss: 1.5213, test_loss: 1.2929, test_f1: 0.2689
 epoch: 1, train_loss: 1.0161, test_loss: 1.0117, test_f1: 0.4568
 epoch: 2, train_loss: 0.9440, test_loss: 0.9422, test_f1: 0.5203
 epoch: 3, train_loss: 0.9041, test_loss: 0.9994, test_f1: 0.5324
 epoch: 4, train_loss: 0.8875, test_loss: 0.8890, test_f1: 0.5337
 epoch: 5, train_loss: 0.8754, test_loss: 0.9188, test_f1: 0.5675
 epoch: 6, train_loss: 0.8335, test_loss: 0.9537, test_f1: 0.5851
 epoch: 7, train_loss: 0.8226, test_loss: 0.9431, test_f1: 0.5713
 epoch: 8, train_loss: 0.7981, test_loss: 0.8996, test_f1: 0.5818
 epoch: 9, train_loss: 0.7739, test_loss: 0.8497, test_f1: 0.5649
 epoch: 10, train_loss: 0.7559, test_loss: 0.9278, test_f1: 0.5967
 epoch: 11, train_loss: 0.7522, test_loss: 0.8393, test_f1: 0.6299
 epoch: 12, train_loss: 0.7084, test_loss: 0.9337, test_f1: 0.5912
 epoch: 13, train_loss: 0.6898, test_loss: 0.8660, test_f1: 0.6235
 epoch: 14, train_loss: 0.6984, test_loss: 1.0102, test_f1: 0.5988
 epoch: 15, train_loss: 0.6758, test_loss: 0.9887, test_f1: 0.6089
 epoch: 16, train_loss: 0.6519, test_loss: 0.9641, test_f1: 0.6137
 epoch: 17, train_loss: 0.6607, test_loss: 1.0117, test_f1: 0.5704
 epoch: 18, train_loss: 0.6384, test_loss: 0.9573, test_f1: 0.6210
 epoch: 19, train_loss: 0.6313, test_loss: 0.9144, test_f1: 0.6214
 epoch: 20, train_loss: 0.6154, test_loss: 0.9223, test_f1: 0.6130
 epoch: 21, train_loss: 0.5855, test_loss: 0.9510, test_f1: 0.6163
 epoch: 22, train_loss: 0.5856, test_loss: 1.0316, test_f1: 0.6083
 epoch: 23, train_loss: 0.6074, test_loss: 0.9753, test_f1: 0.6117
 epoch: 24, train_loss: 0.5702, test_loss: 1.0041, test_f1: 0.6279
 epoch: 25, train_loss: 0.5487, test_loss: 0.9473, test_f1: 0.6331
 epoch: 26, train_loss: 0.5444, test_loss: 1.1544, test_f1: 0.6079
 epoch: 27, train_loss: 0.5584, test_loss: 1.2250, test_f1: 0.5823
 epoch: 28, train_loss: 0.5488, test_loss: 1.0685, test_f1: 0.6274
 epoch: 29, train_loss: 0.5159, test_loss: 0.8876, test_f1: 0.6319
 epoch: 30, train_loss: 0.5218, test_loss: 1.0207, test_f1: 0.6313
 epoch: 31, train_loss: 0.5127, test_loss: 1.0644, test_f1: 0.6261
 epoch: 32, train_loss: 0.4841, test_loss: 0.9874, test_f1: 0.6261
 epoch: 33, train_loss: 0.4885, test_loss: 0.9851, test_f1: 0.6328
 epoch: 34, train_loss: 0.4609, test_loss: 0.9842, test_f1: 0.6187
 epoch: 35, train_loss: 0.4565, test_loss: 1.0363, test_f1: 0.6029
 epoch: 36, train_loss: 0.4613, test_loss: 1.0104, test_f1: 0.6313
 epoch: 37, train_loss: 0.4655, test_loss: 0.9496, test_f1: 0.6598
 epoch: 38, train_loss: 0.4426, test_loss: 0.9782, test_f1: 0.6569
 epoch: 39, train_loss: 0.4531, test_loss: 1.0133, test_f1: 0.6536
 epoch: 40, train_loss: 0.4348, test_loss: 1.0991, test_f1: 0.6202
 epoch: 41, train_loss: 0.4021, test_loss: 0.9312, test_f1: 0.6407
 epoch: 42, train_loss: 0.4210, test_loss: 0.9757, test_f1: 0.6758
 epoch: 43, train_loss: 0.3971, test_loss: 0.9612, test_f1: 0.6516
 epoch: 44, train_loss: 0.3899, test_loss: 0.9241, test_f1: 0.6596
 epoch: 45, train_loss: 0.4111, test_loss: 0.9353, test_f1: 0.6550
 epoch: 46, train_loss: 0.3982, test_loss: 0.8758, test_f1: 0.6619
 epoch: 47, train_loss: 0.3503, test_loss: 1.0547, test_f1: 0.6543
 epoch: 48, train_loss: 0.3950, test_loss: 1.1876, test_f1: 0.6443
 epoch: 49, train_loss: 0.3959, test_loss: 1.0358, test_f1: 0.6491
 epoch: 50, train_loss: 0.3594, test_loss: 0.9502, test_f1: 0.6560
 epoch: 51, train_loss: 0.3185, test_loss: 0.9778, test_f1: 0.6881
 epoch: 52, train_loss: 0.3057, test_loss: 1.0943, test_f1: 0.6675
 epoch: 53, train_loss: 0.2847, test_loss: 1.0246, test_f1: 0.7344
 epoch: 54, train_loss: 0.2760, test_loss: 1.0341, test_f1: 0.6657
 epoch: 55, train_loss: 0.2765, test_loss: 1.0492, test_f1: 0.7039
 epoch: 56, train_loss: 0.2799, test_loss: 1.0194, test_f1: 0.6773
 epoch: 57, train_loss: 0.2706, test_loss: 1.1025, test_f1: 0.6780
 epoch: 58, train_loss: 0.2662, test_loss: 0.9960, test_f1: 0.6963
 epoch: 59, train_loss: 0.2597, test_loss: 1.1138, test_f1: 0.6850
 epoch: 60, train_loss: 0.2605, test_loss: 1.0687, test_f1: 0.6831
 epoch: 61, train_loss: 0.2714, test_loss: 1.0333, test_f1: 0.6816
 epoch: 62, train_loss: 0.2656, test_loss: 1.1162, test_f1: 0.6801
 epoch: 63, train_loss: 0.2474, test_loss: 1.1376, test_f1: 0.6646
 epoch: 64, train_loss: 0.2511, test_loss: 1.2057, test_f1: 0.6815
 epoch: 65, train_loss: 0.2395, test_loss: 1.1516, test_f1: 0.7137
 epoch: 66, train_loss: 0.2395, test_loss: 1.3185, test_f1: 0.6782
 epoch: 67, train_loss: 0.2468, test_loss: 1.3027, test_f1: 0.6845
 epoch: 68, train_loss: 0.2284, test_loss: 1.2636, test_f1: 0.6828
 epoch: 69, train_loss: 0.2321, test_loss: 1.3903, test_f1: 0.6731
 epoch: 70, train_loss: 0.2229, test_loss: 1.1870, test_f1: 0.7148
 epoch: 71, train_loss: 0.2348, test_loss: 1.2978, test_f1: 0.6616
 epoch: 72, train_loss: 0.2211, test_loss: 1.2604, test_f1: 0.7028
 epoch: 73, train_loss: 0.2215, test_loss: 1.2075, test_f1: 0.6877
 epoch: 74, train_loss: 0.2229, test_loss: 1.3050, test_f1: 0.6934
 epoch: 75, train_loss: 0.2104, test_loss: 1.2720, test_f1: 0.6900
 epoch: 76, train_loss: 0.1976, test_loss: 1.3542, test_f1: 0.6907
 epoch: 77, train_loss: 0.1902, test_loss: 1.2677, test_f1: 0.7146
 epoch: 78, train_loss: 0.1882, test_loss: 1.3067, test_f1: 0.6889
 epoch: 79, train_loss: 0.1829, test_loss: 1.3708, test_f1: 0.6944
 epoch: 80, train_loss: 0.2178, test_loss: 1.2851, test_f1: 0.6855
 epoch: 81, train_loss: 0.1927, test_loss: 1.4585, test_f1: 0.6595
 epoch: 82, train_loss: 0.2095, test_loss: 1.3422, test_f1: 0.6656
 epoch: 83, train_loss: 0.2001, test_loss: 1.3266, test_f1: 0.6812
 epoch: 84, train_loss: 0.1910, test_loss: 1.3748, test_f1: 0.6992
 epoch: 85, train_loss: 0.1880, test_loss: 1.3378, test_f1: 0.6744
 epoch: 86, train_loss: 0.1954, test_loss: 1.5762, test_f1: 0.6793
 epoch: 87, train_loss: 0.1808, test_loss: 1.5496, test_f1: 0.6767
 epoch: 88, train_loss: 0.1850, test_loss: 1.3681, test_f1: 0.6977
 epoch: 89, train_loss: 0.1670, test_loss: 1.4558, test_f1: 0.6627
 epoch: 90, train_loss: 0.1832, test_loss: 1.5198, test_f1: 0.6854
 epoch: 91, train_loss: 0.1622, test_loss: 1.4442, test_f1: 0.6841
 epoch: 92, train_loss: 0.1831, test_loss: 1.5147, test_f1: 0.6915
 epoch: 93, train_loss: 0.1948, test_loss: 1.4291, test_f1: 0.6950
 epoch: 94, train_loss: 0.1648, test_loss: 1.5191, test_f1: 0.6672
 epoch: 95, train_loss: 0.1674, test_loss: 1.4256, test_f1: 0.6850
 epoch: 96, train_loss: 0.1654, test_loss: 1.7083, test_f1: 0.6527
 epoch: 97, train_loss: 0.1541, test_loss: 1.4234, test_f1: 0.7030
 epoch: 98, train_loss: 0.1460, test_loss: 1.6082, test_f1: 0.6758
 epoch: 99, train_loss: 0.1617, test_loss: 1.4718, test_f1: 0.7103

Training completed in 1156.26 seconds
Best F1: 0.7344 at epoch 53
Mean F1 across iterations: 0.6940  0.0182
========================FINAL RESULTS================================
FEGIN weighted F1: 0.7344  0.0182
python main.py --data ltspice_examples --representation component_pin --model FEGIN --layers 3 --hiddens 128 --batch_size 128 --lr 0.001 --emb_size 250 --epochs 100 --save_appendix component_pin_L3_H128_BS128_LR0.001_E250 --no_val
-----



STDERR:
  File "main.py", line 370, in <module>
    main()
  File "main.py", line 254, in main
    dataset = dataset_class(
  File "/home/philip/projects/llm_inference_code_repo/Circuit-Completion-Using-GNNs/component_classification_with_link_prediction_head/evaluation/FEGIN/kernel/circuit_datasets.py", line 15, in __init__
    self.data, self.slices = torch.load(self.processed_paths[0])
  File "/home/philip/.local/lib/python3.8/site-packages/torch/serialization.py", line 1040, in load
    warnings.warn(
  File "/usr/lib/python3.8/warnings.py", line 109, in _showwarnmsg
    sw(msg.message, msg.category, msg.filename, msg.lineno,
  File "main.py", line 47, in warn_with_traceback
    traceback.print_stack(file=log)
/home/philip/projects/llm_inference_code_repo/Circuit-Completion-Using-GNNs/component_classification_with_link_prediction_head/evaluation/FEGIN/kernel/circuit_datasets.py:15: FutureWarning: You are using `torch.load` with `weights_only=False` (the current default value), which uses the default pickle module implicitly. It is possible to construct malicious pickle data which will execute arbitrary code during unpickling (See https://github.com/pytorch/pytorch/blob/main/SECURITY.md#untrusted-models for more details). In a future release, the default value for `weights_only` will be flipped to `True`. This limits the functions that could be executed during unpickling. Arbitrary objects will no longer be allowed to be loaded via this mode unless they are explicitly allowlisted by the user via `torch.serialization.add_safe_globals`. We recommend you start setting `weights_only=True` for any use case where you don't have full control of the loaded file. Please open an issue on GitHub for any issues related to this experimental feature.
  self.data, self.slices = torch.load(self.processed_paths[0])
