STDOUT:
Results will be saved in /home/philip/projects/ltspice_examples_code_repo/Circuit-Completion-Using-GNNs/component_classification_with_link_prediction_head/evaluation/FEGIN/results/model_FEGIN_dataset_ltspice_demos
Command line input: python main.py --data ltspice_demos --representation component_component --model FEGIN --layers 4 --hiddens 16 --batch_size 128 --lr 0.001 --emb_size 128 --epochs 100 --save_appendix component_component_L4_H16_BS128_LR0.001_E128 --no_val
 is saved.
-----
ltspice_demos - FEGIN
Using 4 layers, 16 hidden units, h = 2
Loading component_component representation dataset
ENTERED
Training FEGIN on component_component representation
Train: 1565, Test: 383
##################ITERATION #0 ****************************************
 epoch: 0, train_loss: 1.3654, test_loss: 1.3583, test_f1: 0.2281
 epoch: 1, train_loss: 1.3497, test_loss: 1.3519, test_f1: 0.2281
 epoch: 2, train_loss: 1.3403, test_loss: 1.3455, test_f1: 0.2281
 epoch: 3, train_loss: 1.3303, test_loss: 1.3367, test_f1: 0.2281
 epoch: 4, train_loss: 1.3160, test_loss: 1.3265, test_f1: 0.2281
 epoch: 5, train_loss: 1.2971, test_loss: 1.3135, test_f1: 0.2281
 epoch: 6, train_loss: 1.2790, test_loss: 1.2983, test_f1: 0.2281
 epoch: 7, train_loss: 1.2561, test_loss: 1.2811, test_f1: 0.2281
 epoch: 8, train_loss: 1.2283, test_loss: 1.2667, test_f1: 0.2281
 epoch: 9, train_loss: 1.2133, test_loss: 1.2543, test_f1: 0.2281
 epoch: 10, train_loss: 1.2032, test_loss: 1.2474, test_f1: 0.2636
 epoch: 11, train_loss: 1.1875, test_loss: 1.2400, test_f1: 0.3156
 epoch: 12, train_loss: 1.1801, test_loss: 1.2401, test_f1: 0.3163
 epoch: 13, train_loss: 1.1665, test_loss: 1.2438, test_f1: 0.3292
 epoch: 14, train_loss: 1.1535, test_loss: 1.2331, test_f1: 0.3787
 epoch: 15, train_loss: 1.1518, test_loss: 1.2345, test_f1: 0.3407
 epoch: 16, train_loss: 1.1336, test_loss: 1.2381, test_f1: 0.3216
 epoch: 17, train_loss: 1.1352, test_loss: 1.2574, test_f1: 0.3177
 epoch: 18, train_loss: 1.1303, test_loss: 1.2705, test_f1: 0.3305
 epoch: 19, train_loss: 1.1136, test_loss: 1.2499, test_f1: 0.3215
 epoch: 20, train_loss: 1.1159, test_loss: 1.3109, test_f1: 0.3255
 epoch: 21, train_loss: 1.0988, test_loss: 1.2797, test_f1: 0.3116
 epoch: 22, train_loss: 1.0939, test_loss: 1.2937, test_f1: 0.3269
 epoch: 23, train_loss: 1.0934, test_loss: 1.2878, test_f1: 0.3284
 epoch: 24, train_loss: 1.0723, test_loss: 1.2694, test_f1: 0.3401
 epoch: 25, train_loss: 1.0740, test_loss: 1.2454, test_f1: 0.3678
 epoch: 26, train_loss: 1.0741, test_loss: 1.3274, test_f1: 0.3786
 epoch: 27, train_loss: 1.0753, test_loss: 1.3128, test_f1: 0.3728
 epoch: 28, train_loss: 1.0561, test_loss: 1.3536, test_f1: 0.3819
 epoch: 29, train_loss: 1.0670, test_loss: 1.3808, test_f1: 0.3693
 epoch: 30, train_loss: 1.0414, test_loss: 1.2954, test_f1: 0.3811
 epoch: 31, train_loss: 1.0416, test_loss: 1.2776, test_f1: 0.3786
 epoch: 32, train_loss: 1.0355, test_loss: 1.3082, test_f1: 0.3970
 epoch: 33, train_loss: 1.0235, test_loss: 1.2793, test_f1: 0.4124
 epoch: 34, train_loss: 1.0247, test_loss: 1.3087, test_f1: 0.4072
 epoch: 35, train_loss: 1.0210, test_loss: 1.2890, test_f1: 0.3971
 epoch: 36, train_loss: 1.0073, test_loss: 1.3525, test_f1: 0.4042
 epoch: 37, train_loss: 1.0247, test_loss: 1.3516, test_f1: 0.4179
 epoch: 38, train_loss: 1.0190, test_loss: 1.3534, test_f1: 0.4608
 epoch: 39, train_loss: 1.0170, test_loss: 1.2887, test_f1: 0.4353
 epoch: 40, train_loss: 0.9924, test_loss: 1.2844, test_f1: 0.4287
 epoch: 41, train_loss: 0.9954, test_loss: 1.2750, test_f1: 0.4298
 epoch: 42, train_loss: 0.9899, test_loss: 1.3060, test_f1: 0.4297
 epoch: 43, train_loss: 0.9889, test_loss: 1.2914, test_f1: 0.4597
 epoch: 44, train_loss: 0.9902, test_loss: 1.2816, test_f1: 0.4510
 epoch: 45, train_loss: 0.9741, test_loss: 1.3072, test_f1: 0.4610
 epoch: 46, train_loss: 0.9727, test_loss: 1.2937, test_f1: 0.4626
 epoch: 47, train_loss: 0.9571, test_loss: 1.3459, test_f1: 0.4723
 epoch: 48, train_loss: 0.9538, test_loss: 1.3027, test_f1: 0.4633
 epoch: 49, train_loss: 0.9534, test_loss: 1.3189, test_f1: 0.4853
 epoch: 50, train_loss: 0.9625, test_loss: 1.3158, test_f1: 0.4788
 epoch: 51, train_loss: 0.9397, test_loss: 1.3279, test_f1: 0.4714
 epoch: 52, train_loss: 0.9322, test_loss: 1.3670, test_f1: 0.4760
 epoch: 53, train_loss: 0.9350, test_loss: 1.3799, test_f1: 0.4831
 epoch: 54, train_loss: 0.9446, test_loss: 1.3308, test_f1: 0.4917
 epoch: 55, train_loss: 0.9397, test_loss: 1.3562, test_f1: 0.4812
 epoch: 56, train_loss: 0.9276, test_loss: 1.3471, test_f1: 0.4850
 epoch: 57, train_loss: 0.9231, test_loss: 1.3673, test_f1: 0.4871
 epoch: 58, train_loss: 0.9145, test_loss: 1.3429, test_f1: 0.4800
 epoch: 59, train_loss: 0.9232, test_loss: 1.3387, test_f1: 0.4912
 epoch: 60, train_loss: 0.9230, test_loss: 1.3117, test_f1: 0.4831
 epoch: 61, train_loss: 0.9254, test_loss: 1.3376, test_f1: 0.4875
 epoch: 62, train_loss: 0.9128, test_loss: 1.2917, test_f1: 0.5016
 epoch: 63, train_loss: 0.9335, test_loss: 1.3724, test_f1: 0.4878
 epoch: 64, train_loss: 0.9141, test_loss: 1.4052, test_f1: 0.4947
 epoch: 65, train_loss: 0.9056, test_loss: 1.3882, test_f1: 0.4938
 epoch: 66, train_loss: 0.9120, test_loss: 1.3731, test_f1: 0.5034
 epoch: 67, train_loss: 0.9045, test_loss: 1.3658, test_f1: 0.4930
 epoch: 68, train_loss: 0.9029, test_loss: 1.3378, test_f1: 0.4933
 epoch: 69, train_loss: 0.8923, test_loss: 1.3263, test_f1: 0.4965
 epoch: 70, train_loss: 0.9069, test_loss: 1.3341, test_f1: 0.4945
 epoch: 71, train_loss: 0.9030, test_loss: 1.3840, test_f1: 0.4987
 epoch: 72, train_loss: 0.8923, test_loss: 1.3769, test_f1: 0.4896
 epoch: 73, train_loss: 0.8964, test_loss: 1.3855, test_f1: 0.5001
 epoch: 74, train_loss: 0.8927, test_loss: 1.3934, test_f1: 0.4902
 epoch: 75, train_loss: 0.8777, test_loss: 1.3767, test_f1: 0.4925
 epoch: 76, train_loss: 0.8928, test_loss: 1.4101, test_f1: 0.4953
 epoch: 77, train_loss: 0.8886, test_loss: 1.3895, test_f1: 0.4961
 epoch: 78, train_loss: 0.8844, test_loss: 1.3660, test_f1: 0.5072
 epoch: 79, train_loss: 0.8938, test_loss: 1.3844, test_f1: 0.4647
 epoch: 80, train_loss: 0.8796, test_loss: 1.4010, test_f1: 0.4864
 epoch: 81, train_loss: 0.8734, test_loss: 1.3984, test_f1: 0.4882
 epoch: 82, train_loss: 0.8725, test_loss: 1.3475, test_f1: 0.5078
 epoch: 83, train_loss: 0.8811, test_loss: 1.3474, test_f1: 0.5040
 epoch: 84, train_loss: 0.8738, test_loss: 1.4118, test_f1: 0.4974
 epoch: 85, train_loss: 0.8708, test_loss: 1.4061, test_f1: 0.5010
 epoch: 86, train_loss: 0.8763, test_loss: 1.4230, test_f1: 0.5199
 epoch: 87, train_loss: 0.8763, test_loss: 1.3855, test_f1: 0.4661
 epoch: 88, train_loss: 0.8683, test_loss: 1.4013, test_f1: 0.4822
 epoch: 89, train_loss: 0.8703, test_loss: 1.3519, test_f1: 0.5005
 epoch: 90, train_loss: 0.8653, test_loss: 1.3980, test_f1: 0.5017
 epoch: 91, train_loss: 0.8605, test_loss: 1.3505, test_f1: 0.5299
 epoch: 92, train_loss: 0.8799, test_loss: 1.4107, test_f1: 0.5093
 epoch: 93, train_loss: 0.8555, test_loss: 1.4115, test_f1: 0.5086
 epoch: 94, train_loss: 0.8578, test_loss: 1.3823, test_f1: 0.5041
 epoch: 95, train_loss: 0.8638, test_loss: 1.4211, test_f1: 0.4810
 epoch: 96, train_loss: 0.8488, test_loss: 1.4189, test_f1: 0.4862
 epoch: 97, train_loss: 0.8467, test_loss: 1.3879, test_f1: 0.5013
 epoch: 98, train_loss: 0.8542, test_loss: 1.3557, test_f1: 0.5064
 epoch: 99, train_loss: 0.8624, test_loss: 1.3611, test_f1: 0.5012
##################ITERATION #1 ****************************************
 epoch: 0, train_loss: 1.3204, test_loss: 1.3239, test_f1: 0.2281
 epoch: 1, train_loss: 1.2704, test_loss: 1.3163, test_f1: 0.2281
 epoch: 2, train_loss: 1.2503, test_loss: 1.3140, test_f1: 0.2281
 epoch: 3, train_loss: 1.2331, test_loss: 1.3108, test_f1: 0.2281
 epoch: 4, train_loss: 1.2206, test_loss: 1.2974, test_f1: 0.2337
 epoch: 5, train_loss: 1.2200, test_loss: 1.2977, test_f1: 0.2717
 epoch: 6, train_loss: 1.2109, test_loss: 1.3013, test_f1: 0.2872
 epoch: 7, train_loss: 1.2070, test_loss: 1.2926, test_f1: 0.3363
 epoch: 8, train_loss: 1.2090, test_loss: 1.2789, test_f1: 0.3358
 epoch: 9, train_loss: 1.1978, test_loss: 1.2705, test_f1: 0.3396
 epoch: 10, train_loss: 1.1913, test_loss: 1.2682, test_f1: 0.3426
 epoch: 11, train_loss: 1.1863, test_loss: 1.2579, test_f1: 0.3417
 epoch: 12, train_loss: 1.1743, test_loss: 1.2492, test_f1: 0.3626
 epoch: 13, train_loss: 1.1713, test_loss: 1.2477, test_f1: 0.3455
 epoch: 14, train_loss: 1.1612, test_loss: 1.2465, test_f1: 0.3706
 epoch: 15, train_loss: 1.1471, test_loss: 1.2579, test_f1: 0.3644
 epoch: 16, train_loss: 1.1410, test_loss: 1.2419, test_f1: 0.3810
 epoch: 17, train_loss: 1.1205, test_loss: 1.2644, test_f1: 0.4013
 epoch: 18, train_loss: 1.1235, test_loss: 1.2504, test_f1: 0.4482
 epoch: 19, train_loss: 1.1039, test_loss: 1.2428, test_f1: 0.4287
 epoch: 20, train_loss: 1.0961, test_loss: 1.2214, test_f1: 0.4313
 epoch: 21, train_loss: 1.0912, test_loss: 1.2274, test_f1: 0.4455
 epoch: 22, train_loss: 1.0816, test_loss: 1.2367, test_f1: 0.4613
 epoch: 23, train_loss: 1.0656, test_loss: 1.2062, test_f1: 0.4639
 epoch: 24, train_loss: 1.0684, test_loss: 1.1975, test_f1: 0.4476
 epoch: 25, train_loss: 1.0530, test_loss: 1.1684, test_f1: 0.4573
 epoch: 26, train_loss: 1.0569, test_loss: 1.1716, test_f1: 0.4777
 epoch: 27, train_loss: 1.0323, test_loss: 1.1672, test_f1: 0.4922
 epoch: 28, train_loss: 1.0329, test_loss: 1.1733, test_f1: 0.4830
 epoch: 29, train_loss: 1.0006, test_loss: 1.1436, test_f1: 0.5016
 epoch: 30, train_loss: 0.9994, test_loss: 1.1526, test_f1: 0.5142
 epoch: 31, train_loss: 0.9864, test_loss: 1.1716, test_f1: 0.4825
 epoch: 32, train_loss: 0.9979, test_loss: 1.1671, test_f1: 0.5128
 epoch: 33, train_loss: 0.9740, test_loss: 1.1610, test_f1: 0.4929
 epoch: 34, train_loss: 0.9800, test_loss: 1.1417, test_f1: 0.5067
 epoch: 35, train_loss: 0.9637, test_loss: 1.1518, test_f1: 0.4776
 epoch: 36, train_loss: 0.9686, test_loss: 1.1352, test_f1: 0.5073
 epoch: 37, train_loss: 0.9558, test_loss: 1.1332, test_f1: 0.4927
 epoch: 38, train_loss: 0.9442, test_loss: 1.1864, test_f1: 0.4829
 epoch: 39, train_loss: 0.9500, test_loss: 1.2412, test_f1: 0.4731
 epoch: 40, train_loss: 0.9610, test_loss: 1.1303, test_f1: 0.5211
 epoch: 41, train_loss: 0.9499, test_loss: 1.1556, test_f1: 0.4971
 epoch: 42, train_loss: 0.9365, test_loss: 1.1358, test_f1: 0.5179
 epoch: 43, train_loss: 0.9373, test_loss: 1.1686, test_f1: 0.5030
 epoch: 44, train_loss: 0.9086, test_loss: 1.1530, test_f1: 0.4965
 epoch: 45, train_loss: 0.9022, test_loss: 1.1757, test_f1: 0.5100
 epoch: 46, train_loss: 0.9126, test_loss: 1.2099, test_f1: 0.4863
 epoch: 47, train_loss: 0.9153, test_loss: 1.1515, test_f1: 0.4954
 epoch: 48, train_loss: 0.9218, test_loss: 1.1813, test_f1: 0.4648
 epoch: 49, train_loss: 0.8952, test_loss: 1.2357, test_f1: 0.4896
 epoch: 50, train_loss: 0.9114, test_loss: 1.1788, test_f1: 0.5171
 epoch: 51, train_loss: 0.8891, test_loss: 1.2322, test_f1: 0.5223
 epoch: 52, train_loss: 0.8842, test_loss: 1.1831, test_f1: 0.5086
 epoch: 53, train_loss: 0.8784, test_loss: 1.2280, test_f1: 0.4646
 epoch: 54, train_loss: 0.8728, test_loss: 1.1543, test_f1: 0.5036
 epoch: 55, train_loss: 0.8761, test_loss: 1.2052, test_f1: 0.4823
 epoch: 56, train_loss: 0.8711, test_loss: 1.1375, test_f1: 0.5231
 epoch: 57, train_loss: 0.8697, test_loss: 1.1552, test_f1: 0.5346
 epoch: 58, train_loss: 0.8692, test_loss: 1.1779, test_f1: 0.5129
 epoch: 59, train_loss: 0.8628, test_loss: 1.1757, test_f1: 0.5275
 epoch: 60, train_loss: 0.8638, test_loss: 1.1929, test_f1: 0.4873
 epoch: 61, train_loss: 0.8659, test_loss: 1.1746, test_f1: 0.5261
 epoch: 62, train_loss: 0.8601, test_loss: 1.1561, test_f1: 0.5265
 epoch: 63, train_loss: 0.8610, test_loss: 1.2537, test_f1: 0.5042
 epoch: 64, train_loss: 0.8751, test_loss: 1.2246, test_f1: 0.5142
 epoch: 65, train_loss: 0.8693, test_loss: 1.2596, test_f1: 0.4942
 epoch: 66, train_loss: 0.8654, test_loss: 1.2137, test_f1: 0.5353
 epoch: 67, train_loss: 0.8816, test_loss: 1.1999, test_f1: 0.5309
 epoch: 68, train_loss: 0.8595, test_loss: 1.2023, test_f1: 0.5263
 epoch: 69, train_loss: 0.8562, test_loss: 1.2121, test_f1: 0.5015
 epoch: 70, train_loss: 0.8557, test_loss: 1.1850, test_f1: 0.5356
 epoch: 71, train_loss: 0.8536, test_loss: 1.2464, test_f1: 0.5190
 epoch: 72, train_loss: 0.8430, test_loss: 1.2619, test_f1: 0.4946
 epoch: 73, train_loss: 0.8483, test_loss: 1.3070, test_f1: 0.4805
 epoch: 74, train_loss: 0.8603, test_loss: 1.1971, test_f1: 0.5261
 epoch: 75, train_loss: 0.8518, test_loss: 1.2633, test_f1: 0.5211
 epoch: 76, train_loss: 0.8494, test_loss: 1.3325, test_f1: 0.4666
 epoch: 77, train_loss: 0.8502, test_loss: 1.2770, test_f1: 0.5147
 epoch: 78, train_loss: 0.8512, test_loss: 1.2899, test_f1: 0.5055
 epoch: 79, train_loss: 0.8320, test_loss: 1.2877, test_f1: 0.5224
 epoch: 80, train_loss: 0.8355, test_loss: 1.2421, test_f1: 0.5394
 epoch: 81, train_loss: 0.8387, test_loss: 1.3086, test_f1: 0.4913
 epoch: 82, train_loss: 0.8297, test_loss: 1.3146, test_f1: 0.4809
 epoch: 83, train_loss: 0.8631, test_loss: 1.2601, test_f1: 0.5158
 epoch: 84, train_loss: 0.8349, test_loss: 1.2264, test_f1: 0.5329
 epoch: 85, train_loss: 0.8142, test_loss: 1.2629, test_f1: 0.5102
 epoch: 86, train_loss: 0.8380, test_loss: 1.2808, test_f1: 0.5201
 epoch: 87, train_loss: 0.8304, test_loss: 1.3384, test_f1: 0.5164
 epoch: 88, train_loss: 0.8294, test_loss: 1.2890, test_f1: 0.5095
 epoch: 89, train_loss: 0.8111, test_loss: 1.3062, test_f1: 0.5277
 epoch: 90, train_loss: 0.8313, test_loss: 1.3514, test_f1: 0.5145
 epoch: 91, train_loss: 0.8239, test_loss: 1.3974, test_f1: 0.5128
 epoch: 92, train_loss: 0.8243, test_loss: 1.2986, test_f1: 0.5094
 epoch: 93, train_loss: 0.8264, test_loss: 1.2950, test_f1: 0.5133
 epoch: 94, train_loss: 0.8294, test_loss: 1.3277, test_f1: 0.5165
 epoch: 95, train_loss: 0.8184, test_loss: 1.2554, test_f1: 0.5295
 epoch: 96, train_loss: 0.8314, test_loss: 1.3233, test_f1: 0.5244
 epoch: 97, train_loss: 0.8286, test_loss: 1.2878, test_f1: 0.5197
 epoch: 98, train_loss: 0.8190, test_loss: 1.3213, test_f1: 0.5362
 epoch: 99, train_loss: 0.8249, test_loss: 1.2427, test_f1: 0.5496
##################ITERATION #2 ****************************************
 epoch: 0, train_loss: 1.3686, test_loss: 1.3553, test_f1: 0.2281
 epoch: 1, train_loss: 1.2828, test_loss: 1.3138, test_f1: 0.2281
 epoch: 2, train_loss: 1.2615, test_loss: 1.2963, test_f1: 0.2281
 epoch: 3, train_loss: 1.2441, test_loss: 1.2875, test_f1: 0.2281
 epoch: 4, train_loss: 1.2268, test_loss: 1.2814, test_f1: 0.2281
 epoch: 5, train_loss: 1.2166, test_loss: 1.2698, test_f1: 0.2281
 epoch: 6, train_loss: 1.2096, test_loss: 1.2679, test_f1: 0.2281
 epoch: 7, train_loss: 1.1985, test_loss: 1.2675, test_f1: 0.2274
 epoch: 8, train_loss: 1.1892, test_loss: 1.2586, test_f1: 0.2815
 epoch: 9, train_loss: 1.1882, test_loss: 1.2579, test_f1: 0.3230
 epoch: 10, train_loss: 1.1738, test_loss: 1.2541, test_f1: 0.3068
 epoch: 11, train_loss: 1.1653, test_loss: 1.2445, test_f1: 0.3395
 epoch: 12, train_loss: 1.1584, test_loss: 1.2385, test_f1: 0.3740
 epoch: 13, train_loss: 1.1524, test_loss: 1.2321, test_f1: 0.3718
 epoch: 14, train_loss: 1.1386, test_loss: 1.2320, test_f1: 0.4009
 epoch: 15, train_loss: 1.1360, test_loss: 1.2255, test_f1: 0.3880
 epoch: 16, train_loss: 1.1380, test_loss: 1.2335, test_f1: 0.3459
 epoch: 17, train_loss: 1.1232, test_loss: 1.2285, test_f1: 0.4019
 epoch: 18, train_loss: 1.1085, test_loss: 1.2063, test_f1: 0.4211
 epoch: 19, train_loss: 1.1075, test_loss: 1.2076, test_f1: 0.4142
 epoch: 20, train_loss: 1.0974, test_loss: 1.1940, test_f1: 0.4358
 epoch: 21, train_loss: 1.0851, test_loss: 1.2161, test_f1: 0.4083
 epoch: 22, train_loss: 1.0915, test_loss: 1.1965, test_f1: 0.4115
 epoch: 23, train_loss: 1.0747, test_loss: 1.1937, test_f1: 0.4433
 epoch: 24, train_loss: 1.0640, test_loss: 1.2043, test_f1: 0.4430
 epoch: 25, train_loss: 1.0610, test_loss: 1.1891, test_f1: 0.4140
 epoch: 26, train_loss: 1.0371, test_loss: 1.1904, test_f1: 0.4776
 epoch: 27, train_loss: 1.0451, test_loss: 1.2149, test_f1: 0.4847
 epoch: 28, train_loss: 1.0337, test_loss: 1.2195, test_f1: 0.4757
 epoch: 29, train_loss: 1.0226, test_loss: 1.2229, test_f1: 0.4578
 epoch: 30, train_loss: 1.0213, test_loss: 1.1921, test_f1: 0.4715
 epoch: 31, train_loss: 1.0082, test_loss: 1.2282, test_f1: 0.4259
 epoch: 32, train_loss: 0.9947, test_loss: 1.2303, test_f1: 0.4230
 epoch: 33, train_loss: 0.9924, test_loss: 1.2146, test_f1: 0.4752
 epoch: 34, train_loss: 0.9880, test_loss: 1.2211, test_f1: 0.4462
 epoch: 35, train_loss: 0.9936, test_loss: 1.2064, test_f1: 0.5021
 epoch: 36, train_loss: 0.9936, test_loss: 1.2116, test_f1: 0.4434
 epoch: 37, train_loss: 0.9741, test_loss: 1.2350, test_f1: 0.4190
 epoch: 38, train_loss: 0.9672, test_loss: 1.2106, test_f1: 0.4804
 epoch: 39, train_loss: 0.9666, test_loss: 1.2365, test_f1: 0.4411
 epoch: 40, train_loss: 0.9599, test_loss: 1.1998, test_f1: 0.4421
 epoch: 41, train_loss: 0.9564, test_loss: 1.2010, test_f1: 0.4462
 epoch: 42, train_loss: 0.9422, test_loss: 1.2236, test_f1: 0.4510
 epoch: 43, train_loss: 0.9461, test_loss: 1.2350, test_f1: 0.4973
 epoch: 44, train_loss: 0.9427, test_loss: 1.2213, test_f1: 0.4998
 epoch: 45, train_loss: 0.9438, test_loss: 1.2823, test_f1: 0.4461
 epoch: 46, train_loss: 0.9304, test_loss: 1.2262, test_f1: 0.4940
 epoch: 47, train_loss: 0.9321, test_loss: 1.2355, test_f1: 0.4813
 epoch: 48, train_loss: 0.9351, test_loss: 1.2837, test_f1: 0.4862
 epoch: 49, train_loss: 0.9203, test_loss: 1.2380, test_f1: 0.4799
 epoch: 50, train_loss: 0.9179, test_loss: 1.2656, test_f1: 0.4429
 epoch: 51, train_loss: 0.9248, test_loss: 1.3097, test_f1: 0.4463
 epoch: 52, train_loss: 0.9104, test_loss: 1.2878, test_f1: 0.4417
 epoch: 53, train_loss: 0.8864, test_loss: 1.2856, test_f1: 0.4626
 epoch: 54, train_loss: 0.9032, test_loss: 1.3210, test_f1: 0.4544
 epoch: 55, train_loss: 0.8912, test_loss: 1.3329, test_f1: 0.4735
 epoch: 56, train_loss: 0.8888, test_loss: 1.3115, test_f1: 0.4718
 epoch: 57, train_loss: 0.8963, test_loss: 1.3009, test_f1: 0.4977
 epoch: 58, train_loss: 0.8794, test_loss: 1.2571, test_f1: 0.5038
 epoch: 59, train_loss: 0.8896, test_loss: 1.3046, test_f1: 0.4512
 epoch: 60, train_loss: 0.8845, test_loss: 1.3136, test_f1: 0.4924
 epoch: 61, train_loss: 0.8785, test_loss: 1.2842, test_f1: 0.4715
 epoch: 62, train_loss: 0.8743, test_loss: 1.3610, test_f1: 0.4640
 epoch: 63, train_loss: 0.8762, test_loss: 1.3757, test_f1: 0.4443
 epoch: 64, train_loss: 0.8810, test_loss: 1.3749, test_f1: 0.4749
 epoch: 65, train_loss: 0.8771, test_loss: 1.3514, test_f1: 0.5018
 epoch: 66, train_loss: 0.8734, test_loss: 1.3029, test_f1: 0.4745
 epoch: 67, train_loss: 0.8726, test_loss: 1.1964, test_f1: 0.5221
 epoch: 68, train_loss: 0.8602, test_loss: 1.2287, test_f1: 0.4963
 epoch: 69, train_loss: 0.8656, test_loss: 1.2688, test_f1: 0.4606
 epoch: 70, train_loss: 0.8614, test_loss: 1.2890, test_f1: 0.4762
 epoch: 71, train_loss: 0.8519, test_loss: 1.2725, test_f1: 0.4957
 epoch: 72, train_loss: 0.8669, test_loss: 1.3842, test_f1: 0.4815
 epoch: 73, train_loss: 0.8576, test_loss: 1.2930, test_f1: 0.4674
 epoch: 74, train_loss: 0.8579, test_loss: 1.2776, test_f1: 0.4675
 epoch: 75, train_loss: 0.8355, test_loss: 1.2612, test_f1: 0.5064
 epoch: 76, train_loss: 0.8677, test_loss: 1.2737, test_f1: 0.4473
 epoch: 77, train_loss: 0.8543, test_loss: 1.2412, test_f1: 0.5001
 epoch: 78, train_loss: 0.8611, test_loss: 1.3301, test_f1: 0.4659
 epoch: 79, train_loss: 0.8492, test_loss: 1.4517, test_f1: 0.4913
 epoch: 80, train_loss: 0.8556, test_loss: 1.2954, test_f1: 0.4667
 epoch: 81, train_loss: 0.8424, test_loss: 1.4734, test_f1: 0.4551
 epoch: 82, train_loss: 0.8266, test_loss: 1.5406, test_f1: 0.4389
 epoch: 83, train_loss: 0.8389, test_loss: 1.4339, test_f1: 0.4686
 epoch: 84, train_loss: 0.8282, test_loss: 1.4209, test_f1: 0.4681
 epoch: 85, train_loss: 0.8375, test_loss: 1.4394, test_f1: 0.4739
 epoch: 86, train_loss: 0.8349, test_loss: 1.4644, test_f1: 0.4359
 epoch: 87, train_loss: 0.8490, test_loss: 1.3242, test_f1: 0.5014
 epoch: 88, train_loss: 0.8432, test_loss: 1.3378, test_f1: 0.5075
 epoch: 89, train_loss: 0.8232, test_loss: 1.4539, test_f1: 0.4377
 epoch: 90, train_loss: 0.8240, test_loss: 1.3257, test_f1: 0.4770
 epoch: 91, train_loss: 0.8224, test_loss: 1.3183, test_f1: 0.4966
 epoch: 92, train_loss: 0.8471, test_loss: 1.3074, test_f1: 0.4926
 epoch: 93, train_loss: 0.8192, test_loss: 1.3591, test_f1: 0.4723
 epoch: 94, train_loss: 0.8307, test_loss: 1.4712, test_f1: 0.4752
 epoch: 95, train_loss: 0.8320, test_loss: 1.4194, test_f1: 0.4562
 epoch: 96, train_loss: 0.8267, test_loss: 1.4244, test_f1: 0.4543
 epoch: 97, train_loss: 0.8101, test_loss: 1.4344, test_f1: 0.4641
 epoch: 98, train_loss: 0.8329, test_loss: 1.3798, test_f1: 0.4777
 epoch: 99, train_loss: 0.8068, test_loss: 1.4063, test_f1: 0.4701
##################ITERATION #3 ****************************************
 epoch: 0, train_loss: 1.3315, test_loss: 1.3460, test_f1: 0.2281
 epoch: 1, train_loss: 1.2411, test_loss: 1.3011, test_f1: 0.2281
 epoch: 2, train_loss: 1.1923, test_loss: 1.2786, test_f1: 0.2270
 epoch: 3, train_loss: 1.1884, test_loss: 1.2510, test_f1: 0.2974
 epoch: 4, train_loss: 1.1634, test_loss: 1.2371, test_f1: 0.3395
 epoch: 5, train_loss: 1.1380, test_loss: 1.2231, test_f1: 0.3666
 epoch: 6, train_loss: 1.1167, test_loss: 1.2163, test_f1: 0.3685
 epoch: 7, train_loss: 1.1071, test_loss: 1.2070, test_f1: 0.3926
 epoch: 8, train_loss: 1.0960, test_loss: 1.2172, test_f1: 0.4331
 epoch: 9, train_loss: 1.0850, test_loss: 1.2145, test_f1: 0.4166
 epoch: 10, train_loss: 1.0854, test_loss: 1.1970, test_f1: 0.4337
 epoch: 11, train_loss: 1.0601, test_loss: 1.1916, test_f1: 0.4299
 epoch: 12, train_loss: 1.0548, test_loss: 1.1842, test_f1: 0.4394
 epoch: 13, train_loss: 1.0545, test_loss: 1.1540, test_f1: 0.4719
 epoch: 14, train_loss: 1.0350, test_loss: 1.1855, test_f1: 0.4523
 epoch: 15, train_loss: 1.0138, test_loss: 1.1813, test_f1: 0.4765
 epoch: 16, train_loss: 1.0228, test_loss: 1.1813, test_f1: 0.5069
 epoch: 17, train_loss: 1.0006, test_loss: 1.1925, test_f1: 0.5182
 epoch: 18, train_loss: 1.0068, test_loss: 1.1772, test_f1: 0.5152
 epoch: 19, train_loss: 0.9915, test_loss: 1.1800, test_f1: 0.5098
 epoch: 20, train_loss: 0.9841, test_loss: 1.1662, test_f1: 0.5131
 epoch: 21, train_loss: 0.9853, test_loss: 1.1597, test_f1: 0.5228
 epoch: 22, train_loss: 0.9799, test_loss: 1.1421, test_f1: 0.5281
 epoch: 23, train_loss: 0.9870, test_loss: 1.1720, test_f1: 0.5045
 epoch: 24, train_loss: 0.9641, test_loss: 1.1450, test_f1: 0.5315
 epoch: 25, train_loss: 0.9466, test_loss: 1.1585, test_f1: 0.5365
 epoch: 26, train_loss: 0.9542, test_loss: 1.1691, test_f1: 0.5429
 epoch: 27, train_loss: 0.9326, test_loss: 1.1502, test_f1: 0.5553
 epoch: 28, train_loss: 0.9549, test_loss: 1.1764, test_f1: 0.5575
 epoch: 29, train_loss: 0.9373, test_loss: 1.1783, test_f1: 0.5516
 epoch: 30, train_loss: 0.9319, test_loss: 1.1491, test_f1: 0.5579
 epoch: 31, train_loss: 0.9208, test_loss: 1.1495, test_f1: 0.5280
 epoch: 32, train_loss: 0.9166, test_loss: 1.1528, test_f1: 0.5454
 epoch: 33, train_loss: 0.9070, test_loss: 1.1404, test_f1: 0.5516
 epoch: 34, train_loss: 0.9136, test_loss: 1.1640, test_f1: 0.5409
 epoch: 35, train_loss: 0.9021, test_loss: 1.1645, test_f1: 0.5453
 epoch: 36, train_loss: 0.9039, test_loss: 1.1921, test_f1: 0.5519
 epoch: 37, train_loss: 0.9115, test_loss: 1.1903, test_f1: 0.5285
 epoch: 38, train_loss: 0.8940, test_loss: 1.1907, test_f1: 0.5379
 epoch: 39, train_loss: 0.8935, test_loss: 1.1905, test_f1: 0.5066
 epoch: 40, train_loss: 0.8958, test_loss: 1.2110, test_f1: 0.5394
 epoch: 41, train_loss: 0.9024, test_loss: 1.2021, test_f1: 0.5180
 epoch: 42, train_loss: 0.8992, test_loss: 1.2081, test_f1: 0.5427
 epoch: 43, train_loss: 0.8773, test_loss: 1.2329, test_f1: 0.5207
 epoch: 44, train_loss: 0.8776, test_loss: 1.2417, test_f1: 0.5362
 epoch: 45, train_loss: 0.8663, test_loss: 1.2329, test_f1: 0.5228
 epoch: 46, train_loss: 0.8777, test_loss: 1.2774, test_f1: 0.5117
 epoch: 47, train_loss: 0.8646, test_loss: 1.2986, test_f1: 0.5180
 epoch: 48, train_loss: 0.8459, test_loss: 1.3080, test_f1: 0.5097
 epoch: 49, train_loss: 0.8673, test_loss: 1.3056, test_f1: 0.5098
 epoch: 50, train_loss: 0.8364, test_loss: 1.2671, test_f1: 0.5281
 epoch: 51, train_loss: 0.8479, test_loss: 1.2662, test_f1: 0.5191
 epoch: 52, train_loss: 0.8348, test_loss: 1.2661, test_f1: 0.5193
 epoch: 53, train_loss: 0.8405, test_loss: 1.2633, test_f1: 0.5178
 epoch: 54, train_loss: 0.8338, test_loss: 1.2800, test_f1: 0.5207
 epoch: 55, train_loss: 0.8435, test_loss: 1.2810, test_f1: 0.5102
 epoch: 56, train_loss: 0.8334, test_loss: 1.2571, test_f1: 0.5313
 epoch: 57, train_loss: 0.8384, test_loss: 1.2423, test_f1: 0.5271
 epoch: 58, train_loss: 0.8254, test_loss: 1.2766, test_f1: 0.5233
 epoch: 59, train_loss: 0.8308, test_loss: 1.2540, test_f1: 0.5384
 epoch: 60, train_loss: 0.8238, test_loss: 1.2757, test_f1: 0.5238
 epoch: 61, train_loss: 0.8338, test_loss: 1.3161, test_f1: 0.5095
 epoch: 62, train_loss: 0.8152, test_loss: 1.2808, test_f1: 0.5355
 epoch: 63, train_loss: 0.8072, test_loss: 1.2819, test_f1: 0.5277
 epoch: 64, train_loss: 0.8232, test_loss: 1.2987, test_f1: 0.5062
 epoch: 65, train_loss: 0.8143, test_loss: 1.3119, test_f1: 0.5231
 epoch: 66, train_loss: 0.8186, test_loss: 1.3316, test_f1: 0.5146
 epoch: 67, train_loss: 0.8144, test_loss: 1.3711, test_f1: 0.4993
 epoch: 68, train_loss: 0.8168, test_loss: 1.3233, test_f1: 0.5252
 epoch: 69, train_loss: 0.8029, test_loss: 1.3008, test_f1: 0.5136
 epoch: 70, train_loss: 0.8192, test_loss: 1.3239, test_f1: 0.5068
 epoch: 71, train_loss: 0.8353, test_loss: 1.3312, test_f1: 0.5124
 epoch: 72, train_loss: 0.8083, test_loss: 1.3048, test_f1: 0.5276
 epoch: 73, train_loss: 0.8222, test_loss: 1.2736, test_f1: 0.5320
 epoch: 74, train_loss: 0.8234, test_loss: 1.2499, test_f1: 0.5440
 epoch: 75, train_loss: 0.7986, test_loss: 1.2754, test_f1: 0.5236
 epoch: 76, train_loss: 0.8080, test_loss: 1.3253, test_f1: 0.5249
 epoch: 77, train_loss: 0.7973, test_loss: 1.3667, test_f1: 0.5151
 epoch: 78, train_loss: 0.7969, test_loss: 1.3564, test_f1: 0.5338
 epoch: 79, train_loss: 0.8103, test_loss: 1.3823, test_f1: 0.5348
 epoch: 80, train_loss: 0.7928, test_loss: 1.3902, test_f1: 0.5187
 epoch: 81, train_loss: 0.8175, test_loss: 1.3996, test_f1: 0.5200
 epoch: 82, train_loss: 0.7949, test_loss: 1.3646, test_f1: 0.5224
 epoch: 83, train_loss: 0.8001, test_loss: 1.3324, test_f1: 0.5252
 epoch: 84, train_loss: 0.7939, test_loss: 1.3248, test_f1: 0.5211
 epoch: 85, train_loss: 0.7757, test_loss: 1.3781, test_f1: 0.5147
 epoch: 86, train_loss: 0.7841, test_loss: 1.4322, test_f1: 0.4771
 epoch: 87, train_loss: 0.7894, test_loss: 1.3831, test_f1: 0.5023
 epoch: 88, train_loss: 0.8017, test_loss: 1.4479, test_f1: 0.5210
 epoch: 89, train_loss: 0.7704, test_loss: 1.4345, test_f1: 0.4930
 epoch: 90, train_loss: 0.7840, test_loss: 1.4215, test_f1: 0.5042
 epoch: 91, train_loss: 0.7959, test_loss: 1.3909, test_f1: 0.5187
 epoch: 92, train_loss: 0.8032, test_loss: 1.3733, test_f1: 0.5223
 epoch: 93, train_loss: 0.7855, test_loss: 1.3551, test_f1: 0.5165
 epoch: 94, train_loss: 0.7872, test_loss: 1.3509, test_f1: 0.5073
 epoch: 95, train_loss: 0.8000, test_loss: 1.3628, test_f1: 0.5293
 epoch: 96, train_loss: 0.7923, test_loss: 1.4138, test_f1: 0.5052
 epoch: 97, train_loss: 0.7861, test_loss: 1.4082, test_f1: 0.5134
 epoch: 98, train_loss: 0.7941, test_loss: 1.4001, test_f1: 0.5125
 epoch: 99, train_loss: 0.7805, test_loss: 1.3685, test_f1: 0.5285
##################ITERATION #4 ****************************************
 epoch: 0, train_loss: 1.3333, test_loss: 1.3689, test_f1: 0.2404
 epoch: 1, train_loss: 1.2383, test_loss: 1.4134, test_f1: 0.2404
 epoch: 2, train_loss: 1.2258, test_loss: 1.4392, test_f1: 0.2404
 epoch: 3, train_loss: 1.2158, test_loss: 1.4653, test_f1: 0.2672
 epoch: 4, train_loss: 1.1885, test_loss: 1.4018, test_f1: 0.2834
 epoch: 5, train_loss: 1.1911, test_loss: 1.3280, test_f1: 0.3024
 epoch: 6, train_loss: 1.1794, test_loss: 1.3061, test_f1: 0.3043
 epoch: 7, train_loss: 1.1625, test_loss: 1.3159, test_f1: 0.2935
 epoch: 8, train_loss: 1.1484, test_loss: 1.3068, test_f1: 0.2955
 epoch: 9, train_loss: 1.1428, test_loss: 1.2983, test_f1: 0.3126
 epoch: 10, train_loss: 1.1382, test_loss: 1.2980, test_f1: 0.3239
 epoch: 11, train_loss: 1.1211, test_loss: 1.2760, test_f1: 0.3358
 epoch: 12, train_loss: 1.1291, test_loss: 1.2549, test_f1: 0.3542
 epoch: 13, train_loss: 1.1224, test_loss: 1.2480, test_f1: 0.3733
 epoch: 14, train_loss: 1.1123, test_loss: 1.2408, test_f1: 0.3799
 epoch: 15, train_loss: 1.1069, test_loss: 1.2530, test_f1: 0.3791
 epoch: 16, train_loss: 1.0957, test_loss: 1.2461, test_f1: 0.3947
 epoch: 17, train_loss: 1.0884, test_loss: 1.2354, test_f1: 0.3902
 epoch: 18, train_loss: 1.0878, test_loss: 1.2454, test_f1: 0.4332
 epoch: 19, train_loss: 1.0776, test_loss: 1.2627, test_f1: 0.4182
 epoch: 20, train_loss: 1.0679, test_loss: 1.2513, test_f1: 0.4105
 epoch: 21, train_loss: 1.0594, test_loss: 1.2936, test_f1: 0.4227
 epoch: 22, train_loss: 1.0477, test_loss: 1.2577, test_f1: 0.4172
 epoch: 23, train_loss: 1.0455, test_loss: 1.2080, test_f1: 0.4280
 epoch: 24, train_loss: 1.0428, test_loss: 1.2294, test_f1: 0.4578
 epoch: 25, train_loss: 1.0289, test_loss: 1.2083, test_f1: 0.4652
 epoch: 26, train_loss: 1.0412, test_loss: 1.2515, test_f1: 0.4571
 epoch: 27, train_loss: 1.0297, test_loss: 1.2753, test_f1: 0.4867
 epoch: 28, train_loss: 1.0177, test_loss: 1.2346, test_f1: 0.4755
 epoch: 29, train_loss: 1.0223, test_loss: 1.2499, test_f1: 0.4567
 epoch: 30, train_loss: 1.0081, test_loss: 1.3064, test_f1: 0.4253
 epoch: 31, train_loss: 0.9966, test_loss: 1.3125, test_f1: 0.4788
 epoch: 32, train_loss: 0.9996, test_loss: 1.3116, test_f1: 0.4880
 epoch: 33, train_loss: 0.9916, test_loss: 1.3146, test_f1: 0.4146
 epoch: 34, train_loss: 0.9873, test_loss: 1.3032, test_f1: 0.4592
 epoch: 35, train_loss: 0.9859, test_loss: 1.2886, test_f1: 0.4841
 epoch: 36, train_loss: 0.9988, test_loss: 1.3984, test_f1: 0.5092
 epoch: 37, train_loss: 0.9739, test_loss: 1.3809, test_f1: 0.4947
 epoch: 38, train_loss: 0.9486, test_loss: 1.2574, test_f1: 0.5069
 epoch: 39, train_loss: 0.9665, test_loss: 1.2046, test_f1: 0.5299
 epoch: 40, train_loss: 0.9696, test_loss: 1.2212, test_f1: 0.5139
 epoch: 41, train_loss: 0.9492, test_loss: 1.3026, test_f1: 0.4848
 epoch: 42, train_loss: 0.9475, test_loss: 1.4777, test_f1: 0.5249
 epoch: 43, train_loss: 0.9481, test_loss: 1.3721, test_f1: 0.5279
 epoch: 44, train_loss: 0.9303, test_loss: 1.3211, test_f1: 0.5596
 epoch: 45, train_loss: 0.9345, test_loss: 1.4535, test_f1: 0.5468
 epoch: 46, train_loss: 0.9269, test_loss: 1.3244, test_f1: 0.5260
 epoch: 47, train_loss: 0.9392, test_loss: 1.4002, test_f1: 0.5418
 epoch: 48, train_loss: 0.9265, test_loss: 1.3408, test_f1: 0.5191
 epoch: 49, train_loss: 0.9296, test_loss: 1.2709, test_f1: 0.5485
 epoch: 50, train_loss: 0.9282, test_loss: 1.1540, test_f1: 0.5434
 epoch: 51, train_loss: 0.8946, test_loss: 1.2495, test_f1: 0.5373
 epoch: 52, train_loss: 0.8971, test_loss: 1.1923, test_f1: 0.5310
 epoch: 53, train_loss: 0.8989, test_loss: 1.1971, test_f1: 0.5356
 epoch: 54, train_loss: 0.9039, test_loss: 1.1964, test_f1: 0.5375
 epoch: 55, train_loss: 0.9006, test_loss: 1.2079, test_f1: 0.5363
 epoch: 56, train_loss: 0.8978, test_loss: 1.2232, test_f1: 0.5373
 epoch: 57, train_loss: 0.8915, test_loss: 1.1915, test_f1: 0.5507
 epoch: 58, train_loss: 0.8823, test_loss: 1.1597, test_f1: 0.5493
 epoch: 59, train_loss: 0.8955, test_loss: 1.1704, test_f1: 0.5494
 epoch: 60, train_loss: 0.8786, test_loss: 1.1960, test_f1: 0.5640
 epoch: 61, train_loss: 0.8833, test_loss: 1.2069, test_f1: 0.5491
 epoch: 62, train_loss: 0.8845, test_loss: 1.2581, test_f1: 0.5555
 epoch: 63, train_loss: 0.8840, test_loss: 1.3005, test_f1: 0.5524
 epoch: 64, train_loss: 0.8799, test_loss: 1.2975, test_f1: 0.5492
 epoch: 65, train_loss: 0.8662, test_loss: 1.2598, test_f1: 0.5570
 epoch: 66, train_loss: 0.8765, test_loss: 1.3268, test_f1: 0.5520
 epoch: 67, train_loss: 0.8724, test_loss: 1.2909, test_f1: 0.5710
 epoch: 68, train_loss: 0.8741, test_loss: 1.2946, test_f1: 0.5485
 epoch: 69, train_loss: 0.8656, test_loss: 1.3052, test_f1: 0.5557
 epoch: 70, train_loss: 0.8659, test_loss: 1.2255, test_f1: 0.5547
 epoch: 71, train_loss: 0.8730, test_loss: 1.2422, test_f1: 0.5664
 epoch: 72, train_loss: 0.8586, test_loss: 1.3121, test_f1: 0.5628
 epoch: 73, train_loss: 0.8627, test_loss: 1.3108, test_f1: 0.5633
 epoch: 74, train_loss: 0.8510, test_loss: 1.2891, test_f1: 0.5659
 epoch: 75, train_loss: 0.8589, test_loss: 1.2651, test_f1: 0.5640
 epoch: 76, train_loss: 0.8562, test_loss: 1.2165, test_f1: 0.5610
 epoch: 77, train_loss: 0.8555, test_loss: 1.2567, test_f1: 0.5627
 epoch: 78, train_loss: 0.8569, test_loss: 1.2581, test_f1: 0.5736
 epoch: 79, train_loss: 0.8479, test_loss: 1.2956, test_f1: 0.5861
 epoch: 80, train_loss: 0.8321, test_loss: 1.2226, test_f1: 0.5912
 epoch: 81, train_loss: 0.8385, test_loss: 1.3653, test_f1: 0.5648
 epoch: 82, train_loss: 0.8480, test_loss: 1.3422, test_f1: 0.5737
 epoch: 83, train_loss: 0.8269, test_loss: 1.3347, test_f1: 0.5567
 epoch: 84, train_loss: 0.8290, test_loss: 1.3039, test_f1: 0.5556
 epoch: 85, train_loss: 0.8286, test_loss: 1.3826, test_f1: 0.5609
 epoch: 86, train_loss: 0.8323, test_loss: 1.4150, test_f1: 0.5609
 epoch: 87, train_loss: 0.8435, test_loss: 1.4125, test_f1: 0.5583
 epoch: 88, train_loss: 0.8428, test_loss: 1.4222, test_f1: 0.5608
 epoch: 89, train_loss: 0.8175, test_loss: 1.3952, test_f1: 0.5669
 epoch: 90, train_loss: 0.8135, test_loss: 1.3422, test_f1: 0.5611
 epoch: 91, train_loss: 0.8134, test_loss: 1.4112, test_f1: 0.5459
 epoch: 92, train_loss: 0.8076, test_loss: 1.4507, test_f1: 0.5448
 epoch: 93, train_loss: 0.8143, test_loss: 1.5166, test_f1: 0.5437
 epoch: 94, train_loss: 0.8220, test_loss: 1.4727, test_f1: 0.5430
 epoch: 95, train_loss: 0.8202, test_loss: 1.4637, test_f1: 0.5488
 epoch: 96, train_loss: 0.8174, test_loss: 1.4210, test_f1: 0.5507
 epoch: 97, train_loss: 0.7994, test_loss: 1.4634, test_f1: 0.5197
 epoch: 98, train_loss: 0.8066, test_loss: 1.4177, test_f1: 0.5180
 epoch: 99, train_loss: 0.8112, test_loss: 1.4062, test_f1: 0.5432
##################ITERATION #5 ****************************************
 epoch: 0, train_loss: 1.3046, test_loss: 1.3572, test_f1: 0.2281
 epoch: 1, train_loss: 1.2704, test_loss: 1.3343, test_f1: 0.2281
 epoch: 2, train_loss: 1.2499, test_loss: 1.3182, test_f1: 0.2281
 epoch: 3, train_loss: 1.2256, test_loss: 1.3022, test_f1: 0.2248
 epoch: 4, train_loss: 1.2175, test_loss: 1.2933, test_f1: 0.2238
 epoch: 5, train_loss: 1.2154, test_loss: 1.2757, test_f1: 0.2246
 epoch: 6, train_loss: 1.2108, test_loss: 1.2633, test_f1: 0.2378
 epoch: 7, train_loss: 1.1964, test_loss: 1.2602, test_f1: 0.2743
 epoch: 8, train_loss: 1.1978, test_loss: 1.2460, test_f1: 0.3064
 epoch: 9, train_loss: 1.1824, test_loss: 1.2400, test_f1: 0.2880
 epoch: 10, train_loss: 1.1771, test_loss: 1.2395, test_f1: 0.3033
 epoch: 11, train_loss: 1.1772, test_loss: 1.2391, test_f1: 0.3167
 epoch: 12, train_loss: 1.1737, test_loss: 1.2309, test_f1: 0.3213
 epoch: 13, train_loss: 1.1647, test_loss: 1.2357, test_f1: 0.3147
 epoch: 14, train_loss: 1.1615, test_loss: 1.2365, test_f1: 0.3354
 epoch: 15, train_loss: 1.1654, test_loss: 1.2297, test_f1: 0.3416
 epoch: 16, train_loss: 1.1615, test_loss: 1.2253, test_f1: 0.3822
 epoch: 17, train_loss: 1.1490, test_loss: 1.2199, test_f1: 0.3861
 epoch: 18, train_loss: 1.1455, test_loss: 1.2241, test_f1: 0.3530
 epoch: 19, train_loss: 1.1490, test_loss: 1.2235, test_f1: 0.3526
 epoch: 20, train_loss: 1.1422, test_loss: 1.2329, test_f1: 0.3621
 epoch: 21, train_loss: 1.1280, test_loss: 1.2260, test_f1: 0.3539
 epoch: 22, train_loss: 1.1303, test_loss: 1.2284, test_f1: 0.3468
 epoch: 23, train_loss: 1.1163, test_loss: 1.2078, test_f1: 0.3511
 epoch: 24, train_loss: 1.1326, test_loss: 1.2132, test_f1: 0.3583
 epoch: 25, train_loss: 1.1277, test_loss: 1.2069, test_f1: 0.3743
 epoch: 26, train_loss: 1.1126, test_loss: 1.2313, test_f1: 0.3684
 epoch: 27, train_loss: 1.1243, test_loss: 1.2119, test_f1: 0.3497
 epoch: 28, train_loss: 1.0974, test_loss: 1.1984, test_f1: 0.3569
 epoch: 29, train_loss: 1.1139, test_loss: 1.1874, test_f1: 0.3790
 epoch: 30, train_loss: 1.0984, test_loss: 1.2025, test_f1: 0.3419
 epoch: 31, train_loss: 1.1050, test_loss: 1.2012, test_f1: 0.3469
 epoch: 32, train_loss: 1.0759, test_loss: 1.1935, test_f1: 0.3693
 epoch: 33, train_loss: 1.0912, test_loss: 1.1990, test_f1: 0.3345
 epoch: 34, train_loss: 1.0754, test_loss: 1.2042, test_f1: 0.3426
 epoch: 35, train_loss: 1.0860, test_loss: 1.1932, test_f1: 0.3900
 epoch: 36, train_loss: 1.0821, test_loss: 1.2198, test_f1: 0.3523
 epoch: 37, train_loss: 1.1000, test_loss: 1.2193, test_f1: 0.3496
 epoch: 38, train_loss: 1.0753, test_loss: 1.1635, test_f1: 0.3675
 epoch: 39, train_loss: 1.0640, test_loss: 1.2131, test_f1: 0.3851
 epoch: 40, train_loss: 1.0655, test_loss: 1.2133, test_f1: 0.4152
 epoch: 41, train_loss: 1.0703, test_loss: 1.1847, test_f1: 0.4117
 epoch: 42, train_loss: 1.0561, test_loss: 1.1974, test_f1: 0.3533
 epoch: 43, train_loss: 1.0495, test_loss: 1.1699, test_f1: 0.3760
 epoch: 44, train_loss: 1.0575, test_loss: 1.1890, test_f1: 0.3785
 epoch: 45, train_loss: 1.0444, test_loss: 1.2193, test_f1: 0.3837
 epoch: 46, train_loss: 1.0493, test_loss: 1.1848, test_f1: 0.4064
 epoch: 47, train_loss: 1.0416, test_loss: 1.2095, test_f1: 0.3771
 epoch: 48, train_loss: 1.0325, test_loss: 1.1972, test_f1: 0.3857
 epoch: 49, train_loss: 1.0316, test_loss: 1.1822, test_f1: 0.4066
 epoch: 50, train_loss: 1.0346, test_loss: 1.2497, test_f1: 0.3656
 epoch: 51, train_loss: 1.0258, test_loss: 1.2509, test_f1: 0.3752
 epoch: 52, train_loss: 1.0078, test_loss: 1.2129, test_f1: 0.3898
 epoch: 53, train_loss: 1.0244, test_loss: 1.2190, test_f1: 0.4006
 epoch: 54, train_loss: 1.0158, test_loss: 1.1999, test_f1: 0.4188
 epoch: 55, train_loss: 1.0091, test_loss: 1.1971, test_f1: 0.4026
 epoch: 56, train_loss: 1.0146, test_loss: 1.1574, test_f1: 0.4289
 epoch: 57, train_loss: 1.0321, test_loss: 1.1893, test_f1: 0.4116
 epoch: 58, train_loss: 1.0104, test_loss: 1.2260, test_f1: 0.4032
 epoch: 59, train_loss: 1.0047, test_loss: 1.2279, test_f1: 0.3942
 epoch: 60, train_loss: 1.0177, test_loss: 1.2318, test_f1: 0.4066
 epoch: 61, train_loss: 0.9904, test_loss: 1.1664, test_f1: 0.4088
 epoch: 62, train_loss: 0.9942, test_loss: 1.1772, test_f1: 0.4302
 epoch: 63, train_loss: 1.0069, test_loss: 1.1561, test_f1: 0.4181
 epoch: 64, train_loss: 0.9879, test_loss: 1.1690, test_f1: 0.4167
 epoch: 65, train_loss: 0.9989, test_loss: 1.1963, test_f1: 0.4364
 epoch: 66, train_loss: 1.0091, test_loss: 1.1784, test_f1: 0.4302
 epoch: 67, train_loss: 0.9921, test_loss: 1.1719, test_f1: 0.4436
 epoch: 68, train_loss: 0.9852, test_loss: 1.2209, test_f1: 0.4459
 epoch: 69, train_loss: 0.9890, test_loss: 1.2158, test_f1: 0.4339
 epoch: 70, train_loss: 1.0019, test_loss: 1.1511, test_f1: 0.4640
 epoch: 71, train_loss: 0.9794, test_loss: 1.1695, test_f1: 0.4402
 epoch: 72, train_loss: 0.9788, test_loss: 1.2063, test_f1: 0.4395
 epoch: 73, train_loss: 0.9794, test_loss: 1.1968, test_f1: 0.4288
 epoch: 74, train_loss: 0.9732, test_loss: 1.1920, test_f1: 0.4412
 epoch: 75, train_loss: 0.9730, test_loss: 1.1785, test_f1: 0.4553
 epoch: 76, train_loss: 0.9669, test_loss: 1.1942, test_f1: 0.4429
 epoch: 77, train_loss: 0.9751, test_loss: 1.2335, test_f1: 0.4254
 epoch: 78, train_loss: 0.9639, test_loss: 1.2158, test_f1: 0.4469
 epoch: 79, train_loss: 0.9794, test_loss: 1.1600, test_f1: 0.4454
 epoch: 80, train_loss: 0.9850, test_loss: 1.2086, test_f1: 0.4371
 epoch: 81, train_loss: 0.9715, test_loss: 1.2288, test_f1: 0.4500
 epoch: 82, train_loss: 0.9636, test_loss: 1.2121, test_f1: 0.4739
 epoch: 83, train_loss: 0.9608, test_loss: 1.1995, test_f1: 0.4467
 epoch: 84, train_loss: 0.9668, test_loss: 1.2172, test_f1: 0.4479
 epoch: 85, train_loss: 0.9722, test_loss: 1.1994, test_f1: 0.4655
 epoch: 86, train_loss: 0.9614, test_loss: 1.2283, test_f1: 0.4557
 epoch: 87, train_loss: 0.9514, test_loss: 1.2201, test_f1: 0.4521
 epoch: 88, train_loss: 0.9387, test_loss: 1.2835, test_f1: 0.4368
 epoch: 89, train_loss: 0.9480, test_loss: 1.2908, test_f1: 0.4469
 epoch: 90, train_loss: 0.9483, test_loss: 1.2428, test_f1: 0.4719
 epoch: 91, train_loss: 0.9652, test_loss: 1.2754, test_f1: 0.4452
 epoch: 92, train_loss: 0.9377, test_loss: 1.2693, test_f1: 0.4338
 epoch: 93, train_loss: 0.9399, test_loss: 1.2468, test_f1: 0.4559
 epoch: 94, train_loss: 0.9531, test_loss: 1.2401, test_f1: 0.4623
 epoch: 95, train_loss: 0.9542, test_loss: 1.2720, test_f1: 0.4530
 epoch: 96, train_loss: 0.9399, test_loss: 1.2049, test_f1: 0.4464
 epoch: 97, train_loss: 0.9551, test_loss: 1.2108, test_f1: 0.4484
 epoch: 98, train_loss: 0.9454, test_loss: 1.2699, test_f1: 0.4401
 epoch: 99, train_loss: 0.9333, test_loss: 1.2848, test_f1: 0.4595
##################ITERATION #6 ****************************************
 epoch: 0, train_loss: 1.2924, test_loss: 1.3741, test_f1: 0.2404
 epoch: 1, train_loss: 1.2479, test_loss: 1.3705, test_f1: 0.2404
 epoch: 2, train_loss: 1.2395, test_loss: 1.3504, test_f1: 0.2404
 epoch: 3, train_loss: 1.2203, test_loss: 1.3567, test_f1: 0.2430
 epoch: 4, train_loss: 1.2097, test_loss: 1.3490, test_f1: 0.2721
 epoch: 5, train_loss: 1.2096, test_loss: 1.3371, test_f1: 0.3041
 epoch: 6, train_loss: 1.1966, test_loss: 1.3295, test_f1: 0.3162
 epoch: 7, train_loss: 1.1929, test_loss: 1.3269, test_f1: 0.3018
 epoch: 8, train_loss: 1.1833, test_loss: 1.3287, test_f1: 0.3150
 epoch: 9, train_loss: 1.1785, test_loss: 1.3124, test_f1: 0.3339
 epoch: 10, train_loss: 1.1697, test_loss: 1.3249, test_f1: 0.3658
 epoch: 11, train_loss: 1.1666, test_loss: 1.3090, test_f1: 0.3633
 epoch: 12, train_loss: 1.1690, test_loss: 1.3698, test_f1: 0.3644
 epoch: 13, train_loss: 1.1607, test_loss: 1.3390, test_f1: 0.3628
 epoch: 14, train_loss: 1.1514, test_loss: 1.3332, test_f1: 0.3698
 epoch: 15, train_loss: 1.1416, test_loss: 1.2636, test_f1: 0.3756
 epoch: 16, train_loss: 1.1280, test_loss: 1.2854, test_f1: 0.3805
 epoch: 17, train_loss: 1.1393, test_loss: 1.2886, test_f1: 0.3630
 epoch: 18, train_loss: 1.1213, test_loss: 1.3262, test_f1: 0.3634
 epoch: 19, train_loss: 1.1309, test_loss: 1.3309, test_f1: 0.3663
 epoch: 20, train_loss: 1.1321, test_loss: 1.3172, test_f1: 0.3706
 epoch: 21, train_loss: 1.1278, test_loss: 1.2942, test_f1: 0.3841
 epoch: 22, train_loss: 1.1115, test_loss: 1.2993, test_f1: 0.3611
 epoch: 23, train_loss: 1.1088, test_loss: 1.2399, test_f1: 0.3711
 epoch: 24, train_loss: 1.0988, test_loss: 1.2511, test_f1: 0.3800
 epoch: 25, train_loss: 1.1022, test_loss: 1.2474, test_f1: 0.3739
 epoch: 26, train_loss: 1.0936, test_loss: 1.2793, test_f1: 0.3606
 epoch: 27, train_loss: 1.1054, test_loss: 1.2607, test_f1: 0.4056
 epoch: 28, train_loss: 1.0950, test_loss: 1.2641, test_f1: 0.4096
 epoch: 29, train_loss: 1.0926, test_loss: 1.2767, test_f1: 0.3498
 epoch: 30, train_loss: 1.0757, test_loss: 1.2476, test_f1: 0.3838
 epoch: 31, train_loss: 1.0675, test_loss: 1.2567, test_f1: 0.4088
 epoch: 32, train_loss: 1.0604, test_loss: 1.2421, test_f1: 0.4102
 epoch: 33, train_loss: 1.0739, test_loss: 1.2713, test_f1: 0.4058
 epoch: 34, train_loss: 1.0777, test_loss: 1.2804, test_f1: 0.4235
 epoch: 35, train_loss: 1.0589, test_loss: 1.2520, test_f1: 0.3979
 epoch: 36, train_loss: 1.0552, test_loss: 1.2850, test_f1: 0.4171
 epoch: 37, train_loss: 1.0497, test_loss: 1.2929, test_f1: 0.4241
 epoch: 38, train_loss: 1.0340, test_loss: 1.2817, test_f1: 0.4413
 epoch: 39, train_loss: 1.0410, test_loss: 1.2760, test_f1: 0.4443
 epoch: 40, train_loss: 1.0406, test_loss: 1.2613, test_f1: 0.4330
 epoch: 41, train_loss: 1.0445, test_loss: 1.2769, test_f1: 0.4315
 epoch: 42, train_loss: 1.0292, test_loss: 1.2927, test_f1: 0.3773
 epoch: 43, train_loss: 1.0282, test_loss: 1.2732, test_f1: 0.4226
 epoch: 44, train_loss: 1.0309, test_loss: 1.2717, test_f1: 0.4353
 epoch: 45, train_loss: 1.0329, test_loss: 1.2802, test_f1: 0.4293
 epoch: 46, train_loss: 1.0174, test_loss: 1.2897, test_f1: 0.4323
 epoch: 47, train_loss: 1.0157, test_loss: 1.2971, test_f1: 0.4250
 epoch: 48, train_loss: 1.0048, test_loss: 1.2875, test_f1: 0.4612
 epoch: 49, train_loss: 1.0138, test_loss: 1.3089, test_f1: 0.4459
 epoch: 50, train_loss: 1.0075, test_loss: 1.3088, test_f1: 0.4414
 epoch: 51, train_loss: 0.9800, test_loss: 1.3052, test_f1: 0.4641
 epoch: 52, train_loss: 0.9873, test_loss: 1.3225, test_f1: 0.4659
 epoch: 53, train_loss: 0.9946, test_loss: 1.3214, test_f1: 0.4467
 epoch: 54, train_loss: 0.9976, test_loss: 1.3110, test_f1: 0.4648
 epoch: 55, train_loss: 0.9973, test_loss: 1.3028, test_f1: 0.4566
 epoch: 56, train_loss: 0.9935, test_loss: 1.3155, test_f1: 0.4656
 epoch: 57, train_loss: 0.9871, test_loss: 1.3146, test_f1: 0.4570
 epoch: 58, train_loss: 0.9729, test_loss: 1.2929, test_f1: 0.4628
 epoch: 59, train_loss: 0.9635, test_loss: 1.2901, test_f1: 0.4739
 epoch: 60, train_loss: 0.9810, test_loss: 1.2919, test_f1: 0.4689
 epoch: 61, train_loss: 0.9750, test_loss: 1.3046, test_f1: 0.4695
 epoch: 62, train_loss: 0.9708, test_loss: 1.2839, test_f1: 0.4762
 epoch: 63, train_loss: 0.9648, test_loss: 1.2935, test_f1: 0.4701
 epoch: 64, train_loss: 0.9671, test_loss: 1.2938, test_f1: 0.4747
 epoch: 65, train_loss: 0.9563, test_loss: 1.3115, test_f1: 0.4582
 epoch: 66, train_loss: 0.9541, test_loss: 1.2949, test_f1: 0.4725
 epoch: 67, train_loss: 0.9504, test_loss: 1.3047, test_f1: 0.4689
 epoch: 68, train_loss: 0.9608, test_loss: 1.3054, test_f1: 0.4655
 epoch: 69, train_loss: 0.9650, test_loss: 1.2791, test_f1: 0.4808
 epoch: 70, train_loss: 0.9436, test_loss: 1.2931, test_f1: 0.4730
 epoch: 71, train_loss: 0.9581, test_loss: 1.2978, test_f1: 0.4873
 epoch: 72, train_loss: 0.9529, test_loss: 1.3002, test_f1: 0.4807
 epoch: 73, train_loss: 0.9612, test_loss: 1.2872, test_f1: 0.4911
 epoch: 74, train_loss: 0.9526, test_loss: 1.2839, test_f1: 0.4829
 epoch: 75, train_loss: 0.9619, test_loss: 1.2956, test_f1: 0.4778
 epoch: 76, train_loss: 0.9420, test_loss: 1.2838, test_f1: 0.4862
 epoch: 77, train_loss: 0.9480, test_loss: 1.2847, test_f1: 0.4199
 epoch: 78, train_loss: 0.9422, test_loss: 1.2729, test_f1: 0.4672
 epoch: 79, train_loss: 0.9501, test_loss: 1.2906, test_f1: 0.4726
 epoch: 80, train_loss: 0.9300, test_loss: 1.2958, test_f1: 0.4466
 epoch: 81, train_loss: 0.9357, test_loss: 1.2689, test_f1: 0.4668
 epoch: 82, train_loss: 0.9207, test_loss: 1.2830, test_f1: 0.4941
 epoch: 83, train_loss: 0.9314, test_loss: 1.2767, test_f1: 0.4941
 epoch: 84, train_loss: 0.9370, test_loss: 1.2781, test_f1: 0.4821
 epoch: 85, train_loss: 0.9238, test_loss: 1.2721, test_f1: 0.5023
 epoch: 86, train_loss: 0.9230, test_loss: 1.2858, test_f1: 0.4852
 epoch: 87, train_loss: 0.9262, test_loss: 1.2777, test_f1: 0.4717
 epoch: 88, train_loss: 0.9218, test_loss: 1.3192, test_f1: 0.4841
 epoch: 89, train_loss: 0.9135, test_loss: 1.3534, test_f1: 0.4843
 epoch: 90, train_loss: 0.9260, test_loss: 1.2972, test_f1: 0.4816
 epoch: 91, train_loss: 0.9152, test_loss: 1.2987, test_f1: 0.4744
 epoch: 92, train_loss: 0.9264, test_loss: 1.3179, test_f1: 0.4814
 epoch: 93, train_loss: 0.9191, test_loss: 1.3103, test_f1: 0.4703
 epoch: 94, train_loss: 0.9197, test_loss: 1.2896, test_f1: 0.4936
 epoch: 95, train_loss: 0.9037, test_loss: 1.2849, test_f1: 0.4706
 epoch: 96, train_loss: 0.8982, test_loss: 1.3050, test_f1: 0.4714
 epoch: 97, train_loss: 0.9088, test_loss: 1.3159, test_f1: 0.4678
 epoch: 98, train_loss: 0.8958, test_loss: 1.3056, test_f1: 0.4803
 epoch: 99, train_loss: 0.8956, test_loss: 1.3226, test_f1: 0.4641
##################ITERATION #7 ****************************************
 epoch: 0, train_loss: 1.3043, test_loss: 1.3200, test_f1: 0.2281
 epoch: 1, train_loss: 1.2290, test_loss: 1.2955, test_f1: 0.2281
 epoch: 2, train_loss: 1.2069, test_loss: 1.2621, test_f1: 0.2572
 epoch: 3, train_loss: 1.2059, test_loss: 1.2555, test_f1: 0.3265
 epoch: 4, train_loss: 1.1833, test_loss: 1.2450, test_f1: 0.2903
 epoch: 5, train_loss: 1.1545, test_loss: 1.2471, test_f1: 0.2805
 epoch: 6, train_loss: 1.1655, test_loss: 1.2365, test_f1: 0.3174
 epoch: 7, train_loss: 1.1503, test_loss: 1.2205, test_f1: 0.3103
 epoch: 8, train_loss: 1.1535, test_loss: 1.2486, test_f1: 0.3016
 epoch: 9, train_loss: 1.1322, test_loss: 1.2373, test_f1: 0.3317
 epoch: 10, train_loss: 1.1352, test_loss: 1.2399, test_f1: 0.3420
 epoch: 11, train_loss: 1.1221, test_loss: 1.2129, test_f1: 0.3366
 epoch: 12, train_loss: 1.1263, test_loss: 1.2226, test_f1: 0.3203
 epoch: 13, train_loss: 1.1081, test_loss: 1.2582, test_f1: 0.3421
 epoch: 14, train_loss: 1.0944, test_loss: 1.2768, test_f1: 0.3488
 epoch: 15, train_loss: 1.1025, test_loss: 1.2432, test_f1: 0.3578
 epoch: 16, train_loss: 1.0966, test_loss: 1.2537, test_f1: 0.3656
 epoch: 17, train_loss: 1.0832, test_loss: 1.2190, test_f1: 0.3720
 epoch: 18, train_loss: 1.0897, test_loss: 1.2529, test_f1: 0.3770
 epoch: 19, train_loss: 1.0812, test_loss: 1.2366, test_f1: 0.3968
 epoch: 20, train_loss: 1.0778, test_loss: 1.2205, test_f1: 0.3789
 epoch: 21, train_loss: 1.0674, test_loss: 1.2211, test_f1: 0.3772
 epoch: 22, train_loss: 1.0695, test_loss: 1.2664, test_f1: 0.3764
 epoch: 23, train_loss: 1.0633, test_loss: 1.1804, test_f1: 0.4273
 epoch: 24, train_loss: 1.0406, test_loss: 1.2234, test_f1: 0.4221
 epoch: 25, train_loss: 1.0311, test_loss: 1.2205, test_f1: 0.4474
 epoch: 26, train_loss: 1.0404, test_loss: 1.2457, test_f1: 0.4278
 epoch: 27, train_loss: 1.0400, test_loss: 1.2214, test_f1: 0.4408
 epoch: 28, train_loss: 1.0251, test_loss: 1.2015, test_f1: 0.4229
 epoch: 29, train_loss: 1.0078, test_loss: 1.2258, test_f1: 0.4374
 epoch: 30, train_loss: 1.0014, test_loss: 1.1954, test_f1: 0.5071
 epoch: 31, train_loss: 1.0108, test_loss: 1.1867, test_f1: 0.4758
 epoch: 32, train_loss: 0.9901, test_loss: 1.2293, test_f1: 0.4311
 epoch: 33, train_loss: 0.9936, test_loss: 1.1858, test_f1: 0.4807
 epoch: 34, train_loss: 0.9704, test_loss: 1.1885, test_f1: 0.4756
 epoch: 35, train_loss: 0.9834, test_loss: 1.1857, test_f1: 0.5034
 epoch: 36, train_loss: 0.9665, test_loss: 1.1700, test_f1: 0.4984
 epoch: 37, train_loss: 0.9819, test_loss: 1.1881, test_f1: 0.5060
 epoch: 38, train_loss: 0.9684, test_loss: 1.1537, test_f1: 0.4905
 epoch: 39, train_loss: 0.9614, test_loss: 1.1935, test_f1: 0.4840
 epoch: 40, train_loss: 0.9714, test_loss: 1.1726, test_f1: 0.5164
 epoch: 41, train_loss: 0.9636, test_loss: 1.1597, test_f1: 0.4964
 epoch: 42, train_loss: 0.9680, test_loss: 1.2068, test_f1: 0.4242
 epoch: 43, train_loss: 0.9460, test_loss: 1.2586, test_f1: 0.4424
 epoch: 44, train_loss: 0.9834, test_loss: 1.1938, test_f1: 0.4584
 epoch: 45, train_loss: 0.9481, test_loss: 1.1508, test_f1: 0.4731
 epoch: 46, train_loss: 0.9581, test_loss: 1.2126, test_f1: 0.4504
 epoch: 47, train_loss: 0.9481, test_loss: 1.1992, test_f1: 0.4795
 epoch: 48, train_loss: 0.9421, test_loss: 1.1810, test_f1: 0.4868
 epoch: 49, train_loss: 0.9425, test_loss: 1.1808, test_f1: 0.4639
 epoch: 50, train_loss: 0.9367, test_loss: 1.2074, test_f1: 0.4617
 epoch: 51, train_loss: 0.9310, test_loss: 1.2074, test_f1: 0.4868
 epoch: 52, train_loss: 0.9311, test_loss: 1.1999, test_f1: 0.5024
 epoch: 53, train_loss: 0.9328, test_loss: 1.1899, test_f1: 0.5345
 epoch: 54, train_loss: 0.9268, test_loss: 1.1876, test_f1: 0.5184
 epoch: 55, train_loss: 0.9333, test_loss: 1.1971, test_f1: 0.4877
 epoch: 56, train_loss: 0.9151, test_loss: 1.2267, test_f1: 0.4621
 epoch: 57, train_loss: 0.9108, test_loss: 1.2079, test_f1: 0.4892
 epoch: 58, train_loss: 0.9099, test_loss: 1.2183, test_f1: 0.4682
 epoch: 59, train_loss: 0.9410, test_loss: 1.2376, test_f1: 0.4595
 epoch: 60, train_loss: 0.9173, test_loss: 1.2391, test_f1: 0.4445
 epoch: 61, train_loss: 0.9161, test_loss: 1.2144, test_f1: 0.5071
 epoch: 62, train_loss: 0.9215, test_loss: 1.1934, test_f1: 0.4882
 epoch: 63, train_loss: 0.8858, test_loss: 1.1746, test_f1: 0.5135
 epoch: 64, train_loss: 0.8983, test_loss: 1.2292, test_f1: 0.4937
 epoch: 65, train_loss: 0.9126, test_loss: 1.2341, test_f1: 0.4698
 epoch: 66, train_loss: 0.8928, test_loss: 1.2089, test_f1: 0.4670
 epoch: 67, train_loss: 0.8844, test_loss: 1.2429, test_f1: 0.5178
 epoch: 68, train_loss: 0.9115, test_loss: 1.1876, test_f1: 0.4977
 epoch: 69, train_loss: 0.8949, test_loss: 1.1930, test_f1: 0.4873
 epoch: 70, train_loss: 0.9024, test_loss: 1.1814, test_f1: 0.5080
 epoch: 71, train_loss: 0.8929, test_loss: 1.1818, test_f1: 0.5472
 epoch: 72, train_loss: 0.8901, test_loss: 1.2326, test_f1: 0.4992
 epoch: 73, train_loss: 0.8937, test_loss: 1.2310, test_f1: 0.5414
 epoch: 74, train_loss: 0.8824, test_loss: 1.2134, test_f1: 0.5718
 epoch: 75, train_loss: 0.8886, test_loss: 1.1914, test_f1: 0.5471
 epoch: 76, train_loss: 0.8815, test_loss: 1.2580, test_f1: 0.4924
 epoch: 77, train_loss: 0.8944, test_loss: 1.2483, test_f1: 0.5099
 epoch: 78, train_loss: 0.8989, test_loss: 1.2240, test_f1: 0.4967
 epoch: 79, train_loss: 0.8821, test_loss: 1.1926, test_f1: 0.4956
 epoch: 80, train_loss: 0.8744, test_loss: 1.2410, test_f1: 0.4982
 epoch: 81, train_loss: 0.8836, test_loss: 1.2315, test_f1: 0.5166
 epoch: 82, train_loss: 0.8655, test_loss: 1.2481, test_f1: 0.5425
 epoch: 83, train_loss: 0.8811, test_loss: 1.2356, test_f1: 0.5270
 epoch: 84, train_loss: 0.8658, test_loss: 1.2195, test_f1: 0.5336
 epoch: 85, train_loss: 0.8627, test_loss: 1.2268, test_f1: 0.5444
 epoch: 86, train_loss: 0.8647, test_loss: 1.2219, test_f1: 0.5142
 epoch: 87, train_loss: 0.8633, test_loss: 1.2809, test_f1: 0.5005
 epoch: 88, train_loss: 0.8839, test_loss: 1.2676, test_f1: 0.5296
 epoch: 89, train_loss: 0.8632, test_loss: 1.2289, test_f1: 0.5171
 epoch: 90, train_loss: 0.8931, test_loss: 1.2634, test_f1: 0.5769
 epoch: 91, train_loss: 0.8443, test_loss: 1.2590, test_f1: 0.5361
 epoch: 92, train_loss: 0.8752, test_loss: 1.2802, test_f1: 0.5386
 epoch: 93, train_loss: 0.8507, test_loss: 1.2769, test_f1: 0.5125
 epoch: 94, train_loss: 0.8762, test_loss: 1.2906, test_f1: 0.4982
 epoch: 95, train_loss: 0.8561, test_loss: 1.1968, test_f1: 0.4953
 epoch: 96, train_loss: 0.8653, test_loss: 1.2532, test_f1: 0.4934
 epoch: 97, train_loss: 0.8509, test_loss: 1.2326, test_f1: 0.5279
 epoch: 98, train_loss: 0.8647, test_loss: 1.2675, test_f1: 0.5487
 epoch: 99, train_loss: 0.8576, test_loss: 1.2028, test_f1: 0.5164
##################ITERATION #8 ****************************************
 epoch: 0, train_loss: 1.3000, test_loss: 1.3885, test_f1: 0.2354
 epoch: 1, train_loss: 1.2503, test_loss: 1.3695, test_f1: 0.2366
 epoch: 2, train_loss: 1.2234, test_loss: 1.3542, test_f1: 0.2391
 epoch: 3, train_loss: 1.2227, test_loss: 1.3492, test_f1: 0.2391
 epoch: 4, train_loss: 1.2067, test_loss: 1.3523, test_f1: 0.2530
 epoch: 5, train_loss: 1.1949, test_loss: 1.3330, test_f1: 0.2610
 epoch: 6, train_loss: 1.1873, test_loss: 1.3123, test_f1: 0.2768
 epoch: 7, train_loss: 1.1670, test_loss: 1.2786, test_f1: 0.2821
 epoch: 8, train_loss: 1.1537, test_loss: 1.2767, test_f1: 0.2909
 epoch: 9, train_loss: 1.1464, test_loss: 1.2821, test_f1: 0.3079
 epoch: 10, train_loss: 1.1285, test_loss: 1.2684, test_f1: 0.3383
 epoch: 11, train_loss: 1.1151, test_loss: 1.2738, test_f1: 0.3931
 epoch: 12, train_loss: 1.1192, test_loss: 1.2898, test_f1: 0.4075
 epoch: 13, train_loss: 1.1067, test_loss: 1.2680, test_f1: 0.4393
 epoch: 14, train_loss: 1.0894, test_loss: 1.2713, test_f1: 0.4242
 epoch: 15, train_loss: 1.0817, test_loss: 1.2555, test_f1: 0.4589
 epoch: 16, train_loss: 1.0824, test_loss: 1.2062, test_f1: 0.4831
 epoch: 17, train_loss: 1.0570, test_loss: 1.2142, test_f1: 0.4547
 epoch: 18, train_loss: 1.0568, test_loss: 1.2320, test_f1: 0.5104
 epoch: 19, train_loss: 1.0343, test_loss: 1.2166, test_f1: 0.4866
 epoch: 20, train_loss: 1.0332, test_loss: 1.2208, test_f1: 0.4971
 epoch: 21, train_loss: 1.0387, test_loss: 1.2188, test_f1: 0.4731
 epoch: 22, train_loss: 1.0111, test_loss: 1.2235, test_f1: 0.4748
 epoch: 23, train_loss: 1.0190, test_loss: 1.2199, test_f1: 0.4916
 epoch: 24, train_loss: 0.9976, test_loss: 1.1945, test_f1: 0.5314
 epoch: 25, train_loss: 0.9948, test_loss: 1.1779, test_f1: 0.5270
 epoch: 26, train_loss: 0.9929, test_loss: 1.1781, test_f1: 0.5412
 epoch: 27, train_loss: 0.9904, test_loss: 1.1521, test_f1: 0.5065
 epoch: 28, train_loss: 0.9928, test_loss: 1.1701, test_f1: 0.4868
 epoch: 29, train_loss: 0.9633, test_loss: 1.1549, test_f1: 0.5150
 epoch: 30, train_loss: 0.9589, test_loss: 1.2106, test_f1: 0.4812
 epoch: 31, train_loss: 0.9724, test_loss: 1.1440, test_f1: 0.5380
 epoch: 32, train_loss: 0.9584, test_loss: 1.1557, test_f1: 0.4975
 epoch: 33, train_loss: 0.9639, test_loss: 1.1518, test_f1: 0.5137
 epoch: 34, train_loss: 0.9488, test_loss: 1.2004, test_f1: 0.4996
 epoch: 35, train_loss: 0.9414, test_loss: 1.1370, test_f1: 0.5490
 epoch: 36, train_loss: 0.9497, test_loss: 1.1335, test_f1: 0.5275
 epoch: 37, train_loss: 0.9381, test_loss: 1.1105, test_f1: 0.5423
 epoch: 38, train_loss: 0.9432, test_loss: 1.1132, test_f1: 0.5290
 epoch: 39, train_loss: 0.9354, test_loss: 1.1711, test_f1: 0.5042
 epoch: 40, train_loss: 0.9179, test_loss: 1.2083, test_f1: 0.4773
 epoch: 41, train_loss: 0.9203, test_loss: 1.1495, test_f1: 0.5314
 epoch: 42, train_loss: 0.9009, test_loss: 1.1501, test_f1: 0.5501
 epoch: 43, train_loss: 0.9112, test_loss: 1.1441, test_f1: 0.5286
 epoch: 44, train_loss: 0.8951, test_loss: 1.1558, test_f1: 0.5208
 epoch: 45, train_loss: 0.9223, test_loss: 1.1693, test_f1: 0.5397
 epoch: 46, train_loss: 0.8987, test_loss: 1.1682, test_f1: 0.5263
 epoch: 47, train_loss: 0.8999, test_loss: 1.1625, test_f1: 0.5261
 epoch: 48, train_loss: 0.8955, test_loss: 1.1723, test_f1: 0.5115
 epoch: 49, train_loss: 0.8818, test_loss: 1.1434, test_f1: 0.5415
 epoch: 50, train_loss: 0.8820, test_loss: 1.1941, test_f1: 0.5295
 epoch: 51, train_loss: 0.8641, test_loss: 1.1587, test_f1: 0.5236
 epoch: 52, train_loss: 0.8650, test_loss: 1.1552, test_f1: 0.5303
 epoch: 53, train_loss: 0.8659, test_loss: 1.1867, test_f1: 0.5172
 epoch: 54, train_loss: 0.8602, test_loss: 1.1802, test_f1: 0.5115
 epoch: 55, train_loss: 0.8618, test_loss: 1.1488, test_f1: 0.5248
 epoch: 56, train_loss: 0.8647, test_loss: 1.1361, test_f1: 0.5428
 epoch: 57, train_loss: 0.8521, test_loss: 1.1606, test_f1: 0.5358
 epoch: 58, train_loss: 0.8500, test_loss: 1.1551, test_f1: 0.5115
 epoch: 59, train_loss: 0.8476, test_loss: 1.1273, test_f1: 0.5422
 epoch: 60, train_loss: 0.8622, test_loss: 1.1481, test_f1: 0.5519
 epoch: 61, train_loss: 0.8619, test_loss: 1.1741, test_f1: 0.5404
 epoch: 62, train_loss: 0.8579, test_loss: 1.1932, test_f1: 0.5380
 epoch: 63, train_loss: 0.8691, test_loss: 1.1925, test_f1: 0.5456
 epoch: 64, train_loss: 0.8567, test_loss: 1.1484, test_f1: 0.5566
 epoch: 65, train_loss: 0.8440, test_loss: 1.2028, test_f1: 0.5212
 epoch: 66, train_loss: 0.8407, test_loss: 1.2022, test_f1: 0.5292
 epoch: 67, train_loss: 0.8373, test_loss: 1.1917, test_f1: 0.5222
 epoch: 68, train_loss: 0.8503, test_loss: 1.1383, test_f1: 0.5461
 epoch: 69, train_loss: 0.8411, test_loss: 1.1628, test_f1: 0.5321
 epoch: 70, train_loss: 0.8343, test_loss: 1.2671, test_f1: 0.5261
 epoch: 71, train_loss: 0.8396, test_loss: 1.1487, test_f1: 0.5577
 epoch: 72, train_loss: 0.8391, test_loss: 1.1529, test_f1: 0.5531
 epoch: 73, train_loss: 0.8402, test_loss: 1.1380, test_f1: 0.5488
 epoch: 74, train_loss: 0.8245, test_loss: 1.1619, test_f1: 0.5350
 epoch: 75, train_loss: 0.8347, test_loss: 1.2550, test_f1: 0.5202
 epoch: 76, train_loss: 0.8514, test_loss: 1.1850, test_f1: 0.5623
 epoch: 77, train_loss: 0.8272, test_loss: 1.1766, test_f1: 0.5701
 epoch: 78, train_loss: 0.8099, test_loss: 1.1975, test_f1: 0.5354
 epoch: 79, train_loss: 0.8266, test_loss: 1.2195, test_f1: 0.5320
 epoch: 80, train_loss: 0.8407, test_loss: 1.2190, test_f1: 0.5335
 epoch: 81, train_loss: 0.8264, test_loss: 1.2723, test_f1: 0.5282
 epoch: 82, train_loss: 0.8072, test_loss: 1.2116, test_f1: 0.5165
 epoch: 83, train_loss: 0.8119, test_loss: 1.2571, test_f1: 0.5364
 epoch: 84, train_loss: 0.8217, test_loss: 1.2158, test_f1: 0.5372
 epoch: 85, train_loss: 0.8339, test_loss: 1.1806, test_f1: 0.5619
 epoch: 86, train_loss: 0.8105, test_loss: 1.2506, test_f1: 0.5674
 epoch: 87, train_loss: 0.8222, test_loss: 1.2540, test_f1: 0.5621
 epoch: 88, train_loss: 0.8232, test_loss: 1.2176, test_f1: 0.5408
 epoch: 89, train_loss: 0.8083, test_loss: 1.2387, test_f1: 0.5437
 epoch: 90, train_loss: 0.8020, test_loss: 1.2491, test_f1: 0.5539
 epoch: 91, train_loss: 0.7967, test_loss: 1.2688, test_f1: 0.5520
 epoch: 92, train_loss: 0.8169, test_loss: 1.2805, test_f1: 0.5581
 epoch: 93, train_loss: 0.8201, test_loss: 1.2385, test_f1: 0.5321
 epoch: 94, train_loss: 0.7982, test_loss: 1.2115, test_f1: 0.5593
 epoch: 95, train_loss: 0.8045, test_loss: 1.2271, test_f1: 0.5477
 epoch: 96, train_loss: 0.7903, test_loss: 1.2543, test_f1: 0.5507
 epoch: 97, train_loss: 0.8020, test_loss: 1.2433, test_f1: 0.5749
 epoch: 98, train_loss: 0.7900, test_loss: 1.2942, test_f1: 0.5620
 epoch: 99, train_loss: 0.8045, test_loss: 1.2001, test_f1: 0.5696
##################ITERATION #9 ****************************************
 epoch: 0, train_loss: 2.0836, test_loss: 1.6171, test_f1: 0.0523
 epoch: 1, train_loss: 1.4420, test_loss: 1.4272, test_f1: 0.2450
 epoch: 2, train_loss: 1.3576, test_loss: 1.4008, test_f1: 0.2386
 epoch: 3, train_loss: 1.3139, test_loss: 1.3761, test_f1: 0.2456
 epoch: 4, train_loss: 1.2675, test_loss: 1.3791, test_f1: 0.2729
 epoch: 5, train_loss: 1.2504, test_loss: 1.3374, test_f1: 0.2872
 epoch: 6, train_loss: 1.2393, test_loss: 1.3655, test_f1: 0.3060
 epoch: 7, train_loss: 1.2348, test_loss: 1.3439, test_f1: 0.3077
 epoch: 8, train_loss: 1.2218, test_loss: 1.3252, test_f1: 0.3043
 epoch: 9, train_loss: 1.1978, test_loss: 1.2832, test_f1: 0.3013
 epoch: 10, train_loss: 1.1732, test_loss: 1.3034, test_f1: 0.3107
 epoch: 11, train_loss: 1.1932, test_loss: 1.3030, test_f1: 0.3058
 epoch: 12, train_loss: 1.1567, test_loss: 1.2870, test_f1: 0.3113
 epoch: 13, train_loss: 1.1702, test_loss: 1.2733, test_f1: 0.3028
 epoch: 14, train_loss: 1.1409, test_loss: 1.2506, test_f1: 0.2967
 epoch: 15, train_loss: 1.1312, test_loss: 1.2349, test_f1: 0.3219
 epoch: 16, train_loss: 1.1095, test_loss: 1.2700, test_f1: 0.3299
 epoch: 17, train_loss: 1.1220, test_loss: 1.2400, test_f1: 0.3640
 epoch: 18, train_loss: 1.0993, test_loss: 1.2560, test_f1: 0.3742
 epoch: 19, train_loss: 1.1087, test_loss: 1.2729, test_f1: 0.3352
 epoch: 20, train_loss: 1.0917, test_loss: 1.2499, test_f1: 0.3644
 epoch: 21, train_loss: 1.0725, test_loss: 1.2083, test_f1: 0.3976
 epoch: 22, train_loss: 1.0721, test_loss: 1.2112, test_f1: 0.4025
 epoch: 23, train_loss: 1.0726, test_loss: 1.1821, test_f1: 0.3926
 epoch: 24, train_loss: 1.0621, test_loss: 1.2206, test_f1: 0.4229
 epoch: 25, train_loss: 1.0545, test_loss: 1.2097, test_f1: 0.4320
 epoch: 26, train_loss: 1.0544, test_loss: 1.1932, test_f1: 0.4610
 epoch: 27, train_loss: 1.0463, test_loss: 1.2395, test_f1: 0.4504
 epoch: 28, train_loss: 1.0334, test_loss: 1.2021, test_f1: 0.4329
 epoch: 29, train_loss: 1.0269, test_loss: 1.1750, test_f1: 0.4416
 epoch: 30, train_loss: 1.0340, test_loss: 1.1700, test_f1: 0.4799
 epoch: 31, train_loss: 1.0109, test_loss: 1.1688, test_f1: 0.4325
 epoch: 32, train_loss: 1.0293, test_loss: 1.1911, test_f1: 0.4293
 epoch: 33, train_loss: 1.0196, test_loss: 1.2266, test_f1: 0.4416
 epoch: 34, train_loss: 0.9980, test_loss: 1.1807, test_f1: 0.4648
 epoch: 35, train_loss: 1.0000, test_loss: 1.1527, test_f1: 0.4624
 epoch: 36, train_loss: 0.9903, test_loss: 1.1499, test_f1: 0.4662
 epoch: 37, train_loss: 0.9898, test_loss: 1.3456, test_f1: 0.4708
 epoch: 38, train_loss: 1.0000, test_loss: 1.4096, test_f1: 0.4396
 epoch: 39, train_loss: 0.9779, test_loss: 1.2406, test_f1: 0.4670
 epoch: 40, train_loss: 0.9939, test_loss: 1.2237, test_f1: 0.4568
 epoch: 41, train_loss: 0.9699, test_loss: 1.1350, test_f1: 0.4837
 epoch: 42, train_loss: 0.9653, test_loss: 1.1781, test_f1: 0.4545
 epoch: 43, train_loss: 0.9769, test_loss: 1.1496, test_f1: 0.4817
 epoch: 44, train_loss: 0.9789, test_loss: 1.2320, test_f1: 0.5049
 epoch: 45, train_loss: 0.9666, test_loss: 1.2631, test_f1: 0.5000
 epoch: 46, train_loss: 0.9633, test_loss: 1.2836, test_f1: 0.5099
 epoch: 47, train_loss: 0.9532, test_loss: 1.2568, test_f1: 0.4541
 epoch: 48, train_loss: 0.9538, test_loss: 1.2370, test_f1: 0.4811
 epoch: 49, train_loss: 0.9623, test_loss: 1.2693, test_f1: 0.5020
 epoch: 50, train_loss: 0.9281, test_loss: 1.4030, test_f1: 0.5061
 epoch: 51, train_loss: 0.9415, test_loss: 1.4598, test_f1: 0.5097
 epoch: 52, train_loss: 0.9350, test_loss: 1.4228, test_f1: 0.5164
 epoch: 53, train_loss: 0.9288, test_loss: 1.4432, test_f1: 0.4966
 epoch: 54, train_loss: 0.9457, test_loss: 1.4194, test_f1: 0.5050
 epoch: 55, train_loss: 0.9211, test_loss: 1.5107, test_f1: 0.4782
 epoch: 56, train_loss: 0.9310, test_loss: 1.5005, test_f1: 0.4715
 epoch: 57, train_loss: 0.9324, test_loss: 1.4535, test_f1: 0.5231
 epoch: 58, train_loss: 0.9257, test_loss: 1.4753, test_f1: 0.4887
 epoch: 59, train_loss: 0.9235, test_loss: 1.4835, test_f1: 0.5090
 epoch: 60, train_loss: 0.9268, test_loss: 1.4105, test_f1: 0.4745
 epoch: 61, train_loss: 0.9162, test_loss: 1.4401, test_f1: 0.5234
 epoch: 62, train_loss: 0.9191, test_loss: 1.4538, test_f1: 0.5329
 epoch: 63, train_loss: 0.9174, test_loss: 1.4798, test_f1: 0.5154
 epoch: 64, train_loss: 0.9121, test_loss: 1.4858, test_f1: 0.5157
 epoch: 65, train_loss: 0.9003, test_loss: 1.5047, test_f1: 0.5130
 epoch: 66, train_loss: 0.9306, test_loss: 1.3458, test_f1: 0.5178
 epoch: 67, train_loss: 0.9059, test_loss: 1.3913, test_f1: 0.4967
 epoch: 68, train_loss: 0.9165, test_loss: 1.3445, test_f1: 0.5186
 epoch: 69, train_loss: 0.9117, test_loss: 1.4895, test_f1: 0.5045
 epoch: 70, train_loss: 0.8936, test_loss: 1.5684, test_f1: 0.5159
 epoch: 71, train_loss: 0.8929, test_loss: 1.5235, test_f1: 0.5268
 epoch: 72, train_loss: 0.8808, test_loss: 1.5254, test_f1: 0.5229
 epoch: 73, train_loss: 0.8964, test_loss: 1.5036, test_f1: 0.5201
 epoch: 74, train_loss: 0.9014, test_loss: 1.6422, test_f1: 0.5106
 epoch: 75, train_loss: 0.8968, test_loss: 1.6211, test_f1: 0.4958
 epoch: 76, train_loss: 0.8732, test_loss: 1.4177, test_f1: 0.5250
 epoch: 77, train_loss: 0.8804, test_loss: 1.4691, test_f1: 0.5068
 epoch: 78, train_loss: 0.8823, test_loss: 1.5977, test_f1: 0.5015
 epoch: 79, train_loss: 0.8991, test_loss: 1.5120, test_f1: 0.4904
 epoch: 80, train_loss: 0.8778, test_loss: 1.4819, test_f1: 0.5356
 epoch: 81, train_loss: 0.8707, test_loss: 1.3910, test_f1: 0.5333
 epoch: 82, train_loss: 0.8754, test_loss: 1.4740, test_f1: 0.5164
 epoch: 83, train_loss: 0.8824, test_loss: 1.4735, test_f1: 0.5256
 epoch: 84, train_loss: 0.8707, test_loss: 1.6239, test_f1: 0.5313
 epoch: 85, train_loss: 0.8784, test_loss: 1.6020, test_f1: 0.5025
 epoch: 86, train_loss: 0.8874, test_loss: 1.4735, test_f1: 0.5056
 epoch: 87, train_loss: 0.8735, test_loss: 1.5716, test_f1: 0.5006
 epoch: 88, train_loss: 0.8707, test_loss: 1.5296, test_f1: 0.5392
 epoch: 89, train_loss: 0.8663, test_loss: 1.4321, test_f1: 0.5172
 epoch: 90, train_loss: 0.8873, test_loss: 1.3499, test_f1: 0.5241
 epoch: 91, train_loss: 0.8579, test_loss: 1.4086, test_f1: 0.4838
 epoch: 92, train_loss: 0.8871, test_loss: 1.4874, test_f1: 0.5018
 epoch: 93, train_loss: 0.8894, test_loss: 1.4921, test_f1: 0.5219
 epoch: 94, train_loss: 0.8630, test_loss: 1.4045, test_f1: 0.5279
 epoch: 95, train_loss: 0.8691, test_loss: 1.5674, test_f1: 0.5450
 epoch: 96, train_loss: 0.8513, test_loss: 1.4923, test_f1: 0.5242
 epoch: 97, train_loss: 0.8615, test_loss: 1.4738, test_f1: 0.5150
 epoch: 98, train_loss: 0.8486, test_loss: 1.5191, test_f1: 0.5328
 epoch: 99, train_loss: 0.8739, test_loss: 1.4947, test_f1: 0.5456

Training completed in 344.93 seconds
Best F1: 0.5912 at epoch 80
Mean F1 across iterations: 0.5424  0.0344
========================FINAL RESULTS================================
FEGIN weighted F1: 0.5912  0.0344
python main.py --data ltspice_demos --representation component_component --model FEGIN --layers 4 --hiddens 16 --batch_size 128 --lr 0.001 --emb_size 128 --epochs 100 --save_appendix component_component_L4_H16_BS128_LR0.001_E128 --no_val
-----



STDERR:
  File "main.py", line 370, in <module>
    main()
  File "main.py", line 254, in main
    dataset = dataset_class(
  File "/home/philip/projects/ltspice_examples_code_repo/Circuit-Completion-Using-GNNs/component_classification_with_link_prediction_head/evaluation/FEGIN/kernel/circuit_datasets.py", line 15, in __init__
    self.data, self.slices = torch.load(self.processed_paths[0])
  File "/home/philip/.local/lib/python3.8/site-packages/torch/serialization.py", line 1040, in load
    warnings.warn(
  File "/usr/lib/python3.8/warnings.py", line 109, in _showwarnmsg
    sw(msg.message, msg.category, msg.filename, msg.lineno,
  File "main.py", line 47, in warn_with_traceback
    traceback.print_stack(file=log)
/home/philip/projects/ltspice_examples_code_repo/Circuit-Completion-Using-GNNs/component_classification_with_link_prediction_head/evaluation/FEGIN/kernel/circuit_datasets.py:15: FutureWarning: You are using `torch.load` with `weights_only=False` (the current default value), which uses the default pickle module implicitly. It is possible to construct malicious pickle data which will execute arbitrary code during unpickling (See https://github.com/pytorch/pytorch/blob/main/SECURITY.md#untrusted-models for more details). In a future release, the default value for `weights_only` will be flipped to `True`. This limits the functions that could be executed during unpickling. Arbitrary objects will no longer be allowed to be loaded via this mode unless they are explicitly allowlisted by the user via `torch.serialization.add_safe_globals`. We recommend you start setting `weights_only=True` for any use case where you don't have full control of the loaded file. Please open an issue on GitHub for any issues related to this experimental feature.
  self.data, self.slices = torch.load(self.processed_paths[0])
