STDOUT:
Results will be saved in /home/philip/projects/ltspice_examples_code_repo/Circuit-Completion-Using-GNNs/component_classification_with_link_prediction_head/evaluation/FEGIN/results/model_FEGIN_dataset_ltspice_examples
Command line input: python main.py --data ltspice_examples --representation component_pin --model FEGIN --layers 2 --hiddens 128 --batch_size 32 --lr 0.0001 --emb_size 250 --epochs 100 --save_appendix component_pin_L2_H128_BS32_LR0.0001_E250 --no_val
 is saved.
-----
ltspice_examples - FEGIN
Using 2 layers, 128 hidden units, h = 2
Loading component_pin representation dataset
ENTERED
Training FEGIN on component_pin representation
Train: 3560, Test: 848
##################ITERATION #0 ****************************************
 epoch: 0, train_loss: 1.3326, test_loss: 1.2088, test_f1: 0.3361
 epoch: 1, train_loss: 1.1557, test_loss: 1.0857, test_f1: 0.3445
 epoch: 2, train_loss: 1.0703, test_loss: 1.0545, test_f1: 0.3432
 epoch: 3, train_loss: 1.0376, test_loss: 1.0372, test_f1: 0.3711
 epoch: 4, train_loss: 1.0167, test_loss: 1.0111, test_f1: 0.4263
 epoch: 5, train_loss: 0.9920, test_loss: 1.0082, test_f1: 0.4326
 epoch: 6, train_loss: 0.9761, test_loss: 1.0056, test_f1: 0.4839
 epoch: 7, train_loss: 0.9603, test_loss: 0.9933, test_f1: 0.4946
 epoch: 8, train_loss: 0.9544, test_loss: 0.9969, test_f1: 0.4777
 epoch: 9, train_loss: 0.9303, test_loss: 0.9876, test_f1: 0.4898
 epoch: 10, train_loss: 0.9212, test_loss: 0.9732, test_f1: 0.5053
 epoch: 11, train_loss: 0.9000, test_loss: 0.9669, test_f1: 0.5207
 epoch: 12, train_loss: 0.8901, test_loss: 0.9349, test_f1: 0.5261
 epoch: 13, train_loss: 0.8751, test_loss: 0.9339, test_f1: 0.5177
 epoch: 14, train_loss: 0.8601, test_loss: 0.9128, test_f1: 0.5299
 epoch: 15, train_loss: 0.8430, test_loss: 0.9193, test_f1: 0.5217
 epoch: 16, train_loss: 0.8351, test_loss: 0.8997, test_f1: 0.5358
 epoch: 17, train_loss: 0.8226, test_loss: 0.8893, test_f1: 0.5428
 epoch: 18, train_loss: 0.8149, test_loss: 0.8924, test_f1: 0.5390
 epoch: 19, train_loss: 0.7948, test_loss: 0.8778, test_f1: 0.5473
 epoch: 20, train_loss: 0.7859, test_loss: 0.8955, test_f1: 0.5450
 epoch: 21, train_loss: 0.7793, test_loss: 0.9017, test_f1: 0.5318
 epoch: 22, train_loss: 0.7764, test_loss: 0.8777, test_f1: 0.5440
 epoch: 23, train_loss: 0.7584, test_loss: 0.8872, test_f1: 0.5430
 epoch: 24, train_loss: 0.7452, test_loss: 0.8896, test_f1: 0.5534
 epoch: 25, train_loss: 0.7450, test_loss: 0.9006, test_f1: 0.5399
 epoch: 26, train_loss: 0.7377, test_loss: 0.9000, test_f1: 0.5676
 epoch: 27, train_loss: 0.7232, test_loss: 0.8996, test_f1: 0.5413
 epoch: 28, train_loss: 0.7226, test_loss: 0.9046, test_f1: 0.5599
 epoch: 29, train_loss: 0.7093, test_loss: 0.8814, test_f1: 0.5725
 epoch: 30, train_loss: 0.7064, test_loss: 0.8932, test_f1: 0.5625
 epoch: 31, train_loss: 0.6965, test_loss: 0.8737, test_f1: 0.5781
 epoch: 32, train_loss: 0.6944, test_loss: 0.8939, test_f1: 0.5637
 epoch: 33, train_loss: 0.6857, test_loss: 0.8851, test_f1: 0.5920
 epoch: 34, train_loss: 0.6802, test_loss: 0.8862, test_f1: 0.5815
 epoch: 35, train_loss: 0.6797, test_loss: 0.8851, test_f1: 0.5749
 epoch: 36, train_loss: 0.6682, test_loss: 0.9081, test_f1: 0.5837
 epoch: 37, train_loss: 0.6699, test_loss: 0.9276, test_f1: 0.5855
 epoch: 38, train_loss: 0.6492, test_loss: 0.9097, test_f1: 0.6097
 epoch: 39, train_loss: 0.6588, test_loss: 0.9135, test_f1: 0.5730
 epoch: 40, train_loss: 0.6379, test_loss: 0.8899, test_f1: 0.5734
 epoch: 41, train_loss: 0.6339, test_loss: 0.9091, test_f1: 0.5952
 epoch: 42, train_loss: 0.6370, test_loss: 0.8959, test_f1: 0.5949
 epoch: 43, train_loss: 0.6570, test_loss: 0.9167, test_f1: 0.5986
 epoch: 44, train_loss: 0.6272, test_loss: 0.9220, test_f1: 0.5949
 epoch: 45, train_loss: 0.6146, test_loss: 0.9155, test_f1: 0.5998
 epoch: 46, train_loss: 0.6299, test_loss: 0.9250, test_f1: 0.6122
 epoch: 47, train_loss: 0.6158, test_loss: 0.9526, test_f1: 0.5991
 epoch: 48, train_loss: 0.6147, test_loss: 0.9151, test_f1: 0.6291
 epoch: 49, train_loss: 0.6085, test_loss: 0.8941, test_f1: 0.6171
 epoch: 50, train_loss: 0.6083, test_loss: 0.9508, test_f1: 0.6166
 epoch: 51, train_loss: 0.6013, test_loss: 0.9411, test_f1: 0.6164
 epoch: 52, train_loss: 0.5929, test_loss: 0.9409, test_f1: 0.6171
 epoch: 53, train_loss: 0.5832, test_loss: 0.9373, test_f1: 0.5984
 epoch: 54, train_loss: 0.5816, test_loss: 0.9433, test_f1: 0.5942
 epoch: 55, train_loss: 0.5875, test_loss: 0.9261, test_f1: 0.6087
 epoch: 56, train_loss: 0.5722, test_loss: 0.9455, test_f1: 0.6314
 epoch: 57, train_loss: 0.5630, test_loss: 0.9521, test_f1: 0.6097
 epoch: 58, train_loss: 0.5746, test_loss: 0.9341, test_f1: 0.6271
 epoch: 59, train_loss: 0.5812, test_loss: 0.9668, test_f1: 0.6206
 epoch: 60, train_loss: 0.5723, test_loss: 0.9579, test_f1: 0.6020
 epoch: 61, train_loss: 0.5662, test_loss: 0.9616, test_f1: 0.6067
 epoch: 62, train_loss: 0.5686, test_loss: 0.9171, test_f1: 0.6317
 epoch: 63, train_loss: 0.5590, test_loss: 0.9461, test_f1: 0.6336
 epoch: 64, train_loss: 0.5633, test_loss: 0.9352, test_f1: 0.6204
 epoch: 65, train_loss: 0.5535, test_loss: 0.9905, test_f1: 0.6106
 epoch: 66, train_loss: 0.5472, test_loss: 0.9706, test_f1: 0.6187
 epoch: 67, train_loss: 0.5505, test_loss: 0.9483, test_f1: 0.6170
 epoch: 68, train_loss: 0.5468, test_loss: 0.9725, test_f1: 0.6213
 epoch: 69, train_loss: 0.5336, test_loss: 0.9711, test_f1: 0.6221
 epoch: 70, train_loss: 0.5423, test_loss: 0.9634, test_f1: 0.6359
 epoch: 71, train_loss: 0.5296, test_loss: 0.9715, test_f1: 0.6298
 epoch: 72, train_loss: 0.5393, test_loss: 0.9838, test_f1: 0.6170
 epoch: 73, train_loss: 0.5431, test_loss: 0.9681, test_f1: 0.6250
 epoch: 74, train_loss: 0.5236, test_loss: 1.0147, test_f1: 0.6154
 epoch: 75, train_loss: 0.5380, test_loss: 0.9799, test_f1: 0.6427
 epoch: 76, train_loss: 0.5351, test_loss: 1.0030, test_f1: 0.6260
 epoch: 77, train_loss: 0.5274, test_loss: 1.0144, test_f1: 0.6214
 epoch: 78, train_loss: 0.5339, test_loss: 0.9833, test_f1: 0.6297
 epoch: 79, train_loss: 0.5166, test_loss: 1.0322, test_f1: 0.6192
 epoch: 80, train_loss: 0.5150, test_loss: 1.0010, test_f1: 0.6372
 epoch: 81, train_loss: 0.5107, test_loss: 1.0575, test_f1: 0.6228
 epoch: 82, train_loss: 0.5161, test_loss: 1.0261, test_f1: 0.6251
 epoch: 83, train_loss: 0.5231, test_loss: 1.0562, test_f1: 0.6383
 epoch: 84, train_loss: 0.5188, test_loss: 1.0470, test_f1: 0.6259
 epoch: 85, train_loss: 0.5200, test_loss: 1.1027, test_f1: 0.6411
 epoch: 86, train_loss: 0.5134, test_loss: 1.0242, test_f1: 0.6372
 epoch: 87, train_loss: 0.5200, test_loss: 1.0694, test_f1: 0.6340
 epoch: 88, train_loss: 0.5116, test_loss: 1.0643, test_f1: 0.6489
 epoch: 89, train_loss: 0.5104, test_loss: 1.0451, test_f1: 0.6195
 epoch: 90, train_loss: 0.5126, test_loss: 1.0726, test_f1: 0.6282
 epoch: 91, train_loss: 0.4933, test_loss: 1.0945, test_f1: 0.6285
 epoch: 92, train_loss: 0.4997, test_loss: 1.1071, test_f1: 0.6234
 epoch: 93, train_loss: 0.5061, test_loss: 1.0902, test_f1: 0.6354
 epoch: 94, train_loss: 0.4960, test_loss: 1.1122, test_f1: 0.6257
 epoch: 95, train_loss: 0.5018, test_loss: 1.0884, test_f1: 0.6283
 epoch: 96, train_loss: 0.5034, test_loss: 1.1193, test_f1: 0.6328
 epoch: 97, train_loss: 0.4937, test_loss: 1.1033, test_f1: 0.6469
 epoch: 98, train_loss: 0.4788, test_loss: 1.0950, test_f1: 0.6337
 epoch: 99, train_loss: 0.4938, test_loss: 1.1195, test_f1: 0.6234
##################ITERATION #1 ****************************************
 epoch: 0, train_loss: 1.2180, test_loss: 1.0733, test_f1: 0.4042
 epoch: 1, train_loss: 1.0525, test_loss: 1.0059, test_f1: 0.4749
 epoch: 2, train_loss: 1.0028, test_loss: 0.9823, test_f1: 0.5070
 epoch: 3, train_loss: 0.9687, test_loss: 0.9593, test_f1: 0.4979
 epoch: 4, train_loss: 0.9438, test_loss: 0.9239, test_f1: 0.5124
 epoch: 5, train_loss: 0.9123, test_loss: 0.9073, test_f1: 0.5245
 epoch: 6, train_loss: 0.8948, test_loss: 0.9135, test_f1: 0.5414
 epoch: 7, train_loss: 0.8739, test_loss: 0.8855, test_f1: 0.5339
 epoch: 8, train_loss: 0.8547, test_loss: 0.8628, test_f1: 0.5474
 epoch: 9, train_loss: 0.8405, test_loss: 0.8684, test_f1: 0.5396
 epoch: 10, train_loss: 0.8340, test_loss: 0.8668, test_f1: 0.5635
 epoch: 11, train_loss: 0.8153, test_loss: 0.8415, test_f1: 0.5639
 epoch: 12, train_loss: 0.7903, test_loss: 0.8709, test_f1: 0.5484
 epoch: 13, train_loss: 0.7892, test_loss: 0.8139, test_f1: 0.5620
 epoch: 14, train_loss: 0.7815, test_loss: 0.8130, test_f1: 0.5643
 epoch: 15, train_loss: 0.7589, test_loss: 0.8617, test_f1: 0.5762
 epoch: 16, train_loss: 0.7646, test_loss: 0.8484, test_f1: 0.5634
 epoch: 17, train_loss: 0.7544, test_loss: 0.8131, test_f1: 0.5673
 epoch: 18, train_loss: 0.7461, test_loss: 0.8557, test_f1: 0.5726
 epoch: 19, train_loss: 0.7296, test_loss: 0.8203, test_f1: 0.5615
 epoch: 20, train_loss: 0.7246, test_loss: 0.8726, test_f1: 0.5711
 epoch: 21, train_loss: 0.7166, test_loss: 0.8549, test_f1: 0.5814
 epoch: 22, train_loss: 0.7150, test_loss: 0.7977, test_f1: 0.5701
 epoch: 23, train_loss: 0.7071, test_loss: 0.8360, test_f1: 0.5856
 epoch: 24, train_loss: 0.7004, test_loss: 0.8741, test_f1: 0.5765
 epoch: 25, train_loss: 0.6977, test_loss: 0.8493, test_f1: 0.5668
 epoch: 26, train_loss: 0.6848, test_loss: 0.8573, test_f1: 0.5756
 epoch: 27, train_loss: 0.6757, test_loss: 0.7735, test_f1: 0.5925
 epoch: 28, train_loss: 0.6780, test_loss: 0.8471, test_f1: 0.5801
 epoch: 29, train_loss: 0.6842, test_loss: 0.8744, test_f1: 0.5950
 epoch: 30, train_loss: 0.6669, test_loss: 0.7913, test_f1: 0.6105
 epoch: 31, train_loss: 0.6564, test_loss: 0.8352, test_f1: 0.5886
 epoch: 32, train_loss: 0.6475, test_loss: 0.8594, test_f1: 0.5857
 epoch: 33, train_loss: 0.6537, test_loss: 0.8962, test_f1: 0.5873
 epoch: 34, train_loss: 0.6499, test_loss: 0.8507, test_f1: 0.5836
 epoch: 35, train_loss: 0.6419, test_loss: 0.8753, test_f1: 0.6203
 epoch: 36, train_loss: 0.6314, test_loss: 0.8612, test_f1: 0.5932
 epoch: 37, train_loss: 0.6235, test_loss: 0.8367, test_f1: 0.6153
 epoch: 38, train_loss: 0.6219, test_loss: 0.8380, test_f1: 0.6078
 epoch: 39, train_loss: 0.6126, test_loss: 0.8683, test_f1: 0.6254
 epoch: 40, train_loss: 0.6227, test_loss: 0.8707, test_f1: 0.5841
 epoch: 41, train_loss: 0.6035, test_loss: 0.8633, test_f1: 0.6029
 epoch: 42, train_loss: 0.6107, test_loss: 0.8658, test_f1: 0.6044
 epoch: 43, train_loss: 0.6015, test_loss: 0.8863, test_f1: 0.6169
 epoch: 44, train_loss: 0.5908, test_loss: 0.8583, test_f1: 0.6249
 epoch: 45, train_loss: 0.6001, test_loss: 0.8784, test_f1: 0.6043
 epoch: 46, train_loss: 0.5950, test_loss: 0.9019, test_f1: 0.6358
 epoch: 47, train_loss: 0.5798, test_loss: 0.9223, test_f1: 0.6210
 epoch: 48, train_loss: 0.5840, test_loss: 0.9186, test_f1: 0.6421
 epoch: 49, train_loss: 0.5886, test_loss: 0.8867, test_f1: 0.6429
 epoch: 50, train_loss: 0.5677, test_loss: 0.8990, test_f1: 0.6295
 epoch: 51, train_loss: 0.5632, test_loss: 0.9479, test_f1: 0.6139
 epoch: 52, train_loss: 0.5467, test_loss: 0.9027, test_f1: 0.6233
 epoch: 53, train_loss: 0.5402, test_loss: 0.9412, test_f1: 0.6109
 epoch: 54, train_loss: 0.5464, test_loss: 0.9049, test_f1: 0.6351
 epoch: 55, train_loss: 0.5347, test_loss: 0.9034, test_f1: 0.6257
 epoch: 56, train_loss: 0.5325, test_loss: 0.9288, test_f1: 0.6319
 epoch: 57, train_loss: 0.5372, test_loss: 0.9034, test_f1: 0.6206
 epoch: 58, train_loss: 0.5416, test_loss: 0.9048, test_f1: 0.6271
 epoch: 59, train_loss: 0.5261, test_loss: 0.9124, test_f1: 0.6505
 epoch: 60, train_loss: 0.5251, test_loss: 0.9455, test_f1: 0.6252
 epoch: 61, train_loss: 0.5340, test_loss: 0.8590, test_f1: 0.6349
 epoch: 62, train_loss: 0.5321, test_loss: 0.9375, test_f1: 0.6341
 epoch: 63, train_loss: 0.5189, test_loss: 0.9115, test_f1: 0.6351
 epoch: 64, train_loss: 0.5163, test_loss: 0.9518, test_f1: 0.6265
 epoch: 65, train_loss: 0.5113, test_loss: 0.9829, test_f1: 0.6338
 epoch: 66, train_loss: 0.5155, test_loss: 0.9782, test_f1: 0.6120
 epoch: 67, train_loss: 0.5165, test_loss: 0.9561, test_f1: 0.6434
 epoch: 68, train_loss: 0.5163, test_loss: 0.9037, test_f1: 0.6403
 epoch: 69, train_loss: 0.5097, test_loss: 0.8911, test_f1: 0.6413
 epoch: 70, train_loss: 0.5125, test_loss: 0.8980, test_f1: 0.6540
 epoch: 71, train_loss: 0.5027, test_loss: 0.9739, test_f1: 0.6159
 epoch: 72, train_loss: 0.5120, test_loss: 0.9726, test_f1: 0.6532
 epoch: 73, train_loss: 0.5108, test_loss: 0.9375, test_f1: 0.6304
 epoch: 74, train_loss: 0.5000, test_loss: 0.9463, test_f1: 0.6440
 epoch: 75, train_loss: 0.5028, test_loss: 0.8862, test_f1: 0.6456
 epoch: 76, train_loss: 0.4798, test_loss: 0.9721, test_f1: 0.6338
 epoch: 77, train_loss: 0.4926, test_loss: 0.9559, test_f1: 0.6348
 epoch: 78, train_loss: 0.4843, test_loss: 0.9427, test_f1: 0.6432
 epoch: 79, train_loss: 0.4918, test_loss: 0.9401, test_f1: 0.6260
 epoch: 80, train_loss: 0.4924, test_loss: 0.9762, test_f1: 0.6380
 epoch: 81, train_loss: 0.4714, test_loss: 0.9597, test_f1: 0.6358
 epoch: 82, train_loss: 0.4886, test_loss: 0.9871, test_f1: 0.6567
 epoch: 83, train_loss: 0.4702, test_loss: 0.9769, test_f1: 0.6341
 epoch: 84, train_loss: 0.4799, test_loss: 0.9582, test_f1: 0.6399
 epoch: 85, train_loss: 0.4687, test_loss: 0.9488, test_f1: 0.6421
 epoch: 86, train_loss: 0.4832, test_loss: 0.9860, test_f1: 0.6461
 epoch: 87, train_loss: 0.4774, test_loss: 0.9454, test_f1: 0.6476
 epoch: 88, train_loss: 0.4704, test_loss: 1.0103, test_f1: 0.6537
 epoch: 89, train_loss: 0.4697, test_loss: 0.9894, test_f1: 0.6590
 epoch: 90, train_loss: 0.4725, test_loss: 1.0053, test_f1: 0.6463
 epoch: 91, train_loss: 0.4561, test_loss: 1.0366, test_f1: 0.6260
 epoch: 92, train_loss: 0.4586, test_loss: 1.0020, test_f1: 0.6535
 epoch: 93, train_loss: 0.4659, test_loss: 1.0284, test_f1: 0.6378
 epoch: 94, train_loss: 0.4573, test_loss: 0.9779, test_f1: 0.6252
 epoch: 95, train_loss: 0.4500, test_loss: 0.9388, test_f1: 0.6172
 epoch: 96, train_loss: 0.4724, test_loss: 0.9655, test_f1: 0.6377
 epoch: 97, train_loss: 0.4481, test_loss: 0.9791, test_f1: 0.6520
 epoch: 98, train_loss: 0.4473, test_loss: 0.9656, test_f1: 0.6429
 epoch: 99, train_loss: 0.4539, test_loss: 0.9987, test_f1: 0.6449
##################ITERATION #2 ****************************************
 epoch: 0, train_loss: 1.1654, test_loss: 1.0125, test_f1: 0.4215
 epoch: 1, train_loss: 1.0258, test_loss: 0.9676, test_f1: 0.4969
 epoch: 2, train_loss: 0.9901, test_loss: 0.9652, test_f1: 0.4967
 epoch: 3, train_loss: 0.9574, test_loss: 0.9549, test_f1: 0.5423
 epoch: 4, train_loss: 0.9339, test_loss: 0.9256, test_f1: 0.5277
 epoch: 5, train_loss: 0.9157, test_loss: 0.9159, test_f1: 0.5431
 epoch: 6, train_loss: 0.9012, test_loss: 0.9190, test_f1: 0.5689
 epoch: 7, train_loss: 0.8784, test_loss: 0.9101, test_f1: 0.5436
 epoch: 8, train_loss: 0.8684, test_loss: 0.9142, test_f1: 0.5552
 epoch: 9, train_loss: 0.8501, test_loss: 0.8794, test_f1: 0.5640
 epoch: 10, train_loss: 0.8351, test_loss: 0.8459, test_f1: 0.5505
 epoch: 11, train_loss: 0.8222, test_loss: 0.8490, test_f1: 0.5836
 epoch: 12, train_loss: 0.8116, test_loss: 0.8440, test_f1: 0.5807
 epoch: 13, train_loss: 0.7999, test_loss: 0.8536, test_f1: 0.5615
 epoch: 14, train_loss: 0.7960, test_loss: 0.8242, test_f1: 0.5791
 epoch: 15, train_loss: 0.7744, test_loss: 0.8399, test_f1: 0.5543
 epoch: 16, train_loss: 0.7792, test_loss: 0.8178, test_f1: 0.5797
 epoch: 17, train_loss: 0.7690, test_loss: 0.8481, test_f1: 0.5485
 epoch: 18, train_loss: 0.7673, test_loss: 0.8342, test_f1: 0.5826
 epoch: 19, train_loss: 0.7442, test_loss: 0.8053, test_f1: 0.5852
 epoch: 20, train_loss: 0.7327, test_loss: 0.8155, test_f1: 0.6042
 epoch: 21, train_loss: 0.7388, test_loss: 0.8222, test_f1: 0.5810
 epoch: 22, train_loss: 0.7201, test_loss: 0.8174, test_f1: 0.5688
 epoch: 23, train_loss: 0.7177, test_loss: 0.8220, test_f1: 0.5818
 epoch: 24, train_loss: 0.7217, test_loss: 0.8025, test_f1: 0.6045
 epoch: 25, train_loss: 0.7113, test_loss: 0.8154, test_f1: 0.5816
 epoch: 26, train_loss: 0.7080, test_loss: 0.8359, test_f1: 0.5792
 epoch: 27, train_loss: 0.6923, test_loss: 0.8058, test_f1: 0.6075
 epoch: 28, train_loss: 0.6899, test_loss: 0.7952, test_f1: 0.6033
 epoch: 29, train_loss: 0.6792, test_loss: 0.7501, test_f1: 0.6132
 epoch: 30, train_loss: 0.6691, test_loss: 0.7718, test_f1: 0.6165
 epoch: 31, train_loss: 0.6694, test_loss: 0.7812, test_f1: 0.6096
 epoch: 32, train_loss: 0.6634, test_loss: 0.7498, test_f1: 0.5964
 epoch: 33, train_loss: 0.6533, test_loss: 0.8064, test_f1: 0.5815
 epoch: 34, train_loss: 0.6394, test_loss: 0.7618, test_f1: 0.6256
 epoch: 35, train_loss: 0.6377, test_loss: 0.7548, test_f1: 0.6174
 epoch: 36, train_loss: 0.6405, test_loss: 0.7854, test_f1: 0.6265
 epoch: 37, train_loss: 0.6281, test_loss: 0.7482, test_f1: 0.6118
 epoch: 38, train_loss: 0.6279, test_loss: 0.7285, test_f1: 0.6127
 epoch: 39, train_loss: 0.6183, test_loss: 0.7702, test_f1: 0.5972
 epoch: 40, train_loss: 0.6277, test_loss: 0.7629, test_f1: 0.6279
 epoch: 41, train_loss: 0.6168, test_loss: 0.7746, test_f1: 0.6248
 epoch: 42, train_loss: 0.6090, test_loss: 0.7953, test_f1: 0.6323
 epoch: 43, train_loss: 0.6023, test_loss: 0.8114, test_f1: 0.6052
 epoch: 44, train_loss: 0.6032, test_loss: 0.8112, test_f1: 0.5984
 epoch: 45, train_loss: 0.6130, test_loss: 0.8264, test_f1: 0.6278
 epoch: 46, train_loss: 0.5979, test_loss: 0.7641, test_f1: 0.6299
 epoch: 47, train_loss: 0.5784, test_loss: 0.8046, test_f1: 0.6604
 epoch: 48, train_loss: 0.5868, test_loss: 0.7708, test_f1: 0.6327
 epoch: 49, train_loss: 0.5766, test_loss: 0.7615, test_f1: 0.6034
 epoch: 50, train_loss: 0.5763, test_loss: 0.8446, test_f1: 0.6417
 epoch: 51, train_loss: 0.5612, test_loss: 0.8086, test_f1: 0.6365
 epoch: 52, train_loss: 0.5529, test_loss: 0.8159, test_f1: 0.6411
 epoch: 53, train_loss: 0.5422, test_loss: 0.8405, test_f1: 0.6413
 epoch: 54, train_loss: 0.5423, test_loss: 0.7753, test_f1: 0.6692
 epoch: 55, train_loss: 0.5425, test_loss: 0.7713, test_f1: 0.6451
 epoch: 56, train_loss: 0.5371, test_loss: 0.7677, test_f1: 0.6500
 epoch: 57, train_loss: 0.5388, test_loss: 0.7596, test_f1: 0.6299
 epoch: 58, train_loss: 0.5187, test_loss: 0.8123, test_f1: 0.6328
 epoch: 59, train_loss: 0.5443, test_loss: 0.8045, test_f1: 0.6499
 epoch: 60, train_loss: 0.5286, test_loss: 0.8600, test_f1: 0.6448
 epoch: 61, train_loss: 0.5400, test_loss: 0.8353, test_f1: 0.6360
 epoch: 62, train_loss: 0.5232, test_loss: 0.8413, test_f1: 0.6409
 epoch: 63, train_loss: 0.5333, test_loss: 0.7937, test_f1: 0.6542
 epoch: 64, train_loss: 0.5310, test_loss: 0.8424, test_f1: 0.6498
 epoch: 65, train_loss: 0.5174, test_loss: 0.7999, test_f1: 0.6586
 epoch: 66, train_loss: 0.5287, test_loss: 0.8166, test_f1: 0.6882
 epoch: 67, train_loss: 0.5139, test_loss: 0.8608, test_f1: 0.6653
 epoch: 68, train_loss: 0.5195, test_loss: 0.7839, test_f1: 0.6576
 epoch: 69, train_loss: 0.5105, test_loss: 0.8380, test_f1: 0.6696
 epoch: 70, train_loss: 0.5097, test_loss: 0.8451, test_f1: 0.6410
 epoch: 71, train_loss: 0.5185, test_loss: 0.8154, test_f1: 0.6422
 epoch: 72, train_loss: 0.5160, test_loss: 0.8272, test_f1: 0.6662
 epoch: 73, train_loss: 0.5075, test_loss: 0.7954, test_f1: 0.6472
 epoch: 74, train_loss: 0.5069, test_loss: 0.7961, test_f1: 0.6731
 epoch: 75, train_loss: 0.5024, test_loss: 0.8213, test_f1: 0.6563
 epoch: 76, train_loss: 0.4887, test_loss: 0.8181, test_f1: 0.6578
 epoch: 77, train_loss: 0.5038, test_loss: 0.7608, test_f1: 0.6409
 epoch: 78, train_loss: 0.4973, test_loss: 0.8150, test_f1: 0.6455
 epoch: 79, train_loss: 0.4927, test_loss: 0.8586, test_f1: 0.6668
 epoch: 80, train_loss: 0.4903, test_loss: 0.8280, test_f1: 0.6643
 epoch: 81, train_loss: 0.4941, test_loss: 0.8237, test_f1: 0.6725
 epoch: 82, train_loss: 0.4867, test_loss: 0.8570, test_f1: 0.6510
 epoch: 83, train_loss: 0.4786, test_loss: 0.8338, test_f1: 0.6691
 epoch: 84, train_loss: 0.4827, test_loss: 0.9102, test_f1: 0.6582
 epoch: 85, train_loss: 0.4763, test_loss: 0.8285, test_f1: 0.6627
 epoch: 86, train_loss: 0.4749, test_loss: 0.8898, test_f1: 0.6450
 epoch: 87, train_loss: 0.4805, test_loss: 0.8820, test_f1: 0.6731
 epoch: 88, train_loss: 0.4827, test_loss: 0.9257, test_f1: 0.6558
 epoch: 89, train_loss: 0.4600, test_loss: 0.8800, test_f1: 0.6553
 epoch: 90, train_loss: 0.4742, test_loss: 0.8159, test_f1: 0.6640
 epoch: 91, train_loss: 0.4656, test_loss: 0.9426, test_f1: 0.6780
 epoch: 92, train_loss: 0.4602, test_loss: 0.8446, test_f1: 0.6515
 epoch: 93, train_loss: 0.4599, test_loss: 0.9304, test_f1: 0.6706
 epoch: 94, train_loss: 0.4567, test_loss: 0.9426, test_f1: 0.6693
 epoch: 95, train_loss: 0.4640, test_loss: 0.8898, test_f1: 0.6797
 epoch: 96, train_loss: 0.4652, test_loss: 0.8822, test_f1: 0.6767
 epoch: 97, train_loss: 0.4619, test_loss: 0.8831, test_f1: 0.6560
 epoch: 98, train_loss: 0.4481, test_loss: 0.9468, test_f1: 0.6542
 epoch: 99, train_loss: 0.4558, test_loss: 0.9689, test_f1: 0.6631
##################ITERATION #3 ****************************************
 epoch: 0, train_loss: 1.1377, test_loss: 0.9749, test_f1: 0.4895
 epoch: 1, train_loss: 1.0215, test_loss: 0.9516, test_f1: 0.5188
 epoch: 2, train_loss: 0.9892, test_loss: 0.9310, test_f1: 0.5122
 epoch: 3, train_loss: 0.9583, test_loss: 0.9226, test_f1: 0.5501
 epoch: 4, train_loss: 0.9322, test_loss: 0.9078, test_f1: 0.5413
 epoch: 5, train_loss: 0.9276, test_loss: 0.9090, test_f1: 0.5561
 epoch: 6, train_loss: 0.9054, test_loss: 0.8905, test_f1: 0.5680
 epoch: 7, train_loss: 0.8900, test_loss: 0.8982, test_f1: 0.5679
 epoch: 8, train_loss: 0.8881, test_loss: 0.8735, test_f1: 0.5692
 epoch: 9, train_loss: 0.8740, test_loss: 0.8884, test_f1: 0.5656
 epoch: 10, train_loss: 0.8605, test_loss: 0.8796, test_f1: 0.5826
 epoch: 11, train_loss: 0.8435, test_loss: 0.8732, test_f1: 0.5881
 epoch: 12, train_loss: 0.8334, test_loss: 0.8641, test_f1: 0.5954
 epoch: 13, train_loss: 0.8136, test_loss: 0.8593, test_f1: 0.6013
 epoch: 14, train_loss: 0.8143, test_loss: 0.8832, test_f1: 0.5865
 epoch: 15, train_loss: 0.8014, test_loss: 0.8430, test_f1: 0.5942
 epoch: 16, train_loss: 0.7876, test_loss: 0.8509, test_f1: 0.6045
 epoch: 17, train_loss: 0.7775, test_loss: 0.8195, test_f1: 0.5979
 epoch: 18, train_loss: 0.7686, test_loss: 0.8392, test_f1: 0.6003
 epoch: 19, train_loss: 0.7630, test_loss: 0.8467, test_f1: 0.5914
 epoch: 20, train_loss: 0.7584, test_loss: 0.8266, test_f1: 0.6196
 epoch: 21, train_loss: 0.7442, test_loss: 0.8379, test_f1: 0.6141
 epoch: 22, train_loss: 0.7339, test_loss: 0.8594, test_f1: 0.5787
 epoch: 23, train_loss: 0.7335, test_loss: 0.8542, test_f1: 0.6133
 epoch: 24, train_loss: 0.7188, test_loss: 0.8662, test_f1: 0.6167
 epoch: 25, train_loss: 0.7187, test_loss: 0.8590, test_f1: 0.6159
 epoch: 26, train_loss: 0.6946, test_loss: 0.8192, test_f1: 0.6324
 epoch: 27, train_loss: 0.6936, test_loss: 0.8200, test_f1: 0.6192
 epoch: 28, train_loss: 0.6948, test_loss: 0.8308, test_f1: 0.6200
 epoch: 29, train_loss: 0.6938, test_loss: 0.8040, test_f1: 0.6028
 epoch: 30, train_loss: 0.6877, test_loss: 0.8265, test_f1: 0.6317
 epoch: 31, train_loss: 0.6826, test_loss: 0.8886, test_f1: 0.6012
 epoch: 32, train_loss: 0.6613, test_loss: 0.8717, test_f1: 0.6114
 epoch: 33, train_loss: 0.6560, test_loss: 0.8007, test_f1: 0.6144
 epoch: 34, train_loss: 0.6612, test_loss: 0.8347, test_f1: 0.6175
 epoch: 35, train_loss: 0.6636, test_loss: 0.8296, test_f1: 0.6118
 epoch: 36, train_loss: 0.6489, test_loss: 0.8039, test_f1: 0.6235
 epoch: 37, train_loss: 0.6512, test_loss: 0.8820, test_f1: 0.6391
 epoch: 38, train_loss: 0.6270, test_loss: 0.8159, test_f1: 0.6099
 epoch: 39, train_loss: 0.6341, test_loss: 0.8264, test_f1: 0.6156
 epoch: 40, train_loss: 0.6358, test_loss: 0.7915, test_f1: 0.6261
 epoch: 41, train_loss: 0.6297, test_loss: 0.8009, test_f1: 0.6279
 epoch: 42, train_loss: 0.6138, test_loss: 0.7695, test_f1: 0.6244
 epoch: 43, train_loss: 0.6199, test_loss: 0.9102, test_f1: 0.6052
 epoch: 44, train_loss: 0.6068, test_loss: 0.8289, test_f1: 0.6141
 epoch: 45, train_loss: 0.6185, test_loss: 0.8390, test_f1: 0.6250
 epoch: 46, train_loss: 0.5951, test_loss: 0.8135, test_f1: 0.6157
 epoch: 47, train_loss: 0.6069, test_loss: 0.8207, test_f1: 0.6145
 epoch: 48, train_loss: 0.6064, test_loss: 0.8139, test_f1: 0.6013
 epoch: 49, train_loss: 0.5906, test_loss: 0.7679, test_f1: 0.6570
 epoch: 50, train_loss: 0.6048, test_loss: 0.9243, test_f1: 0.5860
 epoch: 51, train_loss: 0.5763, test_loss: 0.8308, test_f1: 0.6261
 epoch: 52, train_loss: 0.5648, test_loss: 0.8455, test_f1: 0.6231
 epoch: 53, train_loss: 0.5530, test_loss: 0.7581, test_f1: 0.6316
 epoch: 54, train_loss: 0.5554, test_loss: 0.8096, test_f1: 0.6231
 epoch: 55, train_loss: 0.5578, test_loss: 0.8196, test_f1: 0.6163
 epoch: 56, train_loss: 0.5524, test_loss: 0.9287, test_f1: 0.6082
 epoch: 57, train_loss: 0.5515, test_loss: 0.8133, test_f1: 0.6390
 epoch: 58, train_loss: 0.5632, test_loss: 0.8225, test_f1: 0.6451
 epoch: 59, train_loss: 0.5441, test_loss: 0.8677, test_f1: 0.6422
 epoch: 60, train_loss: 0.5487, test_loss: 0.8762, test_f1: 0.6111
 epoch: 61, train_loss: 0.5537, test_loss: 0.8911, test_f1: 0.6147
 epoch: 62, train_loss: 0.5397, test_loss: 0.8978, test_f1: 0.6343
 epoch: 63, train_loss: 0.5374, test_loss: 0.8353, test_f1: 0.6273
 epoch: 64, train_loss: 0.5330, test_loss: 0.8494, test_f1: 0.6321
 epoch: 65, train_loss: 0.5306, test_loss: 0.9236, test_f1: 0.6060
 epoch: 66, train_loss: 0.5322, test_loss: 0.8611, test_f1: 0.6161
 epoch: 67, train_loss: 0.5349, test_loss: 0.8489, test_f1: 0.6208
 epoch: 68, train_loss: 0.5216, test_loss: 0.8799, test_f1: 0.6078
 epoch: 69, train_loss: 0.5200, test_loss: 0.8897, test_f1: 0.6242
 epoch: 70, train_loss: 0.5308, test_loss: 0.7979, test_f1: 0.6484
 epoch: 71, train_loss: 0.5187, test_loss: 0.8159, test_f1: 0.6294
 epoch: 72, train_loss: 0.5150, test_loss: 0.9205, test_f1: 0.6203
 epoch: 73, train_loss: 0.5181, test_loss: 0.9080, test_f1: 0.6123
 epoch: 74, train_loss: 0.5129, test_loss: 0.8179, test_f1: 0.6332
 epoch: 75, train_loss: 0.5150, test_loss: 0.8581, test_f1: 0.6212
 epoch: 76, train_loss: 0.5152, test_loss: 0.9025, test_f1: 0.6256
 epoch: 77, train_loss: 0.5124, test_loss: 0.8505, test_f1: 0.6269
 epoch: 78, train_loss: 0.4945, test_loss: 0.8477, test_f1: 0.6385
 epoch: 79, train_loss: 0.4992, test_loss: 0.9044, test_f1: 0.6293
 epoch: 80, train_loss: 0.4904, test_loss: 0.9168, test_f1: 0.6325
 epoch: 81, train_loss: 0.4966, test_loss: 0.8594, test_f1: 0.6431
 epoch: 82, train_loss: 0.4977, test_loss: 0.9246, test_f1: 0.6331
 epoch: 83, train_loss: 0.4856, test_loss: 0.8936, test_f1: 0.6329
 epoch: 84, train_loss: 0.4876, test_loss: 0.9704, test_f1: 0.6278
 epoch: 85, train_loss: 0.4820, test_loss: 1.0021, test_f1: 0.6060
 epoch: 86, train_loss: 0.4802, test_loss: 0.8747, test_f1: 0.6304
 epoch: 87, train_loss: 0.4837, test_loss: 0.8486, test_f1: 0.6465
 epoch: 88, train_loss: 0.4890, test_loss: 0.9745, test_f1: 0.6014
 epoch: 89, train_loss: 0.4869, test_loss: 0.8964, test_f1: 0.6324
 epoch: 90, train_loss: 0.4891, test_loss: 0.9326, test_f1: 0.6315
 epoch: 91, train_loss: 0.4798, test_loss: 1.0013, test_f1: 0.6233
 epoch: 92, train_loss: 0.4678, test_loss: 0.9634, test_f1: 0.6359
 epoch: 93, train_loss: 0.4771, test_loss: 0.9532, test_f1: 0.6617
 epoch: 94, train_loss: 0.4791, test_loss: 0.9652, test_f1: 0.6310
 epoch: 95, train_loss: 0.4642, test_loss: 0.9131, test_f1: 0.6232
 epoch: 96, train_loss: 0.4745, test_loss: 0.9036, test_f1: 0.6396
 epoch: 97, train_loss: 0.4572, test_loss: 0.9039, test_f1: 0.6380
 epoch: 98, train_loss: 0.4634, test_loss: 0.9099, test_f1: 0.6242
 epoch: 99, train_loss: 0.4595, test_loss: 0.9008, test_f1: 0.6350
##################ITERATION #4 ****************************************
 epoch: 0, train_loss: 1.1707, test_loss: 0.9956, test_f1: 0.5105
 epoch: 1, train_loss: 1.0350, test_loss: 0.9719, test_f1: 0.5120
 epoch: 2, train_loss: 0.9916, test_loss: 0.9523, test_f1: 0.5266
 epoch: 3, train_loss: 0.9671, test_loss: 0.9485, test_f1: 0.5335
 epoch: 4, train_loss: 0.9323, test_loss: 0.9208, test_f1: 0.5448
 epoch: 5, train_loss: 0.9268, test_loss: 0.9095, test_f1: 0.5661
 epoch: 6, train_loss: 0.8903, test_loss: 0.9191, test_f1: 0.5540
 epoch: 7, train_loss: 0.8746, test_loss: 0.8983, test_f1: 0.5515
 epoch: 8, train_loss: 0.8649, test_loss: 0.8996, test_f1: 0.5593
 epoch: 9, train_loss: 0.8511, test_loss: 0.8858, test_f1: 0.5977
 epoch: 10, train_loss: 0.8335, test_loss: 0.8515, test_f1: 0.5732
 epoch: 11, train_loss: 0.8293, test_loss: 0.8744, test_f1: 0.5486
 epoch: 12, train_loss: 0.8009, test_loss: 0.8972, test_f1: 0.5970
 epoch: 13, train_loss: 0.7946, test_loss: 0.8889, test_f1: 0.6083
 epoch: 14, train_loss: 0.7951, test_loss: 0.8342, test_f1: 0.5895
 epoch: 15, train_loss: 0.7846, test_loss: 0.8316, test_f1: 0.6122
 epoch: 16, train_loss: 0.7658, test_loss: 0.8446, test_f1: 0.6039
 epoch: 17, train_loss: 0.7677, test_loss: 0.8408, test_f1: 0.5798
 epoch: 18, train_loss: 0.7555, test_loss: 0.8299, test_f1: 0.5932
 epoch: 19, train_loss: 0.7514, test_loss: 0.8279, test_f1: 0.6018
 epoch: 20, train_loss: 0.7353, test_loss: 0.8307, test_f1: 0.5972
 epoch: 21, train_loss: 0.7329, test_loss: 0.8176, test_f1: 0.6057
 epoch: 22, train_loss: 0.7323, test_loss: 0.8223, test_f1: 0.6143
 epoch: 23, train_loss: 0.7109, test_loss: 0.8331, test_f1: 0.6224
 epoch: 24, train_loss: 0.7165, test_loss: 0.8366, test_f1: 0.6129
 epoch: 25, train_loss: 0.6999, test_loss: 0.8041, test_f1: 0.6229
 epoch: 26, train_loss: 0.6938, test_loss: 0.8160, test_f1: 0.6297
 epoch: 27, train_loss: 0.6915, test_loss: 0.8074, test_f1: 0.6154
 epoch: 28, train_loss: 0.6964, test_loss: 0.8109, test_f1: 0.6204
 epoch: 29, train_loss: 0.6760, test_loss: 0.8282, test_f1: 0.6387
 epoch: 30, train_loss: 0.6785, test_loss: 0.8137, test_f1: 0.6178
 epoch: 31, train_loss: 0.6681, test_loss: 0.7795, test_f1: 0.6143
 epoch: 32, train_loss: 0.6802, test_loss: 0.7178, test_f1: 0.6449
 epoch: 33, train_loss: 0.6528, test_loss: 0.7800, test_f1: 0.6368
 epoch: 34, train_loss: 0.6482, test_loss: 0.7903, test_f1: 0.6496
 epoch: 35, train_loss: 0.6511, test_loss: 0.8293, test_f1: 0.6625
 epoch: 36, train_loss: 0.6501, test_loss: 0.7694, test_f1: 0.6382
 epoch: 37, train_loss: 0.6449, test_loss: 0.7555, test_f1: 0.6571
 epoch: 38, train_loss: 0.6502, test_loss: 0.7713, test_f1: 0.6566
 epoch: 39, train_loss: 0.6278, test_loss: 0.7566, test_f1: 0.6469
 epoch: 40, train_loss: 0.6166, test_loss: 0.7776, test_f1: 0.6812
 epoch: 41, train_loss: 0.6207, test_loss: 0.7562, test_f1: 0.6439
 epoch: 42, train_loss: 0.6184, test_loss: 0.7209, test_f1: 0.6746
 epoch: 43, train_loss: 0.6110, test_loss: 0.7686, test_f1: 0.6655
 epoch: 44, train_loss: 0.6026, test_loss: 0.7462, test_f1: 0.6794
 epoch: 45, train_loss: 0.5932, test_loss: 0.7846, test_f1: 0.6657
 epoch: 46, train_loss: 0.5965, test_loss: 0.7716, test_f1: 0.6695
 epoch: 47, train_loss: 0.5918, test_loss: 0.7300, test_f1: 0.6569
 epoch: 48, train_loss: 0.5862, test_loss: 0.7543, test_f1: 0.6608
 epoch: 49, train_loss: 0.5849, test_loss: 0.7705, test_f1: 0.6758
 epoch: 50, train_loss: 0.5679, test_loss: 0.8060, test_f1: 0.6760
 epoch: 51, train_loss: 0.5622, test_loss: 0.7488, test_f1: 0.6715
 epoch: 52, train_loss: 0.5529, test_loss: 0.7715, test_f1: 0.6649
 epoch: 53, train_loss: 0.5401, test_loss: 0.7840, test_f1: 0.6706
 epoch: 54, train_loss: 0.5481, test_loss: 0.7408, test_f1: 0.6702
 epoch: 55, train_loss: 0.5575, test_loss: 0.7509, test_f1: 0.7024
 epoch: 56, train_loss: 0.5399, test_loss: 0.8041, test_f1: 0.6706
 epoch: 57, train_loss: 0.5423, test_loss: 0.7510, test_f1: 0.6494
 epoch: 58, train_loss: 0.5480, test_loss: 0.8079, test_f1: 0.6483
 epoch: 59, train_loss: 0.5323, test_loss: 0.7412, test_f1: 0.6690
 epoch: 60, train_loss: 0.5314, test_loss: 0.8193, test_f1: 0.6656
 epoch: 61, train_loss: 0.5372, test_loss: 0.7817, test_f1: 0.6580
 epoch: 62, train_loss: 0.5311, test_loss: 0.7836, test_f1: 0.6584
 epoch: 63, train_loss: 0.5403, test_loss: 0.7923, test_f1: 0.6768
 epoch: 64, train_loss: 0.5235, test_loss: 0.7756, test_f1: 0.6668
 epoch: 65, train_loss: 0.5307, test_loss: 0.7943, test_f1: 0.6739
 epoch: 66, train_loss: 0.5252, test_loss: 0.7327, test_f1: 0.6720
 epoch: 67, train_loss: 0.5194, test_loss: 0.8037, test_f1: 0.6408
 epoch: 68, train_loss: 0.5182, test_loss: 0.7468, test_f1: 0.6555
 epoch: 69, train_loss: 0.4924, test_loss: 0.7876, test_f1: 0.6669
 epoch: 70, train_loss: 0.5242, test_loss: 0.7097, test_f1: 0.6801
 epoch: 71, train_loss: 0.5200, test_loss: 0.8181, test_f1: 0.6867
 epoch: 72, train_loss: 0.5053, test_loss: 0.7372, test_f1: 0.7008
 epoch: 73, train_loss: 0.5212, test_loss: 0.8142, test_f1: 0.6878
 epoch: 74, train_loss: 0.5196, test_loss: 0.8067, test_f1: 0.6760
 epoch: 75, train_loss: 0.4901, test_loss: 0.7926, test_f1: 0.6765
 epoch: 76, train_loss: 0.4853, test_loss: 0.8073, test_f1: 0.6628
 epoch: 77, train_loss: 0.4891, test_loss: 0.8117, test_f1: 0.6676
 epoch: 78, train_loss: 0.4786, test_loss: 0.8074, test_f1: 0.6585
 epoch: 79, train_loss: 0.4809, test_loss: 0.9146, test_f1: 0.6562
 epoch: 80, train_loss: 0.4867, test_loss: 0.7937, test_f1: 0.6869
 epoch: 81, train_loss: 0.4902, test_loss: 0.8549, test_f1: 0.6693
 epoch: 82, train_loss: 0.4820, test_loss: 0.8588, test_f1: 0.6602
 epoch: 83, train_loss: 0.4685, test_loss: 0.8063, test_f1: 0.6767
 epoch: 84, train_loss: 0.4737, test_loss: 0.7796, test_f1: 0.6796
 epoch: 85, train_loss: 0.4768, test_loss: 0.7720, test_f1: 0.6794
 epoch: 86, train_loss: 0.4721, test_loss: 0.8309, test_f1: 0.6572
 epoch: 87, train_loss: 0.4833, test_loss: 0.7881, test_f1: 0.7004
 epoch: 88, train_loss: 0.4809, test_loss: 0.7767, test_f1: 0.6733
 epoch: 89, train_loss: 0.4560, test_loss: 0.7660, test_f1: 0.6960
 epoch: 90, train_loss: 0.4696, test_loss: 0.7583, test_f1: 0.6709
 epoch: 91, train_loss: 0.4577, test_loss: 0.8020, test_f1: 0.6724
 epoch: 92, train_loss: 0.4701, test_loss: 0.7744, test_f1: 0.6714
 epoch: 93, train_loss: 0.4571, test_loss: 0.7819, test_f1: 0.6987
 epoch: 94, train_loss: 0.4610, test_loss: 0.8268, test_f1: 0.6735
 epoch: 95, train_loss: 0.4533, test_loss: 0.8190, test_f1: 0.6656
 epoch: 96, train_loss: 0.4432, test_loss: 0.8011, test_f1: 0.6809
 epoch: 97, train_loss: 0.4557, test_loss: 0.7976, test_f1: 0.7029
 epoch: 98, train_loss: 0.4555, test_loss: 0.7990, test_f1: 0.6881
 epoch: 99, train_loss: 0.4476, test_loss: 0.8678, test_f1: 0.6660
##################ITERATION #5 ****************************************
 epoch: 0, train_loss: 1.1670, test_loss: 0.9605, test_f1: 0.4825
 epoch: 1, train_loss: 1.0265, test_loss: 0.9671, test_f1: 0.4667
 epoch: 2, train_loss: 0.9889, test_loss: 0.9333, test_f1: 0.5193
 epoch: 3, train_loss: 0.9685, test_loss: 0.9597, test_f1: 0.4839
 epoch: 4, train_loss: 0.9347, test_loss: 0.9127, test_f1: 0.5360
 epoch: 5, train_loss: 0.9266, test_loss: 0.9057, test_f1: 0.5551
 epoch: 6, train_loss: 0.8953, test_loss: 0.8922, test_f1: 0.5591
 epoch: 7, train_loss: 0.8783, test_loss: 0.8827, test_f1: 0.5710
 epoch: 8, train_loss: 0.8664, test_loss: 0.9028, test_f1: 0.5465
 epoch: 9, train_loss: 0.8451, test_loss: 0.8741, test_f1: 0.5641
 epoch: 10, train_loss: 0.8290, test_loss: 0.8594, test_f1: 0.5917
 epoch: 11, train_loss: 0.8351, test_loss: 0.8540, test_f1: 0.5882
 epoch: 12, train_loss: 0.8057, test_loss: 0.8441, test_f1: 0.5829
 epoch: 13, train_loss: 0.7978, test_loss: 0.8679, test_f1: 0.5904
 epoch: 14, train_loss: 0.7928, test_loss: 0.8454, test_f1: 0.6014
 epoch: 15, train_loss: 0.7889, test_loss: 0.8209, test_f1: 0.6148
 epoch: 16, train_loss: 0.7736, test_loss: 0.8271, test_f1: 0.6230
 epoch: 17, train_loss: 0.7705, test_loss: 0.8357, test_f1: 0.6223
 epoch: 18, train_loss: 0.7544, test_loss: 0.8830, test_f1: 0.5863
 epoch: 19, train_loss: 0.7553, test_loss: 0.8499, test_f1: 0.6319
 epoch: 20, train_loss: 0.7331, test_loss: 0.8513, test_f1: 0.6351
 epoch: 21, train_loss: 0.7381, test_loss: 0.8609, test_f1: 0.6014
 epoch: 22, train_loss: 0.7214, test_loss: 0.8353, test_f1: 0.6317
 epoch: 23, train_loss: 0.7167, test_loss: 0.8395, test_f1: 0.6328
 epoch: 24, train_loss: 0.7016, test_loss: 0.8272, test_f1: 0.6414
 epoch: 25, train_loss: 0.7099, test_loss: 0.8102, test_f1: 0.6346
 epoch: 26, train_loss: 0.7035, test_loss: 0.8123, test_f1: 0.6405
 epoch: 27, train_loss: 0.6979, test_loss: 0.8009, test_f1: 0.6273
 epoch: 28, train_loss: 0.6780, test_loss: 0.8144, test_f1: 0.6421
 epoch: 29, train_loss: 0.6745, test_loss: 0.8163, test_f1: 0.6308
 epoch: 30, train_loss: 0.6774, test_loss: 0.8166, test_f1: 0.6433
 epoch: 31, train_loss: 0.6646, test_loss: 0.8279, test_f1: 0.6314
 epoch: 32, train_loss: 0.6484, test_loss: 0.8494, test_f1: 0.6396
 epoch: 33, train_loss: 0.6671, test_loss: 0.8615, test_f1: 0.6036
 epoch: 34, train_loss: 0.6561, test_loss: 0.8881, test_f1: 0.6072
 epoch: 35, train_loss: 0.6560, test_loss: 0.8590, test_f1: 0.6167
 epoch: 36, train_loss: 0.6390, test_loss: 0.8162, test_f1: 0.6298
 epoch: 37, train_loss: 0.6424, test_loss: 0.8007, test_f1: 0.6414
 epoch: 38, train_loss: 0.6321, test_loss: 0.8511, test_f1: 0.6340
 epoch: 39, train_loss: 0.6317, test_loss: 0.8911, test_f1: 0.6099
 epoch: 40, train_loss: 0.6241, test_loss: 0.8423, test_f1: 0.6255
 epoch: 41, train_loss: 0.6193, test_loss: 0.8390, test_f1: 0.6334
 epoch: 42, train_loss: 0.6173, test_loss: 0.8136, test_f1: 0.6492
 epoch: 43, train_loss: 0.6005, test_loss: 0.8778, test_f1: 0.6195
 epoch: 44, train_loss: 0.5998, test_loss: 0.8603, test_f1: 0.6308
 epoch: 45, train_loss: 0.5916, test_loss: 0.8533, test_f1: 0.6421
 epoch: 46, train_loss: 0.5841, test_loss: 0.8155, test_f1: 0.6425
 epoch: 47, train_loss: 0.5795, test_loss: 0.8557, test_f1: 0.6311
 epoch: 48, train_loss: 0.5786, test_loss: 0.8421, test_f1: 0.6455
 epoch: 49, train_loss: 0.5964, test_loss: 0.8165, test_f1: 0.6120
 epoch: 50, train_loss: 0.5663, test_loss: 0.8228, test_f1: 0.6548
 epoch: 51, train_loss: 0.5656, test_loss: 0.8636, test_f1: 0.6419
 epoch: 52, train_loss: 0.5574, test_loss: 0.8324, test_f1: 0.6491
 epoch: 53, train_loss: 0.5450, test_loss: 0.8547, test_f1: 0.6481
 epoch: 54, train_loss: 0.5679, test_loss: 0.8201, test_f1: 0.6492
 epoch: 55, train_loss: 0.5399, test_loss: 0.8216, test_f1: 0.6451
 epoch: 56, train_loss: 0.5476, test_loss: 0.8849, test_f1: 0.6340
 epoch: 57, train_loss: 0.5304, test_loss: 0.9093, test_f1: 0.6128
 epoch: 58, train_loss: 0.5291, test_loss: 0.8615, test_f1: 0.6379
 epoch: 59, train_loss: 0.5307, test_loss: 0.8427, test_f1: 0.6510
 epoch: 60, train_loss: 0.5274, test_loss: 0.8542, test_f1: 0.6539
 epoch: 61, train_loss: 0.5283, test_loss: 0.8457, test_f1: 0.6552
 epoch: 62, train_loss: 0.5295, test_loss: 0.8873, test_f1: 0.6508
 epoch: 63, train_loss: 0.5129, test_loss: 0.8151, test_f1: 0.6491
 epoch: 64, train_loss: 0.5308, test_loss: 0.8824, test_f1: 0.6317
 epoch: 65, train_loss: 0.5327, test_loss: 0.8776, test_f1: 0.6337
 epoch: 66, train_loss: 0.5093, test_loss: 0.8616, test_f1: 0.6306
 epoch: 67, train_loss: 0.5172, test_loss: 0.8928, test_f1: 0.6290
 epoch: 68, train_loss: 0.5074, test_loss: 0.8821, test_f1: 0.6066
 epoch: 69, train_loss: 0.5038, test_loss: 0.8457, test_f1: 0.6304
 epoch: 70, train_loss: 0.5095, test_loss: 0.9099, test_f1: 0.6303
 epoch: 71, train_loss: 0.4989, test_loss: 0.9043, test_f1: 0.6331
 epoch: 72, train_loss: 0.5019, test_loss: 0.9176, test_f1: 0.6374
 epoch: 73, train_loss: 0.5125, test_loss: 0.8716, test_f1: 0.6486
 epoch: 74, train_loss: 0.4983, test_loss: 0.9539, test_f1: 0.6301
 epoch: 75, train_loss: 0.5034, test_loss: 1.0135, test_f1: 0.6318
 epoch: 76, train_loss: 0.4907, test_loss: 0.8939, test_f1: 0.6542
 epoch: 77, train_loss: 0.4919, test_loss: 0.8631, test_f1: 0.6448
 epoch: 78, train_loss: 0.4991, test_loss: 0.9152, test_f1: 0.6369
 epoch: 79, train_loss: 0.4802, test_loss: 0.9011, test_f1: 0.6462
 epoch: 80, train_loss: 0.4989, test_loss: 0.8740, test_f1: 0.6513
 epoch: 81, train_loss: 0.4793, test_loss: 0.9249, test_f1: 0.6491
 epoch: 82, train_loss: 0.4890, test_loss: 0.8756, test_f1: 0.6422
 epoch: 83, train_loss: 0.4774, test_loss: 0.8924, test_f1: 0.6458
 epoch: 84, train_loss: 0.4722, test_loss: 0.9360, test_f1: 0.6160
 epoch: 85, train_loss: 0.4650, test_loss: 0.8766, test_f1: 0.6398
 epoch: 86, train_loss: 0.4772, test_loss: 0.9588, test_f1: 0.6246
 epoch: 87, train_loss: 0.4720, test_loss: 0.9594, test_f1: 0.6312
 epoch: 88, train_loss: 0.4663, test_loss: 0.9356, test_f1: 0.6295
 epoch: 89, train_loss: 0.4638, test_loss: 0.9263, test_f1: 0.6197
 epoch: 90, train_loss: 0.4590, test_loss: 0.8742, test_f1: 0.6316
 epoch: 91, train_loss: 0.4688, test_loss: 0.9490, test_f1: 0.6329
 epoch: 92, train_loss: 0.4644, test_loss: 0.9185, test_f1: 0.6323
 epoch: 93, train_loss: 0.4701, test_loss: 0.9030, test_f1: 0.6390
 epoch: 94, train_loss: 0.4528, test_loss: 1.0060, test_f1: 0.6289
 epoch: 95, train_loss: 0.4596, test_loss: 0.9964, test_f1: 0.6252
 epoch: 96, train_loss: 0.4622, test_loss: 0.9554, test_f1: 0.6244
 epoch: 97, train_loss: 0.4507, test_loss: 0.9968, test_f1: 0.6339
 epoch: 98, train_loss: 0.4481, test_loss: 0.9794, test_f1: 0.6500
 epoch: 99, train_loss: 0.4420, test_loss: 0.9472, test_f1: 0.6527
##################ITERATION #6 ****************************************
 epoch: 0, train_loss: 1.2080, test_loss: 1.0218, test_f1: 0.5051
 epoch: 1, train_loss: 1.0664, test_loss: 0.9998, test_f1: 0.5070
 epoch: 2, train_loss: 1.0244, test_loss: 0.9862, test_f1: 0.5283
 epoch: 3, train_loss: 0.9829, test_loss: 0.9816, test_f1: 0.5103
 epoch: 4, train_loss: 0.9592, test_loss: 0.9638, test_f1: 0.5293
 epoch: 5, train_loss: 0.9483, test_loss: 0.9364, test_f1: 0.5369
 epoch: 6, train_loss: 0.9259, test_loss: 0.9343, test_f1: 0.5443
 epoch: 7, train_loss: 0.8998, test_loss: 0.9279, test_f1: 0.5595
 epoch: 8, train_loss: 0.8865, test_loss: 0.9222, test_f1: 0.5598
 epoch: 9, train_loss: 0.8835, test_loss: 0.9000, test_f1: 0.5848
 epoch: 10, train_loss: 0.8608, test_loss: 0.8990, test_f1: 0.5825
 epoch: 11, train_loss: 0.8483, test_loss: 0.8911, test_f1: 0.6063
 epoch: 12, train_loss: 0.8351, test_loss: 0.8860, test_f1: 0.5834
 epoch: 13, train_loss: 0.8219, test_loss: 0.9159, test_f1: 0.5704
 epoch: 14, train_loss: 0.8149, test_loss: 0.8796, test_f1: 0.6122
 epoch: 15, train_loss: 0.8023, test_loss: 0.8979, test_f1: 0.6131
 epoch: 16, train_loss: 0.7762, test_loss: 0.8606, test_f1: 0.6124
 epoch: 17, train_loss: 0.7782, test_loss: 0.8924, test_f1: 0.5979
 epoch: 18, train_loss: 0.7732, test_loss: 0.8503, test_f1: 0.6077
 epoch: 19, train_loss: 0.7626, test_loss: 0.8306, test_f1: 0.6156
 epoch: 20, train_loss: 0.7544, test_loss: 0.8390, test_f1: 0.6283
 epoch: 21, train_loss: 0.7412, test_loss: 0.8955, test_f1: 0.6100
 epoch: 22, train_loss: 0.7379, test_loss: 0.8589, test_f1: 0.5944
 epoch: 23, train_loss: 0.7238, test_loss: 0.8592, test_f1: 0.6016
 epoch: 24, train_loss: 0.7230, test_loss: 0.8122, test_f1: 0.6260
 epoch: 25, train_loss: 0.7163, test_loss: 0.8312, test_f1: 0.6240
 epoch: 26, train_loss: 0.7174, test_loss: 0.8046, test_f1: 0.6283
 epoch: 27, train_loss: 0.6916, test_loss: 0.8491, test_f1: 0.6150
 epoch: 28, train_loss: 0.6995, test_loss: 0.8345, test_f1: 0.6175
 epoch: 29, train_loss: 0.6752, test_loss: 0.8186, test_f1: 0.6057
 epoch: 30, train_loss: 0.6915, test_loss: 0.8092, test_f1: 0.6290
 epoch: 31, train_loss: 0.6789, test_loss: 0.8045, test_f1: 0.6099
 epoch: 32, train_loss: 0.6674, test_loss: 0.8205, test_f1: 0.6132
 epoch: 33, train_loss: 0.6642, test_loss: 0.8160, test_f1: 0.6101
 epoch: 34, train_loss: 0.6551, test_loss: 0.8773, test_f1: 0.5917
 epoch: 35, train_loss: 0.6590, test_loss: 0.8269, test_f1: 0.6402
 epoch: 36, train_loss: 0.6572, test_loss: 0.8891, test_f1: 0.6118
 epoch: 37, train_loss: 0.6420, test_loss: 0.7968, test_f1: 0.6176
 epoch: 38, train_loss: 0.6326, test_loss: 0.8830, test_f1: 0.5989
 epoch: 39, train_loss: 0.6248, test_loss: 0.8399, test_f1: 0.6328
 epoch: 40, train_loss: 0.6239, test_loss: 0.8216, test_f1: 0.6132
 epoch: 41, train_loss: 0.6240, test_loss: 0.9032, test_f1: 0.6042
 epoch: 42, train_loss: 0.6143, test_loss: 0.8871, test_f1: 0.5960
 epoch: 43, train_loss: 0.6079, test_loss: 0.8102, test_f1: 0.6238
 epoch: 44, train_loss: 0.6147, test_loss: 0.8532, test_f1: 0.6316
 epoch: 45, train_loss: 0.6045, test_loss: 0.8700, test_f1: 0.6128
 epoch: 46, train_loss: 0.5922, test_loss: 0.8107, test_f1: 0.6151
 epoch: 47, train_loss: 0.5903, test_loss: 0.8952, test_f1: 0.6117
 epoch: 48, train_loss: 0.5893, test_loss: 0.7913, test_f1: 0.6516
 epoch: 49, train_loss: 0.5880, test_loss: 0.8614, test_f1: 0.6153
 epoch: 50, train_loss: 0.5724, test_loss: 0.8755, test_f1: 0.6307
 epoch: 51, train_loss: 0.5722, test_loss: 0.8321, test_f1: 0.6330
 epoch: 52, train_loss: 0.5614, test_loss: 0.8655, test_f1: 0.6455
 epoch: 53, train_loss: 0.5697, test_loss: 0.8287, test_f1: 0.6396
 epoch: 54, train_loss: 0.5489, test_loss: 0.8845, test_f1: 0.6112
 epoch: 55, train_loss: 0.5503, test_loss: 0.8816, test_f1: 0.6229
 epoch: 56, train_loss: 0.5415, test_loss: 0.8440, test_f1: 0.6338
 epoch: 57, train_loss: 0.5604, test_loss: 0.8143, test_f1: 0.6286
 epoch: 58, train_loss: 0.5431, test_loss: 0.8147, test_f1: 0.6424
 epoch: 59, train_loss: 0.5312, test_loss: 0.8395, test_f1: 0.6308
 epoch: 60, train_loss: 0.5296, test_loss: 0.8887, test_f1: 0.6270
 epoch: 61, train_loss: 0.5353, test_loss: 0.8457, test_f1: 0.6430
 epoch: 62, train_loss: 0.5164, test_loss: 0.8399, test_f1: 0.6279
 epoch: 63, train_loss: 0.5302, test_loss: 0.8867, test_f1: 0.6121
 epoch: 64, train_loss: 0.5174, test_loss: 0.8435, test_f1: 0.6420
 epoch: 65, train_loss: 0.5229, test_loss: 0.8855, test_f1: 0.6392
 epoch: 66, train_loss: 0.5045, test_loss: 0.8346, test_f1: 0.6433
 epoch: 67, train_loss: 0.5241, test_loss: 0.8681, test_f1: 0.6303
 epoch: 68, train_loss: 0.5207, test_loss: 0.8614, test_f1: 0.6367
 epoch: 69, train_loss: 0.5041, test_loss: 0.8969, test_f1: 0.6237
 epoch: 70, train_loss: 0.5154, test_loss: 0.8860, test_f1: 0.6392
 epoch: 71, train_loss: 0.5184, test_loss: 0.8605, test_f1: 0.6302
 epoch: 72, train_loss: 0.4973, test_loss: 0.8531, test_f1: 0.6487
 epoch: 73, train_loss: 0.4982, test_loss: 0.8736, test_f1: 0.6325
 epoch: 74, train_loss: 0.5035, test_loss: 0.8483, test_f1: 0.6362
 epoch: 75, train_loss: 0.5043, test_loss: 0.9151, test_f1: 0.6296
 epoch: 76, train_loss: 0.5002, test_loss: 0.8734, test_f1: 0.6506
 epoch: 77, train_loss: 0.4874, test_loss: 0.9143, test_f1: 0.6311
 epoch: 78, train_loss: 0.4929, test_loss: 0.9069, test_f1: 0.6452
 epoch: 79, train_loss: 0.5095, test_loss: 0.8652, test_f1: 0.6435
 epoch: 80, train_loss: 0.4799, test_loss: 0.9290, test_f1: 0.6278
 epoch: 81, train_loss: 0.4777, test_loss: 0.9950, test_f1: 0.6276
 epoch: 82, train_loss: 0.4763, test_loss: 0.8692, test_f1: 0.6302
 epoch: 83, train_loss: 0.4787, test_loss: 0.9441, test_f1: 0.6423
 epoch: 84, train_loss: 0.4842, test_loss: 0.8634, test_f1: 0.6245
 epoch: 85, train_loss: 0.4705, test_loss: 0.8751, test_f1: 0.6252
 epoch: 86, train_loss: 0.4730, test_loss: 0.9082, test_f1: 0.6520
 epoch: 87, train_loss: 0.4798, test_loss: 0.8910, test_f1: 0.6551
 epoch: 88, train_loss: 0.4725, test_loss: 0.8991, test_f1: 0.6430
 epoch: 89, train_loss: 0.4669, test_loss: 0.9377, test_f1: 0.6465
 epoch: 90, train_loss: 0.4701, test_loss: 0.9320, test_f1: 0.6491
 epoch: 91, train_loss: 0.4666, test_loss: 0.9754, test_f1: 0.6285
 epoch: 92, train_loss: 0.4587, test_loss: 0.9497, test_f1: 0.6427
 epoch: 93, train_loss: 0.4705, test_loss: 0.9585, test_f1: 0.6399
 epoch: 94, train_loss: 0.4519, test_loss: 0.9630, test_f1: 0.6472
 epoch: 95, train_loss: 0.4505, test_loss: 0.9676, test_f1: 0.6318
 epoch: 96, train_loss: 0.4422, test_loss: 0.9557, test_f1: 0.6539
 epoch: 97, train_loss: 0.4572, test_loss: 0.9766, test_f1: 0.6522
 epoch: 98, train_loss: 0.4517, test_loss: 0.9144, test_f1: 0.6310
 epoch: 99, train_loss: 0.4555, test_loss: 0.9778, test_f1: 0.6470
##################ITERATION #7 ****************************************
 epoch: 0, train_loss: 1.1649, test_loss: 0.9789, test_f1: 0.4576
 epoch: 1, train_loss: 1.0370, test_loss: 0.9543, test_f1: 0.5085
 epoch: 2, train_loss: 0.9833, test_loss: 0.9332, test_f1: 0.4921
 epoch: 3, train_loss: 0.9596, test_loss: 0.9235, test_f1: 0.5338
 epoch: 4, train_loss: 0.9243, test_loss: 0.9407, test_f1: 0.5169
 epoch: 5, train_loss: 0.9131, test_loss: 0.9414, test_f1: 0.5189
 epoch: 6, train_loss: 0.8999, test_loss: 0.9356, test_f1: 0.5460
 epoch: 7, train_loss: 0.8734, test_loss: 0.8975, test_f1: 0.5579
 epoch: 8, train_loss: 0.8663, test_loss: 0.9225, test_f1: 0.5321
 epoch: 9, train_loss: 0.8498, test_loss: 0.8872, test_f1: 0.5543
 epoch: 10, train_loss: 0.8388, test_loss: 0.9006, test_f1: 0.5793
 epoch: 11, train_loss: 0.8150, test_loss: 0.8964, test_f1: 0.5605
 epoch: 12, train_loss: 0.8220, test_loss: 0.8621, test_f1: 0.5888
 epoch: 13, train_loss: 0.8081, test_loss: 0.8750, test_f1: 0.5748
 epoch: 14, train_loss: 0.7959, test_loss: 0.8865, test_f1: 0.5878
 epoch: 15, train_loss: 0.7926, test_loss: 0.8878, test_f1: 0.5800
 epoch: 16, train_loss: 0.7793, test_loss: 0.8887, test_f1: 0.6019
 epoch: 17, train_loss: 0.7657, test_loss: 0.8655, test_f1: 0.5809
 epoch: 18, train_loss: 0.7541, test_loss: 0.8468, test_f1: 0.6016
 epoch: 19, train_loss: 0.7517, test_loss: 0.8824, test_f1: 0.5832
 epoch: 20, train_loss: 0.7374, test_loss: 0.8532, test_f1: 0.5919
 epoch: 21, train_loss: 0.7317, test_loss: 0.8812, test_f1: 0.6027
 epoch: 22, train_loss: 0.7231, test_loss: 0.9535, test_f1: 0.5860
 epoch: 23, train_loss: 0.7244, test_loss: 0.8455, test_f1: 0.6343
 epoch: 24, train_loss: 0.7094, test_loss: 0.8914, test_f1: 0.6038
 epoch: 25, train_loss: 0.6995, test_loss: 0.8293, test_f1: 0.6272
 epoch: 26, train_loss: 0.6920, test_loss: 0.8470, test_f1: 0.5952
 epoch: 27, train_loss: 0.6830, test_loss: 0.8383, test_f1: 0.5976
 epoch: 28, train_loss: 0.6775, test_loss: 0.8283, test_f1: 0.6393
 epoch: 29, train_loss: 0.6782, test_loss: 0.8170, test_f1: 0.6245
 epoch: 30, train_loss: 0.6773, test_loss: 0.8638, test_f1: 0.6258
 epoch: 31, train_loss: 0.6685, test_loss: 0.8394, test_f1: 0.6063
 epoch: 32, train_loss: 0.6645, test_loss: 0.8621, test_f1: 0.6396
 epoch: 33, train_loss: 0.6377, test_loss: 0.8418, test_f1: 0.6302
 epoch: 34, train_loss: 0.6473, test_loss: 0.8190, test_f1: 0.6413
 epoch: 35, train_loss: 0.6331, test_loss: 0.8306, test_f1: 0.6394
 epoch: 36, train_loss: 0.6254, test_loss: 0.8407, test_f1: 0.6340
 epoch: 37, train_loss: 0.6320, test_loss: 0.8649, test_f1: 0.6375
 epoch: 38, train_loss: 0.6373, test_loss: 0.8601, test_f1: 0.6330
 epoch: 39, train_loss: 0.6116, test_loss: 0.8317, test_f1: 0.6418
 epoch: 40, train_loss: 0.6211, test_loss: 0.8930, test_f1: 0.6244
 epoch: 41, train_loss: 0.6152, test_loss: 0.8687, test_f1: 0.6234
 epoch: 42, train_loss: 0.6073, test_loss: 0.8900, test_f1: 0.6517
 epoch: 43, train_loss: 0.6135, test_loss: 0.8783, test_f1: 0.6285
 epoch: 44, train_loss: 0.5905, test_loss: 0.8835, test_f1: 0.6387
 epoch: 45, train_loss: 0.5905, test_loss: 0.8649, test_f1: 0.6340
 epoch: 46, train_loss: 0.5750, test_loss: 0.9678, test_f1: 0.5950
 epoch: 47, train_loss: 0.5869, test_loss: 0.9040, test_f1: 0.6364
 epoch: 48, train_loss: 0.5773, test_loss: 0.8546, test_f1: 0.6600
 epoch: 49, train_loss: 0.5779, test_loss: 0.8561, test_f1: 0.6534
 epoch: 50, train_loss: 0.5494, test_loss: 0.8824, test_f1: 0.6254
 epoch: 51, train_loss: 0.5473, test_loss: 0.8815, test_f1: 0.6547
 epoch: 52, train_loss: 0.5497, test_loss: 0.8696, test_f1: 0.6288
 epoch: 53, train_loss: 0.5359, test_loss: 0.8700, test_f1: 0.6716
 epoch: 54, train_loss: 0.5373, test_loss: 0.8839, test_f1: 0.6514
 epoch: 55, train_loss: 0.5298, test_loss: 0.8963, test_f1: 0.6517
 epoch: 56, train_loss: 0.5285, test_loss: 0.9001, test_f1: 0.6274
 epoch: 57, train_loss: 0.5370, test_loss: 0.8975, test_f1: 0.6410
 epoch: 58, train_loss: 0.5346, test_loss: 0.8989, test_f1: 0.6347
 epoch: 59, train_loss: 0.5311, test_loss: 0.8437, test_f1: 0.6547
 epoch: 60, train_loss: 0.5276, test_loss: 0.8686, test_f1: 0.6549
 epoch: 61, train_loss: 0.5259, test_loss: 0.9140, test_f1: 0.6478
 epoch: 62, train_loss: 0.5176, test_loss: 0.9271, test_f1: 0.6224
 epoch: 63, train_loss: 0.5159, test_loss: 0.8660, test_f1: 0.6474
 epoch: 64, train_loss: 0.5033, test_loss: 0.8617, test_f1: 0.6660
 epoch: 65, train_loss: 0.5092, test_loss: 0.9034, test_f1: 0.6346
 epoch: 66, train_loss: 0.5032, test_loss: 0.9120, test_f1: 0.6417
 epoch: 67, train_loss: 0.4992, test_loss: 0.9237, test_f1: 0.6543
 epoch: 68, train_loss: 0.5008, test_loss: 0.9045, test_f1: 0.6410
 epoch: 69, train_loss: 0.4976, test_loss: 0.8870, test_f1: 0.6475
 epoch: 70, train_loss: 0.4998, test_loss: 0.9186, test_f1: 0.6481
 epoch: 71, train_loss: 0.4944, test_loss: 0.9036, test_f1: 0.6536
 epoch: 72, train_loss: 0.4893, test_loss: 0.9391, test_f1: 0.6534
 epoch: 73, train_loss: 0.4897, test_loss: 0.9064, test_f1: 0.6544
 epoch: 74, train_loss: 0.4987, test_loss: 0.9297, test_f1: 0.6425
 epoch: 75, train_loss: 0.4937, test_loss: 0.9356, test_f1: 0.6512
 epoch: 76, train_loss: 0.4962, test_loss: 0.9484, test_f1: 0.6341
 epoch: 77, train_loss: 0.4865, test_loss: 0.9556, test_f1: 0.6500
 epoch: 78, train_loss: 0.4743, test_loss: 0.9575, test_f1: 0.6410
 epoch: 79, train_loss: 0.4826, test_loss: 0.9403, test_f1: 0.6533
 epoch: 80, train_loss: 0.4731, test_loss: 0.9437, test_f1: 0.6426
 epoch: 81, train_loss: 0.4849, test_loss: 0.9449, test_f1: 0.6541
 epoch: 82, train_loss: 0.4737, test_loss: 0.9733, test_f1: 0.6277
 epoch: 83, train_loss: 0.4726, test_loss: 0.9393, test_f1: 0.6586
 epoch: 84, train_loss: 0.4627, test_loss: 0.8870, test_f1: 0.6668
 epoch: 85, train_loss: 0.4743, test_loss: 1.0016, test_f1: 0.6490
 epoch: 86, train_loss: 0.4613, test_loss: 1.0084, test_f1: 0.6377
 epoch: 87, train_loss: 0.4651, test_loss: 1.0461, test_f1: 0.6419
 epoch: 88, train_loss: 0.4468, test_loss: 0.9431, test_f1: 0.6486
 epoch: 89, train_loss: 0.4534, test_loss: 0.9872, test_f1: 0.6330
 epoch: 90, train_loss: 0.4619, test_loss: 0.9671, test_f1: 0.6715
 epoch: 91, train_loss: 0.4561, test_loss: 0.9582, test_f1: 0.6689
 epoch: 92, train_loss: 0.4540, test_loss: 1.0028, test_f1: 0.6219
 epoch: 93, train_loss: 0.4555, test_loss: 0.9428, test_f1: 0.6531
 epoch: 94, train_loss: 0.4511, test_loss: 0.9531, test_f1: 0.6450
 epoch: 95, train_loss: 0.4334, test_loss: 0.9827, test_f1: 0.6645
 epoch: 96, train_loss: 0.4355, test_loss: 0.9628, test_f1: 0.6517
 epoch: 97, train_loss: 0.4423, test_loss: 1.0153, test_f1: 0.6415
 epoch: 98, train_loss: 0.4413, test_loss: 1.0290, test_f1: 0.6484
 epoch: 99, train_loss: 0.4349, test_loss: 0.9506, test_f1: 0.6642
##################ITERATION #8 ****************************************
 epoch: 0, train_loss: 1.2068, test_loss: 1.0202, test_f1: 0.4567
 epoch: 1, train_loss: 1.0685, test_loss: 0.9771, test_f1: 0.4564
 epoch: 2, train_loss: 1.0181, test_loss: 0.9668, test_f1: 0.4677
 epoch: 3, train_loss: 1.0017, test_loss: 0.9208, test_f1: 0.5363
 epoch: 4, train_loss: 0.9493, test_loss: 0.9482, test_f1: 0.4587
 epoch: 5, train_loss: 0.9500, test_loss: 0.8956, test_f1: 0.5188
 epoch: 6, train_loss: 0.9259, test_loss: 0.9141, test_f1: 0.5035
 epoch: 7, train_loss: 0.9009, test_loss: 0.8862, test_f1: 0.5474
 epoch: 8, train_loss: 0.8943, test_loss: 0.8985, test_f1: 0.5716
 epoch: 9, train_loss: 0.8726, test_loss: 0.8783, test_f1: 0.5724
 epoch: 10, train_loss: 0.8575, test_loss: 0.8986, test_f1: 0.5504
 epoch: 11, train_loss: 0.8473, test_loss: 0.8997, test_f1: 0.5834
 epoch: 12, train_loss: 0.8429, test_loss: 0.9163, test_f1: 0.5659
 epoch: 13, train_loss: 0.8211, test_loss: 0.8596, test_f1: 0.5894
 epoch: 14, train_loss: 0.8069, test_loss: 0.8678, test_f1: 0.5763
 epoch: 15, train_loss: 0.8011, test_loss: 0.8812, test_f1: 0.5880
 epoch: 16, train_loss: 0.7964, test_loss: 0.8862, test_f1: 0.6059
 epoch: 17, train_loss: 0.7864, test_loss: 0.8533, test_f1: 0.5756
 epoch: 18, train_loss: 0.7781, test_loss: 0.8502, test_f1: 0.5682
 epoch: 19, train_loss: 0.7693, test_loss: 0.8748, test_f1: 0.5651
 epoch: 20, train_loss: 0.7669, test_loss: 0.8795, test_f1: 0.5543
 epoch: 21, train_loss: 0.7565, test_loss: 0.9117, test_f1: 0.5696
 epoch: 22, train_loss: 0.7536, test_loss: 0.8199, test_f1: 0.6093
 epoch: 23, train_loss: 0.7430, test_loss: 0.8681, test_f1: 0.6058
 epoch: 24, train_loss: 0.7436, test_loss: 0.8333, test_f1: 0.6256
 epoch: 25, train_loss: 0.7278, test_loss: 0.8453, test_f1: 0.6071
 epoch: 26, train_loss: 0.7285, test_loss: 0.8639, test_f1: 0.5813
 epoch: 27, train_loss: 0.7220, test_loss: 0.8826, test_f1: 0.5854
 epoch: 28, train_loss: 0.7095, test_loss: 0.8454, test_f1: 0.5813
 epoch: 29, train_loss: 0.6992, test_loss: 0.8960, test_f1: 0.5764
 epoch: 30, train_loss: 0.7194, test_loss: 0.8532, test_f1: 0.6130
 epoch: 31, train_loss: 0.6930, test_loss: 0.8714, test_f1: 0.6002
 epoch: 32, train_loss: 0.6868, test_loss: 0.8361, test_f1: 0.6160
 epoch: 33, train_loss: 0.6734, test_loss: 0.8357, test_f1: 0.6237
 epoch: 34, train_loss: 0.6774, test_loss: 0.8307, test_f1: 0.6055
 epoch: 35, train_loss: 0.6619, test_loss: 0.8548, test_f1: 0.5987
 epoch: 36, train_loss: 0.6745, test_loss: 0.8227, test_f1: 0.6019
 epoch: 37, train_loss: 0.6646, test_loss: 0.8913, test_f1: 0.6023
 epoch: 38, train_loss: 0.6665, test_loss: 0.9196, test_f1: 0.5906
 epoch: 39, train_loss: 0.6530, test_loss: 0.8862, test_f1: 0.5821
 epoch: 40, train_loss: 0.6360, test_loss: 0.8727, test_f1: 0.5922
 epoch: 41, train_loss: 0.6309, test_loss: 0.8728, test_f1: 0.5997
 epoch: 42, train_loss: 0.6412, test_loss: 0.8462, test_f1: 0.6197
 epoch: 43, train_loss: 0.6345, test_loss: 0.8768, test_f1: 0.5955
 epoch: 44, train_loss: 0.6300, test_loss: 0.8509, test_f1: 0.6291
 epoch: 45, train_loss: 0.6151, test_loss: 0.8585, test_f1: 0.6275
 epoch: 46, train_loss: 0.6073, test_loss: 0.8703, test_f1: 0.6077
 epoch: 47, train_loss: 0.6166, test_loss: 0.8864, test_f1: 0.5965
 epoch: 48, train_loss: 0.6117, test_loss: 0.8741, test_f1: 0.6015
 epoch: 49, train_loss: 0.6101, test_loss: 0.8704, test_f1: 0.6204
 epoch: 50, train_loss: 0.6083, test_loss: 0.9187, test_f1: 0.6166
 epoch: 51, train_loss: 0.5802, test_loss: 0.8216, test_f1: 0.6305
 epoch: 52, train_loss: 0.5746, test_loss: 0.8524, test_f1: 0.6326
 epoch: 53, train_loss: 0.5752, test_loss: 0.8453, test_f1: 0.6315
 epoch: 54, train_loss: 0.5830, test_loss: 0.8352, test_f1: 0.6424
 epoch: 55, train_loss: 0.5738, test_loss: 0.8063, test_f1: 0.6189
 epoch: 56, train_loss: 0.5657, test_loss: 0.8284, test_f1: 0.6221
 epoch: 57, train_loss: 0.5577, test_loss: 0.8795, test_f1: 0.6072
 epoch: 58, train_loss: 0.5677, test_loss: 0.8870, test_f1: 0.6270
 epoch: 59, train_loss: 0.5746, test_loss: 0.8506, test_f1: 0.6556
 epoch: 60, train_loss: 0.5674, test_loss: 0.8995, test_f1: 0.6036
 epoch: 61, train_loss: 0.5620, test_loss: 0.8396, test_f1: 0.6565
 epoch: 62, train_loss: 0.5475, test_loss: 0.8408, test_f1: 0.6621
 epoch: 63, train_loss: 0.5352, test_loss: 0.8643, test_f1: 0.6165
 epoch: 64, train_loss: 0.5431, test_loss: 0.8624, test_f1: 0.6369
 epoch: 65, train_loss: 0.5473, test_loss: 0.8897, test_f1: 0.6345
 epoch: 66, train_loss: 0.5438, test_loss: 0.9121, test_f1: 0.6116
 epoch: 67, train_loss: 0.5247, test_loss: 0.8950, test_f1: 0.6330
 epoch: 68, train_loss: 0.5376, test_loss: 0.8673, test_f1: 0.6428
 epoch: 69, train_loss: 0.5310, test_loss: 0.8379, test_f1: 0.6395
 epoch: 70, train_loss: 0.5368, test_loss: 0.8664, test_f1: 0.6095
 epoch: 71, train_loss: 0.5348, test_loss: 0.9025, test_f1: 0.6296
 epoch: 72, train_loss: 0.5255, test_loss: 0.8490, test_f1: 0.6374
 epoch: 73, train_loss: 0.5322, test_loss: 0.8826, test_f1: 0.6512
 epoch: 74, train_loss: 0.5211, test_loss: 0.8927, test_f1: 0.6499
 epoch: 75, train_loss: 0.5298, test_loss: 0.9479, test_f1: 0.6217
 epoch: 76, train_loss: 0.5298, test_loss: 0.9108, test_f1: 0.6340
 epoch: 77, train_loss: 0.5224, test_loss: 0.9257, test_f1: 0.6409
 epoch: 78, train_loss: 0.5180, test_loss: 0.9341, test_f1: 0.6246
 epoch: 79, train_loss: 0.5162, test_loss: 0.9811, test_f1: 0.6207
 epoch: 80, train_loss: 0.5016, test_loss: 0.9421, test_f1: 0.6296
 epoch: 81, train_loss: 0.5204, test_loss: 0.9875, test_f1: 0.6398
 epoch: 82, train_loss: 0.5059, test_loss: 0.9440, test_f1: 0.6307
 epoch: 83, train_loss: 0.5044, test_loss: 0.9149, test_f1: 0.6268
 epoch: 84, train_loss: 0.5114, test_loss: 0.8758, test_f1: 0.6481
 epoch: 85, train_loss: 0.4960, test_loss: 0.8800, test_f1: 0.6426
 epoch: 86, train_loss: 0.5144, test_loss: 0.8771, test_f1: 0.6644
 epoch: 87, train_loss: 0.5074, test_loss: 0.9144, test_f1: 0.6480
 epoch: 88, train_loss: 0.5025, test_loss: 0.9421, test_f1: 0.6529
 epoch: 89, train_loss: 0.5066, test_loss: 0.9471, test_f1: 0.6300
 epoch: 90, train_loss: 0.4883, test_loss: 0.9067, test_f1: 0.6511
 epoch: 91, train_loss: 0.4977, test_loss: 0.9497, test_f1: 0.6250
 epoch: 92, train_loss: 0.4851, test_loss: 0.9431, test_f1: 0.6071
 epoch: 93, train_loss: 0.4921, test_loss: 1.0032, test_f1: 0.6391
 epoch: 94, train_loss: 0.4888, test_loss: 0.9646, test_f1: 0.6535
 epoch: 95, train_loss: 0.4905, test_loss: 0.9518, test_f1: 0.6498
 epoch: 96, train_loss: 0.4814, test_loss: 0.9731, test_f1: 0.6303
 epoch: 97, train_loss: 0.4881, test_loss: 0.9441, test_f1: 0.6466
 epoch: 98, train_loss: 0.4780, test_loss: 0.8591, test_f1: 0.6615
 epoch: 99, train_loss: 0.4851, test_loss: 0.9715, test_f1: 0.6259
##################ITERATION #9 ****************************************
 epoch: 0, train_loss: 1.2534, test_loss: 0.9862, test_f1: 0.4855
 epoch: 1, train_loss: 1.0744, test_loss: 0.9803, test_f1: 0.4970
 epoch: 2, train_loss: 1.0058, test_loss: 0.9389, test_f1: 0.5095
 epoch: 3, train_loss: 0.9830, test_loss: 0.9283, test_f1: 0.5271
 epoch: 4, train_loss: 0.9649, test_loss: 0.9168, test_f1: 0.5379
 epoch: 5, train_loss: 0.9530, test_loss: 0.9029, test_f1: 0.5472
 epoch: 6, train_loss: 0.9284, test_loss: 0.9020, test_f1: 0.5498
 epoch: 7, train_loss: 0.9114, test_loss: 0.8997, test_f1: 0.5315
 epoch: 8, train_loss: 0.8806, test_loss: 0.9157, test_f1: 0.5370
 epoch: 9, train_loss: 0.8837, test_loss: 0.8769, test_f1: 0.5452
 epoch: 10, train_loss: 0.8577, test_loss: 0.8538, test_f1: 0.5561
 epoch: 11, train_loss: 0.8547, test_loss: 0.8733, test_f1: 0.5618
 epoch: 12, train_loss: 0.8345, test_loss: 0.8576, test_f1: 0.5715
 epoch: 13, train_loss: 0.8190, test_loss: 0.8753, test_f1: 0.5887
 epoch: 14, train_loss: 0.8209, test_loss: 0.8707, test_f1: 0.5985
 epoch: 15, train_loss: 0.7978, test_loss: 0.8397, test_f1: 0.5705
 epoch: 16, train_loss: 0.8000, test_loss: 0.8226, test_f1: 0.5728
 epoch: 17, train_loss: 0.7961, test_loss: 0.8298, test_f1: 0.6036
 epoch: 18, train_loss: 0.7826, test_loss: 0.8034, test_f1: 0.6327
 epoch: 19, train_loss: 0.7651, test_loss: 0.7851, test_f1: 0.6029
 epoch: 20, train_loss: 0.7633, test_loss: 0.8184, test_f1: 0.6138
 epoch: 21, train_loss: 0.7512, test_loss: 0.7975, test_f1: 0.6545
 epoch: 22, train_loss: 0.7394, test_loss: 0.8485, test_f1: 0.6077
 epoch: 23, train_loss: 0.7425, test_loss: 0.8297, test_f1: 0.6176
 epoch: 24, train_loss: 0.7344, test_loss: 0.8065, test_f1: 0.6468
 epoch: 25, train_loss: 0.7335, test_loss: 0.7982, test_f1: 0.6289
 epoch: 26, train_loss: 0.7288, test_loss: 0.7783, test_f1: 0.6275
 epoch: 27, train_loss: 0.7209, test_loss: 0.8091, test_f1: 0.6408
 epoch: 28, train_loss: 0.7132, test_loss: 0.8226, test_f1: 0.6081
 epoch: 29, train_loss: 0.7102, test_loss: 0.8170, test_f1: 0.6355
 epoch: 30, train_loss: 0.7004, test_loss: 0.7668, test_f1: 0.6526
 epoch: 31, train_loss: 0.6869, test_loss: 0.8094, test_f1: 0.6420
 epoch: 32, train_loss: 0.6842, test_loss: 0.7942, test_f1: 0.6259
 epoch: 33, train_loss: 0.6883, test_loss: 0.8068, test_f1: 0.6329
 epoch: 34, train_loss: 0.6751, test_loss: 0.8071, test_f1: 0.6571
 epoch: 35, train_loss: 0.6580, test_loss: 0.7991, test_f1: 0.6414
 epoch: 36, train_loss: 0.6623, test_loss: 0.8070, test_f1: 0.6417
 epoch: 37, train_loss: 0.6545, test_loss: 0.8246, test_f1: 0.6278
 epoch: 38, train_loss: 0.6533, test_loss: 0.7875, test_f1: 0.6416
 epoch: 39, train_loss: 0.6428, test_loss: 0.8160, test_f1: 0.6490
 epoch: 40, train_loss: 0.6409, test_loss: 0.8086, test_f1: 0.6402
 epoch: 41, train_loss: 0.6305, test_loss: 0.7785, test_f1: 0.6380
 epoch: 42, train_loss: 0.6342, test_loss: 0.7809, test_f1: 0.6429
 epoch: 43, train_loss: 0.6267, test_loss: 0.8342, test_f1: 0.6380
 epoch: 44, train_loss: 0.6174, test_loss: 0.8437, test_f1: 0.6261
 epoch: 45, train_loss: 0.6100, test_loss: 0.8369, test_f1: 0.6379
 epoch: 46, train_loss: 0.6103, test_loss: 0.8083, test_f1: 0.6444
 epoch: 47, train_loss: 0.5981, test_loss: 0.8197, test_f1: 0.6211
 epoch: 48, train_loss: 0.6010, test_loss: 0.8722, test_f1: 0.6270
 epoch: 49, train_loss: 0.5998, test_loss: 0.8559, test_f1: 0.6382
 epoch: 50, train_loss: 0.5902, test_loss: 0.9115, test_f1: 0.6342
 epoch: 51, train_loss: 0.5758, test_loss: 0.8643, test_f1: 0.6255
 epoch: 52, train_loss: 0.5739, test_loss: 0.8197, test_f1: 0.6257
 epoch: 53, train_loss: 0.5551, test_loss: 0.8728, test_f1: 0.6343
 epoch: 54, train_loss: 0.5630, test_loss: 0.8201, test_f1: 0.6517
 epoch: 55, train_loss: 0.5695, test_loss: 0.8395, test_f1: 0.6386
 epoch: 56, train_loss: 0.5586, test_loss: 0.8284, test_f1: 0.6366
 epoch: 57, train_loss: 0.5525, test_loss: 0.8213, test_f1: 0.6377
 epoch: 58, train_loss: 0.5621, test_loss: 0.8099, test_f1: 0.6480
 epoch: 59, train_loss: 0.5606, test_loss: 0.8379, test_f1: 0.6414
 epoch: 60, train_loss: 0.5594, test_loss: 0.8638, test_f1: 0.6311
 epoch: 61, train_loss: 0.5441, test_loss: 0.8569, test_f1: 0.6311
 epoch: 62, train_loss: 0.5372, test_loss: 0.8567, test_f1: 0.6438
 epoch: 63, train_loss: 0.5390, test_loss: 0.8103, test_f1: 0.6374
 epoch: 64, train_loss: 0.5430, test_loss: 0.7846, test_f1: 0.6367
 epoch: 65, train_loss: 0.5514, test_loss: 0.8412, test_f1: 0.6415
 epoch: 66, train_loss: 0.5325, test_loss: 0.8155, test_f1: 0.6477
 epoch: 67, train_loss: 0.5324, test_loss: 0.8655, test_f1: 0.6403
 epoch: 68, train_loss: 0.5431, test_loss: 0.8670, test_f1: 0.6266
 epoch: 69, train_loss: 0.5260, test_loss: 0.8485, test_f1: 0.6418
 epoch: 70, train_loss: 0.5238, test_loss: 0.8391, test_f1: 0.6476
 epoch: 71, train_loss: 0.5266, test_loss: 0.8858, test_f1: 0.6371
 epoch: 72, train_loss: 0.5149, test_loss: 0.8512, test_f1: 0.6432
 epoch: 73, train_loss: 0.5326, test_loss: 0.8311, test_f1: 0.6448
 epoch: 74, train_loss: 0.5181, test_loss: 0.8653, test_f1: 0.6346
 epoch: 75, train_loss: 0.5157, test_loss: 0.8301, test_f1: 0.6468
 epoch: 76, train_loss: 0.5232, test_loss: 0.8916, test_f1: 0.6445
 epoch: 77, train_loss: 0.5173, test_loss: 0.8864, test_f1: 0.6443
 epoch: 78, train_loss: 0.5121, test_loss: 0.8778, test_f1: 0.6570
 epoch: 79, train_loss: 0.5102, test_loss: 0.9109, test_f1: 0.6211
 epoch: 80, train_loss: 0.5014, test_loss: 0.8463, test_f1: 0.6373
 epoch: 81, train_loss: 0.4980, test_loss: 0.8694, test_f1: 0.6346
 epoch: 82, train_loss: 0.4921, test_loss: 0.8612, test_f1: 0.6522
 epoch: 83, train_loss: 0.4929, test_loss: 0.8686, test_f1: 0.6625
 epoch: 84, train_loss: 0.4991, test_loss: 0.9409, test_f1: 0.6320
 epoch: 85, train_loss: 0.4863, test_loss: 0.9012, test_f1: 0.6628
 epoch: 86, train_loss: 0.4943, test_loss: 0.8343, test_f1: 0.6649
 epoch: 87, train_loss: 0.5031, test_loss: 0.8544, test_f1: 0.6471
 epoch: 88, train_loss: 0.4864, test_loss: 0.9589, test_f1: 0.6375
 epoch: 89, train_loss: 0.5030, test_loss: 0.8578, test_f1: 0.6534
 epoch: 90, train_loss: 0.4763, test_loss: 0.8767, test_f1: 0.6497
 epoch: 91, train_loss: 0.4903, test_loss: 0.8933, test_f1: 0.6404
 epoch: 92, train_loss: 0.4848, test_loss: 0.8269, test_f1: 0.6545
 epoch: 93, train_loss: 0.4841, test_loss: 0.8794, test_f1: 0.6491
 epoch: 94, train_loss: 0.4931, test_loss: 0.9251, test_f1: 0.6418
 epoch: 95, train_loss: 0.4813, test_loss: 0.9308, test_f1: 0.6544
 epoch: 96, train_loss: 0.4601, test_loss: 0.8810, test_f1: 0.6432
 epoch: 97, train_loss: 0.4534, test_loss: 0.8928, test_f1: 0.6472
 epoch: 98, train_loss: 0.4721, test_loss: 0.8816, test_f1: 0.6379
 epoch: 99, train_loss: 0.4578, test_loss: 0.9113, test_f1: 0.6608

Training completed in 827.58 seconds
Best F1: 0.7029 at epoch 97
Mean F1 across iterations: 0.6672  0.0157
========================FINAL RESULTS================================
FEGIN weighted F1: 0.7029  0.0157
python main.py --data ltspice_examples --representation component_pin --model FEGIN --layers 2 --hiddens 128 --batch_size 32 --lr 0.0001 --emb_size 250 --epochs 100 --save_appendix component_pin_L2_H128_BS32_LR0.0001_E250 --no_val
-----



STDERR:
  File "main.py", line 370, in <module>
    main()
  File "main.py", line 254, in main
    dataset = dataset_class(
  File "/home/philip/projects/ltspice_examples_code_repo/Circuit-Completion-Using-GNNs/component_classification_with_link_prediction_head/evaluation/FEGIN/kernel/circuit_datasets.py", line 15, in __init__
    self.data, self.slices = torch.load(self.processed_paths[0])
  File "/home/philip/.local/lib/python3.8/site-packages/torch/serialization.py", line 1040, in load
    warnings.warn(
  File "/usr/lib/python3.8/warnings.py", line 109, in _showwarnmsg
    sw(msg.message, msg.category, msg.filename, msg.lineno,
  File "main.py", line 47, in warn_with_traceback
    traceback.print_stack(file=log)
/home/philip/projects/ltspice_examples_code_repo/Circuit-Completion-Using-GNNs/component_classification_with_link_prediction_head/evaluation/FEGIN/kernel/circuit_datasets.py:15: FutureWarning: You are using `torch.load` with `weights_only=False` (the current default value), which uses the default pickle module implicitly. It is possible to construct malicious pickle data which will execute arbitrary code during unpickling (See https://github.com/pytorch/pytorch/blob/main/SECURITY.md#untrusted-models for more details). In a future release, the default value for `weights_only` will be flipped to `True`. This limits the functions that could be executed during unpickling. Arbitrary objects will no longer be allowed to be loaded via this mode unless they are explicitly allowlisted by the user via `torch.serialization.add_safe_globals`. We recommend you start setting `weights_only=True` for any use case where you don't have full control of the loaded file. Please open an issue on GitHub for any issues related to this experimental feature.
  self.data, self.slices = torch.load(self.processed_paths[0])
