STDOUT:
Results will be saved in /home/philip/projects/ltspice_examples_code_repo/Circuit-Completion-Using-GNNs/component_classification_with_link_prediction_head/evaluation/FEGIN/results/model_FEGIN_dataset_ltspice_demos
Command line input: python main.py --data ltspice_demos --representation component_component --model FEGIN --layers 3 --hiddens 32 --batch_size 256 --lr 0.01 --emb_size 250 --epochs 100 --save_appendix component_component_L3_H32_BS256_LR0.01_E250 --no_val
 is saved.
-----
ltspice_demos - FEGIN
Using 3 layers, 32 hidden units, h = 2
Loading component_component representation dataset
ENTERED
Training FEGIN on component_component representation
Train: 1565, Test: 383
##################ITERATION #0 ****************************************
 epoch: 0, train_loss: 1.3011, test_loss: 1.3159, test_f1: 0.1751
 epoch: 1, train_loss: 1.2101, test_loss: 1.2859, test_f1: 0.3019
 epoch: 2, train_loss: 1.1905, test_loss: 1.3465, test_f1: 0.2606
 epoch: 3, train_loss: 1.1691, test_loss: 1.3049, test_f1: 0.2281
 epoch: 4, train_loss: 1.1562, test_loss: 1.3647, test_f1: 0.3290
 epoch: 5, train_loss: 1.1593, test_loss: 1.3961, test_f1: 0.3336
 epoch: 6, train_loss: 1.1666, test_loss: 1.3879, test_f1: 0.2281
 epoch: 7, train_loss: 1.1631, test_loss: 1.2834, test_f1: 0.3970
 epoch: 8, train_loss: 1.1215, test_loss: 1.2222, test_f1: 0.4297
 epoch: 9, train_loss: 1.1119, test_loss: 1.1945, test_f1: 0.3320
 epoch: 10, train_loss: 1.0776, test_loss: 1.2076, test_f1: 0.2953
 epoch: 11, train_loss: 1.0710, test_loss: 1.3886, test_f1: 0.4098
 epoch: 12, train_loss: 1.0346, test_loss: 1.6113, test_f1: 0.3901
 epoch: 13, train_loss: 1.0536, test_loss: 1.2742, test_f1: 0.4057
 epoch: 14, train_loss: 0.9947, test_loss: 1.1788, test_f1: 0.5395
 epoch: 15, train_loss: 0.9740, test_loss: 1.1839, test_f1: 0.5335
 epoch: 16, train_loss: 0.9446, test_loss: 1.1347, test_f1: 0.4713
 epoch: 17, train_loss: 0.9269, test_loss: 1.2076, test_f1: 0.4311
 epoch: 18, train_loss: 0.8971, test_loss: 1.2852, test_f1: 0.3831
 epoch: 19, train_loss: 0.9276, test_loss: 1.3399, test_f1: 0.5158
 epoch: 20, train_loss: 0.9219, test_loss: 1.2589, test_f1: 0.4706
 epoch: 21, train_loss: 0.8830, test_loss: 1.0954, test_f1: 0.5667
 epoch: 22, train_loss: 0.8735, test_loss: 1.1424, test_f1: 0.5019
 epoch: 23, train_loss: 0.8526, test_loss: 1.3336, test_f1: 0.4333
 epoch: 24, train_loss: 0.8396, test_loss: 1.3213, test_f1: 0.4864
 epoch: 25, train_loss: 0.8413, test_loss: 1.1925, test_f1: 0.4679
 epoch: 26, train_loss: 0.8242, test_loss: 1.2136, test_f1: 0.4528
 epoch: 27, train_loss: 0.8140, test_loss: 1.3160, test_f1: 0.5133
 epoch: 28, train_loss: 0.8473, test_loss: 1.2873, test_f1: 0.5039
 epoch: 29, train_loss: 0.8321, test_loss: 1.0728, test_f1: 0.5069
 epoch: 30, train_loss: 0.8318, test_loss: 1.0083, test_f1: 0.5444
 epoch: 31, train_loss: 0.8190, test_loss: 1.0942, test_f1: 0.4637
 epoch: 32, train_loss: 0.8174, test_loss: 1.2849, test_f1: 0.5765
 epoch: 33, train_loss: 0.8095, test_loss: 1.3536, test_f1: 0.5663
 epoch: 34, train_loss: 0.8221, test_loss: 1.1623, test_f1: 0.5556
 epoch: 35, train_loss: 0.8092, test_loss: 1.2395, test_f1: 0.4887
 epoch: 36, train_loss: 0.8155, test_loss: 1.4622, test_f1: 0.4587
 epoch: 37, train_loss: 0.7902, test_loss: 1.1700, test_f1: 0.5497
 epoch: 38, train_loss: 0.7744, test_loss: 1.4742, test_f1: 0.5471
 epoch: 39, train_loss: 0.7984, test_loss: 1.6854, test_f1: 0.5054
 epoch: 40, train_loss: 0.7601, test_loss: 1.6403, test_f1: 0.5699
 epoch: 41, train_loss: 0.7757, test_loss: 1.7747, test_f1: 0.5537
 epoch: 42, train_loss: 0.7602, test_loss: 1.3074, test_f1: 0.5872
 epoch: 43, train_loss: 0.7743, test_loss: 1.1331, test_f1: 0.5278
 epoch: 44, train_loss: 0.7579, test_loss: 1.1683, test_f1: 0.5683
 epoch: 45, train_loss: 0.7942, test_loss: 1.4969, test_f1: 0.5192
 epoch: 46, train_loss: 0.8017, test_loss: 1.3893, test_f1: 0.5154
 epoch: 47, train_loss: 0.7738, test_loss: 1.2037, test_f1: 0.5419
 epoch: 48, train_loss: 0.7637, test_loss: 1.1621, test_f1: 0.5161
 epoch: 49, train_loss: 0.7451, test_loss: 1.1968, test_f1: 0.4512
 epoch: 50, train_loss: 0.7810, test_loss: 1.2122, test_f1: 0.5555
 epoch: 51, train_loss: 0.7923, test_loss: 1.1887, test_f1: 0.5449
 epoch: 52, train_loss: 0.7559, test_loss: 1.2451, test_f1: 0.5118
 epoch: 53, train_loss: 0.7372, test_loss: 1.2519, test_f1: 0.5654
 epoch: 54, train_loss: 0.7452, test_loss: 1.3878, test_f1: 0.5646
 epoch: 55, train_loss: 0.7119, test_loss: 1.4176, test_f1: 0.5501
 epoch: 56, train_loss: 0.7093, test_loss: 1.4900, test_f1: 0.4976
 epoch: 57, train_loss: 0.7209, test_loss: 1.5920, test_f1: 0.5513
 epoch: 58, train_loss: 0.7110, test_loss: 1.2644, test_f1: 0.5705
 epoch: 59, train_loss: 0.7284, test_loss: 1.4137, test_f1: 0.5349
 epoch: 60, train_loss: 0.7145, test_loss: 1.3400, test_f1: 0.5655
 epoch: 61, train_loss: 0.7029, test_loss: 1.4160, test_f1: 0.5738
 epoch: 62, train_loss: 0.6909, test_loss: 1.3757, test_f1: 0.5612
 epoch: 63, train_loss: 0.6750, test_loss: 1.2895, test_f1: 0.5734
 epoch: 64, train_loss: 0.6692, test_loss: 1.3422, test_f1: 0.5612
 epoch: 65, train_loss: 0.6661, test_loss: 1.4255, test_f1: 0.5975
 epoch: 66, train_loss: 0.6502, test_loss: 1.5242, test_f1: 0.5731
 epoch: 67, train_loss: 0.6613, test_loss: 1.5239, test_f1: 0.5662
 epoch: 68, train_loss: 0.6525, test_loss: 1.9151, test_f1: 0.5549
 epoch: 69, train_loss: 0.6647, test_loss: 2.0260, test_f1: 0.5530
 epoch: 70, train_loss: 0.6642, test_loss: 1.7901, test_f1: 0.5718
 epoch: 71, train_loss: 0.6466, test_loss: 1.7081, test_f1: 0.5545
 epoch: 72, train_loss: 0.6716, test_loss: 1.7607, test_f1: 0.5699
 epoch: 73, train_loss: 0.6738, test_loss: 1.8032, test_f1: 0.5828
 epoch: 74, train_loss: 0.6648, test_loss: 1.7044, test_f1: 0.5768
 epoch: 75, train_loss: 0.6387, test_loss: 1.7351, test_f1: 0.5674
 epoch: 76, train_loss: 0.6275, test_loss: 1.8627, test_f1: 0.5634
 epoch: 77, train_loss: 0.6206, test_loss: 2.0042, test_f1: 0.5866
 epoch: 78, train_loss: 0.6147, test_loss: 2.0900, test_f1: 0.5549
 epoch: 79, train_loss: 0.6287, test_loss: 1.9824, test_f1: 0.5347
 epoch: 80, train_loss: 0.6442, test_loss: 1.8358, test_f1: 0.5776
 epoch: 81, train_loss: 0.6204, test_loss: 1.7890, test_f1: 0.5835
 epoch: 82, train_loss: 0.6164, test_loss: 1.8782, test_f1: 0.5490
 epoch: 83, train_loss: 0.6197, test_loss: 1.9891, test_f1: 0.5442
 epoch: 84, train_loss: 0.6304, test_loss: 2.2477, test_f1: 0.5017
 epoch: 85, train_loss: 0.6688, test_loss: 1.7594, test_f1: 0.4825
 epoch: 86, train_loss: 0.6686, test_loss: 1.8670, test_f1: 0.5183
 epoch: 87, train_loss: 0.6867, test_loss: 1.8205, test_f1: 0.5732
 epoch: 88, train_loss: 0.6468, test_loss: 1.6288, test_f1: 0.5401
 epoch: 89, train_loss: 0.6258, test_loss: 1.4973, test_f1: 0.5726
 epoch: 90, train_loss: 0.6098, test_loss: 1.7705, test_f1: 0.5755
 epoch: 91, train_loss: 0.6184, test_loss: 2.0017, test_f1: 0.5720
 epoch: 92, train_loss: 0.6163, test_loss: 1.9710, test_f1: 0.6066
 epoch: 93, train_loss: 0.5987, test_loss: 1.6982, test_f1: 0.5838
 epoch: 94, train_loss: 0.6651, test_loss: 1.4948, test_f1: 0.5757
 epoch: 95, train_loss: 0.6824, test_loss: 1.4536, test_f1: 0.5673
 epoch: 96, train_loss: 0.6367, test_loss: 1.5466, test_f1: 0.6092
 epoch: 97, train_loss: 0.6167, test_loss: 1.6495, test_f1: 0.5668
 epoch: 98, train_loss: 0.6160, test_loss: 1.7004, test_f1: 0.5824
 epoch: 99, train_loss: 0.6028, test_loss: 1.5495, test_f1: 0.5895
##################ITERATION #1 ****************************************
 epoch: 0, train_loss: 1.3120, test_loss: 1.4057, test_f1: 0.2281
 epoch: 1, train_loss: 1.1977, test_loss: 1.2754, test_f1: 0.2281
 epoch: 2, train_loss: 1.1632, test_loss: 1.2618, test_f1: 0.2614
 epoch: 3, train_loss: 1.1260, test_loss: 1.2517, test_f1: 0.4232
 epoch: 4, train_loss: 1.1065, test_loss: 1.2611, test_f1: 0.3568
 epoch: 5, train_loss: 1.0901, test_loss: 1.3135, test_f1: 0.3099
 epoch: 6, train_loss: 1.0746, test_loss: 1.3277, test_f1: 0.3163
 epoch: 7, train_loss: 1.0834, test_loss: 1.4525, test_f1: 0.3505
 epoch: 8, train_loss: 1.0434, test_loss: 1.3291, test_f1: 0.3334
 epoch: 9, train_loss: 1.0347, test_loss: 1.4265, test_f1: 0.3029
 epoch: 10, train_loss: 0.9974, test_loss: 1.2181, test_f1: 0.4994
 epoch: 11, train_loss: 0.9678, test_loss: 1.1509, test_f1: 0.5105
 epoch: 12, train_loss: 0.9644, test_loss: 1.2063, test_f1: 0.4658
 epoch: 13, train_loss: 0.9657, test_loss: 1.1796, test_f1: 0.4621
 epoch: 14, train_loss: 0.9557, test_loss: 1.2012, test_f1: 0.4971
 epoch: 15, train_loss: 0.9236, test_loss: 1.2003, test_f1: 0.4984
 epoch: 16, train_loss: 0.9210, test_loss: 1.1178, test_f1: 0.5235
 epoch: 17, train_loss: 0.9130, test_loss: 1.1679, test_f1: 0.5162
 epoch: 18, train_loss: 0.8959, test_loss: 1.1874, test_f1: 0.4131
 epoch: 19, train_loss: 0.8945, test_loss: 1.1526, test_f1: 0.4812
 epoch: 20, train_loss: 0.8946, test_loss: 1.1265, test_f1: 0.5065
 epoch: 21, train_loss: 0.8684, test_loss: 1.1757, test_f1: 0.4734
 epoch: 22, train_loss: 0.8596, test_loss: 1.0958, test_f1: 0.5494
 epoch: 23, train_loss: 0.8620, test_loss: 1.0845, test_f1: 0.5608
 epoch: 24, train_loss: 0.8546, test_loss: 1.0861, test_f1: 0.4515
 epoch: 25, train_loss: 0.8552, test_loss: 1.0567, test_f1: 0.5179
 epoch: 26, train_loss: 0.8597, test_loss: 1.1088, test_f1: 0.5147
 epoch: 27, train_loss: 0.8343, test_loss: 1.0256, test_f1: 0.5741
 epoch: 28, train_loss: 0.8568, test_loss: 1.3660, test_f1: 0.4815
 epoch: 29, train_loss: 0.8309, test_loss: 1.1040, test_f1: 0.5154
 epoch: 30, train_loss: 0.8159, test_loss: 1.1100, test_f1: 0.5110
 epoch: 31, train_loss: 0.7995, test_loss: 1.1308, test_f1: 0.5488
 epoch: 32, train_loss: 0.8052, test_loss: 1.2893, test_f1: 0.4977
 epoch: 33, train_loss: 0.8139, test_loss: 1.1628, test_f1: 0.5305
 epoch: 34, train_loss: 0.8251, test_loss: 1.2793, test_f1: 0.5454
 epoch: 35, train_loss: 0.8240, test_loss: 1.1510, test_f1: 0.5625
 epoch: 36, train_loss: 0.8190, test_loss: 1.2467, test_f1: 0.5616
 epoch: 37, train_loss: 0.8289, test_loss: 1.6127, test_f1: 0.4128
 epoch: 38, train_loss: 0.8664, test_loss: 1.6295, test_f1: 0.4658
 epoch: 39, train_loss: 0.7895, test_loss: 1.1340, test_f1: 0.5485
 epoch: 40, train_loss: 0.8400, test_loss: 1.1068, test_f1: 0.5714
 epoch: 41, train_loss: 0.7956, test_loss: 1.0916, test_f1: 0.5911
 epoch: 42, train_loss: 0.7944, test_loss: 1.3680, test_f1: 0.4934
 epoch: 43, train_loss: 0.7948, test_loss: 1.1874, test_f1: 0.5439
 epoch: 44, train_loss: 0.7728, test_loss: 1.2473, test_f1: 0.5276
 epoch: 45, train_loss: 0.8104, test_loss: 1.1335, test_f1: 0.5765
 epoch: 46, train_loss: 0.7802, test_loss: 1.1074, test_f1: 0.5917
 epoch: 47, train_loss: 0.7868, test_loss: 1.3829, test_f1: 0.5256
 epoch: 48, train_loss: 0.7825, test_loss: 1.1954, test_f1: 0.5865
 epoch: 49, train_loss: 0.7798, test_loss: 1.0410, test_f1: 0.5949
 epoch: 50, train_loss: 0.7879, test_loss: 1.1621, test_f1: 0.5572
 epoch: 51, train_loss: 0.7544, test_loss: 1.0809, test_f1: 0.5552
 epoch: 52, train_loss: 0.7659, test_loss: 1.0932, test_f1: 0.5957
 epoch: 53, train_loss: 0.7313, test_loss: 1.1350, test_f1: 0.5891
 epoch: 54, train_loss: 0.7360, test_loss: 1.1848, test_f1: 0.5819
 epoch: 55, train_loss: 0.7204, test_loss: 1.3021, test_f1: 0.5679
 epoch: 56, train_loss: 0.7461, test_loss: 1.3913, test_f1: 0.5533
 epoch: 57, train_loss: 0.7503, test_loss: 1.2967, test_f1: 0.5994
 epoch: 58, train_loss: 0.7367, test_loss: 1.2930, test_f1: 0.5879
 epoch: 59, train_loss: 0.7283, test_loss: 1.3365, test_f1: 0.6009
 epoch: 60, train_loss: 0.7214, test_loss: 1.3361, test_f1: 0.5713
 epoch: 61, train_loss: 0.7172, test_loss: 1.1956, test_f1: 0.5606
 epoch: 62, train_loss: 0.7087, test_loss: 1.2143, test_f1: 0.5828
 epoch: 63, train_loss: 0.6937, test_loss: 1.2222, test_f1: 0.5691
 epoch: 64, train_loss: 0.6842, test_loss: 1.3087, test_f1: 0.5651
 epoch: 65, train_loss: 0.6750, test_loss: 1.2274, test_f1: 0.5923
 epoch: 66, train_loss: 0.6775, test_loss: 1.2368, test_f1: 0.6061
 epoch: 67, train_loss: 0.6822, test_loss: 1.2760, test_f1: 0.6359
 epoch: 68, train_loss: 0.6977, test_loss: 1.3188, test_f1: 0.5964
 epoch: 69, train_loss: 0.7495, test_loss: 1.4062, test_f1: 0.5812
 epoch: 70, train_loss: 0.7364, test_loss: 1.4837, test_f1: 0.5871
 epoch: 71, train_loss: 0.7610, test_loss: 1.3664, test_f1: 0.5691
 epoch: 72, train_loss: 0.7171, test_loss: 1.1723, test_f1: 0.5995
 epoch: 73, train_loss: 0.7175, test_loss: 1.2533, test_f1: 0.5684
 epoch: 74, train_loss: 0.7093, test_loss: 1.3704, test_f1: 0.5993
 epoch: 75, train_loss: 0.6912, test_loss: 1.4115, test_f1: 0.5829
 epoch: 76, train_loss: 0.6980, test_loss: 1.2955, test_f1: 0.5739
 epoch: 77, train_loss: 0.6934, test_loss: 1.2436, test_f1: 0.5674
 epoch: 78, train_loss: 0.6673, test_loss: 1.2786, test_f1: 0.5888
 epoch: 79, train_loss: 0.6813, test_loss: 1.3066, test_f1: 0.5836
 epoch: 80, train_loss: 0.6582, test_loss: 1.3505, test_f1: 0.5736
 epoch: 81, train_loss: 0.6624, test_loss: 1.3479, test_f1: 0.5760
 epoch: 82, train_loss: 0.6640, test_loss: 1.3817, test_f1: 0.5881
 epoch: 83, train_loss: 0.6502, test_loss: 1.3140, test_f1: 0.6027
 epoch: 84, train_loss: 0.6667, test_loss: 1.2076, test_f1: 0.6393
 epoch: 85, train_loss: 0.6490, test_loss: 1.2496, test_f1: 0.6297
 epoch: 86, train_loss: 0.6587, test_loss: 1.3889, test_f1: 0.6102
 epoch: 87, train_loss: 0.6518, test_loss: 1.3577, test_f1: 0.6098
 epoch: 88, train_loss: 0.6253, test_loss: 1.2571, test_f1: 0.6310
 epoch: 89, train_loss: 0.6430, test_loss: 1.2643, test_f1: 0.6211
 epoch: 90, train_loss: 0.6715, test_loss: 1.3441, test_f1: 0.5794
 epoch: 91, train_loss: 0.6842, test_loss: 1.2094, test_f1: 0.6028
 epoch: 92, train_loss: 0.6697, test_loss: 1.3087, test_f1: 0.5931
 epoch: 93, train_loss: 0.6678, test_loss: 1.5811, test_f1: 0.5591
 epoch: 94, train_loss: 0.6304, test_loss: 1.8642, test_f1: 0.5468
 epoch: 95, train_loss: 0.6455, test_loss: 1.5972, test_f1: 0.5928
 epoch: 96, train_loss: 0.6530, test_loss: 1.4597, test_f1: 0.6362
 epoch: 97, train_loss: 0.6627, test_loss: 1.5487, test_f1: 0.5743
 epoch: 98, train_loss: 0.6615, test_loss: 1.4795, test_f1: 0.6105
 epoch: 99, train_loss: 0.6488, test_loss: 1.6777, test_f1: 0.5739
##################ITERATION #2 ****************************************
 epoch: 0, train_loss: 1.3255, test_loss: 1.5880, test_f1: 0.2164
 epoch: 1, train_loss: 1.1910, test_loss: 1.2727, test_f1: 0.3753
 epoch: 2, train_loss: 1.1413, test_loss: 1.2319, test_f1: 0.3148
 epoch: 3, train_loss: 1.1189, test_loss: 1.2108, test_f1: 0.3206
 epoch: 4, train_loss: 1.0832, test_loss: 1.2012, test_f1: 0.4310
 epoch: 5, train_loss: 1.0670, test_loss: 1.1941, test_f1: 0.4015
 epoch: 6, train_loss: 1.0537, test_loss: 1.1877, test_f1: 0.4521
 epoch: 7, train_loss: 1.0287, test_loss: 1.1610, test_f1: 0.4092
 epoch: 8, train_loss: 1.0179, test_loss: 1.2775, test_f1: 0.3868
 epoch: 9, train_loss: 0.9939, test_loss: 1.3539, test_f1: 0.3968
 epoch: 10, train_loss: 0.9747, test_loss: 1.2478, test_f1: 0.4821
 epoch: 11, train_loss: 0.9488, test_loss: 1.7675, test_f1: 0.4119
 epoch: 12, train_loss: 0.9597, test_loss: 1.2695, test_f1: 0.4740
 epoch: 13, train_loss: 0.9514, test_loss: 1.4179, test_f1: 0.4116
 epoch: 14, train_loss: 0.9250, test_loss: 1.2354, test_f1: 0.4337
 epoch: 15, train_loss: 0.9378, test_loss: 1.2241, test_f1: 0.5125
 epoch: 16, train_loss: 0.9420, test_loss: 1.4491, test_f1: 0.4290
 epoch: 17, train_loss: 0.9668, test_loss: 1.1007, test_f1: 0.5263
 epoch: 18, train_loss: 0.9430, test_loss: 1.1176, test_f1: 0.4989
 epoch: 19, train_loss: 0.9362, test_loss: 1.1761, test_f1: 0.4961
 epoch: 20, train_loss: 0.9169, test_loss: 1.3589, test_f1: 0.3964
 epoch: 21, train_loss: 0.9006, test_loss: 1.1230, test_f1: 0.5117
 epoch: 22, train_loss: 0.8786, test_loss: 1.1028, test_f1: 0.5168
 epoch: 23, train_loss: 0.8727, test_loss: 1.0844, test_f1: 0.5327
 epoch: 24, train_loss: 0.8609, test_loss: 1.1264, test_f1: 0.5347
 epoch: 25, train_loss: 0.8702, test_loss: 1.6030, test_f1: 0.4773
 epoch: 26, train_loss: 0.8452, test_loss: 2.0836, test_f1: 0.4671
 epoch: 27, train_loss: 0.8484, test_loss: 1.8483, test_f1: 0.4778
 epoch: 28, train_loss: 0.8273, test_loss: 1.4371, test_f1: 0.5049
 epoch: 29, train_loss: 0.8492, test_loss: 2.4234, test_f1: 0.5039
 epoch: 30, train_loss: 0.9024, test_loss: 1.6441, test_f1: 0.5056
 epoch: 31, train_loss: 0.8895, test_loss: 1.1104, test_f1: 0.5090
 epoch: 32, train_loss: 0.8704, test_loss: 1.0928, test_f1: 0.5187
 epoch: 33, train_loss: 0.8402, test_loss: 1.0548, test_f1: 0.5644
 epoch: 34, train_loss: 0.8591, test_loss: 1.1160, test_f1: 0.5563
 epoch: 35, train_loss: 0.8151, test_loss: 1.0145, test_f1: 0.5684
 epoch: 36, train_loss: 0.8222, test_loss: 1.1221, test_f1: 0.5218
 epoch: 37, train_loss: 0.8135, test_loss: 1.1064, test_f1: 0.5444
 epoch: 38, train_loss: 0.8118, test_loss: 1.0744, test_f1: 0.5557
 epoch: 39, train_loss: 0.7973, test_loss: 1.0717, test_f1: 0.5663
 epoch: 40, train_loss: 0.7727, test_loss: 1.0788, test_f1: 0.5437
 epoch: 41, train_loss: 0.7991, test_loss: 1.1482, test_f1: 0.5603
 epoch: 42, train_loss: 0.7987, test_loss: 1.2211, test_f1: 0.5225
 epoch: 43, train_loss: 0.8491, test_loss: 1.1840, test_f1: 0.5205
 epoch: 44, train_loss: 0.8278, test_loss: 1.2067, test_f1: 0.4970
 epoch: 45, train_loss: 0.7834, test_loss: 1.1210, test_f1: 0.5617
 epoch: 46, train_loss: 0.7793, test_loss: 1.1015, test_f1: 0.5835
 epoch: 47, train_loss: 0.7787, test_loss: 1.1209, test_f1: 0.5448
 epoch: 48, train_loss: 0.7533, test_loss: 1.5467, test_f1: 0.4699
 epoch: 49, train_loss: 0.7613, test_loss: 1.3175, test_f1: 0.5357
 epoch: 50, train_loss: 0.7482, test_loss: 1.1893, test_f1: 0.5717
 epoch: 51, train_loss: 0.7359, test_loss: 1.0599, test_f1: 0.5913
 epoch: 52, train_loss: 0.7299, test_loss: 1.1691, test_f1: 0.5699
 epoch: 53, train_loss: 0.6982, test_loss: 1.2379, test_f1: 0.5266
 epoch: 54, train_loss: 0.6813, test_loss: 1.2212, test_f1: 0.5214
 epoch: 55, train_loss: 0.6718, test_loss: 1.1525, test_f1: 0.5716
 epoch: 56, train_loss: 0.6755, test_loss: 1.2016, test_f1: 0.5889
 epoch: 57, train_loss: 0.6557, test_loss: 1.3325, test_f1: 0.5538
 epoch: 58, train_loss: 0.6580, test_loss: 1.2284, test_f1: 0.5513
 epoch: 59, train_loss: 0.6549, test_loss: 1.1848, test_f1: 0.5308
 epoch: 60, train_loss: 0.6730, test_loss: 1.0982, test_f1: 0.5966
 epoch: 61, train_loss: 0.6481, test_loss: 1.2427, test_f1: 0.5293
 epoch: 62, train_loss: 0.6674, test_loss: 1.2398, test_f1: 0.5012
 epoch: 63, train_loss: 0.6611, test_loss: 1.1123, test_f1: 0.5825
 epoch: 64, train_loss: 0.6752, test_loss: 1.1943, test_f1: 0.5741
 epoch: 65, train_loss: 0.6411, test_loss: 1.2660, test_f1: 0.5497
 epoch: 66, train_loss: 0.6250, test_loss: 1.3951, test_f1: 0.5017
 epoch: 67, train_loss: 0.6491, test_loss: 1.3685, test_f1: 0.5291
 epoch: 68, train_loss: 0.6458, test_loss: 1.3073, test_f1: 0.5536
 epoch: 69, train_loss: 0.6445, test_loss: 1.2469, test_f1: 0.5838
 epoch: 70, train_loss: 0.6541, test_loss: 1.3936, test_f1: 0.5215
 epoch: 71, train_loss: 0.6324, test_loss: 1.5694, test_f1: 0.5273
 epoch: 72, train_loss: 0.6329, test_loss: 1.5388, test_f1: 0.5230
 epoch: 73, train_loss: 0.6168, test_loss: 1.2820, test_f1: 0.5691
 epoch: 74, train_loss: 0.6190, test_loss: 1.1670, test_f1: 0.5714
 epoch: 75, train_loss: 0.6146, test_loss: 1.1309, test_f1: 0.5799
 epoch: 76, train_loss: 0.6203, test_loss: 1.1177, test_f1: 0.5956
 epoch: 77, train_loss: 0.5818, test_loss: 1.2931, test_f1: 0.5621
 epoch: 78, train_loss: 0.6069, test_loss: 1.4400, test_f1: 0.5118
 epoch: 79, train_loss: 0.5631, test_loss: 1.4840, test_f1: 0.5004
 epoch: 80, train_loss: 0.5957, test_loss: 1.3191, test_f1: 0.5241
 epoch: 81, train_loss: 0.6185, test_loss: 1.2538, test_f1: 0.5717
 epoch: 82, train_loss: 0.6206, test_loss: 1.3590, test_f1: 0.5517
 epoch: 83, train_loss: 0.6366, test_loss: 1.1854, test_f1: 0.6073
 epoch: 84, train_loss: 0.6681, test_loss: 1.2672, test_f1: 0.5797
 epoch: 85, train_loss: 0.6551, test_loss: 1.5883, test_f1: 0.5053
 epoch: 86, train_loss: 0.6148, test_loss: 1.4911, test_f1: 0.5201
 epoch: 87, train_loss: 0.6033, test_loss: 1.3094, test_f1: 0.5498
 epoch: 88, train_loss: 0.5828, test_loss: 1.2880, test_f1: 0.5498
 epoch: 89, train_loss: 0.6238, test_loss: 1.4084, test_f1: 0.5150
 epoch: 90, train_loss: 0.5862, test_loss: 1.3084, test_f1: 0.5468
 epoch: 91, train_loss: 0.5859, test_loss: 1.1958, test_f1: 0.5818
 epoch: 92, train_loss: 0.5563, test_loss: 1.3444, test_f1: 0.5655
 epoch: 93, train_loss: 0.5485, test_loss: 1.3279, test_f1: 0.6119
 epoch: 94, train_loss: 0.5954, test_loss: 1.4945, test_f1: 0.5513
 epoch: 95, train_loss: 0.6170, test_loss: 1.6642, test_f1: 0.5018
 epoch: 96, train_loss: 0.5930, test_loss: 1.3988, test_f1: 0.5174
 epoch: 97, train_loss: 0.5754, test_loss: 1.2407, test_f1: 0.6090
 epoch: 98, train_loss: 0.5651, test_loss: 1.3347, test_f1: 0.6017
 epoch: 99, train_loss: 0.5927, test_loss: 1.4773, test_f1: 0.5372
##################ITERATION #3 ****************************************
 epoch: 0, train_loss: 1.3406, test_loss: 1.5032, test_f1: 0.3387
 epoch: 1, train_loss: 1.2086, test_loss: 1.4102, test_f1: 0.3463
 epoch: 2, train_loss: 1.1847, test_loss: 1.3097, test_f1: 0.3553
 epoch: 3, train_loss: 1.1545, test_loss: 1.2366, test_f1: 0.3447
 epoch: 4, train_loss: 1.1061, test_loss: 1.2024, test_f1: 0.4395
 epoch: 5, train_loss: 1.1014, test_loss: 1.1848, test_f1: 0.4584
 epoch: 6, train_loss: 1.0808, test_loss: 1.1904, test_f1: 0.4676
 epoch: 7, train_loss: 1.0397, test_loss: 1.4450, test_f1: 0.4678
 epoch: 8, train_loss: 1.0439, test_loss: 1.3677, test_f1: 0.5175
 epoch: 9, train_loss: 1.0273, test_loss: 1.1957, test_f1: 0.3980
 epoch: 10, train_loss: 1.0539, test_loss: 1.2165, test_f1: 0.4315
 epoch: 11, train_loss: 1.0328, test_loss: 1.3701, test_f1: 0.3461
 epoch: 12, train_loss: 1.0014, test_loss: 1.1361, test_f1: 0.3988
 epoch: 13, train_loss: 1.0155, test_loss: 1.1220, test_f1: 0.4506
 epoch: 14, train_loss: 0.9583, test_loss: 1.3737, test_f1: 0.4338
 epoch: 15, train_loss: 0.9535, test_loss: 1.1996, test_f1: 0.5278
 epoch: 16, train_loss: 0.9303, test_loss: 1.1132, test_f1: 0.5594
 epoch: 17, train_loss: 0.9257, test_loss: 1.0893, test_f1: 0.5318
 epoch: 18, train_loss: 0.9263, test_loss: 1.1428, test_f1: 0.4825
 epoch: 19, train_loss: 0.9257, test_loss: 1.0859, test_f1: 0.5246
 epoch: 20, train_loss: 0.9113, test_loss: 1.2195, test_f1: 0.4813
 epoch: 21, train_loss: 0.8774, test_loss: 1.0853, test_f1: 0.5254
 epoch: 22, train_loss: 0.8551, test_loss: 1.1253, test_f1: 0.4954
 epoch: 23, train_loss: 0.8496, test_loss: 1.1780, test_f1: 0.5365
 epoch: 24, train_loss: 0.8408, test_loss: 1.0633, test_f1: 0.5557
 epoch: 25, train_loss: 0.8153, test_loss: 1.0779, test_f1: 0.5736
 epoch: 26, train_loss: 0.8178, test_loss: 1.0637, test_f1: 0.5461
 epoch: 27, train_loss: 0.8129, test_loss: 1.3516, test_f1: 0.4238
 epoch: 28, train_loss: 0.8162, test_loss: 1.1637, test_f1: 0.5477
 epoch: 29, train_loss: 0.8007, test_loss: 1.1050, test_f1: 0.5427
 epoch: 30, train_loss: 0.8431, test_loss: 1.1439, test_f1: 0.5124
 epoch: 31, train_loss: 0.8243, test_loss: 1.0790, test_f1: 0.5645
 epoch: 32, train_loss: 0.8270, test_loss: 1.1155, test_f1: 0.5414
 epoch: 33, train_loss: 0.8099, test_loss: 1.1481, test_f1: 0.5322
 epoch: 34, train_loss: 0.7854, test_loss: 1.1688, test_f1: 0.5216
 epoch: 35, train_loss: 0.7808, test_loss: 1.2019, test_f1: 0.5063
 epoch: 36, train_loss: 0.7778, test_loss: 1.0959, test_f1: 0.5516
 epoch: 37, train_loss: 0.7698, test_loss: 1.1757, test_f1: 0.5301
 epoch: 38, train_loss: 0.7366, test_loss: 1.1850, test_f1: 0.5585
 epoch: 39, train_loss: 0.7263, test_loss: 1.0769, test_f1: 0.6074
 epoch: 40, train_loss: 0.7282, test_loss: 1.1764, test_f1: 0.5444
 epoch: 41, train_loss: 0.7489, test_loss: 1.2228, test_f1: 0.5379
 epoch: 42, train_loss: 0.7483, test_loss: 1.1095, test_f1: 0.6136
 epoch: 43, train_loss: 0.7809, test_loss: 1.1501, test_f1: 0.5929
 epoch: 44, train_loss: 0.7878, test_loss: 1.0272, test_f1: 0.6075
 epoch: 45, train_loss: 0.7594, test_loss: 1.1260, test_f1: 0.5678
 epoch: 46, train_loss: 0.7495, test_loss: 1.0548, test_f1: 0.5908
 epoch: 47, train_loss: 0.7514, test_loss: 1.0292, test_f1: 0.6042
 epoch: 48, train_loss: 0.7594, test_loss: 1.0394, test_f1: 0.6117
 epoch: 49, train_loss: 0.7559, test_loss: 1.3212, test_f1: 0.5076
 epoch: 50, train_loss: 0.7539, test_loss: 1.1780, test_f1: 0.5697
 epoch: 51, train_loss: 0.7429, test_loss: 1.0560, test_f1: 0.5504
 epoch: 52, train_loss: 0.7244, test_loss: 1.1417, test_f1: 0.5329
 epoch: 53, train_loss: 0.7197, test_loss: 1.0855, test_f1: 0.5602
 epoch: 54, train_loss: 0.7301, test_loss: 1.2234, test_f1: 0.5552
 epoch: 55, train_loss: 0.7173, test_loss: 1.2965, test_f1: 0.5055
 epoch: 56, train_loss: 0.7098, test_loss: 1.1659, test_f1: 0.5720
 epoch: 57, train_loss: 0.6997, test_loss: 1.1880, test_f1: 0.5634
 epoch: 58, train_loss: 0.6946, test_loss: 1.1054, test_f1: 0.5568
 epoch: 59, train_loss: 0.6784, test_loss: 1.0860, test_f1: 0.5334
 epoch: 60, train_loss: 0.6980, test_loss: 1.1260, test_f1: 0.5851
 epoch: 61, train_loss: 0.6769, test_loss: 1.1986, test_f1: 0.5751
 epoch: 62, train_loss: 0.6625, test_loss: 1.2125, test_f1: 0.6031
 epoch: 63, train_loss: 0.6629, test_loss: 1.1474, test_f1: 0.6028
 epoch: 64, train_loss: 0.6566, test_loss: 1.1002, test_f1: 0.6223
 epoch: 65, train_loss: 0.6508, test_loss: 1.1773, test_f1: 0.5813
 epoch: 66, train_loss: 0.6722, test_loss: 1.3941, test_f1: 0.5750
 epoch: 67, train_loss: 0.6717, test_loss: 1.2333, test_f1: 0.5833
 epoch: 68, train_loss: 0.6654, test_loss: 1.1697, test_f1: 0.5834
 epoch: 69, train_loss: 0.6553, test_loss: 1.1663, test_f1: 0.5692
 epoch: 70, train_loss: 0.6618, test_loss: 1.0930, test_f1: 0.6188
 epoch: 71, train_loss: 0.6606, test_loss: 1.0730, test_f1: 0.6389
 epoch: 72, train_loss: 0.6475, test_loss: 1.1041, test_f1: 0.6198
 epoch: 73, train_loss: 0.6641, test_loss: 1.0910, test_f1: 0.6123
 epoch: 74, train_loss: 0.6552, test_loss: 1.2159, test_f1: 0.5454
 epoch: 75, train_loss: 0.6340, test_loss: 1.1509, test_f1: 0.6210
 epoch: 76, train_loss: 0.6348, test_loss: 1.0905, test_f1: 0.6167
 epoch: 77, train_loss: 0.6145, test_loss: 1.0651, test_f1: 0.5851
 epoch: 78, train_loss: 0.6264, test_loss: 1.0797, test_f1: 0.5978
 epoch: 79, train_loss: 0.6301, test_loss: 1.1172, test_f1: 0.6140
 epoch: 80, train_loss: 0.6275, test_loss: 1.1609, test_f1: 0.5894
 epoch: 81, train_loss: 0.5966, test_loss: 1.1406, test_f1: 0.5986
 epoch: 82, train_loss: 0.6111, test_loss: 1.2939, test_f1: 0.5699
 epoch: 83, train_loss: 0.6059, test_loss: 1.3355, test_f1: 0.5881
 epoch: 84, train_loss: 0.5919, test_loss: 1.2224, test_f1: 0.5821
 epoch: 85, train_loss: 0.5999, test_loss: 1.2651, test_f1: 0.6176
 epoch: 86, train_loss: 0.5877, test_loss: 1.2088, test_f1: 0.6207
 epoch: 87, train_loss: 0.6150, test_loss: 1.2684, test_f1: 0.5900
 epoch: 88, train_loss: 0.6079, test_loss: 1.3463, test_f1: 0.5570
 epoch: 89, train_loss: 0.6171, test_loss: 1.2267, test_f1: 0.6269
 epoch: 90, train_loss: 0.6235, test_loss: 1.2110, test_f1: 0.6189
 epoch: 91, train_loss: 0.7021, test_loss: 1.6349, test_f1: 0.5088
 epoch: 92, train_loss: 0.7349, test_loss: 1.6753, test_f1: 0.5542
 epoch: 93, train_loss: 0.6755, test_loss: 1.3844, test_f1: 0.5754
 epoch: 94, train_loss: 0.6448, test_loss: 1.1792, test_f1: 0.6055
 epoch: 95, train_loss: 0.6416, test_loss: 1.1543, test_f1: 0.6164
 epoch: 96, train_loss: 0.6172, test_loss: 1.1806, test_f1: 0.5624
 epoch: 97, train_loss: 0.6266, test_loss: 1.1584, test_f1: 0.5877
 epoch: 98, train_loss: 0.6333, test_loss: 1.2327, test_f1: 0.6126
 epoch: 99, train_loss: 0.6098, test_loss: 1.4102, test_f1: 0.5416
##################ITERATION #4 ****************************************
 epoch: 0, train_loss: 1.2716, test_loss: 1.5095, test_f1: 0.2403
 epoch: 1, train_loss: 1.1893, test_loss: 1.3916, test_f1: 0.2109
 epoch: 2, train_loss: 1.1182, test_loss: 1.2787, test_f1: 0.3469
 epoch: 3, train_loss: 1.0774, test_loss: 1.2941, test_f1: 0.3534
 epoch: 4, train_loss: 1.0233, test_loss: 1.2868, test_f1: 0.3839
 epoch: 5, train_loss: 0.9957, test_loss: 1.2391, test_f1: 0.3809
 epoch: 6, train_loss: 0.9579, test_loss: 1.1372, test_f1: 0.4789
 epoch: 7, train_loss: 0.9582, test_loss: 1.2758, test_f1: 0.4375
 epoch: 8, train_loss: 0.9347, test_loss: 1.1619, test_f1: 0.4857
 epoch: 9, train_loss: 0.9072, test_loss: 1.1564, test_f1: 0.4880
 epoch: 10, train_loss: 0.8885, test_loss: 1.0438, test_f1: 0.5614
 epoch: 11, train_loss: 0.8701, test_loss: 1.2164, test_f1: 0.4615
 epoch: 12, train_loss: 0.8456, test_loss: 1.1065, test_f1: 0.4947
 epoch: 13, train_loss: 0.8533, test_loss: 1.0736, test_f1: 0.5281
 epoch: 14, train_loss: 0.8286, test_loss: 1.1482, test_f1: 0.4942
 epoch: 15, train_loss: 0.8030, test_loss: 1.0809, test_f1: 0.5174
 epoch: 16, train_loss: 0.8298, test_loss: 1.0666, test_f1: 0.5912
 epoch: 17, train_loss: 0.8196, test_loss: 1.0843, test_f1: 0.5361
 epoch: 18, train_loss: 0.7912, test_loss: 1.1602, test_f1: 0.5174
 epoch: 19, train_loss: 0.7830, test_loss: 1.0411, test_f1: 0.5520
 epoch: 20, train_loss: 0.7749, test_loss: 1.1081, test_f1: 0.5119
 epoch: 21, train_loss: 0.7967, test_loss: 1.1197, test_f1: 0.5248
 epoch: 22, train_loss: 0.7577, test_loss: 1.1804, test_f1: 0.5440
 epoch: 23, train_loss: 0.7524, test_loss: 1.1401, test_f1: 0.5381
 epoch: 24, train_loss: 0.8018, test_loss: 1.2132, test_f1: 0.4938
 epoch: 25, train_loss: 0.8307, test_loss: 1.1601, test_f1: 0.5260
 epoch: 26, train_loss: 0.7859, test_loss: 1.2226, test_f1: 0.5158
 epoch: 27, train_loss: 0.7785, test_loss: 1.2050, test_f1: 0.5501
 epoch: 28, train_loss: 0.7980, test_loss: 1.0733, test_f1: 0.5275
 epoch: 29, train_loss: 0.8074, test_loss: 1.3327, test_f1: 0.5100
 epoch: 30, train_loss: 0.8058, test_loss: 1.0820, test_f1: 0.5771
 epoch: 31, train_loss: 0.7593, test_loss: 1.0736, test_f1: 0.5163
 epoch: 32, train_loss: 0.7784, test_loss: 1.0891, test_f1: 0.5691
 epoch: 33, train_loss: 0.7636, test_loss: 1.3721, test_f1: 0.5537
 epoch: 34, train_loss: 0.8074, test_loss: 1.2007, test_f1: 0.5380
 epoch: 35, train_loss: 0.7980, test_loss: 1.1039, test_f1: 0.5408
 epoch: 36, train_loss: 0.7972, test_loss: 1.2328, test_f1: 0.4612
 epoch: 37, train_loss: 0.8095, test_loss: 1.1266, test_f1: 0.5319
 epoch: 38, train_loss: 0.7758, test_loss: 1.0740, test_f1: 0.5865
 epoch: 39, train_loss: 0.7885, test_loss: 1.1716, test_f1: 0.5022
 epoch: 40, train_loss: 0.7609, test_loss: 1.0186, test_f1: 0.5490
 epoch: 41, train_loss: 0.7528, test_loss: 1.0262, test_f1: 0.5451
 epoch: 42, train_loss: 0.7386, test_loss: 1.0237, test_f1: 0.5440
 epoch: 43, train_loss: 0.7082, test_loss: 1.0356, test_f1: 0.5451
 epoch: 44, train_loss: 0.7300, test_loss: 1.0209, test_f1: 0.5380
 epoch: 45, train_loss: 0.7065, test_loss: 1.0276, test_f1: 0.5548
 epoch: 46, train_loss: 0.6888, test_loss: 1.0791, test_f1: 0.5615
 epoch: 47, train_loss: 0.7089, test_loss: 1.2772, test_f1: 0.5288
 epoch: 48, train_loss: 0.7572, test_loss: 1.3463, test_f1: 0.5438
 epoch: 49, train_loss: 0.7370, test_loss: 1.0948, test_f1: 0.5723
 epoch: 50, train_loss: 0.7464, test_loss: 1.0959, test_f1: 0.5508
 epoch: 51, train_loss: 0.7148, test_loss: 1.0613, test_f1: 0.5765
 epoch: 52, train_loss: 0.6950, test_loss: 1.0122, test_f1: 0.5681
 epoch: 53, train_loss: 0.6839, test_loss: 1.0102, test_f1: 0.5602
 epoch: 54, train_loss: 0.6691, test_loss: 1.0639, test_f1: 0.5665
 epoch: 55, train_loss: 0.6620, test_loss: 1.1357, test_f1: 0.5447
 epoch: 56, train_loss: 0.6471, test_loss: 1.1875, test_f1: 0.5333
 epoch: 57, train_loss: 0.6375, test_loss: 1.1788, test_f1: 0.6076
 epoch: 58, train_loss: 0.6269, test_loss: 1.1524, test_f1: 0.5684
 epoch: 59, train_loss: 0.6213, test_loss: 1.2107, test_f1: 0.5269
 epoch: 60, train_loss: 0.6237, test_loss: 1.2241, test_f1: 0.5239
 epoch: 61, train_loss: 0.6558, test_loss: 1.1935, test_f1: 0.5517
 epoch: 62, train_loss: 0.6278, test_loss: 1.1762, test_f1: 0.6218
 epoch: 63, train_loss: 0.6169, test_loss: 1.2279, test_f1: 0.5605
 epoch: 64, train_loss: 0.5922, test_loss: 1.3887, test_f1: 0.5210
 epoch: 65, train_loss: 0.5955, test_loss: 1.1225, test_f1: 0.5510
 epoch: 66, train_loss: 0.5951, test_loss: 1.0940, test_f1: 0.6006
 epoch: 67, train_loss: 0.5942, test_loss: 1.0789, test_f1: 0.5861
 epoch: 68, train_loss: 0.5989, test_loss: 1.2397, test_f1: 0.5202
 epoch: 69, train_loss: 0.5934, test_loss: 1.3518, test_f1: 0.5223
 epoch: 70, train_loss: 0.5863, test_loss: 1.2200, test_f1: 0.5700
 epoch: 71, train_loss: 0.5809, test_loss: 1.1051, test_f1: 0.6053
 epoch: 72, train_loss: 0.5963, test_loss: 1.1553, test_f1: 0.5593
 epoch: 73, train_loss: 0.6046, test_loss: 1.2121, test_f1: 0.5548
 epoch: 74, train_loss: 0.5661, test_loss: 1.2082, test_f1: 0.5314
 epoch: 75, train_loss: 0.5523, test_loss: 1.1408, test_f1: 0.5755
 epoch: 76, train_loss: 0.5693, test_loss: 1.1168, test_f1: 0.5843
 epoch: 77, train_loss: 0.6012, test_loss: 1.2045, test_f1: 0.5634
 epoch: 78, train_loss: 0.5707, test_loss: 1.3875, test_f1: 0.5133
 epoch: 79, train_loss: 0.5582, test_loss: 1.3066, test_f1: 0.5262
 epoch: 80, train_loss: 0.5638, test_loss: 1.1726, test_f1: 0.5782
 epoch: 81, train_loss: 0.5430, test_loss: 1.1697, test_f1: 0.5533
 epoch: 82, train_loss: 0.5556, test_loss: 1.1805, test_f1: 0.5751
 epoch: 83, train_loss: 0.5744, test_loss: 1.1671, test_f1: 0.5728
 epoch: 84, train_loss: 0.5577, test_loss: 1.2412, test_f1: 0.5715
 epoch: 85, train_loss: 0.5502, test_loss: 1.5961, test_f1: 0.4483
 epoch: 86, train_loss: 0.5900, test_loss: 1.2715, test_f1: 0.5562
 epoch: 87, train_loss: 0.5944, test_loss: 1.3079, test_f1: 0.5565
 epoch: 88, train_loss: 0.6197, test_loss: 1.1679, test_f1: 0.5501
 epoch: 89, train_loss: 0.5916, test_loss: 1.0896, test_f1: 0.5473
 epoch: 90, train_loss: 0.5644, test_loss: 1.1500, test_f1: 0.5648
 epoch: 91, train_loss: 0.6000, test_loss: 1.1527, test_f1: 0.5656
 epoch: 92, train_loss: 0.5670, test_loss: 1.1495, test_f1: 0.5522
 epoch: 93, train_loss: 0.5410, test_loss: 1.1043, test_f1: 0.5475
 epoch: 94, train_loss: 0.5176, test_loss: 1.1845, test_f1: 0.5658
 epoch: 95, train_loss: 0.5147, test_loss: 1.2184, test_f1: 0.5835
 epoch: 96, train_loss: 0.5274, test_loss: 1.1799, test_f1: 0.5193
 epoch: 97, train_loss: 0.5444, test_loss: 1.1962, test_f1: 0.5205
 epoch: 98, train_loss: 0.5220, test_loss: 1.1345, test_f1: 0.5926
 epoch: 99, train_loss: 0.5354, test_loss: 1.2813, test_f1: 0.5398
##################ITERATION #5 ****************************************
 epoch: 0, train_loss: 1.3379, test_loss: 1.4152, test_f1: 0.2281
 epoch: 1, train_loss: 1.2079, test_loss: 1.3535, test_f1: 0.3330
 epoch: 2, train_loss: 1.1721, test_loss: 1.3134, test_f1: 0.3384
 epoch: 3, train_loss: 1.1703, test_loss: 1.3081, test_f1: 0.3321
 epoch: 4, train_loss: 1.1340, test_loss: 1.1856, test_f1: 0.4486
 epoch: 5, train_loss: 1.0873, test_loss: 1.1542, test_f1: 0.4894
 epoch: 6, train_loss: 1.0651, test_loss: 1.1482, test_f1: 0.4790
 epoch: 7, train_loss: 1.0561, test_loss: 1.1994, test_f1: 0.4366
 epoch: 8, train_loss: 1.0315, test_loss: 1.2723, test_f1: 0.3904
 epoch: 9, train_loss: 1.0031, test_loss: 1.1142, test_f1: 0.4828
 epoch: 10, train_loss: 0.9739, test_loss: 1.1705, test_f1: 0.4544
 epoch: 11, train_loss: 0.9556, test_loss: 1.1218, test_f1: 0.5232
 epoch: 12, train_loss: 0.9239, test_loss: 1.0950, test_f1: 0.5383
 epoch: 13, train_loss: 0.9181, test_loss: 1.0528, test_f1: 0.5603
 epoch: 14, train_loss: 0.9025, test_loss: 1.2037, test_f1: 0.5194
 epoch: 15, train_loss: 0.8794, test_loss: 1.0996, test_f1: 0.5649
 epoch: 16, train_loss: 0.8640, test_loss: 1.2130, test_f1: 0.5168
 epoch: 17, train_loss: 0.8690, test_loss: 1.1394, test_f1: 0.5253
 epoch: 18, train_loss: 0.8528, test_loss: 1.5948, test_f1: 0.4660
 epoch: 19, train_loss: 0.8579, test_loss: 1.3650, test_f1: 0.4479
 epoch: 20, train_loss: 0.8625, test_loss: 1.1180, test_f1: 0.5634
 epoch: 21, train_loss: 0.8293, test_loss: 1.1119, test_f1: 0.5545
 epoch: 22, train_loss: 0.8286, test_loss: 1.1194, test_f1: 0.5062
 epoch: 23, train_loss: 0.8211, test_loss: 1.0620, test_f1: 0.5815
 epoch: 24, train_loss: 0.8181, test_loss: 1.0898, test_f1: 0.5724
 epoch: 25, train_loss: 0.8098, test_loss: 1.1936, test_f1: 0.5714
 epoch: 26, train_loss: 0.7929, test_loss: 1.1284, test_f1: 0.5190
 epoch: 27, train_loss: 0.7861, test_loss: 1.0221, test_f1: 0.5695
 epoch: 28, train_loss: 0.8075, test_loss: 1.4676, test_f1: 0.4804
 epoch: 29, train_loss: 0.7990, test_loss: 1.0787, test_f1: 0.6002
 epoch: 30, train_loss: 0.7720, test_loss: 1.0566, test_f1: 0.5937
 epoch: 31, train_loss: 0.7807, test_loss: 1.1882, test_f1: 0.5456
 epoch: 32, train_loss: 0.7793, test_loss: 1.1479, test_f1: 0.5712
 epoch: 33, train_loss: 0.7839, test_loss: 1.1566, test_f1: 0.5641
 epoch: 34, train_loss: 0.7700, test_loss: 1.1811, test_f1: 0.5512
 epoch: 35, train_loss: 0.7975, test_loss: 1.0147, test_f1: 0.6284
 epoch: 36, train_loss: 0.7992, test_loss: 1.1097, test_f1: 0.5482
 epoch: 37, train_loss: 0.7974, test_loss: 1.3408, test_f1: 0.4640
 epoch: 38, train_loss: 0.7718, test_loss: 1.0996, test_f1: 0.5491
 epoch: 39, train_loss: 0.7415, test_loss: 1.1142, test_f1: 0.5854
 epoch: 40, train_loss: 0.7252, test_loss: 1.0550, test_f1: 0.5894
 epoch: 41, train_loss: 0.7267, test_loss: 1.2138, test_f1: 0.5594
 epoch: 42, train_loss: 0.7496, test_loss: 1.2113, test_f1: 0.5378
 epoch: 43, train_loss: 0.7217, test_loss: 1.2094, test_f1: 0.5831
 epoch: 44, train_loss: 0.7212, test_loss: 1.1059, test_f1: 0.5970
 epoch: 45, train_loss: 0.7342, test_loss: 1.1313, test_f1: 0.5751
 epoch: 46, train_loss: 0.7278, test_loss: 1.4022, test_f1: 0.5347
 epoch: 47, train_loss: 0.7249, test_loss: 1.0802, test_f1: 0.5947
 epoch: 48, train_loss: 0.7352, test_loss: 1.2805, test_f1: 0.5092
 epoch: 49, train_loss: 0.7573, test_loss: 1.2358, test_f1: 0.5126
 epoch: 50, train_loss: 0.7253, test_loss: 0.9817, test_f1: 0.6090
 epoch: 51, train_loss: 0.7170, test_loss: 1.0102, test_f1: 0.6141
 epoch: 52, train_loss: 0.7168, test_loss: 1.0827, test_f1: 0.6039
 epoch: 53, train_loss: 0.7059, test_loss: 1.0650, test_f1: 0.5829
 epoch: 54, train_loss: 0.6910, test_loss: 1.0660, test_f1: 0.5999
 epoch: 55, train_loss: 0.6698, test_loss: 1.1378, test_f1: 0.5766
 epoch: 56, train_loss: 0.6729, test_loss: 1.2514, test_f1: 0.5769
 epoch: 57, train_loss: 0.6696, test_loss: 1.2733, test_f1: 0.5778
 epoch: 58, train_loss: 0.6476, test_loss: 1.2250, test_f1: 0.5948
 epoch: 59, train_loss: 0.6274, test_loss: 1.1421, test_f1: 0.6073
 epoch: 60, train_loss: 0.6591, test_loss: 1.1928, test_f1: 0.6148
 epoch: 61, train_loss: 0.6355, test_loss: 1.2736, test_f1: 0.5322
 epoch: 62, train_loss: 0.6247, test_loss: 1.3370, test_f1: 0.5651
 epoch: 63, train_loss: 0.6321, test_loss: 1.3190, test_f1: 0.5767
 epoch: 64, train_loss: 0.6474, test_loss: 1.2466, test_f1: 0.5763
 epoch: 65, train_loss: 0.6558, test_loss: 1.2061, test_f1: 0.5397
 epoch: 66, train_loss: 0.6640, test_loss: 1.0623, test_f1: 0.5878
 epoch: 67, train_loss: 0.6808, test_loss: 1.1029, test_f1: 0.5796
 epoch: 68, train_loss: 0.6587, test_loss: 1.2408, test_f1: 0.5683
 epoch: 69, train_loss: 0.6593, test_loss: 1.3792, test_f1: 0.5152
 epoch: 70, train_loss: 0.7841, test_loss: 1.5561, test_f1: 0.6146
 epoch: 71, train_loss: 0.6928, test_loss: 1.5994, test_f1: 0.5325
 epoch: 72, train_loss: 0.7005, test_loss: 1.3385, test_f1: 0.5869
 epoch: 73, train_loss: 0.6938, test_loss: 1.2195, test_f1: 0.5894
 epoch: 74, train_loss: 0.6691, test_loss: 1.1250, test_f1: 0.5785
 epoch: 75, train_loss: 0.6491, test_loss: 1.1475, test_f1: 0.6056
 epoch: 76, train_loss: 0.6469, test_loss: 1.2406, test_f1: 0.6080
 epoch: 77, train_loss: 0.6281, test_loss: 1.2498, test_f1: 0.5797
 epoch: 78, train_loss: 0.6407, test_loss: 1.3086, test_f1: 0.5895
 epoch: 79, train_loss: 0.6205, test_loss: 1.3590, test_f1: 0.5585
 epoch: 80, train_loss: 0.5898, test_loss: 1.1840, test_f1: 0.5935
 epoch: 81, train_loss: 0.6289, test_loss: 1.2463, test_f1: 0.6416
 epoch: 82, train_loss: 0.6176, test_loss: 1.2755, test_f1: 0.6224
 epoch: 83, train_loss: 0.6044, test_loss: 1.2732, test_f1: 0.6181
 epoch: 84, train_loss: 0.5989, test_loss: 1.3790, test_f1: 0.6167
 epoch: 85, train_loss: 0.6864, test_loss: 1.5096, test_f1: 0.5410
 epoch: 86, train_loss: 0.6454, test_loss: 1.1677, test_f1: 0.5971
 epoch: 87, train_loss: 0.6389, test_loss: 1.2085, test_f1: 0.6169
 epoch: 88, train_loss: 0.6348, test_loss: 1.2744, test_f1: 0.6106
 epoch: 89, train_loss: 0.6202, test_loss: 1.3628, test_f1: 0.5772
 epoch: 90, train_loss: 0.5904, test_loss: 1.3645, test_f1: 0.5880
 epoch: 91, train_loss: 0.5812, test_loss: 1.3744, test_f1: 0.6049
 epoch: 92, train_loss: 0.5616, test_loss: 1.3361, test_f1: 0.5912
 epoch: 93, train_loss: 0.5759, test_loss: 1.3689, test_f1: 0.5752
 epoch: 94, train_loss: 0.5651, test_loss: 1.4220, test_f1: 0.5737
 epoch: 95, train_loss: 0.5513, test_loss: 1.5527, test_f1: 0.5776
 epoch: 96, train_loss: 0.5593, test_loss: 1.4732, test_f1: 0.5812
 epoch: 97, train_loss: 0.5589, test_loss: 1.6343, test_f1: 0.5468
 epoch: 98, train_loss: 0.6017, test_loss: 1.4695, test_f1: 0.5773
 epoch: 99, train_loss: 0.5681, test_loss: 1.3087, test_f1: 0.5830
##################ITERATION #6 ****************************************
 epoch: 0, train_loss: 1.3341, test_loss: 1.4428, test_f1: 0.2549
 epoch: 1, train_loss: 1.1790, test_loss: 1.3950, test_f1: 0.3491
 epoch: 2, train_loss: 1.1490, test_loss: 1.3052, test_f1: 0.3062
 epoch: 3, train_loss: 1.0890, test_loss: 1.2979, test_f1: 0.2717
 epoch: 4, train_loss: 1.0463, test_loss: 1.2570, test_f1: 0.3499
 epoch: 5, train_loss: 1.0292, test_loss: 1.3670, test_f1: 0.3805
 epoch: 6, train_loss: 1.0321, test_loss: 1.0294, test_f1: 0.5872
 epoch: 7, train_loss: 1.0049, test_loss: 1.0152, test_f1: 0.6067
 epoch: 8, train_loss: 0.9626, test_loss: 1.1377, test_f1: 0.5501
 epoch: 9, train_loss: 0.9499, test_loss: 1.1872, test_f1: 0.4734
 epoch: 10, train_loss: 0.9366, test_loss: 1.6364, test_f1: 0.5108
 epoch: 11, train_loss: 0.9264, test_loss: 1.1254, test_f1: 0.6016
 epoch: 12, train_loss: 0.9169, test_loss: 1.0809, test_f1: 0.5688
 epoch: 13, train_loss: 0.9096, test_loss: 1.0976, test_f1: 0.5402
 epoch: 14, train_loss: 0.9037, test_loss: 1.3833, test_f1: 0.4833
 epoch: 15, train_loss: 0.8754, test_loss: 1.7285, test_f1: 0.4556
 epoch: 16, train_loss: 0.8887, test_loss: 1.1170, test_f1: 0.5611
 epoch: 17, train_loss: 0.8767, test_loss: 1.0494, test_f1: 0.5694
 epoch: 18, train_loss: 0.8858, test_loss: 1.0193, test_f1: 0.5455
 epoch: 19, train_loss: 0.8986, test_loss: 1.0037, test_f1: 0.6009
 epoch: 20, train_loss: 0.8997, test_loss: 1.1706, test_f1: 0.5799
 epoch: 21, train_loss: 0.8904, test_loss: 1.6723, test_f1: 0.4682
 epoch: 22, train_loss: 0.8650, test_loss: 1.6578, test_f1: 0.5137
 epoch: 23, train_loss: 0.8426, test_loss: 1.3895, test_f1: 0.5417
 epoch: 24, train_loss: 0.8199, test_loss: 1.3318, test_f1: 0.5051
 epoch: 25, train_loss: 0.8440, test_loss: 1.1359, test_f1: 0.5323
 epoch: 26, train_loss: 0.8456, test_loss: 1.1451, test_f1: 0.6123
 epoch: 27, train_loss: 0.8065, test_loss: 1.0418, test_f1: 0.6190
 epoch: 28, train_loss: 0.7915, test_loss: 1.0946, test_f1: 0.5945
 epoch: 29, train_loss: 0.7773, test_loss: 1.1311, test_f1: 0.6193
 epoch: 30, train_loss: 0.7856, test_loss: 1.0932, test_f1: 0.6258
 epoch: 31, train_loss: 0.7464, test_loss: 1.2772, test_f1: 0.4946
 epoch: 32, train_loss: 0.7602, test_loss: 1.1496, test_f1: 0.5844
 epoch: 33, train_loss: 0.7604, test_loss: 1.1607, test_f1: 0.5438
 epoch: 34, train_loss: 0.7723, test_loss: 1.3101, test_f1: 0.5445
 epoch: 35, train_loss: 0.8455, test_loss: 1.3993, test_f1: 0.4563
 epoch: 36, train_loss: 0.8526, test_loss: 1.2091, test_f1: 0.5570
 epoch: 37, train_loss: 0.8698, test_loss: 1.6721, test_f1: 0.5103
 epoch: 38, train_loss: 0.8433, test_loss: 1.2386, test_f1: 0.5279
 epoch: 39, train_loss: 0.8115, test_loss: 1.2064, test_f1: 0.5139
 epoch: 40, train_loss: 0.7904, test_loss: 1.0594, test_f1: 0.5551
 epoch: 41, train_loss: 0.7994, test_loss: 1.0555, test_f1: 0.5804
 epoch: 42, train_loss: 0.7592, test_loss: 1.3194, test_f1: 0.5282
 epoch: 43, train_loss: 0.7764, test_loss: 1.1872, test_f1: 0.5917
 epoch: 44, train_loss: 0.7612, test_loss: 1.1636, test_f1: 0.5527
 epoch: 45, train_loss: 0.7929, test_loss: 1.1807, test_f1: 0.5340
 epoch: 46, train_loss: 0.7855, test_loss: 1.0141, test_f1: 0.5859
 epoch: 47, train_loss: 0.7788, test_loss: 1.0334, test_f1: 0.5698
 epoch: 48, train_loss: 0.7615, test_loss: 1.0665, test_f1: 0.5374
 epoch: 49, train_loss: 0.7442, test_loss: 1.1216, test_f1: 0.5394
 epoch: 50, train_loss: 0.7285, test_loss: 1.1099, test_f1: 0.5874
 epoch: 51, train_loss: 0.7300, test_loss: 1.0389, test_f1: 0.5882
 epoch: 52, train_loss: 0.7039, test_loss: 1.0587, test_f1: 0.5795
 epoch: 53, train_loss: 0.6848, test_loss: 1.1112, test_f1: 0.5710
 epoch: 54, train_loss: 0.6605, test_loss: 1.0756, test_f1: 0.6087
 epoch: 55, train_loss: 0.6611, test_loss: 1.1207, test_f1: 0.6109
 epoch: 56, train_loss: 0.6520, test_loss: 1.1635, test_f1: 0.5866
 epoch: 57, train_loss: 0.6551, test_loss: 1.1183, test_f1: 0.5972
 epoch: 58, train_loss: 0.6383, test_loss: 1.1685, test_f1: 0.6265
 epoch: 59, train_loss: 0.6579, test_loss: 1.1253, test_f1: 0.6421
 epoch: 60, train_loss: 0.6322, test_loss: 1.1923, test_f1: 0.5831
 epoch: 61, train_loss: 0.6430, test_loss: 1.1396, test_f1: 0.6196
 epoch: 62, train_loss: 0.6529, test_loss: 1.1862, test_f1: 0.5886
 epoch: 63, train_loss: 0.6413, test_loss: 1.1113, test_f1: 0.5971
 epoch: 64, train_loss: 0.6191, test_loss: 1.1238, test_f1: 0.5963
 epoch: 65, train_loss: 0.6167, test_loss: 1.1660, test_f1: 0.5789
 epoch: 66, train_loss: 0.6277, test_loss: 1.1693, test_f1: 0.6170
 epoch: 67, train_loss: 0.6154, test_loss: 1.1911, test_f1: 0.6161
 epoch: 68, train_loss: 0.6257, test_loss: 1.2589, test_f1: 0.5990
 epoch: 69, train_loss: 0.6261, test_loss: 1.1273, test_f1: 0.5735
 epoch: 70, train_loss: 0.6096, test_loss: 1.2559, test_f1: 0.5532
 epoch: 71, train_loss: 0.6097, test_loss: 1.2227, test_f1: 0.5714
 epoch: 72, train_loss: 0.6073, test_loss: 1.2282, test_f1: 0.5714
 epoch: 73, train_loss: 0.6040, test_loss: 1.1800, test_f1: 0.5914
 epoch: 74, train_loss: 0.5948, test_loss: 1.2309, test_f1: 0.5864
 epoch: 75, train_loss: 0.5797, test_loss: 1.2151, test_f1: 0.6007
 epoch: 76, train_loss: 0.5590, test_loss: 1.2005, test_f1: 0.5808
 epoch: 77, train_loss: 0.5595, test_loss: 1.2362, test_f1: 0.6126
 epoch: 78, train_loss: 0.5571, test_loss: 1.2319, test_f1: 0.6117
 epoch: 79, train_loss: 0.5803, test_loss: 1.3070, test_f1: 0.5928
 epoch: 80, train_loss: 0.5934, test_loss: 1.2167, test_f1: 0.6064
 epoch: 81, train_loss: 0.6045, test_loss: 1.3438, test_f1: 0.5782
 epoch: 82, train_loss: 0.5811, test_loss: 1.2379, test_f1: 0.5822
 epoch: 83, train_loss: 0.5547, test_loss: 1.2138, test_f1: 0.5843
 epoch: 84, train_loss: 0.5672, test_loss: 1.1701, test_f1: 0.6251
 epoch: 85, train_loss: 0.5591, test_loss: 1.1831, test_f1: 0.6077
 epoch: 86, train_loss: 0.5843, test_loss: 1.3426, test_f1: 0.5820
 epoch: 87, train_loss: 0.5626, test_loss: 1.3492, test_f1: 0.5952
 epoch: 88, train_loss: 0.5649, test_loss: 1.3962, test_f1: 0.5505
 epoch: 89, train_loss: 0.5473, test_loss: 1.2826, test_f1: 0.5709
 epoch: 90, train_loss: 0.5661, test_loss: 1.2134, test_f1: 0.6360
 epoch: 91, train_loss: 0.5399, test_loss: 1.2403, test_f1: 0.6312
 epoch: 92, train_loss: 0.5419, test_loss: 1.2850, test_f1: 0.5954
 epoch: 93, train_loss: 0.5290, test_loss: 1.1963, test_f1: 0.6449
 epoch: 94, train_loss: 0.5056, test_loss: 1.3668, test_f1: 0.5936
 epoch: 95, train_loss: 0.5213, test_loss: 1.2371, test_f1: 0.6331
 epoch: 96, train_loss: 0.5104, test_loss: 1.3603, test_f1: 0.6458
 epoch: 97, train_loss: 0.5170, test_loss: 1.2618, test_f1: 0.6277
 epoch: 98, train_loss: 0.5042, test_loss: 1.2360, test_f1: 0.5898
 epoch: 99, train_loss: 0.5371, test_loss: 1.2700, test_f1: 0.5984
##################ITERATION #7 ****************************************
 epoch: 0, train_loss: 1.4929, test_loss: 1.5269, test_f1: 0.1987
 epoch: 1, train_loss: 1.2121, test_loss: 1.3990, test_f1: 0.3024
 epoch: 2, train_loss: 1.1617, test_loss: 1.3207, test_f1: 0.2676
 epoch: 3, train_loss: 1.1066, test_loss: 1.3407, test_f1: 0.3525
 epoch: 4, train_loss: 1.0721, test_loss: 1.3248, test_f1: 0.3379
 epoch: 5, train_loss: 1.0255, test_loss: 1.2422, test_f1: 0.4187
 epoch: 6, train_loss: 1.0126, test_loss: 1.4600, test_f1: 0.3214
 epoch: 7, train_loss: 0.9965, test_loss: 1.1220, test_f1: 0.4923
 epoch: 8, train_loss: 0.9841, test_loss: 1.1420, test_f1: 0.4194
 epoch: 9, train_loss: 0.9153, test_loss: 1.0652, test_f1: 0.4660
 epoch: 10, train_loss: 0.9143, test_loss: 1.4212, test_f1: 0.4236
 epoch: 11, train_loss: 0.9097, test_loss: 1.1147, test_f1: 0.4869
 epoch: 12, train_loss: 0.8772, test_loss: 1.0526, test_f1: 0.5421
 epoch: 13, train_loss: 0.9144, test_loss: 1.0496, test_f1: 0.5578
 epoch: 14, train_loss: 0.8873, test_loss: 1.6882, test_f1: 0.4170
 epoch: 15, train_loss: 0.9004, test_loss: 1.0693, test_f1: 0.4345
 epoch: 16, train_loss: 0.8755, test_loss: 1.0976, test_f1: 0.4976
 epoch: 17, train_loss: 0.8523, test_loss: 1.1782, test_f1: 0.5415
 epoch: 18, train_loss: 0.8576, test_loss: 1.2583, test_f1: 0.4542
 epoch: 19, train_loss: 0.8528, test_loss: 1.1193, test_f1: 0.5543
 epoch: 20, train_loss: 0.8704, test_loss: 1.2569, test_f1: 0.4043
 epoch: 21, train_loss: 0.9160, test_loss: 2.5558, test_f1: 0.1729
 epoch: 22, train_loss: 0.8742, test_loss: 1.0207, test_f1: 0.5685
 epoch: 23, train_loss: 0.8641, test_loss: 1.6726, test_f1: 0.3865
 epoch: 24, train_loss: 0.8387, test_loss: 1.1160, test_f1: 0.5124
 epoch: 25, train_loss: 0.8209, test_loss: 1.0954, test_f1: 0.5938
 epoch: 26, train_loss: 0.8186, test_loss: 1.3050, test_f1: 0.5129
 epoch: 27, train_loss: 0.9174, test_loss: 1.1566, test_f1: 0.4953
 epoch: 28, train_loss: 0.9255, test_loss: 1.1369, test_f1: 0.4679
 epoch: 29, train_loss: 0.9019, test_loss: 1.0955, test_f1: 0.5476
 epoch: 30, train_loss: 0.8868, test_loss: 1.1623, test_f1: 0.5087
 epoch: 31, train_loss: 0.9004, test_loss: 1.3782, test_f1: 0.3567
 epoch: 32, train_loss: 0.9099, test_loss: 1.0767, test_f1: 0.4806
 epoch: 33, train_loss: 0.8478, test_loss: 2.5854, test_f1: 0.4443
 epoch: 34, train_loss: 0.8488, test_loss: 1.1671, test_f1: 0.4650
 epoch: 35, train_loss: 0.8167, test_loss: 1.0416, test_f1: 0.5247
 epoch: 36, train_loss: 0.8026, test_loss: 1.1236, test_f1: 0.5235
 epoch: 37, train_loss: 0.8198, test_loss: 1.0107, test_f1: 0.5669
 epoch: 38, train_loss: 0.8048, test_loss: 0.9831, test_f1: 0.6080
 epoch: 39, train_loss: 0.8159, test_loss: 1.0115, test_f1: 0.6122
 epoch: 40, train_loss: 0.7904, test_loss: 1.0086, test_f1: 0.5636
 epoch: 41, train_loss: 0.7864, test_loss: 1.1656, test_f1: 0.4501
 epoch: 42, train_loss: 0.8024, test_loss: 1.0136, test_f1: 0.5561
 epoch: 43, train_loss: 0.7882, test_loss: 1.2628, test_f1: 0.4271
 epoch: 44, train_loss: 0.7785, test_loss: 1.6836, test_f1: 0.3726
 epoch: 45, train_loss: 0.7594, test_loss: 1.0002, test_f1: 0.5900
 epoch: 46, train_loss: 0.7531, test_loss: 1.0050, test_f1: 0.5877
 epoch: 47, train_loss: 0.7514, test_loss: 1.0832, test_f1: 0.5271
 epoch: 48, train_loss: 0.7602, test_loss: 0.9699, test_f1: 0.5749
 epoch: 49, train_loss: 0.7513, test_loss: 1.0520, test_f1: 0.5626
 epoch: 50, train_loss: 0.7635, test_loss: 0.9777, test_f1: 0.5644
 epoch: 51, train_loss: 0.7336, test_loss: 0.9854, test_f1: 0.6101
 epoch: 52, train_loss: 0.7283, test_loss: 0.9907, test_f1: 0.6135
 epoch: 53, train_loss: 0.7084, test_loss: 1.0035, test_f1: 0.5836
 epoch: 54, train_loss: 0.7111, test_loss: 1.0399, test_f1: 0.5613
 epoch: 55, train_loss: 0.7075, test_loss: 1.5899, test_f1: 0.4664
 epoch: 56, train_loss: 0.6904, test_loss: 1.0118, test_f1: 0.5579
 epoch: 57, train_loss: 0.7041, test_loss: 1.0033, test_f1: 0.6009
 epoch: 58, train_loss: 0.6883, test_loss: 1.1576, test_f1: 0.4944
 epoch: 59, train_loss: 0.6850, test_loss: 1.1602, test_f1: 0.5182
 epoch: 60, train_loss: 0.6823, test_loss: 1.0290, test_f1: 0.6001
 epoch: 61, train_loss: 0.7031, test_loss: 1.0223, test_f1: 0.5923
 epoch: 62, train_loss: 0.6746, test_loss: 1.1220, test_f1: 0.5390
 epoch: 63, train_loss: 0.6798, test_loss: 1.1681, test_f1: 0.5206
 epoch: 64, train_loss: 0.6948, test_loss: 1.0468, test_f1: 0.5904
 epoch: 65, train_loss: 0.6703, test_loss: 1.1397, test_f1: 0.5420
 epoch: 66, train_loss: 0.6668, test_loss: 1.0649, test_f1: 0.5474
 epoch: 67, train_loss: 0.6594, test_loss: 1.0515, test_f1: 0.5703
 epoch: 68, train_loss: 0.6420, test_loss: 1.2621, test_f1: 0.5334
 epoch: 69, train_loss: 0.6285, test_loss: 1.0463, test_f1: 0.5969
 epoch: 70, train_loss: 0.6178, test_loss: 1.0807, test_f1: 0.5684
 epoch: 71, train_loss: 0.6336, test_loss: 1.1386, test_f1: 0.6002
 epoch: 72, train_loss: 0.6224, test_loss: 1.2864, test_f1: 0.5336
 epoch: 73, train_loss: 0.6010, test_loss: 1.0547, test_f1: 0.6066
 epoch: 74, train_loss: 0.6100, test_loss: 1.0531, test_f1: 0.5945
 epoch: 75, train_loss: 0.6226, test_loss: 1.1110, test_f1: 0.5527
 epoch: 76, train_loss: 0.6311, test_loss: 1.1211, test_f1: 0.5492
 epoch: 77, train_loss: 0.6304, test_loss: 1.0714, test_f1: 0.5891
 epoch: 78, train_loss: 0.6446, test_loss: 1.1913, test_f1: 0.5582
 epoch: 79, train_loss: 0.6235, test_loss: 1.1803, test_f1: 0.5303
 epoch: 80, train_loss: 0.6149, test_loss: 1.1322, test_f1: 0.5659
 epoch: 81, train_loss: 0.6080, test_loss: 1.1542, test_f1: 0.5588
 epoch: 82, train_loss: 0.5949, test_loss: 1.1960, test_f1: 0.5609
 epoch: 83, train_loss: 0.5863, test_loss: 1.2375, test_f1: 0.5554
 epoch: 84, train_loss: 0.5930, test_loss: 1.4502, test_f1: 0.4873
 epoch: 85, train_loss: 0.6216, test_loss: 1.2063, test_f1: 0.5834
 epoch: 86, train_loss: 0.6078, test_loss: 2.0134, test_f1: 0.5162
 epoch: 87, train_loss: 0.6050, test_loss: 1.3505, test_f1: 0.5309
 epoch: 88, train_loss: 0.6044, test_loss: 1.2140, test_f1: 0.5345
 epoch: 89, train_loss: 0.5952, test_loss: 1.1209, test_f1: 0.5978
 epoch: 90, train_loss: 0.6087, test_loss: 1.1151, test_f1: 0.6021
 epoch: 91, train_loss: 0.5969, test_loss: 1.1591, test_f1: 0.5486
 epoch: 92, train_loss: 0.5775, test_loss: 1.1733, test_f1: 0.5624
 epoch: 93, train_loss: 0.5788, test_loss: 1.1508, test_f1: 0.5575
 epoch: 94, train_loss: 0.5593, test_loss: 1.1185, test_f1: 0.5479
 epoch: 95, train_loss: 0.5593, test_loss: 1.3202, test_f1: 0.5127
 epoch: 96, train_loss: 0.5653, test_loss: 1.2120, test_f1: 0.5438
 epoch: 97, train_loss: 0.5424, test_loss: 1.1663, test_f1: 0.5795
 epoch: 98, train_loss: 0.5581, test_loss: 1.2609, test_f1: 0.5326
 epoch: 99, train_loss: 0.5434, test_loss: 1.2522, test_f1: 0.5359
##################ITERATION #8 ****************************************
 epoch: 0, train_loss: 1.4422, test_loss: 1.4646, test_f1: 0.2206
 epoch: 1, train_loss: 1.2272, test_loss: 1.4580, test_f1: 0.2603
 epoch: 2, train_loss: 1.1618, test_loss: 1.2889, test_f1: 0.3960
 epoch: 3, train_loss: 1.1270, test_loss: 1.2496, test_f1: 0.3679
 epoch: 4, train_loss: 1.0694, test_loss: 1.2023, test_f1: 0.4421
 epoch: 5, train_loss: 1.0343, test_loss: 1.1652, test_f1: 0.5666
 epoch: 6, train_loss: 1.0225, test_loss: 1.1343, test_f1: 0.4790
 epoch: 7, train_loss: 0.9826, test_loss: 1.1251, test_f1: 0.4909
 epoch: 8, train_loss: 0.9617, test_loss: 1.0493, test_f1: 0.5555
 epoch: 9, train_loss: 0.9240, test_loss: 1.1536, test_f1: 0.4580
 epoch: 10, train_loss: 0.9175, test_loss: 1.1974, test_f1: 0.4621
 epoch: 11, train_loss: 0.8871, test_loss: 1.1217, test_f1: 0.5455
 epoch: 12, train_loss: 0.8705, test_loss: 1.0941, test_f1: 0.5884
 epoch: 13, train_loss: 0.9268, test_loss: 1.3808, test_f1: 0.4151
 epoch: 14, train_loss: 0.8986, test_loss: 1.1060, test_f1: 0.5252
 epoch: 15, train_loss: 0.8967, test_loss: 1.2463, test_f1: 0.5156
 epoch: 16, train_loss: 0.8479, test_loss: 1.0113, test_f1: 0.5692
 epoch: 17, train_loss: 0.8684, test_loss: 1.0607, test_f1: 0.5896
 epoch: 18, train_loss: 0.8344, test_loss: 1.0468, test_f1: 0.5447
 epoch: 19, train_loss: 0.8084, test_loss: 1.1669, test_f1: 0.5362
 epoch: 20, train_loss: 0.8270, test_loss: 1.0083, test_f1: 0.6026
 epoch: 21, train_loss: 0.7950, test_loss: 1.2130, test_f1: 0.4830
 epoch: 22, train_loss: 0.8428, test_loss: 1.0810, test_f1: 0.5915
 epoch: 23, train_loss: 0.8325, test_loss: 1.0819, test_f1: 0.5673
 epoch: 24, train_loss: 0.8237, test_loss: 1.0990, test_f1: 0.5850
 epoch: 25, train_loss: 0.7847, test_loss: 1.1021, test_f1: 0.6111
 epoch: 26, train_loss: 0.7885, test_loss: 1.1116, test_f1: 0.5757
 epoch: 27, train_loss: 0.7573, test_loss: 1.0490, test_f1: 0.5378
 epoch: 28, train_loss: 0.7720, test_loss: 1.1912, test_f1: 0.5330
 epoch: 29, train_loss: 0.7582, test_loss: 1.1361, test_f1: 0.5770
 epoch: 30, train_loss: 0.7500, test_loss: 1.1249, test_f1: 0.5460
 epoch: 31, train_loss: 0.7968, test_loss: 1.1645, test_f1: 0.5400
 epoch: 32, train_loss: 0.7749, test_loss: 1.1541, test_f1: 0.5993
 epoch: 33, train_loss: 0.7986, test_loss: 1.0658, test_f1: 0.6188
 epoch: 34, train_loss: 0.7997, test_loss: 1.1619, test_f1: 0.5850
 epoch: 35, train_loss: 0.7980, test_loss: 1.2118, test_f1: 0.5565
 epoch: 36, train_loss: 0.7574, test_loss: 1.1337, test_f1: 0.5817
 epoch: 37, train_loss: 0.7471, test_loss: 1.0741, test_f1: 0.5596
 epoch: 38, train_loss: 0.7665, test_loss: 1.7640, test_f1: 0.4184
 epoch: 39, train_loss: 0.7715, test_loss: 1.3389, test_f1: 0.5846
 epoch: 40, train_loss: 0.7339, test_loss: 1.2880, test_f1: 0.5821
 epoch: 41, train_loss: 0.7439, test_loss: 1.2241, test_f1: 0.6064
 epoch: 42, train_loss: 0.7249, test_loss: 1.1783, test_f1: 0.5502
 epoch: 43, train_loss: 0.7804, test_loss: 1.5117, test_f1: 0.4809
 epoch: 44, train_loss: 0.7853, test_loss: 1.1521, test_f1: 0.5473
 epoch: 45, train_loss: 0.7533, test_loss: 1.1539, test_f1: 0.5589
 epoch: 46, train_loss: 0.7428, test_loss: 1.2513, test_f1: 0.5183
 epoch: 47, train_loss: 0.7515, test_loss: 1.0891, test_f1: 0.5476
 epoch: 48, train_loss: 0.7975, test_loss: 1.2133, test_f1: 0.5234
 epoch: 49, train_loss: 0.7889, test_loss: 1.1718, test_f1: 0.5399
 epoch: 50, train_loss: 0.7653, test_loss: 1.1360, test_f1: 0.6383
 epoch: 51, train_loss: 0.7166, test_loss: 1.0965, test_f1: 0.6172
 epoch: 52, train_loss: 0.7018, test_loss: 1.1116, test_f1: 0.6089
 epoch: 53, train_loss: 0.6892, test_loss: 1.1109, test_f1: 0.5996
 epoch: 54, train_loss: 0.6767, test_loss: 1.1887, test_f1: 0.5740
 epoch: 55, train_loss: 0.6490, test_loss: 1.1453, test_f1: 0.5819
 epoch: 56, train_loss: 0.6397, test_loss: 1.1308, test_f1: 0.5922
 epoch: 57, train_loss: 0.6464, test_loss: 1.1307, test_f1: 0.5932
 epoch: 58, train_loss: 0.6467, test_loss: 1.0880, test_f1: 0.6040
 epoch: 59, train_loss: 0.6222, test_loss: 1.1510, test_f1: 0.5473
 epoch: 60, train_loss: 0.6513, test_loss: 1.2010, test_f1: 0.5373
 epoch: 61, train_loss: 0.6257, test_loss: 1.2072, test_f1: 0.5562
 epoch: 62, train_loss: 0.6182, test_loss: 1.1290, test_f1: 0.6186
 epoch: 63, train_loss: 0.6234, test_loss: 1.1688, test_f1: 0.6362
 epoch: 64, train_loss: 0.6121, test_loss: 1.1674, test_f1: 0.5940
 epoch: 65, train_loss: 0.5980, test_loss: 1.3537, test_f1: 0.5512
 epoch: 66, train_loss: 0.6077, test_loss: 1.1762, test_f1: 0.6062
 epoch: 67, train_loss: 0.6102, test_loss: 1.1174, test_f1: 0.5871
 epoch: 68, train_loss: 0.6273, test_loss: 1.1955, test_f1: 0.5773
 epoch: 69, train_loss: 0.5936, test_loss: 1.1522, test_f1: 0.6313
 epoch: 70, train_loss: 0.6208, test_loss: 1.4642, test_f1: 0.5235
 epoch: 71, train_loss: 0.6395, test_loss: 1.1765, test_f1: 0.6062
 epoch: 72, train_loss: 0.5940, test_loss: 1.1639, test_f1: 0.6053
 epoch: 73, train_loss: 0.5786, test_loss: 1.2277, test_f1: 0.5907
 epoch: 74, train_loss: 0.5664, test_loss: 1.2516, test_f1: 0.6088
 epoch: 75, train_loss: 0.5572, test_loss: 1.2484, test_f1: 0.6239
 epoch: 76, train_loss: 0.5646, test_loss: 1.2363, test_f1: 0.6095
 epoch: 77, train_loss: 0.5535, test_loss: 1.2312, test_f1: 0.6451
 epoch: 78, train_loss: 0.5901, test_loss: 1.2275, test_f1: 0.6146
 epoch: 79, train_loss: 0.5812, test_loss: 1.2732, test_f1: 0.5789
 epoch: 80, train_loss: 0.5527, test_loss: 1.1642, test_f1: 0.6454
 epoch: 81, train_loss: 0.5883, test_loss: 1.2409, test_f1: 0.6498
 epoch: 82, train_loss: 0.6057, test_loss: 1.3125, test_f1: 0.5828
 epoch: 83, train_loss: 0.6020, test_loss: 1.1604, test_f1: 0.5832
 epoch: 84, train_loss: 0.5612, test_loss: 1.2095, test_f1: 0.5859
 epoch: 85, train_loss: 0.5637, test_loss: 1.2834, test_f1: 0.5655
 epoch: 86, train_loss: 0.5668, test_loss: 1.2349, test_f1: 0.6022
 epoch: 87, train_loss: 0.5605, test_loss: 1.3274, test_f1: 0.6037
 epoch: 88, train_loss: 0.5459, test_loss: 1.3162, test_f1: 0.5813
 epoch: 89, train_loss: 0.5391, test_loss: 1.3471, test_f1: 0.5899
 epoch: 90, train_loss: 0.5524, test_loss: 1.3755, test_f1: 0.6045
 epoch: 91, train_loss: 0.5653, test_loss: 1.3285, test_f1: 0.6241
 epoch: 92, train_loss: 0.5353, test_loss: 1.3392, test_f1: 0.6116
 epoch: 93, train_loss: 0.5524, test_loss: 1.2483, test_f1: 0.6048
 epoch: 94, train_loss: 0.5543, test_loss: 1.2096, test_f1: 0.6077
 epoch: 95, train_loss: 0.5273, test_loss: 1.2343, test_f1: 0.6176
 epoch: 96, train_loss: 0.5395, test_loss: 1.4899, test_f1: 0.5688
 epoch: 97, train_loss: 0.5275, test_loss: 1.2371, test_f1: 0.6136
 epoch: 98, train_loss: 0.5088, test_loss: 1.1382, test_f1: 0.6152
 epoch: 99, train_loss: 0.5502, test_loss: 1.3962, test_f1: 0.5800
##################ITERATION #9 ****************************************
 epoch: 0, train_loss: 1.4090, test_loss: 1.4565, test_f1: 0.2746
 epoch: 1, train_loss: 1.2003, test_loss: 1.3076, test_f1: 0.2459
 epoch: 2, train_loss: 1.1263, test_loss: 1.2742, test_f1: 0.3340
 epoch: 3, train_loss: 1.0899, test_loss: 1.2913, test_f1: 0.3289
 epoch: 4, train_loss: 1.0497, test_loss: 1.2741, test_f1: 0.3831
 epoch: 5, train_loss: 1.0297, test_loss: 1.2547, test_f1: 0.4124
 epoch: 6, train_loss: 1.0206, test_loss: 1.3173, test_f1: 0.4120
 epoch: 7, train_loss: 0.9872, test_loss: 1.1810, test_f1: 0.5199
 epoch: 8, train_loss: 0.9826, test_loss: 1.1342, test_f1: 0.4907
 epoch: 9, train_loss: 0.9313, test_loss: 1.1743, test_f1: 0.4931
 epoch: 10, train_loss: 0.9017, test_loss: 1.2254, test_f1: 0.4328
 epoch: 11, train_loss: 0.8756, test_loss: 1.2006, test_f1: 0.4844
 epoch: 12, train_loss: 0.8645, test_loss: 1.1594, test_f1: 0.5672
 epoch: 13, train_loss: 0.8625, test_loss: 1.2191, test_f1: 0.4642
 epoch: 14, train_loss: 0.8799, test_loss: 1.2028, test_f1: 0.4519
 epoch: 15, train_loss: 0.8507, test_loss: 1.0682, test_f1: 0.5288
 epoch: 16, train_loss: 0.8514, test_loss: 1.0857, test_f1: 0.5489
 epoch: 17, train_loss: 0.8104, test_loss: 1.0201, test_f1: 0.5315
 epoch: 18, train_loss: 0.7943, test_loss: 1.0380, test_f1: 0.5585
 epoch: 19, train_loss: 0.7944, test_loss: 1.2687, test_f1: 0.5564
 epoch: 20, train_loss: 0.7737, test_loss: 1.1092, test_f1: 0.5785
 epoch: 21, train_loss: 0.7782, test_loss: 1.1165, test_f1: 0.5436
 epoch: 22, train_loss: 0.7714, test_loss: 1.1342, test_f1: 0.5518
 epoch: 23, train_loss: 0.8080, test_loss: 1.2528, test_f1: 0.4983
 epoch: 24, train_loss: 0.7878, test_loss: 1.1028, test_f1: 0.5410
 epoch: 25, train_loss: 0.7894, test_loss: 0.9801, test_f1: 0.6084
 epoch: 26, train_loss: 0.7706, test_loss: 1.2143, test_f1: 0.5712
 epoch: 27, train_loss: 0.8120, test_loss: 1.1686, test_f1: 0.5665
 epoch: 28, train_loss: 0.7818, test_loss: 1.1446, test_f1: 0.5569
 epoch: 29, train_loss: 0.7455, test_loss: 1.6076, test_f1: 0.4593
 epoch: 30, train_loss: 0.7431, test_loss: 1.1189, test_f1: 0.5727
 epoch: 31, train_loss: 0.7150, test_loss: 1.0058, test_f1: 0.5983
 epoch: 32, train_loss: 0.7044, test_loss: 1.1276, test_f1: 0.5575
 epoch: 33, train_loss: 0.6583, test_loss: 1.4781, test_f1: 0.5091
 epoch: 34, train_loss: 0.7271, test_loss: 1.1776, test_f1: 0.5738
 epoch: 35, train_loss: 0.7191, test_loss: 1.2462, test_f1: 0.5720
 epoch: 36, train_loss: 0.7175, test_loss: 1.0754, test_f1: 0.5885
 epoch: 37, train_loss: 0.7178, test_loss: 1.0466, test_f1: 0.5829
 epoch: 38, train_loss: 0.7690, test_loss: 1.3354, test_f1: 0.4533
 epoch: 39, train_loss: 0.7600, test_loss: 1.1277, test_f1: 0.5644
 epoch: 40, train_loss: 0.7255, test_loss: 1.0128, test_f1: 0.5998
 epoch: 41, train_loss: 0.6975, test_loss: 1.0401, test_f1: 0.5802
 epoch: 42, train_loss: 0.7177, test_loss: 1.0468, test_f1: 0.6088
 epoch: 43, train_loss: 0.7103, test_loss: 0.9943, test_f1: 0.5882
 epoch: 44, train_loss: 0.7233, test_loss: 1.1082, test_f1: 0.5803
 epoch: 45, train_loss: 0.7063, test_loss: 1.1429, test_f1: 0.5752
 epoch: 46, train_loss: 0.6953, test_loss: 1.1721, test_f1: 0.5948
 epoch: 47, train_loss: 0.6925, test_loss: 1.2473, test_f1: 0.5876
 epoch: 48, train_loss: 0.6758, test_loss: 1.1145, test_f1: 0.5778
 epoch: 49, train_loss: 0.6687, test_loss: 1.1282, test_f1: 0.5531
 epoch: 50, train_loss: 0.6440, test_loss: 1.0252, test_f1: 0.6391
 epoch: 51, train_loss: 0.6271, test_loss: 1.0725, test_f1: 0.6254
 epoch: 52, train_loss: 0.6352, test_loss: 1.2085, test_f1: 0.5373
 epoch: 53, train_loss: 0.5985, test_loss: 1.3333, test_f1: 0.5492
 epoch: 54, train_loss: 0.6011, test_loss: 1.0007, test_f1: 0.6501
 epoch: 55, train_loss: 0.6018, test_loss: 1.0562, test_f1: 0.6606
 epoch: 56, train_loss: 0.5950, test_loss: 1.1217, test_f1: 0.6425
 epoch: 57, train_loss: 0.5602, test_loss: 1.2005, test_f1: 0.6424
 epoch: 58, train_loss: 0.5663, test_loss: 1.2682, test_f1: 0.5837
 epoch: 59, train_loss: 0.5892, test_loss: 1.2198, test_f1: 0.6483
 epoch: 60, train_loss: 0.5731, test_loss: 1.2623, test_f1: 0.6065
 epoch: 61, train_loss: 0.5717, test_loss: 1.4924, test_f1: 0.5600
 epoch: 62, train_loss: 0.6253, test_loss: 1.2088, test_f1: 0.5806
 epoch: 63, train_loss: 0.5875, test_loss: 1.2091, test_f1: 0.6172
 epoch: 64, train_loss: 0.6037, test_loss: 1.2593, test_f1: 0.5890
 epoch: 65, train_loss: 0.6048, test_loss: 1.4025, test_f1: 0.6109
 epoch: 66, train_loss: 0.5675, test_loss: 1.5488, test_f1: 0.5888
 epoch: 67, train_loss: 0.5622, test_loss: 1.3222, test_f1: 0.6242
 epoch: 68, train_loss: 0.5586, test_loss: 1.1174, test_f1: 0.6462
 epoch: 69, train_loss: 0.5798, test_loss: 1.1899, test_f1: 0.6067
 epoch: 70, train_loss: 0.5577, test_loss: 1.5005, test_f1: 0.5369
 epoch: 71, train_loss: 0.5558, test_loss: 1.1420, test_f1: 0.6226
 epoch: 72, train_loss: 0.5357, test_loss: 1.2298, test_f1: 0.6511
 epoch: 73, train_loss: 0.5389, test_loss: 1.3847, test_f1: 0.5801
 epoch: 74, train_loss: 0.5468, test_loss: 1.3343, test_f1: 0.5715
 epoch: 75, train_loss: 0.5567, test_loss: 1.5456, test_f1: 0.5327
 epoch: 76, train_loss: 0.5531, test_loss: 1.7890, test_f1: 0.4933
 epoch: 77, train_loss: 0.5459, test_loss: 1.5215, test_f1: 0.5366
 epoch: 78, train_loss: 0.5419, test_loss: 1.3052, test_f1: 0.6032
 epoch: 79, train_loss: 0.5213, test_loss: 1.3103, test_f1: 0.5901
 epoch: 80, train_loss: 0.5210, test_loss: 1.2232, test_f1: 0.5905
 epoch: 81, train_loss: 0.5250, test_loss: 1.3565, test_f1: 0.5819
 epoch: 82, train_loss: 0.4977, test_loss: 1.2256, test_f1: 0.5782
 epoch: 83, train_loss: 0.5009, test_loss: 1.2064, test_f1: 0.6151
 epoch: 84, train_loss: 0.4745, test_loss: 1.3072, test_f1: 0.5925
 epoch: 85, train_loss: 0.5051, test_loss: 1.3102, test_f1: 0.6038
 epoch: 86, train_loss: 0.4985, test_loss: 1.5932, test_f1: 0.5404
 epoch: 87, train_loss: 0.5162, test_loss: 1.3204, test_f1: 0.6033
 epoch: 88, train_loss: 0.4960, test_loss: 1.4589, test_f1: 0.6059
 epoch: 89, train_loss: 0.5146, test_loss: 1.2879, test_f1: 0.6064
 epoch: 90, train_loss: 0.5213, test_loss: 1.2210, test_f1: 0.6113
 epoch: 91, train_loss: 0.4998, test_loss: 1.4049, test_f1: 0.6156
 epoch: 92, train_loss: 0.4940, test_loss: 1.4526, test_f1: 0.6010
 epoch: 93, train_loss: 0.4731, test_loss: 1.4461, test_f1: 0.5411
 epoch: 94, train_loss: 0.5313, test_loss: 1.6544, test_f1: 0.5417
 epoch: 95, train_loss: 0.4986, test_loss: 1.4272, test_f1: 0.5892
 epoch: 96, train_loss: 0.4937, test_loss: 1.4776, test_f1: 0.6133
 epoch: 97, train_loss: 0.4841, test_loss: 1.6037, test_f1: 0.6048
 epoch: 98, train_loss: 0.4924, test_loss: 1.7269, test_f1: 0.5352
 epoch: 99, train_loss: 0.5279, test_loss: 1.7001, test_f1: 0.4960

Training completed in 339.02 seconds
Best F1: 0.6606 at epoch 55
Mean F1 across iterations: 0.6332  0.0169
========================FINAL RESULTS================================
FEGIN weighted F1: 0.6606  0.0169
python main.py --data ltspice_demos --representation component_component --model FEGIN --layers 3 --hiddens 32 --batch_size 256 --lr 0.01 --emb_size 250 --epochs 100 --save_appendix component_component_L3_H32_BS256_LR0.01_E250 --no_val
-----



STDERR:
  File "main.py", line 370, in <module>
    main()
  File "main.py", line 254, in main
    dataset = dataset_class(
  File "/home/philip/projects/ltspice_examples_code_repo/Circuit-Completion-Using-GNNs/component_classification_with_link_prediction_head/evaluation/FEGIN/kernel/circuit_datasets.py", line 15, in __init__
    self.data, self.slices = torch.load(self.processed_paths[0])
  File "/home/philip/.local/lib/python3.8/site-packages/torch/serialization.py", line 1040, in load
    warnings.warn(
  File "/usr/lib/python3.8/warnings.py", line 109, in _showwarnmsg
    sw(msg.message, msg.category, msg.filename, msg.lineno,
  File "main.py", line 47, in warn_with_traceback
    traceback.print_stack(file=log)
/home/philip/projects/ltspice_examples_code_repo/Circuit-Completion-Using-GNNs/component_classification_with_link_prediction_head/evaluation/FEGIN/kernel/circuit_datasets.py:15: FutureWarning: You are using `torch.load` with `weights_only=False` (the current default value), which uses the default pickle module implicitly. It is possible to construct malicious pickle data which will execute arbitrary code during unpickling (See https://github.com/pytorch/pytorch/blob/main/SECURITY.md#untrusted-models for more details). In a future release, the default value for `weights_only` will be flipped to `True`. This limits the functions that could be executed during unpickling. Arbitrary objects will no longer be allowed to be loaded via this mode unless they are explicitly allowlisted by the user via `torch.serialization.add_safe_globals`. We recommend you start setting `weights_only=True` for any use case where you don't have full control of the loaded file. Please open an issue on GitHub for any issues related to this experimental feature.
  self.data, self.slices = torch.load(self.processed_paths[0])
