STDOUT:
Results will be saved in /home/philip/projects/ltspice_examples_code_repo/Circuit-Completion-Using-GNNs/component_classification_with_link_prediction_head/evaluation/FEGIN/results/model_FEGIN_dataset_ltspice_examples
Command line input: python main.py --data ltspice_examples --representation component_pin --model FEGIN --layers 3 --hiddens 128 --batch_size 64 --lr 0.01 --emb_size 512 --epochs 100 --save_appendix component_pin_L3_H128_BS64_LR0.01_E512 --no_val
 is saved.
-----
ltspice_examples - FEGIN
Using 3 layers, 128 hidden units, h = 2
Loading component_pin representation dataset
ENTERED
Training FEGIN on component_pin representation
Train: 3560, Test: 848
##################ITERATION #0 ****************************************
 epoch: 0, train_loss: 1.1357, test_loss: 1.1216, test_f1: 0.4054
 epoch: 1, train_loss: 0.9988, test_loss: 0.9973, test_f1: 0.5177
 epoch: 2, train_loss: 0.9593, test_loss: 0.9336, test_f1: 0.5072
 epoch: 3, train_loss: 0.9431, test_loss: 1.1169, test_f1: 0.4576
 epoch: 4, train_loss: 0.9096, test_loss: 0.9213, test_f1: 0.4973
 epoch: 5, train_loss: 0.8992, test_loss: 0.9139, test_f1: 0.5680
 epoch: 6, train_loss: 0.8859, test_loss: 0.9106, test_f1: 0.4842
 epoch: 7, train_loss: 0.8683, test_loss: 0.7991, test_f1: 0.6202
 epoch: 8, train_loss: 0.8305, test_loss: 0.8548, test_f1: 0.5159
 epoch: 9, train_loss: 0.8410, test_loss: 0.9206, test_f1: 0.5335
 epoch: 10, train_loss: 0.8209, test_loss: 0.8146, test_f1: 0.5739
 epoch: 11, train_loss: 0.8253, test_loss: 0.7775, test_f1: 0.5981
 epoch: 12, train_loss: 0.7816, test_loss: 0.7697, test_f1: 0.5487
 epoch: 13, train_loss: 0.7721, test_loss: 1.0115, test_f1: 0.5492
 epoch: 14, train_loss: 0.7684, test_loss: 0.7152, test_f1: 0.6271
 epoch: 15, train_loss: 0.7356, test_loss: 0.9044, test_f1: 0.5186
 epoch: 16, train_loss: 0.7371, test_loss: 0.8261, test_f1: 0.5723
 epoch: 17, train_loss: 0.7408, test_loss: 0.8774, test_f1: 0.4925
 epoch: 18, train_loss: 0.7412, test_loss: 0.8002, test_f1: 0.6102
 epoch: 19, train_loss: 0.6964, test_loss: 0.7819, test_f1: 0.5892
 epoch: 20, train_loss: 0.7353, test_loss: 0.7161, test_f1: 0.5866
 epoch: 21, train_loss: 0.7237, test_loss: 0.8736, test_f1: 0.5650
 epoch: 22, train_loss: 0.7033, test_loss: 0.9529, test_f1: 0.5525
 epoch: 23, train_loss: 0.6715, test_loss: 1.2359, test_f1: 0.6320
 epoch: 24, train_loss: 0.7015, test_loss: 0.9433, test_f1: 0.5816
 epoch: 25, train_loss: 0.6785, test_loss: 0.9434, test_f1: 0.5680
 epoch: 26, train_loss: 0.6738, test_loss: 0.8738, test_f1: 0.5627
 epoch: 27, train_loss: 0.6822, test_loss: 0.9238, test_f1: 0.5238
 epoch: 28, train_loss: 0.6828, test_loss: 0.9769, test_f1: 0.6361
 epoch: 29, train_loss: 0.6503, test_loss: 0.8419, test_f1: 0.6488
 epoch: 30, train_loss: 0.6421, test_loss: 0.8258, test_f1: 0.5714
 epoch: 31, train_loss: 0.6339, test_loss: 0.8577, test_f1: 0.5776
 epoch: 32, train_loss: 0.6277, test_loss: 0.8223, test_f1: 0.5742
 epoch: 33, train_loss: 0.6271, test_loss: 0.7565, test_f1: 0.5872
 epoch: 34, train_loss: 0.6236, test_loss: 0.8361, test_f1: 0.5416
 epoch: 35, train_loss: 0.6129, test_loss: 0.8862, test_f1: 0.5396
 epoch: 36, train_loss: 0.6244, test_loss: 0.7731, test_f1: 0.6370
 epoch: 37, train_loss: 0.6071, test_loss: 0.8828, test_f1: 0.5929
 epoch: 38, train_loss: 0.6132, test_loss: 0.9088, test_f1: 0.5820
 epoch: 39, train_loss: 0.5944, test_loss: 0.8992, test_f1: 0.6297
 epoch: 40, train_loss: 0.6226, test_loss: 0.8773, test_f1: 0.6267
 epoch: 41, train_loss: 0.6090, test_loss: 0.7538, test_f1: 0.6774
 epoch: 42, train_loss: 0.5879, test_loss: 0.8479, test_f1: 0.5769
 epoch: 43, train_loss: 0.5806, test_loss: 0.7729, test_f1: 0.6360
 epoch: 44, train_loss: 0.5883, test_loss: 0.8132, test_f1: 0.5946
 epoch: 45, train_loss: 0.5776, test_loss: 1.0271, test_f1: 0.6402
 epoch: 46, train_loss: 0.5758, test_loss: 0.9581, test_f1: 0.6494
 epoch: 47, train_loss: 0.5591, test_loss: 0.8126, test_f1: 0.6329
 epoch: 48, train_loss: 0.5545, test_loss: 0.9147, test_f1: 0.5800
 epoch: 49, train_loss: 0.5352, test_loss: 0.9604, test_f1: 0.6434
 epoch: 50, train_loss: 0.5810, test_loss: 0.8813, test_f1: 0.6498
 epoch: 51, train_loss: 0.5088, test_loss: 0.8664, test_f1: 0.6351
 epoch: 52, train_loss: 0.4918, test_loss: 0.8475, test_f1: 0.6181
 epoch: 53, train_loss: 0.4624, test_loss: 0.8147, test_f1: 0.6479
 epoch: 54, train_loss: 0.4506, test_loss: 0.9711, test_f1: 0.6329
 epoch: 55, train_loss: 0.4624, test_loss: 0.9274, test_f1: 0.6342
 epoch: 56, train_loss: 0.4549, test_loss: 0.8440, test_f1: 0.6306
 epoch: 57, train_loss: 0.4277, test_loss: 0.8748, test_f1: 0.6092
 epoch: 58, train_loss: 0.4145, test_loss: 0.9316, test_f1: 0.6168
 epoch: 59, train_loss: 0.4327, test_loss: 0.9484, test_f1: 0.6464
 epoch: 60, train_loss: 0.4281, test_loss: 0.9719, test_f1: 0.6299
 epoch: 61, train_loss: 0.4358, test_loss: 0.8598, test_f1: 0.6410
 epoch: 62, train_loss: 0.4482, test_loss: 0.9344, test_f1: 0.6615
 epoch: 63, train_loss: 0.4231, test_loss: 0.9282, test_f1: 0.6382
 epoch: 64, train_loss: 0.4165, test_loss: 0.9713, test_f1: 0.6524
 epoch: 65, train_loss: 0.3963, test_loss: 0.8924, test_f1: 0.6548
 epoch: 66, train_loss: 0.4104, test_loss: 0.9159, test_f1: 0.6505
 epoch: 67, train_loss: 0.3939, test_loss: 0.9539, test_f1: 0.6475
 epoch: 68, train_loss: 0.3855, test_loss: 0.9238, test_f1: 0.6593
 epoch: 69, train_loss: 0.4163, test_loss: 0.9457, test_f1: 0.6802
 epoch: 70, train_loss: 0.3780, test_loss: 1.0724, test_f1: 0.6254
 epoch: 71, train_loss: 0.3758, test_loss: 1.1177, test_f1: 0.6330
 epoch: 72, train_loss: 0.3868, test_loss: 1.1016, test_f1: 0.6520
 epoch: 73, train_loss: 0.3748, test_loss: 1.0007, test_f1: 0.6461
 epoch: 74, train_loss: 0.3911, test_loss: 1.2056, test_f1: 0.6206
 epoch: 75, train_loss: 0.3524, test_loss: 1.0065, test_f1: 0.6591
 epoch: 76, train_loss: 0.3636, test_loss: 1.0238, test_f1: 0.6286
 epoch: 77, train_loss: 0.3785, test_loss: 1.0618, test_f1: 0.6226
 epoch: 78, train_loss: 0.3714, test_loss: 1.0003, test_f1: 0.6409
 epoch: 79, train_loss: 0.3640, test_loss: 0.9816, test_f1: 0.6564
 epoch: 80, train_loss: 0.3423, test_loss: 1.2331, test_f1: 0.6347
 epoch: 81, train_loss: 0.3418, test_loss: 1.0688, test_f1: 0.6647
 epoch: 82, train_loss: 0.3243, test_loss: 1.1099, test_f1: 0.6419
 epoch: 83, train_loss: 0.3485, test_loss: 1.0889, test_f1: 0.6650
 epoch: 84, train_loss: 0.3434, test_loss: 1.0276, test_f1: 0.6349
 epoch: 85, train_loss: 0.3361, test_loss: 1.2247, test_f1: 0.5985
 epoch: 86, train_loss: 0.3411, test_loss: 1.0845, test_f1: 0.6808
 epoch: 87, train_loss: 0.3425, test_loss: 1.0774, test_f1: 0.6967
 epoch: 88, train_loss: 0.3456, test_loss: 1.0428, test_f1: 0.6862
 epoch: 89, train_loss: 0.3313, test_loss: 1.2307, test_f1: 0.6428
 epoch: 90, train_loss: 0.3338, test_loss: 1.0475, test_f1: 0.6555
 epoch: 91, train_loss: 0.3185, test_loss: 1.1217, test_f1: 0.6363
 epoch: 92, train_loss: 0.3267, test_loss: 1.1099, test_f1: 0.6640
 epoch: 93, train_loss: 0.3301, test_loss: 1.1071, test_f1: 0.6852
 epoch: 94, train_loss: 0.2938, test_loss: 1.2966, test_f1: 0.6599
 epoch: 95, train_loss: 0.3094, test_loss: 1.3065, test_f1: 0.6445
 epoch: 96, train_loss: 0.3008, test_loss: 1.1562, test_f1: 0.6596
 epoch: 97, train_loss: 0.3074, test_loss: 1.0794, test_f1: 0.6194
 epoch: 98, train_loss: 0.2940, test_loss: 1.1765, test_f1: 0.6417
 epoch: 99, train_loss: 0.3107, test_loss: 1.1624, test_f1: 0.6893
##################ITERATION #1 ****************************************
 epoch: 0, train_loss: 1.1840, test_loss: 1.2328, test_f1: 0.4617
 epoch: 1, train_loss: 1.0218, test_loss: 1.0022, test_f1: 0.4433
 epoch: 2, train_loss: 1.0015, test_loss: 1.2597, test_f1: 0.4028
 epoch: 3, train_loss: 0.9756, test_loss: 1.1154, test_f1: 0.4785
 epoch: 4, train_loss: 0.9390, test_loss: 0.9085, test_f1: 0.5008
 epoch: 5, train_loss: 0.9174, test_loss: 0.8737, test_f1: 0.5095
 epoch: 6, train_loss: 0.8965, test_loss: 0.8902, test_f1: 0.5205
 epoch: 7, train_loss: 0.8718, test_loss: 1.0525, test_f1: 0.4403
 epoch: 8, train_loss: 0.8530, test_loss: 1.1620, test_f1: 0.4967
 epoch: 9, train_loss: 0.8504, test_loss: 0.8884, test_f1: 0.5212
 epoch: 10, train_loss: 0.8346, test_loss: 1.0153, test_f1: 0.5246
 epoch: 11, train_loss: 0.8199, test_loss: 0.8692, test_f1: 0.5873
 epoch: 12, train_loss: 0.8146, test_loss: 0.8430, test_f1: 0.5416
 epoch: 13, train_loss: 0.8354, test_loss: 0.9671, test_f1: 0.4957
 epoch: 14, train_loss: 0.7945, test_loss: 0.8775, test_f1: 0.5372
 epoch: 15, train_loss: 0.7878, test_loss: 0.7840, test_f1: 0.5840
 epoch: 16, train_loss: 0.7742, test_loss: 0.8692, test_f1: 0.5057
 epoch: 17, train_loss: 0.7619, test_loss: 0.8100, test_f1: 0.5568
 epoch: 18, train_loss: 0.7527, test_loss: 0.7750, test_f1: 0.5654
 epoch: 19, train_loss: 0.7481, test_loss: 0.8786, test_f1: 0.5485
 epoch: 20, train_loss: 0.7633, test_loss: 1.0088, test_f1: 0.5384
 epoch: 21, train_loss: 0.7267, test_loss: 0.9355, test_f1: 0.5842
 epoch: 22, train_loss: 0.7443, test_loss: 0.9932, test_f1: 0.5606
 epoch: 23, train_loss: 0.7251, test_loss: 0.8958, test_f1: 0.5759
 epoch: 24, train_loss: 0.7239, test_loss: 0.9547, test_f1: 0.5287
 epoch: 25, train_loss: 0.7085, test_loss: 0.9175, test_f1: 0.6061
 epoch: 26, train_loss: 0.7039, test_loss: 0.9078, test_f1: 0.5724
 epoch: 27, train_loss: 0.6889, test_loss: 0.8969, test_f1: 0.5703
 epoch: 28, train_loss: 0.6999, test_loss: 0.8829, test_f1: 0.5385
 epoch: 29, train_loss: 0.6962, test_loss: 0.9545, test_f1: 0.6210
 epoch: 30, train_loss: 0.6689, test_loss: 1.0117, test_f1: 0.6432
 epoch: 31, train_loss: 0.6723, test_loss: 0.9654, test_f1: 0.6310
 epoch: 32, train_loss: 0.6574, test_loss: 1.0630, test_f1: 0.5716
 epoch: 33, train_loss: 0.6415, test_loss: 0.9024, test_f1: 0.6196
 epoch: 34, train_loss: 0.6454, test_loss: 0.9884, test_f1: 0.6184
 epoch: 35, train_loss: 0.6630, test_loss: 0.9201, test_f1: 0.6571
 epoch: 36, train_loss: 0.6390, test_loss: 1.1599, test_f1: 0.6043
 epoch: 37, train_loss: 0.6335, test_loss: 1.1471, test_f1: 0.5972
 epoch: 38, train_loss: 0.6217, test_loss: 0.8870, test_f1: 0.6054
 epoch: 39, train_loss: 0.6068, test_loss: 0.9210, test_f1: 0.5843
 epoch: 40, train_loss: 0.5958, test_loss: 0.8818, test_f1: 0.6117
 epoch: 41, train_loss: 0.6020, test_loss: 1.1175, test_f1: 0.6485
 epoch: 42, train_loss: 0.6187, test_loss: 0.8434, test_f1: 0.6232
 epoch: 43, train_loss: 0.6018, test_loss: 0.7406, test_f1: 0.6557
 epoch: 44, train_loss: 0.5750, test_loss: 0.8777, test_f1: 0.6294
 epoch: 45, train_loss: 0.5798, test_loss: 0.9487, test_f1: 0.6032
 epoch: 46, train_loss: 0.5708, test_loss: 0.9580, test_f1: 0.6136
 epoch: 47, train_loss: 0.5479, test_loss: 1.0498, test_f1: 0.6436
 epoch: 48, train_loss: 0.5376, test_loss: 1.0505, test_f1: 0.6261
 epoch: 49, train_loss: 0.5532, test_loss: 1.0060, test_f1: 0.6049
 epoch: 50, train_loss: 0.5461, test_loss: 0.9188, test_f1: 0.6455
 epoch: 51, train_loss: 0.5127, test_loss: 0.9563, test_f1: 0.6785
 epoch: 52, train_loss: 0.4848, test_loss: 0.7677, test_f1: 0.6775
 epoch: 53, train_loss: 0.4733, test_loss: 0.9885, test_f1: 0.6746
 epoch: 54, train_loss: 0.4485, test_loss: 1.0213, test_f1: 0.6887
 epoch: 55, train_loss: 0.4308, test_loss: 1.0392, test_f1: 0.6732
 epoch: 56, train_loss: 0.4433, test_loss: 1.0588, test_f1: 0.6729
 epoch: 57, train_loss: 0.4374, test_loss: 1.1884, test_f1: 0.6733
 epoch: 58, train_loss: 0.4408, test_loss: 0.9179, test_f1: 0.6623
 epoch: 59, train_loss: 0.4230, test_loss: 0.9001, test_f1: 0.6640
 epoch: 60, train_loss: 0.4510, test_loss: 0.9343, test_f1: 0.6851
 epoch: 61, train_loss: 0.4280, test_loss: 0.9465, test_f1: 0.6562
 epoch: 62, train_loss: 0.4071, test_loss: 1.0409, test_f1: 0.6821
 epoch: 63, train_loss: 0.4040, test_loss: 1.1528, test_f1: 0.7029
 epoch: 64, train_loss: 0.4042, test_loss: 1.0333, test_f1: 0.6737
 epoch: 65, train_loss: 0.3906, test_loss: 1.1154, test_f1: 0.6880
 epoch: 66, train_loss: 0.3935, test_loss: 1.2982, test_f1: 0.6837
 epoch: 67, train_loss: 0.3932, test_loss: 1.2446, test_f1: 0.6905
 epoch: 68, train_loss: 0.3890, test_loss: 1.2503, test_f1: 0.6575
 epoch: 69, train_loss: 0.3868, test_loss: 1.2188, test_f1: 0.6790
 epoch: 70, train_loss: 0.3733, test_loss: 0.9485, test_f1: 0.6763
 epoch: 71, train_loss: 0.3696, test_loss: 0.9697, test_f1: 0.6866
 epoch: 72, train_loss: 0.3912, test_loss: 1.0032, test_f1: 0.6863
 epoch: 73, train_loss: 0.3787, test_loss: 1.0848, test_f1: 0.6938
 epoch: 74, train_loss: 0.3757, test_loss: 0.9352, test_f1: 0.7049
 epoch: 75, train_loss: 0.3631, test_loss: 1.2234, test_f1: 0.7008
 epoch: 76, train_loss: 0.3842, test_loss: 1.0442, test_f1: 0.6655
 epoch: 77, train_loss: 0.3692, test_loss: 1.1250, test_f1: 0.6739
 epoch: 78, train_loss: 0.3570, test_loss: 1.2349, test_f1: 0.6896
 epoch: 79, train_loss: 0.3460, test_loss: 1.1756, test_f1: 0.6790
 epoch: 80, train_loss: 0.3358, test_loss: 1.0707, test_f1: 0.6856
 epoch: 81, train_loss: 0.3411, test_loss: 1.0629, test_f1: 0.6597
 epoch: 82, train_loss: 0.3226, test_loss: 1.2988, test_f1: 0.7022
 epoch: 83, train_loss: 0.3270, test_loss: 1.2865, test_f1: 0.6747
 epoch: 84, train_loss: 0.3422, test_loss: 1.2060, test_f1: 0.6728
 epoch: 85, train_loss: 0.3550, test_loss: 1.0819, test_f1: 0.7072
 epoch: 86, train_loss: 0.3453, test_loss: 1.1937, test_f1: 0.6694
 epoch: 87, train_loss: 0.3398, test_loss: 1.4897, test_f1: 0.7096
 epoch: 88, train_loss: 0.3482, test_loss: 1.0618, test_f1: 0.6807
 epoch: 89, train_loss: 0.3446, test_loss: 1.0203, test_f1: 0.7021
 epoch: 90, train_loss: 0.3068, test_loss: 1.1184, test_f1: 0.7012
 epoch: 91, train_loss: 0.3017, test_loss: 1.3235, test_f1: 0.6666
 epoch: 92, train_loss: 0.3090, test_loss: 1.4695, test_f1: 0.6690
 epoch: 93, train_loss: 0.3187, test_loss: 1.3967, test_f1: 0.7039
 epoch: 94, train_loss: 0.3167, test_loss: 1.2286, test_f1: 0.6901
 epoch: 95, train_loss: 0.2954, test_loss: 1.2413, test_f1: 0.7014
 epoch: 96, train_loss: 0.2951, test_loss: 1.4139, test_f1: 0.6921
 epoch: 97, train_loss: 0.3266, test_loss: 1.5256, test_f1: 0.6612
 epoch: 98, train_loss: 0.2978, test_loss: 1.2518, test_f1: 0.7035
 epoch: 99, train_loss: 0.2870, test_loss: 1.2259, test_f1: 0.6916
##################ITERATION #2 ****************************************
 epoch: 0, train_loss: 1.2152, test_loss: 1.1246, test_f1: 0.4605
 epoch: 1, train_loss: 1.0297, test_loss: 1.0970, test_f1: 0.4536
 epoch: 2, train_loss: 0.9828, test_loss: 1.1631, test_f1: 0.4344
 epoch: 3, train_loss: 0.9594, test_loss: 1.0952, test_f1: 0.4698
 epoch: 4, train_loss: 0.9276, test_loss: 1.2272, test_f1: 0.4121
 epoch: 5, train_loss: 0.9033, test_loss: 1.2392, test_f1: 0.4742
 epoch: 6, train_loss: 0.9154, test_loss: 1.0161, test_f1: 0.4906
 epoch: 7, train_loss: 0.8925, test_loss: 0.9025, test_f1: 0.4876
 epoch: 8, train_loss: 0.8650, test_loss: 0.9744, test_f1: 0.5224
 epoch: 9, train_loss: 0.8471, test_loss: 0.8700, test_f1: 0.4915
 epoch: 10, train_loss: 0.8478, test_loss: 0.8843, test_f1: 0.5182
 epoch: 11, train_loss: 0.8380, test_loss: 0.8742, test_f1: 0.5650
 epoch: 12, train_loss: 0.7984, test_loss: 1.0281, test_f1: 0.5317
 epoch: 13, train_loss: 0.8336, test_loss: 1.0238, test_f1: 0.5091
 epoch: 14, train_loss: 0.8044, test_loss: 1.0561, test_f1: 0.5237
 epoch: 15, train_loss: 0.8079, test_loss: 0.8989, test_f1: 0.5293
 epoch: 16, train_loss: 0.7834, test_loss: 0.8649, test_f1: 0.5318
 epoch: 17, train_loss: 0.7888, test_loss: 0.8092, test_f1: 0.5432
 epoch: 18, train_loss: 0.7596, test_loss: 0.7889, test_f1: 0.5833
 epoch: 19, train_loss: 0.7621, test_loss: 1.0820, test_f1: 0.5695
 epoch: 20, train_loss: 0.7488, test_loss: 0.9087, test_f1: 0.5370
 epoch: 21, train_loss: 0.7536, test_loss: 0.9016, test_f1: 0.5759
 epoch: 22, train_loss: 0.7422, test_loss: 0.9959, test_f1: 0.5213
 epoch: 23, train_loss: 0.7372, test_loss: 1.1171, test_f1: 0.5909
 epoch: 24, train_loss: 0.7183, test_loss: 0.8033, test_f1: 0.6336
 epoch: 25, train_loss: 0.7162, test_loss: 0.8299, test_f1: 0.6086
 epoch: 26, train_loss: 0.6961, test_loss: 0.8818, test_f1: 0.6312
 epoch: 27, train_loss: 0.6901, test_loss: 0.8919, test_f1: 0.5629
 epoch: 28, train_loss: 0.6920, test_loss: 0.9164, test_f1: 0.5159
 epoch: 29, train_loss: 0.6816, test_loss: 0.9071, test_f1: 0.6409
 epoch: 30, train_loss: 0.6836, test_loss: 0.8755, test_f1: 0.6242
 epoch: 31, train_loss: 0.6559, test_loss: 1.0373, test_f1: 0.6210
 epoch: 32, train_loss: 0.6860, test_loss: 0.9461, test_f1: 0.5758
 epoch: 33, train_loss: 0.7131, test_loss: 1.0074, test_f1: 0.5519
 epoch: 34, train_loss: 0.6702, test_loss: 0.8224, test_f1: 0.5461
 epoch: 35, train_loss: 0.6645, test_loss: 0.9662, test_f1: 0.6279
 epoch: 36, train_loss: 0.6510, test_loss: 1.0077, test_f1: 0.6163
 epoch: 37, train_loss: 0.6169, test_loss: 0.9392, test_f1: 0.5777
 epoch: 38, train_loss: 0.6198, test_loss: 1.0455, test_f1: 0.6109
 epoch: 39, train_loss: 0.6268, test_loss: 0.9429, test_f1: 0.6204
 epoch: 40, train_loss: 0.6255, test_loss: 1.1501, test_f1: 0.5959
 epoch: 41, train_loss: 0.5843, test_loss: 1.0716, test_f1: 0.6039
 epoch: 42, train_loss: 0.5980, test_loss: 1.0531, test_f1: 0.6014
 epoch: 43, train_loss: 0.6143, test_loss: 0.9976, test_f1: 0.6122
 epoch: 44, train_loss: 0.5955, test_loss: 0.9553, test_f1: 0.5787
 epoch: 45, train_loss: 0.5944, test_loss: 1.2380, test_f1: 0.5908
 epoch: 46, train_loss: 0.6127, test_loss: 0.8759, test_f1: 0.6345
 epoch: 47, train_loss: 0.5919, test_loss: 0.9046, test_f1: 0.6604
 epoch: 48, train_loss: 0.5597, test_loss: 0.8518, test_f1: 0.6163
 epoch: 49, train_loss: 0.5727, test_loss: 1.1077, test_f1: 0.6292
 epoch: 50, train_loss: 0.5680, test_loss: 1.1199, test_f1: 0.5667
 epoch: 51, train_loss: 0.5182, test_loss: 0.9660, test_f1: 0.6250
 epoch: 52, train_loss: 0.4899, test_loss: 0.9054, test_f1: 0.6459
 epoch: 53, train_loss: 0.4890, test_loss: 0.9587, test_f1: 0.6413
 epoch: 54, train_loss: 0.4645, test_loss: 1.0120, test_f1: 0.6340
 epoch: 55, train_loss: 0.4733, test_loss: 0.9973, test_f1: 0.6308
 epoch: 56, train_loss: 0.4667, test_loss: 1.1069, test_f1: 0.6241
 epoch: 57, train_loss: 0.4627, test_loss: 1.1353, test_f1: 0.6374
 epoch: 58, train_loss: 0.4658, test_loss: 1.0048, test_f1: 0.6271
 epoch: 59, train_loss: 0.4518, test_loss: 1.0266, test_f1: 0.6301
 epoch: 60, train_loss: 0.4456, test_loss: 0.9650, test_f1: 0.6712
 epoch: 61, train_loss: 0.4277, test_loss: 1.0356, test_f1: 0.6388
 epoch: 62, train_loss: 0.4245, test_loss: 1.0509, test_f1: 0.6494
 epoch: 63, train_loss: 0.4288, test_loss: 1.0878, test_f1: 0.6508
 epoch: 64, train_loss: 0.4267, test_loss: 1.0868, test_f1: 0.6496
 epoch: 65, train_loss: 0.4426, test_loss: 1.0929, test_f1: 0.6417
 epoch: 66, train_loss: 0.4291, test_loss: 1.3753, test_f1: 0.6184
 epoch: 67, train_loss: 0.4151, test_loss: 1.1320, test_f1: 0.6194
 epoch: 68, train_loss: 0.4324, test_loss: 1.1674, test_f1: 0.6252
 epoch: 69, train_loss: 0.4256, test_loss: 1.3170, test_f1: 0.6206
 epoch: 70, train_loss: 0.4086, test_loss: 1.1227, test_f1: 0.6571
 epoch: 71, train_loss: 0.3996, test_loss: 1.0732, test_f1: 0.6603
 epoch: 72, train_loss: 0.3904, test_loss: 1.2408, test_f1: 0.6347
 epoch: 73, train_loss: 0.3900, test_loss: 1.0569, test_f1: 0.6856
 epoch: 74, train_loss: 0.3877, test_loss: 1.1862, test_f1: 0.6646
 epoch: 75, train_loss: 0.3839, test_loss: 1.0395, test_f1: 0.6664
 epoch: 76, train_loss: 0.3787, test_loss: 1.2800, test_f1: 0.6333
 epoch: 77, train_loss: 0.3693, test_loss: 1.2100, test_f1: 0.6435
 epoch: 78, train_loss: 0.3678, test_loss: 1.3261, test_f1: 0.6303
 epoch: 79, train_loss: 0.3548, test_loss: 1.1968, test_f1: 0.6764
 epoch: 80, train_loss: 0.3725, test_loss: 1.3845, test_f1: 0.6308
 epoch: 81, train_loss: 0.3685, test_loss: 1.2984, test_f1: 0.6402
 epoch: 82, train_loss: 0.3494, test_loss: 1.2360, test_f1: 0.6662
 epoch: 83, train_loss: 0.3565, test_loss: 1.2793, test_f1: 0.6732
 epoch: 84, train_loss: 0.3640, test_loss: 1.3691, test_f1: 0.6627
 epoch: 85, train_loss: 0.3505, test_loss: 1.1275, test_f1: 0.6544
 epoch: 86, train_loss: 0.3680, test_loss: 1.1599, test_f1: 0.6996
 epoch: 87, train_loss: 0.3478, test_loss: 1.0950, test_f1: 0.6875
 epoch: 88, train_loss: 0.3518, test_loss: 1.2945, test_f1: 0.6474
 epoch: 89, train_loss: 0.3213, test_loss: 1.2904, test_f1: 0.6691
 epoch: 90, train_loss: 0.3406, test_loss: 1.2368, test_f1: 0.6825
 epoch: 91, train_loss: 0.3495, test_loss: 1.1841, test_f1: 0.6661
 epoch: 92, train_loss: 0.3203, test_loss: 1.3150, test_f1: 0.6395
 epoch: 93, train_loss: 0.3313, test_loss: 1.1805, test_f1: 0.6633
 epoch: 94, train_loss: 0.3308, test_loss: 1.2748, test_f1: 0.6781
 epoch: 95, train_loss: 0.3292, test_loss: 1.0547, test_f1: 0.6976
 epoch: 96, train_loss: 0.3033, test_loss: 1.2393, test_f1: 0.6500
 epoch: 97, train_loss: 0.3088, test_loss: 1.4240, test_f1: 0.6610
 epoch: 98, train_loss: 0.2976, test_loss: 1.2788, test_f1: 0.6336
 epoch: 99, train_loss: 0.2972, test_loss: 1.6506, test_f1: 0.6542
##################ITERATION #3 ****************************************
 epoch: 0, train_loss: 1.1950, test_loss: 1.3195, test_f1: 0.4111
 epoch: 1, train_loss: 1.0316, test_loss: 1.0281, test_f1: 0.4759
 epoch: 2, train_loss: 0.9854, test_loss: 1.0480, test_f1: 0.4779
 epoch: 3, train_loss: 0.9781, test_loss: 1.0184, test_f1: 0.4936
 epoch: 4, train_loss: 0.9603, test_loss: 0.9583, test_f1: 0.5026
 epoch: 5, train_loss: 0.9357, test_loss: 1.1823, test_f1: 0.4585
 epoch: 6, train_loss: 0.9188, test_loss: 1.1479, test_f1: 0.4518
 epoch: 7, train_loss: 0.9127, test_loss: 1.0805, test_f1: 0.4814
 epoch: 8, train_loss: 0.8995, test_loss: 1.0063, test_f1: 0.4824
 epoch: 9, train_loss: 0.8953, test_loss: 0.9522, test_f1: 0.4609
 epoch: 10, train_loss: 0.8748, test_loss: 0.9606, test_f1: 0.5548
 epoch: 11, train_loss: 0.8692, test_loss: 0.8799, test_f1: 0.5463
 epoch: 12, train_loss: 0.8620, test_loss: 0.9816, test_f1: 0.5229
 epoch: 13, train_loss: 0.8521, test_loss: 0.9696, test_f1: 0.5544
 epoch: 14, train_loss: 0.8465, test_loss: 0.8149, test_f1: 0.5643
 epoch: 15, train_loss: 0.8277, test_loss: 0.9504, test_f1: 0.5198
 epoch: 16, train_loss: 0.8195, test_loss: 0.8478, test_f1: 0.5854
 epoch: 17, train_loss: 0.8193, test_loss: 0.7816, test_f1: 0.5573
 epoch: 18, train_loss: 0.7811, test_loss: 0.8841, test_f1: 0.5410
 epoch: 19, train_loss: 0.7730, test_loss: 0.8683, test_f1: 0.5225
 epoch: 20, train_loss: 0.8030, test_loss: 0.9409, test_f1: 0.5429
 epoch: 21, train_loss: 0.7895, test_loss: 0.9102, test_f1: 0.5565
 epoch: 22, train_loss: 0.7714, test_loss: 0.8723, test_f1: 0.5392
 epoch: 23, train_loss: 0.7750, test_loss: 0.7412, test_f1: 0.5923
 epoch: 24, train_loss: 0.7641, test_loss: 0.8919, test_f1: 0.4992
 epoch: 25, train_loss: 0.7454, test_loss: 0.8594, test_f1: 0.5899
 epoch: 26, train_loss: 0.7114, test_loss: 0.8323, test_f1: 0.5576
 epoch: 27, train_loss: 0.7124, test_loss: 0.8867, test_f1: 0.5822
 epoch: 28, train_loss: 0.7262, test_loss: 0.8942, test_f1: 0.5327
 epoch: 29, train_loss: 0.7028, test_loss: 0.9464, test_f1: 0.5718
 epoch: 30, train_loss: 0.7107, test_loss: 0.8835, test_f1: 0.6295
 epoch: 31, train_loss: 0.7061, test_loss: 0.8146, test_f1: 0.5598
 epoch: 32, train_loss: 0.6939, test_loss: 0.7750, test_f1: 0.6196
 epoch: 33, train_loss: 0.7023, test_loss: 0.8320, test_f1: 0.5983
 epoch: 34, train_loss: 0.6759, test_loss: 0.8681, test_f1: 0.5844
 epoch: 35, train_loss: 0.6689, test_loss: 0.8602, test_f1: 0.5974
 epoch: 36, train_loss: 0.6756, test_loss: 0.8408, test_f1: 0.6003
 epoch: 37, train_loss: 0.7095, test_loss: 0.9097, test_f1: 0.5504
 epoch: 38, train_loss: 0.6743, test_loss: 0.9571, test_f1: 0.5717
 epoch: 39, train_loss: 0.6494, test_loss: 1.0607, test_f1: 0.5243
 epoch: 40, train_loss: 0.6469, test_loss: 0.8269, test_f1: 0.6297
 epoch: 41, train_loss: 0.6471, test_loss: 0.8239, test_f1: 0.5968
 epoch: 42, train_loss: 0.6480, test_loss: 0.7914, test_f1: 0.5990
 epoch: 43, train_loss: 0.6430, test_loss: 0.7955, test_f1: 0.6112
 epoch: 44, train_loss: 0.6448, test_loss: 0.7846, test_f1: 0.5931
 epoch: 45, train_loss: 0.6323, test_loss: 0.8179, test_f1: 0.6119
 epoch: 46, train_loss: 0.6184, test_loss: 0.8657, test_f1: 0.6071
 epoch: 47, train_loss: 0.6120, test_loss: 0.9627, test_f1: 0.5553
 epoch: 48, train_loss: 0.6144, test_loss: 0.9486, test_f1: 0.5853
 epoch: 49, train_loss: 0.5918, test_loss: 0.9368, test_f1: 0.5983
 epoch: 50, train_loss: 0.6166, test_loss: 0.7267, test_f1: 0.6106
 epoch: 51, train_loss: 0.5632, test_loss: 0.8727, test_f1: 0.6033
 epoch: 52, train_loss: 0.5467, test_loss: 0.8236, test_f1: 0.6302
 epoch: 53, train_loss: 0.5149, test_loss: 0.8842, test_f1: 0.6323
 epoch: 54, train_loss: 0.5183, test_loss: 0.8223, test_f1: 0.6371
 epoch: 55, train_loss: 0.5198, test_loss: 0.8077, test_f1: 0.6262
 epoch: 56, train_loss: 0.4951, test_loss: 0.8335, test_f1: 0.6409
 epoch: 57, train_loss: 0.5048, test_loss: 0.8014, test_f1: 0.6405
 epoch: 58, train_loss: 0.4947, test_loss: 0.8696, test_f1: 0.6192
 epoch: 59, train_loss: 0.4860, test_loss: 0.8936, test_f1: 0.6399
 epoch: 60, train_loss: 0.5016, test_loss: 0.8505, test_f1: 0.6144
 epoch: 61, train_loss: 0.4892, test_loss: 0.8466, test_f1: 0.6243
 epoch: 62, train_loss: 0.4802, test_loss: 0.8262, test_f1: 0.6285
 epoch: 63, train_loss: 0.4700, test_loss: 0.8025, test_f1: 0.6582
 epoch: 64, train_loss: 0.4729, test_loss: 0.8108, test_f1: 0.6221
 epoch: 65, train_loss: 0.4415, test_loss: 0.9045, test_f1: 0.6469
 epoch: 66, train_loss: 0.4690, test_loss: 0.8311, test_f1: 0.6494
 epoch: 67, train_loss: 0.4430, test_loss: 0.8238, test_f1: 0.6538
 epoch: 68, train_loss: 0.4609, test_loss: 0.8480, test_f1: 0.6609
 epoch: 69, train_loss: 0.4628, test_loss: 0.7919, test_f1: 0.6429
 epoch: 70, train_loss: 0.4593, test_loss: 0.8027, test_f1: 0.6352
 epoch: 71, train_loss: 0.4472, test_loss: 0.7828, test_f1: 0.6517
 epoch: 72, train_loss: 0.4533, test_loss: 0.7518, test_f1: 0.6495
 epoch: 73, train_loss: 0.4252, test_loss: 0.8223, test_f1: 0.6721
 epoch: 74, train_loss: 0.4243, test_loss: 0.8061, test_f1: 0.6534
 epoch: 75, train_loss: 0.4377, test_loss: 0.7677, test_f1: 0.6810
 epoch: 76, train_loss: 0.4339, test_loss: 0.7892, test_f1: 0.6549
 epoch: 77, train_loss: 0.4117, test_loss: 0.8396, test_f1: 0.6491
 epoch: 78, train_loss: 0.4351, test_loss: 0.8075, test_f1: 0.6718
 epoch: 79, train_loss: 0.4007, test_loss: 0.8452, test_f1: 0.6580
 epoch: 80, train_loss: 0.4252, test_loss: 0.8506, test_f1: 0.6654
 epoch: 81, train_loss: 0.4027, test_loss: 0.9796, test_f1: 0.6518
 epoch: 82, train_loss: 0.4033, test_loss: 0.8678, test_f1: 0.6715
 epoch: 83, train_loss: 0.3975, test_loss: 0.9248, test_f1: 0.6600
 epoch: 84, train_loss: 0.3761, test_loss: 0.9508, test_f1: 0.6604
 epoch: 85, train_loss: 0.3907, test_loss: 0.9067, test_f1: 0.6660
 epoch: 86, train_loss: 0.3789, test_loss: 0.7570, test_f1: 0.6874
 epoch: 87, train_loss: 0.3823, test_loss: 0.8753, test_f1: 0.6430
 epoch: 88, train_loss: 0.3938, test_loss: 0.8783, test_f1: 0.6529
 epoch: 89, train_loss: 0.3662, test_loss: 0.8988, test_f1: 0.6487
 epoch: 90, train_loss: 0.3750, test_loss: 0.8626, test_f1: 0.6715
 epoch: 91, train_loss: 0.3844, test_loss: 0.8542, test_f1: 0.6733
 epoch: 92, train_loss: 0.3569, test_loss: 0.9320, test_f1: 0.6669
 epoch: 93, train_loss: 0.3596, test_loss: 0.9376, test_f1: 0.6587
 epoch: 94, train_loss: 0.3782, test_loss: 0.8387, test_f1: 0.6559
 epoch: 95, train_loss: 0.3510, test_loss: 0.9483, test_f1: 0.6614
 epoch: 96, train_loss: 0.3514, test_loss: 0.8046, test_f1: 0.6931
 epoch: 97, train_loss: 0.3761, test_loss: 0.8864, test_f1: 0.6935
 epoch: 98, train_loss: 0.3462, test_loss: 0.9703, test_f1: 0.6645
 epoch: 99, train_loss: 0.3552, test_loss: 0.8929, test_f1: 0.6697
##################ITERATION #4 ****************************************
 epoch: 0, train_loss: 1.1970, test_loss: 1.2141, test_f1: 0.3337
 epoch: 1, train_loss: 1.0012, test_loss: 0.9604, test_f1: 0.4739
 epoch: 2, train_loss: 0.9709, test_loss: 1.0312, test_f1: 0.4628
 epoch: 3, train_loss: 0.9455, test_loss: 0.9853, test_f1: 0.4705
 epoch: 4, train_loss: 0.9168, test_loss: 1.0219, test_f1: 0.4860
 epoch: 5, train_loss: 0.9196, test_loss: 0.9553, test_f1: 0.5001
 epoch: 6, train_loss: 0.9032, test_loss: 0.9566, test_f1: 0.5030
 epoch: 7, train_loss: 0.9041, test_loss: 0.9022, test_f1: 0.5192
 epoch: 8, train_loss: 0.8769, test_loss: 0.9164, test_f1: 0.5134
 epoch: 9, train_loss: 0.8759, test_loss: 0.8869, test_f1: 0.5315
 epoch: 10, train_loss: 0.8514, test_loss: 0.9457, test_f1: 0.5481
 epoch: 11, train_loss: 0.8495, test_loss: 0.8150, test_f1: 0.5657
 epoch: 12, train_loss: 0.8288, test_loss: 0.8662, test_f1: 0.5212
 epoch: 13, train_loss: 0.8121, test_loss: 0.9154, test_f1: 0.5128
 epoch: 14, train_loss: 0.7972, test_loss: 1.1400, test_f1: 0.4785
 epoch: 15, train_loss: 0.7985, test_loss: 0.9292, test_f1: 0.5293
 epoch: 16, train_loss: 0.7726, test_loss: 0.8712, test_f1: 0.5970
 epoch: 17, train_loss: 0.7952, test_loss: 1.0717, test_f1: 0.4766
 epoch: 18, train_loss: 0.7618, test_loss: 0.8768, test_f1: 0.6220
 epoch: 19, train_loss: 0.7910, test_loss: 1.1187, test_f1: 0.5170
 epoch: 20, train_loss: 0.7641, test_loss: 0.8555, test_f1: 0.5216
 epoch: 21, train_loss: 0.7602, test_loss: 0.7846, test_f1: 0.5729
 epoch: 22, train_loss: 0.7442, test_loss: 0.8030, test_f1: 0.5601
 epoch: 23, train_loss: 0.7351, test_loss: 0.7661, test_f1: 0.5716
 epoch: 24, train_loss: 0.7364, test_loss: 0.8187, test_f1: 0.5504
 epoch: 25, train_loss: 0.7527, test_loss: 0.8214, test_f1: 0.6091
 epoch: 26, train_loss: 0.7113, test_loss: 0.7803, test_f1: 0.5789
 epoch: 27, train_loss: 0.7203, test_loss: 0.8952, test_f1: 0.5840
 epoch: 28, train_loss: 0.7272, test_loss: 0.9325, test_f1: 0.5292
 epoch: 29, train_loss: 0.7188, test_loss: 0.8951, test_f1: 0.5978
 epoch: 30, train_loss: 0.7025, test_loss: 1.0713, test_f1: 0.5439
 epoch: 31, train_loss: 0.6862, test_loss: 0.7420, test_f1: 0.5706
 epoch: 32, train_loss: 0.6814, test_loss: 1.0312, test_f1: 0.5454
 epoch: 33, train_loss: 0.6711, test_loss: 1.0311, test_f1: 0.5733
 epoch: 34, train_loss: 0.6661, test_loss: 0.9008, test_f1: 0.5834
 epoch: 35, train_loss: 0.6662, test_loss: 1.2184, test_f1: 0.5795
 epoch: 36, train_loss: 0.6697, test_loss: 1.2993, test_f1: 0.5448
 epoch: 37, train_loss: 0.6706, test_loss: 0.8904, test_f1: 0.6134
 epoch: 38, train_loss: 0.6683, test_loss: 0.9185, test_f1: 0.5337
 epoch: 39, train_loss: 0.6574, test_loss: 0.8501, test_f1: 0.6183
 epoch: 40, train_loss: 0.6589, test_loss: 1.1674, test_f1: 0.5381
 epoch: 41, train_loss: 0.6285, test_loss: 0.8723, test_f1: 0.6149
 epoch: 42, train_loss: 0.6508, test_loss: 0.9212, test_f1: 0.6501
 epoch: 43, train_loss: 0.6288, test_loss: 0.7248, test_f1: 0.6592
 epoch: 44, train_loss: 0.6244, test_loss: 0.9630, test_f1: 0.6128
 epoch: 45, train_loss: 0.6226, test_loss: 0.8541, test_f1: 0.6496
 epoch: 46, train_loss: 0.6293, test_loss: 1.0731, test_f1: 0.6436
 epoch: 47, train_loss: 0.6020, test_loss: 1.0081, test_f1: 0.6444
 epoch: 48, train_loss: 0.6204, test_loss: 0.9606, test_f1: 0.6257
 epoch: 49, train_loss: 0.5761, test_loss: 1.0707, test_f1: 0.6400
 epoch: 50, train_loss: 0.6110, test_loss: 1.1736, test_f1: 0.5597
 epoch: 51, train_loss: 0.5558, test_loss: 1.0263, test_f1: 0.6321
 epoch: 52, train_loss: 0.5584, test_loss: 1.1925, test_f1: 0.6501
 epoch: 53, train_loss: 0.5244, test_loss: 1.0662, test_f1: 0.6504
 epoch: 54, train_loss: 0.5152, test_loss: 1.0379, test_f1: 0.6387
 epoch: 55, train_loss: 0.5111, test_loss: 1.2454, test_f1: 0.6600
 epoch: 56, train_loss: 0.4831, test_loss: 1.1164, test_f1: 0.6334
 epoch: 57, train_loss: 0.4901, test_loss: 1.1036, test_f1: 0.6413
 epoch: 58, train_loss: 0.4886, test_loss: 0.9750, test_f1: 0.6613
 epoch: 59, train_loss: 0.4856, test_loss: 1.0910, test_f1: 0.6334
 epoch: 60, train_loss: 0.4820, test_loss: 1.1974, test_f1: 0.6286
 epoch: 61, train_loss: 0.4963, test_loss: 1.2260, test_f1: 0.6197
 epoch: 62, train_loss: 0.4686, test_loss: 1.1464, test_f1: 0.6428
 epoch: 63, train_loss: 0.4678, test_loss: 1.3333, test_f1: 0.6237
 epoch: 64, train_loss: 0.4728, test_loss: 1.1112, test_f1: 0.6569
 epoch: 65, train_loss: 0.4558, test_loss: 1.2173, test_f1: 0.6515
 epoch: 66, train_loss: 0.4509, test_loss: 1.2466, test_f1: 0.6606
 epoch: 67, train_loss: 0.4637, test_loss: 1.3139, test_f1: 0.6214
 epoch: 68, train_loss: 0.4636, test_loss: 1.1470, test_f1: 0.6377
 epoch: 69, train_loss: 0.4504, test_loss: 1.2421, test_f1: 0.6287
 epoch: 70, train_loss: 0.4372, test_loss: 1.2846, test_f1: 0.6227
 epoch: 71, train_loss: 0.4380, test_loss: 1.2506, test_f1: 0.6614
 epoch: 72, train_loss: 0.4403, test_loss: 1.2753, test_f1: 0.6179
 epoch: 73, train_loss: 0.4369, test_loss: 1.3100, test_f1: 0.6500
 epoch: 74, train_loss: 0.4291, test_loss: 1.2054, test_f1: 0.6310
 epoch: 75, train_loss: 0.4266, test_loss: 1.4755, test_f1: 0.6430
 epoch: 76, train_loss: 0.4324, test_loss: 1.2012, test_f1: 0.6498
 epoch: 77, train_loss: 0.4264, test_loss: 1.2374, test_f1: 0.6370
 epoch: 78, train_loss: 0.4100, test_loss: 1.2521, test_f1: 0.6537
 epoch: 79, train_loss: 0.4058, test_loss: 1.4144, test_f1: 0.6314
 epoch: 80, train_loss: 0.3925, test_loss: 1.1642, test_f1: 0.6464
 epoch: 81, train_loss: 0.3977, test_loss: 1.4081, test_f1: 0.6474
 epoch: 82, train_loss: 0.3913, test_loss: 1.2317, test_f1: 0.6498
 epoch: 83, train_loss: 0.3858, test_loss: 1.4326, test_f1: 0.6347
 epoch: 84, train_loss: 0.4004, test_loss: 1.2174, test_f1: 0.6228
 epoch: 85, train_loss: 0.3912, test_loss: 1.3560, test_f1: 0.6606
 epoch: 86, train_loss: 0.3873, test_loss: 1.4585, test_f1: 0.6505
 epoch: 87, train_loss: 0.3726, test_loss: 1.3537, test_f1: 0.6360
 epoch: 88, train_loss: 0.3999, test_loss: 1.3330, test_f1: 0.6430
 epoch: 89, train_loss: 0.3687, test_loss: 1.4217, test_f1: 0.6407
 epoch: 90, train_loss: 0.3951, test_loss: 1.6919, test_f1: 0.6279
 epoch: 91, train_loss: 0.3920, test_loss: 1.1942, test_f1: 0.6453
 epoch: 92, train_loss: 0.3705, test_loss: 1.4107, test_f1: 0.6454
 epoch: 93, train_loss: 0.3698, test_loss: 1.4249, test_f1: 0.6389
 epoch: 94, train_loss: 0.3763, test_loss: 1.4062, test_f1: 0.6502
 epoch: 95, train_loss: 0.3719, test_loss: 1.4223, test_f1: 0.6335
 epoch: 96, train_loss: 0.3419, test_loss: 1.3514, test_f1: 0.6545
 epoch: 97, train_loss: 0.3600, test_loss: 1.3147, test_f1: 0.6448
 epoch: 98, train_loss: 0.3637, test_loss: 1.3029, test_f1: 0.6495
 epoch: 99, train_loss: 0.3389, test_loss: 1.4110, test_f1: 0.6553
##################ITERATION #5 ****************************************
 epoch: 0, train_loss: 1.2256, test_loss: 1.3046, test_f1: 0.3247
 epoch: 1, train_loss: 1.0192, test_loss: 1.0578, test_f1: 0.4663
 epoch: 2, train_loss: 0.9743, test_loss: 1.0759, test_f1: 0.4842
 epoch: 3, train_loss: 0.9475, test_loss: 1.0651, test_f1: 0.4936
 epoch: 4, train_loss: 0.9325, test_loss: 0.9791, test_f1: 0.4971
 epoch: 5, train_loss: 0.8964, test_loss: 0.9419, test_f1: 0.5183
 epoch: 6, train_loss: 0.8782, test_loss: 0.9690, test_f1: 0.5425
 epoch: 7, train_loss: 0.8688, test_loss: 0.9385, test_f1: 0.5279
 epoch: 8, train_loss: 0.8584, test_loss: 1.0870, test_f1: 0.4888
 epoch: 9, train_loss: 0.8474, test_loss: 0.8745, test_f1: 0.5436
 epoch: 10, train_loss: 0.8121, test_loss: 0.9945, test_f1: 0.5505
 epoch: 11, train_loss: 0.8330, test_loss: 0.8568, test_f1: 0.5976
 epoch: 12, train_loss: 0.8320, test_loss: 0.9610, test_f1: 0.5763
 epoch: 13, train_loss: 0.8021, test_loss: 0.8517, test_f1: 0.5161
 epoch: 14, train_loss: 0.7897, test_loss: 0.9210, test_f1: 0.5657
 epoch: 15, train_loss: 0.7810, test_loss: 0.9111, test_f1: 0.5350
 epoch: 16, train_loss: 0.7835, test_loss: 0.8837, test_f1: 0.5492
 epoch: 17, train_loss: 0.7576, test_loss: 0.7725, test_f1: 0.5537
 epoch: 18, train_loss: 0.7552, test_loss: 0.8509, test_f1: 0.5745
 epoch: 19, train_loss: 0.7537, test_loss: 0.8793, test_f1: 0.5453
 epoch: 20, train_loss: 0.7361, test_loss: 0.8966, test_f1: 0.5756
 epoch: 21, train_loss: 0.7231, test_loss: 0.9489, test_f1: 0.5154
 epoch: 22, train_loss: 0.7108, test_loss: 0.9997, test_f1: 0.5953
 epoch: 23, train_loss: 0.7423, test_loss: 0.8030, test_f1: 0.6045
 epoch: 24, train_loss: 0.7191, test_loss: 0.9662, test_f1: 0.5755
 epoch: 25, train_loss: 0.7204, test_loss: 0.8638, test_f1: 0.6281
 epoch: 26, train_loss: 0.7004, test_loss: 1.0672, test_f1: 0.5663
 epoch: 27, train_loss: 0.6672, test_loss: 0.8543, test_f1: 0.6332
 epoch: 28, train_loss: 0.6696, test_loss: 1.0208, test_f1: 0.5983
 epoch: 29, train_loss: 0.6633, test_loss: 0.9524, test_f1: 0.5961
 epoch: 30, train_loss: 0.6812, test_loss: 1.0777, test_f1: 0.5449
 epoch: 31, train_loss: 0.6762, test_loss: 0.9694, test_f1: 0.6170
 epoch: 32, train_loss: 0.6548, test_loss: 0.8886, test_f1: 0.6405
 epoch: 33, train_loss: 0.6337, test_loss: 0.8882, test_f1: 0.5841
 epoch: 34, train_loss: 0.6269, test_loss: 0.8234, test_f1: 0.5845
 epoch: 35, train_loss: 0.5975, test_loss: 1.0417, test_f1: 0.6124
 epoch: 36, train_loss: 0.6398, test_loss: 0.9422, test_f1: 0.6069
 epoch: 37, train_loss: 0.6065, test_loss: 1.0609, test_f1: 0.5986
 epoch: 38, train_loss: 0.6345, test_loss: 0.9992, test_f1: 0.6015
 epoch: 39, train_loss: 0.5960, test_loss: 0.9048, test_f1: 0.6282
 epoch: 40, train_loss: 0.6207, test_loss: 0.9992, test_f1: 0.6439
 epoch: 41, train_loss: 0.6101, test_loss: 1.0016, test_f1: 0.6266
 epoch: 42, train_loss: 0.5782, test_loss: 1.0389, test_f1: 0.6382
 epoch: 43, train_loss: 0.5898, test_loss: 0.9293, test_f1: 0.6607
 epoch: 44, train_loss: 0.5934, test_loss: 1.0686, test_f1: 0.5873
 epoch: 45, train_loss: 0.5811, test_loss: 1.0741, test_f1: 0.6055
 epoch: 46, train_loss: 0.5814, test_loss: 0.9405, test_f1: 0.5994
 epoch: 47, train_loss: 0.5860, test_loss: 0.8333, test_f1: 0.6423
 epoch: 48, train_loss: 0.5822, test_loss: 0.8674, test_f1: 0.6536
 epoch: 49, train_loss: 0.5572, test_loss: 0.9897, test_f1: 0.5837
 epoch: 50, train_loss: 0.5592, test_loss: 0.9070, test_f1: 0.6279
 epoch: 51, train_loss: 0.5018, test_loss: 0.8545, test_f1: 0.6496
 epoch: 52, train_loss: 0.4783, test_loss: 0.8999, test_f1: 0.6795
 epoch: 53, train_loss: 0.4668, test_loss: 0.9575, test_f1: 0.6803
 epoch: 54, train_loss: 0.4670, test_loss: 0.9297, test_f1: 0.6555
 epoch: 55, train_loss: 0.4517, test_loss: 0.8707, test_f1: 0.6696
 epoch: 56, train_loss: 0.4530, test_loss: 0.9445, test_f1: 0.6571
 epoch: 57, train_loss: 0.4650, test_loss: 1.0892, test_f1: 0.6471
 epoch: 58, train_loss: 0.4466, test_loss: 1.0407, test_f1: 0.6412
 epoch: 59, train_loss: 0.4347, test_loss: 0.8474, test_f1: 0.6698
 epoch: 60, train_loss: 0.4295, test_loss: 1.0001, test_f1: 0.6620
 epoch: 61, train_loss: 0.4309, test_loss: 0.9620, test_f1: 0.6592
 epoch: 62, train_loss: 0.4401, test_loss: 1.0018, test_f1: 0.6413
 epoch: 63, train_loss: 0.4156, test_loss: 1.0144, test_f1: 0.6679
 epoch: 64, train_loss: 0.4082, test_loss: 1.1195, test_f1: 0.6472
 epoch: 65, train_loss: 0.4307, test_loss: 0.9827, test_f1: 0.6574
 epoch: 66, train_loss: 0.4227, test_loss: 1.1092, test_f1: 0.6402
 epoch: 67, train_loss: 0.4030, test_loss: 1.0138, test_f1: 0.6428
 epoch: 68, train_loss: 0.4113, test_loss: 1.1007, test_f1: 0.6313
 epoch: 69, train_loss: 0.3846, test_loss: 1.1492, test_f1: 0.6445
 epoch: 70, train_loss: 0.3963, test_loss: 0.9546, test_f1: 0.6685
 epoch: 71, train_loss: 0.4137, test_loss: 0.9262, test_f1: 0.6602
 epoch: 72, train_loss: 0.3962, test_loss: 0.9907, test_f1: 0.6395
 epoch: 73, train_loss: 0.3883, test_loss: 1.1799, test_f1: 0.6715
 epoch: 74, train_loss: 0.3892, test_loss: 1.1368, test_f1: 0.6582
 epoch: 75, train_loss: 0.3828, test_loss: 1.1933, test_f1: 0.6691
 epoch: 76, train_loss: 0.3851, test_loss: 1.0230, test_f1: 0.6567
 epoch: 77, train_loss: 0.3633, test_loss: 1.1538, test_f1: 0.6497
 epoch: 78, train_loss: 0.3769, test_loss: 1.0600, test_f1: 0.6539
 epoch: 79, train_loss: 0.3844, test_loss: 1.0746, test_f1: 0.6703
 epoch: 80, train_loss: 0.3829, test_loss: 1.1001, test_f1: 0.6600
 epoch: 81, train_loss: 0.3655, test_loss: 1.1769, test_f1: 0.6644
 epoch: 82, train_loss: 0.3734, test_loss: 1.0558, test_f1: 0.6723
 epoch: 83, train_loss: 0.3714, test_loss: 1.0702, test_f1: 0.6291
 epoch: 84, train_loss: 0.3393, test_loss: 1.1387, test_f1: 0.6579
 epoch: 85, train_loss: 0.3439, test_loss: 1.0745, test_f1: 0.6628
 epoch: 86, train_loss: 0.3731, test_loss: 1.0782, test_f1: 0.6791
 epoch: 87, train_loss: 0.3395, test_loss: 1.1087, test_f1: 0.6674
 epoch: 88, train_loss: 0.3580, test_loss: 1.2602, test_f1: 0.6684
 epoch: 89, train_loss: 0.3522, test_loss: 1.1514, test_f1: 0.6685
 epoch: 90, train_loss: 0.3306, test_loss: 1.2350, test_f1: 0.6610
 epoch: 91, train_loss: 0.3436, test_loss: 0.9594, test_f1: 0.6620
 epoch: 92, train_loss: 0.3279, test_loss: 1.0338, test_f1: 0.6759
 epoch: 93, train_loss: 0.3167, test_loss: 1.2235, test_f1: 0.6485
 epoch: 94, train_loss: 0.3428, test_loss: 1.3652, test_f1: 0.6240
 epoch: 95, train_loss: 0.3523, test_loss: 1.1626, test_f1: 0.6494
 epoch: 96, train_loss: 0.3284, test_loss: 1.0912, test_f1: 0.6898
 epoch: 97, train_loss: 0.3353, test_loss: 1.1920, test_f1: 0.6556
 epoch: 98, train_loss: 0.3225, test_loss: 1.1686, test_f1: 0.6503
 epoch: 99, train_loss: 0.3099, test_loss: 1.2535, test_f1: 0.6799
##################ITERATION #6 ****************************************
 epoch: 0, train_loss: 1.2370, test_loss: 1.2186, test_f1: 0.4169
 epoch: 1, train_loss: 0.9995, test_loss: 1.0483, test_f1: 0.4719
 epoch: 2, train_loss: 0.9694, test_loss: 1.0563, test_f1: 0.4971
 epoch: 3, train_loss: 0.9252, test_loss: 1.0412, test_f1: 0.5247
 epoch: 4, train_loss: 0.9077, test_loss: 1.0285, test_f1: 0.4666
 epoch: 5, train_loss: 0.8974, test_loss: 1.2888, test_f1: 0.4350
 epoch: 6, train_loss: 0.8750, test_loss: 1.0511, test_f1: 0.4947
 epoch: 7, train_loss: 0.8599, test_loss: 0.9531, test_f1: 0.5274
 epoch: 8, train_loss: 0.8502, test_loss: 1.1505, test_f1: 0.4572
 epoch: 9, train_loss: 0.8155, test_loss: 0.9958, test_f1: 0.5059
 epoch: 10, train_loss: 0.8226, test_loss: 0.8875, test_f1: 0.5239
 epoch: 11, train_loss: 0.8053, test_loss: 0.9361, test_f1: 0.5175
 epoch: 12, train_loss: 0.8074, test_loss: 0.9943, test_f1: 0.5353
 epoch: 13, train_loss: 0.7957, test_loss: 1.0680, test_f1: 0.5397
 epoch: 14, train_loss: 0.7729, test_loss: 0.9562, test_f1: 0.5253
 epoch: 15, train_loss: 0.7645, test_loss: 0.8106, test_f1: 0.6085
 epoch: 16, train_loss: 0.7591, test_loss: 0.8445, test_f1: 0.6262
 epoch: 17, train_loss: 0.7584, test_loss: 0.8943, test_f1: 0.6075
 epoch: 18, train_loss: 0.7467, test_loss: 0.8908, test_f1: 0.5778
 epoch: 19, train_loss: 0.7300, test_loss: 1.1154, test_f1: 0.4977
 epoch: 20, train_loss: 0.7194, test_loss: 0.9461, test_f1: 0.5888
 epoch: 21, train_loss: 0.7015, test_loss: 0.9907, test_f1: 0.6357
 epoch: 22, train_loss: 0.7221, test_loss: 0.9063, test_f1: 0.6273
 epoch: 23, train_loss: 0.7111, test_loss: 0.9806, test_f1: 0.6224
 epoch: 24, train_loss: 0.6963, test_loss: 0.9629, test_f1: 0.5875
 epoch: 25, train_loss: 0.6835, test_loss: 0.8676, test_f1: 0.6288
 epoch: 26, train_loss: 0.6632, test_loss: 1.0560, test_f1: 0.6382
 epoch: 27, train_loss: 0.6689, test_loss: 0.9568, test_f1: 0.6493
 epoch: 28, train_loss: 0.6386, test_loss: 1.0508, test_f1: 0.6584
 epoch: 29, train_loss: 0.6650, test_loss: 0.8866, test_f1: 0.6427
 epoch: 30, train_loss: 0.6560, test_loss: 1.2677, test_f1: 0.5755
 epoch: 31, train_loss: 0.6461, test_loss: 1.1174, test_f1: 0.6024
 epoch: 32, train_loss: 0.7012, test_loss: 1.1161, test_f1: 0.6091
 epoch: 33, train_loss: 0.6697, test_loss: 0.8737, test_f1: 0.6349
 epoch: 34, train_loss: 0.6209, test_loss: 1.6090, test_f1: 0.5677
 epoch: 35, train_loss: 0.6247, test_loss: 1.0296, test_f1: 0.6067
 epoch: 36, train_loss: 0.6300, test_loss: 1.5944, test_f1: 0.5372
 epoch: 37, train_loss: 0.6305, test_loss: 0.9362, test_f1: 0.6487
 epoch: 38, train_loss: 0.6068, test_loss: 1.2753, test_f1: 0.6275
 epoch: 39, train_loss: 0.6042, test_loss: 1.3164, test_f1: 0.5835
 epoch: 40, train_loss: 0.6247, test_loss: 1.1366, test_f1: 0.6601
 epoch: 41, train_loss: 0.6254, test_loss: 1.1807, test_f1: 0.5464
 epoch: 42, train_loss: 0.5818, test_loss: 0.9920, test_f1: 0.6450
 epoch: 43, train_loss: 0.5769, test_loss: 1.0380, test_f1: 0.6467
 epoch: 44, train_loss: 0.5783, test_loss: 1.1006, test_f1: 0.6634
 epoch: 45, train_loss: 0.5655, test_loss: 1.2168, test_f1: 0.5694
 epoch: 46, train_loss: 0.5700, test_loss: 0.9909, test_f1: 0.6570
 epoch: 47, train_loss: 0.5442, test_loss: 1.1565, test_f1: 0.5869
 epoch: 48, train_loss: 0.5515, test_loss: 0.9752, test_f1: 0.6011
 epoch: 49, train_loss: 0.5341, test_loss: 1.0025, test_f1: 0.6697
 epoch: 50, train_loss: 0.5611, test_loss: 1.0800, test_f1: 0.6443
 epoch: 51, train_loss: 0.4951, test_loss: 0.9792, test_f1: 0.6860
 epoch: 52, train_loss: 0.4627, test_loss: 1.0136, test_f1: 0.7120
 epoch: 53, train_loss: 0.4572, test_loss: 1.2309, test_f1: 0.6797
 epoch: 54, train_loss: 0.4366, test_loss: 1.5198, test_f1: 0.6653
 epoch: 55, train_loss: 0.4463, test_loss: 1.1086, test_f1: 0.6777
 epoch: 56, train_loss: 0.4302, test_loss: 1.2045, test_f1: 0.6878
 epoch: 57, train_loss: 0.4307, test_loss: 1.0466, test_f1: 0.6758
 epoch: 58, train_loss: 0.3956, test_loss: 1.1572, test_f1: 0.6910
 epoch: 59, train_loss: 0.4152, test_loss: 1.3942, test_f1: 0.6534
 epoch: 60, train_loss: 0.4116, test_loss: 1.2057, test_f1: 0.6789
 epoch: 61, train_loss: 0.3972, test_loss: 1.2882, test_f1: 0.7126
 epoch: 62, train_loss: 0.4027, test_loss: 1.2409, test_f1: 0.6855
 epoch: 63, train_loss: 0.3893, test_loss: 1.2965, test_f1: 0.6728
 epoch: 64, train_loss: 0.3927, test_loss: 1.3766, test_f1: 0.6713
 epoch: 65, train_loss: 0.3773, test_loss: 1.3358, test_f1: 0.6627
 epoch: 66, train_loss: 0.3859, test_loss: 1.4079, test_f1: 0.6639
 epoch: 67, train_loss: 0.3813, test_loss: 1.3981, test_f1: 0.7135
 epoch: 68, train_loss: 0.3743, test_loss: 1.3484, test_f1: 0.6961
 epoch: 69, train_loss: 0.3696, test_loss: 1.2085, test_f1: 0.6808
 epoch: 70, train_loss: 0.3703, test_loss: 1.4407, test_f1: 0.6986
 epoch: 71, train_loss: 0.3654, test_loss: 1.3222, test_f1: 0.6584
 epoch: 72, train_loss: 0.3666, test_loss: 1.1890, test_f1: 0.6919
 epoch: 73, train_loss: 0.3548, test_loss: 1.3292, test_f1: 0.7036
 epoch: 74, train_loss: 0.3670, test_loss: 1.2445, test_f1: 0.6823
 epoch: 75, train_loss: 0.3449, test_loss: 1.3429, test_f1: 0.6889
 epoch: 76, train_loss: 0.3422, test_loss: 1.4702, test_f1: 0.6374
 epoch: 77, train_loss: 0.3386, test_loss: 1.5160, test_f1: 0.6844
 epoch: 78, train_loss: 0.3261, test_loss: 1.5395, test_f1: 0.6852
 epoch: 79, train_loss: 0.3514, test_loss: 1.7401, test_f1: 0.6469
 epoch: 80, train_loss: 0.3349, test_loss: 1.5319, test_f1: 0.6735
 epoch: 81, train_loss: 0.3402, test_loss: 1.4130, test_f1: 0.6944
 epoch: 82, train_loss: 0.3434, test_loss: 1.4989, test_f1: 0.6622
 epoch: 83, train_loss: 0.3239, test_loss: 1.5954, test_f1: 0.6697
 epoch: 84, train_loss: 0.2972, test_loss: 1.5141, test_f1: 0.6818
 epoch: 85, train_loss: 0.3304, test_loss: 1.4052, test_f1: 0.6529
 epoch: 86, train_loss: 0.3191, test_loss: 1.5704, test_f1: 0.6716
 epoch: 87, train_loss: 0.3235, test_loss: 1.6890, test_f1: 0.6750
 epoch: 88, train_loss: 0.3151, test_loss: 1.5339, test_f1: 0.6770
 epoch: 89, train_loss: 0.3054, test_loss: 1.6580, test_f1: 0.6647
 epoch: 90, train_loss: 0.2997, test_loss: 1.6334, test_f1: 0.6599
 epoch: 91, train_loss: 0.3002, test_loss: 1.6725, test_f1: 0.6815
 epoch: 92, train_loss: 0.2922, test_loss: 1.6795, test_f1: 0.6560
 epoch: 93, train_loss: 0.2758, test_loss: 1.4538, test_f1: 0.6650
 epoch: 94, train_loss: 0.2826, test_loss: 1.2493, test_f1: 0.6874
 epoch: 95, train_loss: 0.2900, test_loss: 1.7481, test_f1: 0.6595
 epoch: 96, train_loss: 0.3310, test_loss: 1.6462, test_f1: 0.6593
 epoch: 97, train_loss: 0.3055, test_loss: 1.7686, test_f1: 0.6522
 epoch: 98, train_loss: 0.2903, test_loss: 1.5881, test_f1: 0.6556
 epoch: 99, train_loss: 0.2787, test_loss: 1.6909, test_f1: 0.6675
##################ITERATION #7 ****************************************
 epoch: 0, train_loss: 1.2727, test_loss: 1.1432, test_f1: 0.4380
 epoch: 1, train_loss: 1.0258, test_loss: 1.3717, test_f1: 0.3604
 epoch: 2, train_loss: 0.9847, test_loss: 1.1236, test_f1: 0.4533
 epoch: 3, train_loss: 0.9471, test_loss: 1.0627, test_f1: 0.4790
 epoch: 4, train_loss: 0.9194, test_loss: 0.9409, test_f1: 0.5138
 epoch: 5, train_loss: 0.9047, test_loss: 0.9470, test_f1: 0.5104
 epoch: 6, train_loss: 0.8983, test_loss: 1.1586, test_f1: 0.3989
 epoch: 7, train_loss: 0.8766, test_loss: 0.9381, test_f1: 0.5189
 epoch: 8, train_loss: 0.8784, test_loss: 1.1598, test_f1: 0.5098
 epoch: 9, train_loss: 0.8838, test_loss: 0.9715, test_f1: 0.5490
 epoch: 10, train_loss: 0.8395, test_loss: 0.9799, test_f1: 0.5362
 epoch: 11, train_loss: 0.8290, test_loss: 0.9639, test_f1: 0.5241
 epoch: 12, train_loss: 0.8382, test_loss: 0.9498, test_f1: 0.5335
 epoch: 13, train_loss: 0.8256, test_loss: 1.2322, test_f1: 0.4213
 epoch: 14, train_loss: 0.8000, test_loss: 0.8543, test_f1: 0.5792
 epoch: 15, train_loss: 0.7725, test_loss: 0.9602, test_f1: 0.5368
 epoch: 16, train_loss: 0.7923, test_loss: 0.8455, test_f1: 0.5490
 epoch: 17, train_loss: 0.7689, test_loss: 0.8573, test_f1: 0.5338
 epoch: 18, train_loss: 0.7754, test_loss: 0.7419, test_f1: 0.6196
 epoch: 19, train_loss: 0.7681, test_loss: 0.8506, test_f1: 0.5332
 epoch: 20, train_loss: 0.7409, test_loss: 0.9374, test_f1: 0.5315
 epoch: 21, train_loss: 0.7881, test_loss: 0.8910, test_f1: 0.5255
 epoch: 22, train_loss: 0.7494, test_loss: 0.9436, test_f1: 0.5436
 epoch: 23, train_loss: 0.7134, test_loss: 0.8578, test_f1: 0.5743
 epoch: 24, train_loss: 0.7052, test_loss: 0.8051, test_f1: 0.6267
 epoch: 25, train_loss: 0.7191, test_loss: 1.0484, test_f1: 0.5398
 epoch: 26, train_loss: 0.7113, test_loss: 1.0888, test_f1: 0.5300
 epoch: 27, train_loss: 0.6976, test_loss: 0.9035, test_f1: 0.6195
 epoch: 28, train_loss: 0.7121, test_loss: 1.1130, test_f1: 0.5359
 epoch: 29, train_loss: 0.6967, test_loss: 0.8149, test_f1: 0.6052
 epoch: 30, train_loss: 0.6842, test_loss: 0.7687, test_f1: 0.6313
 epoch: 31, train_loss: 0.6759, test_loss: 0.9269, test_f1: 0.5706
 epoch: 32, train_loss: 0.6796, test_loss: 0.9032, test_f1: 0.5852
 epoch: 33, train_loss: 0.6553, test_loss: 0.8562, test_f1: 0.6222
 epoch: 34, train_loss: 0.6693, test_loss: 0.8133, test_f1: 0.5811
 epoch: 35, train_loss: 0.6558, test_loss: 0.8219, test_f1: 0.5670
 epoch: 36, train_loss: 0.6401, test_loss: 0.9005, test_f1: 0.5863
 epoch: 37, train_loss: 0.6485, test_loss: 0.9479, test_f1: 0.5497
 epoch: 38, train_loss: 0.6662, test_loss: 0.8266, test_f1: 0.6446
 epoch: 39, train_loss: 0.6083, test_loss: 0.7407, test_f1: 0.6500
 epoch: 40, train_loss: 0.6166, test_loss: 0.9918, test_f1: 0.5679
 epoch: 41, train_loss: 0.6229, test_loss: 0.9221, test_f1: 0.6107
 epoch: 42, train_loss: 0.6036, test_loss: 0.8542, test_f1: 0.5997
 epoch: 43, train_loss: 0.5859, test_loss: 1.1220, test_f1: 0.5706
 epoch: 44, train_loss: 0.6138, test_loss: 0.9443, test_f1: 0.6506
 epoch: 45, train_loss: 0.5983, test_loss: 2.6104, test_f1: 0.3932
 epoch: 46, train_loss: 0.6118, test_loss: 1.1409, test_f1: 0.5638
 epoch: 47, train_loss: 0.5639, test_loss: 0.9034, test_f1: 0.6583
 epoch: 48, train_loss: 0.5786, test_loss: 0.9949, test_f1: 0.6337
 epoch: 49, train_loss: 0.5787, test_loss: 1.0400, test_f1: 0.6112
 epoch: 50, train_loss: 0.5680, test_loss: 0.8264, test_f1: 0.6196
 epoch: 51, train_loss: 0.5362, test_loss: 1.0914, test_f1: 0.6612
 epoch: 52, train_loss: 0.4809, test_loss: 0.9730, test_f1: 0.6563
 epoch: 53, train_loss: 0.4946, test_loss: 0.9692, test_f1: 0.6396
 epoch: 54, train_loss: 0.4717, test_loss: 1.0742, test_f1: 0.6447
 epoch: 55, train_loss: 0.4721, test_loss: 1.2145, test_f1: 0.6150
 epoch: 56, train_loss: 0.4836, test_loss: 1.1604, test_f1: 0.6628
 epoch: 57, train_loss: 0.4549, test_loss: 0.9995, test_f1: 0.6572
 epoch: 58, train_loss: 0.4520, test_loss: 1.1437, test_f1: 0.6875
 epoch: 59, train_loss: 0.4541, test_loss: 1.0794, test_f1: 0.6569
 epoch: 60, train_loss: 0.4642, test_loss: 1.0434, test_f1: 0.6682
 epoch: 61, train_loss: 0.4393, test_loss: 1.2771, test_f1: 0.7007
 epoch: 62, train_loss: 0.4396, test_loss: 1.0777, test_f1: 0.6466
 epoch: 63, train_loss: 0.4420, test_loss: 0.9451, test_f1: 0.6691
 epoch: 64, train_loss: 0.4162, test_loss: 0.9404, test_f1: 0.6690
 epoch: 65, train_loss: 0.4385, test_loss: 1.0420, test_f1: 0.6590
 epoch: 66, train_loss: 0.4075, test_loss: 1.1307, test_f1: 0.6542
 epoch: 67, train_loss: 0.4278, test_loss: 1.2276, test_f1: 0.6685
 epoch: 68, train_loss: 0.4264, test_loss: 1.0571, test_f1: 0.6668
 epoch: 69, train_loss: 0.3927, test_loss: 1.2368, test_f1: 0.6542
 epoch: 70, train_loss: 0.3949, test_loss: 1.1535, test_f1: 0.6719
 epoch: 71, train_loss: 0.3993, test_loss: 1.0100, test_f1: 0.6897
 epoch: 72, train_loss: 0.3778, test_loss: 1.0648, test_f1: 0.6881
 epoch: 73, train_loss: 0.3894, test_loss: 0.9771, test_f1: 0.6626
 epoch: 74, train_loss: 0.3856, test_loss: 0.9848, test_f1: 0.6795
 epoch: 75, train_loss: 0.3902, test_loss: 1.0249, test_f1: 0.6765
 epoch: 76, train_loss: 0.3996, test_loss: 1.0930, test_f1: 0.6991
 epoch: 77, train_loss: 0.3795, test_loss: 1.2023, test_f1: 0.6646
 epoch: 78, train_loss: 0.3795, test_loss: 1.1837, test_f1: 0.6784
 epoch: 79, train_loss: 0.3901, test_loss: 1.1641, test_f1: 0.6540
 epoch: 80, train_loss: 0.3508, test_loss: 1.1989, test_f1: 0.6578
 epoch: 81, train_loss: 0.3519, test_loss: 1.1782, test_f1: 0.6615
 epoch: 82, train_loss: 0.3558, test_loss: 1.0601, test_f1: 0.6658
 epoch: 83, train_loss: 0.3691, test_loss: 1.1769, test_f1: 0.6305
 epoch: 84, train_loss: 0.3548, test_loss: 1.0869, test_f1: 0.6683
 epoch: 85, train_loss: 0.3430, test_loss: 1.1255, test_f1: 0.6522
 epoch: 86, train_loss: 0.3678, test_loss: 1.1271, test_f1: 0.6678
 epoch: 87, train_loss: 0.3397, test_loss: 1.0365, test_f1: 0.6781
 epoch: 88, train_loss: 0.3321, test_loss: 1.2846, test_f1: 0.6564
 epoch: 89, train_loss: 0.3309, test_loss: 1.3408, test_f1: 0.6634
 epoch: 90, train_loss: 0.3261, test_loss: 1.2386, test_f1: 0.6780
 epoch: 91, train_loss: 0.3317, test_loss: 1.3818, test_f1: 0.6776
 epoch: 92, train_loss: 0.3382, test_loss: 1.1511, test_f1: 0.6807
 epoch: 93, train_loss: 0.3496, test_loss: 1.1394, test_f1: 0.6789
 epoch: 94, train_loss: 0.3308, test_loss: 1.2015, test_f1: 0.6746
 epoch: 95, train_loss: 0.3603, test_loss: 1.1600, test_f1: 0.6740
 epoch: 96, train_loss: 0.3238, test_loss: 1.1241, test_f1: 0.6633
 epoch: 97, train_loss: 0.3207, test_loss: 1.3874, test_f1: 0.6342
 epoch: 98, train_loss: 0.3132, test_loss: 1.3442, test_f1: 0.6487
 epoch: 99, train_loss: 0.3120, test_loss: 1.0040, test_f1: 0.6876
##################ITERATION #8 ****************************************
 epoch: 0, train_loss: 1.2276, test_loss: 1.0845, test_f1: 0.4533
 epoch: 1, train_loss: 1.0353, test_loss: 0.9760, test_f1: 0.4705
 epoch: 2, train_loss: 0.9616, test_loss: 1.1580, test_f1: 0.4882
 epoch: 3, train_loss: 0.9520, test_loss: 1.2086, test_f1: 0.4889
 epoch: 4, train_loss: 0.9253, test_loss: 1.1059, test_f1: 0.4422
 epoch: 5, train_loss: 0.9131, test_loss: 1.2418, test_f1: 0.4500
 epoch: 6, train_loss: 0.9063, test_loss: 1.0605, test_f1: 0.5115
 epoch: 7, train_loss: 0.8714, test_loss: 0.9144, test_f1: 0.5311
 epoch: 8, train_loss: 0.8717, test_loss: 0.8415, test_f1: 0.5176
 epoch: 9, train_loss: 0.8659, test_loss: 1.1376, test_f1: 0.4474
 epoch: 10, train_loss: 0.8620, test_loss: 0.9828, test_f1: 0.5218
 epoch: 11, train_loss: 0.8295, test_loss: 0.8340, test_f1: 0.5153
 epoch: 12, train_loss: 0.8416, test_loss: 1.0551, test_f1: 0.4339
 epoch: 13, train_loss: 0.8298, test_loss: 1.0816, test_f1: 0.4582
 epoch: 14, train_loss: 0.8211, test_loss: 0.8766, test_f1: 0.5188
 epoch: 15, train_loss: 0.7999, test_loss: 0.8659, test_f1: 0.5415
 epoch: 16, train_loss: 0.7860, test_loss: 0.8321, test_f1: 0.5620
 epoch: 17, train_loss: 0.8032, test_loss: 0.8301, test_f1: 0.5318
 epoch: 18, train_loss: 0.7684, test_loss: 0.8592, test_f1: 0.5455
 epoch: 19, train_loss: 0.7818, test_loss: 0.8836, test_f1: 0.5432
 epoch: 20, train_loss: 0.7590, test_loss: 0.9939, test_f1: 0.5109
 epoch: 21, train_loss: 0.7306, test_loss: 1.0923, test_f1: 0.5115
 epoch: 22, train_loss: 0.7329, test_loss: 0.8842, test_f1: 0.5293
 epoch: 23, train_loss: 0.7000, test_loss: 0.9409, test_f1: 0.5856
 epoch: 24, train_loss: 0.7337, test_loss: 0.9100, test_f1: 0.5495
 epoch: 25, train_loss: 0.7172, test_loss: 0.9024, test_f1: 0.5616
 epoch: 26, train_loss: 0.7191, test_loss: 1.1261, test_f1: 0.5735
 epoch: 27, train_loss: 0.7127, test_loss: 1.3784, test_f1: 0.5178
 epoch: 28, train_loss: 0.7024, test_loss: 1.0129, test_f1: 0.5644
 epoch: 29, train_loss: 0.7147, test_loss: 0.8658, test_f1: 0.5834
 epoch: 30, train_loss: 0.6740, test_loss: 1.0308, test_f1: 0.5790
 epoch: 31, train_loss: 0.6832, test_loss: 0.8732, test_f1: 0.5540
 epoch: 32, train_loss: 0.6835, test_loss: 0.8023, test_f1: 0.5527
 epoch: 33, train_loss: 0.6757, test_loss: 0.7577, test_f1: 0.6336
 epoch: 34, train_loss: 0.6596, test_loss: 0.9509, test_f1: 0.6200
 epoch: 35, train_loss: 0.6816, test_loss: 0.8203, test_f1: 0.6150
 epoch: 36, train_loss: 0.6558, test_loss: 0.7568, test_f1: 0.6133
 epoch: 37, train_loss: 0.6659, test_loss: 0.9283, test_f1: 0.6353
 epoch: 38, train_loss: 0.6222, test_loss: 0.8647, test_f1: 0.6194
 epoch: 39, train_loss: 0.6319, test_loss: 0.9140, test_f1: 0.6116
 epoch: 40, train_loss: 0.6329, test_loss: 0.7770, test_f1: 0.5963
 epoch: 41, train_loss: 0.6304, test_loss: 0.7894, test_f1: 0.6391
 epoch: 42, train_loss: 0.6227, test_loss: 0.8088, test_f1: 0.6061
 epoch: 43, train_loss: 0.6415, test_loss: 0.7951, test_f1: 0.6163
 epoch: 44, train_loss: 0.6219, test_loss: 0.8412, test_f1: 0.6059
 epoch: 45, train_loss: 0.6278, test_loss: 0.8013, test_f1: 0.5964
 epoch: 46, train_loss: 0.6281, test_loss: 0.9426, test_f1: 0.6311
 epoch: 47, train_loss: 0.6203, test_loss: 0.7872, test_f1: 0.5615
 epoch: 48, train_loss: 0.5753, test_loss: 0.7687, test_f1: 0.6297
 epoch: 49, train_loss: 0.5932, test_loss: 0.7792, test_f1: 0.6127
 epoch: 50, train_loss: 0.5999, test_loss: 0.8934, test_f1: 0.5805
 epoch: 51, train_loss: 0.5477, test_loss: 0.8416, test_f1: 0.6307
 epoch: 52, train_loss: 0.5190, test_loss: 0.9227, test_f1: 0.6203
 epoch: 53, train_loss: 0.5257, test_loss: 0.8838, test_f1: 0.6439
 epoch: 54, train_loss: 0.5088, test_loss: 1.0349, test_f1: 0.6219
 epoch: 55, train_loss: 0.5105, test_loss: 0.9180, test_f1: 0.6396
 epoch: 56, train_loss: 0.4862, test_loss: 0.9283, test_f1: 0.6501
 epoch: 57, train_loss: 0.4828, test_loss: 0.9062, test_f1: 0.6351
 epoch: 58, train_loss: 0.4795, test_loss: 0.9311, test_f1: 0.6266
 epoch: 59, train_loss: 0.4802, test_loss: 0.9450, test_f1: 0.6691
 epoch: 60, train_loss: 0.4744, test_loss: 1.0181, test_f1: 0.6775
 epoch: 61, train_loss: 0.4710, test_loss: 0.9745, test_f1: 0.6617
 epoch: 62, train_loss: 0.4498, test_loss: 0.9666, test_f1: 0.6336
 epoch: 63, train_loss: 0.4472, test_loss: 1.2262, test_f1: 0.6105
 epoch: 64, train_loss: 0.4399, test_loss: 1.0705, test_f1: 0.6451
 epoch: 65, train_loss: 0.4343, test_loss: 1.1347, test_f1: 0.6779
 epoch: 66, train_loss: 0.4524, test_loss: 0.9941, test_f1: 0.6697
 epoch: 67, train_loss: 0.4207, test_loss: 0.9228, test_f1: 0.6327
 epoch: 68, train_loss: 0.4506, test_loss: 1.1625, test_f1: 0.6633
 epoch: 69, train_loss: 0.4229, test_loss: 1.0094, test_f1: 0.6652
 epoch: 70, train_loss: 0.4216, test_loss: 1.0427, test_f1: 0.6531
 epoch: 71, train_loss: 0.4325, test_loss: 0.9785, test_f1: 0.6783
 epoch: 72, train_loss: 0.4138, test_loss: 1.0533, test_f1: 0.6671
 epoch: 73, train_loss: 0.4061, test_loss: 1.1451, test_f1: 0.6651
 epoch: 74, train_loss: 0.3976, test_loss: 1.0765, test_f1: 0.6468
 epoch: 75, train_loss: 0.4067, test_loss: 1.0481, test_f1: 0.6619
 epoch: 76, train_loss: 0.3964, test_loss: 1.0449, test_f1: 0.6441
 epoch: 77, train_loss: 0.3930, test_loss: 1.1829, test_f1: 0.6317
 epoch: 78, train_loss: 0.3973, test_loss: 0.9880, test_f1: 0.6784
 epoch: 79, train_loss: 0.3954, test_loss: 1.2303, test_f1: 0.6539
 epoch: 80, train_loss: 0.3942, test_loss: 1.3526, test_f1: 0.6443
 epoch: 81, train_loss: 0.3870, test_loss: 1.3076, test_f1: 0.6554
 epoch: 82, train_loss: 0.3756, test_loss: 1.1272, test_f1: 0.6630
 epoch: 83, train_loss: 0.3630, test_loss: 1.1151, test_f1: 0.6548
 epoch: 84, train_loss: 0.3611, test_loss: 1.0515, test_f1: 0.6651
 epoch: 85, train_loss: 0.3603, test_loss: 1.1996, test_f1: 0.6769
 epoch: 86, train_loss: 0.3663, test_loss: 1.4475, test_f1: 0.6469
 epoch: 87, train_loss: 0.3600, test_loss: 1.3865, test_f1: 0.6266
 epoch: 88, train_loss: 0.3760, test_loss: 1.1982, test_f1: 0.6675
 epoch: 89, train_loss: 0.3631, test_loss: 1.0771, test_f1: 0.6703
 epoch: 90, train_loss: 0.3648, test_loss: 1.2234, test_f1: 0.6513
 epoch: 91, train_loss: 0.3821, test_loss: 1.1759, test_f1: 0.6765
 epoch: 92, train_loss: 0.3550, test_loss: 1.1224, test_f1: 0.6703
 epoch: 93, train_loss: 0.3388, test_loss: 1.2099, test_f1: 0.6713
 epoch: 94, train_loss: 0.3575, test_loss: 1.0597, test_f1: 0.6703
 epoch: 95, train_loss: 0.3191, test_loss: 1.3871, test_f1: 0.6552
 epoch: 96, train_loss: 0.3305, test_loss: 1.1338, test_f1: 0.6856
 epoch: 97, train_loss: 0.3466, test_loss: 1.3769, test_f1: 0.6263
 epoch: 98, train_loss: 0.3414, test_loss: 1.2208, test_f1: 0.6580
 epoch: 99, train_loss: 0.3191, test_loss: 1.2725, test_f1: 0.6653
##################ITERATION #9 ****************************************
 epoch: 0, train_loss: 1.2099, test_loss: 2.6155, test_f1: 0.2464
 epoch: 1, train_loss: 1.0323, test_loss: 1.0123, test_f1: 0.4458
 epoch: 2, train_loss: 0.9664, test_loss: 0.9457, test_f1: 0.5502
 epoch: 3, train_loss: 0.9264, test_loss: 1.0051, test_f1: 0.5001
 epoch: 4, train_loss: 0.9239, test_loss: 0.9222, test_f1: 0.4956
 epoch: 5, train_loss: 0.8972, test_loss: 1.0096, test_f1: 0.4505
 epoch: 6, train_loss: 0.8810, test_loss: 0.8698, test_f1: 0.5354
 epoch: 7, train_loss: 0.8449, test_loss: 0.8562, test_f1: 0.5482
 epoch: 8, train_loss: 0.8486, test_loss: 0.8997, test_f1: 0.5360
 epoch: 9, train_loss: 0.8662, test_loss: 0.9848, test_f1: 0.4609
 epoch: 10, train_loss: 0.8169, test_loss: 1.7664, test_f1: 0.3686
 epoch: 11, train_loss: 0.8388, test_loss: 0.9642, test_f1: 0.5380
 epoch: 12, train_loss: 0.8147, test_loss: 0.9446, test_f1: 0.5680
 epoch: 13, train_loss: 0.8067, test_loss: 0.8951, test_f1: 0.5688
 epoch: 14, train_loss: 0.7782, test_loss: 0.9635, test_f1: 0.5914
 epoch: 15, train_loss: 0.7646, test_loss: 0.8324, test_f1: 0.5851
 epoch: 16, train_loss: 0.7424, test_loss: 0.8438, test_f1: 0.5577
 epoch: 17, train_loss: 0.7424, test_loss: 0.9775, test_f1: 0.6222
 epoch: 18, train_loss: 0.7580, test_loss: 0.8543, test_f1: 0.5787
 epoch: 19, train_loss: 0.7345, test_loss: 1.0301, test_f1: 0.5363
 epoch: 20, train_loss: 0.7449, test_loss: 1.0598, test_f1: 0.5342
 epoch: 21, train_loss: 0.7480, test_loss: 0.9462, test_f1: 0.5670
 epoch: 22, train_loss: 0.7194, test_loss: 0.8453, test_f1: 0.5887
 epoch: 23, train_loss: 0.7073, test_loss: 0.7816, test_f1: 0.6225
 epoch: 24, train_loss: 0.7006, test_loss: 0.9998, test_f1: 0.5404
 epoch: 25, train_loss: 0.6780, test_loss: 0.8459, test_f1: 0.5991
 epoch: 26, train_loss: 0.6887, test_loss: 0.8227, test_f1: 0.5889
 epoch: 27, train_loss: 0.6822, test_loss: 0.8560, test_f1: 0.6341
 epoch: 28, train_loss: 0.6949, test_loss: 1.1836, test_f1: 0.5445
 epoch: 29, train_loss: 0.6676, test_loss: 0.8915, test_f1: 0.5815
 epoch: 30, train_loss: 0.6530, test_loss: 0.9833, test_f1: 0.6117
 epoch: 31, train_loss: 0.6641, test_loss: 1.0640, test_f1: 0.5941
 epoch: 32, train_loss: 0.6626, test_loss: 0.9400, test_f1: 0.6531
 epoch: 33, train_loss: 0.6651, test_loss: 0.9769, test_f1: 0.5697
 epoch: 34, train_loss: 0.6497, test_loss: 0.8811, test_f1: 0.6106
 epoch: 35, train_loss: 0.6302, test_loss: 0.8930, test_f1: 0.6384
 epoch: 36, train_loss: 0.6240, test_loss: 0.8634, test_f1: 0.6416
 epoch: 37, train_loss: 0.6495, test_loss: 0.9454, test_f1: 0.5920
 epoch: 38, train_loss: 0.6454, test_loss: 0.9386, test_f1: 0.6543
 epoch: 39, train_loss: 0.6232, test_loss: 0.8217, test_f1: 0.6428
 epoch: 40, train_loss: 0.6329, test_loss: 0.8280, test_f1: 0.6440
 epoch: 41, train_loss: 0.6251, test_loss: 0.9425, test_f1: 0.6286
 epoch: 42, train_loss: 0.5820, test_loss: 0.8065, test_f1: 0.6294
 epoch: 43, train_loss: 0.5894, test_loss: 0.8896, test_f1: 0.6563
 epoch: 44, train_loss: 0.6103, test_loss: 0.8956, test_f1: 0.6277
 epoch: 45, train_loss: 0.6135, test_loss: 0.8324, test_f1: 0.6690
 epoch: 46, train_loss: 0.5790, test_loss: 0.8628, test_f1: 0.6323
 epoch: 47, train_loss: 0.5622, test_loss: 0.8191, test_f1: 0.6621
 epoch: 48, train_loss: 0.5576, test_loss: 0.9411, test_f1: 0.6695
 epoch: 49, train_loss: 0.5667, test_loss: 0.9024, test_f1: 0.6531
 epoch: 50, train_loss: 0.5601, test_loss: 0.9031, test_f1: 0.6598
 epoch: 51, train_loss: 0.5066, test_loss: 0.8434, test_f1: 0.6727
 epoch: 52, train_loss: 0.4829, test_loss: 0.9062, test_f1: 0.6676
 epoch: 53, train_loss: 0.4678, test_loss: 0.9906, test_f1: 0.6809
 epoch: 54, train_loss: 0.4537, test_loss: 0.9011, test_f1: 0.6974
 epoch: 55, train_loss: 0.4716, test_loss: 0.8942, test_f1: 0.6997
 epoch: 56, train_loss: 0.4528, test_loss: 0.9530, test_f1: 0.6764
 epoch: 57, train_loss: 0.4683, test_loss: 0.9005, test_f1: 0.6697
 epoch: 58, train_loss: 0.4235, test_loss: 1.0222, test_f1: 0.6904
 epoch: 59, train_loss: 0.4438, test_loss: 0.8936, test_f1: 0.6925
 epoch: 60, train_loss: 0.4439, test_loss: 0.9737, test_f1: 0.6894
 epoch: 61, train_loss: 0.4497, test_loss: 0.9019, test_f1: 0.6885
 epoch: 62, train_loss: 0.4270, test_loss: 0.9316, test_f1: 0.6813
 epoch: 63, train_loss: 0.4167, test_loss: 0.9334, test_f1: 0.6671
 epoch: 64, train_loss: 0.4073, test_loss: 1.0467, test_f1: 0.7018
 epoch: 65, train_loss: 0.4088, test_loss: 0.8587, test_f1: 0.6887
 epoch: 66, train_loss: 0.3929, test_loss: 0.9032, test_f1: 0.6837
 epoch: 67, train_loss: 0.3982, test_loss: 0.9668, test_f1: 0.6927
 epoch: 68, train_loss: 0.3910, test_loss: 0.9693, test_f1: 0.6689
 epoch: 69, train_loss: 0.3969, test_loss: 0.9746, test_f1: 0.6980
 epoch: 70, train_loss: 0.3800, test_loss: 1.1198, test_f1: 0.6681
 epoch: 71, train_loss: 0.3756, test_loss: 1.0364, test_f1: 0.6877
 epoch: 72, train_loss: 0.3602, test_loss: 1.1449, test_f1: 0.6788
 epoch: 73, train_loss: 0.3681, test_loss: 1.1337, test_f1: 0.6826
 epoch: 74, train_loss: 0.3644, test_loss: 1.0906, test_f1: 0.7037
 epoch: 75, train_loss: 0.3710, test_loss: 0.9588, test_f1: 0.7099
 epoch: 76, train_loss: 0.3446, test_loss: 1.1115, test_f1: 0.6947
 epoch: 77, train_loss: 0.3437, test_loss: 1.0637, test_f1: 0.6860
 epoch: 78, train_loss: 0.3672, test_loss: 1.1307, test_f1: 0.6747
 epoch: 79, train_loss: 0.3488, test_loss: 1.0304, test_f1: 0.6878
 epoch: 80, train_loss: 0.3495, test_loss: 0.9816, test_f1: 0.6785
 epoch: 81, train_loss: 0.3555, test_loss: 1.0502, test_f1: 0.6651
 epoch: 82, train_loss: 0.3385, test_loss: 1.1249, test_f1: 0.6876
 epoch: 83, train_loss: 0.3455, test_loss: 1.0072, test_f1: 0.6888
 epoch: 84, train_loss: 0.3320, test_loss: 0.9668, test_f1: 0.7031
 epoch: 85, train_loss: 0.3091, test_loss: 1.2290, test_f1: 0.6739
 epoch: 86, train_loss: 0.3202, test_loss: 1.0836, test_f1: 0.6974
 epoch: 87, train_loss: 0.3326, test_loss: 1.0765, test_f1: 0.6790
 epoch: 88, train_loss: 0.3282, test_loss: 1.0031, test_f1: 0.6815
 epoch: 89, train_loss: 0.3143, test_loss: 1.0571, test_f1: 0.6647
 epoch: 90, train_loss: 0.3247, test_loss: 1.2734, test_f1: 0.6803
 epoch: 91, train_loss: 0.3075, test_loss: 1.1348, test_f1: 0.6714
 epoch: 92, train_loss: 0.3264, test_loss: 1.2362, test_f1: 0.6885
 epoch: 93, train_loss: 0.3009, test_loss: 1.2521, test_f1: 0.6927
 epoch: 94, train_loss: 0.2962, test_loss: 1.1620, test_f1: 0.7039
 epoch: 95, train_loss: 0.3225, test_loss: 1.1086, test_f1: 0.6689
 epoch: 96, train_loss: 0.2915, test_loss: 1.2349, test_f1: 0.6776
 epoch: 97, train_loss: 0.2930, test_loss: 1.1934, test_f1: 0.6655
 epoch: 98, train_loss: 0.2834, test_loss: 1.1327, test_f1: 0.7022
 epoch: 99, train_loss: 0.3133, test_loss: 1.1789, test_f1: 0.6888

Training completed in 654.56 seconds
Best F1: 0.7135 at epoch 67
Mean F1 across iterations: 0.6960  0.0144
========================FINAL RESULTS================================
FEGIN weighted F1: 0.7135  0.0144
python main.py --data ltspice_examples --representation component_pin --model FEGIN --layers 3 --hiddens 128 --batch_size 64 --lr 0.01 --emb_size 512 --epochs 100 --save_appendix component_pin_L3_H128_BS64_LR0.01_E512 --no_val
-----



STDERR:
  File "main.py", line 370, in <module>
    main()
  File "main.py", line 254, in main
    dataset = dataset_class(
  File "/home/philip/projects/ltspice_examples_code_repo/Circuit-Completion-Using-GNNs/component_classification_with_link_prediction_head/evaluation/FEGIN/kernel/circuit_datasets.py", line 15, in __init__
    self.data, self.slices = torch.load(self.processed_paths[0])
  File "/home/philip/.local/lib/python3.8/site-packages/torch/serialization.py", line 1040, in load
    warnings.warn(
  File "/usr/lib/python3.8/warnings.py", line 109, in _showwarnmsg
    sw(msg.message, msg.category, msg.filename, msg.lineno,
  File "main.py", line 47, in warn_with_traceback
    traceback.print_stack(file=log)
/home/philip/projects/ltspice_examples_code_repo/Circuit-Completion-Using-GNNs/component_classification_with_link_prediction_head/evaluation/FEGIN/kernel/circuit_datasets.py:15: FutureWarning: You are using `torch.load` with `weights_only=False` (the current default value), which uses the default pickle module implicitly. It is possible to construct malicious pickle data which will execute arbitrary code during unpickling (See https://github.com/pytorch/pytorch/blob/main/SECURITY.md#untrusted-models for more details). In a future release, the default value for `weights_only` will be flipped to `True`. This limits the functions that could be executed during unpickling. Arbitrary objects will no longer be allowed to be loaded via this mode unless they are explicitly allowlisted by the user via `torch.serialization.add_safe_globals`. We recommend you start setting `weights_only=True` for any use case where you don't have full control of the loaded file. Please open an issue on GitHub for any issues related to this experimental feature.
  self.data, self.slices = torch.load(self.processed_paths[0])
