STDOUT:
Results will be saved in /home/philip/projects/llm_inference_code_repo/Circuit-Completion-Using-GNNs/component_classification_with_link_prediction_head/evaluation/FEGIN/results/model_FEGIN_dataset_ltspice_examples
Command line input: python main.py --data ltspice_examples --representation component_pin_net --model FEGIN --layers 6 --hiddens 16 --batch_size 32 --lr 0.0001 --emb_size 250 --epochs 100 --save_appendix component_pin_net_L6_H16_BS32_LR0.0001_E250 --no_val
 is saved.
-----
ltspice_examples - FEGIN
Using 6 layers, 16 hidden units, h = 2
Loading component_pin_net representation dataset
ENTERED
Training FEGIN on component_pin_net representation
Train: 3558, Test: 846
##################ITERATION #0 ****************************************
 epoch: 0, train_loss: 1.4575, test_loss: 1.4378, test_f1: 0.0793
 epoch: 1, train_loss: 1.4434, test_loss: 1.4292, test_f1: 0.0793
 epoch: 2, train_loss: 1.4343, test_loss: 1.4199, test_f1: 0.0793
 epoch: 3, train_loss: 1.4250, test_loss: 1.4107, test_f1: 0.1043
 epoch: 4, train_loss: 1.4150, test_loss: 1.3990, test_f1: 0.1853
 epoch: 5, train_loss: 1.3993, test_loss: 1.3838, test_f1: 0.2489
 epoch: 6, train_loss: 1.3827, test_loss: 1.3691, test_f1: 0.3612
 epoch: 7, train_loss: 1.3633, test_loss: 1.3510, test_f1: 0.3382
 epoch: 8, train_loss: 1.3493, test_loss: 1.3380, test_f1: 0.3041
 epoch: 9, train_loss: 1.3321, test_loss: 1.3256, test_f1: 0.2773
 epoch: 10, train_loss: 1.3217, test_loss: 1.3122, test_f1: 0.2604
 epoch: 11, train_loss: 1.3120, test_loss: 1.2995, test_f1: 0.2610
 epoch: 12, train_loss: 1.2996, test_loss: 1.2933, test_f1: 0.2554
 epoch: 13, train_loss: 1.2920, test_loss: 1.2797, test_f1: 0.2560
 epoch: 14, train_loss: 1.2843, test_loss: 1.2681, test_f1: 0.2634
 epoch: 15, train_loss: 1.2695, test_loss: 1.2598, test_f1: 0.2392
 epoch: 16, train_loss: 1.2614, test_loss: 1.2465, test_f1: 0.2845
 epoch: 17, train_loss: 1.2529, test_loss: 1.2356, test_f1: 0.2719
 epoch: 18, train_loss: 1.2459, test_loss: 1.2231, test_f1: 0.2916
 epoch: 19, train_loss: 1.2357, test_loss: 1.2116, test_f1: 0.2857
 epoch: 20, train_loss: 1.2248, test_loss: 1.1993, test_f1: 0.3260
 epoch: 21, train_loss: 1.2103, test_loss: 1.1867, test_f1: 0.3390
 epoch: 22, train_loss: 1.1976, test_loss: 1.1714, test_f1: 0.3654
 epoch: 23, train_loss: 1.1899, test_loss: 1.1592, test_f1: 0.3723
 epoch: 24, train_loss: 1.1755, test_loss: 1.1429, test_f1: 0.3441
 epoch: 25, train_loss: 1.1674, test_loss: 1.1285, test_f1: 0.3677
 epoch: 26, train_loss: 1.1480, test_loss: 1.1182, test_f1: 0.3448
 epoch: 27, train_loss: 1.1425, test_loss: 1.1042, test_f1: 0.3763
 epoch: 28, train_loss: 1.1326, test_loss: 1.0940, test_f1: 0.3469
 epoch: 29, train_loss: 1.1224, test_loss: 1.0865, test_f1: 0.3557
 epoch: 30, train_loss: 1.1092, test_loss: 1.0797, test_f1: 0.3883
 epoch: 31, train_loss: 1.1063, test_loss: 1.0730, test_f1: 0.3875
 epoch: 32, train_loss: 1.1004, test_loss: 1.0737, test_f1: 0.3530
 epoch: 33, train_loss: 1.0980, test_loss: 1.0679, test_f1: 0.3642
 epoch: 34, train_loss: 1.0933, test_loss: 1.0664, test_f1: 0.3489
 epoch: 35, train_loss: 1.0890, test_loss: 1.0622, test_f1: 0.3476
 epoch: 36, train_loss: 1.0717, test_loss: 1.0541, test_f1: 0.3483
 epoch: 37, train_loss: 1.0745, test_loss: 1.0543, test_f1: 0.3481
 epoch: 38, train_loss: 1.0639, test_loss: 1.0498, test_f1: 0.3479
 epoch: 39, train_loss: 1.0663, test_loss: 1.0437, test_f1: 0.3489
 epoch: 40, train_loss: 1.0599, test_loss: 1.0481, test_f1: 0.3497
 epoch: 41, train_loss: 1.0573, test_loss: 1.0485, test_f1: 0.3479
 epoch: 42, train_loss: 1.0663, test_loss: 1.0407, test_f1: 0.3473
 epoch: 43, train_loss: 1.0530, test_loss: 1.0433, test_f1: 0.3511
 epoch: 44, train_loss: 1.0485, test_loss: 1.0441, test_f1: 0.3479
 epoch: 45, train_loss: 1.0506, test_loss: 1.0502, test_f1: 0.3429
 epoch: 46, train_loss: 1.0432, test_loss: 1.0524, test_f1: 0.3443
 epoch: 47, train_loss: 1.0407, test_loss: 1.0350, test_f1: 0.3516
 epoch: 48, train_loss: 1.0358, test_loss: 1.0443, test_f1: 0.3531
 epoch: 49, train_loss: 1.0399, test_loss: 1.0376, test_f1: 0.3474
 epoch: 50, train_loss: 1.0434, test_loss: 1.0401, test_f1: 0.3510
 epoch: 51, train_loss: 1.0340, test_loss: 1.0381, test_f1: 0.3533
 epoch: 52, train_loss: 1.0284, test_loss: 1.0457, test_f1: 0.3552
 epoch: 53, train_loss: 1.0355, test_loss: 1.0382, test_f1: 0.3498
 epoch: 54, train_loss: 1.0382, test_loss: 1.0338, test_f1: 0.3511
 epoch: 55, train_loss: 1.0284, test_loss: 1.0384, test_f1: 0.3505
 epoch: 56, train_loss: 1.0274, test_loss: 1.0311, test_f1: 0.3557
 epoch: 57, train_loss: 1.0336, test_loss: 1.0369, test_f1: 0.3471
 epoch: 58, train_loss: 1.0314, test_loss: 1.0328, test_f1: 0.3541
 epoch: 59, train_loss: 1.0191, test_loss: 1.0332, test_f1: 0.3535
 epoch: 60, train_loss: 1.0240, test_loss: 1.0331, test_f1: 0.3479
 epoch: 61, train_loss: 1.0280, test_loss: 1.0339, test_f1: 0.3501
 epoch: 62, train_loss: 1.0133, test_loss: 1.0299, test_f1: 0.3516
 epoch: 63, train_loss: 1.0272, test_loss: 1.0241, test_f1: 0.3654
 epoch: 64, train_loss: 1.0222, test_loss: 1.0261, test_f1: 0.3579
 epoch: 65, train_loss: 1.0191, test_loss: 1.0361, test_f1: 0.3675
 epoch: 66, train_loss: 1.0157, test_loss: 1.0225, test_f1: 0.3554
 epoch: 67, train_loss: 1.0234, test_loss: 1.0293, test_f1: 0.3555
 epoch: 68, train_loss: 1.0166, test_loss: 1.0305, test_f1: 0.3590
 epoch: 69, train_loss: 1.0258, test_loss: 1.0282, test_f1: 0.3607
 epoch: 70, train_loss: 1.0258, test_loss: 1.0266, test_f1: 0.3666
 epoch: 71, train_loss: 1.0146, test_loss: 1.0406, test_f1: 0.3594
 epoch: 72, train_loss: 1.0182, test_loss: 1.0273, test_f1: 0.3614
 epoch: 73, train_loss: 1.0190, test_loss: 1.0329, test_f1: 0.3621
 epoch: 74, train_loss: 1.0186, test_loss: 1.0300, test_f1: 0.3600
 epoch: 75, train_loss: 1.0157, test_loss: 1.0292, test_f1: 0.3549
 epoch: 76, train_loss: 1.0147, test_loss: 1.0258, test_f1: 0.3571
 epoch: 77, train_loss: 1.0107, test_loss: 1.0250, test_f1: 0.3580
 epoch: 78, train_loss: 1.0134, test_loss: 1.0267, test_f1: 0.3726
 epoch: 79, train_loss: 1.0184, test_loss: 1.0226, test_f1: 0.3727
 epoch: 80, train_loss: 1.0142, test_loss: 1.0322, test_f1: 0.3727
 epoch: 81, train_loss: 1.0134, test_loss: 1.0273, test_f1: 0.3688
 epoch: 82, train_loss: 1.0138, test_loss: 1.0235, test_f1: 0.3655
 epoch: 83, train_loss: 1.0089, test_loss: 1.0256, test_f1: 0.3717
 epoch: 84, train_loss: 1.0080, test_loss: 1.0218, test_f1: 0.3735
 epoch: 85, train_loss: 1.0012, test_loss: 1.0164, test_f1: 0.3653
 epoch: 86, train_loss: 1.0050, test_loss: 1.0126, test_f1: 0.3744
 epoch: 87, train_loss: 1.0139, test_loss: 1.0186, test_f1: 0.3692
 epoch: 88, train_loss: 1.0004, test_loss: 1.0131, test_f1: 0.3732
 epoch: 89, train_loss: 1.0063, test_loss: 1.0179, test_f1: 0.3793
 epoch: 90, train_loss: 1.0024, test_loss: 1.0177, test_f1: 0.3741
 epoch: 91, train_loss: 1.0039, test_loss: 1.0196, test_f1: 0.3778
 epoch: 92, train_loss: 1.0042, test_loss: 1.0221, test_f1: 0.3783
 epoch: 93, train_loss: 0.9984, test_loss: 1.0165, test_f1: 0.3803
 epoch: 94, train_loss: 1.0107, test_loss: 1.0267, test_f1: 0.3904
 epoch: 95, train_loss: 1.0028, test_loss: 1.0257, test_f1: 0.3864
 epoch: 96, train_loss: 0.9977, test_loss: 1.0187, test_f1: 0.3820
 epoch: 97, train_loss: 1.0016, test_loss: 1.0225, test_f1: 0.3923
 epoch: 98, train_loss: 0.9902, test_loss: 1.0101, test_f1: 0.3884
 epoch: 99, train_loss: 0.9933, test_loss: 1.0144, test_f1: 0.4022
##################ITERATION #1 ****************************************
 epoch: 0, train_loss: 1.3414, test_loss: 1.3184, test_f1: 0.2270
 epoch: 1, train_loss: 1.3164, test_loss: 1.3004, test_f1: 0.2270
 epoch: 2, train_loss: 1.2965, test_loss: 1.2766, test_f1: 0.2270
 epoch: 3, train_loss: 1.2788, test_loss: 1.2577, test_f1: 0.2270
 epoch: 4, train_loss: 1.2569, test_loss: 1.2361, test_f1: 0.2270
 epoch: 5, train_loss: 1.2386, test_loss: 1.2114, test_f1: 0.2527
 epoch: 6, train_loss: 1.2187, test_loss: 1.1936, test_f1: 0.3250
 epoch: 7, train_loss: 1.2026, test_loss: 1.1731, test_f1: 0.3393
 epoch: 8, train_loss: 1.1827, test_loss: 1.1517, test_f1: 0.3422
 epoch: 9, train_loss: 1.1664, test_loss: 1.1350, test_f1: 0.3460
 epoch: 10, train_loss: 1.1529, test_loss: 1.1232, test_f1: 0.3428
 epoch: 11, train_loss: 1.1425, test_loss: 1.1087, test_f1: 0.3450
 epoch: 12, train_loss: 1.1338, test_loss: 1.0981, test_f1: 0.3450
 epoch: 13, train_loss: 1.1138, test_loss: 1.0966, test_f1: 0.3421
 epoch: 14, train_loss: 1.1121, test_loss: 1.0876, test_f1: 0.3460
 epoch: 15, train_loss: 1.0994, test_loss: 1.0818, test_f1: 0.3431
 epoch: 16, train_loss: 1.0990, test_loss: 1.0796, test_f1: 0.3421
 epoch: 17, train_loss: 1.0873, test_loss: 1.0761, test_f1: 0.3428
 epoch: 18, train_loss: 1.0810, test_loss: 1.0689, test_f1: 0.3440
 epoch: 19, train_loss: 1.0759, test_loss: 1.0605, test_f1: 0.3449
 epoch: 20, train_loss: 1.0815, test_loss: 1.0696, test_f1: 0.3404
 epoch: 21, train_loss: 1.0707, test_loss: 1.0614, test_f1: 0.3440
 epoch: 22, train_loss: 1.0657, test_loss: 1.0596, test_f1: 0.3592
 epoch: 23, train_loss: 1.0644, test_loss: 1.0567, test_f1: 0.3550
 epoch: 24, train_loss: 1.0661, test_loss: 1.0584, test_f1: 0.3573
 epoch: 25, train_loss: 1.0615, test_loss: 1.0561, test_f1: 0.3608
 epoch: 26, train_loss: 1.0511, test_loss: 1.0550, test_f1: 0.3694
 epoch: 27, train_loss: 1.0434, test_loss: 1.0577, test_f1: 0.3652
 epoch: 28, train_loss: 1.0435, test_loss: 1.0469, test_f1: 0.3674
 epoch: 29, train_loss: 1.0426, test_loss: 1.0586, test_f1: 0.3669
 epoch: 30, train_loss: 1.0409, test_loss: 1.0542, test_f1: 0.3679
 epoch: 31, train_loss: 1.0409, test_loss: 1.0439, test_f1: 0.3799
 epoch: 32, train_loss: 1.0359, test_loss: 1.0457, test_f1: 0.3772
 epoch: 33, train_loss: 1.0393, test_loss: 1.0438, test_f1: 0.3965
 epoch: 34, train_loss: 1.0351, test_loss: 1.0321, test_f1: 0.3948
 epoch: 35, train_loss: 1.0315, test_loss: 1.0250, test_f1: 0.4159
 epoch: 36, train_loss: 1.0270, test_loss: 1.0187, test_f1: 0.4124
 epoch: 37, train_loss: 1.0278, test_loss: 1.0196, test_f1: 0.4147
 epoch: 38, train_loss: 1.0220, test_loss: 1.0261, test_f1: 0.4166
 epoch: 39, train_loss: 1.0156, test_loss: 1.0200, test_f1: 0.4169
 epoch: 40, train_loss: 1.0193, test_loss: 1.0172, test_f1: 0.4254
 epoch: 41, train_loss: 1.0073, test_loss: 1.0136, test_f1: 0.4235
 epoch: 42, train_loss: 1.0155, test_loss: 1.0041, test_f1: 0.4182
 epoch: 43, train_loss: 1.0048, test_loss: 1.0087, test_f1: 0.4313
 epoch: 44, train_loss: 1.0044, test_loss: 1.0056, test_f1: 0.4339
 epoch: 45, train_loss: 1.0082, test_loss: 0.9866, test_f1: 0.4292
 epoch: 46, train_loss: 0.9986, test_loss: 0.9863, test_f1: 0.4540
 epoch: 47, train_loss: 1.0029, test_loss: 0.9864, test_f1: 0.4388
 epoch: 48, train_loss: 0.9968, test_loss: 0.9715, test_f1: 0.4632
 epoch: 49, train_loss: 0.9997, test_loss: 0.9617, test_f1: 0.4572
 epoch: 50, train_loss: 0.9963, test_loss: 0.9661, test_f1: 0.4703
 epoch: 51, train_loss: 0.9883, test_loss: 0.9862, test_f1: 0.4606
 epoch: 52, train_loss: 0.9910, test_loss: 0.9657, test_f1: 0.4717
 epoch: 53, train_loss: 0.9919, test_loss: 0.9815, test_f1: 0.4588
 epoch: 54, train_loss: 0.9789, test_loss: 0.9632, test_f1: 0.4727
 epoch: 55, train_loss: 0.9864, test_loss: 0.9723, test_f1: 0.4608
 epoch: 56, train_loss: 0.9888, test_loss: 0.9906, test_f1: 0.4549
 epoch: 57, train_loss: 0.9857, test_loss: 0.9791, test_f1: 0.4719
 epoch: 58, train_loss: 0.9796, test_loss: 0.9646, test_f1: 0.4742
 epoch: 59, train_loss: 0.9797, test_loss: 0.9743, test_f1: 0.4852
 epoch: 60, train_loss: 0.9814, test_loss: 0.9557, test_f1: 0.4740
 epoch: 61, train_loss: 0.9782, test_loss: 0.9462, test_f1: 0.4804
 epoch: 62, train_loss: 0.9785, test_loss: 0.9463, test_f1: 0.4793
 epoch: 63, train_loss: 0.9798, test_loss: 0.9554, test_f1: 0.4731
 epoch: 64, train_loss: 0.9733, test_loss: 0.9490, test_f1: 0.4776
 epoch: 65, train_loss: 0.9704, test_loss: 0.9541, test_f1: 0.4683
 epoch: 66, train_loss: 0.9731, test_loss: 0.9500, test_f1: 0.4815
 epoch: 67, train_loss: 0.9736, test_loss: 0.9416, test_f1: 0.4781
 epoch: 68, train_loss: 0.9694, test_loss: 0.9433, test_f1: 0.4758
 epoch: 69, train_loss: 0.9699, test_loss: 0.9309, test_f1: 0.4952
 epoch: 70, train_loss: 0.9750, test_loss: 0.9324, test_f1: 0.4897
 epoch: 71, train_loss: 0.9590, test_loss: 0.9381, test_f1: 0.4736
 epoch: 72, train_loss: 0.9648, test_loss: 0.9292, test_f1: 0.4826
 epoch: 73, train_loss: 0.9704, test_loss: 0.9412, test_f1: 0.4667
 epoch: 74, train_loss: 0.9739, test_loss: 0.9305, test_f1: 0.4972
 epoch: 75, train_loss: 0.9667, test_loss: 0.9336, test_f1: 0.4845
 epoch: 76, train_loss: 0.9774, test_loss: 0.9309, test_f1: 0.4990
 epoch: 77, train_loss: 0.9697, test_loss: 0.9346, test_f1: 0.4893
 epoch: 78, train_loss: 0.9581, test_loss: 0.9285, test_f1: 0.4982
 epoch: 79, train_loss: 0.9624, test_loss: 0.9325, test_f1: 0.4930
 epoch: 80, train_loss: 0.9661, test_loss: 0.9151, test_f1: 0.5024
 epoch: 81, train_loss: 0.9607, test_loss: 0.9250, test_f1: 0.5065
 epoch: 82, train_loss: 0.9593, test_loss: 0.9218, test_f1: 0.5183
 epoch: 83, train_loss: 0.9632, test_loss: 0.9214, test_f1: 0.5038
 epoch: 84, train_loss: 0.9589, test_loss: 0.9176, test_f1: 0.4981
 epoch: 85, train_loss: 0.9691, test_loss: 0.9188, test_f1: 0.5036
 epoch: 86, train_loss: 0.9567, test_loss: 0.9318, test_f1: 0.4733
 epoch: 87, train_loss: 0.9529, test_loss: 0.9270, test_f1: 0.5027
 epoch: 88, train_loss: 0.9633, test_loss: 0.9146, test_f1: 0.5065
 epoch: 89, train_loss: 0.9578, test_loss: 0.9167, test_f1: 0.5073
 epoch: 90, train_loss: 0.9510, test_loss: 0.9144, test_f1: 0.5082
 epoch: 91, train_loss: 0.9522, test_loss: 0.9121, test_f1: 0.5092
 epoch: 92, train_loss: 0.9550, test_loss: 0.9240, test_f1: 0.4973
 epoch: 93, train_loss: 0.9531, test_loss: 0.9117, test_f1: 0.5021
 epoch: 94, train_loss: 0.9545, test_loss: 0.9271, test_f1: 0.4929
 epoch: 95, train_loss: 0.9417, test_loss: 0.9084, test_f1: 0.5090
 epoch: 96, train_loss: 0.9398, test_loss: 0.9181, test_f1: 0.5068
 epoch: 97, train_loss: 0.9516, test_loss: 0.9246, test_f1: 0.4977
 epoch: 98, train_loss: 0.9508, test_loss: 0.9093, test_f1: 0.5046
 epoch: 99, train_loss: 0.9520, test_loss: 0.9271, test_f1: 0.4845
##################ITERATION #2 ****************************************
 epoch: 0, train_loss: 1.2937, test_loss: 1.2762, test_f1: 0.2270
 epoch: 1, train_loss: 1.2655, test_loss: 1.2415, test_f1: 0.2690
 epoch: 2, train_loss: 1.2402, test_loss: 1.2079, test_f1: 0.3116
 epoch: 3, train_loss: 1.2161, test_loss: 1.1768, test_f1: 0.3312
 epoch: 4, train_loss: 1.1967, test_loss: 1.1539, test_f1: 0.3435
 epoch: 5, train_loss: 1.1734, test_loss: 1.1354, test_f1: 0.3384
 epoch: 6, train_loss: 1.1527, test_loss: 1.1177, test_f1: 0.3374
 epoch: 7, train_loss: 1.1423, test_loss: 1.1020, test_f1: 0.3420
 epoch: 8, train_loss: 1.1208, test_loss: 1.0997, test_f1: 0.3354
 epoch: 9, train_loss: 1.1084, test_loss: 1.0894, test_f1: 0.3367
 epoch: 10, train_loss: 1.1011, test_loss: 1.0774, test_f1: 0.3424
 epoch: 11, train_loss: 1.0946, test_loss: 1.0868, test_f1: 0.3340
 epoch: 12, train_loss: 1.0783, test_loss: 1.0731, test_f1: 0.3396
 epoch: 13, train_loss: 1.0776, test_loss: 1.0550, test_f1: 0.3388
 epoch: 14, train_loss: 1.0609, test_loss: 1.0539, test_f1: 0.3385
 epoch: 15, train_loss: 1.0587, test_loss: 1.0611, test_f1: 0.3437
 epoch: 16, train_loss: 1.0455, test_loss: 1.0561, test_f1: 0.3475
 epoch: 17, train_loss: 1.0401, test_loss: 1.0404, test_f1: 0.3438
 epoch: 18, train_loss: 1.0373, test_loss: 1.0478, test_f1: 0.3580
 epoch: 19, train_loss: 1.0324, test_loss: 1.0439, test_f1: 0.3955
 epoch: 20, train_loss: 1.0236, test_loss: 1.0453, test_f1: 0.4112
 epoch: 21, train_loss: 1.0213, test_loss: 1.0309, test_f1: 0.4018
 epoch: 22, train_loss: 1.0220, test_loss: 1.0212, test_f1: 0.4133
 epoch: 23, train_loss: 1.0151, test_loss: 1.0246, test_f1: 0.4142
 epoch: 24, train_loss: 1.0117, test_loss: 1.0177, test_f1: 0.4364
 epoch: 25, train_loss: 1.0017, test_loss: 1.0209, test_f1: 0.4412
 epoch: 26, train_loss: 1.0114, test_loss: 1.0422, test_f1: 0.4393
 epoch: 27, train_loss: 1.0020, test_loss: 1.0534, test_f1: 0.4494
 epoch: 28, train_loss: 0.9962, test_loss: 1.0160, test_f1: 0.4523
 epoch: 29, train_loss: 1.0004, test_loss: 1.0410, test_f1: 0.4482
 epoch: 30, train_loss: 0.9940, test_loss: 1.0077, test_f1: 0.4525
 epoch: 31, train_loss: 0.9916, test_loss: 1.0122, test_f1: 0.4549
 epoch: 32, train_loss: 1.0004, test_loss: 0.9947, test_f1: 0.4648
 epoch: 33, train_loss: 0.9811, test_loss: 1.0100, test_f1: 0.4545
 epoch: 34, train_loss: 0.9796, test_loss: 1.0234, test_f1: 0.4355
 epoch: 35, train_loss: 0.9859, test_loss: 0.9819, test_f1: 0.4596
 epoch: 36, train_loss: 0.9725, test_loss: 0.9830, test_f1: 0.4519
 epoch: 37, train_loss: 0.9717, test_loss: 0.9787, test_f1: 0.4661
 epoch: 38, train_loss: 0.9762, test_loss: 0.9870, test_f1: 0.4769
 epoch: 39, train_loss: 0.9729, test_loss: 1.0004, test_f1: 0.4554
 epoch: 40, train_loss: 0.9715, test_loss: 0.9775, test_f1: 0.4568
 epoch: 41, train_loss: 0.9600, test_loss: 0.9676, test_f1: 0.4465
 epoch: 42, train_loss: 0.9672, test_loss: 0.9652, test_f1: 0.4825
 epoch: 43, train_loss: 0.9706, test_loss: 0.9820, test_f1: 0.4781
 epoch: 44, train_loss: 0.9639, test_loss: 0.9851, test_f1: 0.4749
 epoch: 45, train_loss: 0.9569, test_loss: 0.9643, test_f1: 0.4858
 epoch: 46, train_loss: 0.9520, test_loss: 0.9652, test_f1: 0.4817
 epoch: 47, train_loss: 0.9525, test_loss: 0.9665, test_f1: 0.4704
 epoch: 48, train_loss: 0.9497, test_loss: 0.9758, test_f1: 0.4804
 epoch: 49, train_loss: 0.9531, test_loss: 0.9558, test_f1: 0.4625
 epoch: 50, train_loss: 0.9549, test_loss: 0.9438, test_f1: 0.4772
 epoch: 51, train_loss: 0.9463, test_loss: 0.9405, test_f1: 0.4763
 epoch: 52, train_loss: 0.9539, test_loss: 0.9444, test_f1: 0.4896
 epoch: 53, train_loss: 0.9408, test_loss: 0.9496, test_f1: 0.4740
 epoch: 54, train_loss: 0.9502, test_loss: 0.9399, test_f1: 0.4816
 epoch: 55, train_loss: 0.9444, test_loss: 0.9423, test_f1: 0.4708
 epoch: 56, train_loss: 0.9393, test_loss: 0.9729, test_f1: 0.4692
 epoch: 57, train_loss: 0.9476, test_loss: 0.9494, test_f1: 0.4800
 epoch: 58, train_loss: 0.9431, test_loss: 0.9329, test_f1: 0.4787
 epoch: 59, train_loss: 0.9488, test_loss: 0.9472, test_f1: 0.4721
 epoch: 60, train_loss: 0.9431, test_loss: 0.9433, test_f1: 0.4751
 epoch: 61, train_loss: 0.9414, test_loss: 0.9386, test_f1: 0.4813
 epoch: 62, train_loss: 0.9453, test_loss: 0.9585, test_f1: 0.4704
 epoch: 63, train_loss: 0.9387, test_loss: 0.9651, test_f1: 0.4751
 epoch: 64, train_loss: 0.9428, test_loss: 0.9557, test_f1: 0.4702
 epoch: 65, train_loss: 0.9442, test_loss: 0.9219, test_f1: 0.4847
 epoch: 66, train_loss: 0.9305, test_loss: 0.9463, test_f1: 0.4770
 epoch: 67, train_loss: 0.9399, test_loss: 0.9418, test_f1: 0.4821
 epoch: 68, train_loss: 0.9344, test_loss: 0.9076, test_f1: 0.5014
 epoch: 69, train_loss: 0.9252, test_loss: 0.9162, test_f1: 0.4924
 epoch: 70, train_loss: 0.9339, test_loss: 0.9143, test_f1: 0.4942
 epoch: 71, train_loss: 0.9268, test_loss: 0.9183, test_f1: 0.4851
 epoch: 72, train_loss: 0.9231, test_loss: 0.8992, test_f1: 0.5011
 epoch: 73, train_loss: 0.9243, test_loss: 0.9207, test_f1: 0.5027
 epoch: 74, train_loss: 0.9285, test_loss: 0.9371, test_f1: 0.4779
 epoch: 75, train_loss: 0.9306, test_loss: 0.9235, test_f1: 0.4915
 epoch: 76, train_loss: 0.9378, test_loss: 0.9208, test_f1: 0.4848
 epoch: 77, train_loss: 0.9212, test_loss: 0.9008, test_f1: 0.4985
 epoch: 78, train_loss: 0.9310, test_loss: 0.9112, test_f1: 0.4973
 epoch: 79, train_loss: 0.9241, test_loss: 0.9299, test_f1: 0.4766
 epoch: 80, train_loss: 0.9249, test_loss: 0.8957, test_f1: 0.5070
 epoch: 81, train_loss: 0.9284, test_loss: 0.9039, test_f1: 0.5033
 epoch: 82, train_loss: 0.9203, test_loss: 0.9018, test_f1: 0.4991
 epoch: 83, train_loss: 0.9223, test_loss: 0.9116, test_f1: 0.4885
 epoch: 84, train_loss: 0.9290, test_loss: 0.9272, test_f1: 0.4885
 epoch: 85, train_loss: 0.9230, test_loss: 0.8985, test_f1: 0.5012
 epoch: 86, train_loss: 0.9177, test_loss: 0.8983, test_f1: 0.5065
 epoch: 87, train_loss: 0.9203, test_loss: 0.8940, test_f1: 0.5042
 epoch: 88, train_loss: 0.9261, test_loss: 0.8992, test_f1: 0.5046
 epoch: 89, train_loss: 0.9149, test_loss: 0.9031, test_f1: 0.4964
 epoch: 90, train_loss: 0.9259, test_loss: 0.8832, test_f1: 0.5192
 epoch: 91, train_loss: 0.9159, test_loss: 0.8904, test_f1: 0.5150
 epoch: 92, train_loss: 0.9130, test_loss: 0.8868, test_f1: 0.5038
 epoch: 93, train_loss: 0.9220, test_loss: 0.8969, test_f1: 0.5102
 epoch: 94, train_loss: 0.9052, test_loss: 0.9104, test_f1: 0.4963
 epoch: 95, train_loss: 0.9164, test_loss: 0.8990, test_f1: 0.5049
 epoch: 96, train_loss: 0.9037, test_loss: 0.8829, test_f1: 0.5008
 epoch: 97, train_loss: 0.9155, test_loss: 0.8973, test_f1: 0.4933
 epoch: 98, train_loss: 0.9160, test_loss: 0.9015, test_f1: 0.4989
 epoch: 99, train_loss: 0.9045, test_loss: 0.8990, test_f1: 0.5013
##################ITERATION #3 ****************************************
 epoch: 0, train_loss: 1.2735, test_loss: 1.2275, test_f1: 0.2728
 epoch: 1, train_loss: 1.2366, test_loss: 1.2009, test_f1: 0.2870
 epoch: 2, train_loss: 1.2180, test_loss: 1.1728, test_f1: 0.3152
 epoch: 3, train_loss: 1.1926, test_loss: 1.1441, test_f1: 0.3305
 epoch: 4, train_loss: 1.1729, test_loss: 1.1200, test_f1: 0.3413
 epoch: 5, train_loss: 1.1523, test_loss: 1.1021, test_f1: 0.3595
 epoch: 6, train_loss: 1.1366, test_loss: 1.0900, test_f1: 0.3446
 epoch: 7, train_loss: 1.1255, test_loss: 1.0706, test_f1: 0.3434
 epoch: 8, train_loss: 1.1057, test_loss: 1.0574, test_f1: 0.3657
 epoch: 9, train_loss: 1.0965, test_loss: 1.0463, test_f1: 0.3815
 epoch: 10, train_loss: 1.0848, test_loss: 1.0494, test_f1: 0.4022
 epoch: 11, train_loss: 1.0751, test_loss: 1.0433, test_f1: 0.3759
 epoch: 12, train_loss: 1.0680, test_loss: 1.0312, test_f1: 0.3905
 epoch: 13, train_loss: 1.0658, test_loss: 1.0288, test_f1: 0.4139
 epoch: 14, train_loss: 1.0589, test_loss: 1.0290, test_f1: 0.4074
 epoch: 15, train_loss: 1.0589, test_loss: 1.0174, test_f1: 0.4290
 epoch: 16, train_loss: 1.0402, test_loss: 1.0276, test_f1: 0.4506
 epoch: 17, train_loss: 1.0415, test_loss: 1.0161, test_f1: 0.4281
 epoch: 18, train_loss: 1.0405, test_loss: 1.0212, test_f1: 0.4200
 epoch: 19, train_loss: 1.0362, test_loss: 1.0102, test_f1: 0.4365
 epoch: 20, train_loss: 1.0326, test_loss: 1.0101, test_f1: 0.4426
 epoch: 21, train_loss: 1.0282, test_loss: 1.0028, test_f1: 0.4312
 epoch: 22, train_loss: 1.0281, test_loss: 1.0058, test_f1: 0.4479
 epoch: 23, train_loss: 1.0274, test_loss: 1.0014, test_f1: 0.4465
 epoch: 24, train_loss: 1.0165, test_loss: 1.0102, test_f1: 0.4357
 epoch: 25, train_loss: 1.0189, test_loss: 1.0012, test_f1: 0.4396
 epoch: 26, train_loss: 1.0062, test_loss: 0.9935, test_f1: 0.4644
 epoch: 27, train_loss: 1.0098, test_loss: 0.9817, test_f1: 0.4539
 epoch: 28, train_loss: 1.0031, test_loss: 0.9858, test_f1: 0.4758
 epoch: 29, train_loss: 0.9996, test_loss: 0.9850, test_f1: 0.4742
 epoch: 30, train_loss: 1.0026, test_loss: 0.9867, test_f1: 0.4828
 epoch: 31, train_loss: 0.9949, test_loss: 0.9779, test_f1: 0.4731
 epoch: 32, train_loss: 0.9969, test_loss: 0.9705, test_f1: 0.4895
 epoch: 33, train_loss: 0.9959, test_loss: 0.9892, test_f1: 0.4440
 epoch: 34, train_loss: 0.9863, test_loss: 0.9617, test_f1: 0.4617
 epoch: 35, train_loss: 0.9932, test_loss: 0.9870, test_f1: 0.4726
 epoch: 36, train_loss: 0.9782, test_loss: 0.9816, test_f1: 0.4794
 epoch: 37, train_loss: 0.9828, test_loss: 0.9766, test_f1: 0.4824
 epoch: 38, train_loss: 0.9777, test_loss: 0.9766, test_f1: 0.4757
 epoch: 39, train_loss: 0.9898, test_loss: 0.9751, test_f1: 0.4756
 epoch: 40, train_loss: 0.9791, test_loss: 0.9664, test_f1: 0.4836
 epoch: 41, train_loss: 0.9739, test_loss: 0.9645, test_f1: 0.4692
 epoch: 42, train_loss: 0.9789, test_loss: 0.9575, test_f1: 0.4848
 epoch: 43, train_loss: 0.9745, test_loss: 0.9469, test_f1: 0.4789
 epoch: 44, train_loss: 0.9809, test_loss: 0.9779, test_f1: 0.4900
 epoch: 45, train_loss: 0.9714, test_loss: 0.9969, test_f1: 0.4747
 epoch: 46, train_loss: 0.9731, test_loss: 0.9673, test_f1: 0.4723
 epoch: 47, train_loss: 0.9620, test_loss: 0.9674, test_f1: 0.4671
 epoch: 48, train_loss: 0.9629, test_loss: 0.9582, test_f1: 0.5044
 epoch: 49, train_loss: 0.9651, test_loss: 0.9728, test_f1: 0.4933
 epoch: 50, train_loss: 0.9625, test_loss: 0.9713, test_f1: 0.4924
 epoch: 51, train_loss: 0.9485, test_loss: 0.9534, test_f1: 0.4958
 epoch: 52, train_loss: 0.9580, test_loss: 0.9536, test_f1: 0.4962
 epoch: 53, train_loss: 0.9574, test_loss: 0.9632, test_f1: 0.4950
 epoch: 54, train_loss: 0.9627, test_loss: 0.9602, test_f1: 0.4920
 epoch: 55, train_loss: 0.9614, test_loss: 0.9690, test_f1: 0.4853
 epoch: 56, train_loss: 0.9604, test_loss: 0.9587, test_f1: 0.5039
 epoch: 57, train_loss: 0.9515, test_loss: 0.9537, test_f1: 0.5078
 epoch: 58, train_loss: 0.9603, test_loss: 0.9542, test_f1: 0.4936
 epoch: 59, train_loss: 0.9535, test_loss: 0.9579, test_f1: 0.5203
 epoch: 60, train_loss: 0.9592, test_loss: 0.9477, test_f1: 0.5065
 epoch: 61, train_loss: 0.9560, test_loss: 0.9509, test_f1: 0.5073
 epoch: 62, train_loss: 0.9505, test_loss: 0.9671, test_f1: 0.5034
 epoch: 63, train_loss: 0.9533, test_loss: 0.9672, test_f1: 0.5098
 epoch: 64, train_loss: 0.9415, test_loss: 0.9304, test_f1: 0.5179
 epoch: 65, train_loss: 0.9507, test_loss: 0.9576, test_f1: 0.5101
 epoch: 66, train_loss: 0.9466, test_loss: 0.9538, test_f1: 0.5117
 epoch: 67, train_loss: 0.9454, test_loss: 0.9473, test_f1: 0.5105
 epoch: 68, train_loss: 0.9435, test_loss: 0.9483, test_f1: 0.5272
 epoch: 69, train_loss: 0.9513, test_loss: 0.9463, test_f1: 0.5167
 epoch: 70, train_loss: 0.9453, test_loss: 0.9417, test_f1: 0.5107
 epoch: 71, train_loss: 0.9495, test_loss: 0.9270, test_f1: 0.5134
 epoch: 72, train_loss: 0.9462, test_loss: 0.9200, test_f1: 0.5234
 epoch: 73, train_loss: 0.9402, test_loss: 0.9363, test_f1: 0.5235
 epoch: 74, train_loss: 0.9480, test_loss: 0.9009, test_f1: 0.5278
 epoch: 75, train_loss: 0.9406, test_loss: 0.9207, test_f1: 0.5240
 epoch: 76, train_loss: 0.9339, test_loss: 0.9375, test_f1: 0.5009
 epoch: 77, train_loss: 0.9427, test_loss: 0.9434, test_f1: 0.5084
 epoch: 78, train_loss: 0.9432, test_loss: 0.9209, test_f1: 0.5087
 epoch: 79, train_loss: 0.9390, test_loss: 0.9323, test_f1: 0.5195
 epoch: 80, train_loss: 0.9449, test_loss: 0.9362, test_f1: 0.5188
 epoch: 81, train_loss: 0.9424, test_loss: 0.9509, test_f1: 0.5197
 epoch: 82, train_loss: 0.9366, test_loss: 0.9412, test_f1: 0.5195
 epoch: 83, train_loss: 0.9417, test_loss: 0.9613, test_f1: 0.5237
 epoch: 84, train_loss: 0.9455, test_loss: 0.9324, test_f1: 0.5199
 epoch: 85, train_loss: 0.9365, test_loss: 0.9141, test_f1: 0.5312
 epoch: 86, train_loss: 0.9331, test_loss: 0.9122, test_f1: 0.5278
 epoch: 87, train_loss: 0.9421, test_loss: 0.9331, test_f1: 0.5196
 epoch: 88, train_loss: 0.9372, test_loss: 0.9309, test_f1: 0.5243
 epoch: 89, train_loss: 0.9383, test_loss: 0.9149, test_f1: 0.5190
 epoch: 90, train_loss: 0.9352, test_loss: 0.9089, test_f1: 0.5321
 epoch: 91, train_loss: 0.9349, test_loss: 0.9048, test_f1: 0.5293
 epoch: 92, train_loss: 0.9347, test_loss: 0.9087, test_f1: 0.5361
 epoch: 93, train_loss: 0.9319, test_loss: 0.9282, test_f1: 0.5305
 epoch: 94, train_loss: 0.9298, test_loss: 0.9418, test_f1: 0.5331
 epoch: 95, train_loss: 0.9291, test_loss: 0.9407, test_f1: 0.5203
 epoch: 96, train_loss: 0.9368, test_loss: 0.9202, test_f1: 0.5304
 epoch: 97, train_loss: 0.9255, test_loss: 0.9176, test_f1: 0.5264
 epoch: 98, train_loss: 0.9291, test_loss: 0.9111, test_f1: 0.5292
 epoch: 99, train_loss: 0.9248, test_loss: 0.9008, test_f1: 0.5236
##################ITERATION #4 ****************************************
 epoch: 0, train_loss: 1.3047, test_loss: 1.2581, test_f1: 0.2270
 epoch: 1, train_loss: 1.2457, test_loss: 1.2014, test_f1: 0.2936
 epoch: 2, train_loss: 1.2118, test_loss: 1.1693, test_f1: 0.3364
 epoch: 3, train_loss: 1.1830, test_loss: 1.1523, test_f1: 0.3422
 epoch: 4, train_loss: 1.1691, test_loss: 1.1337, test_f1: 0.3441
 epoch: 5, train_loss: 1.1547, test_loss: 1.1262, test_f1: 0.3441
 epoch: 6, train_loss: 1.1342, test_loss: 1.1094, test_f1: 0.3392
 epoch: 7, train_loss: 1.1279, test_loss: 1.0930, test_f1: 0.3431
 epoch: 8, train_loss: 1.1114, test_loss: 1.0852, test_f1: 0.3407
 epoch: 9, train_loss: 1.1014, test_loss: 1.0787, test_f1: 0.3441
 epoch: 10, train_loss: 1.0907, test_loss: 1.0713, test_f1: 0.3402
 epoch: 11, train_loss: 1.0796, test_loss: 1.0668, test_f1: 0.3372
 epoch: 12, train_loss: 1.0721, test_loss: 1.0604, test_f1: 0.3408
 epoch: 13, train_loss: 1.0703, test_loss: 1.0523, test_f1: 0.3438
 epoch: 14, train_loss: 1.0582, test_loss: 1.0539, test_f1: 0.3502
 epoch: 15, train_loss: 1.0585, test_loss: 1.0503, test_f1: 0.3635
 epoch: 16, train_loss: 1.0563, test_loss: 1.0482, test_f1: 0.3657
 epoch: 17, train_loss: 1.0499, test_loss: 1.0452, test_f1: 0.3739
 epoch: 18, train_loss: 1.0509, test_loss: 1.0391, test_f1: 0.3834
 epoch: 19, train_loss: 1.0437, test_loss: 1.0464, test_f1: 0.3912
 epoch: 20, train_loss: 1.0357, test_loss: 1.0441, test_f1: 0.4054
 epoch: 21, train_loss: 1.0407, test_loss: 1.0312, test_f1: 0.4060
 epoch: 22, train_loss: 1.0410, test_loss: 1.0284, test_f1: 0.4088
 epoch: 23, train_loss: 1.0255, test_loss: 1.0265, test_f1: 0.4157
 epoch: 24, train_loss: 1.0245, test_loss: 1.0277, test_f1: 0.4208
 epoch: 25, train_loss: 1.0217, test_loss: 1.0327, test_f1: 0.4285
 epoch: 26, train_loss: 1.0179, test_loss: 1.0151, test_f1: 0.4270
 epoch: 27, train_loss: 1.0180, test_loss: 1.0249, test_f1: 0.4385
 epoch: 28, train_loss: 1.0101, test_loss: 1.0155, test_f1: 0.4416
 epoch: 29, train_loss: 1.0144, test_loss: 1.0149, test_f1: 0.4439
 epoch: 30, train_loss: 1.0003, test_loss: 1.0085, test_f1: 0.4407
 epoch: 31, train_loss: 1.0019, test_loss: 1.0186, test_f1: 0.4460
 epoch: 32, train_loss: 0.9954, test_loss: 1.0048, test_f1: 0.4526
 epoch: 33, train_loss: 0.9969, test_loss: 1.0147, test_f1: 0.4494
 epoch: 34, train_loss: 0.9949, test_loss: 1.0114, test_f1: 0.4421
 epoch: 35, train_loss: 0.9882, test_loss: 1.0050, test_f1: 0.4502
 epoch: 36, train_loss: 0.9917, test_loss: 0.9961, test_f1: 0.4449
 epoch: 37, train_loss: 0.9841, test_loss: 0.9993, test_f1: 0.4603
 epoch: 38, train_loss: 0.9874, test_loss: 0.9907, test_f1: 0.4626
 epoch: 39, train_loss: 0.9825, test_loss: 0.9971, test_f1: 0.4580
 epoch: 40, train_loss: 0.9878, test_loss: 0.9962, test_f1: 0.4685
 epoch: 41, train_loss: 0.9740, test_loss: 1.0032, test_f1: 0.4601
 epoch: 42, train_loss: 0.9832, test_loss: 0.9923, test_f1: 0.4684
 epoch: 43, train_loss: 0.9839, test_loss: 0.9948, test_f1: 0.4719
 epoch: 44, train_loss: 0.9738, test_loss: 1.0123, test_f1: 0.4726
 epoch: 45, train_loss: 0.9709, test_loss: 0.9851, test_f1: 0.4807
 epoch: 46, train_loss: 0.9724, test_loss: 0.9923, test_f1: 0.4779
 epoch: 47, train_loss: 0.9763, test_loss: 0.9973, test_f1: 0.4806
 epoch: 48, train_loss: 0.9691, test_loss: 0.9924, test_f1: 0.4650
 epoch: 49, train_loss: 0.9628, test_loss: 0.9962, test_f1: 0.4851
 epoch: 50, train_loss: 0.9657, test_loss: 0.9800, test_f1: 0.4770
 epoch: 51, train_loss: 0.9630, test_loss: 0.9967, test_f1: 0.4814
 epoch: 52, train_loss: 0.9669, test_loss: 0.9884, test_f1: 0.4751
 epoch: 53, train_loss: 0.9734, test_loss: 0.9853, test_f1: 0.4803
 epoch: 54, train_loss: 0.9602, test_loss: 0.9852, test_f1: 0.4753
 epoch: 55, train_loss: 0.9619, test_loss: 0.9975, test_f1: 0.4897
 epoch: 56, train_loss: 0.9614, test_loss: 0.9676, test_f1: 0.4798
 epoch: 57, train_loss: 0.9556, test_loss: 0.9836, test_f1: 0.4808
 epoch: 58, train_loss: 0.9673, test_loss: 1.0113, test_f1: 0.4780
 epoch: 59, train_loss: 0.9584, test_loss: 0.9788, test_f1: 0.4833
 epoch: 60, train_loss: 0.9586, test_loss: 0.9654, test_f1: 0.4776
 epoch: 61, train_loss: 0.9597, test_loss: 0.9704, test_f1: 0.4781
 epoch: 62, train_loss: 0.9542, test_loss: 0.9623, test_f1: 0.4798
 epoch: 63, train_loss: 0.9510, test_loss: 0.9814, test_f1: 0.4823
 epoch: 64, train_loss: 0.9551, test_loss: 0.9637, test_f1: 0.4835
 epoch: 65, train_loss: 0.9477, test_loss: 0.9784, test_f1: 0.4814
 epoch: 66, train_loss: 0.9475, test_loss: 0.9647, test_f1: 0.4861
 epoch: 67, train_loss: 0.9511, test_loss: 0.9762, test_f1: 0.4834
 epoch: 68, train_loss: 0.9487, test_loss: 0.9591, test_f1: 0.4741
 epoch: 69, train_loss: 0.9511, test_loss: 0.9715, test_f1: 0.4844
 epoch: 70, train_loss: 0.9508, test_loss: 0.9765, test_f1: 0.4841
 epoch: 71, train_loss: 0.9503, test_loss: 0.9593, test_f1: 0.4812
 epoch: 72, train_loss: 0.9521, test_loss: 0.9893, test_f1: 0.4906
 epoch: 73, train_loss: 0.9512, test_loss: 0.9756, test_f1: 0.4953
 epoch: 74, train_loss: 0.9522, test_loss: 0.9729, test_f1: 0.4868
 epoch: 75, train_loss: 0.9448, test_loss: 0.9757, test_f1: 0.4865
 epoch: 76, train_loss: 0.9493, test_loss: 0.9835, test_f1: 0.4851
 epoch: 77, train_loss: 0.9527, test_loss: 0.9785, test_f1: 0.4873
 epoch: 78, train_loss: 0.9507, test_loss: 0.9818, test_f1: 0.4866
 epoch: 79, train_loss: 0.9458, test_loss: 0.9817, test_f1: 0.4934
 epoch: 80, train_loss: 0.9436, test_loss: 0.9829, test_f1: 0.4898
 epoch: 81, train_loss: 0.9478, test_loss: 0.9805, test_f1: 0.4866
 epoch: 82, train_loss: 0.9457, test_loss: 0.9938, test_f1: 0.4838
 epoch: 83, train_loss: 0.9423, test_loss: 0.9845, test_f1: 0.4911
 epoch: 84, train_loss: 0.9417, test_loss: 0.9895, test_f1: 0.4804
 epoch: 85, train_loss: 0.9429, test_loss: 0.9959, test_f1: 0.4853
 epoch: 86, train_loss: 0.9369, test_loss: 1.0008, test_f1: 0.4875
 epoch: 87, train_loss: 0.9377, test_loss: 0.9923, test_f1: 0.4879
 epoch: 88, train_loss: 0.9355, test_loss: 0.9769, test_f1: 0.4898
 epoch: 89, train_loss: 0.9461, test_loss: 0.9813, test_f1: 0.4881
 epoch: 90, train_loss: 0.9418, test_loss: 0.9896, test_f1: 0.4893
 epoch: 91, train_loss: 0.9358, test_loss: 1.0119, test_f1: 0.4863
 epoch: 92, train_loss: 0.9346, test_loss: 0.9864, test_f1: 0.4908
 epoch: 93, train_loss: 0.9423, test_loss: 0.9405, test_f1: 0.4891
 epoch: 94, train_loss: 0.9393, test_loss: 0.9620, test_f1: 0.4845
 epoch: 95, train_loss: 0.9327, test_loss: 0.9690, test_f1: 0.4880
 epoch: 96, train_loss: 0.9291, test_loss: 1.0099, test_f1: 0.4842
 epoch: 97, train_loss: 0.9357, test_loss: 0.9766, test_f1: 0.4900
 epoch: 98, train_loss: 0.9307, test_loss: 0.9723, test_f1: 0.4861
 epoch: 99, train_loss: 0.9396, test_loss: 0.9633, test_f1: 0.4897
##################ITERATION #5 ****************************************
 epoch: 0, train_loss: 1.2941, test_loss: 1.2563, test_f1: 0.2270
 epoch: 1, train_loss: 1.2501, test_loss: 1.2271, test_f1: 0.2393
 epoch: 2, train_loss: 1.2370, test_loss: 1.2025, test_f1: 0.2670
 epoch: 3, train_loss: 1.2226, test_loss: 1.1815, test_f1: 0.2863
 epoch: 4, train_loss: 1.2056, test_loss: 1.1566, test_f1: 0.3223
 epoch: 5, train_loss: 1.1835, test_loss: 1.1396, test_f1: 0.3369
 epoch: 6, train_loss: 1.1652, test_loss: 1.1222, test_f1: 0.3569
 epoch: 7, train_loss: 1.1486, test_loss: 1.1040, test_f1: 0.3601
 epoch: 8, train_loss: 1.1431, test_loss: 1.1020, test_f1: 0.3651
 epoch: 9, train_loss: 1.1240, test_loss: 1.0922, test_f1: 0.3649
 epoch: 10, train_loss: 1.1165, test_loss: 1.0882, test_f1: 0.3668
 epoch: 11, train_loss: 1.1019, test_loss: 1.0799, test_f1: 0.3731
 epoch: 12, train_loss: 1.1025, test_loss: 1.0746, test_f1: 0.3784
 epoch: 13, train_loss: 1.0908, test_loss: 1.0693, test_f1: 0.3689
 epoch: 14, train_loss: 1.0790, test_loss: 1.0621, test_f1: 0.3817
 epoch: 15, train_loss: 1.0802, test_loss: 1.0671, test_f1: 0.3924
 epoch: 16, train_loss: 1.0771, test_loss: 1.0578, test_f1: 0.3954
 epoch: 17, train_loss: 1.0649, test_loss: 1.0509, test_f1: 0.4029
 epoch: 18, train_loss: 1.0660, test_loss: 1.0507, test_f1: 0.3990
 epoch: 19, train_loss: 1.0525, test_loss: 1.0584, test_f1: 0.3809
 epoch: 20, train_loss: 1.0549, test_loss: 1.0567, test_f1: 0.4006
 epoch: 21, train_loss: 1.0502, test_loss: 1.0553, test_f1: 0.4034
 epoch: 22, train_loss: 1.0429, test_loss: 1.0522, test_f1: 0.3899
 epoch: 23, train_loss: 1.0473, test_loss: 1.0632, test_f1: 0.3830
 epoch: 24, train_loss: 1.0426, test_loss: 1.0411, test_f1: 0.4136
 epoch: 25, train_loss: 1.0418, test_loss: 1.0484, test_f1: 0.4075
 epoch: 26, train_loss: 1.0429, test_loss: 1.0438, test_f1: 0.4084
 epoch: 27, train_loss: 1.0273, test_loss: 1.0532, test_f1: 0.3970
 epoch: 28, train_loss: 1.0289, test_loss: 1.0333, test_f1: 0.4186
 epoch: 29, train_loss: 1.0262, test_loss: 1.0462, test_f1: 0.4307
 epoch: 30, train_loss: 1.0218, test_loss: 1.0216, test_f1: 0.4485
 epoch: 31, train_loss: 1.0294, test_loss: 1.0293, test_f1: 0.4462
 epoch: 32, train_loss: 1.0234, test_loss: 1.0270, test_f1: 0.4204
 epoch: 33, train_loss: 1.0170, test_loss: 1.0091, test_f1: 0.4372
 epoch: 34, train_loss: 1.0154, test_loss: 1.0177, test_f1: 0.4610
 epoch: 35, train_loss: 1.0094, test_loss: 1.0341, test_f1: 0.4646
 epoch: 36, train_loss: 1.0075, test_loss: 1.0321, test_f1: 0.4524
 epoch: 37, train_loss: 1.0036, test_loss: 1.0238, test_f1: 0.4483
 epoch: 38, train_loss: 1.0050, test_loss: 1.0160, test_f1: 0.4338
 epoch: 39, train_loss: 1.0086, test_loss: 1.0329, test_f1: 0.4156
 epoch: 40, train_loss: 0.9998, test_loss: 1.0039, test_f1: 0.4617
 epoch: 41, train_loss: 0.9953, test_loss: 1.0151, test_f1: 0.4520
 epoch: 42, train_loss: 0.9971, test_loss: 0.9971, test_f1: 0.4697
 epoch: 43, train_loss: 0.9962, test_loss: 1.0013, test_f1: 0.4649
 epoch: 44, train_loss: 0.9964, test_loss: 1.0091, test_f1: 0.4567
 epoch: 45, train_loss: 0.9859, test_loss: 1.0103, test_f1: 0.4594
 epoch: 46, train_loss: 0.9971, test_loss: 0.9916, test_f1: 0.4814
 epoch: 47, train_loss: 0.9847, test_loss: 1.0060, test_f1: 0.4617
 epoch: 48, train_loss: 0.9877, test_loss: 0.9949, test_f1: 0.4557
 epoch: 49, train_loss: 0.9779, test_loss: 0.9835, test_f1: 0.4685
 epoch: 50, train_loss: 0.9786, test_loss: 0.9899, test_f1: 0.4862
 epoch: 51, train_loss: 0.9829, test_loss: 0.9933, test_f1: 0.4688
 epoch: 52, train_loss: 0.9764, test_loss: 0.9806, test_f1: 0.4917
 epoch: 53, train_loss: 0.9752, test_loss: 0.9957, test_f1: 0.4721
 epoch: 54, train_loss: 0.9651, test_loss: 0.9685, test_f1: 0.4865
 epoch: 55, train_loss: 0.9773, test_loss: 0.9849, test_f1: 0.4810
 epoch: 56, train_loss: 0.9689, test_loss: 0.9646, test_f1: 0.4858
 epoch: 57, train_loss: 0.9697, test_loss: 0.9728, test_f1: 0.4835
 epoch: 58, train_loss: 0.9671, test_loss: 0.9702, test_f1: 0.4821
 epoch: 59, train_loss: 0.9714, test_loss: 0.9740, test_f1: 0.4967
 epoch: 60, train_loss: 0.9665, test_loss: 0.9685, test_f1: 0.4955
 epoch: 61, train_loss: 0.9664, test_loss: 0.9522, test_f1: 0.4898
 epoch: 62, train_loss: 0.9622, test_loss: 0.9675, test_f1: 0.4805
 epoch: 63, train_loss: 0.9609, test_loss: 0.9701, test_f1: 0.4687
 epoch: 64, train_loss: 0.9528, test_loss: 0.9280, test_f1: 0.5058
 epoch: 65, train_loss: 0.9586, test_loss: 0.9434, test_f1: 0.5003
 epoch: 66, train_loss: 0.9563, test_loss: 0.9569, test_f1: 0.4859
 epoch: 67, train_loss: 0.9546, test_loss: 0.9397, test_f1: 0.4940
 epoch: 68, train_loss: 0.9605, test_loss: 0.9380, test_f1: 0.4912
 epoch: 69, train_loss: 0.9663, test_loss: 0.9555, test_f1: 0.4720
 epoch: 70, train_loss: 0.9549, test_loss: 0.9367, test_f1: 0.4875
 epoch: 71, train_loss: 0.9480, test_loss: 0.9480, test_f1: 0.4781
 epoch: 72, train_loss: 0.9538, test_loss: 0.9310, test_f1: 0.4975
 epoch: 73, train_loss: 0.9555, test_loss: 0.9420, test_f1: 0.4927
 epoch: 74, train_loss: 0.9528, test_loss: 0.9365, test_f1: 0.4956
 epoch: 75, train_loss: 0.9544, test_loss: 0.9356, test_f1: 0.4967
 epoch: 76, train_loss: 0.9534, test_loss: 0.9537, test_f1: 0.4698
 epoch: 77, train_loss: 0.9595, test_loss: 0.9449, test_f1: 0.4736
 epoch: 78, train_loss: 0.9475, test_loss: 0.9517, test_f1: 0.4932
 epoch: 79, train_loss: 0.9574, test_loss: 0.9325, test_f1: 0.5084
 epoch: 80, train_loss: 0.9455, test_loss: 0.9358, test_f1: 0.4850
 epoch: 81, train_loss: 0.9520, test_loss: 0.9299, test_f1: 0.4987
 epoch: 82, train_loss: 0.9499, test_loss: 0.9380, test_f1: 0.4898
 epoch: 83, train_loss: 0.9500, test_loss: 0.9202, test_f1: 0.5302
 epoch: 84, train_loss: 0.9586, test_loss: 0.9439, test_f1: 0.5050
 epoch: 85, train_loss: 0.9490, test_loss: 0.9283, test_f1: 0.4700
 epoch: 86, train_loss: 0.9498, test_loss: 0.9341, test_f1: 0.4936
 epoch: 87, train_loss: 0.9410, test_loss: 0.9253, test_f1: 0.4979
 epoch: 88, train_loss: 0.9516, test_loss: 0.9184, test_f1: 0.4852
 epoch: 89, train_loss: 0.9440, test_loss: 0.9367, test_f1: 0.4861
 epoch: 90, train_loss: 0.9432, test_loss: 0.9451, test_f1: 0.4923
 epoch: 91, train_loss: 0.9466, test_loss: 0.9347, test_f1: 0.5037
 epoch: 92, train_loss: 0.9397, test_loss: 0.9244, test_f1: 0.4723
 epoch: 93, train_loss: 0.9468, test_loss: 0.9596, test_f1: 0.5073
 epoch: 94, train_loss: 0.9413, test_loss: 0.9209, test_f1: 0.4915
 epoch: 95, train_loss: 0.9367, test_loss: 0.9248, test_f1: 0.5069
 epoch: 96, train_loss: 0.9420, test_loss: 0.9494, test_f1: 0.4859
 epoch: 97, train_loss: 0.9468, test_loss: 0.9439, test_f1: 0.5038
 epoch: 98, train_loss: 0.9411, test_loss: 0.9367, test_f1: 0.5152
 epoch: 99, train_loss: 0.9392, test_loss: 0.9227, test_f1: 0.4884
##################ITERATION #6 ****************************************
 epoch: 0, train_loss: 1.2943, test_loss: 1.2174, test_f1: 0.2416
 epoch: 1, train_loss: 1.2363, test_loss: 1.1923, test_f1: 0.2952
 epoch: 2, train_loss: 1.1950, test_loss: 1.1608, test_f1: 0.3382
 epoch: 3, train_loss: 1.1898, test_loss: 1.1370, test_f1: 0.3536
 epoch: 4, train_loss: 1.1624, test_loss: 1.1166, test_f1: 0.3554
 epoch: 5, train_loss: 1.1451, test_loss: 1.1035, test_f1: 0.3560
 epoch: 6, train_loss: 1.1285, test_loss: 1.0858, test_f1: 0.3527
 epoch: 7, train_loss: 1.1126, test_loss: 1.0723, test_f1: 0.3503
 epoch: 8, train_loss: 1.1050, test_loss: 1.0590, test_f1: 0.3852
 epoch: 9, train_loss: 1.0918, test_loss: 1.0542, test_f1: 0.3849
 epoch: 10, train_loss: 1.0875, test_loss: 1.0464, test_f1: 0.3811
 epoch: 11, train_loss: 1.0776, test_loss: 1.0424, test_f1: 0.4195
 epoch: 12, train_loss: 1.0723, test_loss: 1.0468, test_f1: 0.4056
 epoch: 13, train_loss: 1.0542, test_loss: 1.0279, test_f1: 0.4123
 epoch: 14, train_loss: 1.0655, test_loss: 1.0311, test_f1: 0.4109
 epoch: 15, train_loss: 1.0555, test_loss: 1.0477, test_f1: 0.4437
 epoch: 16, train_loss: 1.0417, test_loss: 1.0232, test_f1: 0.4352
 epoch: 17, train_loss: 1.0491, test_loss: 1.0272, test_f1: 0.4236
 epoch: 18, train_loss: 1.0438, test_loss: 1.0199, test_f1: 0.4294
 epoch: 19, train_loss: 1.0345, test_loss: 1.0252, test_f1: 0.4407
 epoch: 20, train_loss: 1.0321, test_loss: 1.0294, test_f1: 0.4511
 epoch: 21, train_loss: 1.0310, test_loss: 1.0172, test_f1: 0.4587
 epoch: 22, train_loss: 1.0246, test_loss: 1.0240, test_f1: 0.4654
 epoch: 23, train_loss: 1.0212, test_loss: 1.0217, test_f1: 0.4476
 epoch: 24, train_loss: 1.0186, test_loss: 1.0105, test_f1: 0.4658
 epoch: 25, train_loss: 1.0169, test_loss: 1.0080, test_f1: 0.4630
 epoch: 26, train_loss: 1.0077, test_loss: 1.0189, test_f1: 0.4643
 epoch: 27, train_loss: 1.0126, test_loss: 1.0056, test_f1: 0.4893
 epoch: 28, train_loss: 1.0076, test_loss: 1.0088, test_f1: 0.4670
 epoch: 29, train_loss: 1.0006, test_loss: 0.9966, test_f1: 0.4589
 epoch: 30, train_loss: 1.0021, test_loss: 1.0116, test_f1: 0.4781
 epoch: 31, train_loss: 0.9947, test_loss: 0.9934, test_f1: 0.4667
 epoch: 32, train_loss: 1.0076, test_loss: 0.9973, test_f1: 0.4339
 epoch: 33, train_loss: 0.9933, test_loss: 0.9972, test_f1: 0.4652
 epoch: 34, train_loss: 0.9960, test_loss: 0.9964, test_f1: 0.4637
 epoch: 35, train_loss: 0.9886, test_loss: 1.0034, test_f1: 0.4737
 epoch: 36, train_loss: 0.9924, test_loss: 0.9850, test_f1: 0.4635
 epoch: 37, train_loss: 0.9831, test_loss: 1.0037, test_f1: 0.4700
 epoch: 38, train_loss: 0.9853, test_loss: 0.9986, test_f1: 0.4762
 epoch: 39, train_loss: 0.9826, test_loss: 0.9784, test_f1: 0.4816
 epoch: 40, train_loss: 0.9861, test_loss: 1.0033, test_f1: 0.4677
 epoch: 41, train_loss: 0.9816, test_loss: 0.9847, test_f1: 0.4556
 epoch: 42, train_loss: 0.9824, test_loss: 0.9986, test_f1: 0.4571
 epoch: 43, train_loss: 0.9728, test_loss: 0.9938, test_f1: 0.4736
 epoch: 44, train_loss: 0.9736, test_loss: 0.9819, test_f1: 0.4603
 epoch: 45, train_loss: 0.9696, test_loss: 0.9828, test_f1: 0.4747
 epoch: 46, train_loss: 0.9665, test_loss: 0.9692, test_f1: 0.4790
 epoch: 47, train_loss: 0.9663, test_loss: 0.9826, test_f1: 0.4682
 epoch: 48, train_loss: 0.9740, test_loss: 0.9780, test_f1: 0.4741
 epoch: 49, train_loss: 0.9668, test_loss: 0.9882, test_f1: 0.4728
 epoch: 50, train_loss: 0.9680, test_loss: 0.9915, test_f1: 0.4726
 epoch: 51, train_loss: 0.9616, test_loss: 0.9880, test_f1: 0.4646
 epoch: 52, train_loss: 0.9607, test_loss: 0.9709, test_f1: 0.4698
 epoch: 53, train_loss: 0.9591, test_loss: 0.9666, test_f1: 0.4740
 epoch: 54, train_loss: 0.9629, test_loss: 0.9797, test_f1: 0.4682
 epoch: 55, train_loss: 0.9509, test_loss: 0.9657, test_f1: 0.4750
 epoch: 56, train_loss: 0.9523, test_loss: 0.9759, test_f1: 0.4741
 epoch: 57, train_loss: 0.9604, test_loss: 0.9743, test_f1: 0.4626
 epoch: 58, train_loss: 0.9568, test_loss: 0.9795, test_f1: 0.4841
 epoch: 59, train_loss: 0.9535, test_loss: 0.9667, test_f1: 0.4726
 epoch: 60, train_loss: 0.9506, test_loss: 0.9728, test_f1: 0.4708
 epoch: 61, train_loss: 0.9580, test_loss: 0.9657, test_f1: 0.4829
 epoch: 62, train_loss: 0.9525, test_loss: 0.9692, test_f1: 0.4793
 epoch: 63, train_loss: 0.9505, test_loss: 0.9625, test_f1: 0.4694
 epoch: 64, train_loss: 0.9459, test_loss: 0.9565, test_f1: 0.4829
 epoch: 65, train_loss: 0.9517, test_loss: 0.9706, test_f1: 0.4724
 epoch: 66, train_loss: 0.9565, test_loss: 0.9746, test_f1: 0.4664
 epoch: 67, train_loss: 0.9476, test_loss: 0.9722, test_f1: 0.4836
 epoch: 68, train_loss: 0.9441, test_loss: 0.9654, test_f1: 0.4763
 epoch: 69, train_loss: 0.9498, test_loss: 0.9655, test_f1: 0.4802
 epoch: 70, train_loss: 0.9480, test_loss: 0.9692, test_f1: 0.4620
 epoch: 71, train_loss: 0.9470, test_loss: 0.9718, test_f1: 0.4895
 epoch: 72, train_loss: 0.9454, test_loss: 0.9595, test_f1: 0.4875
 epoch: 73, train_loss: 0.9393, test_loss: 0.9719, test_f1: 0.4727
 epoch: 74, train_loss: 0.9510, test_loss: 0.9638, test_f1: 0.4738
 epoch: 75, train_loss: 0.9430, test_loss: 0.9632, test_f1: 0.4749
 epoch: 76, train_loss: 0.9418, test_loss: 0.9588, test_f1: 0.4807
 epoch: 77, train_loss: 0.9425, test_loss: 0.9623, test_f1: 0.4775
 epoch: 78, train_loss: 0.9363, test_loss: 0.9612, test_f1: 0.4776
 epoch: 79, train_loss: 0.9339, test_loss: 0.9630, test_f1: 0.4880
 epoch: 80, train_loss: 0.9378, test_loss: 0.9617, test_f1: 0.4838
 epoch: 81, train_loss: 0.9389, test_loss: 0.9649, test_f1: 0.4851
 epoch: 82, train_loss: 0.9326, test_loss: 0.9725, test_f1: 0.4945
 epoch: 83, train_loss: 0.9375, test_loss: 0.9541, test_f1: 0.4864
 epoch: 84, train_loss: 0.9345, test_loss: 0.9529, test_f1: 0.4896
 epoch: 85, train_loss: 0.9342, test_loss: 0.9730, test_f1: 0.4773
 epoch: 86, train_loss: 0.9277, test_loss: 0.9682, test_f1: 0.4786
 epoch: 87, train_loss: 0.9301, test_loss: 0.9720, test_f1: 0.4828
 epoch: 88, train_loss: 0.9206, test_loss: 0.9582, test_f1: 0.4808
 epoch: 89, train_loss: 0.9389, test_loss: 0.9544, test_f1: 0.4798
 epoch: 90, train_loss: 0.9328, test_loss: 0.9645, test_f1: 0.4837
 epoch: 91, train_loss: 0.9317, test_loss: 0.9376, test_f1: 0.4891
 epoch: 92, train_loss: 0.9321, test_loss: 0.9504, test_f1: 0.4877
 epoch: 93, train_loss: 0.9312, test_loss: 0.9289, test_f1: 0.4892
 epoch: 94, train_loss: 0.9197, test_loss: 0.9453, test_f1: 0.4816
 epoch: 95, train_loss: 0.9235, test_loss: 0.9339, test_f1: 0.4833
 epoch: 96, train_loss: 0.9335, test_loss: 0.9444, test_f1: 0.4838
 epoch: 97, train_loss: 0.9222, test_loss: 0.9463, test_f1: 0.4876
 epoch: 98, train_loss: 0.9150, test_loss: 0.9407, test_f1: 0.4884
 epoch: 99, train_loss: 0.9186, test_loss: 0.9367, test_f1: 0.4869
##################ITERATION #7 ****************************************
 epoch: 0, train_loss: 1.3381, test_loss: 1.2442, test_f1: 0.2321
 epoch: 1, train_loss: 1.2428, test_loss: 1.1965, test_f1: 0.2558
 epoch: 2, train_loss: 1.2091, test_loss: 1.1459, test_f1: 0.3126
 epoch: 3, train_loss: 1.1778, test_loss: 1.1128, test_f1: 0.3329
 epoch: 4, train_loss: 1.1557, test_loss: 1.0861, test_f1: 0.3394
 epoch: 5, train_loss: 1.1273, test_loss: 1.0675, test_f1: 0.3421
 epoch: 6, train_loss: 1.1134, test_loss: 1.0595, test_f1: 0.3422
 epoch: 7, train_loss: 1.1026, test_loss: 1.0434, test_f1: 0.3509
 epoch: 8, train_loss: 1.0914, test_loss: 1.0451, test_f1: 0.3419
 epoch: 9, train_loss: 1.0863, test_loss: 1.0350, test_f1: 0.3603
 epoch: 10, train_loss: 1.0762, test_loss: 1.0231, test_f1: 0.3677
 epoch: 11, train_loss: 1.0645, test_loss: 1.0267, test_f1: 0.3692
 epoch: 12, train_loss: 1.0661, test_loss: 1.0188, test_f1: 0.3888
 epoch: 13, train_loss: 1.0524, test_loss: 1.0126, test_f1: 0.4029
 epoch: 14, train_loss: 1.0546, test_loss: 1.0125, test_f1: 0.4162
 epoch: 15, train_loss: 1.0528, test_loss: 1.0081, test_f1: 0.4187
 epoch: 16, train_loss: 1.0390, test_loss: 1.0001, test_f1: 0.4407
 epoch: 17, train_loss: 1.0408, test_loss: 1.0040, test_f1: 0.4245
 epoch: 18, train_loss: 1.0309, test_loss: 0.9925, test_f1: 0.4291
 epoch: 19, train_loss: 1.0291, test_loss: 0.9965, test_f1: 0.4476
 epoch: 20, train_loss: 1.0254, test_loss: 0.9998, test_f1: 0.4489
 epoch: 21, train_loss: 1.0248, test_loss: 0.9966, test_f1: 0.4476
 epoch: 22, train_loss: 1.0123, test_loss: 0.9932, test_f1: 0.4617
 epoch: 23, train_loss: 1.0318, test_loss: 0.9891, test_f1: 0.4514
 epoch: 24, train_loss: 1.0222, test_loss: 0.9838, test_f1: 0.4707
 epoch: 25, train_loss: 1.0098, test_loss: 0.9921, test_f1: 0.4528
 epoch: 26, train_loss: 1.0040, test_loss: 0.9826, test_f1: 0.4678
 epoch: 27, train_loss: 1.0059, test_loss: 0.9843, test_f1: 0.4763
 epoch: 28, train_loss: 1.0112, test_loss: 0.9958, test_f1: 0.4365
 epoch: 29, train_loss: 1.0041, test_loss: 0.9870, test_f1: 0.4610
 epoch: 30, train_loss: 1.0071, test_loss: 0.9869, test_f1: 0.4675
 epoch: 31, train_loss: 1.0002, test_loss: 0.9767, test_f1: 0.4813
 epoch: 32, train_loss: 0.9997, test_loss: 0.9831, test_f1: 0.4716
 epoch: 33, train_loss: 0.9903, test_loss: 0.9782, test_f1: 0.4675
 epoch: 34, train_loss: 0.9900, test_loss: 0.9803, test_f1: 0.4769
 epoch: 35, train_loss: 0.9822, test_loss: 0.9799, test_f1: 0.4684
 epoch: 36, train_loss: 0.9829, test_loss: 0.9712, test_f1: 0.4806
 epoch: 37, train_loss: 0.9854, test_loss: 0.9722, test_f1: 0.4565
 epoch: 38, train_loss: 0.9813, test_loss: 0.9831, test_f1: 0.4765
 epoch: 39, train_loss: 0.9855, test_loss: 0.9756, test_f1: 0.4668
 epoch: 40, train_loss: 0.9775, test_loss: 0.9737, test_f1: 0.4705
 epoch: 41, train_loss: 0.9896, test_loss: 0.9643, test_f1: 0.4749
 epoch: 42, train_loss: 0.9843, test_loss: 0.9620, test_f1: 0.4798
 epoch: 43, train_loss: 0.9705, test_loss: 0.9596, test_f1: 0.4766
 epoch: 44, train_loss: 0.9703, test_loss: 0.9654, test_f1: 0.4976
 epoch: 45, train_loss: 0.9698, test_loss: 0.9543, test_f1: 0.4977
 epoch: 46, train_loss: 0.9668, test_loss: 0.9614, test_f1: 0.4681
 epoch: 47, train_loss: 0.9682, test_loss: 0.9571, test_f1: 0.5031
 epoch: 48, train_loss: 0.9679, test_loss: 0.9669, test_f1: 0.4952
 epoch: 49, train_loss: 0.9785, test_loss: 0.9783, test_f1: 0.4934
 epoch: 50, train_loss: 0.9619, test_loss: 0.9696, test_f1: 0.4948
 epoch: 51, train_loss: 0.9574, test_loss: 0.9572, test_f1: 0.4986
 epoch: 52, train_loss: 0.9645, test_loss: 0.9668, test_f1: 0.4984
 epoch: 53, train_loss: 0.9698, test_loss: 0.9637, test_f1: 0.4923
 epoch: 54, train_loss: 0.9634, test_loss: 0.9733, test_f1: 0.5005
 epoch: 55, train_loss: 0.9591, test_loss: 0.9642, test_f1: 0.5002
 epoch: 56, train_loss: 0.9613, test_loss: 0.9762, test_f1: 0.5062
 epoch: 57, train_loss: 0.9658, test_loss: 0.9637, test_f1: 0.5048
 epoch: 58, train_loss: 0.9577, test_loss: 0.9601, test_f1: 0.5093
 epoch: 59, train_loss: 0.9614, test_loss: 0.9567, test_f1: 0.5074
 epoch: 60, train_loss: 0.9546, test_loss: 0.9524, test_f1: 0.5015
 epoch: 61, train_loss: 0.9541, test_loss: 0.9663, test_f1: 0.4962
 epoch: 62, train_loss: 0.9470, test_loss: 0.9604, test_f1: 0.5088
 epoch: 63, train_loss: 0.9607, test_loss: 0.9638, test_f1: 0.5015
 epoch: 64, train_loss: 0.9510, test_loss: 0.9635, test_f1: 0.4956
 epoch: 65, train_loss: 0.9531, test_loss: 0.9577, test_f1: 0.4957
 epoch: 66, train_loss: 0.9584, test_loss: 0.9837, test_f1: 0.5072
 epoch: 67, train_loss: 0.9449, test_loss: 0.9913, test_f1: 0.4968
 epoch: 68, train_loss: 0.9433, test_loss: 0.9732, test_f1: 0.4954
 epoch: 69, train_loss: 0.9640, test_loss: 0.9648, test_f1: 0.4992
 epoch: 70, train_loss: 0.9491, test_loss: 0.9629, test_f1: 0.5046
 epoch: 71, train_loss: 0.9510, test_loss: 0.9698, test_f1: 0.5054
 epoch: 72, train_loss: 0.9524, test_loss: 0.9613, test_f1: 0.5018
 epoch: 73, train_loss: 0.9507, test_loss: 0.9741, test_f1: 0.4996
 epoch: 74, train_loss: 0.9473, test_loss: 0.9589, test_f1: 0.5009
 epoch: 75, train_loss: 0.9485, test_loss: 0.9543, test_f1: 0.5109
 epoch: 76, train_loss: 0.9432, test_loss: 0.9591, test_f1: 0.5120
 epoch: 77, train_loss: 0.9481, test_loss: 0.9624, test_f1: 0.5011
 epoch: 78, train_loss: 0.9447, test_loss: 0.9519, test_f1: 0.5073
 epoch: 79, train_loss: 0.9387, test_loss: 0.9694, test_f1: 0.4983
 epoch: 80, train_loss: 0.9486, test_loss: 0.9539, test_f1: 0.5027
 epoch: 81, train_loss: 0.9395, test_loss: 0.9610, test_f1: 0.4977
 epoch: 82, train_loss: 0.9479, test_loss: 0.9473, test_f1: 0.5082
 epoch: 83, train_loss: 0.9405, test_loss: 0.9452, test_f1: 0.5116
 epoch: 84, train_loss: 0.9435, test_loss: 0.9598, test_f1: 0.4974
 epoch: 85, train_loss: 0.9497, test_loss: 0.9520, test_f1: 0.5076
 epoch: 86, train_loss: 0.9454, test_loss: 0.9754, test_f1: 0.5134
 epoch: 87, train_loss: 0.9417, test_loss: 0.9557, test_f1: 0.5123
 epoch: 88, train_loss: 0.9332, test_loss: 0.9500, test_f1: 0.5055
 epoch: 89, train_loss: 0.9395, test_loss: 0.9533, test_f1: 0.5045
 epoch: 90, train_loss: 0.9451, test_loss: 0.9655, test_f1: 0.5099
 epoch: 91, train_loss: 0.9365, test_loss: 0.9603, test_f1: 0.5007
 epoch: 92, train_loss: 0.9430, test_loss: 0.9694, test_f1: 0.4981
 epoch: 93, train_loss: 0.9345, test_loss: 0.9463, test_f1: 0.5108
 epoch: 94, train_loss: 0.9474, test_loss: 0.9717, test_f1: 0.5084
 epoch: 95, train_loss: 0.9308, test_loss: 0.9623, test_f1: 0.5105
 epoch: 96, train_loss: 0.9388, test_loss: 0.9750, test_f1: 0.5062
 epoch: 97, train_loss: 0.9346, test_loss: 0.9563, test_f1: 0.5092
 epoch: 98, train_loss: 0.9363, test_loss: 0.9566, test_f1: 0.5114
 epoch: 99, train_loss: 0.9330, test_loss: 0.9525, test_f1: 0.5121
##################ITERATION #8 ****************************************
 epoch: 0, train_loss: 1.3050, test_loss: 1.1657, test_f1: 0.3092
 epoch: 1, train_loss: 1.1993, test_loss: 1.1295, test_f1: 0.3271
 epoch: 2, train_loss: 1.1785, test_loss: 1.1159, test_f1: 0.3275
 epoch: 3, train_loss: 1.1550, test_loss: 1.1000, test_f1: 0.3315
 epoch: 4, train_loss: 1.1410, test_loss: 1.0877, test_f1: 0.3340
 epoch: 5, train_loss: 1.1306, test_loss: 1.0767, test_f1: 0.3526
 epoch: 6, train_loss: 1.1277, test_loss: 1.0681, test_f1: 0.3529
 epoch: 7, train_loss: 1.1140, test_loss: 1.0585, test_f1: 0.3841
 epoch: 8, train_loss: 1.1001, test_loss: 1.0584, test_f1: 0.3848
 epoch: 9, train_loss: 1.0963, test_loss: 1.0407, test_f1: 0.4098
 epoch: 10, train_loss: 1.0800, test_loss: 1.0302, test_f1: 0.4035
 epoch: 11, train_loss: 1.0751, test_loss: 1.0233, test_f1: 0.4186
 epoch: 12, train_loss: 1.0737, test_loss: 1.0161, test_f1: 0.4244
 epoch: 13, train_loss: 1.0562, test_loss: 1.0149, test_f1: 0.4333
 epoch: 14, train_loss: 1.0623, test_loss: 1.0140, test_f1: 0.4283
 epoch: 15, train_loss: 1.0459, test_loss: 1.0131, test_f1: 0.4227
 epoch: 16, train_loss: 1.0508, test_loss: 1.0122, test_f1: 0.4310
 epoch: 17, train_loss: 1.0440, test_loss: 1.0011, test_f1: 0.4419
 epoch: 18, train_loss: 1.0354, test_loss: 1.0156, test_f1: 0.4312
 epoch: 19, train_loss: 1.0295, test_loss: 1.0113, test_f1: 0.4393
 epoch: 20, train_loss: 1.0320, test_loss: 1.0087, test_f1: 0.4430
 epoch: 21, train_loss: 1.0176, test_loss: 0.9995, test_f1: 0.4454
 epoch: 22, train_loss: 1.0241, test_loss: 0.9940, test_f1: 0.4437
 epoch: 23, train_loss: 1.0202, test_loss: 0.9970, test_f1: 0.4511
 epoch: 24, train_loss: 1.0156, test_loss: 0.9951, test_f1: 0.4467
 epoch: 25, train_loss: 1.0069, test_loss: 0.9919, test_f1: 0.4580
 epoch: 26, train_loss: 1.0026, test_loss: 0.9900, test_f1: 0.4540
 epoch: 27, train_loss: 1.0069, test_loss: 1.0036, test_f1: 0.4586
 epoch: 28, train_loss: 1.0055, test_loss: 1.0042, test_f1: 0.4661
 epoch: 29, train_loss: 1.0088, test_loss: 0.9940, test_f1: 0.4505
 epoch: 30, train_loss: 1.0040, test_loss: 0.9931, test_f1: 0.4590
 epoch: 31, train_loss: 0.9996, test_loss: 0.9980, test_f1: 0.4734
 epoch: 32, train_loss: 0.9981, test_loss: 0.9768, test_f1: 0.4646
 epoch: 33, train_loss: 0.9915, test_loss: 0.9867, test_f1: 0.4550
 epoch: 34, train_loss: 0.9742, test_loss: 0.9836, test_f1: 0.4659
 epoch: 35, train_loss: 0.9857, test_loss: 0.9941, test_f1: 0.4996
 epoch: 36, train_loss: 0.9923, test_loss: 0.9783, test_f1: 0.4917
 epoch: 37, train_loss: 0.9803, test_loss: 0.9811, test_f1: 0.4883
 epoch: 38, train_loss: 0.9751, test_loss: 0.9837, test_f1: 0.4869
 epoch: 39, train_loss: 0.9819, test_loss: 0.9822, test_f1: 0.4925
 epoch: 40, train_loss: 0.9747, test_loss: 0.9749, test_f1: 0.5040
 epoch: 41, train_loss: 0.9816, test_loss: 0.9792, test_f1: 0.4980
 epoch: 42, train_loss: 0.9721, test_loss: 0.9748, test_f1: 0.4945
 epoch: 43, train_loss: 0.9679, test_loss: 0.9581, test_f1: 0.4927
 epoch: 44, train_loss: 0.9740, test_loss: 0.9732, test_f1: 0.4939
 epoch: 45, train_loss: 0.9712, test_loss: 0.9560, test_f1: 0.5152
 epoch: 46, train_loss: 0.9700, test_loss: 0.9738, test_f1: 0.5032
 epoch: 47, train_loss: 0.9665, test_loss: 0.9290, test_f1: 0.5129
 epoch: 48, train_loss: 0.9647, test_loss: 0.9313, test_f1: 0.4928
 epoch: 49, train_loss: 0.9682, test_loss: 0.9268, test_f1: 0.4962
 epoch: 50, train_loss: 0.9633, test_loss: 0.9619, test_f1: 0.5114
 epoch: 51, train_loss: 0.9436, test_loss: 0.9408, test_f1: 0.5159
 epoch: 52, train_loss: 0.9559, test_loss: 0.9403, test_f1: 0.5229
 epoch: 53, train_loss: 0.9591, test_loss: 0.9467, test_f1: 0.5159
 epoch: 54, train_loss: 0.9502, test_loss: 0.9392, test_f1: 0.5222
 epoch: 55, train_loss: 0.9614, test_loss: 0.9486, test_f1: 0.5192
 epoch: 56, train_loss: 0.9414, test_loss: 0.9359, test_f1: 0.5217
 epoch: 57, train_loss: 0.9556, test_loss: 0.9302, test_f1: 0.5194
 epoch: 58, train_loss: 0.9530, test_loss: 0.9382, test_f1: 0.5150
 epoch: 59, train_loss: 0.9526, test_loss: 0.9449, test_f1: 0.5192
 epoch: 60, train_loss: 0.9469, test_loss: 0.9403, test_f1: 0.5217
 epoch: 61, train_loss: 0.9435, test_loss: 0.9333, test_f1: 0.5179
 epoch: 62, train_loss: 0.9545, test_loss: 0.9257, test_f1: 0.5176
 epoch: 63, train_loss: 0.9418, test_loss: 0.9308, test_f1: 0.5163
 epoch: 64, train_loss: 0.9553, test_loss: 0.9266, test_f1: 0.5124
 epoch: 65, train_loss: 0.9391, test_loss: 0.9305, test_f1: 0.5263
 epoch: 66, train_loss: 0.9442, test_loss: 0.9353, test_f1: 0.5227
 epoch: 67, train_loss: 0.9381, test_loss: 0.9474, test_f1: 0.5182
 epoch: 68, train_loss: 0.9435, test_loss: 0.9375, test_f1: 0.5221
 epoch: 69, train_loss: 0.9443, test_loss: 0.9242, test_f1: 0.5298
 epoch: 70, train_loss: 0.9447, test_loss: 0.9344, test_f1: 0.5106
 epoch: 71, train_loss: 0.9373, test_loss: 0.9321, test_f1: 0.5235
 epoch: 72, train_loss: 0.9402, test_loss: 0.9334, test_f1: 0.5310
 epoch: 73, train_loss: 0.9460, test_loss: 0.9367, test_f1: 0.5190
 epoch: 74, train_loss: 0.9404, test_loss: 0.9344, test_f1: 0.5243
 epoch: 75, train_loss: 0.9373, test_loss: 0.9403, test_f1: 0.5274
 epoch: 76, train_loss: 0.9399, test_loss: 0.9472, test_f1: 0.5321
 epoch: 77, train_loss: 0.9442, test_loss: 0.9587, test_f1: 0.5313
 epoch: 78, train_loss: 0.9432, test_loss: 0.9462, test_f1: 0.5311
 epoch: 79, train_loss: 0.9294, test_loss: 0.9094, test_f1: 0.5258
 epoch: 80, train_loss: 0.9330, test_loss: 0.9288, test_f1: 0.5413
 epoch: 81, train_loss: 0.9297, test_loss: 0.9244, test_f1: 0.5308
 epoch: 82, train_loss: 0.9334, test_loss: 0.9404, test_f1: 0.5234
 epoch: 83, train_loss: 0.9351, test_loss: 0.9427, test_f1: 0.5274
 epoch: 84, train_loss: 0.9312, test_loss: 0.9234, test_f1: 0.5309
 epoch: 85, train_loss: 0.9237, test_loss: 0.9190, test_f1: 0.5347
 epoch: 86, train_loss: 0.9290, test_loss: 0.9043, test_f1: 0.5279
 epoch: 87, train_loss: 0.9271, test_loss: 0.9242, test_f1: 0.5276
 epoch: 88, train_loss: 0.9279, test_loss: 0.9107, test_f1: 0.5238
 epoch: 89, train_loss: 0.9363, test_loss: 0.9347, test_f1: 0.5247
 epoch: 90, train_loss: 0.9265, test_loss: 0.9205, test_f1: 0.5281
 epoch: 91, train_loss: 0.9269, test_loss: 0.9355, test_f1: 0.5287
 epoch: 92, train_loss: 0.9258, test_loss: 0.9399, test_f1: 0.5243
 epoch: 93, train_loss: 0.9330, test_loss: 0.9192, test_f1: 0.5223
 epoch: 94, train_loss: 0.9231, test_loss: 0.9213, test_f1: 0.5360
 epoch: 95, train_loss: 0.9311, test_loss: 0.9219, test_f1: 0.5292
 epoch: 96, train_loss: 0.9236, test_loss: 0.9298, test_f1: 0.5310
 epoch: 97, train_loss: 0.9336, test_loss: 0.9264, test_f1: 0.5187
 epoch: 98, train_loss: 0.9253, test_loss: 0.9347, test_f1: 0.5392
 epoch: 99, train_loss: 0.9213, test_loss: 0.9325, test_f1: 0.5245
##################ITERATION #9 ****************************************
 epoch: 0, train_loss: 1.3076, test_loss: 1.2231, test_f1: 0.2870
 epoch: 1, train_loss: 1.2287, test_loss: 1.1807, test_f1: 0.3198
 epoch: 2, train_loss: 1.2013, test_loss: 1.1585, test_f1: 0.3197
 epoch: 3, train_loss: 1.1768, test_loss: 1.1368, test_f1: 0.3282
 epoch: 4, train_loss: 1.1582, test_loss: 1.1169, test_f1: 0.3432
 epoch: 5, train_loss: 1.1406, test_loss: 1.1088, test_f1: 0.3422
 epoch: 6, train_loss: 1.1318, test_loss: 1.0954, test_f1: 0.3451
 epoch: 7, train_loss: 1.1204, test_loss: 1.0863, test_f1: 0.3422
 epoch: 8, train_loss: 1.1050, test_loss: 1.0774, test_f1: 0.3422
 epoch: 9, train_loss: 1.0955, test_loss: 1.0744, test_f1: 0.3441
 epoch: 10, train_loss: 1.0894, test_loss: 1.0662, test_f1: 0.3564
 epoch: 11, train_loss: 1.0859, test_loss: 1.0600, test_f1: 0.3583
 epoch: 12, train_loss: 1.0847, test_loss: 1.0544, test_f1: 0.3535
 epoch: 13, train_loss: 1.0684, test_loss: 1.0664, test_f1: 0.3536
 epoch: 14, train_loss: 1.0692, test_loss: 1.0506, test_f1: 0.3591
 epoch: 15, train_loss: 1.0573, test_loss: 1.0517, test_f1: 0.3436
 epoch: 16, train_loss: 1.0571, test_loss: 1.0428, test_f1: 0.3589
 epoch: 17, train_loss: 1.0591, test_loss: 1.0468, test_f1: 0.3553
 epoch: 18, train_loss: 1.0610, test_loss: 1.0501, test_f1: 0.3575
 epoch: 19, train_loss: 1.0549, test_loss: 1.0438, test_f1: 0.3656
 epoch: 20, train_loss: 1.0559, test_loss: 1.0424, test_f1: 0.3718
 epoch: 21, train_loss: 1.0490, test_loss: 1.0400, test_f1: 0.3755
 epoch: 22, train_loss: 1.0476, test_loss: 1.0361, test_f1: 0.3703
 epoch: 23, train_loss: 1.0476, test_loss: 1.0371, test_f1: 0.3854
 epoch: 24, train_loss: 1.0498, test_loss: 1.0364, test_f1: 0.3746
 epoch: 25, train_loss: 1.0427, test_loss: 1.0322, test_f1: 0.3928
 epoch: 26, train_loss: 1.0353, test_loss: 1.0300, test_f1: 0.3867
 epoch: 27, train_loss: 1.0325, test_loss: 1.0283, test_f1: 0.3905
 epoch: 28, train_loss: 1.0254, test_loss: 1.0199, test_f1: 0.4049
 epoch: 29, train_loss: 1.0376, test_loss: 1.0173, test_f1: 0.4131
 epoch: 30, train_loss: 1.0284, test_loss: 1.0173, test_f1: 0.3902
 epoch: 31, train_loss: 1.0304, test_loss: 1.0193, test_f1: 0.4247
 epoch: 32, train_loss: 1.0236, test_loss: 1.0168, test_f1: 0.4167
 epoch: 33, train_loss: 1.0273, test_loss: 1.0097, test_f1: 0.4034
 epoch: 34, train_loss: 1.0149, test_loss: 1.0175, test_f1: 0.4267
 epoch: 35, train_loss: 1.0214, test_loss: 1.0023, test_f1: 0.4259
 epoch: 36, train_loss: 1.0200, test_loss: 1.0121, test_f1: 0.4365
 epoch: 37, train_loss: 1.0182, test_loss: 1.0122, test_f1: 0.4493
 epoch: 38, train_loss: 1.0099, test_loss: 0.9960, test_f1: 0.4393
 epoch: 39, train_loss: 1.0152, test_loss: 1.0049, test_f1: 0.4465
 epoch: 40, train_loss: 1.0071, test_loss: 1.0038, test_f1: 0.4371
 epoch: 41, train_loss: 1.0048, test_loss: 1.0065, test_f1: 0.4506
 epoch: 42, train_loss: 0.9979, test_loss: 0.9967, test_f1: 0.4485
 epoch: 43, train_loss: 1.0056, test_loss: 1.0026, test_f1: 0.4677
 epoch: 44, train_loss: 0.9965, test_loss: 0.9852, test_f1: 0.4606
 epoch: 45, train_loss: 0.9986, test_loss: 0.9799, test_f1: 0.4539
 epoch: 46, train_loss: 1.0033, test_loss: 0.9848, test_f1: 0.4653
 epoch: 47, train_loss: 0.9917, test_loss: 1.0019, test_f1: 0.4708
 epoch: 48, train_loss: 1.0022, test_loss: 0.9946, test_f1: 0.4627
 epoch: 49, train_loss: 0.9882, test_loss: 0.9985, test_f1: 0.4745
 epoch: 50, train_loss: 0.9929, test_loss: 0.9824, test_f1: 0.4709
 epoch: 51, train_loss: 0.9875, test_loss: 0.9823, test_f1: 0.4674
 epoch: 52, train_loss: 0.9791, test_loss: 0.9824, test_f1: 0.4801
 epoch: 53, train_loss: 0.9838, test_loss: 0.9790, test_f1: 0.4666
 epoch: 54, train_loss: 0.9838, test_loss: 0.9854, test_f1: 0.4687
 epoch: 55, train_loss: 0.9747, test_loss: 0.9827, test_f1: 0.4650
 epoch: 56, train_loss: 0.9864, test_loss: 0.9717, test_f1: 0.4700
 epoch: 57, train_loss: 0.9779, test_loss: 0.9635, test_f1: 0.4718
 epoch: 58, train_loss: 0.9780, test_loss: 0.9756, test_f1: 0.4663
 epoch: 59, train_loss: 0.9814, test_loss: 0.9800, test_f1: 0.4796
 epoch: 60, train_loss: 0.9843, test_loss: 0.9718, test_f1: 0.4808
 epoch: 61, train_loss: 0.9734, test_loss: 0.9807, test_f1: 0.4632
 epoch: 62, train_loss: 0.9756, test_loss: 0.9699, test_f1: 0.4607
 epoch: 63, train_loss: 0.9772, test_loss: 0.9699, test_f1: 0.4594
 epoch: 64, train_loss: 0.9749, test_loss: 0.9940, test_f1: 0.4556
 epoch: 65, train_loss: 0.9792, test_loss: 0.9755, test_f1: 0.4577
 epoch: 66, train_loss: 0.9678, test_loss: 0.9681, test_f1: 0.4726
 epoch: 67, train_loss: 0.9730, test_loss: 0.9654, test_f1: 0.4622
 epoch: 68, train_loss: 0.9672, test_loss: 0.9533, test_f1: 0.4810
 epoch: 69, train_loss: 0.9677, test_loss: 0.9535, test_f1: 0.4634
 epoch: 70, train_loss: 0.9669, test_loss: 0.9506, test_f1: 0.4650
 epoch: 71, train_loss: 0.9650, test_loss: 0.9741, test_f1: 0.4660
 epoch: 72, train_loss: 0.9661, test_loss: 0.9723, test_f1: 0.4747
 epoch: 73, train_loss: 0.9628, test_loss: 0.9457, test_f1: 0.4775
 epoch: 74, train_loss: 0.9706, test_loss: 0.9583, test_f1: 0.4657
 epoch: 75, train_loss: 0.9609, test_loss: 0.9665, test_f1: 0.4680
 epoch: 76, train_loss: 0.9587, test_loss: 0.9811, test_f1: 0.4721
 epoch: 77, train_loss: 0.9661, test_loss: 0.9653, test_f1: 0.4802
 epoch: 78, train_loss: 0.9605, test_loss: 0.9802, test_f1: 0.4688
 epoch: 79, train_loss: 0.9568, test_loss: 0.9543, test_f1: 0.4840
 epoch: 80, train_loss: 0.9599, test_loss: 0.9603, test_f1: 0.4818
 epoch: 81, train_loss: 0.9613, test_loss: 0.9685, test_f1: 0.4906
 epoch: 82, train_loss: 0.9528, test_loss: 0.9657, test_f1: 0.4735
 epoch: 83, train_loss: 0.9562, test_loss: 0.9594, test_f1: 0.4745
 epoch: 84, train_loss: 0.9492, test_loss: 0.9543, test_f1: 0.4893
 epoch: 85, train_loss: 0.9509, test_loss: 0.9623, test_f1: 0.4713
 epoch: 86, train_loss: 0.9588, test_loss: 0.9478, test_f1: 0.4721
 epoch: 87, train_loss: 0.9612, test_loss: 0.9452, test_f1: 0.4775
 epoch: 88, train_loss: 0.9522, test_loss: 0.9472, test_f1: 0.4812
 epoch: 89, train_loss: 0.9578, test_loss: 0.9416, test_f1: 0.4974
 epoch: 90, train_loss: 0.9560, test_loss: 0.9427, test_f1: 0.4843
 epoch: 91, train_loss: 0.9555, test_loss: 0.9485, test_f1: 0.4796
 epoch: 92, train_loss: 0.9493, test_loss: 0.9579, test_f1: 0.4857
 epoch: 93, train_loss: 0.9522, test_loss: 0.9360, test_f1: 0.4896
 epoch: 94, train_loss: 0.9533, test_loss: 0.9386, test_f1: 0.4797
 epoch: 95, train_loss: 0.9466, test_loss: 0.9495, test_f1: 0.4871
 epoch: 96, train_loss: 0.9497, test_loss: 0.9614, test_f1: 0.4972
 epoch: 97, train_loss: 0.9506, test_loss: 0.9557, test_f1: 0.4769
 epoch: 98, train_loss: 0.9407, test_loss: 0.9540, test_f1: 0.4940
 epoch: 99, train_loss: 0.9463, test_loss: 0.9293, test_f1: 0.5003

Training completed in 1578.51 seconds
Best F1: 0.5413 at epoch 80
Mean F1 across iterations: 0.5051  0.0376
========================FINAL RESULTS================================
FEGIN weighted F1: 0.5413  0.0376
python main.py --data ltspice_examples --representation component_pin_net --model FEGIN --layers 6 --hiddens 16 --batch_size 32 --lr 0.0001 --emb_size 250 --epochs 100 --save_appendix component_pin_net_L6_H16_BS32_LR0.0001_E250 --no_val
-----



STDERR:
  File "main.py", line 370, in <module>
    main()
  File "main.py", line 254, in main
    dataset = dataset_class(
  File "/home/philip/projects/llm_inference_code_repo/Circuit-Completion-Using-GNNs/component_classification_with_link_prediction_head/evaluation/FEGIN/kernel/circuit_datasets.py", line 15, in __init__
    self.data, self.slices = torch.load(self.processed_paths[0])
  File "/home/philip/.local/lib/python3.8/site-packages/torch/serialization.py", line 1040, in load
    warnings.warn(
  File "/usr/lib/python3.8/warnings.py", line 109, in _showwarnmsg
    sw(msg.message, msg.category, msg.filename, msg.lineno,
  File "main.py", line 47, in warn_with_traceback
    traceback.print_stack(file=log)
/home/philip/projects/llm_inference_code_repo/Circuit-Completion-Using-GNNs/component_classification_with_link_prediction_head/evaluation/FEGIN/kernel/circuit_datasets.py:15: FutureWarning: You are using `torch.load` with `weights_only=False` (the current default value), which uses the default pickle module implicitly. It is possible to construct malicious pickle data which will execute arbitrary code during unpickling (See https://github.com/pytorch/pytorch/blob/main/SECURITY.md#untrusted-models for more details). In a future release, the default value for `weights_only` will be flipped to `True`. This limits the functions that could be executed during unpickling. Arbitrary objects will no longer be allowed to be loaded via this mode unless they are explicitly allowlisted by the user via `torch.serialization.add_safe_globals`. We recommend you start setting `weights_only=True` for any use case where you don't have full control of the loaded file. Please open an issue on GitHub for any issues related to this experimental feature.
  self.data, self.slices = torch.load(self.processed_paths[0])
