STDOUT:
Results will be saved in /home/philip/projects/ltspice_examples_code_repo/Circuit-Completion-Using-GNNs/component_classification_with_link_prediction_head/evaluation/FEGIN/results/model_FEGIN_dataset_ltspice_examples
Command line input: python main.py --data ltspice_examples --representation component_pin --model FEGIN --layers 4 --hiddens 64 --batch_size 256 --lr 0.0001 --emb_size 128 --epochs 100 --save_appendix component_pin_L4_H64_BS256_LR0.0001_E128 --no_val
 is saved.
-----
ltspice_examples - FEGIN
Using 4 layers, 64 hidden units, h = 2
Loading component_pin representation dataset
ENTERED
Training FEGIN on component_pin representation
Train: 3560, Test: 848
##################ITERATION #0 ****************************************
 epoch: 0, train_loss: 1.3963, test_loss: 1.3955, test_f1: 0.0303
 epoch: 1, train_loss: 1.3886, test_loss: 1.3925, test_f1: 0.0303
 epoch: 2, train_loss: 1.3841, test_loss: 1.3887, test_f1: 0.0303
 epoch: 3, train_loss: 1.3788, test_loss: 1.3825, test_f1: 0.1332
 epoch: 4, train_loss: 1.3729, test_loss: 1.3736, test_f1: 0.2995
 epoch: 5, train_loss: 1.3660, test_loss: 1.3631, test_f1: 0.3381
 epoch: 6, train_loss: 1.3577, test_loss: 1.3523, test_f1: 0.3361
 epoch: 7, train_loss: 1.3463, test_loss: 1.3398, test_f1: 0.3361
 epoch: 8, train_loss: 1.3331, test_loss: 1.3240, test_f1: 0.3342
 epoch: 9, train_loss: 1.3164, test_loss: 1.3052, test_f1: 0.3301
 epoch: 10, train_loss: 1.2980, test_loss: 1.2825, test_f1: 0.3270
 epoch: 11, train_loss: 1.2756, test_loss: 1.2581, test_f1: 0.3332
 epoch: 12, train_loss: 1.2536, test_loss: 1.2337, test_f1: 0.3361
 epoch: 13, train_loss: 1.2293, test_loss: 1.2110, test_f1: 0.3361
 epoch: 14, train_loss: 1.2103, test_loss: 1.1874, test_f1: 0.3361
 epoch: 15, train_loss: 1.1922, test_loss: 1.1658, test_f1: 0.3374
 epoch: 16, train_loss: 1.1734, test_loss: 1.1473, test_f1: 0.3429
 epoch: 17, train_loss: 1.1558, test_loss: 1.1254, test_f1: 0.3429
 epoch: 18, train_loss: 1.1376, test_loss: 1.1088, test_f1: 0.3429
 epoch: 19, train_loss: 1.1179, test_loss: 1.0904, test_f1: 0.3438
 epoch: 20, train_loss: 1.1028, test_loss: 1.0731, test_f1: 0.3435
 epoch: 21, train_loss: 1.0877, test_loss: 1.0652, test_f1: 0.3574
 epoch: 22, train_loss: 1.0712, test_loss: 1.0503, test_f1: 0.3657
 epoch: 23, train_loss: 1.0627, test_loss: 1.0472, test_f1: 0.3643
 epoch: 24, train_loss: 1.0551, test_loss: 1.0386, test_f1: 0.3827
 epoch: 25, train_loss: 1.0382, test_loss: 1.0359, test_f1: 0.3846
 epoch: 26, train_loss: 1.0301, test_loss: 1.0317, test_f1: 0.3754
 epoch: 27, train_loss: 1.0279, test_loss: 1.0282, test_f1: 0.3981
 epoch: 28, train_loss: 1.0183, test_loss: 1.0312, test_f1: 0.4127
 epoch: 29, train_loss: 1.0115, test_loss: 1.0229, test_f1: 0.4180
 epoch: 30, train_loss: 1.0040, test_loss: 1.0223, test_f1: 0.4373
 epoch: 31, train_loss: 0.9990, test_loss: 1.0224, test_f1: 0.4408
 epoch: 32, train_loss: 0.9910, test_loss: 1.0226, test_f1: 0.4431
 epoch: 33, train_loss: 0.9957, test_loss: 1.0148, test_f1: 0.4464
 epoch: 34, train_loss: 0.9873, test_loss: 1.0456, test_f1: 0.4279
 epoch: 35, train_loss: 0.9858, test_loss: 1.0240, test_f1: 0.4535
 epoch: 36, train_loss: 0.9807, test_loss: 1.0273, test_f1: 0.4475
 epoch: 37, train_loss: 0.9759, test_loss: 1.0357, test_f1: 0.4370
 epoch: 38, train_loss: 0.9694, test_loss: 1.0127, test_f1: 0.4574
 epoch: 39, train_loss: 0.9695, test_loss: 1.0422, test_f1: 0.4406
 epoch: 40, train_loss: 0.9615, test_loss: 1.0124, test_f1: 0.4564
 epoch: 41, train_loss: 0.9629, test_loss: 1.0207, test_f1: 0.4522
 epoch: 42, train_loss: 0.9545, test_loss: 1.0327, test_f1: 0.4585
 epoch: 43, train_loss: 0.9544, test_loss: 1.0248, test_f1: 0.4648
 epoch: 44, train_loss: 0.9511, test_loss: 1.0307, test_f1: 0.4566
 epoch: 45, train_loss: 0.9473, test_loss: 1.0313, test_f1: 0.4636
 epoch: 46, train_loss: 0.9382, test_loss: 1.0460, test_f1: 0.4530
 epoch: 47, train_loss: 0.9353, test_loss: 1.0194, test_f1: 0.4839
 epoch: 48, train_loss: 0.9367, test_loss: 1.0367, test_f1: 0.4657
 epoch: 49, train_loss: 0.9238, test_loss: 1.0405, test_f1: 0.4829
 epoch: 50, train_loss: 0.9247, test_loss: 1.0163, test_f1: 0.4847
 epoch: 51, train_loss: 0.9172, test_loss: 1.0250, test_f1: 0.4890
 epoch: 52, train_loss: 0.9146, test_loss: 1.0235, test_f1: 0.4841
 epoch: 53, train_loss: 0.9195, test_loss: 1.0236, test_f1: 0.4857
 epoch: 54, train_loss: 0.9089, test_loss: 1.0277, test_f1: 0.4884
 epoch: 55, train_loss: 0.9101, test_loss: 1.0189, test_f1: 0.4917
 epoch: 56, train_loss: 0.9104, test_loss: 1.0185, test_f1: 0.4933
 epoch: 57, train_loss: 0.9120, test_loss: 1.0245, test_f1: 0.4921
 epoch: 58, train_loss: 0.9059, test_loss: 1.0336, test_f1: 0.4882
 epoch: 59, train_loss: 0.9054, test_loss: 1.0185, test_f1: 0.4909
 epoch: 60, train_loss: 0.8960, test_loss: 1.0264, test_f1: 0.4859
 epoch: 61, train_loss: 0.8951, test_loss: 1.0208, test_f1: 0.4914
 epoch: 62, train_loss: 0.8939, test_loss: 1.0122, test_f1: 0.4946
 epoch: 63, train_loss: 0.8920, test_loss: 1.0148, test_f1: 0.4923
 epoch: 64, train_loss: 0.8878, test_loss: 1.0151, test_f1: 0.4894
 epoch: 65, train_loss: 0.8893, test_loss: 1.0179, test_f1: 0.4971
 epoch: 66, train_loss: 0.8880, test_loss: 1.0199, test_f1: 0.4979
 epoch: 67, train_loss: 0.8752, test_loss: 1.0167, test_f1: 0.5074
 epoch: 68, train_loss: 0.8840, test_loss: 1.0161, test_f1: 0.5014
 epoch: 69, train_loss: 0.8721, test_loss: 1.0307, test_f1: 0.4976
 epoch: 70, train_loss: 0.8751, test_loss: 1.0306, test_f1: 0.5027
 epoch: 71, train_loss: 0.8724, test_loss: 1.0252, test_f1: 0.5000
 epoch: 72, train_loss: 0.8694, test_loss: 1.0181, test_f1: 0.5052
 epoch: 73, train_loss: 0.8698, test_loss: 1.0141, test_f1: 0.5128
 epoch: 74, train_loss: 0.8752, test_loss: 1.0214, test_f1: 0.5000
 epoch: 75, train_loss: 0.8672, test_loss: 1.0145, test_f1: 0.4991
 epoch: 76, train_loss: 0.8677, test_loss: 1.0098, test_f1: 0.5065
 epoch: 77, train_loss: 0.8539, test_loss: 1.0216, test_f1: 0.4993
 epoch: 78, train_loss: 0.8562, test_loss: 1.0243, test_f1: 0.5009
 epoch: 79, train_loss: 0.8484, test_loss: 1.0133, test_f1: 0.5061
 epoch: 80, train_loss: 0.8517, test_loss: 1.0141, test_f1: 0.5127
 epoch: 81, train_loss: 0.8502, test_loss: 0.9979, test_f1: 0.5076
 epoch: 82, train_loss: 0.8392, test_loss: 1.0291, test_f1: 0.4995
 epoch: 83, train_loss: 0.8440, test_loss: 1.0227, test_f1: 0.5105
 epoch: 84, train_loss: 0.8391, test_loss: 1.0152, test_f1: 0.5087
 epoch: 85, train_loss: 0.8358, test_loss: 1.0222, test_f1: 0.5067
 epoch: 86, train_loss: 0.8389, test_loss: 0.9923, test_f1: 0.5102
 epoch: 87, train_loss: 0.8357, test_loss: 1.0303, test_f1: 0.5039
 epoch: 88, train_loss: 0.8217, test_loss: 1.0097, test_f1: 0.5140
 epoch: 89, train_loss: 0.8214, test_loss: 1.0159, test_f1: 0.5046
 epoch: 90, train_loss: 0.8219, test_loss: 1.0165, test_f1: 0.5075
 epoch: 91, train_loss: 0.8167, test_loss: 1.0101, test_f1: 0.5092
 epoch: 92, train_loss: 0.8205, test_loss: 1.0165, test_f1: 0.5152
 epoch: 93, train_loss: 0.8255, test_loss: 1.0171, test_f1: 0.5055
 epoch: 94, train_loss: 0.8149, test_loss: 1.0265, test_f1: 0.5120
 epoch: 95, train_loss: 0.8067, test_loss: 1.0268, test_f1: 0.5146
 epoch: 96, train_loss: 0.8171, test_loss: 1.0151, test_f1: 0.5153
 epoch: 97, train_loss: 0.8070, test_loss: 1.0296, test_f1: 0.4976
 epoch: 98, train_loss: 0.8035, test_loss: 1.0023, test_f1: 0.5203
 epoch: 99, train_loss: 0.7971, test_loss: 1.0136, test_f1: 0.5216
##################ITERATION #1 ****************************************
 epoch: 0, train_loss: 1.3542, test_loss: 1.3633, test_f1: 0.2260
 epoch: 1, train_loss: 1.3359, test_loss: 1.3510, test_f1: 0.2260
 epoch: 2, train_loss: 1.3224, test_loss: 1.3325, test_f1: 0.2260
 epoch: 3, train_loss: 1.3089, test_loss: 1.3103, test_f1: 0.2260
 epoch: 4, train_loss: 1.2931, test_loss: 1.2884, test_f1: 0.2260
 epoch: 5, train_loss: 1.2760, test_loss: 1.2668, test_f1: 0.2260
 epoch: 6, train_loss: 1.2590, test_loss: 1.2450, test_f1: 0.2286
 epoch: 7, train_loss: 1.2392, test_loss: 1.2236, test_f1: 0.3358
 epoch: 8, train_loss: 1.2202, test_loss: 1.2006, test_f1: 0.3343
 epoch: 9, train_loss: 1.2034, test_loss: 1.1797, test_f1: 0.3374
 epoch: 10, train_loss: 1.1822, test_loss: 1.1595, test_f1: 0.3400
 epoch: 11, train_loss: 1.1622, test_loss: 1.1368, test_f1: 0.3419
 epoch: 12, train_loss: 1.1440, test_loss: 1.1162, test_f1: 0.3419
 epoch: 13, train_loss: 1.1197, test_loss: 1.0964, test_f1: 0.3429
 epoch: 14, train_loss: 1.1030, test_loss: 1.0785, test_f1: 0.3477
 epoch: 15, train_loss: 1.0829, test_loss: 1.0609, test_f1: 0.3640
 epoch: 16, train_loss: 1.0647, test_loss: 1.0506, test_f1: 0.3735
 epoch: 17, train_loss: 1.0481, test_loss: 1.0381, test_f1: 0.3835
 epoch: 18, train_loss: 1.0368, test_loss: 1.0289, test_f1: 0.4009
 epoch: 19, train_loss: 1.0246, test_loss: 1.0188, test_f1: 0.4203
 epoch: 20, train_loss: 1.0092, test_loss: 1.0090, test_f1: 0.4352
 epoch: 21, train_loss: 1.0035, test_loss: 1.0056, test_f1: 0.4449
 epoch: 22, train_loss: 0.9975, test_loss: 1.0081, test_f1: 0.4487
 epoch: 23, train_loss: 0.9886, test_loss: 0.9934, test_f1: 0.4534
 epoch: 24, train_loss: 0.9790, test_loss: 0.9917, test_f1: 0.4651
 epoch: 25, train_loss: 0.9732, test_loss: 0.9819, test_f1: 0.4700
 epoch: 26, train_loss: 0.9591, test_loss: 0.9866, test_f1: 0.4627
 epoch: 27, train_loss: 0.9562, test_loss: 0.9767, test_f1: 0.4707
 epoch: 28, train_loss: 0.9489, test_loss: 0.9776, test_f1: 0.4744
 epoch: 29, train_loss: 0.9411, test_loss: 0.9675, test_f1: 0.4802
 epoch: 30, train_loss: 0.9330, test_loss: 0.9676, test_f1: 0.4738
 epoch: 31, train_loss: 0.9295, test_loss: 0.9558, test_f1: 0.4771
 epoch: 32, train_loss: 0.9163, test_loss: 0.9671, test_f1: 0.4747
 epoch: 33, train_loss: 0.9173, test_loss: 0.9418, test_f1: 0.4970
 epoch: 34, train_loss: 0.9113, test_loss: 0.9252, test_f1: 0.4921
 epoch: 35, train_loss: 0.8988, test_loss: 0.9429, test_f1: 0.4947
 epoch: 36, train_loss: 0.8982, test_loss: 0.9340, test_f1: 0.5182
 epoch: 37, train_loss: 0.8874, test_loss: 0.9239, test_f1: 0.5123
 epoch: 38, train_loss: 0.8816, test_loss: 0.9132, test_f1: 0.5187
 epoch: 39, train_loss: 0.8798, test_loss: 0.9144, test_f1: 0.5278
 epoch: 40, train_loss: 0.8652, test_loss: 0.9306, test_f1: 0.5223
 epoch: 41, train_loss: 0.8613, test_loss: 0.9088, test_f1: 0.5357
 epoch: 42, train_loss: 0.8605, test_loss: 0.9148, test_f1: 0.5281
 epoch: 43, train_loss: 0.8525, test_loss: 0.9051, test_f1: 0.5400
 epoch: 44, train_loss: 0.8486, test_loss: 0.8841, test_f1: 0.5418
 epoch: 45, train_loss: 0.8497, test_loss: 0.9074, test_f1: 0.5260
 epoch: 46, train_loss: 0.8462, test_loss: 0.8790, test_f1: 0.5351
 epoch: 47, train_loss: 0.8369, test_loss: 0.8705, test_f1: 0.5457
 epoch: 48, train_loss: 0.8205, test_loss: 0.8899, test_f1: 0.5217
 epoch: 49, train_loss: 0.8255, test_loss: 0.8690, test_f1: 0.5220
 epoch: 50, train_loss: 0.8198, test_loss: 0.8687, test_f1: 0.5447
 epoch: 51, train_loss: 0.8116, test_loss: 0.8698, test_f1: 0.5324
 epoch: 52, train_loss: 0.8059, test_loss: 0.8767, test_f1: 0.5333
 epoch: 53, train_loss: 0.8054, test_loss: 0.8678, test_f1: 0.5311
 epoch: 54, train_loss: 0.8068, test_loss: 0.8663, test_f1: 0.5301
 epoch: 55, train_loss: 0.8034, test_loss: 0.8713, test_f1: 0.5325
 epoch: 56, train_loss: 0.8012, test_loss: 0.8667, test_f1: 0.5467
 epoch: 57, train_loss: 0.7919, test_loss: 0.8678, test_f1: 0.5393
 epoch: 58, train_loss: 0.7900, test_loss: 0.8620, test_f1: 0.5414
 epoch: 59, train_loss: 0.7925, test_loss: 0.8631, test_f1: 0.5403
 epoch: 60, train_loss: 0.7853, test_loss: 0.8657, test_f1: 0.5379
 epoch: 61, train_loss: 0.7871, test_loss: 0.8633, test_f1: 0.5410
 epoch: 62, train_loss: 0.7916, test_loss: 0.8593, test_f1: 0.5340
 epoch: 63, train_loss: 0.7738, test_loss: 0.8694, test_f1: 0.5334
 epoch: 64, train_loss: 0.7841, test_loss: 0.8588, test_f1: 0.5400
 epoch: 65, train_loss: 0.7867, test_loss: 0.8712, test_f1: 0.5279
 epoch: 66, train_loss: 0.7776, test_loss: 0.8524, test_f1: 0.5516
 epoch: 67, train_loss: 0.7707, test_loss: 0.8711, test_f1: 0.5348
 epoch: 68, train_loss: 0.7586, test_loss: 0.8791, test_f1: 0.5410
 epoch: 69, train_loss: 0.7717, test_loss: 0.8549, test_f1: 0.5477
 epoch: 70, train_loss: 0.7780, test_loss: 0.8564, test_f1: 0.5450
 epoch: 71, train_loss: 0.7690, test_loss: 0.8661, test_f1: 0.5374
 epoch: 72, train_loss: 0.7556, test_loss: 0.8782, test_f1: 0.5284
 epoch: 73, train_loss: 0.7643, test_loss: 0.8710, test_f1: 0.5340
 epoch: 74, train_loss: 0.7592, test_loss: 0.8573, test_f1: 0.5484
 epoch: 75, train_loss: 0.7614, test_loss: 0.8727, test_f1: 0.5434
 epoch: 76, train_loss: 0.7479, test_loss: 0.8666, test_f1: 0.5459
 epoch: 77, train_loss: 0.7454, test_loss: 0.8733, test_f1: 0.5319
 epoch: 78, train_loss: 0.7467, test_loss: 0.8645, test_f1: 0.5395
 epoch: 79, train_loss: 0.7480, test_loss: 0.8683, test_f1: 0.5419
 epoch: 80, train_loss: 0.7476, test_loss: 0.8747, test_f1: 0.5362
 epoch: 81, train_loss: 0.7509, test_loss: 0.8753, test_f1: 0.5474
 epoch: 82, train_loss: 0.7419, test_loss: 0.8812, test_f1: 0.5444
 epoch: 83, train_loss: 0.7398, test_loss: 0.8661, test_f1: 0.5407
 epoch: 84, train_loss: 0.7371, test_loss: 0.8695, test_f1: 0.5507
 epoch: 85, train_loss: 0.7325, test_loss: 0.8633, test_f1: 0.5556
 epoch: 86, train_loss: 0.7341, test_loss: 0.8789, test_f1: 0.5421
 epoch: 87, train_loss: 0.7272, test_loss: 0.8813, test_f1: 0.5419
 epoch: 88, train_loss: 0.7345, test_loss: 0.8758, test_f1: 0.5527
 epoch: 89, train_loss: 0.7230, test_loss: 0.8753, test_f1: 0.5444
 epoch: 90, train_loss: 0.7287, test_loss: 0.8690, test_f1: 0.5461
 epoch: 91, train_loss: 0.7310, test_loss: 0.8809, test_f1: 0.5454
 epoch: 92, train_loss: 0.7264, test_loss: 0.8916, test_f1: 0.5412
 epoch: 93, train_loss: 0.7245, test_loss: 0.8952, test_f1: 0.5530
 epoch: 94, train_loss: 0.7184, test_loss: 0.8779, test_f1: 0.5451
 epoch: 95, train_loss: 0.7187, test_loss: 0.8790, test_f1: 0.5515
 epoch: 96, train_loss: 0.7103, test_loss: 0.8696, test_f1: 0.5463
 epoch: 97, train_loss: 0.7208, test_loss: 0.8622, test_f1: 0.5560
 epoch: 98, train_loss: 0.7169, test_loss: 0.8842, test_f1: 0.5430
 epoch: 99, train_loss: 0.7094, test_loss: 0.8991, test_f1: 0.5362
##################ITERATION #2 ****************************************
 epoch: 0, train_loss: 1.3331, test_loss: 1.3475, test_f1: 0.2260
 epoch: 1, train_loss: 1.3103, test_loss: 1.3336, test_f1: 0.2260
 epoch: 2, train_loss: 1.2963, test_loss: 1.3148, test_f1: 0.2260
 epoch: 3, train_loss: 1.2835, test_loss: 1.2908, test_f1: 0.2260
 epoch: 4, train_loss: 1.2678, test_loss: 1.2618, test_f1: 0.2260
 epoch: 5, train_loss: 1.2487, test_loss: 1.2317, test_f1: 0.2685
 epoch: 6, train_loss: 1.2284, test_loss: 1.2025, test_f1: 0.3396
 epoch: 7, train_loss: 1.2098, test_loss: 1.1760, test_f1: 0.3769
 epoch: 8, train_loss: 1.1895, test_loss: 1.1505, test_f1: 0.4009
 epoch: 9, train_loss: 1.1661, test_loss: 1.1252, test_f1: 0.3944
 epoch: 10, train_loss: 1.1448, test_loss: 1.1022, test_f1: 0.4136
 epoch: 11, train_loss: 1.1313, test_loss: 1.0832, test_f1: 0.4169
 epoch: 12, train_loss: 1.1054, test_loss: 1.0628, test_f1: 0.4339
 epoch: 13, train_loss: 1.0857, test_loss: 1.0470, test_f1: 0.4486
 epoch: 14, train_loss: 1.0693, test_loss: 1.0321, test_f1: 0.4522
 epoch: 15, train_loss: 1.0500, test_loss: 1.0189, test_f1: 0.4608
 epoch: 16, train_loss: 1.0372, test_loss: 1.0033, test_f1: 0.4617
 epoch: 17, train_loss: 1.0247, test_loss: 0.9960, test_f1: 0.4645
 epoch: 18, train_loss: 1.0166, test_loss: 0.9889, test_f1: 0.4703
 epoch: 19, train_loss: 1.0037, test_loss: 0.9766, test_f1: 0.4586
 epoch: 20, train_loss: 0.9945, test_loss: 0.9658, test_f1: 0.4807
 epoch: 21, train_loss: 0.9757, test_loss: 0.9604, test_f1: 0.4707
 epoch: 22, train_loss: 0.9700, test_loss: 0.9599, test_f1: 0.4722
 epoch: 23, train_loss: 0.9643, test_loss: 0.9499, test_f1: 0.4774
 epoch: 24, train_loss: 0.9605, test_loss: 0.9481, test_f1: 0.4737
 epoch: 25, train_loss: 0.9583, test_loss: 0.9484, test_f1: 0.4730
 epoch: 26, train_loss: 0.9449, test_loss: 0.9365, test_f1: 0.4731
 epoch: 27, train_loss: 0.9376, test_loss: 0.9346, test_f1: 0.4711
 epoch: 28, train_loss: 0.9388, test_loss: 0.9415, test_f1: 0.4859
 epoch: 29, train_loss: 0.9299, test_loss: 0.9290, test_f1: 0.4807
 epoch: 30, train_loss: 0.9171, test_loss: 0.9308, test_f1: 0.4843
 epoch: 31, train_loss: 0.9191, test_loss: 0.9270, test_f1: 0.4906
 epoch: 32, train_loss: 0.9079, test_loss: 0.9312, test_f1: 0.4828
 epoch: 33, train_loss: 0.9201, test_loss: 0.9323, test_f1: 0.4792
 epoch: 34, train_loss: 0.9003, test_loss: 0.9272, test_f1: 0.4875
 epoch: 35, train_loss: 0.9039, test_loss: 0.9262, test_f1: 0.4875
 epoch: 36, train_loss: 0.8934, test_loss: 0.9227, test_f1: 0.4826
 epoch: 37, train_loss: 0.8898, test_loss: 0.9377, test_f1: 0.4881
 epoch: 38, train_loss: 0.8849, test_loss: 0.9237, test_f1: 0.5005
 epoch: 39, train_loss: 0.8718, test_loss: 0.9158, test_f1: 0.4931
 epoch: 40, train_loss: 0.8695, test_loss: 0.9406, test_f1: 0.4930
 epoch: 41, train_loss: 0.8717, test_loss: 0.9478, test_f1: 0.4963
 epoch: 42, train_loss: 0.8656, test_loss: 0.9212, test_f1: 0.4935
 epoch: 43, train_loss: 0.8616, test_loss: 0.9289, test_f1: 0.4908
 epoch: 44, train_loss: 0.8553, test_loss: 0.9127, test_f1: 0.4994
 epoch: 45, train_loss: 0.8475, test_loss: 0.9335, test_f1: 0.4887
 epoch: 46, train_loss: 0.8419, test_loss: 0.9424, test_f1: 0.4897
 epoch: 47, train_loss: 0.8485, test_loss: 0.9284, test_f1: 0.5123
 epoch: 48, train_loss: 0.8408, test_loss: 0.9265, test_f1: 0.4932
 epoch: 49, train_loss: 0.8324, test_loss: 0.9423, test_f1: 0.4968
 epoch: 50, train_loss: 0.8272, test_loss: 0.9429, test_f1: 0.4973
 epoch: 51, train_loss: 0.8222, test_loss: 0.9274, test_f1: 0.5070
 epoch: 52, train_loss: 0.8123, test_loss: 0.9291, test_f1: 0.5077
 epoch: 53, train_loss: 0.8149, test_loss: 0.9317, test_f1: 0.5025
 epoch: 54, train_loss: 0.8116, test_loss: 0.9300, test_f1: 0.4976
 epoch: 55, train_loss: 0.8098, test_loss: 0.9316, test_f1: 0.5213
 epoch: 56, train_loss: 0.8061, test_loss: 0.9382, test_f1: 0.5069
 epoch: 57, train_loss: 0.8061, test_loss: 0.9310, test_f1: 0.5051
 epoch: 58, train_loss: 0.7971, test_loss: 0.9405, test_f1: 0.4926
 epoch: 59, train_loss: 0.7993, test_loss: 0.9226, test_f1: 0.5197
 epoch: 60, train_loss: 0.8034, test_loss: 0.9380, test_f1: 0.4981
 epoch: 61, train_loss: 0.8000, test_loss: 0.9343, test_f1: 0.5214
 epoch: 62, train_loss: 0.7921, test_loss: 0.9335, test_f1: 0.5154
 epoch: 63, train_loss: 0.7938, test_loss: 0.9463, test_f1: 0.5152
 epoch: 64, train_loss: 0.7896, test_loss: 0.9406, test_f1: 0.5177
 epoch: 65, train_loss: 0.7810, test_loss: 0.9299, test_f1: 0.5147
 epoch: 66, train_loss: 0.7881, test_loss: 0.9274, test_f1: 0.5194
 epoch: 67, train_loss: 0.7829, test_loss: 0.9241, test_f1: 0.5235
 epoch: 68, train_loss: 0.7734, test_loss: 0.9318, test_f1: 0.5226
 epoch: 69, train_loss: 0.7775, test_loss: 0.9323, test_f1: 0.5136
 epoch: 70, train_loss: 0.7839, test_loss: 0.9380, test_f1: 0.5240
 epoch: 71, train_loss: 0.7760, test_loss: 0.9383, test_f1: 0.5231
 epoch: 72, train_loss: 0.7744, test_loss: 0.9461, test_f1: 0.5215
 epoch: 73, train_loss: 0.7761, test_loss: 0.9440, test_f1: 0.5153
 epoch: 74, train_loss: 0.7655, test_loss: 0.9515, test_f1: 0.5172
 epoch: 75, train_loss: 0.7730, test_loss: 0.9382, test_f1: 0.5172
 epoch: 76, train_loss: 0.7691, test_loss: 0.9266, test_f1: 0.5216
 epoch: 77, train_loss: 0.7606, test_loss: 0.9290, test_f1: 0.5210
 epoch: 78, train_loss: 0.7520, test_loss: 0.9318, test_f1: 0.5179
 epoch: 79, train_loss: 0.7583, test_loss: 0.9229, test_f1: 0.5202
 epoch: 80, train_loss: 0.7737, test_loss: 0.9124, test_f1: 0.5193
 epoch: 81, train_loss: 0.7673, test_loss: 0.9471, test_f1: 0.5170
 epoch: 82, train_loss: 0.7594, test_loss: 0.9424, test_f1: 0.5226
 epoch: 83, train_loss: 0.7564, test_loss: 0.9410, test_f1: 0.5327
 epoch: 84, train_loss: 0.7465, test_loss: 0.9377, test_f1: 0.5197
 epoch: 85, train_loss: 0.7426, test_loss: 0.9355, test_f1: 0.5146
 epoch: 86, train_loss: 0.7435, test_loss: 0.9195, test_f1: 0.5327
 epoch: 87, train_loss: 0.7462, test_loss: 0.9304, test_f1: 0.5264
 epoch: 88, train_loss: 0.7461, test_loss: 0.9202, test_f1: 0.5192
 epoch: 89, train_loss: 0.7394, test_loss: 0.9444, test_f1: 0.5133
 epoch: 90, train_loss: 0.7407, test_loss: 0.9266, test_f1: 0.5219
 epoch: 91, train_loss: 0.7377, test_loss: 0.9443, test_f1: 0.5201
 epoch: 92, train_loss: 0.7260, test_loss: 0.9143, test_f1: 0.5214
 epoch: 93, train_loss: 0.7314, test_loss: 0.9437, test_f1: 0.5159
 epoch: 94, train_loss: 0.7402, test_loss: 0.9222, test_f1: 0.5183
 epoch: 95, train_loss: 0.7268, test_loss: 0.9278, test_f1: 0.5292
 epoch: 96, train_loss: 0.7329, test_loss: 0.9194, test_f1: 0.5235
 epoch: 97, train_loss: 0.7338, test_loss: 0.9369, test_f1: 0.5218
 epoch: 98, train_loss: 0.7306, test_loss: 0.9509, test_f1: 0.5140
 epoch: 99, train_loss: 0.7275, test_loss: 0.9198, test_f1: 0.5227
##################ITERATION #3 ****************************************
 epoch: 0, train_loss: 1.3080, test_loss: 1.3160, test_f1: 0.2260
 epoch: 1, train_loss: 1.2795, test_loss: 1.3101, test_f1: 0.2260
 epoch: 2, train_loss: 1.2621, test_loss: 1.2955, test_f1: 0.2260
 epoch: 3, train_loss: 1.2423, test_loss: 1.2547, test_f1: 0.2308
 epoch: 4, train_loss: 1.2257, test_loss: 1.2089, test_f1: 0.2897
 epoch: 5, train_loss: 1.2052, test_loss: 1.1721, test_f1: 0.4302
 epoch: 6, train_loss: 1.1821, test_loss: 1.1448, test_f1: 0.4286
 epoch: 7, train_loss: 1.1606, test_loss: 1.1215, test_f1: 0.4342
 epoch: 8, train_loss: 1.1359, test_loss: 1.1026, test_f1: 0.4320
 epoch: 9, train_loss: 1.1208, test_loss: 1.0880, test_f1: 0.4322
 epoch: 10, train_loss: 1.0953, test_loss: 1.0744, test_f1: 0.4238
 epoch: 11, train_loss: 1.0775, test_loss: 1.0556, test_f1: 0.4452
 epoch: 12, train_loss: 1.0636, test_loss: 1.0500, test_f1: 0.4441
 epoch: 13, train_loss: 1.0447, test_loss: 1.0353, test_f1: 0.4691
 epoch: 14, train_loss: 1.0348, test_loss: 1.0326, test_f1: 0.4520
 epoch: 15, train_loss: 1.0171, test_loss: 1.0269, test_f1: 0.4560
 epoch: 16, train_loss: 1.0107, test_loss: 1.0212, test_f1: 0.4634
 epoch: 17, train_loss: 1.0035, test_loss: 1.0216, test_f1: 0.4698
 epoch: 18, train_loss: 0.9913, test_loss: 1.0046, test_f1: 0.4704
 epoch: 19, train_loss: 0.9812, test_loss: 1.0038, test_f1: 0.4756
 epoch: 20, train_loss: 0.9781, test_loss: 1.0011, test_f1: 0.4766
 epoch: 21, train_loss: 0.9701, test_loss: 1.0114, test_f1: 0.4788
 epoch: 22, train_loss: 0.9610, test_loss: 0.9923, test_f1: 0.4806
 epoch: 23, train_loss: 0.9510, test_loss: 0.9811, test_f1: 0.5002
 epoch: 24, train_loss: 0.9481, test_loss: 0.9927, test_f1: 0.4801
 epoch: 25, train_loss: 0.9348, test_loss: 0.9850, test_f1: 0.4909
 epoch: 26, train_loss: 0.9308, test_loss: 0.9817, test_f1: 0.4906
 epoch: 27, train_loss: 0.9226, test_loss: 0.9693, test_f1: 0.4954
 epoch: 28, train_loss: 0.9147, test_loss: 0.9769, test_f1: 0.4865
 epoch: 29, train_loss: 0.9152, test_loss: 0.9828, test_f1: 0.4830
 epoch: 30, train_loss: 0.9088, test_loss: 0.9615, test_f1: 0.5058
 epoch: 31, train_loss: 0.8987, test_loss: 0.9716, test_f1: 0.4861
 epoch: 32, train_loss: 0.8950, test_loss: 0.9579, test_f1: 0.5055
 epoch: 33, train_loss: 0.8928, test_loss: 0.9651, test_f1: 0.4921
 epoch: 34, train_loss: 0.8936, test_loss: 0.9672, test_f1: 0.4978
 epoch: 35, train_loss: 0.8813, test_loss: 0.9513, test_f1: 0.5074
 epoch: 36, train_loss: 0.8719, test_loss: 0.9906, test_f1: 0.4853
 epoch: 37, train_loss: 0.8593, test_loss: 0.9479, test_f1: 0.5130
 epoch: 38, train_loss: 0.8584, test_loss: 0.9652, test_f1: 0.4998
 epoch: 39, train_loss: 0.8589, test_loss: 0.9615, test_f1: 0.5073
 epoch: 40, train_loss: 0.8506, test_loss: 0.9491, test_f1: 0.5118
 epoch: 41, train_loss: 0.8460, test_loss: 0.9419, test_f1: 0.5297
 epoch: 42, train_loss: 0.8417, test_loss: 0.9793, test_f1: 0.4943
 epoch: 43, train_loss: 0.8242, test_loss: 0.9373, test_f1: 0.5271
 epoch: 44, train_loss: 0.8399, test_loss: 0.9507, test_f1: 0.5111
 epoch: 45, train_loss: 0.8194, test_loss: 0.9487, test_f1: 0.5335
 epoch: 46, train_loss: 0.8280, test_loss: 0.9493, test_f1: 0.5280
 epoch: 47, train_loss: 0.8100, test_loss: 0.9420, test_f1: 0.5270
 epoch: 48, train_loss: 0.8097, test_loss: 0.9723, test_f1: 0.5163
 epoch: 49, train_loss: 0.8108, test_loss: 0.9892, test_f1: 0.5029
 epoch: 50, train_loss: 0.7988, test_loss: 0.9494, test_f1: 0.5374
 epoch: 51, train_loss: 0.7875, test_loss: 0.9439, test_f1: 0.5321
 epoch: 52, train_loss: 0.7837, test_loss: 0.9541, test_f1: 0.5299
 epoch: 53, train_loss: 0.7909, test_loss: 0.9522, test_f1: 0.5305
 epoch: 54, train_loss: 0.7838, test_loss: 0.9468, test_f1: 0.5365
 epoch: 55, train_loss: 0.7740, test_loss: 0.9466, test_f1: 0.5331
 epoch: 56, train_loss: 0.7774, test_loss: 0.9461, test_f1: 0.5349
 epoch: 57, train_loss: 0.7730, test_loss: 0.9579, test_f1: 0.5284
 epoch: 58, train_loss: 0.7730, test_loss: 0.9631, test_f1: 0.5385
 epoch: 59, train_loss: 0.7653, test_loss: 0.9569, test_f1: 0.5344
 epoch: 60, train_loss: 0.7704, test_loss: 0.9681, test_f1: 0.5235
 epoch: 61, train_loss: 0.7713, test_loss: 0.9535, test_f1: 0.5250
 epoch: 62, train_loss: 0.7570, test_loss: 0.9750, test_f1: 0.5225
 epoch: 63, train_loss: 0.7575, test_loss: 0.9642, test_f1: 0.5260
 epoch: 64, train_loss: 0.7621, test_loss: 0.9645, test_f1: 0.5264
 epoch: 65, train_loss: 0.7602, test_loss: 0.9556, test_f1: 0.5346
 epoch: 66, train_loss: 0.7472, test_loss: 0.9629, test_f1: 0.5256
 epoch: 67, train_loss: 0.7600, test_loss: 0.9688, test_f1: 0.5333
 epoch: 68, train_loss: 0.7605, test_loss: 0.9738, test_f1: 0.5274
 epoch: 69, train_loss: 0.7449, test_loss: 0.9826, test_f1: 0.5141
 epoch: 70, train_loss: 0.7554, test_loss: 0.9882, test_f1: 0.5136
 epoch: 71, train_loss: 0.7472, test_loss: 0.9764, test_f1: 0.5191
 epoch: 72, train_loss: 0.7429, test_loss: 0.9723, test_f1: 0.5370
 epoch: 73, train_loss: 0.7417, test_loss: 0.9714, test_f1: 0.5111
 epoch: 74, train_loss: 0.7403, test_loss: 0.9680, test_f1: 0.5340
 epoch: 75, train_loss: 0.7368, test_loss: 0.9802, test_f1: 0.5337
 epoch: 76, train_loss: 0.7344, test_loss: 0.9726, test_f1: 0.5207
 epoch: 77, train_loss: 0.7420, test_loss: 0.9795, test_f1: 0.5204
 epoch: 78, train_loss: 0.7354, test_loss: 0.9801, test_f1: 0.5089
 epoch: 79, train_loss: 0.7368, test_loss: 0.9780, test_f1: 0.5311
 epoch: 80, train_loss: 0.7320, test_loss: 0.9831, test_f1: 0.5214
 epoch: 81, train_loss: 0.7255, test_loss: 0.9809, test_f1: 0.5152
 epoch: 82, train_loss: 0.7205, test_loss: 0.9866, test_f1: 0.5217
 epoch: 83, train_loss: 0.7226, test_loss: 0.9820, test_f1: 0.5276
 epoch: 84, train_loss: 0.7123, test_loss: 0.9695, test_f1: 0.5242
 epoch: 85, train_loss: 0.7284, test_loss: 0.9802, test_f1: 0.5284
 epoch: 86, train_loss: 0.7263, test_loss: 0.9742, test_f1: 0.5139
 epoch: 87, train_loss: 0.7050, test_loss: 0.9920, test_f1: 0.5205
 epoch: 88, train_loss: 0.7154, test_loss: 0.9767, test_f1: 0.5306
 epoch: 89, train_loss: 0.7072, test_loss: 0.9820, test_f1: 0.5290
 epoch: 90, train_loss: 0.7064, test_loss: 0.9753, test_f1: 0.5252
 epoch: 91, train_loss: 0.7173, test_loss: 0.9757, test_f1: 0.5227
 epoch: 92, train_loss: 0.7117, test_loss: 0.9672, test_f1: 0.5299
 epoch: 93, train_loss: 0.7060, test_loss: 0.9762, test_f1: 0.5234
 epoch: 94, train_loss: 0.7101, test_loss: 0.9796, test_f1: 0.5300
 epoch: 95, train_loss: 0.7076, test_loss: 0.9899, test_f1: 0.5087
 epoch: 96, train_loss: 0.6988, test_loss: 0.9905, test_f1: 0.5173
 epoch: 97, train_loss: 0.6892, test_loss: 0.9978, test_f1: 0.5012
 epoch: 98, train_loss: 0.6947, test_loss: 1.0147, test_f1: 0.5118
 epoch: 99, train_loss: 0.7020, test_loss: 0.9948, test_f1: 0.5080
##################ITERATION #4 ****************************************
 epoch: 0, train_loss: 1.2909, test_loss: 1.3112, test_f1: 0.2260
 epoch: 1, train_loss: 1.2500, test_loss: 1.3029, test_f1: 0.2260
 epoch: 2, train_loss: 1.2243, test_loss: 1.2850, test_f1: 0.2260
 epoch: 3, train_loss: 1.2024, test_loss: 1.2564, test_f1: 0.2708
 epoch: 4, train_loss: 1.1789, test_loss: 1.2006, test_f1: 0.3049
 epoch: 5, train_loss: 1.1584, test_loss: 1.1353, test_f1: 0.4299
 epoch: 6, train_loss: 1.1387, test_loss: 1.1019, test_f1: 0.4449
 epoch: 7, train_loss: 1.1194, test_loss: 1.0819, test_f1: 0.4546
 epoch: 8, train_loss: 1.1011, test_loss: 1.0682, test_f1: 0.4487
 epoch: 9, train_loss: 1.0850, test_loss: 1.0513, test_f1: 0.4515
 epoch: 10, train_loss: 1.0761, test_loss: 1.0427, test_f1: 0.4465
 epoch: 11, train_loss: 1.0596, test_loss: 1.0373, test_f1: 0.4664
 epoch: 12, train_loss: 1.0397, test_loss: 1.0308, test_f1: 0.4627
 epoch: 13, train_loss: 1.0314, test_loss: 1.0251, test_f1: 0.4605
 epoch: 14, train_loss: 1.0251, test_loss: 1.0178, test_f1: 0.4676
 epoch: 15, train_loss: 1.0189, test_loss: 1.0063, test_f1: 0.4838
 epoch: 16, train_loss: 1.0056, test_loss: 1.0081, test_f1: 0.4676
 epoch: 17, train_loss: 0.9972, test_loss: 1.0001, test_f1: 0.4812
 epoch: 18, train_loss: 0.9894, test_loss: 0.9918, test_f1: 0.4877
 epoch: 19, train_loss: 0.9782, test_loss: 0.9967, test_f1: 0.4784
 epoch: 20, train_loss: 0.9684, test_loss: 0.9854, test_f1: 0.4807
 epoch: 21, train_loss: 0.9638, test_loss: 0.9812, test_f1: 0.4955
 epoch: 22, train_loss: 0.9562, test_loss: 0.9802, test_f1: 0.4998
 epoch: 23, train_loss: 0.9444, test_loss: 0.9791, test_f1: 0.5019
 epoch: 24, train_loss: 0.9369, test_loss: 0.9729, test_f1: 0.4895
 epoch: 25, train_loss: 0.9230, test_loss: 0.9679, test_f1: 0.5018
 epoch: 26, train_loss: 0.9205, test_loss: 0.9658, test_f1: 0.4959
 epoch: 27, train_loss: 0.9179, test_loss: 0.9596, test_f1: 0.5083
 epoch: 28, train_loss: 0.9063, test_loss: 0.9585, test_f1: 0.5133
 epoch: 29, train_loss: 0.8907, test_loss: 0.9514, test_f1: 0.5172
 epoch: 30, train_loss: 0.8934, test_loss: 0.9416, test_f1: 0.5045
 epoch: 31, train_loss: 0.8843, test_loss: 0.9499, test_f1: 0.5027
 epoch: 32, train_loss: 0.8827, test_loss: 0.9364, test_f1: 0.5254
 epoch: 33, train_loss: 0.8769, test_loss: 0.9272, test_f1: 0.5129
 epoch: 34, train_loss: 0.8684, test_loss: 0.9354, test_f1: 0.5306
 epoch: 35, train_loss: 0.8635, test_loss: 0.9579, test_f1: 0.4831
 epoch: 36, train_loss: 0.8516, test_loss: 0.9323, test_f1: 0.5118
 epoch: 37, train_loss: 0.8487, test_loss: 0.9401, test_f1: 0.4965
 epoch: 38, train_loss: 0.8383, test_loss: 0.9225, test_f1: 0.5256
 epoch: 39, train_loss: 0.8332, test_loss: 0.9213, test_f1: 0.5342
 epoch: 40, train_loss: 0.8285, test_loss: 0.9122, test_f1: 0.5239
 epoch: 41, train_loss: 0.8279, test_loss: 0.9365, test_f1: 0.5176
 epoch: 42, train_loss: 0.8153, test_loss: 0.9175, test_f1: 0.5461
 epoch: 43, train_loss: 0.8148, test_loss: 0.9141, test_f1: 0.5346
 epoch: 44, train_loss: 0.8084, test_loss: 0.9188, test_f1: 0.5280
 epoch: 45, train_loss: 0.8102, test_loss: 0.9075, test_f1: 0.5485
 epoch: 46, train_loss: 0.8038, test_loss: 0.9319, test_f1: 0.5317
 epoch: 47, train_loss: 0.7967, test_loss: 0.9270, test_f1: 0.5386
 epoch: 48, train_loss: 0.7938, test_loss: 0.9068, test_f1: 0.5411
 epoch: 49, train_loss: 0.7824, test_loss: 0.9205, test_f1: 0.5392
 epoch: 50, train_loss: 0.7776, test_loss: 0.9171, test_f1: 0.5425
 epoch: 51, train_loss: 0.7624, test_loss: 0.9116, test_f1: 0.5425
 epoch: 52, train_loss: 0.7703, test_loss: 0.9211, test_f1: 0.5415
 epoch: 53, train_loss: 0.7676, test_loss: 0.9136, test_f1: 0.5387
 epoch: 54, train_loss: 0.7639, test_loss: 0.9100, test_f1: 0.5455
 epoch: 55, train_loss: 0.7626, test_loss: 0.9110, test_f1: 0.5417
 epoch: 56, train_loss: 0.7691, test_loss: 0.9146, test_f1: 0.5400
 epoch: 57, train_loss: 0.7674, test_loss: 0.9180, test_f1: 0.5391
 epoch: 58, train_loss: 0.7619, test_loss: 0.9103, test_f1: 0.5392
 epoch: 59, train_loss: 0.7596, test_loss: 0.9131, test_f1: 0.5398
 epoch: 60, train_loss: 0.7479, test_loss: 0.9202, test_f1: 0.5409
 epoch: 61, train_loss: 0.7450, test_loss: 0.9191, test_f1: 0.5500
 epoch: 62, train_loss: 0.7434, test_loss: 0.9417, test_f1: 0.5296
 epoch: 63, train_loss: 0.7539, test_loss: 0.9137, test_f1: 0.5433
 epoch: 64, train_loss: 0.7328, test_loss: 0.9205, test_f1: 0.5342
 epoch: 65, train_loss: 0.7419, test_loss: 0.9073, test_f1: 0.5499
 epoch: 66, train_loss: 0.7420, test_loss: 0.9195, test_f1: 0.5452
 epoch: 67, train_loss: 0.7390, test_loss: 0.9035, test_f1: 0.5491
 epoch: 68, train_loss: 0.7337, test_loss: 0.9146, test_f1: 0.5461
 epoch: 69, train_loss: 0.7374, test_loss: 0.9104, test_f1: 0.5471
 epoch: 70, train_loss: 0.7299, test_loss: 0.9351, test_f1: 0.5380
 epoch: 71, train_loss: 0.7318, test_loss: 0.9014, test_f1: 0.5528
 epoch: 72, train_loss: 0.7294, test_loss: 0.9244, test_f1: 0.5476
 epoch: 73, train_loss: 0.7238, test_loss: 0.9075, test_f1: 0.5519
 epoch: 74, train_loss: 0.7192, test_loss: 0.9185, test_f1: 0.5508
 epoch: 75, train_loss: 0.7232, test_loss: 0.9026, test_f1: 0.5499
 epoch: 76, train_loss: 0.7160, test_loss: 0.9177, test_f1: 0.5449
 epoch: 77, train_loss: 0.7195, test_loss: 0.9125, test_f1: 0.5563
 epoch: 78, train_loss: 0.7099, test_loss: 0.9271, test_f1: 0.5419
 epoch: 79, train_loss: 0.7101, test_loss: 0.9317, test_f1: 0.5430
 epoch: 80, train_loss: 0.7184, test_loss: 0.9332, test_f1: 0.5404
 epoch: 81, train_loss: 0.6992, test_loss: 0.9149, test_f1: 0.5459
 epoch: 82, train_loss: 0.7157, test_loss: 0.9271, test_f1: 0.5481
 epoch: 83, train_loss: 0.7038, test_loss: 0.9158, test_f1: 0.5512
 epoch: 84, train_loss: 0.7004, test_loss: 0.9075, test_f1: 0.5561
 epoch: 85, train_loss: 0.6994, test_loss: 0.9200, test_f1: 0.5550
 epoch: 86, train_loss: 0.6925, test_loss: 0.9306, test_f1: 0.5493
 epoch: 87, train_loss: 0.6895, test_loss: 0.9250, test_f1: 0.5508
 epoch: 88, train_loss: 0.6875, test_loss: 0.9371, test_f1: 0.5435
 epoch: 89, train_loss: 0.6967, test_loss: 0.9225, test_f1: 0.5579
 epoch: 90, train_loss: 0.6900, test_loss: 0.9383, test_f1: 0.5610
 epoch: 91, train_loss: 0.6977, test_loss: 0.9220, test_f1: 0.5611
 epoch: 92, train_loss: 0.6861, test_loss: 0.9279, test_f1: 0.5545
 epoch: 93, train_loss: 0.6905, test_loss: 0.9272, test_f1: 0.5563
 epoch: 94, train_loss: 0.6778, test_loss: 0.9598, test_f1: 0.5468
 epoch: 95, train_loss: 0.6850, test_loss: 0.9274, test_f1: 0.5683
 epoch: 96, train_loss: 0.6960, test_loss: 0.9388, test_f1: 0.5538
 epoch: 97, train_loss: 0.6871, test_loss: 0.9382, test_f1: 0.5685
 epoch: 98, train_loss: 0.6799, test_loss: 0.9306, test_f1: 0.5603
 epoch: 99, train_loss: 0.6839, test_loss: 0.9434, test_f1: 0.5555
##################ITERATION #5 ****************************************
 epoch: 0, train_loss: 1.2593, test_loss: 1.3102, test_f1: 0.2260
 epoch: 1, train_loss: 1.2037, test_loss: 1.2925, test_f1: 0.2260
 epoch: 2, train_loss: 1.1746, test_loss: 1.2549, test_f1: 0.2385
 epoch: 3, train_loss: 1.1532, test_loss: 1.1962, test_f1: 0.2762
 epoch: 4, train_loss: 1.1250, test_loss: 1.1325, test_f1: 0.4277
 epoch: 5, train_loss: 1.1074, test_loss: 1.0952, test_f1: 0.4310
 epoch: 6, train_loss: 1.0813, test_loss: 1.0664, test_f1: 0.4451
 epoch: 7, train_loss: 1.0632, test_loss: 1.0312, test_f1: 0.4652
 epoch: 8, train_loss: 1.0420, test_loss: 1.0098, test_f1: 0.4707
 epoch: 9, train_loss: 1.0226, test_loss: 0.9918, test_f1: 0.4727
 epoch: 10, train_loss: 1.0073, test_loss: 0.9773, test_f1: 0.4782
 epoch: 11, train_loss: 0.9994, test_loss: 0.9669, test_f1: 0.4782
 epoch: 12, train_loss: 0.9808, test_loss: 0.9568, test_f1: 0.4706
 epoch: 13, train_loss: 0.9658, test_loss: 0.9532, test_f1: 0.4766
 epoch: 14, train_loss: 0.9627, test_loss: 0.9311, test_f1: 0.4926
 epoch: 15, train_loss: 0.9480, test_loss: 0.9302, test_f1: 0.4910
 epoch: 16, train_loss: 0.9431, test_loss: 0.9199, test_f1: 0.4948
 epoch: 17, train_loss: 0.9312, test_loss: 0.9166, test_f1: 0.4880
 epoch: 18, train_loss: 0.9126, test_loss: 0.9136, test_f1: 0.4976
 epoch: 19, train_loss: 0.9192, test_loss: 0.9067, test_f1: 0.4955
 epoch: 20, train_loss: 0.9171, test_loss: 0.8997, test_f1: 0.4973
 epoch: 21, train_loss: 0.9035, test_loss: 0.9016, test_f1: 0.5011
 epoch: 22, train_loss: 0.8912, test_loss: 0.8925, test_f1: 0.5053
 epoch: 23, train_loss: 0.8844, test_loss: 0.8895, test_f1: 0.5034
 epoch: 24, train_loss: 0.8827, test_loss: 0.8766, test_f1: 0.5124
 epoch: 25, train_loss: 0.8761, test_loss: 0.8715, test_f1: 0.5053
 epoch: 26, train_loss: 0.8775, test_loss: 0.8871, test_f1: 0.5012
 epoch: 27, train_loss: 0.8685, test_loss: 0.8739, test_f1: 0.5013
 epoch: 28, train_loss: 0.8686, test_loss: 0.8705, test_f1: 0.5080
 epoch: 29, train_loss: 0.8529, test_loss: 0.8634, test_f1: 0.5209
 epoch: 30, train_loss: 0.8511, test_loss: 0.8628, test_f1: 0.5220
 epoch: 31, train_loss: 0.8464, test_loss: 0.8544, test_f1: 0.5263
 epoch: 32, train_loss: 0.8370, test_loss: 0.8548, test_f1: 0.5197
 epoch: 33, train_loss: 0.8398, test_loss: 0.8601, test_f1: 0.5216
 epoch: 34, train_loss: 0.8324, test_loss: 0.8500, test_f1: 0.5327
 epoch: 35, train_loss: 0.8300, test_loss: 0.8357, test_f1: 0.5328
 epoch: 36, train_loss: 0.8254, test_loss: 0.8488, test_f1: 0.5162
 epoch: 37, train_loss: 0.8154, test_loss: 0.8424, test_f1: 0.5322
 epoch: 38, train_loss: 0.8115, test_loss: 0.8317, test_f1: 0.5479
 epoch: 39, train_loss: 0.8066, test_loss: 0.8274, test_f1: 0.5412
 epoch: 40, train_loss: 0.8127, test_loss: 0.8366, test_f1: 0.5319
 epoch: 41, train_loss: 0.8047, test_loss: 0.8333, test_f1: 0.5409
 epoch: 42, train_loss: 0.7962, test_loss: 0.8258, test_f1: 0.5379
 epoch: 43, train_loss: 0.7863, test_loss: 0.8274, test_f1: 0.5483
 epoch: 44, train_loss: 0.7718, test_loss: 0.8411, test_f1: 0.5382
 epoch: 45, train_loss: 0.7681, test_loss: 0.8253, test_f1: 0.5477
 epoch: 46, train_loss: 0.7797, test_loss: 0.8204, test_f1: 0.5508
 epoch: 47, train_loss: 0.7750, test_loss: 0.8226, test_f1: 0.5511
 epoch: 48, train_loss: 0.7698, test_loss: 0.8301, test_f1: 0.5339
 epoch: 49, train_loss: 0.7647, test_loss: 0.8057, test_f1: 0.5517
 epoch: 50, train_loss: 0.7572, test_loss: 0.8070, test_f1: 0.5509
 epoch: 51, train_loss: 0.7573, test_loss: 0.8213, test_f1: 0.5416
 epoch: 52, train_loss: 0.7539, test_loss: 0.8230, test_f1: 0.5402
 epoch: 53, train_loss: 0.7549, test_loss: 0.8278, test_f1: 0.5555
 epoch: 54, train_loss: 0.7433, test_loss: 0.8183, test_f1: 0.5502
 epoch: 55, train_loss: 0.7445, test_loss: 0.8160, test_f1: 0.5568
 epoch: 56, train_loss: 0.7428, test_loss: 0.8119, test_f1: 0.5641
 epoch: 57, train_loss: 0.7320, test_loss: 0.8161, test_f1: 0.5639
 epoch: 58, train_loss: 0.7358, test_loss: 0.8205, test_f1: 0.5529
 epoch: 59, train_loss: 0.7428, test_loss: 0.8247, test_f1: 0.5477
 epoch: 60, train_loss: 0.7329, test_loss: 0.8253, test_f1: 0.5475
 epoch: 61, train_loss: 0.7285, test_loss: 0.8248, test_f1: 0.5738
 epoch: 62, train_loss: 0.7310, test_loss: 0.8276, test_f1: 0.5562
 epoch: 63, train_loss: 0.7293, test_loss: 0.8229, test_f1: 0.5652
 epoch: 64, train_loss: 0.7334, test_loss: 0.8418, test_f1: 0.5573
 epoch: 65, train_loss: 0.7315, test_loss: 0.8240, test_f1: 0.5533
 epoch: 66, train_loss: 0.7213, test_loss: 0.8290, test_f1: 0.5605
 epoch: 67, train_loss: 0.7218, test_loss: 0.8321, test_f1: 0.5504
 epoch: 68, train_loss: 0.7252, test_loss: 0.8329, test_f1: 0.5556
 epoch: 69, train_loss: 0.7129, test_loss: 0.8301, test_f1: 0.5568
 epoch: 70, train_loss: 0.7148, test_loss: 0.8168, test_f1: 0.5642
 epoch: 71, train_loss: 0.7138, test_loss: 0.8256, test_f1: 0.5594
 epoch: 72, train_loss: 0.7131, test_loss: 0.8252, test_f1: 0.5497
 epoch: 73, train_loss: 0.7202, test_loss: 0.8439, test_f1: 0.5601
 epoch: 74, train_loss: 0.7070, test_loss: 0.8215, test_f1: 0.5586
 epoch: 75, train_loss: 0.7111, test_loss: 0.8373, test_f1: 0.5600
 epoch: 76, train_loss: 0.7049, test_loss: 0.8495, test_f1: 0.5608
 epoch: 77, train_loss: 0.7041, test_loss: 0.8455, test_f1: 0.5590
 epoch: 78, train_loss: 0.6953, test_loss: 0.8333, test_f1: 0.5538
 epoch: 79, train_loss: 0.7145, test_loss: 0.8393, test_f1: 0.5527
 epoch: 80, train_loss: 0.6987, test_loss: 0.8343, test_f1: 0.5605
 epoch: 81, train_loss: 0.7057, test_loss: 0.8400, test_f1: 0.5598
 epoch: 82, train_loss: 0.7024, test_loss: 0.8449, test_f1: 0.5494
 epoch: 83, train_loss: 0.6961, test_loss: 0.8396, test_f1: 0.5601
 epoch: 84, train_loss: 0.6914, test_loss: 0.8212, test_f1: 0.5593
 epoch: 85, train_loss: 0.6862, test_loss: 0.8435, test_f1: 0.5635
 epoch: 86, train_loss: 0.6902, test_loss: 0.8490, test_f1: 0.5615
 epoch: 87, train_loss: 0.6880, test_loss: 0.8353, test_f1: 0.5541
 epoch: 88, train_loss: 0.6806, test_loss: 0.8369, test_f1: 0.5558
 epoch: 89, train_loss: 0.6922, test_loss: 0.8336, test_f1: 0.5593
 epoch: 90, train_loss: 0.6924, test_loss: 0.8277, test_f1: 0.5593
 epoch: 91, train_loss: 0.6849, test_loss: 0.8400, test_f1: 0.5625
 epoch: 92, train_loss: 0.6777, test_loss: 0.8426, test_f1: 0.5551
 epoch: 93, train_loss: 0.6766, test_loss: 0.8451, test_f1: 0.5591
 epoch: 94, train_loss: 0.6713, test_loss: 0.8387, test_f1: 0.5588
 epoch: 95, train_loss: 0.6788, test_loss: 0.8422, test_f1: 0.5581
 epoch: 96, train_loss: 0.6762, test_loss: 0.8492, test_f1: 0.5554
 epoch: 97, train_loss: 0.6780, test_loss: 0.8466, test_f1: 0.5584
 epoch: 98, train_loss: 0.6765, test_loss: 0.8592, test_f1: 0.5448
 epoch: 99, train_loss: 0.6645, test_loss: 0.8629, test_f1: 0.5558
##################ITERATION #6 ****************************************
 epoch: 0, train_loss: 1.2930, test_loss: 1.2962, test_f1: 0.2260
 epoch: 1, train_loss: 1.2203, test_loss: 1.2886, test_f1: 0.2620
 epoch: 2, train_loss: 1.1882, test_loss: 1.2614, test_f1: 0.3348
 epoch: 3, train_loss: 1.1676, test_loss: 1.1804, test_f1: 0.3640
 epoch: 4, train_loss: 1.1482, test_loss: 1.1225, test_f1: 0.4456
 epoch: 5, train_loss: 1.1282, test_loss: 1.0892, test_f1: 0.4571
 epoch: 6, train_loss: 1.1055, test_loss: 1.0617, test_f1: 0.4503
 epoch: 7, train_loss: 1.0892, test_loss: 1.0428, test_f1: 0.4534
 epoch: 8, train_loss: 1.0707, test_loss: 1.0285, test_f1: 0.4673
 epoch: 9, train_loss: 1.0586, test_loss: 1.0193, test_f1: 0.4758
 epoch: 10, train_loss: 1.0410, test_loss: 1.0099, test_f1: 0.4789
 epoch: 11, train_loss: 1.0347, test_loss: 1.0012, test_f1: 0.4779
 epoch: 12, train_loss: 1.0190, test_loss: 0.9942, test_f1: 0.4848
 epoch: 13, train_loss: 1.0034, test_loss: 0.9855, test_f1: 0.4776
 epoch: 14, train_loss: 0.9959, test_loss: 0.9843, test_f1: 0.4789
 epoch: 15, train_loss: 0.9812, test_loss: 0.9734, test_f1: 0.4798
 epoch: 16, train_loss: 0.9739, test_loss: 0.9661, test_f1: 0.4897
 epoch: 17, train_loss: 0.9648, test_loss: 0.9625, test_f1: 0.4816
 epoch: 18, train_loss: 0.9619, test_loss: 0.9583, test_f1: 0.4946
 epoch: 19, train_loss: 0.9549, test_loss: 0.9647, test_f1: 0.4828
 epoch: 20, train_loss: 0.9367, test_loss: 0.9524, test_f1: 0.4955
 epoch: 21, train_loss: 0.9396, test_loss: 0.9530, test_f1: 0.4917
 epoch: 22, train_loss: 0.9302, test_loss: 0.9597, test_f1: 0.4884
 epoch: 23, train_loss: 0.9156, test_loss: 0.9580, test_f1: 0.4815
 epoch: 24, train_loss: 0.9246, test_loss: 0.9409, test_f1: 0.4902
 epoch: 25, train_loss: 0.9149, test_loss: 0.9390, test_f1: 0.4941
 epoch: 26, train_loss: 0.9032, test_loss: 0.9456, test_f1: 0.4893
 epoch: 27, train_loss: 0.8909, test_loss: 0.9542, test_f1: 0.4878
 epoch: 28, train_loss: 0.8912, test_loss: 0.9656, test_f1: 0.4860
 epoch: 29, train_loss: 0.8892, test_loss: 0.9540, test_f1: 0.4963
 epoch: 30, train_loss: 0.8774, test_loss: 0.9383, test_f1: 0.4906
 epoch: 31, train_loss: 0.8724, test_loss: 0.9545, test_f1: 0.4897
 epoch: 32, train_loss: 0.8738, test_loss: 0.9474, test_f1: 0.4971
 epoch: 33, train_loss: 0.8540, test_loss: 0.9582, test_f1: 0.4937
 epoch: 34, train_loss: 0.8520, test_loss: 0.9627, test_f1: 0.4867
 epoch: 35, train_loss: 0.8521, test_loss: 0.9468, test_f1: 0.4989
 epoch: 36, train_loss: 0.8408, test_loss: 0.9745, test_f1: 0.4968
 epoch: 37, train_loss: 0.8414, test_loss: 0.9638, test_f1: 0.4895
 epoch: 38, train_loss: 0.8346, test_loss: 0.9548, test_f1: 0.4842
 epoch: 39, train_loss: 0.8362, test_loss: 0.9622, test_f1: 0.4886
 epoch: 40, train_loss: 0.8257, test_loss: 0.9699, test_f1: 0.4816
 epoch: 41, train_loss: 0.8317, test_loss: 0.9457, test_f1: 0.4964
 epoch: 42, train_loss: 0.8191, test_loss: 0.9463, test_f1: 0.4930
 epoch: 43, train_loss: 0.8158, test_loss: 0.9547, test_f1: 0.5027
 epoch: 44, train_loss: 0.8045, test_loss: 0.9648, test_f1: 0.4917
 epoch: 45, train_loss: 0.8049, test_loss: 0.9782, test_f1: 0.4967
 epoch: 46, train_loss: 0.7978, test_loss: 0.9572, test_f1: 0.4919
 epoch: 47, train_loss: 0.7936, test_loss: 0.9663, test_f1: 0.4972
 epoch: 48, train_loss: 0.7937, test_loss: 0.9655, test_f1: 0.4857
 epoch: 49, train_loss: 0.7774, test_loss: 0.9697, test_f1: 0.4935
 epoch: 50, train_loss: 0.7946, test_loss: 0.9771, test_f1: 0.5022
 epoch: 51, train_loss: 0.7893, test_loss: 0.9660, test_f1: 0.4903
 epoch: 52, train_loss: 0.7651, test_loss: 0.9731, test_f1: 0.4900
 epoch: 53, train_loss: 0.7748, test_loss: 0.9653, test_f1: 0.4971
 epoch: 54, train_loss: 0.7634, test_loss: 0.9797, test_f1: 0.4974
 epoch: 55, train_loss: 0.7686, test_loss: 0.9752, test_f1: 0.4988
 epoch: 56, train_loss: 0.7642, test_loss: 0.9864, test_f1: 0.4862
 epoch: 57, train_loss: 0.7707, test_loss: 0.9848, test_f1: 0.4858
 epoch: 58, train_loss: 0.7585, test_loss: 0.9845, test_f1: 0.4976
 epoch: 59, train_loss: 0.7533, test_loss: 0.9907, test_f1: 0.4946
 epoch: 60, train_loss: 0.7508, test_loss: 0.9794, test_f1: 0.4947
 epoch: 61, train_loss: 0.7502, test_loss: 0.9948, test_f1: 0.4980
 epoch: 62, train_loss: 0.7500, test_loss: 0.9904, test_f1: 0.4956
 epoch: 63, train_loss: 0.7454, test_loss: 0.9958, test_f1: 0.4926
 epoch: 64, train_loss: 0.7522, test_loss: 0.9905, test_f1: 0.4947
 epoch: 65, train_loss: 0.7500, test_loss: 1.0022, test_f1: 0.4872
 epoch: 66, train_loss: 0.7434, test_loss: 0.9747, test_f1: 0.4899
 epoch: 67, train_loss: 0.7437, test_loss: 0.9837, test_f1: 0.4968
 epoch: 68, train_loss: 0.7365, test_loss: 0.9890, test_f1: 0.4951
 epoch: 69, train_loss: 0.7551, test_loss: 0.9874, test_f1: 0.4991
 epoch: 70, train_loss: 0.7403, test_loss: 0.9887, test_f1: 0.4970
 epoch: 71, train_loss: 0.7303, test_loss: 0.9924, test_f1: 0.5040
 epoch: 72, train_loss: 0.7314, test_loss: 1.0020, test_f1: 0.4931
 epoch: 73, train_loss: 0.7235, test_loss: 1.0071, test_f1: 0.4951
 epoch: 74, train_loss: 0.7296, test_loss: 1.0006, test_f1: 0.4973
 epoch: 75, train_loss: 0.7257, test_loss: 1.0157, test_f1: 0.4934
 epoch: 76, train_loss: 0.7237, test_loss: 1.0018, test_f1: 0.4971
 epoch: 77, train_loss: 0.7195, test_loss: 1.0069, test_f1: 0.4907
 epoch: 78, train_loss: 0.7245, test_loss: 1.0110, test_f1: 0.4967
 epoch: 79, train_loss: 0.7226, test_loss: 1.0171, test_f1: 0.5020
 epoch: 80, train_loss: 0.7269, test_loss: 1.0100, test_f1: 0.4961
 epoch: 81, train_loss: 0.7252, test_loss: 1.0041, test_f1: 0.4993
 epoch: 82, train_loss: 0.7191, test_loss: 1.0213, test_f1: 0.4983
 epoch: 83, train_loss: 0.7134, test_loss: 1.0222, test_f1: 0.4968
 epoch: 84, train_loss: 0.7134, test_loss: 1.0153, test_f1: 0.5037
 epoch: 85, train_loss: 0.7119, test_loss: 1.0062, test_f1: 0.5057
 epoch: 86, train_loss: 0.7158, test_loss: 1.0167, test_f1: 0.4994
 epoch: 87, train_loss: 0.7087, test_loss: 1.0126, test_f1: 0.5032
 epoch: 88, train_loss: 0.7172, test_loss: 1.0164, test_f1: 0.4956
 epoch: 89, train_loss: 0.7009, test_loss: 1.0186, test_f1: 0.5063
 epoch: 90, train_loss: 0.7087, test_loss: 1.0123, test_f1: 0.5049
 epoch: 91, train_loss: 0.7027, test_loss: 1.0421, test_f1: 0.5017
 epoch: 92, train_loss: 0.7044, test_loss: 1.0337, test_f1: 0.5086
 epoch: 93, train_loss: 0.6973, test_loss: 1.0504, test_f1: 0.5091
 epoch: 94, train_loss: 0.6970, test_loss: 1.0325, test_f1: 0.5011
 epoch: 95, train_loss: 0.6875, test_loss: 1.0405, test_f1: 0.5010
 epoch: 96, train_loss: 0.7030, test_loss: 1.0502, test_f1: 0.5033
 epoch: 97, train_loss: 0.6913, test_loss: 1.0457, test_f1: 0.5123
 epoch: 98, train_loss: 0.6895, test_loss: 1.0596, test_f1: 0.5008
 epoch: 99, train_loss: 0.6943, test_loss: 1.0481, test_f1: 0.5091
##################ITERATION #7 ****************************************
 epoch: 0, train_loss: 1.3029, test_loss: 1.3051, test_f1: 0.2260
 epoch: 1, train_loss: 1.2259, test_loss: 1.3025, test_f1: 0.2260
 epoch: 2, train_loss: 1.1977, test_loss: 1.2765, test_f1: 0.2260
 epoch: 3, train_loss: 1.1648, test_loss: 1.2135, test_f1: 0.2531
 epoch: 4, train_loss: 1.1481, test_loss: 1.1282, test_f1: 0.4146
 epoch: 5, train_loss: 1.1215, test_loss: 1.0806, test_f1: 0.4648
 epoch: 6, train_loss: 1.1032, test_loss: 1.0594, test_f1: 0.4544
 epoch: 7, train_loss: 1.0890, test_loss: 1.0474, test_f1: 0.4589
 epoch: 8, train_loss: 1.0644, test_loss: 1.0356, test_f1: 0.4498
 epoch: 9, train_loss: 1.0584, test_loss: 1.0251, test_f1: 0.4640
 epoch: 10, train_loss: 1.0418, test_loss: 1.0206, test_f1: 0.4582
 epoch: 11, train_loss: 1.0217, test_loss: 1.0107, test_f1: 0.4562
 epoch: 12, train_loss: 1.0219, test_loss: 1.0030, test_f1: 0.4666
 epoch: 13, train_loss: 1.0087, test_loss: 0.9933, test_f1: 0.4653
 epoch: 14, train_loss: 1.0034, test_loss: 0.9890, test_f1: 0.4660
 epoch: 15, train_loss: 0.9821, test_loss: 0.9839, test_f1: 0.4659
 epoch: 16, train_loss: 0.9787, test_loss: 0.9801, test_f1: 0.4653
 epoch: 17, train_loss: 0.9726, test_loss: 0.9802, test_f1: 0.4628
 epoch: 18, train_loss: 0.9653, test_loss: 0.9727, test_f1: 0.4627
 epoch: 19, train_loss: 0.9553, test_loss: 0.9650, test_f1: 0.4643
 epoch: 20, train_loss: 0.9507, test_loss: 0.9640, test_f1: 0.4820
 epoch: 21, train_loss: 0.9390, test_loss: 0.9591, test_f1: 0.4777
 epoch: 22, train_loss: 0.9367, test_loss: 0.9584, test_f1: 0.4876
 epoch: 23, train_loss: 0.9231, test_loss: 0.9596, test_f1: 0.4802
 epoch: 24, train_loss: 0.9252, test_loss: 0.9650, test_f1: 0.4761
 epoch: 25, train_loss: 0.9087, test_loss: 0.9531, test_f1: 0.4885
 epoch: 26, train_loss: 0.9013, test_loss: 0.9604, test_f1: 0.4804
 epoch: 27, train_loss: 0.9030, test_loss: 0.9457, test_f1: 0.4907
 epoch: 28, train_loss: 0.8965, test_loss: 0.9423, test_f1: 0.4953
 epoch: 29, train_loss: 0.8894, test_loss: 0.9370, test_f1: 0.4870
 epoch: 30, train_loss: 0.8797, test_loss: 0.9446, test_f1: 0.4971
 epoch: 31, train_loss: 0.8707, test_loss: 0.9449, test_f1: 0.4945
 epoch: 32, train_loss: 0.8649, test_loss: 0.9401, test_f1: 0.5066
 epoch: 33, train_loss: 0.8638, test_loss: 0.9468, test_f1: 0.5046
 epoch: 34, train_loss: 0.8642, test_loss: 0.9574, test_f1: 0.4924
 epoch: 35, train_loss: 0.8489, test_loss: 0.9322, test_f1: 0.5090
 epoch: 36, train_loss: 0.8554, test_loss: 0.9269, test_f1: 0.5196
 epoch: 37, train_loss: 0.8496, test_loss: 0.9236, test_f1: 0.5157
 epoch: 38, train_loss: 0.8424, test_loss: 0.9334, test_f1: 0.5123
 epoch: 39, train_loss: 0.8277, test_loss: 0.9319, test_f1: 0.5220
 epoch: 40, train_loss: 0.8238, test_loss: 0.9487, test_f1: 0.5204
 epoch: 41, train_loss: 0.8252, test_loss: 0.9415, test_f1: 0.5159
 epoch: 42, train_loss: 0.8179, test_loss: 0.9480, test_f1: 0.5159
 epoch: 43, train_loss: 0.8153, test_loss: 0.9256, test_f1: 0.5219
 epoch: 44, train_loss: 0.8145, test_loss: 0.9457, test_f1: 0.5193
 epoch: 45, train_loss: 0.8195, test_loss: 0.9396, test_f1: 0.5264
 epoch: 46, train_loss: 0.7948, test_loss: 0.9590, test_f1: 0.5268
 epoch: 47, train_loss: 0.7931, test_loss: 0.9547, test_f1: 0.5163
 epoch: 48, train_loss: 0.7956, test_loss: 0.9653, test_f1: 0.5273
 epoch: 49, train_loss: 0.7814, test_loss: 0.9476, test_f1: 0.5341
 epoch: 50, train_loss: 0.7825, test_loss: 0.9652, test_f1: 0.5192
 epoch: 51, train_loss: 0.7770, test_loss: 0.9625, test_f1: 0.5292
 epoch: 52, train_loss: 0.7738, test_loss: 0.9538, test_f1: 0.5277
 epoch: 53, train_loss: 0.7669, test_loss: 0.9557, test_f1: 0.5252
 epoch: 54, train_loss: 0.7660, test_loss: 0.9640, test_f1: 0.5177
 epoch: 55, train_loss: 0.7672, test_loss: 0.9531, test_f1: 0.5316
 epoch: 56, train_loss: 0.7649, test_loss: 0.9544, test_f1: 0.5216
 epoch: 57, train_loss: 0.7645, test_loss: 0.9576, test_f1: 0.5266
 epoch: 58, train_loss: 0.7596, test_loss: 0.9656, test_f1: 0.5315
 epoch: 59, train_loss: 0.7488, test_loss: 0.9554, test_f1: 0.5309
 epoch: 60, train_loss: 0.7641, test_loss: 0.9647, test_f1: 0.5222
 epoch: 61, train_loss: 0.7516, test_loss: 0.9761, test_f1: 0.5158
 epoch: 62, train_loss: 0.7523, test_loss: 0.9775, test_f1: 0.5188
 epoch: 63, train_loss: 0.7429, test_loss: 0.9772, test_f1: 0.5151
 epoch: 64, train_loss: 0.7365, test_loss: 0.9805, test_f1: 0.5205
 epoch: 65, train_loss: 0.7459, test_loss: 0.9699, test_f1: 0.5342
 epoch: 66, train_loss: 0.7443, test_loss: 0.9795, test_f1: 0.5368
 epoch: 67, train_loss: 0.7324, test_loss: 0.9710, test_f1: 0.5276
 epoch: 68, train_loss: 0.7326, test_loss: 0.9684, test_f1: 0.5256
 epoch: 69, train_loss: 0.7285, test_loss: 0.9720, test_f1: 0.5380
 epoch: 70, train_loss: 0.7264, test_loss: 0.9908, test_f1: 0.5313
 epoch: 71, train_loss: 0.7310, test_loss: 0.9703, test_f1: 0.5360
 epoch: 72, train_loss: 0.7287, test_loss: 0.9820, test_f1: 0.5377
 epoch: 73, train_loss: 0.7272, test_loss: 0.9750, test_f1: 0.5290
 epoch: 74, train_loss: 0.7376, test_loss: 0.9791, test_f1: 0.5398
 epoch: 75, train_loss: 0.7231, test_loss: 0.9881, test_f1: 0.5181
 epoch: 76, train_loss: 0.7196, test_loss: 0.9876, test_f1: 0.5109
 epoch: 77, train_loss: 0.7156, test_loss: 0.9821, test_f1: 0.5311
 epoch: 78, train_loss: 0.7270, test_loss: 0.9981, test_f1: 0.5229
 epoch: 79, train_loss: 0.7199, test_loss: 0.9850, test_f1: 0.5266
 epoch: 80, train_loss: 0.7138, test_loss: 0.9849, test_f1: 0.5248
 epoch: 81, train_loss: 0.7118, test_loss: 1.0152, test_f1: 0.5260
 epoch: 82, train_loss: 0.7106, test_loss: 1.0007, test_f1: 0.5228
 epoch: 83, train_loss: 0.7195, test_loss: 1.0116, test_f1: 0.5304
 epoch: 84, train_loss: 0.7121, test_loss: 0.9894, test_f1: 0.5277
 epoch: 85, train_loss: 0.7053, test_loss: 0.9939, test_f1: 0.5314
 epoch: 86, train_loss: 0.7104, test_loss: 1.0044, test_f1: 0.5267
 epoch: 87, train_loss: 0.7018, test_loss: 1.0114, test_f1: 0.5234
 epoch: 88, train_loss: 0.6990, test_loss: 1.0317, test_f1: 0.5352
 epoch: 89, train_loss: 0.7030, test_loss: 1.0218, test_f1: 0.5249
 epoch: 90, train_loss: 0.7075, test_loss: 1.0028, test_f1: 0.5355
 epoch: 91, train_loss: 0.6952, test_loss: 1.0127, test_f1: 0.5297
 epoch: 92, train_loss: 0.6899, test_loss: 1.0179, test_f1: 0.5192
 epoch: 93, train_loss: 0.6964, test_loss: 1.0059, test_f1: 0.5394
 epoch: 94, train_loss: 0.6997, test_loss: 1.0041, test_f1: 0.5541
 epoch: 95, train_loss: 0.6907, test_loss: 1.0123, test_f1: 0.5378
 epoch: 96, train_loss: 0.6891, test_loss: 1.0280, test_f1: 0.5389
 epoch: 97, train_loss: 0.6776, test_loss: 1.0276, test_f1: 0.5334
 epoch: 98, train_loss: 0.6827, test_loss: 1.0436, test_f1: 0.5158
 epoch: 99, train_loss: 0.6794, test_loss: 1.0195, test_f1: 0.5240
##################ITERATION #8 ****************************************
 epoch: 0, train_loss: 1.2955, test_loss: 1.3108, test_f1: 0.2260
 epoch: 1, train_loss: 1.2117, test_loss: 1.2995, test_f1: 0.2260
 epoch: 2, train_loss: 1.1748, test_loss: 1.2718, test_f1: 0.2959
 epoch: 3, train_loss: 1.1528, test_loss: 1.1827, test_f1: 0.3653
 epoch: 4, train_loss: 1.1362, test_loss: 1.1163, test_f1: 0.4186
 epoch: 5, train_loss: 1.1066, test_loss: 1.0685, test_f1: 0.4486
 epoch: 6, train_loss: 1.0886, test_loss: 1.0497, test_f1: 0.4564
 epoch: 7, train_loss: 1.0786, test_loss: 1.0363, test_f1: 0.4593
 epoch: 8, train_loss: 1.0602, test_loss: 1.0259, test_f1: 0.4600
 epoch: 9, train_loss: 1.0556, test_loss: 1.0174, test_f1: 0.4663
 epoch: 10, train_loss: 1.0401, test_loss: 1.0153, test_f1: 0.4679
 epoch: 11, train_loss: 1.0286, test_loss: 1.0029, test_f1: 0.4768
 epoch: 12, train_loss: 1.0186, test_loss: 0.9918, test_f1: 0.4812
 epoch: 13, train_loss: 1.0170, test_loss: 0.9906, test_f1: 0.4747
 epoch: 14, train_loss: 0.9993, test_loss: 0.9877, test_f1: 0.4876
 epoch: 15, train_loss: 0.9850, test_loss: 0.9723, test_f1: 0.4864
 epoch: 16, train_loss: 0.9802, test_loss: 0.9657, test_f1: 0.4870
 epoch: 17, train_loss: 0.9823, test_loss: 0.9635, test_f1: 0.4871
 epoch: 18, train_loss: 0.9703, test_loss: 0.9592, test_f1: 0.4967
 epoch: 19, train_loss: 0.9595, test_loss: 0.9617, test_f1: 0.5047
 epoch: 20, train_loss: 0.9549, test_loss: 0.9593, test_f1: 0.5010
 epoch: 21, train_loss: 0.9445, test_loss: 0.9601, test_f1: 0.5182
 epoch: 22, train_loss: 0.9445, test_loss: 0.9593, test_f1: 0.5091
 epoch: 23, train_loss: 0.9376, test_loss: 0.9543, test_f1: 0.5110
 epoch: 24, train_loss: 0.9310, test_loss: 0.9420, test_f1: 0.5184
 epoch: 25, train_loss: 0.9284, test_loss: 0.9674, test_f1: 0.5002
 epoch: 26, train_loss: 0.9178, test_loss: 0.9597, test_f1: 0.5182
 epoch: 27, train_loss: 0.9225, test_loss: 0.9513, test_f1: 0.5225
 epoch: 28, train_loss: 0.9086, test_loss: 0.9429, test_f1: 0.5259
 epoch: 29, train_loss: 0.9053, test_loss: 0.9353, test_f1: 0.5259
 epoch: 30, train_loss: 0.8918, test_loss: 0.9604, test_f1: 0.5135
 epoch: 31, train_loss: 0.8883, test_loss: 0.9660, test_f1: 0.5125
 epoch: 32, train_loss: 0.8817, test_loss: 0.9490, test_f1: 0.5301
 epoch: 33, train_loss: 0.8739, test_loss: 0.9632, test_f1: 0.5229
 epoch: 34, train_loss: 0.8788, test_loss: 0.9633, test_f1: 0.5242
 epoch: 35, train_loss: 0.8757, test_loss: 0.9455, test_f1: 0.5335
 epoch: 36, train_loss: 0.8703, test_loss: 0.9380, test_f1: 0.5401
 epoch: 37, train_loss: 0.8596, test_loss: 0.9555, test_f1: 0.5330
 epoch: 38, train_loss: 0.8542, test_loss: 0.9777, test_f1: 0.5273
 epoch: 39, train_loss: 0.8440, test_loss: 0.9412, test_f1: 0.5278
 epoch: 40, train_loss: 0.8469, test_loss: 0.9599, test_f1: 0.5287
 epoch: 41, train_loss: 0.8350, test_loss: 0.9453, test_f1: 0.5269
 epoch: 42, train_loss: 0.8438, test_loss: 0.9418, test_f1: 0.5242
 epoch: 43, train_loss: 0.8316, test_loss: 0.9813, test_f1: 0.5191
 epoch: 44, train_loss: 0.8307, test_loss: 0.9258, test_f1: 0.5520
 epoch: 45, train_loss: 0.8260, test_loss: 0.9500, test_f1: 0.5346
 epoch: 46, train_loss: 0.8181, test_loss: 0.9351, test_f1: 0.5390
 epoch: 47, train_loss: 0.8164, test_loss: 0.9178, test_f1: 0.5302
 epoch: 48, train_loss: 0.8093, test_loss: 0.9194, test_f1: 0.5410
 epoch: 49, train_loss: 0.7935, test_loss: 0.9368, test_f1: 0.5221
 epoch: 50, train_loss: 0.7975, test_loss: 1.0187, test_f1: 0.5192
 epoch: 51, train_loss: 0.7938, test_loss: 0.9783, test_f1: 0.5170
 epoch: 52, train_loss: 0.7855, test_loss: 0.9237, test_f1: 0.5312
 epoch: 53, train_loss: 0.7828, test_loss: 0.9386, test_f1: 0.5244
 epoch: 54, train_loss: 0.7822, test_loss: 0.9899, test_f1: 0.5202
 epoch: 55, train_loss: 0.7913, test_loss: 0.9781, test_f1: 0.5321
 epoch: 56, train_loss: 0.7871, test_loss: 0.9783, test_f1: 0.5300
 epoch: 57, train_loss: 0.7806, test_loss: 0.9517, test_f1: 0.5202
 epoch: 58, train_loss: 0.7785, test_loss: 0.9963, test_f1: 0.5270
 epoch: 59, train_loss: 0.7799, test_loss: 0.9908, test_f1: 0.5265
 epoch: 60, train_loss: 0.7737, test_loss: 0.9710, test_f1: 0.5268
 epoch: 61, train_loss: 0.7753, test_loss: 0.9690, test_f1: 0.5327
 epoch: 62, train_loss: 0.7656, test_loss: 0.9307, test_f1: 0.5372
 epoch: 63, train_loss: 0.7716, test_loss: 0.9350, test_f1: 0.5426
 epoch: 64, train_loss: 0.7568, test_loss: 0.9815, test_f1: 0.5270
 epoch: 65, train_loss: 0.7616, test_loss: 0.9710, test_f1: 0.5247
 epoch: 66, train_loss: 0.7641, test_loss: 0.9250, test_f1: 0.5432
 epoch: 67, train_loss: 0.7603, test_loss: 0.9286, test_f1: 0.5449
 epoch: 68, train_loss: 0.7585, test_loss: 1.0003, test_f1: 0.5313
 epoch: 69, train_loss: 0.7504, test_loss: 0.9695, test_f1: 0.5383
 epoch: 70, train_loss: 0.7592, test_loss: 0.9537, test_f1: 0.5317
 epoch: 71, train_loss: 0.7500, test_loss: 0.9661, test_f1: 0.5263
 epoch: 72, train_loss: 0.7457, test_loss: 1.0126, test_f1: 0.5366
 epoch: 73, train_loss: 0.7387, test_loss: 1.0049, test_f1: 0.5281
 epoch: 74, train_loss: 0.7445, test_loss: 1.0271, test_f1: 0.5367
 epoch: 75, train_loss: 0.7432, test_loss: 1.0566, test_f1: 0.5383
 epoch: 76, train_loss: 0.7397, test_loss: 1.0316, test_f1: 0.5331
 epoch: 77, train_loss: 0.7344, test_loss: 1.0150, test_f1: 0.5390
 epoch: 78, train_loss: 0.7320, test_loss: 0.9791, test_f1: 0.5342
 epoch: 79, train_loss: 0.7348, test_loss: 1.0164, test_f1: 0.5340
 epoch: 80, train_loss: 0.7421, test_loss: 1.0029, test_f1: 0.5393
 epoch: 81, train_loss: 0.7346, test_loss: 0.9989, test_f1: 0.5391
 epoch: 82, train_loss: 0.7262, test_loss: 0.9999, test_f1: 0.5414
 epoch: 83, train_loss: 0.7240, test_loss: 0.9835, test_f1: 0.5420
 epoch: 84, train_loss: 0.7315, test_loss: 0.9993, test_f1: 0.5329
 epoch: 85, train_loss: 0.7200, test_loss: 1.0063, test_f1: 0.5423
 epoch: 86, train_loss: 0.7228, test_loss: 0.9949, test_f1: 0.5360
 epoch: 87, train_loss: 0.7313, test_loss: 1.0158, test_f1: 0.5368
 epoch: 88, train_loss: 0.7137, test_loss: 0.9947, test_f1: 0.5344
 epoch: 89, train_loss: 0.7138, test_loss: 0.9794, test_f1: 0.5360
 epoch: 90, train_loss: 0.7095, test_loss: 0.9724, test_f1: 0.5409
 epoch: 91, train_loss: 0.7119, test_loss: 1.0140, test_f1: 0.5343
 epoch: 92, train_loss: 0.7063, test_loss: 1.0080, test_f1: 0.5357
 epoch: 93, train_loss: 0.7121, test_loss: 0.9923, test_f1: 0.5400
 epoch: 94, train_loss: 0.7237, test_loss: 1.0711, test_f1: 0.5375
 epoch: 95, train_loss: 0.7022, test_loss: 1.0675, test_f1: 0.5341
 epoch: 96, train_loss: 0.7005, test_loss: 1.0355, test_f1: 0.5384
 epoch: 97, train_loss: 0.7034, test_loss: 1.0444, test_f1: 0.5326
 epoch: 98, train_loss: 0.7017, test_loss: 1.1152, test_f1: 0.5436
 epoch: 99, train_loss: 0.6966, test_loss: 1.1232, test_f1: 0.5275
##################ITERATION #9 ****************************************
 epoch: 0, train_loss: 1.3151, test_loss: 1.3329, test_f1: 0.2260
 epoch: 1, train_loss: 1.2072, test_loss: 1.3212, test_f1: 0.2540
 epoch: 2, train_loss: 1.1722, test_loss: 1.3012, test_f1: 0.3075
 epoch: 3, train_loss: 1.1433, test_loss: 1.1937, test_f1: 0.3327
 epoch: 4, train_loss: 1.1242, test_loss: 1.0971, test_f1: 0.4386
 epoch: 5, train_loss: 1.0998, test_loss: 1.0538, test_f1: 0.4633
 epoch: 6, train_loss: 1.0766, test_loss: 1.0318, test_f1: 0.4769
 epoch: 7, train_loss: 1.0645, test_loss: 1.0148, test_f1: 0.4849
 epoch: 8, train_loss: 1.0533, test_loss: 1.0017, test_f1: 0.4779
 epoch: 9, train_loss: 1.0436, test_loss: 0.9930, test_f1: 0.4742
 epoch: 10, train_loss: 1.0291, test_loss: 0.9793, test_f1: 0.4809
 epoch: 11, train_loss: 1.0163, test_loss: 0.9658, test_f1: 0.4846
 epoch: 12, train_loss: 1.0062, test_loss: 0.9618, test_f1: 0.4898
 epoch: 13, train_loss: 0.9904, test_loss: 0.9588, test_f1: 0.4710
 epoch: 14, train_loss: 0.9790, test_loss: 0.9485, test_f1: 0.4726
 epoch: 15, train_loss: 0.9742, test_loss: 0.9373, test_f1: 0.4806
 epoch: 16, train_loss: 0.9675, test_loss: 0.9286, test_f1: 0.4897
 epoch: 17, train_loss: 0.9623, test_loss: 0.9301, test_f1: 0.4921
 epoch: 18, train_loss: 0.9548, test_loss: 0.9245, test_f1: 0.4871
 epoch: 19, train_loss: 0.9455, test_loss: 0.9159, test_f1: 0.4929
 epoch: 20, train_loss: 0.9348, test_loss: 0.9109, test_f1: 0.4965
 epoch: 21, train_loss: 0.9290, test_loss: 0.9071, test_f1: 0.4958
 epoch: 22, train_loss: 0.9131, test_loss: 0.8990, test_f1: 0.4970
 epoch: 23, train_loss: 0.9069, test_loss: 0.8957, test_f1: 0.5007
 epoch: 24, train_loss: 0.9125, test_loss: 0.8932, test_f1: 0.5000
 epoch: 25, train_loss: 0.9039, test_loss: 0.8794, test_f1: 0.5064
 epoch: 26, train_loss: 0.8919, test_loss: 0.8920, test_f1: 0.4996
 epoch: 27, train_loss: 0.8867, test_loss: 0.8872, test_f1: 0.5020
 epoch: 28, train_loss: 0.8734, test_loss: 0.8805, test_f1: 0.5116
 epoch: 29, train_loss: 0.8708, test_loss: 0.8767, test_f1: 0.5169
 epoch: 30, train_loss: 0.8623, test_loss: 0.8776, test_f1: 0.5045
 epoch: 31, train_loss: 0.8603, test_loss: 0.8860, test_f1: 0.5060
 epoch: 32, train_loss: 0.8419, test_loss: 0.8788, test_f1: 0.5144
 epoch: 33, train_loss: 0.8415, test_loss: 0.8698, test_f1: 0.5118
 epoch: 34, train_loss: 0.8387, test_loss: 0.8824, test_f1: 0.5049
 epoch: 35, train_loss: 0.8350, test_loss: 0.9159, test_f1: 0.5046
 epoch: 36, train_loss: 0.8138, test_loss: 0.9135, test_f1: 0.5005
 epoch: 37, train_loss: 0.8223, test_loss: 0.8669, test_f1: 0.5151
 epoch: 38, train_loss: 0.8153, test_loss: 0.9071, test_f1: 0.5115
 epoch: 39, train_loss: 0.8167, test_loss: 0.9181, test_f1: 0.5089
 epoch: 40, train_loss: 0.8051, test_loss: 0.8647, test_f1: 0.5264
 epoch: 41, train_loss: 0.7964, test_loss: 0.8744, test_f1: 0.5256
 epoch: 42, train_loss: 0.7991, test_loss: 0.9047, test_f1: 0.5192
 epoch: 43, train_loss: 0.7815, test_loss: 0.8828, test_f1: 0.5349
 epoch: 44, train_loss: 0.7819, test_loss: 0.8992, test_f1: 0.5284
 epoch: 45, train_loss: 0.7734, test_loss: 0.9062, test_f1: 0.5334
 epoch: 46, train_loss: 0.7710, test_loss: 0.8712, test_f1: 0.5430
 epoch: 47, train_loss: 0.7682, test_loss: 0.9160, test_f1: 0.5433
 epoch: 48, train_loss: 0.7634, test_loss: 0.8334, test_f1: 0.5668
 epoch: 49, train_loss: 0.7694, test_loss: 0.8546, test_f1: 0.5448
 epoch: 50, train_loss: 0.7586, test_loss: 0.8752, test_f1: 0.5437
 epoch: 51, train_loss: 0.7507, test_loss: 0.8795, test_f1: 0.5516
 epoch: 52, train_loss: 0.7389, test_loss: 0.8643, test_f1: 0.5517
 epoch: 53, train_loss: 0.7319, test_loss: 0.8750, test_f1: 0.5546
 epoch: 54, train_loss: 0.7304, test_loss: 0.8636, test_f1: 0.5522
 epoch: 55, train_loss: 0.7326, test_loss: 0.8853, test_f1: 0.5499
 epoch: 56, train_loss: 0.7229, test_loss: 0.8545, test_f1: 0.5604
 epoch: 57, train_loss: 0.7186, test_loss: 0.8758, test_f1: 0.5436
 epoch: 58, train_loss: 0.7300, test_loss: 0.8579, test_f1: 0.5578
 epoch: 59, train_loss: 0.7167, test_loss: 0.8835, test_f1: 0.5514
 epoch: 60, train_loss: 0.7172, test_loss: 0.8812, test_f1: 0.5538
 epoch: 61, train_loss: 0.7123, test_loss: 0.8827, test_f1: 0.5590
 epoch: 62, train_loss: 0.7185, test_loss: 0.8672, test_f1: 0.5589
 epoch: 63, train_loss: 0.7137, test_loss: 0.8855, test_f1: 0.5532
 epoch: 64, train_loss: 0.7174, test_loss: 0.8747, test_f1: 0.5627
 epoch: 65, train_loss: 0.7195, test_loss: 0.8747, test_f1: 0.5581
 epoch: 66, train_loss: 0.7110, test_loss: 0.8940, test_f1: 0.5675
 epoch: 67, train_loss: 0.7092, test_loss: 0.8692, test_f1: 0.5531
 epoch: 68, train_loss: 0.7001, test_loss: 0.8459, test_f1: 0.5565
 epoch: 69, train_loss: 0.7035, test_loss: 0.8857, test_f1: 0.5618
 epoch: 70, train_loss: 0.7036, test_loss: 0.8762, test_f1: 0.5643
 epoch: 71, train_loss: 0.7024, test_loss: 0.8649, test_f1: 0.5618
 epoch: 72, train_loss: 0.6935, test_loss: 0.8905, test_f1: 0.5574
 epoch: 73, train_loss: 0.7004, test_loss: 0.8690, test_f1: 0.5637
 epoch: 74, train_loss: 0.7003, test_loss: 0.8353, test_f1: 0.5656
 epoch: 75, train_loss: 0.7057, test_loss: 0.8474, test_f1: 0.5691
 epoch: 76, train_loss: 0.6940, test_loss: 0.8698, test_f1: 0.5570
 epoch: 77, train_loss: 0.6836, test_loss: 0.8682, test_f1: 0.5612
 epoch: 78, train_loss: 0.6887, test_loss: 0.8565, test_f1: 0.5660
 epoch: 79, train_loss: 0.6925, test_loss: 0.8686, test_f1: 0.5735
 epoch: 80, train_loss: 0.6842, test_loss: 0.8739, test_f1: 0.5708
 epoch: 81, train_loss: 0.6830, test_loss: 0.8979, test_f1: 0.5618
 epoch: 82, train_loss: 0.6678, test_loss: 0.8749, test_f1: 0.5646
 epoch: 83, train_loss: 0.6757, test_loss: 0.8700, test_f1: 0.5690
 epoch: 84, train_loss: 0.6729, test_loss: 0.8881, test_f1: 0.5702
 epoch: 85, train_loss: 0.6851, test_loss: 0.8762, test_f1: 0.5619
 epoch: 86, train_loss: 0.6729, test_loss: 0.8811, test_f1: 0.5746
 epoch: 87, train_loss: 0.6675, test_loss: 0.8938, test_f1: 0.5720
 epoch: 88, train_loss: 0.6679, test_loss: 0.8816, test_f1: 0.5670
 epoch: 89, train_loss: 0.6681, test_loss: 0.8694, test_f1: 0.5695
 epoch: 90, train_loss: 0.6659, test_loss: 0.8438, test_f1: 0.5689
 epoch: 91, train_loss: 0.6707, test_loss: 0.8667, test_f1: 0.5691
 epoch: 92, train_loss: 0.6632, test_loss: 0.8843, test_f1: 0.5666
 epoch: 93, train_loss: 0.6619, test_loss: 0.8649, test_f1: 0.5665
 epoch: 94, train_loss: 0.6589, test_loss: 0.9016, test_f1: 0.5699
 epoch: 95, train_loss: 0.6641, test_loss: 0.8830, test_f1: 0.5673
 epoch: 96, train_loss: 0.6557, test_loss: 0.8941, test_f1: 0.5644
 epoch: 97, train_loss: 0.6677, test_loss: 0.8820, test_f1: 0.5645
 epoch: 98, train_loss: 0.6722, test_loss: 0.9043, test_f1: 0.5725
 epoch: 99, train_loss: 0.6539, test_loss: 0.8949, test_f1: 0.5652

Training completed in 444.01 seconds
Best F1: 0.5746 at epoch 86
Mean F1 across iterations: 0.5484  0.0205
========================FINAL RESULTS================================
FEGIN weighted F1: 0.5746  0.0205
python main.py --data ltspice_examples --representation component_pin --model FEGIN --layers 4 --hiddens 64 --batch_size 256 --lr 0.0001 --emb_size 128 --epochs 100 --save_appendix component_pin_L4_H64_BS256_LR0.0001_E128 --no_val
-----



STDERR:
  File "main.py", line 370, in <module>
    main()
  File "main.py", line 254, in main
    dataset = dataset_class(
  File "/home/philip/projects/ltspice_examples_code_repo/Circuit-Completion-Using-GNNs/component_classification_with_link_prediction_head/evaluation/FEGIN/kernel/circuit_datasets.py", line 15, in __init__
    self.data, self.slices = torch.load(self.processed_paths[0])
  File "/home/philip/.local/lib/python3.8/site-packages/torch/serialization.py", line 1040, in load
    warnings.warn(
  File "/usr/lib/python3.8/warnings.py", line 109, in _showwarnmsg
    sw(msg.message, msg.category, msg.filename, msg.lineno,
  File "main.py", line 47, in warn_with_traceback
    traceback.print_stack(file=log)
/home/philip/projects/ltspice_examples_code_repo/Circuit-Completion-Using-GNNs/component_classification_with_link_prediction_head/evaluation/FEGIN/kernel/circuit_datasets.py:15: FutureWarning: You are using `torch.load` with `weights_only=False` (the current default value), which uses the default pickle module implicitly. It is possible to construct malicious pickle data which will execute arbitrary code during unpickling (See https://github.com/pytorch/pytorch/blob/main/SECURITY.md#untrusted-models for more details). In a future release, the default value for `weights_only` will be flipped to `True`. This limits the functions that could be executed during unpickling. Arbitrary objects will no longer be allowed to be loaded via this mode unless they are explicitly allowlisted by the user via `torch.serialization.add_safe_globals`. We recommend you start setting `weights_only=True` for any use case where you don't have full control of the loaded file. Please open an issue on GitHub for any issues related to this experimental feature.
  self.data, self.slices = torch.load(self.processed_paths[0])
