STDOUT:
Results will be saved in /home/philip/projects/ltspice_examples_code_repo/Circuit-Completion-Using-GNNs/component_classification_with_link_prediction_head/evaluation/FEGIN/results/model_FEGIN_dataset_ltspice_demos
Command line input: python main.py --data ltspice_demos --representation component_component --model FEGIN --layers 5 --hiddens 128 --batch_size 256 --lr 0.001 --emb_size 250 --epochs 100 --save_appendix component_component_L5_H128_BS256_LR0.001_E250 --no_val
 is saved.
-----
ltspice_demos - FEGIN
Using 5 layers, 128 hidden units, h = 2
Loading component_component representation dataset
ENTERED
Training FEGIN on component_component representation
Train: 1565, Test: 383
##################ITERATION #0 ****************************************
 epoch: 0, train_loss: 1.3417, test_loss: 1.3395, test_f1: 0.1443
 epoch: 1, train_loss: 1.2072, test_loss: 1.3046, test_f1: 0.3466
 epoch: 2, train_loss: 1.1681, test_loss: 1.3095, test_f1: 0.3513
 epoch: 3, train_loss: 1.1182, test_loss: 1.3052, test_f1: 0.3643
 epoch: 4, train_loss: 1.0889, test_loss: 1.3194, test_f1: 0.3567
 epoch: 5, train_loss: 1.0501, test_loss: 1.3378, test_f1: 0.3792
 epoch: 6, train_loss: 1.0285, test_loss: 1.2287, test_f1: 0.4257
 epoch: 7, train_loss: 0.9797, test_loss: 1.2043, test_f1: 0.4774
 epoch: 8, train_loss: 0.9600, test_loss: 1.1576, test_f1: 0.4548
 epoch: 9, train_loss: 0.9316, test_loss: 1.1491, test_f1: 0.4487
 epoch: 10, train_loss: 0.9120, test_loss: 1.2131, test_f1: 0.4787
 epoch: 11, train_loss: 0.9030, test_loss: 1.2150, test_f1: 0.4616
 epoch: 12, train_loss: 0.8622, test_loss: 1.3822, test_f1: 0.4883
 epoch: 13, train_loss: 0.8360, test_loss: 1.3022, test_f1: 0.4639
 epoch: 14, train_loss: 0.8292, test_loss: 1.2420, test_f1: 0.5232
 epoch: 15, train_loss: 0.8154, test_loss: 1.2161, test_f1: 0.4782
 epoch: 16, train_loss: 0.7868, test_loss: 1.3197, test_f1: 0.5400
 epoch: 17, train_loss: 0.7725, test_loss: 1.2085, test_f1: 0.4702
 epoch: 18, train_loss: 0.7625, test_loss: 1.2045, test_f1: 0.5053
 epoch: 19, train_loss: 0.7396, test_loss: 1.1830, test_f1: 0.5208
 epoch: 20, train_loss: 0.7307, test_loss: 1.2111, test_f1: 0.5642
 epoch: 21, train_loss: 0.7235, test_loss: 1.1846, test_f1: 0.5820
 epoch: 22, train_loss: 0.7218, test_loss: 1.4373, test_f1: 0.4967
 epoch: 23, train_loss: 0.6850, test_loss: 1.2283, test_f1: 0.5333
 epoch: 24, train_loss: 0.6779, test_loss: 1.2148, test_f1: 0.5742
 epoch: 25, train_loss: 0.6588, test_loss: 1.1962, test_f1: 0.5429
 epoch: 26, train_loss: 0.6295, test_loss: 1.6901, test_f1: 0.4467
 epoch: 27, train_loss: 0.6593, test_loss: 1.4151, test_f1: 0.5107
 epoch: 28, train_loss: 0.6086, test_loss: 1.9102, test_f1: 0.5418
 epoch: 29, train_loss: 0.6520, test_loss: 2.0139, test_f1: 0.5681
 epoch: 30, train_loss: 0.6717, test_loss: 1.7369, test_f1: 0.5335
 epoch: 31, train_loss: 0.7133, test_loss: 1.2436, test_f1: 0.5325
 epoch: 32, train_loss: 0.6702, test_loss: 1.3399, test_f1: 0.5142
 epoch: 33, train_loss: 0.6375, test_loss: 1.2909, test_f1: 0.4977
 epoch: 34, train_loss: 0.6240, test_loss: 1.5287, test_f1: 0.4584
 epoch: 35, train_loss: 0.6075, test_loss: 1.8122, test_f1: 0.4903
 epoch: 36, train_loss: 0.5494, test_loss: 1.3450, test_f1: 0.5774
 epoch: 37, train_loss: 0.5792, test_loss: 1.5248, test_f1: 0.5926
 epoch: 38, train_loss: 0.5742, test_loss: 1.5041, test_f1: 0.5455
 epoch: 39, train_loss: 0.5660, test_loss: 1.6780, test_f1: 0.5380
 epoch: 40, train_loss: 0.5574, test_loss: 1.4913, test_f1: 0.5560
 epoch: 41, train_loss: 0.5188, test_loss: 1.3624, test_f1: 0.5797
 epoch: 42, train_loss: 0.5575, test_loss: 1.5162, test_f1: 0.5696
 epoch: 43, train_loss: 0.5325, test_loss: 1.4975, test_f1: 0.5458
 epoch: 44, train_loss: 0.5247, test_loss: 1.3148, test_f1: 0.5750
 epoch: 45, train_loss: 0.4991, test_loss: 1.4291, test_f1: 0.5531
 epoch: 46, train_loss: 0.5411, test_loss: 1.6951, test_f1: 0.5193
 epoch: 47, train_loss: 0.5417, test_loss: 1.7623, test_f1: 0.4887
 epoch: 48, train_loss: 0.4923, test_loss: 1.6652, test_f1: 0.5787
 epoch: 49, train_loss: 0.5074, test_loss: 1.8307, test_f1: 0.5214
 epoch: 50, train_loss: 0.4606, test_loss: 1.7536, test_f1: 0.5240
 epoch: 51, train_loss: 0.4313, test_loss: 1.7221, test_f1: 0.5251
 epoch: 52, train_loss: 0.4076, test_loss: 1.7133, test_f1: 0.5559
 epoch: 53, train_loss: 0.4000, test_loss: 1.6663, test_f1: 0.5693
 epoch: 54, train_loss: 0.4194, test_loss: 1.7492, test_f1: 0.5333
 epoch: 55, train_loss: 0.4059, test_loss: 1.8418, test_f1: 0.5358
 epoch: 56, train_loss: 0.3754, test_loss: 1.7132, test_f1: 0.5068
 epoch: 57, train_loss: 0.3826, test_loss: 1.8522, test_f1: 0.5143
 epoch: 58, train_loss: 0.3640, test_loss: 2.0197, test_f1: 0.5164
 epoch: 59, train_loss: 0.3805, test_loss: 1.7901, test_f1: 0.5388
 epoch: 60, train_loss: 0.3689, test_loss: 1.7568, test_f1: 0.5580
 epoch: 61, train_loss: 0.3664, test_loss: 1.7646, test_f1: 0.5520
 epoch: 62, train_loss: 0.3607, test_loss: 1.8132, test_f1: 0.5096
 epoch: 63, train_loss: 0.3340, test_loss: 1.7857, test_f1: 0.5410
 epoch: 64, train_loss: 0.3456, test_loss: 1.7515, test_f1: 0.5664
 epoch: 65, train_loss: 0.3429, test_loss: 1.6553, test_f1: 0.5746
 epoch: 66, train_loss: 0.3808, test_loss: 1.7636, test_f1: 0.5819
 epoch: 67, train_loss: 0.3528, test_loss: 1.8417, test_f1: 0.5569
 epoch: 68, train_loss: 0.3459, test_loss: 1.9133, test_f1: 0.5601
 epoch: 69, train_loss: 0.3822, test_loss: 1.7620, test_f1: 0.5386
 epoch: 70, train_loss: 0.3391, test_loss: 1.7060, test_f1: 0.5446
 epoch: 71, train_loss: 0.3357, test_loss: 1.6721, test_f1: 0.5787
 epoch: 72, train_loss: 0.3375, test_loss: 1.8527, test_f1: 0.5643
 epoch: 73, train_loss: 0.3221, test_loss: 1.9550, test_f1: 0.5629
 epoch: 74, train_loss: 0.3032, test_loss: 2.1479, test_f1: 0.5112
 epoch: 75, train_loss: 0.3015, test_loss: 2.1998, test_f1: 0.4899
 epoch: 76, train_loss: 0.3455, test_loss: 2.1086, test_f1: 0.4894
 epoch: 77, train_loss: 0.3307, test_loss: 1.9133, test_f1: 0.5132
 epoch: 78, train_loss: 0.3214, test_loss: 1.8630, test_f1: 0.5584
 epoch: 79, train_loss: 0.3117, test_loss: 2.1194, test_f1: 0.5167
 epoch: 80, train_loss: 0.3228, test_loss: 2.1297, test_f1: 0.5139
 epoch: 81, train_loss: 0.3121, test_loss: 1.9951, test_f1: 0.5684
 epoch: 82, train_loss: 0.3144, test_loss: 2.3439, test_f1: 0.5627
 epoch: 83, train_loss: 0.3349, test_loss: 2.1576, test_f1: 0.5359
 epoch: 84, train_loss: 0.3200, test_loss: 2.1803, test_f1: 0.5668
 epoch: 85, train_loss: 0.3091, test_loss: 2.3370, test_f1: 0.5118
 epoch: 86, train_loss: 0.3122, test_loss: 2.0848, test_f1: 0.5489
 epoch: 87, train_loss: 0.2928, test_loss: 2.0669, test_f1: 0.5603
 epoch: 88, train_loss: 0.2783, test_loss: 2.1102, test_f1: 0.5711
 epoch: 89, train_loss: 0.2975, test_loss: 2.0778, test_f1: 0.5577
 epoch: 90, train_loss: 0.2928, test_loss: 2.1783, test_f1: 0.5619
 epoch: 91, train_loss: 0.2975, test_loss: 2.0814, test_f1: 0.5616
 epoch: 92, train_loss: 0.3124, test_loss: 2.0384, test_f1: 0.5739
 epoch: 93, train_loss: 0.3003, test_loss: 1.9681, test_f1: 0.5754
 epoch: 94, train_loss: 0.3034, test_loss: 2.0900, test_f1: 0.5520
 epoch: 95, train_loss: 0.2615, test_loss: 2.0507, test_f1: 0.5334
 epoch: 96, train_loss: 0.2903, test_loss: 2.2803, test_f1: 0.5302
 epoch: 97, train_loss: 0.2617, test_loss: 2.2981, test_f1: 0.5413
 epoch: 98, train_loss: 0.2622, test_loss: 2.1092, test_f1: 0.5426
 epoch: 99, train_loss: 0.3011, test_loss: 2.1378, test_f1: 0.5617
##################ITERATION #1 ****************************************
 epoch: 0, train_loss: 1.2558, test_loss: 1.3163, test_f1: 0.3365
 epoch: 1, train_loss: 1.1240, test_loss: 1.2712, test_f1: 0.3458
 epoch: 2, train_loss: 1.0642, test_loss: 1.2273, test_f1: 0.3595
 epoch: 3, train_loss: 1.0224, test_loss: 1.2127, test_f1: 0.3659
 epoch: 4, train_loss: 0.9768, test_loss: 1.1726, test_f1: 0.3730
 epoch: 5, train_loss: 0.9286, test_loss: 1.1596, test_f1: 0.3945
 epoch: 6, train_loss: 0.8947, test_loss: 1.1395, test_f1: 0.4226
 epoch: 7, train_loss: 0.8827, test_loss: 1.1575, test_f1: 0.5199
 epoch: 8, train_loss: 0.8465, test_loss: 1.1625, test_f1: 0.5314
 epoch: 9, train_loss: 0.7981, test_loss: 1.1290, test_f1: 0.5279
 epoch: 10, train_loss: 0.7778, test_loss: 1.2716, test_f1: 0.5353
 epoch: 11, train_loss: 0.7676, test_loss: 1.5079, test_f1: 0.5401
 epoch: 12, train_loss: 0.7593, test_loss: 1.3667, test_f1: 0.5552
 epoch: 13, train_loss: 0.7518, test_loss: 1.3691, test_f1: 0.5608
 epoch: 14, train_loss: 0.7152, test_loss: 1.2866, test_f1: 0.5551
 epoch: 15, train_loss: 0.7102, test_loss: 1.4222, test_f1: 0.5754
 epoch: 16, train_loss: 0.6970, test_loss: 1.4570, test_f1: 0.5288
 epoch: 17, train_loss: 0.6854, test_loss: 1.3492, test_f1: 0.5488
 epoch: 18, train_loss: 0.6502, test_loss: 1.3744, test_f1: 0.5893
 epoch: 19, train_loss: 0.6446, test_loss: 1.5052, test_f1: 0.5608
 epoch: 20, train_loss: 0.6751, test_loss: 1.6163, test_f1: 0.5431
 epoch: 21, train_loss: 0.6745, test_loss: 1.8800, test_f1: 0.5022
 epoch: 22, train_loss: 0.6518, test_loss: 1.6584, test_f1: 0.5446
 epoch: 23, train_loss: 0.6246, test_loss: 1.6379, test_f1: 0.5556
 epoch: 24, train_loss: 0.6276, test_loss: 1.4343, test_f1: 0.5793
 epoch: 25, train_loss: 0.6060, test_loss: 1.6347, test_f1: 0.5860
 epoch: 26, train_loss: 0.5943, test_loss: 1.6817, test_f1: 0.5260
 epoch: 27, train_loss: 0.5974, test_loss: 1.6543, test_f1: 0.5345
 epoch: 28, train_loss: 0.6175, test_loss: 1.6196, test_f1: 0.5471
 epoch: 29, train_loss: 0.5799, test_loss: 1.7139, test_f1: 0.5186
 epoch: 30, train_loss: 0.5514, test_loss: 1.6735, test_f1: 0.5618
 epoch: 31, train_loss: 0.5624, test_loss: 1.9416, test_f1: 0.5148
 epoch: 32, train_loss: 0.5483, test_loss: 2.3182, test_f1: 0.5069
 epoch: 33, train_loss: 0.5584, test_loss: 2.1315, test_f1: 0.5324
 epoch: 34, train_loss: 0.5494, test_loss: 2.0768, test_f1: 0.5527
 epoch: 35, train_loss: 0.5089, test_loss: 1.9866, test_f1: 0.5859
 epoch: 36, train_loss: 0.4879, test_loss: 2.0547, test_f1: 0.5963
 epoch: 37, train_loss: 0.5251, test_loss: 2.0276, test_f1: 0.5367
 epoch: 38, train_loss: 0.4687, test_loss: 1.9121, test_f1: 0.5542
 epoch: 39, train_loss: 0.4960, test_loss: 2.0306, test_f1: 0.5618
 epoch: 40, train_loss: 0.4814, test_loss: 2.1859, test_f1: 0.5622
 epoch: 41, train_loss: 0.5315, test_loss: 2.7985, test_f1: 0.5343
 epoch: 42, train_loss: 0.5145, test_loss: 2.2647, test_f1: 0.5667
 epoch: 43, train_loss: 0.4964, test_loss: 2.2649, test_f1: 0.5426
 epoch: 44, train_loss: 0.4889, test_loss: 2.3647, test_f1: 0.5664
 epoch: 45, train_loss: 0.4933, test_loss: 2.0597, test_f1: 0.5525
 epoch: 46, train_loss: 0.4785, test_loss: 1.8654, test_f1: 0.6008
 epoch: 47, train_loss: 0.4647, test_loss: 2.1177, test_f1: 0.5382
 epoch: 48, train_loss: 0.4314, test_loss: 2.4795, test_f1: 0.5073
 epoch: 49, train_loss: 0.4238, test_loss: 1.9669, test_f1: 0.5937
 epoch: 50, train_loss: 0.4604, test_loss: 2.4316, test_f1: 0.5416
 epoch: 51, train_loss: 0.4341, test_loss: 2.3386, test_f1: 0.5646
 epoch: 52, train_loss: 0.3891, test_loss: 2.2267, test_f1: 0.5812
 epoch: 53, train_loss: 0.3804, test_loss: 2.4374, test_f1: 0.5699
 epoch: 54, train_loss: 0.3863, test_loss: 2.4418, test_f1: 0.5635
 epoch: 55, train_loss: 0.3977, test_loss: 2.7580, test_f1: 0.5570
 epoch: 56, train_loss: 0.3531, test_loss: 2.9614, test_f1: 0.5715
 epoch: 57, train_loss: 0.3606, test_loss: 2.7946, test_f1: 0.5979
 epoch: 58, train_loss: 0.4343, test_loss: 2.9815, test_f1: 0.5975
 epoch: 59, train_loss: 0.4133, test_loss: 2.7755, test_f1: 0.5844
 epoch: 60, train_loss: 0.4031, test_loss: 2.7119, test_f1: 0.5788
 epoch: 61, train_loss: 0.3765, test_loss: 2.8001, test_f1: 0.5619
 epoch: 62, train_loss: 0.3422, test_loss: 3.0548, test_f1: 0.5953
 epoch: 63, train_loss: 0.3445, test_loss: 2.7710, test_f1: 0.5888
 epoch: 64, train_loss: 0.3128, test_loss: 3.0599, test_f1: 0.5693
 epoch: 65, train_loss: 0.3259, test_loss: 3.4125, test_f1: 0.5561
 epoch: 66, train_loss: 0.3416, test_loss: 3.3175, test_f1: 0.5678
 epoch: 67, train_loss: 0.3137, test_loss: 2.9767, test_f1: 0.5744
 epoch: 68, train_loss: 0.3546, test_loss: 2.5367, test_f1: 0.5946
 epoch: 69, train_loss: 0.3316, test_loss: 2.5293, test_f1: 0.5853
 epoch: 70, train_loss: 0.3339, test_loss: 2.6352, test_f1: 0.5731
 epoch: 71, train_loss: 0.3594, test_loss: 2.9072, test_f1: 0.5379
 epoch: 72, train_loss: 0.3453, test_loss: 2.4475, test_f1: 0.5526
 epoch: 73, train_loss: 0.3081, test_loss: 2.2613, test_f1: 0.5762
 epoch: 74, train_loss: 0.3224, test_loss: 2.2519, test_f1: 0.5641
 epoch: 75, train_loss: 0.2976, test_loss: 2.4416, test_f1: 0.5743
 epoch: 76, train_loss: 0.3225, test_loss: 2.4725, test_f1: 0.5498
 epoch: 77, train_loss: 0.2941, test_loss: 2.4930, test_f1: 0.5532
 epoch: 78, train_loss: 0.2997, test_loss: 2.4420, test_f1: 0.5732
 epoch: 79, train_loss: 0.3017, test_loss: 2.5082, test_f1: 0.5696
 epoch: 80, train_loss: 0.2921, test_loss: 2.3981, test_f1: 0.5631
 epoch: 81, train_loss: 0.2959, test_loss: 2.5293, test_f1: 0.5619
 epoch: 82, train_loss: 0.2787, test_loss: 2.8726, test_f1: 0.5503
 epoch: 83, train_loss: 0.2867, test_loss: 2.7462, test_f1: 0.5636
 epoch: 84, train_loss: 0.2909, test_loss: 3.2424, test_f1: 0.5512
 epoch: 85, train_loss: 0.2814, test_loss: 3.4820, test_f1: 0.5450
 epoch: 86, train_loss: 0.2944, test_loss: 3.6989, test_f1: 0.5498
 epoch: 87, train_loss: 0.2842, test_loss: 3.7365, test_f1: 0.5657
 epoch: 88, train_loss: 0.2470, test_loss: 3.4235, test_f1: 0.5464
 epoch: 89, train_loss: 0.2627, test_loss: 3.0059, test_f1: 0.5562
 epoch: 90, train_loss: 0.2659, test_loss: 2.8407, test_f1: 0.5690
 epoch: 91, train_loss: 0.2610, test_loss: 3.3305, test_f1: 0.5568
 epoch: 92, train_loss: 0.2691, test_loss: 3.6817, test_f1: 0.5641
 epoch: 93, train_loss: 0.2896, test_loss: 3.0792, test_f1: 0.5668
 epoch: 94, train_loss: 0.2782, test_loss: 2.8850, test_f1: 0.5875
 epoch: 95, train_loss: 0.2645, test_loss: 2.7738, test_f1: 0.5925
 epoch: 96, train_loss: 0.2473, test_loss: 2.9691, test_f1: 0.5662
 epoch: 97, train_loss: 0.2654, test_loss: 3.2794, test_f1: 0.5566
 epoch: 98, train_loss: 0.2703, test_loss: 3.3632, test_f1: 0.5971
 epoch: 99, train_loss: 0.2724, test_loss: 3.5784, test_f1: 0.5513
##################ITERATION #2 ****************************************
 epoch: 0, train_loss: 1.2499, test_loss: 1.3641, test_f1: 0.1836
 epoch: 1, train_loss: 1.1182, test_loss: 1.3074, test_f1: 0.1836
 epoch: 2, train_loss: 1.0606, test_loss: 1.2737, test_f1: 0.3425
 epoch: 3, train_loss: 1.0164, test_loss: 1.2328, test_f1: 0.4036
 epoch: 4, train_loss: 0.9905, test_loss: 1.2025, test_f1: 0.5305
 epoch: 5, train_loss: 0.9253, test_loss: 1.1962, test_f1: 0.4876
 epoch: 6, train_loss: 0.8989, test_loss: 1.1690, test_f1: 0.4985
 epoch: 7, train_loss: 0.8563, test_loss: 1.2063, test_f1: 0.5176
 epoch: 8, train_loss: 0.8439, test_loss: 1.2311, test_f1: 0.5196
 epoch: 9, train_loss: 0.8015, test_loss: 1.4098, test_f1: 0.5002
 epoch: 10, train_loss: 0.7940, test_loss: 1.2598, test_f1: 0.5215
 epoch: 11, train_loss: 0.7582, test_loss: 1.2410, test_f1: 0.5666
 epoch: 12, train_loss: 0.7507, test_loss: 1.5874, test_f1: 0.4662
 epoch: 13, train_loss: 0.7570, test_loss: 1.5913, test_f1: 0.5052
 epoch: 14, train_loss: 0.7419, test_loss: 1.5860, test_f1: 0.4862
 epoch: 15, train_loss: 0.7388, test_loss: 1.5391, test_f1: 0.5350
 epoch: 16, train_loss: 0.7113, test_loss: 1.4174, test_f1: 0.5458
 epoch: 17, train_loss: 0.7153, test_loss: 1.4658, test_f1: 0.5757
 epoch: 18, train_loss: 0.7277, test_loss: 1.4131, test_f1: 0.5166
 epoch: 19, train_loss: 0.7055, test_loss: 1.5300, test_f1: 0.4983
 epoch: 20, train_loss: 0.6742, test_loss: 1.5275, test_f1: 0.5318
 epoch: 21, train_loss: 0.6539, test_loss: 1.5864, test_f1: 0.5419
 epoch: 22, train_loss: 0.6492, test_loss: 1.5788, test_f1: 0.5667
 epoch: 23, train_loss: 0.6104, test_loss: 1.5550, test_f1: 0.5440
 epoch: 24, train_loss: 0.5892, test_loss: 1.4721, test_f1: 0.5865
 epoch: 25, train_loss: 0.5824, test_loss: 1.7400, test_f1: 0.5553
 epoch: 26, train_loss: 0.5994, test_loss: 1.7788, test_f1: 0.5145
 epoch: 27, train_loss: 0.6098, test_loss: 1.7675, test_f1: 0.5237
 epoch: 28, train_loss: 0.5904, test_loss: 1.8765, test_f1: 0.5425
 epoch: 29, train_loss: 0.6344, test_loss: 2.3255, test_f1: 0.4664
 epoch: 30, train_loss: 0.5629, test_loss: 1.9827, test_f1: 0.5412
 epoch: 31, train_loss: 0.5772, test_loss: 1.8047, test_f1: 0.5475
 epoch: 32, train_loss: 0.5883, test_loss: 1.5335, test_f1: 0.5342
 epoch: 33, train_loss: 0.5708, test_loss: 1.6140, test_f1: 0.5847
 epoch: 34, train_loss: 0.5532, test_loss: 1.7227, test_f1: 0.5402
 epoch: 35, train_loss: 0.5270, test_loss: 1.5030, test_f1: 0.5306
 epoch: 36, train_loss: 0.5616, test_loss: 1.3852, test_f1: 0.5939
 epoch: 37, train_loss: 0.5338, test_loss: 1.6044, test_f1: 0.6093
 epoch: 38, train_loss: 0.5142, test_loss: 1.5631, test_f1: 0.6028
 epoch: 39, train_loss: 0.4799, test_loss: 1.5676, test_f1: 0.6057
 epoch: 40, train_loss: 0.5032, test_loss: 1.8926, test_f1: 0.5628
 epoch: 41, train_loss: 0.5042, test_loss: 1.7916, test_f1: 0.4937
 epoch: 42, train_loss: 0.5213, test_loss: 2.0059, test_f1: 0.5522
 epoch: 43, train_loss: 0.5017, test_loss: 2.8887, test_f1: 0.5718
 epoch: 44, train_loss: 0.5406, test_loss: 2.0142, test_f1: 0.5156
 epoch: 45, train_loss: 0.5787, test_loss: 1.8229, test_f1: 0.5422
 epoch: 46, train_loss: 0.5895, test_loss: 1.5649, test_f1: 0.5716
 epoch: 47, train_loss: 0.5863, test_loss: 1.7122, test_f1: 0.4713
 epoch: 48, train_loss: 0.5781, test_loss: 1.7537, test_f1: 0.5229
 epoch: 49, train_loss: 0.5292, test_loss: 1.6414, test_f1: 0.5523
 epoch: 50, train_loss: 0.5213, test_loss: 1.6119, test_f1: 0.5704
 epoch: 51, train_loss: 0.4667, test_loss: 1.6590, test_f1: 0.5713
 epoch: 52, train_loss: 0.4432, test_loss: 1.8090, test_f1: 0.5628
 epoch: 53, train_loss: 0.4271, test_loss: 1.7949, test_f1: 0.5842
 epoch: 54, train_loss: 0.4157, test_loss: 1.6542, test_f1: 0.5899
 epoch: 55, train_loss: 0.4095, test_loss: 1.4749, test_f1: 0.5808
 epoch: 56, train_loss: 0.4201, test_loss: 1.6871, test_f1: 0.5838
 epoch: 57, train_loss: 0.4331, test_loss: 2.0159, test_f1: 0.5643
 epoch: 58, train_loss: 0.3933, test_loss: 1.8626, test_f1: 0.5299
 epoch: 59, train_loss: 0.4190, test_loss: 2.0255, test_f1: 0.5464
 epoch: 60, train_loss: 0.4151, test_loss: 2.0719, test_f1: 0.5190
 epoch: 61, train_loss: 0.3933, test_loss: 2.0795, test_f1: 0.5366
 epoch: 62, train_loss: 0.3801, test_loss: 2.1489, test_f1: 0.5706
 epoch: 63, train_loss: 0.3581, test_loss: 2.4968, test_f1: 0.5721
 epoch: 64, train_loss: 0.3571, test_loss: 2.3934, test_f1: 0.5912
 epoch: 65, train_loss: 0.3563, test_loss: 2.2037, test_f1: 0.5757
 epoch: 66, train_loss: 0.3562, test_loss: 2.2140, test_f1: 0.5237
 epoch: 67, train_loss: 0.3283, test_loss: 2.2035, test_f1: 0.5473
 epoch: 68, train_loss: 0.3617, test_loss: 2.2212, test_f1: 0.5195
 epoch: 69, train_loss: 0.3575, test_loss: 2.0974, test_f1: 0.5598
 epoch: 70, train_loss: 0.3323, test_loss: 1.9148, test_f1: 0.5724
 epoch: 71, train_loss: 0.3389, test_loss: 1.9510, test_f1: 0.5844
 epoch: 72, train_loss: 0.3255, test_loss: 2.2309, test_f1: 0.5327
 epoch: 73, train_loss: 0.3573, test_loss: 2.0831, test_f1: 0.5526
 epoch: 74, train_loss: 0.3284, test_loss: 1.9954, test_f1: 0.5941
 epoch: 75, train_loss: 0.3254, test_loss: 1.8994, test_f1: 0.6115
 epoch: 76, train_loss: 0.3259, test_loss: 2.0000, test_f1: 0.5820
 epoch: 77, train_loss: 0.3277, test_loss: 1.9264, test_f1: 0.5893
 epoch: 78, train_loss: 0.3188, test_loss: 2.0263, test_f1: 0.5750
 epoch: 79, train_loss: 0.3012, test_loss: 2.1601, test_f1: 0.5836
 epoch: 80, train_loss: 0.3341, test_loss: 2.1969, test_f1: 0.5695
 epoch: 81, train_loss: 0.3191, test_loss: 2.2803, test_f1: 0.5365
 epoch: 82, train_loss: 0.3272, test_loss: 2.3629, test_f1: 0.5763
 epoch: 83, train_loss: 0.3400, test_loss: 2.4438, test_f1: 0.5769
 epoch: 84, train_loss: 0.3539, test_loss: 2.4571, test_f1: 0.5426
 epoch: 85, train_loss: 0.3665, test_loss: 2.2140, test_f1: 0.5601
 epoch: 86, train_loss: 0.3547, test_loss: 2.4186, test_f1: 0.5392
 epoch: 87, train_loss: 0.3166, test_loss: 2.5162, test_f1: 0.5876
 epoch: 88, train_loss: 0.3766, test_loss: 2.4172, test_f1: 0.5779
 epoch: 89, train_loss: 0.3926, test_loss: 2.2552, test_f1: 0.5759
 epoch: 90, train_loss: 0.3665, test_loss: 2.1987, test_f1: 0.5456
 epoch: 91, train_loss: 0.3518, test_loss: 2.2111, test_f1: 0.5836
 epoch: 92, train_loss: 0.3232, test_loss: 2.1267, test_f1: 0.5680
 epoch: 93, train_loss: 0.3512, test_loss: 1.9757, test_f1: 0.5916
 epoch: 94, train_loss: 0.3224, test_loss: 1.8721, test_f1: 0.6187
 epoch: 95, train_loss: 0.3308, test_loss: 1.7582, test_f1: 0.5993
 epoch: 96, train_loss: 0.3410, test_loss: 1.9021, test_f1: 0.5727
 epoch: 97, train_loss: 0.3413, test_loss: 2.0309, test_f1: 0.5923
 epoch: 98, train_loss: 0.3174, test_loss: 2.0046, test_f1: 0.6035
 epoch: 99, train_loss: 0.3300, test_loss: 2.0504, test_f1: 0.5890
##################ITERATION #3 ****************************************
 epoch: 0, train_loss: 1.2229, test_loss: 1.3225, test_f1: 0.1425
 epoch: 1, train_loss: 1.0910, test_loss: 1.3201, test_f1: 0.2017
 epoch: 2, train_loss: 1.0411, test_loss: 1.2279, test_f1: 0.2787
 epoch: 3, train_loss: 1.0097, test_loss: 1.2303, test_f1: 0.3372
 epoch: 4, train_loss: 0.9503, test_loss: 1.2157, test_f1: 0.4350
 epoch: 5, train_loss: 0.9126, test_loss: 1.1520, test_f1: 0.5405
 epoch: 6, train_loss: 0.8867, test_loss: 1.1480, test_f1: 0.4407
 epoch: 7, train_loss: 0.8654, test_loss: 1.1608, test_f1: 0.5122
 epoch: 8, train_loss: 0.8662, test_loss: 1.2308, test_f1: 0.5789
 epoch: 9, train_loss: 0.8254, test_loss: 1.1971, test_f1: 0.5034
 epoch: 10, train_loss: 0.7952, test_loss: 1.1866, test_f1: 0.5488
 epoch: 11, train_loss: 0.7919, test_loss: 1.1680, test_f1: 0.5159
 epoch: 12, train_loss: 0.7790, test_loss: 1.3353, test_f1: 0.5404
 epoch: 13, train_loss: 0.7609, test_loss: 1.2629, test_f1: 0.5091
 epoch: 14, train_loss: 0.7494, test_loss: 1.5958, test_f1: 0.3676
 epoch: 15, train_loss: 0.7349, test_loss: 1.4281, test_f1: 0.5666
 epoch: 16, train_loss: 0.7271, test_loss: 1.6212, test_f1: 0.4604
 epoch: 17, train_loss: 0.7003, test_loss: 1.3798, test_f1: 0.5048
 epoch: 18, train_loss: 0.7000, test_loss: 1.4356, test_f1: 0.5292
 epoch: 19, train_loss: 0.7061, test_loss: 1.5819, test_f1: 0.4605
 epoch: 20, train_loss: 0.7036, test_loss: 1.4728, test_f1: 0.5050
 epoch: 21, train_loss: 0.6501, test_loss: 1.4703, test_f1: 0.5742
 epoch: 22, train_loss: 0.6093, test_loss: 1.3371, test_f1: 0.5491
 epoch: 23, train_loss: 0.6310, test_loss: 1.3714, test_f1: 0.5593
 epoch: 24, train_loss: 0.6080, test_loss: 1.3412, test_f1: 0.5837
 epoch: 25, train_loss: 0.6164, test_loss: 1.3482, test_f1: 0.5148
 epoch: 26, train_loss: 0.6045, test_loss: 1.6262, test_f1: 0.4956
 epoch: 27, train_loss: 0.6004, test_loss: 1.4533, test_f1: 0.5160
 epoch: 28, train_loss: 0.5810, test_loss: 1.5081, test_f1: 0.5095
 epoch: 29, train_loss: 0.5745, test_loss: 1.8191, test_f1: 0.4423
 epoch: 30, train_loss: 0.6066, test_loss: 2.0484, test_f1: 0.4271
 epoch: 31, train_loss: 0.6626, test_loss: 1.7285, test_f1: 0.5134
 epoch: 32, train_loss: 0.6418, test_loss: 1.7078, test_f1: 0.5032
 epoch: 33, train_loss: 0.6153, test_loss: 1.5250, test_f1: 0.4839
 epoch: 34, train_loss: 0.6013, test_loss: 1.6107, test_f1: 0.4859
 epoch: 35, train_loss: 0.5881, test_loss: 1.7614, test_f1: 0.4533
 epoch: 36, train_loss: 0.5682, test_loss: 1.6292, test_f1: 0.4904
 epoch: 37, train_loss: 0.5819, test_loss: 1.7480, test_f1: 0.4799
 epoch: 38, train_loss: 0.5630, test_loss: 1.7259, test_f1: 0.5248
 epoch: 39, train_loss: 0.5556, test_loss: 1.9414, test_f1: 0.5575
 epoch: 40, train_loss: 0.5455, test_loss: 1.7762, test_f1: 0.5343
 epoch: 41, train_loss: 0.5444, test_loss: 1.8206, test_f1: 0.4811
 epoch: 42, train_loss: 0.5409, test_loss: 1.6842, test_f1: 0.5592
 epoch: 43, train_loss: 0.5313, test_loss: 1.6910, test_f1: 0.5442
 epoch: 44, train_loss: 0.5234, test_loss: 1.5982, test_f1: 0.5588
 epoch: 45, train_loss: 0.5235, test_loss: 1.5390, test_f1: 0.5238
 epoch: 46, train_loss: 0.5090, test_loss: 1.5959, test_f1: 0.5048
 epoch: 47, train_loss: 0.4629, test_loss: 1.8844, test_f1: 0.4431
 epoch: 48, train_loss: 0.4734, test_loss: 1.8957, test_f1: 0.4882
 epoch: 49, train_loss: 0.4695, test_loss: 1.7379, test_f1: 0.5075
 epoch: 50, train_loss: 0.4970, test_loss: 1.6897, test_f1: 0.5179
 epoch: 51, train_loss: 0.4750, test_loss: 1.5535, test_f1: 0.5695
 epoch: 52, train_loss: 0.4345, test_loss: 1.6642, test_f1: 0.5628
 epoch: 53, train_loss: 0.4248, test_loss: 1.7329, test_f1: 0.5269
 epoch: 54, train_loss: 0.4087, test_loss: 1.6582, test_f1: 0.5246
 epoch: 55, train_loss: 0.3807, test_loss: 1.6351, test_f1: 0.5284
 epoch: 56, train_loss: 0.3913, test_loss: 1.7892, test_f1: 0.5460
 epoch: 57, train_loss: 0.3690, test_loss: 1.8162, test_f1: 0.5391
 epoch: 58, train_loss: 0.3827, test_loss: 2.0182, test_f1: 0.5179
 epoch: 59, train_loss: 0.3627, test_loss: 1.9756, test_f1: 0.5194
 epoch: 60, train_loss: 0.3576, test_loss: 1.8963, test_f1: 0.5338
 epoch: 61, train_loss: 0.3263, test_loss: 1.9800, test_f1: 0.5260
 epoch: 62, train_loss: 0.3418, test_loss: 2.0117, test_f1: 0.5246
 epoch: 63, train_loss: 0.3520, test_loss: 2.0295, test_f1: 0.5329
 epoch: 64, train_loss: 0.3540, test_loss: 1.9612, test_f1: 0.5746
 epoch: 65, train_loss: 0.3563, test_loss: 1.9825, test_f1: 0.5410
 epoch: 66, train_loss: 0.3600, test_loss: 1.9519, test_f1: 0.5230
 epoch: 67, train_loss: 0.3484, test_loss: 1.9768, test_f1: 0.5318
 epoch: 68, train_loss: 0.3503, test_loss: 2.0980, test_f1: 0.5409
 epoch: 69, train_loss: 0.3204, test_loss: 2.1893, test_f1: 0.4972
 epoch: 70, train_loss: 0.3136, test_loss: 2.1169, test_f1: 0.5027
 epoch: 71, train_loss: 0.3335, test_loss: 2.1595, test_f1: 0.5311
 epoch: 72, train_loss: 0.3405, test_loss: 2.1186, test_f1: 0.5372
 epoch: 73, train_loss: 0.3569, test_loss: 2.1682, test_f1: 0.5292
 epoch: 74, train_loss: 0.3584, test_loss: 2.0201, test_f1: 0.5401
 epoch: 75, train_loss: 0.3319, test_loss: 1.9542, test_f1: 0.5677
 epoch: 76, train_loss: 0.3180, test_loss: 2.1767, test_f1: 0.5819
 epoch: 77, train_loss: 0.3005, test_loss: 2.3899, test_f1: 0.5644
 epoch: 78, train_loss: 0.3205, test_loss: 2.3501, test_f1: 0.5534
 epoch: 79, train_loss: 0.3229, test_loss: 2.2634, test_f1: 0.5114
 epoch: 80, train_loss: 0.3204, test_loss: 2.2789, test_f1: 0.5418
 epoch: 81, train_loss: 0.3168, test_loss: 2.3694, test_f1: 0.5829
 epoch: 82, train_loss: 0.2979, test_loss: 2.4141, test_f1: 0.5296
 epoch: 83, train_loss: 0.3134, test_loss: 2.4287, test_f1: 0.5543
 epoch: 84, train_loss: 0.2969, test_loss: 2.4607, test_f1: 0.5531
 epoch: 85, train_loss: 0.3062, test_loss: 2.3196, test_f1: 0.5629
 epoch: 86, train_loss: 0.2797, test_loss: 2.2662, test_f1: 0.5621
 epoch: 87, train_loss: 0.2980, test_loss: 2.5596, test_f1: 0.5574
 epoch: 88, train_loss: 0.3126, test_loss: 2.8488, test_f1: 0.5071
 epoch: 89, train_loss: 0.3298, test_loss: 2.5439, test_f1: 0.5123
 epoch: 90, train_loss: 0.2924, test_loss: 2.2983, test_f1: 0.5424
 epoch: 91, train_loss: 0.3694, test_loss: 2.4107, test_f1: 0.5659
 epoch: 92, train_loss: 0.3456, test_loss: 3.0142, test_f1: 0.5242
 epoch: 93, train_loss: 0.3222, test_loss: 2.3874, test_f1: 0.5589
 epoch: 94, train_loss: 0.3082, test_loss: 2.3559, test_f1: 0.5556
 epoch: 95, train_loss: 0.3123, test_loss: 2.4740, test_f1: 0.5492
 epoch: 96, train_loss: 0.2863, test_loss: 2.4786, test_f1: 0.5475
 epoch: 97, train_loss: 0.2829, test_loss: 2.4320, test_f1: 0.5597
 epoch: 98, train_loss: 0.2998, test_loss: 2.4130, test_f1: 0.5353
 epoch: 99, train_loss: 0.2884, test_loss: 2.3250, test_f1: 0.5582
##################ITERATION #4 ****************************************
 epoch: 0, train_loss: 1.2859, test_loss: 1.3883, test_f1: 0.1836
 epoch: 1, train_loss: 1.1292, test_loss: 1.3263, test_f1: 0.1423
 epoch: 2, train_loss: 1.0635, test_loss: 1.2740, test_f1: 0.2517
 epoch: 3, train_loss: 1.0243, test_loss: 1.2849, test_f1: 0.2455
 epoch: 4, train_loss: 0.9916, test_loss: 1.2108, test_f1: 0.4396
 epoch: 5, train_loss: 0.9485, test_loss: 1.2336, test_f1: 0.4162
 epoch: 6, train_loss: 0.9157, test_loss: 1.2515, test_f1: 0.5198
 epoch: 7, train_loss: 0.8916, test_loss: 1.2233, test_f1: 0.4310
 epoch: 8, train_loss: 0.8853, test_loss: 1.2294, test_f1: 0.5135
 epoch: 9, train_loss: 0.8595, test_loss: 1.2038, test_f1: 0.5152
 epoch: 10, train_loss: 0.8421, test_loss: 1.1677, test_f1: 0.5379
 epoch: 11, train_loss: 0.8069, test_loss: 1.2156, test_f1: 0.5205
 epoch: 12, train_loss: 0.7967, test_loss: 1.1773, test_f1: 0.6035
 epoch: 13, train_loss: 0.7879, test_loss: 1.3125, test_f1: 0.5755
 epoch: 14, train_loss: 0.7659, test_loss: 1.3062, test_f1: 0.5575
 epoch: 15, train_loss: 0.7382, test_loss: 1.4087, test_f1: 0.5195
 epoch: 16, train_loss: 0.7409, test_loss: 1.5835, test_f1: 0.5423
 epoch: 17, train_loss: 0.7401, test_loss: 1.4975, test_f1: 0.5537
 epoch: 18, train_loss: 0.7144, test_loss: 1.6143, test_f1: 0.4689
 epoch: 19, train_loss: 0.7364, test_loss: 1.4444, test_f1: 0.5238
 epoch: 20, train_loss: 0.7313, test_loss: 1.4735, test_f1: 0.5339
 epoch: 21, train_loss: 0.6897, test_loss: 1.6135, test_f1: 0.4972
 epoch: 22, train_loss: 0.7282, test_loss: 1.6547, test_f1: 0.4710
 epoch: 23, train_loss: 0.7317, test_loss: 1.4519, test_f1: 0.5497
 epoch: 24, train_loss: 0.6770, test_loss: 1.3728, test_f1: 0.5684
 epoch: 25, train_loss: 0.6675, test_loss: 1.3842, test_f1: 0.5911
 epoch: 26, train_loss: 0.6722, test_loss: 1.6034, test_f1: 0.4916
 epoch: 27, train_loss: 0.6799, test_loss: 1.5809, test_f1: 0.5342
 epoch: 28, train_loss: 0.6513, test_loss: 1.5649, test_f1: 0.5531
 epoch: 29, train_loss: 0.6532, test_loss: 1.3857, test_f1: 0.5902
 epoch: 30, train_loss: 0.6747, test_loss: 1.4160, test_f1: 0.5791
 epoch: 31, train_loss: 0.6356, test_loss: 1.4044, test_f1: 0.5785
 epoch: 32, train_loss: 0.6220, test_loss: 1.5241, test_f1: 0.5470
 epoch: 33, train_loss: 0.6117, test_loss: 1.4679, test_f1: 0.5495
 epoch: 34, train_loss: 0.5993, test_loss: 1.4449, test_f1: 0.5807
 epoch: 35, train_loss: 0.6095, test_loss: 1.5597, test_f1: 0.5646
 epoch: 36, train_loss: 0.5739, test_loss: 1.6192, test_f1: 0.5929
 epoch: 37, train_loss: 0.5608, test_loss: 1.6773, test_f1: 0.5592
 epoch: 38, train_loss: 0.5766, test_loss: 1.5744, test_f1: 0.5512
 epoch: 39, train_loss: 0.5453, test_loss: 1.7536, test_f1: 0.5485
 epoch: 40, train_loss: 0.5860, test_loss: 1.6192, test_f1: 0.5576
 epoch: 41, train_loss: 0.5664, test_loss: 1.5433, test_f1: 0.5786
 epoch: 42, train_loss: 0.5676, test_loss: 1.5161, test_f1: 0.5946
 epoch: 43, train_loss: 0.5689, test_loss: 1.5626, test_f1: 0.5674
 epoch: 44, train_loss: 0.5873, test_loss: 1.6834, test_f1: 0.5175
 epoch: 45, train_loss: 0.6044, test_loss: 2.0551, test_f1: 0.5432
 epoch: 46, train_loss: 0.5685, test_loss: 1.6269, test_f1: 0.6055
 epoch: 47, train_loss: 0.5949, test_loss: 1.5046, test_f1: 0.6163
 epoch: 48, train_loss: 0.5492, test_loss: 1.6283, test_f1: 0.5551
 epoch: 49, train_loss: 0.5378, test_loss: 1.8583, test_f1: 0.5463
 epoch: 50, train_loss: 0.5356, test_loss: 2.0398, test_f1: 0.5541
 epoch: 51, train_loss: 0.5197, test_loss: 1.8006, test_f1: 0.5676
 epoch: 52, train_loss: 0.4828, test_loss: 1.6493, test_f1: 0.5764
 epoch: 53, train_loss: 0.4784, test_loss: 1.7902, test_f1: 0.5781
 epoch: 54, train_loss: 0.4575, test_loss: 1.8846, test_f1: 0.5624
 epoch: 55, train_loss: 0.4400, test_loss: 1.7502, test_f1: 0.5678
 epoch: 56, train_loss: 0.4397, test_loss: 1.7397, test_f1: 0.5608
 epoch: 57, train_loss: 0.4645, test_loss: 1.8588, test_f1: 0.5360
 epoch: 58, train_loss: 0.4357, test_loss: 1.9438, test_f1: 0.5626
 epoch: 59, train_loss: 0.4509, test_loss: 1.8878, test_f1: 0.5578
 epoch: 60, train_loss: 0.4076, test_loss: 1.8416, test_f1: 0.5745
 epoch: 61, train_loss: 0.3982, test_loss: 1.8598, test_f1: 0.5875
 epoch: 62, train_loss: 0.4021, test_loss: 1.8543, test_f1: 0.5828
 epoch: 63, train_loss: 0.4183, test_loss: 2.0872, test_f1: 0.5218
 epoch: 64, train_loss: 0.4302, test_loss: 1.9221, test_f1: 0.5818
 epoch: 65, train_loss: 0.3880, test_loss: 1.9070, test_f1: 0.5914
 epoch: 66, train_loss: 0.3912, test_loss: 1.7914, test_f1: 0.6082
 epoch: 67, train_loss: 0.3881, test_loss: 1.7699, test_f1: 0.5580
 epoch: 68, train_loss: 0.4338, test_loss: 1.8648, test_f1: 0.5895
 epoch: 69, train_loss: 0.4076, test_loss: 2.0073, test_f1: 0.5702
 epoch: 70, train_loss: 0.3943, test_loss: 1.8798, test_f1: 0.5690
 epoch: 71, train_loss: 0.4057, test_loss: 1.9446, test_f1: 0.5602
 epoch: 72, train_loss: 0.3904, test_loss: 1.8244, test_f1: 0.5942
 epoch: 73, train_loss: 0.4031, test_loss: 1.8097, test_f1: 0.6036
 epoch: 74, train_loss: 0.3990, test_loss: 1.8221, test_f1: 0.6086
 epoch: 75, train_loss: 0.3818, test_loss: 1.8020, test_f1: 0.6225
 epoch: 76, train_loss: 0.3743, test_loss: 1.8127, test_f1: 0.5952
 epoch: 77, train_loss: 0.3812, test_loss: 1.8432, test_f1: 0.5774
 epoch: 78, train_loss: 0.3679, test_loss: 1.8253, test_f1: 0.5693
 epoch: 79, train_loss: 0.3801, test_loss: 1.9835, test_f1: 0.5959
 epoch: 80, train_loss: 0.3895, test_loss: 2.0722, test_f1: 0.5669
 epoch: 81, train_loss: 0.3644, test_loss: 1.8574, test_f1: 0.6089
 epoch: 82, train_loss: 0.3905, test_loss: 1.8754, test_f1: 0.5956
 epoch: 83, train_loss: 0.4068, test_loss: 2.1643, test_f1: 0.5664
 epoch: 84, train_loss: 0.3806, test_loss: 2.0507, test_f1: 0.5851
 epoch: 85, train_loss: 0.3531, test_loss: 1.9492, test_f1: 0.5608
 epoch: 86, train_loss: 0.3451, test_loss: 1.8052, test_f1: 0.5929
 epoch: 87, train_loss: 0.3331, test_loss: 1.8115, test_f1: 0.5806
 epoch: 88, train_loss: 0.3079, test_loss: 1.8372, test_f1: 0.5905
 epoch: 89, train_loss: 0.3038, test_loss: 1.8416, test_f1: 0.6116
 epoch: 90, train_loss: 0.3080, test_loss: 1.9467, test_f1: 0.5910
 epoch: 91, train_loss: 0.3177, test_loss: 1.9396, test_f1: 0.5870
 epoch: 92, train_loss: 0.3185, test_loss: 1.9097, test_f1: 0.6182
 epoch: 93, train_loss: 0.3122, test_loss: 1.9116, test_f1: 0.5978
 epoch: 94, train_loss: 0.3355, test_loss: 1.9402, test_f1: 0.6363
 epoch: 95, train_loss: 0.3220, test_loss: 2.2235, test_f1: 0.5715
 epoch: 96, train_loss: 0.3181, test_loss: 2.1780, test_f1: 0.5914
 epoch: 97, train_loss: 0.3170, test_loss: 2.1806, test_f1: 0.5640
 epoch: 98, train_loss: 0.3207, test_loss: 2.0655, test_f1: 0.5897
 epoch: 99, train_loss: 0.3253, test_loss: 2.0276, test_f1: 0.5988
##################ITERATION #5 ****************************************
 epoch: 0, train_loss: 1.2665, test_loss: 1.3711, test_f1: 0.1365
 epoch: 1, train_loss: 1.1187, test_loss: 1.3289, test_f1: 0.1487
 epoch: 2, train_loss: 1.0543, test_loss: 1.3259, test_f1: 0.2203
 epoch: 3, train_loss: 1.0138, test_loss: 1.2817, test_f1: 0.3591
 epoch: 4, train_loss: 0.9870, test_loss: 1.2325, test_f1: 0.3785
 epoch: 5, train_loss: 0.9519, test_loss: 1.2294, test_f1: 0.4088
 epoch: 6, train_loss: 0.9111, test_loss: 1.2640, test_f1: 0.4012
 epoch: 7, train_loss: 0.9072, test_loss: 1.2716, test_f1: 0.4410
 epoch: 8, train_loss: 0.9044, test_loss: 1.1689, test_f1: 0.5487
 epoch: 9, train_loss: 0.8637, test_loss: 1.2533, test_f1: 0.5193
 epoch: 10, train_loss: 0.8171, test_loss: 1.2771, test_f1: 0.4815
 epoch: 11, train_loss: 0.8156, test_loss: 1.4049, test_f1: 0.4463
 epoch: 12, train_loss: 0.8176, test_loss: 1.4576, test_f1: 0.5433
 epoch: 13, train_loss: 0.8283, test_loss: 1.4726, test_f1: 0.4798
 epoch: 14, train_loss: 0.7949, test_loss: 1.2982, test_f1: 0.5458
 epoch: 15, train_loss: 0.8048, test_loss: 1.2835, test_f1: 0.6180
 epoch: 16, train_loss: 0.7706, test_loss: 1.3913, test_f1: 0.5260
 epoch: 17, train_loss: 0.7766, test_loss: 1.2808, test_f1: 0.6239
 epoch: 18, train_loss: 0.7576, test_loss: 1.2804, test_f1: 0.5731
 epoch: 19, train_loss: 0.7382, test_loss: 1.4455, test_f1: 0.5486
 epoch: 20, train_loss: 0.7482, test_loss: 1.3686, test_f1: 0.5988
 epoch: 21, train_loss: 0.7118, test_loss: 1.3972, test_f1: 0.5704
 epoch: 22, train_loss: 0.7017, test_loss: 1.4193, test_f1: 0.6199
 epoch: 23, train_loss: 0.7027, test_loss: 1.3363, test_f1: 0.5922
 epoch: 24, train_loss: 0.7020, test_loss: 1.3518, test_f1: 0.5679
 epoch: 25, train_loss: 0.6716, test_loss: 1.3487, test_f1: 0.5463
 epoch: 26, train_loss: 0.6557, test_loss: 1.4471, test_f1: 0.5570
 epoch: 27, train_loss: 0.6586, test_loss: 1.4830, test_f1: 0.5877
 epoch: 28, train_loss: 0.6553, test_loss: 1.6903, test_f1: 0.4833
 epoch: 29, train_loss: 0.6091, test_loss: 1.5642, test_f1: 0.5370
 epoch: 30, train_loss: 0.6268, test_loss: 1.4571, test_f1: 0.5230
 epoch: 31, train_loss: 0.6563, test_loss: 1.4716, test_f1: 0.5052
 epoch: 32, train_loss: 0.6502, test_loss: 1.3989, test_f1: 0.5280
 epoch: 33, train_loss: 0.6197, test_loss: 1.5478, test_f1: 0.5858
 epoch: 34, train_loss: 0.6205, test_loss: 1.5427, test_f1: 0.5427
 epoch: 35, train_loss: 0.6362, test_loss: 1.4804, test_f1: 0.5516
 epoch: 36, train_loss: 0.6055, test_loss: 1.9318, test_f1: 0.5221
 epoch: 37, train_loss: 0.5865, test_loss: 1.9152, test_f1: 0.4938
 epoch: 38, train_loss: 0.5665, test_loss: 1.7294, test_f1: 0.5497
 epoch: 39, train_loss: 0.5836, test_loss: 1.7579, test_f1: 0.5715
 epoch: 40, train_loss: 0.5684, test_loss: 1.6933, test_f1: 0.5255
 epoch: 41, train_loss: 0.5645, test_loss: 1.7872, test_f1: 0.5220
 epoch: 42, train_loss: 0.5531, test_loss: 1.9477, test_f1: 0.5366
 epoch: 43, train_loss: 0.5428, test_loss: 1.9829, test_f1: 0.5441
 epoch: 44, train_loss: 0.5417, test_loss: 2.0309, test_f1: 0.5210
 epoch: 45, train_loss: 0.5208, test_loss: 1.8155, test_f1: 0.5627
 epoch: 46, train_loss: 0.5161, test_loss: 2.0175, test_f1: 0.5408
 epoch: 47, train_loss: 0.5842, test_loss: 1.7203, test_f1: 0.5312
 epoch: 48, train_loss: 0.5693, test_loss: 1.5520, test_f1: 0.6100
 epoch: 49, train_loss: 0.5361, test_loss: 1.5979, test_f1: 0.5488
 epoch: 50, train_loss: 0.5213, test_loss: 1.6236, test_f1: 0.5753
 epoch: 51, train_loss: 0.5097, test_loss: 1.6781, test_f1: 0.5477
 epoch: 52, train_loss: 0.4818, test_loss: 1.8398, test_f1: 0.5147
 epoch: 53, train_loss: 0.4672, test_loss: 1.8557, test_f1: 0.5299
 epoch: 54, train_loss: 0.4459, test_loss: 1.8740, test_f1: 0.5583
 epoch: 55, train_loss: 0.4139, test_loss: 1.9401, test_f1: 0.5778
 epoch: 56, train_loss: 0.4116, test_loss: 1.8914, test_f1: 0.5715
 epoch: 57, train_loss: 0.3845, test_loss: 2.0345, test_f1: 0.5554
 epoch: 58, train_loss: 0.4016, test_loss: 2.1462, test_f1: 0.5650
 epoch: 59, train_loss: 0.4387, test_loss: 2.1028, test_f1: 0.5757
 epoch: 60, train_loss: 0.4236, test_loss: 2.0026, test_f1: 0.5287
 epoch: 61, train_loss: 0.4215, test_loss: 1.9306, test_f1: 0.5869
 epoch: 62, train_loss: 0.4087, test_loss: 1.9672, test_f1: 0.5615
 epoch: 63, train_loss: 0.3822, test_loss: 2.2133, test_f1: 0.5071
 epoch: 64, train_loss: 0.3943, test_loss: 2.2692, test_f1: 0.5539
 epoch: 65, train_loss: 0.3610, test_loss: 1.9975, test_f1: 0.5940
 epoch: 66, train_loss: 0.3637, test_loss: 1.9230, test_f1: 0.5986
 epoch: 67, train_loss: 0.3637, test_loss: 1.7982, test_f1: 0.5918
 epoch: 68, train_loss: 0.3736, test_loss: 1.8331, test_f1: 0.5867
 epoch: 69, train_loss: 0.3479, test_loss: 1.9698, test_f1: 0.5797
 epoch: 70, train_loss: 0.3466, test_loss: 2.2123, test_f1: 0.5433
 epoch: 71, train_loss: 0.3734, test_loss: 2.2846, test_f1: 0.5774
 epoch: 72, train_loss: 0.3802, test_loss: 2.1635, test_f1: 0.5914
 epoch: 73, train_loss: 0.3760, test_loss: 2.2315, test_f1: 0.5520
 epoch: 74, train_loss: 0.3922, test_loss: 2.4513, test_f1: 0.5300
 epoch: 75, train_loss: 0.4072, test_loss: 2.3239, test_f1: 0.5232
 epoch: 76, train_loss: 0.3786, test_loss: 2.1772, test_f1: 0.5358
 epoch: 77, train_loss: 0.3657, test_loss: 2.2847, test_f1: 0.5252
 epoch: 78, train_loss: 0.3661, test_loss: 2.3217, test_f1: 0.5573
 epoch: 79, train_loss: 0.3797, test_loss: 2.1625, test_f1: 0.5633
 epoch: 80, train_loss: 0.3450, test_loss: 2.2186, test_f1: 0.5871
 epoch: 81, train_loss: 0.3731, test_loss: 2.1376, test_f1: 0.5604
 epoch: 82, train_loss: 0.3869, test_loss: 2.0935, test_f1: 0.5516
 epoch: 83, train_loss: 0.3710, test_loss: 2.1202, test_f1: 0.5729
 epoch: 84, train_loss: 0.3581, test_loss: 1.9917, test_f1: 0.6020
 epoch: 85, train_loss: 0.3445, test_loss: 2.0220, test_f1: 0.5838
 epoch: 86, train_loss: 0.3274, test_loss: 2.2832, test_f1: 0.5488
 epoch: 87, train_loss: 0.3310, test_loss: 2.2411, test_f1: 0.5562
 epoch: 88, train_loss: 0.3242, test_loss: 2.2251, test_f1: 0.5917
 epoch: 89, train_loss: 0.3446, test_loss: 2.1641, test_f1: 0.5796
 epoch: 90, train_loss: 0.3117, test_loss: 2.2638, test_f1: 0.5471
 epoch: 91, train_loss: 0.3257, test_loss: 2.4143, test_f1: 0.5533
 epoch: 92, train_loss: 0.3089, test_loss: 2.5077, test_f1: 0.5532
 epoch: 93, train_loss: 0.3101, test_loss: 2.4808, test_f1: 0.5772
 epoch: 94, train_loss: 0.2995, test_loss: 2.1619, test_f1: 0.5916
 epoch: 95, train_loss: 0.3152, test_loss: 2.1637, test_f1: 0.6111
 epoch: 96, train_loss: 0.2922, test_loss: 2.0981, test_f1: 0.6035
 epoch: 97, train_loss: 0.2929, test_loss: 2.1494, test_f1: 0.5860
 epoch: 98, train_loss: 0.2796, test_loss: 2.2848, test_f1: 0.5822
 epoch: 99, train_loss: 0.2882, test_loss: 2.2311, test_f1: 0.5915
##################ITERATION #6 ****************************************
 epoch: 0, train_loss: 1.2665, test_loss: 1.3991, test_f1: 0.1561
 epoch: 1, train_loss: 1.1257, test_loss: 1.3039, test_f1: 0.2255
 epoch: 2, train_loss: 1.0585, test_loss: 1.2425, test_f1: 0.4359
 epoch: 3, train_loss: 1.0330, test_loss: 1.2351, test_f1: 0.4409
 epoch: 4, train_loss: 0.9989, test_loss: 1.2263, test_f1: 0.4755
 epoch: 5, train_loss: 0.9534, test_loss: 1.2054, test_f1: 0.5340
 epoch: 6, train_loss: 0.9156, test_loss: 1.1607, test_f1: 0.5134
 epoch: 7, train_loss: 0.9083, test_loss: 1.1839, test_f1: 0.5082
 epoch: 8, train_loss: 0.8844, test_loss: 1.2389, test_f1: 0.4670
 epoch: 9, train_loss: 0.8757, test_loss: 1.2568, test_f1: 0.5139
 epoch: 10, train_loss: 0.8607, test_loss: 1.2850, test_f1: 0.5865
 epoch: 11, train_loss: 0.8350, test_loss: 1.4360, test_f1: 0.4894
 epoch: 12, train_loss: 0.8326, test_loss: 1.2933, test_f1: 0.5653
 epoch: 13, train_loss: 0.7964, test_loss: 1.3138, test_f1: 0.5875
 epoch: 14, train_loss: 0.8065, test_loss: 1.5069, test_f1: 0.4969
 epoch: 15, train_loss: 0.7864, test_loss: 1.3972, test_f1: 0.5152
 epoch: 16, train_loss: 0.7574, test_loss: 1.4640, test_f1: 0.5367
 epoch: 17, train_loss: 0.7835, test_loss: 1.4928, test_f1: 0.5169
 epoch: 18, train_loss: 0.7708, test_loss: 1.4349, test_f1: 0.5498
 epoch: 19, train_loss: 0.7025, test_loss: 1.4133, test_f1: 0.5593
 epoch: 20, train_loss: 0.7030, test_loss: 1.3782, test_f1: 0.4995
 epoch: 21, train_loss: 0.6892, test_loss: 1.6194, test_f1: 0.5196
 epoch: 22, train_loss: 0.7081, test_loss: 1.6041, test_f1: 0.5084
 epoch: 23, train_loss: 0.6930, test_loss: 1.5652, test_f1: 0.5326
 epoch: 24, train_loss: 0.6844, test_loss: 1.6517, test_f1: 0.5337
 epoch: 25, train_loss: 0.7155, test_loss: 1.6226, test_f1: 0.5052
 epoch: 26, train_loss: 0.7564, test_loss: 1.7928, test_f1: 0.4791
 epoch: 27, train_loss: 0.7423, test_loss: 1.7859, test_f1: 0.4983
 epoch: 28, train_loss: 0.7305, test_loss: 1.5855, test_f1: 0.5568
 epoch: 29, train_loss: 0.6966, test_loss: 1.5795, test_f1: 0.5368
 epoch: 30, train_loss: 0.6704, test_loss: 1.5533, test_f1: 0.5279
 epoch: 31, train_loss: 0.6448, test_loss: 1.5590, test_f1: 0.5320
 epoch: 32, train_loss: 0.6493, test_loss: 1.5434, test_f1: 0.5747
 epoch: 33, train_loss: 0.6714, test_loss: 1.5566, test_f1: 0.5411
 epoch: 34, train_loss: 0.6683, test_loss: 1.5480, test_f1: 0.5041
 epoch: 35, train_loss: 0.6424, test_loss: 1.9120, test_f1: 0.4689
 epoch: 36, train_loss: 0.6279, test_loss: 1.7196, test_f1: 0.5174
 epoch: 37, train_loss: 0.6633, test_loss: 1.5667, test_f1: 0.4991
 epoch: 38, train_loss: 0.6638, test_loss: 1.7587, test_f1: 0.4722
 epoch: 39, train_loss: 0.6375, test_loss: 1.6068, test_f1: 0.5612
 epoch: 40, train_loss: 0.6224, test_loss: 1.6710, test_f1: 0.5224
 epoch: 41, train_loss: 0.6064, test_loss: 1.6867, test_f1: 0.5115
 epoch: 42, train_loss: 0.5771, test_loss: 1.5579, test_f1: 0.5671
 epoch: 43, train_loss: 0.5974, test_loss: 1.5724, test_f1: 0.5313
 epoch: 44, train_loss: 0.5629, test_loss: 1.7536, test_f1: 0.4905
 epoch: 45, train_loss: 0.5789, test_loss: 1.6276, test_f1: 0.4902
 epoch: 46, train_loss: 0.6268, test_loss: 1.5916, test_f1: 0.4959
 epoch: 47, train_loss: 0.6019, test_loss: 1.6351, test_f1: 0.5204
 epoch: 48, train_loss: 0.5552, test_loss: 1.6932, test_f1: 0.5018
 epoch: 49, train_loss: 0.5327, test_loss: 1.7268, test_f1: 0.4989
 epoch: 50, train_loss: 0.5259, test_loss: 1.7922, test_f1: 0.4775
 epoch: 51, train_loss: 0.5052, test_loss: 1.8201, test_f1: 0.4922
 epoch: 52, train_loss: 0.5065, test_loss: 1.7635, test_f1: 0.5107
 epoch: 53, train_loss: 0.4595, test_loss: 1.5944, test_f1: 0.5466
 epoch: 54, train_loss: 0.4446, test_loss: 1.6755, test_f1: 0.5256
 epoch: 55, train_loss: 0.4354, test_loss: 1.7204, test_f1: 0.5556
 epoch: 56, train_loss: 0.4191, test_loss: 1.7624, test_f1: 0.5232
 epoch: 57, train_loss: 0.4212, test_loss: 2.0229, test_f1: 0.4895
 epoch: 58, train_loss: 0.4385, test_loss: 2.0217, test_f1: 0.4981
 epoch: 59, train_loss: 0.4237, test_loss: 1.8990, test_f1: 0.5229
 epoch: 60, train_loss: 0.4276, test_loss: 1.9131, test_f1: 0.5192
 epoch: 61, train_loss: 0.4243, test_loss: 2.0587, test_f1: 0.5189
 epoch: 62, train_loss: 0.4315, test_loss: 2.1050, test_f1: 0.5321
 epoch: 63, train_loss: 0.4287, test_loss: 2.1449, test_f1: 0.5230
 epoch: 64, train_loss: 0.4170, test_loss: 2.1166, test_f1: 0.5303
 epoch: 65, train_loss: 0.4021, test_loss: 2.2377, test_f1: 0.5150
 epoch: 66, train_loss: 0.3833, test_loss: 2.1608, test_f1: 0.5536
 epoch: 67, train_loss: 0.3899, test_loss: 2.1443, test_f1: 0.5614
 epoch: 68, train_loss: 0.3992, test_loss: 2.3191, test_f1: 0.5392
 epoch: 69, train_loss: 0.3793, test_loss: 2.4504, test_f1: 0.5366
 epoch: 70, train_loss: 0.3891, test_loss: 2.2425, test_f1: 0.5505
 epoch: 71, train_loss: 0.3632, test_loss: 2.2606, test_f1: 0.5091
 epoch: 72, train_loss: 0.3733, test_loss: 2.1157, test_f1: 0.5256
 epoch: 73, train_loss: 0.3742, test_loss: 2.0847, test_f1: 0.5338
 epoch: 74, train_loss: 0.3580, test_loss: 2.2033, test_f1: 0.5509
 epoch: 75, train_loss: 0.3501, test_loss: 2.2998, test_f1: 0.5306
 epoch: 76, train_loss: 0.3714, test_loss: 2.2446, test_f1: 0.5413
 epoch: 77, train_loss: 0.3461, test_loss: 2.2257, test_f1: 0.5251
 epoch: 78, train_loss: 0.3533, test_loss: 2.1839, test_f1: 0.5283
 epoch: 79, train_loss: 0.3437, test_loss: 2.3229, test_f1: 0.5060
 epoch: 80, train_loss: 0.3475, test_loss: 2.6170, test_f1: 0.5042
 epoch: 81, train_loss: 0.3683, test_loss: 2.6977, test_f1: 0.5074
 epoch: 82, train_loss: 0.3631, test_loss: 2.5308, test_f1: 0.4899
 epoch: 83, train_loss: 0.3685, test_loss: 2.6094, test_f1: 0.5176
 epoch: 84, train_loss: 0.3595, test_loss: 2.4461, test_f1: 0.5213
 epoch: 85, train_loss: 0.3634, test_loss: 2.3635, test_f1: 0.5476
 epoch: 86, train_loss: 0.3315, test_loss: 2.4236, test_f1: 0.5439
 epoch: 87, train_loss: 0.3174, test_loss: 2.1951, test_f1: 0.5456
 epoch: 88, train_loss: 0.3335, test_loss: 2.2113, test_f1: 0.5222
 epoch: 89, train_loss: 0.3303, test_loss: 2.4417, test_f1: 0.4986
 epoch: 90, train_loss: 0.3139, test_loss: 2.6546, test_f1: 0.5052
 epoch: 91, train_loss: 0.3274, test_loss: 2.5528, test_f1: 0.5033
 epoch: 92, train_loss: 0.3306, test_loss: 2.3819, test_f1: 0.5845
 epoch: 93, train_loss: 0.3285, test_loss: 2.4015, test_f1: 0.5375
 epoch: 94, train_loss: 0.3272, test_loss: 2.4593, test_f1: 0.5174
 epoch: 95, train_loss: 0.3085, test_loss: 2.6663, test_f1: 0.4955
 epoch: 96, train_loss: 0.3218, test_loss: 2.6628, test_f1: 0.5274
 epoch: 97, train_loss: 0.3343, test_loss: 2.5846, test_f1: 0.5426
 epoch: 98, train_loss: 0.3565, test_loss: 2.3728, test_f1: 0.5373
 epoch: 99, train_loss: 0.3414, test_loss: 2.4605, test_f1: 0.5686
##################ITERATION #7 ****************************************
 epoch: 0, train_loss: 1.2794, test_loss: 1.4576, test_f1: 0.1428
 epoch: 1, train_loss: 1.1160, test_loss: 1.3199, test_f1: 0.2284
 epoch: 2, train_loss: 1.0551, test_loss: 1.3243, test_f1: 0.3924
 epoch: 3, train_loss: 1.0264, test_loss: 1.2816, test_f1: 0.2980
 epoch: 4, train_loss: 0.9814, test_loss: 1.2409, test_f1: 0.4139
 epoch: 5, train_loss: 0.9527, test_loss: 1.1633, test_f1: 0.4724
 epoch: 6, train_loss: 0.9074, test_loss: 1.1598, test_f1: 0.4744
 epoch: 7, train_loss: 0.8606, test_loss: 1.1757, test_f1: 0.5440
 epoch: 8, train_loss: 0.8454, test_loss: 1.1304, test_f1: 0.5559
 epoch: 9, train_loss: 0.8107, test_loss: 1.1169, test_f1: 0.5244
 epoch: 10, train_loss: 0.8232, test_loss: 1.2402, test_f1: 0.5262
 epoch: 11, train_loss: 0.8311, test_loss: 1.2895, test_f1: 0.5119
 epoch: 12, train_loss: 0.8305, test_loss: 1.1777, test_f1: 0.5423
 epoch: 13, train_loss: 0.7741, test_loss: 1.1252, test_f1: 0.5551
 epoch: 14, train_loss: 0.7474, test_loss: 1.1262, test_f1: 0.5572
 epoch: 15, train_loss: 0.7613, test_loss: 1.2747, test_f1: 0.5454
 epoch: 16, train_loss: 0.7317, test_loss: 1.2301, test_f1: 0.5583
 epoch: 17, train_loss: 0.7049, test_loss: 1.2616, test_f1: 0.5932
 epoch: 18, train_loss: 0.7086, test_loss: 1.2805, test_f1: 0.5341
 epoch: 19, train_loss: 0.7062, test_loss: 1.2674, test_f1: 0.5656
 epoch: 20, train_loss: 0.6982, test_loss: 1.2005, test_f1: 0.5928
 epoch: 21, train_loss: 0.6970, test_loss: 1.3375, test_f1: 0.5387
 epoch: 22, train_loss: 0.7140, test_loss: 1.3953, test_f1: 0.5908
 epoch: 23, train_loss: 0.7092, test_loss: 1.4540, test_f1: 0.5552
 epoch: 24, train_loss: 0.6897, test_loss: 1.5382, test_f1: 0.5568
 epoch: 25, train_loss: 0.6833, test_loss: 1.4354, test_f1: 0.5286
 epoch: 26, train_loss: 0.6583, test_loss: 1.2744, test_f1: 0.5715
 epoch: 27, train_loss: 0.6218, test_loss: 1.2788, test_f1: 0.6115
 epoch: 28, train_loss: 0.6112, test_loss: 1.3100, test_f1: 0.5538
 epoch: 29, train_loss: 0.6054, test_loss: 1.3753, test_f1: 0.5073
 epoch: 30, train_loss: 0.5876, test_loss: 1.6098, test_f1: 0.5136
 epoch: 31, train_loss: 0.6361, test_loss: 1.4153, test_f1: 0.5420
 epoch: 32, train_loss: 0.6258, test_loss: 1.4015, test_f1: 0.5463
 epoch: 33, train_loss: 0.6056, test_loss: 1.3271, test_f1: 0.5748
 epoch: 34, train_loss: 0.5593, test_loss: 1.5299, test_f1: 0.5208
 epoch: 35, train_loss: 0.5740, test_loss: 1.6412, test_f1: 0.5315
 epoch: 36, train_loss: 0.5444, test_loss: 1.6030, test_f1: 0.5687
 epoch: 37, train_loss: 0.5239, test_loss: 1.6645, test_f1: 0.5688
 epoch: 38, train_loss: 0.5269, test_loss: 1.7268, test_f1: 0.5533
 epoch: 39, train_loss: 0.5673, test_loss: 1.8023, test_f1: 0.4832
 epoch: 40, train_loss: 0.6225, test_loss: 1.7058, test_f1: 0.5246
 epoch: 41, train_loss: 0.5958, test_loss: 1.5873, test_f1: 0.5305
 epoch: 42, train_loss: 0.5604, test_loss: 1.7598, test_f1: 0.5275
 epoch: 43, train_loss: 0.5463, test_loss: 1.6006, test_f1: 0.5575
 epoch: 44, train_loss: 0.5637, test_loss: 1.5622, test_f1: 0.5569
 epoch: 45, train_loss: 0.5541, test_loss: 1.5534, test_f1: 0.5818
 epoch: 46, train_loss: 0.5227, test_loss: 1.4666, test_f1: 0.5585
 epoch: 47, train_loss: 0.4980, test_loss: 1.4839, test_f1: 0.5221
 epoch: 48, train_loss: 0.4806, test_loss: 1.8243, test_f1: 0.5499
 epoch: 49, train_loss: 0.4457, test_loss: 1.7087, test_f1: 0.5444
 epoch: 50, train_loss: 0.4465, test_loss: 1.9777, test_f1: 0.5013
 epoch: 51, train_loss: 0.4456, test_loss: 1.9670, test_f1: 0.5138
 epoch: 52, train_loss: 0.4067, test_loss: 1.9366, test_f1: 0.5208
 epoch: 53, train_loss: 0.4038, test_loss: 2.1023, test_f1: 0.5228
 epoch: 54, train_loss: 0.3864, test_loss: 2.0631, test_f1: 0.5228
 epoch: 55, train_loss: 0.4133, test_loss: 1.9408, test_f1: 0.5404
 epoch: 56, train_loss: 0.4193, test_loss: 1.7784, test_f1: 0.5397
 epoch: 57, train_loss: 0.4015, test_loss: 1.7055, test_f1: 0.5795
 epoch: 58, train_loss: 0.4067, test_loss: 1.7614, test_f1: 0.5822
 epoch: 59, train_loss: 0.4053, test_loss: 1.7327, test_f1: 0.5831
 epoch: 60, train_loss: 0.3904, test_loss: 1.9519, test_f1: 0.5471
 epoch: 61, train_loss: 0.3959, test_loss: 2.2579, test_f1: 0.4952
 epoch: 62, train_loss: 0.3710, test_loss: 2.2230, test_f1: 0.5304
 epoch: 63, train_loss: 0.3903, test_loss: 2.0513, test_f1: 0.5551
 epoch: 64, train_loss: 0.3734, test_loss: 1.9079, test_f1: 0.5525
 epoch: 65, train_loss: 0.3601, test_loss: 1.9315, test_f1: 0.5597
 epoch: 66, train_loss: 0.3767, test_loss: 2.0829, test_f1: 0.5577
 epoch: 67, train_loss: 0.3634, test_loss: 2.1003, test_f1: 0.5666
 epoch: 68, train_loss: 0.3605, test_loss: 2.1369, test_f1: 0.5953
 epoch: 69, train_loss: 0.3311, test_loss: 2.1215, test_f1: 0.5475
 epoch: 70, train_loss: 0.3379, test_loss: 2.3084, test_f1: 0.5580
 epoch: 71, train_loss: 0.3477, test_loss: 2.3859, test_f1: 0.5648
 epoch: 72, train_loss: 0.3316, test_loss: 2.2569, test_f1: 0.5458
 epoch: 73, train_loss: 0.3541, test_loss: 2.1959, test_f1: 0.5481
 epoch: 74, train_loss: 0.3536, test_loss: 2.2888, test_f1: 0.5503
 epoch: 75, train_loss: 0.3350, test_loss: 2.3583, test_f1: 0.5276
 epoch: 76, train_loss: 0.3548, test_loss: 2.3448, test_f1: 0.5293
 epoch: 77, train_loss: 0.3381, test_loss: 2.4036, test_f1: 0.5413
 epoch: 78, train_loss: 0.3318, test_loss: 2.3576, test_f1: 0.5165
 epoch: 79, train_loss: 0.3214, test_loss: 2.3149, test_f1: 0.5531
 epoch: 80, train_loss: 0.2854, test_loss: 2.3968, test_f1: 0.5657
 epoch: 81, train_loss: 0.3527, test_loss: 2.2424, test_f1: 0.5575
 epoch: 82, train_loss: 0.3446, test_loss: 2.3554, test_f1: 0.5551
 epoch: 83, train_loss: 0.3541, test_loss: 2.4273, test_f1: 0.5429
 epoch: 84, train_loss: 0.3420, test_loss: 2.4142, test_f1: 0.5713
 epoch: 85, train_loss: 0.3338, test_loss: 2.2507, test_f1: 0.5883
 epoch: 86, train_loss: 0.3054, test_loss: 2.2710, test_f1: 0.5529
 epoch: 87, train_loss: 0.3174, test_loss: 2.4920, test_f1: 0.5328
 epoch: 88, train_loss: 0.3425, test_loss: 2.5884, test_f1: 0.5218
 epoch: 89, train_loss: 0.3241, test_loss: 2.5419, test_f1: 0.5654
 epoch: 90, train_loss: 0.3485, test_loss: 2.6924, test_f1: 0.5475
 epoch: 91, train_loss: 0.3418, test_loss: 2.6959, test_f1: 0.5437
 epoch: 92, train_loss: 0.4139, test_loss: 2.6674, test_f1: 0.4858
 epoch: 93, train_loss: 0.3783, test_loss: 2.4009, test_f1: 0.5009
 epoch: 94, train_loss: 0.3857, test_loss: 2.3645, test_f1: 0.5159
 epoch: 95, train_loss: 0.3617, test_loss: 2.3314, test_f1: 0.5238
 epoch: 96, train_loss: 0.3521, test_loss: 2.3532, test_f1: 0.5361
 epoch: 97, train_loss: 0.3178, test_loss: 2.2049, test_f1: 0.5289
 epoch: 98, train_loss: 0.3346, test_loss: 2.2366, test_f1: 0.5466
 epoch: 99, train_loss: 0.3266, test_loss: 2.2865, test_f1: 0.5316
##################ITERATION #8 ****************************************
 epoch: 0, train_loss: 1.2643, test_loss: 1.3708, test_f1: 0.1365
 epoch: 1, train_loss: 1.1333, test_loss: 1.3694, test_f1: 0.1365
 epoch: 2, train_loss: 1.0627, test_loss: 1.2994, test_f1: 0.3192
 epoch: 3, train_loss: 1.0198, test_loss: 1.2640, test_f1: 0.3888
 epoch: 4, train_loss: 1.0053, test_loss: 1.2537, test_f1: 0.3754
 epoch: 5, train_loss: 0.9678, test_loss: 1.1912, test_f1: 0.4185
 epoch: 6, train_loss: 0.9338, test_loss: 1.1528, test_f1: 0.5457
 epoch: 7, train_loss: 0.9153, test_loss: 1.1822, test_f1: 0.5342
 epoch: 8, train_loss: 0.9035, test_loss: 1.1830, test_f1: 0.5598
 epoch: 9, train_loss: 0.8775, test_loss: 1.1900, test_f1: 0.5222
 epoch: 10, train_loss: 0.8661, test_loss: 1.1983, test_f1: 0.5128
 epoch: 11, train_loss: 0.8578, test_loss: 1.2292, test_f1: 0.5200
 epoch: 12, train_loss: 0.8284, test_loss: 1.2297, test_f1: 0.5755
 epoch: 13, train_loss: 0.8282, test_loss: 1.2335, test_f1: 0.5673
 epoch: 14, train_loss: 0.8102, test_loss: 1.3002, test_f1: 0.5396
 epoch: 15, train_loss: 0.7629, test_loss: 1.2575, test_f1: 0.5200
 epoch: 16, train_loss: 0.7681, test_loss: 1.1848, test_f1: 0.5559
 epoch: 17, train_loss: 0.7691, test_loss: 1.2094, test_f1: 0.5267
 epoch: 18, train_loss: 0.7180, test_loss: 1.3199, test_f1: 0.5251
 epoch: 19, train_loss: 0.7388, test_loss: 1.8480, test_f1: 0.4800
 epoch: 20, train_loss: 0.7079, test_loss: 1.1607, test_f1: 0.5434
 epoch: 21, train_loss: 0.6626, test_loss: 1.2336, test_f1: 0.5855
 epoch: 22, train_loss: 0.6669, test_loss: 1.5331, test_f1: 0.4994
 epoch: 23, train_loss: 0.6835, test_loss: 1.5608, test_f1: 0.4879
 epoch: 24, train_loss: 0.7164, test_loss: 1.7143, test_f1: 0.4872
 epoch: 25, train_loss: 0.6814, test_loss: 1.6786, test_f1: 0.4845
 epoch: 26, train_loss: 0.6718, test_loss: 1.5215, test_f1: 0.5579
 epoch: 27, train_loss: 0.6630, test_loss: 1.5959, test_f1: 0.5688
 epoch: 28, train_loss: 0.6480, test_loss: 1.4569, test_f1: 0.5677
 epoch: 29, train_loss: 0.6425, test_loss: 1.3793, test_f1: 0.5678
 epoch: 30, train_loss: 0.6626, test_loss: 1.5168, test_f1: 0.5437
 epoch: 31, train_loss: 0.6414, test_loss: 1.3583, test_f1: 0.5461
 epoch: 32, train_loss: 0.6235, test_loss: 1.3563, test_f1: 0.5328
 epoch: 33, train_loss: 0.6057, test_loss: 1.5586, test_f1: 0.4687
 epoch: 34, train_loss: 0.5896, test_loss: 1.3948, test_f1: 0.5271
 epoch: 35, train_loss: 0.5771, test_loss: 1.3946, test_f1: 0.5548
 epoch: 36, train_loss: 0.5746, test_loss: 1.4944, test_f1: 0.5396
 epoch: 37, train_loss: 0.5933, test_loss: 1.5261, test_f1: 0.5566
 epoch: 38, train_loss: 0.5579, test_loss: 1.3798, test_f1: 0.5493
 epoch: 39, train_loss: 0.5570, test_loss: 1.5551, test_f1: 0.5445
 epoch: 40, train_loss: 0.5546, test_loss: 1.4354, test_f1: 0.5558
 epoch: 41, train_loss: 0.5400, test_loss: 1.6691, test_f1: 0.5128
 epoch: 42, train_loss: 0.5553, test_loss: 1.8010, test_f1: 0.5197
 epoch: 43, train_loss: 0.5495, test_loss: 1.3604, test_f1: 0.6160
 epoch: 44, train_loss: 0.5126, test_loss: 1.4976, test_f1: 0.5732
 epoch: 45, train_loss: 0.5260, test_loss: 1.6100, test_f1: 0.5349
 epoch: 46, train_loss: 0.5046, test_loss: 1.7311, test_f1: 0.5766
 epoch: 47, train_loss: 0.5004, test_loss: 1.7433, test_f1: 0.5720
 epoch: 48, train_loss: 0.5312, test_loss: 1.5489, test_f1: 0.5906
 epoch: 49, train_loss: 0.5154, test_loss: 1.7861, test_f1: 0.5540
 epoch: 50, train_loss: 0.5635, test_loss: 1.6868, test_f1: 0.5422
 epoch: 51, train_loss: 0.4949, test_loss: 1.6267, test_f1: 0.5349
 epoch: 52, train_loss: 0.4688, test_loss: 1.5873, test_f1: 0.5603
 epoch: 53, train_loss: 0.4788, test_loss: 1.8221, test_f1: 0.5299
 epoch: 54, train_loss: 0.4307, test_loss: 1.7181, test_f1: 0.5432
 epoch: 55, train_loss: 0.4292, test_loss: 1.6706, test_f1: 0.5384
 epoch: 56, train_loss: 0.4115, test_loss: 1.7011, test_f1: 0.5416
 epoch: 57, train_loss: 0.4030, test_loss: 1.6499, test_f1: 0.5580
 epoch: 58, train_loss: 0.3705, test_loss: 1.5556, test_f1: 0.5677
 epoch: 59, train_loss: 0.3854, test_loss: 1.6759, test_f1: 0.5618
 epoch: 60, train_loss: 0.3689, test_loss: 1.7361, test_f1: 0.5326
 epoch: 61, train_loss: 0.3634, test_loss: 1.6839, test_f1: 0.5630
 epoch: 62, train_loss: 0.3583, test_loss: 1.7763, test_f1: 0.5448
 epoch: 63, train_loss: 0.3743, test_loss: 1.8130, test_f1: 0.5772
 epoch: 64, train_loss: 0.3916, test_loss: 1.8003, test_f1: 0.5538
 epoch: 65, train_loss: 0.3827, test_loss: 2.0087, test_f1: 0.5547
 epoch: 66, train_loss: 0.3862, test_loss: 1.9522, test_f1: 0.5005
 epoch: 67, train_loss: 0.3850, test_loss: 2.0235, test_f1: 0.5163
 epoch: 68, train_loss: 0.3932, test_loss: 1.8763, test_f1: 0.5476
 epoch: 69, train_loss: 0.3824, test_loss: 1.6928, test_f1: 0.5714
 epoch: 70, train_loss: 0.3880, test_loss: 1.6948, test_f1: 0.5352
 epoch: 71, train_loss: 0.3467, test_loss: 1.7969, test_f1: 0.5360
 epoch: 72, train_loss: 0.3446, test_loss: 1.7509, test_f1: 0.5660
 epoch: 73, train_loss: 0.3132, test_loss: 2.0191, test_f1: 0.5523
 epoch: 74, train_loss: 0.3253, test_loss: 2.0265, test_f1: 0.5582
 epoch: 75, train_loss: 0.3407, test_loss: 2.0052, test_f1: 0.5509
 epoch: 76, train_loss: 0.3455, test_loss: 2.0791, test_f1: 0.5877
 epoch: 77, train_loss: 0.3443, test_loss: 1.9719, test_f1: 0.6226
 epoch: 78, train_loss: 0.3406, test_loss: 2.4787, test_f1: 0.5358
 epoch: 79, train_loss: 0.3470, test_loss: 2.3263, test_f1: 0.5450
 epoch: 80, train_loss: 0.3258, test_loss: 2.1218, test_f1: 0.5608
 epoch: 81, train_loss: 0.3257, test_loss: 2.0295, test_f1: 0.5312
 epoch: 82, train_loss: 0.3297, test_loss: 1.9783, test_f1: 0.5354
 epoch: 83, train_loss: 0.3241, test_loss: 2.1901, test_f1: 0.5293
 epoch: 84, train_loss: 0.3729, test_loss: 1.9951, test_f1: 0.5821
 epoch: 85, train_loss: 0.3160, test_loss: 2.1500, test_f1: 0.5542
 epoch: 86, train_loss: 0.3149, test_loss: 2.2528, test_f1: 0.5117
 epoch: 87, train_loss: 0.3262, test_loss: 2.2176, test_f1: 0.5184
 epoch: 88, train_loss: 0.3279, test_loss: 2.2239, test_f1: 0.4898
 epoch: 89, train_loss: 0.3315, test_loss: 2.1745, test_f1: 0.5133
 epoch: 90, train_loss: 0.3359, test_loss: 2.2255, test_f1: 0.5591
 epoch: 91, train_loss: 0.3376, test_loss: 2.2030, test_f1: 0.5520
 epoch: 92, train_loss: 0.3017, test_loss: 2.2169, test_f1: 0.5754
 epoch: 93, train_loss: 0.2892, test_loss: 2.4467, test_f1: 0.5877
 epoch: 94, train_loss: 0.2892, test_loss: 2.3068, test_f1: 0.5608
 epoch: 95, train_loss: 0.3066, test_loss: 2.3536, test_f1: 0.5519
 epoch: 96, train_loss: 0.2924, test_loss: 2.1770, test_f1: 0.5898
 epoch: 97, train_loss: 0.2893, test_loss: 2.0762, test_f1: 0.5911
 epoch: 98, train_loss: 0.2892, test_loss: 2.2087, test_f1: 0.5474
 epoch: 99, train_loss: 0.2815, test_loss: 2.4433, test_f1: 0.5692
##################ITERATION #9 ****************************************
 epoch: 0, train_loss: 1.2923, test_loss: 1.4426, test_f1: 0.2198
 epoch: 1, train_loss: 1.0773, test_loss: 1.3503, test_f1: 0.1365
 epoch: 2, train_loss: 1.0108, test_loss: 1.3103, test_f1: 0.1377
 epoch: 3, train_loss: 0.9730, test_loss: 1.2698, test_f1: 0.3286
 epoch: 4, train_loss: 0.9126, test_loss: 1.2135, test_f1: 0.4705
 epoch: 5, train_loss: 0.8912, test_loss: 1.2357, test_f1: 0.5303
 epoch: 6, train_loss: 0.8761, test_loss: 1.2527, test_f1: 0.5141
 epoch: 7, train_loss: 0.8369, test_loss: 1.1503, test_f1: 0.5667
 epoch: 8, train_loss: 0.8407, test_loss: 1.2213, test_f1: 0.5986
 epoch: 9, train_loss: 0.8463, test_loss: 1.2909, test_f1: 0.5662
 epoch: 10, train_loss: 0.8134, test_loss: 1.2199, test_f1: 0.5806
 epoch: 11, train_loss: 0.7847, test_loss: 1.2755, test_f1: 0.5625
 epoch: 12, train_loss: 0.7490, test_loss: 1.2854, test_f1: 0.5386
 epoch: 13, train_loss: 0.7222, test_loss: 1.2639, test_f1: 0.5530
 epoch: 14, train_loss: 0.7120, test_loss: 1.3133, test_f1: 0.5695
 epoch: 15, train_loss: 0.7201, test_loss: 1.4755, test_f1: 0.5527
 epoch: 16, train_loss: 0.7082, test_loss: 1.4125, test_f1: 0.5513
 epoch: 17, train_loss: 0.6983, test_loss: 1.2523, test_f1: 0.5796
 epoch: 18, train_loss: 0.6776, test_loss: 1.5134, test_f1: 0.5420
 epoch: 19, train_loss: 0.6739, test_loss: 1.3342, test_f1: 0.5263
 epoch: 20, train_loss: 0.6969, test_loss: 1.2620, test_f1: 0.5114
 epoch: 21, train_loss: 0.7322, test_loss: 1.2832, test_f1: 0.5443
 epoch: 22, train_loss: 0.6910, test_loss: 1.4846, test_f1: 0.5006
 epoch: 23, train_loss: 0.6691, test_loss: 1.3509, test_f1: 0.5429
 epoch: 24, train_loss: 0.6401, test_loss: 1.3687, test_f1: 0.5595
 epoch: 25, train_loss: 0.6517, test_loss: 1.2893, test_f1: 0.5509
 epoch: 26, train_loss: 0.6556, test_loss: 1.5841, test_f1: 0.4868
 epoch: 27, train_loss: 0.6688, test_loss: 1.3664, test_f1: 0.5404
 epoch: 28, train_loss: 0.6642, test_loss: 1.4047, test_f1: 0.5604
 epoch: 29, train_loss: 0.6360, test_loss: 1.5219, test_f1: 0.5433
 epoch: 30, train_loss: 0.6286, test_loss: 1.3905, test_f1: 0.5525
 epoch: 31, train_loss: 0.6404, test_loss: 2.0896, test_f1: 0.4624
 epoch: 32, train_loss: 0.6469, test_loss: 1.4607, test_f1: 0.5325
 epoch: 33, train_loss: 0.5633, test_loss: 1.6317, test_f1: 0.5128
 epoch: 34, train_loss: 0.5745, test_loss: 1.7038, test_f1: 0.5343
 epoch: 35, train_loss: 0.5754, test_loss: 1.6020, test_f1: 0.5499
 epoch: 36, train_loss: 0.5635, test_loss: 1.2806, test_f1: 0.6140
 epoch: 37, train_loss: 0.5368, test_loss: 1.4861, test_f1: 0.5411
 epoch: 38, train_loss: 0.5047, test_loss: 1.4172, test_f1: 0.5546
 epoch: 39, train_loss: 0.5066, test_loss: 1.4909, test_f1: 0.5970
 epoch: 40, train_loss: 0.5189, test_loss: 1.6790, test_f1: 0.5668
 epoch: 41, train_loss: 0.5280, test_loss: 1.6745, test_f1: 0.5579
 epoch: 42, train_loss: 0.5036, test_loss: 1.5909, test_f1: 0.5319
 epoch: 43, train_loss: 0.4777, test_loss: 1.5514, test_f1: 0.5196
 epoch: 44, train_loss: 0.4878, test_loss: 1.5270, test_f1: 0.5561
 epoch: 45, train_loss: 0.6042, test_loss: 1.4808, test_f1: 0.5743
 epoch: 46, train_loss: 0.6700, test_loss: 1.4741, test_f1: 0.5432
 epoch: 47, train_loss: 0.5631, test_loss: 1.7314, test_f1: 0.4798
 epoch: 48, train_loss: 0.5581, test_loss: 1.5231, test_f1: 0.5626
 epoch: 49, train_loss: 0.5540, test_loss: 1.7014, test_f1: 0.5443
 epoch: 50, train_loss: 0.5320, test_loss: 1.8027, test_f1: 0.5197
 epoch: 51, train_loss: 0.5261, test_loss: 1.7855, test_f1: 0.5378
 epoch: 52, train_loss: 0.4899, test_loss: 1.5619, test_f1: 0.5862
 epoch: 53, train_loss: 0.4601, test_loss: 1.5386, test_f1: 0.5981
 epoch: 54, train_loss: 0.4542, test_loss: 1.6382, test_f1: 0.5555
 epoch: 55, train_loss: 0.4661, test_loss: 1.6775, test_f1: 0.5802
 epoch: 56, train_loss: 0.4265, test_loss: 1.7105, test_f1: 0.5665
 epoch: 57, train_loss: 0.3852, test_loss: 1.6936, test_f1: 0.5704
 epoch: 58, train_loss: 0.3933, test_loss: 1.6712, test_f1: 0.5871
 epoch: 59, train_loss: 0.4106, test_loss: 1.7471, test_f1: 0.5540
 epoch: 60, train_loss: 0.4278, test_loss: 1.9914, test_f1: 0.5186
 epoch: 61, train_loss: 0.4217, test_loss: 1.7576, test_f1: 0.5500
 epoch: 62, train_loss: 0.4003, test_loss: 1.6927, test_f1: 0.5345
 epoch: 63, train_loss: 0.4015, test_loss: 1.6547, test_f1: 0.5705
 epoch: 64, train_loss: 0.4143, test_loss: 1.6393, test_f1: 0.5799
 epoch: 65, train_loss: 0.3826, test_loss: 1.5542, test_f1: 0.5852
 epoch: 66, train_loss: 0.4244, test_loss: 1.5716, test_f1: 0.6008
 epoch: 67, train_loss: 0.3920, test_loss: 1.8996, test_f1: 0.5537
 epoch: 68, train_loss: 0.3656, test_loss: 2.2226, test_f1: 0.5283
 epoch: 69, train_loss: 0.3361, test_loss: 2.0146, test_f1: 0.5388
 epoch: 70, train_loss: 0.3603, test_loss: 1.9502, test_f1: 0.5231
 epoch: 71, train_loss: 0.3625, test_loss: 2.0134, test_f1: 0.5356
 epoch: 72, train_loss: 0.3456, test_loss: 1.9077, test_f1: 0.5549
 epoch: 73, train_loss: 0.3676, test_loss: 1.7651, test_f1: 0.5532
 epoch: 74, train_loss: 0.3424, test_loss: 1.9961, test_f1: 0.5723
 epoch: 75, train_loss: 0.3565, test_loss: 1.7581, test_f1: 0.5838
 epoch: 76, train_loss: 0.3591, test_loss: 1.7378, test_f1: 0.5595
 epoch: 77, train_loss: 0.3526, test_loss: 1.8390, test_f1: 0.5644
 epoch: 78, train_loss: 0.3220, test_loss: 1.9665, test_f1: 0.5845
 epoch: 79, train_loss: 0.3239, test_loss: 2.1000, test_f1: 0.5471
 epoch: 80, train_loss: 0.3268, test_loss: 1.9252, test_f1: 0.5425
 epoch: 81, train_loss: 0.3194, test_loss: 1.9527, test_f1: 0.5537
 epoch: 82, train_loss: 0.3190, test_loss: 2.1719, test_f1: 0.5662
 epoch: 83, train_loss: 0.3074, test_loss: 2.2382, test_f1: 0.5884
 epoch: 84, train_loss: 0.2956, test_loss: 2.3208, test_f1: 0.5480
 epoch: 85, train_loss: 0.2739, test_loss: 2.4017, test_f1: 0.5358
 epoch: 86, train_loss: 0.2829, test_loss: 2.3559, test_f1: 0.5368
 epoch: 87, train_loss: 0.3240, test_loss: 2.4196, test_f1: 0.5573
 epoch: 88, train_loss: 0.3388, test_loss: 2.2109, test_f1: 0.5424
 epoch: 89, train_loss: 0.3178, test_loss: 2.1813, test_f1: 0.5289
 epoch: 90, train_loss: 0.3162, test_loss: 2.2504, test_f1: 0.5130
 epoch: 91, train_loss: 0.3240, test_loss: 2.2933, test_f1: 0.5422
 epoch: 92, train_loss: 0.3226, test_loss: 2.0359, test_f1: 0.5879
 epoch: 93, train_loss: 0.3142, test_loss: 1.9078, test_f1: 0.5837
 epoch: 94, train_loss: 0.3129, test_loss: 1.9909, test_f1: 0.5758
 epoch: 95, train_loss: 0.3169, test_loss: 2.1020, test_f1: 0.5393
 epoch: 96, train_loss: 0.3127, test_loss: 2.1483, test_f1: 0.5540
 epoch: 97, train_loss: 0.2887, test_loss: 2.2894, test_f1: 0.5319
 epoch: 98, train_loss: 0.2927, test_loss: 2.3795, test_f1: 0.5452
 epoch: 99, train_loss: 0.3088, test_loss: 2.2058, test_f1: 0.5477

Training completed in 308.21 seconds
Best F1: 0.6363 at epoch 94
Mean F1 across iterations: 0.6092  0.0165
========================FINAL RESULTS================================
FEGIN weighted F1: 0.6363  0.0165
python main.py --data ltspice_demos --representation component_component --model FEGIN --layers 5 --hiddens 128 --batch_size 256 --lr 0.001 --emb_size 250 --epochs 100 --save_appendix component_component_L5_H128_BS256_LR0.001_E250 --no_val
-----



STDERR:
  File "main.py", line 370, in <module>
    main()
  File "main.py", line 254, in main
    dataset = dataset_class(
  File "/home/philip/projects/ltspice_examples_code_repo/Circuit-Completion-Using-GNNs/component_classification_with_link_prediction_head/evaluation/FEGIN/kernel/circuit_datasets.py", line 15, in __init__
    self.data, self.slices = torch.load(self.processed_paths[0])
  File "/home/philip/.local/lib/python3.8/site-packages/torch/serialization.py", line 1040, in load
    warnings.warn(
  File "/usr/lib/python3.8/warnings.py", line 109, in _showwarnmsg
    sw(msg.message, msg.category, msg.filename, msg.lineno,
  File "main.py", line 47, in warn_with_traceback
    traceback.print_stack(file=log)
/home/philip/projects/ltspice_examples_code_repo/Circuit-Completion-Using-GNNs/component_classification_with_link_prediction_head/evaluation/FEGIN/kernel/circuit_datasets.py:15: FutureWarning: You are using `torch.load` with `weights_only=False` (the current default value), which uses the default pickle module implicitly. It is possible to construct malicious pickle data which will execute arbitrary code during unpickling (See https://github.com/pytorch/pytorch/blob/main/SECURITY.md#untrusted-models for more details). In a future release, the default value for `weights_only` will be flipped to `True`. This limits the functions that could be executed during unpickling. Arbitrary objects will no longer be allowed to be loaded via this mode unless they are explicitly allowlisted by the user via `torch.serialization.add_safe_globals`. We recommend you start setting `weights_only=True` for any use case where you don't have full control of the loaded file. Please open an issue on GitHub for any issues related to this experimental feature.
  self.data, self.slices = torch.load(self.processed_paths[0])
