STDOUT:
Results will be saved in /home/philip/projects/ltspice_examples_code_repo/Circuit-Completion-Using-GNNs/component_classification_with_link_prediction_head/evaluation/FEGIN/results/model_FEGIN_dataset_ltspice_examples
Command line input: python main.py --data ltspice_examples --representation component_component --model FEGIN --layers 6 --hiddens 32 --batch_size 256 --lr 0.0001 --emb_size 250 --epochs 100 --save_appendix component_component_L6_H32_BS256_LR0.0001_E250 --no_val
 is saved.
-----
ltspice_examples - FEGIN
Using 6 layers, 32 hidden units, h = 2
Loading component_component representation dataset
ENTERED
Training FEGIN on component_component representation
Train: 3556, Test: 845
##################ITERATION #0 ****************************************
 epoch: 0, train_loss: 1.4328, test_loss: 1.4239, test_f1: 0.1015
 epoch: 1, train_loss: 1.4289, test_loss: 1.4222, test_f1: 0.1015
 epoch: 2, train_loss: 1.4263, test_loss: 1.4205, test_f1: 0.1015
 epoch: 3, train_loss: 1.4240, test_loss: 1.4182, test_f1: 0.1011
 epoch: 4, train_loss: 1.4221, test_loss: 1.4155, test_f1: 0.1135
 epoch: 5, train_loss: 1.4192, test_loss: 1.4121, test_f1: 0.1179
 epoch: 6, train_loss: 1.4172, test_loss: 1.4095, test_f1: 0.1179
 epoch: 7, train_loss: 1.4147, test_loss: 1.4072, test_f1: 0.1217
 epoch: 8, train_loss: 1.4117, test_loss: 1.4051, test_f1: 0.1428
 epoch: 9, train_loss: 1.4098, test_loss: 1.4027, test_f1: 0.1464
 epoch: 10, train_loss: 1.4072, test_loss: 1.4002, test_f1: 0.1464
 epoch: 11, train_loss: 1.4039, test_loss: 1.3969, test_f1: 0.1463
 epoch: 12, train_loss: 1.4013, test_loss: 1.3934, test_f1: 0.1497
 epoch: 13, train_loss: 1.3975, test_loss: 1.3901, test_f1: 0.1480
 epoch: 14, train_loss: 1.3936, test_loss: 1.3856, test_f1: 0.1564
 epoch: 15, train_loss: 1.3900, test_loss: 1.3813, test_f1: 0.1631
 epoch: 16, train_loss: 1.3855, test_loss: 1.3762, test_f1: 0.1781
 epoch: 17, train_loss: 1.3794, test_loss: 1.3708, test_f1: 0.1828
 epoch: 18, train_loss: 1.3751, test_loss: 1.3652, test_f1: 0.1628
 epoch: 19, train_loss: 1.3675, test_loss: 1.3585, test_f1: 0.1645
 epoch: 20, train_loss: 1.3596, test_loss: 1.3513, test_f1: 0.1638
 epoch: 21, train_loss: 1.3529, test_loss: 1.3440, test_f1: 0.1812
 epoch: 22, train_loss: 1.3462, test_loss: 1.3357, test_f1: 0.2743
 epoch: 23, train_loss: 1.3380, test_loss: 1.3282, test_f1: 0.3131
 epoch: 24, train_loss: 1.3290, test_loss: 1.3192, test_f1: 0.3384
 epoch: 25, train_loss: 1.3195, test_loss: 1.3102, test_f1: 0.3607
 epoch: 26, train_loss: 1.3120, test_loss: 1.3016, test_f1: 0.3704
 epoch: 27, train_loss: 1.3060, test_loss: 1.2930, test_f1: 0.3578
 epoch: 28, train_loss: 1.2978, test_loss: 1.2844, test_f1: 0.3457
 epoch: 29, train_loss: 1.2870, test_loss: 1.2769, test_f1: 0.3465
 epoch: 30, train_loss: 1.2833, test_loss: 1.2703, test_f1: 0.3276
 epoch: 31, train_loss: 1.2718, test_loss: 1.2640, test_f1: 0.3239
 epoch: 32, train_loss: 1.2686, test_loss: 1.2570, test_f1: 0.3267
 epoch: 33, train_loss: 1.2660, test_loss: 1.2501, test_f1: 0.3188
 epoch: 34, train_loss: 1.2553, test_loss: 1.2441, test_f1: 0.3268
 epoch: 35, train_loss: 1.2540, test_loss: 1.2388, test_f1: 0.3256
 epoch: 36, train_loss: 1.2456, test_loss: 1.2335, test_f1: 0.3300
 epoch: 37, train_loss: 1.2417, test_loss: 1.2290, test_f1: 0.3300
 epoch: 38, train_loss: 1.2392, test_loss: 1.2245, test_f1: 0.3337
 epoch: 39, train_loss: 1.2334, test_loss: 1.2197, test_f1: 0.3307
 epoch: 40, train_loss: 1.2319, test_loss: 1.2170, test_f1: 0.3312
 epoch: 41, train_loss: 1.2259, test_loss: 1.2128, test_f1: 0.3353
 epoch: 42, train_loss: 1.2242, test_loss: 1.2089, test_f1: 0.3339
 epoch: 43, train_loss: 1.2254, test_loss: 1.2063, test_f1: 0.3336
 epoch: 44, train_loss: 1.2154, test_loss: 1.2034, test_f1: 0.3285
 epoch: 45, train_loss: 1.2095, test_loss: 1.2005, test_f1: 0.3252
 epoch: 46, train_loss: 1.2119, test_loss: 1.1960, test_f1: 0.3247
 epoch: 47, train_loss: 1.2050, test_loss: 1.1937, test_f1: 0.3331
 epoch: 48, train_loss: 1.2079, test_loss: 1.1909, test_f1: 0.3273
 epoch: 49, train_loss: 1.2040, test_loss: 1.1885, test_f1: 0.3354
 epoch: 50, train_loss: 1.1940, test_loss: 1.1854, test_f1: 0.3424
 epoch: 51, train_loss: 1.2003, test_loss: 1.1846, test_f1: 0.3397
 epoch: 52, train_loss: 1.1966, test_loss: 1.1828, test_f1: 0.3389
 epoch: 53, train_loss: 1.1931, test_loss: 1.1816, test_f1: 0.3367
 epoch: 54, train_loss: 1.1864, test_loss: 1.1811, test_f1: 0.3364
 epoch: 55, train_loss: 1.1875, test_loss: 1.1802, test_f1: 0.3358
 epoch: 56, train_loss: 1.1903, test_loss: 1.1797, test_f1: 0.3358
 epoch: 57, train_loss: 1.1895, test_loss: 1.1778, test_f1: 0.3394
 epoch: 58, train_loss: 1.1860, test_loss: 1.1763, test_f1: 0.3364
 epoch: 59, train_loss: 1.1868, test_loss: 1.1751, test_f1: 0.3404
 epoch: 60, train_loss: 1.1798, test_loss: 1.1734, test_f1: 0.3418
 epoch: 61, train_loss: 1.1829, test_loss: 1.1730, test_f1: 0.3439
 epoch: 62, train_loss: 1.1841, test_loss: 1.1715, test_f1: 0.3430
 epoch: 63, train_loss: 1.1800, test_loss: 1.1717, test_f1: 0.3422
 epoch: 64, train_loss: 1.1778, test_loss: 1.1707, test_f1: 0.3452
 epoch: 65, train_loss: 1.1790, test_loss: 1.1693, test_f1: 0.3454
 epoch: 66, train_loss: 1.1741, test_loss: 1.1681, test_f1: 0.3471
 epoch: 67, train_loss: 1.1760, test_loss: 1.1676, test_f1: 0.3481
 epoch: 68, train_loss: 1.1748, test_loss: 1.1677, test_f1: 0.3472
 epoch: 69, train_loss: 1.1726, test_loss: 1.1669, test_f1: 0.3481
 epoch: 70, train_loss: 1.1747, test_loss: 1.1652, test_f1: 0.3475
 epoch: 71, train_loss: 1.1692, test_loss: 1.1641, test_f1: 0.3478
 epoch: 72, train_loss: 1.1664, test_loss: 1.1642, test_f1: 0.3477
 epoch: 73, train_loss: 1.1665, test_loss: 1.1640, test_f1: 0.3501
 epoch: 74, train_loss: 1.1638, test_loss: 1.1608, test_f1: 0.3521
 epoch: 75, train_loss: 1.1667, test_loss: 1.1618, test_f1: 0.3559
 epoch: 76, train_loss: 1.1598, test_loss: 1.1588, test_f1: 0.3552
 epoch: 77, train_loss: 1.1594, test_loss: 1.1573, test_f1: 0.3571
 epoch: 78, train_loss: 1.1620, test_loss: 1.1589, test_f1: 0.3643
 epoch: 79, train_loss: 1.1626, test_loss: 1.1584, test_f1: 0.3575
 epoch: 80, train_loss: 1.1583, test_loss: 1.1573, test_f1: 0.3609
 epoch: 81, train_loss: 1.1583, test_loss: 1.1558, test_f1: 0.3604
 epoch: 82, train_loss: 1.1544, test_loss: 1.1560, test_f1: 0.3642
 epoch: 83, train_loss: 1.1532, test_loss: 1.1566, test_f1: 0.3651
 epoch: 84, train_loss: 1.1559, test_loss: 1.1567, test_f1: 0.3684
 epoch: 85, train_loss: 1.1484, test_loss: 1.1563, test_f1: 0.3663
 epoch: 86, train_loss: 1.1475, test_loss: 1.1556, test_f1: 0.3680
 epoch: 87, train_loss: 1.1544, test_loss: 1.1556, test_f1: 0.3645
 epoch: 88, train_loss: 1.1446, test_loss: 1.1545, test_f1: 0.3684
 epoch: 89, train_loss: 1.1447, test_loss: 1.1560, test_f1: 0.3705
 epoch: 90, train_loss: 1.1408, test_loss: 1.1537, test_f1: 0.3671
 epoch: 91, train_loss: 1.1385, test_loss: 1.1508, test_f1: 0.3680
 epoch: 92, train_loss: 1.1412, test_loss: 1.1526, test_f1: 0.3666
 epoch: 93, train_loss: 1.1421, test_loss: 1.1519, test_f1: 0.3688
 epoch: 94, train_loss: 1.1429, test_loss: 1.1507, test_f1: 0.3746
 epoch: 95, train_loss: 1.1442, test_loss: 1.1506, test_f1: 0.3826
 epoch: 96, train_loss: 1.1422, test_loss: 1.1522, test_f1: 0.3827
 epoch: 97, train_loss: 1.1369, test_loss: 1.1519, test_f1: 0.3888
 epoch: 98, train_loss: 1.1320, test_loss: 1.1516, test_f1: 0.3870
 epoch: 99, train_loss: 1.1331, test_loss: 1.1476, test_f1: 0.3801
##################ITERATION #1 ****************************************
 epoch: 0, train_loss: 1.3889, test_loss: 1.3883, test_f1: 0.1603
 epoch: 1, train_loss: 1.3830, test_loss: 1.3869, test_f1: 0.1637
 epoch: 2, train_loss: 1.3779, test_loss: 1.3823, test_f1: 0.1612
 epoch: 3, train_loss: 1.3732, test_loss: 1.3725, test_f1: 0.1930
 epoch: 4, train_loss: 1.3681, test_loss: 1.3656, test_f1: 0.2192
 epoch: 5, train_loss: 1.3624, test_loss: 1.3585, test_f1: 0.2535
 epoch: 6, train_loss: 1.3564, test_loss: 1.3512, test_f1: 0.2747
 epoch: 7, train_loss: 1.3507, test_loss: 1.3420, test_f1: 0.2642
 epoch: 8, train_loss: 1.3440, test_loss: 1.3348, test_f1: 0.2654
 epoch: 9, train_loss: 1.3352, test_loss: 1.3267, test_f1: 0.2753
 epoch: 10, train_loss: 1.3276, test_loss: 1.3185, test_f1: 0.2847
 epoch: 11, train_loss: 1.3196, test_loss: 1.3109, test_f1: 0.3048
 epoch: 12, train_loss: 1.3112, test_loss: 1.3027, test_f1: 0.3057
 epoch: 13, train_loss: 1.3042, test_loss: 1.2950, test_f1: 0.3060
 epoch: 14, train_loss: 1.2958, test_loss: 1.2875, test_f1: 0.2955
 epoch: 15, train_loss: 1.2892, test_loss: 1.2806, test_f1: 0.2845
 epoch: 16, train_loss: 1.2829, test_loss: 1.2740, test_f1: 0.2832
 epoch: 17, train_loss: 1.2729, test_loss: 1.2685, test_f1: 0.2751
 epoch: 18, train_loss: 1.2682, test_loss: 1.2628, test_f1: 0.2756
 epoch: 19, train_loss: 1.2585, test_loss: 1.2578, test_f1: 0.2670
 epoch: 20, train_loss: 1.2580, test_loss: 1.2530, test_f1: 0.2663
 epoch: 21, train_loss: 1.2502, test_loss: 1.2498, test_f1: 0.2644
 epoch: 22, train_loss: 1.2474, test_loss: 1.2458, test_f1: 0.2662
 epoch: 23, train_loss: 1.2410, test_loss: 1.2429, test_f1: 0.2693
 epoch: 24, train_loss: 1.2401, test_loss: 1.2393, test_f1: 0.2739
 epoch: 25, train_loss: 1.2422, test_loss: 1.2363, test_f1: 0.2818
 epoch: 26, train_loss: 1.2386, test_loss: 1.2337, test_f1: 0.2818
 epoch: 27, train_loss: 1.2309, test_loss: 1.2321, test_f1: 0.2901
 epoch: 28, train_loss: 1.2244, test_loss: 1.2294, test_f1: 0.2881
 epoch: 29, train_loss: 1.2231, test_loss: 1.2265, test_f1: 0.2887
 epoch: 30, train_loss: 1.2219, test_loss: 1.2239, test_f1: 0.3015
 epoch: 31, train_loss: 1.2226, test_loss: 1.2223, test_f1: 0.3156
 epoch: 32, train_loss: 1.2152, test_loss: 1.2193, test_f1: 0.3160
 epoch: 33, train_loss: 1.2139, test_loss: 1.2167, test_f1: 0.3224
 epoch: 34, train_loss: 1.2093, test_loss: 1.2140, test_f1: 0.3216
 epoch: 35, train_loss: 1.2059, test_loss: 1.2115, test_f1: 0.3261
 epoch: 36, train_loss: 1.2086, test_loss: 1.2085, test_f1: 0.3319
 epoch: 37, train_loss: 1.2005, test_loss: 1.2060, test_f1: 0.3384
 epoch: 38, train_loss: 1.1986, test_loss: 1.2036, test_f1: 0.3314
 epoch: 39, train_loss: 1.1982, test_loss: 1.2007, test_f1: 0.3264
 epoch: 40, train_loss: 1.1976, test_loss: 1.1992, test_f1: 0.3335
 epoch: 41, train_loss: 1.1930, test_loss: 1.1980, test_f1: 0.3422
 epoch: 42, train_loss: 1.1892, test_loss: 1.1935, test_f1: 0.3438
 epoch: 43, train_loss: 1.1882, test_loss: 1.1909, test_f1: 0.3514
 epoch: 44, train_loss: 1.1857, test_loss: 1.1892, test_f1: 0.3583
 epoch: 45, train_loss: 1.1795, test_loss: 1.1866, test_f1: 0.3692
 epoch: 46, train_loss: 1.1764, test_loss: 1.1845, test_f1: 0.3692
 epoch: 47, train_loss: 1.1736, test_loss: 1.1820, test_f1: 0.3683
 epoch: 48, train_loss: 1.1701, test_loss: 1.1802, test_f1: 0.3708
 epoch: 49, train_loss: 1.1643, test_loss: 1.1786, test_f1: 0.3727
 epoch: 50, train_loss: 1.1646, test_loss: 1.1748, test_f1: 0.3841
 epoch: 51, train_loss: 1.1636, test_loss: 1.1736, test_f1: 0.3832
 epoch: 52, train_loss: 1.1645, test_loss: 1.1718, test_f1: 0.3890
 epoch: 53, train_loss: 1.1635, test_loss: 1.1707, test_f1: 0.3888
 epoch: 54, train_loss: 1.1571, test_loss: 1.1688, test_f1: 0.3977
 epoch: 55, train_loss: 1.1519, test_loss: 1.1676, test_f1: 0.3948
 epoch: 56, train_loss: 1.1508, test_loss: 1.1676, test_f1: 0.3915
 epoch: 57, train_loss: 1.1546, test_loss: 1.1666, test_f1: 0.3897
 epoch: 58, train_loss: 1.1544, test_loss: 1.1655, test_f1: 0.3868
 epoch: 59, train_loss: 1.1488, test_loss: 1.1643, test_f1: 0.3869
 epoch: 60, train_loss: 1.1483, test_loss: 1.1630, test_f1: 0.3888
 epoch: 61, train_loss: 1.1482, test_loss: 1.1618, test_f1: 0.3869
 epoch: 62, train_loss: 1.1547, test_loss: 1.1625, test_f1: 0.3947
 epoch: 63, train_loss: 1.1413, test_loss: 1.1614, test_f1: 0.3922
 epoch: 64, train_loss: 1.1472, test_loss: 1.1605, test_f1: 0.3905
 epoch: 65, train_loss: 1.1408, test_loss: 1.1593, test_f1: 0.3962
 epoch: 66, train_loss: 1.1365, test_loss: 1.1585, test_f1: 0.3897
 epoch: 67, train_loss: 1.1370, test_loss: 1.1585, test_f1: 0.3897
 epoch: 68, train_loss: 1.1404, test_loss: 1.1574, test_f1: 0.3894
 epoch: 69, train_loss: 1.1341, test_loss: 1.1560, test_f1: 0.3895
 epoch: 70, train_loss: 1.1355, test_loss: 1.1559, test_f1: 0.3821
 epoch: 71, train_loss: 1.1333, test_loss: 1.1544, test_f1: 0.3897
 epoch: 72, train_loss: 1.1354, test_loss: 1.1547, test_f1: 0.3839
 epoch: 73, train_loss: 1.1291, test_loss: 1.1544, test_f1: 0.3886
 epoch: 74, train_loss: 1.1283, test_loss: 1.1531, test_f1: 0.3894
 epoch: 75, train_loss: 1.1259, test_loss: 1.1527, test_f1: 0.3876
 epoch: 76, train_loss: 1.1241, test_loss: 1.1516, test_f1: 0.3875
 epoch: 77, train_loss: 1.1214, test_loss: 1.1501, test_f1: 0.3931
 epoch: 78, train_loss: 1.1188, test_loss: 1.1487, test_f1: 0.3970
 epoch: 79, train_loss: 1.1268, test_loss: 1.1487, test_f1: 0.3887
 epoch: 80, train_loss: 1.1190, test_loss: 1.1477, test_f1: 0.3932
 epoch: 81, train_loss: 1.1165, test_loss: 1.1484, test_f1: 0.3898
 epoch: 82, train_loss: 1.1189, test_loss: 1.1494, test_f1: 0.3862
 epoch: 83, train_loss: 1.1173, test_loss: 1.1490, test_f1: 0.3899
 epoch: 84, train_loss: 1.1149, test_loss: 1.1470, test_f1: 0.3906
 epoch: 85, train_loss: 1.1135, test_loss: 1.1439, test_f1: 0.3898
 epoch: 86, train_loss: 1.1089, test_loss: 1.1444, test_f1: 0.3899
 epoch: 87, train_loss: 1.1147, test_loss: 1.1435, test_f1: 0.3891
 epoch: 88, train_loss: 1.1121, test_loss: 1.1427, test_f1: 0.3930
 epoch: 89, train_loss: 1.1110, test_loss: 1.1443, test_f1: 0.3930
 epoch: 90, train_loss: 1.1063, test_loss: 1.1430, test_f1: 0.3930
 epoch: 91, train_loss: 1.1070, test_loss: 1.1414, test_f1: 0.3928
 epoch: 92, train_loss: 1.1074, test_loss: 1.1417, test_f1: 0.3939
 epoch: 93, train_loss: 1.1081, test_loss: 1.1416, test_f1: 0.3920
 epoch: 94, train_loss: 1.1012, test_loss: 1.1416, test_f1: 0.3936
 epoch: 95, train_loss: 1.1039, test_loss: 1.1417, test_f1: 0.3902
 epoch: 96, train_loss: 1.1015, test_loss: 1.1412, test_f1: 0.3946
 epoch: 97, train_loss: 1.0976, test_loss: 1.1411, test_f1: 0.3976
 epoch: 98, train_loss: 1.0998, test_loss: 1.1412, test_f1: 0.4054
 epoch: 99, train_loss: 1.0941, test_loss: 1.1402, test_f1: 0.4057
##################ITERATION #2 ****************************************
 epoch: 0, train_loss: 1.3439, test_loss: 1.3528, test_f1: 0.2274
 epoch: 1, train_loss: 1.3347, test_loss: 1.3438, test_f1: 0.2274
 epoch: 2, train_loss: 1.3278, test_loss: 1.3369, test_f1: 0.2274
 epoch: 3, train_loss: 1.3193, test_loss: 1.3290, test_f1: 0.2274
 epoch: 4, train_loss: 1.3139, test_loss: 1.3217, test_f1: 0.2564
 epoch: 5, train_loss: 1.3076, test_loss: 1.3107, test_f1: 0.2848
 epoch: 6, train_loss: 1.3029, test_loss: 1.2979, test_f1: 0.2775
 epoch: 7, train_loss: 1.2958, test_loss: 1.2894, test_f1: 0.2762
 epoch: 8, train_loss: 1.2897, test_loss: 1.2835, test_f1: 0.2658
 epoch: 9, train_loss: 1.2838, test_loss: 1.2771, test_f1: 0.2823
 epoch: 10, train_loss: 1.2790, test_loss: 1.2721, test_f1: 0.2863
 epoch: 11, train_loss: 1.2735, test_loss: 1.2681, test_f1: 0.2868
 epoch: 12, train_loss: 1.2674, test_loss: 1.2618, test_f1: 0.2884
 epoch: 13, train_loss: 1.2620, test_loss: 1.2550, test_f1: 0.3093
 epoch: 14, train_loss: 1.2581, test_loss: 1.2505, test_f1: 0.3127
 epoch: 15, train_loss: 1.2563, test_loss: 1.2446, test_f1: 0.3095
 epoch: 16, train_loss: 1.2506, test_loss: 1.2407, test_f1: 0.3242
 epoch: 17, train_loss: 1.2439, test_loss: 1.2354, test_f1: 0.3257
 epoch: 18, train_loss: 1.2438, test_loss: 1.2316, test_f1: 0.3264
 epoch: 19, train_loss: 1.2405, test_loss: 1.2269, test_f1: 0.3319
 epoch: 20, train_loss: 1.2372, test_loss: 1.2252, test_f1: 0.3337
 epoch: 21, train_loss: 1.2327, test_loss: 1.2227, test_f1: 0.3322
 epoch: 22, train_loss: 1.2278, test_loss: 1.2190, test_f1: 0.3363
 epoch: 23, train_loss: 1.2263, test_loss: 1.2148, test_f1: 0.3409
 epoch: 24, train_loss: 1.2231, test_loss: 1.2110, test_f1: 0.3404
 epoch: 25, train_loss: 1.2242, test_loss: 1.2078, test_f1: 0.3416
 epoch: 26, train_loss: 1.2157, test_loss: 1.2064, test_f1: 0.3415
 epoch: 27, train_loss: 1.2170, test_loss: 1.2038, test_f1: 0.3427
 epoch: 28, train_loss: 1.2140, test_loss: 1.2016, test_f1: 0.3430
 epoch: 29, train_loss: 1.2097, test_loss: 1.2013, test_f1: 0.3455
 epoch: 30, train_loss: 1.2044, test_loss: 1.1987, test_f1: 0.3480
 epoch: 31, train_loss: 1.2070, test_loss: 1.1954, test_f1: 0.3472
 epoch: 32, train_loss: 1.1997, test_loss: 1.1936, test_f1: 0.3483
 epoch: 33, train_loss: 1.2049, test_loss: 1.1919, test_f1: 0.3477
 epoch: 34, train_loss: 1.1948, test_loss: 1.1896, test_f1: 0.3483
 epoch: 35, train_loss: 1.1914, test_loss: 1.1871, test_f1: 0.3471
 epoch: 36, train_loss: 1.1921, test_loss: 1.1853, test_f1: 0.3480
 epoch: 37, train_loss: 1.1927, test_loss: 1.1837, test_f1: 0.3475
 epoch: 38, train_loss: 1.1894, test_loss: 1.1820, test_f1: 0.3514
 epoch: 39, train_loss: 1.1872, test_loss: 1.1803, test_f1: 0.3512
 epoch: 40, train_loss: 1.1864, test_loss: 1.1785, test_f1: 0.3478
 epoch: 41, train_loss: 1.1856, test_loss: 1.1761, test_f1: 0.3471
 epoch: 42, train_loss: 1.1862, test_loss: 1.1754, test_f1: 0.3436
 epoch: 43, train_loss: 1.1801, test_loss: 1.1762, test_f1: 0.3394
 epoch: 44, train_loss: 1.1773, test_loss: 1.1766, test_f1: 0.3381
 epoch: 45, train_loss: 1.1730, test_loss: 1.1743, test_f1: 0.3366
 epoch: 46, train_loss: 1.1783, test_loss: 1.1708, test_f1: 0.3414
 epoch: 47, train_loss: 1.1723, test_loss: 1.1684, test_f1: 0.3389
 epoch: 48, train_loss: 1.1703, test_loss: 1.1659, test_f1: 0.3340
 epoch: 49, train_loss: 1.1695, test_loss: 1.1662, test_f1: 0.3322
 epoch: 50, train_loss: 1.1704, test_loss: 1.1643, test_f1: 0.3351
 epoch: 51, train_loss: 1.1629, test_loss: 1.1652, test_f1: 0.3328
 epoch: 52, train_loss: 1.1608, test_loss: 1.1655, test_f1: 0.3411
 epoch: 53, train_loss: 1.1582, test_loss: 1.1645, test_f1: 0.3343
 epoch: 54, train_loss: 1.1643, test_loss: 1.1648, test_f1: 0.3452
 epoch: 55, train_loss: 1.1561, test_loss: 1.1623, test_f1: 0.3421
 epoch: 56, train_loss: 1.1598, test_loss: 1.1611, test_f1: 0.3398
 epoch: 57, train_loss: 1.1585, test_loss: 1.1596, test_f1: 0.3449
 epoch: 58, train_loss: 1.1602, test_loss: 1.1599, test_f1: 0.3448
 epoch: 59, train_loss: 1.1524, test_loss: 1.1592, test_f1: 0.3515
 epoch: 60, train_loss: 1.1579, test_loss: 1.1587, test_f1: 0.3581
 epoch: 61, train_loss: 1.1523, test_loss: 1.1584, test_f1: 0.3570
 epoch: 62, train_loss: 1.1512, test_loss: 1.1585, test_f1: 0.3497
 epoch: 63, train_loss: 1.1537, test_loss: 1.1568, test_f1: 0.3470
 epoch: 64, train_loss: 1.1483, test_loss: 1.1568, test_f1: 0.3543
 epoch: 65, train_loss: 1.1482, test_loss: 1.1543, test_f1: 0.3655
 epoch: 66, train_loss: 1.1475, test_loss: 1.1542, test_f1: 0.3743
 epoch: 67, train_loss: 1.1489, test_loss: 1.1529, test_f1: 0.3733
 epoch: 68, train_loss: 1.1470, test_loss: 1.1533, test_f1: 0.3727
 epoch: 69, train_loss: 1.1436, test_loss: 1.1538, test_f1: 0.3471
 epoch: 70, train_loss: 1.1430, test_loss: 1.1528, test_f1: 0.3555
 epoch: 71, train_loss: 1.1440, test_loss: 1.1522, test_f1: 0.3700
 epoch: 72, train_loss: 1.1405, test_loss: 1.1514, test_f1: 0.3573
 epoch: 73, train_loss: 1.1455, test_loss: 1.1505, test_f1: 0.3566
 epoch: 74, train_loss: 1.1421, test_loss: 1.1496, test_f1: 0.3604
 epoch: 75, train_loss: 1.1430, test_loss: 1.1505, test_f1: 0.3583
 epoch: 76, train_loss: 1.1420, test_loss: 1.1503, test_f1: 0.3693
 epoch: 77, train_loss: 1.1359, test_loss: 1.1500, test_f1: 0.3574
 epoch: 78, train_loss: 1.1412, test_loss: 1.1491, test_f1: 0.3600
 epoch: 79, train_loss: 1.1371, test_loss: 1.1502, test_f1: 0.3686
 epoch: 80, train_loss: 1.1390, test_loss: 1.1482, test_f1: 0.3636
 epoch: 81, train_loss: 1.1348, test_loss: 1.1467, test_f1: 0.3735
 epoch: 82, train_loss: 1.1368, test_loss: 1.1455, test_f1: 0.3623
 epoch: 83, train_loss: 1.1299, test_loss: 1.1470, test_f1: 0.3569
 epoch: 84, train_loss: 1.1317, test_loss: 1.1461, test_f1: 0.3583
 epoch: 85, train_loss: 1.1307, test_loss: 1.1455, test_f1: 0.3580
 epoch: 86, train_loss: 1.1270, test_loss: 1.1475, test_f1: 0.3579
 epoch: 87, train_loss: 1.1234, test_loss: 1.1473, test_f1: 0.3526
 epoch: 88, train_loss: 1.1297, test_loss: 1.1453, test_f1: 0.3536
 epoch: 89, train_loss: 1.1254, test_loss: 1.1457, test_f1: 0.3585
 epoch: 90, train_loss: 1.1306, test_loss: 1.1466, test_f1: 0.3541
 epoch: 91, train_loss: 1.1268, test_loss: 1.1449, test_f1: 0.3462
 epoch: 92, train_loss: 1.1225, test_loss: 1.1452, test_f1: 0.3465
 epoch: 93, train_loss: 1.1241, test_loss: 1.1436, test_f1: 0.3487
 epoch: 94, train_loss: 1.1229, test_loss: 1.1428, test_f1: 0.3465
 epoch: 95, train_loss: 1.1233, test_loss: 1.1422, test_f1: 0.3521
 epoch: 96, train_loss: 1.1227, test_loss: 1.1426, test_f1: 0.3562
 epoch: 97, train_loss: 1.1230, test_loss: 1.1423, test_f1: 0.3524
 epoch: 98, train_loss: 1.1217, test_loss: 1.1405, test_f1: 0.3602
 epoch: 99, train_loss: 1.1224, test_loss: 1.1406, test_f1: 0.3590
##################ITERATION #3 ****************************************
 epoch: 0, train_loss: 1.3419, test_loss: 1.3595, test_f1: 0.2274
 epoch: 1, train_loss: 1.3309, test_loss: 1.3528, test_f1: 0.2274
 epoch: 2, train_loss: 1.3255, test_loss: 1.3406, test_f1: 0.2274
 epoch: 3, train_loss: 1.3201, test_loss: 1.3297, test_f1: 0.2329
 epoch: 4, train_loss: 1.3125, test_loss: 1.3190, test_f1: 0.2339
 epoch: 5, train_loss: 1.3086, test_loss: 1.3085, test_f1: 0.2637
 epoch: 6, train_loss: 1.3007, test_loss: 1.2994, test_f1: 0.2686
 epoch: 7, train_loss: 1.2969, test_loss: 1.2899, test_f1: 0.2664
 epoch: 8, train_loss: 1.2912, test_loss: 1.2845, test_f1: 0.2728
 epoch: 9, train_loss: 1.2853, test_loss: 1.2788, test_f1: 0.2782
 epoch: 10, train_loss: 1.2820, test_loss: 1.2707, test_f1: 0.3017
 epoch: 11, train_loss: 1.2776, test_loss: 1.2687, test_f1: 0.2999
 epoch: 12, train_loss: 1.2727, test_loss: 1.2621, test_f1: 0.3027
 epoch: 13, train_loss: 1.2674, test_loss: 1.2543, test_f1: 0.3111
 epoch: 14, train_loss: 1.2645, test_loss: 1.2510, test_f1: 0.3029
 epoch: 15, train_loss: 1.2594, test_loss: 1.2498, test_f1: 0.3190
 epoch: 16, train_loss: 1.2544, test_loss: 1.2436, test_f1: 0.3222
 epoch: 17, train_loss: 1.2495, test_loss: 1.2349, test_f1: 0.3318
 epoch: 18, train_loss: 1.2409, test_loss: 1.2278, test_f1: 0.3344
 epoch: 19, train_loss: 1.2443, test_loss: 1.2235, test_f1: 0.3323
 epoch: 20, train_loss: 1.2377, test_loss: 1.2209, test_f1: 0.3343
 epoch: 21, train_loss: 1.2344, test_loss: 1.2189, test_f1: 0.3382
 epoch: 22, train_loss: 1.2335, test_loss: 1.2137, test_f1: 0.3337
 epoch: 23, train_loss: 1.2312, test_loss: 1.2101, test_f1: 0.3320
 epoch: 24, train_loss: 1.2268, test_loss: 1.2044, test_f1: 0.3294
 epoch: 25, train_loss: 1.2235, test_loss: 1.2030, test_f1: 0.3400
 epoch: 26, train_loss: 1.2189, test_loss: 1.1999, test_f1: 0.3367
 epoch: 27, train_loss: 1.2194, test_loss: 1.1977, test_f1: 0.3443
 epoch: 28, train_loss: 1.2141, test_loss: 1.1960, test_f1: 0.3431
 epoch: 29, train_loss: 1.2113, test_loss: 1.1926, test_f1: 0.3427
 epoch: 30, train_loss: 1.2078, test_loss: 1.1933, test_f1: 0.3446
 epoch: 31, train_loss: 1.2080, test_loss: 1.1891, test_f1: 0.3459
 epoch: 32, train_loss: 1.2018, test_loss: 1.1871, test_f1: 0.3546
 epoch: 33, train_loss: 1.1955, test_loss: 1.1860, test_f1: 0.3578
 epoch: 34, train_loss: 1.2046, test_loss: 1.1843, test_f1: 0.3545
 epoch: 35, train_loss: 1.1989, test_loss: 1.1802, test_f1: 0.3516
 epoch: 36, train_loss: 1.1970, test_loss: 1.1777, test_f1: 0.3536
 epoch: 37, train_loss: 1.1897, test_loss: 1.1767, test_f1: 0.3585
 epoch: 38, train_loss: 1.1898, test_loss: 1.1760, test_f1: 0.3577
 epoch: 39, train_loss: 1.1885, test_loss: 1.1732, test_f1: 0.3589
 epoch: 40, train_loss: 1.1798, test_loss: 1.1704, test_f1: 0.3650
 epoch: 41, train_loss: 1.1867, test_loss: 1.1718, test_f1: 0.3704
 epoch: 42, train_loss: 1.1803, test_loss: 1.1712, test_f1: 0.3689
 epoch: 43, train_loss: 1.1774, test_loss: 1.1650, test_f1: 0.3656
 epoch: 44, train_loss: 1.1762, test_loss: 1.1637, test_f1: 0.3730
 epoch: 45, train_loss: 1.1643, test_loss: 1.1621, test_f1: 0.3749
 epoch: 46, train_loss: 1.1679, test_loss: 1.1602, test_f1: 0.3663
 epoch: 47, train_loss: 1.1679, test_loss: 1.1615, test_f1: 0.3693
 epoch: 48, train_loss: 1.1697, test_loss: 1.1589, test_f1: 0.3651
 epoch: 49, train_loss: 1.1646, test_loss: 1.1597, test_f1: 0.3611
 epoch: 50, train_loss: 1.1593, test_loss: 1.1581, test_f1: 0.3668
 epoch: 51, train_loss: 1.1561, test_loss: 1.1576, test_f1: 0.3667
 epoch: 52, train_loss: 1.1589, test_loss: 1.1562, test_f1: 0.3744
 epoch: 53, train_loss: 1.1564, test_loss: 1.1542, test_f1: 0.3789
 epoch: 54, train_loss: 1.1526, test_loss: 1.1546, test_f1: 0.3711
 epoch: 55, train_loss: 1.1537, test_loss: 1.1539, test_f1: 0.3711
 epoch: 56, train_loss: 1.1551, test_loss: 1.1540, test_f1: 0.3721
 epoch: 57, train_loss: 1.1512, test_loss: 1.1521, test_f1: 0.3695
 epoch: 58, train_loss: 1.1455, test_loss: 1.1510, test_f1: 0.3710
 epoch: 59, train_loss: 1.1495, test_loss: 1.1510, test_f1: 0.3765
 epoch: 60, train_loss: 1.1543, test_loss: 1.1527, test_f1: 0.3762
 epoch: 61, train_loss: 1.1493, test_loss: 1.1502, test_f1: 0.3713
 epoch: 62, train_loss: 1.1426, test_loss: 1.1492, test_f1: 0.3694
 epoch: 63, train_loss: 1.1395, test_loss: 1.1468, test_f1: 0.3767
 epoch: 64, train_loss: 1.1408, test_loss: 1.1489, test_f1: 0.3746
 epoch: 65, train_loss: 1.1390, test_loss: 1.1444, test_f1: 0.3783
 epoch: 66, train_loss: 1.1404, test_loss: 1.1470, test_f1: 0.3729
 epoch: 67, train_loss: 1.1368, test_loss: 1.1433, test_f1: 0.3745
 epoch: 68, train_loss: 1.1350, test_loss: 1.1432, test_f1: 0.3726
 epoch: 69, train_loss: 1.1342, test_loss: 1.1430, test_f1: 0.3703
 epoch: 70, train_loss: 1.1322, test_loss: 1.1425, test_f1: 0.3728
 epoch: 71, train_loss: 1.1349, test_loss: 1.1391, test_f1: 0.3718
 epoch: 72, train_loss: 1.1299, test_loss: 1.1403, test_f1: 0.3739
 epoch: 73, train_loss: 1.1352, test_loss: 1.1429, test_f1: 0.3743
 epoch: 74, train_loss: 1.1262, test_loss: 1.1420, test_f1: 0.3767
 epoch: 75, train_loss: 1.1249, test_loss: 1.1410, test_f1: 0.3715
 epoch: 76, train_loss: 1.1252, test_loss: 1.1407, test_f1: 0.3692
 epoch: 77, train_loss: 1.1322, test_loss: 1.1410, test_f1: 0.3682
 epoch: 78, train_loss: 1.1237, test_loss: 1.1427, test_f1: 0.3679
 epoch: 79, train_loss: 1.1297, test_loss: 1.1393, test_f1: 0.3716
 epoch: 80, train_loss: 1.1293, test_loss: 1.1388, test_f1: 0.3695
 epoch: 81, train_loss: 1.1215, test_loss: 1.1372, test_f1: 0.3741
 epoch: 82, train_loss: 1.1218, test_loss: 1.1341, test_f1: 0.3784
 epoch: 83, train_loss: 1.1212, test_loss: 1.1354, test_f1: 0.3762
 epoch: 84, train_loss: 1.1227, test_loss: 1.1368, test_f1: 0.3684
 epoch: 85, train_loss: 1.1173, test_loss: 1.1374, test_f1: 0.3697
 epoch: 86, train_loss: 1.1142, test_loss: 1.1330, test_f1: 0.3699
 epoch: 87, train_loss: 1.1153, test_loss: 1.1345, test_f1: 0.3724
 epoch: 88, train_loss: 1.1071, test_loss: 1.1350, test_f1: 0.3666
 epoch: 89, train_loss: 1.1136, test_loss: 1.1352, test_f1: 0.3666
 epoch: 90, train_loss: 1.1177, test_loss: 1.1366, test_f1: 0.3666
 epoch: 91, train_loss: 1.1149, test_loss: 1.1335, test_f1: 0.3702
 epoch: 92, train_loss: 1.1095, test_loss: 1.1328, test_f1: 0.3712
 epoch: 93, train_loss: 1.1090, test_loss: 1.1251, test_f1: 0.3725
 epoch: 94, train_loss: 1.1062, test_loss: 1.1266, test_f1: 0.3718
 epoch: 95, train_loss: 1.1081, test_loss: 1.1268, test_f1: 0.3749
 epoch: 96, train_loss: 1.1085, test_loss: 1.1313, test_f1: 0.3802
 epoch: 97, train_loss: 1.1043, test_loss: 1.1289, test_f1: 0.3759
 epoch: 98, train_loss: 1.1124, test_loss: 1.1298, test_f1: 0.3924
 epoch: 99, train_loss: 1.0993, test_loss: 1.1313, test_f1: 0.3813
##################ITERATION #4 ****************************************
 epoch: 0, train_loss: 1.3139, test_loss: 1.3578, test_f1: 0.2274
 epoch: 1, train_loss: 1.3019, test_loss: 1.3397, test_f1: 0.2274
 epoch: 2, train_loss: 1.2949, test_loss: 1.3218, test_f1: 0.2274
 epoch: 3, train_loss: 1.2876, test_loss: 1.3015, test_f1: 0.2390
 epoch: 4, train_loss: 1.2796, test_loss: 1.2835, test_f1: 0.2499
 epoch: 5, train_loss: 1.2724, test_loss: 1.2710, test_f1: 0.2855
 epoch: 6, train_loss: 1.2698, test_loss: 1.2616, test_f1: 0.2952
 epoch: 7, train_loss: 1.2607, test_loss: 1.2544, test_f1: 0.3054
 epoch: 8, train_loss: 1.2572, test_loss: 1.2477, test_f1: 0.3047
 epoch: 9, train_loss: 1.2510, test_loss: 1.2417, test_f1: 0.3095
 epoch: 10, train_loss: 1.2490, test_loss: 1.2369, test_f1: 0.3232
 epoch: 11, train_loss: 1.2475, test_loss: 1.2338, test_f1: 0.3046
 epoch: 12, train_loss: 1.2389, test_loss: 1.2290, test_f1: 0.3063
 epoch: 13, train_loss: 1.2335, test_loss: 1.2268, test_f1: 0.3070
 epoch: 14, train_loss: 1.2265, test_loss: 1.2184, test_f1: 0.3231
 epoch: 15, train_loss: 1.2276, test_loss: 1.2141, test_f1: 0.3172
 epoch: 16, train_loss: 1.2271, test_loss: 1.2109, test_f1: 0.3160
 epoch: 17, train_loss: 1.2219, test_loss: 1.2075, test_f1: 0.3151
 epoch: 18, train_loss: 1.2168, test_loss: 1.2046, test_f1: 0.3232
 epoch: 19, train_loss: 1.2186, test_loss: 1.2027, test_f1: 0.3309
 epoch: 20, train_loss: 1.2119, test_loss: 1.1988, test_f1: 0.3326
 epoch: 21, train_loss: 1.2112, test_loss: 1.1965, test_f1: 0.3390
 epoch: 22, train_loss: 1.2026, test_loss: 1.1955, test_f1: 0.3409
 epoch: 23, train_loss: 1.2063, test_loss: 1.1929, test_f1: 0.3312
 epoch: 24, train_loss: 1.1988, test_loss: 1.1945, test_f1: 0.3142
 epoch: 25, train_loss: 1.2008, test_loss: 1.1921, test_f1: 0.3320
 epoch: 26, train_loss: 1.1937, test_loss: 1.1900, test_f1: 0.3391
 epoch: 27, train_loss: 1.1886, test_loss: 1.1841, test_f1: 0.3405
 epoch: 28, train_loss: 1.1885, test_loss: 1.1814, test_f1: 0.3373
 epoch: 29, train_loss: 1.1879, test_loss: 1.1821, test_f1: 0.3404
 epoch: 30, train_loss: 1.1845, test_loss: 1.1783, test_f1: 0.3413
 epoch: 31, train_loss: 1.1811, test_loss: 1.1760, test_f1: 0.3474
 epoch: 32, train_loss: 1.1712, test_loss: 1.1769, test_f1: 0.3413
 epoch: 33, train_loss: 1.1750, test_loss: 1.1747, test_f1: 0.3424
 epoch: 34, train_loss: 1.1739, test_loss: 1.1722, test_f1: 0.3423
 epoch: 35, train_loss: 1.1737, test_loss: 1.1702, test_f1: 0.3455
 epoch: 36, train_loss: 1.1632, test_loss: 1.1701, test_f1: 0.3449
 epoch: 37, train_loss: 1.1623, test_loss: 1.1682, test_f1: 0.3483
 epoch: 38, train_loss: 1.1616, test_loss: 1.1664, test_f1: 0.3499
 epoch: 39, train_loss: 1.1563, test_loss: 1.1643, test_f1: 0.3460
 epoch: 40, train_loss: 1.1562, test_loss: 1.1634, test_f1: 0.3647
 epoch: 41, train_loss: 1.1471, test_loss: 1.1630, test_f1: 0.3630
 epoch: 42, train_loss: 1.1495, test_loss: 1.1642, test_f1: 0.3591
 epoch: 43, train_loss: 1.1438, test_loss: 1.1648, test_f1: 0.3652
 epoch: 44, train_loss: 1.1396, test_loss: 1.1661, test_f1: 0.3642
 epoch: 45, train_loss: 1.1367, test_loss: 1.1621, test_f1: 0.3719
 epoch: 46, train_loss: 1.1341, test_loss: 1.1609, test_f1: 0.3743
 epoch: 47, train_loss: 1.1369, test_loss: 1.1584, test_f1: 0.3653
 epoch: 48, train_loss: 1.1331, test_loss: 1.1612, test_f1: 0.3569
 epoch: 49, train_loss: 1.1237, test_loss: 1.1608, test_f1: 0.3867
 epoch: 50, train_loss: 1.1256, test_loss: 1.1610, test_f1: 0.3830
 epoch: 51, train_loss: 1.1166, test_loss: 1.1606, test_f1: 0.3916
 epoch: 52, train_loss: 1.1164, test_loss: 1.1599, test_f1: 0.3897
 epoch: 53, train_loss: 1.1177, test_loss: 1.1570, test_f1: 0.4118
 epoch: 54, train_loss: 1.1187, test_loss: 1.1566, test_f1: 0.4120
 epoch: 55, train_loss: 1.1185, test_loss: 1.1592, test_f1: 0.4217
 epoch: 56, train_loss: 1.1243, test_loss: 1.1564, test_f1: 0.4253
 epoch: 57, train_loss: 1.1125, test_loss: 1.1533, test_f1: 0.4313
 epoch: 58, train_loss: 1.1138, test_loss: 1.1548, test_f1: 0.4331
 epoch: 59, train_loss: 1.1089, test_loss: 1.1530, test_f1: 0.4340
 epoch: 60, train_loss: 1.1139, test_loss: 1.1547, test_f1: 0.4362
 epoch: 61, train_loss: 1.1080, test_loss: 1.1561, test_f1: 0.4418
 epoch: 62, train_loss: 1.1045, test_loss: 1.1559, test_f1: 0.4441
 epoch: 63, train_loss: 1.1074, test_loss: 1.1572, test_f1: 0.4436
 epoch: 64, train_loss: 1.1150, test_loss: 1.1520, test_f1: 0.4415
 epoch: 65, train_loss: 1.1055, test_loss: 1.1506, test_f1: 0.4472
 epoch: 66, train_loss: 1.1089, test_loss: 1.1565, test_f1: 0.4485
 epoch: 67, train_loss: 1.1050, test_loss: 1.1544, test_f1: 0.4466
 epoch: 68, train_loss: 1.1025, test_loss: 1.1554, test_f1: 0.4487
 epoch: 69, train_loss: 1.0968, test_loss: 1.1559, test_f1: 0.4499
 epoch: 70, train_loss: 1.1018, test_loss: 1.1571, test_f1: 0.4508
 epoch: 71, train_loss: 1.0964, test_loss: 1.1505, test_f1: 0.4490
 epoch: 72, train_loss: 1.0941, test_loss: 1.1502, test_f1: 0.4472
 epoch: 73, train_loss: 1.0895, test_loss: 1.1496, test_f1: 0.4506
 epoch: 74, train_loss: 1.0929, test_loss: 1.1503, test_f1: 0.4527
 epoch: 75, train_loss: 1.0953, test_loss: 1.1520, test_f1: 0.4561
 epoch: 76, train_loss: 1.0909, test_loss: 1.1534, test_f1: 0.4599
 epoch: 77, train_loss: 1.0945, test_loss: 1.1510, test_f1: 0.4560
 epoch: 78, train_loss: 1.0847, test_loss: 1.1534, test_f1: 0.4517
 epoch: 79, train_loss: 1.0908, test_loss: 1.1525, test_f1: 0.4584
 epoch: 80, train_loss: 1.0969, test_loss: 1.1484, test_f1: 0.4678
 epoch: 81, train_loss: 1.0920, test_loss: 1.1532, test_f1: 0.4691
 epoch: 82, train_loss: 1.0911, test_loss: 1.1492, test_f1: 0.4619
 epoch: 83, train_loss: 1.0888, test_loss: 1.1477, test_f1: 0.4691
 epoch: 84, train_loss: 1.0866, test_loss: 1.1491, test_f1: 0.4642
 epoch: 85, train_loss: 1.0821, test_loss: 1.1526, test_f1: 0.4712
 epoch: 86, train_loss: 1.0737, test_loss: 1.1505, test_f1: 0.4680
 epoch: 87, train_loss: 1.0804, test_loss: 1.1493, test_f1: 0.4684
 epoch: 88, train_loss: 1.0783, test_loss: 1.1476, test_f1: 0.4699
 epoch: 89, train_loss: 1.0795, test_loss: 1.1504, test_f1: 0.4695
 epoch: 90, train_loss: 1.0774, test_loss: 1.1452, test_f1: 0.4648
 epoch: 91, train_loss: 1.0756, test_loss: 1.1521, test_f1: 0.4747
 epoch: 92, train_loss: 1.0781, test_loss: 1.1518, test_f1: 0.4763
 epoch: 93, train_loss: 1.0741, test_loss: 1.1491, test_f1: 0.4697
 epoch: 94, train_loss: 1.0718, test_loss: 1.1490, test_f1: 0.4749
 epoch: 95, train_loss: 1.0742, test_loss: 1.1506, test_f1: 0.4709
 epoch: 96, train_loss: 1.0730, test_loss: 1.1559, test_f1: 0.4673
 epoch: 97, train_loss: 1.0618, test_loss: 1.1469, test_f1: 0.4832
 epoch: 98, train_loss: 1.0682, test_loss: 1.1458, test_f1: 0.4793
 epoch: 99, train_loss: 1.0686, test_loss: 1.1525, test_f1: 0.4733
##################ITERATION #5 ****************************************
 epoch: 0, train_loss: 1.3093, test_loss: 1.3324, test_f1: 0.2274
 epoch: 1, train_loss: 1.2924, test_loss: 1.3242, test_f1: 0.2274
 epoch: 2, train_loss: 1.2858, test_loss: 1.3111, test_f1: 0.2274
 epoch: 3, train_loss: 1.2776, test_loss: 1.2910, test_f1: 0.2274
 epoch: 4, train_loss: 1.2725, test_loss: 1.2700, test_f1: 0.2656
 epoch: 5, train_loss: 1.2647, test_loss: 1.2553, test_f1: 0.2787
 epoch: 6, train_loss: 1.2580, test_loss: 1.2445, test_f1: 0.2930
 epoch: 7, train_loss: 1.2558, test_loss: 1.2353, test_f1: 0.3088
 epoch: 8, train_loss: 1.2512, test_loss: 1.2290, test_f1: 0.3111
 epoch: 9, train_loss: 1.2441, test_loss: 1.2234, test_f1: 0.3164
 epoch: 10, train_loss: 1.2386, test_loss: 1.2151, test_f1: 0.3275
 epoch: 11, train_loss: 1.2312, test_loss: 1.2111, test_f1: 0.3315
 epoch: 12, train_loss: 1.2275, test_loss: 1.2060, test_f1: 0.3294
 epoch: 13, train_loss: 1.2258, test_loss: 1.2000, test_f1: 0.3441
 epoch: 14, train_loss: 1.2226, test_loss: 1.1963, test_f1: 0.3436
 epoch: 15, train_loss: 1.2134, test_loss: 1.1953, test_f1: 0.3456
 epoch: 16, train_loss: 1.2105, test_loss: 1.1886, test_f1: 0.3408
 epoch: 17, train_loss: 1.2076, test_loss: 1.1862, test_f1: 0.3481
 epoch: 18, train_loss: 1.2031, test_loss: 1.1827, test_f1: 0.3465
 epoch: 19, train_loss: 1.2018, test_loss: 1.1809, test_f1: 0.3494
 epoch: 20, train_loss: 1.2023, test_loss: 1.1753, test_f1: 0.3529
 epoch: 21, train_loss: 1.2000, test_loss: 1.1716, test_f1: 0.3499
 epoch: 22, train_loss: 1.1913, test_loss: 1.1686, test_f1: 0.3560
 epoch: 23, train_loss: 1.1848, test_loss: 1.1684, test_f1: 0.3512
 epoch: 24, train_loss: 1.1825, test_loss: 1.1654, test_f1: 0.3491
 epoch: 25, train_loss: 1.1863, test_loss: 1.1608, test_f1: 0.3534
 epoch: 26, train_loss: 1.1807, test_loss: 1.1581, test_f1: 0.3590
 epoch: 27, train_loss: 1.1810, test_loss: 1.1564, test_f1: 0.3608
 epoch: 28, train_loss: 1.1746, test_loss: 1.1542, test_f1: 0.3502
 epoch: 29, train_loss: 1.1793, test_loss: 1.1537, test_f1: 0.3593
 epoch: 30, train_loss: 1.1734, test_loss: 1.1532, test_f1: 0.3562
 epoch: 31, train_loss: 1.1784, test_loss: 1.1495, test_f1: 0.3562
 epoch: 32, train_loss: 1.1680, test_loss: 1.1487, test_f1: 0.3570
 epoch: 33, train_loss: 1.1707, test_loss: 1.1455, test_f1: 0.3547
 epoch: 34, train_loss: 1.1627, test_loss: 1.1447, test_f1: 0.3559
 epoch: 35, train_loss: 1.1621, test_loss: 1.1425, test_f1: 0.3574
 epoch: 36, train_loss: 1.1573, test_loss: 1.1413, test_f1: 0.3576
 epoch: 37, train_loss: 1.1574, test_loss: 1.1376, test_f1: 0.3597
 epoch: 38, train_loss: 1.1652, test_loss: 1.1368, test_f1: 0.3527
 epoch: 39, train_loss: 1.1557, test_loss: 1.1345, test_f1: 0.3542
 epoch: 40, train_loss: 1.1455, test_loss: 1.1323, test_f1: 0.3537
 epoch: 41, train_loss: 1.1566, test_loss: 1.1298, test_f1: 0.3595
 epoch: 42, train_loss: 1.1464, test_loss: 1.1288, test_f1: 0.3595
 epoch: 43, train_loss: 1.1475, test_loss: 1.1279, test_f1: 0.3563
 epoch: 44, train_loss: 1.1427, test_loss: 1.1264, test_f1: 0.3569
 epoch: 45, train_loss: 1.1450, test_loss: 1.1266, test_f1: 0.3543
 epoch: 46, train_loss: 1.1355, test_loss: 1.1244, test_f1: 0.3511
 epoch: 47, train_loss: 1.1420, test_loss: 1.1225, test_f1: 0.3553
 epoch: 48, train_loss: 1.1321, test_loss: 1.1221, test_f1: 0.3588
 epoch: 49, train_loss: 1.1368, test_loss: 1.1220, test_f1: 0.3615
 epoch: 50, train_loss: 1.1353, test_loss: 1.1214, test_f1: 0.3631
 epoch: 51, train_loss: 1.1287, test_loss: 1.1210, test_f1: 0.3619
 epoch: 52, train_loss: 1.1233, test_loss: 1.1187, test_f1: 0.3593
 epoch: 53, train_loss: 1.1287, test_loss: 1.1176, test_f1: 0.3636
 epoch: 54, train_loss: 1.1308, test_loss: 1.1167, test_f1: 0.3698
 epoch: 55, train_loss: 1.1219, test_loss: 1.1166, test_f1: 0.3700
 epoch: 56, train_loss: 1.1115, test_loss: 1.1163, test_f1: 0.3712
 epoch: 57, train_loss: 1.1243, test_loss: 1.1161, test_f1: 0.3820
 epoch: 58, train_loss: 1.1249, test_loss: 1.1162, test_f1: 0.3855
 epoch: 59, train_loss: 1.1149, test_loss: 1.1139, test_f1: 0.3938
 epoch: 60, train_loss: 1.1179, test_loss: 1.1134, test_f1: 0.3946
 epoch: 61, train_loss: 1.1133, test_loss: 1.1129, test_f1: 0.3969
 epoch: 62, train_loss: 1.1193, test_loss: 1.1131, test_f1: 0.3946
 epoch: 63, train_loss: 1.1255, test_loss: 1.1140, test_f1: 0.3998
 epoch: 64, train_loss: 1.1136, test_loss: 1.1127, test_f1: 0.4025
 epoch: 65, train_loss: 1.1059, test_loss: 1.1126, test_f1: 0.4043
 epoch: 66, train_loss: 1.1122, test_loss: 1.1129, test_f1: 0.4097
 epoch: 67, train_loss: 1.1172, test_loss: 1.1136, test_f1: 0.3997
 epoch: 68, train_loss: 1.1114, test_loss: 1.1119, test_f1: 0.4076
 epoch: 69, train_loss: 1.1039, test_loss: 1.1132, test_f1: 0.4068
 epoch: 70, train_loss: 1.1055, test_loss: 1.1123, test_f1: 0.4168
 epoch: 71, train_loss: 1.1032, test_loss: 1.1122, test_f1: 0.4142
 epoch: 72, train_loss: 1.1102, test_loss: 1.1108, test_f1: 0.4115
 epoch: 73, train_loss: 1.1044, test_loss: 1.1109, test_f1: 0.4107
 epoch: 74, train_loss: 1.1124, test_loss: 1.1113, test_f1: 0.4143
 epoch: 75, train_loss: 1.1018, test_loss: 1.1124, test_f1: 0.4145
 epoch: 76, train_loss: 1.1051, test_loss: 1.1085, test_f1: 0.4089
 epoch: 77, train_loss: 1.0994, test_loss: 1.1086, test_f1: 0.4110
 epoch: 78, train_loss: 1.0976, test_loss: 1.1096, test_f1: 0.4100
 epoch: 79, train_loss: 1.1024, test_loss: 1.1075, test_f1: 0.4071
 epoch: 80, train_loss: 1.0972, test_loss: 1.1088, test_f1: 0.4085
 epoch: 81, train_loss: 1.0959, test_loss: 1.1063, test_f1: 0.4122
 epoch: 82, train_loss: 1.0937, test_loss: 1.1051, test_f1: 0.4123
 epoch: 83, train_loss: 1.0976, test_loss: 1.1048, test_f1: 0.4133
 epoch: 84, train_loss: 1.0953, test_loss: 1.1038, test_f1: 0.4181
 epoch: 85, train_loss: 1.0878, test_loss: 1.1040, test_f1: 0.4193
 epoch: 86, train_loss: 1.0907, test_loss: 1.1037, test_f1: 0.4159
 epoch: 87, train_loss: 1.0956, test_loss: 1.1027, test_f1: 0.4227
 epoch: 88, train_loss: 1.0977, test_loss: 1.1032, test_f1: 0.4240
 epoch: 89, train_loss: 1.0849, test_loss: 1.1031, test_f1: 0.4191
 epoch: 90, train_loss: 1.0850, test_loss: 1.1027, test_f1: 0.4184
 epoch: 91, train_loss: 1.0901, test_loss: 1.1026, test_f1: 0.4170
 epoch: 92, train_loss: 1.0848, test_loss: 1.1026, test_f1: 0.4175
 epoch: 93, train_loss: 1.0810, test_loss: 1.1037, test_f1: 0.4152
 epoch: 94, train_loss: 1.0774, test_loss: 1.1028, test_f1: 0.4207
 epoch: 95, train_loss: 1.0891, test_loss: 1.1031, test_f1: 0.4184
 epoch: 96, train_loss: 1.0881, test_loss: 1.1027, test_f1: 0.4295
 epoch: 97, train_loss: 1.0770, test_loss: 1.1024, test_f1: 0.4190
 epoch: 98, train_loss: 1.0859, test_loss: 1.0987, test_f1: 0.4228
 epoch: 99, train_loss: 1.0782, test_loss: 1.1020, test_f1: 0.4184
##################ITERATION #6 ****************************************
 epoch: 0, train_loss: 1.3434, test_loss: 1.3692, test_f1: 0.2274
 epoch: 1, train_loss: 1.3225, test_loss: 1.3521, test_f1: 0.2274
 epoch: 2, train_loss: 1.3149, test_loss: 1.3403, test_f1: 0.2274
 epoch: 3, train_loss: 1.3071, test_loss: 1.3375, test_f1: 0.2274
 epoch: 4, train_loss: 1.2969, test_loss: 1.3150, test_f1: 0.2274
 epoch: 5, train_loss: 1.2884, test_loss: 1.2985, test_f1: 0.2428
 epoch: 6, train_loss: 1.2793, test_loss: 1.2810, test_f1: 0.2747
 epoch: 7, train_loss: 1.2753, test_loss: 1.2697, test_f1: 0.2833
 epoch: 8, train_loss: 1.2653, test_loss: 1.2601, test_f1: 0.2943
 epoch: 9, train_loss: 1.2589, test_loss: 1.2517, test_f1: 0.2998
 epoch: 10, train_loss: 1.2571, test_loss: 1.2461, test_f1: 0.3026
 epoch: 11, train_loss: 1.2534, test_loss: 1.2415, test_f1: 0.3075
 epoch: 12, train_loss: 1.2484, test_loss: 1.2370, test_f1: 0.3148
 epoch: 13, train_loss: 1.2417, test_loss: 1.2318, test_f1: 0.3137
 epoch: 14, train_loss: 1.2400, test_loss: 1.2266, test_f1: 0.3230
 epoch: 15, train_loss: 1.2370, test_loss: 1.2250, test_f1: 0.3384
 epoch: 16, train_loss: 1.2274, test_loss: 1.2199, test_f1: 0.3377
 epoch: 17, train_loss: 1.2265, test_loss: 1.2160, test_f1: 0.3282
 epoch: 18, train_loss: 1.2141, test_loss: 1.2118, test_f1: 0.3236
 epoch: 19, train_loss: 1.2199, test_loss: 1.2066, test_f1: 0.3370
 epoch: 20, train_loss: 1.2191, test_loss: 1.2043, test_f1: 0.3362
 epoch: 21, train_loss: 1.2101, test_loss: 1.2018, test_f1: 0.3471
 epoch: 22, train_loss: 1.2022, test_loss: 1.1995, test_f1: 0.3492
 epoch: 23, train_loss: 1.2082, test_loss: 1.1956, test_f1: 0.3509
 epoch: 24, train_loss: 1.1990, test_loss: 1.1932, test_f1: 0.3510
 epoch: 25, train_loss: 1.1938, test_loss: 1.1917, test_f1: 0.3561
 epoch: 26, train_loss: 1.1997, test_loss: 1.1894, test_f1: 0.3579
 epoch: 27, train_loss: 1.1893, test_loss: 1.1874, test_f1: 0.3544
 epoch: 28, train_loss: 1.1906, test_loss: 1.1848, test_f1: 0.3606
 epoch: 29, train_loss: 1.1931, test_loss: 1.1816, test_f1: 0.3608
 epoch: 30, train_loss: 1.1839, test_loss: 1.1792, test_f1: 0.3687
 epoch: 31, train_loss: 1.1812, test_loss: 1.1783, test_f1: 0.3596
 epoch: 32, train_loss: 1.1830, test_loss: 1.1780, test_f1: 0.3590
 epoch: 33, train_loss: 1.1816, test_loss: 1.1779, test_f1: 0.3612
 epoch: 34, train_loss: 1.1746, test_loss: 1.1764, test_f1: 0.3675
 epoch: 35, train_loss: 1.1754, test_loss: 1.1748, test_f1: 0.3725
 epoch: 36, train_loss: 1.1647, test_loss: 1.1700, test_f1: 0.3629
 epoch: 37, train_loss: 1.1681, test_loss: 1.1678, test_f1: 0.3697
 epoch: 38, train_loss: 1.1725, test_loss: 1.1680, test_f1: 0.3762
 epoch: 39, train_loss: 1.1690, test_loss: 1.1661, test_f1: 0.3758
 epoch: 40, train_loss: 1.1657, test_loss: 1.1639, test_f1: 0.3689
 epoch: 41, train_loss: 1.1605, test_loss: 1.1625, test_f1: 0.3792
 epoch: 42, train_loss: 1.1556, test_loss: 1.1623, test_f1: 0.3787
 epoch: 43, train_loss: 1.1555, test_loss: 1.1607, test_f1: 0.3809
 epoch: 44, train_loss: 1.1538, test_loss: 1.1600, test_f1: 0.3858
 epoch: 45, train_loss: 1.1553, test_loss: 1.1551, test_f1: 0.3916
 epoch: 46, train_loss: 1.1566, test_loss: 1.1585, test_f1: 0.3941
 epoch: 47, train_loss: 1.1491, test_loss: 1.1577, test_f1: 0.4160
 epoch: 48, train_loss: 1.1386, test_loss: 1.1576, test_f1: 0.4130
 epoch: 49, train_loss: 1.1445, test_loss: 1.1554, test_f1: 0.4145
 epoch: 50, train_loss: 1.1392, test_loss: 1.1567, test_f1: 0.4288
 epoch: 51, train_loss: 1.1425, test_loss: 1.1556, test_f1: 0.4308
 epoch: 52, train_loss: 1.1363, test_loss: 1.1570, test_f1: 0.4342
 epoch: 53, train_loss: 1.1402, test_loss: 1.1575, test_f1: 0.4208
 epoch: 54, train_loss: 1.1429, test_loss: 1.1571, test_f1: 0.4291
 epoch: 55, train_loss: 1.1327, test_loss: 1.1583, test_f1: 0.4174
 epoch: 56, train_loss: 1.1284, test_loss: 1.1591, test_f1: 0.4299
 epoch: 57, train_loss: 1.1294, test_loss: 1.1580, test_f1: 0.4363
 epoch: 58, train_loss: 1.1345, test_loss: 1.1597, test_f1: 0.4384
 epoch: 59, train_loss: 1.1290, test_loss: 1.1587, test_f1: 0.4528
 epoch: 60, train_loss: 1.1271, test_loss: 1.1603, test_f1: 0.4468
 epoch: 61, train_loss: 1.1290, test_loss: 1.1585, test_f1: 0.4528
 epoch: 62, train_loss: 1.1343, test_loss: 1.1589, test_f1: 0.4321
 epoch: 63, train_loss: 1.1250, test_loss: 1.1591, test_f1: 0.4393
 epoch: 64, train_loss: 1.1247, test_loss: 1.1550, test_f1: 0.4607
 epoch: 65, train_loss: 1.1171, test_loss: 1.1568, test_f1: 0.4581
 epoch: 66, train_loss: 1.1270, test_loss: 1.1586, test_f1: 0.4557
 epoch: 67, train_loss: 1.1258, test_loss: 1.1571, test_f1: 0.4520
 epoch: 68, train_loss: 1.1246, test_loss: 1.1587, test_f1: 0.4515
 epoch: 69, train_loss: 1.1191, test_loss: 1.1570, test_f1: 0.4525
 epoch: 70, train_loss: 1.1272, test_loss: 1.1608, test_f1: 0.4494
 epoch: 71, train_loss: 1.1207, test_loss: 1.1626, test_f1: 0.4441
 epoch: 72, train_loss: 1.1197, test_loss: 1.1613, test_f1: 0.4459
 epoch: 73, train_loss: 1.1102, test_loss: 1.1607, test_f1: 0.4263
 epoch: 74, train_loss: 1.1073, test_loss: 1.1596, test_f1: 0.4461
 epoch: 75, train_loss: 1.1131, test_loss: 1.1603, test_f1: 0.4480
 epoch: 76, train_loss: 1.1068, test_loss: 1.1630, test_f1: 0.4401
 epoch: 77, train_loss: 1.1143, test_loss: 1.1617, test_f1: 0.4726
 epoch: 78, train_loss: 1.1132, test_loss: 1.1595, test_f1: 0.4648
 epoch: 79, train_loss: 1.1148, test_loss: 1.1627, test_f1: 0.4607
 epoch: 80, train_loss: 1.1045, test_loss: 1.1636, test_f1: 0.4621
 epoch: 81, train_loss: 1.1009, test_loss: 1.1627, test_f1: 0.4416
 epoch: 82, train_loss: 1.1075, test_loss: 1.1623, test_f1: 0.4321
 epoch: 83, train_loss: 1.1095, test_loss: 1.1598, test_f1: 0.4452
 epoch: 84, train_loss: 1.1079, test_loss: 1.1622, test_f1: 0.4229
 epoch: 85, train_loss: 1.1073, test_loss: 1.1638, test_f1: 0.4296
 epoch: 86, train_loss: 1.1009, test_loss: 1.1627, test_f1: 0.4379
 epoch: 87, train_loss: 1.1047, test_loss: 1.1640, test_f1: 0.4243
 epoch: 88, train_loss: 1.1039, test_loss: 1.1642, test_f1: 0.4282
 epoch: 89, train_loss: 1.1069, test_loss: 1.1611, test_f1: 0.4465
 epoch: 90, train_loss: 1.0989, test_loss: 1.1615, test_f1: 0.4326
 epoch: 91, train_loss: 1.1047, test_loss: 1.1629, test_f1: 0.4313
 epoch: 92, train_loss: 1.0952, test_loss: 1.1660, test_f1: 0.4292
 epoch: 93, train_loss: 1.0991, test_loss: 1.1638, test_f1: 0.4270
 epoch: 94, train_loss: 1.0903, test_loss: 1.1633, test_f1: 0.4343
 epoch: 95, train_loss: 1.0968, test_loss: 1.1632, test_f1: 0.4312
 epoch: 96, train_loss: 1.0996, test_loss: 1.1622, test_f1: 0.4241
 epoch: 97, train_loss: 1.1023, test_loss: 1.1637, test_f1: 0.4135
 epoch: 98, train_loss: 1.0926, test_loss: 1.1612, test_f1: 0.4222
 epoch: 99, train_loss: 1.0887, test_loss: 1.1621, test_f1: 0.4225
##################ITERATION #7 ****************************************
 epoch: 0, train_loss: 1.3265, test_loss: 1.3551, test_f1: 0.2274
 epoch: 1, train_loss: 1.3040, test_loss: 1.3412, test_f1: 0.2274
 epoch: 2, train_loss: 1.2988, test_loss: 1.3239, test_f1: 0.2276
 epoch: 3, train_loss: 1.2883, test_loss: 1.3008, test_f1: 0.2393
 epoch: 4, train_loss: 1.2784, test_loss: 1.2824, test_f1: 0.2550
 epoch: 5, train_loss: 1.2717, test_loss: 1.2712, test_f1: 0.2605
 epoch: 6, train_loss: 1.2619, test_loss: 1.2613, test_f1: 0.2509
 epoch: 7, train_loss: 1.2551, test_loss: 1.2508, test_f1: 0.2657
 epoch: 8, train_loss: 1.2525, test_loss: 1.2422, test_f1: 0.2812
 epoch: 9, train_loss: 1.2385, test_loss: 1.2359, test_f1: 0.2741
 epoch: 10, train_loss: 1.2459, test_loss: 1.2313, test_f1: 0.2816
 epoch: 11, train_loss: 1.2340, test_loss: 1.2239, test_f1: 0.2843
 epoch: 12, train_loss: 1.2348, test_loss: 1.2182, test_f1: 0.2865
 epoch: 13, train_loss: 1.2325, test_loss: 1.2133, test_f1: 0.2965
 epoch: 14, train_loss: 1.2223, test_loss: 1.2118, test_f1: 0.3080
 epoch: 15, train_loss: 1.2198, test_loss: 1.2083, test_f1: 0.3166
 epoch: 16, train_loss: 1.2136, test_loss: 1.2046, test_f1: 0.3265
 epoch: 17, train_loss: 1.2143, test_loss: 1.2008, test_f1: 0.3363
 epoch: 18, train_loss: 1.2088, test_loss: 1.1961, test_f1: 0.3364
 epoch: 19, train_loss: 1.2043, test_loss: 1.1911, test_f1: 0.3440
 epoch: 20, train_loss: 1.2058, test_loss: 1.1912, test_f1: 0.3459
 epoch: 21, train_loss: 1.1985, test_loss: 1.1881, test_f1: 0.3565
 epoch: 22, train_loss: 1.1919, test_loss: 1.1846, test_f1: 0.3526
 epoch: 23, train_loss: 1.1926, test_loss: 1.1812, test_f1: 0.3559
 epoch: 24, train_loss: 1.1917, test_loss: 1.1805, test_f1: 0.3552
 epoch: 25, train_loss: 1.1864, test_loss: 1.1775, test_f1: 0.3644
 epoch: 26, train_loss: 1.1901, test_loss: 1.1740, test_f1: 0.3859
 epoch: 27, train_loss: 1.1835, test_loss: 1.1700, test_f1: 0.3787
 epoch: 28, train_loss: 1.1814, test_loss: 1.1683, test_f1: 0.3784
 epoch: 29, train_loss: 1.1779, test_loss: 1.1669, test_f1: 0.3879
 epoch: 30, train_loss: 1.1729, test_loss: 1.1650, test_f1: 0.3798
 epoch: 31, train_loss: 1.1731, test_loss: 1.1650, test_f1: 0.3847
 epoch: 32, train_loss: 1.1739, test_loss: 1.1619, test_f1: 0.3895
 epoch: 33, train_loss: 1.1645, test_loss: 1.1593, test_f1: 0.3975
 epoch: 34, train_loss: 1.1664, test_loss: 1.1565, test_f1: 0.3907
 epoch: 35, train_loss: 1.1685, test_loss: 1.1562, test_f1: 0.3905
 epoch: 36, train_loss: 1.1610, test_loss: 1.1563, test_f1: 0.3944
 epoch: 37, train_loss: 1.1559, test_loss: 1.1548, test_f1: 0.3897
 epoch: 38, train_loss: 1.1665, test_loss: 1.1517, test_f1: 0.3893
 epoch: 39, train_loss: 1.1550, test_loss: 1.1481, test_f1: 0.3855
 epoch: 40, train_loss: 1.1505, test_loss: 1.1473, test_f1: 0.3919
 epoch: 41, train_loss: 1.1547, test_loss: 1.1428, test_f1: 0.4004
 epoch: 42, train_loss: 1.1479, test_loss: 1.1462, test_f1: 0.3942
 epoch: 43, train_loss: 1.1575, test_loss: 1.1449, test_f1: 0.3837
 epoch: 44, train_loss: 1.1556, test_loss: 1.1438, test_f1: 0.3794
 epoch: 45, train_loss: 1.1437, test_loss: 1.1396, test_f1: 0.3806
 epoch: 46, train_loss: 1.1397, test_loss: 1.1398, test_f1: 0.3797
 epoch: 47, train_loss: 1.1399, test_loss: 1.1397, test_f1: 0.3838
 epoch: 48, train_loss: 1.1409, test_loss: 1.1368, test_f1: 0.4025
 epoch: 49, train_loss: 1.1321, test_loss: 1.1376, test_f1: 0.3809
 epoch: 50, train_loss: 1.1277, test_loss: 1.1321, test_f1: 0.3969
 epoch: 51, train_loss: 1.1341, test_loss: 1.1310, test_f1: 0.3777
 epoch: 52, train_loss: 1.1299, test_loss: 1.1321, test_f1: 0.3845
 epoch: 53, train_loss: 1.1271, test_loss: 1.1344, test_f1: 0.3892
 epoch: 54, train_loss: 1.1310, test_loss: 1.1329, test_f1: 0.3885
 epoch: 55, train_loss: 1.1228, test_loss: 1.1331, test_f1: 0.3931
 epoch: 56, train_loss: 1.1319, test_loss: 1.1292, test_f1: 0.4011
 epoch: 57, train_loss: 1.1283, test_loss: 1.1296, test_f1: 0.3982
 epoch: 58, train_loss: 1.1247, test_loss: 1.1283, test_f1: 0.3997
 epoch: 59, train_loss: 1.1198, test_loss: 1.1288, test_f1: 0.4049
 epoch: 60, train_loss: 1.1257, test_loss: 1.1267, test_f1: 0.4030
 epoch: 61, train_loss: 1.1229, test_loss: 1.1261, test_f1: 0.4158
 epoch: 62, train_loss: 1.1238, test_loss: 1.1259, test_f1: 0.4154
 epoch: 63, train_loss: 1.1198, test_loss: 1.1223, test_f1: 0.4182
 epoch: 64, train_loss: 1.1220, test_loss: 1.1231, test_f1: 0.4285
 epoch: 65, train_loss: 1.1118, test_loss: 1.1236, test_f1: 0.4261
 epoch: 66, train_loss: 1.1188, test_loss: 1.1226, test_f1: 0.4314
 epoch: 67, train_loss: 1.1178, test_loss: 1.1210, test_f1: 0.4358
 epoch: 68, train_loss: 1.1207, test_loss: 1.1218, test_f1: 0.4305
 epoch: 69, train_loss: 1.1068, test_loss: 1.1194, test_f1: 0.4275
 epoch: 70, train_loss: 1.1063, test_loss: 1.1208, test_f1: 0.4225
 epoch: 71, train_loss: 1.1089, test_loss: 1.1202, test_f1: 0.4234
 epoch: 72, train_loss: 1.1047, test_loss: 1.1212, test_f1: 0.4243
 epoch: 73, train_loss: 1.1065, test_loss: 1.1193, test_f1: 0.4242
 epoch: 74, train_loss: 1.1052, test_loss: 1.1179, test_f1: 0.4246
 epoch: 75, train_loss: 1.1080, test_loss: 1.1170, test_f1: 0.4308
 epoch: 76, train_loss: 1.1054, test_loss: 1.1181, test_f1: 0.4355
 epoch: 77, train_loss: 1.1016, test_loss: 1.1175, test_f1: 0.4454
 epoch: 78, train_loss: 1.1003, test_loss: 1.1166, test_f1: 0.4381
 epoch: 79, train_loss: 1.1004, test_loss: 1.1126, test_f1: 0.4391
 epoch: 80, train_loss: 1.1012, test_loss: 1.1143, test_f1: 0.4408
 epoch: 81, train_loss: 1.0932, test_loss: 1.1133, test_f1: 0.4439
 epoch: 82, train_loss: 1.0987, test_loss: 1.1137, test_f1: 0.4375
 epoch: 83, train_loss: 1.1025, test_loss: 1.1121, test_f1: 0.4366
 epoch: 84, train_loss: 1.0958, test_loss: 1.1091, test_f1: 0.4335
 epoch: 85, train_loss: 1.0983, test_loss: 1.1098, test_f1: 0.4392
 epoch: 86, train_loss: 1.0983, test_loss: 1.1062, test_f1: 0.4384
 epoch: 87, train_loss: 1.0871, test_loss: 1.1076, test_f1: 0.4379
 epoch: 88, train_loss: 1.1022, test_loss: 1.1070, test_f1: 0.4394
 epoch: 89, train_loss: 1.0916, test_loss: 1.1076, test_f1: 0.4361
 epoch: 90, train_loss: 1.0983, test_loss: 1.1057, test_f1: 0.4306
 epoch: 91, train_loss: 1.0926, test_loss: 1.1109, test_f1: 0.4390
 epoch: 92, train_loss: 1.0925, test_loss: 1.1089, test_f1: 0.4446
 epoch: 93, train_loss: 1.0881, test_loss: 1.1103, test_f1: 0.4457
 epoch: 94, train_loss: 1.0877, test_loss: 1.1064, test_f1: 0.4417
 epoch: 95, train_loss: 1.0792, test_loss: 1.1054, test_f1: 0.4544
 epoch: 96, train_loss: 1.0891, test_loss: 1.1049, test_f1: 0.4341
 epoch: 97, train_loss: 1.0921, test_loss: 1.1041, test_f1: 0.4394
 epoch: 98, train_loss: 1.0939, test_loss: 1.1053, test_f1: 0.4490
 epoch: 99, train_loss: 1.0789, test_loss: 1.1075, test_f1: 0.4430
##################ITERATION #8 ****************************************
 epoch: 0, train_loss: 1.3067, test_loss: 1.3204, test_f1: 0.2274
 epoch: 1, train_loss: 1.2937, test_loss: 1.3062, test_f1: 0.2274
 epoch: 2, train_loss: 1.2862, test_loss: 1.3013, test_f1: 0.2555
 epoch: 3, train_loss: 1.2828, test_loss: 1.2901, test_f1: 0.2276
 epoch: 4, train_loss: 1.2685, test_loss: 1.2745, test_f1: 0.2274
 epoch: 5, train_loss: 1.2663, test_loss: 1.2702, test_f1: 0.2300
 epoch: 6, train_loss: 1.2629, test_loss: 1.2717, test_f1: 0.2285
 epoch: 7, train_loss: 1.2583, test_loss: 1.2680, test_f1: 0.2367
 epoch: 8, train_loss: 1.2475, test_loss: 1.2604, test_f1: 0.2488
 epoch: 9, train_loss: 1.2460, test_loss: 1.2561, test_f1: 0.2614
 epoch: 10, train_loss: 1.2459, test_loss: 1.2525, test_f1: 0.2638
 epoch: 11, train_loss: 1.2424, test_loss: 1.2455, test_f1: 0.2665
 epoch: 12, train_loss: 1.2349, test_loss: 1.2487, test_f1: 0.2668
 epoch: 13, train_loss: 1.2335, test_loss: 1.2389, test_f1: 0.2941
 epoch: 14, train_loss: 1.2287, test_loss: 1.2341, test_f1: 0.2957
 epoch: 15, train_loss: 1.2274, test_loss: 1.2342, test_f1: 0.2997
 epoch: 16, train_loss: 1.2236, test_loss: 1.2318, test_f1: 0.3017
 epoch: 17, train_loss: 1.2205, test_loss: 1.2251, test_f1: 0.3030
 epoch: 18, train_loss: 1.2180, test_loss: 1.2227, test_f1: 0.3229
 epoch: 19, train_loss: 1.2136, test_loss: 1.2201, test_f1: 0.3227
 epoch: 20, train_loss: 1.2137, test_loss: 1.2133, test_f1: 0.3352
 epoch: 21, train_loss: 1.2095, test_loss: 1.2140, test_f1: 0.3374
 epoch: 22, train_loss: 1.2098, test_loss: 1.2083, test_f1: 0.3305
 epoch: 23, train_loss: 1.2059, test_loss: 1.2091, test_f1: 0.3388
 epoch: 24, train_loss: 1.2008, test_loss: 1.2054, test_f1: 0.3273
 epoch: 25, train_loss: 1.1978, test_loss: 1.2067, test_f1: 0.3261
 epoch: 26, train_loss: 1.1981, test_loss: 1.2064, test_f1: 0.3226
 epoch: 27, train_loss: 1.1901, test_loss: 1.2062, test_f1: 0.3197
 epoch: 28, train_loss: 1.1910, test_loss: 1.2030, test_f1: 0.3224
 epoch: 29, train_loss: 1.1879, test_loss: 1.1979, test_f1: 0.3347
 epoch: 30, train_loss: 1.1905, test_loss: 1.1960, test_f1: 0.3297
 epoch: 31, train_loss: 1.1881, test_loss: 1.1898, test_f1: 0.3299
 epoch: 32, train_loss: 1.1764, test_loss: 1.1871, test_f1: 0.3284
 epoch: 33, train_loss: 1.1809, test_loss: 1.1791, test_f1: 0.3271
 epoch: 34, train_loss: 1.1752, test_loss: 1.1841, test_f1: 0.3347
 epoch: 35, train_loss: 1.1745, test_loss: 1.1798, test_f1: 0.3286
 epoch: 36, train_loss: 1.1698, test_loss: 1.1761, test_f1: 0.3390
 epoch: 37, train_loss: 1.1753, test_loss: 1.1774, test_f1: 0.3489
 epoch: 38, train_loss: 1.1694, test_loss: 1.1789, test_f1: 0.3554
 epoch: 39, train_loss: 1.1626, test_loss: 1.1756, test_f1: 0.3678
 epoch: 40, train_loss: 1.1620, test_loss: 1.1723, test_f1: 0.3749
 epoch: 41, train_loss: 1.1536, test_loss: 1.1673, test_f1: 0.3760
 epoch: 42, train_loss: 1.1551, test_loss: 1.1768, test_f1: 0.3712
 epoch: 43, train_loss: 1.1489, test_loss: 1.1728, test_f1: 0.3855
 epoch: 44, train_loss: 1.1524, test_loss: 1.1732, test_f1: 0.3717
 epoch: 45, train_loss: 1.1532, test_loss: 1.1555, test_f1: 0.3959
 epoch: 46, train_loss: 1.1440, test_loss: 1.1681, test_f1: 0.3941
 epoch: 47, train_loss: 1.1441, test_loss: 1.1775, test_f1: 0.3839
 epoch: 48, train_loss: 1.1443, test_loss: 1.1749, test_f1: 0.3894
 epoch: 49, train_loss: 1.1305, test_loss: 1.1648, test_f1: 0.3906
 epoch: 50, train_loss: 1.1310, test_loss: 1.1844, test_f1: 0.4015
 epoch: 51, train_loss: 1.1353, test_loss: 1.1829, test_f1: 0.3993
 epoch: 52, train_loss: 1.1324, test_loss: 1.1787, test_f1: 0.3998
 epoch: 53, train_loss: 1.1249, test_loss: 1.1780, test_f1: 0.3926
 epoch: 54, train_loss: 1.1263, test_loss: 1.1772, test_f1: 0.3941
 epoch: 55, train_loss: 1.1298, test_loss: 1.1851, test_f1: 0.3925
 epoch: 56, train_loss: 1.1217, test_loss: 1.1839, test_f1: 0.3891
 epoch: 57, train_loss: 1.1271, test_loss: 1.1795, test_f1: 0.3910
 epoch: 58, train_loss: 1.1184, test_loss: 1.1532, test_f1: 0.3945
 epoch: 59, train_loss: 1.1150, test_loss: 1.1837, test_f1: 0.3969
 epoch: 60, train_loss: 1.1228, test_loss: 1.1897, test_f1: 0.3976
 epoch: 61, train_loss: 1.1167, test_loss: 1.1762, test_f1: 0.3953
 epoch: 62, train_loss: 1.1195, test_loss: 1.1620, test_f1: 0.3986
 epoch: 63, train_loss: 1.1161, test_loss: 1.1835, test_f1: 0.4064
 epoch: 64, train_loss: 1.1179, test_loss: 1.1783, test_f1: 0.4010
 epoch: 65, train_loss: 1.1105, test_loss: 1.1577, test_f1: 0.4083
 epoch: 66, train_loss: 1.1095, test_loss: 1.1837, test_f1: 0.4023
 epoch: 67, train_loss: 1.1117, test_loss: 1.1803, test_f1: 0.4042
 epoch: 68, train_loss: 1.1119, test_loss: 1.1833, test_f1: 0.4007
 epoch: 69, train_loss: 1.1057, test_loss: 1.1796, test_f1: 0.4132
 epoch: 70, train_loss: 1.1122, test_loss: 1.1792, test_f1: 0.4044
 epoch: 71, train_loss: 1.1033, test_loss: 1.1833, test_f1: 0.4011
 epoch: 72, train_loss: 1.1050, test_loss: 1.1663, test_f1: 0.4022
 epoch: 73, train_loss: 1.1033, test_loss: 1.1760, test_f1: 0.4071
 epoch: 74, train_loss: 1.1022, test_loss: 1.1778, test_f1: 0.4042
 epoch: 75, train_loss: 1.1071, test_loss: 1.1787, test_f1: 0.4014
 epoch: 76, train_loss: 1.1054, test_loss: 1.1867, test_f1: 0.4054
 epoch: 77, train_loss: 1.0938, test_loss: 1.1914, test_f1: 0.4081
 epoch: 78, train_loss: 1.1026, test_loss: 1.1741, test_f1: 0.4056
 epoch: 79, train_loss: 1.0930, test_loss: 1.1713, test_f1: 0.4059
 epoch: 80, train_loss: 1.1025, test_loss: 1.1541, test_f1: 0.4010
 epoch: 81, train_loss: 1.1016, test_loss: 1.1833, test_f1: 0.4105
 epoch: 82, train_loss: 1.0960, test_loss: 1.1920, test_f1: 0.4062
 epoch: 83, train_loss: 1.0847, test_loss: 1.1893, test_f1: 0.3992
 epoch: 84, train_loss: 1.0929, test_loss: 1.1856, test_f1: 0.4106
 epoch: 85, train_loss: 1.0886, test_loss: 1.1832, test_f1: 0.4049
 epoch: 86, train_loss: 1.0903, test_loss: 1.1976, test_f1: 0.4041
 epoch: 87, train_loss: 1.0873, test_loss: 1.2114, test_f1: 0.4015
 epoch: 88, train_loss: 1.0936, test_loss: 1.2142, test_f1: 0.3993
 epoch: 89, train_loss: 1.0828, test_loss: 1.2140, test_f1: 0.4052
 epoch: 90, train_loss: 1.0887, test_loss: 1.1767, test_f1: 0.4092
 epoch: 91, train_loss: 1.0849, test_loss: 1.1792, test_f1: 0.4045
 epoch: 92, train_loss: 1.0820, test_loss: 1.1951, test_f1: 0.4061
 epoch: 93, train_loss: 1.0808, test_loss: 1.1831, test_f1: 0.4030
 epoch: 94, train_loss: 1.0802, test_loss: 1.1866, test_f1: 0.4079
 epoch: 95, train_loss: 1.0744, test_loss: 1.2221, test_f1: 0.4249
 epoch: 96, train_loss: 1.0789, test_loss: 1.1366, test_f1: 0.4221
 epoch: 97, train_loss: 1.0755, test_loss: 1.1604, test_f1: 0.4243
 epoch: 98, train_loss: 1.0737, test_loss: 1.1870, test_f1: 0.4084
 epoch: 99, train_loss: 1.0781, test_loss: 1.1819, test_f1: 0.4123
##################ITERATION #9 ****************************************
 epoch: 0, train_loss: 1.3302, test_loss: 1.3494, test_f1: 0.2274
 epoch: 1, train_loss: 1.3075, test_loss: 1.3339, test_f1: 0.2274
 epoch: 2, train_loss: 1.2965, test_loss: 1.3007, test_f1: 0.2274
 epoch: 3, train_loss: 1.2907, test_loss: 1.2837, test_f1: 0.2274
 epoch: 4, train_loss: 1.2815, test_loss: 1.2738, test_f1: 0.2292
 epoch: 5, train_loss: 1.2733, test_loss: 1.2677, test_f1: 0.2295
 epoch: 6, train_loss: 1.2660, test_loss: 1.2589, test_f1: 0.2580
 epoch: 7, train_loss: 1.2588, test_loss: 1.2492, test_f1: 0.2728
 epoch: 8, train_loss: 1.2509, test_loss: 1.2355, test_f1: 0.2973
 epoch: 9, train_loss: 1.2430, test_loss: 1.2277, test_f1: 0.3020
 epoch: 10, train_loss: 1.2445, test_loss: 1.2201, test_f1: 0.3030
 epoch: 11, train_loss: 1.2341, test_loss: 1.2176, test_f1: 0.2975
 epoch: 12, train_loss: 1.2265, test_loss: 1.2143, test_f1: 0.2991
 epoch: 13, train_loss: 1.2274, test_loss: 1.2087, test_f1: 0.2968
 epoch: 14, train_loss: 1.2233, test_loss: 1.2038, test_f1: 0.2967
 epoch: 15, train_loss: 1.2229, test_loss: 1.1982, test_f1: 0.3028
 epoch: 16, train_loss: 1.2175, test_loss: 1.1963, test_f1: 0.3065
 epoch: 17, train_loss: 1.2120, test_loss: 1.1925, test_f1: 0.3009
 epoch: 18, train_loss: 1.2076, test_loss: 1.1898, test_f1: 0.3059
 epoch: 19, train_loss: 1.2042, test_loss: 1.1844, test_f1: 0.3059
 epoch: 20, train_loss: 1.2006, test_loss: 1.1809, test_f1: 0.3137
 epoch: 21, train_loss: 1.2065, test_loss: 1.1778, test_f1: 0.3174
 epoch: 22, train_loss: 1.1976, test_loss: 1.1734, test_f1: 0.3280
 epoch: 23, train_loss: 1.1937, test_loss: 1.1712, test_f1: 0.3199
 epoch: 24, train_loss: 1.1851, test_loss: 1.1699, test_f1: 0.3351
 epoch: 25, train_loss: 1.1895, test_loss: 1.1659, test_f1: 0.3409
 epoch: 26, train_loss: 1.1872, test_loss: 1.1630, test_f1: 0.3382
 epoch: 27, train_loss: 1.1863, test_loss: 1.1612, test_f1: 0.3391
 epoch: 28, train_loss: 1.1817, test_loss: 1.1567, test_f1: 0.3393
 epoch: 29, train_loss: 1.1780, test_loss: 1.1548, test_f1: 0.3404
 epoch: 30, train_loss: 1.1729, test_loss: 1.1511, test_f1: 0.3509
 epoch: 31, train_loss: 1.1750, test_loss: 1.1512, test_f1: 0.3459
 epoch: 32, train_loss: 1.1729, test_loss: 1.1471, test_f1: 0.3516
 epoch: 33, train_loss: 1.1651, test_loss: 1.1436, test_f1: 0.3494
 epoch: 34, train_loss: 1.1638, test_loss: 1.1449, test_f1: 0.3507
 epoch: 35, train_loss: 1.1596, test_loss: 1.1395, test_f1: 0.3499
 epoch: 36, train_loss: 1.1573, test_loss: 1.1399, test_f1: 0.3482
 epoch: 37, train_loss: 1.1609, test_loss: 1.1386, test_f1: 0.3506
 epoch: 38, train_loss: 1.1601, test_loss: 1.1368, test_f1: 0.3502
 epoch: 39, train_loss: 1.1483, test_loss: 1.1354, test_f1: 0.3467
 epoch: 40, train_loss: 1.1497, test_loss: 1.1315, test_f1: 0.3513
 epoch: 41, train_loss: 1.1502, test_loss: 1.1290, test_f1: 0.3508
 epoch: 42, train_loss: 1.1509, test_loss: 1.1249, test_f1: 0.3699
 epoch: 43, train_loss: 1.1376, test_loss: 1.1240, test_f1: 0.3639
 epoch: 44, train_loss: 1.1483, test_loss: 1.1267, test_f1: 0.3703
 epoch: 45, train_loss: 1.1314, test_loss: 1.1265, test_f1: 0.3734
 epoch: 46, train_loss: 1.1369, test_loss: 1.1234, test_f1: 0.3709
 epoch: 47, train_loss: 1.1355, test_loss: 1.1214, test_f1: 0.3748
 epoch: 48, train_loss: 1.1334, test_loss: 1.1193, test_f1: 0.3807
 epoch: 49, train_loss: 1.1325, test_loss: 1.1170, test_f1: 0.3885
 epoch: 50, train_loss: 1.1252, test_loss: 1.1142, test_f1: 0.4001
 epoch: 51, train_loss: 1.1265, test_loss: 1.1167, test_f1: 0.3997
 epoch: 52, train_loss: 1.1278, test_loss: 1.1160, test_f1: 0.4044
 epoch: 53, train_loss: 1.1205, test_loss: 1.1170, test_f1: 0.4081
 epoch: 54, train_loss: 1.1212, test_loss: 1.1168, test_f1: 0.4097
 epoch: 55, train_loss: 1.1182, test_loss: 1.1173, test_f1: 0.4115
 epoch: 56, train_loss: 1.1158, test_loss: 1.1143, test_f1: 0.4117
 epoch: 57, train_loss: 1.1199, test_loss: 1.1130, test_f1: 0.4093
 epoch: 58, train_loss: 1.1133, test_loss: 1.1151, test_f1: 0.4123
 epoch: 59, train_loss: 1.1162, test_loss: 1.1161, test_f1: 0.4083
 epoch: 60, train_loss: 1.1230, test_loss: 1.1142, test_f1: 0.4095
 epoch: 61, train_loss: 1.1186, test_loss: 1.1147, test_f1: 0.4073
 epoch: 62, train_loss: 1.1118, test_loss: 1.1097, test_f1: 0.4103
 epoch: 63, train_loss: 1.1233, test_loss: 1.1119, test_f1: 0.4136
 epoch: 64, train_loss: 1.1179, test_loss: 1.1108, test_f1: 0.4143
 epoch: 65, train_loss: 1.1127, test_loss: 1.1104, test_f1: 0.4140
 epoch: 66, train_loss: 1.1050, test_loss: 1.1113, test_f1: 0.4190
 epoch: 67, train_loss: 1.1142, test_loss: 1.1083, test_f1: 0.4141
 epoch: 68, train_loss: 1.1043, test_loss: 1.1064, test_f1: 0.4134
 epoch: 69, train_loss: 1.1100, test_loss: 1.1074, test_f1: 0.4163
 epoch: 70, train_loss: 1.1091, test_loss: 1.1048, test_f1: 0.4191
 epoch: 71, train_loss: 1.1010, test_loss: 1.1042, test_f1: 0.4171
 epoch: 72, train_loss: 1.1044, test_loss: 1.1064, test_f1: 0.4199
 epoch: 73, train_loss: 1.0999, test_loss: 1.1036, test_f1: 0.4198
 epoch: 74, train_loss: 1.0935, test_loss: 1.1014, test_f1: 0.4157
 epoch: 75, train_loss: 1.0889, test_loss: 1.1022, test_f1: 0.4175
 epoch: 76, train_loss: 1.0940, test_loss: 1.1045, test_f1: 0.4139
 epoch: 77, train_loss: 1.0945, test_loss: 1.1052, test_f1: 0.4122
 epoch: 78, train_loss: 1.0899, test_loss: 1.1030, test_f1: 0.4143
 epoch: 79, train_loss: 1.0941, test_loss: 1.1053, test_f1: 0.4107
 epoch: 80, train_loss: 1.0905, test_loss: 1.1040, test_f1: 0.4097
 epoch: 81, train_loss: 1.0930, test_loss: 1.0991, test_f1: 0.4125
 epoch: 82, train_loss: 1.0946, test_loss: 1.1049, test_f1: 0.4071
 epoch: 83, train_loss: 1.0891, test_loss: 1.1024, test_f1: 0.4143
 epoch: 84, train_loss: 1.0864, test_loss: 1.1006, test_f1: 0.4097
 epoch: 85, train_loss: 1.0918, test_loss: 1.1004, test_f1: 0.4157
 epoch: 86, train_loss: 1.0877, test_loss: 1.1015, test_f1: 0.4107
 epoch: 87, train_loss: 1.0854, test_loss: 1.1029, test_f1: 0.4021
 epoch: 88, train_loss: 1.0879, test_loss: 1.0989, test_f1: 0.4126
 epoch: 89, train_loss: 1.0914, test_loss: 1.1013, test_f1: 0.4122
 epoch: 90, train_loss: 1.0867, test_loss: 1.0983, test_f1: 0.4117
 epoch: 91, train_loss: 1.0827, test_loss: 1.1016, test_f1: 0.4040
 epoch: 92, train_loss: 1.0787, test_loss: 1.1013, test_f1: 0.4074
 epoch: 93, train_loss: 1.0880, test_loss: 1.1037, test_f1: 0.4090
 epoch: 94, train_loss: 1.0749, test_loss: 1.1089, test_f1: 0.4065
 epoch: 95, train_loss: 1.0741, test_loss: 1.1029, test_f1: 0.3993
 epoch: 96, train_loss: 1.0817, test_loss: 1.0975, test_f1: 0.4103
 epoch: 97, train_loss: 1.0764, test_loss: 1.0992, test_f1: 0.4031
 epoch: 98, train_loss: 1.0774, test_loss: 1.1024, test_f1: 0.4012
 epoch: 99, train_loss: 1.0736, test_loss: 1.1036, test_f1: 0.4074

Training completed in 430.08 seconds
Best F1: 0.4832 at epoch 97
Mean F1 across iterations: 0.4246  0.0345
========================FINAL RESULTS================================
FEGIN weighted F1: 0.4832  0.0345
python main.py --data ltspice_examples --representation component_component --model FEGIN --layers 6 --hiddens 32 --batch_size 256 --lr 0.0001 --emb_size 250 --epochs 100 --save_appendix component_component_L6_H32_BS256_LR0.0001_E250 --no_val
-----



STDERR:
  File "main.py", line 370, in <module>
    main()
  File "main.py", line 254, in main
    dataset = dataset_class(
  File "/home/philip/projects/ltspice_examples_code_repo/Circuit-Completion-Using-GNNs/component_classification_with_link_prediction_head/evaluation/FEGIN/kernel/circuit_datasets.py", line 15, in __init__
    self.data, self.slices = torch.load(self.processed_paths[0])
  File "/home/philip/.local/lib/python3.8/site-packages/torch/serialization.py", line 1040, in load
    warnings.warn(
  File "/usr/lib/python3.8/warnings.py", line 109, in _showwarnmsg
    sw(msg.message, msg.category, msg.filename, msg.lineno,
  File "main.py", line 47, in warn_with_traceback
    traceback.print_stack(file=log)
/home/philip/projects/ltspice_examples_code_repo/Circuit-Completion-Using-GNNs/component_classification_with_link_prediction_head/evaluation/FEGIN/kernel/circuit_datasets.py:15: FutureWarning: You are using `torch.load` with `weights_only=False` (the current default value), which uses the default pickle module implicitly. It is possible to construct malicious pickle data which will execute arbitrary code during unpickling (See https://github.com/pytorch/pytorch/blob/main/SECURITY.md#untrusted-models for more details). In a future release, the default value for `weights_only` will be flipped to `True`. This limits the functions that could be executed during unpickling. Arbitrary objects will no longer be allowed to be loaded via this mode unless they are explicitly allowlisted by the user via `torch.serialization.add_safe_globals`. We recommend you start setting `weights_only=True` for any use case where you don't have full control of the loaded file. Please open an issue on GitHub for any issues related to this experimental feature.
  self.data, self.slices = torch.load(self.processed_paths[0])
