STDOUT:
Results will be saved in /home/philip/projects/ltspice_examples_code_repo/Circuit-Completion-Using-GNNs/component_classification_with_link_prediction_head/evaluation/FEGIN/results/model_FEGIN_dataset_ltspice_examples
Command line input: python main.py --data ltspice_examples --representation component_net --model FEGIN --layers 3 --hiddens 64 --batch_size 128 --lr 0.01 --emb_size 250 --epochs 100 --save_appendix component_net_L3_H64_BS128_LR0.01_E250 --no_val
 is saved.
-----
ltspice_examples - FEGIN
Using 3 layers, 64 hidden units, h = 2
Loading component_net representation dataset
ENTERED
Training FEGIN on component_net representation
Train: 3558, Test: 846
##################ITERATION #0 ****************************************
 epoch: 0, train_loss: 1.2627, test_loss: 1.2867, test_f1: 0.2270
 epoch: 1, train_loss: 1.1013, test_loss: 1.0843, test_f1: 0.3545
 epoch: 2, train_loss: 1.0720, test_loss: 1.1034, test_f1: 0.3469
 epoch: 3, train_loss: 1.0296, test_loss: 1.0828, test_f1: 0.3797
 epoch: 4, train_loss: 0.9999, test_loss: 1.0372, test_f1: 0.4180
 epoch: 5, train_loss: 0.9737, test_loss: 0.9999, test_f1: 0.4688
 epoch: 6, train_loss: 0.9615, test_loss: 1.0337, test_f1: 0.4390
 epoch: 7, train_loss: 0.9514, test_loss: 0.9115, test_f1: 0.5069
 epoch: 8, train_loss: 0.9433, test_loss: 0.9075, test_f1: 0.5118
 epoch: 9, train_loss: 0.9430, test_loss: 0.9527, test_f1: 0.4969
 epoch: 10, train_loss: 0.9022, test_loss: 0.9681, test_f1: 0.4716
 epoch: 11, train_loss: 0.8917, test_loss: 0.9088, test_f1: 0.5162
 epoch: 12, train_loss: 0.8970, test_loss: 0.9899, test_f1: 0.4967
 epoch: 13, train_loss: 0.8783, test_loss: 0.9866, test_f1: 0.4824
 epoch: 14, train_loss: 0.8751, test_loss: 0.9146, test_f1: 0.5062
 epoch: 15, train_loss: 0.8534, test_loss: 0.8615, test_f1: 0.5790
 epoch: 16, train_loss: 0.8487, test_loss: 1.1299, test_f1: 0.4818
 epoch: 17, train_loss: 0.8357, test_loss: 0.9459, test_f1: 0.5580
 epoch: 18, train_loss: 0.8280, test_loss: 0.8875, test_f1: 0.5196
 epoch: 19, train_loss: 0.8208, test_loss: 1.0150, test_f1: 0.5360
 epoch: 20, train_loss: 0.8088, test_loss: 0.8951, test_f1: 0.5821
 epoch: 21, train_loss: 0.8124, test_loss: 0.9913, test_f1: 0.5214
 epoch: 22, train_loss: 0.8051, test_loss: 0.9686, test_f1: 0.5464
 epoch: 23, train_loss: 0.7967, test_loss: 0.9614, test_f1: 0.5802
 epoch: 24, train_loss: 0.7807, test_loss: 0.8532, test_f1: 0.5606
 epoch: 25, train_loss: 0.7765, test_loss: 0.9879, test_f1: 0.5112
 epoch: 26, train_loss: 0.7705, test_loss: 1.0660, test_f1: 0.5725
 epoch: 27, train_loss: 0.7843, test_loss: 0.9674, test_f1: 0.5316
 epoch: 28, train_loss: 0.7914, test_loss: 1.0018, test_f1: 0.5962
 epoch: 29, train_loss: 0.7809, test_loss: 1.0404, test_f1: 0.5464
 epoch: 30, train_loss: 0.7641, test_loss: 1.0582, test_f1: 0.5766
 epoch: 31, train_loss: 0.7513, test_loss: 1.0378, test_f1: 0.5516
 epoch: 32, train_loss: 0.7464, test_loss: 0.9438, test_f1: 0.5715
 epoch: 33, train_loss: 0.7304, test_loss: 1.0338, test_f1: 0.5710
 epoch: 34, train_loss: 0.7270, test_loss: 1.1118, test_f1: 0.5641
 epoch: 35, train_loss: 0.7332, test_loss: 1.0837, test_f1: 0.5479
 epoch: 36, train_loss: 0.7080, test_loss: 1.2640, test_f1: 0.5318
 epoch: 37, train_loss: 0.7047, test_loss: 1.2152, test_f1: 0.5774
 epoch: 38, train_loss: 0.6962, test_loss: 1.1472, test_f1: 0.6224
 epoch: 39, train_loss: 0.7027, test_loss: 1.2923, test_f1: 0.5488
 epoch: 40, train_loss: 0.6903, test_loss: 1.3153, test_f1: 0.5322
 epoch: 41, train_loss: 0.6877, test_loss: 1.3355, test_f1: 0.5447
 epoch: 42, train_loss: 0.7084, test_loss: 1.1408, test_f1: 0.5693
 epoch: 43, train_loss: 0.7034, test_loss: 1.0951, test_f1: 0.5875
 epoch: 44, train_loss: 0.6933, test_loss: 0.9953, test_f1: 0.5952
 epoch: 45, train_loss: 0.6769, test_loss: 1.2129, test_f1: 0.5985
 epoch: 46, train_loss: 0.6692, test_loss: 1.0322, test_f1: 0.6237
 epoch: 47, train_loss: 0.6625, test_loss: 1.0937, test_f1: 0.5962
 epoch: 48, train_loss: 0.6393, test_loss: 1.1670, test_f1: 0.5956
 epoch: 49, train_loss: 0.6583, test_loss: 1.0710, test_f1: 0.5896
 epoch: 50, train_loss: 0.6300, test_loss: 1.4640, test_f1: 0.5744
 epoch: 51, train_loss: 0.6244, test_loss: 1.0225, test_f1: 0.6233
 epoch: 52, train_loss: 0.5948, test_loss: 1.2840, test_f1: 0.6169
 epoch: 53, train_loss: 0.5777, test_loss: 1.3091, test_f1: 0.6329
 epoch: 54, train_loss: 0.5828, test_loss: 0.9774, test_f1: 0.6241
 epoch: 55, train_loss: 0.5676, test_loss: 1.2454, test_f1: 0.6583
 epoch: 56, train_loss: 0.5409, test_loss: 1.1635, test_f1: 0.6310
 epoch: 57, train_loss: 0.5937, test_loss: 1.0534, test_f1: 0.6205
 epoch: 58, train_loss: 0.5908, test_loss: 0.9508, test_f1: 0.6313
 epoch: 59, train_loss: 0.5592, test_loss: 1.0424, test_f1: 0.6577
 epoch: 60, train_loss: 0.5583, test_loss: 1.0314, test_f1: 0.5902
 epoch: 61, train_loss: 0.5530, test_loss: 1.0291, test_f1: 0.5985
 epoch: 62, train_loss: 0.5607, test_loss: 1.1054, test_f1: 0.6204
 epoch: 63, train_loss: 0.5455, test_loss: 1.1574, test_f1: 0.6253
 epoch: 64, train_loss: 0.5283, test_loss: 1.1297, test_f1: 0.6272
 epoch: 65, train_loss: 0.5286, test_loss: 1.1812, test_f1: 0.6161
 epoch: 66, train_loss: 0.5415, test_loss: 1.0455, test_f1: 0.6374
 epoch: 67, train_loss: 0.5336, test_loss: 1.1671, test_f1: 0.6638
 epoch: 68, train_loss: 0.5245, test_loss: 1.2040, test_f1: 0.6188
 epoch: 69, train_loss: 0.5079, test_loss: 1.2139, test_f1: 0.5786
 epoch: 70, train_loss: 0.5290, test_loss: 1.1997, test_f1: 0.6282
 epoch: 71, train_loss: 0.5092, test_loss: 1.0923, test_f1: 0.6528
 epoch: 72, train_loss: 0.5091, test_loss: 1.1331, test_f1: 0.6064
 epoch: 73, train_loss: 0.5095, test_loss: 1.3352, test_f1: 0.6146
 epoch: 74, train_loss: 0.5102, test_loss: 1.0609, test_f1: 0.6581
 epoch: 75, train_loss: 0.5059, test_loss: 1.4189, test_f1: 0.6111
 epoch: 76, train_loss: 0.4886, test_loss: 1.2970, test_f1: 0.6304
 epoch: 77, train_loss: 0.4845, test_loss: 1.3604, test_f1: 0.6313
 epoch: 78, train_loss: 0.5143, test_loss: 1.1599, test_f1: 0.6285
 epoch: 79, train_loss: 0.4909, test_loss: 1.2692, test_f1: 0.6288
 epoch: 80, train_loss: 0.4772, test_loss: 1.3885, test_f1: 0.6486
 epoch: 81, train_loss: 0.4872, test_loss: 1.2291, test_f1: 0.6435
 epoch: 82, train_loss: 0.4748, test_loss: 1.3199, test_f1: 0.6408
 epoch: 83, train_loss: 0.4507, test_loss: 1.4829, test_f1: 0.6385
 epoch: 84, train_loss: 0.4555, test_loss: 1.3161, test_f1: 0.6256
 epoch: 85, train_loss: 0.4623, test_loss: 1.2998, test_f1: 0.5905
 epoch: 86, train_loss: 0.4592, test_loss: 1.4090, test_f1: 0.6139
 epoch: 87, train_loss: 0.4644, test_loss: 1.3680, test_f1: 0.6260
 epoch: 88, train_loss: 0.4593, test_loss: 1.3300, test_f1: 0.6568
 epoch: 89, train_loss: 0.4709, test_loss: 1.3358, test_f1: 0.6589
 epoch: 90, train_loss: 0.4397, test_loss: 1.5242, test_f1: 0.6330
 epoch: 91, train_loss: 0.4341, test_loss: 1.3133, test_f1: 0.6717
 epoch: 92, train_loss: 0.4590, test_loss: 1.3270, test_f1: 0.6479
 epoch: 93, train_loss: 0.4512, test_loss: 1.4565, test_f1: 0.6318
 epoch: 94, train_loss: 0.4330, test_loss: 1.5050, test_f1: 0.5997
 epoch: 95, train_loss: 0.4125, test_loss: 1.2631, test_f1: 0.6589
 epoch: 96, train_loss: 0.4054, test_loss: 1.3871, test_f1: 0.6834
 epoch: 97, train_loss: 0.4241, test_loss: 1.5062, test_f1: 0.6434
 epoch: 98, train_loss: 0.3972, test_loss: 1.5257, test_f1: 0.6437
 epoch: 99, train_loss: 0.4100, test_loss: 1.2052, test_f1: 0.6348
##################ITERATION #1 ****************************************
 epoch: 0, train_loss: 1.2170, test_loss: 1.0701, test_f1: 0.3914
 epoch: 1, train_loss: 1.0202, test_loss: 1.0512, test_f1: 0.4430
 epoch: 2, train_loss: 0.9647, test_loss: 1.0528, test_f1: 0.4835
 epoch: 3, train_loss: 0.9341, test_loss: 0.9447, test_f1: 0.4959
 epoch: 4, train_loss: 0.9200, test_loss: 0.9020, test_f1: 0.5122
 epoch: 5, train_loss: 0.8930, test_loss: 0.9207, test_f1: 0.5079
 epoch: 6, train_loss: 0.8818, test_loss: 1.0117, test_f1: 0.5012
 epoch: 7, train_loss: 0.8631, test_loss: 1.0047, test_f1: 0.5395
 epoch: 8, train_loss: 0.8627, test_loss: 0.9644, test_f1: 0.5130
 epoch: 9, train_loss: 0.8352, test_loss: 0.9152, test_f1: 0.5547
 epoch: 10, train_loss: 0.8273, test_loss: 0.9504, test_f1: 0.5551
 epoch: 11, train_loss: 0.8176, test_loss: 0.9766, test_f1: 0.5226
 epoch: 12, train_loss: 0.8265, test_loss: 0.9230, test_f1: 0.5472
 epoch: 13, train_loss: 0.8217, test_loss: 0.9870, test_f1: 0.5587
 epoch: 14, train_loss: 0.8027, test_loss: 0.9965, test_f1: 0.5775
 epoch: 15, train_loss: 0.7961, test_loss: 0.9476, test_f1: 0.6039
 epoch: 16, train_loss: 0.7958, test_loss: 0.8944, test_f1: 0.5768
 epoch: 17, train_loss: 0.7845, test_loss: 1.0552, test_f1: 0.5611
 epoch: 18, train_loss: 0.7757, test_loss: 1.0350, test_f1: 0.5430
 epoch: 19, train_loss: 0.7674, test_loss: 0.9843, test_f1: 0.5870
 epoch: 20, train_loss: 0.7454, test_loss: 1.0423, test_f1: 0.5708
 epoch: 21, train_loss: 0.7601, test_loss: 0.9878, test_f1: 0.5577
 epoch: 22, train_loss: 0.7405, test_loss: 0.8951, test_f1: 0.6120
 epoch: 23, train_loss: 0.7295, test_loss: 1.0871, test_f1: 0.5792
 epoch: 24, train_loss: 0.7376, test_loss: 1.0232, test_f1: 0.6073
 epoch: 25, train_loss: 0.7268, test_loss: 1.1047, test_f1: 0.5428
 epoch: 26, train_loss: 0.7186, test_loss: 1.1687, test_f1: 0.5890
 epoch: 27, train_loss: 0.7086, test_loss: 1.0314, test_f1: 0.5921
 epoch: 28, train_loss: 0.7022, test_loss: 1.2009, test_f1: 0.5211
 epoch: 29, train_loss: 0.6876, test_loss: 1.0835, test_f1: 0.5974
 epoch: 30, train_loss: 0.7215, test_loss: 0.9372, test_f1: 0.5986
 epoch: 31, train_loss: 0.7102, test_loss: 1.1794, test_f1: 0.6057
 epoch: 32, train_loss: 0.6865, test_loss: 1.0808, test_f1: 0.6280
 epoch: 33, train_loss: 0.6727, test_loss: 1.0620, test_f1: 0.6399
 epoch: 34, train_loss: 0.6583, test_loss: 1.1327, test_f1: 0.6135
 epoch: 35, train_loss: 0.6605, test_loss: 1.0234, test_f1: 0.6333
 epoch: 36, train_loss: 0.6692, test_loss: 0.9632, test_f1: 0.6205
 epoch: 37, train_loss: 0.6604, test_loss: 0.9848, test_f1: 0.6467
 epoch: 38, train_loss: 0.6464, test_loss: 1.0993, test_f1: 0.5983
 epoch: 39, train_loss: 0.6512, test_loss: 1.0450, test_f1: 0.6170
 epoch: 40, train_loss: 0.6423, test_loss: 1.0085, test_f1: 0.6296
 epoch: 41, train_loss: 0.6378, test_loss: 1.1838, test_f1: 0.5623
 epoch: 42, train_loss: 0.6453, test_loss: 1.1039, test_f1: 0.6289
 epoch: 43, train_loss: 0.6081, test_loss: 0.9914, test_f1: 0.6233
 epoch: 44, train_loss: 0.6341, test_loss: 0.9877, test_f1: 0.6494
 epoch: 45, train_loss: 0.6167, test_loss: 1.1581, test_f1: 0.6338
 epoch: 46, train_loss: 0.6062, test_loss: 1.0836, test_f1: 0.6354
 epoch: 47, train_loss: 0.5959, test_loss: 1.2327, test_f1: 0.6195
 epoch: 48, train_loss: 0.6226, test_loss: 1.0864, test_f1: 0.6127
 epoch: 49, train_loss: 0.6101, test_loss: 1.0830, test_f1: 0.6237
 epoch: 50, train_loss: 0.6130, test_loss: 1.0298, test_f1: 0.6446
 epoch: 51, train_loss: 0.5607, test_loss: 1.1192, test_f1: 0.6570
 epoch: 52, train_loss: 0.5364, test_loss: 1.1330, test_f1: 0.6676
 epoch: 53, train_loss: 0.5368, test_loss: 1.1815, test_f1: 0.6325
 epoch: 54, train_loss: 0.5251, test_loss: 1.1812, test_f1: 0.6356
 epoch: 55, train_loss: 0.5267, test_loss: 1.1600, test_f1: 0.6380
 epoch: 56, train_loss: 0.5100, test_loss: 1.4095, test_f1: 0.6278
 epoch: 57, train_loss: 0.5128, test_loss: 1.3343, test_f1: 0.6314
 epoch: 58, train_loss: 0.4957, test_loss: 1.2608, test_f1: 0.6542
 epoch: 59, train_loss: 0.4906, test_loss: 1.4282, test_f1: 0.6110
 epoch: 60, train_loss: 0.4935, test_loss: 1.2835, test_f1: 0.6383
 epoch: 61, train_loss: 0.4816, test_loss: 1.2952, test_f1: 0.6504
 epoch: 62, train_loss: 0.4836, test_loss: 1.2174, test_f1: 0.6319
 epoch: 63, train_loss: 0.4812, test_loss: 1.2909, test_f1: 0.6467
 epoch: 64, train_loss: 0.4813, test_loss: 1.4676, test_f1: 0.6468
 epoch: 65, train_loss: 0.4784, test_loss: 1.3356, test_f1: 0.6370
 epoch: 66, train_loss: 0.4673, test_loss: 1.4228, test_f1: 0.6374
 epoch: 67, train_loss: 0.4610, test_loss: 1.3851, test_f1: 0.6350
 epoch: 68, train_loss: 0.4667, test_loss: 1.5590, test_f1: 0.6259
 epoch: 69, train_loss: 0.4718, test_loss: 1.3638, test_f1: 0.6531
 epoch: 70, train_loss: 0.4709, test_loss: 1.3696, test_f1: 0.6453
 epoch: 71, train_loss: 0.4463, test_loss: 1.3752, test_f1: 0.6429
 epoch: 72, train_loss: 0.4725, test_loss: 1.4307, test_f1: 0.6236
 epoch: 73, train_loss: 0.4326, test_loss: 1.2869, test_f1: 0.6589
 epoch: 74, train_loss: 0.4555, test_loss: 1.3566, test_f1: 0.6545
 epoch: 75, train_loss: 0.4382, test_loss: 1.3958, test_f1: 0.6250
 epoch: 76, train_loss: 0.4320, test_loss: 1.4764, test_f1: 0.6333
 epoch: 77, train_loss: 0.4541, test_loss: 1.5891, test_f1: 0.6429
 epoch: 78, train_loss: 0.4438, test_loss: 1.3520, test_f1: 0.6363
 epoch: 79, train_loss: 0.4618, test_loss: 1.5340, test_f1: 0.6375
 epoch: 80, train_loss: 0.4416, test_loss: 1.5341, test_f1: 0.6499
 epoch: 81, train_loss: 0.4345, test_loss: 1.4218, test_f1: 0.6384
 epoch: 82, train_loss: 0.4503, test_loss: 1.4732, test_f1: 0.6507
 epoch: 83, train_loss: 0.4401, test_loss: 1.4839, test_f1: 0.6512
 epoch: 84, train_loss: 0.4295, test_loss: 1.4371, test_f1: 0.6371
 epoch: 85, train_loss: 0.4385, test_loss: 1.4689, test_f1: 0.6183
 epoch: 86, train_loss: 0.4198, test_loss: 1.4803, test_f1: 0.6409
 epoch: 87, train_loss: 0.4287, test_loss: 1.5028, test_f1: 0.5970
 epoch: 88, train_loss: 0.4406, test_loss: 1.2597, test_f1: 0.6188
 epoch: 89, train_loss: 0.4239, test_loss: 1.4159, test_f1: 0.6506
 epoch: 90, train_loss: 0.4033, test_loss: 1.3811, test_f1: 0.6401
 epoch: 91, train_loss: 0.4201, test_loss: 1.2790, test_f1: 0.6580
 epoch: 92, train_loss: 0.4197, test_loss: 1.4551, test_f1: 0.6534
 epoch: 93, train_loss: 0.4128, test_loss: 1.5327, test_f1: 0.6443
 epoch: 94, train_loss: 0.4120, test_loss: 1.5939, test_f1: 0.6390
 epoch: 95, train_loss: 0.4007, test_loss: 1.3832, test_f1: 0.6184
 epoch: 96, train_loss: 0.4294, test_loss: 1.4742, test_f1: 0.6464
 epoch: 97, train_loss: 0.4120, test_loss: 1.6827, test_f1: 0.6527
 epoch: 98, train_loss: 0.3974, test_loss: 1.5215, test_f1: 0.6096
 epoch: 99, train_loss: 0.4040, test_loss: 1.4810, test_f1: 0.6094
##################ITERATION #2 ****************************************
 epoch: 0, train_loss: 1.2085, test_loss: 1.2161, test_f1: 0.3045
 epoch: 1, train_loss: 1.0037, test_loss: 0.9785, test_f1: 0.4791
 epoch: 2, train_loss: 0.9583, test_loss: 0.9507, test_f1: 0.5391
 epoch: 3, train_loss: 0.9514, test_loss: 0.9156, test_f1: 0.4936
 epoch: 4, train_loss: 0.9182, test_loss: 0.9664, test_f1: 0.4872
 epoch: 5, train_loss: 0.9192, test_loss: 0.9653, test_f1: 0.5166
 epoch: 6, train_loss: 0.8963, test_loss: 0.9345, test_f1: 0.5237
 epoch: 7, train_loss: 0.8973, test_loss: 0.9731, test_f1: 0.4571
 epoch: 8, train_loss: 0.8790, test_loss: 0.9083, test_f1: 0.5220
 epoch: 9, train_loss: 0.8763, test_loss: 0.9316, test_f1: 0.5346
 epoch: 10, train_loss: 0.8730, test_loss: 0.9472, test_f1: 0.5337
 epoch: 11, train_loss: 0.8783, test_loss: 0.9283, test_f1: 0.5628
 epoch: 12, train_loss: 0.8646, test_loss: 0.9968, test_f1: 0.5549
 epoch: 13, train_loss: 0.8396, test_loss: 0.8774, test_f1: 0.5440
 epoch: 14, train_loss: 0.8360, test_loss: 0.9523, test_f1: 0.5715
 epoch: 15, train_loss: 0.8321, test_loss: 0.8577, test_f1: 0.5617
 epoch: 16, train_loss: 0.8158, test_loss: 0.8666, test_f1: 0.5794
 epoch: 17, train_loss: 0.8010, test_loss: 0.9966, test_f1: 0.5256
 epoch: 18, train_loss: 0.7995, test_loss: 0.8918, test_f1: 0.5575
 epoch: 19, train_loss: 0.8059, test_loss: 0.8652, test_f1: 0.5751
 epoch: 20, train_loss: 0.8027, test_loss: 0.9103, test_f1: 0.5250
 epoch: 21, train_loss: 0.7820, test_loss: 0.8780, test_f1: 0.6106
 epoch: 22, train_loss: 0.7748, test_loss: 1.0144, test_f1: 0.5208
 epoch: 23, train_loss: 0.7645, test_loss: 0.9344, test_f1: 0.5885
 epoch: 24, train_loss: 0.7855, test_loss: 0.8648, test_f1: 0.5613
 epoch: 25, train_loss: 0.7813, test_loss: 0.9887, test_f1: 0.5452
 epoch: 26, train_loss: 0.7893, test_loss: 0.9387, test_f1: 0.5449
 epoch: 27, train_loss: 0.7663, test_loss: 1.0477, test_f1: 0.5190
 epoch: 28, train_loss: 0.7470, test_loss: 0.9292, test_f1: 0.6104
 epoch: 29, train_loss: 0.7508, test_loss: 0.9828, test_f1: 0.5451
 epoch: 30, train_loss: 0.7402, test_loss: 0.9647, test_f1: 0.5422
 epoch: 31, train_loss: 0.7281, test_loss: 0.9042, test_f1: 0.6134
 epoch: 32, train_loss: 0.7226, test_loss: 0.9393, test_f1: 0.6159
 epoch: 33, train_loss: 0.7279, test_loss: 0.9915, test_f1: 0.6096
 epoch: 34, train_loss: 0.6998, test_loss: 0.9218, test_f1: 0.6157
 epoch: 35, train_loss: 0.6954, test_loss: 0.8834, test_f1: 0.6113
 epoch: 36, train_loss: 0.6923, test_loss: 1.0384, test_f1: 0.5956
 epoch: 37, train_loss: 0.7102, test_loss: 1.0327, test_f1: 0.5850
 epoch: 38, train_loss: 0.6940, test_loss: 0.9497, test_f1: 0.5712
 epoch: 39, train_loss: 0.6926, test_loss: 1.0137, test_f1: 0.6132
 epoch: 40, train_loss: 0.6682, test_loss: 0.9371, test_f1: 0.6153
 epoch: 41, train_loss: 0.6929, test_loss: 0.9313, test_f1: 0.6257
 epoch: 42, train_loss: 0.6957, test_loss: 1.0024, test_f1: 0.5911
 epoch: 43, train_loss: 0.6518, test_loss: 1.1310, test_f1: 0.6109
 epoch: 44, train_loss: 0.6640, test_loss: 1.1865, test_f1: 0.5527
 epoch: 45, train_loss: 0.6795, test_loss: 0.9155, test_f1: 0.6405
 epoch: 46, train_loss: 0.6712, test_loss: 0.9045, test_f1: 0.5947
 epoch: 47, train_loss: 0.6499, test_loss: 1.0107, test_f1: 0.6066
 epoch: 48, train_loss: 0.6306, test_loss: 0.9379, test_f1: 0.6176
 epoch: 49, train_loss: 0.6565, test_loss: 1.0076, test_f1: 0.6035
 epoch: 50, train_loss: 0.6338, test_loss: 0.9842, test_f1: 0.6550
 epoch: 51, train_loss: 0.5885, test_loss: 0.9794, test_f1: 0.6351
 epoch: 52, train_loss: 0.5806, test_loss: 1.1177, test_f1: 0.6238
 epoch: 53, train_loss: 0.5881, test_loss: 0.9858, test_f1: 0.6419
 epoch: 54, train_loss: 0.5800, test_loss: 1.0155, test_f1: 0.6440
 epoch: 55, train_loss: 0.5624, test_loss: 1.0193, test_f1: 0.6425
 epoch: 56, train_loss: 0.5466, test_loss: 1.1061, test_f1: 0.6445
 epoch: 57, train_loss: 0.5536, test_loss: 1.0496, test_f1: 0.6181
 epoch: 58, train_loss: 0.5575, test_loss: 1.0966, test_f1: 0.6471
 epoch: 59, train_loss: 0.5552, test_loss: 1.0811, test_f1: 0.6142
 epoch: 60, train_loss: 0.5520, test_loss: 1.0873, test_f1: 0.6300
 epoch: 61, train_loss: 0.5426, test_loss: 1.0655, test_f1: 0.6356
 epoch: 62, train_loss: 0.5505, test_loss: 1.1299, test_f1: 0.6286
 epoch: 63, train_loss: 0.5276, test_loss: 1.1890, test_f1: 0.6262
 epoch: 64, train_loss: 0.5422, test_loss: 1.1121, test_f1: 0.6414
 epoch: 65, train_loss: 0.5283, test_loss: 1.1607, test_f1: 0.6435
 epoch: 66, train_loss: 0.5054, test_loss: 1.1711, test_f1: 0.6337
 epoch: 67, train_loss: 0.5373, test_loss: 1.0670, test_f1: 0.6743
 epoch: 68, train_loss: 0.5236, test_loss: 1.1848, test_f1: 0.6554
 epoch: 69, train_loss: 0.5170, test_loss: 1.1557, test_f1: 0.6269
 epoch: 70, train_loss: 0.5099, test_loss: 1.2355, test_f1: 0.6541
 epoch: 71, train_loss: 0.5287, test_loss: 1.1499, test_f1: 0.6444
 epoch: 72, train_loss: 0.5074, test_loss: 1.2348, test_f1: 0.6524
 epoch: 73, train_loss: 0.4758, test_loss: 1.1769, test_f1: 0.6674
 epoch: 74, train_loss: 0.4664, test_loss: 1.1938, test_f1: 0.6350
 epoch: 75, train_loss: 0.4857, test_loss: 1.1753, test_f1: 0.6293
 epoch: 76, train_loss: 0.4811, test_loss: 1.1893, test_f1: 0.6570
 epoch: 77, train_loss: 0.4947, test_loss: 1.1798, test_f1: 0.6701
 epoch: 78, train_loss: 0.5053, test_loss: 1.2214, test_f1: 0.6379
 epoch: 79, train_loss: 0.4899, test_loss: 1.1892, test_f1: 0.6527
 epoch: 80, train_loss: 0.5039, test_loss: 1.2012, test_f1: 0.6467
 epoch: 81, train_loss: 0.4684, test_loss: 1.2954, test_f1: 0.6752
 epoch: 82, train_loss: 0.4763, test_loss: 1.2413, test_f1: 0.6764
 epoch: 83, train_loss: 0.4788, test_loss: 1.2502, test_f1: 0.6457
 epoch: 84, train_loss: 0.4668, test_loss: 1.2415, test_f1: 0.6422
 epoch: 85, train_loss: 0.4901, test_loss: 1.1948, test_f1: 0.6602
 epoch: 86, train_loss: 0.4807, test_loss: 1.3152, test_f1: 0.6534
 epoch: 87, train_loss: 0.4501, test_loss: 1.2685, test_f1: 0.6212
 epoch: 88, train_loss: 0.4441, test_loss: 1.3738, test_f1: 0.6745
 epoch: 89, train_loss: 0.4698, test_loss: 1.2548, test_f1: 0.6566
 epoch: 90, train_loss: 0.4703, test_loss: 1.2775, test_f1: 0.6236
 epoch: 91, train_loss: 0.4499, test_loss: 1.2744, test_f1: 0.6476
 epoch: 92, train_loss: 0.4377, test_loss: 1.3477, test_f1: 0.6197
 epoch: 93, train_loss: 0.4569, test_loss: 1.3690, test_f1: 0.6436
 epoch: 94, train_loss: 0.4255, test_loss: 1.4199, test_f1: 0.6157
 epoch: 95, train_loss: 0.4437, test_loss: 1.2842, test_f1: 0.6209
 epoch: 96, train_loss: 0.4231, test_loss: 1.4244, test_f1: 0.6108
 epoch: 97, train_loss: 0.4390, test_loss: 1.2748, test_f1: 0.6357
 epoch: 98, train_loss: 0.4330, test_loss: 1.5028, test_f1: 0.6730
 epoch: 99, train_loss: 0.4232, test_loss: 1.4681, test_f1: 0.6401
##################ITERATION #3 ****************************************
 epoch: 0, train_loss: 1.2431, test_loss: 1.4207, test_f1: 0.2781
 epoch: 1, train_loss: 1.0174, test_loss: 1.0742, test_f1: 0.4619
 epoch: 2, train_loss: 0.9846, test_loss: 0.9703, test_f1: 0.4676
 epoch: 3, train_loss: 0.9649, test_loss: 0.9411, test_f1: 0.4970
 epoch: 4, train_loss: 0.9442, test_loss: 0.9864, test_f1: 0.4931
 epoch: 5, train_loss: 0.9368, test_loss: 0.9136, test_f1: 0.5390
 epoch: 6, train_loss: 0.9128, test_loss: 0.9611, test_f1: 0.5095
 epoch: 7, train_loss: 0.9080, test_loss: 0.9442, test_f1: 0.5203
 epoch: 8, train_loss: 0.9069, test_loss: 0.8764, test_f1: 0.5658
 epoch: 9, train_loss: 0.8949, test_loss: 0.9289, test_f1: 0.5534
 epoch: 10, train_loss: 0.8852, test_loss: 0.8767, test_f1: 0.5868
 epoch: 11, train_loss: 0.8634, test_loss: 0.8949, test_f1: 0.5232
 epoch: 12, train_loss: 0.8521, test_loss: 0.9391, test_f1: 0.5803
 epoch: 13, train_loss: 0.8574, test_loss: 0.9963, test_f1: 0.4773
 epoch: 14, train_loss: 0.8302, test_loss: 0.9273, test_f1: 0.5812
 epoch: 15, train_loss: 0.8311, test_loss: 0.8842, test_f1: 0.5444
 epoch: 16, train_loss: 0.8311, test_loss: 0.8789, test_f1: 0.5808
 epoch: 17, train_loss: 0.8319, test_loss: 1.1391, test_f1: 0.4485
 epoch: 18, train_loss: 0.8189, test_loss: 0.9031, test_f1: 0.5243
 epoch: 19, train_loss: 0.8054, test_loss: 0.8718, test_f1: 0.6037
 epoch: 20, train_loss: 0.8237, test_loss: 0.9341, test_f1: 0.5892
 epoch: 21, train_loss: 0.7976, test_loss: 0.9295, test_f1: 0.5800
 epoch: 22, train_loss: 0.7759, test_loss: 0.9021, test_f1: 0.5929
 epoch: 23, train_loss: 0.7702, test_loss: 0.8586, test_f1: 0.5809
 epoch: 24, train_loss: 0.7808, test_loss: 0.9290, test_f1: 0.5664
 epoch: 25, train_loss: 0.7641, test_loss: 0.8595, test_f1: 0.6005
 epoch: 26, train_loss: 0.7431, test_loss: 0.9039, test_f1: 0.6097
 epoch: 27, train_loss: 0.7263, test_loss: 0.9326, test_f1: 0.6257
 epoch: 28, train_loss: 0.7335, test_loss: 1.1262, test_f1: 0.5912
 epoch: 29, train_loss: 0.7484, test_loss: 1.0271, test_f1: 0.5782
 epoch: 30, train_loss: 0.7345, test_loss: 0.9208, test_f1: 0.5785
 epoch: 31, train_loss: 0.7044, test_loss: 0.9602, test_f1: 0.5948
 epoch: 32, train_loss: 0.7130, test_loss: 0.9414, test_f1: 0.5946
 epoch: 33, train_loss: 0.7106, test_loss: 0.9658, test_f1: 0.5653
 epoch: 34, train_loss: 0.7069, test_loss: 0.9448, test_f1: 0.6145
 epoch: 35, train_loss: 0.6886, test_loss: 0.9997, test_f1: 0.6228
 epoch: 36, train_loss: 0.6927, test_loss: 0.9175, test_f1: 0.5998
 epoch: 37, train_loss: 0.6790, test_loss: 0.9022, test_f1: 0.6192
 epoch: 38, train_loss: 0.6853, test_loss: 1.0132, test_f1: 0.6090
 epoch: 39, train_loss: 0.6711, test_loss: 0.8572, test_f1: 0.6300
 epoch: 40, train_loss: 0.6716, test_loss: 1.0384, test_f1: 0.6301
 epoch: 41, train_loss: 0.6862, test_loss: 0.9162, test_f1: 0.6085
 epoch: 42, train_loss: 0.6633, test_loss: 0.8865, test_f1: 0.6142
 epoch: 43, train_loss: 0.6657, test_loss: 0.8953, test_f1: 0.6207
 epoch: 44, train_loss: 0.6416, test_loss: 0.9907, test_f1: 0.6465
 epoch: 45, train_loss: 0.6324, test_loss: 0.9730, test_f1: 0.6288
 epoch: 46, train_loss: 0.6364, test_loss: 0.9580, test_f1: 0.6096
 epoch: 47, train_loss: 0.6456, test_loss: 0.9242, test_f1: 0.6363
 epoch: 48, train_loss: 0.6273, test_loss: 0.8885, test_f1: 0.6361
 epoch: 49, train_loss: 0.6645, test_loss: 1.0055, test_f1: 0.6174
 epoch: 50, train_loss: 0.6305, test_loss: 1.0124, test_f1: 0.6466
 epoch: 51, train_loss: 0.6071, test_loss: 0.9553, test_f1: 0.6444
 epoch: 52, train_loss: 0.5736, test_loss: 0.9685, test_f1: 0.6542
 epoch: 53, train_loss: 0.5662, test_loss: 0.9458, test_f1: 0.6441
 epoch: 54, train_loss: 0.5512, test_loss: 0.9426, test_f1: 0.6469
 epoch: 55, train_loss: 0.5419, test_loss: 0.9048, test_f1: 0.6421
 epoch: 56, train_loss: 0.5481, test_loss: 0.9416, test_f1: 0.6402
 epoch: 57, train_loss: 0.5385, test_loss: 0.9800, test_f1: 0.6502
 epoch: 58, train_loss: 0.5431, test_loss: 1.0129, test_f1: 0.6264
 epoch: 59, train_loss: 0.5468, test_loss: 1.0043, test_f1: 0.6642
 epoch: 60, train_loss: 0.5496, test_loss: 0.9891, test_f1: 0.6467
 epoch: 61, train_loss: 0.5215, test_loss: 1.1438, test_f1: 0.6336
 epoch: 62, train_loss: 0.5377, test_loss: 1.0090, test_f1: 0.6638
 epoch: 63, train_loss: 0.5148, test_loss: 0.9906, test_f1: 0.6459
 epoch: 64, train_loss: 0.5289, test_loss: 1.1036, test_f1: 0.6528
 epoch: 65, train_loss: 0.5248, test_loss: 1.0467, test_f1: 0.6811
 epoch: 66, train_loss: 0.5119, test_loss: 1.0622, test_f1: 0.6909
 epoch: 67, train_loss: 0.5082, test_loss: 1.1230, test_f1: 0.6619
 epoch: 68, train_loss: 0.5077, test_loss: 1.1893, test_f1: 0.6565
 epoch: 69, train_loss: 0.5059, test_loss: 1.1302, test_f1: 0.6401
 epoch: 70, train_loss: 0.4973, test_loss: 1.0657, test_f1: 0.6476
 epoch: 71, train_loss: 0.5022, test_loss: 1.0677, test_f1: 0.6439
 epoch: 72, train_loss: 0.5001, test_loss: 1.0610, test_f1: 0.6559
 epoch: 73, train_loss: 0.4966, test_loss: 1.0943, test_f1: 0.6812
 epoch: 74, train_loss: 0.4887, test_loss: 1.0221, test_f1: 0.6656
 epoch: 75, train_loss: 0.4857, test_loss: 1.0524, test_f1: 0.6521
 epoch: 76, train_loss: 0.4842, test_loss: 1.1359, test_f1: 0.6390
 epoch: 77, train_loss: 0.4856, test_loss: 1.2109, test_f1: 0.7028
 epoch: 78, train_loss: 0.4705, test_loss: 1.1562, test_f1: 0.6517
 epoch: 79, train_loss: 0.4854, test_loss: 1.1410, test_f1: 0.6980
 epoch: 80, train_loss: 0.4650, test_loss: 1.1169, test_f1: 0.6597
 epoch: 81, train_loss: 0.4511, test_loss: 1.0897, test_f1: 0.6931
 epoch: 82, train_loss: 0.4473, test_loss: 1.2557, test_f1: 0.6596
 epoch: 83, train_loss: 0.4611, test_loss: 1.1103, test_f1: 0.6382
 epoch: 84, train_loss: 0.4697, test_loss: 1.1795, test_f1: 0.6742
 epoch: 85, train_loss: 0.4681, test_loss: 1.2098, test_f1: 0.7013
 epoch: 86, train_loss: 0.4657, test_loss: 1.1557, test_f1: 0.6859
 epoch: 87, train_loss: 0.4620, test_loss: 1.1656, test_f1: 0.6640
 epoch: 88, train_loss: 0.4415, test_loss: 1.2531, test_f1: 0.6478
 epoch: 89, train_loss: 0.4649, test_loss: 1.2340, test_f1: 0.7033
 epoch: 90, train_loss: 0.4587, test_loss: 1.2508, test_f1: 0.6629
 epoch: 91, train_loss: 0.4615, test_loss: 1.1890, test_f1: 0.6754
 epoch: 92, train_loss: 0.4582, test_loss: 1.2727, test_f1: 0.6375
 epoch: 93, train_loss: 0.4451, test_loss: 1.3402, test_f1: 0.6629
 epoch: 94, train_loss: 0.4330, test_loss: 1.3578, test_f1: 0.6506
 epoch: 95, train_loss: 0.4305, test_loss: 1.2211, test_f1: 0.6881
 epoch: 96, train_loss: 0.4401, test_loss: 1.2087, test_f1: 0.6908
 epoch: 97, train_loss: 0.4312, test_loss: 1.1391, test_f1: 0.6805
 epoch: 98, train_loss: 0.4174, test_loss: 1.2904, test_f1: 0.6530
 epoch: 99, train_loss: 0.4145, test_loss: 1.3819, test_f1: 0.6195
##################ITERATION #4 ****************************************
 epoch: 0, train_loss: 1.2409, test_loss: 1.1837, test_f1: 0.3655
 epoch: 1, train_loss: 1.0344, test_loss: 1.0112, test_f1: 0.4902
 epoch: 2, train_loss: 0.9870, test_loss: 0.9664, test_f1: 0.4874
 epoch: 3, train_loss: 0.9608, test_loss: 0.9977, test_f1: 0.4725
 epoch: 4, train_loss: 0.9593, test_loss: 0.9329, test_f1: 0.5098
 epoch: 5, train_loss: 0.9321, test_loss: 0.9425, test_f1: 0.5189
 epoch: 6, train_loss: 0.9353, test_loss: 0.9954, test_f1: 0.4783
 epoch: 7, train_loss: 0.9080, test_loss: 0.9013, test_f1: 0.5407
 epoch: 8, train_loss: 0.9032, test_loss: 0.9801, test_f1: 0.4933
 epoch: 9, train_loss: 0.8792, test_loss: 1.0776, test_f1: 0.4854
 epoch: 10, train_loss: 0.8554, test_loss: 0.9193, test_f1: 0.5444
 epoch: 11, train_loss: 0.8672, test_loss: 0.9413, test_f1: 0.5551
 epoch: 12, train_loss: 0.8584, test_loss: 0.9146, test_f1: 0.5176
 epoch: 13, train_loss: 0.8585, test_loss: 0.9551, test_f1: 0.5222
 epoch: 14, train_loss: 0.8339, test_loss: 0.8830, test_f1: 0.5450
 epoch: 15, train_loss: 0.8347, test_loss: 0.8954, test_f1: 0.5679
 epoch: 16, train_loss: 0.8116, test_loss: 0.9005, test_f1: 0.5720
 epoch: 17, train_loss: 0.8158, test_loss: 0.8928, test_f1: 0.5769
 epoch: 18, train_loss: 0.7973, test_loss: 0.8841, test_f1: 0.5560
 epoch: 19, train_loss: 0.7935, test_loss: 0.9360, test_f1: 0.5066
 epoch: 20, train_loss: 0.7877, test_loss: 0.9426, test_f1: 0.5789
 epoch: 21, train_loss: 0.7807, test_loss: 0.9307, test_f1: 0.5926
 epoch: 22, train_loss: 0.7611, test_loss: 0.8921, test_f1: 0.5667
 epoch: 23, train_loss: 0.7643, test_loss: 0.8978, test_f1: 0.6000
 epoch: 24, train_loss: 0.7528, test_loss: 0.9641, test_f1: 0.5755
 epoch: 25, train_loss: 0.7420, test_loss: 0.8870, test_f1: 0.5901
 epoch: 26, train_loss: 0.7334, test_loss: 0.8861, test_f1: 0.6088
 epoch: 27, train_loss: 0.7322, test_loss: 1.0449, test_f1: 0.5102
 epoch: 28, train_loss: 0.7325, test_loss: 0.8930, test_f1: 0.5868
 epoch: 29, train_loss: 0.7246, test_loss: 0.8681, test_f1: 0.5872
 epoch: 30, train_loss: 0.7291, test_loss: 1.6720, test_f1: 0.4077
 epoch: 31, train_loss: 0.7281, test_loss: 1.0042, test_f1: 0.5435
 epoch: 32, train_loss: 0.7153, test_loss: 0.9224, test_f1: 0.5905
 epoch: 33, train_loss: 0.6941, test_loss: 1.0584, test_f1: 0.5465
 epoch: 34, train_loss: 0.6930, test_loss: 0.9826, test_f1: 0.5982
 epoch: 35, train_loss: 0.6847, test_loss: 1.0824, test_f1: 0.5861
 epoch: 36, train_loss: 0.6897, test_loss: 0.9499, test_f1: 0.5878
 epoch: 37, train_loss: 0.6680, test_loss: 1.0394, test_f1: 0.6076
 epoch: 38, train_loss: 0.6911, test_loss: 0.9959, test_f1: 0.5335
 epoch: 39, train_loss: 0.6816, test_loss: 0.9917, test_f1: 0.6085
 epoch: 40, train_loss: 0.6612, test_loss: 1.0881, test_f1: 0.5798
 epoch: 41, train_loss: 0.6517, test_loss: 1.0165, test_f1: 0.6118
 epoch: 42, train_loss: 0.6547, test_loss: 0.9412, test_f1: 0.6061
 epoch: 43, train_loss: 0.6847, test_loss: 0.9643, test_f1: 0.6077
 epoch: 44, train_loss: 0.6492, test_loss: 1.0826, test_f1: 0.5873
 epoch: 45, train_loss: 0.6418, test_loss: 0.9585, test_f1: 0.6053
 epoch: 46, train_loss: 0.6456, test_loss: 1.0633, test_f1: 0.5995
 epoch: 47, train_loss: 0.6150, test_loss: 1.1066, test_f1: 0.6730
 epoch: 48, train_loss: 0.6206, test_loss: 1.0556, test_f1: 0.6251
 epoch: 49, train_loss: 0.6155, test_loss: 1.2722, test_f1: 0.6166
 epoch: 50, train_loss: 0.6139, test_loss: 1.2189, test_f1: 0.6174
 epoch: 51, train_loss: 0.5920, test_loss: 1.0039, test_f1: 0.6285
 epoch: 52, train_loss: 0.5624, test_loss: 1.1341, test_f1: 0.6441
 epoch: 53, train_loss: 0.5594, test_loss: 1.2035, test_f1: 0.6305
 epoch: 54, train_loss: 0.5454, test_loss: 1.2010, test_f1: 0.6197
 epoch: 55, train_loss: 0.5390, test_loss: 1.1124, test_f1: 0.6359
 epoch: 56, train_loss: 0.5355, test_loss: 1.1054, test_f1: 0.6229
 epoch: 57, train_loss: 0.5152, test_loss: 1.3237, test_f1: 0.6437
 epoch: 58, train_loss: 0.5296, test_loss: 1.2050, test_f1: 0.6674
 epoch: 59, train_loss: 0.5195, test_loss: 1.2650, test_f1: 0.6314
 epoch: 60, train_loss: 0.5295, test_loss: 1.2730, test_f1: 0.6482
 epoch: 61, train_loss: 0.5276, test_loss: 1.1911, test_f1: 0.6400
 epoch: 62, train_loss: 0.5243, test_loss: 1.2590, test_f1: 0.6124
 epoch: 63, train_loss: 0.5094, test_loss: 1.2398, test_f1: 0.6368
 epoch: 64, train_loss: 0.5178, test_loss: 1.2579, test_f1: 0.6239
 epoch: 65, train_loss: 0.5026, test_loss: 1.3208, test_f1: 0.6326
 epoch: 66, train_loss: 0.4994, test_loss: 1.2943, test_f1: 0.6409
 epoch: 67, train_loss: 0.5107, test_loss: 1.4268, test_f1: 0.6752
 epoch: 68, train_loss: 0.4997, test_loss: 1.4172, test_f1: 0.6534
 epoch: 69, train_loss: 0.4797, test_loss: 1.3006, test_f1: 0.6128
 epoch: 70, train_loss: 0.4978, test_loss: 1.4450, test_f1: 0.6131
 epoch: 71, train_loss: 0.4938, test_loss: 1.2483, test_f1: 0.6558
 epoch: 72, train_loss: 0.4761, test_loss: 1.3876, test_f1: 0.6446
 epoch: 73, train_loss: 0.4945, test_loss: 1.5815, test_f1: 0.6164
 epoch: 74, train_loss: 0.4790, test_loss: 1.3800, test_f1: 0.6613
 epoch: 75, train_loss: 0.4628, test_loss: 1.5347, test_f1: 0.6549
 epoch: 76, train_loss: 0.4785, test_loss: 1.6612, test_f1: 0.6573
 epoch: 77, train_loss: 0.4926, test_loss: 1.5403, test_f1: 0.6495
 epoch: 78, train_loss: 0.4761, test_loss: 1.3620, test_f1: 0.6309
 epoch: 79, train_loss: 0.4578, test_loss: 1.3270, test_f1: 0.6361
 epoch: 80, train_loss: 0.4712, test_loss: 1.4394, test_f1: 0.6694
 epoch: 81, train_loss: 0.4516, test_loss: 1.6608, test_f1: 0.6504
 epoch: 82, train_loss: 0.4631, test_loss: 1.5340, test_f1: 0.6598
 epoch: 83, train_loss: 0.4660, test_loss: 1.6821, test_f1: 0.6249
 epoch: 84, train_loss: 0.4658, test_loss: 1.4579, test_f1: 0.6464
 epoch: 85, train_loss: 0.4460, test_loss: 1.3811, test_f1: 0.6484
 epoch: 86, train_loss: 0.4358, test_loss: 1.5204, test_f1: 0.6436
 epoch: 87, train_loss: 0.4283, test_loss: 1.8463, test_f1: 0.6301
 epoch: 88, train_loss: 0.4373, test_loss: 1.4359, test_f1: 0.6354
 epoch: 89, train_loss: 0.4515, test_loss: 1.4788, test_f1: 0.6342
 epoch: 90, train_loss: 0.4519, test_loss: 1.5327, test_f1: 0.6622
 epoch: 91, train_loss: 0.4418, test_loss: 1.5575, test_f1: 0.6389
 epoch: 92, train_loss: 0.4466, test_loss: 1.6907, test_f1: 0.6587
 epoch: 93, train_loss: 0.4288, test_loss: 1.6535, test_f1: 0.6486
 epoch: 94, train_loss: 0.4567, test_loss: 1.3324, test_f1: 0.6331
 epoch: 95, train_loss: 0.4358, test_loss: 1.5965, test_f1: 0.6321
 epoch: 96, train_loss: 0.4374, test_loss: 1.5444, test_f1: 0.6595
 epoch: 97, train_loss: 0.4252, test_loss: 1.7831, test_f1: 0.6602
 epoch: 98, train_loss: 0.4211, test_loss: 1.4587, test_f1: 0.6382
 epoch: 99, train_loss: 0.4154, test_loss: 1.5808, test_f1: 0.6666
##################ITERATION #5 ****************************************
 epoch: 0, train_loss: 1.2741, test_loss: 1.3502, test_f1: 0.2640
 epoch: 1, train_loss: 1.0085, test_loss: 0.9392, test_f1: 0.5041
 epoch: 2, train_loss: 0.9616, test_loss: 1.0325, test_f1: 0.4300
 epoch: 3, train_loss: 0.9398, test_loss: 0.9597, test_f1: 0.4987
 epoch: 4, train_loss: 0.9474, test_loss: 0.9382, test_f1: 0.4938
 epoch: 5, train_loss: 0.9080, test_loss: 0.9494, test_f1: 0.4588
 epoch: 6, train_loss: 0.9039, test_loss: 0.9521, test_f1: 0.5218
 epoch: 7, train_loss: 0.8839, test_loss: 1.0010, test_f1: 0.4825
 epoch: 8, train_loss: 0.8784, test_loss: 0.9493, test_f1: 0.5188
 epoch: 9, train_loss: 0.8724, test_loss: 0.9208, test_f1: 0.5197
 epoch: 10, train_loss: 0.8708, test_loss: 0.8962, test_f1: 0.5333
 epoch: 11, train_loss: 0.8489, test_loss: 0.8794, test_f1: 0.5383
 epoch: 12, train_loss: 0.8205, test_loss: 0.9100, test_f1: 0.5450
 epoch: 13, train_loss: 0.8408, test_loss: 0.8836, test_f1: 0.5203
 epoch: 14, train_loss: 0.8502, test_loss: 0.8448, test_f1: 0.5560
 epoch: 15, train_loss: 0.8247, test_loss: 0.9924, test_f1: 0.5242
 epoch: 16, train_loss: 0.8126, test_loss: 0.8908, test_f1: 0.5708
 epoch: 17, train_loss: 0.7946, test_loss: 0.8789, test_f1: 0.5666
 epoch: 18, train_loss: 0.8113, test_loss: 0.8560, test_f1: 0.5618
 epoch: 19, train_loss: 0.7832, test_loss: 0.9834, test_f1: 0.5350
 epoch: 20, train_loss: 0.7838, test_loss: 0.8631, test_f1: 0.5481
 epoch: 21, train_loss: 0.7645, test_loss: 0.9184, test_f1: 0.5780
 epoch: 22, train_loss: 0.7461, test_loss: 0.8389, test_f1: 0.5944
 epoch: 23, train_loss: 0.7432, test_loss: 0.9494, test_f1: 0.5400
 epoch: 24, train_loss: 0.7477, test_loss: 0.9176, test_f1: 0.5863
 epoch: 25, train_loss: 0.7539, test_loss: 0.8803, test_f1: 0.6035
 epoch: 26, train_loss: 0.7389, test_loss: 0.9077, test_f1: 0.5899
 epoch: 27, train_loss: 0.7226, test_loss: 0.9077, test_f1: 0.5545
 epoch: 28, train_loss: 0.7162, test_loss: 0.8725, test_f1: 0.5971
 epoch: 29, train_loss: 0.7232, test_loss: 0.9460, test_f1: 0.5674
 epoch: 30, train_loss: 0.7148, test_loss: 0.9073, test_f1: 0.6116
 epoch: 31, train_loss: 0.7095, test_loss: 0.9702, test_f1: 0.6024
 epoch: 32, train_loss: 0.6878, test_loss: 0.8633, test_f1: 0.6230
 epoch: 33, train_loss: 0.7226, test_loss: 1.1322, test_f1: 0.5438
 epoch: 34, train_loss: 0.6718, test_loss: 0.9390, test_f1: 0.6118
 epoch: 35, train_loss: 0.6725, test_loss: 0.9677, test_f1: 0.6432
 epoch: 36, train_loss: 0.6930, test_loss: 1.0159, test_f1: 0.5552
 epoch: 37, train_loss: 0.6922, test_loss: 0.8729, test_f1: 0.5536
 epoch: 38, train_loss: 0.6811, test_loss: 0.9283, test_f1: 0.6228
 epoch: 39, train_loss: 0.6604, test_loss: 0.9370, test_f1: 0.5984
 epoch: 40, train_loss: 0.6661, test_loss: 0.9467, test_f1: 0.5876
 epoch: 41, train_loss: 0.6407, test_loss: 0.9637, test_f1: 0.6437
 epoch: 42, train_loss: 0.6535, test_loss: 0.8761, test_f1: 0.6222
 epoch: 43, train_loss: 0.6499, test_loss: 1.0296, test_f1: 0.6030
 epoch: 44, train_loss: 0.6244, test_loss: 0.8831, test_f1: 0.5964
 epoch: 45, train_loss: 0.6513, test_loss: 0.9402, test_f1: 0.5982
 epoch: 46, train_loss: 0.6302, test_loss: 1.0308, test_f1: 0.6200
 epoch: 47, train_loss: 0.6066, test_loss: 0.9769, test_f1: 0.6317
 epoch: 48, train_loss: 0.6172, test_loss: 0.9926, test_f1: 0.6571
 epoch: 49, train_loss: 0.6473, test_loss: 1.0637, test_f1: 0.6074
 epoch: 50, train_loss: 0.6376, test_loss: 1.1745, test_f1: 0.6137
 epoch: 51, train_loss: 0.6024, test_loss: 0.9947, test_f1: 0.6449
 epoch: 52, train_loss: 0.5645, test_loss: 1.1399, test_f1: 0.6057
 epoch: 53, train_loss: 0.5350, test_loss: 1.1075, test_f1: 0.6267
 epoch: 54, train_loss: 0.5289, test_loss: 1.0671, test_f1: 0.6463
 epoch: 55, train_loss: 0.5172, test_loss: 1.1477, test_f1: 0.6496
 epoch: 56, train_loss: 0.5151, test_loss: 1.1991, test_f1: 0.6480
 epoch: 57, train_loss: 0.5121, test_loss: 1.1154, test_f1: 0.6446
 epoch: 58, train_loss: 0.5110, test_loss: 1.0972, test_f1: 0.6123
 epoch: 59, train_loss: 0.5167, test_loss: 1.1071, test_f1: 0.6734
 epoch: 60, train_loss: 0.4818, test_loss: 1.1613, test_f1: 0.6344
 epoch: 61, train_loss: 0.4981, test_loss: 1.3193, test_f1: 0.6239
 epoch: 62, train_loss: 0.5033, test_loss: 1.1044, test_f1: 0.6274
 epoch: 63, train_loss: 0.4892, test_loss: 1.1240, test_f1: 0.6483
 epoch: 64, train_loss: 0.4876, test_loss: 1.2409, test_f1: 0.6629
 epoch: 65, train_loss: 0.4941, test_loss: 1.2449, test_f1: 0.6351
 epoch: 66, train_loss: 0.4858, test_loss: 1.2333, test_f1: 0.6719
 epoch: 67, train_loss: 0.4610, test_loss: 1.1283, test_f1: 0.6609
 epoch: 68, train_loss: 0.4816, test_loss: 1.2457, test_f1: 0.6423
 epoch: 69, train_loss: 0.4674, test_loss: 1.2111, test_f1: 0.6289
 epoch: 70, train_loss: 0.4574, test_loss: 1.4193, test_f1: 0.6888
 epoch: 71, train_loss: 0.4673, test_loss: 1.2031, test_f1: 0.6790
 epoch: 72, train_loss: 0.4909, test_loss: 1.3987, test_f1: 0.6671
 epoch: 73, train_loss: 0.4624, test_loss: 1.1660, test_f1: 0.6432
 epoch: 74, train_loss: 0.4594, test_loss: 1.2318, test_f1: 0.6412
 epoch: 75, train_loss: 0.4428, test_loss: 1.3039, test_f1: 0.6913
 epoch: 76, train_loss: 0.4733, test_loss: 1.2409, test_f1: 0.6765
 epoch: 77, train_loss: 0.4228, test_loss: 1.3990, test_f1: 0.6053
 epoch: 78, train_loss: 0.4462, test_loss: 1.1352, test_f1: 0.6260
 epoch: 79, train_loss: 0.4141, test_loss: 1.2666, test_f1: 0.6370
 epoch: 80, train_loss: 0.4417, test_loss: 1.1963, test_f1: 0.6487
 epoch: 81, train_loss: 0.4394, test_loss: 1.2140, test_f1: 0.6590
 epoch: 82, train_loss: 0.4424, test_loss: 1.2892, test_f1: 0.6651
 epoch: 83, train_loss: 0.4410, test_loss: 1.3149, test_f1: 0.6346
 epoch: 84, train_loss: 0.4282, test_loss: 1.4611, test_f1: 0.6109
 epoch: 85, train_loss: 0.4250, test_loss: 1.4231, test_f1: 0.6600
 epoch: 86, train_loss: 0.4227, test_loss: 1.5678, test_f1: 0.6340
 epoch: 87, train_loss: 0.4206, test_loss: 1.2828, test_f1: 0.6660
 epoch: 88, train_loss: 0.4272, test_loss: 1.4313, test_f1: 0.6609
 epoch: 89, train_loss: 0.4175, test_loss: 1.2960, test_f1: 0.6414
 epoch: 90, train_loss: 0.3875, test_loss: 1.2901, test_f1: 0.6500
 epoch: 91, train_loss: 0.4257, test_loss: 1.3734, test_f1: 0.6412
 epoch: 92, train_loss: 0.4166, test_loss: 1.3266, test_f1: 0.6662
 epoch: 93, train_loss: 0.4192, test_loss: 1.4091, test_f1: 0.6181
 epoch: 94, train_loss: 0.3969, test_loss: 1.3968, test_f1: 0.6488
 epoch: 95, train_loss: 0.4024, test_loss: 1.5539, test_f1: 0.6495
 epoch: 96, train_loss: 0.4037, test_loss: 1.2650, test_f1: 0.6345
 epoch: 97, train_loss: 0.4014, test_loss: 1.2931, test_f1: 0.6542
 epoch: 98, train_loss: 0.3912, test_loss: 1.2793, test_f1: 0.6672
 epoch: 99, train_loss: 0.3891, test_loss: 1.3208, test_f1: 0.6402
##################ITERATION #6 ****************************************
 epoch: 0, train_loss: 1.2379, test_loss: 1.3184, test_f1: 0.2983
 epoch: 1, train_loss: 1.0273, test_loss: 1.0574, test_f1: 0.4386
 epoch: 2, train_loss: 0.9799, test_loss: 1.0198, test_f1: 0.4616
 epoch: 3, train_loss: 0.9655, test_loss: 0.9664, test_f1: 0.4784
 epoch: 4, train_loss: 0.9262, test_loss: 1.0275, test_f1: 0.4998
 epoch: 5, train_loss: 0.9275, test_loss: 0.9428, test_f1: 0.4987
 epoch: 6, train_loss: 0.9056, test_loss: 0.9692, test_f1: 0.4827
 epoch: 7, train_loss: 0.8976, test_loss: 1.0174, test_f1: 0.5349
 epoch: 8, train_loss: 0.8806, test_loss: 0.9211, test_f1: 0.5395
 epoch: 9, train_loss: 0.8893, test_loss: 1.0439, test_f1: 0.5236
 epoch: 10, train_loss: 0.8932, test_loss: 0.9464, test_f1: 0.5230
 epoch: 11, train_loss: 0.8536, test_loss: 0.8582, test_f1: 0.5422
 epoch: 12, train_loss: 0.8552, test_loss: 0.8729, test_f1: 0.5184
 epoch: 13, train_loss: 0.8463, test_loss: 0.9697, test_f1: 0.5474
 epoch: 14, train_loss: 0.8324, test_loss: 0.9139, test_f1: 0.5532
 epoch: 15, train_loss: 0.8124, test_loss: 0.9696, test_f1: 0.5083
 epoch: 16, train_loss: 0.8045, test_loss: 0.8904, test_f1: 0.5709
 epoch: 17, train_loss: 0.8157, test_loss: 0.9006, test_f1: 0.5745
 epoch: 18, train_loss: 0.8010, test_loss: 0.8543, test_f1: 0.5733
 epoch: 19, train_loss: 0.7846, test_loss: 0.9530, test_f1: 0.5155
 epoch: 20, train_loss: 0.7843, test_loss: 1.0610, test_f1: 0.5087
 epoch: 21, train_loss: 0.7834, test_loss: 0.9483, test_f1: 0.5347
 epoch: 22, train_loss: 0.7756, test_loss: 0.9105, test_f1: 0.5313
 epoch: 23, train_loss: 0.7813, test_loss: 0.8484, test_f1: 0.5788
 epoch: 24, train_loss: 0.7571, test_loss: 0.9121, test_f1: 0.5948
 epoch: 25, train_loss: 0.7642, test_loss: 1.0069, test_f1: 0.5201
 epoch: 26, train_loss: 0.7667, test_loss: 0.8475, test_f1: 0.5951
 epoch: 27, train_loss: 0.7490, test_loss: 0.8729, test_f1: 0.5954
 epoch: 28, train_loss: 0.7457, test_loss: 0.9316, test_f1: 0.5910
 epoch: 29, train_loss: 0.7463, test_loss: 0.9383, test_f1: 0.5648
 epoch: 30, train_loss: 0.7479, test_loss: 0.9960, test_f1: 0.5565
 epoch: 31, train_loss: 0.7218, test_loss: 0.9311, test_f1: 0.5582
 epoch: 32, train_loss: 0.7230, test_loss: 0.9557, test_f1: 0.5684
 epoch: 33, train_loss: 0.7189, test_loss: 0.8620, test_f1: 0.6300
 epoch: 34, train_loss: 0.7240, test_loss: 0.8954, test_f1: 0.6208
 epoch: 35, train_loss: 0.6949, test_loss: 1.0871, test_f1: 0.5629
 epoch: 36, train_loss: 0.6840, test_loss: 0.9366, test_f1: 0.6195
 epoch: 37, train_loss: 0.6702, test_loss: 0.9506, test_f1: 0.6163
 epoch: 38, train_loss: 0.7119, test_loss: 1.0130, test_f1: 0.5662
 epoch: 39, train_loss: 0.6850, test_loss: 0.9737, test_f1: 0.6186
 epoch: 40, train_loss: 0.6949, test_loss: 0.8620, test_f1: 0.6176
 epoch: 41, train_loss: 0.6804, test_loss: 0.8895, test_f1: 0.6271
 epoch: 42, train_loss: 0.6542, test_loss: 1.0026, test_f1: 0.6521
 epoch: 43, train_loss: 0.6532, test_loss: 0.9767, test_f1: 0.5961
 epoch: 44, train_loss: 0.6670, test_loss: 1.0077, test_f1: 0.6313
 epoch: 45, train_loss: 0.6487, test_loss: 0.9761, test_f1: 0.5882
 epoch: 46, train_loss: 0.6437, test_loss: 1.0248, test_f1: 0.6295
 epoch: 47, train_loss: 0.6279, test_loss: 1.0704, test_f1: 0.6219
 epoch: 48, train_loss: 0.6298, test_loss: 1.4301, test_f1: 0.5699
 epoch: 49, train_loss: 0.6384, test_loss: 0.9650, test_f1: 0.6116
 epoch: 50, train_loss: 0.6346, test_loss: 0.9636, test_f1: 0.6217
 epoch: 51, train_loss: 0.6001, test_loss: 0.9213, test_f1: 0.6468
 epoch: 52, train_loss: 0.5862, test_loss: 0.9688, test_f1: 0.6602
 epoch: 53, train_loss: 0.5646, test_loss: 1.0228, test_f1: 0.6194
 epoch: 54, train_loss: 0.5554, test_loss: 0.9742, test_f1: 0.6496
 epoch: 55, train_loss: 0.5456, test_loss: 1.0645, test_f1: 0.6325
 epoch: 56, train_loss: 0.5455, test_loss: 1.0231, test_f1: 0.6366
 epoch: 57, train_loss: 0.5632, test_loss: 1.0867, test_f1: 0.6173
 epoch: 58, train_loss: 0.5537, test_loss: 0.9965, test_f1: 0.6487
 epoch: 59, train_loss: 0.5244, test_loss: 1.0269, test_f1: 0.6411
 epoch: 60, train_loss: 0.5321, test_loss: 1.1350, test_f1: 0.6431
 epoch: 61, train_loss: 0.5200, test_loss: 1.2065, test_f1: 0.6321
 epoch: 62, train_loss: 0.5254, test_loss: 1.0590, test_f1: 0.6509
 epoch: 63, train_loss: 0.5205, test_loss: 1.0746, test_f1: 0.6734
 epoch: 64, train_loss: 0.5212, test_loss: 1.1434, test_f1: 0.6377
 epoch: 65, train_loss: 0.5163, test_loss: 1.2032, test_f1: 0.6503
 epoch: 66, train_loss: 0.5156, test_loss: 1.0496, test_f1: 0.6373
 epoch: 67, train_loss: 0.5166, test_loss: 1.2894, test_f1: 0.6599
 epoch: 68, train_loss: 0.5068, test_loss: 1.1507, test_f1: 0.6321
 epoch: 69, train_loss: 0.5134, test_loss: 1.0564, test_f1: 0.6314
 epoch: 70, train_loss: 0.5107, test_loss: 1.1905, test_f1: 0.6396
 epoch: 71, train_loss: 0.5064, test_loss: 1.2120, test_f1: 0.6306
 epoch: 72, train_loss: 0.5133, test_loss: 1.1072, test_f1: 0.6213
 epoch: 73, train_loss: 0.4926, test_loss: 1.3230, test_f1: 0.6737
 epoch: 74, train_loss: 0.5102, test_loss: 1.2469, test_f1: 0.6575
 epoch: 75, train_loss: 0.5259, test_loss: 1.2611, test_f1: 0.6745
 epoch: 76, train_loss: 0.5330, test_loss: 1.3173, test_f1: 0.6424
 epoch: 77, train_loss: 0.4971, test_loss: 1.3923, test_f1: 0.6287
 epoch: 78, train_loss: 0.4933, test_loss: 1.2388, test_f1: 0.6451
 epoch: 79, train_loss: 0.4849, test_loss: 1.1952, test_f1: 0.6645
 epoch: 80, train_loss: 0.5085, test_loss: 1.2743, test_f1: 0.6435
 epoch: 81, train_loss: 0.4777, test_loss: 1.1906, test_f1: 0.6825
 epoch: 82, train_loss: 0.4939, test_loss: 1.3076, test_f1: 0.6669
 epoch: 83, train_loss: 0.4699, test_loss: 1.2408, test_f1: 0.6566
 epoch: 84, train_loss: 0.4645, test_loss: 1.2458, test_f1: 0.6153
 epoch: 85, train_loss: 0.4447, test_loss: 1.3438, test_f1: 0.6544
 epoch: 86, train_loss: 0.4687, test_loss: 1.2507, test_f1: 0.6399
 epoch: 87, train_loss: 0.4716, test_loss: 1.2239, test_f1: 0.6593
 epoch: 88, train_loss: 0.4497, test_loss: 1.3164, test_f1: 0.6362
 epoch: 89, train_loss: 0.4567, test_loss: 1.4556, test_f1: 0.6525
 epoch: 90, train_loss: 0.4692, test_loss: 1.4426, test_f1: 0.6338
 epoch: 91, train_loss: 0.4620, test_loss: 1.4310, test_f1: 0.6406
 epoch: 92, train_loss: 0.4346, test_loss: 1.3535, test_f1: 0.6416
 epoch: 93, train_loss: 0.4583, test_loss: 1.4717, test_f1: 0.6678
 epoch: 94, train_loss: 0.4457, test_loss: 1.4455, test_f1: 0.6352
 epoch: 95, train_loss: 0.4598, test_loss: 1.3922, test_f1: 0.6228
 epoch: 96, train_loss: 0.4524, test_loss: 1.3369, test_f1: 0.6391
 epoch: 97, train_loss: 0.4483, test_loss: 1.3492, test_f1: 0.6717
 epoch: 98, train_loss: 0.4442, test_loss: 1.4038, test_f1: 0.6283
 epoch: 99, train_loss: 0.4280, test_loss: 1.4151, test_f1: 0.6232
##################ITERATION #7 ****************************************
 epoch: 0, train_loss: 1.2852, test_loss: 1.3083, test_f1: 0.2725
 epoch: 1, train_loss: 1.0359, test_loss: 1.0346, test_f1: 0.4277
 epoch: 2, train_loss: 0.9688, test_loss: 0.9876, test_f1: 0.4750
 epoch: 3, train_loss: 0.9461, test_loss: 0.9433, test_f1: 0.5013
 epoch: 4, train_loss: 0.9289, test_loss: 0.9436, test_f1: 0.5408
 epoch: 5, train_loss: 0.9148, test_loss: 1.0320, test_f1: 0.4813
 epoch: 6, train_loss: 0.9020, test_loss: 0.9370, test_f1: 0.5451
 epoch: 7, train_loss: 0.9109, test_loss: 0.9180, test_f1: 0.5113
 epoch: 8, train_loss: 0.8882, test_loss: 0.9606, test_f1: 0.5648
 epoch: 9, train_loss: 0.8868, test_loss: 0.9385, test_f1: 0.5076
 epoch: 10, train_loss: 0.8709, test_loss: 0.9331, test_f1: 0.5551
 epoch: 11, train_loss: 0.8532, test_loss: 1.0693, test_f1: 0.5071
 epoch: 12, train_loss: 0.8481, test_loss: 0.9153, test_f1: 0.5338
 epoch: 13, train_loss: 0.8418, test_loss: 0.9970, test_f1: 0.5540
 epoch: 14, train_loss: 0.8324, test_loss: 0.9462, test_f1: 0.5679
 epoch: 15, train_loss: 0.8131, test_loss: 0.9941, test_f1: 0.5305
 epoch: 16, train_loss: 0.8433, test_loss: 1.0105, test_f1: 0.4973
 epoch: 17, train_loss: 0.8423, test_loss: 0.8888, test_f1: 0.5641
 epoch: 18, train_loss: 0.8129, test_loss: 0.9928, test_f1: 0.5594
 epoch: 19, train_loss: 0.8130, test_loss: 1.0638, test_f1: 0.5342
 epoch: 20, train_loss: 0.8097, test_loss: 0.9637, test_f1: 0.5675
 epoch: 21, train_loss: 0.8003, test_loss: 0.9898, test_f1: 0.6276
 epoch: 22, train_loss: 0.7860, test_loss: 0.9352, test_f1: 0.5662
 epoch: 23, train_loss: 0.7873, test_loss: 1.0068, test_f1: 0.5638
 epoch: 24, train_loss: 0.7691, test_loss: 1.0900, test_f1: 0.5675
 epoch: 25, train_loss: 0.7700, test_loss: 1.1709, test_f1: 0.5706
 epoch: 26, train_loss: 0.7642, test_loss: 1.0769, test_f1: 0.5622
 epoch: 27, train_loss: 0.7581, test_loss: 1.0329, test_f1: 0.6173
 epoch: 28, train_loss: 0.7942, test_loss: 1.5400, test_f1: 0.4884
 epoch: 29, train_loss: 0.7778, test_loss: 0.9487, test_f1: 0.5957
 epoch: 30, train_loss: 0.7604, test_loss: 0.9895, test_f1: 0.5883
 epoch: 31, train_loss: 0.7483, test_loss: 1.0858, test_f1: 0.6203
 epoch: 32, train_loss: 0.7499, test_loss: 0.9225, test_f1: 0.6304
 epoch: 33, train_loss: 0.7392, test_loss: 0.9190, test_f1: 0.6345
 epoch: 34, train_loss: 0.7573, test_loss: 0.9952, test_f1: 0.5900
 epoch: 35, train_loss: 0.7476, test_loss: 1.1817, test_f1: 0.5812
 epoch: 36, train_loss: 0.7246, test_loss: 0.9682, test_f1: 0.6295
 epoch: 37, train_loss: 0.7325, test_loss: 1.3224, test_f1: 0.5576
 epoch: 38, train_loss: 0.7073, test_loss: 1.0552, test_f1: 0.6274
 epoch: 39, train_loss: 0.7075, test_loss: 0.9826, test_f1: 0.6213
 epoch: 40, train_loss: 0.6982, test_loss: 1.1669, test_f1: 0.5911
 epoch: 41, train_loss: 0.7015, test_loss: 1.0808, test_f1: 0.6057
 epoch: 42, train_loss: 0.7175, test_loss: 1.1583, test_f1: 0.5926
 epoch: 43, train_loss: 0.7042, test_loss: 0.9771, test_f1: 0.5992
 epoch: 44, train_loss: 0.6872, test_loss: 0.9750, test_f1: 0.5967
 epoch: 45, train_loss: 0.6875, test_loss: 1.1504, test_f1: 0.6119
 epoch: 46, train_loss: 0.6799, test_loss: 1.0048, test_f1: 0.6122
 epoch: 47, train_loss: 0.6758, test_loss: 1.0282, test_f1: 0.6271
 epoch: 48, train_loss: 0.6777, test_loss: 1.0810, test_f1: 0.5915
 epoch: 49, train_loss: 0.7157, test_loss: 1.1327, test_f1: 0.5732
 epoch: 50, train_loss: 0.7302, test_loss: 1.4241, test_f1: 0.5469
 epoch: 51, train_loss: 0.6997, test_loss: 1.1060, test_f1: 0.6177
 epoch: 52, train_loss: 0.6451, test_loss: 1.0650, test_f1: 0.6383
 epoch: 53, train_loss: 0.6428, test_loss: 1.1438, test_f1: 0.6103
 epoch: 54, train_loss: 0.6231, test_loss: 1.1892, test_f1: 0.6164
 epoch: 55, train_loss: 0.6188, test_loss: 1.0987, test_f1: 0.6442
 epoch: 56, train_loss: 0.6246, test_loss: 1.2194, test_f1: 0.6378
 epoch: 57, train_loss: 0.5911, test_loss: 1.1670, test_f1: 0.6479
 epoch: 58, train_loss: 0.5828, test_loss: 1.1519, test_f1: 0.6293
 epoch: 59, train_loss: 0.5981, test_loss: 1.1389, test_f1: 0.6650
 epoch: 60, train_loss: 0.5954, test_loss: 1.2891, test_f1: 0.5881
 epoch: 61, train_loss: 0.5887, test_loss: 1.1957, test_f1: 0.6535
 epoch: 62, train_loss: 0.5944, test_loss: 1.2008, test_f1: 0.6653
 epoch: 63, train_loss: 0.5866, test_loss: 1.2262, test_f1: 0.6562
 epoch: 64, train_loss: 0.5723, test_loss: 1.2106, test_f1: 0.6261
 epoch: 65, train_loss: 0.5661, test_loss: 1.1624, test_f1: 0.6377
 epoch: 66, train_loss: 0.5692, test_loss: 1.2202, test_f1: 0.6398
 epoch: 67, train_loss: 0.5781, test_loss: 1.2343, test_f1: 0.6632
 epoch: 68, train_loss: 0.5613, test_loss: 1.1543, test_f1: 0.6810
 epoch: 69, train_loss: 0.5554, test_loss: 1.2651, test_f1: 0.6292
 epoch: 70, train_loss: 0.5679, test_loss: 1.2146, test_f1: 0.6226
 epoch: 71, train_loss: 0.5840, test_loss: 1.3080, test_f1: 0.6282
 epoch: 72, train_loss: 0.5488, test_loss: 1.2470, test_f1: 0.6234
 epoch: 73, train_loss: 0.5656, test_loss: 1.3192, test_f1: 0.6532
 epoch: 74, train_loss: 0.5285, test_loss: 1.1436, test_f1: 0.6614
 epoch: 75, train_loss: 0.5433, test_loss: 1.0948, test_f1: 0.6393
 epoch: 76, train_loss: 0.5462, test_loss: 1.0680, test_f1: 0.6392
 epoch: 77, train_loss: 0.5302, test_loss: 1.1005, test_f1: 0.6737
 epoch: 78, train_loss: 0.5150, test_loss: 1.1798, test_f1: 0.6392
 epoch: 79, train_loss: 0.5370, test_loss: 1.5427, test_f1: 0.5520
 epoch: 80, train_loss: 0.5335, test_loss: 1.0148, test_f1: 0.6874
 epoch: 81, train_loss: 0.5293, test_loss: 1.2832, test_f1: 0.6495
 epoch: 82, train_loss: 0.5040, test_loss: 1.1396, test_f1: 0.6535
 epoch: 83, train_loss: 0.5228, test_loss: 1.4735, test_f1: 0.6386
 epoch: 84, train_loss: 0.5164, test_loss: 1.1388, test_f1: 0.6554
 epoch: 85, train_loss: 0.5114, test_loss: 1.1552, test_f1: 0.6559
 epoch: 86, train_loss: 0.5355, test_loss: 1.6234, test_f1: 0.5852
 epoch: 87, train_loss: 0.5133, test_loss: 1.5524, test_f1: 0.6283
 epoch: 88, train_loss: 0.4878, test_loss: 1.2732, test_f1: 0.6679
 epoch: 89, train_loss: 0.4892, test_loss: 1.3697, test_f1: 0.6457
 epoch: 90, train_loss: 0.4987, test_loss: 1.3277, test_f1: 0.6672
 epoch: 91, train_loss: 0.5061, test_loss: 1.2711, test_f1: 0.6346
 epoch: 92, train_loss: 0.4932, test_loss: 1.3784, test_f1: 0.6702
 epoch: 93, train_loss: 0.4949, test_loss: 1.3265, test_f1: 0.6594
 epoch: 94, train_loss: 0.5008, test_loss: 1.1737, test_f1: 0.6607
 epoch: 95, train_loss: 0.4985, test_loss: 1.4771, test_f1: 0.6097
 epoch: 96, train_loss: 0.4803, test_loss: 1.3672, test_f1: 0.6501
 epoch: 97, train_loss: 0.4692, test_loss: 1.2893, test_f1: 0.6316
 epoch: 98, train_loss: 0.4741, test_loss: 1.3645, test_f1: 0.6692
 epoch: 99, train_loss: 0.4841, test_loss: 1.6467, test_f1: 0.6562
##################ITERATION #8 ****************************************
 epoch: 0, train_loss: 1.2518, test_loss: 1.0730, test_f1: 0.4224
 epoch: 1, train_loss: 1.0129, test_loss: 0.9939, test_f1: 0.4534
 epoch: 2, train_loss: 0.9761, test_loss: 1.0068, test_f1: 0.4770
 epoch: 3, train_loss: 0.9503, test_loss: 0.9817, test_f1: 0.5190
 epoch: 4, train_loss: 0.9381, test_loss: 1.0073, test_f1: 0.4608
 epoch: 5, train_loss: 0.9236, test_loss: 0.9837, test_f1: 0.4841
 epoch: 6, train_loss: 0.9170, test_loss: 0.9319, test_f1: 0.4970
 epoch: 7, train_loss: 0.8819, test_loss: 1.0294, test_f1: 0.4963
 epoch: 8, train_loss: 0.9130, test_loss: 0.9532, test_f1: 0.5080
 epoch: 9, train_loss: 0.8866, test_loss: 1.0388, test_f1: 0.4913
 epoch: 10, train_loss: 0.8883, test_loss: 0.9028, test_f1: 0.5400
 epoch: 11, train_loss: 0.8848, test_loss: 0.9187, test_f1: 0.4971
 epoch: 12, train_loss: 0.8676, test_loss: 1.0106, test_f1: 0.5306
 epoch: 13, train_loss: 0.8659, test_loss: 0.9756, test_f1: 0.5488
 epoch: 14, train_loss: 0.8570, test_loss: 1.0234, test_f1: 0.5467
 epoch: 15, train_loss: 0.8264, test_loss: 0.9664, test_f1: 0.5419
 epoch: 16, train_loss: 0.8239, test_loss: 1.0015, test_f1: 0.5210
 epoch: 17, train_loss: 0.8174, test_loss: 0.9992, test_f1: 0.5676
 epoch: 18, train_loss: 0.8143, test_loss: 0.9625, test_f1: 0.5473
 epoch: 19, train_loss: 0.8100, test_loss: 0.8952, test_f1: 0.5461
 epoch: 20, train_loss: 0.8019, test_loss: 0.9625, test_f1: 0.5221
 epoch: 21, train_loss: 0.7946, test_loss: 1.0981, test_f1: 0.4904
 epoch: 22, train_loss: 0.7914, test_loss: 0.9720, test_f1: 0.5900
 epoch: 23, train_loss: 0.7822, test_loss: 0.9918, test_f1: 0.5399
 epoch: 24, train_loss: 0.7751, test_loss: 1.0446, test_f1: 0.5317
 epoch: 25, train_loss: 0.7943, test_loss: 1.0603, test_f1: 0.5875
 epoch: 26, train_loss: 0.7450, test_loss: 0.9617, test_f1: 0.5823
 epoch: 27, train_loss: 0.7454, test_loss: 1.0541, test_f1: 0.5919
 epoch: 28, train_loss: 0.7247, test_loss: 1.0272, test_f1: 0.5762
 epoch: 29, train_loss: 0.7497, test_loss: 0.9763, test_f1: 0.5767
 epoch: 30, train_loss: 0.7562, test_loss: 0.9232, test_f1: 0.5727
 epoch: 31, train_loss: 0.7188, test_loss: 1.0362, test_f1: 0.6038
 epoch: 32, train_loss: 0.7028, test_loss: 0.9612, test_f1: 0.5979
 epoch: 33, train_loss: 0.7335, test_loss: 1.0202, test_f1: 0.6158
 epoch: 34, train_loss: 0.7162, test_loss: 1.1051, test_f1: 0.5581
 epoch: 35, train_loss: 0.7099, test_loss: 1.0146, test_f1: 0.6029
 epoch: 36, train_loss: 0.7091, test_loss: 0.9652, test_f1: 0.6251
 epoch: 37, train_loss: 0.7322, test_loss: 1.1514, test_f1: 0.5931
 epoch: 38, train_loss: 0.6757, test_loss: 1.0474, test_f1: 0.6160
 epoch: 39, train_loss: 0.6843, test_loss: 1.0698, test_f1: 0.5798
 epoch: 40, train_loss: 0.7070, test_loss: 1.1261, test_f1: 0.5952
 epoch: 41, train_loss: 0.6764, test_loss: 1.2119, test_f1: 0.5749
 epoch: 42, train_loss: 0.6607, test_loss: 1.1856, test_f1: 0.5852
 epoch: 43, train_loss: 0.6726, test_loss: 1.1107, test_f1: 0.6043
 epoch: 44, train_loss: 0.6521, test_loss: 1.1721, test_f1: 0.6165
 epoch: 45, train_loss: 0.6684, test_loss: 1.3359, test_f1: 0.6443
 epoch: 46, train_loss: 0.6479, test_loss: 1.2375, test_f1: 0.6520
 epoch: 47, train_loss: 0.6820, test_loss: 1.1670, test_f1: 0.6028
 epoch: 48, train_loss: 0.6661, test_loss: 1.3049, test_f1: 0.5803
 epoch: 49, train_loss: 0.7132, test_loss: 1.2623, test_f1: 0.5626
 epoch: 50, train_loss: 0.7308, test_loss: 1.0480, test_f1: 0.5487
 epoch: 51, train_loss: 0.6919, test_loss: 1.1972, test_f1: 0.6114
 epoch: 52, train_loss: 0.6390, test_loss: 1.1930, test_f1: 0.6059
 epoch: 53, train_loss: 0.6226, test_loss: 1.1956, test_f1: 0.6017
 epoch: 54, train_loss: 0.6067, test_loss: 1.2244, test_f1: 0.6135
 epoch: 55, train_loss: 0.6049, test_loss: 1.2117, test_f1: 0.6123
 epoch: 56, train_loss: 0.5930, test_loss: 1.3183, test_f1: 0.6356
 epoch: 57, train_loss: 0.5937, test_loss: 1.2830, test_f1: 0.6107
 epoch: 58, train_loss: 0.5806, test_loss: 1.2537, test_f1: 0.6043
 epoch: 59, train_loss: 0.5676, test_loss: 1.2769, test_f1: 0.6039
 epoch: 60, train_loss: 0.5674, test_loss: 1.2411, test_f1: 0.6165
 epoch: 61, train_loss: 0.5697, test_loss: 1.3352, test_f1: 0.6136
 epoch: 62, train_loss: 0.5481, test_loss: 1.3283, test_f1: 0.6293
 epoch: 63, train_loss: 0.5386, test_loss: 1.4196, test_f1: 0.6329
 epoch: 64, train_loss: 0.5419, test_loss: 1.2666, test_f1: 0.6302
 epoch: 65, train_loss: 0.5376, test_loss: 1.3444, test_f1: 0.6315
 epoch: 66, train_loss: 0.5352, test_loss: 1.3204, test_f1: 0.6618
 epoch: 67, train_loss: 0.5327, test_loss: 1.4737, test_f1: 0.5989
 epoch: 68, train_loss: 0.5282, test_loss: 1.4172, test_f1: 0.6184
 epoch: 69, train_loss: 0.5507, test_loss: 1.2788, test_f1: 0.6480
 epoch: 70, train_loss: 0.5176, test_loss: 1.4189, test_f1: 0.6161
 epoch: 71, train_loss: 0.5189, test_loss: 1.3249, test_f1: 0.6153
 epoch: 72, train_loss: 0.5174, test_loss: 1.3381, test_f1: 0.5912
 epoch: 73, train_loss: 0.5011, test_loss: 1.3488, test_f1: 0.6266
 epoch: 74, train_loss: 0.5106, test_loss: 1.4069, test_f1: 0.6363
 epoch: 75, train_loss: 0.5044, test_loss: 1.3952, test_f1: 0.6533
 epoch: 76, train_loss: 0.4966, test_loss: 1.3552, test_f1: 0.6227
 epoch: 77, train_loss: 0.4901, test_loss: 1.3260, test_f1: 0.6266
 epoch: 78, train_loss: 0.5167, test_loss: 1.4359, test_f1: 0.6115
 epoch: 79, train_loss: 0.5055, test_loss: 1.4699, test_f1: 0.5924
 epoch: 80, train_loss: 0.4882, test_loss: 1.3967, test_f1: 0.6527
 epoch: 81, train_loss: 0.4909, test_loss: 1.3859, test_f1: 0.6080
 epoch: 82, train_loss: 0.4909, test_loss: 1.3410, test_f1: 0.6503
 epoch: 83, train_loss: 0.4798, test_loss: 1.5465, test_f1: 0.5998
 epoch: 84, train_loss: 0.4958, test_loss: 1.5049, test_f1: 0.6035
 epoch: 85, train_loss: 0.4924, test_loss: 1.4111, test_f1: 0.5984
 epoch: 86, train_loss: 0.4649, test_loss: 1.4010, test_f1: 0.6350
 epoch: 87, train_loss: 0.4671, test_loss: 1.4211, test_f1: 0.6135
 epoch: 88, train_loss: 0.4799, test_loss: 1.5482, test_f1: 0.5833
 epoch: 89, train_loss: 0.4748, test_loss: 1.4973, test_f1: 0.6276
 epoch: 90, train_loss: 0.4591, test_loss: 1.4484, test_f1: 0.6228
 epoch: 91, train_loss: 0.4432, test_loss: 1.4390, test_f1: 0.6571
 epoch: 92, train_loss: 0.4458, test_loss: 1.5118, test_f1: 0.6428
 epoch: 93, train_loss: 0.4569, test_loss: 1.4676, test_f1: 0.6141
 epoch: 94, train_loss: 0.4615, test_loss: 1.5368, test_f1: 0.6155
 epoch: 95, train_loss: 0.4648, test_loss: 1.3909, test_f1: 0.6349
 epoch: 96, train_loss: 0.5092, test_loss: 1.3814, test_f1: 0.5978
 epoch: 97, train_loss: 0.4774, test_loss: 1.4496, test_f1: 0.6115
 epoch: 98, train_loss: 0.4544, test_loss: 1.4731, test_f1: 0.6318
 epoch: 99, train_loss: 0.4465, test_loss: 1.4563, test_f1: 0.6267
##################ITERATION #9 ****************************************
 epoch: 0, train_loss: 1.3121, test_loss: 1.4422, test_f1: 0.2744
 epoch: 1, train_loss: 1.0097, test_loss: 1.1915, test_f1: 0.3935
 epoch: 2, train_loss: 0.9490, test_loss: 1.0264, test_f1: 0.4551
 epoch: 3, train_loss: 0.9330, test_loss: 0.9240, test_f1: 0.5082
 epoch: 4, train_loss: 0.9085, test_loss: 0.9760, test_f1: 0.5059
 epoch: 5, train_loss: 0.9014, test_loss: 0.9633, test_f1: 0.5029
 epoch: 6, train_loss: 0.8888, test_loss: 0.9124, test_f1: 0.5142
 epoch: 7, train_loss: 0.8720, test_loss: 0.9488, test_f1: 0.5522
 epoch: 8, train_loss: 0.8645, test_loss: 0.9473, test_f1: 0.5490
 epoch: 9, train_loss: 0.8610, test_loss: 0.9894, test_f1: 0.5015
 epoch: 10, train_loss: 0.8412, test_loss: 0.9124, test_f1: 0.5229
 epoch: 11, train_loss: 0.8436, test_loss: 0.9425, test_f1: 0.5470
 epoch: 12, train_loss: 0.8295, test_loss: 0.9126, test_f1: 0.5290
 epoch: 13, train_loss: 0.8364, test_loss: 0.9936, test_f1: 0.4865
 epoch: 14, train_loss: 0.8198, test_loss: 1.0685, test_f1: 0.5190
 epoch: 15, train_loss: 0.8279, test_loss: 1.0896, test_f1: 0.5426
 epoch: 16, train_loss: 0.8216, test_loss: 0.8774, test_f1: 0.5401
 epoch: 17, train_loss: 0.8047, test_loss: 1.0304, test_f1: 0.5603
 epoch: 18, train_loss: 0.8046, test_loss: 0.9150, test_f1: 0.5778
 epoch: 19, train_loss: 0.7810, test_loss: 0.9065, test_f1: 0.6023
 epoch: 20, train_loss: 0.7879, test_loss: 0.8872, test_f1: 0.5839
 epoch: 21, train_loss: 0.7772, test_loss: 1.0199, test_f1: 0.5250
 epoch: 22, train_loss: 0.7836, test_loss: 0.9496, test_f1: 0.5735
 epoch: 23, train_loss: 0.7821, test_loss: 0.8470, test_f1: 0.5639
 epoch: 24, train_loss: 0.7777, test_loss: 16.4066, test_f1: 0.4538
 epoch: 25, train_loss: 0.8208, test_loss: 0.9995, test_f1: 0.5439
 epoch: 26, train_loss: 0.7603, test_loss: 0.9695, test_f1: 0.5875
 epoch: 27, train_loss: 0.7829, test_loss: 0.9925, test_f1: 0.5365
 epoch: 28, train_loss: 0.7649, test_loss: 0.9194, test_f1: 0.5842
 epoch: 29, train_loss: 0.7399, test_loss: 0.9662, test_f1: 0.5794
 epoch: 30, train_loss: 0.7263, test_loss: 0.9615, test_f1: 0.5580
 epoch: 31, train_loss: 0.7263, test_loss: 0.9657, test_f1: 0.5802
 epoch: 32, train_loss: 0.7189, test_loss: 0.9698, test_f1: 0.6261
 epoch: 33, train_loss: 0.7144, test_loss: 0.9754, test_f1: 0.5713
 epoch: 34, train_loss: 0.7159, test_loss: 1.0042, test_f1: 0.5720
 epoch: 35, train_loss: 0.7320, test_loss: 0.9877, test_f1: 0.6020
 epoch: 36, train_loss: 0.7172, test_loss: 1.1470, test_f1: 0.5835
 epoch: 37, train_loss: 0.7227, test_loss: 0.9545, test_f1: 0.5757
 epoch: 38, train_loss: 0.7162, test_loss: 0.9492, test_f1: 0.5372
 epoch: 39, train_loss: 0.6999, test_loss: 0.9598, test_f1: 0.5898
 epoch: 40, train_loss: 0.6867, test_loss: 0.9560, test_f1: 0.5942
 epoch: 41, train_loss: 0.6962, test_loss: 0.8807, test_f1: 0.5859
 epoch: 42, train_loss: 0.7133, test_loss: 0.9966, test_f1: 0.5931
 epoch: 43, train_loss: 0.6951, test_loss: 0.9597, test_f1: 0.5984
 epoch: 44, train_loss: 0.6804, test_loss: 1.2160, test_f1: 0.5125
 epoch: 45, train_loss: 0.6688, test_loss: 1.0322, test_f1: 0.5917
 epoch: 46, train_loss: 0.6952, test_loss: 1.0814, test_f1: 0.5940
 epoch: 47, train_loss: 0.6633, test_loss: 1.0815, test_f1: 0.5571
 epoch: 48, train_loss: 0.6735, test_loss: 1.0668, test_f1: 0.5888
 epoch: 49, train_loss: 0.6754, test_loss: 1.2149, test_f1: 0.5596
 epoch: 50, train_loss: 0.6761, test_loss: 0.9574, test_f1: 0.6417
 epoch: 51, train_loss: 0.6365, test_loss: 1.0614, test_f1: 0.5702
 epoch: 52, train_loss: 0.6285, test_loss: 0.9867, test_f1: 0.5983
 epoch: 53, train_loss: 0.5979, test_loss: 1.0274, test_f1: 0.5953
 epoch: 54, train_loss: 0.5886, test_loss: 1.0428, test_f1: 0.5827
 epoch: 55, train_loss: 0.5975, test_loss: 1.0832, test_f1: 0.5934
 epoch: 56, train_loss: 0.5883, test_loss: 0.9696, test_f1: 0.6101
 epoch: 57, train_loss: 0.5916, test_loss: 1.0705, test_f1: 0.6003
 epoch: 58, train_loss: 0.5995, test_loss: 1.0347, test_f1: 0.6003
 epoch: 59, train_loss: 0.5762, test_loss: 1.0508, test_f1: 0.5873
 epoch: 60, train_loss: 0.5804, test_loss: 1.0433, test_f1: 0.6112
 epoch: 61, train_loss: 0.5612, test_loss: 1.0704, test_f1: 0.6029
 epoch: 62, train_loss: 0.5670, test_loss: 1.0527, test_f1: 0.6187
 epoch: 63, train_loss: 0.5665, test_loss: 1.0952, test_f1: 0.5932
 epoch: 64, train_loss: 0.5616, test_loss: 1.1374, test_f1: 0.6156
 epoch: 65, train_loss: 0.5635, test_loss: 1.1541, test_f1: 0.6312
 epoch: 66, train_loss: 0.5698, test_loss: 1.0596, test_f1: 0.6222
 epoch: 67, train_loss: 0.5626, test_loss: 1.0970, test_f1: 0.5843
 epoch: 68, train_loss: 0.5565, test_loss: 1.1372, test_f1: 0.5879
 epoch: 69, train_loss: 0.5523, test_loss: 1.1765, test_f1: 0.5856
 epoch: 70, train_loss: 0.5591, test_loss: 1.1874, test_f1: 0.6029
 epoch: 71, train_loss: 0.5544, test_loss: 1.1926, test_f1: 0.6004
 epoch: 72, train_loss: 0.5497, test_loss: 1.0769, test_f1: 0.5792
 epoch: 73, train_loss: 0.5466, test_loss: 1.2546, test_f1: 0.5920
 epoch: 74, train_loss: 0.5322, test_loss: 1.1888, test_f1: 0.5996
 epoch: 75, train_loss: 0.5654, test_loss: 1.0831, test_f1: 0.6126
 epoch: 76, train_loss: 0.5404, test_loss: 1.2000, test_f1: 0.5950
 epoch: 77, train_loss: 0.5418, test_loss: 1.2608, test_f1: 0.6207
 epoch: 78, train_loss: 0.5183, test_loss: 1.2678, test_f1: 0.5864
 epoch: 79, train_loss: 0.5074, test_loss: 1.3123, test_f1: 0.6021
 epoch: 80, train_loss: 0.5193, test_loss: 1.1880, test_f1: 0.6041
 epoch: 81, train_loss: 0.5247, test_loss: 1.2334, test_f1: 0.6005
 epoch: 82, train_loss: 0.5275, test_loss: 1.3497, test_f1: 0.6211
 epoch: 83, train_loss: 0.5405, test_loss: 1.4760, test_f1: 0.6349
 epoch: 84, train_loss: 0.5299, test_loss: 1.2898, test_f1: 0.6080
 epoch: 85, train_loss: 0.5022, test_loss: 1.3125, test_f1: 0.5852
 epoch: 86, train_loss: 0.5205, test_loss: 1.3236, test_f1: 0.5865
 epoch: 87, train_loss: 0.5214, test_loss: 1.2220, test_f1: 0.6173
 epoch: 88, train_loss: 0.4864, test_loss: 1.2134, test_f1: 0.6186
 epoch: 89, train_loss: 0.4849, test_loss: 1.3107, test_f1: 0.6129
 epoch: 90, train_loss: 0.5102, test_loss: 1.3929, test_f1: 0.6141
 epoch: 91, train_loss: 0.4822, test_loss: 1.2874, test_f1: 0.6134
 epoch: 92, train_loss: 0.5018, test_loss: 1.2550, test_f1: 0.6102
 epoch: 93, train_loss: 0.5157, test_loss: 1.3774, test_f1: 0.6126
 epoch: 94, train_loss: 0.5002, test_loss: 1.3255, test_f1: 0.6098
 epoch: 95, train_loss: 0.4777, test_loss: 1.3275, test_f1: 0.6010
 epoch: 96, train_loss: 0.4959, test_loss: 1.3829, test_f1: 0.6216
 epoch: 97, train_loss: 0.5082, test_loss: 1.1856, test_f1: 0.6045
 epoch: 98, train_loss: 0.4776, test_loss: 1.2654, test_f1: 0.6426
 epoch: 99, train_loss: 0.4738, test_loss: 1.2670, test_f1: 0.6234

Training completed in 455.45 seconds
Best F1: 0.7033 at epoch 89
Mean F1 across iterations: 0.6772  0.0161
========================FINAL RESULTS================================
FEGIN weighted F1: 0.7033  0.0161
python main.py --data ltspice_examples --representation component_net --model FEGIN --layers 3 --hiddens 64 --batch_size 128 --lr 0.01 --emb_size 250 --epochs 100 --save_appendix component_net_L3_H64_BS128_LR0.01_E250 --no_val
-----



STDERR:
  File "main.py", line 370, in <module>
    main()
  File "main.py", line 254, in main
    dataset = dataset_class(
  File "/home/philip/projects/ltspice_examples_code_repo/Circuit-Completion-Using-GNNs/component_classification_with_link_prediction_head/evaluation/FEGIN/kernel/circuit_datasets.py", line 15, in __init__
    self.data, self.slices = torch.load(self.processed_paths[0])
  File "/home/philip/.local/lib/python3.8/site-packages/torch/serialization.py", line 1040, in load
    warnings.warn(
  File "/usr/lib/python3.8/warnings.py", line 109, in _showwarnmsg
    sw(msg.message, msg.category, msg.filename, msg.lineno,
  File "main.py", line 47, in warn_with_traceback
    traceback.print_stack(file=log)
/home/philip/projects/ltspice_examples_code_repo/Circuit-Completion-Using-GNNs/component_classification_with_link_prediction_head/evaluation/FEGIN/kernel/circuit_datasets.py:15: FutureWarning: You are using `torch.load` with `weights_only=False` (the current default value), which uses the default pickle module implicitly. It is possible to construct malicious pickle data which will execute arbitrary code during unpickling (See https://github.com/pytorch/pytorch/blob/main/SECURITY.md#untrusted-models for more details). In a future release, the default value for `weights_only` will be flipped to `True`. This limits the functions that could be executed during unpickling. Arbitrary objects will no longer be allowed to be loaded via this mode unless they are explicitly allowlisted by the user via `torch.serialization.add_safe_globals`. We recommend you start setting `weights_only=True` for any use case where you don't have full control of the loaded file. Please open an issue on GitHub for any issues related to this experimental feature.
  self.data, self.slices = torch.load(self.processed_paths[0])
