STDOUT:
Results will be saved in /home/philip/projects/ltspice_examples_code_repo/Circuit-Completion-Using-GNNs/component_classification_with_link_prediction_head/evaluation/FEGIN/results/model_FEGIN_dataset_ltspice_examples
Command line input: python main.py --data ltspice_examples --representation component_pin --model FEGIN --layers 3 --hiddens 32 --batch_size 128 --lr 0.01 --emb_size 128 --epochs 100 --save_appendix component_pin_L3_H32_BS128_LR0.01_E128 --no_val
 is saved.
-----
ltspice_examples - FEGIN
Using 3 layers, 32 hidden units, h = 2
Loading component_pin representation dataset
ENTERED
Training FEGIN on component_pin representation
Train: 3560, Test: 848
##################ITERATION #0 ****************************************
 epoch: 0, train_loss: 1.2488, test_loss: 1.2400, test_f1: 0.2260
 epoch: 1, train_loss: 1.1022, test_loss: 1.0587, test_f1: 0.3391
 epoch: 2, train_loss: 1.0349, test_loss: 1.0076, test_f1: 0.4652
 epoch: 3, train_loss: 0.9801, test_loss: 0.9583, test_f1: 0.4831
 epoch: 4, train_loss: 0.9403, test_loss: 0.9287, test_f1: 0.5009
 epoch: 5, train_loss: 0.9069, test_loss: 0.9121, test_f1: 0.5218
 epoch: 6, train_loss: 0.8985, test_loss: 1.0221, test_f1: 0.5065
 epoch: 7, train_loss: 0.8838, test_loss: 0.9854, test_f1: 0.4981
 epoch: 8, train_loss: 0.8608, test_loss: 0.8198, test_f1: 0.5358
 epoch: 9, train_loss: 0.8412, test_loss: 1.0109, test_f1: 0.5082
 epoch: 10, train_loss: 0.8476, test_loss: 1.1528, test_f1: 0.4280
 epoch: 11, train_loss: 0.8265, test_loss: 0.8425, test_f1: 0.5450
 epoch: 12, train_loss: 0.8137, test_loss: 0.8296, test_f1: 0.5454
 epoch: 13, train_loss: 0.8321, test_loss: 0.7746, test_f1: 0.5531
 epoch: 14, train_loss: 0.8367, test_loss: 0.8350, test_f1: 0.5064
 epoch: 15, train_loss: 0.8051, test_loss: 0.8285, test_f1: 0.5710
 epoch: 16, train_loss: 0.8025, test_loss: 1.1451, test_f1: 0.4800
 epoch: 17, train_loss: 0.7882, test_loss: 0.9488, test_f1: 0.5312
 epoch: 18, train_loss: 0.7841, test_loss: 0.8088, test_f1: 0.5595
 epoch: 19, train_loss: 0.7604, test_loss: 0.8940, test_f1: 0.5378
 epoch: 20, train_loss: 0.7641, test_loss: 1.0306, test_f1: 0.4906
 epoch: 21, train_loss: 0.7675, test_loss: 0.7867, test_f1: 0.5458
 epoch: 22, train_loss: 0.7611, test_loss: 0.8418, test_f1: 0.5695
 epoch: 23, train_loss: 0.7564, test_loss: 0.9634, test_f1: 0.5074
 epoch: 24, train_loss: 0.7408, test_loss: 0.9806, test_f1: 0.5271
 epoch: 25, train_loss: 0.7405, test_loss: 0.7963, test_f1: 0.5760
 epoch: 26, train_loss: 0.7332, test_loss: 0.9572, test_f1: 0.5762
 epoch: 27, train_loss: 0.7261, test_loss: 0.8331, test_f1: 0.5866
 epoch: 28, train_loss: 0.7401, test_loss: 0.9837, test_f1: 0.5163
 epoch: 29, train_loss: 0.7290, test_loss: 0.7360, test_f1: 0.6007
 epoch: 30, train_loss: 0.7236, test_loss: 0.8660, test_f1: 0.5851
 epoch: 31, train_loss: 0.7248, test_loss: 0.8911, test_f1: 0.5559
 epoch: 32, train_loss: 0.7022, test_loss: 0.8889, test_f1: 0.6413
 epoch: 33, train_loss: 0.6965, test_loss: 0.9070, test_f1: 0.6028
 epoch: 34, train_loss: 0.6828, test_loss: 0.8741, test_f1: 0.5413
 epoch: 35, train_loss: 0.6929, test_loss: 1.0599, test_f1: 0.5327
 epoch: 36, train_loss: 0.6875, test_loss: 0.8546, test_f1: 0.5525
 epoch: 37, train_loss: 0.6934, test_loss: 0.9264, test_f1: 0.5258
 epoch: 38, train_loss: 0.6817, test_loss: 0.8659, test_f1: 0.5821
 epoch: 39, train_loss: 0.6751, test_loss: 0.8197, test_f1: 0.6407
 epoch: 40, train_loss: 0.6667, test_loss: 0.8149, test_f1: 0.5746
 epoch: 41, train_loss: 0.6711, test_loss: 0.9502, test_f1: 0.5763
 epoch: 42, train_loss: 0.6641, test_loss: 0.8357, test_f1: 0.6204
 epoch: 43, train_loss: 0.6657, test_loss: 0.9217, test_f1: 0.6142
 epoch: 44, train_loss: 0.6559, test_loss: 0.8493, test_f1: 0.5740
 epoch: 45, train_loss: 0.6506, test_loss: 0.8655, test_f1: 0.6208
 epoch: 46, train_loss: 0.6607, test_loss: 0.9280, test_f1: 0.6211
 epoch: 47, train_loss: 0.6541, test_loss: 0.9058, test_f1: 0.6088
 epoch: 48, train_loss: 0.6503, test_loss: 0.8372, test_f1: 0.6261
 epoch: 49, train_loss: 0.6371, test_loss: 0.9359, test_f1: 0.5550
 epoch: 50, train_loss: 0.6462, test_loss: 0.8736, test_f1: 0.5985
 epoch: 51, train_loss: 0.6096, test_loss: 0.9313, test_f1: 0.6296
 epoch: 52, train_loss: 0.5825, test_loss: 0.7833, test_f1: 0.6867
 epoch: 53, train_loss: 0.5741, test_loss: 0.8789, test_f1: 0.6166
 epoch: 54, train_loss: 0.5758, test_loss: 0.8876, test_f1: 0.6370
 epoch: 55, train_loss: 0.5740, test_loss: 0.8957, test_f1: 0.6113
 epoch: 56, train_loss: 0.5615, test_loss: 0.8748, test_f1: 0.6581
 epoch: 57, train_loss: 0.5596, test_loss: 0.8759, test_f1: 0.6484
 epoch: 58, train_loss: 0.5580, test_loss: 0.9390, test_f1: 0.6207
 epoch: 59, train_loss: 0.5594, test_loss: 0.8479, test_f1: 0.6772
 epoch: 60, train_loss: 0.5513, test_loss: 0.9158, test_f1: 0.6233
 epoch: 61, train_loss: 0.5632, test_loss: 0.9973, test_f1: 0.6088
 epoch: 62, train_loss: 0.5595, test_loss: 0.8799, test_f1: 0.6509
 epoch: 63, train_loss: 0.5596, test_loss: 0.9931, test_f1: 0.6259
 epoch: 64, train_loss: 0.5341, test_loss: 0.8544, test_f1: 0.6618
 epoch: 65, train_loss: 0.5363, test_loss: 0.8511, test_f1: 0.6687
 epoch: 66, train_loss: 0.5291, test_loss: 0.8866, test_f1: 0.6528
 epoch: 67, train_loss: 0.5291, test_loss: 0.9746, test_f1: 0.6554
 epoch: 68, train_loss: 0.5350, test_loss: 0.9474, test_f1: 0.6396
 epoch: 69, train_loss: 0.5347, test_loss: 0.8946, test_f1: 0.6531
 epoch: 70, train_loss: 0.5243, test_loss: 0.9266, test_f1: 0.6471
 epoch: 71, train_loss: 0.5403, test_loss: 0.8553, test_f1: 0.6512
 epoch: 72, train_loss: 0.5565, test_loss: 0.8877, test_f1: 0.6528
 epoch: 73, train_loss: 0.5165, test_loss: 0.8714, test_f1: 0.6357
 epoch: 74, train_loss: 0.5191, test_loss: 0.9906, test_f1: 0.6517
 epoch: 75, train_loss: 0.5181, test_loss: 0.8257, test_f1: 0.6645
 epoch: 76, train_loss: 0.5042, test_loss: 0.9318, test_f1: 0.6607
 epoch: 77, train_loss: 0.5098, test_loss: 0.9339, test_f1: 0.6566
 epoch: 78, train_loss: 0.4925, test_loss: 0.9963, test_f1: 0.6410
 epoch: 79, train_loss: 0.5046, test_loss: 1.0397, test_f1: 0.6310
 epoch: 80, train_loss: 0.5098, test_loss: 1.0115, test_f1: 0.6547
 epoch: 81, train_loss: 0.5235, test_loss: 0.9321, test_f1: 0.6509
 epoch: 82, train_loss: 0.5035, test_loss: 1.0060, test_f1: 0.6539
 epoch: 83, train_loss: 0.4991, test_loss: 0.9915, test_f1: 0.6407
 epoch: 84, train_loss: 0.4985, test_loss: 0.9678, test_f1: 0.6396
 epoch: 85, train_loss: 0.4776, test_loss: 0.9121, test_f1: 0.6472
 epoch: 86, train_loss: 0.4876, test_loss: 0.9679, test_f1: 0.6328
 epoch: 87, train_loss: 0.5085, test_loss: 0.8772, test_f1: 0.6392
 epoch: 88, train_loss: 0.4899, test_loss: 1.0146, test_f1: 0.6393
 epoch: 89, train_loss: 0.4905, test_loss: 0.9808, test_f1: 0.6182
 epoch: 90, train_loss: 0.4945, test_loss: 0.9242, test_f1: 0.6610
 epoch: 91, train_loss: 0.4757, test_loss: 1.0157, test_f1: 0.6417
 epoch: 92, train_loss: 0.4911, test_loss: 1.2110, test_f1: 0.6132
 epoch: 93, train_loss: 0.4680, test_loss: 0.8476, test_f1: 0.6414
 epoch: 94, train_loss: 0.4943, test_loss: 0.9868, test_f1: 0.6241
 epoch: 95, train_loss: 0.4771, test_loss: 0.8458, test_f1: 0.6543
 epoch: 96, train_loss: 0.4919, test_loss: 0.8818, test_f1: 0.6675
 epoch: 97, train_loss: 0.4672, test_loss: 0.9397, test_f1: 0.6599
 epoch: 98, train_loss: 0.4620, test_loss: 0.8541, test_f1: 0.6687
 epoch: 99, train_loss: 0.5014, test_loss: 1.0589, test_f1: 0.6187
##################ITERATION #1 ****************************************
 epoch: 0, train_loss: 1.2264, test_loss: 1.0975, test_f1: 0.3940
 epoch: 1, train_loss: 1.0355, test_loss: 1.3323, test_f1: 0.3697
 epoch: 2, train_loss: 0.9906, test_loss: 1.0381, test_f1: 0.4594
 epoch: 3, train_loss: 0.9623, test_loss: 1.0040, test_f1: 0.4774
 epoch: 4, train_loss: 0.9333, test_loss: 0.9908, test_f1: 0.4692
 epoch: 5, train_loss: 0.9196, test_loss: 0.9651, test_f1: 0.4954
 epoch: 6, train_loss: 0.9149, test_loss: 0.9667, test_f1: 0.5255
 epoch: 7, train_loss: 0.9064, test_loss: 0.9237, test_f1: 0.5227
 epoch: 8, train_loss: 0.8898, test_loss: 0.9159, test_f1: 0.5669
 epoch: 9, train_loss: 0.8554, test_loss: 0.9198, test_f1: 0.5292
 epoch: 10, train_loss: 0.8784, test_loss: 0.9655, test_f1: 0.5772
 epoch: 11, train_loss: 0.8609, test_loss: 1.0595, test_f1: 0.4416
 epoch: 12, train_loss: 0.8320, test_loss: 0.9582, test_f1: 0.5156
 epoch: 13, train_loss: 0.8313, test_loss: 0.9214, test_f1: 0.5333
 epoch: 14, train_loss: 0.8283, test_loss: 0.9887, test_f1: 0.5773
 epoch: 15, train_loss: 0.8067, test_loss: 0.9598, test_f1: 0.5089
 epoch: 16, train_loss: 0.8111, test_loss: 0.9220, test_f1: 0.5873
 epoch: 17, train_loss: 0.8011, test_loss: 0.8850, test_f1: 0.5744
 epoch: 18, train_loss: 0.7902, test_loss: 1.0648, test_f1: 0.4925
 epoch: 19, train_loss: 0.7925, test_loss: 0.9063, test_f1: 0.5126
 epoch: 20, train_loss: 0.7949, test_loss: 0.8564, test_f1: 0.5931
 epoch: 21, train_loss: 0.7665, test_loss: 0.9964, test_f1: 0.5033
 epoch: 22, train_loss: 0.7687, test_loss: 0.9797, test_f1: 0.5052
 epoch: 23, train_loss: 0.7693, test_loss: 0.9999, test_f1: 0.5546
 epoch: 24, train_loss: 0.7729, test_loss: 1.2457, test_f1: 0.4422
 epoch: 25, train_loss: 0.7753, test_loss: 1.1841, test_f1: 0.4820
 epoch: 26, train_loss: 0.7564, test_loss: 0.8848, test_f1: 0.5568
 epoch: 27, train_loss: 0.7640, test_loss: 0.8755, test_f1: 0.5510
 epoch: 28, train_loss: 0.7474, test_loss: 1.0308, test_f1: 0.5604
 epoch: 29, train_loss: 0.7303, test_loss: 1.0431, test_f1: 0.5388
 epoch: 30, train_loss: 0.7308, test_loss: 0.8800, test_f1: 0.5874
 epoch: 31, train_loss: 0.7294, test_loss: 1.0537, test_f1: 0.5764
 epoch: 32, train_loss: 0.7156, test_loss: 0.9087, test_f1: 0.5702
 epoch: 33, train_loss: 0.7448, test_loss: 0.9003, test_f1: 0.5553
 epoch: 34, train_loss: 0.7228, test_loss: 0.8704, test_f1: 0.5803
 epoch: 35, train_loss: 0.7185, test_loss: 0.8890, test_f1: 0.5958
 epoch: 36, train_loss: 0.7015, test_loss: 0.9057, test_f1: 0.6013
 epoch: 37, train_loss: 0.7092, test_loss: 0.9395, test_f1: 0.6289
 epoch: 38, train_loss: 0.7295, test_loss: 0.9318, test_f1: 0.5657
 epoch: 39, train_loss: 0.6940, test_loss: 1.0452, test_f1: 0.5615
 epoch: 40, train_loss: 0.6956, test_loss: 0.9947, test_f1: 0.5842
 epoch: 41, train_loss: 0.6823, test_loss: 0.9322, test_f1: 0.5640
 epoch: 42, train_loss: 0.6739, test_loss: 1.0265, test_f1: 0.5738
 epoch: 43, train_loss: 0.6616, test_loss: 0.8643, test_f1: 0.6319
 epoch: 44, train_loss: 0.6716, test_loss: 0.8781, test_f1: 0.6641
 epoch: 45, train_loss: 0.6708, test_loss: 0.8284, test_f1: 0.6139
 epoch: 46, train_loss: 0.6456, test_loss: 0.8828, test_f1: 0.5860
 epoch: 47, train_loss: 0.6466, test_loss: 0.9048, test_f1: 0.5934
 epoch: 48, train_loss: 0.6624, test_loss: 0.9568, test_f1: 0.5824
 epoch: 49, train_loss: 0.6452, test_loss: 0.9339, test_f1: 0.6292
 epoch: 50, train_loss: 0.6666, test_loss: 0.8781, test_f1: 0.6013
 epoch: 51, train_loss: 0.6091, test_loss: 0.8995, test_f1: 0.6592
 epoch: 52, train_loss: 0.6041, test_loss: 0.9423, test_f1: 0.6273
 epoch: 53, train_loss: 0.5815, test_loss: 0.9152, test_f1: 0.6472
 epoch: 54, train_loss: 0.5797, test_loss: 0.9980, test_f1: 0.6002
 epoch: 55, train_loss: 0.5918, test_loss: 0.9127, test_f1: 0.6219
 epoch: 56, train_loss: 0.5591, test_loss: 0.9309, test_f1: 0.6280
 epoch: 57, train_loss: 0.5684, test_loss: 0.9524, test_f1: 0.6182
 epoch: 58, train_loss: 0.5698, test_loss: 0.9667, test_f1: 0.6822
 epoch: 59, train_loss: 0.5548, test_loss: 1.0485, test_f1: 0.6183
 epoch: 60, train_loss: 0.5721, test_loss: 0.9632, test_f1: 0.6301
 epoch: 61, train_loss: 0.5642, test_loss: 0.9385, test_f1: 0.6413
 epoch: 62, train_loss: 0.5740, test_loss: 0.9460, test_f1: 0.6495
 epoch: 63, train_loss: 0.5550, test_loss: 0.9262, test_f1: 0.6481
 epoch: 64, train_loss: 0.5424, test_loss: 0.9873, test_f1: 0.6371
 epoch: 65, train_loss: 0.5498, test_loss: 1.0839, test_f1: 0.6182
 epoch: 66, train_loss: 0.5399, test_loss: 0.9875, test_f1: 0.6267
 epoch: 67, train_loss: 0.5430, test_loss: 0.9051, test_f1: 0.6465
 epoch: 68, train_loss: 0.5257, test_loss: 0.9840, test_f1: 0.6194
 epoch: 69, train_loss: 0.5374, test_loss: 0.9757, test_f1: 0.6229
 epoch: 70, train_loss: 0.5403, test_loss: 0.9811, test_f1: 0.6730
 epoch: 71, train_loss: 0.5409, test_loss: 1.0726, test_f1: 0.6073
 epoch: 72, train_loss: 0.5286, test_loss: 1.0433, test_f1: 0.6142
 epoch: 73, train_loss: 0.5283, test_loss: 0.9827, test_f1: 0.6400
 epoch: 74, train_loss: 0.5508, test_loss: 0.9764, test_f1: 0.6234
 epoch: 75, train_loss: 0.5354, test_loss: 1.0469, test_f1: 0.6324
 epoch: 76, train_loss: 0.5153, test_loss: 0.9756, test_f1: 0.6192
 epoch: 77, train_loss: 0.5119, test_loss: 1.0261, test_f1: 0.6368
 epoch: 78, train_loss: 0.5106, test_loss: 0.8940, test_f1: 0.6619
 epoch: 79, train_loss: 0.5007, test_loss: 0.9396, test_f1: 0.6682
 epoch: 80, train_loss: 0.5204, test_loss: 1.0060, test_f1: 0.6044
 epoch: 81, train_loss: 0.5133, test_loss: 0.9551, test_f1: 0.6202
 epoch: 82, train_loss: 0.5029, test_loss: 0.9497, test_f1: 0.6531
 epoch: 83, train_loss: 0.5142, test_loss: 1.0008, test_f1: 0.6545
 epoch: 84, train_loss: 0.5006, test_loss: 1.0858, test_f1: 0.6362
 epoch: 85, train_loss: 0.5064, test_loss: 0.9784, test_f1: 0.6492
 epoch: 86, train_loss: 0.5216, test_loss: 1.0266, test_f1: 0.6405
 epoch: 87, train_loss: 0.5122, test_loss: 1.0467, test_f1: 0.6207
 epoch: 88, train_loss: 0.5070, test_loss: 1.0283, test_f1: 0.6344
 epoch: 89, train_loss: 0.4854, test_loss: 1.0366, test_f1: 0.6104
 epoch: 90, train_loss: 0.4796, test_loss: 1.1067, test_f1: 0.5824
 epoch: 91, train_loss: 0.5060, test_loss: 0.9574, test_f1: 0.6548
 epoch: 92, train_loss: 0.4856, test_loss: 0.9924, test_f1: 0.6440
 epoch: 93, train_loss: 0.4720, test_loss: 0.9993, test_f1: 0.6093
 epoch: 94, train_loss: 0.4989, test_loss: 1.0130, test_f1: 0.6422
 epoch: 95, train_loss: 0.5035, test_loss: 0.9915, test_f1: 0.6471
 epoch: 96, train_loss: 0.4958, test_loss: 1.0169, test_f1: 0.6356
 epoch: 97, train_loss: 0.4815, test_loss: 0.9614, test_f1: 0.6639
 epoch: 98, train_loss: 0.4882, test_loss: 0.9224, test_f1: 0.6366
 epoch: 99, train_loss: 0.4875, test_loss: 0.9651, test_f1: 0.6675
##################ITERATION #2 ****************************************
 epoch: 0, train_loss: 1.1280, test_loss: 1.0478, test_f1: 0.3878
 epoch: 1, train_loss: 1.0006, test_loss: 0.9786, test_f1: 0.5252
 epoch: 2, train_loss: 0.9456, test_loss: 0.9823, test_f1: 0.5247
 epoch: 3, train_loss: 0.9259, test_loss: 0.9579, test_f1: 0.5444
 epoch: 4, train_loss: 0.9136, test_loss: 1.0253, test_f1: 0.4807
 epoch: 5, train_loss: 0.8890, test_loss: 1.0315, test_f1: 0.4614
 epoch: 6, train_loss: 0.8856, test_loss: 0.9374, test_f1: 0.4967
 epoch: 7, train_loss: 0.8746, test_loss: 0.9356, test_f1: 0.5107
 epoch: 8, train_loss: 0.8627, test_loss: 1.0696, test_f1: 0.4855
 epoch: 9, train_loss: 0.8515, test_loss: 0.8936, test_f1: 0.5730
 epoch: 10, train_loss: 0.8339, test_loss: 0.9372, test_f1: 0.5336
 epoch: 11, train_loss: 0.8325, test_loss: 0.8877, test_f1: 0.5511
 epoch: 12, train_loss: 0.8079, test_loss: 0.8593, test_f1: 0.6137
 epoch: 13, train_loss: 0.8251, test_loss: 0.8654, test_f1: 0.5460
 epoch: 14, train_loss: 0.8074, test_loss: 0.9336, test_f1: 0.5362
 epoch: 15, train_loss: 0.8041, test_loss: 0.9184, test_f1: 0.5671
 epoch: 16, train_loss: 0.8087, test_loss: 0.8584, test_f1: 0.5823
 epoch: 17, train_loss: 0.7898, test_loss: 0.8477, test_f1: 0.5710
 epoch: 18, train_loss: 0.8154, test_loss: 0.9179, test_f1: 0.5197
 epoch: 19, train_loss: 0.7727, test_loss: 0.8978, test_f1: 0.5344
 epoch: 20, train_loss: 0.7632, test_loss: 0.8779, test_f1: 0.5518
 epoch: 21, train_loss: 0.7744, test_loss: 0.9118, test_f1: 0.5825
 epoch: 22, train_loss: 0.7467, test_loss: 0.8932, test_f1: 0.5854
 epoch: 23, train_loss: 0.7513, test_loss: 0.9193, test_f1: 0.5489
 epoch: 24, train_loss: 0.7594, test_loss: 1.1080, test_f1: 0.5100
 epoch: 25, train_loss: 0.7366, test_loss: 0.9810, test_f1: 0.5606
 epoch: 26, train_loss: 0.7638, test_loss: 0.8606, test_f1: 0.5580
 epoch: 27, train_loss: 0.7484, test_loss: 0.9795, test_f1: 0.5197
 epoch: 28, train_loss: 0.7396, test_loss: 0.9736, test_f1: 0.5840
 epoch: 29, train_loss: 0.7313, test_loss: 0.8548, test_f1: 0.6231
 epoch: 30, train_loss: 0.7207, test_loss: 0.8425, test_f1: 0.5992
 epoch: 31, train_loss: 0.7239, test_loss: 0.9077, test_f1: 0.5859
 epoch: 32, train_loss: 0.7195, test_loss: 0.9152, test_f1: 0.5974
 epoch: 33, train_loss: 0.7108, test_loss: 0.8236, test_f1: 0.6225
 epoch: 34, train_loss: 0.7303, test_loss: 0.9083, test_f1: 0.5813
 epoch: 35, train_loss: 0.7271, test_loss: 1.1223, test_f1: 0.5484
 epoch: 36, train_loss: 0.7183, test_loss: 0.8217, test_f1: 0.5944
 epoch: 37, train_loss: 0.6939, test_loss: 0.9665, test_f1: 0.5891
 epoch: 38, train_loss: 0.7125, test_loss: 0.8474, test_f1: 0.6337
 epoch: 39, train_loss: 0.6884, test_loss: 1.0220, test_f1: 0.5606
 epoch: 40, train_loss: 0.6888, test_loss: 0.9443, test_f1: 0.5495
 epoch: 41, train_loss: 0.6835, test_loss: 1.0653, test_f1: 0.5274
 epoch: 42, train_loss: 0.6776, test_loss: 0.9951, test_f1: 0.5961
 epoch: 43, train_loss: 0.6961, test_loss: 0.9267, test_f1: 0.6232
 epoch: 44, train_loss: 0.6869, test_loss: 0.8800, test_f1: 0.6045
 epoch: 45, train_loss: 0.6789, test_loss: 0.9287, test_f1: 0.5816
 epoch: 46, train_loss: 0.6809, test_loss: 1.0234, test_f1: 0.5626
 epoch: 47, train_loss: 0.6733, test_loss: 0.9509, test_f1: 0.6138
 epoch: 48, train_loss: 0.6761, test_loss: 0.8470, test_f1: 0.6456
 epoch: 49, train_loss: 0.6646, test_loss: 0.9709, test_f1: 0.5644
 epoch: 50, train_loss: 0.6535, test_loss: 0.8529, test_f1: 0.6255
 epoch: 51, train_loss: 0.6354, test_loss: 1.0134, test_f1: 0.6060
 epoch: 52, train_loss: 0.6147, test_loss: 0.9392, test_f1: 0.6184
 epoch: 53, train_loss: 0.6054, test_loss: 0.9001, test_f1: 0.6262
 epoch: 54, train_loss: 0.6031, test_loss: 0.9475, test_f1: 0.6407
 epoch: 55, train_loss: 0.6070, test_loss: 0.9537, test_f1: 0.6121
 epoch: 56, train_loss: 0.6054, test_loss: 0.9037, test_f1: 0.6230
 epoch: 57, train_loss: 0.5985, test_loss: 0.9760, test_f1: 0.5986
 epoch: 58, train_loss: 0.5855, test_loss: 1.0740, test_f1: 0.5945
 epoch: 59, train_loss: 0.5941, test_loss: 0.8365, test_f1: 0.6069
 epoch: 60, train_loss: 0.6104, test_loss: 0.9678, test_f1: 0.6311
 epoch: 61, train_loss: 0.5909, test_loss: 1.0333, test_f1: 0.6270
 epoch: 62, train_loss: 0.5911, test_loss: 0.9804, test_f1: 0.5628
 epoch: 63, train_loss: 0.5829, test_loss: 0.9031, test_f1: 0.6517
 epoch: 64, train_loss: 0.5701, test_loss: 1.0029, test_f1: 0.5793
 epoch: 65, train_loss: 0.5719, test_loss: 0.8456, test_f1: 0.6731
 epoch: 66, train_loss: 0.5753, test_loss: 0.9650, test_f1: 0.6330
 epoch: 67, train_loss: 0.5813, test_loss: 0.9267, test_f1: 0.6461
 epoch: 68, train_loss: 0.5834, test_loss: 1.0343, test_f1: 0.5972
 epoch: 69, train_loss: 0.5681, test_loss: 0.8136, test_f1: 0.6683
 epoch: 70, train_loss: 0.5723, test_loss: 0.9519, test_f1: 0.6293
 epoch: 71, train_loss: 0.5651, test_loss: 0.8484, test_f1: 0.6502
 epoch: 72, train_loss: 0.5735, test_loss: 0.9785, test_f1: 0.6188
 epoch: 73, train_loss: 0.5522, test_loss: 0.9997, test_f1: 0.6570
 epoch: 74, train_loss: 0.5629, test_loss: 1.1097, test_f1: 0.6191
 epoch: 75, train_loss: 0.5866, test_loss: 1.2099, test_f1: 0.5746
 epoch: 76, train_loss: 0.5575, test_loss: 0.8586, test_f1: 0.6388
 epoch: 77, train_loss: 0.5549, test_loss: 1.0977, test_f1: 0.5707
 epoch: 78, train_loss: 0.5550, test_loss: 0.8239, test_f1: 0.6454
 epoch: 79, train_loss: 0.5411, test_loss: 0.9650, test_f1: 0.6412
 epoch: 80, train_loss: 0.5552, test_loss: 1.0078, test_f1: 0.6029
 epoch: 81, train_loss: 0.5637, test_loss: 0.9107, test_f1: 0.5956
 epoch: 82, train_loss: 0.5562, test_loss: 0.9778, test_f1: 0.6275
 epoch: 83, train_loss: 0.5552, test_loss: 0.8903, test_f1: 0.6217
 epoch: 84, train_loss: 0.5441, test_loss: 0.9289, test_f1: 0.6072
 epoch: 85, train_loss: 0.5461, test_loss: 0.9101, test_f1: 0.6415
 epoch: 86, train_loss: 0.5513, test_loss: 1.0842, test_f1: 0.5481
 epoch: 87, train_loss: 0.5531, test_loss: 1.0185, test_f1: 0.5918
 epoch: 88, train_loss: 0.5387, test_loss: 1.0215, test_f1: 0.6049
 epoch: 89, train_loss: 0.5418, test_loss: 1.0157, test_f1: 0.6290
 epoch: 90, train_loss: 0.5400, test_loss: 0.8410, test_f1: 0.6649
 epoch: 91, train_loss: 0.5349, test_loss: 0.9740, test_f1: 0.6362
 epoch: 92, train_loss: 0.5261, test_loss: 0.8476, test_f1: 0.6333
 epoch: 93, train_loss: 0.5183, test_loss: 0.9450, test_f1: 0.6075
 epoch: 94, train_loss: 0.5358, test_loss: 1.0544, test_f1: 0.6144
 epoch: 95, train_loss: 0.5309, test_loss: 0.8790, test_f1: 0.6445
 epoch: 96, train_loss: 0.5130, test_loss: 1.0085, test_f1: 0.6229
 epoch: 97, train_loss: 0.5303, test_loss: 0.8826, test_f1: 0.6402
 epoch: 98, train_loss: 0.5397, test_loss: 0.8382, test_f1: 0.6274
 epoch: 99, train_loss: 0.5242, test_loss: 0.9836, test_f1: 0.5990
##################ITERATION #3 ****************************************
 epoch: 0, train_loss: 1.1742, test_loss: 1.1215, test_f1: 0.3920
 epoch: 1, train_loss: 1.0289, test_loss: 1.1375, test_f1: 0.4005
 epoch: 2, train_loss: 0.9867, test_loss: 1.0590, test_f1: 0.4422
 epoch: 3, train_loss: 0.9477, test_loss: 1.0867, test_f1: 0.4735
 epoch: 4, train_loss: 0.9452, test_loss: 0.9976, test_f1: 0.4934
 epoch: 5, train_loss: 0.9069, test_loss: 1.5455, test_f1: 0.3735
 epoch: 6, train_loss: 0.9088, test_loss: 1.0353, test_f1: 0.4657
 epoch: 7, train_loss: 0.8995, test_loss: 0.9463, test_f1: 0.5414
 epoch: 8, train_loss: 0.8677, test_loss: 0.9735, test_f1: 0.4654
 epoch: 9, train_loss: 0.8431, test_loss: 0.9150, test_f1: 0.5386
 epoch: 10, train_loss: 0.8410, test_loss: 1.0667, test_f1: 0.5214
 epoch: 11, train_loss: 0.8301, test_loss: 0.9352, test_f1: 0.5553
 epoch: 12, train_loss: 0.8270, test_loss: 0.9712, test_f1: 0.4989
 epoch: 13, train_loss: 0.8187, test_loss: 0.9178, test_f1: 0.5400
 epoch: 14, train_loss: 0.8015, test_loss: 0.9094, test_f1: 0.5254
 epoch: 15, train_loss: 0.7996, test_loss: 0.8771, test_f1: 0.5422
 epoch: 16, train_loss: 0.7857, test_loss: 1.0312, test_f1: 0.5711
 epoch: 17, train_loss: 0.7907, test_loss: 1.0432, test_f1: 0.4740
 epoch: 18, train_loss: 0.7766, test_loss: 0.8593, test_f1: 0.5459
 epoch: 19, train_loss: 0.7683, test_loss: 0.9203, test_f1: 0.5522
 epoch: 20, train_loss: 0.7696, test_loss: 0.8470, test_f1: 0.5689
 epoch: 21, train_loss: 0.7430, test_loss: 0.8267, test_f1: 0.5525
 epoch: 22, train_loss: 0.7498, test_loss: 1.0333, test_f1: 0.5079
 epoch: 23, train_loss: 0.7407, test_loss: 0.8748, test_f1: 0.5758
 epoch: 24, train_loss: 0.7331, test_loss: 0.9174, test_f1: 0.5911
 epoch: 25, train_loss: 0.7332, test_loss: 0.8819, test_f1: 0.5783
 epoch: 26, train_loss: 0.7358, test_loss: 0.9932, test_f1: 0.5703
 epoch: 27, train_loss: 0.7225, test_loss: 0.9856, test_f1: 0.5613
 epoch: 28, train_loss: 0.7218, test_loss: 1.1072, test_f1: 0.5477
 epoch: 29, train_loss: 0.7210, test_loss: 0.8809, test_f1: 0.5791
 epoch: 30, train_loss: 0.7188, test_loss: 0.9305, test_f1: 0.5608
 epoch: 31, train_loss: 0.7140, test_loss: 0.8555, test_f1: 0.5831
 epoch: 32, train_loss: 0.7051, test_loss: 0.8874, test_f1: 0.5945
 epoch: 33, train_loss: 0.7039, test_loss: 0.8982, test_f1: 0.5900
 epoch: 34, train_loss: 0.6865, test_loss: 0.8957, test_f1: 0.5783
 epoch: 35, train_loss: 0.6930, test_loss: 0.9794, test_f1: 0.5780
 epoch: 36, train_loss: 0.7038, test_loss: 0.9053, test_f1: 0.5807
 epoch: 37, train_loss: 0.7040, test_loss: 0.8403, test_f1: 0.5834
 epoch: 38, train_loss: 0.6739, test_loss: 0.9843, test_f1: 0.5317
 epoch: 39, train_loss: 0.6655, test_loss: 0.9260, test_f1: 0.6067
 epoch: 40, train_loss: 0.6783, test_loss: 0.8624, test_f1: 0.6240
 epoch: 41, train_loss: 0.6769, test_loss: 0.8831, test_f1: 0.5521
 epoch: 42, train_loss: 0.6682, test_loss: 0.9018, test_f1: 0.5727
 epoch: 43, train_loss: 0.6615, test_loss: 0.9942, test_f1: 0.6010
 epoch: 44, train_loss: 0.6331, test_loss: 1.0679, test_f1: 0.5927
 epoch: 45, train_loss: 0.6523, test_loss: 1.2305, test_f1: 0.5268
 epoch: 46, train_loss: 0.6615, test_loss: 0.9301, test_f1: 0.6041
 epoch: 47, train_loss: 0.6864, test_loss: 0.9323, test_f1: 0.5451
 epoch: 48, train_loss: 0.6550, test_loss: 0.9846, test_f1: 0.5984
 epoch: 49, train_loss: 0.6384, test_loss: 1.0928, test_f1: 0.5741
 epoch: 50, train_loss: 0.6682, test_loss: 0.9455, test_f1: 0.6156
 epoch: 51, train_loss: 0.6197, test_loss: 1.0434, test_f1: 0.5668
 epoch: 52, train_loss: 0.6120, test_loss: 0.9328, test_f1: 0.6094
 epoch: 53, train_loss: 0.5931, test_loss: 0.9047, test_f1: 0.6243
 epoch: 54, train_loss: 0.5881, test_loss: 1.0018, test_f1: 0.6135
 epoch: 55, train_loss: 0.5869, test_loss: 0.9253, test_f1: 0.6031
 epoch: 56, train_loss: 0.5808, test_loss: 0.9638, test_f1: 0.6085
 epoch: 57, train_loss: 0.5875, test_loss: 0.9541, test_f1: 0.5925
 epoch: 58, train_loss: 0.5763, test_loss: 1.0208, test_f1: 0.6046
 epoch: 59, train_loss: 0.5846, test_loss: 0.9626, test_f1: 0.5960
 epoch: 60, train_loss: 0.5833, test_loss: 1.0868, test_f1: 0.5792
 epoch: 61, train_loss: 0.5588, test_loss: 0.9875, test_f1: 0.5941
 epoch: 62, train_loss: 0.5756, test_loss: 1.0237, test_f1: 0.6038
 epoch: 63, train_loss: 0.5810, test_loss: 1.0387, test_f1: 0.5970
 epoch: 64, train_loss: 0.5806, test_loss: 1.0555, test_f1: 0.5920
 epoch: 65, train_loss: 0.5940, test_loss: 0.9531, test_f1: 0.6267
 epoch: 66, train_loss: 0.5738, test_loss: 1.0285, test_f1: 0.6017
 epoch: 67, train_loss: 0.5587, test_loss: 1.0334, test_f1: 0.6024
 epoch: 68, train_loss: 0.5410, test_loss: 1.0456, test_f1: 0.6122
 epoch: 69, train_loss: 0.5579, test_loss: 0.9988, test_f1: 0.5966
 epoch: 70, train_loss: 0.5582, test_loss: 1.1659, test_f1: 0.5698
 epoch: 71, train_loss: 0.5582, test_loss: 1.1251, test_f1: 0.5919
 epoch: 72, train_loss: 0.5510, test_loss: 1.0923, test_f1: 0.6051
 epoch: 73, train_loss: 0.5603, test_loss: 1.0029, test_f1: 0.6228
 epoch: 74, train_loss: 0.5565, test_loss: 1.0433, test_f1: 0.6093
 epoch: 75, train_loss: 0.5467, test_loss: 1.0351, test_f1: 0.6410
 epoch: 76, train_loss: 0.5345, test_loss: 1.0058, test_f1: 0.6386
 epoch: 77, train_loss: 0.5409, test_loss: 1.0938, test_f1: 0.6281
 epoch: 78, train_loss: 0.5308, test_loss: 1.0557, test_f1: 0.6055
 epoch: 79, train_loss: 0.5473, test_loss: 1.0806, test_f1: 0.6362
 epoch: 80, train_loss: 0.5253, test_loss: 1.0714, test_f1: 0.6412
 epoch: 81, train_loss: 0.5272, test_loss: 1.0701, test_f1: 0.6134
 epoch: 82, train_loss: 0.5227, test_loss: 1.2158, test_f1: 0.6065
 epoch: 83, train_loss: 0.5315, test_loss: 1.0193, test_f1: 0.6541
 epoch: 84, train_loss: 0.5156, test_loss: 1.0383, test_f1: 0.6414
 epoch: 85, train_loss: 0.5017, test_loss: 1.8513, test_f1: 0.4831
 epoch: 86, train_loss: 0.5156, test_loss: 1.5171, test_f1: 0.5396
 epoch: 87, train_loss: 0.5265, test_loss: 1.1225, test_f1: 0.6310
 epoch: 88, train_loss: 0.5156, test_loss: 1.0987, test_f1: 0.6264
 epoch: 89, train_loss: 0.5185, test_loss: 1.0411, test_f1: 0.6515
 epoch: 90, train_loss: 0.5092, test_loss: 1.1246, test_f1: 0.6356
 epoch: 91, train_loss: 0.5263, test_loss: 1.1040, test_f1: 0.6351
 epoch: 92, train_loss: 0.5259, test_loss: 1.1386, test_f1: 0.6156
 epoch: 93, train_loss: 0.5108, test_loss: 1.2604, test_f1: 0.6208
 epoch: 94, train_loss: 0.5191, test_loss: 1.1787, test_f1: 0.6210
 epoch: 95, train_loss: 0.5020, test_loss: 1.1299, test_f1: 0.6218
 epoch: 96, train_loss: 0.5074, test_loss: 1.1096, test_f1: 0.6374
 epoch: 97, train_loss: 0.5167, test_loss: 1.1475, test_f1: 0.6244
 epoch: 98, train_loss: 0.4931, test_loss: 1.2484, test_f1: 0.6086
 epoch: 99, train_loss: 0.5039, test_loss: 1.2385, test_f1: 0.6496
##################ITERATION #4 ****************************************
 epoch: 0, train_loss: 1.1677, test_loss: 1.1223, test_f1: 0.4623
 epoch: 1, train_loss: 1.0194, test_loss: 1.0403, test_f1: 0.4479
 epoch: 2, train_loss: 0.9908, test_loss: 0.9822, test_f1: 0.4797
 epoch: 3, train_loss: 0.9616, test_loss: 1.0579, test_f1: 0.4577
 epoch: 4, train_loss: 0.9445, test_loss: 0.9270, test_f1: 0.5053
 epoch: 5, train_loss: 0.9165, test_loss: 1.0749, test_f1: 0.4428
 epoch: 6, train_loss: 0.9082, test_loss: 0.9654, test_f1: 0.4752
 epoch: 7, train_loss: 0.8939, test_loss: 1.4242, test_f1: 0.3945
 epoch: 8, train_loss: 0.8799, test_loss: 0.8929, test_f1: 0.5652
 epoch: 9, train_loss: 0.8504, test_loss: 0.9527, test_f1: 0.5122
 epoch: 10, train_loss: 0.8476, test_loss: 0.9902, test_f1: 0.4844
 epoch: 11, train_loss: 0.8266, test_loss: 0.9777, test_f1: 0.4978
 epoch: 12, train_loss: 0.8331, test_loss: 0.9459, test_f1: 0.5456
 epoch: 13, train_loss: 0.8129, test_loss: 1.0085, test_f1: 0.5278
 epoch: 14, train_loss: 0.8323, test_loss: 1.1142, test_f1: 0.4719
 epoch: 15, train_loss: 0.8225, test_loss: 0.8978, test_f1: 0.5760
 epoch: 16, train_loss: 0.8211, test_loss: 0.8717, test_f1: 0.5545
 epoch: 17, train_loss: 0.7763, test_loss: 0.9675, test_f1: 0.5407
 epoch: 18, train_loss: 0.7797, test_loss: 0.9758, test_f1: 0.4968
 epoch: 19, train_loss: 0.7864, test_loss: 0.9704, test_f1: 0.5206
 epoch: 20, train_loss: 0.7752, test_loss: 1.0633, test_f1: 0.5260
 epoch: 21, train_loss: 0.7734, test_loss: 0.9279, test_f1: 0.5684
 epoch: 22, train_loss: 0.7805, test_loss: 0.8788, test_f1: 0.5955
 epoch: 23, train_loss: 0.7774, test_loss: 0.9161, test_f1: 0.5306
 epoch: 24, train_loss: 0.7526, test_loss: 0.9025, test_f1: 0.5510
 epoch: 25, train_loss: 0.7597, test_loss: 0.9462, test_f1: 0.5938
 epoch: 26, train_loss: 0.7363, test_loss: 0.8818, test_f1: 0.6474
 epoch: 27, train_loss: 0.7477, test_loss: 0.9105, test_f1: 0.6174
 epoch: 28, train_loss: 0.7493, test_loss: 1.0250, test_f1: 0.5812
 epoch: 29, train_loss: 0.7231, test_loss: 0.9853, test_f1: 0.6047
 epoch: 30, train_loss: 0.7063, test_loss: 0.9254, test_f1: 0.6151
 epoch: 31, train_loss: 0.7333, test_loss: 1.2353, test_f1: 0.5642
 epoch: 32, train_loss: 0.7140, test_loss: 0.9317, test_f1: 0.6618
 epoch: 33, train_loss: 0.7129, test_loss: 0.9659, test_f1: 0.6330
 epoch: 34, train_loss: 0.7027, test_loss: 1.1837, test_f1: 0.5669
 epoch: 35, train_loss: 0.7095, test_loss: 0.9577, test_f1: 0.5841
 epoch: 36, train_loss: 0.7006, test_loss: 1.1181, test_f1: 0.5950
 epoch: 37, train_loss: 0.6986, test_loss: 0.9905, test_f1: 0.6446
 epoch: 38, train_loss: 0.6881, test_loss: 0.9192, test_f1: 0.7072
 epoch: 39, train_loss: 0.6859, test_loss: 1.1331, test_f1: 0.5739
 epoch: 40, train_loss: 0.6854, test_loss: 0.9107, test_f1: 0.6609
 epoch: 41, train_loss: 0.6704, test_loss: 1.0886, test_f1: 0.5931
 epoch: 42, train_loss: 0.6747, test_loss: 1.0075, test_f1: 0.6017
 epoch: 43, train_loss: 0.6788, test_loss: 1.0058, test_f1: 0.6500
 epoch: 44, train_loss: 0.6726, test_loss: 0.9736, test_f1: 0.6143
 epoch: 45, train_loss: 0.6656, test_loss: 0.9916, test_f1: 0.6440
 epoch: 46, train_loss: 0.6626, test_loss: 0.9254, test_f1: 0.6119
 epoch: 47, train_loss: 0.6622, test_loss: 0.9951, test_f1: 0.6047
 epoch: 48, train_loss: 0.6645, test_loss: 1.3101, test_f1: 0.5085
 epoch: 49, train_loss: 0.6657, test_loss: 1.1556, test_f1: 0.5958
 epoch: 50, train_loss: 0.6671, test_loss: 0.9273, test_f1: 0.6003
 epoch: 51, train_loss: 0.6335, test_loss: 0.9384, test_f1: 0.6634
 epoch: 52, train_loss: 0.6037, test_loss: 0.9052, test_f1: 0.6570
 epoch: 53, train_loss: 0.5927, test_loss: 0.9449, test_f1: 0.6634
 epoch: 54, train_loss: 0.6092, test_loss: 0.9474, test_f1: 0.6722
 epoch: 55, train_loss: 0.5829, test_loss: 0.9348, test_f1: 0.6582
 epoch: 56, train_loss: 0.5845, test_loss: 0.9484, test_f1: 0.6262
 epoch: 57, train_loss: 0.5761, test_loss: 1.0267, test_f1: 0.6464
 epoch: 58, train_loss: 0.5768, test_loss: 1.0340, test_f1: 0.6694
 epoch: 59, train_loss: 0.5733, test_loss: 1.1154, test_f1: 0.6504
 epoch: 60, train_loss: 0.5779, test_loss: 0.9711, test_f1: 0.6404
 epoch: 61, train_loss: 0.5751, test_loss: 0.9628, test_f1: 0.6455
 epoch: 62, train_loss: 0.5648, test_loss: 1.0142, test_f1: 0.6689
 epoch: 63, train_loss: 0.5643, test_loss: 1.0925, test_f1: 0.6616
 epoch: 64, train_loss: 0.5652, test_loss: 1.0024, test_f1: 0.6515
 epoch: 65, train_loss: 0.5807, test_loss: 1.0859, test_f1: 0.6429
 epoch: 66, train_loss: 0.5629, test_loss: 1.1888, test_f1: 0.6285
 epoch: 67, train_loss: 0.5660, test_loss: 1.0593, test_f1: 0.6494
 epoch: 68, train_loss: 0.5724, test_loss: 1.0429, test_f1: 0.6771
 epoch: 69, train_loss: 0.5509, test_loss: 1.1820, test_f1: 0.6253
 epoch: 70, train_loss: 0.5684, test_loss: 1.0740, test_f1: 0.6563
 epoch: 71, train_loss: 0.5401, test_loss: 1.2599, test_f1: 0.6293
 epoch: 72, train_loss: 0.5710, test_loss: 1.2246, test_f1: 0.5972
 epoch: 73, train_loss: 0.5354, test_loss: 1.0671, test_f1: 0.6627
 epoch: 74, train_loss: 0.5532, test_loss: 1.1764, test_f1: 0.6630
 epoch: 75, train_loss: 0.5371, test_loss: 1.1333, test_f1: 0.6616
 epoch: 76, train_loss: 0.5390, test_loss: 1.2325, test_f1: 0.6518
 epoch: 77, train_loss: 0.5413, test_loss: 1.1365, test_f1: 0.7020
 epoch: 78, train_loss: 0.5457, test_loss: 1.1467, test_f1: 0.6440
 epoch: 79, train_loss: 0.5448, test_loss: 1.1414, test_f1: 0.6723
 epoch: 80, train_loss: 0.5427, test_loss: 1.1085, test_f1: 0.6357
 epoch: 81, train_loss: 0.5373, test_loss: 1.1895, test_f1: 0.6563
 epoch: 82, train_loss: 0.5198, test_loss: 1.1873, test_f1: 0.6791
 epoch: 83, train_loss: 0.5292, test_loss: 1.3187, test_f1: 0.6353
 epoch: 84, train_loss: 0.4994, test_loss: 1.2582, test_f1: 0.6556
 epoch: 85, train_loss: 0.5262, test_loss: 1.2708, test_f1: 0.6311
 epoch: 86, train_loss: 0.5391, test_loss: 1.1304, test_f1: 0.6671
 epoch: 87, train_loss: 0.5532, test_loss: 1.1893, test_f1: 0.6223
 epoch: 88, train_loss: 0.5360, test_loss: 1.2929, test_f1: 0.6405
 epoch: 89, train_loss: 0.5052, test_loss: 1.2957, test_f1: 0.6310
 epoch: 90, train_loss: 0.5003, test_loss: 1.1165, test_f1: 0.6496
 epoch: 91, train_loss: 0.5156, test_loss: 1.2589, test_f1: 0.6499
 epoch: 92, train_loss: 0.4964, test_loss: 1.2647, test_f1: 0.6587
 epoch: 93, train_loss: 0.5133, test_loss: 1.1023, test_f1: 0.6614
 epoch: 94, train_loss: 0.5061, test_loss: 1.2325, test_f1: 0.6583
 epoch: 95, train_loss: 0.4898, test_loss: 1.2555, test_f1: 0.6449
 epoch: 96, train_loss: 0.4955, test_loss: 1.2978, test_f1: 0.6684
 epoch: 97, train_loss: 0.5052, test_loss: 1.2559, test_f1: 0.6700
 epoch: 98, train_loss: 0.4765, test_loss: 1.1483, test_f1: 0.6778
 epoch: 99, train_loss: 0.5005, test_loss: 1.3560, test_f1: 0.6197
##################ITERATION #5 ****************************************
 epoch: 0, train_loss: 1.1719, test_loss: 1.0840, test_f1: 0.3538
 epoch: 1, train_loss: 1.0354, test_loss: 1.1875, test_f1: 0.3768
 epoch: 2, train_loss: 0.9995, test_loss: 1.0664, test_f1: 0.4774
 epoch: 3, train_loss: 0.9778, test_loss: 1.0331, test_f1: 0.5025
 epoch: 4, train_loss: 0.9729, test_loss: 1.0708, test_f1: 0.4472
 epoch: 5, train_loss: 0.9392, test_loss: 0.9951, test_f1: 0.5160
 epoch: 6, train_loss: 0.9221, test_loss: 1.0213, test_f1: 0.5216
 epoch: 7, train_loss: 0.9158, test_loss: 1.3944, test_f1: 0.4073
 epoch: 8, train_loss: 0.9017, test_loss: 0.9616, test_f1: 0.5067
 epoch: 9, train_loss: 0.8768, test_loss: 1.2500, test_f1: 0.4548
 epoch: 10, train_loss: 0.8743, test_loss: 1.1167, test_f1: 0.5127
 epoch: 11, train_loss: 0.8737, test_loss: 0.9343, test_f1: 0.5466
 epoch: 12, train_loss: 0.8316, test_loss: 1.0733, test_f1: 0.4784
 epoch: 13, train_loss: 0.8284, test_loss: 1.0566, test_f1: 0.4675
 epoch: 14, train_loss: 0.7927, test_loss: 0.9022, test_f1: 0.5356
 epoch: 15, train_loss: 0.8178, test_loss: 0.8882, test_f1: 0.5608
 epoch: 16, train_loss: 0.8153, test_loss: 0.9461, test_f1: 0.5615
 epoch: 17, train_loss: 0.7959, test_loss: 0.9604, test_f1: 0.5362
 epoch: 18, train_loss: 0.7962, test_loss: 0.9717, test_f1: 0.5233
 epoch: 19, train_loss: 0.7937, test_loss: 0.9476, test_f1: 0.5297
 epoch: 20, train_loss: 0.7778, test_loss: 0.9819, test_f1: 0.5077
 epoch: 21, train_loss: 0.7696, test_loss: 0.9540, test_f1: 0.5234
 epoch: 22, train_loss: 0.7556, test_loss: 0.9083, test_f1: 0.4981
 epoch: 23, train_loss: 0.7709, test_loss: 0.8077, test_f1: 0.5883
 epoch: 24, train_loss: 0.7373, test_loss: 0.9300, test_f1: 0.5894
 epoch: 25, train_loss: 0.7265, test_loss: 0.9477, test_f1: 0.5302
 epoch: 26, train_loss: 0.7309, test_loss: 0.9356, test_f1: 0.5794
 epoch: 27, train_loss: 0.7168, test_loss: 0.8925, test_f1: 0.5843
 epoch: 28, train_loss: 0.7328, test_loss: 0.9022, test_f1: 0.5956
 epoch: 29, train_loss: 0.7373, test_loss: 0.9094, test_f1: 0.5666
 epoch: 30, train_loss: 0.7365, test_loss: 0.9607, test_f1: 0.5902
 epoch: 31, train_loss: 0.7384, test_loss: 0.9433, test_f1: 0.5202
 epoch: 32, train_loss: 0.7259, test_loss: 0.9224, test_f1: 0.5709
 epoch: 33, train_loss: 0.7138, test_loss: 0.9222, test_f1: 0.6035
 epoch: 34, train_loss: 0.7118, test_loss: 0.9158, test_f1: 0.6011
 epoch: 35, train_loss: 0.7128, test_loss: 0.8890, test_f1: 0.5893
 epoch: 36, train_loss: 0.6870, test_loss: 0.8650, test_f1: 0.6266
 epoch: 37, train_loss: 0.6871, test_loss: 0.8757, test_f1: 0.5190
 epoch: 38, train_loss: 0.6896, test_loss: 0.9138, test_f1: 0.5779
 epoch: 39, train_loss: 0.6948, test_loss: 0.7822, test_f1: 0.6234
 epoch: 40, train_loss: 0.6814, test_loss: 0.8430, test_f1: 0.5878
 epoch: 41, train_loss: 0.6747, test_loss: 0.8712, test_f1: 0.5946
 epoch: 42, train_loss: 0.6725, test_loss: 0.8840, test_f1: 0.5734
 epoch: 43, train_loss: 0.7013, test_loss: 1.1740, test_f1: 0.5388
 epoch: 44, train_loss: 0.6788, test_loss: 0.8152, test_f1: 0.5797
 epoch: 45, train_loss: 0.6837, test_loss: 0.9189, test_f1: 0.5496
 epoch: 46, train_loss: 0.6628, test_loss: 0.9198, test_f1: 0.5654
 epoch: 47, train_loss: 0.6641, test_loss: 0.8153, test_f1: 0.6297
 epoch: 48, train_loss: 0.6770, test_loss: 0.9021, test_f1: 0.5966
 epoch: 49, train_loss: 0.6457, test_loss: 0.9158, test_f1: 0.5387
 epoch: 50, train_loss: 0.6634, test_loss: 0.9104, test_f1: 0.5604
 epoch: 51, train_loss: 0.6384, test_loss: 0.8540, test_f1: 0.6319
 epoch: 52, train_loss: 0.6112, test_loss: 0.8315, test_f1: 0.6520
 epoch: 53, train_loss: 0.5938, test_loss: 0.8301, test_f1: 0.6120
 epoch: 54, train_loss: 0.6058, test_loss: 0.8401, test_f1: 0.6061
 epoch: 55, train_loss: 0.5899, test_loss: 0.8531, test_f1: 0.5924
 epoch: 56, train_loss: 0.5933, test_loss: 0.8786, test_f1: 0.5713
 epoch: 57, train_loss: 0.5916, test_loss: 0.8726, test_f1: 0.6119
 epoch: 58, train_loss: 0.5810, test_loss: 0.8298, test_f1: 0.6420
 epoch: 59, train_loss: 0.5849, test_loss: 0.9071, test_f1: 0.6138
 epoch: 60, train_loss: 0.5774, test_loss: 0.8176, test_f1: 0.6416
 epoch: 61, train_loss: 0.5662, test_loss: 0.8723, test_f1: 0.6652
 epoch: 62, train_loss: 0.5739, test_loss: 0.7898, test_f1: 0.6288
 epoch: 63, train_loss: 0.5633, test_loss: 0.8176, test_f1: 0.6223
 epoch: 64, train_loss: 0.5787, test_loss: 0.8603, test_f1: 0.6157
 epoch: 65, train_loss: 0.5548, test_loss: 0.8476, test_f1: 0.6404
 epoch: 66, train_loss: 0.5770, test_loss: 0.7756, test_f1: 0.6498
 epoch: 67, train_loss: 0.5789, test_loss: 0.8504, test_f1: 0.6176
 epoch: 68, train_loss: 0.5730, test_loss: 0.8504, test_f1: 0.6438
 epoch: 69, train_loss: 0.5653, test_loss: 0.9069, test_f1: 0.6370
 epoch: 70, train_loss: 0.5654, test_loss: 0.8549, test_f1: 0.6482
 epoch: 71, train_loss: 0.5708, test_loss: 0.7919, test_f1: 0.6565
 epoch: 72, train_loss: 0.5524, test_loss: 0.9714, test_f1: 0.6045
 epoch: 73, train_loss: 0.5452, test_loss: 0.8887, test_f1: 0.6581
 epoch: 74, train_loss: 0.5562, test_loss: 0.9006, test_f1: 0.6500
 epoch: 75, train_loss: 0.5421, test_loss: 0.8886, test_f1: 0.6356
 epoch: 76, train_loss: 0.5313, test_loss: 0.9105, test_f1: 0.6270
 epoch: 77, train_loss: 0.5399, test_loss: 0.9423, test_f1: 0.5884
 epoch: 78, train_loss: 0.5370, test_loss: 0.9198, test_f1: 0.6414
 epoch: 79, train_loss: 0.5288, test_loss: 0.8923, test_f1: 0.6335
 epoch: 80, train_loss: 0.5285, test_loss: 0.8437, test_f1: 0.6802
 epoch: 81, train_loss: 0.5312, test_loss: 0.8836, test_f1: 0.6452
 epoch: 82, train_loss: 0.5354, test_loss: 0.9434, test_f1: 0.6520
 epoch: 83, train_loss: 0.6349, test_loss: 0.9449, test_f1: 0.6132
 epoch: 84, train_loss: 0.5797, test_loss: 0.8832, test_f1: 0.6369
 epoch: 85, train_loss: 0.5715, test_loss: 1.1126, test_f1: 0.5885
 epoch: 86, train_loss: 0.5599, test_loss: 0.9419, test_f1: 0.6237
 epoch: 87, train_loss: 0.5682, test_loss: 0.9447, test_f1: 0.6415
 epoch: 88, train_loss: 0.5490, test_loss: 0.8996, test_f1: 0.6030
 epoch: 89, train_loss: 0.5194, test_loss: 0.8944, test_f1: 0.6585
 epoch: 90, train_loss: 0.5202, test_loss: 0.9289, test_f1: 0.6537
 epoch: 91, train_loss: 0.5207, test_loss: 0.8541, test_f1: 0.6511
 epoch: 92, train_loss: 0.5122, test_loss: 0.9689, test_f1: 0.6355
 epoch: 93, train_loss: 0.5216, test_loss: 0.8519, test_f1: 0.6302
 epoch: 94, train_loss: 0.5163, test_loss: 0.8545, test_f1: 0.6430
 epoch: 95, train_loss: 0.5047, test_loss: 0.8467, test_f1: 0.6320
 epoch: 96, train_loss: 0.5189, test_loss: 0.9397, test_f1: 0.6581
 epoch: 97, train_loss: 0.5041, test_loss: 0.8530, test_f1: 0.6550
 epoch: 98, train_loss: 0.5217, test_loss: 0.8942, test_f1: 0.6497
 epoch: 99, train_loss: 0.5134, test_loss: 0.9608, test_f1: 0.6286
##################ITERATION #6 ****************************************
 epoch: 0, train_loss: 1.1781, test_loss: 1.1528, test_f1: 0.3914
 epoch: 1, train_loss: 0.9875, test_loss: 1.0652, test_f1: 0.4664
 epoch: 2, train_loss: 0.9458, test_loss: 0.9834, test_f1: 0.5287
 epoch: 3, train_loss: 0.9200, test_loss: 0.9639, test_f1: 0.5517
 epoch: 4, train_loss: 0.8997, test_loss: 1.0486, test_f1: 0.4978
 epoch: 5, train_loss: 0.9010, test_loss: 0.9429, test_f1: 0.5608
 epoch: 6, train_loss: 0.8951, test_loss: 0.9047, test_f1: 0.5867
 epoch: 7, train_loss: 0.8617, test_loss: 0.8950, test_f1: 0.5374
 epoch: 8, train_loss: 0.8630, test_loss: 1.1021, test_f1: 0.4973
 epoch: 9, train_loss: 0.8378, test_loss: 0.9099, test_f1: 0.5328
 epoch: 10, train_loss: 0.8354, test_loss: 0.9599, test_f1: 0.5588
 epoch: 11, train_loss: 0.8321, test_loss: 1.0336, test_f1: 0.5016
 epoch: 12, train_loss: 0.8068, test_loss: 0.8974, test_f1: 0.6040
 epoch: 13, train_loss: 0.8027, test_loss: 0.8535, test_f1: 0.5539
 epoch: 14, train_loss: 0.7939, test_loss: 1.1200, test_f1: 0.4677
 epoch: 15, train_loss: 0.7825, test_loss: 0.9202, test_f1: 0.6108
 epoch: 16, train_loss: 0.7701, test_loss: 0.9128, test_f1: 0.5700
 epoch: 17, train_loss: 0.7750, test_loss: 0.9142, test_f1: 0.5755
 epoch: 18, train_loss: 0.7348, test_loss: 0.9615, test_f1: 0.5362
 epoch: 19, train_loss: 0.7458, test_loss: 0.9405, test_f1: 0.6012
 epoch: 20, train_loss: 0.7500, test_loss: 0.8662, test_f1: 0.6044
 epoch: 21, train_loss: 0.7433, test_loss: 0.9058, test_f1: 0.5857
 epoch: 22, train_loss: 0.7530, test_loss: 0.8861, test_f1: 0.6017
 epoch: 23, train_loss: 0.7307, test_loss: 0.9036, test_f1: 0.6050
 epoch: 24, train_loss: 0.7314, test_loss: 0.9207, test_f1: 0.5823
 epoch: 25, train_loss: 0.7304, test_loss: 0.9176, test_f1: 0.6181
 epoch: 26, train_loss: 0.7257, test_loss: 0.9385, test_f1: 0.5665
 epoch: 27, train_loss: 0.6986, test_loss: 0.9386, test_f1: 0.6131
 epoch: 28, train_loss: 0.6896, test_loss: 0.8270, test_f1: 0.6159
 epoch: 29, train_loss: 0.6813, test_loss: 0.8589, test_f1: 0.6365
 epoch: 30, train_loss: 0.7173, test_loss: 0.9745, test_f1: 0.5674
 epoch: 31, train_loss: 0.6877, test_loss: 0.9199, test_f1: 0.6358
 epoch: 32, train_loss: 0.6921, test_loss: 0.9642, test_f1: 0.6154
 epoch: 33, train_loss: 0.6857, test_loss: 0.9403, test_f1: 0.6209
 epoch: 34, train_loss: 0.6503, test_loss: 0.9372, test_f1: 0.6604
 epoch: 35, train_loss: 0.6636, test_loss: 0.9774, test_f1: 0.5740
 epoch: 36, train_loss: 0.6722, test_loss: 1.2709, test_f1: 0.5189
 epoch: 37, train_loss: 0.6542, test_loss: 1.0359, test_f1: 0.6022
 epoch: 38, train_loss: 0.6656, test_loss: 0.9588, test_f1: 0.6446
 epoch: 39, train_loss: 0.6587, test_loss: 0.9891, test_f1: 0.5910
 epoch: 40, train_loss: 0.6370, test_loss: 1.1252, test_f1: 0.5869
 epoch: 41, train_loss: 0.6579, test_loss: 0.9324, test_f1: 0.6206
 epoch: 42, train_loss: 0.6412, test_loss: 1.0648, test_f1: 0.5603
 epoch: 43, train_loss: 0.6540, test_loss: 0.8754, test_f1: 0.6492
 epoch: 44, train_loss: 0.6386, test_loss: 0.8796, test_f1: 0.6463
 epoch: 45, train_loss: 0.6248, test_loss: 0.9299, test_f1: 0.6446
 epoch: 46, train_loss: 0.6212, test_loss: 0.9614, test_f1: 0.6139
 epoch: 47, train_loss: 0.6158, test_loss: 1.2313, test_f1: 0.6051
 epoch: 48, train_loss: 0.6323, test_loss: 0.9028, test_f1: 0.6669
 epoch: 49, train_loss: 0.6323, test_loss: 1.1216, test_f1: 0.6014
 epoch: 50, train_loss: 0.6291, test_loss: 0.9761, test_f1: 0.6584
 epoch: 51, train_loss: 0.5852, test_loss: 0.9970, test_f1: 0.6147
 epoch: 52, train_loss: 0.5712, test_loss: 1.0133, test_f1: 0.6051
 epoch: 53, train_loss: 0.5504, test_loss: 0.9906, test_f1: 0.6269
 epoch: 54, train_loss: 0.5575, test_loss: 1.0881, test_f1: 0.6377
 epoch: 55, train_loss: 0.5655, test_loss: 1.1057, test_f1: 0.6196
 epoch: 56, train_loss: 0.5570, test_loss: 1.0259, test_f1: 0.6366
 epoch: 57, train_loss: 0.5578, test_loss: 0.9823, test_f1: 0.6225
 epoch: 58, train_loss: 0.5379, test_loss: 1.0330, test_f1: 0.6182
 epoch: 59, train_loss: 0.5354, test_loss: 1.0213, test_f1: 0.6488
 epoch: 60, train_loss: 0.5370, test_loss: 1.1551, test_f1: 0.5967
 epoch: 61, train_loss: 0.5344, test_loss: 1.0632, test_f1: 0.6374
 epoch: 62, train_loss: 0.5208, test_loss: 1.0141, test_f1: 0.6424
 epoch: 63, train_loss: 0.5251, test_loss: 1.0099, test_f1: 0.6372
 epoch: 64, train_loss: 0.5323, test_loss: 0.9932, test_f1: 0.6392
 epoch: 65, train_loss: 0.5346, test_loss: 1.0247, test_f1: 0.6393
 epoch: 66, train_loss: 0.5046, test_loss: 0.9737, test_f1: 0.6600
 epoch: 67, train_loss: 0.5315, test_loss: 0.9943, test_f1: 0.6391
 epoch: 68, train_loss: 0.5229, test_loss: 1.0671, test_f1: 0.6195
 epoch: 69, train_loss: 0.5168, test_loss: 1.0284, test_f1: 0.6459
 epoch: 70, train_loss: 0.5055, test_loss: 1.0691, test_f1: 0.6135
 epoch: 71, train_loss: 0.5137, test_loss: 1.0258, test_f1: 0.6626
 epoch: 72, train_loss: 0.5045, test_loss: 0.9876, test_f1: 0.6323
 epoch: 73, train_loss: 0.5234, test_loss: 1.0839, test_f1: 0.6216
 epoch: 74, train_loss: 0.5265, test_loss: 1.0170, test_f1: 0.6665
 epoch: 75, train_loss: 0.5082, test_loss: 1.0613, test_f1: 0.6108
 epoch: 76, train_loss: 0.5019, test_loss: 0.9998, test_f1: 0.6505
 epoch: 77, train_loss: 0.4891, test_loss: 1.0180, test_f1: 0.5943
 epoch: 78, train_loss: 0.4989, test_loss: 0.9434, test_f1: 0.6521
 epoch: 79, train_loss: 0.5025, test_loss: 1.0804, test_f1: 0.6195
 epoch: 80, train_loss: 0.5005, test_loss: 1.0180, test_f1: 0.6233
 epoch: 81, train_loss: 0.4757, test_loss: 1.0323, test_f1: 0.6184
 epoch: 82, train_loss: 0.5002, test_loss: 0.9992, test_f1: 0.6679
 epoch: 83, train_loss: 0.5107, test_loss: 1.0559, test_f1: 0.6238
 epoch: 84, train_loss: 0.4934, test_loss: 0.9613, test_f1: 0.6527
 epoch: 85, train_loss: 0.4936, test_loss: 1.0364, test_f1: 0.6371
 epoch: 86, train_loss: 0.4923, test_loss: 1.0584, test_f1: 0.6316
 epoch: 87, train_loss: 0.4977, test_loss: 1.0321, test_f1: 0.6627
 epoch: 88, train_loss: 0.4846, test_loss: 1.0291, test_f1: 0.6154
 epoch: 89, train_loss: 0.4906, test_loss: 1.1188, test_f1: 0.6423
 epoch: 90, train_loss: 0.4702, test_loss: 1.0793, test_f1: 0.6373
 epoch: 91, train_loss: 0.4693, test_loss: 1.1102, test_f1: 0.6333
 epoch: 92, train_loss: 0.4552, test_loss: 1.1827, test_f1: 0.6277
 epoch: 93, train_loss: 0.4655, test_loss: 1.1297, test_f1: 0.6101
 epoch: 94, train_loss: 0.4855, test_loss: 1.0656, test_f1: 0.6642
 epoch: 95, train_loss: 0.4726, test_loss: 1.1038, test_f1: 0.6390
 epoch: 96, train_loss: 0.4722, test_loss: 1.0605, test_f1: 0.6117
 epoch: 97, train_loss: 0.4841, test_loss: 1.1444, test_f1: 0.6045
 epoch: 98, train_loss: 0.4590, test_loss: 1.1108, test_f1: 0.6371
 epoch: 99, train_loss: 0.4767, test_loss: 1.1235, test_f1: 0.6149
##################ITERATION #7 ****************************************
 epoch: 0, train_loss: 1.1602, test_loss: 1.1220, test_f1: 0.3814
 epoch: 1, train_loss: 1.0005, test_loss: 1.1196, test_f1: 0.4628
 epoch: 2, train_loss: 0.9562, test_loss: 1.0619, test_f1: 0.4918
 epoch: 3, train_loss: 0.9337, test_loss: 0.9968, test_f1: 0.4672
 epoch: 4, train_loss: 0.9001, test_loss: 1.1103, test_f1: 0.4355
 epoch: 5, train_loss: 0.8815, test_loss: 0.9925, test_f1: 0.4936
 epoch: 6, train_loss: 0.8685, test_loss: 0.9420, test_f1: 0.5445
 epoch: 7, train_loss: 0.8434, test_loss: 0.9954, test_f1: 0.5541
 epoch: 8, train_loss: 0.8555, test_loss: 0.9824, test_f1: 0.4937
 epoch: 9, train_loss: 0.8376, test_loss: 1.0033, test_f1: 0.5430
 epoch: 10, train_loss: 0.8172, test_loss: 0.9659, test_f1: 0.5913
 epoch: 11, train_loss: 0.8126, test_loss: 1.1014, test_f1: 0.4588
 epoch: 12, train_loss: 0.8087, test_loss: 0.8932, test_f1: 0.5814
 epoch: 13, train_loss: 0.7954, test_loss: 0.9064, test_f1: 0.6164
 epoch: 14, train_loss: 0.7947, test_loss: 1.0119, test_f1: 0.5139
 epoch: 15, train_loss: 0.7561, test_loss: 0.9498, test_f1: 0.5868
 epoch: 16, train_loss: 0.7578, test_loss: 0.9668, test_f1: 0.5820
 epoch: 17, train_loss: 0.7570, test_loss: 1.0219, test_f1: 0.5751
 epoch: 18, train_loss: 0.7696, test_loss: 0.9358, test_f1: 0.5668
 epoch: 19, train_loss: 0.7650, test_loss: 0.8816, test_f1: 0.5824
 epoch: 20, train_loss: 0.7315, test_loss: 0.9793, test_f1: 0.5269
 epoch: 21, train_loss: 0.7451, test_loss: 1.0430, test_f1: 0.5758
 epoch: 22, train_loss: 0.7577, test_loss: 1.0139, test_f1: 0.5331
 epoch: 23, train_loss: 0.7194, test_loss: 1.0412, test_f1: 0.5364
 epoch: 24, train_loss: 0.7338, test_loss: 0.9060, test_f1: 0.5698
 epoch: 25, train_loss: 0.7225, test_loss: 0.9245, test_f1: 0.6040
 epoch: 26, train_loss: 0.7300, test_loss: 0.9070, test_f1: 0.6175
 epoch: 27, train_loss: 0.7159, test_loss: 1.0093, test_f1: 0.5809
 epoch: 28, train_loss: 0.7044, test_loss: 0.9425, test_f1: 0.5763
 epoch: 29, train_loss: 0.6994, test_loss: 1.3962, test_f1: 0.5095
 epoch: 30, train_loss: 0.6944, test_loss: 0.9765, test_f1: 0.5757
 epoch: 31, train_loss: 0.7124, test_loss: 1.0016, test_f1: 0.5512
 epoch: 32, train_loss: 0.7004, test_loss: 0.8955, test_f1: 0.5601
 epoch: 33, train_loss: 0.7067, test_loss: 1.0075, test_f1: 0.6067
 epoch: 34, train_loss: 0.7169, test_loss: 0.9773, test_f1: 0.6474
 epoch: 35, train_loss: 0.7159, test_loss: 0.9162, test_f1: 0.5882
 epoch: 36, train_loss: 0.6763, test_loss: 1.0196, test_f1: 0.6336
 epoch: 37, train_loss: 0.6714, test_loss: 0.9830, test_f1: 0.6229
 epoch: 38, train_loss: 0.6734, test_loss: 1.1046, test_f1: 0.5932
 epoch: 39, train_loss: 0.6756, test_loss: 1.0682, test_f1: 0.6169
 epoch: 40, train_loss: 0.6591, test_loss: 1.0701, test_f1: 0.6048
 epoch: 41, train_loss: 0.6485, test_loss: 1.0009, test_f1: 0.6313
 epoch: 42, train_loss: 0.6558, test_loss: 1.0085, test_f1: 0.6096
 epoch: 43, train_loss: 0.6562, test_loss: 1.2069, test_f1: 0.5525
 epoch: 44, train_loss: 0.6794, test_loss: 1.0082, test_f1: 0.5819
 epoch: 45, train_loss: 0.6761, test_loss: 0.9456, test_f1: 0.6556
 epoch: 46, train_loss: 0.6804, test_loss: 1.0246, test_f1: 0.6291
 epoch: 47, train_loss: 0.6399, test_loss: 1.0775, test_f1: 0.6305
 epoch: 48, train_loss: 0.6094, test_loss: 1.0903, test_f1: 0.6198
 epoch: 49, train_loss: 0.6464, test_loss: 0.9799, test_f1: 0.6105
 epoch: 50, train_loss: 0.6432, test_loss: 1.7436, test_f1: 0.4058
 epoch: 51, train_loss: 0.6072, test_loss: 0.9788, test_f1: 0.6374
 epoch: 52, train_loss: 0.5875, test_loss: 1.0391, test_f1: 0.6476
 epoch: 53, train_loss: 0.5811, test_loss: 1.0369, test_f1: 0.6521
 epoch: 54, train_loss: 0.5682, test_loss: 1.1448, test_f1: 0.6561
 epoch: 55, train_loss: 0.5786, test_loss: 1.0012, test_f1: 0.6701
 epoch: 56, train_loss: 0.5705, test_loss: 1.0747, test_f1: 0.6478
 epoch: 57, train_loss: 0.5683, test_loss: 1.0648, test_f1: 0.6438
 epoch: 58, train_loss: 0.5623, test_loss: 1.1059, test_f1: 0.6791
 epoch: 59, train_loss: 0.5687, test_loss: 1.1164, test_f1: 0.6394
 epoch: 60, train_loss: 0.5623, test_loss: 0.9834, test_f1: 0.6471
 epoch: 61, train_loss: 0.5577, test_loss: 0.9554, test_f1: 0.6804
 epoch: 62, train_loss: 0.5398, test_loss: 1.0426, test_f1: 0.6491
 epoch: 63, train_loss: 0.5438, test_loss: 1.2470, test_f1: 0.6504
 epoch: 64, train_loss: 0.5567, test_loss: 1.1877, test_f1: 0.6421
 epoch: 65, train_loss: 0.5599, test_loss: 1.1379, test_f1: 0.6813
 epoch: 66, train_loss: 0.5268, test_loss: 1.0495, test_f1: 0.6825
 epoch: 67, train_loss: 0.5267, test_loss: 1.0958, test_f1: 0.6710
 epoch: 68, train_loss: 0.5477, test_loss: 1.1725, test_f1: 0.6317
 epoch: 69, train_loss: 0.5448, test_loss: 1.1233, test_f1: 0.6898
 epoch: 70, train_loss: 0.5535, test_loss: 1.0961, test_f1: 0.6681
 epoch: 71, train_loss: 0.5131, test_loss: 1.0766, test_f1: 0.6916
 epoch: 72, train_loss: 0.5244, test_loss: 1.1299, test_f1: 0.6537
 epoch: 73, train_loss: 0.5287, test_loss: 1.1136, test_f1: 0.6314
 epoch: 74, train_loss: 0.5183, test_loss: 1.1929, test_f1: 0.6473
 epoch: 75, train_loss: 0.5350, test_loss: 1.3840, test_f1: 0.5858
 epoch: 76, train_loss: 0.5376, test_loss: 1.1855, test_f1: 0.6893
 epoch: 77, train_loss: 0.5224, test_loss: 1.2601, test_f1: 0.6468
 epoch: 78, train_loss: 0.5177, test_loss: 1.1089, test_f1: 0.6723
 epoch: 79, train_loss: 0.5042, test_loss: 1.1027, test_f1: 0.6881
 epoch: 80, train_loss: 0.4928, test_loss: 1.2151, test_f1: 0.6646
 epoch: 81, train_loss: 0.5200, test_loss: 1.1684, test_f1: 0.6939
 epoch: 82, train_loss: 0.5107, test_loss: 1.2010, test_f1: 0.6338
 epoch: 83, train_loss: 0.5150, test_loss: 1.3889, test_f1: 0.6362
 epoch: 84, train_loss: 0.5041, test_loss: 1.0614, test_f1: 0.6494
 epoch: 85, train_loss: 0.5024, test_loss: 1.1714, test_f1: 0.6646
 epoch: 86, train_loss: 0.5040, test_loss: 1.1842, test_f1: 0.6736
 epoch: 87, train_loss: 0.4773, test_loss: 1.1731, test_f1: 0.6828
 epoch: 88, train_loss: 0.4917, test_loss: 1.2267, test_f1: 0.6627
 epoch: 89, train_loss: 0.5088, test_loss: 1.2335, test_f1: 0.6540
 epoch: 90, train_loss: 0.4810, test_loss: 1.2963, test_f1: 0.6654
 epoch: 91, train_loss: 0.4936, test_loss: 1.2290, test_f1: 0.6847
 epoch: 92, train_loss: 0.4918, test_loss: 1.2788, test_f1: 0.6464
 epoch: 93, train_loss: 0.4925, test_loss: 1.3204, test_f1: 0.6746
 epoch: 94, train_loss: 0.4774, test_loss: 1.1914, test_f1: 0.6834
 epoch: 95, train_loss: 0.4865, test_loss: 1.3762, test_f1: 0.6556
 epoch: 96, train_loss: 0.5135, test_loss: 1.2409, test_f1: 0.6508
 epoch: 97, train_loss: 0.4734, test_loss: 1.1832, test_f1: 0.6573
 epoch: 98, train_loss: 0.4925, test_loss: 1.2694, test_f1: 0.6636
 epoch: 99, train_loss: 0.4864, test_loss: 1.2562, test_f1: 0.6840
##################ITERATION #8 ****************************************
 epoch: 0, train_loss: 1.1697, test_loss: 1.3052, test_f1: 0.3438
 epoch: 1, train_loss: 1.0033, test_loss: 1.0093, test_f1: 0.4819
 epoch: 2, train_loss: 0.9571, test_loss: 0.9866, test_f1: 0.5035
 epoch: 3, train_loss: 0.9394, test_loss: 0.9922, test_f1: 0.5477
 epoch: 4, train_loss: 0.9263, test_loss: 1.0349, test_f1: 0.5103
 epoch: 5, train_loss: 0.9093, test_loss: 1.2553, test_f1: 0.4555
 epoch: 6, train_loss: 0.9158, test_loss: 0.9728, test_f1: 0.5286
 epoch: 7, train_loss: 0.8860, test_loss: 1.1149, test_f1: 0.4449
 epoch: 8, train_loss: 0.8688, test_loss: 0.9940, test_f1: 0.4902
 epoch: 9, train_loss: 0.8476, test_loss: 1.1041, test_f1: 0.4874
 epoch: 10, train_loss: 0.8596, test_loss: 0.9483, test_f1: 0.5586
 epoch: 11, train_loss: 0.8622, test_loss: 0.9821, test_f1: 0.5301
 epoch: 12, train_loss: 0.8195, test_loss: 0.9783, test_f1: 0.5578
 epoch: 13, train_loss: 0.8357, test_loss: 0.8900, test_f1: 0.5275
 epoch: 14, train_loss: 0.8379, test_loss: 0.9703, test_f1: 0.5423
 epoch: 15, train_loss: 0.8118, test_loss: 0.9146, test_f1: 0.5948
 epoch: 16, train_loss: 0.7933, test_loss: 0.8948, test_f1: 0.6257
 epoch: 17, train_loss: 0.7679, test_loss: 0.9683, test_f1: 0.5685
 epoch: 18, train_loss: 0.7800, test_loss: 0.9398, test_f1: 0.6120
 epoch: 19, train_loss: 0.7922, test_loss: 0.9594, test_f1: 0.5782
 epoch: 20, train_loss: 0.7818, test_loss: 0.9000, test_f1: 0.6233
 epoch: 21, train_loss: 0.7763, test_loss: 0.9168, test_f1: 0.5552
 epoch: 22, train_loss: 0.7638, test_loss: 0.9976, test_f1: 0.5498
 epoch: 23, train_loss: 0.7359, test_loss: 1.0210, test_f1: 0.5612
 epoch: 24, train_loss: 0.7468, test_loss: 1.0249, test_f1: 0.5339
 epoch: 25, train_loss: 0.7339, test_loss: 0.9154, test_f1: 0.5868
 epoch: 26, train_loss: 0.7313, test_loss: 0.8726, test_f1: 0.6289
 epoch: 27, train_loss: 0.7470, test_loss: 0.9000, test_f1: 0.6253
 epoch: 28, train_loss: 0.7126, test_loss: 0.8942, test_f1: 0.5686
 epoch: 29, train_loss: 0.7075, test_loss: 1.0569, test_f1: 0.5387
 epoch: 30, train_loss: 0.7286, test_loss: 0.9213, test_f1: 0.5929
 epoch: 31, train_loss: 0.7201, test_loss: 0.9606, test_f1: 0.5792
 epoch: 32, train_loss: 0.6978, test_loss: 1.0544, test_f1: 0.5943
 epoch: 33, train_loss: 0.6977, test_loss: 0.9536, test_f1: 0.6370
 epoch: 34, train_loss: 0.7016, test_loss: 0.9009, test_f1: 0.6160
 epoch: 35, train_loss: 0.7034, test_loss: 0.9919, test_f1: 0.5951
 epoch: 36, train_loss: 0.6927, test_loss: 1.1297, test_f1: 0.5541
 epoch: 37, train_loss: 0.6832, test_loss: 0.9963, test_f1: 0.6068
 epoch: 38, train_loss: 0.6732, test_loss: 1.0416, test_f1: 0.6048
 epoch: 39, train_loss: 0.6849, test_loss: 0.9598, test_f1: 0.5951
 epoch: 40, train_loss: 0.6638, test_loss: 0.9811, test_f1: 0.6432
 epoch: 41, train_loss: 0.6794, test_loss: 0.9840, test_f1: 0.6045
 epoch: 42, train_loss: 0.6744, test_loss: 1.0959, test_f1: 0.5848
 epoch: 43, train_loss: 0.6607, test_loss: 0.9446, test_f1: 0.6014
 epoch: 44, train_loss: 0.6741, test_loss: 1.0886, test_f1: 0.5885
 epoch: 45, train_loss: 0.6727, test_loss: 1.0606, test_f1: 0.5715
 epoch: 46, train_loss: 0.6563, test_loss: 0.9893, test_f1: 0.6624
 epoch: 47, train_loss: 0.6665, test_loss: 1.0101, test_f1: 0.6446
 epoch: 48, train_loss: 0.6532, test_loss: 0.9471, test_f1: 0.6572
 epoch: 49, train_loss: 0.6453, test_loss: 1.2174, test_f1: 0.5950
 epoch: 50, train_loss: 0.6712, test_loss: 0.9981, test_f1: 0.5914
 epoch: 51, train_loss: 0.6372, test_loss: 0.9488, test_f1: 0.6441
 epoch: 52, train_loss: 0.6004, test_loss: 0.9152, test_f1: 0.6506
 epoch: 53, train_loss: 0.5912, test_loss: 1.0011, test_f1: 0.6551
 epoch: 54, train_loss: 0.5872, test_loss: 0.9869, test_f1: 0.6695
 epoch: 55, train_loss: 0.5777, test_loss: 0.9987, test_f1: 0.6212
 epoch: 56, train_loss: 0.5773, test_loss: 0.9497, test_f1: 0.6682
 epoch: 57, train_loss: 0.5829, test_loss: 0.9610, test_f1: 0.6706
 epoch: 58, train_loss: 0.5670, test_loss: 0.9210, test_f1: 0.6403
 epoch: 59, train_loss: 0.5826, test_loss: 0.9376, test_f1: 0.6541
 epoch: 60, train_loss: 0.5638, test_loss: 0.9332, test_f1: 0.6586
 epoch: 61, train_loss: 0.5636, test_loss: 0.9692, test_f1: 0.6462
 epoch: 62, train_loss: 0.5633, test_loss: 0.9675, test_f1: 0.6599
 epoch: 63, train_loss: 0.5613, test_loss: 1.0001, test_f1: 0.6416
 epoch: 64, train_loss: 0.5487, test_loss: 1.0024, test_f1: 0.6568
 epoch: 65, train_loss: 0.5681, test_loss: 0.9988, test_f1: 0.6454
 epoch: 66, train_loss: 0.5595, test_loss: 0.9435, test_f1: 0.6512
 epoch: 67, train_loss: 0.5570, test_loss: 1.0244, test_f1: 0.6412
 epoch: 68, train_loss: 0.5521, test_loss: 0.9818, test_f1: 0.6657
 epoch: 69, train_loss: 0.5423, test_loss: 1.0245, test_f1: 0.6281
 epoch: 70, train_loss: 0.5518, test_loss: 0.9992, test_f1: 0.6434
 epoch: 71, train_loss: 0.5282, test_loss: 0.9697, test_f1: 0.6513
 epoch: 72, train_loss: 0.5312, test_loss: 0.9955, test_f1: 0.6410
 epoch: 73, train_loss: 0.5373, test_loss: 0.9877, test_f1: 0.6631
 epoch: 74, train_loss: 0.5317, test_loss: 0.9282, test_f1: 0.6586
 epoch: 75, train_loss: 0.5247, test_loss: 1.0450, test_f1: 0.6195
 epoch: 76, train_loss: 0.5231, test_loss: 0.9758, test_f1: 0.6456
 epoch: 77, train_loss: 0.5158, test_loss: 1.1531, test_f1: 0.6507
 epoch: 78, train_loss: 0.5057, test_loss: 1.0502, test_f1: 0.6293
 epoch: 79, train_loss: 0.5197, test_loss: 1.2239, test_f1: 0.5666
 epoch: 80, train_loss: 0.5290, test_loss: 0.9984, test_f1: 0.6623
 epoch: 81, train_loss: 0.5174, test_loss: 1.0208, test_f1: 0.6598
 epoch: 82, train_loss: 0.5129, test_loss: 1.0003, test_f1: 0.6462
 epoch: 83, train_loss: 0.5295, test_loss: 1.0619, test_f1: 0.6327
 epoch: 84, train_loss: 0.5060, test_loss: 0.9397, test_f1: 0.6688
 epoch: 85, train_loss: 0.5100, test_loss: 1.0591, test_f1: 0.6588
 epoch: 86, train_loss: 0.5269, test_loss: 1.0453, test_f1: 0.6336
 epoch: 87, train_loss: 0.4988, test_loss: 1.1342, test_f1: 0.5956
 epoch: 88, train_loss: 0.5086, test_loss: 1.0703, test_f1: 0.6564
 epoch: 89, train_loss: 0.4943, test_loss: 1.0649, test_f1: 0.6287
 epoch: 90, train_loss: 0.5139, test_loss: 1.0140, test_f1: 0.6395
 epoch: 91, train_loss: 0.5014, test_loss: 1.0320, test_f1: 0.6342
 epoch: 92, train_loss: 0.5009, test_loss: 1.1178, test_f1: 0.6188
 epoch: 93, train_loss: 0.4998, test_loss: 1.0079, test_f1: 0.6621
 epoch: 94, train_loss: 0.5087, test_loss: 1.1166, test_f1: 0.6253
 epoch: 95, train_loss: 0.4953, test_loss: 0.9912, test_f1: 0.6717
 epoch: 96, train_loss: 0.5050, test_loss: 1.0927, test_f1: 0.6554
 epoch: 97, train_loss: 0.4909, test_loss: 1.1116, test_f1: 0.6291
 epoch: 98, train_loss: 0.4837, test_loss: 1.1054, test_f1: 0.6521
 epoch: 99, train_loss: 0.4811, test_loss: 1.1417, test_f1: 0.6552
##################ITERATION #9 ****************************************
 epoch: 0, train_loss: 1.1870, test_loss: 1.1241, test_f1: 0.3532
 epoch: 1, train_loss: 1.0068, test_loss: 1.0290, test_f1: 0.4968
 epoch: 2, train_loss: 0.9720, test_loss: 1.0251, test_f1: 0.4677
 epoch: 3, train_loss: 0.9427, test_loss: 0.9129, test_f1: 0.5298
 epoch: 4, train_loss: 0.9291, test_loss: 0.9124, test_f1: 0.4968
 epoch: 5, train_loss: 0.9459, test_loss: 0.9641, test_f1: 0.4723
 epoch: 6, train_loss: 0.9034, test_loss: 1.1401, test_f1: 0.4521
 epoch: 7, train_loss: 0.8765, test_loss: 0.9920, test_f1: 0.4396
 epoch: 8, train_loss: 0.8839, test_loss: 1.0434, test_f1: 0.4764
 epoch: 9, train_loss: 0.8765, test_loss: 0.9852, test_f1: 0.5434
 epoch: 10, train_loss: 0.8525, test_loss: 0.9014, test_f1: 0.5731
 epoch: 11, train_loss: 0.8559, test_loss: 0.9699, test_f1: 0.5729
 epoch: 12, train_loss: 0.8416, test_loss: 1.0969, test_f1: 0.4528
 epoch: 13, train_loss: 0.8405, test_loss: 0.9343, test_f1: 0.5660
 epoch: 14, train_loss: 0.8161, test_loss: 0.8898, test_f1: 0.5745
 epoch: 15, train_loss: 0.8128, test_loss: 0.9036, test_f1: 0.5845
 epoch: 16, train_loss: 0.8079, test_loss: 0.8943, test_f1: 0.5826
 epoch: 17, train_loss: 0.7974, test_loss: 0.8806, test_f1: 0.5455
 epoch: 18, train_loss: 0.7957, test_loss: 1.0319, test_f1: 0.5454
 epoch: 19, train_loss: 0.7868, test_loss: 0.8864, test_f1: 0.5362
 epoch: 20, train_loss: 0.7905, test_loss: 0.9277, test_f1: 0.5226
 epoch: 21, train_loss: 0.7813, test_loss: 0.9034, test_f1: 0.5390
 epoch: 22, train_loss: 0.7614, test_loss: 0.8661, test_f1: 0.6029
 epoch: 23, train_loss: 0.7497, test_loss: 1.0027, test_f1: 0.5377
 epoch: 24, train_loss: 0.7417, test_loss: 0.8788, test_f1: 0.5811
 epoch: 25, train_loss: 0.7507, test_loss: 1.2488, test_f1: 0.5031
 epoch: 26, train_loss: 0.7381, test_loss: 0.8985, test_f1: 0.5308
 epoch: 27, train_loss: 0.7482, test_loss: 0.8834, test_f1: 0.5967
 epoch: 28, train_loss: 0.7429, test_loss: 0.9919, test_f1: 0.5381
 epoch: 29, train_loss: 0.7374, test_loss: 0.9635, test_f1: 0.5745
 epoch: 30, train_loss: 0.7165, test_loss: 0.9464, test_f1: 0.5319
 epoch: 31, train_loss: 0.7264, test_loss: 1.0547, test_f1: 0.5603
 epoch: 32, train_loss: 0.7214, test_loss: 0.9920, test_f1: 0.5352
 epoch: 33, train_loss: 0.7103, test_loss: 0.9911, test_f1: 0.5265
 epoch: 34, train_loss: 0.7042, test_loss: 0.8923, test_f1: 0.5834
 epoch: 35, train_loss: 0.7003, test_loss: 0.9529, test_f1: 0.5626
 epoch: 36, train_loss: 0.7062, test_loss: 1.0041, test_f1: 0.5507
 epoch: 37, train_loss: 0.7085, test_loss: 0.8923, test_f1: 0.5958
 epoch: 38, train_loss: 0.7132, test_loss: 0.9168, test_f1: 0.5629
 epoch: 39, train_loss: 0.7130, test_loss: 0.8963, test_f1: 0.6224
 epoch: 40, train_loss: 0.7001, test_loss: 0.9529, test_f1: 0.5478
 epoch: 41, train_loss: 0.6801, test_loss: 0.9163, test_f1: 0.6225
 epoch: 42, train_loss: 0.6847, test_loss: 0.9227, test_f1: 0.5884
 epoch: 43, train_loss: 0.6771, test_loss: 0.9260, test_f1: 0.6081
 epoch: 44, train_loss: 0.6674, test_loss: 0.8717, test_f1: 0.6409
 epoch: 45, train_loss: 0.6764, test_loss: 0.9215, test_f1: 0.6261
 epoch: 46, train_loss: 0.6710, test_loss: 0.8839, test_f1: 0.5903
 epoch: 47, train_loss: 0.6586, test_loss: 0.9810, test_f1: 0.6021
 epoch: 48, train_loss: 0.6726, test_loss: 0.9898, test_f1: 0.6176
 epoch: 49, train_loss: 0.6455, test_loss: 0.9893, test_f1: 0.5198
 epoch: 50, train_loss: 0.6675, test_loss: 0.8648, test_f1: 0.6402
 epoch: 51, train_loss: 0.6290, test_loss: 0.9572, test_f1: 0.6098
 epoch: 52, train_loss: 0.6184, test_loss: 0.9621, test_f1: 0.5960
 epoch: 53, train_loss: 0.5989, test_loss: 0.9138, test_f1: 0.6398
 epoch: 54, train_loss: 0.5851, test_loss: 0.9210, test_f1: 0.6363
 epoch: 55, train_loss: 0.5876, test_loss: 0.8627, test_f1: 0.6144
 epoch: 56, train_loss: 0.6003, test_loss: 0.8801, test_f1: 0.6325
 epoch: 57, train_loss: 0.6078, test_loss: 0.9661, test_f1: 0.5997
 epoch: 58, train_loss: 0.5962, test_loss: 0.8935, test_f1: 0.6345
 epoch: 59, train_loss: 0.5901, test_loss: 0.9008, test_f1: 0.6033
 epoch: 60, train_loss: 0.5990, test_loss: 0.8614, test_f1: 0.6363
 epoch: 61, train_loss: 0.5934, test_loss: 0.9047, test_f1: 0.6035
 epoch: 62, train_loss: 0.5731, test_loss: 0.9145, test_f1: 0.6034
 epoch: 63, train_loss: 0.5776, test_loss: 0.8987, test_f1: 0.6107
 epoch: 64, train_loss: 0.5693, test_loss: 0.8815, test_f1: 0.6487
 epoch: 65, train_loss: 0.5778, test_loss: 0.9583, test_f1: 0.5912
 epoch: 66, train_loss: 0.5795, test_loss: 0.8912, test_f1: 0.6325
 epoch: 67, train_loss: 0.5668, test_loss: 0.9518, test_f1: 0.6104
 epoch: 68, train_loss: 0.5641, test_loss: 0.9219, test_f1: 0.6375
 epoch: 69, train_loss: 0.5725, test_loss: 0.9038, test_f1: 0.6205
 epoch: 70, train_loss: 0.5638, test_loss: 0.9548, test_f1: 0.6282
 epoch: 71, train_loss: 0.5641, test_loss: 0.9459, test_f1: 0.5979
 epoch: 72, train_loss: 0.5677, test_loss: 0.9170, test_f1: 0.6383
 epoch: 73, train_loss: 0.5605, test_loss: 0.9009, test_f1: 0.6147
 epoch: 74, train_loss: 0.5548, test_loss: 0.9152, test_f1: 0.6147
 epoch: 75, train_loss: 0.5562, test_loss: 0.9174, test_f1: 0.6146
 epoch: 76, train_loss: 0.5330, test_loss: 0.8811, test_f1: 0.6405
 epoch: 77, train_loss: 0.5542, test_loss: 0.9114, test_f1: 0.6621
 epoch: 78, train_loss: 0.5603, test_loss: 0.9335, test_f1: 0.6378
 epoch: 79, train_loss: 0.5372, test_loss: 0.9574, test_f1: 0.6177
 epoch: 80, train_loss: 0.5366, test_loss: 0.9536, test_f1: 0.6426
 epoch: 81, train_loss: 0.5490, test_loss: 0.9735, test_f1: 0.6120
 epoch: 82, train_loss: 0.5326, test_loss: 0.9483, test_f1: 0.6247
 epoch: 83, train_loss: 0.5219, test_loss: 1.0331, test_f1: 0.6266
 epoch: 84, train_loss: 0.5356, test_loss: 0.9757, test_f1: 0.6343
 epoch: 85, train_loss: 0.5506, test_loss: 0.9540, test_f1: 0.6413
 epoch: 86, train_loss: 0.5688, test_loss: 1.0756, test_f1: 0.6009
 epoch: 87, train_loss: 0.5294, test_loss: 0.9340, test_f1: 0.6443
 epoch: 88, train_loss: 0.5201, test_loss: 0.9764, test_f1: 0.5921
 epoch: 89, train_loss: 0.5318, test_loss: 1.1171, test_f1: 0.5718
 epoch: 90, train_loss: 0.5292, test_loss: 0.8916, test_f1: 0.6643
 epoch: 91, train_loss: 0.5429, test_loss: 1.0525, test_f1: 0.6063
 epoch: 92, train_loss: 0.5170, test_loss: 1.0802, test_f1: 0.5790
 epoch: 93, train_loss: 0.5157, test_loss: 1.0321, test_f1: 0.6333
 epoch: 94, train_loss: 0.5151, test_loss: 0.9479, test_f1: 0.6404
 epoch: 95, train_loss: 0.5192, test_loss: 1.0108, test_f1: 0.6130
 epoch: 96, train_loss: 0.5275, test_loss: 1.0565, test_f1: 0.6087
 epoch: 97, train_loss: 0.5080, test_loss: 0.9983, test_f1: 0.6129
 epoch: 98, train_loss: 0.5120, test_loss: 1.0368, test_f1: 0.6037
 epoch: 99, train_loss: 0.5260, test_loss: 1.0129, test_f1: 0.6134

Training completed in 480.86 seconds
Best F1: 0.7072 at epoch 38
Mean F1 across iterations: 0.6781  0.0146
========================FINAL RESULTS================================
FEGIN weighted F1: 0.7072  0.0146
python main.py --data ltspice_examples --representation component_pin --model FEGIN --layers 3 --hiddens 32 --batch_size 128 --lr 0.01 --emb_size 128 --epochs 100 --save_appendix component_pin_L3_H32_BS128_LR0.01_E128 --no_val
-----



STDERR:
  File "main.py", line 370, in <module>
    main()
  File "main.py", line 254, in main
    dataset = dataset_class(
  File "/home/philip/projects/ltspice_examples_code_repo/Circuit-Completion-Using-GNNs/component_classification_with_link_prediction_head/evaluation/FEGIN/kernel/circuit_datasets.py", line 15, in __init__
    self.data, self.slices = torch.load(self.processed_paths[0])
  File "/home/philip/.local/lib/python3.8/site-packages/torch/serialization.py", line 1040, in load
    warnings.warn(
  File "/usr/lib/python3.8/warnings.py", line 109, in _showwarnmsg
    sw(msg.message, msg.category, msg.filename, msg.lineno,
  File "main.py", line 47, in warn_with_traceback
    traceback.print_stack(file=log)
/home/philip/projects/ltspice_examples_code_repo/Circuit-Completion-Using-GNNs/component_classification_with_link_prediction_head/evaluation/FEGIN/kernel/circuit_datasets.py:15: FutureWarning: You are using `torch.load` with `weights_only=False` (the current default value), which uses the default pickle module implicitly. It is possible to construct malicious pickle data which will execute arbitrary code during unpickling (See https://github.com/pytorch/pytorch/blob/main/SECURITY.md#untrusted-models for more details). In a future release, the default value for `weights_only` will be flipped to `True`. This limits the functions that could be executed during unpickling. Arbitrary objects will no longer be allowed to be loaded via this mode unless they are explicitly allowlisted by the user via `torch.serialization.add_safe_globals`. We recommend you start setting `weights_only=True` for any use case where you don't have full control of the loaded file. Please open an issue on GitHub for any issues related to this experimental feature.
  self.data, self.slices = torch.load(self.processed_paths[0])
