STDOUT:
Results will be saved in /home/philip/projects/ltspice_examples_code_repo/Circuit-Completion-Using-GNNs/component_classification_with_link_prediction_head/evaluation/FEGIN/results/model_FEGIN_dataset_ltspice_examples
Command line input: python main.py --data ltspice_examples --representation component_pin --model FEGIN --layers 6 --hiddens 64 --batch_size 256 --lr 0.001 --emb_size 128 --epochs 100 --save_appendix component_pin_L6_H64_BS256_LR0.001_E128 --no_val
 is saved.
-----
ltspice_examples - FEGIN
Using 6 layers, 64 hidden units, h = 2
Loading component_pin representation dataset
ENTERED
Training FEGIN on component_pin representation
Train: 3560, Test: 848
##################ITERATION #0 ****************************************
 epoch: 0, train_loss: 1.3385, test_loss: 1.3299, test_f1: 0.2260
 epoch: 1, train_loss: 1.2269, test_loss: 1.3046, test_f1: 0.2576
 epoch: 2, train_loss: 1.1817, test_loss: 1.2923, test_f1: 0.2744
 epoch: 3, train_loss: 1.1360, test_loss: 1.2975, test_f1: 0.2233
 epoch: 4, train_loss: 1.0781, test_loss: 1.1203, test_f1: 0.3423
 epoch: 5, train_loss: 1.0241, test_loss: 1.1170, test_f1: 0.4330
 epoch: 6, train_loss: 0.9991, test_loss: 1.0585, test_f1: 0.4291
 epoch: 7, train_loss: 0.9770, test_loss: 1.0316, test_f1: 0.4291
 epoch: 8, train_loss: 0.9605, test_loss: 1.0045, test_f1: 0.4711
 epoch: 9, train_loss: 0.9386, test_loss: 1.0234, test_f1: 0.4905
 epoch: 10, train_loss: 0.9031, test_loss: 1.0048, test_f1: 0.4692
 epoch: 11, train_loss: 0.8832, test_loss: 1.0264, test_f1: 0.4941
 epoch: 12, train_loss: 0.8636, test_loss: 1.0113, test_f1: 0.5111
 epoch: 13, train_loss: 0.8522, test_loss: 0.9976, test_f1: 0.5139
 epoch: 14, train_loss: 0.8165, test_loss: 0.9706, test_f1: 0.5238
 epoch: 15, train_loss: 0.8136, test_loss: 0.9725, test_f1: 0.5415
 epoch: 16, train_loss: 0.8018, test_loss: 0.9595, test_f1: 0.5039
 epoch: 17, train_loss: 0.7781, test_loss: 0.9895, test_f1: 0.5108
 epoch: 18, train_loss: 0.7697, test_loss: 1.1535, test_f1: 0.4990
 epoch: 19, train_loss: 0.7498, test_loss: 1.0396, test_f1: 0.5080
 epoch: 20, train_loss: 0.7260, test_loss: 1.0689, test_f1: 0.5145
 epoch: 21, train_loss: 0.7349, test_loss: 1.0928, test_f1: 0.4888
 epoch: 22, train_loss: 0.7227, test_loss: 0.9789, test_f1: 0.5580
 epoch: 23, train_loss: 0.6989, test_loss: 1.0709, test_f1: 0.5299
 epoch: 24, train_loss: 0.6943, test_loss: 1.0098, test_f1: 0.6010
 epoch: 25, train_loss: 0.6731, test_loss: 1.0188, test_f1: 0.5176
 epoch: 26, train_loss: 0.6766, test_loss: 1.0237, test_f1: 0.5693
 epoch: 27, train_loss: 0.6833, test_loss: 1.0426, test_f1: 0.5384
 epoch: 28, train_loss: 0.6531, test_loss: 0.9799, test_f1: 0.5610
 epoch: 29, train_loss: 0.6612, test_loss: 1.0500, test_f1: 0.5642
 epoch: 30, train_loss: 0.6351, test_loss: 1.0340, test_f1: 0.5438
 epoch: 31, train_loss: 0.6246, test_loss: 1.0665, test_f1: 0.5769
 epoch: 32, train_loss: 0.6160, test_loss: 1.0646, test_f1: 0.5755
 epoch: 33, train_loss: 0.6112, test_loss: 1.0876, test_f1: 0.5704
 epoch: 34, train_loss: 0.6037, test_loss: 1.1318, test_f1: 0.5625
 epoch: 35, train_loss: 0.5976, test_loss: 1.1164, test_f1: 0.5711
 epoch: 36, train_loss: 0.5789, test_loss: 1.0806, test_f1: 0.5865
 epoch: 37, train_loss: 0.5784, test_loss: 1.0188, test_f1: 0.5815
 epoch: 38, train_loss: 0.5864, test_loss: 1.2434, test_f1: 0.5451
 epoch: 39, train_loss: 0.6090, test_loss: 1.1329, test_f1: 0.5793
 epoch: 40, train_loss: 0.5815, test_loss: 1.0464, test_f1: 0.5924
 epoch: 41, train_loss: 0.5562, test_loss: 1.1087, test_f1: 0.5614
 epoch: 42, train_loss: 0.5699, test_loss: 1.0781, test_f1: 0.5582
 epoch: 43, train_loss: 0.5581, test_loss: 1.2281, test_f1: 0.5692
 epoch: 44, train_loss: 0.5552, test_loss: 1.0870, test_f1: 0.5995
 epoch: 45, train_loss: 0.5345, test_loss: 1.1465, test_f1: 0.5708
 epoch: 46, train_loss: 0.5328, test_loss: 1.2350, test_f1: 0.6122
 epoch: 47, train_loss: 0.5338, test_loss: 1.1416, test_f1: 0.5942
 epoch: 48, train_loss: 0.5324, test_loss: 1.1590, test_f1: 0.5804
 epoch: 49, train_loss: 0.5316, test_loss: 1.1196, test_f1: 0.5862
 epoch: 50, train_loss: 0.5283, test_loss: 1.3341, test_f1: 0.5698
 epoch: 51, train_loss: 0.5016, test_loss: 1.1020, test_f1: 0.5799
 epoch: 52, train_loss: 0.4897, test_loss: 1.1525, test_f1: 0.5933
 epoch: 53, train_loss: 0.4797, test_loss: 1.1472, test_f1: 0.6055
 epoch: 54, train_loss: 0.4558, test_loss: 1.1914, test_f1: 0.5888
 epoch: 55, train_loss: 0.4462, test_loss: 1.1488, test_f1: 0.6250
 epoch: 56, train_loss: 0.4403, test_loss: 1.3242, test_f1: 0.6057
 epoch: 57, train_loss: 0.4410, test_loss: 1.2551, test_f1: 0.5957
 epoch: 58, train_loss: 0.4345, test_loss: 1.2845, test_f1: 0.6042
 epoch: 59, train_loss: 0.4308, test_loss: 1.2891, test_f1: 0.5813
 epoch: 60, train_loss: 0.4303, test_loss: 1.2964, test_f1: 0.5792
 epoch: 61, train_loss: 0.4260, test_loss: 1.3375, test_f1: 0.5830
 epoch: 62, train_loss: 0.4149, test_loss: 1.2453, test_f1: 0.6108
 epoch: 63, train_loss: 0.4240, test_loss: 1.3760, test_f1: 0.5953
 epoch: 64, train_loss: 0.4272, test_loss: 1.3501, test_f1: 0.5835
 epoch: 65, train_loss: 0.4323, test_loss: 1.2853, test_f1: 0.5855
 epoch: 66, train_loss: 0.4175, test_loss: 1.2783, test_f1: 0.6062
 epoch: 67, train_loss: 0.4031, test_loss: 1.3239, test_f1: 0.5881
 epoch: 68, train_loss: 0.3907, test_loss: 1.2883, test_f1: 0.6016
 epoch: 69, train_loss: 0.3928, test_loss: 1.4025, test_f1: 0.5833
 epoch: 70, train_loss: 0.3930, test_loss: 1.4270, test_f1: 0.5755
 epoch: 71, train_loss: 0.3832, test_loss: 1.4514, test_f1: 0.5826
 epoch: 72, train_loss: 0.3757, test_loss: 1.4488, test_f1: 0.5746
 epoch: 73, train_loss: 0.3783, test_loss: 1.3828, test_f1: 0.5744
 epoch: 74, train_loss: 0.3781, test_loss: 1.5184, test_f1: 0.5981
 epoch: 75, train_loss: 0.3811, test_loss: 1.4503, test_f1: 0.6073
 epoch: 76, train_loss: 0.3763, test_loss: 1.4678, test_f1: 0.6029
 epoch: 77, train_loss: 0.3656, test_loss: 1.3849, test_f1: 0.5962
 epoch: 78, train_loss: 0.3550, test_loss: 1.5421, test_f1: 0.5932
 epoch: 79, train_loss: 0.3601, test_loss: 1.4490, test_f1: 0.6025
 epoch: 80, train_loss: 0.3745, test_loss: 1.6027, test_f1: 0.5782
 epoch: 81, train_loss: 0.3610, test_loss: 1.5963, test_f1: 0.5918
 epoch: 82, train_loss: 0.3642, test_loss: 1.5256, test_f1: 0.5841
 epoch: 83, train_loss: 0.3412, test_loss: 1.5668, test_f1: 0.5839
 epoch: 84, train_loss: 0.3408, test_loss: 1.4999, test_f1: 0.6239
 epoch: 85, train_loss: 0.3421, test_loss: 1.5921, test_f1: 0.5990
 epoch: 86, train_loss: 0.3320, test_loss: 1.6646, test_f1: 0.5949
 epoch: 87, train_loss: 0.3346, test_loss: 1.5201, test_f1: 0.6179
 epoch: 88, train_loss: 0.3354, test_loss: 1.5751, test_f1: 0.6223
 epoch: 89, train_loss: 0.3169, test_loss: 1.6242, test_f1: 0.6018
 epoch: 90, train_loss: 0.3100, test_loss: 1.5915, test_f1: 0.6215
 epoch: 91, train_loss: 0.3285, test_loss: 1.7219, test_f1: 0.5702
 epoch: 92, train_loss: 0.3137, test_loss: 1.7319, test_f1: 0.5938
 epoch: 93, train_loss: 0.3209, test_loss: 1.5447, test_f1: 0.5980
 epoch: 94, train_loss: 0.3271, test_loss: 1.6217, test_f1: 0.5656
 epoch: 95, train_loss: 0.3301, test_loss: 1.6032, test_f1: 0.5803
 epoch: 96, train_loss: 0.3063, test_loss: 1.6288, test_f1: 0.6050
 epoch: 97, train_loss: 0.3098, test_loss: 1.6712, test_f1: 0.6211
 epoch: 98, train_loss: 0.3262, test_loss: 1.7157, test_f1: 0.6119
 epoch: 99, train_loss: 0.3107, test_loss: 1.5620, test_f1: 0.6123
##################ITERATION #1 ****************************************
 epoch: 0, train_loss: 1.2588, test_loss: 1.2930, test_f1: 0.2260
 epoch: 1, train_loss: 1.1245, test_loss: 1.2421, test_f1: 0.2260
 epoch: 2, train_loss: 1.0592, test_loss: 1.1524, test_f1: 0.3399
 epoch: 3, train_loss: 1.0038, test_loss: 1.2132, test_f1: 0.3634
 epoch: 4, train_loss: 0.9660, test_loss: 1.2265, test_f1: 0.4005
 epoch: 5, train_loss: 0.9410, test_loss: 0.9823, test_f1: 0.5118
 epoch: 6, train_loss: 0.9067, test_loss: 0.9697, test_f1: 0.5346
 epoch: 7, train_loss: 0.8967, test_loss: 0.9655, test_f1: 0.5204
 epoch: 8, train_loss: 0.8672, test_loss: 1.0140, test_f1: 0.5171
 epoch: 9, train_loss: 0.8606, test_loss: 0.9227, test_f1: 0.5481
 epoch: 10, train_loss: 0.8330, test_loss: 0.9592, test_f1: 0.5378
 epoch: 11, train_loss: 0.8182, test_loss: 0.8898, test_f1: 0.5081
 epoch: 12, train_loss: 0.7933, test_loss: 0.9100, test_f1: 0.5386
 epoch: 13, train_loss: 0.7762, test_loss: 0.9986, test_f1: 0.5299
 epoch: 14, train_loss: 0.7622, test_loss: 0.9068, test_f1: 0.5440
 epoch: 15, train_loss: 0.7412, test_loss: 1.0497, test_f1: 0.5070
 epoch: 16, train_loss: 0.7345, test_loss: 1.0109, test_f1: 0.5427
 epoch: 17, train_loss: 0.7130, test_loss: 0.9836, test_f1: 0.5789
 epoch: 18, train_loss: 0.7039, test_loss: 0.9442, test_f1: 0.5598
 epoch: 19, train_loss: 0.6944, test_loss: 0.9466, test_f1: 0.5375
 epoch: 20, train_loss: 0.6889, test_loss: 1.0287, test_f1: 0.5404
 epoch: 21, train_loss: 0.6627, test_loss: 0.9745, test_f1: 0.5904
 epoch: 22, train_loss: 0.6587, test_loss: 0.9620, test_f1: 0.5614
 epoch: 23, train_loss: 0.6608, test_loss: 0.9611, test_f1: 0.5532
 epoch: 24, train_loss: 0.6447, test_loss: 1.0887, test_f1: 0.5486
 epoch: 25, train_loss: 0.6548, test_loss: 0.9620, test_f1: 0.5659
 epoch: 26, train_loss: 0.6367, test_loss: 1.0012, test_f1: 0.5714
 epoch: 27, train_loss: 0.6183, test_loss: 1.0975, test_f1: 0.5683
 epoch: 28, train_loss: 0.6311, test_loss: 1.0528, test_f1: 0.5515
 epoch: 29, train_loss: 0.6184, test_loss: 1.0206, test_f1: 0.5578
 epoch: 30, train_loss: 0.5954, test_loss: 1.0102, test_f1: 0.5836
 epoch: 31, train_loss: 0.5752, test_loss: 1.0009, test_f1: 0.5589
 epoch: 32, train_loss: 0.5627, test_loss: 0.9460, test_f1: 0.5688
 epoch: 33, train_loss: 0.5606, test_loss: 1.1580, test_f1: 0.5621
 epoch: 34, train_loss: 0.5489, test_loss: 1.0498, test_f1: 0.6131
 epoch: 35, train_loss: 0.5415, test_loss: 1.2112, test_f1: 0.4972
 epoch: 36, train_loss: 0.5513, test_loss: 1.1971, test_f1: 0.5484
 epoch: 37, train_loss: 0.5404, test_loss: 1.1634, test_f1: 0.5613
 epoch: 38, train_loss: 0.5415, test_loss: 1.0689, test_f1: 0.5910
 epoch: 39, train_loss: 0.5386, test_loss: 1.0960, test_f1: 0.5933
 epoch: 40, train_loss: 0.5282, test_loss: 0.9696, test_f1: 0.5808
 epoch: 41, train_loss: 0.5217, test_loss: 1.2917, test_f1: 0.5746
 epoch: 42, train_loss: 0.5116, test_loss: 1.1867, test_f1: 0.5871
 epoch: 43, train_loss: 0.5060, test_loss: 1.0703, test_f1: 0.6002
 epoch: 44, train_loss: 0.5000, test_loss: 1.0641, test_f1: 0.5718
 epoch: 45, train_loss: 0.4894, test_loss: 1.1719, test_f1: 0.5449
 epoch: 46, train_loss: 0.5037, test_loss: 1.1222, test_f1: 0.5847
 epoch: 47, train_loss: 0.4869, test_loss: 1.0800, test_f1: 0.6089
 epoch: 48, train_loss: 0.4792, test_loss: 1.2429, test_f1: 0.5870
 epoch: 49, train_loss: 0.4771, test_loss: 1.2565, test_f1: 0.5680
 epoch: 50, train_loss: 0.4708, test_loss: 1.3044, test_f1: 0.5488
 epoch: 51, train_loss: 0.4246, test_loss: 1.1135, test_f1: 0.5882
 epoch: 52, train_loss: 0.4082, test_loss: 1.4265, test_f1: 0.5923
 epoch: 53, train_loss: 0.4012, test_loss: 1.1410, test_f1: 0.5944
 epoch: 54, train_loss: 0.3856, test_loss: 1.1695, test_f1: 0.5974
 epoch: 55, train_loss: 0.3678, test_loss: 1.1541, test_f1: 0.6338
 epoch: 56, train_loss: 0.3658, test_loss: 1.2490, test_f1: 0.5663
 epoch: 57, train_loss: 0.3674, test_loss: 1.3632, test_f1: 0.5745
 epoch: 58, train_loss: 0.3734, test_loss: 1.2834, test_f1: 0.5778
 epoch: 59, train_loss: 0.3698, test_loss: 1.1574, test_f1: 0.6185
 epoch: 60, train_loss: 0.3696, test_loss: 1.2903, test_f1: 0.5878
 epoch: 61, train_loss: 0.3744, test_loss: 1.3506, test_f1: 0.5859
 epoch: 62, train_loss: 0.3465, test_loss: 1.4158, test_f1: 0.5565
 epoch: 63, train_loss: 0.3463, test_loss: 1.2538, test_f1: 0.6154
 epoch: 64, train_loss: 0.3522, test_loss: 1.3491, test_f1: 0.5625
 epoch: 65, train_loss: 0.3381, test_loss: 1.3957, test_f1: 0.5974
 epoch: 66, train_loss: 0.3295, test_loss: 1.3724, test_f1: 0.5921
 epoch: 67, train_loss: 0.3261, test_loss: 1.5170, test_f1: 0.5593
 epoch: 68, train_loss: 0.3208, test_loss: 1.2739, test_f1: 0.5990
 epoch: 69, train_loss: 0.3234, test_loss: 1.5213, test_f1: 0.5715
 epoch: 70, train_loss: 0.3315, test_loss: 1.3744, test_f1: 0.6073
 epoch: 71, train_loss: 0.3104, test_loss: 1.4878, test_f1: 0.5867
 epoch: 72, train_loss: 0.3112, test_loss: 1.4975, test_f1: 0.5761
 epoch: 73, train_loss: 0.2949, test_loss: 1.4845, test_f1: 0.5850
 epoch: 74, train_loss: 0.2937, test_loss: 1.3803, test_f1: 0.5795
 epoch: 75, train_loss: 0.2911, test_loss: 1.5022, test_f1: 0.5855
 epoch: 76, train_loss: 0.3215, test_loss: 1.4623, test_f1: 0.5651
 epoch: 77, train_loss: 0.3084, test_loss: 1.5117, test_f1: 0.5879
 epoch: 78, train_loss: 0.2722, test_loss: 1.6470, test_f1: 0.5768
 epoch: 79, train_loss: 0.2737, test_loss: 1.4941, test_f1: 0.5989
 epoch: 80, train_loss: 0.2931, test_loss: 1.4917, test_f1: 0.5763
 epoch: 81, train_loss: 0.2804, test_loss: 1.4279, test_f1: 0.6043
 epoch: 82, train_loss: 0.2832, test_loss: 1.6673, test_f1: 0.5993
 epoch: 83, train_loss: 0.2916, test_loss: 1.4887, test_f1: 0.5937
 epoch: 84, train_loss: 0.2632, test_loss: 1.6009, test_f1: 0.5940
 epoch: 85, train_loss: 0.2718, test_loss: 1.6934, test_f1: 0.5742
 epoch: 86, train_loss: 0.2604, test_loss: 1.4186, test_f1: 0.5877
 epoch: 87, train_loss: 0.2578, test_loss: 1.5737, test_f1: 0.6055
 epoch: 88, train_loss: 0.2644, test_loss: 1.7872, test_f1: 0.5495
 epoch: 89, train_loss: 0.2536, test_loss: 1.7498, test_f1: 0.5765
 epoch: 90, train_loss: 0.2614, test_loss: 1.7834, test_f1: 0.6101
 epoch: 91, train_loss: 0.2538, test_loss: 1.4745, test_f1: 0.6217
 epoch: 92, train_loss: 0.2675, test_loss: 1.5760, test_f1: 0.6036
 epoch: 93, train_loss: 0.2526, test_loss: 1.5692, test_f1: 0.6052
 epoch: 94, train_loss: 0.2397, test_loss: 1.5311, test_f1: 0.5887
 epoch: 95, train_loss: 0.2401, test_loss: 1.8583, test_f1: 0.5740
 epoch: 96, train_loss: 0.2406, test_loss: 1.7894, test_f1: 0.5671
 epoch: 97, train_loss: 0.2574, test_loss: 1.7867, test_f1: 0.5868
 epoch: 98, train_loss: 0.2345, test_loss: 1.6391, test_f1: 0.6155
 epoch: 99, train_loss: 0.2280, test_loss: 1.9346, test_f1: 0.5828
##################ITERATION #2 ****************************************
 epoch: 0, train_loss: 1.2225, test_loss: 1.2736, test_f1: 0.2260
 epoch: 1, train_loss: 1.0439, test_loss: 1.2140, test_f1: 0.2260
 epoch: 2, train_loss: 1.0026, test_loss: 1.1035, test_f1: 0.3821
 epoch: 3, train_loss: 0.9705, test_loss: 1.0826, test_f1: 0.4703
 epoch: 4, train_loss: 0.9245, test_loss: 0.9930, test_f1: 0.5124
 epoch: 5, train_loss: 0.9067, test_loss: 0.9265, test_f1: 0.5541
 epoch: 6, train_loss: 0.8802, test_loss: 0.8704, test_f1: 0.5699
 epoch: 7, train_loss: 0.8420, test_loss: 0.9098, test_f1: 0.5328
 epoch: 8, train_loss: 0.8317, test_loss: 0.8962, test_f1: 0.5574
 epoch: 9, train_loss: 0.8222, test_loss: 0.9332, test_f1: 0.5533
 epoch: 10, train_loss: 0.7930, test_loss: 0.9438, test_f1: 0.5622
 epoch: 11, train_loss: 0.7961, test_loss: 0.8815, test_f1: 0.5828
 epoch: 12, train_loss: 0.7610, test_loss: 0.8846, test_f1: 0.5755
 epoch: 13, train_loss: 0.7417, test_loss: 1.0004, test_f1: 0.5629
 epoch: 14, train_loss: 0.7383, test_loss: 0.9393, test_f1: 0.5853
 epoch: 15, train_loss: 0.7227, test_loss: 0.8885, test_f1: 0.5608
 epoch: 16, train_loss: 0.6981, test_loss: 0.8611, test_f1: 0.5898
 epoch: 17, train_loss: 0.6930, test_loss: 0.8640, test_f1: 0.5977
 epoch: 18, train_loss: 0.6834, test_loss: 0.8440, test_f1: 0.6135
 epoch: 19, train_loss: 0.6745, test_loss: 1.0611, test_f1: 0.5829
 epoch: 20, train_loss: 0.6770, test_loss: 0.8954, test_f1: 0.5803
 epoch: 21, train_loss: 0.6551, test_loss: 0.9429, test_f1: 0.5716
 epoch: 22, train_loss: 0.6605, test_loss: 0.8763, test_f1: 0.5853
 epoch: 23, train_loss: 0.6579, test_loss: 0.8706, test_f1: 0.6071
 epoch: 24, train_loss: 0.6265, test_loss: 0.9005, test_f1: 0.5870
 epoch: 25, train_loss: 0.6347, test_loss: 0.8990, test_f1: 0.5855
 epoch: 26, train_loss: 0.6194, test_loss: 0.8436, test_f1: 0.6031
 epoch: 27, train_loss: 0.6084, test_loss: 0.9686, test_f1: 0.5837
 epoch: 28, train_loss: 0.6028, test_loss: 0.8777, test_f1: 0.5942
 epoch: 29, train_loss: 0.5828, test_loss: 0.8945, test_f1: 0.6101
 epoch: 30, train_loss: 0.5794, test_loss: 0.9017, test_f1: 0.6074
 epoch: 31, train_loss: 0.5851, test_loss: 0.8912, test_f1: 0.6096
 epoch: 32, train_loss: 0.5476, test_loss: 0.9761, test_f1: 0.5690
 epoch: 33, train_loss: 0.5462, test_loss: 0.9097, test_f1: 0.6331
 epoch: 34, train_loss: 0.5455, test_loss: 0.9148, test_f1: 0.6209
 epoch: 35, train_loss: 0.5346, test_loss: 1.0661, test_f1: 0.5874
 epoch: 36, train_loss: 0.5184, test_loss: 0.8373, test_f1: 0.6363
 epoch: 37, train_loss: 0.5227, test_loss: 0.8750, test_f1: 0.6288
 epoch: 38, train_loss: 0.5432, test_loss: 0.9063, test_f1: 0.6272
 epoch: 39, train_loss: 0.5363, test_loss: 0.8931, test_f1: 0.6122
 epoch: 40, train_loss: 0.5167, test_loss: 0.9633, test_f1: 0.6068
 epoch: 41, train_loss: 0.5085, test_loss: 0.9390, test_f1: 0.6184
 epoch: 42, train_loss: 0.5142, test_loss: 0.8998, test_f1: 0.6438
 epoch: 43, train_loss: 0.4905, test_loss: 0.8761, test_f1: 0.6421
 epoch: 44, train_loss: 0.4890, test_loss: 1.2336, test_f1: 0.5826
 epoch: 45, train_loss: 0.4864, test_loss: 1.1294, test_f1: 0.6083
 epoch: 46, train_loss: 0.4716, test_loss: 0.9568, test_f1: 0.6222
 epoch: 47, train_loss: 0.4662, test_loss: 1.0420, test_f1: 0.6199
 epoch: 48, train_loss: 0.4481, test_loss: 0.9658, test_f1: 0.6291
 epoch: 49, train_loss: 0.4546, test_loss: 1.1568, test_f1: 0.6129
 epoch: 50, train_loss: 0.4594, test_loss: 1.0598, test_f1: 0.6172
 epoch: 51, train_loss: 0.4223, test_loss: 1.1042, test_f1: 0.6092
 epoch: 52, train_loss: 0.4019, test_loss: 1.1051, test_f1: 0.6193
 epoch: 53, train_loss: 0.3841, test_loss: 1.1219, test_f1: 0.6158
 epoch: 54, train_loss: 0.3764, test_loss: 1.1084, test_f1: 0.6345
 epoch: 55, train_loss: 0.3664, test_loss: 1.1389, test_f1: 0.6425
 epoch: 56, train_loss: 0.3609, test_loss: 1.2187, test_f1: 0.6215
 epoch: 57, train_loss: 0.3544, test_loss: 1.2022, test_f1: 0.6292
 epoch: 58, train_loss: 0.3473, test_loss: 1.1615, test_f1: 0.6142
 epoch: 59, train_loss: 0.3493, test_loss: 1.2027, test_f1: 0.6374
 epoch: 60, train_loss: 0.3443, test_loss: 1.1215, test_f1: 0.6321
 epoch: 61, train_loss: 0.3391, test_loss: 1.1836, test_f1: 0.6483
 epoch: 62, train_loss: 0.3263, test_loss: 1.2510, test_f1: 0.6165
 epoch: 63, train_loss: 0.3502, test_loss: 1.1817, test_f1: 0.6163
 epoch: 64, train_loss: 0.3279, test_loss: 1.1754, test_f1: 0.6367
 epoch: 65, train_loss: 0.3278, test_loss: 1.1997, test_f1: 0.6353
 epoch: 66, train_loss: 0.3174, test_loss: 1.2638, test_f1: 0.6155
 epoch: 67, train_loss: 0.3107, test_loss: 1.2747, test_f1: 0.6321
 epoch: 68, train_loss: 0.3068, test_loss: 1.3649, test_f1: 0.6134
 epoch: 69, train_loss: 0.3058, test_loss: 1.3171, test_f1: 0.6301
 epoch: 70, train_loss: 0.3161, test_loss: 1.3251, test_f1: 0.6409
 epoch: 71, train_loss: 0.3103, test_loss: 1.2834, test_f1: 0.6147
 epoch: 72, train_loss: 0.3117, test_loss: 1.4394, test_f1: 0.6052
 epoch: 73, train_loss: 0.3098, test_loss: 1.2927, test_f1: 0.6315
 epoch: 74, train_loss: 0.3199, test_loss: 1.4615, test_f1: 0.6128
 epoch: 75, train_loss: 0.3107, test_loss: 1.3050, test_f1: 0.6332
 epoch: 76, train_loss: 0.3011, test_loss: 1.3327, test_f1: 0.6619
 epoch: 77, train_loss: 0.2840, test_loss: 1.3414, test_f1: 0.6189
 epoch: 78, train_loss: 0.2885, test_loss: 1.3804, test_f1: 0.6361
 epoch: 79, train_loss: 0.2810, test_loss: 1.3660, test_f1: 0.6168
 epoch: 80, train_loss: 0.2823, test_loss: 1.5060, test_f1: 0.6179
 epoch: 81, train_loss: 0.2757, test_loss: 1.4999, test_f1: 0.6103
 epoch: 82, train_loss: 0.2737, test_loss: 1.4684, test_f1: 0.6438
 epoch: 83, train_loss: 0.2671, test_loss: 1.3324, test_f1: 0.6540
 epoch: 84, train_loss: 0.2612, test_loss: 1.5074, test_f1: 0.6184
 epoch: 85, train_loss: 0.2568, test_loss: 1.3765, test_f1: 0.6430
 epoch: 86, train_loss: 0.2641, test_loss: 1.6501, test_f1: 0.5970
 epoch: 87, train_loss: 0.2602, test_loss: 1.5433, test_f1: 0.6334
 epoch: 88, train_loss: 0.2569, test_loss: 1.3900, test_f1: 0.6412
 epoch: 89, train_loss: 0.2835, test_loss: 1.5905, test_f1: 0.6045
 epoch: 90, train_loss: 0.2506, test_loss: 1.5275, test_f1: 0.6251
 epoch: 91, train_loss: 0.2587, test_loss: 1.3806, test_f1: 0.6455
 epoch: 92, train_loss: 0.2611, test_loss: 1.6837, test_f1: 0.6095
 epoch: 93, train_loss: 0.2481, test_loss: 1.5512, test_f1: 0.6284
 epoch: 94, train_loss: 0.2480, test_loss: 1.4868, test_f1: 0.6210
 epoch: 95, train_loss: 0.2475, test_loss: 1.5646, test_f1: 0.6134
 epoch: 96, train_loss: 0.2331, test_loss: 1.7277, test_f1: 0.5999
 epoch: 97, train_loss: 0.2266, test_loss: 1.6743, test_f1: 0.5883
 epoch: 98, train_loss: 0.2277, test_loss: 1.6879, test_f1: 0.6199
 epoch: 99, train_loss: 0.2262, test_loss: 1.7389, test_f1: 0.5945
##################ITERATION #3 ****************************************
 epoch: 0, train_loss: 1.1988, test_loss: 1.3690, test_f1: 0.2321
 epoch: 1, train_loss: 1.0464, test_loss: 1.3877, test_f1: 0.2289
 epoch: 2, train_loss: 0.9976, test_loss: 1.2471, test_f1: 0.3018
 epoch: 3, train_loss: 0.9495, test_loss: 1.1132, test_f1: 0.3994
 epoch: 4, train_loss: 0.9301, test_loss: 1.0152, test_f1: 0.4772
 epoch: 5, train_loss: 0.8974, test_loss: 0.9325, test_f1: 0.5296
 epoch: 6, train_loss: 0.8766, test_loss: 0.9010, test_f1: 0.5720
 epoch: 7, train_loss: 0.8442, test_loss: 0.8855, test_f1: 0.5786
 epoch: 8, train_loss: 0.8338, test_loss: 0.8655, test_f1: 0.5687
 epoch: 9, train_loss: 0.8187, test_loss: 0.9246, test_f1: 0.5494
 epoch: 10, train_loss: 0.8016, test_loss: 0.9009, test_f1: 0.5585
 epoch: 11, train_loss: 0.7721, test_loss: 0.8460, test_f1: 0.5858
 epoch: 12, train_loss: 0.7456, test_loss: 0.8896, test_f1: 0.5847
 epoch: 13, train_loss: 0.7285, test_loss: 0.9051, test_f1: 0.5620
 epoch: 14, train_loss: 0.7140, test_loss: 0.9335, test_f1: 0.5745
 epoch: 15, train_loss: 0.7123, test_loss: 0.8783, test_f1: 0.6119
 epoch: 16, train_loss: 0.6927, test_loss: 0.9096, test_f1: 0.5827
 epoch: 17, train_loss: 0.6755, test_loss: 0.8913, test_f1: 0.5943
 epoch: 18, train_loss: 0.6821, test_loss: 0.9093, test_f1: 0.6013
 epoch: 19, train_loss: 0.6766, test_loss: 0.9046, test_f1: 0.5677
 epoch: 20, train_loss: 0.6767, test_loss: 0.8968, test_f1: 0.5950
 epoch: 21, train_loss: 0.6608, test_loss: 0.8044, test_f1: 0.6000
 epoch: 22, train_loss: 0.6508, test_loss: 0.8876, test_f1: 0.6120
 epoch: 23, train_loss: 0.6310, test_loss: 0.8740, test_f1: 0.6057
 epoch: 24, train_loss: 0.6185, test_loss: 0.9152, test_f1: 0.6031
 epoch: 25, train_loss: 0.6147, test_loss: 0.9417, test_f1: 0.6107
 epoch: 26, train_loss: 0.6016, test_loss: 0.9616, test_f1: 0.5959
 epoch: 27, train_loss: 0.5910, test_loss: 0.8959, test_f1: 0.5990
 epoch: 28, train_loss: 0.5916, test_loss: 0.9399, test_f1: 0.5960
 epoch: 29, train_loss: 0.5924, test_loss: 0.9373, test_f1: 0.5913
 epoch: 30, train_loss: 0.5801, test_loss: 0.9028, test_f1: 0.5921
 epoch: 31, train_loss: 0.5533, test_loss: 0.9745, test_f1: 0.6166
 epoch: 32, train_loss: 0.5446, test_loss: 0.9619, test_f1: 0.6128
 epoch: 33, train_loss: 0.5470, test_loss: 0.9270, test_f1: 0.5920
 epoch: 34, train_loss: 0.5529, test_loss: 1.0050, test_f1: 0.6136
 epoch: 35, train_loss: 0.5483, test_loss: 1.0523, test_f1: 0.5746
 epoch: 36, train_loss: 0.5355, test_loss: 0.9176, test_f1: 0.6103
 epoch: 37, train_loss: 0.5266, test_loss: 1.0028, test_f1: 0.6009
 epoch: 38, train_loss: 0.5133, test_loss: 0.9504, test_f1: 0.6398
 epoch: 39, train_loss: 0.5259, test_loss: 0.9349, test_f1: 0.6193
 epoch: 40, train_loss: 0.5225, test_loss: 1.0507, test_f1: 0.6180
 epoch: 41, train_loss: 0.4897, test_loss: 0.9884, test_f1: 0.6085
 epoch: 42, train_loss: 0.4903, test_loss: 0.8457, test_f1: 0.6534
 epoch: 43, train_loss: 0.5080, test_loss: 0.9989, test_f1: 0.6489
 epoch: 44, train_loss: 0.4866, test_loss: 0.9581, test_f1: 0.6223
 epoch: 45, train_loss: 0.4560, test_loss: 1.0544, test_f1: 0.5743
 epoch: 46, train_loss: 0.4737, test_loss: 0.9842, test_f1: 0.6028
 epoch: 47, train_loss: 0.4807, test_loss: 1.0832, test_f1: 0.6317
 epoch: 48, train_loss: 0.4777, test_loss: 2.1036, test_f1: 0.4463
 epoch: 49, train_loss: 0.4665, test_loss: 0.9037, test_f1: 0.6435
 epoch: 50, train_loss: 0.4600, test_loss: 0.9783, test_f1: 0.6369
 epoch: 51, train_loss: 0.4211, test_loss: 1.0967, test_f1: 0.6181
 epoch: 52, train_loss: 0.3948, test_loss: 0.9682, test_f1: 0.6309
 epoch: 53, train_loss: 0.3872, test_loss: 0.9779, test_f1: 0.6347
 epoch: 54, train_loss: 0.3820, test_loss: 1.0202, test_f1: 0.6516
 epoch: 55, train_loss: 0.3744, test_loss: 0.9640, test_f1: 0.6474
 epoch: 56, train_loss: 0.3619, test_loss: 1.0284, test_f1: 0.6152
 epoch: 57, train_loss: 0.3641, test_loss: 1.0249, test_f1: 0.6386
 epoch: 58, train_loss: 0.3716, test_loss: 0.9858, test_f1: 0.6393
 epoch: 59, train_loss: 0.3527, test_loss: 0.9934, test_f1: 0.6442
 epoch: 60, train_loss: 0.3471, test_loss: 1.0533, test_f1: 0.6248
 epoch: 61, train_loss: 0.3370, test_loss: 1.1847, test_f1: 0.6545
 epoch: 62, train_loss: 0.3400, test_loss: 1.0863, test_f1: 0.6431
 epoch: 63, train_loss: 0.3359, test_loss: 1.3850, test_f1: 0.5976
 epoch: 64, train_loss: 0.3415, test_loss: 1.2922, test_f1: 0.6234
 epoch: 65, train_loss: 0.3313, test_loss: 1.1014, test_f1: 0.6424
 epoch: 66, train_loss: 0.3264, test_loss: 1.1373, test_f1: 0.6380
 epoch: 67, train_loss: 0.3373, test_loss: 1.1934, test_f1: 0.6377
 epoch: 68, train_loss: 0.3258, test_loss: 1.2606, test_f1: 0.6093
 epoch: 69, train_loss: 0.3325, test_loss: 1.3160, test_f1: 0.6184
 epoch: 70, train_loss: 0.3095, test_loss: 1.1453, test_f1: 0.6506
 epoch: 71, train_loss: 0.3078, test_loss: 1.2718, test_f1: 0.6305
 epoch: 72, train_loss: 0.2960, test_loss: 1.3101, test_f1: 0.6181
 epoch: 73, train_loss: 0.2895, test_loss: 1.4064, test_f1: 0.6188
 epoch: 74, train_loss: 0.2939, test_loss: 1.4015, test_f1: 0.6252
 epoch: 75, train_loss: 0.2875, test_loss: 1.3783, test_f1: 0.6413
 epoch: 76, train_loss: 0.2824, test_loss: 1.3462, test_f1: 0.6146
 epoch: 77, train_loss: 0.2791, test_loss: 1.3932, test_f1: 0.6212
 epoch: 78, train_loss: 0.2680, test_loss: 1.3065, test_f1: 0.6503
 epoch: 79, train_loss: 0.2812, test_loss: 1.5487, test_f1: 0.6364
 epoch: 80, train_loss: 0.2908, test_loss: 1.3917, test_f1: 0.6349
 epoch: 81, train_loss: 0.2694, test_loss: 1.3490, test_f1: 0.6188
 epoch: 82, train_loss: 0.2527, test_loss: 1.4644, test_f1: 0.6253
 epoch: 83, train_loss: 0.2564, test_loss: 1.4422, test_f1: 0.6220
 epoch: 84, train_loss: 0.2471, test_loss: 1.5359, test_f1: 0.6216
 epoch: 85, train_loss: 0.2658, test_loss: 1.6067, test_f1: 0.6078
 epoch: 86, train_loss: 0.2808, test_loss: 1.5989, test_f1: 0.6375
 epoch: 87, train_loss: 0.2691, test_loss: 1.5880, test_f1: 0.6285
 epoch: 88, train_loss: 0.2580, test_loss: 1.5446, test_f1: 0.6134
 epoch: 89, train_loss: 0.2427, test_loss: 1.6720, test_f1: 0.6428
 epoch: 90, train_loss: 0.2335, test_loss: 1.5577, test_f1: 0.6241
 epoch: 91, train_loss: 0.2409, test_loss: 1.5889, test_f1: 0.6220
 epoch: 92, train_loss: 0.2547, test_loss: 1.5747, test_f1: 0.6377
 epoch: 93, train_loss: 0.2426, test_loss: 1.5932, test_f1: 0.6415
 epoch: 94, train_loss: 0.2321, test_loss: 1.6104, test_f1: 0.6306
 epoch: 95, train_loss: 0.2353, test_loss: 1.5129, test_f1: 0.6307
 epoch: 96, train_loss: 0.2270, test_loss: 1.5838, test_f1: 0.6258
 epoch: 97, train_loss: 0.2362, test_loss: 1.6417, test_f1: 0.6157
 epoch: 98, train_loss: 0.2343, test_loss: 1.6587, test_f1: 0.6424
 epoch: 99, train_loss: 0.2345, test_loss: 1.5822, test_f1: 0.6199
##################ITERATION #4 ****************************************
 epoch: 0, train_loss: 1.2106, test_loss: 1.3496, test_f1: 0.2260
 epoch: 1, train_loss: 1.0442, test_loss: 1.3799, test_f1: 0.2260
 epoch: 2, train_loss: 0.9890, test_loss: 1.3129, test_f1: 0.2266
 epoch: 3, train_loss: 0.9489, test_loss: 1.1922, test_f1: 0.3236
 epoch: 4, train_loss: 0.9006, test_loss: 1.0039, test_f1: 0.4329
 epoch: 5, train_loss: 0.8724, test_loss: 0.9036, test_f1: 0.5165
 epoch: 6, train_loss: 0.8687, test_loss: 0.9303, test_f1: 0.5193
 epoch: 7, train_loss: 0.8463, test_loss: 0.8452, test_f1: 0.5612
 epoch: 8, train_loss: 0.8332, test_loss: 1.0205, test_f1: 0.5122
 epoch: 9, train_loss: 0.8319, test_loss: 0.9275, test_f1: 0.5481
 epoch: 10, train_loss: 0.7957, test_loss: 0.8899, test_f1: 0.5906
 epoch: 11, train_loss: 0.7850, test_loss: 0.9602, test_f1: 0.5393
 epoch: 12, train_loss: 0.7648, test_loss: 0.9317, test_f1: 0.5425
 epoch: 13, train_loss: 0.7586, test_loss: 0.9411, test_f1: 0.5459
 epoch: 14, train_loss: 0.7470, test_loss: 0.9394, test_f1: 0.5851
 epoch: 15, train_loss: 0.7206, test_loss: 0.9723, test_f1: 0.5450
 epoch: 16, train_loss: 0.7251, test_loss: 0.8964, test_f1: 0.5834
 epoch: 17, train_loss: 0.7033, test_loss: 0.9753, test_f1: 0.5765
 epoch: 18, train_loss: 0.6930, test_loss: 0.8294, test_f1: 0.6274
 epoch: 19, train_loss: 0.6976, test_loss: 0.8840, test_f1: 0.6195
 epoch: 20, train_loss: 0.6683, test_loss: 1.0491, test_f1: 0.5565
 epoch: 21, train_loss: 0.6634, test_loss: 1.0773, test_f1: 0.5286
 epoch: 22, train_loss: 0.6780, test_loss: 0.8895, test_f1: 0.6035
 epoch: 23, train_loss: 0.6495, test_loss: 0.9374, test_f1: 0.5932
 epoch: 24, train_loss: 0.6328, test_loss: 0.9057, test_f1: 0.6141
 epoch: 25, train_loss: 0.6426, test_loss: 1.0490, test_f1: 0.5551
 epoch: 26, train_loss: 0.6535, test_loss: 1.0922, test_f1: 0.5473
 epoch: 27, train_loss: 0.6190, test_loss: 0.9039, test_f1: 0.6288
 epoch: 28, train_loss: 0.6056, test_loss: 0.9995, test_f1: 0.5777
 epoch: 29, train_loss: 0.6212, test_loss: 0.9639, test_f1: 0.5715
 epoch: 30, train_loss: 0.5910, test_loss: 1.0416, test_f1: 0.5754
 epoch: 31, train_loss: 0.5861, test_loss: 0.9722, test_f1: 0.5949
 epoch: 32, train_loss: 0.5868, test_loss: 1.0861, test_f1: 0.5773
 epoch: 33, train_loss: 0.5693, test_loss: 0.9177, test_f1: 0.6130
 epoch: 34, train_loss: 0.5678, test_loss: 0.9408, test_f1: 0.5953
 epoch: 35, train_loss: 0.5586, test_loss: 1.1161, test_f1: 0.5356
 epoch: 36, train_loss: 0.5783, test_loss: 0.9973, test_f1: 0.6046
 epoch: 37, train_loss: 0.5337, test_loss: 0.9963, test_f1: 0.5944
 epoch: 38, train_loss: 0.5319, test_loss: 0.9526, test_f1: 0.6161
 epoch: 39, train_loss: 0.5222, test_loss: 1.0072, test_f1: 0.6173
 epoch: 40, train_loss: 0.5165, test_loss: 0.9349, test_f1: 0.6493
 epoch: 41, train_loss: 0.5123, test_loss: 1.0067, test_f1: 0.6271
 epoch: 42, train_loss: 0.5173, test_loss: 1.0094, test_f1: 0.6106
 epoch: 43, train_loss: 0.5033, test_loss: 1.1238, test_f1: 0.6153
 epoch: 44, train_loss: 0.5100, test_loss: 1.0851, test_f1: 0.5913
 epoch: 45, train_loss: 0.4828, test_loss: 1.0612, test_f1: 0.6377
 epoch: 46, train_loss: 0.4674, test_loss: 1.1472, test_f1: 0.6311
 epoch: 47, train_loss: 0.4708, test_loss: 0.9926, test_f1: 0.6236
 epoch: 48, train_loss: 0.4640, test_loss: 1.1444, test_f1: 0.6194
 epoch: 49, train_loss: 0.4489, test_loss: 1.1845, test_f1: 0.5595
 epoch: 50, train_loss: 0.4441, test_loss: 1.2222, test_f1: 0.6188
 epoch: 51, train_loss: 0.4275, test_loss: 1.1005, test_f1: 0.6329
 epoch: 52, train_loss: 0.3995, test_loss: 1.1502, test_f1: 0.6447
 epoch: 53, train_loss: 0.3807, test_loss: 1.2205, test_f1: 0.6205
 epoch: 54, train_loss: 0.3862, test_loss: 1.1772, test_f1: 0.6358
 epoch: 55, train_loss: 0.3666, test_loss: 1.1506, test_f1: 0.6460
 epoch: 56, train_loss: 0.3815, test_loss: 1.1304, test_f1: 0.6526
 epoch: 57, train_loss: 0.3652, test_loss: 1.2426, test_f1: 0.6319
 epoch: 58, train_loss: 0.3658, test_loss: 1.2554, test_f1: 0.6158
 epoch: 59, train_loss: 0.3642, test_loss: 1.2544, test_f1: 0.6402
 epoch: 60, train_loss: 0.3579, test_loss: 1.2497, test_f1: 0.6069
 epoch: 61, train_loss: 0.3461, test_loss: 1.2288, test_f1: 0.6305
 epoch: 62, train_loss: 0.3446, test_loss: 1.2238, test_f1: 0.6255
 epoch: 63, train_loss: 0.3424, test_loss: 1.3619, test_f1: 0.6226
 epoch: 64, train_loss: 0.3352, test_loss: 1.3653, test_f1: 0.6539
 epoch: 65, train_loss: 0.3301, test_loss: 1.3515, test_f1: 0.6308
 epoch: 66, train_loss: 0.3242, test_loss: 1.3818, test_f1: 0.6269
 epoch: 67, train_loss: 0.3234, test_loss: 1.5026, test_f1: 0.5946
 epoch: 68, train_loss: 0.3259, test_loss: 1.3477, test_f1: 0.6293
 epoch: 69, train_loss: 0.3219, test_loss: 1.3862, test_f1: 0.6476
 epoch: 70, train_loss: 0.3234, test_loss: 1.2605, test_f1: 0.6156
 epoch: 71, train_loss: 0.3045, test_loss: 1.4259, test_f1: 0.6264
 epoch: 72, train_loss: 0.3079, test_loss: 1.3522, test_f1: 0.6555
 epoch: 73, train_loss: 0.3175, test_loss: 1.3802, test_f1: 0.6412
 epoch: 74, train_loss: 0.3033, test_loss: 1.4571, test_f1: 0.6013
 epoch: 75, train_loss: 0.3105, test_loss: 1.3676, test_f1: 0.6501
 epoch: 76, train_loss: 0.2950, test_loss: 1.4682, test_f1: 0.6357
 epoch: 77, train_loss: 0.2994, test_loss: 1.4729, test_f1: 0.6333
 epoch: 78, train_loss: 0.2773, test_loss: 1.4947, test_f1: 0.6012
 epoch: 79, train_loss: 0.2818, test_loss: 1.4257, test_f1: 0.6220
 epoch: 80, train_loss: 0.2691, test_loss: 1.4518, test_f1: 0.6417
 epoch: 81, train_loss: 0.2838, test_loss: 1.3984, test_f1: 0.6601
 epoch: 82, train_loss: 0.2868, test_loss: 1.5385, test_f1: 0.6344
 epoch: 83, train_loss: 0.2754, test_loss: 1.4106, test_f1: 0.6347
 epoch: 84, train_loss: 0.2944, test_loss: 1.3040, test_f1: 0.6582
 epoch: 85, train_loss: 0.2737, test_loss: 1.5304, test_f1: 0.6219
 epoch: 86, train_loss: 0.2770, test_loss: 1.6233, test_f1: 0.6207
 epoch: 87, train_loss: 0.2725, test_loss: 1.5344, test_f1: 0.6218
 epoch: 88, train_loss: 0.2617, test_loss: 1.4841, test_f1: 0.6320
 epoch: 89, train_loss: 0.2456, test_loss: 1.5870, test_f1: 0.6247
 epoch: 90, train_loss: 0.2600, test_loss: 1.4057, test_f1: 0.6250
 epoch: 91, train_loss: 0.2605, test_loss: 1.7066, test_f1: 0.6174
 epoch: 92, train_loss: 0.2600, test_loss: 1.6121, test_f1: 0.6575
 epoch: 93, train_loss: 0.2474, test_loss: 1.7577, test_f1: 0.5994
 epoch: 94, train_loss: 0.2548, test_loss: 1.5591, test_f1: 0.6334
 epoch: 95, train_loss: 0.2410, test_loss: 1.5045, test_f1: 0.6383
 epoch: 96, train_loss: 0.2379, test_loss: 1.6323, test_f1: 0.6238
 epoch: 97, train_loss: 0.2320, test_loss: 1.6552, test_f1: 0.6311
 epoch: 98, train_loss: 0.2278, test_loss: 1.5374, test_f1: 0.6439
 epoch: 99, train_loss: 0.2293, test_loss: 1.6478, test_f1: 0.6140
##################ITERATION #5 ****************************************
 epoch: 0, train_loss: 1.2496, test_loss: 1.3515, test_f1: 0.2260
 epoch: 1, train_loss: 1.0622, test_loss: 1.3223, test_f1: 0.2335
 epoch: 2, train_loss: 1.0115, test_loss: 1.1363, test_f1: 0.3918
 epoch: 3, train_loss: 0.9725, test_loss: 1.0172, test_f1: 0.4197
 epoch: 4, train_loss: 0.9543, test_loss: 1.0040, test_f1: 0.4895
 epoch: 5, train_loss: 0.9154, test_loss: 0.9833, test_f1: 0.5271
 epoch: 6, train_loss: 0.9064, test_loss: 0.9647, test_f1: 0.5448
 epoch: 7, train_loss: 0.8901, test_loss: 0.9746, test_f1: 0.5220
 epoch: 8, train_loss: 0.8704, test_loss: 0.9299, test_f1: 0.5444
 epoch: 9, train_loss: 0.8560, test_loss: 0.9774, test_f1: 0.5183
 epoch: 10, train_loss: 0.8305, test_loss: 0.9565, test_f1: 0.5434
 epoch: 11, train_loss: 0.8167, test_loss: 0.9169, test_f1: 0.5481
 epoch: 12, train_loss: 0.7924, test_loss: 0.9946, test_f1: 0.5303
 epoch: 13, train_loss: 0.8008, test_loss: 0.9220, test_f1: 0.5391
 epoch: 14, train_loss: 0.7815, test_loss: 0.9813, test_f1: 0.5306
 epoch: 15, train_loss: 0.7722, test_loss: 0.9817, test_f1: 0.5549
 epoch: 16, train_loss: 0.7551, test_loss: 0.8912, test_f1: 0.5599
 epoch: 17, train_loss: 0.7446, test_loss: 0.9043, test_f1: 0.5920
 epoch: 18, train_loss: 0.7412, test_loss: 0.9156, test_f1: 0.5701
 epoch: 19, train_loss: 0.7254, test_loss: 0.8689, test_f1: 0.5721
 epoch: 20, train_loss: 0.7257, test_loss: 0.9536, test_f1: 0.5570
 epoch: 21, train_loss: 0.7139, test_loss: 0.9156, test_f1: 0.5707
 epoch: 22, train_loss: 0.6920, test_loss: 0.9488, test_f1: 0.5563
 epoch: 23, train_loss: 0.6870, test_loss: 0.9846, test_f1: 0.5450
 epoch: 24, train_loss: 0.6665, test_loss: 0.9076, test_f1: 0.5852
 epoch: 25, train_loss: 0.6636, test_loss: 0.8632, test_f1: 0.5925
 epoch: 26, train_loss: 0.6526, test_loss: 0.9964, test_f1: 0.5582
 epoch: 27, train_loss: 0.6461, test_loss: 0.9981, test_f1: 0.5840
 epoch: 28, train_loss: 0.6445, test_loss: 0.9048, test_f1: 0.6067
 epoch: 29, train_loss: 0.6517, test_loss: 1.1217, test_f1: 0.5806
 epoch: 30, train_loss: 0.6178, test_loss: 0.8793, test_f1: 0.6122
 epoch: 31, train_loss: 0.6338, test_loss: 0.8776, test_f1: 0.6057
 epoch: 32, train_loss: 0.6196, test_loss: 0.8953, test_f1: 0.5994
 epoch: 33, train_loss: 0.5999, test_loss: 0.8877, test_f1: 0.6025
 epoch: 34, train_loss: 0.5871, test_loss: 0.8587, test_f1: 0.6144
 epoch: 35, train_loss: 0.5790, test_loss: 0.8939, test_f1: 0.6139
 epoch: 36, train_loss: 0.5930, test_loss: 0.9394, test_f1: 0.5894
 epoch: 37, train_loss: 0.5977, test_loss: 0.9298, test_f1: 0.6135
 epoch: 38, train_loss: 0.5910, test_loss: 0.9974, test_f1: 0.5692
 epoch: 39, train_loss: 0.5755, test_loss: 0.9312, test_f1: 0.5604
 epoch: 40, train_loss: 0.5601, test_loss: 0.9984, test_f1: 0.5651
 epoch: 41, train_loss: 0.5573, test_loss: 1.0052, test_f1: 0.5792
 epoch: 42, train_loss: 0.5555, test_loss: 1.0206, test_f1: 0.5633
 epoch: 43, train_loss: 0.5284, test_loss: 1.0130, test_f1: 0.5765
 epoch: 44, train_loss: 0.5358, test_loss: 1.0415, test_f1: 0.5817
 epoch: 45, train_loss: 0.5136, test_loss: 0.8913, test_f1: 0.6144
 epoch: 46, train_loss: 0.5398, test_loss: 1.1122, test_f1: 0.5391
 epoch: 47, train_loss: 0.5162, test_loss: 0.8764, test_f1: 0.6039
 epoch: 48, train_loss: 0.5033, test_loss: 0.8210, test_f1: 0.6541
 epoch: 49, train_loss: 0.5041, test_loss: 1.2913, test_f1: 0.5325
 epoch: 50, train_loss: 0.5092, test_loss: 0.9043, test_f1: 0.6119
 epoch: 51, train_loss: 0.4861, test_loss: 1.0183, test_f1: 0.5733
 epoch: 52, train_loss: 0.4646, test_loss: 0.9769, test_f1: 0.6015
 epoch: 53, train_loss: 0.4337, test_loss: 0.9314, test_f1: 0.6113
 epoch: 54, train_loss: 0.4354, test_loss: 0.9519, test_f1: 0.6321
 epoch: 55, train_loss: 0.4167, test_loss: 0.9875, test_f1: 0.6200
 epoch: 56, train_loss: 0.4213, test_loss: 0.9691, test_f1: 0.6179
 epoch: 57, train_loss: 0.4174, test_loss: 1.0594, test_f1: 0.5705
 epoch: 58, train_loss: 0.4097, test_loss: 1.0991, test_f1: 0.5890
 epoch: 59, train_loss: 0.4151, test_loss: 1.0139, test_f1: 0.6076
 epoch: 60, train_loss: 0.4069, test_loss: 1.1008, test_f1: 0.6065
 epoch: 61, train_loss: 0.4141, test_loss: 0.9773, test_f1: 0.6085
 epoch: 62, train_loss: 0.3900, test_loss: 0.8639, test_f1: 0.6350
 epoch: 63, train_loss: 0.4066, test_loss: 1.1807, test_f1: 0.5874
 epoch: 64, train_loss: 0.3899, test_loss: 1.0521, test_f1: 0.5829
 epoch: 65, train_loss: 0.3907, test_loss: 1.0357, test_f1: 0.6116
 epoch: 66, train_loss: 0.3798, test_loss: 0.9550, test_f1: 0.6177
 epoch: 67, train_loss: 0.3626, test_loss: 1.1065, test_f1: 0.6014
 epoch: 68, train_loss: 0.3865, test_loss: 1.0308, test_f1: 0.6314
 epoch: 69, train_loss: 0.3735, test_loss: 1.0880, test_f1: 0.5843
 epoch: 70, train_loss: 0.3814, test_loss: 1.0266, test_f1: 0.6235
 epoch: 71, train_loss: 0.3817, test_loss: 1.0420, test_f1: 0.6089
 epoch: 72, train_loss: 0.3587, test_loss: 1.0380, test_f1: 0.6215
 epoch: 73, train_loss: 0.3423, test_loss: 1.0626, test_f1: 0.6032
 epoch: 74, train_loss: 0.3543, test_loss: 1.1657, test_f1: 0.5935
 epoch: 75, train_loss: 0.3485, test_loss: 1.0935, test_f1: 0.6072
 epoch: 76, train_loss: 0.3460, test_loss: 1.1067, test_f1: 0.6403
 epoch: 77, train_loss: 0.3468, test_loss: 1.0730, test_f1: 0.6452
 epoch: 78, train_loss: 0.3347, test_loss: 1.0752, test_f1: 0.6236
 epoch: 79, train_loss: 0.3596, test_loss: 1.2866, test_f1: 0.5881
 epoch: 80, train_loss: 0.3634, test_loss: 1.0562, test_f1: 0.5957
 epoch: 81, train_loss: 0.3495, test_loss: 1.0203, test_f1: 0.6466
 epoch: 82, train_loss: 0.3270, test_loss: 1.0519, test_f1: 0.6370
 epoch: 83, train_loss: 0.3243, test_loss: 1.0641, test_f1: 0.6338
 epoch: 84, train_loss: 0.3253, test_loss: 1.0629, test_f1: 0.6296
 epoch: 85, train_loss: 0.3202, test_loss: 1.2521, test_f1: 0.6047
 epoch: 86, train_loss: 0.3143, test_loss: 1.0675, test_f1: 0.6354
 epoch: 87, train_loss: 0.3198, test_loss: 1.0531, test_f1: 0.6343
 epoch: 88, train_loss: 0.3084, test_loss: 1.1541, test_f1: 0.6414
 epoch: 89, train_loss: 0.3082, test_loss: 1.1870, test_f1: 0.6131
 epoch: 90, train_loss: 0.3057, test_loss: 1.1001, test_f1: 0.6257
 epoch: 91, train_loss: 0.2958, test_loss: 1.2008, test_f1: 0.6251
 epoch: 92, train_loss: 0.3188, test_loss: 1.1433, test_f1: 0.6231
 epoch: 93, train_loss: 0.2948, test_loss: 1.1688, test_f1: 0.6215
 epoch: 94, train_loss: 0.2995, test_loss: 1.2126, test_f1: 0.6072
 epoch: 95, train_loss: 0.2862, test_loss: 1.2844, test_f1: 0.6240
 epoch: 96, train_loss: 0.2953, test_loss: 1.2995, test_f1: 0.6193
 epoch: 97, train_loss: 0.2884, test_loss: 1.5180, test_f1: 0.5847
 epoch: 98, train_loss: 0.2888, test_loss: 1.1951, test_f1: 0.6278
 epoch: 99, train_loss: 0.3029, test_loss: 1.2436, test_f1: 0.5997
##################ITERATION #6 ****************************************
 epoch: 0, train_loss: 1.3064, test_loss: 1.3386, test_f1: 0.2379
 epoch: 1, train_loss: 1.0923, test_loss: 1.2638, test_f1: 0.2610
 epoch: 2, train_loss: 1.0482, test_loss: 1.1102, test_f1: 0.3914
 epoch: 3, train_loss: 1.0114, test_loss: 1.1208, test_f1: 0.4061
 epoch: 4, train_loss: 0.9864, test_loss: 1.1311, test_f1: 0.4094
 epoch: 5, train_loss: 0.9542, test_loss: 0.9880, test_f1: 0.4952
 epoch: 6, train_loss: 0.9263, test_loss: 1.0065, test_f1: 0.5149
 epoch: 7, train_loss: 0.8992, test_loss: 0.9415, test_f1: 0.5603
 epoch: 8, train_loss: 0.8693, test_loss: 0.9517, test_f1: 0.5133
 epoch: 9, train_loss: 0.8669, test_loss: 0.9226, test_f1: 0.5478
 epoch: 10, train_loss: 0.8445, test_loss: 0.9199, test_f1: 0.5688
 epoch: 11, train_loss: 0.8218, test_loss: 0.9033, test_f1: 0.5925
 epoch: 12, train_loss: 0.8156, test_loss: 0.9112, test_f1: 0.5741
 epoch: 13, train_loss: 0.8133, test_loss: 0.9042, test_f1: 0.5758
 epoch: 14, train_loss: 0.8007, test_loss: 0.9110, test_f1: 0.5824
 epoch: 15, train_loss: 0.7686, test_loss: 0.8896, test_f1: 0.5678
 epoch: 16, train_loss: 0.7630, test_loss: 0.9636, test_f1: 0.5444
 epoch: 17, train_loss: 0.7769, test_loss: 0.9226, test_f1: 0.5882
 epoch: 18, train_loss: 0.7348, test_loss: 0.9425, test_f1: 0.5822
 epoch: 19, train_loss: 0.7241, test_loss: 0.9263, test_f1: 0.6029
 epoch: 20, train_loss: 0.7231, test_loss: 0.9235, test_f1: 0.5767
 epoch: 21, train_loss: 0.7092, test_loss: 1.0141, test_f1: 0.5581
 epoch: 22, train_loss: 0.6950, test_loss: 0.9247, test_f1: 0.5941
 epoch: 23, train_loss: 0.6883, test_loss: 0.9168, test_f1: 0.5984
 epoch: 24, train_loss: 0.6685, test_loss: 0.8950, test_f1: 0.5995
 epoch: 25, train_loss: 0.6580, test_loss: 0.9246, test_f1: 0.6014
 epoch: 26, train_loss: 0.6452, test_loss: 0.9493, test_f1: 0.5999
 epoch: 27, train_loss: 0.6526, test_loss: 0.9370, test_f1: 0.5757
 epoch: 28, train_loss: 0.6495, test_loss: 0.8895, test_f1: 0.6136
 epoch: 29, train_loss: 0.6350, test_loss: 0.9657, test_f1: 0.6110
 epoch: 30, train_loss: 0.6223, test_loss: 0.8908, test_f1: 0.6104
 epoch: 31, train_loss: 0.6008, test_loss: 1.0207, test_f1: 0.5588
 epoch: 32, train_loss: 0.5709, test_loss: 0.9074, test_f1: 0.5778
 epoch: 33, train_loss: 0.5766, test_loss: 0.9411, test_f1: 0.6152
 epoch: 34, train_loss: 0.5933, test_loss: 0.9850, test_f1: 0.5751
 epoch: 35, train_loss: 0.5781, test_loss: 0.9265, test_f1: 0.6069
 epoch: 36, train_loss: 0.5691, test_loss: 0.9292, test_f1: 0.6289
 epoch: 37, train_loss: 0.5698, test_loss: 0.9495, test_f1: 0.6048
 epoch: 38, train_loss: 0.5456, test_loss: 1.0347, test_f1: 0.5741
 epoch: 39, train_loss: 0.5369, test_loss: 0.9670, test_f1: 0.6096
 epoch: 40, train_loss: 0.5417, test_loss: 0.9596, test_f1: 0.6001
 epoch: 41, train_loss: 0.5236, test_loss: 0.9572, test_f1: 0.5748
 epoch: 42, train_loss: 0.5103, test_loss: 1.0179, test_f1: 0.5694
 epoch: 43, train_loss: 0.4994, test_loss: 0.8790, test_f1: 0.6211
 epoch: 44, train_loss: 0.4946, test_loss: 1.0693, test_f1: 0.5852
 epoch: 45, train_loss: 0.4801, test_loss: 0.9339, test_f1: 0.6432
 epoch: 46, train_loss: 0.4530, test_loss: 0.9347, test_f1: 0.6071
 epoch: 47, train_loss: 0.4757, test_loss: 0.9065, test_f1: 0.6373
 epoch: 48, train_loss: 0.4564, test_loss: 1.0311, test_f1: 0.6184
 epoch: 49, train_loss: 0.4540, test_loss: 0.9656, test_f1: 0.6318
 epoch: 50, train_loss: 0.4593, test_loss: 1.0104, test_f1: 0.6428
 epoch: 51, train_loss: 0.4246, test_loss: 0.9547, test_f1: 0.6325
 epoch: 52, train_loss: 0.4001, test_loss: 0.9521, test_f1: 0.6676
 epoch: 53, train_loss: 0.3832, test_loss: 0.9468, test_f1: 0.6421
 epoch: 54, train_loss: 0.3827, test_loss: 0.9252, test_f1: 0.6482
 epoch: 55, train_loss: 0.3689, test_loss: 0.8908, test_f1: 0.6579
 epoch: 56, train_loss: 0.3760, test_loss: 0.9430, test_f1: 0.6731
 epoch: 57, train_loss: 0.3708, test_loss: 0.9938, test_f1: 0.6718
 epoch: 58, train_loss: 0.3671, test_loss: 0.9753, test_f1: 0.6482
 epoch: 59, train_loss: 0.3459, test_loss: 0.9107, test_f1: 0.6538
 epoch: 60, train_loss: 0.3443, test_loss: 0.9794, test_f1: 0.6296
 epoch: 61, train_loss: 0.3342, test_loss: 1.0450, test_f1: 0.6164
 epoch: 62, train_loss: 0.3418, test_loss: 0.9952, test_f1: 0.6567
 epoch: 63, train_loss: 0.3335, test_loss: 0.9794, test_f1: 0.6384
 epoch: 64, train_loss: 0.3379, test_loss: 1.0286, test_f1: 0.6299
 epoch: 65, train_loss: 0.3185, test_loss: 0.9908, test_f1: 0.6496
 epoch: 66, train_loss: 0.3303, test_loss: 1.0690, test_f1: 0.6566
 epoch: 67, train_loss: 0.3096, test_loss: 1.0209, test_f1: 0.6320
 epoch: 68, train_loss: 0.3134, test_loss: 1.0426, test_f1: 0.6316
 epoch: 69, train_loss: 0.3209, test_loss: 0.9865, test_f1: 0.6489
 epoch: 70, train_loss: 0.3198, test_loss: 1.0277, test_f1: 0.6434
 epoch: 71, train_loss: 0.3042, test_loss: 1.0169, test_f1: 0.6330
 epoch: 72, train_loss: 0.2861, test_loss: 1.1081, test_f1: 0.6526
 epoch: 73, train_loss: 0.3117, test_loss: 1.0322, test_f1: 0.6450
 epoch: 74, train_loss: 0.2970, test_loss: 1.1365, test_f1: 0.6274
 epoch: 75, train_loss: 0.2947, test_loss: 1.0773, test_f1: 0.6417
 epoch: 76, train_loss: 0.2763, test_loss: 1.1420, test_f1: 0.6664
 epoch: 77, train_loss: 0.2885, test_loss: 1.1263, test_f1: 0.6284
 epoch: 78, train_loss: 0.2725, test_loss: 1.2321, test_f1: 0.6104
 epoch: 79, train_loss: 0.2767, test_loss: 1.0935, test_f1: 0.6459
 epoch: 80, train_loss: 0.2892, test_loss: 1.0645, test_f1: 0.6549
 epoch: 81, train_loss: 0.2820, test_loss: 1.0794, test_f1: 0.6648
 epoch: 82, train_loss: 0.2879, test_loss: 1.1634, test_f1: 0.6220
 epoch: 83, train_loss: 0.2910, test_loss: 1.2028, test_f1: 0.6464
 epoch: 84, train_loss: 0.2830, test_loss: 1.1497, test_f1: 0.6282
 epoch: 85, train_loss: 0.2735, test_loss: 1.0803, test_f1: 0.6565
 epoch: 86, train_loss: 0.2617, test_loss: 1.1526, test_f1: 0.6422
 epoch: 87, train_loss: 0.2646, test_loss: 1.1670, test_f1: 0.6278
 epoch: 88, train_loss: 0.2380, test_loss: 1.1923, test_f1: 0.6544
 epoch: 89, train_loss: 0.2394, test_loss: 1.1708, test_f1: 0.6751
 epoch: 90, train_loss: 0.2378, test_loss: 1.2286, test_f1: 0.6424
 epoch: 91, train_loss: 0.2521, test_loss: 1.1709, test_f1: 0.6347
 epoch: 92, train_loss: 0.2473, test_loss: 1.2755, test_f1: 0.6283
 epoch: 93, train_loss: 0.2430, test_loss: 1.2720, test_f1: 0.6361
 epoch: 94, train_loss: 0.2254, test_loss: 1.2363, test_f1: 0.6251
 epoch: 95, train_loss: 0.2463, test_loss: 1.3675, test_f1: 0.6159
 epoch: 96, train_loss: 0.2439, test_loss: 1.1896, test_f1: 0.6292
 epoch: 97, train_loss: 0.2396, test_loss: 1.3793, test_f1: 0.6307
 epoch: 98, train_loss: 0.2338, test_loss: 1.1858, test_f1: 0.6297
 epoch: 99, train_loss: 0.2246, test_loss: 1.2895, test_f1: 0.6421
##################ITERATION #7 ****************************************
 epoch: 0, train_loss: 1.3595, test_loss: 1.3667, test_f1: 0.2260
 epoch: 1, train_loss: 1.0806, test_loss: 1.3366, test_f1: 0.2264
 epoch: 2, train_loss: 1.0224, test_loss: 1.2540, test_f1: 0.2555
 epoch: 3, train_loss: 0.9675, test_loss: 1.1214, test_f1: 0.4097
 epoch: 4, train_loss: 0.9310, test_loss: 0.9880, test_f1: 0.4931
 epoch: 5, train_loss: 0.8953, test_loss: 0.9484, test_f1: 0.5236
 epoch: 6, train_loss: 0.8652, test_loss: 0.9418, test_f1: 0.5004
 epoch: 7, train_loss: 0.8581, test_loss: 0.9271, test_f1: 0.5202
 epoch: 8, train_loss: 0.8352, test_loss: 0.9194, test_f1: 0.5677
 epoch: 9, train_loss: 0.8377, test_loss: 0.8880, test_f1: 0.5616
 epoch: 10, train_loss: 0.8125, test_loss: 0.8864, test_f1: 0.5655
 epoch: 11, train_loss: 0.7772, test_loss: 1.0527, test_f1: 0.5208
 epoch: 12, train_loss: 0.7748, test_loss: 0.8658, test_f1: 0.5839
 epoch: 13, train_loss: 0.7501, test_loss: 0.8802, test_f1: 0.5635
 epoch: 14, train_loss: 0.7476, test_loss: 0.8539, test_f1: 0.6045
 epoch: 15, train_loss: 0.7287, test_loss: 0.8801, test_f1: 0.5915
 epoch: 16, train_loss: 0.7262, test_loss: 0.8971, test_f1: 0.6028
 epoch: 17, train_loss: 0.7045, test_loss: 0.8622, test_f1: 0.6175
 epoch: 18, train_loss: 0.7185, test_loss: 0.8998, test_f1: 0.5868
 epoch: 19, train_loss: 0.7116, test_loss: 0.8419, test_f1: 0.6284
 epoch: 20, train_loss: 0.6967, test_loss: 0.8452, test_f1: 0.6280
 epoch: 21, train_loss: 0.6633, test_loss: 0.8914, test_f1: 0.6022
 epoch: 22, train_loss: 0.6576, test_loss: 0.8702, test_f1: 0.6434
 epoch: 23, train_loss: 0.6449, test_loss: 1.2837, test_f1: 0.5357
 epoch: 24, train_loss: 0.6332, test_loss: 0.8961, test_f1: 0.6042
 epoch: 25, train_loss: 0.6311, test_loss: 0.9121, test_f1: 0.6277
 epoch: 26, train_loss: 0.6226, test_loss: 0.8633, test_f1: 0.6195
 epoch: 27, train_loss: 0.5957, test_loss: 0.9000, test_f1: 0.6178
 epoch: 28, train_loss: 0.6008, test_loss: 0.9115, test_f1: 0.5997
 epoch: 29, train_loss: 0.5971, test_loss: 0.8901, test_f1: 0.5922
 epoch: 30, train_loss: 0.5859, test_loss: 0.8885, test_f1: 0.6148
 epoch: 31, train_loss: 0.5668, test_loss: 0.8832, test_f1: 0.6616
 epoch: 32, train_loss: 0.5610, test_loss: 0.8795, test_f1: 0.6371
 epoch: 33, train_loss: 0.5750, test_loss: 1.0113, test_f1: 0.6051
 epoch: 34, train_loss: 0.5659, test_loss: 0.9281, test_f1: 0.6132
 epoch: 35, train_loss: 0.5376, test_loss: 0.8628, test_f1: 0.6380
 epoch: 36, train_loss: 0.5222, test_loss: 0.9573, test_f1: 0.6034
 epoch: 37, train_loss: 0.5280, test_loss: 1.0018, test_f1: 0.5943
 epoch: 38, train_loss: 0.5280, test_loss: 0.9205, test_f1: 0.6170
 epoch: 39, train_loss: 0.5365, test_loss: 1.0586, test_f1: 0.5753
 epoch: 40, train_loss: 0.5239, test_loss: 0.9017, test_f1: 0.6400
 epoch: 41, train_loss: 0.5173, test_loss: 1.0004, test_f1: 0.6193
 epoch: 42, train_loss: 0.4792, test_loss: 0.9143, test_f1: 0.6597
 epoch: 43, train_loss: 0.4975, test_loss: 1.0349, test_f1: 0.5846
 epoch: 44, train_loss: 0.5016, test_loss: 1.0154, test_f1: 0.5951
 epoch: 45, train_loss: 0.4831, test_loss: 1.3831, test_f1: 0.5257
 epoch: 46, train_loss: 0.4652, test_loss: 0.9711, test_f1: 0.6303
 epoch: 47, train_loss: 0.4421, test_loss: 0.9447, test_f1: 0.6271
 epoch: 48, train_loss: 0.4396, test_loss: 0.9812, test_f1: 0.6163
 epoch: 49, train_loss: 0.4395, test_loss: 1.0303, test_f1: 0.6254
 epoch: 50, train_loss: 0.4635, test_loss: 1.0817, test_f1: 0.5959
 epoch: 51, train_loss: 0.4141, test_loss: 1.0541, test_f1: 0.6206
 epoch: 52, train_loss: 0.3854, test_loss: 0.9818, test_f1: 0.6380
 epoch: 53, train_loss: 0.3779, test_loss: 1.0255, test_f1: 0.6471
 epoch: 54, train_loss: 0.3572, test_loss: 0.9961, test_f1: 0.6423
 epoch: 55, train_loss: 0.3535, test_loss: 1.1412, test_f1: 0.6263
 epoch: 56, train_loss: 0.3448, test_loss: 1.0764, test_f1: 0.6413
 epoch: 57, train_loss: 0.3503, test_loss: 1.1116, test_f1: 0.6400
 epoch: 58, train_loss: 0.3472, test_loss: 1.1062, test_f1: 0.6316
 epoch: 59, train_loss: 0.3706, test_loss: 1.0732, test_f1: 0.6435
 epoch: 60, train_loss: 0.3603, test_loss: 1.0483, test_f1: 0.6488
 epoch: 61, train_loss: 0.3599, test_loss: 1.1016, test_f1: 0.6362
 epoch: 62, train_loss: 0.3411, test_loss: 1.0229, test_f1: 0.6413
 epoch: 63, train_loss: 0.3378, test_loss: 1.1164, test_f1: 0.6403
 epoch: 64, train_loss: 0.3337, test_loss: 1.0811, test_f1: 0.6516
 epoch: 65, train_loss: 0.3479, test_loss: 1.1319, test_f1: 0.6424
 epoch: 66, train_loss: 0.3125, test_loss: 1.1034, test_f1: 0.6288
 epoch: 67, train_loss: 0.3284, test_loss: 1.1483, test_f1: 0.6502
 epoch: 68, train_loss: 0.3166, test_loss: 1.1502, test_f1: 0.6328
 epoch: 69, train_loss: 0.3150, test_loss: 1.1125, test_f1: 0.6428
 epoch: 70, train_loss: 0.3081, test_loss: 1.3169, test_f1: 0.6230
 epoch: 71, train_loss: 0.3084, test_loss: 1.0750, test_f1: 0.6649
 epoch: 72, train_loss: 0.2949, test_loss: 1.2834, test_f1: 0.6248
 epoch: 73, train_loss: 0.2893, test_loss: 1.2007, test_f1: 0.6320
 epoch: 74, train_loss: 0.3006, test_loss: 1.2161, test_f1: 0.6368
 epoch: 75, train_loss: 0.2978, test_loss: 1.2584, test_f1: 0.6148
 epoch: 76, train_loss: 0.3071, test_loss: 1.1714, test_f1: 0.6501
 epoch: 77, train_loss: 0.2898, test_loss: 1.2751, test_f1: 0.6293
 epoch: 78, train_loss: 0.2753, test_loss: 1.2434, test_f1: 0.6515
 epoch: 79, train_loss: 0.2895, test_loss: 1.1805, test_f1: 0.6646
 epoch: 80, train_loss: 0.2751, test_loss: 1.2796, test_f1: 0.6645
 epoch: 81, train_loss: 0.2863, test_loss: 1.2491, test_f1: 0.6347
 epoch: 82, train_loss: 0.2610, test_loss: 1.2360, test_f1: 0.6555
 epoch: 83, train_loss: 0.2599, test_loss: 1.2821, test_f1: 0.6526
 epoch: 84, train_loss: 0.2637, test_loss: 1.3348, test_f1: 0.6428
 epoch: 85, train_loss: 0.2613, test_loss: 1.3363, test_f1: 0.6258
 epoch: 86, train_loss: 0.2562, test_loss: 1.4187, test_f1: 0.6547
 epoch: 87, train_loss: 0.2679, test_loss: 1.2846, test_f1: 0.6513
 epoch: 88, train_loss: 0.2652, test_loss: 1.1483, test_f1: 0.6894
 epoch: 89, train_loss: 0.2569, test_loss: 1.2708, test_f1: 0.6371
 epoch: 90, train_loss: 0.2872, test_loss: 1.4004, test_f1: 0.6280
 epoch: 91, train_loss: 0.2621, test_loss: 1.3431, test_f1: 0.6540
 epoch: 92, train_loss: 0.2567, test_loss: 1.2805, test_f1: 0.6351
 epoch: 93, train_loss: 0.2424, test_loss: 1.2606, test_f1: 0.6620
 epoch: 94, train_loss: 0.2520, test_loss: 1.4564, test_f1: 0.6456
 epoch: 95, train_loss: 0.2338, test_loss: 1.3555, test_f1: 0.6505
 epoch: 96, train_loss: 0.2314, test_loss: 1.4960, test_f1: 0.6577
 epoch: 97, train_loss: 0.2283, test_loss: 1.4688, test_f1: 0.6508
 epoch: 98, train_loss: 0.2307, test_loss: 1.4446, test_f1: 0.6341
 epoch: 99, train_loss: 0.2194, test_loss: 1.4990, test_f1: 0.6312
##################ITERATION #8 ****************************************
 epoch: 0, train_loss: 1.4637, test_loss: 1.3011, test_f1: 0.2260
 epoch: 1, train_loss: 1.1293, test_loss: 1.2611, test_f1: 0.2476
 epoch: 2, train_loss: 1.0319, test_loss: 1.1163, test_f1: 0.3714
 epoch: 3, train_loss: 0.9890, test_loss: 1.0344, test_f1: 0.4269
 epoch: 4, train_loss: 0.9633, test_loss: 0.9861, test_f1: 0.4747
 epoch: 5, train_loss: 0.9443, test_loss: 0.9713, test_f1: 0.4889
 epoch: 6, train_loss: 0.8988, test_loss: 1.0002, test_f1: 0.4972
 epoch: 7, train_loss: 0.8958, test_loss: 0.9287, test_f1: 0.5667
 epoch: 8, train_loss: 0.8684, test_loss: 0.9183, test_f1: 0.5576
 epoch: 9, train_loss: 0.8510, test_loss: 0.9217, test_f1: 0.5954
 epoch: 10, train_loss: 0.8333, test_loss: 0.9199, test_f1: 0.5527
 epoch: 11, train_loss: 0.8246, test_loss: 0.9050, test_f1: 0.5983
 epoch: 12, train_loss: 0.8159, test_loss: 0.9254, test_f1: 0.5518
 epoch: 13, train_loss: 0.8026, test_loss: 0.9646, test_f1: 0.5541
 epoch: 14, train_loss: 0.7808, test_loss: 0.8824, test_f1: 0.5981
 epoch: 15, train_loss: 0.7833, test_loss: 0.9088, test_f1: 0.5819
 epoch: 16, train_loss: 0.7551, test_loss: 0.9008, test_f1: 0.5939
 epoch: 17, train_loss: 0.7474, test_loss: 0.9158, test_f1: 0.5575
 epoch: 18, train_loss: 0.7323, test_loss: 0.8870, test_f1: 0.5804
 epoch: 19, train_loss: 0.7279, test_loss: 0.8810, test_f1: 0.5826
 epoch: 20, train_loss: 0.7267, test_loss: 0.8625, test_f1: 0.6034
 epoch: 21, train_loss: 0.7220, test_loss: 0.9119, test_f1: 0.6034
 epoch: 22, train_loss: 0.7065, test_loss: 0.9053, test_f1: 0.6105
 epoch: 23, train_loss: 0.6851, test_loss: 0.8860, test_f1: 0.6167
 epoch: 24, train_loss: 0.6519, test_loss: 0.9412, test_f1: 0.5989
 epoch: 25, train_loss: 0.6692, test_loss: 0.9617, test_f1: 0.6027
 epoch: 26, train_loss: 0.6691, test_loss: 0.8984, test_f1: 0.6017
 epoch: 27, train_loss: 0.6404, test_loss: 0.9939, test_f1: 0.5714
 epoch: 28, train_loss: 0.6318, test_loss: 0.8800, test_f1: 0.6324
 epoch: 29, train_loss: 0.6318, test_loss: 0.8897, test_f1: 0.5957
 epoch: 30, train_loss: 0.6184, test_loss: 0.9861, test_f1: 0.5911
 epoch: 31, train_loss: 0.6131, test_loss: 0.9198, test_f1: 0.6046
 epoch: 32, train_loss: 0.5914, test_loss: 0.9582, test_f1: 0.5946
 epoch: 33, train_loss: 0.6118, test_loss: 0.9801, test_f1: 0.6075
 epoch: 34, train_loss: 0.5981, test_loss: 0.8842, test_f1: 0.6347
 epoch: 35, train_loss: 0.5772, test_loss: 0.9148, test_f1: 0.6343
 epoch: 36, train_loss: 0.5886, test_loss: 0.9442, test_f1: 0.6271
 epoch: 37, train_loss: 0.5689, test_loss: 0.8611, test_f1: 0.6414
 epoch: 38, train_loss: 0.5658, test_loss: 1.0051, test_f1: 0.5951
 epoch: 39, train_loss: 0.5605, test_loss: 0.9151, test_f1: 0.5968
 epoch: 40, train_loss: 0.5391, test_loss: 0.9392, test_f1: 0.6095
 epoch: 41, train_loss: 0.5400, test_loss: 0.9355, test_f1: 0.6112
 epoch: 42, train_loss: 0.5395, test_loss: 0.9204, test_f1: 0.6159
 epoch: 43, train_loss: 0.5228, test_loss: 1.0643, test_f1: 0.5863
 epoch: 44, train_loss: 0.5156, test_loss: 0.8695, test_f1: 0.6233
 epoch: 45, train_loss: 0.5196, test_loss: 0.9043, test_f1: 0.6221
 epoch: 46, train_loss: 0.5105, test_loss: 0.9153, test_f1: 0.6218
 epoch: 47, train_loss: 0.4984, test_loss: 0.9957, test_f1: 0.6216
 epoch: 48, train_loss: 0.5233, test_loss: 1.2033, test_f1: 0.5669
 epoch: 49, train_loss: 0.5008, test_loss: 1.0226, test_f1: 0.5817
 epoch: 50, train_loss: 0.4996, test_loss: 0.9677, test_f1: 0.6066
 epoch: 51, train_loss: 0.4703, test_loss: 0.9130, test_f1: 0.6268
 epoch: 52, train_loss: 0.4485, test_loss: 0.9759, test_f1: 0.6127
 epoch: 53, train_loss: 0.4277, test_loss: 1.0304, test_f1: 0.6105
 epoch: 54, train_loss: 0.4116, test_loss: 0.9165, test_f1: 0.6541
 epoch: 55, train_loss: 0.4035, test_loss: 0.9247, test_f1: 0.6401
 epoch: 56, train_loss: 0.4110, test_loss: 0.9744, test_f1: 0.6114
 epoch: 57, train_loss: 0.4133, test_loss: 0.9725, test_f1: 0.6302
 epoch: 58, train_loss: 0.4086, test_loss: 0.9626, test_f1: 0.6456
 epoch: 59, train_loss: 0.3968, test_loss: 1.0049, test_f1: 0.6304
 epoch: 60, train_loss: 0.3842, test_loss: 1.0367, test_f1: 0.6387
 epoch: 61, train_loss: 0.3950, test_loss: 0.9489, test_f1: 0.6477
 epoch: 62, train_loss: 0.3826, test_loss: 1.0066, test_f1: 0.6291
 epoch: 63, train_loss: 0.3637, test_loss: 1.0215, test_f1: 0.6322
 epoch: 64, train_loss: 0.3767, test_loss: 0.9645, test_f1: 0.6365
 epoch: 65, train_loss: 0.3650, test_loss: 0.9764, test_f1: 0.6375
 epoch: 66, train_loss: 0.3707, test_loss: 0.9642, test_f1: 0.6507
 epoch: 67, train_loss: 0.3683, test_loss: 1.1583, test_f1: 0.6204
 epoch: 68, train_loss: 0.3643, test_loss: 1.0700, test_f1: 0.6351
 epoch: 69, train_loss: 0.3630, test_loss: 0.9874, test_f1: 0.6669
 epoch: 70, train_loss: 0.3584, test_loss: 1.0417, test_f1: 0.6333
 epoch: 71, train_loss: 0.3564, test_loss: 1.0372, test_f1: 0.6405
 epoch: 72, train_loss: 0.3391, test_loss: 1.0414, test_f1: 0.6404
 epoch: 73, train_loss: 0.3332, test_loss: 1.0157, test_f1: 0.6419
 epoch: 74, train_loss: 0.3372, test_loss: 1.0816, test_f1: 0.6418
 epoch: 75, train_loss: 0.3421, test_loss: 1.0284, test_f1: 0.6549
 epoch: 76, train_loss: 0.3270, test_loss: 1.1483, test_f1: 0.6364
 epoch: 77, train_loss: 0.3333, test_loss: 1.0612, test_f1: 0.6382
 epoch: 78, train_loss: 0.3340, test_loss: 1.0981, test_f1: 0.6268
 epoch: 79, train_loss: 0.3228, test_loss: 1.0888, test_f1: 0.6460
 epoch: 80, train_loss: 0.3459, test_loss: 1.1660, test_f1: 0.6287
 epoch: 81, train_loss: 0.3299, test_loss: 1.0768, test_f1: 0.6308
 epoch: 82, train_loss: 0.3211, test_loss: 1.1131, test_f1: 0.6363
 epoch: 83, train_loss: 0.3003, test_loss: 1.2069, test_f1: 0.6299
 epoch: 84, train_loss: 0.3107, test_loss: 1.2384, test_f1: 0.6353
 epoch: 85, train_loss: 0.2879, test_loss: 1.1453, test_f1: 0.6491
 epoch: 86, train_loss: 0.3014, test_loss: 1.1877, test_f1: 0.6453
 epoch: 87, train_loss: 0.3203, test_loss: 1.2658, test_f1: 0.6294
 epoch: 88, train_loss: 0.3024, test_loss: 1.1089, test_f1: 0.6584
 epoch: 89, train_loss: 0.3066, test_loss: 1.1427, test_f1: 0.6609
 epoch: 90, train_loss: 0.2851, test_loss: 1.2353, test_f1: 0.6385
 epoch: 91, train_loss: 0.2901, test_loss: 1.1679, test_f1: 0.6503
 epoch: 92, train_loss: 0.2882, test_loss: 1.1725, test_f1: 0.6586
 epoch: 93, train_loss: 0.2836, test_loss: 1.0701, test_f1: 0.6742
 epoch: 94, train_loss: 0.2845, test_loss: 1.1895, test_f1: 0.6490
 epoch: 95, train_loss: 0.2768, test_loss: 1.3517, test_f1: 0.6230
 epoch: 96, train_loss: 0.2782, test_loss: 1.2330, test_f1: 0.6620
 epoch: 97, train_loss: 0.2534, test_loss: 1.2877, test_f1: 0.6367
 epoch: 98, train_loss: 0.2751, test_loss: 1.1906, test_f1: 0.6505
 epoch: 99, train_loss: 0.2743, test_loss: 1.2709, test_f1: 0.6396
##################ITERATION #9 ****************************************
 epoch: 0, train_loss: 1.4149, test_loss: 1.3817, test_f1: 0.2401
 epoch: 1, train_loss: 1.1300, test_loss: 1.2795, test_f1: 0.2260
 epoch: 2, train_loss: 1.0491, test_loss: 1.1206, test_f1: 0.3514
 epoch: 3, train_loss: 1.0130, test_loss: 1.0084, test_f1: 0.4221
 epoch: 4, train_loss: 0.9764, test_loss: 0.9618, test_f1: 0.5060
 epoch: 5, train_loss: 0.9451, test_loss: 0.9655, test_f1: 0.5167
 epoch: 6, train_loss: 0.9224, test_loss: 0.9575, test_f1: 0.5109
 epoch: 7, train_loss: 0.9008, test_loss: 1.0001, test_f1: 0.5148
 epoch: 8, train_loss: 0.8927, test_loss: 0.9635, test_f1: 0.5472
 epoch: 9, train_loss: 0.8743, test_loss: 0.9541, test_f1: 0.5470
 epoch: 10, train_loss: 0.8585, test_loss: 0.9634, test_f1: 0.5385
 epoch: 11, train_loss: 0.8451, test_loss: 0.9177, test_f1: 0.5476
 epoch: 12, train_loss: 0.8265, test_loss: 0.9289, test_f1: 0.5346
 epoch: 13, train_loss: 0.8186, test_loss: 0.9680, test_f1: 0.5354
 epoch: 14, train_loss: 0.7975, test_loss: 0.9692, test_f1: 0.5802
 epoch: 15, train_loss: 0.7957, test_loss: 0.9908, test_f1: 0.5138
 epoch: 16, train_loss: 0.7652, test_loss: 0.9443, test_f1: 0.5405
 epoch: 17, train_loss: 0.7483, test_loss: 0.9194, test_f1: 0.5852
 epoch: 18, train_loss: 0.7561, test_loss: 1.0074, test_f1: 0.5321
 epoch: 19, train_loss: 0.7516, test_loss: 0.9442, test_f1: 0.5373
 epoch: 20, train_loss: 0.7349, test_loss: 0.8930, test_f1: 0.5803
 epoch: 21, train_loss: 0.7169, test_loss: 1.0001, test_f1: 0.5441
 epoch: 22, train_loss: 0.7206, test_loss: 0.9226, test_f1: 0.5719
 epoch: 23, train_loss: 0.7026, test_loss: 0.8861, test_f1: 0.5751
 epoch: 24, train_loss: 0.7242, test_loss: 0.9337, test_f1: 0.5760
 epoch: 25, train_loss: 0.7148, test_loss: 0.8551, test_f1: 0.6077
 epoch: 26, train_loss: 0.6997, test_loss: 0.8865, test_f1: 0.5576
 epoch: 27, train_loss: 0.6812, test_loss: 0.9163, test_f1: 0.5847
 epoch: 28, train_loss: 0.6614, test_loss: 0.9865, test_f1: 0.5637
 epoch: 29, train_loss: 0.6560, test_loss: 0.9071, test_f1: 0.5579
 epoch: 30, train_loss: 0.6740, test_loss: 1.1257, test_f1: 0.5384
 epoch: 31, train_loss: 0.6625, test_loss: 0.8571, test_f1: 0.6038
 epoch: 32, train_loss: 0.6482, test_loss: 0.9342, test_f1: 0.5931
 epoch: 33, train_loss: 0.6360, test_loss: 0.9180, test_f1: 0.5684
 epoch: 34, train_loss: 0.6360, test_loss: 0.9496, test_f1: 0.5756
 epoch: 35, train_loss: 0.6270, test_loss: 0.8802, test_f1: 0.6024
 epoch: 36, train_loss: 0.6053, test_loss: 0.9162, test_f1: 0.6047
 epoch: 37, train_loss: 0.6137, test_loss: 0.9415, test_f1: 0.6159
 epoch: 38, train_loss: 0.6132, test_loss: 0.8746, test_f1: 0.6166
 epoch: 39, train_loss: 0.6174, test_loss: 0.8635, test_f1: 0.6222
 epoch: 40, train_loss: 0.5777, test_loss: 0.9045, test_f1: 0.6068
 epoch: 41, train_loss: 0.5538, test_loss: 0.9833, test_f1: 0.5816
 epoch: 42, train_loss: 0.5814, test_loss: 0.8974, test_f1: 0.6061
 epoch: 43, train_loss: 0.5735, test_loss: 0.9715, test_f1: 0.5875
 epoch: 44, train_loss: 0.5603, test_loss: 1.0480, test_f1: 0.5492
 epoch: 45, train_loss: 0.5578, test_loss: 0.9459, test_f1: 0.5768
 epoch: 46, train_loss: 0.5253, test_loss: 0.9175, test_f1: 0.5961
 epoch: 47, train_loss: 0.5298, test_loss: 1.0010, test_f1: 0.5781
 epoch: 48, train_loss: 0.5426, test_loss: 0.9987, test_f1: 0.5901
 epoch: 49, train_loss: 0.5280, test_loss: 0.9529, test_f1: 0.6157
 epoch: 50, train_loss: 0.5503, test_loss: 0.9695, test_f1: 0.6044
 epoch: 51, train_loss: 0.5192, test_loss: 0.8854, test_f1: 0.6440
 epoch: 52, train_loss: 0.4826, test_loss: 0.9038, test_f1: 0.6391
 epoch: 53, train_loss: 0.4723, test_loss: 0.8984, test_f1: 0.6261
 epoch: 54, train_loss: 0.4584, test_loss: 0.9333, test_f1: 0.6260
 epoch: 55, train_loss: 0.4554, test_loss: 0.9254, test_f1: 0.6523
 epoch: 56, train_loss: 0.4515, test_loss: 0.9462, test_f1: 0.6324
 epoch: 57, train_loss: 0.4327, test_loss: 0.8922, test_f1: 0.6357
 epoch: 58, train_loss: 0.4261, test_loss: 0.9258, test_f1: 0.6311
 epoch: 59, train_loss: 0.4235, test_loss: 1.0267, test_f1: 0.6171
 epoch: 60, train_loss: 0.4227, test_loss: 0.9243, test_f1: 0.6579
 epoch: 61, train_loss: 0.4260, test_loss: 0.9477, test_f1: 0.6615
 epoch: 62, train_loss: 0.4241, test_loss: 1.0297, test_f1: 0.6133
 epoch: 63, train_loss: 0.4231, test_loss: 0.9217, test_f1: 0.6516
 epoch: 64, train_loss: 0.4036, test_loss: 1.0203, test_f1: 0.6290
 epoch: 65, train_loss: 0.4172, test_loss: 0.9303, test_f1: 0.6382
 epoch: 66, train_loss: 0.4058, test_loss: 0.9920, test_f1: 0.6211
 epoch: 67, train_loss: 0.4009, test_loss: 1.0350, test_f1: 0.6290
 epoch: 68, train_loss: 0.4028, test_loss: 0.9696, test_f1: 0.6413
 epoch: 69, train_loss: 0.4136, test_loss: 1.0477, test_f1: 0.6315
 epoch: 70, train_loss: 0.3986, test_loss: 0.9421, test_f1: 0.6427
 epoch: 71, train_loss: 0.4018, test_loss: 1.0521, test_f1: 0.6570
 epoch: 72, train_loss: 0.3929, test_loss: 0.9413, test_f1: 0.6586
 epoch: 73, train_loss: 0.3934, test_loss: 1.0431, test_f1: 0.6574
 epoch: 74, train_loss: 0.3704, test_loss: 1.0321, test_f1: 0.6203
 epoch: 75, train_loss: 0.3634, test_loss: 1.0474, test_f1: 0.6454
 epoch: 76, train_loss: 0.3741, test_loss: 1.0223, test_f1: 0.6548
 epoch: 77, train_loss: 0.3937, test_loss: 0.9623, test_f1: 0.6404
 epoch: 78, train_loss: 0.3720, test_loss: 1.0724, test_f1: 0.6378
 epoch: 79, train_loss: 0.3726, test_loss: 1.1047, test_f1: 0.6270
 epoch: 80, train_loss: 0.3676, test_loss: 1.1734, test_f1: 0.6118
 epoch: 81, train_loss: 0.3586, test_loss: 1.0359, test_f1: 0.6426
 epoch: 82, train_loss: 0.3491, test_loss: 1.0741, test_f1: 0.6582
 epoch: 83, train_loss: 0.3354, test_loss: 1.1787, test_f1: 0.6314
 epoch: 84, train_loss: 0.3637, test_loss: 1.0890, test_f1: 0.6260
 epoch: 85, train_loss: 0.3395, test_loss: 1.1507, test_f1: 0.6418
 epoch: 86, train_loss: 0.3419, test_loss: 1.2216, test_f1: 0.6360
 epoch: 87, train_loss: 0.3254, test_loss: 1.1485, test_f1: 0.6348
 epoch: 88, train_loss: 0.3257, test_loss: 1.1806, test_f1: 0.6266
 epoch: 89, train_loss: 0.3425, test_loss: 1.2053, test_f1: 0.6203
 epoch: 90, train_loss: 0.3379, test_loss: 1.1846, test_f1: 0.6226
 epoch: 91, train_loss: 0.3182, test_loss: 1.0654, test_f1: 0.6651
 epoch: 92, train_loss: 0.3152, test_loss: 1.1795, test_f1: 0.6465
 epoch: 93, train_loss: 0.3149, test_loss: 1.2868, test_f1: 0.5998
 epoch: 94, train_loss: 0.3427, test_loss: 1.2649, test_f1: 0.6244
 epoch: 95, train_loss: 0.3268, test_loss: 1.2237, test_f1: 0.6262
 epoch: 96, train_loss: 0.3134, test_loss: 1.1932, test_f1: 0.6410
 epoch: 97, train_loss: 0.3152, test_loss: 1.2919, test_f1: 0.6155
 epoch: 98, train_loss: 0.3142, test_loss: 1.2055, test_f1: 0.6085
 epoch: 99, train_loss: 0.3123, test_loss: 1.2006, test_f1: 0.6257

Training completed in 483.87 seconds
Best F1: 0.6894 at epoch 88
Mean F1 across iterations: 0.6593  0.0181
========================FINAL RESULTS================================
FEGIN weighted F1: 0.6894  0.0181
python main.py --data ltspice_examples --representation component_pin --model FEGIN --layers 6 --hiddens 64 --batch_size 256 --lr 0.001 --emb_size 128 --epochs 100 --save_appendix component_pin_L6_H64_BS256_LR0.001_E128 --no_val
-----



STDERR:
  File "main.py", line 370, in <module>
    main()
  File "main.py", line 254, in main
    dataset = dataset_class(
  File "/home/philip/projects/ltspice_examples_code_repo/Circuit-Completion-Using-GNNs/component_classification_with_link_prediction_head/evaluation/FEGIN/kernel/circuit_datasets.py", line 15, in __init__
    self.data, self.slices = torch.load(self.processed_paths[0])
  File "/home/philip/.local/lib/python3.8/site-packages/torch/serialization.py", line 1040, in load
    warnings.warn(
  File "/usr/lib/python3.8/warnings.py", line 109, in _showwarnmsg
    sw(msg.message, msg.category, msg.filename, msg.lineno,
  File "main.py", line 47, in warn_with_traceback
    traceback.print_stack(file=log)
/home/philip/projects/ltspice_examples_code_repo/Circuit-Completion-Using-GNNs/component_classification_with_link_prediction_head/evaluation/FEGIN/kernel/circuit_datasets.py:15: FutureWarning: You are using `torch.load` with `weights_only=False` (the current default value), which uses the default pickle module implicitly. It is possible to construct malicious pickle data which will execute arbitrary code during unpickling (See https://github.com/pytorch/pytorch/blob/main/SECURITY.md#untrusted-models for more details). In a future release, the default value for `weights_only` will be flipped to `True`. This limits the functions that could be executed during unpickling. Arbitrary objects will no longer be allowed to be loaded via this mode unless they are explicitly allowlisted by the user via `torch.serialization.add_safe_globals`. We recommend you start setting `weights_only=True` for any use case where you don't have full control of the loaded file. Please open an issue on GitHub for any issues related to this experimental feature.
  self.data, self.slices = torch.load(self.processed_paths[0])
