STDOUT:
Results will be saved in /home/philip/projects/ltspice_examples_code_repo/Circuit-Completion-Using-GNNs/component_classification_with_link_prediction_head/evaluation/FEGIN/results/model_FEGIN_dataset_ltspice_examples
Command line input: python main.py --data ltspice_examples --representation component_component --model FEGIN --layers 2 --hiddens 64 --batch_size 128 --lr 0.001 --emb_size 250 --epochs 100 --save_appendix component_component_L2_H64_BS128_LR0.001_E250 --no_val
 is saved.
-----
ltspice_examples - FEGIN
Using 2 layers, 64 hidden units, h = 2
Loading component_component representation dataset
ENTERED
Training FEGIN on component_component representation
Train: 3556, Test: 845
##################ITERATION #0 ****************************************
 epoch: 0, train_loss: 1.3136, test_loss: 1.2543, test_f1: 0.2274
 epoch: 1, train_loss: 1.1969, test_loss: 1.1583, test_f1: 0.3408
 epoch: 2, train_loss: 1.1539, test_loss: 1.1054, test_f1: 0.3647
 epoch: 3, train_loss: 1.1159, test_loss: 1.0655, test_f1: 0.4614
 epoch: 4, train_loss: 1.0835, test_loss: 1.0179, test_f1: 0.4511
 epoch: 5, train_loss: 1.0568, test_loss: 0.9953, test_f1: 0.4886
 epoch: 6, train_loss: 1.0260, test_loss: 1.0141, test_f1: 0.4572
 epoch: 7, train_loss: 0.9954, test_loss: 0.9453, test_f1: 0.5135
 epoch: 8, train_loss: 0.9739, test_loss: 0.9609, test_f1: 0.4755
 epoch: 9, train_loss: 0.9627, test_loss: 0.9741, test_f1: 0.4875
 epoch: 10, train_loss: 0.9387, test_loss: 0.9416, test_f1: 0.5265
 epoch: 11, train_loss: 0.9189, test_loss: 0.9267, test_f1: 0.5111
 epoch: 12, train_loss: 0.9115, test_loss: 0.9400, test_f1: 0.5233
 epoch: 13, train_loss: 0.8858, test_loss: 0.9921, test_f1: 0.5087
 epoch: 14, train_loss: 0.8896, test_loss: 0.9391, test_f1: 0.5133
 epoch: 15, train_loss: 0.8678, test_loss: 0.9287, test_f1: 0.5121
 epoch: 16, train_loss: 0.8610, test_loss: 0.9398, test_f1: 0.5130
 epoch: 17, train_loss: 0.8548, test_loss: 0.9811, test_f1: 0.5178
 epoch: 18, train_loss: 0.8446, test_loss: 1.0068, test_f1: 0.4637
 epoch: 19, train_loss: 0.8327, test_loss: 0.9534, test_f1: 0.5242
 epoch: 20, train_loss: 0.8195, test_loss: 0.9754, test_f1: 0.5249
 epoch: 21, train_loss: 0.8092, test_loss: 0.9486, test_f1: 0.5159
 epoch: 22, train_loss: 0.8052, test_loss: 0.9562, test_f1: 0.5467
 epoch: 23, train_loss: 0.7966, test_loss: 0.9400, test_f1: 0.5200
 epoch: 24, train_loss: 0.7851, test_loss: 1.0798, test_f1: 0.5016
 epoch: 25, train_loss: 0.7724, test_loss: 0.9740, test_f1: 0.5216
 epoch: 26, train_loss: 0.7697, test_loss: 1.0218, test_f1: 0.5225
 epoch: 27, train_loss: 0.7703, test_loss: 1.0093, test_f1: 0.5065
 epoch: 28, train_loss: 0.7493, test_loss: 1.0336, test_f1: 0.5046
 epoch: 29, train_loss: 0.7490, test_loss: 1.0273, test_f1: 0.5445
 epoch: 30, train_loss: 0.7434, test_loss: 1.1096, test_f1: 0.4716
 epoch: 31, train_loss: 0.7358, test_loss: 1.0453, test_f1: 0.5207
 epoch: 32, train_loss: 0.7250, test_loss: 1.0583, test_f1: 0.5027
 epoch: 33, train_loss: 0.7210, test_loss: 1.1006, test_f1: 0.5210
 epoch: 34, train_loss: 0.7246, test_loss: 1.1111, test_f1: 0.5267
 epoch: 35, train_loss: 0.7175, test_loss: 1.0996, test_f1: 0.5352
 epoch: 36, train_loss: 0.6993, test_loss: 1.0847, test_f1: 0.5428
 epoch: 37, train_loss: 0.6984, test_loss: 1.0781, test_f1: 0.5236
 epoch: 38, train_loss: 0.6841, test_loss: 1.0787, test_f1: 0.5155
 epoch: 39, train_loss: 0.6704, test_loss: 1.1318, test_f1: 0.5358
 epoch: 40, train_loss: 0.6584, test_loss: 1.2168, test_f1: 0.4933
 epoch: 41, train_loss: 0.6481, test_loss: 1.1226, test_f1: 0.5404
 epoch: 42, train_loss: 0.6629, test_loss: 1.1713, test_f1: 0.5126
 epoch: 43, train_loss: 0.6334, test_loss: 1.1297, test_f1: 0.5494
 epoch: 44, train_loss: 0.6390, test_loss: 1.1250, test_f1: 0.5146
 epoch: 45, train_loss: 0.6541, test_loss: 1.1980, test_f1: 0.5212
 epoch: 46, train_loss: 0.6268, test_loss: 1.1349, test_f1: 0.5550
 epoch: 47, train_loss: 0.6419, test_loss: 1.1080, test_f1: 0.5523
 epoch: 48, train_loss: 0.6211, test_loss: 1.1611, test_f1: 0.5587
 epoch: 49, train_loss: 0.6149, test_loss: 1.2465, test_f1: 0.5445
 epoch: 50, train_loss: 0.6148, test_loss: 1.3131, test_f1: 0.5643
 epoch: 51, train_loss: 0.5825, test_loss: 1.2589, test_f1: 0.5309
 epoch: 52, train_loss: 0.5570, test_loss: 1.2814, test_f1: 0.5111
 epoch: 53, train_loss: 0.5499, test_loss: 1.2454, test_f1: 0.5549
 epoch: 54, train_loss: 0.5368, test_loss: 1.2725, test_f1: 0.5338
 epoch: 55, train_loss: 0.5341, test_loss: 1.3784, test_f1: 0.5381
 epoch: 56, train_loss: 0.5444, test_loss: 1.3561, test_f1: 0.5437
 epoch: 57, train_loss: 0.5356, test_loss: 1.2516, test_f1: 0.5660
 epoch: 58, train_loss: 0.5368, test_loss: 1.3478, test_f1: 0.5409
 epoch: 59, train_loss: 0.5142, test_loss: 1.3612, test_f1: 0.5333
 epoch: 60, train_loss: 0.5128, test_loss: 1.3798, test_f1: 0.5460
 epoch: 61, train_loss: 0.5100, test_loss: 1.4346, test_f1: 0.5443
 epoch: 62, train_loss: 0.5305, test_loss: 1.3162, test_f1: 0.5694
 epoch: 63, train_loss: 0.5078, test_loss: 1.4175, test_f1: 0.5236
 epoch: 64, train_loss: 0.5111, test_loss: 1.2484, test_f1: 0.5359
 epoch: 65, train_loss: 0.5029, test_loss: 1.3248, test_f1: 0.5436
 epoch: 66, train_loss: 0.5083, test_loss: 1.3076, test_f1: 0.5646
 epoch: 67, train_loss: 0.5035, test_loss: 1.3218, test_f1: 0.5695
 epoch: 68, train_loss: 0.5019, test_loss: 1.3318, test_f1: 0.5781
 epoch: 69, train_loss: 0.4894, test_loss: 1.2949, test_f1: 0.5450
 epoch: 70, train_loss: 0.4946, test_loss: 1.3909, test_f1: 0.5434
 epoch: 71, train_loss: 0.4706, test_loss: 1.3876, test_f1: 0.5289
 epoch: 72, train_loss: 0.4797, test_loss: 1.4792, test_f1: 0.5743
 epoch: 73, train_loss: 0.4819, test_loss: 1.3641, test_f1: 0.5794
 epoch: 74, train_loss: 0.4666, test_loss: 1.3393, test_f1: 0.5602
 epoch: 75, train_loss: 0.4679, test_loss: 1.3812, test_f1: 0.5549
 epoch: 76, train_loss: 0.4669, test_loss: 1.3984, test_f1: 0.5353
 epoch: 77, train_loss: 0.4612, test_loss: 1.3516, test_f1: 0.5736
 epoch: 78, train_loss: 0.4759, test_loss: 1.3899, test_f1: 0.5356
 epoch: 79, train_loss: 0.4518, test_loss: 1.4769, test_f1: 0.5692
 epoch: 80, train_loss: 0.4628, test_loss: 1.3774, test_f1: 0.5692
 epoch: 81, train_loss: 0.4473, test_loss: 1.3980, test_f1: 0.5427
 epoch: 82, train_loss: 0.4361, test_loss: 1.4034, test_f1: 0.5623
 epoch: 83, train_loss: 0.4408, test_loss: 1.4664, test_f1: 0.5785
 epoch: 84, train_loss: 0.4490, test_loss: 1.4344, test_f1: 0.5272
 epoch: 85, train_loss: 0.4515, test_loss: 1.4517, test_f1: 0.5684
 epoch: 86, train_loss: 0.4433, test_loss: 1.4673, test_f1: 0.5838
 epoch: 87, train_loss: 0.4451, test_loss: 1.4468, test_f1: 0.5455
 epoch: 88, train_loss: 0.4332, test_loss: 1.5032, test_f1: 0.5879
 epoch: 89, train_loss: 0.4275, test_loss: 1.5776, test_f1: 0.5585
 epoch: 90, train_loss: 0.4254, test_loss: 1.5540, test_f1: 0.5510
 epoch: 91, train_loss: 0.4266, test_loss: 1.4763, test_f1: 0.5624
 epoch: 92, train_loss: 0.4292, test_loss: 1.5184, test_f1: 0.5823
 epoch: 93, train_loss: 0.4231, test_loss: 1.4602, test_f1: 0.5577
 epoch: 94, train_loss: 0.4165, test_loss: 1.5447, test_f1: 0.5913
 epoch: 95, train_loss: 0.4205, test_loss: 1.5699, test_f1: 0.5674
 epoch: 96, train_loss: 0.4275, test_loss: 1.3991, test_f1: 0.5920
 epoch: 97, train_loss: 0.4157, test_loss: 1.3759, test_f1: 0.5820
 epoch: 98, train_loss: 0.4236, test_loss: 1.7677, test_f1: 0.5691
 epoch: 99, train_loss: 0.4251, test_loss: 1.6129, test_f1: 0.5726
##################ITERATION #1 ****************************************
 epoch: 0, train_loss: 1.2485, test_loss: 1.2347, test_f1: 0.3613
 epoch: 1, train_loss: 1.1348, test_loss: 1.1027, test_f1: 0.4261
 epoch: 2, train_loss: 1.0863, test_loss: 1.0080, test_f1: 0.4507
 epoch: 3, train_loss: 1.0465, test_loss: 0.9940, test_f1: 0.4934
 epoch: 4, train_loss: 1.0152, test_loss: 0.9459, test_f1: 0.4975
 epoch: 5, train_loss: 0.9944, test_loss: 0.9342, test_f1: 0.4754
 epoch: 6, train_loss: 0.9728, test_loss: 0.9945, test_f1: 0.4570
 epoch: 7, train_loss: 0.9475, test_loss: 0.9338, test_f1: 0.4999
 epoch: 8, train_loss: 0.9386, test_loss: 0.9039, test_f1: 0.4977
 epoch: 9, train_loss: 0.9133, test_loss: 0.9189, test_f1: 0.4671
 epoch: 10, train_loss: 0.8944, test_loss: 0.9010, test_f1: 0.4943
 epoch: 11, train_loss: 0.8875, test_loss: 0.9260, test_f1: 0.5427
 epoch: 12, train_loss: 0.8732, test_loss: 0.9238, test_f1: 0.4904
 epoch: 13, train_loss: 0.8556, test_loss: 0.9534, test_f1: 0.5188
 epoch: 14, train_loss: 0.8454, test_loss: 0.9428, test_f1: 0.5352
 epoch: 15, train_loss: 0.8370, test_loss: 0.9506, test_f1: 0.5097
 epoch: 16, train_loss: 0.8118, test_loss: 0.9805, test_f1: 0.5017
 epoch: 17, train_loss: 0.7918, test_loss: 0.9598, test_f1: 0.5256
 epoch: 18, train_loss: 0.7835, test_loss: 0.9789, test_f1: 0.5323
 epoch: 19, train_loss: 0.7820, test_loss: 1.0385, test_f1: 0.5177
 epoch: 20, train_loss: 0.7626, test_loss: 1.1202, test_f1: 0.5107
 epoch: 21, train_loss: 0.7767, test_loss: 1.0746, test_f1: 0.5171
 epoch: 22, train_loss: 0.7528, test_loss: 1.1338, test_f1: 0.4993
 epoch: 23, train_loss: 0.7390, test_loss: 1.0620, test_f1: 0.5274
 epoch: 24, train_loss: 0.7358, test_loss: 1.1198, test_f1: 0.5268
 epoch: 25, train_loss: 0.7187, test_loss: 1.0506, test_f1: 0.5328
 epoch: 26, train_loss: 0.7101, test_loss: 1.0929, test_f1: 0.5252
 epoch: 27, train_loss: 0.7141, test_loss: 1.1097, test_f1: 0.5354
 epoch: 28, train_loss: 0.7070, test_loss: 1.0742, test_f1: 0.5452
 epoch: 29, train_loss: 0.7113, test_loss: 1.2276, test_f1: 0.4961
 epoch: 30, train_loss: 0.7040, test_loss: 1.0984, test_f1: 0.5429
 epoch: 31, train_loss: 0.6884, test_loss: 1.1999, test_f1: 0.5130
 epoch: 32, train_loss: 0.6860, test_loss: 1.0967, test_f1: 0.5610
 epoch: 33, train_loss: 0.6608, test_loss: 1.1072, test_f1: 0.5345
 epoch: 34, train_loss: 0.6528, test_loss: 1.1075, test_f1: 0.5666
 epoch: 35, train_loss: 0.6527, test_loss: 1.1668, test_f1: 0.5215
 epoch: 36, train_loss: 0.6501, test_loss: 1.1140, test_f1: 0.5341
 epoch: 37, train_loss: 0.6344, test_loss: 1.1905, test_f1: 0.5338
 epoch: 38, train_loss: 0.6225, test_loss: 1.1482, test_f1: 0.5239
 epoch: 39, train_loss: 0.6047, test_loss: 1.2461, test_f1: 0.5308
 epoch: 40, train_loss: 0.6063, test_loss: 1.1542, test_f1: 0.5517
 epoch: 41, train_loss: 0.6130, test_loss: 1.2638, test_f1: 0.5238
 epoch: 42, train_loss: 0.6118, test_loss: 1.1400, test_f1: 0.5331
 epoch: 43, train_loss: 0.5890, test_loss: 1.1863, test_f1: 0.5731
 epoch: 44, train_loss: 0.6018, test_loss: 1.2979, test_f1: 0.5378
 epoch: 45, train_loss: 0.5788, test_loss: 1.3192, test_f1: 0.5459
 epoch: 46, train_loss: 0.5869, test_loss: 1.2747, test_f1: 0.5585
 epoch: 47, train_loss: 0.5891, test_loss: 1.2495, test_f1: 0.5532
 epoch: 48, train_loss: 0.5668, test_loss: 1.2435, test_f1: 0.5523
 epoch: 49, train_loss: 0.5640, test_loss: 1.3573, test_f1: 0.5251
 epoch: 50, train_loss: 0.5639, test_loss: 1.2913, test_f1: 0.5607
 epoch: 51, train_loss: 0.5190, test_loss: 1.3197, test_f1: 0.5494
 epoch: 52, train_loss: 0.4998, test_loss: 1.3630, test_f1: 0.5426
 epoch: 53, train_loss: 0.4927, test_loss: 1.3428, test_f1: 0.5596
 epoch: 54, train_loss: 0.4824, test_loss: 1.3407, test_f1: 0.5620
 epoch: 55, train_loss: 0.4833, test_loss: 1.3580, test_f1: 0.5627
 epoch: 56, train_loss: 0.4688, test_loss: 1.4095, test_f1: 0.5494
 epoch: 57, train_loss: 0.4720, test_loss: 1.3894, test_f1: 0.5700
 epoch: 58, train_loss: 0.4687, test_loss: 1.3989, test_f1: 0.5616
 epoch: 59, train_loss: 0.4591, test_loss: 1.4243, test_f1: 0.5785
 epoch: 60, train_loss: 0.4386, test_loss: 1.4653, test_f1: 0.5430
 epoch: 61, train_loss: 0.4495, test_loss: 1.3983, test_f1: 0.5670
 epoch: 62, train_loss: 0.4577, test_loss: 1.5119, test_f1: 0.5514
 epoch: 63, train_loss: 0.4548, test_loss: 1.4580, test_f1: 0.5520
 epoch: 64, train_loss: 0.4502, test_loss: 1.4547, test_f1: 0.5560
 epoch: 65, train_loss: 0.4463, test_loss: 1.4805, test_f1: 0.5647
 epoch: 66, train_loss: 0.4561, test_loss: 1.4544, test_f1: 0.5614
 epoch: 67, train_loss: 0.4442, test_loss: 1.4876, test_f1: 0.5532
 epoch: 68, train_loss: 0.4261, test_loss: 1.5277, test_f1: 0.5435
 epoch: 69, train_loss: 0.4271, test_loss: 1.4948, test_f1: 0.5716
 epoch: 70, train_loss: 0.4191, test_loss: 1.5701, test_f1: 0.5329
 epoch: 71, train_loss: 0.4393, test_loss: 1.5428, test_f1: 0.5615
 epoch: 72, train_loss: 0.4241, test_loss: 1.5415, test_f1: 0.5680
 epoch: 73, train_loss: 0.4233, test_loss: 1.5539, test_f1: 0.5943
 epoch: 74, train_loss: 0.4190, test_loss: 1.5615, test_f1: 0.5330
 epoch: 75, train_loss: 0.4054, test_loss: 1.5327, test_f1: 0.5595
 epoch: 76, train_loss: 0.4182, test_loss: 1.6243, test_f1: 0.5532
 epoch: 77, train_loss: 0.4005, test_loss: 1.6070, test_f1: 0.5568
 epoch: 78, train_loss: 0.4204, test_loss: 1.5016, test_f1: 0.5760
 epoch: 79, train_loss: 0.3996, test_loss: 1.7688, test_f1: 0.5167
 epoch: 80, train_loss: 0.3965, test_loss: 1.5862, test_f1: 0.5502
 epoch: 81, train_loss: 0.4089, test_loss: 1.6163, test_f1: 0.5519
 epoch: 82, train_loss: 0.4078, test_loss: 1.5327, test_f1: 0.5590
 epoch: 83, train_loss: 0.3948, test_loss: 1.6181, test_f1: 0.5524
 epoch: 84, train_loss: 0.3882, test_loss: 1.6505, test_f1: 0.5385
 epoch: 85, train_loss: 0.3674, test_loss: 1.6702, test_f1: 0.5583
 epoch: 86, train_loss: 0.3771, test_loss: 1.6460, test_f1: 0.5389
 epoch: 87, train_loss: 0.3832, test_loss: 1.7768, test_f1: 0.5303
 epoch: 88, train_loss: 0.3755, test_loss: 1.6504, test_f1: 0.5557
 epoch: 89, train_loss: 0.3948, test_loss: 1.7021, test_f1: 0.5643
 epoch: 90, train_loss: 0.3731, test_loss: 1.7230, test_f1: 0.5555
 epoch: 91, train_loss: 0.3670, test_loss: 1.7335, test_f1: 0.5551
 epoch: 92, train_loss: 0.3682, test_loss: 1.7102, test_f1: 0.5436
 epoch: 93, train_loss: 0.3608, test_loss: 1.6831, test_f1: 0.5596
 epoch: 94, train_loss: 0.3610, test_loss: 1.6888, test_f1: 0.5642
 epoch: 95, train_loss: 0.3563, test_loss: 1.7112, test_f1: 0.5772
 epoch: 96, train_loss: 0.3623, test_loss: 1.8402, test_f1: 0.5371
 epoch: 97, train_loss: 0.3697, test_loss: 1.7629, test_f1: 0.5658
 epoch: 98, train_loss: 0.3565, test_loss: 1.8769, test_f1: 0.5620
 epoch: 99, train_loss: 0.3360, test_loss: 1.7462, test_f1: 0.5579
##################ITERATION #2 ****************************************
 epoch: 0, train_loss: 1.3149, test_loss: 1.2034, test_f1: 0.3953
 epoch: 1, train_loss: 1.1596, test_loss: 1.1097, test_f1: 0.4532
 epoch: 2, train_loss: 1.1256, test_loss: 1.0581, test_f1: 0.4319
 epoch: 3, train_loss: 1.0941, test_loss: 1.0329, test_f1: 0.4839
 epoch: 4, train_loss: 1.0781, test_loss: 1.0165, test_f1: 0.4605
 epoch: 5, train_loss: 1.0508, test_loss: 1.0086, test_f1: 0.4527
 epoch: 6, train_loss: 1.0384, test_loss: 0.9787, test_f1: 0.4879
 epoch: 7, train_loss: 1.0040, test_loss: 0.9722, test_f1: 0.4686
 epoch: 8, train_loss: 0.9916, test_loss: 0.9546, test_f1: 0.4646
 epoch: 9, train_loss: 0.9768, test_loss: 0.9704, test_f1: 0.4888
 epoch: 10, train_loss: 0.9541, test_loss: 0.9725, test_f1: 0.4777
 epoch: 11, train_loss: 0.9383, test_loss: 0.9454, test_f1: 0.5046
 epoch: 12, train_loss: 0.9398, test_loss: 0.9598, test_f1: 0.4904
 epoch: 13, train_loss: 0.9378, test_loss: 0.9544, test_f1: 0.5144
 epoch: 14, train_loss: 0.9115, test_loss: 0.9582, test_f1: 0.4897
 epoch: 15, train_loss: 0.9045, test_loss: 0.9490, test_f1: 0.5228
 epoch: 16, train_loss: 0.8949, test_loss: 0.9797, test_f1: 0.5027
 epoch: 17, train_loss: 0.8774, test_loss: 0.9759, test_f1: 0.5296
 epoch: 18, train_loss: 0.8761, test_loss: 0.9447, test_f1: 0.5207
 epoch: 19, train_loss: 0.8715, test_loss: 0.9885, test_f1: 0.4737
 epoch: 20, train_loss: 0.8527, test_loss: 0.9583, test_f1: 0.5005
 epoch: 21, train_loss: 0.8442, test_loss: 0.9714, test_f1: 0.5190
 epoch: 22, train_loss: 0.8479, test_loss: 0.9905, test_f1: 0.5278
 epoch: 23, train_loss: 0.8322, test_loss: 0.9892, test_f1: 0.5180
 epoch: 24, train_loss: 0.8340, test_loss: 0.9853, test_f1: 0.5280
 epoch: 25, train_loss: 0.8192, test_loss: 0.9950, test_f1: 0.5168
 epoch: 26, train_loss: 0.8050, test_loss: 1.0027, test_f1: 0.5288
 epoch: 27, train_loss: 0.8074, test_loss: 1.0054, test_f1: 0.5416
 epoch: 28, train_loss: 0.8001, test_loss: 1.0416, test_f1: 0.5175
 epoch: 29, train_loss: 0.7810, test_loss: 1.0552, test_f1: 0.5211
 epoch: 30, train_loss: 0.7759, test_loss: 1.0465, test_f1: 0.5231
 epoch: 31, train_loss: 0.7799, test_loss: 1.0466, test_f1: 0.5453
 epoch: 32, train_loss: 0.7496, test_loss: 1.1090, test_f1: 0.5433
 epoch: 33, train_loss: 0.7640, test_loss: 1.0946, test_f1: 0.5172
 epoch: 34, train_loss: 0.7518, test_loss: 1.0471, test_f1: 0.5365
 epoch: 35, train_loss: 0.7343, test_loss: 1.0804, test_f1: 0.5405
 epoch: 36, train_loss: 0.7481, test_loss: 1.0643, test_f1: 0.5343
 epoch: 37, train_loss: 0.7318, test_loss: 1.0344, test_f1: 0.5306
 epoch: 38, train_loss: 0.7205, test_loss: 1.0803, test_f1: 0.5640
 epoch: 39, train_loss: 0.7069, test_loss: 1.0719, test_f1: 0.5493
 epoch: 40, train_loss: 0.7096, test_loss: 1.1091, test_f1: 0.5480
 epoch: 41, train_loss: 0.7107, test_loss: 1.0993, test_f1: 0.5506
 epoch: 42, train_loss: 0.6855, test_loss: 1.0853, test_f1: 0.5452
 epoch: 43, train_loss: 0.6811, test_loss: 1.1130, test_f1: 0.5406
 epoch: 44, train_loss: 0.6709, test_loss: 1.1209, test_f1: 0.5590
 epoch: 45, train_loss: 0.6729, test_loss: 1.2397, test_f1: 0.5257
 epoch: 46, train_loss: 0.6513, test_loss: 1.1284, test_f1: 0.5381
 epoch: 47, train_loss: 0.6735, test_loss: 1.1504, test_f1: 0.5434
 epoch: 48, train_loss: 0.6598, test_loss: 1.1244, test_f1: 0.5482
 epoch: 49, train_loss: 0.6518, test_loss: 1.1518, test_f1: 0.5413
 epoch: 50, train_loss: 0.6349, test_loss: 1.1325, test_f1: 0.5615
 epoch: 51, train_loss: 0.6140, test_loss: 1.1685, test_f1: 0.5583
 epoch: 52, train_loss: 0.6028, test_loss: 1.1973, test_f1: 0.5615
 epoch: 53, train_loss: 0.5876, test_loss: 1.1833, test_f1: 0.5489
 epoch: 54, train_loss: 0.5790, test_loss: 1.2539, test_f1: 0.5544
 epoch: 55, train_loss: 0.5719, test_loss: 1.2500, test_f1: 0.5404
 epoch: 56, train_loss: 0.5734, test_loss: 1.2178, test_f1: 0.5645
 epoch: 57, train_loss: 0.5659, test_loss: 1.2372, test_f1: 0.5837
 epoch: 58, train_loss: 0.5710, test_loss: 1.2361, test_f1: 0.5505
 epoch: 59, train_loss: 0.5783, test_loss: 1.2432, test_f1: 0.5606
 epoch: 60, train_loss: 0.5430, test_loss: 1.2499, test_f1: 0.5734
 epoch: 61, train_loss: 0.5541, test_loss: 1.2680, test_f1: 0.5379
 epoch: 62, train_loss: 0.5565, test_loss: 1.3185, test_f1: 0.5575
 epoch: 63, train_loss: 0.5472, test_loss: 1.2692, test_f1: 0.5775
 epoch: 64, train_loss: 0.5362, test_loss: 1.2848, test_f1: 0.5681
 epoch: 65, train_loss: 0.5457, test_loss: 1.2841, test_f1: 0.5530
 epoch: 66, train_loss: 0.5154, test_loss: 1.3221, test_f1: 0.5716
 epoch: 67, train_loss: 0.5234, test_loss: 1.3558, test_f1: 0.5439
 epoch: 68, train_loss: 0.5299, test_loss: 1.3781, test_f1: 0.5391
 epoch: 69, train_loss: 0.5113, test_loss: 1.3926, test_f1: 0.5725
 epoch: 70, train_loss: 0.5175, test_loss: 1.4264, test_f1: 0.5489
 epoch: 71, train_loss: 0.5204, test_loss: 1.3262, test_f1: 0.5491
 epoch: 72, train_loss: 0.5247, test_loss: 1.3840, test_f1: 0.5537
 epoch: 73, train_loss: 0.5083, test_loss: 1.4177, test_f1: 0.5411
 epoch: 74, train_loss: 0.5069, test_loss: 1.3880, test_f1: 0.5579
 epoch: 75, train_loss: 0.5092, test_loss: 1.4149, test_f1: 0.5313
 epoch: 76, train_loss: 0.5032, test_loss: 1.4156, test_f1: 0.5468
 epoch: 77, train_loss: 0.4900, test_loss: 1.4377, test_f1: 0.5365
 epoch: 78, train_loss: 0.4916, test_loss: 1.4376, test_f1: 0.5576
 epoch: 79, train_loss: 0.4765, test_loss: 1.4728, test_f1: 0.5380
 epoch: 80, train_loss: 0.4758, test_loss: 1.4172, test_f1: 0.5670
 epoch: 81, train_loss: 0.4755, test_loss: 1.4832, test_f1: 0.5485
 epoch: 82, train_loss: 0.4683, test_loss: 1.4068, test_f1: 0.5740
 epoch: 83, train_loss: 0.4753, test_loss: 1.4790, test_f1: 0.5626
 epoch: 84, train_loss: 0.4645, test_loss: 1.4817, test_f1: 0.5607
 epoch: 85, train_loss: 0.4690, test_loss: 1.4350, test_f1: 0.5483
 epoch: 86, train_loss: 0.4697, test_loss: 1.5015, test_f1: 0.5642
 epoch: 87, train_loss: 0.4836, test_loss: 1.4911, test_f1: 0.5405
 epoch: 88, train_loss: 0.4648, test_loss: 1.5291, test_f1: 0.5343
 epoch: 89, train_loss: 0.4516, test_loss: 1.5080, test_f1: 0.5725
 epoch: 90, train_loss: 0.4331, test_loss: 1.4897, test_f1: 0.5695
 epoch: 91, train_loss: 0.4597, test_loss: 1.5805, test_f1: 0.5252
 epoch: 92, train_loss: 0.4618, test_loss: 1.5401, test_f1: 0.5464
 epoch: 93, train_loss: 0.4442, test_loss: 1.5669, test_f1: 0.5721
 epoch: 94, train_loss: 0.4511, test_loss: 1.6125, test_f1: 0.5662
 epoch: 95, train_loss: 0.4521, test_loss: 1.6063, test_f1: 0.5653
 epoch: 96, train_loss: 0.4440, test_loss: 1.6786, test_f1: 0.5509
 epoch: 97, train_loss: 0.4245, test_loss: 1.6816, test_f1: 0.5287
 epoch: 98, train_loss: 0.4119, test_loss: 1.5777, test_f1: 0.5880
 epoch: 99, train_loss: 0.4370, test_loss: 1.6886, test_f1: 0.5561
##################ITERATION #3 ****************************************
 epoch: 0, train_loss: 1.3486, test_loss: 1.2419, test_f1: 0.2983
 epoch: 1, train_loss: 1.1809, test_loss: 1.1160, test_f1: 0.4338
 epoch: 2, train_loss: 1.1210, test_loss: 1.0469, test_f1: 0.4444
 epoch: 3, train_loss: 1.0756, test_loss: 1.0374, test_f1: 0.4365
 epoch: 4, train_loss: 1.0459, test_loss: 1.0073, test_f1: 0.4657
 epoch: 5, train_loss: 1.0284, test_loss: 0.9792, test_f1: 0.4780
 epoch: 6, train_loss: 1.0058, test_loss: 0.9826, test_f1: 0.4462
 epoch: 7, train_loss: 0.9961, test_loss: 0.9742, test_f1: 0.4958
 epoch: 8, train_loss: 0.9765, test_loss: 0.9754, test_f1: 0.4850
 epoch: 9, train_loss: 0.9621, test_loss: 1.0374, test_f1: 0.4739
 epoch: 10, train_loss: 0.9537, test_loss: 1.0249, test_f1: 0.4726
 epoch: 11, train_loss: 0.9305, test_loss: 0.9909, test_f1: 0.4658
 epoch: 12, train_loss: 0.9208, test_loss: 0.9638, test_f1: 0.5109
 epoch: 13, train_loss: 0.9139, test_loss: 1.0709, test_f1: 0.4488
 epoch: 14, train_loss: 0.8953, test_loss: 1.0009, test_f1: 0.4883
 epoch: 15, train_loss: 0.8870, test_loss: 0.9919, test_f1: 0.4879
 epoch: 16, train_loss: 0.8752, test_loss: 0.9850, test_f1: 0.5163
 epoch: 17, train_loss: 0.8887, test_loss: 1.0657, test_f1: 0.4652
 epoch: 18, train_loss: 0.8668, test_loss: 0.9412, test_f1: 0.5395
 epoch: 19, train_loss: 0.8532, test_loss: 1.0029, test_f1: 0.5021
 epoch: 20, train_loss: 0.8403, test_loss: 1.1107, test_f1: 0.4590
 epoch: 21, train_loss: 0.8238, test_loss: 0.9805, test_f1: 0.5300
 epoch: 22, train_loss: 0.8274, test_loss: 0.9967, test_f1: 0.5543
 epoch: 23, train_loss: 0.8149, test_loss: 1.0385, test_f1: 0.5175
 epoch: 24, train_loss: 0.8232, test_loss: 1.0290, test_f1: 0.5353
 epoch: 25, train_loss: 0.8102, test_loss: 1.0409, test_f1: 0.5242
 epoch: 26, train_loss: 0.7864, test_loss: 1.0248, test_f1: 0.5405
 epoch: 27, train_loss: 0.7869, test_loss: 1.1146, test_f1: 0.4984
 epoch: 28, train_loss: 0.7810, test_loss: 1.1440, test_f1: 0.5284
 epoch: 29, train_loss: 0.7790, test_loss: 1.1549, test_f1: 0.5104
 epoch: 30, train_loss: 0.7766, test_loss: 1.0524, test_f1: 0.5579
 epoch: 31, train_loss: 0.7688, test_loss: 1.0524, test_f1: 0.5252
 epoch: 32, train_loss: 0.7599, test_loss: 1.0680, test_f1: 0.5514
 epoch: 33, train_loss: 0.7392, test_loss: 1.1483, test_f1: 0.5383
 epoch: 34, train_loss: 0.7462, test_loss: 1.1239, test_f1: 0.5390
 epoch: 35, train_loss: 0.7442, test_loss: 1.0145, test_f1: 0.5256
 epoch: 36, train_loss: 0.7434, test_loss: 1.0073, test_f1: 0.5425
 epoch: 37, train_loss: 0.7385, test_loss: 1.0420, test_f1: 0.5299
 epoch: 38, train_loss: 0.7342, test_loss: 1.0778, test_f1: 0.5416
 epoch: 39, train_loss: 0.7182, test_loss: 1.1385, test_f1: 0.4978
 epoch: 40, train_loss: 0.7120, test_loss: 1.1009, test_f1: 0.5468
 epoch: 41, train_loss: 0.6906, test_loss: 1.0835, test_f1: 0.5561
 epoch: 42, train_loss: 0.6821, test_loss: 1.1387, test_f1: 0.5252
 epoch: 43, train_loss: 0.6989, test_loss: 1.0551, test_f1: 0.5658
 epoch: 44, train_loss: 0.6957, test_loss: 1.2094, test_f1: 0.5058
 epoch: 45, train_loss: 0.6965, test_loss: 1.1138, test_f1: 0.5628
 epoch: 46, train_loss: 0.6782, test_loss: 1.2126, test_f1: 0.5515
 epoch: 47, train_loss: 0.6823, test_loss: 1.1596, test_f1: 0.5360
 epoch: 48, train_loss: 0.6630, test_loss: 1.1579, test_f1: 0.5510
 epoch: 49, train_loss: 0.6658, test_loss: 1.1604, test_f1: 0.5355
 epoch: 50, train_loss: 0.6341, test_loss: 1.1757, test_f1: 0.5530
 epoch: 51, train_loss: 0.6327, test_loss: 1.1806, test_f1: 0.5541
 epoch: 52, train_loss: 0.6135, test_loss: 1.1137, test_f1: 0.5647
 epoch: 53, train_loss: 0.6072, test_loss: 1.1460, test_f1: 0.5494
 epoch: 54, train_loss: 0.6066, test_loss: 1.2466, test_f1: 0.5563
 epoch: 55, train_loss: 0.5954, test_loss: 1.1729, test_f1: 0.5562
 epoch: 56, train_loss: 0.5852, test_loss: 1.2255, test_f1: 0.5245
 epoch: 57, train_loss: 0.6024, test_loss: 1.1751, test_f1: 0.5558
 epoch: 58, train_loss: 0.5941, test_loss: 1.2256, test_f1: 0.5449
 epoch: 59, train_loss: 0.5974, test_loss: 1.2326, test_f1: 0.5228
 epoch: 60, train_loss: 0.5677, test_loss: 1.3442, test_f1: 0.5449
 epoch: 61, train_loss: 0.5886, test_loss: 1.2756, test_f1: 0.5550
 epoch: 62, train_loss: 0.5648, test_loss: 1.2529, test_f1: 0.5454
 epoch: 63, train_loss: 0.5648, test_loss: 1.2537, test_f1: 0.5761
 epoch: 64, train_loss: 0.5662, test_loss: 1.2353, test_f1: 0.5557
 epoch: 65, train_loss: 0.5702, test_loss: 1.2870, test_f1: 0.5613
 epoch: 66, train_loss: 0.5619, test_loss: 1.2746, test_f1: 0.5687
 epoch: 67, train_loss: 0.5526, test_loss: 1.2937, test_f1: 0.5367
 epoch: 68, train_loss: 0.5607, test_loss: 1.3289, test_f1: 0.5432
 epoch: 69, train_loss: 0.5479, test_loss: 1.2447, test_f1: 0.5411
 epoch: 70, train_loss: 0.5378, test_loss: 1.2141, test_f1: 0.5631
 epoch: 71, train_loss: 0.5483, test_loss: 1.2650, test_f1: 0.5495
 epoch: 72, train_loss: 0.5260, test_loss: 1.3767, test_f1: 0.5773
 epoch: 73, train_loss: 0.5406, test_loss: 1.2460, test_f1: 0.5475
 epoch: 74, train_loss: 0.5337, test_loss: 1.3742, test_f1: 0.5340
 epoch: 75, train_loss: 0.5163, test_loss: 1.2241, test_f1: 0.5899
 epoch: 76, train_loss: 0.5211, test_loss: 1.3146, test_f1: 0.5565
 epoch: 77, train_loss: 0.5085, test_loss: 1.4395, test_f1: 0.5686
 epoch: 78, train_loss: 0.5307, test_loss: 1.2888, test_f1: 0.5468
 epoch: 79, train_loss: 0.5250, test_loss: 1.2717, test_f1: 0.5405
 epoch: 80, train_loss: 0.5226, test_loss: 1.4172, test_f1: 0.5728
 epoch: 81, train_loss: 0.5003, test_loss: 1.3463, test_f1: 0.5490
 epoch: 82, train_loss: 0.5167, test_loss: 1.4011, test_f1: 0.5783
 epoch: 83, train_loss: 0.5286, test_loss: 1.3782, test_f1: 0.5359
 epoch: 84, train_loss: 0.4984, test_loss: 1.3964, test_f1: 0.5265
 epoch: 85, train_loss: 0.5153, test_loss: 1.2864, test_f1: 0.5701
 epoch: 86, train_loss: 0.4891, test_loss: 1.3424, test_f1: 0.5838
 epoch: 87, train_loss: 0.4909, test_loss: 1.5102, test_f1: 0.5559
 epoch: 88, train_loss: 0.4893, test_loss: 1.3723, test_f1: 0.5453
 epoch: 89, train_loss: 0.4797, test_loss: 1.3540, test_f1: 0.5629
 epoch: 90, train_loss: 0.4842, test_loss: 1.3698, test_f1: 0.5349
 epoch: 91, train_loss: 0.4740, test_loss: 1.4805, test_f1: 0.5260
 epoch: 92, train_loss: 0.5059, test_loss: 1.5093, test_f1: 0.5511
 epoch: 93, train_loss: 0.4888, test_loss: 1.3795, test_f1: 0.5468
 epoch: 94, train_loss: 0.4710, test_loss: 1.4967, test_f1: 0.5768
 epoch: 95, train_loss: 0.4802, test_loss: 1.4509, test_f1: 0.5444
 epoch: 96, train_loss: 0.4815, test_loss: 1.4849, test_f1: 0.5367
 epoch: 97, train_loss: 0.4735, test_loss: 1.4799, test_f1: 0.5711
 epoch: 98, train_loss: 0.4565, test_loss: 1.4103, test_f1: 0.5655
 epoch: 99, train_loss: 0.4702, test_loss: 1.4526, test_f1: 0.5436
##################ITERATION #4 ****************************************
 epoch: 0, train_loss: 1.3948, test_loss: 1.2093, test_f1: 0.3542
 epoch: 1, train_loss: 1.1779, test_loss: 1.0871, test_f1: 0.4286
 epoch: 2, train_loss: 1.1114, test_loss: 1.0399, test_f1: 0.4364
 epoch: 3, train_loss: 1.0586, test_loss: 0.9748, test_f1: 0.4874
 epoch: 4, train_loss: 1.0307, test_loss: 1.0110, test_f1: 0.4533
 epoch: 5, train_loss: 1.0213, test_loss: 0.9637, test_f1: 0.4939
 epoch: 6, train_loss: 0.9802, test_loss: 0.9852, test_f1: 0.4899
 epoch: 7, train_loss: 0.9790, test_loss: 1.0076, test_f1: 0.5079
 epoch: 8, train_loss: 0.9632, test_loss: 0.9743, test_f1: 0.5088
 epoch: 9, train_loss: 0.9330, test_loss: 0.9625, test_f1: 0.5379
 epoch: 10, train_loss: 0.9374, test_loss: 1.0136, test_f1: 0.5001
 epoch: 11, train_loss: 0.9108, test_loss: 1.0045, test_f1: 0.4901
 epoch: 12, train_loss: 0.9167, test_loss: 1.0448, test_f1: 0.5261
 epoch: 13, train_loss: 0.9046, test_loss: 0.9831, test_f1: 0.5131
 epoch: 14, train_loss: 0.8883, test_loss: 1.0416, test_f1: 0.4953
 epoch: 15, train_loss: 0.8837, test_loss: 1.1615, test_f1: 0.5025
 epoch: 16, train_loss: 0.8704, test_loss: 1.0378, test_f1: 0.5305
 epoch: 17, train_loss: 0.8654, test_loss: 1.0527, test_f1: 0.5325
 epoch: 18, train_loss: 0.8532, test_loss: 1.0911, test_f1: 0.5216
 epoch: 19, train_loss: 0.8424, test_loss: 1.0708, test_f1: 0.5164
 epoch: 20, train_loss: 0.8338, test_loss: 1.1347, test_f1: 0.5083
 epoch: 21, train_loss: 0.8241, test_loss: 1.0425, test_f1: 0.5443
 epoch: 22, train_loss: 0.8352, test_loss: 1.0248, test_f1: 0.5452
 epoch: 23, train_loss: 0.8175, test_loss: 1.1396, test_f1: 0.5275
 epoch: 24, train_loss: 0.8102, test_loss: 1.0047, test_f1: 0.5348
 epoch: 25, train_loss: 0.8046, test_loss: 1.0692, test_f1: 0.5438
 epoch: 26, train_loss: 0.7809, test_loss: 1.0949, test_f1: 0.5350
 epoch: 27, train_loss: 0.7887, test_loss: 1.1043, test_f1: 0.5330
 epoch: 28, train_loss: 0.7792, test_loss: 1.1956, test_f1: 0.5414
 epoch: 29, train_loss: 0.7662, test_loss: 1.1136, test_f1: 0.5372
 epoch: 30, train_loss: 0.7715, test_loss: 1.1833, test_f1: 0.5059
 epoch: 31, train_loss: 0.7708, test_loss: 1.1225, test_f1: 0.5347
 epoch: 32, train_loss: 0.7505, test_loss: 1.1163, test_f1: 0.5075
 epoch: 33, train_loss: 0.7445, test_loss: 1.1582, test_f1: 0.5377
 epoch: 34, train_loss: 0.7227, test_loss: 1.1550, test_f1: 0.5375
 epoch: 35, train_loss: 0.7425, test_loss: 1.0887, test_f1: 0.5333
 epoch: 36, train_loss: 0.7382, test_loss: 1.1485, test_f1: 0.5361
 epoch: 37, train_loss: 0.7407, test_loss: 1.2227, test_f1: 0.5534
 epoch: 38, train_loss: 0.7164, test_loss: 1.1712, test_f1: 0.5511
 epoch: 39, train_loss: 0.7167, test_loss: 1.1338, test_f1: 0.5468
 epoch: 40, train_loss: 0.7082, test_loss: 1.1620, test_f1: 0.5424
 epoch: 41, train_loss: 0.7116, test_loss: 1.1512, test_f1: 0.5314
 epoch: 42, train_loss: 0.6914, test_loss: 1.2021, test_f1: 0.5159
 epoch: 43, train_loss: 0.6736, test_loss: 1.2869, test_f1: 0.5394
 epoch: 44, train_loss: 0.6879, test_loss: 1.1712, test_f1: 0.5527
 epoch: 45, train_loss: 0.6924, test_loss: 1.2607, test_f1: 0.5527
 epoch: 46, train_loss: 0.7006, test_loss: 1.2711, test_f1: 0.5346
 epoch: 47, train_loss: 0.6933, test_loss: 1.2336, test_f1: 0.5454
 epoch: 48, train_loss: 0.6659, test_loss: 1.3368, test_f1: 0.5247
 epoch: 49, train_loss: 0.6655, test_loss: 1.3308, test_f1: 0.5289
 epoch: 50, train_loss: 0.6506, test_loss: 1.2369, test_f1: 0.5478
 epoch: 51, train_loss: 0.6251, test_loss: 1.2851, test_f1: 0.5416
 epoch: 52, train_loss: 0.6206, test_loss: 1.2881, test_f1: 0.5370
 epoch: 53, train_loss: 0.6098, test_loss: 1.3536, test_f1: 0.5365
 epoch: 54, train_loss: 0.6063, test_loss: 1.3472, test_f1: 0.5223
 epoch: 55, train_loss: 0.5968, test_loss: 1.3272, test_f1: 0.5589
 epoch: 56, train_loss: 0.6002, test_loss: 1.3812, test_f1: 0.5400
 epoch: 57, train_loss: 0.5916, test_loss: 1.3888, test_f1: 0.5592
 epoch: 58, train_loss: 0.5764, test_loss: 1.3763, test_f1: 0.5222
 epoch: 59, train_loss: 0.5752, test_loss: 1.3676, test_f1: 0.5534
 epoch: 60, train_loss: 0.5920, test_loss: 1.3903, test_f1: 0.5519
 epoch: 61, train_loss: 0.5686, test_loss: 1.4177, test_f1: 0.5442
 epoch: 62, train_loss: 0.5818, test_loss: 1.4043, test_f1: 0.5415
 epoch: 63, train_loss: 0.5632, test_loss: 1.4342, test_f1: 0.5524
 epoch: 64, train_loss: 0.5806, test_loss: 1.4234, test_f1: 0.5307
 epoch: 65, train_loss: 0.5721, test_loss: 1.3934, test_f1: 0.5515
 epoch: 66, train_loss: 0.5633, test_loss: 1.4600, test_f1: 0.5490
 epoch: 67, train_loss: 0.5583, test_loss: 1.4116, test_f1: 0.5557
 epoch: 68, train_loss: 0.5489, test_loss: 1.4761, test_f1: 0.5572
 epoch: 69, train_loss: 0.5460, test_loss: 1.4613, test_f1: 0.5645
 epoch: 70, train_loss: 0.5413, test_loss: 1.4527, test_f1: 0.5739
 epoch: 71, train_loss: 0.5548, test_loss: 1.4185, test_f1: 0.5490
 epoch: 72, train_loss: 0.5546, test_loss: 1.5387, test_f1: 0.5562
 epoch: 73, train_loss: 0.5337, test_loss: 1.4642, test_f1: 0.5394
 epoch: 74, train_loss: 0.5373, test_loss: 1.5030, test_f1: 0.5548
 epoch: 75, train_loss: 0.5443, test_loss: 1.5366, test_f1: 0.5575
 epoch: 76, train_loss: 0.5370, test_loss: 1.4825, test_f1: 0.5499
 epoch: 77, train_loss: 0.5313, test_loss: 1.5181, test_f1: 0.5495
 epoch: 78, train_loss: 0.5311, test_loss: 1.5204, test_f1: 0.5634
 epoch: 79, train_loss: 0.5312, test_loss: 1.5638, test_f1: 0.5516
 epoch: 80, train_loss: 0.5404, test_loss: 1.4774, test_f1: 0.5489
 epoch: 81, train_loss: 0.5172, test_loss: 1.5213, test_f1: 0.5580
 epoch: 82, train_loss: 0.5068, test_loss: 1.5505, test_f1: 0.5450
 epoch: 83, train_loss: 0.5214, test_loss: 1.5368, test_f1: 0.5540
 epoch: 84, train_loss: 0.5092, test_loss: 1.5234, test_f1: 0.5455
 epoch: 85, train_loss: 0.5118, test_loss: 1.6042, test_f1: 0.5282
 epoch: 86, train_loss: 0.4974, test_loss: 1.6329, test_f1: 0.5511
 epoch: 87, train_loss: 0.4953, test_loss: 1.5855, test_f1: 0.5664
 epoch: 88, train_loss: 0.4963, test_loss: 1.6867, test_f1: 0.5595
 epoch: 89, train_loss: 0.5136, test_loss: 1.6181, test_f1: 0.5715
 epoch: 90, train_loss: 0.5015, test_loss: 1.5806, test_f1: 0.5715
 epoch: 91, train_loss: 0.4985, test_loss: 1.5785, test_f1: 0.5675
 epoch: 92, train_loss: 0.4921, test_loss: 1.5721, test_f1: 0.5527
 epoch: 93, train_loss: 0.4881, test_loss: 1.6844, test_f1: 0.5687
 epoch: 94, train_loss: 0.4922, test_loss: 1.6512, test_f1: 0.5696
 epoch: 95, train_loss: 0.4998, test_loss: 1.6700, test_f1: 0.5649
 epoch: 96, train_loss: 0.4804, test_loss: 1.6236, test_f1: 0.5741
 epoch: 97, train_loss: 0.4703, test_loss: 1.6287, test_f1: 0.5725
 epoch: 98, train_loss: 0.4813, test_loss: 1.6482, test_f1: 0.5659
 epoch: 99, train_loss: 0.4653, test_loss: 1.7817, test_f1: 0.5706
##################ITERATION #5 ****************************************
 epoch: 0, train_loss: 1.4489, test_loss: 1.1748, test_f1: 0.4096
 epoch: 1, train_loss: 1.1964, test_loss: 1.0946, test_f1: 0.4107
 epoch: 2, train_loss: 1.1387, test_loss: 1.0195, test_f1: 0.4651
 epoch: 3, train_loss: 1.0841, test_loss: 1.0172, test_f1: 0.4443
 epoch: 4, train_loss: 1.0405, test_loss: 1.0208, test_f1: 0.4634
 epoch: 5, train_loss: 1.0202, test_loss: 0.9598, test_f1: 0.4938
 epoch: 6, train_loss: 1.0125, test_loss: 0.9363, test_f1: 0.4684
 epoch: 7, train_loss: 0.9797, test_loss: 0.9381, test_f1: 0.4996
 epoch: 8, train_loss: 0.9606, test_loss: 1.0231, test_f1: 0.4247
 epoch: 9, train_loss: 0.9682, test_loss: 0.9733, test_f1: 0.4750
 epoch: 10, train_loss: 0.9543, test_loss: 0.9558, test_f1: 0.4608
 epoch: 11, train_loss: 0.9422, test_loss: 0.9460, test_f1: 0.4844
 epoch: 12, train_loss: 0.9252, test_loss: 0.9730, test_f1: 0.5141
 epoch: 13, train_loss: 0.9148, test_loss: 0.9391, test_f1: 0.5024
 epoch: 14, train_loss: 0.8911, test_loss: 0.9514, test_f1: 0.4856
 epoch: 15, train_loss: 0.8867, test_loss: 0.9755, test_f1: 0.5093
 epoch: 16, train_loss: 0.8758, test_loss: 1.1992, test_f1: 0.4560
 epoch: 17, train_loss: 0.8697, test_loss: 1.0014, test_f1: 0.4943
 epoch: 18, train_loss: 0.8523, test_loss: 1.0289, test_f1: 0.4824
 epoch: 19, train_loss: 0.8584, test_loss: 1.0621, test_f1: 0.4702
 epoch: 20, train_loss: 0.8588, test_loss: 1.0536, test_f1: 0.5019
 epoch: 21, train_loss: 0.8311, test_loss: 0.9304, test_f1: 0.5268
 epoch: 22, train_loss: 0.8252, test_loss: 0.9719, test_f1: 0.5281
 epoch: 23, train_loss: 0.8190, test_loss: 0.9654, test_f1: 0.5312
 epoch: 24, train_loss: 0.8129, test_loss: 1.0025, test_f1: 0.5044
 epoch: 25, train_loss: 0.8199, test_loss: 0.9258, test_f1: 0.5246
 epoch: 26, train_loss: 0.7941, test_loss: 0.9604, test_f1: 0.5170
 epoch: 27, train_loss: 0.8135, test_loss: 1.0096, test_f1: 0.5334
 epoch: 28, train_loss: 0.8009, test_loss: 1.0544, test_f1: 0.5201
 epoch: 29, train_loss: 0.7855, test_loss: 0.9717, test_f1: 0.5524
 epoch: 30, train_loss: 0.7809, test_loss: 1.0351, test_f1: 0.5036
 epoch: 31, train_loss: 0.7722, test_loss: 1.0563, test_f1: 0.5350
 epoch: 32, train_loss: 0.7677, test_loss: 1.1023, test_f1: 0.5126
 epoch: 33, train_loss: 0.7413, test_loss: 1.0348, test_f1: 0.5437
 epoch: 34, train_loss: 0.7455, test_loss: 1.1664, test_f1: 0.5033
 epoch: 35, train_loss: 0.7387, test_loss: 1.0371, test_f1: 0.5237
 epoch: 36, train_loss: 0.7350, test_loss: 1.0449, test_f1: 0.5461
 epoch: 37, train_loss: 0.7236, test_loss: 1.0870, test_f1: 0.5194
 epoch: 38, train_loss: 0.7236, test_loss: 1.0245, test_f1: 0.5319
 epoch: 39, train_loss: 0.7081, test_loss: 1.0559, test_f1: 0.5227
 epoch: 40, train_loss: 0.6874, test_loss: 1.1807, test_f1: 0.4923
 epoch: 41, train_loss: 0.6994, test_loss: 1.1258, test_f1: 0.5446
 epoch: 42, train_loss: 0.6986, test_loss: 1.1008, test_f1: 0.5421
 epoch: 43, train_loss: 0.6987, test_loss: 1.1019, test_f1: 0.5081
 epoch: 44, train_loss: 0.6773, test_loss: 1.0522, test_f1: 0.5796
 epoch: 45, train_loss: 0.6904, test_loss: 1.1283, test_f1: 0.5472
 epoch: 46, train_loss: 0.6802, test_loss: 1.0943, test_f1: 0.5485
 epoch: 47, train_loss: 0.6808, test_loss: 1.1198, test_f1: 0.5512
 epoch: 48, train_loss: 0.6787, test_loss: 1.1455, test_f1: 0.5192
 epoch: 49, train_loss: 0.6752, test_loss: 1.0955, test_f1: 0.5455
 epoch: 50, train_loss: 0.6480, test_loss: 1.1449, test_f1: 0.5667
 epoch: 51, train_loss: 0.6326, test_loss: 1.0840, test_f1: 0.5853
 epoch: 52, train_loss: 0.5963, test_loss: 1.1456, test_f1: 0.5621
 epoch: 53, train_loss: 0.6100, test_loss: 1.1014, test_f1: 0.5767
 epoch: 54, train_loss: 0.5967, test_loss: 1.1684, test_f1: 0.5780
 epoch: 55, train_loss: 0.6132, test_loss: 1.1242, test_f1: 0.5525
 epoch: 56, train_loss: 0.5866, test_loss: 1.1386, test_f1: 0.5698
 epoch: 57, train_loss: 0.5767, test_loss: 1.2035, test_f1: 0.5453
 epoch: 58, train_loss: 0.5862, test_loss: 1.1529, test_f1: 0.5723
 epoch: 59, train_loss: 0.5829, test_loss: 1.1501, test_f1: 0.5789
 epoch: 60, train_loss: 0.5762, test_loss: 1.1528, test_f1: 0.5648
 epoch: 61, train_loss: 0.5879, test_loss: 1.1780, test_f1: 0.5836
 epoch: 62, train_loss: 0.5563, test_loss: 1.1847, test_f1: 0.5759
 epoch: 63, train_loss: 0.5516, test_loss: 1.2251, test_f1: 0.5676
 epoch: 64, train_loss: 0.5565, test_loss: 1.2593, test_f1: 0.5386
 epoch: 65, train_loss: 0.5678, test_loss: 1.2156, test_f1: 0.5459
 epoch: 66, train_loss: 0.5578, test_loss: 1.2550, test_f1: 0.5740
 epoch: 67, train_loss: 0.5540, test_loss: 1.2723, test_f1: 0.5656
 epoch: 68, train_loss: 0.5617, test_loss: 1.3115, test_f1: 0.5698
 epoch: 69, train_loss: 0.5502, test_loss: 1.2617, test_f1: 0.5503
 epoch: 70, train_loss: 0.5510, test_loss: 1.2361, test_f1: 0.5788
 epoch: 71, train_loss: 0.5510, test_loss: 1.3081, test_f1: 0.5587
 epoch: 72, train_loss: 0.5495, test_loss: 1.2854, test_f1: 0.5491
 epoch: 73, train_loss: 0.5268, test_loss: 1.2511, test_f1: 0.5560
 epoch: 74, train_loss: 0.5268, test_loss: 1.2669, test_f1: 0.5562
 epoch: 75, train_loss: 0.5221, test_loss: 1.2129, test_f1: 0.5855
 epoch: 76, train_loss: 0.5273, test_loss: 1.3653, test_f1: 0.5399
 epoch: 77, train_loss: 0.5324, test_loss: 1.3291, test_f1: 0.5864
 epoch: 78, train_loss: 0.5257, test_loss: 1.2415, test_f1: 0.5346
 epoch: 79, train_loss: 0.5313, test_loss: 1.3245, test_f1: 0.5745
 epoch: 80, train_loss: 0.4986, test_loss: 1.2859, test_f1: 0.5487
 epoch: 81, train_loss: 0.5062, test_loss: 1.4214, test_f1: 0.5652
 epoch: 82, train_loss: 0.5044, test_loss: 1.3075, test_f1: 0.5667
 epoch: 83, train_loss: 0.5126, test_loss: 1.2661, test_f1: 0.5605
 epoch: 84, train_loss: 0.5037, test_loss: 1.3670, test_f1: 0.5609
 epoch: 85, train_loss: 0.5133, test_loss: 1.3321, test_f1: 0.5849
 epoch: 86, train_loss: 0.5039, test_loss: 1.6691, test_f1: 0.5544
 epoch: 87, train_loss: 0.5185, test_loss: 1.3042, test_f1: 0.5562
 epoch: 88, train_loss: 0.4909, test_loss: 1.4128, test_f1: 0.5767
 epoch: 89, train_loss: 0.5015, test_loss: 1.4297, test_f1: 0.5711
 epoch: 90, train_loss: 0.4861, test_loss: 1.3750, test_f1: 0.5577
 epoch: 91, train_loss: 0.4756, test_loss: 1.4586, test_f1: 0.5880
 epoch: 92, train_loss: 0.4728, test_loss: 1.5415, test_f1: 0.5767
 epoch: 93, train_loss: 0.4770, test_loss: 1.3757, test_f1: 0.5624
 epoch: 94, train_loss: 0.4879, test_loss: 1.3441, test_f1: 0.5907
 epoch: 95, train_loss: 0.4846, test_loss: 1.4694, test_f1: 0.5758
 epoch: 96, train_loss: 0.4767, test_loss: 1.4906, test_f1: 0.5598
 epoch: 97, train_loss: 0.4886, test_loss: 1.3779, test_f1: 0.5666
 epoch: 98, train_loss: 0.4892, test_loss: 1.4424, test_f1: 0.5861
 epoch: 99, train_loss: 0.4710, test_loss: 1.5374, test_f1: 0.5676
##################ITERATION #6 ****************************************
 epoch: 0, train_loss: 1.5239, test_loss: 1.2081, test_f1: 0.3504
 epoch: 1, train_loss: 1.2216, test_loss: 1.1165, test_f1: 0.4512
 epoch: 2, train_loss: 1.1636, test_loss: 1.0666, test_f1: 0.4272
 epoch: 3, train_loss: 1.1352, test_loss: 1.0497, test_f1: 0.4250
 epoch: 4, train_loss: 1.0994, test_loss: 1.0309, test_f1: 0.4590
 epoch: 5, train_loss: 1.0740, test_loss: 1.0216, test_f1: 0.4450
 epoch: 6, train_loss: 1.0404, test_loss: 1.0297, test_f1: 0.4724
 epoch: 7, train_loss: 1.0211, test_loss: 1.0003, test_f1: 0.4711
 epoch: 8, train_loss: 0.9932, test_loss: 0.9969, test_f1: 0.4758
 epoch: 9, train_loss: 1.0017, test_loss: 1.0242, test_f1: 0.5031
 epoch: 10, train_loss: 0.9774, test_loss: 1.0385, test_f1: 0.5013
 epoch: 11, train_loss: 0.9762, test_loss: 1.0117, test_f1: 0.5117
 epoch: 12, train_loss: 0.9406, test_loss: 0.9829, test_f1: 0.4962
 epoch: 13, train_loss: 0.9322, test_loss: 0.9761, test_f1: 0.5194
 epoch: 14, train_loss: 0.9117, test_loss: 0.9642, test_f1: 0.5298
 epoch: 15, train_loss: 0.9114, test_loss: 1.0053, test_f1: 0.5148
 epoch: 16, train_loss: 0.9002, test_loss: 0.9842, test_f1: 0.4949
 epoch: 17, train_loss: 0.8754, test_loss: 0.9814, test_f1: 0.5325
 epoch: 18, train_loss: 0.8900, test_loss: 0.9664, test_f1: 0.5216
 epoch: 19, train_loss: 0.8607, test_loss: 1.0048, test_f1: 0.4996
 epoch: 20, train_loss: 0.8484, test_loss: 0.9920, test_f1: 0.5066
 epoch: 21, train_loss: 0.8594, test_loss: 0.9726, test_f1: 0.5280
 epoch: 22, train_loss: 0.8483, test_loss: 1.1631, test_f1: 0.5031
 epoch: 23, train_loss: 0.8536, test_loss: 1.0707, test_f1: 0.5069
 epoch: 24, train_loss: 0.8480, test_loss: 1.0332, test_f1: 0.5222
 epoch: 25, train_loss: 0.8458, test_loss: 0.9965, test_f1: 0.5193
 epoch: 26, train_loss: 0.8170, test_loss: 1.0349, test_f1: 0.5319
 epoch: 27, train_loss: 0.8178, test_loss: 1.0093, test_f1: 0.5035
 epoch: 28, train_loss: 0.7949, test_loss: 0.9304, test_f1: 0.5366
 epoch: 29, train_loss: 0.7857, test_loss: 0.9657, test_f1: 0.5310
 epoch: 30, train_loss: 0.7928, test_loss: 1.0415, test_f1: 0.5326
 epoch: 31, train_loss: 0.7858, test_loss: 1.0239, test_f1: 0.5506
 epoch: 32, train_loss: 0.7886, test_loss: 1.0217, test_f1: 0.5616
 epoch: 33, train_loss: 0.7628, test_loss: 1.0765, test_f1: 0.5030
 epoch: 34, train_loss: 0.7688, test_loss: 1.0463, test_f1: 0.5423
 epoch: 35, train_loss: 0.7690, test_loss: 1.0602, test_f1: 0.5016
 epoch: 36, train_loss: 0.7556, test_loss: 1.0616, test_f1: 0.5380
 epoch: 37, train_loss: 0.7533, test_loss: 1.0265, test_f1: 0.5432
 epoch: 38, train_loss: 0.7405, test_loss: 1.0756, test_f1: 0.5559
 epoch: 39, train_loss: 0.7239, test_loss: 1.0638, test_f1: 0.5261
 epoch: 40, train_loss: 0.7110, test_loss: 1.0992, test_f1: 0.5310
 epoch: 41, train_loss: 0.7089, test_loss: 1.1025, test_f1: 0.5330
 epoch: 42, train_loss: 0.7186, test_loss: 1.0803, test_f1: 0.5346
 epoch: 43, train_loss: 0.7201, test_loss: 1.1239, test_f1: 0.5095
 epoch: 44, train_loss: 0.7054, test_loss: 1.1055, test_f1: 0.5109
 epoch: 45, train_loss: 0.7097, test_loss: 1.0784, test_f1: 0.5299
 epoch: 46, train_loss: 0.7026, test_loss: 1.1301, test_f1: 0.4769
 epoch: 47, train_loss: 0.6760, test_loss: 1.1698, test_f1: 0.4985
 epoch: 48, train_loss: 0.6848, test_loss: 1.0956, test_f1: 0.5498
 epoch: 49, train_loss: 0.6949, test_loss: 1.0952, test_f1: 0.5358
 epoch: 50, train_loss: 0.6714, test_loss: 1.1857, test_f1: 0.5264
 epoch: 51, train_loss: 0.6432, test_loss: 1.0827, test_f1: 0.5511
 epoch: 52, train_loss: 0.6214, test_loss: 1.1676, test_f1: 0.5079
 epoch: 53, train_loss: 0.6252, test_loss: 1.0935, test_f1: 0.5548
 epoch: 54, train_loss: 0.6136, test_loss: 1.1456, test_f1: 0.5115
 epoch: 55, train_loss: 0.6017, test_loss: 1.0880, test_f1: 0.5336
 epoch: 56, train_loss: 0.5972, test_loss: 1.1509, test_f1: 0.5480
 epoch: 57, train_loss: 0.6087, test_loss: 1.1857, test_f1: 0.5293
 epoch: 58, train_loss: 0.5900, test_loss: 1.2349, test_f1: 0.5092
 epoch: 59, train_loss: 0.5802, test_loss: 1.1599, test_f1: 0.5289
 epoch: 60, train_loss: 0.5783, test_loss: 1.1511, test_f1: 0.5139
 epoch: 61, train_loss: 0.5887, test_loss: 1.1253, test_f1: 0.5345
 epoch: 62, train_loss: 0.5721, test_loss: 1.2371, test_f1: 0.5076
 epoch: 63, train_loss: 0.5877, test_loss: 1.2063, test_f1: 0.5174
 epoch: 64, train_loss: 0.5861, test_loss: 1.1900, test_f1: 0.5170
 epoch: 65, train_loss: 0.5778, test_loss: 1.2378, test_f1: 0.5225
 epoch: 66, train_loss: 0.5765, test_loss: 1.2582, test_f1: 0.5059
 epoch: 67, train_loss: 0.5649, test_loss: 1.2243, test_f1: 0.5399
 epoch: 68, train_loss: 0.5640, test_loss: 1.1918, test_f1: 0.5391
 epoch: 69, train_loss: 0.5616, test_loss: 1.2650, test_f1: 0.5138
 epoch: 70, train_loss: 0.5543, test_loss: 1.2331, test_f1: 0.5231
 epoch: 71, train_loss: 0.5515, test_loss: 1.2420, test_f1: 0.5384
 epoch: 72, train_loss: 0.5456, test_loss: 1.2476, test_f1: 0.5167
 epoch: 73, train_loss: 0.5399, test_loss: 1.2607, test_f1: 0.5072
 epoch: 74, train_loss: 0.5364, test_loss: 1.3503, test_f1: 0.4923
 epoch: 75, train_loss: 0.5425, test_loss: 1.2780, test_f1: 0.5242
 epoch: 76, train_loss: 0.5430, test_loss: 1.2673, test_f1: 0.5029
 epoch: 77, train_loss: 0.5180, test_loss: 1.3859, test_f1: 0.5111
 epoch: 78, train_loss: 0.5200, test_loss: 1.2650, test_f1: 0.5266
 epoch: 79, train_loss: 0.5292, test_loss: 1.3118, test_f1: 0.5034
 epoch: 80, train_loss: 0.5293, test_loss: 1.2830, test_f1: 0.4981
 epoch: 81, train_loss: 0.5142, test_loss: 1.3612, test_f1: 0.4918
 epoch: 82, train_loss: 0.5192, test_loss: 1.3256, test_f1: 0.4978
 epoch: 83, train_loss: 0.5070, test_loss: 1.3283, test_f1: 0.5235
 epoch: 84, train_loss: 0.5176, test_loss: 1.3258, test_f1: 0.5049
 epoch: 85, train_loss: 0.5129, test_loss: 1.3102, test_f1: 0.4995
 epoch: 86, train_loss: 0.5016, test_loss: 1.3370, test_f1: 0.5301
 epoch: 87, train_loss: 0.4979, test_loss: 1.3080, test_f1: 0.5308
 epoch: 88, train_loss: 0.4939, test_loss: 1.3524, test_f1: 0.5281
 epoch: 89, train_loss: 0.4931, test_loss: 1.4359, test_f1: 0.5178
 epoch: 90, train_loss: 0.4944, test_loss: 1.3627, test_f1: 0.5122
 epoch: 91, train_loss: 0.4658, test_loss: 1.4249, test_f1: 0.4832
 epoch: 92, train_loss: 0.4777, test_loss: 1.3698, test_f1: 0.5572
 epoch: 93, train_loss: 0.4863, test_loss: 1.3592, test_f1: 0.5084
 epoch: 94, train_loss: 0.4859, test_loss: 1.3651, test_f1: 0.5098
 epoch: 95, train_loss: 0.4803, test_loss: 1.4003, test_f1: 0.5342
 epoch: 96, train_loss: 0.4729, test_loss: 1.4863, test_f1: 0.4997
 epoch: 97, train_loss: 0.4792, test_loss: 1.5105, test_f1: 0.4999
 epoch: 98, train_loss: 0.4735, test_loss: 1.4355, test_f1: 0.5208
 epoch: 99, train_loss: 0.4589, test_loss: 1.4212, test_f1: 0.5170
##################ITERATION #7 ****************************************
 epoch: 0, train_loss: 1.5308, test_loss: 1.2068, test_f1: 0.3694
 epoch: 1, train_loss: 1.2237, test_loss: 1.1130, test_f1: 0.4745
 epoch: 2, train_loss: 1.1516, test_loss: 1.0827, test_f1: 0.4819
 epoch: 3, train_loss: 1.1362, test_loss: 1.0527, test_f1: 0.4662
 epoch: 4, train_loss: 1.1127, test_loss: 1.0279, test_f1: 0.4745
 epoch: 5, train_loss: 1.0786, test_loss: 1.0057, test_f1: 0.4662
 epoch: 6, train_loss: 1.0619, test_loss: 0.9958, test_f1: 0.4802
 epoch: 7, train_loss: 1.0404, test_loss: 1.0084, test_f1: 0.4570
 epoch: 8, train_loss: 1.0180, test_loss: 0.9773, test_f1: 0.5043
 epoch: 9, train_loss: 1.0116, test_loss: 0.9834, test_f1: 0.4988
 epoch: 10, train_loss: 0.9934, test_loss: 0.9637, test_f1: 0.4916
 epoch: 11, train_loss: 0.9753, test_loss: 0.9965, test_f1: 0.4954
 epoch: 12, train_loss: 0.9552, test_loss: 1.0465, test_f1: 0.4678
 epoch: 13, train_loss: 0.9546, test_loss: 0.9610, test_f1: 0.5209
 epoch: 14, train_loss: 0.9331, test_loss: 0.9972, test_f1: 0.4915
 epoch: 15, train_loss: 0.9433, test_loss: 0.9419, test_f1: 0.5372
 epoch: 16, train_loss: 0.9315, test_loss: 0.9771, test_f1: 0.5477
 epoch: 17, train_loss: 0.9074, test_loss: 0.9753, test_f1: 0.5602
 epoch: 18, train_loss: 0.8943, test_loss: 1.0156, test_f1: 0.5311
 epoch: 19, train_loss: 0.8844, test_loss: 0.9711, test_f1: 0.5429
 epoch: 20, train_loss: 0.8795, test_loss: 0.9704, test_f1: 0.5784
 epoch: 21, train_loss: 0.8685, test_loss: 0.9263, test_f1: 0.5446
 epoch: 22, train_loss: 0.8855, test_loss: 1.0167, test_f1: 0.5222
 epoch: 23, train_loss: 0.8750, test_loss: 0.9837, test_f1: 0.5635
 epoch: 24, train_loss: 0.8610, test_loss: 1.0013, test_f1: 0.5445
 epoch: 25, train_loss: 0.8533, test_loss: 1.0404, test_f1: 0.5326
 epoch: 26, train_loss: 0.8461, test_loss: 1.0388, test_f1: 0.5610
 epoch: 27, train_loss: 0.8261, test_loss: 0.9990, test_f1: 0.5444
 epoch: 28, train_loss: 0.8475, test_loss: 1.0618, test_f1: 0.5051
 epoch: 29, train_loss: 0.8310, test_loss: 1.0425, test_f1: 0.5202
 epoch: 30, train_loss: 0.8208, test_loss: 1.0153, test_f1: 0.5341
 epoch: 31, train_loss: 0.8043, test_loss: 0.9740, test_f1: 0.5484
 epoch: 32, train_loss: 0.8009, test_loss: 1.0775, test_f1: 0.5114
 epoch: 33, train_loss: 0.7985, test_loss: 1.0373, test_f1: 0.5722
 epoch: 34, train_loss: 0.7900, test_loss: 1.0309, test_f1: 0.5449
 epoch: 35, train_loss: 0.7896, test_loss: 1.0887, test_f1: 0.5365
 epoch: 36, train_loss: 0.7799, test_loss: 1.0113, test_f1: 0.5593
 epoch: 37, train_loss: 0.7836, test_loss: 1.0524, test_f1: 0.5618
 epoch: 38, train_loss: 0.7623, test_loss: 1.1011, test_f1: 0.5056
 epoch: 39, train_loss: 0.7516, test_loss: 1.0934, test_f1: 0.5538
 epoch: 40, train_loss: 0.7718, test_loss: 1.0285, test_f1: 0.5440
 epoch: 41, train_loss: 0.7528, test_loss: 1.1642, test_f1: 0.5377
 epoch: 42, train_loss: 0.7565, test_loss: 1.1450, test_f1: 0.5385
 epoch: 43, train_loss: 0.7452, test_loss: 1.0682, test_f1: 0.5419
 epoch: 44, train_loss: 0.7444, test_loss: 1.0722, test_f1: 0.5410
 epoch: 45, train_loss: 0.7376, test_loss: 1.0523, test_f1: 0.5564
 epoch: 46, train_loss: 0.7339, test_loss: 1.0933, test_f1: 0.5671
 epoch: 47, train_loss: 0.7210, test_loss: 1.1129, test_f1: 0.5529
 epoch: 48, train_loss: 0.6985, test_loss: 1.1326, test_f1: 0.5711
 epoch: 49, train_loss: 0.7279, test_loss: 1.1529, test_f1: 0.5267
 epoch: 50, train_loss: 0.7264, test_loss: 1.0308, test_f1: 0.5442
 epoch: 51, train_loss: 0.6913, test_loss: 1.1291, test_f1: 0.5373
 epoch: 52, train_loss: 0.6873, test_loss: 1.1492, test_f1: 0.5199
 epoch: 53, train_loss: 0.6611, test_loss: 1.0382, test_f1: 0.5883
 epoch: 54, train_loss: 0.6683, test_loss: 1.1549, test_f1: 0.5576
 epoch: 55, train_loss: 0.6527, test_loss: 1.1089, test_f1: 0.5595
 epoch: 56, train_loss: 0.6501, test_loss: 1.0900, test_f1: 0.5711
 epoch: 57, train_loss: 0.6606, test_loss: 1.1547, test_f1: 0.5501
 epoch: 58, train_loss: 0.6415, test_loss: 1.1238, test_f1: 0.5638
 epoch: 59, train_loss: 0.6489, test_loss: 1.1748, test_f1: 0.5490
 epoch: 60, train_loss: 0.6607, test_loss: 1.1592, test_f1: 0.5764
 epoch: 61, train_loss: 0.6450, test_loss: 1.2160, test_f1: 0.5575
 epoch: 62, train_loss: 0.6545, test_loss: 1.0950, test_f1: 0.5642
 epoch: 63, train_loss: 0.6458, test_loss: 1.1315, test_f1: 0.5608
 epoch: 64, train_loss: 0.6381, test_loss: 1.1358, test_f1: 0.5603
 epoch: 65, train_loss: 0.6378, test_loss: 1.1225, test_f1: 0.5537
 epoch: 66, train_loss: 0.6246, test_loss: 1.1242, test_f1: 0.5702
 epoch: 67, train_loss: 0.6251, test_loss: 1.1773, test_f1: 0.5391
 epoch: 68, train_loss: 0.6142, test_loss: 1.2140, test_f1: 0.5406
 epoch: 69, train_loss: 0.6131, test_loss: 1.1827, test_f1: 0.5416
 epoch: 70, train_loss: 0.5969, test_loss: 1.1617, test_f1: 0.5677
 epoch: 71, train_loss: 0.6173, test_loss: 1.2118, test_f1: 0.5514
 epoch: 72, train_loss: 0.6041, test_loss: 1.1265, test_f1: 0.5667
 epoch: 73, train_loss: 0.6031, test_loss: 1.2117, test_f1: 0.5466
 epoch: 74, train_loss: 0.5947, test_loss: 1.1593, test_f1: 0.5724
 epoch: 75, train_loss: 0.6147, test_loss: 1.2721, test_f1: 0.5281
 epoch: 76, train_loss: 0.6056, test_loss: 1.1740, test_f1: 0.5733
 epoch: 77, train_loss: 0.5963, test_loss: 1.2075, test_f1: 0.5607
 epoch: 78, train_loss: 0.5948, test_loss: 1.2779, test_f1: 0.5468
 epoch: 79, train_loss: 0.5951, test_loss: 1.2078, test_f1: 0.5759
 epoch: 80, train_loss: 0.5826, test_loss: 1.3357, test_f1: 0.5469
 epoch: 81, train_loss: 0.5698, test_loss: 1.2192, test_f1: 0.5506
 epoch: 82, train_loss: 0.5937, test_loss: 1.2288, test_f1: 0.5733
 epoch: 83, train_loss: 0.5899, test_loss: 1.2651, test_f1: 0.5622
 epoch: 84, train_loss: 0.5775, test_loss: 1.1673, test_f1: 0.5246
 epoch: 85, train_loss: 0.5924, test_loss: 1.2196, test_f1: 0.5507
 epoch: 86, train_loss: 0.5726, test_loss: 1.2267, test_f1: 0.5426
 epoch: 87, train_loss: 0.5726, test_loss: 1.2152, test_f1: 0.5535
 epoch: 88, train_loss: 0.5617, test_loss: 1.2553, test_f1: 0.5527
 epoch: 89, train_loss: 0.5691, test_loss: 1.2309, test_f1: 0.5437
 epoch: 90, train_loss: 0.5648, test_loss: 1.3739, test_f1: 0.5488
 epoch: 91, train_loss: 0.5622, test_loss: 1.2659, test_f1: 0.5494
 epoch: 92, train_loss: 0.5667, test_loss: 1.2981, test_f1: 0.5613
 epoch: 93, train_loss: 0.5622, test_loss: 1.2736, test_f1: 0.5609
 epoch: 94, train_loss: 0.5453, test_loss: 1.2736, test_f1: 0.5486
 epoch: 95, train_loss: 0.5509, test_loss: 1.3638, test_f1: 0.5673
 epoch: 96, train_loss: 0.5469, test_loss: 1.2494, test_f1: 0.5511
 epoch: 97, train_loss: 0.5550, test_loss: 1.5000, test_f1: 0.5170
 epoch: 98, train_loss: 0.5499, test_loss: 1.2468, test_f1: 0.5272
 epoch: 99, train_loss: 0.5356, test_loss: 1.3840, test_f1: 0.5665
##################ITERATION #8 ****************************************
 epoch: 0, train_loss: 1.5359, test_loss: 1.2813, test_f1: 0.3023
 epoch: 1, train_loss: 1.2033, test_loss: 1.0700, test_f1: 0.4701
 epoch: 2, train_loss: 1.1513, test_loss: 1.0478, test_f1: 0.4375
 epoch: 3, train_loss: 1.1151, test_loss: 1.0195, test_f1: 0.4744
 epoch: 4, train_loss: 1.0928, test_loss: 0.9877, test_f1: 0.4544
 epoch: 5, train_loss: 1.0571, test_loss: 0.9605, test_f1: 0.4679
 epoch: 6, train_loss: 1.0311, test_loss: 0.9401, test_f1: 0.5111
 epoch: 7, train_loss: 1.0260, test_loss: 0.9301, test_f1: 0.5121
 epoch: 8, train_loss: 1.0208, test_loss: 1.0244, test_f1: 0.4480
 epoch: 9, train_loss: 0.9939, test_loss: 0.9551, test_f1: 0.4909
 epoch: 10, train_loss: 0.9866, test_loss: 0.9584, test_f1: 0.4726
 epoch: 11, train_loss: 0.9606, test_loss: 0.9399, test_f1: 0.4851
 epoch: 12, train_loss: 0.9568, test_loss: 0.9678, test_f1: 0.4646
 epoch: 13, train_loss: 0.9343, test_loss: 0.9364, test_f1: 0.4982
 epoch: 14, train_loss: 0.9302, test_loss: 0.8959, test_f1: 0.4908
 epoch: 15, train_loss: 0.9148, test_loss: 0.9593, test_f1: 0.5149
 epoch: 16, train_loss: 0.9046, test_loss: 0.9446, test_f1: 0.5143
 epoch: 17, train_loss: 0.9143, test_loss: 0.9230, test_f1: 0.4998
 epoch: 18, train_loss: 0.8907, test_loss: 0.9336, test_f1: 0.4774
 epoch: 19, train_loss: 0.8847, test_loss: 0.9776, test_f1: 0.4900
 epoch: 20, train_loss: 0.8769, test_loss: 0.9466, test_f1: 0.5052
 epoch: 21, train_loss: 0.8754, test_loss: 1.0005, test_f1: 0.4833
 epoch: 22, train_loss: 0.8646, test_loss: 0.9916, test_f1: 0.5007
 epoch: 23, train_loss: 0.8640, test_loss: 1.0381, test_f1: 0.5222
 epoch: 24, train_loss: 0.8526, test_loss: 1.0314, test_f1: 0.4726
 epoch: 25, train_loss: 0.8401, test_loss: 1.0626, test_f1: 0.4831
 epoch: 26, train_loss: 0.8446, test_loss: 0.9578, test_f1: 0.4827
 epoch: 27, train_loss: 0.8347, test_loss: 1.0015, test_f1: 0.5187
 epoch: 28, train_loss: 0.8209, test_loss: 1.0504, test_f1: 0.4757
 epoch: 29, train_loss: 0.8113, test_loss: 1.0343, test_f1: 0.4816
 epoch: 30, train_loss: 0.8078, test_loss: 1.0106, test_f1: 0.4847
 epoch: 31, train_loss: 0.8209, test_loss: 1.0942, test_f1: 0.4672
 epoch: 32, train_loss: 0.8111, test_loss: 1.0113, test_f1: 0.5143
 epoch: 33, train_loss: 0.7865, test_loss: 1.0084, test_f1: 0.5073
 epoch: 34, train_loss: 0.7788, test_loss: 1.1532, test_f1: 0.4798
 epoch: 35, train_loss: 0.7876, test_loss: 1.1861, test_f1: 0.4437
 epoch: 36, train_loss: 0.8055, test_loss: 1.0435, test_f1: 0.4881
 epoch: 37, train_loss: 0.7737, test_loss: 1.0861, test_f1: 0.5251
 epoch: 38, train_loss: 0.7786, test_loss: 1.0777, test_f1: 0.4854
 epoch: 39, train_loss: 0.7489, test_loss: 1.1033, test_f1: 0.5193
 epoch: 40, train_loss: 0.7468, test_loss: 1.0547, test_f1: 0.5107
 epoch: 41, train_loss: 0.7493, test_loss: 1.2380, test_f1: 0.4756
 epoch: 42, train_loss: 0.7530, test_loss: 1.1583, test_f1: 0.4914
 epoch: 43, train_loss: 0.7234, test_loss: 1.1522, test_f1: 0.4939
 epoch: 44, train_loss: 0.7211, test_loss: 1.2009, test_f1: 0.5205
 epoch: 45, train_loss: 0.7362, test_loss: 1.1201, test_f1: 0.5192
 epoch: 46, train_loss: 0.7108, test_loss: 1.2003, test_f1: 0.5224
 epoch: 47, train_loss: 0.7130, test_loss: 1.1023, test_f1: 0.5457
 epoch: 48, train_loss: 0.7198, test_loss: 1.2508, test_f1: 0.5387
 epoch: 49, train_loss: 0.6942, test_loss: 1.1947, test_f1: 0.5343
 epoch: 50, train_loss: 0.7027, test_loss: 1.1506, test_f1: 0.5382
 epoch: 51, train_loss: 0.6778, test_loss: 1.2067, test_f1: 0.5090
 epoch: 52, train_loss: 0.6565, test_loss: 1.1751, test_f1: 0.5442
 epoch: 53, train_loss: 0.6538, test_loss: 1.2291, test_f1: 0.5350
 epoch: 54, train_loss: 0.6553, test_loss: 1.1950, test_f1: 0.5418
 epoch: 55, train_loss: 0.6441, test_loss: 1.2284, test_f1: 0.5391
 epoch: 56, train_loss: 0.6290, test_loss: 1.2529, test_f1: 0.5232
 epoch: 57, train_loss: 0.6418, test_loss: 1.2821, test_f1: 0.5189
 epoch: 58, train_loss: 0.6333, test_loss: 1.2403, test_f1: 0.5312
 epoch: 59, train_loss: 0.6323, test_loss: 1.2740, test_f1: 0.5367
 epoch: 60, train_loss: 0.6176, test_loss: 1.2916, test_f1: 0.5347
 epoch: 61, train_loss: 0.6288, test_loss: 1.2550, test_f1: 0.5329
 epoch: 62, train_loss: 0.6127, test_loss: 1.2469, test_f1: 0.5183
 epoch: 63, train_loss: 0.6193, test_loss: 1.3148, test_f1: 0.5273
 epoch: 64, train_loss: 0.6172, test_loss: 1.3069, test_f1: 0.5359
 epoch: 65, train_loss: 0.6044, test_loss: 1.3125, test_f1: 0.5272
 epoch: 66, train_loss: 0.6098, test_loss: 1.2968, test_f1: 0.5522
 epoch: 67, train_loss: 0.5942, test_loss: 1.2146, test_f1: 0.5508
 epoch: 68, train_loss: 0.6001, test_loss: 1.3190, test_f1: 0.5368
 epoch: 69, train_loss: 0.5717, test_loss: 1.3229, test_f1: 0.5581
 epoch: 70, train_loss: 0.5859, test_loss: 1.3615, test_f1: 0.5189
 epoch: 71, train_loss: 0.5894, test_loss: 1.4750, test_f1: 0.5189
 epoch: 72, train_loss: 0.6001, test_loss: 1.3346, test_f1: 0.5411
 epoch: 73, train_loss: 0.5770, test_loss: 1.2962, test_f1: 0.5425
 epoch: 74, train_loss: 0.5840, test_loss: 1.3204, test_f1: 0.5423
 epoch: 75, train_loss: 0.5707, test_loss: 1.3221, test_f1: 0.5429
 epoch: 76, train_loss: 0.5670, test_loss: 1.3506, test_f1: 0.5155
 epoch: 77, train_loss: 0.5732, test_loss: 1.3212, test_f1: 0.5696
 epoch: 78, train_loss: 0.5801, test_loss: 1.3135, test_f1: 0.5400
 epoch: 79, train_loss: 0.5670, test_loss: 1.3488, test_f1: 0.5436
 epoch: 80, train_loss: 0.5629, test_loss: 1.3172, test_f1: 0.5504
 epoch: 81, train_loss: 0.5522, test_loss: 1.3357, test_f1: 0.5543
 epoch: 82, train_loss: 0.5474, test_loss: 1.4177, test_f1: 0.5270
 epoch: 83, train_loss: 0.5607, test_loss: 1.3902, test_f1: 0.5642
 epoch: 84, train_loss: 0.5452, test_loss: 1.3639, test_f1: 0.5589
 epoch: 85, train_loss: 0.5475, test_loss: 1.4196, test_f1: 0.5588
 epoch: 86, train_loss: 0.5529, test_loss: 1.3347, test_f1: 0.5768
 epoch: 87, train_loss: 0.5293, test_loss: 1.4178, test_f1: 0.5310
 epoch: 88, train_loss: 0.5395, test_loss: 1.4121, test_f1: 0.5288
 epoch: 89, train_loss: 0.5142, test_loss: 1.4018, test_f1: 0.5397
 epoch: 90, train_loss: 0.5258, test_loss: 1.4345, test_f1: 0.5469
 epoch: 91, train_loss: 0.5261, test_loss: 1.4060, test_f1: 0.5445
 epoch: 92, train_loss: 0.5291, test_loss: 1.3757, test_f1: 0.5515
 epoch: 93, train_loss: 0.5245, test_loss: 1.3536, test_f1: 0.5567
 epoch: 94, train_loss: 0.5280, test_loss: 1.4587, test_f1: 0.5260
 epoch: 95, train_loss: 0.5156, test_loss: 1.4075, test_f1: 0.5598
 epoch: 96, train_loss: 0.5159, test_loss: 1.4434, test_f1: 0.5491
 epoch: 97, train_loss: 0.5431, test_loss: 1.3387, test_f1: 0.5823
 epoch: 98, train_loss: 0.5099, test_loss: 1.3394, test_f1: 0.5770
 epoch: 99, train_loss: 0.5125, test_loss: 1.4114, test_f1: 0.5684
##################ITERATION #9 ****************************************
 epoch: 0, train_loss: 1.7141, test_loss: 1.2105, test_f1: 0.3843
 epoch: 1, train_loss: 1.2147, test_loss: 1.0932, test_f1: 0.4294
 epoch: 2, train_loss: 1.1437, test_loss: 1.0438, test_f1: 0.4165
 epoch: 3, train_loss: 1.0938, test_loss: 1.0053, test_f1: 0.4483
 epoch: 4, train_loss: 1.0905, test_loss: 1.0277, test_f1: 0.4506
 epoch: 5, train_loss: 1.0473, test_loss: 0.9728, test_f1: 0.4696
 epoch: 6, train_loss: 1.0223, test_loss: 0.9740, test_f1: 0.4469
 epoch: 7, train_loss: 1.0125, test_loss: 0.9635, test_f1: 0.4958
 epoch: 8, train_loss: 0.9885, test_loss: 0.9779, test_f1: 0.5034
 epoch: 9, train_loss: 0.9710, test_loss: 0.9957, test_f1: 0.4696
 epoch: 10, train_loss: 0.9600, test_loss: 0.9530, test_f1: 0.4576
 epoch: 11, train_loss: 0.9574, test_loss: 1.0220, test_f1: 0.4732
 epoch: 12, train_loss: 0.9561, test_loss: 1.0006, test_f1: 0.4726
 epoch: 13, train_loss: 0.9267, test_loss: 0.9943, test_f1: 0.4833
 epoch: 14, train_loss: 0.9135, test_loss: 0.9937, test_f1: 0.5058
 epoch: 15, train_loss: 0.9134, test_loss: 1.0214, test_f1: 0.4895
 epoch: 16, train_loss: 0.9095, test_loss: 1.0515, test_f1: 0.4872
 epoch: 17, train_loss: 0.8821, test_loss: 1.0144, test_f1: 0.4809
 epoch: 18, train_loss: 0.8696, test_loss: 1.0445, test_f1: 0.5151
 epoch: 19, train_loss: 0.8756, test_loss: 1.0707, test_f1: 0.5059
 epoch: 20, train_loss: 0.8680, test_loss: 1.0630, test_f1: 0.5236
 epoch: 21, train_loss: 0.8653, test_loss: 0.9918, test_f1: 0.5135
 epoch: 22, train_loss: 0.8379, test_loss: 1.1415, test_f1: 0.5129
 epoch: 23, train_loss: 0.8434, test_loss: 1.0475, test_f1: 0.5110
 epoch: 24, train_loss: 0.8483, test_loss: 1.0471, test_f1: 0.5451
 epoch: 25, train_loss: 0.8273, test_loss: 1.0663, test_f1: 0.5291
 epoch: 26, train_loss: 0.8398, test_loss: 1.0291, test_f1: 0.5256
 epoch: 27, train_loss: 0.8278, test_loss: 1.0130, test_f1: 0.5423
 epoch: 28, train_loss: 0.8100, test_loss: 1.1596, test_f1: 0.5068
 epoch: 29, train_loss: 0.8059, test_loss: 1.0734, test_f1: 0.5229
 epoch: 30, train_loss: 0.7895, test_loss: 1.0175, test_f1: 0.5270
 epoch: 31, train_loss: 0.7975, test_loss: 1.0351, test_f1: 0.5200
 epoch: 32, train_loss: 0.7698, test_loss: 1.1078, test_f1: 0.5339
 epoch: 33, train_loss: 0.7657, test_loss: 1.1739, test_f1: 0.5275
 epoch: 34, train_loss: 0.7865, test_loss: 1.1074, test_f1: 0.4971
 epoch: 35, train_loss: 0.7658, test_loss: 1.1337, test_f1: 0.5159
 epoch: 36, train_loss: 0.7656, test_loss: 1.1493, test_f1: 0.5161
 epoch: 37, train_loss: 0.7477, test_loss: 1.1574, test_f1: 0.5188
 epoch: 38, train_loss: 0.7426, test_loss: 1.2743, test_f1: 0.4914
 epoch: 39, train_loss: 0.7425, test_loss: 1.1313, test_f1: 0.5168
 epoch: 40, train_loss: 0.7265, test_loss: 1.1327, test_f1: 0.5199
 epoch: 41, train_loss: 0.7531, test_loss: 1.1201, test_f1: 0.5150
 epoch: 42, train_loss: 0.7162, test_loss: 1.1288, test_f1: 0.5054
 epoch: 43, train_loss: 0.7194, test_loss: 1.1622, test_f1: 0.4813
 epoch: 44, train_loss: 0.7156, test_loss: 1.2639, test_f1: 0.4982
 epoch: 45, train_loss: 0.7133, test_loss: 1.1464, test_f1: 0.5179
 epoch: 46, train_loss: 0.7010, test_loss: 1.1748, test_f1: 0.5122
 epoch: 47, train_loss: 0.6940, test_loss: 1.2210, test_f1: 0.5162
 epoch: 48, train_loss: 0.6844, test_loss: 1.1903, test_f1: 0.5176
 epoch: 49, train_loss: 0.6937, test_loss: 1.2327, test_f1: 0.5284
 epoch: 50, train_loss: 0.7162, test_loss: 1.2091, test_f1: 0.4994
 epoch: 51, train_loss: 0.6730, test_loss: 1.2383, test_f1: 0.5508
 epoch: 52, train_loss: 0.6373, test_loss: 1.2217, test_f1: 0.5111
 epoch: 53, train_loss: 0.6356, test_loss: 1.2659, test_f1: 0.5254
 epoch: 54, train_loss: 0.6351, test_loss: 1.2087, test_f1: 0.5447
 epoch: 55, train_loss: 0.6257, test_loss: 1.2178, test_f1: 0.5280
 epoch: 56, train_loss: 0.6227, test_loss: 1.2513, test_f1: 0.5565
 epoch: 57, train_loss: 0.6135, test_loss: 1.2098, test_f1: 0.5411
 epoch: 58, train_loss: 0.6253, test_loss: 1.2278, test_f1: 0.5422
 epoch: 59, train_loss: 0.6169, test_loss: 1.2450, test_f1: 0.5266
 epoch: 60, train_loss: 0.6127, test_loss: 1.1863, test_f1: 0.5499
 epoch: 61, train_loss: 0.5923, test_loss: 1.2827, test_f1: 0.5271
 epoch: 62, train_loss: 0.6246, test_loss: 1.2087, test_f1: 0.5188
 epoch: 63, train_loss: 0.5984, test_loss: 1.2538, test_f1: 0.5350
 epoch: 64, train_loss: 0.5969, test_loss: 1.2298, test_f1: 0.5403
 epoch: 65, train_loss: 0.5929, test_loss: 1.2539, test_f1: 0.5330
 epoch: 66, train_loss: 0.5896, test_loss: 1.1721, test_f1: 0.5269
 epoch: 67, train_loss: 0.5749, test_loss: 1.3407, test_f1: 0.5329
 epoch: 68, train_loss: 0.5845, test_loss: 1.2340, test_f1: 0.5340
 epoch: 69, train_loss: 0.5784, test_loss: 1.2327, test_f1: 0.5464
 epoch: 70, train_loss: 0.5608, test_loss: 1.2816, test_f1: 0.5559
 epoch: 71, train_loss: 0.5665, test_loss: 1.3121, test_f1: 0.5154
 epoch: 72, train_loss: 0.5590, test_loss: 1.2739, test_f1: 0.5299
 epoch: 73, train_loss: 0.5570, test_loss: 1.2935, test_f1: 0.5441
 epoch: 74, train_loss: 0.5703, test_loss: 1.2375, test_f1: 0.5364
 epoch: 75, train_loss: 0.5479, test_loss: 1.3733, test_f1: 0.5329
 epoch: 76, train_loss: 0.5608, test_loss: 1.3707, test_f1: 0.5255
 epoch: 77, train_loss: 0.5642, test_loss: 1.3288, test_f1: 0.5472
 epoch: 78, train_loss: 0.5420, test_loss: 1.3643, test_f1: 0.5397
 epoch: 79, train_loss: 0.5540, test_loss: 1.2611, test_f1: 0.5379
 epoch: 80, train_loss: 0.5405, test_loss: 1.2906, test_f1: 0.5538
 epoch: 81, train_loss: 0.5319, test_loss: 1.2728, test_f1: 0.5309
 epoch: 82, train_loss: 0.5262, test_loss: 1.3148, test_f1: 0.5326
 epoch: 83, train_loss: 0.5225, test_loss: 1.3016, test_f1: 0.5472
 epoch: 84, train_loss: 0.5290, test_loss: 1.3297, test_f1: 0.5301
 epoch: 85, train_loss: 0.5333, test_loss: 1.3508, test_f1: 0.5379
 epoch: 86, train_loss: 0.5282, test_loss: 1.3208, test_f1: 0.5516
 epoch: 87, train_loss: 0.5105, test_loss: 1.2948, test_f1: 0.5538
 epoch: 88, train_loss: 0.5246, test_loss: 1.3575, test_f1: 0.5143
 epoch: 89, train_loss: 0.5312, test_loss: 1.3638, test_f1: 0.5420
 epoch: 90, train_loss: 0.5261, test_loss: 1.3307, test_f1: 0.5412
 epoch: 91, train_loss: 0.5083, test_loss: 1.4024, test_f1: 0.5743
 epoch: 92, train_loss: 0.5193, test_loss: 1.3671, test_f1: 0.5385
 epoch: 93, train_loss: 0.5050, test_loss: 1.3526, test_f1: 0.5579
 epoch: 94, train_loss: 0.4933, test_loss: 1.3676, test_f1: 0.5379
 epoch: 95, train_loss: 0.5245, test_loss: 1.3838, test_f1: 0.5459
 epoch: 96, train_loss: 0.5034, test_loss: 1.3260, test_f1: 0.5511
 epoch: 97, train_loss: 0.4982, test_loss: 1.3947, test_f1: 0.5462
 epoch: 98, train_loss: 0.4874, test_loss: 1.4210, test_f1: 0.5346
 epoch: 99, train_loss: 0.4966, test_loss: 1.4190, test_f1: 0.5233

Training completed in 421.41 seconds
Best F1: 0.5943 at epoch 73
Mean F1 across iterations: 0.5835  0.0099
========================FINAL RESULTS================================
FEGIN weighted F1: 0.5943  0.0099
python main.py --data ltspice_examples --representation component_component --model FEGIN --layers 2 --hiddens 64 --batch_size 128 --lr 0.001 --emb_size 250 --epochs 100 --save_appendix component_component_L2_H64_BS128_LR0.001_E250 --no_val
-----



STDERR:
  File "main.py", line 370, in <module>
    main()
  File "main.py", line 254, in main
    dataset = dataset_class(
  File "/home/philip/projects/ltspice_examples_code_repo/Circuit-Completion-Using-GNNs/component_classification_with_link_prediction_head/evaluation/FEGIN/kernel/circuit_datasets.py", line 15, in __init__
    self.data, self.slices = torch.load(self.processed_paths[0])
  File "/home/philip/.local/lib/python3.8/site-packages/torch/serialization.py", line 1040, in load
    warnings.warn(
  File "/usr/lib/python3.8/warnings.py", line 109, in _showwarnmsg
    sw(msg.message, msg.category, msg.filename, msg.lineno,
  File "main.py", line 47, in warn_with_traceback
    traceback.print_stack(file=log)
/home/philip/projects/ltspice_examples_code_repo/Circuit-Completion-Using-GNNs/component_classification_with_link_prediction_head/evaluation/FEGIN/kernel/circuit_datasets.py:15: FutureWarning: You are using `torch.load` with `weights_only=False` (the current default value), which uses the default pickle module implicitly. It is possible to construct malicious pickle data which will execute arbitrary code during unpickling (See https://github.com/pytorch/pytorch/blob/main/SECURITY.md#untrusted-models for more details). In a future release, the default value for `weights_only` will be flipped to `True`. This limits the functions that could be executed during unpickling. Arbitrary objects will no longer be allowed to be loaded via this mode unless they are explicitly allowlisted by the user via `torch.serialization.add_safe_globals`. We recommend you start setting `weights_only=True` for any use case where you don't have full control of the loaded file. Please open an issue on GitHub for any issues related to this experimental feature.
  self.data, self.slices = torch.load(self.processed_paths[0])
