STDOUT:
Results will be saved in /home/philip/projects/llm_inference_code_repo/Circuit-Completion-Using-GNNs/component_classification_with_link_prediction_head/evaluation/FEGIN/results/model_FEGIN_dataset_ltspice_examples
Command line input: python main.py --data ltspice_examples --representation component_net --model FEGIN --layers 6 --hiddens 128 --batch_size 128 --lr 0.001 --emb_size 128 --epochs 100 --save_appendix component_net_L6_H128_BS128_LR0.001_E128 --no_val
 is saved.
-----
ltspice_examples - FEGIN
Using 6 layers, 128 hidden units, h = 2
Loading component_net representation dataset
ENTERED
Training FEGIN on component_net representation
Train: 3558, Test: 846
##################ITERATION #0 ****************************************
 epoch: 0, train_loss: 1.2138, test_loss: 1.2885, test_f1: 0.3676
 epoch: 1, train_loss: 1.0475, test_loss: 1.0217, test_f1: 0.4684
 epoch: 2, train_loss: 0.9740, test_loss: 0.9398, test_f1: 0.5475
 epoch: 3, train_loss: 0.9217, test_loss: 0.9917, test_f1: 0.5217
 epoch: 4, train_loss: 0.8978, test_loss: 1.1236, test_f1: 0.4997
 epoch: 5, train_loss: 0.8825, test_loss: 0.9685, test_f1: 0.5560
 epoch: 6, train_loss: 0.8683, test_loss: 0.8933, test_f1: 0.5715
 epoch: 7, train_loss: 0.8372, test_loss: 0.9702, test_f1: 0.5903
 epoch: 8, train_loss: 0.8187, test_loss: 1.0481, test_f1: 0.5077
 epoch: 9, train_loss: 0.8254, test_loss: 0.9708, test_f1: 0.5599
 epoch: 10, train_loss: 0.8071, test_loss: 0.9982, test_f1: 0.5820
 epoch: 11, train_loss: 0.7814, test_loss: 0.9557, test_f1: 0.5903
 epoch: 12, train_loss: 0.7589, test_loss: 0.9919, test_f1: 0.5523
 epoch: 13, train_loss: 0.7563, test_loss: 0.9419, test_f1: 0.6130
 epoch: 14, train_loss: 0.7567, test_loss: 1.1120, test_f1: 0.5794
 epoch: 15, train_loss: 0.7496, test_loss: 1.0036, test_f1: 0.5865
 epoch: 16, train_loss: 0.7169, test_loss: 0.9296, test_f1: 0.6058
 epoch: 17, train_loss: 0.7072, test_loss: 0.9380, test_f1: 0.6229
 epoch: 18, train_loss: 0.7004, test_loss: 0.9841, test_f1: 0.5848
 epoch: 19, train_loss: 0.6876, test_loss: 0.9117, test_f1: 0.6042
 epoch: 20, train_loss: 0.6726, test_loss: 1.0029, test_f1: 0.5876
 epoch: 21, train_loss: 0.6752, test_loss: 1.0199, test_f1: 0.5969
 epoch: 22, train_loss: 0.6516, test_loss: 1.0202, test_f1: 0.6142
 epoch: 23, train_loss: 0.6402, test_loss: 1.0474, test_f1: 0.6239
 epoch: 24, train_loss: 0.6338, test_loss: 1.1224, test_f1: 0.5659
 epoch: 25, train_loss: 0.6152, test_loss: 1.0906, test_f1: 0.5962
 epoch: 26, train_loss: 0.5975, test_loss: 1.0153, test_f1: 0.6315
 epoch: 27, train_loss: 0.6003, test_loss: 1.0328, test_f1: 0.5790
 epoch: 28, train_loss: 0.5885, test_loss: 1.0505, test_f1: 0.6135
 epoch: 29, train_loss: 0.5906, test_loss: 1.1148, test_f1: 0.6204
 epoch: 30, train_loss: 0.5817, test_loss: 1.0367, test_f1: 0.6180
 epoch: 31, train_loss: 0.5631, test_loss: 1.0888, test_f1: 0.6207
 epoch: 32, train_loss: 0.5396, test_loss: 0.9828, test_f1: 0.6194
 epoch: 33, train_loss: 0.5528, test_loss: 1.1625, test_f1: 0.5846
 epoch: 34, train_loss: 0.5242, test_loss: 1.1681, test_f1: 0.6299
 epoch: 35, train_loss: 0.5508, test_loss: 0.9945, test_f1: 0.6557
 epoch: 36, train_loss: 0.5139, test_loss: 1.1763, test_f1: 0.6099
 epoch: 37, train_loss: 0.5248, test_loss: 1.1345, test_f1: 0.6400
 epoch: 38, train_loss: 0.4754, test_loss: 1.1144, test_f1: 0.6369
 epoch: 39, train_loss: 0.4693, test_loss: 1.4089, test_f1: 0.5954
 epoch: 40, train_loss: 0.4547, test_loss: 1.2275, test_f1: 0.6642
 epoch: 41, train_loss: 0.4459, test_loss: 1.5442, test_f1: 0.5764
 epoch: 42, train_loss: 0.4643, test_loss: 1.2122, test_f1: 0.6604
 epoch: 43, train_loss: 0.4545, test_loss: 1.2036, test_f1: 0.6471
 epoch: 44, train_loss: 0.4256, test_loss: 1.3212, test_f1: 0.6364
 epoch: 45, train_loss: 0.4334, test_loss: 1.4414, test_f1: 0.6158
 epoch: 46, train_loss: 0.4331, test_loss: 1.2793, test_f1: 0.6297
 epoch: 47, train_loss: 0.4157, test_loss: 1.3051, test_f1: 0.6366
 epoch: 48, train_loss: 0.4072, test_loss: 1.4415, test_f1: 0.6327
 epoch: 49, train_loss: 0.3891, test_loss: 1.5016, test_f1: 0.6110
 epoch: 50, train_loss: 0.3769, test_loss: 1.5245, test_f1: 0.6251
 epoch: 51, train_loss: 0.3408, test_loss: 1.4509, test_f1: 0.6573
 epoch: 52, train_loss: 0.3027, test_loss: 1.5878, test_f1: 0.6371
 epoch: 53, train_loss: 0.2752, test_loss: 1.7008, test_f1: 0.6382
 epoch: 54, train_loss: 0.2768, test_loss: 1.7967, test_f1: 0.6348
 epoch: 55, train_loss: 0.2947, test_loss: 1.7612, test_f1: 0.6433
 epoch: 56, train_loss: 0.2664, test_loss: 1.8739, test_f1: 0.6381
 epoch: 57, train_loss: 0.2572, test_loss: 1.7622, test_f1: 0.6369
 epoch: 58, train_loss: 0.2411, test_loss: 1.9774, test_f1: 0.6353
 epoch: 59, train_loss: 0.2271, test_loss: 1.9697, test_f1: 0.6366
 epoch: 60, train_loss: 0.2403, test_loss: 2.0249, test_f1: 0.6224
 epoch: 61, train_loss: 0.2665, test_loss: 2.1996, test_f1: 0.6339
 epoch: 62, train_loss: 0.2443, test_loss: 2.0163, test_f1: 0.6241
 epoch: 63, train_loss: 0.2373, test_loss: 2.1242, test_f1: 0.6203
 epoch: 64, train_loss: 0.2360, test_loss: 2.0534, test_f1: 0.6281
 epoch: 65, train_loss: 0.2473, test_loss: 1.9517, test_f1: 0.6372
 epoch: 66, train_loss: 0.2235, test_loss: 2.0834, test_f1: 0.6445
 epoch: 67, train_loss: 0.2139, test_loss: 2.2505, test_f1: 0.6300
 epoch: 68, train_loss: 0.2106, test_loss: 2.1087, test_f1: 0.6381
 epoch: 69, train_loss: 0.2051, test_loss: 2.3203, test_f1: 0.6204
 epoch: 70, train_loss: 0.2135, test_loss: 2.2116, test_f1: 0.6316
 epoch: 71, train_loss: 0.2056, test_loss: 2.2450, test_f1: 0.6342
 epoch: 72, train_loss: 0.2086, test_loss: 2.3848, test_f1: 0.6217
 epoch: 73, train_loss: 0.2032, test_loss: 2.4629, test_f1: 0.6281
 epoch: 74, train_loss: 0.2371, test_loss: 2.4915, test_f1: 0.6184
 epoch: 75, train_loss: 0.2141, test_loss: 2.5151, test_f1: 0.6112
 epoch: 76, train_loss: 0.1960, test_loss: 2.4293, test_f1: 0.6217
 epoch: 77, train_loss: 0.2124, test_loss: 2.3897, test_f1: 0.6369
 epoch: 78, train_loss: 0.1988, test_loss: 2.3644, test_f1: 0.6322
 epoch: 79, train_loss: 0.1934, test_loss: 2.6072, test_f1: 0.6229
 epoch: 80, train_loss: 0.1824, test_loss: 2.6159, test_f1: 0.6082
 epoch: 81, train_loss: 0.1767, test_loss: 2.4674, test_f1: 0.6335
 epoch: 82, train_loss: 0.1935, test_loss: 2.4898, test_f1: 0.6211
 epoch: 83, train_loss: 0.1855, test_loss: 2.5584, test_f1: 0.6170
 epoch: 84, train_loss: 0.1772, test_loss: 2.5010, test_f1: 0.6176
 epoch: 85, train_loss: 0.1741, test_loss: 2.6582, test_f1: 0.6290
 epoch: 86, train_loss: 0.1810, test_loss: 2.4512, test_f1: 0.6229
 epoch: 87, train_loss: 0.1829, test_loss: 2.4553, test_f1: 0.6300
 epoch: 88, train_loss: 0.1754, test_loss: 2.5962, test_f1: 0.6162
 epoch: 89, train_loss: 0.1653, test_loss: 2.7351, test_f1: 0.6214
 epoch: 90, train_loss: 0.1757, test_loss: 2.5416, test_f1: 0.6274
 epoch: 91, train_loss: 0.1802, test_loss: 2.5572, test_f1: 0.6565
 epoch: 92, train_loss: 0.1758, test_loss: 2.5119, test_f1: 0.6395
 epoch: 93, train_loss: 0.1718, test_loss: 2.6385, test_f1: 0.5994
 epoch: 94, train_loss: 0.1666, test_loss: 2.7552, test_f1: 0.6265
 epoch: 95, train_loss: 0.1683, test_loss: 2.6014, test_f1: 0.6356
 epoch: 96, train_loss: 0.1493, test_loss: 2.5972, test_f1: 0.6472
 epoch: 97, train_loss: 0.1600, test_loss: 2.6003, test_f1: 0.6316
 epoch: 98, train_loss: 0.1666, test_loss: 2.9101, test_f1: 0.6106
 epoch: 99, train_loss: 0.1795, test_loss: 2.7276, test_f1: 0.6103
##################ITERATION #1 ****************************************
 epoch: 0, train_loss: 1.1294, test_loss: 1.2887, test_f1: 0.2894
 epoch: 1, train_loss: 0.9915, test_loss: 0.9706, test_f1: 0.4928
 epoch: 2, train_loss: 0.9436, test_loss: 1.0129, test_f1: 0.4614
 epoch: 3, train_loss: 0.9118, test_loss: 0.9418, test_f1: 0.5491
 epoch: 4, train_loss: 0.8768, test_loss: 0.9151, test_f1: 0.5725
 epoch: 5, train_loss: 0.8619, test_loss: 0.9231, test_f1: 0.5766
 epoch: 6, train_loss: 0.8395, test_loss: 0.9311, test_f1: 0.5654
 epoch: 7, train_loss: 0.8210, test_loss: 0.9443, test_f1: 0.5895
 epoch: 8, train_loss: 0.7840, test_loss: 0.9659, test_f1: 0.5703
 epoch: 9, train_loss: 0.7830, test_loss: 0.9357, test_f1: 0.5269
 epoch: 10, train_loss: 0.7792, test_loss: 0.9585, test_f1: 0.5526
 epoch: 11, train_loss: 0.7535, test_loss: 0.9278, test_f1: 0.5530
 epoch: 12, train_loss: 0.7483, test_loss: 0.9952, test_f1: 0.5804
 epoch: 13, train_loss: 0.7519, test_loss: 0.8927, test_f1: 0.6097
 epoch: 14, train_loss: 0.7424, test_loss: 0.9942, test_f1: 0.5808
 epoch: 15, train_loss: 0.7244, test_loss: 0.9636, test_f1: 0.6054
 epoch: 16, train_loss: 0.7056, test_loss: 0.9438, test_f1: 0.6031
 epoch: 17, train_loss: 0.6941, test_loss: 0.9244, test_f1: 0.5939
 epoch: 18, train_loss: 0.6810, test_loss: 1.0327, test_f1: 0.5907
 epoch: 19, train_loss: 0.6747, test_loss: 0.9928, test_f1: 0.5555
 epoch: 20, train_loss: 0.6649, test_loss: 1.0623, test_f1: 0.5646
 epoch: 21, train_loss: 0.6577, test_loss: 0.9405, test_f1: 0.6224
 epoch: 22, train_loss: 0.6309, test_loss: 0.9641, test_f1: 0.6281
 epoch: 23, train_loss: 0.6297, test_loss: 1.0315, test_f1: 0.5978
 epoch: 24, train_loss: 0.6224, test_loss: 0.9852, test_f1: 0.6415
 epoch: 25, train_loss: 0.5956, test_loss: 1.1822, test_f1: 0.5735
 epoch: 26, train_loss: 0.6135, test_loss: 1.0586, test_f1: 0.6173
 epoch: 27, train_loss: 0.5990, test_loss: 1.0040, test_f1: 0.6280
 epoch: 28, train_loss: 0.6011, test_loss: 1.0235, test_f1: 0.6163
 epoch: 29, train_loss: 0.5703, test_loss: 0.9762, test_f1: 0.6032
 epoch: 30, train_loss: 0.5386, test_loss: 1.1785, test_f1: 0.6362
 epoch: 31, train_loss: 0.5586, test_loss: 1.0680, test_f1: 0.6258
 epoch: 32, train_loss: 0.5187, test_loss: 1.0889, test_f1: 0.6129
 epoch: 33, train_loss: 0.5101, test_loss: 1.1127, test_f1: 0.6334
 epoch: 34, train_loss: 0.5402, test_loss: 0.9856, test_f1: 0.6466
 epoch: 35, train_loss: 0.5171, test_loss: 1.1898, test_f1: 0.5920
 epoch: 36, train_loss: 0.4971, test_loss: 1.1742, test_f1: 0.6534
 epoch: 37, train_loss: 0.4589, test_loss: 1.2498, test_f1: 0.6062
 epoch: 38, train_loss: 0.4670, test_loss: 1.2544, test_f1: 0.6171
 epoch: 39, train_loss: 0.4614, test_loss: 1.2032, test_f1: 0.6455
 epoch: 40, train_loss: 0.4569, test_loss: 1.3096, test_f1: 0.6290
 epoch: 41, train_loss: 0.4727, test_loss: 1.2191, test_f1: 0.6113
 epoch: 42, train_loss: 0.4499, test_loss: 1.3003, test_f1: 0.6274
 epoch: 43, train_loss: 0.4513, test_loss: 1.2447, test_f1: 0.6272
 epoch: 44, train_loss: 0.4258, test_loss: 1.3512, test_f1: 0.6305
 epoch: 45, train_loss: 0.4117, test_loss: 1.2322, test_f1: 0.6336
 epoch: 46, train_loss: 0.4026, test_loss: 1.2331, test_f1: 0.6565
 epoch: 47, train_loss: 0.4098, test_loss: 1.3174, test_f1: 0.6496
 epoch: 48, train_loss: 0.4116, test_loss: 1.3960, test_f1: 0.6218
 epoch: 49, train_loss: 0.3936, test_loss: 1.4269, test_f1: 0.6220
 epoch: 50, train_loss: 0.4253, test_loss: 1.2599, test_f1: 0.6479
 epoch: 51, train_loss: 0.3661, test_loss: 1.2631, test_f1: 0.6604
 epoch: 52, train_loss: 0.3240, test_loss: 1.2471, test_f1: 0.6886
 epoch: 53, train_loss: 0.2912, test_loss: 1.4676, test_f1: 0.6646
 epoch: 54, train_loss: 0.2865, test_loss: 1.5928, test_f1: 0.6566
 epoch: 55, train_loss: 0.2740, test_loss: 1.5852, test_f1: 0.6495
 epoch: 56, train_loss: 0.2859, test_loss: 1.7241, test_f1: 0.6308
 epoch: 57, train_loss: 0.2649, test_loss: 1.6457, test_f1: 0.6381
 epoch: 58, train_loss: 0.2730, test_loss: 1.6458, test_f1: 0.6611
 epoch: 59, train_loss: 0.2461, test_loss: 1.6617, test_f1: 0.6749
 epoch: 60, train_loss: 0.2584, test_loss: 1.5499, test_f1: 0.6688
 epoch: 61, train_loss: 0.2406, test_loss: 1.8161, test_f1: 0.6316
 epoch: 62, train_loss: 0.2470, test_loss: 1.7727, test_f1: 0.6328
 epoch: 63, train_loss: 0.2458, test_loss: 1.7641, test_f1: 0.6209
 epoch: 64, train_loss: 0.2421, test_loss: 1.8913, test_f1: 0.6325
 epoch: 65, train_loss: 0.2505, test_loss: 1.7423, test_f1: 0.6361
 epoch: 66, train_loss: 0.2425, test_loss: 1.7429, test_f1: 0.6295
 epoch: 67, train_loss: 0.2242, test_loss: 1.9402, test_f1: 0.6418
 epoch: 68, train_loss: 0.2202, test_loss: 1.9767, test_f1: 0.6569
 epoch: 69, train_loss: 0.2075, test_loss: 1.8192, test_f1: 0.6420
 epoch: 70, train_loss: 0.1944, test_loss: 1.9759, test_f1: 0.6455
 epoch: 71, train_loss: 0.2017, test_loss: 1.8950, test_f1: 0.6574
 epoch: 72, train_loss: 0.2204, test_loss: 1.9954, test_f1: 0.6545
 epoch: 73, train_loss: 0.2099, test_loss: 2.0723, test_f1: 0.6395
 epoch: 74, train_loss: 0.2091, test_loss: 2.0473, test_f1: 0.6652
 epoch: 75, train_loss: 0.2360, test_loss: 1.9471, test_f1: 0.6639
 epoch: 76, train_loss: 0.2211, test_loss: 2.0209, test_f1: 0.6455
 epoch: 77, train_loss: 0.2144, test_loss: 2.1546, test_f1: 0.6290
 epoch: 78, train_loss: 0.1882, test_loss: 1.9807, test_f1: 0.6570
 epoch: 79, train_loss: 0.2153, test_loss: 1.9501, test_f1: 0.6449
 epoch: 80, train_loss: 0.2020, test_loss: 2.0771, test_f1: 0.6411
 epoch: 81, train_loss: 0.1997, test_loss: 1.9703, test_f1: 0.6269
 epoch: 82, train_loss: 0.2064, test_loss: 2.0483, test_f1: 0.6420
 epoch: 83, train_loss: 0.1956, test_loss: 2.0850, test_f1: 0.6511
 epoch: 84, train_loss: 0.1888, test_loss: 2.1039, test_f1: 0.6775
 epoch: 85, train_loss: 0.1882, test_loss: 2.0768, test_f1: 0.6578
 epoch: 86, train_loss: 0.1809, test_loss: 2.2624, test_f1: 0.6382
 epoch: 87, train_loss: 0.1766, test_loss: 2.3168, test_f1: 0.6447
 epoch: 88, train_loss: 0.1761, test_loss: 2.2090, test_f1: 0.6693
 epoch: 89, train_loss: 0.1611, test_loss: 2.2397, test_f1: 0.6446
 epoch: 90, train_loss: 0.1708, test_loss: 1.9840, test_f1: 0.6597
 epoch: 91, train_loss: 0.1691, test_loss: 2.0183, test_f1: 0.6839
 epoch: 92, train_loss: 0.1652, test_loss: 2.1792, test_f1: 0.6749
 epoch: 93, train_loss: 0.1611, test_loss: 2.4283, test_f1: 0.6586
 epoch: 94, train_loss: 0.1858, test_loss: 2.2087, test_f1: 0.6432
 epoch: 95, train_loss: 0.1689, test_loss: 2.3655, test_f1: 0.6509
 epoch: 96, train_loss: 0.1623, test_loss: 2.5547, test_f1: 0.6352
 epoch: 97, train_loss: 0.1474, test_loss: 2.4045, test_f1: 0.6392
 epoch: 98, train_loss: 0.1464, test_loss: 2.3058, test_f1: 0.6426
 epoch: 99, train_loss: 0.1547, test_loss: 2.6921, test_f1: 0.6184
##################ITERATION #2 ****************************************
 epoch: 0, train_loss: 1.1685, test_loss: 1.1578, test_f1: 0.3171
 epoch: 1, train_loss: 0.9843, test_loss: 0.9882, test_f1: 0.4265
 epoch: 2, train_loss: 0.9278, test_loss: 1.0020, test_f1: 0.5032
 epoch: 3, train_loss: 0.8950, test_loss: 0.9347, test_f1: 0.4876
 epoch: 4, train_loss: 0.8849, test_loss: 0.9819, test_f1: 0.5193
 epoch: 5, train_loss: 0.8510, test_loss: 0.9699, test_f1: 0.5813
 epoch: 6, train_loss: 0.8307, test_loss: 0.9557, test_f1: 0.5664
 epoch: 7, train_loss: 0.8226, test_loss: 0.9483, test_f1: 0.5375
 epoch: 8, train_loss: 0.8140, test_loss: 0.9416, test_f1: 0.5680
 epoch: 9, train_loss: 0.8046, test_loss: 0.9570, test_f1: 0.5830
 epoch: 10, train_loss: 0.7936, test_loss: 0.9288, test_f1: 0.5981
 epoch: 11, train_loss: 0.7724, test_loss: 0.9470, test_f1: 0.5768
 epoch: 12, train_loss: 0.7611, test_loss: 0.9333, test_f1: 0.5765
 epoch: 13, train_loss: 0.7326, test_loss: 0.9513, test_f1: 0.5746
 epoch: 14, train_loss: 0.7471, test_loss: 0.9347, test_f1: 0.5762
 epoch: 15, train_loss: 0.7443, test_loss: 0.9554, test_f1: 0.5899
 epoch: 16, train_loss: 0.7233, test_loss: 0.9836, test_f1: 0.5700
 epoch: 17, train_loss: 0.7196, test_loss: 0.9015, test_f1: 0.5673
 epoch: 18, train_loss: 0.7092, test_loss: 0.9484, test_f1: 0.5698
 epoch: 19, train_loss: 0.6960, test_loss: 1.0174, test_f1: 0.5583
 epoch: 20, train_loss: 0.6924, test_loss: 0.9991, test_f1: 0.5992
 epoch: 21, train_loss: 0.6811, test_loss: 0.9323, test_f1: 0.6006
 epoch: 22, train_loss: 0.6807, test_loss: 0.9747, test_f1: 0.5842
 epoch: 23, train_loss: 0.6703, test_loss: 0.9963, test_f1: 0.6084
 epoch: 24, train_loss: 0.6369, test_loss: 1.0649, test_f1: 0.5922
 epoch: 25, train_loss: 0.6482, test_loss: 0.9699, test_f1: 0.6408
 epoch: 26, train_loss: 0.6506, test_loss: 1.1289, test_f1: 0.5869
 epoch: 27, train_loss: 0.6268, test_loss: 0.9384, test_f1: 0.6273
 epoch: 28, train_loss: 0.6244, test_loss: 0.9385, test_f1: 0.6321
 epoch: 29, train_loss: 0.6135, test_loss: 1.0324, test_f1: 0.6141
 epoch: 30, train_loss: 0.5863, test_loss: 1.0025, test_f1: 0.6260
 epoch: 31, train_loss: 0.5977, test_loss: 0.9955, test_f1: 0.6239
 epoch: 32, train_loss: 0.5921, test_loss: 1.1311, test_f1: 0.5722
 epoch: 33, train_loss: 0.5597, test_loss: 1.0976, test_f1: 0.6414
 epoch: 34, train_loss: 0.5765, test_loss: 1.0588, test_f1: 0.6334
 epoch: 35, train_loss: 0.5716, test_loss: 0.9907, test_f1: 0.6439
 epoch: 36, train_loss: 0.5640, test_loss: 1.0735, test_f1: 0.6369
 epoch: 37, train_loss: 0.5426, test_loss: 0.9786, test_f1: 0.6548
 epoch: 38, train_loss: 0.5481, test_loss: 1.1083, test_f1: 0.6439
 epoch: 39, train_loss: 0.5229, test_loss: 1.1240, test_f1: 0.6388
 epoch: 40, train_loss: 0.5161, test_loss: 1.1156, test_f1: 0.6419
 epoch: 41, train_loss: 0.4943, test_loss: 1.0959, test_f1: 0.6406
 epoch: 42, train_loss: 0.4662, test_loss: 1.2279, test_f1: 0.6413
 epoch: 43, train_loss: 0.4927, test_loss: 0.9938, test_f1: 0.6339
 epoch: 44, train_loss: 0.5045, test_loss: 1.1090, test_f1: 0.6142
 epoch: 45, train_loss: 0.5038, test_loss: 1.2065, test_f1: 0.6135
 epoch: 46, train_loss: 0.4822, test_loss: 1.3530, test_f1: 0.6193
 epoch: 47, train_loss: 0.4775, test_loss: 1.0907, test_f1: 0.6619
 epoch: 48, train_loss: 0.4781, test_loss: 1.3618, test_f1: 0.5969
 epoch: 49, train_loss: 0.4558, test_loss: 1.2130, test_f1: 0.6355
 epoch: 50, train_loss: 0.4299, test_loss: 1.1738, test_f1: 0.6524
 epoch: 51, train_loss: 0.3990, test_loss: 1.1653, test_f1: 0.6603
 epoch: 52, train_loss: 0.3630, test_loss: 1.1904, test_f1: 0.6796
 epoch: 53, train_loss: 0.3469, test_loss: 1.1982, test_f1: 0.6854
 epoch: 54, train_loss: 0.3422, test_loss: 1.2778, test_f1: 0.6590
 epoch: 55, train_loss: 0.3253, test_loss: 1.2235, test_f1: 0.7018
 epoch: 56, train_loss: 0.3201, test_loss: 1.2861, test_f1: 0.6650
 epoch: 57, train_loss: 0.3011, test_loss: 1.3627, test_f1: 0.6843
 epoch: 58, train_loss: 0.3159, test_loss: 1.2515, test_f1: 0.6890
 epoch: 59, train_loss: 0.3027, test_loss: 1.3690, test_f1: 0.6836
 epoch: 60, train_loss: 0.2952, test_loss: 1.2831, test_f1: 0.6707
 epoch: 61, train_loss: 0.2853, test_loss: 1.4786, test_f1: 0.6488
 epoch: 62, train_loss: 0.2896, test_loss: 1.4142, test_f1: 0.6723
 epoch: 63, train_loss: 0.2981, test_loss: 1.4304, test_f1: 0.6855
 epoch: 64, train_loss: 0.2967, test_loss: 1.3881, test_f1: 0.6498
 epoch: 65, train_loss: 0.2935, test_loss: 1.4405, test_f1: 0.6837
 epoch: 66, train_loss: 0.2868, test_loss: 1.6313, test_f1: 0.6243
 epoch: 67, train_loss: 0.2862, test_loss: 1.4821, test_f1: 0.6534
 epoch: 68, train_loss: 0.2812, test_loss: 1.5115, test_f1: 0.6640
 epoch: 69, train_loss: 0.2666, test_loss: 1.5808, test_f1: 0.6819
 epoch: 70, train_loss: 0.2575, test_loss: 1.5451, test_f1: 0.6569
 epoch: 71, train_loss: 0.2620, test_loss: 1.6790, test_f1: 0.6545
 epoch: 72, train_loss: 0.2511, test_loss: 1.5240, test_f1: 0.6645
 epoch: 73, train_loss: 0.2740, test_loss: 1.5067, test_f1: 0.6736
 epoch: 74, train_loss: 0.2434, test_loss: 1.6772, test_f1: 0.6687
 epoch: 75, train_loss: 0.2561, test_loss: 1.5171, test_f1: 0.6729
 epoch: 76, train_loss: 0.2501, test_loss: 1.4659, test_f1: 0.6799
 epoch: 77, train_loss: 0.2199, test_loss: 1.6648, test_f1: 0.6816
 epoch: 78, train_loss: 0.2153, test_loss: 1.6486, test_f1: 0.6720
 epoch: 79, train_loss: 0.2233, test_loss: 1.7143, test_f1: 0.6552
 epoch: 80, train_loss: 0.2352, test_loss: 1.7471, test_f1: 0.6545
 epoch: 81, train_loss: 0.2345, test_loss: 1.6556, test_f1: 0.6660
 epoch: 82, train_loss: 0.2149, test_loss: 1.9629, test_f1: 0.6485
 epoch: 83, train_loss: 0.2137, test_loss: 1.8604, test_f1: 0.6578
 epoch: 84, train_loss: 0.2349, test_loss: 1.7905, test_f1: 0.6556
 epoch: 85, train_loss: 0.2132, test_loss: 1.8433, test_f1: 0.6533
 epoch: 86, train_loss: 0.2116, test_loss: 1.8985, test_f1: 0.6466
 epoch: 87, train_loss: 0.2101, test_loss: 1.8732, test_f1: 0.6614
 epoch: 88, train_loss: 0.2009, test_loss: 1.7668, test_f1: 0.6726
 epoch: 89, train_loss: 0.2100, test_loss: 1.8603, test_f1: 0.6490
 epoch: 90, train_loss: 0.2084, test_loss: 1.6984, test_f1: 0.6714
 epoch: 91, train_loss: 0.1927, test_loss: 1.7747, test_f1: 0.6550
 epoch: 92, train_loss: 0.1885, test_loss: 2.0431, test_f1: 0.6622
 epoch: 93, train_loss: 0.1934, test_loss: 1.8647, test_f1: 0.6690
 epoch: 94, train_loss: 0.1921, test_loss: 1.9566, test_f1: 0.6713
 epoch: 95, train_loss: 0.1750, test_loss: 1.8963, test_f1: 0.6578
 epoch: 96, train_loss: 0.1634, test_loss: 2.0872, test_f1: 0.6500
 epoch: 97, train_loss: 0.1829, test_loss: 2.0585, test_f1: 0.6691
 epoch: 98, train_loss: 0.1971, test_loss: 1.9507, test_f1: 0.6817
 epoch: 99, train_loss: 0.1854, test_loss: 1.9870, test_f1: 0.6583
##################ITERATION #3 ****************************************
 epoch: 0, train_loss: 1.2173, test_loss: 1.1463, test_f1: 0.3287
 epoch: 1, train_loss: 1.0078, test_loss: 1.0027, test_f1: 0.4511
 epoch: 2, train_loss: 0.9481, test_loss: 0.9388, test_f1: 0.5307
 epoch: 3, train_loss: 0.9177, test_loss: 0.9329, test_f1: 0.5592
 epoch: 4, train_loss: 0.8945, test_loss: 0.9221, test_f1: 0.4982
 epoch: 5, train_loss: 0.8711, test_loss: 0.9472, test_f1: 0.5252
 epoch: 6, train_loss: 0.8629, test_loss: 0.9082, test_f1: 0.5276
 epoch: 7, train_loss: 0.8393, test_loss: 0.9108, test_f1: 0.5604
 epoch: 8, train_loss: 0.8427, test_loss: 0.9284, test_f1: 0.5189
 epoch: 9, train_loss: 0.8089, test_loss: 0.9181, test_f1: 0.5199
 epoch: 10, train_loss: 0.7902, test_loss: 0.9581, test_f1: 0.5528
 epoch: 11, train_loss: 0.7816, test_loss: 0.9546, test_f1: 0.5300
 epoch: 12, train_loss: 0.7666, test_loss: 0.9809, test_f1: 0.5795
 epoch: 13, train_loss: 0.7668, test_loss: 0.9692, test_f1: 0.5576
 epoch: 14, train_loss: 0.7454, test_loss: 0.9898, test_f1: 0.5629
 epoch: 15, train_loss: 0.7411, test_loss: 0.9558, test_f1: 0.5482
 epoch: 16, train_loss: 0.7440, test_loss: 0.9347, test_f1: 0.5559
 epoch: 17, train_loss: 0.7384, test_loss: 0.9695, test_f1: 0.5968
 epoch: 18, train_loss: 0.7185, test_loss: 0.9596, test_f1: 0.5900
 epoch: 19, train_loss: 0.7039, test_loss: 0.9868, test_f1: 0.6033
 epoch: 20, train_loss: 0.7004, test_loss: 1.1440, test_f1: 0.5309
 epoch: 21, train_loss: 0.6849, test_loss: 1.0006, test_f1: 0.5785
 epoch: 22, train_loss: 0.6715, test_loss: 1.0798, test_f1: 0.5944
 epoch: 23, train_loss: 0.6735, test_loss: 0.9970, test_f1: 0.6170
 epoch: 24, train_loss: 0.6533, test_loss: 0.9020, test_f1: 0.6437
 epoch: 25, train_loss: 0.6722, test_loss: 0.9002, test_f1: 0.6391
 epoch: 26, train_loss: 0.6548, test_loss: 0.9877, test_f1: 0.6177
 epoch: 27, train_loss: 0.6452, test_loss: 0.9992, test_f1: 0.5988
 epoch: 28, train_loss: 0.6111, test_loss: 1.0623, test_f1: 0.5984
 epoch: 29, train_loss: 0.6051, test_loss: 1.1364, test_f1: 0.5848
 epoch: 30, train_loss: 0.6082, test_loss: 1.0164, test_f1: 0.6073
 epoch: 31, train_loss: 0.6184, test_loss: 1.0606, test_f1: 0.6102
 epoch: 32, train_loss: 0.5966, test_loss: 1.0775, test_f1: 0.6293
 epoch: 33, train_loss: 0.5629, test_loss: 1.4349, test_f1: 0.5559
 epoch: 34, train_loss: 0.5579, test_loss: 1.1140, test_f1: 0.6061
 epoch: 35, train_loss: 0.5808, test_loss: 1.2125, test_f1: 0.6175
 epoch: 36, train_loss: 0.5760, test_loss: 1.0321, test_f1: 0.6198
 epoch: 37, train_loss: 0.5651, test_loss: 1.1278, test_f1: 0.6333
 epoch: 38, train_loss: 0.5352, test_loss: 1.1227, test_f1: 0.6242
 epoch: 39, train_loss: 0.5386, test_loss: 1.1049, test_f1: 0.6081
 epoch: 40, train_loss: 0.5253, test_loss: 1.1560, test_f1: 0.6176
 epoch: 41, train_loss: 0.5107, test_loss: 1.0979, test_f1: 0.6274
 epoch: 42, train_loss: 0.5179, test_loss: 1.1734, test_f1: 0.6035
 epoch: 43, train_loss: 0.5201, test_loss: 1.2036, test_f1: 0.6089
 epoch: 44, train_loss: 0.4834, test_loss: 1.0743, test_f1: 0.6389
 epoch: 45, train_loss: 0.4537, test_loss: 1.1721, test_f1: 0.6365
 epoch: 46, train_loss: 0.4742, test_loss: 1.1858, test_f1: 0.6420
 epoch: 47, train_loss: 0.4604, test_loss: 1.1929, test_f1: 0.5966
 epoch: 48, train_loss: 0.4486, test_loss: 1.4141, test_f1: 0.6013
 epoch: 49, train_loss: 0.4608, test_loss: 1.2720, test_f1: 0.6116
 epoch: 50, train_loss: 0.4569, test_loss: 1.1738, test_f1: 0.6618
 epoch: 51, train_loss: 0.3987, test_loss: 1.2196, test_f1: 0.6536
 epoch: 52, train_loss: 0.3814, test_loss: 1.2395, test_f1: 0.6311
 epoch: 53, train_loss: 0.3358, test_loss: 1.3553, test_f1: 0.6336
 epoch: 54, train_loss: 0.3397, test_loss: 1.4135, test_f1: 0.6574
 epoch: 55, train_loss: 0.3386, test_loss: 1.4779, test_f1: 0.6371
 epoch: 56, train_loss: 0.3344, test_loss: 1.4899, test_f1: 0.6373
 epoch: 57, train_loss: 0.3197, test_loss: 1.3610, test_f1: 0.6320
 epoch: 58, train_loss: 0.3163, test_loss: 1.4636, test_f1: 0.6246
 epoch: 59, train_loss: 0.3133, test_loss: 1.4752, test_f1: 0.6210
 epoch: 60, train_loss: 0.3115, test_loss: 1.5842, test_f1: 0.6329
 epoch: 61, train_loss: 0.2973, test_loss: 1.4548, test_f1: 0.6479
 epoch: 62, train_loss: 0.3086, test_loss: 1.5322, test_f1: 0.6025
 epoch: 63, train_loss: 0.3027, test_loss: 1.3693, test_f1: 0.6570
 epoch: 64, train_loss: 0.2861, test_loss: 1.8600, test_f1: 0.6183
 epoch: 65, train_loss: 0.2897, test_loss: 1.6503, test_f1: 0.6509
 epoch: 66, train_loss: 0.2796, test_loss: 1.5587, test_f1: 0.6268
 epoch: 67, train_loss: 0.2634, test_loss: 1.6233, test_f1: 0.6485
 epoch: 68, train_loss: 0.2649, test_loss: 1.7395, test_f1: 0.6391
 epoch: 69, train_loss: 0.2648, test_loss: 1.5831, test_f1: 0.6362
 epoch: 70, train_loss: 0.2875, test_loss: 1.7514, test_f1: 0.6333
 epoch: 71, train_loss: 0.2586, test_loss: 1.7095, test_f1: 0.6391
 epoch: 72, train_loss: 0.2570, test_loss: 1.8278, test_f1: 0.6295
 epoch: 73, train_loss: 0.2527, test_loss: 1.5613, test_f1: 0.6307
 epoch: 74, train_loss: 0.2498, test_loss: 1.7475, test_f1: 0.6427
 epoch: 75, train_loss: 0.2455, test_loss: 1.6927, test_f1: 0.6276
 epoch: 76, train_loss: 0.2465, test_loss: 1.7689, test_f1: 0.6135
 epoch: 77, train_loss: 0.2538, test_loss: 1.8172, test_f1: 0.6166
 epoch: 78, train_loss: 0.2362, test_loss: 1.7218, test_f1: 0.6483
 epoch: 79, train_loss: 0.2258, test_loss: 1.8762, test_f1: 0.6320
 epoch: 80, train_loss: 0.2195, test_loss: 1.8244, test_f1: 0.6397
 epoch: 81, train_loss: 0.2286, test_loss: 2.0419, test_f1: 0.6163
 epoch: 82, train_loss: 0.2354, test_loss: 1.8198, test_f1: 0.6405
 epoch: 83, train_loss: 0.2177, test_loss: 2.0188, test_f1: 0.6461
 epoch: 84, train_loss: 0.2129, test_loss: 1.9547, test_f1: 0.6316
 epoch: 85, train_loss: 0.2129, test_loss: 1.9114, test_f1: 0.6648
 epoch: 86, train_loss: 0.2122, test_loss: 2.0352, test_f1: 0.6570
 epoch: 87, train_loss: 0.2106, test_loss: 1.9269, test_f1: 0.6304
 epoch: 88, train_loss: 0.2172, test_loss: 1.8813, test_f1: 0.6352
 epoch: 89, train_loss: 0.2050, test_loss: 1.9240, test_f1: 0.6519
 epoch: 90, train_loss: 0.2036, test_loss: 1.8614, test_f1: 0.6426
 epoch: 91, train_loss: 0.2034, test_loss: 1.9301, test_f1: 0.6398
 epoch: 92, train_loss: 0.2088, test_loss: 2.0212, test_f1: 0.6529
 epoch: 93, train_loss: 0.2124, test_loss: 2.0376, test_f1: 0.6529
 epoch: 94, train_loss: 0.2296, test_loss: 1.8998, test_f1: 0.6612
 epoch: 95, train_loss: 0.2134, test_loss: 1.9692, test_f1: 0.6497
 epoch: 96, train_loss: 0.2277, test_loss: 1.7217, test_f1: 0.6276
 epoch: 97, train_loss: 0.1932, test_loss: 1.9476, test_f1: 0.6503
 epoch: 98, train_loss: 0.1932, test_loss: 1.8658, test_f1: 0.6489
 epoch: 99, train_loss: 0.1830, test_loss: 1.9374, test_f1: 0.6179
##################ITERATION #4 ****************************************
 epoch: 0, train_loss: 1.2817, test_loss: 1.1301, test_f1: 0.3428
 epoch: 1, train_loss: 1.0381, test_loss: 1.0439, test_f1: 0.4122
 epoch: 2, train_loss: 0.9693, test_loss: 0.9582, test_f1: 0.4714
 epoch: 3, train_loss: 0.9336, test_loss: 0.9025, test_f1: 0.5171
 epoch: 4, train_loss: 0.9030, test_loss: 0.9444, test_f1: 0.5387
 epoch: 5, train_loss: 0.8751, test_loss: 0.9948, test_f1: 0.4990
 epoch: 6, train_loss: 0.8726, test_loss: 0.9497, test_f1: 0.5556
 epoch: 7, train_loss: 0.8566, test_loss: 0.9536, test_f1: 0.5354
 epoch: 8, train_loss: 0.8229, test_loss: 0.9948, test_f1: 0.5608
 epoch: 9, train_loss: 0.8024, test_loss: 0.9677, test_f1: 0.5551
 epoch: 10, train_loss: 0.8012, test_loss: 0.9498, test_f1: 0.5949
 epoch: 11, train_loss: 0.7862, test_loss: 0.9607, test_f1: 0.5641
 epoch: 12, train_loss: 0.8012, test_loss: 0.9000, test_f1: 0.5777
 epoch: 13, train_loss: 0.7845, test_loss: 0.9533, test_f1: 0.5606
 epoch: 14, train_loss: 0.7586, test_loss: 0.9484, test_f1: 0.5822
 epoch: 15, train_loss: 0.7539, test_loss: 0.9373, test_f1: 0.5712
 epoch: 16, train_loss: 0.7337, test_loss: 0.9627, test_f1: 0.5634
 epoch: 17, train_loss: 0.7326, test_loss: 0.9684, test_f1: 0.5854
 epoch: 18, train_loss: 0.7115, test_loss: 0.9436, test_f1: 0.5956
 epoch: 19, train_loss: 0.7024, test_loss: 1.0165, test_f1: 0.5737
 epoch: 20, train_loss: 0.6880, test_loss: 0.9448, test_f1: 0.6014
 epoch: 21, train_loss: 0.6981, test_loss: 0.9898, test_f1: 0.6070
 epoch: 22, train_loss: 0.6747, test_loss: 1.0147, test_f1: 0.6010
 epoch: 23, train_loss: 0.6663, test_loss: 0.9825, test_f1: 0.5829
 epoch: 24, train_loss: 0.6634, test_loss: 1.0224, test_f1: 0.6266
 epoch: 25, train_loss: 0.6780, test_loss: 0.9815, test_f1: 0.6203
 epoch: 26, train_loss: 0.6526, test_loss: 0.9865, test_f1: 0.5981
 epoch: 27, train_loss: 0.6454, test_loss: 0.9781, test_f1: 0.6139
 epoch: 28, train_loss: 0.6333, test_loss: 0.9694, test_f1: 0.6244
 epoch: 29, train_loss: 0.6078, test_loss: 1.1312, test_f1: 0.5840
 epoch: 30, train_loss: 0.6229, test_loss: 0.9574, test_f1: 0.6529
 epoch: 31, train_loss: 0.6194, test_loss: 0.9593, test_f1: 0.6049
 epoch: 32, train_loss: 0.6010, test_loss: 1.0359, test_f1: 0.6328
 epoch: 33, train_loss: 0.5936, test_loss: 1.0497, test_f1: 0.5885
 epoch: 34, train_loss: 0.5840, test_loss: 1.0189, test_f1: 0.6375
 epoch: 35, train_loss: 0.6011, test_loss: 1.0184, test_f1: 0.5829
 epoch: 36, train_loss: 0.5755, test_loss: 1.0410, test_f1: 0.6415
 epoch: 37, train_loss: 0.5626, test_loss: 1.0890, test_f1: 0.6244
 epoch: 38, train_loss: 0.5567, test_loss: 1.0223, test_f1: 0.6391
 epoch: 39, train_loss: 0.5580, test_loss: 1.1136, test_f1: 0.6043
 epoch: 40, train_loss: 0.5460, test_loss: 1.0415, test_f1: 0.6039
 epoch: 41, train_loss: 0.5307, test_loss: 1.1055, test_f1: 0.6466
 epoch: 42, train_loss: 0.5204, test_loss: 1.1734, test_f1: 0.6152
 epoch: 43, train_loss: 0.4956, test_loss: 1.0757, test_f1: 0.6022
 epoch: 44, train_loss: 0.5114, test_loss: 1.2299, test_f1: 0.6272
 epoch: 45, train_loss: 0.5099, test_loss: 1.1267, test_f1: 0.6133
 epoch: 46, train_loss: 0.5270, test_loss: 1.1648, test_f1: 0.6372
 epoch: 47, train_loss: 0.5022, test_loss: 1.1407, test_f1: 0.6533
 epoch: 48, train_loss: 0.4727, test_loss: 1.1857, test_f1: 0.6560
 epoch: 49, train_loss: 0.4682, test_loss: 1.1584, test_f1: 0.6376
 epoch: 50, train_loss: 0.4472, test_loss: 1.0840, test_f1: 0.6258
 epoch: 51, train_loss: 0.4279, test_loss: 1.2506, test_f1: 0.6369
 epoch: 52, train_loss: 0.3828, test_loss: 1.2525, test_f1: 0.6384
 epoch: 53, train_loss: 0.3638, test_loss: 1.2284, test_f1: 0.6527
 epoch: 54, train_loss: 0.3638, test_loss: 1.1972, test_f1: 0.6553
 epoch: 55, train_loss: 0.3636, test_loss: 1.3118, test_f1: 0.6332
 epoch: 56, train_loss: 0.3477, test_loss: 1.2697, test_f1: 0.6340
 epoch: 57, train_loss: 0.3321, test_loss: 1.2586, test_f1: 0.6501
 epoch: 58, train_loss: 0.3368, test_loss: 1.3238, test_f1: 0.6643
 epoch: 59, train_loss: 0.3309, test_loss: 1.3929, test_f1: 0.6356
 epoch: 60, train_loss: 0.3249, test_loss: 1.2856, test_f1: 0.6517
 epoch: 61, train_loss: 0.3087, test_loss: 1.4042, test_f1: 0.6453
 epoch: 62, train_loss: 0.3021, test_loss: 1.4324, test_f1: 0.6597
 epoch: 63, train_loss: 0.3148, test_loss: 1.4066, test_f1: 0.6708
 epoch: 64, train_loss: 0.3062, test_loss: 1.5043, test_f1: 0.6270
 epoch: 65, train_loss: 0.3001, test_loss: 1.5334, test_f1: 0.6479
 epoch: 66, train_loss: 0.2940, test_loss: 1.4608, test_f1: 0.6539
 epoch: 67, train_loss: 0.2923, test_loss: 1.4185, test_f1: 0.6517
 epoch: 68, train_loss: 0.2946, test_loss: 1.4981, test_f1: 0.6312
 epoch: 69, train_loss: 0.2802, test_loss: 1.5806, test_f1: 0.6368
 epoch: 70, train_loss: 0.2856, test_loss: 1.5855, test_f1: 0.6148
 epoch: 71, train_loss: 0.2837, test_loss: 1.3991, test_f1: 0.6754
 epoch: 72, train_loss: 0.2659, test_loss: 1.5729, test_f1: 0.6372
 epoch: 73, train_loss: 0.2815, test_loss: 1.7033, test_f1: 0.6340
 epoch: 74, train_loss: 0.2598, test_loss: 1.6322, test_f1: 0.6202
 epoch: 75, train_loss: 0.2633, test_loss: 1.5998, test_f1: 0.6236
 epoch: 76, train_loss: 0.2593, test_loss: 1.6757, test_f1: 0.6396
 epoch: 77, train_loss: 0.2553, test_loss: 1.6377, test_f1: 0.6584
 epoch: 78, train_loss: 0.2607, test_loss: 1.7468, test_f1: 0.6002
 epoch: 79, train_loss: 0.2498, test_loss: 1.6186, test_f1: 0.6156
 epoch: 80, train_loss: 0.2665, test_loss: 1.7073, test_f1: 0.6108
 epoch: 81, train_loss: 0.2592, test_loss: 1.6293, test_f1: 0.6265
 epoch: 82, train_loss: 0.2382, test_loss: 1.6058, test_f1: 0.6315
 epoch: 83, train_loss: 0.2466, test_loss: 1.6045, test_f1: 0.6417
 epoch: 84, train_loss: 0.2517, test_loss: 1.7165, test_f1: 0.6258
 epoch: 85, train_loss: 0.2196, test_loss: 1.8258, test_f1: 0.6265
 epoch: 86, train_loss: 0.2286, test_loss: 1.8210, test_f1: 0.6431
 epoch: 87, train_loss: 0.2253, test_loss: 1.7221, test_f1: 0.6259
 epoch: 88, train_loss: 0.2294, test_loss: 1.7943, test_f1: 0.6100
 epoch: 89, train_loss: 0.2089, test_loss: 1.7543, test_f1: 0.6271
 epoch: 90, train_loss: 0.2106, test_loss: 1.7635, test_f1: 0.6496
 epoch: 91, train_loss: 0.1951, test_loss: 1.9042, test_f1: 0.6197
 epoch: 92, train_loss: 0.2033, test_loss: 1.8775, test_f1: 0.6102
 epoch: 93, train_loss: 0.2051, test_loss: 1.9585, test_f1: 0.6420
 epoch: 94, train_loss: 0.2063, test_loss: 1.9219, test_f1: 0.6067
 epoch: 95, train_loss: 0.2322, test_loss: 1.8568, test_f1: 0.6240
 epoch: 96, train_loss: 0.2008, test_loss: 1.8669, test_f1: 0.6354
 epoch: 97, train_loss: 0.2147, test_loss: 1.6339, test_f1: 0.6451
 epoch: 98, train_loss: 0.2080, test_loss: 1.9590, test_f1: 0.6235
 epoch: 99, train_loss: 0.2028, test_loss: 2.0608, test_f1: 0.6412
##################ITERATION #5 ****************************************
 epoch: 0, train_loss: 1.3112, test_loss: 1.1943, test_f1: 0.2555
 epoch: 1, train_loss: 1.0176, test_loss: 1.0205, test_f1: 0.4671
 epoch: 2, train_loss: 0.9492, test_loss: 0.9249, test_f1: 0.5036
 epoch: 3, train_loss: 0.9079, test_loss: 0.9475, test_f1: 0.5520
 epoch: 4, train_loss: 0.8923, test_loss: 0.9141, test_f1: 0.5497
 epoch: 5, train_loss: 0.8721, test_loss: 0.9886, test_f1: 0.5040
 epoch: 6, train_loss: 0.8495, test_loss: 0.9608, test_f1: 0.5494
 epoch: 7, train_loss: 0.8363, test_loss: 0.9366, test_f1: 0.5443
 epoch: 8, train_loss: 0.8207, test_loss: 0.9528, test_f1: 0.5494
 epoch: 9, train_loss: 0.8065, test_loss: 0.9254, test_f1: 0.5712
 epoch: 10, train_loss: 0.8212, test_loss: 0.9565, test_f1: 0.5783
 epoch: 11, train_loss: 0.8038, test_loss: 0.9811, test_f1: 0.5742
 epoch: 12, train_loss: 0.7786, test_loss: 0.9779, test_f1: 0.5519
 epoch: 13, train_loss: 0.7689, test_loss: 0.9926, test_f1: 0.5779
 epoch: 14, train_loss: 0.7507, test_loss: 0.9832, test_f1: 0.5738
 epoch: 15, train_loss: 0.7386, test_loss: 0.9676, test_f1: 0.6206
 epoch: 16, train_loss: 0.7174, test_loss: 0.9928, test_f1: 0.5718
 epoch: 17, train_loss: 0.7166, test_loss: 1.0122, test_f1: 0.6060
 epoch: 18, train_loss: 0.7149, test_loss: 0.9614, test_f1: 0.6121
 epoch: 19, train_loss: 0.7102, test_loss: 1.0194, test_f1: 0.5695
 epoch: 20, train_loss: 0.7036, test_loss: 1.0718, test_f1: 0.5939
 epoch: 21, train_loss: 0.7039, test_loss: 0.9964, test_f1: 0.6132
 epoch: 22, train_loss: 0.6755, test_loss: 1.0160, test_f1: 0.6423
 epoch: 23, train_loss: 0.6801, test_loss: 0.9866, test_f1: 0.6156
 epoch: 24, train_loss: 0.6442, test_loss: 1.0129, test_f1: 0.6046
 epoch: 25, train_loss: 0.6641, test_loss: 1.0693, test_f1: 0.5999
 epoch: 26, train_loss: 0.6498, test_loss: 1.0204, test_f1: 0.6204
 epoch: 27, train_loss: 0.6264, test_loss: 1.0892, test_f1: 0.6158
 epoch: 28, train_loss: 0.6384, test_loss: 1.0322, test_f1: 0.5941
 epoch: 29, train_loss: 0.6238, test_loss: 1.0622, test_f1: 0.5776
 epoch: 30, train_loss: 0.6136, test_loss: 1.1014, test_f1: 0.6008
 epoch: 31, train_loss: 0.6203, test_loss: 1.0602, test_f1: 0.6017
 epoch: 32, train_loss: 0.5936, test_loss: 1.0745, test_f1: 0.6334
 epoch: 33, train_loss: 0.6028, test_loss: 1.0257, test_f1: 0.6000
 epoch: 34, train_loss: 0.5850, test_loss: 1.1746, test_f1: 0.6033
 epoch: 35, train_loss: 0.5907, test_loss: 1.0940, test_f1: 0.6003
 epoch: 36, train_loss: 0.5705, test_loss: 1.2183, test_f1: 0.5966
 epoch: 37, train_loss: 0.5784, test_loss: 1.1602, test_f1: 0.6151
 epoch: 38, train_loss: 0.5402, test_loss: 1.2167, test_f1: 0.6136
 epoch: 39, train_loss: 0.5597, test_loss: 1.3065, test_f1: 0.6065
 epoch: 40, train_loss: 0.5204, test_loss: 1.2557, test_f1: 0.6248
 epoch: 41, train_loss: 0.5525, test_loss: 1.1988, test_f1: 0.6260
 epoch: 42, train_loss: 0.5272, test_loss: 1.1747, test_f1: 0.6292
 epoch: 43, train_loss: 0.5193, test_loss: 1.1361, test_f1: 0.6173
 epoch: 44, train_loss: 0.5166, test_loss: 1.1137, test_f1: 0.6206
 epoch: 45, train_loss: 0.5167, test_loss: 1.2399, test_f1: 0.6071
 epoch: 46, train_loss: 0.4850, test_loss: 1.4602, test_f1: 0.5785
 epoch: 47, train_loss: 0.4886, test_loss: 1.1568, test_f1: 0.6482
 epoch: 48, train_loss: 0.4957, test_loss: 1.2368, test_f1: 0.6311
 epoch: 49, train_loss: 0.4724, test_loss: 1.2533, test_f1: 0.6167
 epoch: 50, train_loss: 0.4560, test_loss: 1.2180, test_f1: 0.6340
 epoch: 51, train_loss: 0.4147, test_loss: 1.2255, test_f1: 0.6451
 epoch: 52, train_loss: 0.3724, test_loss: 1.3463, test_f1: 0.6404
 epoch: 53, train_loss: 0.3586, test_loss: 1.2866, test_f1: 0.6382
 epoch: 54, train_loss: 0.3518, test_loss: 1.4574, test_f1: 0.6344
 epoch: 55, train_loss: 0.3529, test_loss: 1.4479, test_f1: 0.6344
 epoch: 56, train_loss: 0.3158, test_loss: 1.4362, test_f1: 0.6451
 epoch: 57, train_loss: 0.3515, test_loss: 1.5390, test_f1: 0.6476
 epoch: 58, train_loss: 0.3423, test_loss: 1.5377, test_f1: 0.6321
 epoch: 59, train_loss: 0.3407, test_loss: 1.4148, test_f1: 0.6323
 epoch: 60, train_loss: 0.3468, test_loss: 1.5579, test_f1: 0.6322
 epoch: 61, train_loss: 0.3080, test_loss: 1.5296, test_f1: 0.6485
 epoch: 62, train_loss: 0.3213, test_loss: 1.5571, test_f1: 0.6543
 epoch: 63, train_loss: 0.3229, test_loss: 1.5128, test_f1: 0.6310
 epoch: 64, train_loss: 0.3069, test_loss: 1.5163, test_f1: 0.6568
 epoch: 65, train_loss: 0.3184, test_loss: 1.4791, test_f1: 0.6353
 epoch: 66, train_loss: 0.3183, test_loss: 1.6535, test_f1: 0.6419
 epoch: 67, train_loss: 0.3018, test_loss: 1.6850, test_f1: 0.6264
 epoch: 68, train_loss: 0.2921, test_loss: 1.6776, test_f1: 0.6425
 epoch: 69, train_loss: 0.2964, test_loss: 1.7669, test_f1: 0.6182
 epoch: 70, train_loss: 0.2805, test_loss: 1.7912, test_f1: 0.6164
 epoch: 71, train_loss: 0.3025, test_loss: 1.6465, test_f1: 0.6345
 epoch: 72, train_loss: 0.2888, test_loss: 1.7255, test_f1: 0.6140
 epoch: 73, train_loss: 0.2794, test_loss: 1.7331, test_f1: 0.6436
 epoch: 74, train_loss: 0.2696, test_loss: 1.6925, test_f1: 0.6431
 epoch: 75, train_loss: 0.2630, test_loss: 1.6910, test_f1: 0.6237
 epoch: 76, train_loss: 0.2502, test_loss: 1.7894, test_f1: 0.6187
 epoch: 77, train_loss: 0.2533, test_loss: 1.8793, test_f1: 0.6361
 epoch: 78, train_loss: 0.2579, test_loss: 1.7475, test_f1: 0.6520
 epoch: 79, train_loss: 0.2537, test_loss: 1.8580, test_f1: 0.6124
 epoch: 80, train_loss: 0.2354, test_loss: 1.9616, test_f1: 0.6283
 epoch: 81, train_loss: 0.2373, test_loss: 2.2089, test_f1: 0.6028
 epoch: 82, train_loss: 0.2325, test_loss: 1.9549, test_f1: 0.6297
 epoch: 83, train_loss: 0.2358, test_loss: 1.9658, test_f1: 0.6474
 epoch: 84, train_loss: 0.2575, test_loss: 1.7617, test_f1: 0.6446
 epoch: 85, train_loss: 0.2248, test_loss: 1.9496, test_f1: 0.6349
 epoch: 86, train_loss: 0.2445, test_loss: 1.8957, test_f1: 0.6449
 epoch: 87, train_loss: 0.2378, test_loss: 1.9243, test_f1: 0.6492
 epoch: 88, train_loss: 0.2189, test_loss: 1.9971, test_f1: 0.6471
 epoch: 89, train_loss: 0.2369, test_loss: 1.9525, test_f1: 0.6440
 epoch: 90, train_loss: 0.2157, test_loss: 1.9809, test_f1: 0.6260
 epoch: 91, train_loss: 0.2015, test_loss: 2.0663, test_f1: 0.6339
 epoch: 92, train_loss: 0.2098, test_loss: 2.1401, test_f1: 0.6237
 epoch: 93, train_loss: 0.2178, test_loss: 1.9015, test_f1: 0.6561
 epoch: 94, train_loss: 0.2258, test_loss: 2.1298, test_f1: 0.6243
 epoch: 95, train_loss: 0.2325, test_loss: 1.9432, test_f1: 0.6594
 epoch: 96, train_loss: 0.2340, test_loss: 1.8834, test_f1: 0.6294
 epoch: 97, train_loss: 0.1937, test_loss: 2.0714, test_f1: 0.6231
 epoch: 98, train_loss: 0.2205, test_loss: 2.0713, test_f1: 0.6243
 epoch: 99, train_loss: 0.2210, test_loss: 1.9391, test_f1: 0.6570
##################ITERATION #6 ****************************************
 epoch: 0, train_loss: 1.3159, test_loss: 1.1764, test_f1: 0.2553
 epoch: 1, train_loss: 1.0271, test_loss: 0.9454, test_f1: 0.4512
 epoch: 2, train_loss: 0.9556, test_loss: 0.9429, test_f1: 0.4845
 epoch: 3, train_loss: 0.9296, test_loss: 0.9849, test_f1: 0.4542
 epoch: 4, train_loss: 0.8987, test_loss: 0.9115, test_f1: 0.5110
 epoch: 5, train_loss: 0.8974, test_loss: 0.9253, test_f1: 0.4875
 epoch: 6, train_loss: 0.8610, test_loss: 0.9443, test_f1: 0.5126
 epoch: 7, train_loss: 0.8618, test_loss: 0.9888, test_f1: 0.5041
 epoch: 8, train_loss: 0.8324, test_loss: 0.9441, test_f1: 0.4987
 epoch: 9, train_loss: 0.8164, test_loss: 0.9689, test_f1: 0.5201
 epoch: 10, train_loss: 0.8040, test_loss: 0.9799, test_f1: 0.5298
 epoch: 11, train_loss: 0.8117, test_loss: 0.9628, test_f1: 0.5121
 epoch: 12, train_loss: 0.7793, test_loss: 0.9768, test_f1: 0.5675
 epoch: 13, train_loss: 0.7723, test_loss: 0.9976, test_f1: 0.5542
 epoch: 14, train_loss: 0.7717, test_loss: 0.9649, test_f1: 0.5229
 epoch: 15, train_loss: 0.7671, test_loss: 0.9463, test_f1: 0.5356
 epoch: 16, train_loss: 0.7438, test_loss: 0.9786, test_f1: 0.5238
 epoch: 17, train_loss: 0.7286, test_loss: 0.9966, test_f1: 0.5469
 epoch: 18, train_loss: 0.7304, test_loss: 0.9722, test_f1: 0.5383
 epoch: 19, train_loss: 0.7259, test_loss: 0.9853, test_f1: 0.5701
 epoch: 20, train_loss: 0.7110, test_loss: 0.9649, test_f1: 0.5837
 epoch: 21, train_loss: 0.6903, test_loss: 0.9364, test_f1: 0.6159
 epoch: 22, train_loss: 0.6923, test_loss: 1.0171, test_f1: 0.5593
 epoch: 23, train_loss: 0.6810, test_loss: 1.0656, test_f1: 0.5953
 epoch: 24, train_loss: 0.6734, test_loss: 0.9859, test_f1: 0.5954
 epoch: 25, train_loss: 0.6673, test_loss: 1.0025, test_f1: 0.5790
 epoch: 26, train_loss: 0.6564, test_loss: 1.0156, test_f1: 0.5867
 epoch: 27, train_loss: 0.6556, test_loss: 0.9621, test_f1: 0.6330
 epoch: 28, train_loss: 0.6567, test_loss: 1.0742, test_f1: 0.5612
 epoch: 29, train_loss: 0.6345, test_loss: 0.9385, test_f1: 0.5773
 epoch: 30, train_loss: 0.6120, test_loss: 1.0878, test_f1: 0.5965
 epoch: 31, train_loss: 0.6074, test_loss: 0.9879, test_f1: 0.6045
 epoch: 32, train_loss: 0.6203, test_loss: 0.9859, test_f1: 0.6329
 epoch: 33, train_loss: 0.6031, test_loss: 1.0765, test_f1: 0.5843
 epoch: 34, train_loss: 0.6037, test_loss: 1.1242, test_f1: 0.5625
 epoch: 35, train_loss: 0.6021, test_loss: 1.0961, test_f1: 0.5738
 epoch: 36, train_loss: 0.5768, test_loss: 1.0545, test_f1: 0.6178
 epoch: 37, train_loss: 0.5583, test_loss: 0.9538, test_f1: 0.6436
 epoch: 38, train_loss: 0.5672, test_loss: 1.1582, test_f1: 0.6108
 epoch: 39, train_loss: 0.5596, test_loss: 1.2105, test_f1: 0.5764
 epoch: 40, train_loss: 0.5518, test_loss: 1.1316, test_f1: 0.5849
 epoch: 41, train_loss: 0.5425, test_loss: 1.0641, test_f1: 0.6265
 epoch: 42, train_loss: 0.5236, test_loss: 1.0960, test_f1: 0.6312
 epoch: 43, train_loss: 0.5100, test_loss: 1.0935, test_f1: 0.6230
 epoch: 44, train_loss: 0.5216, test_loss: 1.1162, test_f1: 0.6178
 epoch: 45, train_loss: 0.5208, test_loss: 1.1710, test_f1: 0.6116
 epoch: 46, train_loss: 0.4932, test_loss: 1.2241, test_f1: 0.6369
 epoch: 47, train_loss: 0.4816, test_loss: 1.0841, test_f1: 0.6152
 epoch: 48, train_loss: 0.4818, test_loss: 1.2940, test_f1: 0.5835
 epoch: 49, train_loss: 0.4767, test_loss: 1.2786, test_f1: 0.6196
 epoch: 50, train_loss: 0.4960, test_loss: 1.1449, test_f1: 0.6458
 epoch: 51, train_loss: 0.4293, test_loss: 1.1870, test_f1: 0.6381
 epoch: 52, train_loss: 0.3969, test_loss: 1.2356, test_f1: 0.6283
 epoch: 53, train_loss: 0.3849, test_loss: 1.1479, test_f1: 0.6577
 epoch: 54, train_loss: 0.3702, test_loss: 1.2795, test_f1: 0.6359
 epoch: 55, train_loss: 0.3752, test_loss: 1.2352, test_f1: 0.6481
 epoch: 56, train_loss: 0.3611, test_loss: 1.3625, test_f1: 0.6412
 epoch: 57, train_loss: 0.3534, test_loss: 1.2097, test_f1: 0.6711
 epoch: 58, train_loss: 0.3432, test_loss: 1.4077, test_f1: 0.6383
 epoch: 59, train_loss: 0.3447, test_loss: 1.4543, test_f1: 0.6067
 epoch: 60, train_loss: 0.3516, test_loss: 1.2849, test_f1: 0.6275
 epoch: 61, train_loss: 0.3416, test_loss: 1.3791, test_f1: 0.6255
 epoch: 62, train_loss: 0.3190, test_loss: 1.4307, test_f1: 0.6072
 epoch: 63, train_loss: 0.3114, test_loss: 1.3885, test_f1: 0.6443
 epoch: 64, train_loss: 0.3301, test_loss: 1.3729, test_f1: 0.6463
 epoch: 65, train_loss: 0.3201, test_loss: 1.3611, test_f1: 0.6549
 epoch: 66, train_loss: 0.3033, test_loss: 1.4602, test_f1: 0.6361
 epoch: 67, train_loss: 0.3241, test_loss: 1.4179, test_f1: 0.6337
 epoch: 68, train_loss: 0.2950, test_loss: 1.3802, test_f1: 0.6506
 epoch: 69, train_loss: 0.3078, test_loss: 1.4269, test_f1: 0.6425
 epoch: 70, train_loss: 0.2969, test_loss: 1.3887, test_f1: 0.6555
 epoch: 71, train_loss: 0.2938, test_loss: 1.3758, test_f1: 0.6521
 epoch: 72, train_loss: 0.2748, test_loss: 1.6285, test_f1: 0.6063
 epoch: 73, train_loss: 0.2658, test_loss: 1.4922, test_f1: 0.6597
 epoch: 74, train_loss: 0.2878, test_loss: 1.5773, test_f1: 0.6453
 epoch: 75, train_loss: 0.2916, test_loss: 1.5784, test_f1: 0.6401
 epoch: 76, train_loss: 0.2821, test_loss: 1.5160, test_f1: 0.6368
 epoch: 77, train_loss: 0.2968, test_loss: 1.4686, test_f1: 0.6362
 epoch: 78, train_loss: 0.2775, test_loss: 1.4912, test_f1: 0.6021
 epoch: 79, train_loss: 0.2667, test_loss: 1.5194, test_f1: 0.5920
 epoch: 80, train_loss: 0.2661, test_loss: 1.5273, test_f1: 0.6181
 epoch: 81, train_loss: 0.2685, test_loss: 1.5231, test_f1: 0.6200
 epoch: 82, train_loss: 0.2675, test_loss: 1.5484, test_f1: 0.6264
 epoch: 83, train_loss: 0.2432, test_loss: 1.5249, test_f1: 0.6304
 epoch: 84, train_loss: 0.2576, test_loss: 1.6033, test_f1: 0.6545
 epoch: 85, train_loss: 0.2383, test_loss: 1.6371, test_f1: 0.6226
 epoch: 86, train_loss: 0.2349, test_loss: 1.4662, test_f1: 0.6411
 epoch: 87, train_loss: 0.2305, test_loss: 1.7341, test_f1: 0.6004
 epoch: 88, train_loss: 0.2299, test_loss: 1.7074, test_f1: 0.6348
 epoch: 89, train_loss: 0.2395, test_loss: 1.5999, test_f1: 0.6339
 epoch: 90, train_loss: 0.2531, test_loss: 1.5083, test_f1: 0.6440
 epoch: 91, train_loss: 0.2482, test_loss: 1.5233, test_f1: 0.6392
 epoch: 92, train_loss: 0.2385, test_loss: 1.6478, test_f1: 0.6513
 epoch: 93, train_loss: 0.2356, test_loss: 1.6403, test_f1: 0.6326
 epoch: 94, train_loss: 0.2647, test_loss: 1.6467, test_f1: 0.6396
 epoch: 95, train_loss: 0.2410, test_loss: 1.6069, test_f1: 0.6274
 epoch: 96, train_loss: 0.2227, test_loss: 1.7413, test_f1: 0.6325
 epoch: 97, train_loss: 0.2180, test_loss: 1.6552, test_f1: 0.6304
 epoch: 98, train_loss: 0.2051, test_loss: 1.6967, test_f1: 0.6241
 epoch: 99, train_loss: 0.2234, test_loss: 1.6922, test_f1: 0.6351
##################ITERATION #7 ****************************************
 epoch: 0, train_loss: 1.3490, test_loss: 1.2409, test_f1: 0.2976
 epoch: 1, train_loss: 1.0279, test_loss: 1.0182, test_f1: 0.4307
 epoch: 2, train_loss: 0.9630, test_loss: 0.9436, test_f1: 0.4914
 epoch: 3, train_loss: 0.9322, test_loss: 0.9048, test_f1: 0.4927
 epoch: 4, train_loss: 0.9344, test_loss: 0.9113, test_f1: 0.4828
 epoch: 5, train_loss: 0.8909, test_loss: 0.9224, test_f1: 0.4910
 epoch: 6, train_loss: 0.8849, test_loss: 0.9675, test_f1: 0.5144
 epoch: 7, train_loss: 0.8524, test_loss: 0.9371, test_f1: 0.5145
 epoch: 8, train_loss: 0.8426, test_loss: 0.9245, test_f1: 0.5332
 epoch: 9, train_loss: 0.8270, test_loss: 0.9435, test_f1: 0.5131
 epoch: 10, train_loss: 0.8103, test_loss: 0.9538, test_f1: 0.5336
 epoch: 11, train_loss: 0.8083, test_loss: 1.0247, test_f1: 0.5434
 epoch: 12, train_loss: 0.8021, test_loss: 0.9385, test_f1: 0.5406
 epoch: 13, train_loss: 0.7863, test_loss: 1.1091, test_f1: 0.5173
 epoch: 14, train_loss: 0.7665, test_loss: 1.0018, test_f1: 0.5687
 epoch: 15, train_loss: 0.7512, test_loss: 1.0571, test_f1: 0.5353
 epoch: 16, train_loss: 0.7484, test_loss: 1.0208, test_f1: 0.5693
 epoch: 17, train_loss: 0.7576, test_loss: 1.1288, test_f1: 0.5724
 epoch: 18, train_loss: 0.7313, test_loss: 1.0373, test_f1: 0.5676
 epoch: 19, train_loss: 0.7310, test_loss: 1.0482, test_f1: 0.5654
 epoch: 20, train_loss: 0.7206, test_loss: 0.9968, test_f1: 0.5816
 epoch: 21, train_loss: 0.7026, test_loss: 1.0542, test_f1: 0.5799
 epoch: 22, train_loss: 0.6916, test_loss: 1.1560, test_f1: 0.5817
 epoch: 23, train_loss: 0.6950, test_loss: 1.0615, test_f1: 0.6001
 epoch: 24, train_loss: 0.6876, test_loss: 1.0454, test_f1: 0.5614
 epoch: 25, train_loss: 0.6724, test_loss: 1.0417, test_f1: 0.5977
 epoch: 26, train_loss: 0.6520, test_loss: 0.9983, test_f1: 0.5999
 epoch: 27, train_loss: 0.6441, test_loss: 1.0422, test_f1: 0.6183
 epoch: 28, train_loss: 0.6338, test_loss: 1.1065, test_f1: 0.6341
 epoch: 29, train_loss: 0.6269, test_loss: 1.0892, test_f1: 0.5804
 epoch: 30, train_loss: 0.6415, test_loss: 1.0713, test_f1: 0.5860
 epoch: 31, train_loss: 0.5949, test_loss: 1.1665, test_f1: 0.5838
 epoch: 32, train_loss: 0.5840, test_loss: 1.1211, test_f1: 0.6012
 epoch: 33, train_loss: 0.6088, test_loss: 1.1622, test_f1: 0.6164
 epoch: 34, train_loss: 0.6162, test_loss: 1.1322, test_f1: 0.6207
 epoch: 35, train_loss: 0.6123, test_loss: 1.1400, test_f1: 0.6237
 epoch: 36, train_loss: 0.6003, test_loss: 1.1068, test_f1: 0.6196
 epoch: 37, train_loss: 0.5728, test_loss: 1.2246, test_f1: 0.5739
 epoch: 38, train_loss: 0.5412, test_loss: 1.1909, test_f1: 0.6113
 epoch: 39, train_loss: 0.5463, test_loss: 1.2315, test_f1: 0.5794
 epoch: 40, train_loss: 0.5345, test_loss: 1.1326, test_f1: 0.6382
 epoch: 41, train_loss: 0.5449, test_loss: 1.1492, test_f1: 0.6418
 epoch: 42, train_loss: 0.5187, test_loss: 1.2488, test_f1: 0.6178
 epoch: 43, train_loss: 0.5453, test_loss: 1.2228, test_f1: 0.5900
 epoch: 44, train_loss: 0.5145, test_loss: 1.2002, test_f1: 0.6225
 epoch: 45, train_loss: 0.5396, test_loss: 1.3296, test_f1: 0.5730
 epoch: 46, train_loss: 0.5071, test_loss: 1.2537, test_f1: 0.6069
 epoch: 47, train_loss: 0.4899, test_loss: 1.2796, test_f1: 0.6353
 epoch: 48, train_loss: 0.4702, test_loss: 1.2143, test_f1: 0.6248
 epoch: 49, train_loss: 0.4786, test_loss: 1.1062, test_f1: 0.6390
 epoch: 50, train_loss: 0.4683, test_loss: 1.2545, test_f1: 0.6354
 epoch: 51, train_loss: 0.4309, test_loss: 1.1974, test_f1: 0.6494
 epoch: 52, train_loss: 0.4005, test_loss: 1.2251, test_f1: 0.6263
 epoch: 53, train_loss: 0.3696, test_loss: 1.2469, test_f1: 0.6487
 epoch: 54, train_loss: 0.3721, test_loss: 1.2508, test_f1: 0.6465
 epoch: 55, train_loss: 0.3626, test_loss: 1.3163, test_f1: 0.6509
 epoch: 56, train_loss: 0.3425, test_loss: 1.3454, test_f1: 0.6563
 epoch: 57, train_loss: 0.3551, test_loss: 1.3939, test_f1: 0.6446
 epoch: 58, train_loss: 0.3347, test_loss: 1.5222, test_f1: 0.6330
 epoch: 59, train_loss: 0.3318, test_loss: 1.3878, test_f1: 0.6457
 epoch: 60, train_loss: 0.3258, test_loss: 1.4413, test_f1: 0.6388
 epoch: 61, train_loss: 0.3204, test_loss: 1.4347, test_f1: 0.6345
 epoch: 62, train_loss: 0.3374, test_loss: 1.4777, test_f1: 0.6463
 epoch: 63, train_loss: 0.3330, test_loss: 1.4909, test_f1: 0.6593
 epoch: 64, train_loss: 0.3293, test_loss: 1.5095, test_f1: 0.6453
 epoch: 65, train_loss: 0.3169, test_loss: 1.4760, test_f1: 0.6391
 epoch: 66, train_loss: 0.2969, test_loss: 1.4812, test_f1: 0.6655
 epoch: 67, train_loss: 0.2950, test_loss: 1.4542, test_f1: 0.6546
 epoch: 68, train_loss: 0.3362, test_loss: 1.6129, test_f1: 0.6137
 epoch: 69, train_loss: 0.3157, test_loss: 1.5695, test_f1: 0.6507
 epoch: 70, train_loss: 0.3010, test_loss: 1.5034, test_f1: 0.6497
 epoch: 71, train_loss: 0.2800, test_loss: 1.6444, test_f1: 0.6511
 epoch: 72, train_loss: 0.2788, test_loss: 1.7509, test_f1: 0.6394
 epoch: 73, train_loss: 0.2792, test_loss: 1.6711, test_f1: 0.6295
 epoch: 74, train_loss: 0.2733, test_loss: 1.6303, test_f1: 0.6332
 epoch: 75, train_loss: 0.2655, test_loss: 1.6414, test_f1: 0.6468
 epoch: 76, train_loss: 0.2537, test_loss: 1.7076, test_f1: 0.6379
 epoch: 77, train_loss: 0.2779, test_loss: 1.7974, test_f1: 0.6373
 epoch: 78, train_loss: 0.2849, test_loss: 1.6746, test_f1: 0.6428
 epoch: 79, train_loss: 0.2661, test_loss: 1.7714, test_f1: 0.6517
 epoch: 80, train_loss: 0.2817, test_loss: 1.7290, test_f1: 0.6395
 epoch: 81, train_loss: 0.2674, test_loss: 1.5797, test_f1: 0.6512
 epoch: 82, train_loss: 0.2695, test_loss: 1.7475, test_f1: 0.6273
 epoch: 83, train_loss: 0.2602, test_loss: 1.6592, test_f1: 0.6448
 epoch: 84, train_loss: 0.2541, test_loss: 1.7439, test_f1: 0.6528
 epoch: 85, train_loss: 0.2637, test_loss: 1.8259, test_f1: 0.6364
 epoch: 86, train_loss: 0.2539, test_loss: 1.8776, test_f1: 0.6415
 epoch: 87, train_loss: 0.2579, test_loss: 1.8080, test_f1: 0.6271
 epoch: 88, train_loss: 0.2340, test_loss: 1.8961, test_f1: 0.6249
 epoch: 89, train_loss: 0.2442, test_loss: 1.9015, test_f1: 0.6341
 epoch: 90, train_loss: 0.2247, test_loss: 1.9448, test_f1: 0.6276
 epoch: 91, train_loss: 0.2171, test_loss: 1.7622, test_f1: 0.6579
 epoch: 92, train_loss: 0.2329, test_loss: 1.8722, test_f1: 0.6463
 epoch: 93, train_loss: 0.2418, test_loss: 1.8345, test_f1: 0.6310
 epoch: 94, train_loss: 0.2334, test_loss: 1.8813, test_f1: 0.6397
 epoch: 95, train_loss: 0.2191, test_loss: 1.9811, test_f1: 0.6423
 epoch: 96, train_loss: 0.2166, test_loss: 2.0000, test_f1: 0.6311
 epoch: 97, train_loss: 0.2230, test_loss: 1.9160, test_f1: 0.6245
 epoch: 98, train_loss: 0.2282, test_loss: 2.0869, test_f1: 0.6532
 epoch: 99, train_loss: 0.2151, test_loss: 2.0011, test_f1: 0.6307
##################ITERATION #8 ****************************************
 epoch: 0, train_loss: 1.4081, test_loss: 1.1233, test_f1: 0.3481
 epoch: 1, train_loss: 1.0307, test_loss: 1.0044, test_f1: 0.4862
 epoch: 2, train_loss: 0.9739, test_loss: 0.9763, test_f1: 0.4706
 epoch: 3, train_loss: 0.9437, test_loss: 1.0206, test_f1: 0.4756
 epoch: 4, train_loss: 0.9096, test_loss: 0.9510, test_f1: 0.4867
 epoch: 5, train_loss: 0.8979, test_loss: 0.9811, test_f1: 0.5342
 epoch: 6, train_loss: 0.8728, test_loss: 1.0020, test_f1: 0.5042
 epoch: 7, train_loss: 0.8566, test_loss: 0.9285, test_f1: 0.5168
 epoch: 8, train_loss: 0.8560, test_loss: 1.0016, test_f1: 0.5191
 epoch: 9, train_loss: 0.8287, test_loss: 0.9261, test_f1: 0.5502
 epoch: 10, train_loss: 0.8133, test_loss: 1.0056, test_f1: 0.5326
 epoch: 11, train_loss: 0.8075, test_loss: 0.9890, test_f1: 0.5226
 epoch: 12, train_loss: 0.8069, test_loss: 0.9495, test_f1: 0.5375
 epoch: 13, train_loss: 0.7829, test_loss: 0.9488, test_f1: 0.5653
 epoch: 14, train_loss: 0.7609, test_loss: 0.9633, test_f1: 0.5594
 epoch: 15, train_loss: 0.7668, test_loss: 1.0097, test_f1: 0.5636
 epoch: 16, train_loss: 0.7479, test_loss: 0.9690, test_f1: 0.6054
 epoch: 17, train_loss: 0.7540, test_loss: 0.9509, test_f1: 0.5827
 epoch: 18, train_loss: 0.7450, test_loss: 0.9947, test_f1: 0.5929
 epoch: 19, train_loss: 0.7187, test_loss: 0.9978, test_f1: 0.6091
 epoch: 20, train_loss: 0.7166, test_loss: 0.9846, test_f1: 0.5766
 epoch: 21, train_loss: 0.7048, test_loss: 1.0024, test_f1: 0.5642
 epoch: 22, train_loss: 0.7111, test_loss: 1.0017, test_f1: 0.5673
 epoch: 23, train_loss: 0.7163, test_loss: 0.9898, test_f1: 0.5931
 epoch: 24, train_loss: 0.7004, test_loss: 0.9444, test_f1: 0.6104
 epoch: 25, train_loss: 0.6874, test_loss: 0.9852, test_f1: 0.5958
 epoch: 26, train_loss: 0.6659, test_loss: 0.9715, test_f1: 0.5961
 epoch: 27, train_loss: 0.6597, test_loss: 1.0895, test_f1: 0.5785
 epoch: 28, train_loss: 0.6475, test_loss: 0.9951, test_f1: 0.6147
 epoch: 29, train_loss: 0.6535, test_loss: 1.2056, test_f1: 0.5747
 epoch: 30, train_loss: 0.6348, test_loss: 1.0184, test_f1: 0.6216
 epoch: 31, train_loss: 0.6287, test_loss: 1.0564, test_f1: 0.6057
 epoch: 32, train_loss: 0.6159, test_loss: 1.0270, test_f1: 0.6215
 epoch: 33, train_loss: 0.6177, test_loss: 1.0868, test_f1: 0.5974
 epoch: 34, train_loss: 0.5904, test_loss: 1.1613, test_f1: 0.6290
 epoch: 35, train_loss: 0.6026, test_loss: 1.1149, test_f1: 0.6267
 epoch: 36, train_loss: 0.5807, test_loss: 1.0606, test_f1: 0.5875
 epoch: 37, train_loss: 0.5736, test_loss: 1.1140, test_f1: 0.6070
 epoch: 38, train_loss: 0.5797, test_loss: 1.0559, test_f1: 0.6506
 epoch: 39, train_loss: 0.5650, test_loss: 1.0635, test_f1: 0.6546
 epoch: 40, train_loss: 0.5119, test_loss: 1.1941, test_f1: 0.6310
 epoch: 41, train_loss: 0.5412, test_loss: 1.2410, test_f1: 0.6021
 epoch: 42, train_loss: 0.5319, test_loss: 1.1221, test_f1: 0.6138
 epoch: 43, train_loss: 0.5294, test_loss: 1.0650, test_f1: 0.6459
 epoch: 44, train_loss: 0.5195, test_loss: 1.1521, test_f1: 0.6238
 epoch: 45, train_loss: 0.5111, test_loss: 1.1715, test_f1: 0.6303
 epoch: 46, train_loss: 0.5110, test_loss: 1.2688, test_f1: 0.6577
 epoch: 47, train_loss: 0.5023, test_loss: 1.1990, test_f1: 0.6415
 epoch: 48, train_loss: 0.4980, test_loss: 1.2047, test_f1: 0.6379
 epoch: 49, train_loss: 0.4841, test_loss: 1.2116, test_f1: 0.6014
 epoch: 50, train_loss: 0.4733, test_loss: 1.2818, test_f1: 0.6470
 epoch: 51, train_loss: 0.4266, test_loss: 1.2052, test_f1: 0.6561
 epoch: 52, train_loss: 0.3963, test_loss: 1.2568, test_f1: 0.6502
 epoch: 53, train_loss: 0.3841, test_loss: 1.2908, test_f1: 0.6376
 epoch: 54, train_loss: 0.3712, test_loss: 1.2732, test_f1: 0.6285
 epoch: 55, train_loss: 0.3767, test_loss: 1.3428, test_f1: 0.6202
 epoch: 56, train_loss: 0.3728, test_loss: 1.2708, test_f1: 0.6559
 epoch: 57, train_loss: 0.3539, test_loss: 1.3531, test_f1: 0.6295
 epoch: 58, train_loss: 0.3410, test_loss: 1.4182, test_f1: 0.6195
 epoch: 59, train_loss: 0.3383, test_loss: 1.3881, test_f1: 0.6367
 epoch: 60, train_loss: 0.3511, test_loss: 1.4866, test_f1: 0.6540
 epoch: 61, train_loss: 0.3549, test_loss: 1.3945, test_f1: 0.6573
 epoch: 62, train_loss: 0.3417, test_loss: 1.3781, test_f1: 0.6226
 epoch: 63, train_loss: 0.3282, test_loss: 1.4055, test_f1: 0.6316
 epoch: 64, train_loss: 0.3370, test_loss: 1.2843, test_f1: 0.6686
 epoch: 65, train_loss: 0.3143, test_loss: 1.4185, test_f1: 0.6356
 epoch: 66, train_loss: 0.3106, test_loss: 1.4015, test_f1: 0.6571
 epoch: 67, train_loss: 0.2956, test_loss: 1.5265, test_f1: 0.6611
 epoch: 68, train_loss: 0.3134, test_loss: 1.5151, test_f1: 0.6380
 epoch: 69, train_loss: 0.2881, test_loss: 1.4469, test_f1: 0.6640
 epoch: 70, train_loss: 0.2979, test_loss: 1.4876, test_f1: 0.6554
 epoch: 71, train_loss: 0.2768, test_loss: 1.5490, test_f1: 0.6293
 epoch: 72, train_loss: 0.3134, test_loss: 1.5940, test_f1: 0.6537
 epoch: 73, train_loss: 0.2957, test_loss: 1.5763, test_f1: 0.6585
 epoch: 74, train_loss: 0.2961, test_loss: 1.5573, test_f1: 0.6668
 epoch: 75, train_loss: 0.2899, test_loss: 1.5699, test_f1: 0.6611
 epoch: 76, train_loss: 0.2893, test_loss: 1.5863, test_f1: 0.6164
 epoch: 77, train_loss: 0.2893, test_loss: 1.6668, test_f1: 0.6599
 epoch: 78, train_loss: 0.2720, test_loss: 1.5996, test_f1: 0.6613
 epoch: 79, train_loss: 0.2655, test_loss: 1.6644, test_f1: 0.6322
 epoch: 80, train_loss: 0.2631, test_loss: 1.5646, test_f1: 0.6536
 epoch: 81, train_loss: 0.2471, test_loss: 1.6818, test_f1: 0.6467
 epoch: 82, train_loss: 0.2700, test_loss: 1.7744, test_f1: 0.6368
 epoch: 83, train_loss: 0.2903, test_loss: 1.6068, test_f1: 0.6507
 epoch: 84, train_loss: 0.2600, test_loss: 1.6932, test_f1: 0.6522
 epoch: 85, train_loss: 0.2565, test_loss: 1.7715, test_f1: 0.6500
 epoch: 86, train_loss: 0.2370, test_loss: 1.6044, test_f1: 0.6564
 epoch: 87, train_loss: 0.2493, test_loss: 1.7754, test_f1: 0.6391
 epoch: 88, train_loss: 0.2500, test_loss: 1.7308, test_f1: 0.6468
 epoch: 89, train_loss: 0.2478, test_loss: 1.6261, test_f1: 0.6593
 epoch: 90, train_loss: 0.2349, test_loss: 1.6646, test_f1: 0.6676
 epoch: 91, train_loss: 0.2527, test_loss: 1.7212, test_f1: 0.6568
 epoch: 92, train_loss: 0.2360, test_loss: 1.5236, test_f1: 0.6763
 epoch: 93, train_loss: 0.2263, test_loss: 1.6371, test_f1: 0.6510
 epoch: 94, train_loss: 0.2361, test_loss: 1.7299, test_f1: 0.6423
 epoch: 95, train_loss: 0.2382, test_loss: 1.7491, test_f1: 0.6557
 epoch: 96, train_loss: 0.2267, test_loss: 1.7372, test_f1: 0.6679
 epoch: 97, train_loss: 0.2301, test_loss: 1.7189, test_f1: 0.6367
 epoch: 98, train_loss: 0.2312, test_loss: 1.5269, test_f1: 0.6549
 epoch: 99, train_loss: 0.2538, test_loss: 1.8144, test_f1: 0.6388
##################ITERATION #9 ****************************************
 epoch: 0, train_loss: 1.4372, test_loss: 1.1922, test_f1: 0.3410
 epoch: 1, train_loss: 1.0395, test_loss: 0.9922, test_f1: 0.4677
 epoch: 2, train_loss: 0.9513, test_loss: 0.9443, test_f1: 0.4891
 epoch: 3, train_loss: 0.9071, test_loss: 0.9535, test_f1: 0.5159
 epoch: 4, train_loss: 0.9080, test_loss: 0.9649, test_f1: 0.5127
 epoch: 5, train_loss: 0.8950, test_loss: 0.9506, test_f1: 0.5046
 epoch: 6, train_loss: 0.8458, test_loss: 0.9494, test_f1: 0.5159
 epoch: 7, train_loss: 0.8417, test_loss: 0.9572, test_f1: 0.5373
 epoch: 8, train_loss: 0.8153, test_loss: 1.0123, test_f1: 0.5371
 epoch: 9, train_loss: 0.8287, test_loss: 0.9690, test_f1: 0.5626
 epoch: 10, train_loss: 0.7967, test_loss: 0.9639, test_f1: 0.5703
 epoch: 11, train_loss: 0.7863, test_loss: 1.0805, test_f1: 0.5477
 epoch: 12, train_loss: 0.7879, test_loss: 0.9907, test_f1: 0.5796
 epoch: 13, train_loss: 0.7700, test_loss: 0.9638, test_f1: 0.5961
 epoch: 14, train_loss: 0.7567, test_loss: 0.9676, test_f1: 0.5608
 epoch: 15, train_loss: 0.7380, test_loss: 0.9944, test_f1: 0.5756
 epoch: 16, train_loss: 0.7203, test_loss: 0.8790, test_f1: 0.6216
 epoch: 17, train_loss: 0.7463, test_loss: 0.9135, test_f1: 0.5820
 epoch: 18, train_loss: 0.7169, test_loss: 0.9732, test_f1: 0.5968
 epoch: 19, train_loss: 0.7182, test_loss: 0.9388, test_f1: 0.6170
 epoch: 20, train_loss: 0.6944, test_loss: 0.9440, test_f1: 0.5765
 epoch: 21, train_loss: 0.7130, test_loss: 0.9923, test_f1: 0.6018
 epoch: 22, train_loss: 0.6933, test_loss: 1.0151, test_f1: 0.6050
 epoch: 23, train_loss: 0.6868, test_loss: 0.9680, test_f1: 0.6058
 epoch: 24, train_loss: 0.6679, test_loss: 1.0612, test_f1: 0.6125
 epoch: 25, train_loss: 0.6757, test_loss: 0.9855, test_f1: 0.6018
 epoch: 26, train_loss: 0.6701, test_loss: 0.9832, test_f1: 0.5601
 epoch: 27, train_loss: 0.6374, test_loss: 1.0081, test_f1: 0.6146
 epoch: 28, train_loss: 0.6309, test_loss: 1.0236, test_f1: 0.5676
 epoch: 29, train_loss: 0.6068, test_loss: 1.0384, test_f1: 0.6102
 epoch: 30, train_loss: 0.6216, test_loss: 1.0688, test_f1: 0.6050
 epoch: 31, train_loss: 0.6256, test_loss: 1.0478, test_f1: 0.6154
 epoch: 32, train_loss: 0.5943, test_loss: 1.0246, test_f1: 0.5974
 epoch: 33, train_loss: 0.5967, test_loss: 1.0312, test_f1: 0.6521
 epoch: 34, train_loss: 0.5897, test_loss: 1.0863, test_f1: 0.6047
 epoch: 35, train_loss: 0.5817, test_loss: 1.0108, test_f1: 0.6208
 epoch: 36, train_loss: 0.5644, test_loss: 1.0561, test_f1: 0.6618
 epoch: 37, train_loss: 0.5619, test_loss: 1.1878, test_f1: 0.6045
 epoch: 38, train_loss: 0.5672, test_loss: 1.0798, test_f1: 0.5923
 epoch: 39, train_loss: 0.5616, test_loss: 1.1257, test_f1: 0.6044
 epoch: 40, train_loss: 0.5468, test_loss: 1.1380, test_f1: 0.6031
 epoch: 41, train_loss: 0.5516, test_loss: 1.0528, test_f1: 0.6507
 epoch: 42, train_loss: 0.5235, test_loss: 1.2695, test_f1: 0.5912
 epoch: 43, train_loss: 0.5198, test_loss: 1.1614, test_f1: 0.6246
 epoch: 44, train_loss: 0.4979, test_loss: 1.4014, test_f1: 0.5921
 epoch: 45, train_loss: 0.5052, test_loss: 1.2016, test_f1: 0.6398
 epoch: 46, train_loss: 0.5210, test_loss: 1.1431, test_f1: 0.6340
 epoch: 47, train_loss: 0.4921, test_loss: 1.1409, test_f1: 0.6242
 epoch: 48, train_loss: 0.5001, test_loss: 1.2137, test_f1: 0.6199
 epoch: 49, train_loss: 0.4884, test_loss: 1.2993, test_f1: 0.5996
 epoch: 50, train_loss: 0.4773, test_loss: 1.2274, test_f1: 0.6505
 epoch: 51, train_loss: 0.4353, test_loss: 1.1528, test_f1: 0.6254
 epoch: 52, train_loss: 0.3838, test_loss: 1.2270, test_f1: 0.6642
 epoch: 53, train_loss: 0.3609, test_loss: 1.2382, test_f1: 0.6429
 epoch: 54, train_loss: 0.3351, test_loss: 1.3279, test_f1: 0.6483
 epoch: 55, train_loss: 0.3732, test_loss: 1.2719, test_f1: 0.6380
 epoch: 56, train_loss: 0.3361, test_loss: 1.3605, test_f1: 0.6282
 epoch: 57, train_loss: 0.3507, test_loss: 1.3419, test_f1: 0.6431
 epoch: 58, train_loss: 0.3485, test_loss: 1.3495, test_f1: 0.6491
 epoch: 59, train_loss: 0.3444, test_loss: 1.4020, test_f1: 0.6214
 epoch: 60, train_loss: 0.3486, test_loss: 1.3397, test_f1: 0.6394
 epoch: 61, train_loss: 0.3286, test_loss: 1.5028, test_f1: 0.6267
 epoch: 62, train_loss: 0.3268, test_loss: 1.4516, test_f1: 0.6473
 epoch: 63, train_loss: 0.3288, test_loss: 1.5042, test_f1: 0.6500
 epoch: 64, train_loss: 0.3173, test_loss: 1.6425, test_f1: 0.6073
 epoch: 65, train_loss: 0.3076, test_loss: 1.5242, test_f1: 0.6310
 epoch: 66, train_loss: 0.3048, test_loss: 1.6294, test_f1: 0.6227
 epoch: 67, train_loss: 0.2948, test_loss: 1.5846, test_f1: 0.6143
 epoch: 68, train_loss: 0.3011, test_loss: 1.4608, test_f1: 0.6297
 epoch: 69, train_loss: 0.2857, test_loss: 1.6409, test_f1: 0.6374
 epoch: 70, train_loss: 0.3039, test_loss: 1.7796, test_f1: 0.6217
 epoch: 71, train_loss: 0.2725, test_loss: 1.5191, test_f1: 0.6450
 epoch: 72, train_loss: 0.2766, test_loss: 1.6447, test_f1: 0.6251
 epoch: 73, train_loss: 0.2806, test_loss: 1.5734, test_f1: 0.6569
 epoch: 74, train_loss: 0.2741, test_loss: 1.8324, test_f1: 0.6222
 epoch: 75, train_loss: 0.2855, test_loss: 1.5720, test_f1: 0.6517
 epoch: 76, train_loss: 0.2846, test_loss: 1.7036, test_f1: 0.6686
 epoch: 77, train_loss: 0.2689, test_loss: 1.6380, test_f1: 0.6434
 epoch: 78, train_loss: 0.2499, test_loss: 1.6485, test_f1: 0.6482
 epoch: 79, train_loss: 0.2655, test_loss: 1.6482, test_f1: 0.6429
 epoch: 80, train_loss: 0.2569, test_loss: 1.8217, test_f1: 0.6477
 epoch: 81, train_loss: 0.2614, test_loss: 1.8025, test_f1: 0.6396
 epoch: 82, train_loss: 0.2512, test_loss: 1.9211, test_f1: 0.6242
 epoch: 83, train_loss: 0.2548, test_loss: 2.0870, test_f1: 0.6313
 epoch: 84, train_loss: 0.2377, test_loss: 1.8497, test_f1: 0.6484
 epoch: 85, train_loss: 0.2435, test_loss: 1.7811, test_f1: 0.6282
 epoch: 86, train_loss: 0.2315, test_loss: 1.7833, test_f1: 0.6193
 epoch: 87, train_loss: 0.2276, test_loss: 1.7324, test_f1: 0.6561
 epoch: 88, train_loss: 0.2262, test_loss: 1.9601, test_f1: 0.6185
 epoch: 89, train_loss: 0.2235, test_loss: 1.9163, test_f1: 0.6018
 epoch: 90, train_loss: 0.2319, test_loss: 1.8589, test_f1: 0.6171
 epoch: 91, train_loss: 0.2347, test_loss: 1.9388, test_f1: 0.6246
 epoch: 92, train_loss: 0.2398, test_loss: 1.9079, test_f1: 0.6338
 epoch: 93, train_loss: 0.2316, test_loss: 1.8040, test_f1: 0.6540
 epoch: 94, train_loss: 0.2121, test_loss: 2.0304, test_f1: 0.6246
 epoch: 95, train_loss: 0.2344, test_loss: 1.8936, test_f1: 0.6579
 epoch: 96, train_loss: 0.2064, test_loss: 1.8977, test_f1: 0.6525
 epoch: 97, train_loss: 0.2071, test_loss: 1.8724, test_f1: 0.6571
 epoch: 98, train_loss: 0.2169, test_loss: 2.0005, test_f1: 0.6405
 epoch: 99, train_loss: 0.1934, test_loss: 1.9047, test_f1: 0.6522

Training completed in 1161.69 seconds
Best F1: 0.7018 at epoch 55
Mean F1 across iterations: 0.6736  0.0122
========================FINAL RESULTS================================
FEGIN weighted F1: 0.7018  0.0122
python main.py --data ltspice_examples --representation component_net --model FEGIN --layers 6 --hiddens 128 --batch_size 128 --lr 0.001 --emb_size 128 --epochs 100 --save_appendix component_net_L6_H128_BS128_LR0.001_E128 --no_val
-----



STDERR:
  File "main.py", line 370, in <module>
    main()
  File "main.py", line 254, in main
    dataset = dataset_class(
  File "/home/philip/projects/llm_inference_code_repo/Circuit-Completion-Using-GNNs/component_classification_with_link_prediction_head/evaluation/FEGIN/kernel/circuit_datasets.py", line 15, in __init__
    self.data, self.slices = torch.load(self.processed_paths[0])
  File "/home/philip/.local/lib/python3.8/site-packages/torch/serialization.py", line 1040, in load
    warnings.warn(
  File "/usr/lib/python3.8/warnings.py", line 109, in _showwarnmsg
    sw(msg.message, msg.category, msg.filename, msg.lineno,
  File "main.py", line 47, in warn_with_traceback
    traceback.print_stack(file=log)
/home/philip/projects/llm_inference_code_repo/Circuit-Completion-Using-GNNs/component_classification_with_link_prediction_head/evaluation/FEGIN/kernel/circuit_datasets.py:15: FutureWarning: You are using `torch.load` with `weights_only=False` (the current default value), which uses the default pickle module implicitly. It is possible to construct malicious pickle data which will execute arbitrary code during unpickling (See https://github.com/pytorch/pytorch/blob/main/SECURITY.md#untrusted-models for more details). In a future release, the default value for `weights_only` will be flipped to `True`. This limits the functions that could be executed during unpickling. Arbitrary objects will no longer be allowed to be loaded via this mode unless they are explicitly allowlisted by the user via `torch.serialization.add_safe_globals`. We recommend you start setting `weights_only=True` for any use case where you don't have full control of the loaded file. Please open an issue on GitHub for any issues related to this experimental feature.
  self.data, self.slices = torch.load(self.processed_paths[0])
