STDOUT:
Results will be saved in /home/philip/projects/ltspice_examples_code_repo/Circuit-Completion-Using-GNNs/component_classification_with_link_prediction_head/evaluation/FEGIN/results/model_FEGIN_dataset_ltspice_examples
Command line input: python main.py --data ltspice_examples --representation component_net --model FEGIN --layers 2 --hiddens 128 --batch_size 256 --lr 0.001 --emb_size 250 --epochs 100 --save_appendix component_net_L2_H128_BS256_LR0.001_E250 --no_val
 is saved.
-----
ltspice_examples - FEGIN
Using 2 layers, 128 hidden units, h = 2
Loading component_net representation dataset
ENTERED
Training FEGIN on component_net representation
Train: 3558, Test: 846
##################ITERATION #0 ****************************************
 epoch: 0, train_loss: 1.2999, test_loss: 1.3033, test_f1: 0.2270
 epoch: 1, train_loss: 1.1805, test_loss: 1.2159, test_f1: 0.2611
 epoch: 2, train_loss: 1.0926, test_loss: 1.1046, test_f1: 0.4521
 epoch: 3, train_loss: 1.0123, test_loss: 1.0517, test_f1: 0.4330
 epoch: 4, train_loss: 0.9606, test_loss: 1.0096, test_f1: 0.4338
 epoch: 5, train_loss: 0.9383, test_loss: 0.9650, test_f1: 0.5228
 epoch: 6, train_loss: 0.9193, test_loss: 0.9161, test_f1: 0.5153
 epoch: 7, train_loss: 0.8923, test_loss: 0.9580, test_f1: 0.5069
 epoch: 8, train_loss: 0.8635, test_loss: 0.9466, test_f1: 0.4951
 epoch: 9, train_loss: 0.8608, test_loss: 1.0774, test_f1: 0.4954
 epoch: 10, train_loss: 0.8615, test_loss: 0.9583, test_f1: 0.5388
 epoch: 11, train_loss: 0.8427, test_loss: 0.9213, test_f1: 0.5237
 epoch: 12, train_loss: 0.8261, test_loss: 0.9448, test_f1: 0.5145
 epoch: 13, train_loss: 0.8001, test_loss: 0.9140, test_f1: 0.5453
 epoch: 14, train_loss: 0.7880, test_loss: 0.9445, test_f1: 0.5571
 epoch: 15, train_loss: 0.7794, test_loss: 1.0273, test_f1: 0.5311
 epoch: 16, train_loss: 0.7703, test_loss: 0.8939, test_f1: 0.5436
 epoch: 17, train_loss: 0.7609, test_loss: 0.9539, test_f1: 0.5230
 epoch: 18, train_loss: 0.7439, test_loss: 0.9314, test_f1: 0.5508
 epoch: 19, train_loss: 0.7250, test_loss: 0.9865, test_f1: 0.5881
 epoch: 20, train_loss: 0.7162, test_loss: 0.9093, test_f1: 0.5849
 epoch: 21, train_loss: 0.7169, test_loss: 0.9919, test_f1: 0.5659
 epoch: 22, train_loss: 0.7233, test_loss: 0.9427, test_f1: 0.5792
 epoch: 23, train_loss: 0.7148, test_loss: 0.9047, test_f1: 0.6078
 epoch: 24, train_loss: 0.7122, test_loss: 0.9384, test_f1: 0.5969
 epoch: 25, train_loss: 0.6810, test_loss: 0.9490, test_f1: 0.5880
 epoch: 26, train_loss: 0.6830, test_loss: 0.9406, test_f1: 0.6399
 epoch: 27, train_loss: 0.6584, test_loss: 0.9765, test_f1: 0.5836
 epoch: 28, train_loss: 0.6496, test_loss: 0.9295, test_f1: 0.6287
 epoch: 29, train_loss: 0.6257, test_loss: 0.9631, test_f1: 0.6011
 epoch: 30, train_loss: 0.6372, test_loss: 0.9452, test_f1: 0.6137
 epoch: 31, train_loss: 0.6213, test_loss: 0.9773, test_f1: 0.6100
 epoch: 32, train_loss: 0.6321, test_loss: 1.0281, test_f1: 0.5750
 epoch: 33, train_loss: 0.6206, test_loss: 0.9504, test_f1: 0.6268
 epoch: 34, train_loss: 0.6052, test_loss: 1.0454, test_f1: 0.6091
 epoch: 35, train_loss: 0.5924, test_loss: 0.9676, test_f1: 0.6247
 epoch: 36, train_loss: 0.5707, test_loss: 1.0021, test_f1: 0.6130
 epoch: 37, train_loss: 0.5798, test_loss: 1.0133, test_f1: 0.5998
 epoch: 38, train_loss: 0.5757, test_loss: 1.1169, test_f1: 0.5858
 epoch: 39, train_loss: 0.5745, test_loss: 0.9506, test_f1: 0.6134
 epoch: 40, train_loss: 0.5445, test_loss: 0.9963, test_f1: 0.6503
 epoch: 41, train_loss: 0.5305, test_loss: 1.0416, test_f1: 0.6077
 epoch: 42, train_loss: 0.5139, test_loss: 0.9884, test_f1: 0.6455
 epoch: 43, train_loss: 0.5271, test_loss: 0.9736, test_f1: 0.6164
 epoch: 44, train_loss: 0.5227, test_loss: 1.0184, test_f1: 0.6195
 epoch: 45, train_loss: 0.5030, test_loss: 1.2281, test_f1: 0.5847
 epoch: 46, train_loss: 0.4992, test_loss: 1.1125, test_f1: 0.6204
 epoch: 47, train_loss: 0.4866, test_loss: 1.1031, test_f1: 0.5814
 epoch: 48, train_loss: 0.4958, test_loss: 1.2386, test_f1: 0.6180
 epoch: 49, train_loss: 0.4870, test_loss: 1.1587, test_f1: 0.6218
 epoch: 50, train_loss: 0.4879, test_loss: 1.0997, test_f1: 0.6548
 epoch: 51, train_loss: 0.4504, test_loss: 1.1045, test_f1: 0.6498
 epoch: 52, train_loss: 0.4249, test_loss: 1.1260, test_f1: 0.6576
 epoch: 53, train_loss: 0.4185, test_loss: 1.2235, test_f1: 0.6230
 epoch: 54, train_loss: 0.4025, test_loss: 1.1560, test_f1: 0.6377
 epoch: 55, train_loss: 0.3866, test_loss: 1.2228, test_f1: 0.6489
 epoch: 56, train_loss: 0.3988, test_loss: 1.1356, test_f1: 0.6413
 epoch: 57, train_loss: 0.3920, test_loss: 1.2691, test_f1: 0.6380
 epoch: 58, train_loss: 0.3829, test_loss: 1.2927, test_f1: 0.6523
 epoch: 59, train_loss: 0.3792, test_loss: 1.2713, test_f1: 0.6440
 epoch: 60, train_loss: 0.3774, test_loss: 1.2368, test_f1: 0.6538
 epoch: 61, train_loss: 0.3783, test_loss: 1.2503, test_f1: 0.6481
 epoch: 62, train_loss: 0.3579, test_loss: 1.3389, test_f1: 0.6272
 epoch: 63, train_loss: 0.3599, test_loss: 1.2834, test_f1: 0.6322
 epoch: 64, train_loss: 0.3509, test_loss: 1.4251, test_f1: 0.6236
 epoch: 65, train_loss: 0.3556, test_loss: 1.2643, test_f1: 0.6585
 epoch: 66, train_loss: 0.3485, test_loss: 1.3354, test_f1: 0.6382
 epoch: 67, train_loss: 0.3325, test_loss: 1.3140, test_f1: 0.6328
 epoch: 68, train_loss: 0.3448, test_loss: 1.3731, test_f1: 0.6433
 epoch: 69, train_loss: 0.3416, test_loss: 1.3757, test_f1: 0.6245
 epoch: 70, train_loss: 0.3295, test_loss: 1.3986, test_f1: 0.6234
 epoch: 71, train_loss: 0.3225, test_loss: 1.4217, test_f1: 0.6541
 epoch: 72, train_loss: 0.3220, test_loss: 1.4157, test_f1: 0.6406
 epoch: 73, train_loss: 0.3255, test_loss: 1.3798, test_f1: 0.6255
 epoch: 74, train_loss: 0.3448, test_loss: 1.5106, test_f1: 0.6170
 epoch: 75, train_loss: 0.3276, test_loss: 1.4304, test_f1: 0.6449
 epoch: 76, train_loss: 0.3196, test_loss: 1.4421, test_f1: 0.6391
 epoch: 77, train_loss: 0.3054, test_loss: 1.5940, test_f1: 0.6484
 epoch: 78, train_loss: 0.3011, test_loss: 1.6035, test_f1: 0.6318
 epoch: 79, train_loss: 0.2905, test_loss: 1.6151, test_f1: 0.6428
 epoch: 80, train_loss: 0.3068, test_loss: 1.4818, test_f1: 0.6216
 epoch: 81, train_loss: 0.2917, test_loss: 1.4933, test_f1: 0.6388
 epoch: 82, train_loss: 0.2907, test_loss: 1.6288, test_f1: 0.6653
 epoch: 83, train_loss: 0.2768, test_loss: 1.5311, test_f1: 0.6156
 epoch: 84, train_loss: 0.2851, test_loss: 1.5976, test_f1: 0.6434
 epoch: 85, train_loss: 0.2879, test_loss: 1.6542, test_f1: 0.6208
 epoch: 86, train_loss: 0.2658, test_loss: 1.7326, test_f1: 0.6324
 epoch: 87, train_loss: 0.2582, test_loss: 1.5629, test_f1: 0.6265
 epoch: 88, train_loss: 0.2588, test_loss: 1.6303, test_f1: 0.6387
 epoch: 89, train_loss: 0.2632, test_loss: 1.8525, test_f1: 0.6292
 epoch: 90, train_loss: 0.2743, test_loss: 1.6351, test_f1: 0.6542
 epoch: 91, train_loss: 0.2632, test_loss: 1.6975, test_f1: 0.6268
 epoch: 92, train_loss: 0.2546, test_loss: 1.7344, test_f1: 0.6649
 epoch: 93, train_loss: 0.2641, test_loss: 1.7153, test_f1: 0.6416
 epoch: 94, train_loss: 0.2788, test_loss: 1.7985, test_f1: 0.6257
 epoch: 95, train_loss: 0.2523, test_loss: 1.7577, test_f1: 0.6498
 epoch: 96, train_loss: 0.2480, test_loss: 1.7693, test_f1: 0.6309
 epoch: 97, train_loss: 0.2383, test_loss: 1.7186, test_f1: 0.6142
 epoch: 98, train_loss: 0.2327, test_loss: 1.7623, test_f1: 0.6303
 epoch: 99, train_loss: 0.2445, test_loss: 1.7951, test_f1: 0.6424
##################ITERATION #1 ****************************************
 epoch: 0, train_loss: 1.2036, test_loss: 1.2570, test_f1: 0.2270
 epoch: 1, train_loss: 1.0424, test_loss: 1.1148, test_f1: 0.3441
 epoch: 2, train_loss: 0.9888, test_loss: 1.0145, test_f1: 0.4655
 epoch: 3, train_loss: 0.9431, test_loss: 0.9652, test_f1: 0.5276
 epoch: 4, train_loss: 0.9261, test_loss: 0.9686, test_f1: 0.4868
 epoch: 5, train_loss: 0.8959, test_loss: 0.9095, test_f1: 0.5675
 epoch: 6, train_loss: 0.8716, test_loss: 0.9847, test_f1: 0.5077
 epoch: 7, train_loss: 0.8629, test_loss: 0.8888, test_f1: 0.5369
 epoch: 8, train_loss: 0.8331, test_loss: 0.9135, test_f1: 0.5736
 epoch: 9, train_loss: 0.8365, test_loss: 0.9380, test_f1: 0.5339
 epoch: 10, train_loss: 0.8084, test_loss: 0.9263, test_f1: 0.5754
 epoch: 11, train_loss: 0.7959, test_loss: 0.8845, test_f1: 0.5592
 epoch: 12, train_loss: 0.7861, test_loss: 0.9191, test_f1: 0.5862
 epoch: 13, train_loss: 0.7846, test_loss: 0.8941, test_f1: 0.5344
 epoch: 14, train_loss: 0.7575, test_loss: 0.8956, test_f1: 0.5915
 epoch: 15, train_loss: 0.7538, test_loss: 0.9495, test_f1: 0.5610
 epoch: 16, train_loss: 0.7317, test_loss: 0.9066, test_f1: 0.6095
 epoch: 17, train_loss: 0.7276, test_loss: 0.9298, test_f1: 0.6149
 epoch: 18, train_loss: 0.7181, test_loss: 0.9274, test_f1: 0.5946
 epoch: 19, train_loss: 0.6955, test_loss: 0.8848, test_f1: 0.6315
 epoch: 20, train_loss: 0.6821, test_loss: 0.8946, test_f1: 0.6417
 epoch: 21, train_loss: 0.6761, test_loss: 0.9180, test_f1: 0.6445
 epoch: 22, train_loss: 0.6776, test_loss: 1.0017, test_f1: 0.5921
 epoch: 23, train_loss: 0.6472, test_loss: 0.9322, test_f1: 0.6081
 epoch: 24, train_loss: 0.6683, test_loss: 1.0645, test_f1: 0.5778
 epoch: 25, train_loss: 0.6327, test_loss: 1.0534, test_f1: 0.5804
 epoch: 26, train_loss: 0.6297, test_loss: 0.9285, test_f1: 0.6626
 epoch: 27, train_loss: 0.6349, test_loss: 1.0287, test_f1: 0.6167
 epoch: 28, train_loss: 0.6245, test_loss: 0.9890, test_f1: 0.6173
 epoch: 29, train_loss: 0.6214, test_loss: 0.9428, test_f1: 0.6577
 epoch: 30, train_loss: 0.6113, test_loss: 1.0096, test_f1: 0.6251
 epoch: 31, train_loss: 0.6072, test_loss: 1.0163, test_f1: 0.6145
 epoch: 32, train_loss: 0.5749, test_loss: 0.9872, test_f1: 0.6391
 epoch: 33, train_loss: 0.5859, test_loss: 0.9861, test_f1: 0.6500
 epoch: 34, train_loss: 0.5669, test_loss: 0.9873, test_f1: 0.6403
 epoch: 35, train_loss: 0.5571, test_loss: 1.0268, test_f1: 0.6131
 epoch: 36, train_loss: 0.5501, test_loss: 1.0227, test_f1: 0.6658
 epoch: 37, train_loss: 0.5337, test_loss: 1.0342, test_f1: 0.6324
 epoch: 38, train_loss: 0.5266, test_loss: 1.1021, test_f1: 0.6121
 epoch: 39, train_loss: 0.5190, test_loss: 1.1827, test_f1: 0.5927
 epoch: 40, train_loss: 0.5253, test_loss: 1.1311, test_f1: 0.6327
 epoch: 41, train_loss: 0.5216, test_loss: 1.1604, test_f1: 0.6585
 epoch: 42, train_loss: 0.5090, test_loss: 1.1081, test_f1: 0.6053
 epoch: 43, train_loss: 0.5166, test_loss: 1.0876, test_f1: 0.6714
 epoch: 44, train_loss: 0.4955, test_loss: 1.0883, test_f1: 0.6708
 epoch: 45, train_loss: 0.4888, test_loss: 1.0997, test_f1: 0.6466
 epoch: 46, train_loss: 0.4991, test_loss: 1.0775, test_f1: 0.6636
 epoch: 47, train_loss: 0.4820, test_loss: 1.2100, test_f1: 0.6199
 epoch: 48, train_loss: 0.4635, test_loss: 1.1242, test_f1: 0.6505
 epoch: 49, train_loss: 0.4616, test_loss: 1.4411, test_f1: 0.5877
 epoch: 50, train_loss: 0.4384, test_loss: 1.1457, test_f1: 0.6742
 epoch: 51, train_loss: 0.4169, test_loss: 1.1308, test_f1: 0.6764
 epoch: 52, train_loss: 0.4014, test_loss: 1.1909, test_f1: 0.6524
 epoch: 53, train_loss: 0.4041, test_loss: 1.2476, test_f1: 0.6373
 epoch: 54, train_loss: 0.3777, test_loss: 1.2436, test_f1: 0.6527
 epoch: 55, train_loss: 0.3718, test_loss: 1.2079, test_f1: 0.6537
 epoch: 56, train_loss: 0.3734, test_loss: 1.2292, test_f1: 0.6537
 epoch: 57, train_loss: 0.3876, test_loss: 1.2850, test_f1: 0.6332
 epoch: 58, train_loss: 0.3563, test_loss: 1.3477, test_f1: 0.6267
 epoch: 59, train_loss: 0.3669, test_loss: 1.3042, test_f1: 0.6655
 epoch: 60, train_loss: 0.3541, test_loss: 1.3736, test_f1: 0.6423
 epoch: 61, train_loss: 0.3596, test_loss: 1.2704, test_f1: 0.6652
 epoch: 62, train_loss: 0.3559, test_loss: 1.3197, test_f1: 0.6697
 epoch: 63, train_loss: 0.3587, test_loss: 1.3487, test_f1: 0.6498
 epoch: 64, train_loss: 0.3673, test_loss: 1.4402, test_f1: 0.6456
 epoch: 65, train_loss: 0.3569, test_loss: 1.2876, test_f1: 0.6648
 epoch: 66, train_loss: 0.3415, test_loss: 1.3070, test_f1: 0.6676
 epoch: 67, train_loss: 0.3357, test_loss: 1.3885, test_f1: 0.6377
 epoch: 68, train_loss: 0.3386, test_loss: 1.4589, test_f1: 0.6135
 epoch: 69, train_loss: 0.3204, test_loss: 1.3388, test_f1: 0.6655
 epoch: 70, train_loss: 0.3305, test_loss: 1.4878, test_f1: 0.6149
 epoch: 71, train_loss: 0.3114, test_loss: 1.4217, test_f1: 0.6597
 epoch: 72, train_loss: 0.3398, test_loss: 1.4413, test_f1: 0.6405
 epoch: 73, train_loss: 0.3130, test_loss: 1.5417, test_f1: 0.6515
 epoch: 74, train_loss: 0.3259, test_loss: 1.5235, test_f1: 0.6481
 epoch: 75, train_loss: 0.3028, test_loss: 1.4651, test_f1: 0.6342
 epoch: 76, train_loss: 0.2952, test_loss: 1.3964, test_f1: 0.6697
 epoch: 77, train_loss: 0.3075, test_loss: 1.6557, test_f1: 0.6254
 epoch: 78, train_loss: 0.3139, test_loss: 1.4389, test_f1: 0.6402
 epoch: 79, train_loss: 0.2928, test_loss: 1.5604, test_f1: 0.6429
 epoch: 80, train_loss: 0.2819, test_loss: 1.5745, test_f1: 0.6382
 epoch: 81, train_loss: 0.2856, test_loss: 1.5287, test_f1: 0.6648
 epoch: 82, train_loss: 0.2928, test_loss: 1.6204, test_f1: 0.6305
 epoch: 83, train_loss: 0.2877, test_loss: 1.6183, test_f1: 0.6415
 epoch: 84, train_loss: 0.3020, test_loss: 1.6451, test_f1: 0.6370
 epoch: 85, train_loss: 0.3092, test_loss: 1.4966, test_f1: 0.6489
 epoch: 86, train_loss: 0.2990, test_loss: 1.6443, test_f1: 0.6378
 epoch: 87, train_loss: 0.2855, test_loss: 1.6004, test_f1: 0.6478
 epoch: 88, train_loss: 0.2784, test_loss: 1.7304, test_f1: 0.6279
 epoch: 89, train_loss: 0.2851, test_loss: 1.6181, test_f1: 0.6743
 epoch: 90, train_loss: 0.2643, test_loss: 1.6444, test_f1: 0.6308
 epoch: 91, train_loss: 0.2663, test_loss: 1.6787, test_f1: 0.6420
 epoch: 92, train_loss: 0.2555, test_loss: 1.6657, test_f1: 0.6508
 epoch: 93, train_loss: 0.2554, test_loss: 1.7735, test_f1: 0.6361
 epoch: 94, train_loss: 0.2511, test_loss: 1.5956, test_f1: 0.6432
 epoch: 95, train_loss: 0.2462, test_loss: 1.7470, test_f1: 0.6595
 epoch: 96, train_loss: 0.2685, test_loss: 1.8122, test_f1: 0.6304
 epoch: 97, train_loss: 0.2512, test_loss: 1.7522, test_f1: 0.6533
 epoch: 98, train_loss: 0.2387, test_loss: 1.8052, test_f1: 0.6255
 epoch: 99, train_loss: 0.2347, test_loss: 1.7569, test_f1: 0.6441
##################ITERATION #2 ****************************************
 epoch: 0, train_loss: 1.2390, test_loss: 1.2757, test_f1: 0.2270
 epoch: 1, train_loss: 1.0359, test_loss: 1.1115, test_f1: 0.3438
 epoch: 2, train_loss: 0.9642, test_loss: 1.0297, test_f1: 0.4161
 epoch: 3, train_loss: 0.9429, test_loss: 0.9887, test_f1: 0.4627
 epoch: 4, train_loss: 0.9308, test_loss: 0.9381, test_f1: 0.5008
 epoch: 5, train_loss: 0.8948, test_loss: 0.9141, test_f1: 0.5067
 epoch: 6, train_loss: 0.8721, test_loss: 0.9369, test_f1: 0.5452
 epoch: 7, train_loss: 0.8516, test_loss: 0.8778, test_f1: 0.5410
 epoch: 8, train_loss: 0.8326, test_loss: 0.8646, test_f1: 0.5769
 epoch: 9, train_loss: 0.8100, test_loss: 0.9020, test_f1: 0.5559
 epoch: 10, train_loss: 0.8088, test_loss: 0.8694, test_f1: 0.5612
 epoch: 11, train_loss: 0.8085, test_loss: 0.9310, test_f1: 0.5723
 epoch: 12, train_loss: 0.7850, test_loss: 0.9318, test_f1: 0.5517
 epoch: 13, train_loss: 0.7707, test_loss: 0.9779, test_f1: 0.5538
 epoch: 14, train_loss: 0.7682, test_loss: 0.9228, test_f1: 0.5881
 epoch: 15, train_loss: 0.7607, test_loss: 0.9029, test_f1: 0.6057
 epoch: 16, train_loss: 0.7406, test_loss: 0.9301, test_f1: 0.6032
 epoch: 17, train_loss: 0.7280, test_loss: 0.8719, test_f1: 0.6405
 epoch: 18, train_loss: 0.7180, test_loss: 0.9304, test_f1: 0.6337
 epoch: 19, train_loss: 0.7148, test_loss: 0.9800, test_f1: 0.5894
 epoch: 20, train_loss: 0.7013, test_loss: 0.9061, test_f1: 0.6481
 epoch: 21, train_loss: 0.7008, test_loss: 0.9544, test_f1: 0.5646
 epoch: 22, train_loss: 0.6926, test_loss: 0.9291, test_f1: 0.6257
 epoch: 23, train_loss: 0.6852, test_loss: 0.9870, test_f1: 0.5991
 epoch: 24, train_loss: 0.6684, test_loss: 0.9544, test_f1: 0.6282
 epoch: 25, train_loss: 0.6446, test_loss: 1.0010, test_f1: 0.6234
 epoch: 26, train_loss: 0.6575, test_loss: 0.9505, test_f1: 0.6357
 epoch: 27, train_loss: 0.6497, test_loss: 0.9342, test_f1: 0.6457
 epoch: 28, train_loss: 0.6283, test_loss: 1.0127, test_f1: 0.6071
 epoch: 29, train_loss: 0.6202, test_loss: 0.9414, test_f1: 0.6548
 epoch: 30, train_loss: 0.6186, test_loss: 1.0775, test_f1: 0.5669
 epoch: 31, train_loss: 0.5988, test_loss: 1.0034, test_f1: 0.6137
 epoch: 32, train_loss: 0.5934, test_loss: 1.0270, test_f1: 0.6481
 epoch: 33, train_loss: 0.5832, test_loss: 1.0297, test_f1: 0.6540
 epoch: 34, train_loss: 0.5837, test_loss: 1.0640, test_f1: 0.6352
 epoch: 35, train_loss: 0.5753, test_loss: 1.1144, test_f1: 0.6435
 epoch: 36, train_loss: 0.5626, test_loss: 1.0791, test_f1: 0.6576
 epoch: 37, train_loss: 0.5481, test_loss: 1.2034, test_f1: 0.5948
 epoch: 38, train_loss: 0.5552, test_loss: 1.1097, test_f1: 0.6559
 epoch: 39, train_loss: 0.5382, test_loss: 1.0201, test_f1: 0.6291
 epoch: 40, train_loss: 0.5536, test_loss: 1.0548, test_f1: 0.6753
 epoch: 41, train_loss: 0.5312, test_loss: 1.1604, test_f1: 0.6408
 epoch: 42, train_loss: 0.5298, test_loss: 1.0760, test_f1: 0.6286
 epoch: 43, train_loss: 0.5017, test_loss: 1.3108, test_f1: 0.6335
 epoch: 44, train_loss: 0.4822, test_loss: 1.1241, test_f1: 0.6580
 epoch: 45, train_loss: 0.4850, test_loss: 1.2029, test_f1: 0.6098
 epoch: 46, train_loss: 0.4631, test_loss: 1.1825, test_f1: 0.6866
 epoch: 47, train_loss: 0.4923, test_loss: 1.5273, test_f1: 0.5824
 epoch: 48, train_loss: 0.4983, test_loss: 1.1526, test_f1: 0.6465
 epoch: 49, train_loss: 0.4866, test_loss: 1.2116, test_f1: 0.6726
 epoch: 50, train_loss: 0.4724, test_loss: 1.1822, test_f1: 0.6382
 epoch: 51, train_loss: 0.4605, test_loss: 1.1515, test_f1: 0.6860
 epoch: 52, train_loss: 0.4186, test_loss: 1.1465, test_f1: 0.6928
 epoch: 53, train_loss: 0.4215, test_loss: 1.1839, test_f1: 0.6820
 epoch: 54, train_loss: 0.4179, test_loss: 1.2874, test_f1: 0.6623
 epoch: 55, train_loss: 0.4039, test_loss: 1.2190, test_f1: 0.7024
 epoch: 56, train_loss: 0.3889, test_loss: 1.2542, test_f1: 0.6986
 epoch: 57, train_loss: 0.3888, test_loss: 1.2718, test_f1: 0.6964
 epoch: 58, train_loss: 0.3956, test_loss: 1.2754, test_f1: 0.6460
 epoch: 59, train_loss: 0.3796, test_loss: 1.2664, test_f1: 0.6756
 epoch: 60, train_loss: 0.3722, test_loss: 1.2831, test_f1: 0.6788
 epoch: 61, train_loss: 0.3794, test_loss: 1.2942, test_f1: 0.6974
 epoch: 62, train_loss: 0.3560, test_loss: 1.3119, test_f1: 0.6986
 epoch: 63, train_loss: 0.3534, test_loss: 1.4870, test_f1: 0.6822
 epoch: 64, train_loss: 0.3632, test_loss: 1.3598, test_f1: 0.6836
 epoch: 65, train_loss: 0.3629, test_loss: 1.3751, test_f1: 0.6643
 epoch: 66, train_loss: 0.3459, test_loss: 1.3621, test_f1: 0.6952
 epoch: 67, train_loss: 0.3696, test_loss: 1.3940, test_f1: 0.7013
 epoch: 68, train_loss: 0.3531, test_loss: 1.4302, test_f1: 0.6654
 epoch: 69, train_loss: 0.3507, test_loss: 1.3733, test_f1: 0.6800
 epoch: 70, train_loss: 0.3406, test_loss: 1.5712, test_f1: 0.6387
 epoch: 71, train_loss: 0.3271, test_loss: 1.3873, test_f1: 0.6947
 epoch: 72, train_loss: 0.3232, test_loss: 1.4549, test_f1: 0.6713
 epoch: 73, train_loss: 0.3194, test_loss: 1.4989, test_f1: 0.6939
 epoch: 74, train_loss: 0.3307, test_loss: 1.4920, test_f1: 0.6992
 epoch: 75, train_loss: 0.3216, test_loss: 1.3791, test_f1: 0.6832
 epoch: 76, train_loss: 0.3154, test_loss: 1.4435, test_f1: 0.6739
 epoch: 77, train_loss: 0.3136, test_loss: 1.6176, test_f1: 0.6737
 epoch: 78, train_loss: 0.3173, test_loss: 1.5270, test_f1: 0.6497
 epoch: 79, train_loss: 0.3082, test_loss: 1.5363, test_f1: 0.6776
 epoch: 80, train_loss: 0.3183, test_loss: 1.5307, test_f1: 0.6901
 epoch: 81, train_loss: 0.3104, test_loss: 1.5517, test_f1: 0.6932
 epoch: 82, train_loss: 0.3115, test_loss: 1.5019, test_f1: 0.6734
 epoch: 83, train_loss: 0.3038, test_loss: 1.5497, test_f1: 0.6718
 epoch: 84, train_loss: 0.2968, test_loss: 1.5075, test_f1: 0.6908
 epoch: 85, train_loss: 0.2932, test_loss: 1.5304, test_f1: 0.6838
 epoch: 86, train_loss: 0.3034, test_loss: 1.5805, test_f1: 0.6622
 epoch: 87, train_loss: 0.2908, test_loss: 1.5529, test_f1: 0.6934
 epoch: 88, train_loss: 0.2869, test_loss: 1.5639, test_f1: 0.7074
 epoch: 89, train_loss: 0.2613, test_loss: 1.6342, test_f1: 0.6777
 epoch: 90, train_loss: 0.2744, test_loss: 1.6121, test_f1: 0.6738
 epoch: 91, train_loss: 0.2672, test_loss: 1.5966, test_f1: 0.6899
 epoch: 92, train_loss: 0.2718, test_loss: 1.6909, test_f1: 0.6824
 epoch: 93, train_loss: 0.2748, test_loss: 1.7653, test_f1: 0.6846
 epoch: 94, train_loss: 0.2591, test_loss: 1.6343, test_f1: 0.6635
 epoch: 95, train_loss: 0.2658, test_loss: 1.6556, test_f1: 0.7051
 epoch: 96, train_loss: 0.2624, test_loss: 1.6533, test_f1: 0.6758
 epoch: 97, train_loss: 0.2556, test_loss: 1.6555, test_f1: 0.6827
 epoch: 98, train_loss: 0.2704, test_loss: 1.7120, test_f1: 0.6677
 epoch: 99, train_loss: 0.2573, test_loss: 1.8403, test_f1: 0.6925
##################ITERATION #3 ****************************************
 epoch: 0, train_loss: 1.3543, test_loss: 1.2818, test_f1: 0.2691
 epoch: 1, train_loss: 1.0927, test_loss: 1.1397, test_f1: 0.3267
 epoch: 2, train_loss: 0.9976, test_loss: 1.0136, test_f1: 0.4416
 epoch: 3, train_loss: 0.9444, test_loss: 0.9328, test_f1: 0.4991
 epoch: 4, train_loss: 0.9170, test_loss: 0.9208, test_f1: 0.5346
 epoch: 5, train_loss: 0.8839, test_loss: 0.9192, test_f1: 0.5230
 epoch: 6, train_loss: 0.8694, test_loss: 0.8791, test_f1: 0.5202
 epoch: 7, train_loss: 0.8579, test_loss: 0.8700, test_f1: 0.5611
 epoch: 8, train_loss: 0.8410, test_loss: 0.8755, test_f1: 0.5339
 epoch: 9, train_loss: 0.8227, test_loss: 0.9006, test_f1: 0.5414
 epoch: 10, train_loss: 0.7949, test_loss: 0.8936, test_f1: 0.5624
 epoch: 11, train_loss: 0.7882, test_loss: 0.8686, test_f1: 0.5829
 epoch: 12, train_loss: 0.7871, test_loss: 0.8693, test_f1: 0.5776
 epoch: 13, train_loss: 0.7734, test_loss: 0.8406, test_f1: 0.5760
 epoch: 14, train_loss: 0.7610, test_loss: 0.9325, test_f1: 0.5607
 epoch: 15, train_loss: 0.7404, test_loss: 0.8744, test_f1: 0.5805
 epoch: 16, train_loss: 0.7415, test_loss: 0.8828, test_f1: 0.5842
 epoch: 17, train_loss: 0.7150, test_loss: 0.9301, test_f1: 0.5482
 epoch: 18, train_loss: 0.7162, test_loss: 0.8291, test_f1: 0.5665
 epoch: 19, train_loss: 0.7167, test_loss: 0.8756, test_f1: 0.5915
 epoch: 20, train_loss: 0.7082, test_loss: 0.8989, test_f1: 0.5768
 epoch: 21, train_loss: 0.6789, test_loss: 0.8638, test_f1: 0.6106
 epoch: 22, train_loss: 0.6832, test_loss: 0.9042, test_f1: 0.5977
 epoch: 23, train_loss: 0.6679, test_loss: 0.8946, test_f1: 0.6068
 epoch: 24, train_loss: 0.6669, test_loss: 0.9840, test_f1: 0.6218
 epoch: 25, train_loss: 0.6709, test_loss: 0.9967, test_f1: 0.6032
 epoch: 26, train_loss: 0.6623, test_loss: 0.9609, test_f1: 0.5921
 epoch: 27, train_loss: 0.6357, test_loss: 0.9049, test_f1: 0.6259
 epoch: 28, train_loss: 0.6417, test_loss: 0.9633, test_f1: 0.6385
 epoch: 29, train_loss: 0.6305, test_loss: 1.0092, test_f1: 0.5730
 epoch: 30, train_loss: 0.6099, test_loss: 0.9196, test_f1: 0.6441
 epoch: 31, train_loss: 0.6152, test_loss: 0.9246, test_f1: 0.6238
 epoch: 32, train_loss: 0.5992, test_loss: 0.9744, test_f1: 0.6215
 epoch: 33, train_loss: 0.5846, test_loss: 1.0187, test_f1: 0.6287
 epoch: 34, train_loss: 0.5693, test_loss: 0.9654, test_f1: 0.6360
 epoch: 35, train_loss: 0.5780, test_loss: 0.9569, test_f1: 0.6419
 epoch: 36, train_loss: 0.5635, test_loss: 0.8898, test_f1: 0.6530
 epoch: 37, train_loss: 0.5686, test_loss: 0.9301, test_f1: 0.6356
 epoch: 38, train_loss: 0.5506, test_loss: 1.0211, test_f1: 0.6351
 epoch: 39, train_loss: 0.5531, test_loss: 0.9657, test_f1: 0.6584
 epoch: 40, train_loss: 0.5549, test_loss: 0.9926, test_f1: 0.6391
 epoch: 41, train_loss: 0.5394, test_loss: 0.9677, test_f1: 0.6394
 epoch: 42, train_loss: 0.5186, test_loss: 0.9718, test_f1: 0.6610
 epoch: 43, train_loss: 0.4924, test_loss: 0.9576, test_f1: 0.6538
 epoch: 44, train_loss: 0.4932, test_loss: 0.9770, test_f1: 0.6773
 epoch: 45, train_loss: 0.5062, test_loss: 1.0524, test_f1: 0.6671
 epoch: 46, train_loss: 0.4870, test_loss: 1.0713, test_f1: 0.6079
 epoch: 47, train_loss: 0.4883, test_loss: 1.2002, test_f1: 0.6181
 epoch: 48, train_loss: 0.4769, test_loss: 1.0519, test_f1: 0.6440
 epoch: 49, train_loss: 0.4791, test_loss: 1.0933, test_f1: 0.6573
 epoch: 50, train_loss: 0.4443, test_loss: 1.1126, test_f1: 0.6505
 epoch: 51, train_loss: 0.4477, test_loss: 1.0857, test_f1: 0.6561
 epoch: 52, train_loss: 0.4167, test_loss: 1.0323, test_f1: 0.6551
 epoch: 53, train_loss: 0.4221, test_loss: 1.0586, test_f1: 0.6647
 epoch: 54, train_loss: 0.3986, test_loss: 1.1209, test_f1: 0.6604
 epoch: 55, train_loss: 0.4039, test_loss: 1.0851, test_f1: 0.6563
 epoch: 56, train_loss: 0.4010, test_loss: 1.0558, test_f1: 0.6633
 epoch: 57, train_loss: 0.4053, test_loss: 1.0819, test_f1: 0.6573
 epoch: 58, train_loss: 0.3978, test_loss: 1.0791, test_f1: 0.6721
 epoch: 59, train_loss: 0.3738, test_loss: 1.1362, test_f1: 0.6681
 epoch: 60, train_loss: 0.3785, test_loss: 1.1840, test_f1: 0.6559
 epoch: 61, train_loss: 0.3907, test_loss: 1.2294, test_f1: 0.6355
 epoch: 62, train_loss: 0.3736, test_loss: 1.1030, test_f1: 0.6906
 epoch: 63, train_loss: 0.3602, test_loss: 1.2491, test_f1: 0.6625
 epoch: 64, train_loss: 0.3521, test_loss: 1.2106, test_f1: 0.6628
 epoch: 65, train_loss: 0.3669, test_loss: 1.2535, test_f1: 0.6620
 epoch: 66, train_loss: 0.3526, test_loss: 1.2074, test_f1: 0.6618
 epoch: 67, train_loss: 0.3639, test_loss: 1.2932, test_f1: 0.6596
 epoch: 68, train_loss: 0.3426, test_loss: 1.2103, test_f1: 0.6780
 epoch: 69, train_loss: 0.3512, test_loss: 1.2336, test_f1: 0.6555
 epoch: 70, train_loss: 0.3466, test_loss: 1.2461, test_f1: 0.6678
 epoch: 71, train_loss: 0.3473, test_loss: 1.2956, test_f1: 0.6607
 epoch: 72, train_loss: 0.3511, test_loss: 1.4268, test_f1: 0.6369
 epoch: 73, train_loss: 0.3471, test_loss: 1.2379, test_f1: 0.6681
 epoch: 74, train_loss: 0.3361, test_loss: 1.2911, test_f1: 0.6795
 epoch: 75, train_loss: 0.3307, test_loss: 1.4201, test_f1: 0.6315
 epoch: 76, train_loss: 0.3285, test_loss: 1.3080, test_f1: 0.6577
 epoch: 77, train_loss: 0.3267, test_loss: 1.3294, test_f1: 0.6688
 epoch: 78, train_loss: 0.3187, test_loss: 1.3451, test_f1: 0.6717
 epoch: 79, train_loss: 0.3307, test_loss: 1.3383, test_f1: 0.6493
 epoch: 80, train_loss: 0.3187, test_loss: 1.3076, test_f1: 0.6631
 epoch: 81, train_loss: 0.3038, test_loss: 1.3675, test_f1: 0.6637
 epoch: 82, train_loss: 0.3273, test_loss: 1.4951, test_f1: 0.6458
 epoch: 83, train_loss: 0.3063, test_loss: 1.2943, test_f1: 0.6475
 epoch: 84, train_loss: 0.2941, test_loss: 1.3737, test_f1: 0.6677
 epoch: 85, train_loss: 0.2982, test_loss: 1.4730, test_f1: 0.6364
 epoch: 86, train_loss: 0.2805, test_loss: 1.4090, test_f1: 0.6575
 epoch: 87, train_loss: 0.2938, test_loss: 1.5628, test_f1: 0.6571
 epoch: 88, train_loss: 0.2894, test_loss: 1.5570, test_f1: 0.6491
 epoch: 89, train_loss: 0.2870, test_loss: 1.3659, test_f1: 0.6762
 epoch: 90, train_loss: 0.2958, test_loss: 1.4869, test_f1: 0.6618
 epoch: 91, train_loss: 0.2954, test_loss: 1.5823, test_f1: 0.6559
 epoch: 92, train_loss: 0.2847, test_loss: 1.5730, test_f1: 0.6596
 epoch: 93, train_loss: 0.2773, test_loss: 1.4882, test_f1: 0.6617
 epoch: 94, train_loss: 0.2833, test_loss: 1.4514, test_f1: 0.6522
 epoch: 95, train_loss: 0.2793, test_loss: 1.3817, test_f1: 0.6902
 epoch: 96, train_loss: 0.2795, test_loss: 1.6647, test_f1: 0.6516
 epoch: 97, train_loss: 0.2875, test_loss: 1.6007, test_f1: 0.6524
 epoch: 98, train_loss: 0.2777, test_loss: 1.6771, test_f1: 0.6473
 epoch: 99, train_loss: 0.2650, test_loss: 1.4314, test_f1: 0.6882
##################ITERATION #4 ****************************************
 epoch: 0, train_loss: 1.4841, test_loss: 1.2859, test_f1: 0.2270
 epoch: 1, train_loss: 1.1046, test_loss: 1.2290, test_f1: 0.2297
 epoch: 2, train_loss: 1.0160, test_loss: 1.0431, test_f1: 0.3931
 epoch: 3, train_loss: 0.9572, test_loss: 0.9368, test_f1: 0.4710
 epoch: 4, train_loss: 0.9352, test_loss: 0.9126, test_f1: 0.4685
 epoch: 5, train_loss: 0.9141, test_loss: 0.9008, test_f1: 0.5281
 epoch: 6, train_loss: 0.8892, test_loss: 0.9076, test_f1: 0.5215
 epoch: 7, train_loss: 0.8725, test_loss: 0.8794, test_f1: 0.5611
 epoch: 8, train_loss: 0.8519, test_loss: 0.9023, test_f1: 0.5516
 epoch: 9, train_loss: 0.8385, test_loss: 0.9607, test_f1: 0.4914
 epoch: 10, train_loss: 0.8290, test_loss: 0.8719, test_f1: 0.5942
 epoch: 11, train_loss: 0.8222, test_loss: 0.8981, test_f1: 0.5451
 epoch: 12, train_loss: 0.7966, test_loss: 0.9244, test_f1: 0.5356
 epoch: 13, train_loss: 0.7750, test_loss: 0.8507, test_f1: 0.5802
 epoch: 14, train_loss: 0.7650, test_loss: 0.8902, test_f1: 0.5723
 epoch: 15, train_loss: 0.7718, test_loss: 0.9156, test_f1: 0.5733
 epoch: 16, train_loss: 0.7610, test_loss: 0.8081, test_f1: 0.6160
 epoch: 17, train_loss: 0.7390, test_loss: 0.8932, test_f1: 0.5985
 epoch: 18, train_loss: 0.7230, test_loss: 0.8412, test_f1: 0.6014
 epoch: 19, train_loss: 0.7196, test_loss: 0.9298, test_f1: 0.5703
 epoch: 20, train_loss: 0.7178, test_loss: 0.9020, test_f1: 0.6202
 epoch: 21, train_loss: 0.7039, test_loss: 0.9286, test_f1: 0.5866
 epoch: 22, train_loss: 0.6952, test_loss: 0.9127, test_f1: 0.6306
 epoch: 23, train_loss: 0.6741, test_loss: 0.8929, test_f1: 0.5926
 epoch: 24, train_loss: 0.6670, test_loss: 0.9206, test_f1: 0.6079
 epoch: 25, train_loss: 0.6658, test_loss: 0.8830, test_f1: 0.6087
 epoch: 26, train_loss: 0.6540, test_loss: 0.9077, test_f1: 0.6274
 epoch: 27, train_loss: 0.6416, test_loss: 0.8492, test_f1: 0.6026
 epoch: 28, train_loss: 0.6595, test_loss: 0.8864, test_f1: 0.6305
 epoch: 29, train_loss: 0.6275, test_loss: 0.9170, test_f1: 0.6198
 epoch: 30, train_loss: 0.6148, test_loss: 0.9968, test_f1: 0.6086
 epoch: 31, train_loss: 0.6149, test_loss: 0.9114, test_f1: 0.6419
 epoch: 32, train_loss: 0.6049, test_loss: 0.9431, test_f1: 0.6542
 epoch: 33, train_loss: 0.6042, test_loss: 0.9319, test_f1: 0.5984
 epoch: 34, train_loss: 0.5836, test_loss: 0.9592, test_f1: 0.6212
 epoch: 35, train_loss: 0.5921, test_loss: 1.0120, test_f1: 0.6294
 epoch: 36, train_loss: 0.5617, test_loss: 0.9733, test_f1: 0.6353
 epoch: 37, train_loss: 0.5687, test_loss: 0.9844, test_f1: 0.6168
 epoch: 38, train_loss: 0.5593, test_loss: 0.9896, test_f1: 0.6590
 epoch: 39, train_loss: 0.5542, test_loss: 0.9654, test_f1: 0.6189
 epoch: 40, train_loss: 0.5411, test_loss: 1.0436, test_f1: 0.6353
 epoch: 41, train_loss: 0.5447, test_loss: 1.0108, test_f1: 0.6422
 epoch: 42, train_loss: 0.5349, test_loss: 1.0315, test_f1: 0.6239
 epoch: 43, train_loss: 0.5164, test_loss: 1.0363, test_f1: 0.6729
 epoch: 44, train_loss: 0.5190, test_loss: 0.9962, test_f1: 0.6608
 epoch: 45, train_loss: 0.5038, test_loss: 1.0775, test_f1: 0.6792
 epoch: 46, train_loss: 0.5073, test_loss: 0.9849, test_f1: 0.6755
 epoch: 47, train_loss: 0.5010, test_loss: 1.0682, test_f1: 0.6407
 epoch: 48, train_loss: 0.5018, test_loss: 1.0551, test_f1: 0.6132
 epoch: 49, train_loss: 0.4936, test_loss: 1.0409, test_f1: 0.6510
 epoch: 50, train_loss: 0.4964, test_loss: 1.0742, test_f1: 0.6456
 epoch: 51, train_loss: 0.4784, test_loss: 1.0794, test_f1: 0.6759
 epoch: 52, train_loss: 0.4533, test_loss: 1.1269, test_f1: 0.6402
 epoch: 53, train_loss: 0.4418, test_loss: 1.1186, test_f1: 0.6470
 epoch: 54, train_loss: 0.4268, test_loss: 1.0800, test_f1: 0.6558
 epoch: 55, train_loss: 0.4179, test_loss: 1.1220, test_f1: 0.6693
 epoch: 56, train_loss: 0.4126, test_loss: 1.1230, test_f1: 0.6739
 epoch: 57, train_loss: 0.3977, test_loss: 1.0925, test_f1: 0.6769
 epoch: 58, train_loss: 0.3982, test_loss: 1.1559, test_f1: 0.6534
 epoch: 59, train_loss: 0.3916, test_loss: 1.1448, test_f1: 0.6668
 epoch: 60, train_loss: 0.4019, test_loss: 1.1916, test_f1: 0.6755
 epoch: 61, train_loss: 0.3877, test_loss: 1.1821, test_f1: 0.6708
 epoch: 62, train_loss: 0.3956, test_loss: 1.1644, test_f1: 0.6672
 epoch: 63, train_loss: 0.3820, test_loss: 1.2911, test_f1: 0.6538
 epoch: 64, train_loss: 0.3908, test_loss: 1.2663, test_f1: 0.6495
 epoch: 65, train_loss: 0.3869, test_loss: 1.2159, test_f1: 0.6737
 epoch: 66, train_loss: 0.3747, test_loss: 1.2107, test_f1: 0.6696
 epoch: 67, train_loss: 0.3808, test_loss: 1.2630, test_f1: 0.6434
 epoch: 68, train_loss: 0.3489, test_loss: 1.3068, test_f1: 0.6543
 epoch: 69, train_loss: 0.3594, test_loss: 1.1993, test_f1: 0.6557
 epoch: 70, train_loss: 0.3618, test_loss: 1.2383, test_f1: 0.6645
 epoch: 71, train_loss: 0.3577, test_loss: 1.3299, test_f1: 0.6581
 epoch: 72, train_loss: 0.3449, test_loss: 1.2520, test_f1: 0.6642
 epoch: 73, train_loss: 0.3590, test_loss: 1.3598, test_f1: 0.6414
 epoch: 74, train_loss: 0.3472, test_loss: 1.2440, test_f1: 0.6695
 epoch: 75, train_loss: 0.3326, test_loss: 1.2716, test_f1: 0.6745
 epoch: 76, train_loss: 0.3355, test_loss: 1.3504, test_f1: 0.6810
 epoch: 77, train_loss: 0.3223, test_loss: 1.3049, test_f1: 0.6510
 epoch: 78, train_loss: 0.3269, test_loss: 1.3603, test_f1: 0.6414
 epoch: 79, train_loss: 0.3260, test_loss: 1.4218, test_f1: 0.6428
 epoch: 80, train_loss: 0.3222, test_loss: 1.3410, test_f1: 0.6577
 epoch: 81, train_loss: 0.3301, test_loss: 1.3531, test_f1: 0.6624
 epoch: 82, train_loss: 0.3239, test_loss: 1.3693, test_f1: 0.6624
 epoch: 83, train_loss: 0.3204, test_loss: 1.3476, test_f1: 0.6594
 epoch: 84, train_loss: 0.3125, test_loss: 1.4373, test_f1: 0.6654
 epoch: 85, train_loss: 0.3122, test_loss: 1.4219, test_f1: 0.6659
 epoch: 86, train_loss: 0.3104, test_loss: 1.3746, test_f1: 0.6423
 epoch: 87, train_loss: 0.3147, test_loss: 1.4117, test_f1: 0.6618
 epoch: 88, train_loss: 0.3030, test_loss: 1.4510, test_f1: 0.6702
 epoch: 89, train_loss: 0.3013, test_loss: 1.3946, test_f1: 0.6743
 epoch: 90, train_loss: 0.2947, test_loss: 1.4238, test_f1: 0.6498
 epoch: 91, train_loss: 0.3100, test_loss: 1.4850, test_f1: 0.6606
 epoch: 92, train_loss: 0.2989, test_loss: 1.4788, test_f1: 0.6561
 epoch: 93, train_loss: 0.2926, test_loss: 1.4429, test_f1: 0.6501
 epoch: 94, train_loss: 0.3079, test_loss: 1.5226, test_f1: 0.6613
 epoch: 95, train_loss: 0.2747, test_loss: 1.5082, test_f1: 0.6440
 epoch: 96, train_loss: 0.2900, test_loss: 1.4416, test_f1: 0.6459
 epoch: 97, train_loss: 0.2962, test_loss: 1.4951, test_f1: 0.6717
 epoch: 98, train_loss: 0.2951, test_loss: 1.4481, test_f1: 0.6625
 epoch: 99, train_loss: 0.2783, test_loss: 1.4810, test_f1: 0.6576
##################ITERATION #5 ****************************************
 epoch: 0, train_loss: 1.8031, test_loss: 1.3830, test_f1: 0.2270
 epoch: 1, train_loss: 1.1230, test_loss: 1.3145, test_f1: 0.3088
 epoch: 2, train_loss: 1.0268, test_loss: 1.0566, test_f1: 0.3776
 epoch: 3, train_loss: 0.9768, test_loss: 0.9834, test_f1: 0.4456
 epoch: 4, train_loss: 0.9360, test_loss: 0.9413, test_f1: 0.5105
 epoch: 5, train_loss: 0.9284, test_loss: 0.9594, test_f1: 0.4715
 epoch: 6, train_loss: 0.9121, test_loss: 0.9391, test_f1: 0.5056
 epoch: 7, train_loss: 0.8831, test_loss: 0.9209, test_f1: 0.5164
 epoch: 8, train_loss: 0.8709, test_loss: 0.8798, test_f1: 0.5205
 epoch: 9, train_loss: 0.8584, test_loss: 0.8903, test_f1: 0.5343
 epoch: 10, train_loss: 0.8438, test_loss: 0.9235, test_f1: 0.5592
 epoch: 11, train_loss: 0.8259, test_loss: 0.8829, test_f1: 0.5793
 epoch: 12, train_loss: 0.8151, test_loss: 0.9843, test_f1: 0.5173
 epoch: 13, train_loss: 0.7994, test_loss: 0.9249, test_f1: 0.5303
 epoch: 14, train_loss: 0.7970, test_loss: 0.9469, test_f1: 0.5546
 epoch: 15, train_loss: 0.7878, test_loss: 0.9237, test_f1: 0.5622
 epoch: 16, train_loss: 0.7774, test_loss: 0.9215, test_f1: 0.5579
 epoch: 17, train_loss: 0.7616, test_loss: 0.9316, test_f1: 0.5353
 epoch: 18, train_loss: 0.7609, test_loss: 0.9111, test_f1: 0.5781
 epoch: 19, train_loss: 0.7348, test_loss: 0.9147, test_f1: 0.6008
 epoch: 20, train_loss: 0.7255, test_loss: 0.9478, test_f1: 0.5710
 epoch: 21, train_loss: 0.7262, test_loss: 0.9345, test_f1: 0.5985
 epoch: 22, train_loss: 0.7090, test_loss: 0.9806, test_f1: 0.6049
 epoch: 23, train_loss: 0.7094, test_loss: 0.9779, test_f1: 0.5973
 epoch: 24, train_loss: 0.6876, test_loss: 0.9391, test_f1: 0.6254
 epoch: 25, train_loss: 0.6776, test_loss: 0.9763, test_f1: 0.6027
 epoch: 26, train_loss: 0.6871, test_loss: 0.9373, test_f1: 0.6174
 epoch: 27, train_loss: 0.6755, test_loss: 0.9837, test_f1: 0.5884
 epoch: 28, train_loss: 0.6663, test_loss: 0.9313, test_f1: 0.5956
 epoch: 29, train_loss: 0.6771, test_loss: 1.0119, test_f1: 0.5796
 epoch: 30, train_loss: 0.6737, test_loss: 0.9643, test_f1: 0.5945
 epoch: 31, train_loss: 0.6503, test_loss: 1.0625, test_f1: 0.5910
 epoch: 32, train_loss: 0.6269, test_loss: 0.9259, test_f1: 0.6422
 epoch: 33, train_loss: 0.6106, test_loss: 1.1094, test_f1: 0.5622
 epoch: 34, train_loss: 0.6161, test_loss: 0.9284, test_f1: 0.6483
 epoch: 35, train_loss: 0.6148, test_loss: 0.9919, test_f1: 0.6497
 epoch: 36, train_loss: 0.5963, test_loss: 0.9838, test_f1: 0.6531
 epoch: 37, train_loss: 0.6056, test_loss: 0.9949, test_f1: 0.6443
 epoch: 38, train_loss: 0.5761, test_loss: 0.9643, test_f1: 0.5951
 epoch: 39, train_loss: 0.5888, test_loss: 1.0204, test_f1: 0.6399
 epoch: 40, train_loss: 0.5745, test_loss: 0.9490, test_f1: 0.6476
 epoch: 41, train_loss: 0.5558, test_loss: 1.0113, test_f1: 0.5975
 epoch: 42, train_loss: 0.5668, test_loss: 1.0029, test_f1: 0.6460
 epoch: 43, train_loss: 0.5520, test_loss: 1.0053, test_f1: 0.6166
 epoch: 44, train_loss: 0.5475, test_loss: 1.0622, test_f1: 0.6307
 epoch: 45, train_loss: 0.5332, test_loss: 1.0312, test_f1: 0.6380
 epoch: 46, train_loss: 0.5341, test_loss: 1.0704, test_f1: 0.6691
 epoch: 47, train_loss: 0.5300, test_loss: 0.9814, test_f1: 0.6511
 epoch: 48, train_loss: 0.5208, test_loss: 1.0984, test_f1: 0.6121
 epoch: 49, train_loss: 0.5024, test_loss: 1.0625, test_f1: 0.6476
 epoch: 50, train_loss: 0.5041, test_loss: 1.1149, test_f1: 0.6586
 epoch: 51, train_loss: 0.4758, test_loss: 1.0463, test_f1: 0.6513
 epoch: 52, train_loss: 0.4687, test_loss: 1.0257, test_f1: 0.6700
 epoch: 53, train_loss: 0.4405, test_loss: 1.0827, test_f1: 0.6376
 epoch: 54, train_loss: 0.4514, test_loss: 1.0624, test_f1: 0.6588
 epoch: 55, train_loss: 0.4238, test_loss: 1.0795, test_f1: 0.6719
 epoch: 56, train_loss: 0.4463, test_loss: 1.1092, test_f1: 0.6483
 epoch: 57, train_loss: 0.4318, test_loss: 1.0988, test_f1: 0.6779
 epoch: 58, train_loss: 0.4231, test_loss: 1.1485, test_f1: 0.6571
 epoch: 59, train_loss: 0.4272, test_loss: 1.1694, test_f1: 0.6621
 epoch: 60, train_loss: 0.4197, test_loss: 1.1865, test_f1: 0.6869
 epoch: 61, train_loss: 0.4307, test_loss: 1.1407, test_f1: 0.6657
 epoch: 62, train_loss: 0.4288, test_loss: 1.2123, test_f1: 0.6581
 epoch: 63, train_loss: 0.4297, test_loss: 1.1603, test_f1: 0.6520
 epoch: 64, train_loss: 0.4122, test_loss: 1.1774, test_f1: 0.6564
 epoch: 65, train_loss: 0.4042, test_loss: 1.2083, test_f1: 0.6251
 epoch: 66, train_loss: 0.3870, test_loss: 1.1226, test_f1: 0.6915
 epoch: 67, train_loss: 0.3877, test_loss: 1.1698, test_f1: 0.6904
 epoch: 68, train_loss: 0.3851, test_loss: 1.2479, test_f1: 0.6468
 epoch: 69, train_loss: 0.3794, test_loss: 1.2087, test_f1: 0.6768
 epoch: 70, train_loss: 0.3807, test_loss: 1.1634, test_f1: 0.6779
 epoch: 71, train_loss: 0.3623, test_loss: 1.2241, test_f1: 0.6430
 epoch: 72, train_loss: 0.3792, test_loss: 1.2932, test_f1: 0.6759
 epoch: 73, train_loss: 0.3638, test_loss: 1.2410, test_f1: 0.6820
 epoch: 74, train_loss: 0.3599, test_loss: 1.2671, test_f1: 0.6591
 epoch: 75, train_loss: 0.3602, test_loss: 1.3060, test_f1: 0.6640
 epoch: 76, train_loss: 0.3566, test_loss: 1.3136, test_f1: 0.6736
 epoch: 77, train_loss: 0.3498, test_loss: 1.3812, test_f1: 0.6378
 epoch: 78, train_loss: 0.3672, test_loss: 1.4567, test_f1: 0.6365
 epoch: 79, train_loss: 0.3632, test_loss: 1.1965, test_f1: 0.6718
 epoch: 80, train_loss: 0.3518, test_loss: 1.3459, test_f1: 0.6697
 epoch: 81, train_loss: 0.3556, test_loss: 1.2485, test_f1: 0.6702
 epoch: 82, train_loss: 0.3452, test_loss: 1.3117, test_f1: 0.6629
 epoch: 83, train_loss: 0.3533, test_loss: 1.2938, test_f1: 0.6708
 epoch: 84, train_loss: 0.3428, test_loss: 1.3661, test_f1: 0.6379
 epoch: 85, train_loss: 0.3513, test_loss: 1.2887, test_f1: 0.6436
 epoch: 86, train_loss: 0.3363, test_loss: 1.2301, test_f1: 0.6795
 epoch: 87, train_loss: 0.3288, test_loss: 1.3687, test_f1: 0.6770
 epoch: 88, train_loss: 0.3327, test_loss: 1.5084, test_f1: 0.6491
 epoch: 89, train_loss: 0.3343, test_loss: 1.4232, test_f1: 0.6745
 epoch: 90, train_loss: 0.3194, test_loss: 1.3718, test_f1: 0.6504
 epoch: 91, train_loss: 0.3117, test_loss: 1.3555, test_f1: 0.6593
 epoch: 92, train_loss: 0.2939, test_loss: 1.3885, test_f1: 0.6601
 epoch: 93, train_loss: 0.3022, test_loss: 1.6080, test_f1: 0.6231
 epoch: 94, train_loss: 0.2982, test_loss: 1.4230, test_f1: 0.7004
 epoch: 95, train_loss: 0.3070, test_loss: 1.5038, test_f1: 0.6428
 epoch: 96, train_loss: 0.3059, test_loss: 1.4862, test_f1: 0.6537
 epoch: 97, train_loss: 0.3094, test_loss: 1.5110, test_f1: 0.6749
 epoch: 98, train_loss: 0.3069, test_loss: 1.4390, test_f1: 0.6589
 epoch: 99, train_loss: 0.2887, test_loss: 1.5172, test_f1: 0.6852
##################ITERATION #6 ****************************************
 epoch: 0, train_loss: 1.7473, test_loss: 1.4227, test_f1: 0.2270
 epoch: 1, train_loss: 1.0866, test_loss: 1.2158, test_f1: 0.2529
 epoch: 2, train_loss: 0.9922, test_loss: 1.0236, test_f1: 0.4169
 epoch: 3, train_loss: 0.9613, test_loss: 0.9794, test_f1: 0.4460
 epoch: 4, train_loss: 0.9254, test_loss: 0.9357, test_f1: 0.4751
 epoch: 5, train_loss: 0.8950, test_loss: 0.9284, test_f1: 0.5407
 epoch: 6, train_loss: 0.8867, test_loss: 0.9020, test_f1: 0.4927
 epoch: 7, train_loss: 0.8615, test_loss: 0.8675, test_f1: 0.5606
 epoch: 8, train_loss: 0.8420, test_loss: 0.9094, test_f1: 0.5732
 epoch: 9, train_loss: 0.8366, test_loss: 0.9126, test_f1: 0.5446
 epoch: 10, train_loss: 0.8153, test_loss: 0.8783, test_f1: 0.5968
 epoch: 11, train_loss: 0.7901, test_loss: 0.9022, test_f1: 0.5529
 epoch: 12, train_loss: 0.7882, test_loss: 0.9068, test_f1: 0.5412
 epoch: 13, train_loss: 0.7920, test_loss: 0.8884, test_f1: 0.5836
 epoch: 14, train_loss: 0.7653, test_loss: 0.9116, test_f1: 0.6082
 epoch: 15, train_loss: 0.7524, test_loss: 0.9093, test_f1: 0.5424
 epoch: 16, train_loss: 0.7509, test_loss: 0.9052, test_f1: 0.5707
 epoch: 17, train_loss: 0.7369, test_loss: 0.8822, test_f1: 0.6068
 epoch: 18, train_loss: 0.7175, test_loss: 0.8962, test_f1: 0.5673
 epoch: 19, train_loss: 0.7057, test_loss: 0.9188, test_f1: 0.5688
 epoch: 20, train_loss: 0.6959, test_loss: 0.9541, test_f1: 0.5590
 epoch: 21, train_loss: 0.7030, test_loss: 0.9241, test_f1: 0.6297
 epoch: 22, train_loss: 0.7007, test_loss: 0.9119, test_f1: 0.6098
 epoch: 23, train_loss: 0.6873, test_loss: 0.9379, test_f1: 0.5703
 epoch: 24, train_loss: 0.6605, test_loss: 0.9543, test_f1: 0.6294
 epoch: 25, train_loss: 0.6402, test_loss: 0.9822, test_f1: 0.5931
 epoch: 26, train_loss: 0.6518, test_loss: 0.9435, test_f1: 0.5604
 epoch: 27, train_loss: 0.6456, test_loss: 0.9289, test_f1: 0.6111
 epoch: 28, train_loss: 0.6373, test_loss: 1.0255, test_f1: 0.5894
 epoch: 29, train_loss: 0.6228, test_loss: 0.9832, test_f1: 0.5945
 epoch: 30, train_loss: 0.6275, test_loss: 0.9882, test_f1: 0.5969
 epoch: 31, train_loss: 0.6212, test_loss: 0.9361, test_f1: 0.6108
 epoch: 32, train_loss: 0.6119, test_loss: 0.9639, test_f1: 0.6307
 epoch: 33, train_loss: 0.5884, test_loss: 0.9539, test_f1: 0.6429
 epoch: 34, train_loss: 0.5919, test_loss: 1.0418, test_f1: 0.5848
 epoch: 35, train_loss: 0.5846, test_loss: 0.9601, test_f1: 0.6250
 epoch: 36, train_loss: 0.5925, test_loss: 1.0015, test_f1: 0.6494
 epoch: 37, train_loss: 0.5776, test_loss: 0.9978, test_f1: 0.6259
 epoch: 38, train_loss: 0.5697, test_loss: 1.2815, test_f1: 0.5739
 epoch: 39, train_loss: 0.5543, test_loss: 0.9705, test_f1: 0.6165
 epoch: 40, train_loss: 0.5549, test_loss: 1.0111, test_f1: 0.5831
 epoch: 41, train_loss: 0.5466, test_loss: 1.0638, test_f1: 0.6336
 epoch: 42, train_loss: 0.5236, test_loss: 1.0851, test_f1: 0.6089
 epoch: 43, train_loss: 0.5398, test_loss: 1.0441, test_f1: 0.6283
 epoch: 44, train_loss: 0.5371, test_loss: 1.1078, test_f1: 0.6107
 epoch: 45, train_loss: 0.4992, test_loss: 1.0361, test_f1: 0.6228
 epoch: 46, train_loss: 0.5089, test_loss: 1.1228, test_f1: 0.6031
 epoch: 47, train_loss: 0.5040, test_loss: 1.1297, test_f1: 0.5860
 epoch: 48, train_loss: 0.4982, test_loss: 1.0885, test_f1: 0.6260
 epoch: 49, train_loss: 0.4767, test_loss: 1.0732, test_f1: 0.6199
 epoch: 50, train_loss: 0.4615, test_loss: 1.1666, test_f1: 0.5882
 epoch: 51, train_loss: 0.4389, test_loss: 1.0418, test_f1: 0.6348
 epoch: 52, train_loss: 0.4327, test_loss: 1.2285, test_f1: 0.6073
 epoch: 53, train_loss: 0.4126, test_loss: 1.1422, test_f1: 0.6232
 epoch: 54, train_loss: 0.4058, test_loss: 1.1722, test_f1: 0.6199
 epoch: 55, train_loss: 0.4141, test_loss: 1.1765, test_f1: 0.6387
 epoch: 56, train_loss: 0.3924, test_loss: 1.0973, test_f1: 0.6429
 epoch: 57, train_loss: 0.4032, test_loss: 1.1270, test_f1: 0.6416
 epoch: 58, train_loss: 0.3906, test_loss: 1.2274, test_f1: 0.6151
 epoch: 59, train_loss: 0.4005, test_loss: 1.1715, test_f1: 0.6372
 epoch: 60, train_loss: 0.3958, test_loss: 1.2208, test_f1: 0.6469
 epoch: 61, train_loss: 0.3981, test_loss: 1.1822, test_f1: 0.6295
 epoch: 62, train_loss: 0.4048, test_loss: 1.1689, test_f1: 0.6393
 epoch: 63, train_loss: 0.3786, test_loss: 1.2153, test_f1: 0.6500
 epoch: 64, train_loss: 0.3706, test_loss: 1.1792, test_f1: 0.6236
 epoch: 65, train_loss: 0.3548, test_loss: 1.1628, test_f1: 0.6121
 epoch: 66, train_loss: 0.3609, test_loss: 1.2742, test_f1: 0.6256
 epoch: 67, train_loss: 0.3590, test_loss: 1.2644, test_f1: 0.6180
 epoch: 68, train_loss: 0.3543, test_loss: 1.3157, test_f1: 0.6221
 epoch: 69, train_loss: 0.3549, test_loss: 1.3069, test_f1: 0.6243
 epoch: 70, train_loss: 0.3503, test_loss: 1.1921, test_f1: 0.6341
 epoch: 71, train_loss: 0.3777, test_loss: 1.2726, test_f1: 0.6490
 epoch: 72, train_loss: 0.3561, test_loss: 1.2675, test_f1: 0.6379
 epoch: 73, train_loss: 0.3492, test_loss: 1.2541, test_f1: 0.6473
 epoch: 74, train_loss: 0.3405, test_loss: 1.2942, test_f1: 0.6338
 epoch: 75, train_loss: 0.3315, test_loss: 1.2737, test_f1: 0.6385
 epoch: 76, train_loss: 0.3368, test_loss: 1.3210, test_f1: 0.6438
 epoch: 77, train_loss: 0.3335, test_loss: 1.2853, test_f1: 0.6542
 epoch: 78, train_loss: 0.3253, test_loss: 1.3502, test_f1: 0.6325
 epoch: 79, train_loss: 0.3349, test_loss: 1.5007, test_f1: 0.6165
 epoch: 80, train_loss: 0.3455, test_loss: 1.3622, test_f1: 0.6208
 epoch: 81, train_loss: 0.3409, test_loss: 1.3262, test_f1: 0.6397
 epoch: 82, train_loss: 0.3345, test_loss: 1.4090, test_f1: 0.6118
 epoch: 83, train_loss: 0.3211, test_loss: 1.4596, test_f1: 0.6060
 epoch: 84, train_loss: 0.3247, test_loss: 1.3561, test_f1: 0.6533
 epoch: 85, train_loss: 0.3259, test_loss: 1.7596, test_f1: 0.6132
 epoch: 86, train_loss: 0.3328, test_loss: 1.3328, test_f1: 0.6344
 epoch: 87, train_loss: 0.3186, test_loss: 1.4734, test_f1: 0.6494
 epoch: 88, train_loss: 0.3082, test_loss: 1.3815, test_f1: 0.6457
 epoch: 89, train_loss: 0.3049, test_loss: 1.4543, test_f1: 0.6349
 epoch: 90, train_loss: 0.3141, test_loss: 1.3936, test_f1: 0.6386
 epoch: 91, train_loss: 0.3047, test_loss: 1.4690, test_f1: 0.6492
 epoch: 92, train_loss: 0.3065, test_loss: 1.5618, test_f1: 0.6396
 epoch: 93, train_loss: 0.3035, test_loss: 1.4301, test_f1: 0.6155
 epoch: 94, train_loss: 0.2936, test_loss: 1.4950, test_f1: 0.6650
 epoch: 95, train_loss: 0.2841, test_loss: 1.4732, test_f1: 0.6232
 epoch: 96, train_loss: 0.2820, test_loss: 1.6320, test_f1: 0.6191
 epoch: 97, train_loss: 0.2845, test_loss: 1.6109, test_f1: 0.6419
 epoch: 98, train_loss: 0.2994, test_loss: 1.4979, test_f1: 0.6371
 epoch: 99, train_loss: 0.2862, test_loss: 1.6303, test_f1: 0.6012
##################ITERATION #7 ****************************************
 epoch: 0, train_loss: 1.6005, test_loss: 1.4574, test_f1: 0.2417
 epoch: 1, train_loss: 1.1028, test_loss: 1.1174, test_f1: 0.3752
 epoch: 2, train_loss: 1.0080, test_loss: 0.9970, test_f1: 0.4318
 epoch: 3, train_loss: 0.9769, test_loss: 0.9610, test_f1: 0.4514
 epoch: 4, train_loss: 0.9444, test_loss: 0.9409, test_f1: 0.4917
 epoch: 5, train_loss: 0.9150, test_loss: 0.9317, test_f1: 0.4797
 epoch: 6, train_loss: 0.8915, test_loss: 0.8953, test_f1: 0.5231
 epoch: 7, train_loss: 0.8906, test_loss: 0.9271, test_f1: 0.4992
 epoch: 8, train_loss: 0.8680, test_loss: 0.8923, test_f1: 0.5275
 epoch: 9, train_loss: 0.8551, test_loss: 0.8962, test_f1: 0.5466
 epoch: 10, train_loss: 0.8322, test_loss: 0.8938, test_f1: 0.5468
 epoch: 11, train_loss: 0.8239, test_loss: 0.8894, test_f1: 0.5417
 epoch: 12, train_loss: 0.8104, test_loss: 0.8900, test_f1: 0.5434
 epoch: 13, train_loss: 0.8040, test_loss: 0.8733, test_f1: 0.5488
 epoch: 14, train_loss: 0.7960, test_loss: 0.9634, test_f1: 0.4947
 epoch: 15, train_loss: 0.7953, test_loss: 0.8883, test_f1: 0.5350
 epoch: 16, train_loss: 0.7811, test_loss: 0.8612, test_f1: 0.5608
 epoch: 17, train_loss: 0.7700, test_loss: 0.8863, test_f1: 0.5424
 epoch: 18, train_loss: 0.7579, test_loss: 0.8548, test_f1: 0.5677
 epoch: 19, train_loss: 0.7648, test_loss: 0.8707, test_f1: 0.5966
 epoch: 20, train_loss: 0.7436, test_loss: 0.9006, test_f1: 0.5669
 epoch: 21, train_loss: 0.7201, test_loss: 0.8749, test_f1: 0.6090
 epoch: 22, train_loss: 0.7281, test_loss: 0.8862, test_f1: 0.6022
 epoch: 23, train_loss: 0.7127, test_loss: 0.9144, test_f1: 0.5868
 epoch: 24, train_loss: 0.6862, test_loss: 0.9024, test_f1: 0.5907
 epoch: 25, train_loss: 0.6785, test_loss: 0.9430, test_f1: 0.5525
 epoch: 26, train_loss: 0.6848, test_loss: 0.9147, test_f1: 0.6016
 epoch: 27, train_loss: 0.6849, test_loss: 0.8969, test_f1: 0.5720
 epoch: 28, train_loss: 0.6777, test_loss: 0.9140, test_f1: 0.5694
 epoch: 29, train_loss: 0.6511, test_loss: 0.8980, test_f1: 0.6264
 epoch: 30, train_loss: 0.6643, test_loss: 0.9262, test_f1: 0.6085
 epoch: 31, train_loss: 0.6544, test_loss: 0.9409, test_f1: 0.6040
 epoch: 32, train_loss: 0.6745, test_loss: 0.9680, test_f1: 0.5728
 epoch: 33, train_loss: 0.6395, test_loss: 0.9787, test_f1: 0.5541
 epoch: 34, train_loss: 0.6309, test_loss: 0.9179, test_f1: 0.6033
 epoch: 35, train_loss: 0.6188, test_loss: 0.9250, test_f1: 0.6035
 epoch: 36, train_loss: 0.6143, test_loss: 0.9819, test_f1: 0.5939
 epoch: 37, train_loss: 0.6297, test_loss: 0.9439, test_f1: 0.6141
 epoch: 38, train_loss: 0.5939, test_loss: 0.9577, test_f1: 0.6066
 epoch: 39, train_loss: 0.6052, test_loss: 1.0020, test_f1: 0.5945
 epoch: 40, train_loss: 0.5971, test_loss: 0.9084, test_f1: 0.6320
 epoch: 41, train_loss: 0.5958, test_loss: 0.9384, test_f1: 0.6132
 epoch: 42, train_loss: 0.5962, test_loss: 0.9853, test_f1: 0.6328
 epoch: 43, train_loss: 0.5924, test_loss: 0.9671, test_f1: 0.6307
 epoch: 44, train_loss: 0.5798, test_loss: 0.9340, test_f1: 0.6160
 epoch: 45, train_loss: 0.5480, test_loss: 1.0246, test_f1: 0.6227
 epoch: 46, train_loss: 0.5367, test_loss: 1.0249, test_f1: 0.6245
 epoch: 47, train_loss: 0.5471, test_loss: 0.9921, test_f1: 0.6333
 epoch: 48, train_loss: 0.5300, test_loss: 1.0451, test_f1: 0.6298
 epoch: 49, train_loss: 0.5317, test_loss: 1.0409, test_f1: 0.6200
 epoch: 50, train_loss: 0.5179, test_loss: 1.1387, test_f1: 0.5823
 epoch: 51, train_loss: 0.4917, test_loss: 0.9759, test_f1: 0.6314
 epoch: 52, train_loss: 0.4924, test_loss: 1.0284, test_f1: 0.6455
 epoch: 53, train_loss: 0.4704, test_loss: 1.0057, test_f1: 0.6452
 epoch: 54, train_loss: 0.4602, test_loss: 1.0216, test_f1: 0.6502
 epoch: 55, train_loss: 0.4618, test_loss: 1.0860, test_f1: 0.6646
 epoch: 56, train_loss: 0.4601, test_loss: 1.0479, test_f1: 0.6128
 epoch: 57, train_loss: 0.4635, test_loss: 1.0406, test_f1: 0.6255
 epoch: 58, train_loss: 0.4592, test_loss: 1.0892, test_f1: 0.6449
 epoch: 59, train_loss: 0.4468, test_loss: 1.0937, test_f1: 0.6496
 epoch: 60, train_loss: 0.4557, test_loss: 1.0489, test_f1: 0.6448
 epoch: 61, train_loss: 0.4268, test_loss: 1.0727, test_f1: 0.6618
 epoch: 62, train_loss: 0.4288, test_loss: 1.1332, test_f1: 0.6419
 epoch: 63, train_loss: 0.4159, test_loss: 1.0620, test_f1: 0.6762
 epoch: 64, train_loss: 0.4160, test_loss: 1.1134, test_f1: 0.6445
 epoch: 65, train_loss: 0.4234, test_loss: 1.0534, test_f1: 0.6473
 epoch: 66, train_loss: 0.4090, test_loss: 1.0867, test_f1: 0.6593
 epoch: 67, train_loss: 0.4192, test_loss: 1.1401, test_f1: 0.6462
 epoch: 68, train_loss: 0.3979, test_loss: 1.1381, test_f1: 0.6548
 epoch: 69, train_loss: 0.4039, test_loss: 1.1708, test_f1: 0.6470
 epoch: 70, train_loss: 0.3933, test_loss: 1.1900, test_f1: 0.6254
 epoch: 71, train_loss: 0.4082, test_loss: 1.1367, test_f1: 0.6272
 epoch: 72, train_loss: 0.4011, test_loss: 1.1706, test_f1: 0.6441
 epoch: 73, train_loss: 0.3909, test_loss: 1.1934, test_f1: 0.6469
 epoch: 74, train_loss: 0.3815, test_loss: 1.1636, test_f1: 0.6351
 epoch: 75, train_loss: 0.3821, test_loss: 1.2002, test_f1: 0.6542
 epoch: 76, train_loss: 0.3829, test_loss: 1.1868, test_f1: 0.6547
 epoch: 77, train_loss: 0.3576, test_loss: 1.2520, test_f1: 0.6538
 epoch: 78, train_loss: 0.3696, test_loss: 1.2369, test_f1: 0.6555
 epoch: 79, train_loss: 0.3690, test_loss: 1.2698, test_f1: 0.6414
 epoch: 80, train_loss: 0.3702, test_loss: 1.2365, test_f1: 0.6370
 epoch: 81, train_loss: 0.3657, test_loss: 1.1777, test_f1: 0.6618
 epoch: 82, train_loss: 0.3534, test_loss: 1.3503, test_f1: 0.6154
 epoch: 83, train_loss: 0.3520, test_loss: 1.1696, test_f1: 0.6641
 epoch: 84, train_loss: 0.3559, test_loss: 1.3465, test_f1: 0.6437
 epoch: 85, train_loss: 0.3616, test_loss: 1.3348, test_f1: 0.6381
 epoch: 86, train_loss: 0.3504, test_loss: 1.3171, test_f1: 0.6169
 epoch: 87, train_loss: 0.3428, test_loss: 1.2543, test_f1: 0.6304
 epoch: 88, train_loss: 0.3425, test_loss: 1.2850, test_f1: 0.6387
 epoch: 89, train_loss: 0.3389, test_loss: 1.2636, test_f1: 0.6585
 epoch: 90, train_loss: 0.3452, test_loss: 1.3817, test_f1: 0.6400
 epoch: 91, train_loss: 0.3178, test_loss: 1.2850, test_f1: 0.6406
 epoch: 92, train_loss: 0.3442, test_loss: 1.2887, test_f1: 0.6399
 epoch: 93, train_loss: 0.3416, test_loss: 1.3196, test_f1: 0.6346
 epoch: 94, train_loss: 0.3276, test_loss: 1.2951, test_f1: 0.6149
 epoch: 95, train_loss: 0.3265, test_loss: 1.3499, test_f1: 0.6740
 epoch: 96, train_loss: 0.3353, test_loss: 1.3303, test_f1: 0.6417
 epoch: 97, train_loss: 0.3177, test_loss: 1.4981, test_f1: 0.6248
 epoch: 98, train_loss: 0.3235, test_loss: 1.3735, test_f1: 0.6482
 epoch: 99, train_loss: 0.3236, test_loss: 1.3564, test_f1: 0.6492
##################ITERATION #8 ****************************************
 epoch: 0, train_loss: 2.1047, test_loss: 1.6873, test_f1: 0.2483
 epoch: 1, train_loss: 1.1275, test_loss: 1.3337, test_f1: 0.2441
 epoch: 2, train_loss: 1.0305, test_loss: 1.0797, test_f1: 0.3609
 epoch: 3, train_loss: 0.9774, test_loss: 0.9438, test_f1: 0.4382
 epoch: 4, train_loss: 0.9406, test_loss: 0.9232, test_f1: 0.4970
 epoch: 5, train_loss: 0.9219, test_loss: 0.8934, test_f1: 0.5273
 epoch: 6, train_loss: 0.8976, test_loss: 0.9291, test_f1: 0.5109
 epoch: 7, train_loss: 0.8692, test_loss: 0.9093, test_f1: 0.5465
 epoch: 8, train_loss: 0.8718, test_loss: 0.8859, test_f1: 0.5419
 epoch: 9, train_loss: 0.8495, test_loss: 0.9061, test_f1: 0.5530
 epoch: 10, train_loss: 0.8391, test_loss: 0.9030, test_f1: 0.5508
 epoch: 11, train_loss: 0.8318, test_loss: 0.9039, test_f1: 0.5450
 epoch: 12, train_loss: 0.8192, test_loss: 0.9248, test_f1: 0.5278
 epoch: 13, train_loss: 0.8033, test_loss: 0.8656, test_f1: 0.5755
 epoch: 14, train_loss: 0.7957, test_loss: 0.8940, test_f1: 0.5691
 epoch: 15, train_loss: 0.7788, test_loss: 0.9036, test_f1: 0.5715
 epoch: 16, train_loss: 0.7812, test_loss: 0.9656, test_f1: 0.5428
 epoch: 17, train_loss: 0.7556, test_loss: 0.9322, test_f1: 0.5699
 epoch: 18, train_loss: 0.7620, test_loss: 0.9034, test_f1: 0.5770
 epoch: 19, train_loss: 0.7539, test_loss: 0.9331, test_f1: 0.5927
 epoch: 20, train_loss: 0.7460, test_loss: 0.9194, test_f1: 0.5797
 epoch: 21, train_loss: 0.7382, test_loss: 0.8721, test_f1: 0.6172
 epoch: 22, train_loss: 0.7211, test_loss: 1.0185, test_f1: 0.5705
 epoch: 23, train_loss: 0.7116, test_loss: 0.9202, test_f1: 0.5959
 epoch: 24, train_loss: 0.7148, test_loss: 0.9528, test_f1: 0.5741
 epoch: 25, train_loss: 0.6853, test_loss: 0.9143, test_f1: 0.5853
 epoch: 26, train_loss: 0.6809, test_loss: 0.9669, test_f1: 0.5750
 epoch: 27, train_loss: 0.7024, test_loss: 0.9217, test_f1: 0.5999
 epoch: 28, train_loss: 0.6898, test_loss: 0.9789, test_f1: 0.5772
 epoch: 29, train_loss: 0.6651, test_loss: 0.9842, test_f1: 0.6213
 epoch: 30, train_loss: 0.6818, test_loss: 0.9975, test_f1: 0.5907
 epoch: 31, train_loss: 0.6562, test_loss: 0.9375, test_f1: 0.5839
 epoch: 32, train_loss: 0.6705, test_loss: 0.9013, test_f1: 0.6021
 epoch: 33, train_loss: 0.6638, test_loss: 0.9507, test_f1: 0.6023
 epoch: 34, train_loss: 0.6253, test_loss: 1.1127, test_f1: 0.5931
 epoch: 35, train_loss: 0.6362, test_loss: 0.9993, test_f1: 0.5731
 epoch: 36, train_loss: 0.6217, test_loss: 0.9113, test_f1: 0.6026
 epoch: 37, train_loss: 0.6138, test_loss: 0.9195, test_f1: 0.6236
 epoch: 38, train_loss: 0.6163, test_loss: 0.9849, test_f1: 0.6177
 epoch: 39, train_loss: 0.5944, test_loss: 1.0048, test_f1: 0.5985
 epoch: 40, train_loss: 0.6000, test_loss: 0.9939, test_f1: 0.6298
 epoch: 41, train_loss: 0.6232, test_loss: 0.9976, test_f1: 0.6242
 epoch: 42, train_loss: 0.5831, test_loss: 1.0207, test_f1: 0.6146
 epoch: 43, train_loss: 0.5602, test_loss: 1.0532, test_f1: 0.6303
 epoch: 44, train_loss: 0.5476, test_loss: 1.0398, test_f1: 0.6122
 epoch: 45, train_loss: 0.5475, test_loss: 1.0242, test_f1: 0.5933
 epoch: 46, train_loss: 0.5462, test_loss: 1.0387, test_f1: 0.6213
 epoch: 47, train_loss: 0.5393, test_loss: 1.0421, test_f1: 0.6468
 epoch: 48, train_loss: 0.5439, test_loss: 1.0034, test_f1: 0.6171
 epoch: 49, train_loss: 0.5229, test_loss: 1.0839, test_f1: 0.6318
 epoch: 50, train_loss: 0.5166, test_loss: 1.0608, test_f1: 0.6110
 epoch: 51, train_loss: 0.4935, test_loss: 1.0602, test_f1: 0.6450
 epoch: 52, train_loss: 0.4563, test_loss: 1.0516, test_f1: 0.6603
 epoch: 53, train_loss: 0.4588, test_loss: 1.0918, test_f1: 0.6388
 epoch: 54, train_loss: 0.4596, test_loss: 1.0833, test_f1: 0.6484
 epoch: 55, train_loss: 0.4407, test_loss: 1.1166, test_f1: 0.6446
 epoch: 56, train_loss: 0.4536, test_loss: 1.1065, test_f1: 0.6400
 epoch: 57, train_loss: 0.4397, test_loss: 1.1926, test_f1: 0.6217
 epoch: 58, train_loss: 0.4437, test_loss: 1.1906, test_f1: 0.6152
 epoch: 59, train_loss: 0.4274, test_loss: 1.2319, test_f1: 0.6266
 epoch: 60, train_loss: 0.4295, test_loss: 1.1547, test_f1: 0.6215
 epoch: 61, train_loss: 0.4303, test_loss: 1.1276, test_f1: 0.6422
 epoch: 62, train_loss: 0.4254, test_loss: 1.1755, test_f1: 0.6292
 epoch: 63, train_loss: 0.4109, test_loss: 1.1884, test_f1: 0.6418
 epoch: 64, train_loss: 0.4066, test_loss: 1.1603, test_f1: 0.6429
 epoch: 65, train_loss: 0.4022, test_loss: 1.2498, test_f1: 0.6184
 epoch: 66, train_loss: 0.3900, test_loss: 1.1870, test_f1: 0.6293
 epoch: 67, train_loss: 0.4116, test_loss: 1.1853, test_f1: 0.6200
 epoch: 68, train_loss: 0.3970, test_loss: 1.1817, test_f1: 0.6779
 epoch: 69, train_loss: 0.3897, test_loss: 1.2151, test_f1: 0.6590
 epoch: 70, train_loss: 0.3844, test_loss: 1.2418, test_f1: 0.6264
 epoch: 71, train_loss: 0.3961, test_loss: 1.2240, test_f1: 0.6552
 epoch: 72, train_loss: 0.3767, test_loss: 1.2261, test_f1: 0.6410
 epoch: 73, train_loss: 0.3836, test_loss: 1.2613, test_f1: 0.6386
 epoch: 74, train_loss: 0.3670, test_loss: 1.1701, test_f1: 0.6461
 epoch: 75, train_loss: 0.3820, test_loss: 1.3376, test_f1: 0.6308
 epoch: 76, train_loss: 0.3862, test_loss: 1.1819, test_f1: 0.6675
 epoch: 77, train_loss: 0.3734, test_loss: 1.1291, test_f1: 0.6501
 epoch: 78, train_loss: 0.3560, test_loss: 1.2783, test_f1: 0.6293
 epoch: 79, train_loss: 0.3671, test_loss: 1.3471, test_f1: 0.6119
 epoch: 80, train_loss: 0.3695, test_loss: 1.2788, test_f1: 0.6321
 epoch: 81, train_loss: 0.3626, test_loss: 1.2436, test_f1: 0.6378
 epoch: 82, train_loss: 0.3634, test_loss: 1.2528, test_f1: 0.6579
 epoch: 83, train_loss: 0.3640, test_loss: 1.1941, test_f1: 0.6458
 epoch: 84, train_loss: 0.3599, test_loss: 1.3546, test_f1: 0.6276
 epoch: 85, train_loss: 0.3494, test_loss: 1.2890, test_f1: 0.6286
 epoch: 86, train_loss: 0.3411, test_loss: 1.3180, test_f1: 0.6169
 epoch: 87, train_loss: 0.3558, test_loss: 1.3178, test_f1: 0.6214
 epoch: 88, train_loss: 0.3425, test_loss: 1.3409, test_f1: 0.6354
 epoch: 89, train_loss: 0.3256, test_loss: 1.3999, test_f1: 0.6325
 epoch: 90, train_loss: 0.3368, test_loss: 1.3081, test_f1: 0.6307
 epoch: 91, train_loss: 0.3427, test_loss: 1.3756, test_f1: 0.6257
 epoch: 92, train_loss: 0.3228, test_loss: 1.3404, test_f1: 0.6377
 epoch: 93, train_loss: 0.3287, test_loss: 1.4153, test_f1: 0.6402
 epoch: 94, train_loss: 0.3236, test_loss: 1.3708, test_f1: 0.6420
 epoch: 95, train_loss: 0.3383, test_loss: 1.4141, test_f1: 0.6376
 epoch: 96, train_loss: 0.3194, test_loss: 1.3586, test_f1: 0.6531
 epoch: 97, train_loss: 0.3084, test_loss: 1.4164, test_f1: 0.6173
 epoch: 98, train_loss: 0.3173, test_loss: 1.4406, test_f1: 0.6227
 epoch: 99, train_loss: 0.3054, test_loss: 1.3859, test_f1: 0.6451
##################ITERATION #9 ****************************************
 epoch: 0, train_loss: 1.7926, test_loss: 1.6410, test_f1: 0.2270
 epoch: 1, train_loss: 1.0810, test_loss: 1.2082, test_f1: 0.2801
 epoch: 2, train_loss: 0.9899, test_loss: 1.0231, test_f1: 0.3700
 epoch: 3, train_loss: 0.9546, test_loss: 0.9811, test_f1: 0.4019
 epoch: 4, train_loss: 0.9374, test_loss: 0.9334, test_f1: 0.4338
 epoch: 5, train_loss: 0.9113, test_loss: 0.9237, test_f1: 0.4521
 epoch: 6, train_loss: 0.9024, test_loss: 0.9180, test_f1: 0.5068
 epoch: 7, train_loss: 0.8869, test_loss: 0.9054, test_f1: 0.4976
 epoch: 8, train_loss: 0.8599, test_loss: 0.9283, test_f1: 0.4890
 epoch: 9, train_loss: 0.8647, test_loss: 0.9086, test_f1: 0.4955
 epoch: 10, train_loss: 0.8395, test_loss: 0.9638, test_f1: 0.4613
 epoch: 11, train_loss: 0.8343, test_loss: 0.8899, test_f1: 0.5288
 epoch: 12, train_loss: 0.8283, test_loss: 0.8499, test_f1: 0.5497
 epoch: 13, train_loss: 0.8169, test_loss: 0.9729, test_f1: 0.5420
 epoch: 14, train_loss: 0.8030, test_loss: 0.8717, test_f1: 0.5734
 epoch: 15, train_loss: 0.7880, test_loss: 0.8996, test_f1: 0.5434
 epoch: 16, train_loss: 0.7648, test_loss: 0.8449, test_f1: 0.5794
 epoch: 17, train_loss: 0.7595, test_loss: 0.8538, test_f1: 0.5963
 epoch: 18, train_loss: 0.7571, test_loss: 0.8546, test_f1: 0.5970
 epoch: 19, train_loss: 0.7381, test_loss: 0.8549, test_f1: 0.5791
 epoch: 20, train_loss: 0.7371, test_loss: 0.8762, test_f1: 0.5769
 epoch: 21, train_loss: 0.7282, test_loss: 0.9151, test_f1: 0.5628
 epoch: 22, train_loss: 0.7197, test_loss: 0.9137, test_f1: 0.5875
 epoch: 23, train_loss: 0.7081, test_loss: 0.8741, test_f1: 0.6045
 epoch: 24, train_loss: 0.7000, test_loss: 0.8621, test_f1: 0.6136
 epoch: 25, train_loss: 0.6920, test_loss: 0.8864, test_f1: 0.6108
 epoch: 26, train_loss: 0.6857, test_loss: 0.9105, test_f1: 0.6118
 epoch: 27, train_loss: 0.6775, test_loss: 0.9493, test_f1: 0.5778
 epoch: 28, train_loss: 0.6731, test_loss: 1.0002, test_f1: 0.5653
 epoch: 29, train_loss: 0.6680, test_loss: 0.8870, test_f1: 0.6197
 epoch: 30, train_loss: 0.6473, test_loss: 0.9193, test_f1: 0.6192
 epoch: 31, train_loss: 0.6393, test_loss: 0.9482, test_f1: 0.6206
 epoch: 32, train_loss: 0.6279, test_loss: 0.8944, test_f1: 0.6547
 epoch: 33, train_loss: 0.6335, test_loss: 0.9134, test_f1: 0.6378
 epoch: 34, train_loss: 0.6018, test_loss: 1.1133, test_f1: 0.5454
 epoch: 35, train_loss: 0.6081, test_loss: 0.9833, test_f1: 0.5871
 epoch: 36, train_loss: 0.5997, test_loss: 0.8717, test_f1: 0.6597
 epoch: 37, train_loss: 0.5820, test_loss: 0.9505, test_f1: 0.6405
 epoch: 38, train_loss: 0.5803, test_loss: 0.9737, test_f1: 0.6025
 epoch: 39, train_loss: 0.5746, test_loss: 0.9478, test_f1: 0.5907
 epoch: 40, train_loss: 0.5789, test_loss: 1.0103, test_f1: 0.6261
 epoch: 41, train_loss: 0.5681, test_loss: 0.9629, test_f1: 0.6520
 epoch: 42, train_loss: 0.5590, test_loss: 0.9473, test_f1: 0.6364
 epoch: 43, train_loss: 0.5412, test_loss: 0.9274, test_f1: 0.6128
 epoch: 44, train_loss: 0.5435, test_loss: 0.9167, test_f1: 0.6507
 epoch: 45, train_loss: 0.5544, test_loss: 0.9485, test_f1: 0.6328
 epoch: 46, train_loss: 0.5564, test_loss: 0.9725, test_f1: 0.6445
 epoch: 47, train_loss: 0.5097, test_loss: 0.9411, test_f1: 0.6073
 epoch: 48, train_loss: 0.5182, test_loss: 0.9028, test_f1: 0.6500
 epoch: 49, train_loss: 0.5150, test_loss: 0.9412, test_f1: 0.6482
 epoch: 50, train_loss: 0.4961, test_loss: 0.9983, test_f1: 0.6291
 epoch: 51, train_loss: 0.4880, test_loss: 0.9959, test_f1: 0.6601
 epoch: 52, train_loss: 0.4818, test_loss: 0.9251, test_f1: 0.6588
 epoch: 53, train_loss: 0.4539, test_loss: 0.9158, test_f1: 0.6721
 epoch: 54, train_loss: 0.4486, test_loss: 1.0000, test_f1: 0.6676
 epoch: 55, train_loss: 0.4454, test_loss: 0.9601, test_f1: 0.6667
 epoch: 56, train_loss: 0.4417, test_loss: 1.0095, test_f1: 0.6601
 epoch: 57, train_loss: 0.4326, test_loss: 0.9991, test_f1: 0.6358
 epoch: 58, train_loss: 0.4149, test_loss: 1.0828, test_f1: 0.6595
 epoch: 59, train_loss: 0.4191, test_loss: 1.0738, test_f1: 0.6591
 epoch: 60, train_loss: 0.4170, test_loss: 1.0164, test_f1: 0.6416
 epoch: 61, train_loss: 0.4195, test_loss: 1.1212, test_f1: 0.6532
 epoch: 62, train_loss: 0.4107, test_loss: 1.0350, test_f1: 0.6472
 epoch: 63, train_loss: 0.4012, test_loss: 1.0706, test_f1: 0.6682
 epoch: 64, train_loss: 0.4090, test_loss: 1.0489, test_f1: 0.6621
 epoch: 65, train_loss: 0.4010, test_loss: 1.0840, test_f1: 0.6821
 epoch: 66, train_loss: 0.3919, test_loss: 1.0103, test_f1: 0.6717
 epoch: 67, train_loss: 0.3812, test_loss: 1.0161, test_f1: 0.6794
 epoch: 68, train_loss: 0.3994, test_loss: 1.1130, test_f1: 0.6563
 epoch: 69, train_loss: 0.3887, test_loss: 1.0752, test_f1: 0.6493
 epoch: 70, train_loss: 0.3817, test_loss: 1.1046, test_f1: 0.6566
 epoch: 71, train_loss: 0.3802, test_loss: 1.1107, test_f1: 0.6810
 epoch: 72, train_loss: 0.3820, test_loss: 1.0947, test_f1: 0.6627
 epoch: 73, train_loss: 0.3792, test_loss: 1.1251, test_f1: 0.6645
 epoch: 74, train_loss: 0.3709, test_loss: 1.1083, test_f1: 0.6501
 epoch: 75, train_loss: 0.3756, test_loss: 1.1377, test_f1: 0.6620
 epoch: 76, train_loss: 0.3592, test_loss: 1.1709, test_f1: 0.6449
 epoch: 77, train_loss: 0.3660, test_loss: 1.1373, test_f1: 0.6685
 epoch: 78, train_loss: 0.3610, test_loss: 1.1219, test_f1: 0.6563
 epoch: 79, train_loss: 0.3606, test_loss: 1.1342, test_f1: 0.6512
 epoch: 80, train_loss: 0.3588, test_loss: 1.1835, test_f1: 0.6559
 epoch: 81, train_loss: 0.3474, test_loss: 1.2132, test_f1: 0.6279
 epoch: 82, train_loss: 0.3869, test_loss: 1.0967, test_f1: 0.6552
 epoch: 83, train_loss: 0.3620, test_loss: 1.1878, test_f1: 0.6569
 epoch: 84, train_loss: 0.3573, test_loss: 1.1384, test_f1: 0.6592
 epoch: 85, train_loss: 0.3447, test_loss: 1.1651, test_f1: 0.6556
 epoch: 86, train_loss: 0.3404, test_loss: 1.1707, test_f1: 0.6681
 epoch: 87, train_loss: 0.3425, test_loss: 1.1955, test_f1: 0.6650
 epoch: 88, train_loss: 0.3157, test_loss: 1.1518, test_f1: 0.6524
 epoch: 89, train_loss: 0.3273, test_loss: 1.2259, test_f1: 0.6598
 epoch: 90, train_loss: 0.3233, test_loss: 1.1948, test_f1: 0.6916
 epoch: 91, train_loss: 0.3109, test_loss: 1.2363, test_f1: 0.6505
 epoch: 92, train_loss: 0.3111, test_loss: 1.2256, test_f1: 0.6418
 epoch: 93, train_loss: 0.3242, test_loss: 1.3855, test_f1: 0.6587
 epoch: 94, train_loss: 0.3118, test_loss: 1.1901, test_f1: 0.6782
 epoch: 95, train_loss: 0.3217, test_loss: 1.2750, test_f1: 0.6745
 epoch: 96, train_loss: 0.3103, test_loss: 1.3194, test_f1: 0.6789
 epoch: 97, train_loss: 0.3097, test_loss: 1.2408, test_f1: 0.6611
 epoch: 98, train_loss: 0.3112, test_loss: 1.2381, test_f1: 0.6757
 epoch: 99, train_loss: 0.3071, test_loss: 1.3055, test_f1: 0.6386

Training completed in 375.79 seconds
Best F1: 0.7074 at epoch 88
Mean F1 across iterations: 0.6832  0.0134
========================FINAL RESULTS================================
FEGIN weighted F1: 0.7074  0.0134
python main.py --data ltspice_examples --representation component_net --model FEGIN --layers 2 --hiddens 128 --batch_size 256 --lr 0.001 --emb_size 250 --epochs 100 --save_appendix component_net_L2_H128_BS256_LR0.001_E250 --no_val
-----



STDERR:
  File "main.py", line 370, in <module>
    main()
  File "main.py", line 254, in main
    dataset = dataset_class(
  File "/home/philip/projects/ltspice_examples_code_repo/Circuit-Completion-Using-GNNs/component_classification_with_link_prediction_head/evaluation/FEGIN/kernel/circuit_datasets.py", line 15, in __init__
    self.data, self.slices = torch.load(self.processed_paths[0])
  File "/home/philip/.local/lib/python3.8/site-packages/torch/serialization.py", line 1040, in load
    warnings.warn(
  File "/usr/lib/python3.8/warnings.py", line 109, in _showwarnmsg
    sw(msg.message, msg.category, msg.filename, msg.lineno,
  File "main.py", line 47, in warn_with_traceback
    traceback.print_stack(file=log)
/home/philip/projects/ltspice_examples_code_repo/Circuit-Completion-Using-GNNs/component_classification_with_link_prediction_head/evaluation/FEGIN/kernel/circuit_datasets.py:15: FutureWarning: You are using `torch.load` with `weights_only=False` (the current default value), which uses the default pickle module implicitly. It is possible to construct malicious pickle data which will execute arbitrary code during unpickling (See https://github.com/pytorch/pytorch/blob/main/SECURITY.md#untrusted-models for more details). In a future release, the default value for `weights_only` will be flipped to `True`. This limits the functions that could be executed during unpickling. Arbitrary objects will no longer be allowed to be loaded via this mode unless they are explicitly allowlisted by the user via `torch.serialization.add_safe_globals`. We recommend you start setting `weights_only=True` for any use case where you don't have full control of the loaded file. Please open an issue on GitHub for any issues related to this experimental feature.
  self.data, self.slices = torch.load(self.processed_paths[0])
