STDOUT:
Results will be saved in /home/philip/projects/ltspice_examples_code_repo/Circuit-Completion-Using-GNNs/component_classification_with_link_prediction_head/evaluation/FEGIN/results/model_FEGIN_dataset_ltspice_examples
Command line input: python main.py --data ltspice_examples --representation component_net --model FEGIN --layers 4 --hiddens 128 --batch_size 256 --lr 0.001 --emb_size 128 --epochs 100 --save_appendix component_net_L4_H128_BS256_LR0.001_E128 --no_val
 is saved.
-----
ltspice_examples - FEGIN
Using 4 layers, 128 hidden units, h = 2
Loading component_net representation dataset
ENTERED
Training FEGIN on component_net representation
Train: 3558, Test: 846
##################ITERATION #0 ****************************************
 epoch: 0, train_loss: 1.2780, test_loss: 1.3299, test_f1: 0.2270
 epoch: 1, train_loss: 1.1500, test_loss: 1.2582, test_f1: 0.2729
 epoch: 2, train_loss: 1.0716, test_loss: 1.1330, test_f1: 0.4758
 epoch: 3, train_loss: 0.9821, test_loss: 1.0269, test_f1: 0.4825
 epoch: 4, train_loss: 0.9379, test_loss: 0.9825, test_f1: 0.4958
 epoch: 5, train_loss: 0.9102, test_loss: 0.9277, test_f1: 0.5075
 epoch: 6, train_loss: 0.8859, test_loss: 0.9402, test_f1: 0.4923
 epoch: 7, train_loss: 0.8526, test_loss: 0.9214, test_f1: 0.5305
 epoch: 8, train_loss: 0.8284, test_loss: 0.9406, test_f1: 0.5403
 epoch: 9, train_loss: 0.8214, test_loss: 0.8771, test_f1: 0.5403
 epoch: 10, train_loss: 0.8026, test_loss: 0.9199, test_f1: 0.5555
 epoch: 11, train_loss: 0.8014, test_loss: 0.9398, test_f1: 0.5794
 epoch: 12, train_loss: 0.7969, test_loss: 0.9221, test_f1: 0.5538
 epoch: 13, train_loss: 0.7723, test_loss: 0.9273, test_f1: 0.5875
 epoch: 14, train_loss: 0.7581, test_loss: 0.9173, test_f1: 0.5579
 epoch: 15, train_loss: 0.7516, test_loss: 0.9248, test_f1: 0.5789
 epoch: 16, train_loss: 0.7320, test_loss: 0.9047, test_f1: 0.6049
 epoch: 17, train_loss: 0.7077, test_loss: 0.9156, test_f1: 0.5935
 epoch: 18, train_loss: 0.6995, test_loss: 1.0057, test_f1: 0.5992
 epoch: 19, train_loss: 0.6925, test_loss: 0.9595, test_f1: 0.5987
 epoch: 20, train_loss: 0.6897, test_loss: 0.8944, test_f1: 0.6236
 epoch: 21, train_loss: 0.6680, test_loss: 0.9475, test_f1: 0.6197
 epoch: 22, train_loss: 0.6624, test_loss: 0.8812, test_f1: 0.5982
 epoch: 23, train_loss: 0.6528, test_loss: 1.1451, test_f1: 0.5478
 epoch: 24, train_loss: 0.6426, test_loss: 0.9891, test_f1: 0.6018
 epoch: 25, train_loss: 0.6338, test_loss: 1.0417, test_f1: 0.5776
 epoch: 26, train_loss: 0.6268, test_loss: 0.8602, test_f1: 0.6120
 epoch: 27, train_loss: 0.6049, test_loss: 1.1627, test_f1: 0.5813
 epoch: 28, train_loss: 0.5704, test_loss: 1.0017, test_f1: 0.6134
 epoch: 29, train_loss: 0.5486, test_loss: 0.9633, test_f1: 0.6581
 epoch: 30, train_loss: 0.5400, test_loss: 1.0122, test_f1: 0.6200
 epoch: 31, train_loss: 0.5473, test_loss: 1.2197, test_f1: 0.5861
 epoch: 32, train_loss: 0.5065, test_loss: 0.9907, test_f1: 0.6388
 epoch: 33, train_loss: 0.5084, test_loss: 1.0793, test_f1: 0.6173
 epoch: 34, train_loss: 0.4970, test_loss: 1.1454, test_f1: 0.6130
 epoch: 35, train_loss: 0.5021, test_loss: 1.1391, test_f1: 0.6366
 epoch: 36, train_loss: 0.4836, test_loss: 1.1704, test_f1: 0.6217
 epoch: 37, train_loss: 0.4682, test_loss: 1.0878, test_f1: 0.6363
 epoch: 38, train_loss: 0.4290, test_loss: 1.1008, test_f1: 0.6121
 epoch: 39, train_loss: 0.4353, test_loss: 1.3681, test_f1: 0.6060
 epoch: 40, train_loss: 0.4237, test_loss: 1.2720, test_f1: 0.6301
 epoch: 41, train_loss: 0.4378, test_loss: 1.4630, test_f1: 0.5951
 epoch: 42, train_loss: 0.4410, test_loss: 1.3129, test_f1: 0.5997
 epoch: 43, train_loss: 0.4125, test_loss: 1.2536, test_f1: 0.6426
 epoch: 44, train_loss: 0.3697, test_loss: 1.3250, test_f1: 0.6131
 epoch: 45, train_loss: 0.3611, test_loss: 1.4119, test_f1: 0.6211
 epoch: 46, train_loss: 0.3727, test_loss: 1.3844, test_f1: 0.6258
 epoch: 47, train_loss: 0.3540, test_loss: 1.3902, test_f1: 0.6099
 epoch: 48, train_loss: 0.3451, test_loss: 1.3083, test_f1: 0.6280
 epoch: 49, train_loss: 0.3447, test_loss: 1.3138, test_f1: 0.6382
 epoch: 50, train_loss: 0.3365, test_loss: 1.3881, test_f1: 0.5947
 epoch: 51, train_loss: 0.3013, test_loss: 1.5358, test_f1: 0.6323
 epoch: 52, train_loss: 0.2814, test_loss: 1.6097, test_f1: 0.6377
 epoch: 53, train_loss: 0.2585, test_loss: 1.6295, test_f1: 0.6402
 epoch: 54, train_loss: 0.2513, test_loss: 1.5922, test_f1: 0.6389
 epoch: 55, train_loss: 0.2427, test_loss: 1.7684, test_f1: 0.5903
 epoch: 56, train_loss: 0.2390, test_loss: 1.7380, test_f1: 0.6225
 epoch: 57, train_loss: 0.2270, test_loss: 1.7285, test_f1: 0.6300
 epoch: 58, train_loss: 0.2105, test_loss: 1.9013, test_f1: 0.6331
 epoch: 59, train_loss: 0.2199, test_loss: 1.8867, test_f1: 0.6195
 epoch: 60, train_loss: 0.2050, test_loss: 1.8842, test_f1: 0.6103
 epoch: 61, train_loss: 0.1954, test_loss: 1.8733, test_f1: 0.6367
 epoch: 62, train_loss: 0.2054, test_loss: 1.9339, test_f1: 0.6246
 epoch: 63, train_loss: 0.2140, test_loss: 2.0759, test_f1: 0.6084
 epoch: 64, train_loss: 0.2090, test_loss: 2.1264, test_f1: 0.6003
 epoch: 65, train_loss: 0.2009, test_loss: 1.9467, test_f1: 0.6108
 epoch: 66, train_loss: 0.1993, test_loss: 2.0094, test_f1: 0.6383
 epoch: 67, train_loss: 0.1929, test_loss: 2.1397, test_f1: 0.5970
 epoch: 68, train_loss: 0.1891, test_loss: 2.1044, test_f1: 0.6310
 epoch: 69, train_loss: 0.1944, test_loss: 1.9862, test_f1: 0.6386
 epoch: 70, train_loss: 0.1960, test_loss: 2.0123, test_f1: 0.5981
 epoch: 71, train_loss: 0.1754, test_loss: 2.1376, test_f1: 0.6035
 epoch: 72, train_loss: 0.1815, test_loss: 2.1345, test_f1: 0.6094
 epoch: 73, train_loss: 0.1926, test_loss: 2.1341, test_f1: 0.6156
 epoch: 74, train_loss: 0.1712, test_loss: 2.2663, test_f1: 0.6232
 epoch: 75, train_loss: 0.1676, test_loss: 2.2770, test_f1: 0.6127
 epoch: 76, train_loss: 0.1743, test_loss: 2.4823, test_f1: 0.5759
 epoch: 77, train_loss: 0.1773, test_loss: 2.2577, test_f1: 0.5866
 epoch: 78, train_loss: 0.1788, test_loss: 2.4375, test_f1: 0.5880
 epoch: 79, train_loss: 0.1872, test_loss: 2.4403, test_f1: 0.6323
 epoch: 80, train_loss: 0.1731, test_loss: 2.1369, test_f1: 0.6146
 epoch: 81, train_loss: 0.1537, test_loss: 2.2878, test_f1: 0.6105
 epoch: 82, train_loss: 0.1703, test_loss: 2.5408, test_f1: 0.5789
 epoch: 83, train_loss: 0.1463, test_loss: 2.3847, test_f1: 0.6199
 epoch: 84, train_loss: 0.1463, test_loss: 2.4051, test_f1: 0.6199
 epoch: 85, train_loss: 0.1436, test_loss: 2.3831, test_f1: 0.6306
 epoch: 86, train_loss: 0.1543, test_loss: 2.6352, test_f1: 0.5961
 epoch: 87, train_loss: 0.1549, test_loss: 2.4630, test_f1: 0.6047
 epoch: 88, train_loss: 0.1423, test_loss: 2.4675, test_f1: 0.5877
 epoch: 89, train_loss: 0.1405, test_loss: 2.5011, test_f1: 0.5778
 epoch: 90, train_loss: 0.1412, test_loss: 2.5197, test_f1: 0.6077
 epoch: 91, train_loss: 0.1402, test_loss: 2.5219, test_f1: 0.6176
 epoch: 92, train_loss: 0.1405, test_loss: 2.5010, test_f1: 0.6122
 epoch: 93, train_loss: 0.1320, test_loss: 2.5555, test_f1: 0.6201
 epoch: 94, train_loss: 0.1316, test_loss: 2.7367, test_f1: 0.6032
 epoch: 95, train_loss: 0.1410, test_loss: 2.5190, test_f1: 0.6191
 epoch: 96, train_loss: 0.1423, test_loss: 2.6492, test_f1: 0.6269
 epoch: 97, train_loss: 0.1378, test_loss: 2.6073, test_f1: 0.6294
 epoch: 98, train_loss: 0.1336, test_loss: 2.8859, test_f1: 0.6003
 epoch: 99, train_loss: 0.1354, test_loss: 2.3111, test_f1: 0.6420
##################ITERATION #1 ****************************************
 epoch: 0, train_loss: 1.1685, test_loss: 1.2464, test_f1: 0.2270
 epoch: 1, train_loss: 1.0241, test_loss: 1.1268, test_f1: 0.4179
 epoch: 2, train_loss: 0.9575, test_loss: 1.0139, test_f1: 0.4722
 epoch: 3, train_loss: 0.9068, test_loss: 0.9465, test_f1: 0.5148
 epoch: 4, train_loss: 0.8728, test_loss: 1.0189, test_f1: 0.5104
 epoch: 5, train_loss: 0.8807, test_loss: 0.9255, test_f1: 0.5375
 epoch: 6, train_loss: 0.8509, test_loss: 0.8900, test_f1: 0.5376
 epoch: 7, train_loss: 0.8119, test_loss: 0.8915, test_f1: 0.5725
 epoch: 8, train_loss: 0.7861, test_loss: 0.9072, test_f1: 0.5700
 epoch: 9, train_loss: 0.7769, test_loss: 0.8757, test_f1: 0.6063
 epoch: 10, train_loss: 0.7615, test_loss: 0.9087, test_f1: 0.5885
 epoch: 11, train_loss: 0.7362, test_loss: 0.9603, test_f1: 0.5858
 epoch: 12, train_loss: 0.7238, test_loss: 0.9091, test_f1: 0.6004
 epoch: 13, train_loss: 0.7092, test_loss: 0.9753, test_f1: 0.6017
 epoch: 14, train_loss: 0.6942, test_loss: 1.0296, test_f1: 0.5423
 epoch: 15, train_loss: 0.6660, test_loss: 0.9847, test_f1: 0.6095
 epoch: 16, train_loss: 0.6542, test_loss: 1.0657, test_f1: 0.5844
 epoch: 17, train_loss: 0.6594, test_loss: 0.9542, test_f1: 0.6534
 epoch: 18, train_loss: 0.6429, test_loss: 0.9221, test_f1: 0.6023
 epoch: 19, train_loss: 0.6413, test_loss: 0.9287, test_f1: 0.6178
 epoch: 20, train_loss: 0.6276, test_loss: 0.9756, test_f1: 0.6051
 epoch: 21, train_loss: 0.6038, test_loss: 0.9373, test_f1: 0.6240
 epoch: 22, train_loss: 0.5816, test_loss: 1.0732, test_f1: 0.6083
 epoch: 23, train_loss: 0.5804, test_loss: 1.0489, test_f1: 0.5756
 epoch: 24, train_loss: 0.5587, test_loss: 1.0637, test_f1: 0.6232
 epoch: 25, train_loss: 0.5413, test_loss: 1.0964, test_f1: 0.6052
 epoch: 26, train_loss: 0.5490, test_loss: 1.0103, test_f1: 0.6285
 epoch: 27, train_loss: 0.5243, test_loss: 1.0549, test_f1: 0.5944
 epoch: 28, train_loss: 0.5010, test_loss: 1.0718, test_f1: 0.6109
 epoch: 29, train_loss: 0.5041, test_loss: 1.1806, test_f1: 0.6052
 epoch: 30, train_loss: 0.4835, test_loss: 1.0898, test_f1: 0.6138
 epoch: 31, train_loss: 0.4784, test_loss: 1.0808, test_f1: 0.6253
 epoch: 32, train_loss: 0.4542, test_loss: 1.1356, test_f1: 0.5900
 epoch: 33, train_loss: 0.4683, test_loss: 1.1204, test_f1: 0.6077
 epoch: 34, train_loss: 0.4634, test_loss: 1.0714, test_f1: 0.6394
 epoch: 35, train_loss: 0.4747, test_loss: 1.0961, test_f1: 0.6214
 epoch: 36, train_loss: 0.4383, test_loss: 1.1510, test_f1: 0.6483
 epoch: 37, train_loss: 0.4193, test_loss: 1.2159, test_f1: 0.6360
 epoch: 38, train_loss: 0.3867, test_loss: 1.2067, test_f1: 0.6442
 epoch: 39, train_loss: 0.4011, test_loss: 1.2348, test_f1: 0.6455
 epoch: 40, train_loss: 0.3925, test_loss: 1.0922, test_f1: 0.6507
 epoch: 41, train_loss: 0.3666, test_loss: 1.3900, test_f1: 0.6804
 epoch: 42, train_loss: 0.3619, test_loss: 1.2446, test_f1: 0.6329
 epoch: 43, train_loss: 0.3860, test_loss: 1.3612, test_f1: 0.6412
 epoch: 44, train_loss: 0.3556, test_loss: 1.3060, test_f1: 0.6680
 epoch: 45, train_loss: 0.3455, test_loss: 1.3740, test_f1: 0.6356
 epoch: 46, train_loss: 0.3276, test_loss: 1.5678, test_f1: 0.6430
 epoch: 47, train_loss: 0.3144, test_loss: 1.5005, test_f1: 0.6418
 epoch: 48, train_loss: 0.3287, test_loss: 1.4634, test_f1: 0.6173
 epoch: 49, train_loss: 0.3195, test_loss: 1.4625, test_f1: 0.6457
 epoch: 50, train_loss: 0.2986, test_loss: 1.5039, test_f1: 0.6382
 epoch: 51, train_loss: 0.2660, test_loss: 1.4852, test_f1: 0.6474
 epoch: 52, train_loss: 0.2323, test_loss: 1.6491, test_f1: 0.6420
 epoch: 53, train_loss: 0.2264, test_loss: 1.6512, test_f1: 0.6388
 epoch: 54, train_loss: 0.2173, test_loss: 1.7173, test_f1: 0.6381
 epoch: 55, train_loss: 0.2092, test_loss: 1.7179, test_f1: 0.6439
 epoch: 56, train_loss: 0.2144, test_loss: 1.8343, test_f1: 0.6434
 epoch: 57, train_loss: 0.1921, test_loss: 1.7608, test_f1: 0.6300
 epoch: 58, train_loss: 0.1995, test_loss: 1.6687, test_f1: 0.6448
 epoch: 59, train_loss: 0.1850, test_loss: 1.8618, test_f1: 0.6365
 epoch: 60, train_loss: 0.1907, test_loss: 1.9677, test_f1: 0.6453
 epoch: 61, train_loss: 0.1912, test_loss: 2.0084, test_f1: 0.6353
 epoch: 62, train_loss: 0.1858, test_loss: 1.9103, test_f1: 0.6197
 epoch: 63, train_loss: 0.1921, test_loss: 1.9805, test_f1: 0.6411
 epoch: 64, train_loss: 0.1977, test_loss: 1.9192, test_f1: 0.6231
 epoch: 65, train_loss: 0.2050, test_loss: 2.1679, test_f1: 0.6296
 epoch: 66, train_loss: 0.2133, test_loss: 2.0103, test_f1: 0.6424
 epoch: 67, train_loss: 0.1948, test_loss: 2.0292, test_f1: 0.6375
 epoch: 68, train_loss: 0.1811, test_loss: 1.8720, test_f1: 0.6498
 epoch: 69, train_loss: 0.1718, test_loss: 2.0461, test_f1: 0.6368
 epoch: 70, train_loss: 0.1658, test_loss: 2.2345, test_f1: 0.6388
 epoch: 71, train_loss: 0.1679, test_loss: 2.0400, test_f1: 0.6312
 epoch: 72, train_loss: 0.1627, test_loss: 2.1292, test_f1: 0.6483
 epoch: 73, train_loss: 0.1488, test_loss: 2.0481, test_f1: 0.6568
 epoch: 74, train_loss: 0.1590, test_loss: 2.1950, test_f1: 0.6240
 epoch: 75, train_loss: 0.1582, test_loss: 2.1927, test_f1: 0.6502
 epoch: 76, train_loss: 0.1499, test_loss: 2.4937, test_f1: 0.6321
 epoch: 77, train_loss: 0.1473, test_loss: 2.3020, test_f1: 0.6586
 epoch: 78, train_loss: 0.1550, test_loss: 2.0017, test_f1: 0.6322
 epoch: 79, train_loss: 0.1572, test_loss: 2.3130, test_f1: 0.6261
 epoch: 80, train_loss: 0.1615, test_loss: 2.2729, test_f1: 0.6533
 epoch: 81, train_loss: 0.1578, test_loss: 2.2381, test_f1: 0.6509
 epoch: 82, train_loss: 0.1544, test_loss: 2.4904, test_f1: 0.6089
 epoch: 83, train_loss: 0.1489, test_loss: 2.5532, test_f1: 0.6365
 epoch: 84, train_loss: 0.1549, test_loss: 2.3472, test_f1: 0.6423
 epoch: 85, train_loss: 0.1447, test_loss: 2.4333, test_f1: 0.6380
 epoch: 86, train_loss: 0.1538, test_loss: 2.4125, test_f1: 0.6465
 epoch: 87, train_loss: 0.1442, test_loss: 2.4273, test_f1: 0.6534
 epoch: 88, train_loss: 0.1498, test_loss: 2.4224, test_f1: 0.6460
 epoch: 89, train_loss: 0.1529, test_loss: 2.2439, test_f1: 0.6446
 epoch: 90, train_loss: 0.1524, test_loss: 2.7490, test_f1: 0.6297
 epoch: 91, train_loss: 0.1651, test_loss: 2.4216, test_f1: 0.6430
 epoch: 92, train_loss: 0.1483, test_loss: 2.4404, test_f1: 0.6323
 epoch: 93, train_loss: 0.1446, test_loss: 2.4732, test_f1: 0.6387
 epoch: 94, train_loss: 0.1377, test_loss: 2.3651, test_f1: 0.6418
 epoch: 95, train_loss: 0.1385, test_loss: 2.3582, test_f1: 0.6309
 epoch: 96, train_loss: 0.1394, test_loss: 2.5414, test_f1: 0.6225
 epoch: 97, train_loss: 0.1206, test_loss: 2.4962, test_f1: 0.6480
 epoch: 98, train_loss: 0.1255, test_loss: 2.6566, test_f1: 0.6257
 epoch: 99, train_loss: 0.1205, test_loss: 2.6739, test_f1: 0.6276
##################ITERATION #2 ****************************************
 epoch: 0, train_loss: 1.2068, test_loss: 1.2382, test_f1: 0.2527
 epoch: 1, train_loss: 1.0219, test_loss: 1.1258, test_f1: 0.3427
 epoch: 2, train_loss: 0.9663, test_loss: 1.0343, test_f1: 0.3812
 epoch: 3, train_loss: 0.9221, test_loss: 0.9747, test_f1: 0.4968
 epoch: 4, train_loss: 0.8998, test_loss: 0.8917, test_f1: 0.5257
 epoch: 5, train_loss: 0.8767, test_loss: 0.9351, test_f1: 0.5427
 epoch: 6, train_loss: 0.8552, test_loss: 0.9390, test_f1: 0.5732
 epoch: 7, train_loss: 0.8365, test_loss: 0.9849, test_f1: 0.5408
 epoch: 8, train_loss: 0.8132, test_loss: 0.9662, test_f1: 0.5495
 epoch: 9, train_loss: 0.8139, test_loss: 0.9513, test_f1: 0.5752
 epoch: 10, train_loss: 0.8026, test_loss: 0.9560, test_f1: 0.5935
 epoch: 11, train_loss: 0.7799, test_loss: 0.9252, test_f1: 0.6255
 epoch: 12, train_loss: 0.7614, test_loss: 0.9749, test_f1: 0.5802
 epoch: 13, train_loss: 0.7652, test_loss: 0.9845, test_f1: 0.5507
 epoch: 14, train_loss: 0.7547, test_loss: 0.9011, test_f1: 0.6093
 epoch: 15, train_loss: 0.7284, test_loss: 1.0313, test_f1: 0.5885
 epoch: 16, train_loss: 0.7162, test_loss: 0.9602, test_f1: 0.5714
 epoch: 17, train_loss: 0.6962, test_loss: 1.0018, test_f1: 0.5973
 epoch: 18, train_loss: 0.6972, test_loss: 1.0758, test_f1: 0.5600
 epoch: 19, train_loss: 0.6794, test_loss: 0.9991, test_f1: 0.5795
 epoch: 20, train_loss: 0.6610, test_loss: 0.9471, test_f1: 0.6119
 epoch: 21, train_loss: 0.6511, test_loss: 0.9639, test_f1: 0.6211
 epoch: 22, train_loss: 0.6485, test_loss: 0.9870, test_f1: 0.6078
 epoch: 23, train_loss: 0.6348, test_loss: 1.0820, test_f1: 0.5648
 epoch: 24, train_loss: 0.6250, test_loss: 1.0204, test_f1: 0.5823
 epoch: 25, train_loss: 0.6176, test_loss: 0.9766, test_f1: 0.6264
 epoch: 26, train_loss: 0.6231, test_loss: 0.9605, test_f1: 0.6270
 epoch: 27, train_loss: 0.5781, test_loss: 1.0147, test_f1: 0.6442
 epoch: 28, train_loss: 0.5729, test_loss: 1.0268, test_f1: 0.6121
 epoch: 29, train_loss: 0.5587, test_loss: 0.9927, test_f1: 0.6067
 epoch: 30, train_loss: 0.5526, test_loss: 1.0524, test_f1: 0.6370
 epoch: 31, train_loss: 0.5260, test_loss: 1.3111, test_f1: 0.5586
 epoch: 32, train_loss: 0.5475, test_loss: 1.0662, test_f1: 0.6506
 epoch: 33, train_loss: 0.5265, test_loss: 1.1201, test_f1: 0.5956
 epoch: 34, train_loss: 0.5228, test_loss: 1.0171, test_f1: 0.6240
 epoch: 35, train_loss: 0.5030, test_loss: 1.0830, test_f1: 0.6410
 epoch: 36, train_loss: 0.4855, test_loss: 1.2684, test_f1: 0.6252
 epoch: 37, train_loss: 0.4797, test_loss: 1.3213, test_f1: 0.6053
 epoch: 38, train_loss: 0.4752, test_loss: 1.1486, test_f1: 0.6391
 epoch: 39, train_loss: 0.4554, test_loss: 1.1068, test_f1: 0.6372
 epoch: 40, train_loss: 0.4486, test_loss: 1.1579, test_f1: 0.6373
 epoch: 41, train_loss: 0.4359, test_loss: 1.1601, test_f1: 0.6437
 epoch: 42, train_loss: 0.4265, test_loss: 1.1491, test_f1: 0.6548
 epoch: 43, train_loss: 0.4338, test_loss: 1.2610, test_f1: 0.6344
 epoch: 44, train_loss: 0.4134, test_loss: 1.1888, test_f1: 0.6564
 epoch: 45, train_loss: 0.4124, test_loss: 1.2681, test_f1: 0.6176
 epoch: 46, train_loss: 0.3950, test_loss: 1.2266, test_f1: 0.6889
 epoch: 47, train_loss: 0.3890, test_loss: 1.4488, test_f1: 0.6283
 epoch: 48, train_loss: 0.4077, test_loss: 1.2196, test_f1: 0.6278
 epoch: 49, train_loss: 0.4029, test_loss: 1.3046, test_f1: 0.6179
 epoch: 50, train_loss: 0.3868, test_loss: 1.2714, test_f1: 0.6516
 epoch: 51, train_loss: 0.3576, test_loss: 1.2678, test_f1: 0.6623
 epoch: 52, train_loss: 0.3135, test_loss: 1.3791, test_f1: 0.6437
 epoch: 53, train_loss: 0.2851, test_loss: 1.3762, test_f1: 0.6357
 epoch: 54, train_loss: 0.2808, test_loss: 1.4679, test_f1: 0.6374
 epoch: 55, train_loss: 0.2818, test_loss: 1.3965, test_f1: 0.6344
 epoch: 56, train_loss: 0.2793, test_loss: 1.5229, test_f1: 0.6415
 epoch: 57, train_loss: 0.2805, test_loss: 1.4771, test_f1: 0.6445
 epoch: 58, train_loss: 0.2556, test_loss: 1.5633, test_f1: 0.6315
 epoch: 59, train_loss: 0.2494, test_loss: 1.6164, test_f1: 0.6501
 epoch: 60, train_loss: 0.2549, test_loss: 1.5411, test_f1: 0.6634
 epoch: 61, train_loss: 0.2491, test_loss: 1.5340, test_f1: 0.6499
 epoch: 62, train_loss: 0.2475, test_loss: 1.5881, test_f1: 0.6464
 epoch: 63, train_loss: 0.2441, test_loss: 1.6516, test_f1: 0.6422
 epoch: 64, train_loss: 0.2357, test_loss: 1.6930, test_f1: 0.6291
 epoch: 65, train_loss: 0.2451, test_loss: 1.6523, test_f1: 0.6278
 epoch: 66, train_loss: 0.2351, test_loss: 1.5065, test_f1: 0.6538
 epoch: 67, train_loss: 0.2321, test_loss: 1.6760, test_f1: 0.6380
 epoch: 68, train_loss: 0.2331, test_loss: 1.6685, test_f1: 0.6211
 epoch: 69, train_loss: 0.2377, test_loss: 1.7689, test_f1: 0.6291
 epoch: 70, train_loss: 0.2189, test_loss: 1.8468, test_f1: 0.6196
 epoch: 71, train_loss: 0.2408, test_loss: 1.7195, test_f1: 0.6457
 epoch: 72, train_loss: 0.2341, test_loss: 1.7894, test_f1: 0.6249
 epoch: 73, train_loss: 0.2181, test_loss: 1.8968, test_f1: 0.6342
 epoch: 74, train_loss: 0.2176, test_loss: 1.6936, test_f1: 0.6473
 epoch: 75, train_loss: 0.2194, test_loss: 1.6710, test_f1: 0.6547
 epoch: 76, train_loss: 0.2140, test_loss: 1.8704, test_f1: 0.6248
 epoch: 77, train_loss: 0.2071, test_loss: 1.7667, test_f1: 0.6367
 epoch: 78, train_loss: 0.1964, test_loss: 1.8625, test_f1: 0.6423
 epoch: 79, train_loss: 0.1956, test_loss: 1.8828, test_f1: 0.6375
 epoch: 80, train_loss: 0.2052, test_loss: 1.8545, test_f1: 0.6528
 epoch: 81, train_loss: 0.1977, test_loss: 1.8711, test_f1: 0.6302
 epoch: 82, train_loss: 0.1768, test_loss: 1.8714, test_f1: 0.6297
 epoch: 83, train_loss: 0.1973, test_loss: 2.0067, test_f1: 0.6242
 epoch: 84, train_loss: 0.1972, test_loss: 2.0175, test_f1: 0.6053
 epoch: 85, train_loss: 0.1865, test_loss: 1.9014, test_f1: 0.6258
 epoch: 86, train_loss: 0.1864, test_loss: 1.7990, test_f1: 0.6419
 epoch: 87, train_loss: 0.1826, test_loss: 1.8805, test_f1: 0.6375
 epoch: 88, train_loss: 0.1845, test_loss: 1.9917, test_f1: 0.6217
 epoch: 89, train_loss: 0.1740, test_loss: 2.0966, test_f1: 0.6262
 epoch: 90, train_loss: 0.1761, test_loss: 2.1290, test_f1: 0.6266
 epoch: 91, train_loss: 0.1761, test_loss: 2.1454, test_f1: 0.6263
 epoch: 92, train_loss: 0.1715, test_loss: 1.9435, test_f1: 0.6177
 epoch: 93, train_loss: 0.1640, test_loss: 2.2304, test_f1: 0.6153
 epoch: 94, train_loss: 0.1658, test_loss: 2.1539, test_f1: 0.6137
 epoch: 95, train_loss: 0.1557, test_loss: 2.0686, test_f1: 0.6266
 epoch: 96, train_loss: 0.1621, test_loss: 2.2456, test_f1: 0.6197
 epoch: 97, train_loss: 0.1824, test_loss: 1.9936, test_f1: 0.6479
 epoch: 98, train_loss: 0.1876, test_loss: 2.1608, test_f1: 0.6086
 epoch: 99, train_loss: 0.1734, test_loss: 2.0567, test_f1: 0.6439
##################ITERATION #3 ****************************************
 epoch: 0, train_loss: 1.2727, test_loss: 1.2599, test_f1: 0.2295
 epoch: 1, train_loss: 1.0268, test_loss: 1.1476, test_f1: 0.3632
 epoch: 2, train_loss: 0.9634, test_loss: 1.0343, test_f1: 0.4438
 epoch: 3, train_loss: 0.9235, test_loss: 0.9471, test_f1: 0.5125
 epoch: 4, train_loss: 0.8894, test_loss: 0.9378, test_f1: 0.5527
 epoch: 5, train_loss: 0.8498, test_loss: 0.9149, test_f1: 0.5639
 epoch: 6, train_loss: 0.8293, test_loss: 0.9249, test_f1: 0.5633
 epoch: 7, train_loss: 0.8321, test_loss: 0.9160, test_f1: 0.5672
 epoch: 8, train_loss: 0.8134, test_loss: 0.9711, test_f1: 0.5563
 epoch: 9, train_loss: 0.7947, test_loss: 0.9148, test_f1: 0.5687
 epoch: 10, train_loss: 0.7796, test_loss: 0.9664, test_f1: 0.5661
 epoch: 11, train_loss: 0.7611, test_loss: 0.9506, test_f1: 0.6042
 epoch: 12, train_loss: 0.7497, test_loss: 0.9467, test_f1: 0.5610
 epoch: 13, train_loss: 0.7401, test_loss: 0.9256, test_f1: 0.6056
 epoch: 14, train_loss: 0.7268, test_loss: 0.8993, test_f1: 0.6117
 epoch: 15, train_loss: 0.7150, test_loss: 0.8878, test_f1: 0.6260
 epoch: 16, train_loss: 0.6885, test_loss: 0.9098, test_f1: 0.6176
 epoch: 17, train_loss: 0.6805, test_loss: 0.9250, test_f1: 0.5903
 epoch: 18, train_loss: 0.6921, test_loss: 0.9400, test_f1: 0.5947
 epoch: 19, train_loss: 0.6722, test_loss: 0.9789, test_f1: 0.6015
 epoch: 20, train_loss: 0.6668, test_loss: 0.9180, test_f1: 0.5877
 epoch: 21, train_loss: 0.6487, test_loss: 0.9152, test_f1: 0.6269
 epoch: 22, train_loss: 0.6170, test_loss: 0.9872, test_f1: 0.6199
 epoch: 23, train_loss: 0.6287, test_loss: 1.0342, test_f1: 0.6002
 epoch: 24, train_loss: 0.6131, test_loss: 0.9749, test_f1: 0.6254
 epoch: 25, train_loss: 0.5832, test_loss: 0.9889, test_f1: 0.6366
 epoch: 26, train_loss: 0.5742, test_loss: 0.8910, test_f1: 0.6171
 epoch: 27, train_loss: 0.5610, test_loss: 1.0066, test_f1: 0.6259
 epoch: 28, train_loss: 0.5497, test_loss: 1.0218, test_f1: 0.6263
 epoch: 29, train_loss: 0.5581, test_loss: 0.9462, test_f1: 0.6654
 epoch: 30, train_loss: 0.5376, test_loss: 1.0410, test_f1: 0.6458
 epoch: 31, train_loss: 0.5020, test_loss: 1.0017, test_f1: 0.6327
 epoch: 32, train_loss: 0.4954, test_loss: 1.0714, test_f1: 0.6307
 epoch: 33, train_loss: 0.4869, test_loss: 1.0653, test_f1: 0.6328
 epoch: 34, train_loss: 0.4846, test_loss: 1.0551, test_f1: 0.6405
 epoch: 35, train_loss: 0.4820, test_loss: 1.0910, test_f1: 0.6366
 epoch: 36, train_loss: 0.4885, test_loss: 1.1010, test_f1: 0.6322
 epoch: 37, train_loss: 0.4863, test_loss: 1.0985, test_f1: 0.6333
 epoch: 38, train_loss: 0.4613, test_loss: 1.1397, test_f1: 0.6359
 epoch: 39, train_loss: 0.4609, test_loss: 1.1442, test_f1: 0.6250
 epoch: 40, train_loss: 0.4418, test_loss: 1.0899, test_f1: 0.6777
 epoch: 41, train_loss: 0.4342, test_loss: 1.1147, test_f1: 0.6559
 epoch: 42, train_loss: 0.3991, test_loss: 1.2666, test_f1: 0.6293
 epoch: 43, train_loss: 0.4111, test_loss: 1.3026, test_f1: 0.6012
 epoch: 44, train_loss: 0.3818, test_loss: 1.1845, test_f1: 0.6452
 epoch: 45, train_loss: 0.3640, test_loss: 1.2691, test_f1: 0.6643
 epoch: 46, train_loss: 0.4059, test_loss: 1.3789, test_f1: 0.6267
 epoch: 47, train_loss: 0.3920, test_loss: 1.2706, test_f1: 0.6272
 epoch: 48, train_loss: 0.3763, test_loss: 1.4375, test_f1: 0.6188
 epoch: 49, train_loss: 0.3701, test_loss: 1.4477, test_f1: 0.6186
 epoch: 50, train_loss: 0.3672, test_loss: 1.5120, test_f1: 0.6234
 epoch: 51, train_loss: 0.3482, test_loss: 1.2894, test_f1: 0.6597
 epoch: 52, train_loss: 0.3077, test_loss: 1.3268, test_f1: 0.6648
 epoch: 53, train_loss: 0.2811, test_loss: 1.3948, test_f1: 0.6360
 epoch: 54, train_loss: 0.2767, test_loss: 1.4726, test_f1: 0.6519
 epoch: 55, train_loss: 0.2553, test_loss: 1.5372, test_f1: 0.6379
 epoch: 56, train_loss: 0.2521, test_loss: 1.4882, test_f1: 0.6334
 epoch: 57, train_loss: 0.2440, test_loss: 1.6029, test_f1: 0.6541
 epoch: 58, train_loss: 0.2526, test_loss: 1.6295, test_f1: 0.6366
 epoch: 59, train_loss: 0.2531, test_loss: 1.5180, test_f1: 0.6479
 epoch: 60, train_loss: 0.2379, test_loss: 1.5419, test_f1: 0.6761
 epoch: 61, train_loss: 0.2460, test_loss: 1.5744, test_f1: 0.6348
 epoch: 62, train_loss: 0.2424, test_loss: 1.6995, test_f1: 0.6410
 epoch: 63, train_loss: 0.2554, test_loss: 1.5742, test_f1: 0.6631
 epoch: 64, train_loss: 0.2455, test_loss: 1.6382, test_f1: 0.6423
 epoch: 65, train_loss: 0.2191, test_loss: 1.6461, test_f1: 0.6212
 epoch: 66, train_loss: 0.2163, test_loss: 1.6285, test_f1: 0.6382
 epoch: 67, train_loss: 0.2140, test_loss: 1.6559, test_f1: 0.6411
 epoch: 68, train_loss: 0.2325, test_loss: 1.7176, test_f1: 0.6335
 epoch: 69, train_loss: 0.2075, test_loss: 1.7881, test_f1: 0.6573
 epoch: 70, train_loss: 0.2087, test_loss: 1.8134, test_f1: 0.6503
 epoch: 71, train_loss: 0.2189, test_loss: 1.7855, test_f1: 0.6157
 epoch: 72, train_loss: 0.2072, test_loss: 1.6766, test_f1: 0.6480
 epoch: 73, train_loss: 0.1996, test_loss: 1.7422, test_f1: 0.6348
 epoch: 74, train_loss: 0.1998, test_loss: 1.7869, test_f1: 0.6472
 epoch: 75, train_loss: 0.1958, test_loss: 1.8845, test_f1: 0.6390
 epoch: 76, train_loss: 0.1868, test_loss: 1.7768, test_f1: 0.6590
 epoch: 77, train_loss: 0.1933, test_loss: 1.8386, test_f1: 0.6594
 epoch: 78, train_loss: 0.1844, test_loss: 1.9053, test_f1: 0.6366
 epoch: 79, train_loss: 0.1920, test_loss: 1.7703, test_f1: 0.6600
 epoch: 80, train_loss: 0.1898, test_loss: 1.9727, test_f1: 0.6285
 epoch: 81, train_loss: 0.1647, test_loss: 2.0019, test_f1: 0.6363
 epoch: 82, train_loss: 0.1716, test_loss: 1.9247, test_f1: 0.6449
 epoch: 83, train_loss: 0.1814, test_loss: 1.9622, test_f1: 0.6370
 epoch: 84, train_loss: 0.1726, test_loss: 1.8847, test_f1: 0.6583
 epoch: 85, train_loss: 0.1658, test_loss: 1.9697, test_f1: 0.6435
 epoch: 86, train_loss: 0.1642, test_loss: 2.2142, test_f1: 0.6292
 epoch: 87, train_loss: 0.1740, test_loss: 2.2134, test_f1: 0.6391
 epoch: 88, train_loss: 0.1894, test_loss: 2.0070, test_f1: 0.6262
 epoch: 89, train_loss: 0.1762, test_loss: 2.1862, test_f1: 0.6529
 epoch: 90, train_loss: 0.1741, test_loss: 2.1019, test_f1: 0.6503
 epoch: 91, train_loss: 0.1694, test_loss: 2.1203, test_f1: 0.6598
 epoch: 92, train_loss: 0.1697, test_loss: 2.1709, test_f1: 0.6424
 epoch: 93, train_loss: 0.1730, test_loss: 2.1526, test_f1: 0.6439
 epoch: 94, train_loss: 0.1672, test_loss: 2.0947, test_f1: 0.6603
 epoch: 95, train_loss: 0.1536, test_loss: 2.0859, test_f1: 0.6520
 epoch: 96, train_loss: 0.1474, test_loss: 2.1762, test_f1: 0.6434
 epoch: 97, train_loss: 0.1558, test_loss: 2.1751, test_f1: 0.6574
 epoch: 98, train_loss: 0.1499, test_loss: 2.1204, test_f1: 0.6649
 epoch: 99, train_loss: 0.1456, test_loss: 2.2026, test_f1: 0.6385
##################ITERATION #4 ****************************************
 epoch: 0, train_loss: 1.3539, test_loss: 1.2668, test_f1: 0.2270
 epoch: 1, train_loss: 1.0634, test_loss: 1.2118, test_f1: 0.2631
 epoch: 2, train_loss: 0.9928, test_loss: 1.1053, test_f1: 0.3881
 epoch: 3, train_loss: 0.9345, test_loss: 0.9879, test_f1: 0.4696
 epoch: 4, train_loss: 0.8970, test_loss: 0.9325, test_f1: 0.4931
 epoch: 5, train_loss: 0.8812, test_loss: 0.9064, test_f1: 0.5204
 epoch: 6, train_loss: 0.8657, test_loss: 0.9003, test_f1: 0.5052
 epoch: 7, train_loss: 0.8350, test_loss: 0.8892, test_f1: 0.5706
 epoch: 8, train_loss: 0.8300, test_loss: 0.9231, test_f1: 0.5521
 epoch: 9, train_loss: 0.8081, test_loss: 0.8885, test_f1: 0.5661
 epoch: 10, train_loss: 0.7902, test_loss: 0.8997, test_f1: 0.5978
 epoch: 11, train_loss: 0.7817, test_loss: 0.9508, test_f1: 0.5922
 epoch: 12, train_loss: 0.7727, test_loss: 0.9110, test_f1: 0.6084
 epoch: 13, train_loss: 0.7434, test_loss: 0.8603, test_f1: 0.5914
 epoch: 14, train_loss: 0.7320, test_loss: 0.9554, test_f1: 0.5922
 epoch: 15, train_loss: 0.7144, test_loss: 0.8488, test_f1: 0.6053
 epoch: 16, train_loss: 0.6816, test_loss: 0.9202, test_f1: 0.5724
 epoch: 17, train_loss: 0.7054, test_loss: 0.8910, test_f1: 0.6245
 epoch: 18, train_loss: 0.6804, test_loss: 0.9076, test_f1: 0.6249
 epoch: 19, train_loss: 0.6633, test_loss: 0.8870, test_f1: 0.6587
 epoch: 20, train_loss: 0.6547, test_loss: 0.9183, test_f1: 0.6248
 epoch: 21, train_loss: 0.6487, test_loss: 0.8936, test_f1: 0.6070
 epoch: 22, train_loss: 0.6249, test_loss: 0.9451, test_f1: 0.5997
 epoch: 23, train_loss: 0.6236, test_loss: 0.9619, test_f1: 0.6404
 epoch: 24, train_loss: 0.6311, test_loss: 0.9939, test_f1: 0.6120
 epoch: 25, train_loss: 0.6095, test_loss: 0.9303, test_f1: 0.5891
 epoch: 26, train_loss: 0.6039, test_loss: 0.8962, test_f1: 0.6472
 epoch: 27, train_loss: 0.5901, test_loss: 0.9796, test_f1: 0.6095
 epoch: 28, train_loss: 0.5822, test_loss: 0.9444, test_f1: 0.6697
 epoch: 29, train_loss: 0.5731, test_loss: 0.8844, test_f1: 0.6303
 epoch: 30, train_loss: 0.5697, test_loss: 1.0368, test_f1: 0.6269
 epoch: 31, train_loss: 0.5399, test_loss: 0.9874, test_f1: 0.6144
 epoch: 32, train_loss: 0.5369, test_loss: 1.0612, test_f1: 0.6100
 epoch: 33, train_loss: 0.5436, test_loss: 1.0176, test_f1: 0.5961
 epoch: 34, train_loss: 0.5115, test_loss: 1.0403, test_f1: 0.6637
 epoch: 35, train_loss: 0.5162, test_loss: 1.0823, test_f1: 0.6334
 epoch: 36, train_loss: 0.4852, test_loss: 1.1403, test_f1: 0.6491
 epoch: 37, train_loss: 0.4781, test_loss: 1.0453, test_f1: 0.6634
 epoch: 38, train_loss: 0.4750, test_loss: 1.0824, test_f1: 0.6285
 epoch: 39, train_loss: 0.4688, test_loss: 1.1082, test_f1: 0.6282
 epoch: 40, train_loss: 0.4728, test_loss: 1.1327, test_f1: 0.6404
 epoch: 41, train_loss: 0.4427, test_loss: 1.1490, test_f1: 0.6443
 epoch: 42, train_loss: 0.4550, test_loss: 1.1615, test_f1: 0.6168
 epoch: 43, train_loss: 0.4460, test_loss: 1.1114, test_f1: 0.6528
 epoch: 44, train_loss: 0.4502, test_loss: 1.0646, test_f1: 0.6897
 epoch: 45, train_loss: 0.4037, test_loss: 1.0376, test_f1: 0.6576
 epoch: 46, train_loss: 0.4192, test_loss: 1.0959, test_f1: 0.6341
 epoch: 47, train_loss: 0.4059, test_loss: 1.1361, test_f1: 0.6698
 epoch: 48, train_loss: 0.4059, test_loss: 1.2526, test_f1: 0.6275
 epoch: 49, train_loss: 0.3814, test_loss: 1.2360, test_f1: 0.6555
 epoch: 50, train_loss: 0.3900, test_loss: 1.1329, test_f1: 0.6773
 epoch: 51, train_loss: 0.3826, test_loss: 1.1613, test_f1: 0.6502
 epoch: 52, train_loss: 0.3142, test_loss: 1.2212, test_f1: 0.6702
 epoch: 53, train_loss: 0.3107, test_loss: 1.2164, test_f1: 0.6689
 epoch: 54, train_loss: 0.2923, test_loss: 1.2244, test_f1: 0.6623
 epoch: 55, train_loss: 0.2866, test_loss: 1.3221, test_f1: 0.6693
 epoch: 56, train_loss: 0.2857, test_loss: 1.2036, test_f1: 0.6744
 epoch: 57, train_loss: 0.2825, test_loss: 1.3582, test_f1: 0.6625
 epoch: 58, train_loss: 0.2594, test_loss: 1.3907, test_f1: 0.6768
 epoch: 59, train_loss: 0.2700, test_loss: 1.3518, test_f1: 0.6839
 epoch: 60, train_loss: 0.2690, test_loss: 1.4077, test_f1: 0.6676
 epoch: 61, train_loss: 0.2760, test_loss: 1.4656, test_f1: 0.6661
 epoch: 62, train_loss: 0.2570, test_loss: 1.3828, test_f1: 0.6973
 epoch: 63, train_loss: 0.2350, test_loss: 1.4761, test_f1: 0.7030
 epoch: 64, train_loss: 0.2417, test_loss: 1.4045, test_f1: 0.6794
 epoch: 65, train_loss: 0.2411, test_loss: 1.4678, test_f1: 0.6772
 epoch: 66, train_loss: 0.2420, test_loss: 1.5077, test_f1: 0.6761
 epoch: 67, train_loss: 0.2338, test_loss: 1.5630, test_f1: 0.6648
 epoch: 68, train_loss: 0.2346, test_loss: 1.5190, test_f1: 0.6880
 epoch: 69, train_loss: 0.2292, test_loss: 1.4931, test_f1: 0.6591
 epoch: 70, train_loss: 0.2353, test_loss: 1.4883, test_f1: 0.6920
 epoch: 71, train_loss: 0.2232, test_loss: 1.5408, test_f1: 0.6781
 epoch: 72, train_loss: 0.2126, test_loss: 1.6492, test_f1: 0.6558
 epoch: 73, train_loss: 0.2116, test_loss: 1.5983, test_f1: 0.6927
 epoch: 74, train_loss: 0.2238, test_loss: 1.6333, test_f1: 0.6651
 epoch: 75, train_loss: 0.2154, test_loss: 1.5819, test_f1: 0.6685
 epoch: 76, train_loss: 0.2222, test_loss: 1.6385, test_f1: 0.6893
 epoch: 77, train_loss: 0.2225, test_loss: 1.7946, test_f1: 0.6385
 epoch: 78, train_loss: 0.2269, test_loss: 1.7568, test_f1: 0.6308
 epoch: 79, train_loss: 0.2169, test_loss: 1.8101, test_f1: 0.6565
 epoch: 80, train_loss: 0.2031, test_loss: 1.6615, test_f1: 0.6533
 epoch: 81, train_loss: 0.1975, test_loss: 1.7458, test_f1: 0.6732
 epoch: 82, train_loss: 0.2062, test_loss: 1.7456, test_f1: 0.6580
 epoch: 83, train_loss: 0.1866, test_loss: 1.7970, test_f1: 0.6592
 epoch: 84, train_loss: 0.1901, test_loss: 1.8681, test_f1: 0.6349
 epoch: 85, train_loss: 0.1808, test_loss: 1.7927, test_f1: 0.6470
 epoch: 86, train_loss: 0.1796, test_loss: 1.7501, test_f1: 0.6594
 epoch: 87, train_loss: 0.1893, test_loss: 1.8303, test_f1: 0.6641
 epoch: 88, train_loss: 0.1732, test_loss: 1.9375, test_f1: 0.6617
 epoch: 89, train_loss: 0.1898, test_loss: 1.9286, test_f1: 0.6550
 epoch: 90, train_loss: 0.1752, test_loss: 1.9252, test_f1: 0.6695
 epoch: 91, train_loss: 0.2048, test_loss: 1.9375, test_f1: 0.6594
 epoch: 92, train_loss: 0.1845, test_loss: 1.9587, test_f1: 0.6283
 epoch: 93, train_loss: 0.1753, test_loss: 1.8971, test_f1: 0.6921
 epoch: 94, train_loss: 0.1933, test_loss: 1.9255, test_f1: 0.6468
 epoch: 95, train_loss: 0.1913, test_loss: 1.8356, test_f1: 0.6663
 epoch: 96, train_loss: 0.1768, test_loss: 1.9750, test_f1: 0.6613
 epoch: 97, train_loss: 0.1835, test_loss: 2.0329, test_f1: 0.6580
 epoch: 98, train_loss: 0.2213, test_loss: 1.8700, test_f1: 0.6605
 epoch: 99, train_loss: 0.1935, test_loss: 1.9757, test_f1: 0.6446
##################ITERATION #5 ****************************************
 epoch: 0, train_loss: 1.4804, test_loss: 1.3521, test_f1: 0.2270
 epoch: 1, train_loss: 1.0575, test_loss: 1.2092, test_f1: 0.2616
 epoch: 2, train_loss: 0.9777, test_loss: 1.0269, test_f1: 0.4357
 epoch: 3, train_loss: 0.9356, test_loss: 0.9600, test_f1: 0.4724
 epoch: 4, train_loss: 0.9053, test_loss: 0.9511, test_f1: 0.5139
 epoch: 5, train_loss: 0.8892, test_loss: 0.9243, test_f1: 0.5153
 epoch: 6, train_loss: 0.8557, test_loss: 0.9189, test_f1: 0.5424
 epoch: 7, train_loss: 0.8303, test_loss: 0.9404, test_f1: 0.5652
 epoch: 8, train_loss: 0.8201, test_loss: 0.9035, test_f1: 0.5592
 epoch: 9, train_loss: 0.8194, test_loss: 0.9111, test_f1: 0.5494
 epoch: 10, train_loss: 0.7955, test_loss: 0.9103, test_f1: 0.5857
 epoch: 11, train_loss: 0.7793, test_loss: 0.9351, test_f1: 0.5748
 epoch: 12, train_loss: 0.7804, test_loss: 0.9049, test_f1: 0.5875
 epoch: 13, train_loss: 0.7583, test_loss: 0.9276, test_f1: 0.5838
 epoch: 14, train_loss: 0.7486, test_loss: 0.9094, test_f1: 0.6313
 epoch: 15, train_loss: 0.7265, test_loss: 0.8836, test_f1: 0.5995
 epoch: 16, train_loss: 0.7084, test_loss: 0.9085, test_f1: 0.5723
 epoch: 17, train_loss: 0.7103, test_loss: 1.0133, test_f1: 0.6007
 epoch: 18, train_loss: 0.7118, test_loss: 1.0235, test_f1: 0.5575
 epoch: 19, train_loss: 0.7072, test_loss: 0.9466, test_f1: 0.5717
 epoch: 20, train_loss: 0.6795, test_loss: 0.9366, test_f1: 0.6336
 epoch: 21, train_loss: 0.6725, test_loss: 0.9627, test_f1: 0.6240
 epoch: 22, train_loss: 0.6652, test_loss: 1.0285, test_f1: 0.5824
 epoch: 23, train_loss: 0.6736, test_loss: 0.9834, test_f1: 0.5746
 epoch: 24, train_loss: 0.6400, test_loss: 0.9544, test_f1: 0.6192
 epoch: 25, train_loss: 0.6371, test_loss: 0.9875, test_f1: 0.6191
 epoch: 26, train_loss: 0.6207, test_loss: 0.9809, test_f1: 0.6016
 epoch: 27, train_loss: 0.6429, test_loss: 1.0354, test_f1: 0.5856
 epoch: 28, train_loss: 0.6039, test_loss: 1.0416, test_f1: 0.6149
 epoch: 29, train_loss: 0.6053, test_loss: 1.0464, test_f1: 0.5958
 epoch: 30, train_loss: 0.5905, test_loss: 1.1080, test_f1: 0.5802
 epoch: 31, train_loss: 0.5883, test_loss: 0.9963, test_f1: 0.5900
 epoch: 32, train_loss: 0.5876, test_loss: 1.0597, test_f1: 0.6050
 epoch: 33, train_loss: 0.5627, test_loss: 1.0281, test_f1: 0.6056
 epoch: 34, train_loss: 0.5542, test_loss: 1.1202, test_f1: 0.5943
 epoch: 35, train_loss: 0.5281, test_loss: 1.1423, test_f1: 0.6149
 epoch: 36, train_loss: 0.5367, test_loss: 1.0647, test_f1: 0.5952
 epoch: 37, train_loss: 0.5530, test_loss: 1.1920, test_f1: 0.5430
 epoch: 38, train_loss: 0.5492, test_loss: 1.1197, test_f1: 0.6157
 epoch: 39, train_loss: 0.5297, test_loss: 1.1458, test_f1: 0.5873
 epoch: 40, train_loss: 0.5218, test_loss: 1.0824, test_f1: 0.6146
 epoch: 41, train_loss: 0.5165, test_loss: 1.1468, test_f1: 0.6150
 epoch: 42, train_loss: 0.4953, test_loss: 1.0977, test_f1: 0.6345
 epoch: 43, train_loss: 0.4673, test_loss: 1.2603, test_f1: 0.6178
 epoch: 44, train_loss: 0.4706, test_loss: 1.1092, test_f1: 0.6422
 epoch: 45, train_loss: 0.4628, test_loss: 1.2129, test_f1: 0.6058
 epoch: 46, train_loss: 0.4793, test_loss: 1.2778, test_f1: 0.6183
 epoch: 47, train_loss: 0.4550, test_loss: 1.2962, test_f1: 0.6277
 epoch: 48, train_loss: 0.4500, test_loss: 1.2988, test_f1: 0.6366
 epoch: 49, train_loss: 0.4392, test_loss: 1.1959, test_f1: 0.6112
 epoch: 50, train_loss: 0.4332, test_loss: 1.1588, test_f1: 0.6477
 epoch: 51, train_loss: 0.4024, test_loss: 1.3011, test_f1: 0.6176
 epoch: 52, train_loss: 0.3884, test_loss: 1.3099, test_f1: 0.6032
 epoch: 53, train_loss: 0.3635, test_loss: 1.2942, test_f1: 0.6537
 epoch: 54, train_loss: 0.3593, test_loss: 1.3876, test_f1: 0.6236
 epoch: 55, train_loss: 0.3561, test_loss: 1.4207, test_f1: 0.6166
 epoch: 56, train_loss: 0.3330, test_loss: 1.3631, test_f1: 0.6209
 epoch: 57, train_loss: 0.3157, test_loss: 1.4566, test_f1: 0.5852
 epoch: 58, train_loss: 0.3131, test_loss: 1.3464, test_f1: 0.6242
 epoch: 59, train_loss: 0.3262, test_loss: 1.4884, test_f1: 0.6217
 epoch: 60, train_loss: 0.3091, test_loss: 1.3933, test_f1: 0.6365
 epoch: 61, train_loss: 0.3034, test_loss: 1.4812, test_f1: 0.6396
 epoch: 62, train_loss: 0.3154, test_loss: 1.4793, test_f1: 0.6356
 epoch: 63, train_loss: 0.3084, test_loss: 1.4131, test_f1: 0.6578
 epoch: 64, train_loss: 0.2946, test_loss: 1.5112, test_f1: 0.6414
 epoch: 65, train_loss: 0.2901, test_loss: 1.6981, test_f1: 0.6222
 epoch: 66, train_loss: 0.2730, test_loss: 1.5579, test_f1: 0.6483
 epoch: 67, train_loss: 0.2875, test_loss: 1.6284, test_f1: 0.6225
 epoch: 68, train_loss: 0.2855, test_loss: 1.6597, test_f1: 0.6335
 epoch: 69, train_loss: 0.2924, test_loss: 1.5277, test_f1: 0.6260
 epoch: 70, train_loss: 0.2926, test_loss: 1.6332, test_f1: 0.6125
 epoch: 71, train_loss: 0.2723, test_loss: 1.8058, test_f1: 0.5829
 epoch: 72, train_loss: 0.2680, test_loss: 1.7159, test_f1: 0.6287
 epoch: 73, train_loss: 0.2809, test_loss: 1.7494, test_f1: 0.6138
 epoch: 74, train_loss: 0.2631, test_loss: 1.7352, test_f1: 0.6291
 epoch: 75, train_loss: 0.2513, test_loss: 1.8109, test_f1: 0.6304
 epoch: 76, train_loss: 0.2648, test_loss: 1.8174, test_f1: 0.6058
 epoch: 77, train_loss: 0.2451, test_loss: 1.7616, test_f1: 0.6440
 epoch: 78, train_loss: 0.2451, test_loss: 1.7935, test_f1: 0.6125
 epoch: 79, train_loss: 0.2504, test_loss: 1.7531, test_f1: 0.6533
 epoch: 80, train_loss: 0.2562, test_loss: 1.7856, test_f1: 0.6517
 epoch: 81, train_loss: 0.2465, test_loss: 1.8040, test_f1: 0.6091
 epoch: 82, train_loss: 0.2347, test_loss: 1.7875, test_f1: 0.6381
 epoch: 83, train_loss: 0.2364, test_loss: 1.8105, test_f1: 0.6169
 epoch: 84, train_loss: 0.2398, test_loss: 1.9077, test_f1: 0.6216
 epoch: 85, train_loss: 0.2364, test_loss: 1.8787, test_f1: 0.6146
 epoch: 86, train_loss: 0.2298, test_loss: 1.8140, test_f1: 0.6194
 epoch: 87, train_loss: 0.2254, test_loss: 1.8548, test_f1: 0.6250
 epoch: 88, train_loss: 0.2275, test_loss: 2.0354, test_f1: 0.6284
 epoch: 89, train_loss: 0.2189, test_loss: 2.0852, test_f1: 0.6301
 epoch: 90, train_loss: 0.2106, test_loss: 2.0038, test_f1: 0.6248
 epoch: 91, train_loss: 0.2157, test_loss: 1.9656, test_f1: 0.6373
 epoch: 92, train_loss: 0.2065, test_loss: 2.0871, test_f1: 0.5995
 epoch: 93, train_loss: 0.2122, test_loss: 2.1557, test_f1: 0.6650
 epoch: 94, train_loss: 0.2114, test_loss: 2.0591, test_f1: 0.6193
 epoch: 95, train_loss: 0.2267, test_loss: 1.9403, test_f1: 0.6305
 epoch: 96, train_loss: 0.2134, test_loss: 2.1232, test_f1: 0.6070
 epoch: 97, train_loss: 0.2019, test_loss: 2.0305, test_f1: 0.6068
 epoch: 98, train_loss: 0.2013, test_loss: 2.1469, test_f1: 0.6330
 epoch: 99, train_loss: 0.1882, test_loss: 2.0789, test_f1: 0.6182
##################ITERATION #6 ****************************************
 epoch: 0, train_loss: 1.6309, test_loss: 1.4201, test_f1: 0.2270
 epoch: 1, train_loss: 1.0648, test_loss: 1.1264, test_f1: 0.3546
 epoch: 2, train_loss: 0.9823, test_loss: 1.0183, test_f1: 0.4446
 epoch: 3, train_loss: 0.9323, test_loss: 0.9588, test_f1: 0.4642
 epoch: 4, train_loss: 0.8948, test_loss: 0.9192, test_f1: 0.4931
 epoch: 5, train_loss: 0.8665, test_loss: 0.9439, test_f1: 0.5287
 epoch: 6, train_loss: 0.8492, test_loss: 0.9210, test_f1: 0.5506
 epoch: 7, train_loss: 0.8357, test_loss: 0.9395, test_f1: 0.5151
 epoch: 8, train_loss: 0.8121, test_loss: 0.9325, test_f1: 0.5554
 epoch: 9, train_loss: 0.8086, test_loss: 0.9166, test_f1: 0.5840
 epoch: 10, train_loss: 0.7871, test_loss: 0.8901, test_f1: 0.5831
 epoch: 11, train_loss: 0.7709, test_loss: 0.9381, test_f1: 0.5596
 epoch: 12, train_loss: 0.7686, test_loss: 0.9288, test_f1: 0.5211
 epoch: 13, train_loss: 0.7689, test_loss: 0.9270, test_f1: 0.5613
 epoch: 14, train_loss: 0.7668, test_loss: 0.8650, test_f1: 0.5588
 epoch: 15, train_loss: 0.7245, test_loss: 0.9100, test_f1: 0.5508
 epoch: 16, train_loss: 0.7182, test_loss: 0.8812, test_f1: 0.5828
 epoch: 17, train_loss: 0.7208, test_loss: 0.9076, test_f1: 0.5796
 epoch: 18, train_loss: 0.7262, test_loss: 0.8617, test_f1: 0.5791
 epoch: 19, train_loss: 0.6921, test_loss: 0.9218, test_f1: 0.6073
 epoch: 20, train_loss: 0.6838, test_loss: 0.9521, test_f1: 0.5941
 epoch: 21, train_loss: 0.6844, test_loss: 0.9285, test_f1: 0.5759
 epoch: 22, train_loss: 0.6589, test_loss: 0.9001, test_f1: 0.5832
 epoch: 23, train_loss: 0.6494, test_loss: 0.8789, test_f1: 0.6297
 epoch: 24, train_loss: 0.6409, test_loss: 0.9582, test_f1: 0.5982
 epoch: 25, train_loss: 0.6447, test_loss: 0.9635, test_f1: 0.5962
 epoch: 26, train_loss: 0.6475, test_loss: 0.9385, test_f1: 0.6196
 epoch: 27, train_loss: 0.6420, test_loss: 0.9371, test_f1: 0.6442
 epoch: 28, train_loss: 0.6144, test_loss: 1.0104, test_f1: 0.6005
 epoch: 29, train_loss: 0.6109, test_loss: 0.9325, test_f1: 0.6266
 epoch: 30, train_loss: 0.6082, test_loss: 0.9331, test_f1: 0.6282
 epoch: 31, train_loss: 0.5833, test_loss: 0.9472, test_f1: 0.6233
 epoch: 32, train_loss: 0.5648, test_loss: 1.0514, test_f1: 0.6285
 epoch: 33, train_loss: 0.5541, test_loss: 0.9599, test_f1: 0.6208
 epoch: 34, train_loss: 0.5485, test_loss: 0.9908, test_f1: 0.6313
 epoch: 35, train_loss: 0.5561, test_loss: 0.9288, test_f1: 0.6067
 epoch: 36, train_loss: 0.5491, test_loss: 0.9944, test_f1: 0.6286
 epoch: 37, train_loss: 0.5399, test_loss: 0.9430, test_f1: 0.6605
 epoch: 38, train_loss: 0.5231, test_loss: 1.0086, test_f1: 0.6120
 epoch: 39, train_loss: 0.5096, test_loss: 1.0484, test_f1: 0.5914
 epoch: 40, train_loss: 0.4990, test_loss: 1.0291, test_f1: 0.6494
 epoch: 41, train_loss: 0.4818, test_loss: 1.0706, test_f1: 0.6095
 epoch: 42, train_loss: 0.4625, test_loss: 1.0101, test_f1: 0.6412
 epoch: 43, train_loss: 0.4689, test_loss: 1.0337, test_f1: 0.6586
 epoch: 44, train_loss: 0.4898, test_loss: 1.0921, test_f1: 0.6309
 epoch: 45, train_loss: 0.4626, test_loss: 1.1543, test_f1: 0.5948
 epoch: 46, train_loss: 0.4457, test_loss: 1.1461, test_f1: 0.6225
 epoch: 47, train_loss: 0.4524, test_loss: 1.0497, test_f1: 0.6629
 epoch: 48, train_loss: 0.4511, test_loss: 1.0994, test_f1: 0.6206
 epoch: 49, train_loss: 0.4233, test_loss: 1.0965, test_f1: 0.6348
 epoch: 50, train_loss: 0.4474, test_loss: 1.0693, test_f1: 0.6263
 epoch: 51, train_loss: 0.4066, test_loss: 1.0654, test_f1: 0.6559
 epoch: 52, train_loss: 0.3669, test_loss: 1.0763, test_f1: 0.6528
 epoch: 53, train_loss: 0.3466, test_loss: 1.1234, test_f1: 0.6524
 epoch: 54, train_loss: 0.3275, test_loss: 1.1878, test_f1: 0.6335
 epoch: 55, train_loss: 0.3085, test_loss: 1.2111, test_f1: 0.6472
 epoch: 56, train_loss: 0.3098, test_loss: 1.2318, test_f1: 0.6402
 epoch: 57, train_loss: 0.3186, test_loss: 1.2947, test_f1: 0.6393
 epoch: 58, train_loss: 0.3049, test_loss: 1.2030, test_f1: 0.6476
 epoch: 59, train_loss: 0.3023, test_loss: 1.2337, test_f1: 0.6633
 epoch: 60, train_loss: 0.2973, test_loss: 1.2904, test_f1: 0.6250
 epoch: 61, train_loss: 0.2897, test_loss: 1.2277, test_f1: 0.6718
 epoch: 62, train_loss: 0.2766, test_loss: 1.3575, test_f1: 0.6286
 epoch: 63, train_loss: 0.2799, test_loss: 1.3767, test_f1: 0.6494
 epoch: 64, train_loss: 0.2874, test_loss: 1.3664, test_f1: 0.6536
 epoch: 65, train_loss: 0.2941, test_loss: 1.4300, test_f1: 0.6132
 epoch: 66, train_loss: 0.2779, test_loss: 1.3597, test_f1: 0.6291
 epoch: 67, train_loss: 0.2780, test_loss: 1.3919, test_f1: 0.6171
 epoch: 68, train_loss: 0.2818, test_loss: 1.3433, test_f1: 0.6288
 epoch: 69, train_loss: 0.2467, test_loss: 1.3583, test_f1: 0.6353
 epoch: 70, train_loss: 0.2658, test_loss: 1.3214, test_f1: 0.6485
 epoch: 71, train_loss: 0.2440, test_loss: 1.3072, test_f1: 0.6534
 epoch: 72, train_loss: 0.2442, test_loss: 1.3892, test_f1: 0.6360
 epoch: 73, train_loss: 0.2369, test_loss: 1.3923, test_f1: 0.6285
 epoch: 74, train_loss: 0.2335, test_loss: 1.4835, test_f1: 0.6301
 epoch: 75, train_loss: 0.2437, test_loss: 1.4592, test_f1: 0.6386
 epoch: 76, train_loss: 0.2485, test_loss: 1.4588, test_f1: 0.6428
 epoch: 77, train_loss: 0.2355, test_loss: 1.4855, test_f1: 0.6172
 epoch: 78, train_loss: 0.2311, test_loss: 1.5558, test_f1: 0.6429
 epoch: 79, train_loss: 0.2287, test_loss: 1.6406, test_f1: 0.6507
 epoch: 80, train_loss: 0.2333, test_loss: 1.4171, test_f1: 0.6221
 epoch: 81, train_loss: 0.2306, test_loss: 1.4221, test_f1: 0.6591
 epoch: 82, train_loss: 0.2528, test_loss: 1.6199, test_f1: 0.6546
 epoch: 83, train_loss: 0.2405, test_loss: 1.5757, test_f1: 0.6315
 epoch: 84, train_loss: 0.2247, test_loss: 1.4740, test_f1: 0.6450
 epoch: 85, train_loss: 0.2264, test_loss: 1.4418, test_f1: 0.6162
 epoch: 86, train_loss: 0.2106, test_loss: 1.4178, test_f1: 0.6522
 epoch: 87, train_loss: 0.2063, test_loss: 1.6178, test_f1: 0.5984
 epoch: 88, train_loss: 0.2109, test_loss: 1.4424, test_f1: 0.6600
 epoch: 89, train_loss: 0.1934, test_loss: 1.5637, test_f1: 0.6306
 epoch: 90, train_loss: 0.1943, test_loss: 1.7611, test_f1: 0.6147
 epoch: 91, train_loss: 0.2032, test_loss: 1.7494, test_f1: 0.6208
 epoch: 92, train_loss: 0.2142, test_loss: 1.6348, test_f1: 0.6182
 epoch: 93, train_loss: 0.1907, test_loss: 1.5529, test_f1: 0.6557
 epoch: 94, train_loss: 0.1805, test_loss: 1.5573, test_f1: 0.6379
 epoch: 95, train_loss: 0.1865, test_loss: 1.8206, test_f1: 0.6121
 epoch: 96, train_loss: 0.1787, test_loss: 1.7313, test_f1: 0.6234
 epoch: 97, train_loss: 0.1806, test_loss: 1.7343, test_f1: 0.6279
 epoch: 98, train_loss: 0.1957, test_loss: 1.8046, test_f1: 0.6080
 epoch: 99, train_loss: 0.1899, test_loss: 1.7338, test_f1: 0.6254
##################ITERATION #7 ****************************************
 epoch: 0, train_loss: 1.5833, test_loss: 1.2778, test_f1: 0.2270
 epoch: 1, train_loss: 1.0586, test_loss: 1.1451, test_f1: 0.3404
 epoch: 2, train_loss: 0.9679, test_loss: 1.1228, test_f1: 0.3752
 epoch: 3, train_loss: 0.9428, test_loss: 1.0215, test_f1: 0.4499
 epoch: 4, train_loss: 0.9009, test_loss: 0.9977, test_f1: 0.4978
 epoch: 5, train_loss: 0.8880, test_loss: 0.9943, test_f1: 0.4823
 epoch: 6, train_loss: 0.8596, test_loss: 0.9483, test_f1: 0.4946
 epoch: 7, train_loss: 0.8456, test_loss: 0.9361, test_f1: 0.5465
 epoch: 8, train_loss: 0.8398, test_loss: 0.9714, test_f1: 0.5068
 epoch: 9, train_loss: 0.8128, test_loss: 0.9366, test_f1: 0.5148
 epoch: 10, train_loss: 0.8052, test_loss: 0.9766, test_f1: 0.5299
 epoch: 11, train_loss: 0.7902, test_loss: 0.9556, test_f1: 0.5491
 epoch: 12, train_loss: 0.7795, test_loss: 0.9343, test_f1: 0.5380
 epoch: 13, train_loss: 0.7717, test_loss: 0.9714, test_f1: 0.5872
 epoch: 14, train_loss: 0.7537, test_loss: 0.9611, test_f1: 0.5559
 epoch: 15, train_loss: 0.7450, test_loss: 0.9433, test_f1: 0.5557
 epoch: 16, train_loss: 0.7266, test_loss: 1.0074, test_f1: 0.5366
 epoch: 17, train_loss: 0.7320, test_loss: 0.9389, test_f1: 0.5892
 epoch: 18, train_loss: 0.7161, test_loss: 0.9482, test_f1: 0.5894
 epoch: 19, train_loss: 0.7122, test_loss: 0.9711, test_f1: 0.5763
 epoch: 20, train_loss: 0.7138, test_loss: 1.0681, test_f1: 0.5512
 epoch: 21, train_loss: 0.6837, test_loss: 0.9838, test_f1: 0.5713
 epoch: 22, train_loss: 0.6764, test_loss: 0.9688, test_f1: 0.5953
 epoch: 23, train_loss: 0.6553, test_loss: 1.0093, test_f1: 0.6117
 epoch: 24, train_loss: 0.6595, test_loss: 0.9684, test_f1: 0.5770
 epoch: 25, train_loss: 0.6512, test_loss: 0.9356, test_f1: 0.6071
 epoch: 26, train_loss: 0.6462, test_loss: 1.0263, test_f1: 0.5759
 epoch: 27, train_loss: 0.6358, test_loss: 0.9496, test_f1: 0.6266
 epoch: 28, train_loss: 0.6377, test_loss: 1.0288, test_f1: 0.6153
 epoch: 29, train_loss: 0.6259, test_loss: 0.9993, test_f1: 0.6301
 epoch: 30, train_loss: 0.5994, test_loss: 0.9812, test_f1: 0.6381
 epoch: 31, train_loss: 0.6027, test_loss: 1.0894, test_f1: 0.5763
 epoch: 32, train_loss: 0.5763, test_loss: 0.9562, test_f1: 0.5951
 epoch: 33, train_loss: 0.5729, test_loss: 0.9964, test_f1: 0.6201
 epoch: 34, train_loss: 0.5578, test_loss: 1.1582, test_f1: 0.5797
 epoch: 35, train_loss: 0.5551, test_loss: 1.0393, test_f1: 0.6120
 epoch: 36, train_loss: 0.5491, test_loss: 1.0761, test_f1: 0.6231
 epoch: 37, train_loss: 0.5500, test_loss: 1.0235, test_f1: 0.6338
 epoch: 38, train_loss: 0.5263, test_loss: 1.1306, test_f1: 0.5962
 epoch: 39, train_loss: 0.5174, test_loss: 1.0824, test_f1: 0.5967
 epoch: 40, train_loss: 0.5040, test_loss: 1.1895, test_f1: 0.5598
 epoch: 41, train_loss: 0.5265, test_loss: 1.1183, test_f1: 0.6172
 epoch: 42, train_loss: 0.4987, test_loss: 1.1878, test_f1: 0.6245
 epoch: 43, train_loss: 0.4885, test_loss: 1.3505, test_f1: 0.5665
 epoch: 44, train_loss: 0.4972, test_loss: 1.1143, test_f1: 0.6000
 epoch: 45, train_loss: 0.4799, test_loss: 1.1824, test_f1: 0.5730
 epoch: 46, train_loss: 0.4652, test_loss: 1.1713, test_f1: 0.6340
 epoch: 47, train_loss: 0.4708, test_loss: 1.0788, test_f1: 0.6230
 epoch: 48, train_loss: 0.4478, test_loss: 1.1460, test_f1: 0.6269
 epoch: 49, train_loss: 0.4467, test_loss: 1.1981, test_f1: 0.6258
 epoch: 50, train_loss: 0.4375, test_loss: 1.1729, test_f1: 0.6514
 epoch: 51, train_loss: 0.4161, test_loss: 1.1455, test_f1: 0.6614
 epoch: 52, train_loss: 0.4012, test_loss: 1.2966, test_f1: 0.6304
 epoch: 53, train_loss: 0.3485, test_loss: 1.2342, test_f1: 0.6308
 epoch: 54, train_loss: 0.3533, test_loss: 1.3098, test_f1: 0.6453
 epoch: 55, train_loss: 0.3501, test_loss: 1.3150, test_f1: 0.6598
 epoch: 56, train_loss: 0.3403, test_loss: 1.3691, test_f1: 0.6267
 epoch: 57, train_loss: 0.3266, test_loss: 1.3058, test_f1: 0.6428
 epoch: 58, train_loss: 0.3164, test_loss: 1.3333, test_f1: 0.6535
 epoch: 59, train_loss: 0.3153, test_loss: 1.4175, test_f1: 0.6183
 epoch: 60, train_loss: 0.3004, test_loss: 1.3605, test_f1: 0.6534
 epoch: 61, train_loss: 0.3216, test_loss: 1.4120, test_f1: 0.6318
 epoch: 62, train_loss: 0.3161, test_loss: 1.3805, test_f1: 0.6485
 epoch: 63, train_loss: 0.2971, test_loss: 1.4262, test_f1: 0.6405
 epoch: 64, train_loss: 0.3056, test_loss: 1.3610, test_f1: 0.6557
 epoch: 65, train_loss: 0.2924, test_loss: 1.5227, test_f1: 0.6268
 epoch: 66, train_loss: 0.2823, test_loss: 1.4359, test_f1: 0.6663
 epoch: 67, train_loss: 0.2853, test_loss: 1.4995, test_f1: 0.6464
 epoch: 68, train_loss: 0.2698, test_loss: 1.5076, test_f1: 0.6410
 epoch: 69, train_loss: 0.2662, test_loss: 1.5189, test_f1: 0.6340
 epoch: 70, train_loss: 0.2799, test_loss: 1.5465, test_f1: 0.6539
 epoch: 71, train_loss: 0.2773, test_loss: 1.5202, test_f1: 0.6513
 epoch: 72, train_loss: 0.2803, test_loss: 1.5168, test_f1: 0.6427
 epoch: 73, train_loss: 0.2749, test_loss: 1.4387, test_f1: 0.6548
 epoch: 74, train_loss: 0.2763, test_loss: 1.6963, test_f1: 0.6335
 epoch: 75, train_loss: 0.2667, test_loss: 1.6997, test_f1: 0.6399
 epoch: 76, train_loss: 0.2582, test_loss: 1.6474, test_f1: 0.6295
 epoch: 77, train_loss: 0.2438, test_loss: 1.6203, test_f1: 0.6238
 epoch: 78, train_loss: 0.2468, test_loss: 1.7346, test_f1: 0.6279
 epoch: 79, train_loss: 0.2461, test_loss: 1.6328, test_f1: 0.6380
 epoch: 80, train_loss: 0.2443, test_loss: 1.6985, test_f1: 0.6326
 epoch: 81, train_loss: 0.2345, test_loss: 1.6465, test_f1: 0.6449
 epoch: 82, train_loss: 0.2291, test_loss: 1.6531, test_f1: 0.6380
 epoch: 83, train_loss: 0.2204, test_loss: 1.6636, test_f1: 0.6366
 epoch: 84, train_loss: 0.2159, test_loss: 1.8274, test_f1: 0.6387
 epoch: 85, train_loss: 0.2137, test_loss: 1.7005, test_f1: 0.6416
 epoch: 86, train_loss: 0.2295, test_loss: 1.6034, test_f1: 0.6610
 epoch: 87, train_loss: 0.2255, test_loss: 1.7419, test_f1: 0.6353
 epoch: 88, train_loss: 0.2191, test_loss: 1.7791, test_f1: 0.6212
 epoch: 89, train_loss: 0.2315, test_loss: 1.6829, test_f1: 0.6344
 epoch: 90, train_loss: 0.2392, test_loss: 1.7674, test_f1: 0.6285
 epoch: 91, train_loss: 0.2365, test_loss: 1.7657, test_f1: 0.6545
 epoch: 92, train_loss: 0.2276, test_loss: 1.8202, test_f1: 0.6372
 epoch: 93, train_loss: 0.2182, test_loss: 1.7597, test_f1: 0.6293
 epoch: 94, train_loss: 0.2073, test_loss: 1.7304, test_f1: 0.6339
 epoch: 95, train_loss: 0.1978, test_loss: 1.8189, test_f1: 0.6495
 epoch: 96, train_loss: 0.1975, test_loss: 1.8866, test_f1: 0.6501
 epoch: 97, train_loss: 0.1920, test_loss: 1.9630, test_f1: 0.6303
 epoch: 98, train_loss: 0.1863, test_loss: 1.9671, test_f1: 0.6122
 epoch: 99, train_loss: 0.1865, test_loss: 1.9146, test_f1: 0.5998
##################ITERATION #8 ****************************************
 epoch: 0, train_loss: 1.7307, test_loss: 1.2898, test_f1: 0.2270
 epoch: 1, train_loss: 1.0733, test_loss: 1.1732, test_f1: 0.2781
 epoch: 2, train_loss: 0.9744, test_loss: 1.1092, test_f1: 0.4513
 epoch: 3, train_loss: 0.9245, test_loss: 1.0617, test_f1: 0.4524
 epoch: 4, train_loss: 0.9051, test_loss: 0.9733, test_f1: 0.4690
 epoch: 5, train_loss: 0.8832, test_loss: 0.9465, test_f1: 0.5414
 epoch: 6, train_loss: 0.8710, test_loss: 0.9524, test_f1: 0.5256
 epoch: 7, train_loss: 0.8296, test_loss: 0.9659, test_f1: 0.5212
 epoch: 8, train_loss: 0.8321, test_loss: 0.9171, test_f1: 0.5379
 epoch: 9, train_loss: 0.8146, test_loss: 0.8966, test_f1: 0.5765
 epoch: 10, train_loss: 0.8059, test_loss: 0.9372, test_f1: 0.5805
 epoch: 11, train_loss: 0.7816, test_loss: 0.9423, test_f1: 0.5727
 epoch: 12, train_loss: 0.7640, test_loss: 0.9266, test_f1: 0.6011
 epoch: 13, train_loss: 0.7557, test_loss: 0.8994, test_f1: 0.5973
 epoch: 14, train_loss: 0.7425, test_loss: 0.9200, test_f1: 0.5635
 epoch: 15, train_loss: 0.7239, test_loss: 0.9420, test_f1: 0.5781
 epoch: 16, train_loss: 0.7270, test_loss: 0.8908, test_f1: 0.6104
 epoch: 17, train_loss: 0.7278, test_loss: 0.9245, test_f1: 0.5967
 epoch: 18, train_loss: 0.7061, test_loss: 0.9508, test_f1: 0.6250
 epoch: 19, train_loss: 0.6888, test_loss: 0.9314, test_f1: 0.6334
 epoch: 20, train_loss: 0.6770, test_loss: 0.9697, test_f1: 0.6250
 epoch: 21, train_loss: 0.6670, test_loss: 0.9314, test_f1: 0.6308
 epoch: 22, train_loss: 0.6615, test_loss: 0.9656, test_f1: 0.6120
 epoch: 23, train_loss: 0.6603, test_loss: 0.9217, test_f1: 0.6444
 epoch: 24, train_loss: 0.6476, test_loss: 1.0139, test_f1: 0.6111
 epoch: 25, train_loss: 0.6595, test_loss: 0.9368, test_f1: 0.5967
 epoch: 26, train_loss: 0.6351, test_loss: 0.9552, test_f1: 0.6219
 epoch: 27, train_loss: 0.6089, test_loss: 0.9638, test_f1: 0.6587
 epoch: 28, train_loss: 0.6069, test_loss: 0.9411, test_f1: 0.6273
 epoch: 29, train_loss: 0.5751, test_loss: 1.0739, test_f1: 0.6023
 epoch: 30, train_loss: 0.5876, test_loss: 0.9781, test_f1: 0.6202
 epoch: 31, train_loss: 0.5726, test_loss: 0.9915, test_f1: 0.6064
 epoch: 32, train_loss: 0.5594, test_loss: 1.0380, test_f1: 0.6086
 epoch: 33, train_loss: 0.5733, test_loss: 0.9954, test_f1: 0.6148
 epoch: 34, train_loss: 0.5420, test_loss: 0.9874, test_f1: 0.6452
 epoch: 35, train_loss: 0.5102, test_loss: 1.0484, test_f1: 0.6423
 epoch: 36, train_loss: 0.4985, test_loss: 1.0287, test_f1: 0.6159
 epoch: 37, train_loss: 0.4926, test_loss: 1.0848, test_f1: 0.6279
 epoch: 38, train_loss: 0.5197, test_loss: 1.0447, test_f1: 0.6168
 epoch: 39, train_loss: 0.5107, test_loss: 1.1182, test_f1: 0.6312
 epoch: 40, train_loss: 0.4931, test_loss: 1.0913, test_f1: 0.6481
 epoch: 41, train_loss: 0.4842, test_loss: 1.0633, test_f1: 0.6554
 epoch: 42, train_loss: 0.4711, test_loss: 1.1172, test_f1: 0.6507
 epoch: 43, train_loss: 0.4548, test_loss: 1.0499, test_f1: 0.6436
 epoch: 44, train_loss: 0.4342, test_loss: 1.1187, test_f1: 0.6382
 epoch: 45, train_loss: 0.4452, test_loss: 1.1617, test_f1: 0.6329
 epoch: 46, train_loss: 0.4718, test_loss: 1.1434, test_f1: 0.5983
 epoch: 47, train_loss: 0.4461, test_loss: 1.1208, test_f1: 0.6230
 epoch: 48, train_loss: 0.4262, test_loss: 1.1475, test_f1: 0.6197
 epoch: 49, train_loss: 0.4156, test_loss: 1.2731, test_f1: 0.6211
 epoch: 50, train_loss: 0.4196, test_loss: 1.1944, test_f1: 0.6262
 epoch: 51, train_loss: 0.3839, test_loss: 1.2161, test_f1: 0.6489
 epoch: 52, train_loss: 0.3610, test_loss: 1.2686, test_f1: 0.6536
 epoch: 53, train_loss: 0.3331, test_loss: 1.3143, test_f1: 0.6281
 epoch: 54, train_loss: 0.3235, test_loss: 1.3041, test_f1: 0.6296
 epoch: 55, train_loss: 0.3255, test_loss: 1.3689, test_f1: 0.6556
 epoch: 56, train_loss: 0.3148, test_loss: 1.3419, test_f1: 0.6105
 epoch: 57, train_loss: 0.3068, test_loss: 1.3824, test_f1: 0.6306
 epoch: 58, train_loss: 0.2927, test_loss: 1.3646, test_f1: 0.6369
 epoch: 59, train_loss: 0.2805, test_loss: 1.4258, test_f1: 0.6170
 epoch: 60, train_loss: 0.2853, test_loss: 1.4762, test_f1: 0.6343
 epoch: 61, train_loss: 0.2880, test_loss: 1.4658, test_f1: 0.6176
 epoch: 62, train_loss: 0.2846, test_loss: 1.4830, test_f1: 0.6338
 epoch: 63, train_loss: 0.2840, test_loss: 1.4558, test_f1: 0.6429
 epoch: 64, train_loss: 0.2720, test_loss: 1.3925, test_f1: 0.6534
 epoch: 65, train_loss: 0.2866, test_loss: 1.3383, test_f1: 0.6610
 epoch: 66, train_loss: 0.2812, test_loss: 1.4264, test_f1: 0.6484
 epoch: 67, train_loss: 0.2600, test_loss: 1.4986, test_f1: 0.6242
 epoch: 68, train_loss: 0.2440, test_loss: 1.4559, test_f1: 0.6400
 epoch: 69, train_loss: 0.2621, test_loss: 1.5858, test_f1: 0.6390
 epoch: 70, train_loss: 0.2596, test_loss: 1.5618, test_f1: 0.6311
 epoch: 71, train_loss: 0.2639, test_loss: 1.6167, test_f1: 0.6157
 epoch: 72, train_loss: 0.2581, test_loss: 1.5699, test_f1: 0.6262
 epoch: 73, train_loss: 0.2502, test_loss: 1.6010, test_f1: 0.6348
 epoch: 74, train_loss: 0.2394, test_loss: 1.5681, test_f1: 0.6340
 epoch: 75, train_loss: 0.2349, test_loss: 1.5861, test_f1: 0.6258
 epoch: 76, train_loss: 0.2398, test_loss: 1.5333, test_f1: 0.6357
 epoch: 77, train_loss: 0.2363, test_loss: 1.6500, test_f1: 0.6537
 epoch: 78, train_loss: 0.2265, test_loss: 1.5657, test_f1: 0.6511
 epoch: 79, train_loss: 0.2300, test_loss: 1.5872, test_f1: 0.6336
 epoch: 80, train_loss: 0.2355, test_loss: 1.7535, test_f1: 0.6262
 epoch: 81, train_loss: 0.2439, test_loss: 1.7292, test_f1: 0.6323
 epoch: 82, train_loss: 0.2324, test_loss: 1.6233, test_f1: 0.6503
 epoch: 83, train_loss: 0.2466, test_loss: 1.5627, test_f1: 0.6374
 epoch: 84, train_loss: 0.2234, test_loss: 1.6297, test_f1: 0.6397
 epoch: 85, train_loss: 0.2315, test_loss: 1.7375, test_f1: 0.6179
 epoch: 86, train_loss: 0.2198, test_loss: 1.7640, test_f1: 0.6536
 epoch: 87, train_loss: 0.2153, test_loss: 1.6632, test_f1: 0.6341
 epoch: 88, train_loss: 0.2164, test_loss: 1.8021, test_f1: 0.6260
 epoch: 89, train_loss: 0.2255, test_loss: 1.7035, test_f1: 0.6264
 epoch: 90, train_loss: 0.2115, test_loss: 1.9292, test_f1: 0.6013
 epoch: 91, train_loss: 0.2320, test_loss: 1.9346, test_f1: 0.6263
 epoch: 92, train_loss: 0.2305, test_loss: 1.6536, test_f1: 0.6311
 epoch: 93, train_loss: 0.2158, test_loss: 1.8140, test_f1: 0.6250
 epoch: 94, train_loss: 0.2017, test_loss: 1.7582, test_f1: 0.6412
 epoch: 95, train_loss: 0.1857, test_loss: 1.9007, test_f1: 0.6403
 epoch: 96, train_loss: 0.2160, test_loss: 1.7912, test_f1: 0.6439
 epoch: 97, train_loss: 0.2109, test_loss: 1.8519, test_f1: 0.6262
 epoch: 98, train_loss: 0.1812, test_loss: 1.9117, test_f1: 0.6175
 epoch: 99, train_loss: 0.1964, test_loss: 1.9094, test_f1: 0.6299
##################ITERATION #9 ****************************************
 epoch: 0, train_loss: 1.6547, test_loss: 1.3906, test_f1: 0.2270
 epoch: 1, train_loss: 1.0717, test_loss: 1.1274, test_f1: 0.3171
 epoch: 2, train_loss: 0.9791, test_loss: 1.0336, test_f1: 0.3750
 epoch: 3, train_loss: 0.9456, test_loss: 0.9720, test_f1: 0.4179
 epoch: 4, train_loss: 0.9158, test_loss: 0.9419, test_f1: 0.4806
 epoch: 5, train_loss: 0.8908, test_loss: 0.9150, test_f1: 0.5169
 epoch: 6, train_loss: 0.8564, test_loss: 0.9320, test_f1: 0.5237
 epoch: 7, train_loss: 0.8450, test_loss: 0.9285, test_f1: 0.5114
 epoch: 8, train_loss: 0.8302, test_loss: 0.9154, test_f1: 0.5283
 epoch: 9, train_loss: 0.7913, test_loss: 0.9007, test_f1: 0.5424
 epoch: 10, train_loss: 0.8091, test_loss: 0.9247, test_f1: 0.5734
 epoch: 11, train_loss: 0.8036, test_loss: 0.8880, test_f1: 0.5706
 epoch: 12, train_loss: 0.7780, test_loss: 0.8631, test_f1: 0.5905
 epoch: 13, train_loss: 0.7774, test_loss: 0.8868, test_f1: 0.5617
 epoch: 14, train_loss: 0.7553, test_loss: 0.8965, test_f1: 0.5523
 epoch: 15, train_loss: 0.7449, test_loss: 0.9038, test_f1: 0.5886
 epoch: 16, train_loss: 0.7330, test_loss: 0.8978, test_f1: 0.5665
 epoch: 17, train_loss: 0.7224, test_loss: 0.9415, test_f1: 0.5955
 epoch: 18, train_loss: 0.7208, test_loss: 0.9930, test_f1: 0.5725
 epoch: 19, train_loss: 0.7076, test_loss: 0.8837, test_f1: 0.5932
 epoch: 20, train_loss: 0.6821, test_loss: 0.8979, test_f1: 0.5815
 epoch: 21, train_loss: 0.6801, test_loss: 1.2702, test_f1: 0.4648
 epoch: 22, train_loss: 0.6919, test_loss: 0.8705, test_f1: 0.5874
 epoch: 23, train_loss: 0.6857, test_loss: 0.8939, test_f1: 0.6105
 epoch: 24, train_loss: 0.6773, test_loss: 1.0219, test_f1: 0.5489
 epoch: 25, train_loss: 0.6539, test_loss: 1.0317, test_f1: 0.5660
 epoch: 26, train_loss: 0.6423, test_loss: 0.9444, test_f1: 0.5959
 epoch: 27, train_loss: 0.6403, test_loss: 0.8661, test_f1: 0.6134
 epoch: 28, train_loss: 0.6257, test_loss: 0.9670, test_f1: 0.5948
 epoch: 29, train_loss: 0.6060, test_loss: 1.0156, test_f1: 0.6367
 epoch: 30, train_loss: 0.6149, test_loss: 0.9744, test_f1: 0.6362
 epoch: 31, train_loss: 0.5912, test_loss: 0.9609, test_f1: 0.5931
 epoch: 32, train_loss: 0.5697, test_loss: 1.1077, test_f1: 0.5677
 epoch: 33, train_loss: 0.5880, test_loss: 1.0031, test_f1: 0.6152
 epoch: 34, train_loss: 0.5723, test_loss: 0.9717, test_f1: 0.6026
 epoch: 35, train_loss: 0.5686, test_loss: 1.0891, test_f1: 0.5934
 epoch: 36, train_loss: 0.5633, test_loss: 1.0546, test_f1: 0.5934
 epoch: 37, train_loss: 0.5481, test_loss: 0.8871, test_f1: 0.6393
 epoch: 38, train_loss: 0.5291, test_loss: 0.9574, test_f1: 0.6125
 epoch: 39, train_loss: 0.5294, test_loss: 1.0922, test_f1: 0.5867
 epoch: 40, train_loss: 0.5686, test_loss: 1.0829, test_f1: 0.6035
 epoch: 41, train_loss: 0.5344, test_loss: 1.0551, test_f1: 0.6414
 epoch: 42, train_loss: 0.5038, test_loss: 0.9586, test_f1: 0.6503
 epoch: 43, train_loss: 0.4935, test_loss: 0.9960, test_f1: 0.6409
 epoch: 44, train_loss: 0.4928, test_loss: 1.1573, test_f1: 0.5802
 epoch: 45, train_loss: 0.4982, test_loss: 1.1632, test_f1: 0.5803
 epoch: 46, train_loss: 0.4850, test_loss: 1.0808, test_f1: 0.6403
 epoch: 47, train_loss: 0.4794, test_loss: 1.0957, test_f1: 0.6260
 epoch: 48, train_loss: 0.4632, test_loss: 1.1108, test_f1: 0.6167
 epoch: 49, train_loss: 0.4634, test_loss: 1.1496, test_f1: 0.6291
 epoch: 50, train_loss: 0.4625, test_loss: 1.1681, test_f1: 0.6312
 epoch: 51, train_loss: 0.4235, test_loss: 1.0801, test_f1: 0.6294
 epoch: 52, train_loss: 0.3834, test_loss: 1.1079, test_f1: 0.6248
 epoch: 53, train_loss: 0.3591, test_loss: 1.2793, test_f1: 0.6149
 epoch: 54, train_loss: 0.3566, test_loss: 1.2057, test_f1: 0.6400
 epoch: 55, train_loss: 0.3612, test_loss: 1.1533, test_f1: 0.6251
 epoch: 56, train_loss: 0.3363, test_loss: 1.2770, test_f1: 0.6376
 epoch: 57, train_loss: 0.3294, test_loss: 1.2736, test_f1: 0.6200
 epoch: 58, train_loss: 0.3252, test_loss: 1.3096, test_f1: 0.6411
 epoch: 59, train_loss: 0.3402, test_loss: 1.2525, test_f1: 0.6637
 epoch: 60, train_loss: 0.3214, test_loss: 1.2843, test_f1: 0.6254
 epoch: 61, train_loss: 0.3273, test_loss: 1.3828, test_f1: 0.6059
 epoch: 62, train_loss: 0.3355, test_loss: 1.2716, test_f1: 0.6402
 epoch: 63, train_loss: 0.3079, test_loss: 1.3732, test_f1: 0.6281
 epoch: 64, train_loss: 0.2962, test_loss: 1.3778, test_f1: 0.6401
 epoch: 65, train_loss: 0.3071, test_loss: 1.3240, test_f1: 0.6419
 epoch: 66, train_loss: 0.2880, test_loss: 1.3097, test_f1: 0.6361
 epoch: 67, train_loss: 0.2869, test_loss: 1.3851, test_f1: 0.6177
 epoch: 68, train_loss: 0.2906, test_loss: 1.4504, test_f1: 0.6176
 epoch: 69, train_loss: 0.2903, test_loss: 1.3601, test_f1: 0.6229
 epoch: 70, train_loss: 0.2773, test_loss: 1.4064, test_f1: 0.6372
 epoch: 71, train_loss: 0.2661, test_loss: 1.4105, test_f1: 0.6299
 epoch: 72, train_loss: 0.2896, test_loss: 1.3955, test_f1: 0.6395
 epoch: 73, train_loss: 0.2742, test_loss: 1.4414, test_f1: 0.6314
 epoch: 74, train_loss: 0.2788, test_loss: 1.3731, test_f1: 0.6463
 epoch: 75, train_loss: 0.2780, test_loss: 1.5963, test_f1: 0.6209
 epoch: 76, train_loss: 0.2660, test_loss: 1.4754, test_f1: 0.6219
 epoch: 77, train_loss: 0.2668, test_loss: 1.4333, test_f1: 0.6285
 epoch: 78, train_loss: 0.2629, test_loss: 1.5911, test_f1: 0.6095
 epoch: 79, train_loss: 0.2569, test_loss: 1.4280, test_f1: 0.6447
 epoch: 80, train_loss: 0.2589, test_loss: 1.4145, test_f1: 0.6605
 epoch: 81, train_loss: 0.2414, test_loss: 1.5763, test_f1: 0.6159
 epoch: 82, train_loss: 0.2512, test_loss: 1.4129, test_f1: 0.6360
 epoch: 83, train_loss: 0.2347, test_loss: 1.5200, test_f1: 0.6253
 epoch: 84, train_loss: 0.2279, test_loss: 1.7126, test_f1: 0.6184
 epoch: 85, train_loss: 0.2327, test_loss: 1.6561, test_f1: 0.6215
 epoch: 86, train_loss: 0.2400, test_loss: 1.5725, test_f1: 0.6415
 epoch: 87, train_loss: 0.2131, test_loss: 1.6956, test_f1: 0.6260
 epoch: 88, train_loss: 0.2267, test_loss: 1.7065, test_f1: 0.6241
 epoch: 89, train_loss: 0.2265, test_loss: 1.5429, test_f1: 0.6317
 epoch: 90, train_loss: 0.2231, test_loss: 1.6415, test_f1: 0.6118
 epoch: 91, train_loss: 0.2401, test_loss: 1.5709, test_f1: 0.6338
 epoch: 92, train_loss: 0.2312, test_loss: 1.8827, test_f1: 0.6036
 epoch: 93, train_loss: 0.2496, test_loss: 1.7046, test_f1: 0.6191
 epoch: 94, train_loss: 0.2271, test_loss: 1.6666, test_f1: 0.6278
 epoch: 95, train_loss: 0.2354, test_loss: 1.8095, test_f1: 0.6353
 epoch: 96, train_loss: 0.2153, test_loss: 1.6841, test_f1: 0.6347
 epoch: 97, train_loss: 0.2054, test_loss: 1.6697, test_f1: 0.6204
 epoch: 98, train_loss: 0.2050, test_loss: 1.7312, test_f1: 0.6214
 epoch: 99, train_loss: 0.2084, test_loss: 1.7617, test_f1: 0.6295

Training completed in 418.07 seconds
Best F1: 0.7030 at epoch 63
Mean F1 across iterations: 0.6736  0.0134
========================FINAL RESULTS================================
FEGIN weighted F1: 0.7030  0.0134
python main.py --data ltspice_examples --representation component_net --model FEGIN --layers 4 --hiddens 128 --batch_size 256 --lr 0.001 --emb_size 128 --epochs 100 --save_appendix component_net_L4_H128_BS256_LR0.001_E128 --no_val
-----



STDERR:
  File "main.py", line 370, in <module>
    main()
  File "main.py", line 254, in main
    dataset = dataset_class(
  File "/home/philip/projects/ltspice_examples_code_repo/Circuit-Completion-Using-GNNs/component_classification_with_link_prediction_head/evaluation/FEGIN/kernel/circuit_datasets.py", line 15, in __init__
    self.data, self.slices = torch.load(self.processed_paths[0])
  File "/home/philip/.local/lib/python3.8/site-packages/torch/serialization.py", line 1040, in load
    warnings.warn(
  File "/usr/lib/python3.8/warnings.py", line 109, in _showwarnmsg
    sw(msg.message, msg.category, msg.filename, msg.lineno,
  File "main.py", line 47, in warn_with_traceback
    traceback.print_stack(file=log)
/home/philip/projects/ltspice_examples_code_repo/Circuit-Completion-Using-GNNs/component_classification_with_link_prediction_head/evaluation/FEGIN/kernel/circuit_datasets.py:15: FutureWarning: You are using `torch.load` with `weights_only=False` (the current default value), which uses the default pickle module implicitly. It is possible to construct malicious pickle data which will execute arbitrary code during unpickling (See https://github.com/pytorch/pytorch/blob/main/SECURITY.md#untrusted-models for more details). In a future release, the default value for `weights_only` will be flipped to `True`. This limits the functions that could be executed during unpickling. Arbitrary objects will no longer be allowed to be loaded via this mode unless they are explicitly allowlisted by the user via `torch.serialization.add_safe_globals`. We recommend you start setting `weights_only=True` for any use case where you don't have full control of the loaded file. Please open an issue on GitHub for any issues related to this experimental feature.
  self.data, self.slices = torch.load(self.processed_paths[0])
