STDOUT:
Results will be saved in /home/philip/projects/ltspice_examples_code_repo/Circuit-Completion-Using-GNNs/component_classification_with_link_prediction_head/evaluation/FEGIN/results/model_FEGIN_dataset_ltspice_examples
Command line input: python main.py --data ltspice_examples --representation component_pin --model FEGIN --layers 6 --hiddens 64 --batch_size 128 --lr 0.0001 --emb_size 250 --epochs 100 --save_appendix component_pin_L6_H64_BS128_LR0.0001_E250 --no_val
 is saved.
-----
ltspice_examples - FEGIN
Using 6 layers, 64 hidden units, h = 2
Loading component_pin representation dataset
ENTERED
Training FEGIN on component_pin representation
Train: 3560, Test: 848
##################ITERATION #0 ****************************************
 epoch: 0, train_loss: 1.3880, test_loss: 1.3844, test_f1: 0.1694
 epoch: 1, train_loss: 1.3701, test_loss: 1.3738, test_f1: 0.3241
 epoch: 2, train_loss: 1.3520, test_loss: 1.3478, test_f1: 0.2457
 epoch: 3, train_loss: 1.3265, test_loss: 1.3163, test_f1: 0.2260
 epoch: 4, train_loss: 1.2960, test_loss: 1.2812, test_f1: 0.2260
 epoch: 5, train_loss: 1.2696, test_loss: 1.2545, test_f1: 0.2260
 epoch: 6, train_loss: 1.2471, test_loss: 1.2350, test_f1: 0.2260
 epoch: 7, train_loss: 1.2300, test_loss: 1.2140, test_f1: 0.2260
 epoch: 8, train_loss: 1.2127, test_loss: 1.1902, test_f1: 0.2260
 epoch: 9, train_loss: 1.2010, test_loss: 1.1752, test_f1: 0.2311
 epoch: 10, train_loss: 1.1853, test_loss: 1.1606, test_f1: 0.3337
 epoch: 11, train_loss: 1.1691, test_loss: 1.1484, test_f1: 0.3460
 epoch: 12, train_loss: 1.1520, test_loss: 1.1319, test_f1: 0.3515
 epoch: 13, train_loss: 1.1342, test_loss: 1.1128, test_f1: 0.3795
 epoch: 14, train_loss: 1.1152, test_loss: 1.1047, test_f1: 0.3951
 epoch: 15, train_loss: 1.0936, test_loss: 1.0805, test_f1: 0.4097
 epoch: 16, train_loss: 1.0739, test_loss: 1.0606, test_f1: 0.4012
 epoch: 17, train_loss: 1.0522, test_loss: 1.0468, test_f1: 0.4464
 epoch: 18, train_loss: 1.0368, test_loss: 1.0362, test_f1: 0.4174
 epoch: 19, train_loss: 1.0208, test_loss: 1.0165, test_f1: 0.3985
 epoch: 20, train_loss: 1.0063, test_loss: 1.0151, test_f1: 0.4326
 epoch: 21, train_loss: 1.0056, test_loss: 1.0054, test_f1: 0.4379
 epoch: 22, train_loss: 0.9928, test_loss: 1.0087, test_f1: 0.4216
 epoch: 23, train_loss: 0.9889, test_loss: 1.0212, test_f1: 0.4325
 epoch: 24, train_loss: 0.9767, test_loss: 1.0034, test_f1: 0.4350
 epoch: 25, train_loss: 0.9707, test_loss: 1.0077, test_f1: 0.4591
 epoch: 26, train_loss: 0.9637, test_loss: 1.0050, test_f1: 0.4548
 epoch: 27, train_loss: 0.9677, test_loss: 0.9985, test_f1: 0.4466
 epoch: 28, train_loss: 0.9522, test_loss: 1.0013, test_f1: 0.4810
 epoch: 29, train_loss: 0.9497, test_loss: 0.9856, test_f1: 0.4534
 epoch: 30, train_loss: 0.9458, test_loss: 1.0008, test_f1: 0.4616
 epoch: 31, train_loss: 0.9439, test_loss: 0.9812, test_f1: 0.4632
 epoch: 32, train_loss: 0.9340, test_loss: 0.9943, test_f1: 0.4537
 epoch: 33, train_loss: 0.9284, test_loss: 0.9681, test_f1: 0.4779
 epoch: 34, train_loss: 0.9322, test_loss: 0.9716, test_f1: 0.4996
 epoch: 35, train_loss: 0.9242, test_loss: 0.9818, test_f1: 0.5032
 epoch: 36, train_loss: 0.9195, test_loss: 0.9746, test_f1: 0.5163
 epoch: 37, train_loss: 0.9125, test_loss: 0.9654, test_f1: 0.4831
 epoch: 38, train_loss: 0.9078, test_loss: 0.9504, test_f1: 0.5222
 epoch: 39, train_loss: 0.9089, test_loss: 0.9610, test_f1: 0.5197
 epoch: 40, train_loss: 0.9050, test_loss: 0.9570, test_f1: 0.5174
 epoch: 41, train_loss: 0.8963, test_loss: 0.9448, test_f1: 0.5044
 epoch: 42, train_loss: 0.9025, test_loss: 0.9405, test_f1: 0.5242
 epoch: 43, train_loss: 0.8831, test_loss: 0.9401, test_f1: 0.5096
 epoch: 44, train_loss: 0.8876, test_loss: 0.9418, test_f1: 0.5232
 epoch: 45, train_loss: 0.8704, test_loss: 0.9187, test_f1: 0.5332
 epoch: 46, train_loss: 0.8759, test_loss: 0.9258, test_f1: 0.5364
 epoch: 47, train_loss: 0.8654, test_loss: 0.9033, test_f1: 0.5308
 epoch: 48, train_loss: 0.8596, test_loss: 0.9178, test_f1: 0.5424
 epoch: 49, train_loss: 0.8693, test_loss: 0.9130, test_f1: 0.5333
 epoch: 50, train_loss: 0.8599, test_loss: 0.9321, test_f1: 0.5205
 epoch: 51, train_loss: 0.8491, test_loss: 0.8977, test_f1: 0.5483
 epoch: 52, train_loss: 0.8447, test_loss: 0.8978, test_f1: 0.5411
 epoch: 53, train_loss: 0.8425, test_loss: 0.8975, test_f1: 0.5488
 epoch: 54, train_loss: 0.8294, test_loss: 0.9020, test_f1: 0.5339
 epoch: 55, train_loss: 0.8344, test_loss: 0.9011, test_f1: 0.5453
 epoch: 56, train_loss: 0.8309, test_loss: 0.8903, test_f1: 0.5504
 epoch: 57, train_loss: 0.8325, test_loss: 0.8813, test_f1: 0.5595
 epoch: 58, train_loss: 0.8276, test_loss: 0.8865, test_f1: 0.5585
 epoch: 59, train_loss: 0.8168, test_loss: 0.8849, test_f1: 0.5494
 epoch: 60, train_loss: 0.8193, test_loss: 0.9032, test_f1: 0.5445
 epoch: 61, train_loss: 0.8150, test_loss: 0.8952, test_f1: 0.5544
 epoch: 62, train_loss: 0.8082, test_loss: 0.8781, test_f1: 0.5699
 epoch: 63, train_loss: 0.8150, test_loss: 0.9031, test_f1: 0.5375
 epoch: 64, train_loss: 0.8165, test_loss: 0.8992, test_f1: 0.5426
 epoch: 65, train_loss: 0.8060, test_loss: 0.8955, test_f1: 0.5498
 epoch: 66, train_loss: 0.8081, test_loss: 0.8792, test_f1: 0.5591
 epoch: 67, train_loss: 0.8072, test_loss: 0.8869, test_f1: 0.5717
 epoch: 68, train_loss: 0.8105, test_loss: 0.8945, test_f1: 0.5494
 epoch: 69, train_loss: 0.8078, test_loss: 0.8866, test_f1: 0.5560
 epoch: 70, train_loss: 0.7952, test_loss: 0.8788, test_f1: 0.5701
 epoch: 71, train_loss: 0.8056, test_loss: 0.8821, test_f1: 0.5553
 epoch: 72, train_loss: 0.7928, test_loss: 0.8851, test_f1: 0.5630
 epoch: 73, train_loss: 0.7930, test_loss: 0.8717, test_f1: 0.5587
 epoch: 74, train_loss: 0.7910, test_loss: 0.8900, test_f1: 0.5445
 epoch: 75, train_loss: 0.7843, test_loss: 0.8817, test_f1: 0.5592
 epoch: 76, train_loss: 0.7826, test_loss: 0.8745, test_f1: 0.5614
 epoch: 77, train_loss: 0.7791, test_loss: 0.8785, test_f1: 0.5592
 epoch: 78, train_loss: 0.7742, test_loss: 0.8809, test_f1: 0.5540
 epoch: 79, train_loss: 0.7838, test_loss: 0.8876, test_f1: 0.5551
 epoch: 80, train_loss: 0.7891, test_loss: 0.8681, test_f1: 0.5536
 epoch: 81, train_loss: 0.7809, test_loss: 0.8903, test_f1: 0.5395
 epoch: 82, train_loss: 0.7725, test_loss: 0.8646, test_f1: 0.5669
 epoch: 83, train_loss: 0.7772, test_loss: 0.8721, test_f1: 0.5653
 epoch: 84, train_loss: 0.7717, test_loss: 0.8712, test_f1: 0.5578
 epoch: 85, train_loss: 0.7702, test_loss: 0.8755, test_f1: 0.5572
 epoch: 86, train_loss: 0.7681, test_loss: 0.8725, test_f1: 0.5721
 epoch: 87, train_loss: 0.7595, test_loss: 0.8813, test_f1: 0.5591
 epoch: 88, train_loss: 0.7610, test_loss: 0.8884, test_f1: 0.5613
 epoch: 89, train_loss: 0.7533, test_loss: 0.8752, test_f1: 0.5569
 epoch: 90, train_loss: 0.7489, test_loss: 0.8760, test_f1: 0.5691
 epoch: 91, train_loss: 0.7539, test_loss: 0.8733, test_f1: 0.5753
 epoch: 92, train_loss: 0.7431, test_loss: 0.8766, test_f1: 0.5671
 epoch: 93, train_loss: 0.7456, test_loss: 0.8880, test_f1: 0.5702
 epoch: 94, train_loss: 0.7513, test_loss: 0.8683, test_f1: 0.5657
 epoch: 95, train_loss: 0.7480, test_loss: 0.8709, test_f1: 0.5671
 epoch: 96, train_loss: 0.7469, test_loss: 0.8730, test_f1: 0.5612
 epoch: 97, train_loss: 0.7451, test_loss: 0.8849, test_f1: 0.5651
 epoch: 98, train_loss: 0.7357, test_loss: 0.8988, test_f1: 0.5674
 epoch: 99, train_loss: 0.7374, test_loss: 0.8782, test_f1: 0.5570
##################ITERATION #1 ****************************************
 epoch: 0, train_loss: 1.3534, test_loss: 1.3573, test_f1: 0.2266
 epoch: 1, train_loss: 1.3100, test_loss: 1.3429, test_f1: 0.2260
 epoch: 2, train_loss: 1.2761, test_loss: 1.2669, test_f1: 0.2383
 epoch: 3, train_loss: 1.2411, test_loss: 1.2145, test_f1: 0.3338
 epoch: 4, train_loss: 1.2043, test_loss: 1.1739, test_f1: 0.3371
 epoch: 5, train_loss: 1.1722, test_loss: 1.1402, test_f1: 0.3410
 epoch: 6, train_loss: 1.1412, test_loss: 1.1127, test_f1: 0.3387
 epoch: 7, train_loss: 1.1105, test_loss: 1.0871, test_f1: 0.3369
 epoch: 8, train_loss: 1.0873, test_loss: 1.0731, test_f1: 0.3583
 epoch: 9, train_loss: 1.0596, test_loss: 1.0544, test_f1: 0.3650
 epoch: 10, train_loss: 1.0412, test_loss: 1.0518, test_f1: 0.4006
 epoch: 11, train_loss: 1.0308, test_loss: 1.0494, test_f1: 0.3983
 epoch: 12, train_loss: 1.0243, test_loss: 1.0344, test_f1: 0.4365
 epoch: 13, train_loss: 1.0037, test_loss: 1.0360, test_f1: 0.4262
 epoch: 14, train_loss: 0.9968, test_loss: 1.0408, test_f1: 0.4491
 epoch: 15, train_loss: 0.9885, test_loss: 1.0179, test_f1: 0.4800
 epoch: 16, train_loss: 0.9818, test_loss: 1.0159, test_f1: 0.4876
 epoch: 17, train_loss: 0.9681, test_loss: 1.0025, test_f1: 0.4985
 epoch: 18, train_loss: 0.9725, test_loss: 1.0057, test_f1: 0.4921
 epoch: 19, train_loss: 0.9480, test_loss: 1.0019, test_f1: 0.4970
 epoch: 20, train_loss: 0.9537, test_loss: 1.0077, test_f1: 0.4902
 epoch: 21, train_loss: 0.9365, test_loss: 0.9915, test_f1: 0.5097
 epoch: 22, train_loss: 0.9353, test_loss: 0.9923, test_f1: 0.5220
 epoch: 23, train_loss: 0.9241, test_loss: 1.0111, test_f1: 0.4930
 epoch: 24, train_loss: 0.9177, test_loss: 0.9875, test_f1: 0.5070
 epoch: 25, train_loss: 0.9115, test_loss: 0.9852, test_f1: 0.5044
 epoch: 26, train_loss: 0.8966, test_loss: 0.9843, test_f1: 0.4959
 epoch: 27, train_loss: 0.8951, test_loss: 0.9764, test_f1: 0.5203
 epoch: 28, train_loss: 0.8891, test_loss: 0.9671, test_f1: 0.5163
 epoch: 29, train_loss: 0.8786, test_loss: 0.9787, test_f1: 0.5229
 epoch: 30, train_loss: 0.8758, test_loss: 0.9666, test_f1: 0.5055
 epoch: 31, train_loss: 0.8772, test_loss: 0.9734, test_f1: 0.5302
 epoch: 32, train_loss: 0.8710, test_loss: 0.9719, test_f1: 0.5232
 epoch: 33, train_loss: 0.8581, test_loss: 0.9731, test_f1: 0.5317
 epoch: 34, train_loss: 0.8491, test_loss: 0.9666, test_f1: 0.5118
 epoch: 35, train_loss: 0.8469, test_loss: 0.9810, test_f1: 0.5170
 epoch: 36, train_loss: 0.8442, test_loss: 0.9670, test_f1: 0.5162
 epoch: 37, train_loss: 0.8279, test_loss: 0.9670, test_f1: 0.5189
 epoch: 38, train_loss: 0.8259, test_loss: 0.9592, test_f1: 0.5305
 epoch: 39, train_loss: 0.8216, test_loss: 0.9804, test_f1: 0.5344
 epoch: 40, train_loss: 0.8146, test_loss: 0.9435, test_f1: 0.5233
 epoch: 41, train_loss: 0.8060, test_loss: 0.9593, test_f1: 0.5249
 epoch: 42, train_loss: 0.8029, test_loss: 0.9481, test_f1: 0.5135
 epoch: 43, train_loss: 0.7958, test_loss: 0.9466, test_f1: 0.5247
 epoch: 44, train_loss: 0.7920, test_loss: 0.9674, test_f1: 0.5255
 epoch: 45, train_loss: 0.7901, test_loss: 0.9847, test_f1: 0.5263
 epoch: 46, train_loss: 0.7831, test_loss: 0.9509, test_f1: 0.5236
 epoch: 47, train_loss: 0.7882, test_loss: 0.9536, test_f1: 0.5367
 epoch: 48, train_loss: 0.7722, test_loss: 0.9562, test_f1: 0.5328
 epoch: 49, train_loss: 0.7643, test_loss: 0.9546, test_f1: 0.5412
 epoch: 50, train_loss: 0.7441, test_loss: 0.9701, test_f1: 0.5207
 epoch: 51, train_loss: 0.7530, test_loss: 0.9460, test_f1: 0.5518
 epoch: 52, train_loss: 0.7572, test_loss: 0.9624, test_f1: 0.5397
 epoch: 53, train_loss: 0.7415, test_loss: 0.9606, test_f1: 0.5247
 epoch: 54, train_loss: 0.7446, test_loss: 0.9554, test_f1: 0.5344
 epoch: 55, train_loss: 0.7302, test_loss: 0.9461, test_f1: 0.5576
 epoch: 56, train_loss: 0.7321, test_loss: 0.9561, test_f1: 0.5426
 epoch: 57, train_loss: 0.7309, test_loss: 0.9557, test_f1: 0.5350
 epoch: 58, train_loss: 0.7313, test_loss: 0.9471, test_f1: 0.5502
 epoch: 59, train_loss: 0.7313, test_loss: 0.9322, test_f1: 0.5254
 epoch: 60, train_loss: 0.7307, test_loss: 0.9599, test_f1: 0.5357
 epoch: 61, train_loss: 0.7286, test_loss: 0.9328, test_f1: 0.5516
 epoch: 62, train_loss: 0.7232, test_loss: 0.9556, test_f1: 0.5244
 epoch: 63, train_loss: 0.7281, test_loss: 0.9603, test_f1: 0.5335
 epoch: 64, train_loss: 0.7136, test_loss: 0.9639, test_f1: 0.5361
 epoch: 65, train_loss: 0.7138, test_loss: 0.9703, test_f1: 0.5459
 epoch: 66, train_loss: 0.7184, test_loss: 0.9759, test_f1: 0.5399
 epoch: 67, train_loss: 0.7087, test_loss: 0.9726, test_f1: 0.5272
 epoch: 68, train_loss: 0.7119, test_loss: 0.9881, test_f1: 0.5332
 epoch: 69, train_loss: 0.7108, test_loss: 0.9826, test_f1: 0.5322
 epoch: 70, train_loss: 0.7031, test_loss: 0.9699, test_f1: 0.5394
 epoch: 71, train_loss: 0.6873, test_loss: 0.9755, test_f1: 0.5348
 epoch: 72, train_loss: 0.7042, test_loss: 0.9768, test_f1: 0.5271
 epoch: 73, train_loss: 0.7003, test_loss: 0.9748, test_f1: 0.5357
 epoch: 74, train_loss: 0.6874, test_loss: 0.9646, test_f1: 0.5368
 epoch: 75, train_loss: 0.6952, test_loss: 1.0009, test_f1: 0.5366
 epoch: 76, train_loss: 0.6983, test_loss: 0.9771, test_f1: 0.5457
 epoch: 77, train_loss: 0.6958, test_loss: 0.9846, test_f1: 0.5281
 epoch: 78, train_loss: 0.6747, test_loss: 0.9967, test_f1: 0.5390
 epoch: 79, train_loss: 0.6792, test_loss: 0.9651, test_f1: 0.5458
 epoch: 80, train_loss: 0.6855, test_loss: 0.9647, test_f1: 0.5405
 epoch: 81, train_loss: 0.6786, test_loss: 0.9768, test_f1: 0.5204
 epoch: 82, train_loss: 0.6752, test_loss: 1.0011, test_f1: 0.5337
 epoch: 83, train_loss: 0.6783, test_loss: 1.0007, test_f1: 0.5321
 epoch: 84, train_loss: 0.6715, test_loss: 0.9959, test_f1: 0.5339
 epoch: 85, train_loss: 0.6827, test_loss: 0.9876, test_f1: 0.5348
 epoch: 86, train_loss: 0.6749, test_loss: 1.0302, test_f1: 0.5384
 epoch: 87, train_loss: 0.6710, test_loss: 1.0046, test_f1: 0.5479
 epoch: 88, train_loss: 0.6729, test_loss: 1.0300, test_f1: 0.5406
 epoch: 89, train_loss: 0.6645, test_loss: 1.0118, test_f1: 0.5325
 epoch: 90, train_loss: 0.6692, test_loss: 1.0162, test_f1: 0.5418
 epoch: 91, train_loss: 0.6592, test_loss: 1.0217, test_f1: 0.5285
 epoch: 92, train_loss: 0.6640, test_loss: 1.0228, test_f1: 0.5295
 epoch: 93, train_loss: 0.6699, test_loss: 1.0172, test_f1: 0.5268
 epoch: 94, train_loss: 0.6861, test_loss: 1.0258, test_f1: 0.5317
 epoch: 95, train_loss: 0.6597, test_loss: 1.0139, test_f1: 0.5508
 epoch: 96, train_loss: 0.6661, test_loss: 1.0285, test_f1: 0.5335
 epoch: 97, train_loss: 0.6574, test_loss: 1.0241, test_f1: 0.5491
 epoch: 98, train_loss: 0.6706, test_loss: 1.0122, test_f1: 0.5497
 epoch: 99, train_loss: 0.6620, test_loss: 1.0271, test_f1: 0.5434
##################ITERATION #2 ****************************************
 epoch: 0, train_loss: 1.3280, test_loss: 1.3421, test_f1: 0.2260
 epoch: 1, train_loss: 1.2843, test_loss: 1.2974, test_f1: 0.2582
 epoch: 2, train_loss: 1.2522, test_loss: 1.2293, test_f1: 0.3850
 epoch: 3, train_loss: 1.2172, test_loss: 1.1838, test_f1: 0.4127
 epoch: 4, train_loss: 1.1853, test_loss: 1.1454, test_f1: 0.4221
 epoch: 5, train_loss: 1.1492, test_loss: 1.1101, test_f1: 0.4333
 epoch: 6, train_loss: 1.1145, test_loss: 1.0830, test_f1: 0.4322
 epoch: 7, train_loss: 1.0868, test_loss: 1.0659, test_f1: 0.4387
 epoch: 8, train_loss: 1.0567, test_loss: 1.0439, test_f1: 0.4389
 epoch: 9, train_loss: 1.0427, test_loss: 1.0322, test_f1: 0.4457
 epoch: 10, train_loss: 1.0251, test_loss: 1.0257, test_f1: 0.4543
 epoch: 11, train_loss: 1.0202, test_loss: 1.0224, test_f1: 0.4655
 epoch: 12, train_loss: 0.9985, test_loss: 1.0119, test_f1: 0.4768
 epoch: 13, train_loss: 0.9881, test_loss: 1.0103, test_f1: 0.4819
 epoch: 14, train_loss: 0.9787, test_loss: 0.9993, test_f1: 0.4807
 epoch: 15, train_loss: 0.9690, test_loss: 0.9906, test_f1: 0.4862
 epoch: 16, train_loss: 0.9554, test_loss: 1.0040, test_f1: 0.4814
 epoch: 17, train_loss: 0.9460, test_loss: 0.9674, test_f1: 0.4794
 epoch: 18, train_loss: 0.9427, test_loss: 0.9778, test_f1: 0.4863
 epoch: 19, train_loss: 0.9411, test_loss: 0.9804, test_f1: 0.4782
 epoch: 20, train_loss: 0.9251, test_loss: 0.9604, test_f1: 0.4942
 epoch: 21, train_loss: 0.9165, test_loss: 0.9821, test_f1: 0.4962
 epoch: 22, train_loss: 0.9087, test_loss: 0.9509, test_f1: 0.4989
 epoch: 23, train_loss: 0.9096, test_loss: 0.9399, test_f1: 0.5111
 epoch: 24, train_loss: 0.8993, test_loss: 0.9676, test_f1: 0.4922
 epoch: 25, train_loss: 0.8870, test_loss: 0.9339, test_f1: 0.5172
 epoch: 26, train_loss: 0.8922, test_loss: 0.9412, test_f1: 0.5144
 epoch: 27, train_loss: 0.8789, test_loss: 0.9462, test_f1: 0.5235
 epoch: 28, train_loss: 0.8769, test_loss: 0.9353, test_f1: 0.5112
 epoch: 29, train_loss: 0.8665, test_loss: 0.9412, test_f1: 0.5098
 epoch: 30, train_loss: 0.8700, test_loss: 0.9626, test_f1: 0.5017
 epoch: 31, train_loss: 0.8611, test_loss: 0.9187, test_f1: 0.5198
 epoch: 32, train_loss: 0.8531, test_loss: 0.9550, test_f1: 0.4995
 epoch: 33, train_loss: 0.8491, test_loss: 0.9639, test_f1: 0.5196
 epoch: 34, train_loss: 0.8401, test_loss: 0.9336, test_f1: 0.5045
 epoch: 35, train_loss: 0.8456, test_loss: 0.9583, test_f1: 0.4963
 epoch: 36, train_loss: 0.8327, test_loss: 0.9520, test_f1: 0.5077
 epoch: 37, train_loss: 0.8129, test_loss: 0.9447, test_f1: 0.4998
 epoch: 38, train_loss: 0.8163, test_loss: 0.9461, test_f1: 0.5004
 epoch: 39, train_loss: 0.8107, test_loss: 0.9587, test_f1: 0.4890
 epoch: 40, train_loss: 0.8076, test_loss: 0.9583, test_f1: 0.4973
 epoch: 41, train_loss: 0.8085, test_loss: 0.9712, test_f1: 0.5047
 epoch: 42, train_loss: 0.8021, test_loss: 0.9837, test_f1: 0.4932
 epoch: 43, train_loss: 0.7919, test_loss: 0.9892, test_f1: 0.5002
 epoch: 44, train_loss: 0.7930, test_loss: 0.9621, test_f1: 0.4997
 epoch: 45, train_loss: 0.7800, test_loss: 0.9640, test_f1: 0.5142
 epoch: 46, train_loss: 0.7774, test_loss: 1.0077, test_f1: 0.4974
 epoch: 47, train_loss: 0.7762, test_loss: 0.9784, test_f1: 0.5070
 epoch: 48, train_loss: 0.7824, test_loss: 0.9583, test_f1: 0.5250
 epoch: 49, train_loss: 0.7611, test_loss: 0.9339, test_f1: 0.5226
 epoch: 50, train_loss: 0.7638, test_loss: 0.9335, test_f1: 0.5164
 epoch: 51, train_loss: 0.7470, test_loss: 0.9520, test_f1: 0.5144
 epoch: 52, train_loss: 0.7466, test_loss: 0.9710, test_f1: 0.5228
 epoch: 53, train_loss: 0.7495, test_loss: 0.9798, test_f1: 0.5159
 epoch: 54, train_loss: 0.7446, test_loss: 0.9640, test_f1: 0.5107
 epoch: 55, train_loss: 0.7456, test_loss: 0.9493, test_f1: 0.5150
 epoch: 56, train_loss: 0.7291, test_loss: 0.9747, test_f1: 0.5112
 epoch: 57, train_loss: 0.7373, test_loss: 1.0029, test_f1: 0.4981
 epoch: 58, train_loss: 0.7377, test_loss: 0.9709, test_f1: 0.5178
 epoch: 59, train_loss: 0.7316, test_loss: 0.9931, test_f1: 0.5165
 epoch: 60, train_loss: 0.7246, test_loss: 0.9756, test_f1: 0.5201
 epoch: 61, train_loss: 0.7231, test_loss: 0.9738, test_f1: 0.5225
 epoch: 62, train_loss: 0.7212, test_loss: 0.9968, test_f1: 0.5179
 epoch: 63, train_loss: 0.7277, test_loss: 0.9865, test_f1: 0.5120
 epoch: 64, train_loss: 0.7253, test_loss: 0.9772, test_f1: 0.5295
 epoch: 65, train_loss: 0.7186, test_loss: 0.9783, test_f1: 0.5060
 epoch: 66, train_loss: 0.7088, test_loss: 1.0100, test_f1: 0.5099
 epoch: 67, train_loss: 0.7181, test_loss: 1.0030, test_f1: 0.5124
 epoch: 68, train_loss: 0.7059, test_loss: 1.0132, test_f1: 0.5177
 epoch: 69, train_loss: 0.7117, test_loss: 1.0144, test_f1: 0.5159
 epoch: 70, train_loss: 0.7116, test_loss: 1.0253, test_f1: 0.5143
 epoch: 71, train_loss: 0.7030, test_loss: 0.9959, test_f1: 0.5104
 epoch: 72, train_loss: 0.7046, test_loss: 0.9735, test_f1: 0.5232
 epoch: 73, train_loss: 0.7008, test_loss: 1.0112, test_f1: 0.5038
 epoch: 74, train_loss: 0.7214, test_loss: 0.9850, test_f1: 0.5166
 epoch: 75, train_loss: 0.7030, test_loss: 1.0020, test_f1: 0.5064
 epoch: 76, train_loss: 0.6955, test_loss: 1.0223, test_f1: 0.5116
 epoch: 77, train_loss: 0.6972, test_loss: 1.0180, test_f1: 0.5223
 epoch: 78, train_loss: 0.6951, test_loss: 0.9957, test_f1: 0.5146
 epoch: 79, train_loss: 0.6896, test_loss: 1.0184, test_f1: 0.5046
 epoch: 80, train_loss: 0.6890, test_loss: 1.0270, test_f1: 0.5180
 epoch: 81, train_loss: 0.6911, test_loss: 0.9947, test_f1: 0.5157
 epoch: 82, train_loss: 0.6823, test_loss: 1.0288, test_f1: 0.5243
 epoch: 83, train_loss: 0.6904, test_loss: 1.0346, test_f1: 0.5192
 epoch: 84, train_loss: 0.6784, test_loss: 1.0191, test_f1: 0.5272
 epoch: 85, train_loss: 0.6852, test_loss: 0.9996, test_f1: 0.5364
 epoch: 86, train_loss: 0.6868, test_loss: 0.9848, test_f1: 0.5209
 epoch: 87, train_loss: 0.6797, test_loss: 0.9949, test_f1: 0.5175
 epoch: 88, train_loss: 0.6690, test_loss: 0.9854, test_f1: 0.5215
 epoch: 89, train_loss: 0.6805, test_loss: 1.0138, test_f1: 0.5179
 epoch: 90, train_loss: 0.6797, test_loss: 1.0436, test_f1: 0.5227
 epoch: 91, train_loss: 0.6763, test_loss: 1.0624, test_f1: 0.5144
 epoch: 92, train_loss: 0.6744, test_loss: 1.0091, test_f1: 0.5295
 epoch: 93, train_loss: 0.6695, test_loss: 0.9985, test_f1: 0.5374
 epoch: 94, train_loss: 0.6787, test_loss: 1.0136, test_f1: 0.5248
 epoch: 95, train_loss: 0.6649, test_loss: 1.0008, test_f1: 0.5327
 epoch: 96, train_loss: 0.6670, test_loss: 1.0072, test_f1: 0.5351
 epoch: 97, train_loss: 0.6721, test_loss: 1.0262, test_f1: 0.5279
 epoch: 98, train_loss: 0.6614, test_loss: 1.0071, test_f1: 0.5371
 epoch: 99, train_loss: 0.6701, test_loss: 1.0168, test_f1: 0.5276
##################ITERATION #3 ****************************************
 epoch: 0, train_loss: 1.2962, test_loss: 1.3060, test_f1: 0.2260
 epoch: 1, train_loss: 1.2472, test_loss: 1.2738, test_f1: 0.2260
 epoch: 2, train_loss: 1.2142, test_loss: 1.2109, test_f1: 0.2730
 epoch: 3, train_loss: 1.1796, test_loss: 1.1355, test_f1: 0.4506
 epoch: 4, train_loss: 1.1490, test_loss: 1.0955, test_f1: 0.4609
 epoch: 5, train_loss: 1.1167, test_loss: 1.0640, test_f1: 0.4637
 epoch: 6, train_loss: 1.0872, test_loss: 1.0372, test_f1: 0.4814
 epoch: 7, train_loss: 1.0620, test_loss: 1.0187, test_f1: 0.4893
 epoch: 8, train_loss: 1.0448, test_loss: 1.0057, test_f1: 0.4925
 epoch: 9, train_loss: 1.0284, test_loss: 0.9950, test_f1: 0.4773
 epoch: 10, train_loss: 1.0102, test_loss: 0.9835, test_f1: 0.4854
 epoch: 11, train_loss: 0.9897, test_loss: 0.9749, test_f1: 0.4880
 epoch: 12, train_loss: 0.9837, test_loss: 0.9700, test_f1: 0.4859
 epoch: 13, train_loss: 0.9664, test_loss: 0.9689, test_f1: 0.4811
 epoch: 14, train_loss: 0.9543, test_loss: 0.9586, test_f1: 0.4919
 epoch: 15, train_loss: 0.9393, test_loss: 0.9585, test_f1: 0.4808
 epoch: 16, train_loss: 0.9313, test_loss: 0.9419, test_f1: 0.4909
 epoch: 17, train_loss: 0.9323, test_loss: 0.9328, test_f1: 0.4937
 epoch: 18, train_loss: 0.9187, test_loss: 0.9345, test_f1: 0.5009
 epoch: 19, train_loss: 0.9055, test_loss: 0.9389, test_f1: 0.4908
 epoch: 20, train_loss: 0.9062, test_loss: 0.9314, test_f1: 0.4922
 epoch: 21, train_loss: 0.8944, test_loss: 0.9260, test_f1: 0.5007
 epoch: 22, train_loss: 0.8842, test_loss: 0.9100, test_f1: 0.5007
 epoch: 23, train_loss: 0.8755, test_loss: 0.8893, test_f1: 0.5197
 epoch: 24, train_loss: 0.8636, test_loss: 0.9382, test_f1: 0.4928
 epoch: 25, train_loss: 0.8652, test_loss: 0.9075, test_f1: 0.5061
 epoch: 26, train_loss: 0.8632, test_loss: 0.9050, test_f1: 0.5086
 epoch: 27, train_loss: 0.8559, test_loss: 0.8770, test_f1: 0.5312
 epoch: 28, train_loss: 0.8321, test_loss: 0.8899, test_f1: 0.5305
 epoch: 29, train_loss: 0.8322, test_loss: 0.9258, test_f1: 0.5145
 epoch: 30, train_loss: 0.8371, test_loss: 0.8644, test_f1: 0.5345
 epoch: 31, train_loss: 0.8296, test_loss: 0.8662, test_f1: 0.5418
 epoch: 32, train_loss: 0.8105, test_loss: 0.8641, test_f1: 0.5486
 epoch: 33, train_loss: 0.8128, test_loss: 0.8795, test_f1: 0.5562
 epoch: 34, train_loss: 0.8054, test_loss: 0.8927, test_f1: 0.5307
 epoch: 35, train_loss: 0.7861, test_loss: 0.8920, test_f1: 0.5551
 epoch: 36, train_loss: 0.7900, test_loss: 0.8815, test_f1: 0.5302
 epoch: 37, train_loss: 0.7954, test_loss: 0.8536, test_f1: 0.5671
 epoch: 38, train_loss: 0.7821, test_loss: 0.8757, test_f1: 0.5532
 epoch: 39, train_loss: 0.7852, test_loss: 0.8625, test_f1: 0.5673
 epoch: 40, train_loss: 0.7716, test_loss: 0.8712, test_f1: 0.5567
 epoch: 41, train_loss: 0.7589, test_loss: 0.8694, test_f1: 0.5615
 epoch: 42, train_loss: 0.7545, test_loss: 0.8601, test_f1: 0.5726
 epoch: 43, train_loss: 0.7651, test_loss: 0.8652, test_f1: 0.5823
 epoch: 44, train_loss: 0.7482, test_loss: 0.8698, test_f1: 0.5641
 epoch: 45, train_loss: 0.7426, test_loss: 0.8713, test_f1: 0.5614
 epoch: 46, train_loss: 0.7297, test_loss: 0.9166, test_f1: 0.5480
 epoch: 47, train_loss: 0.7384, test_loss: 0.8939, test_f1: 0.5624
 epoch: 48, train_loss: 0.7265, test_loss: 0.8673, test_f1: 0.5740
 epoch: 49, train_loss: 0.7085, test_loss: 0.8838, test_f1: 0.5596
 epoch: 50, train_loss: 0.7233, test_loss: 0.8832, test_f1: 0.5693
 epoch: 51, train_loss: 0.7001, test_loss: 0.8868, test_f1: 0.5691
 epoch: 52, train_loss: 0.6984, test_loss: 0.8873, test_f1: 0.5736
 epoch: 53, train_loss: 0.7143, test_loss: 0.8753, test_f1: 0.5772
 epoch: 54, train_loss: 0.6861, test_loss: 0.8946, test_f1: 0.5800
 epoch: 55, train_loss: 0.6950, test_loss: 0.9016, test_f1: 0.5729
 epoch: 56, train_loss: 0.6915, test_loss: 0.8793, test_f1: 0.5790
 epoch: 57, train_loss: 0.6878, test_loss: 0.8925, test_f1: 0.5818
 epoch: 58, train_loss: 0.6883, test_loss: 0.8865, test_f1: 0.5824
 epoch: 59, train_loss: 0.6830, test_loss: 0.8969, test_f1: 0.5697
 epoch: 60, train_loss: 0.6903, test_loss: 0.8969, test_f1: 0.5716
 epoch: 61, train_loss: 0.6801, test_loss: 0.8944, test_f1: 0.5687
 epoch: 62, train_loss: 0.6784, test_loss: 0.9007, test_f1: 0.5715
 epoch: 63, train_loss: 0.6755, test_loss: 0.9066, test_f1: 0.5645
 epoch: 64, train_loss: 0.6713, test_loss: 0.9136, test_f1: 0.5627
 epoch: 65, train_loss: 0.6630, test_loss: 0.9109, test_f1: 0.5730
 epoch: 66, train_loss: 0.6668, test_loss: 0.8990, test_f1: 0.5721
 epoch: 67, train_loss: 0.6776, test_loss: 0.9157, test_f1: 0.5740
 epoch: 68, train_loss: 0.6542, test_loss: 0.9126, test_f1: 0.5757
 epoch: 69, train_loss: 0.6624, test_loss: 0.9230, test_f1: 0.5733
 epoch: 70, train_loss: 0.6668, test_loss: 0.9187, test_f1: 0.5773
 epoch: 71, train_loss: 0.6505, test_loss: 0.9244, test_f1: 0.5746
 epoch: 72, train_loss: 0.6656, test_loss: 0.9318, test_f1: 0.5604
 epoch: 73, train_loss: 0.6576, test_loss: 0.9027, test_f1: 0.5644
 epoch: 74, train_loss: 0.6528, test_loss: 0.9212, test_f1: 0.5699
 epoch: 75, train_loss: 0.6505, test_loss: 0.9091, test_f1: 0.5795
 epoch: 76, train_loss: 0.6437, test_loss: 0.9322, test_f1: 0.5685
 epoch: 77, train_loss: 0.6466, test_loss: 0.9146, test_f1: 0.5667
 epoch: 78, train_loss: 0.6469, test_loss: 0.9296, test_f1: 0.5801
 epoch: 79, train_loss: 0.6438, test_loss: 0.9364, test_f1: 0.5648
 epoch: 80, train_loss: 0.6499, test_loss: 0.9237, test_f1: 0.5723
 epoch: 81, train_loss: 0.6387, test_loss: 0.9465, test_f1: 0.5771
 epoch: 82, train_loss: 0.6427, test_loss: 0.9369, test_f1: 0.5782
 epoch: 83, train_loss: 0.6319, test_loss: 0.9355, test_f1: 0.5679
 epoch: 84, train_loss: 0.6319, test_loss: 0.9430, test_f1: 0.5731
 epoch: 85, train_loss: 0.6497, test_loss: 0.9256, test_f1: 0.5851
 epoch: 86, train_loss: 0.6357, test_loss: 0.9327, test_f1: 0.5899
 epoch: 87, train_loss: 0.6450, test_loss: 0.9637, test_f1: 0.5728
 epoch: 88, train_loss: 0.6178, test_loss: 0.9428, test_f1: 0.5748
 epoch: 89, train_loss: 0.6266, test_loss: 0.9315, test_f1: 0.5874
 epoch: 90, train_loss: 0.6249, test_loss: 0.9582, test_f1: 0.5893
 epoch: 91, train_loss: 0.6352, test_loss: 0.9638, test_f1: 0.5717
 epoch: 92, train_loss: 0.6442, test_loss: 0.9522, test_f1: 0.5928
 epoch: 93, train_loss: 0.6350, test_loss: 0.9410, test_f1: 0.5958
 epoch: 94, train_loss: 0.6215, test_loss: 0.9822, test_f1: 0.5894
 epoch: 95, train_loss: 0.6214, test_loss: 0.9569, test_f1: 0.5916
 epoch: 96, train_loss: 0.6072, test_loss: 0.9483, test_f1: 0.6027
 epoch: 97, train_loss: 0.6179, test_loss: 0.9994, test_f1: 0.5901
 epoch: 98, train_loss: 0.6214, test_loss: 0.9731, test_f1: 0.5940
 epoch: 99, train_loss: 0.6195, test_loss: 0.9598, test_f1: 0.5934
##################ITERATION #4 ****************************************
 epoch: 0, train_loss: 1.2823, test_loss: 1.2871, test_f1: 0.2260
 epoch: 1, train_loss: 1.2295, test_loss: 1.2568, test_f1: 0.2260
 epoch: 2, train_loss: 1.1932, test_loss: 1.1601, test_f1: 0.3172
 epoch: 3, train_loss: 1.1582, test_loss: 1.1101, test_f1: 0.4457
 epoch: 4, train_loss: 1.1214, test_loss: 1.0760, test_f1: 0.4595
 epoch: 5, train_loss: 1.0835, test_loss: 1.0486, test_f1: 0.4738
 epoch: 6, train_loss: 1.0514, test_loss: 1.0294, test_f1: 0.4598
 epoch: 7, train_loss: 1.0321, test_loss: 1.0133, test_f1: 0.4662
 epoch: 8, train_loss: 1.0112, test_loss: 0.9990, test_f1: 0.4769
 epoch: 9, train_loss: 0.9951, test_loss: 0.9910, test_f1: 0.4721
 epoch: 10, train_loss: 0.9822, test_loss: 0.9937, test_f1: 0.4790
 epoch: 11, train_loss: 0.9676, test_loss: 0.9853, test_f1: 0.4710
 epoch: 12, train_loss: 0.9559, test_loss: 0.9840, test_f1: 0.4792
 epoch: 13, train_loss: 0.9538, test_loss: 0.9685, test_f1: 0.4899
 epoch: 14, train_loss: 0.9449, test_loss: 0.9787, test_f1: 0.4878
 epoch: 15, train_loss: 0.9382, test_loss: 0.9779, test_f1: 0.4978
 epoch: 16, train_loss: 0.9278, test_loss: 0.9756, test_f1: 0.4823
 epoch: 17, train_loss: 0.9077, test_loss: 0.9672, test_f1: 0.5097
 epoch: 18, train_loss: 0.9179, test_loss: 0.9706, test_f1: 0.5016
 epoch: 19, train_loss: 0.9016, test_loss: 0.9864, test_f1: 0.4993
 epoch: 20, train_loss: 0.8999, test_loss: 0.9530, test_f1: 0.5221
 epoch: 21, train_loss: 0.8909, test_loss: 0.9582, test_f1: 0.4927
 epoch: 22, train_loss: 0.8771, test_loss: 0.9790, test_f1: 0.5118
 epoch: 23, train_loss: 0.8650, test_loss: 0.9479, test_f1: 0.5147
 epoch: 24, train_loss: 0.8736, test_loss: 0.9648, test_f1: 0.5153
 epoch: 25, train_loss: 0.8595, test_loss: 0.9557, test_f1: 0.5194
 epoch: 26, train_loss: 0.8571, test_loss: 0.9606, test_f1: 0.5159
 epoch: 27, train_loss: 0.8506, test_loss: 0.9535, test_f1: 0.5239
 epoch: 28, train_loss: 0.8476, test_loss: 0.9383, test_f1: 0.5329
 epoch: 29, train_loss: 0.8398, test_loss: 0.9511, test_f1: 0.5194
 epoch: 30, train_loss: 0.8269, test_loss: 0.9390, test_f1: 0.5374
 epoch: 31, train_loss: 0.8325, test_loss: 0.9607, test_f1: 0.5343
 epoch: 32, train_loss: 0.8218, test_loss: 0.9437, test_f1: 0.5265
 epoch: 33, train_loss: 0.8066, test_loss: 0.9437, test_f1: 0.5389
 epoch: 34, train_loss: 0.8076, test_loss: 0.9591, test_f1: 0.5324
 epoch: 35, train_loss: 0.8072, test_loss: 0.9479, test_f1: 0.5324
 epoch: 36, train_loss: 0.8019, test_loss: 0.9430, test_f1: 0.5250
 epoch: 37, train_loss: 0.7952, test_loss: 0.9389, test_f1: 0.5497
 epoch: 38, train_loss: 0.7976, test_loss: 0.9373, test_f1: 0.5431
 epoch: 39, train_loss: 0.7820, test_loss: 0.9434, test_f1: 0.5362
 epoch: 40, train_loss: 0.7774, test_loss: 0.9659, test_f1: 0.5420
 epoch: 41, train_loss: 0.7816, test_loss: 0.9761, test_f1: 0.5214
 epoch: 42, train_loss: 0.7703, test_loss: 0.9402, test_f1: 0.5525
 epoch: 43, train_loss: 0.7635, test_loss: 0.9510, test_f1: 0.5501
 epoch: 44, train_loss: 0.7595, test_loss: 0.9387, test_f1: 0.5436
 epoch: 45, train_loss: 0.7616, test_loss: 0.9411, test_f1: 0.5528
 epoch: 46, train_loss: 0.7496, test_loss: 0.9400, test_f1: 0.5476
 epoch: 47, train_loss: 0.7469, test_loss: 0.9340, test_f1: 0.5508
 epoch: 48, train_loss: 0.7476, test_loss: 0.9439, test_f1: 0.5541
 epoch: 49, train_loss: 0.7458, test_loss: 0.9434, test_f1: 0.5476
 epoch: 50, train_loss: 0.7291, test_loss: 0.9404, test_f1: 0.5467
 epoch: 51, train_loss: 0.7292, test_loss: 0.9462, test_f1: 0.5463
 epoch: 52, train_loss: 0.7205, test_loss: 0.9341, test_f1: 0.5490
 epoch: 53, train_loss: 0.7108, test_loss: 0.9408, test_f1: 0.5605
 epoch: 54, train_loss: 0.7120, test_loss: 0.9390, test_f1: 0.5543
 epoch: 55, train_loss: 0.7112, test_loss: 0.9610, test_f1: 0.5503
 epoch: 56, train_loss: 0.7152, test_loss: 0.9565, test_f1: 0.5488
 epoch: 57, train_loss: 0.7076, test_loss: 0.9403, test_f1: 0.5643
 epoch: 58, train_loss: 0.7165, test_loss: 0.9320, test_f1: 0.5614
 epoch: 59, train_loss: 0.7093, test_loss: 0.9547, test_f1: 0.5604
 epoch: 60, train_loss: 0.7038, test_loss: 0.9547, test_f1: 0.5582
 epoch: 61, train_loss: 0.7010, test_loss: 0.9405, test_f1: 0.5622
 epoch: 62, train_loss: 0.6989, test_loss: 0.9437, test_f1: 0.5581
 epoch: 63, train_loss: 0.6972, test_loss: 0.9398, test_f1: 0.5566
 epoch: 64, train_loss: 0.6834, test_loss: 0.9412, test_f1: 0.5618
 epoch: 65, train_loss: 0.7051, test_loss: 0.9551, test_f1: 0.5551
 epoch: 66, train_loss: 0.6980, test_loss: 0.9539, test_f1: 0.5445
 epoch: 67, train_loss: 0.6899, test_loss: 0.9503, test_f1: 0.5479
 epoch: 68, train_loss: 0.6861, test_loss: 0.9465, test_f1: 0.5530
 epoch: 69, train_loss: 0.6787, test_loss: 0.9488, test_f1: 0.5566
 epoch: 70, train_loss: 0.6824, test_loss: 0.9584, test_f1: 0.5386
 epoch: 71, train_loss: 0.6836, test_loss: 0.9601, test_f1: 0.5461
 epoch: 72, train_loss: 0.6752, test_loss: 0.9769, test_f1: 0.5363
 epoch: 73, train_loss: 0.6760, test_loss: 0.9627, test_f1: 0.5377
 epoch: 74, train_loss: 0.6771, test_loss: 0.9574, test_f1: 0.5558
 epoch: 75, train_loss: 0.6771, test_loss: 0.9687, test_f1: 0.5558
 epoch: 76, train_loss: 0.6702, test_loss: 0.9558, test_f1: 0.5565
 epoch: 77, train_loss: 0.6651, test_loss: 0.9610, test_f1: 0.5557
 epoch: 78, train_loss: 0.6633, test_loss: 0.9695, test_f1: 0.5435
 epoch: 79, train_loss: 0.6648, test_loss: 0.9786, test_f1: 0.5557
 epoch: 80, train_loss: 0.6629, test_loss: 0.9577, test_f1: 0.5588
 epoch: 81, train_loss: 0.6608, test_loss: 0.9660, test_f1: 0.5514
 epoch: 82, train_loss: 0.6467, test_loss: 0.9530, test_f1: 0.5592
 epoch: 83, train_loss: 0.6584, test_loss: 0.9872, test_f1: 0.5480
 epoch: 84, train_loss: 0.6466, test_loss: 0.9716, test_f1: 0.5577
 epoch: 85, train_loss: 0.6529, test_loss: 0.9536, test_f1: 0.5633
 epoch: 86, train_loss: 0.6541, test_loss: 0.9755, test_f1: 0.5452
 epoch: 87, train_loss: 0.6499, test_loss: 0.9648, test_f1: 0.5567
 epoch: 88, train_loss: 0.6497, test_loss: 0.9751, test_f1: 0.5647
 epoch: 89, train_loss: 0.6472, test_loss: 0.9718, test_f1: 0.5576
 epoch: 90, train_loss: 0.6548, test_loss: 0.9760, test_f1: 0.5592
 epoch: 91, train_loss: 0.6497, test_loss: 0.9853, test_f1: 0.5429
 epoch: 92, train_loss: 0.6592, test_loss: 0.9833, test_f1: 0.5432
 epoch: 93, train_loss: 0.6381, test_loss: 0.9673, test_f1: 0.5470
 epoch: 94, train_loss: 0.6485, test_loss: 0.9791, test_f1: 0.5351
 epoch: 95, train_loss: 0.6402, test_loss: 0.9723, test_f1: 0.5602
 epoch: 96, train_loss: 0.6428, test_loss: 0.9615, test_f1: 0.5663
 epoch: 97, train_loss: 0.6295, test_loss: 0.9865, test_f1: 0.5510
 epoch: 98, train_loss: 0.6300, test_loss: 0.9779, test_f1: 0.5530
 epoch: 99, train_loss: 0.6361, test_loss: 0.9735, test_f1: 0.5435
##################ITERATION #5 ****************************************
 epoch: 0, train_loss: 1.2852, test_loss: 1.2899, test_f1: 0.2260
 epoch: 1, train_loss: 1.1859, test_loss: 1.1977, test_f1: 0.3039
 epoch: 2, train_loss: 1.1463, test_loss: 1.1010, test_f1: 0.4300
 epoch: 3, train_loss: 1.1186, test_loss: 1.0598, test_f1: 0.4520
 epoch: 4, train_loss: 1.0935, test_loss: 1.0385, test_f1: 0.4490
 epoch: 5, train_loss: 1.0647, test_loss: 1.0150, test_f1: 0.4633
 epoch: 6, train_loss: 1.0434, test_loss: 0.9922, test_f1: 0.4579
 epoch: 7, train_loss: 1.0280, test_loss: 0.9749, test_f1: 0.4767
 epoch: 8, train_loss: 1.0129, test_loss: 0.9683, test_f1: 0.4813
 epoch: 9, train_loss: 0.9910, test_loss: 0.9627, test_f1: 0.4679
 epoch: 10, train_loss: 0.9729, test_loss: 0.9529, test_f1: 0.4784
 epoch: 11, train_loss: 0.9650, test_loss: 0.9502, test_f1: 0.4886
 epoch: 12, train_loss: 0.9517, test_loss: 0.9470, test_f1: 0.4855
 epoch: 13, train_loss: 0.9405, test_loss: 0.9472, test_f1: 0.4955
 epoch: 14, train_loss: 0.9347, test_loss: 0.9246, test_f1: 0.5039
 epoch: 15, train_loss: 0.9094, test_loss: 0.9200, test_f1: 0.5076
 epoch: 16, train_loss: 0.9165, test_loss: 0.9646, test_f1: 0.5002
 epoch: 17, train_loss: 0.9081, test_loss: 0.9159, test_f1: 0.5057
 epoch: 18, train_loss: 0.9050, test_loss: 0.9299, test_f1: 0.5264
 epoch: 19, train_loss: 0.8882, test_loss: 0.9207, test_f1: 0.5321
 epoch: 20, train_loss: 0.8921, test_loss: 0.9203, test_f1: 0.5043
 epoch: 21, train_loss: 0.8770, test_loss: 0.9159, test_f1: 0.5414
 epoch: 22, train_loss: 0.8558, test_loss: 0.9163, test_f1: 0.5418
 epoch: 23, train_loss: 0.8591, test_loss: 0.9165, test_f1: 0.5096
 epoch: 24, train_loss: 0.8637, test_loss: 0.9117, test_f1: 0.5447
 epoch: 25, train_loss: 0.8448, test_loss: 0.9014, test_f1: 0.5308
 epoch: 26, train_loss: 0.8421, test_loss: 0.8995, test_f1: 0.5568
 epoch: 27, train_loss: 0.8354, test_loss: 0.9067, test_f1: 0.5387
 epoch: 28, train_loss: 0.8269, test_loss: 0.9125, test_f1: 0.5354
 epoch: 29, train_loss: 0.8295, test_loss: 0.9137, test_f1: 0.5267
 epoch: 30, train_loss: 0.8232, test_loss: 0.8943, test_f1: 0.5508
 epoch: 31, train_loss: 0.8110, test_loss: 0.9153, test_f1: 0.5169
 epoch: 32, train_loss: 0.8173, test_loss: 0.9162, test_f1: 0.5417
 epoch: 33, train_loss: 0.8056, test_loss: 0.9079, test_f1: 0.5465
 epoch: 34, train_loss: 0.8052, test_loss: 0.9196, test_f1: 0.5354
 epoch: 35, train_loss: 0.7981, test_loss: 0.9147, test_f1: 0.5389
 epoch: 36, train_loss: 0.7990, test_loss: 0.9144, test_f1: 0.5317
 epoch: 37, train_loss: 0.7932, test_loss: 0.9269, test_f1: 0.5512
 epoch: 38, train_loss: 0.7842, test_loss: 0.9183, test_f1: 0.5318
 epoch: 39, train_loss: 0.7790, test_loss: 0.9209, test_f1: 0.5297
 epoch: 40, train_loss: 0.7622, test_loss: 0.9073, test_f1: 0.5567
 epoch: 41, train_loss: 0.7574, test_loss: 0.9311, test_f1: 0.5295
 epoch: 42, train_loss: 0.7627, test_loss: 0.9325, test_f1: 0.5225
 epoch: 43, train_loss: 0.7553, test_loss: 0.9355, test_f1: 0.5186
 epoch: 44, train_loss: 0.7546, test_loss: 0.9298, test_f1: 0.5208
 epoch: 45, train_loss: 0.7542, test_loss: 0.9222, test_f1: 0.5253
 epoch: 46, train_loss: 0.7512, test_loss: 0.9472, test_f1: 0.5142
 epoch: 47, train_loss: 0.7459, test_loss: 0.9131, test_f1: 0.5315
 epoch: 48, train_loss: 0.7396, test_loss: 0.9132, test_f1: 0.5450
 epoch: 49, train_loss: 0.7401, test_loss: 0.9222, test_f1: 0.5345
 epoch: 50, train_loss: 0.7263, test_loss: 0.9319, test_f1: 0.5311
 epoch: 51, train_loss: 0.7201, test_loss: 0.9157, test_f1: 0.5419
 epoch: 52, train_loss: 0.7180, test_loss: 0.9308, test_f1: 0.5425
 epoch: 53, train_loss: 0.7046, test_loss: 0.9319, test_f1: 0.5350
 epoch: 54, train_loss: 0.7111, test_loss: 0.9309, test_f1: 0.5319
 epoch: 55, train_loss: 0.7057, test_loss: 0.9260, test_f1: 0.5518
 epoch: 56, train_loss: 0.7025, test_loss: 0.9304, test_f1: 0.5375
 epoch: 57, train_loss: 0.6957, test_loss: 0.9381, test_f1: 0.5272
 epoch: 58, train_loss: 0.6951, test_loss: 0.9343, test_f1: 0.5370
 epoch: 59, train_loss: 0.6925, test_loss: 0.9296, test_f1: 0.5361
 epoch: 60, train_loss: 0.6966, test_loss: 0.9471, test_f1: 0.5266
 epoch: 61, train_loss: 0.6926, test_loss: 0.9327, test_f1: 0.5293
 epoch: 62, train_loss: 0.6905, test_loss: 0.9317, test_f1: 0.5307
 epoch: 63, train_loss: 0.6897, test_loss: 0.9085, test_f1: 0.5444
 epoch: 64, train_loss: 0.6921, test_loss: 0.9452, test_f1: 0.5358
 epoch: 65, train_loss: 0.6856, test_loss: 0.9528, test_f1: 0.5413
 epoch: 66, train_loss: 0.6853, test_loss: 0.9478, test_f1: 0.5352
 epoch: 67, train_loss: 0.6675, test_loss: 0.9253, test_f1: 0.5365
 epoch: 68, train_loss: 0.6773, test_loss: 0.9389, test_f1: 0.5472
 epoch: 69, train_loss: 0.6726, test_loss: 0.9454, test_f1: 0.5401
 epoch: 70, train_loss: 0.6689, test_loss: 0.9313, test_f1: 0.5324
 epoch: 71, train_loss: 0.6831, test_loss: 0.9235, test_f1: 0.5462
 epoch: 72, train_loss: 0.6674, test_loss: 0.9406, test_f1: 0.5290
 epoch: 73, train_loss: 0.6686, test_loss: 0.9493, test_f1: 0.5256
 epoch: 74, train_loss: 0.6677, test_loss: 0.9530, test_f1: 0.5356
 epoch: 75, train_loss: 0.6681, test_loss: 0.9454, test_f1: 0.5301
 epoch: 76, train_loss: 0.6833, test_loss: 0.9817, test_f1: 0.5457
 epoch: 77, train_loss: 0.6653, test_loss: 0.9362, test_f1: 0.5497
 epoch: 78, train_loss: 0.6578, test_loss: 0.9393, test_f1: 0.5468
 epoch: 79, train_loss: 0.6624, test_loss: 0.9641, test_f1: 0.5278
 epoch: 80, train_loss: 0.6519, test_loss: 0.9518, test_f1: 0.5266
 epoch: 81, train_loss: 0.6638, test_loss: 0.9620, test_f1: 0.5321
 epoch: 82, train_loss: 0.6648, test_loss: 0.9625, test_f1: 0.5363
 epoch: 83, train_loss: 0.6533, test_loss: 0.9752, test_f1: 0.5313
 epoch: 84, train_loss: 0.6532, test_loss: 0.9519, test_f1: 0.5501
 epoch: 85, train_loss: 0.6581, test_loss: 0.9488, test_f1: 0.5281
 epoch: 86, train_loss: 0.6554, test_loss: 0.9748, test_f1: 0.5240
 epoch: 87, train_loss: 0.6553, test_loss: 0.9552, test_f1: 0.5341
 epoch: 88, train_loss: 0.6415, test_loss: 0.9715, test_f1: 0.5350
 epoch: 89, train_loss: 0.6448, test_loss: 1.0284, test_f1: 0.5334
 epoch: 90, train_loss: 0.6430, test_loss: 0.9823, test_f1: 0.5427
 epoch: 91, train_loss: 0.6443, test_loss: 0.9780, test_f1: 0.5294
 epoch: 92, train_loss: 0.6618, test_loss: 0.9661, test_f1: 0.5371
 epoch: 93, train_loss: 0.6405, test_loss: 0.9441, test_f1: 0.5491
 epoch: 94, train_loss: 0.6402, test_loss: 0.9721, test_f1: 0.5356
 epoch: 95, train_loss: 0.6280, test_loss: 0.9767, test_f1: 0.5392
 epoch: 96, train_loss: 0.6360, test_loss: 0.9743, test_f1: 0.5282
 epoch: 97, train_loss: 0.6332, test_loss: 0.9613, test_f1: 0.5339
 epoch: 98, train_loss: 0.6198, test_loss: 0.9798, test_f1: 0.5351
 epoch: 99, train_loss: 0.6355, test_loss: 0.9657, test_f1: 0.5386
##################ITERATION #6 ****************************************
 epoch: 0, train_loss: 1.2836, test_loss: 1.2777, test_f1: 0.2260
 epoch: 1, train_loss: 1.1836, test_loss: 1.1917, test_f1: 0.3050
 epoch: 2, train_loss: 1.1378, test_loss: 1.0776, test_f1: 0.4606
 epoch: 3, train_loss: 1.1040, test_loss: 1.0322, test_f1: 0.4641
 epoch: 4, train_loss: 1.0747, test_loss: 1.0063, test_f1: 0.4729
 epoch: 5, train_loss: 1.0485, test_loss: 0.9910, test_f1: 0.4665
 epoch: 6, train_loss: 1.0206, test_loss: 0.9840, test_f1: 0.4881
 epoch: 7, train_loss: 1.0126, test_loss: 0.9792, test_f1: 0.5003
 epoch: 8, train_loss: 0.9867, test_loss: 0.9744, test_f1: 0.4954
 epoch: 9, train_loss: 0.9806, test_loss: 0.9645, test_f1: 0.5023
 epoch: 10, train_loss: 0.9628, test_loss: 0.9636, test_f1: 0.5124
 epoch: 11, train_loss: 0.9434, test_loss: 0.9636, test_f1: 0.5032
 epoch: 12, train_loss: 0.9394, test_loss: 0.9572, test_f1: 0.4919
 epoch: 13, train_loss: 0.9271, test_loss: 0.9509, test_f1: 0.5107
 epoch: 14, train_loss: 0.9168, test_loss: 0.9455, test_f1: 0.5110
 epoch: 15, train_loss: 0.9086, test_loss: 0.9615, test_f1: 0.5209
 epoch: 16, train_loss: 0.8912, test_loss: 0.9409, test_f1: 0.5134
 epoch: 17, train_loss: 0.8829, test_loss: 0.9549, test_f1: 0.5183
 epoch: 18, train_loss: 0.8874, test_loss: 0.9377, test_f1: 0.5339
 epoch: 19, train_loss: 0.8732, test_loss: 0.9408, test_f1: 0.5323
 epoch: 20, train_loss: 0.8667, test_loss: 0.9117, test_f1: 0.5455
 epoch: 21, train_loss: 0.8576, test_loss: 0.9185, test_f1: 0.5476
 epoch: 22, train_loss: 0.8456, test_loss: 0.9373, test_f1: 0.5327
 epoch: 23, train_loss: 0.8432, test_loss: 0.9235, test_f1: 0.5404
 epoch: 24, train_loss: 0.8331, test_loss: 0.9181, test_f1: 0.5462
 epoch: 25, train_loss: 0.8288, test_loss: 0.9263, test_f1: 0.5515
 epoch: 26, train_loss: 0.8230, test_loss: 0.9046, test_f1: 0.5530
 epoch: 27, train_loss: 0.8126, test_loss: 0.9056, test_f1: 0.5377
 epoch: 28, train_loss: 0.8114, test_loss: 0.8920, test_f1: 0.5573
 epoch: 29, train_loss: 0.8010, test_loss: 0.8940, test_f1: 0.5530
 epoch: 30, train_loss: 0.7914, test_loss: 0.8982, test_f1: 0.5538
 epoch: 31, train_loss: 0.7868, test_loss: 0.9544, test_f1: 0.5378
 epoch: 32, train_loss: 0.7891, test_loss: 0.8923, test_f1: 0.5501
 epoch: 33, train_loss: 0.7847, test_loss: 0.9055, test_f1: 0.5556
 epoch: 34, train_loss: 0.7673, test_loss: 0.8770, test_f1: 0.5611
 epoch: 35, train_loss: 0.7777, test_loss: 0.8989, test_f1: 0.5524
 epoch: 36, train_loss: 0.7662, test_loss: 0.8850, test_f1: 0.5583
 epoch: 37, train_loss: 0.7657, test_loss: 0.8839, test_f1: 0.5654
 epoch: 38, train_loss: 0.7528, test_loss: 0.9137, test_f1: 0.5517
 epoch: 39, train_loss: 0.7485, test_loss: 0.8988, test_f1: 0.5485
 epoch: 40, train_loss: 0.7407, test_loss: 0.9061, test_f1: 0.5504
 epoch: 41, train_loss: 0.7400, test_loss: 0.9026, test_f1: 0.5483
 epoch: 42, train_loss: 0.7252, test_loss: 0.8891, test_f1: 0.5632
 epoch: 43, train_loss: 0.7225, test_loss: 0.8865, test_f1: 0.5592
 epoch: 44, train_loss: 0.7234, test_loss: 0.9116, test_f1: 0.5646
 epoch: 45, train_loss: 0.7122, test_loss: 0.9154, test_f1: 0.5624
 epoch: 46, train_loss: 0.7208, test_loss: 0.9175, test_f1: 0.5522
 epoch: 47, train_loss: 0.7282, test_loss: 0.9019, test_f1: 0.5586
 epoch: 48, train_loss: 0.7093, test_loss: 0.9456, test_f1: 0.5448
 epoch: 49, train_loss: 0.7136, test_loss: 0.9105, test_f1: 0.5601
 epoch: 50, train_loss: 0.7015, test_loss: 0.9173, test_f1: 0.5570
 epoch: 51, train_loss: 0.7022, test_loss: 0.9340, test_f1: 0.5571
 epoch: 52, train_loss: 0.6902, test_loss: 0.9129, test_f1: 0.5625
 epoch: 53, train_loss: 0.6823, test_loss: 0.9134, test_f1: 0.5617
 epoch: 54, train_loss: 0.6818, test_loss: 0.9192, test_f1: 0.5561
 epoch: 55, train_loss: 0.6928, test_loss: 0.8959, test_f1: 0.5705
 epoch: 56, train_loss: 0.6781, test_loss: 0.9053, test_f1: 0.5551
 epoch: 57, train_loss: 0.6816, test_loss: 0.9043, test_f1: 0.5624
 epoch: 58, train_loss: 0.6933, test_loss: 0.9140, test_f1: 0.5422
 epoch: 59, train_loss: 0.6672, test_loss: 0.9173, test_f1: 0.5701
 epoch: 60, train_loss: 0.6564, test_loss: 0.9133, test_f1: 0.5509
 epoch: 61, train_loss: 0.6655, test_loss: 0.9201, test_f1: 0.5686
 epoch: 62, train_loss: 0.6688, test_loss: 0.9247, test_f1: 0.5554
 epoch: 63, train_loss: 0.6685, test_loss: 0.9285, test_f1: 0.5628
 epoch: 64, train_loss: 0.6635, test_loss: 0.9241, test_f1: 0.5666
 epoch: 65, train_loss: 0.6653, test_loss: 0.9257, test_f1: 0.5527
 epoch: 66, train_loss: 0.6675, test_loss: 0.9215, test_f1: 0.5676
 epoch: 67, train_loss: 0.6683, test_loss: 0.9110, test_f1: 0.5718
 epoch: 68, train_loss: 0.6565, test_loss: 0.9061, test_f1: 0.5607
 epoch: 69, train_loss: 0.6496, test_loss: 0.9383, test_f1: 0.5621
 epoch: 70, train_loss: 0.6486, test_loss: 0.9261, test_f1: 0.5806
 epoch: 71, train_loss: 0.6490, test_loss: 0.9321, test_f1: 0.5574
 epoch: 72, train_loss: 0.6648, test_loss: 0.9372, test_f1: 0.5596
 epoch: 73, train_loss: 0.6453, test_loss: 0.9543, test_f1: 0.5629
 epoch: 74, train_loss: 0.6502, test_loss: 0.9183, test_f1: 0.5750
 epoch: 75, train_loss: 0.6503, test_loss: 0.9310, test_f1: 0.5683
 epoch: 76, train_loss: 0.6368, test_loss: 0.9490, test_f1: 0.5510
 epoch: 77, train_loss: 0.6414, test_loss: 0.9494, test_f1: 0.5716
 epoch: 78, train_loss: 0.6438, test_loss: 0.9267, test_f1: 0.5636
 epoch: 79, train_loss: 0.6295, test_loss: 0.9389, test_f1: 0.5611
 epoch: 80, train_loss: 0.6407, test_loss: 0.9283, test_f1: 0.5737
 epoch: 81, train_loss: 0.6452, test_loss: 0.9451, test_f1: 0.5689
 epoch: 82, train_loss: 0.6390, test_loss: 0.9380, test_f1: 0.5785
 epoch: 83, train_loss: 0.6452, test_loss: 0.9400, test_f1: 0.5845
 epoch: 84, train_loss: 0.6267, test_loss: 0.9340, test_f1: 0.5713
 epoch: 85, train_loss: 0.6347, test_loss: 0.9280, test_f1: 0.5718
 epoch: 86, train_loss: 0.6257, test_loss: 0.9370, test_f1: 0.5810
 epoch: 87, train_loss: 0.6371, test_loss: 0.9242, test_f1: 0.5790
 epoch: 88, train_loss: 0.6236, test_loss: 0.9510, test_f1: 0.5808
 epoch: 89, train_loss: 0.6356, test_loss: 0.9549, test_f1: 0.5796
 epoch: 90, train_loss: 0.6383, test_loss: 0.9546, test_f1: 0.5857
 epoch: 91, train_loss: 0.6315, test_loss: 0.9624, test_f1: 0.5789
 epoch: 92, train_loss: 0.6261, test_loss: 0.9335, test_f1: 0.5739
 epoch: 93, train_loss: 0.6200, test_loss: 0.9406, test_f1: 0.5732
 epoch: 94, train_loss: 0.6204, test_loss: 0.9444, test_f1: 0.5745
 epoch: 95, train_loss: 0.6212, test_loss: 0.9529, test_f1: 0.5692
 epoch: 96, train_loss: 0.6153, test_loss: 0.9429, test_f1: 0.5774
 epoch: 97, train_loss: 0.6339, test_loss: 0.9509, test_f1: 0.5846
 epoch: 98, train_loss: 0.6222, test_loss: 0.9293, test_f1: 0.5857
 epoch: 99, train_loss: 0.6016, test_loss: 0.9436, test_f1: 0.5817
##################ITERATION #7 ****************************************
 epoch: 0, train_loss: 1.2758, test_loss: 1.3037, test_f1: 0.2741
 epoch: 1, train_loss: 1.2088, test_loss: 1.2388, test_f1: 0.3357
 epoch: 2, train_loss: 1.1607, test_loss: 1.1262, test_f1: 0.4364
 epoch: 3, train_loss: 1.1260, test_loss: 1.0766, test_f1: 0.4539
 epoch: 4, train_loss: 1.1010, test_loss: 1.0492, test_f1: 0.4644
 epoch: 5, train_loss: 1.0755, test_loss: 1.0295, test_f1: 0.4667
 epoch: 6, train_loss: 1.0477, test_loss: 1.0182, test_f1: 0.4685
 epoch: 7, train_loss: 1.0415, test_loss: 1.0111, test_f1: 0.4703
 epoch: 8, train_loss: 1.0259, test_loss: 1.0077, test_f1: 0.4685
 epoch: 9, train_loss: 1.0129, test_loss: 0.9982, test_f1: 0.4679
 epoch: 10, train_loss: 1.0052, test_loss: 0.9874, test_f1: 0.4800
 epoch: 11, train_loss: 0.9956, test_loss: 0.9832, test_f1: 0.4871
 epoch: 12, train_loss: 0.9850, test_loss: 0.9870, test_f1: 0.4795
 epoch: 13, train_loss: 0.9910, test_loss: 0.9777, test_f1: 0.4876
 epoch: 14, train_loss: 0.9711, test_loss: 0.9799, test_f1: 0.4905
 epoch: 15, train_loss: 0.9651, test_loss: 0.9751, test_f1: 0.4955
 epoch: 16, train_loss: 0.9558, test_loss: 0.9667, test_f1: 0.5108
 epoch: 17, train_loss: 0.9411, test_loss: 0.9723, test_f1: 0.5007
 epoch: 18, train_loss: 0.9364, test_loss: 0.9703, test_f1: 0.5271
 epoch: 19, train_loss: 0.9295, test_loss: 0.9745, test_f1: 0.5184
 epoch: 20, train_loss: 0.9236, test_loss: 0.9626, test_f1: 0.5251
 epoch: 21, train_loss: 0.9225, test_loss: 0.9665, test_f1: 0.5243
 epoch: 22, train_loss: 0.9126, test_loss: 0.9548, test_f1: 0.5178
 epoch: 23, train_loss: 0.9078, test_loss: 0.9444, test_f1: 0.5269
 epoch: 24, train_loss: 0.8942, test_loss: 0.9273, test_f1: 0.5161
 epoch: 25, train_loss: 0.8989, test_loss: 0.9354, test_f1: 0.5234
 epoch: 26, train_loss: 0.8849, test_loss: 0.9309, test_f1: 0.5230
 epoch: 27, train_loss: 0.8784, test_loss: 0.9373, test_f1: 0.5267
 epoch: 28, train_loss: 0.8770, test_loss: 0.9233, test_f1: 0.5231
 epoch: 29, train_loss: 0.8642, test_loss: 0.9237, test_f1: 0.5335
 epoch: 30, train_loss: 0.8572, test_loss: 0.9487, test_f1: 0.5297
 epoch: 31, train_loss: 0.8606, test_loss: 0.9323, test_f1: 0.5173
 epoch: 32, train_loss: 0.8457, test_loss: 0.9390, test_f1: 0.5237
 epoch: 33, train_loss: 0.8528, test_loss: 0.9227, test_f1: 0.5338
 epoch: 34, train_loss: 0.8537, test_loss: 0.9369, test_f1: 0.5269
 epoch: 35, train_loss: 0.8390, test_loss: 0.9338, test_f1: 0.5305
 epoch: 36, train_loss: 0.8342, test_loss: 0.9255, test_f1: 0.5326
 epoch: 37, train_loss: 0.8323, test_loss: 0.9266, test_f1: 0.5317
 epoch: 38, train_loss: 0.8238, test_loss: 0.9342, test_f1: 0.5239
 epoch: 39, train_loss: 0.8149, test_loss: 0.9303, test_f1: 0.5397
 epoch: 40, train_loss: 0.8133, test_loss: 0.9286, test_f1: 0.5380
 epoch: 41, train_loss: 0.8173, test_loss: 0.9299, test_f1: 0.5322
 epoch: 42, train_loss: 0.7997, test_loss: 0.9323, test_f1: 0.5336
 epoch: 43, train_loss: 0.8026, test_loss: 0.9457, test_f1: 0.5313
 epoch: 44, train_loss: 0.7899, test_loss: 0.9309, test_f1: 0.5543
 epoch: 45, train_loss: 0.8048, test_loss: 0.9406, test_f1: 0.5408
 epoch: 46, train_loss: 0.7860, test_loss: 0.9453, test_f1: 0.5340
 epoch: 47, train_loss: 0.7696, test_loss: 0.9487, test_f1: 0.5405
 epoch: 48, train_loss: 0.7803, test_loss: 0.9697, test_f1: 0.5383
 epoch: 49, train_loss: 0.7813, test_loss: 0.9553, test_f1: 0.5263
 epoch: 50, train_loss: 0.7719, test_loss: 0.9618, test_f1: 0.5332
 epoch: 51, train_loss: 0.7605, test_loss: 0.9425, test_f1: 0.5419
 epoch: 52, train_loss: 0.7541, test_loss: 0.9339, test_f1: 0.5446
 epoch: 53, train_loss: 0.7501, test_loss: 0.9424, test_f1: 0.5322
 epoch: 54, train_loss: 0.7556, test_loss: 0.9333, test_f1: 0.5512
 epoch: 55, train_loss: 0.7467, test_loss: 0.9295, test_f1: 0.5490
 epoch: 56, train_loss: 0.7430, test_loss: 0.9511, test_f1: 0.5337
 epoch: 57, train_loss: 0.7405, test_loss: 0.9580, test_f1: 0.5286
 epoch: 58, train_loss: 0.7403, test_loss: 0.9672, test_f1: 0.5302
 epoch: 59, train_loss: 0.7503, test_loss: 0.9522, test_f1: 0.5368
 epoch: 60, train_loss: 0.7413, test_loss: 0.9610, test_f1: 0.5460
 epoch: 61, train_loss: 0.7405, test_loss: 0.9433, test_f1: 0.5526
 epoch: 62, train_loss: 0.7422, test_loss: 0.9894, test_f1: 0.5286
 epoch: 63, train_loss: 0.7430, test_loss: 0.9774, test_f1: 0.5448
 epoch: 64, train_loss: 0.7358, test_loss: 0.9793, test_f1: 0.5266
 epoch: 65, train_loss: 0.7368, test_loss: 0.9817, test_f1: 0.5355
 epoch: 66, train_loss: 0.7241, test_loss: 0.9882, test_f1: 0.5309
 epoch: 67, train_loss: 0.7370, test_loss: 0.9813, test_f1: 0.5257
 epoch: 68, train_loss: 0.7168, test_loss: 0.9680, test_f1: 0.5281
 epoch: 69, train_loss: 0.7180, test_loss: 0.9669, test_f1: 0.5351
 epoch: 70, train_loss: 0.7171, test_loss: 0.9759, test_f1: 0.5325
 epoch: 71, train_loss: 0.7158, test_loss: 0.9761, test_f1: 0.5317
 epoch: 72, train_loss: 0.7074, test_loss: 0.9729, test_f1: 0.5324
 epoch: 73, train_loss: 0.7136, test_loss: 1.0085, test_f1: 0.5276
 epoch: 74, train_loss: 0.7145, test_loss: 1.0052, test_f1: 0.5406
 epoch: 75, train_loss: 0.7039, test_loss: 0.9911, test_f1: 0.5423
 epoch: 76, train_loss: 0.7065, test_loss: 1.0066, test_f1: 0.5386
 epoch: 77, train_loss: 0.6982, test_loss: 0.9837, test_f1: 0.5377
 epoch: 78, train_loss: 0.7003, test_loss: 0.9872, test_f1: 0.5344
 epoch: 79, train_loss: 0.6933, test_loss: 1.0178, test_f1: 0.5346
 epoch: 80, train_loss: 0.6936, test_loss: 0.9693, test_f1: 0.5474
 epoch: 81, train_loss: 0.7147, test_loss: 1.0162, test_f1: 0.5395
 epoch: 82, train_loss: 0.6935, test_loss: 1.0181, test_f1: 0.5391
 epoch: 83, train_loss: 0.7016, test_loss: 1.0477, test_f1: 0.5405
 epoch: 84, train_loss: 0.6891, test_loss: 1.0123, test_f1: 0.5484
 epoch: 85, train_loss: 0.6875, test_loss: 1.0371, test_f1: 0.5378
 epoch: 86, train_loss: 0.6963, test_loss: 1.0224, test_f1: 0.5556
 epoch: 87, train_loss: 0.6808, test_loss: 1.0207, test_f1: 0.5445
 epoch: 88, train_loss: 0.6820, test_loss: 1.0028, test_f1: 0.5394
 epoch: 89, train_loss: 0.6919, test_loss: 1.0127, test_f1: 0.5337
 epoch: 90, train_loss: 0.6877, test_loss: 0.9894, test_f1: 0.5374
 epoch: 91, train_loss: 0.6925, test_loss: 1.0271, test_f1: 0.5401
 epoch: 92, train_loss: 0.6879, test_loss: 1.0439, test_f1: 0.5436
 epoch: 93, train_loss: 0.6709, test_loss: 1.0360, test_f1: 0.5392
 epoch: 94, train_loss: 0.6855, test_loss: 1.0304, test_f1: 0.5402
 epoch: 95, train_loss: 0.6734, test_loss: 1.0801, test_f1: 0.5337
 epoch: 96, train_loss: 0.6819, test_loss: 1.0419, test_f1: 0.5398
 epoch: 97, train_loss: 0.6667, test_loss: 1.0469, test_f1: 0.5405
 epoch: 98, train_loss: 0.6673, test_loss: 1.0403, test_f1: 0.5433
 epoch: 99, train_loss: 0.6627, test_loss: 1.0352, test_f1: 0.5364
##################ITERATION #8 ****************************************
 epoch: 0, train_loss: 1.2581, test_loss: 1.2634, test_f1: 0.2260
 epoch: 1, train_loss: 1.1805, test_loss: 1.1366, test_f1: 0.3904
 epoch: 2, train_loss: 1.1414, test_loss: 1.0660, test_f1: 0.4459
 epoch: 3, train_loss: 1.1110, test_loss: 1.0245, test_f1: 0.4926
 epoch: 4, train_loss: 1.0923, test_loss: 1.0105, test_f1: 0.4806
 epoch: 5, train_loss: 1.0736, test_loss: 0.9955, test_f1: 0.4686
 epoch: 6, train_loss: 1.0568, test_loss: 0.9810, test_f1: 0.4898
 epoch: 7, train_loss: 1.0405, test_loss: 0.9677, test_f1: 0.5018
 epoch: 8, train_loss: 1.0231, test_loss: 0.9706, test_f1: 0.4906
 epoch: 9, train_loss: 1.0295, test_loss: 0.9633, test_f1: 0.4845
 epoch: 10, train_loss: 1.0080, test_loss: 0.9626, test_f1: 0.5188
 epoch: 11, train_loss: 0.9896, test_loss: 0.9645, test_f1: 0.4752
 epoch: 12, train_loss: 0.9836, test_loss: 0.9581, test_f1: 0.4900
 epoch: 13, train_loss: 0.9730, test_loss: 0.9615, test_f1: 0.4786
 epoch: 14, train_loss: 0.9682, test_loss: 0.9664, test_f1: 0.4941
 epoch: 15, train_loss: 0.9577, test_loss: 0.9462, test_f1: 0.5088
 epoch: 16, train_loss: 0.9592, test_loss: 0.9474, test_f1: 0.4944
 epoch: 17, train_loss: 0.9413, test_loss: 0.9434, test_f1: 0.4965
 epoch: 18, train_loss: 0.9362, test_loss: 0.9503, test_f1: 0.5083
 epoch: 19, train_loss: 0.9192, test_loss: 0.9499, test_f1: 0.5102
 epoch: 20, train_loss: 0.9272, test_loss: 0.9378, test_f1: 0.5042
 epoch: 21, train_loss: 0.9204, test_loss: 0.9339, test_f1: 0.4977
 epoch: 22, train_loss: 0.9105, test_loss: 0.9391, test_f1: 0.4979
 epoch: 23, train_loss: 0.9074, test_loss: 0.9524, test_f1: 0.4947
 epoch: 24, train_loss: 0.9014, test_loss: 0.9414, test_f1: 0.4928
 epoch: 25, train_loss: 0.8965, test_loss: 0.9486, test_f1: 0.4985
 epoch: 26, train_loss: 0.8877, test_loss: 0.9307, test_f1: 0.5262
 epoch: 27, train_loss: 0.8710, test_loss: 0.9297, test_f1: 0.5249
 epoch: 28, train_loss: 0.8757, test_loss: 0.9423, test_f1: 0.5195
 epoch: 29, train_loss: 0.8714, test_loss: 0.9467, test_f1: 0.5181
 epoch: 30, train_loss: 0.8620, test_loss: 0.9601, test_f1: 0.5229
 epoch: 31, train_loss: 0.8552, test_loss: 0.9622, test_f1: 0.5179
 epoch: 32, train_loss: 0.8379, test_loss: 0.9292, test_f1: 0.5377
 epoch: 33, train_loss: 0.8519, test_loss: 0.9567, test_f1: 0.5328
 epoch: 34, train_loss: 0.8351, test_loss: 0.9235, test_f1: 0.5350
 epoch: 35, train_loss: 0.8268, test_loss: 0.9316, test_f1: 0.5386
 epoch: 36, train_loss: 0.8324, test_loss: 0.9362, test_f1: 0.5409
 epoch: 37, train_loss: 0.8239, test_loss: 0.9450, test_f1: 0.5424
 epoch: 38, train_loss: 0.8254, test_loss: 0.9307, test_f1: 0.5554
 epoch: 39, train_loss: 0.8112, test_loss: 0.9200, test_f1: 0.5552
 epoch: 40, train_loss: 0.8068, test_loss: 0.9304, test_f1: 0.5491
 epoch: 41, train_loss: 0.7995, test_loss: 0.9192, test_f1: 0.5570
 epoch: 42, train_loss: 0.8028, test_loss: 0.9484, test_f1: 0.5489
 epoch: 43, train_loss: 0.7884, test_loss: 0.9533, test_f1: 0.5386
 epoch: 44, train_loss: 0.7944, test_loss: 0.8918, test_f1: 0.5663
 epoch: 45, train_loss: 0.7936, test_loss: 0.9273, test_f1: 0.5545
 epoch: 46, train_loss: 0.7870, test_loss: 0.9047, test_f1: 0.5593
 epoch: 47, train_loss: 0.7826, test_loss: 0.9345, test_f1: 0.5488
 epoch: 48, train_loss: 0.7748, test_loss: 0.9223, test_f1: 0.5690
 epoch: 49, train_loss: 0.7729, test_loss: 0.9435, test_f1: 0.5510
 epoch: 50, train_loss: 0.7694, test_loss: 0.9221, test_f1: 0.5706
 epoch: 51, train_loss: 0.7635, test_loss: 0.9162, test_f1: 0.5755
 epoch: 52, train_loss: 0.7608, test_loss: 0.9169, test_f1: 0.5755
 epoch: 53, train_loss: 0.7511, test_loss: 0.9015, test_f1: 0.5668
 epoch: 54, train_loss: 0.7457, test_loss: 0.9100, test_f1: 0.5754
 epoch: 55, train_loss: 0.7410, test_loss: 0.9259, test_f1: 0.5605
 epoch: 56, train_loss: 0.7467, test_loss: 0.9423, test_f1: 0.5682
 epoch: 57, train_loss: 0.7507, test_loss: 0.9202, test_f1: 0.5777
 epoch: 58, train_loss: 0.7330, test_loss: 0.9265, test_f1: 0.5687
 epoch: 59, train_loss: 0.7408, test_loss: 0.8997, test_f1: 0.5844
 epoch: 60, train_loss: 0.7330, test_loss: 0.9241, test_f1: 0.5681
 epoch: 61, train_loss: 0.7292, test_loss: 0.9234, test_f1: 0.5734
 epoch: 62, train_loss: 0.7540, test_loss: 0.9307, test_f1: 0.5655
 epoch: 63, train_loss: 0.7304, test_loss: 0.9224, test_f1: 0.5715
 epoch: 64, train_loss: 0.7450, test_loss: 0.9175, test_f1: 0.5684
 epoch: 65, train_loss: 0.7277, test_loss: 0.8897, test_f1: 0.5895
 epoch: 66, train_loss: 0.7287, test_loss: 0.9176, test_f1: 0.5726
 epoch: 67, train_loss: 0.7143, test_loss: 0.8911, test_f1: 0.5897
 epoch: 68, train_loss: 0.7214, test_loss: 0.9300, test_f1: 0.5801
 epoch: 69, train_loss: 0.7295, test_loss: 0.8992, test_f1: 0.5722
 epoch: 70, train_loss: 0.7105, test_loss: 0.9325, test_f1: 0.5722
 epoch: 71, train_loss: 0.7238, test_loss: 0.9255, test_f1: 0.5712
 epoch: 72, train_loss: 0.7094, test_loss: 0.9109, test_f1: 0.5729
 epoch: 73, train_loss: 0.7062, test_loss: 0.9366, test_f1: 0.5674
 epoch: 74, train_loss: 0.7109, test_loss: 0.9093, test_f1: 0.5764
 epoch: 75, train_loss: 0.7233, test_loss: 0.9061, test_f1: 0.5738
 epoch: 76, train_loss: 0.7181, test_loss: 0.9228, test_f1: 0.5746
 epoch: 77, train_loss: 0.6974, test_loss: 0.9067, test_f1: 0.5780
 epoch: 78, train_loss: 0.7046, test_loss: 0.9203, test_f1: 0.5686
 epoch: 79, train_loss: 0.7026, test_loss: 0.8967, test_f1: 0.5806
 epoch: 80, train_loss: 0.7024, test_loss: 0.9285, test_f1: 0.5771
 epoch: 81, train_loss: 0.6948, test_loss: 0.9302, test_f1: 0.5775
 epoch: 82, train_loss: 0.6988, test_loss: 0.9259, test_f1: 0.5833
 epoch: 83, train_loss: 0.6918, test_loss: 0.9184, test_f1: 0.5674
 epoch: 84, train_loss: 0.7065, test_loss: 0.9210, test_f1: 0.5614
 epoch: 85, train_loss: 0.6928, test_loss: 0.9113, test_f1: 0.5765
 epoch: 86, train_loss: 0.6996, test_loss: 0.9156, test_f1: 0.5755
 epoch: 87, train_loss: 0.6962, test_loss: 0.9071, test_f1: 0.5682
 epoch: 88, train_loss: 0.6803, test_loss: 0.9222, test_f1: 0.5695
 epoch: 89, train_loss: 0.6891, test_loss: 0.9049, test_f1: 0.5710
 epoch: 90, train_loss: 0.6935, test_loss: 0.9027, test_f1: 0.5854
 epoch: 91, train_loss: 0.6831, test_loss: 0.9303, test_f1: 0.5731
 epoch: 92, train_loss: 0.6841, test_loss: 0.9123, test_f1: 0.5786
 epoch: 93, train_loss: 0.6760, test_loss: 0.9367, test_f1: 0.5812
 epoch: 94, train_loss: 0.6872, test_loss: 0.9087, test_f1: 0.5819
 epoch: 95, train_loss: 0.6863, test_loss: 0.9208, test_f1: 0.5841
 epoch: 96, train_loss: 0.6761, test_loss: 0.9295, test_f1: 0.5789
 epoch: 97, train_loss: 0.6767, test_loss: 0.9297, test_f1: 0.5804
 epoch: 98, train_loss: 0.6683, test_loss: 0.9201, test_f1: 0.5734
 epoch: 99, train_loss: 0.6775, test_loss: 0.9340, test_f1: 0.5827
##################ITERATION #9 ****************************************
 epoch: 0, train_loss: 1.2854, test_loss: 1.2684, test_f1: 0.3058
 epoch: 1, train_loss: 1.1747, test_loss: 1.1661, test_f1: 0.3806
 epoch: 2, train_loss: 1.1380, test_loss: 1.0683, test_f1: 0.4808
 epoch: 3, train_loss: 1.0983, test_loss: 1.0354, test_f1: 0.4883
 epoch: 4, train_loss: 1.0888, test_loss: 1.0218, test_f1: 0.4774
 epoch: 5, train_loss: 1.0533, test_loss: 1.0095, test_f1: 0.4728
 epoch: 6, train_loss: 1.0440, test_loss: 0.9892, test_f1: 0.4859
 epoch: 7, train_loss: 1.0227, test_loss: 0.9909, test_f1: 0.4786
 epoch: 8, train_loss: 1.0140, test_loss: 0.9838, test_f1: 0.4911
 epoch: 9, train_loss: 0.9944, test_loss: 0.9792, test_f1: 0.4781
 epoch: 10, train_loss: 0.9897, test_loss: 0.9588, test_f1: 0.4881
 epoch: 11, train_loss: 0.9731, test_loss: 0.9587, test_f1: 0.4939
 epoch: 12, train_loss: 0.9748, test_loss: 0.9497, test_f1: 0.4880
 epoch: 13, train_loss: 0.9597, test_loss: 0.9457, test_f1: 0.5109
 epoch: 14, train_loss: 0.9415, test_loss: 0.9564, test_f1: 0.4993
 epoch: 15, train_loss: 0.9378, test_loss: 0.9329, test_f1: 0.5025
 epoch: 16, train_loss: 0.9267, test_loss: 0.9357, test_f1: 0.5047
 epoch: 17, train_loss: 0.9227, test_loss: 0.9273, test_f1: 0.5197
 epoch: 18, train_loss: 0.9112, test_loss: 0.9389, test_f1: 0.4896
 epoch: 19, train_loss: 0.9048, test_loss: 0.9371, test_f1: 0.5321
 epoch: 20, train_loss: 0.8983, test_loss: 0.9221, test_f1: 0.5196
 epoch: 21, train_loss: 0.8889, test_loss: 0.9555, test_f1: 0.4979
 epoch: 22, train_loss: 0.8808, test_loss: 0.9272, test_f1: 0.5298
 epoch: 23, train_loss: 0.8754, test_loss: 0.9330, test_f1: 0.5188
 epoch: 24, train_loss: 0.8735, test_loss: 0.9318, test_f1: 0.5137
 epoch: 25, train_loss: 0.8640, test_loss: 0.9109, test_f1: 0.5248
 epoch: 26, train_loss: 0.8571, test_loss: 0.9276, test_f1: 0.5338
 epoch: 27, train_loss: 0.8531, test_loss: 0.9079, test_f1: 0.5411
 epoch: 28, train_loss: 0.8439, test_loss: 0.9286, test_f1: 0.5256
 epoch: 29, train_loss: 0.8373, test_loss: 0.9274, test_f1: 0.5240
 epoch: 30, train_loss: 0.8375, test_loss: 0.9221, test_f1: 0.5449
 epoch: 31, train_loss: 0.8201, test_loss: 0.9264, test_f1: 0.5356
 epoch: 32, train_loss: 0.8191, test_loss: 0.9361, test_f1: 0.5487
 epoch: 33, train_loss: 0.8191, test_loss: 0.9380, test_f1: 0.5271
 epoch: 34, train_loss: 0.8068, test_loss: 0.9360, test_f1: 0.5446
 epoch: 35, train_loss: 0.8094, test_loss: 0.9259, test_f1: 0.5453
 epoch: 36, train_loss: 0.8012, test_loss: 0.9267, test_f1: 0.5375
 epoch: 37, train_loss: 0.8010, test_loss: 0.9312, test_f1: 0.5354
 epoch: 38, train_loss: 0.7946, test_loss: 0.9295, test_f1: 0.5347
 epoch: 39, train_loss: 0.7883, test_loss: 0.9120, test_f1: 0.5258
 epoch: 40, train_loss: 0.7821, test_loss: 0.9382, test_f1: 0.5188
 epoch: 41, train_loss: 0.7797, test_loss: 0.9242, test_f1: 0.5420
 epoch: 42, train_loss: 0.7755, test_loss: 0.9103, test_f1: 0.5520
 epoch: 43, train_loss: 0.7748, test_loss: 0.8920, test_f1: 0.5453
 epoch: 44, train_loss: 0.7678, test_loss: 0.8985, test_f1: 0.5442
 epoch: 45, train_loss: 0.7557, test_loss: 0.8892, test_f1: 0.5350
 epoch: 46, train_loss: 0.7537, test_loss: 0.9094, test_f1: 0.5435
 epoch: 47, train_loss: 0.7448, test_loss: 0.9041, test_f1: 0.5506
 epoch: 48, train_loss: 0.7491, test_loss: 0.8874, test_f1: 0.5484
 epoch: 49, train_loss: 0.7503, test_loss: 0.9145, test_f1: 0.5139
 epoch: 50, train_loss: 0.7378, test_loss: 0.9022, test_f1: 0.5549
 epoch: 51, train_loss: 0.7399, test_loss: 0.8924, test_f1: 0.5455
 epoch: 52, train_loss: 0.7290, test_loss: 0.9063, test_f1: 0.5532
 epoch: 53, train_loss: 0.7250, test_loss: 0.9179, test_f1: 0.5444
 epoch: 54, train_loss: 0.7371, test_loss: 0.9191, test_f1: 0.5447
 epoch: 55, train_loss: 0.7188, test_loss: 0.8965, test_f1: 0.5400
 epoch: 56, train_loss: 0.7165, test_loss: 0.9276, test_f1: 0.5348
 epoch: 57, train_loss: 0.7180, test_loss: 0.9148, test_f1: 0.5476
 epoch: 58, train_loss: 0.7157, test_loss: 0.9175, test_f1: 0.5320
 epoch: 59, train_loss: 0.7076, test_loss: 0.9041, test_f1: 0.5354
 epoch: 60, train_loss: 0.7154, test_loss: 0.9153, test_f1: 0.5392
 epoch: 61, train_loss: 0.7081, test_loss: 0.9113, test_f1: 0.5344
 epoch: 62, train_loss: 0.7009, test_loss: 0.9145, test_f1: 0.5385
 epoch: 63, train_loss: 0.7087, test_loss: 0.9159, test_f1: 0.5280
 epoch: 64, train_loss: 0.7119, test_loss: 0.9270, test_f1: 0.5419
 epoch: 65, train_loss: 0.7148, test_loss: 0.9166, test_f1: 0.5347
 epoch: 66, train_loss: 0.6942, test_loss: 0.9074, test_f1: 0.5300
 epoch: 67, train_loss: 0.7029, test_loss: 0.9113, test_f1: 0.5330
 epoch: 68, train_loss: 0.6866, test_loss: 0.9411, test_f1: 0.5338
 epoch: 69, train_loss: 0.6919, test_loss: 0.9223, test_f1: 0.5429
 epoch: 70, train_loss: 0.7014, test_loss: 0.9100, test_f1: 0.5490
 epoch: 71, train_loss: 0.6860, test_loss: 0.9238, test_f1: 0.5438
 epoch: 72, train_loss: 0.6842, test_loss: 0.9047, test_f1: 0.5458
 epoch: 73, train_loss: 0.7020, test_loss: 0.9018, test_f1: 0.5473
 epoch: 74, train_loss: 0.6889, test_loss: 0.9256, test_f1: 0.5468
 epoch: 75, train_loss: 0.6867, test_loss: 0.9181, test_f1: 0.5397
 epoch: 76, train_loss: 0.6821, test_loss: 0.9206, test_f1: 0.5384
 epoch: 77, train_loss: 0.6949, test_loss: 0.9314, test_f1: 0.5274
 epoch: 78, train_loss: 0.6808, test_loss: 0.9090, test_f1: 0.5476
 epoch: 79, train_loss: 0.6798, test_loss: 0.9114, test_f1: 0.5431
 epoch: 80, train_loss: 0.6772, test_loss: 0.9157, test_f1: 0.5260
 epoch: 81, train_loss: 0.6779, test_loss: 0.9198, test_f1: 0.5454
 epoch: 82, train_loss: 0.6750, test_loss: 0.9266, test_f1: 0.5395
 epoch: 83, train_loss: 0.6720, test_loss: 0.9204, test_f1: 0.5458
 epoch: 84, train_loss: 0.6666, test_loss: 0.9221, test_f1: 0.5417
 epoch: 85, train_loss: 0.6611, test_loss: 0.9220, test_f1: 0.5614
 epoch: 86, train_loss: 0.6557, test_loss: 0.9244, test_f1: 0.5427
 epoch: 87, train_loss: 0.6729, test_loss: 0.9410, test_f1: 0.5383
 epoch: 88, train_loss: 0.6518, test_loss: 0.9279, test_f1: 0.5430
 epoch: 89, train_loss: 0.6776, test_loss: 0.9237, test_f1: 0.5530
 epoch: 90, train_loss: 0.6683, test_loss: 0.9443, test_f1: 0.5343
 epoch: 91, train_loss: 0.6626, test_loss: 0.9364, test_f1: 0.5512
 epoch: 92, train_loss: 0.6533, test_loss: 0.9615, test_f1: 0.5257
 epoch: 93, train_loss: 0.6524, test_loss: 0.9419, test_f1: 0.5285
 epoch: 94, train_loss: 0.6545, test_loss: 0.9606, test_f1: 0.5286
 epoch: 95, train_loss: 0.6676, test_loss: 0.9489, test_f1: 0.5526
 epoch: 96, train_loss: 0.6514, test_loss: 0.9679, test_f1: 0.5364
 epoch: 97, train_loss: 0.6434, test_loss: 0.9794, test_f1: 0.5292
 epoch: 98, train_loss: 0.6483, test_loss: 0.9387, test_f1: 0.5389
 epoch: 99, train_loss: 0.6586, test_loss: 0.9361, test_f1: 0.5551

Training completed in 580.33 seconds
Best F1: 0.6027 at epoch 96
Mean F1 across iterations: 0.5689  0.0185
========================FINAL RESULTS================================
FEGIN weighted F1: 0.6027  0.0185
python main.py --data ltspice_examples --representation component_pin --model FEGIN --layers 6 --hiddens 64 --batch_size 128 --lr 0.0001 --emb_size 250 --epochs 100 --save_appendix component_pin_L6_H64_BS128_LR0.0001_E250 --no_val
-----



STDERR:
  File "main.py", line 370, in <module>
    main()
  File "main.py", line 254, in main
    dataset = dataset_class(
  File "/home/philip/projects/ltspice_examples_code_repo/Circuit-Completion-Using-GNNs/component_classification_with_link_prediction_head/evaluation/FEGIN/kernel/circuit_datasets.py", line 15, in __init__
    self.data, self.slices = torch.load(self.processed_paths[0])
  File "/home/philip/.local/lib/python3.8/site-packages/torch/serialization.py", line 1040, in load
    warnings.warn(
  File "/usr/lib/python3.8/warnings.py", line 109, in _showwarnmsg
    sw(msg.message, msg.category, msg.filename, msg.lineno,
  File "main.py", line 47, in warn_with_traceback
    traceback.print_stack(file=log)
/home/philip/projects/ltspice_examples_code_repo/Circuit-Completion-Using-GNNs/component_classification_with_link_prediction_head/evaluation/FEGIN/kernel/circuit_datasets.py:15: FutureWarning: You are using `torch.load` with `weights_only=False` (the current default value), which uses the default pickle module implicitly. It is possible to construct malicious pickle data which will execute arbitrary code during unpickling (See https://github.com/pytorch/pytorch/blob/main/SECURITY.md#untrusted-models for more details). In a future release, the default value for `weights_only` will be flipped to `True`. This limits the functions that could be executed during unpickling. Arbitrary objects will no longer be allowed to be loaded via this mode unless they are explicitly allowlisted by the user via `torch.serialization.add_safe_globals`. We recommend you start setting `weights_only=True` for any use case where you don't have full control of the loaded file. Please open an issue on GitHub for any issues related to this experimental feature.
  self.data, self.slices = torch.load(self.processed_paths[0])
