STDOUT:
Results will be saved in /home/philip/projects/ltspice_examples_code_repo/Circuit-Completion-Using-GNNs/component_classification_with_link_prediction_head/evaluation/FEGIN/results/model_FEGIN_dataset_ltspice_demos
Command line input: python main.py --data ltspice_demos --representation component_net --model FEGIN --layers 4 --hiddens 128 --batch_size 64 --lr 0.001 --emb_size 128 --epochs 100 --save_appendix component_net_L4_H128_BS64_LR0.001_E128 --no_val
 is saved.
-----
ltspice_demos - FEGIN
Using 4 layers, 128 hidden units, h = 2
Loading component_net representation dataset
Loading component_net representation data...
Loaded 1948 examples (component_net)
saving path: data/processed/ltspice_demos_component_net_processed.pt
ENTERED
Training FEGIN on component_net representation
Train: 1565, Test: 383
##################ITERATION #0 ****************************************
 epoch: 0, train_loss: 1.2171, test_loss: 1.2954, test_f1: 0.2281
 epoch: 1, train_loss: 1.0961, test_loss: 1.1420, test_f1: 0.4778
 epoch: 2, train_loss: 1.0257, test_loss: 1.0672, test_f1: 0.5221
 epoch: 3, train_loss: 0.9722, test_loss: 1.0623, test_f1: 0.5492
 epoch: 4, train_loss: 0.9329, test_loss: 1.0330, test_f1: 0.5431
 epoch: 5, train_loss: 0.8972, test_loss: 0.9629, test_f1: 0.5703
 epoch: 6, train_loss: 0.9130, test_loss: 1.0904, test_f1: 0.4768
 epoch: 7, train_loss: 0.8587, test_loss: 1.1542, test_f1: 0.5090
 epoch: 8, train_loss: 0.8406, test_loss: 1.1449, test_f1: 0.5695
 epoch: 9, train_loss: 0.8199, test_loss: 1.0953, test_f1: 0.5683
 epoch: 10, train_loss: 0.8026, test_loss: 1.1657, test_f1: 0.5985
 epoch: 11, train_loss: 0.8033, test_loss: 1.1334, test_f1: 0.5870
 epoch: 12, train_loss: 0.7870, test_loss: 1.2415, test_f1: 0.5346
 epoch: 13, train_loss: 0.7599, test_loss: 1.2251, test_f1: 0.5923
 epoch: 14, train_loss: 0.7330, test_loss: 1.3096, test_f1: 0.5622
 epoch: 15, train_loss: 0.6942, test_loss: 1.3062, test_f1: 0.5851
 epoch: 16, train_loss: 0.6844, test_loss: 1.4477, test_f1: 0.5494
 epoch: 17, train_loss: 0.6673, test_loss: 1.3166, test_f1: 0.5894
 epoch: 18, train_loss: 0.6802, test_loss: 1.3056, test_f1: 0.5428
 epoch: 19, train_loss: 0.6685, test_loss: 1.6543, test_f1: 0.5446
 epoch: 20, train_loss: 0.6546, test_loss: 1.6623, test_f1: 0.5631
 epoch: 21, train_loss: 0.6606, test_loss: 1.2260, test_f1: 0.6204
 epoch: 22, train_loss: 0.5892, test_loss: 1.4839, test_f1: 0.6014
 epoch: 23, train_loss: 0.5648, test_loss: 1.8839, test_f1: 0.5007
 epoch: 24, train_loss: 0.6230, test_loss: 1.6204, test_f1: 0.5811
 epoch: 25, train_loss: 0.5786, test_loss: 1.8390, test_f1: 0.5092
 epoch: 26, train_loss: 0.5518, test_loss: 1.7808, test_f1: 0.5610
 epoch: 27, train_loss: 0.5403, test_loss: 1.9112, test_f1: 0.5908
 epoch: 28, train_loss: 0.5336, test_loss: 1.7934, test_f1: 0.5803
 epoch: 29, train_loss: 0.4914, test_loss: 1.8931, test_f1: 0.6042
 epoch: 30, train_loss: 0.4959, test_loss: 2.1035, test_f1: 0.5257
 epoch: 31, train_loss: 0.5131, test_loss: 2.0438, test_f1: 0.5467
 epoch: 32, train_loss: 0.4730, test_loss: 1.8922, test_f1: 0.5650
 epoch: 33, train_loss: 0.5128, test_loss: 2.0550, test_f1: 0.5675
 epoch: 34, train_loss: 0.4521, test_loss: 1.9323, test_f1: 0.5701
 epoch: 35, train_loss: 0.4266, test_loss: 2.2292, test_f1: 0.5797
 epoch: 36, train_loss: 0.4291, test_loss: 2.2724, test_f1: 0.5593
 epoch: 37, train_loss: 0.4258, test_loss: 2.1332, test_f1: 0.5888
 epoch: 38, train_loss: 0.4020, test_loss: 2.3353, test_f1: 0.5807
 epoch: 39, train_loss: 0.4015, test_loss: 2.5414, test_f1: 0.5466
 epoch: 40, train_loss: 0.4431, test_loss: 2.4796, test_f1: 0.5549
 epoch: 41, train_loss: 0.4104, test_loss: 2.4120, test_f1: 0.5830
 epoch: 42, train_loss: 0.3603, test_loss: 2.3631, test_f1: 0.6115
 epoch: 43, train_loss: 0.3566, test_loss: 2.7488, test_f1: 0.5437
 epoch: 44, train_loss: 0.3703, test_loss: 2.4354, test_f1: 0.5793
 epoch: 45, train_loss: 0.3790, test_loss: 2.7270, test_f1: 0.5721
 epoch: 46, train_loss: 0.3885, test_loss: 2.0545, test_f1: 0.6120
 epoch: 47, train_loss: 0.4026, test_loss: 2.1724, test_f1: 0.5366
 epoch: 48, train_loss: 0.3406, test_loss: 2.3011, test_f1: 0.5807
 epoch: 49, train_loss: 0.3607, test_loss: 2.6769, test_f1: 0.5703
 epoch: 50, train_loss: 0.3305, test_loss: 2.5109, test_f1: 0.6069
 epoch: 51, train_loss: 0.2754, test_loss: 2.7483, test_f1: 0.5686
 epoch: 52, train_loss: 0.2605, test_loss: 2.9663, test_f1: 0.5576
 epoch: 53, train_loss: 0.2328, test_loss: 3.0245, test_f1: 0.5753
 epoch: 54, train_loss: 0.2289, test_loss: 2.7045, test_f1: 0.5882
 epoch: 55, train_loss: 0.2200, test_loss: 3.0877, test_f1: 0.5712
 epoch: 56, train_loss: 0.2196, test_loss: 3.2283, test_f1: 0.5606
 epoch: 57, train_loss: 0.2240, test_loss: 3.4260, test_f1: 0.5637
 epoch: 58, train_loss: 0.2145, test_loss: 3.3985, test_f1: 0.5827
 epoch: 59, train_loss: 0.2426, test_loss: 3.3760, test_f1: 0.5733
 epoch: 60, train_loss: 0.1951, test_loss: 3.4575, test_f1: 0.5680
 epoch: 61, train_loss: 0.1957, test_loss: 3.6851, test_f1: 0.5845
 epoch: 62, train_loss: 0.1905, test_loss: 3.5001, test_f1: 0.5588
 epoch: 63, train_loss: 0.1983, test_loss: 3.4205, test_f1: 0.5859
 epoch: 64, train_loss: 0.1780, test_loss: 3.4294, test_f1: 0.5757
 epoch: 65, train_loss: 0.1772, test_loss: 3.5778, test_f1: 0.5741
 epoch: 66, train_loss: 0.1683, test_loss: 3.5975, test_f1: 0.5786
 epoch: 67, train_loss: 0.1806, test_loss: 3.7450, test_f1: 0.5868
 epoch: 68, train_loss: 0.2007, test_loss: 3.4901, test_f1: 0.5874
 epoch: 69, train_loss: 0.1815, test_loss: 3.4623, test_f1: 0.5802
 epoch: 70, train_loss: 0.1942, test_loss: 3.8445, test_f1: 0.5813
 epoch: 71, train_loss: 0.1842, test_loss: 3.9081, test_f1: 0.5564
 epoch: 72, train_loss: 0.1582, test_loss: 3.8124, test_f1: 0.5581
 epoch: 73, train_loss: 0.1662, test_loss: 3.9757, test_f1: 0.5796
 epoch: 74, train_loss: 0.1879, test_loss: 4.0097, test_f1: 0.5681
 epoch: 75, train_loss: 0.2126, test_loss: 3.3853, test_f1: 0.5580
 epoch: 76, train_loss: 0.1768, test_loss: 3.7664, test_f1: 0.5827
 epoch: 77, train_loss: 0.1660, test_loss: 3.5168, test_f1: 0.5840
 epoch: 78, train_loss: 0.1605, test_loss: 3.7541, test_f1: 0.5778
 epoch: 79, train_loss: 0.1343, test_loss: 3.8566, test_f1: 0.5840
 epoch: 80, train_loss: 0.1367, test_loss: 4.0381, test_f1: 0.5716
 epoch: 81, train_loss: 0.1950, test_loss: 4.1543, test_f1: 0.5511
 epoch: 82, train_loss: 0.1687, test_loss: 4.0131, test_f1: 0.5910
 epoch: 83, train_loss: 0.1728, test_loss: 3.9618, test_f1: 0.5451
 epoch: 84, train_loss: 0.1663, test_loss: 3.8371, test_f1: 0.5794
 epoch: 85, train_loss: 0.1398, test_loss: 3.8478, test_f1: 0.5662
 epoch: 86, train_loss: 0.1433, test_loss: 4.0089, test_f1: 0.6155
 epoch: 87, train_loss: 0.1671, test_loss: 4.0928, test_f1: 0.5794
 epoch: 88, train_loss: 0.1343, test_loss: 3.9967, test_f1: 0.5889
 epoch: 89, train_loss: 0.1474, test_loss: 3.7849, test_f1: 0.5880
 epoch: 90, train_loss: 0.1603, test_loss: 3.8735, test_f1: 0.5825
 epoch: 91, train_loss: 0.1489, test_loss: 3.8887, test_f1: 0.5733
 epoch: 92, train_loss: 0.1420, test_loss: 4.1675, test_f1: 0.5940
 epoch: 93, train_loss: 0.1269, test_loss: 4.0103, test_f1: 0.5825
 epoch: 94, train_loss: 0.1277, test_loss: 4.1839, test_f1: 0.5813
 epoch: 95, train_loss: 0.1286, test_loss: 4.3197, test_f1: 0.5661
 epoch: 96, train_loss: 0.1325, test_loss: 3.7980, test_f1: 0.5682
 epoch: 97, train_loss: 0.1121, test_loss: 4.3057, test_f1: 0.5790
 epoch: 98, train_loss: 0.1246, test_loss: 4.1913, test_f1: 0.5849
 epoch: 99, train_loss: 0.1441, test_loss: 4.5867, test_f1: 0.5672
##################ITERATION #1 ****************************************
 epoch: 0, train_loss: 1.1492, test_loss: 1.2264, test_f1: 0.2935
 epoch: 1, train_loss: 1.0172, test_loss: 1.1398, test_f1: 0.4580
 epoch: 2, train_loss: 0.9466, test_loss: 1.0289, test_f1: 0.5488
 epoch: 3, train_loss: 0.8949, test_loss: 1.0746, test_f1: 0.5429
 epoch: 4, train_loss: 0.8861, test_loss: 1.0804, test_f1: 0.5337
 epoch: 5, train_loss: 0.8528, test_loss: 1.0457, test_f1: 0.5272
 epoch: 6, train_loss: 0.8357, test_loss: 1.0701, test_f1: 0.5794
 epoch: 7, train_loss: 0.8332, test_loss: 1.1492, test_f1: 0.5346
 epoch: 8, train_loss: 0.8210, test_loss: 0.9931, test_f1: 0.5474
 epoch: 9, train_loss: 0.8011, test_loss: 1.0492, test_f1: 0.5868
 epoch: 10, train_loss: 0.7789, test_loss: 1.0512, test_f1: 0.5888
 epoch: 11, train_loss: 0.7485, test_loss: 1.1862, test_f1: 0.5803
 epoch: 12, train_loss: 0.7618, test_loss: 1.1541, test_f1: 0.5870
 epoch: 13, train_loss: 0.7220, test_loss: 1.2285, test_f1: 0.5739
 epoch: 14, train_loss: 0.6994, test_loss: 1.0808, test_f1: 0.6434
 epoch: 15, train_loss: 0.6959, test_loss: 1.3829, test_f1: 0.5061
 epoch: 16, train_loss: 0.6706, test_loss: 1.2746, test_f1: 0.5591
 epoch: 17, train_loss: 0.6485, test_loss: 1.3056, test_f1: 0.5836
 epoch: 18, train_loss: 0.6149, test_loss: 1.3596, test_f1: 0.5965
 epoch: 19, train_loss: 0.6121, test_loss: 1.3728, test_f1: 0.6100
 epoch: 20, train_loss: 0.5999, test_loss: 1.1715, test_f1: 0.6252
 epoch: 21, train_loss: 0.5803, test_loss: 1.4655, test_f1: 0.6145
 epoch: 22, train_loss: 0.5867, test_loss: 1.3586, test_f1: 0.6122
 epoch: 23, train_loss: 0.5824, test_loss: 1.4940, test_f1: 0.5993
 epoch: 24, train_loss: 0.5648, test_loss: 1.3448, test_f1: 0.6337
 epoch: 25, train_loss: 0.5246, test_loss: 1.7495, test_f1: 0.5949
 epoch: 26, train_loss: 0.5588, test_loss: 1.4146, test_f1: 0.5641
 epoch: 27, train_loss: 0.5357, test_loss: 1.6756, test_f1: 0.5798
 epoch: 28, train_loss: 0.5101, test_loss: 1.6675, test_f1: 0.6228
 epoch: 29, train_loss: 0.5332, test_loss: 1.4209, test_f1: 0.6071
 epoch: 30, train_loss: 0.4875, test_loss: 1.5868, test_f1: 0.5779
 epoch: 31, train_loss: 0.4745, test_loss: 1.6697, test_f1: 0.5739
 epoch: 32, train_loss: 0.5095, test_loss: 1.4959, test_f1: 0.6229
 epoch: 33, train_loss: 0.4790, test_loss: 1.5115, test_f1: 0.6146
 epoch: 34, train_loss: 0.4543, test_loss: 1.6612, test_f1: 0.6156
 epoch: 35, train_loss: 0.4341, test_loss: 1.5461, test_f1: 0.6111
 epoch: 36, train_loss: 0.4464, test_loss: 1.9749, test_f1: 0.5599
 epoch: 37, train_loss: 0.4473, test_loss: 1.6848, test_f1: 0.5810
 epoch: 38, train_loss: 0.4345, test_loss: 1.7744, test_f1: 0.6271
 epoch: 39, train_loss: 0.3962, test_loss: 1.7839, test_f1: 0.5913
 epoch: 40, train_loss: 0.3769, test_loss: 2.0170, test_f1: 0.5796
 epoch: 41, train_loss: 0.3841, test_loss: 1.8808, test_f1: 0.5962
 epoch: 42, train_loss: 0.3826, test_loss: 2.1499, test_f1: 0.6134
 epoch: 43, train_loss: 0.3734, test_loss: 1.9512, test_f1: 0.5854
 epoch: 44, train_loss: 0.4039, test_loss: 2.0279, test_f1: 0.5765
 epoch: 45, train_loss: 0.3552, test_loss: 2.0098, test_f1: 0.6012
 epoch: 46, train_loss: 0.3412, test_loss: 2.1789, test_f1: 0.5984
 epoch: 47, train_loss: 0.3552, test_loss: 2.6264, test_f1: 0.5670
 epoch: 48, train_loss: 0.3546, test_loss: 1.9788, test_f1: 0.5924
 epoch: 49, train_loss: 0.3734, test_loss: 1.9990, test_f1: 0.5896
 epoch: 50, train_loss: 0.3494, test_loss: 2.0331, test_f1: 0.5837
 epoch: 51, train_loss: 0.3159, test_loss: 2.1016, test_f1: 0.5950
 epoch: 52, train_loss: 0.2625, test_loss: 2.0591, test_f1: 0.6091
 epoch: 53, train_loss: 0.2491, test_loss: 2.1612, test_f1: 0.6036
 epoch: 54, train_loss: 0.2314, test_loss: 2.5186, test_f1: 0.6021
 epoch: 55, train_loss: 0.2321, test_loss: 2.4914, test_f1: 0.5921
 epoch: 56, train_loss: 0.2471, test_loss: 2.6681, test_f1: 0.6164
 epoch: 57, train_loss: 0.2324, test_loss: 2.6427, test_f1: 0.5862
 epoch: 58, train_loss: 0.2188, test_loss: 2.5473, test_f1: 0.6057
 epoch: 59, train_loss: 0.2390, test_loss: 2.3819, test_f1: 0.6016
 epoch: 60, train_loss: 0.2104, test_loss: 2.6054, test_f1: 0.5941
 epoch: 61, train_loss: 0.1938, test_loss: 2.8615, test_f1: 0.5605
 epoch: 62, train_loss: 0.1955, test_loss: 2.9091, test_f1: 0.5961
 epoch: 63, train_loss: 0.2072, test_loss: 2.8941, test_f1: 0.5801
 epoch: 64, train_loss: 0.1805, test_loss: 2.7758, test_f1: 0.5873
 epoch: 65, train_loss: 0.1892, test_loss: 2.7979, test_f1: 0.5933
 epoch: 66, train_loss: 0.2085, test_loss: 2.9424, test_f1: 0.6108
 epoch: 67, train_loss: 0.2065, test_loss: 2.9856, test_f1: 0.6038
 epoch: 68, train_loss: 0.2020, test_loss: 2.9247, test_f1: 0.5791
 epoch: 69, train_loss: 0.1870, test_loss: 2.9790, test_f1: 0.5883
 epoch: 70, train_loss: 0.1636, test_loss: 2.8900, test_f1: 0.6139
 epoch: 71, train_loss: 0.1672, test_loss: 3.1375, test_f1: 0.6015
 epoch: 72, train_loss: 0.1739, test_loss: 3.4057, test_f1: 0.6063
 epoch: 73, train_loss: 0.1846, test_loss: 2.9731, test_f1: 0.6278
 epoch: 74, train_loss: 0.1649, test_loss: 2.9522, test_f1: 0.5771
 epoch: 75, train_loss: 0.1747, test_loss: 3.0283, test_f1: 0.5882
 epoch: 76, train_loss: 0.1747, test_loss: 3.1163, test_f1: 0.6135
 epoch: 77, train_loss: 0.1560, test_loss: 3.0254, test_f1: 0.6211
 epoch: 78, train_loss: 0.1643, test_loss: 3.3861, test_f1: 0.5667
 epoch: 79, train_loss: 0.1944, test_loss: 3.4009, test_f1: 0.5377
 epoch: 80, train_loss: 0.1912, test_loss: 3.0815, test_f1: 0.5550
 epoch: 81, train_loss: 0.1621, test_loss: 3.1637, test_f1: 0.5863
 epoch: 82, train_loss: 0.1632, test_loss: 3.2265, test_f1: 0.5639
 epoch: 83, train_loss: 0.1707, test_loss: 3.1790, test_f1: 0.5570
 epoch: 84, train_loss: 0.1682, test_loss: 3.2816, test_f1: 0.6125
 epoch: 85, train_loss: 0.1771, test_loss: 3.3572, test_f1: 0.5572
 epoch: 86, train_loss: 0.1647, test_loss: 3.4796, test_f1: 0.5776
 epoch: 87, train_loss: 0.1660, test_loss: 3.3214, test_f1: 0.5768
 epoch: 88, train_loss: 0.1671, test_loss: 2.9786, test_f1: 0.5914
 epoch: 89, train_loss: 0.1517, test_loss: 3.1571, test_f1: 0.5855
 epoch: 90, train_loss: 0.1434, test_loss: 3.1909, test_f1: 0.5699
 epoch: 91, train_loss: 0.1425, test_loss: 3.2103, test_f1: 0.5827
 epoch: 92, train_loss: 0.1193, test_loss: 3.3609, test_f1: 0.5930
 epoch: 93, train_loss: 0.1212, test_loss: 3.3243, test_f1: 0.5765
 epoch: 94, train_loss: 0.1217, test_loss: 3.6248, test_f1: 0.5982
 epoch: 95, train_loss: 0.1215, test_loss: 3.6202, test_f1: 0.5958
 epoch: 96, train_loss: 0.1235, test_loss: 3.5119, test_f1: 0.5640
 epoch: 97, train_loss: 0.1517, test_loss: 3.5226, test_f1: 0.5921
 epoch: 98, train_loss: 0.1538, test_loss: 3.5560, test_f1: 0.5867
 epoch: 99, train_loss: 0.1577, test_loss: 3.7561, test_f1: 0.5933
##################ITERATION #2 ****************************************
 epoch: 0, train_loss: 1.1421, test_loss: 1.2130, test_f1: 0.3819
 epoch: 1, train_loss: 1.0136, test_loss: 1.0856, test_f1: 0.4993
 epoch: 2, train_loss: 0.9349, test_loss: 1.0965, test_f1: 0.4984
 epoch: 3, train_loss: 0.8962, test_loss: 1.0585, test_f1: 0.5017
 epoch: 4, train_loss: 0.9064, test_loss: 1.0659, test_f1: 0.5529
 epoch: 5, train_loss: 0.8482, test_loss: 1.0670, test_f1: 0.5768
 epoch: 6, train_loss: 0.8044, test_loss: 1.1102, test_f1: 0.5337
 epoch: 7, train_loss: 0.8318, test_loss: 0.9816, test_f1: 0.5873
 epoch: 8, train_loss: 0.7820, test_loss: 1.0445, test_f1: 0.5531
 epoch: 9, train_loss: 0.8099, test_loss: 1.1476, test_f1: 0.5900
 epoch: 10, train_loss: 0.7921, test_loss: 1.1367, test_f1: 0.5444
 epoch: 11, train_loss: 0.7524, test_loss: 1.1181, test_f1: 0.5592
 epoch: 12, train_loss: 0.7450, test_loss: 1.3221, test_f1: 0.5663
 epoch: 13, train_loss: 0.7454, test_loss: 1.1526, test_f1: 0.6105
 epoch: 14, train_loss: 0.7031, test_loss: 1.0868, test_f1: 0.6052
 epoch: 15, train_loss: 0.6989, test_loss: 1.1381, test_f1: 0.5879
 epoch: 16, train_loss: 0.6613, test_loss: 1.3166, test_f1: 0.6075
 epoch: 17, train_loss: 0.6441, test_loss: 1.2322, test_f1: 0.6167
 epoch: 18, train_loss: 0.6526, test_loss: 1.3701, test_f1: 0.5526
 epoch: 19, train_loss: 0.6651, test_loss: 1.4953, test_f1: 0.5443
 epoch: 20, train_loss: 0.6411, test_loss: 1.3852, test_f1: 0.5986
 epoch: 21, train_loss: 0.6210, test_loss: 1.3370, test_f1: 0.5705
 epoch: 22, train_loss: 0.6230, test_loss: 1.4218, test_f1: 0.5821
 epoch: 23, train_loss: 0.5808, test_loss: 1.4671, test_f1: 0.5874
 epoch: 24, train_loss: 0.5982, test_loss: 1.4623, test_f1: 0.5825
 epoch: 25, train_loss: 0.5382, test_loss: 1.5482, test_f1: 0.5861
 epoch: 26, train_loss: 0.5458, test_loss: 1.4598, test_f1: 0.5759
 epoch: 27, train_loss: 0.5401, test_loss: 1.8199, test_f1: 0.5638
 epoch: 28, train_loss: 0.5329, test_loss: 1.6081, test_f1: 0.5777
 epoch: 29, train_loss: 0.5556, test_loss: 1.4673, test_f1: 0.6013
 epoch: 30, train_loss: 0.5403, test_loss: 1.6308, test_f1: 0.6039
 epoch: 31, train_loss: 0.4953, test_loss: 1.8526, test_f1: 0.5851
 epoch: 32, train_loss: 0.4833, test_loss: 1.7827, test_f1: 0.5925
 epoch: 33, train_loss: 0.4555, test_loss: 1.8249, test_f1: 0.5713
 epoch: 34, train_loss: 0.4548, test_loss: 1.9427, test_f1: 0.6072
 epoch: 35, train_loss: 0.4524, test_loss: 1.8466, test_f1: 0.5799
 epoch: 36, train_loss: 0.4183, test_loss: 1.9408, test_f1: 0.6230
 epoch: 37, train_loss: 0.4476, test_loss: 2.1773, test_f1: 0.5843
 epoch: 38, train_loss: 0.4312, test_loss: 1.6966, test_f1: 0.5978
 epoch: 39, train_loss: 0.4026, test_loss: 1.8735, test_f1: 0.5936
 epoch: 40, train_loss: 0.4281, test_loss: 1.8548, test_f1: 0.6089
 epoch: 41, train_loss: 0.4140, test_loss: 2.2219, test_f1: 0.5345
 epoch: 42, train_loss: 0.4322, test_loss: 1.9657, test_f1: 0.5803
 epoch: 43, train_loss: 0.4561, test_loss: 2.0078, test_f1: 0.5556
 epoch: 44, train_loss: 0.4038, test_loss: 1.7477, test_f1: 0.6103
 epoch: 45, train_loss: 0.3756, test_loss: 1.9856, test_f1: 0.5916
 epoch: 46, train_loss: 0.3802, test_loss: 2.1160, test_f1: 0.6240
 epoch: 47, train_loss: 0.3998, test_loss: 2.0115, test_f1: 0.5980
 epoch: 48, train_loss: 0.3521, test_loss: 2.4881, test_f1: 0.5910
 epoch: 49, train_loss: 0.3659, test_loss: 2.2421, test_f1: 0.6256
 epoch: 50, train_loss: 0.3940, test_loss: 2.2933, test_f1: 0.5894
 epoch: 51, train_loss: 0.3474, test_loss: 2.2118, test_f1: 0.6066
 epoch: 52, train_loss: 0.2718, test_loss: 2.2270, test_f1: 0.6521
 epoch: 53, train_loss: 0.2589, test_loss: 2.2779, test_f1: 0.6188
 epoch: 54, train_loss: 0.2491, test_loss: 2.6452, test_f1: 0.5965
 epoch: 55, train_loss: 0.2504, test_loss: 2.6751, test_f1: 0.6271
 epoch: 56, train_loss: 0.2099, test_loss: 2.7945, test_f1: 0.6293
 epoch: 57, train_loss: 0.2118, test_loss: 2.6571, test_f1: 0.6176
 epoch: 58, train_loss: 0.2290, test_loss: 2.8349, test_f1: 0.6069
 epoch: 59, train_loss: 0.2162, test_loss: 2.9437, test_f1: 0.6150
 epoch: 60, train_loss: 0.2062, test_loss: 2.8022, test_f1: 0.6323
 epoch: 61, train_loss: 0.2289, test_loss: 2.9541, test_f1: 0.6102
 epoch: 62, train_loss: 0.2312, test_loss: 2.8488, test_f1: 0.6126
 epoch: 63, train_loss: 0.1802, test_loss: 2.8960, test_f1: 0.6225
 epoch: 64, train_loss: 0.1767, test_loss: 3.0480, test_f1: 0.6238
 epoch: 65, train_loss: 0.1747, test_loss: 3.3325, test_f1: 0.6135
 epoch: 66, train_loss: 0.2040, test_loss: 3.4400, test_f1: 0.6020
 epoch: 67, train_loss: 0.1874, test_loss: 3.1023, test_f1: 0.6154
 epoch: 68, train_loss: 0.1846, test_loss: 3.1831, test_f1: 0.6210
 epoch: 69, train_loss: 0.1706, test_loss: 3.2678, test_f1: 0.6199
 epoch: 70, train_loss: 0.1713, test_loss: 3.5867, test_f1: 0.6184
 epoch: 71, train_loss: 0.1744, test_loss: 3.4833, test_f1: 0.5975
 epoch: 72, train_loss: 0.1794, test_loss: 3.5097, test_f1: 0.6030
 epoch: 73, train_loss: 0.1736, test_loss: 3.5183, test_f1: 0.6120
 epoch: 74, train_loss: 0.1662, test_loss: 3.3049, test_f1: 0.6554
 epoch: 75, train_loss: 0.1537, test_loss: 3.4837, test_f1: 0.6275
 epoch: 76, train_loss: 0.1641, test_loss: 3.4302, test_f1: 0.6362
 epoch: 77, train_loss: 0.1787, test_loss: 3.5849, test_f1: 0.6268
 epoch: 78, train_loss: 0.1439, test_loss: 3.7068, test_f1: 0.6126
 epoch: 79, train_loss: 0.1529, test_loss: 3.6014, test_f1: 0.6244
 epoch: 80, train_loss: 0.1806, test_loss: 3.4942, test_f1: 0.6499
 epoch: 81, train_loss: 0.1726, test_loss: 3.8639, test_f1: 0.6084
 epoch: 82, train_loss: 0.1758, test_loss: 3.8641, test_f1: 0.6126
 epoch: 83, train_loss: 0.1346, test_loss: 3.8171, test_f1: 0.6056
 epoch: 84, train_loss: 0.1498, test_loss: 3.6694, test_f1: 0.6176
 epoch: 85, train_loss: 0.2022, test_loss: 3.5712, test_f1: 0.6034
 epoch: 86, train_loss: 0.1835, test_loss: 3.5473, test_f1: 0.6250
 epoch: 87, train_loss: 0.1667, test_loss: 3.7235, test_f1: 0.6097
 epoch: 88, train_loss: 0.1437, test_loss: 3.5816, test_f1: 0.6351
 epoch: 89, train_loss: 0.1431, test_loss: 3.6797, test_f1: 0.6268
 epoch: 90, train_loss: 0.1415, test_loss: 3.6772, test_f1: 0.6020
 epoch: 91, train_loss: 0.1433, test_loss: 3.9525, test_f1: 0.6294
 epoch: 92, train_loss: 0.1425, test_loss: 3.7795, test_f1: 0.6041
 epoch: 93, train_loss: 0.1425, test_loss: 3.7382, test_f1: 0.6181
 epoch: 94, train_loss: 0.1075, test_loss: 3.8126, test_f1: 0.6124
 epoch: 95, train_loss: 0.1175, test_loss: 4.3011, test_f1: 0.5982
 epoch: 96, train_loss: 0.1424, test_loss: 4.1707, test_f1: 0.6253
 epoch: 97, train_loss: 0.1198, test_loss: 4.0989, test_f1: 0.6026
 epoch: 98, train_loss: 0.1453, test_loss: 3.7431, test_f1: 0.6380
 epoch: 99, train_loss: 0.1209, test_loss: 4.0977, test_f1: 0.6173
##################ITERATION #3 ****************************************
 epoch: 0, train_loss: 1.2155, test_loss: 1.2328, test_f1: 0.3123
 epoch: 1, train_loss: 1.0441, test_loss: 1.0978, test_f1: 0.4847
 epoch: 2, train_loss: 0.9527, test_loss: 1.0354, test_f1: 0.5581
 epoch: 3, train_loss: 0.9199, test_loss: 1.0645, test_f1: 0.5656
 epoch: 4, train_loss: 0.9150, test_loss: 1.0415, test_f1: 0.5673
 epoch: 5, train_loss: 0.8625, test_loss: 1.0611, test_f1: 0.5856
 epoch: 6, train_loss: 0.8746, test_loss: 1.0712, test_f1: 0.5831
 epoch: 7, train_loss: 0.8224, test_loss: 1.0421, test_f1: 0.6081
 epoch: 8, train_loss: 0.8163, test_loss: 1.0216, test_f1: 0.6221
 epoch: 9, train_loss: 0.8077, test_loss: 1.0313, test_f1: 0.6025
 epoch: 10, train_loss: 0.7877, test_loss: 1.0023, test_f1: 0.6010
 epoch: 11, train_loss: 0.7665, test_loss: 1.1018, test_f1: 0.5560
 epoch: 12, train_loss: 0.7617, test_loss: 1.0647, test_f1: 0.6215
 epoch: 13, train_loss: 0.7457, test_loss: 1.1791, test_f1: 0.6307
 epoch: 14, train_loss: 0.7341, test_loss: 1.2241, test_f1: 0.5574
 epoch: 15, train_loss: 0.6626, test_loss: 1.0639, test_f1: 0.6383
 epoch: 16, train_loss: 0.6575, test_loss: 1.2243, test_f1: 0.5840
 epoch: 17, train_loss: 0.6578, test_loss: 1.2806, test_f1: 0.5574
 epoch: 18, train_loss: 0.6169, test_loss: 1.2890, test_f1: 0.5848
 epoch: 19, train_loss: 0.5927, test_loss: 1.2993, test_f1: 0.6005
 epoch: 20, train_loss: 0.6022, test_loss: 1.1309, test_f1: 0.6666
 epoch: 21, train_loss: 0.5699, test_loss: 1.4516, test_f1: 0.5907
 epoch: 22, train_loss: 0.5842, test_loss: 1.6998, test_f1: 0.4970
 epoch: 23, train_loss: 0.5645, test_loss: 1.3740, test_f1: 0.6072
 epoch: 24, train_loss: 0.5555, test_loss: 1.4319, test_f1: 0.6397
 epoch: 25, train_loss: 0.5341, test_loss: 1.5337, test_f1: 0.5846
 epoch: 26, train_loss: 0.5546, test_loss: 1.5548, test_f1: 0.6053
 epoch: 27, train_loss: 0.5218, test_loss: 1.6830, test_f1: 0.5635
 epoch: 28, train_loss: 0.4931, test_loss: 1.5204, test_f1: 0.6110
 epoch: 29, train_loss: 0.4924, test_loss: 1.4645, test_f1: 0.6127
 epoch: 30, train_loss: 0.5008, test_loss: 1.6966, test_f1: 0.6290
 epoch: 31, train_loss: 0.4671, test_loss: 1.8965, test_f1: 0.6262
 epoch: 32, train_loss: 0.4827, test_loss: 1.6609, test_f1: 0.5815
 epoch: 33, train_loss: 0.4567, test_loss: 1.9278, test_f1: 0.5976
 epoch: 34, train_loss: 0.4521, test_loss: 1.9005, test_f1: 0.6144
 epoch: 35, train_loss: 0.4837, test_loss: 1.9055, test_f1: 0.5643
 epoch: 36, train_loss: 0.4864, test_loss: 1.7882, test_f1: 0.5975
 epoch: 37, train_loss: 0.4247, test_loss: 1.8877, test_f1: 0.6243
 epoch: 38, train_loss: 0.4480, test_loss: 2.0700, test_f1: 0.5535
 epoch: 39, train_loss: 0.4175, test_loss: 1.8998, test_f1: 0.5607
 epoch: 40, train_loss: 0.4240, test_loss: 2.0780, test_f1: 0.5845
 epoch: 41, train_loss: 0.3930, test_loss: 2.2074, test_f1: 0.6148
 epoch: 42, train_loss: 0.3926, test_loss: 1.8252, test_f1: 0.6106
 epoch: 43, train_loss: 0.3986, test_loss: 1.9196, test_f1: 0.6232
 epoch: 44, train_loss: 0.3557, test_loss: 2.0910, test_f1: 0.6476
 epoch: 45, train_loss: 0.3403, test_loss: 2.1944, test_f1: 0.5877
 epoch: 46, train_loss: 0.3612, test_loss: 1.9278, test_f1: 0.6213
 epoch: 47, train_loss: 0.3858, test_loss: 2.2629, test_f1: 0.5621
 epoch: 48, train_loss: 0.3396, test_loss: 2.3526, test_f1: 0.5789
 epoch: 49, train_loss: 0.2999, test_loss: 2.3651, test_f1: 0.5927
 epoch: 50, train_loss: 0.3808, test_loss: 2.2942, test_f1: 0.5912
 epoch: 51, train_loss: 0.2948, test_loss: 2.1314, test_f1: 0.6288
 epoch: 52, train_loss: 0.3102, test_loss: 2.5209, test_f1: 0.6010
 epoch: 53, train_loss: 0.2774, test_loss: 2.5611, test_f1: 0.6282
 epoch: 54, train_loss: 0.2419, test_loss: 2.5813, test_f1: 0.6317
 epoch: 55, train_loss: 0.2570, test_loss: 2.7771, test_f1: 0.5978
 epoch: 56, train_loss: 0.2423, test_loss: 2.7250, test_f1: 0.6227
 epoch: 57, train_loss: 0.2418, test_loss: 2.7617, test_f1: 0.5898
 epoch: 58, train_loss: 0.2126, test_loss: 2.7825, test_f1: 0.6170
 epoch: 59, train_loss: 0.1987, test_loss: 3.0667, test_f1: 0.6156
 epoch: 60, train_loss: 0.2246, test_loss: 2.9492, test_f1: 0.6077
 epoch: 61, train_loss: 0.2220, test_loss: 3.2129, test_f1: 0.6033
 epoch: 62, train_loss: 0.2124, test_loss: 2.9754, test_f1: 0.6091
 epoch: 63, train_loss: 0.2111, test_loss: 3.3682, test_f1: 0.5916
 epoch: 64, train_loss: 0.1861, test_loss: 2.9046, test_f1: 0.6023
 epoch: 65, train_loss: 0.2012, test_loss: 3.4053, test_f1: 0.5809
 epoch: 66, train_loss: 0.2006, test_loss: 3.4802, test_f1: 0.5789
 epoch: 67, train_loss: 0.2075, test_loss: 2.8442, test_f1: 0.6030
 epoch: 68, train_loss: 0.1828, test_loss: 3.3353, test_f1: 0.5849
 epoch: 69, train_loss: 0.1788, test_loss: 3.0136, test_f1: 0.5990
 epoch: 70, train_loss: 0.1887, test_loss: 3.3310, test_f1: 0.5678
 epoch: 71, train_loss: 0.1928, test_loss: 3.1364, test_f1: 0.6232
 epoch: 72, train_loss: 0.1615, test_loss: 3.3277, test_f1: 0.5951
 epoch: 73, train_loss: 0.1865, test_loss: 3.2499, test_f1: 0.5943
 epoch: 74, train_loss: 0.1869, test_loss: 3.1918, test_f1: 0.6024
 epoch: 75, train_loss: 0.1802, test_loss: 3.1152, test_f1: 0.6236
 epoch: 76, train_loss: 0.1762, test_loss: 3.2857, test_f1: 0.6240
 epoch: 77, train_loss: 0.1871, test_loss: 3.4728, test_f1: 0.5471
 epoch: 78, train_loss: 0.1874, test_loss: 3.2173, test_f1: 0.5830
 epoch: 79, train_loss: 0.1649, test_loss: 3.4700, test_f1: 0.6028
 epoch: 80, train_loss: 0.1548, test_loss: 3.3775, test_f1: 0.5987
 epoch: 81, train_loss: 0.1573, test_loss: 3.8690, test_f1: 0.6105
 epoch: 82, train_loss: 0.1460, test_loss: 3.4593, test_f1: 0.5912
 epoch: 83, train_loss: 0.1453, test_loss: 3.3077, test_f1: 0.6182
 epoch: 84, train_loss: 0.1407, test_loss: 3.8482, test_f1: 0.6249
 epoch: 85, train_loss: 0.1632, test_loss: 3.8734, test_f1: 0.5982
 epoch: 86, train_loss: 0.1549, test_loss: 3.6888, test_f1: 0.6233
 epoch: 87, train_loss: 0.1508, test_loss: 3.6519, test_f1: 0.6328
 epoch: 88, train_loss: 0.1424, test_loss: 3.9331, test_f1: 0.5771
 epoch: 89, train_loss: 0.1387, test_loss: 3.7886, test_f1: 0.6365
 epoch: 90, train_loss: 0.1622, test_loss: 3.9429, test_f1: 0.5994
 epoch: 91, train_loss: 0.1692, test_loss: 3.7719, test_f1: 0.5895
 epoch: 92, train_loss: 0.1250, test_loss: 3.8827, test_f1: 0.5990
 epoch: 93, train_loss: 0.1393, test_loss: 3.9887, test_f1: 0.6059
 epoch: 94, train_loss: 0.1416, test_loss: 4.1484, test_f1: 0.5911
 epoch: 95, train_loss: 0.1256, test_loss: 4.1946, test_f1: 0.5833
 epoch: 96, train_loss: 0.1689, test_loss: 3.9394, test_f1: 0.5807
 epoch: 97, train_loss: 0.1793, test_loss: 3.9051, test_f1: 0.5811
 epoch: 98, train_loss: 0.1478, test_loss: 3.4671, test_f1: 0.5837
 epoch: 99, train_loss: 0.1452, test_loss: 4.2282, test_f1: 0.5759
##################ITERATION #4 ****************************************
 epoch: 0, train_loss: 1.3150, test_loss: 1.2207, test_f1: 0.2799
 epoch: 1, train_loss: 1.0207, test_loss: 1.1595, test_f1: 0.4046
 epoch: 2, train_loss: 0.9698, test_loss: 1.1162, test_f1: 0.5045
 epoch: 3, train_loss: 0.9349, test_loss: 1.1268, test_f1: 0.5437
 epoch: 4, train_loss: 0.9161, test_loss: 1.1597, test_f1: 0.5095
 epoch: 5, train_loss: 0.8785, test_loss: 1.0792, test_f1: 0.5568
 epoch: 6, train_loss: 0.8757, test_loss: 1.1157, test_f1: 0.5777
 epoch: 7, train_loss: 0.8370, test_loss: 1.1617, test_f1: 0.5537
 epoch: 8, train_loss: 0.8359, test_loss: 1.1313, test_f1: 0.5597
 epoch: 9, train_loss: 0.8079, test_loss: 1.1898, test_f1: 0.5831
 epoch: 10, train_loss: 0.7961, test_loss: 1.0871, test_f1: 0.5946
 epoch: 11, train_loss: 0.7831, test_loss: 1.2131, test_f1: 0.5939
 epoch: 12, train_loss: 0.7736, test_loss: 1.1634, test_f1: 0.5822
 epoch: 13, train_loss: 0.7669, test_loss: 1.2325, test_f1: 0.6201
 epoch: 14, train_loss: 0.7562, test_loss: 1.2092, test_f1: 0.6134
 epoch: 15, train_loss: 0.7319, test_loss: 1.1899, test_f1: 0.6086
 epoch: 16, train_loss: 0.6905, test_loss: 1.3667, test_f1: 0.5765
 epoch: 17, train_loss: 0.6728, test_loss: 1.4579, test_f1: 0.5442
 epoch: 18, train_loss: 0.7116, test_loss: 1.4937, test_f1: 0.6035
 epoch: 19, train_loss: 0.6700, test_loss: 1.4440, test_f1: 0.5750
 epoch: 20, train_loss: 0.6436, test_loss: 1.4036, test_f1: 0.5731
 epoch: 21, train_loss: 0.6279, test_loss: 1.5451, test_f1: 0.5628
 epoch: 22, train_loss: 0.6237, test_loss: 1.5883, test_f1: 0.5903
 epoch: 23, train_loss: 0.6150, test_loss: 1.4948, test_f1: 0.5782
 epoch: 24, train_loss: 0.6209, test_loss: 1.4756, test_f1: 0.6114
 epoch: 25, train_loss: 0.6089, test_loss: 1.6255, test_f1: 0.5782
 epoch: 26, train_loss: 0.5962, test_loss: 1.4053, test_f1: 0.5684
 epoch: 27, train_loss: 0.5710, test_loss: 1.6303, test_f1: 0.6166
 epoch: 28, train_loss: 0.5568, test_loss: 1.7413, test_f1: 0.5692
 epoch: 29, train_loss: 0.5351, test_loss: 1.9345, test_f1: 0.5473
 epoch: 30, train_loss: 0.5415, test_loss: 1.5450, test_f1: 0.5866
 epoch: 31, train_loss: 0.5358, test_loss: 1.8603, test_f1: 0.5720
 epoch: 32, train_loss: 0.5275, test_loss: 1.7889, test_f1: 0.5858
 epoch: 33, train_loss: 0.5197, test_loss: 1.7176, test_f1: 0.6291
 epoch: 34, train_loss: 0.4981, test_loss: 1.7375, test_f1: 0.5636
 epoch: 35, train_loss: 0.4736, test_loss: 2.1534, test_f1: 0.6224
 epoch: 36, train_loss: 0.4856, test_loss: 1.8795, test_f1: 0.5994
 epoch: 37, train_loss: 0.4800, test_loss: 1.8876, test_f1: 0.6063
 epoch: 38, train_loss: 0.4736, test_loss: 1.8273, test_f1: 0.5692
 epoch: 39, train_loss: 0.4789, test_loss: 1.8150, test_f1: 0.5965
 epoch: 40, train_loss: 0.4208, test_loss: 2.0199, test_f1: 0.5773
 epoch: 41, train_loss: 0.4267, test_loss: 2.0527, test_f1: 0.6087
 epoch: 42, train_loss: 0.4161, test_loss: 2.2646, test_f1: 0.5667
 epoch: 43, train_loss: 0.4220, test_loss: 2.0993, test_f1: 0.5225
 epoch: 44, train_loss: 0.4198, test_loss: 2.2778, test_f1: 0.6208
 epoch: 45, train_loss: 0.3948, test_loss: 2.2962, test_f1: 0.5812
 epoch: 46, train_loss: 0.3950, test_loss: 2.2861, test_f1: 0.5519
 epoch: 47, train_loss: 0.3850, test_loss: 2.3667, test_f1: 0.5201
 epoch: 48, train_loss: 0.3893, test_loss: 2.3803, test_f1: 0.5885
 epoch: 49, train_loss: 0.3795, test_loss: 2.3920, test_f1: 0.5968
 epoch: 50, train_loss: 0.3692, test_loss: 2.2399, test_f1: 0.5247
 epoch: 51, train_loss: 0.3614, test_loss: 2.3616, test_f1: 0.5835
 epoch: 52, train_loss: 0.3226, test_loss: 2.3456, test_f1: 0.6001
 epoch: 53, train_loss: 0.2948, test_loss: 2.4166, test_f1: 0.5846
 epoch: 54, train_loss: 0.3011, test_loss: 2.6154, test_f1: 0.5782
 epoch: 55, train_loss: 0.2775, test_loss: 2.6289, test_f1: 0.5786
 epoch: 56, train_loss: 0.2656, test_loss: 2.6088, test_f1: 0.5824
 epoch: 57, train_loss: 0.2676, test_loss: 2.7250, test_f1: 0.5890
 epoch: 58, train_loss: 0.2429, test_loss: 2.7668, test_f1: 0.6030
 epoch: 59, train_loss: 0.2457, test_loss: 2.8481, test_f1: 0.5761
 epoch: 60, train_loss: 0.2432, test_loss: 2.9880, test_f1: 0.5769
 epoch: 61, train_loss: 0.2519, test_loss: 3.0622, test_f1: 0.5562
 epoch: 62, train_loss: 0.2538, test_loss: 2.9181, test_f1: 0.5818
 epoch: 63, train_loss: 0.2398, test_loss: 3.0030, test_f1: 0.5950
 epoch: 64, train_loss: 0.2298, test_loss: 2.9192, test_f1: 0.5866
 epoch: 65, train_loss: 0.2004, test_loss: 3.1795, test_f1: 0.5898
 epoch: 66, train_loss: 0.2222, test_loss: 2.9079, test_f1: 0.5931
 epoch: 67, train_loss: 0.2150, test_loss: 3.1293, test_f1: 0.5904
 epoch: 68, train_loss: 0.2199, test_loss: 3.1587, test_f1: 0.5643
 epoch: 69, train_loss: 0.2384, test_loss: 3.2728, test_f1: 0.5828
 epoch: 70, train_loss: 0.2118, test_loss: 3.3355, test_f1: 0.5833
 epoch: 71, train_loss: 0.2207, test_loss: 3.3486, test_f1: 0.5823
 epoch: 72, train_loss: 0.2218, test_loss: 3.6819, test_f1: 0.5668
 epoch: 73, train_loss: 0.1884, test_loss: 3.6245, test_f1: 0.5691
 epoch: 74, train_loss: 0.2126, test_loss: 3.2686, test_f1: 0.6007
 epoch: 75, train_loss: 0.2146, test_loss: 3.3326, test_f1: 0.5845
 epoch: 76, train_loss: 0.1895, test_loss: 3.5245, test_f1: 0.5834
 epoch: 77, train_loss: 0.1976, test_loss: 3.2493, test_f1: 0.5883
 epoch: 78, train_loss: 0.2343, test_loss: 3.3673, test_f1: 0.5842
 epoch: 79, train_loss: 0.2372, test_loss: 3.2629, test_f1: 0.6086
 epoch: 80, train_loss: 0.2279, test_loss: 3.7710, test_f1: 0.5859
 epoch: 81, train_loss: 0.2006, test_loss: 3.3720, test_f1: 0.5838
 epoch: 82, train_loss: 0.1783, test_loss: 3.2869, test_f1: 0.5907
 epoch: 83, train_loss: 0.1850, test_loss: 3.6753, test_f1: 0.5749
 epoch: 84, train_loss: 0.1864, test_loss: 3.8527, test_f1: 0.5595
 epoch: 85, train_loss: 0.1949, test_loss: 3.4563, test_f1: 0.5837
 epoch: 86, train_loss: 0.1724, test_loss: 3.7222, test_f1: 0.5653
 epoch: 87, train_loss: 0.1740, test_loss: 3.5630, test_f1: 0.5967
 epoch: 88, train_loss: 0.2037, test_loss: 3.5320, test_f1: 0.5784
 epoch: 89, train_loss: 0.1848, test_loss: 3.9473, test_f1: 0.5913
 epoch: 90, train_loss: 0.1744, test_loss: 3.4604, test_f1: 0.5774
 epoch: 91, train_loss: 0.1975, test_loss: 3.7187, test_f1: 0.5690
 epoch: 92, train_loss: 0.1970, test_loss: 3.9377, test_f1: 0.5899
 epoch: 93, train_loss: 0.1849, test_loss: 3.3836, test_f1: 0.5787
 epoch: 94, train_loss: 0.1885, test_loss: 3.6022, test_f1: 0.5880
 epoch: 95, train_loss: 0.1710, test_loss: 3.7844, test_f1: 0.5908
 epoch: 96, train_loss: 0.1796, test_loss: 4.0643, test_f1: 0.5684
 epoch: 97, train_loss: 0.1597, test_loss: 3.9025, test_f1: 0.5853
 epoch: 98, train_loss: 0.1674, test_loss: 4.2553, test_f1: 0.5679
 epoch: 99, train_loss: 0.1837, test_loss: 3.9809, test_f1: 0.5773
##################ITERATION #5 ****************************************
 epoch: 0, train_loss: 1.3120, test_loss: 1.2588, test_f1: 0.2003
 epoch: 1, train_loss: 1.0599, test_loss: 1.1318, test_f1: 0.3972
 epoch: 2, train_loss: 0.9725, test_loss: 1.1239, test_f1: 0.4329
 epoch: 3, train_loss: 0.9681, test_loss: 1.1155, test_f1: 0.4888
 epoch: 4, train_loss: 0.9313, test_loss: 1.0306, test_f1: 0.5646
 epoch: 5, train_loss: 0.9010, test_loss: 1.0633, test_f1: 0.5511
 epoch: 6, train_loss: 0.8781, test_loss: 1.0301, test_f1: 0.5481
 epoch: 7, train_loss: 0.8347, test_loss: 1.0317, test_f1: 0.5601
 epoch: 8, train_loss: 0.8283, test_loss: 1.0686, test_f1: 0.4835
 epoch: 9, train_loss: 0.8206, test_loss: 1.0955, test_f1: 0.5429
 epoch: 10, train_loss: 0.7962, test_loss: 1.0693, test_f1: 0.4591
 epoch: 11, train_loss: 0.7871, test_loss: 1.0451, test_f1: 0.5739
 epoch: 12, train_loss: 0.7833, test_loss: 1.0435, test_f1: 0.5789
 epoch: 13, train_loss: 0.7592, test_loss: 1.1547, test_f1: 0.5374
 epoch: 14, train_loss: 0.7300, test_loss: 1.0418, test_f1: 0.5959
 epoch: 15, train_loss: 0.7297, test_loss: 1.2483, test_f1: 0.4333
 epoch: 16, train_loss: 0.7331, test_loss: 1.1306, test_f1: 0.5617
 epoch: 17, train_loss: 0.6939, test_loss: 1.3374, test_f1: 0.5673
 epoch: 18, train_loss: 0.6755, test_loss: 1.2158, test_f1: 0.5890
 epoch: 19, train_loss: 0.6712, test_loss: 1.1355, test_f1: 0.6035
 epoch: 20, train_loss: 0.6341, test_loss: 1.1707, test_f1: 0.5875
 epoch: 21, train_loss: 0.6356, test_loss: 1.2108, test_f1: 0.5585
 epoch: 22, train_loss: 0.6285, test_loss: 1.2547, test_f1: 0.5981
 epoch: 23, train_loss: 0.6179, test_loss: 1.2552, test_f1: 0.5974
 epoch: 24, train_loss: 0.5977, test_loss: 1.1878, test_f1: 0.5999
 epoch: 25, train_loss: 0.5858, test_loss: 1.3544, test_f1: 0.5395
 epoch: 26, train_loss: 0.5413, test_loss: 1.3453, test_f1: 0.5731
 epoch: 27, train_loss: 0.5351, test_loss: 1.3772, test_f1: 0.5744
 epoch: 28, train_loss: 0.5223, test_loss: 1.5032, test_f1: 0.6122
 epoch: 29, train_loss: 0.5414, test_loss: 1.4245, test_f1: 0.5643
 epoch: 30, train_loss: 0.5314, test_loss: 1.4056, test_f1: 0.6301
 epoch: 31, train_loss: 0.4960, test_loss: 1.6198, test_f1: 0.5924
 epoch: 32, train_loss: 0.5457, test_loss: 1.3342, test_f1: 0.6191
 epoch: 33, train_loss: 0.5381, test_loss: 1.4715, test_f1: 0.5109
 epoch: 34, train_loss: 0.4750, test_loss: 1.7247, test_f1: 0.5880
 epoch: 35, train_loss: 0.4745, test_loss: 1.3839, test_f1: 0.6193
 epoch: 36, train_loss: 0.4562, test_loss: 1.6561, test_f1: 0.5541
 epoch: 37, train_loss: 0.4530, test_loss: 1.6289, test_f1: 0.6271
 epoch: 38, train_loss: 0.4693, test_loss: 1.7743, test_f1: 0.5954
 epoch: 39, train_loss: 0.4618, test_loss: 1.6848, test_f1: 0.5906
 epoch: 40, train_loss: 0.4514, test_loss: 1.7695, test_f1: 0.5717
 epoch: 41, train_loss: 0.4171, test_loss: 1.6168, test_f1: 0.6116
 epoch: 42, train_loss: 0.4424, test_loss: 1.6346, test_f1: 0.5640
 epoch: 43, train_loss: 0.4202, test_loss: 1.6956, test_f1: 0.6143
 epoch: 44, train_loss: 0.4136, test_loss: 1.8971, test_f1: 0.5363
 epoch: 45, train_loss: 0.3769, test_loss: 1.8069, test_f1: 0.5963
 epoch: 46, train_loss: 0.3826, test_loss: 1.8828, test_f1: 0.5759
 epoch: 47, train_loss: 0.3740, test_loss: 2.0095, test_f1: 0.6021
 epoch: 48, train_loss: 0.3549, test_loss: 2.0105, test_f1: 0.5731
 epoch: 49, train_loss: 0.3293, test_loss: 1.9407, test_f1: 0.5854
 epoch: 50, train_loss: 0.3390, test_loss: 2.0083, test_f1: 0.5927
 epoch: 51, train_loss: 0.2997, test_loss: 2.0719, test_f1: 0.5937
 epoch: 52, train_loss: 0.2723, test_loss: 2.1457, test_f1: 0.5790
 epoch: 53, train_loss: 0.2693, test_loss: 2.4409, test_f1: 0.5944
 epoch: 54, train_loss: 0.2707, test_loss: 2.5717, test_f1: 0.5656
 epoch: 55, train_loss: 0.2560, test_loss: 2.3708, test_f1: 0.5921
 epoch: 56, train_loss: 0.2495, test_loss: 2.5635, test_f1: 0.5903
 epoch: 57, train_loss: 0.2454, test_loss: 2.6361, test_f1: 0.5763
 epoch: 58, train_loss: 0.2256, test_loss: 2.6412, test_f1: 0.5680
 epoch: 59, train_loss: 0.2376, test_loss: 2.5874, test_f1: 0.5641
 epoch: 60, train_loss: 0.2223, test_loss: 2.7632, test_f1: 0.5945
 epoch: 61, train_loss: 0.2378, test_loss: 2.6448, test_f1: 0.5727
 epoch: 62, train_loss: 0.2471, test_loss: 2.6947, test_f1: 0.5663
 epoch: 63, train_loss: 0.2170, test_loss: 2.6383, test_f1: 0.6191
 epoch: 64, train_loss: 0.2376, test_loss: 2.7205, test_f1: 0.5625
 epoch: 65, train_loss: 0.2205, test_loss: 2.9931, test_f1: 0.5918
 epoch: 66, train_loss: 0.2213, test_loss: 2.9072, test_f1: 0.5713
 epoch: 67, train_loss: 0.2191, test_loss: 2.9429, test_f1: 0.5704
 epoch: 68, train_loss: 0.2025, test_loss: 3.0674, test_f1: 0.5694
 epoch: 69, train_loss: 0.2299, test_loss: 2.9615, test_f1: 0.5775
 epoch: 70, train_loss: 0.2296, test_loss: 2.7479, test_f1: 0.5737
 epoch: 71, train_loss: 0.1987, test_loss: 3.1066, test_f1: 0.6060
 epoch: 72, train_loss: 0.2055, test_loss: 3.0588, test_f1: 0.6002
 epoch: 73, train_loss: 0.1880, test_loss: 3.0460, test_f1: 0.5777
 epoch: 74, train_loss: 0.1938, test_loss: 3.0073, test_f1: 0.5802
 epoch: 75, train_loss: 0.1861, test_loss: 3.4436, test_f1: 0.5749
 epoch: 76, train_loss: 0.1925, test_loss: 2.9452, test_f1: 0.6219
 epoch: 77, train_loss: 0.1899, test_loss: 3.1504, test_f1: 0.5983
 epoch: 78, train_loss: 0.2289, test_loss: 2.6371, test_f1: 0.6034
 epoch: 79, train_loss: 0.2234, test_loss: 2.7879, test_f1: 0.6014
 epoch: 80, train_loss: 0.2029, test_loss: 2.9292, test_f1: 0.6020
 epoch: 81, train_loss: 0.1883, test_loss: 2.8931, test_f1: 0.6144
 epoch: 82, train_loss: 0.1809, test_loss: 3.0646, test_f1: 0.6030
 epoch: 83, train_loss: 0.1855, test_loss: 2.8597, test_f1: 0.5807
 epoch: 84, train_loss: 0.1634, test_loss: 2.8818, test_f1: 0.5929
 epoch: 85, train_loss: 0.1735, test_loss: 3.0427, test_f1: 0.6134
 epoch: 86, train_loss: 0.1511, test_loss: 3.1887, test_f1: 0.5770
 epoch: 87, train_loss: 0.1630, test_loss: 3.1066, test_f1: 0.5948
 epoch: 88, train_loss: 0.1614, test_loss: 3.4232, test_f1: 0.5991
 epoch: 89, train_loss: 0.1598, test_loss: 3.4156, test_f1: 0.5944
 epoch: 90, train_loss: 0.1701, test_loss: 3.1481, test_f1: 0.6157
 epoch: 91, train_loss: 0.1754, test_loss: 3.0334, test_f1: 0.5878
 epoch: 92, train_loss: 0.1692, test_loss: 3.2481, test_f1: 0.6075
 epoch: 93, train_loss: 0.1622, test_loss: 3.6004, test_f1: 0.5579
 epoch: 94, train_loss: 0.1765, test_loss: 3.4127, test_f1: 0.5748
 epoch: 95, train_loss: 0.1347, test_loss: 3.0861, test_f1: 0.6108
 epoch: 96, train_loss: 0.1374, test_loss: 3.4947, test_f1: 0.6010
 epoch: 97, train_loss: 0.1416, test_loss: 3.4283, test_f1: 0.5830
 epoch: 98, train_loss: 0.1868, test_loss: 3.3838, test_f1: 0.5782
 epoch: 99, train_loss: 0.1600, test_loss: 3.6278, test_f1: 0.5681
##################ITERATION #6 ****************************************
 epoch: 0, train_loss: 1.3807, test_loss: 1.2847, test_f1: 0.1365
 epoch: 1, train_loss: 1.0928, test_loss: 1.1243, test_f1: 0.4145
 epoch: 2, train_loss: 0.9672, test_loss: 1.1010, test_f1: 0.5216
 epoch: 3, train_loss: 0.9364, test_loss: 1.0532, test_f1: 0.5218
 epoch: 4, train_loss: 0.9071, test_loss: 1.0220, test_f1: 0.5791
 epoch: 5, train_loss: 0.8723, test_loss: 1.0917, test_f1: 0.5668
 epoch: 6, train_loss: 0.8474, test_loss: 1.1023, test_f1: 0.5653
 epoch: 7, train_loss: 0.8289, test_loss: 1.0326, test_f1: 0.5916
 epoch: 8, train_loss: 0.8194, test_loss: 1.1176, test_f1: 0.5333
 epoch: 9, train_loss: 0.7911, test_loss: 1.0610, test_f1: 0.5998
 epoch: 10, train_loss: 0.7934, test_loss: 1.0531, test_f1: 0.5742
 epoch: 11, train_loss: 0.8012, test_loss: 1.1441, test_f1: 0.5819
 epoch: 12, train_loss: 0.7568, test_loss: 1.1528, test_f1: 0.5240
 epoch: 13, train_loss: 0.7337, test_loss: 1.1381, test_f1: 0.5608
 epoch: 14, train_loss: 0.7194, test_loss: 1.1734, test_f1: 0.5834
 epoch: 15, train_loss: 0.6975, test_loss: 1.3381, test_f1: 0.5571
 epoch: 16, train_loss: 0.6803, test_loss: 1.3413, test_f1: 0.5377
 epoch: 17, train_loss: 0.6947, test_loss: 1.1807, test_f1: 0.5966
 epoch: 18, train_loss: 0.6867, test_loss: 1.1785, test_f1: 0.6231
 epoch: 19, train_loss: 0.6661, test_loss: 1.3100, test_f1: 0.6190
 epoch: 20, train_loss: 0.6392, test_loss: 1.2746, test_f1: 0.5731
 epoch: 21, train_loss: 0.6067, test_loss: 1.4187, test_f1: 0.5710
 epoch: 22, train_loss: 0.6164, test_loss: 1.3883, test_f1: 0.5952
 epoch: 23, train_loss: 0.5902, test_loss: 1.5447, test_f1: 0.5592
 epoch: 24, train_loss: 0.5623, test_loss: 1.4167, test_f1: 0.5965
 epoch: 25, train_loss: 0.5673, test_loss: 1.3801, test_f1: 0.5929
 epoch: 26, train_loss: 0.5834, test_loss: 1.3594, test_f1: 0.5635
 epoch: 27, train_loss: 0.5797, test_loss: 1.2890, test_f1: 0.5880
 epoch: 28, train_loss: 0.5500, test_loss: 1.2517, test_f1: 0.6192
 epoch: 29, train_loss: 0.5152, test_loss: 1.4576, test_f1: 0.6147
 epoch: 30, train_loss: 0.5205, test_loss: 1.4695, test_f1: 0.6030
 epoch: 31, train_loss: 0.5516, test_loss: 1.5921, test_f1: 0.5543
 epoch: 32, train_loss: 0.4789, test_loss: 1.4768, test_f1: 0.6041
 epoch: 33, train_loss: 0.4739, test_loss: 1.3818, test_f1: 0.5851
 epoch: 34, train_loss: 0.4610, test_loss: 1.7545, test_f1: 0.5913
 epoch: 35, train_loss: 0.4742, test_loss: 1.8272, test_f1: 0.5570
 epoch: 36, train_loss: 0.4791, test_loss: 1.6506, test_f1: 0.5915
 epoch: 37, train_loss: 0.4293, test_loss: 1.6480, test_f1: 0.5901
 epoch: 38, train_loss: 0.4197, test_loss: 1.9272, test_f1: 0.6011
 epoch: 39, train_loss: 0.4488, test_loss: 1.7046, test_f1: 0.6018
 epoch: 40, train_loss: 0.4074, test_loss: 1.6151, test_f1: 0.5978
 epoch: 41, train_loss: 0.4245, test_loss: 1.9674, test_f1: 0.5793
 epoch: 42, train_loss: 0.4340, test_loss: 1.4439, test_f1: 0.6029
 epoch: 43, train_loss: 0.4030, test_loss: 1.8583, test_f1: 0.5931
 epoch: 44, train_loss: 0.4085, test_loss: 2.0010, test_f1: 0.5758
 epoch: 45, train_loss: 0.4199, test_loss: 1.8173, test_f1: 0.5950
 epoch: 46, train_loss: 0.3959, test_loss: 1.7266, test_f1: 0.6123
 epoch: 47, train_loss: 0.3940, test_loss: 2.2372, test_f1: 0.5807
 epoch: 48, train_loss: 0.3603, test_loss: 1.7552, test_f1: 0.5925
 epoch: 49, train_loss: 0.3309, test_loss: 1.7875, test_f1: 0.5992
 epoch: 50, train_loss: 0.3609, test_loss: 1.8935, test_f1: 0.6229
 epoch: 51, train_loss: 0.3432, test_loss: 2.0280, test_f1: 0.5911
 epoch: 52, train_loss: 0.2924, test_loss: 2.1988, test_f1: 0.5817
 epoch: 53, train_loss: 0.2700, test_loss: 2.1862, test_f1: 0.5755
 epoch: 54, train_loss: 0.2551, test_loss: 2.2607, test_f1: 0.5834
 epoch: 55, train_loss: 0.2513, test_loss: 2.2129, test_f1: 0.6006
 epoch: 56, train_loss: 0.2585, test_loss: 2.3289, test_f1: 0.5950
 epoch: 57, train_loss: 0.2531, test_loss: 2.1359, test_f1: 0.6177
 epoch: 58, train_loss: 0.2291, test_loss: 2.4251, test_f1: 0.5748
 epoch: 59, train_loss: 0.2368, test_loss: 2.1781, test_f1: 0.6053
 epoch: 60, train_loss: 0.2403, test_loss: 2.1801, test_f1: 0.6051
 epoch: 61, train_loss: 0.2445, test_loss: 2.3537, test_f1: 0.5930
 epoch: 62, train_loss: 0.2270, test_loss: 2.5246, test_f1: 0.5924
 epoch: 63, train_loss: 0.2255, test_loss: 2.3347, test_f1: 0.6151
 epoch: 64, train_loss: 0.2251, test_loss: 2.7009, test_f1: 0.6052
 epoch: 65, train_loss: 0.2393, test_loss: 2.1985, test_f1: 0.6223
 epoch: 66, train_loss: 0.2313, test_loss: 2.4837, test_f1: 0.6248
 epoch: 67, train_loss: 0.1951, test_loss: 2.6034, test_f1: 0.6174
 epoch: 68, train_loss: 0.2298, test_loss: 2.5031, test_f1: 0.6070
 epoch: 69, train_loss: 0.2078, test_loss: 2.8442, test_f1: 0.5723
 epoch: 70, train_loss: 0.1945, test_loss: 2.6500, test_f1: 0.6031
 epoch: 71, train_loss: 0.1846, test_loss: 2.5994, test_f1: 0.6059
 epoch: 72, train_loss: 0.1684, test_loss: 2.6864, test_f1: 0.6128
 epoch: 73, train_loss: 0.1697, test_loss: 2.7688, test_f1: 0.5938
 epoch: 74, train_loss: 0.1967, test_loss: 3.0469, test_f1: 0.5813
 epoch: 75, train_loss: 0.2175, test_loss: 2.7783, test_f1: 0.6197
 epoch: 76, train_loss: 0.2027, test_loss: 3.0644, test_f1: 0.5972
 epoch: 77, train_loss: 0.1799, test_loss: 3.0019, test_f1: 0.6253
 epoch: 78, train_loss: 0.1735, test_loss: 3.0404, test_f1: 0.5724
 epoch: 79, train_loss: 0.1819, test_loss: 2.8824, test_f1: 0.6025
 epoch: 80, train_loss: 0.1826, test_loss: 3.0151, test_f1: 0.6110
 epoch: 81, train_loss: 0.1940, test_loss: 2.9941, test_f1: 0.5889
 epoch: 82, train_loss: 0.1967, test_loss: 2.9163, test_f1: 0.6023
 epoch: 83, train_loss: 0.1743, test_loss: 2.9966, test_f1: 0.5867
 epoch: 84, train_loss: 0.1551, test_loss: 2.9946, test_f1: 0.6037
 epoch: 85, train_loss: 0.1860, test_loss: 3.1162, test_f1: 0.5679
 epoch: 86, train_loss: 0.1735, test_loss: 2.7226, test_f1: 0.5946
 epoch: 87, train_loss: 0.1770, test_loss: 2.9612, test_f1: 0.5646
 epoch: 88, train_loss: 0.1622, test_loss: 3.0194, test_f1: 0.5706
 epoch: 89, train_loss: 0.1697, test_loss: 2.9376, test_f1: 0.5977
 epoch: 90, train_loss: 0.1597, test_loss: 3.1660, test_f1: 0.5644
 epoch: 91, train_loss: 0.1498, test_loss: 3.4476, test_f1: 0.5989
 epoch: 92, train_loss: 0.1409, test_loss: 3.3377, test_f1: 0.5857
 epoch: 93, train_loss: 0.1656, test_loss: 3.5085, test_f1: 0.5668
 epoch: 94, train_loss: 0.1581, test_loss: 3.5720, test_f1: 0.5601
 epoch: 95, train_loss: 0.1529, test_loss: 3.4736, test_f1: 0.5583
 epoch: 96, train_loss: 0.1213, test_loss: 3.7266, test_f1: 0.5894
 epoch: 97, train_loss: 0.1918, test_loss: 3.3130, test_f1: 0.5749
 epoch: 98, train_loss: 0.1478, test_loss: 3.5073, test_f1: 0.5782
 epoch: 99, train_loss: 0.1488, test_loss: 3.3217, test_f1: 0.5776
##################ITERATION #7 ****************************************
 epoch: 0, train_loss: 1.4194, test_loss: 1.2329, test_f1: 0.3177
 epoch: 1, train_loss: 1.0787, test_loss: 1.1158, test_f1: 0.4762
 epoch: 2, train_loss: 0.9985, test_loss: 1.0969, test_f1: 0.4372
 epoch: 3, train_loss: 0.9592, test_loss: 1.0906, test_f1: 0.4897
 epoch: 4, train_loss: 0.9432, test_loss: 1.1079, test_f1: 0.5651
 epoch: 5, train_loss: 0.9179, test_loss: 1.0405, test_f1: 0.5548
 epoch: 6, train_loss: 0.8978, test_loss: 1.0282, test_f1: 0.5204
 epoch: 7, train_loss: 0.8862, test_loss: 1.1248, test_f1: 0.4825
 epoch: 8, train_loss: 0.8614, test_loss: 1.0751, test_f1: 0.5486
 epoch: 9, train_loss: 0.8326, test_loss: 1.1001, test_f1: 0.5916
 epoch: 10, train_loss: 0.8302, test_loss: 1.0703, test_f1: 0.5808
 epoch: 11, train_loss: 0.8284, test_loss: 1.1628, test_f1: 0.5558
 epoch: 12, train_loss: 0.7993, test_loss: 1.1101, test_f1: 0.5803
 epoch: 13, train_loss: 0.8109, test_loss: 1.0752, test_f1: 0.5962
 epoch: 14, train_loss: 0.7943, test_loss: 1.0862, test_f1: 0.5727
 epoch: 15, train_loss: 0.7823, test_loss: 1.2088, test_f1: 0.5366
 epoch: 16, train_loss: 0.7616, test_loss: 1.1256, test_f1: 0.6179
 epoch: 17, train_loss: 0.7670, test_loss: 1.1261, test_f1: 0.6268
 epoch: 18, train_loss: 0.7304, test_loss: 1.0916, test_f1: 0.5687
 epoch: 19, train_loss: 0.7428, test_loss: 1.2545, test_f1: 0.5446
 epoch: 20, train_loss: 0.7045, test_loss: 1.1798, test_f1: 0.5771
 epoch: 21, train_loss: 0.7158, test_loss: 1.3035, test_f1: 0.5869
 epoch: 22, train_loss: 0.7075, test_loss: 1.1814, test_f1: 0.6056
 epoch: 23, train_loss: 0.6814, test_loss: 1.2019, test_f1: 0.5975
 epoch: 24, train_loss: 0.6929, test_loss: 1.1678, test_f1: 0.6023
 epoch: 25, train_loss: 0.6698, test_loss: 1.3524, test_f1: 0.5780
 epoch: 26, train_loss: 0.6517, test_loss: 1.3450, test_f1: 0.5950
 epoch: 27, train_loss: 0.6687, test_loss: 1.2150, test_f1: 0.6216
 epoch: 28, train_loss: 0.6546, test_loss: 1.2005, test_f1: 0.6072
 epoch: 29, train_loss: 0.6227, test_loss: 1.1635, test_f1: 0.6041
 epoch: 30, train_loss: 0.6024, test_loss: 1.2702, test_f1: 0.6454
 epoch: 31, train_loss: 0.5719, test_loss: 1.5189, test_f1: 0.5615
 epoch: 32, train_loss: 0.5506, test_loss: 1.4626, test_f1: 0.5667
 epoch: 33, train_loss: 0.5595, test_loss: 1.3522, test_f1: 0.6024
 epoch: 34, train_loss: 0.5742, test_loss: 1.5126, test_f1: 0.5982
 epoch: 35, train_loss: 0.5559, test_loss: 1.4959, test_f1: 0.5723
 epoch: 36, train_loss: 0.5700, test_loss: 1.3642, test_f1: 0.6004
 epoch: 37, train_loss: 0.5637, test_loss: 1.3042, test_f1: 0.5867
 epoch: 38, train_loss: 0.5389, test_loss: 1.3923, test_f1: 0.6000
 epoch: 39, train_loss: 0.5351, test_loss: 1.5259, test_f1: 0.6054
 epoch: 40, train_loss: 0.5052, test_loss: 1.6725, test_f1: 0.5269
 epoch: 41, train_loss: 0.4883, test_loss: 1.6821, test_f1: 0.5731
 epoch: 42, train_loss: 0.5076, test_loss: 1.5103, test_f1: 0.5837
 epoch: 43, train_loss: 0.5169, test_loss: 1.4652, test_f1: 0.6030
 epoch: 44, train_loss: 0.5230, test_loss: 1.5860, test_f1: 0.5826
 epoch: 45, train_loss: 0.4613, test_loss: 1.5097, test_f1: 0.6170
 epoch: 46, train_loss: 0.4852, test_loss: 1.5510, test_f1: 0.6189
 epoch: 47, train_loss: 0.4619, test_loss: 1.6280, test_f1: 0.6089
 epoch: 48, train_loss: 0.4453, test_loss: 1.6234, test_f1: 0.6056
 epoch: 49, train_loss: 0.4295, test_loss: 1.7396, test_f1: 0.6094
 epoch: 50, train_loss: 0.4243, test_loss: 1.9172, test_f1: 0.5333
 epoch: 51, train_loss: 0.3934, test_loss: 1.8646, test_f1: 0.6146
 epoch: 52, train_loss: 0.3630, test_loss: 1.9441, test_f1: 0.6028
 epoch: 53, train_loss: 0.3346, test_loss: 1.9542, test_f1: 0.6178
 epoch: 54, train_loss: 0.3419, test_loss: 2.2345, test_f1: 0.5843
 epoch: 55, train_loss: 0.3251, test_loss: 2.0016, test_f1: 0.5931
 epoch: 56, train_loss: 0.3089, test_loss: 2.0417, test_f1: 0.5830
 epoch: 57, train_loss: 0.3472, test_loss: 2.2011, test_f1: 0.5796
 epoch: 58, train_loss: 0.3535, test_loss: 2.2877, test_f1: 0.6033
 epoch: 59, train_loss: 0.3265, test_loss: 2.0671, test_f1: 0.6098
 epoch: 60, train_loss: 0.3088, test_loss: 2.3185, test_f1: 0.6168
 epoch: 61, train_loss: 0.2889, test_loss: 2.6802, test_f1: 0.5939
 epoch: 62, train_loss: 0.2916, test_loss: 2.2109, test_f1: 0.6008
 epoch: 63, train_loss: 0.3104, test_loss: 2.5663, test_f1: 0.5951
 epoch: 64, train_loss: 0.2764, test_loss: 2.3913, test_f1: 0.5932
 epoch: 65, train_loss: 0.2864, test_loss: 2.5015, test_f1: 0.5950
 epoch: 66, train_loss: 0.2934, test_loss: 2.3147, test_f1: 0.6200
 epoch: 67, train_loss: 0.2613, test_loss: 2.5806, test_f1: 0.5798
 epoch: 68, train_loss: 0.2532, test_loss: 2.5850, test_f1: 0.5726
 epoch: 69, train_loss: 0.2641, test_loss: 2.5197, test_f1: 0.6001
 epoch: 70, train_loss: 0.2767, test_loss: 2.4416, test_f1: 0.6160
 epoch: 71, train_loss: 0.2625, test_loss: 2.7494, test_f1: 0.5924
 epoch: 72, train_loss: 0.2496, test_loss: 2.5034, test_f1: 0.5862
 epoch: 73, train_loss: 0.2610, test_loss: 2.5788, test_f1: 0.5937
 epoch: 74, train_loss: 0.2547, test_loss: 2.5486, test_f1: 0.5877
 epoch: 75, train_loss: 0.2625, test_loss: 2.7746, test_f1: 0.5822
 epoch: 76, train_loss: 0.2241, test_loss: 2.9392, test_f1: 0.5734
 epoch: 77, train_loss: 0.2300, test_loss: 2.6154, test_f1: 0.5903
 epoch: 78, train_loss: 0.2338, test_loss: 2.8338, test_f1: 0.5906
 epoch: 79, train_loss: 0.2262, test_loss: 2.7881, test_f1: 0.5934
 epoch: 80, train_loss: 0.2285, test_loss: 3.0469, test_f1: 0.5887
 epoch: 81, train_loss: 0.2476, test_loss: 3.0392, test_f1: 0.5717
 epoch: 82, train_loss: 0.2169, test_loss: 2.7283, test_f1: 0.6076
 epoch: 83, train_loss: 0.2356, test_loss: 3.1345, test_f1: 0.5764
 epoch: 84, train_loss: 0.2185, test_loss: 2.9128, test_f1: 0.5780
 epoch: 85, train_loss: 0.2223, test_loss: 2.8538, test_f1: 0.5882
 epoch: 86, train_loss: 0.2394, test_loss: 2.7605, test_f1: 0.5996
 epoch: 87, train_loss: 0.1848, test_loss: 2.7805, test_f1: 0.5793
 epoch: 88, train_loss: 0.2088, test_loss: 2.8928, test_f1: 0.6011
 epoch: 89, train_loss: 0.2180, test_loss: 2.8943, test_f1: 0.5829
 epoch: 90, train_loss: 0.2278, test_loss: 3.2231, test_f1: 0.6124
 epoch: 91, train_loss: 0.2258, test_loss: 2.8716, test_f1: 0.5785
 epoch: 92, train_loss: 0.2130, test_loss: 2.8147, test_f1: 0.5650
 epoch: 93, train_loss: 0.2099, test_loss: 3.0009, test_f1: 0.5748
 epoch: 94, train_loss: 0.2158, test_loss: 3.0821, test_f1: 0.5957
 epoch: 95, train_loss: 0.1773, test_loss: 3.1858, test_f1: 0.5447
 epoch: 96, train_loss: 0.1732, test_loss: 2.9948, test_f1: 0.5686
 epoch: 97, train_loss: 0.1888, test_loss: 2.9193, test_f1: 0.5946
 epoch: 98, train_loss: 0.1819, test_loss: 2.9592, test_f1: 0.5557
 epoch: 99, train_loss: 0.1932, test_loss: 2.9621, test_f1: 0.5746
##################ITERATION #8 ****************************************
 epoch: 0, train_loss: 1.3884, test_loss: 1.3558, test_f1: 0.2228
 epoch: 1, train_loss: 1.0562, test_loss: 1.1871, test_f1: 0.3368
 epoch: 2, train_loss: 0.9909, test_loss: 1.1143, test_f1: 0.4778
 epoch: 3, train_loss: 0.9572, test_loss: 1.0652, test_f1: 0.5487
 epoch: 4, train_loss: 0.9196, test_loss: 1.0467, test_f1: 0.5558
 epoch: 5, train_loss: 0.9044, test_loss: 1.0183, test_f1: 0.6045
 epoch: 6, train_loss: 0.8687, test_loss: 1.0272, test_f1: 0.5547
 epoch: 7, train_loss: 0.8533, test_loss: 1.0101, test_f1: 0.5709
 epoch: 8, train_loss: 0.8599, test_loss: 1.1394, test_f1: 0.5338
 epoch: 9, train_loss: 0.8495, test_loss: 1.0220, test_f1: 0.5659
 epoch: 10, train_loss: 0.8491, test_loss: 1.0606, test_f1: 0.5135
 epoch: 11, train_loss: 0.8032, test_loss: 1.1046, test_f1: 0.5262
 epoch: 12, train_loss: 0.7886, test_loss: 1.1169, test_f1: 0.5956
 epoch: 13, train_loss: 0.7952, test_loss: 0.9572, test_f1: 0.6369
 epoch: 14, train_loss: 0.7695, test_loss: 1.0681, test_f1: 0.6081
 epoch: 15, train_loss: 0.7936, test_loss: 1.1394, test_f1: 0.5553
 epoch: 16, train_loss: 0.7508, test_loss: 1.0699, test_f1: 0.6017
 epoch: 17, train_loss: 0.7222, test_loss: 1.0413, test_f1: 0.5932
 epoch: 18, train_loss: 0.7320, test_loss: 1.1866, test_f1: 0.5550
 epoch: 19, train_loss: 0.7224, test_loss: 1.0886, test_f1: 0.5782
 epoch: 20, train_loss: 0.7037, test_loss: 1.0922, test_f1: 0.6047
 epoch: 21, train_loss: 0.6826, test_loss: 1.2184, test_f1: 0.5767
 epoch: 22, train_loss: 0.6930, test_loss: 1.1448, test_f1: 0.6278
 epoch: 23, train_loss: 0.6537, test_loss: 1.2501, test_f1: 0.5793
 epoch: 24, train_loss: 0.6711, test_loss: 1.2268, test_f1: 0.6258
 epoch: 25, train_loss: 0.6627, test_loss: 1.2588, test_f1: 0.5797
 epoch: 26, train_loss: 0.6659, test_loss: 1.2036, test_f1: 0.6052
 epoch: 27, train_loss: 0.6046, test_loss: 1.3239, test_f1: 0.5517
 epoch: 28, train_loss: 0.5985, test_loss: 1.3066, test_f1: 0.5530
 epoch: 29, train_loss: 0.5967, test_loss: 1.2348, test_f1: 0.5890
 epoch: 30, train_loss: 0.5858, test_loss: 1.3863, test_f1: 0.5405
 epoch: 31, train_loss: 0.5720, test_loss: 1.3110, test_f1: 0.6290
 epoch: 32, train_loss: 0.5582, test_loss: 1.4274, test_f1: 0.5766
 epoch: 33, train_loss: 0.5426, test_loss: 1.4063, test_f1: 0.6370
 epoch: 34, train_loss: 0.5495, test_loss: 1.5349, test_f1: 0.6104
 epoch: 35, train_loss: 0.5244, test_loss: 1.3372, test_f1: 0.6200
 epoch: 36, train_loss: 0.4903, test_loss: 1.8923, test_f1: 0.5585
 epoch: 37, train_loss: 0.5307, test_loss: 1.3972, test_f1: 0.5962
 epoch: 38, train_loss: 0.5198, test_loss: 1.4799, test_f1: 0.5701
 epoch: 39, train_loss: 0.4939, test_loss: 1.5540, test_f1: 0.5993
 epoch: 40, train_loss: 0.4712, test_loss: 1.6605, test_f1: 0.5788
 epoch: 41, train_loss: 0.4800, test_loss: 1.8881, test_f1: 0.5925
 epoch: 42, train_loss: 0.4928, test_loss: 1.2912, test_f1: 0.6087
 epoch: 43, train_loss: 0.4550, test_loss: 1.4581, test_f1: 0.5870
 epoch: 44, train_loss: 0.4388, test_loss: 1.7308, test_f1: 0.5863
 epoch: 45, train_loss: 0.4116, test_loss: 1.7235, test_f1: 0.5555
 epoch: 46, train_loss: 0.4187, test_loss: 1.9233, test_f1: 0.5602
 epoch: 47, train_loss: 0.4254, test_loss: 1.8358, test_f1: 0.6046
 epoch: 48, train_loss: 0.4173, test_loss: 1.6276, test_f1: 0.6150
 epoch: 49, train_loss: 0.4415, test_loss: 1.7775, test_f1: 0.6252
 epoch: 50, train_loss: 0.4191, test_loss: 1.6865, test_f1: 0.5927
 epoch: 51, train_loss: 0.3931, test_loss: 1.7786, test_f1: 0.5687
 epoch: 52, train_loss: 0.3298, test_loss: 1.8793, test_f1: 0.6082
 epoch: 53, train_loss: 0.3151, test_loss: 2.1065, test_f1: 0.5813
 epoch: 54, train_loss: 0.3280, test_loss: 1.8446, test_f1: 0.6545
 epoch: 55, train_loss: 0.3441, test_loss: 1.9778, test_f1: 0.5630
 epoch: 56, train_loss: 0.3039, test_loss: 1.9731, test_f1: 0.6028
 epoch: 57, train_loss: 0.2854, test_loss: 2.2454, test_f1: 0.5638
 epoch: 58, train_loss: 0.2972, test_loss: 2.2714, test_f1: 0.5882
 epoch: 59, train_loss: 0.2737, test_loss: 2.2894, test_f1: 0.5972
 epoch: 60, train_loss: 0.2632, test_loss: 2.4106, test_f1: 0.5940
 epoch: 61, train_loss: 0.2797, test_loss: 2.5556, test_f1: 0.5861
 epoch: 62, train_loss: 0.2965, test_loss: 2.2595, test_f1: 0.5688
 epoch: 63, train_loss: 0.2781, test_loss: 2.1291, test_f1: 0.5849
 epoch: 64, train_loss: 0.2589, test_loss: 2.3212, test_f1: 0.5821
 epoch: 65, train_loss: 0.2424, test_loss: 2.3450, test_f1: 0.5810
 epoch: 66, train_loss: 0.2645, test_loss: 2.1651, test_f1: 0.5992
 epoch: 67, train_loss: 0.2637, test_loss: 2.4846, test_f1: 0.5727
 epoch: 68, train_loss: 0.2492, test_loss: 2.4004, test_f1: 0.5753
 epoch: 69, train_loss: 0.2583, test_loss: 2.2908, test_f1: 0.6117
 epoch: 70, train_loss: 0.2462, test_loss: 2.5938, test_f1: 0.5543
 epoch: 71, train_loss: 0.2790, test_loss: 2.4641, test_f1: 0.6185
 epoch: 72, train_loss: 0.2612, test_loss: 2.2197, test_f1: 0.5921
 epoch: 73, train_loss: 0.2636, test_loss: 2.2673, test_f1: 0.5944
 epoch: 74, train_loss: 0.2514, test_loss: 2.2585, test_f1: 0.5849
 epoch: 75, train_loss: 0.2488, test_loss: 2.5968, test_f1: 0.5740
 epoch: 76, train_loss: 0.2331, test_loss: 2.3694, test_f1: 0.6099
 epoch: 77, train_loss: 0.2253, test_loss: 2.4414, test_f1: 0.5821
 epoch: 78, train_loss: 0.2200, test_loss: 2.8655, test_f1: 0.5891
 epoch: 79, train_loss: 0.2610, test_loss: 2.3913, test_f1: 0.6343
 epoch: 80, train_loss: 0.2147, test_loss: 2.6128, test_f1: 0.5989
 epoch: 81, train_loss: 0.2236, test_loss: 2.6512, test_f1: 0.5973
 epoch: 82, train_loss: 0.2096, test_loss: 2.6987, test_f1: 0.5798
 epoch: 83, train_loss: 0.1988, test_loss: 2.5361, test_f1: 0.5877
 epoch: 84, train_loss: 0.2101, test_loss: 2.8347, test_f1: 0.5810
 epoch: 85, train_loss: 0.1985, test_loss: 2.7577, test_f1: 0.5929
 epoch: 86, train_loss: 0.1867, test_loss: 2.9382, test_f1: 0.5888
 epoch: 87, train_loss: 0.1916, test_loss: 3.1135, test_f1: 0.5637
 epoch: 88, train_loss: 0.2121, test_loss: 2.9593, test_f1: 0.5802
 epoch: 89, train_loss: 0.2044, test_loss: 2.7264, test_f1: 0.6037
 epoch: 90, train_loss: 0.1985, test_loss: 3.0599, test_f1: 0.6010
 epoch: 91, train_loss: 0.1891, test_loss: 3.2247, test_f1: 0.5573
 epoch: 92, train_loss: 0.1850, test_loss: 3.2235, test_f1: 0.5974
 epoch: 93, train_loss: 0.1919, test_loss: 3.1404, test_f1: 0.5730
 epoch: 94, train_loss: 0.1749, test_loss: 3.2432, test_f1: 0.5889
 epoch: 95, train_loss: 0.1779, test_loss: 3.4556, test_f1: 0.5791
 epoch: 96, train_loss: 0.2253, test_loss: 3.2818, test_f1: 0.5785
 epoch: 97, train_loss: 0.1771, test_loss: 3.5129, test_f1: 0.5722
 epoch: 98, train_loss: 0.1998, test_loss: 3.0397, test_f1: 0.5945
 epoch: 99, train_loss: 0.1710, test_loss: 3.2153, test_f1: 0.5984
##################ITERATION #9 ****************************************
 epoch: 0, train_loss: 1.5084, test_loss: 1.3824, test_f1: 0.2170
 epoch: 1, train_loss: 1.1114, test_loss: 1.2425, test_f1: 0.2351
 epoch: 2, train_loss: 0.9961, test_loss: 1.1261, test_f1: 0.4524
 epoch: 3, train_loss: 0.9583, test_loss: 1.0677, test_f1: 0.5342
 epoch: 4, train_loss: 0.9335, test_loss: 1.0338, test_f1: 0.4850
 epoch: 5, train_loss: 0.8878, test_loss: 1.0582, test_f1: 0.5170
 epoch: 6, train_loss: 0.8917, test_loss: 1.0132, test_f1: 0.5666
 epoch: 7, train_loss: 0.8518, test_loss: 1.0354, test_f1: 0.5854
 epoch: 8, train_loss: 0.8344, test_loss: 1.0255, test_f1: 0.5882
 epoch: 9, train_loss: 0.8294, test_loss: 1.0754, test_f1: 0.5486
 epoch: 10, train_loss: 0.7876, test_loss: 1.0640, test_f1: 0.5686
 epoch: 11, train_loss: 0.7970, test_loss: 1.0733, test_f1: 0.5686
 epoch: 12, train_loss: 0.7977, test_loss: 1.0226, test_f1: 0.5846
 epoch: 13, train_loss: 0.7686, test_loss: 1.0159, test_f1: 0.6040
 epoch: 14, train_loss: 0.7582, test_loss: 1.1141, test_f1: 0.5060
 epoch: 15, train_loss: 0.7585, test_loss: 1.0549, test_f1: 0.5678
 epoch: 16, train_loss: 0.7327, test_loss: 1.0669, test_f1: 0.5740
 epoch: 17, train_loss: 0.7191, test_loss: 1.3341, test_f1: 0.5876
 epoch: 18, train_loss: 0.7064, test_loss: 1.1788, test_f1: 0.5868
 epoch: 19, train_loss: 0.6782, test_loss: 1.1717, test_f1: 0.5578
 epoch: 20, train_loss: 0.6519, test_loss: 1.1084, test_f1: 0.5732
 epoch: 21, train_loss: 0.6169, test_loss: 1.2430, test_f1: 0.5827
 epoch: 22, train_loss: 0.6343, test_loss: 1.1298, test_f1: 0.6135
 epoch: 23, train_loss: 0.6362, test_loss: 1.2823, test_f1: 0.5775
 epoch: 24, train_loss: 0.6206, test_loss: 1.3936, test_f1: 0.5833
 epoch: 25, train_loss: 0.5923, test_loss: 1.2745, test_f1: 0.5654
 epoch: 26, train_loss: 0.5613, test_loss: 1.3474, test_f1: 0.6011
 epoch: 27, train_loss: 0.5717, test_loss: 1.2859, test_f1: 0.6225
 epoch: 28, train_loss: 0.5610, test_loss: 1.4398, test_f1: 0.5729
 epoch: 29, train_loss: 0.5516, test_loss: 1.3803, test_f1: 0.5713
 epoch: 30, train_loss: 0.5303, test_loss: 1.3769, test_f1: 0.6129
 epoch: 31, train_loss: 0.4972, test_loss: 1.2807, test_f1: 0.6230
 epoch: 32, train_loss: 0.4990, test_loss: 1.5156, test_f1: 0.5814
 epoch: 33, train_loss: 0.5234, test_loss: 1.5848, test_f1: 0.6205
 epoch: 34, train_loss: 0.4849, test_loss: 1.5519, test_f1: 0.5417
 epoch: 35, train_loss: 0.4581, test_loss: 1.6746, test_f1: 0.6211
 epoch: 36, train_loss: 0.4741, test_loss: 1.5776, test_f1: 0.5901
 epoch: 37, train_loss: 0.4860, test_loss: 1.6422, test_f1: 0.6008
 epoch: 38, train_loss: 0.4829, test_loss: 1.6952, test_f1: 0.5990
 epoch: 39, train_loss: 0.4684, test_loss: 1.3529, test_f1: 0.6318
 epoch: 40, train_loss: 0.4393, test_loss: 1.2814, test_f1: 0.6201
 epoch: 41, train_loss: 0.4469, test_loss: 1.6382, test_f1: 0.5920
 epoch: 42, train_loss: 0.4197, test_loss: 1.3827, test_f1: 0.6184
 epoch: 43, train_loss: 0.4487, test_loss: 1.6497, test_f1: 0.6261
 epoch: 44, train_loss: 0.4393, test_loss: 1.4245, test_f1: 0.6040
 epoch: 45, train_loss: 0.4329, test_loss: 1.7056, test_f1: 0.6040
 epoch: 46, train_loss: 0.3886, test_loss: 1.6838, test_f1: 0.5611
 epoch: 47, train_loss: 0.3990, test_loss: 1.6004, test_f1: 0.6050
 epoch: 48, train_loss: 0.3928, test_loss: 1.6129, test_f1: 0.5844
 epoch: 49, train_loss: 0.4116, test_loss: 1.6850, test_f1: 0.6096
 epoch: 50, train_loss: 0.3856, test_loss: 1.4458, test_f1: 0.6140
 epoch: 51, train_loss: 0.3373, test_loss: 1.7491, test_f1: 0.6046
 epoch: 52, train_loss: 0.3136, test_loss: 1.7092, test_f1: 0.6001
 epoch: 53, train_loss: 0.2958, test_loss: 1.6299, test_f1: 0.6405
 epoch: 54, train_loss: 0.2935, test_loss: 1.8561, test_f1: 0.6164
 epoch: 55, train_loss: 0.2823, test_loss: 1.9073, test_f1: 0.6210
 epoch: 56, train_loss: 0.2697, test_loss: 2.0016, test_f1: 0.6021
 epoch: 57, train_loss: 0.2851, test_loss: 2.1377, test_f1: 0.6053
 epoch: 58, train_loss: 0.2646, test_loss: 1.9008, test_f1: 0.6149
 epoch: 59, train_loss: 0.2708, test_loss: 1.9828, test_f1: 0.5916
 epoch: 60, train_loss: 0.2730, test_loss: 1.8371, test_f1: 0.6416
 epoch: 61, train_loss: 0.2440, test_loss: 2.1402, test_f1: 0.6119
 epoch: 62, train_loss: 0.2673, test_loss: 2.1904, test_f1: 0.6159
 epoch: 63, train_loss: 0.2330, test_loss: 2.2451, test_f1: 0.6027
 epoch: 64, train_loss: 0.2430, test_loss: 2.1752, test_f1: 0.6353
 epoch: 65, train_loss: 0.2429, test_loss: 2.3585, test_f1: 0.6267
 epoch: 66, train_loss: 0.2571, test_loss: 2.1809, test_f1: 0.6103
 epoch: 67, train_loss: 0.2365, test_loss: 2.1814, test_f1: 0.6217
 epoch: 68, train_loss: 0.2077, test_loss: 2.0805, test_f1: 0.6135
 epoch: 69, train_loss: 0.2273, test_loss: 2.4120, test_f1: 0.6111
 epoch: 70, train_loss: 0.2181, test_loss: 2.4763, test_f1: 0.6082
 epoch: 71, train_loss: 0.1963, test_loss: 2.8413, test_f1: 0.5899
 epoch: 72, train_loss: 0.2039, test_loss: 2.3160, test_f1: 0.6259
 epoch: 73, train_loss: 0.2080, test_loss: 2.5223, test_f1: 0.6003
 epoch: 74, train_loss: 0.1868, test_loss: 2.8816, test_f1: 0.6039
 epoch: 75, train_loss: 0.2065, test_loss: 2.7366, test_f1: 0.5862
 epoch: 76, train_loss: 0.2077, test_loss: 2.2959, test_f1: 0.5995
 epoch: 77, train_loss: 0.2306, test_loss: 2.4392, test_f1: 0.6109
 epoch: 78, train_loss: 0.2306, test_loss: 2.4131, test_f1: 0.6223
 epoch: 79, train_loss: 0.2006, test_loss: 2.5809, test_f1: 0.6083
 epoch: 80, train_loss: 0.1925, test_loss: 2.5025, test_f1: 0.6022
 epoch: 81, train_loss: 0.2161, test_loss: 2.2940, test_f1: 0.6142
 epoch: 82, train_loss: 0.1843, test_loss: 2.4430, test_f1: 0.6230
 epoch: 83, train_loss: 0.1810, test_loss: 2.6781, test_f1: 0.5824
 epoch: 84, train_loss: 0.1958, test_loss: 2.5532, test_f1: 0.6005
 epoch: 85, train_loss: 0.1854, test_loss: 2.5633, test_f1: 0.5857
 epoch: 86, train_loss: 0.1893, test_loss: 2.5648, test_f1: 0.6015
 epoch: 87, train_loss: 0.1797, test_loss: 2.8835, test_f1: 0.5846
 epoch: 88, train_loss: 0.1953, test_loss: 2.3435, test_f1: 0.5996
 epoch: 89, train_loss: 0.2103, test_loss: 2.6537, test_f1: 0.5985
 epoch: 90, train_loss: 0.1934, test_loss: 2.4096, test_f1: 0.5963
 epoch: 91, train_loss: 0.1588, test_loss: 2.4650, test_f1: 0.6029
 epoch: 92, train_loss: 0.1786, test_loss: 2.4745, test_f1: 0.5994
 epoch: 93, train_loss: 0.2008, test_loss: 2.6930, test_f1: 0.5935
 epoch: 94, train_loss: 0.1720, test_loss: 2.4548, test_f1: 0.6170
 epoch: 95, train_loss: 0.1728, test_loss: 2.5039, test_f1: 0.6244
 epoch: 96, train_loss: 0.1691, test_loss: 2.7980, test_f1: 0.5988
 epoch: 97, train_loss: 0.1593, test_loss: 2.4144, test_f1: 0.5951
 epoch: 98, train_loss: 0.1420, test_loss: 2.7463, test_f1: 0.5989
 epoch: 99, train_loss: 0.1634, test_loss: 3.0061, test_f1: 0.5861

Training completed in 461.26 seconds
Best F1: 0.6666 at epoch 20
Mean F1 across iterations: 0.6412  0.0142
========================FINAL RESULTS================================
FEGIN weighted F1: 0.6666  0.0142
python main.py --data ltspice_demos --representation component_net --model FEGIN --layers 4 --hiddens 128 --batch_size 64 --lr 0.001 --emb_size 128 --epochs 100 --save_appendix component_net_L4_H128_BS64_LR0.001_E128 --no_val
-----



STDERR:
Processing...
Done!
  File "main.py", line 370, in <module>
    main()
  File "main.py", line 254, in main
    dataset = dataset_class(
  File "/home/philip/projects/ltspice_examples_code_repo/Circuit-Completion-Using-GNNs/component_classification_with_link_prediction_head/evaluation/FEGIN/kernel/circuit_datasets.py", line 15, in __init__
    self.data, self.slices = torch.load(self.processed_paths[0])
  File "/home/philip/.local/lib/python3.8/site-packages/torch/serialization.py", line 1040, in load
    warnings.warn(
  File "/usr/lib/python3.8/warnings.py", line 109, in _showwarnmsg
    sw(msg.message, msg.category, msg.filename, msg.lineno,
  File "main.py", line 47, in warn_with_traceback
    traceback.print_stack(file=log)
/home/philip/projects/ltspice_examples_code_repo/Circuit-Completion-Using-GNNs/component_classification_with_link_prediction_head/evaluation/FEGIN/kernel/circuit_datasets.py:15: FutureWarning: You are using `torch.load` with `weights_only=False` (the current default value), which uses the default pickle module implicitly. It is possible to construct malicious pickle data which will execute arbitrary code during unpickling (See https://github.com/pytorch/pytorch/blob/main/SECURITY.md#untrusted-models for more details). In a future release, the default value for `weights_only` will be flipped to `True`. This limits the functions that could be executed during unpickling. Arbitrary objects will no longer be allowed to be loaded via this mode unless they are explicitly allowlisted by the user via `torch.serialization.add_safe_globals`. We recommend you start setting `weights_only=True` for any use case where you don't have full control of the loaded file. Please open an issue on GitHub for any issues related to this experimental feature.
  self.data, self.slices = torch.load(self.processed_paths[0])
