STDOUT:
Results will be saved in /home/philip/projects/ltspice_examples_code_repo/Circuit-Completion-Using-GNNs/component_classification_with_link_prediction_head/evaluation/FEGIN/results/model_FEGIN_dataset_ltspice_examples
Command line input: python main.py --data ltspice_examples --representation component_net --model FEGIN --layers 4 --hiddens 32 --batch_size 32 --lr 0.01 --emb_size 128 --epochs 100 --save_appendix component_net_L4_H32_BS32_LR0.01_E128 --no_val
 is saved.
-----
ltspice_examples - FEGIN
Using 4 layers, 32 hidden units, h = 2
Loading component_net representation dataset
ENTERED
Training FEGIN on component_net representation
Train: 3558, Test: 846
##################ITERATION #0 ****************************************
 epoch: 0, train_loss: 1.1895, test_loss: 1.0787, test_f1: 0.3534
 epoch: 1, train_loss: 1.0515, test_loss: 1.0778, test_f1: 0.4855
 epoch: 2, train_loss: 1.0067, test_loss: 1.0717, test_f1: 0.4426
 epoch: 3, train_loss: 0.9950, test_loss: 0.9815, test_f1: 0.5225
 epoch: 4, train_loss: 0.9913, test_loss: 0.9616, test_f1: 0.4749
 epoch: 5, train_loss: 0.9774, test_loss: 0.9437, test_f1: 0.4693
 epoch: 6, train_loss: 0.9705, test_loss: 0.9258, test_f1: 0.5177
 epoch: 7, train_loss: 0.9559, test_loss: 0.9500, test_f1: 0.4787
 epoch: 8, train_loss: 0.9588, test_loss: 0.8981, test_f1: 0.5372
 epoch: 9, train_loss: 0.9419, test_loss: 0.9545, test_f1: 0.4568
 epoch: 10, train_loss: 0.9509, test_loss: 0.9279, test_f1: 0.4922
 epoch: 11, train_loss: 0.9279, test_loss: 1.0347, test_f1: 0.4870
 epoch: 12, train_loss: 0.9310, test_loss: 0.9828, test_f1: 0.4929
 epoch: 13, train_loss: 0.9468, test_loss: 0.9187, test_f1: 0.4885
 epoch: 14, train_loss: 0.9373, test_loss: 1.0394, test_f1: 0.4742
 epoch: 15, train_loss: 0.9420, test_loss: 0.8753, test_f1: 0.5102
 epoch: 16, train_loss: 0.9158, test_loss: 0.9511, test_f1: 0.4743
 epoch: 17, train_loss: 0.9291, test_loss: 0.9833, test_f1: 0.5047
 epoch: 18, train_loss: 0.9231, test_loss: 1.0297, test_f1: 0.4859
 epoch: 19, train_loss: 0.9156, test_loss: 0.9916, test_f1: 0.5084
 epoch: 20, train_loss: 0.9250, test_loss: 0.9475, test_f1: 0.4889
 epoch: 21, train_loss: 0.9015, test_loss: 0.9734, test_f1: 0.4881
 epoch: 22, train_loss: 0.9048, test_loss: 0.9656, test_f1: 0.4990
 epoch: 23, train_loss: 0.8909, test_loss: 0.9933, test_f1: 0.4910
 epoch: 24, train_loss: 0.8940, test_loss: 0.9353, test_f1: 0.4562
 epoch: 25, train_loss: 0.9131, test_loss: 1.0637, test_f1: 0.5279
 epoch: 26, train_loss: 0.8891, test_loss: 1.0069, test_f1: 0.5046
 epoch: 27, train_loss: 0.8926, test_loss: 1.0651, test_f1: 0.4826
 epoch: 28, train_loss: 0.8912, test_loss: 0.9873, test_f1: 0.5098
 epoch: 29, train_loss: 0.8832, test_loss: 1.0042, test_f1: 0.4988
 epoch: 30, train_loss: 0.8912, test_loss: 0.9734, test_f1: 0.5014
 epoch: 31, train_loss: 0.8753, test_loss: 1.0732, test_f1: 0.4953
 epoch: 32, train_loss: 0.8533, test_loss: 1.0414, test_f1: 0.5065
 epoch: 33, train_loss: 0.8620, test_loss: 1.0148, test_f1: 0.5109
 epoch: 34, train_loss: 0.8768, test_loss: 1.0134, test_f1: 0.5470
 epoch: 35, train_loss: 0.8717, test_loss: 1.0432, test_f1: 0.5713
 epoch: 36, train_loss: 0.8665, test_loss: 1.1150, test_f1: 0.5000
 epoch: 37, train_loss: 0.8463, test_loss: 1.0523, test_f1: 0.5015
 epoch: 38, train_loss: 0.8480, test_loss: 1.1207, test_f1: 0.5635
 epoch: 39, train_loss: 0.8528, test_loss: 1.1087, test_f1: 0.5210
 epoch: 40, train_loss: 0.8590, test_loss: 1.0397, test_f1: 0.5200
 epoch: 41, train_loss: 0.8415, test_loss: 1.0359, test_f1: 0.5134
 epoch: 42, train_loss: 0.8758, test_loss: 1.0534, test_f1: 0.5128
 epoch: 43, train_loss: 0.8717, test_loss: 1.0022, test_f1: 0.5111
 epoch: 44, train_loss: 0.8515, test_loss: 1.0150, test_f1: 0.4870
 epoch: 45, train_loss: 0.8587, test_loss: 0.9363, test_f1: 0.5864
 epoch: 46, train_loss: 0.8457, test_loss: 1.1139, test_f1: 0.5088
 epoch: 47, train_loss: 0.8491, test_loss: 1.0426, test_f1: 0.5153
 epoch: 48, train_loss: 0.8475, test_loss: 1.0674, test_f1: 0.5260
 epoch: 49, train_loss: 0.8311, test_loss: 1.0469, test_f1: 0.4976
 epoch: 50, train_loss: 0.8146, test_loss: 1.0151, test_f1: 0.5094
 epoch: 51, train_loss: 0.7885, test_loss: 1.0361, test_f1: 0.5472
 epoch: 52, train_loss: 0.7933, test_loss: 1.1020, test_f1: 0.5310
 epoch: 53, train_loss: 0.7954, test_loss: 1.1329, test_f1: 0.5096
 epoch: 54, train_loss: 0.7727, test_loss: 1.0474, test_f1: 0.5651
 epoch: 55, train_loss: 0.7815, test_loss: 1.0274, test_f1: 0.6041
 epoch: 56, train_loss: 0.7770, test_loss: 1.0698, test_f1: 0.5912
 epoch: 57, train_loss: 0.7761, test_loss: 1.0937, test_f1: 0.5949
 epoch: 58, train_loss: 0.7760, test_loss: 0.9894, test_f1: 0.5685
 epoch: 59, train_loss: 0.7757, test_loss: 1.0918, test_f1: 0.5390
 epoch: 60, train_loss: 0.7647, test_loss: 1.0478, test_f1: 0.5912
 epoch: 61, train_loss: 0.7617, test_loss: 1.1830, test_f1: 0.5642
 epoch: 62, train_loss: 0.7590, test_loss: 1.0892, test_f1: 0.6034
 epoch: 63, train_loss: 0.7582, test_loss: 0.9952, test_f1: 0.5636
 epoch: 64, train_loss: 0.7628, test_loss: 1.1179, test_f1: 0.5989
 epoch: 65, train_loss: 0.7593, test_loss: 1.0770, test_f1: 0.5863
 epoch: 66, train_loss: 0.7464, test_loss: 1.2322, test_f1: 0.5584
 epoch: 67, train_loss: 0.7523, test_loss: 1.1500, test_f1: 0.5900
 epoch: 68, train_loss: 0.7550, test_loss: 1.1156, test_f1: 0.5835
 epoch: 69, train_loss: 0.7458, test_loss: 1.1066, test_f1: 0.5854
 epoch: 70, train_loss: 0.7429, test_loss: 1.0785, test_f1: 0.5985
 epoch: 71, train_loss: 0.7279, test_loss: 1.2978, test_f1: 0.5835
 epoch: 72, train_loss: 0.7524, test_loss: 1.1794, test_f1: 0.5459
 epoch: 73, train_loss: 0.7458, test_loss: 1.1389, test_f1: 0.5693
 epoch: 74, train_loss: 0.7310, test_loss: 1.2378, test_f1: 0.5454
 epoch: 75, train_loss: 0.7490, test_loss: 1.2860, test_f1: 0.5478
 epoch: 76, train_loss: 0.7379, test_loss: 1.2206, test_f1: 0.6087
 epoch: 77, train_loss: 0.7546, test_loss: 1.1935, test_f1: 0.5759
 epoch: 78, train_loss: 0.7335, test_loss: 1.1730, test_f1: 0.6090
 epoch: 79, train_loss: 0.7295, test_loss: 1.2385, test_f1: 0.6222
 epoch: 80, train_loss: 0.7312, test_loss: 1.2115, test_f1: 0.6074
 epoch: 81, train_loss: 0.7177, test_loss: 1.2204, test_f1: 0.6317
 epoch: 82, train_loss: 0.7275, test_loss: 1.1653, test_f1: 0.5999
 epoch: 83, train_loss: 0.7222, test_loss: 1.2289, test_f1: 0.6166
 epoch: 84, train_loss: 0.7284, test_loss: 1.0343, test_f1: 0.6156
 epoch: 85, train_loss: 0.7192, test_loss: 1.1494, test_f1: 0.5637
 epoch: 86, train_loss: 0.7186, test_loss: 1.1770, test_f1: 0.5624
 epoch: 87, train_loss: 0.7271, test_loss: 1.2274, test_f1: 0.5951
 epoch: 88, train_loss: 0.7260, test_loss: 1.2014, test_f1: 0.5738
 epoch: 89, train_loss: 0.7284, test_loss: 1.1510, test_f1: 0.5570
 epoch: 90, train_loss: 0.7049, test_loss: 1.0919, test_f1: 0.5988
 epoch: 91, train_loss: 0.7067, test_loss: 1.2367, test_f1: 0.5847
 epoch: 92, train_loss: 0.7110, test_loss: 1.1298, test_f1: 0.6184
 epoch: 93, train_loss: 0.7156, test_loss: 1.2280, test_f1: 0.5462
 epoch: 94, train_loss: 0.7035, test_loss: 1.2847, test_f1: 0.5835
 epoch: 95, train_loss: 0.7084, test_loss: 1.0329, test_f1: 0.5612
 epoch: 96, train_loss: 0.7031, test_loss: 1.1590, test_f1: 0.6142
 epoch: 97, train_loss: 0.7097, test_loss: 1.1514, test_f1: 0.5784
 epoch: 98, train_loss: 0.7225, test_loss: 1.1441, test_f1: 0.5973
 epoch: 99, train_loss: 0.7171, test_loss: 1.1546, test_f1: 0.6061
##################ITERATION #1 ****************************************
 epoch: 0, train_loss: 1.1680, test_loss: 1.1663, test_f1: 0.4536
 epoch: 1, train_loss: 1.0328, test_loss: 1.0219, test_f1: 0.4458
 epoch: 2, train_loss: 1.0237, test_loss: 1.0280, test_f1: 0.4505
 epoch: 3, train_loss: 0.9913, test_loss: 1.0095, test_f1: 0.5243
 epoch: 4, train_loss: 0.9941, test_loss: 1.0415, test_f1: 0.4443
 epoch: 5, train_loss: 0.9858, test_loss: 1.0387, test_f1: 0.4414
 epoch: 6, train_loss: 0.9772, test_loss: 0.9873, test_f1: 0.5180
 epoch: 7, train_loss: 0.9770, test_loss: 0.9855, test_f1: 0.4824
 epoch: 8, train_loss: 0.9608, test_loss: 1.0166, test_f1: 0.4575
 epoch: 9, train_loss: 0.9499, test_loss: 0.9594, test_f1: 0.4997
 epoch: 10, train_loss: 0.9544, test_loss: 0.9751, test_f1: 0.5068
 epoch: 11, train_loss: 0.9514, test_loss: 0.9498, test_f1: 0.4897
 epoch: 12, train_loss: 0.9459, test_loss: 0.9087, test_f1: 0.5144
 epoch: 13, train_loss: 0.9399, test_loss: 0.9798, test_f1: 0.5105
 epoch: 14, train_loss: 0.9285, test_loss: 1.0339, test_f1: 0.4968
 epoch: 15, train_loss: 0.9295, test_loss: 0.9656, test_f1: 0.5171
 epoch: 16, train_loss: 0.9360, test_loss: 0.9603, test_f1: 0.5442
 epoch: 17, train_loss: 0.9259, test_loss: 0.9437, test_f1: 0.5740
 epoch: 18, train_loss: 0.9078, test_loss: 0.9623, test_f1: 0.5090
 epoch: 19, train_loss: 0.9131, test_loss: 0.9080, test_f1: 0.4823
 epoch: 20, train_loss: 0.9166, test_loss: 0.9216, test_f1: 0.5180
 epoch: 21, train_loss: 0.9342, test_loss: 0.9749, test_f1: 0.5093
 epoch: 22, train_loss: 0.9370, test_loss: 0.9486, test_f1: 0.4910
 epoch: 23, train_loss: 0.9195, test_loss: 0.8565, test_f1: 0.5632
 epoch: 24, train_loss: 0.9059, test_loss: 0.9192, test_f1: 0.5337
 epoch: 25, train_loss: 0.8920, test_loss: 0.9356, test_f1: 0.5034
 epoch: 26, train_loss: 0.9159, test_loss: 0.9936, test_f1: 0.5100
 epoch: 27, train_loss: 0.8917, test_loss: 0.9468, test_f1: 0.5705
 epoch: 28, train_loss: 0.8854, test_loss: 0.9240, test_f1: 0.5526
 epoch: 29, train_loss: 0.8882, test_loss: 0.8762, test_f1: 0.5331
 epoch: 30, train_loss: 0.8701, test_loss: 0.9317, test_f1: 0.5725
 epoch: 31, train_loss: 0.8640, test_loss: 0.9393, test_f1: 0.5182
 epoch: 32, train_loss: 0.8700, test_loss: 0.8820, test_f1: 0.5080
 epoch: 33, train_loss: 0.8657, test_loss: 0.9001, test_f1: 0.5639
 epoch: 34, train_loss: 0.8609, test_loss: 0.9049, test_f1: 0.5261
 epoch: 35, train_loss: 0.8499, test_loss: 0.8720, test_f1: 0.5606
 epoch: 36, train_loss: 0.8642, test_loss: 0.9142, test_f1: 0.5722
 epoch: 37, train_loss: 0.8957, test_loss: 0.9611, test_f1: 0.5181
 epoch: 38, train_loss: 0.8686, test_loss: 0.9222, test_f1: 0.5829
 epoch: 39, train_loss: 0.8529, test_loss: 0.8587, test_f1: 0.5925
 epoch: 40, train_loss: 0.8435, test_loss: 0.9019, test_f1: 0.5330
 epoch: 41, train_loss: 0.8348, test_loss: 0.9125, test_f1: 0.5714
 epoch: 42, train_loss: 0.8481, test_loss: 0.8826, test_f1: 0.5402
 epoch: 43, train_loss: 0.8316, test_loss: 0.9002, test_f1: 0.5386
 epoch: 44, train_loss: 0.8210, test_loss: 0.8919, test_f1: 0.5892
 epoch: 45, train_loss: 0.8264, test_loss: 0.9111, test_f1: 0.5568
 epoch: 46, train_loss: 0.8104, test_loss: 0.9029, test_f1: 0.5793
 epoch: 47, train_loss: 0.8276, test_loss: 0.8880, test_f1: 0.5387
 epoch: 48, train_loss: 0.8282, test_loss: 0.8885, test_f1: 0.6037
 epoch: 49, train_loss: 0.8270, test_loss: 0.8803, test_f1: 0.6120
 epoch: 50, train_loss: 0.8196, test_loss: 0.8431, test_f1: 0.5841
 epoch: 51, train_loss: 0.7863, test_loss: 0.8659, test_f1: 0.6201
 epoch: 52, train_loss: 0.7855, test_loss: 0.8942, test_f1: 0.6117
 epoch: 53, train_loss: 0.7726, test_loss: 0.8636, test_f1: 0.6057
 epoch: 54, train_loss: 0.7824, test_loss: 0.8730, test_f1: 0.6199
 epoch: 55, train_loss: 0.7786, test_loss: 0.8459, test_f1: 0.6004
 epoch: 56, train_loss: 0.7685, test_loss: 0.8674, test_f1: 0.6148
 epoch: 57, train_loss: 0.7726, test_loss: 0.9120, test_f1: 0.6047
 epoch: 58, train_loss: 0.7485, test_loss: 0.8719, test_f1: 0.6062
 epoch: 59, train_loss: 0.7681, test_loss: 0.8430, test_f1: 0.5952
 epoch: 60, train_loss: 0.7452, test_loss: 0.8254, test_f1: 0.6210
 epoch: 61, train_loss: 0.7617, test_loss: 0.8530, test_f1: 0.6266
 epoch: 62, train_loss: 0.7541, test_loss: 0.8933, test_f1: 0.6074
 epoch: 63, train_loss: 0.7624, test_loss: 0.8785, test_f1: 0.6236
 epoch: 64, train_loss: 0.7466, test_loss: 0.8792, test_f1: 0.6185
 epoch: 65, train_loss: 0.7585, test_loss: 0.8990, test_f1: 0.6133
 epoch: 66, train_loss: 0.7485, test_loss: 0.8844, test_f1: 0.6185
 epoch: 67, train_loss: 0.7459, test_loss: 0.8800, test_f1: 0.5733
 epoch: 68, train_loss: 0.7442, test_loss: 0.8587, test_f1: 0.6362
 epoch: 69, train_loss: 0.7452, test_loss: 0.8672, test_f1: 0.6353
 epoch: 70, train_loss: 0.7433, test_loss: 0.9113, test_f1: 0.6082
 epoch: 71, train_loss: 0.7673, test_loss: 0.8953, test_f1: 0.6524
 epoch: 72, train_loss: 0.7367, test_loss: 0.8916, test_f1: 0.6088
 epoch: 73, train_loss: 0.7325, test_loss: 0.8801, test_f1: 0.6422
 epoch: 74, train_loss: 0.7385, test_loss: 0.8818, test_f1: 0.6290
 epoch: 75, train_loss: 0.7302, test_loss: 0.8819, test_f1: 0.6405
 epoch: 76, train_loss: 0.7342, test_loss: 0.8877, test_f1: 0.6138
 epoch: 77, train_loss: 0.7389, test_loss: 0.9071, test_f1: 0.6230
 epoch: 78, train_loss: 0.7323, test_loss: 0.9604, test_f1: 0.6220
 epoch: 79, train_loss: 0.7396, test_loss: 0.9172, test_f1: 0.6442
 epoch: 80, train_loss: 0.7373, test_loss: 0.9177, test_f1: 0.6302
 epoch: 81, train_loss: 0.7272, test_loss: 0.9159, test_f1: 0.6450
 epoch: 82, train_loss: 0.7301, test_loss: 0.8803, test_f1: 0.6367
 epoch: 83, train_loss: 0.7394, test_loss: 0.8833, test_f1: 0.6052
 epoch: 84, train_loss: 0.7281, test_loss: 0.8976, test_f1: 0.6163
 epoch: 85, train_loss: 0.7229, test_loss: 0.8976, test_f1: 0.6050
 epoch: 86, train_loss: 0.7363, test_loss: 0.8614, test_f1: 0.6357
 epoch: 87, train_loss: 0.7155, test_loss: 0.8673, test_f1: 0.6472
 epoch: 88, train_loss: 0.7271, test_loss: 0.8587, test_f1: 0.6349
 epoch: 89, train_loss: 0.7209, test_loss: 0.8889, test_f1: 0.6409
 epoch: 90, train_loss: 0.7315, test_loss: 0.9062, test_f1: 0.6533
 epoch: 91, train_loss: 0.7137, test_loss: 0.8710, test_f1: 0.6538
 epoch: 92, train_loss: 0.7147, test_loss: 0.8885, test_f1: 0.6482
 epoch: 93, train_loss: 0.7125, test_loss: 0.9065, test_f1: 0.6538
 epoch: 94, train_loss: 0.7264, test_loss: 0.8648, test_f1: 0.6470
 epoch: 95, train_loss: 0.7050, test_loss: 0.8610, test_f1: 0.6520
 epoch: 96, train_loss: 0.7078, test_loss: 0.8920, test_f1: 0.6137
 epoch: 97, train_loss: 0.7764, test_loss: 0.8416, test_f1: 0.6464
 epoch: 98, train_loss: 0.7562, test_loss: 0.8999, test_f1: 0.6336
 epoch: 99, train_loss: 0.7392, test_loss: 0.8139, test_f1: 0.6257
##################ITERATION #2 ****************************************
 epoch: 0, train_loss: 1.1628, test_loss: 1.0659, test_f1: 0.3775
 epoch: 1, train_loss: 1.0520, test_loss: 0.9965, test_f1: 0.4751
 epoch: 2, train_loss: 1.0210, test_loss: 1.0674, test_f1: 0.4573
 epoch: 3, train_loss: 0.9951, test_loss: 0.9803, test_f1: 0.4892
 epoch: 4, train_loss: 0.9889, test_loss: 1.0293, test_f1: 0.5307
 epoch: 5, train_loss: 0.9848, test_loss: 0.9444, test_f1: 0.5001
 epoch: 6, train_loss: 0.9862, test_loss: 0.9862, test_f1: 0.5107
 epoch: 7, train_loss: 0.9646, test_loss: 0.9668, test_f1: 0.4720
 epoch: 8, train_loss: 0.9620, test_loss: 0.9651, test_f1: 0.4539
 epoch: 9, train_loss: 0.9602, test_loss: 1.0407, test_f1: 0.5007
 epoch: 10, train_loss: 0.9786, test_loss: 0.9882, test_f1: 0.4717
 epoch: 11, train_loss: 0.9635, test_loss: 0.9834, test_f1: 0.5203
 epoch: 12, train_loss: 0.9419, test_loss: 0.9591, test_f1: 0.4836
 epoch: 13, train_loss: 0.9620, test_loss: 0.9617, test_f1: 0.4814
 epoch: 14, train_loss: 0.9407, test_loss: 1.0437, test_f1: 0.4900
 epoch: 15, train_loss: 0.9512, test_loss: 0.9042, test_f1: 0.5133
 epoch: 16, train_loss: 0.9281, test_loss: 0.8985, test_f1: 0.4913
 epoch: 17, train_loss: 0.9306, test_loss: 0.9559, test_f1: 0.4912
 epoch: 18, train_loss: 0.9259, test_loss: 0.8925, test_f1: 0.5043
 epoch: 19, train_loss: 0.9208, test_loss: 0.9189, test_f1: 0.4877
 epoch: 20, train_loss: 0.9157, test_loss: 1.0019, test_f1: 0.4913
 epoch: 21, train_loss: 0.9070, test_loss: 0.9635, test_f1: 0.4626
 epoch: 22, train_loss: 0.9150, test_loss: 0.9433, test_f1: 0.4796
 epoch: 23, train_loss: 0.9075, test_loss: 0.9112, test_f1: 0.5319
 epoch: 24, train_loss: 0.9030, test_loss: 1.0421, test_f1: 0.5094
 epoch: 25, train_loss: 0.9036, test_loss: 0.9851, test_f1: 0.4881
 epoch: 26, train_loss: 0.8902, test_loss: 0.9026, test_f1: 0.5652
 epoch: 27, train_loss: 0.9011, test_loss: 1.0487, test_f1: 0.5297
 epoch: 28, train_loss: 0.9296, test_loss: 1.0392, test_f1: 0.5015
 epoch: 29, train_loss: 0.9158, test_loss: 1.0172, test_f1: 0.5238
 epoch: 30, train_loss: 0.9036, test_loss: 1.0248, test_f1: 0.5301
 epoch: 31, train_loss: 0.8974, test_loss: 0.9703, test_f1: 0.4967
 epoch: 32, train_loss: 0.8921, test_loss: 1.0042, test_f1: 0.4827
 epoch: 33, train_loss: 0.8829, test_loss: 0.9368, test_f1: 0.5133
 epoch: 34, train_loss: 0.8786, test_loss: 0.9716, test_f1: 0.4921
 epoch: 35, train_loss: 0.8753, test_loss: 0.9852, test_f1: 0.5524
 epoch: 36, train_loss: 0.8738, test_loss: 0.9601, test_f1: 0.4896
 epoch: 37, train_loss: 0.8789, test_loss: 1.0303, test_f1: 0.4690
 epoch: 38, train_loss: 0.8743, test_loss: 1.0652, test_f1: 0.5013
 epoch: 39, train_loss: 0.8685, test_loss: 0.9774, test_f1: 0.5262
 epoch: 40, train_loss: 0.8795, test_loss: 0.9759, test_f1: 0.4837
 epoch: 41, train_loss: 0.8619, test_loss: 0.9731, test_f1: 0.5068
 epoch: 42, train_loss: 0.8832, test_loss: 0.9902, test_f1: 0.5111
 epoch: 43, train_loss: 0.8568, test_loss: 0.9698, test_f1: 0.5178
 epoch: 44, train_loss: 0.8788, test_loss: 0.9725, test_f1: 0.5454
 epoch: 45, train_loss: 0.8420, test_loss: 1.0873, test_f1: 0.5011
 epoch: 46, train_loss: 0.8667, test_loss: 0.9334, test_f1: 0.4994
 epoch: 47, train_loss: 0.8392, test_loss: 0.9748, test_f1: 0.5663
 epoch: 48, train_loss: 0.8506, test_loss: 0.9410, test_f1: 0.5969
 epoch: 49, train_loss: 0.8492, test_loss: 0.9059, test_f1: 0.5640
 epoch: 50, train_loss: 0.8582, test_loss: 0.9506, test_f1: 0.4970
 epoch: 51, train_loss: 0.8300, test_loss: 0.9397, test_f1: 0.5191
 epoch: 52, train_loss: 0.8172, test_loss: 0.9863, test_f1: 0.5543
 epoch: 53, train_loss: 0.8086, test_loss: 0.9889, test_f1: 0.5530
 epoch: 54, train_loss: 0.8064, test_loss: 1.0165, test_f1: 0.5161
 epoch: 55, train_loss: 0.8018, test_loss: 1.0117, test_f1: 0.5383
 epoch: 56, train_loss: 0.8079, test_loss: 0.9763, test_f1: 0.6129
 epoch: 57, train_loss: 0.7963, test_loss: 1.0297, test_f1: 0.5164
 epoch: 58, train_loss: 0.7977, test_loss: 0.9953, test_f1: 0.5422
 epoch: 59, train_loss: 0.7929, test_loss: 1.0298, test_f1: 0.5671
 epoch: 60, train_loss: 0.7936, test_loss: 1.0188, test_f1: 0.5101
 epoch: 61, train_loss: 0.8017, test_loss: 1.0284, test_f1: 0.5916
 epoch: 62, train_loss: 0.8007, test_loss: 0.9995, test_f1: 0.5401
 epoch: 63, train_loss: 0.7950, test_loss: 0.9914, test_f1: 0.5603
 epoch: 64, train_loss: 0.7719, test_loss: 1.0341, test_f1: 0.5252
 epoch: 65, train_loss: 0.7952, test_loss: 1.0305, test_f1: 0.5769
 epoch: 66, train_loss: 0.7845, test_loss: 0.9850, test_f1: 0.5730
 epoch: 67, train_loss: 0.7747, test_loss: 1.0517, test_f1: 0.5332
 epoch: 68, train_loss: 0.7720, test_loss: 1.0259, test_f1: 0.5965
 epoch: 69, train_loss: 0.7729, test_loss: 1.0051, test_f1: 0.5860
 epoch: 70, train_loss: 0.7798, test_loss: 0.9977, test_f1: 0.5918
 epoch: 71, train_loss: 0.7645, test_loss: 1.0658, test_f1: 0.6016
 epoch: 72, train_loss: 0.7779, test_loss: 1.0968, test_f1: 0.5329
 epoch: 73, train_loss: 0.7580, test_loss: 1.0085, test_f1: 0.5757
 epoch: 74, train_loss: 0.7586, test_loss: 1.0390, test_f1: 0.5910
 epoch: 75, train_loss: 0.8141, test_loss: 1.0779, test_f1: 0.5177
 epoch: 76, train_loss: 0.7623, test_loss: 1.0567, test_f1: 0.6202
 epoch: 77, train_loss: 0.7620, test_loss: 0.9861, test_f1: 0.6088
 epoch: 78, train_loss: 0.7597, test_loss: 1.0184, test_f1: 0.6202
 epoch: 79, train_loss: 0.7699, test_loss: 1.0424, test_f1: 0.6236
 epoch: 80, train_loss: 0.7429, test_loss: 0.9155, test_f1: 0.5779
 epoch: 81, train_loss: 0.7469, test_loss: 1.0781, test_f1: 0.5983
 epoch: 82, train_loss: 0.7508, test_loss: 0.9874, test_f1: 0.6183
 epoch: 83, train_loss: 0.7478, test_loss: 1.0359, test_f1: 0.6075
 epoch: 84, train_loss: 0.7586, test_loss: 0.9915, test_f1: 0.6101
 epoch: 85, train_loss: 0.7378, test_loss: 1.0348, test_f1: 0.6149
 epoch: 86, train_loss: 0.7368, test_loss: 1.0437, test_f1: 0.6368
 epoch: 87, train_loss: 0.7320, test_loss: 1.0084, test_f1: 0.6053
 epoch: 88, train_loss: 0.7519, test_loss: 0.9456, test_f1: 0.6202
 epoch: 89, train_loss: 0.7564, test_loss: 1.0430, test_f1: 0.5523
 epoch: 90, train_loss: 0.7440, test_loss: 0.9891, test_f1: 0.6513
 epoch: 91, train_loss: 0.7288, test_loss: 1.1047, test_f1: 0.6338
 epoch: 92, train_loss: 0.7342, test_loss: 1.0348, test_f1: 0.6057
 epoch: 93, train_loss: 0.7418, test_loss: 1.0797, test_f1: 0.5892
 epoch: 94, train_loss: 0.7271, test_loss: 1.0871, test_f1: 0.5809
 epoch: 95, train_loss: 0.7272, test_loss: 1.0200, test_f1: 0.6245
 epoch: 96, train_loss: 0.7208, test_loss: 1.0512, test_f1: 0.6197
 epoch: 97, train_loss: 0.7270, test_loss: 1.0657, test_f1: 0.6218
 epoch: 98, train_loss: 0.7272, test_loss: 1.0711, test_f1: 0.6299
 epoch: 99, train_loss: 0.7272, test_loss: 1.0220, test_f1: 0.6309
##################ITERATION #3 ****************************************
 epoch: 0, train_loss: 1.1367, test_loss: 1.1074, test_f1: 0.4036
 epoch: 1, train_loss: 1.0428, test_loss: 1.0577, test_f1: 0.4521
 epoch: 2, train_loss: 1.0157, test_loss: 1.0226, test_f1: 0.4581
 epoch: 3, train_loss: 1.0001, test_loss: 1.0626, test_f1: 0.4512
 epoch: 4, train_loss: 1.0013, test_loss: 1.2989, test_f1: 0.3916
 epoch: 5, train_loss: 0.9993, test_loss: 1.0659, test_f1: 0.4348
 epoch: 6, train_loss: 0.9922, test_loss: 0.9706, test_f1: 0.4522
 epoch: 7, train_loss: 0.9669, test_loss: 1.0224, test_f1: 0.4398
 epoch: 8, train_loss: 0.9556, test_loss: 1.0123, test_f1: 0.4870
 epoch: 9, train_loss: 0.9585, test_loss: 1.0256, test_f1: 0.4880
 epoch: 10, train_loss: 0.9547, test_loss: 0.9786, test_f1: 0.5138
 epoch: 11, train_loss: 0.9464, test_loss: 1.0491, test_f1: 0.4655
 epoch: 12, train_loss: 0.9393, test_loss: 1.0189, test_f1: 0.4772
 epoch: 13, train_loss: 0.9514, test_loss: 1.0276, test_f1: 0.4845
 epoch: 14, train_loss: 0.9294, test_loss: 0.9876, test_f1: 0.4778
 epoch: 15, train_loss: 0.9322, test_loss: 0.9304, test_f1: 0.4892
 epoch: 16, train_loss: 0.9406, test_loss: 1.0207, test_f1: 0.4866
 epoch: 17, train_loss: 0.9292, test_loss: 0.9383, test_f1: 0.5119
 epoch: 18, train_loss: 0.9125, test_loss: 1.0256, test_f1: 0.4476
 epoch: 19, train_loss: 0.9196, test_loss: 0.9072, test_f1: 0.4920
 epoch: 20, train_loss: 0.9287, test_loss: 1.0044, test_f1: 0.4856
 epoch: 21, train_loss: 0.9078, test_loss: 0.9469, test_f1: 0.5349
 epoch: 22, train_loss: 0.9150, test_loss: 1.0412, test_f1: 0.5161
 epoch: 23, train_loss: 0.8953, test_loss: 0.9910, test_f1: 0.5297
 epoch: 24, train_loss: 0.8964, test_loss: 1.0810, test_f1: 0.5069
 epoch: 25, train_loss: 0.8930, test_loss: 1.0320, test_f1: 0.4921
 epoch: 26, train_loss: 0.8817, test_loss: 0.9178, test_f1: 0.5727
 epoch: 27, train_loss: 0.8831, test_loss: 0.9650, test_f1: 0.5170
 epoch: 28, train_loss: 0.8852, test_loss: 1.0158, test_f1: 0.5465
 epoch: 29, train_loss: 0.8913, test_loss: 0.9399, test_f1: 0.5083
 epoch: 30, train_loss: 0.8867, test_loss: 0.9156, test_f1: 0.5512
 epoch: 31, train_loss: 0.8746, test_loss: 0.9100, test_f1: 0.5520
 epoch: 32, train_loss: 0.8849, test_loss: 0.8817, test_f1: 0.5574
 epoch: 33, train_loss: 0.8734, test_loss: 0.9660, test_f1: 0.5036
 epoch: 34, train_loss: 0.8577, test_loss: 0.9500, test_f1: 0.5050
 epoch: 35, train_loss: 0.8510, test_loss: 1.0191, test_f1: 0.5083
 epoch: 36, train_loss: 0.8500, test_loss: 0.8903, test_f1: 0.5537
 epoch: 37, train_loss: 0.8583, test_loss: 0.9621, test_f1: 0.5245
 epoch: 38, train_loss: 0.8582, test_loss: 0.9911, test_f1: 0.5415
 epoch: 39, train_loss: 0.8569, test_loss: 0.9830, test_f1: 0.5666
 epoch: 40, train_loss: 0.8548, test_loss: 1.0399, test_f1: 0.5282
 epoch: 41, train_loss: 0.8400, test_loss: 1.1552, test_f1: 0.5418
 epoch: 42, train_loss: 0.8423, test_loss: 0.9966, test_f1: 0.5612
 epoch: 43, train_loss: 0.8572, test_loss: 0.9802, test_f1: 0.5261
 epoch: 44, train_loss: 0.8512, test_loss: 0.9368, test_f1: 0.5976
 epoch: 45, train_loss: 0.8549, test_loss: 0.9042, test_f1: 0.5168
 epoch: 46, train_loss: 0.8358, test_loss: 0.8947, test_f1: 0.5456
 epoch: 47, train_loss: 0.8535, test_loss: 0.9837, test_f1: 0.5235
 epoch: 48, train_loss: 0.8307, test_loss: 1.0327, test_f1: 0.5449
 epoch: 49, train_loss: 0.8360, test_loss: 0.9783, test_f1: 0.5524
 epoch: 50, train_loss: 0.8330, test_loss: 1.0125, test_f1: 0.5152
 epoch: 51, train_loss: 0.8122, test_loss: 0.9709, test_f1: 0.5715
 epoch: 52, train_loss: 0.8202, test_loss: 0.9741, test_f1: 0.5554
 epoch: 53, train_loss: 0.7921, test_loss: 1.0425, test_f1: 0.6041
 epoch: 54, train_loss: 0.7991, test_loss: 1.0894, test_f1: 0.5916
 epoch: 55, train_loss: 0.7968, test_loss: 0.9849, test_f1: 0.5670
 epoch: 56, train_loss: 0.7911, test_loss: 1.0212, test_f1: 0.6190
 epoch: 57, train_loss: 0.7883, test_loss: 1.0221, test_f1: 0.6383
 epoch: 58, train_loss: 0.8180, test_loss: 1.0799, test_f1: 0.5932
 epoch: 59, train_loss: 0.7916, test_loss: 1.0955, test_f1: 0.5793
 epoch: 60, train_loss: 0.7916, test_loss: 1.0831, test_f1: 0.6046
 epoch: 61, train_loss: 0.7737, test_loss: 1.0520, test_f1: 0.5799
 epoch: 62, train_loss: 0.7880, test_loss: 0.9531, test_f1: 0.6012
 epoch: 63, train_loss: 0.7752, test_loss: 1.0273, test_f1: 0.6143
 epoch: 64, train_loss: 0.7961, test_loss: 1.0673, test_f1: 0.5945
 epoch: 65, train_loss: 0.7907, test_loss: 1.0469, test_f1: 0.5795
 epoch: 66, train_loss: 0.7749, test_loss: 1.0170, test_f1: 0.6098
 epoch: 67, train_loss: 0.7659, test_loss: 1.0639, test_f1: 0.5964
 epoch: 68, train_loss: 0.7756, test_loss: 1.0203, test_f1: 0.6063
 epoch: 69, train_loss: 0.7894, test_loss: 0.9551, test_f1: 0.5730
 epoch: 70, train_loss: 0.7753, test_loss: 0.9530, test_f1: 0.5836
 epoch: 71, train_loss: 0.7576, test_loss: 0.9866, test_f1: 0.6088
 epoch: 72, train_loss: 0.7691, test_loss: 0.9772, test_f1: 0.6128
 epoch: 73, train_loss: 0.7500, test_loss: 1.0630, test_f1: 0.6225
 epoch: 74, train_loss: 0.7804, test_loss: 0.9742, test_f1: 0.5836
 epoch: 75, train_loss: 0.7551, test_loss: 0.9929, test_f1: 0.6388
 epoch: 76, train_loss: 0.7739, test_loss: 1.0246, test_f1: 0.6128
 epoch: 77, train_loss: 0.7558, test_loss: 1.0556, test_f1: 0.6007
 epoch: 78, train_loss: 0.7558, test_loss: 1.0159, test_f1: 0.6178
 epoch: 79, train_loss: 0.7598, test_loss: 1.0201, test_f1: 0.6352
 epoch: 80, train_loss: 0.7622, test_loss: 1.0077, test_f1: 0.6024
 epoch: 81, train_loss: 0.7514, test_loss: 0.9937, test_f1: 0.6313
 epoch: 82, train_loss: 0.7408, test_loss: 1.0312, test_f1: 0.6114
 epoch: 83, train_loss: 0.7547, test_loss: 1.0694, test_f1: 0.5953
 epoch: 84, train_loss: 0.7427, test_loss: 0.9983, test_f1: 0.6393
 epoch: 85, train_loss: 0.7511, test_loss: 1.0538, test_f1: 0.6014
 epoch: 86, train_loss: 0.7515, test_loss: 1.1589, test_f1: 0.5978
 epoch: 87, train_loss: 0.7443, test_loss: 1.0999, test_f1: 0.6295
 epoch: 88, train_loss: 0.7449, test_loss: 1.1011, test_f1: 0.5914
 epoch: 89, train_loss: 0.7423, test_loss: 1.1557, test_f1: 0.6519
 epoch: 90, train_loss: 0.7397, test_loss: 1.1541, test_f1: 0.6150
 epoch: 91, train_loss: 0.7340, test_loss: 1.1083, test_f1: 0.6102
 epoch: 92, train_loss: 0.7367, test_loss: 1.1978, test_f1: 0.6057
 epoch: 93, train_loss: 0.7573, test_loss: 1.1890, test_f1: 0.5849
 epoch: 94, train_loss: 0.7375, test_loss: 1.2013, test_f1: 0.6180
 epoch: 95, train_loss: 0.7439, test_loss: 1.1267, test_f1: 0.6165
 epoch: 96, train_loss: 0.7367, test_loss: 1.0873, test_f1: 0.6075
 epoch: 97, train_loss: 0.7302, test_loss: 1.1498, test_f1: 0.6115
 epoch: 98, train_loss: 0.7436, test_loss: 1.1175, test_f1: 0.5570
 epoch: 99, train_loss: 0.7268, test_loss: 1.1934, test_f1: 0.5663
##################ITERATION #4 ****************************************
 epoch: 0, train_loss: 1.1944, test_loss: 1.1040, test_f1: 0.4004
 epoch: 1, train_loss: 1.0432, test_loss: 1.0647, test_f1: 0.4602
 epoch: 2, train_loss: 1.0195, test_loss: 1.0204, test_f1: 0.4481
 epoch: 3, train_loss: 1.0324, test_loss: 1.0327, test_f1: 0.5045
 epoch: 4, train_loss: 1.0160, test_loss: 0.9657, test_f1: 0.4888
 epoch: 5, train_loss: 1.0005, test_loss: 1.0488, test_f1: 0.4545
 epoch: 6, train_loss: 1.0145, test_loss: 1.0299, test_f1: 0.4707
 epoch: 7, train_loss: 0.9830, test_loss: 1.0551, test_f1: 0.4588
 epoch: 8, train_loss: 0.9781, test_loss: 1.3170, test_f1: 0.4568
 epoch: 9, train_loss: 0.9793, test_loss: 1.0356, test_f1: 0.4745
 epoch: 10, train_loss: 0.9590, test_loss: 1.0415, test_f1: 0.4577
 epoch: 11, train_loss: 0.9525, test_loss: 0.9928, test_f1: 0.4904
 epoch: 12, train_loss: 0.9477, test_loss: 0.9484, test_f1: 0.4974
 epoch: 13, train_loss: 0.9492, test_loss: 1.0455, test_f1: 0.4783
 epoch: 14, train_loss: 0.9272, test_loss: 1.0171, test_f1: 0.5147
 epoch: 15, train_loss: 0.9427, test_loss: 0.9951, test_f1: 0.5093
 epoch: 16, train_loss: 0.9404, test_loss: 1.0348, test_f1: 0.4753
 epoch: 17, train_loss: 0.9387, test_loss: 0.9717, test_f1: 0.5188
 epoch: 18, train_loss: 0.9619, test_loss: 1.0542, test_f1: 0.5033
 epoch: 19, train_loss: 0.9372, test_loss: 1.0086, test_f1: 0.5293
 epoch: 20, train_loss: 0.9470, test_loss: 1.1023, test_f1: 0.4701
 epoch: 21, train_loss: 0.9403, test_loss: 0.9817, test_f1: 0.4693
 epoch: 22, train_loss: 0.9370, test_loss: 1.0157, test_f1: 0.5197
 epoch: 23, train_loss: 0.9309, test_loss: 0.9868, test_f1: 0.4886
 epoch: 24, train_loss: 0.9183, test_loss: 0.9832, test_f1: 0.4915
 epoch: 25, train_loss: 0.9257, test_loss: 0.9567, test_f1: 0.4866
 epoch: 26, train_loss: 0.9087, test_loss: 0.9649, test_f1: 0.5357
 epoch: 27, train_loss: 0.9268, test_loss: 1.0081, test_f1: 0.5099
 epoch: 28, train_loss: 0.9229, test_loss: 1.0990, test_f1: 0.4437
 epoch: 29, train_loss: 0.9296, test_loss: 0.9551, test_f1: 0.4799
 epoch: 30, train_loss: 0.9292, test_loss: 1.0295, test_f1: 0.4927
 epoch: 31, train_loss: 0.9562, test_loss: 1.0200, test_f1: 0.5087
 epoch: 32, train_loss: 0.9376, test_loss: 1.0515, test_f1: 0.4797
 epoch: 33, train_loss: 0.9425, test_loss: 0.9776, test_f1: 0.5082
 epoch: 34, train_loss: 0.9345, test_loss: 0.9934, test_f1: 0.5048
 epoch: 35, train_loss: 0.9419, test_loss: 0.9789, test_f1: 0.4990
 epoch: 36, train_loss: 0.9241, test_loss: 1.0542, test_f1: 0.5059
 epoch: 37, train_loss: 0.9204, test_loss: 1.0030, test_f1: 0.5144
 epoch: 38, train_loss: 0.9101, test_loss: 1.0202, test_f1: 0.4749
 epoch: 39, train_loss: 0.9250, test_loss: 1.0143, test_f1: 0.4945
 epoch: 40, train_loss: 0.8986, test_loss: 1.0037, test_f1: 0.5026
 epoch: 41, train_loss: 0.9016, test_loss: 1.0005, test_f1: 0.4959
 epoch: 42, train_loss: 0.9156, test_loss: 1.0488, test_f1: 0.5206
 epoch: 43, train_loss: 0.9045, test_loss: 1.0061, test_f1: 0.4794
 epoch: 44, train_loss: 0.9009, test_loss: 0.9827, test_f1: 0.4989
 epoch: 45, train_loss: 0.8897, test_loss: 1.0268, test_f1: 0.5500
 epoch: 46, train_loss: 0.8755, test_loss: 1.0229, test_f1: 0.5025
 epoch: 47, train_loss: 0.8790, test_loss: 0.9424, test_f1: 0.4898
 epoch: 48, train_loss: 0.8904, test_loss: 0.9951, test_f1: 0.4747
 epoch: 49, train_loss: 0.8890, test_loss: 0.9401, test_f1: 0.4906
 epoch: 50, train_loss: 0.8622, test_loss: 0.9824, test_f1: 0.5112
 epoch: 51, train_loss: 0.8505, test_loss: 0.9594, test_f1: 0.5359
 epoch: 52, train_loss: 0.8290, test_loss: 0.9840, test_f1: 0.5451
 epoch: 53, train_loss: 0.8365, test_loss: 0.9604, test_f1: 0.5465
 epoch: 54, train_loss: 0.8381, test_loss: 0.9606, test_f1: 0.5575
 epoch: 55, train_loss: 0.8252, test_loss: 0.9660, test_f1: 0.5533
 epoch: 56, train_loss: 0.8255, test_loss: 0.9704, test_f1: 0.5693
 epoch: 57, train_loss: 0.8219, test_loss: 0.9924, test_f1: 0.5484
 epoch: 58, train_loss: 0.8087, test_loss: 0.9918, test_f1: 0.5263
 epoch: 59, train_loss: 0.8146, test_loss: 0.9754, test_f1: 0.6096
 epoch: 60, train_loss: 0.8046, test_loss: 0.9866, test_f1: 0.5562
 epoch: 61, train_loss: 0.8091, test_loss: 0.9944, test_f1: 0.5684
 epoch: 62, train_loss: 0.8143, test_loss: 1.0149, test_f1: 0.5323
 epoch: 63, train_loss: 0.8066, test_loss: 1.0161, test_f1: 0.6136
 epoch: 64, train_loss: 0.8061, test_loss: 0.9724, test_f1: 0.5735
 epoch: 65, train_loss: 0.8142, test_loss: 0.9762, test_f1: 0.5824
 epoch: 66, train_loss: 0.8065, test_loss: 0.9631, test_f1: 0.5588
 epoch: 67, train_loss: 0.7862, test_loss: 1.0224, test_f1: 0.6057
 epoch: 68, train_loss: 0.8353, test_loss: 0.9618, test_f1: 0.5916
 epoch: 69, train_loss: 0.7983, test_loss: 0.9694, test_f1: 0.5330
 epoch: 70, train_loss: 0.7980, test_loss: 0.9816, test_f1: 0.5690
 epoch: 71, train_loss: 0.7951, test_loss: 0.9768, test_f1: 0.5972
 epoch: 72, train_loss: 0.8559, test_loss: 0.9631, test_f1: 0.5987
 epoch: 73, train_loss: 0.8156, test_loss: 1.0016, test_f1: 0.5489
 epoch: 74, train_loss: 0.7997, test_loss: 0.9992, test_f1: 0.5671
 epoch: 75, train_loss: 0.7925, test_loss: 0.9958, test_f1: 0.5817
 epoch: 76, train_loss: 0.7843, test_loss: 1.0081, test_f1: 0.6265
 epoch: 77, train_loss: 0.7918, test_loss: 0.9942, test_f1: 0.5896
 epoch: 78, train_loss: 0.7916, test_loss: 0.9643, test_f1: 0.6260
 epoch: 79, train_loss: 0.7775, test_loss: 0.9767, test_f1: 0.6024
 epoch: 80, train_loss: 0.7779, test_loss: 0.9596, test_f1: 0.6237
 epoch: 81, train_loss: 0.7648, test_loss: 0.9933, test_f1: 0.6266
 epoch: 82, train_loss: 0.7852, test_loss: 0.9553, test_f1: 0.5549
 epoch: 83, train_loss: 0.8071, test_loss: 0.9412, test_f1: 0.5648
 epoch: 84, train_loss: 0.7789, test_loss: 0.9298, test_f1: 0.5841
 epoch: 85, train_loss: 0.7691, test_loss: 0.9335, test_f1: 0.5785
 epoch: 86, train_loss: 0.7679, test_loss: 0.9571, test_f1: 0.6336
 epoch: 87, train_loss: 0.7567, test_loss: 1.0057, test_f1: 0.5803
 epoch: 88, train_loss: 0.7545, test_loss: 0.9775, test_f1: 0.5929
 epoch: 89, train_loss: 0.7629, test_loss: 0.9588, test_f1: 0.6302
 epoch: 90, train_loss: 0.7618, test_loss: 1.0206, test_f1: 0.5838
 epoch: 91, train_loss: 0.7538, test_loss: 1.0133, test_f1: 0.6019
 epoch: 92, train_loss: 0.7584, test_loss: 0.9777, test_f1: 0.5963
 epoch: 93, train_loss: 0.7629, test_loss: 0.9713, test_f1: 0.5966
 epoch: 94, train_loss: 0.7717, test_loss: 0.9680, test_f1: 0.5598
 epoch: 95, train_loss: 0.7522, test_loss: 1.0242, test_f1: 0.5781
 epoch: 96, train_loss: 0.7502, test_loss: 1.0772, test_f1: 0.5584
 epoch: 97, train_loss: 0.7454, test_loss: 0.9974, test_f1: 0.5804
 epoch: 98, train_loss: 0.7582, test_loss: 1.0005, test_f1: 0.6233
 epoch: 99, train_loss: 0.7530, test_loss: 1.0020, test_f1: 0.5975
##################ITERATION #5 ****************************************
 epoch: 0, train_loss: 1.1670, test_loss: 1.0583, test_f1: 0.4103
 epoch: 1, train_loss: 1.0419, test_loss: 1.0177, test_f1: 0.5040
 epoch: 2, train_loss: 1.0067, test_loss: 1.0173, test_f1: 0.4919
 epoch: 3, train_loss: 1.0067, test_loss: 1.0536, test_f1: 0.4736
 epoch: 4, train_loss: 0.9958, test_loss: 1.0227, test_f1: 0.4523
 epoch: 5, train_loss: 0.9791, test_loss: 1.0053, test_f1: 0.4680
 epoch: 6, train_loss: 0.9717, test_loss: 1.0530, test_f1: 0.4689
 epoch: 7, train_loss: 0.9637, test_loss: 1.0042, test_f1: 0.4766
 epoch: 8, train_loss: 0.9395, test_loss: 0.9481, test_f1: 0.4972
 epoch: 9, train_loss: 0.9411, test_loss: 0.9892, test_f1: 0.4955
 epoch: 10, train_loss: 0.9321, test_loss: 0.9953, test_f1: 0.4661
 epoch: 11, train_loss: 0.9382, test_loss: 0.9995, test_f1: 0.5179
 epoch: 12, train_loss: 0.9260, test_loss: 0.9995, test_f1: 0.4931
 epoch: 13, train_loss: 0.9245, test_loss: 0.9746, test_f1: 0.5173
 epoch: 14, train_loss: 0.9121, test_loss: 0.9507, test_f1: 0.4874
 epoch: 15, train_loss: 0.9219, test_loss: 0.9102, test_f1: 0.5002
 epoch: 16, train_loss: 0.9129, test_loss: 0.9976, test_f1: 0.5099
 epoch: 17, train_loss: 0.9074, test_loss: 0.9485, test_f1: 0.5173
 epoch: 18, train_loss: 0.9093, test_loss: 0.9714, test_f1: 0.5055
 epoch: 19, train_loss: 0.9039, test_loss: 0.9850, test_f1: 0.5162
 epoch: 20, train_loss: 0.9110, test_loss: 0.9756, test_f1: 0.5171
 epoch: 21, train_loss: 0.8904, test_loss: 0.9337, test_f1: 0.5192
 epoch: 22, train_loss: 0.8967, test_loss: 0.9877, test_f1: 0.5233
 epoch: 23, train_loss: 0.8806, test_loss: 0.9792, test_f1: 0.5166
 epoch: 24, train_loss: 0.8959, test_loss: 1.0191, test_f1: 0.4827
 epoch: 25, train_loss: 0.8828, test_loss: 0.9612, test_f1: 0.5137
 epoch: 26, train_loss: 0.8825, test_loss: 0.9776, test_f1: 0.5104
 epoch: 27, train_loss: 0.8762, test_loss: 0.9736, test_f1: 0.5469
 epoch: 28, train_loss: 0.8657, test_loss: 0.9677, test_f1: 0.5440
 epoch: 29, train_loss: 0.8786, test_loss: 0.9574, test_f1: 0.5318
 epoch: 30, train_loss: 0.8959, test_loss: 0.9641, test_f1: 0.5057
 epoch: 31, train_loss: 0.9036, test_loss: 0.9486, test_f1: 0.5130
 epoch: 32, train_loss: 0.8717, test_loss: 0.9851, test_f1: 0.4828
 epoch: 33, train_loss: 0.8765, test_loss: 0.9477, test_f1: 0.4926
 epoch: 34, train_loss: 0.8565, test_loss: 0.9836, test_f1: 0.5888
 epoch: 35, train_loss: 0.8789, test_loss: 1.0038, test_f1: 0.5235
 epoch: 36, train_loss: 0.8883, test_loss: 0.9501, test_f1: 0.5282
 epoch: 37, train_loss: 0.8626, test_loss: 0.9498, test_f1: 0.5455
 epoch: 38, train_loss: 0.8589, test_loss: 0.9664, test_f1: 0.4916
 epoch: 39, train_loss: 0.8587, test_loss: 0.9352, test_f1: 0.5325
 epoch: 40, train_loss: 0.8813, test_loss: 0.9728, test_f1: 0.5558
 epoch: 41, train_loss: 0.8538, test_loss: 0.9985, test_f1: 0.5119
 epoch: 42, train_loss: 0.8443, test_loss: 0.9790, test_f1: 0.5846
 epoch: 43, train_loss: 0.8605, test_loss: 0.9512, test_f1: 0.5183
 epoch: 44, train_loss: 0.8388, test_loss: 0.9338, test_f1: 0.5345
 epoch: 45, train_loss: 0.8485, test_loss: 0.9920, test_f1: 0.5277
 epoch: 46, train_loss: 0.8421, test_loss: 0.9961, test_f1: 0.5135
 epoch: 47, train_loss: 0.8297, test_loss: 0.9888, test_f1: 0.5326
 epoch: 48, train_loss: 0.8343, test_loss: 0.9570, test_f1: 0.5495
 epoch: 49, train_loss: 0.8493, test_loss: 0.9362, test_f1: 0.5186
 epoch: 50, train_loss: 0.8380, test_loss: 0.9570, test_f1: 0.5198
 epoch: 51, train_loss: 0.8166, test_loss: 0.9703, test_f1: 0.5667
 epoch: 52, train_loss: 0.8031, test_loss: 0.9521, test_f1: 0.5375
 epoch: 53, train_loss: 0.8086, test_loss: 0.9772, test_f1: 0.6070
 epoch: 54, train_loss: 0.8034, test_loss: 0.9960, test_f1: 0.5480
 epoch: 55, train_loss: 0.7887, test_loss: 0.9930, test_f1: 0.5880
 epoch: 56, train_loss: 0.7946, test_loss: 0.9454, test_f1: 0.6071
 epoch: 57, train_loss: 0.7997, test_loss: 0.9514, test_f1: 0.5960
 epoch: 58, train_loss: 0.7856, test_loss: 0.9661, test_f1: 0.5894
 epoch: 59, train_loss: 0.7979, test_loss: 0.9099, test_f1: 0.6110
 epoch: 60, train_loss: 0.7960, test_loss: 0.9436, test_f1: 0.5880
 epoch: 61, train_loss: 0.7773, test_loss: 0.9492, test_f1: 0.6200
 epoch: 62, train_loss: 0.7841, test_loss: 0.9323, test_f1: 0.6080
 epoch: 63, train_loss: 0.7841, test_loss: 0.9046, test_f1: 0.5979
 epoch: 64, train_loss: 0.7665, test_loss: 0.9375, test_f1: 0.6257
 epoch: 65, train_loss: 0.7733, test_loss: 0.9422, test_f1: 0.6292
 epoch: 66, train_loss: 0.7850, test_loss: 0.9436, test_f1: 0.6322
 epoch: 67, train_loss: 0.7792, test_loss: 0.9669, test_f1: 0.6113
 epoch: 68, train_loss: 0.7712, test_loss: 0.9548, test_f1: 0.6266
 epoch: 69, train_loss: 0.7611, test_loss: 0.9588, test_f1: 0.6253
 epoch: 70, train_loss: 0.7737, test_loss: 0.9484, test_f1: 0.5888
 epoch: 71, train_loss: 0.7511, test_loss: 0.9571, test_f1: 0.6288
 epoch: 72, train_loss: 0.7585, test_loss: 0.9529, test_f1: 0.6097
 epoch: 73, train_loss: 0.7674, test_loss: 0.9625, test_f1: 0.6107
 epoch: 74, train_loss: 0.7550, test_loss: 0.9473, test_f1: 0.5674
 epoch: 75, train_loss: 0.7634, test_loss: 0.9396, test_f1: 0.5906
 epoch: 76, train_loss: 0.7485, test_loss: 0.9821, test_f1: 0.6085
 epoch: 77, train_loss: 0.7550, test_loss: 1.0013, test_f1: 0.5885
 epoch: 78, train_loss: 0.7711, test_loss: 0.9598, test_f1: 0.6426
 epoch: 79, train_loss: 0.7580, test_loss: 0.9554, test_f1: 0.6377
 epoch: 80, train_loss: 0.7460, test_loss: 0.9621, test_f1: 0.5946
 epoch: 81, train_loss: 0.7532, test_loss: 0.9338, test_f1: 0.6043
 epoch: 82, train_loss: 0.7571, test_loss: 0.9766, test_f1: 0.6166
 epoch: 83, train_loss: 0.7436, test_loss: 1.0014, test_f1: 0.6233
 epoch: 84, train_loss: 0.7552, test_loss: 1.0009, test_f1: 0.5930
 epoch: 85, train_loss: 0.7559, test_loss: 0.9816, test_f1: 0.6010
 epoch: 86, train_loss: 0.7458, test_loss: 1.0018, test_f1: 0.5886
 epoch: 87, train_loss: 0.7424, test_loss: 0.9469, test_f1: 0.6663
 epoch: 88, train_loss: 0.7455, test_loss: 1.0282, test_f1: 0.5936
 epoch: 89, train_loss: 0.7556, test_loss: 0.9559, test_f1: 0.6443
 epoch: 90, train_loss: 0.7368, test_loss: 0.9083, test_f1: 0.6185
 epoch: 91, train_loss: 0.7644, test_loss: 0.9217, test_f1: 0.6264
 epoch: 92, train_loss: 0.7473, test_loss: 0.9400, test_f1: 0.6349
 epoch: 93, train_loss: 0.7430, test_loss: 0.9065, test_f1: 0.6193
 epoch: 94, train_loss: 0.7412, test_loss: 0.9587, test_f1: 0.6114
 epoch: 95, train_loss: 0.7361, test_loss: 0.9414, test_f1: 0.6132
 epoch: 96, train_loss: 0.7519, test_loss: 0.9669, test_f1: 0.6508
 epoch: 97, train_loss: 0.7519, test_loss: 0.9070, test_f1: 0.5962
 epoch: 98, train_loss: 0.7648, test_loss: 0.9627, test_f1: 0.6138
 epoch: 99, train_loss: 0.7672, test_loss: 0.9148, test_f1: 0.6604
##################ITERATION #6 ****************************************
 epoch: 0, train_loss: 1.1833, test_loss: 1.2303, test_f1: 0.3576
 epoch: 1, train_loss: 1.0381, test_loss: 1.1051, test_f1: 0.4504
 epoch: 2, train_loss: 1.0050, test_loss: 1.0193, test_f1: 0.4512
 epoch: 3, train_loss: 0.9798, test_loss: 0.9877, test_f1: 0.4887
 epoch: 4, train_loss: 0.9659, test_loss: 0.9430, test_f1: 0.4836
 epoch: 5, train_loss: 0.9488, test_loss: 0.9902, test_f1: 0.4615
 epoch: 6, train_loss: 0.9533, test_loss: 0.9747, test_f1: 0.4849
 epoch: 7, train_loss: 0.9409, test_loss: 0.9490, test_f1: 0.5570
 epoch: 8, train_loss: 0.9422, test_loss: 0.9966, test_f1: 0.4916
 epoch: 9, train_loss: 0.9334, test_loss: 0.9679, test_f1: 0.5523
 epoch: 10, train_loss: 0.9230, test_loss: 0.9308, test_f1: 0.5268
 epoch: 11, train_loss: 0.9195, test_loss: 0.9809, test_f1: 0.5404
 epoch: 12, train_loss: 0.9088, test_loss: 0.9819, test_f1: 0.5059
 epoch: 13, train_loss: 0.9161, test_loss: 1.0056, test_f1: 0.4636
 epoch: 14, train_loss: 0.9154, test_loss: 0.9290, test_f1: 0.5602
 epoch: 15, train_loss: 0.9358, test_loss: 1.0583, test_f1: 0.4566
 epoch: 16, train_loss: 0.9315, test_loss: 1.0094, test_f1: 0.5205
 epoch: 17, train_loss: 0.9037, test_loss: 0.9544, test_f1: 0.4811
 epoch: 18, train_loss: 0.9211, test_loss: 0.9363, test_f1: 0.5088
 epoch: 19, train_loss: 0.8841, test_loss: 0.9726, test_f1: 0.4949
 epoch: 20, train_loss: 0.8815, test_loss: 0.9688, test_f1: 0.4931
 epoch: 21, train_loss: 0.8657, test_loss: 0.9188, test_f1: 0.5550
 epoch: 22, train_loss: 0.8564, test_loss: 0.9200, test_f1: 0.5084
 epoch: 23, train_loss: 0.8692, test_loss: 0.9561, test_f1: 0.5583
 epoch: 24, train_loss: 0.8469, test_loss: 1.0270, test_f1: 0.5504
 epoch: 25, train_loss: 0.8383, test_loss: 1.0218, test_f1: 0.5838
 epoch: 26, train_loss: 0.8741, test_loss: 0.9910, test_f1: 0.5716
 epoch: 27, train_loss: 0.8359, test_loss: 0.9657, test_f1: 0.5432
 epoch: 28, train_loss: 0.8301, test_loss: 0.9042, test_f1: 0.5192
 epoch: 29, train_loss: 0.8472, test_loss: 0.9442, test_f1: 0.5760
 epoch: 30, train_loss: 0.8384, test_loss: 0.8818, test_f1: 0.5715
 epoch: 31, train_loss: 0.8069, test_loss: 0.9264, test_f1: 0.5987
 epoch: 32, train_loss: 0.8212, test_loss: 0.8821, test_f1: 0.6008
 epoch: 33, train_loss: 0.8161, test_loss: 0.9159, test_f1: 0.6017
 epoch: 34, train_loss: 0.8079, test_loss: 0.9246, test_f1: 0.5854
 epoch: 35, train_loss: 0.8112, test_loss: 0.9403, test_f1: 0.5945
 epoch: 36, train_loss: 0.7822, test_loss: 0.9527, test_f1: 0.5579
 epoch: 37, train_loss: 0.7929, test_loss: 0.9686, test_f1: 0.6002
 epoch: 38, train_loss: 0.7929, test_loss: 0.9765, test_f1: 0.6019
 epoch: 39, train_loss: 0.8070, test_loss: 0.9550, test_f1: 0.5689
 epoch: 40, train_loss: 0.8018, test_loss: 0.9225, test_f1: 0.5526
 epoch: 41, train_loss: 0.7996, test_loss: 0.9416, test_f1: 0.5645
 epoch: 42, train_loss: 0.7688, test_loss: 1.0025, test_f1: 0.6036
 epoch: 43, train_loss: 0.7793, test_loss: 0.9247, test_f1: 0.5676
 epoch: 44, train_loss: 0.7843, test_loss: 0.9043, test_f1: 0.6059
 epoch: 45, train_loss: 0.7840, test_loss: 0.9122, test_f1: 0.6101
 epoch: 46, train_loss: 0.8103, test_loss: 0.9353, test_f1: 0.5799
 epoch: 47, train_loss: 0.7882, test_loss: 0.9876, test_f1: 0.5453
 epoch: 48, train_loss: 0.7918, test_loss: 0.8483, test_f1: 0.6304
 epoch: 49, train_loss: 0.7883, test_loss: 0.9482, test_f1: 0.6453
 epoch: 50, train_loss: 0.7662, test_loss: 0.9129, test_f1: 0.6557
 epoch: 51, train_loss: 0.7565, test_loss: 0.9966, test_f1: 0.6157
 epoch: 52, train_loss: 0.7549, test_loss: 0.9710, test_f1: 0.6305
 epoch: 53, train_loss: 0.7431, test_loss: 0.9333, test_f1: 0.6398
 epoch: 54, train_loss: 0.7219, test_loss: 0.9506, test_f1: 0.6281
 epoch: 55, train_loss: 0.7228, test_loss: 0.9520, test_f1: 0.6197
 epoch: 56, train_loss: 0.7266, test_loss: 0.9917, test_f1: 0.5954
 epoch: 57, train_loss: 0.7377, test_loss: 0.9395, test_f1: 0.6231
 epoch: 58, train_loss: 0.7266, test_loss: 0.9761, test_f1: 0.6442
 epoch: 59, train_loss: 0.7113, test_loss: 1.0111, test_f1: 0.6409
 epoch: 60, train_loss: 0.7065, test_loss: 0.9667, test_f1: 0.6495
 epoch: 61, train_loss: 0.7068, test_loss: 0.9599, test_f1: 0.6072
 epoch: 62, train_loss: 0.7142, test_loss: 0.9642, test_f1: 0.6539
 epoch: 63, train_loss: 0.7040, test_loss: 0.9673, test_f1: 0.6560
 epoch: 64, train_loss: 0.7149, test_loss: 1.0019, test_f1: 0.6396
 epoch: 65, train_loss: 0.7083, test_loss: 0.9679, test_f1: 0.6571
 epoch: 66, train_loss: 0.6957, test_loss: 0.9482, test_f1: 0.6272
 epoch: 67, train_loss: 0.7025, test_loss: 0.9769, test_f1: 0.6251
 epoch: 68, train_loss: 0.7038, test_loss: 0.9636, test_f1: 0.5791
 epoch: 69, train_loss: 0.6976, test_loss: 0.9778, test_f1: 0.6083
 epoch: 70, train_loss: 0.6874, test_loss: 0.9594, test_f1: 0.6485
 epoch: 71, train_loss: 0.6952, test_loss: 0.9508, test_f1: 0.6078
 epoch: 72, train_loss: 0.7355, test_loss: 0.9289, test_f1: 0.6192
 epoch: 73, train_loss: 0.6951, test_loss: 0.9217, test_f1: 0.6483
 epoch: 74, train_loss: 0.6800, test_loss: 0.9322, test_f1: 0.6079
 epoch: 75, train_loss: 0.6914, test_loss: 0.9581, test_f1: 0.6305
 epoch: 76, train_loss: 0.6902, test_loss: 1.0147, test_f1: 0.6407
 epoch: 77, train_loss: 0.6864, test_loss: 0.9823, test_f1: 0.6248
 epoch: 78, train_loss: 0.6775, test_loss: 0.9566, test_f1: 0.6350
 epoch: 79, train_loss: 0.6780, test_loss: 1.0011, test_f1: 0.6579
 epoch: 80, train_loss: 0.7079, test_loss: 0.9219, test_f1: 0.6394
 epoch: 81, train_loss: 0.6863, test_loss: 0.9502, test_f1: 0.6362
 epoch: 82, train_loss: 0.6767, test_loss: 0.9382, test_f1: 0.6744
 epoch: 83, train_loss: 0.6751, test_loss: 0.9324, test_f1: 0.6494
 epoch: 84, train_loss: 0.6794, test_loss: 0.9363, test_f1: 0.6601
 epoch: 85, train_loss: 0.6825, test_loss: 0.9590, test_f1: 0.6444
 epoch: 86, train_loss: 0.6844, test_loss: 0.9244, test_f1: 0.6460
 epoch: 87, train_loss: 0.6630, test_loss: 0.9969, test_f1: 0.6540
 epoch: 88, train_loss: 0.6545, test_loss: 0.9691, test_f1: 0.6349
 epoch: 89, train_loss: 0.6737, test_loss: 0.9752, test_f1: 0.6420
 epoch: 90, train_loss: 0.6491, test_loss: 1.0342, test_f1: 0.6438
 epoch: 91, train_loss: 0.6588, test_loss: 1.0350, test_f1: 0.6764
 epoch: 92, train_loss: 0.6668, test_loss: 0.9900, test_f1: 0.6474
 epoch: 93, train_loss: 0.6598, test_loss: 0.9894, test_f1: 0.6594
 epoch: 94, train_loss: 0.6517, test_loss: 0.9675, test_f1: 0.6615
 epoch: 95, train_loss: 0.6564, test_loss: 0.9550, test_f1: 0.6428
 epoch: 96, train_loss: 0.6471, test_loss: 0.9269, test_f1: 0.6676
 epoch: 97, train_loss: 0.6514, test_loss: 0.9681, test_f1: 0.6361
 epoch: 98, train_loss: 0.6521, test_loss: 0.9978, test_f1: 0.6476
 epoch: 99, train_loss: 0.6483, test_loss: 0.9610, test_f1: 0.6235
##################ITERATION #7 ****************************************
 epoch: 0, train_loss: 1.1854, test_loss: 1.0760, test_f1: 0.4497
 epoch: 1, train_loss: 1.0298, test_loss: 1.1201, test_f1: 0.4189
 epoch: 2, train_loss: 1.0109, test_loss: 0.9905, test_f1: 0.4397
 epoch: 3, train_loss: 0.9886, test_loss: 0.9913, test_f1: 0.4779
 epoch: 4, train_loss: 0.9866, test_loss: 1.0217, test_f1: 0.4587
 epoch: 5, train_loss: 0.9795, test_loss: 1.1559, test_f1: 0.4001
 epoch: 6, train_loss: 0.9597, test_loss: 1.0204, test_f1: 0.5122
 epoch: 7, train_loss: 0.9585, test_loss: 1.0041, test_f1: 0.4862
 epoch: 8, train_loss: 0.9514, test_loss: 1.0349, test_f1: 0.4821
 epoch: 9, train_loss: 0.9524, test_loss: 1.0239, test_f1: 0.4732
 epoch: 10, train_loss: 0.9401, test_loss: 1.0343, test_f1: 0.4784
 epoch: 11, train_loss: 0.9596, test_loss: 0.9994, test_f1: 0.4914
 epoch: 12, train_loss: 0.9359, test_loss: 1.0068, test_f1: 0.4845
 epoch: 13, train_loss: 0.9307, test_loss: 0.9624, test_f1: 0.4911
 epoch: 14, train_loss: 0.9242, test_loss: 0.9293, test_f1: 0.4801
 epoch: 15, train_loss: 0.9277, test_loss: 1.0071, test_f1: 0.4965
 epoch: 16, train_loss: 0.9104, test_loss: 0.9963, test_f1: 0.5265
 epoch: 17, train_loss: 0.9108, test_loss: 0.9032, test_f1: 0.5039
 epoch: 18, train_loss: 0.9173, test_loss: 0.9375, test_f1: 0.5297
 epoch: 19, train_loss: 0.8994, test_loss: 0.9477, test_f1: 0.5078
 epoch: 20, train_loss: 0.8957, test_loss: 0.9994, test_f1: 0.4864
 epoch: 21, train_loss: 0.8925, test_loss: 0.9647, test_f1: 0.4973
 epoch: 22, train_loss: 0.9069, test_loss: 0.8997, test_f1: 0.5135
 epoch: 23, train_loss: 0.8964, test_loss: 0.9609, test_f1: 0.5158
 epoch: 24, train_loss: 0.8919, test_loss: 0.9521, test_f1: 0.5098
 epoch: 25, train_loss: 0.8890, test_loss: 0.9468, test_f1: 0.5349
 epoch: 26, train_loss: 0.8806, test_loss: 0.9854, test_f1: 0.5109
 epoch: 27, train_loss: 0.8815, test_loss: 0.9941, test_f1: 0.5349
 epoch: 28, train_loss: 0.8832, test_loss: 0.9829, test_f1: 0.5070
 epoch: 29, train_loss: 0.8758, test_loss: 0.9717, test_f1: 0.5102
 epoch: 30, train_loss: 0.8939, test_loss: 0.9846, test_f1: 0.5670
 epoch: 31, train_loss: 0.8928, test_loss: 0.9877, test_f1: 0.4934
 epoch: 32, train_loss: 0.8770, test_loss: 0.9528, test_f1: 0.5135
 epoch: 33, train_loss: 0.8733, test_loss: 0.9506, test_f1: 0.4994
 epoch: 34, train_loss: 0.8606, test_loss: 0.9500, test_f1: 0.5010
 epoch: 35, train_loss: 0.8599, test_loss: 0.9383, test_f1: 0.5260
 epoch: 36, train_loss: 0.8513, test_loss: 0.9971, test_f1: 0.4864
 epoch: 37, train_loss: 0.8674, test_loss: 0.9600, test_f1: 0.5584
 epoch: 38, train_loss: 0.8538, test_loss: 0.9750, test_f1: 0.5671
 epoch: 39, train_loss: 0.8570, test_loss: 0.9828, test_f1: 0.5118
 epoch: 40, train_loss: 0.8559, test_loss: 1.0366, test_f1: 0.5563
 epoch: 41, train_loss: 0.8376, test_loss: 0.9625, test_f1: 0.5098
 epoch: 42, train_loss: 0.8502, test_loss: 0.9309, test_f1: 0.5624
 epoch: 43, train_loss: 0.8289, test_loss: 1.0120, test_f1: 0.5719
 epoch: 44, train_loss: 0.8392, test_loss: 0.9087, test_f1: 0.5695
 epoch: 45, train_loss: 0.8601, test_loss: 1.0490, test_f1: 0.4906
 epoch: 46, train_loss: 0.8536, test_loss: 1.0062, test_f1: 0.5486
 epoch: 47, train_loss: 0.8481, test_loss: 0.9247, test_f1: 0.5143
 epoch: 48, train_loss: 0.8350, test_loss: 0.9050, test_f1: 0.5200
 epoch: 49, train_loss: 0.8194, test_loss: 0.9328, test_f1: 0.5239
 epoch: 50, train_loss: 0.8253, test_loss: 0.9736, test_f1: 0.5729
 epoch: 51, train_loss: 0.7962, test_loss: 0.9140, test_f1: 0.5727
 epoch: 52, train_loss: 0.7879, test_loss: 0.8827, test_f1: 0.6074
 epoch: 53, train_loss: 0.7976, test_loss: 0.8982, test_f1: 0.5750
 epoch: 54, train_loss: 0.7988, test_loss: 0.8987, test_f1: 0.5333
 epoch: 55, train_loss: 0.7964, test_loss: 0.9173, test_f1: 0.6118
 epoch: 56, train_loss: 0.7798, test_loss: 0.9031, test_f1: 0.6302
 epoch: 57, train_loss: 0.7839, test_loss: 0.8804, test_f1: 0.5598
 epoch: 58, train_loss: 0.7906, test_loss: 0.8989, test_f1: 0.5996
 epoch: 59, train_loss: 0.7716, test_loss: 0.9078, test_f1: 0.5887
 epoch: 60, train_loss: 0.7664, test_loss: 0.9545, test_f1: 0.5868
 epoch: 61, train_loss: 0.7826, test_loss: 0.9249, test_f1: 0.5764
 epoch: 62, train_loss: 0.7869, test_loss: 0.9209, test_f1: 0.6192
 epoch: 63, train_loss: 0.7906, test_loss: 0.8939, test_f1: 0.6130
 epoch: 64, train_loss: 0.7933, test_loss: 0.8990, test_f1: 0.6345
 epoch: 65, train_loss: 0.7715, test_loss: 0.9234, test_f1: 0.5870
 epoch: 66, train_loss: 0.7792, test_loss: 0.9419, test_f1: 0.6178
 epoch: 67, train_loss: 0.7779, test_loss: 0.9255, test_f1: 0.6069
 epoch: 68, train_loss: 0.7659, test_loss: 0.9230, test_f1: 0.5966
 epoch: 69, train_loss: 0.7642, test_loss: 0.8784, test_f1: 0.5906
 epoch: 70, train_loss: 0.7725, test_loss: 0.8988, test_f1: 0.5983
 epoch: 71, train_loss: 0.7515, test_loss: 0.9044, test_f1: 0.6232
 epoch: 72, train_loss: 0.7682, test_loss: 0.8924, test_f1: 0.6193
 epoch: 73, train_loss: 0.7566, test_loss: 0.8872, test_f1: 0.6070
 epoch: 74, train_loss: 0.7476, test_loss: 0.8901, test_f1: 0.5940
 epoch: 75, train_loss: 0.7713, test_loss: 0.9171, test_f1: 0.5829
 epoch: 76, train_loss: 0.7517, test_loss: 0.9301, test_f1: 0.6195
 epoch: 77, train_loss: 0.7632, test_loss: 0.9005, test_f1: 0.6185
 epoch: 78, train_loss: 0.7525, test_loss: 0.9158, test_f1: 0.6071
 epoch: 79, train_loss: 0.7544, test_loss: 0.9393, test_f1: 0.6099
 epoch: 80, train_loss: 0.7484, test_loss: 0.8587, test_f1: 0.6186
 epoch: 81, train_loss: 0.7514, test_loss: 0.9216, test_f1: 0.5864
 epoch: 82, train_loss: 0.7506, test_loss: 0.9107, test_f1: 0.6184
 epoch: 83, train_loss: 0.7499, test_loss: 0.9310, test_f1: 0.6314
 epoch: 84, train_loss: 0.7488, test_loss: 0.9042, test_f1: 0.6061
 epoch: 85, train_loss: 0.7541, test_loss: 0.9758, test_f1: 0.6164
 epoch: 86, train_loss: 0.7727, test_loss: 0.9300, test_f1: 0.5946
 epoch: 87, train_loss: 0.7571, test_loss: 0.8863, test_f1: 0.5729
 epoch: 88, train_loss: 0.7691, test_loss: 0.8677, test_f1: 0.6222
 epoch: 89, train_loss: 0.7538, test_loss: 0.8765, test_f1: 0.6174
 epoch: 90, train_loss: 0.7338, test_loss: 0.8867, test_f1: 0.6261
 epoch: 91, train_loss: 0.7400, test_loss: 0.8766, test_f1: 0.6313
 epoch: 92, train_loss: 0.7527, test_loss: 0.9229, test_f1: 0.5824
 epoch: 93, train_loss: 0.7410, test_loss: 0.9882, test_f1: 0.5664
 epoch: 94, train_loss: 0.7853, test_loss: 0.9573, test_f1: 0.6084
 epoch: 95, train_loss: 0.7468, test_loss: 0.9408, test_f1: 0.5668
 epoch: 96, train_loss: 0.7513, test_loss: 0.9339, test_f1: 0.6417
 epoch: 97, train_loss: 0.7314, test_loss: 0.9146, test_f1: 0.6461
 epoch: 98, train_loss: 0.7330, test_loss: 0.9126, test_f1: 0.6406
 epoch: 99, train_loss: 0.7563, test_loss: 0.9027, test_f1: 0.6497
##################ITERATION #8 ****************************************
 epoch: 0, train_loss: 1.1523, test_loss: 1.0839, test_f1: 0.3962
 epoch: 1, train_loss: 1.0334, test_loss: 1.0162, test_f1: 0.4558
 epoch: 2, train_loss: 0.9993, test_loss: 1.0037, test_f1: 0.4787
 epoch: 3, train_loss: 0.9973, test_loss: 1.0091, test_f1: 0.4889
 epoch: 4, train_loss: 0.9857, test_loss: 0.9524, test_f1: 0.4929
 epoch: 5, train_loss: 0.9659, test_loss: 0.9586, test_f1: 0.4748
 epoch: 6, train_loss: 0.9614, test_loss: 0.9284, test_f1: 0.4851
 epoch: 7, train_loss: 0.9413, test_loss: 0.9435, test_f1: 0.5116
 epoch: 8, train_loss: 0.9301, test_loss: 0.9965, test_f1: 0.4869
 epoch: 9, train_loss: 0.9307, test_loss: 0.9641, test_f1: 0.5098
 epoch: 10, train_loss: 0.9171, test_loss: 0.9870, test_f1: 0.5088
 epoch: 11, train_loss: 0.9250, test_loss: 0.9818, test_f1: 0.4932
 epoch: 12, train_loss: 0.9195, test_loss: 0.9499, test_f1: 0.5036
 epoch: 13, train_loss: 0.9250, test_loss: 0.9946, test_f1: 0.5376
 epoch: 14, train_loss: 0.8988, test_loss: 0.9751, test_f1: 0.5096
 epoch: 15, train_loss: 0.8983, test_loss: 0.9915, test_f1: 0.5070
 epoch: 16, train_loss: 0.8956, test_loss: 0.9929, test_f1: 0.5338
 epoch: 17, train_loss: 0.8796, test_loss: 0.9250, test_f1: 0.5197
 epoch: 18, train_loss: 0.8899, test_loss: 0.9417, test_f1: 0.5157
 epoch: 19, train_loss: 0.8938, test_loss: 0.9564, test_f1: 0.4997
 epoch: 20, train_loss: 0.9015, test_loss: 0.9588, test_f1: 0.5139
 epoch: 21, train_loss: 0.8865, test_loss: 0.9287, test_f1: 0.5218
 epoch: 22, train_loss: 0.8666, test_loss: 0.9389, test_f1: 0.5198
 epoch: 23, train_loss: 0.8535, test_loss: 0.9760, test_f1: 0.5457
 epoch: 24, train_loss: 0.8700, test_loss: 0.9351, test_f1: 0.5253
 epoch: 25, train_loss: 0.8567, test_loss: 0.9533, test_f1: 0.5341
 epoch: 26, train_loss: 0.8457, test_loss: 0.9276, test_f1: 0.5403
 epoch: 27, train_loss: 0.8580, test_loss: 0.9216, test_f1: 0.5456
 epoch: 28, train_loss: 0.8505, test_loss: 0.8858, test_f1: 0.5391
 epoch: 29, train_loss: 0.8475, test_loss: 0.9416, test_f1: 0.5312
 epoch: 30, train_loss: 0.8560, test_loss: 0.9468, test_f1: 0.5099
 epoch: 31, train_loss: 0.8429, test_loss: 0.9301, test_f1: 0.5639
 epoch: 32, train_loss: 0.8342, test_loss: 0.8988, test_f1: 0.5906
 epoch: 33, train_loss: 0.8483, test_loss: 0.8997, test_f1: 0.5307
 epoch: 34, train_loss: 0.8573, test_loss: 0.9235, test_f1: 0.5208
 epoch: 35, train_loss: 0.8344, test_loss: 0.9054, test_f1: 0.5402
 epoch: 36, train_loss: 0.8252, test_loss: 0.9366, test_f1: 0.6025
 epoch: 37, train_loss: 0.8355, test_loss: 0.8935, test_f1: 0.5728
 epoch: 38, train_loss: 0.8198, test_loss: 0.9008, test_f1: 0.5561
 epoch: 39, train_loss: 0.8223, test_loss: 0.8530, test_f1: 0.6086
 epoch: 40, train_loss: 0.8198, test_loss: 0.9012, test_f1: 0.5760
 epoch: 41, train_loss: 0.8532, test_loss: 0.9143, test_f1: 0.5888
 epoch: 42, train_loss: 0.8313, test_loss: 0.8992, test_f1: 0.5653
 epoch: 43, train_loss: 0.8237, test_loss: 0.8451, test_f1: 0.5831
 epoch: 44, train_loss: 0.8187, test_loss: 0.9395, test_f1: 0.5062
 epoch: 45, train_loss: 0.8524, test_loss: 0.9166, test_f1: 0.5603
 epoch: 46, train_loss: 0.8252, test_loss: 0.9184, test_f1: 0.5751
 epoch: 47, train_loss: 0.8212, test_loss: 0.9576, test_f1: 0.5353
 epoch: 48, train_loss: 0.8484, test_loss: 0.8935, test_f1: 0.5484
 epoch: 49, train_loss: 0.8338, test_loss: 0.9390, test_f1: 0.5201
 epoch: 50, train_loss: 0.8881, test_loss: 0.8929, test_f1: 0.5597
 epoch: 51, train_loss: 0.8529, test_loss: 0.9151, test_f1: 0.5101
 epoch: 52, train_loss: 0.8274, test_loss: 0.9363, test_f1: 0.5739
 epoch: 53, train_loss: 0.8045, test_loss: 0.8913, test_f1: 0.5575
 epoch: 54, train_loss: 0.8051, test_loss: 0.9834, test_f1: 0.5604
 epoch: 55, train_loss: 0.8118, test_loss: 0.8865, test_f1: 0.5876
 epoch: 56, train_loss: 0.7881, test_loss: 0.9167, test_f1: 0.5903
 epoch: 57, train_loss: 0.7910, test_loss: 0.8836, test_f1: 0.6094
 epoch: 58, train_loss: 0.7782, test_loss: 0.9052, test_f1: 0.6097
 epoch: 59, train_loss: 0.7868, test_loss: 0.8597, test_f1: 0.5805
 epoch: 60, train_loss: 0.7786, test_loss: 0.8765, test_f1: 0.5882
 epoch: 61, train_loss: 0.7726, test_loss: 0.9042, test_f1: 0.5695
 epoch: 62, train_loss: 0.7758, test_loss: 0.8879, test_f1: 0.6216
 epoch: 63, train_loss: 0.7727, test_loss: 0.8600, test_f1: 0.6089
 epoch: 64, train_loss: 0.7727, test_loss: 0.8702, test_f1: 0.6290
 epoch: 65, train_loss: 0.7712, test_loss: 0.9491, test_f1: 0.5975
 epoch: 66, train_loss: 0.7765, test_loss: 0.8875, test_f1: 0.6138
 epoch: 67, train_loss: 0.7659, test_loss: 0.8785, test_f1: 0.6170
 epoch: 68, train_loss: 0.7732, test_loss: 0.8963, test_f1: 0.6302
 epoch: 69, train_loss: 0.7459, test_loss: 0.9055, test_f1: 0.6481
 epoch: 70, train_loss: 0.7569, test_loss: 0.9552, test_f1: 0.5850
 epoch: 71, train_loss: 0.7488, test_loss: 0.8927, test_f1: 0.6165
 epoch: 72, train_loss: 0.7426, test_loss: 0.9121, test_f1: 0.6328
 epoch: 73, train_loss: 0.7453, test_loss: 0.9179, test_f1: 0.6029
 epoch: 74, train_loss: 0.7366, test_loss: 0.9189, test_f1: 0.6341
 epoch: 75, train_loss: 0.7377, test_loss: 0.9049, test_f1: 0.6365
 epoch: 76, train_loss: 0.7549, test_loss: 0.9545, test_f1: 0.6119
 epoch: 77, train_loss: 0.7392, test_loss: 0.9299, test_f1: 0.6137
 epoch: 78, train_loss: 0.7233, test_loss: 0.8965, test_f1: 0.6321
 epoch: 79, train_loss: 0.7405, test_loss: 0.8886, test_f1: 0.6471
 epoch: 80, train_loss: 0.7410, test_loss: 0.9571, test_f1: 0.6105
 epoch: 81, train_loss: 0.7333, test_loss: 0.9088, test_f1: 0.6469
 epoch: 82, train_loss: 0.7312, test_loss: 0.9471, test_f1: 0.6616
 epoch: 83, train_loss: 0.7612, test_loss: 0.8941, test_f1: 0.6238
 epoch: 84, train_loss: 0.7302, test_loss: 0.9363, test_f1: 0.6373
 epoch: 85, train_loss: 0.7392, test_loss: 0.8962, test_f1: 0.6281
 epoch: 86, train_loss: 0.7288, test_loss: 0.8988, test_f1: 0.6049
 epoch: 87, train_loss: 0.7309, test_loss: 0.9310, test_f1: 0.6311
 epoch: 88, train_loss: 0.7437, test_loss: 0.9122, test_f1: 0.6110
 epoch: 89, train_loss: 0.7308, test_loss: 0.9171, test_f1: 0.6487
 epoch: 90, train_loss: 0.7137, test_loss: 0.8743, test_f1: 0.6327
 epoch: 91, train_loss: 0.7148, test_loss: 0.9318, test_f1: 0.6412
 epoch: 92, train_loss: 0.7101, test_loss: 0.9038, test_f1: 0.6579
 epoch: 93, train_loss: 0.7250, test_loss: 0.8779, test_f1: 0.6439
 epoch: 94, train_loss: 0.7351, test_loss: 0.9388, test_f1: 0.6346
 epoch: 95, train_loss: 0.7374, test_loss: 0.8731, test_f1: 0.6475
 epoch: 96, train_loss: 0.7109, test_loss: 0.9195, test_f1: 0.5786
 epoch: 97, train_loss: 0.7369, test_loss: 0.9053, test_f1: 0.6662
 epoch: 98, train_loss: 0.7123, test_loss: 0.8910, test_f1: 0.6288
 epoch: 99, train_loss: 0.7007, test_loss: 0.8930, test_f1: 0.6061
##################ITERATION #9 ****************************************
 epoch: 0, train_loss: 1.1746, test_loss: 1.1179, test_f1: 0.4203
 epoch: 1, train_loss: 1.0333, test_loss: 1.0539, test_f1: 0.4502
 epoch: 2, train_loss: 1.0260, test_loss: 1.0706, test_f1: 0.4264
 epoch: 3, train_loss: 1.0177, test_loss: 0.9930, test_f1: 0.4383
 epoch: 4, train_loss: 0.9988, test_loss: 1.0277, test_f1: 0.4783
 epoch: 5, train_loss: 0.9856, test_loss: 1.0192, test_f1: 0.4413
 epoch: 6, train_loss: 0.9720, test_loss: 1.0122, test_f1: 0.4859
 epoch: 7, train_loss: 0.9587, test_loss: 0.9596, test_f1: 0.4718
 epoch: 8, train_loss: 0.9734, test_loss: 0.9900, test_f1: 0.4534
 epoch: 9, train_loss: 0.9510, test_loss: 1.1600, test_f1: 0.4725
 epoch: 10, train_loss: 0.9573, test_loss: 0.9357, test_f1: 0.5393
 epoch: 11, train_loss: 0.9568, test_loss: 0.9878, test_f1: 0.5263
 epoch: 12, train_loss: 0.9480, test_loss: 1.0093, test_f1: 0.4974
 epoch: 13, train_loss: 0.9367, test_loss: 1.0190, test_f1: 0.5038
 epoch: 14, train_loss: 0.9289, test_loss: 0.9241, test_f1: 0.4976
 epoch: 15, train_loss: 0.9276, test_loss: 1.0209, test_f1: 0.5027
 epoch: 16, train_loss: 0.9281, test_loss: 0.9970, test_f1: 0.4990
 epoch: 17, train_loss: 0.9197, test_loss: 0.9851, test_f1: 0.5251
 epoch: 18, train_loss: 0.9065, test_loss: 0.9322, test_f1: 0.4935
 epoch: 19, train_loss: 0.9040, test_loss: 1.0038, test_f1: 0.5005
 epoch: 20, train_loss: 0.9099, test_loss: 0.9942, test_f1: 0.5290
 epoch: 21, train_loss: 0.9063, test_loss: 1.0336, test_f1: 0.5180
 epoch: 22, train_loss: 0.9132, test_loss: 0.8850, test_f1: 0.5745
 epoch: 23, train_loss: 0.8916, test_loss: 0.9193, test_f1: 0.5029
 epoch: 24, train_loss: 0.8883, test_loss: 1.0508, test_f1: 0.5292
 epoch: 25, train_loss: 0.8898, test_loss: 1.0145, test_f1: 0.5048
 epoch: 26, train_loss: 0.8854, test_loss: 1.0838, test_f1: 0.5162
 epoch: 27, train_loss: 0.8913, test_loss: 0.9765, test_f1: 0.4653
 epoch: 28, train_loss: 0.8721, test_loss: 1.1162, test_f1: 0.5018
 epoch: 29, train_loss: 0.8721, test_loss: 1.1327, test_f1: 0.5230
 epoch: 30, train_loss: 0.8973, test_loss: 1.2102, test_f1: 0.5303
 epoch: 31, train_loss: 0.8791, test_loss: 0.9895, test_f1: 0.5678
 epoch: 32, train_loss: 0.9003, test_loss: 0.9341, test_f1: 0.5249
 epoch: 33, train_loss: 0.8915, test_loss: 0.9882, test_f1: 0.4969
 epoch: 34, train_loss: 0.8680, test_loss: 0.9096, test_f1: 0.5326
 epoch: 35, train_loss: 0.8734, test_loss: 0.9784, test_f1: 0.5718
 epoch: 36, train_loss: 0.8599, test_loss: 0.8868, test_f1: 0.5582
 epoch: 37, train_loss: 0.8577, test_loss: 0.9809, test_f1: 0.5034
 epoch: 38, train_loss: 0.8534, test_loss: 0.9276, test_f1: 0.5311
 epoch: 39, train_loss: 0.8389, test_loss: 0.9109, test_f1: 0.5627
 epoch: 40, train_loss: 0.8807, test_loss: 0.9715, test_f1: 0.5415
 epoch: 41, train_loss: 0.8462, test_loss: 0.9183, test_f1: 0.5886
 epoch: 42, train_loss: 0.8634, test_loss: 0.8739, test_f1: 0.5435
 epoch: 43, train_loss: 0.8355, test_loss: 0.9301, test_f1: 0.5383
 epoch: 44, train_loss: 0.8310, test_loss: 0.9119, test_f1: 0.5802
 epoch: 45, train_loss: 0.8006, test_loss: 0.9654, test_f1: 0.5411
 epoch: 46, train_loss: 0.8331, test_loss: 0.9595, test_f1: 0.5811
 epoch: 47, train_loss: 0.8396, test_loss: 0.9194, test_f1: 0.5529
 epoch: 48, train_loss: 0.8181, test_loss: 0.9681, test_f1: 0.5141
 epoch: 49, train_loss: 0.8150, test_loss: 0.9401, test_f1: 0.5398
 epoch: 50, train_loss: 0.8121, test_loss: 0.9498, test_f1: 0.5383
 epoch: 51, train_loss: 0.7811, test_loss: 0.9379, test_f1: 0.5863
 epoch: 52, train_loss: 0.7890, test_loss: 0.9979, test_f1: 0.5658
 epoch: 53, train_loss: 0.7582, test_loss: 0.9610, test_f1: 0.6146
 epoch: 54, train_loss: 0.7855, test_loss: 0.9843, test_f1: 0.5537
 epoch: 55, train_loss: 0.7658, test_loss: 0.9723, test_f1: 0.5840
 epoch: 56, train_loss: 0.7871, test_loss: 1.1218, test_f1: 0.5297
 epoch: 57, train_loss: 0.7821, test_loss: 1.0084, test_f1: 0.5682
 epoch: 58, train_loss: 0.7543, test_loss: 0.9316, test_f1: 0.6065
 epoch: 59, train_loss: 0.7519, test_loss: 0.9319, test_f1: 0.6164
 epoch: 60, train_loss: 0.7633, test_loss: 0.9402, test_f1: 0.5698
 epoch: 61, train_loss: 0.7677, test_loss: 0.9200, test_f1: 0.6546
 epoch: 62, train_loss: 0.7539, test_loss: 0.9224, test_f1: 0.6030
 epoch: 63, train_loss: 0.7458, test_loss: 0.9332, test_f1: 0.6403
 epoch: 64, train_loss: 0.7503, test_loss: 0.9360, test_f1: 0.5985
 epoch: 65, train_loss: 0.7402, test_loss: 0.9927, test_f1: 0.6207
 epoch: 66, train_loss: 0.7354, test_loss: 0.9655, test_f1: 0.6177
 epoch: 67, train_loss: 0.7585, test_loss: 0.9427, test_f1: 0.6186
 epoch: 68, train_loss: 0.7341, test_loss: 0.9899, test_f1: 0.5886
 epoch: 69, train_loss: 0.7466, test_loss: 0.9091, test_f1: 0.5837
 epoch: 70, train_loss: 0.7476, test_loss: 0.9167, test_f1: 0.5697
 epoch: 71, train_loss: 0.7393, test_loss: 0.9096, test_f1: 0.5819
 epoch: 72, train_loss: 0.7439, test_loss: 0.9492, test_f1: 0.5974
 epoch: 73, train_loss: 0.7438, test_loss: 0.9247, test_f1: 0.6038
 epoch: 74, train_loss: 0.7377, test_loss: 0.9299, test_f1: 0.6247
 epoch: 75, train_loss: 0.7667, test_loss: 0.9191, test_f1: 0.5972
 epoch: 76, train_loss: 0.7351, test_loss: 0.9046, test_f1: 0.6033
 epoch: 77, train_loss: 0.7334, test_loss: 0.9136, test_f1: 0.6229
 epoch: 78, train_loss: 0.7366, test_loss: 0.9747, test_f1: 0.6224
 epoch: 79, train_loss: 0.7346, test_loss: 0.9244, test_f1: 0.6240
 epoch: 80, train_loss: 0.7234, test_loss: 1.0832, test_f1: 0.5819
 epoch: 81, train_loss: 0.7262, test_loss: 1.0673, test_f1: 0.6178
 epoch: 82, train_loss: 0.7234, test_loss: 1.0053, test_f1: 0.6275
 epoch: 83, train_loss: 0.7329, test_loss: 0.9380, test_f1: 0.6142
 epoch: 84, train_loss: 0.7114, test_loss: 1.0162, test_f1: 0.5979
 epoch: 85, train_loss: 0.7421, test_loss: 0.9972, test_f1: 0.5553
 epoch: 86, train_loss: 0.7227, test_loss: 0.9328, test_f1: 0.6346
 epoch: 87, train_loss: 0.7257, test_loss: 0.9372, test_f1: 0.6030
 epoch: 88, train_loss: 0.7134, test_loss: 0.9620, test_f1: 0.6316
 epoch: 89, train_loss: 0.7216, test_loss: 0.9221, test_f1: 0.5837
 epoch: 90, train_loss: 0.7157, test_loss: 0.9723, test_f1: 0.5751
 epoch: 91, train_loss: 0.7206, test_loss: 0.8734, test_f1: 0.6176
 epoch: 92, train_loss: 0.7174, test_loss: 1.0052, test_f1: 0.5997
 epoch: 93, train_loss: 0.7138, test_loss: 0.9817, test_f1: 0.5915
 epoch: 94, train_loss: 0.7087, test_loss: 0.9819, test_f1: 0.6022
 epoch: 95, train_loss: 0.7087, test_loss: 0.9460, test_f1: 0.6149
 epoch: 96, train_loss: 0.7105, test_loss: 0.9492, test_f1: 0.5920
 epoch: 97, train_loss: 0.6891, test_loss: 0.9565, test_f1: 0.6272
 epoch: 98, train_loss: 0.6960, test_loss: 0.9607, test_f1: 0.6283
 epoch: 99, train_loss: 0.6981, test_loss: 0.9034, test_f1: 0.6315

Training completed in 1122.03 seconds
Best F1: 0.6764 at epoch 91
Mean F1 across iterations: 0.6535  0.0132
========================FINAL RESULTS================================
FEGIN weighted F1: 0.6764  0.0132
python main.py --data ltspice_examples --representation component_net --model FEGIN --layers 4 --hiddens 32 --batch_size 32 --lr 0.01 --emb_size 128 --epochs 100 --save_appendix component_net_L4_H32_BS32_LR0.01_E128 --no_val
-----



STDERR:
  File "main.py", line 370, in <module>
    main()
  File "main.py", line 254, in main
    dataset = dataset_class(
  File "/home/philip/projects/ltspice_examples_code_repo/Circuit-Completion-Using-GNNs/component_classification_with_link_prediction_head/evaluation/FEGIN/kernel/circuit_datasets.py", line 15, in __init__
    self.data, self.slices = torch.load(self.processed_paths[0])
  File "/home/philip/.local/lib/python3.8/site-packages/torch/serialization.py", line 1040, in load
    warnings.warn(
  File "/usr/lib/python3.8/warnings.py", line 109, in _showwarnmsg
    sw(msg.message, msg.category, msg.filename, msg.lineno,
  File "main.py", line 47, in warn_with_traceback
    traceback.print_stack(file=log)
/home/philip/projects/ltspice_examples_code_repo/Circuit-Completion-Using-GNNs/component_classification_with_link_prediction_head/evaluation/FEGIN/kernel/circuit_datasets.py:15: FutureWarning: You are using `torch.load` with `weights_only=False` (the current default value), which uses the default pickle module implicitly. It is possible to construct malicious pickle data which will execute arbitrary code during unpickling (See https://github.com/pytorch/pytorch/blob/main/SECURITY.md#untrusted-models for more details). In a future release, the default value for `weights_only` will be flipped to `True`. This limits the functions that could be executed during unpickling. Arbitrary objects will no longer be allowed to be loaded via this mode unless they are explicitly allowlisted by the user via `torch.serialization.add_safe_globals`. We recommend you start setting `weights_only=True` for any use case where you don't have full control of the loaded file. Please open an issue on GitHub for any issues related to this experimental feature.
  self.data, self.slices = torch.load(self.processed_paths[0])
