STDOUT:
Results will be saved in /home/philip/projects/llm_inference_code_repo/Circuit-Completion-Using-GNNs/component_classification_with_link_prediction_head/evaluation/FEGIN/results/model_FEGIN_dataset_ltspice_examples
Command line input: python main.py --data ltspice_examples --representation component_pin --model FEGIN --layers 4 --hiddens 16 --batch_size 64 --lr 0.001 --emb_size 250 --epochs 100 --save_appendix component_pin_L4_H16_BS64_LR0.001_E250 --no_val
 is saved.
-----
ltspice_examples - FEGIN
Using 4 layers, 16 hidden units, h = 2
Loading component_pin representation dataset
ENTERED
Training FEGIN on component_pin representation
Train: 3560, Test: 848
##################ITERATION #0 ****************************************
 epoch: 0, train_loss: 1.3662, test_loss: 1.2716, test_f1: 0.2962
 epoch: 1, train_loss: 1.2463, test_loss: 1.1903, test_f1: 0.2605
 epoch: 2, train_loss: 1.1813, test_loss: 1.1299, test_f1: 0.3314
 epoch: 3, train_loss: 1.1298, test_loss: 1.0792, test_f1: 0.3393
 epoch: 4, train_loss: 1.0851, test_loss: 1.0749, test_f1: 0.3331
 epoch: 5, train_loss: 1.0532, test_loss: 1.0432, test_f1: 0.3986
 epoch: 6, train_loss: 1.0231, test_loss: 1.0093, test_f1: 0.4184
 epoch: 7, train_loss: 1.0216, test_loss: 0.9893, test_f1: 0.4292
 epoch: 8, train_loss: 0.9971, test_loss: 1.0588, test_f1: 0.4319
 epoch: 9, train_loss: 0.9855, test_loss: 1.0263, test_f1: 0.4658
 epoch: 10, train_loss: 0.9740, test_loss: 0.9905, test_f1: 0.4481
 epoch: 11, train_loss: 0.9586, test_loss: 0.9975, test_f1: 0.4777
 epoch: 12, train_loss: 0.9608, test_loss: 1.0926, test_f1: 0.4597
 epoch: 13, train_loss: 0.9508, test_loss: 0.9871, test_f1: 0.4580
 epoch: 14, train_loss: 0.9440, test_loss: 0.9893, test_f1: 0.4846
 epoch: 15, train_loss: 0.9199, test_loss: 0.9680, test_f1: 0.4837
 epoch: 16, train_loss: 0.9197, test_loss: 0.9680, test_f1: 0.4602
 epoch: 17, train_loss: 0.9164, test_loss: 0.9820, test_f1: 0.4964
 epoch: 18, train_loss: 0.9088, test_loss: 0.9894, test_f1: 0.4874
 epoch: 19, train_loss: 0.9007, test_loss: 1.0058, test_f1: 0.4899
 epoch: 20, train_loss: 0.8878, test_loss: 0.9853, test_f1: 0.4999
 epoch: 21, train_loss: 0.8921, test_loss: 1.0326, test_f1: 0.4912
 epoch: 22, train_loss: 0.8826, test_loss: 0.9636, test_f1: 0.5249
 epoch: 23, train_loss: 0.8698, test_loss: 0.9953, test_f1: 0.4876
 epoch: 24, train_loss: 0.8764, test_loss: 0.9769, test_f1: 0.5037
 epoch: 25, train_loss: 0.8642, test_loss: 0.9572, test_f1: 0.5116
 epoch: 26, train_loss: 0.8544, test_loss: 0.9793, test_f1: 0.5030
 epoch: 27, train_loss: 0.8498, test_loss: 0.9817, test_f1: 0.4936
 epoch: 28, train_loss: 0.8403, test_loss: 0.9504, test_f1: 0.5188
 epoch: 29, train_loss: 0.8518, test_loss: 0.9736, test_f1: 0.5156
 epoch: 30, train_loss: 0.8330, test_loss: 0.9816, test_f1: 0.5057
 epoch: 31, train_loss: 0.8262, test_loss: 1.0121, test_f1: 0.5002
 epoch: 32, train_loss: 0.8254, test_loss: 0.9699, test_f1: 0.5120
 epoch: 33, train_loss: 0.8296, test_loss: 0.9389, test_f1: 0.5030
 epoch: 34, train_loss: 0.8229, test_loss: 0.9641, test_f1: 0.5198
 epoch: 35, train_loss: 0.8105, test_loss: 0.9573, test_f1: 0.5089
 epoch: 36, train_loss: 0.8227, test_loss: 1.0341, test_f1: 0.5102
 epoch: 37, train_loss: 0.8213, test_loss: 0.9349, test_f1: 0.5262
 epoch: 38, train_loss: 0.8008, test_loss: 0.9644, test_f1: 0.4977
 epoch: 39, train_loss: 0.7978, test_loss: 0.9750, test_f1: 0.5002
 epoch: 40, train_loss: 0.7929, test_loss: 0.9917, test_f1: 0.5426
 epoch: 41, train_loss: 0.8014, test_loss: 0.9521, test_f1: 0.5513
 epoch: 42, train_loss: 0.7845, test_loss: 0.9652, test_f1: 0.5108
 epoch: 43, train_loss: 0.7886, test_loss: 0.9746, test_f1: 0.5200
 epoch: 44, train_loss: 0.7953, test_loss: 1.2007, test_f1: 0.4806
 epoch: 45, train_loss: 0.8084, test_loss: 0.9780, test_f1: 0.5406
 epoch: 46, train_loss: 0.7893, test_loss: 0.9569, test_f1: 0.5243
 epoch: 47, train_loss: 0.7925, test_loss: 0.9648, test_f1: 0.5248
 epoch: 48, train_loss: 0.7966, test_loss: 0.9910, test_f1: 0.5067
 epoch: 49, train_loss: 0.7720, test_loss: 1.0165, test_f1: 0.4937
 epoch: 50, train_loss: 0.7748, test_loss: 0.9974, test_f1: 0.5033
 epoch: 51, train_loss: 0.7479, test_loss: 0.9850, test_f1: 0.5159
 epoch: 52, train_loss: 0.7674, test_loss: 0.9876, test_f1: 0.5071
 epoch: 53, train_loss: 0.7552, test_loss: 0.9943, test_f1: 0.5126
 epoch: 54, train_loss: 0.7516, test_loss: 0.9805, test_f1: 0.5158
 epoch: 55, train_loss: 0.7456, test_loss: 0.9842, test_f1: 0.5300
 epoch: 56, train_loss: 0.7502, test_loss: 0.9767, test_f1: 0.5117
 epoch: 57, train_loss: 0.7488, test_loss: 0.9972, test_f1: 0.5155
 epoch: 58, train_loss: 0.7516, test_loss: 1.0119, test_f1: 0.5091
 epoch: 59, train_loss: 0.7349, test_loss: 0.9815, test_f1: 0.5087
 epoch: 60, train_loss: 0.7338, test_loss: 0.9858, test_f1: 0.5034
 epoch: 61, train_loss: 0.7346, test_loss: 1.0003, test_f1: 0.5174
 epoch: 62, train_loss: 0.7265, test_loss: 1.0005, test_f1: 0.5177
 epoch: 63, train_loss: 0.7319, test_loss: 0.9990, test_f1: 0.5100
 epoch: 64, train_loss: 0.7313, test_loss: 0.9835, test_f1: 0.5229
 epoch: 65, train_loss: 0.7302, test_loss: 1.0171, test_f1: 0.5215
 epoch: 66, train_loss: 0.7377, test_loss: 0.9967, test_f1: 0.5150
 epoch: 67, train_loss: 0.7327, test_loss: 1.0171, test_f1: 0.5037
 epoch: 68, train_loss: 0.7289, test_loss: 1.0302, test_f1: 0.5057
 epoch: 69, train_loss: 0.7366, test_loss: 1.0400, test_f1: 0.5016
 epoch: 70, train_loss: 0.7328, test_loss: 0.9982, test_f1: 0.5137
 epoch: 71, train_loss: 0.7243, test_loss: 0.9958, test_f1: 0.5222
 epoch: 72, train_loss: 0.7330, test_loss: 0.9927, test_f1: 0.5152
 epoch: 73, train_loss: 0.7280, test_loss: 0.9884, test_f1: 0.5225
 epoch: 74, train_loss: 0.7351, test_loss: 1.0467, test_f1: 0.4965
 epoch: 75, train_loss: 0.7178, test_loss: 1.0137, test_f1: 0.5039
 epoch: 76, train_loss: 0.7386, test_loss: 0.9838, test_f1: 0.5430
 epoch: 77, train_loss: 0.7116, test_loss: 1.0039, test_f1: 0.5259
 epoch: 78, train_loss: 0.7328, test_loss: 1.0038, test_f1: 0.5129
 epoch: 79, train_loss: 0.7102, test_loss: 0.9918, test_f1: 0.5242
 epoch: 80, train_loss: 0.7198, test_loss: 0.9875, test_f1: 0.5315
 epoch: 81, train_loss: 0.7112, test_loss: 1.0187, test_f1: 0.5237
 epoch: 82, train_loss: 0.7187, test_loss: 0.9784, test_f1: 0.5373
 epoch: 83, train_loss: 0.7253, test_loss: 0.9665, test_f1: 0.5254
 epoch: 84, train_loss: 0.7187, test_loss: 1.0122, test_f1: 0.5162
 epoch: 85, train_loss: 0.7222, test_loss: 0.9953, test_f1: 0.5339
 epoch: 86, train_loss: 0.7113, test_loss: 0.9880, test_f1: 0.5205
 epoch: 87, train_loss: 0.7184, test_loss: 1.0079, test_f1: 0.5246
 epoch: 88, train_loss: 0.7148, test_loss: 1.0001, test_f1: 0.5299
 epoch: 89, train_loss: 0.7073, test_loss: 1.0114, test_f1: 0.5316
 epoch: 90, train_loss: 0.7024, test_loss: 1.0025, test_f1: 0.5220
 epoch: 91, train_loss: 0.7042, test_loss: 1.0158, test_f1: 0.5366
 epoch: 92, train_loss: 0.7022, test_loss: 0.9926, test_f1: 0.5301
 epoch: 93, train_loss: 0.7127, test_loss: 1.0104, test_f1: 0.5447
 epoch: 94, train_loss: 0.7083, test_loss: 1.0138, test_f1: 0.5277
 epoch: 95, train_loss: 0.7065, test_loss: 1.0143, test_f1: 0.5215
 epoch: 96, train_loss: 0.7065, test_loss: 1.0276, test_f1: 0.5270
 epoch: 97, train_loss: 0.7100, test_loss: 0.9991, test_f1: 0.5272
 epoch: 98, train_loss: 0.7134, test_loss: 1.0016, test_f1: 0.5240
 epoch: 99, train_loss: 0.7120, test_loss: 1.0016, test_f1: 0.5378
##################ITERATION #1 ****************************************
 epoch: 0, train_loss: 1.2480, test_loss: 1.1842, test_f1: 0.3132
 epoch: 1, train_loss: 1.1639, test_loss: 1.1111, test_f1: 0.3696
 epoch: 2, train_loss: 1.1309, test_loss: 1.0672, test_f1: 0.3605
 epoch: 3, train_loss: 1.0887, test_loss: 1.0522, test_f1: 0.3867
 epoch: 4, train_loss: 1.0563, test_loss: 1.0316, test_f1: 0.3819
 epoch: 5, train_loss: 1.0385, test_loss: 1.0482, test_f1: 0.4315
 epoch: 6, train_loss: 1.0342, test_loss: 1.0325, test_f1: 0.3933
 epoch: 7, train_loss: 1.0167, test_loss: 1.0374, test_f1: 0.4040
 epoch: 8, train_loss: 1.0067, test_loss: 1.0184, test_f1: 0.4766
 epoch: 9, train_loss: 1.0070, test_loss: 1.0245, test_f1: 0.4703
 epoch: 10, train_loss: 0.9995, test_loss: 1.0237, test_f1: 0.4791
 epoch: 11, train_loss: 0.9923, test_loss: 1.0195, test_f1: 0.4557
 epoch: 12, train_loss: 0.9743, test_loss: 1.0376, test_f1: 0.4273
 epoch: 13, train_loss: 0.9785, test_loss: 1.0005, test_f1: 0.4678
 epoch: 14, train_loss: 0.9760, test_loss: 0.9813, test_f1: 0.4716
 epoch: 15, train_loss: 0.9645, test_loss: 0.9783, test_f1: 0.4730
 epoch: 16, train_loss: 0.9662, test_loss: 1.0062, test_f1: 0.4685
 epoch: 17, train_loss: 0.9489, test_loss: 0.9780, test_f1: 0.4882
 epoch: 18, train_loss: 0.9354, test_loss: 0.9994, test_f1: 0.4887
 epoch: 19, train_loss: 0.9291, test_loss: 0.9696, test_f1: 0.4780
 epoch: 20, train_loss: 0.9247, test_loss: 0.9978, test_f1: 0.4824
 epoch: 21, train_loss: 0.9233, test_loss: 0.9721, test_f1: 0.4687
 epoch: 22, train_loss: 0.9142, test_loss: 0.9389, test_f1: 0.4895
 epoch: 23, train_loss: 0.9090, test_loss: 0.9302, test_f1: 0.5096
 epoch: 24, train_loss: 0.9140, test_loss: 0.9765, test_f1: 0.4937
 epoch: 25, train_loss: 0.8961, test_loss: 0.9564, test_f1: 0.4746
 epoch: 26, train_loss: 0.9044, test_loss: 0.9305, test_f1: 0.4995
 epoch: 27, train_loss: 0.8928, test_loss: 0.9558, test_f1: 0.5066
 epoch: 28, train_loss: 0.9008, test_loss: 0.9812, test_f1: 0.5016
 epoch: 29, train_loss: 0.8994, test_loss: 0.9376, test_f1: 0.4878
 epoch: 30, train_loss: 0.8807, test_loss: 1.0167, test_f1: 0.4787
 epoch: 31, train_loss: 0.8870, test_loss: 0.9729, test_f1: 0.4849
 epoch: 32, train_loss: 0.8770, test_loss: 0.9283, test_f1: 0.5160
 epoch: 33, train_loss: 0.8699, test_loss: 0.9205, test_f1: 0.5146
 epoch: 34, train_loss: 0.8722, test_loss: 0.9556, test_f1: 0.4804
 epoch: 35, train_loss: 0.8691, test_loss: 1.0229, test_f1: 0.4731
 epoch: 36, train_loss: 0.8712, test_loss: 0.9495, test_f1: 0.5121
 epoch: 37, train_loss: 0.8562, test_loss: 0.9345, test_f1: 0.4956
 epoch: 38, train_loss: 0.8699, test_loss: 0.9261, test_f1: 0.4997
 epoch: 39, train_loss: 0.8529, test_loss: 0.9043, test_f1: 0.5181
 epoch: 40, train_loss: 0.8453, test_loss: 0.9136, test_f1: 0.4951
 epoch: 41, train_loss: 0.8478, test_loss: 0.9437, test_f1: 0.5016
 epoch: 42, train_loss: 0.8502, test_loss: 0.9339, test_f1: 0.5220
 epoch: 43, train_loss: 0.8523, test_loss: 0.9361, test_f1: 0.4945
 epoch: 44, train_loss: 0.8378, test_loss: 0.8880, test_f1: 0.5172
 epoch: 45, train_loss: 0.8473, test_loss: 0.9465, test_f1: 0.5018
 epoch: 46, train_loss: 0.8345, test_loss: 0.8961, test_f1: 0.5109
 epoch: 47, train_loss: 0.8317, test_loss: 0.9919, test_f1: 0.4797
 epoch: 48, train_loss: 0.8334, test_loss: 0.9262, test_f1: 0.4947
 epoch: 49, train_loss: 0.8307, test_loss: 0.8962, test_f1: 0.5291
 epoch: 50, train_loss: 0.8255, test_loss: 0.9406, test_f1: 0.5055
 epoch: 51, train_loss: 0.8230, test_loss: 0.9201, test_f1: 0.5214
 epoch: 52, train_loss: 0.8148, test_loss: 0.9180, test_f1: 0.5181
 epoch: 53, train_loss: 0.8013, test_loss: 0.9062, test_f1: 0.5102
 epoch: 54, train_loss: 0.7986, test_loss: 0.8973, test_f1: 0.5237
 epoch: 55, train_loss: 0.8096, test_loss: 0.9752, test_f1: 0.4848
 epoch: 56, train_loss: 0.7985, test_loss: 0.8950, test_f1: 0.5070
 epoch: 57, train_loss: 0.7936, test_loss: 0.9099, test_f1: 0.5136
 epoch: 58, train_loss: 0.7969, test_loss: 0.9525, test_f1: 0.5013
 epoch: 59, train_loss: 0.8037, test_loss: 0.9423, test_f1: 0.4885
 epoch: 60, train_loss: 0.7907, test_loss: 0.8894, test_f1: 0.5193
 epoch: 61, train_loss: 0.8038, test_loss: 0.9482, test_f1: 0.4954
 epoch: 62, train_loss: 0.7993, test_loss: 0.9497, test_f1: 0.5115
 epoch: 63, train_loss: 0.7996, test_loss: 0.9086, test_f1: 0.5225
 epoch: 64, train_loss: 0.7901, test_loss: 0.9049, test_f1: 0.5001
 epoch: 65, train_loss: 0.7870, test_loss: 0.9048, test_f1: 0.5207
 epoch: 66, train_loss: 0.7753, test_loss: 0.9251, test_f1: 0.5037
 epoch: 67, train_loss: 0.7946, test_loss: 0.9207, test_f1: 0.5061
 epoch: 68, train_loss: 0.7847, test_loss: 0.9492, test_f1: 0.5017
 epoch: 69, train_loss: 0.7913, test_loss: 0.9273, test_f1: 0.5193
 epoch: 70, train_loss: 0.7897, test_loss: 0.9365, test_f1: 0.5087
 epoch: 71, train_loss: 0.7741, test_loss: 0.9486, test_f1: 0.5022
 epoch: 72, train_loss: 0.7730, test_loss: 0.9487, test_f1: 0.4897
 epoch: 73, train_loss: 0.7779, test_loss: 0.9169, test_f1: 0.5098
 epoch: 74, train_loss: 0.7759, test_loss: 0.9089, test_f1: 0.5081
 epoch: 75, train_loss: 0.7723, test_loss: 0.9245, test_f1: 0.5081
 epoch: 76, train_loss: 0.7833, test_loss: 0.9121, test_f1: 0.5174
 epoch: 77, train_loss: 0.7714, test_loss: 0.9441, test_f1: 0.5000
 epoch: 78, train_loss: 0.7733, test_loss: 0.9248, test_f1: 0.5076
 epoch: 79, train_loss: 0.7693, test_loss: 0.9766, test_f1: 0.4916
 epoch: 80, train_loss: 0.7888, test_loss: 0.9108, test_f1: 0.5099
 epoch: 81, train_loss: 0.7770, test_loss: 0.9148, test_f1: 0.5083
 epoch: 82, train_loss: 0.7754, test_loss: 0.9868, test_f1: 0.4992
 epoch: 83, train_loss: 0.7640, test_loss: 0.8917, test_f1: 0.5083
 epoch: 84, train_loss: 0.7694, test_loss: 0.9096, test_f1: 0.5038
 epoch: 85, train_loss: 0.7680, test_loss: 0.9345, test_f1: 0.5066
 epoch: 86, train_loss: 0.7515, test_loss: 0.9062, test_f1: 0.5158
 epoch: 87, train_loss: 0.7621, test_loss: 0.9445, test_f1: 0.5052
 epoch: 88, train_loss: 0.7671, test_loss: 0.9228, test_f1: 0.4945
 epoch: 89, train_loss: 0.7619, test_loss: 0.8973, test_f1: 0.5121
 epoch: 90, train_loss: 0.7666, test_loss: 0.9226, test_f1: 0.5129
 epoch: 91, train_loss: 0.7606, test_loss: 0.9127, test_f1: 0.5156
 epoch: 92, train_loss: 0.7562, test_loss: 0.9115, test_f1: 0.5168
 epoch: 93, train_loss: 0.7686, test_loss: 0.9285, test_f1: 0.5121
 epoch: 94, train_loss: 0.7676, test_loss: 0.9167, test_f1: 0.5303
 epoch: 95, train_loss: 0.7666, test_loss: 0.9063, test_f1: 0.5291
 epoch: 96, train_loss: 0.7600, test_loss: 0.9092, test_f1: 0.5238
 epoch: 97, train_loss: 0.7456, test_loss: 0.9074, test_f1: 0.5170
 epoch: 98, train_loss: 0.7467, test_loss: 0.8973, test_f1: 0.5300
 epoch: 99, train_loss: 0.7499, test_loss: 0.9095, test_f1: 0.5230
##################ITERATION #2 ****************************************
 epoch: 0, train_loss: 1.2359, test_loss: 1.2663, test_f1: 0.3009
 epoch: 1, train_loss: 1.1026, test_loss: 1.0319, test_f1: 0.4408
 epoch: 2, train_loss: 1.0627, test_loss: 1.0057, test_f1: 0.4456
 epoch: 3, train_loss: 1.0353, test_loss: 1.0012, test_f1: 0.4513
 epoch: 4, train_loss: 1.0302, test_loss: 1.0153, test_f1: 0.4460
 epoch: 5, train_loss: 0.9991, test_loss: 0.9634, test_f1: 0.4181
 epoch: 6, train_loss: 0.9934, test_loss: 0.9957, test_f1: 0.4731
 epoch: 7, train_loss: 0.9753, test_loss: 0.9460, test_f1: 0.4967
 epoch: 8, train_loss: 0.9626, test_loss: 0.9462, test_f1: 0.5063
 epoch: 9, train_loss: 0.9424, test_loss: 0.9099, test_f1: 0.5063
 epoch: 10, train_loss: 0.9541, test_loss: 0.9021, test_f1: 0.5120
 epoch: 11, train_loss: 0.9262, test_loss: 0.9022, test_f1: 0.5069
 epoch: 12, train_loss: 0.9234, test_loss: 0.9106, test_f1: 0.5198
 epoch: 13, train_loss: 0.9077, test_loss: 0.8655, test_f1: 0.5505
 epoch: 14, train_loss: 0.8997, test_loss: 0.8683, test_f1: 0.5063
 epoch: 15, train_loss: 0.8939, test_loss: 0.8969, test_f1: 0.5073
 epoch: 16, train_loss: 0.8889, test_loss: 0.8676, test_f1: 0.5281
 epoch: 17, train_loss: 0.8834, test_loss: 0.8489, test_f1: 0.5305
 epoch: 18, train_loss: 0.8833, test_loss: 0.8346, test_f1: 0.5196
 epoch: 19, train_loss: 0.8701, test_loss: 0.8741, test_f1: 0.5290
 epoch: 20, train_loss: 0.8723, test_loss: 0.8483, test_f1: 0.5333
 epoch: 21, train_loss: 0.8706, test_loss: 0.8334, test_f1: 0.5415
 epoch: 22, train_loss: 0.8735, test_loss: 0.8100, test_f1: 0.5347
 epoch: 23, train_loss: 0.8638, test_loss: 0.8659, test_f1: 0.5156
 epoch: 24, train_loss: 0.8511, test_loss: 0.8884, test_f1: 0.5198
 epoch: 25, train_loss: 0.8490, test_loss: 0.8576, test_f1: 0.5355
 epoch: 26, train_loss: 0.8540, test_loss: 0.8465, test_f1: 0.5280
 epoch: 27, train_loss: 0.8537, test_loss: 0.7850, test_f1: 0.5650
 epoch: 28, train_loss: 0.8448, test_loss: 0.8189, test_f1: 0.5513
 epoch: 29, train_loss: 0.8331, test_loss: 0.8955, test_f1: 0.5021
 epoch: 30, train_loss: 0.8441, test_loss: 0.8302, test_f1: 0.5257
 epoch: 31, train_loss: 0.8359, test_loss: 0.8073, test_f1: 0.5280
 epoch: 32, train_loss: 0.8326, test_loss: 0.8670, test_f1: 0.5292
 epoch: 33, train_loss: 0.8391, test_loss: 0.8427, test_f1: 0.5248
 epoch: 34, train_loss: 0.8092, test_loss: 0.8490, test_f1: 0.5161
 epoch: 35, train_loss: 0.8376, test_loss: 0.8006, test_f1: 0.5445
 epoch: 36, train_loss: 0.8096, test_loss: 0.9009, test_f1: 0.5224
 epoch: 37, train_loss: 0.8080, test_loss: 0.8515, test_f1: 0.5225
 epoch: 38, train_loss: 0.8099, test_loss: 0.8273, test_f1: 0.5229
 epoch: 39, train_loss: 0.8041, test_loss: 0.8128, test_f1: 0.5471
 epoch: 40, train_loss: 0.8034, test_loss: 0.8316, test_f1: 0.5363
 epoch: 41, train_loss: 0.8033, test_loss: 0.8029, test_f1: 0.5530
 epoch: 42, train_loss: 0.7955, test_loss: 0.8492, test_f1: 0.5528
 epoch: 43, train_loss: 0.7938, test_loss: 0.8085, test_f1: 0.5473
 epoch: 44, train_loss: 0.7915, test_loss: 0.8971, test_f1: 0.5224
 epoch: 45, train_loss: 0.7909, test_loss: 0.8776, test_f1: 0.5491
 epoch: 46, train_loss: 0.7864, test_loss: 0.7972, test_f1: 0.5517
 epoch: 47, train_loss: 0.7898, test_loss: 0.8277, test_f1: 0.5387
 epoch: 48, train_loss: 0.7933, test_loss: 0.8090, test_f1: 0.5483
 epoch: 49, train_loss: 0.7853, test_loss: 0.8940, test_f1: 0.5151
 epoch: 50, train_loss: 0.7824, test_loss: 0.8636, test_f1: 0.5443
 epoch: 51, train_loss: 0.7761, test_loss: 0.8335, test_f1: 0.5407
 epoch: 52, train_loss: 0.7554, test_loss: 0.8782, test_f1: 0.5201
 epoch: 53, train_loss: 0.7614, test_loss: 0.8321, test_f1: 0.5412
 epoch: 54, train_loss: 0.7626, test_loss: 0.8975, test_f1: 0.5118
 epoch: 55, train_loss: 0.7619, test_loss: 0.8646, test_f1: 0.5327
 epoch: 56, train_loss: 0.7642, test_loss: 0.8500, test_f1: 0.5370
 epoch: 57, train_loss: 0.7616, test_loss: 0.8584, test_f1: 0.5435
 epoch: 58, train_loss: 0.7570, test_loss: 0.8694, test_f1: 0.5277
 epoch: 59, train_loss: 0.7547, test_loss: 0.8584, test_f1: 0.5469
 epoch: 60, train_loss: 0.7497, test_loss: 0.8156, test_f1: 0.5472
 epoch: 61, train_loss: 0.7548, test_loss: 0.7963, test_f1: 0.5457
 epoch: 62, train_loss: 0.7561, test_loss: 0.8077, test_f1: 0.5503
 epoch: 63, train_loss: 0.7595, test_loss: 0.8097, test_f1: 0.5479
 epoch: 64, train_loss: 0.7493, test_loss: 0.8670, test_f1: 0.5415
 epoch: 65, train_loss: 0.7414, test_loss: 0.8705, test_f1: 0.5468
 epoch: 66, train_loss: 0.7483, test_loss: 0.7890, test_f1: 0.5592
 epoch: 67, train_loss: 0.7609, test_loss: 0.8116, test_f1: 0.5383
 epoch: 68, train_loss: 0.7538, test_loss: 0.8273, test_f1: 0.5529
 epoch: 69, train_loss: 0.7510, test_loss: 0.8635, test_f1: 0.5335
 epoch: 70, train_loss: 0.7446, test_loss: 0.8396, test_f1: 0.5462
 epoch: 71, train_loss: 0.7449, test_loss: 0.8520, test_f1: 0.5478
 epoch: 72, train_loss: 0.7529, test_loss: 0.8393, test_f1: 0.5474
 epoch: 73, train_loss: 0.7488, test_loss: 0.8043, test_f1: 0.5596
 epoch: 74, train_loss: 0.7339, test_loss: 0.8439, test_f1: 0.5486
 epoch: 75, train_loss: 0.7406, test_loss: 0.8812, test_f1: 0.5356
 epoch: 76, train_loss: 0.7484, test_loss: 0.8604, test_f1: 0.5525
 epoch: 77, train_loss: 0.7413, test_loss: 0.8264, test_f1: 0.5580
 epoch: 78, train_loss: 0.7363, test_loss: 0.8813, test_f1: 0.5367
 epoch: 79, train_loss: 0.7405, test_loss: 0.8236, test_f1: 0.5684
 epoch: 80, train_loss: 0.7257, test_loss: 0.7999, test_f1: 0.5560
 epoch: 81, train_loss: 0.7346, test_loss: 0.8656, test_f1: 0.5447
 epoch: 82, train_loss: 0.7337, test_loss: 0.8721, test_f1: 0.5326
 epoch: 83, train_loss: 0.7407, test_loss: 0.8591, test_f1: 0.5457
 epoch: 84, train_loss: 0.7406, test_loss: 0.8268, test_f1: 0.5582
 epoch: 85, train_loss: 0.7212, test_loss: 0.8493, test_f1: 0.5513
 epoch: 86, train_loss: 0.7365, test_loss: 0.8100, test_f1: 0.5600
 epoch: 87, train_loss: 0.7477, test_loss: 0.8473, test_f1: 0.5424
 epoch: 88, train_loss: 0.7281, test_loss: 0.8333, test_f1: 0.5374
 epoch: 89, train_loss: 0.7190, test_loss: 0.8425, test_f1: 0.5486
 epoch: 90, train_loss: 0.7357, test_loss: 0.8733, test_f1: 0.5443
 epoch: 91, train_loss: 0.7298, test_loss: 0.8168, test_f1: 0.5544
 epoch: 92, train_loss: 0.7227, test_loss: 0.8115, test_f1: 0.5609
 epoch: 93, train_loss: 0.7399, test_loss: 0.8931, test_f1: 0.5394
 epoch: 94, train_loss: 0.7305, test_loss: 0.8310, test_f1: 0.5548
 epoch: 95, train_loss: 0.7211, test_loss: 0.8464, test_f1: 0.5410
 epoch: 96, train_loss: 0.7342, test_loss: 0.8441, test_f1: 0.5478
 epoch: 97, train_loss: 0.7295, test_loss: 0.8295, test_f1: 0.5529
 epoch: 98, train_loss: 0.7352, test_loss: 0.8365, test_f1: 0.5454
 epoch: 99, train_loss: 0.7335, test_loss: 0.8821, test_f1: 0.5405
##################ITERATION #3 ****************************************
 epoch: 0, train_loss: 1.1905, test_loss: 1.0870, test_f1: 0.4349
 epoch: 1, train_loss: 1.0925, test_loss: 1.0741, test_f1: 0.3504
 epoch: 2, train_loss: 1.0678, test_loss: 1.0413, test_f1: 0.4270
 epoch: 3, train_loss: 1.0407, test_loss: 1.0405, test_f1: 0.3956
 epoch: 4, train_loss: 1.0265, test_loss: 1.0336, test_f1: 0.4633
 epoch: 5, train_loss: 1.0136, test_loss: 1.0100, test_f1: 0.4690
 epoch: 6, train_loss: 0.9955, test_loss: 1.0390, test_f1: 0.4252
 epoch: 7, train_loss: 0.9921, test_loss: 1.0382, test_f1: 0.4384
 epoch: 8, train_loss: 0.9789, test_loss: 0.9653, test_f1: 0.4995
 epoch: 9, train_loss: 0.9701, test_loss: 0.9914, test_f1: 0.4894
 epoch: 10, train_loss: 0.9659, test_loss: 0.9827, test_f1: 0.4866
 epoch: 11, train_loss: 0.9619, test_loss: 0.9782, test_f1: 0.4964
 epoch: 12, train_loss: 0.9478, test_loss: 0.9188, test_f1: 0.5003
 epoch: 13, train_loss: 0.9427, test_loss: 0.9474, test_f1: 0.5104
 epoch: 14, train_loss: 0.9388, test_loss: 0.9054, test_f1: 0.4898
 epoch: 15, train_loss: 0.9292, test_loss: 0.9534, test_f1: 0.4933
 epoch: 16, train_loss: 0.9241, test_loss: 0.9150, test_f1: 0.5088
 epoch: 17, train_loss: 0.9104, test_loss: 0.9070, test_f1: 0.5082
 epoch: 18, train_loss: 0.9092, test_loss: 0.9156, test_f1: 0.5021
 epoch: 19, train_loss: 0.9054, test_loss: 0.8969, test_f1: 0.5117
 epoch: 20, train_loss: 0.8870, test_loss: 0.9579, test_f1: 0.4783
 epoch: 21, train_loss: 0.8935, test_loss: 0.9010, test_f1: 0.5153
 epoch: 22, train_loss: 0.8807, test_loss: 0.9564, test_f1: 0.4848
 epoch: 23, train_loss: 0.8850, test_loss: 0.9502, test_f1: 0.4919
 epoch: 24, train_loss: 0.8774, test_loss: 0.8967, test_f1: 0.5088
 epoch: 25, train_loss: 0.8738, test_loss: 0.9441, test_f1: 0.4972
 epoch: 26, train_loss: 0.8662, test_loss: 0.8798, test_f1: 0.5386
 epoch: 27, train_loss: 0.8672, test_loss: 0.9041, test_f1: 0.5272
 epoch: 28, train_loss: 0.8623, test_loss: 0.9392, test_f1: 0.5207
 epoch: 29, train_loss: 0.8536, test_loss: 0.8680, test_f1: 0.5279
 epoch: 30, train_loss: 0.8434, test_loss: 0.8827, test_f1: 0.5324
 epoch: 31, train_loss: 0.8371, test_loss: 0.8655, test_f1: 0.5275
 epoch: 32, train_loss: 0.8549, test_loss: 0.8386, test_f1: 0.5367
 epoch: 33, train_loss: 0.8382, test_loss: 0.8897, test_f1: 0.5126
 epoch: 34, train_loss: 0.8405, test_loss: 0.8767, test_f1: 0.5314
 epoch: 35, train_loss: 0.8389, test_loss: 0.8507, test_f1: 0.5390
 epoch: 36, train_loss: 0.8453, test_loss: 0.8408, test_f1: 0.5370
 epoch: 37, train_loss: 0.8331, test_loss: 0.8691, test_f1: 0.5495
 epoch: 38, train_loss: 0.8130, test_loss: 0.9005, test_f1: 0.5175
 epoch: 39, train_loss: 0.8229, test_loss: 0.8761, test_f1: 0.5298
 epoch: 40, train_loss: 0.8115, test_loss: 0.8518, test_f1: 0.5418
 epoch: 41, train_loss: 0.8117, test_loss: 0.8607, test_f1: 0.5424
 epoch: 42, train_loss: 0.8171, test_loss: 0.8735, test_f1: 0.5356
 epoch: 43, train_loss: 0.8085, test_loss: 0.8539, test_f1: 0.5506
 epoch: 44, train_loss: 0.8136, test_loss: 0.8404, test_f1: 0.5538
 epoch: 45, train_loss: 0.8003, test_loss: 0.8162, test_f1: 0.5505
 epoch: 46, train_loss: 0.7923, test_loss: 0.8767, test_f1: 0.5277
 epoch: 47, train_loss: 0.8082, test_loss: 0.8285, test_f1: 0.5247
 epoch: 48, train_loss: 0.7910, test_loss: 0.9153, test_f1: 0.5155
 epoch: 49, train_loss: 0.7855, test_loss: 0.9020, test_f1: 0.5061
 epoch: 50, train_loss: 0.7879, test_loss: 0.8633, test_f1: 0.5563
 epoch: 51, train_loss: 0.7802, test_loss: 0.8590, test_f1: 0.5424
 epoch: 52, train_loss: 0.7762, test_loss: 0.8483, test_f1: 0.5387
 epoch: 53, train_loss: 0.7893, test_loss: 0.8484, test_f1: 0.5409
 epoch: 54, train_loss: 0.7826, test_loss: 0.8561, test_f1: 0.5373
 epoch: 55, train_loss: 0.7664, test_loss: 0.8506, test_f1: 0.5470
 epoch: 56, train_loss: 0.7695, test_loss: 0.8658, test_f1: 0.5430
 epoch: 57, train_loss: 0.7639, test_loss: 0.8405, test_f1: 0.5528
 epoch: 58, train_loss: 0.7643, test_loss: 0.8318, test_f1: 0.5577
 epoch: 59, train_loss: 0.7647, test_loss: 0.8442, test_f1: 0.5431
 epoch: 60, train_loss: 0.7696, test_loss: 0.8328, test_f1: 0.5509
 epoch: 61, train_loss: 0.7686, test_loss: 0.8280, test_f1: 0.5599
 epoch: 62, train_loss: 0.7646, test_loss: 0.8344, test_f1: 0.5486
 epoch: 63, train_loss: 0.7630, test_loss: 0.8410, test_f1: 0.5417
 epoch: 64, train_loss: 0.7560, test_loss: 0.8472, test_f1: 0.5470
 epoch: 65, train_loss: 0.7572, test_loss: 0.8398, test_f1: 0.5489
 epoch: 66, train_loss: 0.7577, test_loss: 0.8520, test_f1: 0.5431
 epoch: 67, train_loss: 0.7676, test_loss: 0.8371, test_f1: 0.5500
 epoch: 68, train_loss: 0.7455, test_loss: 0.8511, test_f1: 0.5503
 epoch: 69, train_loss: 0.7574, test_loss: 0.8355, test_f1: 0.5536
 epoch: 70, train_loss: 0.7532, test_loss: 0.8260, test_f1: 0.5503
 epoch: 71, train_loss: 0.7476, test_loss: 0.8474, test_f1: 0.5459
 epoch: 72, train_loss: 0.7414, test_loss: 0.8258, test_f1: 0.5491
 epoch: 73, train_loss: 0.7617, test_loss: 0.8319, test_f1: 0.5382
 epoch: 74, train_loss: 0.7509, test_loss: 0.8283, test_f1: 0.5316
 epoch: 75, train_loss: 0.7630, test_loss: 0.8327, test_f1: 0.5469
 epoch: 76, train_loss: 0.7410, test_loss: 0.8241, test_f1: 0.5472
 epoch: 77, train_loss: 0.7415, test_loss: 0.8466, test_f1: 0.5346
 epoch: 78, train_loss: 0.7470, test_loss: 0.8280, test_f1: 0.5492
 epoch: 79, train_loss: 0.7438, test_loss: 0.8371, test_f1: 0.5473
 epoch: 80, train_loss: 0.7329, test_loss: 0.8267, test_f1: 0.5552
 epoch: 81, train_loss: 0.7434, test_loss: 0.8307, test_f1: 0.5383
 epoch: 82, train_loss: 0.7486, test_loss: 0.8509, test_f1: 0.5369
 epoch: 83, train_loss: 0.7525, test_loss: 0.8037, test_f1: 0.5461
 epoch: 84, train_loss: 0.7427, test_loss: 0.8321, test_f1: 0.5374
 epoch: 85, train_loss: 0.7363, test_loss: 0.8451, test_f1: 0.5666
 epoch: 86, train_loss: 0.7452, test_loss: 0.8477, test_f1: 0.5651
 epoch: 87, train_loss: 0.7277, test_loss: 0.8154, test_f1: 0.5625
 epoch: 88, train_loss: 0.7456, test_loss: 0.8303, test_f1: 0.5420
 epoch: 89, train_loss: 0.7346, test_loss: 0.8371, test_f1: 0.5413
 epoch: 90, train_loss: 0.7446, test_loss: 0.8488, test_f1: 0.5356
 epoch: 91, train_loss: 0.7334, test_loss: 0.8179, test_f1: 0.5650
 epoch: 92, train_loss: 0.7340, test_loss: 0.9060, test_f1: 0.5134
 epoch: 93, train_loss: 0.7281, test_loss: 0.8269, test_f1: 0.5451
 epoch: 94, train_loss: 0.7317, test_loss: 0.8587, test_f1: 0.5423
 epoch: 95, train_loss: 0.7390, test_loss: 0.8197, test_f1: 0.5631
 epoch: 96, train_loss: 0.7341, test_loss: 0.8179, test_f1: 0.5529
 epoch: 97, train_loss: 0.7191, test_loss: 0.8592, test_f1: 0.5535
 epoch: 98, train_loss: 0.7387, test_loss: 0.8415, test_f1: 0.5519
 epoch: 99, train_loss: 0.7282, test_loss: 0.8560, test_f1: 0.5372
##################ITERATION #4 ****************************************
 epoch: 0, train_loss: 1.2407, test_loss: 1.1745, test_f1: 0.2772
 epoch: 1, train_loss: 1.1277, test_loss: 1.0484, test_f1: 0.3510
 epoch: 2, train_loss: 1.0865, test_loss: 1.0362, test_f1: 0.3708
 epoch: 3, train_loss: 1.0483, test_loss: 1.0125, test_f1: 0.4093
 epoch: 4, train_loss: 1.0353, test_loss: 1.0098, test_f1: 0.4316
 epoch: 5, train_loss: 1.0174, test_loss: 0.9808, test_f1: 0.4399
 epoch: 6, train_loss: 0.9846, test_loss: 0.9705, test_f1: 0.4769
 epoch: 7, train_loss: 0.9802, test_loss: 0.9751, test_f1: 0.4905
 epoch: 8, train_loss: 0.9649, test_loss: 0.9670, test_f1: 0.5069
 epoch: 9, train_loss: 0.9574, test_loss: 1.0842, test_f1: 0.4229
 epoch: 10, train_loss: 0.9488, test_loss: 0.9877, test_f1: 0.4896
 epoch: 11, train_loss: 0.9370, test_loss: 0.9690, test_f1: 0.5030
 epoch: 12, train_loss: 0.9331, test_loss: 0.9590, test_f1: 0.5023
 epoch: 13, train_loss: 0.9208, test_loss: 0.9321, test_f1: 0.5157
 epoch: 14, train_loss: 0.9154, test_loss: 0.9991, test_f1: 0.4892
 epoch: 15, train_loss: 0.9016, test_loss: 0.9464, test_f1: 0.5251
 epoch: 16, train_loss: 0.9025, test_loss: 0.9266, test_f1: 0.5192
 epoch: 17, train_loss: 0.8885, test_loss: 0.9213, test_f1: 0.5178
 epoch: 18, train_loss: 0.8941, test_loss: 0.9890, test_f1: 0.4723
 epoch: 19, train_loss: 0.8767, test_loss: 0.9506, test_f1: 0.5018
 epoch: 20, train_loss: 0.8778, test_loss: 0.9347, test_f1: 0.5243
 epoch: 21, train_loss: 0.8805, test_loss: 0.9136, test_f1: 0.5422
 epoch: 22, train_loss: 0.8621, test_loss: 0.9593, test_f1: 0.5170
 epoch: 23, train_loss: 0.8694, test_loss: 0.9298, test_f1: 0.5291
 epoch: 24, train_loss: 0.8529, test_loss: 0.9062, test_f1: 0.5389
 epoch: 25, train_loss: 0.8553, test_loss: 0.9199, test_f1: 0.5312
 epoch: 26, train_loss: 0.8594, test_loss: 0.9426, test_f1: 0.5292
 epoch: 27, train_loss: 0.8426, test_loss: 0.9201, test_f1: 0.5212
 epoch: 28, train_loss: 0.8490, test_loss: 0.9336, test_f1: 0.5294
 epoch: 29, train_loss: 0.8374, test_loss: 0.8917, test_f1: 0.5456
 epoch: 30, train_loss: 0.8370, test_loss: 0.9155, test_f1: 0.5339
 epoch: 31, train_loss: 0.8400, test_loss: 0.9498, test_f1: 0.5348
 epoch: 32, train_loss: 0.8239, test_loss: 0.9571, test_f1: 0.5115
 epoch: 33, train_loss: 0.8171, test_loss: 0.9848, test_f1: 0.5069
 epoch: 34, train_loss: 0.8257, test_loss: 0.9282, test_f1: 0.5366
 epoch: 35, train_loss: 0.8148, test_loss: 0.9444, test_f1: 0.5273
 epoch: 36, train_loss: 0.8202, test_loss: 0.9712, test_f1: 0.5043
 epoch: 37, train_loss: 0.8105, test_loss: 0.9443, test_f1: 0.5373
 epoch: 38, train_loss: 0.7969, test_loss: 0.9337, test_f1: 0.5337
 epoch: 39, train_loss: 0.8019, test_loss: 0.9311, test_f1: 0.5355
 epoch: 40, train_loss: 0.8081, test_loss: 0.9184, test_f1: 0.5451
 epoch: 41, train_loss: 0.8007, test_loss: 0.9388, test_f1: 0.5081
 epoch: 42, train_loss: 0.7958, test_loss: 0.9100, test_f1: 0.5515
 epoch: 43, train_loss: 0.8009, test_loss: 0.8994, test_f1: 0.5615
 epoch: 44, train_loss: 0.7973, test_loss: 0.9017, test_f1: 0.5563
 epoch: 45, train_loss: 0.7932, test_loss: 0.9233, test_f1: 0.5372
 epoch: 46, train_loss: 0.7926, test_loss: 0.9406, test_f1: 0.5145
 epoch: 47, train_loss: 0.7886, test_loss: 0.9309, test_f1: 0.5260
 epoch: 48, train_loss: 0.7822, test_loss: 0.9088, test_f1: 0.5625
 epoch: 49, train_loss: 0.7810, test_loss: 0.9182, test_f1: 0.5596
 epoch: 50, train_loss: 0.7761, test_loss: 0.9876, test_f1: 0.4875
 epoch: 51, train_loss: 0.7813, test_loss: 0.8788, test_f1: 0.5571
 epoch: 52, train_loss: 0.7605, test_loss: 0.9117, test_f1: 0.5645
 epoch: 53, train_loss: 0.7565, test_loss: 0.9333, test_f1: 0.5524
 epoch: 54, train_loss: 0.7595, test_loss: 0.9545, test_f1: 0.5016
 epoch: 55, train_loss: 0.7544, test_loss: 0.9271, test_f1: 0.5577
 epoch: 56, train_loss: 0.7663, test_loss: 0.9384, test_f1: 0.5305
 epoch: 57, train_loss: 0.7570, test_loss: 0.9318, test_f1: 0.5544
 epoch: 58, train_loss: 0.7664, test_loss: 0.9438, test_f1: 0.5534
 epoch: 59, train_loss: 0.7549, test_loss: 0.9013, test_f1: 0.5597
 epoch: 60, train_loss: 0.7473, test_loss: 0.9187, test_f1: 0.5453
 epoch: 61, train_loss: 0.7579, test_loss: 0.8970, test_f1: 0.5757
 epoch: 62, train_loss: 0.7505, test_loss: 0.9078, test_f1: 0.5574
 epoch: 63, train_loss: 0.7494, test_loss: 0.8961, test_f1: 0.5790
 epoch: 64, train_loss: 0.7477, test_loss: 0.9427, test_f1: 0.5610
 epoch: 65, train_loss: 0.7607, test_loss: 0.9231, test_f1: 0.5542
 epoch: 66, train_loss: 0.7466, test_loss: 0.9513, test_f1: 0.5425
 epoch: 67, train_loss: 0.7402, test_loss: 0.9363, test_f1: 0.5298
 epoch: 68, train_loss: 0.7383, test_loss: 0.9564, test_f1: 0.5240
 epoch: 69, train_loss: 0.7411, test_loss: 0.9481, test_f1: 0.5476
 epoch: 70, train_loss: 0.7350, test_loss: 0.9259, test_f1: 0.5729
 epoch: 71, train_loss: 0.7446, test_loss: 0.9257, test_f1: 0.5639
 epoch: 72, train_loss: 0.7389, test_loss: 0.9874, test_f1: 0.5569
 epoch: 73, train_loss: 0.7379, test_loss: 0.9261, test_f1: 0.5673
 epoch: 74, train_loss: 0.7321, test_loss: 0.9200, test_f1: 0.5660
 epoch: 75, train_loss: 0.7450, test_loss: 0.9270, test_f1: 0.5558
 epoch: 76, train_loss: 0.7317, test_loss: 0.9552, test_f1: 0.5398
 epoch: 77, train_loss: 0.7369, test_loss: 0.9738, test_f1: 0.5172
 epoch: 78, train_loss: 0.7417, test_loss: 0.9175, test_f1: 0.5655
 epoch: 79, train_loss: 0.7290, test_loss: 0.9010, test_f1: 0.5643
 epoch: 80, train_loss: 0.7341, test_loss: 0.9448, test_f1: 0.5619
 epoch: 81, train_loss: 0.7232, test_loss: 0.9343, test_f1: 0.5495
 epoch: 82, train_loss: 0.7250, test_loss: 0.9497, test_f1: 0.5602
 epoch: 83, train_loss: 0.7236, test_loss: 0.9033, test_f1: 0.5685
 epoch: 84, train_loss: 0.7293, test_loss: 0.9192, test_f1: 0.5732
 epoch: 85, train_loss: 0.7296, test_loss: 0.9429, test_f1: 0.5452
 epoch: 86, train_loss: 0.7273, test_loss: 0.9225, test_f1: 0.5588
 epoch: 87, train_loss: 0.7150, test_loss: 0.9306, test_f1: 0.5461
 epoch: 88, train_loss: 0.7274, test_loss: 0.9928, test_f1: 0.5324
 epoch: 89, train_loss: 0.7201, test_loss: 0.9255, test_f1: 0.5647
 epoch: 90, train_loss: 0.7265, test_loss: 0.9510, test_f1: 0.5458
 epoch: 91, train_loss: 0.7239, test_loss: 0.9213, test_f1: 0.5530
 epoch: 92, train_loss: 0.7296, test_loss: 1.0040, test_f1: 0.5239
 epoch: 93, train_loss: 0.7199, test_loss: 0.9450, test_f1: 0.5729
 epoch: 94, train_loss: 0.7195, test_loss: 0.9655, test_f1: 0.5407
 epoch: 95, train_loss: 0.7166, test_loss: 0.9322, test_f1: 0.5799
 epoch: 96, train_loss: 0.7071, test_loss: 0.9230, test_f1: 0.5652
 epoch: 97, train_loss: 0.7262, test_loss: 0.9280, test_f1: 0.5681
 epoch: 98, train_loss: 0.7278, test_loss: 0.9477, test_f1: 0.5671
 epoch: 99, train_loss: 0.7042, test_loss: 0.9409, test_f1: 0.5657
##################ITERATION #5 ****************************************
 epoch: 0, train_loss: 1.3124, test_loss: 1.2104, test_f1: 0.2979
 epoch: 1, train_loss: 1.1336, test_loss: 1.0643, test_f1: 0.3639
 epoch: 2, train_loss: 1.0916, test_loss: 1.0626, test_f1: 0.3611
 epoch: 3, train_loss: 1.0716, test_loss: 1.0504, test_f1: 0.3447
 epoch: 4, train_loss: 1.0310, test_loss: 1.0410, test_f1: 0.3726
 epoch: 5, train_loss: 1.0125, test_loss: 1.0496, test_f1: 0.4246
 epoch: 6, train_loss: 0.9998, test_loss: 1.0137, test_f1: 0.4440
 epoch: 7, train_loss: 0.9929, test_loss: 1.0383, test_f1: 0.4474
 epoch: 8, train_loss: 0.9827, test_loss: 1.0150, test_f1: 0.4901
 epoch: 9, train_loss: 0.9756, test_loss: 1.0025, test_f1: 0.4705
 epoch: 10, train_loss: 0.9648, test_loss: 1.0073, test_f1: 0.4650
 epoch: 11, train_loss: 0.9549, test_loss: 0.9892, test_f1: 0.4859
 epoch: 12, train_loss: 0.9494, test_loss: 0.9901, test_f1: 0.5028
 epoch: 13, train_loss: 0.9413, test_loss: 0.9866, test_f1: 0.4945
 epoch: 14, train_loss: 0.9320, test_loss: 0.9641, test_f1: 0.5119
 epoch: 15, train_loss: 0.9222, test_loss: 0.9417, test_f1: 0.5030
 epoch: 16, train_loss: 0.9128, test_loss: 0.9307, test_f1: 0.5070
 epoch: 17, train_loss: 0.9030, test_loss: 0.9645, test_f1: 0.4954
 epoch: 18, train_loss: 0.9049, test_loss: 0.9235, test_f1: 0.5063
 epoch: 19, train_loss: 0.9042, test_loss: 0.9324, test_f1: 0.5178
 epoch: 20, train_loss: 0.8998, test_loss: 0.9204, test_f1: 0.5228
 epoch: 21, train_loss: 0.8843, test_loss: 0.9248, test_f1: 0.5342
 epoch: 22, train_loss: 0.8822, test_loss: 0.9329, test_f1: 0.5329
 epoch: 23, train_loss: 0.8798, test_loss: 0.9230, test_f1: 0.5184
 epoch: 24, train_loss: 0.8863, test_loss: 0.9337, test_f1: 0.5160
 epoch: 25, train_loss: 0.8686, test_loss: 0.9759, test_f1: 0.4807
 epoch: 26, train_loss: 0.8650, test_loss: 0.9238, test_f1: 0.5307
 epoch: 27, train_loss: 0.8538, test_loss: 0.9183, test_f1: 0.5176
 epoch: 28, train_loss: 0.8514, test_loss: 0.9356, test_f1: 0.5296
 epoch: 29, train_loss: 0.8465, test_loss: 0.9046, test_f1: 0.5303
 epoch: 30, train_loss: 0.8441, test_loss: 0.9374, test_f1: 0.5157
 epoch: 31, train_loss: 0.8273, test_loss: 0.9148, test_f1: 0.5293
 epoch: 32, train_loss: 0.8286, test_loss: 0.9435, test_f1: 0.5110
 epoch: 33, train_loss: 0.8332, test_loss: 0.9285, test_f1: 0.5131
 epoch: 34, train_loss: 0.8224, test_loss: 0.9185, test_f1: 0.5389
 epoch: 35, train_loss: 0.8247, test_loss: 0.9005, test_f1: 0.5330
 epoch: 36, train_loss: 0.8244, test_loss: 0.9116, test_f1: 0.5134
 epoch: 37, train_loss: 0.8141, test_loss: 0.9008, test_f1: 0.5239
 epoch: 38, train_loss: 0.7957, test_loss: 0.9027, test_f1: 0.5284
 epoch: 39, train_loss: 0.8103, test_loss: 0.8904, test_f1: 0.5325
 epoch: 40, train_loss: 0.8002, test_loss: 0.9080, test_f1: 0.5390
 epoch: 41, train_loss: 0.7980, test_loss: 0.9262, test_f1: 0.5178
 epoch: 42, train_loss: 0.7915, test_loss: 0.9095, test_f1: 0.5287
 epoch: 43, train_loss: 0.8005, test_loss: 0.8913, test_f1: 0.5245
 epoch: 44, train_loss: 0.7884, test_loss: 0.9769, test_f1: 0.4702
 epoch: 45, train_loss: 0.7919, test_loss: 0.9036, test_f1: 0.5231
 epoch: 46, train_loss: 0.7817, test_loss: 0.9075, test_f1: 0.5445
 epoch: 47, train_loss: 0.7909, test_loss: 0.9221, test_f1: 0.5292
 epoch: 48, train_loss: 0.7753, test_loss: 0.9304, test_f1: 0.5179
 epoch: 49, train_loss: 0.7681, test_loss: 0.8942, test_f1: 0.5514
 epoch: 50, train_loss: 0.7706, test_loss: 0.9610, test_f1: 0.5117
 epoch: 51, train_loss: 0.7460, test_loss: 0.9189, test_f1: 0.5218
 epoch: 52, train_loss: 0.7601, test_loss: 0.9076, test_f1: 0.5404
 epoch: 53, train_loss: 0.7447, test_loss: 0.8891, test_f1: 0.5427
 epoch: 54, train_loss: 0.7478, test_loss: 0.9220, test_f1: 0.5314
 epoch: 55, train_loss: 0.7418, test_loss: 0.9022, test_f1: 0.5315
 epoch: 56, train_loss: 0.7358, test_loss: 0.9048, test_f1: 0.5252
 epoch: 57, train_loss: 0.7382, test_loss: 0.9084, test_f1: 0.5391
 epoch: 58, train_loss: 0.7371, test_loss: 0.8982, test_f1: 0.5518
 epoch: 59, train_loss: 0.7578, test_loss: 0.9125, test_f1: 0.5380
 epoch: 60, train_loss: 0.7348, test_loss: 0.9280, test_f1: 0.5317
 epoch: 61, train_loss: 0.7269, test_loss: 0.9143, test_f1: 0.5494
 epoch: 62, train_loss: 0.7376, test_loss: 0.9094, test_f1: 0.5419
 epoch: 63, train_loss: 0.7417, test_loss: 0.9096, test_f1: 0.5439
 epoch: 64, train_loss: 0.7366, test_loss: 0.9152, test_f1: 0.5448
 epoch: 65, train_loss: 0.7229, test_loss: 0.9278, test_f1: 0.5312
 epoch: 66, train_loss: 0.7340, test_loss: 0.9129, test_f1: 0.5331
 epoch: 67, train_loss: 0.7277, test_loss: 0.9210, test_f1: 0.5413
 epoch: 68, train_loss: 0.7176, test_loss: 0.9140, test_f1: 0.5530
 epoch: 69, train_loss: 0.7230, test_loss: 0.9052, test_f1: 0.5411
 epoch: 70, train_loss: 0.7199, test_loss: 0.9245, test_f1: 0.5457
 epoch: 71, train_loss: 0.7233, test_loss: 0.9065, test_f1: 0.5630
 epoch: 72, train_loss: 0.7195, test_loss: 0.9161, test_f1: 0.5577
 epoch: 73, train_loss: 0.7228, test_loss: 0.9114, test_f1: 0.5690
 epoch: 74, train_loss: 0.7206, test_loss: 0.9110, test_f1: 0.5496
 epoch: 75, train_loss: 0.7056, test_loss: 0.9154, test_f1: 0.5379
 epoch: 76, train_loss: 0.7311, test_loss: 0.8970, test_f1: 0.5519
 epoch: 77, train_loss: 0.7335, test_loss: 0.9166, test_f1: 0.5518
 epoch: 78, train_loss: 0.7270, test_loss: 0.9357, test_f1: 0.5530
 epoch: 79, train_loss: 0.7179, test_loss: 0.9112, test_f1: 0.5712
 epoch: 80, train_loss: 0.7043, test_loss: 0.9371, test_f1: 0.5478
 epoch: 81, train_loss: 0.7176, test_loss: 0.9005, test_f1: 0.5502
 epoch: 82, train_loss: 0.7040, test_loss: 0.9076, test_f1: 0.5789
 epoch: 83, train_loss: 0.6994, test_loss: 0.9324, test_f1: 0.5554
 epoch: 84, train_loss: 0.7128, test_loss: 0.9064, test_f1: 0.5454
 epoch: 85, train_loss: 0.6971, test_loss: 0.9342, test_f1: 0.5334
 epoch: 86, train_loss: 0.7017, test_loss: 0.9170, test_f1: 0.5363
 epoch: 87, train_loss: 0.6984, test_loss: 0.9904, test_f1: 0.5494
 epoch: 88, train_loss: 0.7026, test_loss: 0.9123, test_f1: 0.5367
 epoch: 89, train_loss: 0.7016, test_loss: 0.9097, test_f1: 0.5716
 epoch: 90, train_loss: 0.6969, test_loss: 0.9359, test_f1: 0.5753
 epoch: 91, train_loss: 0.7087, test_loss: 0.9229, test_f1: 0.5603
 epoch: 92, train_loss: 0.7150, test_loss: 0.9525, test_f1: 0.5429
 epoch: 93, train_loss: 0.6868, test_loss: 0.9118, test_f1: 0.5543
 epoch: 94, train_loss: 0.6978, test_loss: 0.9218, test_f1: 0.5364
 epoch: 95, train_loss: 0.6948, test_loss: 0.9302, test_f1: 0.5441
 epoch: 96, train_loss: 0.6987, test_loss: 0.9284, test_f1: 0.5433
 epoch: 97, train_loss: 0.6926, test_loss: 0.9108, test_f1: 0.5649
 epoch: 98, train_loss: 0.6936, test_loss: 0.9289, test_f1: 0.5539
 epoch: 99, train_loss: 0.6882, test_loss: 0.9613, test_f1: 0.5243
##################ITERATION #6 ****************************************
 epoch: 0, train_loss: 1.3640, test_loss: 1.1460, test_f1: 0.3425
 epoch: 1, train_loss: 1.1551, test_loss: 1.0704, test_f1: 0.3584
 epoch: 2, train_loss: 1.1100, test_loss: 1.0382, test_f1: 0.4058
 epoch: 3, train_loss: 1.0864, test_loss: 1.0276, test_f1: 0.4128
 epoch: 4, train_loss: 1.0595, test_loss: 1.0171, test_f1: 0.4113
 epoch: 5, train_loss: 1.0351, test_loss: 1.0297, test_f1: 0.4206
 epoch: 6, train_loss: 1.0262, test_loss: 1.0251, test_f1: 0.4728
 epoch: 7, train_loss: 1.0143, test_loss: 1.0343, test_f1: 0.4501
 epoch: 8, train_loss: 1.0052, test_loss: 1.0360, test_f1: 0.4632
 epoch: 9, train_loss: 0.9985, test_loss: 1.0218, test_f1: 0.4677
 epoch: 10, train_loss: 0.9971, test_loss: 1.0303, test_f1: 0.4850
 epoch: 11, train_loss: 0.9888, test_loss: 1.0238, test_f1: 0.4767
 epoch: 12, train_loss: 0.9838, test_loss: 0.9898, test_f1: 0.4589
 epoch: 13, train_loss: 0.9739, test_loss: 1.0053, test_f1: 0.4749
 epoch: 14, train_loss: 0.9590, test_loss: 0.9895, test_f1: 0.4894
 epoch: 15, train_loss: 0.9546, test_loss: 0.9904, test_f1: 0.4690
 epoch: 16, train_loss: 0.9432, test_loss: 0.9810, test_f1: 0.4953
 epoch: 17, train_loss: 0.9375, test_loss: 0.9863, test_f1: 0.5073
 epoch: 18, train_loss: 0.9329, test_loss: 0.9592, test_f1: 0.4894
 epoch: 19, train_loss: 0.9349, test_loss: 0.9950, test_f1: 0.5015
 epoch: 20, train_loss: 0.9268, test_loss: 0.9767, test_f1: 0.4913
 epoch: 21, train_loss: 0.9167, test_loss: 0.9474, test_f1: 0.5123
 epoch: 22, train_loss: 0.9127, test_loss: 0.9691, test_f1: 0.4741
 epoch: 23, train_loss: 0.9119, test_loss: 0.9553, test_f1: 0.5221
 epoch: 24, train_loss: 0.9031, test_loss: 0.9836, test_f1: 0.5216
 epoch: 25, train_loss: 0.9102, test_loss: 0.9601, test_f1: 0.4566
 epoch: 26, train_loss: 0.8912, test_loss: 0.9501, test_f1: 0.5017
 epoch: 27, train_loss: 0.8916, test_loss: 0.9290, test_f1: 0.5143
 epoch: 28, train_loss: 0.8787, test_loss: 0.9500, test_f1: 0.5093
 epoch: 29, train_loss: 0.8864, test_loss: 1.0005, test_f1: 0.4613
 epoch: 30, train_loss: 0.8946, test_loss: 0.9429, test_f1: 0.5149
 epoch: 31, train_loss: 0.8760, test_loss: 0.9338, test_f1: 0.5116
 epoch: 32, train_loss: 0.8849, test_loss: 0.9161, test_f1: 0.5233
 epoch: 33, train_loss: 0.8714, test_loss: 0.9855, test_f1: 0.4799
 epoch: 34, train_loss: 0.8638, test_loss: 0.9431, test_f1: 0.4934
 epoch: 35, train_loss: 0.8626, test_loss: 0.9519, test_f1: 0.5040
 epoch: 36, train_loss: 0.8512, test_loss: 0.9348, test_f1: 0.4927
 epoch: 37, train_loss: 0.8634, test_loss: 0.9263, test_f1: 0.4849
 epoch: 38, train_loss: 0.8464, test_loss: 1.0096, test_f1: 0.4868
 epoch: 39, train_loss: 0.8626, test_loss: 0.9099, test_f1: 0.5034
 epoch: 40, train_loss: 0.8315, test_loss: 0.9554, test_f1: 0.4890
 epoch: 41, train_loss: 0.8492, test_loss: 0.9176, test_f1: 0.5159
 epoch: 42, train_loss: 0.8463, test_loss: 0.9255, test_f1: 0.5089
 epoch: 43, train_loss: 0.8273, test_loss: 0.9394, test_f1: 0.4947
 epoch: 44, train_loss: 0.8312, test_loss: 0.9070, test_f1: 0.5125
 epoch: 45, train_loss: 0.8349, test_loss: 0.8957, test_f1: 0.4965
 epoch: 46, train_loss: 0.8282, test_loss: 0.9067, test_f1: 0.5142
 epoch: 47, train_loss: 0.8317, test_loss: 0.9104, test_f1: 0.5369
 epoch: 48, train_loss: 0.8187, test_loss: 0.9166, test_f1: 0.5237
 epoch: 49, train_loss: 0.8189, test_loss: 0.9117, test_f1: 0.5056
 epoch: 50, train_loss: 0.8218, test_loss: 0.8946, test_f1: 0.5335
 epoch: 51, train_loss: 0.8048, test_loss: 0.8848, test_f1: 0.5215
 epoch: 52, train_loss: 0.8026, test_loss: 0.9078, test_f1: 0.5291
 epoch: 53, train_loss: 0.7961, test_loss: 0.9028, test_f1: 0.5183
 epoch: 54, train_loss: 0.8057, test_loss: 0.9073, test_f1: 0.5213
 epoch: 55, train_loss: 0.7975, test_loss: 0.9086, test_f1: 0.5172
 epoch: 56, train_loss: 0.8128, test_loss: 0.9107, test_f1: 0.5101
 epoch: 57, train_loss: 0.8087, test_loss: 0.8921, test_f1: 0.5353
 epoch: 58, train_loss: 0.7886, test_loss: 0.8785, test_f1: 0.5372
 epoch: 59, train_loss: 0.7953, test_loss: 0.8897, test_f1: 0.5334
 epoch: 60, train_loss: 0.7965, test_loss: 0.9015, test_f1: 0.5218
 epoch: 61, train_loss: 0.7802, test_loss: 0.9075, test_f1: 0.5338
 epoch: 62, train_loss: 0.7852, test_loss: 0.8964, test_f1: 0.5280
 epoch: 63, train_loss: 0.7817, test_loss: 0.9072, test_f1: 0.5214
 epoch: 64, train_loss: 0.7864, test_loss: 0.9085, test_f1: 0.5319
 epoch: 65, train_loss: 0.7789, test_loss: 0.9105, test_f1: 0.5321
 epoch: 66, train_loss: 0.7833, test_loss: 0.9397, test_f1: 0.5164
 epoch: 67, train_loss: 0.7859, test_loss: 0.9047, test_f1: 0.5380
 epoch: 68, train_loss: 0.7826, test_loss: 0.9064, test_f1: 0.5358
 epoch: 69, train_loss: 0.7937, test_loss: 0.8900, test_f1: 0.5425
 epoch: 70, train_loss: 0.7750, test_loss: 0.9165, test_f1: 0.5355
 epoch: 71, train_loss: 0.7844, test_loss: 0.9175, test_f1: 0.5408
 epoch: 72, train_loss: 0.7784, test_loss: 0.9074, test_f1: 0.5376
 epoch: 73, train_loss: 0.7729, test_loss: 0.9128, test_f1: 0.5295
 epoch: 74, train_loss: 0.7770, test_loss: 0.9072, test_f1: 0.5252
 epoch: 75, train_loss: 0.7801, test_loss: 0.9070, test_f1: 0.5432
 epoch: 76, train_loss: 0.7761, test_loss: 0.9142, test_f1: 0.5307
 epoch: 77, train_loss: 0.7688, test_loss: 0.8902, test_f1: 0.5392
 epoch: 78, train_loss: 0.7686, test_loss: 0.9147, test_f1: 0.5393
 epoch: 79, train_loss: 0.7780, test_loss: 0.9716, test_f1: 0.5280
 epoch: 80, train_loss: 0.7726, test_loss: 0.9272, test_f1: 0.5213
 epoch: 81, train_loss: 0.7783, test_loss: 0.9222, test_f1: 0.5158
 epoch: 82, train_loss: 0.7567, test_loss: 0.9250, test_f1: 0.5467
 epoch: 83, train_loss: 0.7605, test_loss: 0.9147, test_f1: 0.5370
 epoch: 84, train_loss: 0.7665, test_loss: 0.9267, test_f1: 0.5227
 epoch: 85, train_loss: 0.7667, test_loss: 0.8974, test_f1: 0.5303
 epoch: 86, train_loss: 0.7654, test_loss: 0.9538, test_f1: 0.5391
 epoch: 87, train_loss: 0.7556, test_loss: 0.9207, test_f1: 0.5249
 epoch: 88, train_loss: 0.7673, test_loss: 0.9147, test_f1: 0.5336
 epoch: 89, train_loss: 0.7584, test_loss: 0.9139, test_f1: 0.5433
 epoch: 90, train_loss: 0.7603, test_loss: 0.9513, test_f1: 0.5319
 epoch: 91, train_loss: 0.7491, test_loss: 0.9291, test_f1: 0.5292
 epoch: 92, train_loss: 0.7542, test_loss: 0.9195, test_f1: 0.5362
 epoch: 93, train_loss: 0.7638, test_loss: 0.8977, test_f1: 0.5304
 epoch: 94, train_loss: 0.7600, test_loss: 0.9115, test_f1: 0.5308
 epoch: 95, train_loss: 0.7589, test_loss: 0.8932, test_f1: 0.5579
 epoch: 96, train_loss: 0.7550, test_loss: 0.9017, test_f1: 0.5391
 epoch: 97, train_loss: 0.7717, test_loss: 0.9320, test_f1: 0.5287
 epoch: 98, train_loss: 0.7482, test_loss: 0.9290, test_f1: 0.5410
 epoch: 99, train_loss: 0.7614, test_loss: 0.8994, test_f1: 0.5529
##################ITERATION #7 ****************************************
 epoch: 0, train_loss: 1.2908, test_loss: 1.1755, test_f1: 0.3394
 epoch: 1, train_loss: 1.1741, test_loss: 1.0643, test_f1: 0.3852
 epoch: 2, train_loss: 1.1111, test_loss: 1.0142, test_f1: 0.4031
 epoch: 3, train_loss: 1.0843, test_loss: 1.0052, test_f1: 0.3999
 epoch: 4, train_loss: 1.0521, test_loss: 1.0068, test_f1: 0.4163
 epoch: 5, train_loss: 1.0262, test_loss: 0.9888, test_f1: 0.4082
 epoch: 6, train_loss: 1.0013, test_loss: 0.9823, test_f1: 0.4605
 epoch: 7, train_loss: 0.9844, test_loss: 0.9784, test_f1: 0.4810
 epoch: 8, train_loss: 0.9766, test_loss: 0.9859, test_f1: 0.5012
 epoch: 9, train_loss: 0.9552, test_loss: 0.9401, test_f1: 0.4731
 epoch: 10, train_loss: 0.9479, test_loss: 0.9737, test_f1: 0.4660
 epoch: 11, train_loss: 0.9421, test_loss: 0.9822, test_f1: 0.4772
 epoch: 12, train_loss: 0.9338, test_loss: 0.9640, test_f1: 0.4911
 epoch: 13, train_loss: 0.9144, test_loss: 0.9454, test_f1: 0.4953
 epoch: 14, train_loss: 0.9127, test_loss: 0.9598, test_f1: 0.5182
 epoch: 15, train_loss: 0.8871, test_loss: 0.9303, test_f1: 0.5239
 epoch: 16, train_loss: 0.8813, test_loss: 0.9452, test_f1: 0.5345
 epoch: 17, train_loss: 0.8609, test_loss: 0.9389, test_f1: 0.5169
 epoch: 18, train_loss: 0.8733, test_loss: 0.9203, test_f1: 0.5341
 epoch: 19, train_loss: 0.8667, test_loss: 0.8937, test_f1: 0.5344
 epoch: 20, train_loss: 0.8618, test_loss: 0.9179, test_f1: 0.5205
 epoch: 21, train_loss: 0.8553, test_loss: 0.9282, test_f1: 0.5293
 epoch: 22, train_loss: 0.8454, test_loss: 0.9073, test_f1: 0.5409
 epoch: 23, train_loss: 0.8430, test_loss: 0.9156, test_f1: 0.5300
 epoch: 24, train_loss: 0.8611, test_loss: 0.9352, test_f1: 0.5287
 epoch: 25, train_loss: 0.8353, test_loss: 0.9190, test_f1: 0.5371
 epoch: 26, train_loss: 0.8286, test_loss: 0.8829, test_f1: 0.5518
 epoch: 27, train_loss: 0.8224, test_loss: 0.8997, test_f1: 0.5412
 epoch: 28, train_loss: 0.8204, test_loss: 0.8925, test_f1: 0.5516
 epoch: 29, train_loss: 0.8197, test_loss: 0.9075, test_f1: 0.5411
 epoch: 30, train_loss: 0.8238, test_loss: 0.8973, test_f1: 0.5468
 epoch: 31, train_loss: 0.8092, test_loss: 0.8952, test_f1: 0.5513
 epoch: 32, train_loss: 0.8309, test_loss: 0.9000, test_f1: 0.5444
 epoch: 33, train_loss: 0.8023, test_loss: 0.8963, test_f1: 0.5632
 epoch: 34, train_loss: 0.8039, test_loss: 0.8839, test_f1: 0.5537
 epoch: 35, train_loss: 0.8024, test_loss: 0.8663, test_f1: 0.5552
 epoch: 36, train_loss: 0.7983, test_loss: 0.8965, test_f1: 0.5495
 epoch: 37, train_loss: 0.8031, test_loss: 0.8942, test_f1: 0.5450
 epoch: 38, train_loss: 0.7925, test_loss: 0.9062, test_f1: 0.5398
 epoch: 39, train_loss: 0.7945, test_loss: 0.9042, test_f1: 0.5539
 epoch: 40, train_loss: 0.7864, test_loss: 0.8713, test_f1: 0.5416
 epoch: 41, train_loss: 0.7843, test_loss: 0.8778, test_f1: 0.5382
 epoch: 42, train_loss: 0.7936, test_loss: 0.8753, test_f1: 0.5535
 epoch: 43, train_loss: 0.7878, test_loss: 0.8613, test_f1: 0.5569
 epoch: 44, train_loss: 0.7856, test_loss: 0.9042, test_f1: 0.5608
 epoch: 45, train_loss: 0.7906, test_loss: 0.8732, test_f1: 0.5599
 epoch: 46, train_loss: 0.7826, test_loss: 0.8692, test_f1: 0.5558
 epoch: 47, train_loss: 0.7665, test_loss: 0.8498, test_f1: 0.5668
 epoch: 48, train_loss: 0.7807, test_loss: 0.9089, test_f1: 0.5384
 epoch: 49, train_loss: 0.7859, test_loss: 0.8937, test_f1: 0.5536
 epoch: 50, train_loss: 0.7789, test_loss: 0.8711, test_f1: 0.5553
 epoch: 51, train_loss: 0.7586, test_loss: 0.8500, test_f1: 0.5691
 epoch: 52, train_loss: 0.7474, test_loss: 0.8569, test_f1: 0.5618
 epoch: 53, train_loss: 0.7515, test_loss: 0.8536, test_f1: 0.5570
 epoch: 54, train_loss: 0.7419, test_loss: 0.8485, test_f1: 0.5632
 epoch: 55, train_loss: 0.7489, test_loss: 0.8539, test_f1: 0.5638
 epoch: 56, train_loss: 0.7449, test_loss: 0.8636, test_f1: 0.5703
 epoch: 57, train_loss: 0.7490, test_loss: 0.8767, test_f1: 0.5598
 epoch: 58, train_loss: 0.7446, test_loss: 0.8610, test_f1: 0.5652
 epoch: 59, train_loss: 0.7343, test_loss: 0.8660, test_f1: 0.5672
 epoch: 60, train_loss: 0.7312, test_loss: 0.8538, test_f1: 0.5711
 epoch: 61, train_loss: 0.7341, test_loss: 0.8613, test_f1: 0.5700
 epoch: 62, train_loss: 0.7382, test_loss: 0.8688, test_f1: 0.5657
 epoch: 63, train_loss: 0.7341, test_loss: 0.8617, test_f1: 0.5743
 epoch: 64, train_loss: 0.7377, test_loss: 0.8643, test_f1: 0.5698
 epoch: 65, train_loss: 0.7300, test_loss: 0.8661, test_f1: 0.5612
 epoch: 66, train_loss: 0.7186, test_loss: 0.8660, test_f1: 0.5649
 epoch: 67, train_loss: 0.7130, test_loss: 0.8572, test_f1: 0.5550
 epoch: 68, train_loss: 0.7301, test_loss: 0.8727, test_f1: 0.5570
 epoch: 69, train_loss: 0.7267, test_loss: 0.8665, test_f1: 0.5680
 epoch: 70, train_loss: 0.7142, test_loss: 0.8656, test_f1: 0.5673
 epoch: 71, train_loss: 0.7297, test_loss: 0.8642, test_f1: 0.5610
 epoch: 72, train_loss: 0.7297, test_loss: 0.8707, test_f1: 0.5633
 epoch: 73, train_loss: 0.7267, test_loss: 0.8550, test_f1: 0.5710
 epoch: 74, train_loss: 0.7160, test_loss: 0.8592, test_f1: 0.5673
 epoch: 75, train_loss: 0.7171, test_loss: 0.8571, test_f1: 0.5682
 epoch: 76, train_loss: 0.7198, test_loss: 0.8488, test_f1: 0.5659
 epoch: 77, train_loss: 0.7172, test_loss: 0.8433, test_f1: 0.5741
 epoch: 78, train_loss: 0.7235, test_loss: 0.8534, test_f1: 0.5638
 epoch: 79, train_loss: 0.7216, test_loss: 0.8464, test_f1: 0.5720
 epoch: 80, train_loss: 0.7219, test_loss: 0.8525, test_f1: 0.5599
 epoch: 81, train_loss: 0.7099, test_loss: 0.8670, test_f1: 0.5588
 epoch: 82, train_loss: 0.7068, test_loss: 0.8600, test_f1: 0.5638
 epoch: 83, train_loss: 0.7310, test_loss: 0.8667, test_f1: 0.5580
 epoch: 84, train_loss: 0.7072, test_loss: 0.8522, test_f1: 0.5683
 epoch: 85, train_loss: 0.7001, test_loss: 0.8352, test_f1: 0.5804
 epoch: 86, train_loss: 0.6954, test_loss: 0.8358, test_f1: 0.5722
 epoch: 87, train_loss: 0.7081, test_loss: 0.8382, test_f1: 0.5727
 epoch: 88, train_loss: 0.6949, test_loss: 0.8509, test_f1: 0.5662
 epoch: 89, train_loss: 0.7132, test_loss: 0.8526, test_f1: 0.5892
 epoch: 90, train_loss: 0.7119, test_loss: 0.8572, test_f1: 0.5656
 epoch: 91, train_loss: 0.7123, test_loss: 0.8441, test_f1: 0.5765
 epoch: 92, train_loss: 0.6915, test_loss: 0.8575, test_f1: 0.5787
 epoch: 93, train_loss: 0.7074, test_loss: 0.8523, test_f1: 0.5926
 epoch: 94, train_loss: 0.7027, test_loss: 0.8396, test_f1: 0.6007
 epoch: 95, train_loss: 0.6924, test_loss: 0.8411, test_f1: 0.5994
 epoch: 96, train_loss: 0.7010, test_loss: 0.8449, test_f1: 0.5775
 epoch: 97, train_loss: 0.6977, test_loss: 0.8411, test_f1: 0.5890
 epoch: 98, train_loss: 0.6958, test_loss: 0.8537, test_f1: 0.5755
 epoch: 99, train_loss: 0.6875, test_loss: 0.8501, test_f1: 0.5704
##################ITERATION #8 ****************************************
 epoch: 0, train_loss: 1.4291, test_loss: 1.1793, test_f1: 0.2985
 epoch: 1, train_loss: 1.1931, test_loss: 1.0983, test_f1: 0.4134
 epoch: 2, train_loss: 1.1507, test_loss: 1.0823, test_f1: 0.4063
 epoch: 3, train_loss: 1.1015, test_loss: 1.0572, test_f1: 0.4046
 epoch: 4, train_loss: 1.0704, test_loss: 1.0457, test_f1: 0.3888
 epoch: 5, train_loss: 1.0505, test_loss: 1.0539, test_f1: 0.4092
 epoch: 6, train_loss: 1.0327, test_loss: 1.0447, test_f1: 0.4721
 epoch: 7, train_loss: 1.0274, test_loss: 1.0304, test_f1: 0.4756
 epoch: 8, train_loss: 1.0109, test_loss: 1.0269, test_f1: 0.4694
 epoch: 9, train_loss: 1.0012, test_loss: 1.0105, test_f1: 0.5020
 epoch: 10, train_loss: 0.9887, test_loss: 0.9969, test_f1: 0.5013
 epoch: 11, train_loss: 0.9678, test_loss: 0.9968, test_f1: 0.5119
 epoch: 12, train_loss: 0.9746, test_loss: 1.0199, test_f1: 0.5062
 epoch: 13, train_loss: 0.9661, test_loss: 1.0081, test_f1: 0.5141
 epoch: 14, train_loss: 0.9593, test_loss: 0.9745, test_f1: 0.5242
 epoch: 15, train_loss: 0.9410, test_loss: 0.9717, test_f1: 0.5256
 epoch: 16, train_loss: 0.9332, test_loss: 0.9698, test_f1: 0.5298
 epoch: 17, train_loss: 0.9248, test_loss: 0.9700, test_f1: 0.5257
 epoch: 18, train_loss: 0.9212, test_loss: 0.9537, test_f1: 0.5304
 epoch: 19, train_loss: 0.9295, test_loss: 0.9650, test_f1: 0.5284
 epoch: 20, train_loss: 0.9155, test_loss: 0.9472, test_f1: 0.5318
 epoch: 21, train_loss: 0.9132, test_loss: 0.9341, test_f1: 0.5378
 epoch: 22, train_loss: 0.9004, test_loss: 0.9199, test_f1: 0.5468
 epoch: 23, train_loss: 0.8959, test_loss: 0.9694, test_f1: 0.5145
 epoch: 24, train_loss: 0.8985, test_loss: 0.9593, test_f1: 0.5240
 epoch: 25, train_loss: 0.8956, test_loss: 0.9287, test_f1: 0.5394
 epoch: 26, train_loss: 0.8812, test_loss: 0.9232, test_f1: 0.5312
 epoch: 27, train_loss: 0.8797, test_loss: 0.9187, test_f1: 0.5444
 epoch: 28, train_loss: 0.8715, test_loss: 0.9331, test_f1: 0.5253
 epoch: 29, train_loss: 0.8733, test_loss: 0.9309, test_f1: 0.5349
 epoch: 30, train_loss: 0.8621, test_loss: 0.9392, test_f1: 0.5379
 epoch: 31, train_loss: 0.8696, test_loss: 0.9317, test_f1: 0.5427
 epoch: 32, train_loss: 0.8620, test_loss: 0.9234, test_f1: 0.5337
 epoch: 33, train_loss: 0.8536, test_loss: 0.9310, test_f1: 0.5179
 epoch: 34, train_loss: 0.8608, test_loss: 0.9292, test_f1: 0.5347
 epoch: 35, train_loss: 0.8520, test_loss: 0.9102, test_f1: 0.5439
 epoch: 36, train_loss: 0.8533, test_loss: 0.9491, test_f1: 0.5122
 epoch: 37, train_loss: 0.8486, test_loss: 0.9127, test_f1: 0.5496
 epoch: 38, train_loss: 0.8321, test_loss: 0.9385, test_f1: 0.5328
 epoch: 39, train_loss: 0.8279, test_loss: 0.9144, test_f1: 0.5496
 epoch: 40, train_loss: 0.8406, test_loss: 0.9292, test_f1: 0.5375
 epoch: 41, train_loss: 0.8392, test_loss: 0.8963, test_f1: 0.5451
 epoch: 42, train_loss: 0.8249, test_loss: 0.9139, test_f1: 0.5502
 epoch: 43, train_loss: 0.8221, test_loss: 0.9000, test_f1: 0.5424
 epoch: 44, train_loss: 0.8273, test_loss: 0.9216, test_f1: 0.5510
 epoch: 45, train_loss: 0.8246, test_loss: 0.9450, test_f1: 0.5377
 epoch: 46, train_loss: 0.8284, test_loss: 0.9264, test_f1: 0.5385
 epoch: 47, train_loss: 0.8284, test_loss: 0.9337, test_f1: 0.5414
 epoch: 48, train_loss: 0.8065, test_loss: 0.9521, test_f1: 0.5450
 epoch: 49, train_loss: 0.8112, test_loss: 1.0113, test_f1: 0.5185
 epoch: 50, train_loss: 0.8201, test_loss: 0.9155, test_f1: 0.5574
 epoch: 51, train_loss: 0.7914, test_loss: 0.9029, test_f1: 0.5590
 epoch: 52, train_loss: 0.8060, test_loss: 0.9572, test_f1: 0.5462
 epoch: 53, train_loss: 0.7884, test_loss: 0.9276, test_f1: 0.5464
 epoch: 54, train_loss: 0.7933, test_loss: 0.9157, test_f1: 0.5560
 epoch: 55, train_loss: 0.7994, test_loss: 0.9328, test_f1: 0.5461
 epoch: 56, train_loss: 0.7878, test_loss: 0.9279, test_f1: 0.5490
 epoch: 57, train_loss: 0.7889, test_loss: 0.9377, test_f1: 0.5304
 epoch: 58, train_loss: 0.7800, test_loss: 0.9240, test_f1: 0.5474
 epoch: 59, train_loss: 0.7776, test_loss: 0.9140, test_f1: 0.5508
 epoch: 60, train_loss: 0.7706, test_loss: 0.9423, test_f1: 0.5332
 epoch: 61, train_loss: 0.7847, test_loss: 0.9240, test_f1: 0.5519
 epoch: 62, train_loss: 0.7773, test_loss: 0.9078, test_f1: 0.5629
 epoch: 63, train_loss: 0.7741, test_loss: 0.9532, test_f1: 0.5318
 epoch: 64, train_loss: 0.7713, test_loss: 0.9419, test_f1: 0.5417
 epoch: 65, train_loss: 0.7822, test_loss: 0.9400, test_f1: 0.5374
 epoch: 66, train_loss: 0.7693, test_loss: 0.9476, test_f1: 0.5221
 epoch: 67, train_loss: 0.7769, test_loss: 0.9502, test_f1: 0.5566
 epoch: 68, train_loss: 0.7649, test_loss: 0.9353, test_f1: 0.5395
 epoch: 69, train_loss: 0.7759, test_loss: 0.9281, test_f1: 0.5417
 epoch: 70, train_loss: 0.7612, test_loss: 0.9229, test_f1: 0.5456
 epoch: 71, train_loss: 0.7555, test_loss: 0.9279, test_f1: 0.5290
 epoch: 72, train_loss: 0.7660, test_loss: 0.9254, test_f1: 0.5598
 epoch: 73, train_loss: 0.7688, test_loss: 0.9202, test_f1: 0.5347
 epoch: 74, train_loss: 0.7624, test_loss: 0.9318, test_f1: 0.5322
 epoch: 75, train_loss: 0.7710, test_loss: 0.9388, test_f1: 0.5502
 epoch: 76, train_loss: 0.7743, test_loss: 0.9097, test_f1: 0.5500
 epoch: 77, train_loss: 0.7679, test_loss: 0.9185, test_f1: 0.5454
 epoch: 78, train_loss: 0.7638, test_loss: 0.9197, test_f1: 0.5556
 epoch: 79, train_loss: 0.7703, test_loss: 0.9219, test_f1: 0.5389
 epoch: 80, train_loss: 0.7621, test_loss: 0.9603, test_f1: 0.5437
 epoch: 81, train_loss: 0.7505, test_loss: 0.9181, test_f1: 0.5337
 epoch: 82, train_loss: 0.7528, test_loss: 0.9130, test_f1: 0.5491
 epoch: 83, train_loss: 0.7389, test_loss: 0.9303, test_f1: 0.5332
 epoch: 84, train_loss: 0.7573, test_loss: 0.9239, test_f1: 0.5559
 epoch: 85, train_loss: 0.7506, test_loss: 0.9113, test_f1: 0.5565
 epoch: 86, train_loss: 0.7561, test_loss: 0.9216, test_f1: 0.5481
 epoch: 87, train_loss: 0.7379, test_loss: 0.9234, test_f1: 0.5304
 epoch: 88, train_loss: 0.7548, test_loss: 0.9105, test_f1: 0.5461
 epoch: 89, train_loss: 0.7328, test_loss: 0.8866, test_f1: 0.5651
 epoch: 90, train_loss: 0.7592, test_loss: 0.8992, test_f1: 0.5373
 epoch: 91, train_loss: 0.7515, test_loss: 0.9271, test_f1: 0.5419
 epoch: 92, train_loss: 0.7425, test_loss: 0.9244, test_f1: 0.5434
 epoch: 93, train_loss: 0.7441, test_loss: 0.9077, test_f1: 0.5365
 epoch: 94, train_loss: 0.7305, test_loss: 0.9107, test_f1: 0.5460
 epoch: 95, train_loss: 0.7512, test_loss: 0.9141, test_f1: 0.5558
 epoch: 96, train_loss: 0.7495, test_loss: 0.9254, test_f1: 0.5432
 epoch: 97, train_loss: 0.7430, test_loss: 0.9146, test_f1: 0.5442
 epoch: 98, train_loss: 0.7304, test_loss: 0.9092, test_f1: 0.5429
 epoch: 99, train_loss: 0.7377, test_loss: 0.9169, test_f1: 0.5411
##################ITERATION #9 ****************************************
 epoch: 0, train_loss: 1.4341, test_loss: 1.2269, test_f1: 0.2324
 epoch: 1, train_loss: 1.1635, test_loss: 1.0489, test_f1: 0.4163
 epoch: 2, train_loss: 1.1088, test_loss: 1.0115, test_f1: 0.3849
 epoch: 3, train_loss: 1.0729, test_loss: 0.9899, test_f1: 0.4213
 epoch: 4, train_loss: 1.0537, test_loss: 0.9830, test_f1: 0.4399
 epoch: 5, train_loss: 1.0178, test_loss: 0.9567, test_f1: 0.4361
 epoch: 6, train_loss: 1.0116, test_loss: 0.9641, test_f1: 0.4512
 epoch: 7, train_loss: 0.9951, test_loss: 0.9258, test_f1: 0.4696
 epoch: 8, train_loss: 0.9807, test_loss: 0.9396, test_f1: 0.4910
 epoch: 9, train_loss: 0.9666, test_loss: 0.9053, test_f1: 0.4975
 epoch: 10, train_loss: 0.9725, test_loss: 0.9427, test_f1: 0.4548
 epoch: 11, train_loss: 0.9562, test_loss: 0.9055, test_f1: 0.5084
 epoch: 12, train_loss: 0.9421, test_loss: 0.9189, test_f1: 0.4934
 epoch: 13, train_loss: 0.9383, test_loss: 0.8760, test_f1: 0.4996
 epoch: 14, train_loss: 0.9349, test_loss: 0.8906, test_f1: 0.5157
 epoch: 15, train_loss: 0.9268, test_loss: 0.8637, test_f1: 0.5199
 epoch: 16, train_loss: 0.9201, test_loss: 0.8954, test_f1: 0.5271
 epoch: 17, train_loss: 0.9126, test_loss: 0.8941, test_f1: 0.5008
 epoch: 18, train_loss: 0.9101, test_loss: 0.9314, test_f1: 0.5212
 epoch: 19, train_loss: 0.9163, test_loss: 0.8442, test_f1: 0.5229
 epoch: 20, train_loss: 0.9163, test_loss: 0.8676, test_f1: 0.5314
 epoch: 21, train_loss: 0.8973, test_loss: 0.9567, test_f1: 0.4913
 epoch: 22, train_loss: 0.8998, test_loss: 0.8743, test_f1: 0.5280
 epoch: 23, train_loss: 0.9012, test_loss: 0.9085, test_f1: 0.5118
 epoch: 24, train_loss: 0.8721, test_loss: 0.8172, test_f1: 0.5291
 epoch: 25, train_loss: 0.8894, test_loss: 0.9426, test_f1: 0.5184
 epoch: 26, train_loss: 0.8719, test_loss: 0.8772, test_f1: 0.5236
 epoch: 27, train_loss: 0.8707, test_loss: 0.8977, test_f1: 0.5119
 epoch: 28, train_loss: 0.8797, test_loss: 0.8942, test_f1: 0.5215
 epoch: 29, train_loss: 0.8722, test_loss: 0.8696, test_f1: 0.5341
 epoch: 30, train_loss: 0.8557, test_loss: 0.9018, test_f1: 0.5245
 epoch: 31, train_loss: 0.8545, test_loss: 0.9112, test_f1: 0.5215
 epoch: 32, train_loss: 0.8626, test_loss: 0.8446, test_f1: 0.5359
 epoch: 33, train_loss: 0.8471, test_loss: 0.9026, test_f1: 0.5279
 epoch: 34, train_loss: 0.8388, test_loss: 0.9229, test_f1: 0.5106
 epoch: 35, train_loss: 0.8361, test_loss: 0.8796, test_f1: 0.5414
 epoch: 36, train_loss: 0.8455, test_loss: 0.8828, test_f1: 0.5402
 epoch: 37, train_loss: 0.8410, test_loss: 0.8896, test_f1: 0.5381
 epoch: 38, train_loss: 0.8348, test_loss: 0.8890, test_f1: 0.5256
 epoch: 39, train_loss: 0.8407, test_loss: 0.8463, test_f1: 0.5548
 epoch: 40, train_loss: 0.8360, test_loss: 0.8606, test_f1: 0.5316
 epoch: 41, train_loss: 0.8384, test_loss: 0.8602, test_f1: 0.5437
 epoch: 42, train_loss: 0.8339, test_loss: 0.8462, test_f1: 0.5348
 epoch: 43, train_loss: 0.8052, test_loss: 0.8731, test_f1: 0.5480
 epoch: 44, train_loss: 0.8187, test_loss: 0.9068, test_f1: 0.5243
 epoch: 45, train_loss: 0.8180, test_loss: 0.9026, test_f1: 0.5336
 epoch: 46, train_loss: 0.8169, test_loss: 0.8595, test_f1: 0.5833
 epoch: 47, train_loss: 0.7984, test_loss: 0.8446, test_f1: 0.5477
 epoch: 48, train_loss: 0.8093, test_loss: 0.8675, test_f1: 0.5453
 epoch: 49, train_loss: 0.8168, test_loss: 0.8390, test_f1: 0.5939
 epoch: 50, train_loss: 0.7960, test_loss: 0.8565, test_f1: 0.5441
 epoch: 51, train_loss: 0.7895, test_loss: 0.8875, test_f1: 0.5554
 epoch: 52, train_loss: 0.7847, test_loss: 0.8537, test_f1: 0.5528
 epoch: 53, train_loss: 0.7850, test_loss: 0.8464, test_f1: 0.5699
 epoch: 54, train_loss: 0.7766, test_loss: 0.8613, test_f1: 0.5895
 epoch: 55, train_loss: 0.7724, test_loss: 0.8388, test_f1: 0.5562
 epoch: 56, train_loss: 0.7747, test_loss: 0.8900, test_f1: 0.5700
 epoch: 57, train_loss: 0.7783, test_loss: 0.8537, test_f1: 0.5654
 epoch: 58, train_loss: 0.7914, test_loss: 0.8373, test_f1: 0.5996
 epoch: 59, train_loss: 0.7697, test_loss: 0.8403, test_f1: 0.5887
 epoch: 60, train_loss: 0.7776, test_loss: 0.8534, test_f1: 0.5624
 epoch: 61, train_loss: 0.7749, test_loss: 0.8583, test_f1: 0.5817
 epoch: 62, train_loss: 0.7767, test_loss: 0.8511, test_f1: 0.5724
 epoch: 63, train_loss: 0.7622, test_loss: 0.8766, test_f1: 0.5523
 epoch: 64, train_loss: 0.7663, test_loss: 0.8442, test_f1: 0.5653
 epoch: 65, train_loss: 0.7677, test_loss: 0.8592, test_f1: 0.5587
 epoch: 66, train_loss: 0.7647, test_loss: 0.8735, test_f1: 0.5541
 epoch: 67, train_loss: 0.7598, test_loss: 0.8614, test_f1: 0.5654
 epoch: 68, train_loss: 0.7659, test_loss: 0.8859, test_f1: 0.5564
 epoch: 69, train_loss: 0.7606, test_loss: 0.8841, test_f1: 0.5510
 epoch: 70, train_loss: 0.7591, test_loss: 0.8469, test_f1: 0.5497
 epoch: 71, train_loss: 0.7639, test_loss: 0.8927, test_f1: 0.5449
 epoch: 72, train_loss: 0.7567, test_loss: 0.8742, test_f1: 0.5611
 epoch: 73, train_loss: 0.7624, test_loss: 0.8878, test_f1: 0.5502
 epoch: 74, train_loss: 0.7654, test_loss: 0.8733, test_f1: 0.5457
 epoch: 75, train_loss: 0.7524, test_loss: 0.8689, test_f1: 0.5436
 epoch: 76, train_loss: 0.7545, test_loss: 0.8410, test_f1: 0.5734
 epoch: 77, train_loss: 0.7540, test_loss: 0.8447, test_f1: 0.5662
 epoch: 78, train_loss: 0.7476, test_loss: 0.8547, test_f1: 0.5732
 epoch: 79, train_loss: 0.7554, test_loss: 0.8597, test_f1: 0.5728
 epoch: 80, train_loss: 0.7457, test_loss: 0.8786, test_f1: 0.5670
 epoch: 81, train_loss: 0.7439, test_loss: 0.8614, test_f1: 0.5856
 epoch: 82, train_loss: 0.7314, test_loss: 0.8664, test_f1: 0.5833
 epoch: 83, train_loss: 0.7517, test_loss: 0.8745, test_f1: 0.5701
 epoch: 84, train_loss: 0.7432, test_loss: 0.8697, test_f1: 0.5829
 epoch: 85, train_loss: 0.7487, test_loss: 0.8719, test_f1: 0.5761
 epoch: 86, train_loss: 0.7426, test_loss: 0.8348, test_f1: 0.5989
 epoch: 87, train_loss: 0.7361, test_loss: 0.8543, test_f1: 0.5828
 epoch: 88, train_loss: 0.7386, test_loss: 0.8727, test_f1: 0.5798
 epoch: 89, train_loss: 0.7436, test_loss: 0.8402, test_f1: 0.5895
 epoch: 90, train_loss: 0.7393, test_loss: 0.8553, test_f1: 0.5760
 epoch: 91, train_loss: 0.7439, test_loss: 0.8242, test_f1: 0.5829
 epoch: 92, train_loss: 0.7461, test_loss: 0.8732, test_f1: 0.5772
 epoch: 93, train_loss: 0.7356, test_loss: 0.8712, test_f1: 0.5595
 epoch: 94, train_loss: 0.7506, test_loss: 0.8910, test_f1: 0.5884
 epoch: 95, train_loss: 0.7488, test_loss: 0.8755, test_f1: 0.5756
 epoch: 96, train_loss: 0.7575, test_loss: 0.8600, test_f1: 0.5938
 epoch: 97, train_loss: 0.7365, test_loss: 0.8593, test_f1: 0.6044
 epoch: 98, train_loss: 0.7512, test_loss: 0.9022, test_f1: 0.5593
 epoch: 99, train_loss: 0.7519, test_loss: 0.8607, test_f1: 0.5991

Training completed in 861.02 seconds
Best F1: 0.6044 at epoch 97
Mean F1 across iterations: 0.5703  0.0210
========================FINAL RESULTS================================
FEGIN weighted F1: 0.6044  0.0210
python main.py --data ltspice_examples --representation component_pin --model FEGIN --layers 4 --hiddens 16 --batch_size 64 --lr 0.001 --emb_size 250 --epochs 100 --save_appendix component_pin_L4_H16_BS64_LR0.001_E250 --no_val
-----



STDERR:
  File "main.py", line 370, in <module>
    main()
  File "main.py", line 254, in main
    dataset = dataset_class(
  File "/home/philip/projects/llm_inference_code_repo/Circuit-Completion-Using-GNNs/component_classification_with_link_prediction_head/evaluation/FEGIN/kernel/circuit_datasets.py", line 15, in __init__
    self.data, self.slices = torch.load(self.processed_paths[0])
  File "/home/philip/.local/lib/python3.8/site-packages/torch/serialization.py", line 1040, in load
    warnings.warn(
  File "/usr/lib/python3.8/warnings.py", line 109, in _showwarnmsg
    sw(msg.message, msg.category, msg.filename, msg.lineno,
  File "main.py", line 47, in warn_with_traceback
    traceback.print_stack(file=log)
/home/philip/projects/llm_inference_code_repo/Circuit-Completion-Using-GNNs/component_classification_with_link_prediction_head/evaluation/FEGIN/kernel/circuit_datasets.py:15: FutureWarning: You are using `torch.load` with `weights_only=False` (the current default value), which uses the default pickle module implicitly. It is possible to construct malicious pickle data which will execute arbitrary code during unpickling (See https://github.com/pytorch/pytorch/blob/main/SECURITY.md#untrusted-models for more details). In a future release, the default value for `weights_only` will be flipped to `True`. This limits the functions that could be executed during unpickling. Arbitrary objects will no longer be allowed to be loaded via this mode unless they are explicitly allowlisted by the user via `torch.serialization.add_safe_globals`. We recommend you start setting `weights_only=True` for any use case where you don't have full control of the loaded file. Please open an issue on GitHub for any issues related to this experimental feature.
  self.data, self.slices = torch.load(self.processed_paths[0])
