STDOUT:
Results will be saved in /home/philip/projects/ltspice_examples_code_repo/Circuit-Completion-Using-GNNs/component_classification_with_link_prediction_head/evaluation/FEGIN/results/model_FEGIN_dataset_ltspice_demos
Command line input: python main.py --data ltspice_demos --representation component_pin --model FEGIN --layers 2 --hiddens 32 --batch_size 32 --lr 0.001 --emb_size 512 --epochs 100 --save_appendix component_pin_L2_H32_BS32_LR0.001_E512 --no_val
 is saved.
-----
ltspice_demos - FEGIN
Using 2 layers, 32 hidden units, h = 2
Loading component_pin representation dataset
ENTERED
Training FEGIN on component_pin representation
Train: 1565, Test: 383
##################ITERATION #0 ****************************************
 epoch: 0, train_loss: 1.3144, test_loss: 1.2976, test_f1: 0.3480
 epoch: 1, train_loss: 1.1934, test_loss: 1.2006, test_f1: 0.3836
 epoch: 2, train_loss: 1.0871, test_loss: 1.1143, test_f1: 0.4246
 epoch: 3, train_loss: 1.0179, test_loss: 1.1128, test_f1: 0.3721
 epoch: 4, train_loss: 0.9972, test_loss: 1.0549, test_f1: 0.4638
 epoch: 5, train_loss: 0.9624, test_loss: 1.0285, test_f1: 0.4480
 epoch: 6, train_loss: 0.9468, test_loss: 1.0230, test_f1: 0.5224
 epoch: 7, train_loss: 0.9304, test_loss: 1.0242, test_f1: 0.5202
 epoch: 8, train_loss: 0.9065, test_loss: 0.9697, test_f1: 0.5738
 epoch: 9, train_loss: 0.8777, test_loss: 0.9987, test_f1: 0.5720
 epoch: 10, train_loss: 0.8636, test_loss: 0.9539, test_f1: 0.5855
 epoch: 11, train_loss: 0.8466, test_loss: 0.9520, test_f1: 0.5298
 epoch: 12, train_loss: 0.8293, test_loss: 0.9444, test_f1: 0.5704
 epoch: 13, train_loss: 0.7982, test_loss: 0.9740, test_f1: 0.6076
 epoch: 14, train_loss: 0.8133, test_loss: 0.9212, test_f1: 0.5522
 epoch: 15, train_loss: 0.7767, test_loss: 0.9600, test_f1: 0.5426
 epoch: 16, train_loss: 0.7712, test_loss: 0.9143, test_f1: 0.6256
 epoch: 17, train_loss: 0.7598, test_loss: 0.9693, test_f1: 0.5272
 epoch: 18, train_loss: 0.7505, test_loss: 0.9968, test_f1: 0.5750
 epoch: 19, train_loss: 0.7431, test_loss: 0.9013, test_f1: 0.5965
 epoch: 20, train_loss: 0.7500, test_loss: 0.9584, test_f1: 0.5604
 epoch: 21, train_loss: 0.7479, test_loss: 1.1094, test_f1: 0.5478
 epoch: 22, train_loss: 0.7370, test_loss: 0.9068, test_f1: 0.6047
 epoch: 23, train_loss: 0.7301, test_loss: 0.9473, test_f1: 0.5252
 epoch: 24, train_loss: 0.7284, test_loss: 0.9437, test_f1: 0.6050
 epoch: 25, train_loss: 0.7080, test_loss: 1.0209, test_f1: 0.5505
 epoch: 26, train_loss: 0.7064, test_loss: 0.9607, test_f1: 0.5580
 epoch: 27, train_loss: 0.6886, test_loss: 0.9727, test_f1: 0.5591
 epoch: 28, train_loss: 0.6893, test_loss: 1.1043, test_f1: 0.6018
 epoch: 29, train_loss: 0.6863, test_loss: 0.9839, test_f1: 0.5988
 epoch: 30, train_loss: 0.7009, test_loss: 0.9690, test_f1: 0.6043
 epoch: 31, train_loss: 0.6896, test_loss: 1.0268, test_f1: 0.5787
 epoch: 32, train_loss: 0.6790, test_loss: 1.1053, test_f1: 0.6011
 epoch: 33, train_loss: 0.6695, test_loss: 1.0037, test_f1: 0.6159
 epoch: 34, train_loss: 0.6613, test_loss: 0.9781, test_f1: 0.6127
 epoch: 35, train_loss: 0.6657, test_loss: 1.0772, test_f1: 0.5920
 epoch: 36, train_loss: 0.6834, test_loss: 1.0140, test_f1: 0.5342
 epoch: 37, train_loss: 0.6724, test_loss: 1.0175, test_f1: 0.6050
 epoch: 38, train_loss: 0.6632, test_loss: 0.9768, test_f1: 0.5825
 epoch: 39, train_loss: 0.6432, test_loss: 1.0422, test_f1: 0.5935
 epoch: 40, train_loss: 0.6457, test_loss: 1.0613, test_f1: 0.6040
 epoch: 41, train_loss: 0.6440, test_loss: 1.2158, test_f1: 0.5685
 epoch: 42, train_loss: 0.6320, test_loss: 1.1143, test_f1: 0.5809
 epoch: 43, train_loss: 0.6041, test_loss: 1.1399, test_f1: 0.6360
 epoch: 44, train_loss: 0.6234, test_loss: 1.1012, test_f1: 0.6137
 epoch: 45, train_loss: 0.6255, test_loss: 1.2011, test_f1: 0.6139
 epoch: 46, train_loss: 0.6101, test_loss: 1.0727, test_f1: 0.5872
 epoch: 47, train_loss: 0.6109, test_loss: 1.2655, test_f1: 0.6158
 epoch: 48, train_loss: 0.6093, test_loss: 1.1761, test_f1: 0.6195
 epoch: 49, train_loss: 0.6090, test_loss: 1.1354, test_f1: 0.6057
 epoch: 50, train_loss: 0.6236, test_loss: 1.2700, test_f1: 0.6042
 epoch: 51, train_loss: 0.5879, test_loss: 1.1077, test_f1: 0.6339
 epoch: 52, train_loss: 0.5714, test_loss: 1.0972, test_f1: 0.6400
 epoch: 53, train_loss: 0.5670, test_loss: 1.1252, test_f1: 0.6489
 epoch: 54, train_loss: 0.5677, test_loss: 1.1553, test_f1: 0.6305
 epoch: 55, train_loss: 0.5516, test_loss: 1.1776, test_f1: 0.6354
 epoch: 56, train_loss: 0.5584, test_loss: 1.1952, test_f1: 0.6420
 epoch: 57, train_loss: 0.5444, test_loss: 1.1862, test_f1: 0.6300
 epoch: 58, train_loss: 0.5545, test_loss: 1.1560, test_f1: 0.6232
 epoch: 59, train_loss: 0.5489, test_loss: 1.2250, test_f1: 0.6408
 epoch: 60, train_loss: 0.5375, test_loss: 1.2304, test_f1: 0.6438
 epoch: 61, train_loss: 0.5389, test_loss: 1.2002, test_f1: 0.6414
 epoch: 62, train_loss: 0.5374, test_loss: 1.2745, test_f1: 0.6242
 epoch: 63, train_loss: 0.5497, test_loss: 1.2822, test_f1: 0.6193
 epoch: 64, train_loss: 0.5477, test_loss: 1.2930, test_f1: 0.6116
 epoch: 65, train_loss: 0.5430, test_loss: 1.2443, test_f1: 0.6182
 epoch: 66, train_loss: 0.5469, test_loss: 1.2686, test_f1: 0.6123
 epoch: 67, train_loss: 0.5234, test_loss: 1.2765, test_f1: 0.6313
 epoch: 68, train_loss: 0.5325, test_loss: 1.2850, test_f1: 0.6443
 epoch: 69, train_loss: 0.5243, test_loss: 1.3788, test_f1: 0.6283
 epoch: 70, train_loss: 0.5098, test_loss: 1.3963, test_f1: 0.6300
 epoch: 71, train_loss: 0.5252, test_loss: 1.4094, test_f1: 0.6113
 epoch: 72, train_loss: 0.5293, test_loss: 1.2881, test_f1: 0.6033
 epoch: 73, train_loss: 0.5286, test_loss: 1.3556, test_f1: 0.6107
 epoch: 74, train_loss: 0.5144, test_loss: 1.3318, test_f1: 0.6184
 epoch: 75, train_loss: 0.5169, test_loss: 1.3292, test_f1: 0.6052
 epoch: 76, train_loss: 0.4941, test_loss: 1.2960, test_f1: 0.6326
 epoch: 77, train_loss: 0.4945, test_loss: 1.5387, test_f1: 0.6148
 epoch: 78, train_loss: 0.4743, test_loss: 1.3700, test_f1: 0.6109
 epoch: 79, train_loss: 0.5056, test_loss: 1.4711, test_f1: 0.6319
 epoch: 80, train_loss: 0.4960, test_loss: 1.2817, test_f1: 0.6389
 epoch: 81, train_loss: 0.5071, test_loss: 1.4026, test_f1: 0.6393
 epoch: 82, train_loss: 0.4952, test_loss: 1.3225, test_f1: 0.6406
 epoch: 83, train_loss: 0.4905, test_loss: 1.3776, test_f1: 0.6271
 epoch: 84, train_loss: 0.4874, test_loss: 1.4580, test_f1: 0.6406
 epoch: 85, train_loss: 0.4749, test_loss: 1.4888, test_f1: 0.6376
 epoch: 86, train_loss: 0.4631, test_loss: 1.5413, test_f1: 0.5971
 epoch: 87, train_loss: 0.4642, test_loss: 1.4852, test_f1: 0.6456
 epoch: 88, train_loss: 0.4897, test_loss: 1.4151, test_f1: 0.6237
 epoch: 89, train_loss: 0.4796, test_loss: 1.5510, test_f1: 0.6346
 epoch: 90, train_loss: 0.4627, test_loss: 1.4868, test_f1: 0.6497
 epoch: 91, train_loss: 0.4794, test_loss: 1.6229, test_f1: 0.6211
 epoch: 92, train_loss: 0.4628, test_loss: 1.5537, test_f1: 0.6507
 epoch: 93, train_loss: 0.4443, test_loss: 1.4294, test_f1: 0.6165
 epoch: 94, train_loss: 0.4490, test_loss: 1.3947, test_f1: 0.6389
 epoch: 95, train_loss: 0.4513, test_loss: 1.4791, test_f1: 0.6509
 epoch: 96, train_loss: 0.4637, test_loss: 1.4622, test_f1: 0.6255
 epoch: 97, train_loss: 0.4520, test_loss: 1.4727, test_f1: 0.6371
 epoch: 98, train_loss: 0.4356, test_loss: 1.4366, test_f1: 0.6693
 epoch: 99, train_loss: 0.4517, test_loss: 1.4773, test_f1: 0.6240
##################ITERATION #1 ****************************************
 epoch: 0, train_loss: 1.2074, test_loss: 1.2439, test_f1: 0.2348
 epoch: 1, train_loss: 1.0545, test_loss: 1.0843, test_f1: 0.4293
 epoch: 2, train_loss: 0.9750, test_loss: 1.0460, test_f1: 0.4459
 epoch: 3, train_loss: 0.9211, test_loss: 1.0174, test_f1: 0.4802
 epoch: 4, train_loss: 0.8776, test_loss: 0.9904, test_f1: 0.5567
 epoch: 5, train_loss: 0.8329, test_loss: 1.0237, test_f1: 0.5831
 epoch: 6, train_loss: 0.8117, test_loss: 1.0367, test_f1: 0.5796
 epoch: 7, train_loss: 0.7801, test_loss: 1.1365, test_f1: 0.5313
 epoch: 8, train_loss: 0.7782, test_loss: 1.0945, test_f1: 0.5768
 epoch: 9, train_loss: 0.7664, test_loss: 1.0313, test_f1: 0.5984
 epoch: 10, train_loss: 0.7441, test_loss: 1.0299, test_f1: 0.5794
 epoch: 11, train_loss: 0.7263, test_loss: 1.0739, test_f1: 0.5239
 epoch: 12, train_loss: 0.7383, test_loss: 1.0451, test_f1: 0.5666
 epoch: 13, train_loss: 0.7255, test_loss: 1.1003, test_f1: 0.5589
 epoch: 14, train_loss: 0.7002, test_loss: 1.1634, test_f1: 0.6097
 epoch: 15, train_loss: 0.6996, test_loss: 1.0971, test_f1: 0.6338
 epoch: 16, train_loss: 0.6840, test_loss: 1.0112, test_f1: 0.5781
 epoch: 17, train_loss: 0.6894, test_loss: 1.1340, test_f1: 0.5770
 epoch: 18, train_loss: 0.6822, test_loss: 1.1603, test_f1: 0.6301
 epoch: 19, train_loss: 0.6865, test_loss: 1.0314, test_f1: 0.5624
 epoch: 20, train_loss: 0.6977, test_loss: 1.3045, test_f1: 0.5614
 epoch: 21, train_loss: 0.6705, test_loss: 1.1179, test_f1: 0.6108
 epoch: 22, train_loss: 0.6500, test_loss: 1.1682, test_f1: 0.5906
 epoch: 23, train_loss: 0.6526, test_loss: 0.9991, test_f1: 0.6155
 epoch: 24, train_loss: 0.6442, test_loss: 1.1916, test_f1: 0.5841
 epoch: 25, train_loss: 0.6434, test_loss: 0.9691, test_f1: 0.6084
 epoch: 26, train_loss: 0.6306, test_loss: 1.0936, test_f1: 0.5677
 epoch: 27, train_loss: 0.6285, test_loss: 1.0285, test_f1: 0.5682
 epoch: 28, train_loss: 0.6176, test_loss: 1.2815, test_f1: 0.5627
 epoch: 29, train_loss: 0.6036, test_loss: 1.2175, test_f1: 0.5855
 epoch: 30, train_loss: 0.6137, test_loss: 1.1674, test_f1: 0.5977
 epoch: 31, train_loss: 0.5964, test_loss: 1.0227, test_f1: 0.6054
 epoch: 32, train_loss: 0.5853, test_loss: 1.0012, test_f1: 0.6229
 epoch: 33, train_loss: 0.5795, test_loss: 1.0860, test_f1: 0.5781
 epoch: 34, train_loss: 0.5882, test_loss: 1.1192, test_f1: 0.5790
 epoch: 35, train_loss: 0.6083, test_loss: 1.2361, test_f1: 0.6067
 epoch: 36, train_loss: 0.5637, test_loss: 1.2632, test_f1: 0.5899
 epoch: 37, train_loss: 0.5936, test_loss: 1.1687, test_f1: 0.6004
 epoch: 38, train_loss: 0.5742, test_loss: 1.0842, test_f1: 0.5751
 epoch: 39, train_loss: 0.5596, test_loss: 1.0998, test_f1: 0.5819
 epoch: 40, train_loss: 0.5688, test_loss: 1.0535, test_f1: 0.5911
 epoch: 41, train_loss: 0.5390, test_loss: 1.0751, test_f1: 0.6161
 epoch: 42, train_loss: 0.5588, test_loss: 1.1043, test_f1: 0.5890
 epoch: 43, train_loss: 0.5449, test_loss: 1.2268, test_f1: 0.5843
 epoch: 44, train_loss: 0.5201, test_loss: 1.2578, test_f1: 0.6347
 epoch: 45, train_loss: 0.5238, test_loss: 1.1662, test_f1: 0.5846
 epoch: 46, train_loss: 0.5270, test_loss: 1.2345, test_f1: 0.6059
 epoch: 47, train_loss: 0.5255, test_loss: 1.1809, test_f1: 0.6159
 epoch: 48, train_loss: 0.5139, test_loss: 1.2173, test_f1: 0.5919
 epoch: 49, train_loss: 0.5194, test_loss: 1.1475, test_f1: 0.6210
 epoch: 50, train_loss: 0.5209, test_loss: 1.2578, test_f1: 0.6153
 epoch: 51, train_loss: 0.4988, test_loss: 1.3355, test_f1: 0.5876
 epoch: 52, train_loss: 0.4922, test_loss: 1.3291, test_f1: 0.6098
 epoch: 53, train_loss: 0.4644, test_loss: 1.2532, test_f1: 0.6493
 epoch: 54, train_loss: 0.4576, test_loss: 1.1492, test_f1: 0.6481
 epoch: 55, train_loss: 0.4509, test_loss: 1.2530, test_f1: 0.6126
 epoch: 56, train_loss: 0.4483, test_loss: 1.2636, test_f1: 0.6087
 epoch: 57, train_loss: 0.4435, test_loss: 1.1828, test_f1: 0.5986
 epoch: 58, train_loss: 0.4404, test_loss: 1.3394, test_f1: 0.6390
 epoch: 59, train_loss: 0.4447, test_loss: 1.3277, test_f1: 0.5999
 epoch: 60, train_loss: 0.4453, test_loss: 1.2981, test_f1: 0.6445
 epoch: 61, train_loss: 0.4334, test_loss: 1.3630, test_f1: 0.6014
 epoch: 62, train_loss: 0.4414, test_loss: 1.3307, test_f1: 0.6288
 epoch: 63, train_loss: 0.4405, test_loss: 1.3503, test_f1: 0.5901
 epoch: 64, train_loss: 0.4298, test_loss: 1.4329, test_f1: 0.6089
 epoch: 65, train_loss: 0.4357, test_loss: 1.5001, test_f1: 0.5942
 epoch: 66, train_loss: 0.4351, test_loss: 1.3934, test_f1: 0.5704
 epoch: 67, train_loss: 0.4171, test_loss: 1.3418, test_f1: 0.6186
 epoch: 68, train_loss: 0.4153, test_loss: 1.4800, test_f1: 0.6347
 epoch: 69, train_loss: 0.4229, test_loss: 1.3703, test_f1: 0.6181
 epoch: 70, train_loss: 0.4069, test_loss: 1.4217, test_f1: 0.5849
 epoch: 71, train_loss: 0.4073, test_loss: 1.5406, test_f1: 0.6030
 epoch: 72, train_loss: 0.4238, test_loss: 1.5686, test_f1: 0.6042
 epoch: 73, train_loss: 0.4096, test_loss: 1.5225, test_f1: 0.5937
 epoch: 74, train_loss: 0.3787, test_loss: 1.6025, test_f1: 0.6047
 epoch: 75, train_loss: 0.4162, test_loss: 1.6196, test_f1: 0.6062
 epoch: 76, train_loss: 0.3918, test_loss: 1.4583, test_f1: 0.6178
 epoch: 77, train_loss: 0.3966, test_loss: 1.4942, test_f1: 0.6004
 epoch: 78, train_loss: 0.3924, test_loss: 1.3983, test_f1: 0.6060
 epoch: 79, train_loss: 0.3969, test_loss: 1.5393, test_f1: 0.6119
 epoch: 80, train_loss: 0.4058, test_loss: 1.4110, test_f1: 0.6140
 epoch: 81, train_loss: 0.3749, test_loss: 1.6777, test_f1: 0.5978
 epoch: 82, train_loss: 0.3680, test_loss: 1.4451, test_f1: 0.6305
 epoch: 83, train_loss: 0.3883, test_loss: 1.4506, test_f1: 0.6214
 epoch: 84, train_loss: 0.3658, test_loss: 1.5800, test_f1: 0.6154
 epoch: 85, train_loss: 0.3740, test_loss: 1.5694, test_f1: 0.6406
 epoch: 86, train_loss: 0.3897, test_loss: 1.6206, test_f1: 0.6046
 epoch: 87, train_loss: 0.3590, test_loss: 1.7135, test_f1: 0.6045
 epoch: 88, train_loss: 0.3685, test_loss: 1.6162, test_f1: 0.6332
 epoch: 89, train_loss: 0.3843, test_loss: 1.5001, test_f1: 0.6097
 epoch: 90, train_loss: 0.3707, test_loss: 1.4977, test_f1: 0.6220
 epoch: 91, train_loss: 0.3576, test_loss: 1.6779, test_f1: 0.5991
 epoch: 92, train_loss: 0.3548, test_loss: 1.5559, test_f1: 0.5961
 epoch: 93, train_loss: 0.3533, test_loss: 1.4438, test_f1: 0.6237
 epoch: 94, train_loss: 0.3559, test_loss: 1.4970, test_f1: 0.6139
 epoch: 95, train_loss: 0.3580, test_loss: 1.5997, test_f1: 0.6236
 epoch: 96, train_loss: 0.3366, test_loss: 1.7528, test_f1: 0.6127
 epoch: 97, train_loss: 0.3474, test_loss: 1.5431, test_f1: 0.6324
 epoch: 98, train_loss: 0.3747, test_loss: 1.7446, test_f1: 0.6187
 epoch: 99, train_loss: 0.3333, test_loss: 1.6491, test_f1: 0.6159
##################ITERATION #2 ****************************************
 epoch: 0, train_loss: 1.2087, test_loss: 1.2072, test_f1: 0.3231
 epoch: 1, train_loss: 1.0610, test_loss: 1.0857, test_f1: 0.4860
 epoch: 2, train_loss: 0.9884, test_loss: 1.0241, test_f1: 0.5483
 epoch: 3, train_loss: 0.9414, test_loss: 1.0279, test_f1: 0.5494
 epoch: 4, train_loss: 0.9004, test_loss: 1.0379, test_f1: 0.5776
 epoch: 5, train_loss: 0.8664, test_loss: 1.0282, test_f1: 0.5649
 epoch: 6, train_loss: 0.8609, test_loss: 1.0850, test_f1: 0.5342
 epoch: 7, train_loss: 0.8404, test_loss: 1.0446, test_f1: 0.6011
 epoch: 8, train_loss: 0.8383, test_loss: 1.0148, test_f1: 0.5945
 epoch: 9, train_loss: 0.8044, test_loss: 1.0705, test_f1: 0.5818
 epoch: 10, train_loss: 0.7833, test_loss: 1.0462, test_f1: 0.5894
 epoch: 11, train_loss: 0.7758, test_loss: 1.1417, test_f1: 0.6174
 epoch: 12, train_loss: 0.7621, test_loss: 1.0978, test_f1: 0.5797
 epoch: 13, train_loss: 0.7501, test_loss: 0.9542, test_f1: 0.5865
 epoch: 14, train_loss: 0.7252, test_loss: 0.9983, test_f1: 0.5992
 epoch: 15, train_loss: 0.7069, test_loss: 1.1029, test_f1: 0.6086
 epoch: 16, train_loss: 0.7176, test_loss: 1.0528, test_f1: 0.5808
 epoch: 17, train_loss: 0.7062, test_loss: 1.1627, test_f1: 0.5431
 epoch: 18, train_loss: 0.7021, test_loss: 1.1882, test_f1: 0.5941
 epoch: 19, train_loss: 0.7021, test_loss: 1.3155, test_f1: 0.5657
 epoch: 20, train_loss: 0.6991, test_loss: 1.0559, test_f1: 0.5457
 epoch: 21, train_loss: 0.6781, test_loss: 1.0444, test_f1: 0.5806
 epoch: 22, train_loss: 0.6750, test_loss: 1.3372, test_f1: 0.5739
 epoch: 23, train_loss: 0.6541, test_loss: 1.2092, test_f1: 0.5722
 epoch: 24, train_loss: 0.6743, test_loss: 0.9896, test_f1: 0.5902
 epoch: 25, train_loss: 0.6628, test_loss: 1.2350, test_f1: 0.5467
 epoch: 26, train_loss: 0.6482, test_loss: 1.0388, test_f1: 0.6171
 epoch: 27, train_loss: 0.6619, test_loss: 1.2999, test_f1: 0.6120
 epoch: 28, train_loss: 0.6208, test_loss: 1.2337, test_f1: 0.5980
 epoch: 29, train_loss: 0.6485, test_loss: 1.0611, test_f1: 0.5612
 epoch: 30, train_loss: 0.6018, test_loss: 1.3333, test_f1: 0.5259
 epoch: 31, train_loss: 0.6165, test_loss: 1.2486, test_f1: 0.5661
 epoch: 32, train_loss: 0.6107, test_loss: 1.2696, test_f1: 0.5541
 epoch: 33, train_loss: 0.5939, test_loss: 1.1714, test_f1: 0.5840
 epoch: 34, train_loss: 0.5976, test_loss: 1.7525, test_f1: 0.5550
 epoch: 35, train_loss: 0.6066, test_loss: 1.1997, test_f1: 0.5208
 epoch: 36, train_loss: 0.5844, test_loss: 1.2472, test_f1: 0.5247
 epoch: 37, train_loss: 0.5939, test_loss: 1.2484, test_f1: 0.5470
 epoch: 38, train_loss: 0.5822, test_loss: 1.2286, test_f1: 0.5703
 epoch: 39, train_loss: 0.5878, test_loss: 1.2607, test_f1: 0.5790
 epoch: 40, train_loss: 0.5663, test_loss: 1.1581, test_f1: 0.5817
 epoch: 41, train_loss: 0.5378, test_loss: 1.4345, test_f1: 0.5478
 epoch: 42, train_loss: 0.5843, test_loss: 1.1844, test_f1: 0.6476
 epoch: 43, train_loss: 0.5439, test_loss: 1.2664, test_f1: 0.6050
 epoch: 44, train_loss: 0.5727, test_loss: 1.3746, test_f1: 0.6117
 epoch: 45, train_loss: 0.5684, test_loss: 1.1196, test_f1: 0.6588
 epoch: 46, train_loss: 0.5451, test_loss: 1.4514, test_f1: 0.5881
 epoch: 47, train_loss: 0.5255, test_loss: 1.4337, test_f1: 0.5724
 epoch: 48, train_loss: 0.5062, test_loss: 1.5944, test_f1: 0.5703
 epoch: 49, train_loss: 0.5241, test_loss: 1.4619, test_f1: 0.6137
 epoch: 50, train_loss: 0.5160, test_loss: 1.3776, test_f1: 0.5781
 epoch: 51, train_loss: 0.4962, test_loss: 1.5618, test_f1: 0.5618
 epoch: 52, train_loss: 0.4764, test_loss: 1.6307, test_f1: 0.5995
 epoch: 53, train_loss: 0.4662, test_loss: 1.5643, test_f1: 0.5714
 epoch: 54, train_loss: 0.4764, test_loss: 1.5081, test_f1: 0.5805
 epoch: 55, train_loss: 0.4696, test_loss: 1.4868, test_f1: 0.5951
 epoch: 56, train_loss: 0.4603, test_loss: 1.5999, test_f1: 0.5557
 epoch: 57, train_loss: 0.4828, test_loss: 1.7790, test_f1: 0.5658
 epoch: 58, train_loss: 0.4491, test_loss: 1.6053, test_f1: 0.5680
 epoch: 59, train_loss: 0.4388, test_loss: 1.5598, test_f1: 0.5824
 epoch: 60, train_loss: 0.4301, test_loss: 1.6378, test_f1: 0.6100
 epoch: 61, train_loss: 0.4337, test_loss: 1.8495, test_f1: 0.5654
 epoch: 62, train_loss: 0.4247, test_loss: 1.6934, test_f1: 0.5829
 epoch: 63, train_loss: 0.4343, test_loss: 1.5381, test_f1: 0.6071
 epoch: 64, train_loss: 0.4230, test_loss: 1.5430, test_f1: 0.6346
 epoch: 65, train_loss: 0.4332, test_loss: 1.6668, test_f1: 0.6009
 epoch: 66, train_loss: 0.4274, test_loss: 1.8721, test_f1: 0.5326
 epoch: 67, train_loss: 0.4265, test_loss: 1.8657, test_f1: 0.5628
 epoch: 68, train_loss: 0.4138, test_loss: 1.9195, test_f1: 0.5482
 epoch: 69, train_loss: 0.4173, test_loss: 1.8383, test_f1: 0.5957
 epoch: 70, train_loss: 0.4381, test_loss: 1.9031, test_f1: 0.5675
 epoch: 71, train_loss: 0.4227, test_loss: 1.9117, test_f1: 0.5662
 epoch: 72, train_loss: 0.4108, test_loss: 1.7754, test_f1: 0.5901
 epoch: 73, train_loss: 0.4125, test_loss: 1.7833, test_f1: 0.5775
 epoch: 74, train_loss: 0.3968, test_loss: 1.7429, test_f1: 0.5806
 epoch: 75, train_loss: 0.4066, test_loss: 1.9404, test_f1: 0.5905
 epoch: 76, train_loss: 0.3972, test_loss: 1.8442, test_f1: 0.5747
 epoch: 77, train_loss: 0.3789, test_loss: 1.9141, test_f1: 0.6124
 epoch: 78, train_loss: 0.3824, test_loss: 2.2075, test_f1: 0.5761
 epoch: 79, train_loss: 0.3933, test_loss: 1.9821, test_f1: 0.5524
 epoch: 80, train_loss: 0.3757, test_loss: 2.1597, test_f1: 0.5705
 epoch: 81, train_loss: 0.4047, test_loss: 2.0213, test_f1: 0.5278
 epoch: 82, train_loss: 0.3797, test_loss: 1.7594, test_f1: 0.6034
 epoch: 83, train_loss: 0.3725, test_loss: 1.9564, test_f1: 0.5829
 epoch: 84, train_loss: 0.3793, test_loss: 1.8383, test_f1: 0.5842
 epoch: 85, train_loss: 0.3821, test_loss: 1.8451, test_f1: 0.5925
 epoch: 86, train_loss: 0.3750, test_loss: 1.6423, test_f1: 0.6133
 epoch: 87, train_loss: 0.3842, test_loss: 1.6696, test_f1: 0.5871
 epoch: 88, train_loss: 0.3550, test_loss: 2.1891, test_f1: 0.5675
 epoch: 89, train_loss: 0.3643, test_loss: 1.7550, test_f1: 0.5568
 epoch: 90, train_loss: 0.3613, test_loss: 2.0539, test_f1: 0.5538
 epoch: 91, train_loss: 0.3599, test_loss: 1.9272, test_f1: 0.5983
 epoch: 92, train_loss: 0.3597, test_loss: 2.0046, test_f1: 0.5879
 epoch: 93, train_loss: 0.3715, test_loss: 1.8064, test_f1: 0.6293
 epoch: 94, train_loss: 0.3480, test_loss: 2.1969, test_f1: 0.5711
 epoch: 95, train_loss: 0.3359, test_loss: 2.0233, test_f1: 0.5891
 epoch: 96, train_loss: 0.3293, test_loss: 2.0853, test_f1: 0.5665
 epoch: 97, train_loss: 0.3747, test_loss: 2.0338, test_f1: 0.5587
 epoch: 98, train_loss: 0.3587, test_loss: 1.9109, test_f1: 0.5783
 epoch: 99, train_loss: 0.3522, test_loss: 1.8651, test_f1: 0.6186
##################ITERATION #3 ****************************************
 epoch: 0, train_loss: 1.3349, test_loss: 1.1919, test_f1: 0.2782
 epoch: 1, train_loss: 1.0388, test_loss: 1.0564, test_f1: 0.5184
 epoch: 2, train_loss: 1.0000, test_loss: 1.0079, test_f1: 0.5640
 epoch: 3, train_loss: 0.9257, test_loss: 1.0035, test_f1: 0.5764
 epoch: 4, train_loss: 0.8974, test_loss: 1.0233, test_f1: 0.5707
 epoch: 5, train_loss: 0.8677, test_loss: 0.9562, test_f1: 0.5860
 epoch: 6, train_loss: 0.8417, test_loss: 0.9557, test_f1: 0.6050
 epoch: 7, train_loss: 0.8078, test_loss: 0.9756, test_f1: 0.5767
 epoch: 8, train_loss: 0.7972, test_loss: 0.9926, test_f1: 0.6028
 epoch: 9, train_loss: 0.7837, test_loss: 0.9660, test_f1: 0.6023
 epoch: 10, train_loss: 0.7735, test_loss: 0.9363, test_f1: 0.6209
 epoch: 11, train_loss: 0.7537, test_loss: 0.9506, test_f1: 0.6005
 epoch: 12, train_loss: 0.7408, test_loss: 0.9227, test_f1: 0.6023
 epoch: 13, train_loss: 0.7252, test_loss: 0.9966, test_f1: 0.5696
 epoch: 14, train_loss: 0.7320, test_loss: 0.9424, test_f1: 0.5894
 epoch: 15, train_loss: 0.7129, test_loss: 0.9511, test_f1: 0.6233
 epoch: 16, train_loss: 0.7227, test_loss: 0.9526, test_f1: 0.5909
 epoch: 17, train_loss: 0.7180, test_loss: 0.9639, test_f1: 0.6127
 epoch: 18, train_loss: 0.7023, test_loss: 1.0124, test_f1: 0.5679
 epoch: 19, train_loss: 0.6943, test_loss: 0.9156, test_f1: 0.6012
 epoch: 20, train_loss: 0.6818, test_loss: 1.1083, test_f1: 0.5378
 epoch: 21, train_loss: 0.6654, test_loss: 1.0451, test_f1: 0.5578
 epoch: 22, train_loss: 0.6659, test_loss: 0.9613, test_f1: 0.5822
 epoch: 23, train_loss: 0.6675, test_loss: 1.0702, test_f1: 0.5732
 epoch: 24, train_loss: 0.6543, test_loss: 0.9924, test_f1: 0.5503
 epoch: 25, train_loss: 0.6537, test_loss: 0.9104, test_f1: 0.6501
 epoch: 26, train_loss: 0.6249, test_loss: 1.0812, test_f1: 0.5888
 epoch: 27, train_loss: 0.6273, test_loss: 0.9758, test_f1: 0.6128
 epoch: 28, train_loss: 0.6275, test_loss: 1.1035, test_f1: 0.5953
 epoch: 29, train_loss: 0.6097, test_loss: 1.1211, test_f1: 0.5720
 epoch: 30, train_loss: 0.5994, test_loss: 1.0164, test_f1: 0.6138
 epoch: 31, train_loss: 0.5926, test_loss: 1.0519, test_f1: 0.6124
 epoch: 32, train_loss: 0.5878, test_loss: 1.1950, test_f1: 0.5551
 epoch: 33, train_loss: 0.5786, test_loss: 1.1378, test_f1: 0.5798
 epoch: 34, train_loss: 0.5927, test_loss: 1.2829, test_f1: 0.5517
 epoch: 35, train_loss: 0.6040, test_loss: 1.1024, test_f1: 0.6114
 epoch: 36, train_loss: 0.5754, test_loss: 1.1436, test_f1: 0.5974
 epoch: 37, train_loss: 0.5660, test_loss: 1.1744, test_f1: 0.5654
 epoch: 38, train_loss: 0.5839, test_loss: 1.1250, test_f1: 0.6186
 epoch: 39, train_loss: 0.5534, test_loss: 1.2082, test_f1: 0.5888
 epoch: 40, train_loss: 0.5379, test_loss: 1.3111, test_f1: 0.5902
 epoch: 41, train_loss: 0.5425, test_loss: 1.1195, test_f1: 0.5733
 epoch: 42, train_loss: 0.5528, test_loss: 1.5066, test_f1: 0.5192
 epoch: 43, train_loss: 0.5589, test_loss: 1.3027, test_f1: 0.5965
 epoch: 44, train_loss: 0.5440, test_loss: 1.1138, test_f1: 0.6047
 epoch: 45, train_loss: 0.5056, test_loss: 1.2379, test_f1: 0.5842
 epoch: 46, train_loss: 0.5183, test_loss: 1.2837, test_f1: 0.6077
 epoch: 47, train_loss: 0.5277, test_loss: 1.2928, test_f1: 0.5782
 epoch: 48, train_loss: 0.5201, test_loss: 1.2087, test_f1: 0.6124
 epoch: 49, train_loss: 0.5133, test_loss: 1.2811, test_f1: 0.6314
 epoch: 50, train_loss: 0.5257, test_loss: 1.3575, test_f1: 0.5820
 epoch: 51, train_loss: 0.4945, test_loss: 1.2682, test_f1: 0.6366
 epoch: 52, train_loss: 0.4803, test_loss: 1.2142, test_f1: 0.6188
 epoch: 53, train_loss: 0.4628, test_loss: 1.2926, test_f1: 0.6078
 epoch: 54, train_loss: 0.4578, test_loss: 1.1981, test_f1: 0.6070
 epoch: 55, train_loss: 0.4349, test_loss: 1.3960, test_f1: 0.6286
 epoch: 56, train_loss: 0.4692, test_loss: 1.3072, test_f1: 0.6391
 epoch: 57, train_loss: 0.4520, test_loss: 1.3474, test_f1: 0.6420
 epoch: 58, train_loss: 0.4274, test_loss: 1.3893, test_f1: 0.6191
 epoch: 59, train_loss: 0.4459, test_loss: 1.4483, test_f1: 0.6330
 epoch: 60, train_loss: 0.4233, test_loss: 1.3800, test_f1: 0.6268
 epoch: 61, train_loss: 0.4389, test_loss: 1.3891, test_f1: 0.6335
 epoch: 62, train_loss: 0.4116, test_loss: 1.4201, test_f1: 0.6061
 epoch: 63, train_loss: 0.4468, test_loss: 1.4380, test_f1: 0.6450
 epoch: 64, train_loss: 0.4137, test_loss: 1.5415, test_f1: 0.6296
 epoch: 65, train_loss: 0.4150, test_loss: 1.4960, test_f1: 0.6048
 epoch: 66, train_loss: 0.4063, test_loss: 1.5561, test_f1: 0.6224
 epoch: 67, train_loss: 0.4153, test_loss: 1.5409, test_f1: 0.6177
 epoch: 68, train_loss: 0.4023, test_loss: 1.5415, test_f1: 0.6079
 epoch: 69, train_loss: 0.4363, test_loss: 1.6877, test_f1: 0.6126
 epoch: 70, train_loss: 0.4249, test_loss: 1.4945, test_f1: 0.6090
 epoch: 71, train_loss: 0.4258, test_loss: 1.6508, test_f1: 0.6008
 epoch: 72, train_loss: 0.4089, test_loss: 1.5043, test_f1: 0.6198
 epoch: 73, train_loss: 0.4134, test_loss: 1.5544, test_f1: 0.6280
 epoch: 74, train_loss: 0.4169, test_loss: 1.4244, test_f1: 0.6296
 epoch: 75, train_loss: 0.3822, test_loss: 1.6384, test_f1: 0.6270
 epoch: 76, train_loss: 0.3686, test_loss: 1.6474, test_f1: 0.6186
 epoch: 77, train_loss: 0.3690, test_loss: 1.7353, test_f1: 0.6200
 epoch: 78, train_loss: 0.3738, test_loss: 1.6807, test_f1: 0.6209
 epoch: 79, train_loss: 0.3774, test_loss: 1.6617, test_f1: 0.6308
 epoch: 80, train_loss: 0.3697, test_loss: 1.6213, test_f1: 0.6356
 epoch: 81, train_loss: 0.3768, test_loss: 1.7319, test_f1: 0.5874
 epoch: 82, train_loss: 0.3645, test_loss: 1.6800, test_f1: 0.6177
 epoch: 83, train_loss: 0.3933, test_loss: 1.6378, test_f1: 0.6202
 epoch: 84, train_loss: 0.3767, test_loss: 1.7642, test_f1: 0.5987
 epoch: 85, train_loss: 0.3564, test_loss: 1.6576, test_f1: 0.6386
 epoch: 86, train_loss: 0.3590, test_loss: 1.8971, test_f1: 0.6341
 epoch: 87, train_loss: 0.3910, test_loss: 1.9143, test_f1: 0.5977
 epoch: 88, train_loss: 0.3589, test_loss: 1.7241, test_f1: 0.6431
 epoch: 89, train_loss: 0.3706, test_loss: 1.8784, test_f1: 0.6314
 epoch: 90, train_loss: 0.3555, test_loss: 1.7786, test_f1: 0.6309
 epoch: 91, train_loss: 0.3761, test_loss: 2.0557, test_f1: 0.6205
 epoch: 92, train_loss: 0.3454, test_loss: 1.8614, test_f1: 0.6426
 epoch: 93, train_loss: 0.3560, test_loss: 1.9310, test_f1: 0.6119
 epoch: 94, train_loss: 0.3491, test_loss: 1.9477, test_f1: 0.6136
 epoch: 95, train_loss: 0.3589, test_loss: 1.8685, test_f1: 0.6248
 epoch: 96, train_loss: 0.3569, test_loss: 1.9544, test_f1: 0.6166
 epoch: 97, train_loss: 0.3663, test_loss: 1.8505, test_f1: 0.6367
 epoch: 98, train_loss: 0.3509, test_loss: 1.9414, test_f1: 0.6359
 epoch: 99, train_loss: 0.3622, test_loss: 1.9583, test_f1: 0.5971
##################ITERATION #4 ****************************************
 epoch: 0, train_loss: 1.2879, test_loss: 1.2483, test_f1: 0.2833
 epoch: 1, train_loss: 1.1022, test_loss: 1.0850, test_f1: 0.5032
 epoch: 2, train_loss: 1.0080, test_loss: 1.0877, test_f1: 0.5038
 epoch: 3, train_loss: 0.9749, test_loss: 1.0331, test_f1: 0.5387
 epoch: 4, train_loss: 0.9458, test_loss: 0.9928, test_f1: 0.5642
 epoch: 5, train_loss: 0.9153, test_loss: 1.0246, test_f1: 0.5277
 epoch: 6, train_loss: 0.8837, test_loss: 0.9984, test_f1: 0.5155
 epoch: 7, train_loss: 0.8860, test_loss: 1.1035, test_f1: 0.4924
 epoch: 8, train_loss: 0.8672, test_loss: 1.0268, test_f1: 0.5491
 epoch: 9, train_loss: 0.8539, test_loss: 1.0045, test_f1: 0.5501
 epoch: 10, train_loss: 0.8460, test_loss: 0.9586, test_f1: 0.5972
 epoch: 11, train_loss: 0.8222, test_loss: 0.9830, test_f1: 0.5820
 epoch: 12, train_loss: 0.8257, test_loss: 1.0637, test_f1: 0.5030
 epoch: 13, train_loss: 0.8208, test_loss: 0.9382, test_f1: 0.6399
 epoch: 14, train_loss: 0.8030, test_loss: 0.9764, test_f1: 0.5859
 epoch: 15, train_loss: 0.7841, test_loss: 0.9916, test_f1: 0.5275
 epoch: 16, train_loss: 0.7908, test_loss: 1.1145, test_f1: 0.5243
 epoch: 17, train_loss: 0.7799, test_loss: 0.9709, test_f1: 0.5376
 epoch: 18, train_loss: 0.7605, test_loss: 1.0388, test_f1: 0.5762
 epoch: 19, train_loss: 0.7300, test_loss: 0.9996, test_f1: 0.5616
 epoch: 20, train_loss: 0.7455, test_loss: 1.0395, test_f1: 0.5366
 epoch: 21, train_loss: 0.7313, test_loss: 1.0042, test_f1: 0.5938
 epoch: 22, train_loss: 0.7482, test_loss: 1.0604, test_f1: 0.5677
 epoch: 23, train_loss: 0.7334, test_loss: 1.1849, test_f1: 0.5304
 epoch: 24, train_loss: 0.7625, test_loss: 1.0384, test_f1: 0.5853
 epoch: 25, train_loss: 0.7375, test_loss: 1.1601, test_f1: 0.5257
 epoch: 26, train_loss: 0.6980, test_loss: 1.0080, test_f1: 0.5725
 epoch: 27, train_loss: 0.7018, test_loss: 1.0943, test_f1: 0.6109
 epoch: 28, train_loss: 0.7081, test_loss: 0.9989, test_f1: 0.6224
 epoch: 29, train_loss: 0.6706, test_loss: 1.2330, test_f1: 0.5156
 epoch: 30, train_loss: 0.6744, test_loss: 1.0433, test_f1: 0.6121
 epoch: 31, train_loss: 0.6560, test_loss: 1.0476, test_f1: 0.5948
 epoch: 32, train_loss: 0.6555, test_loss: 1.1539, test_f1: 0.6005
 epoch: 33, train_loss: 0.6799, test_loss: 1.0584, test_f1: 0.5947
 epoch: 34, train_loss: 0.6791, test_loss: 0.9594, test_f1: 0.6279
 epoch: 35, train_loss: 0.6654, test_loss: 1.0701, test_f1: 0.5660
 epoch: 36, train_loss: 0.6392, test_loss: 1.0570, test_f1: 0.6364
 epoch: 37, train_loss: 0.6343, test_loss: 1.1161, test_f1: 0.5859
 epoch: 38, train_loss: 0.6446, test_loss: 1.2825, test_f1: 0.5522
 epoch: 39, train_loss: 0.6449, test_loss: 1.2246, test_f1: 0.5995
 epoch: 40, train_loss: 0.6283, test_loss: 1.1007, test_f1: 0.6379
 epoch: 41, train_loss: 0.6077, test_loss: 1.1085, test_f1: 0.6307
 epoch: 42, train_loss: 0.6135, test_loss: 1.1715, test_f1: 0.5947
 epoch: 43, train_loss: 0.6101, test_loss: 1.1236, test_f1: 0.6203
 epoch: 44, train_loss: 0.6395, test_loss: 1.1863, test_f1: 0.6379
 epoch: 45, train_loss: 0.6284, test_loss: 1.1961, test_f1: 0.5649
 epoch: 46, train_loss: 0.6040, test_loss: 1.1338, test_f1: 0.6178
 epoch: 47, train_loss: 0.5760, test_loss: 1.2195, test_f1: 0.5951
 epoch: 48, train_loss: 0.5987, test_loss: 1.1726, test_f1: 0.6320
 epoch: 49, train_loss: 0.5949, test_loss: 1.1855, test_f1: 0.6122
 epoch: 50, train_loss: 0.5774, test_loss: 1.3695, test_f1: 0.5413
 epoch: 51, train_loss: 0.5652, test_loss: 1.2095, test_f1: 0.6190
 epoch: 52, train_loss: 0.5534, test_loss: 1.2412, test_f1: 0.6090
 epoch: 53, train_loss: 0.5430, test_loss: 1.2085, test_f1: 0.6059
 epoch: 54, train_loss: 0.5706, test_loss: 1.2795, test_f1: 0.5767
 epoch: 55, train_loss: 0.5438, test_loss: 1.2476, test_f1: 0.5965
 epoch: 56, train_loss: 0.5257, test_loss: 1.1639, test_f1: 0.5901
 epoch: 57, train_loss: 0.5347, test_loss: 1.3085, test_f1: 0.6016
 epoch: 58, train_loss: 0.5280, test_loss: 1.3561, test_f1: 0.5993
 epoch: 59, train_loss: 0.5453, test_loss: 1.1740, test_f1: 0.6073
 epoch: 60, train_loss: 0.5213, test_loss: 1.4430, test_f1: 0.5803
 epoch: 61, train_loss: 0.5088, test_loss: 1.2407, test_f1: 0.6429
 epoch: 62, train_loss: 0.5245, test_loss: 1.4510, test_f1: 0.5946
 epoch: 63, train_loss: 0.5265, test_loss: 1.1458, test_f1: 0.6749
 epoch: 64, train_loss: 0.5200, test_loss: 1.4077, test_f1: 0.5886
 epoch: 65, train_loss: 0.5148, test_loss: 1.2131, test_f1: 0.6106
 epoch: 66, train_loss: 0.5002, test_loss: 1.3091, test_f1: 0.6089
 epoch: 67, train_loss: 0.5177, test_loss: 1.4980, test_f1: 0.5704
 epoch: 68, train_loss: 0.4988, test_loss: 1.4136, test_f1: 0.5845
 epoch: 69, train_loss: 0.5088, test_loss: 1.4590, test_f1: 0.5962
 epoch: 70, train_loss: 0.4947, test_loss: 1.3904, test_f1: 0.5813
 epoch: 71, train_loss: 0.4895, test_loss: 1.2896, test_f1: 0.6334
 epoch: 72, train_loss: 0.4985, test_loss: 1.3665, test_f1: 0.6122
 epoch: 73, train_loss: 0.4790, test_loss: 1.3091, test_f1: 0.6246
 epoch: 74, train_loss: 0.4974, test_loss: 1.3748, test_f1: 0.6520
 epoch: 75, train_loss: 0.4644, test_loss: 1.4759, test_f1: 0.5594
 epoch: 76, train_loss: 0.4874, test_loss: 1.5516, test_f1: 0.5786
 epoch: 77, train_loss: 0.4760, test_loss: 1.5626, test_f1: 0.5840
 epoch: 78, train_loss: 0.4707, test_loss: 1.4044, test_f1: 0.5860
 epoch: 79, train_loss: 0.4692, test_loss: 1.5052, test_f1: 0.5774
 epoch: 80, train_loss: 0.4761, test_loss: 1.4116, test_f1: 0.6080
 epoch: 81, train_loss: 0.4886, test_loss: 1.5066, test_f1: 0.5775
 epoch: 82, train_loss: 0.4637, test_loss: 1.4288, test_f1: 0.6353
 epoch: 83, train_loss: 0.4645, test_loss: 1.3800, test_f1: 0.6082
 epoch: 84, train_loss: 0.4522, test_loss: 1.4854, test_f1: 0.5851
 epoch: 85, train_loss: 0.4824, test_loss: 1.5625, test_f1: 0.5645
 epoch: 86, train_loss: 0.4796, test_loss: 1.6511, test_f1: 0.5652
 epoch: 87, train_loss: 0.4558, test_loss: 1.4372, test_f1: 0.6004
 epoch: 88, train_loss: 0.4497, test_loss: 1.4622, test_f1: 0.6108
 epoch: 89, train_loss: 0.4546, test_loss: 1.5315, test_f1: 0.6367
 epoch: 90, train_loss: 0.4517, test_loss: 1.5979, test_f1: 0.5863
 epoch: 91, train_loss: 0.4565, test_loss: 1.6742, test_f1: 0.5682
 epoch: 92, train_loss: 0.4491, test_loss: 1.4978, test_f1: 0.5670
 epoch: 93, train_loss: 0.4524, test_loss: 1.6794, test_f1: 0.5776
 epoch: 94, train_loss: 0.4497, test_loss: 1.4341, test_f1: 0.6444
 epoch: 95, train_loss: 0.4372, test_loss: 1.6073, test_f1: 0.6141
 epoch: 96, train_loss: 0.4409, test_loss: 1.4948, test_f1: 0.6311
 epoch: 97, train_loss: 0.4356, test_loss: 1.5384, test_f1: 0.6245
 epoch: 98, train_loss: 0.4390, test_loss: 1.4969, test_f1: 0.6222
 epoch: 99, train_loss: 0.4267, test_loss: 1.4496, test_f1: 0.6160
##################ITERATION #5 ****************************************
 epoch: 0, train_loss: 1.2676, test_loss: 1.2522, test_f1: 0.4019
 epoch: 1, train_loss: 1.0343, test_loss: 1.1003, test_f1: 0.4207
 epoch: 2, train_loss: 1.0059, test_loss: 1.0871, test_f1: 0.4528
 epoch: 3, train_loss: 0.9599, test_loss: 1.1922, test_f1: 0.4980
 epoch: 4, train_loss: 0.9210, test_loss: 1.1716, test_f1: 0.5193
 epoch: 5, train_loss: 0.9088, test_loss: 1.0221, test_f1: 0.5256
 epoch: 6, train_loss: 0.8666, test_loss: 1.1329, test_f1: 0.5237
 epoch: 7, train_loss: 0.8626, test_loss: 1.0654, test_f1: 0.5104
 epoch: 8, train_loss: 0.8419, test_loss: 1.0926, test_f1: 0.5367
 epoch: 9, train_loss: 0.8317, test_loss: 1.0155, test_f1: 0.5711
 epoch: 10, train_loss: 0.8211, test_loss: 1.0271, test_f1: 0.5785
 epoch: 11, train_loss: 0.8083, test_loss: 1.0292, test_f1: 0.5616
 epoch: 12, train_loss: 0.7854, test_loss: 1.0129, test_f1: 0.5973
 epoch: 13, train_loss: 0.7847, test_loss: 1.6707, test_f1: 0.4830
 epoch: 14, train_loss: 0.7842, test_loss: 1.0439, test_f1: 0.5365
 epoch: 15, train_loss: 0.7631, test_loss: 1.2878, test_f1: 0.4978
 epoch: 16, train_loss: 0.7578, test_loss: 1.1366, test_f1: 0.5800
 epoch: 17, train_loss: 0.7425, test_loss: 1.0893, test_f1: 0.5946
 epoch: 18, train_loss: 0.7249, test_loss: 1.2311, test_f1: 0.5620
 epoch: 19, train_loss: 0.7215, test_loss: 1.0159, test_f1: 0.5705
 epoch: 20, train_loss: 0.7131, test_loss: 0.9829, test_f1: 0.6122
 epoch: 21, train_loss: 0.6979, test_loss: 1.0455, test_f1: 0.5856
 epoch: 22, train_loss: 0.6824, test_loss: 1.1589, test_f1: 0.5967
 epoch: 23, train_loss: 0.6897, test_loss: 1.0545, test_f1: 0.6003
 epoch: 24, train_loss: 0.6810, test_loss: 0.9981, test_f1: 0.5955
 epoch: 25, train_loss: 0.6835, test_loss: 1.1802, test_f1: 0.5613
 epoch: 26, train_loss: 0.6590, test_loss: 0.9975, test_f1: 0.6101
 epoch: 27, train_loss: 0.6790, test_loss: 1.1768, test_f1: 0.5140
 epoch: 28, train_loss: 0.6610, test_loss: 1.0509, test_f1: 0.5554
 epoch: 29, train_loss: 0.6526, test_loss: 1.1955, test_f1: 0.5715
 epoch: 30, train_loss: 0.6553, test_loss: 1.0159, test_f1: 0.6129
 epoch: 31, train_loss: 0.6394, test_loss: 1.1713, test_f1: 0.5663
 epoch: 32, train_loss: 0.6514, test_loss: 1.1238, test_f1: 0.5843
 epoch: 33, train_loss: 0.6399, test_loss: 1.6120, test_f1: 0.5552
 epoch: 34, train_loss: 0.6231, test_loss: 1.1776, test_f1: 0.5841
 epoch: 35, train_loss: 0.6044, test_loss: 1.0569, test_f1: 0.5910
 epoch: 36, train_loss: 0.6040, test_loss: 1.2700, test_f1: 0.6057
 epoch: 37, train_loss: 0.6381, test_loss: 1.3462, test_f1: 0.5409
 epoch: 38, train_loss: 0.6057, test_loss: 1.2598, test_f1: 0.6040
 epoch: 39, train_loss: 0.6008, test_loss: 1.3424, test_f1: 0.5569
 epoch: 40, train_loss: 0.6012, test_loss: 1.2702, test_f1: 0.6065
 epoch: 41, train_loss: 0.6068, test_loss: 1.2002, test_f1: 0.5690
 epoch: 42, train_loss: 0.5929, test_loss: 1.3257, test_f1: 0.5411
 epoch: 43, train_loss: 0.5901, test_loss: 1.3490, test_f1: 0.6298
 epoch: 44, train_loss: 0.5746, test_loss: 1.2857, test_f1: 0.5867
 epoch: 45, train_loss: 0.5837, test_loss: 1.2027, test_f1: 0.5906
 epoch: 46, train_loss: 0.5821, test_loss: 1.1153, test_f1: 0.5808
 epoch: 47, train_loss: 0.5710, test_loss: 1.1334, test_f1: 0.5946
 epoch: 48, train_loss: 0.5417, test_loss: 1.4251, test_f1: 0.5645
 epoch: 49, train_loss: 0.5602, test_loss: 1.1463, test_f1: 0.5878
 epoch: 50, train_loss: 0.5476, test_loss: 1.3394, test_f1: 0.6010
 epoch: 51, train_loss: 0.5157, test_loss: 1.3728, test_f1: 0.6091
 epoch: 52, train_loss: 0.5235, test_loss: 1.2170, test_f1: 0.5783
 epoch: 53, train_loss: 0.5071, test_loss: 1.2888, test_f1: 0.5916
 epoch: 54, train_loss: 0.5249, test_loss: 1.4408, test_f1: 0.5997
 epoch: 55, train_loss: 0.4958, test_loss: 1.4560, test_f1: 0.5835
 epoch: 56, train_loss: 0.5007, test_loss: 1.3606, test_f1: 0.5966
 epoch: 57, train_loss: 0.5102, test_loss: 1.3280, test_f1: 0.6345
 epoch: 58, train_loss: 0.4835, test_loss: 1.6679, test_f1: 0.6164
 epoch: 59, train_loss: 0.4876, test_loss: 1.3169, test_f1: 0.5982
 epoch: 60, train_loss: 0.4741, test_loss: 1.2627, test_f1: 0.6379
 epoch: 61, train_loss: 0.4852, test_loss: 1.4072, test_f1: 0.6295
 epoch: 62, train_loss: 0.4706, test_loss: 1.3721, test_f1: 0.6208
 epoch: 63, train_loss: 0.4613, test_loss: 1.5737, test_f1: 0.6242
 epoch: 64, train_loss: 0.4809, test_loss: 1.3805, test_f1: 0.6302
 epoch: 65, train_loss: 0.4655, test_loss: 1.3987, test_f1: 0.6056
 epoch: 66, train_loss: 0.4533, test_loss: 2.2672, test_f1: 0.6128
 epoch: 67, train_loss: 0.4434, test_loss: 1.4715, test_f1: 0.5895
 epoch: 68, train_loss: 0.4459, test_loss: 2.5469, test_f1: 0.5981
 epoch: 69, train_loss: 0.4452, test_loss: 2.2884, test_f1: 0.5906
 epoch: 70, train_loss: 0.4637, test_loss: 1.3527, test_f1: 0.6204
 epoch: 71, train_loss: 0.4754, test_loss: 1.4378, test_f1: 0.6372
 epoch: 72, train_loss: 0.4346, test_loss: 1.3845, test_f1: 0.6110
 epoch: 73, train_loss: 0.4599, test_loss: 1.3998, test_f1: 0.6476
 epoch: 74, train_loss: 0.4380, test_loss: 1.3383, test_f1: 0.6074
 epoch: 75, train_loss: 0.4245, test_loss: 1.5327, test_f1: 0.6317
 epoch: 76, train_loss: 0.4416, test_loss: 1.5968, test_f1: 0.6016
 epoch: 77, train_loss: 0.4272, test_loss: 1.2969, test_f1: 0.6340
 epoch: 78, train_loss: 0.4275, test_loss: 1.8926, test_f1: 0.6279
 epoch: 79, train_loss: 0.4181, test_loss: 1.5390, test_f1: 0.6102
 epoch: 80, train_loss: 0.4119, test_loss: 2.0370, test_f1: 0.5853
 epoch: 81, train_loss: 0.4189, test_loss: 1.3505, test_f1: 0.6413
 epoch: 82, train_loss: 0.4036, test_loss: 1.3961, test_f1: 0.6523
 epoch: 83, train_loss: 0.4165, test_loss: 1.5523, test_f1: 0.6279
 epoch: 84, train_loss: 0.4114, test_loss: 1.6640, test_f1: 0.6004
 epoch: 85, train_loss: 0.3998, test_loss: 1.5921, test_f1: 0.5892
 epoch: 86, train_loss: 0.4158, test_loss: 2.0073, test_f1: 0.5873
 epoch: 87, train_loss: 0.4166, test_loss: 2.2391, test_f1: 0.6164
 epoch: 88, train_loss: 0.4282, test_loss: 1.5583, test_f1: 0.5987
 epoch: 89, train_loss: 0.4082, test_loss: 2.6796, test_f1: 0.5768
 epoch: 90, train_loss: 0.4017, test_loss: 2.8377, test_f1: 0.6081
 epoch: 91, train_loss: 0.4124, test_loss: 1.7184, test_f1: 0.6182
 epoch: 92, train_loss: 0.3906, test_loss: 1.6788, test_f1: 0.6357
 epoch: 93, train_loss: 0.3913, test_loss: 1.4768, test_f1: 0.6054
 epoch: 94, train_loss: 0.3979, test_loss: 1.7449, test_f1: 0.5989
 epoch: 95, train_loss: 0.3811, test_loss: 1.6230, test_f1: 0.6267
 epoch: 96, train_loss: 0.3930, test_loss: 1.8281, test_f1: 0.6232
 epoch: 97, train_loss: 0.3836, test_loss: 2.4061, test_f1: 0.6475
 epoch: 98, train_loss: 0.4074, test_loss: 2.7531, test_f1: 0.6127
 epoch: 99, train_loss: 0.3851, test_loss: 1.5907, test_f1: 0.5833
##################ITERATION #6 ****************************************
 epoch: 0, train_loss: 1.2905, test_loss: 1.2774, test_f1: 0.4247
 epoch: 1, train_loss: 1.0386, test_loss: 1.1445, test_f1: 0.5678
 epoch: 2, train_loss: 0.9904, test_loss: 1.0915, test_f1: 0.5105
 epoch: 3, train_loss: 0.9392, test_loss: 1.0635, test_f1: 0.4984
 epoch: 4, train_loss: 0.9146, test_loss: 1.0638, test_f1: 0.5482
 epoch: 5, train_loss: 0.8994, test_loss: 1.0236, test_f1: 0.5099
 epoch: 6, train_loss: 0.8644, test_loss: 1.0422, test_f1: 0.5177
 epoch: 7, train_loss: 0.8529, test_loss: 1.0584, test_f1: 0.5460
 epoch: 8, train_loss: 0.8336, test_loss: 1.0110, test_f1: 0.5900
 epoch: 9, train_loss: 0.8116, test_loss: 1.0037, test_f1: 0.5727
 epoch: 10, train_loss: 0.8414, test_loss: 0.9597, test_f1: 0.6068
 epoch: 11, train_loss: 0.8169, test_loss: 0.9724, test_f1: 0.5482
 epoch: 12, train_loss: 0.7806, test_loss: 1.0123, test_f1: 0.6059
 epoch: 13, train_loss: 0.7748, test_loss: 0.9639, test_f1: 0.6327
 epoch: 14, train_loss: 0.7653, test_loss: 0.9919, test_f1: 0.5791
 epoch: 15, train_loss: 0.7802, test_loss: 0.9619, test_f1: 0.6036
 epoch: 16, train_loss: 0.7620, test_loss: 0.9456, test_f1: 0.6053
 epoch: 17, train_loss: 0.7272, test_loss: 0.9991, test_f1: 0.5776
 epoch: 18, train_loss: 0.7274, test_loss: 0.9752, test_f1: 0.6024
 epoch: 19, train_loss: 0.7348, test_loss: 0.9364, test_f1: 0.5933
 epoch: 20, train_loss: 0.7292, test_loss: 0.9574, test_f1: 0.5828
 epoch: 21, train_loss: 0.7040, test_loss: 0.9518, test_f1: 0.6218
 epoch: 22, train_loss: 0.7403, test_loss: 0.9578, test_f1: 0.6136
 epoch: 23, train_loss: 0.7092, test_loss: 0.9446, test_f1: 0.6172
 epoch: 24, train_loss: 0.6969, test_loss: 1.1791, test_f1: 0.5762
 epoch: 25, train_loss: 0.6956, test_loss: 0.9728, test_f1: 0.6139
 epoch: 26, train_loss: 0.7001, test_loss: 0.9605, test_f1: 0.6014
 epoch: 27, train_loss: 0.6633, test_loss: 0.9192, test_f1: 0.5905
 epoch: 28, train_loss: 0.6702, test_loss: 0.9133, test_f1: 0.6182
 epoch: 29, train_loss: 0.6684, test_loss: 1.0121, test_f1: 0.5762
 epoch: 30, train_loss: 0.6639, test_loss: 1.0199, test_f1: 0.6224
 epoch: 31, train_loss: 0.6525, test_loss: 1.0179, test_f1: 0.5916
 epoch: 32, train_loss: 0.6503, test_loss: 1.2334, test_f1: 0.5650
 epoch: 33, train_loss: 0.6425, test_loss: 1.1001, test_f1: 0.6027
 epoch: 34, train_loss: 0.6315, test_loss: 0.9838, test_f1: 0.6269
 epoch: 35, train_loss: 0.6982, test_loss: 1.0940, test_f1: 0.5762
 epoch: 36, train_loss: 0.6586, test_loss: 1.0004, test_f1: 0.6076
 epoch: 37, train_loss: 0.6757, test_loss: 1.1185, test_f1: 0.5516
 epoch: 38, train_loss: 0.6507, test_loss: 1.0378, test_f1: 0.6160
 epoch: 39, train_loss: 0.6384, test_loss: 1.0285, test_f1: 0.5930
 epoch: 40, train_loss: 0.6337, test_loss: 1.1273, test_f1: 0.5685
 epoch: 41, train_loss: 0.6431, test_loss: 0.9651, test_f1: 0.6360
 epoch: 42, train_loss: 0.6174, test_loss: 0.9800, test_f1: 0.6129
 epoch: 43, train_loss: 0.6247, test_loss: 1.1302, test_f1: 0.5909
 epoch: 44, train_loss: 0.5914, test_loss: 1.0967, test_f1: 0.5649
 epoch: 45, train_loss: 0.6111, test_loss: 1.0379, test_f1: 0.5951
 epoch: 46, train_loss: 0.5963, test_loss: 1.0414, test_f1: 0.6172
 epoch: 47, train_loss: 0.6024, test_loss: 0.9900, test_f1: 0.6476
 epoch: 48, train_loss: 0.5740, test_loss: 1.1412, test_f1: 0.6304
 epoch: 49, train_loss: 0.5857, test_loss: 1.1483, test_f1: 0.5978
 epoch: 50, train_loss: 0.6120, test_loss: 1.1721, test_f1: 0.6169
 epoch: 51, train_loss: 0.5782, test_loss: 1.2316, test_f1: 0.5999
 epoch: 52, train_loss: 0.5592, test_loss: 1.1742, test_f1: 0.6127
 epoch: 53, train_loss: 0.5384, test_loss: 1.1806, test_f1: 0.6238
 epoch: 54, train_loss: 0.5372, test_loss: 1.1968, test_f1: 0.6124
 epoch: 55, train_loss: 0.5403, test_loss: 1.1194, test_f1: 0.6144
 epoch: 56, train_loss: 0.5324, test_loss: 1.2430, test_f1: 0.5906
 epoch: 57, train_loss: 0.5196, test_loss: 1.2137, test_f1: 0.5939
 epoch: 58, train_loss: 0.5310, test_loss: 1.2601, test_f1: 0.6013
 epoch: 59, train_loss: 0.5299, test_loss: 1.2618, test_f1: 0.5959
 epoch: 60, train_loss: 0.5226, test_loss: 1.2391, test_f1: 0.5972
 epoch: 61, train_loss: 0.5108, test_loss: 1.2226, test_f1: 0.5992
 epoch: 62, train_loss: 0.5125, test_loss: 1.2304, test_f1: 0.6076
 epoch: 63, train_loss: 0.5100, test_loss: 1.1802, test_f1: 0.6081
 epoch: 64, train_loss: 0.5171, test_loss: 1.2449, test_f1: 0.6014
 epoch: 65, train_loss: 0.5123, test_loss: 1.3913, test_f1: 0.5936
 epoch: 66, train_loss: 0.5080, test_loss: 1.1603, test_f1: 0.6402
 epoch: 67, train_loss: 0.5028, test_loss: 1.2347, test_f1: 0.6096
 epoch: 68, train_loss: 0.4848, test_loss: 1.2633, test_f1: 0.6054
 epoch: 69, train_loss: 0.4768, test_loss: 1.2276, test_f1: 0.6048
 epoch: 70, train_loss: 0.4939, test_loss: 1.3488, test_f1: 0.5849
 epoch: 71, train_loss: 0.4767, test_loss: 1.2986, test_f1: 0.6057
 epoch: 72, train_loss: 0.4732, test_loss: 1.2952, test_f1: 0.6135
 epoch: 73, train_loss: 0.4872, test_loss: 1.2849, test_f1: 0.6098
 epoch: 74, train_loss: 0.4552, test_loss: 1.3443, test_f1: 0.6019
 epoch: 75, train_loss: 0.4937, test_loss: 1.3416, test_f1: 0.6049
 epoch: 76, train_loss: 0.4828, test_loss: 1.2639, test_f1: 0.6485
 epoch: 77, train_loss: 0.4652, test_loss: 1.3920, test_f1: 0.6114
 epoch: 78, train_loss: 0.5000, test_loss: 1.3184, test_f1: 0.6091
 epoch: 79, train_loss: 0.4893, test_loss: 1.2769, test_f1: 0.6398
 epoch: 80, train_loss: 0.4996, test_loss: 1.4878, test_f1: 0.5716
 epoch: 81, train_loss: 0.4628, test_loss: 1.3996, test_f1: 0.5875
 epoch: 82, train_loss: 0.4544, test_loss: 1.3658, test_f1: 0.6194
 epoch: 83, train_loss: 0.4671, test_loss: 1.4588, test_f1: 0.5946
 epoch: 84, train_loss: 0.4570, test_loss: 1.4548, test_f1: 0.6110
 epoch: 85, train_loss: 0.4585, test_loss: 1.4896, test_f1: 0.6059
 epoch: 86, train_loss: 0.4429, test_loss: 1.4623, test_f1: 0.6052
 epoch: 87, train_loss: 0.4447, test_loss: 1.3961, test_f1: 0.6196
 epoch: 88, train_loss: 0.4402, test_loss: 1.5465, test_f1: 0.6232
 epoch: 89, train_loss: 0.4427, test_loss: 1.6154, test_f1: 0.5887
 epoch: 90, train_loss: 0.4443, test_loss: 1.4769, test_f1: 0.6111
 epoch: 91, train_loss: 0.4538, test_loss: 1.4204, test_f1: 0.6339
 epoch: 92, train_loss: 0.4258, test_loss: 1.5279, test_f1: 0.6092
 epoch: 93, train_loss: 0.4557, test_loss: 1.6314, test_f1: 0.6025
 epoch: 94, train_loss: 0.4447, test_loss: 1.4941, test_f1: 0.6396
 epoch: 95, train_loss: 0.4461, test_loss: 1.6680, test_f1: 0.5893
 epoch: 96, train_loss: 0.4276, test_loss: 1.6814, test_f1: 0.6058
 epoch: 97, train_loss: 0.4124, test_loss: 1.5197, test_f1: 0.6433
 epoch: 98, train_loss: 0.4351, test_loss: 1.5868, test_f1: 0.6316
 epoch: 99, train_loss: 0.4482, test_loss: 1.6451, test_f1: 0.5711
##################ITERATION #7 ****************************************
 epoch: 0, train_loss: 1.4711, test_loss: 1.2830, test_f1: 0.2933
 epoch: 1, train_loss: 1.0883, test_loss: 1.1120, test_f1: 0.5075
 epoch: 2, train_loss: 0.9867, test_loss: 1.0783, test_f1: 0.5264
 epoch: 3, train_loss: 0.9726, test_loss: 1.0783, test_f1: 0.5587
 epoch: 4, train_loss: 0.9466, test_loss: 1.0529, test_f1: 0.5605
 epoch: 5, train_loss: 0.9199, test_loss: 1.0134, test_f1: 0.5885
 epoch: 6, train_loss: 0.8719, test_loss: 1.0472, test_f1: 0.5340
 epoch: 7, train_loss: 0.8520, test_loss: 1.0646, test_f1: 0.5608
 epoch: 8, train_loss: 0.8422, test_loss: 1.0217, test_f1: 0.5913
 epoch: 9, train_loss: 0.8373, test_loss: 0.9865, test_f1: 0.5933
 epoch: 10, train_loss: 0.8092, test_loss: 1.0231, test_f1: 0.5634
 epoch: 11, train_loss: 0.8142, test_loss: 1.0119, test_f1: 0.5871
 epoch: 12, train_loss: 0.7919, test_loss: 1.0393, test_f1: 0.5533
 epoch: 13, train_loss: 0.7866, test_loss: 1.0026, test_f1: 0.6268
 epoch: 14, train_loss: 0.7615, test_loss: 1.0151, test_f1: 0.5959
 epoch: 15, train_loss: 0.7707, test_loss: 1.0268, test_f1: 0.5618
 epoch: 16, train_loss: 0.7589, test_loss: 1.0542, test_f1: 0.5824
 epoch: 17, train_loss: 0.7228, test_loss: 1.0712, test_f1: 0.5705
 epoch: 18, train_loss: 0.7548, test_loss: 1.0379, test_f1: 0.5552
 epoch: 19, train_loss: 0.7380, test_loss: 1.0238, test_f1: 0.5861
 epoch: 20, train_loss: 0.7234, test_loss: 1.2023, test_f1: 0.5870
 epoch: 21, train_loss: 0.7043, test_loss: 1.0413, test_f1: 0.6170
 epoch: 22, train_loss: 0.7082, test_loss: 1.0910, test_f1: 0.5730
 epoch: 23, train_loss: 0.6874, test_loss: 1.0465, test_f1: 0.6304
 epoch: 24, train_loss: 0.7038, test_loss: 1.0145, test_f1: 0.5929
 epoch: 25, train_loss: 0.6806, test_loss: 0.9870, test_f1: 0.5892
 epoch: 26, train_loss: 0.6819, test_loss: 1.0573, test_f1: 0.5738
 epoch: 27, train_loss: 0.6868, test_loss: 0.9659, test_f1: 0.6462
 epoch: 28, train_loss: 0.6666, test_loss: 1.0331, test_f1: 0.6217
 epoch: 29, train_loss: 0.6552, test_loss: 1.1378, test_f1: 0.6078
 epoch: 30, train_loss: 0.6511, test_loss: 1.0018, test_f1: 0.6143
 epoch: 31, train_loss: 0.6303, test_loss: 1.0800, test_f1: 0.6160
 epoch: 32, train_loss: 0.6549, test_loss: 1.0236, test_f1: 0.5729
 epoch: 33, train_loss: 0.6119, test_loss: 1.1755, test_f1: 0.5533
 epoch: 34, train_loss: 0.6174, test_loss: 1.0047, test_f1: 0.6232
 epoch: 35, train_loss: 0.6098, test_loss: 1.1071, test_f1: 0.6154
 epoch: 36, train_loss: 0.6173, test_loss: 1.1043, test_f1: 0.5973
 epoch: 37, train_loss: 0.5977, test_loss: 1.1612, test_f1: 0.6206
 epoch: 38, train_loss: 0.6114, test_loss: 1.0018, test_f1: 0.6779
 epoch: 39, train_loss: 0.6146, test_loss: 1.2225, test_f1: 0.5725
 epoch: 40, train_loss: 0.6137, test_loss: 1.2455, test_f1: 0.5897
 epoch: 41, train_loss: 0.5882, test_loss: 1.2619, test_f1: 0.5622
 epoch: 42, train_loss: 0.5713, test_loss: 1.1157, test_f1: 0.6244
 epoch: 43, train_loss: 0.5629, test_loss: 1.2113, test_f1: 0.5924
 epoch: 44, train_loss: 0.5737, test_loss: 1.1659, test_f1: 0.6594
 epoch: 45, train_loss: 0.5798, test_loss: 1.2861, test_f1: 0.6051
 epoch: 46, train_loss: 0.5670, test_loss: 1.2585, test_f1: 0.5718
 epoch: 47, train_loss: 0.5446, test_loss: 1.4250, test_f1: 0.5941
 epoch: 48, train_loss: 0.5343, test_loss: 1.4491, test_f1: 0.5890
 epoch: 49, train_loss: 0.5436, test_loss: 1.2601, test_f1: 0.5824
 epoch: 50, train_loss: 0.5638, test_loss: 1.2530, test_f1: 0.5707
 epoch: 51, train_loss: 0.5133, test_loss: 1.2720, test_f1: 0.6274
 epoch: 52, train_loss: 0.5016, test_loss: 1.1512, test_f1: 0.6516
 epoch: 53, train_loss: 0.4930, test_loss: 1.2077, test_f1: 0.6413
 epoch: 54, train_loss: 0.4759, test_loss: 1.3329, test_f1: 0.6294
 epoch: 55, train_loss: 0.4683, test_loss: 1.3031, test_f1: 0.5994
 epoch: 56, train_loss: 0.4637, test_loss: 1.3119, test_f1: 0.6353
 epoch: 57, train_loss: 0.4489, test_loss: 1.4274, test_f1: 0.6167
 epoch: 58, train_loss: 0.4537, test_loss: 1.4357, test_f1: 0.6302
 epoch: 59, train_loss: 0.4576, test_loss: 1.3876, test_f1: 0.6458
 epoch: 60, train_loss: 0.4613, test_loss: 1.3323, test_f1: 0.6336
 epoch: 61, train_loss: 0.4668, test_loss: 1.4383, test_f1: 0.6392
 epoch: 62, train_loss: 0.4604, test_loss: 1.5305, test_f1: 0.6158
 epoch: 63, train_loss: 0.4715, test_loss: 1.4660, test_f1: 0.6430
 epoch: 64, train_loss: 0.4435, test_loss: 1.6300, test_f1: 0.6106
 epoch: 65, train_loss: 0.4469, test_loss: 1.3683, test_f1: 0.6065
 epoch: 66, train_loss: 0.4392, test_loss: 1.4577, test_f1: 0.6242
 epoch: 67, train_loss: 0.4635, test_loss: 1.5255, test_f1: 0.6173
 epoch: 68, train_loss: 0.4373, test_loss: 1.5069, test_f1: 0.6240
 epoch: 69, train_loss: 0.4277, test_loss: 1.4196, test_f1: 0.6356
 epoch: 70, train_loss: 0.4188, test_loss: 1.5195, test_f1: 0.6253
 epoch: 71, train_loss: 0.4319, test_loss: 1.4108, test_f1: 0.6099
 epoch: 72, train_loss: 0.4344, test_loss: 1.5108, test_f1: 0.6110
 epoch: 73, train_loss: 0.4227, test_loss: 1.4086, test_f1: 0.6231
 epoch: 74, train_loss: 0.4093, test_loss: 1.5033, test_f1: 0.6304
 epoch: 75, train_loss: 0.4260, test_loss: 1.4287, test_f1: 0.6176
 epoch: 76, train_loss: 0.4270, test_loss: 1.4796, test_f1: 0.6342
 epoch: 77, train_loss: 0.4086, test_loss: 1.6996, test_f1: 0.6186
 epoch: 78, train_loss: 0.4258, test_loss: 1.5549, test_f1: 0.6158
 epoch: 79, train_loss: 0.3905, test_loss: 1.5057, test_f1: 0.6288
 epoch: 80, train_loss: 0.3964, test_loss: 1.6511, test_f1: 0.6225
 epoch: 81, train_loss: 0.3956, test_loss: 1.5951, test_f1: 0.6253
 epoch: 82, train_loss: 0.3992, test_loss: 1.7056, test_f1: 0.6010
 epoch: 83, train_loss: 0.3983, test_loss: 1.5093, test_f1: 0.6306
 epoch: 84, train_loss: 0.3825, test_loss: 1.5327, test_f1: 0.6263
 epoch: 85, train_loss: 0.3892, test_loss: 1.5882, test_f1: 0.6096
 epoch: 86, train_loss: 0.3796, test_loss: 1.7003, test_f1: 0.6054
 epoch: 87, train_loss: 0.3795, test_loss: 1.5423, test_f1: 0.6226
 epoch: 88, train_loss: 0.4051, test_loss: 1.5046, test_f1: 0.6123
 epoch: 89, train_loss: 0.3923, test_loss: 1.5730, test_f1: 0.6134
 epoch: 90, train_loss: 0.3579, test_loss: 1.6061, test_f1: 0.5925
 epoch: 91, train_loss: 0.3921, test_loss: 1.5838, test_f1: 0.6015
 epoch: 92, train_loss: 0.3585, test_loss: 1.6420, test_f1: 0.5814
 epoch: 93, train_loss: 0.3446, test_loss: 1.8034, test_f1: 0.5916
 epoch: 94, train_loss: 0.3694, test_loss: 1.8948, test_f1: 0.5908
 epoch: 95, train_loss: 0.3701, test_loss: 1.6788, test_f1: 0.6128
 epoch: 96, train_loss: 0.3432, test_loss: 1.9711, test_f1: 0.6042
 epoch: 97, train_loss: 0.4069, test_loss: 2.0148, test_f1: 0.6040
 epoch: 98, train_loss: 0.3666, test_loss: 1.7175, test_f1: 0.6100
 epoch: 99, train_loss: 0.3697, test_loss: 1.7836, test_f1: 0.6193
##################ITERATION #8 ****************************************
 epoch: 0, train_loss: 1.3344, test_loss: 1.2279, test_f1: 0.4355
 epoch: 1, train_loss: 1.0796, test_loss: 1.1367, test_f1: 0.4661
 epoch: 2, train_loss: 1.0325, test_loss: 1.1478, test_f1: 0.4031
 epoch: 3, train_loss: 0.9845, test_loss: 1.1000, test_f1: 0.4923
 epoch: 4, train_loss: 0.9726, test_loss: 1.1034, test_f1: 0.4589
 epoch: 5, train_loss: 0.9548, test_loss: 1.0534, test_f1: 0.4975
 epoch: 6, train_loss: 0.9263, test_loss: 1.0544, test_f1: 0.5335
 epoch: 7, train_loss: 0.8863, test_loss: 0.9977, test_f1: 0.5163
 epoch: 8, train_loss: 0.8897, test_loss: 1.0021, test_f1: 0.5852
 epoch: 9, train_loss: 0.8347, test_loss: 1.0544, test_f1: 0.5397
 epoch: 10, train_loss: 0.8427, test_loss: 0.9825, test_f1: 0.5651
 epoch: 11, train_loss: 0.8566, test_loss: 1.0098, test_f1: 0.5046
 epoch: 12, train_loss: 0.8208, test_loss: 0.9764, test_f1: 0.5616
 epoch: 13, train_loss: 0.8077, test_loss: 1.0344, test_f1: 0.5457
 epoch: 14, train_loss: 0.8031, test_loss: 0.9858, test_f1: 0.5576
 epoch: 15, train_loss: 0.7849, test_loss: 0.9530, test_f1: 0.6114
 epoch: 16, train_loss: 0.7841, test_loss: 0.9613, test_f1: 0.6112
 epoch: 17, train_loss: 0.7860, test_loss: 0.9736, test_f1: 0.5835
 epoch: 18, train_loss: 0.7487, test_loss: 0.9992, test_f1: 0.5354
 epoch: 19, train_loss: 0.7503, test_loss: 1.0429, test_f1: 0.5758
 epoch: 20, train_loss: 0.7390, test_loss: 0.9524, test_f1: 0.5938
 epoch: 21, train_loss: 0.7357, test_loss: 0.9614, test_f1: 0.5815
 epoch: 22, train_loss: 0.7285, test_loss: 0.9482, test_f1: 0.5484
 epoch: 23, train_loss: 0.7178, test_loss: 1.0473, test_f1: 0.5707
 epoch: 24, train_loss: 0.7310, test_loss: 1.0055, test_f1: 0.5557
 epoch: 25, train_loss: 0.7115, test_loss: 0.9869, test_f1: 0.5359
 epoch: 26, train_loss: 0.6844, test_loss: 1.3329, test_f1: 0.4857
 epoch: 27, train_loss: 0.7019, test_loss: 0.9749, test_f1: 0.6095
 epoch: 28, train_loss: 0.6843, test_loss: 1.0194, test_f1: 0.5688
 epoch: 29, train_loss: 0.6728, test_loss: 0.9445, test_f1: 0.5845
 epoch: 30, train_loss: 0.6617, test_loss: 0.9356, test_f1: 0.6016
 epoch: 31, train_loss: 0.6562, test_loss: 1.0883, test_f1: 0.5118
 epoch: 32, train_loss: 0.6676, test_loss: 1.2134, test_f1: 0.5238
 epoch: 33, train_loss: 0.6587, test_loss: 0.9309, test_f1: 0.6377
 epoch: 34, train_loss: 0.6291, test_loss: 1.0637, test_f1: 0.5813
 epoch: 35, train_loss: 0.6346, test_loss: 0.9941, test_f1: 0.6009
 epoch: 36, train_loss: 0.6216, test_loss: 1.0311, test_f1: 0.5759
 epoch: 37, train_loss: 0.6336, test_loss: 1.0802, test_f1: 0.5747
 epoch: 38, train_loss: 0.6396, test_loss: 1.0464, test_f1: 0.5878
 epoch: 39, train_loss: 0.6093, test_loss: 1.0775, test_f1: 0.5783
 epoch: 40, train_loss: 0.6210, test_loss: 0.9830, test_f1: 0.6027
 epoch: 41, train_loss: 0.5963, test_loss: 0.9916, test_f1: 0.6368
 epoch: 42, train_loss: 0.6040, test_loss: 1.0193, test_f1: 0.5917
 epoch: 43, train_loss: 0.5985, test_loss: 1.2524, test_f1: 0.5774
 epoch: 44, train_loss: 0.5807, test_loss: 1.0788, test_f1: 0.5506
 epoch: 45, train_loss: 0.5960, test_loss: 1.0927, test_f1: 0.5759
 epoch: 46, train_loss: 0.5769, test_loss: 1.0147, test_f1: 0.6022
 epoch: 47, train_loss: 0.5687, test_loss: 1.0485, test_f1: 0.6083
 epoch: 48, train_loss: 0.5751, test_loss: 1.0646, test_f1: 0.6120
 epoch: 49, train_loss: 0.5652, test_loss: 1.1236, test_f1: 0.6035
 epoch: 50, train_loss: 0.5698, test_loss: 1.0127, test_f1: 0.6385
 epoch: 51, train_loss: 0.5248, test_loss: 1.1139, test_f1: 0.6091
 epoch: 52, train_loss: 0.5239, test_loss: 1.0697, test_f1: 0.6167
 epoch: 53, train_loss: 0.5051, test_loss: 1.0729, test_f1: 0.6216
 epoch: 54, train_loss: 0.5051, test_loss: 1.1645, test_f1: 0.5846
 epoch: 55, train_loss: 0.5129, test_loss: 1.1607, test_f1: 0.6235
 epoch: 56, train_loss: 0.5300, test_loss: 1.1434, test_f1: 0.5965
 epoch: 57, train_loss: 0.4936, test_loss: 1.1295, test_f1: 0.6242
 epoch: 58, train_loss: 0.4814, test_loss: 1.1506, test_f1: 0.6226
 epoch: 59, train_loss: 0.4917, test_loss: 1.1692, test_f1: 0.6213
 epoch: 60, train_loss: 0.5039, test_loss: 1.1655, test_f1: 0.5943
 epoch: 61, train_loss: 0.4907, test_loss: 1.1059, test_f1: 0.6388
 epoch: 62, train_loss: 0.4941, test_loss: 1.1118, test_f1: 0.6413
 epoch: 63, train_loss: 0.4940, test_loss: 1.1718, test_f1: 0.6244
 epoch: 64, train_loss: 0.5039, test_loss: 1.2226, test_f1: 0.5971
 epoch: 65, train_loss: 0.5016, test_loss: 1.1275, test_f1: 0.6104
 epoch: 66, train_loss: 0.4625, test_loss: 1.0998, test_f1: 0.6459
 epoch: 67, train_loss: 0.4703, test_loss: 1.2156, test_f1: 0.6267
 epoch: 68, train_loss: 0.4916, test_loss: 1.2341, test_f1: 0.6029
 epoch: 69, train_loss: 0.4809, test_loss: 1.2437, test_f1: 0.6247
 epoch: 70, train_loss: 0.4735, test_loss: 1.2386, test_f1: 0.6077
 epoch: 71, train_loss: 0.4523, test_loss: 1.2333, test_f1: 0.6219
 epoch: 72, train_loss: 0.4562, test_loss: 1.2580, test_f1: 0.6080
 epoch: 73, train_loss: 0.4480, test_loss: 1.2145, test_f1: 0.6335
 epoch: 74, train_loss: 0.4506, test_loss: 1.2594, test_f1: 0.5989
 epoch: 75, train_loss: 0.4441, test_loss: 1.2234, test_f1: 0.6312
 epoch: 76, train_loss: 0.4499, test_loss: 1.2500, test_f1: 0.6106
 epoch: 77, train_loss: 0.4538, test_loss: 1.2364, test_f1: 0.6382
 epoch: 78, train_loss: 0.4293, test_loss: 1.2877, test_f1: 0.6266
 epoch: 79, train_loss: 0.4633, test_loss: 1.2875, test_f1: 0.6299
 epoch: 80, train_loss: 0.4477, test_loss: 1.2816, test_f1: 0.6281
 epoch: 81, train_loss: 0.4517, test_loss: 1.3018, test_f1: 0.6226
 epoch: 82, train_loss: 0.4257, test_loss: 1.3388, test_f1: 0.6210
 epoch: 83, train_loss: 0.4311, test_loss: 1.2913, test_f1: 0.6199
 epoch: 84, train_loss: 0.4227, test_loss: 1.4020, test_f1: 0.5908
 epoch: 85, train_loss: 0.4215, test_loss: 1.3551, test_f1: 0.6280
 epoch: 86, train_loss: 0.4085, test_loss: 1.3076, test_f1: 0.6334
 epoch: 87, train_loss: 0.4246, test_loss: 1.3486, test_f1: 0.6285
 epoch: 88, train_loss: 0.4257, test_loss: 1.2466, test_f1: 0.6313
 epoch: 89, train_loss: 0.4162, test_loss: 1.2759, test_f1: 0.6339
 epoch: 90, train_loss: 0.3919, test_loss: 1.2832, test_f1: 0.6309
 epoch: 91, train_loss: 0.4352, test_loss: 1.3068, test_f1: 0.6185
 epoch: 92, train_loss: 0.3975, test_loss: 1.2914, test_f1: 0.6308
 epoch: 93, train_loss: 0.4232, test_loss: 1.2608, test_f1: 0.6300
 epoch: 94, train_loss: 0.4026, test_loss: 1.3756, test_f1: 0.6347
 epoch: 95, train_loss: 0.3842, test_loss: 1.3976, test_f1: 0.6190
 epoch: 96, train_loss: 0.3998, test_loss: 1.3805, test_f1: 0.6133
 epoch: 97, train_loss: 0.4198, test_loss: 1.3675, test_f1: 0.6210
 epoch: 98, train_loss: 0.4309, test_loss: 1.3563, test_f1: 0.6167
 epoch: 99, train_loss: 0.4215, test_loss: 1.3331, test_f1: 0.6621
##################ITERATION #9 ****************************************
 epoch: 0, train_loss: 1.8366, test_loss: 1.3256, test_f1: 0.3286
 epoch: 1, train_loss: 1.0940, test_loss: 1.1414, test_f1: 0.4731
 epoch: 2, train_loss: 1.0244, test_loss: 1.1198, test_f1: 0.4609
 epoch: 3, train_loss: 0.9597, test_loss: 1.1038, test_f1: 0.5199
 epoch: 4, train_loss: 0.9508, test_loss: 1.1021, test_f1: 0.5450
 epoch: 5, train_loss: 0.8985, test_loss: 1.0666, test_f1: 0.5586
 epoch: 6, train_loss: 0.8726, test_loss: 1.1118, test_f1: 0.5364
 epoch: 7, train_loss: 0.8617, test_loss: 1.1039, test_f1: 0.5211
 epoch: 8, train_loss: 0.8451, test_loss: 1.0443, test_f1: 0.5326
 epoch: 9, train_loss: 0.8394, test_loss: 1.0112, test_f1: 0.5864
 epoch: 10, train_loss: 0.8167, test_loss: 1.0712, test_f1: 0.5578
 epoch: 11, train_loss: 0.8068, test_loss: 1.0240, test_f1: 0.5751
 epoch: 12, train_loss: 0.7789, test_loss: 1.0678, test_f1: 0.5810
 epoch: 13, train_loss: 0.7738, test_loss: 1.0229, test_f1: 0.5628
 epoch: 14, train_loss: 0.7723, test_loss: 1.0763, test_f1: 0.5219
 epoch: 15, train_loss: 0.7506, test_loss: 1.0966, test_f1: 0.5284
 epoch: 16, train_loss: 0.7541, test_loss: 1.0792, test_f1: 0.5666
 epoch: 17, train_loss: 0.7535, test_loss: 1.0664, test_f1: 0.5530
 epoch: 18, train_loss: 0.7390, test_loss: 1.0845, test_f1: 0.5329
 epoch: 19, train_loss: 0.7343, test_loss: 1.0285, test_f1: 0.5922
 epoch: 20, train_loss: 0.7149, test_loss: 1.1550, test_f1: 0.5531
 epoch: 21, train_loss: 0.7149, test_loss: 1.1209, test_f1: 0.5074
 epoch: 22, train_loss: 0.7172, test_loss: 1.1570, test_f1: 0.5993
 epoch: 23, train_loss: 0.7187, test_loss: 1.0958, test_f1: 0.5889
 epoch: 24, train_loss: 0.6804, test_loss: 1.0768, test_f1: 0.5903
 epoch: 25, train_loss: 0.6863, test_loss: 1.0627, test_f1: 0.5806
 epoch: 26, train_loss: 0.6769, test_loss: 1.0522, test_f1: 0.5918
 epoch: 27, train_loss: 0.6646, test_loss: 1.1011, test_f1: 0.6182
 epoch: 28, train_loss: 0.6785, test_loss: 1.1682, test_f1: 0.5527
 epoch: 29, train_loss: 0.6846, test_loss: 1.1540, test_f1: 0.5251
 epoch: 30, train_loss: 0.6663, test_loss: 1.1725, test_f1: 0.6031
 epoch: 31, train_loss: 0.6640, test_loss: 1.1741, test_f1: 0.5251
 epoch: 32, train_loss: 0.6532, test_loss: 1.0678, test_f1: 0.6094
 epoch: 33, train_loss: 0.6397, test_loss: 1.0580, test_f1: 0.5614
 epoch: 34, train_loss: 0.6492, test_loss: 1.1486, test_f1: 0.5359
 epoch: 35, train_loss: 0.6304, test_loss: 1.1341, test_f1: 0.5850
 epoch: 36, train_loss: 0.6285, test_loss: 1.1871, test_f1: 0.5366
 epoch: 37, train_loss: 0.6190, test_loss: 1.2193, test_f1: 0.5652
 epoch: 38, train_loss: 0.5883, test_loss: 1.0900, test_f1: 0.5909
 epoch: 39, train_loss: 0.6069, test_loss: 1.1193, test_f1: 0.5466
 epoch: 40, train_loss: 0.5905, test_loss: 1.1082, test_f1: 0.5304
 epoch: 41, train_loss: 0.6017, test_loss: 1.1909, test_f1: 0.5437
 epoch: 42, train_loss: 0.5996, test_loss: 1.2473, test_f1: 0.5827
 epoch: 43, train_loss: 0.6056, test_loss: 1.1202, test_f1: 0.5577
 epoch: 44, train_loss: 0.5864, test_loss: 1.1928, test_f1: 0.5654
 epoch: 45, train_loss: 0.5759, test_loss: 1.2939, test_f1: 0.5577
 epoch: 46, train_loss: 0.5534, test_loss: 1.2436, test_f1: 0.5413
 epoch: 47, train_loss: 0.5668, test_loss: 1.1957, test_f1: 0.5371
 epoch: 48, train_loss: 0.5466, test_loss: 1.1268, test_f1: 0.5734
 epoch: 49, train_loss: 0.5623, test_loss: 1.2874, test_f1: 0.5022
 epoch: 50, train_loss: 0.5759, test_loss: 1.2453, test_f1: 0.5839
 epoch: 51, train_loss: 0.5328, test_loss: 1.1901, test_f1: 0.5874
 epoch: 52, train_loss: 0.5164, test_loss: 1.2332, test_f1: 0.5886
 epoch: 53, train_loss: 0.5074, test_loss: 1.2853, test_f1: 0.5806
 epoch: 54, train_loss: 0.5142, test_loss: 1.2519, test_f1: 0.5704
 epoch: 55, train_loss: 0.4792, test_loss: 1.3502, test_f1: 0.5586
 epoch: 56, train_loss: 0.5082, test_loss: 1.3293, test_f1: 0.5874
 epoch: 57, train_loss: 0.5211, test_loss: 1.2598, test_f1: 0.5695
 epoch: 58, train_loss: 0.4882, test_loss: 1.2990, test_f1: 0.5922
 epoch: 59, train_loss: 0.4906, test_loss: 1.3588, test_f1: 0.5401
 epoch: 60, train_loss: 0.4765, test_loss: 1.3121, test_f1: 0.5755
 epoch: 61, train_loss: 0.4973, test_loss: 1.2942, test_f1: 0.6064
 epoch: 62, train_loss: 0.4817, test_loss: 1.4148, test_f1: 0.6006
 epoch: 63, train_loss: 0.4785, test_loss: 1.4306, test_f1: 0.5683
 epoch: 64, train_loss: 0.4919, test_loss: 1.2768, test_f1: 0.6305
 epoch: 65, train_loss: 0.4569, test_loss: 1.3855, test_f1: 0.5794
 epoch: 66, train_loss: 0.4673, test_loss: 1.4137, test_f1: 0.5739
 epoch: 67, train_loss: 0.4496, test_loss: 1.3770, test_f1: 0.5772
 epoch: 68, train_loss: 0.4533, test_loss: 1.6691, test_f1: 0.5555
 epoch: 69, train_loss: 0.4605, test_loss: 1.4840, test_f1: 0.5204
 epoch: 70, train_loss: 0.4398, test_loss: 1.4069, test_f1: 0.5676
 epoch: 71, train_loss: 0.4623, test_loss: 1.6102, test_f1: 0.5869
 epoch: 72, train_loss: 0.4228, test_loss: 1.6408, test_f1: 0.5889
 epoch: 73, train_loss: 0.4709, test_loss: 1.8181, test_f1: 0.5302
 epoch: 74, train_loss: 0.4608, test_loss: 1.5449, test_f1: 0.5749
 epoch: 75, train_loss: 0.4434, test_loss: 1.6047, test_f1: 0.5166
 epoch: 76, train_loss: 0.4427, test_loss: 1.5388, test_f1: 0.5791
 epoch: 77, train_loss: 0.4391, test_loss: 1.6751, test_f1: 0.5845
 epoch: 78, train_loss: 0.4137, test_loss: 1.5224, test_f1: 0.5779
 epoch: 79, train_loss: 0.4203, test_loss: 1.4693, test_f1: 0.6209
 epoch: 80, train_loss: 0.4263, test_loss: 1.6922, test_f1: 0.5267
 epoch: 81, train_loss: 0.4058, test_loss: 1.7018, test_f1: 0.5734
 epoch: 82, train_loss: 0.4144, test_loss: 1.4872, test_f1: 0.5443
 epoch: 83, train_loss: 0.4115, test_loss: 1.6366, test_f1: 0.5840
 epoch: 84, train_loss: 0.4262, test_loss: 1.5904, test_f1: 0.6104
 epoch: 85, train_loss: 0.4157, test_loss: 1.6381, test_f1: 0.5692
 epoch: 86, train_loss: 0.4256, test_loss: 1.7302, test_f1: 0.5717
 epoch: 87, train_loss: 0.3963, test_loss: 1.8351, test_f1: 0.5686
 epoch: 88, train_loss: 0.3908, test_loss: 1.7298, test_f1: 0.5478
 epoch: 89, train_loss: 0.3966, test_loss: 1.6274, test_f1: 0.5697
 epoch: 90, train_loss: 0.4067, test_loss: 1.5545, test_f1: 0.5643
 epoch: 91, train_loss: 0.4226, test_loss: 1.7170, test_f1: 0.5614
 epoch: 92, train_loss: 0.4021, test_loss: 1.7396, test_f1: 0.5617
 epoch: 93, train_loss: 0.3923, test_loss: 1.7907, test_f1: 0.6089
 epoch: 94, train_loss: 0.4059, test_loss: 1.8078, test_f1: 0.5928
 epoch: 95, train_loss: 0.3670, test_loss: 1.8987, test_f1: 0.6124
 epoch: 96, train_loss: 0.3767, test_loss: 1.7502, test_f1: 0.5750
 epoch: 97, train_loss: 0.4082, test_loss: 1.7855, test_f1: 0.5540
 epoch: 98, train_loss: 0.3827, test_loss: 1.6763, test_f1: 0.5722
 epoch: 99, train_loss: 0.3847, test_loss: 1.7086, test_f1: 0.6189

Training completed in 500.24 seconds
Best F1: 0.6779 at epoch 38
Mean F1 across iterations: 0.6574  0.0136
========================FINAL RESULTS================================
FEGIN weighted F1: 0.6779  0.0136
python main.py --data ltspice_demos --representation component_pin --model FEGIN --layers 2 --hiddens 32 --batch_size 32 --lr 0.001 --emb_size 512 --epochs 100 --save_appendix component_pin_L2_H32_BS32_LR0.001_E512 --no_val
-----



STDERR:
  File "main.py", line 370, in <module>
    main()
  File "main.py", line 254, in main
    dataset = dataset_class(
  File "/home/philip/projects/ltspice_examples_code_repo/Circuit-Completion-Using-GNNs/component_classification_with_link_prediction_head/evaluation/FEGIN/kernel/circuit_datasets.py", line 15, in __init__
    self.data, self.slices = torch.load(self.processed_paths[0])
  File "/home/philip/.local/lib/python3.8/site-packages/torch/serialization.py", line 1040, in load
    warnings.warn(
  File "/usr/lib/python3.8/warnings.py", line 109, in _showwarnmsg
    sw(msg.message, msg.category, msg.filename, msg.lineno,
  File "main.py", line 47, in warn_with_traceback
    traceback.print_stack(file=log)
/home/philip/projects/ltspice_examples_code_repo/Circuit-Completion-Using-GNNs/component_classification_with_link_prediction_head/evaluation/FEGIN/kernel/circuit_datasets.py:15: FutureWarning: You are using `torch.load` with `weights_only=False` (the current default value), which uses the default pickle module implicitly. It is possible to construct malicious pickle data which will execute arbitrary code during unpickling (See https://github.com/pytorch/pytorch/blob/main/SECURITY.md#untrusted-models for more details). In a future release, the default value for `weights_only` will be flipped to `True`. This limits the functions that could be executed during unpickling. Arbitrary objects will no longer be allowed to be loaded via this mode unless they are explicitly allowlisted by the user via `torch.serialization.add_safe_globals`. We recommend you start setting `weights_only=True` for any use case where you don't have full control of the loaded file. Please open an issue on GitHub for any issues related to this experimental feature.
  self.data, self.slices = torch.load(self.processed_paths[0])
