STDOUT:
Results will be saved in /home/philip/projects/ltspice_examples_code_repo/Circuit-Completion-Using-GNNs/component_classification_with_link_prediction_head/evaluation/FEGIN/results/model_FEGIN_dataset_ltspice_examples
Command line input: python main.py --data ltspice_examples --representation component_component --model FEGIN --layers 3 --hiddens 32 --batch_size 256 --lr 0.01 --emb_size 250 --epochs 100 --save_appendix component_component_L3_H32_BS256_LR0.01_E250 --no_val
 is saved.
-----
ltspice_examples - FEGIN
Using 3 layers, 32 hidden units, h = 2
Loading component_component representation dataset
ENTERED
Training FEGIN on component_component representation
Train: 3556, Test: 845
##################ITERATION #0 ****************************************
 epoch: 0, train_loss: 1.2975, test_loss: 1.2645, test_f1: 0.2870
 epoch: 1, train_loss: 1.2207, test_loss: 1.2080, test_f1: 0.3115
 epoch: 2, train_loss: 1.1806, test_loss: 1.1753, test_f1: 0.3204
 epoch: 3, train_loss: 1.1536, test_loss: 1.1455, test_f1: 0.3925
 epoch: 4, train_loss: 1.1040, test_loss: 1.0615, test_f1: 0.4455
 epoch: 5, train_loss: 1.0817, test_loss: 1.0340, test_f1: 0.4342
 epoch: 6, train_loss: 1.0528, test_loss: 1.0466, test_f1: 0.4224
 epoch: 7, train_loss: 1.0128, test_loss: 0.9942, test_f1: 0.4550
 epoch: 8, train_loss: 0.9835, test_loss: 0.9360, test_f1: 0.5192
 epoch: 9, train_loss: 0.9537, test_loss: 1.1791, test_f1: 0.4913
 epoch: 10, train_loss: 0.9544, test_loss: 0.9332, test_f1: 0.5360
 epoch: 11, train_loss: 0.9265, test_loss: 0.9940, test_f1: 0.4756
 epoch: 12, train_loss: 0.9007, test_loss: 1.0097, test_f1: 0.5173
 epoch: 13, train_loss: 0.8888, test_loss: 0.9650, test_f1: 0.5425
 epoch: 14, train_loss: 0.8781, test_loss: 1.0336, test_f1: 0.5245
 epoch: 15, train_loss: 0.8621, test_loss: 1.0538, test_f1: 0.5030
 epoch: 16, train_loss: 0.8550, test_loss: 0.9975, test_f1: 0.5309
 epoch: 17, train_loss: 0.8752, test_loss: 1.0054, test_f1: 0.5404
 epoch: 18, train_loss: 0.8482, test_loss: 1.0782, test_f1: 0.5196
 epoch: 19, train_loss: 0.8629, test_loss: 1.0005, test_f1: 0.5290
 epoch: 20, train_loss: 0.8301, test_loss: 0.9502, test_f1: 0.5588
 epoch: 21, train_loss: 0.8145, test_loss: 1.0415, test_f1: 0.5629
 epoch: 22, train_loss: 0.8036, test_loss: 1.0845, test_f1: 0.5271
 epoch: 23, train_loss: 0.8124, test_loss: 1.0011, test_f1: 0.5461
 epoch: 24, train_loss: 0.8004, test_loss: 1.0689, test_f1: 0.5328
 epoch: 25, train_loss: 0.7917, test_loss: 1.0449, test_f1: 0.5506
 epoch: 26, train_loss: 0.7787, test_loss: 1.0484, test_f1: 0.5546
 epoch: 27, train_loss: 0.7977, test_loss: 1.1677, test_f1: 0.5490
 epoch: 28, train_loss: 0.7779, test_loss: 1.0579, test_f1: 0.5585
 epoch: 29, train_loss: 0.7690, test_loss: 1.0577, test_f1: 0.5215
 epoch: 30, train_loss: 0.7694, test_loss: 1.0889, test_f1: 0.5187
 epoch: 31, train_loss: 0.7797, test_loss: 1.0816, test_f1: 0.5416
 epoch: 32, train_loss: 0.7788, test_loss: 1.1008, test_f1: 0.5582
 epoch: 33, train_loss: 0.7560, test_loss: 1.0906, test_f1: 0.5575
 epoch: 34, train_loss: 0.7811, test_loss: 1.0658, test_f1: 0.5525
 epoch: 35, train_loss: 0.7628, test_loss: 1.0474, test_f1: 0.5555
 epoch: 36, train_loss: 0.7328, test_loss: 1.0805, test_f1: 0.5641
 epoch: 37, train_loss: 0.7376, test_loss: 1.0669, test_f1: 0.5668
 epoch: 38, train_loss: 0.7418, test_loss: 1.0698, test_f1: 0.5372
 epoch: 39, train_loss: 0.7365, test_loss: 1.0267, test_f1: 0.5723
 epoch: 40, train_loss: 0.7443, test_loss: 1.0844, test_f1: 0.5590
 epoch: 41, train_loss: 0.7297, test_loss: 1.0555, test_f1: 0.5625
 epoch: 42, train_loss: 0.7152, test_loss: 1.0768, test_f1: 0.5627
 epoch: 43, train_loss: 0.7082, test_loss: 1.1794, test_f1: 0.5353
 epoch: 44, train_loss: 0.7408, test_loss: 0.9802, test_f1: 0.5521
 epoch: 45, train_loss: 0.7158, test_loss: 1.3286, test_f1: 0.4908
 epoch: 46, train_loss: 0.7130, test_loss: 1.1555, test_f1: 0.5179
 epoch: 47, train_loss: 0.6895, test_loss: 1.0122, test_f1: 0.5948
 epoch: 48, train_loss: 0.7012, test_loss: 1.1564, test_f1: 0.5613
 epoch: 49, train_loss: 0.6851, test_loss: 1.3126, test_f1: 0.5322
 epoch: 50, train_loss: 0.6652, test_loss: 1.1772, test_f1: 0.5670
 epoch: 51, train_loss: 0.6567, test_loss: 1.2033, test_f1: 0.5598
 epoch: 52, train_loss: 0.6416, test_loss: 1.1546, test_f1: 0.5421
 epoch: 53, train_loss: 0.6311, test_loss: 1.1536, test_f1: 0.5509
 epoch: 54, train_loss: 0.6448, test_loss: 1.1531, test_f1: 0.5509
 epoch: 55, train_loss: 0.6060, test_loss: 1.1468, test_f1: 0.5517
 epoch: 56, train_loss: 0.5941, test_loss: 1.1433, test_f1: 0.5915
 epoch: 57, train_loss: 0.5866, test_loss: 1.1956, test_f1: 0.5446
 epoch: 58, train_loss: 0.5975, test_loss: 1.1833, test_f1: 0.5377
 epoch: 59, train_loss: 0.5843, test_loss: 1.3101, test_f1: 0.5401
 epoch: 60, train_loss: 0.5955, test_loss: 1.3604, test_f1: 0.5226
 epoch: 61, train_loss: 0.5877, test_loss: 1.2409, test_f1: 0.5263
 epoch: 62, train_loss: 0.5709, test_loss: 1.2265, test_f1: 0.5348
 epoch: 63, train_loss: 0.5741, test_loss: 1.2062, test_f1: 0.5467
 epoch: 64, train_loss: 0.5605, test_loss: 1.2926, test_f1: 0.5671
 epoch: 65, train_loss: 0.5635, test_loss: 1.4470, test_f1: 0.4800
 epoch: 66, train_loss: 0.5727, test_loss: 1.2772, test_f1: 0.5455
 epoch: 67, train_loss: 0.5832, test_loss: 1.3248, test_f1: 0.5197
 epoch: 68, train_loss: 0.5521, test_loss: 1.2489, test_f1: 0.5534
 epoch: 69, train_loss: 0.5572, test_loss: 1.4569, test_f1: 0.5306
 epoch: 70, train_loss: 0.5740, test_loss: 1.2440, test_f1: 0.5268
 epoch: 71, train_loss: 0.5424, test_loss: 1.5543, test_f1: 0.5091
 epoch: 72, train_loss: 0.5291, test_loss: 1.3523, test_f1: 0.5145
 epoch: 73, train_loss: 0.5375, test_loss: 1.3606, test_f1: 0.5333
 epoch: 74, train_loss: 0.5521, test_loss: 1.3047, test_f1: 0.5532
 epoch: 75, train_loss: 0.5256, test_loss: 1.3501, test_f1: 0.5316
 epoch: 76, train_loss: 0.5325, test_loss: 1.3707, test_f1: 0.5475
 epoch: 77, train_loss: 0.5285, test_loss: 1.3707, test_f1: 0.5256
 epoch: 78, train_loss: 0.5550, test_loss: 1.4733, test_f1: 0.5445
 epoch: 79, train_loss: 0.5539, test_loss: 1.4199, test_f1: 0.5268
 epoch: 80, train_loss: 0.5124, test_loss: 1.3533, test_f1: 0.5610
 epoch: 81, train_loss: 0.5219, test_loss: 1.2527, test_f1: 0.5776
 epoch: 82, train_loss: 0.5049, test_loss: 1.2433, test_f1: 0.5684
 epoch: 83, train_loss: 0.5022, test_loss: 1.5690, test_f1: 0.5341
 epoch: 84, train_loss: 0.5259, test_loss: 1.4500, test_f1: 0.5184
 epoch: 85, train_loss: 0.5251, test_loss: 1.2707, test_f1: 0.5652
 epoch: 86, train_loss: 0.5065, test_loss: 1.3764, test_f1: 0.5439
 epoch: 87, train_loss: 0.4851, test_loss: 1.5091, test_f1: 0.5365
 epoch: 88, train_loss: 0.4926, test_loss: 1.3360, test_f1: 0.5349
 epoch: 89, train_loss: 0.4980, test_loss: 1.4536, test_f1: 0.5406
 epoch: 90, train_loss: 0.5157, test_loss: 1.3245, test_f1: 0.5610
 epoch: 91, train_loss: 0.5108, test_loss: 1.4999, test_f1: 0.5085
 epoch: 92, train_loss: 0.4820, test_loss: 1.4616, test_f1: 0.5534
 epoch: 93, train_loss: 0.4512, test_loss: 1.4661, test_f1: 0.5690
 epoch: 94, train_loss: 0.5138, test_loss: 1.5073, test_f1: 0.5337
 epoch: 95, train_loss: 0.4985, test_loss: 1.4064, test_f1: 0.5565
 epoch: 96, train_loss: 0.5030, test_loss: 1.4118, test_f1: 0.5474
 epoch: 97, train_loss: 0.4936, test_loss: 1.2820, test_f1: 0.5736
 epoch: 98, train_loss: 0.4800, test_loss: 1.2925, test_f1: 0.5791
 epoch: 99, train_loss: 0.4597, test_loss: 1.4613, test_f1: 0.5308
##################ITERATION #1 ****************************************
 epoch: 0, train_loss: 1.2957, test_loss: 1.2609, test_f1: 0.2808
 epoch: 1, train_loss: 1.2100, test_loss: 1.1968, test_f1: 0.3891
 epoch: 2, train_loss: 1.1663, test_loss: 1.1254, test_f1: 0.4596
 epoch: 3, train_loss: 1.1055, test_loss: 1.0701, test_f1: 0.4509
 epoch: 4, train_loss: 1.0781, test_loss: 1.0464, test_f1: 0.4546
 epoch: 5, train_loss: 1.0285, test_loss: 1.0374, test_f1: 0.4896
 epoch: 6, train_loss: 1.0202, test_loss: 1.0202, test_f1: 0.4714
 epoch: 7, train_loss: 1.0095, test_loss: 1.0234, test_f1: 0.4993
 epoch: 8, train_loss: 0.9946, test_loss: 1.1125, test_f1: 0.4637
 epoch: 9, train_loss: 0.9688, test_loss: 1.0342, test_f1: 0.4689
 epoch: 10, train_loss: 0.9424, test_loss: 0.9902, test_f1: 0.4826
 epoch: 11, train_loss: 0.9487, test_loss: 1.0292, test_f1: 0.5062
 epoch: 12, train_loss: 0.9387, test_loss: 1.0269, test_f1: 0.4865
 epoch: 13, train_loss: 0.9062, test_loss: 1.0510, test_f1: 0.4990
 epoch: 14, train_loss: 0.9239, test_loss: 1.0506, test_f1: 0.5336
 epoch: 15, train_loss: 0.9175, test_loss: 1.0277, test_f1: 0.4729
 epoch: 16, train_loss: 0.8997, test_loss: 1.0476, test_f1: 0.4817
 epoch: 17, train_loss: 0.8971, test_loss: 1.0395, test_f1: 0.4826
 epoch: 18, train_loss: 0.8764, test_loss: 1.1838, test_f1: 0.4841
 epoch: 19, train_loss: 0.8803, test_loss: 1.0127, test_f1: 0.4991
 epoch: 20, train_loss: 0.8646, test_loss: 1.0019, test_f1: 0.5357
 epoch: 21, train_loss: 0.8477, test_loss: 1.0937, test_f1: 0.5486
 epoch: 22, train_loss: 0.8461, test_loss: 1.0851, test_f1: 0.4960
 epoch: 23, train_loss: 0.8487, test_loss: 1.0562, test_f1: 0.5312
 epoch: 24, train_loss: 0.8378, test_loss: 1.1388, test_f1: 0.4741
 epoch: 25, train_loss: 0.8471, test_loss: 1.0990, test_f1: 0.5085
 epoch: 26, train_loss: 0.8249, test_loss: 1.0970, test_f1: 0.5147
 epoch: 27, train_loss: 0.8252, test_loss: 1.1043, test_f1: 0.5270
 epoch: 28, train_loss: 0.8029, test_loss: 1.1145, test_f1: 0.5140
 epoch: 29, train_loss: 0.8203, test_loss: 1.1143, test_f1: 0.5021
 epoch: 30, train_loss: 0.8072, test_loss: 1.0918, test_f1: 0.5347
 epoch: 31, train_loss: 0.7783, test_loss: 1.0474, test_f1: 0.5548
 epoch: 32, train_loss: 0.7792, test_loss: 1.0683, test_f1: 0.5314
 epoch: 33, train_loss: 0.7858, test_loss: 1.0409, test_f1: 0.5431
 epoch: 34, train_loss: 0.8113, test_loss: 1.1051, test_f1: 0.5255
 epoch: 35, train_loss: 0.7888, test_loss: 1.0452, test_f1: 0.5429
 epoch: 36, train_loss: 0.7807, test_loss: 1.3179, test_f1: 0.4906
 epoch: 37, train_loss: 0.7671, test_loss: 1.0439, test_f1: 0.5292
 epoch: 38, train_loss: 0.7458, test_loss: 1.1905, test_f1: 0.5266
 epoch: 39, train_loss: 0.7756, test_loss: 1.0628, test_f1: 0.5247
 epoch: 40, train_loss: 0.7983, test_loss: 1.2075, test_f1: 0.4684
 epoch: 41, train_loss: 0.8017, test_loss: 0.9720, test_f1: 0.5435
 epoch: 42, train_loss: 0.7732, test_loss: 1.1417, test_f1: 0.5331
 epoch: 43, train_loss: 0.7406, test_loss: 1.1619, test_f1: 0.5199
 epoch: 44, train_loss: 0.7547, test_loss: 1.0950, test_f1: 0.5500
 epoch: 45, train_loss: 0.7345, test_loss: 1.0725, test_f1: 0.5505
 epoch: 46, train_loss: 0.7298, test_loss: 1.1219, test_f1: 0.5451
 epoch: 47, train_loss: 0.7238, test_loss: 1.0797, test_f1: 0.5151
 epoch: 48, train_loss: 0.7228, test_loss: 1.1939, test_f1: 0.5633
 epoch: 49, train_loss: 0.7021, test_loss: 1.1639, test_f1: 0.5370
 epoch: 50, train_loss: 0.6967, test_loss: 1.1923, test_f1: 0.5385
 epoch: 51, train_loss: 0.6943, test_loss: 1.2371, test_f1: 0.5269
 epoch: 52, train_loss: 0.6601, test_loss: 1.2473, test_f1: 0.5141
 epoch: 53, train_loss: 0.6493, test_loss: 1.3626, test_f1: 0.5066
 epoch: 54, train_loss: 0.6361, test_loss: 1.2470, test_f1: 0.5357
 epoch: 55, train_loss: 0.6483, test_loss: 1.2129, test_f1: 0.5387
 epoch: 56, train_loss: 0.6333, test_loss: 1.3662, test_f1: 0.5281
 epoch: 57, train_loss: 0.6300, test_loss: 1.4841, test_f1: 0.5026
 epoch: 58, train_loss: 0.6213, test_loss: 1.2698, test_f1: 0.5499
 epoch: 59, train_loss: 0.6361, test_loss: 1.3591, test_f1: 0.5421
 epoch: 60, train_loss: 0.6230, test_loss: 1.2351, test_f1: 0.5465
 epoch: 61, train_loss: 0.6213, test_loss: 1.3612, test_f1: 0.5386
 epoch: 62, train_loss: 0.6076, test_loss: 1.2735, test_f1: 0.5489
 epoch: 63, train_loss: 0.6069, test_loss: 1.3473, test_f1: 0.5373
 epoch: 64, train_loss: 0.6299, test_loss: 1.3700, test_f1: 0.5326
 epoch: 65, train_loss: 0.6086, test_loss: 1.4003, test_f1: 0.5333
 epoch: 66, train_loss: 0.6018, test_loss: 1.3391, test_f1: 0.5416
 epoch: 67, train_loss: 0.5881, test_loss: 1.3725, test_f1: 0.5708
 epoch: 68, train_loss: 0.5824, test_loss: 1.4370, test_f1: 0.5429
 epoch: 69, train_loss: 0.5813, test_loss: 1.4381, test_f1: 0.5443
 epoch: 70, train_loss: 0.5792, test_loss: 1.6823, test_f1: 0.5019
 epoch: 71, train_loss: 0.6086, test_loss: 1.3482, test_f1: 0.5605
 epoch: 72, train_loss: 0.5860, test_loss: 1.3916, test_f1: 0.5399
 epoch: 73, train_loss: 0.5814, test_loss: 1.3191, test_f1: 0.5613
 epoch: 74, train_loss: 0.5812, test_loss: 1.3161, test_f1: 0.5852
 epoch: 75, train_loss: 0.5939, test_loss: 1.3848, test_f1: 0.5411
 epoch: 76, train_loss: 0.5755, test_loss: 1.4688, test_f1: 0.5414
 epoch: 77, train_loss: 0.5769, test_loss: 1.4335, test_f1: 0.5464
 epoch: 78, train_loss: 0.5592, test_loss: 1.3083, test_f1: 0.5370
 epoch: 79, train_loss: 0.5640, test_loss: 1.3621, test_f1: 0.5577
 epoch: 80, train_loss: 0.5433, test_loss: 1.5726, test_f1: 0.5252
 epoch: 81, train_loss: 0.5606, test_loss: 1.5137, test_f1: 0.5415
 epoch: 82, train_loss: 0.5493, test_loss: 1.5673, test_f1: 0.5118
 epoch: 83, train_loss: 0.5412, test_loss: 1.6116, test_f1: 0.5264
 epoch: 84, train_loss: 0.5599, test_loss: 1.3590, test_f1: 0.5615
 epoch: 85, train_loss: 0.5340, test_loss: 1.7032, test_f1: 0.5202
 epoch: 86, train_loss: 0.5333, test_loss: 1.3665, test_f1: 0.5673
 epoch: 87, train_loss: 0.5318, test_loss: 1.7389, test_f1: 0.5134
 epoch: 88, train_loss: 0.5361, test_loss: 1.4448, test_f1: 0.5668
 epoch: 89, train_loss: 0.5175, test_loss: 1.7219, test_f1: 0.5490
 epoch: 90, train_loss: 0.5398, test_loss: 1.4917, test_f1: 0.5285
 epoch: 91, train_loss: 0.5251, test_loss: 1.3488, test_f1: 0.5895
 epoch: 92, train_loss: 0.5451, test_loss: 1.6258, test_f1: 0.5356
 epoch: 93, train_loss: 0.5369, test_loss: 1.6345, test_f1: 0.5281
 epoch: 94, train_loss: 0.5337, test_loss: 1.5580, test_f1: 0.5362
 epoch: 95, train_loss: 0.5370, test_loss: 1.3779, test_f1: 0.5778
 epoch: 96, train_loss: 0.5428, test_loss: 1.6042, test_f1: 0.5409
 epoch: 97, train_loss: 0.5161, test_loss: 1.5859, test_f1: 0.5652
 epoch: 98, train_loss: 0.5043, test_loss: 1.6579, test_f1: 0.5689
 epoch: 99, train_loss: 0.5162, test_loss: 1.8416, test_f1: 0.5140
##################ITERATION #2 ****************************************
 epoch: 0, train_loss: 1.3401, test_loss: 1.2878, test_f1: 0.2583
 epoch: 1, train_loss: 1.1985, test_loss: 1.1739, test_f1: 0.3572
 epoch: 2, train_loss: 1.1466, test_loss: 1.1035, test_f1: 0.4702
 epoch: 3, train_loss: 1.0985, test_loss: 1.1760, test_f1: 0.3954
 epoch: 4, train_loss: 1.0816, test_loss: 1.0380, test_f1: 0.4535
 epoch: 5, train_loss: 1.0575, test_loss: 1.0489, test_f1: 0.4514
 epoch: 6, train_loss: 1.0317, test_loss: 0.9543, test_f1: 0.4942
 epoch: 7, train_loss: 1.0019, test_loss: 1.0922, test_f1: 0.4224
 epoch: 8, train_loss: 1.0162, test_loss: 0.9748, test_f1: 0.5067
 epoch: 9, train_loss: 0.9849, test_loss: 0.9694, test_f1: 0.4933
 epoch: 10, train_loss: 0.9618, test_loss: 0.9090, test_f1: 0.5202
 epoch: 11, train_loss: 0.9520, test_loss: 0.9062, test_f1: 0.4825
 epoch: 12, train_loss: 0.9402, test_loss: 0.9879, test_f1: 0.4830
 epoch: 13, train_loss: 0.9293, test_loss: 0.9674, test_f1: 0.4947
 epoch: 14, train_loss: 0.9229, test_loss: 0.9814, test_f1: 0.4974
 epoch: 15, train_loss: 0.9133, test_loss: 1.0217, test_f1: 0.4947
 epoch: 16, train_loss: 0.8950, test_loss: 0.9468, test_f1: 0.5332
 epoch: 17, train_loss: 0.8913, test_loss: 1.0387, test_f1: 0.5138
 epoch: 18, train_loss: 0.8777, test_loss: 1.0152, test_f1: 0.4937
 epoch: 19, train_loss: 0.8691, test_loss: 1.1429, test_f1: 0.4744
 epoch: 20, train_loss: 0.8485, test_loss: 1.0325, test_f1: 0.4857
 epoch: 21, train_loss: 0.8403, test_loss: 1.0683, test_f1: 0.5730
 epoch: 22, train_loss: 0.8571, test_loss: 1.0903, test_f1: 0.4967
 epoch: 23, train_loss: 0.8738, test_loss: 1.0047, test_f1: 0.5316
 epoch: 24, train_loss: 0.8296, test_loss: 0.9917, test_f1: 0.5422
 epoch: 25, train_loss: 0.8305, test_loss: 1.0419, test_f1: 0.5090
 epoch: 26, train_loss: 0.8245, test_loss: 1.0464, test_f1: 0.5500
 epoch: 27, train_loss: 0.8034, test_loss: 1.0155, test_f1: 0.5332
 epoch: 28, train_loss: 0.7810, test_loss: 1.1288, test_f1: 0.4892
 epoch: 29, train_loss: 0.8202, test_loss: 1.2107, test_f1: 0.4704
 epoch: 30, train_loss: 0.8139, test_loss: 1.0225, test_f1: 0.5357
 epoch: 31, train_loss: 0.7996, test_loss: 1.0946, test_f1: 0.5197
 epoch: 32, train_loss: 0.8001, test_loss: 1.0833, test_f1: 0.5173
 epoch: 33, train_loss: 0.7978, test_loss: 1.0195, test_f1: 0.5514
 epoch: 34, train_loss: 0.7866, test_loss: 1.0926, test_f1: 0.5014
 epoch: 35, train_loss: 0.7713, test_loss: 1.0422, test_f1: 0.5620
 epoch: 36, train_loss: 0.7719, test_loss: 1.0594, test_f1: 0.5409
 epoch: 37, train_loss: 0.7681, test_loss: 1.0545, test_f1: 0.5476
 epoch: 38, train_loss: 0.7567, test_loss: 1.0768, test_f1: 0.5560
 epoch: 39, train_loss: 0.7422, test_loss: 1.0079, test_f1: 0.5412
 epoch: 40, train_loss: 0.7365, test_loss: 1.0509, test_f1: 0.5269
 epoch: 41, train_loss: 0.7405, test_loss: 1.0021, test_f1: 0.5606
 epoch: 42, train_loss: 0.7554, test_loss: 1.0368, test_f1: 0.5622
 epoch: 43, train_loss: 0.7256, test_loss: 1.0779, test_f1: 0.5429
 epoch: 44, train_loss: 0.7393, test_loss: 1.0416, test_f1: 0.5410
 epoch: 45, train_loss: 0.7542, test_loss: 1.0509, test_f1: 0.5468
 epoch: 46, train_loss: 0.7314, test_loss: 1.0773, test_f1: 0.5639
 epoch: 47, train_loss: 0.7327, test_loss: 1.0810, test_f1: 0.5481
 epoch: 48, train_loss: 0.6973, test_loss: 1.1871, test_f1: 0.5123
 epoch: 49, train_loss: 0.7028, test_loss: 1.0728, test_f1: 0.5329
 epoch: 50, train_loss: 0.7124, test_loss: 1.1352, test_f1: 0.5300
 epoch: 51, train_loss: 0.6794, test_loss: 1.0694, test_f1: 0.5422
 epoch: 52, train_loss: 0.6448, test_loss: 1.0697, test_f1: 0.5785
 epoch: 53, train_loss: 0.6395, test_loss: 1.1035, test_f1: 0.5712
 epoch: 54, train_loss: 0.6313, test_loss: 1.1381, test_f1: 0.5627
 epoch: 55, train_loss: 0.6187, test_loss: 1.1802, test_f1: 0.5632
 epoch: 56, train_loss: 0.6315, test_loss: 1.2318, test_f1: 0.5268
 epoch: 57, train_loss: 0.6478, test_loss: 1.1856, test_f1: 0.5830
 epoch: 58, train_loss: 0.6346, test_loss: 1.0328, test_f1: 0.5844
 epoch: 59, train_loss: 0.6358, test_loss: 1.2212, test_f1: 0.5558
 epoch: 60, train_loss: 0.6241, test_loss: 1.1514, test_f1: 0.5991
 epoch: 61, train_loss: 0.5969, test_loss: 1.2545, test_f1: 0.5484
 epoch: 62, train_loss: 0.6109, test_loss: 1.2679, test_f1: 0.5686
 epoch: 63, train_loss: 0.6127, test_loss: 1.1314, test_f1: 0.5550
 epoch: 64, train_loss: 0.5870, test_loss: 1.1799, test_f1: 0.5621
 epoch: 65, train_loss: 0.5783, test_loss: 1.2784, test_f1: 0.5476
 epoch: 66, train_loss: 0.5977, test_loss: 1.2048, test_f1: 0.5930
 epoch: 67, train_loss: 0.5868, test_loss: 1.3608, test_f1: 0.5606
 epoch: 68, train_loss: 0.5974, test_loss: 1.1636, test_f1: 0.5734
 epoch: 69, train_loss: 0.5889, test_loss: 1.2060, test_f1: 0.5701
 epoch: 70, train_loss: 0.5809, test_loss: 1.2183, test_f1: 0.5779
 epoch: 71, train_loss: 0.5893, test_loss: 1.2431, test_f1: 0.5714
 epoch: 72, train_loss: 0.5891, test_loss: 1.2325, test_f1: 0.5648
 epoch: 73, train_loss: 0.5758, test_loss: 1.3379, test_f1: 0.5479
 epoch: 74, train_loss: 0.5878, test_loss: 1.1402, test_f1: 0.5611
 epoch: 75, train_loss: 0.5819, test_loss: 1.1962, test_f1: 0.5540
 epoch: 76, train_loss: 0.5837, test_loss: 1.2369, test_f1: 0.5416
 epoch: 77, train_loss: 0.5682, test_loss: 1.2325, test_f1: 0.5708
 epoch: 78, train_loss: 0.5598, test_loss: 1.3828, test_f1: 0.5594
 epoch: 79, train_loss: 0.5718, test_loss: 1.1756, test_f1: 0.5904
 epoch: 80, train_loss: 0.5524, test_loss: 1.1663, test_f1: 0.5969
 epoch: 81, train_loss: 0.5726, test_loss: 1.2267, test_f1: 0.5751
 epoch: 82, train_loss: 0.5755, test_loss: 1.2129, test_f1: 0.5588
 epoch: 83, train_loss: 0.5549, test_loss: 1.2092, test_f1: 0.5956
 epoch: 84, train_loss: 0.5349, test_loss: 1.3686, test_f1: 0.5443
 epoch: 85, train_loss: 0.5299, test_loss: 1.3669, test_f1: 0.5595
 epoch: 86, train_loss: 0.5289, test_loss: 1.3193, test_f1: 0.5832
 epoch: 87, train_loss: 0.5578, test_loss: 1.3893, test_f1: 0.5539
 epoch: 88, train_loss: 0.5570, test_loss: 1.2549, test_f1: 0.5854
 epoch: 89, train_loss: 0.5353, test_loss: 1.2887, test_f1: 0.5829
 epoch: 90, train_loss: 0.5259, test_loss: 1.3460, test_f1: 0.5509
 epoch: 91, train_loss: 0.5345, test_loss: 1.3204, test_f1: 0.5771
 epoch: 92, train_loss: 0.5320, test_loss: 1.2304, test_f1: 0.5999
 epoch: 93, train_loss: 0.5215, test_loss: 1.3279, test_f1: 0.5894
 epoch: 94, train_loss: 0.5279, test_loss: 1.2746, test_f1: 0.5929
 epoch: 95, train_loss: 0.5251, test_loss: 1.2705, test_f1: 0.5889
 epoch: 96, train_loss: 0.5360, test_loss: 1.5786, test_f1: 0.5204
 epoch: 97, train_loss: 0.5397, test_loss: 1.5488, test_f1: 0.5540
 epoch: 98, train_loss: 0.5417, test_loss: 1.5396, test_f1: 0.5304
 epoch: 99, train_loss: 0.5204, test_loss: 1.3532, test_f1: 0.5803
##################ITERATION #3 ****************************************
 epoch: 0, train_loss: 1.3413, test_loss: 1.2637, test_f1: 0.2955
 epoch: 1, train_loss: 1.2282, test_loss: 1.1980, test_f1: 0.3196
 epoch: 2, train_loss: 1.1884, test_loss: 1.1876, test_f1: 0.3602
 epoch: 3, train_loss: 1.1541, test_loss: 1.1205, test_f1: 0.4022
 epoch: 4, train_loss: 1.1200, test_loss: 1.0899, test_f1: 0.4197
 epoch: 5, train_loss: 1.0895, test_loss: 1.0482, test_f1: 0.4413
 epoch: 6, train_loss: 1.0601, test_loss: 0.9886, test_f1: 0.4875
 epoch: 7, train_loss: 1.0340, test_loss: 0.9804, test_f1: 0.4714
 epoch: 8, train_loss: 1.0047, test_loss: 1.0152, test_f1: 0.4830
 epoch: 9, train_loss: 1.0071, test_loss: 0.9995, test_f1: 0.4395
 epoch: 10, train_loss: 0.9718, test_loss: 0.9279, test_f1: 0.4991
 epoch: 11, train_loss: 0.9526, test_loss: 1.0485, test_f1: 0.4662
 epoch: 12, train_loss: 0.9525, test_loss: 0.9602, test_f1: 0.4500
 epoch: 13, train_loss: 0.9254, test_loss: 0.9093, test_f1: 0.5323
 epoch: 14, train_loss: 0.9228, test_loss: 0.9985, test_f1: 0.4916
 epoch: 15, train_loss: 0.9002, test_loss: 0.9791, test_f1: 0.5291
 epoch: 16, train_loss: 0.8968, test_loss: 0.9368, test_f1: 0.4948
 epoch: 17, train_loss: 0.8868, test_loss: 0.9926, test_f1: 0.5240
 epoch: 18, train_loss: 0.8881, test_loss: 0.9401, test_f1: 0.4937
 epoch: 19, train_loss: 0.8710, test_loss: 0.9658, test_f1: 0.5119
 epoch: 20, train_loss: 0.8671, test_loss: 0.9649, test_f1: 0.5447
 epoch: 21, train_loss: 0.8655, test_loss: 0.9106, test_f1: 0.5456
 epoch: 22, train_loss: 0.8696, test_loss: 0.9667, test_f1: 0.5434
 epoch: 23, train_loss: 0.8563, test_loss: 1.0041, test_f1: 0.5025
 epoch: 24, train_loss: 0.8369, test_loss: 1.0910, test_f1: 0.5316
 epoch: 25, train_loss: 0.8299, test_loss: 1.0343, test_f1: 0.5206
 epoch: 26, train_loss: 0.8375, test_loss: 1.0197, test_f1: 0.5018
 epoch: 27, train_loss: 0.8244, test_loss: 1.0369, test_f1: 0.5676
 epoch: 28, train_loss: 0.8105, test_loss: 1.0348, test_f1: 0.5018
 epoch: 29, train_loss: 0.8273, test_loss: 1.0347, test_f1: 0.5405
 epoch: 30, train_loss: 0.8475, test_loss: 1.0333, test_f1: 0.5416
 epoch: 31, train_loss: 0.8135, test_loss: 1.0066, test_f1: 0.5505
 epoch: 32, train_loss: 0.8037, test_loss: 1.0673, test_f1: 0.5081
 epoch: 33, train_loss: 0.7836, test_loss: 1.0276, test_f1: 0.5545
 epoch: 34, train_loss: 0.7735, test_loss: 1.0473, test_f1: 0.5521
 epoch: 35, train_loss: 0.7562, test_loss: 1.0920, test_f1: 0.5264
 epoch: 36, train_loss: 0.7809, test_loss: 1.0447, test_f1: 0.5267
 epoch: 37, train_loss: 0.7742, test_loss: 0.9819, test_f1: 0.5467
 epoch: 38, train_loss: 0.7618, test_loss: 1.0619, test_f1: 0.5114
 epoch: 39, train_loss: 0.7637, test_loss: 1.2394, test_f1: 0.4875
 epoch: 40, train_loss: 0.7543, test_loss: 1.1388, test_f1: 0.4954
 epoch: 41, train_loss: 0.7456, test_loss: 1.0755, test_f1: 0.5314
 epoch: 42, train_loss: 0.7598, test_loss: 1.0629, test_f1: 0.5303
 epoch: 43, train_loss: 0.7446, test_loss: 1.0240, test_f1: 0.5525
 epoch: 44, train_loss: 0.7347, test_loss: 1.1017, test_f1: 0.5641
 epoch: 45, train_loss: 0.7492, test_loss: 1.0462, test_f1: 0.5515
 epoch: 46, train_loss: 0.7430, test_loss: 1.1404, test_f1: 0.5304
 epoch: 47, train_loss: 0.7309, test_loss: 1.1393, test_f1: 0.5334
 epoch: 48, train_loss: 0.7177, test_loss: 1.1229, test_f1: 0.5220
 epoch: 49, train_loss: 0.7267, test_loss: 1.3353, test_f1: 0.4741
 epoch: 50, train_loss: 0.7023, test_loss: 1.1383, test_f1: 0.5412
 epoch: 51, train_loss: 0.6915, test_loss: 1.0954, test_f1: 0.5328
 epoch: 52, train_loss: 0.6665, test_loss: 1.1338, test_f1: 0.5370
 epoch: 53, train_loss: 0.6483, test_loss: 1.1475, test_f1: 0.5491
 epoch: 54, train_loss: 0.6418, test_loss: 1.2292, test_f1: 0.5141
 epoch: 55, train_loss: 0.6435, test_loss: 1.2243, test_f1: 0.5309
 epoch: 56, train_loss: 0.6421, test_loss: 1.1640, test_f1: 0.5333
 epoch: 57, train_loss: 0.6370, test_loss: 1.1729, test_f1: 0.5363
 epoch: 58, train_loss: 0.6425, test_loss: 1.2153, test_f1: 0.5221
 epoch: 59, train_loss: 0.6317, test_loss: 1.3382, test_f1: 0.5199
 epoch: 60, train_loss: 0.6392, test_loss: 1.1644, test_f1: 0.5406
 epoch: 61, train_loss: 0.6388, test_loss: 1.2205, test_f1: 0.5332
 epoch: 62, train_loss: 0.6302, test_loss: 1.1812, test_f1: 0.5226
 epoch: 63, train_loss: 0.6131, test_loss: 1.2362, test_f1: 0.5431
 epoch: 64, train_loss: 0.6124, test_loss: 1.2381, test_f1: 0.5389
 epoch: 65, train_loss: 0.6291, test_loss: 1.2088, test_f1: 0.5288
 epoch: 66, train_loss: 0.6074, test_loss: 1.1911, test_f1: 0.5110
 epoch: 67, train_loss: 0.5894, test_loss: 1.2498, test_f1: 0.5275
 epoch: 68, train_loss: 0.6059, test_loss: 1.2022, test_f1: 0.5470
 epoch: 69, train_loss: 0.5997, test_loss: 1.2336, test_f1: 0.5389
 epoch: 70, train_loss: 0.5874, test_loss: 1.3261, test_f1: 0.5392
 epoch: 71, train_loss: 0.6012, test_loss: 1.1856, test_f1: 0.5456
 epoch: 72, train_loss: 0.6027, test_loss: 1.2708, test_f1: 0.5399
 epoch: 73, train_loss: 0.6016, test_loss: 1.2402, test_f1: 0.5637
 epoch: 74, train_loss: 0.5977, test_loss: 1.2397, test_f1: 0.5477
 epoch: 75, train_loss: 0.5954, test_loss: 1.1522, test_f1: 0.5491
 epoch: 76, train_loss: 0.6077, test_loss: 1.2500, test_f1: 0.5554
 epoch: 77, train_loss: 0.5963, test_loss: 1.3352, test_f1: 0.5300
 epoch: 78, train_loss: 0.6218, test_loss: 1.2417, test_f1: 0.5370
 epoch: 79, train_loss: 0.5968, test_loss: 1.3334, test_f1: 0.5194
 epoch: 80, train_loss: 0.6158, test_loss: 1.1861, test_f1: 0.5433
 epoch: 81, train_loss: 0.5765, test_loss: 1.2775, test_f1: 0.5104
 epoch: 82, train_loss: 0.5726, test_loss: 1.3834, test_f1: 0.5188
 epoch: 83, train_loss: 0.5701, test_loss: 1.2540, test_f1: 0.5537
 epoch: 84, train_loss: 0.5656, test_loss: 1.3015, test_f1: 0.5348
 epoch: 85, train_loss: 0.5512, test_loss: 1.2890, test_f1: 0.5592
 epoch: 86, train_loss: 0.5660, test_loss: 1.3507, test_f1: 0.5161
 epoch: 87, train_loss: 0.5540, test_loss: 1.2231, test_f1: 0.5579
 epoch: 88, train_loss: 0.5513, test_loss: 1.3705, test_f1: 0.5150
 epoch: 89, train_loss: 0.5451, test_loss: 1.5469, test_f1: 0.5096
 epoch: 90, train_loss: 0.5671, test_loss: 1.2628, test_f1: 0.5504
 epoch: 91, train_loss: 0.5300, test_loss: 1.3101, test_f1: 0.5351
 epoch: 92, train_loss: 0.5552, test_loss: 1.4053, test_f1: 0.5325
 epoch: 93, train_loss: 0.5460, test_loss: 1.3019, test_f1: 0.5320
 epoch: 94, train_loss: 0.5470, test_loss: 1.4298, test_f1: 0.5255
 epoch: 95, train_loss: 0.5432, test_loss: 1.3695, test_f1: 0.5329
 epoch: 96, train_loss: 0.5415, test_loss: 1.3849, test_f1: 0.5195
 epoch: 97, train_loss: 0.5257, test_loss: 1.5194, test_f1: 0.5094
 epoch: 98, train_loss: 0.5526, test_loss: 1.3224, test_f1: 0.5301
 epoch: 99, train_loss: 0.5617, test_loss: 1.3228, test_f1: 0.5482
##################ITERATION #4 ****************************************
 epoch: 0, train_loss: 1.3657, test_loss: 1.2773, test_f1: 0.2709
 epoch: 1, train_loss: 1.1862, test_loss: 1.1414, test_f1: 0.3863
 epoch: 2, train_loss: 1.1341, test_loss: 1.1020, test_f1: 0.4558
 epoch: 3, train_loss: 1.0958, test_loss: 1.0365, test_f1: 0.4705
 epoch: 4, train_loss: 1.0402, test_loss: 1.0392, test_f1: 0.4474
 epoch: 5, train_loss: 1.0271, test_loss: 1.0069, test_f1: 0.4849
 epoch: 6, train_loss: 1.0079, test_loss: 1.0381, test_f1: 0.4629
 epoch: 7, train_loss: 0.9918, test_loss: 1.0008, test_f1: 0.4608
 epoch: 8, train_loss: 0.9833, test_loss: 0.9877, test_f1: 0.4735
 epoch: 9, train_loss: 0.9692, test_loss: 1.0276, test_f1: 0.5311
 epoch: 10, train_loss: 0.9440, test_loss: 0.9134, test_f1: 0.5375
 epoch: 11, train_loss: 0.9437, test_loss: 1.0226, test_f1: 0.5145
 epoch: 12, train_loss: 0.9211, test_loss: 1.0401, test_f1: 0.5477
 epoch: 13, train_loss: 0.9072, test_loss: 1.0084, test_f1: 0.5169
 epoch: 14, train_loss: 0.9040, test_loss: 1.0161, test_f1: 0.5098
 epoch: 15, train_loss: 0.9129, test_loss: 0.9777, test_f1: 0.4808
 epoch: 16, train_loss: 0.8883, test_loss: 1.0417, test_f1: 0.5577
 epoch: 17, train_loss: 0.8839, test_loss: 0.9898, test_f1: 0.5289
 epoch: 18, train_loss: 0.8720, test_loss: 0.9933, test_f1: 0.5475
 epoch: 19, train_loss: 0.8529, test_loss: 0.9934, test_f1: 0.5645
 epoch: 20, train_loss: 0.8473, test_loss: 1.0089, test_f1: 0.5592
 epoch: 21, train_loss: 0.8489, test_loss: 1.1821, test_f1: 0.5084
 epoch: 22, train_loss: 0.8399, test_loss: 1.0592, test_f1: 0.5221
 epoch: 23, train_loss: 0.8345, test_loss: 1.0207, test_f1: 0.5250
 epoch: 24, train_loss: 0.8357, test_loss: 1.0207, test_f1: 0.5116
 epoch: 25, train_loss: 0.8215, test_loss: 1.0582, test_f1: 0.5086
 epoch: 26, train_loss: 0.8115, test_loss: 1.0135, test_f1: 0.5514
 epoch: 27, train_loss: 0.7994, test_loss: 0.9796, test_f1: 0.5695
 epoch: 28, train_loss: 0.8148, test_loss: 1.0473, test_f1: 0.5378
 epoch: 29, train_loss: 0.8029, test_loss: 1.0195, test_f1: 0.5541
 epoch: 30, train_loss: 0.8183, test_loss: 1.0608, test_f1: 0.5170
 epoch: 31, train_loss: 0.8021, test_loss: 1.0004, test_f1: 0.5558
 epoch: 32, train_loss: 0.8025, test_loss: 1.0185, test_f1: 0.5382
 epoch: 33, train_loss: 0.7813, test_loss: 0.9799, test_f1: 0.5536
 epoch: 34, train_loss: 0.7706, test_loss: 1.0271, test_f1: 0.5734
 epoch: 35, train_loss: 0.7695, test_loss: 1.1133, test_f1: 0.5043
 epoch: 36, train_loss: 0.7743, test_loss: 0.9882, test_f1: 0.5699
 epoch: 37, train_loss: 0.7703, test_loss: 0.9819, test_f1: 0.5505
 epoch: 38, train_loss: 0.7435, test_loss: 1.0545, test_f1: 0.5780
 epoch: 39, train_loss: 0.7561, test_loss: 1.0286, test_f1: 0.5230
 epoch: 40, train_loss: 0.7321, test_loss: 1.0904, test_f1: 0.5018
 epoch: 41, train_loss: 0.7391, test_loss: 0.9592, test_f1: 0.5901
 epoch: 42, train_loss: 0.7543, test_loss: 1.0631, test_f1: 0.5213
 epoch: 43, train_loss: 0.7778, test_loss: 1.0927, test_f1: 0.5176
 epoch: 44, train_loss: 0.7653, test_loss: 1.0534, test_f1: 0.5666
 epoch: 45, train_loss: 0.7618, test_loss: 1.0546, test_f1: 0.5727
 epoch: 46, train_loss: 0.7352, test_loss: 1.0479, test_f1: 0.5321
 epoch: 47, train_loss: 0.7216, test_loss: 1.0301, test_f1: 0.5650
 epoch: 48, train_loss: 0.7244, test_loss: 1.0604, test_f1: 0.5306
 epoch: 49, train_loss: 0.7016, test_loss: 1.0412, test_f1: 0.5361
 epoch: 50, train_loss: 0.6999, test_loss: 1.1321, test_f1: 0.5280
 epoch: 51, train_loss: 0.6839, test_loss: 1.0314, test_f1: 0.5664
 epoch: 52, train_loss: 0.6405, test_loss: 1.1211, test_f1: 0.5248
 epoch: 53, train_loss: 0.6354, test_loss: 1.0455, test_f1: 0.5765
 epoch: 54, train_loss: 0.6389, test_loss: 1.0393, test_f1: 0.5532
 epoch: 55, train_loss: 0.6349, test_loss: 1.1396, test_f1: 0.5298
 epoch: 56, train_loss: 0.6058, test_loss: 1.0549, test_f1: 0.5551
 epoch: 57, train_loss: 0.6258, test_loss: 1.0694, test_f1: 0.5626
 epoch: 58, train_loss: 0.6118, test_loss: 1.1154, test_f1: 0.5570
 epoch: 59, train_loss: 0.6100, test_loss: 1.1221, test_f1: 0.5286
 epoch: 60, train_loss: 0.5999, test_loss: 1.1676, test_f1: 0.5036
 epoch: 61, train_loss: 0.5871, test_loss: 1.3162, test_f1: 0.5787
 epoch: 62, train_loss: 0.6017, test_loss: 1.1204, test_f1: 0.5803
 epoch: 63, train_loss: 0.5939, test_loss: 1.1143, test_f1: 0.5526
 epoch: 64, train_loss: 0.5750, test_loss: 1.2192, test_f1: 0.5560
 epoch: 65, train_loss: 0.5905, test_loss: 1.1841, test_f1: 0.5342
 epoch: 66, train_loss: 0.5652, test_loss: 1.2541, test_f1: 0.5714
 epoch: 67, train_loss: 0.5887, test_loss: 1.2341, test_f1: 0.4992
 epoch: 68, train_loss: 0.5717, test_loss: 1.1574, test_f1: 0.5229
 epoch: 69, train_loss: 0.5699, test_loss: 1.1620, test_f1: 0.5452
 epoch: 70, train_loss: 0.5706, test_loss: 1.2507, test_f1: 0.5317
 epoch: 71, train_loss: 0.5548, test_loss: 1.1362, test_f1: 0.5474
 epoch: 72, train_loss: 0.5489, test_loss: 1.1662, test_f1: 0.5543
 epoch: 73, train_loss: 0.5584, test_loss: 1.1936, test_f1: 0.5626
 epoch: 74, train_loss: 0.5591, test_loss: 1.2456, test_f1: 0.5379
 epoch: 75, train_loss: 0.5474, test_loss: 1.1708, test_f1: 0.5410
 epoch: 76, train_loss: 0.5502, test_loss: 1.1382, test_f1: 0.5736
 epoch: 77, train_loss: 0.5551, test_loss: 1.2404, test_f1: 0.5196
 epoch: 78, train_loss: 0.5571, test_loss: 1.2120, test_f1: 0.5670
 epoch: 79, train_loss: 0.5735, test_loss: 1.1973, test_f1: 0.5446
 epoch: 80, train_loss: 0.5714, test_loss: 1.2649, test_f1: 0.4898
 epoch: 81, train_loss: 0.5459, test_loss: 1.2335, test_f1: 0.5198
 epoch: 82, train_loss: 0.5029, test_loss: 1.1666, test_f1: 0.5793
 epoch: 83, train_loss: 0.5146, test_loss: 1.3471, test_f1: 0.5166
 epoch: 84, train_loss: 0.5318, test_loss: 1.1502, test_f1: 0.5639
 epoch: 85, train_loss: 0.5355, test_loss: 1.2082, test_f1: 0.5766
 epoch: 86, train_loss: 0.5142, test_loss: 1.2281, test_f1: 0.5640
 epoch: 87, train_loss: 0.5121, test_loss: 1.3053, test_f1: 0.5226
 epoch: 88, train_loss: 0.5007, test_loss: 1.4492, test_f1: 0.5546
 epoch: 89, train_loss: 0.5081, test_loss: 1.2086, test_f1: 0.5353
 epoch: 90, train_loss: 0.5151, test_loss: 1.2938, test_f1: 0.5402
 epoch: 91, train_loss: 0.5196, test_loss: 1.2155, test_f1: 0.5412
 epoch: 92, train_loss: 0.4777, test_loss: 1.2792, test_f1: 0.5774
 epoch: 93, train_loss: 0.4807, test_loss: 1.3581, test_f1: 0.5477
 epoch: 94, train_loss: 0.4952, test_loss: 1.2865, test_f1: 0.5727
 epoch: 95, train_loss: 0.5143, test_loss: 1.1967, test_f1: 0.5779
 epoch: 96, train_loss: 0.5080, test_loss: 1.2766, test_f1: 0.5595
 epoch: 97, train_loss: 0.5101, test_loss: 1.4084, test_f1: 0.5745
 epoch: 98, train_loss: 0.5143, test_loss: 1.2861, test_f1: 0.5500
 epoch: 99, train_loss: 0.5053, test_loss: 1.3435, test_f1: 0.5434
##################ITERATION #5 ****************************************
 epoch: 0, train_loss: 1.4371, test_loss: 1.2805, test_f1: 0.2492
 epoch: 1, train_loss: 1.2146, test_loss: 1.1929, test_f1: 0.2648
 epoch: 2, train_loss: 1.1746, test_loss: 1.1085, test_f1: 0.4235
 epoch: 3, train_loss: 1.1035, test_loss: 1.0259, test_f1: 0.4419
 epoch: 4, train_loss: 1.0700, test_loss: 1.0848, test_f1: 0.4365
 epoch: 5, train_loss: 1.0366, test_loss: 0.9729, test_f1: 0.4729
 epoch: 6, train_loss: 1.0012, test_loss: 1.0050, test_f1: 0.4600
 epoch: 7, train_loss: 0.9864, test_loss: 1.1974, test_f1: 0.4503
 epoch: 8, train_loss: 0.9760, test_loss: 0.9622, test_f1: 0.4411
 epoch: 9, train_loss: 0.9481, test_loss: 0.9380, test_f1: 0.4886
 epoch: 10, train_loss: 0.9178, test_loss: 0.9500, test_f1: 0.4934
 epoch: 11, train_loss: 0.8926, test_loss: 0.9879, test_f1: 0.5112
 epoch: 12, train_loss: 0.8900, test_loss: 1.0541, test_f1: 0.4922
 epoch: 13, train_loss: 0.8951, test_loss: 1.0209, test_f1: 0.4851
 epoch: 14, train_loss: 0.9106, test_loss: 1.0071, test_f1: 0.5322
 epoch: 15, train_loss: 0.8894, test_loss: 1.0083, test_f1: 0.4939
 epoch: 16, train_loss: 0.8565, test_loss: 1.0618, test_f1: 0.4953
 epoch: 17, train_loss: 0.8490, test_loss: 1.0642, test_f1: 0.4792
 epoch: 18, train_loss: 0.8358, test_loss: 1.1230, test_f1: 0.4803
 epoch: 19, train_loss: 0.8398, test_loss: 1.2037, test_f1: 0.4748
 epoch: 20, train_loss: 0.8305, test_loss: 1.0172, test_f1: 0.5122
 epoch: 21, train_loss: 0.8318, test_loss: 1.0995, test_f1: 0.5084
 epoch: 22, train_loss: 0.8464, test_loss: 1.1438, test_f1: 0.4779
 epoch: 23, train_loss: 0.8061, test_loss: 1.0861, test_f1: 0.5187
 epoch: 24, train_loss: 0.8037, test_loss: 1.0342, test_f1: 0.5133
 epoch: 25, train_loss: 0.7983, test_loss: 1.1122, test_f1: 0.4714
 epoch: 26, train_loss: 0.7881, test_loss: 1.1209, test_f1: 0.4908
 epoch: 27, train_loss: 0.8026, test_loss: 0.9889, test_f1: 0.5313
 epoch: 28, train_loss: 0.7822, test_loss: 1.0836, test_f1: 0.5226
 epoch: 29, train_loss: 0.8183, test_loss: 1.2884, test_f1: 0.4826
 epoch: 30, train_loss: 0.7980, test_loss: 1.0732, test_f1: 0.5141
 epoch: 31, train_loss: 0.7716, test_loss: 1.0550, test_f1: 0.4990
 epoch: 32, train_loss: 0.7785, test_loss: 1.1736, test_f1: 0.4697
 epoch: 33, train_loss: 0.7670, test_loss: 1.1338, test_f1: 0.5120
 epoch: 34, train_loss: 0.7546, test_loss: 1.0013, test_f1: 0.5759
 epoch: 35, train_loss: 0.7372, test_loss: 1.1266, test_f1: 0.5175
 epoch: 36, train_loss: 0.7224, test_loss: 1.1740, test_f1: 0.5382
 epoch: 37, train_loss: 0.7315, test_loss: 1.0977, test_f1: 0.5177
 epoch: 38, train_loss: 0.7571, test_loss: 1.0718, test_f1: 0.5293
 epoch: 39, train_loss: 0.7645, test_loss: 1.0493, test_f1: 0.5543
 epoch: 40, train_loss: 0.7283, test_loss: 1.0621, test_f1: 0.5575
 epoch: 41, train_loss: 0.7348, test_loss: 1.1040, test_f1: 0.5467
 epoch: 42, train_loss: 0.7173, test_loss: 1.1605, test_f1: 0.5255
 epoch: 43, train_loss: 0.7116, test_loss: 1.1491, test_f1: 0.5416
 epoch: 44, train_loss: 0.7068, test_loss: 1.0833, test_f1: 0.5712
 epoch: 45, train_loss: 0.7200, test_loss: 1.1510, test_f1: 0.5218
 epoch: 46, train_loss: 0.7240, test_loss: 1.1867, test_f1: 0.5251
 epoch: 47, train_loss: 0.6921, test_loss: 1.1909, test_f1: 0.4975
 epoch: 48, train_loss: 0.6901, test_loss: 1.1029, test_f1: 0.5320
 epoch: 49, train_loss: 0.6862, test_loss: 1.2316, test_f1: 0.5062
 epoch: 50, train_loss: 0.6957, test_loss: 1.1426, test_f1: 0.5515
 epoch: 51, train_loss: 0.6798, test_loss: 1.1307, test_f1: 0.5582
 epoch: 52, train_loss: 0.6355, test_loss: 1.1036, test_f1: 0.5360
 epoch: 53, train_loss: 0.6271, test_loss: 1.1873, test_f1: 0.5412
 epoch: 54, train_loss: 0.6193, test_loss: 1.1209, test_f1: 0.5854
 epoch: 55, train_loss: 0.6319, test_loss: 1.2274, test_f1: 0.5474
 epoch: 56, train_loss: 0.6124, test_loss: 1.1468, test_f1: 0.5589
 epoch: 57, train_loss: 0.6102, test_loss: 1.1796, test_f1: 0.5713
 epoch: 58, train_loss: 0.6127, test_loss: 1.2179, test_f1: 0.5442
 epoch: 59, train_loss: 0.6152, test_loss: 1.1794, test_f1: 0.5582
 epoch: 60, train_loss: 0.6016, test_loss: 1.1933, test_f1: 0.5619
 epoch: 61, train_loss: 0.6144, test_loss: 1.1534, test_f1: 0.5825
 epoch: 62, train_loss: 0.6260, test_loss: 1.2087, test_f1: 0.5399
 epoch: 63, train_loss: 0.5871, test_loss: 1.2140, test_f1: 0.5728
 epoch: 64, train_loss: 0.6007, test_loss: 1.2124, test_f1: 0.5561
 epoch: 65, train_loss: 0.5978, test_loss: 1.2746, test_f1: 0.5430
 epoch: 66, train_loss: 0.5807, test_loss: 1.1783, test_f1: 0.5588
 epoch: 67, train_loss: 0.5928, test_loss: 1.1973, test_f1: 0.5770
 epoch: 68, train_loss: 0.5821, test_loss: 1.3205, test_f1: 0.5443
 epoch: 69, train_loss: 0.5635, test_loss: 1.3124, test_f1: 0.5352
 epoch: 70, train_loss: 0.5619, test_loss: 1.2834, test_f1: 0.5797
 epoch: 71, train_loss: 0.5542, test_loss: 1.3014, test_f1: 0.5655
 epoch: 72, train_loss: 0.5606, test_loss: 1.2865, test_f1: 0.5520
 epoch: 73, train_loss: 0.5576, test_loss: 1.3572, test_f1: 0.5406
 epoch: 74, train_loss: 0.5790, test_loss: 1.2981, test_f1: 0.5594
 epoch: 75, train_loss: 0.5535, test_loss: 1.3495, test_f1: 0.5340
 epoch: 76, train_loss: 0.5514, test_loss: 1.3734, test_f1: 0.5289
 epoch: 77, train_loss: 0.5535, test_loss: 1.2166, test_f1: 0.5703
 epoch: 78, train_loss: 0.5471, test_loss: 1.2872, test_f1: 0.5652
 epoch: 79, train_loss: 0.5247, test_loss: 1.3597, test_f1: 0.5516
 epoch: 80, train_loss: 0.5391, test_loss: 1.4844, test_f1: 0.5716
 epoch: 81, train_loss: 0.5359, test_loss: 1.4201, test_f1: 0.5473
 epoch: 82, train_loss: 0.5351, test_loss: 1.4446, test_f1: 0.5211
 epoch: 83, train_loss: 0.5343, test_loss: 1.4083, test_f1: 0.5473
 epoch: 84, train_loss: 0.5398, test_loss: 1.3419, test_f1: 0.5508
 epoch: 85, train_loss: 0.5301, test_loss: 1.3594, test_f1: 0.5622
 epoch: 86, train_loss: 0.5403, test_loss: 1.2496, test_f1: 0.5464
 epoch: 87, train_loss: 0.5324, test_loss: 1.3890, test_f1: 0.5643
 epoch: 88, train_loss: 0.5135, test_loss: 1.5200, test_f1: 0.5541
 epoch: 89, train_loss: 0.5327, test_loss: 1.4583, test_f1: 0.5392
 epoch: 90, train_loss: 0.5426, test_loss: 1.3989, test_f1: 0.5429
 epoch: 91, train_loss: 0.5354, test_loss: 1.5048, test_f1: 0.5069
 epoch: 92, train_loss: 0.5255, test_loss: 1.3817, test_f1: 0.5554
 epoch: 93, train_loss: 0.5340, test_loss: 1.4448, test_f1: 0.5234
 epoch: 94, train_loss: 0.5056, test_loss: 1.4274, test_f1: 0.5299
 epoch: 95, train_loss: 0.5057, test_loss: 1.3566, test_f1: 0.5625
 epoch: 96, train_loss: 0.4996, test_loss: 1.5173, test_f1: 0.5489
 epoch: 97, train_loss: 0.4985, test_loss: 1.5413, test_f1: 0.5158
 epoch: 98, train_loss: 0.5108, test_loss: 1.5062, test_f1: 0.5405
 epoch: 99, train_loss: 0.5063, test_loss: 1.5089, test_f1: 0.5259
##################ITERATION #6 ****************************************
 epoch: 0, train_loss: 1.4193, test_loss: 1.2907, test_f1: 0.2707
 epoch: 1, train_loss: 1.2189, test_loss: 1.1912, test_f1: 0.3275
 epoch: 2, train_loss: 1.1881, test_loss: 1.1513, test_f1: 0.3296
 epoch: 3, train_loss: 1.1456, test_loss: 1.0708, test_f1: 0.4326
 epoch: 4, train_loss: 1.1132, test_loss: 1.0985, test_f1: 0.4272
 epoch: 5, train_loss: 1.0690, test_loss: 1.0635, test_f1: 0.4426
 epoch: 6, train_loss: 1.0397, test_loss: 0.9546, test_f1: 0.4682
 epoch: 7, train_loss: 1.0171, test_loss: 0.9846, test_f1: 0.4790
 epoch: 8, train_loss: 0.9891, test_loss: 0.9502, test_f1: 0.4732
 epoch: 9, train_loss: 0.9740, test_loss: 0.9980, test_f1: 0.4729
 epoch: 10, train_loss: 0.9542, test_loss: 0.9251, test_f1: 0.4766
 epoch: 11, train_loss: 0.9569, test_loss: 0.9542, test_f1: 0.4893
 epoch: 12, train_loss: 0.9462, test_loss: 0.9692, test_f1: 0.4720
 epoch: 13, train_loss: 0.9160, test_loss: 0.9353, test_f1: 0.5089
 epoch: 14, train_loss: 0.9127, test_loss: 1.1128, test_f1: 0.4627
 epoch: 15, train_loss: 0.9286, test_loss: 0.9995, test_f1: 0.5332
 epoch: 16, train_loss: 0.8978, test_loss: 0.9864, test_f1: 0.5350
 epoch: 17, train_loss: 0.8762, test_loss: 0.9573, test_f1: 0.5205
 epoch: 18, train_loss: 0.8666, test_loss: 1.0081, test_f1: 0.5059
 epoch: 19, train_loss: 0.8657, test_loss: 1.0393, test_f1: 0.4719
 epoch: 20, train_loss: 0.8627, test_loss: 0.9012, test_f1: 0.5355
 epoch: 21, train_loss: 0.8717, test_loss: 1.0773, test_f1: 0.4878
 epoch: 22, train_loss: 0.8673, test_loss: 1.0544, test_f1: 0.4934
 epoch: 23, train_loss: 0.8736, test_loss: 1.0128, test_f1: 0.4886
 epoch: 24, train_loss: 0.8368, test_loss: 1.0356, test_f1: 0.5349
 epoch: 25, train_loss: 0.8393, test_loss: 1.0407, test_f1: 0.5105
 epoch: 26, train_loss: 0.8279, test_loss: 1.0560, test_f1: 0.5020
 epoch: 27, train_loss: 0.8218, test_loss: 1.1700, test_f1: 0.4311
 epoch: 28, train_loss: 0.8322, test_loss: 1.0911, test_f1: 0.5083
 epoch: 29, train_loss: 0.8109, test_loss: 1.0172, test_f1: 0.5339
 epoch: 30, train_loss: 0.7988, test_loss: 0.9440, test_f1: 0.5296
 epoch: 31, train_loss: 0.7985, test_loss: 1.0782, test_f1: 0.5291
 epoch: 32, train_loss: 0.7806, test_loss: 1.0516, test_f1: 0.5553
 epoch: 33, train_loss: 0.7881, test_loss: 1.0660, test_f1: 0.5245
 epoch: 34, train_loss: 0.7866, test_loss: 1.0611, test_f1: 0.5350
 epoch: 35, train_loss: 0.7982, test_loss: 0.9918, test_f1: 0.5383
 epoch: 36, train_loss: 0.7758, test_loss: 1.1144, test_f1: 0.5137
 epoch: 37, train_loss: 0.7656, test_loss: 1.0238, test_f1: 0.5162
 epoch: 38, train_loss: 0.7606, test_loss: 1.0249, test_f1: 0.5076
 epoch: 39, train_loss: 0.7749, test_loss: 1.1654, test_f1: 0.5097
 epoch: 40, train_loss: 0.7724, test_loss: 1.0031, test_f1: 0.5798
 epoch: 41, train_loss: 0.7615, test_loss: 1.1013, test_f1: 0.4848
 epoch: 42, train_loss: 0.7377, test_loss: 1.0584, test_f1: 0.5231
 epoch: 43, train_loss: 0.7451, test_loss: 0.9872, test_f1: 0.5404
 epoch: 44, train_loss: 0.7406, test_loss: 1.0229, test_f1: 0.5428
 epoch: 45, train_loss: 0.7428, test_loss: 1.1136, test_f1: 0.5103
 epoch: 46, train_loss: 0.7334, test_loss: 1.1180, test_f1: 0.4743
 epoch: 47, train_loss: 0.7213, test_loss: 1.0521, test_f1: 0.5413
 epoch: 48, train_loss: 0.7385, test_loss: 1.1325, test_f1: 0.5364
 epoch: 49, train_loss: 0.7395, test_loss: 1.1243, test_f1: 0.5365
 epoch: 50, train_loss: 0.7268, test_loss: 1.0294, test_f1: 0.5521
 epoch: 51, train_loss: 0.6917, test_loss: 1.0108, test_f1: 0.5736
 epoch: 52, train_loss: 0.6753, test_loss: 1.0102, test_f1: 0.5791
 epoch: 53, train_loss: 0.6384, test_loss: 1.0666, test_f1: 0.5852
 epoch: 54, train_loss: 0.6463, test_loss: 1.0579, test_f1: 0.5768
 epoch: 55, train_loss: 0.6512, test_loss: 1.0129, test_f1: 0.5742
 epoch: 56, train_loss: 0.6308, test_loss: 1.1711, test_f1: 0.5394
 epoch: 57, train_loss: 0.6427, test_loss: 1.0533, test_f1: 0.5663
 epoch: 58, train_loss: 0.6345, test_loss: 1.1062, test_f1: 0.5552
 epoch: 59, train_loss: 0.6348, test_loss: 1.1148, test_f1: 0.5635
 epoch: 60, train_loss: 0.6318, test_loss: 1.1059, test_f1: 0.5579
 epoch: 61, train_loss: 0.6207, test_loss: 1.1555, test_f1: 0.5423
 epoch: 62, train_loss: 0.6041, test_loss: 1.0864, test_f1: 0.5820
 epoch: 63, train_loss: 0.6032, test_loss: 1.1435, test_f1: 0.5824
 epoch: 64, train_loss: 0.5994, test_loss: 1.1614, test_f1: 0.5402
 epoch: 65, train_loss: 0.6090, test_loss: 1.1380, test_f1: 0.5663
 epoch: 66, train_loss: 0.6172, test_loss: 1.1944, test_f1: 0.5418
 epoch: 67, train_loss: 0.6129, test_loss: 1.1356, test_f1: 0.5573
 epoch: 68, train_loss: 0.6288, test_loss: 1.1872, test_f1: 0.5566
 epoch: 69, train_loss: 0.6021, test_loss: 1.1029, test_f1: 0.5621
 epoch: 70, train_loss: 0.5730, test_loss: 1.1565, test_f1: 0.5518
 epoch: 71, train_loss: 0.5585, test_loss: 1.1880, test_f1: 0.5577
 epoch: 72, train_loss: 0.5617, test_loss: 1.1500, test_f1: 0.5502
 epoch: 73, train_loss: 0.5668, test_loss: 1.2134, test_f1: 0.5259
 epoch: 74, train_loss: 0.5866, test_loss: 1.2033, test_f1: 0.5767
 epoch: 75, train_loss: 0.5669, test_loss: 1.2550, test_f1: 0.5562
 epoch: 76, train_loss: 0.5858, test_loss: 1.1674, test_f1: 0.5504
 epoch: 77, train_loss: 0.5885, test_loss: 1.3457, test_f1: 0.5500
 epoch: 78, train_loss: 0.5639, test_loss: 1.1748, test_f1: 0.5536
 epoch: 79, train_loss: 0.5475, test_loss: 1.1895, test_f1: 0.5674
 epoch: 80, train_loss: 0.5393, test_loss: 1.2818, test_f1: 0.5841
 epoch: 81, train_loss: 0.5493, test_loss: 1.1942, test_f1: 0.5802
 epoch: 82, train_loss: 0.5517, test_loss: 1.3432, test_f1: 0.5252
 epoch: 83, train_loss: 0.5317, test_loss: 1.1778, test_f1: 0.5841
 epoch: 84, train_loss: 0.5382, test_loss: 1.5109, test_f1: 0.5255
 epoch: 85, train_loss: 0.5326, test_loss: 1.2170, test_f1: 0.5541
 epoch: 86, train_loss: 0.5255, test_loss: 1.1713, test_f1: 0.5475
 epoch: 87, train_loss: 0.5554, test_loss: 1.1937, test_f1: 0.5582
 epoch: 88, train_loss: 0.5359, test_loss: 1.3852, test_f1: 0.5677
 epoch: 89, train_loss: 0.5603, test_loss: 1.2540, test_f1: 0.5503
 epoch: 90, train_loss: 0.5461, test_loss: 1.2085, test_f1: 0.5473
 epoch: 91, train_loss: 0.5347, test_loss: 1.2723, test_f1: 0.5524
 epoch: 92, train_loss: 0.5470, test_loss: 1.2172, test_f1: 0.5697
 epoch: 93, train_loss: 0.5413, test_loss: 1.3253, test_f1: 0.5484
 epoch: 94, train_loss: 0.5405, test_loss: 1.1904, test_f1: 0.5604
 epoch: 95, train_loss: 0.5087, test_loss: 1.2998, test_f1: 0.5533
 epoch: 96, train_loss: 0.5185, test_loss: 1.3113, test_f1: 0.5632
 epoch: 97, train_loss: 0.5153, test_loss: 1.2889, test_f1: 0.5830
 epoch: 98, train_loss: 0.5110, test_loss: 1.3540, test_f1: 0.5610
 epoch: 99, train_loss: 0.5310, test_loss: 1.2299, test_f1: 0.5628
##################ITERATION #7 ****************************************
 epoch: 0, train_loss: 1.4796, test_loss: 1.2800, test_f1: 0.2446
 epoch: 1, train_loss: 1.2328, test_loss: 1.2239, test_f1: 0.3136
 epoch: 2, train_loss: 1.1862, test_loss: 1.1783, test_f1: 0.3621
 epoch: 3, train_loss: 1.1561, test_loss: 1.0826, test_f1: 0.4142
 epoch: 4, train_loss: 1.1105, test_loss: 1.0677, test_f1: 0.4108
 epoch: 5, train_loss: 1.0755, test_loss: 1.0380, test_f1: 0.4494
 epoch: 6, train_loss: 1.0479, test_loss: 0.9860, test_f1: 0.4799
 epoch: 7, train_loss: 1.0268, test_loss: 1.0142, test_f1: 0.4829
 epoch: 8, train_loss: 1.0068, test_loss: 0.9748, test_f1: 0.4836
 epoch: 9, train_loss: 0.9889, test_loss: 0.9503, test_f1: 0.4543
 epoch: 10, train_loss: 0.9804, test_loss: 1.0000, test_f1: 0.4623
 epoch: 11, train_loss: 0.9581, test_loss: 1.1234, test_f1: 0.4513
 epoch: 12, train_loss: 0.9521, test_loss: 0.8898, test_f1: 0.5171
 epoch: 13, train_loss: 0.9458, test_loss: 0.9157, test_f1: 0.4932
 epoch: 14, train_loss: 0.9480, test_loss: 0.9960, test_f1: 0.4608
 epoch: 15, train_loss: 0.9538, test_loss: 0.9046, test_f1: 0.4937
 epoch: 16, train_loss: 0.9310, test_loss: 1.0745, test_f1: 0.4519
 epoch: 17, train_loss: 0.9227, test_loss: 0.9474, test_f1: 0.5038
 epoch: 18, train_loss: 0.9037, test_loss: 0.9120, test_f1: 0.5387
 epoch: 19, train_loss: 0.8945, test_loss: 1.2624, test_f1: 0.4707
 epoch: 20, train_loss: 0.9180, test_loss: 1.0135, test_f1: 0.4562
 epoch: 21, train_loss: 0.8961, test_loss: 0.9280, test_f1: 0.4848
 epoch: 22, train_loss: 0.8927, test_loss: 1.0530, test_f1: 0.4686
 epoch: 23, train_loss: 0.8853, test_loss: 0.9455, test_f1: 0.5000
 epoch: 24, train_loss: 0.8832, test_loss: 0.9147, test_f1: 0.5057
 epoch: 25, train_loss: 0.8573, test_loss: 0.9574, test_f1: 0.4924
 epoch: 26, train_loss: 0.8555, test_loss: 0.8404, test_f1: 0.5169
 epoch: 27, train_loss: 0.8527, test_loss: 0.8768, test_f1: 0.5086
 epoch: 28, train_loss: 0.8677, test_loss: 1.0992, test_f1: 0.4843
 epoch: 29, train_loss: 0.8622, test_loss: 1.1570, test_f1: 0.4687
 epoch: 30, train_loss: 0.8453, test_loss: 1.0103, test_f1: 0.4838
 epoch: 31, train_loss: 0.8465, test_loss: 0.9920, test_f1: 0.5349
 epoch: 32, train_loss: 0.8301, test_loss: 1.0147, test_f1: 0.5145
 epoch: 33, train_loss: 0.8122, test_loss: 1.0004, test_f1: 0.5325
 epoch: 34, train_loss: 0.8097, test_loss: 1.0105, test_f1: 0.5199
 epoch: 35, train_loss: 0.8183, test_loss: 1.0755, test_f1: 0.5170
 epoch: 36, train_loss: 0.8108, test_loss: 1.0136, test_f1: 0.5105
 epoch: 37, train_loss: 0.8428, test_loss: 1.0476, test_f1: 0.5090
 epoch: 38, train_loss: 0.8074, test_loss: 0.9428, test_f1: 0.5272
 epoch: 39, train_loss: 0.8140, test_loss: 1.0158, test_f1: 0.5319
 epoch: 40, train_loss: 0.7870, test_loss: 1.0662, test_f1: 0.5070
 epoch: 41, train_loss: 0.8041, test_loss: 1.0832, test_f1: 0.4849
 epoch: 42, train_loss: 0.8019, test_loss: 0.9693, test_f1: 0.5274
 epoch: 43, train_loss: 0.7955, test_loss: 0.9907, test_f1: 0.5336
 epoch: 44, train_loss: 0.7933, test_loss: 1.0264, test_f1: 0.5551
 epoch: 45, train_loss: 0.8061, test_loss: 1.1131, test_f1: 0.4599
 epoch: 46, train_loss: 0.7900, test_loss: 1.0146, test_f1: 0.5312
 epoch: 47, train_loss: 0.7750, test_loss: 0.8960, test_f1: 0.5342
 epoch: 48, train_loss: 0.7832, test_loss: 1.0148, test_f1: 0.5318
 epoch: 49, train_loss: 0.7716, test_loss: 0.9491, test_f1: 0.5349
 epoch: 50, train_loss: 0.7701, test_loss: 0.9818, test_f1: 0.5101
 epoch: 51, train_loss: 0.7452, test_loss: 0.9561, test_f1: 0.5487
 epoch: 52, train_loss: 0.7241, test_loss: 1.0130, test_f1: 0.5045
 epoch: 53, train_loss: 0.7062, test_loss: 0.9554, test_f1: 0.5451
 epoch: 54, train_loss: 0.7061, test_loss: 1.0158, test_f1: 0.5041
 epoch: 55, train_loss: 0.7091, test_loss: 0.9999, test_f1: 0.5429
 epoch: 56, train_loss: 0.7147, test_loss: 1.0038, test_f1: 0.5333
 epoch: 57, train_loss: 0.7071, test_loss: 1.0904, test_f1: 0.5076
 epoch: 58, train_loss: 0.6992, test_loss: 1.0483, test_f1: 0.5479
 epoch: 59, train_loss: 0.6949, test_loss: 1.0555, test_f1: 0.5030
 epoch: 60, train_loss: 0.7077, test_loss: 1.0362, test_f1: 0.5177
 epoch: 61, train_loss: 0.7104, test_loss: 1.1005, test_f1: 0.5211
 epoch: 62, train_loss: 0.6860, test_loss: 1.0661, test_f1: 0.5178
 epoch: 63, train_loss: 0.6875, test_loss: 1.1349, test_f1: 0.5103
 epoch: 64, train_loss: 0.6842, test_loss: 1.0713, test_f1: 0.5325
 epoch: 65, train_loss: 0.6755, test_loss: 1.0393, test_f1: 0.5235
 epoch: 66, train_loss: 0.6979, test_loss: 1.0474, test_f1: 0.5385
 epoch: 67, train_loss: 0.6659, test_loss: 1.0815, test_f1: 0.5347
 epoch: 68, train_loss: 0.6749, test_loss: 1.1577, test_f1: 0.5017
 epoch: 69, train_loss: 0.6734, test_loss: 1.1135, test_f1: 0.5266
 epoch: 70, train_loss: 0.6598, test_loss: 1.0399, test_f1: 0.5386
 epoch: 71, train_loss: 0.6762, test_loss: 1.1116, test_f1: 0.5255
 epoch: 72, train_loss: 0.6824, test_loss: 1.0225, test_f1: 0.5478
 epoch: 73, train_loss: 0.6654, test_loss: 1.1193, test_f1: 0.5227
 epoch: 74, train_loss: 0.6556, test_loss: 1.0335, test_f1: 0.5367
 epoch: 75, train_loss: 0.6532, test_loss: 1.1007, test_f1: 0.5443
 epoch: 76, train_loss: 0.6697, test_loss: 1.1925, test_f1: 0.5177
 epoch: 77, train_loss: 0.6597, test_loss: 1.0953, test_f1: 0.5515
 epoch: 78, train_loss: 0.6576, test_loss: 1.0930, test_f1: 0.5211
 epoch: 79, train_loss: 0.6495, test_loss: 1.1624, test_f1: 0.5202
 epoch: 80, train_loss: 0.6487, test_loss: 1.0600, test_f1: 0.5346
 epoch: 81, train_loss: 0.6493, test_loss: 1.0726, test_f1: 0.5593
 epoch: 82, train_loss: 0.6500, test_loss: 1.1183, test_f1: 0.5276
 epoch: 83, train_loss: 0.6519, test_loss: 1.1926, test_f1: 0.5028
 epoch: 84, train_loss: 0.6660, test_loss: 1.2095, test_f1: 0.5092
 epoch: 85, train_loss: 0.6551, test_loss: 1.1852, test_f1: 0.5140
 epoch: 86, train_loss: 0.6537, test_loss: 1.2436, test_f1: 0.5088
 epoch: 87, train_loss: 0.6362, test_loss: 1.0749, test_f1: 0.5268
 epoch: 88, train_loss: 0.6351, test_loss: 1.0722, test_f1: 0.5595
 epoch: 89, train_loss: 0.6475, test_loss: 1.1556, test_f1: 0.5267
 epoch: 90, train_loss: 0.6278, test_loss: 1.2170, test_f1: 0.5666
 epoch: 91, train_loss: 0.6282, test_loss: 1.2965, test_f1: 0.5062
 epoch: 92, train_loss: 0.6186, test_loss: 1.1433, test_f1: 0.5202
 epoch: 93, train_loss: 0.6353, test_loss: 1.1833, test_f1: 0.5608
 epoch: 94, train_loss: 0.6299, test_loss: 1.1322, test_f1: 0.5419
 epoch: 95, train_loss: 0.6161, test_loss: 1.1472, test_f1: 0.5423
 epoch: 96, train_loss: 0.6021, test_loss: 1.1107, test_f1: 0.5551
 epoch: 97, train_loss: 0.6370, test_loss: 1.1859, test_f1: 0.5199
 epoch: 98, train_loss: 0.6461, test_loss: 1.2502, test_f1: 0.5092
 epoch: 99, train_loss: 0.6277, test_loss: 1.2169, test_f1: 0.5414
##################ITERATION #8 ****************************************
 epoch: 0, train_loss: 1.4181, test_loss: 1.2822, test_f1: 0.2791
 epoch: 1, train_loss: 1.2390, test_loss: 1.1970, test_f1: 0.3524
 epoch: 2, train_loss: 1.2004, test_loss: 1.1944, test_f1: 0.3022
 epoch: 3, train_loss: 1.1620, test_loss: 1.1080, test_f1: 0.4638
 epoch: 4, train_loss: 1.1264, test_loss: 1.0772, test_f1: 0.4464
 epoch: 5, train_loss: 1.1138, test_loss: 1.0903, test_f1: 0.4435
 epoch: 6, train_loss: 1.0947, test_loss: 1.0338, test_f1: 0.4686
 epoch: 7, train_loss: 1.0677, test_loss: 1.0355, test_f1: 0.4525
 epoch: 8, train_loss: 1.0425, test_loss: 1.0300, test_f1: 0.4734
 epoch: 9, train_loss: 1.0303, test_loss: 0.9712, test_f1: 0.5164
 epoch: 10, train_loss: 1.0002, test_loss: 1.0146, test_f1: 0.5025
 epoch: 11, train_loss: 0.9708, test_loss: 0.9938, test_f1: 0.4974
 epoch: 12, train_loss: 0.9682, test_loss: 1.1010, test_f1: 0.4615
 epoch: 13, train_loss: 0.9187, test_loss: 1.0180, test_f1: 0.5009
 epoch: 14, train_loss: 0.9205, test_loss: 1.0270, test_f1: 0.4829
 epoch: 15, train_loss: 0.9230, test_loss: 0.9810, test_f1: 0.5324
 epoch: 16, train_loss: 0.8850, test_loss: 1.0164, test_f1: 0.5264
 epoch: 17, train_loss: 0.8859, test_loss: 1.0052, test_f1: 0.5100
 epoch: 18, train_loss: 0.8750, test_loss: 1.0731, test_f1: 0.5169
 epoch: 19, train_loss: 0.8728, test_loss: 1.0043, test_f1: 0.5284
 epoch: 20, train_loss: 0.8659, test_loss: 1.0007, test_f1: 0.5261
 epoch: 21, train_loss: 0.8499, test_loss: 1.0167, test_f1: 0.5389
 epoch: 22, train_loss: 0.8391, test_loss: 1.0142, test_f1: 0.5264
 epoch: 23, train_loss: 0.8425, test_loss: 1.0083, test_f1: 0.5362
 epoch: 24, train_loss: 0.8309, test_loss: 0.9881, test_f1: 0.5554
 epoch: 25, train_loss: 0.8156, test_loss: 1.0023, test_f1: 0.5428
 epoch: 26, train_loss: 0.8358, test_loss: 1.2860, test_f1: 0.4789
 epoch: 27, train_loss: 0.8291, test_loss: 1.0788, test_f1: 0.5047
 epoch: 28, train_loss: 0.8273, test_loss: 1.1407, test_f1: 0.5216
 epoch: 29, train_loss: 0.8099, test_loss: 1.0471, test_f1: 0.5374
 epoch: 30, train_loss: 0.8008, test_loss: 1.0129, test_f1: 0.5159
 epoch: 31, train_loss: 0.7970, test_loss: 1.0263, test_f1: 0.5424
 epoch: 32, train_loss: 0.7817, test_loss: 1.0210, test_f1: 0.5222
 epoch: 33, train_loss: 0.7849, test_loss: 1.0153, test_f1: 0.5499
 epoch: 34, train_loss: 0.7627, test_loss: 1.0369, test_f1: 0.5416
 epoch: 35, train_loss: 0.7905, test_loss: 1.0615, test_f1: 0.5131
 epoch: 36, train_loss: 0.8024, test_loss: 1.0897, test_f1: 0.5248
 epoch: 37, train_loss: 0.7731, test_loss: 1.0534, test_f1: 0.5286
 epoch: 38, train_loss: 0.7672, test_loss: 1.0537, test_f1: 0.5295
 epoch: 39, train_loss: 0.7864, test_loss: 1.0079, test_f1: 0.5383
 epoch: 40, train_loss: 0.7832, test_loss: 0.9759, test_f1: 0.5480
 epoch: 41, train_loss: 0.7585, test_loss: 1.0506, test_f1: 0.5459
 epoch: 42, train_loss: 0.7508, test_loss: 1.1257, test_f1: 0.5407
 epoch: 43, train_loss: 0.7323, test_loss: 1.0371, test_f1: 0.5551
 epoch: 44, train_loss: 0.7264, test_loss: 1.1230, test_f1: 0.5310
 epoch: 45, train_loss: 0.7487, test_loss: 1.0507, test_f1: 0.5100
 epoch: 46, train_loss: 0.7477, test_loss: 1.0933, test_f1: 0.5537
 epoch: 47, train_loss: 0.7184, test_loss: 1.0638, test_f1: 0.5665
 epoch: 48, train_loss: 0.6902, test_loss: 1.0486, test_f1: 0.5515
 epoch: 49, train_loss: 0.7292, test_loss: 1.0042, test_f1: 0.5564
 epoch: 50, train_loss: 0.7202, test_loss: 1.0607, test_f1: 0.5470
 epoch: 51, train_loss: 0.6930, test_loss: 1.0954, test_f1: 0.5484
 epoch: 52, train_loss: 0.6784, test_loss: 1.0955, test_f1: 0.5268
 epoch: 53, train_loss: 0.6558, test_loss: 1.0583, test_f1: 0.5459
 epoch: 54, train_loss: 0.6683, test_loss: 1.1354, test_f1: 0.5157
 epoch: 55, train_loss: 0.6536, test_loss: 1.0604, test_f1: 0.5333
 epoch: 56, train_loss: 0.6331, test_loss: 1.1453, test_f1: 0.5187
 epoch: 57, train_loss: 0.6312, test_loss: 1.1078, test_f1: 0.5418
 epoch: 58, train_loss: 0.6310, test_loss: 1.0151, test_f1: 0.5547
 epoch: 59, train_loss: 0.6253, test_loss: 1.0916, test_f1: 0.5402
 epoch: 60, train_loss: 0.6109, test_loss: 1.0455, test_f1: 0.5639
 epoch: 61, train_loss: 0.6229, test_loss: 1.0906, test_f1: 0.5614
 epoch: 62, train_loss: 0.6179, test_loss: 1.1078, test_f1: 0.5434
 epoch: 63, train_loss: 0.6212, test_loss: 1.1316, test_f1: 0.5346
 epoch: 64, train_loss: 0.6128, test_loss: 1.1654, test_f1: 0.5372
 epoch: 65, train_loss: 0.6143, test_loss: 1.1386, test_f1: 0.5539
 epoch: 66, train_loss: 0.6137, test_loss: 1.2913, test_f1: 0.5087
 epoch: 67, train_loss: 0.6246, test_loss: 1.1403, test_f1: 0.5421
 epoch: 68, train_loss: 0.6088, test_loss: 1.1016, test_f1: 0.5550
 epoch: 69, train_loss: 0.5992, test_loss: 1.0612, test_f1: 0.5714
 epoch: 70, train_loss: 0.6004, test_loss: 1.2153, test_f1: 0.5186
 epoch: 71, train_loss: 0.5989, test_loss: 1.3190, test_f1: 0.5208
 epoch: 72, train_loss: 0.5985, test_loss: 1.1277, test_f1: 0.5638
 epoch: 73, train_loss: 0.5864, test_loss: 1.1043, test_f1: 0.5695
 epoch: 74, train_loss: 0.5618, test_loss: 1.1585, test_f1: 0.5692
 epoch: 75, train_loss: 0.5918, test_loss: 1.2116, test_f1: 0.5352
 epoch: 76, train_loss: 0.5865, test_loss: 1.0973, test_f1: 0.5917
 epoch: 77, train_loss: 0.6020, test_loss: 1.1283, test_f1: 0.5500
 epoch: 78, train_loss: 0.5844, test_loss: 1.1325, test_f1: 0.5520
 epoch: 79, train_loss: 0.5832, test_loss: 1.3426, test_f1: 0.5236
 epoch: 80, train_loss: 0.5928, test_loss: 1.1568, test_f1: 0.5816
 epoch: 81, train_loss: 0.5738, test_loss: 1.1309, test_f1: 0.5823
 epoch: 82, train_loss: 0.5850, test_loss: 1.1187, test_f1: 0.5732
 epoch: 83, train_loss: 0.5736, test_loss: 1.2836, test_f1: 0.5502
 epoch: 84, train_loss: 0.5649, test_loss: 1.3650, test_f1: 0.5523
 epoch: 85, train_loss: 0.5902, test_loss: 1.2322, test_f1: 0.5263
 epoch: 86, train_loss: 0.5689, test_loss: 1.3762, test_f1: 0.5578
 epoch: 87, train_loss: 0.5577, test_loss: 1.4266, test_f1: 0.5417
 epoch: 88, train_loss: 0.5518, test_loss: 1.1763, test_f1: 0.5670
 epoch: 89, train_loss: 0.5437, test_loss: 1.3105, test_f1: 0.5426
 epoch: 90, train_loss: 0.5501, test_loss: 1.1357, test_f1: 0.5640
 epoch: 91, train_loss: 0.5372, test_loss: 1.1221, test_f1: 0.5755
 epoch: 92, train_loss: 0.5554, test_loss: 1.2242, test_f1: 0.5389
 epoch: 93, train_loss: 0.5375, test_loss: 1.3396, test_f1: 0.5468
 epoch: 94, train_loss: 0.5523, test_loss: 1.2493, test_f1: 0.5554
 epoch: 95, train_loss: 0.5313, test_loss: 1.3360, test_f1: 0.5363
 epoch: 96, train_loss: 0.5415, test_loss: 1.4197, test_f1: 0.5607
 epoch: 97, train_loss: 0.5551, test_loss: 1.2416, test_f1: 0.5521
 epoch: 98, train_loss: 0.5505, test_loss: 1.2411, test_f1: 0.5491
 epoch: 99, train_loss: 0.5508, test_loss: 1.5180, test_f1: 0.5420
##################ITERATION #9 ****************************************
 epoch: 0, train_loss: 1.3760, test_loss: 1.3482, test_f1: 0.2274
 epoch: 1, train_loss: 1.2474, test_loss: 1.2169, test_f1: 0.3585
 epoch: 2, train_loss: 1.1938, test_loss: 1.1803, test_f1: 0.3884
 epoch: 3, train_loss: 1.1429, test_loss: 1.1618, test_f1: 0.4257
 epoch: 4, train_loss: 1.0994, test_loss: 1.0645, test_f1: 0.4177
 epoch: 5, train_loss: 1.0577, test_loss: 1.0017, test_f1: 0.4645
 epoch: 6, train_loss: 1.0365, test_loss: 1.0469, test_f1: 0.4615
 epoch: 7, train_loss: 1.0186, test_loss: 0.9729, test_f1: 0.4599
 epoch: 8, train_loss: 1.0107, test_loss: 0.9456, test_f1: 0.4785
 epoch: 9, train_loss: 0.9911, test_loss: 0.9591, test_f1: 0.4645
 epoch: 10, train_loss: 0.9723, test_loss: 0.9542, test_f1: 0.4688
 epoch: 11, train_loss: 0.9469, test_loss: 0.9341, test_f1: 0.4593
 epoch: 12, train_loss: 0.9196, test_loss: 0.9797, test_f1: 0.5001
 epoch: 13, train_loss: 0.9322, test_loss: 0.9633, test_f1: 0.4562
 epoch: 14, train_loss: 0.9271, test_loss: 1.0032, test_f1: 0.4790
 epoch: 15, train_loss: 0.9132, test_loss: 0.9701, test_f1: 0.4822
 epoch: 16, train_loss: 0.8958, test_loss: 0.9815, test_f1: 0.5084
 epoch: 17, train_loss: 0.8697, test_loss: 0.9533, test_f1: 0.5060
 epoch: 18, train_loss: 0.8836, test_loss: 0.9859, test_f1: 0.4995
 epoch: 19, train_loss: 0.8703, test_loss: 0.9796, test_f1: 0.4769
 epoch: 20, train_loss: 0.8767, test_loss: 0.8946, test_f1: 0.5073
 epoch: 21, train_loss: 0.8592, test_loss: 0.9952, test_f1: 0.5221
 epoch: 22, train_loss: 0.8434, test_loss: 1.0245, test_f1: 0.4949
 epoch: 23, train_loss: 0.8672, test_loss: 1.1142, test_f1: 0.4766
 epoch: 24, train_loss: 0.8390, test_loss: 1.0928, test_f1: 0.4776
 epoch: 25, train_loss: 0.8261, test_loss: 1.1614, test_f1: 0.4888
 epoch: 26, train_loss: 0.8292, test_loss: 0.9968, test_f1: 0.5302
 epoch: 27, train_loss: 0.8411, test_loss: 0.9725, test_f1: 0.5028
 epoch: 28, train_loss: 0.8144, test_loss: 1.0661, test_f1: 0.5222
 epoch: 29, train_loss: 0.8079, test_loss: 1.0267, test_f1: 0.5201
 epoch: 30, train_loss: 0.7863, test_loss: 1.0423, test_f1: 0.4918
 epoch: 31, train_loss: 0.7949, test_loss: 1.0663, test_f1: 0.5190
 epoch: 32, train_loss: 0.7970, test_loss: 1.0618, test_f1: 0.5067
 epoch: 33, train_loss: 0.7961, test_loss: 1.0218, test_f1: 0.5179
 epoch: 34, train_loss: 0.7790, test_loss: 1.0210, test_f1: 0.5252
 epoch: 35, train_loss: 0.8114, test_loss: 1.0959, test_f1: 0.5212
 epoch: 36, train_loss: 0.8072, test_loss: 1.0839, test_f1: 0.4832
 epoch: 37, train_loss: 0.7770, test_loss: 1.0221, test_f1: 0.5216
 epoch: 38, train_loss: 0.7551, test_loss: 1.0019, test_f1: 0.5439
 epoch: 39, train_loss: 0.7716, test_loss: 1.0511, test_f1: 0.5380
 epoch: 40, train_loss: 0.7707, test_loss: 1.0401, test_f1: 0.5195
 epoch: 41, train_loss: 0.7429, test_loss: 1.0954, test_f1: 0.5443
 epoch: 42, train_loss: 0.7391, test_loss: 1.0403, test_f1: 0.5445
 epoch: 43, train_loss: 0.7506, test_loss: 0.9986, test_f1: 0.5296
 epoch: 44, train_loss: 0.7338, test_loss: 1.0559, test_f1: 0.5718
 epoch: 45, train_loss: 0.7325, test_loss: 1.1903, test_f1: 0.4975
 epoch: 46, train_loss: 0.7394, test_loss: 1.1017, test_f1: 0.5034
 epoch: 47, train_loss: 0.7302, test_loss: 1.0715, test_f1: 0.5297
 epoch: 48, train_loss: 0.7150, test_loss: 1.1373, test_f1: 0.5473
 epoch: 49, train_loss: 0.7143, test_loss: 1.1793, test_f1: 0.5537
 epoch: 50, train_loss: 0.7268, test_loss: 1.1158, test_f1: 0.5445
 epoch: 51, train_loss: 0.7025, test_loss: 1.0269, test_f1: 0.5524
 epoch: 52, train_loss: 0.6699, test_loss: 1.0697, test_f1: 0.5739
 epoch: 53, train_loss: 0.6763, test_loss: 1.0651, test_f1: 0.5634
 epoch: 54, train_loss: 0.6691, test_loss: 1.0811, test_f1: 0.5733
 epoch: 55, train_loss: 0.6599, test_loss: 1.2036, test_f1: 0.5325
 epoch: 56, train_loss: 0.6577, test_loss: 1.1145, test_f1: 0.5539
 epoch: 57, train_loss: 0.6526, test_loss: 1.0674, test_f1: 0.5572
 epoch: 58, train_loss: 0.6546, test_loss: 1.1359, test_f1: 0.5485
 epoch: 59, train_loss: 0.6241, test_loss: 1.1732, test_f1: 0.5570
 epoch: 60, train_loss: 0.6432, test_loss: 1.1539, test_f1: 0.5328
 epoch: 61, train_loss: 0.6333, test_loss: 1.2097, test_f1: 0.5499
 epoch: 62, train_loss: 0.6043, test_loss: 1.1038, test_f1: 0.5521
 epoch: 63, train_loss: 0.6105, test_loss: 1.4636, test_f1: 0.5205
 epoch: 64, train_loss: 0.6106, test_loss: 1.3727, test_f1: 0.5457
 epoch: 65, train_loss: 0.6244, test_loss: 1.1570, test_f1: 0.5374
 epoch: 66, train_loss: 0.6122, test_loss: 1.2854, test_f1: 0.5310
 epoch: 67, train_loss: 0.6019, test_loss: 1.4060, test_f1: 0.5302
 epoch: 68, train_loss: 0.6202, test_loss: 1.2510, test_f1: 0.5355
 epoch: 69, train_loss: 0.6059, test_loss: 1.1935, test_f1: 0.5554
 epoch: 70, train_loss: 0.6020, test_loss: 1.1467, test_f1: 0.5502
 epoch: 71, train_loss: 0.6069, test_loss: 1.2944, test_f1: 0.5549
 epoch: 72, train_loss: 0.5857, test_loss: 1.2114, test_f1: 0.5372
 epoch: 73, train_loss: 0.5948, test_loss: 1.1538, test_f1: 0.5865
 epoch: 74, train_loss: 0.5867, test_loss: 1.2192, test_f1: 0.5410
 epoch: 75, train_loss: 0.5673, test_loss: 1.2195, test_f1: 0.5716
 epoch: 76, train_loss: 0.5791, test_loss: 1.2518, test_f1: 0.5428
 epoch: 77, train_loss: 0.5849, test_loss: 1.1774, test_f1: 0.5368
 epoch: 78, train_loss: 0.5794, test_loss: 1.3908, test_f1: 0.5591
 epoch: 79, train_loss: 0.5747, test_loss: 1.2994, test_f1: 0.5481
 epoch: 80, train_loss: 0.5816, test_loss: 1.3954, test_f1: 0.5362
 epoch: 81, train_loss: 0.5655, test_loss: 1.3231, test_f1: 0.5306
 epoch: 82, train_loss: 0.5734, test_loss: 1.2056, test_f1: 0.5733
 epoch: 83, train_loss: 0.5529, test_loss: 1.2593, test_f1: 0.5721
 epoch: 84, train_loss: 0.5435, test_loss: 1.2032, test_f1: 0.5617
 epoch: 85, train_loss: 0.5425, test_loss: 1.3694, test_f1: 0.5447
 epoch: 86, train_loss: 0.5384, test_loss: 1.2817, test_f1: 0.5592
 epoch: 87, train_loss: 0.5399, test_loss: 1.1611, test_f1: 0.5608
 epoch: 88, train_loss: 0.5631, test_loss: 1.3966, test_f1: 0.5136
 epoch: 89, train_loss: 0.5921, test_loss: 1.2428, test_f1: 0.5423
 epoch: 90, train_loss: 0.5739, test_loss: 1.3731, test_f1: 0.5184
 epoch: 91, train_loss: 0.5464, test_loss: 1.2327, test_f1: 0.5345
 epoch: 92, train_loss: 0.5573, test_loss: 1.2524, test_f1: 0.5715
 epoch: 93, train_loss: 0.5405, test_loss: 1.2861, test_f1: 0.5706
 epoch: 94, train_loss: 0.5329, test_loss: 1.7835, test_f1: 0.5633
 epoch: 95, train_loss: 0.5331, test_loss: 1.3861, test_f1: 0.5406
 epoch: 96, train_loss: 0.5350, test_loss: 1.3257, test_f1: 0.5112
 epoch: 97, train_loss: 0.5240, test_loss: 1.4043, test_f1: 0.5417
 epoch: 98, train_loss: 0.5397, test_loss: 1.3922, test_f1: 0.5672
 epoch: 99, train_loss: 0.5223, test_loss: 1.2840, test_f1: 0.5337

Training completed in 373.44 seconds
Best F1: 0.5999 at epoch 92
Mean F1 across iterations: 0.5857  0.0102
========================FINAL RESULTS================================
FEGIN weighted F1: 0.5999  0.0102
python main.py --data ltspice_examples --representation component_component --model FEGIN --layers 3 --hiddens 32 --batch_size 256 --lr 0.01 --emb_size 250 --epochs 100 --save_appendix component_component_L3_H32_BS256_LR0.01_E250 --no_val
-----



STDERR:
  File "main.py", line 370, in <module>
    main()
  File "main.py", line 254, in main
    dataset = dataset_class(
  File "/home/philip/projects/ltspice_examples_code_repo/Circuit-Completion-Using-GNNs/component_classification_with_link_prediction_head/evaluation/FEGIN/kernel/circuit_datasets.py", line 15, in __init__
    self.data, self.slices = torch.load(self.processed_paths[0])
  File "/home/philip/.local/lib/python3.8/site-packages/torch/serialization.py", line 1040, in load
    warnings.warn(
  File "/usr/lib/python3.8/warnings.py", line 109, in _showwarnmsg
    sw(msg.message, msg.category, msg.filename, msg.lineno,
  File "main.py", line 47, in warn_with_traceback
    traceback.print_stack(file=log)
/home/philip/projects/ltspice_examples_code_repo/Circuit-Completion-Using-GNNs/component_classification_with_link_prediction_head/evaluation/FEGIN/kernel/circuit_datasets.py:15: FutureWarning: You are using `torch.load` with `weights_only=False` (the current default value), which uses the default pickle module implicitly. It is possible to construct malicious pickle data which will execute arbitrary code during unpickling (See https://github.com/pytorch/pytorch/blob/main/SECURITY.md#untrusted-models for more details). In a future release, the default value for `weights_only` will be flipped to `True`. This limits the functions that could be executed during unpickling. Arbitrary objects will no longer be allowed to be loaded via this mode unless they are explicitly allowlisted by the user via `torch.serialization.add_safe_globals`. We recommend you start setting `weights_only=True` for any use case where you don't have full control of the loaded file. Please open an issue on GitHub for any issues related to this experimental feature.
  self.data, self.slices = torch.load(self.processed_paths[0])
