STDOUT:
Results will be saved in /home/philip/projects/ltspice_examples_code_repo/Circuit-Completion-Using-GNNs/component_classification_with_link_prediction_head/evaluation/FEGIN/results/model_FEGIN_dataset_ltspice_examples
Command line input: python main.py --data ltspice_examples --representation component_pin --model FEGIN --layers 2 --hiddens 128 --batch_size 128 --lr 0.001 --emb_size 250 --epochs 100 --save_appendix component_pin_L2_H128_BS128_LR0.001_E250 --no_val
 is saved.
-----
ltspice_examples - FEGIN
Using 2 layers, 128 hidden units, h = 2
Loading component_pin representation dataset
ENTERED
Training FEGIN on component_pin representation
Train: 3560, Test: 848
##################ITERATION #0 ****************************************
 epoch: 0, train_loss: 1.2110, test_loss: 1.2526, test_f1: 0.2260
 epoch: 1, train_loss: 1.0317, test_loss: 1.0476, test_f1: 0.3500
 epoch: 2, train_loss: 0.9793, test_loss: 1.0216, test_f1: 0.4383
 epoch: 3, train_loss: 0.9338, test_loss: 0.9758, test_f1: 0.5030
 epoch: 4, train_loss: 0.8977, test_loss: 0.9285, test_f1: 0.5454
 epoch: 5, train_loss: 0.8465, test_loss: 0.9581, test_f1: 0.5132
 epoch: 6, train_loss: 0.8133, test_loss: 0.9082, test_f1: 0.5627
 epoch: 7, train_loss: 0.8013, test_loss: 0.9103, test_f1: 0.5201
 epoch: 8, train_loss: 0.7831, test_loss: 0.8815, test_f1: 0.5283
 epoch: 9, train_loss: 0.7568, test_loss: 0.9815, test_f1: 0.5118
 epoch: 10, train_loss: 0.7251, test_loss: 0.8819, test_f1: 0.5745
 epoch: 11, train_loss: 0.7074, test_loss: 0.8656, test_f1: 0.5793
 epoch: 12, train_loss: 0.6961, test_loss: 0.9562, test_f1: 0.5613
 epoch: 13, train_loss: 0.6869, test_loss: 0.9551, test_f1: 0.5622
 epoch: 14, train_loss: 0.6911, test_loss: 0.9178, test_f1: 0.5713
 epoch: 15, train_loss: 0.6542, test_loss: 0.9895, test_f1: 0.6172
 epoch: 16, train_loss: 0.6564, test_loss: 0.8513, test_f1: 0.5963
 epoch: 17, train_loss: 0.6399, test_loss: 0.8979, test_f1: 0.6050
 epoch: 18, train_loss: 0.6266, test_loss: 0.8662, test_f1: 0.5993
 epoch: 19, train_loss: 0.6146, test_loss: 0.8978, test_f1: 0.6284
 epoch: 20, train_loss: 0.5991, test_loss: 0.9662, test_f1: 0.6199
 epoch: 21, train_loss: 0.5756, test_loss: 0.9781, test_f1: 0.5732
 epoch: 22, train_loss: 0.5739, test_loss: 1.1198, test_f1: 0.6030
 epoch: 23, train_loss: 0.5809, test_loss: 0.9754, test_f1: 0.6340
 epoch: 24, train_loss: 0.5629, test_loss: 1.1135, test_f1: 0.5976
 epoch: 25, train_loss: 0.5484, test_loss: 0.9051, test_f1: 0.6215
 epoch: 26, train_loss: 0.5173, test_loss: 1.0257, test_f1: 0.6545
 epoch: 27, train_loss: 0.5080, test_loss: 0.9570, test_f1: 0.6445
 epoch: 28, train_loss: 0.5191, test_loss: 1.1136, test_f1: 0.6094
 epoch: 29, train_loss: 0.5045, test_loss: 1.0014, test_f1: 0.6067
 epoch: 30, train_loss: 0.4902, test_loss: 1.0780, test_f1: 0.6549
 epoch: 31, train_loss: 0.4910, test_loss: 1.0804, test_f1: 0.6361
 epoch: 32, train_loss: 0.4698, test_loss: 1.2792, test_f1: 0.5751
 epoch: 33, train_loss: 0.4604, test_loss: 1.1453, test_f1: 0.6261
 epoch: 34, train_loss: 0.4711, test_loss: 1.2866, test_f1: 0.5494
 epoch: 35, train_loss: 0.4540, test_loss: 0.9268, test_f1: 0.6296
 epoch: 36, train_loss: 0.4310, test_loss: 1.1157, test_f1: 0.6359
 epoch: 37, train_loss: 0.4321, test_loss: 1.0499, test_f1: 0.5927
 epoch: 38, train_loss: 0.4097, test_loss: 1.0852, test_f1: 0.6397
 epoch: 39, train_loss: 0.3912, test_loss: 1.3935, test_f1: 0.6388
 epoch: 40, train_loss: 0.3820, test_loss: 1.0694, test_f1: 0.6456
 epoch: 41, train_loss: 0.3908, test_loss: 1.2286, test_f1: 0.5975
 epoch: 42, train_loss: 0.3931, test_loss: 1.2509, test_f1: 0.6428
 epoch: 43, train_loss: 0.3717, test_loss: 1.2080, test_f1: 0.6162
 epoch: 44, train_loss: 0.3683, test_loss: 1.3009, test_f1: 0.6392
 epoch: 45, train_loss: 0.3676, test_loss: 1.2071, test_f1: 0.6056
 epoch: 46, train_loss: 0.3745, test_loss: 1.2918, test_f1: 0.5906
 epoch: 47, train_loss: 0.3428, test_loss: 1.1497, test_f1: 0.6678
 epoch: 48, train_loss: 0.3348, test_loss: 1.4166, test_f1: 0.6096
 epoch: 49, train_loss: 0.3445, test_loss: 1.4272, test_f1: 0.6154
 epoch: 50, train_loss: 0.3346, test_loss: 1.2977, test_f1: 0.6426
 epoch: 51, train_loss: 0.3010, test_loss: 1.5303, test_f1: 0.6502
 epoch: 52, train_loss: 0.2664, test_loss: 1.4259, test_f1: 0.6408
 epoch: 53, train_loss: 0.2503, test_loss: 1.5068, test_f1: 0.6576
 epoch: 54, train_loss: 0.2408, test_loss: 1.6068, test_f1: 0.6552
 epoch: 55, train_loss: 0.2502, test_loss: 1.6048, test_f1: 0.6427
 epoch: 56, train_loss: 0.2403, test_loss: 1.6373, test_f1: 0.6516
 epoch: 57, train_loss: 0.2291, test_loss: 1.5847, test_f1: 0.6663
 epoch: 58, train_loss: 0.2309, test_loss: 1.8117, test_f1: 0.6298
 epoch: 59, train_loss: 0.2292, test_loss: 1.7728, test_f1: 0.6459
 epoch: 60, train_loss: 0.2381, test_loss: 1.7095, test_f1: 0.6390
 epoch: 61, train_loss: 0.2248, test_loss: 1.8358, test_f1: 0.6081
 epoch: 62, train_loss: 0.2163, test_loss: 2.0315, test_f1: 0.6168
 epoch: 63, train_loss: 0.2134, test_loss: 1.7138, test_f1: 0.6523
 epoch: 64, train_loss: 0.2032, test_loss: 2.0847, test_f1: 0.5876
 epoch: 65, train_loss: 0.2019, test_loss: 1.8747, test_f1: 0.6711
 epoch: 66, train_loss: 0.1962, test_loss: 2.0250, test_f1: 0.6155
 epoch: 67, train_loss: 0.1865, test_loss: 1.9673, test_f1: 0.6395
 epoch: 68, train_loss: 0.2054, test_loss: 1.9509, test_f1: 0.6332
 epoch: 69, train_loss: 0.1945, test_loss: 1.9668, test_f1: 0.6376
 epoch: 70, train_loss: 0.1866, test_loss: 1.8825, test_f1: 0.6410
 epoch: 71, train_loss: 0.2010, test_loss: 1.9449, test_f1: 0.6399
 epoch: 72, train_loss: 0.1875, test_loss: 1.6957, test_f1: 0.6484
 epoch: 73, train_loss: 0.2081, test_loss: 1.9190, test_f1: 0.6339
 epoch: 74, train_loss: 0.1948, test_loss: 2.1122, test_f1: 0.6170
 epoch: 75, train_loss: 0.1616, test_loss: 1.9722, test_f1: 0.6627
 epoch: 76, train_loss: 0.1615, test_loss: 1.9520, test_f1: 0.6466
 epoch: 77, train_loss: 0.1670, test_loss: 1.9343, test_f1: 0.6470
 epoch: 78, train_loss: 0.1621, test_loss: 2.2077, test_f1: 0.6341
 epoch: 79, train_loss: 0.1593, test_loss: 2.0698, test_f1: 0.6284
 epoch: 80, train_loss: 0.1518, test_loss: 2.1516, test_f1: 0.6255
 epoch: 81, train_loss: 0.1566, test_loss: 2.0795, test_f1: 0.6452
 epoch: 82, train_loss: 0.1507, test_loss: 2.2326, test_f1: 0.6276
 epoch: 83, train_loss: 0.1589, test_loss: 2.1989, test_f1: 0.6246
 epoch: 84, train_loss: 0.1518, test_loss: 2.2187, test_f1: 0.6341
 epoch: 85, train_loss: 0.1464, test_loss: 2.2402, test_f1: 0.6213
 epoch: 86, train_loss: 0.1743, test_loss: 2.1641, test_f1: 0.6550
 epoch: 87, train_loss: 0.1640, test_loss: 2.2551, test_f1: 0.6305
 epoch: 88, train_loss: 0.1541, test_loss: 2.3377, test_f1: 0.6394
 epoch: 89, train_loss: 0.1795, test_loss: 2.2069, test_f1: 0.5955
 epoch: 90, train_loss: 0.1420, test_loss: 2.2799, test_f1: 0.6571
 epoch: 91, train_loss: 0.1442, test_loss: 2.1398, test_f1: 0.6239
 epoch: 92, train_loss: 0.1399, test_loss: 2.3297, test_f1: 0.6188
 epoch: 93, train_loss: 0.1225, test_loss: 2.4038, test_f1: 0.6389
 epoch: 94, train_loss: 0.1322, test_loss: 2.2515, test_f1: 0.6408
 epoch: 95, train_loss: 0.1387, test_loss: 2.4916, test_f1: 0.6267
 epoch: 96, train_loss: 0.1337, test_loss: 2.3109, test_f1: 0.6407
 epoch: 97, train_loss: 0.1310, test_loss: 2.3780, test_f1: 0.6227
 epoch: 98, train_loss: 0.1308, test_loss: 2.3847, test_f1: 0.6232
 epoch: 99, train_loss: 0.1216, test_loss: 2.5855, test_f1: 0.6473
##################ITERATION #1 ****************************************
 epoch: 0, train_loss: 1.1135, test_loss: 1.1418, test_f1: 0.3906
 epoch: 1, train_loss: 0.9556, test_loss: 1.0701, test_f1: 0.3903
 epoch: 2, train_loss: 0.9031, test_loss: 0.9725, test_f1: 0.4903
 epoch: 3, train_loss: 0.8670, test_loss: 0.9010, test_f1: 0.5187
 epoch: 4, train_loss: 0.8318, test_loss: 0.8854, test_f1: 0.5752
 epoch: 5, train_loss: 0.7971, test_loss: 0.8284, test_f1: 0.5978
 epoch: 6, train_loss: 0.7905, test_loss: 0.8438, test_f1: 0.6259
 epoch: 7, train_loss: 0.7708, test_loss: 0.8804, test_f1: 0.5814
 epoch: 8, train_loss: 0.7361, test_loss: 0.9751, test_f1: 0.5439
 epoch: 9, train_loss: 0.7355, test_loss: 1.0593, test_f1: 0.4580
 epoch: 10, train_loss: 0.7246, test_loss: 0.8684, test_f1: 0.6197
 epoch: 11, train_loss: 0.6800, test_loss: 0.8456, test_f1: 0.6005
 epoch: 12, train_loss: 0.6585, test_loss: 0.8533, test_f1: 0.6444
 epoch: 13, train_loss: 0.6714, test_loss: 0.8836, test_f1: 0.6161
 epoch: 14, train_loss: 0.6643, test_loss: 0.9950, test_f1: 0.5252
 epoch: 15, train_loss: 0.6473, test_loss: 0.9230, test_f1: 0.6021
 epoch: 16, train_loss: 0.6354, test_loss: 0.9116, test_f1: 0.6373
 epoch: 17, train_loss: 0.6171, test_loss: 0.9627, test_f1: 0.5952
 epoch: 18, train_loss: 0.6016, test_loss: 1.0004, test_f1: 0.5771
 epoch: 19, train_loss: 0.5867, test_loss: 0.9283, test_f1: 0.6149
 epoch: 20, train_loss: 0.5820, test_loss: 0.9192, test_f1: 0.6418
 epoch: 21, train_loss: 0.5579, test_loss: 0.8906, test_f1: 0.6695
 epoch: 22, train_loss: 0.5602, test_loss: 1.0504, test_f1: 0.6131
 epoch: 23, train_loss: 0.5528, test_loss: 0.9719, test_f1: 0.6062
 epoch: 24, train_loss: 0.5387, test_loss: 0.8837, test_f1: 0.6691
 epoch: 25, train_loss: 0.5333, test_loss: 0.8759, test_f1: 0.6302
 epoch: 26, train_loss: 0.5114, test_loss: 1.2244, test_f1: 0.5791
 epoch: 27, train_loss: 0.5175, test_loss: 0.9640, test_f1: 0.6536
 epoch: 28, train_loss: 0.4981, test_loss: 0.9404, test_f1: 0.6518
 epoch: 29, train_loss: 0.4883, test_loss: 1.2452, test_f1: 0.5923
 epoch: 30, train_loss: 0.4745, test_loss: 1.0189, test_f1: 0.6463
 epoch: 31, train_loss: 0.4869, test_loss: 1.0595, test_f1: 0.6320
 epoch: 32, train_loss: 0.4574, test_loss: 1.0168, test_f1: 0.6637
 epoch: 33, train_loss: 0.4509, test_loss: 1.0605, test_f1: 0.6607
 epoch: 34, train_loss: 0.4483, test_loss: 1.1006, test_f1: 0.6339
 epoch: 35, train_loss: 0.4396, test_loss: 1.0933, test_f1: 0.6398
 epoch: 36, train_loss: 0.4352, test_loss: 1.3066, test_f1: 0.6085
 epoch: 37, train_loss: 0.4188, test_loss: 1.1186, test_f1: 0.6319
 epoch: 38, train_loss: 0.4150, test_loss: 1.1038, test_f1: 0.6465
 epoch: 39, train_loss: 0.3918, test_loss: 1.2820, test_f1: 0.6436
 epoch: 40, train_loss: 0.4102, test_loss: 1.2261, test_f1: 0.6054
 epoch: 41, train_loss: 0.3766, test_loss: 1.2088, test_f1: 0.6430
 epoch: 42, train_loss: 0.3755, test_loss: 1.1224, test_f1: 0.6368
 epoch: 43, train_loss: 0.3904, test_loss: 1.2274, test_f1: 0.6321
 epoch: 44, train_loss: 0.3961, test_loss: 1.3111, test_f1: 0.6331
 epoch: 45, train_loss: 0.3765, test_loss: 1.1975, test_f1: 0.6427
 epoch: 46, train_loss: 0.3449, test_loss: 1.3906, test_f1: 0.6237
 epoch: 47, train_loss: 0.3439, test_loss: 1.2282, test_f1: 0.6705
 epoch: 48, train_loss: 0.3649, test_loss: 1.2348, test_f1: 0.6506
 epoch: 49, train_loss: 0.3274, test_loss: 1.2592, test_f1: 0.6567
 epoch: 50, train_loss: 0.3258, test_loss: 1.3097, test_f1: 0.6798
 epoch: 51, train_loss: 0.2941, test_loss: 1.2552, test_f1: 0.6632
 epoch: 52, train_loss: 0.2540, test_loss: 1.2536, test_f1: 0.6860
 epoch: 53, train_loss: 0.2572, test_loss: 1.3589, test_f1: 0.6679
 epoch: 54, train_loss: 0.2603, test_loss: 1.4043, test_f1: 0.6849
 epoch: 55, train_loss: 0.2453, test_loss: 1.4306, test_f1: 0.6707
 epoch: 56, train_loss: 0.2569, test_loss: 1.3579, test_f1: 0.6705
 epoch: 57, train_loss: 0.2305, test_loss: 1.5030, test_f1: 0.6882
 epoch: 58, train_loss: 0.2478, test_loss: 1.3539, test_f1: 0.6557
 epoch: 59, train_loss: 0.2456, test_loss: 1.3552, test_f1: 0.6792
 epoch: 60, train_loss: 0.2167, test_loss: 1.2622, test_f1: 0.7123
 epoch: 61, train_loss: 0.2357, test_loss: 1.3976, test_f1: 0.6760
 epoch: 62, train_loss: 0.2169, test_loss: 1.5643, test_f1: 0.6589
 epoch: 63, train_loss: 0.1995, test_loss: 1.5261, test_f1: 0.6658
 epoch: 64, train_loss: 0.2025, test_loss: 1.8483, test_f1: 0.6374
 epoch: 65, train_loss: 0.2193, test_loss: 1.5559, test_f1: 0.6539
 epoch: 66, train_loss: 0.2072, test_loss: 1.5935, test_f1: 0.6779
 epoch: 67, train_loss: 0.1917, test_loss: 1.5976, test_f1: 0.6641
 epoch: 68, train_loss: 0.2083, test_loss: 1.5995, test_f1: 0.6757
 epoch: 69, train_loss: 0.1881, test_loss: 1.5518, test_f1: 0.6761
 epoch: 70, train_loss: 0.2175, test_loss: 1.7316, test_f1: 0.6581
 epoch: 71, train_loss: 0.2077, test_loss: 1.6833, test_f1: 0.6787
 epoch: 72, train_loss: 0.1974, test_loss: 1.7815, test_f1: 0.6660
 epoch: 73, train_loss: 0.1853, test_loss: 1.6884, test_f1: 0.6683
 epoch: 74, train_loss: 0.1883, test_loss: 1.5959, test_f1: 0.6779
 epoch: 75, train_loss: 0.1818, test_loss: 1.6870, test_f1: 0.6779
 epoch: 76, train_loss: 0.1746, test_loss: 1.7821, test_f1: 0.6703
 epoch: 77, train_loss: 0.1718, test_loss: 1.6864, test_f1: 0.6897
 epoch: 78, train_loss: 0.1833, test_loss: 1.7449, test_f1: 0.6987
 epoch: 79, train_loss: 0.1795, test_loss: 1.7749, test_f1: 0.6858
 epoch: 80, train_loss: 0.1771, test_loss: 1.7929, test_f1: 0.6530
 epoch: 81, train_loss: 0.1726, test_loss: 1.6618, test_f1: 0.6643
 epoch: 82, train_loss: 0.1917, test_loss: 1.7304, test_f1: 0.6922
 epoch: 83, train_loss: 0.1694, test_loss: 1.7350, test_f1: 0.6700
 epoch: 84, train_loss: 0.1633, test_loss: 1.7296, test_f1: 0.7136
 epoch: 85, train_loss: 0.1676, test_loss: 1.8304, test_f1: 0.6771
 epoch: 86, train_loss: 0.1566, test_loss: 1.9699, test_f1: 0.6808
 epoch: 87, train_loss: 0.1641, test_loss: 1.8006, test_f1: 0.6888
 epoch: 88, train_loss: 0.1716, test_loss: 1.7986, test_f1: 0.6855
 epoch: 89, train_loss: 0.1618, test_loss: 1.7665, test_f1: 0.7043
 epoch: 90, train_loss: 0.1592, test_loss: 2.0093, test_f1: 0.6782
 epoch: 91, train_loss: 0.1490, test_loss: 1.9236, test_f1: 0.6885
 epoch: 92, train_loss: 0.1394, test_loss: 1.9473, test_f1: 0.6898
 epoch: 93, train_loss: 0.1446, test_loss: 2.0915, test_f1: 0.6706
 epoch: 94, train_loss: 0.1370, test_loss: 2.0539, test_f1: 0.6711
 epoch: 95, train_loss: 0.1408, test_loss: 1.8256, test_f1: 0.6759
 epoch: 96, train_loss: 0.1512, test_loss: 1.9488, test_f1: 0.6732
 epoch: 97, train_loss: 0.1430, test_loss: 2.1097, test_f1: 0.6799
 epoch: 98, train_loss: 0.1477, test_loss: 2.0500, test_f1: 0.6770
 epoch: 99, train_loss: 0.1390, test_loss: 1.8432, test_f1: 0.6908
##################ITERATION #2 ****************************************
 epoch: 0, train_loss: 1.1297, test_loss: 1.2224, test_f1: 0.2286
 epoch: 1, train_loss: 0.9534, test_loss: 0.9885, test_f1: 0.4727
 epoch: 2, train_loss: 0.8838, test_loss: 0.8854, test_f1: 0.5547
 epoch: 3, train_loss: 0.8508, test_loss: 0.9082, test_f1: 0.5725
 epoch: 4, train_loss: 0.8225, test_loss: 0.9381, test_f1: 0.5672
 epoch: 5, train_loss: 0.7933, test_loss: 0.8736, test_f1: 0.5901
 epoch: 6, train_loss: 0.7765, test_loss: 0.8965, test_f1: 0.5913
 epoch: 7, train_loss: 0.7499, test_loss: 0.9751, test_f1: 0.5827
 epoch: 8, train_loss: 0.7421, test_loss: 0.8427, test_f1: 0.6081
 epoch: 9, train_loss: 0.7015, test_loss: 0.8458, test_f1: 0.6215
 epoch: 10, train_loss: 0.6881, test_loss: 0.8480, test_f1: 0.5280
 epoch: 11, train_loss: 0.6716, test_loss: 0.7818, test_f1: 0.6389
 epoch: 12, train_loss: 0.6759, test_loss: 0.7864, test_f1: 0.6286
 epoch: 13, train_loss: 0.6400, test_loss: 0.7584, test_f1: 0.6183
 epoch: 14, train_loss: 0.6238, test_loss: 0.8331, test_f1: 0.6514
 epoch: 15, train_loss: 0.6304, test_loss: 0.7743, test_f1: 0.6536
 epoch: 16, train_loss: 0.6025, test_loss: 0.7513, test_f1: 0.6599
 epoch: 17, train_loss: 0.6052, test_loss: 0.8532, test_f1: 0.6202
 epoch: 18, train_loss: 0.5946, test_loss: 0.7892, test_f1: 0.6523
 epoch: 19, train_loss: 0.5663, test_loss: 0.7774, test_f1: 0.6579
 epoch: 20, train_loss: 0.5517, test_loss: 0.7444, test_f1: 0.6694
 epoch: 21, train_loss: 0.5438, test_loss: 0.8396, test_f1: 0.6226
 epoch: 22, train_loss: 0.5367, test_loss: 0.8244, test_f1: 0.6453
 epoch: 23, train_loss: 0.5316, test_loss: 0.7467, test_f1: 0.6748
 epoch: 24, train_loss: 0.5192, test_loss: 0.7954, test_f1: 0.6693
 epoch: 25, train_loss: 0.4997, test_loss: 0.9700, test_f1: 0.6444
 epoch: 26, train_loss: 0.5023, test_loss: 0.9528, test_f1: 0.6291
 epoch: 27, train_loss: 0.4860, test_loss: 0.8225, test_f1: 0.6884
 epoch: 28, train_loss: 0.4755, test_loss: 0.8424, test_f1: 0.6673
 epoch: 29, train_loss: 0.4566, test_loss: 0.7273, test_f1: 0.6967
 epoch: 30, train_loss: 0.4316, test_loss: 0.8408, test_f1: 0.6609
 epoch: 31, train_loss: 0.4387, test_loss: 0.8420, test_f1: 0.6630
 epoch: 32, train_loss: 0.4170, test_loss: 1.3048, test_f1: 0.6341
 epoch: 33, train_loss: 0.4252, test_loss: 0.9499, test_f1: 0.6758
 epoch: 34, train_loss: 0.3921, test_loss: 0.9565, test_f1: 0.6420
 epoch: 35, train_loss: 0.4056, test_loss: 1.0751, test_f1: 0.6453
 epoch: 36, train_loss: 0.3952, test_loss: 0.8382, test_f1: 0.6701
 epoch: 37, train_loss: 0.3769, test_loss: 1.0111, test_f1: 0.6266
 epoch: 38, train_loss: 0.3899, test_loss: 0.9216, test_f1: 0.6848
 epoch: 39, train_loss: 0.3764, test_loss: 1.0521, test_f1: 0.6783
 epoch: 40, train_loss: 0.3606, test_loss: 0.8951, test_f1: 0.6989
 epoch: 41, train_loss: 0.3366, test_loss: 1.0430, test_f1: 0.6992
 epoch: 42, train_loss: 0.3621, test_loss: 0.9919, test_f1: 0.6496
 epoch: 43, train_loss: 0.3440, test_loss: 1.0734, test_f1: 0.6871
 epoch: 44, train_loss: 0.3542, test_loss: 1.0471, test_f1: 0.6193
 epoch: 45, train_loss: 0.3180, test_loss: 1.0535, test_f1: 0.6774
 epoch: 46, train_loss: 0.3333, test_loss: 1.0577, test_f1: 0.6648
 epoch: 47, train_loss: 0.3218, test_loss: 0.9664, test_f1: 0.6832
 epoch: 48, train_loss: 0.3091, test_loss: 1.1812, test_f1: 0.6872
 epoch: 49, train_loss: 0.3061, test_loss: 1.0699, test_f1: 0.6513
 epoch: 50, train_loss: 0.3068, test_loss: 1.1181, test_f1: 0.6390
 epoch: 51, train_loss: 0.2536, test_loss: 1.1368, test_f1: 0.7060
 epoch: 52, train_loss: 0.2507, test_loss: 1.0700, test_f1: 0.7052
 epoch: 53, train_loss: 0.2391, test_loss: 1.2963, test_f1: 0.6616
 epoch: 54, train_loss: 0.2268, test_loss: 1.2030, test_f1: 0.6846
 epoch: 55, train_loss: 0.2092, test_loss: 1.1394, test_f1: 0.6795
 epoch: 56, train_loss: 0.1933, test_loss: 1.2293, test_f1: 0.6702
 epoch: 57, train_loss: 0.1919, test_loss: 1.1771, test_f1: 0.7163
 epoch: 58, train_loss: 0.2163, test_loss: 1.2375, test_f1: 0.6915
 epoch: 59, train_loss: 0.2057, test_loss: 1.3299, test_f1: 0.6726
 epoch: 60, train_loss: 0.1967, test_loss: 1.2511, test_f1: 0.6825
 epoch: 61, train_loss: 0.1988, test_loss: 1.3535, test_f1: 0.6868
 epoch: 62, train_loss: 0.1933, test_loss: 1.4463, test_f1: 0.6554
 epoch: 63, train_loss: 0.1828, test_loss: 1.2540, test_f1: 0.7154
 epoch: 64, train_loss: 0.1884, test_loss: 1.2973, test_f1: 0.6817
 epoch: 65, train_loss: 0.1867, test_loss: 1.4118, test_f1: 0.6579
 epoch: 66, train_loss: 0.1857, test_loss: 1.3217, test_f1: 0.6647
 epoch: 67, train_loss: 0.1658, test_loss: 1.4716, test_f1: 0.6654
 epoch: 68, train_loss: 0.1648, test_loss: 1.3259, test_f1: 0.6717
 epoch: 69, train_loss: 0.1697, test_loss: 1.3887, test_f1: 0.6695
 epoch: 70, train_loss: 0.1647, test_loss: 1.3729, test_f1: 0.6740
 epoch: 71, train_loss: 0.1737, test_loss: 1.4365, test_f1: 0.6648
 epoch: 72, train_loss: 0.1644, test_loss: 1.3265, test_f1: 0.6923
 epoch: 73, train_loss: 0.1769, test_loss: 1.5090, test_f1: 0.6821
 epoch: 74, train_loss: 0.1663, test_loss: 1.3886, test_f1: 0.6904
 epoch: 75, train_loss: 0.1475, test_loss: 1.5026, test_f1: 0.6852
 epoch: 76, train_loss: 0.1410, test_loss: 1.4561, test_f1: 0.6563
 epoch: 77, train_loss: 0.1540, test_loss: 1.5451, test_f1: 0.6817
 epoch: 78, train_loss: 0.1708, test_loss: 1.4083, test_f1: 0.6971
 epoch: 79, train_loss: 0.1554, test_loss: 1.5472, test_f1: 0.6480
 epoch: 80, train_loss: 0.1479, test_loss: 1.6286, test_f1: 0.6577
 epoch: 81, train_loss: 0.1548, test_loss: 1.6187, test_f1: 0.6684
 epoch: 82, train_loss: 0.1545, test_loss: 1.3982, test_f1: 0.6785
 epoch: 83, train_loss: 0.1476, test_loss: 1.5173, test_f1: 0.6791
 epoch: 84, train_loss: 0.1425, test_loss: 1.6137, test_f1: 0.6507
 epoch: 85, train_loss: 0.1592, test_loss: 1.4919, test_f1: 0.6686
 epoch: 86, train_loss: 0.1353, test_loss: 1.6139, test_f1: 0.6634
 epoch: 87, train_loss: 0.1414, test_loss: 1.5710, test_f1: 0.6702
 epoch: 88, train_loss: 0.1263, test_loss: 1.7393, test_f1: 0.6767
 epoch: 89, train_loss: 0.1316, test_loss: 1.5188, test_f1: 0.6718
 epoch: 90, train_loss: 0.1367, test_loss: 1.6109, test_f1: 0.6675
 epoch: 91, train_loss: 0.1162, test_loss: 1.7522, test_f1: 0.6560
 epoch: 92, train_loss: 0.1177, test_loss: 1.7726, test_f1: 0.6733
 epoch: 93, train_loss: 0.1120, test_loss: 1.5947, test_f1: 0.6952
 epoch: 94, train_loss: 0.1310, test_loss: 1.8078, test_f1: 0.6234
 epoch: 95, train_loss: 0.1308, test_loss: 1.6287, test_f1: 0.6398
 epoch: 96, train_loss: 0.1287, test_loss: 1.4909, test_f1: 0.6938
 epoch: 97, train_loss: 0.1265, test_loss: 1.8651, test_f1: 0.6420
 epoch: 98, train_loss: 0.1282, test_loss: 1.8016, test_f1: 0.6552
 epoch: 99, train_loss: 0.1196, test_loss: 1.8381, test_f1: 0.6800
##################ITERATION #3 ****************************************
 epoch: 0, train_loss: 1.2365, test_loss: 1.3215, test_f1: 0.2288
 epoch: 1, train_loss: 1.0147, test_loss: 1.0961, test_f1: 0.4386
 epoch: 2, train_loss: 0.9523, test_loss: 0.9352, test_f1: 0.5095
 epoch: 3, train_loss: 0.9130, test_loss: 0.9277, test_f1: 0.5294
 epoch: 4, train_loss: 0.8785, test_loss: 0.8885, test_f1: 0.5796
 epoch: 5, train_loss: 0.8651, test_loss: 0.9133, test_f1: 0.5382
 epoch: 6, train_loss: 0.8331, test_loss: 0.8406, test_f1: 0.5439
 epoch: 7, train_loss: 0.8107, test_loss: 0.8270, test_f1: 0.5932
 epoch: 8, train_loss: 0.7876, test_loss: 0.8333, test_f1: 0.5640
 epoch: 9, train_loss: 0.7544, test_loss: 0.7672, test_f1: 0.5899
 epoch: 10, train_loss: 0.7488, test_loss: 0.9184, test_f1: 0.5928
 epoch: 11, train_loss: 0.7419, test_loss: 0.8263, test_f1: 0.6361
 epoch: 12, train_loss: 0.7187, test_loss: 0.8676, test_f1: 0.6038
 epoch: 13, train_loss: 0.7084, test_loss: 0.8171, test_f1: 0.6536
 epoch: 14, train_loss: 0.6815, test_loss: 0.9578, test_f1: 0.5828
 epoch: 15, train_loss: 0.6681, test_loss: 0.8345, test_f1: 0.6213
 epoch: 16, train_loss: 0.6714, test_loss: 0.9924, test_f1: 0.5519
 epoch: 17, train_loss: 0.6538, test_loss: 0.9307, test_f1: 0.5940
 epoch: 18, train_loss: 0.6316, test_loss: 0.8470, test_f1: 0.6100
 epoch: 19, train_loss: 0.6381, test_loss: 0.8309, test_f1: 0.6243
 epoch: 20, train_loss: 0.6241, test_loss: 0.7793, test_f1: 0.6323
 epoch: 21, train_loss: 0.5909, test_loss: 0.8969, test_f1: 0.6222
 epoch: 22, train_loss: 0.5797, test_loss: 0.8623, test_f1: 0.6451
 epoch: 23, train_loss: 0.5805, test_loss: 0.8624, test_f1: 0.6334
 epoch: 24, train_loss: 0.5601, test_loss: 1.1142, test_f1: 0.5798
 epoch: 25, train_loss: 0.5675, test_loss: 0.9084, test_f1: 0.6211
 epoch: 26, train_loss: 0.5564, test_loss: 0.8379, test_f1: 0.6206
 epoch: 27, train_loss: 0.5164, test_loss: 0.8664, test_f1: 0.6325
 epoch: 28, train_loss: 0.5239, test_loss: 0.7887, test_f1: 0.6523
 epoch: 29, train_loss: 0.5159, test_loss: 1.0477, test_f1: 0.6101
 epoch: 30, train_loss: 0.5171, test_loss: 0.8382, test_f1: 0.6784
 epoch: 31, train_loss: 0.5006, test_loss: 0.9178, test_f1: 0.6118
 epoch: 32, train_loss: 0.4985, test_loss: 0.8965, test_f1: 0.6355
 epoch: 33, train_loss: 0.4675, test_loss: 0.8498, test_f1: 0.6594
 epoch: 34, train_loss: 0.4739, test_loss: 0.9960, test_f1: 0.6344
 epoch: 35, train_loss: 0.4644, test_loss: 0.8420, test_f1: 0.6638
 epoch: 36, train_loss: 0.4513, test_loss: 1.0474, test_f1: 0.6178
 epoch: 37, train_loss: 0.4465, test_loss: 0.9386, test_f1: 0.6503
 epoch: 38, train_loss: 0.4297, test_loss: 1.0782, test_f1: 0.6023
 epoch: 39, train_loss: 0.4386, test_loss: 0.8901, test_f1: 0.6536
 epoch: 40, train_loss: 0.4160, test_loss: 1.0027, test_f1: 0.6344
 epoch: 41, train_loss: 0.4139, test_loss: 1.0722, test_f1: 0.6272
 epoch: 42, train_loss: 0.4109, test_loss: 0.9499, test_f1: 0.6614
 epoch: 43, train_loss: 0.4120, test_loss: 0.9761, test_f1: 0.6317
 epoch: 44, train_loss: 0.4040, test_loss: 1.0481, test_f1: 0.6220
 epoch: 45, train_loss: 0.3883, test_loss: 1.2156, test_f1: 0.6267
 epoch: 46, train_loss: 0.4021, test_loss: 0.9802, test_f1: 0.6398
 epoch: 47, train_loss: 0.3956, test_loss: 1.1234, test_f1: 0.6535
 epoch: 48, train_loss: 0.3799, test_loss: 1.0756, test_f1: 0.6608
 epoch: 49, train_loss: 0.3766, test_loss: 1.2792, test_f1: 0.6205
 epoch: 50, train_loss: 0.3908, test_loss: 1.2379, test_f1: 0.5965
 epoch: 51, train_loss: 0.3269, test_loss: 1.1330, test_f1: 0.6588
 epoch: 52, train_loss: 0.3077, test_loss: 1.1309, test_f1: 0.6539
 epoch: 53, train_loss: 0.2864, test_loss: 1.0942, test_f1: 0.6548
 epoch: 54, train_loss: 0.2902, test_loss: 1.0293, test_f1: 0.6801
 epoch: 55, train_loss: 0.2749, test_loss: 1.1218, test_f1: 0.6535
 epoch: 56, train_loss: 0.2670, test_loss: 1.2033, test_f1: 0.6578
 epoch: 57, train_loss: 0.2669, test_loss: 1.2445, test_f1: 0.6323
 epoch: 58, train_loss: 0.2740, test_loss: 1.3171, test_f1: 0.6416
 epoch: 59, train_loss: 0.2562, test_loss: 1.2203, test_f1: 0.6720
 epoch: 60, train_loss: 0.2588, test_loss: 1.2428, test_f1: 0.6644
 epoch: 61, train_loss: 0.2650, test_loss: 1.1874, test_f1: 0.6662
 epoch: 62, train_loss: 0.2736, test_loss: 1.3537, test_f1: 0.6594
 epoch: 63, train_loss: 0.2485, test_loss: 1.1334, test_f1: 0.6689
 epoch: 64, train_loss: 0.2440, test_loss: 1.2695, test_f1: 0.6504
 epoch: 65, train_loss: 0.2299, test_loss: 1.1896, test_f1: 0.6630
 epoch: 66, train_loss: 0.2357, test_loss: 1.2750, test_f1: 0.6576
 epoch: 67, train_loss: 0.2232, test_loss: 1.4128, test_f1: 0.6340
 epoch: 68, train_loss: 0.2348, test_loss: 1.3472, test_f1: 0.6721
 epoch: 69, train_loss: 0.2332, test_loss: 1.2907, test_f1: 0.6495
 epoch: 70, train_loss: 0.2216, test_loss: 1.4851, test_f1: 0.6456
 epoch: 71, train_loss: 0.2137, test_loss: 1.2044, test_f1: 0.6877
 epoch: 72, train_loss: 0.2103, test_loss: 1.2841, test_f1: 0.6533
 epoch: 73, train_loss: 0.2204, test_loss: 1.4880, test_f1: 0.6689
 epoch: 74, train_loss: 0.2037, test_loss: 1.3493, test_f1: 0.6626
 epoch: 75, train_loss: 0.2126, test_loss: 1.4640, test_f1: 0.6294
 epoch: 76, train_loss: 0.2144, test_loss: 1.4800, test_f1: 0.6450
 epoch: 77, train_loss: 0.2144, test_loss: 1.4046, test_f1: 0.6696
 epoch: 78, train_loss: 0.2134, test_loss: 1.7129, test_f1: 0.6084
 epoch: 79, train_loss: 0.1995, test_loss: 1.3672, test_f1: 0.6569
 epoch: 80, train_loss: 0.1954, test_loss: 1.5291, test_f1: 0.6501
 epoch: 81, train_loss: 0.1921, test_loss: 1.4180, test_f1: 0.6556
 epoch: 82, train_loss: 0.1932, test_loss: 1.4125, test_f1: 0.6606
 epoch: 83, train_loss: 0.1856, test_loss: 1.5563, test_f1: 0.6510
 epoch: 84, train_loss: 0.1969, test_loss: 1.5033, test_f1: 0.6492
 epoch: 85, train_loss: 0.2136, test_loss: 1.4569, test_f1: 0.6615
 epoch: 86, train_loss: 0.1794, test_loss: 1.6684, test_f1: 0.6206
 epoch: 87, train_loss: 0.1903, test_loss: 1.5541, test_f1: 0.6444
 epoch: 88, train_loss: 0.1859, test_loss: 1.4198, test_f1: 0.6479
 epoch: 89, train_loss: 0.1823, test_loss: 1.5383, test_f1: 0.6491
 epoch: 90, train_loss: 0.1845, test_loss: 1.5398, test_f1: 0.6247
 epoch: 91, train_loss: 0.1681, test_loss: 1.5455, test_f1: 0.6505
 epoch: 92, train_loss: 0.1705, test_loss: 1.8812, test_f1: 0.6360
 epoch: 93, train_loss: 0.1587, test_loss: 1.4996, test_f1: 0.6549
 epoch: 94, train_loss: 0.1822, test_loss: 1.5754, test_f1: 0.6601
 epoch: 95, train_loss: 0.1668, test_loss: 1.8993, test_f1: 0.6274
 epoch: 96, train_loss: 0.1724, test_loss: 1.7336, test_f1: 0.6666
 epoch: 97, train_loss: 0.1696, test_loss: 1.6091, test_f1: 0.6706
 epoch: 98, train_loss: 0.1567, test_loss: 1.5592, test_f1: 0.6638
 epoch: 99, train_loss: 0.1569, test_loss: 1.6996, test_f1: 0.6774
##################ITERATION #4 ****************************************
 epoch: 0, train_loss: 1.3466, test_loss: 1.1882, test_f1: 0.2518
 epoch: 1, train_loss: 1.0037, test_loss: 0.9873, test_f1: 0.4885
 epoch: 2, train_loss: 0.9439, test_loss: 0.9636, test_f1: 0.5646
 epoch: 3, train_loss: 0.9048, test_loss: 0.9362, test_f1: 0.5371
 epoch: 4, train_loss: 0.8876, test_loss: 0.9570, test_f1: 0.5280
 epoch: 5, train_loss: 0.8486, test_loss: 0.9333, test_f1: 0.5876
 epoch: 6, train_loss: 0.8363, test_loss: 0.9127, test_f1: 0.5695
 epoch: 7, train_loss: 0.8285, test_loss: 0.9107, test_f1: 0.5588
 epoch: 8, train_loss: 0.8036, test_loss: 0.8927, test_f1: 0.5746
 epoch: 9, train_loss: 0.8037, test_loss: 0.9076, test_f1: 0.5777
 epoch: 10, train_loss: 0.7718, test_loss: 0.8607, test_f1: 0.6138
 epoch: 11, train_loss: 0.7513, test_loss: 0.8488, test_f1: 0.6268
 epoch: 12, train_loss: 0.7331, test_loss: 0.9314, test_f1: 0.6044
 epoch: 13, train_loss: 0.7290, test_loss: 0.8679, test_f1: 0.6046
 epoch: 14, train_loss: 0.7091, test_loss: 0.9040, test_f1: 0.5730
 epoch: 15, train_loss: 0.7173, test_loss: 0.8821, test_f1: 0.6006
 epoch: 16, train_loss: 0.6913, test_loss: 0.8530, test_f1: 0.6268
 epoch: 17, train_loss: 0.6878, test_loss: 0.9553, test_f1: 0.5719
 epoch: 18, train_loss: 0.6687, test_loss: 0.9339, test_f1: 0.5796
 epoch: 19, train_loss: 0.6607, test_loss: 0.9619, test_f1: 0.5900
 epoch: 20, train_loss: 0.6381, test_loss: 0.9708, test_f1: 0.5775
 epoch: 21, train_loss: 0.6495, test_loss: 0.8802, test_f1: 0.6168
 epoch: 22, train_loss: 0.6377, test_loss: 0.8670, test_f1: 0.5941
 epoch: 23, train_loss: 0.5936, test_loss: 0.8983, test_f1: 0.6224
 epoch: 24, train_loss: 0.5934, test_loss: 0.9139, test_f1: 0.6486
 epoch: 25, train_loss: 0.5779, test_loss: 0.9308, test_f1: 0.6286
 epoch: 26, train_loss: 0.5771, test_loss: 0.9148, test_f1: 0.6299
 epoch: 27, train_loss: 0.5522, test_loss: 1.1263, test_f1: 0.5414
 epoch: 28, train_loss: 0.5556, test_loss: 0.9600, test_f1: 0.6168
 epoch: 29, train_loss: 0.5372, test_loss: 1.1984, test_f1: 0.5864
 epoch: 30, train_loss: 0.5172, test_loss: 0.9476, test_f1: 0.6166
 epoch: 31, train_loss: 0.5292, test_loss: 0.9153, test_f1: 0.6333
 epoch: 32, train_loss: 0.5217, test_loss: 0.9406, test_f1: 0.6426
 epoch: 33, train_loss: 0.5052, test_loss: 0.9690, test_f1: 0.6129
 epoch: 34, train_loss: 0.4773, test_loss: 1.0087, test_f1: 0.5981
 epoch: 35, train_loss: 0.4922, test_loss: 1.0602, test_f1: 0.5974
 epoch: 36, train_loss: 0.4934, test_loss: 0.9162, test_f1: 0.6310
 epoch: 37, train_loss: 0.4870, test_loss: 0.9943, test_f1: 0.6553
 epoch: 38, train_loss: 0.4650, test_loss: 0.9522, test_f1: 0.6471
 epoch: 39, train_loss: 0.4543, test_loss: 1.1067, test_f1: 0.6502
 epoch: 40, train_loss: 0.4420, test_loss: 1.0438, test_f1: 0.6057
 epoch: 41, train_loss: 0.4390, test_loss: 1.0255, test_f1: 0.6585
 epoch: 42, train_loss: 0.4445, test_loss: 1.0688, test_f1: 0.6109
 epoch: 43, train_loss: 0.4295, test_loss: 0.9889, test_f1: 0.6444
 epoch: 44, train_loss: 0.4330, test_loss: 1.4498, test_f1: 0.5708
 epoch: 45, train_loss: 0.4361, test_loss: 1.0084, test_f1: 0.6720
 epoch: 46, train_loss: 0.3937, test_loss: 1.0851, test_f1: 0.6613
 epoch: 47, train_loss: 0.4146, test_loss: 1.1644, test_f1: 0.6280
 epoch: 48, train_loss: 0.3965, test_loss: 1.0487, test_f1: 0.6511
 epoch: 49, train_loss: 0.3971, test_loss: 1.1081, test_f1: 0.6427
 epoch: 50, train_loss: 0.3836, test_loss: 1.1238, test_f1: 0.6627
 epoch: 51, train_loss: 0.3526, test_loss: 0.9914, test_f1: 0.6735
 epoch: 52, train_loss: 0.3250, test_loss: 1.0935, test_f1: 0.6729
 epoch: 53, train_loss: 0.3022, test_loss: 1.1184, test_f1: 0.6770
 epoch: 54, train_loss: 0.3077, test_loss: 1.1963, test_f1: 0.6645
 epoch: 55, train_loss: 0.3007, test_loss: 1.1090, test_f1: 0.6671
 epoch: 56, train_loss: 0.2934, test_loss: 1.1957, test_f1: 0.6804
 epoch: 57, train_loss: 0.2928, test_loss: 1.1725, test_f1: 0.6783
 epoch: 58, train_loss: 0.2871, test_loss: 1.2769, test_f1: 0.6389
 epoch: 59, train_loss: 0.2711, test_loss: 1.1886, test_f1: 0.6930
 epoch: 60, train_loss: 0.2688, test_loss: 1.2450, test_f1: 0.6435
 epoch: 61, train_loss: 0.2841, test_loss: 1.2558, test_f1: 0.6633
 epoch: 62, train_loss: 0.2711, test_loss: 1.1515, test_f1: 0.6532
 epoch: 63, train_loss: 0.2852, test_loss: 1.4085, test_f1: 0.6325
 epoch: 64, train_loss: 0.2683, test_loss: 1.3624, test_f1: 0.6401
 epoch: 65, train_loss: 0.2609, test_loss: 1.2802, test_f1: 0.6797
 epoch: 66, train_loss: 0.2513, test_loss: 1.2922, test_f1: 0.6708
 epoch: 67, train_loss: 0.2608, test_loss: 1.3435, test_f1: 0.6721
 epoch: 68, train_loss: 0.2522, test_loss: 1.3467, test_f1: 0.6538
 epoch: 69, train_loss: 0.2428, test_loss: 1.3514, test_f1: 0.6562
 epoch: 70, train_loss: 0.2544, test_loss: 1.3654, test_f1: 0.6580
 epoch: 71, train_loss: 0.2444, test_loss: 1.2282, test_f1: 0.6798
 epoch: 72, train_loss: 0.2459, test_loss: 1.3783, test_f1: 0.6604
 epoch: 73, train_loss: 0.2339, test_loss: 1.3453, test_f1: 0.6448
 epoch: 74, train_loss: 0.2438, test_loss: 1.4980, test_f1: 0.6603
 epoch: 75, train_loss: 0.2328, test_loss: 1.4466, test_f1: 0.6586
 epoch: 76, train_loss: 0.2372, test_loss: 1.3352, test_f1: 0.6471
 epoch: 77, train_loss: 0.2239, test_loss: 1.4439, test_f1: 0.6640
 epoch: 78, train_loss: 0.2199, test_loss: 1.4129, test_f1: 0.6506
 epoch: 79, train_loss: 0.2273, test_loss: 1.3901, test_f1: 0.6427
 epoch: 80, train_loss: 0.2193, test_loss: 1.4816, test_f1: 0.6600
 epoch: 81, train_loss: 0.2244, test_loss: 1.5025, test_f1: 0.6478
 epoch: 82, train_loss: 0.2215, test_loss: 1.5473, test_f1: 0.6481
 epoch: 83, train_loss: 0.2176, test_loss: 1.4543, test_f1: 0.6544
 epoch: 84, train_loss: 0.2064, test_loss: 1.3671, test_f1: 0.6677
 epoch: 85, train_loss: 0.2034, test_loss: 1.4107, test_f1: 0.6793
 epoch: 86, train_loss: 0.2116, test_loss: 1.5447, test_f1: 0.6728
 epoch: 87, train_loss: 0.2123, test_loss: 1.4740, test_f1: 0.6508
 epoch: 88, train_loss: 0.2053, test_loss: 1.5208, test_f1: 0.6686
 epoch: 89, train_loss: 0.2065, test_loss: 1.5022, test_f1: 0.6735
 epoch: 90, train_loss: 0.2002, test_loss: 1.6991, test_f1: 0.6215
 epoch: 91, train_loss: 0.2077, test_loss: 1.4525, test_f1: 0.6667
 epoch: 92, train_loss: 0.2050, test_loss: 1.4928, test_f1: 0.6642
 epoch: 93, train_loss: 0.1907, test_loss: 1.5737, test_f1: 0.6403
 epoch: 94, train_loss: 0.1982, test_loss: 1.5856, test_f1: 0.6797
 epoch: 95, train_loss: 0.1797, test_loss: 1.5266, test_f1: 0.6702
 epoch: 96, train_loss: 0.1735, test_loss: 1.6354, test_f1: 0.6727
 epoch: 97, train_loss: 0.1841, test_loss: 1.5836, test_f1: 0.6406
 epoch: 98, train_loss: 0.1987, test_loss: 1.4674, test_f1: 0.6638
 epoch: 99, train_loss: 0.1831, test_loss: 1.5744, test_f1: 0.6492
##################ITERATION #5 ****************************************
 epoch: 0, train_loss: 1.5073, test_loss: 1.3283, test_f1: 0.2846
 epoch: 1, train_loss: 1.0261, test_loss: 1.0320, test_f1: 0.5125
 epoch: 2, train_loss: 0.9563, test_loss: 0.9877, test_f1: 0.5541
 epoch: 3, train_loss: 0.9067, test_loss: 0.9825, test_f1: 0.5139
 epoch: 4, train_loss: 0.8902, test_loss: 0.9541, test_f1: 0.5800
 epoch: 5, train_loss: 0.8624, test_loss: 0.9153, test_f1: 0.5677
 epoch: 6, train_loss: 0.8416, test_loss: 0.9764, test_f1: 0.5330
 epoch: 7, train_loss: 0.8094, test_loss: 1.0101, test_f1: 0.5389
 epoch: 8, train_loss: 0.7978, test_loss: 0.9183, test_f1: 0.5654
 epoch: 9, train_loss: 0.7614, test_loss: 0.8939, test_f1: 0.5786
 epoch: 10, train_loss: 0.7303, test_loss: 0.9667, test_f1: 0.5546
 epoch: 11, train_loss: 0.7147, test_loss: 0.9225, test_f1: 0.5638
 epoch: 12, train_loss: 0.7252, test_loss: 0.8786, test_f1: 0.5826
 epoch: 13, train_loss: 0.6835, test_loss: 1.1155, test_f1: 0.4857
 epoch: 14, train_loss: 0.6740, test_loss: 0.9600, test_f1: 0.5353
 epoch: 15, train_loss: 0.6642, test_loss: 0.8395, test_f1: 0.6217
 epoch: 16, train_loss: 0.6461, test_loss: 0.8698, test_f1: 0.5945
 epoch: 17, train_loss: 0.6443, test_loss: 0.9281, test_f1: 0.5745
 epoch: 18, train_loss: 0.6446, test_loss: 0.9547, test_f1: 0.5938
 epoch: 19, train_loss: 0.6090, test_loss: 0.8620, test_f1: 0.5768
 epoch: 20, train_loss: 0.5980, test_loss: 0.8216, test_f1: 0.6369
 epoch: 21, train_loss: 0.6150, test_loss: 0.8246, test_f1: 0.6218
 epoch: 22, train_loss: 0.5864, test_loss: 0.8121, test_f1: 0.6489
 epoch: 23, train_loss: 0.5759, test_loss: 0.8066, test_f1: 0.6213
 epoch: 24, train_loss: 0.5374, test_loss: 0.8159, test_f1: 0.6295
 epoch: 25, train_loss: 0.5442, test_loss: 0.8889, test_f1: 0.6200
 epoch: 26, train_loss: 0.5227, test_loss: 0.8385, test_f1: 0.6451
 epoch: 27, train_loss: 0.5295, test_loss: 0.8306, test_f1: 0.6208
 epoch: 28, train_loss: 0.5315, test_loss: 0.8543, test_f1: 0.5858
 epoch: 29, train_loss: 0.4955, test_loss: 0.7872, test_f1: 0.6447
 epoch: 30, train_loss: 0.4855, test_loss: 1.0911, test_f1: 0.5809
 epoch: 31, train_loss: 0.4857, test_loss: 0.8272, test_f1: 0.6412
 epoch: 32, train_loss: 0.4667, test_loss: 1.0146, test_f1: 0.6004
 epoch: 33, train_loss: 0.4649, test_loss: 0.9358, test_f1: 0.6375
 epoch: 34, train_loss: 0.4588, test_loss: 1.1639, test_f1: 0.5696
 epoch: 35, train_loss: 0.4503, test_loss: 1.0401, test_f1: 0.6245
 epoch: 36, train_loss: 0.4817, test_loss: 0.8677, test_f1: 0.6485
 epoch: 37, train_loss: 0.4448, test_loss: 1.0848, test_f1: 0.6072
 epoch: 38, train_loss: 0.4076, test_loss: 0.8644, test_f1: 0.6765
 epoch: 39, train_loss: 0.3975, test_loss: 0.8974, test_f1: 0.6299
 epoch: 40, train_loss: 0.4192, test_loss: 0.9393, test_f1: 0.6299
 epoch: 41, train_loss: 0.4159, test_loss: 0.8716, test_f1: 0.6567
 epoch: 42, train_loss: 0.4025, test_loss: 0.8844, test_f1: 0.6689
 epoch: 43, train_loss: 0.3930, test_loss: 0.9944, test_f1: 0.6269
 epoch: 44, train_loss: 0.4156, test_loss: 1.1747, test_f1: 0.6053
 epoch: 45, train_loss: 0.3859, test_loss: 0.8871, test_f1: 0.6506
 epoch: 46, train_loss: 0.3859, test_loss: 0.9267, test_f1: 0.6872
 epoch: 47, train_loss: 0.3662, test_loss: 0.9213, test_f1: 0.6530
 epoch: 48, train_loss: 0.3535, test_loss: 1.0065, test_f1: 0.6732
 epoch: 49, train_loss: 0.3713, test_loss: 0.9767, test_f1: 0.6732
 epoch: 50, train_loss: 0.3411, test_loss: 1.0403, test_f1: 0.6361
 epoch: 51, train_loss: 0.3358, test_loss: 1.0323, test_f1: 0.6721
 epoch: 52, train_loss: 0.3051, test_loss: 1.0189, test_f1: 0.6604
 epoch: 53, train_loss: 0.2744, test_loss: 0.9869, test_f1: 0.6648
 epoch: 54, train_loss: 0.2799, test_loss: 1.2177, test_f1: 0.6696
 epoch: 55, train_loss: 0.2717, test_loss: 1.1531, test_f1: 0.6564
 epoch: 56, train_loss: 0.2532, test_loss: 1.0796, test_f1: 0.6887
 epoch: 57, train_loss: 0.2638, test_loss: 1.3307, test_f1: 0.6621
 epoch: 58, train_loss: 0.2586, test_loss: 1.2414, test_f1: 0.6373
 epoch: 59, train_loss: 0.2554, test_loss: 1.1643, test_f1: 0.6642
 epoch: 60, train_loss: 0.2588, test_loss: 1.1140, test_f1: 0.6695
 epoch: 61, train_loss: 0.2512, test_loss: 1.1025, test_f1: 0.6749
 epoch: 62, train_loss: 0.2347, test_loss: 1.0576, test_f1: 0.6613
 epoch: 63, train_loss: 0.2435, test_loss: 1.0960, test_f1: 0.6774
 epoch: 64, train_loss: 0.2497, test_loss: 1.2201, test_f1: 0.6525
 epoch: 65, train_loss: 0.2349, test_loss: 1.1294, test_f1: 0.6675
 epoch: 66, train_loss: 0.2483, test_loss: 1.2220, test_f1: 0.6579
 epoch: 67, train_loss: 0.2381, test_loss: 1.2133, test_f1: 0.6516
 epoch: 68, train_loss: 0.2255, test_loss: 1.2134, test_f1: 0.6541
 epoch: 69, train_loss: 0.2183, test_loss: 1.1108, test_f1: 0.6764
 epoch: 70, train_loss: 0.2114, test_loss: 1.2555, test_f1: 0.6471
 epoch: 71, train_loss: 0.2220, test_loss: 1.2095, test_f1: 0.6329
 epoch: 72, train_loss: 0.2435, test_loss: 1.2971, test_f1: 0.6242
 epoch: 73, train_loss: 0.2282, test_loss: 1.1321, test_f1: 0.6805
 epoch: 74, train_loss: 0.2099, test_loss: 1.2934, test_f1: 0.6651
 epoch: 75, train_loss: 0.1969, test_loss: 1.4443, test_f1: 0.6235
 epoch: 76, train_loss: 0.1940, test_loss: 1.2969, test_f1: 0.6260
 epoch: 77, train_loss: 0.2076, test_loss: 1.5075, test_f1: 0.6466
 epoch: 78, train_loss: 0.2130, test_loss: 1.5372, test_f1: 0.5964
 epoch: 79, train_loss: 0.1808, test_loss: 1.3636, test_f1: 0.6436
 epoch: 80, train_loss: 0.2002, test_loss: 1.3274, test_f1: 0.6411
 epoch: 81, train_loss: 0.1839, test_loss: 1.5983, test_f1: 0.6222
 epoch: 82, train_loss: 0.1990, test_loss: 1.4934, test_f1: 0.6266
 epoch: 83, train_loss: 0.2159, test_loss: 1.5258, test_f1: 0.6061
 epoch: 84, train_loss: 0.1964, test_loss: 1.3778, test_f1: 0.6544
 epoch: 85, train_loss: 0.1851, test_loss: 1.3134, test_f1: 0.6892
 epoch: 86, train_loss: 0.1853, test_loss: 1.4691, test_f1: 0.6407
 epoch: 87, train_loss: 0.1908, test_loss: 1.4196, test_f1: 0.6545
 epoch: 88, train_loss: 0.1750, test_loss: 1.5808, test_f1: 0.6138
 epoch: 89, train_loss: 0.1763, test_loss: 1.4832, test_f1: 0.6411
 epoch: 90, train_loss: 0.1668, test_loss: 1.4888, test_f1: 0.6587
 epoch: 91, train_loss: 0.1798, test_loss: 1.6370, test_f1: 0.6143
 epoch: 92, train_loss: 0.1709, test_loss: 1.5057, test_f1: 0.6567
 epoch: 93, train_loss: 0.1713, test_loss: 1.5421, test_f1: 0.6403
 epoch: 94, train_loss: 0.1871, test_loss: 1.5024, test_f1: 0.6504
 epoch: 95, train_loss: 0.1761, test_loss: 1.7720, test_f1: 0.6208
 epoch: 96, train_loss: 0.1782, test_loss: 1.3820, test_f1: 0.6490
 epoch: 97, train_loss: 0.1724, test_loss: 1.8556, test_f1: 0.6199
 epoch: 98, train_loss: 0.1571, test_loss: 1.6068, test_f1: 0.6579
 epoch: 99, train_loss: 0.1759, test_loss: 1.5812, test_f1: 0.6493
##################ITERATION #6 ****************************************
 epoch: 0, train_loss: 1.3874, test_loss: 1.5107, test_f1: 0.2260
 epoch: 1, train_loss: 0.9712, test_loss: 1.1006, test_f1: 0.4062
 epoch: 2, train_loss: 0.9103, test_loss: 0.9327, test_f1: 0.4996
 epoch: 3, train_loss: 0.8842, test_loss: 0.9143, test_f1: 0.5354
 epoch: 4, train_loss: 0.8512, test_loss: 0.9484, test_f1: 0.5764
 epoch: 5, train_loss: 0.8138, test_loss: 0.9473, test_f1: 0.5649
 epoch: 6, train_loss: 0.8010, test_loss: 0.8973, test_f1: 0.5816
 epoch: 7, train_loss: 0.7753, test_loss: 0.8842, test_f1: 0.6139
 epoch: 8, train_loss: 0.7549, test_loss: 0.8201, test_f1: 0.6337
 epoch: 9, train_loss: 0.7366, test_loss: 0.8781, test_f1: 0.6184
 epoch: 10, train_loss: 0.7226, test_loss: 0.8333, test_f1: 0.6449
 epoch: 11, train_loss: 0.6856, test_loss: 0.8427, test_f1: 0.6309
 epoch: 12, train_loss: 0.6710, test_loss: 0.9417, test_f1: 0.6032
 epoch: 13, train_loss: 0.6660, test_loss: 0.8495, test_f1: 0.6043
 epoch: 14, train_loss: 0.6793, test_loss: 0.8359, test_f1: 0.6196
 epoch: 15, train_loss: 0.6482, test_loss: 0.8668, test_f1: 0.6425
 epoch: 16, train_loss: 0.6179, test_loss: 0.8781, test_f1: 0.6465
 epoch: 17, train_loss: 0.6221, test_loss: 0.9575, test_f1: 0.5682
 epoch: 18, train_loss: 0.6102, test_loss: 0.8368, test_f1: 0.6598
 epoch: 19, train_loss: 0.5700, test_loss: 0.7567, test_f1: 0.6748
 epoch: 20, train_loss: 0.5885, test_loss: 0.9368, test_f1: 0.6348
 epoch: 21, train_loss: 0.5780, test_loss: 0.9143, test_f1: 0.6356
 epoch: 22, train_loss: 0.5785, test_loss: 0.8952, test_f1: 0.6199
 epoch: 23, train_loss: 0.5512, test_loss: 0.8837, test_f1: 0.6072
 epoch: 24, train_loss: 0.5450, test_loss: 0.8851, test_f1: 0.6497
 epoch: 25, train_loss: 0.5299, test_loss: 0.8670, test_f1: 0.6592
 epoch: 26, train_loss: 0.5071, test_loss: 0.8611, test_f1: 0.6494
 epoch: 27, train_loss: 0.5002, test_loss: 0.8861, test_f1: 0.6221
 epoch: 28, train_loss: 0.4943, test_loss: 0.9285, test_f1: 0.6431
 epoch: 29, train_loss: 0.4794, test_loss: 0.9390, test_f1: 0.6436
 epoch: 30, train_loss: 0.4940, test_loss: 0.8174, test_f1: 0.6845
 epoch: 31, train_loss: 0.4583, test_loss: 0.8732, test_f1: 0.6520
 epoch: 32, train_loss: 0.4722, test_loss: 0.8902, test_f1: 0.6660
 epoch: 33, train_loss: 0.4502, test_loss: 0.9882, test_f1: 0.6360
 epoch: 34, train_loss: 0.4391, test_loss: 0.8928, test_f1: 0.6747
 epoch: 35, train_loss: 0.4421, test_loss: 1.0025, test_f1: 0.6237
 epoch: 36, train_loss: 0.4296, test_loss: 0.8939, test_f1: 0.6575
 epoch: 37, train_loss: 0.4002, test_loss: 0.9133, test_f1: 0.6794
 epoch: 38, train_loss: 0.4395, test_loss: 1.0182, test_f1: 0.6304
 epoch: 39, train_loss: 0.4147, test_loss: 0.9944, test_f1: 0.6689
 epoch: 40, train_loss: 0.4235, test_loss: 1.0845, test_f1: 0.6421
 epoch: 41, train_loss: 0.3934, test_loss: 0.9859, test_f1: 0.6553
 epoch: 42, train_loss: 0.3850, test_loss: 1.0153, test_f1: 0.6441
 epoch: 43, train_loss: 0.3853, test_loss: 0.9647, test_f1: 0.6673
 epoch: 44, train_loss: 0.3767, test_loss: 1.0820, test_f1: 0.6497
 epoch: 45, train_loss: 0.3755, test_loss: 1.0290, test_f1: 0.6407
 epoch: 46, train_loss: 0.3891, test_loss: 1.0352, test_f1: 0.6803
 epoch: 47, train_loss: 0.3683, test_loss: 1.0579, test_f1: 0.6388
 epoch: 48, train_loss: 0.3695, test_loss: 1.0020, test_f1: 0.6651
 epoch: 49, train_loss: 0.3335, test_loss: 1.2582, test_f1: 0.6271
 epoch: 50, train_loss: 0.3370, test_loss: 1.1748, test_f1: 0.6459
 epoch: 51, train_loss: 0.3370, test_loss: 1.0373, test_f1: 0.6742
 epoch: 52, train_loss: 0.2884, test_loss: 1.0610, test_f1: 0.6622
 epoch: 53, train_loss: 0.2754, test_loss: 1.0538, test_f1: 0.6639
 epoch: 54, train_loss: 0.2876, test_loss: 1.0522, test_f1: 0.6837
 epoch: 55, train_loss: 0.2755, test_loss: 1.0571, test_f1: 0.6866
 epoch: 56, train_loss: 0.2620, test_loss: 1.1345, test_f1: 0.6762
 epoch: 57, train_loss: 0.2559, test_loss: 1.1657, test_f1: 0.6498
 epoch: 58, train_loss: 0.2592, test_loss: 1.1309, test_f1: 0.6590
 epoch: 59, train_loss: 0.2496, test_loss: 1.1428, test_f1: 0.6792
 epoch: 60, train_loss: 0.2496, test_loss: 1.2562, test_f1: 0.6552
 epoch: 61, train_loss: 0.2286, test_loss: 1.1701, test_f1: 0.6607
 epoch: 62, train_loss: 0.2281, test_loss: 1.2279, test_f1: 0.6689
 epoch: 63, train_loss: 0.2261, test_loss: 1.2292, test_f1: 0.6603
 epoch: 64, train_loss: 0.2289, test_loss: 1.2067, test_f1: 0.6760
 epoch: 65, train_loss: 0.2281, test_loss: 1.2268, test_f1: 0.6528
 epoch: 66, train_loss: 0.2295, test_loss: 1.2525, test_f1: 0.6687
 epoch: 67, train_loss: 0.2286, test_loss: 1.3341, test_f1: 0.6313
 epoch: 68, train_loss: 0.2198, test_loss: 1.3085, test_f1: 0.6579
 epoch: 69, train_loss: 0.2311, test_loss: 1.2516, test_f1: 0.6473
 epoch: 70, train_loss: 0.1924, test_loss: 1.2588, test_f1: 0.6303
 epoch: 71, train_loss: 0.2006, test_loss: 1.2862, test_f1: 0.6546
 epoch: 72, train_loss: 0.2351, test_loss: 1.3323, test_f1: 0.6373
 epoch: 73, train_loss: 0.2066, test_loss: 1.3818, test_f1: 0.6629
 epoch: 74, train_loss: 0.2092, test_loss: 1.4697, test_f1: 0.6441
 epoch: 75, train_loss: 0.2267, test_loss: 1.3698, test_f1: 0.6459
 epoch: 76, train_loss: 0.2152, test_loss: 1.3276, test_f1: 0.6497
 epoch: 77, train_loss: 0.2000, test_loss: 1.4226, test_f1: 0.6430
 epoch: 78, train_loss: 0.1894, test_loss: 1.4056, test_f1: 0.6542
 epoch: 79, train_loss: 0.1823, test_loss: 1.4325, test_f1: 0.6624
 epoch: 80, train_loss: 0.1656, test_loss: 1.4489, test_f1: 0.6508
 epoch: 81, train_loss: 0.1800, test_loss: 1.4988, test_f1: 0.6512
 epoch: 82, train_loss: 0.1868, test_loss: 1.3985, test_f1: 0.6546
 epoch: 83, train_loss: 0.1874, test_loss: 1.3947, test_f1: 0.6632
 epoch: 84, train_loss: 0.1805, test_loss: 1.4343, test_f1: 0.6674
 epoch: 85, train_loss: 0.1918, test_loss: 1.5490, test_f1: 0.6567
 epoch: 86, train_loss: 0.1798, test_loss: 1.4163, test_f1: 0.6460
 epoch: 87, train_loss: 0.1752, test_loss: 1.6223, test_f1: 0.6442
 epoch: 88, train_loss: 0.1839, test_loss: 1.4668, test_f1: 0.6618
 epoch: 89, train_loss: 0.1787, test_loss: 1.4167, test_f1: 0.6721
 epoch: 90, train_loss: 0.1609, test_loss: 1.5805, test_f1: 0.6449
 epoch: 91, train_loss: 0.1761, test_loss: 1.5513, test_f1: 0.6595
 epoch: 92, train_loss: 0.1863, test_loss: 1.6210, test_f1: 0.6522
 epoch: 93, train_loss: 0.1895, test_loss: 1.5372, test_f1: 0.6535
 epoch: 94, train_loss: 0.1665, test_loss: 1.5481, test_f1: 0.6615
 epoch: 95, train_loss: 0.1843, test_loss: 1.5506, test_f1: 0.6634
 epoch: 96, train_loss: 0.1785, test_loss: 1.5039, test_f1: 0.6546
 epoch: 97, train_loss: 0.1861, test_loss: 1.6722, test_f1: 0.6425
 epoch: 98, train_loss: 0.1612, test_loss: 1.6617, test_f1: 0.6436
 epoch: 99, train_loss: 0.1453, test_loss: 1.6146, test_f1: 0.6597
##################ITERATION #7 ****************************************
 epoch: 0, train_loss: 1.4213, test_loss: 1.2592, test_f1: 0.2405
 epoch: 1, train_loss: 1.0201, test_loss: 1.0266, test_f1: 0.4644
 epoch: 2, train_loss: 0.9485, test_loss: 0.9653, test_f1: 0.5032
 epoch: 3, train_loss: 0.8937, test_loss: 0.9258, test_f1: 0.5629
 epoch: 4, train_loss: 0.8658, test_loss: 0.9266, test_f1: 0.5872
 epoch: 5, train_loss: 0.8419, test_loss: 0.8926, test_f1: 0.5710
 epoch: 6, train_loss: 0.8310, test_loss: 1.1134, test_f1: 0.5382
 epoch: 7, train_loss: 0.8020, test_loss: 0.9097, test_f1: 0.5804
 epoch: 8, train_loss: 0.7844, test_loss: 0.9016, test_f1: 0.5550
 epoch: 9, train_loss: 0.7528, test_loss: 0.9052, test_f1: 0.5811
 epoch: 10, train_loss: 0.7455, test_loss: 0.9475, test_f1: 0.5539
 epoch: 11, train_loss: 0.7516, test_loss: 0.8602, test_f1: 0.5967
 epoch: 12, train_loss: 0.7208, test_loss: 0.9154, test_f1: 0.5852
 epoch: 13, train_loss: 0.7279, test_loss: 0.9443, test_f1: 0.5747
 epoch: 14, train_loss: 0.6928, test_loss: 0.8557, test_f1: 0.6260
 epoch: 15, train_loss: 0.6791, test_loss: 1.0080, test_f1: 0.5587
 epoch: 16, train_loss: 0.6691, test_loss: 0.8825, test_f1: 0.6267
 epoch: 17, train_loss: 0.6550, test_loss: 0.9018, test_f1: 0.5993
 epoch: 18, train_loss: 0.6347, test_loss: 0.8836, test_f1: 0.6074
 epoch: 19, train_loss: 0.6337, test_loss: 0.9294, test_f1: 0.5793
 epoch: 20, train_loss: 0.6369, test_loss: 0.8943, test_f1: 0.5995
 epoch: 21, train_loss: 0.6127, test_loss: 0.9929, test_f1: 0.6002
 epoch: 22, train_loss: 0.6082, test_loss: 0.8856, test_f1: 0.6280
 epoch: 23, train_loss: 0.5724, test_loss: 0.9696, test_f1: 0.5959
 epoch: 24, train_loss: 0.5717, test_loss: 0.9038, test_f1: 0.6305
 epoch: 25, train_loss: 0.5628, test_loss: 0.9165, test_f1: 0.6450
 epoch: 26, train_loss: 0.5318, test_loss: 0.9633, test_f1: 0.6181
 epoch: 27, train_loss: 0.5387, test_loss: 0.8954, test_f1: 0.6468
 epoch: 28, train_loss: 0.5224, test_loss: 0.8743, test_f1: 0.6373
 epoch: 29, train_loss: 0.5054, test_loss: 1.0479, test_f1: 0.6073
 epoch: 30, train_loss: 0.5034, test_loss: 1.0806, test_f1: 0.5945
 epoch: 31, train_loss: 0.5097, test_loss: 1.0030, test_f1: 0.6311
 epoch: 32, train_loss: 0.5050, test_loss: 0.9883, test_f1: 0.6403
 epoch: 33, train_loss: 0.4817, test_loss: 1.0933, test_f1: 0.6015
 epoch: 34, train_loss: 0.4952, test_loss: 1.1017, test_f1: 0.5937
 epoch: 35, train_loss: 0.5030, test_loss: 1.0135, test_f1: 0.6251
 epoch: 36, train_loss: 0.4664, test_loss: 1.0688, test_f1: 0.6110
 epoch: 37, train_loss: 0.4472, test_loss: 1.0483, test_f1: 0.6211
 epoch: 38, train_loss: 0.4482, test_loss: 0.9691, test_f1: 0.6565
 epoch: 39, train_loss: 0.4457, test_loss: 1.0999, test_f1: 0.6355
 epoch: 40, train_loss: 0.4362, test_loss: 1.0364, test_f1: 0.6466
 epoch: 41, train_loss: 0.4569, test_loss: 1.0513, test_f1: 0.6224
 epoch: 42, train_loss: 0.4374, test_loss: 1.1614, test_f1: 0.6156
 epoch: 43, train_loss: 0.4556, test_loss: 1.0413, test_f1: 0.6339
 epoch: 44, train_loss: 0.4282, test_loss: 1.0451, test_f1: 0.6382
 epoch: 45, train_loss: 0.4022, test_loss: 1.0579, test_f1: 0.6513
 epoch: 46, train_loss: 0.3854, test_loss: 1.0599, test_f1: 0.6533
 epoch: 47, train_loss: 0.3850, test_loss: 1.3139, test_f1: 0.5982
 epoch: 48, train_loss: 0.3785, test_loss: 1.0079, test_f1: 0.6550
 epoch: 49, train_loss: 0.3815, test_loss: 1.0680, test_f1: 0.6858
 epoch: 50, train_loss: 0.3684, test_loss: 1.1635, test_f1: 0.6387
 epoch: 51, train_loss: 0.3356, test_loss: 1.1064, test_f1: 0.6866
 epoch: 52, train_loss: 0.3071, test_loss: 1.0390, test_f1: 0.6997
 epoch: 53, train_loss: 0.3053, test_loss: 1.1510, test_f1: 0.6848
 epoch: 54, train_loss: 0.3023, test_loss: 1.1552, test_f1: 0.6978
 epoch: 55, train_loss: 0.2929, test_loss: 1.1025, test_f1: 0.7084
 epoch: 56, train_loss: 0.2751, test_loss: 1.1826, test_f1: 0.6747
 epoch: 57, train_loss: 0.2689, test_loss: 1.2236, test_f1: 0.6766
 epoch: 58, train_loss: 0.2614, test_loss: 1.2143, test_f1: 0.6758
 epoch: 59, train_loss: 0.2735, test_loss: 1.2146, test_f1: 0.6730
 epoch: 60, train_loss: 0.2734, test_loss: 1.1976, test_f1: 0.6687
 epoch: 61, train_loss: 0.2654, test_loss: 1.3643, test_f1: 0.6789
 epoch: 62, train_loss: 0.2606, test_loss: 1.2955, test_f1: 0.7023
 epoch: 63, train_loss: 0.2694, test_loss: 1.3481, test_f1: 0.6376
 epoch: 64, train_loss: 0.2480, test_loss: 1.2274, test_f1: 0.6758
 epoch: 65, train_loss: 0.2325, test_loss: 1.3515, test_f1: 0.6827
 epoch: 66, train_loss: 0.2481, test_loss: 1.3167, test_f1: 0.6588
 epoch: 67, train_loss: 0.2549, test_loss: 1.3940, test_f1: 0.6397
 epoch: 68, train_loss: 0.2427, test_loss: 1.4560, test_f1: 0.6614
 epoch: 69, train_loss: 0.2399, test_loss: 1.3081, test_f1: 0.7019
 epoch: 70, train_loss: 0.2327, test_loss: 1.3917, test_f1: 0.6619
 epoch: 71, train_loss: 0.2345, test_loss: 1.4189, test_f1: 0.6662
 epoch: 72, train_loss: 0.2443, test_loss: 1.4499, test_f1: 0.6377
 epoch: 73, train_loss: 0.2334, test_loss: 1.3144, test_f1: 0.6710
 epoch: 74, train_loss: 0.2275, test_loss: 1.4584, test_f1: 0.6611
 epoch: 75, train_loss: 0.2120, test_loss: 1.4771, test_f1: 0.6691
 epoch: 76, train_loss: 0.2333, test_loss: 1.4762, test_f1: 0.6602
 epoch: 77, train_loss: 0.2259, test_loss: 1.4441, test_f1: 0.6404
 epoch: 78, train_loss: 0.2078, test_loss: 1.6490, test_f1: 0.6215
 epoch: 79, train_loss: 0.2017, test_loss: 1.4295, test_f1: 0.6886
 epoch: 80, train_loss: 0.2034, test_loss: 1.5261, test_f1: 0.6648
 epoch: 81, train_loss: 0.2230, test_loss: 1.4874, test_f1: 0.6672
 epoch: 82, train_loss: 0.2045, test_loss: 1.5222, test_f1: 0.6831
 epoch: 83, train_loss: 0.2101, test_loss: 1.5143, test_f1: 0.6497
 epoch: 84, train_loss: 0.2140, test_loss: 1.7321, test_f1: 0.6569
 epoch: 85, train_loss: 0.2103, test_loss: 1.6455, test_f1: 0.6721
 epoch: 86, train_loss: 0.2108, test_loss: 1.4824, test_f1: 0.6632
 epoch: 87, train_loss: 0.2231, test_loss: 1.6563, test_f1: 0.6488
 epoch: 88, train_loss: 0.1948, test_loss: 1.5045, test_f1: 0.6715
 epoch: 89, train_loss: 0.2004, test_loss: 1.5911, test_f1: 0.6710
 epoch: 90, train_loss: 0.1779, test_loss: 1.5096, test_f1: 0.6784
 epoch: 91, train_loss: 0.1867, test_loss: 1.7680, test_f1: 0.6597
 epoch: 92, train_loss: 0.1919, test_loss: 1.7910, test_f1: 0.6866
 epoch: 93, train_loss: 0.2045, test_loss: 1.6240, test_f1: 0.6776
 epoch: 94, train_loss: 0.1863, test_loss: 1.5912, test_f1: 0.6814
 epoch: 95, train_loss: 0.1849, test_loss: 1.5842, test_f1: 0.6358
 epoch: 96, train_loss: 0.1763, test_loss: 1.5532, test_f1: 0.6773
 epoch: 97, train_loss: 0.1771, test_loss: 1.5938, test_f1: 0.6705
 epoch: 98, train_loss: 0.1751, test_loss: 1.9812, test_f1: 0.6221
 epoch: 99, train_loss: 0.1814, test_loss: 1.8061, test_f1: 0.6513
##################ITERATION #8 ****************************************
 epoch: 0, train_loss: 1.6054, test_loss: 1.2433, test_f1: 0.2383
 epoch: 1, train_loss: 1.0338, test_loss: 1.0276, test_f1: 0.4039
 epoch: 2, train_loss: 0.9725, test_loss: 0.9713, test_f1: 0.4916
 epoch: 3, train_loss: 0.9292, test_loss: 0.9619, test_f1: 0.5366
 epoch: 4, train_loss: 0.9196, test_loss: 0.9646, test_f1: 0.5239
 epoch: 5, train_loss: 0.8953, test_loss: 0.9354, test_f1: 0.4950
 epoch: 6, train_loss: 0.8569, test_loss: 0.9087, test_f1: 0.5442
 epoch: 7, train_loss: 0.8388, test_loss: 0.9514, test_f1: 0.5353
 epoch: 8, train_loss: 0.8194, test_loss: 0.9927, test_f1: 0.5359
 epoch: 9, train_loss: 0.7927, test_loss: 0.8536, test_f1: 0.5891
 epoch: 10, train_loss: 0.7635, test_loss: 0.9094, test_f1: 0.5807
 epoch: 11, train_loss: 0.7545, test_loss: 0.8153, test_f1: 0.6231
 epoch: 12, train_loss: 0.7514, test_loss: 0.8775, test_f1: 0.5973
 epoch: 13, train_loss: 0.7312, test_loss: 0.8535, test_f1: 0.6026
 epoch: 14, train_loss: 0.7150, test_loss: 0.8325, test_f1: 0.5769
 epoch: 15, train_loss: 0.7007, test_loss: 0.8589, test_f1: 0.6124
 epoch: 16, train_loss: 0.6847, test_loss: 0.8374, test_f1: 0.6087
 epoch: 17, train_loss: 0.6636, test_loss: 0.9958, test_f1: 0.5810
 epoch: 18, train_loss: 0.6708, test_loss: 0.9330, test_f1: 0.5733
 epoch: 19, train_loss: 0.6420, test_loss: 0.9069, test_f1: 0.5496
 epoch: 20, train_loss: 0.6208, test_loss: 0.8577, test_f1: 0.6120
 epoch: 21, train_loss: 0.6148, test_loss: 0.8034, test_f1: 0.6437
 epoch: 22, train_loss: 0.5925, test_loss: 0.9018, test_f1: 0.6002
 epoch: 23, train_loss: 0.6081, test_loss: 0.8512, test_f1: 0.6109
 epoch: 24, train_loss: 0.5836, test_loss: 0.8613, test_f1: 0.6526
 epoch: 25, train_loss: 0.5789, test_loss: 0.8846, test_f1: 0.6387
 epoch: 26, train_loss: 0.5677, test_loss: 0.9216, test_f1: 0.6017
 epoch: 27, train_loss: 0.5511, test_loss: 0.8963, test_f1: 0.6307
 epoch: 28, train_loss: 0.5302, test_loss: 0.9867, test_f1: 0.6197
 epoch: 29, train_loss: 0.5308, test_loss: 0.9657, test_f1: 0.6030
 epoch: 30, train_loss: 0.5239, test_loss: 0.9388, test_f1: 0.6330
 epoch: 31, train_loss: 0.4961, test_loss: 0.9895, test_f1: 0.6152
 epoch: 32, train_loss: 0.5193, test_loss: 0.9180, test_f1: 0.6804
 epoch: 33, train_loss: 0.4973, test_loss: 0.9552, test_f1: 0.6545
 epoch: 34, train_loss: 0.4933, test_loss: 1.0300, test_f1: 0.6078
 epoch: 35, train_loss: 0.4770, test_loss: 1.0226, test_f1: 0.5828
 epoch: 36, train_loss: 0.4759, test_loss: 1.1303, test_f1: 0.6100
 epoch: 37, train_loss: 0.4977, test_loss: 0.9529, test_f1: 0.6335
 epoch: 38, train_loss: 0.4797, test_loss: 0.9960, test_f1: 0.6126
 epoch: 39, train_loss: 0.4677, test_loss: 1.0554, test_f1: 0.6068
 epoch: 40, train_loss: 0.4577, test_loss: 0.9292, test_f1: 0.6589
 epoch: 41, train_loss: 0.4276, test_loss: 1.0110, test_f1: 0.6255
 epoch: 42, train_loss: 0.4224, test_loss: 0.9646, test_f1: 0.6513
 epoch: 43, train_loss: 0.4059, test_loss: 1.0522, test_f1: 0.6187
 epoch: 44, train_loss: 0.4233, test_loss: 1.2931, test_f1: 0.5913
 epoch: 45, train_loss: 0.4387, test_loss: 1.0476, test_f1: 0.6637
 epoch: 46, train_loss: 0.3845, test_loss: 1.2841, test_f1: 0.6027
 epoch: 47, train_loss: 0.4064, test_loss: 1.0399, test_f1: 0.6373
 epoch: 48, train_loss: 0.4218, test_loss: 1.1013, test_f1: 0.6416
 epoch: 49, train_loss: 0.3725, test_loss: 1.0323, test_f1: 0.6434
 epoch: 50, train_loss: 0.4046, test_loss: 1.1139, test_f1: 0.6480
 epoch: 51, train_loss: 0.3472, test_loss: 1.0548, test_f1: 0.6499
 epoch: 52, train_loss: 0.3228, test_loss: 1.0655, test_f1: 0.6768
 epoch: 53, train_loss: 0.3285, test_loss: 1.1163, test_f1: 0.6602
 epoch: 54, train_loss: 0.3091, test_loss: 1.1537, test_f1: 0.6412
 epoch: 55, train_loss: 0.2981, test_loss: 1.1432, test_f1: 0.6533
 epoch: 56, train_loss: 0.3101, test_loss: 1.1024, test_f1: 0.6740
 epoch: 57, train_loss: 0.2949, test_loss: 1.0949, test_f1: 0.6744
 epoch: 58, train_loss: 0.2806, test_loss: 1.1964, test_f1: 0.6796
 epoch: 59, train_loss: 0.3055, test_loss: 1.0635, test_f1: 0.6585
 epoch: 60, train_loss: 0.2793, test_loss: 1.1594, test_f1: 0.6752
 epoch: 61, train_loss: 0.2951, test_loss: 1.1703, test_f1: 0.6561
 epoch: 62, train_loss: 0.2768, test_loss: 1.1260, test_f1: 0.6686
 epoch: 63, train_loss: 0.2686, test_loss: 1.1575, test_f1: 0.6609
 epoch: 64, train_loss: 0.2652, test_loss: 1.1556, test_f1: 0.6674
 epoch: 65, train_loss: 0.2672, test_loss: 1.2219, test_f1: 0.6709
 epoch: 66, train_loss: 0.2501, test_loss: 1.1401, test_f1: 0.6724
 epoch: 67, train_loss: 0.2629, test_loss: 1.2179, test_f1: 0.6586
 epoch: 68, train_loss: 0.2607, test_loss: 1.2574, test_f1: 0.6613
 epoch: 69, train_loss: 0.2303, test_loss: 1.2986, test_f1: 0.6409
 epoch: 70, train_loss: 0.2599, test_loss: 1.1954, test_f1: 0.6534
 epoch: 71, train_loss: 0.2718, test_loss: 1.2583, test_f1: 0.6603
 epoch: 72, train_loss: 0.2657, test_loss: 1.2911, test_f1: 0.6664
 epoch: 73, train_loss: 0.2713, test_loss: 1.2467, test_f1: 0.6480
 epoch: 74, train_loss: 0.2538, test_loss: 1.2023, test_f1: 0.6645
 epoch: 75, train_loss: 0.2443, test_loss: 1.2530, test_f1: 0.6486
 epoch: 76, train_loss: 0.2414, test_loss: 1.2199, test_f1: 0.6646
 epoch: 77, train_loss: 0.2431, test_loss: 1.3044, test_f1: 0.6551
 epoch: 78, train_loss: 0.2461, test_loss: 1.2773, test_f1: 0.6704
 epoch: 79, train_loss: 0.2388, test_loss: 1.4288, test_f1: 0.6562
 epoch: 80, train_loss: 0.2415, test_loss: 1.1954, test_f1: 0.6924
 epoch: 81, train_loss: 0.2172, test_loss: 1.3628, test_f1: 0.6523
 epoch: 82, train_loss: 0.2135, test_loss: 1.3726, test_f1: 0.6576
 epoch: 83, train_loss: 0.2209, test_loss: 1.3362, test_f1: 0.6881
 epoch: 84, train_loss: 0.2017, test_loss: 1.3498, test_f1: 0.6670
 epoch: 85, train_loss: 0.2031, test_loss: 1.3209, test_f1: 0.6952
 epoch: 86, train_loss: 0.2365, test_loss: 1.4763, test_f1: 0.6277
 epoch: 87, train_loss: 0.2252, test_loss: 1.4032, test_f1: 0.6607
 epoch: 88, train_loss: 0.1957, test_loss: 1.3757, test_f1: 0.6667
 epoch: 89, train_loss: 0.2219, test_loss: 1.3152, test_f1: 0.6958
 epoch: 90, train_loss: 0.1993, test_loss: 1.3153, test_f1: 0.6827
 epoch: 91, train_loss: 0.2194, test_loss: 1.2902, test_f1: 0.6692
 epoch: 92, train_loss: 0.1991, test_loss: 1.6465, test_f1: 0.6559
 epoch: 93, train_loss: 0.2028, test_loss: 1.3457, test_f1: 0.6867
 epoch: 94, train_loss: 0.2051, test_loss: 1.5353, test_f1: 0.6672
 epoch: 95, train_loss: 0.2091, test_loss: 1.3653, test_f1: 0.6594
 epoch: 96, train_loss: 0.2179, test_loss: 1.3523, test_f1: 0.6695
 epoch: 97, train_loss: 0.2159, test_loss: 1.5538, test_f1: 0.6446
 epoch: 98, train_loss: 0.2042, test_loss: 1.4805, test_f1: 0.6493
 epoch: 99, train_loss: 0.1939, test_loss: 1.4581, test_f1: 0.6492
##################ITERATION #9 ****************************************
 epoch: 0, train_loss: 1.5378, test_loss: 1.4402, test_f1: 0.2262
 epoch: 1, train_loss: 0.9955, test_loss: 1.0405, test_f1: 0.4897
 epoch: 2, train_loss: 0.9437, test_loss: 0.9764, test_f1: 0.5264
 epoch: 3, train_loss: 0.9068, test_loss: 0.9620, test_f1: 0.5022
 epoch: 4, train_loss: 0.8831, test_loss: 0.9259, test_f1: 0.5637
 epoch: 5, train_loss: 0.8500, test_loss: 1.0213, test_f1: 0.5192
 epoch: 6, train_loss: 0.8218, test_loss: 0.8701, test_f1: 0.5458
 epoch: 7, train_loss: 0.7968, test_loss: 0.9357, test_f1: 0.4976
 epoch: 8, train_loss: 0.7755, test_loss: 0.8884, test_f1: 0.5945
 epoch: 9, train_loss: 0.7568, test_loss: 0.8989, test_f1: 0.5907
 epoch: 10, train_loss: 0.7348, test_loss: 0.8414, test_f1: 0.6069
 epoch: 11, train_loss: 0.7219, test_loss: 0.8466, test_f1: 0.6143
 epoch: 12, train_loss: 0.6995, test_loss: 0.9388, test_f1: 0.5922
 epoch: 13, train_loss: 0.6915, test_loss: 0.9177, test_f1: 0.5956
 epoch: 14, train_loss: 0.6732, test_loss: 0.9594, test_f1: 0.6047
 epoch: 15, train_loss: 0.6634, test_loss: 0.9389, test_f1: 0.5938
 epoch: 16, train_loss: 0.6559, test_loss: 0.8509, test_f1: 0.6058
 epoch: 17, train_loss: 0.6384, test_loss: 1.0785, test_f1: 0.5945
 epoch: 18, train_loss: 0.6187, test_loss: 0.8335, test_f1: 0.6340
 epoch: 19, train_loss: 0.6171, test_loss: 1.0981, test_f1: 0.5799
 epoch: 20, train_loss: 0.6153, test_loss: 0.9341, test_f1: 0.5733
 epoch: 21, train_loss: 0.6072, test_loss: 0.8622, test_f1: 0.6687
 epoch: 22, train_loss: 0.5723, test_loss: 0.8050, test_f1: 0.6521
 epoch: 23, train_loss: 0.5895, test_loss: 0.8395, test_f1: 0.6490
 epoch: 24, train_loss: 0.5611, test_loss: 0.8281, test_f1: 0.6634
 epoch: 25, train_loss: 0.5456, test_loss: 0.9271, test_f1: 0.6349
 epoch: 26, train_loss: 0.5362, test_loss: 0.8865, test_f1: 0.6542
 epoch: 27, train_loss: 0.5408, test_loss: 0.8343, test_f1: 0.6470
 epoch: 28, train_loss: 0.5178, test_loss: 0.8708, test_f1: 0.6495
 epoch: 29, train_loss: 0.5069, test_loss: 0.9204, test_f1: 0.6503
 epoch: 30, train_loss: 0.5140, test_loss: 0.9694, test_f1: 0.6388
 epoch: 31, train_loss: 0.5245, test_loss: 0.8876, test_f1: 0.6623
 epoch: 32, train_loss: 0.4826, test_loss: 0.9574, test_f1: 0.6407
 epoch: 33, train_loss: 0.4864, test_loss: 0.8811, test_f1: 0.6728
 epoch: 34, train_loss: 0.4985, test_loss: 1.0675, test_f1: 0.6410
 epoch: 35, train_loss: 0.4675, test_loss: 1.0278, test_f1: 0.6201
 epoch: 36, train_loss: 0.4591, test_loss: 1.0361, test_f1: 0.6536
 epoch: 37, train_loss: 0.4477, test_loss: 1.0277, test_f1: 0.6538
 epoch: 38, train_loss: 0.4495, test_loss: 1.0468, test_f1: 0.6462
 epoch: 39, train_loss: 0.4455, test_loss: 0.9679, test_f1: 0.6615
 epoch: 40, train_loss: 0.4451, test_loss: 1.1457, test_f1: 0.6236
 epoch: 41, train_loss: 0.4379, test_loss: 0.9899, test_f1: 0.6787
 epoch: 42, train_loss: 0.4348, test_loss: 0.9771, test_f1: 0.6651
 epoch: 43, train_loss: 0.4255, test_loss: 0.9004, test_f1: 0.6901
 epoch: 44, train_loss: 0.4075, test_loss: 0.9138, test_f1: 0.6554
 epoch: 45, train_loss: 0.3954, test_loss: 1.0227, test_f1: 0.6657
 epoch: 46, train_loss: 0.4028, test_loss: 1.0139, test_f1: 0.6616
 epoch: 47, train_loss: 0.3819, test_loss: 1.1047, test_f1: 0.6348
 epoch: 48, train_loss: 0.3918, test_loss: 0.9967, test_f1: 0.6409
 epoch: 49, train_loss: 0.3870, test_loss: 1.0900, test_f1: 0.6656
 epoch: 50, train_loss: 0.3741, test_loss: 1.0463, test_f1: 0.6740
 epoch: 51, train_loss: 0.3544, test_loss: 1.0167, test_f1: 0.6749
 epoch: 52, train_loss: 0.3281, test_loss: 1.0236, test_f1: 0.6980
 epoch: 53, train_loss: 0.2885, test_loss: 1.0972, test_f1: 0.6705
 epoch: 54, train_loss: 0.2836, test_loss: 1.0597, test_f1: 0.6655
 epoch: 55, train_loss: 0.2892, test_loss: 1.1446, test_f1: 0.6771
 epoch: 56, train_loss: 0.2774, test_loss: 1.2419, test_f1: 0.7048
 epoch: 57, train_loss: 0.2850, test_loss: 1.1339, test_f1: 0.7012
 epoch: 58, train_loss: 0.2774, test_loss: 1.2160, test_f1: 0.6741
 epoch: 59, train_loss: 0.2796, test_loss: 1.2068, test_f1: 0.6888
 epoch: 60, train_loss: 0.2677, test_loss: 1.1784, test_f1: 0.6712
 epoch: 61, train_loss: 0.2809, test_loss: 1.1175, test_f1: 0.6753
 epoch: 62, train_loss: 0.2698, test_loss: 1.1950, test_f1: 0.6898
 epoch: 63, train_loss: 0.2482, test_loss: 1.2391, test_f1: 0.6835
 epoch: 64, train_loss: 0.2406, test_loss: 1.1906, test_f1: 0.6609
 epoch: 65, train_loss: 0.2587, test_loss: 1.2402, test_f1: 0.6761
 epoch: 66, train_loss: 0.2521, test_loss: 1.5209, test_f1: 0.6773
 epoch: 67, train_loss: 0.2496, test_loss: 1.1247, test_f1: 0.7067
 epoch: 68, train_loss: 0.2449, test_loss: 1.3990, test_f1: 0.6966
 epoch: 69, train_loss: 0.2420, test_loss: 1.1967, test_f1: 0.6830
 epoch: 70, train_loss: 0.2216, test_loss: 1.4017, test_f1: 0.6924
 epoch: 71, train_loss: 0.2185, test_loss: 1.4235, test_f1: 0.7047
 epoch: 72, train_loss: 0.2272, test_loss: 1.4583, test_f1: 0.6890
 epoch: 73, train_loss: 0.2337, test_loss: 1.3664, test_f1: 0.6596
 epoch: 74, train_loss: 0.2487, test_loss: 1.2849, test_f1: 0.6816
 epoch: 75, train_loss: 0.2226, test_loss: 1.3056, test_f1: 0.6644
 epoch: 76, train_loss: 0.2319, test_loss: 1.2540, test_f1: 0.6874
 epoch: 77, train_loss: 0.2149, test_loss: 1.3598, test_f1: 0.6848
 epoch: 78, train_loss: 0.2095, test_loss: 1.4951, test_f1: 0.6822
 epoch: 79, train_loss: 0.2172, test_loss: 1.4675, test_f1: 0.6447
 epoch: 80, train_loss: 0.2306, test_loss: 1.4947, test_f1: 0.6686
 epoch: 81, train_loss: 0.2180, test_loss: 1.3252, test_f1: 0.6774
 epoch: 82, train_loss: 0.2257, test_loss: 1.2422, test_f1: 0.6836
 epoch: 83, train_loss: 0.2294, test_loss: 1.4014, test_f1: 0.6935
 epoch: 84, train_loss: 0.2074, test_loss: 1.5394, test_f1: 0.6802
 epoch: 85, train_loss: 0.2096, test_loss: 1.4777, test_f1: 0.7026
 epoch: 86, train_loss: 0.2085, test_loss: 1.4803, test_f1: 0.6758
 epoch: 87, train_loss: 0.1907, test_loss: 1.4953, test_f1: 0.6926
 epoch: 88, train_loss: 0.1863, test_loss: 1.9323, test_f1: 0.6513
 epoch: 89, train_loss: 0.1900, test_loss: 1.5148, test_f1: 0.6568
 epoch: 90, train_loss: 0.1933, test_loss: 1.6092, test_f1: 0.6875
 epoch: 91, train_loss: 0.2012, test_loss: 1.4982, test_f1: 0.6994
 epoch: 92, train_loss: 0.1944, test_loss: 1.6761, test_f1: 0.6755
 epoch: 93, train_loss: 0.1942, test_loss: 1.5585, test_f1: 0.6912
 epoch: 94, train_loss: 0.1835, test_loss: 1.7529, test_f1: 0.6775
 epoch: 95, train_loss: 0.1876, test_loss: 1.5471, test_f1: 0.6770
 epoch: 96, train_loss: 0.1824, test_loss: 1.6807, test_f1: 0.6879
 epoch: 97, train_loss: 0.1598, test_loss: 1.6212, test_f1: 0.6912
 epoch: 98, train_loss: 0.1708, test_loss: 1.6689, test_f1: 0.6749
 epoch: 99, train_loss: 0.1533, test_loss: 1.7251, test_f1: 0.6793

Training completed in 477.08 seconds
Best F1: 0.7163 at epoch 57
Mean F1 across iterations: 0.6968  0.0135
========================FINAL RESULTS================================
FEGIN weighted F1: 0.7163  0.0135
python main.py --data ltspice_examples --representation component_pin --model FEGIN --layers 2 --hiddens 128 --batch_size 128 --lr 0.001 --emb_size 250 --epochs 100 --save_appendix component_pin_L2_H128_BS128_LR0.001_E250 --no_val
-----



STDERR:
  File "main.py", line 370, in <module>
    main()
  File "main.py", line 254, in main
    dataset = dataset_class(
  File "/home/philip/projects/ltspice_examples_code_repo/Circuit-Completion-Using-GNNs/component_classification_with_link_prediction_head/evaluation/FEGIN/kernel/circuit_datasets.py", line 15, in __init__
    self.data, self.slices = torch.load(self.processed_paths[0])
  File "/home/philip/.local/lib/python3.8/site-packages/torch/serialization.py", line 1040, in load
    warnings.warn(
  File "/usr/lib/python3.8/warnings.py", line 109, in _showwarnmsg
    sw(msg.message, msg.category, msg.filename, msg.lineno,
  File "main.py", line 47, in warn_with_traceback
    traceback.print_stack(file=log)
/home/philip/projects/ltspice_examples_code_repo/Circuit-Completion-Using-GNNs/component_classification_with_link_prediction_head/evaluation/FEGIN/kernel/circuit_datasets.py:15: FutureWarning: You are using `torch.load` with `weights_only=False` (the current default value), which uses the default pickle module implicitly. It is possible to construct malicious pickle data which will execute arbitrary code during unpickling (See https://github.com/pytorch/pytorch/blob/main/SECURITY.md#untrusted-models for more details). In a future release, the default value for `weights_only` will be flipped to `True`. This limits the functions that could be executed during unpickling. Arbitrary objects will no longer be allowed to be loaded via this mode unless they are explicitly allowlisted by the user via `torch.serialization.add_safe_globals`. We recommend you start setting `weights_only=True` for any use case where you don't have full control of the loaded file. Please open an issue on GitHub for any issues related to this experimental feature.
  self.data, self.slices = torch.load(self.processed_paths[0])
