STDOUT:
Results will be saved in /home/philip/projects/ltspice_examples_code_repo/Circuit-Completion-Using-GNNs/component_classification_with_link_prediction_head/evaluation/FEGIN/results/model_FEGIN_dataset_ltspice_demos
Command line input: python main.py --data ltspice_demos --representation component_net --model FEGIN --layers 5 --hiddens 128 --batch_size 64 --lr 0.001 --emb_size 250 --epochs 100 --save_appendix component_net_L5_H128_BS64_LR0.001_E250 --no_val
 is saved.
-----
ltspice_demos - FEGIN
Using 5 layers, 128 hidden units, h = 2
Loading component_net representation dataset
ENTERED
Training FEGIN on component_net representation
Train: 1565, Test: 383
##################ITERATION #0 ****************************************
 epoch: 0, train_loss: 1.2171, test_loss: 1.3069, test_f1: 0.2583
 epoch: 1, train_loss: 1.1063, test_loss: 1.1429, test_f1: 0.4217
 epoch: 2, train_loss: 1.0285, test_loss: 1.1781, test_f1: 0.5070
 epoch: 3, train_loss: 0.9710, test_loss: 1.2083, test_f1: 0.4971
 epoch: 4, train_loss: 0.9102, test_loss: 1.0993, test_f1: 0.4887
 epoch: 5, train_loss: 0.8951, test_loss: 1.0352, test_f1: 0.5967
 epoch: 6, train_loss: 0.8636, test_loss: 1.0565, test_f1: 0.5816
 epoch: 7, train_loss: 0.8729, test_loss: 1.0138, test_f1: 0.5864
 epoch: 8, train_loss: 0.8462, test_loss: 1.0522, test_f1: 0.5771
 epoch: 9, train_loss: 0.8006, test_loss: 1.0675, test_f1: 0.5833
 epoch: 10, train_loss: 0.7876, test_loss: 1.0799, test_f1: 0.5891
 epoch: 11, train_loss: 0.7837, test_loss: 1.1212, test_f1: 0.5252
 epoch: 12, train_loss: 0.7619, test_loss: 1.1913, test_f1: 0.5598
 epoch: 13, train_loss: 0.7679, test_loss: 1.2254, test_f1: 0.5439
 epoch: 14, train_loss: 0.7496, test_loss: 1.1717, test_f1: 0.5798
 epoch: 15, train_loss: 0.7228, test_loss: 1.1491, test_f1: 0.6184
 epoch: 16, train_loss: 0.7137, test_loss: 1.2483, test_f1: 0.6392
 epoch: 17, train_loss: 0.6766, test_loss: 1.4108, test_f1: 0.5033
 epoch: 18, train_loss: 0.6795, test_loss: 1.3273, test_f1: 0.5961
 epoch: 19, train_loss: 0.6821, test_loss: 1.3247, test_f1: 0.6152
 epoch: 20, train_loss: 0.6437, test_loss: 1.3000, test_f1: 0.5851
 epoch: 21, train_loss: 0.6686, test_loss: 1.4243, test_f1: 0.5731
 epoch: 22, train_loss: 0.6209, test_loss: 1.5322, test_f1: 0.5984
 epoch: 23, train_loss: 0.6105, test_loss: 1.6332, test_f1: 0.5903
 epoch: 24, train_loss: 0.5842, test_loss: 1.4908, test_f1: 0.6400
 epoch: 25, train_loss: 0.5516, test_loss: 1.6312, test_f1: 0.5713
 epoch: 26, train_loss: 0.5563, test_loss: 1.5047, test_f1: 0.5953
 epoch: 27, train_loss: 0.5410, test_loss: 1.7858, test_f1: 0.5556
 epoch: 28, train_loss: 0.5373, test_loss: 1.7376, test_f1: 0.5761
 epoch: 29, train_loss: 0.5231, test_loss: 1.6702, test_f1: 0.5449
 epoch: 30, train_loss: 0.5397, test_loss: 1.5777, test_f1: 0.5967
 epoch: 31, train_loss: 0.5197, test_loss: 1.8214, test_f1: 0.5741
 epoch: 32, train_loss: 0.5293, test_loss: 1.8357, test_f1: 0.5766
 epoch: 33, train_loss: 0.4640, test_loss: 1.6073, test_f1: 0.6015
 epoch: 34, train_loss: 0.4656, test_loss: 1.9682, test_f1: 0.5540
 epoch: 35, train_loss: 0.4949, test_loss: 1.7956, test_f1: 0.5511
 epoch: 36, train_loss: 0.5043, test_loss: 1.6759, test_f1: 0.6206
 epoch: 37, train_loss: 0.4596, test_loss: 2.0648, test_f1: 0.5708
 epoch: 38, train_loss: 0.4769, test_loss: 1.7080, test_f1: 0.6133
 epoch: 39, train_loss: 0.4480, test_loss: 2.0347, test_f1: 0.5579
 epoch: 40, train_loss: 0.4204, test_loss: 2.0175, test_f1: 0.5985
 epoch: 41, train_loss: 0.3896, test_loss: 2.3621, test_f1: 0.5486
 epoch: 42, train_loss: 0.4097, test_loss: 2.0897, test_f1: 0.5818
 epoch: 43, train_loss: 0.3984, test_loss: 2.0453, test_f1: 0.5825
 epoch: 44, train_loss: 0.3670, test_loss: 1.9297, test_f1: 0.6096
 epoch: 45, train_loss: 0.3748, test_loss: 2.4437, test_f1: 0.5821
 epoch: 46, train_loss: 0.3729, test_loss: 2.1118, test_f1: 0.6222
 epoch: 47, train_loss: 0.3874, test_loss: 2.1365, test_f1: 0.6229
 epoch: 48, train_loss: 0.3655, test_loss: 2.5246, test_f1: 0.5737
 epoch: 49, train_loss: 0.3948, test_loss: 2.3208, test_f1: 0.6143
 epoch: 50, train_loss: 0.3211, test_loss: 2.4661, test_f1: 0.5932
 epoch: 51, train_loss: 0.2900, test_loss: 2.6052, test_f1: 0.5989
 epoch: 52, train_loss: 0.2833, test_loss: 2.5975, test_f1: 0.6047
 epoch: 53, train_loss: 0.2550, test_loss: 2.7432, test_f1: 0.6099
 epoch: 54, train_loss: 0.2595, test_loss: 2.6733, test_f1: 0.6095
 epoch: 55, train_loss: 0.2435, test_loss: 2.8299, test_f1: 0.6057
 epoch: 56, train_loss: 0.2322, test_loss: 2.9104, test_f1: 0.5810
 epoch: 57, train_loss: 0.2352, test_loss: 3.2713, test_f1: 0.6000
 epoch: 58, train_loss: 0.2473, test_loss: 2.6892, test_f1: 0.6111
 epoch: 59, train_loss: 0.2542, test_loss: 3.0426, test_f1: 0.5995
 epoch: 60, train_loss: 0.2128, test_loss: 2.8837, test_f1: 0.6539
 epoch: 61, train_loss: 0.2166, test_loss: 3.1053, test_f1: 0.6192
 epoch: 62, train_loss: 0.2243, test_loss: 3.2114, test_f1: 0.5906
 epoch: 63, train_loss: 0.2206, test_loss: 2.9475, test_f1: 0.6243
 epoch: 64, train_loss: 0.2086, test_loss: 3.3282, test_f1: 0.6063
 epoch: 65, train_loss: 0.2011, test_loss: 2.9097, test_f1: 0.6198
 epoch: 66, train_loss: 0.2157, test_loss: 3.0981, test_f1: 0.6264
 epoch: 67, train_loss: 0.1997, test_loss: 3.1334, test_f1: 0.5855
 epoch: 68, train_loss: 0.1845, test_loss: 3.5646, test_f1: 0.5920
 epoch: 69, train_loss: 0.1938, test_loss: 3.2436, test_f1: 0.6261
 epoch: 70, train_loss: 0.1737, test_loss: 3.2278, test_f1: 0.6148
 epoch: 71, train_loss: 0.1684, test_loss: 3.4510, test_f1: 0.6033
 epoch: 72, train_loss: 0.1495, test_loss: 3.6618, test_f1: 0.6208
 epoch: 73, train_loss: 0.1602, test_loss: 3.7583, test_f1: 0.6039
 epoch: 74, train_loss: 0.1579, test_loss: 3.7844, test_f1: 0.5978
 epoch: 75, train_loss: 0.1812, test_loss: 3.2741, test_f1: 0.6382
 epoch: 76, train_loss: 0.2289, test_loss: 3.4565, test_f1: 0.6148
 epoch: 77, train_loss: 0.2183, test_loss: 3.4335, test_f1: 0.6104
 epoch: 78, train_loss: 0.1946, test_loss: 3.6693, test_f1: 0.5992
 epoch: 79, train_loss: 0.1733, test_loss: 3.6403, test_f1: 0.5876
 epoch: 80, train_loss: 0.1932, test_loss: 3.6749, test_f1: 0.6000
 epoch: 81, train_loss: 0.1776, test_loss: 3.6217, test_f1: 0.5854
 epoch: 82, train_loss: 0.1821, test_loss: 3.6588, test_f1: 0.6020
 epoch: 83, train_loss: 0.1496, test_loss: 3.5968, test_f1: 0.6272
 epoch: 84, train_loss: 0.1666, test_loss: 3.6919, test_f1: 0.5922
 epoch: 85, train_loss: 0.1646, test_loss: 3.6186, test_f1: 0.5988
 epoch: 86, train_loss: 0.1688, test_loss: 3.9364, test_f1: 0.6252
 epoch: 87, train_loss: 0.1525, test_loss: 3.8151, test_f1: 0.6076
 epoch: 88, train_loss: 0.1289, test_loss: 3.5673, test_f1: 0.6234
 epoch: 89, train_loss: 0.1608, test_loss: 3.9436, test_f1: 0.5935
 epoch: 90, train_loss: 0.1354, test_loss: 3.6615, test_f1: 0.6352
 epoch: 91, train_loss: 0.1541, test_loss: 3.8518, test_f1: 0.6176
 epoch: 92, train_loss: 0.1535, test_loss: 4.2110, test_f1: 0.5937
 epoch: 93, train_loss: 0.1415, test_loss: 3.8193, test_f1: 0.6070
 epoch: 94, train_loss: 0.1545, test_loss: 4.4750, test_f1: 0.5812
 epoch: 95, train_loss: 0.1434, test_loss: 4.0411, test_f1: 0.6050
 epoch: 96, train_loss: 0.1058, test_loss: 4.1763, test_f1: 0.6084
 epoch: 97, train_loss: 0.1178, test_loss: 4.2932, test_f1: 0.5897
 epoch: 98, train_loss: 0.1365, test_loss: 4.1910, test_f1: 0.5819
 epoch: 99, train_loss: 0.1492, test_loss: 4.1099, test_f1: 0.6246
##################ITERATION #1 ****************************************
 epoch: 0, train_loss: 1.1439, test_loss: 1.2517, test_f1: 0.2281
 epoch: 1, train_loss: 1.0066, test_loss: 1.0850, test_f1: 0.4983
 epoch: 2, train_loss: 0.9771, test_loss: 1.0647, test_f1: 0.5075
 epoch: 3, train_loss: 0.9317, test_loss: 1.0417, test_f1: 0.5785
 epoch: 4, train_loss: 0.9070, test_loss: 1.1375, test_f1: 0.5479
 epoch: 5, train_loss: 0.8720, test_loss: 1.1873, test_f1: 0.5310
 epoch: 6, train_loss: 0.8401, test_loss: 1.0875, test_f1: 0.5528
 epoch: 7, train_loss: 0.8657, test_loss: 1.1627, test_f1: 0.5071
 epoch: 8, train_loss: 0.8372, test_loss: 1.0649, test_f1: 0.5582
 epoch: 9, train_loss: 0.8019, test_loss: 1.2282, test_f1: 0.5632
 epoch: 10, train_loss: 0.7996, test_loss: 1.1943, test_f1: 0.5729
 epoch: 11, train_loss: 0.7836, test_loss: 1.1838, test_f1: 0.5899
 epoch: 12, train_loss: 0.7182, test_loss: 1.2019, test_f1: 0.6029
 epoch: 13, train_loss: 0.7777, test_loss: 1.2679, test_f1: 0.5706
 epoch: 14, train_loss: 0.7738, test_loss: 1.1773, test_f1: 0.5413
 epoch: 15, train_loss: 0.7198, test_loss: 1.3426, test_f1: 0.5811
 epoch: 16, train_loss: 0.7049, test_loss: 1.2778, test_f1: 0.5986
 epoch: 17, train_loss: 0.6901, test_loss: 1.3441, test_f1: 0.5566
 epoch: 18, train_loss: 0.6424, test_loss: 1.3174, test_f1: 0.5881
 epoch: 19, train_loss: 0.6667, test_loss: 1.3005, test_f1: 0.5852
 epoch: 20, train_loss: 0.6309, test_loss: 1.3700, test_f1: 0.5537
 epoch: 21, train_loss: 0.5996, test_loss: 1.2905, test_f1: 0.6177
 epoch: 22, train_loss: 0.5920, test_loss: 1.4525, test_f1: 0.5939
 epoch: 23, train_loss: 0.6068, test_loss: 1.3997, test_f1: 0.5813
 epoch: 24, train_loss: 0.5932, test_loss: 1.4870, test_f1: 0.6155
 epoch: 25, train_loss: 0.6349, test_loss: 1.3700, test_f1: 0.6099
 epoch: 26, train_loss: 0.6076, test_loss: 1.3848, test_f1: 0.6006
 epoch: 27, train_loss: 0.5670, test_loss: 1.3981, test_f1: 0.5686
 epoch: 28, train_loss: 0.5636, test_loss: 1.3843, test_f1: 0.5907
 epoch: 29, train_loss: 0.5482, test_loss: 1.5527, test_f1: 0.6116
 epoch: 30, train_loss: 0.5065, test_loss: 1.5841, test_f1: 0.5541
 epoch: 31, train_loss: 0.5207, test_loss: 1.8705, test_f1: 0.5372
 epoch: 32, train_loss: 0.5190, test_loss: 1.6497, test_f1: 0.5167
 epoch: 33, train_loss: 0.5443, test_loss: 1.7722, test_f1: 0.5355
 epoch: 34, train_loss: 0.4857, test_loss: 1.8154, test_f1: 0.5843
 epoch: 35, train_loss: 0.4780, test_loss: 1.6064, test_f1: 0.5840
 epoch: 36, train_loss: 0.4566, test_loss: 1.9626, test_f1: 0.5671
 epoch: 37, train_loss: 0.4713, test_loss: 1.6725, test_f1: 0.6003
 epoch: 38, train_loss: 0.4835, test_loss: 1.8512, test_f1: 0.6109
 epoch: 39, train_loss: 0.4828, test_loss: 1.7236, test_f1: 0.6033
 epoch: 40, train_loss: 0.4410, test_loss: 2.0962, test_f1: 0.5936
 epoch: 41, train_loss: 0.4502, test_loss: 1.7732, test_f1: 0.6022
 epoch: 42, train_loss: 0.4340, test_loss: 2.0392, test_f1: 0.6220
 epoch: 43, train_loss: 0.4178, test_loss: 1.9306, test_f1: 0.5985
 epoch: 44, train_loss: 0.4248, test_loss: 1.9918, test_f1: 0.5495
 epoch: 45, train_loss: 0.3877, test_loss: 2.2121, test_f1: 0.5970
 epoch: 46, train_loss: 0.4005, test_loss: 1.9432, test_f1: 0.6158
 epoch: 47, train_loss: 0.3746, test_loss: 2.3545, test_f1: 0.5911
 epoch: 48, train_loss: 0.4242, test_loss: 2.0745, test_f1: 0.5855
 epoch: 49, train_loss: 0.4026, test_loss: 2.3697, test_f1: 0.4985
 epoch: 50, train_loss: 0.3655, test_loss: 2.0699, test_f1: 0.5777
 epoch: 51, train_loss: 0.3783, test_loss: 2.0820, test_f1: 0.6277
 epoch: 52, train_loss: 0.3211, test_loss: 2.1429, test_f1: 0.6345
 epoch: 53, train_loss: 0.2853, test_loss: 2.1792, test_f1: 0.5912
 epoch: 54, train_loss: 0.2930, test_loss: 2.2604, test_f1: 0.6032
 epoch: 55, train_loss: 0.2923, test_loss: 2.5207, test_f1: 0.5998
 epoch: 56, train_loss: 0.2740, test_loss: 2.2633, test_f1: 0.6017
 epoch: 57, train_loss: 0.2875, test_loss: 2.4208, test_f1: 0.6088
 epoch: 58, train_loss: 0.2926, test_loss: 2.5630, test_f1: 0.6064
 epoch: 59, train_loss: 0.2576, test_loss: 2.6186, test_f1: 0.6034
 epoch: 60, train_loss: 0.2551, test_loss: 2.4169, test_f1: 0.5860
 epoch: 61, train_loss: 0.2592, test_loss: 2.7374, test_f1: 0.6039
 epoch: 62, train_loss: 0.2464, test_loss: 2.5773, test_f1: 0.5541
 epoch: 63, train_loss: 0.2526, test_loss: 3.1457, test_f1: 0.5846
 epoch: 64, train_loss: 0.2512, test_loss: 2.5038, test_f1: 0.5912
 epoch: 65, train_loss: 0.2314, test_loss: 2.6420, test_f1: 0.6182
 epoch: 66, train_loss: 0.2243, test_loss: 2.8948, test_f1: 0.6067
 epoch: 67, train_loss: 0.2458, test_loss: 2.7937, test_f1: 0.6071
 epoch: 68, train_loss: 0.2551, test_loss: 2.7403, test_f1: 0.5831
 epoch: 69, train_loss: 0.2151, test_loss: 2.9649, test_f1: 0.6164
 epoch: 70, train_loss: 0.2376, test_loss: 3.0793, test_f1: 0.5633
 epoch: 71, train_loss: 0.2349, test_loss: 2.7253, test_f1: 0.6140
 epoch: 72, train_loss: 0.2156, test_loss: 3.0272, test_f1: 0.5595
 epoch: 73, train_loss: 0.1981, test_loss: 3.1022, test_f1: 0.5786
 epoch: 74, train_loss: 0.1991, test_loss: 3.2197, test_f1: 0.5988
 epoch: 75, train_loss: 0.2126, test_loss: 3.5570, test_f1: 0.5797
 epoch: 76, train_loss: 0.2266, test_loss: 3.4112, test_f1: 0.5732
 epoch: 77, train_loss: 0.2047, test_loss: 3.0688, test_f1: 0.5809
 epoch: 78, train_loss: 0.1968, test_loss: 3.2400, test_f1: 0.5618
 epoch: 79, train_loss: 0.2256, test_loss: 3.2928, test_f1: 0.5967
 epoch: 80, train_loss: 0.2330, test_loss: 2.9458, test_f1: 0.5737
 epoch: 81, train_loss: 0.1964, test_loss: 3.3089, test_f1: 0.5572
 epoch: 82, train_loss: 0.1994, test_loss: 3.1462, test_f1: 0.5914
 epoch: 83, train_loss: 0.2391, test_loss: 3.1724, test_f1: 0.5627
 epoch: 84, train_loss: 0.2109, test_loss: 2.6907, test_f1: 0.6144
 epoch: 85, train_loss: 0.1779, test_loss: 3.1262, test_f1: 0.5780
 epoch: 86, train_loss: 0.2007, test_loss: 3.3451, test_f1: 0.5571
 epoch: 87, train_loss: 0.1872, test_loss: 2.9594, test_f1: 0.5831
 epoch: 88, train_loss: 0.1650, test_loss: 3.3064, test_f1: 0.5988
 epoch: 89, train_loss: 0.1494, test_loss: 3.3572, test_f1: 0.5908
 epoch: 90, train_loss: 0.1698, test_loss: 3.8241, test_f1: 0.5639
 epoch: 91, train_loss: 0.1656, test_loss: 3.4428, test_f1: 0.5693
 epoch: 92, train_loss: 0.1876, test_loss: 3.5119, test_f1: 0.5669
 epoch: 93, train_loss: 0.1585, test_loss: 3.7752, test_f1: 0.5781
 epoch: 94, train_loss: 0.1867, test_loss: 3.7682, test_f1: 0.5569
 epoch: 95, train_loss: 0.1948, test_loss: 3.6988, test_f1: 0.5818
 epoch: 96, train_loss: 0.1745, test_loss: 3.5317, test_f1: 0.5994
 epoch: 97, train_loss: 0.1506, test_loss: 3.5107, test_f1: 0.5910
 epoch: 98, train_loss: 0.1467, test_loss: 3.4411, test_f1: 0.5929
 epoch: 99, train_loss: 0.1448, test_loss: 3.7094, test_f1: 0.5878
##################ITERATION #2 ****************************************
 epoch: 0, train_loss: 1.1613, test_loss: 1.2008, test_f1: 0.4344
 epoch: 1, train_loss: 1.0209, test_loss: 1.0856, test_f1: 0.5036
 epoch: 2, train_loss: 0.9538, test_loss: 1.0283, test_f1: 0.5672
 epoch: 3, train_loss: 0.9277, test_loss: 1.0408, test_f1: 0.5322
 epoch: 4, train_loss: 0.9084, test_loss: 1.1042, test_f1: 0.5474
 epoch: 5, train_loss: 0.8662, test_loss: 1.0687, test_f1: 0.5479
 epoch: 6, train_loss: 0.8588, test_loss: 1.0623, test_f1: 0.5557
 epoch: 7, train_loss: 0.8604, test_loss: 1.0573, test_f1: 0.5744
 epoch: 8, train_loss: 0.8396, test_loss: 1.0603, test_f1: 0.5656
 epoch: 9, train_loss: 0.8141, test_loss: 1.1302, test_f1: 0.5975
 epoch: 10, train_loss: 0.7997, test_loss: 1.0961, test_f1: 0.5808
 epoch: 11, train_loss: 0.7717, test_loss: 1.2627, test_f1: 0.5782
 epoch: 12, train_loss: 0.7705, test_loss: 1.3026, test_f1: 0.5453
 epoch: 13, train_loss: 0.7740, test_loss: 1.2275, test_f1: 0.5513
 epoch: 14, train_loss: 0.7516, test_loss: 1.2569, test_f1: 0.6027
 epoch: 15, train_loss: 0.7108, test_loss: 1.2773, test_f1: 0.6301
 epoch: 16, train_loss: 0.7178, test_loss: 1.2251, test_f1: 0.5824
 epoch: 17, train_loss: 0.7094, test_loss: 1.4450, test_f1: 0.5837
 epoch: 18, train_loss: 0.6752, test_loss: 1.5091, test_f1: 0.4717
 epoch: 19, train_loss: 0.6480, test_loss: 1.3912, test_f1: 0.5880
 epoch: 20, train_loss: 0.6742, test_loss: 1.3294, test_f1: 0.6211
 epoch: 21, train_loss: 0.6614, test_loss: 1.4430, test_f1: 0.6074
 epoch: 22, train_loss: 0.6401, test_loss: 1.3855, test_f1: 0.6252
 epoch: 23, train_loss: 0.6227, test_loss: 1.6287, test_f1: 0.5683
 epoch: 24, train_loss: 0.5887, test_loss: 1.5666, test_f1: 0.5780
 epoch: 25, train_loss: 0.5678, test_loss: 1.7830, test_f1: 0.5030
 epoch: 26, train_loss: 0.5725, test_loss: 1.5148, test_f1: 0.6039
 epoch: 27, train_loss: 0.5821, test_loss: 1.6401, test_f1: 0.6008
 epoch: 28, train_loss: 0.5527, test_loss: 1.7028, test_f1: 0.5884
 epoch: 29, train_loss: 0.5454, test_loss: 1.7946, test_f1: 0.6382
 epoch: 30, train_loss: 0.5446, test_loss: 1.6414, test_f1: 0.5685
 epoch: 31, train_loss: 0.5212, test_loss: 1.9411, test_f1: 0.5825
 epoch: 32, train_loss: 0.5155, test_loss: 1.8385, test_f1: 0.5827
 epoch: 33, train_loss: 0.5248, test_loss: 1.4636, test_f1: 0.6050
 epoch: 34, train_loss: 0.5054, test_loss: 1.6290, test_f1: 0.5961
 epoch: 35, train_loss: 0.4762, test_loss: 1.8063, test_f1: 0.5986
 epoch: 36, train_loss: 0.4861, test_loss: 2.2156, test_f1: 0.5800
 epoch: 37, train_loss: 0.4696, test_loss: 1.7931, test_f1: 0.5950
 epoch: 38, train_loss: 0.4843, test_loss: 2.0122, test_f1: 0.5930
 epoch: 39, train_loss: 0.4710, test_loss: 1.9581, test_f1: 0.5335
 epoch: 40, train_loss: 0.4655, test_loss: 2.3274, test_f1: 0.5823
 epoch: 41, train_loss: 0.4668, test_loss: 1.7257, test_f1: 0.6138
 epoch: 42, train_loss: 0.4429, test_loss: 1.7741, test_f1: 0.6189
 epoch: 43, train_loss: 0.4011, test_loss: 1.6644, test_f1: 0.6210
 epoch: 44, train_loss: 0.4171, test_loss: 1.8430, test_f1: 0.6001
 epoch: 45, train_loss: 0.4202, test_loss: 1.9035, test_f1: 0.5646
 epoch: 46, train_loss: 0.3797, test_loss: 2.3300, test_f1: 0.5880
 epoch: 47, train_loss: 0.3835, test_loss: 1.9246, test_f1: 0.6172
 epoch: 48, train_loss: 0.4161, test_loss: 2.0592, test_f1: 0.5522
 epoch: 49, train_loss: 0.4841, test_loss: 1.7397, test_f1: 0.5593
 epoch: 50, train_loss: 0.4276, test_loss: 1.8822, test_f1: 0.6241
 epoch: 51, train_loss: 0.3414, test_loss: 2.0794, test_f1: 0.5962
 epoch: 52, train_loss: 0.3229, test_loss: 1.9556, test_f1: 0.6352
 epoch: 53, train_loss: 0.2813, test_loss: 2.1438, test_f1: 0.6187
 epoch: 54, train_loss: 0.2844, test_loss: 2.2312, test_f1: 0.6068
 epoch: 55, train_loss: 0.2735, test_loss: 2.3378, test_f1: 0.5975
 epoch: 56, train_loss: 0.2733, test_loss: 2.3816, test_f1: 0.6190
 epoch: 57, train_loss: 0.2731, test_loss: 2.2368, test_f1: 0.6067
 epoch: 58, train_loss: 0.2810, test_loss: 2.2519, test_f1: 0.6164
 epoch: 59, train_loss: 0.2389, test_loss: 2.3415, test_f1: 0.6304
 epoch: 60, train_loss: 0.2427, test_loss: 2.5120, test_f1: 0.5902
 epoch: 61, train_loss: 0.2593, test_loss: 2.5882, test_f1: 0.6005
 epoch: 62, train_loss: 0.2565, test_loss: 2.6257, test_f1: 0.5964
 epoch: 63, train_loss: 0.2533, test_loss: 2.8518, test_f1: 0.5784
 epoch: 64, train_loss: 0.2380, test_loss: 2.4286, test_f1: 0.5970
 epoch: 65, train_loss: 0.2136, test_loss: 2.8504, test_f1: 0.5963
 epoch: 66, train_loss: 0.2193, test_loss: 2.7643, test_f1: 0.5899
 epoch: 67, train_loss: 0.2200, test_loss: 3.0322, test_f1: 0.5682
 epoch: 68, train_loss: 0.2106, test_loss: 2.8823, test_f1: 0.5801
 epoch: 69, train_loss: 0.2009, test_loss: 3.1684, test_f1: 0.5943
 epoch: 70, train_loss: 0.1988, test_loss: 2.7994, test_f1: 0.5825
 epoch: 71, train_loss: 0.1982, test_loss: 2.8380, test_f1: 0.5928
 epoch: 72, train_loss: 0.2155, test_loss: 2.8099, test_f1: 0.5737
 epoch: 73, train_loss: 0.2184, test_loss: 2.9997, test_f1: 0.5783
 epoch: 74, train_loss: 0.2289, test_loss: 2.8789, test_f1: 0.6119
 epoch: 75, train_loss: 0.2013, test_loss: 2.7294, test_f1: 0.5901
 epoch: 76, train_loss: 0.1849, test_loss: 2.6489, test_f1: 0.5878
 epoch: 77, train_loss: 0.1879, test_loss: 2.9593, test_f1: 0.5751
 epoch: 78, train_loss: 0.1836, test_loss: 3.4126, test_f1: 0.5796
 epoch: 79, train_loss: 0.2203, test_loss: 2.8818, test_f1: 0.5802
 epoch: 80, train_loss: 0.2003, test_loss: 3.3237, test_f1: 0.6014
 epoch: 81, train_loss: 0.2078, test_loss: 2.8137, test_f1: 0.6106
 epoch: 82, train_loss: 0.1878, test_loss: 3.0478, test_f1: 0.6129
 epoch: 83, train_loss: 0.1862, test_loss: 3.5102, test_f1: 0.6012
 epoch: 84, train_loss: 0.1758, test_loss: 3.1864, test_f1: 0.6035
 epoch: 85, train_loss: 0.2021, test_loss: 3.1916, test_f1: 0.5853
 epoch: 86, train_loss: 0.1735, test_loss: 3.2308, test_f1: 0.6136
 epoch: 87, train_loss: 0.2015, test_loss: 3.3505, test_f1: 0.5839
 epoch: 88, train_loss: 0.1743, test_loss: 3.0728, test_f1: 0.5836
 epoch: 89, train_loss: 0.1813, test_loss: 2.9364, test_f1: 0.6203
 epoch: 90, train_loss: 0.2151, test_loss: 3.5102, test_f1: 0.5795
 epoch: 91, train_loss: 0.1744, test_loss: 3.1031, test_f1: 0.6129
 epoch: 92, train_loss: 0.1734, test_loss: 3.8405, test_f1: 0.6096
 epoch: 93, train_loss: 0.1736, test_loss: 2.8953, test_f1: 0.6149
 epoch: 94, train_loss: 0.1724, test_loss: 3.2350, test_f1: 0.6137
 epoch: 95, train_loss: 0.1873, test_loss: 2.8335, test_f1: 0.6030
 epoch: 96, train_loss: 0.1611, test_loss: 3.6021, test_f1: 0.6211
 epoch: 97, train_loss: 0.1517, test_loss: 3.2415, test_f1: 0.6009
 epoch: 98, train_loss: 0.1748, test_loss: 3.5309, test_f1: 0.5771
 epoch: 99, train_loss: 0.1555, test_loss: 3.3123, test_f1: 0.5897
##################ITERATION #3 ****************************************
 epoch: 0, train_loss: 1.2064, test_loss: 1.2604, test_f1: 0.2308
 epoch: 1, train_loss: 1.0608, test_loss: 1.1020, test_f1: 0.4765
 epoch: 2, train_loss: 0.9939, test_loss: 1.0565, test_f1: 0.5298
 epoch: 3, train_loss: 0.9391, test_loss: 1.0502, test_f1: 0.5348
 epoch: 4, train_loss: 0.9005, test_loss: 0.9815, test_f1: 0.5682
 epoch: 5, train_loss: 0.8878, test_loss: 1.0610, test_f1: 0.5601
 epoch: 6, train_loss: 0.8652, test_loss: 1.0689, test_f1: 0.5427
 epoch: 7, train_loss: 0.8615, test_loss: 1.0367, test_f1: 0.5429
 epoch: 8, train_loss: 0.8583, test_loss: 0.9669, test_f1: 0.5840
 epoch: 9, train_loss: 0.8345, test_loss: 1.0736, test_f1: 0.5503
 epoch: 10, train_loss: 0.8127, test_loss: 0.9891, test_f1: 0.5726
 epoch: 11, train_loss: 0.8065, test_loss: 1.1278, test_f1: 0.4956
 epoch: 12, train_loss: 0.7883, test_loss: 1.0700, test_f1: 0.5825
 epoch: 13, train_loss: 0.7611, test_loss: 1.0605, test_f1: 0.5843
 epoch: 14, train_loss: 0.7535, test_loss: 1.1191, test_f1: 0.5000
 epoch: 15, train_loss: 0.7418, test_loss: 1.1699, test_f1: 0.5977
 epoch: 16, train_loss: 0.7255, test_loss: 1.2758, test_f1: 0.5672
 epoch: 17, train_loss: 0.7147, test_loss: 1.2579, test_f1: 0.6117
 epoch: 18, train_loss: 0.7058, test_loss: 1.2217, test_f1: 0.5753
 epoch: 19, train_loss: 0.6715, test_loss: 1.2624, test_f1: 0.6230
 epoch: 20, train_loss: 0.6691, test_loss: 1.2958, test_f1: 0.6092
 epoch: 21, train_loss: 0.6663, test_loss: 1.4409, test_f1: 0.4689
 epoch: 22, train_loss: 0.6990, test_loss: 1.4325, test_f1: 0.5825
 epoch: 23, train_loss: 0.6636, test_loss: 1.2264, test_f1: 0.5712
 epoch: 24, train_loss: 0.6168, test_loss: 1.3005, test_f1: 0.5735
 epoch: 25, train_loss: 0.6027, test_loss: 1.2540, test_f1: 0.6211
 epoch: 26, train_loss: 0.6085, test_loss: 1.3051, test_f1: 0.5528
 epoch: 27, train_loss: 0.6232, test_loss: 1.4065, test_f1: 0.5739
 epoch: 28, train_loss: 0.5794, test_loss: 1.3277, test_f1: 0.5908
 epoch: 29, train_loss: 0.6022, test_loss: 1.1746, test_f1: 0.6089
 epoch: 30, train_loss: 0.5638, test_loss: 1.3490, test_f1: 0.6006
 epoch: 31, train_loss: 0.5491, test_loss: 1.7543, test_f1: 0.5682
 epoch: 32, train_loss: 0.5150, test_loss: 1.5666, test_f1: 0.5857
 epoch: 33, train_loss: 0.5504, test_loss: 1.4086, test_f1: 0.6032
 epoch: 34, train_loss: 0.5525, test_loss: 1.5234, test_f1: 0.5872
 epoch: 35, train_loss: 0.5209, test_loss: 1.5408, test_f1: 0.5522
 epoch: 36, train_loss: 0.4932, test_loss: 1.7422, test_f1: 0.6081
 epoch: 37, train_loss: 0.4888, test_loss: 1.8266, test_f1: 0.5397
 epoch: 38, train_loss: 0.4798, test_loss: 1.7863, test_f1: 0.6048
 epoch: 39, train_loss: 0.4634, test_loss: 1.8996, test_f1: 0.5909
 epoch: 40, train_loss: 0.4418, test_loss: 1.5366, test_f1: 0.6077
 epoch: 41, train_loss: 0.4732, test_loss: 1.4253, test_f1: 0.5960
 epoch: 42, train_loss: 0.4666, test_loss: 1.6515, test_f1: 0.5976
 epoch: 43, train_loss: 0.4452, test_loss: 1.7506, test_f1: 0.5893
 epoch: 44, train_loss: 0.4253, test_loss: 1.8156, test_f1: 0.6163
 epoch: 45, train_loss: 0.4283, test_loss: 1.7762, test_f1: 0.5529
 epoch: 46, train_loss: 0.4084, test_loss: 1.8801, test_f1: 0.5982
 epoch: 47, train_loss: 0.4013, test_loss: 1.9538, test_f1: 0.5813
 epoch: 48, train_loss: 0.4221, test_loss: 1.7599, test_f1: 0.5731
 epoch: 49, train_loss: 0.3735, test_loss: 1.7658, test_f1: 0.5877
 epoch: 50, train_loss: 0.4062, test_loss: 2.4302, test_f1: 0.6001
 epoch: 51, train_loss: 0.3762, test_loss: 2.0324, test_f1: 0.5692
 epoch: 52, train_loss: 0.3278, test_loss: 2.0687, test_f1: 0.5763
 epoch: 53, train_loss: 0.3094, test_loss: 2.0520, test_f1: 0.5967
 epoch: 54, train_loss: 0.2794, test_loss: 2.1948, test_f1: 0.6061
 epoch: 55, train_loss: 0.2536, test_loss: 2.2402, test_f1: 0.5916
 epoch: 56, train_loss: 0.2672, test_loss: 2.3571, test_f1: 0.5692
 epoch: 57, train_loss: 0.2565, test_loss: 2.3173, test_f1: 0.5963
 epoch: 58, train_loss: 0.2672, test_loss: 2.4280, test_f1: 0.5876
 epoch: 59, train_loss: 0.2629, test_loss: 2.4425, test_f1: 0.6056
 epoch: 60, train_loss: 0.2704, test_loss: 2.6554, test_f1: 0.6006
 epoch: 61, train_loss: 0.2668, test_loss: 2.3255, test_f1: 0.6164
 epoch: 62, train_loss: 0.2657, test_loss: 2.4669, test_f1: 0.5894
 epoch: 63, train_loss: 0.2517, test_loss: 2.4503, test_f1: 0.5864
 epoch: 64, train_loss: 0.2865, test_loss: 2.5537, test_f1: 0.5910
 epoch: 65, train_loss: 0.2634, test_loss: 2.5625, test_f1: 0.5898
 epoch: 66, train_loss: 0.2411, test_loss: 2.3872, test_f1: 0.6198
 epoch: 67, train_loss: 0.2297, test_loss: 2.6916, test_f1: 0.5999
 epoch: 68, train_loss: 0.2133, test_loss: 2.5433, test_f1: 0.6073
 epoch: 69, train_loss: 0.2257, test_loss: 2.7344, test_f1: 0.5824
 epoch: 70, train_loss: 0.2125, test_loss: 2.8410, test_f1: 0.6012
 epoch: 71, train_loss: 0.1914, test_loss: 2.7154, test_f1: 0.6055
 epoch: 72, train_loss: 0.2092, test_loss: 2.7476, test_f1: 0.6020
 epoch: 73, train_loss: 0.2215, test_loss: 2.5978, test_f1: 0.6141
 epoch: 74, train_loss: 0.2164, test_loss: 2.9983, test_f1: 0.5756
 epoch: 75, train_loss: 0.2291, test_loss: 2.5901, test_f1: 0.5882
 epoch: 76, train_loss: 0.2216, test_loss: 2.8268, test_f1: 0.6206
 epoch: 77, train_loss: 0.2126, test_loss: 2.6919, test_f1: 0.5956
 epoch: 78, train_loss: 0.1840, test_loss: 2.8151, test_f1: 0.6066
 epoch: 79, train_loss: 0.1788, test_loss: 2.9084, test_f1: 0.5979
 epoch: 80, train_loss: 0.2131, test_loss: 2.8944, test_f1: 0.5950
 epoch: 81, train_loss: 0.1839, test_loss: 3.0325, test_f1: 0.5952
 epoch: 82, train_loss: 0.1770, test_loss: 3.1278, test_f1: 0.5784
 epoch: 83, train_loss: 0.2034, test_loss: 3.1221, test_f1: 0.5894
 epoch: 84, train_loss: 0.1810, test_loss: 2.8966, test_f1: 0.5823
 epoch: 85, train_loss: 0.1809, test_loss: 3.3349, test_f1: 0.5886
 epoch: 86, train_loss: 0.1761, test_loss: 3.1725, test_f1: 0.5843
 epoch: 87, train_loss: 0.1664, test_loss: 3.1152, test_f1: 0.5799
 epoch: 88, train_loss: 0.2232, test_loss: 3.3214, test_f1: 0.5812
 epoch: 89, train_loss: 0.1816, test_loss: 3.0270, test_f1: 0.5673
 epoch: 90, train_loss: 0.2008, test_loss: 3.1418, test_f1: 0.6087
 epoch: 91, train_loss: 0.1994, test_loss: 3.2602, test_f1: 0.5912
 epoch: 92, train_loss: 0.2034, test_loss: 2.8133, test_f1: 0.5934
 epoch: 93, train_loss: 0.1637, test_loss: 2.9556, test_f1: 0.5906
 epoch: 94, train_loss: 0.1581, test_loss: 3.0407, test_f1: 0.6048
 epoch: 95, train_loss: 0.1824, test_loss: 2.9962, test_f1: 0.6160
 epoch: 96, train_loss: 0.2080, test_loss: 3.0546, test_f1: 0.5798
 epoch: 97, train_loss: 0.2064, test_loss: 3.2723, test_f1: 0.5936
 epoch: 98, train_loss: 0.1666, test_loss: 3.2280, test_f1: 0.5989
 epoch: 99, train_loss: 0.1796, test_loss: 3.3933, test_f1: 0.5951
##################ITERATION #4 ****************************************
 epoch: 0, train_loss: 1.2251, test_loss: 1.2787, test_f1: 0.1905
 epoch: 1, train_loss: 1.0545, test_loss: 1.1687, test_f1: 0.3675
 epoch: 2, train_loss: 0.9832, test_loss: 1.1255, test_f1: 0.4345
 epoch: 3, train_loss: 0.9314, test_loss: 1.1007, test_f1: 0.5387
 epoch: 4, train_loss: 0.9224, test_loss: 1.1692, test_f1: 0.4962
 epoch: 5, train_loss: 0.8815, test_loss: 1.0700, test_f1: 0.5270
 epoch: 6, train_loss: 0.8828, test_loss: 1.0868, test_f1: 0.5538
 epoch: 7, train_loss: 0.8537, test_loss: 1.1378, test_f1: 0.5369
 epoch: 8, train_loss: 0.8511, test_loss: 1.1216, test_f1: 0.5088
 epoch: 9, train_loss: 0.8370, test_loss: 1.2165, test_f1: 0.5150
 epoch: 10, train_loss: 0.8080, test_loss: 1.0279, test_f1: 0.5745
 epoch: 11, train_loss: 0.7779, test_loss: 1.1714, test_f1: 0.5812
 epoch: 12, train_loss: 0.7768, test_loss: 1.2240, test_f1: 0.5900
 epoch: 13, train_loss: 0.7321, test_loss: 1.2639, test_f1: 0.5458
 epoch: 14, train_loss: 0.7605, test_loss: 1.4076, test_f1: 0.5111
 epoch: 15, train_loss: 0.7604, test_loss: 1.3289, test_f1: 0.5951
 epoch: 16, train_loss: 0.7353, test_loss: 1.2393, test_f1: 0.5013
 epoch: 17, train_loss: 0.7006, test_loss: 1.1653, test_f1: 0.5511
 epoch: 18, train_loss: 0.6815, test_loss: 1.2938, test_f1: 0.5377
 epoch: 19, train_loss: 0.6825, test_loss: 1.0813, test_f1: 0.6408
 epoch: 20, train_loss: 0.6768, test_loss: 1.2085, test_f1: 0.5953
 epoch: 21, train_loss: 0.6457, test_loss: 1.1965, test_f1: 0.5722
 epoch: 22, train_loss: 0.6638, test_loss: 1.2820, test_f1: 0.5964
 epoch: 23, train_loss: 0.6661, test_loss: 1.2954, test_f1: 0.5966
 epoch: 24, train_loss: 0.6168, test_loss: 1.2385, test_f1: 0.6215
 epoch: 25, train_loss: 0.6342, test_loss: 1.4035, test_f1: 0.6186
 epoch: 26, train_loss: 0.5762, test_loss: 1.3684, test_f1: 0.5882
 epoch: 27, train_loss: 0.5936, test_loss: 1.3971, test_f1: 0.6092
 epoch: 28, train_loss: 0.5566, test_loss: 1.2266, test_f1: 0.6463
 epoch: 29, train_loss: 0.5574, test_loss: 1.5955, test_f1: 0.5684
 epoch: 30, train_loss: 0.5548, test_loss: 1.4387, test_f1: 0.6184
 epoch: 31, train_loss: 0.5588, test_loss: 1.5505, test_f1: 0.5562
 epoch: 32, train_loss: 0.5361, test_loss: 1.5220, test_f1: 0.6137
 epoch: 33, train_loss: 0.5298, test_loss: 1.4590, test_f1: 0.5917
 epoch: 34, train_loss: 0.5058, test_loss: 1.4768, test_f1: 0.5343
 epoch: 35, train_loss: 0.5056, test_loss: 1.5548, test_f1: 0.6088
 epoch: 36, train_loss: 0.5062, test_loss: 1.5483, test_f1: 0.5857
 epoch: 37, train_loss: 0.4738, test_loss: 1.6753, test_f1: 0.5771
 epoch: 38, train_loss: 0.4947, test_loss: 1.6033, test_f1: 0.6299
 epoch: 39, train_loss: 0.5229, test_loss: 1.3846, test_f1: 0.5888
 epoch: 40, train_loss: 0.4778, test_loss: 1.5087, test_f1: 0.5906
 epoch: 41, train_loss: 0.4641, test_loss: 1.5375, test_f1: 0.5541
 epoch: 42, train_loss: 0.4462, test_loss: 1.5165, test_f1: 0.6109
 epoch: 43, train_loss: 0.4700, test_loss: 1.6921, test_f1: 0.5832
 epoch: 44, train_loss: 0.4491, test_loss: 1.5261, test_f1: 0.6075
 epoch: 45, train_loss: 0.3954, test_loss: 1.9236, test_f1: 0.5892
 epoch: 46, train_loss: 0.4129, test_loss: 1.7034, test_f1: 0.5917
 epoch: 47, train_loss: 0.4303, test_loss: 2.0038, test_f1: 0.5729
 epoch: 48, train_loss: 0.4424, test_loss: 1.9055, test_f1: 0.6353
 epoch: 49, train_loss: 0.4346, test_loss: 1.9645, test_f1: 0.5996
 epoch: 50, train_loss: 0.4187, test_loss: 1.6587, test_f1: 0.6117
 epoch: 51, train_loss: 0.3828, test_loss: 1.6993, test_f1: 0.5468
 epoch: 52, train_loss: 0.3475, test_loss: 1.8966, test_f1: 0.5910
 epoch: 53, train_loss: 0.3107, test_loss: 1.9916, test_f1: 0.6129
 epoch: 54, train_loss: 0.3099, test_loss: 1.9855, test_f1: 0.5950
 epoch: 55, train_loss: 0.2984, test_loss: 2.0871, test_f1: 0.5862
 epoch: 56, train_loss: 0.2910, test_loss: 2.2207, test_f1: 0.6081
 epoch: 57, train_loss: 0.2871, test_loss: 1.9504, test_f1: 0.6440
 epoch: 58, train_loss: 0.2610, test_loss: 2.4066, test_f1: 0.5728
 epoch: 59, train_loss: 0.2773, test_loss: 2.1381, test_f1: 0.5966
 epoch: 60, train_loss: 0.2788, test_loss: 2.3750, test_f1: 0.6048
 epoch: 61, train_loss: 0.2762, test_loss: 2.5141, test_f1: 0.5895
 epoch: 62, train_loss: 0.2846, test_loss: 2.5214, test_f1: 0.5634
 epoch: 63, train_loss: 0.2791, test_loss: 2.6758, test_f1: 0.5902
 epoch: 64, train_loss: 0.2746, test_loss: 2.5398, test_f1: 0.5780
 epoch: 65, train_loss: 0.2636, test_loss: 2.5490, test_f1: 0.5836
 epoch: 66, train_loss: 0.2564, test_loss: 2.4771, test_f1: 0.5665
 epoch: 67, train_loss: 0.2350, test_loss: 2.3681, test_f1: 0.5963
 epoch: 68, train_loss: 0.2381, test_loss: 2.4692, test_f1: 0.6042
 epoch: 69, train_loss: 0.2475, test_loss: 2.7300, test_f1: 0.5607
 epoch: 70, train_loss: 0.2518, test_loss: 2.6790, test_f1: 0.5958
 epoch: 71, train_loss: 0.2263, test_loss: 2.7029, test_f1: 0.5807
 epoch: 72, train_loss: 0.2536, test_loss: 2.6219, test_f1: 0.6252
 epoch: 73, train_loss: 0.2375, test_loss: 2.6943, test_f1: 0.5761
 epoch: 74, train_loss: 0.2269, test_loss: 2.6046, test_f1: 0.5894
 epoch: 75, train_loss: 0.1929, test_loss: 2.8192, test_f1: 0.5934
 epoch: 76, train_loss: 0.2275, test_loss: 2.7680, test_f1: 0.5565
 epoch: 77, train_loss: 0.2033, test_loss: 2.7997, test_f1: 0.5866
 epoch: 78, train_loss: 0.2092, test_loss: 2.8686, test_f1: 0.5893
 epoch: 79, train_loss: 0.2533, test_loss: 2.6616, test_f1: 0.6003
 epoch: 80, train_loss: 0.2170, test_loss: 2.8657, test_f1: 0.5927
 epoch: 81, train_loss: 0.2124, test_loss: 3.0055, test_f1: 0.5629
 epoch: 82, train_loss: 0.2235, test_loss: 2.6675, test_f1: 0.5982
 epoch: 83, train_loss: 0.1929, test_loss: 2.4673, test_f1: 0.6045
 epoch: 84, train_loss: 0.1997, test_loss: 2.6153, test_f1: 0.5936
 epoch: 85, train_loss: 0.2029, test_loss: 2.8578, test_f1: 0.5863
 epoch: 86, train_loss: 0.2059, test_loss: 2.9015, test_f1: 0.6026
 epoch: 87, train_loss: 0.1931, test_loss: 3.2366, test_f1: 0.5569
 epoch: 88, train_loss: 0.1790, test_loss: 2.7755, test_f1: 0.5870
 epoch: 89, train_loss: 0.1714, test_loss: 2.8370, test_f1: 0.5938
 epoch: 90, train_loss: 0.2100, test_loss: 2.8966, test_f1: 0.5900
 epoch: 91, train_loss: 0.2261, test_loss: 2.9175, test_f1: 0.5698
 epoch: 92, train_loss: 0.1945, test_loss: 2.7582, test_f1: 0.5865
 epoch: 93, train_loss: 0.1775, test_loss: 3.2378, test_f1: 0.5711
 epoch: 94, train_loss: 0.1832, test_loss: 2.9999, test_f1: 0.5730
 epoch: 95, train_loss: 0.1711, test_loss: 3.0700, test_f1: 0.5648
 epoch: 96, train_loss: 0.1816, test_loss: 3.0468, test_f1: 0.5626
 epoch: 97, train_loss: 0.2164, test_loss: 3.3057, test_f1: 0.5654
 epoch: 98, train_loss: 0.1691, test_loss: 3.0859, test_f1: 0.5839
 epoch: 99, train_loss: 0.1771, test_loss: 3.0106, test_f1: 0.5881
##################ITERATION #5 ****************************************
 epoch: 0, train_loss: 1.2942, test_loss: 1.3755, test_f1: 0.1365
 epoch: 1, train_loss: 1.1064, test_loss: 1.1880, test_f1: 0.3117
 epoch: 2, train_loss: 0.9970, test_loss: 1.0850, test_f1: 0.4687
 epoch: 3, train_loss: 0.9526, test_loss: 1.0230, test_f1: 0.5526
 epoch: 4, train_loss: 0.9167, test_loss: 1.0310, test_f1: 0.5690
 epoch: 5, train_loss: 0.8944, test_loss: 1.1618, test_f1: 0.4116
 epoch: 6, train_loss: 0.8956, test_loss: 1.0576, test_f1: 0.5276
 epoch: 7, train_loss: 0.8919, test_loss: 1.0175, test_f1: 0.5461
 epoch: 8, train_loss: 0.8833, test_loss: 1.0731, test_f1: 0.5910
 epoch: 9, train_loss: 0.8526, test_loss: 1.0359, test_f1: 0.5365
 epoch: 10, train_loss: 0.8353, test_loss: 1.0713, test_f1: 0.6142
 epoch: 11, train_loss: 0.8221, test_loss: 0.9537, test_f1: 0.6265
 epoch: 12, train_loss: 0.8264, test_loss: 1.0142, test_f1: 0.6004
 epoch: 13, train_loss: 0.8226, test_loss: 1.0071, test_f1: 0.5904
 epoch: 14, train_loss: 0.7934, test_loss: 0.9728, test_f1: 0.5878
 epoch: 15, train_loss: 0.7872, test_loss: 1.0627, test_f1: 0.5802
 epoch: 16, train_loss: 0.7505, test_loss: 1.0812, test_f1: 0.5910
 epoch: 17, train_loss: 0.7068, test_loss: 1.0751, test_f1: 0.6115
 epoch: 18, train_loss: 0.7194, test_loss: 1.1151, test_f1: 0.6269
 epoch: 19, train_loss: 0.7116, test_loss: 1.1227, test_f1: 0.5672
 epoch: 20, train_loss: 0.7176, test_loss: 1.4988, test_f1: 0.5201
 epoch: 21, train_loss: 0.6864, test_loss: 1.2697, test_f1: 0.5503
 epoch: 22, train_loss: 0.6814, test_loss: 1.1298, test_f1: 0.5823
 epoch: 23, train_loss: 0.6336, test_loss: 1.2599, test_f1: 0.5599
 epoch: 24, train_loss: 0.6534, test_loss: 1.2255, test_f1: 0.5844
 epoch: 25, train_loss: 0.6076, test_loss: 1.3321, test_f1: 0.6041
 epoch: 26, train_loss: 0.6387, test_loss: 1.3222, test_f1: 0.6023
 epoch: 27, train_loss: 0.6267, test_loss: 1.2580, test_f1: 0.6229
 epoch: 28, train_loss: 0.5956, test_loss: 1.1539, test_f1: 0.5736
 epoch: 29, train_loss: 0.5782, test_loss: 1.3901, test_f1: 0.5176
 epoch: 30, train_loss: 0.5573, test_loss: 1.4810, test_f1: 0.5711
 epoch: 31, train_loss: 0.5529, test_loss: 1.3849, test_f1: 0.6344
 epoch: 32, train_loss: 0.5476, test_loss: 1.3952, test_f1: 0.5874
 epoch: 33, train_loss: 0.5095, test_loss: 1.6780, test_f1: 0.5459
 epoch: 34, train_loss: 0.5161, test_loss: 1.3351, test_f1: 0.6198
 epoch: 35, train_loss: 0.5062, test_loss: 1.3287, test_f1: 0.6432
 epoch: 36, train_loss: 0.4907, test_loss: 1.7175, test_f1: 0.5967
 epoch: 37, train_loss: 0.5264, test_loss: 1.4513, test_f1: 0.6638
 epoch: 38, train_loss: 0.5382, test_loss: 1.6264, test_f1: 0.6030
 epoch: 39, train_loss: 0.4860, test_loss: 1.4825, test_f1: 0.6055
 epoch: 40, train_loss: 0.4520, test_loss: 1.6830, test_f1: 0.5894
 epoch: 41, train_loss: 0.4546, test_loss: 1.6206, test_f1: 0.6089
 epoch: 42, train_loss: 0.4179, test_loss: 1.6661, test_f1: 0.6205
 epoch: 43, train_loss: 0.4248, test_loss: 2.1332, test_f1: 0.5922
 epoch: 44, train_loss: 0.4022, test_loss: 1.9748, test_f1: 0.5891
 epoch: 45, train_loss: 0.4147, test_loss: 1.9036, test_f1: 0.5503
 epoch: 46, train_loss: 0.4400, test_loss: 1.9332, test_f1: 0.6140
 epoch: 47, train_loss: 0.4327, test_loss: 1.9384, test_f1: 0.5702
 epoch: 48, train_loss: 0.4425, test_loss: 1.9092, test_f1: 0.5644
 epoch: 49, train_loss: 0.4250, test_loss: 1.6375, test_f1: 0.6221
 epoch: 50, train_loss: 0.4002, test_loss: 1.9717, test_f1: 0.5997
 epoch: 51, train_loss: 0.3582, test_loss: 1.9192, test_f1: 0.5849
 epoch: 52, train_loss: 0.3236, test_loss: 2.0181, test_f1: 0.6160
 epoch: 53, train_loss: 0.3072, test_loss: 1.9270, test_f1: 0.6258
 epoch: 54, train_loss: 0.2992, test_loss: 1.9667, test_f1: 0.6115
 epoch: 55, train_loss: 0.2881, test_loss: 1.9966, test_f1: 0.6270
 epoch: 56, train_loss: 0.3212, test_loss: 2.1102, test_f1: 0.6043
 epoch: 57, train_loss: 0.2950, test_loss: 2.0981, test_f1: 0.6282
 epoch: 58, train_loss: 0.2820, test_loss: 2.2999, test_f1: 0.5981
 epoch: 59, train_loss: 0.2870, test_loss: 2.3115, test_f1: 0.5948
 epoch: 60, train_loss: 0.2780, test_loss: 2.4601, test_f1: 0.5951
 epoch: 61, train_loss: 0.2803, test_loss: 2.2871, test_f1: 0.5942
 epoch: 62, train_loss: 0.2757, test_loss: 2.3302, test_f1: 0.6011
 epoch: 63, train_loss: 0.2655, test_loss: 2.5342, test_f1: 0.6323
 epoch: 64, train_loss: 0.2460, test_loss: 2.3479, test_f1: 0.5896
 epoch: 65, train_loss: 0.2345, test_loss: 2.2692, test_f1: 0.6071
 epoch: 66, train_loss: 0.2477, test_loss: 2.3931, test_f1: 0.5861
 epoch: 67, train_loss: 0.2338, test_loss: 2.4748, test_f1: 0.6147
 epoch: 68, train_loss: 0.2372, test_loss: 2.3920, test_f1: 0.6125
 epoch: 69, train_loss: 0.2566, test_loss: 2.3666, test_f1: 0.5948
 epoch: 70, train_loss: 0.2309, test_loss: 2.4024, test_f1: 0.5829
 epoch: 71, train_loss: 0.2302, test_loss: 2.7958, test_f1: 0.5825
 epoch: 72, train_loss: 0.2202, test_loss: 2.6525, test_f1: 0.6014
 epoch: 73, train_loss: 0.2440, test_loss: 2.6569, test_f1: 0.5647
 epoch: 74, train_loss: 0.2154, test_loss: 2.6214, test_f1: 0.6042
 epoch: 75, train_loss: 0.2051, test_loss: 2.7504, test_f1: 0.6107
 epoch: 76, train_loss: 0.2278, test_loss: 2.6707, test_f1: 0.6002
 epoch: 77, train_loss: 0.2400, test_loss: 2.5532, test_f1: 0.5673
 epoch: 78, train_loss: 0.1994, test_loss: 2.4720, test_f1: 0.6322
 epoch: 79, train_loss: 0.2233, test_loss: 2.6385, test_f1: 0.5964
 epoch: 80, train_loss: 0.1958, test_loss: 2.7766, test_f1: 0.5907
 epoch: 81, train_loss: 0.1991, test_loss: 2.9585, test_f1: 0.5973
 epoch: 82, train_loss: 0.2057, test_loss: 2.9632, test_f1: 0.5840
 epoch: 83, train_loss: 0.1986, test_loss: 2.7489, test_f1: 0.6068
 epoch: 84, train_loss: 0.2110, test_loss: 2.7995, test_f1: 0.6414
 epoch: 85, train_loss: 0.1944, test_loss: 2.9373, test_f1: 0.5930
 epoch: 86, train_loss: 0.2127, test_loss: 2.8177, test_f1: 0.5983
 epoch: 87, train_loss: 0.1689, test_loss: 2.9704, test_f1: 0.6228
 epoch: 88, train_loss: 0.2048, test_loss: 2.9376, test_f1: 0.5679
 epoch: 89, train_loss: 0.1982, test_loss: 2.9686, test_f1: 0.6039
 epoch: 90, train_loss: 0.1831, test_loss: 2.9076, test_f1: 0.6207
 epoch: 91, train_loss: 0.1744, test_loss: 3.2015, test_f1: 0.5885
 epoch: 92, train_loss: 0.1664, test_loss: 3.1739, test_f1: 0.5726
 epoch: 93, train_loss: 0.1643, test_loss: 2.9742, test_f1: 0.6078
 epoch: 94, train_loss: 0.1750, test_loss: 2.9966, test_f1: 0.5746
 epoch: 95, train_loss: 0.1735, test_loss: 3.2308, test_f1: 0.6015
 epoch: 96, train_loss: 0.1958, test_loss: 3.1995, test_f1: 0.6222
 epoch: 97, train_loss: 0.1646, test_loss: 2.8423, test_f1: 0.5860
 epoch: 98, train_loss: 0.1393, test_loss: 3.0447, test_f1: 0.6264
 epoch: 99, train_loss: 0.1751, test_loss: 3.0932, test_f1: 0.5961
##################ITERATION #6 ****************************************
 epoch: 0, train_loss: 1.3240, test_loss: 1.2773, test_f1: 0.1471
 epoch: 1, train_loss: 1.0422, test_loss: 1.1847, test_f1: 0.3696
 epoch: 2, train_loss: 0.9868, test_loss: 1.0909, test_f1: 0.5008
 epoch: 3, train_loss: 0.9294, test_loss: 1.1105, test_f1: 0.4780
 epoch: 4, train_loss: 0.8964, test_loss: 1.0253, test_f1: 0.5680
 epoch: 5, train_loss: 0.8949, test_loss: 1.0219, test_f1: 0.5738
 epoch: 6, train_loss: 0.8798, test_loss: 1.1074, test_f1: 0.5463
 epoch: 7, train_loss: 0.8605, test_loss: 1.0392, test_f1: 0.5803
 epoch: 8, train_loss: 0.8465, test_loss: 1.1007, test_f1: 0.5728
 epoch: 9, train_loss: 0.8182, test_loss: 1.0942, test_f1: 0.5769
 epoch: 10, train_loss: 0.8296, test_loss: 1.1364, test_f1: 0.5583
 epoch: 11, train_loss: 0.7877, test_loss: 1.0810, test_f1: 0.6382
 epoch: 12, train_loss: 0.7816, test_loss: 1.1116, test_f1: 0.6276
 epoch: 13, train_loss: 0.7497, test_loss: 1.1940, test_f1: 0.5687
 epoch: 14, train_loss: 0.7649, test_loss: 1.1194, test_f1: 0.5845
 epoch: 15, train_loss: 0.7323, test_loss: 1.1002, test_f1: 0.5834
 epoch: 16, train_loss: 0.7319, test_loss: 1.0848, test_f1: 0.6095
 epoch: 17, train_loss: 0.7123, test_loss: 1.0371, test_f1: 0.6273
 epoch: 18, train_loss: 0.6798, test_loss: 1.1482, test_f1: 0.6022
 epoch: 19, train_loss: 0.6530, test_loss: 1.1947, test_f1: 0.6092
 epoch: 20, train_loss: 0.6499, test_loss: 1.2181, test_f1: 0.5613
 epoch: 21, train_loss: 0.6562, test_loss: 1.3220, test_f1: 0.5606
 epoch: 22, train_loss: 0.6309, test_loss: 1.3189, test_f1: 0.5801
 epoch: 23, train_loss: 0.6295, test_loss: 1.2340, test_f1: 0.5863
 epoch: 24, train_loss: 0.6174, test_loss: 1.2576, test_f1: 0.6252
 epoch: 25, train_loss: 0.6291, test_loss: 1.3579, test_f1: 0.5745
 epoch: 26, train_loss: 0.5803, test_loss: 1.3453, test_f1: 0.5618
 epoch: 27, train_loss: 0.5872, test_loss: 1.2770, test_f1: 0.5710
 epoch: 28, train_loss: 0.5569, test_loss: 1.3754, test_f1: 0.5991
 epoch: 29, train_loss: 0.5278, test_loss: 1.3041, test_f1: 0.5955
 epoch: 30, train_loss: 0.5750, test_loss: 1.2143, test_f1: 0.6144
 epoch: 31, train_loss: 0.5601, test_loss: 1.2270, test_f1: 0.6435
 epoch: 32, train_loss: 0.5462, test_loss: 1.4003, test_f1: 0.6226
 epoch: 33, train_loss: 0.5019, test_loss: 1.7652, test_f1: 0.5848
 epoch: 34, train_loss: 0.5005, test_loss: 1.3149, test_f1: 0.5800
 epoch: 35, train_loss: 0.5514, test_loss: 1.4785, test_f1: 0.5755
 epoch: 36, train_loss: 0.4829, test_loss: 1.5325, test_f1: 0.5814
 epoch: 37, train_loss: 0.5031, test_loss: 1.5247, test_f1: 0.5926
 epoch: 38, train_loss: 0.5122, test_loss: 1.4484, test_f1: 0.5858
 epoch: 39, train_loss: 0.4475, test_loss: 1.6724, test_f1: 0.6134
 epoch: 40, train_loss: 0.4563, test_loss: 1.5029, test_f1: 0.6457
 epoch: 41, train_loss: 0.4502, test_loss: 1.6882, test_f1: 0.6081
 epoch: 42, train_loss: 0.4849, test_loss: 1.6117, test_f1: 0.5745
 epoch: 43, train_loss: 0.4424, test_loss: 1.8356, test_f1: 0.5948
 epoch: 44, train_loss: 0.4288, test_loss: 1.7316, test_f1: 0.5904
 epoch: 45, train_loss: 0.4436, test_loss: 1.6848, test_f1: 0.5828
 epoch: 46, train_loss: 0.4148, test_loss: 1.8348, test_f1: 0.5671
 epoch: 47, train_loss: 0.4321, test_loss: 1.9259, test_f1: 0.6112
 epoch: 48, train_loss: 0.4821, test_loss: 1.7190, test_f1: 0.5809
 epoch: 49, train_loss: 0.4307, test_loss: 1.9974, test_f1: 0.5427
 epoch: 50, train_loss: 0.4075, test_loss: 2.0383, test_f1: 0.5901
 epoch: 51, train_loss: 0.3716, test_loss: 1.7941, test_f1: 0.5922
 epoch: 52, train_loss: 0.3497, test_loss: 1.7194, test_f1: 0.6004
 epoch: 53, train_loss: 0.3030, test_loss: 1.9463, test_f1: 0.6035
 epoch: 54, train_loss: 0.3083, test_loss: 2.1282, test_f1: 0.5877
 epoch: 55, train_loss: 0.3074, test_loss: 2.0242, test_f1: 0.6017
 epoch: 56, train_loss: 0.3069, test_loss: 2.0327, test_f1: 0.6075
 epoch: 57, train_loss: 0.2762, test_loss: 2.2623, test_f1: 0.5874
 epoch: 58, train_loss: 0.2819, test_loss: 2.4146, test_f1: 0.5820
 epoch: 59, train_loss: 0.2848, test_loss: 2.3261, test_f1: 0.6045
 epoch: 60, train_loss: 0.2660, test_loss: 2.1668, test_f1: 0.5963
 epoch: 61, train_loss: 0.2805, test_loss: 2.4595, test_f1: 0.5887
 epoch: 62, train_loss: 0.2572, test_loss: 2.4944, test_f1: 0.5851
 epoch: 63, train_loss: 0.2394, test_loss: 2.6786, test_f1: 0.5797
 epoch: 64, train_loss: 0.2492, test_loss: 2.3891, test_f1: 0.6014
 epoch: 65, train_loss: 0.2335, test_loss: 2.5478, test_f1: 0.6158
 epoch: 66, train_loss: 0.2507, test_loss: 2.4808, test_f1: 0.5934
 epoch: 67, train_loss: 0.2721, test_loss: 2.6104, test_f1: 0.6110
 epoch: 68, train_loss: 0.2450, test_loss: 2.5434, test_f1: 0.5762
 epoch: 69, train_loss: 0.2430, test_loss: 2.9181, test_f1: 0.5852
 epoch: 70, train_loss: 0.2289, test_loss: 3.0014, test_f1: 0.5694
 epoch: 71, train_loss: 0.2461, test_loss: 3.0870, test_f1: 0.5786
 epoch: 72, train_loss: 0.2239, test_loss: 2.7924, test_f1: 0.6160
 epoch: 73, train_loss: 0.2367, test_loss: 2.5650, test_f1: 0.6064
 epoch: 74, train_loss: 0.2506, test_loss: 2.7935, test_f1: 0.6197
 epoch: 75, train_loss: 0.2347, test_loss: 2.8018, test_f1: 0.5604
 epoch: 76, train_loss: 0.2387, test_loss: 3.0715, test_f1: 0.5576
 epoch: 77, train_loss: 0.2110, test_loss: 2.7556, test_f1: 0.6052
 epoch: 78, train_loss: 0.2086, test_loss: 3.0294, test_f1: 0.5822
 epoch: 79, train_loss: 0.2050, test_loss: 3.1102, test_f1: 0.6207
 epoch: 80, train_loss: 0.2248, test_loss: 2.9471, test_f1: 0.5918
 epoch: 81, train_loss: 0.2118, test_loss: 3.0024, test_f1: 0.5790
 epoch: 82, train_loss: 0.2041, test_loss: 2.9769, test_f1: 0.6254
 epoch: 83, train_loss: 0.1793, test_loss: 3.1726, test_f1: 0.5916
 epoch: 84, train_loss: 0.2315, test_loss: 2.9689, test_f1: 0.6016
 epoch: 85, train_loss: 0.1927, test_loss: 2.9301, test_f1: 0.6069
 epoch: 86, train_loss: 0.2047, test_loss: 2.8784, test_f1: 0.5979
 epoch: 87, train_loss: 0.1822, test_loss: 3.0715, test_f1: 0.5709
 epoch: 88, train_loss: 0.1629, test_loss: 3.0364, test_f1: 0.6031
 epoch: 89, train_loss: 0.1904, test_loss: 3.0847, test_f1: 0.6132
 epoch: 90, train_loss: 0.1984, test_loss: 3.0233, test_f1: 0.6001
 epoch: 91, train_loss: 0.1596, test_loss: 3.3068, test_f1: 0.6078
 epoch: 92, train_loss: 0.1757, test_loss: 3.4361, test_f1: 0.5362
 epoch: 93, train_loss: 0.1790, test_loss: 3.5466, test_f1: 0.5995
 epoch: 94, train_loss: 0.1850, test_loss: 3.6034, test_f1: 0.5511
 epoch: 95, train_loss: 0.1853, test_loss: 3.3159, test_f1: 0.5958
 epoch: 96, train_loss: 0.1992, test_loss: 3.4073, test_f1: 0.5570
 epoch: 97, train_loss: 0.2021, test_loss: 2.8234, test_f1: 0.5977
 epoch: 98, train_loss: 0.1604, test_loss: 2.8094, test_f1: 0.6167
 epoch: 99, train_loss: 0.1543, test_loss: 3.1871, test_f1: 0.5897
##################ITERATION #7 ****************************************
 epoch: 0, train_loss: 1.3086, test_loss: 1.3320, test_f1: 0.2093
 epoch: 1, train_loss: 1.0658, test_loss: 1.0941, test_f1: 0.3824
 epoch: 2, train_loss: 0.9617, test_loss: 1.0723, test_f1: 0.4767
 epoch: 3, train_loss: 0.9401, test_loss: 1.0920, test_f1: 0.5352
 epoch: 4, train_loss: 0.9067, test_loss: 1.0517, test_f1: 0.5468
 epoch: 5, train_loss: 0.9031, test_loss: 1.0483, test_f1: 0.5638
 epoch: 6, train_loss: 0.8794, test_loss: 1.0435, test_f1: 0.5167
 epoch: 7, train_loss: 0.8498, test_loss: 1.0787, test_f1: 0.5265
 epoch: 8, train_loss: 0.8515, test_loss: 1.1478, test_f1: 0.5587
 epoch: 9, train_loss: 0.8338, test_loss: 1.1122, test_f1: 0.5694
 epoch: 10, train_loss: 0.7999, test_loss: 1.1187, test_f1: 0.5838
 epoch: 11, train_loss: 0.8000, test_loss: 1.1012, test_f1: 0.5252
 epoch: 12, train_loss: 0.7605, test_loss: 1.0044, test_f1: 0.5862
 epoch: 13, train_loss: 0.7737, test_loss: 1.0723, test_f1: 0.5665
 epoch: 14, train_loss: 0.7366, test_loss: 1.0633, test_f1: 0.5363
 epoch: 15, train_loss: 0.7142, test_loss: 1.1212, test_f1: 0.5845
 epoch: 16, train_loss: 0.7457, test_loss: 1.3664, test_f1: 0.5957
 epoch: 17, train_loss: 0.7203, test_loss: 1.1157, test_f1: 0.6120
 epoch: 18, train_loss: 0.6763, test_loss: 1.1807, test_f1: 0.6005
 epoch: 19, train_loss: 0.6543, test_loss: 1.3045, test_f1: 0.5403
 epoch: 20, train_loss: 0.6639, test_loss: 1.3821, test_f1: 0.5568
 epoch: 21, train_loss: 0.6553, test_loss: 1.2376, test_f1: 0.6062
 epoch: 22, train_loss: 0.6316, test_loss: 1.2986, test_f1: 0.6201
 epoch: 23, train_loss: 0.6346, test_loss: 1.2352, test_f1: 0.5964
 epoch: 24, train_loss: 0.5972, test_loss: 1.3403, test_f1: 0.5909
 epoch: 25, train_loss: 0.6137, test_loss: 1.2370, test_f1: 0.5526
 epoch: 26, train_loss: 0.6061, test_loss: 1.5368, test_f1: 0.5941
 epoch: 27, train_loss: 0.6018, test_loss: 1.4053, test_f1: 0.5699
 epoch: 28, train_loss: 0.5566, test_loss: 1.5064, test_f1: 0.6007
 epoch: 29, train_loss: 0.5603, test_loss: 1.4393, test_f1: 0.5945
 epoch: 30, train_loss: 0.5606, test_loss: 1.4047, test_f1: 0.5958
 epoch: 31, train_loss: 0.5575, test_loss: 1.4727, test_f1: 0.6029
 epoch: 32, train_loss: 0.5295, test_loss: 1.5736, test_f1: 0.5765
 epoch: 33, train_loss: 0.5228, test_loss: 1.4592, test_f1: 0.6107
 epoch: 34, train_loss: 0.5418, test_loss: 1.4324, test_f1: 0.5741
 epoch: 35, train_loss: 0.5004, test_loss: 1.6111, test_f1: 0.5828
 epoch: 36, train_loss: 0.4933, test_loss: 1.4798, test_f1: 0.6278
 epoch: 37, train_loss: 0.4694, test_loss: 1.7447, test_f1: 0.5658
 epoch: 38, train_loss: 0.4573, test_loss: 1.4951, test_f1: 0.6102
 epoch: 39, train_loss: 0.4446, test_loss: 2.0516, test_f1: 0.5230
 epoch: 40, train_loss: 0.4999, test_loss: 1.6564, test_f1: 0.6127
 epoch: 41, train_loss: 0.4601, test_loss: 1.6920, test_f1: 0.5526
 epoch: 42, train_loss: 0.4928, test_loss: 1.5608, test_f1: 0.6591
 epoch: 43, train_loss: 0.4684, test_loss: 1.5784, test_f1: 0.6376
 epoch: 44, train_loss: 0.4442, test_loss: 1.7360, test_f1: 0.6025
 epoch: 45, train_loss: 0.4164, test_loss: 2.1055, test_f1: 0.5179
 epoch: 46, train_loss: 0.4471, test_loss: 1.6471, test_f1: 0.6130
 epoch: 47, train_loss: 0.4142, test_loss: 1.5068, test_f1: 0.6328
 epoch: 48, train_loss: 0.3897, test_loss: 1.7480, test_f1: 0.6034
 epoch: 49, train_loss: 0.3965, test_loss: 1.7203, test_f1: 0.6233
 epoch: 50, train_loss: 0.3690, test_loss: 1.8736, test_f1: 0.6053
 epoch: 51, train_loss: 0.3443, test_loss: 1.6647, test_f1: 0.6230
 epoch: 52, train_loss: 0.2971, test_loss: 1.9263, test_f1: 0.6193
 epoch: 53, train_loss: 0.2989, test_loss: 1.9258, test_f1: 0.6190
 epoch: 54, train_loss: 0.2596, test_loss: 2.1743, test_f1: 0.6292
 epoch: 55, train_loss: 0.3097, test_loss: 2.2531, test_f1: 0.6165
 epoch: 56, train_loss: 0.2934, test_loss: 2.2313, test_f1: 0.5930
 epoch: 57, train_loss: 0.2964, test_loss: 1.9401, test_f1: 0.6360
 epoch: 58, train_loss: 0.2759, test_loss: 2.1765, test_f1: 0.6493
 epoch: 59, train_loss: 0.2454, test_loss: 2.4411, test_f1: 0.6178
 epoch: 60, train_loss: 0.2596, test_loss: 2.4450, test_f1: 0.6262
 epoch: 61, train_loss: 0.2690, test_loss: 2.3270, test_f1: 0.6099
 epoch: 62, train_loss: 0.2561, test_loss: 2.2022, test_f1: 0.6380
 epoch: 63, train_loss: 0.2467, test_loss: 2.5462, test_f1: 0.6274
 epoch: 64, train_loss: 0.2515, test_loss: 2.3628, test_f1: 0.6322
 epoch: 65, train_loss: 0.2294, test_loss: 2.4551, test_f1: 0.5982
 epoch: 66, train_loss: 0.2522, test_loss: 2.4396, test_f1: 0.6339
 epoch: 67, train_loss: 0.2331, test_loss: 2.6631, test_f1: 0.6191
 epoch: 68, train_loss: 0.2452, test_loss: 2.5840, test_f1: 0.6068
 epoch: 69, train_loss: 0.2642, test_loss: 2.4602, test_f1: 0.5995
 epoch: 70, train_loss: 0.2490, test_loss: 2.5452, test_f1: 0.6018
 epoch: 71, train_loss: 0.2379, test_loss: 2.5588, test_f1: 0.6169
 epoch: 72, train_loss: 0.2389, test_loss: 2.6138, test_f1: 0.5954
 epoch: 73, train_loss: 0.2275, test_loss: 2.5614, test_f1: 0.6175
 epoch: 74, train_loss: 0.2273, test_loss: 2.8524, test_f1: 0.6275
 epoch: 75, train_loss: 0.2273, test_loss: 2.7397, test_f1: 0.5841
 epoch: 76, train_loss: 0.2482, test_loss: 2.6672, test_f1: 0.5949
 epoch: 77, train_loss: 0.2210, test_loss: 2.5975, test_f1: 0.6217
 epoch: 78, train_loss: 0.2097, test_loss: 2.7755, test_f1: 0.6235
 epoch: 79, train_loss: 0.2194, test_loss: 2.8509, test_f1: 0.6069
 epoch: 80, train_loss: 0.1992, test_loss: 3.1995, test_f1: 0.5617
 epoch: 81, train_loss: 0.2108, test_loss: 2.9151, test_f1: 0.5706
 epoch: 82, train_loss: 0.2088, test_loss: 2.7384, test_f1: 0.6217
 epoch: 83, train_loss: 0.2523, test_loss: 2.8184, test_f1: 0.5832
 epoch: 84, train_loss: 0.2321, test_loss: 2.6944, test_f1: 0.6225
 epoch: 85, train_loss: 0.1939, test_loss: 2.6787, test_f1: 0.6073
 epoch: 86, train_loss: 0.1950, test_loss: 2.8529, test_f1: 0.5960
 epoch: 87, train_loss: 0.1678, test_loss: 2.9299, test_f1: 0.5905
 epoch: 88, train_loss: 0.1665, test_loss: 2.8917, test_f1: 0.5675
 epoch: 89, train_loss: 0.1672, test_loss: 2.9064, test_f1: 0.6014
 epoch: 90, train_loss: 0.1821, test_loss: 3.1366, test_f1: 0.5802
 epoch: 91, train_loss: 0.1902, test_loss: 2.9265, test_f1: 0.6235
 epoch: 92, train_loss: 0.1982, test_loss: 2.9736, test_f1: 0.6210
 epoch: 93, train_loss: 0.2003, test_loss: 2.8318, test_f1: 0.5925
 epoch: 94, train_loss: 0.2225, test_loss: 2.8549, test_f1: 0.5721
 epoch: 95, train_loss: 0.1565, test_loss: 2.8835, test_f1: 0.6302
 epoch: 96, train_loss: 0.1632, test_loss: 3.1330, test_f1: 0.5747
 epoch: 97, train_loss: 0.1502, test_loss: 2.9544, test_f1: 0.6246
 epoch: 98, train_loss: 0.1847, test_loss: 2.8576, test_f1: 0.6061
 epoch: 99, train_loss: 0.1698, test_loss: 3.3613, test_f1: 0.6044
##################ITERATION #8 ****************************************
 epoch: 0, train_loss: 1.3618, test_loss: 1.2860, test_f1: 0.1541
 epoch: 1, train_loss: 1.0789, test_loss: 1.1630, test_f1: 0.3587
 epoch: 2, train_loss: 1.0153, test_loss: 1.0838, test_f1: 0.4177
 epoch: 3, train_loss: 0.9699, test_loss: 0.9938, test_f1: 0.5401
 epoch: 4, train_loss: 0.9302, test_loss: 1.0869, test_f1: 0.4980
 epoch: 5, train_loss: 0.8895, test_loss: 1.0639, test_f1: 0.5338
 epoch: 6, train_loss: 0.8927, test_loss: 0.9920, test_f1: 0.5444
 epoch: 7, train_loss: 0.8700, test_loss: 1.1036, test_f1: 0.4933
 epoch: 8, train_loss: 0.8400, test_loss: 1.0030, test_f1: 0.5679
 epoch: 9, train_loss: 0.8288, test_loss: 1.0142, test_f1: 0.5633
 epoch: 10, train_loss: 0.8257, test_loss: 0.9530, test_f1: 0.5764
 epoch: 11, train_loss: 0.8038, test_loss: 1.1224, test_f1: 0.5376
 epoch: 12, train_loss: 0.8065, test_loss: 1.1324, test_f1: 0.5607
 epoch: 13, train_loss: 0.8056, test_loss: 1.2078, test_f1: 0.5136
 epoch: 14, train_loss: 0.7746, test_loss: 1.0668, test_f1: 0.5869
 epoch: 15, train_loss: 0.7534, test_loss: 1.2145, test_f1: 0.5539
 epoch: 16, train_loss: 0.7466, test_loss: 1.0296, test_f1: 0.5857
 epoch: 17, train_loss: 0.7025, test_loss: 1.2219, test_f1: 0.5143
 epoch: 18, train_loss: 0.6922, test_loss: 1.1838, test_f1: 0.5859
 epoch: 19, train_loss: 0.7052, test_loss: 1.2971, test_f1: 0.5445
 epoch: 20, train_loss: 0.7125, test_loss: 1.1667, test_f1: 0.5513
 epoch: 21, train_loss: 0.6955, test_loss: 1.1618, test_f1: 0.6115
 epoch: 22, train_loss: 0.6561, test_loss: 1.2237, test_f1: 0.6014
 epoch: 23, train_loss: 0.6566, test_loss: 1.1875, test_f1: 0.6137
 epoch: 24, train_loss: 0.6157, test_loss: 1.2104, test_f1: 0.6194
 epoch: 25, train_loss: 0.6509, test_loss: 1.3231, test_f1: 0.5738
 epoch: 26, train_loss: 0.6093, test_loss: 1.4110, test_f1: 0.5558
 epoch: 27, train_loss: 0.6099, test_loss: 1.3206, test_f1: 0.6164
 epoch: 28, train_loss: 0.6336, test_loss: 1.1367, test_f1: 0.6064
 epoch: 29, train_loss: 0.6079, test_loss: 1.2020, test_f1: 0.5943
 epoch: 30, train_loss: 0.5857, test_loss: 1.2651, test_f1: 0.6030
 epoch: 31, train_loss: 0.5977, test_loss: 1.3520, test_f1: 0.5665
 epoch: 32, train_loss: 0.5860, test_loss: 1.3377, test_f1: 0.5730
 epoch: 33, train_loss: 0.5760, test_loss: 1.3379, test_f1: 0.5803
 epoch: 34, train_loss: 0.5568, test_loss: 1.2636, test_f1: 0.6188
 epoch: 35, train_loss: 0.5879, test_loss: 1.2778, test_f1: 0.5395
 epoch: 36, train_loss: 0.5364, test_loss: 1.1624, test_f1: 0.6611
 epoch: 37, train_loss: 0.5304, test_loss: 1.6523, test_f1: 0.5524
 epoch: 38, train_loss: 0.5238, test_loss: 1.3942, test_f1: 0.5507
 epoch: 39, train_loss: 0.5074, test_loss: 1.4700, test_f1: 0.5636
 epoch: 40, train_loss: 0.5040, test_loss: 1.4532, test_f1: 0.5588
 epoch: 41, train_loss: 0.4643, test_loss: 1.3715, test_f1: 0.5829
 epoch: 42, train_loss: 0.4733, test_loss: 1.5171, test_f1: 0.6126
 epoch: 43, train_loss: 0.4656, test_loss: 1.7124, test_f1: 0.5852
 epoch: 44, train_loss: 0.4421, test_loss: 1.5815, test_f1: 0.5986
 epoch: 45, train_loss: 0.4518, test_loss: 1.6243, test_f1: 0.5600
 epoch: 46, train_loss: 0.4525, test_loss: 1.6358, test_f1: 0.5772
 epoch: 47, train_loss: 0.5005, test_loss: 1.4956, test_f1: 0.6216
 epoch: 48, train_loss: 0.4448, test_loss: 1.7397, test_f1: 0.5314
 epoch: 49, train_loss: 0.4291, test_loss: 1.7078, test_f1: 0.5818
 epoch: 50, train_loss: 0.4380, test_loss: 1.7472, test_f1: 0.6335
 epoch: 51, train_loss: 0.3973, test_loss: 1.6314, test_f1: 0.5877
 epoch: 52, train_loss: 0.3465, test_loss: 1.8114, test_f1: 0.6048
 epoch: 53, train_loss: 0.3398, test_loss: 1.9375, test_f1: 0.5817
 epoch: 54, train_loss: 0.3035, test_loss: 1.9739, test_f1: 0.5890
 epoch: 55, train_loss: 0.3223, test_loss: 2.1334, test_f1: 0.5640
 epoch: 56, train_loss: 0.3036, test_loss: 1.8779, test_f1: 0.6276
 epoch: 57, train_loss: 0.3182, test_loss: 2.0882, test_f1: 0.6188
 epoch: 58, train_loss: 0.2951, test_loss: 2.0414, test_f1: 0.6047
 epoch: 59, train_loss: 0.3113, test_loss: 2.1230, test_f1: 0.5949
 epoch: 60, train_loss: 0.2981, test_loss: 1.9134, test_f1: 0.6269
 epoch: 61, train_loss: 0.3180, test_loss: 2.1368, test_f1: 0.5824
 epoch: 62, train_loss: 0.2923, test_loss: 2.3383, test_f1: 0.5961
 epoch: 63, train_loss: 0.2740, test_loss: 2.2383, test_f1: 0.5897
 epoch: 64, train_loss: 0.2826, test_loss: 2.2408, test_f1: 0.5863
 epoch: 65, train_loss: 0.2785, test_loss: 2.3422, test_f1: 0.6130
 epoch: 66, train_loss: 0.2720, test_loss: 2.4620, test_f1: 0.5906
 epoch: 67, train_loss: 0.2763, test_loss: 2.8908, test_f1: 0.5605
 epoch: 68, train_loss: 0.2641, test_loss: 2.4981, test_f1: 0.6016
 epoch: 69, train_loss: 0.2597, test_loss: 2.5949, test_f1: 0.5966
 epoch: 70, train_loss: 0.2512, test_loss: 2.2750, test_f1: 0.6125
 epoch: 71, train_loss: 0.2522, test_loss: 2.7059, test_f1: 0.5824
 epoch: 72, train_loss: 0.2711, test_loss: 2.4101, test_f1: 0.5734
 epoch: 73, train_loss: 0.2614, test_loss: 2.2730, test_f1: 0.6068
 epoch: 74, train_loss: 0.2256, test_loss: 2.5157, test_f1: 0.5876
 epoch: 75, train_loss: 0.2355, test_loss: 2.5174, test_f1: 0.6037
 epoch: 76, train_loss: 0.2514, test_loss: 2.4826, test_f1: 0.6015
 epoch: 77, train_loss: 0.2746, test_loss: 2.4493, test_f1: 0.5997
 epoch: 78, train_loss: 0.2248, test_loss: 2.6987, test_f1: 0.5758
 epoch: 79, train_loss: 0.2335, test_loss: 2.4822, test_f1: 0.5852
 epoch: 80, train_loss: 0.2326, test_loss: 2.5207, test_f1: 0.6044
 epoch: 81, train_loss: 0.2555, test_loss: 2.6310, test_f1: 0.6297
 epoch: 82, train_loss: 0.2728, test_loss: 2.6847, test_f1: 0.6092
 epoch: 83, train_loss: 0.2628, test_loss: 2.5878, test_f1: 0.5982
 epoch: 84, train_loss: 0.2402, test_loss: 2.7209, test_f1: 0.5886
 epoch: 85, train_loss: 0.2142, test_loss: 2.6180, test_f1: 0.5960
 epoch: 86, train_loss: 0.1953, test_loss: 2.6264, test_f1: 0.6171
 epoch: 87, train_loss: 0.2028, test_loss: 2.9620, test_f1: 0.6070
 epoch: 88, train_loss: 0.2344, test_loss: 2.6883, test_f1: 0.6212
 epoch: 89, train_loss: 0.1994, test_loss: 2.6217, test_f1: 0.6126
 epoch: 90, train_loss: 0.2181, test_loss: 2.3975, test_f1: 0.6106
 epoch: 91, train_loss: 0.2046, test_loss: 2.6310, test_f1: 0.6320
 epoch: 92, train_loss: 0.2048, test_loss: 2.7507, test_f1: 0.6185
 epoch: 93, train_loss: 0.2085, test_loss: 2.7175, test_f1: 0.5882
 epoch: 94, train_loss: 0.2320, test_loss: 2.8043, test_f1: 0.6266
 epoch: 95, train_loss: 0.2323, test_loss: 2.8858, test_f1: 0.5917
 epoch: 96, train_loss: 0.2116, test_loss: 2.7020, test_f1: 0.5775
 epoch: 97, train_loss: 0.2133, test_loss: 2.8957, test_f1: 0.5943
 epoch: 98, train_loss: 0.1910, test_loss: 2.7648, test_f1: 0.5725
 epoch: 99, train_loss: 0.2210, test_loss: 2.7479, test_f1: 0.5946
##################ITERATION #9 ****************************************
 epoch: 0, train_loss: 1.3420, test_loss: 1.5182, test_f1: 0.1365
 epoch: 1, train_loss: 1.1331, test_loss: 1.1531, test_f1: 0.3052
 epoch: 2, train_loss: 1.0321, test_loss: 1.0687, test_f1: 0.4937
 epoch: 3, train_loss: 0.9674, test_loss: 1.0948, test_f1: 0.5139
 epoch: 4, train_loss: 0.9284, test_loss: 1.0177, test_f1: 0.5103
 epoch: 5, train_loss: 0.9052, test_loss: 1.0176, test_f1: 0.5874
 epoch: 6, train_loss: 0.8705, test_loss: 1.0547, test_f1: 0.5269
 epoch: 7, train_loss: 0.8811, test_loss: 1.0523, test_f1: 0.5775
 epoch: 8, train_loss: 0.8556, test_loss: 1.1813, test_f1: 0.5180
 epoch: 9, train_loss: 0.8456, test_loss: 1.1487, test_f1: 0.5166
 epoch: 10, train_loss: 0.8130, test_loss: 1.0010, test_f1: 0.5643
 epoch: 11, train_loss: 0.8075, test_loss: 1.1145, test_f1: 0.5832
 epoch: 12, train_loss: 0.8089, test_loss: 1.2628, test_f1: 0.5082
 epoch: 13, train_loss: 0.7813, test_loss: 1.1770, test_f1: 0.5590
 epoch: 14, train_loss: 0.7826, test_loss: 1.1705, test_f1: 0.5288
 epoch: 15, train_loss: 0.7655, test_loss: 1.1369, test_f1: 0.5817
 epoch: 16, train_loss: 0.7567, test_loss: 1.1824, test_f1: 0.5839
 epoch: 17, train_loss: 0.7277, test_loss: 1.1722, test_f1: 0.6046
 epoch: 18, train_loss: 0.7135, test_loss: 1.2083, test_f1: 0.5899
 epoch: 19, train_loss: 0.6971, test_loss: 1.2810, test_f1: 0.5986
 epoch: 20, train_loss: 0.6702, test_loss: 1.3665, test_f1: 0.5737
 epoch: 21, train_loss: 0.6733, test_loss: 1.2536, test_f1: 0.6132
 epoch: 22, train_loss: 0.6654, test_loss: 1.2306, test_f1: 0.6363
 epoch: 23, train_loss: 0.6675, test_loss: 1.5474, test_f1: 0.5836
 epoch: 24, train_loss: 0.6576, test_loss: 1.5215, test_f1: 0.4921
 epoch: 25, train_loss: 0.6423, test_loss: 1.2491, test_f1: 0.6112
 epoch: 26, train_loss: 0.6415, test_loss: 1.2908, test_f1: 0.5902
 epoch: 27, train_loss: 0.6119, test_loss: 1.5074, test_f1: 0.5348
 epoch: 28, train_loss: 0.5798, test_loss: 1.4582, test_f1: 0.5738
 epoch: 29, train_loss: 0.5928, test_loss: 1.4013, test_f1: 0.5924
 epoch: 30, train_loss: 0.5670, test_loss: 1.3575, test_f1: 0.5922
 epoch: 31, train_loss: 0.5916, test_loss: 1.4896, test_f1: 0.5783
 epoch: 32, train_loss: 0.5357, test_loss: 1.5897, test_f1: 0.5649
 epoch: 33, train_loss: 0.5225, test_loss: 1.5710, test_f1: 0.5630
 epoch: 34, train_loss: 0.5624, test_loss: 1.5331, test_f1: 0.5152
 epoch: 35, train_loss: 0.5327, test_loss: 1.5732, test_f1: 0.5962
 epoch: 36, train_loss: 0.5274, test_loss: 1.5719, test_f1: 0.6087
 epoch: 37, train_loss: 0.5003, test_loss: 1.5810, test_f1: 0.5828
 epoch: 38, train_loss: 0.4958, test_loss: 1.6176, test_f1: 0.5806
 epoch: 39, train_loss: 0.5042, test_loss: 1.6537, test_f1: 0.5471
 epoch: 40, train_loss: 0.4780, test_loss: 2.2506, test_f1: 0.5106
 epoch: 41, train_loss: 0.4880, test_loss: 1.4980, test_f1: 0.5747
 epoch: 42, train_loss: 0.4921, test_loss: 1.6705, test_f1: 0.5516
 epoch: 43, train_loss: 0.4546, test_loss: 1.8550, test_f1: 0.5368
 epoch: 44, train_loss: 0.4568, test_loss: 1.6938, test_f1: 0.5744
 epoch: 45, train_loss: 0.4650, test_loss: 1.5007, test_f1: 0.5785
 epoch: 46, train_loss: 0.4495, test_loss: 1.5830, test_f1: 0.5916
 epoch: 47, train_loss: 0.4187, test_loss: 1.7990, test_f1: 0.5844
 epoch: 48, train_loss: 0.4547, test_loss: 1.6946, test_f1: 0.6021
 epoch: 49, train_loss: 0.3967, test_loss: 1.6934, test_f1: 0.5856
 epoch: 50, train_loss: 0.4214, test_loss: 2.0423, test_f1: 0.6022
 epoch: 51, train_loss: 0.3790, test_loss: 1.6669, test_f1: 0.6056
 epoch: 52, train_loss: 0.3376, test_loss: 1.6818, test_f1: 0.6207
 epoch: 53, train_loss: 0.3256, test_loss: 1.7394, test_f1: 0.5925
 epoch: 54, train_loss: 0.3125, test_loss: 1.9224, test_f1: 0.6052
 epoch: 55, train_loss: 0.2970, test_loss: 2.0497, test_f1: 0.6214
 epoch: 56, train_loss: 0.3042, test_loss: 2.0681, test_f1: 0.5972
 epoch: 57, train_loss: 0.2683, test_loss: 2.4671, test_f1: 0.5493
 epoch: 58, train_loss: 0.3076, test_loss: 2.1473, test_f1: 0.6199
 epoch: 59, train_loss: 0.2763, test_loss: 2.1672, test_f1: 0.5904
 epoch: 60, train_loss: 0.2803, test_loss: 2.2814, test_f1: 0.5707
 epoch: 61, train_loss: 0.3136, test_loss: 2.0043, test_f1: 0.5881
 epoch: 62, train_loss: 0.2978, test_loss: 2.2483, test_f1: 0.5802
 epoch: 63, train_loss: 0.2876, test_loss: 1.9640, test_f1: 0.6089
 epoch: 64, train_loss: 0.2712, test_loss: 2.3750, test_f1: 0.5832
 epoch: 65, train_loss: 0.2783, test_loss: 2.4526, test_f1: 0.5829
 epoch: 66, train_loss: 0.2610, test_loss: 1.9847, test_f1: 0.5830
 epoch: 67, train_loss: 0.2840, test_loss: 2.2488, test_f1: 0.5920
 epoch: 68, train_loss: 0.2675, test_loss: 2.2916, test_f1: 0.5711
 epoch: 69, train_loss: 0.2826, test_loss: 2.5314, test_f1: 0.6065
 epoch: 70, train_loss: 0.2786, test_loss: 2.4201, test_f1: 0.5838
 epoch: 71, train_loss: 0.2532, test_loss: 2.3416, test_f1: 0.6041
 epoch: 72, train_loss: 0.2346, test_loss: 2.4305, test_f1: 0.6012
 epoch: 73, train_loss: 0.2434, test_loss: 2.4171, test_f1: 0.6022
 epoch: 74, train_loss: 0.2412, test_loss: 2.2813, test_f1: 0.5770
 epoch: 75, train_loss: 0.2371, test_loss: 2.7441, test_f1: 0.5867
 epoch: 76, train_loss: 0.2277, test_loss: 2.6424, test_f1: 0.5829
 epoch: 77, train_loss: 0.2222, test_loss: 2.6128, test_f1: 0.5915
 epoch: 78, train_loss: 0.2274, test_loss: 2.6976, test_f1: 0.5772
 epoch: 79, train_loss: 0.2258, test_loss: 2.7819, test_f1: 0.5927
 epoch: 80, train_loss: 0.2304, test_loss: 2.7795, test_f1: 0.5516
 epoch: 81, train_loss: 0.2280, test_loss: 2.3219, test_f1: 0.5945
 epoch: 82, train_loss: 0.2088, test_loss: 2.6146, test_f1: 0.5943
 epoch: 83, train_loss: 0.1974, test_loss: 2.5977, test_f1: 0.5788
 epoch: 84, train_loss: 0.2028, test_loss: 2.7514, test_f1: 0.5844
 epoch: 85, train_loss: 0.2542, test_loss: 2.6221, test_f1: 0.5713
 epoch: 86, train_loss: 0.2598, test_loss: 2.8603, test_f1: 0.5875
 epoch: 87, train_loss: 0.2546, test_loss: 2.3323, test_f1: 0.6066
 epoch: 88, train_loss: 0.2214, test_loss: 2.2512, test_f1: 0.5896
 epoch: 89, train_loss: 0.2109, test_loss: 2.6781, test_f1: 0.5791
 epoch: 90, train_loss: 0.2286, test_loss: 2.4702, test_f1: 0.5792
 epoch: 91, train_loss: 0.2349, test_loss: 2.5126, test_f1: 0.5963
 epoch: 92, train_loss: 0.1859, test_loss: 2.4870, test_f1: 0.6052
 epoch: 93, train_loss: 0.2185, test_loss: 2.9523, test_f1: 0.5771
 epoch: 94, train_loss: 0.2079, test_loss: 2.5634, test_f1: 0.5922
 epoch: 95, train_loss: 0.1994, test_loss: 2.6573, test_f1: 0.5762
 epoch: 96, train_loss: 0.1820, test_loss: 3.0538, test_f1: 0.5861
 epoch: 97, train_loss: 0.1855, test_loss: 2.7854, test_f1: 0.6100
 epoch: 98, train_loss: 0.1858, test_loss: 3.1844, test_f1: 0.5859
 epoch: 99, train_loss: 0.1865, test_loss: 2.8122, test_f1: 0.5914

Training completed in 502.89 seconds
Best F1: 0.6638 at epoch 37
Mean F1 across iterations: 0.6462  0.0126
========================FINAL RESULTS================================
FEGIN weighted F1: 0.6638  0.0126
python main.py --data ltspice_demos --representation component_net --model FEGIN --layers 5 --hiddens 128 --batch_size 64 --lr 0.001 --emb_size 250 --epochs 100 --save_appendix component_net_L5_H128_BS64_LR0.001_E250 --no_val
-----



STDERR:
  File "main.py", line 370, in <module>
    main()
  File "main.py", line 254, in main
    dataset = dataset_class(
  File "/home/philip/projects/ltspice_examples_code_repo/Circuit-Completion-Using-GNNs/component_classification_with_link_prediction_head/evaluation/FEGIN/kernel/circuit_datasets.py", line 15, in __init__
    self.data, self.slices = torch.load(self.processed_paths[0])
  File "/home/philip/.local/lib/python3.8/site-packages/torch/serialization.py", line 1040, in load
    warnings.warn(
  File "/usr/lib/python3.8/warnings.py", line 109, in _showwarnmsg
    sw(msg.message, msg.category, msg.filename, msg.lineno,
  File "main.py", line 47, in warn_with_traceback
    traceback.print_stack(file=log)
/home/philip/projects/ltspice_examples_code_repo/Circuit-Completion-Using-GNNs/component_classification_with_link_prediction_head/evaluation/FEGIN/kernel/circuit_datasets.py:15: FutureWarning: You are using `torch.load` with `weights_only=False` (the current default value), which uses the default pickle module implicitly. It is possible to construct malicious pickle data which will execute arbitrary code during unpickling (See https://github.com/pytorch/pytorch/blob/main/SECURITY.md#untrusted-models for more details). In a future release, the default value for `weights_only` will be flipped to `True`. This limits the functions that could be executed during unpickling. Arbitrary objects will no longer be allowed to be loaded via this mode unless they are explicitly allowlisted by the user via `torch.serialization.add_safe_globals`. We recommend you start setting `weights_only=True` for any use case where you don't have full control of the loaded file. Please open an issue on GitHub for any issues related to this experimental feature.
  self.data, self.slices = torch.load(self.processed_paths[0])
