STDOUT:
Results will be saved in /home/philip/projects/ltspice_examples_code_repo/Circuit-Completion-Using-GNNs/component_classification_with_link_prediction_head/evaluation/FEGIN/results/model_FEGIN_dataset_ltspice_examples
Command line input: python main.py --data ltspice_examples --representation component_pin_net --model FEGIN --layers 5 --hiddens 32 --batch_size 32 --lr 0.001 --emb_size 128 --epochs 100 --save_appendix component_pin_net_L5_H32_BS32_LR0.001_E128 --no_val
 is saved.
-----
ltspice_examples - FEGIN
Using 5 layers, 32 hidden units, h = 2
Loading component_pin_net representation dataset
ENTERED
Training FEGIN on component_pin_net representation
Train: 3558, Test: 846
##################ITERATION #0 ****************************************
 epoch: 0, train_loss: 1.2140, test_loss: 1.0697, test_f1: 0.4158
 epoch: 1, train_loss: 1.0448, test_loss: 1.0367, test_f1: 0.4738
 epoch: 2, train_loss: 1.0116, test_loss: 1.0146, test_f1: 0.5080
 epoch: 3, train_loss: 1.0016, test_loss: 0.9899, test_f1: 0.5076
 epoch: 4, train_loss: 0.9706, test_loss: 1.0117, test_f1: 0.5055
 epoch: 5, train_loss: 0.9560, test_loss: 0.9381, test_f1: 0.4832
 epoch: 6, train_loss: 0.9572, test_loss: 0.9488, test_f1: 0.5041
 epoch: 7, train_loss: 0.9394, test_loss: 0.9185, test_f1: 0.5401
 epoch: 8, train_loss: 0.9357, test_loss: 0.9256, test_f1: 0.5374
 epoch: 9, train_loss: 0.9244, test_loss: 0.9237, test_f1: 0.5307
 epoch: 10, train_loss: 0.9092, test_loss: 0.9474, test_f1: 0.5079
 epoch: 11, train_loss: 0.9112, test_loss: 0.8820, test_f1: 0.5362
 epoch: 12, train_loss: 0.8979, test_loss: 0.8500, test_f1: 0.5471
 epoch: 13, train_loss: 0.8907, test_loss: 0.8675, test_f1: 0.5456
 epoch: 14, train_loss: 0.8742, test_loss: 0.8691, test_f1: 0.5294
 epoch: 15, train_loss: 0.8747, test_loss: 0.8544, test_f1: 0.5390
 epoch: 16, train_loss: 0.8564, test_loss: 0.9043, test_f1: 0.5194
 epoch: 17, train_loss: 0.8558, test_loss: 0.9109, test_f1: 0.5227
 epoch: 18, train_loss: 0.8638, test_loss: 0.8461, test_f1: 0.5350
 epoch: 19, train_loss: 0.8404, test_loss: 0.9118, test_f1: 0.5462
 epoch: 20, train_loss: 0.8373, test_loss: 0.8997, test_f1: 0.5760
 epoch: 21, train_loss: 0.8331, test_loss: 0.9216, test_f1: 0.5565
 epoch: 22, train_loss: 0.8195, test_loss: 0.9311, test_f1: 0.5733
 epoch: 23, train_loss: 0.8071, test_loss: 0.8992, test_f1: 0.5772
 epoch: 24, train_loss: 0.8148, test_loss: 0.8879, test_f1: 0.5605
 epoch: 25, train_loss: 0.7897, test_loss: 0.9072, test_f1: 0.5390
 epoch: 26, train_loss: 0.7818, test_loss: 0.9124, test_f1: 0.5997
 epoch: 27, train_loss: 0.7773, test_loss: 0.8848, test_f1: 0.5779
 epoch: 28, train_loss: 0.7872, test_loss: 0.9049, test_f1: 0.5793
 epoch: 29, train_loss: 0.7714, test_loss: 0.9452, test_f1: 0.5529
 epoch: 30, train_loss: 0.7656, test_loss: 0.9497, test_f1: 0.5752
 epoch: 31, train_loss: 0.7545, test_loss: 0.9291, test_f1: 0.5655
 epoch: 32, train_loss: 0.7569, test_loss: 0.9114, test_f1: 0.5810
 epoch: 33, train_loss: 0.7574, test_loss: 0.8980, test_f1: 0.5842
 epoch: 34, train_loss: 0.7521, test_loss: 0.9594, test_f1: 0.5365
 epoch: 35, train_loss: 0.7361, test_loss: 0.9755, test_f1: 0.5853
 epoch: 36, train_loss: 0.7299, test_loss: 0.8658, test_f1: 0.6081
 epoch: 37, train_loss: 0.7218, test_loss: 0.9494, test_f1: 0.6093
 epoch: 38, train_loss: 0.7219, test_loss: 0.9348, test_f1: 0.5678
 epoch: 39, train_loss: 0.7160, test_loss: 0.9081, test_f1: 0.5968
 epoch: 40, train_loss: 0.7244, test_loss: 0.8668, test_f1: 0.6451
 epoch: 41, train_loss: 0.6991, test_loss: 0.9331, test_f1: 0.5934
 epoch: 42, train_loss: 0.6812, test_loss: 0.9520, test_f1: 0.5921
 epoch: 43, train_loss: 0.7104, test_loss: 0.8858, test_f1: 0.6402
 epoch: 44, train_loss: 0.6835, test_loss: 0.9066, test_f1: 0.6389
 epoch: 45, train_loss: 0.6706, test_loss: 0.8811, test_f1: 0.6488
 epoch: 46, train_loss: 0.6715, test_loss: 0.8875, test_f1: 0.5841
 epoch: 47, train_loss: 0.6738, test_loss: 0.9137, test_f1: 0.6093
 epoch: 48, train_loss: 0.6651, test_loss: 0.9102, test_f1: 0.5925
 epoch: 49, train_loss: 0.6585, test_loss: 0.9094, test_f1: 0.6297
 epoch: 50, train_loss: 0.6490, test_loss: 0.9541, test_f1: 0.6019
 epoch: 51, train_loss: 0.6469, test_loss: 0.9142, test_f1: 0.6325
 epoch: 52, train_loss: 0.6233, test_loss: 0.8844, test_f1: 0.6436
 epoch: 53, train_loss: 0.6170, test_loss: 0.9311, test_f1: 0.6232
 epoch: 54, train_loss: 0.6137, test_loss: 0.9037, test_f1: 0.6353
 epoch: 55, train_loss: 0.6146, test_loss: 0.9052, test_f1: 0.6587
 epoch: 56, train_loss: 0.6054, test_loss: 0.9191, test_f1: 0.6368
 epoch: 57, train_loss: 0.6023, test_loss: 0.9660, test_f1: 0.6034
 epoch: 58, train_loss: 0.5939, test_loss: 0.9203, test_f1: 0.6335
 epoch: 59, train_loss: 0.6056, test_loss: 0.9130, test_f1: 0.6230
 epoch: 60, train_loss: 0.5918, test_loss: 0.9390, test_f1: 0.6492
 epoch: 61, train_loss: 0.5883, test_loss: 0.9012, test_f1: 0.6351
 epoch: 62, train_loss: 0.6066, test_loss: 0.9215, test_f1: 0.6506
 epoch: 63, train_loss: 0.6038, test_loss: 0.9520, test_f1: 0.6364
 epoch: 64, train_loss: 0.5878, test_loss: 0.9801, test_f1: 0.6320
 epoch: 65, train_loss: 0.5921, test_loss: 0.9422, test_f1: 0.6618
 epoch: 66, train_loss: 0.5914, test_loss: 0.9046, test_f1: 0.6440
 epoch: 67, train_loss: 0.5935, test_loss: 0.9428, test_f1: 0.6281
 epoch: 68, train_loss: 0.5782, test_loss: 0.8944, test_f1: 0.6458
 epoch: 69, train_loss: 0.5890, test_loss: 0.8860, test_f1: 0.6577
 epoch: 70, train_loss: 0.5726, test_loss: 0.9080, test_f1: 0.6612
 epoch: 71, train_loss: 0.5811, test_loss: 0.9163, test_f1: 0.6469
 epoch: 72, train_loss: 0.5833, test_loss: 0.9231, test_f1: 0.6560
 epoch: 73, train_loss: 0.5582, test_loss: 0.9571, test_f1: 0.6421
 epoch: 74, train_loss: 0.5685, test_loss: 0.9249, test_f1: 0.6482
 epoch: 75, train_loss: 0.5620, test_loss: 0.9974, test_f1: 0.6253
 epoch: 76, train_loss: 0.5673, test_loss: 0.9203, test_f1: 0.6475
 epoch: 77, train_loss: 0.5514, test_loss: 0.9738, test_f1: 0.6610
 epoch: 78, train_loss: 0.5601, test_loss: 1.0122, test_f1: 0.6435
 epoch: 79, train_loss: 0.5509, test_loss: 1.0019, test_f1: 0.6295
 epoch: 80, train_loss: 0.5613, test_loss: 1.0542, test_f1: 0.6427
 epoch: 81, train_loss: 0.5658, test_loss: 1.0062, test_f1: 0.6430
 epoch: 82, train_loss: 0.5456, test_loss: 0.9926, test_f1: 0.6541
 epoch: 83, train_loss: 0.5516, test_loss: 1.0364, test_f1: 0.6272
 epoch: 84, train_loss: 0.5537, test_loss: 0.9775, test_f1: 0.6283
 epoch: 85, train_loss: 0.5409, test_loss: 1.0140, test_f1: 0.6165
 epoch: 86, train_loss: 0.5412, test_loss: 1.0068, test_f1: 0.6521
 epoch: 87, train_loss: 0.5423, test_loss: 0.9866, test_f1: 0.6523
 epoch: 88, train_loss: 0.5235, test_loss: 0.9744, test_f1: 0.6348
 epoch: 89, train_loss: 0.5448, test_loss: 1.0199, test_f1: 0.6413
 epoch: 90, train_loss: 0.5486, test_loss: 1.0790, test_f1: 0.6229
 epoch: 91, train_loss: 0.5401, test_loss: 1.0103, test_f1: 0.6401
 epoch: 92, train_loss: 0.5393, test_loss: 1.1060, test_f1: 0.6231
 epoch: 93, train_loss: 0.5422, test_loss: 0.9934, test_f1: 0.6414
 epoch: 94, train_loss: 0.5627, test_loss: 0.9803, test_f1: 0.6464
 epoch: 95, train_loss: 0.5391, test_loss: 1.0359, test_f1: 0.6306
 epoch: 96, train_loss: 0.5307, test_loss: 1.0510, test_f1: 0.6130
 epoch: 97, train_loss: 0.5210, test_loss: 1.0939, test_f1: 0.6202
 epoch: 98, train_loss: 0.5354, test_loss: 1.0366, test_f1: 0.6264
 epoch: 99, train_loss: 0.5281, test_loss: 1.0092, test_f1: 0.6261
##################ITERATION #1 ****************************************
 epoch: 0, train_loss: 1.1246, test_loss: 1.0536, test_f1: 0.4829
 epoch: 1, train_loss: 1.0079, test_loss: 1.0033, test_f1: 0.4762
 epoch: 2, train_loss: 0.9769, test_loss: 0.9554, test_f1: 0.4946
 epoch: 3, train_loss: 0.9587, test_loss: 0.9479, test_f1: 0.5227
 epoch: 4, train_loss: 0.9402, test_loss: 0.8920, test_f1: 0.5110
 epoch: 5, train_loss: 0.9441, test_loss: 0.9325, test_f1: 0.5120
 epoch: 6, train_loss: 0.9256, test_loss: 0.9272, test_f1: 0.4722
 epoch: 7, train_loss: 0.8950, test_loss: 0.8927, test_f1: 0.5346
 epoch: 8, train_loss: 0.8792, test_loss: 0.8886, test_f1: 0.5337
 epoch: 9, train_loss: 0.8741, test_loss: 0.8465, test_f1: 0.5585
 epoch: 10, train_loss: 0.8723, test_loss: 0.9059, test_f1: 0.5706
 epoch: 11, train_loss: 0.8535, test_loss: 0.8583, test_f1: 0.5356
 epoch: 12, train_loss: 0.8496, test_loss: 0.9657, test_f1: 0.5554
 epoch: 13, train_loss: 0.8212, test_loss: 0.9219, test_f1: 0.5257
 epoch: 14, train_loss: 0.8253, test_loss: 0.8816, test_f1: 0.5854
 epoch: 15, train_loss: 0.8033, test_loss: 0.9035, test_f1: 0.5540
 epoch: 16, train_loss: 0.8026, test_loss: 0.9036, test_f1: 0.5580
 epoch: 17, train_loss: 0.7914, test_loss: 0.8464, test_f1: 0.6047
 epoch: 18, train_loss: 0.7840, test_loss: 0.8365, test_f1: 0.5825
 epoch: 19, train_loss: 0.7547, test_loss: 0.8350, test_f1: 0.6129
 epoch: 20, train_loss: 0.7733, test_loss: 0.8391, test_f1: 0.6010
 epoch: 21, train_loss: 0.7483, test_loss: 0.8534, test_f1: 0.5981
 epoch: 22, train_loss: 0.7602, test_loss: 0.7930, test_f1: 0.6048
 epoch: 23, train_loss: 0.7376, test_loss: 0.8666, test_f1: 0.6335
 epoch: 24, train_loss: 0.7169, test_loss: 0.8495, test_f1: 0.6440
 epoch: 25, train_loss: 0.7222, test_loss: 0.8528, test_f1: 0.5905
 epoch: 26, train_loss: 0.7307, test_loss: 0.8319, test_f1: 0.6148
 epoch: 27, train_loss: 0.7283, test_loss: 0.7952, test_f1: 0.6086
 epoch: 28, train_loss: 0.7249, test_loss: 0.8275, test_f1: 0.6313
 epoch: 29, train_loss: 0.7102, test_loss: 0.7864, test_f1: 0.6694
 epoch: 30, train_loss: 0.7161, test_loss: 0.8369, test_f1: 0.6311
 epoch: 31, train_loss: 0.6925, test_loss: 0.8153, test_f1: 0.6693
 epoch: 32, train_loss: 0.6872, test_loss: 0.7868, test_f1: 0.6577
 epoch: 33, train_loss: 0.6763, test_loss: 0.8152, test_f1: 0.6254
 epoch: 34, train_loss: 0.7142, test_loss: 0.8491, test_f1: 0.6411
 epoch: 35, train_loss: 0.6784, test_loss: 0.7866, test_f1: 0.6570
 epoch: 36, train_loss: 0.6761, test_loss: 0.7698, test_f1: 0.6429
 epoch: 37, train_loss: 0.6579, test_loss: 0.9030, test_f1: 0.5958
 epoch: 38, train_loss: 0.6597, test_loss: 0.8037, test_f1: 0.6771
 epoch: 39, train_loss: 0.6439, test_loss: 0.8170, test_f1: 0.6304
 epoch: 40, train_loss: 0.6632, test_loss: 0.7348, test_f1: 0.6744
 epoch: 41, train_loss: 0.6558, test_loss: 0.8054, test_f1: 0.6499
 epoch: 42, train_loss: 0.6567, test_loss: 0.8200, test_f1: 0.6438
 epoch: 43, train_loss: 0.6598, test_loss: 0.8048, test_f1: 0.6671
 epoch: 44, train_loss: 0.6620, test_loss: 0.8764, test_f1: 0.6433
 epoch: 45, train_loss: 0.6475, test_loss: 0.8939, test_f1: 0.6653
 epoch: 46, train_loss: 0.6410, test_loss: 0.8356, test_f1: 0.6458
 epoch: 47, train_loss: 0.6260, test_loss: 0.8635, test_f1: 0.6476
 epoch: 48, train_loss: 0.6272, test_loss: 0.8747, test_f1: 0.6209
 epoch: 49, train_loss: 0.6316, test_loss: 0.7891, test_f1: 0.6796
 epoch: 50, train_loss: 0.6104, test_loss: 0.8623, test_f1: 0.6529
 epoch: 51, train_loss: 0.6022, test_loss: 0.8622, test_f1: 0.6417
 epoch: 52, train_loss: 0.5902, test_loss: 0.8309, test_f1: 0.6577
 epoch: 53, train_loss: 0.5819, test_loss: 0.8030, test_f1: 0.6655
 epoch: 54, train_loss: 0.5728, test_loss: 0.7954, test_f1: 0.6778
 epoch: 55, train_loss: 0.5687, test_loss: 0.8235, test_f1: 0.6685
 epoch: 56, train_loss: 0.5886, test_loss: 0.8561, test_f1: 0.6545
 epoch: 57, train_loss: 0.5754, test_loss: 0.8129, test_f1: 0.6652
 epoch: 58, train_loss: 0.5725, test_loss: 0.8547, test_f1: 0.6826
 epoch: 59, train_loss: 0.5714, test_loss: 0.8254, test_f1: 0.6832
 epoch: 60, train_loss: 0.5647, test_loss: 0.9059, test_f1: 0.6830
 epoch: 61, train_loss: 0.5506, test_loss: 0.8745, test_f1: 0.6722
 epoch: 62, train_loss: 0.5531, test_loss: 0.9356, test_f1: 0.6764
 epoch: 63, train_loss: 0.5474, test_loss: 0.8964, test_f1: 0.6558
 epoch: 64, train_loss: 0.5485, test_loss: 0.9260, test_f1: 0.6880
 epoch: 65, train_loss: 0.5649, test_loss: 0.8583, test_f1: 0.6827
 epoch: 66, train_loss: 0.5488, test_loss: 0.8781, test_f1: 0.6759
 epoch: 67, train_loss: 0.5532, test_loss: 0.8495, test_f1: 0.6671
 epoch: 68, train_loss: 0.5432, test_loss: 0.9261, test_f1: 0.6465
 epoch: 69, train_loss: 0.5390, test_loss: 0.8472, test_f1: 0.6743
 epoch: 70, train_loss: 0.5407, test_loss: 0.8636, test_f1: 0.6777
 epoch: 71, train_loss: 0.5436, test_loss: 0.8937, test_f1: 0.6637
 epoch: 72, train_loss: 0.5359, test_loss: 0.9205, test_f1: 0.6603
 epoch: 73, train_loss: 0.5390, test_loss: 0.8930, test_f1: 0.6792
 epoch: 74, train_loss: 0.5458, test_loss: 1.0108, test_f1: 0.6673
 epoch: 75, train_loss: 0.5453, test_loss: 0.9124, test_f1: 0.6479
 epoch: 76, train_loss: 0.5337, test_loss: 0.9068, test_f1: 0.6718
 epoch: 77, train_loss: 0.5324, test_loss: 0.9264, test_f1: 0.6852
 epoch: 78, train_loss: 0.5207, test_loss: 0.9071, test_f1: 0.6577
 epoch: 79, train_loss: 0.5257, test_loss: 0.9349, test_f1: 0.6602
 epoch: 80, train_loss: 0.5366, test_loss: 0.9505, test_f1: 0.6520
 epoch: 81, train_loss: 0.5101, test_loss: 0.9721, test_f1: 0.6800
 epoch: 82, train_loss: 0.5309, test_loss: 0.9509, test_f1: 0.6779
 epoch: 83, train_loss: 0.5072, test_loss: 0.9568, test_f1: 0.6797
 epoch: 84, train_loss: 0.5033, test_loss: 0.9622, test_f1: 0.6351
 epoch: 85, train_loss: 0.5083, test_loss: 0.9684, test_f1: 0.6724
 epoch: 86, train_loss: 0.5118, test_loss: 0.9097, test_f1: 0.6782
 epoch: 87, train_loss: 0.5035, test_loss: 0.8845, test_f1: 0.6582
 epoch: 88, train_loss: 0.5312, test_loss: 0.9463, test_f1: 0.6787
 epoch: 89, train_loss: 0.4889, test_loss: 1.0093, test_f1: 0.6907
 epoch: 90, train_loss: 0.5067, test_loss: 0.9734, test_f1: 0.6703
 epoch: 91, train_loss: 0.5188, test_loss: 1.0052, test_f1: 0.6763
 epoch: 92, train_loss: 0.5005, test_loss: 0.9808, test_f1: 0.6672
 epoch: 93, train_loss: 0.5047, test_loss: 0.9609, test_f1: 0.6920
 epoch: 94, train_loss: 0.5003, test_loss: 0.9863, test_f1: 0.6797
 epoch: 95, train_loss: 0.4988, test_loss: 1.0725, test_f1: 0.6528
 epoch: 96, train_loss: 0.5101, test_loss: 0.9822, test_f1: 0.6776
 epoch: 97, train_loss: 0.4867, test_loss: 1.0073, test_f1: 0.6988
 epoch: 98, train_loss: 0.4930, test_loss: 1.0324, test_f1: 0.6550
 epoch: 99, train_loss: 0.4897, test_loss: 1.0853, test_f1: 0.6760
##################ITERATION #2 ****************************************
 epoch: 0, train_loss: 1.1223, test_loss: 0.9880, test_f1: 0.4823
 epoch: 1, train_loss: 0.9972, test_loss: 0.9693, test_f1: 0.4861
 epoch: 2, train_loss: 0.9648, test_loss: 0.8894, test_f1: 0.5265
 epoch: 3, train_loss: 0.9394, test_loss: 0.9431, test_f1: 0.5333
 epoch: 4, train_loss: 0.9109, test_loss: 0.9162, test_f1: 0.5317
 epoch: 5, train_loss: 0.9075, test_loss: 0.8826, test_f1: 0.5482
 epoch: 6, train_loss: 0.8951, test_loss: 0.8468, test_f1: 0.5588
 epoch: 7, train_loss: 0.8758, test_loss: 0.8858, test_f1: 0.5518
 epoch: 8, train_loss: 0.8662, test_loss: 0.8189, test_f1: 0.5825
 epoch: 9, train_loss: 0.8582, test_loss: 0.8078, test_f1: 0.5754
 epoch: 10, train_loss: 0.8456, test_loss: 0.8397, test_f1: 0.5499
 epoch: 11, train_loss: 0.8462, test_loss: 0.7955, test_f1: 0.6072
 epoch: 12, train_loss: 0.8141, test_loss: 0.8361, test_f1: 0.5752
 epoch: 13, train_loss: 0.8149, test_loss: 0.8193, test_f1: 0.5812
 epoch: 14, train_loss: 0.7966, test_loss: 0.8382, test_f1: 0.5920
 epoch: 15, train_loss: 0.7885, test_loss: 0.8050, test_f1: 0.6046
 epoch: 16, train_loss: 0.7748, test_loss: 0.7898, test_f1: 0.5961
 epoch: 17, train_loss: 0.7711, test_loss: 0.8019, test_f1: 0.6547
 epoch: 18, train_loss: 0.7679, test_loss: 0.7839, test_f1: 0.5705
 epoch: 19, train_loss: 0.7598, test_loss: 0.7994, test_f1: 0.5942
 epoch: 20, train_loss: 0.7433, test_loss: 0.8813, test_f1: 0.6065
 epoch: 21, train_loss: 0.7367, test_loss: 0.7663, test_f1: 0.6092
 epoch: 22, train_loss: 0.7505, test_loss: 0.8358, test_f1: 0.5960
 epoch: 23, train_loss: 0.7356, test_loss: 0.8070, test_f1: 0.5976
 epoch: 24, train_loss: 0.7297, test_loss: 0.8093, test_f1: 0.5869
 epoch: 25, train_loss: 0.7182, test_loss: 0.8162, test_f1: 0.6321
 epoch: 26, train_loss: 0.7082, test_loss: 0.7956, test_f1: 0.6065
 epoch: 27, train_loss: 0.7061, test_loss: 0.8462, test_f1: 0.5926
 epoch: 28, train_loss: 0.7053, test_loss: 0.8178, test_f1: 0.6267
 epoch: 29, train_loss: 0.6928, test_loss: 0.8247, test_f1: 0.6423
 epoch: 30, train_loss: 0.6874, test_loss: 0.8695, test_f1: 0.6333
 epoch: 31, train_loss: 0.6942, test_loss: 0.8112, test_f1: 0.6110
 epoch: 32, train_loss: 0.6956, test_loss: 0.7415, test_f1: 0.6338
 epoch: 33, train_loss: 0.6815, test_loss: 0.7794, test_f1: 0.6433
 epoch: 34, train_loss: 0.6858, test_loss: 0.8386, test_f1: 0.6274
 epoch: 35, train_loss: 0.6579, test_loss: 0.8194, test_f1: 0.6619
 epoch: 36, train_loss: 0.6600, test_loss: 0.8033, test_f1: 0.6459
 epoch: 37, train_loss: 0.6571, test_loss: 0.7891, test_f1: 0.6727
 epoch: 38, train_loss: 0.6433, test_loss: 0.8135, test_f1: 0.6109
 epoch: 39, train_loss: 0.6521, test_loss: 0.8008, test_f1: 0.6420
 epoch: 40, train_loss: 0.6218, test_loss: 0.8451, test_f1: 0.6087
 epoch: 41, train_loss: 0.6363, test_loss: 0.8920, test_f1: 0.6100
 epoch: 42, train_loss: 0.6421, test_loss: 0.8691, test_f1: 0.6558
 epoch: 43, train_loss: 0.6391, test_loss: 0.8560, test_f1: 0.6351
 epoch: 44, train_loss: 0.6393, test_loss: 0.8337, test_f1: 0.6681
 epoch: 45, train_loss: 0.6399, test_loss: 0.8500, test_f1: 0.6686
 epoch: 46, train_loss: 0.6204, test_loss: 0.8516, test_f1: 0.6543
 epoch: 47, train_loss: 0.6267, test_loss: 0.8195, test_f1: 0.6419
 epoch: 48, train_loss: 0.6202, test_loss: 0.8781, test_f1: 0.6338
 epoch: 49, train_loss: 0.6169, test_loss: 0.8501, test_f1: 0.6417
 epoch: 50, train_loss: 0.6286, test_loss: 0.7566, test_f1: 0.6557
 epoch: 51, train_loss: 0.5828, test_loss: 0.7673, test_f1: 0.6566
 epoch: 52, train_loss: 0.5758, test_loss: 0.8131, test_f1: 0.6519
 epoch: 53, train_loss: 0.5722, test_loss: 0.8228, test_f1: 0.6586
 epoch: 54, train_loss: 0.5604, test_loss: 0.8184, test_f1: 0.6739
 epoch: 55, train_loss: 0.5610, test_loss: 0.8520, test_f1: 0.6488
 epoch: 56, train_loss: 0.5544, test_loss: 0.7953, test_f1: 0.6467
 epoch: 57, train_loss: 0.5588, test_loss: 0.8354, test_f1: 0.6354
 epoch: 58, train_loss: 0.5586, test_loss: 0.9010, test_f1: 0.6382
 epoch: 59, train_loss: 0.5523, test_loss: 0.9101, test_f1: 0.6256
 epoch: 60, train_loss: 0.5431, test_loss: 0.8342, test_f1: 0.6729
 epoch: 61, train_loss: 0.5479, test_loss: 0.9114, test_f1: 0.6684
 epoch: 62, train_loss: 0.5447, test_loss: 0.9169, test_f1: 0.6774
 epoch: 63, train_loss: 0.5399, test_loss: 0.7831, test_f1: 0.6746
 epoch: 64, train_loss: 0.5350, test_loss: 0.9247, test_f1: 0.6678
 epoch: 65, train_loss: 0.5296, test_loss: 0.7869, test_f1: 0.6604
 epoch: 66, train_loss: 0.5223, test_loss: 0.8517, test_f1: 0.6632
 epoch: 67, train_loss: 0.5275, test_loss: 0.8813, test_f1: 0.6703
 epoch: 68, train_loss: 0.5157, test_loss: 0.8737, test_f1: 0.6705
 epoch: 69, train_loss: 0.5317, test_loss: 0.8871, test_f1: 0.6497
 epoch: 70, train_loss: 0.5143, test_loss: 0.8769, test_f1: 0.6550
 epoch: 71, train_loss: 0.5219, test_loss: 0.9103, test_f1: 0.6611
 epoch: 72, train_loss: 0.5095, test_loss: 0.8997, test_f1: 0.6662
 epoch: 73, train_loss: 0.5219, test_loss: 0.8982, test_f1: 0.6672
 epoch: 74, train_loss: 0.4955, test_loss: 0.8579, test_f1: 0.6668
 epoch: 75, train_loss: 0.5129, test_loss: 0.9577, test_f1: 0.6770
 epoch: 76, train_loss: 0.5044, test_loss: 0.8541, test_f1: 0.6482
 epoch: 77, train_loss: 0.5080, test_loss: 0.9250, test_f1: 0.6394
 epoch: 78, train_loss: 0.4892, test_loss: 0.9562, test_f1: 0.6737
 epoch: 79, train_loss: 0.5021, test_loss: 0.8745, test_f1: 0.6678
 epoch: 80, train_loss: 0.4875, test_loss: 0.9196, test_f1: 0.6370
 epoch: 81, train_loss: 0.4935, test_loss: 0.9431, test_f1: 0.6479
 epoch: 82, train_loss: 0.4846, test_loss: 0.9781, test_f1: 0.6510
 epoch: 83, train_loss: 0.5044, test_loss: 0.9044, test_f1: 0.6478
 epoch: 84, train_loss: 0.4836, test_loss: 0.9548, test_f1: 0.6475
 epoch: 85, train_loss: 0.4682, test_loss: 0.9672, test_f1: 0.6562
 epoch: 86, train_loss: 0.4952, test_loss: 0.9718, test_f1: 0.6602
 epoch: 87, train_loss: 0.4719, test_loss: 0.9821, test_f1: 0.6817
 epoch: 88, train_loss: 0.4686, test_loss: 0.9423, test_f1: 0.6615
 epoch: 89, train_loss: 0.4754, test_loss: 1.0568, test_f1: 0.6625
 epoch: 90, train_loss: 0.4878, test_loss: 1.0173, test_f1: 0.6386
 epoch: 91, train_loss: 0.4661, test_loss: 0.9346, test_f1: 0.6605
 epoch: 92, train_loss: 0.4791, test_loss: 1.0126, test_f1: 0.6603
 epoch: 93, train_loss: 0.4603, test_loss: 1.0110, test_f1: 0.6660
 epoch: 94, train_loss: 0.4709, test_loss: 1.0093, test_f1: 0.6601
 epoch: 95, train_loss: 0.4756, test_loss: 0.9448, test_f1: 0.6671
 epoch: 96, train_loss: 0.4805, test_loss: 0.9591, test_f1: 0.6554
 epoch: 97, train_loss: 0.4489, test_loss: 0.9430, test_f1: 0.6673
 epoch: 98, train_loss: 0.4792, test_loss: 0.9428, test_f1: 0.6618
 epoch: 99, train_loss: 0.4638, test_loss: 1.0615, test_f1: 0.6378
##################ITERATION #3 ****************************************
 epoch: 0, train_loss: 1.1600, test_loss: 1.0379, test_f1: 0.5057
 epoch: 1, train_loss: 1.0213, test_loss: 0.9496, test_f1: 0.5068
 epoch: 2, train_loss: 0.9995, test_loss: 1.0014, test_f1: 0.4918
 epoch: 3, train_loss: 0.9686, test_loss: 0.9593, test_f1: 0.4977
 epoch: 4, train_loss: 0.9538, test_loss: 0.9902, test_f1: 0.5148
 epoch: 5, train_loss: 0.9444, test_loss: 1.0079, test_f1: 0.5081
 epoch: 6, train_loss: 0.9272, test_loss: 0.9716, test_f1: 0.5311
 epoch: 7, train_loss: 0.9136, test_loss: 0.9312, test_f1: 0.5563
 epoch: 8, train_loss: 0.8911, test_loss: 0.8874, test_f1: 0.5357
 epoch: 9, train_loss: 0.9000, test_loss: 0.9206, test_f1: 0.5246
 epoch: 10, train_loss: 0.8707, test_loss: 0.8828, test_f1: 0.5145
 epoch: 11, train_loss: 0.8630, test_loss: 0.9059, test_f1: 0.5553
 epoch: 12, train_loss: 0.8311, test_loss: 0.8567, test_f1: 0.5609
 epoch: 13, train_loss: 0.8511, test_loss: 0.8121, test_f1: 0.6102
 epoch: 14, train_loss: 0.8292, test_loss: 0.7996, test_f1: 0.6109
 epoch: 15, train_loss: 0.8188, test_loss: 0.8238, test_f1: 0.5794
 epoch: 16, train_loss: 0.8056, test_loss: 0.8617, test_f1: 0.5598
 epoch: 17, train_loss: 0.7880, test_loss: 0.7953, test_f1: 0.5874
 epoch: 18, train_loss: 0.7831, test_loss: 0.7724, test_f1: 0.6496
 epoch: 19, train_loss: 0.7752, test_loss: 0.8396, test_f1: 0.6130
 epoch: 20, train_loss: 0.7698, test_loss: 0.7827, test_f1: 0.6121
 epoch: 21, train_loss: 0.7514, test_loss: 0.7548, test_f1: 0.5989
 epoch: 22, train_loss: 0.7493, test_loss: 0.7338, test_f1: 0.6467
 epoch: 23, train_loss: 0.7407, test_loss: 0.7337, test_f1: 0.6851
 epoch: 24, train_loss: 0.7189, test_loss: 0.7457, test_f1: 0.6466
 epoch: 25, train_loss: 0.7043, test_loss: 0.8491, test_f1: 0.6214
 epoch: 26, train_loss: 0.7327, test_loss: 0.7288, test_f1: 0.6816
 epoch: 27, train_loss: 0.6929, test_loss: 0.7294, test_f1: 0.6116
 epoch: 28, train_loss: 0.7101, test_loss: 0.7493, test_f1: 0.6569
 epoch: 29, train_loss: 0.7215, test_loss: 0.8387, test_f1: 0.6398
 epoch: 30, train_loss: 0.7064, test_loss: 0.7542, test_f1: 0.6393
 epoch: 31, train_loss: 0.6968, test_loss: 0.6927, test_f1: 0.6553
 epoch: 32, train_loss: 0.6910, test_loss: 0.7729, test_f1: 0.6426
 epoch: 33, train_loss: 0.6797, test_loss: 0.7356, test_f1: 0.6542
 epoch: 34, train_loss: 0.6856, test_loss: 0.7843, test_f1: 0.6537
 epoch: 35, train_loss: 0.6798, test_loss: 0.7320, test_f1: 0.6817
 epoch: 36, train_loss: 0.6873, test_loss: 0.7298, test_f1: 0.6474
 epoch: 37, train_loss: 0.6732, test_loss: 0.7464, test_f1: 0.6513
 epoch: 38, train_loss: 0.6662, test_loss: 0.8266, test_f1: 0.5811
 epoch: 39, train_loss: 0.6674, test_loss: 0.7551, test_f1: 0.6836
 epoch: 40, train_loss: 0.6546, test_loss: 0.7217, test_f1: 0.6733
 epoch: 41, train_loss: 0.6605, test_loss: 0.7855, test_f1: 0.6765
 epoch: 42, train_loss: 0.6504, test_loss: 0.7057, test_f1: 0.6798
 epoch: 43, train_loss: 0.6495, test_loss: 0.7894, test_f1: 0.6344
 epoch: 44, train_loss: 0.6398, test_loss: 0.7346, test_f1: 0.6678
 epoch: 45, train_loss: 0.6430, test_loss: 0.7577, test_f1: 0.6710
 epoch: 46, train_loss: 0.6219, test_loss: 0.7724, test_f1: 0.6530
 epoch: 47, train_loss: 0.6207, test_loss: 0.8284, test_f1: 0.6647
 epoch: 48, train_loss: 0.6428, test_loss: 0.7344, test_f1: 0.6529
 epoch: 49, train_loss: 0.6436, test_loss: 0.7336, test_f1: 0.6689
 epoch: 50, train_loss: 0.6252, test_loss: 0.7407, test_f1: 0.6635
 epoch: 51, train_loss: 0.6033, test_loss: 0.7646, test_f1: 0.6396
 epoch: 52, train_loss: 0.5756, test_loss: 0.7664, test_f1: 0.6722
 epoch: 53, train_loss: 0.5866, test_loss: 0.7644, test_f1: 0.6792
 epoch: 54, train_loss: 0.5761, test_loss: 0.7749, test_f1: 0.6628
 epoch: 55, train_loss: 0.5676, test_loss: 0.7931, test_f1: 0.6670
 epoch: 56, train_loss: 0.5757, test_loss: 0.8193, test_f1: 0.6611
 epoch: 57, train_loss: 0.5691, test_loss: 0.8342, test_f1: 0.6504
 epoch: 58, train_loss: 0.5618, test_loss: 0.8099, test_f1: 0.6617
 epoch: 59, train_loss: 0.5654, test_loss: 0.8581, test_f1: 0.6616
 epoch: 60, train_loss: 0.5619, test_loss: 0.7592, test_f1: 0.6756
 epoch: 61, train_loss: 0.5488, test_loss: 0.8825, test_f1: 0.6518
 epoch: 62, train_loss: 0.5418, test_loss: 0.8742, test_f1: 0.6607
 epoch: 63, train_loss: 0.5502, test_loss: 0.8684, test_f1: 0.6672
 epoch: 64, train_loss: 0.5519, test_loss: 0.8626, test_f1: 0.6533
 epoch: 65, train_loss: 0.5611, test_loss: 0.8259, test_f1: 0.6557
 epoch: 66, train_loss: 0.5482, test_loss: 0.9066, test_f1: 0.6544
 epoch: 67, train_loss: 0.5299, test_loss: 0.8452, test_f1: 0.6573
 epoch: 68, train_loss: 0.5524, test_loss: 0.7696, test_f1: 0.6787
 epoch: 69, train_loss: 0.5333, test_loss: 0.7742, test_f1: 0.6532
 epoch: 70, train_loss: 0.5329, test_loss: 0.8681, test_f1: 0.6452
 epoch: 71, train_loss: 0.5395, test_loss: 0.8418, test_f1: 0.6502
 epoch: 72, train_loss: 0.5234, test_loss: 0.9405, test_f1: 0.6141
 epoch: 73, train_loss: 0.5231, test_loss: 0.7917, test_f1: 0.6670
 epoch: 74, train_loss: 0.5608, test_loss: 0.7865, test_f1: 0.6612
 epoch: 75, train_loss: 0.5317, test_loss: 0.8439, test_f1: 0.6537
 epoch: 76, train_loss: 0.5202, test_loss: 0.8553, test_f1: 0.6631
 epoch: 77, train_loss: 0.5345, test_loss: 0.8431, test_f1: 0.6602
 epoch: 78, train_loss: 0.5252, test_loss: 0.8698, test_f1: 0.6610
 epoch: 79, train_loss: 0.5249, test_loss: 0.8996, test_f1: 0.6368
 epoch: 80, train_loss: 0.5193, test_loss: 0.9520, test_f1: 0.6483
 epoch: 81, train_loss: 0.5290, test_loss: 0.9298, test_f1: 0.6445
 epoch: 82, train_loss: 0.5281, test_loss: 0.9490, test_f1: 0.6556
 epoch: 83, train_loss: 0.5233, test_loss: 0.8738, test_f1: 0.6792
 epoch: 84, train_loss: 0.4932, test_loss: 0.9032, test_f1: 0.6649
 epoch: 85, train_loss: 0.5011, test_loss: 0.8770, test_f1: 0.6594
 epoch: 86, train_loss: 0.4982, test_loss: 0.9168, test_f1: 0.6397
 epoch: 87, train_loss: 0.5133, test_loss: 0.8319, test_f1: 0.6725
 epoch: 88, train_loss: 0.5026, test_loss: 0.9171, test_f1: 0.6582
 epoch: 89, train_loss: 0.4903, test_loss: 0.9601, test_f1: 0.6420
 epoch: 90, train_loss: 0.4908, test_loss: 0.9149, test_f1: 0.6613
 epoch: 91, train_loss: 0.4929, test_loss: 0.9529, test_f1: 0.6532
 epoch: 92, train_loss: 0.4886, test_loss: 0.9479, test_f1: 0.6534
 epoch: 93, train_loss: 0.5071, test_loss: 0.9461, test_f1: 0.6507
 epoch: 94, train_loss: 0.4980, test_loss: 0.8998, test_f1: 0.6672
 epoch: 95, train_loss: 0.5053, test_loss: 1.0426, test_f1: 0.6354
 epoch: 96, train_loss: 0.4882, test_loss: 1.0113, test_f1: 0.6627
 epoch: 97, train_loss: 0.5065, test_loss: 0.8890, test_f1: 0.6422
 epoch: 98, train_loss: 0.4956, test_loss: 0.8621, test_f1: 0.6594
 epoch: 99, train_loss: 0.4809, test_loss: 0.9947, test_f1: 0.6669
##################ITERATION #4 ****************************************
 epoch: 0, train_loss: 1.1707, test_loss: 0.9757, test_f1: 0.4956
 epoch: 1, train_loss: 1.0285, test_loss: 0.9712, test_f1: 0.4761
 epoch: 2, train_loss: 0.9800, test_loss: 0.9467, test_f1: 0.4683
 epoch: 3, train_loss: 0.9694, test_loss: 0.9476, test_f1: 0.4978
 epoch: 4, train_loss: 0.9423, test_loss: 0.9072, test_f1: 0.5084
 epoch: 5, train_loss: 0.9351, test_loss: 0.8874, test_f1: 0.5165
 epoch: 6, train_loss: 0.9260, test_loss: 0.9043, test_f1: 0.5004
 epoch: 7, train_loss: 0.9065, test_loss: 0.8545, test_f1: 0.5465
 epoch: 8, train_loss: 0.8955, test_loss: 0.8613, test_f1: 0.5290
 epoch: 9, train_loss: 0.8856, test_loss: 0.8460, test_f1: 0.5531
 epoch: 10, train_loss: 0.8746, test_loss: 0.8702, test_f1: 0.5403
 epoch: 11, train_loss: 0.8617, test_loss: 0.8363, test_f1: 0.5575
 epoch: 12, train_loss: 0.8652, test_loss: 0.8323, test_f1: 0.5857
 epoch: 13, train_loss: 0.8471, test_loss: 0.7968, test_f1: 0.5709
 epoch: 14, train_loss: 0.8275, test_loss: 0.8128, test_f1: 0.5587
 epoch: 15, train_loss: 0.8195, test_loss: 0.7812, test_f1: 0.6248
 epoch: 16, train_loss: 0.8145, test_loss: 0.7368, test_f1: 0.6233
 epoch: 17, train_loss: 0.8091, test_loss: 0.7650, test_f1: 0.6131
 epoch: 18, train_loss: 0.7906, test_loss: 0.7796, test_f1: 0.5815
 epoch: 19, train_loss: 0.7907, test_loss: 0.7618, test_f1: 0.6632
 epoch: 20, train_loss: 0.7762, test_loss: 0.7996, test_f1: 0.6040
 epoch: 21, train_loss: 0.7798, test_loss: 0.7626, test_f1: 0.5880
 epoch: 22, train_loss: 0.7675, test_loss: 0.7479, test_f1: 0.6643
 epoch: 23, train_loss: 0.7737, test_loss: 0.7583, test_f1: 0.6156
 epoch: 24, train_loss: 0.7454, test_loss: 0.7416, test_f1: 0.6252
 epoch: 25, train_loss: 0.7502, test_loss: 0.7421, test_f1: 0.6292
 epoch: 26, train_loss: 0.7365, test_loss: 0.8351, test_f1: 0.6195
 epoch: 27, train_loss: 0.7224, test_loss: 0.7776, test_f1: 0.6438
 epoch: 28, train_loss: 0.7308, test_loss: 0.8343, test_f1: 0.5948
 epoch: 29, train_loss: 0.7199, test_loss: 0.7912, test_f1: 0.6173
 epoch: 30, train_loss: 0.7523, test_loss: 0.7576, test_f1: 0.6157
 epoch: 31, train_loss: 0.7017, test_loss: 0.7651, test_f1: 0.6189
 epoch: 32, train_loss: 0.7238, test_loss: 0.7776, test_f1: 0.6220
 epoch: 33, train_loss: 0.6884, test_loss: 0.8111, test_f1: 0.6319
 epoch: 34, train_loss: 0.6979, test_loss: 0.8445, test_f1: 0.6048
 epoch: 35, train_loss: 0.7100, test_loss: 0.8075, test_f1: 0.6391
 epoch: 36, train_loss: 0.7129, test_loss: 0.7521, test_f1: 0.6637
 epoch: 37, train_loss: 0.6957, test_loss: 0.8111, test_f1: 0.6433
 epoch: 38, train_loss: 0.6860, test_loss: 0.8112, test_f1: 0.6105
 epoch: 39, train_loss: 0.6726, test_loss: 0.8601, test_f1: 0.6212
 epoch: 40, train_loss: 0.6786, test_loss: 0.7852, test_f1: 0.6230
 epoch: 41, train_loss: 0.6619, test_loss: 0.8285, test_f1: 0.6377
 epoch: 42, train_loss: 0.6601, test_loss: 0.8163, test_f1: 0.6185
 epoch: 43, train_loss: 0.6715, test_loss: 0.7827, test_f1: 0.6335
 epoch: 44, train_loss: 0.6543, test_loss: 0.8093, test_f1: 0.6309
 epoch: 45, train_loss: 0.6382, test_loss: 0.7829, test_f1: 0.6306
 epoch: 46, train_loss: 0.6247, test_loss: 0.8350, test_f1: 0.6605
 epoch: 47, train_loss: 0.6375, test_loss: 0.8680, test_f1: 0.6472
 epoch: 48, train_loss: 0.6235, test_loss: 0.8789, test_f1: 0.6353
 epoch: 49, train_loss: 0.6584, test_loss: 0.8482, test_f1: 0.6556
 epoch: 50, train_loss: 0.6397, test_loss: 0.7962, test_f1: 0.6431
 epoch: 51, train_loss: 0.6026, test_loss: 0.8191, test_f1: 0.6340
 epoch: 52, train_loss: 0.5941, test_loss: 0.8100, test_f1: 0.6612
 epoch: 53, train_loss: 0.5910, test_loss: 0.8422, test_f1: 0.6441
 epoch: 54, train_loss: 0.5815, test_loss: 0.8606, test_f1: 0.6479
 epoch: 55, train_loss: 0.5819, test_loss: 0.8668, test_f1: 0.6233
 epoch: 56, train_loss: 0.5771, test_loss: 0.8417, test_f1: 0.6458
 epoch: 57, train_loss: 0.5693, test_loss: 0.8426, test_f1: 0.6501
 epoch: 58, train_loss: 0.5635, test_loss: 0.8367, test_f1: 0.6576
 epoch: 59, train_loss: 0.5718, test_loss: 0.8605, test_f1: 0.6391
 epoch: 60, train_loss: 0.5575, test_loss: 0.8707, test_f1: 0.6494
 epoch: 61, train_loss: 0.5606, test_loss: 0.8586, test_f1: 0.6528
 epoch: 62, train_loss: 0.5595, test_loss: 0.8688, test_f1: 0.6487
 epoch: 63, train_loss: 0.5497, test_loss: 0.8387, test_f1: 0.6601
 epoch: 64, train_loss: 0.5633, test_loss: 0.8793, test_f1: 0.6496
 epoch: 65, train_loss: 0.5234, test_loss: 0.8892, test_f1: 0.6631
 epoch: 66, train_loss: 0.5510, test_loss: 0.9149, test_f1: 0.6456
 epoch: 67, train_loss: 0.5462, test_loss: 0.8788, test_f1: 0.6471
 epoch: 68, train_loss: 0.5400, test_loss: 0.9064, test_f1: 0.6610
 epoch: 69, train_loss: 0.5357, test_loss: 0.9592, test_f1: 0.6314
 epoch: 70, train_loss: 0.5324, test_loss: 0.8809, test_f1: 0.6633
 epoch: 71, train_loss: 0.5405, test_loss: 0.9080, test_f1: 0.6401
 epoch: 72, train_loss: 0.5357, test_loss: 0.9291, test_f1: 0.6454
 epoch: 73, train_loss: 0.5427, test_loss: 0.9309, test_f1: 0.6415
 epoch: 74, train_loss: 0.5198, test_loss: 0.9417, test_f1: 0.6290
 epoch: 75, train_loss: 0.5280, test_loss: 0.9301, test_f1: 0.6494
 epoch: 76, train_loss: 0.5122, test_loss: 0.9423, test_f1: 0.6487
 epoch: 77, train_loss: 0.5098, test_loss: 0.9494, test_f1: 0.6448
 epoch: 78, train_loss: 0.5187, test_loss: 0.9318, test_f1: 0.6643
 epoch: 79, train_loss: 0.5028, test_loss: 0.9099, test_f1: 0.6534
 epoch: 80, train_loss: 0.4958, test_loss: 0.9068, test_f1: 0.6516
 epoch: 81, train_loss: 0.5161, test_loss: 0.8854, test_f1: 0.6476
 epoch: 82, train_loss: 0.5114, test_loss: 0.8726, test_f1: 0.6606
 epoch: 83, train_loss: 0.5150, test_loss: 0.9731, test_f1: 0.6472
 epoch: 84, train_loss: 0.5055, test_loss: 0.9281, test_f1: 0.6510
 epoch: 85, train_loss: 0.5014, test_loss: 0.9297, test_f1: 0.6547
 epoch: 86, train_loss: 0.4837, test_loss: 0.9826, test_f1: 0.6556
 epoch: 87, train_loss: 0.4953, test_loss: 0.9719, test_f1: 0.6389
 epoch: 88, train_loss: 0.4856, test_loss: 0.9769, test_f1: 0.6647
 epoch: 89, train_loss: 0.4910, test_loss: 0.9332, test_f1: 0.6672
 epoch: 90, train_loss: 0.4901, test_loss: 0.9807, test_f1: 0.6449
 epoch: 91, train_loss: 0.4912, test_loss: 0.9916, test_f1: 0.6599
 epoch: 92, train_loss: 0.4939, test_loss: 1.0146, test_f1: 0.6397
 epoch: 93, train_loss: 0.4929, test_loss: 0.9750, test_f1: 0.6435
 epoch: 94, train_loss: 0.4842, test_loss: 0.9975, test_f1: 0.6617
 epoch: 95, train_loss: 0.4661, test_loss: 1.0088, test_f1: 0.6525
 epoch: 96, train_loss: 0.4721, test_loss: 0.9452, test_f1: 0.6702
 epoch: 97, train_loss: 0.4753, test_loss: 0.8908, test_f1: 0.6655
 epoch: 98, train_loss: 0.4893, test_loss: 0.9436, test_f1: 0.6552
 epoch: 99, train_loss: 0.4631, test_loss: 1.0372, test_f1: 0.6659
##################ITERATION #5 ****************************************
 epoch: 0, train_loss: 1.1926, test_loss: 1.0313, test_f1: 0.4943
 epoch: 1, train_loss: 1.0340, test_loss: 0.9778, test_f1: 0.4640
 epoch: 2, train_loss: 1.0053, test_loss: 0.9259, test_f1: 0.5123
 epoch: 3, train_loss: 0.9657, test_loss: 0.9478, test_f1: 0.5153
 epoch: 4, train_loss: 0.9706, test_loss: 0.9202, test_f1: 0.4873
 epoch: 5, train_loss: 0.9317, test_loss: 0.9334, test_f1: 0.5211
 epoch: 6, train_loss: 0.9222, test_loss: 0.9799, test_f1: 0.4857
 epoch: 7, train_loss: 0.9167, test_loss: 0.9110, test_f1: 0.5119
 epoch: 8, train_loss: 0.8995, test_loss: 0.8934, test_f1: 0.5343
 epoch: 9, train_loss: 0.8971, test_loss: 0.8539, test_f1: 0.5677
 epoch: 10, train_loss: 0.8714, test_loss: 0.8551, test_f1: 0.5562
 epoch: 11, train_loss: 0.8571, test_loss: 0.8590, test_f1: 0.5679
 epoch: 12, train_loss: 0.8608, test_loss: 0.8274, test_f1: 0.5642
 epoch: 13, train_loss: 0.8494, test_loss: 0.8729, test_f1: 0.5471
 epoch: 14, train_loss: 0.8275, test_loss: 0.7934, test_f1: 0.5957
 epoch: 15, train_loss: 0.8235, test_loss: 0.8083, test_f1: 0.5996
 epoch: 16, train_loss: 0.8279, test_loss: 0.8235, test_f1: 0.5970
 epoch: 17, train_loss: 0.8165, test_loss: 0.9583, test_f1: 0.5770
 epoch: 18, train_loss: 0.8037, test_loss: 0.8209, test_f1: 0.6017
 epoch: 19, train_loss: 0.7935, test_loss: 0.8240, test_f1: 0.5999
 epoch: 20, train_loss: 0.7839, test_loss: 0.8266, test_f1: 0.6223
 epoch: 21, train_loss: 0.7727, test_loss: 0.7705, test_f1: 0.6265
 epoch: 22, train_loss: 0.7672, test_loss: 0.8007, test_f1: 0.6384
 epoch: 23, train_loss: 0.7670, test_loss: 0.8370, test_f1: 0.6125
 epoch: 24, train_loss: 0.7652, test_loss: 0.8287, test_f1: 0.6077
 epoch: 25, train_loss: 0.7604, test_loss: 0.8762, test_f1: 0.6215
 epoch: 26, train_loss: 0.7481, test_loss: 0.7915, test_f1: 0.6252
 epoch: 27, train_loss: 0.7453, test_loss: 0.8850, test_f1: 0.5724
 epoch: 28, train_loss: 0.7436, test_loss: 0.8473, test_f1: 0.6163
 epoch: 29, train_loss: 0.7413, test_loss: 0.8732, test_f1: 0.6204
 epoch: 30, train_loss: 0.7340, test_loss: 0.8009, test_f1: 0.6292
 epoch: 31, train_loss: 0.7309, test_loss: 0.8403, test_f1: 0.6279
 epoch: 32, train_loss: 0.7306, test_loss: 0.8544, test_f1: 0.6432
 epoch: 33, train_loss: 0.7015, test_loss: 0.8318, test_f1: 0.6565
 epoch: 34, train_loss: 0.7079, test_loss: 0.8176, test_f1: 0.6437
 epoch: 35, train_loss: 0.7118, test_loss: 0.7978, test_f1: 0.6718
 epoch: 36, train_loss: 0.6985, test_loss: 0.8713, test_f1: 0.6403
 epoch: 37, train_loss: 0.7007, test_loss: 0.8919, test_f1: 0.6364
 epoch: 38, train_loss: 0.6983, test_loss: 0.8422, test_f1: 0.6350
 epoch: 39, train_loss: 0.6873, test_loss: 0.8719, test_f1: 0.6543
 epoch: 40, train_loss: 0.6810, test_loss: 0.8234, test_f1: 0.6471
 epoch: 41, train_loss: 0.6765, test_loss: 0.8507, test_f1: 0.6461
 epoch: 42, train_loss: 0.6794, test_loss: 0.8301, test_f1: 0.6464
 epoch: 43, train_loss: 0.6760, test_loss: 0.7572, test_f1: 0.6450
 epoch: 44, train_loss: 0.6697, test_loss: 0.8281, test_f1: 0.6386
 epoch: 45, train_loss: 0.6716, test_loss: 0.8483, test_f1: 0.6355
 epoch: 46, train_loss: 0.6737, test_loss: 0.8049, test_f1: 0.6393
 epoch: 47, train_loss: 0.6569, test_loss: 0.8423, test_f1: 0.6332
 epoch: 48, train_loss: 0.6621, test_loss: 0.8677, test_f1: 0.6158
 epoch: 49, train_loss: 0.6619, test_loss: 0.8507, test_f1: 0.6381
 epoch: 50, train_loss: 0.6621, test_loss: 0.8480, test_f1: 0.6167
 epoch: 51, train_loss: 0.6224, test_loss: 0.8427, test_f1: 0.6524
 epoch: 52, train_loss: 0.6260, test_loss: 0.8375, test_f1: 0.6548
 epoch: 53, train_loss: 0.6231, test_loss: 0.8415, test_f1: 0.6459
 epoch: 54, train_loss: 0.6346, test_loss: 0.8555, test_f1: 0.6394
 epoch: 55, train_loss: 0.6221, test_loss: 0.8665, test_f1: 0.6614
 epoch: 56, train_loss: 0.5987, test_loss: 0.8496, test_f1: 0.6584
 epoch: 57, train_loss: 0.5941, test_loss: 0.8527, test_f1: 0.6576
 epoch: 58, train_loss: 0.5962, test_loss: 0.8598, test_f1: 0.6522
 epoch: 59, train_loss: 0.5925, test_loss: 0.8778, test_f1: 0.6586
 epoch: 60, train_loss: 0.6007, test_loss: 0.8939, test_f1: 0.6518
 epoch: 61, train_loss: 0.5898, test_loss: 0.8678, test_f1: 0.6539
 epoch: 62, train_loss: 0.5947, test_loss: 0.8094, test_f1: 0.6418
 epoch: 63, train_loss: 0.5880, test_loss: 0.8424, test_f1: 0.6829
 epoch: 64, train_loss: 0.5748, test_loss: 0.9022, test_f1: 0.6451
 epoch: 65, train_loss: 0.5682, test_loss: 0.8470, test_f1: 0.6518
 epoch: 66, train_loss: 0.5884, test_loss: 0.8602, test_f1: 0.6575
 epoch: 67, train_loss: 0.5660, test_loss: 0.9301, test_f1: 0.6443
 epoch: 68, train_loss: 0.5657, test_loss: 0.8860, test_f1: 0.6592
 epoch: 69, train_loss: 0.5756, test_loss: 0.9065, test_f1: 0.6676
 epoch: 70, train_loss: 0.5783, test_loss: 0.8814, test_f1: 0.6582
 epoch: 71, train_loss: 0.5600, test_loss: 0.8606, test_f1: 0.6529
 epoch: 72, train_loss: 0.5832, test_loss: 0.8950, test_f1: 0.6580
 epoch: 73, train_loss: 0.5827, test_loss: 0.8908, test_f1: 0.6389
 epoch: 74, train_loss: 0.5615, test_loss: 0.9183, test_f1: 0.6454
 epoch: 75, train_loss: 0.5603, test_loss: 0.8936, test_f1: 0.6680
 epoch: 76, train_loss: 0.5580, test_loss: 0.9507, test_f1: 0.6623
 epoch: 77, train_loss: 0.5703, test_loss: 0.9114, test_f1: 0.6865
 epoch: 78, train_loss: 0.5612, test_loss: 0.9046, test_f1: 0.6739
 epoch: 79, train_loss: 0.5646, test_loss: 0.8843, test_f1: 0.6631
 epoch: 80, train_loss: 0.5527, test_loss: 0.8577, test_f1: 0.6619
 epoch: 81, train_loss: 0.5578, test_loss: 0.9031, test_f1: 0.6721
 epoch: 82, train_loss: 0.5701, test_loss: 0.8768, test_f1: 0.6591
 epoch: 83, train_loss: 0.5425, test_loss: 0.9087, test_f1: 0.6785
 epoch: 84, train_loss: 0.5394, test_loss: 0.9081, test_f1: 0.6513
 epoch: 85, train_loss: 0.5488, test_loss: 0.9088, test_f1: 0.6658
 epoch: 86, train_loss: 0.5294, test_loss: 0.9217, test_f1: 0.6705
 epoch: 87, train_loss: 0.5347, test_loss: 0.9155, test_f1: 0.6495
 epoch: 88, train_loss: 0.5402, test_loss: 0.9269, test_f1: 0.6481
 epoch: 89, train_loss: 0.5417, test_loss: 0.9259, test_f1: 0.6826
 epoch: 90, train_loss: 0.5328, test_loss: 0.9284, test_f1: 0.6384
 epoch: 91, train_loss: 0.5502, test_loss: 0.8688, test_f1: 0.6660
 epoch: 92, train_loss: 0.5380, test_loss: 0.9040, test_f1: 0.6613
 epoch: 93, train_loss: 0.5355, test_loss: 0.9372, test_f1: 0.6690
 epoch: 94, train_loss: 0.5285, test_loss: 0.8814, test_f1: 0.6777
 epoch: 95, train_loss: 0.5327, test_loss: 0.9835, test_f1: 0.6676
 epoch: 96, train_loss: 0.5368, test_loss: 0.9292, test_f1: 0.6749
 epoch: 97, train_loss: 0.5286, test_loss: 0.9275, test_f1: 0.6574
 epoch: 98, train_loss: 0.5227, test_loss: 0.9732, test_f1: 0.6721
 epoch: 99, train_loss: 0.5126, test_loss: 0.9861, test_f1: 0.6615
##################ITERATION #6 ****************************************
 epoch: 0, train_loss: 1.2408, test_loss: 0.9938, test_f1: 0.5119
 epoch: 1, train_loss: 1.0083, test_loss: 0.9633, test_f1: 0.5484
 epoch: 2, train_loss: 0.9840, test_loss: 0.9860, test_f1: 0.5280
 epoch: 3, train_loss: 0.9594, test_loss: 0.9719, test_f1: 0.5484
 epoch: 4, train_loss: 0.9448, test_loss: 0.9921, test_f1: 0.5222
 epoch: 5, train_loss: 0.9203, test_loss: 0.9201, test_f1: 0.5684
 epoch: 6, train_loss: 0.9129, test_loss: 0.9414, test_f1: 0.5398
 epoch: 7, train_loss: 0.8979, test_loss: 0.9194, test_f1: 0.5568
 epoch: 8, train_loss: 0.9036, test_loss: 0.9243, test_f1: 0.5435
 epoch: 9, train_loss: 0.8704, test_loss: 0.8748, test_f1: 0.5509
 epoch: 10, train_loss: 0.8633, test_loss: 0.8830, test_f1: 0.5987
 epoch: 11, train_loss: 0.8698, test_loss: 0.8950, test_f1: 0.5600
 epoch: 12, train_loss: 0.8492, test_loss: 0.8567, test_f1: 0.5702
 epoch: 13, train_loss: 0.8307, test_loss: 0.8233, test_f1: 0.5773
 epoch: 14, train_loss: 0.8324, test_loss: 0.8323, test_f1: 0.5830
 epoch: 15, train_loss: 0.8035, test_loss: 0.8053, test_f1: 0.6049
 epoch: 16, train_loss: 0.8146, test_loss: 0.8156, test_f1: 0.5846
 epoch: 17, train_loss: 0.7786, test_loss: 0.8370, test_f1: 0.5828
 epoch: 18, train_loss: 0.7877, test_loss: 0.8673, test_f1: 0.6024
 epoch: 19, train_loss: 0.7652, test_loss: 0.7630, test_f1: 0.6379
 epoch: 20, train_loss: 0.7962, test_loss: 0.8374, test_f1: 0.6122
 epoch: 21, train_loss: 0.7578, test_loss: 0.8673, test_f1: 0.6135
 epoch: 22, train_loss: 0.7480, test_loss: 0.8301, test_f1: 0.6284
 epoch: 23, train_loss: 0.7616, test_loss: 0.8546, test_f1: 0.6281
 epoch: 24, train_loss: 0.7297, test_loss: 0.8009, test_f1: 0.6223
 epoch: 25, train_loss: 0.7394, test_loss: 0.8257, test_f1: 0.6174
 epoch: 26, train_loss: 0.7292, test_loss: 0.8444, test_f1: 0.6186
 epoch: 27, train_loss: 0.7348, test_loss: 0.8849, test_f1: 0.6342
 epoch: 28, train_loss: 0.7275, test_loss: 0.8911, test_f1: 0.6355
 epoch: 29, train_loss: 0.7267, test_loss: 0.8473, test_f1: 0.6328
 epoch: 30, train_loss: 0.7147, test_loss: 0.8144, test_f1: 0.6342
 epoch: 31, train_loss: 0.7060, test_loss: 0.7278, test_f1: 0.6489
 epoch: 32, train_loss: 0.6901, test_loss: 0.8562, test_f1: 0.6301
 epoch: 33, train_loss: 0.7000, test_loss: 0.9181, test_f1: 0.6508
 epoch: 34, train_loss: 0.6980, test_loss: 0.8815, test_f1: 0.6382
 epoch: 35, train_loss: 0.6901, test_loss: 0.8318, test_f1: 0.6754
 epoch: 36, train_loss: 0.6781, test_loss: 0.8850, test_f1: 0.6432
 epoch: 37, train_loss: 0.6715, test_loss: 0.8459, test_f1: 0.6708
 epoch: 38, train_loss: 0.6833, test_loss: 0.8945, test_f1: 0.6204
 epoch: 39, train_loss: 0.6735, test_loss: 0.8981, test_f1: 0.6305
 epoch: 40, train_loss: 0.6610, test_loss: 0.8604, test_f1: 0.6330
 epoch: 41, train_loss: 0.6520, test_loss: 0.8704, test_f1: 0.6426
 epoch: 42, train_loss: 0.6636, test_loss: 0.8624, test_f1: 0.6360
 epoch: 43, train_loss: 0.6570, test_loss: 0.8737, test_f1: 0.6586
 epoch: 44, train_loss: 0.6677, test_loss: 0.8679, test_f1: 0.6554
 epoch: 45, train_loss: 0.6370, test_loss: 0.7841, test_f1: 0.6466
 epoch: 46, train_loss: 0.6437, test_loss: 0.8181, test_f1: 0.6480
 epoch: 47, train_loss: 0.6465, test_loss: 0.8683, test_f1: 0.6595
 epoch: 48, train_loss: 0.6304, test_loss: 0.8253, test_f1: 0.6598
 epoch: 49, train_loss: 0.6377, test_loss: 0.7880, test_f1: 0.6479
 epoch: 50, train_loss: 0.6233, test_loss: 0.8103, test_f1: 0.6768
 epoch: 51, train_loss: 0.5894, test_loss: 0.8052, test_f1: 0.6908
 epoch: 52, train_loss: 0.5560, test_loss: 0.8634, test_f1: 0.6519
 epoch: 53, train_loss: 0.5665, test_loss: 0.8311, test_f1: 0.6659
 epoch: 54, train_loss: 0.5583, test_loss: 0.8467, test_f1: 0.6640
 epoch: 55, train_loss: 0.5723, test_loss: 0.8766, test_f1: 0.6571
 epoch: 56, train_loss: 0.5766, test_loss: 0.8541, test_f1: 0.6524
 epoch: 57, train_loss: 0.5676, test_loss: 0.8849, test_f1: 0.6371
 epoch: 58, train_loss: 0.5622, test_loss: 0.9156, test_f1: 0.6651
 epoch: 59, train_loss: 0.5557, test_loss: 0.9243, test_f1: 0.6495
 epoch: 60, train_loss: 0.5460, test_loss: 0.9271, test_f1: 0.6700
 epoch: 61, train_loss: 0.5419, test_loss: 0.8611, test_f1: 0.6619
 epoch: 62, train_loss: 0.5321, test_loss: 0.9135, test_f1: 0.6658
 epoch: 63, train_loss: 0.5237, test_loss: 0.9303, test_f1: 0.6613
 epoch: 64, train_loss: 0.5464, test_loss: 0.9136, test_f1: 0.6345
 epoch: 65, train_loss: 0.5383, test_loss: 0.8938, test_f1: 0.6560
 epoch: 66, train_loss: 0.5343, test_loss: 0.9662, test_f1: 0.6464
 epoch: 67, train_loss: 0.5443, test_loss: 0.9573, test_f1: 0.6314
 epoch: 68, train_loss: 0.5207, test_loss: 0.9206, test_f1: 0.6299
 epoch: 69, train_loss: 0.5305, test_loss: 0.9303, test_f1: 0.6531
 epoch: 70, train_loss: 0.5330, test_loss: 0.8909, test_f1: 0.6823
 epoch: 71, train_loss: 0.5103, test_loss: 0.9319, test_f1: 0.6505
 epoch: 72, train_loss: 0.5187, test_loss: 0.9022, test_f1: 0.6783
 epoch: 73, train_loss: 0.5052, test_loss: 0.9651, test_f1: 0.6707
 epoch: 74, train_loss: 0.5138, test_loss: 0.9462, test_f1: 0.6520
 epoch: 75, train_loss: 0.5261, test_loss: 0.9958, test_f1: 0.6485
 epoch: 76, train_loss: 0.5010, test_loss: 0.9173, test_f1: 0.6697
 epoch: 77, train_loss: 0.5027, test_loss: 0.9568, test_f1: 0.6793
 epoch: 78, train_loss: 0.4952, test_loss: 0.9780, test_f1: 0.6515
 epoch: 79, train_loss: 0.5163, test_loss: 0.9815, test_f1: 0.6868
 epoch: 80, train_loss: 0.4962, test_loss: 1.0602, test_f1: 0.6772
 epoch: 81, train_loss: 0.4979, test_loss: 1.0248, test_f1: 0.6553
 epoch: 82, train_loss: 0.4919, test_loss: 1.0082, test_f1: 0.6451
 epoch: 83, train_loss: 0.5029, test_loss: 0.9262, test_f1: 0.6514
 epoch: 84, train_loss: 0.4763, test_loss: 1.0128, test_f1: 0.6529
 epoch: 85, train_loss: 0.5167, test_loss: 0.9155, test_f1: 0.6758
 epoch: 86, train_loss: 0.4893, test_loss: 0.9293, test_f1: 0.6706
 epoch: 87, train_loss: 0.4694, test_loss: 1.0442, test_f1: 0.6465
 epoch: 88, train_loss: 0.4905, test_loss: 0.9700, test_f1: 0.6532
 epoch: 89, train_loss: 0.4815, test_loss: 0.9324, test_f1: 0.6796
 epoch: 90, train_loss: 0.5055, test_loss: 0.9029, test_f1: 0.6851
 epoch: 91, train_loss: 0.4636, test_loss: 0.9945, test_f1: 0.6613
 epoch: 92, train_loss: 0.4747, test_loss: 1.0588, test_f1: 0.6588
 epoch: 93, train_loss: 0.4682, test_loss: 0.9721, test_f1: 0.6782
 epoch: 94, train_loss: 0.4937, test_loss: 0.9766, test_f1: 0.6797
 epoch: 95, train_loss: 0.4661, test_loss: 0.9838, test_f1: 0.6655
 epoch: 96, train_loss: 0.4796, test_loss: 1.0454, test_f1: 0.6452
 epoch: 97, train_loss: 0.5002, test_loss: 0.9948, test_f1: 0.6536
 epoch: 98, train_loss: 0.4653, test_loss: 1.0400, test_f1: 0.6508
 epoch: 99, train_loss: 0.4645, test_loss: 1.0589, test_f1: 0.6777
##################ITERATION #7 ****************************************
 epoch: 0, train_loss: 1.2572, test_loss: 1.0072, test_f1: 0.4928
 epoch: 1, train_loss: 1.0192, test_loss: 0.9818, test_f1: 0.4958
 epoch: 2, train_loss: 0.9951, test_loss: 0.9746, test_f1: 0.5086
 epoch: 3, train_loss: 0.9739, test_loss: 0.9423, test_f1: 0.5179
 epoch: 4, train_loss: 0.9575, test_loss: 0.9163, test_f1: 0.5134
 epoch: 5, train_loss: 0.9410, test_loss: 0.8982, test_f1: 0.5426
 epoch: 6, train_loss: 0.9296, test_loss: 0.8694, test_f1: 0.5568
 epoch: 7, train_loss: 0.9105, test_loss: 0.9677, test_f1: 0.5647
 epoch: 8, train_loss: 0.9080, test_loss: 0.9180, test_f1: 0.5574
 epoch: 9, train_loss: 0.8966, test_loss: 0.8879, test_f1: 0.5708
 epoch: 10, train_loss: 0.8877, test_loss: 0.8629, test_f1: 0.5452
 epoch: 11, train_loss: 0.8870, test_loss: 0.8799, test_f1: 0.5544
 epoch: 12, train_loss: 0.8801, test_loss: 0.8044, test_f1: 0.5711
 epoch: 13, train_loss: 0.8431, test_loss: 0.8307, test_f1: 0.5782
 epoch: 14, train_loss: 0.8479, test_loss: 0.8824, test_f1: 0.5871
 epoch: 15, train_loss: 0.8599, test_loss: 0.8287, test_f1: 0.5930
 epoch: 16, train_loss: 0.8362, test_loss: 0.8742, test_f1: 0.5776
 epoch: 17, train_loss: 0.8214, test_loss: 0.8313, test_f1: 0.5930
 epoch: 18, train_loss: 0.8200, test_loss: 0.8408, test_f1: 0.6076
 epoch: 19, train_loss: 0.8139, test_loss: 0.7787, test_f1: 0.6168
 epoch: 20, train_loss: 0.7904, test_loss: 0.7645, test_f1: 0.5976
 epoch: 21, train_loss: 0.7952, test_loss: 0.8051, test_f1: 0.6294
 epoch: 22, train_loss: 0.7780, test_loss: 0.8016, test_f1: 0.5993
 epoch: 23, train_loss: 0.7757, test_loss: 0.7463, test_f1: 0.6401
 epoch: 24, train_loss: 0.7727, test_loss: 0.7980, test_f1: 0.6171
 epoch: 25, train_loss: 0.7483, test_loss: 0.8527, test_f1: 0.5969
 epoch: 26, train_loss: 0.7469, test_loss: 0.7912, test_f1: 0.6273
 epoch: 27, train_loss: 0.7419, test_loss: 0.8479, test_f1: 0.6051
 epoch: 28, train_loss: 0.7460, test_loss: 0.7611, test_f1: 0.6152
 epoch: 29, train_loss: 0.7392, test_loss: 0.7889, test_f1: 0.5959
 epoch: 30, train_loss: 0.7218, test_loss: 0.7965, test_f1: 0.6097
 epoch: 31, train_loss: 0.7243, test_loss: 0.7984, test_f1: 0.5929
 epoch: 32, train_loss: 0.7183, test_loss: 0.7616, test_f1: 0.6445
 epoch: 33, train_loss: 0.7053, test_loss: 0.7917, test_f1: 0.6146
 epoch: 34, train_loss: 0.7069, test_loss: 0.7912, test_f1: 0.6462
 epoch: 35, train_loss: 0.7025, test_loss: 0.7800, test_f1: 0.6373
 epoch: 36, train_loss: 0.6912, test_loss: 0.8532, test_f1: 0.6157
 epoch: 37, train_loss: 0.6867, test_loss: 0.8041, test_f1: 0.6139
 epoch: 38, train_loss: 0.6684, test_loss: 0.7817, test_f1: 0.6292
 epoch: 39, train_loss: 0.6765, test_loss: 0.7612, test_f1: 0.6382
 epoch: 40, train_loss: 0.6778, test_loss: 0.7703, test_f1: 0.6411
 epoch: 41, train_loss: 0.6664, test_loss: 0.7897, test_f1: 0.6525
 epoch: 42, train_loss: 0.6834, test_loss: 0.8691, test_f1: 0.6214
 epoch: 43, train_loss: 0.6548, test_loss: 0.7589, test_f1: 0.6487
 epoch: 44, train_loss: 0.6917, test_loss: 0.7389, test_f1: 0.6420
 epoch: 45, train_loss: 0.6963, test_loss: 0.7582, test_f1: 0.6529
 epoch: 46, train_loss: 0.6758, test_loss: 0.7781, test_f1: 0.6371
 epoch: 47, train_loss: 0.6643, test_loss: 0.7232, test_f1: 0.6646
 epoch: 48, train_loss: 0.6828, test_loss: 0.8236, test_f1: 0.6472
 epoch: 49, train_loss: 0.6491, test_loss: 0.7594, test_f1: 0.6661
 epoch: 50, train_loss: 0.6449, test_loss: 0.8037, test_f1: 0.6578
 epoch: 51, train_loss: 0.6183, test_loss: 0.7310, test_f1: 0.6591
 epoch: 52, train_loss: 0.6061, test_loss: 0.7429, test_f1: 0.6631
 epoch: 53, train_loss: 0.5988, test_loss: 0.8127, test_f1: 0.6547
 epoch: 54, train_loss: 0.5981, test_loss: 0.7837, test_f1: 0.6556
 epoch: 55, train_loss: 0.5929, test_loss: 0.7255, test_f1: 0.6828
 epoch: 56, train_loss: 0.5919, test_loss: 0.7169, test_f1: 0.6764
 epoch: 57, train_loss: 0.5867, test_loss: 0.7209, test_f1: 0.6885
 epoch: 58, train_loss: 0.5744, test_loss: 0.7773, test_f1: 0.6745
 epoch: 59, train_loss: 0.5739, test_loss: 0.7552, test_f1: 0.6605
 epoch: 60, train_loss: 0.5717, test_loss: 0.7073, test_f1: 0.6646
 epoch: 61, train_loss: 0.5891, test_loss: 0.7044, test_f1: 0.6729
 epoch: 62, train_loss: 0.5861, test_loss: 0.6900, test_f1: 0.6767
 epoch: 63, train_loss: 0.5742, test_loss: 0.7481, test_f1: 0.6718
 epoch: 64, train_loss: 0.5847, test_loss: 0.7119, test_f1: 0.6679
 epoch: 65, train_loss: 0.5700, test_loss: 0.7302, test_f1: 0.6972
 epoch: 66, train_loss: 0.5554, test_loss: 0.7394, test_f1: 0.6766
 epoch: 67, train_loss: 0.5487, test_loss: 0.7470, test_f1: 0.6814
 epoch: 68, train_loss: 0.5437, test_loss: 0.7152, test_f1: 0.6933
 epoch: 69, train_loss: 0.5492, test_loss: 0.6853, test_f1: 0.6871
 epoch: 70, train_loss: 0.5579, test_loss: 0.7578, test_f1: 0.6883
 epoch: 71, train_loss: 0.5444, test_loss: 0.7375, test_f1: 0.6874
 epoch: 72, train_loss: 0.5467, test_loss: 0.6798, test_f1: 0.7019
 epoch: 73, train_loss: 0.5449, test_loss: 0.7583, test_f1: 0.6767
 epoch: 74, train_loss: 0.5496, test_loss: 0.6928, test_f1: 0.6867
 epoch: 75, train_loss: 0.5378, test_loss: 0.7134, test_f1: 0.6690
 epoch: 76, train_loss: 0.5233, test_loss: 0.7236, test_f1: 0.6838
 epoch: 77, train_loss: 0.5307, test_loss: 0.6774, test_f1: 0.7029
 epoch: 78, train_loss: 0.5296, test_loss: 0.8157, test_f1: 0.6578
 epoch: 79, train_loss: 0.5322, test_loss: 0.7405, test_f1: 0.6709
 epoch: 80, train_loss: 0.5412, test_loss: 0.7783, test_f1: 0.6545
 epoch: 81, train_loss: 0.5154, test_loss: 0.7557, test_f1: 0.6851
 epoch: 82, train_loss: 0.5320, test_loss: 0.7812, test_f1: 0.6662
 epoch: 83, train_loss: 0.5177, test_loss: 0.7809, test_f1: 0.6829
 epoch: 84, train_loss: 0.5156, test_loss: 0.7829, test_f1: 0.6758
 epoch: 85, train_loss: 0.5057, test_loss: 0.7962, test_f1: 0.6623
 epoch: 86, train_loss: 0.5181, test_loss: 0.7996, test_f1: 0.6788
 epoch: 87, train_loss: 0.4989, test_loss: 0.7363, test_f1: 0.7058
 epoch: 88, train_loss: 0.5100, test_loss: 0.8046, test_f1: 0.7070
 epoch: 89, train_loss: 0.4909, test_loss: 0.8507, test_f1: 0.6699
 epoch: 90, train_loss: 0.5135, test_loss: 0.7744, test_f1: 0.6792
 epoch: 91, train_loss: 0.5088, test_loss: 0.7680, test_f1: 0.6805
 epoch: 92, train_loss: 0.4929, test_loss: 0.7928, test_f1: 0.6846
 epoch: 93, train_loss: 0.5226, test_loss: 0.8042, test_f1: 0.6714
 epoch: 94, train_loss: 0.5060, test_loss: 0.7997, test_f1: 0.6923
 epoch: 95, train_loss: 0.4912, test_loss: 0.8141, test_f1: 0.7020
 epoch: 96, train_loss: 0.4913, test_loss: 0.7474, test_f1: 0.7141
 epoch: 97, train_loss: 0.5046, test_loss: 0.7942, test_f1: 0.7066
 epoch: 98, train_loss: 0.5126, test_loss: 0.7667, test_f1: 0.7021
 epoch: 99, train_loss: 0.4904, test_loss: 0.7561, test_f1: 0.6986
##################ITERATION #8 ****************************************
 epoch: 0, train_loss: 1.2074, test_loss: 0.9954, test_f1: 0.4613
 epoch: 1, train_loss: 1.0375, test_loss: 1.0117, test_f1: 0.4822
 epoch: 2, train_loss: 0.9917, test_loss: 0.9821, test_f1: 0.4718
 epoch: 3, train_loss: 0.9648, test_loss: 0.9353, test_f1: 0.4824
 epoch: 4, train_loss: 0.9615, test_loss: 0.8885, test_f1: 0.5044
 epoch: 5, train_loss: 0.9378, test_loss: 0.9221, test_f1: 0.5119
 epoch: 6, train_loss: 0.9387, test_loss: 0.8906, test_f1: 0.5347
 epoch: 7, train_loss: 0.9073, test_loss: 0.9435, test_f1: 0.5425
 epoch: 8, train_loss: 0.9040, test_loss: 0.8845, test_f1: 0.5141
 epoch: 9, train_loss: 0.8887, test_loss: 0.9341, test_f1: 0.5380
 epoch: 10, train_loss: 0.8746, test_loss: 0.8434, test_f1: 0.5738
 epoch: 11, train_loss: 0.8661, test_loss: 0.7964, test_f1: 0.5389
 epoch: 12, train_loss: 0.8476, test_loss: 0.8060, test_f1: 0.5806
 epoch: 13, train_loss: 0.8439, test_loss: 0.8066, test_f1: 0.5867
 epoch: 14, train_loss: 0.8354, test_loss: 0.7871, test_f1: 0.6249
 epoch: 15, train_loss: 0.8370, test_loss: 0.8424, test_f1: 0.5758
 epoch: 16, train_loss: 0.8270, test_loss: 0.8547, test_f1: 0.5799
 epoch: 17, train_loss: 0.8082, test_loss: 0.8255, test_f1: 0.5482
 epoch: 18, train_loss: 0.8164, test_loss: 0.7802, test_f1: 0.6421
 epoch: 19, train_loss: 0.8152, test_loss: 0.7828, test_f1: 0.5847
 epoch: 20, train_loss: 0.7870, test_loss: 0.7875, test_f1: 0.5912
 epoch: 21, train_loss: 0.7725, test_loss: 0.7844, test_f1: 0.5960
 epoch: 22, train_loss: 0.7852, test_loss: 0.7630, test_f1: 0.6050
 epoch: 23, train_loss: 0.7657, test_loss: 0.8129, test_f1: 0.5989
 epoch: 24, train_loss: 0.7677, test_loss: 0.7438, test_f1: 0.6008
 epoch: 25, train_loss: 0.7652, test_loss: 0.7392, test_f1: 0.6379
 epoch: 26, train_loss: 0.7616, test_loss: 0.7358, test_f1: 0.6604
 epoch: 27, train_loss: 0.7412, test_loss: 0.7108, test_f1: 0.6642
 epoch: 28, train_loss: 0.7430, test_loss: 0.8377, test_f1: 0.5694
 epoch: 29, train_loss: 0.7380, test_loss: 0.7416, test_f1: 0.6318
 epoch: 30, train_loss: 0.7322, test_loss: 0.7132, test_f1: 0.6579
 epoch: 31, train_loss: 0.7365, test_loss: 0.7396, test_f1: 0.6541
 epoch: 32, train_loss: 0.7469, test_loss: 0.7242, test_f1: 0.6475
 epoch: 33, train_loss: 0.7274, test_loss: 0.7436, test_f1: 0.6188
 epoch: 34, train_loss: 0.7209, test_loss: 0.7162, test_f1: 0.6704
 epoch: 35, train_loss: 0.7155, test_loss: 0.7777, test_f1: 0.6007
 epoch: 36, train_loss: 0.6944, test_loss: 0.7877, test_f1: 0.6461
 epoch: 37, train_loss: 0.7175, test_loss: 0.6842, test_f1: 0.6801
 epoch: 38, train_loss: 0.6804, test_loss: 0.8303, test_f1: 0.5916
 epoch: 39, train_loss: 0.7102, test_loss: 0.7389, test_f1: 0.6711
 epoch: 40, train_loss: 0.6798, test_loss: 0.7426, test_f1: 0.6678
 epoch: 41, train_loss: 0.6898, test_loss: 0.7385, test_f1: 0.6302
 epoch: 42, train_loss: 0.6629, test_loss: 0.6874, test_f1: 0.6804
 epoch: 43, train_loss: 0.6524, test_loss: 0.7465, test_f1: 0.6409
 epoch: 44, train_loss: 0.6655, test_loss: 0.7645, test_f1: 0.6203
 epoch: 45, train_loss: 0.6628, test_loss: 0.7255, test_f1: 0.6574
 epoch: 46, train_loss: 0.6754, test_loss: 0.6990, test_f1: 0.6723
 epoch: 47, train_loss: 0.6560, test_loss: 0.6884, test_f1: 0.6568
 epoch: 48, train_loss: 0.6522, test_loss: 0.7022, test_f1: 0.6601
 epoch: 49, train_loss: 0.6636, test_loss: 0.7494, test_f1: 0.6300
 epoch: 50, train_loss: 0.6470, test_loss: 0.7786, test_f1: 0.6144
 epoch: 51, train_loss: 0.6195, test_loss: 0.7341, test_f1: 0.6701
 epoch: 52, train_loss: 0.6039, test_loss: 0.7275, test_f1: 0.6690
 epoch: 53, train_loss: 0.5988, test_loss: 0.7391, test_f1: 0.6586
 epoch: 54, train_loss: 0.6008, test_loss: 0.7550, test_f1: 0.6691
 epoch: 55, train_loss: 0.5992, test_loss: 0.7111, test_f1: 0.6907
 epoch: 56, train_loss: 0.5799, test_loss: 0.7270, test_f1: 0.6586
 epoch: 57, train_loss: 0.5899, test_loss: 0.7272, test_f1: 0.6710
 epoch: 58, train_loss: 0.5845, test_loss: 0.7185, test_f1: 0.6631
 epoch: 59, train_loss: 0.5726, test_loss: 0.7082, test_f1: 0.6702
 epoch: 60, train_loss: 0.5713, test_loss: 0.7012, test_f1: 0.6908
 epoch: 61, train_loss: 0.5743, test_loss: 0.7210, test_f1: 0.6698
 epoch: 62, train_loss: 0.5758, test_loss: 0.7245, test_f1: 0.6733
 epoch: 63, train_loss: 0.5905, test_loss: 0.7195, test_f1: 0.6971
 epoch: 64, train_loss: 0.5825, test_loss: 0.7558, test_f1: 0.6429
 epoch: 65, train_loss: 0.5664, test_loss: 0.7238, test_f1: 0.6775
 epoch: 66, train_loss: 0.5682, test_loss: 0.7582, test_f1: 0.6588
 epoch: 67, train_loss: 0.5599, test_loss: 0.7424, test_f1: 0.6683
 epoch: 68, train_loss: 0.5774, test_loss: 0.7739, test_f1: 0.6670
 epoch: 69, train_loss: 0.5482, test_loss: 0.7630, test_f1: 0.6822
 epoch: 70, train_loss: 0.5649, test_loss: 0.7659, test_f1: 0.6645
 epoch: 71, train_loss: 0.5497, test_loss: 0.7331, test_f1: 0.6800
 epoch: 72, train_loss: 0.5548, test_loss: 0.7469, test_f1: 0.6658
 epoch: 73, train_loss: 0.5687, test_loss: 0.7867, test_f1: 0.6639
 epoch: 74, train_loss: 0.5415, test_loss: 0.7957, test_f1: 0.6626
 epoch: 75, train_loss: 0.5403, test_loss: 0.8779, test_f1: 0.6481
 epoch: 76, train_loss: 0.5681, test_loss: 0.7698, test_f1: 0.6455
 epoch: 77, train_loss: 0.5205, test_loss: 0.7624, test_f1: 0.6550
 epoch: 78, train_loss: 0.5491, test_loss: 0.8021, test_f1: 0.6469
 epoch: 79, train_loss: 0.5283, test_loss: 0.7703, test_f1: 0.6705
 epoch: 80, train_loss: 0.5367, test_loss: 0.7491, test_f1: 0.6579
 epoch: 81, train_loss: 0.5262, test_loss: 0.7279, test_f1: 0.7013
 epoch: 82, train_loss: 0.5404, test_loss: 0.7434, test_f1: 0.6863
 epoch: 83, train_loss: 0.5228, test_loss: 0.7580, test_f1: 0.6676
 epoch: 84, train_loss: 0.5154, test_loss: 0.8608, test_f1: 0.6496
 epoch: 85, train_loss: 0.5260, test_loss: 0.7580, test_f1: 0.6781
 epoch: 86, train_loss: 0.5279, test_loss: 0.7370, test_f1: 0.6894
 epoch: 87, train_loss: 0.5357, test_loss: 0.8030, test_f1: 0.6668
 epoch: 88, train_loss: 0.5252, test_loss: 0.8236, test_f1: 0.6516
 epoch: 89, train_loss: 0.5139, test_loss: 0.7592, test_f1: 0.6739
 epoch: 90, train_loss: 0.5186, test_loss: 0.7873, test_f1: 0.6950
 epoch: 91, train_loss: 0.5144, test_loss: 0.7387, test_f1: 0.6973
 epoch: 92, train_loss: 0.5092, test_loss: 0.8116, test_f1: 0.6774
 epoch: 93, train_loss: 0.5058, test_loss: 0.8621, test_f1: 0.6441
 epoch: 94, train_loss: 0.5226, test_loss: 0.7321, test_f1: 0.6718
 epoch: 95, train_loss: 0.5119, test_loss: 0.7824, test_f1: 0.6629
 epoch: 96, train_loss: 0.5109, test_loss: 0.8624, test_f1: 0.6701
 epoch: 97, train_loss: 0.5242, test_loss: 0.8075, test_f1: 0.6610
 epoch: 98, train_loss: 0.4914, test_loss: 0.8334, test_f1: 0.6509
 epoch: 99, train_loss: 0.4988, test_loss: 0.8287, test_f1: 0.6638
##################ITERATION #9 ****************************************
 epoch: 0, train_loss: 1.2565, test_loss: 1.0569, test_f1: 0.4666
 epoch: 1, train_loss: 1.0396, test_loss: 0.9871, test_f1: 0.4883
 epoch: 2, train_loss: 1.0066, test_loss: 0.9840, test_f1: 0.5145
 epoch: 3, train_loss: 0.9855, test_loss: 0.9372, test_f1: 0.5126
 epoch: 4, train_loss: 0.9651, test_loss: 0.9077, test_f1: 0.4840
 epoch: 5, train_loss: 0.9424, test_loss: 0.9471, test_f1: 0.5160
 epoch: 6, train_loss: 0.9502, test_loss: 0.8955, test_f1: 0.5039
 epoch: 7, train_loss: 0.9338, test_loss: 0.8792, test_f1: 0.5286
 epoch: 8, train_loss: 0.9172, test_loss: 0.8690, test_f1: 0.5520
 epoch: 9, train_loss: 0.9059, test_loss: 0.8718, test_f1: 0.5311
 epoch: 10, train_loss: 0.8980, test_loss: 0.8397, test_f1: 0.5479
 epoch: 11, train_loss: 0.8820, test_loss: 0.8345, test_f1: 0.5883
 epoch: 12, train_loss: 0.8706, test_loss: 0.8065, test_f1: 0.5738
 epoch: 13, train_loss: 0.8704, test_loss: 0.7989, test_f1: 0.5894
 epoch: 14, train_loss: 0.8502, test_loss: 0.8257, test_f1: 0.6015
 epoch: 15, train_loss: 0.8458, test_loss: 0.7712, test_f1: 0.6183
 epoch: 16, train_loss: 0.8444, test_loss: 0.7608, test_f1: 0.6093
 epoch: 17, train_loss: 0.8223, test_loss: 0.7717, test_f1: 0.5900
 epoch: 18, train_loss: 0.8316, test_loss: 0.7635, test_f1: 0.5897
 epoch: 19, train_loss: 0.8157, test_loss: 0.7171, test_f1: 0.6265
 epoch: 20, train_loss: 0.8178, test_loss: 0.7363, test_f1: 0.6270
 epoch: 21, train_loss: 0.8135, test_loss: 0.7168, test_f1: 0.6417
 epoch: 22, train_loss: 0.7908, test_loss: 0.7728, test_f1: 0.6187
 epoch: 23, train_loss: 0.8007, test_loss: 0.7237, test_f1: 0.6233
 epoch: 24, train_loss: 0.7764, test_loss: 0.7215, test_f1: 0.6570
 epoch: 25, train_loss: 0.7665, test_loss: 0.7682, test_f1: 0.6040
 epoch: 26, train_loss: 0.7588, test_loss: 0.7301, test_f1: 0.6369
 epoch: 27, train_loss: 0.7490, test_loss: 0.7419, test_f1: 0.6809
 epoch: 28, train_loss: 0.7493, test_loss: 0.7724, test_f1: 0.5894
 epoch: 29, train_loss: 0.7526, test_loss: 0.6979, test_f1: 0.6483
 epoch: 30, train_loss: 0.7526, test_loss: 0.6897, test_f1: 0.6743
 epoch: 31, train_loss: 0.7345, test_loss: 0.6856, test_f1: 0.6705
 epoch: 32, train_loss: 0.7386, test_loss: 0.6813, test_f1: 0.6631
 epoch: 33, train_loss: 0.7500, test_loss: 0.7096, test_f1: 0.6341
 epoch: 34, train_loss: 0.7241, test_loss: 0.6951, test_f1: 0.6472
 epoch: 35, train_loss: 0.7106, test_loss: 0.7367, test_f1: 0.6530
 epoch: 36, train_loss: 0.7377, test_loss: 0.6838, test_f1: 0.6755
 epoch: 37, train_loss: 0.7162, test_loss: 0.6933, test_f1: 0.6829
 epoch: 38, train_loss: 0.7050, test_loss: 0.6948, test_f1: 0.6478
 epoch: 39, train_loss: 0.7063, test_loss: 0.7584, test_f1: 0.6660
 epoch: 40, train_loss: 0.6979, test_loss: 0.7177, test_f1: 0.6491
 epoch: 41, train_loss: 0.7128, test_loss: 0.6856, test_f1: 0.6557
 epoch: 42, train_loss: 0.6889, test_loss: 0.7135, test_f1: 0.6420
 epoch: 43, train_loss: 0.6952, test_loss: 0.7292, test_f1: 0.6552
 epoch: 44, train_loss: 0.6918, test_loss: 0.7155, test_f1: 0.6638
 epoch: 45, train_loss: 0.6761, test_loss: 0.7744, test_f1: 0.6389
 epoch: 46, train_loss: 0.6905, test_loss: 0.7745, test_f1: 0.6243
 epoch: 47, train_loss: 0.6954, test_loss: 0.7464, test_f1: 0.6728
 epoch: 48, train_loss: 0.6813, test_loss: 0.7315, test_f1: 0.6633
 epoch: 49, train_loss: 0.6936, test_loss: 0.7292, test_f1: 0.6564
 epoch: 50, train_loss: 0.6658, test_loss: 0.8099, test_f1: 0.6278
 epoch: 51, train_loss: 0.6447, test_loss: 0.7600, test_f1: 0.6372
 epoch: 52, train_loss: 0.6349, test_loss: 0.7245, test_f1: 0.6671
 epoch: 53, train_loss: 0.6329, test_loss: 0.7680, test_f1: 0.6670
 epoch: 54, train_loss: 0.6255, test_loss: 0.7504, test_f1: 0.6460
 epoch: 55, train_loss: 0.6288, test_loss: 0.7554, test_f1: 0.6627
 epoch: 56, train_loss: 0.6142, test_loss: 0.7707, test_f1: 0.6552
 epoch: 57, train_loss: 0.6203, test_loss: 0.7753, test_f1: 0.6362
 epoch: 58, train_loss: 0.6130, test_loss: 0.7699, test_f1: 0.6522
 epoch: 59, train_loss: 0.6050, test_loss: 0.7367, test_f1: 0.6728
 epoch: 60, train_loss: 0.6057, test_loss: 0.7558, test_f1: 0.6644
 epoch: 61, train_loss: 0.6008, test_loss: 0.7621, test_f1: 0.6599
 epoch: 62, train_loss: 0.5859, test_loss: 0.8493, test_f1: 0.6434
 epoch: 63, train_loss: 0.6039, test_loss: 0.7968, test_f1: 0.6154
 epoch: 64, train_loss: 0.5834, test_loss: 0.7595, test_f1: 0.6644
 epoch: 65, train_loss: 0.5991, test_loss: 0.7605, test_f1: 0.6734
 epoch: 66, train_loss: 0.5951, test_loss: 0.7875, test_f1: 0.6569
 epoch: 67, train_loss: 0.5983, test_loss: 0.7813, test_f1: 0.6298
 epoch: 68, train_loss: 0.5958, test_loss: 0.7979, test_f1: 0.6586
 epoch: 69, train_loss: 0.5885, test_loss: 0.7747, test_f1: 0.6534
 epoch: 70, train_loss: 0.5894, test_loss: 0.7922, test_f1: 0.6480
 epoch: 71, train_loss: 0.5965, test_loss: 0.8381, test_f1: 0.6289
 epoch: 72, train_loss: 0.5726, test_loss: 0.7544, test_f1: 0.6667
 epoch: 73, train_loss: 0.5835, test_loss: 0.7796, test_f1: 0.6661
 epoch: 74, train_loss: 0.5778, test_loss: 0.7613, test_f1: 0.6501
 epoch: 75, train_loss: 0.5743, test_loss: 0.8109, test_f1: 0.6416
 epoch: 76, train_loss: 0.5675, test_loss: 0.7479, test_f1: 0.6576
 epoch: 77, train_loss: 0.5683, test_loss: 0.7362, test_f1: 0.6631
 epoch: 78, train_loss: 0.5660, test_loss: 0.7603, test_f1: 0.6565
 epoch: 79, train_loss: 0.5757, test_loss: 0.8010, test_f1: 0.6457
 epoch: 80, train_loss: 0.5566, test_loss: 0.7448, test_f1: 0.6489
 epoch: 81, train_loss: 0.5531, test_loss: 0.7811, test_f1: 0.6584
 epoch: 82, train_loss: 0.5691, test_loss: 0.7963, test_f1: 0.6488
 epoch: 83, train_loss: 0.5593, test_loss: 0.7747, test_f1: 0.6676
 epoch: 84, train_loss: 0.5602, test_loss: 0.7277, test_f1: 0.6836
 epoch: 85, train_loss: 0.5479, test_loss: 0.8543, test_f1: 0.6527
 epoch: 86, train_loss: 0.5544, test_loss: 0.7654, test_f1: 0.6699
 epoch: 87, train_loss: 0.5445, test_loss: 0.7632, test_f1: 0.6591
 epoch: 88, train_loss: 0.5627, test_loss: 0.8067, test_f1: 0.6543
 epoch: 89, train_loss: 0.5474, test_loss: 0.8460, test_f1: 0.6690
 epoch: 90, train_loss: 0.5484, test_loss: 0.8359, test_f1: 0.6599
 epoch: 91, train_loss: 0.5566, test_loss: 0.7912, test_f1: 0.6623
 epoch: 92, train_loss: 0.5540, test_loss: 0.7881, test_f1: 0.6742
 epoch: 93, train_loss: 0.5388, test_loss: 0.7991, test_f1: 0.6605
 epoch: 94, train_loss: 0.5358, test_loss: 0.8510, test_f1: 0.6863
 epoch: 95, train_loss: 0.5398, test_loss: 0.8144, test_f1: 0.6515
 epoch: 96, train_loss: 0.5384, test_loss: 0.8169, test_f1: 0.6579
 epoch: 97, train_loss: 0.5399, test_loss: 0.8965, test_f1: 0.6400
 epoch: 98, train_loss: 0.5276, test_loss: 0.8252, test_f1: 0.6484
 epoch: 99, train_loss: 0.5420, test_loss: 0.8092, test_f1: 0.6623

Training completed in 1306.77 seconds
Best F1: 0.7141 at epoch 96
Mean F1 across iterations: 0.6876  0.0143
========================FINAL RESULTS================================
FEGIN weighted F1: 0.7141  0.0143
python main.py --data ltspice_examples --representation component_pin_net --model FEGIN --layers 5 --hiddens 32 --batch_size 32 --lr 0.001 --emb_size 128 --epochs 100 --save_appendix component_pin_net_L5_H32_BS32_LR0.001_E128 --no_val
-----



STDERR:
  File "main.py", line 370, in <module>
    main()
  File "main.py", line 254, in main
    dataset = dataset_class(
  File "/home/philip/projects/ltspice_examples_code_repo/Circuit-Completion-Using-GNNs/component_classification_with_link_prediction_head/evaluation/FEGIN/kernel/circuit_datasets.py", line 15, in __init__
    self.data, self.slices = torch.load(self.processed_paths[0])
  File "/home/philip/.local/lib/python3.8/site-packages/torch/serialization.py", line 1040, in load
    warnings.warn(
  File "/usr/lib/python3.8/warnings.py", line 109, in _showwarnmsg
    sw(msg.message, msg.category, msg.filename, msg.lineno,
  File "main.py", line 47, in warn_with_traceback
    traceback.print_stack(file=log)
/home/philip/projects/ltspice_examples_code_repo/Circuit-Completion-Using-GNNs/component_classification_with_link_prediction_head/evaluation/FEGIN/kernel/circuit_datasets.py:15: FutureWarning: You are using `torch.load` with `weights_only=False` (the current default value), which uses the default pickle module implicitly. It is possible to construct malicious pickle data which will execute arbitrary code during unpickling (See https://github.com/pytorch/pytorch/blob/main/SECURITY.md#untrusted-models for more details). In a future release, the default value for `weights_only` will be flipped to `True`. This limits the functions that could be executed during unpickling. Arbitrary objects will no longer be allowed to be loaded via this mode unless they are explicitly allowlisted by the user via `torch.serialization.add_safe_globals`. We recommend you start setting `weights_only=True` for any use case where you don't have full control of the loaded file. Please open an issue on GitHub for any issues related to this experimental feature.
  self.data, self.slices = torch.load(self.processed_paths[0])
