STDOUT:
Results will be saved in /home/philip/projects/ltspice_examples_code_repo/Circuit-Completion-Using-GNNs/component_classification_with_link_prediction_head/evaluation/FEGIN/results/model_FEGIN_dataset_ltspice_examples
Command line input: python main.py --data ltspice_examples --representation component_component --model FEGIN --layers 5 --hiddens 128 --batch_size 256 --lr 0.001 --emb_size 512 --epochs 100 --save_appendix component_component_L5_H128_BS256_LR0.001_E512 --no_val
 is saved.
-----
ltspice_examples - FEGIN
Using 5 layers, 128 hidden units, h = 2
Loading component_component representation dataset
ENTERED
Training FEGIN on component_component representation
Train: 3556, Test: 845
##################ITERATION #0 ****************************************
 epoch: 0, train_loss: 1.3136, test_loss: 1.2838, test_f1: 0.2589
 epoch: 1, train_loss: 1.1996, test_loss: 1.2060, test_f1: 0.3383
 epoch: 2, train_loss: 1.1402, test_loss: 1.1409, test_f1: 0.3854
 epoch: 3, train_loss: 1.0887, test_loss: 1.1025, test_f1: 0.4500
 epoch: 4, train_loss: 1.0414, test_loss: 1.0018, test_f1: 0.5073
 epoch: 5, train_loss: 1.0079, test_loss: 1.0044, test_f1: 0.5010
 epoch: 6, train_loss: 0.9619, test_loss: 1.0086, test_f1: 0.4860
 epoch: 7, train_loss: 0.9318, test_loss: 1.0072, test_f1: 0.5013
 epoch: 8, train_loss: 0.9192, test_loss: 0.9938, test_f1: 0.5157
 epoch: 9, train_loss: 0.8826, test_loss: 1.0182, test_f1: 0.5008
 epoch: 10, train_loss: 0.8624, test_loss: 1.0471, test_f1: 0.4985
 epoch: 11, train_loss: 0.8456, test_loss: 1.1657, test_f1: 0.4724
 epoch: 12, train_loss: 0.8095, test_loss: 1.1143, test_f1: 0.4726
 epoch: 13, train_loss: 0.7980, test_loss: 1.0664, test_f1: 0.5210
 epoch: 14, train_loss: 0.7785, test_loss: 1.0598, test_f1: 0.5084
 epoch: 15, train_loss: 0.7540, test_loss: 1.1268, test_f1: 0.4900
 epoch: 16, train_loss: 0.7381, test_loss: 1.1389, test_f1: 0.4913
 epoch: 17, train_loss: 0.7216, test_loss: 1.2618, test_f1: 0.4897
 epoch: 18, train_loss: 0.7056, test_loss: 1.2567, test_f1: 0.5039
 epoch: 19, train_loss: 0.7041, test_loss: 1.2012, test_f1: 0.5169
 epoch: 20, train_loss: 0.7020, test_loss: 1.3526, test_f1: 0.5278
 epoch: 21, train_loss: 0.6802, test_loss: 1.2656, test_f1: 0.5085
 epoch: 22, train_loss: 0.6738, test_loss: 1.2611, test_f1: 0.5326
 epoch: 23, train_loss: 0.6570, test_loss: 1.3440, test_f1: 0.5227
 epoch: 24, train_loss: 0.6266, test_loss: 1.4841, test_f1: 0.5201
 epoch: 25, train_loss: 0.6157, test_loss: 1.3989, test_f1: 0.5307
 epoch: 26, train_loss: 0.6110, test_loss: 1.3954, test_f1: 0.5236
 epoch: 27, train_loss: 0.6270, test_loss: 1.5517, test_f1: 0.4754
 epoch: 28, train_loss: 0.6098, test_loss: 1.3985, test_f1: 0.5019
 epoch: 29, train_loss: 0.6007, test_loss: 1.4151, test_f1: 0.5363
 epoch: 30, train_loss: 0.5611, test_loss: 1.3952, test_f1: 0.5453
 epoch: 31, train_loss: 0.5687, test_loss: 1.5730, test_f1: 0.5218
 epoch: 32, train_loss: 0.5364, test_loss: 1.5496, test_f1: 0.5200
 epoch: 33, train_loss: 0.5143, test_loss: 1.5994, test_f1: 0.5171
 epoch: 34, train_loss: 0.5187, test_loss: 2.1133, test_f1: 0.5081
 epoch: 35, train_loss: 0.5007, test_loss: 1.7724, test_f1: 0.4980
 epoch: 36, train_loss: 0.5033, test_loss: 1.6924, test_f1: 0.5160
 epoch: 37, train_loss: 0.4784, test_loss: 1.7572, test_f1: 0.4927
 epoch: 38, train_loss: 0.5127, test_loss: 2.1379, test_f1: 0.4710
 epoch: 39, train_loss: 0.5055, test_loss: 1.8638, test_f1: 0.5417
 epoch: 40, train_loss: 0.4804, test_loss: 1.6632, test_f1: 0.5561
 epoch: 41, train_loss: 0.4313, test_loss: 1.7590, test_f1: 0.5630
 epoch: 42, train_loss: 0.4678, test_loss: 1.9611, test_f1: 0.5222
 epoch: 43, train_loss: 0.4697, test_loss: 1.7155, test_f1: 0.5184
 epoch: 44, train_loss: 0.4692, test_loss: 1.8127, test_f1: 0.5047
 epoch: 45, train_loss: 0.4541, test_loss: 1.6948, test_f1: 0.5685
 epoch: 46, train_loss: 0.4610, test_loss: 1.8170, test_f1: 0.5179
 epoch: 47, train_loss: 0.4325, test_loss: 1.8473, test_f1: 0.5339
 epoch: 48, train_loss: 0.4195, test_loss: 1.7598, test_f1: 0.5547
 epoch: 49, train_loss: 0.4069, test_loss: 2.0199, test_f1: 0.5310
 epoch: 50, train_loss: 0.3974, test_loss: 2.0011, test_f1: 0.5232
 epoch: 51, train_loss: 0.3755, test_loss: 2.0371, test_f1: 0.5299
 epoch: 52, train_loss: 0.3291, test_loss: 2.1090, test_f1: 0.5180
 epoch: 53, train_loss: 0.3206, test_loss: 2.2176, test_f1: 0.5272
 epoch: 54, train_loss: 0.3245, test_loss: 2.3273, test_f1: 0.5192
 epoch: 55, train_loss: 0.3007, test_loss: 2.2199, test_f1: 0.5056
 epoch: 56, train_loss: 0.2916, test_loss: 2.3358, test_f1: 0.5086
 epoch: 57, train_loss: 0.2827, test_loss: 2.3084, test_f1: 0.5248
 epoch: 58, train_loss: 0.2828, test_loss: 2.3130, test_f1: 0.5347
 epoch: 59, train_loss: 0.2738, test_loss: 2.2995, test_f1: 0.5344
 epoch: 60, train_loss: 0.2657, test_loss: 2.4341, test_f1: 0.5158
 epoch: 61, train_loss: 0.2576, test_loss: 2.6608, test_f1: 0.5185
 epoch: 62, train_loss: 0.2620, test_loss: 2.6058, test_f1: 0.5257
 epoch: 63, train_loss: 0.2578, test_loss: 2.7749, test_f1: 0.5089
 epoch: 64, train_loss: 0.2733, test_loss: 2.5450, test_f1: 0.5471
 epoch: 65, train_loss: 0.2536, test_loss: 2.7638, test_f1: 0.5316
 epoch: 66, train_loss: 0.2554, test_loss: 2.6081, test_f1: 0.5322
 epoch: 67, train_loss: 0.2629, test_loss: 2.6278, test_f1: 0.5372
 epoch: 68, train_loss: 0.2466, test_loss: 2.7746, test_f1: 0.4908
 epoch: 69, train_loss: 0.2642, test_loss: 2.5986, test_f1: 0.5079
 epoch: 70, train_loss: 0.2564, test_loss: 2.6185, test_f1: 0.5188
 epoch: 71, train_loss: 0.2659, test_loss: 2.7843, test_f1: 0.5197
 epoch: 72, train_loss: 0.2568, test_loss: 2.7059, test_f1: 0.5138
 epoch: 73, train_loss: 0.2639, test_loss: 2.6799, test_f1: 0.5109
 epoch: 74, train_loss: 0.2456, test_loss: 2.7919, test_f1: 0.5109
 epoch: 75, train_loss: 0.2486, test_loss: 2.6928, test_f1: 0.5164
 epoch: 76, train_loss: 0.2405, test_loss: 2.5543, test_f1: 0.5285
 epoch: 77, train_loss: 0.2401, test_loss: 2.6670, test_f1: 0.5257
 epoch: 78, train_loss: 0.2174, test_loss: 2.7553, test_f1: 0.5156
 epoch: 79, train_loss: 0.2049, test_loss: 2.9174, test_f1: 0.5287
 epoch: 80, train_loss: 0.1975, test_loss: 2.8524, test_f1: 0.5038
 epoch: 81, train_loss: 0.2260, test_loss: 2.8441, test_f1: 0.5082
 epoch: 82, train_loss: 0.2131, test_loss: 3.2759, test_f1: 0.5005
 epoch: 83, train_loss: 0.2197, test_loss: 2.9639, test_f1: 0.5076
 epoch: 84, train_loss: 0.2264, test_loss: 2.8247, test_f1: 0.5209
 epoch: 85, train_loss: 0.2114, test_loss: 2.9199, test_f1: 0.5406
 epoch: 86, train_loss: 0.2135, test_loss: 2.8348, test_f1: 0.5328
 epoch: 87, train_loss: 0.1952, test_loss: 3.0895, test_f1: 0.5342
 epoch: 88, train_loss: 0.2060, test_loss: 3.2727, test_f1: 0.5257
 epoch: 89, train_loss: 0.2202, test_loss: 2.8509, test_f1: 0.5256
 epoch: 90, train_loss: 0.1902, test_loss: 3.0003, test_f1: 0.5224
 epoch: 91, train_loss: 0.2096, test_loss: 2.9785, test_f1: 0.5139
 epoch: 92, train_loss: 0.2085, test_loss: 3.0121, test_f1: 0.5448
 epoch: 93, train_loss: 0.1956, test_loss: 3.1219, test_f1: 0.5218
 epoch: 94, train_loss: 0.2132, test_loss: 3.1037, test_f1: 0.5058
 epoch: 95, train_loss: 0.2027, test_loss: 3.2085, test_f1: 0.5661
 epoch: 96, train_loss: 0.1996, test_loss: 3.2866, test_f1: 0.5200
 epoch: 97, train_loss: 0.1773, test_loss: 2.9812, test_f1: 0.5446
 epoch: 98, train_loss: 0.1728, test_loss: 3.4532, test_f1: 0.5032
 epoch: 99, train_loss: 0.1724, test_loss: 3.2201, test_f1: 0.5259
##################ITERATION #1 ****************************************
 epoch: 0, train_loss: 1.2334, test_loss: 1.2538, test_f1: 0.2274
 epoch: 1, train_loss: 1.1188, test_loss: 1.1481, test_f1: 0.4551
 epoch: 2, train_loss: 1.0601, test_loss: 1.0599, test_f1: 0.4984
 epoch: 3, train_loss: 1.0180, test_loss: 0.9915, test_f1: 0.4946
 epoch: 4, train_loss: 0.9840, test_loss: 0.9730, test_f1: 0.5113
 epoch: 5, train_loss: 0.9449, test_loss: 0.9661, test_f1: 0.5025
 epoch: 6, train_loss: 0.8908, test_loss: 1.0018, test_f1: 0.5069
 epoch: 7, train_loss: 0.8706, test_loss: 1.0407, test_f1: 0.4731
 epoch: 8, train_loss: 0.8518, test_loss: 1.0474, test_f1: 0.5156
 epoch: 9, train_loss: 0.8266, test_loss: 1.0879, test_f1: 0.4949
 epoch: 10, train_loss: 0.7993, test_loss: 1.0992, test_f1: 0.4766
 epoch: 11, train_loss: 0.7893, test_loss: 1.0981, test_f1: 0.5383
 epoch: 12, train_loss: 0.7756, test_loss: 1.1194, test_f1: 0.5304
 epoch: 13, train_loss: 0.7670, test_loss: 1.2017, test_f1: 0.5131
 epoch: 14, train_loss: 0.7222, test_loss: 1.1811, test_f1: 0.5129
 epoch: 15, train_loss: 0.7154, test_loss: 1.1959, test_f1: 0.4855
 epoch: 16, train_loss: 0.6867, test_loss: 1.2203, test_f1: 0.5069
 epoch: 17, train_loss: 0.6825, test_loss: 1.1444, test_f1: 0.5581
 epoch: 18, train_loss: 0.6822, test_loss: 1.1949, test_f1: 0.5299
 epoch: 19, train_loss: 0.6611, test_loss: 1.3235, test_f1: 0.5081
 epoch: 20, train_loss: 0.6478, test_loss: 1.1418, test_f1: 0.5389
 epoch: 21, train_loss: 0.5995, test_loss: 1.6665, test_f1: 0.4996
 epoch: 22, train_loss: 0.5901, test_loss: 1.3345, test_f1: 0.5211
 epoch: 23, train_loss: 0.6019, test_loss: 1.4749, test_f1: 0.5038
 epoch: 24, train_loss: 0.5840, test_loss: 1.4785, test_f1: 0.5012
 epoch: 25, train_loss: 0.5709, test_loss: 1.3269, test_f1: 0.5493
 epoch: 26, train_loss: 0.5597, test_loss: 1.4103, test_f1: 0.5271
 epoch: 27, train_loss: 0.5401, test_loss: 1.4483, test_f1: 0.5223
 epoch: 28, train_loss: 0.5265, test_loss: 1.6078, test_f1: 0.5104
 epoch: 29, train_loss: 0.5372, test_loss: 1.4888, test_f1: 0.5064
 epoch: 30, train_loss: 0.5200, test_loss: 1.7091, test_f1: 0.5096
 epoch: 31, train_loss: 0.4997, test_loss: 1.7639, test_f1: 0.5214
 epoch: 32, train_loss: 0.4900, test_loss: 1.7866, test_f1: 0.5283
 epoch: 33, train_loss: 0.4876, test_loss: 1.5249, test_f1: 0.5158
 epoch: 34, train_loss: 0.4477, test_loss: 1.7706, test_f1: 0.5418
 epoch: 35, train_loss: 0.4694, test_loss: 1.9769, test_f1: 0.5254
 epoch: 36, train_loss: 0.4866, test_loss: 1.7483, test_f1: 0.5314
 epoch: 37, train_loss: 0.4493, test_loss: 1.4405, test_f1: 0.5376
 epoch: 38, train_loss: 0.4248, test_loss: 2.0493, test_f1: 0.5331
 epoch: 39, train_loss: 0.4309, test_loss: 1.7996, test_f1: 0.5355
 epoch: 40, train_loss: 0.4066, test_loss: 1.9155, test_f1: 0.5364
 epoch: 41, train_loss: 0.4028, test_loss: 2.0658, test_f1: 0.5005
 epoch: 42, train_loss: 0.4164, test_loss: 1.8634, test_f1: 0.5393
 epoch: 43, train_loss: 0.4079, test_loss: 1.9070, test_f1: 0.5186
 epoch: 44, train_loss: 0.3919, test_loss: 2.0297, test_f1: 0.5249
 epoch: 45, train_loss: 0.3921, test_loss: 2.0381, test_f1: 0.5103
 epoch: 46, train_loss: 0.3876, test_loss: 1.8681, test_f1: 0.5388
 epoch: 47, train_loss: 0.3724, test_loss: 1.9558, test_f1: 0.5311
 epoch: 48, train_loss: 0.3877, test_loss: 2.2427, test_f1: 0.5176
 epoch: 49, train_loss: 0.3646, test_loss: 1.9101, test_f1: 0.5474
 epoch: 50, train_loss: 0.3728, test_loss: 2.2729, test_f1: 0.5115
 epoch: 51, train_loss: 0.3071, test_loss: 2.0955, test_f1: 0.5406
 epoch: 52, train_loss: 0.2814, test_loss: 2.0876, test_f1: 0.5409
 epoch: 53, train_loss: 0.2765, test_loss: 2.3778, test_f1: 0.5249
 epoch: 54, train_loss: 0.2587, test_loss: 2.2037, test_f1: 0.5325
 epoch: 55, train_loss: 0.2598, test_loss: 2.3784, test_f1: 0.5277
 epoch: 56, train_loss: 0.2590, test_loss: 2.5219, test_f1: 0.5253
 epoch: 57, train_loss: 0.2422, test_loss: 2.2273, test_f1: 0.5385
 epoch: 58, train_loss: 0.2254, test_loss: 2.3681, test_f1: 0.5169
 epoch: 59, train_loss: 0.2345, test_loss: 2.5681, test_f1: 0.5351
 epoch: 60, train_loss: 0.2255, test_loss: 2.6130, test_f1: 0.5419
 epoch: 61, train_loss: 0.2102, test_loss: 2.8958, test_f1: 0.5249
 epoch: 62, train_loss: 0.2119, test_loss: 2.6076, test_f1: 0.5301
 epoch: 63, train_loss: 0.2333, test_loss: 2.4799, test_f1: 0.5217
 epoch: 64, train_loss: 0.2335, test_loss: 2.7287, test_f1: 0.5244
 epoch: 65, train_loss: 0.2224, test_loss: 2.5121, test_f1: 0.5330
 epoch: 66, train_loss: 0.2369, test_loss: 2.9925, test_f1: 0.5043
 epoch: 67, train_loss: 0.2409, test_loss: 2.5798, test_f1: 0.5280
 epoch: 68, train_loss: 0.2342, test_loss: 2.7141, test_f1: 0.5338
 epoch: 69, train_loss: 0.2237, test_loss: 2.5719, test_f1: 0.5376
 epoch: 70, train_loss: 0.2213, test_loss: 2.6997, test_f1: 0.4963
 epoch: 71, train_loss: 0.2284, test_loss: 2.6016, test_f1: 0.5232
 epoch: 72, train_loss: 0.2224, test_loss: 2.4377, test_f1: 0.5492
 epoch: 73, train_loss: 0.2224, test_loss: 2.8048, test_f1: 0.5267
 epoch: 74, train_loss: 0.1910, test_loss: 2.7032, test_f1: 0.5369
 epoch: 75, train_loss: 0.1957, test_loss: 2.8571, test_f1: 0.4969
 epoch: 76, train_loss: 0.1985, test_loss: 2.9007, test_f1: 0.5061
 epoch: 77, train_loss: 0.1922, test_loss: 2.9719, test_f1: 0.5464
 epoch: 78, train_loss: 0.1985, test_loss: 2.8549, test_f1: 0.5108
 epoch: 79, train_loss: 0.1908, test_loss: 3.1139, test_f1: 0.5136
 epoch: 80, train_loss: 0.1890, test_loss: 2.9329, test_f1: 0.5149
 epoch: 81, train_loss: 0.1851, test_loss: 2.8867, test_f1: 0.5312
 epoch: 82, train_loss: 0.1749, test_loss: 3.1821, test_f1: 0.5089
 epoch: 83, train_loss: 0.1668, test_loss: 3.0528, test_f1: 0.5318
 epoch: 84, train_loss: 0.1745, test_loss: 2.9867, test_f1: 0.5066
 epoch: 85, train_loss: 0.1661, test_loss: 3.4368, test_f1: 0.5316
 epoch: 86, train_loss: 0.1672, test_loss: 3.2296, test_f1: 0.5125
 epoch: 87, train_loss: 0.1619, test_loss: 3.2452, test_f1: 0.5152
 epoch: 88, train_loss: 0.1696, test_loss: 3.4042, test_f1: 0.5071
 epoch: 89, train_loss: 0.1668, test_loss: 3.6812, test_f1: 0.5322
 epoch: 90, train_loss: 0.1798, test_loss: 3.3842, test_f1: 0.5179
 epoch: 91, train_loss: 0.1581, test_loss: 3.5509, test_f1: 0.4918
 epoch: 92, train_loss: 0.1792, test_loss: 3.2838, test_f1: 0.5037
 epoch: 93, train_loss: 0.1805, test_loss: 3.3019, test_f1: 0.5261
 epoch: 94, train_loss: 0.1710, test_loss: 3.3120, test_f1: 0.5284
 epoch: 95, train_loss: 0.1631, test_loss: 3.2502, test_f1: 0.5154
 epoch: 96, train_loss: 0.1583, test_loss: 3.3544, test_f1: 0.5090
 epoch: 97, train_loss: 0.1488, test_loss: 3.3410, test_f1: 0.5192
 epoch: 98, train_loss: 0.1478, test_loss: 3.7169, test_f1: 0.5084
 epoch: 99, train_loss: 0.1554, test_loss: 3.2926, test_f1: 0.5203
##################ITERATION #2 ****************************************
 epoch: 0, train_loss: 1.2733, test_loss: 1.2532, test_f1: 0.3106
 epoch: 1, train_loss: 1.1451, test_loss: 1.1882, test_f1: 0.4248
 epoch: 2, train_loss: 1.0863, test_loss: 1.1380, test_f1: 0.4103
 epoch: 3, train_loss: 1.0406, test_loss: 1.0477, test_f1: 0.4758
 epoch: 4, train_loss: 1.0078, test_loss: 1.0004, test_f1: 0.5242
 epoch: 5, train_loss: 0.9750, test_loss: 0.9531, test_f1: 0.5082
 epoch: 6, train_loss: 0.9441, test_loss: 1.0250, test_f1: 0.4954
 epoch: 7, train_loss: 0.9175, test_loss: 1.0368, test_f1: 0.5073
 epoch: 8, train_loss: 0.8961, test_loss: 1.0553, test_f1: 0.4887
 epoch: 9, train_loss: 0.9045, test_loss: 0.9777, test_f1: 0.5302
 epoch: 10, train_loss: 0.8722, test_loss: 1.1383, test_f1: 0.4785
 epoch: 11, train_loss: 0.8432, test_loss: 1.0233, test_f1: 0.5130
 epoch: 12, train_loss: 0.8113, test_loss: 1.0295, test_f1: 0.5042
 epoch: 13, train_loss: 0.8102, test_loss: 1.0467, test_f1: 0.5205
 epoch: 14, train_loss: 0.8041, test_loss: 1.1368, test_f1: 0.5104
 epoch: 15, train_loss: 0.7895, test_loss: 1.2375, test_f1: 0.5361
 epoch: 16, train_loss: 0.7741, test_loss: 1.0649, test_f1: 0.5231
 epoch: 17, train_loss: 0.7793, test_loss: 1.0866, test_f1: 0.5449
 epoch: 18, train_loss: 0.7498, test_loss: 1.1593, test_f1: 0.5057
 epoch: 19, train_loss: 0.7389, test_loss: 1.3193, test_f1: 0.4665
 epoch: 20, train_loss: 0.7134, test_loss: 1.2686, test_f1: 0.5079
 epoch: 21, train_loss: 0.7070, test_loss: 1.2345, test_f1: 0.5253
 epoch: 22, train_loss: 0.6937, test_loss: 1.2555, test_f1: 0.5231
 epoch: 23, train_loss: 0.6783, test_loss: 1.1829, test_f1: 0.5664
 epoch: 24, train_loss: 0.6662, test_loss: 1.3478, test_f1: 0.4985
 epoch: 25, train_loss: 0.6579, test_loss: 1.1536, test_f1: 0.5302
 epoch: 26, train_loss: 0.6430, test_loss: 1.3564, test_f1: 0.5160
 epoch: 27, train_loss: 0.6334, test_loss: 1.3211, test_f1: 0.5431
 epoch: 28, train_loss: 0.6353, test_loss: 1.3790, test_f1: 0.5038
 epoch: 29, train_loss: 0.6194, test_loss: 1.3554, test_f1: 0.5298
 epoch: 30, train_loss: 0.6124, test_loss: 1.3849, test_f1: 0.5412
 epoch: 31, train_loss: 0.5937, test_loss: 1.4221, test_f1: 0.5573
 epoch: 32, train_loss: 0.5837, test_loss: 1.3375, test_f1: 0.5379
 epoch: 33, train_loss: 0.5748, test_loss: 1.6163, test_f1: 0.5141
 epoch: 34, train_loss: 0.5586, test_loss: 1.4918, test_f1: 0.5535
 epoch: 35, train_loss: 0.5652, test_loss: 1.4701, test_f1: 0.5461
 epoch: 36, train_loss: 0.5703, test_loss: 1.8401, test_f1: 0.5241
 epoch: 37, train_loss: 0.5728, test_loss: 1.4933, test_f1: 0.5512
 epoch: 38, train_loss: 0.5504, test_loss: 1.4324, test_f1: 0.5113
 epoch: 39, train_loss: 0.5459, test_loss: 1.7017, test_f1: 0.5163
 epoch: 40, train_loss: 0.5524, test_loss: 1.6684, test_f1: 0.5027
 epoch: 41, train_loss: 0.5152, test_loss: 1.5398, test_f1: 0.5314
 epoch: 42, train_loss: 0.5067, test_loss: 1.6768, test_f1: 0.5279
 epoch: 43, train_loss: 0.4954, test_loss: 1.5216, test_f1: 0.5568
 epoch: 44, train_loss: 0.5033, test_loss: 1.6660, test_f1: 0.5208
 epoch: 45, train_loss: 0.4974, test_loss: 1.6700, test_f1: 0.5587
 epoch: 46, train_loss: 0.4799, test_loss: 2.0659, test_f1: 0.5277
 epoch: 47, train_loss: 0.4894, test_loss: 1.7497, test_f1: 0.4888
 epoch: 48, train_loss: 0.4926, test_loss: 1.7204, test_f1: 0.5308
 epoch: 49, train_loss: 0.4569, test_loss: 1.7849, test_f1: 0.5324
 epoch: 50, train_loss: 0.4567, test_loss: 1.7353, test_f1: 0.5423
 epoch: 51, train_loss: 0.4112, test_loss: 1.7718, test_f1: 0.5533
 epoch: 52, train_loss: 0.3836, test_loss: 1.9140, test_f1: 0.5492
 epoch: 53, train_loss: 0.3667, test_loss: 1.9956, test_f1: 0.5409
 epoch: 54, train_loss: 0.3548, test_loss: 1.7907, test_f1: 0.5833
 epoch: 55, train_loss: 0.3480, test_loss: 2.0287, test_f1: 0.5587
 epoch: 56, train_loss: 0.3301, test_loss: 2.0525, test_f1: 0.5571
 epoch: 57, train_loss: 0.3387, test_loss: 2.1193, test_f1: 0.5449
 epoch: 58, train_loss: 0.3130, test_loss: 1.9734, test_f1: 0.5552
 epoch: 59, train_loss: 0.3243, test_loss: 2.0251, test_f1: 0.5615
 epoch: 60, train_loss: 0.3200, test_loss: 2.1476, test_f1: 0.5465
 epoch: 61, train_loss: 0.3178, test_loss: 2.1546, test_f1: 0.5448
 epoch: 62, train_loss: 0.3098, test_loss: 2.0469, test_f1: 0.5552
 epoch: 63, train_loss: 0.3078, test_loss: 2.2378, test_f1: 0.5449
 epoch: 64, train_loss: 0.2952, test_loss: 2.1730, test_f1: 0.5460
 epoch: 65, train_loss: 0.2796, test_loss: 2.4888, test_f1: 0.5118
 epoch: 66, train_loss: 0.2750, test_loss: 2.2512, test_f1: 0.5600
 epoch: 67, train_loss: 0.2845, test_loss: 2.4404, test_f1: 0.5549
 epoch: 68, train_loss: 0.2986, test_loss: 2.3729, test_f1: 0.5406
 epoch: 69, train_loss: 0.3017, test_loss: 2.3595, test_f1: 0.5256
 epoch: 70, train_loss: 0.2936, test_loss: 2.5288, test_f1: 0.5348
 epoch: 71, train_loss: 0.2778, test_loss: 2.1871, test_f1: 0.5683
 epoch: 72, train_loss: 0.2661, test_loss: 2.4754, test_f1: 0.5422
 epoch: 73, train_loss: 0.2505, test_loss: 2.5302, test_f1: 0.5269
 epoch: 74, train_loss: 0.2574, test_loss: 2.6498, test_f1: 0.5219
 epoch: 75, train_loss: 0.2531, test_loss: 2.5347, test_f1: 0.5432
 epoch: 76, train_loss: 0.2397, test_loss: 2.5974, test_f1: 0.5485
 epoch: 77, train_loss: 0.2428, test_loss: 2.6423, test_f1: 0.5212
 epoch: 78, train_loss: 0.2939, test_loss: 2.7042, test_f1: 0.5305
 epoch: 79, train_loss: 0.2845, test_loss: 2.4161, test_f1: 0.5645
 epoch: 80, train_loss: 0.2637, test_loss: 2.6324, test_f1: 0.5116
 epoch: 81, train_loss: 0.2632, test_loss: 2.6349, test_f1: 0.5310
 epoch: 82, train_loss: 0.2659, test_loss: 2.6314, test_f1: 0.5147
 epoch: 83, train_loss: 0.2701, test_loss: 2.6404, test_f1: 0.5422
 epoch: 84, train_loss: 0.2456, test_loss: 2.6943, test_f1: 0.5027
 epoch: 85, train_loss: 0.2347, test_loss: 2.5705, test_f1: 0.5511
 epoch: 86, train_loss: 0.2389, test_loss: 2.5994, test_f1: 0.5629
 epoch: 87, train_loss: 0.2268, test_loss: 2.6108, test_f1: 0.5453
 epoch: 88, train_loss: 0.2215, test_loss: 2.9600, test_f1: 0.5570
 epoch: 89, train_loss: 0.2179, test_loss: 2.8825, test_f1: 0.5434
 epoch: 90, train_loss: 0.2139, test_loss: 2.8249, test_f1: 0.4978
 epoch: 91, train_loss: 0.2166, test_loss: 2.8734, test_f1: 0.5428
 epoch: 92, train_loss: 0.2277, test_loss: 3.0013, test_f1: 0.5453
 epoch: 93, train_loss: 0.2199, test_loss: 2.8560, test_f1: 0.5262
 epoch: 94, train_loss: 0.2055, test_loss: 2.9631, test_f1: 0.5263
 epoch: 95, train_loss: 0.2098, test_loss: 3.0192, test_f1: 0.5201
 epoch: 96, train_loss: 0.2171, test_loss: 2.8340, test_f1: 0.5353
 epoch: 97, train_loss: 0.2222, test_loss: 2.9567, test_f1: 0.5164
 epoch: 98, train_loss: 0.2241, test_loss: 2.9872, test_f1: 0.5201
 epoch: 99, train_loss: 0.2186, test_loss: 2.8632, test_f1: 0.5218
##################ITERATION #3 ****************************************
 epoch: 0, train_loss: 1.3072, test_loss: 1.2435, test_f1: 0.3390
 epoch: 1, train_loss: 1.1389, test_loss: 1.1958, test_f1: 0.3776
 epoch: 2, train_loss: 1.0914, test_loss: 1.0892, test_f1: 0.4457
 epoch: 3, train_loss: 1.0540, test_loss: 1.0410, test_f1: 0.4603
 epoch: 4, train_loss: 1.0067, test_loss: 1.0194, test_f1: 0.4622
 epoch: 5, train_loss: 0.9728, test_loss: 1.0308, test_f1: 0.4874
 epoch: 6, train_loss: 0.9284, test_loss: 0.9736, test_f1: 0.4969
 epoch: 7, train_loss: 0.9064, test_loss: 1.0393, test_f1: 0.5296
 epoch: 8, train_loss: 0.9017, test_loss: 1.0114, test_f1: 0.4942
 epoch: 9, train_loss: 0.8692, test_loss: 1.0413, test_f1: 0.4965
 epoch: 10, train_loss: 0.8500, test_loss: 1.0571, test_f1: 0.4998
 epoch: 11, train_loss: 0.8106, test_loss: 1.1145, test_f1: 0.4947
 epoch: 12, train_loss: 0.8030, test_loss: 1.0482, test_f1: 0.5292
 epoch: 13, train_loss: 0.7852, test_loss: 1.1359, test_f1: 0.5408
 epoch: 14, train_loss: 0.7611, test_loss: 1.1951, test_f1: 0.5056
 epoch: 15, train_loss: 0.7258, test_loss: 1.1319, test_f1: 0.5467
 epoch: 16, train_loss: 0.7154, test_loss: 1.2499, test_f1: 0.4934
 epoch: 17, train_loss: 0.6875, test_loss: 1.2013, test_f1: 0.5302
 epoch: 18, train_loss: 0.6940, test_loss: 1.2835, test_f1: 0.5222
 epoch: 19, train_loss: 0.6850, test_loss: 1.4310, test_f1: 0.4898
 epoch: 20, train_loss: 0.6931, test_loss: 1.3380, test_f1: 0.5042
 epoch: 21, train_loss: 0.6640, test_loss: 1.2583, test_f1: 0.5549
 epoch: 22, train_loss: 0.6200, test_loss: 1.2705, test_f1: 0.5517
 epoch: 23, train_loss: 0.6261, test_loss: 1.2660, test_f1: 0.5660
 epoch: 24, train_loss: 0.6184, test_loss: 1.4584, test_f1: 0.5312
 epoch: 25, train_loss: 0.6097, test_loss: 1.6239, test_f1: 0.4855
 epoch: 26, train_loss: 0.6092, test_loss: 1.3095, test_f1: 0.5506
 epoch: 27, train_loss: 0.5896, test_loss: 1.3736, test_f1: 0.5158
 epoch: 28, train_loss: 0.5733, test_loss: 1.4444, test_f1: 0.5304
 epoch: 29, train_loss: 0.5142, test_loss: 1.4436, test_f1: 0.5413
 epoch: 30, train_loss: 0.5423, test_loss: 1.5137, test_f1: 0.5626
 epoch: 31, train_loss: 0.5286, test_loss: 1.5142, test_f1: 0.5199
 epoch: 32, train_loss: 0.5001, test_loss: 1.4783, test_f1: 0.5569
 epoch: 33, train_loss: 0.4964, test_loss: 1.4812, test_f1: 0.5456
 epoch: 34, train_loss: 0.4824, test_loss: 1.6451, test_f1: 0.5449
 epoch: 35, train_loss: 0.4829, test_loss: 1.7290, test_f1: 0.5320
 epoch: 36, train_loss: 0.4842, test_loss: 1.5924, test_f1: 0.5306
 epoch: 37, train_loss: 0.5140, test_loss: 1.7302, test_f1: 0.5159
 epoch: 38, train_loss: 0.5150, test_loss: 1.5237, test_f1: 0.5575
 epoch: 39, train_loss: 0.4975, test_loss: 1.5349, test_f1: 0.5544
 epoch: 40, train_loss: 0.4656, test_loss: 1.6075, test_f1: 0.5431
 epoch: 41, train_loss: 0.4652, test_loss: 1.6845, test_f1: 0.5568
 epoch: 42, train_loss: 0.4312, test_loss: 1.7158, test_f1: 0.5352
 epoch: 43, train_loss: 0.4218, test_loss: 1.7195, test_f1: 0.5487
 epoch: 44, train_loss: 0.4216, test_loss: 1.6389, test_f1: 0.5562
 epoch: 45, train_loss: 0.3782, test_loss: 1.7181, test_f1: 0.5785
 epoch: 46, train_loss: 0.4162, test_loss: 1.7590, test_f1: 0.5699
 epoch: 47, train_loss: 0.4357, test_loss: 1.7816, test_f1: 0.5342
 epoch: 48, train_loss: 0.4157, test_loss: 1.9536, test_f1: 0.5543
 epoch: 49, train_loss: 0.3924, test_loss: 1.8739, test_f1: 0.5384
 epoch: 50, train_loss: 0.3911, test_loss: 1.6480, test_f1: 0.5542
 epoch: 51, train_loss: 0.3418, test_loss: 1.8464, test_f1: 0.5573
 epoch: 52, train_loss: 0.2987, test_loss: 2.0840, test_f1: 0.5653
 epoch: 53, train_loss: 0.2871, test_loss: 2.0262, test_f1: 0.5654
 epoch: 54, train_loss: 0.2846, test_loss: 2.0654, test_f1: 0.5507
 epoch: 55, train_loss: 0.2682, test_loss: 2.1380, test_f1: 0.5619
 epoch: 56, train_loss: 0.2706, test_loss: 2.1754, test_f1: 0.5469
 epoch: 57, train_loss: 0.2620, test_loss: 2.2194, test_f1: 0.5351
 epoch: 58, train_loss: 0.2623, test_loss: 2.3358, test_f1: 0.5558
 epoch: 59, train_loss: 0.2693, test_loss: 2.1822, test_f1: 0.5459
 epoch: 60, train_loss: 0.2650, test_loss: 2.4958, test_f1: 0.5490
 epoch: 61, train_loss: 0.2619, test_loss: 2.2475, test_f1: 0.5487
 epoch: 62, train_loss: 0.2529, test_loss: 2.2801, test_f1: 0.5642
 epoch: 63, train_loss: 0.2450, test_loss: 2.2570, test_f1: 0.5506
 epoch: 64, train_loss: 0.2433, test_loss: 2.3965, test_f1: 0.5363
 epoch: 65, train_loss: 0.2432, test_loss: 2.3755, test_f1: 0.5563
 epoch: 66, train_loss: 0.2398, test_loss: 2.5148, test_f1: 0.5478
 epoch: 67, train_loss: 0.2345, test_loss: 2.4795, test_f1: 0.5493
 epoch: 68, train_loss: 0.2339, test_loss: 2.4111, test_f1: 0.5582
 epoch: 69, train_loss: 0.2186, test_loss: 2.5241, test_f1: 0.5464
 epoch: 70, train_loss: 0.2294, test_loss: 2.5533, test_f1: 0.5267
 epoch: 71, train_loss: 0.2192, test_loss: 2.8456, test_f1: 0.5486
 epoch: 72, train_loss: 0.2150, test_loss: 2.7719, test_f1: 0.5402
 epoch: 73, train_loss: 0.2154, test_loss: 2.8137, test_f1: 0.5471
 epoch: 74, train_loss: 0.2003, test_loss: 2.7184, test_f1: 0.5473
 epoch: 75, train_loss: 0.2078, test_loss: 2.7106, test_f1: 0.5503
 epoch: 76, train_loss: 0.2178, test_loss: 2.4144, test_f1: 0.5756
 epoch: 77, train_loss: 0.2228, test_loss: 2.6392, test_f1: 0.5481
 epoch: 78, train_loss: 0.2094, test_loss: 2.8999, test_f1: 0.5651
 epoch: 79, train_loss: 0.2222, test_loss: 2.7059, test_f1: 0.5447
 epoch: 80, train_loss: 0.1931, test_loss: 2.5295, test_f1: 0.5437
 epoch: 81, train_loss: 0.2118, test_loss: 2.6370, test_f1: 0.5489
 epoch: 82, train_loss: 0.1855, test_loss: 2.8557, test_f1: 0.5356
 epoch: 83, train_loss: 0.2059, test_loss: 3.0470, test_f1: 0.5395
 epoch: 84, train_loss: 0.1941, test_loss: 2.5658, test_f1: 0.5663
 epoch: 85, train_loss: 0.1848, test_loss: 2.8268, test_f1: 0.5262
 epoch: 86, train_loss: 0.1723, test_loss: 2.8109, test_f1: 0.5405
 epoch: 87, train_loss: 0.1805, test_loss: 3.0075, test_f1: 0.5513
 epoch: 88, train_loss: 0.1897, test_loss: 2.8295, test_f1: 0.5514
 epoch: 89, train_loss: 0.1714, test_loss: 2.9993, test_f1: 0.5446
 epoch: 90, train_loss: 0.1803, test_loss: 2.9625, test_f1: 0.5375
 epoch: 91, train_loss: 0.1855, test_loss: 2.9580, test_f1: 0.5251
 epoch: 92, train_loss: 0.1732, test_loss: 3.0812, test_f1: 0.5415
 epoch: 93, train_loss: 0.1657, test_loss: 3.1546, test_f1: 0.5179
 epoch: 94, train_loss: 0.1653, test_loss: 3.1490, test_f1: 0.5292
 epoch: 95, train_loss: 0.1618, test_loss: 3.3280, test_f1: 0.5282
 epoch: 96, train_loss: 0.1525, test_loss: 3.1130, test_f1: 0.5556
 epoch: 97, train_loss: 0.1741, test_loss: 3.0817, test_f1: 0.5478
 epoch: 98, train_loss: 0.1888, test_loss: 2.9524, test_f1: 0.5290
 epoch: 99, train_loss: 0.1921, test_loss: 3.1440, test_f1: 0.5381
##################ITERATION #4 ****************************************
 epoch: 0, train_loss: 1.3209, test_loss: 1.3217, test_f1: 0.3808
 epoch: 1, train_loss: 1.1883, test_loss: 1.1750, test_f1: 0.4741
 epoch: 2, train_loss: 1.1178, test_loss: 1.0818, test_f1: 0.4474
 epoch: 3, train_loss: 1.0587, test_loss: 1.0437, test_f1: 0.4565
 epoch: 4, train_loss: 1.0244, test_loss: 1.0202, test_f1: 0.4990
 epoch: 5, train_loss: 0.9925, test_loss: 0.9986, test_f1: 0.4767
 epoch: 6, train_loss: 0.9598, test_loss: 0.9627, test_f1: 0.5257
 epoch: 7, train_loss: 0.9408, test_loss: 1.0117, test_f1: 0.4545
 epoch: 8, train_loss: 0.9072, test_loss: 1.0133, test_f1: 0.5083
 epoch: 9, train_loss: 0.8939, test_loss: 1.0321, test_f1: 0.4988
 epoch: 10, train_loss: 0.8771, test_loss: 0.9668, test_f1: 0.5114
 epoch: 11, train_loss: 0.8549, test_loss: 1.1116, test_f1: 0.5117
 epoch: 12, train_loss: 0.8479, test_loss: 1.0511, test_f1: 0.5116
 epoch: 13, train_loss: 0.8156, test_loss: 1.0768, test_f1: 0.5114
 epoch: 14, train_loss: 0.7936, test_loss: 1.0852, test_f1: 0.5334
 epoch: 15, train_loss: 0.7678, test_loss: 1.0912, test_f1: 0.5078
 epoch: 16, train_loss: 0.7474, test_loss: 1.1605, test_f1: 0.4976
 epoch: 17, train_loss: 0.7440, test_loss: 1.1171, test_f1: 0.5299
 epoch: 18, train_loss: 0.7278, test_loss: 1.0511, test_f1: 0.5487
 epoch: 19, train_loss: 0.7189, test_loss: 1.1497, test_f1: 0.5501
 epoch: 20, train_loss: 0.7018, test_loss: 1.2814, test_f1: 0.5060
 epoch: 21, train_loss: 0.6972, test_loss: 1.1341, test_f1: 0.5396
 epoch: 22, train_loss: 0.6694, test_loss: 1.2879, test_f1: 0.5289
 epoch: 23, train_loss: 0.6544, test_loss: 1.2070, test_f1: 0.5392
 epoch: 24, train_loss: 0.6367, test_loss: 1.3658, test_f1: 0.5352
 epoch: 25, train_loss: 0.6434, test_loss: 1.2822, test_f1: 0.5402
 epoch: 26, train_loss: 0.6575, test_loss: 1.3527, test_f1: 0.5046
 epoch: 27, train_loss: 0.6101, test_loss: 1.2518, test_f1: 0.5602
 epoch: 28, train_loss: 0.5918, test_loss: 1.4379, test_f1: 0.5103
 epoch: 29, train_loss: 0.6022, test_loss: 1.3897, test_f1: 0.4964
 epoch: 30, train_loss: 0.5997, test_loss: 1.3574, test_f1: 0.5447
 epoch: 31, train_loss: 0.5729, test_loss: 1.3279, test_f1: 0.5512
 epoch: 32, train_loss: 0.5716, test_loss: 1.4291, test_f1: 0.5596
 epoch: 33, train_loss: 0.5548, test_loss: 1.4387, test_f1: 0.4949
 epoch: 34, train_loss: 0.5491, test_loss: 1.3995, test_f1: 0.5703
 epoch: 35, train_loss: 0.5213, test_loss: 1.3368, test_f1: 0.5492
 epoch: 36, train_loss: 0.5100, test_loss: 1.4272, test_f1: 0.5294
 epoch: 37, train_loss: 0.5264, test_loss: 1.5679, test_f1: 0.5103
 epoch: 38, train_loss: 0.5219, test_loss: 1.7604, test_f1: 0.4914
 epoch: 39, train_loss: 0.5282, test_loss: 1.4202, test_f1: 0.5642
 epoch: 40, train_loss: 0.5271, test_loss: 1.3029, test_f1: 0.5706
 epoch: 41, train_loss: 0.4858, test_loss: 1.5104, test_f1: 0.5384
 epoch: 42, train_loss: 0.4819, test_loss: 1.5278, test_f1: 0.5161
 epoch: 43, train_loss: 0.4565, test_loss: 1.7624, test_f1: 0.5025
 epoch: 44, train_loss: 0.4635, test_loss: 1.4921, test_f1: 0.5551
 epoch: 45, train_loss: 0.4639, test_loss: 1.4344, test_f1: 0.5491
 epoch: 46, train_loss: 0.4714, test_loss: 1.6417, test_f1: 0.5627
 epoch: 47, train_loss: 0.4518, test_loss: 1.6927, test_f1: 0.5017
 epoch: 48, train_loss: 0.4474, test_loss: 1.6079, test_f1: 0.5451
 epoch: 49, train_loss: 0.4539, test_loss: 1.7930, test_f1: 0.5380
 epoch: 50, train_loss: 0.4311, test_loss: 1.7793, test_f1: 0.4993
 epoch: 51, train_loss: 0.3745, test_loss: 1.6421, test_f1: 0.5612
 epoch: 52, train_loss: 0.3426, test_loss: 1.7255, test_f1: 0.5464
 epoch: 53, train_loss: 0.3319, test_loss: 2.0187, test_f1: 0.5383
 epoch: 54, train_loss: 0.3187, test_loss: 1.9926, test_f1: 0.5245
 epoch: 55, train_loss: 0.3336, test_loss: 2.0549, test_f1: 0.5452
 epoch: 56, train_loss: 0.3152, test_loss: 1.9951, test_f1: 0.5360
 epoch: 57, train_loss: 0.3169, test_loss: 2.1162, test_f1: 0.5030
 epoch: 58, train_loss: 0.2783, test_loss: 2.0037, test_f1: 0.5450
 epoch: 59, train_loss: 0.2893, test_loss: 2.0673, test_f1: 0.5384
 epoch: 60, train_loss: 0.2967, test_loss: 2.1903, test_f1: 0.5319
 epoch: 61, train_loss: 0.2926, test_loss: 1.9521, test_f1: 0.5408
 epoch: 62, train_loss: 0.3058, test_loss: 2.1043, test_f1: 0.5449
 epoch: 63, train_loss: 0.3085, test_loss: 2.0066, test_f1: 0.5436
 epoch: 64, train_loss: 0.2976, test_loss: 2.2759, test_f1: 0.5367
 epoch: 65, train_loss: 0.2676, test_loss: 2.3841, test_f1: 0.5089
 epoch: 66, train_loss: 0.2645, test_loss: 2.1867, test_f1: 0.5508
 epoch: 67, train_loss: 0.2720, test_loss: 2.2874, test_f1: 0.5299
 epoch: 68, train_loss: 0.2708, test_loss: 2.3635, test_f1: 0.5384
 epoch: 69, train_loss: 0.2675, test_loss: 2.2307, test_f1: 0.5513
 epoch: 70, train_loss: 0.2552, test_loss: 2.3499, test_f1: 0.5418
 epoch: 71, train_loss: 0.2530, test_loss: 2.3314, test_f1: 0.5439
 epoch: 72, train_loss: 0.2409, test_loss: 2.4912, test_f1: 0.5300
 epoch: 73, train_loss: 0.2455, test_loss: 2.3671, test_f1: 0.5551
 epoch: 74, train_loss: 0.2550, test_loss: 2.1221, test_f1: 0.5476
 epoch: 75, train_loss: 0.2425, test_loss: 2.3968, test_f1: 0.5432
 epoch: 76, train_loss: 0.2297, test_loss: 2.4092, test_f1: 0.5599
 epoch: 77, train_loss: 0.2527, test_loss: 2.6118, test_f1: 0.5314
 epoch: 78, train_loss: 0.2501, test_loss: 2.5514, test_f1: 0.5455
 epoch: 79, train_loss: 0.2367, test_loss: 2.4047, test_f1: 0.5559
 epoch: 80, train_loss: 0.2562, test_loss: 2.4539, test_f1: 0.5579
 epoch: 81, train_loss: 0.2346, test_loss: 2.6346, test_f1: 0.5266
 epoch: 82, train_loss: 0.2402, test_loss: 2.2432, test_f1: 0.5686
 epoch: 83, train_loss: 0.2212, test_loss: 2.3584, test_f1: 0.5447
 epoch: 84, train_loss: 0.2063, test_loss: 2.4674, test_f1: 0.5557
 epoch: 85, train_loss: 0.2153, test_loss: 2.7171, test_f1: 0.5309
 epoch: 86, train_loss: 0.2147, test_loss: 2.5334, test_f1: 0.5614
 epoch: 87, train_loss: 0.2022, test_loss: 2.4711, test_f1: 0.5424
 epoch: 88, train_loss: 0.1961, test_loss: 2.6872, test_f1: 0.5537
 epoch: 89, train_loss: 0.1942, test_loss: 2.5688, test_f1: 0.5551
 epoch: 90, train_loss: 0.2011, test_loss: 2.7162, test_f1: 0.5395
 epoch: 91, train_loss: 0.2153, test_loss: 2.9691, test_f1: 0.5315
 epoch: 92, train_loss: 0.1983, test_loss: 2.6340, test_f1: 0.5529
 epoch: 93, train_loss: 0.1988, test_loss: 2.8965, test_f1: 0.5423
 epoch: 94, train_loss: 0.2036, test_loss: 2.6552, test_f1: 0.5517
 epoch: 95, train_loss: 0.2117, test_loss: 2.7187, test_f1: 0.5485
 epoch: 96, train_loss: 0.2057, test_loss: 2.6382, test_f1: 0.5562
 epoch: 97, train_loss: 0.2045, test_loss: 2.3171, test_f1: 0.5407
 epoch: 98, train_loss: 0.2179, test_loss: 2.5086, test_f1: 0.5580
 epoch: 99, train_loss: 0.2078, test_loss: 2.8717, test_f1: 0.5082
##################ITERATION #5 ****************************************
 epoch: 0, train_loss: 1.4207, test_loss: 1.2953, test_f1: 0.3210
 epoch: 1, train_loss: 1.2167, test_loss: 1.2169, test_f1: 0.4271
 epoch: 2, train_loss: 1.1566, test_loss: 1.1887, test_f1: 0.4030
 epoch: 3, train_loss: 1.0877, test_loss: 1.0861, test_f1: 0.4660
 epoch: 4, train_loss: 1.0557, test_loss: 1.0320, test_f1: 0.5006
 epoch: 5, train_loss: 1.0093, test_loss: 1.0226, test_f1: 0.4870
 epoch: 6, train_loss: 0.9889, test_loss: 1.0267, test_f1: 0.4669
 epoch: 7, train_loss: 0.9741, test_loss: 0.9738, test_f1: 0.5123
 epoch: 8, train_loss: 0.9265, test_loss: 0.9814, test_f1: 0.5051
 epoch: 9, train_loss: 0.8962, test_loss: 1.1321, test_f1: 0.5020
 epoch: 10, train_loss: 0.8686, test_loss: 1.0358, test_f1: 0.4942
 epoch: 11, train_loss: 0.8537, test_loss: 1.0164, test_f1: 0.4998
 epoch: 12, train_loss: 0.8379, test_loss: 1.1334, test_f1: 0.5210
 epoch: 13, train_loss: 0.8187, test_loss: 1.0790, test_f1: 0.4938
 epoch: 14, train_loss: 0.7990, test_loss: 1.1031, test_f1: 0.5019
 epoch: 15, train_loss: 0.7796, test_loss: 1.1498, test_f1: 0.5313
 epoch: 16, train_loss: 0.7830, test_loss: 1.2216, test_f1: 0.5063
 epoch: 17, train_loss: 0.7582, test_loss: 1.1622, test_f1: 0.4763
 epoch: 18, train_loss: 0.7620, test_loss: 1.1396, test_f1: 0.5071
 epoch: 19, train_loss: 0.7335, test_loss: 1.2121, test_f1: 0.5067
 epoch: 20, train_loss: 0.7058, test_loss: 1.2464, test_f1: 0.4936
 epoch: 21, train_loss: 0.6869, test_loss: 1.2672, test_f1: 0.5303
 epoch: 22, train_loss: 0.6563, test_loss: 1.2187, test_f1: 0.5274
 epoch: 23, train_loss: 0.6564, test_loss: 1.3544, test_f1: 0.5283
 epoch: 24, train_loss: 0.6446, test_loss: 1.2885, test_f1: 0.5156
 epoch: 25, train_loss: 0.6482, test_loss: 1.4690, test_f1: 0.5064
 epoch: 26, train_loss: 0.6305, test_loss: 1.3421, test_f1: 0.5067
 epoch: 27, train_loss: 0.6260, test_loss: 1.4832, test_f1: 0.5187
 epoch: 28, train_loss: 0.6264, test_loss: 1.5340, test_f1: 0.5217
 epoch: 29, train_loss: 0.6210, test_loss: 1.2574, test_f1: 0.5557
 epoch: 30, train_loss: 0.5837, test_loss: 1.4018, test_f1: 0.5224
 epoch: 31, train_loss: 0.5638, test_loss: 1.5854, test_f1: 0.5111
 epoch: 32, train_loss: 0.5880, test_loss: 1.4225, test_f1: 0.5272
 epoch: 33, train_loss: 0.5655, test_loss: 1.5649, test_f1: 0.5087
 epoch: 34, train_loss: 0.5569, test_loss: 1.5469, test_f1: 0.5136
 epoch: 35, train_loss: 0.5603, test_loss: 1.4934, test_f1: 0.5375
 epoch: 36, train_loss: 0.5504, test_loss: 1.5478, test_f1: 0.5275
 epoch: 37, train_loss: 0.5293, test_loss: 1.6145, test_f1: 0.5359
 epoch: 38, train_loss: 0.5376, test_loss: 1.5646, test_f1: 0.5126
 epoch: 39, train_loss: 0.5039, test_loss: 1.6892, test_f1: 0.5116
 epoch: 40, train_loss: 0.4898, test_loss: 1.7328, test_f1: 0.5267
 epoch: 41, train_loss: 0.4607, test_loss: 1.7576, test_f1: 0.5146
 epoch: 42, train_loss: 0.4684, test_loss: 1.7845, test_f1: 0.5378
 epoch: 43, train_loss: 0.4520, test_loss: 1.8254, test_f1: 0.5231
 epoch: 44, train_loss: 0.4602, test_loss: 1.8048, test_f1: 0.5105
 epoch: 45, train_loss: 0.4592, test_loss: 1.6675, test_f1: 0.5567
 epoch: 46, train_loss: 0.4870, test_loss: 1.8890, test_f1: 0.5240
 epoch: 47, train_loss: 0.4723, test_loss: 1.9909, test_f1: 0.5101
 epoch: 48, train_loss: 0.4477, test_loss: 1.6982, test_f1: 0.5125
 epoch: 49, train_loss: 0.4324, test_loss: 1.7157, test_f1: 0.5192
 epoch: 50, train_loss: 0.4404, test_loss: 1.8368, test_f1: 0.5274
 epoch: 51, train_loss: 0.3805, test_loss: 1.8675, test_f1: 0.5306
 epoch: 52, train_loss: 0.3561, test_loss: 2.0468, test_f1: 0.5307
 epoch: 53, train_loss: 0.3513, test_loss: 1.9262, test_f1: 0.5287
 epoch: 54, train_loss: 0.3174, test_loss: 1.9686, test_f1: 0.5443
 epoch: 55, train_loss: 0.3173, test_loss: 2.2667, test_f1: 0.5221
 epoch: 56, train_loss: 0.2906, test_loss: 2.1417, test_f1: 0.5386
 epoch: 57, train_loss: 0.3156, test_loss: 2.1992, test_f1: 0.5277
 epoch: 58, train_loss: 0.3092, test_loss: 2.2465, test_f1: 0.5231
 epoch: 59, train_loss: 0.3140, test_loss: 2.1454, test_f1: 0.5378
 epoch: 60, train_loss: 0.2991, test_loss: 2.3548, test_f1: 0.5303
 epoch: 61, train_loss: 0.2998, test_loss: 2.2379, test_f1: 0.5321
 epoch: 62, train_loss: 0.2908, test_loss: 2.2942, test_f1: 0.5375
 epoch: 63, train_loss: 0.2959, test_loss: 2.3044, test_f1: 0.5424
 epoch: 64, train_loss: 0.2823, test_loss: 2.2508, test_f1: 0.5350
 epoch: 65, train_loss: 0.2767, test_loss: 2.3327, test_f1: 0.5315
 epoch: 66, train_loss: 0.2740, test_loss: 2.3878, test_f1: 0.5211
 epoch: 67, train_loss: 0.2641, test_loss: 2.2998, test_f1: 0.5443
 epoch: 68, train_loss: 0.2561, test_loss: 2.4125, test_f1: 0.5284
 epoch: 69, train_loss: 0.2607, test_loss: 2.4910, test_f1: 0.5398
 epoch: 70, train_loss: 0.2585, test_loss: 2.3938, test_f1: 0.5343
 epoch: 71, train_loss: 0.2551, test_loss: 2.5146, test_f1: 0.5181
 epoch: 72, train_loss: 0.2838, test_loss: 2.6890, test_f1: 0.5204
 epoch: 73, train_loss: 0.2855, test_loss: 2.4628, test_f1: 0.5178
 epoch: 74, train_loss: 0.2628, test_loss: 2.3329, test_f1: 0.5324
 epoch: 75, train_loss: 0.2593, test_loss: 2.3700, test_f1: 0.5277
 epoch: 76, train_loss: 0.2525, test_loss: 2.5137, test_f1: 0.5428
 epoch: 77, train_loss: 0.2470, test_loss: 2.5448, test_f1: 0.5287
 epoch: 78, train_loss: 0.2433, test_loss: 2.5236, test_f1: 0.5457
 epoch: 79, train_loss: 0.2538, test_loss: 2.4751, test_f1: 0.5192
 epoch: 80, train_loss: 0.2380, test_loss: 2.4872, test_f1: 0.5540
 epoch: 81, train_loss: 0.2308, test_loss: 2.6617, test_f1: 0.5246
 epoch: 82, train_loss: 0.2310, test_loss: 2.5538, test_f1: 0.5307
 epoch: 83, train_loss: 0.2319, test_loss: 2.5436, test_f1: 0.5110
 epoch: 84, train_loss: 0.2447, test_loss: 2.5028, test_f1: 0.5202
 epoch: 85, train_loss: 0.2396, test_loss: 2.4698, test_f1: 0.5496
 epoch: 86, train_loss: 0.2338, test_loss: 2.7290, test_f1: 0.5248
 epoch: 87, train_loss: 0.2449, test_loss: 2.5095, test_f1: 0.5438
 epoch: 88, train_loss: 0.2253, test_loss: 2.6395, test_f1: 0.5329
 epoch: 89, train_loss: 0.2254, test_loss: 2.4793, test_f1: 0.5550
 epoch: 90, train_loss: 0.2041, test_loss: 2.7453, test_f1: 0.5545
 epoch: 91, train_loss: 0.2138, test_loss: 2.6941, test_f1: 0.5667
 epoch: 92, train_loss: 0.2074, test_loss: 2.7152, test_f1: 0.5432
 epoch: 93, train_loss: 0.2093, test_loss: 2.8266, test_f1: 0.5502
 epoch: 94, train_loss: 0.2216, test_loss: 2.9095, test_f1: 0.5318
 epoch: 95, train_loss: 0.1886, test_loss: 2.7786, test_f1: 0.5371
 epoch: 96, train_loss: 0.1948, test_loss: 2.9183, test_f1: 0.5462
 epoch: 97, train_loss: 0.1848, test_loss: 2.9416, test_f1: 0.5547
 epoch: 98, train_loss: 0.1991, test_loss: 2.9849, test_f1: 0.5411
 epoch: 99, train_loss: 0.2128, test_loss: 3.0601, test_f1: 0.5356
##################ITERATION #6 ****************************************
 epoch: 0, train_loss: 1.4997, test_loss: 1.2960, test_f1: 0.3355
 epoch: 1, train_loss: 1.1897, test_loss: 1.1584, test_f1: 0.4329
 epoch: 2, train_loss: 1.1110, test_loss: 1.0692, test_f1: 0.4273
 epoch: 3, train_loss: 1.0425, test_loss: 1.0244, test_f1: 0.4778
 epoch: 4, train_loss: 1.0141, test_loss: 0.9979, test_f1: 0.4737
 epoch: 5, train_loss: 0.9657, test_loss: 0.9954, test_f1: 0.5082
 epoch: 6, train_loss: 0.9464, test_loss: 0.9781, test_f1: 0.5318
 epoch: 7, train_loss: 0.9197, test_loss: 0.9623, test_f1: 0.5061
 epoch: 8, train_loss: 0.9075, test_loss: 1.0339, test_f1: 0.5003
 epoch: 9, train_loss: 0.8865, test_loss: 0.9599, test_f1: 0.5173
 epoch: 10, train_loss: 0.8556, test_loss: 1.0079, test_f1: 0.5152
 epoch: 11, train_loss: 0.8532, test_loss: 1.0180, test_f1: 0.5047
 epoch: 12, train_loss: 0.8234, test_loss: 1.0414, test_f1: 0.5447
 epoch: 13, train_loss: 0.8049, test_loss: 1.0352, test_f1: 0.5037
 epoch: 14, train_loss: 0.7802, test_loss: 1.1482, test_f1: 0.4957
 epoch: 15, train_loss: 0.7682, test_loss: 1.0577, test_f1: 0.5182
 epoch: 16, train_loss: 0.7372, test_loss: 1.1206, test_f1: 0.5095
 epoch: 17, train_loss: 0.7375, test_loss: 1.1583, test_f1: 0.5547
 epoch: 18, train_loss: 0.7284, test_loss: 1.1445, test_f1: 0.5171
 epoch: 19, train_loss: 0.7164, test_loss: 1.2528, test_f1: 0.4994
 epoch: 20, train_loss: 0.6813, test_loss: 1.2371, test_f1: 0.5041
 epoch: 21, train_loss: 0.6824, test_loss: 1.3451, test_f1: 0.5217
 epoch: 22, train_loss: 0.6611, test_loss: 1.3636, test_f1: 0.5403
 epoch: 23, train_loss: 0.6485, test_loss: 1.2920, test_f1: 0.5075
 epoch: 24, train_loss: 0.6327, test_loss: 1.2731, test_f1: 0.5499
 epoch: 25, train_loss: 0.6458, test_loss: 1.3225, test_f1: 0.5195
 epoch: 26, train_loss: 0.6276, test_loss: 1.3315, test_f1: 0.5276
 epoch: 27, train_loss: 0.6082, test_loss: 1.3054, test_f1: 0.5611
 epoch: 28, train_loss: 0.5915, test_loss: 1.4493, test_f1: 0.5208
 epoch: 29, train_loss: 0.5870, test_loss: 1.3912, test_f1: 0.5373
 epoch: 30, train_loss: 0.5840, test_loss: 1.5609, test_f1: 0.5038
 epoch: 31, train_loss: 0.5613, test_loss: 1.3466, test_f1: 0.5431
 epoch: 32, train_loss: 0.5504, test_loss: 1.4606, test_f1: 0.5424
 epoch: 33, train_loss: 0.5524, test_loss: 1.7163, test_f1: 0.5449
 epoch: 34, train_loss: 0.5497, test_loss: 1.8032, test_f1: 0.5197
 epoch: 35, train_loss: 0.5304, test_loss: 1.4775, test_f1: 0.5437
 epoch: 36, train_loss: 0.5277, test_loss: 1.4417, test_f1: 0.5347
 epoch: 37, train_loss: 0.5095, test_loss: 1.5122, test_f1: 0.5375
 epoch: 38, train_loss: 0.5129, test_loss: 1.5762, test_f1: 0.5502
 epoch: 39, train_loss: 0.5105, test_loss: 1.4699, test_f1: 0.5256
 epoch: 40, train_loss: 0.4721, test_loss: 1.7157, test_f1: 0.5219
 epoch: 41, train_loss: 0.4513, test_loss: 1.7421, test_f1: 0.5147
 epoch: 42, train_loss: 0.4460, test_loss: 1.7811, test_f1: 0.5213
 epoch: 43, train_loss: 0.4279, test_loss: 1.7517, test_f1: 0.5192
 epoch: 44, train_loss: 0.4539, test_loss: 1.8028, test_f1: 0.5382
 epoch: 45, train_loss: 0.4625, test_loss: 1.7746, test_f1: 0.5035
 epoch: 46, train_loss: 0.4457, test_loss: 1.6693, test_f1: 0.5478
 epoch: 47, train_loss: 0.4375, test_loss: 1.8203, test_f1: 0.5288
 epoch: 48, train_loss: 0.4159, test_loss: 1.9029, test_f1: 0.5298
 epoch: 49, train_loss: 0.3933, test_loss: 1.9662, test_f1: 0.5172
 epoch: 50, train_loss: 0.3704, test_loss: 1.7908, test_f1: 0.5535
 epoch: 51, train_loss: 0.3763, test_loss: 2.0969, test_f1: 0.5308
 epoch: 52, train_loss: 0.3475, test_loss: 2.1017, test_f1: 0.5327
 epoch: 53, train_loss: 0.3199, test_loss: 2.0347, test_f1: 0.5491
 epoch: 54, train_loss: 0.3224, test_loss: 2.1788, test_f1: 0.5452
 epoch: 55, train_loss: 0.3098, test_loss: 2.2802, test_f1: 0.5549
 epoch: 56, train_loss: 0.2908, test_loss: 2.1687, test_f1: 0.5343
 epoch: 57, train_loss: 0.2877, test_loss: 2.1588, test_f1: 0.5361
 epoch: 58, train_loss: 0.2884, test_loss: 2.2361, test_f1: 0.5421
 epoch: 59, train_loss: 0.2812, test_loss: 2.4268, test_f1: 0.5145
 epoch: 60, train_loss: 0.2885, test_loss: 2.3236, test_f1: 0.5310
 epoch: 61, train_loss: 0.2774, test_loss: 2.3065, test_f1: 0.5231
 epoch: 62, train_loss: 0.2981, test_loss: 2.2318, test_f1: 0.5169
 epoch: 63, train_loss: 0.2713, test_loss: 2.2875, test_f1: 0.5359
 epoch: 64, train_loss: 0.2745, test_loss: 2.5501, test_f1: 0.5335
 epoch: 65, train_loss: 0.2678, test_loss: 2.4745, test_f1: 0.5184
 epoch: 66, train_loss: 0.2562, test_loss: 2.3834, test_f1: 0.5344
 epoch: 67, train_loss: 0.2537, test_loss: 2.4808, test_f1: 0.5177
 epoch: 68, train_loss: 0.2562, test_loss: 2.5346, test_f1: 0.5265
 epoch: 69, train_loss: 0.2724, test_loss: 2.5067, test_f1: 0.5077
 epoch: 70, train_loss: 0.2673, test_loss: 2.7349, test_f1: 0.5430
 epoch: 71, train_loss: 0.2574, test_loss: 2.2355, test_f1: 0.5387
 epoch: 72, train_loss: 0.2430, test_loss: 2.4437, test_f1: 0.5266
 epoch: 73, train_loss: 0.2260, test_loss: 2.4069, test_f1: 0.5380
 epoch: 74, train_loss: 0.2348, test_loss: 2.5135, test_f1: 0.5191
 epoch: 75, train_loss: 0.2407, test_loss: 2.4409, test_f1: 0.5371
 epoch: 76, train_loss: 0.2446, test_loss: 2.4637, test_f1: 0.5293
 epoch: 77, train_loss: 0.2252, test_loss: 2.5336, test_f1: 0.5400
 epoch: 78, train_loss: 0.2431, test_loss: 2.3781, test_f1: 0.5273
 epoch: 79, train_loss: 0.2535, test_loss: 2.6778, test_f1: 0.5060
 epoch: 80, train_loss: 0.2648, test_loss: 2.5439, test_f1: 0.5461
 epoch: 81, train_loss: 0.2520, test_loss: 2.4377, test_f1: 0.5288
 epoch: 82, train_loss: 0.2284, test_loss: 2.5736, test_f1: 0.5393
 epoch: 83, train_loss: 0.2077, test_loss: 2.5012, test_f1: 0.5305
 epoch: 84, train_loss: 0.2162, test_loss: 2.6386, test_f1: 0.5427
 epoch: 85, train_loss: 0.2059, test_loss: 2.7120, test_f1: 0.5428
 epoch: 86, train_loss: 0.1974, test_loss: 2.6694, test_f1: 0.5420
 epoch: 87, train_loss: 0.2225, test_loss: 2.6634, test_f1: 0.5330
 epoch: 88, train_loss: 0.2179, test_loss: 2.7002, test_f1: 0.5463
 epoch: 89, train_loss: 0.2163, test_loss: 2.8585, test_f1: 0.5432
 epoch: 90, train_loss: 0.2024, test_loss: 2.5520, test_f1: 0.5156
 epoch: 91, train_loss: 0.1918, test_loss: 2.5849, test_f1: 0.5634
 epoch: 92, train_loss: 0.2067, test_loss: 2.6636, test_f1: 0.5587
 epoch: 93, train_loss: 0.1804, test_loss: 2.8399, test_f1: 0.5446
 epoch: 94, train_loss: 0.1854, test_loss: 2.8445, test_f1: 0.5567
 epoch: 95, train_loss: 0.1873, test_loss: 2.8854, test_f1: 0.5274
 epoch: 96, train_loss: 0.2120, test_loss: 2.9770, test_f1: 0.5104
 epoch: 97, train_loss: 0.1999, test_loss: 2.8444, test_f1: 0.5249
 epoch: 98, train_loss: 0.1983, test_loss: 2.7768, test_f1: 0.5222
 epoch: 99, train_loss: 0.2033, test_loss: 2.8486, test_f1: 0.5256
##################ITERATION #7 ****************************************
 epoch: 0, train_loss: 1.4470, test_loss: 1.2971, test_f1: 0.3591
 epoch: 1, train_loss: 1.2091, test_loss: 1.2565, test_f1: 0.3421
 epoch: 2, train_loss: 1.1206, test_loss: 1.1913, test_f1: 0.4175
 epoch: 3, train_loss: 1.0606, test_loss: 1.1069, test_f1: 0.4209
 epoch: 4, train_loss: 1.0008, test_loss: 1.0334, test_f1: 0.4683
 epoch: 5, train_loss: 0.9752, test_loss: 1.0081, test_f1: 0.4727
 epoch: 6, train_loss: 0.9450, test_loss: 0.9606, test_f1: 0.5126
 epoch: 7, train_loss: 0.9217, test_loss: 0.9836, test_f1: 0.4729
 epoch: 8, train_loss: 0.8986, test_loss: 0.9977, test_f1: 0.5004
 epoch: 9, train_loss: 0.8665, test_loss: 1.0180, test_f1: 0.5316
 epoch: 10, train_loss: 0.8686, test_loss: 1.0553, test_f1: 0.5142
 epoch: 11, train_loss: 0.8588, test_loss: 1.0895, test_f1: 0.4612
 epoch: 12, train_loss: 0.8240, test_loss: 1.0428, test_f1: 0.5288
 epoch: 13, train_loss: 0.7888, test_loss: 1.0885, test_f1: 0.5050
 epoch: 14, train_loss: 0.7856, test_loss: 1.0307, test_f1: 0.5186
 epoch: 15, train_loss: 0.7641, test_loss: 1.0895, test_f1: 0.5164
 epoch: 16, train_loss: 0.7619, test_loss: 1.1084, test_f1: 0.5014
 epoch: 17, train_loss: 0.7450, test_loss: 1.0330, test_f1: 0.5584
 epoch: 18, train_loss: 0.7280, test_loss: 1.1219, test_f1: 0.5017
 epoch: 19, train_loss: 0.7063, test_loss: 1.1947, test_f1: 0.5012
 epoch: 20, train_loss: 0.6947, test_loss: 1.1886, test_f1: 0.4992
 epoch: 21, train_loss: 0.7060, test_loss: 1.1858, test_f1: 0.5478
 epoch: 22, train_loss: 0.7267, test_loss: 1.1966, test_f1: 0.5387
 epoch: 23, train_loss: 0.6714, test_loss: 1.2751, test_f1: 0.5109
 epoch: 24, train_loss: 0.6450, test_loss: 1.3185, test_f1: 0.5042
 epoch: 25, train_loss: 0.6389, test_loss: 1.3314, test_f1: 0.5338
 epoch: 26, train_loss: 0.6203, test_loss: 1.2495, test_f1: 0.5513
 epoch: 27, train_loss: 0.6177, test_loss: 1.2806, test_f1: 0.5409
 epoch: 28, train_loss: 0.6104, test_loss: 1.4301, test_f1: 0.5006
 epoch: 29, train_loss: 0.6029, test_loss: 1.3697, test_f1: 0.5209
 epoch: 30, train_loss: 0.5611, test_loss: 1.3810, test_f1: 0.5397
 epoch: 31, train_loss: 0.5541, test_loss: 1.4891, test_f1: 0.5399
 epoch: 32, train_loss: 0.5395, test_loss: 1.4637, test_f1: 0.5436
 epoch: 33, train_loss: 0.5469, test_loss: 1.5236, test_f1: 0.5289
 epoch: 34, train_loss: 0.5251, test_loss: 1.4544, test_f1: 0.5469
 epoch: 35, train_loss: 0.5062, test_loss: 1.6296, test_f1: 0.5205
 epoch: 36, train_loss: 0.5101, test_loss: 1.4436, test_f1: 0.5223
 epoch: 37, train_loss: 0.5372, test_loss: 1.4749, test_f1: 0.5381
 epoch: 38, train_loss: 0.5316, test_loss: 1.4895, test_f1: 0.5251
 epoch: 39, train_loss: 0.5134, test_loss: 1.5536, test_f1: 0.5381
 epoch: 40, train_loss: 0.4635, test_loss: 1.4554, test_f1: 0.5584
 epoch: 41, train_loss: 0.4569, test_loss: 1.6425, test_f1: 0.5344
 epoch: 42, train_loss: 0.4896, test_loss: 1.6443, test_f1: 0.5311
 epoch: 43, train_loss: 0.4717, test_loss: 1.7172, test_f1: 0.5216
 epoch: 44, train_loss: 0.4773, test_loss: 1.5559, test_f1: 0.5399
 epoch: 45, train_loss: 0.4643, test_loss: 1.6718, test_f1: 0.5183
 epoch: 46, train_loss: 0.4348, test_loss: 1.6703, test_f1: 0.5228
 epoch: 47, train_loss: 0.4328, test_loss: 1.6979, test_f1: 0.5159
 epoch: 48, train_loss: 0.4361, test_loss: 1.8384, test_f1: 0.5039
 epoch: 49, train_loss: 0.4141, test_loss: 1.7455, test_f1: 0.5382
 epoch: 50, train_loss: 0.4111, test_loss: 1.6499, test_f1: 0.5290
 epoch: 51, train_loss: 0.3988, test_loss: 1.8174, test_f1: 0.5453
 epoch: 52, train_loss: 0.3432, test_loss: 1.8662, test_f1: 0.5447
 epoch: 53, train_loss: 0.3297, test_loss: 2.0077, test_f1: 0.5335
 epoch: 54, train_loss: 0.3120, test_loss: 1.9139, test_f1: 0.5549
 epoch: 55, train_loss: 0.2937, test_loss: 1.9755, test_f1: 0.5293
 epoch: 56, train_loss: 0.3036, test_loss: 2.0406, test_f1: 0.5402
 epoch: 57, train_loss: 0.2965, test_loss: 2.1346, test_f1: 0.5333
 epoch: 58, train_loss: 0.2983, test_loss: 2.1204, test_f1: 0.5533
 epoch: 59, train_loss: 0.2873, test_loss: 2.0476, test_f1: 0.5661
 epoch: 60, train_loss: 0.2820, test_loss: 2.1765, test_f1: 0.5417
 epoch: 61, train_loss: 0.2659, test_loss: 2.0967, test_f1: 0.5405
 epoch: 62, train_loss: 0.2681, test_loss: 2.3116, test_f1: 0.5246
 epoch: 63, train_loss: 0.2707, test_loss: 2.2471, test_f1: 0.5370
 epoch: 64, train_loss: 0.2844, test_loss: 2.2670, test_f1: 0.5497
 epoch: 65, train_loss: 0.2685, test_loss: 2.2113, test_f1: 0.5374
 epoch: 66, train_loss: 0.2702, test_loss: 2.3411, test_f1: 0.5419
 epoch: 67, train_loss: 0.2552, test_loss: 2.2957, test_f1: 0.5320
 epoch: 68, train_loss: 0.2689, test_loss: 2.4935, test_f1: 0.5255
 epoch: 69, train_loss: 0.2881, test_loss: 2.5062, test_f1: 0.5268
 epoch: 70, train_loss: 0.2993, test_loss: 2.1437, test_f1: 0.5397
 epoch: 71, train_loss: 0.2726, test_loss: 2.1671, test_f1: 0.5378
 epoch: 72, train_loss: 0.2539, test_loss: 2.1877, test_f1: 0.5351
 epoch: 73, train_loss: 0.2437, test_loss: 2.4525, test_f1: 0.5421
 epoch: 74, train_loss: 0.2515, test_loss: 2.4195, test_f1: 0.5321
 epoch: 75, train_loss: 0.2443, test_loss: 2.1915, test_f1: 0.5369
 epoch: 76, train_loss: 0.2349, test_loss: 2.3513, test_f1: 0.5519
 epoch: 77, train_loss: 0.2226, test_loss: 2.3895, test_f1: 0.5504
 epoch: 78, train_loss: 0.2471, test_loss: 2.4954, test_f1: 0.5260
 epoch: 79, train_loss: 0.2368, test_loss: 2.6553, test_f1: 0.5272
 epoch: 80, train_loss: 0.2201, test_loss: 2.5835, test_f1: 0.5370
 epoch: 81, train_loss: 0.2309, test_loss: 2.5941, test_f1: 0.5507
 epoch: 82, train_loss: 0.2248, test_loss: 2.6159, test_f1: 0.5453
 epoch: 83, train_loss: 0.2439, test_loss: 2.4736, test_f1: 0.5161
 epoch: 84, train_loss: 0.2296, test_loss: 2.5701, test_f1: 0.5321
 epoch: 85, train_loss: 0.2288, test_loss: 2.7174, test_f1: 0.5282
 epoch: 86, train_loss: 0.2128, test_loss: 2.8295, test_f1: 0.5349
 epoch: 87, train_loss: 0.2236, test_loss: 2.6286, test_f1: 0.5406
 epoch: 88, train_loss: 0.2352, test_loss: 2.4081, test_f1: 0.5488
 epoch: 89, train_loss: 0.2297, test_loss: 2.8240, test_f1: 0.5088
 epoch: 90, train_loss: 0.2099, test_loss: 2.6172, test_f1: 0.5277
 epoch: 91, train_loss: 0.2158, test_loss: 2.6022, test_f1: 0.5134
 epoch: 92, train_loss: 0.2125, test_loss: 2.7400, test_f1: 0.5516
 epoch: 93, train_loss: 0.2123, test_loss: 2.5129, test_f1: 0.5644
 epoch: 94, train_loss: 0.1952, test_loss: 2.7863, test_f1: 0.5258
 epoch: 95, train_loss: 0.1987, test_loss: 2.6901, test_f1: 0.5379
 epoch: 96, train_loss: 0.1954, test_loss: 2.6420, test_f1: 0.5598
 epoch: 97, train_loss: 0.2054, test_loss: 2.7821, test_f1: 0.5428
 epoch: 98, train_loss: 0.1862, test_loss: 2.8438, test_f1: 0.5223
 epoch: 99, train_loss: 0.1935, test_loss: 2.8937, test_f1: 0.5188
##################ITERATION #8 ****************************************
 epoch: 0, train_loss: 1.6124, test_loss: 1.3907, test_f1: 0.2761
 epoch: 1, train_loss: 1.2451, test_loss: 1.2068, test_f1: 0.3437
 epoch: 2, train_loss: 1.1374, test_loss: 1.1265, test_f1: 0.4705
 epoch: 3, train_loss: 1.0677, test_loss: 1.0588, test_f1: 0.4654
 epoch: 4, train_loss: 1.0235, test_loss: 1.0264, test_f1: 0.5086
 epoch: 5, train_loss: 1.0002, test_loss: 1.0015, test_f1: 0.5017
 epoch: 6, train_loss: 0.9718, test_loss: 0.9458, test_f1: 0.5288
 epoch: 7, train_loss: 0.9509, test_loss: 0.9806, test_f1: 0.4988
 epoch: 8, train_loss: 0.9237, test_loss: 0.9481, test_f1: 0.5249
 epoch: 9, train_loss: 0.9042, test_loss: 1.0373, test_f1: 0.4875
 epoch: 10, train_loss: 0.8885, test_loss: 1.0012, test_f1: 0.4912
 epoch: 11, train_loss: 0.8888, test_loss: 0.9670, test_f1: 0.5067
 epoch: 12, train_loss: 0.8715, test_loss: 0.9779, test_f1: 0.5391
 epoch: 13, train_loss: 0.8544, test_loss: 1.0004, test_f1: 0.5181
 epoch: 14, train_loss: 0.8129, test_loss: 1.0859, test_f1: 0.4764
 epoch: 15, train_loss: 0.8176, test_loss: 0.9746, test_f1: 0.5499
 epoch: 16, train_loss: 0.8176, test_loss: 1.0455, test_f1: 0.5046
 epoch: 17, train_loss: 0.7865, test_loss: 1.0800, test_f1: 0.4842
 epoch: 18, train_loss: 0.7743, test_loss: 1.1421, test_f1: 0.5084
 epoch: 19, train_loss: 0.7656, test_loss: 1.1249, test_f1: 0.5062
 epoch: 20, train_loss: 0.7366, test_loss: 1.0432, test_f1: 0.5411
 epoch: 21, train_loss: 0.7465, test_loss: 1.0866, test_f1: 0.5308
 epoch: 22, train_loss: 0.7409, test_loss: 0.9804, test_f1: 0.5777
 epoch: 23, train_loss: 0.7247, test_loss: 1.0521, test_f1: 0.5263
 epoch: 24, train_loss: 0.7067, test_loss: 1.1318, test_f1: 0.5585
 epoch: 25, train_loss: 0.6924, test_loss: 1.1955, test_f1: 0.5138
 epoch: 26, train_loss: 0.6957, test_loss: 1.1100, test_f1: 0.5455
 epoch: 27, train_loss: 0.6737, test_loss: 1.1459, test_f1: 0.5492
 epoch: 28, train_loss: 0.6717, test_loss: 1.1067, test_f1: 0.5298
 epoch: 29, train_loss: 0.6878, test_loss: 1.2708, test_f1: 0.4998
 epoch: 30, train_loss: 0.6561, test_loss: 1.2740, test_f1: 0.5149
 epoch: 31, train_loss: 0.6361, test_loss: 1.2109, test_f1: 0.5588
 epoch: 32, train_loss: 0.6362, test_loss: 1.3063, test_f1: 0.5243
 epoch: 33, train_loss: 0.6248, test_loss: 1.2400, test_f1: 0.5507
 epoch: 34, train_loss: 0.6152, test_loss: 1.2290, test_f1: 0.5417
 epoch: 35, train_loss: 0.5869, test_loss: 1.2963, test_f1: 0.5149
 epoch: 36, train_loss: 0.5832, test_loss: 1.4176, test_f1: 0.5270
 epoch: 37, train_loss: 0.5944, test_loss: 1.1916, test_f1: 0.5596
 epoch: 38, train_loss: 0.6069, test_loss: 1.3889, test_f1: 0.5192
 epoch: 39, train_loss: 0.5816, test_loss: 1.3016, test_f1: 0.5217
 epoch: 40, train_loss: 0.5471, test_loss: 1.3278, test_f1: 0.5598
 epoch: 41, train_loss: 0.5562, test_loss: 1.5142, test_f1: 0.5294
 epoch: 42, train_loss: 0.5530, test_loss: 1.3805, test_f1: 0.5335
 epoch: 43, train_loss: 0.5400, test_loss: 1.5986, test_f1: 0.5129
 epoch: 44, train_loss: 0.5417, test_loss: 1.3884, test_f1: 0.5388
 epoch: 45, train_loss: 0.5527, test_loss: 1.4345, test_f1: 0.5589
 epoch: 46, train_loss: 0.5386, test_loss: 1.4544, test_f1: 0.5597
 epoch: 47, train_loss: 0.5046, test_loss: 1.5761, test_f1: 0.5346
 epoch: 48, train_loss: 0.5164, test_loss: 1.4547, test_f1: 0.5358
 epoch: 49, train_loss: 0.5026, test_loss: 1.4210, test_f1: 0.5469
 epoch: 50, train_loss: 0.4978, test_loss: 1.5271, test_f1: 0.5300
 epoch: 51, train_loss: 0.4555, test_loss: 1.5790, test_f1: 0.5511
 epoch: 52, train_loss: 0.4192, test_loss: 1.5490, test_f1: 0.5719
 epoch: 53, train_loss: 0.4033, test_loss: 1.6933, test_f1: 0.5384
 epoch: 54, train_loss: 0.3896, test_loss: 1.6013, test_f1: 0.5407
 epoch: 55, train_loss: 0.3743, test_loss: 1.6645, test_f1: 0.5313
 epoch: 56, train_loss: 0.3750, test_loss: 1.6837, test_f1: 0.5478
 epoch: 57, train_loss: 0.3865, test_loss: 1.7491, test_f1: 0.5540
 epoch: 58, train_loss: 0.3897, test_loss: 1.8398, test_f1: 0.5279
 epoch: 59, train_loss: 0.3667, test_loss: 1.6532, test_f1: 0.5513
 epoch: 60, train_loss: 0.3586, test_loss: 1.8895, test_f1: 0.5499
 epoch: 61, train_loss: 0.3608, test_loss: 1.6606, test_f1: 0.5515
 epoch: 62, train_loss: 0.3367, test_loss: 1.8425, test_f1: 0.5905
 epoch: 63, train_loss: 0.3360, test_loss: 1.9181, test_f1: 0.5511
 epoch: 64, train_loss: 0.3404, test_loss: 2.0105, test_f1: 0.5636
 epoch: 65, train_loss: 0.3264, test_loss: 2.1292, test_f1: 0.5398
 epoch: 66, train_loss: 0.3333, test_loss: 1.9615, test_f1: 0.5651
 epoch: 67, train_loss: 0.3257, test_loss: 1.9347, test_f1: 0.5450
 epoch: 68, train_loss: 0.3435, test_loss: 2.0631, test_f1: 0.5626
 epoch: 69, train_loss: 0.3308, test_loss: 2.1497, test_f1: 0.5440
 epoch: 70, train_loss: 0.3209, test_loss: 2.0750, test_f1: 0.5583
 epoch: 71, train_loss: 0.2989, test_loss: 1.9198, test_f1: 0.5575
 epoch: 72, train_loss: 0.3110, test_loss: 2.2209, test_f1: 0.5473
 epoch: 73, train_loss: 0.2998, test_loss: 2.0436, test_f1: 0.5442
 epoch: 74, train_loss: 0.3022, test_loss: 2.1921, test_f1: 0.5352
 epoch: 75, train_loss: 0.3084, test_loss: 2.0686, test_f1: 0.5440
 epoch: 76, train_loss: 0.2826, test_loss: 2.0873, test_f1: 0.5574
 epoch: 77, train_loss: 0.2724, test_loss: 2.2011, test_f1: 0.5568
 epoch: 78, train_loss: 0.2947, test_loss: 2.1887, test_f1: 0.5828
 epoch: 79, train_loss: 0.2843, test_loss: 2.0503, test_f1: 0.5570
 epoch: 80, train_loss: 0.2928, test_loss: 2.0525, test_f1: 0.5411
 epoch: 81, train_loss: 0.2868, test_loss: 1.9424, test_f1: 0.5643
 epoch: 82, train_loss: 0.2940, test_loss: 2.1991, test_f1: 0.5550
 epoch: 83, train_loss: 0.2833, test_loss: 2.2741, test_f1: 0.5625
 epoch: 84, train_loss: 0.2812, test_loss: 2.1799, test_f1: 0.5656
 epoch: 85, train_loss: 0.2893, test_loss: 2.2406, test_f1: 0.5651
 epoch: 86, train_loss: 0.2864, test_loss: 2.2688, test_f1: 0.5351
 epoch: 87, train_loss: 0.2582, test_loss: 2.2354, test_f1: 0.5686
 epoch: 88, train_loss: 0.2617, test_loss: 2.3754, test_f1: 0.5443
 epoch: 89, train_loss: 0.2459, test_loss: 2.2737, test_f1: 0.5495
 epoch: 90, train_loss: 0.2468, test_loss: 2.3043, test_f1: 0.5488
 epoch: 91, train_loss: 0.2425, test_loss: 2.4355, test_f1: 0.5676
 epoch: 92, train_loss: 0.2576, test_loss: 2.3300, test_f1: 0.5745
 epoch: 93, train_loss: 0.2464, test_loss: 2.2907, test_f1: 0.5524
 epoch: 94, train_loss: 0.2655, test_loss: 2.3462, test_f1: 0.5573
 epoch: 95, train_loss: 0.2434, test_loss: 2.2986, test_f1: 0.5399
 epoch: 96, train_loss: 0.2560, test_loss: 2.3981, test_f1: 0.5598
 epoch: 97, train_loss: 0.2401, test_loss: 2.1124, test_f1: 0.5630
 epoch: 98, train_loss: 0.2403, test_loss: 2.4423, test_f1: 0.5674
 epoch: 99, train_loss: 0.2279, test_loss: 2.6796, test_f1: 0.5435
##################ITERATION #9 ****************************************
 epoch: 0, train_loss: 1.5584, test_loss: 1.2679, test_f1: 0.2274
 epoch: 1, train_loss: 1.2228, test_loss: 1.1809, test_f1: 0.3333
 epoch: 2, train_loss: 1.1385, test_loss: 1.1162, test_f1: 0.4215
 epoch: 3, train_loss: 1.0899, test_loss: 1.0779, test_f1: 0.4187
 epoch: 4, train_loss: 1.0490, test_loss: 1.0873, test_f1: 0.4497
 epoch: 5, train_loss: 1.0350, test_loss: 1.0584, test_f1: 0.4439
 epoch: 6, train_loss: 0.9917, test_loss: 1.0093, test_f1: 0.4606
 epoch: 7, train_loss: 0.9710, test_loss: 1.0044, test_f1: 0.4744
 epoch: 8, train_loss: 0.9436, test_loss: 1.0317, test_f1: 0.4656
 epoch: 9, train_loss: 0.9183, test_loss: 1.0625, test_f1: 0.4765
 epoch: 10, train_loss: 0.9071, test_loss: 1.0179, test_f1: 0.4839
 epoch: 11, train_loss: 0.9096, test_loss: 1.0460, test_f1: 0.4942
 epoch: 12, train_loss: 0.8631, test_loss: 1.1001, test_f1: 0.4884
 epoch: 13, train_loss: 0.8575, test_loss: 1.0960, test_f1: 0.5065
 epoch: 14, train_loss: 0.8340, test_loss: 1.1308, test_f1: 0.4802
 epoch: 15, train_loss: 0.8134, test_loss: 1.0879, test_f1: 0.5064
 epoch: 16, train_loss: 0.8039, test_loss: 1.2325, test_f1: 0.4872
 epoch: 17, train_loss: 0.7979, test_loss: 1.1605, test_f1: 0.4962
 epoch: 18, train_loss: 0.7945, test_loss: 1.1273, test_f1: 0.5211
 epoch: 19, train_loss: 0.7706, test_loss: 1.1745, test_f1: 0.5207
 epoch: 20, train_loss: 0.7481, test_loss: 1.3595, test_f1: 0.4948
 epoch: 21, train_loss: 0.7301, test_loss: 1.1309, test_f1: 0.5108
 epoch: 22, train_loss: 0.7275, test_loss: 1.2546, test_f1: 0.5081
 epoch: 23, train_loss: 0.7140, test_loss: 1.2953, test_f1: 0.5080
 epoch: 24, train_loss: 0.7047, test_loss: 1.3035, test_f1: 0.4930
 epoch: 25, train_loss: 0.6894, test_loss: 1.4191, test_f1: 0.4981
 epoch: 26, train_loss: 0.6596, test_loss: 1.5064, test_f1: 0.4995
 epoch: 27, train_loss: 0.6676, test_loss: 1.1663, test_f1: 0.5139
 epoch: 28, train_loss: 0.6415, test_loss: 1.4272, test_f1: 0.5064
 epoch: 29, train_loss: 0.6429, test_loss: 1.5243, test_f1: 0.4824
 epoch: 30, train_loss: 0.6147, test_loss: 1.4091, test_f1: 0.4859
 epoch: 31, train_loss: 0.6002, test_loss: 1.3054, test_f1: 0.5032
 epoch: 32, train_loss: 0.6091, test_loss: 1.3849, test_f1: 0.5089
 epoch: 33, train_loss: 0.6144, test_loss: 1.4063, test_f1: 0.5220
 epoch: 34, train_loss: 0.6215, test_loss: 1.4677, test_f1: 0.5061
 epoch: 35, train_loss: 0.6287, test_loss: 1.3490, test_f1: 0.5122
 epoch: 36, train_loss: 0.5798, test_loss: 1.4931, test_f1: 0.5292
 epoch: 37, train_loss: 0.5895, test_loss: 1.6205, test_f1: 0.5114
 epoch: 38, train_loss: 0.5611, test_loss: 1.7325, test_f1: 0.4987
 epoch: 39, train_loss: 0.5650, test_loss: 1.3492, test_f1: 0.5347
 epoch: 40, train_loss: 0.5613, test_loss: 1.4865, test_f1: 0.5138
 epoch: 41, train_loss: 0.5469, test_loss: 1.5889, test_f1: 0.4872
 epoch: 42, train_loss: 0.5319, test_loss: 1.5413, test_f1: 0.5301
 epoch: 43, train_loss: 0.5332, test_loss: 1.7512, test_f1: 0.5034
 epoch: 44, train_loss: 0.5269, test_loss: 1.5952, test_f1: 0.5277
 epoch: 45, train_loss: 0.5172, test_loss: 1.5571, test_f1: 0.5236
 epoch: 46, train_loss: 0.5117, test_loss: 1.7005, test_f1: 0.5132
 epoch: 47, train_loss: 0.4931, test_loss: 1.9970, test_f1: 0.5106
 epoch: 48, train_loss: 0.5082, test_loss: 1.6889, test_f1: 0.5171
 epoch: 49, train_loss: 0.4900, test_loss: 1.7587, test_f1: 0.5309
 epoch: 50, train_loss: 0.4900, test_loss: 1.7621, test_f1: 0.5544
 epoch: 51, train_loss: 0.4547, test_loss: 1.7252, test_f1: 0.5474
 epoch: 52, train_loss: 0.4128, test_loss: 1.6710, test_f1: 0.5341
 epoch: 53, train_loss: 0.4013, test_loss: 1.8598, test_f1: 0.5405
 epoch: 54, train_loss: 0.3735, test_loss: 1.9739, test_f1: 0.5143
 epoch: 55, train_loss: 0.3699, test_loss: 1.9202, test_f1: 0.5444
 epoch: 56, train_loss: 0.3716, test_loss: 2.2088, test_f1: 0.5234
 epoch: 57, train_loss: 0.3869, test_loss: 1.9649, test_f1: 0.5268
 epoch: 58, train_loss: 0.3633, test_loss: 1.9871, test_f1: 0.5303
 epoch: 59, train_loss: 0.3662, test_loss: 2.1414, test_f1: 0.5418
 epoch: 60, train_loss: 0.3514, test_loss: 2.3701, test_f1: 0.5382
 epoch: 61, train_loss: 0.3466, test_loss: 2.0764, test_f1: 0.5317
 epoch: 62, train_loss: 0.3315, test_loss: 2.2236, test_f1: 0.5274
 epoch: 63, train_loss: 0.3351, test_loss: 2.2718, test_f1: 0.5253
 epoch: 64, train_loss: 0.3335, test_loss: 2.1633, test_f1: 0.5341
 epoch: 65, train_loss: 0.3062, test_loss: 2.3854, test_f1: 0.5366
 epoch: 66, train_loss: 0.2946, test_loss: 2.2984, test_f1: 0.5314
 epoch: 67, train_loss: 0.3206, test_loss: 2.3821, test_f1: 0.5201
 epoch: 68, train_loss: 0.3409, test_loss: 2.0544, test_f1: 0.5537
 epoch: 69, train_loss: 0.3235, test_loss: 2.4257, test_f1: 0.5345
 epoch: 70, train_loss: 0.2949, test_loss: 2.3319, test_f1: 0.5600
 epoch: 71, train_loss: 0.3058, test_loss: 2.3022, test_f1: 0.5441
 epoch: 72, train_loss: 0.3131, test_loss: 2.2409, test_f1: 0.5443
 epoch: 73, train_loss: 0.3083, test_loss: 2.3771, test_f1: 0.5335
 epoch: 74, train_loss: 0.3054, test_loss: 2.3411, test_f1: 0.5247
 epoch: 75, train_loss: 0.2815, test_loss: 2.5267, test_f1: 0.5270
 epoch: 76, train_loss: 0.2955, test_loss: 2.2870, test_f1: 0.5338
 epoch: 77, train_loss: 0.2960, test_loss: 2.4671, test_f1: 0.5473
 epoch: 78, train_loss: 0.2770, test_loss: 2.6078, test_f1: 0.5438
 epoch: 79, train_loss: 0.2645, test_loss: 2.5021, test_f1: 0.5496
 epoch: 80, train_loss: 0.2672, test_loss: 2.7724, test_f1: 0.5355
 epoch: 81, train_loss: 0.2537, test_loss: 2.6776, test_f1: 0.5309
 epoch: 82, train_loss: 0.2562, test_loss: 2.7254, test_f1: 0.5436
 epoch: 83, train_loss: 0.2599, test_loss: 2.5387, test_f1: 0.5343
 epoch: 84, train_loss: 0.2511, test_loss: 2.7581, test_f1: 0.5522
 epoch: 85, train_loss: 0.2674, test_loss: 2.9217, test_f1: 0.5105
 epoch: 86, train_loss: 0.2904, test_loss: 2.6408, test_f1: 0.5399
 epoch: 87, train_loss: 0.2809, test_loss: 2.6567, test_f1: 0.5462
 epoch: 88, train_loss: 0.2809, test_loss: 2.5536, test_f1: 0.5384
 epoch: 89, train_loss: 0.2541, test_loss: 2.8954, test_f1: 0.5494
 epoch: 90, train_loss: 0.2455, test_loss: 2.6760, test_f1: 0.5339
 epoch: 91, train_loss: 0.2341, test_loss: 2.6613, test_f1: 0.5441
 epoch: 92, train_loss: 0.2367, test_loss: 2.7910, test_f1: 0.5348
 epoch: 93, train_loss: 0.2292, test_loss: 3.1848, test_f1: 0.5412
 epoch: 94, train_loss: 0.2359, test_loss: 3.0080, test_f1: 0.5223
 epoch: 95, train_loss: 0.2263, test_loss: 2.9563, test_f1: 0.5238
 epoch: 96, train_loss: 0.2357, test_loss: 3.0600, test_f1: 0.5136
 epoch: 97, train_loss: 0.2508, test_loss: 2.8440, test_f1: 0.5342
 epoch: 98, train_loss: 0.2785, test_loss: 2.9549, test_f1: 0.5187
 epoch: 99, train_loss: 0.2403, test_loss: 2.7016, test_f1: 0.5406

Training completed in 413.94 seconds
Best F1: 0.5905 at epoch 62
Mean F1 across iterations: 0.5706  0.0099
========================FINAL RESULTS================================
FEGIN weighted F1: 0.5905  0.0099
python main.py --data ltspice_examples --representation component_component --model FEGIN --layers 5 --hiddens 128 --batch_size 256 --lr 0.001 --emb_size 512 --epochs 100 --save_appendix component_component_L5_H128_BS256_LR0.001_E512 --no_val
-----



STDERR:
  File "main.py", line 370, in <module>
    main()
  File "main.py", line 254, in main
    dataset = dataset_class(
  File "/home/philip/projects/ltspice_examples_code_repo/Circuit-Completion-Using-GNNs/component_classification_with_link_prediction_head/evaluation/FEGIN/kernel/circuit_datasets.py", line 15, in __init__
    self.data, self.slices = torch.load(self.processed_paths[0])
  File "/home/philip/.local/lib/python3.8/site-packages/torch/serialization.py", line 1040, in load
    warnings.warn(
  File "/usr/lib/python3.8/warnings.py", line 109, in _showwarnmsg
    sw(msg.message, msg.category, msg.filename, msg.lineno,
  File "main.py", line 47, in warn_with_traceback
    traceback.print_stack(file=log)
/home/philip/projects/ltspice_examples_code_repo/Circuit-Completion-Using-GNNs/component_classification_with_link_prediction_head/evaluation/FEGIN/kernel/circuit_datasets.py:15: FutureWarning: You are using `torch.load` with `weights_only=False` (the current default value), which uses the default pickle module implicitly. It is possible to construct malicious pickle data which will execute arbitrary code during unpickling (See https://github.com/pytorch/pytorch/blob/main/SECURITY.md#untrusted-models for more details). In a future release, the default value for `weights_only` will be flipped to `True`. This limits the functions that could be executed during unpickling. Arbitrary objects will no longer be allowed to be loaded via this mode unless they are explicitly allowlisted by the user via `torch.serialization.add_safe_globals`. We recommend you start setting `weights_only=True` for any use case where you don't have full control of the loaded file. Please open an issue on GitHub for any issues related to this experimental feature.
  self.data, self.slices = torch.load(self.processed_paths[0])
