STDOUT:
Results will be saved in /home/philip/projects/ltspice_examples_code_repo/Circuit-Completion-Using-GNNs/component_classification_with_link_prediction_head/evaluation/FEGIN/results/model_FEGIN_dataset_ltspice_examples
Command line input: python main.py --data ltspice_examples --representation component_pin_net --model FEGIN --layers 6 --hiddens 32 --batch_size 128 --lr 0.0001 --emb_size 128 --epochs 100 --save_appendix component_pin_net_L6_H32_BS128_LR0.0001_E128 --no_val
 is saved.
-----
ltspice_examples - FEGIN
Using 6 layers, 32 hidden units, h = 2
Loading component_pin_net representation dataset
ENTERED
Training FEGIN on component_pin_net representation
Train: 3558, Test: 846
##################ITERATION #0 ****************************************
 epoch: 0, train_loss: 1.3891, test_loss: 1.3903, test_f1: 0.0304
 epoch: 1, train_loss: 1.3819, test_loss: 1.3849, test_f1: 0.1355
 epoch: 2, train_loss: 1.3771, test_loss: 1.3770, test_f1: 0.2412
 epoch: 3, train_loss: 1.3724, test_loss: 1.3697, test_f1: 0.3944
 epoch: 4, train_loss: 1.3660, test_loss: 1.3619, test_f1: 0.4356
 epoch: 5, train_loss: 1.3586, test_loss: 1.3525, test_f1: 0.4081
 epoch: 6, train_loss: 1.3475, test_loss: 1.3407, test_f1: 0.3777
 epoch: 7, train_loss: 1.3354, test_loss: 1.3273, test_f1: 0.3350
 epoch: 8, train_loss: 1.3217, test_loss: 1.3105, test_f1: 0.3179
 epoch: 9, train_loss: 1.3043, test_loss: 1.2938, test_f1: 0.3115
 epoch: 10, train_loss: 1.2903, test_loss: 1.2766, test_f1: 0.3228
 epoch: 11, train_loss: 1.2721, test_loss: 1.2595, test_f1: 0.3239
 epoch: 12, train_loss: 1.2611, test_loss: 1.2447, test_f1: 0.3403
 epoch: 13, train_loss: 1.2453, test_loss: 1.2285, test_f1: 0.3413
 epoch: 14, train_loss: 1.2301, test_loss: 1.2109, test_f1: 0.3413
 epoch: 15, train_loss: 1.2193, test_loss: 1.1962, test_f1: 0.3422
 epoch: 16, train_loss: 1.2036, test_loss: 1.1790, test_f1: 0.3422
 epoch: 17, train_loss: 1.1881, test_loss: 1.1606, test_f1: 0.3422
 epoch: 18, train_loss: 1.1659, test_loss: 1.1443, test_f1: 0.3441
 epoch: 19, train_loss: 1.1577, test_loss: 1.1285, test_f1: 0.3460
 epoch: 20, train_loss: 1.1372, test_loss: 1.1130, test_f1: 0.3460
 epoch: 21, train_loss: 1.1263, test_loss: 1.1037, test_f1: 0.3449
 epoch: 22, train_loss: 1.1097, test_loss: 1.0925, test_f1: 0.3469
 epoch: 23, train_loss: 1.0962, test_loss: 1.0848, test_f1: 0.3469
 epoch: 24, train_loss: 1.0846, test_loss: 1.0772, test_f1: 0.3459
 epoch: 25, train_loss: 1.0722, test_loss: 1.0747, test_f1: 0.3440
 epoch: 26, train_loss: 1.0655, test_loss: 1.0705, test_f1: 0.3459
 epoch: 27, train_loss: 1.0589, test_loss: 1.0642, test_f1: 0.3459
 epoch: 28, train_loss: 1.0476, test_loss: 1.0636, test_f1: 0.3418
 epoch: 29, train_loss: 1.0422, test_loss: 1.0560, test_f1: 0.3479
 epoch: 30, train_loss: 1.0399, test_loss: 1.0541, test_f1: 0.3571
 epoch: 31, train_loss: 1.0381, test_loss: 1.0532, test_f1: 0.3671
 epoch: 32, train_loss: 1.0307, test_loss: 1.0469, test_f1: 0.3830
 epoch: 33, train_loss: 1.0205, test_loss: 1.0404, test_f1: 0.3815
 epoch: 34, train_loss: 1.0184, test_loss: 1.0430, test_f1: 0.4037
 epoch: 35, train_loss: 1.0113, test_loss: 1.0377, test_f1: 0.4262
 epoch: 36, train_loss: 1.0078, test_loss: 1.0283, test_f1: 0.4365
 epoch: 37, train_loss: 1.0049, test_loss: 1.0303, test_f1: 0.4365
 epoch: 38, train_loss: 0.9944, test_loss: 1.0270, test_f1: 0.4432
 epoch: 39, train_loss: 0.9947, test_loss: 1.0266, test_f1: 0.4541
 epoch: 40, train_loss: 0.9899, test_loss: 1.0198, test_f1: 0.4659
 epoch: 41, train_loss: 0.9833, test_loss: 1.0200, test_f1: 0.4610
 epoch: 42, train_loss: 0.9784, test_loss: 1.0194, test_f1: 0.4585
 epoch: 43, train_loss: 0.9710, test_loss: 1.0157, test_f1: 0.4749
 epoch: 44, train_loss: 0.9671, test_loss: 1.0047, test_f1: 0.4698
 epoch: 45, train_loss: 0.9656, test_loss: 1.0126, test_f1: 0.4936
 epoch: 46, train_loss: 0.9600, test_loss: 1.0033, test_f1: 0.4763
 epoch: 47, train_loss: 0.9566, test_loss: 0.9931, test_f1: 0.4937
 epoch: 48, train_loss: 0.9510, test_loss: 0.9934, test_f1: 0.4898
 epoch: 49, train_loss: 0.9503, test_loss: 0.9959, test_f1: 0.4940
 epoch: 50, train_loss: 0.9408, test_loss: 0.9899, test_f1: 0.4810
 epoch: 51, train_loss: 0.9497, test_loss: 0.9859, test_f1: 0.4855
 epoch: 52, train_loss: 0.9378, test_loss: 0.9821, test_f1: 0.4954
 epoch: 53, train_loss: 0.9313, test_loss: 0.9802, test_f1: 0.4820
 epoch: 54, train_loss: 0.9353, test_loss: 0.9783, test_f1: 0.4932
 epoch: 55, train_loss: 0.9398, test_loss: 0.9763, test_f1: 0.4915
 epoch: 56, train_loss: 0.9327, test_loss: 0.9785, test_f1: 0.4989
 epoch: 57, train_loss: 0.9280, test_loss: 0.9748, test_f1: 0.4974
 epoch: 58, train_loss: 0.9324, test_loss: 0.9704, test_f1: 0.5003
 epoch: 59, train_loss: 0.9322, test_loss: 0.9740, test_f1: 0.5006
 epoch: 60, train_loss: 0.9211, test_loss: 0.9753, test_f1: 0.4954
 epoch: 61, train_loss: 0.9252, test_loss: 0.9724, test_f1: 0.4968
 epoch: 62, train_loss: 0.9219, test_loss: 0.9668, test_f1: 0.4921
 epoch: 63, train_loss: 0.9280, test_loss: 0.9678, test_f1: 0.4990
 epoch: 64, train_loss: 0.9210, test_loss: 0.9638, test_f1: 0.4978
 epoch: 65, train_loss: 0.9134, test_loss: 0.9599, test_f1: 0.4919
 epoch: 66, train_loss: 0.9206, test_loss: 0.9688, test_f1: 0.5005
 epoch: 67, train_loss: 0.9276, test_loss: 0.9602, test_f1: 0.4980
 epoch: 68, train_loss: 0.9191, test_loss: 0.9583, test_f1: 0.4987
 epoch: 69, train_loss: 0.9231, test_loss: 0.9591, test_f1: 0.4976
 epoch: 70, train_loss: 0.9166, test_loss: 0.9625, test_f1: 0.4931
 epoch: 71, train_loss: 0.9110, test_loss: 0.9586, test_f1: 0.5071
 epoch: 72, train_loss: 0.8998, test_loss: 0.9544, test_f1: 0.4937
 epoch: 73, train_loss: 0.9157, test_loss: 0.9533, test_f1: 0.5000
 epoch: 74, train_loss: 0.9036, test_loss: 0.9601, test_f1: 0.5023
 epoch: 75, train_loss: 0.9033, test_loss: 0.9557, test_f1: 0.5042
 epoch: 76, train_loss: 0.9074, test_loss: 0.9576, test_f1: 0.4965
 epoch: 77, train_loss: 0.9063, test_loss: 0.9569, test_f1: 0.5053
 epoch: 78, train_loss: 0.8987, test_loss: 0.9470, test_f1: 0.5000
 epoch: 79, train_loss: 0.9027, test_loss: 0.9565, test_f1: 0.5019
 epoch: 80, train_loss: 0.9067, test_loss: 0.9465, test_f1: 0.4990
 epoch: 81, train_loss: 0.9019, test_loss: 0.9557, test_f1: 0.5050
 epoch: 82, train_loss: 0.8994, test_loss: 0.9480, test_f1: 0.5059
 epoch: 83, train_loss: 0.8976, test_loss: 0.9495, test_f1: 0.5096
 epoch: 84, train_loss: 0.8943, test_loss: 0.9455, test_f1: 0.4989
 epoch: 85, train_loss: 0.8996, test_loss: 0.9545, test_f1: 0.5032
 epoch: 86, train_loss: 0.8860, test_loss: 0.9423, test_f1: 0.4976
 epoch: 87, train_loss: 0.8897, test_loss: 0.9449, test_f1: 0.5138
 epoch: 88, train_loss: 0.8853, test_loss: 0.9452, test_f1: 0.4999
 epoch: 89, train_loss: 0.8991, test_loss: 0.9441, test_f1: 0.5002
 epoch: 90, train_loss: 0.8979, test_loss: 0.9388, test_f1: 0.5025
 epoch: 91, train_loss: 0.8932, test_loss: 0.9407, test_f1: 0.5000
 epoch: 92, train_loss: 0.8921, test_loss: 0.9451, test_f1: 0.5047
 epoch: 93, train_loss: 0.8829, test_loss: 0.9417, test_f1: 0.5031
 epoch: 94, train_loss: 0.8843, test_loss: 0.9447, test_f1: 0.5035
 epoch: 95, train_loss: 0.8788, test_loss: 0.9398, test_f1: 0.4975
 epoch: 96, train_loss: 0.8825, test_loss: 0.9391, test_f1: 0.5026
 epoch: 97, train_loss: 0.8896, test_loss: 0.9419, test_f1: 0.5042
 epoch: 98, train_loss: 0.8864, test_loss: 0.9345, test_f1: 0.5003
 epoch: 99, train_loss: 0.8774, test_loss: 0.9426, test_f1: 0.5009
##################ITERATION #1 ****************************************
 epoch: 0, train_loss: 1.3566, test_loss: 1.3749, test_f1: 0.2270
 epoch: 1, train_loss: 1.3333, test_loss: 1.3537, test_f1: 0.2836
 epoch: 2, train_loss: 1.3158, test_loss: 1.3062, test_f1: 0.3948
 epoch: 3, train_loss: 1.2968, test_loss: 1.2774, test_f1: 0.4054
 epoch: 4, train_loss: 1.2762, test_loss: 1.2519, test_f1: 0.4007
 epoch: 5, train_loss: 1.2544, test_loss: 1.2265, test_f1: 0.3919
 epoch: 6, train_loss: 1.2244, test_loss: 1.2001, test_f1: 0.3751
 epoch: 7, train_loss: 1.2045, test_loss: 1.1761, test_f1: 0.3781
 epoch: 8, train_loss: 1.1767, test_loss: 1.1574, test_f1: 0.3498
 epoch: 9, train_loss: 1.1563, test_loss: 1.1375, test_f1: 0.3765
 epoch: 10, train_loss: 1.1378, test_loss: 1.1256, test_f1: 0.3714
 epoch: 11, train_loss: 1.1186, test_loss: 1.1135, test_f1: 0.3463
 epoch: 12, train_loss: 1.1068, test_loss: 1.1017, test_f1: 0.3537
 epoch: 13, train_loss: 1.0918, test_loss: 1.0919, test_f1: 0.3514
 epoch: 14, train_loss: 1.0846, test_loss: 1.0958, test_f1: 0.3552
 epoch: 15, train_loss: 1.0755, test_loss: 1.0848, test_f1: 0.3829
 epoch: 16, train_loss: 1.0638, test_loss: 1.0834, test_f1: 0.3631
 epoch: 17, train_loss: 1.0595, test_loss: 1.0681, test_f1: 0.3811
 epoch: 18, train_loss: 1.0500, test_loss: 1.0736, test_f1: 0.4033
 epoch: 19, train_loss: 1.0434, test_loss: 1.0642, test_f1: 0.4131
 epoch: 20, train_loss: 1.0416, test_loss: 1.0550, test_f1: 0.4265
 epoch: 21, train_loss: 1.0301, test_loss: 1.0589, test_f1: 0.4383
 epoch: 22, train_loss: 1.0305, test_loss: 1.0588, test_f1: 0.4434
 epoch: 23, train_loss: 1.0181, test_loss: 1.0473, test_f1: 0.4585
 epoch: 24, train_loss: 1.0169, test_loss: 1.0419, test_f1: 0.4648
 epoch: 25, train_loss: 1.0100, test_loss: 1.0361, test_f1: 0.4436
 epoch: 26, train_loss: 1.0120, test_loss: 1.0257, test_f1: 0.4586
 epoch: 27, train_loss: 1.0019, test_loss: 1.0284, test_f1: 0.4575
 epoch: 28, train_loss: 1.0064, test_loss: 1.0312, test_f1: 0.4540
 epoch: 29, train_loss: 0.9994, test_loss: 1.0235, test_f1: 0.4740
 epoch: 30, train_loss: 0.9919, test_loss: 1.0128, test_f1: 0.4633
 epoch: 31, train_loss: 0.9887, test_loss: 1.0102, test_f1: 0.4686
 epoch: 32, train_loss: 0.9789, test_loss: 1.0087, test_f1: 0.4638
 epoch: 33, train_loss: 0.9902, test_loss: 0.9999, test_f1: 0.4691
 epoch: 34, train_loss: 0.9754, test_loss: 1.0009, test_f1: 0.4650
 epoch: 35, train_loss: 0.9749, test_loss: 0.9978, test_f1: 0.4701
 epoch: 36, train_loss: 0.9717, test_loss: 0.9945, test_f1: 0.4719
 epoch: 37, train_loss: 0.9785, test_loss: 0.9838, test_f1: 0.4783
 epoch: 38, train_loss: 0.9662, test_loss: 0.9956, test_f1: 0.4817
 epoch: 39, train_loss: 0.9701, test_loss: 0.9816, test_f1: 0.4743
 epoch: 40, train_loss: 0.9587, test_loss: 0.9813, test_f1: 0.4861
 epoch: 41, train_loss: 0.9585, test_loss: 0.9777, test_f1: 0.5010
 epoch: 42, train_loss: 0.9559, test_loss: 0.9788, test_f1: 0.4831
 epoch: 43, train_loss: 0.9459, test_loss: 0.9915, test_f1: 0.4934
 epoch: 44, train_loss: 0.9527, test_loss: 0.9806, test_f1: 0.4946
 epoch: 45, train_loss: 0.9599, test_loss: 0.9845, test_f1: 0.4926
 epoch: 46, train_loss: 0.9464, test_loss: 0.9844, test_f1: 0.4966
 epoch: 47, train_loss: 0.9461, test_loss: 0.9736, test_f1: 0.5049
 epoch: 48, train_loss: 0.9423, test_loss: 0.9714, test_f1: 0.5056
 epoch: 49, train_loss: 0.9451, test_loss: 0.9738, test_f1: 0.5054
 epoch: 50, train_loss: 0.9379, test_loss: 0.9827, test_f1: 0.4974
 epoch: 51, train_loss: 0.9324, test_loss: 0.9760, test_f1: 0.5099
 epoch: 52, train_loss: 0.9314, test_loss: 0.9656, test_f1: 0.5088
 epoch: 53, train_loss: 0.9337, test_loss: 0.9748, test_f1: 0.5152
 epoch: 54, train_loss: 0.9339, test_loss: 0.9670, test_f1: 0.5186
 epoch: 55, train_loss: 0.9367, test_loss: 0.9718, test_f1: 0.5100
 epoch: 56, train_loss: 0.9202, test_loss: 0.9618, test_f1: 0.5139
 epoch: 57, train_loss: 0.9272, test_loss: 0.9796, test_f1: 0.5091
 epoch: 58, train_loss: 0.9310, test_loss: 0.9737, test_f1: 0.5026
 epoch: 59, train_loss: 0.9266, test_loss: 0.9732, test_f1: 0.5131
 epoch: 60, train_loss: 0.9235, test_loss: 0.9668, test_f1: 0.5218
 epoch: 61, train_loss: 0.9241, test_loss: 0.9728, test_f1: 0.5241
 epoch: 62, train_loss: 0.9183, test_loss: 0.9673, test_f1: 0.5215
 epoch: 63, train_loss: 0.9233, test_loss: 0.9678, test_f1: 0.5108
 epoch: 64, train_loss: 0.9201, test_loss: 0.9714, test_f1: 0.5138
 epoch: 65, train_loss: 0.9213, test_loss: 0.9687, test_f1: 0.5205
 epoch: 66, train_loss: 0.9207, test_loss: 0.9638, test_f1: 0.5179
 epoch: 67, train_loss: 0.9229, test_loss: 0.9550, test_f1: 0.5123
 epoch: 68, train_loss: 0.9129, test_loss: 0.9529, test_f1: 0.5215
 epoch: 69, train_loss: 0.9158, test_loss: 0.9646, test_f1: 0.5187
 epoch: 70, train_loss: 0.9188, test_loss: 0.9691, test_f1: 0.5155
 epoch: 71, train_loss: 0.9116, test_loss: 0.9684, test_f1: 0.5206
 epoch: 72, train_loss: 0.9068, test_loss: 0.9609, test_f1: 0.5258
 epoch: 73, train_loss: 0.9050, test_loss: 0.9622, test_f1: 0.5235
 epoch: 74, train_loss: 0.9125, test_loss: 0.9639, test_f1: 0.5219
 epoch: 75, train_loss: 0.9123, test_loss: 0.9655, test_f1: 0.5260
 epoch: 76, train_loss: 0.9092, test_loss: 0.9674, test_f1: 0.5249
 epoch: 77, train_loss: 0.9081, test_loss: 0.9686, test_f1: 0.5192
 epoch: 78, train_loss: 0.9016, test_loss: 0.9583, test_f1: 0.5239
 epoch: 79, train_loss: 0.9106, test_loss: 0.9606, test_f1: 0.5247
 epoch: 80, train_loss: 0.9053, test_loss: 0.9651, test_f1: 0.5284
 epoch: 81, train_loss: 0.9034, test_loss: 0.9641, test_f1: 0.5279
 epoch: 82, train_loss: 0.8979, test_loss: 0.9607, test_f1: 0.5237
 epoch: 83, train_loss: 0.9046, test_loss: 0.9667, test_f1: 0.5231
 epoch: 84, train_loss: 0.9018, test_loss: 0.9647, test_f1: 0.5284
 epoch: 85, train_loss: 0.8960, test_loss: 0.9603, test_f1: 0.5263
 epoch: 86, train_loss: 0.9054, test_loss: 0.9640, test_f1: 0.5257
 epoch: 87, train_loss: 0.8949, test_loss: 0.9658, test_f1: 0.5307
 epoch: 88, train_loss: 0.9032, test_loss: 0.9642, test_f1: 0.5289
 epoch: 89, train_loss: 0.9002, test_loss: 0.9628, test_f1: 0.5238
 epoch: 90, train_loss: 0.8913, test_loss: 0.9659, test_f1: 0.5168
 epoch: 91, train_loss: 0.9005, test_loss: 0.9631, test_f1: 0.5261
 epoch: 92, train_loss: 0.8955, test_loss: 0.9695, test_f1: 0.5286
 epoch: 93, train_loss: 0.8940, test_loss: 0.9686, test_f1: 0.5252
 epoch: 94, train_loss: 0.8909, test_loss: 0.9619, test_f1: 0.5306
 epoch: 95, train_loss: 0.8995, test_loss: 0.9658, test_f1: 0.5252
 epoch: 96, train_loss: 0.8978, test_loss: 0.9675, test_f1: 0.5264
 epoch: 97, train_loss: 0.8904, test_loss: 0.9742, test_f1: 0.5241
 epoch: 98, train_loss: 0.8967, test_loss: 0.9699, test_f1: 0.5315
 epoch: 99, train_loss: 0.8990, test_loss: 0.9625, test_f1: 0.5270
##################ITERATION #2 ****************************************
 epoch: 0, train_loss: 1.3210, test_loss: 1.3354, test_f1: 0.2270
 epoch: 1, train_loss: 1.2973, test_loss: 1.3099, test_f1: 0.2270
 epoch: 2, train_loss: 1.2862, test_loss: 1.2842, test_f1: 0.2270
 epoch: 3, train_loss: 1.2727, test_loss: 1.2626, test_f1: 0.2270
 epoch: 4, train_loss: 1.2606, test_loss: 1.2448, test_f1: 0.2270
 epoch: 5, train_loss: 1.2439, test_loss: 1.2286, test_f1: 0.2295
 epoch: 6, train_loss: 1.2325, test_loss: 1.2141, test_f1: 0.2420
 epoch: 7, train_loss: 1.2199, test_loss: 1.1995, test_f1: 0.2499
 epoch: 8, train_loss: 1.2088, test_loss: 1.1841, test_f1: 0.2567
 epoch: 9, train_loss: 1.1919, test_loss: 1.1670, test_f1: 0.2743
 epoch: 10, train_loss: 1.1815, test_loss: 1.1527, test_f1: 0.3125
 epoch: 11, train_loss: 1.1662, test_loss: 1.1348, test_f1: 0.3893
 epoch: 12, train_loss: 1.1481, test_loss: 1.1188, test_f1: 0.4144
 epoch: 13, train_loss: 1.1330, test_loss: 1.1011, test_f1: 0.4107
 epoch: 14, train_loss: 1.1131, test_loss: 1.0832, test_f1: 0.4297
 epoch: 15, train_loss: 1.1002, test_loss: 1.0703, test_f1: 0.4357
 epoch: 16, train_loss: 1.0861, test_loss: 1.0544, test_f1: 0.4394
 epoch: 17, train_loss: 1.0731, test_loss: 1.0406, test_f1: 0.4635
 epoch: 18, train_loss: 1.0583, test_loss: 1.0292, test_f1: 0.4727
 epoch: 19, train_loss: 1.0457, test_loss: 1.0272, test_f1: 0.4474
 epoch: 20, train_loss: 1.0283, test_loss: 1.0136, test_f1: 0.4841
 epoch: 21, train_loss: 1.0276, test_loss: 1.0076, test_f1: 0.4793
 epoch: 22, train_loss: 1.0187, test_loss: 1.0066, test_f1: 0.4707
 epoch: 23, train_loss: 1.0120, test_loss: 1.0067, test_f1: 0.4733
 epoch: 24, train_loss: 1.0040, test_loss: 1.0029, test_f1: 0.4795
 epoch: 25, train_loss: 0.9944, test_loss: 0.9913, test_f1: 0.4924
 epoch: 26, train_loss: 0.9940, test_loss: 0.9957, test_f1: 0.4799
 epoch: 27, train_loss: 0.9790, test_loss: 0.9930, test_f1: 0.4763
 epoch: 28, train_loss: 0.9821, test_loss: 0.9865, test_f1: 0.4988
 epoch: 29, train_loss: 0.9781, test_loss: 0.9885, test_f1: 0.4794
 epoch: 30, train_loss: 0.9743, test_loss: 0.9823, test_f1: 0.4968
 epoch: 31, train_loss: 0.9631, test_loss: 0.9746, test_f1: 0.5022
 epoch: 32, train_loss: 0.9609, test_loss: 0.9788, test_f1: 0.5029
 epoch: 33, train_loss: 0.9583, test_loss: 0.9710, test_f1: 0.4976
 epoch: 34, train_loss: 0.9541, test_loss: 0.9677, test_f1: 0.5021
 epoch: 35, train_loss: 0.9490, test_loss: 0.9685, test_f1: 0.4943
 epoch: 36, train_loss: 0.9559, test_loss: 0.9808, test_f1: 0.4797
 epoch: 37, train_loss: 0.9463, test_loss: 0.9757, test_f1: 0.4914
 epoch: 38, train_loss: 0.9392, test_loss: 0.9664, test_f1: 0.4965
 epoch: 39, train_loss: 0.9358, test_loss: 0.9516, test_f1: 0.5016
 epoch: 40, train_loss: 0.9329, test_loss: 0.9597, test_f1: 0.4946
 epoch: 41, train_loss: 0.9375, test_loss: 0.9532, test_f1: 0.5055
 epoch: 42, train_loss: 0.9248, test_loss: 0.9475, test_f1: 0.4975
 epoch: 43, train_loss: 0.9358, test_loss: 0.9559, test_f1: 0.5017
 epoch: 44, train_loss: 0.9371, test_loss: 0.9502, test_f1: 0.5046
 epoch: 45, train_loss: 0.9215, test_loss: 0.9349, test_f1: 0.5132
 epoch: 46, train_loss: 0.9275, test_loss: 0.9425, test_f1: 0.5008
 epoch: 47, train_loss: 0.9135, test_loss: 0.9577, test_f1: 0.5002
 epoch: 48, train_loss: 0.9243, test_loss: 0.9437, test_f1: 0.5048
 epoch: 49, train_loss: 0.9145, test_loss: 0.9463, test_f1: 0.4977
 epoch: 50, train_loss: 0.9215, test_loss: 0.9665, test_f1: 0.4896
 epoch: 51, train_loss: 0.9105, test_loss: 0.9315, test_f1: 0.5007
 epoch: 52, train_loss: 0.9084, test_loss: 0.9397, test_f1: 0.5073
 epoch: 53, train_loss: 0.9068, test_loss: 0.9523, test_f1: 0.4979
 epoch: 54, train_loss: 0.9072, test_loss: 0.9420, test_f1: 0.5051
 epoch: 55, train_loss: 0.9010, test_loss: 0.9331, test_f1: 0.5018
 epoch: 56, train_loss: 0.9021, test_loss: 0.9304, test_f1: 0.5040
 epoch: 57, train_loss: 0.8959, test_loss: 0.9247, test_f1: 0.5063
 epoch: 58, train_loss: 0.9019, test_loss: 0.9226, test_f1: 0.5051
 epoch: 59, train_loss: 0.8956, test_loss: 0.9322, test_f1: 0.4980
 epoch: 60, train_loss: 0.9030, test_loss: 0.9232, test_f1: 0.5100
 epoch: 61, train_loss: 0.8952, test_loss: 0.9251, test_f1: 0.5120
 epoch: 62, train_loss: 0.9017, test_loss: 0.9340, test_f1: 0.5110
 epoch: 63, train_loss: 0.8934, test_loss: 0.9194, test_f1: 0.5097
 epoch: 64, train_loss: 0.8962, test_loss: 0.9364, test_f1: 0.5048
 epoch: 65, train_loss: 0.9048, test_loss: 0.9252, test_f1: 0.5130
 epoch: 66, train_loss: 0.8935, test_loss: 0.9199, test_f1: 0.5137
 epoch: 67, train_loss: 0.8939, test_loss: 0.9200, test_f1: 0.5198
 epoch: 68, train_loss: 0.8950, test_loss: 0.9193, test_f1: 0.5102
 epoch: 69, train_loss: 0.8949, test_loss: 0.9086, test_f1: 0.5072
 epoch: 70, train_loss: 0.8908, test_loss: 0.9170, test_f1: 0.5090
 epoch: 71, train_loss: 0.8887, test_loss: 0.9110, test_f1: 0.5083
 epoch: 72, train_loss: 0.8852, test_loss: 0.9064, test_f1: 0.5132
 epoch: 73, train_loss: 0.8836, test_loss: 0.9098, test_f1: 0.5112
 epoch: 74, train_loss: 0.8831, test_loss: 0.9054, test_f1: 0.5035
 epoch: 75, train_loss: 0.8850, test_loss: 0.9082, test_f1: 0.5083
 epoch: 76, train_loss: 0.8903, test_loss: 0.9078, test_f1: 0.5104
 epoch: 77, train_loss: 0.8887, test_loss: 0.9172, test_f1: 0.5101
 epoch: 78, train_loss: 0.8867, test_loss: 0.9086, test_f1: 0.5122
 epoch: 79, train_loss: 0.8901, test_loss: 0.9092, test_f1: 0.5028
 epoch: 80, train_loss: 0.8865, test_loss: 0.9070, test_f1: 0.5129
 epoch: 81, train_loss: 0.8852, test_loss: 0.9143, test_f1: 0.5124
 epoch: 82, train_loss: 0.8774, test_loss: 0.9093, test_f1: 0.5201
 epoch: 83, train_loss: 0.8802, test_loss: 0.9112, test_f1: 0.5114
 epoch: 84, train_loss: 0.8728, test_loss: 0.9287, test_f1: 0.5035
 epoch: 85, train_loss: 0.8784, test_loss: 0.9017, test_f1: 0.5084
 epoch: 86, train_loss: 0.8776, test_loss: 0.9021, test_f1: 0.5125
 epoch: 87, train_loss: 0.8720, test_loss: 0.9045, test_f1: 0.5081
 epoch: 88, train_loss: 0.8775, test_loss: 0.9078, test_f1: 0.5130
 epoch: 89, train_loss: 0.8678, test_loss: 0.9105, test_f1: 0.5144
 epoch: 90, train_loss: 0.8810, test_loss: 0.9098, test_f1: 0.5204
 epoch: 91, train_loss: 0.8763, test_loss: 0.9131, test_f1: 0.5130
 epoch: 92, train_loss: 0.8705, test_loss: 0.9034, test_f1: 0.5082
 epoch: 93, train_loss: 0.8710, test_loss: 0.9162, test_f1: 0.5111
 epoch: 94, train_loss: 0.8753, test_loss: 0.9066, test_f1: 0.5108
 epoch: 95, train_loss: 0.8789, test_loss: 0.9132, test_f1: 0.5132
 epoch: 96, train_loss: 0.8699, test_loss: 0.9019, test_f1: 0.5141
 epoch: 97, train_loss: 0.8650, test_loss: 0.9070, test_f1: 0.5071
 epoch: 98, train_loss: 0.8641, test_loss: 0.9083, test_f1: 0.5162
 epoch: 99, train_loss: 0.8662, test_loss: 0.9130, test_f1: 0.5159
##################ITERATION #3 ****************************************
 epoch: 0, train_loss: 1.3061, test_loss: 1.3388, test_f1: 0.2270
 epoch: 1, train_loss: 1.2682, test_loss: 1.3100, test_f1: 0.2270
 epoch: 2, train_loss: 1.2410, test_loss: 1.2508, test_f1: 0.3130
 epoch: 3, train_loss: 1.2186, test_loss: 1.1967, test_f1: 0.3324
 epoch: 4, train_loss: 1.1960, test_loss: 1.1708, test_f1: 0.3510
 epoch: 5, train_loss: 1.1729, test_loss: 1.1492, test_f1: 0.3505
 epoch: 6, train_loss: 1.1490, test_loss: 1.1328, test_f1: 0.3527
 epoch: 7, train_loss: 1.1288, test_loss: 1.1178, test_f1: 0.3475
 epoch: 8, train_loss: 1.1162, test_loss: 1.1042, test_f1: 0.3636
 epoch: 9, train_loss: 1.1019, test_loss: 1.0960, test_f1: 0.3670
 epoch: 10, train_loss: 1.0861, test_loss: 1.0810, test_f1: 0.3938
 epoch: 11, train_loss: 1.0737, test_loss: 1.0764, test_f1: 0.3945
 epoch: 12, train_loss: 1.0612, test_loss: 1.0715, test_f1: 0.3981
 epoch: 13, train_loss: 1.0530, test_loss: 1.0606, test_f1: 0.4215
 epoch: 14, train_loss: 1.0413, test_loss: 1.0524, test_f1: 0.4321
 epoch: 15, train_loss: 1.0313, test_loss: 1.0495, test_f1: 0.4426
 epoch: 16, train_loss: 1.0217, test_loss: 1.0378, test_f1: 0.4528
 epoch: 17, train_loss: 1.0118, test_loss: 1.0464, test_f1: 0.4411
 epoch: 18, train_loss: 1.0059, test_loss: 1.0297, test_f1: 0.4618
 epoch: 19, train_loss: 1.0007, test_loss: 1.0259, test_f1: 0.4673
 epoch: 20, train_loss: 0.9903, test_loss: 1.0206, test_f1: 0.4809
 epoch: 21, train_loss: 0.9859, test_loss: 1.0160, test_f1: 0.4903
 epoch: 22, train_loss: 0.9801, test_loss: 1.0206, test_f1: 0.4975
 epoch: 23, train_loss: 0.9727, test_loss: 1.0052, test_f1: 0.4956
 epoch: 24, train_loss: 0.9700, test_loss: 1.0273, test_f1: 0.4813
 epoch: 25, train_loss: 0.9591, test_loss: 0.9936, test_f1: 0.4874
 epoch: 26, train_loss: 0.9594, test_loss: 0.9875, test_f1: 0.4938
 epoch: 27, train_loss: 0.9461, test_loss: 0.9862, test_f1: 0.4905
 epoch: 28, train_loss: 0.9495, test_loss: 0.9624, test_f1: 0.5022
 epoch: 29, train_loss: 0.9389, test_loss: 0.9868, test_f1: 0.4943
 epoch: 30, train_loss: 0.9412, test_loss: 0.9615, test_f1: 0.5086
 epoch: 31, train_loss: 0.9345, test_loss: 0.9476, test_f1: 0.5007
 epoch: 32, train_loss: 0.9334, test_loss: 0.9470, test_f1: 0.4905
 epoch: 33, train_loss: 0.9320, test_loss: 0.9528, test_f1: 0.4951
 epoch: 34, train_loss: 0.9227, test_loss: 0.9432, test_f1: 0.4985
 epoch: 35, train_loss: 0.9214, test_loss: 0.9628, test_f1: 0.5001
 epoch: 36, train_loss: 0.9089, test_loss: 0.9437, test_f1: 0.5047
 epoch: 37, train_loss: 0.9135, test_loss: 0.9236, test_f1: 0.5001
 epoch: 38, train_loss: 0.9139, test_loss: 0.8998, test_f1: 0.5175
 epoch: 39, train_loss: 0.9117, test_loss: 0.9478, test_f1: 0.5020
 epoch: 40, train_loss: 0.8985, test_loss: 0.9321, test_f1: 0.4941
 epoch: 41, train_loss: 0.8993, test_loss: 0.9561, test_f1: 0.5048
 epoch: 42, train_loss: 0.9044, test_loss: 0.9263, test_f1: 0.4961
 epoch: 43, train_loss: 0.8971, test_loss: 0.9186, test_f1: 0.5123
 epoch: 44, train_loss: 0.8964, test_loss: 0.8956, test_f1: 0.5095
 epoch: 45, train_loss: 0.8988, test_loss: 0.9029, test_f1: 0.5176
 epoch: 46, train_loss: 0.8897, test_loss: 0.9300, test_f1: 0.4961
 epoch: 47, train_loss: 0.8824, test_loss: 0.9105, test_f1: 0.5194
 epoch: 48, train_loss: 0.8795, test_loss: 0.9060, test_f1: 0.5052
 epoch: 49, train_loss: 0.8798, test_loss: 0.9280, test_f1: 0.5022
 epoch: 50, train_loss: 0.8792, test_loss: 0.9307, test_f1: 0.5032
 epoch: 51, train_loss: 0.8796, test_loss: 0.9088, test_f1: 0.5173
 epoch: 52, train_loss: 0.8748, test_loss: 0.9143, test_f1: 0.5111
 epoch: 53, train_loss: 0.8680, test_loss: 0.9078, test_f1: 0.5235
 epoch: 54, train_loss: 0.8687, test_loss: 0.9055, test_f1: 0.5255
 epoch: 55, train_loss: 0.8655, test_loss: 0.9180, test_f1: 0.4995
 epoch: 56, train_loss: 0.8580, test_loss: 0.9007, test_f1: 0.5321
 epoch: 57, train_loss: 0.8594, test_loss: 0.9174, test_f1: 0.5133
 epoch: 58, train_loss: 0.8635, test_loss: 0.9130, test_f1: 0.5119
 epoch: 59, train_loss: 0.8681, test_loss: 0.9120, test_f1: 0.5202
 epoch: 60, train_loss: 0.8547, test_loss: 0.9550, test_f1: 0.5072
 epoch: 61, train_loss: 0.8618, test_loss: 0.9212, test_f1: 0.5086
 epoch: 62, train_loss: 0.8645, test_loss: 0.9069, test_f1: 0.5284
 epoch: 63, train_loss: 0.8592, test_loss: 0.9202, test_f1: 0.5149
 epoch: 64, train_loss: 0.8549, test_loss: 0.9208, test_f1: 0.5075
 epoch: 65, train_loss: 0.8544, test_loss: 0.9421, test_f1: 0.5068
 epoch: 66, train_loss: 0.8600, test_loss: 0.9347, test_f1: 0.5055
 epoch: 67, train_loss: 0.8602, test_loss: 0.9167, test_f1: 0.5126
 epoch: 68, train_loss: 0.8524, test_loss: 0.9119, test_f1: 0.5197
 epoch: 69, train_loss: 0.8534, test_loss: 0.9087, test_f1: 0.5334
 epoch: 70, train_loss: 0.8572, test_loss: 0.9103, test_f1: 0.5258
 epoch: 71, train_loss: 0.8560, test_loss: 0.9256, test_f1: 0.5116
 epoch: 72, train_loss: 0.8424, test_loss: 0.9160, test_f1: 0.5145
 epoch: 73, train_loss: 0.8481, test_loss: 0.9037, test_f1: 0.5283
 epoch: 74, train_loss: 0.8402, test_loss: 0.9338, test_f1: 0.5150
 epoch: 75, train_loss: 0.8414, test_loss: 0.9141, test_f1: 0.5127
 epoch: 76, train_loss: 0.8399, test_loss: 0.9061, test_f1: 0.5210
 epoch: 77, train_loss: 0.8457, test_loss: 0.9105, test_f1: 0.5184
 epoch: 78, train_loss: 0.8420, test_loss: 0.9082, test_f1: 0.5261
 epoch: 79, train_loss: 0.8456, test_loss: 0.9017, test_f1: 0.5254
 epoch: 80, train_loss: 0.8390, test_loss: 0.9121, test_f1: 0.5167
 epoch: 81, train_loss: 0.8444, test_loss: 0.8942, test_f1: 0.5344
 epoch: 82, train_loss: 0.8407, test_loss: 0.9087, test_f1: 0.5273
 epoch: 83, train_loss: 0.8418, test_loss: 0.9059, test_f1: 0.5305
 epoch: 84, train_loss: 0.8362, test_loss: 0.9391, test_f1: 0.5119
 epoch: 85, train_loss: 0.8399, test_loss: 0.9133, test_f1: 0.5218
 epoch: 86, train_loss: 0.8451, test_loss: 0.9086, test_f1: 0.5386
 epoch: 87, train_loss: 0.8342, test_loss: 0.9095, test_f1: 0.5290
 epoch: 88, train_loss: 0.8373, test_loss: 0.8947, test_f1: 0.5289
 epoch: 89, train_loss: 0.8321, test_loss: 0.9157, test_f1: 0.5301
 epoch: 90, train_loss: 0.8383, test_loss: 0.9465, test_f1: 0.5200
 epoch: 91, train_loss: 0.8305, test_loss: 0.9230, test_f1: 0.5240
 epoch: 92, train_loss: 0.8265, test_loss: 0.9075, test_f1: 0.5305
 epoch: 93, train_loss: 0.8226, test_loss: 0.9209, test_f1: 0.5259
 epoch: 94, train_loss: 0.8271, test_loss: 0.9134, test_f1: 0.5376
 epoch: 95, train_loss: 0.8251, test_loss: 0.9010, test_f1: 0.5305
 epoch: 96, train_loss: 0.8200, test_loss: 0.9196, test_f1: 0.5229
 epoch: 97, train_loss: 0.8244, test_loss: 0.9474, test_f1: 0.5339
 epoch: 98, train_loss: 0.8223, test_loss: 0.9127, test_f1: 0.5343
 epoch: 99, train_loss: 0.8241, test_loss: 0.9294, test_f1: 0.5160
##################ITERATION #4 ****************************************
 epoch: 0, train_loss: 1.2827, test_loss: 1.3130, test_f1: 0.2270
 epoch: 1, train_loss: 1.2320, test_loss: 1.2467, test_f1: 0.2295
 epoch: 2, train_loss: 1.2062, test_loss: 1.1912, test_f1: 0.3376
 epoch: 3, train_loss: 1.1787, test_loss: 1.1526, test_f1: 0.3940
 epoch: 4, train_loss: 1.1556, test_loss: 1.1320, test_f1: 0.4037
 epoch: 5, train_loss: 1.1419, test_loss: 1.1149, test_f1: 0.4374
 epoch: 6, train_loss: 1.1243, test_loss: 1.1012, test_f1: 0.4323
 epoch: 7, train_loss: 1.1094, test_loss: 1.0893, test_f1: 0.4186
 epoch: 8, train_loss: 1.0905, test_loss: 1.0818, test_f1: 0.4241
 epoch: 9, train_loss: 1.0850, test_loss: 1.0735, test_f1: 0.4299
 epoch: 10, train_loss: 1.0675, test_loss: 1.0696, test_f1: 0.4274
 epoch: 11, train_loss: 1.0618, test_loss: 1.0622, test_f1: 0.4233
 epoch: 12, train_loss: 1.0506, test_loss: 1.0594, test_f1: 0.4191
 epoch: 13, train_loss: 1.0518, test_loss: 1.0511, test_f1: 0.4409
 epoch: 14, train_loss: 1.0369, test_loss: 1.0541, test_f1: 0.4330
 epoch: 15, train_loss: 1.0318, test_loss: 1.0468, test_f1: 0.4657
 epoch: 16, train_loss: 1.0241, test_loss: 1.0371, test_f1: 0.4412
 epoch: 17, train_loss: 1.0175, test_loss: 1.0282, test_f1: 0.4568
 epoch: 18, train_loss: 1.0123, test_loss: 1.0264, test_f1: 0.4672
 epoch: 19, train_loss: 1.0121, test_loss: 1.0248, test_f1: 0.4592
 epoch: 20, train_loss: 1.0053, test_loss: 1.0218, test_f1: 0.4705
 epoch: 21, train_loss: 1.0011, test_loss: 1.0195, test_f1: 0.4808
 epoch: 22, train_loss: 0.9957, test_loss: 1.0183, test_f1: 0.4747
 epoch: 23, train_loss: 0.9881, test_loss: 1.0100, test_f1: 0.4905
 epoch: 24, train_loss: 0.9866, test_loss: 1.0174, test_f1: 0.4865
 epoch: 25, train_loss: 0.9799, test_loss: 1.0071, test_f1: 0.4849
 epoch: 26, train_loss: 0.9871, test_loss: 1.0081, test_f1: 0.4795
 epoch: 27, train_loss: 0.9797, test_loss: 0.9980, test_f1: 0.4841
 epoch: 28, train_loss: 0.9674, test_loss: 0.9996, test_f1: 0.4873
 epoch: 29, train_loss: 0.9671, test_loss: 1.0025, test_f1: 0.4787
 epoch: 30, train_loss: 0.9623, test_loss: 0.9982, test_f1: 0.4921
 epoch: 31, train_loss: 0.9569, test_loss: 0.9847, test_f1: 0.4931
 epoch: 32, train_loss: 0.9528, test_loss: 0.9775, test_f1: 0.4943
 epoch: 33, train_loss: 0.9489, test_loss: 0.9748, test_f1: 0.5018
 epoch: 34, train_loss: 0.9512, test_loss: 0.9657, test_f1: 0.5016
 epoch: 35, train_loss: 0.9459, test_loss: 0.9973, test_f1: 0.5004
 epoch: 36, train_loss: 0.9495, test_loss: 0.9923, test_f1: 0.4865
 epoch: 37, train_loss: 0.9328, test_loss: 0.9797, test_f1: 0.5022
 epoch: 38, train_loss: 0.9387, test_loss: 0.9739, test_f1: 0.5059
 epoch: 39, train_loss: 0.9339, test_loss: 0.9657, test_f1: 0.5061
 epoch: 40, train_loss: 0.9274, test_loss: 0.9725, test_f1: 0.5061
 epoch: 41, train_loss: 0.9267, test_loss: 0.9636, test_f1: 0.5067
 epoch: 42, train_loss: 0.9250, test_loss: 0.9633, test_f1: 0.5026
 epoch: 43, train_loss: 0.9129, test_loss: 0.9586, test_f1: 0.5097
 epoch: 44, train_loss: 0.9141, test_loss: 0.9579, test_f1: 0.5038
 epoch: 45, train_loss: 0.9057, test_loss: 0.9457, test_f1: 0.5095
 epoch: 46, train_loss: 0.9134, test_loss: 0.9551, test_f1: 0.5121
 epoch: 47, train_loss: 0.9131, test_loss: 0.9473, test_f1: 0.5223
 epoch: 48, train_loss: 0.8992, test_loss: 0.9447, test_f1: 0.5261
 epoch: 49, train_loss: 0.9096, test_loss: 0.9366, test_f1: 0.5220
 epoch: 50, train_loss: 0.9071, test_loss: 0.9378, test_f1: 0.5275
 epoch: 51, train_loss: 0.8982, test_loss: 0.9430, test_f1: 0.5295
 epoch: 52, train_loss: 0.8955, test_loss: 0.9293, test_f1: 0.5275
 epoch: 53, train_loss: 0.8921, test_loss: 0.9342, test_f1: 0.5264
 epoch: 54, train_loss: 0.8878, test_loss: 0.9390, test_f1: 0.5263
 epoch: 55, train_loss: 0.8941, test_loss: 0.9308, test_f1: 0.5311
 epoch: 56, train_loss: 0.8864, test_loss: 0.9261, test_f1: 0.5315
 epoch: 57, train_loss: 0.8950, test_loss: 0.9385, test_f1: 0.5318
 epoch: 58, train_loss: 0.8946, test_loss: 0.9375, test_f1: 0.5274
 epoch: 59, train_loss: 0.8910, test_loss: 0.9263, test_f1: 0.5345
 epoch: 60, train_loss: 0.8886, test_loss: 0.9318, test_f1: 0.5303
 epoch: 61, train_loss: 0.8882, test_loss: 0.9321, test_f1: 0.5349
 epoch: 62, train_loss: 0.8811, test_loss: 0.9297, test_f1: 0.5296
 epoch: 63, train_loss: 0.8831, test_loss: 0.9326, test_f1: 0.5193
 epoch: 64, train_loss: 0.8897, test_loss: 0.9380, test_f1: 0.5329
 epoch: 65, train_loss: 0.8827, test_loss: 0.9273, test_f1: 0.5345
 epoch: 66, train_loss: 0.8797, test_loss: 0.9268, test_f1: 0.5281
 epoch: 67, train_loss: 0.8815, test_loss: 0.9299, test_f1: 0.5313
 epoch: 68, train_loss: 0.8788, test_loss: 0.9292, test_f1: 0.5348
 epoch: 69, train_loss: 0.8710, test_loss: 0.9309, test_f1: 0.5336
 epoch: 70, train_loss: 0.8817, test_loss: 0.9243, test_f1: 0.5275
 epoch: 71, train_loss: 0.8671, test_loss: 0.9238, test_f1: 0.5340
 epoch: 72, train_loss: 0.8772, test_loss: 0.9220, test_f1: 0.5284
 epoch: 73, train_loss: 0.8783, test_loss: 0.9143, test_f1: 0.5316
 epoch: 74, train_loss: 0.8737, test_loss: 0.9216, test_f1: 0.5266
 epoch: 75, train_loss: 0.8707, test_loss: 0.9148, test_f1: 0.5260
 epoch: 76, train_loss: 0.8652, test_loss: 0.9083, test_f1: 0.5288
 epoch: 77, train_loss: 0.8699, test_loss: 0.9033, test_f1: 0.5342
 epoch: 78, train_loss: 0.8722, test_loss: 0.9129, test_f1: 0.5290
 epoch: 79, train_loss: 0.8611, test_loss: 0.9086, test_f1: 0.5375
 epoch: 80, train_loss: 0.8700, test_loss: 0.9067, test_f1: 0.5315
 epoch: 81, train_loss: 0.8680, test_loss: 0.9176, test_f1: 0.5388
 epoch: 82, train_loss: 0.8675, test_loss: 0.9256, test_f1: 0.5311
 epoch: 83, train_loss: 0.8707, test_loss: 0.9251, test_f1: 0.5337
 epoch: 84, train_loss: 0.8583, test_loss: 0.9179, test_f1: 0.5323
 epoch: 85, train_loss: 0.8701, test_loss: 0.9195, test_f1: 0.5325
 epoch: 86, train_loss: 0.8546, test_loss: 0.9092, test_f1: 0.5378
 epoch: 87, train_loss: 0.8647, test_loss: 0.9135, test_f1: 0.5301
 epoch: 88, train_loss: 0.8671, test_loss: 0.9098, test_f1: 0.5285
 epoch: 89, train_loss: 0.8633, test_loss: 0.9045, test_f1: 0.5321
 epoch: 90, train_loss: 0.8557, test_loss: 0.9191, test_f1: 0.5376
 epoch: 91, train_loss: 0.8531, test_loss: 0.9162, test_f1: 0.5342
 epoch: 92, train_loss: 0.8618, test_loss: 0.9163, test_f1: 0.5301
 epoch: 93, train_loss: 0.8581, test_loss: 0.9172, test_f1: 0.5308
 epoch: 94, train_loss: 0.8543, test_loss: 0.8998, test_f1: 0.5365
 epoch: 95, train_loss: 0.8526, test_loss: 0.9236, test_f1: 0.5330
 epoch: 96, train_loss: 0.8546, test_loss: 0.9128, test_f1: 0.5304
 epoch: 97, train_loss: 0.8493, test_loss: 0.9017, test_f1: 0.5369
 epoch: 98, train_loss: 0.8517, test_loss: 0.9091, test_f1: 0.5262
 epoch: 99, train_loss: 0.8529, test_loss: 0.9084, test_f1: 0.5304
##################ITERATION #5 ****************************************
 epoch: 0, train_loss: 1.2454, test_loss: 1.3658, test_f1: 0.2270
 epoch: 1, train_loss: 1.1797, test_loss: 1.2661, test_f1: 0.3152
 epoch: 2, train_loss: 1.1516, test_loss: 1.1318, test_f1: 0.3407
 epoch: 3, train_loss: 1.1294, test_loss: 1.0895, test_f1: 0.3445
 epoch: 4, train_loss: 1.1172, test_loss: 1.0763, test_f1: 0.3526
 epoch: 5, train_loss: 1.0943, test_loss: 1.0651, test_f1: 0.3575
 epoch: 6, train_loss: 1.0807, test_loss: 1.0577, test_f1: 0.3632
 epoch: 7, train_loss: 1.0705, test_loss: 1.0445, test_f1: 0.3669
 epoch: 8, train_loss: 1.0602, test_loss: 1.0502, test_f1: 0.3726
 epoch: 9, train_loss: 1.0527, test_loss: 1.0395, test_f1: 0.3954
 epoch: 10, train_loss: 1.0383, test_loss: 1.0345, test_f1: 0.4066
 epoch: 11, train_loss: 1.0272, test_loss: 1.0259, test_f1: 0.4358
 epoch: 12, train_loss: 1.0302, test_loss: 1.0183, test_f1: 0.4391
 epoch: 13, train_loss: 1.0136, test_loss: 1.0243, test_f1: 0.4516
 epoch: 14, train_loss: 1.0122, test_loss: 1.0104, test_f1: 0.4778
 epoch: 15, train_loss: 0.9978, test_loss: 1.0006, test_f1: 0.4781
 epoch: 16, train_loss: 0.9977, test_loss: 1.0030, test_f1: 0.4818
 epoch: 17, train_loss: 0.9874, test_loss: 0.9910, test_f1: 0.4858
 epoch: 18, train_loss: 0.9829, test_loss: 0.9860, test_f1: 0.4797
 epoch: 19, train_loss: 0.9788, test_loss: 0.9844, test_f1: 0.4906
 epoch: 20, train_loss: 0.9683, test_loss: 0.9654, test_f1: 0.4912
 epoch: 21, train_loss: 0.9597, test_loss: 0.9620, test_f1: 0.5007
 epoch: 22, train_loss: 0.9578, test_loss: 0.9868, test_f1: 0.4921
 epoch: 23, train_loss: 0.9549, test_loss: 0.9488, test_f1: 0.4968
 epoch: 24, train_loss: 0.9613, test_loss: 0.9776, test_f1: 0.4998
 epoch: 25, train_loss: 0.9445, test_loss: 0.9578, test_f1: 0.5054
 epoch: 26, train_loss: 0.9438, test_loss: 0.9441, test_f1: 0.5093
 epoch: 27, train_loss: 0.9329, test_loss: 0.9584, test_f1: 0.5071
 epoch: 28, train_loss: 0.9214, test_loss: 0.9425, test_f1: 0.5040
 epoch: 29, train_loss: 0.9293, test_loss: 0.9402, test_f1: 0.5037
 epoch: 30, train_loss: 0.9214, test_loss: 0.9379, test_f1: 0.5056
 epoch: 31, train_loss: 0.9178, test_loss: 0.9317, test_f1: 0.5023
 epoch: 32, train_loss: 0.9068, test_loss: 0.9466, test_f1: 0.5051
 epoch: 33, train_loss: 0.9047, test_loss: 0.9412, test_f1: 0.5077
 epoch: 34, train_loss: 0.9073, test_loss: 0.9701, test_f1: 0.5126
 epoch: 35, train_loss: 0.9154, test_loss: 0.9408, test_f1: 0.5152
 epoch: 36, train_loss: 0.9006, test_loss: 0.9691, test_f1: 0.5159
 epoch: 37, train_loss: 0.8953, test_loss: 0.9337, test_f1: 0.5296
 epoch: 38, train_loss: 0.8949, test_loss: 0.9322, test_f1: 0.5256
 epoch: 39, train_loss: 0.8933, test_loss: 0.9527, test_f1: 0.5333
 epoch: 40, train_loss: 0.8868, test_loss: 0.9238, test_f1: 0.5379
 epoch: 41, train_loss: 0.8866, test_loss: 0.9494, test_f1: 0.5305
 epoch: 42, train_loss: 0.8786, test_loss: 0.9338, test_f1: 0.5342
 epoch: 43, train_loss: 0.8795, test_loss: 0.9341, test_f1: 0.5354
 epoch: 44, train_loss: 0.8754, test_loss: 0.9393, test_f1: 0.5392
 epoch: 45, train_loss: 0.8737, test_loss: 0.9232, test_f1: 0.5359
 epoch: 46, train_loss: 0.8768, test_loss: 0.9296, test_f1: 0.5324
 epoch: 47, train_loss: 0.8730, test_loss: 0.9308, test_f1: 0.5323
 epoch: 48, train_loss: 0.8658, test_loss: 0.9394, test_f1: 0.5325
 epoch: 49, train_loss: 0.8670, test_loss: 0.9572, test_f1: 0.5398
 epoch: 50, train_loss: 0.8636, test_loss: 0.9205, test_f1: 0.5434
 epoch: 51, train_loss: 0.8558, test_loss: 0.9321, test_f1: 0.5362
 epoch: 52, train_loss: 0.8506, test_loss: 0.9301, test_f1: 0.5356
 epoch: 53, train_loss: 0.8525, test_loss: 0.9325, test_f1: 0.5441
 epoch: 54, train_loss: 0.8575, test_loss: 0.9262, test_f1: 0.5399
 epoch: 55, train_loss: 0.8520, test_loss: 0.9241, test_f1: 0.5401
 epoch: 56, train_loss: 0.8484, test_loss: 0.9333, test_f1: 0.5375
 epoch: 57, train_loss: 0.8515, test_loss: 0.9324, test_f1: 0.5431
 epoch: 58, train_loss: 0.8427, test_loss: 0.9338, test_f1: 0.5450
 epoch: 59, train_loss: 0.8529, test_loss: 0.9410, test_f1: 0.5414
 epoch: 60, train_loss: 0.8533, test_loss: 0.9294, test_f1: 0.5420
 epoch: 61, train_loss: 0.8430, test_loss: 0.9483, test_f1: 0.5515
 epoch: 62, train_loss: 0.8372, test_loss: 0.9346, test_f1: 0.5475
 epoch: 63, train_loss: 0.8436, test_loss: 0.9429, test_f1: 0.5466
 epoch: 64, train_loss: 0.8420, test_loss: 0.9360, test_f1: 0.5479
 epoch: 65, train_loss: 0.8370, test_loss: 0.9351, test_f1: 0.5444
 epoch: 66, train_loss: 0.8374, test_loss: 0.9355, test_f1: 0.5494
 epoch: 67, train_loss: 0.8345, test_loss: 0.9191, test_f1: 0.5490
 epoch: 68, train_loss: 0.8401, test_loss: 0.9235, test_f1: 0.5484
 epoch: 69, train_loss: 0.8362, test_loss: 0.9333, test_f1: 0.5498
 epoch: 70, train_loss: 0.8381, test_loss: 0.9252, test_f1: 0.5456
 epoch: 71, train_loss: 0.8278, test_loss: 0.9228, test_f1: 0.5522
 epoch: 72, train_loss: 0.8236, test_loss: 0.9250, test_f1: 0.5491
 epoch: 73, train_loss: 0.8314, test_loss: 0.9171, test_f1: 0.5459
 epoch: 74, train_loss: 0.8383, test_loss: 0.9169, test_f1: 0.5473
 epoch: 75, train_loss: 0.8299, test_loss: 0.9347, test_f1: 0.5497
 epoch: 76, train_loss: 0.8306, test_loss: 0.9295, test_f1: 0.5433
 epoch: 77, train_loss: 0.8291, test_loss: 0.9312, test_f1: 0.5529
 epoch: 78, train_loss: 0.8166, test_loss: 0.9187, test_f1: 0.5508
 epoch: 79, train_loss: 0.8284, test_loss: 0.9222, test_f1: 0.5495
 epoch: 80, train_loss: 0.8244, test_loss: 0.9330, test_f1: 0.5554
 epoch: 81, train_loss: 0.8171, test_loss: 0.9269, test_f1: 0.5431
 epoch: 82, train_loss: 0.8211, test_loss: 0.9298, test_f1: 0.5478
 epoch: 83, train_loss: 0.8246, test_loss: 0.9234, test_f1: 0.5525
 epoch: 84, train_loss: 0.8312, test_loss: 0.9314, test_f1: 0.5442
 epoch: 85, train_loss: 0.8217, test_loss: 0.9320, test_f1: 0.5417
 epoch: 86, train_loss: 0.8123, test_loss: 0.9210, test_f1: 0.5548
 epoch: 87, train_loss: 0.8184, test_loss: 0.9234, test_f1: 0.5469
 epoch: 88, train_loss: 0.8139, test_loss: 0.9277, test_f1: 0.5558
 epoch: 89, train_loss: 0.8143, test_loss: 0.9230, test_f1: 0.5526
 epoch: 90, train_loss: 0.8123, test_loss: 0.9339, test_f1: 0.5577
 epoch: 91, train_loss: 0.8221, test_loss: 0.9285, test_f1: 0.5438
 epoch: 92, train_loss: 0.8090, test_loss: 0.9292, test_f1: 0.5466
 epoch: 93, train_loss: 0.8062, test_loss: 0.9143, test_f1: 0.5561
 epoch: 94, train_loss: 0.8071, test_loss: 0.9184, test_f1: 0.5485
 epoch: 95, train_loss: 0.8060, test_loss: 0.9372, test_f1: 0.5541
 epoch: 96, train_loss: 0.8042, test_loss: 0.9139, test_f1: 0.5489
 epoch: 97, train_loss: 0.8032, test_loss: 0.9231, test_f1: 0.5568
 epoch: 98, train_loss: 0.8007, test_loss: 0.9241, test_f1: 0.5492
 epoch: 99, train_loss: 0.8105, test_loss: 0.9171, test_f1: 0.5482
##################ITERATION #6 ****************************************
 epoch: 0, train_loss: 1.3048, test_loss: 1.3543, test_f1: 0.2270
 epoch: 1, train_loss: 1.2327, test_loss: 1.2300, test_f1: 0.3210
 epoch: 2, train_loss: 1.1949, test_loss: 1.1641, test_f1: 0.3507
 epoch: 3, train_loss: 1.1742, test_loss: 1.1299, test_f1: 0.3457
 epoch: 4, train_loss: 1.1416, test_loss: 1.1100, test_f1: 0.3622
 epoch: 5, train_loss: 1.1213, test_loss: 1.0907, test_f1: 0.3892
 epoch: 6, train_loss: 1.1078, test_loss: 1.0746, test_f1: 0.4162
 epoch: 7, train_loss: 1.0945, test_loss: 1.0636, test_f1: 0.4376
 epoch: 8, train_loss: 1.0726, test_loss: 1.0555, test_f1: 0.4377
 epoch: 9, train_loss: 1.0602, test_loss: 1.0555, test_f1: 0.4571
 epoch: 10, train_loss: 1.0585, test_loss: 1.0399, test_f1: 0.4522
 epoch: 11, train_loss: 1.0453, test_loss: 1.0399, test_f1: 0.4554
 epoch: 12, train_loss: 1.0362, test_loss: 1.0404, test_f1: 0.4640
 epoch: 13, train_loss: 1.0346, test_loss: 1.0206, test_f1: 0.4620
 epoch: 14, train_loss: 1.0189, test_loss: 1.0150, test_f1: 0.4693
 epoch: 15, train_loss: 1.0122, test_loss: 1.0061, test_f1: 0.4716
 epoch: 16, train_loss: 1.0097, test_loss: 1.0046, test_f1: 0.4755
 epoch: 17, train_loss: 1.0053, test_loss: 1.0203, test_f1: 0.4787
 epoch: 18, train_loss: 0.9866, test_loss: 1.0164, test_f1: 0.4681
 epoch: 19, train_loss: 0.9960, test_loss: 1.0087, test_f1: 0.4756
 epoch: 20, train_loss: 0.9915, test_loss: 0.9982, test_f1: 0.4640
 epoch: 21, train_loss: 0.9754, test_loss: 1.0097, test_f1: 0.4677
 epoch: 22, train_loss: 0.9777, test_loss: 0.9816, test_f1: 0.4904
 epoch: 23, train_loss: 0.9789, test_loss: 0.9886, test_f1: 0.4888
 epoch: 24, train_loss: 0.9704, test_loss: 0.9861, test_f1: 0.4685
 epoch: 25, train_loss: 0.9609, test_loss: 0.9849, test_f1: 0.4858
 epoch: 26, train_loss: 0.9566, test_loss: 0.9982, test_f1: 0.4877
 epoch: 27, train_loss: 0.9565, test_loss: 0.9903, test_f1: 0.4810
 epoch: 28, train_loss: 0.9462, test_loss: 0.9895, test_f1: 0.4943
 epoch: 29, train_loss: 0.9570, test_loss: 0.9876, test_f1: 0.5022
 epoch: 30, train_loss: 0.9470, test_loss: 0.9781, test_f1: 0.5062
 epoch: 31, train_loss: 0.9403, test_loss: 0.9780, test_f1: 0.5132
 epoch: 32, train_loss: 0.9468, test_loss: 0.9752, test_f1: 0.5081
 epoch: 33, train_loss: 0.9395, test_loss: 0.9659, test_f1: 0.5033
 epoch: 34, train_loss: 0.9428, test_loss: 0.9765, test_f1: 0.5040
 epoch: 35, train_loss: 0.9320, test_loss: 0.9782, test_f1: 0.4995
 epoch: 36, train_loss: 0.9333, test_loss: 0.9836, test_f1: 0.5021
 epoch: 37, train_loss: 0.9194, test_loss: 0.9637, test_f1: 0.5136
 epoch: 38, train_loss: 0.9298, test_loss: 0.9723, test_f1: 0.5180
 epoch: 39, train_loss: 0.9190, test_loss: 0.9666, test_f1: 0.5165
 epoch: 40, train_loss: 0.9142, test_loss: 0.9695, test_f1: 0.5201
 epoch: 41, train_loss: 0.9156, test_loss: 0.9427, test_f1: 0.5236
 epoch: 42, train_loss: 0.9066, test_loss: 0.9547, test_f1: 0.5271
 epoch: 43, train_loss: 0.9070, test_loss: 0.9578, test_f1: 0.5177
 epoch: 44, train_loss: 0.9051, test_loss: 0.9607, test_f1: 0.5191
 epoch: 45, train_loss: 0.9043, test_loss: 0.9682, test_f1: 0.5180
 epoch: 46, train_loss: 0.8989, test_loss: 0.9535, test_f1: 0.5301
 epoch: 47, train_loss: 0.9025, test_loss: 0.9708, test_f1: 0.5220
 epoch: 48, train_loss: 0.8982, test_loss: 0.9529, test_f1: 0.5175
 epoch: 49, train_loss: 0.9034, test_loss: 0.9498, test_f1: 0.5310
 epoch: 50, train_loss: 0.8971, test_loss: 0.9441, test_f1: 0.5245
 epoch: 51, train_loss: 0.8785, test_loss: 0.9447, test_f1: 0.5260
 epoch: 52, train_loss: 0.8871, test_loss: 0.9383, test_f1: 0.5296
 epoch: 53, train_loss: 0.8775, test_loss: 0.9403, test_f1: 0.5299
 epoch: 54, train_loss: 0.8773, test_loss: 0.9469, test_f1: 0.5334
 epoch: 55, train_loss: 0.8849, test_loss: 0.9570, test_f1: 0.5321
 epoch: 56, train_loss: 0.8771, test_loss: 0.9530, test_f1: 0.5302
 epoch: 57, train_loss: 0.8762, test_loss: 0.9590, test_f1: 0.5358
 epoch: 58, train_loss: 0.8691, test_loss: 0.9416, test_f1: 0.5321
 epoch: 59, train_loss: 0.8802, test_loss: 0.9438, test_f1: 0.5336
 epoch: 60, train_loss: 0.8701, test_loss: 0.9397, test_f1: 0.5382
 epoch: 61, train_loss: 0.8718, test_loss: 0.9214, test_f1: 0.5339
 epoch: 62, train_loss: 0.8713, test_loss: 0.9465, test_f1: 0.5377
 epoch: 63, train_loss: 0.8736, test_loss: 0.9435, test_f1: 0.5325
 epoch: 64, train_loss: 0.8718, test_loss: 0.9466, test_f1: 0.5361
 epoch: 65, train_loss: 0.8742, test_loss: 0.9608, test_f1: 0.5299
 epoch: 66, train_loss: 0.8644, test_loss: 0.9551, test_f1: 0.5397
 epoch: 67, train_loss: 0.8689, test_loss: 0.9561, test_f1: 0.5331
 epoch: 68, train_loss: 0.8656, test_loss: 0.9591, test_f1: 0.5358
 epoch: 69, train_loss: 0.8702, test_loss: 0.9526, test_f1: 0.5331
 epoch: 70, train_loss: 0.8610, test_loss: 0.9572, test_f1: 0.5315
 epoch: 71, train_loss: 0.8645, test_loss: 0.9451, test_f1: 0.5363
 epoch: 72, train_loss: 0.8583, test_loss: 0.9411, test_f1: 0.5361
 epoch: 73, train_loss: 0.8511, test_loss: 0.9508, test_f1: 0.5379
 epoch: 74, train_loss: 0.8586, test_loss: 0.9454, test_f1: 0.5364
 epoch: 75, train_loss: 0.8556, test_loss: 0.9289, test_f1: 0.5381
 epoch: 76, train_loss: 0.8596, test_loss: 0.9384, test_f1: 0.5397
 epoch: 77, train_loss: 0.8540, test_loss: 0.9470, test_f1: 0.5307
 epoch: 78, train_loss: 0.8594, test_loss: 0.9276, test_f1: 0.5422
 epoch: 79, train_loss: 0.8545, test_loss: 0.9284, test_f1: 0.5342
 epoch: 80, train_loss: 0.8508, test_loss: 0.9427, test_f1: 0.5337
 epoch: 81, train_loss: 0.8443, test_loss: 0.9430, test_f1: 0.5364
 epoch: 82, train_loss: 0.8566, test_loss: 0.9353, test_f1: 0.5363
 epoch: 83, train_loss: 0.8401, test_loss: 0.9375, test_f1: 0.5363
 epoch: 84, train_loss: 0.8499, test_loss: 0.9393, test_f1: 0.5463
 epoch: 85, train_loss: 0.8538, test_loss: 0.9264, test_f1: 0.5402
 epoch: 86, train_loss: 0.8433, test_loss: 0.9306, test_f1: 0.5446
 epoch: 87, train_loss: 0.8451, test_loss: 0.9396, test_f1: 0.5455
 epoch: 88, train_loss: 0.8449, test_loss: 0.9348, test_f1: 0.5394
 epoch: 89, train_loss: 0.8440, test_loss: 0.9353, test_f1: 0.5352
 epoch: 90, train_loss: 0.8500, test_loss: 0.9386, test_f1: 0.5361
 epoch: 91, train_loss: 0.8343, test_loss: 0.9359, test_f1: 0.5431
 epoch: 92, train_loss: 0.8410, test_loss: 0.9425, test_f1: 0.5396
 epoch: 93, train_loss: 0.8377, test_loss: 0.9371, test_f1: 0.5436
 epoch: 94, train_loss: 0.8472, test_loss: 0.9373, test_f1: 0.5433
 epoch: 95, train_loss: 0.8415, test_loss: 0.9438, test_f1: 0.5406
 epoch: 96, train_loss: 0.8244, test_loss: 0.9503, test_f1: 0.5349
 epoch: 97, train_loss: 0.8350, test_loss: 0.9306, test_f1: 0.5413
 epoch: 98, train_loss: 0.8302, test_loss: 0.9385, test_f1: 0.5438
 epoch: 99, train_loss: 0.8353, test_loss: 0.9411, test_f1: 0.5445
##################ITERATION #7 ****************************************
 epoch: 0, train_loss: 1.2808, test_loss: 1.3174, test_f1: 0.2270
 epoch: 1, train_loss: 1.1917, test_loss: 1.2565, test_f1: 0.2320
 epoch: 2, train_loss: 1.1618, test_loss: 1.1360, test_f1: 0.3513
 epoch: 3, train_loss: 1.1416, test_loss: 1.1011, test_f1: 0.3569
 epoch: 4, train_loss: 1.1171, test_loss: 1.0867, test_f1: 0.3655
 epoch: 5, train_loss: 1.1020, test_loss: 1.0698, test_f1: 0.3842
 epoch: 6, train_loss: 1.0769, test_loss: 1.0574, test_f1: 0.4068
 epoch: 7, train_loss: 1.0710, test_loss: 1.0519, test_f1: 0.4199
 epoch: 8, train_loss: 1.0526, test_loss: 1.0482, test_f1: 0.4180
 epoch: 9, train_loss: 1.0448, test_loss: 1.0391, test_f1: 0.4251
 epoch: 10, train_loss: 1.0397, test_loss: 1.0407, test_f1: 0.4307
 epoch: 11, train_loss: 1.0330, test_loss: 1.0393, test_f1: 0.4296
 epoch: 12, train_loss: 1.0226, test_loss: 1.0336, test_f1: 0.4432
 epoch: 13, train_loss: 1.0153, test_loss: 1.0250, test_f1: 0.4654
 epoch: 14, train_loss: 1.0040, test_loss: 1.0208, test_f1: 0.4656
 epoch: 15, train_loss: 1.0027, test_loss: 1.0175, test_f1: 0.4668
 epoch: 16, train_loss: 0.9997, test_loss: 1.0085, test_f1: 0.4696
 epoch: 17, train_loss: 0.9923, test_loss: 1.0070, test_f1: 0.4666
 epoch: 18, train_loss: 0.9892, test_loss: 1.0053, test_f1: 0.4669
 epoch: 19, train_loss: 0.9746, test_loss: 0.9932, test_f1: 0.4789
 epoch: 20, train_loss: 0.9785, test_loss: 0.9972, test_f1: 0.4717
 epoch: 21, train_loss: 0.9745, test_loss: 0.9995, test_f1: 0.4733
 epoch: 22, train_loss: 0.9693, test_loss: 0.9944, test_f1: 0.4799
 epoch: 23, train_loss: 0.9686, test_loss: 0.9917, test_f1: 0.4834
 epoch: 24, train_loss: 0.9618, test_loss: 0.9897, test_f1: 0.4868
 epoch: 25, train_loss: 0.9493, test_loss: 0.9826, test_f1: 0.4893
 epoch: 26, train_loss: 0.9538, test_loss: 0.9836, test_f1: 0.4839
 epoch: 27, train_loss: 0.9458, test_loss: 0.9844, test_f1: 0.4823
 epoch: 28, train_loss: 0.9407, test_loss: 0.9821, test_f1: 0.4856
 epoch: 29, train_loss: 0.9347, test_loss: 0.9753, test_f1: 0.5060
 epoch: 30, train_loss: 0.9381, test_loss: 0.9638, test_f1: 0.4911
 epoch: 31, train_loss: 0.9278, test_loss: 0.9784, test_f1: 0.4922
 epoch: 32, train_loss: 0.9281, test_loss: 0.9679, test_f1: 0.5036
 epoch: 33, train_loss: 0.9282, test_loss: 0.9653, test_f1: 0.5073
 epoch: 34, train_loss: 0.9255, test_loss: 0.9602, test_f1: 0.5113
 epoch: 35, train_loss: 0.9162, test_loss: 0.9608, test_f1: 0.5146
 epoch: 36, train_loss: 0.9164, test_loss: 0.9639, test_f1: 0.5140
 epoch: 37, train_loss: 0.9159, test_loss: 0.9772, test_f1: 0.5017
 epoch: 38, train_loss: 0.9159, test_loss: 0.9561, test_f1: 0.5133
 epoch: 39, train_loss: 0.9009, test_loss: 0.9591, test_f1: 0.5261
 epoch: 40, train_loss: 0.9095, test_loss: 0.9634, test_f1: 0.5152
 epoch: 41, train_loss: 0.9007, test_loss: 0.9486, test_f1: 0.5272
 epoch: 42, train_loss: 0.8994, test_loss: 0.9424, test_f1: 0.5172
 epoch: 43, train_loss: 0.8946, test_loss: 0.9503, test_f1: 0.5105
 epoch: 44, train_loss: 0.8923, test_loss: 0.9482, test_f1: 0.5157
 epoch: 45, train_loss: 0.8889, test_loss: 0.9384, test_f1: 0.5216
 epoch: 46, train_loss: 0.8850, test_loss: 0.9365, test_f1: 0.5228
 epoch: 47, train_loss: 0.8853, test_loss: 0.9240, test_f1: 0.5209
 epoch: 48, train_loss: 0.8816, test_loss: 0.9302, test_f1: 0.5173
 epoch: 49, train_loss: 0.8687, test_loss: 0.9370, test_f1: 0.5223
 epoch: 50, train_loss: 0.8732, test_loss: 0.9285, test_f1: 0.5136
 epoch: 51, train_loss: 0.8717, test_loss: 0.9232, test_f1: 0.5283
 epoch: 52, train_loss: 0.8770, test_loss: 0.9174, test_f1: 0.5331
 epoch: 53, train_loss: 0.8642, test_loss: 0.9240, test_f1: 0.5209
 epoch: 54, train_loss: 0.8579, test_loss: 0.9160, test_f1: 0.5194
 epoch: 55, train_loss: 0.8633, test_loss: 0.9187, test_f1: 0.5378
 epoch: 56, train_loss: 0.8609, test_loss: 0.9149, test_f1: 0.5234
 epoch: 57, train_loss: 0.8558, test_loss: 0.9141, test_f1: 0.5183
 epoch: 58, train_loss: 0.8654, test_loss: 0.9146, test_f1: 0.5323
 epoch: 59, train_loss: 0.8554, test_loss: 0.9061, test_f1: 0.5278
 epoch: 60, train_loss: 0.8739, test_loss: 0.9138, test_f1: 0.5219
 epoch: 61, train_loss: 0.8647, test_loss: 0.9010, test_f1: 0.5235
 epoch: 62, train_loss: 0.8527, test_loss: 0.8996, test_f1: 0.5275
 epoch: 63, train_loss: 0.8600, test_loss: 0.8918, test_f1: 0.5293
 epoch: 64, train_loss: 0.8579, test_loss: 0.9024, test_f1: 0.5235
 epoch: 65, train_loss: 0.8548, test_loss: 0.8986, test_f1: 0.5250
 epoch: 66, train_loss: 0.8480, test_loss: 0.9052, test_f1: 0.5290
 epoch: 67, train_loss: 0.8450, test_loss: 0.8963, test_f1: 0.5279
 epoch: 68, train_loss: 0.8539, test_loss: 0.8971, test_f1: 0.5375
 epoch: 69, train_loss: 0.8481, test_loss: 0.8987, test_f1: 0.5249
 epoch: 70, train_loss: 0.8464, test_loss: 0.8928, test_f1: 0.5268
 epoch: 71, train_loss: 0.8466, test_loss: 0.8936, test_f1: 0.5376
 epoch: 72, train_loss: 0.8480, test_loss: 0.8967, test_f1: 0.5399
 epoch: 73, train_loss: 0.8481, test_loss: 0.8876, test_f1: 0.5215
 epoch: 74, train_loss: 0.8469, test_loss: 0.8861, test_f1: 0.5369
 epoch: 75, train_loss: 0.8460, test_loss: 0.8881, test_f1: 0.5382
 epoch: 76, train_loss: 0.8427, test_loss: 0.8871, test_f1: 0.5297
 epoch: 77, train_loss: 0.8402, test_loss: 0.8838, test_f1: 0.5295
 epoch: 78, train_loss: 0.8416, test_loss: 0.8796, test_f1: 0.5378
 epoch: 79, train_loss: 0.8372, test_loss: 0.8854, test_f1: 0.5348
 epoch: 80, train_loss: 0.8331, test_loss: 0.8843, test_f1: 0.5360
 epoch: 81, train_loss: 0.8364, test_loss: 0.8862, test_f1: 0.5420
 epoch: 82, train_loss: 0.8366, test_loss: 0.8778, test_f1: 0.5353
 epoch: 83, train_loss: 0.8321, test_loss: 0.8821, test_f1: 0.5377
 epoch: 84, train_loss: 0.8415, test_loss: 0.8753, test_f1: 0.5464
 epoch: 85, train_loss: 0.8364, test_loss: 0.8755, test_f1: 0.5365
 epoch: 86, train_loss: 0.8370, test_loss: 0.8746, test_f1: 0.5397
 epoch: 87, train_loss: 0.8248, test_loss: 0.8659, test_f1: 0.5397
 epoch: 88, train_loss: 0.8290, test_loss: 0.8831, test_f1: 0.5374
 epoch: 89, train_loss: 0.8321, test_loss: 0.8718, test_f1: 0.5377
 epoch: 90, train_loss: 0.8339, test_loss: 0.8675, test_f1: 0.5450
 epoch: 91, train_loss: 0.8335, test_loss: 0.8741, test_f1: 0.5504
 epoch: 92, train_loss: 0.8220, test_loss: 0.8760, test_f1: 0.5330
 epoch: 93, train_loss: 0.8322, test_loss: 0.8665, test_f1: 0.5443
 epoch: 94, train_loss: 0.8279, test_loss: 0.8680, test_f1: 0.5322
 epoch: 95, train_loss: 0.8271, test_loss: 0.8787, test_f1: 0.5367
 epoch: 96, train_loss: 0.8216, test_loss: 0.8773, test_f1: 0.5325
 epoch: 97, train_loss: 0.8274, test_loss: 0.8756, test_f1: 0.5327
 epoch: 98, train_loss: 0.8185, test_loss: 0.8630, test_f1: 0.5467
 epoch: 99, train_loss: 0.8218, test_loss: 0.8711, test_f1: 0.5437
##################ITERATION #8 ****************************************
 epoch: 0, train_loss: 1.3650, test_loss: 1.3545, test_f1: 0.2270
 epoch: 1, train_loss: 1.2486, test_loss: 1.2609, test_f1: 0.2270
 epoch: 2, train_loss: 1.2113, test_loss: 1.1610, test_f1: 0.3612
 epoch: 3, train_loss: 1.1728, test_loss: 1.1193, test_f1: 0.3846
 epoch: 4, train_loss: 1.1481, test_loss: 1.0967, test_f1: 0.3806
 epoch: 5, train_loss: 1.1298, test_loss: 1.0776, test_f1: 0.4044
 epoch: 6, train_loss: 1.1121, test_loss: 1.0637, test_f1: 0.4008
 epoch: 7, train_loss: 1.0890, test_loss: 1.0529, test_f1: 0.4279
 epoch: 8, train_loss: 1.0794, test_loss: 1.0381, test_f1: 0.4476
 epoch: 9, train_loss: 1.0590, test_loss: 1.0341, test_f1: 0.4500
 epoch: 10, train_loss: 1.0488, test_loss: 1.0294, test_f1: 0.4527
 epoch: 11, train_loss: 1.0425, test_loss: 1.0190, test_f1: 0.4577
 epoch: 12, train_loss: 1.0310, test_loss: 1.0156, test_f1: 0.4632
 epoch: 13, train_loss: 1.0185, test_loss: 1.0130, test_f1: 0.4652
 epoch: 14, train_loss: 1.0152, test_loss: 1.0100, test_f1: 0.4713
 epoch: 15, train_loss: 1.0033, test_loss: 1.0041, test_f1: 0.4718
 epoch: 16, train_loss: 1.0006, test_loss: 1.0039, test_f1: 0.4716
 epoch: 17, train_loss: 0.9973, test_loss: 1.0016, test_f1: 0.4772
 epoch: 18, train_loss: 0.9981, test_loss: 0.9950, test_f1: 0.4715
 epoch: 19, train_loss: 0.9765, test_loss: 0.9904, test_f1: 0.4750
 epoch: 20, train_loss: 0.9821, test_loss: 0.9834, test_f1: 0.4867
 epoch: 21, train_loss: 0.9756, test_loss: 0.9861, test_f1: 0.4776
 epoch: 22, train_loss: 0.9784, test_loss: 0.9820, test_f1: 0.4872
 epoch: 23, train_loss: 0.9630, test_loss: 0.9847, test_f1: 0.4830
 epoch: 24, train_loss: 0.9568, test_loss: 0.9722, test_f1: 0.4998
 epoch: 25, train_loss: 0.9543, test_loss: 0.9730, test_f1: 0.5014
 epoch: 26, train_loss: 0.9505, test_loss: 0.9686, test_f1: 0.4938
 epoch: 27, train_loss: 0.9499, test_loss: 0.9638, test_f1: 0.4972
 epoch: 28, train_loss: 0.9402, test_loss: 0.9577, test_f1: 0.5062
 epoch: 29, train_loss: 0.9470, test_loss: 0.9558, test_f1: 0.5001
 epoch: 30, train_loss: 0.9432, test_loss: 0.9687, test_f1: 0.5081
 epoch: 31, train_loss: 0.9359, test_loss: 0.9660, test_f1: 0.4945
 epoch: 32, train_loss: 0.9340, test_loss: 0.9517, test_f1: 0.5092
 epoch: 33, train_loss: 0.9216, test_loss: 0.9449, test_f1: 0.5063
 epoch: 34, train_loss: 0.9327, test_loss: 0.9503, test_f1: 0.5018
 epoch: 35, train_loss: 0.9158, test_loss: 0.9442, test_f1: 0.4991
 epoch: 36, train_loss: 0.9231, test_loss: 0.9227, test_f1: 0.5088
 epoch: 37, train_loss: 0.9168, test_loss: 0.9157, test_f1: 0.5082
 epoch: 38, train_loss: 0.9143, test_loss: 0.9479, test_f1: 0.5103
 epoch: 39, train_loss: 0.9145, test_loss: 0.9110, test_f1: 0.5109
 epoch: 40, train_loss: 0.9104, test_loss: 0.9464, test_f1: 0.5110
 epoch: 41, train_loss: 0.9040, test_loss: 0.9496, test_f1: 0.5182
 epoch: 42, train_loss: 0.9027, test_loss: 0.9462, test_f1: 0.5207
 epoch: 43, train_loss: 0.8989, test_loss: 0.9368, test_f1: 0.5016
 epoch: 44, train_loss: 0.8984, test_loss: 0.9279, test_f1: 0.5110
 epoch: 45, train_loss: 0.8950, test_loss: 0.9288, test_f1: 0.5047
 epoch: 46, train_loss: 0.8950, test_loss: 0.9380, test_f1: 0.5081
 epoch: 47, train_loss: 0.8960, test_loss: 0.9305, test_f1: 0.5068
 epoch: 48, train_loss: 0.8871, test_loss: 0.9180, test_f1: 0.5168
 epoch: 49, train_loss: 0.8878, test_loss: 0.9093, test_f1: 0.5261
 epoch: 50, train_loss: 0.8851, test_loss: 0.9354, test_f1: 0.5178
 epoch: 51, train_loss: 0.8874, test_loss: 0.9281, test_f1: 0.5167
 epoch: 52, train_loss: 0.8843, test_loss: 0.9253, test_f1: 0.5202
 epoch: 53, train_loss: 0.8727, test_loss: 0.9240, test_f1: 0.5203
 epoch: 54, train_loss: 0.8807, test_loss: 0.9117, test_f1: 0.5252
 epoch: 55, train_loss: 0.8723, test_loss: 0.9206, test_f1: 0.5190
 epoch: 56, train_loss: 0.8745, test_loss: 0.9222, test_f1: 0.5223
 epoch: 57, train_loss: 0.8762, test_loss: 0.9165, test_f1: 0.5267
 epoch: 58, train_loss: 0.8793, test_loss: 0.9372, test_f1: 0.5309
 epoch: 59, train_loss: 0.8743, test_loss: 0.9143, test_f1: 0.5298
 epoch: 60, train_loss: 0.8763, test_loss: 0.9204, test_f1: 0.5319
 epoch: 61, train_loss: 0.8671, test_loss: 0.9297, test_f1: 0.5221
 epoch: 62, train_loss: 0.8714, test_loss: 0.9155, test_f1: 0.5233
 epoch: 63, train_loss: 0.8661, test_loss: 0.9198, test_f1: 0.5245
 epoch: 64, train_loss: 0.8605, test_loss: 0.8973, test_f1: 0.5259
 epoch: 65, train_loss: 0.8652, test_loss: 0.9127, test_f1: 0.5174
 epoch: 66, train_loss: 0.8651, test_loss: 0.9322, test_f1: 0.5205
 epoch: 67, train_loss: 0.8694, test_loss: 0.9253, test_f1: 0.5182
 epoch: 68, train_loss: 0.8603, test_loss: 0.9082, test_f1: 0.5242
 epoch: 69, train_loss: 0.8615, test_loss: 0.9245, test_f1: 0.5239
 epoch: 70, train_loss: 0.8622, test_loss: 0.9308, test_f1: 0.5229
 epoch: 71, train_loss: 0.8604, test_loss: 0.9176, test_f1: 0.5316
 epoch: 72, train_loss: 0.8563, test_loss: 0.8611, test_f1: 0.5409
 epoch: 73, train_loss: 0.8530, test_loss: 0.8639, test_f1: 0.5414
 epoch: 74, train_loss: 0.8602, test_loss: 0.9210, test_f1: 0.5303
 epoch: 75, train_loss: 0.8556, test_loss: 0.9312, test_f1: 0.5243
 epoch: 76, train_loss: 0.8526, test_loss: 0.9115, test_f1: 0.5309
 epoch: 77, train_loss: 0.8499, test_loss: 0.9112, test_f1: 0.5312
 epoch: 78, train_loss: 0.8540, test_loss: 0.9114, test_f1: 0.5363
 epoch: 79, train_loss: 0.8465, test_loss: 0.9129, test_f1: 0.5262
 epoch: 80, train_loss: 0.8533, test_loss: 0.9202, test_f1: 0.5284
 epoch: 81, train_loss: 0.8474, test_loss: 0.9207, test_f1: 0.5221
 epoch: 82, train_loss: 0.8471, test_loss: 0.9081, test_f1: 0.5312
 epoch: 83, train_loss: 0.8514, test_loss: 0.9086, test_f1: 0.5316
 epoch: 84, train_loss: 0.8363, test_loss: 0.9082, test_f1: 0.5343
 epoch: 85, train_loss: 0.8459, test_loss: 0.9094, test_f1: 0.5292
 epoch: 86, train_loss: 0.8444, test_loss: 0.9018, test_f1: 0.5351
 epoch: 87, train_loss: 0.8494, test_loss: 0.9112, test_f1: 0.5338
 epoch: 88, train_loss: 0.8480, test_loss: 0.9083, test_f1: 0.5342
 epoch: 89, train_loss: 0.8392, test_loss: 0.9063, test_f1: 0.5308
 epoch: 90, train_loss: 0.8513, test_loss: 0.8991, test_f1: 0.5358
 epoch: 91, train_loss: 0.8389, test_loss: 0.9047, test_f1: 0.5406
 epoch: 92, train_loss: 0.8391, test_loss: 0.8981, test_f1: 0.5452
 epoch: 93, train_loss: 0.8449, test_loss: 0.8922, test_f1: 0.5369
 epoch: 94, train_loss: 0.8345, test_loss: 0.8978, test_f1: 0.5360
 epoch: 95, train_loss: 0.8425, test_loss: 0.9194, test_f1: 0.5401
 epoch: 96, train_loss: 0.8286, test_loss: 0.8956, test_f1: 0.5365
 epoch: 97, train_loss: 0.8384, test_loss: 0.8870, test_f1: 0.5403
 epoch: 98, train_loss: 0.8308, test_loss: 0.8825, test_f1: 0.5344
 epoch: 99, train_loss: 0.8291, test_loss: 0.8927, test_f1: 0.5367
##################ITERATION #9 ****************************************
 epoch: 0, train_loss: 1.3238, test_loss: 1.3882, test_f1: 0.2270
 epoch: 1, train_loss: 1.1952, test_loss: 1.2182, test_f1: 0.2277
 epoch: 2, train_loss: 1.1545, test_loss: 1.0994, test_f1: 0.3647
 epoch: 3, train_loss: 1.1293, test_loss: 1.0558, test_f1: 0.3906
 epoch: 4, train_loss: 1.1089, test_loss: 1.0413, test_f1: 0.4099
 epoch: 5, train_loss: 1.0887, test_loss: 1.0274, test_f1: 0.4287
 epoch: 6, train_loss: 1.0765, test_loss: 1.0118, test_f1: 0.4312
 epoch: 7, train_loss: 1.0584, test_loss: 0.9998, test_f1: 0.4488
 epoch: 8, train_loss: 1.0505, test_loss: 0.9947, test_f1: 0.4652
 epoch: 9, train_loss: 1.0400, test_loss: 0.9832, test_f1: 0.4664
 epoch: 10, train_loss: 1.0285, test_loss: 0.9822, test_f1: 0.4566
 epoch: 11, train_loss: 1.0222, test_loss: 0.9716, test_f1: 0.4831
 epoch: 12, train_loss: 1.0083, test_loss: 0.9683, test_f1: 0.4869
 epoch: 13, train_loss: 1.0068, test_loss: 0.9658, test_f1: 0.4929
 epoch: 14, train_loss: 0.9999, test_loss: 0.9575, test_f1: 0.4958
 epoch: 15, train_loss: 0.9884, test_loss: 0.9507, test_f1: 0.5056
 epoch: 16, train_loss: 0.9896, test_loss: 0.9472, test_f1: 0.4784
 epoch: 17, train_loss: 0.9870, test_loss: 0.9474, test_f1: 0.5011
 epoch: 18, train_loss: 0.9748, test_loss: 0.9386, test_f1: 0.4972
 epoch: 19, train_loss: 0.9710, test_loss: 0.9365, test_f1: 0.5027
 epoch: 20, train_loss: 0.9699, test_loss: 0.9325, test_f1: 0.4941
 epoch: 21, train_loss: 0.9618, test_loss: 0.9345, test_f1: 0.5063
 epoch: 22, train_loss: 0.9666, test_loss: 0.9224, test_f1: 0.4969
 epoch: 23, train_loss: 0.9554, test_loss: 0.9296, test_f1: 0.5175
 epoch: 24, train_loss: 0.9530, test_loss: 0.9286, test_f1: 0.4898
 epoch: 25, train_loss: 0.9512, test_loss: 0.9284, test_f1: 0.4987
 epoch: 26, train_loss: 0.9492, test_loss: 0.9248, test_f1: 0.4860
 epoch: 27, train_loss: 0.9511, test_loss: 0.9232, test_f1: 0.5004
 epoch: 28, train_loss: 0.9388, test_loss: 0.9159, test_f1: 0.4944
 epoch: 29, train_loss: 0.9397, test_loss: 0.9119, test_f1: 0.5142
 epoch: 30, train_loss: 0.9426, test_loss: 0.9080, test_f1: 0.4986
 epoch: 31, train_loss: 0.9250, test_loss: 0.9070, test_f1: 0.5131
 epoch: 32, train_loss: 0.9327, test_loss: 0.9068, test_f1: 0.4937
 epoch: 33, train_loss: 0.9290, test_loss: 0.9011, test_f1: 0.5031
 epoch: 34, train_loss: 0.9261, test_loss: 0.9025, test_f1: 0.5104
 epoch: 35, train_loss: 0.9195, test_loss: 0.9168, test_f1: 0.4970
 epoch: 36, train_loss: 0.9160, test_loss: 0.8943, test_f1: 0.5178
 epoch: 37, train_loss: 0.9175, test_loss: 0.8878, test_f1: 0.5306
 epoch: 38, train_loss: 0.9239, test_loss: 0.8854, test_f1: 0.5317
 epoch: 39, train_loss: 0.9101, test_loss: 0.8842, test_f1: 0.5240
 epoch: 40, train_loss: 0.9103, test_loss: 0.8844, test_f1: 0.5273
 epoch: 41, train_loss: 0.9010, test_loss: 0.8847, test_f1: 0.5286
 epoch: 42, train_loss: 0.8999, test_loss: 0.8894, test_f1: 0.5264
 epoch: 43, train_loss: 0.9026, test_loss: 0.8925, test_f1: 0.5288
 epoch: 44, train_loss: 0.9033, test_loss: 0.8937, test_f1: 0.5323
 epoch: 45, train_loss: 0.9000, test_loss: 0.8895, test_f1: 0.5150
 epoch: 46, train_loss: 0.9010, test_loss: 0.8767, test_f1: 0.5390
 epoch: 47, train_loss: 0.8926, test_loss: 0.8864, test_f1: 0.5334
 epoch: 48, train_loss: 0.8890, test_loss: 0.8809, test_f1: 0.5269
 epoch: 49, train_loss: 0.8904, test_loss: 0.8847, test_f1: 0.5323
 epoch: 50, train_loss: 0.8852, test_loss: 0.8800, test_f1: 0.5268
 epoch: 51, train_loss: 0.8800, test_loss: 0.8917, test_f1: 0.5265
 epoch: 52, train_loss: 0.8903, test_loss: 0.9013, test_f1: 0.5248
 epoch: 53, train_loss: 0.8776, test_loss: 0.9033, test_f1: 0.5258
 epoch: 54, train_loss: 0.8746, test_loss: 0.8931, test_f1: 0.5198
 epoch: 55, train_loss: 0.8766, test_loss: 0.8981, test_f1: 0.5209
 epoch: 56, train_loss: 0.8784, test_loss: 0.8922, test_f1: 0.5284
 epoch: 57, train_loss: 0.8705, test_loss: 0.8852, test_f1: 0.5284
 epoch: 58, train_loss: 0.8703, test_loss: 0.8883, test_f1: 0.5304
 epoch: 59, train_loss: 0.8724, test_loss: 0.8932, test_f1: 0.5221
 epoch: 60, train_loss: 0.8636, test_loss: 0.8875, test_f1: 0.5274
 epoch: 61, train_loss: 0.8738, test_loss: 0.8929, test_f1: 0.5263
 epoch: 62, train_loss: 0.8663, test_loss: 0.8877, test_f1: 0.5219
 epoch: 63, train_loss: 0.8654, test_loss: 0.8930, test_f1: 0.5222
 epoch: 64, train_loss: 0.8720, test_loss: 0.8948, test_f1: 0.5251
 epoch: 65, train_loss: 0.8603, test_loss: 0.8875, test_f1: 0.5303
 epoch: 66, train_loss: 0.8538, test_loss: 0.8888, test_f1: 0.5334
 epoch: 67, train_loss: 0.8664, test_loss: 0.8872, test_f1: 0.5319
 epoch: 68, train_loss: 0.8490, test_loss: 0.8859, test_f1: 0.5318
 epoch: 69, train_loss: 0.8653, test_loss: 0.8928, test_f1: 0.5265
 epoch: 70, train_loss: 0.8534, test_loss: 0.8949, test_f1: 0.5267
 epoch: 71, train_loss: 0.8580, test_loss: 0.8881, test_f1: 0.5292
 epoch: 72, train_loss: 0.8532, test_loss: 0.8843, test_f1: 0.5387
 epoch: 73, train_loss: 0.8618, test_loss: 0.8858, test_f1: 0.5354
 epoch: 74, train_loss: 0.8552, test_loss: 0.8837, test_f1: 0.5291
 epoch: 75, train_loss: 0.8475, test_loss: 0.8823, test_f1: 0.5414
 epoch: 76, train_loss: 0.8610, test_loss: 0.8848, test_f1: 0.5227
 epoch: 77, train_loss: 0.8500, test_loss: 0.8843, test_f1: 0.5313
 epoch: 78, train_loss: 0.8547, test_loss: 0.8877, test_f1: 0.5268
 epoch: 79, train_loss: 0.8542, test_loss: 0.8867, test_f1: 0.5341
 epoch: 80, train_loss: 0.8524, test_loss: 0.8857, test_f1: 0.5188
 epoch: 81, train_loss: 0.8467, test_loss: 0.8802, test_f1: 0.5371
 epoch: 82, train_loss: 0.8504, test_loss: 0.8818, test_f1: 0.5250
 epoch: 83, train_loss: 0.8439, test_loss: 0.8751, test_f1: 0.5315
 epoch: 84, train_loss: 0.8538, test_loss: 0.8856, test_f1: 0.5320
 epoch: 85, train_loss: 0.8617, test_loss: 0.8762, test_f1: 0.5295
 epoch: 86, train_loss: 0.8459, test_loss: 0.8840, test_f1: 0.5316
 epoch: 87, train_loss: 0.8420, test_loss: 0.8806, test_f1: 0.5300
 epoch: 88, train_loss: 0.8407, test_loss: 0.8814, test_f1: 0.5313
 epoch: 89, train_loss: 0.8441, test_loss: 0.8918, test_f1: 0.5282
 epoch: 90, train_loss: 0.8484, test_loss: 0.8848, test_f1: 0.5356
 epoch: 91, train_loss: 0.8427, test_loss: 0.8802, test_f1: 0.5352
 epoch: 92, train_loss: 0.8357, test_loss: 0.8934, test_f1: 0.5302
 epoch: 93, train_loss: 0.8378, test_loss: 0.8818, test_f1: 0.5419
 epoch: 94, train_loss: 0.8436, test_loss: 0.8805, test_f1: 0.5337
 epoch: 95, train_loss: 0.8229, test_loss: 0.8765, test_f1: 0.5334
 epoch: 96, train_loss: 0.8410, test_loss: 0.8791, test_f1: 0.5352
 epoch: 97, train_loss: 0.8345, test_loss: 0.8784, test_f1: 0.5327
 epoch: 98, train_loss: 0.8298, test_loss: 0.8748, test_f1: 0.5363
 epoch: 99, train_loss: 0.8273, test_loss: 0.8723, test_f1: 0.5329

Training completed in 581.47 seconds
Best F1: 0.5577 at epoch 90
Mean F1 across iterations: 0.5385  0.0127
========================FINAL RESULTS================================
FEGIN weighted F1: 0.5577  0.0127
python main.py --data ltspice_examples --representation component_pin_net --model FEGIN --layers 6 --hiddens 32 --batch_size 128 --lr 0.0001 --emb_size 128 --epochs 100 --save_appendix component_pin_net_L6_H32_BS128_LR0.0001_E128 --no_val
-----



STDERR:
  File "main.py", line 370, in <module>
    main()
  File "main.py", line 254, in main
    dataset = dataset_class(
  File "/home/philip/projects/ltspice_examples_code_repo/Circuit-Completion-Using-GNNs/component_classification_with_link_prediction_head/evaluation/FEGIN/kernel/circuit_datasets.py", line 15, in __init__
    self.data, self.slices = torch.load(self.processed_paths[0])
  File "/home/philip/.local/lib/python3.8/site-packages/torch/serialization.py", line 1040, in load
    warnings.warn(
  File "/usr/lib/python3.8/warnings.py", line 109, in _showwarnmsg
    sw(msg.message, msg.category, msg.filename, msg.lineno,
  File "main.py", line 47, in warn_with_traceback
    traceback.print_stack(file=log)
/home/philip/projects/ltspice_examples_code_repo/Circuit-Completion-Using-GNNs/component_classification_with_link_prediction_head/evaluation/FEGIN/kernel/circuit_datasets.py:15: FutureWarning: You are using `torch.load` with `weights_only=False` (the current default value), which uses the default pickle module implicitly. It is possible to construct malicious pickle data which will execute arbitrary code during unpickling (See https://github.com/pytorch/pytorch/blob/main/SECURITY.md#untrusted-models for more details). In a future release, the default value for `weights_only` will be flipped to `True`. This limits the functions that could be executed during unpickling. Arbitrary objects will no longer be allowed to be loaded via this mode unless they are explicitly allowlisted by the user via `torch.serialization.add_safe_globals`. We recommend you start setting `weights_only=True` for any use case where you don't have full control of the loaded file. Please open an issue on GitHub for any issues related to this experimental feature.
  self.data, self.slices = torch.load(self.processed_paths[0])
