STDOUT:
Results will be saved in /home/philip/projects/ltspice_examples_code_repo/Circuit-Completion-Using-GNNs/component_classification_with_link_prediction_head/evaluation/FEGIN/results/model_FEGIN_dataset_ltspice_demos
Command line input: python main.py --data ltspice_demos --representation component_pin_net --model FEGIN --layers 5 --hiddens 32 --batch_size 32 --lr 0.001 --emb_size 128 --epochs 100 --save_appendix component_pin_net_L5_H32_BS32_LR0.001_E128 --no_val
 is saved.
-----
ltspice_demos - FEGIN
Using 5 layers, 32 hidden units, h = 2
Loading component_pin_net representation dataset
ENTERED
Training FEGIN on component_pin_net representation
Train: 1565, Test: 383
##################ITERATION #0 ****************************************
 epoch: 0, train_loss: 1.2835, test_loss: 1.2965, test_f1: 0.3232
 epoch: 1, train_loss: 1.1545, test_loss: 1.2005, test_f1: 0.3861
 epoch: 2, train_loss: 1.1188, test_loss: 1.1649, test_f1: 0.4360
 epoch: 3, train_loss: 1.0852, test_loss: 1.1321, test_f1: 0.4409
 epoch: 4, train_loss: 1.0297, test_loss: 1.0891, test_f1: 0.4778
 epoch: 5, train_loss: 0.9954, test_loss: 1.0752, test_f1: 0.4517
 epoch: 6, train_loss: 0.9829, test_loss: 1.0541, test_f1: 0.4618
 epoch: 7, train_loss: 0.9689, test_loss: 1.0430, test_f1: 0.5093
 epoch: 8, train_loss: 0.9581, test_loss: 1.0601, test_f1: 0.5351
 epoch: 9, train_loss: 0.9514, test_loss: 1.0596, test_f1: 0.5510
 epoch: 10, train_loss: 0.9351, test_loss: 1.0283, test_f1: 0.5594
 epoch: 11, train_loss: 0.9275, test_loss: 1.0453, test_f1: 0.5483
 epoch: 12, train_loss: 0.9086, test_loss: 1.0043, test_f1: 0.4852
 epoch: 13, train_loss: 0.9150, test_loss: 1.0205, test_f1: 0.5622
 epoch: 14, train_loss: 0.8920, test_loss: 1.0066, test_f1: 0.5471
 epoch: 15, train_loss: 0.8812, test_loss: 1.0858, test_f1: 0.5435
 epoch: 16, train_loss: 0.8701, test_loss: 1.0018, test_f1: 0.5269
 epoch: 17, train_loss: 0.8583, test_loss: 0.9860, test_f1: 0.5833
 epoch: 18, train_loss: 0.8353, test_loss: 0.9737, test_f1: 0.5899
 epoch: 19, train_loss: 0.8086, test_loss: 1.0050, test_f1: 0.5924
 epoch: 20, train_loss: 0.8158, test_loss: 1.0570, test_f1: 0.5714
 epoch: 21, train_loss: 0.7924, test_loss: 1.0308, test_f1: 0.5033
 epoch: 22, train_loss: 0.7881, test_loss: 1.0076, test_f1: 0.6008
 epoch: 23, train_loss: 0.7620, test_loss: 1.0167, test_f1: 0.5456
 epoch: 24, train_loss: 0.7529, test_loss: 0.9473, test_f1: 0.5426
 epoch: 25, train_loss: 0.7637, test_loss: 1.0674, test_f1: 0.5007
 epoch: 26, train_loss: 0.7481, test_loss: 0.9572, test_f1: 0.5660
 epoch: 27, train_loss: 0.7256, test_loss: 1.0098, test_f1: 0.6194
 epoch: 28, train_loss: 0.7307, test_loss: 0.9573, test_f1: 0.5945
 epoch: 29, train_loss: 0.7185, test_loss: 0.9388, test_f1: 0.6014
 epoch: 30, train_loss: 0.6979, test_loss: 0.9680, test_f1: 0.6187
 epoch: 31, train_loss: 0.6828, test_loss: 0.9557, test_f1: 0.5866
 epoch: 32, train_loss: 0.6750, test_loss: 0.9850, test_f1: 0.6348
 epoch: 33, train_loss: 0.6726, test_loss: 1.0622, test_f1: 0.5775
 epoch: 34, train_loss: 0.6723, test_loss: 0.9624, test_f1: 0.6076
 epoch: 35, train_loss: 0.6618, test_loss: 1.0975, test_f1: 0.5586
 epoch: 36, train_loss: 0.6626, test_loss: 0.9759, test_f1: 0.5979
 epoch: 37, train_loss: 0.6692, test_loss: 1.0772, test_f1: 0.5819
 epoch: 38, train_loss: 0.6374, test_loss: 0.9718, test_f1: 0.6317
 epoch: 39, train_loss: 0.6518, test_loss: 1.1066, test_f1: 0.5867
 epoch: 40, train_loss: 0.6184, test_loss: 1.0365, test_f1: 0.5823
 epoch: 41, train_loss: 0.6089, test_loss: 1.0426, test_f1: 0.5969
 epoch: 42, train_loss: 0.6152, test_loss: 1.0954, test_f1: 0.5829
 epoch: 43, train_loss: 0.6169, test_loss: 1.0277, test_f1: 0.6115
 epoch: 44, train_loss: 0.6074, test_loss: 1.1108, test_f1: 0.6148
 epoch: 45, train_loss: 0.6215, test_loss: 1.1482, test_f1: 0.5640
 epoch: 46, train_loss: 0.6102, test_loss: 1.0977, test_f1: 0.5949
 epoch: 47, train_loss: 0.6109, test_loss: 1.1530, test_f1: 0.5790
 epoch: 48, train_loss: 0.5963, test_loss: 1.0569, test_f1: 0.6195
 epoch: 49, train_loss: 0.6105, test_loss: 1.1013, test_f1: 0.6105
 epoch: 50, train_loss: 0.5821, test_loss: 1.0539, test_f1: 0.6010
 epoch: 51, train_loss: 0.5580, test_loss: 1.0348, test_f1: 0.6108
 epoch: 52, train_loss: 0.5362, test_loss: 1.0576, test_f1: 0.6302
 epoch: 53, train_loss: 0.5505, test_loss: 1.0866, test_f1: 0.6112
 epoch: 54, train_loss: 0.5375, test_loss: 1.1141, test_f1: 0.6197
 epoch: 55, train_loss: 0.5196, test_loss: 1.1471, test_f1: 0.6061
 epoch: 56, train_loss: 0.4961, test_loss: 1.0877, test_f1: 0.6365
 epoch: 57, train_loss: 0.4999, test_loss: 1.1377, test_f1: 0.6201
 epoch: 58, train_loss: 0.4974, test_loss: 1.1624, test_f1: 0.6029
 epoch: 59, train_loss: 0.5005, test_loss: 1.2847, test_f1: 0.6004
 epoch: 60, train_loss: 0.5174, test_loss: 1.1716, test_f1: 0.6338
 epoch: 61, train_loss: 0.5011, test_loss: 1.1095, test_f1: 0.6283
 epoch: 62, train_loss: 0.5081, test_loss: 1.1904, test_f1: 0.6172
 epoch: 63, train_loss: 0.4944, test_loss: 1.1755, test_f1: 0.6122
 epoch: 64, train_loss: 0.5211, test_loss: 1.1172, test_f1: 0.6351
 epoch: 65, train_loss: 0.4759, test_loss: 1.1973, test_f1: 0.6125
 epoch: 66, train_loss: 0.4872, test_loss: 1.1555, test_f1: 0.6227
 epoch: 67, train_loss: 0.4708, test_loss: 1.1552, test_f1: 0.6244
 epoch: 68, train_loss: 0.4489, test_loss: 1.2763, test_f1: 0.6082
 epoch: 69, train_loss: 0.4682, test_loss: 1.2297, test_f1: 0.5790
 epoch: 70, train_loss: 0.4456, test_loss: 1.1848, test_f1: 0.6341
 epoch: 71, train_loss: 0.4735, test_loss: 1.2988, test_f1: 0.5956
 epoch: 72, train_loss: 0.4370, test_loss: 1.2887, test_f1: 0.6021
 epoch: 73, train_loss: 0.4319, test_loss: 1.2800, test_f1: 0.6192
 epoch: 74, train_loss: 0.4483, test_loss: 1.2544, test_f1: 0.6125
 epoch: 75, train_loss: 0.4375, test_loss: 1.2200, test_f1: 0.6154
 epoch: 76, train_loss: 0.4559, test_loss: 1.2500, test_f1: 0.6282
 epoch: 77, train_loss: 0.4300, test_loss: 1.2701, test_f1: 0.6158
 epoch: 78, train_loss: 0.4208, test_loss: 1.2703, test_f1: 0.6139
 epoch: 79, train_loss: 0.4368, test_loss: 1.3732, test_f1: 0.5932
 epoch: 80, train_loss: 0.4136, test_loss: 1.3062, test_f1: 0.6409
 epoch: 81, train_loss: 0.4323, test_loss: 1.3184, test_f1: 0.6288
 epoch: 82, train_loss: 0.4050, test_loss: 1.3455, test_f1: 0.6279
 epoch: 83, train_loss: 0.4262, test_loss: 1.3864, test_f1: 0.6006
 epoch: 84, train_loss: 0.4150, test_loss: 1.4236, test_f1: 0.6089
 epoch: 85, train_loss: 0.4116, test_loss: 1.3973, test_f1: 0.6199
 epoch: 86, train_loss: 0.4038, test_loss: 1.5140, test_f1: 0.6057
 epoch: 87, train_loss: 0.4225, test_loss: 1.4247, test_f1: 0.6042
 epoch: 88, train_loss: 0.4014, test_loss: 1.3067, test_f1: 0.6496
 epoch: 89, train_loss: 0.4141, test_loss: 1.4054, test_f1: 0.6212
 epoch: 90, train_loss: 0.4179, test_loss: 1.4004, test_f1: 0.6300
 epoch: 91, train_loss: 0.3769, test_loss: 1.4083, test_f1: 0.5928
 epoch: 92, train_loss: 0.3971, test_loss: 1.4412, test_f1: 0.6247
 epoch: 93, train_loss: 0.3837, test_loss: 1.4383, test_f1: 0.6285
 epoch: 94, train_loss: 0.3786, test_loss: 1.4930, test_f1: 0.6146
 epoch: 95, train_loss: 0.3701, test_loss: 1.4856, test_f1: 0.6207
 epoch: 96, train_loss: 0.3788, test_loss: 1.4024, test_f1: 0.6362
 epoch: 97, train_loss: 0.3551, test_loss: 1.4144, test_f1: 0.6285
 epoch: 98, train_loss: 0.3831, test_loss: 1.4772, test_f1: 0.6086
 epoch: 99, train_loss: 0.3495, test_loss: 1.4965, test_f1: 0.6119
##################ITERATION #1 ****************************************
 epoch: 0, train_loss: 1.1739, test_loss: 1.1844, test_f1: 0.4558
 epoch: 1, train_loss: 1.0393, test_loss: 1.0643, test_f1: 0.5513
 epoch: 2, train_loss: 0.9956, test_loss: 1.0280, test_f1: 0.5398
 epoch: 3, train_loss: 0.9659, test_loss: 1.0204, test_f1: 0.5127
 epoch: 4, train_loss: 0.9450, test_loss: 1.0607, test_f1: 0.5144
 epoch: 5, train_loss: 0.9348, test_loss: 0.9808, test_f1: 0.5686
 epoch: 6, train_loss: 0.9197, test_loss: 0.9992, test_f1: 0.5748
 epoch: 7, train_loss: 0.9075, test_loss: 0.9581, test_f1: 0.5801
 epoch: 8, train_loss: 0.9060, test_loss: 0.9813, test_f1: 0.5853
 epoch: 9, train_loss: 0.8746, test_loss: 0.9686, test_f1: 0.5710
 epoch: 10, train_loss: 0.8582, test_loss: 1.0013, test_f1: 0.5902
 epoch: 11, train_loss: 0.8570, test_loss: 1.0294, test_f1: 0.5453
 epoch: 12, train_loss: 0.8487, test_loss: 1.0100, test_f1: 0.5487
 epoch: 13, train_loss: 0.8256, test_loss: 0.9766, test_f1: 0.5870
 epoch: 14, train_loss: 0.8091, test_loss: 0.9756, test_f1: 0.5611
 epoch: 15, train_loss: 0.7952, test_loss: 1.0405, test_f1: 0.5932
 epoch: 16, train_loss: 0.8077, test_loss: 1.0161, test_f1: 0.5954
 epoch: 17, train_loss: 0.7826, test_loss: 1.0542, test_f1: 0.6057
 epoch: 18, train_loss: 0.7651, test_loss: 1.0178, test_f1: 0.6007
 epoch: 19, train_loss: 0.7441, test_loss: 1.0324, test_f1: 0.6023
 epoch: 20, train_loss: 0.7539, test_loss: 0.9769, test_f1: 0.6488
 epoch: 21, train_loss: 0.7413, test_loss: 1.1369, test_f1: 0.5760
 epoch: 22, train_loss: 0.7144, test_loss: 1.0321, test_f1: 0.6196
 epoch: 23, train_loss: 0.7070, test_loss: 1.0718, test_f1: 0.6042
 epoch: 24, train_loss: 0.6967, test_loss: 1.0457, test_f1: 0.6294
 epoch: 25, train_loss: 0.6708, test_loss: 1.0984, test_f1: 0.6049
 epoch: 26, train_loss: 0.6586, test_loss: 1.0797, test_f1: 0.5656
 epoch: 27, train_loss: 0.6694, test_loss: 1.1083, test_f1: 0.5791
 epoch: 28, train_loss: 0.6535, test_loss: 1.0831, test_f1: 0.6176
 epoch: 29, train_loss: 0.6461, test_loss: 1.1053, test_f1: 0.5903
 epoch: 30, train_loss: 0.6287, test_loss: 1.1293, test_f1: 0.6131
 epoch: 31, train_loss: 0.6264, test_loss: 1.1445, test_f1: 0.5661
 epoch: 32, train_loss: 0.6311, test_loss: 1.1740, test_f1: 0.5543
 epoch: 33, train_loss: 0.6089, test_loss: 1.2360, test_f1: 0.6098
 epoch: 34, train_loss: 0.6127, test_loss: 1.2879, test_f1: 0.6008
 epoch: 35, train_loss: 0.5847, test_loss: 1.3064, test_f1: 0.5460
 epoch: 36, train_loss: 0.5851, test_loss: 1.1957, test_f1: 0.6095
 epoch: 37, train_loss: 0.5710, test_loss: 1.6171, test_f1: 0.4752
 epoch: 38, train_loss: 0.5822, test_loss: 1.2907, test_f1: 0.5977
 epoch: 39, train_loss: 0.5705, test_loss: 1.3121, test_f1: 0.5955
 epoch: 40, train_loss: 0.5602, test_loss: 1.3579, test_f1: 0.5699
 epoch: 41, train_loss: 0.5570, test_loss: 1.4529, test_f1: 0.5925
 epoch: 42, train_loss: 0.5490, test_loss: 1.3825, test_f1: 0.5520
 epoch: 43, train_loss: 0.5361, test_loss: 1.3557, test_f1: 0.5990
 epoch: 44, train_loss: 0.5406, test_loss: 1.3532, test_f1: 0.5770
 epoch: 45, train_loss: 0.5254, test_loss: 1.3562, test_f1: 0.6009
 epoch: 46, train_loss: 0.4911, test_loss: 1.3858, test_f1: 0.5906
 epoch: 47, train_loss: 0.5174, test_loss: 1.3782, test_f1: 0.6282
 epoch: 48, train_loss: 0.5110, test_loss: 1.2737, test_f1: 0.6002
 epoch: 49, train_loss: 0.5232, test_loss: 1.3494, test_f1: 0.6126
 epoch: 50, train_loss: 0.4981, test_loss: 1.5003, test_f1: 0.5682
 epoch: 51, train_loss: 0.4628, test_loss: 1.3477, test_f1: 0.6001
 epoch: 52, train_loss: 0.4315, test_loss: 1.4856, test_f1: 0.6232
 epoch: 53, train_loss: 0.4363, test_loss: 1.4990, test_f1: 0.6223
 epoch: 54, train_loss: 0.4163, test_loss: 1.5753, test_f1: 0.6074
 epoch: 55, train_loss: 0.4196, test_loss: 1.4848, test_f1: 0.6037
 epoch: 56, train_loss: 0.4259, test_loss: 1.5586, test_f1: 0.6177
 epoch: 57, train_loss: 0.4264, test_loss: 1.6360, test_f1: 0.6212
 epoch: 58, train_loss: 0.4056, test_loss: 1.6729, test_f1: 0.6232
 epoch: 59, train_loss: 0.4223, test_loss: 1.6475, test_f1: 0.6026
 epoch: 60, train_loss: 0.4079, test_loss: 1.7122, test_f1: 0.6027
 epoch: 61, train_loss: 0.4278, test_loss: 1.5488, test_f1: 0.5988
 epoch: 62, train_loss: 0.3842, test_loss: 1.6477, test_f1: 0.5726
 epoch: 63, train_loss: 0.4045, test_loss: 1.7981, test_f1: 0.5672
 epoch: 64, train_loss: 0.3889, test_loss: 1.6836, test_f1: 0.6136
 epoch: 65, train_loss: 0.3634, test_loss: 1.7590, test_f1: 0.6137
 epoch: 66, train_loss: 0.3773, test_loss: 1.8084, test_f1: 0.5800
 epoch: 67, train_loss: 0.3655, test_loss: 1.7684, test_f1: 0.5917
 epoch: 68, train_loss: 0.3931, test_loss: 1.8825, test_f1: 0.5991
 epoch: 69, train_loss: 0.3780, test_loss: 1.6399, test_f1: 0.5896
 epoch: 70, train_loss: 0.3712, test_loss: 1.7697, test_f1: 0.5956
 epoch: 71, train_loss: 0.3574, test_loss: 1.7435, test_f1: 0.6202
 epoch: 72, train_loss: 0.3763, test_loss: 1.8979, test_f1: 0.5853
 epoch: 73, train_loss: 0.3459, test_loss: 1.7370, test_f1: 0.5862
 epoch: 74, train_loss: 0.3335, test_loss: 1.8789, test_f1: 0.5977
 epoch: 75, train_loss: 0.3382, test_loss: 1.7276, test_f1: 0.6041
 epoch: 76, train_loss: 0.3433, test_loss: 1.9537, test_f1: 0.6167
 epoch: 77, train_loss: 0.3698, test_loss: 1.7809, test_f1: 0.5958
 epoch: 78, train_loss: 0.3250, test_loss: 1.8825, test_f1: 0.5815
 epoch: 79, train_loss: 0.3304, test_loss: 1.8289, test_f1: 0.6157
 epoch: 80, train_loss: 0.3344, test_loss: 1.9743, test_f1: 0.5893
 epoch: 81, train_loss: 0.3037, test_loss: 1.9959, test_f1: 0.6170
 epoch: 82, train_loss: 0.3501, test_loss: 1.9439, test_f1: 0.6063
 epoch: 83, train_loss: 0.3390, test_loss: 1.9627, test_f1: 0.5809
 epoch: 84, train_loss: 0.3284, test_loss: 2.0297, test_f1: 0.5907
 epoch: 85, train_loss: 0.3110, test_loss: 2.0893, test_f1: 0.6195
 epoch: 86, train_loss: 0.3048, test_loss: 1.9672, test_f1: 0.5949
 epoch: 87, train_loss: 0.2907, test_loss: 2.0899, test_f1: 0.6168
 epoch: 88, train_loss: 0.3298, test_loss: 2.1588, test_f1: 0.5950
 epoch: 89, train_loss: 0.3289, test_loss: 2.1168, test_f1: 0.5942
 epoch: 90, train_loss: 0.3108, test_loss: 2.1454, test_f1: 0.6043
 epoch: 91, train_loss: 0.2822, test_loss: 2.1777, test_f1: 0.5760
 epoch: 92, train_loss: 0.2956, test_loss: 2.1214, test_f1: 0.5901
 epoch: 93, train_loss: 0.2974, test_loss: 2.2184, test_f1: 0.5572
 epoch: 94, train_loss: 0.2998, test_loss: 2.0708, test_f1: 0.5821
 epoch: 95, train_loss: 0.3017, test_loss: 1.9203, test_f1: 0.5622
 epoch: 96, train_loss: 0.2815, test_loss: 1.9555, test_f1: 0.5886
 epoch: 97, train_loss: 0.2722, test_loss: 2.0782, test_f1: 0.5999
 epoch: 98, train_loss: 0.3119, test_loss: 1.9704, test_f1: 0.5752
 epoch: 99, train_loss: 0.2884, test_loss: 2.1201, test_f1: 0.5856
##################ITERATION #2 ****************************************
 epoch: 0, train_loss: 1.1614, test_loss: 1.3057, test_f1: 0.2918
 epoch: 1, train_loss: 1.0341, test_loss: 1.0803, test_f1: 0.4544
 epoch: 2, train_loss: 1.0005, test_loss: 1.0343, test_f1: 0.5309
 epoch: 3, train_loss: 0.9840, test_loss: 1.0008, test_f1: 0.5289
 epoch: 4, train_loss: 0.9495, test_loss: 1.0097, test_f1: 0.5335
 epoch: 5, train_loss: 0.9183, test_loss: 1.0007, test_f1: 0.5382
 epoch: 6, train_loss: 0.9167, test_loss: 1.0179, test_f1: 0.5820
 epoch: 7, train_loss: 0.9172, test_loss: 1.0217, test_f1: 0.5516
 epoch: 8, train_loss: 0.8857, test_loss: 0.9834, test_f1: 0.5659
 epoch: 9, train_loss: 0.8519, test_loss: 0.9684, test_f1: 0.5887
 epoch: 10, train_loss: 0.8479, test_loss: 0.9797, test_f1: 0.5540
 epoch: 11, train_loss: 0.8268, test_loss: 1.0241, test_f1: 0.5923
 epoch: 12, train_loss: 0.8235, test_loss: 0.9907, test_f1: 0.5826
 epoch: 13, train_loss: 0.7943, test_loss: 1.0347, test_f1: 0.5530
 epoch: 14, train_loss: 0.7843, test_loss: 1.0847, test_f1: 0.6098
 epoch: 15, train_loss: 0.7886, test_loss: 1.1357, test_f1: 0.4838
 epoch: 16, train_loss: 0.7358, test_loss: 1.0485, test_f1: 0.5883
 epoch: 17, train_loss: 0.7335, test_loss: 0.9974, test_f1: 0.5975
 epoch: 18, train_loss: 0.7245, test_loss: 1.0508, test_f1: 0.6267
 epoch: 19, train_loss: 0.7194, test_loss: 1.0674, test_f1: 0.5849
 epoch: 20, train_loss: 0.7237, test_loss: 1.2461, test_f1: 0.4923
 epoch: 21, train_loss: 0.7076, test_loss: 1.0833, test_f1: 0.6019
 epoch: 22, train_loss: 0.6916, test_loss: 1.0423, test_f1: 0.6322
 epoch: 23, train_loss: 0.6755, test_loss: 1.1650, test_f1: 0.5576
 epoch: 24, train_loss: 0.6661, test_loss: 1.1432, test_f1: 0.5755
 epoch: 25, train_loss: 0.6928, test_loss: 1.1339, test_f1: 0.5938
 epoch: 26, train_loss: 0.6499, test_loss: 1.1206, test_f1: 0.5868
 epoch: 27, train_loss: 0.6677, test_loss: 1.1280, test_f1: 0.5781
 epoch: 28, train_loss: 0.6424, test_loss: 1.1590, test_f1: 0.5739
 epoch: 29, train_loss: 0.6435, test_loss: 1.0616, test_f1: 0.6064
 epoch: 30, train_loss: 0.6236, test_loss: 1.2859, test_f1: 0.5720
 epoch: 31, train_loss: 0.6367, test_loss: 1.2447, test_f1: 0.5273
 epoch: 32, train_loss: 0.6148, test_loss: 1.1952, test_f1: 0.5833
 epoch: 33, train_loss: 0.5922, test_loss: 1.1257, test_f1: 0.6167
 epoch: 34, train_loss: 0.5951, test_loss: 1.2644, test_f1: 0.5650
 epoch: 35, train_loss: 0.5785, test_loss: 1.1380, test_f1: 0.6069
 epoch: 36, train_loss: 0.5859, test_loss: 1.2510, test_f1: 0.5681
 epoch: 37, train_loss: 0.5481, test_loss: 1.2927, test_f1: 0.5928
 epoch: 38, train_loss: 0.5906, test_loss: 1.2924, test_f1: 0.5777
 epoch: 39, train_loss: 0.5968, test_loss: 1.1098, test_f1: 0.6496
 epoch: 40, train_loss: 0.5695, test_loss: 1.1527, test_f1: 0.6281
 epoch: 41, train_loss: 0.5519, test_loss: 1.1530, test_f1: 0.6410
 epoch: 42, train_loss: 0.5125, test_loss: 1.4339, test_f1: 0.5220
 epoch: 43, train_loss: 0.5229, test_loss: 1.3191, test_f1: 0.5859
 epoch: 44, train_loss: 0.5495, test_loss: 1.3472, test_f1: 0.5925
 epoch: 45, train_loss: 0.5528, test_loss: 1.2379, test_f1: 0.6183
 epoch: 46, train_loss: 0.5138, test_loss: 1.3276, test_f1: 0.6188
 epoch: 47, train_loss: 0.5111, test_loss: 1.2182, test_f1: 0.6502
 epoch: 48, train_loss: 0.5006, test_loss: 1.4051, test_f1: 0.6030
 epoch: 49, train_loss: 0.5085, test_loss: 1.4243, test_f1: 0.6184
 epoch: 50, train_loss: 0.4853, test_loss: 1.1839, test_f1: 0.6032
 epoch: 51, train_loss: 0.4364, test_loss: 1.2697, test_f1: 0.6298
 epoch: 52, train_loss: 0.4423, test_loss: 1.2637, test_f1: 0.6095
 epoch: 53, train_loss: 0.4210, test_loss: 1.3684, test_f1: 0.6182
 epoch: 54, train_loss: 0.4261, test_loss: 1.4549, test_f1: 0.6111
 epoch: 55, train_loss: 0.4084, test_loss: 1.4537, test_f1: 0.6182
 epoch: 56, train_loss: 0.4369, test_loss: 1.4431, test_f1: 0.6149
 epoch: 57, train_loss: 0.4079, test_loss: 1.4854, test_f1: 0.6193
 epoch: 58, train_loss: 0.3858, test_loss: 1.5220, test_f1: 0.5555
 epoch: 59, train_loss: 0.3899, test_loss: 1.4532, test_f1: 0.6235
 epoch: 60, train_loss: 0.3812, test_loss: 1.5756, test_f1: 0.6191
 epoch: 61, train_loss: 0.3734, test_loss: 1.5627, test_f1: 0.6023
 epoch: 62, train_loss: 0.3933, test_loss: 1.5848, test_f1: 0.6141
 epoch: 63, train_loss: 0.3719, test_loss: 1.5954, test_f1: 0.6252
 epoch: 64, train_loss: 0.3880, test_loss: 1.6320, test_f1: 0.6127
 epoch: 65, train_loss: 0.3814, test_loss: 1.6126, test_f1: 0.6324
 epoch: 66, train_loss: 0.3862, test_loss: 1.4876, test_f1: 0.6163
 epoch: 67, train_loss: 0.3640, test_loss: 1.6790, test_f1: 0.6009
 epoch: 68, train_loss: 0.3778, test_loss: 1.6088, test_f1: 0.6332
 epoch: 69, train_loss: 0.3631, test_loss: 1.6762, test_f1: 0.5902
 epoch: 70, train_loss: 0.3459, test_loss: 1.5262, test_f1: 0.6429
 epoch: 71, train_loss: 0.3239, test_loss: 1.7597, test_f1: 0.6001
 epoch: 72, train_loss: 0.3273, test_loss: 1.7907, test_f1: 0.6168
 epoch: 73, train_loss: 0.3288, test_loss: 1.6885, test_f1: 0.6059
 epoch: 74, train_loss: 0.3579, test_loss: 1.9254, test_f1: 0.5967
 epoch: 75, train_loss: 0.3589, test_loss: 1.7430, test_f1: 0.5868
 epoch: 76, train_loss: 0.3354, test_loss: 1.7828, test_f1: 0.5877
 epoch: 77, train_loss: 0.3230, test_loss: 1.8413, test_f1: 0.6275
 epoch: 78, train_loss: 0.3383, test_loss: 1.8983, test_f1: 0.6326
 epoch: 79, train_loss: 0.3144, test_loss: 1.9286, test_f1: 0.6276
 epoch: 80, train_loss: 0.3159, test_loss: 1.8136, test_f1: 0.6206
 epoch: 81, train_loss: 0.3054, test_loss: 1.8852, test_f1: 0.6336
 epoch: 82, train_loss: 0.3257, test_loss: 1.9000, test_f1: 0.6237
 epoch: 83, train_loss: 0.3221, test_loss: 1.9174, test_f1: 0.6244
 epoch: 84, train_loss: 0.3541, test_loss: 1.9051, test_f1: 0.6232
 epoch: 85, train_loss: 0.3270, test_loss: 1.9183, test_f1: 0.6101
 epoch: 86, train_loss: 0.2957, test_loss: 1.9212, test_f1: 0.6291
 epoch: 87, train_loss: 0.2852, test_loss: 1.9138, test_f1: 0.6197
 epoch: 88, train_loss: 0.2909, test_loss: 1.8891, test_f1: 0.6191
 epoch: 89, train_loss: 0.3327, test_loss: 1.9598, test_f1: 0.6118
 epoch: 90, train_loss: 0.2962, test_loss: 2.0302, test_f1: 0.6062
 epoch: 91, train_loss: 0.2995, test_loss: 2.0848, test_f1: 0.6255
 epoch: 92, train_loss: 0.2964, test_loss: 1.9675, test_f1: 0.6260
 epoch: 93, train_loss: 0.2842, test_loss: 2.0148, test_f1: 0.6338
 epoch: 94, train_loss: 0.2868, test_loss: 2.0088, test_f1: 0.6264
 epoch: 95, train_loss: 0.2702, test_loss: 2.0423, test_f1: 0.6186
 epoch: 96, train_loss: 0.2747, test_loss: 2.0999, test_f1: 0.6152
 epoch: 97, train_loss: 0.2825, test_loss: 2.0497, test_f1: 0.6074
 epoch: 98, train_loss: 0.2882, test_loss: 2.2185, test_f1: 0.5667
 epoch: 99, train_loss: 0.3197, test_loss: 2.0102, test_f1: 0.6385
##################ITERATION #3 ****************************************
 epoch: 0, train_loss: 1.1740, test_loss: 1.3620, test_f1: 0.1459
 epoch: 1, train_loss: 1.0193, test_loss: 1.0401, test_f1: 0.4491
 epoch: 2, train_loss: 0.9987, test_loss: 1.0215, test_f1: 0.5077
 epoch: 3, train_loss: 0.9564, test_loss: 1.0402, test_f1: 0.5068
 epoch: 4, train_loss: 0.9456, test_loss: 1.0202, test_f1: 0.5365
 epoch: 5, train_loss: 0.9227, test_loss: 1.0372, test_f1: 0.5104
 epoch: 6, train_loss: 0.9047, test_loss: 1.0679, test_f1: 0.5154
 epoch: 7, train_loss: 0.8791, test_loss: 1.0242, test_f1: 0.5503
 epoch: 8, train_loss: 0.8878, test_loss: 1.0216, test_f1: 0.5371
 epoch: 9, train_loss: 0.8670, test_loss: 1.0200, test_f1: 0.5412
 epoch: 10, train_loss: 0.8656, test_loss: 1.0239, test_f1: 0.5877
 epoch: 11, train_loss: 0.8533, test_loss: 1.0141, test_f1: 0.5864
 epoch: 12, train_loss: 0.8229, test_loss: 1.1283, test_f1: 0.5142
 epoch: 13, train_loss: 0.8408, test_loss: 1.0431, test_f1: 0.5810
 epoch: 14, train_loss: 0.8088, test_loss: 0.9899, test_f1: 0.6182
 epoch: 15, train_loss: 0.7983, test_loss: 1.0219, test_f1: 0.6051
 epoch: 16, train_loss: 0.7666, test_loss: 1.0358, test_f1: 0.6250
 epoch: 17, train_loss: 0.7981, test_loss: 1.0435, test_f1: 0.6115
 epoch: 18, train_loss: 0.7753, test_loss: 1.2189, test_f1: 0.5819
 epoch: 19, train_loss: 0.7490, test_loss: 1.0816, test_f1: 0.5440
 epoch: 20, train_loss: 0.7459, test_loss: 1.1034, test_f1: 0.5293
 epoch: 21, train_loss: 0.7318, test_loss: 1.0794, test_f1: 0.6089
 epoch: 22, train_loss: 0.7285, test_loss: 1.0725, test_f1: 0.5953
 epoch: 23, train_loss: 0.7211, test_loss: 1.0543, test_f1: 0.5965
 epoch: 24, train_loss: 0.7070, test_loss: 1.1382, test_f1: 0.5919
 epoch: 25, train_loss: 0.7092, test_loss: 1.0584, test_f1: 0.5517
 epoch: 26, train_loss: 0.6887, test_loss: 1.0954, test_f1: 0.5900
 epoch: 27, train_loss: 0.6902, test_loss: 1.0946, test_f1: 0.6453
 epoch: 28, train_loss: 0.6584, test_loss: 1.1243, test_f1: 0.5985
 epoch: 29, train_loss: 0.6778, test_loss: 1.0634, test_f1: 0.6544
 epoch: 30, train_loss: 0.6728, test_loss: 1.1663, test_f1: 0.5929
 epoch: 31, train_loss: 0.6746, test_loss: 1.1687, test_f1: 0.5660
 epoch: 32, train_loss: 0.6420, test_loss: 1.1447, test_f1: 0.5968
 epoch: 33, train_loss: 0.6269, test_loss: 1.1720, test_f1: 0.6033
 epoch: 34, train_loss: 0.6518, test_loss: 1.2961, test_f1: 0.5706
 epoch: 35, train_loss: 0.6452, test_loss: 1.2655, test_f1: 0.6343
 epoch: 36, train_loss: 0.6390, test_loss: 1.1683, test_f1: 0.6072
 epoch: 37, train_loss: 0.6215, test_loss: 1.3617, test_f1: 0.5892
 epoch: 38, train_loss: 0.5880, test_loss: 1.2666, test_f1: 0.5772
 epoch: 39, train_loss: 0.5940, test_loss: 1.3774, test_f1: 0.5707
 epoch: 40, train_loss: 0.5864, test_loss: 1.3243, test_f1: 0.5758
 epoch: 41, train_loss: 0.5821, test_loss: 1.3836, test_f1: 0.5679
 epoch: 42, train_loss: 0.5745, test_loss: 1.3355, test_f1: 0.6211
 epoch: 43, train_loss: 0.6092, test_loss: 1.6357, test_f1: 0.5643
 epoch: 44, train_loss: 0.5906, test_loss: 1.3884, test_f1: 0.5668
 epoch: 45, train_loss: 0.5502, test_loss: 1.8056, test_f1: 0.5495
 epoch: 46, train_loss: 0.5555, test_loss: 1.6698, test_f1: 0.6034
 epoch: 47, train_loss: 0.5870, test_loss: 1.4269, test_f1: 0.6086
 epoch: 48, train_loss: 0.5342, test_loss: 1.5076, test_f1: 0.6224
 epoch: 49, train_loss: 0.5395, test_loss: 1.3492, test_f1: 0.6292
 epoch: 50, train_loss: 0.5635, test_loss: 1.3545, test_f1: 0.6392
 epoch: 51, train_loss: 0.5035, test_loss: 1.3858, test_f1: 0.6289
 epoch: 52, train_loss: 0.5058, test_loss: 1.4260, test_f1: 0.6174
 epoch: 53, train_loss: 0.4763, test_loss: 1.4305, test_f1: 0.6408
 epoch: 54, train_loss: 0.4793, test_loss: 1.3998, test_f1: 0.6575
 epoch: 55, train_loss: 0.4801, test_loss: 1.4853, test_f1: 0.6003
 epoch: 56, train_loss: 0.4556, test_loss: 1.4921, test_f1: 0.6375
 epoch: 57, train_loss: 0.4441, test_loss: 1.5003, test_f1: 0.6304
 epoch: 58, train_loss: 0.4561, test_loss: 1.5007, test_f1: 0.6340
 epoch: 59, train_loss: 0.4535, test_loss: 1.6334, test_f1: 0.6158
 epoch: 60, train_loss: 0.4454, test_loss: 1.5895, test_f1: 0.6193
 epoch: 61, train_loss: 0.4369, test_loss: 1.6362, test_f1: 0.6298
 epoch: 62, train_loss: 0.4608, test_loss: 1.5875, test_f1: 0.6353
 epoch: 63, train_loss: 0.4702, test_loss: 1.6186, test_f1: 0.5825
 epoch: 64, train_loss: 0.4551, test_loss: 1.6891, test_f1: 0.6031
 epoch: 65, train_loss: 0.4555, test_loss: 1.6105, test_f1: 0.6279
 epoch: 66, train_loss: 0.4099, test_loss: 1.6437, test_f1: 0.6430
 epoch: 67, train_loss: 0.4211, test_loss: 1.6945, test_f1: 0.6202
 epoch: 68, train_loss: 0.4252, test_loss: 1.6928, test_f1: 0.6378
 epoch: 69, train_loss: 0.4335, test_loss: 1.6780, test_f1: 0.6327
 epoch: 70, train_loss: 0.4213, test_loss: 1.6832, test_f1: 0.6342
 epoch: 71, train_loss: 0.4017, test_loss: 1.6887, test_f1: 0.6310
 epoch: 72, train_loss: 0.4010, test_loss: 1.8235, test_f1: 0.6403
 epoch: 73, train_loss: 0.4038, test_loss: 1.7424, test_f1: 0.6153
 epoch: 74, train_loss: 0.3842, test_loss: 1.7925, test_f1: 0.6262
 epoch: 75, train_loss: 0.4252, test_loss: 1.7433, test_f1: 0.6556
 epoch: 76, train_loss: 0.3907, test_loss: 1.8564, test_f1: 0.6276
 epoch: 77, train_loss: 0.3957, test_loss: 1.8130, test_f1: 0.6242
 epoch: 78, train_loss: 0.3959, test_loss: 1.8557, test_f1: 0.6389
 epoch: 79, train_loss: 0.3777, test_loss: 1.8226, test_f1: 0.6311
 epoch: 80, train_loss: 0.3732, test_loss: 1.9212, test_f1: 0.6096
 epoch: 81, train_loss: 0.3709, test_loss: 1.9944, test_f1: 0.6210
 epoch: 82, train_loss: 0.3633, test_loss: 1.9335, test_f1: 0.6350
 epoch: 83, train_loss: 0.3801, test_loss: 1.9064, test_f1: 0.6152
 epoch: 84, train_loss: 0.3738, test_loss: 1.9242, test_f1: 0.6115
 epoch: 85, train_loss: 0.3827, test_loss: 1.8671, test_f1: 0.6542
 epoch: 86, train_loss: 0.3397, test_loss: 1.9334, test_f1: 0.6413
 epoch: 87, train_loss: 0.3423, test_loss: 2.0176, test_f1: 0.6514
 epoch: 88, train_loss: 0.3679, test_loss: 1.9807, test_f1: 0.6367
 epoch: 89, train_loss: 0.3589, test_loss: 1.9963, test_f1: 0.6399
 epoch: 90, train_loss: 0.3480, test_loss: 1.8704, test_f1: 0.6344
 epoch: 91, train_loss: 0.3332, test_loss: 1.9926, test_f1: 0.6112
 epoch: 92, train_loss: 0.3563, test_loss: 1.9947, test_f1: 0.6407
 epoch: 93, train_loss: 0.3332, test_loss: 1.9635, test_f1: 0.6390
 epoch: 94, train_loss: 0.3716, test_loss: 1.9426, test_f1: 0.6257
 epoch: 95, train_loss: 0.3382, test_loss: 2.0432, test_f1: 0.6455
 epoch: 96, train_loss: 0.3382, test_loss: 1.9682, test_f1: 0.6332
 epoch: 97, train_loss: 0.3390, test_loss: 2.0679, test_f1: 0.6257
 epoch: 98, train_loss: 0.3457, test_loss: 2.0496, test_f1: 0.6272
 epoch: 99, train_loss: 0.3246, test_loss: 2.0418, test_f1: 0.6152
##################ITERATION #4 ****************************************
 epoch: 0, train_loss: 1.2716, test_loss: 1.3897, test_f1: 0.1361
 epoch: 1, train_loss: 1.0720, test_loss: 1.1286, test_f1: 0.4677
 epoch: 2, train_loss: 1.0268, test_loss: 1.0386, test_f1: 0.5357
 epoch: 3, train_loss: 0.9748, test_loss: 1.0508, test_f1: 0.5742
 epoch: 4, train_loss: 0.9679, test_loss: 1.0406, test_f1: 0.5423
 epoch: 5, train_loss: 0.9365, test_loss: 1.0369, test_f1: 0.5752
 epoch: 6, train_loss: 0.9364, test_loss: 1.0116, test_f1: 0.5721
 epoch: 7, train_loss: 0.9280, test_loss: 0.9892, test_f1: 0.5801
 epoch: 8, train_loss: 0.9066, test_loss: 1.0295, test_f1: 0.5393
 epoch: 9, train_loss: 0.8838, test_loss: 1.0063, test_f1: 0.5562
 epoch: 10, train_loss: 0.8669, test_loss: 0.9775, test_f1: 0.5770
 epoch: 11, train_loss: 0.8615, test_loss: 1.0337, test_f1: 0.5822
 epoch: 12, train_loss: 0.8670, test_loss: 1.0349, test_f1: 0.5646
 epoch: 13, train_loss: 0.8364, test_loss: 0.9958, test_f1: 0.5494
 epoch: 14, train_loss: 0.8035, test_loss: 0.9899, test_f1: 0.5772
 epoch: 15, train_loss: 0.8028, test_loss: 1.0111, test_f1: 0.5624
 epoch: 16, train_loss: 0.8116, test_loss: 0.9455, test_f1: 0.6125
 epoch: 17, train_loss: 0.7988, test_loss: 0.9727, test_f1: 0.5946
 epoch: 18, train_loss: 0.7778, test_loss: 0.9797, test_f1: 0.5988
 epoch: 19, train_loss: 0.7835, test_loss: 0.9674, test_f1: 0.6049
 epoch: 20, train_loss: 0.7345, test_loss: 0.9746, test_f1: 0.5928
 epoch: 21, train_loss: 0.7538, test_loss: 1.0830, test_f1: 0.6249
 epoch: 22, train_loss: 0.7244, test_loss: 1.0100, test_f1: 0.5962
 epoch: 23, train_loss: 0.7215, test_loss: 1.1709, test_f1: 0.5591
 epoch: 24, train_loss: 0.7215, test_loss: 0.9818, test_f1: 0.6087
 epoch: 25, train_loss: 0.6885, test_loss: 1.0619, test_f1: 0.6323
 epoch: 26, train_loss: 0.6892, test_loss: 1.0196, test_f1: 0.6418
 epoch: 27, train_loss: 0.6672, test_loss: 1.0934, test_f1: 0.6064
 epoch: 28, train_loss: 0.6875, test_loss: 1.1101, test_f1: 0.5993
 epoch: 29, train_loss: 0.6484, test_loss: 1.0942, test_f1: 0.6119
 epoch: 30, train_loss: 0.6473, test_loss: 1.0348, test_f1: 0.6533
 epoch: 31, train_loss: 0.6397, test_loss: 1.1116, test_f1: 0.6006
 epoch: 32, train_loss: 0.6542, test_loss: 1.1860, test_f1: 0.6011
 epoch: 33, train_loss: 0.6282, test_loss: 1.1645, test_f1: 0.6041
 epoch: 34, train_loss: 0.6164, test_loss: 1.1682, test_f1: 0.6256
 epoch: 35, train_loss: 0.6143, test_loss: 1.1840, test_f1: 0.5838
 epoch: 36, train_loss: 0.5959, test_loss: 1.1783, test_f1: 0.6248
 epoch: 37, train_loss: 0.5998, test_loss: 1.2062, test_f1: 0.6269
 epoch: 38, train_loss: 0.6021, test_loss: 1.1874, test_f1: 0.6306
 epoch: 39, train_loss: 0.5991, test_loss: 1.2777, test_f1: 0.6256
 epoch: 40, train_loss: 0.6098, test_loss: 1.2536, test_f1: 0.6100
 epoch: 41, train_loss: 0.5764, test_loss: 1.2243, test_f1: 0.6231
 epoch: 42, train_loss: 0.5717, test_loss: 1.2473, test_f1: 0.6368
 epoch: 43, train_loss: 0.5934, test_loss: 1.2269, test_f1: 0.6245
 epoch: 44, train_loss: 0.5778, test_loss: 1.1912, test_f1: 0.6111
 epoch: 45, train_loss: 0.5682, test_loss: 1.2362, test_f1: 0.6122
 epoch: 46, train_loss: 0.5624, test_loss: 1.2693, test_f1: 0.6010
 epoch: 47, train_loss: 0.5242, test_loss: 1.2015, test_f1: 0.6153
 epoch: 48, train_loss: 0.5152, test_loss: 1.3212, test_f1: 0.6085
 epoch: 49, train_loss: 0.5421, test_loss: 1.2544, test_f1: 0.6169
 epoch: 50, train_loss: 0.5422, test_loss: 1.3055, test_f1: 0.5941
 epoch: 51, train_loss: 0.4919, test_loss: 1.2464, test_f1: 0.6386
 epoch: 52, train_loss: 0.4634, test_loss: 1.2819, test_f1: 0.6219
 epoch: 53, train_loss: 0.4447, test_loss: 1.2781, test_f1: 0.6384
 epoch: 54, train_loss: 0.4491, test_loss: 1.2891, test_f1: 0.6467
 epoch: 55, train_loss: 0.4445, test_loss: 1.3038, test_f1: 0.6398
 epoch: 56, train_loss: 0.4349, test_loss: 1.2848, test_f1: 0.6505
 epoch: 57, train_loss: 0.4465, test_loss: 1.2759, test_f1: 0.6510
 epoch: 58, train_loss: 0.4524, test_loss: 1.3708, test_f1: 0.6537
 epoch: 59, train_loss: 0.4334, test_loss: 1.3528, test_f1: 0.6572
 epoch: 60, train_loss: 0.4423, test_loss: 1.3301, test_f1: 0.6508
 epoch: 61, train_loss: 0.4641, test_loss: 1.3692, test_f1: 0.6360
 epoch: 62, train_loss: 0.4363, test_loss: 1.3635, test_f1: 0.6313
 epoch: 63, train_loss: 0.4235, test_loss: 1.3977, test_f1: 0.6357
 epoch: 64, train_loss: 0.4196, test_loss: 1.4290, test_f1: 0.6368
 epoch: 65, train_loss: 0.4130, test_loss: 1.4908, test_f1: 0.6351
 epoch: 66, train_loss: 0.4380, test_loss: 1.4936, test_f1: 0.6333
 epoch: 67, train_loss: 0.4114, test_loss: 1.4234, test_f1: 0.6397
 epoch: 68, train_loss: 0.3800, test_loss: 1.4841, test_f1: 0.6394
 epoch: 69, train_loss: 0.3807, test_loss: 1.4698, test_f1: 0.6445
 epoch: 70, train_loss: 0.4024, test_loss: 1.5342, test_f1: 0.6411
 epoch: 71, train_loss: 0.3926, test_loss: 1.4801, test_f1: 0.6419
 epoch: 72, train_loss: 0.3683, test_loss: 1.4470, test_f1: 0.6494
 epoch: 73, train_loss: 0.3545, test_loss: 1.5447, test_f1: 0.6415
 epoch: 74, train_loss: 0.3626, test_loss: 1.6357, test_f1: 0.6000
 epoch: 75, train_loss: 0.3885, test_loss: 1.5064, test_f1: 0.6110
 epoch: 76, train_loss: 0.3892, test_loss: 1.5937, test_f1: 0.6316
 epoch: 77, train_loss: 0.3460, test_loss: 1.6545, test_f1: 0.6295
 epoch: 78, train_loss: 0.3854, test_loss: 1.5939, test_f1: 0.6100
 epoch: 79, train_loss: 0.3605, test_loss: 1.5680, test_f1: 0.6245
 epoch: 80, train_loss: 0.3694, test_loss: 1.6560, test_f1: 0.6175
 epoch: 81, train_loss: 0.3689, test_loss: 1.6102, test_f1: 0.6263
 epoch: 82, train_loss: 0.3602, test_loss: 1.6124, test_f1: 0.6138
 epoch: 83, train_loss: 0.3500, test_loss: 1.6402, test_f1: 0.6043
 epoch: 84, train_loss: 0.3482, test_loss: 1.7353, test_f1: 0.5955
 epoch: 85, train_loss: 0.3435, test_loss: 1.6711, test_f1: 0.6246
 epoch: 86, train_loss: 0.3393, test_loss: 1.7745, test_f1: 0.6018
 epoch: 87, train_loss: 0.3281, test_loss: 1.7201, test_f1: 0.6266
 epoch: 88, train_loss: 0.3367, test_loss: 1.7344, test_f1: 0.6230
 epoch: 89, train_loss: 0.3558, test_loss: 1.7801, test_f1: 0.6180
 epoch: 90, train_loss: 0.3372, test_loss: 1.7981, test_f1: 0.6120
 epoch: 91, train_loss: 0.3194, test_loss: 1.6688, test_f1: 0.6251
 epoch: 92, train_loss: 0.3508, test_loss: 1.7529, test_f1: 0.6215
 epoch: 93, train_loss: 0.3304, test_loss: 1.6631, test_f1: 0.6503
 epoch: 94, train_loss: 0.3306, test_loss: 1.7629, test_f1: 0.6341
 epoch: 95, train_loss: 0.3213, test_loss: 1.7488, test_f1: 0.6402
 epoch: 96, train_loss: 0.2956, test_loss: 1.9154, test_f1: 0.6159
 epoch: 97, train_loss: 0.3063, test_loss: 1.9047, test_f1: 0.5944
 epoch: 98, train_loss: 0.3162, test_loss: 1.8105, test_f1: 0.6265
 epoch: 99, train_loss: 0.2971, test_loss: 1.8197, test_f1: 0.6236
##################ITERATION #5 ****************************************
 epoch: 0, train_loss: 1.2930, test_loss: 1.3241, test_f1: 0.1601
 epoch: 1, train_loss: 1.0720, test_loss: 1.0900, test_f1: 0.5259
 epoch: 2, train_loss: 1.0206, test_loss: 1.1114, test_f1: 0.4922
 epoch: 3, train_loss: 0.9944, test_loss: 1.0880, test_f1: 0.4948
 epoch: 4, train_loss: 0.9588, test_loss: 1.0708, test_f1: 0.5368
 epoch: 5, train_loss: 0.9418, test_loss: 1.0402, test_f1: 0.5397
 epoch: 6, train_loss: 0.9279, test_loss: 1.0316, test_f1: 0.5508
 epoch: 7, train_loss: 0.8960, test_loss: 1.0310, test_f1: 0.5655
 epoch: 8, train_loss: 0.8868, test_loss: 0.9926, test_f1: 0.5411
 epoch: 9, train_loss: 0.8646, test_loss: 0.9728, test_f1: 0.5467
 epoch: 10, train_loss: 0.8464, test_loss: 1.0251, test_f1: 0.5130
 epoch: 11, train_loss: 0.8378, test_loss: 0.9740, test_f1: 0.5367
 epoch: 12, train_loss: 0.8076, test_loss: 0.9869, test_f1: 0.6015
 epoch: 13, train_loss: 0.8217, test_loss: 0.9989, test_f1: 0.5827
 epoch: 14, train_loss: 0.8050, test_loss: 1.0184, test_f1: 0.5473
 epoch: 15, train_loss: 0.7798, test_loss: 0.9538, test_f1: 0.5792
 epoch: 16, train_loss: 0.7667, test_loss: 1.0052, test_f1: 0.5855
 epoch: 17, train_loss: 0.7519, test_loss: 1.0054, test_f1: 0.5775
 epoch: 18, train_loss: 0.7481, test_loss: 1.0224, test_f1: 0.5504
 epoch: 19, train_loss: 0.7463, test_loss: 1.0218, test_f1: 0.6011
 epoch: 20, train_loss: 0.7502, test_loss: 1.0578, test_f1: 0.5625
 epoch: 21, train_loss: 0.7407, test_loss: 0.9907, test_f1: 0.5705
 epoch: 22, train_loss: 0.6938, test_loss: 1.0371, test_f1: 0.5579
 epoch: 23, train_loss: 0.6909, test_loss: 1.0748, test_f1: 0.5692
 epoch: 24, train_loss: 0.6829, test_loss: 1.0480, test_f1: 0.5509
 epoch: 25, train_loss: 0.6785, test_loss: 0.9868, test_f1: 0.5780
 epoch: 26, train_loss: 0.6596, test_loss: 1.1040, test_f1: 0.6055
 epoch: 27, train_loss: 0.6631, test_loss: 1.1750, test_f1: 0.5564
 epoch: 28, train_loss: 0.6782, test_loss: 1.0833, test_f1: 0.5491
 epoch: 29, train_loss: 0.6511, test_loss: 1.0414, test_f1: 0.5742
 epoch: 30, train_loss: 0.6303, test_loss: 1.1124, test_f1: 0.6057
 epoch: 31, train_loss: 0.6433, test_loss: 1.0240, test_f1: 0.6008
 epoch: 32, train_loss: 0.6207, test_loss: 1.0790, test_f1: 0.6059
 epoch: 33, train_loss: 0.6220, test_loss: 1.0883, test_f1: 0.5326
 epoch: 34, train_loss: 0.6359, test_loss: 1.0489, test_f1: 0.6279
 epoch: 35, train_loss: 0.6011, test_loss: 1.0877, test_f1: 0.5445
 epoch: 36, train_loss: 0.5979, test_loss: 1.1657, test_f1: 0.5445
 epoch: 37, train_loss: 0.5805, test_loss: 1.2721, test_f1: 0.5811
 epoch: 38, train_loss: 0.5836, test_loss: 1.2795, test_f1: 0.5612
 epoch: 39, train_loss: 0.5943, test_loss: 1.1137, test_f1: 0.6233
 epoch: 40, train_loss: 0.5809, test_loss: 1.1960, test_f1: 0.5494
 epoch: 41, train_loss: 0.5784, test_loss: 1.1008, test_f1: 0.6127
 epoch: 42, train_loss: 0.5883, test_loss: 1.2199, test_f1: 0.5192
 epoch: 43, train_loss: 0.5798, test_loss: 1.1943, test_f1: 0.5896
 epoch: 44, train_loss: 0.5770, test_loss: 1.2412, test_f1: 0.6196
 epoch: 45, train_loss: 0.5649, test_loss: 1.0664, test_f1: 0.6511
 epoch: 46, train_loss: 0.5542, test_loss: 1.3014, test_f1: 0.6145
 epoch: 47, train_loss: 0.5706, test_loss: 1.1344, test_f1: 0.6420
 epoch: 48, train_loss: 0.5280, test_loss: 1.2431, test_f1: 0.6458
 epoch: 49, train_loss: 0.5452, test_loss: 1.2043, test_f1: 0.5936
 epoch: 50, train_loss: 0.5670, test_loss: 1.2530, test_f1: 0.5887
 epoch: 51, train_loss: 0.5315, test_loss: 1.2168, test_f1: 0.6545
 epoch: 52, train_loss: 0.4736, test_loss: 1.2690, test_f1: 0.6001
 epoch: 53, train_loss: 0.4677, test_loss: 1.3057, test_f1: 0.6215
 epoch: 54, train_loss: 0.4638, test_loss: 1.3337, test_f1: 0.6321
 epoch: 55, train_loss: 0.4437, test_loss: 1.3600, test_f1: 0.6193
 epoch: 56, train_loss: 0.4408, test_loss: 1.3910, test_f1: 0.6159
 epoch: 57, train_loss: 0.4681, test_loss: 1.3621, test_f1: 0.6103
 epoch: 58, train_loss: 0.4355, test_loss: 1.5023, test_f1: 0.6393
 epoch: 59, train_loss: 0.4561, test_loss: 1.4239, test_f1: 0.6151
 epoch: 60, train_loss: 0.4334, test_loss: 1.4953, test_f1: 0.6205
 epoch: 61, train_loss: 0.4370, test_loss: 1.4189, test_f1: 0.6113
 epoch: 62, train_loss: 0.4355, test_loss: 1.4094, test_f1: 0.6197
 epoch: 63, train_loss: 0.4010, test_loss: 1.4429, test_f1: 0.6206
 epoch: 64, train_loss: 0.4133, test_loss: 1.5724, test_f1: 0.6285
 epoch: 65, train_loss: 0.4051, test_loss: 1.4426, test_f1: 0.6361
 epoch: 66, train_loss: 0.4040, test_loss: 1.5831, test_f1: 0.6125
 epoch: 67, train_loss: 0.3945, test_loss: 1.5322, test_f1: 0.6190
 epoch: 68, train_loss: 0.4067, test_loss: 1.5397, test_f1: 0.6268
 epoch: 69, train_loss: 0.4128, test_loss: 1.5230, test_f1: 0.6211
 epoch: 70, train_loss: 0.3907, test_loss: 1.6934, test_f1: 0.6143
 epoch: 71, train_loss: 0.3935, test_loss: 1.5490, test_f1: 0.6071
 epoch: 72, train_loss: 0.3964, test_loss: 1.6472, test_f1: 0.6380
 epoch: 73, train_loss: 0.3756, test_loss: 1.6741, test_f1: 0.6180
 epoch: 74, train_loss: 0.3643, test_loss: 1.5900, test_f1: 0.6301
 epoch: 75, train_loss: 0.3842, test_loss: 1.7000, test_f1: 0.6408
 epoch: 76, train_loss: 0.3745, test_loss: 1.6896, test_f1: 0.6098
 epoch: 77, train_loss: 0.3977, test_loss: 1.6555, test_f1: 0.6251
 epoch: 78, train_loss: 0.3835, test_loss: 1.6026, test_f1: 0.6526
 epoch: 79, train_loss: 0.4058, test_loss: 1.7154, test_f1: 0.6222
 epoch: 80, train_loss: 0.3647, test_loss: 1.6603, test_f1: 0.6410
 epoch: 81, train_loss: 0.3786, test_loss: 1.5644, test_f1: 0.6303
 epoch: 82, train_loss: 0.3905, test_loss: 1.8472, test_f1: 0.6207
 epoch: 83, train_loss: 0.3455, test_loss: 1.7955, test_f1: 0.6281
 epoch: 84, train_loss: 0.3631, test_loss: 1.7775, test_f1: 0.6101
 epoch: 85, train_loss: 0.3510, test_loss: 1.7765, test_f1: 0.6229
 epoch: 86, train_loss: 0.3390, test_loss: 1.8973, test_f1: 0.6137
 epoch: 87, train_loss: 0.3258, test_loss: 1.9312, test_f1: 0.6122
 epoch: 88, train_loss: 0.3275, test_loss: 1.9181, test_f1: 0.6317
 epoch: 89, train_loss: 0.3500, test_loss: 1.8748, test_f1: 0.6243
 epoch: 90, train_loss: 0.3589, test_loss: 1.8564, test_f1: 0.6241
 epoch: 91, train_loss: 0.3374, test_loss: 1.9592, test_f1: 0.6203
 epoch: 92, train_loss: 0.3564, test_loss: 1.9325, test_f1: 0.6061
 epoch: 93, train_loss: 0.3355, test_loss: 1.8290, test_f1: 0.6151
 epoch: 94, train_loss: 0.3395, test_loss: 2.0319, test_f1: 0.6138
 epoch: 95, train_loss: 0.3383, test_loss: 1.8778, test_f1: 0.6069
 epoch: 96, train_loss: 0.3389, test_loss: 1.9208, test_f1: 0.6000
 epoch: 97, train_loss: 0.3330, test_loss: 1.9122, test_f1: 0.6183
 epoch: 98, train_loss: 0.3041, test_loss: 1.9834, test_f1: 0.6337
 epoch: 99, train_loss: 0.3525, test_loss: 1.9482, test_f1: 0.6056
##################ITERATION #6 ****************************************
 epoch: 0, train_loss: 1.2450, test_loss: 1.8810, test_f1: 0.1014
 epoch: 1, train_loss: 1.0676, test_loss: 1.0855, test_f1: 0.5155
 epoch: 2, train_loss: 1.0106, test_loss: 1.0676, test_f1: 0.4854
 epoch: 3, train_loss: 0.9547, test_loss: 1.0571, test_f1: 0.5364
 epoch: 4, train_loss: 0.9696, test_loss: 1.0732, test_f1: 0.5390
 epoch: 5, train_loss: 0.9331, test_loss: 1.0492, test_f1: 0.5535
 epoch: 6, train_loss: 0.9315, test_loss: 1.0501, test_f1: 0.5623
 epoch: 7, train_loss: 0.9037, test_loss: 1.0340, test_f1: 0.5221
 epoch: 8, train_loss: 0.9142, test_loss: 1.0300, test_f1: 0.5550
 epoch: 9, train_loss: 0.8904, test_loss: 1.0130, test_f1: 0.5762
 epoch: 10, train_loss: 0.8704, test_loss: 1.0431, test_f1: 0.5723
 epoch: 11, train_loss: 0.8489, test_loss: 1.0474, test_f1: 0.5709
 epoch: 12, train_loss: 0.8514, test_loss: 1.0250, test_f1: 0.5410
 epoch: 13, train_loss: 0.8509, test_loss: 1.0169, test_f1: 0.5462
 epoch: 14, train_loss: 0.8312, test_loss: 1.0350, test_f1: 0.5726
 epoch: 15, train_loss: 0.8205, test_loss: 1.0827, test_f1: 0.5547
 epoch: 16, train_loss: 0.8304, test_loss: 1.0281, test_f1: 0.6336
 epoch: 17, train_loss: 0.8032, test_loss: 1.0265, test_f1: 0.6214
 epoch: 18, train_loss: 0.7845, test_loss: 0.9853, test_f1: 0.6242
 epoch: 19, train_loss: 0.7585, test_loss: 1.0209, test_f1: 0.5923
 epoch: 20, train_loss: 0.7607, test_loss: 0.9911, test_f1: 0.6217
 epoch: 21, train_loss: 0.7634, test_loss: 1.0258, test_f1: 0.6121
 epoch: 22, train_loss: 0.7364, test_loss: 1.0509, test_f1: 0.5945
 epoch: 23, train_loss: 0.7456, test_loss: 1.0922, test_f1: 0.5975
 epoch: 24, train_loss: 0.7051, test_loss: 1.0427, test_f1: 0.5924
 epoch: 25, train_loss: 0.7161, test_loss: 1.0586, test_f1: 0.5975
 epoch: 26, train_loss: 0.7270, test_loss: 1.0929, test_f1: 0.5875
 epoch: 27, train_loss: 0.6907, test_loss: 1.0845, test_f1: 0.5994
 epoch: 28, train_loss: 0.6894, test_loss: 1.1625, test_f1: 0.5442
 epoch: 29, train_loss: 0.6913, test_loss: 1.0721, test_f1: 0.6175
 epoch: 30, train_loss: 0.6695, test_loss: 1.0584, test_f1: 0.6202
 epoch: 31, train_loss: 0.7003, test_loss: 1.1664, test_f1: 0.6072
 epoch: 32, train_loss: 0.6948, test_loss: 1.0922, test_f1: 0.6171
 epoch: 33, train_loss: 0.6483, test_loss: 1.1420, test_f1: 0.5835
 epoch: 34, train_loss: 0.6303, test_loss: 1.0830, test_f1: 0.6393
 epoch: 35, train_loss: 0.6282, test_loss: 1.1739, test_f1: 0.6140
 epoch: 36, train_loss: 0.6063, test_loss: 1.1717, test_f1: 0.6141
 epoch: 37, train_loss: 0.6327, test_loss: 1.1875, test_f1: 0.6275
 epoch: 38, train_loss: 0.6206, test_loss: 1.1927, test_f1: 0.5749
 epoch: 39, train_loss: 0.6163, test_loss: 1.1779, test_f1: 0.6255
 epoch: 40, train_loss: 0.6049, test_loss: 1.1950, test_f1: 0.6067
 epoch: 41, train_loss: 0.6101, test_loss: 1.2087, test_f1: 0.6071
 epoch: 42, train_loss: 0.6110, test_loss: 1.2320, test_f1: 0.6382
 epoch: 43, train_loss: 0.5901, test_loss: 1.2382, test_f1: 0.5756
 epoch: 44, train_loss: 0.6015, test_loss: 1.2420, test_f1: 0.5711
 epoch: 45, train_loss: 0.5628, test_loss: 1.2245, test_f1: 0.6125
 epoch: 46, train_loss: 0.5650, test_loss: 1.2448, test_f1: 0.6156
 epoch: 47, train_loss: 0.5816, test_loss: 1.2225, test_f1: 0.5532
 epoch: 48, train_loss: 0.5655, test_loss: 1.2192, test_f1: 0.6069
 epoch: 49, train_loss: 0.5985, test_loss: 1.2294, test_f1: 0.6087
 epoch: 50, train_loss: 0.5600, test_loss: 1.2880, test_f1: 0.6202
 epoch: 51, train_loss: 0.5528, test_loss: 1.3213, test_f1: 0.5909
 epoch: 52, train_loss: 0.5001, test_loss: 1.2865, test_f1: 0.6305
 epoch: 53, train_loss: 0.5081, test_loss: 1.3595, test_f1: 0.6218
 epoch: 54, train_loss: 0.4888, test_loss: 1.3118, test_f1: 0.6101
 epoch: 55, train_loss: 0.4845, test_loss: 1.3210, test_f1: 0.6266
 epoch: 56, train_loss: 0.4962, test_loss: 1.3002, test_f1: 0.6147
 epoch: 57, train_loss: 0.4796, test_loss: 1.3634, test_f1: 0.6293
 epoch: 58, train_loss: 0.4940, test_loss: 1.4292, test_f1: 0.5997
 epoch: 59, train_loss: 0.4814, test_loss: 1.3480, test_f1: 0.6293
 epoch: 60, train_loss: 0.4676, test_loss: 1.4295, test_f1: 0.6308
 epoch: 61, train_loss: 0.4575, test_loss: 1.4143, test_f1: 0.6221
 epoch: 62, train_loss: 0.4479, test_loss: 1.4352, test_f1: 0.6041
 epoch: 63, train_loss: 0.4465, test_loss: 1.4704, test_f1: 0.6070
 epoch: 64, train_loss: 0.4452, test_loss: 1.4596, test_f1: 0.6451
 epoch: 65, train_loss: 0.4143, test_loss: 1.5210, test_f1: 0.6564
 epoch: 66, train_loss: 0.4350, test_loss: 1.5570, test_f1: 0.5967
 epoch: 67, train_loss: 0.4473, test_loss: 1.5559, test_f1: 0.5957
 epoch: 68, train_loss: 0.4285, test_loss: 1.6069, test_f1: 0.5868
 epoch: 69, train_loss: 0.4355, test_loss: 1.5586, test_f1: 0.5931
 epoch: 70, train_loss: 0.4432, test_loss: 1.4854, test_f1: 0.6096
 epoch: 71, train_loss: 0.4139, test_loss: 1.5856, test_f1: 0.5860
 epoch: 72, train_loss: 0.4208, test_loss: 1.5380, test_f1: 0.6182
 epoch: 73, train_loss: 0.4257, test_loss: 1.5132, test_f1: 0.6201
 epoch: 74, train_loss: 0.4212, test_loss: 1.6304, test_f1: 0.6187
 epoch: 75, train_loss: 0.4173, test_loss: 1.5829, test_f1: 0.6224
 epoch: 76, train_loss: 0.4005, test_loss: 1.6400, test_f1: 0.5962
 epoch: 77, train_loss: 0.3981, test_loss: 1.6319, test_f1: 0.6208
 epoch: 78, train_loss: 0.4150, test_loss: 1.6638, test_f1: 0.6079
 epoch: 79, train_loss: 0.4188, test_loss: 1.5765, test_f1: 0.6132
 epoch: 80, train_loss: 0.3917, test_loss: 1.7530, test_f1: 0.5825
 epoch: 81, train_loss: 0.4162, test_loss: 1.7046, test_f1: 0.5888
 epoch: 82, train_loss: 0.3935, test_loss: 1.7952, test_f1: 0.5780
 epoch: 83, train_loss: 0.3903, test_loss: 1.6583, test_f1: 0.6003
 epoch: 84, train_loss: 0.3888, test_loss: 1.6794, test_f1: 0.5947
 epoch: 85, train_loss: 0.3861, test_loss: 1.6673, test_f1: 0.6335
 epoch: 86, train_loss: 0.3864, test_loss: 1.7156, test_f1: 0.6283
 epoch: 87, train_loss: 0.3989, test_loss: 1.7084, test_f1: 0.6145
 epoch: 88, train_loss: 0.3828, test_loss: 1.7366, test_f1: 0.6229
 epoch: 89, train_loss: 0.3824, test_loss: 1.8089, test_f1: 0.6162
 epoch: 90, train_loss: 0.3688, test_loss: 1.8355, test_f1: 0.6162
 epoch: 91, train_loss: 0.3601, test_loss: 1.7459, test_f1: 0.6414
 epoch: 92, train_loss: 0.3731, test_loss: 1.7921, test_f1: 0.6360
 epoch: 93, train_loss: 0.3620, test_loss: 1.8366, test_f1: 0.5970
 epoch: 94, train_loss: 0.3588, test_loss: 1.8459, test_f1: 0.6117
 epoch: 95, train_loss: 0.3902, test_loss: 1.8543, test_f1: 0.5919
 epoch: 96, train_loss: 0.3504, test_loss: 1.8736, test_f1: 0.6153
 epoch: 97, train_loss: 0.3605, test_loss: 1.8390, test_f1: 0.6222
 epoch: 98, train_loss: 0.3392, test_loss: 1.8021, test_f1: 0.6302
 epoch: 99, train_loss: 0.3577, test_loss: 1.9220, test_f1: 0.6255
##################ITERATION #7 ****************************************
 epoch: 0, train_loss: 1.3708, test_loss: 1.3077, test_f1: 0.2754
 epoch: 1, train_loss: 1.1259, test_loss: 1.1301, test_f1: 0.4871
 epoch: 2, train_loss: 1.0440, test_loss: 1.0724, test_f1: 0.5476
 epoch: 3, train_loss: 1.0087, test_loss: 1.0781, test_f1: 0.5331
 epoch: 4, train_loss: 0.9833, test_loss: 1.0630, test_f1: 0.5372
 epoch: 5, train_loss: 0.9794, test_loss: 1.0658, test_f1: 0.5357
 epoch: 6, train_loss: 0.9435, test_loss: 1.0391, test_f1: 0.5658
 epoch: 7, train_loss: 0.9460, test_loss: 1.0416, test_f1: 0.5328
 epoch: 8, train_loss: 0.9339, test_loss: 1.0460, test_f1: 0.5544
 epoch: 9, train_loss: 0.9265, test_loss: 1.0360, test_f1: 0.5701
 epoch: 10, train_loss: 0.9208, test_loss: 1.0311, test_f1: 0.5619
 epoch: 11, train_loss: 0.8952, test_loss: 1.0295, test_f1: 0.5119
 epoch: 12, train_loss: 0.8892, test_loss: 1.0269, test_f1: 0.5861
 epoch: 13, train_loss: 0.8719, test_loss: 1.0087, test_f1: 0.5558
 epoch: 14, train_loss: 0.8635, test_loss: 1.0019, test_f1: 0.5622
 epoch: 15, train_loss: 0.8334, test_loss: 1.0454, test_f1: 0.5470
 epoch: 16, train_loss: 0.8248, test_loss: 1.0144, test_f1: 0.5073
 epoch: 17, train_loss: 0.8414, test_loss: 1.0172, test_f1: 0.5422
 epoch: 18, train_loss: 0.8319, test_loss: 1.0227, test_f1: 0.5563
 epoch: 19, train_loss: 0.8169, test_loss: 0.9907, test_f1: 0.5395
 epoch: 20, train_loss: 0.7909, test_loss: 0.9556, test_f1: 0.5944
 epoch: 21, train_loss: 0.7794, test_loss: 0.9906, test_f1: 0.5996
 epoch: 22, train_loss: 0.7671, test_loss: 1.0105, test_f1: 0.5848
 epoch: 23, train_loss: 0.7699, test_loss: 1.0072, test_f1: 0.5992
 epoch: 24, train_loss: 0.7592, test_loss: 0.9939, test_f1: 0.5580
 epoch: 25, train_loss: 0.7747, test_loss: 1.0157, test_f1: 0.5770
 epoch: 26, train_loss: 0.7378, test_loss: 1.0012, test_f1: 0.6028
 epoch: 27, train_loss: 0.7134, test_loss: 1.0827, test_f1: 0.6014
 epoch: 28, train_loss: 0.7048, test_loss: 1.0622, test_f1: 0.6035
 epoch: 29, train_loss: 0.7030, test_loss: 1.0705, test_f1: 0.5802
 epoch: 30, train_loss: 0.7010, test_loss: 1.1097, test_f1: 0.5790
 epoch: 31, train_loss: 0.6946, test_loss: 1.0638, test_f1: 0.5976
 epoch: 32, train_loss: 0.7027, test_loss: 1.0887, test_f1: 0.5860
 epoch: 33, train_loss: 0.6829, test_loss: 1.0353, test_f1: 0.5806
 epoch: 34, train_loss: 0.6691, test_loss: 1.1277, test_f1: 0.6149
 epoch: 35, train_loss: 0.6604, test_loss: 1.1432, test_f1: 0.5384
 epoch: 36, train_loss: 0.6387, test_loss: 1.1112, test_f1: 0.5917
 epoch: 37, train_loss: 0.6526, test_loss: 1.0974, test_f1: 0.6099
 epoch: 38, train_loss: 0.6311, test_loss: 1.0723, test_f1: 0.6029
 epoch: 39, train_loss: 0.6312, test_loss: 1.0535, test_f1: 0.6237
 epoch: 40, train_loss: 0.6236, test_loss: 1.1791, test_f1: 0.5999
 epoch: 41, train_loss: 0.6028, test_loss: 1.1244, test_f1: 0.5986
 epoch: 42, train_loss: 0.5978, test_loss: 1.1284, test_f1: 0.5911
 epoch: 43, train_loss: 0.5758, test_loss: 1.1568, test_f1: 0.5904
 epoch: 44, train_loss: 0.5795, test_loss: 1.1651, test_f1: 0.5942
 epoch: 45, train_loss: 0.6012, test_loss: 1.1572, test_f1: 0.5981
 epoch: 46, train_loss: 0.5692, test_loss: 1.2784, test_f1: 0.5988
 epoch: 47, train_loss: 0.5735, test_loss: 1.1760, test_f1: 0.5984
 epoch: 48, train_loss: 0.5791, test_loss: 1.3297, test_f1: 0.6199
 epoch: 49, train_loss: 0.5706, test_loss: 1.1859, test_f1: 0.6251
 epoch: 50, train_loss: 0.5720, test_loss: 1.2612, test_f1: 0.5861
 epoch: 51, train_loss: 0.5261, test_loss: 1.2566, test_f1: 0.6278
 epoch: 52, train_loss: 0.4873, test_loss: 1.2457, test_f1: 0.6100
 epoch: 53, train_loss: 0.4817, test_loss: 1.2821, test_f1: 0.6273
 epoch: 54, train_loss: 0.4766, test_loss: 1.2531, test_f1: 0.6529
 epoch: 55, train_loss: 0.4664, test_loss: 1.3693, test_f1: 0.6262
 epoch: 56, train_loss: 0.4610, test_loss: 1.4530, test_f1: 0.6169
 epoch: 57, train_loss: 0.4751, test_loss: 1.3983, test_f1: 0.6174
 epoch: 58, train_loss: 0.4714, test_loss: 1.3088, test_f1: 0.6441
 epoch: 59, train_loss: 0.4531, test_loss: 1.4107, test_f1: 0.6157
 epoch: 60, train_loss: 0.4609, test_loss: 1.4364, test_f1: 0.6039
 epoch: 61, train_loss: 0.4593, test_loss: 1.3880, test_f1: 0.6106
 epoch: 62, train_loss: 0.4282, test_loss: 1.4417, test_f1: 0.6218
 epoch: 63, train_loss: 0.4113, test_loss: 1.4385, test_f1: 0.6136
 epoch: 64, train_loss: 0.4394, test_loss: 1.5006, test_f1: 0.6252
 epoch: 65, train_loss: 0.4258, test_loss: 1.4145, test_f1: 0.6336
 epoch: 66, train_loss: 0.4119, test_loss: 1.5290, test_f1: 0.5979
 epoch: 67, train_loss: 0.3992, test_loss: 1.4974, test_f1: 0.6327
 epoch: 68, train_loss: 0.4088, test_loss: 1.5568, test_f1: 0.6164
 epoch: 69, train_loss: 0.4182, test_loss: 1.5781, test_f1: 0.6216
 epoch: 70, train_loss: 0.4091, test_loss: 1.5372, test_f1: 0.6133
 epoch: 71, train_loss: 0.4349, test_loss: 1.4920, test_f1: 0.6123
 epoch: 72, train_loss: 0.4316, test_loss: 1.4772, test_f1: 0.6213
 epoch: 73, train_loss: 0.4000, test_loss: 1.4544, test_f1: 0.6430
 epoch: 74, train_loss: 0.4113, test_loss: 1.4739, test_f1: 0.6161
 epoch: 75, train_loss: 0.3925, test_loss: 1.5272, test_f1: 0.6177
 epoch: 76, train_loss: 0.4280, test_loss: 1.4970, test_f1: 0.6224
 epoch: 77, train_loss: 0.4017, test_loss: 1.6113, test_f1: 0.5987
 epoch: 78, train_loss: 0.3900, test_loss: 1.5634, test_f1: 0.6180
 epoch: 79, train_loss: 0.3808, test_loss: 1.6224, test_f1: 0.6213
 epoch: 80, train_loss: 0.3672, test_loss: 1.6604, test_f1: 0.6210
 epoch: 81, train_loss: 0.3630, test_loss: 1.6549, test_f1: 0.6158
 epoch: 82, train_loss: 0.3743, test_loss: 1.6383, test_f1: 0.6215
 epoch: 83, train_loss: 0.3456, test_loss: 1.6759, test_f1: 0.6132
 epoch: 84, train_loss: 0.3602, test_loss: 1.6511, test_f1: 0.5980
 epoch: 85, train_loss: 0.3735, test_loss: 1.6670, test_f1: 0.6162
 epoch: 86, train_loss: 0.3726, test_loss: 1.6658, test_f1: 0.5973
 epoch: 87, train_loss: 0.3810, test_loss: 1.7072, test_f1: 0.6006
 epoch: 88, train_loss: 0.3364, test_loss: 1.6477, test_f1: 0.6126
 epoch: 89, train_loss: 0.3533, test_loss: 1.7616, test_f1: 0.6311
 epoch: 90, train_loss: 0.3655, test_loss: 1.8205, test_f1: 0.5948
 epoch: 91, train_loss: 0.3394, test_loss: 1.6620, test_f1: 0.6063
 epoch: 92, train_loss: 0.3337, test_loss: 1.8402, test_f1: 0.6220
 epoch: 93, train_loss: 0.3159, test_loss: 1.7597, test_f1: 0.6254
 epoch: 94, train_loss: 0.3582, test_loss: 1.6374, test_f1: 0.6300
 epoch: 95, train_loss: 0.3312, test_loss: 1.8332, test_f1: 0.6234
 epoch: 96, train_loss: 0.3326, test_loss: 1.7113, test_f1: 0.6089
 epoch: 97, train_loss: 0.3222, test_loss: 1.7783, test_f1: 0.6137
 epoch: 98, train_loss: 0.3181, test_loss: 1.7524, test_f1: 0.6339
 epoch: 99, train_loss: 0.3418, test_loss: 1.9215, test_f1: 0.5984
##################ITERATION #8 ****************************************
 epoch: 0, train_loss: 1.3153, test_loss: 1.2387, test_f1: 0.3661
 epoch: 1, train_loss: 1.0360, test_loss: 1.0513, test_f1: 0.5224
 epoch: 2, train_loss: 0.9865, test_loss: 1.0800, test_f1: 0.4856
 epoch: 3, train_loss: 0.9454, test_loss: 1.0748, test_f1: 0.5306
 epoch: 4, train_loss: 0.9455, test_loss: 1.0481, test_f1: 0.5007
 epoch: 5, train_loss: 0.9161, test_loss: 1.0769, test_f1: 0.5434
 epoch: 6, train_loss: 0.8912, test_loss: 1.0875, test_f1: 0.6004
 epoch: 7, train_loss: 0.8771, test_loss: 1.0653, test_f1: 0.5020
 epoch: 8, train_loss: 0.8683, test_loss: 1.0543, test_f1: 0.5556
 epoch: 9, train_loss: 0.8560, test_loss: 1.0506, test_f1: 0.5831
 epoch: 10, train_loss: 0.8393, test_loss: 1.1058, test_f1: 0.5495
 epoch: 11, train_loss: 0.8249, test_loss: 1.0876, test_f1: 0.5657
 epoch: 12, train_loss: 0.8260, test_loss: 1.0789, test_f1: 0.5846
 epoch: 13, train_loss: 0.8270, test_loss: 1.0940, test_f1: 0.5608
 epoch: 14, train_loss: 0.8001, test_loss: 1.0743, test_f1: 0.6120
 epoch: 15, train_loss: 0.8159, test_loss: 1.0621, test_f1: 0.5933
 epoch: 16, train_loss: 0.7808, test_loss: 1.0653, test_f1: 0.5379
 epoch: 17, train_loss: 0.7547, test_loss: 1.0793, test_f1: 0.5833
 epoch: 18, train_loss: 0.7464, test_loss: 1.0941, test_f1: 0.5577
 epoch: 19, train_loss: 0.7325, test_loss: 1.1222, test_f1: 0.6076
 epoch: 20, train_loss: 0.7264, test_loss: 1.0652, test_f1: 0.5802
 epoch: 21, train_loss: 0.7156, test_loss: 1.1551, test_f1: 0.5489
 epoch: 22, train_loss: 0.7100, test_loss: 1.1321, test_f1: 0.5719
 epoch: 23, train_loss: 0.7002, test_loss: 1.1289, test_f1: 0.6057
 epoch: 24, train_loss: 0.7120, test_loss: 1.1059, test_f1: 0.6054
 epoch: 25, train_loss: 0.6853, test_loss: 1.1879, test_f1: 0.5605
 epoch: 26, train_loss: 0.7148, test_loss: 1.1117, test_f1: 0.5868
 epoch: 27, train_loss: 0.6494, test_loss: 1.2205, test_f1: 0.5676
 epoch: 28, train_loss: 0.6223, test_loss: 1.1474, test_f1: 0.5658
 epoch: 29, train_loss: 0.6636, test_loss: 1.1876, test_f1: 0.5780
 epoch: 30, train_loss: 0.6296, test_loss: 1.1728, test_f1: 0.5598
 epoch: 31, train_loss: 0.6493, test_loss: 1.2028, test_f1: 0.5831
 epoch: 32, train_loss: 0.6212, test_loss: 1.1645, test_f1: 0.5655
 epoch: 33, train_loss: 0.6331, test_loss: 1.1996, test_f1: 0.5736
 epoch: 34, train_loss: 0.6162, test_loss: 1.2303, test_f1: 0.6255
 epoch: 35, train_loss: 0.5889, test_loss: 1.1913, test_f1: 0.5786
 epoch: 36, train_loss: 0.6087, test_loss: 1.2802, test_f1: 0.5942
 epoch: 37, train_loss: 0.6007, test_loss: 1.3102, test_f1: 0.5693
 epoch: 38, train_loss: 0.5853, test_loss: 1.2664, test_f1: 0.5961
 epoch: 39, train_loss: 0.5830, test_loss: 1.2669, test_f1: 0.6184
 epoch: 40, train_loss: 0.5462, test_loss: 1.2465, test_f1: 0.6185
 epoch: 41, train_loss: 0.5478, test_loss: 1.2841, test_f1: 0.6163
 epoch: 42, train_loss: 0.5766, test_loss: 1.2925, test_f1: 0.6003
 epoch: 43, train_loss: 0.5772, test_loss: 1.2781, test_f1: 0.6427
 epoch: 44, train_loss: 0.5353, test_loss: 1.5461, test_f1: 0.5396
 epoch: 45, train_loss: 0.5607, test_loss: 1.2909, test_f1: 0.6211
 epoch: 46, train_loss: 0.5573, test_loss: 1.3243, test_f1: 0.6212
 epoch: 47, train_loss: 0.5618, test_loss: 1.2577, test_f1: 0.6268
 epoch: 48, train_loss: 0.5399, test_loss: 1.4397, test_f1: 0.5735
 epoch: 49, train_loss: 0.5304, test_loss: 1.3413, test_f1: 0.6357
 epoch: 50, train_loss: 0.5327, test_loss: 1.4038, test_f1: 0.6033
 epoch: 51, train_loss: 0.4883, test_loss: 1.3120, test_f1: 0.6395
 epoch: 52, train_loss: 0.4581, test_loss: 1.3127, test_f1: 0.6349
 epoch: 53, train_loss: 0.4558, test_loss: 1.3998, test_f1: 0.6339
 epoch: 54, train_loss: 0.4434, test_loss: 1.3536, test_f1: 0.6267
 epoch: 55, train_loss: 0.4454, test_loss: 1.4477, test_f1: 0.6164
 epoch: 56, train_loss: 0.4507, test_loss: 1.4609, test_f1: 0.6071
 epoch: 57, train_loss: 0.4740, test_loss: 1.3841, test_f1: 0.6368
 epoch: 58, train_loss: 0.4298, test_loss: 1.4823, test_f1: 0.6489
 epoch: 59, train_loss: 0.4261, test_loss: 1.4259, test_f1: 0.6721
 epoch: 60, train_loss: 0.4300, test_loss: 1.4706, test_f1: 0.6745
 epoch: 61, train_loss: 0.4437, test_loss: 1.5531, test_f1: 0.6290
 epoch: 62, train_loss: 0.4084, test_loss: 1.5585, test_f1: 0.6425
 epoch: 63, train_loss: 0.4074, test_loss: 1.5537, test_f1: 0.6326
 epoch: 64, train_loss: 0.3941, test_loss: 1.5527, test_f1: 0.6510
 epoch: 65, train_loss: 0.4027, test_loss: 1.6100, test_f1: 0.6431
 epoch: 66, train_loss: 0.4046, test_loss: 1.5168, test_f1: 0.6282
 epoch: 67, train_loss: 0.4279, test_loss: 1.6022, test_f1: 0.6528
 epoch: 68, train_loss: 0.4139, test_loss: 1.5326, test_f1: 0.6432
 epoch: 69, train_loss: 0.4073, test_loss: 1.6254, test_f1: 0.6326
 epoch: 70, train_loss: 0.3802, test_loss: 1.5997, test_f1: 0.6422
 epoch: 71, train_loss: 0.3932, test_loss: 1.6791, test_f1: 0.6096
 epoch: 72, train_loss: 0.3840, test_loss: 1.6555, test_f1: 0.6474
 epoch: 73, train_loss: 0.3532, test_loss: 1.6713, test_f1: 0.6398
 epoch: 74, train_loss: 0.3749, test_loss: 1.6865, test_f1: 0.6223
 epoch: 75, train_loss: 0.3465, test_loss: 1.6546, test_f1: 0.6495
 epoch: 76, train_loss: 0.3644, test_loss: 1.7042, test_f1: 0.6375
 epoch: 77, train_loss: 0.3845, test_loss: 1.7372, test_f1: 0.6254
 epoch: 78, train_loss: 0.3649, test_loss: 1.6186, test_f1: 0.6801
 epoch: 79, train_loss: 0.3860, test_loss: 1.6152, test_f1: 0.6484
 epoch: 80, train_loss: 0.3658, test_loss: 1.8140, test_f1: 0.6609
 epoch: 81, train_loss: 0.3695, test_loss: 1.6846, test_f1: 0.6479
 epoch: 82, train_loss: 0.3693, test_loss: 1.7628, test_f1: 0.6683
 epoch: 83, train_loss: 0.3932, test_loss: 1.7411, test_f1: 0.6477
 epoch: 84, train_loss: 0.3342, test_loss: 1.7391, test_f1: 0.6520
 epoch: 85, train_loss: 0.3652, test_loss: 1.8144, test_f1: 0.6475
 epoch: 86, train_loss: 0.3247, test_loss: 1.7962, test_f1: 0.6317
 epoch: 87, train_loss: 0.3570, test_loss: 1.8148, test_f1: 0.6378
 epoch: 88, train_loss: 0.3703, test_loss: 1.8977, test_f1: 0.6306
 epoch: 89, train_loss: 0.3409, test_loss: 1.8384, test_f1: 0.6493
 epoch: 90, train_loss: 0.3395, test_loss: 1.8481, test_f1: 0.6353
 epoch: 91, train_loss: 0.3610, test_loss: 1.9202, test_f1: 0.6373
 epoch: 92, train_loss: 0.3251, test_loss: 1.8719, test_f1: 0.6415
 epoch: 93, train_loss: 0.3627, test_loss: 1.8490, test_f1: 0.6291
 epoch: 94, train_loss: 0.3036, test_loss: 1.9063, test_f1: 0.6413
 epoch: 95, train_loss: 0.3206, test_loss: 1.8799, test_f1: 0.6607
 epoch: 96, train_loss: 0.3262, test_loss: 1.9157, test_f1: 0.6498
 epoch: 97, train_loss: 0.3059, test_loss: 1.9574, test_f1: 0.6617
 epoch: 98, train_loss: 0.3000, test_loss: 1.9158, test_f1: 0.6391
 epoch: 99, train_loss: 0.3267, test_loss: 1.9506, test_f1: 0.6314
##################ITERATION #9 ****************************************
 epoch: 0, train_loss: 1.4140, test_loss: 1.3784, test_f1: 0.3154
 epoch: 1, train_loss: 1.0701, test_loss: 1.1401, test_f1: 0.4793
 epoch: 2, train_loss: 0.9819, test_loss: 1.0691, test_f1: 0.5619
 epoch: 3, train_loss: 0.9855, test_loss: 1.0907, test_f1: 0.4936
 epoch: 4, train_loss: 0.9390, test_loss: 1.0600, test_f1: 0.5330
 epoch: 5, train_loss: 0.9172, test_loss: 1.0410, test_f1: 0.5557
 epoch: 6, train_loss: 0.9120, test_loss: 1.0599, test_f1: 0.5578
 epoch: 7, train_loss: 0.8771, test_loss: 1.0122, test_f1: 0.5951
 epoch: 8, train_loss: 0.8629, test_loss: 0.9965, test_f1: 0.6335
 epoch: 9, train_loss: 0.8573, test_loss: 1.0550, test_f1: 0.5554
 epoch: 10, train_loss: 0.8398, test_loss: 1.0471, test_f1: 0.5972
 epoch: 11, train_loss: 0.8438, test_loss: 1.0115, test_f1: 0.6007
 epoch: 12, train_loss: 0.8075, test_loss: 1.0169, test_f1: 0.5727
 epoch: 13, train_loss: 0.7788, test_loss: 0.9795, test_f1: 0.6376
 epoch: 14, train_loss: 0.7588, test_loss: 0.9843, test_f1: 0.6442
 epoch: 15, train_loss: 0.7460, test_loss: 1.0932, test_f1: 0.5987
 epoch: 16, train_loss: 0.7566, test_loss: 1.0060, test_f1: 0.5818
 epoch: 17, train_loss: 0.7417, test_loss: 1.0016, test_f1: 0.6353
 epoch: 18, train_loss: 0.7358, test_loss: 1.0541, test_f1: 0.5885
 epoch: 19, train_loss: 0.7091, test_loss: 0.9481, test_f1: 0.6728
 epoch: 20, train_loss: 0.7213, test_loss: 0.9674, test_f1: 0.6867
 epoch: 21, train_loss: 0.6990, test_loss: 0.9945, test_f1: 0.6442
 epoch: 22, train_loss: 0.6781, test_loss: 1.0694, test_f1: 0.5590
 epoch: 23, train_loss: 0.6575, test_loss: 1.0376, test_f1: 0.5998
 epoch: 24, train_loss: 0.6640, test_loss: 1.0694, test_f1: 0.6247
 epoch: 25, train_loss: 0.6824, test_loss: 1.0777, test_f1: 0.6277
 epoch: 26, train_loss: 0.6533, test_loss: 1.0998, test_f1: 0.5980
 epoch: 27, train_loss: 0.6430, test_loss: 1.0459, test_f1: 0.6130
 epoch: 28, train_loss: 0.6337, test_loss: 1.1145, test_f1: 0.5995
 epoch: 29, train_loss: 0.6020, test_loss: 1.0475, test_f1: 0.6234
 epoch: 30, train_loss: 0.6178, test_loss: 1.1557, test_f1: 0.6086
 epoch: 31, train_loss: 0.6125, test_loss: 1.2505, test_f1: 0.5994
 epoch: 32, train_loss: 0.6128, test_loss: 1.0752, test_f1: 0.6301
 epoch: 33, train_loss: 0.5879, test_loss: 1.0594, test_f1: 0.6299
 epoch: 34, train_loss: 0.6128, test_loss: 1.1846, test_f1: 0.6041
 epoch: 35, train_loss: 0.5886, test_loss: 1.0925, test_f1: 0.6247
 epoch: 36, train_loss: 0.5821, test_loss: 1.1069, test_f1: 0.6425
 epoch: 37, train_loss: 0.5710, test_loss: 1.2481, test_f1: 0.6406
 epoch: 38, train_loss: 0.5737, test_loss: 1.1560, test_f1: 0.6336
 epoch: 39, train_loss: 0.5950, test_loss: 1.2070, test_f1: 0.6055
 epoch: 40, train_loss: 0.5665, test_loss: 1.2762, test_f1: 0.5842
 epoch: 41, train_loss: 0.5790, test_loss: 1.2476, test_f1: 0.6038
 epoch: 42, train_loss: 0.5614, test_loss: 1.1695, test_f1: 0.6438
 epoch: 43, train_loss: 0.5335, test_loss: 1.1560, test_f1: 0.6413
 epoch: 44, train_loss: 0.5249, test_loss: 1.2122, test_f1: 0.6305
 epoch: 45, train_loss: 0.5548, test_loss: 1.2999, test_f1: 0.6398
 epoch: 46, train_loss: 0.5533, test_loss: 1.2953, test_f1: 0.6184
 epoch: 47, train_loss: 0.5199, test_loss: 1.2141, test_f1: 0.6527
 epoch: 48, train_loss: 0.5322, test_loss: 1.2087, test_f1: 0.6314
 epoch: 49, train_loss: 0.5080, test_loss: 1.3772, test_f1: 0.6015
 epoch: 50, train_loss: 0.5617, test_loss: 1.3468, test_f1: 0.5918
 epoch: 51, train_loss: 0.4869, test_loss: 1.2362, test_f1: 0.6269
 epoch: 52, train_loss: 0.4468, test_loss: 1.2119, test_f1: 0.6269
 epoch: 53, train_loss: 0.4615, test_loss: 1.2894, test_f1: 0.6308
 epoch: 54, train_loss: 0.4439, test_loss: 1.3065, test_f1: 0.6291
 epoch: 55, train_loss: 0.4371, test_loss: 1.3843, test_f1: 0.6194
 epoch: 56, train_loss: 0.4420, test_loss: 1.3267, test_f1: 0.6448
 epoch: 57, train_loss: 0.4465, test_loss: 1.3224, test_f1: 0.6420
 epoch: 58, train_loss: 0.4180, test_loss: 1.3768, test_f1: 0.6277
 epoch: 59, train_loss: 0.4454, test_loss: 1.5117, test_f1: 0.6067
 epoch: 60, train_loss: 0.4127, test_loss: 1.3789, test_f1: 0.6327
 epoch: 61, train_loss: 0.4064, test_loss: 1.4951, test_f1: 0.6283
 epoch: 62, train_loss: 0.4150, test_loss: 1.3467, test_f1: 0.6458
 epoch: 63, train_loss: 0.4012, test_loss: 1.4477, test_f1: 0.6299
 epoch: 64, train_loss: 0.4381, test_loss: 1.4041, test_f1: 0.6407
 epoch: 65, train_loss: 0.4097, test_loss: 1.5198, test_f1: 0.6303
 epoch: 66, train_loss: 0.4000, test_loss: 1.4344, test_f1: 0.6514
 epoch: 67, train_loss: 0.4104, test_loss: 1.5508, test_f1: 0.6325
 epoch: 68, train_loss: 0.3784, test_loss: 1.4752, test_f1: 0.6385
 epoch: 69, train_loss: 0.3628, test_loss: 1.5374, test_f1: 0.6175
 epoch: 70, train_loss: 0.4005, test_loss: 1.4796, test_f1: 0.6561
 epoch: 71, train_loss: 0.3731, test_loss: 1.5380, test_f1: 0.6344
 epoch: 72, train_loss: 0.4113, test_loss: 1.5501, test_f1: 0.6317
 epoch: 73, train_loss: 0.3847, test_loss: 1.4191, test_f1: 0.6337
 epoch: 74, train_loss: 0.3785, test_loss: 1.4642, test_f1: 0.6391
 epoch: 75, train_loss: 0.3755, test_loss: 1.4740, test_f1: 0.6300
 epoch: 76, train_loss: 0.3886, test_loss: 1.4783, test_f1: 0.6210
 epoch: 77, train_loss: 0.3795, test_loss: 1.5216, test_f1: 0.6534
 epoch: 78, train_loss: 0.3869, test_loss: 1.5738, test_f1: 0.6131
 epoch: 79, train_loss: 0.3814, test_loss: 1.5595, test_f1: 0.6374
 epoch: 80, train_loss: 0.3916, test_loss: 1.5910, test_f1: 0.6311
 epoch: 81, train_loss: 0.3600, test_loss: 1.6751, test_f1: 0.6306
 epoch: 82, train_loss: 0.3692, test_loss: 1.5383, test_f1: 0.6441
 epoch: 83, train_loss: 0.3739, test_loss: 1.6712, test_f1: 0.6210
 epoch: 84, train_loss: 0.3588, test_loss: 1.6771, test_f1: 0.6306
 epoch: 85, train_loss: 0.3528, test_loss: 1.7770, test_f1: 0.6261
 epoch: 86, train_loss: 0.3574, test_loss: 1.6195, test_f1: 0.6324
 epoch: 87, train_loss: 0.3340, test_loss: 1.7143, test_f1: 0.6274
 epoch: 88, train_loss: 0.3629, test_loss: 1.6074, test_f1: 0.6476
 epoch: 89, train_loss: 0.3396, test_loss: 1.6006, test_f1: 0.6254
 epoch: 90, train_loss: 0.3494, test_loss: 1.7291, test_f1: 0.6233
 epoch: 91, train_loss: 0.3637, test_loss: 1.7087, test_f1: 0.6393
 epoch: 92, train_loss: 0.3311, test_loss: 1.6986, test_f1: 0.6333
 epoch: 93, train_loss: 0.3266, test_loss: 1.6603, test_f1: 0.6449
 epoch: 94, train_loss: 0.3290, test_loss: 1.6783, test_f1: 0.6567
 epoch: 95, train_loss: 0.3624, test_loss: 1.7610, test_f1: 0.6460
 epoch: 96, train_loss: 0.3290, test_loss: 1.7627, test_f1: 0.6396
 epoch: 97, train_loss: 0.3371, test_loss: 1.6039, test_f1: 0.6445
 epoch: 98, train_loss: 0.3149, test_loss: 1.6411, test_f1: 0.6311
 epoch: 99, train_loss: 0.3038, test_loss: 1.6194, test_f1: 0.6693

Training completed in 736.63 seconds
Best F1: 0.6867 at epoch 20
Mean F1 across iterations: 0.6594  0.0125
========================FINAL RESULTS================================
FEGIN weighted F1: 0.6867  0.0125
python main.py --data ltspice_demos --representation component_pin_net --model FEGIN --layers 5 --hiddens 32 --batch_size 32 --lr 0.001 --emb_size 128 --epochs 100 --save_appendix component_pin_net_L5_H32_BS32_LR0.001_E128 --no_val
-----



STDERR:
  File "main.py", line 370, in <module>
    main()
  File "main.py", line 254, in main
    dataset = dataset_class(
  File "/home/philip/projects/ltspice_examples_code_repo/Circuit-Completion-Using-GNNs/component_classification_with_link_prediction_head/evaluation/FEGIN/kernel/circuit_datasets.py", line 15, in __init__
    self.data, self.slices = torch.load(self.processed_paths[0])
  File "/home/philip/.local/lib/python3.8/site-packages/torch/serialization.py", line 1040, in load
    warnings.warn(
  File "/usr/lib/python3.8/warnings.py", line 109, in _showwarnmsg
    sw(msg.message, msg.category, msg.filename, msg.lineno,
  File "main.py", line 47, in warn_with_traceback
    traceback.print_stack(file=log)
/home/philip/projects/ltspice_examples_code_repo/Circuit-Completion-Using-GNNs/component_classification_with_link_prediction_head/evaluation/FEGIN/kernel/circuit_datasets.py:15: FutureWarning: You are using `torch.load` with `weights_only=False` (the current default value), which uses the default pickle module implicitly. It is possible to construct malicious pickle data which will execute arbitrary code during unpickling (See https://github.com/pytorch/pytorch/blob/main/SECURITY.md#untrusted-models for more details). In a future release, the default value for `weights_only` will be flipped to `True`. This limits the functions that could be executed during unpickling. Arbitrary objects will no longer be allowed to be loaded via this mode unless they are explicitly allowlisted by the user via `torch.serialization.add_safe_globals`. We recommend you start setting `weights_only=True` for any use case where you don't have full control of the loaded file. Please open an issue on GitHub for any issues related to this experimental feature.
  self.data, self.slices = torch.load(self.processed_paths[0])
