STDOUT:
Results will be saved in /home/philip/projects/ltspice_examples_code_repo/Circuit-Completion-Using-GNNs/component_classification_with_link_prediction_head/evaluation/FEGIN/results/model_FEGIN_dataset_ltspice_examples
Command line input: python main.py --data ltspice_examples --representation component_component --model FEGIN --layers 6 --hiddens 64 --batch_size 64 --lr 0.001 --emb_size 512 --epochs 100 --save_appendix component_component_L6_H64_BS64_LR0.001_E512 --no_val
 is saved.
-----
ltspice_examples - FEGIN
Using 6 layers, 64 hidden units, h = 2
Loading component_component representation dataset
ENTERED
Training FEGIN on component_component representation
Train: 3556, Test: 845
##################ITERATION #0 ****************************************
 epoch: 0, train_loss: 1.2764, test_loss: 1.1952, test_f1: 0.3142
 epoch: 1, train_loss: 1.1869, test_loss: 1.1417, test_f1: 0.3803
 epoch: 2, train_loss: 1.1236, test_loss: 1.0842, test_f1: 0.4215
 epoch: 3, train_loss: 1.0897, test_loss: 1.1461, test_f1: 0.3993
 epoch: 4, train_loss: 1.0676, test_loss: 1.0161, test_f1: 0.4548
 epoch: 5, train_loss: 1.0351, test_loss: 1.0037, test_f1: 0.4537
 epoch: 6, train_loss: 1.0143, test_loss: 0.9994, test_f1: 0.4744
 epoch: 7, train_loss: 0.9879, test_loss: 0.9915, test_f1: 0.4968
 epoch: 8, train_loss: 0.9827, test_loss: 0.9846, test_f1: 0.4912
 epoch: 9, train_loss: 0.9636, test_loss: 1.0132, test_f1: 0.4554
 epoch: 10, train_loss: 0.9378, test_loss: 1.0250, test_f1: 0.4806
 epoch: 11, train_loss: 0.9242, test_loss: 1.0148, test_f1: 0.4956
 epoch: 12, train_loss: 0.9172, test_loss: 1.0251, test_f1: 0.4876
 epoch: 13, train_loss: 0.9046, test_loss: 1.0218, test_f1: 0.4973
 epoch: 14, train_loss: 0.8808, test_loss: 1.0029, test_f1: 0.4797
 epoch: 15, train_loss: 0.8682, test_loss: 1.0171, test_f1: 0.4976
 epoch: 16, train_loss: 0.8528, test_loss: 0.9960, test_f1: 0.4787
 epoch: 17, train_loss: 0.8459, test_loss: 1.0216, test_f1: 0.4983
 epoch: 18, train_loss: 0.8245, test_loss: 1.0891, test_f1: 0.5000
 epoch: 19, train_loss: 0.8178, test_loss: 1.0789, test_f1: 0.5154
 epoch: 20, train_loss: 0.8248, test_loss: 1.0727, test_f1: 0.5071
 epoch: 21, train_loss: 0.7969, test_loss: 1.1053, test_f1: 0.4972
 epoch: 22, train_loss: 0.7902, test_loss: 1.0725, test_f1: 0.5131
 epoch: 23, train_loss: 0.7694, test_loss: 1.1325, test_f1: 0.4968
 epoch: 24, train_loss: 0.7896, test_loss: 1.1452, test_f1: 0.5408
 epoch: 25, train_loss: 0.7615, test_loss: 1.1688, test_f1: 0.5106
 epoch: 26, train_loss: 0.7787, test_loss: 1.0702, test_f1: 0.5240
 epoch: 27, train_loss: 0.7406, test_loss: 1.1331, test_f1: 0.5278
 epoch: 28, train_loss: 0.7506, test_loss: 1.1070, test_f1: 0.5611
 epoch: 29, train_loss: 0.7429, test_loss: 1.2207, test_f1: 0.5268
 epoch: 30, train_loss: 0.7487, test_loss: 1.1220, test_f1: 0.5027
 epoch: 31, train_loss: 0.7340, test_loss: 1.1401, test_f1: 0.5521
 epoch: 32, train_loss: 0.7083, test_loss: 1.2106, test_f1: 0.5323
 epoch: 33, train_loss: 0.7201, test_loss: 1.2096, test_f1: 0.5597
 epoch: 34, train_loss: 0.6997, test_loss: 1.1660, test_f1: 0.5549
 epoch: 35, train_loss: 0.7048, test_loss: 1.2258, test_f1: 0.5259
 epoch: 36, train_loss: 0.6810, test_loss: 1.2897, test_f1: 0.5434
 epoch: 37, train_loss: 0.6620, test_loss: 1.2447, test_f1: 0.5334
 epoch: 38, train_loss: 0.6721, test_loss: 1.2868, test_f1: 0.5292
 epoch: 39, train_loss: 0.6665, test_loss: 1.2834, test_f1: 0.5277
 epoch: 40, train_loss: 0.6552, test_loss: 1.2995, test_f1: 0.5401
 epoch: 41, train_loss: 0.6331, test_loss: 1.2747, test_f1: 0.5716
 epoch: 42, train_loss: 0.6366, test_loss: 1.3632, test_f1: 0.5438
 epoch: 43, train_loss: 0.6545, test_loss: 1.3262, test_f1: 0.5432
 epoch: 44, train_loss: 0.6370, test_loss: 1.2896, test_f1: 0.5714
 epoch: 45, train_loss: 0.6144, test_loss: 1.3101, test_f1: 0.5434
 epoch: 46, train_loss: 0.6232, test_loss: 1.3798, test_f1: 0.5335
 epoch: 47, train_loss: 0.6181, test_loss: 1.3172, test_f1: 0.5846
 epoch: 48, train_loss: 0.5998, test_loss: 1.3424, test_f1: 0.5757
 epoch: 49, train_loss: 0.5877, test_loss: 1.3104, test_f1: 0.5724
 epoch: 50, train_loss: 0.6102, test_loss: 1.3546, test_f1: 0.5619
 epoch: 51, train_loss: 0.5567, test_loss: 1.4323, test_f1: 0.5860
 epoch: 52, train_loss: 0.5334, test_loss: 1.5186, test_f1: 0.5581
 epoch: 53, train_loss: 0.5197, test_loss: 1.4964, test_f1: 0.5670
 epoch: 54, train_loss: 0.5194, test_loss: 1.5523, test_f1: 0.5768
 epoch: 55, train_loss: 0.5348, test_loss: 1.4509, test_f1: 0.6020
 epoch: 56, train_loss: 0.5099, test_loss: 1.4095, test_f1: 0.5778
 epoch: 57, train_loss: 0.5067, test_loss: 1.4307, test_f1: 0.5749
 epoch: 58, train_loss: 0.4947, test_loss: 1.6002, test_f1: 0.5763
 epoch: 59, train_loss: 0.5050, test_loss: 1.5427, test_f1: 0.6022
 epoch: 60, train_loss: 0.4829, test_loss: 1.5310, test_f1: 0.5971
 epoch: 61, train_loss: 0.4948, test_loss: 1.5398, test_f1: 0.5826
 epoch: 62, train_loss: 0.4900, test_loss: 1.4823, test_f1: 0.5807
 epoch: 63, train_loss: 0.4584, test_loss: 1.5799, test_f1: 0.5827
 epoch: 64, train_loss: 0.4770, test_loss: 1.6819, test_f1: 0.6022
 epoch: 65, train_loss: 0.4675, test_loss: 1.5827, test_f1: 0.6036
 epoch: 66, train_loss: 0.4714, test_loss: 1.6205, test_f1: 0.5976
 epoch: 67, train_loss: 0.4543, test_loss: 1.6540, test_f1: 0.5948
 epoch: 68, train_loss: 0.4531, test_loss: 1.5590, test_f1: 0.5917
 epoch: 69, train_loss: 0.4437, test_loss: 1.6765, test_f1: 0.5743
 epoch: 70, train_loss: 0.4436, test_loss: 1.7325, test_f1: 0.6040
 epoch: 71, train_loss: 0.4713, test_loss: 1.6389, test_f1: 0.5869
 epoch: 72, train_loss: 0.4524, test_loss: 1.6691, test_f1: 0.5847
 epoch: 73, train_loss: 0.4338, test_loss: 1.7406, test_f1: 0.5902
 epoch: 74, train_loss: 0.4188, test_loss: 1.7781, test_f1: 0.5785
 epoch: 75, train_loss: 0.4202, test_loss: 1.7538, test_f1: 0.5996
 epoch: 76, train_loss: 0.4242, test_loss: 1.7129, test_f1: 0.6033
 epoch: 77, train_loss: 0.4265, test_loss: 1.8380, test_f1: 0.5589
 epoch: 78, train_loss: 0.4392, test_loss: 1.6904, test_f1: 0.6056
 epoch: 79, train_loss: 0.4201, test_loss: 1.8416, test_f1: 0.5819
 epoch: 80, train_loss: 0.4197, test_loss: 1.7435, test_f1: 0.5846
 epoch: 81, train_loss: 0.4174, test_loss: 1.7116, test_f1: 0.5949
 epoch: 82, train_loss: 0.4331, test_loss: 1.7173, test_f1: 0.5772
 epoch: 83, train_loss: 0.4126, test_loss: 1.6598, test_f1: 0.5913
 epoch: 84, train_loss: 0.4274, test_loss: 1.7427, test_f1: 0.5910
 epoch: 85, train_loss: 0.4252, test_loss: 1.7302, test_f1: 0.5887
 epoch: 86, train_loss: 0.4058, test_loss: 1.7186, test_f1: 0.5979
 epoch: 87, train_loss: 0.4021, test_loss: 1.8649, test_f1: 0.5875
 epoch: 88, train_loss: 0.3978, test_loss: 1.8217, test_f1: 0.5868
 epoch: 89, train_loss: 0.3974, test_loss: 1.9204, test_f1: 0.5849
 epoch: 90, train_loss: 0.3809, test_loss: 1.8946, test_f1: 0.5926
 epoch: 91, train_loss: 0.3905, test_loss: 1.9312, test_f1: 0.5625
 epoch: 92, train_loss: 0.4126, test_loss: 1.8659, test_f1: 0.5877
 epoch: 93, train_loss: 0.4037, test_loss: 2.0162, test_f1: 0.5740
 epoch: 94, train_loss: 0.4016, test_loss: 1.6926, test_f1: 0.6217
 epoch: 95, train_loss: 0.3897, test_loss: 1.7966, test_f1: 0.6069
 epoch: 96, train_loss: 0.3737, test_loss: 1.8899, test_f1: 0.5769
 epoch: 97, train_loss: 0.3530, test_loss: 1.9372, test_f1: 0.5882
 epoch: 98, train_loss: 0.3585, test_loss: 1.9145, test_f1: 0.5825
 epoch: 99, train_loss: 0.3628, test_loss: 2.0101, test_f1: 0.5804
##################ITERATION #1 ****************************************
 epoch: 0, train_loss: 1.2469, test_loss: 1.1655, test_f1: 0.4361
 epoch: 1, train_loss: 1.1665, test_loss: 1.0949, test_f1: 0.4493
 epoch: 2, train_loss: 1.1006, test_loss: 1.0384, test_f1: 0.4696
 epoch: 3, train_loss: 1.0662, test_loss: 1.0296, test_f1: 0.4521
 epoch: 4, train_loss: 1.0535, test_loss: 0.9704, test_f1: 0.4721
 epoch: 5, train_loss: 1.0259, test_loss: 0.9586, test_f1: 0.4922
 epoch: 6, train_loss: 0.9976, test_loss: 0.9736, test_f1: 0.4858
 epoch: 7, train_loss: 0.9807, test_loss: 0.9422, test_f1: 0.4934
 epoch: 8, train_loss: 0.9820, test_loss: 1.0147, test_f1: 0.4995
 epoch: 9, train_loss: 0.9572, test_loss: 1.0081, test_f1: 0.4974
 epoch: 10, train_loss: 0.9408, test_loss: 0.9829, test_f1: 0.4993
 epoch: 11, train_loss: 0.9288, test_loss: 0.9665, test_f1: 0.4830
 epoch: 12, train_loss: 0.9080, test_loss: 0.9478, test_f1: 0.5031
 epoch: 13, train_loss: 0.9046, test_loss: 1.0220, test_f1: 0.4893
 epoch: 14, train_loss: 0.8887, test_loss: 1.0848, test_f1: 0.4766
 epoch: 15, train_loss: 0.8833, test_loss: 1.1442, test_f1: 0.4806
 epoch: 16, train_loss: 0.8625, test_loss: 1.0183, test_f1: 0.4768
 epoch: 17, train_loss: 0.8679, test_loss: 1.0544, test_f1: 0.5180
 epoch: 18, train_loss: 0.8516, test_loss: 0.9907, test_f1: 0.5009
 epoch: 19, train_loss: 0.8434, test_loss: 1.1350, test_f1: 0.4826
 epoch: 20, train_loss: 0.8286, test_loss: 0.9725, test_f1: 0.5288
 epoch: 21, train_loss: 0.8249, test_loss: 1.0986, test_f1: 0.5150
 epoch: 22, train_loss: 0.7959, test_loss: 1.0460, test_f1: 0.5160
 epoch: 23, train_loss: 0.8132, test_loss: 1.0505, test_f1: 0.5188
 epoch: 24, train_loss: 0.8025, test_loss: 1.0264, test_f1: 0.5095
 epoch: 25, train_loss: 0.7887, test_loss: 1.1722, test_f1: 0.4985
 epoch: 26, train_loss: 0.7676, test_loss: 1.2268, test_f1: 0.4833
 epoch: 27, train_loss: 0.7824, test_loss: 1.1579, test_f1: 0.4892
 epoch: 28, train_loss: 0.7590, test_loss: 1.1488, test_f1: 0.5232
 epoch: 29, train_loss: 0.7539, test_loss: 1.1884, test_f1: 0.5211
 epoch: 30, train_loss: 0.7407, test_loss: 1.1681, test_f1: 0.5230
 epoch: 31, train_loss: 0.7547, test_loss: 1.2761, test_f1: 0.5299
 epoch: 32, train_loss: 0.7479, test_loss: 1.2546, test_f1: 0.4912
 epoch: 33, train_loss: 0.7344, test_loss: 1.2052, test_f1: 0.5215
 epoch: 34, train_loss: 0.7140, test_loss: 1.1992, test_f1: 0.5204
 epoch: 35, train_loss: 0.7078, test_loss: 1.1963, test_f1: 0.5183
 epoch: 36, train_loss: 0.7144, test_loss: 1.1731, test_f1: 0.5317
 epoch: 37, train_loss: 0.6830, test_loss: 1.2845, test_f1: 0.4991
 epoch: 38, train_loss: 0.7048, test_loss: 1.1214, test_f1: 0.5124
 epoch: 39, train_loss: 0.6980, test_loss: 1.1604, test_f1: 0.5070
 epoch: 40, train_loss: 0.7001, test_loss: 1.3015, test_f1: 0.4942
 epoch: 41, train_loss: 0.6932, test_loss: 1.1751, test_f1: 0.5165
 epoch: 42, train_loss: 0.6815, test_loss: 1.1566, test_f1: 0.5732
 epoch: 43, train_loss: 0.6624, test_loss: 1.3601, test_f1: 0.5027
 epoch: 44, train_loss: 0.6577, test_loss: 1.3336, test_f1: 0.5526
 epoch: 45, train_loss: 0.6582, test_loss: 1.2386, test_f1: 0.5376
 epoch: 46, train_loss: 0.6463, test_loss: 1.2631, test_f1: 0.5598
 epoch: 47, train_loss: 0.6533, test_loss: 1.3486, test_f1: 0.5277
 epoch: 48, train_loss: 0.6499, test_loss: 1.3801, test_f1: 0.5015
 epoch: 49, train_loss: 0.6668, test_loss: 1.3504, test_f1: 0.5197
 epoch: 50, train_loss: 0.6404, test_loss: 1.3490, test_f1: 0.5379
 epoch: 51, train_loss: 0.6009, test_loss: 1.3894, test_f1: 0.5374
 epoch: 52, train_loss: 0.5630, test_loss: 1.3724, test_f1: 0.5485
 epoch: 53, train_loss: 0.5610, test_loss: 1.4809, test_f1: 0.5375
 epoch: 54, train_loss: 0.5603, test_loss: 1.3846, test_f1: 0.5597
 epoch: 55, train_loss: 0.5539, test_loss: 1.4534, test_f1: 0.5458
 epoch: 56, train_loss: 0.5438, test_loss: 1.5265, test_f1: 0.5434
 epoch: 57, train_loss: 0.5335, test_loss: 1.4952, test_f1: 0.5410
 epoch: 58, train_loss: 0.5411, test_loss: 1.4908, test_f1: 0.5628
 epoch: 59, train_loss: 0.5508, test_loss: 1.3515, test_f1: 0.5582
 epoch: 60, train_loss: 0.5232, test_loss: 1.5150, test_f1: 0.5604
 epoch: 61, train_loss: 0.5152, test_loss: 1.4703, test_f1: 0.5568
 epoch: 62, train_loss: 0.5190, test_loss: 1.5315, test_f1: 0.5493
 epoch: 63, train_loss: 0.5160, test_loss: 1.4544, test_f1: 0.5691
 epoch: 64, train_loss: 0.5136, test_loss: 1.5540, test_f1: 0.5468
 epoch: 65, train_loss: 0.5037, test_loss: 1.5256, test_f1: 0.5657
 epoch: 66, train_loss: 0.4923, test_loss: 1.7232, test_f1: 0.5272
 epoch: 67, train_loss: 0.5046, test_loss: 1.5968, test_f1: 0.5571
 epoch: 68, train_loss: 0.4834, test_loss: 1.5311, test_f1: 0.5521
 epoch: 69, train_loss: 0.4839, test_loss: 1.5741, test_f1: 0.5608
 epoch: 70, train_loss: 0.4845, test_loss: 1.5946, test_f1: 0.5467
 epoch: 71, train_loss: 0.4883, test_loss: 1.5921, test_f1: 0.5642
 epoch: 72, train_loss: 0.4620, test_loss: 1.7720, test_f1: 0.5462
 epoch: 73, train_loss: 0.4758, test_loss: 1.5523, test_f1: 0.5734
 epoch: 74, train_loss: 0.4555, test_loss: 1.7294, test_f1: 0.5499
 epoch: 75, train_loss: 0.4724, test_loss: 1.7576, test_f1: 0.5497
 epoch: 76, train_loss: 0.4691, test_loss: 1.7069, test_f1: 0.5468
 epoch: 77, train_loss: 0.4645, test_loss: 1.9186, test_f1: 0.5466
 epoch: 78, train_loss: 0.4647, test_loss: 1.8126, test_f1: 0.5240
 epoch: 79, train_loss: 0.4458, test_loss: 1.8282, test_f1: 0.5494
 epoch: 80, train_loss: 0.4472, test_loss: 1.6230, test_f1: 0.5487
 epoch: 81, train_loss: 0.4391, test_loss: 1.8034, test_f1: 0.5575
 epoch: 82, train_loss: 0.4422, test_loss: 1.6193, test_f1: 0.5485
 epoch: 83, train_loss: 0.4420, test_loss: 1.6687, test_f1: 0.5708
 epoch: 84, train_loss: 0.4208, test_loss: 2.0583, test_f1: 0.5566
 epoch: 85, train_loss: 0.4372, test_loss: 1.6854, test_f1: 0.5540
 epoch: 86, train_loss: 0.4225, test_loss: 2.0252, test_f1: 0.5384
 epoch: 87, train_loss: 0.4288, test_loss: 1.8465, test_f1: 0.5498
 epoch: 88, train_loss: 0.4396, test_loss: 1.6614, test_f1: 0.5434
 epoch: 89, train_loss: 0.4153, test_loss: 1.9842, test_f1: 0.5526
 epoch: 90, train_loss: 0.4234, test_loss: 1.9681, test_f1: 0.5485
 epoch: 91, train_loss: 0.4319, test_loss: 1.8698, test_f1: 0.5340
 epoch: 92, train_loss: 0.4255, test_loss: 1.8582, test_f1: 0.5273
 epoch: 93, train_loss: 0.4308, test_loss: 1.8816, test_f1: 0.5562
 epoch: 94, train_loss: 0.4155, test_loss: 1.7050, test_f1: 0.5571
 epoch: 95, train_loss: 0.3983, test_loss: 1.9411, test_f1: 0.5566
 epoch: 96, train_loss: 0.4046, test_loss: 2.0355, test_f1: 0.5491
 epoch: 97, train_loss: 0.3837, test_loss: 1.9510, test_f1: 0.5739
 epoch: 98, train_loss: 0.4087, test_loss: 1.7951, test_f1: 0.5666
 epoch: 99, train_loss: 0.3941, test_loss: 1.9843, test_f1: 0.5593
##################ITERATION #2 ****************************************
 epoch: 0, train_loss: 1.2821, test_loss: 1.2407, test_f1: 0.4085
 epoch: 1, train_loss: 1.1766, test_loss: 1.1222, test_f1: 0.4175
 epoch: 2, train_loss: 1.1224, test_loss: 1.1014, test_f1: 0.4591
 epoch: 3, train_loss: 1.0868, test_loss: 1.0306, test_f1: 0.4597
 epoch: 4, train_loss: 1.0411, test_loss: 0.9878, test_f1: 0.4724
 epoch: 5, train_loss: 1.0337, test_loss: 1.0064, test_f1: 0.4540
 epoch: 6, train_loss: 0.9991, test_loss: 0.9887, test_f1: 0.4932
 epoch: 7, train_loss: 0.9879, test_loss: 0.9496, test_f1: 0.4913
 epoch: 8, train_loss: 0.9539, test_loss: 0.9763, test_f1: 0.4817
 epoch: 9, train_loss: 0.9431, test_loss: 0.9205, test_f1: 0.4853
 epoch: 10, train_loss: 0.9324, test_loss: 0.9177, test_f1: 0.4926
 epoch: 11, train_loss: 0.9121, test_loss: 0.9312, test_f1: 0.5020
 epoch: 12, train_loss: 0.9038, test_loss: 0.9882, test_f1: 0.4988
 epoch: 13, train_loss: 0.8810, test_loss: 0.9407, test_f1: 0.5056
 epoch: 14, train_loss: 0.8854, test_loss: 0.9212, test_f1: 0.5289
 epoch: 15, train_loss: 0.8725, test_loss: 1.0139, test_f1: 0.4983
 epoch: 16, train_loss: 0.8696, test_loss: 0.9115, test_f1: 0.5344
 epoch: 17, train_loss: 0.8636, test_loss: 0.9783, test_f1: 0.4923
 epoch: 18, train_loss: 0.8536, test_loss: 0.9103, test_f1: 0.5430
 epoch: 19, train_loss: 0.8355, test_loss: 1.0042, test_f1: 0.4930
 epoch: 20, train_loss: 0.8183, test_loss: 0.9964, test_f1: 0.5323
 epoch: 21, train_loss: 0.8527, test_loss: 1.0407, test_f1: 0.5000
 epoch: 22, train_loss: 0.8247, test_loss: 1.0180, test_f1: 0.5083
 epoch: 23, train_loss: 0.8148, test_loss: 1.0096, test_f1: 0.5389
 epoch: 24, train_loss: 0.8114, test_loss: 1.0836, test_f1: 0.5160
 epoch: 25, train_loss: 0.7907, test_loss: 1.0762, test_f1: 0.5303
 epoch: 26, train_loss: 0.8026, test_loss: 1.0430, test_f1: 0.5441
 epoch: 27, train_loss: 0.7954, test_loss: 1.1027, test_f1: 0.4907
 epoch: 28, train_loss: 0.7885, test_loss: 0.9593, test_f1: 0.5594
 epoch: 29, train_loss: 0.7809, test_loss: 0.9575, test_f1: 0.5674
 epoch: 30, train_loss: 0.7702, test_loss: 1.1117, test_f1: 0.5091
 epoch: 31, train_loss: 0.7687, test_loss: 1.0668, test_f1: 0.5370
 epoch: 32, train_loss: 0.7766, test_loss: 1.0758, test_f1: 0.5384
 epoch: 33, train_loss: 0.7506, test_loss: 1.1315, test_f1: 0.5093
 epoch: 34, train_loss: 0.7387, test_loss: 1.1160, test_f1: 0.5460
 epoch: 35, train_loss: 0.7339, test_loss: 1.1642, test_f1: 0.5131
 epoch: 36, train_loss: 0.7206, test_loss: 1.1517, test_f1: 0.5322
 epoch: 37, train_loss: 0.7257, test_loss: 1.0891, test_f1: 0.5108
 epoch: 38, train_loss: 0.7298, test_loss: 1.2267, test_f1: 0.5218
 epoch: 39, train_loss: 0.7123, test_loss: 1.1169, test_f1: 0.5196
 epoch: 40, train_loss: 0.7457, test_loss: 1.1922, test_f1: 0.5128
 epoch: 41, train_loss: 0.7361, test_loss: 1.1889, test_f1: 0.4783
 epoch: 42, train_loss: 0.7347, test_loss: 1.2403, test_f1: 0.4897
 epoch: 43, train_loss: 0.7293, test_loss: 1.1778, test_f1: 0.5170
 epoch: 44, train_loss: 0.7399, test_loss: 1.2015, test_f1: 0.4940
 epoch: 45, train_loss: 0.7069, test_loss: 1.1729, test_f1: 0.5221
 epoch: 46, train_loss: 0.6946, test_loss: 1.1818, test_f1: 0.5284
 epoch: 47, train_loss: 0.6815, test_loss: 1.1641, test_f1: 0.5439
 epoch: 48, train_loss: 0.6761, test_loss: 1.2088, test_f1: 0.5069
 epoch: 49, train_loss: 0.6812, test_loss: 1.2812, test_f1: 0.5363
 epoch: 50, train_loss: 0.6650, test_loss: 1.3311, test_f1: 0.4946
 epoch: 51, train_loss: 0.6221, test_loss: 1.2258, test_f1: 0.5275
 epoch: 52, train_loss: 0.6219, test_loss: 1.2695, test_f1: 0.5332
 epoch: 53, train_loss: 0.6119, test_loss: 1.4646, test_f1: 0.5148
 epoch: 54, train_loss: 0.6037, test_loss: 1.3091, test_f1: 0.5395
 epoch: 55, train_loss: 0.6052, test_loss: 1.3038, test_f1: 0.5302
 epoch: 56, train_loss: 0.6048, test_loss: 1.2319, test_f1: 0.5508
 epoch: 57, train_loss: 0.5828, test_loss: 1.3268, test_f1: 0.5394
 epoch: 58, train_loss: 0.5873, test_loss: 1.4165, test_f1: 0.5250
 epoch: 59, train_loss: 0.5800, test_loss: 1.3529, test_f1: 0.5446
 epoch: 60, train_loss: 0.5592, test_loss: 1.3221, test_f1: 0.5549
 epoch: 61, train_loss: 0.5662, test_loss: 1.3721, test_f1: 0.5620
 epoch: 62, train_loss: 0.5696, test_loss: 1.3440, test_f1: 0.5705
 epoch: 63, train_loss: 0.5657, test_loss: 1.4789, test_f1: 0.5344
 epoch: 64, train_loss: 0.5484, test_loss: 1.3384, test_f1: 0.5481
 epoch: 65, train_loss: 0.5686, test_loss: 1.3603, test_f1: 0.5556
 epoch: 66, train_loss: 0.5500, test_loss: 1.3683, test_f1: 0.5522
 epoch: 67, train_loss: 0.5562, test_loss: 1.5779, test_f1: 0.5298
 epoch: 68, train_loss: 0.5597, test_loss: 1.2002, test_f1: 0.5798
 epoch: 69, train_loss: 0.5512, test_loss: 1.3892, test_f1: 0.5695
 epoch: 70, train_loss: 0.5410, test_loss: 1.2709, test_f1: 0.5611
 epoch: 71, train_loss: 0.5225, test_loss: 1.3683, test_f1: 0.5652
 epoch: 72, train_loss: 0.5316, test_loss: 1.4193, test_f1: 0.5514
 epoch: 73, train_loss: 0.5268, test_loss: 1.4813, test_f1: 0.5589
 epoch: 74, train_loss: 0.5303, test_loss: 1.4996, test_f1: 0.5502
 epoch: 75, train_loss: 0.5313, test_loss: 1.4968, test_f1: 0.5565
 epoch: 76, train_loss: 0.5235, test_loss: 1.4441, test_f1: 0.5415
 epoch: 77, train_loss: 0.5219, test_loss: 1.5420, test_f1: 0.5429
 epoch: 78, train_loss: 0.5148, test_loss: 1.4000, test_f1: 0.5542
 epoch: 79, train_loss: 0.4979, test_loss: 1.4927, test_f1: 0.5550
 epoch: 80, train_loss: 0.5074, test_loss: 1.5667, test_f1: 0.5559
 epoch: 81, train_loss: 0.5190, test_loss: 1.4839, test_f1: 0.5358
 epoch: 82, train_loss: 0.4927, test_loss: 1.4326, test_f1: 0.5620
 epoch: 83, train_loss: 0.4978, test_loss: 1.5342, test_f1: 0.5729
 epoch: 84, train_loss: 0.4928, test_loss: 1.5011, test_f1: 0.5528
 epoch: 85, train_loss: 0.4864, test_loss: 1.4760, test_f1: 0.5523
 epoch: 86, train_loss: 0.4763, test_loss: 1.5134, test_f1: 0.5816
 epoch: 87, train_loss: 0.4929, test_loss: 1.5346, test_f1: 0.5473
 epoch: 88, train_loss: 0.4717, test_loss: 1.4178, test_f1: 0.5811
 epoch: 89, train_loss: 0.4652, test_loss: 1.5124, test_f1: 0.5621
 epoch: 90, train_loss: 0.4691, test_loss: 1.5916, test_f1: 0.5426
 epoch: 91, train_loss: 0.4657, test_loss: 1.5613, test_f1: 0.5297
 epoch: 92, train_loss: 0.4586, test_loss: 1.5671, test_f1: 0.5386
 epoch: 93, train_loss: 0.4497, test_loss: 1.6329, test_f1: 0.5318
 epoch: 94, train_loss: 0.4697, test_loss: 1.4436, test_f1: 0.5813
 epoch: 95, train_loss: 0.4587, test_loss: 1.6112, test_f1: 0.5497
 epoch: 96, train_loss: 0.4517, test_loss: 1.4853, test_f1: 0.5600
 epoch: 97, train_loss: 0.4452, test_loss: 1.5061, test_f1: 0.5574
 epoch: 98, train_loss: 0.4510, test_loss: 1.6214, test_f1: 0.5293
 epoch: 99, train_loss: 0.4376, test_loss: 1.4736, test_f1: 0.5685
##################ITERATION #3 ****************************************
 epoch: 0, train_loss: 1.2771, test_loss: 1.1665, test_f1: 0.3716
 epoch: 1, train_loss: 1.1561, test_loss: 1.0896, test_f1: 0.4629
 epoch: 2, train_loss: 1.1202, test_loss: 1.0346, test_f1: 0.4630
 epoch: 3, train_loss: 1.0818, test_loss: 1.0325, test_f1: 0.4378
 epoch: 4, train_loss: 1.0617, test_loss: 1.0225, test_f1: 0.4581
 epoch: 5, train_loss: 1.0244, test_loss: 1.0364, test_f1: 0.4304
 epoch: 6, train_loss: 1.0109, test_loss: 0.9816, test_f1: 0.4828
 epoch: 7, train_loss: 0.9826, test_loss: 0.9863, test_f1: 0.4593
 epoch: 8, train_loss: 0.9779, test_loss: 0.9491, test_f1: 0.4876
 epoch: 9, train_loss: 0.9550, test_loss: 0.9686, test_f1: 0.4742
 epoch: 10, train_loss: 0.9325, test_loss: 0.9988, test_f1: 0.4534
 epoch: 11, train_loss: 0.9248, test_loss: 0.9410, test_f1: 0.5169
 epoch: 12, train_loss: 0.8982, test_loss: 0.9986, test_f1: 0.5088
 epoch: 13, train_loss: 0.8830, test_loss: 0.9930, test_f1: 0.5184
 epoch: 14, train_loss: 0.8921, test_loss: 1.0234, test_f1: 0.4753
 epoch: 15, train_loss: 0.8759, test_loss: 1.0475, test_f1: 0.4696
 epoch: 16, train_loss: 0.8675, test_loss: 1.0357, test_f1: 0.4845
 epoch: 17, train_loss: 0.8537, test_loss: 1.1456, test_f1: 0.4884
 epoch: 18, train_loss: 0.8520, test_loss: 1.0246, test_f1: 0.5103
 epoch: 19, train_loss: 0.8381, test_loss: 0.9927, test_f1: 0.5012
 epoch: 20, train_loss: 0.8069, test_loss: 1.0506, test_f1: 0.5312
 epoch: 21, train_loss: 0.8180, test_loss: 1.0312, test_f1: 0.5313
 epoch: 22, train_loss: 0.8192, test_loss: 1.1628, test_f1: 0.5151
 epoch: 23, train_loss: 0.8220, test_loss: 1.0487, test_f1: 0.5201
 epoch: 24, train_loss: 0.7960, test_loss: 1.1440, test_f1: 0.5058
 epoch: 25, train_loss: 0.7970, test_loss: 1.2653, test_f1: 0.5358
 epoch: 26, train_loss: 0.7943, test_loss: 1.1739, test_f1: 0.4826
 epoch: 27, train_loss: 0.7718, test_loss: 1.1274, test_f1: 0.5333
 epoch: 28, train_loss: 0.7811, test_loss: 1.0939, test_f1: 0.5041
 epoch: 29, train_loss: 0.7654, test_loss: 1.1678, test_f1: 0.5152
 epoch: 30, train_loss: 0.7600, test_loss: 1.1665, test_f1: 0.5125
 epoch: 31, train_loss: 0.7672, test_loss: 1.1680, test_f1: 0.4963
 epoch: 32, train_loss: 0.7465, test_loss: 1.2290, test_f1: 0.5246
 epoch: 33, train_loss: 0.7359, test_loss: 1.2445, test_f1: 0.5259
 epoch: 34, train_loss: 0.7200, test_loss: 1.1454, test_f1: 0.5228
 epoch: 35, train_loss: 0.7182, test_loss: 1.1135, test_f1: 0.5235
 epoch: 36, train_loss: 0.7365, test_loss: 1.2247, test_f1: 0.5126
 epoch: 37, train_loss: 0.7153, test_loss: 1.1547, test_f1: 0.5295
 epoch: 38, train_loss: 0.6938, test_loss: 1.2195, test_f1: 0.5266
 epoch: 39, train_loss: 0.6956, test_loss: 1.1446, test_f1: 0.5592
 epoch: 40, train_loss: 0.6899, test_loss: 1.2444, test_f1: 0.5488
 epoch: 41, train_loss: 0.6971, test_loss: 1.1751, test_f1: 0.5503
 epoch: 42, train_loss: 0.6964, test_loss: 1.2613, test_f1: 0.5195
 epoch: 43, train_loss: 0.6813, test_loss: 1.3215, test_f1: 0.5061
 epoch: 44, train_loss: 0.6809, test_loss: 1.2846, test_f1: 0.5232
 epoch: 45, train_loss: 0.6736, test_loss: 1.3869, test_f1: 0.5272
 epoch: 46, train_loss: 0.6587, test_loss: 1.3222, test_f1: 0.4982
 epoch: 47, train_loss: 0.6490, test_loss: 1.3074, test_f1: 0.5111
 epoch: 48, train_loss: 0.6302, test_loss: 1.2951, test_f1: 0.5423
 epoch: 49, train_loss: 0.6477, test_loss: 1.3331, test_f1: 0.5116
 epoch: 50, train_loss: 0.6655, test_loss: 1.4243, test_f1: 0.5282
 epoch: 51, train_loss: 0.6221, test_loss: 1.2950, test_f1: 0.5341
 epoch: 52, train_loss: 0.5736, test_loss: 1.3146, test_f1: 0.5418
 epoch: 53, train_loss: 0.5697, test_loss: 1.3885, test_f1: 0.5313
 epoch: 54, train_loss: 0.5745, test_loss: 1.3610, test_f1: 0.5316
 epoch: 55, train_loss: 0.5413, test_loss: 1.4090, test_f1: 0.5695
 epoch: 56, train_loss: 0.5416, test_loss: 1.4279, test_f1: 0.5181
 epoch: 57, train_loss: 0.5468, test_loss: 1.4485, test_f1: 0.5218
 epoch: 58, train_loss: 0.5310, test_loss: 1.4231, test_f1: 0.5245
 epoch: 59, train_loss: 0.5358, test_loss: 1.4628, test_f1: 0.5431
 epoch: 60, train_loss: 0.5330, test_loss: 1.5372, test_f1: 0.5065
 epoch: 61, train_loss: 0.5357, test_loss: 1.4707, test_f1: 0.5145
 epoch: 62, train_loss: 0.5294, test_loss: 1.4194, test_f1: 0.5389
 epoch: 63, train_loss: 0.5041, test_loss: 1.5346, test_f1: 0.5365
 epoch: 64, train_loss: 0.5275, test_loss: 1.5346, test_f1: 0.5348
 epoch: 65, train_loss: 0.5332, test_loss: 1.4842, test_f1: 0.5509
 epoch: 66, train_loss: 0.4985, test_loss: 1.5574, test_f1: 0.5192
 epoch: 67, train_loss: 0.4903, test_loss: 1.5381, test_f1: 0.5204
 epoch: 68, train_loss: 0.4964, test_loss: 1.5313, test_f1: 0.5431
 epoch: 69, train_loss: 0.4908, test_loss: 1.6468, test_f1: 0.5273
 epoch: 70, train_loss: 0.4918, test_loss: 1.5358, test_f1: 0.5203
 epoch: 71, train_loss: 0.5000, test_loss: 1.6114, test_f1: 0.5365
 epoch: 72, train_loss: 0.4664, test_loss: 1.5910, test_f1: 0.5300
 epoch: 73, train_loss: 0.4831, test_loss: 1.5744, test_f1: 0.5433
 epoch: 74, train_loss: 0.4729, test_loss: 1.6027, test_f1: 0.5376
 epoch: 75, train_loss: 0.4835, test_loss: 1.6183, test_f1: 0.5291
 epoch: 76, train_loss: 0.4653, test_loss: 1.5406, test_f1: 0.5442
 epoch: 77, train_loss: 0.4459, test_loss: 1.7875, test_f1: 0.5359
 epoch: 78, train_loss: 0.4679, test_loss: 1.6302, test_f1: 0.5147
 epoch: 79, train_loss: 0.4775, test_loss: 1.6302, test_f1: 0.5565
 epoch: 80, train_loss: 0.4599, test_loss: 1.6717, test_f1: 0.5584
 epoch: 81, train_loss: 0.4514, test_loss: 1.7187, test_f1: 0.5207
 epoch: 82, train_loss: 0.4346, test_loss: 1.5846, test_f1: 0.5358
 epoch: 83, train_loss: 0.4421, test_loss: 1.5934, test_f1: 0.5468
 epoch: 84, train_loss: 0.4395, test_loss: 1.6029, test_f1: 0.5460
 epoch: 85, train_loss: 0.4296, test_loss: 1.6910, test_f1: 0.5241
 epoch: 86, train_loss: 0.4354, test_loss: 1.7012, test_f1: 0.5395
 epoch: 87, train_loss: 0.4470, test_loss: 1.8669, test_f1: 0.5363
 epoch: 88, train_loss: 0.4184, test_loss: 1.6827, test_f1: 0.5221
 epoch: 89, train_loss: 0.4307, test_loss: 1.7600, test_f1: 0.5449
 epoch: 90, train_loss: 0.4381, test_loss: 1.8222, test_f1: 0.5261
 epoch: 91, train_loss: 0.4224, test_loss: 1.7278, test_f1: 0.5276
 epoch: 92, train_loss: 0.4234, test_loss: 1.7189, test_f1: 0.5454
 epoch: 93, train_loss: 0.4061, test_loss: 1.7591, test_f1: 0.5243
 epoch: 94, train_loss: 0.4186, test_loss: 1.8334, test_f1: 0.5171
 epoch: 95, train_loss: 0.4194, test_loss: 1.7099, test_f1: 0.5649
 epoch: 96, train_loss: 0.4085, test_loss: 1.8439, test_f1: 0.5366
 epoch: 97, train_loss: 0.4150, test_loss: 1.8363, test_f1: 0.5436
 epoch: 98, train_loss: 0.3945, test_loss: 1.9475, test_f1: 0.5330
 epoch: 99, train_loss: 0.3822, test_loss: 1.7938, test_f1: 0.5442
##################ITERATION #4 ****************************************
 epoch: 0, train_loss: 1.3087, test_loss: 1.1674, test_f1: 0.3685
 epoch: 1, train_loss: 1.1726, test_loss: 1.1009, test_f1: 0.4291
 epoch: 2, train_loss: 1.1298, test_loss: 1.0784, test_f1: 0.4216
 epoch: 3, train_loss: 1.0961, test_loss: 1.0305, test_f1: 0.4543
 epoch: 4, train_loss: 1.0834, test_loss: 1.0382, test_f1: 0.4558
 epoch: 5, train_loss: 1.0529, test_loss: 1.0390, test_f1: 0.4504
 epoch: 6, train_loss: 1.0326, test_loss: 1.0280, test_f1: 0.4597
 epoch: 7, train_loss: 1.0290, test_loss: 1.0117, test_f1: 0.4434
 epoch: 8, train_loss: 1.0165, test_loss: 0.9839, test_f1: 0.4724
 epoch: 9, train_loss: 1.0123, test_loss: 1.0336, test_f1: 0.4783
 epoch: 10, train_loss: 0.9955, test_loss: 0.9834, test_f1: 0.5081
 epoch: 11, train_loss: 0.9670, test_loss: 0.9902, test_f1: 0.4621
 epoch: 12, train_loss: 0.9484, test_loss: 0.9787, test_f1: 0.4907
 epoch: 13, train_loss: 0.9535, test_loss: 1.0509, test_f1: 0.4694
 epoch: 14, train_loss: 0.9480, test_loss: 1.0324, test_f1: 0.4815
 epoch: 15, train_loss: 0.9282, test_loss: 1.0194, test_f1: 0.4660
 epoch: 16, train_loss: 0.9263, test_loss: 0.9523, test_f1: 0.5024
 epoch: 17, train_loss: 0.8955, test_loss: 1.0576, test_f1: 0.4613
 epoch: 18, train_loss: 0.8959, test_loss: 1.0250, test_f1: 0.5037
 epoch: 19, train_loss: 0.8797, test_loss: 1.0674, test_f1: 0.4659
 epoch: 20, train_loss: 0.8817, test_loss: 1.0018, test_f1: 0.5087
 epoch: 21, train_loss: 0.8704, test_loss: 0.9938, test_f1: 0.5079
 epoch: 22, train_loss: 0.8707, test_loss: 0.9488, test_f1: 0.5332
 epoch: 23, train_loss: 0.8533, test_loss: 1.0299, test_f1: 0.5214
 epoch: 24, train_loss: 0.8697, test_loss: 1.0208, test_f1: 0.5180
 epoch: 25, train_loss: 0.8516, test_loss: 1.0720, test_f1: 0.4981
 epoch: 26, train_loss: 0.8363, test_loss: 1.0285, test_f1: 0.4912
 epoch: 27, train_loss: 0.8421, test_loss: 1.0217, test_f1: 0.5219
 epoch: 28, train_loss: 0.8320, test_loss: 0.9817, test_f1: 0.5303
 epoch: 29, train_loss: 0.8120, test_loss: 1.0821, test_f1: 0.4895
 epoch: 30, train_loss: 0.8194, test_loss: 1.0586, test_f1: 0.5183
 epoch: 31, train_loss: 0.7875, test_loss: 1.0584, test_f1: 0.5283
 epoch: 32, train_loss: 0.8109, test_loss: 1.0162, test_f1: 0.5421
 epoch: 33, train_loss: 0.7868, test_loss: 1.0318, test_f1: 0.5307
 epoch: 34, train_loss: 0.7928, test_loss: 1.1255, test_f1: 0.5037
 epoch: 35, train_loss: 0.7890, test_loss: 1.0879, test_f1: 0.5264
 epoch: 36, train_loss: 0.7690, test_loss: 1.0678, test_f1: 0.5356
 epoch: 37, train_loss: 0.7741, test_loss: 1.0970, test_f1: 0.5013
 epoch: 38, train_loss: 0.7530, test_loss: 1.1142, test_f1: 0.5200
 epoch: 39, train_loss: 0.7540, test_loss: 1.1578, test_f1: 0.5202
 epoch: 40, train_loss: 0.7503, test_loss: 1.1123, test_f1: 0.5683
 epoch: 41, train_loss: 0.7464, test_loss: 1.1997, test_f1: 0.5242
 epoch: 42, train_loss: 0.7476, test_loss: 1.1250, test_f1: 0.5172
 epoch: 43, train_loss: 0.7384, test_loss: 1.1893, test_f1: 0.4939
 epoch: 44, train_loss: 0.7299, test_loss: 1.2696, test_f1: 0.4959
 epoch: 45, train_loss: 0.7313, test_loss: 1.0851, test_f1: 0.5363
 epoch: 46, train_loss: 0.7399, test_loss: 1.1111, test_f1: 0.5306
 epoch: 47, train_loss: 0.7180, test_loss: 1.1958, test_f1: 0.5223
 epoch: 48, train_loss: 0.7063, test_loss: 1.1963, test_f1: 0.5150
 epoch: 49, train_loss: 0.6960, test_loss: 1.1463, test_f1: 0.5244
 epoch: 50, train_loss: 0.6932, test_loss: 1.2992, test_f1: 0.5092
 epoch: 51, train_loss: 0.6738, test_loss: 1.1552, test_f1: 0.5537
 epoch: 52, train_loss: 0.6434, test_loss: 1.1828, test_f1: 0.5425
 epoch: 53, train_loss: 0.6353, test_loss: 1.1638, test_f1: 0.5536
 epoch: 54, train_loss: 0.6304, test_loss: 1.2348, test_f1: 0.5510
 epoch: 55, train_loss: 0.6374, test_loss: 1.2511, test_f1: 0.5232
 epoch: 56, train_loss: 0.6172, test_loss: 1.1811, test_f1: 0.5309
 epoch: 57, train_loss: 0.6286, test_loss: 1.2753, test_f1: 0.5171
 epoch: 58, train_loss: 0.6113, test_loss: 1.2907, test_f1: 0.5369
 epoch: 59, train_loss: 0.6107, test_loss: 1.2261, test_f1: 0.5339
 epoch: 60, train_loss: 0.6282, test_loss: 1.2301, test_f1: 0.5517
 epoch: 61, train_loss: 0.6122, test_loss: 1.2947, test_f1: 0.5272
 epoch: 62, train_loss: 0.5939, test_loss: 1.3137, test_f1: 0.5353
 epoch: 63, train_loss: 0.6058, test_loss: 1.3513, test_f1: 0.5412
 epoch: 64, train_loss: 0.6000, test_loss: 1.3407, test_f1: 0.5447
 epoch: 65, train_loss: 0.5973, test_loss: 1.2371, test_f1: 0.5627
 epoch: 66, train_loss: 0.5714, test_loss: 1.3558, test_f1: 0.5333
 epoch: 67, train_loss: 0.5806, test_loss: 1.2759, test_f1: 0.5658
 epoch: 68, train_loss: 0.5783, test_loss: 1.3221, test_f1: 0.5357
 epoch: 69, train_loss: 0.5666, test_loss: 1.3770, test_f1: 0.5420
 epoch: 70, train_loss: 0.5696, test_loss: 1.3554, test_f1: 0.5418
 epoch: 71, train_loss: 0.5654, test_loss: 1.4040, test_f1: 0.5225
 epoch: 72, train_loss: 0.5799, test_loss: 1.3543, test_f1: 0.5578
 epoch: 73, train_loss: 0.5755, test_loss: 1.3304, test_f1: 0.5390
 epoch: 74, train_loss: 0.5733, test_loss: 1.3394, test_f1: 0.5315
 epoch: 75, train_loss: 0.5787, test_loss: 1.3785, test_f1: 0.5352
 epoch: 76, train_loss: 0.5825, test_loss: 1.2916, test_f1: 0.5533
 epoch: 77, train_loss: 0.5586, test_loss: 1.3740, test_f1: 0.5362
 epoch: 78, train_loss: 0.5517, test_loss: 1.3222, test_f1: 0.5662
 epoch: 79, train_loss: 0.5522, test_loss: 1.6574, test_f1: 0.4998
 epoch: 80, train_loss: 0.5509, test_loss: 1.4320, test_f1: 0.5244
 epoch: 81, train_loss: 0.5476, test_loss: 1.3571, test_f1: 0.5262
 epoch: 82, train_loss: 0.5350, test_loss: 1.3403, test_f1: 0.5573
 epoch: 83, train_loss: 0.5389, test_loss: 1.5448, test_f1: 0.5201
 epoch: 84, train_loss: 0.5303, test_loss: 1.4345, test_f1: 0.5500
 epoch: 85, train_loss: 0.5375, test_loss: 1.3892, test_f1: 0.5441
 epoch: 86, train_loss: 0.5365, test_loss: 1.4132, test_f1: 0.5302
 epoch: 87, train_loss: 0.5332, test_loss: 1.3551, test_f1: 0.5474
 epoch: 88, train_loss: 0.5073, test_loss: 1.3566, test_f1: 0.5690
 epoch: 89, train_loss: 0.5188, test_loss: 1.4188, test_f1: 0.5636
 epoch: 90, train_loss: 0.5014, test_loss: 1.5006, test_f1: 0.5545
 epoch: 91, train_loss: 0.5112, test_loss: 1.4165, test_f1: 0.5570
 epoch: 92, train_loss: 0.5128, test_loss: 1.3532, test_f1: 0.5654
 epoch: 93, train_loss: 0.4920, test_loss: 1.5928, test_f1: 0.5501
 epoch: 94, train_loss: 0.5181, test_loss: 1.6956, test_f1: 0.5494
 epoch: 95, train_loss: 0.5157, test_loss: 1.4650, test_f1: 0.5415
 epoch: 96, train_loss: 0.4998, test_loss: 1.4492, test_f1: 0.5463
 epoch: 97, train_loss: 0.5103, test_loss: 1.4979, test_f1: 0.5665
 epoch: 98, train_loss: 0.5098, test_loss: 1.4529, test_f1: 0.5532
 epoch: 99, train_loss: 0.4782, test_loss: 1.4140, test_f1: 0.5738
##################ITERATION #5 ****************************************
 epoch: 0, train_loss: 1.3600, test_loss: 1.1793, test_f1: 0.3433
 epoch: 1, train_loss: 1.1961, test_loss: 1.1307, test_f1: 0.4127
 epoch: 2, train_loss: 1.1616, test_loss: 1.1076, test_f1: 0.4086
 epoch: 3, train_loss: 1.1404, test_loss: 1.1100, test_f1: 0.4153
 epoch: 4, train_loss: 1.1162, test_loss: 1.0729, test_f1: 0.4303
 epoch: 5, train_loss: 1.0787, test_loss: 1.0680, test_f1: 0.4075
 epoch: 6, train_loss: 1.0624, test_loss: 1.0275, test_f1: 0.4777
 epoch: 7, train_loss: 1.0469, test_loss: 1.0369, test_f1: 0.4262
 epoch: 8, train_loss: 1.0332, test_loss: 1.0198, test_f1: 0.4475
 epoch: 9, train_loss: 1.0127, test_loss: 1.0817, test_f1: 0.4314
 epoch: 10, train_loss: 0.9948, test_loss: 1.0327, test_f1: 0.4403
 epoch: 11, train_loss: 0.9711, test_loss: 0.9601, test_f1: 0.4748
 epoch: 12, train_loss: 0.9661, test_loss: 1.0798, test_f1: 0.4379
 epoch: 13, train_loss: 0.9537, test_loss: 1.0754, test_f1: 0.4457
 epoch: 14, train_loss: 0.9394, test_loss: 1.0452, test_f1: 0.4673
 epoch: 15, train_loss: 0.9215, test_loss: 0.9517, test_f1: 0.4799
 epoch: 16, train_loss: 0.9165, test_loss: 0.9548, test_f1: 0.4618
 epoch: 17, train_loss: 0.9115, test_loss: 1.0126, test_f1: 0.4537
 epoch: 18, train_loss: 0.9069, test_loss: 1.0378, test_f1: 0.4985
 epoch: 19, train_loss: 0.8934, test_loss: 1.0413, test_f1: 0.4609
 epoch: 20, train_loss: 0.8994, test_loss: 1.0155, test_f1: 0.4554
 epoch: 21, train_loss: 0.8812, test_loss: 0.9909, test_f1: 0.5064
 epoch: 22, train_loss: 0.8753, test_loss: 1.1560, test_f1: 0.4800
 epoch: 23, train_loss: 0.8770, test_loss: 1.1924, test_f1: 0.4762
 epoch: 24, train_loss: 0.8386, test_loss: 1.0757, test_f1: 0.4837
 epoch: 25, train_loss: 0.8422, test_loss: 1.2089, test_f1: 0.4674
 epoch: 26, train_loss: 0.8575, test_loss: 1.0631, test_f1: 0.5128
 epoch: 27, train_loss: 0.8509, test_loss: 1.1896, test_f1: 0.4604
 epoch: 28, train_loss: 0.8429, test_loss: 1.1633, test_f1: 0.4865
 epoch: 29, train_loss: 0.8381, test_loss: 1.1443, test_f1: 0.4840
 epoch: 30, train_loss: 0.8190, test_loss: 1.1053, test_f1: 0.4704
 epoch: 31, train_loss: 0.8078, test_loss: 1.0048, test_f1: 0.5085
 epoch: 32, train_loss: 0.8152, test_loss: 1.1327, test_f1: 0.5168
 epoch: 33, train_loss: 0.8084, test_loss: 1.0845, test_f1: 0.4890
 epoch: 34, train_loss: 0.7955, test_loss: 1.1275, test_f1: 0.4872
 epoch: 35, train_loss: 0.7903, test_loss: 1.1008, test_f1: 0.4895
 epoch: 36, train_loss: 0.7896, test_loss: 1.1965, test_f1: 0.5065
 epoch: 37, train_loss: 0.7741, test_loss: 1.1534, test_f1: 0.5153
 epoch: 38, train_loss: 0.7731, test_loss: 1.1577, test_f1: 0.4811
 epoch: 39, train_loss: 0.8056, test_loss: 1.1130, test_f1: 0.5037
 epoch: 40, train_loss: 0.7903, test_loss: 1.0998, test_f1: 0.5202
 epoch: 41, train_loss: 0.7811, test_loss: 1.1262, test_f1: 0.5052
 epoch: 42, train_loss: 0.7530, test_loss: 1.1828, test_f1: 0.5113
 epoch: 43, train_loss: 0.7493, test_loss: 1.1733, test_f1: 0.5091
 epoch: 44, train_loss: 0.7831, test_loss: 1.1836, test_f1: 0.5020
 epoch: 45, train_loss: 0.7382, test_loss: 1.1434, test_f1: 0.4898
 epoch: 46, train_loss: 0.7417, test_loss: 1.2534, test_f1: 0.4906
 epoch: 47, train_loss: 0.7443, test_loss: 1.2012, test_f1: 0.5299
 epoch: 48, train_loss: 0.7260, test_loss: 1.1693, test_f1: 0.5187
 epoch: 49, train_loss: 0.7438, test_loss: 1.1759, test_f1: 0.5172
 epoch: 50, train_loss: 0.7202, test_loss: 1.2278, test_f1: 0.5354
 epoch: 51, train_loss: 0.6987, test_loss: 1.2717, test_f1: 0.5186
 epoch: 52, train_loss: 0.6818, test_loss: 1.2224, test_f1: 0.4985
 epoch: 53, train_loss: 0.6627, test_loss: 1.2073, test_f1: 0.5131
 epoch: 54, train_loss: 0.6562, test_loss: 1.3183, test_f1: 0.5333
 epoch: 55, train_loss: 0.6610, test_loss: 1.2064, test_f1: 0.5574
 epoch: 56, train_loss: 0.6644, test_loss: 1.2422, test_f1: 0.5043
 epoch: 57, train_loss: 0.6535, test_loss: 1.2895, test_f1: 0.5419
 epoch: 58, train_loss: 0.6650, test_loss: 1.3134, test_f1: 0.5153
 epoch: 59, train_loss: 0.6383, test_loss: 1.2646, test_f1: 0.5117
 epoch: 60, train_loss: 0.6411, test_loss: 1.2525, test_f1: 0.5267
 epoch: 61, train_loss: 0.6208, test_loss: 1.2704, test_f1: 0.5500
 epoch: 62, train_loss: 0.6374, test_loss: 1.2865, test_f1: 0.5141
 epoch: 63, train_loss: 0.6112, test_loss: 1.3098, test_f1: 0.5199
 epoch: 64, train_loss: 0.6233, test_loss: 1.2936, test_f1: 0.5137
 epoch: 65, train_loss: 0.6123, test_loss: 1.3454, test_f1: 0.5300
 epoch: 66, train_loss: 0.6218, test_loss: 1.3496, test_f1: 0.5041
 epoch: 67, train_loss: 0.6062, test_loss: 1.3346, test_f1: 0.5203
 epoch: 68, train_loss: 0.6087, test_loss: 1.3569, test_f1: 0.5026
 epoch: 69, train_loss: 0.5963, test_loss: 1.3893, test_f1: 0.4921
 epoch: 70, train_loss: 0.6044, test_loss: 1.3847, test_f1: 0.5168
 epoch: 71, train_loss: 0.5921, test_loss: 1.3291, test_f1: 0.5091
 epoch: 72, train_loss: 0.5922, test_loss: 1.3342, test_f1: 0.5230
 epoch: 73, train_loss: 0.5965, test_loss: 1.3728, test_f1: 0.5225
 epoch: 74, train_loss: 0.5879, test_loss: 1.2745, test_f1: 0.5408
 epoch: 75, train_loss: 0.5687, test_loss: 1.2555, test_f1: 0.5368
 epoch: 76, train_loss: 0.5959, test_loss: 1.4148, test_f1: 0.5154
 epoch: 77, train_loss: 0.5759, test_loss: 1.3659, test_f1: 0.5495
 epoch: 78, train_loss: 0.5848, test_loss: 1.3400, test_f1: 0.5200
 epoch: 79, train_loss: 0.5806, test_loss: 1.3987, test_f1: 0.5100
 epoch: 80, train_loss: 0.5895, test_loss: 1.3415, test_f1: 0.5608
 epoch: 81, train_loss: 0.5568, test_loss: 1.3976, test_f1: 0.5280
 epoch: 82, train_loss: 0.5597, test_loss: 1.3754, test_f1: 0.5566
 epoch: 83, train_loss: 0.5638, test_loss: 1.4657, test_f1: 0.5205
 epoch: 84, train_loss: 0.5658, test_loss: 1.4110, test_f1: 0.5213
 epoch: 85, train_loss: 0.5483, test_loss: 1.4171, test_f1: 0.5229
 epoch: 86, train_loss: 0.5494, test_loss: 1.4764, test_f1: 0.5185
 epoch: 87, train_loss: 0.5477, test_loss: 1.5220, test_f1: 0.5388
 epoch: 88, train_loss: 0.5398, test_loss: 1.5161, test_f1: 0.5471
 epoch: 89, train_loss: 0.5244, test_loss: 1.4418, test_f1: 0.5409
 epoch: 90, train_loss: 0.5337, test_loss: 1.5894, test_f1: 0.5341
 epoch: 91, train_loss: 0.5458, test_loss: 1.4417, test_f1: 0.5215
 epoch: 92, train_loss: 0.5448, test_loss: 1.4940, test_f1: 0.5510
 epoch: 93, train_loss: 0.5295, test_loss: 1.4686, test_f1: 0.5506
 epoch: 94, train_loss: 0.5438, test_loss: 1.4452, test_f1: 0.5521
 epoch: 95, train_loss: 0.5314, test_loss: 1.4480, test_f1: 0.5443
 epoch: 96, train_loss: 0.5163, test_loss: 1.4893, test_f1: 0.5560
 epoch: 97, train_loss: 0.5128, test_loss: 1.5745, test_f1: 0.5355
 epoch: 98, train_loss: 0.5275, test_loss: 1.5406, test_f1: 0.5087
 epoch: 99, train_loss: 0.5193, test_loss: 1.5764, test_f1: 0.5240
##################ITERATION #6 ****************************************
 epoch: 0, train_loss: 1.3510, test_loss: 1.1559, test_f1: 0.3880
 epoch: 1, train_loss: 1.2161, test_loss: 1.1053, test_f1: 0.4058
 epoch: 2, train_loss: 1.1416, test_loss: 1.0416, test_f1: 0.4413
 epoch: 3, train_loss: 1.1276, test_loss: 1.0296, test_f1: 0.4530
 epoch: 4, train_loss: 1.0959, test_loss: 1.0292, test_f1: 0.4343
 epoch: 5, train_loss: 1.0756, test_loss: 1.0114, test_f1: 0.4444
 epoch: 6, train_loss: 1.0506, test_loss: 1.0171, test_f1: 0.4688
 epoch: 7, train_loss: 1.0258, test_loss: 1.0283, test_f1: 0.4735
 epoch: 8, train_loss: 1.0193, test_loss: 0.9679, test_f1: 0.4753
 epoch: 9, train_loss: 0.9973, test_loss: 1.0037, test_f1: 0.4676
 epoch: 10, train_loss: 0.9926, test_loss: 0.9661, test_f1: 0.5157
 epoch: 11, train_loss: 0.9572, test_loss: 0.9652, test_f1: 0.4771
 epoch: 12, train_loss: 0.9652, test_loss: 0.9679, test_f1: 0.4636
 epoch: 13, train_loss: 0.9388, test_loss: 0.9881, test_f1: 0.4878
 epoch: 14, train_loss: 0.9246, test_loss: 0.9774, test_f1: 0.4694
 epoch: 15, train_loss: 0.9252, test_loss: 0.9101, test_f1: 0.5184
 epoch: 16, train_loss: 0.9067, test_loss: 0.9629, test_f1: 0.4793
 epoch: 17, train_loss: 0.8926, test_loss: 0.9698, test_f1: 0.4809
 epoch: 18, train_loss: 0.8843, test_loss: 0.9353, test_f1: 0.5036
 epoch: 19, train_loss: 0.8600, test_loss: 0.9733, test_f1: 0.5227
 epoch: 20, train_loss: 0.8722, test_loss: 1.0130, test_f1: 0.4971
 epoch: 21, train_loss: 0.8529, test_loss: 1.1675, test_f1: 0.4786
 epoch: 22, train_loss: 0.8525, test_loss: 1.0201, test_f1: 0.5252
 epoch: 23, train_loss: 0.8676, test_loss: 0.9953, test_f1: 0.5032
 epoch: 24, train_loss: 0.8422, test_loss: 1.0110, test_f1: 0.5118
 epoch: 25, train_loss: 0.8145, test_loss: 1.0629, test_f1: 0.4702
 epoch: 26, train_loss: 0.8207, test_loss: 1.0382, test_f1: 0.5323
 epoch: 27, train_loss: 0.8278, test_loss: 1.0842, test_f1: 0.5096
 epoch: 28, train_loss: 0.8232, test_loss: 1.0810, test_f1: 0.5079
 epoch: 29, train_loss: 0.8179, test_loss: 1.0418, test_f1: 0.5117
 epoch: 30, train_loss: 0.7853, test_loss: 1.0491, test_f1: 0.5390
 epoch: 31, train_loss: 0.7841, test_loss: 1.0655, test_f1: 0.5125
 epoch: 32, train_loss: 0.7909, test_loss: 1.0629, test_f1: 0.5310
 epoch: 33, train_loss: 0.7766, test_loss: 1.2549, test_f1: 0.4735
 epoch: 34, train_loss: 0.7921, test_loss: 1.0803, test_f1: 0.5194
 epoch: 35, train_loss: 0.7838, test_loss: 1.0822, test_f1: 0.5282
 epoch: 36, train_loss: 0.7626, test_loss: 1.0645, test_f1: 0.5495
 epoch: 37, train_loss: 0.7536, test_loss: 1.0569, test_f1: 0.5281
 epoch: 38, train_loss: 0.7628, test_loss: 1.0436, test_f1: 0.5425
 epoch: 39, train_loss: 0.7440, test_loss: 1.1844, test_f1: 0.5230
 epoch: 40, train_loss: 0.7513, test_loss: 1.1184, test_f1: 0.5160
 epoch: 41, train_loss: 0.7364, test_loss: 1.1714, test_f1: 0.5246
 epoch: 42, train_loss: 0.7336, test_loss: 1.1831, test_f1: 0.5060
 epoch: 43, train_loss: 0.7301, test_loss: 1.0839, test_f1: 0.5290
 epoch: 44, train_loss: 0.7210, test_loss: 1.0744, test_f1: 0.5410
 epoch: 45, train_loss: 0.7243, test_loss: 1.1560, test_f1: 0.5049
 epoch: 46, train_loss: 0.7043, test_loss: 1.1210, test_f1: 0.5599
 epoch: 47, train_loss: 0.7105, test_loss: 1.0240, test_f1: 0.5504
 epoch: 48, train_loss: 0.7025, test_loss: 1.1419, test_f1: 0.5481
 epoch: 49, train_loss: 0.7016, test_loss: 1.1471, test_f1: 0.5227
 epoch: 50, train_loss: 0.6914, test_loss: 1.2415, test_f1: 0.5275
 epoch: 51, train_loss: 0.6477, test_loss: 1.1375, test_f1: 0.5534
 epoch: 52, train_loss: 0.6265, test_loss: 1.2193, test_f1: 0.5486
 epoch: 53, train_loss: 0.6225, test_loss: 1.2655, test_f1: 0.5498
 epoch: 54, train_loss: 0.6305, test_loss: 1.2635, test_f1: 0.5581
 epoch: 55, train_loss: 0.6133, test_loss: 1.2579, test_f1: 0.5381
 epoch: 56, train_loss: 0.6062, test_loss: 1.2365, test_f1: 0.5403
 epoch: 57, train_loss: 0.6084, test_loss: 1.3437, test_f1: 0.5356
 epoch: 58, train_loss: 0.5902, test_loss: 1.3314, test_f1: 0.5631
 epoch: 59, train_loss: 0.5947, test_loss: 1.2800, test_f1: 0.5373
 epoch: 60, train_loss: 0.5909, test_loss: 1.2569, test_f1: 0.5532
 epoch: 61, train_loss: 0.5697, test_loss: 1.3082, test_f1: 0.5488
 epoch: 62, train_loss: 0.5757, test_loss: 1.3449, test_f1: 0.5365
 epoch: 63, train_loss: 0.5635, test_loss: 1.2934, test_f1: 0.5536
 epoch: 64, train_loss: 0.5766, test_loss: 1.3807, test_f1: 0.5401
 epoch: 65, train_loss: 0.5698, test_loss: 1.3535, test_f1: 0.5812
 epoch: 66, train_loss: 0.5706, test_loss: 1.3394, test_f1: 0.5757
 epoch: 67, train_loss: 0.5635, test_loss: 1.3115, test_f1: 0.5540
 epoch: 68, train_loss: 0.5594, test_loss: 1.3257, test_f1: 0.5630
 epoch: 69, train_loss: 0.5660, test_loss: 1.3215, test_f1: 0.5448
 epoch: 70, train_loss: 0.5443, test_loss: 1.3333, test_f1: 0.5682
 epoch: 71, train_loss: 0.5426, test_loss: 1.3894, test_f1: 0.5613
 epoch: 72, train_loss: 0.5312, test_loss: 1.4260, test_f1: 0.5474
 epoch: 73, train_loss: 0.5261, test_loss: 1.5252, test_f1: 0.5247
 epoch: 74, train_loss: 0.5448, test_loss: 1.3761, test_f1: 0.5377
 epoch: 75, train_loss: 0.5377, test_loss: 1.3456, test_f1: 0.5531
 epoch: 76, train_loss: 0.5206, test_loss: 1.4538, test_f1: 0.5423
 epoch: 77, train_loss: 0.5318, test_loss: 1.5102, test_f1: 0.5422
 epoch: 78, train_loss: 0.5069, test_loss: 1.4156, test_f1: 0.5547
 epoch: 79, train_loss: 0.5174, test_loss: 1.4227, test_f1: 0.5716
 epoch: 80, train_loss: 0.5120, test_loss: 1.3843, test_f1: 0.5724
 epoch: 81, train_loss: 0.5066, test_loss: 1.4731, test_f1: 0.5650
 epoch: 82, train_loss: 0.5097, test_loss: 1.4914, test_f1: 0.5573
 epoch: 83, train_loss: 0.5070, test_loss: 1.5384, test_f1: 0.5444
 epoch: 84, train_loss: 0.5165, test_loss: 1.4424, test_f1: 0.5483
 epoch: 85, train_loss: 0.5238, test_loss: 1.4089, test_f1: 0.5692
 epoch: 86, train_loss: 0.4957, test_loss: 1.4531, test_f1: 0.5645
 epoch: 87, train_loss: 0.4938, test_loss: 1.4436, test_f1: 0.5783
 epoch: 88, train_loss: 0.4758, test_loss: 1.4292, test_f1: 0.5568
 epoch: 89, train_loss: 0.4979, test_loss: 1.5714, test_f1: 0.5484
 epoch: 90, train_loss: 0.4723, test_loss: 1.4638, test_f1: 0.5536
 epoch: 91, train_loss: 0.4827, test_loss: 1.5111, test_f1: 0.5415
 epoch: 92, train_loss: 0.4963, test_loss: 1.5637, test_f1: 0.5540
 epoch: 93, train_loss: 0.4980, test_loss: 1.3905, test_f1: 0.5679
 epoch: 94, train_loss: 0.4563, test_loss: 1.5433, test_f1: 0.5629
 epoch: 95, train_loss: 0.4573, test_loss: 1.6038, test_f1: 0.5557
 epoch: 96, train_loss: 0.4805, test_loss: 1.5099, test_f1: 0.5392
 epoch: 97, train_loss: 0.4699, test_loss: 1.4543, test_f1: 0.5742
 epoch: 98, train_loss: 0.4778, test_loss: 1.4753, test_f1: 0.5790
 epoch: 99, train_loss: 0.4486, test_loss: 1.4396, test_f1: 0.5798
##################ITERATION #7 ****************************************
 epoch: 0, train_loss: 1.3744, test_loss: 1.2087, test_f1: 0.4018
 epoch: 1, train_loss: 1.2037, test_loss: 1.1886, test_f1: 0.3685
 epoch: 2, train_loss: 1.1612, test_loss: 1.1380, test_f1: 0.3819
 epoch: 3, train_loss: 1.1517, test_loss: 1.0943, test_f1: 0.4250
 epoch: 4, train_loss: 1.1232, test_loss: 1.0618, test_f1: 0.4346
 epoch: 5, train_loss: 1.0889, test_loss: 1.0761, test_f1: 0.4158
 epoch: 6, train_loss: 1.0771, test_loss: 1.0532, test_f1: 0.4335
 epoch: 7, train_loss: 1.0601, test_loss: 1.0616, test_f1: 0.4390
 epoch: 8, train_loss: 1.0239, test_loss: 1.1261, test_f1: 0.4108
 epoch: 9, train_loss: 1.0313, test_loss: 1.0041, test_f1: 0.4461
 epoch: 10, train_loss: 1.0160, test_loss: 0.9772, test_f1: 0.4723
 epoch: 11, train_loss: 0.9921, test_loss: 1.0080, test_f1: 0.4604
 epoch: 12, train_loss: 0.9848, test_loss: 1.0105, test_f1: 0.4800
 epoch: 13, train_loss: 0.9672, test_loss: 1.0091, test_f1: 0.4938
 epoch: 14, train_loss: 0.9643, test_loss: 0.9898, test_f1: 0.4745
 epoch: 15, train_loss: 0.9573, test_loss: 1.0887, test_f1: 0.4495
 epoch: 16, train_loss: 0.9562, test_loss: 0.9733, test_f1: 0.4983
 epoch: 17, train_loss: 0.9415, test_loss: 0.9539, test_f1: 0.4835
 epoch: 18, train_loss: 0.9389, test_loss: 1.0881, test_f1: 0.4634
 epoch: 19, train_loss: 0.9173, test_loss: 0.9988, test_f1: 0.5240
 epoch: 20, train_loss: 0.9153, test_loss: 1.0667, test_f1: 0.4555
 epoch: 21, train_loss: 0.9200, test_loss: 1.1206, test_f1: 0.4571
 epoch: 22, train_loss: 0.9015, test_loss: 1.0185, test_f1: 0.5017
 epoch: 23, train_loss: 0.8861, test_loss: 1.0542, test_f1: 0.4735
 epoch: 24, train_loss: 0.8739, test_loss: 1.0063, test_f1: 0.5118
 epoch: 25, train_loss: 0.8783, test_loss: 1.0446, test_f1: 0.4647
 epoch: 26, train_loss: 0.8616, test_loss: 1.0925, test_f1: 0.4843
 epoch: 27, train_loss: 0.8460, test_loss: 1.0175, test_f1: 0.4957
 epoch: 28, train_loss: 0.8706, test_loss: 1.0038, test_f1: 0.5219
 epoch: 29, train_loss: 0.8499, test_loss: 1.0010, test_f1: 0.4996
 epoch: 30, train_loss: 0.8403, test_loss: 1.1334, test_f1: 0.4922
 epoch: 31, train_loss: 0.8384, test_loss: 1.1552, test_f1: 0.4736
 epoch: 32, train_loss: 0.8289, test_loss: 1.0177, test_f1: 0.5356
 epoch: 33, train_loss: 0.8199, test_loss: 1.0699, test_f1: 0.4802
 epoch: 34, train_loss: 0.8092, test_loss: 1.0796, test_f1: 0.5176
 epoch: 35, train_loss: 0.8090, test_loss: 1.0411, test_f1: 0.5069
 epoch: 36, train_loss: 0.7855, test_loss: 1.0576, test_f1: 0.5144
 epoch: 37, train_loss: 0.8029, test_loss: 1.1233, test_f1: 0.4842
 epoch: 38, train_loss: 0.7858, test_loss: 1.2001, test_f1: 0.5010
 epoch: 39, train_loss: 0.7958, test_loss: 1.1543, test_f1: 0.5174
 epoch: 40, train_loss: 0.7917, test_loss: 1.0698, test_f1: 0.5167
 epoch: 41, train_loss: 0.7850, test_loss: 1.0955, test_f1: 0.5327
 epoch: 42, train_loss: 0.7713, test_loss: 1.0997, test_f1: 0.5249
 epoch: 43, train_loss: 0.7858, test_loss: 1.1536, test_f1: 0.5029
 epoch: 44, train_loss: 0.7725, test_loss: 1.0832, test_f1: 0.5151
 epoch: 45, train_loss: 0.7696, test_loss: 1.0867, test_f1: 0.5276
 epoch: 46, train_loss: 0.7777, test_loss: 1.1349, test_f1: 0.4993
 epoch: 47, train_loss: 0.7428, test_loss: 1.1218, test_f1: 0.5395
 epoch: 48, train_loss: 0.7349, test_loss: 1.0170, test_f1: 0.5399
 epoch: 49, train_loss: 0.7336, test_loss: 1.1434, test_f1: 0.5368
 epoch: 50, train_loss: 0.7477, test_loss: 1.0743, test_f1: 0.5319
 epoch: 51, train_loss: 0.6990, test_loss: 1.0949, test_f1: 0.5262
 epoch: 52, train_loss: 0.6822, test_loss: 1.1079, test_f1: 0.5507
 epoch: 53, train_loss: 0.6827, test_loss: 1.1967, test_f1: 0.5317
 epoch: 54, train_loss: 0.6837, test_loss: 1.1936, test_f1: 0.5356
 epoch: 55, train_loss: 0.6786, test_loss: 1.2134, test_f1: 0.5298
 epoch: 56, train_loss: 0.6564, test_loss: 1.2449, test_f1: 0.5419
 epoch: 57, train_loss: 0.6664, test_loss: 1.2584, test_f1: 0.5131
 epoch: 58, train_loss: 0.6499, test_loss: 1.1682, test_f1: 0.5347
 epoch: 59, train_loss: 0.6428, test_loss: 1.2159, test_f1: 0.5389
 epoch: 60, train_loss: 0.6441, test_loss: 1.3294, test_f1: 0.5292
 epoch: 61, train_loss: 0.6353, test_loss: 1.2244, test_f1: 0.5107
 epoch: 62, train_loss: 0.6417, test_loss: 1.1963, test_f1: 0.5277
 epoch: 63, train_loss: 0.6323, test_loss: 1.3359, test_f1: 0.5349
 epoch: 64, train_loss: 0.6251, test_loss: 1.2343, test_f1: 0.5326
 epoch: 65, train_loss: 0.6387, test_loss: 1.2843, test_f1: 0.5495
 epoch: 66, train_loss: 0.6255, test_loss: 1.2551, test_f1: 0.5431
 epoch: 67, train_loss: 0.6235, test_loss: 1.2508, test_f1: 0.5433
 epoch: 68, train_loss: 0.6419, test_loss: 1.2244, test_f1: 0.5666
 epoch: 69, train_loss: 0.6182, test_loss: 1.2267, test_f1: 0.5559
 epoch: 70, train_loss: 0.6235, test_loss: 1.2524, test_f1: 0.5366
 epoch: 71, train_loss: 0.6094, test_loss: 1.2124, test_f1: 0.5551
 epoch: 72, train_loss: 0.6174, test_loss: 1.3194, test_f1: 0.5219
 epoch: 73, train_loss: 0.5914, test_loss: 1.3162, test_f1: 0.5337
 epoch: 74, train_loss: 0.6036, test_loss: 1.2839, test_f1: 0.5477
 epoch: 75, train_loss: 0.6094, test_loss: 1.3116, test_f1: 0.5437
 epoch: 76, train_loss: 0.5956, test_loss: 1.3288, test_f1: 0.5501
 epoch: 77, train_loss: 0.5857, test_loss: 1.3210, test_f1: 0.5160
 epoch: 78, train_loss: 0.5847, test_loss: 1.3333, test_f1: 0.5482
 epoch: 79, train_loss: 0.5690, test_loss: 1.3578, test_f1: 0.5463
 epoch: 80, train_loss: 0.5760, test_loss: 1.4175, test_f1: 0.5231
 epoch: 81, train_loss: 0.5784, test_loss: 1.3906, test_f1: 0.5457
 epoch: 82, train_loss: 0.5615, test_loss: 1.3472, test_f1: 0.5502
 epoch: 83, train_loss: 0.5849, test_loss: 1.4086, test_f1: 0.5481
 epoch: 84, train_loss: 0.5494, test_loss: 1.3116, test_f1: 0.5624
 epoch: 85, train_loss: 0.5872, test_loss: 1.2909, test_f1: 0.5317
 epoch: 86, train_loss: 0.5616, test_loss: 1.3246, test_f1: 0.5601
 epoch: 87, train_loss: 0.5622, test_loss: 1.3269, test_f1: 0.5294
 epoch: 88, train_loss: 0.5709, test_loss: 1.3851, test_f1: 0.5394
 epoch: 89, train_loss: 0.5565, test_loss: 1.3593, test_f1: 0.5319
 epoch: 90, train_loss: 0.5664, test_loss: 1.3666, test_f1: 0.5358
 epoch: 91, train_loss: 0.5522, test_loss: 1.3540, test_f1: 0.5498
 epoch: 92, train_loss: 0.5278, test_loss: 1.4208, test_f1: 0.5463
 epoch: 93, train_loss: 0.5596, test_loss: 1.3552, test_f1: 0.5440
 epoch: 94, train_loss: 0.5381, test_loss: 1.4309, test_f1: 0.5301
 epoch: 95, train_loss: 0.5629, test_loss: 1.3433, test_f1: 0.5647
 epoch: 96, train_loss: 0.5459, test_loss: 1.3724, test_f1: 0.5136
 epoch: 97, train_loss: 0.5341, test_loss: 1.3921, test_f1: 0.5379
 epoch: 98, train_loss: 0.5188, test_loss: 1.4110, test_f1: 0.5340
 epoch: 99, train_loss: 0.5241, test_loss: 1.4191, test_f1: 0.5423
##################ITERATION #8 ****************************************
 epoch: 0, train_loss: 1.3818, test_loss: 1.1959, test_f1: 0.2853
 epoch: 1, train_loss: 1.2084, test_loss: 1.1231, test_f1: 0.4333
 epoch: 2, train_loss: 1.1632, test_loss: 1.0974, test_f1: 0.4172
 epoch: 3, train_loss: 1.1323, test_loss: 1.0675, test_f1: 0.4153
 epoch: 4, train_loss: 1.1040, test_loss: 1.0616, test_f1: 0.4141
 epoch: 5, train_loss: 1.0792, test_loss: 1.0419, test_f1: 0.4265
 epoch: 6, train_loss: 1.0519, test_loss: 1.0078, test_f1: 0.4755
 epoch: 7, train_loss: 1.0263, test_loss: 0.9915, test_f1: 0.4485
 epoch: 8, train_loss: 1.0049, test_loss: 1.0103, test_f1: 0.4493
 epoch: 9, train_loss: 0.9995, test_loss: 0.9681, test_f1: 0.4914
 epoch: 10, train_loss: 0.9748, test_loss: 1.0249, test_f1: 0.4531
 epoch: 11, train_loss: 0.9617, test_loss: 0.9521, test_f1: 0.4945
 epoch: 12, train_loss: 0.9459, test_loss: 1.0457, test_f1: 0.4544
 epoch: 13, train_loss: 0.9299, test_loss: 0.9481, test_f1: 0.4835
 epoch: 14, train_loss: 0.9312, test_loss: 1.0042, test_f1: 0.4909
 epoch: 15, train_loss: 0.8944, test_loss: 1.0940, test_f1: 0.4469
 epoch: 16, train_loss: 0.9043, test_loss: 0.9442, test_f1: 0.5054
 epoch: 17, train_loss: 0.9116, test_loss: 1.0535, test_f1: 0.4717
 epoch: 18, train_loss: 0.8782, test_loss: 0.9573, test_f1: 0.4934
 epoch: 19, train_loss: 0.8682, test_loss: 1.0300, test_f1: 0.4894
 epoch: 20, train_loss: 0.8676, test_loss: 0.9912, test_f1: 0.5161
 epoch: 21, train_loss: 0.8456, test_loss: 0.9921, test_f1: 0.5013
 epoch: 22, train_loss: 0.8460, test_loss: 1.0441, test_f1: 0.4993
 epoch: 23, train_loss: 0.8356, test_loss: 1.1349, test_f1: 0.5107
 epoch: 24, train_loss: 0.8321, test_loss: 1.0483, test_f1: 0.5134
 epoch: 25, train_loss: 0.8220, test_loss: 1.0265, test_f1: 0.5396
 epoch: 26, train_loss: 0.8148, test_loss: 1.0139, test_f1: 0.5333
 epoch: 27, train_loss: 0.8142, test_loss: 0.9651, test_f1: 0.5143
 epoch: 28, train_loss: 0.7978, test_loss: 1.0270, test_f1: 0.5394
 epoch: 29, train_loss: 0.7992, test_loss: 1.0502, test_f1: 0.4905
 epoch: 30, train_loss: 0.7898, test_loss: 1.0833, test_f1: 0.5407
 epoch: 31, train_loss: 0.7701, test_loss: 1.0377, test_f1: 0.5436
 epoch: 32, train_loss: 0.7787, test_loss: 0.9843, test_f1: 0.5348
 epoch: 33, train_loss: 0.7650, test_loss: 1.0171, test_f1: 0.5163
 epoch: 34, train_loss: 0.7398, test_loss: 1.1509, test_f1: 0.5214
 epoch: 35, train_loss: 0.7582, test_loss: 1.1043, test_f1: 0.5158
 epoch: 36, train_loss: 0.7475, test_loss: 1.1158, test_f1: 0.5103
 epoch: 37, train_loss: 0.7517, test_loss: 1.0116, test_f1: 0.5216
 epoch: 38, train_loss: 0.7461, test_loss: 1.0797, test_f1: 0.5297
 epoch: 39, train_loss: 0.7218, test_loss: 1.1246, test_f1: 0.5313
 epoch: 40, train_loss: 0.7298, test_loss: 1.0783, test_f1: 0.5480
 epoch: 41, train_loss: 0.7228, test_loss: 1.1394, test_f1: 0.5160
 epoch: 42, train_loss: 0.7217, test_loss: 1.1515, test_f1: 0.5244
 epoch: 43, train_loss: 0.7039, test_loss: 1.1374, test_f1: 0.5221
 epoch: 44, train_loss: 0.7115, test_loss: 1.0261, test_f1: 0.5424
 epoch: 45, train_loss: 0.7093, test_loss: 1.1459, test_f1: 0.5343
 epoch: 46, train_loss: 0.7061, test_loss: 1.1322, test_f1: 0.5355
 epoch: 47, train_loss: 0.6737, test_loss: 1.1581, test_f1: 0.5288
 epoch: 48, train_loss: 0.6837, test_loss: 1.1263, test_f1: 0.5244
 epoch: 49, train_loss: 0.6831, test_loss: 1.1244, test_f1: 0.5325
 epoch: 50, train_loss: 0.6629, test_loss: 1.1072, test_f1: 0.5538
 epoch: 51, train_loss: 0.6414, test_loss: 1.3285, test_f1: 0.5296
 epoch: 52, train_loss: 0.6206, test_loss: 1.1456, test_f1: 0.5335
 epoch: 53, train_loss: 0.6146, test_loss: 1.1931, test_f1: 0.5565
 epoch: 54, train_loss: 0.6208, test_loss: 1.1378, test_f1: 0.5571
 epoch: 55, train_loss: 0.6068, test_loss: 1.3092, test_f1: 0.5436
 epoch: 56, train_loss: 0.5927, test_loss: 1.1504, test_f1: 0.5515
 epoch: 57, train_loss: 0.6024, test_loss: 1.1877, test_f1: 0.5612
 epoch: 58, train_loss: 0.5908, test_loss: 1.2027, test_f1: 0.5470
 epoch: 59, train_loss: 0.5850, test_loss: 1.2592, test_f1: 0.5404
 epoch: 60, train_loss: 0.5875, test_loss: 1.2049, test_f1: 0.5369
 epoch: 61, train_loss: 0.5728, test_loss: 1.2144, test_f1: 0.5263
 epoch: 62, train_loss: 0.5960, test_loss: 1.2267, test_f1: 0.5496
 epoch: 63, train_loss: 0.5678, test_loss: 1.2334, test_f1: 0.5517
 epoch: 64, train_loss: 0.5727, test_loss: 1.2143, test_f1: 0.5552
 epoch: 65, train_loss: 0.5721, test_loss: 1.2233, test_f1: 0.5461
 epoch: 66, train_loss: 0.5703, test_loss: 1.2629, test_f1: 0.5402
 epoch: 67, train_loss: 0.5409, test_loss: 1.2718, test_f1: 0.5373
 epoch: 68, train_loss: 0.5593, test_loss: 1.2625, test_f1: 0.5400
 epoch: 69, train_loss: 0.5658, test_loss: 1.3487, test_f1: 0.5198
 epoch: 70, train_loss: 0.5525, test_loss: 1.3027, test_f1: 0.5145
 epoch: 71, train_loss: 0.5482, test_loss: 1.3403, test_f1: 0.5273
 epoch: 72, train_loss: 0.5293, test_loss: 1.2382, test_f1: 0.5570
 epoch: 73, train_loss: 0.5260, test_loss: 1.3502, test_f1: 0.5353
 epoch: 74, train_loss: 0.5284, test_loss: 1.2730, test_f1: 0.5441
 epoch: 75, train_loss: 0.5224, test_loss: 1.3104, test_f1: 0.5351
 epoch: 76, train_loss: 0.5234, test_loss: 1.3498, test_f1: 0.5308
 epoch: 77, train_loss: 0.5335, test_loss: 1.3834, test_f1: 0.5251
 epoch: 78, train_loss: 0.5196, test_loss: 1.3340, test_f1: 0.5246
 epoch: 79, train_loss: 0.5138, test_loss: 1.3176, test_f1: 0.5583
 epoch: 80, train_loss: 0.5163, test_loss: 1.2607, test_f1: 0.5506
 epoch: 81, train_loss: 0.5248, test_loss: 1.3204, test_f1: 0.5530
 epoch: 82, train_loss: 0.5078, test_loss: 1.3661, test_f1: 0.5385
 epoch: 83, train_loss: 0.5001, test_loss: 1.3455, test_f1: 0.5280
 epoch: 84, train_loss: 0.5048, test_loss: 1.3307, test_f1: 0.5547
 epoch: 85, train_loss: 0.5106, test_loss: 1.3350, test_f1: 0.5462
 epoch: 86, train_loss: 0.4940, test_loss: 1.3822, test_f1: 0.5391
 epoch: 87, train_loss: 0.4819, test_loss: 1.3666, test_f1: 0.5449
 epoch: 88, train_loss: 0.4899, test_loss: 1.4172, test_f1: 0.5268
 epoch: 89, train_loss: 0.4848, test_loss: 1.2879, test_f1: 0.5467
 epoch: 90, train_loss: 0.4848, test_loss: 1.4067, test_f1: 0.5298
 epoch: 91, train_loss: 0.4727, test_loss: 1.4671, test_f1: 0.5372
 epoch: 92, train_loss: 0.4679, test_loss: 1.4139, test_f1: 0.5386
 epoch: 93, train_loss: 0.4905, test_loss: 1.5125, test_f1: 0.5272
 epoch: 94, train_loss: 0.4940, test_loss: 1.4482, test_f1: 0.5381
 epoch: 95, train_loss: 0.4576, test_loss: 1.4179, test_f1: 0.5432
 epoch: 96, train_loss: 0.4682, test_loss: 1.3550, test_f1: 0.5506
 epoch: 97, train_loss: 0.4806, test_loss: 1.3812, test_f1: 0.5448
 epoch: 98, train_loss: 0.4684, test_loss: 1.4416, test_f1: 0.5309
 epoch: 99, train_loss: 0.4535, test_loss: 1.4373, test_f1: 0.5461
##################ITERATION #9 ****************************************
 epoch: 0, train_loss: 1.3976, test_loss: 1.2081, test_f1: 0.3771
 epoch: 1, train_loss: 1.2030, test_loss: 1.1194, test_f1: 0.4264
 epoch: 2, train_loss: 1.1528, test_loss: 1.0683, test_f1: 0.4377
 epoch: 3, train_loss: 1.1221, test_loss: 1.0643, test_f1: 0.4334
 epoch: 4, train_loss: 1.0946, test_loss: 1.0549, test_f1: 0.4486
 epoch: 5, train_loss: 1.0752, test_loss: 1.0459, test_f1: 0.4561
 epoch: 6, train_loss: 1.0471, test_loss: 1.0131, test_f1: 0.4693
 epoch: 7, train_loss: 1.0266, test_loss: 0.9885, test_f1: 0.5055
 epoch: 8, train_loss: 1.0139, test_loss: 0.9569, test_f1: 0.4739
 epoch: 9, train_loss: 0.9874, test_loss: 0.9601, test_f1: 0.4780
 epoch: 10, train_loss: 0.9632, test_loss: 0.9969, test_f1: 0.4655
 epoch: 11, train_loss: 0.9534, test_loss: 0.9743, test_f1: 0.4726
 epoch: 12, train_loss: 0.9462, test_loss: 0.9935, test_f1: 0.4769
 epoch: 13, train_loss: 0.9336, test_loss: 1.0004, test_f1: 0.4841
 epoch: 14, train_loss: 0.9247, test_loss: 1.0065, test_f1: 0.4773
 epoch: 15, train_loss: 0.9104, test_loss: 1.0126, test_f1: 0.4577
 epoch: 16, train_loss: 0.8817, test_loss: 1.0242, test_f1: 0.4590
 epoch: 17, train_loss: 0.8801, test_loss: 1.0002, test_f1: 0.4694
 epoch: 18, train_loss: 0.8616, test_loss: 0.9820, test_f1: 0.4994
 epoch: 19, train_loss: 0.8562, test_loss: 1.0102, test_f1: 0.4943
 epoch: 20, train_loss: 0.8716, test_loss: 1.0173, test_f1: 0.4836
 epoch: 21, train_loss: 0.8597, test_loss: 1.0080, test_f1: 0.5195
 epoch: 22, train_loss: 0.8508, test_loss: 1.0452, test_f1: 0.5131
 epoch: 23, train_loss: 0.8423, test_loss: 1.0892, test_f1: 0.5033
 epoch: 24, train_loss: 0.8352, test_loss: 0.9920, test_f1: 0.4915
 epoch: 25, train_loss: 0.8156, test_loss: 1.1083, test_f1: 0.4962
 epoch: 26, train_loss: 0.8099, test_loss: 1.0411, test_f1: 0.4944
 epoch: 27, train_loss: 0.8332, test_loss: 1.0200, test_f1: 0.5027
 epoch: 28, train_loss: 0.8104, test_loss: 1.0365, test_f1: 0.4972
 epoch: 29, train_loss: 0.8068, test_loss: 1.0684, test_f1: 0.5112
 epoch: 30, train_loss: 0.7881, test_loss: 1.0546, test_f1: 0.5214
 epoch: 31, train_loss: 0.7798, test_loss: 1.1061, test_f1: 0.5095
 epoch: 32, train_loss: 0.7680, test_loss: 1.0930, test_f1: 0.5055
 epoch: 33, train_loss: 0.7835, test_loss: 1.0795, test_f1: 0.5360
 epoch: 34, train_loss: 0.7783, test_loss: 1.1021, test_f1: 0.5116
 epoch: 35, train_loss: 0.7703, test_loss: 1.0478, test_f1: 0.5446
 epoch: 36, train_loss: 0.7534, test_loss: 1.0942, test_f1: 0.5399
 epoch: 37, train_loss: 0.7383, test_loss: 1.1252, test_f1: 0.5438
 epoch: 38, train_loss: 0.7459, test_loss: 1.1041, test_f1: 0.5385
 epoch: 39, train_loss: 0.7297, test_loss: 1.1981, test_f1: 0.5322
 epoch: 40, train_loss: 0.7109, test_loss: 1.1723, test_f1: 0.5079
 epoch: 41, train_loss: 0.7015, test_loss: 1.0767, test_f1: 0.5586
 epoch: 42, train_loss: 0.7384, test_loss: 1.1137, test_f1: 0.5393
 epoch: 43, train_loss: 0.7352, test_loss: 1.2554, test_f1: 0.4895
 epoch: 44, train_loss: 0.7288, test_loss: 1.1657, test_f1: 0.5571
 epoch: 45, train_loss: 0.7125, test_loss: 1.1885, test_f1: 0.5293
 epoch: 46, train_loss: 0.6961, test_loss: 1.1665, test_f1: 0.5278
 epoch: 47, train_loss: 0.6830, test_loss: 1.2597, test_f1: 0.5301
 epoch: 48, train_loss: 0.6917, test_loss: 1.2419, test_f1: 0.5238
 epoch: 49, train_loss: 0.6940, test_loss: 1.1223, test_f1: 0.5309
 epoch: 50, train_loss: 0.6916, test_loss: 1.2128, test_f1: 0.5234
 epoch: 51, train_loss: 0.6359, test_loss: 1.2443, test_f1: 0.5299
 epoch: 52, train_loss: 0.6051, test_loss: 1.2190, test_f1: 0.5516
 epoch: 53, train_loss: 0.6100, test_loss: 1.2545, test_f1: 0.5500
 epoch: 54, train_loss: 0.5955, test_loss: 1.3109, test_f1: 0.5406
 epoch: 55, train_loss: 0.6029, test_loss: 1.3030, test_f1: 0.5542
 epoch: 56, train_loss: 0.5975, test_loss: 1.2308, test_f1: 0.5615
 epoch: 57, train_loss: 0.6017, test_loss: 1.2739, test_f1: 0.5536
 epoch: 58, train_loss: 0.5875, test_loss: 1.3434, test_f1: 0.5237
 epoch: 59, train_loss: 0.5839, test_loss: 1.2648, test_f1: 0.5524
 epoch: 60, train_loss: 0.5625, test_loss: 1.3061, test_f1: 0.5372
 epoch: 61, train_loss: 0.5759, test_loss: 1.2746, test_f1: 0.5543
 epoch: 62, train_loss: 0.5834, test_loss: 1.3149, test_f1: 0.5554
 epoch: 63, train_loss: 0.5816, test_loss: 1.2847, test_f1: 0.5476
 epoch: 64, train_loss: 0.5913, test_loss: 1.2964, test_f1: 0.5495
 epoch: 65, train_loss: 0.5742, test_loss: 1.2850, test_f1: 0.5399
 epoch: 66, train_loss: 0.5638, test_loss: 1.3616, test_f1: 0.5625
 epoch: 67, train_loss: 0.5504, test_loss: 1.3832, test_f1: 0.5469
 epoch: 68, train_loss: 0.5587, test_loss: 1.3235, test_f1: 0.5732
 epoch: 69, train_loss: 0.5622, test_loss: 1.4310, test_f1: 0.5659
 epoch: 70, train_loss: 0.5251, test_loss: 1.4162, test_f1: 0.5465
 epoch: 71, train_loss: 0.5370, test_loss: 1.4285, test_f1: 0.5466
 epoch: 72, train_loss: 0.5313, test_loss: 1.3470, test_f1: 0.5639
 epoch: 73, train_loss: 0.5401, test_loss: 1.4635, test_f1: 0.5487
 epoch: 74, train_loss: 0.5448, test_loss: 1.4155, test_f1: 0.5367
 epoch: 75, train_loss: 0.5223, test_loss: 1.4419, test_f1: 0.5420
 epoch: 76, train_loss: 0.5276, test_loss: 1.4271, test_f1: 0.5628
 epoch: 77, train_loss: 0.5438, test_loss: 1.3596, test_f1: 0.5623
 epoch: 78, train_loss: 0.5297, test_loss: 1.3856, test_f1: 0.5568
 epoch: 79, train_loss: 0.5286, test_loss: 1.3908, test_f1: 0.5431
 epoch: 80, train_loss: 0.5266, test_loss: 1.3637, test_f1: 0.5701
 epoch: 81, train_loss: 0.5260, test_loss: 1.4551, test_f1: 0.5356
 epoch: 82, train_loss: 0.5133, test_loss: 1.4128, test_f1: 0.5382
 epoch: 83, train_loss: 0.4984, test_loss: 1.5278, test_f1: 0.5336
 epoch: 84, train_loss: 0.5104, test_loss: 1.5260, test_f1: 0.5402
 epoch: 85, train_loss: 0.5083, test_loss: 1.4350, test_f1: 0.5710
 epoch: 86, train_loss: 0.5021, test_loss: 1.4498, test_f1: 0.5575
 epoch: 87, train_loss: 0.4878, test_loss: 1.4501, test_f1: 0.5672
 epoch: 88, train_loss: 0.4786, test_loss: 1.4288, test_f1: 0.5676
 epoch: 89, train_loss: 0.4757, test_loss: 1.4863, test_f1: 0.5822
 epoch: 90, train_loss: 0.4896, test_loss: 1.4866, test_f1: 0.5740
 epoch: 91, train_loss: 0.4796, test_loss: 1.4690, test_f1: 0.5809
 epoch: 92, train_loss: 0.4662, test_loss: 1.5045, test_f1: 0.5749
 epoch: 93, train_loss: 0.4842, test_loss: 1.4645, test_f1: 0.5691
 epoch: 94, train_loss: 0.4928, test_loss: 1.4014, test_f1: 0.5889
 epoch: 95, train_loss: 0.4715, test_loss: 1.5103, test_f1: 0.5753
 epoch: 96, train_loss: 0.4683, test_loss: 1.4830, test_f1: 0.5812
 epoch: 97, train_loss: 0.4619, test_loss: 1.5441, test_f1: 0.5652
 epoch: 98, train_loss: 0.4783, test_loss: 1.4873, test_f1: 0.5669
 epoch: 99, train_loss: 0.4679, test_loss: 1.5006, test_f1: 0.5755

Training completed in 883.02 seconds
Best F1: 0.6217 at epoch 94
Mean F1 across iterations: 0.5779  0.0169
========================FINAL RESULTS================================
FEGIN weighted F1: 0.6217  0.0169
python main.py --data ltspice_examples --representation component_component --model FEGIN --layers 6 --hiddens 64 --batch_size 64 --lr 0.001 --emb_size 512 --epochs 100 --save_appendix component_component_L6_H64_BS64_LR0.001_E512 --no_val
-----



STDERR:
  File "main.py", line 370, in <module>
    main()
  File "main.py", line 254, in main
    dataset = dataset_class(
  File "/home/philip/projects/ltspice_examples_code_repo/Circuit-Completion-Using-GNNs/component_classification_with_link_prediction_head/evaluation/FEGIN/kernel/circuit_datasets.py", line 15, in __init__
    self.data, self.slices = torch.load(self.processed_paths[0])
  File "/home/philip/.local/lib/python3.8/site-packages/torch/serialization.py", line 1040, in load
    warnings.warn(
  File "/usr/lib/python3.8/warnings.py", line 109, in _showwarnmsg
    sw(msg.message, msg.category, msg.filename, msg.lineno,
  File "main.py", line 47, in warn_with_traceback
    traceback.print_stack(file=log)
/home/philip/projects/ltspice_examples_code_repo/Circuit-Completion-Using-GNNs/component_classification_with_link_prediction_head/evaluation/FEGIN/kernel/circuit_datasets.py:15: FutureWarning: You are using `torch.load` with `weights_only=False` (the current default value), which uses the default pickle module implicitly. It is possible to construct malicious pickle data which will execute arbitrary code during unpickling (See https://github.com/pytorch/pytorch/blob/main/SECURITY.md#untrusted-models for more details). In a future release, the default value for `weights_only` will be flipped to `True`. This limits the functions that could be executed during unpickling. Arbitrary objects will no longer be allowed to be loaded via this mode unless they are explicitly allowlisted by the user via `torch.serialization.add_safe_globals`. We recommend you start setting `weights_only=True` for any use case where you don't have full control of the loaded file. Please open an issue on GitHub for any issues related to this experimental feature.
  self.data, self.slices = torch.load(self.processed_paths[0])
