STDOUT:
Results will be saved in /home/philip/projects/ltspice_examples_code_repo/Circuit-Completion-Using-GNNs/component_classification_with_link_prediction_head/evaluation/FEGIN/results/model_FEGIN_dataset_ltspice_examples
Command line input: python main.py --data ltspice_examples --representation component_pin --model FEGIN --layers 4 --hiddens 16 --batch_size 64 --lr 0.001 --emb_size 250 --epochs 100 --save_appendix component_pin_L4_H16_BS64_LR0.001_E250 --no_val
 is saved.
-----
ltspice_examples - FEGIN
Using 4 layers, 16 hidden units, h = 2
Loading component_pin representation dataset
ENTERED
Training FEGIN on component_pin representation
Train: 3560, Test: 848
##################ITERATION #0 ****************************************
 epoch: 0, train_loss: 1.3830, test_loss: 1.3135, test_f1: 0.3537
 epoch: 1, train_loss: 1.2679, test_loss: 1.2095, test_f1: 0.2383
 epoch: 2, train_loss: 1.2100, test_loss: 1.1701, test_f1: 0.2545
 epoch: 3, train_loss: 1.1765, test_loss: 1.1282, test_f1: 0.3377
 epoch: 4, train_loss: 1.1244, test_loss: 1.0734, test_f1: 0.3412
 epoch: 5, train_loss: 1.0549, test_loss: 1.0187, test_f1: 0.3581
 epoch: 6, train_loss: 1.0137, test_loss: 0.9726, test_f1: 0.4548
 epoch: 7, train_loss: 0.9872, test_loss: 1.0177, test_f1: 0.4348
 epoch: 8, train_loss: 0.9746, test_loss: 0.9780, test_f1: 0.4591
 epoch: 9, train_loss: 0.9489, test_loss: 0.9863, test_f1: 0.4689
 epoch: 10, train_loss: 0.9328, test_loss: 0.9586, test_f1: 0.4632
 epoch: 11, train_loss: 0.9256, test_loss: 0.9683, test_f1: 0.4953
 epoch: 12, train_loss: 0.9091, test_loss: 0.9531, test_f1: 0.4861
 epoch: 13, train_loss: 0.9118, test_loss: 0.9540, test_f1: 0.4849
 epoch: 14, train_loss: 0.9021, test_loss: 1.0878, test_f1: 0.4655
 epoch: 15, train_loss: 0.8948, test_loss: 0.9292, test_f1: 0.4944
 epoch: 16, train_loss: 0.8835, test_loss: 0.9571, test_f1: 0.4867
 epoch: 17, train_loss: 0.8836, test_loss: 0.9431, test_f1: 0.5204
 epoch: 18, train_loss: 0.8790, test_loss: 1.0285, test_f1: 0.4931
 epoch: 19, train_loss: 0.8685, test_loss: 0.9352, test_f1: 0.4922
 epoch: 20, train_loss: 0.8703, test_loss: 0.9648, test_f1: 0.4951
 epoch: 21, train_loss: 0.8619, test_loss: 0.9527, test_f1: 0.5057
 epoch: 22, train_loss: 0.8543, test_loss: 0.9311, test_f1: 0.4856
 epoch: 23, train_loss: 0.8491, test_loss: 0.9366, test_f1: 0.5169
 epoch: 24, train_loss: 0.8552, test_loss: 0.9386, test_f1: 0.5155
 epoch: 25, train_loss: 0.8392, test_loss: 0.9463, test_f1: 0.5106
 epoch: 26, train_loss: 0.8327, test_loss: 0.8745, test_f1: 0.5166
 epoch: 27, train_loss: 0.8232, test_loss: 0.8850, test_f1: 0.5195
 epoch: 28, train_loss: 0.8324, test_loss: 0.9182, test_f1: 0.5287
 epoch: 29, train_loss: 0.8344, test_loss: 0.9348, test_f1: 0.5059
 epoch: 30, train_loss: 0.8220, test_loss: 0.9922, test_f1: 0.5038
 epoch: 31, train_loss: 0.8288, test_loss: 0.9313, test_f1: 0.5115
 epoch: 32, train_loss: 0.8144, test_loss: 0.9149, test_f1: 0.5278
 epoch: 33, train_loss: 0.8182, test_loss: 0.9049, test_f1: 0.5366
 epoch: 34, train_loss: 0.8357, test_loss: 0.8849, test_f1: 0.5245
 epoch: 35, train_loss: 0.8125, test_loss: 0.9044, test_f1: 0.5175
 epoch: 36, train_loss: 0.8078, test_loss: 0.9111, test_f1: 0.5251
 epoch: 37, train_loss: 0.7977, test_loss: 0.9249, test_f1: 0.5164
 epoch: 38, train_loss: 0.8080, test_loss: 0.8910, test_f1: 0.5333
 epoch: 39, train_loss: 0.7904, test_loss: 0.9108, test_f1: 0.5266
 epoch: 40, train_loss: 0.7937, test_loss: 0.9079, test_f1: 0.5277
 epoch: 41, train_loss: 0.7954, test_loss: 0.9421, test_f1: 0.5159
 epoch: 42, train_loss: 0.7844, test_loss: 0.9017, test_f1: 0.5238
 epoch: 43, train_loss: 0.7789, test_loss: 0.8933, test_f1: 0.5224
 epoch: 44, train_loss: 0.7894, test_loss: 0.9150, test_f1: 0.5228
 epoch: 45, train_loss: 0.7913, test_loss: 0.9312, test_f1: 0.5176
 epoch: 46, train_loss: 0.7759, test_loss: 0.9312, test_f1: 0.5177
 epoch: 47, train_loss: 0.7827, test_loss: 0.9125, test_f1: 0.5273
 epoch: 48, train_loss: 0.7947, test_loss: 0.9110, test_f1: 0.5287
 epoch: 49, train_loss: 0.7598, test_loss: 0.9276, test_f1: 0.5237
 epoch: 50, train_loss: 0.7672, test_loss: 0.8977, test_f1: 0.5342
 epoch: 51, train_loss: 0.7479, test_loss: 0.9017, test_f1: 0.5234
 epoch: 52, train_loss: 0.7352, test_loss: 0.9005, test_f1: 0.5349
 epoch: 53, train_loss: 0.7501, test_loss: 0.8817, test_f1: 0.5438
 epoch: 54, train_loss: 0.7411, test_loss: 0.8924, test_f1: 0.5191
 epoch: 55, train_loss: 0.7343, test_loss: 0.9017, test_f1: 0.5279
 epoch: 56, train_loss: 0.7446, test_loss: 0.9108, test_f1: 0.5280
 epoch: 57, train_loss: 0.7438, test_loss: 0.9032, test_f1: 0.5323
 epoch: 58, train_loss: 0.7554, test_loss: 0.8755, test_f1: 0.5356
 epoch: 59, train_loss: 0.7458, test_loss: 0.8876, test_f1: 0.5378
 epoch: 60, train_loss: 0.7463, test_loss: 0.9248, test_f1: 0.5312
 epoch: 61, train_loss: 0.7409, test_loss: 0.8936, test_f1: 0.5386
 epoch: 62, train_loss: 0.7369, test_loss: 0.9252, test_f1: 0.5281
 epoch: 63, train_loss: 0.7398, test_loss: 0.9177, test_f1: 0.5256
 epoch: 64, train_loss: 0.7229, test_loss: 0.8898, test_f1: 0.5415
 epoch: 65, train_loss: 0.7392, test_loss: 0.9256, test_f1: 0.5263
 epoch: 66, train_loss: 0.7307, test_loss: 0.8733, test_f1: 0.5380
 epoch: 67, train_loss: 0.7332, test_loss: 0.9064, test_f1: 0.5320
 epoch: 68, train_loss: 0.7411, test_loss: 0.9057, test_f1: 0.5249
 epoch: 69, train_loss: 0.7207, test_loss: 0.9174, test_f1: 0.5410
 epoch: 70, train_loss: 0.7363, test_loss: 0.8975, test_f1: 0.5319
 epoch: 71, train_loss: 0.7296, test_loss: 0.9180, test_f1: 0.5264
 epoch: 72, train_loss: 0.7269, test_loss: 0.8961, test_f1: 0.5264
 epoch: 73, train_loss: 0.7243, test_loss: 0.9322, test_f1: 0.5353
 epoch: 74, train_loss: 0.7136, test_loss: 0.9106, test_f1: 0.5327
 epoch: 75, train_loss: 0.7238, test_loss: 0.8859, test_f1: 0.5395
 epoch: 76, train_loss: 0.7251, test_loss: 0.8848, test_f1: 0.5296
 epoch: 77, train_loss: 0.7293, test_loss: 0.8558, test_f1: 0.5450
 epoch: 78, train_loss: 0.7286, test_loss: 0.8627, test_f1: 0.5414
 epoch: 79, train_loss: 0.7327, test_loss: 0.8942, test_f1: 0.5312
 epoch: 80, train_loss: 0.7211, test_loss: 0.8757, test_f1: 0.5350
 epoch: 81, train_loss: 0.7184, test_loss: 0.8813, test_f1: 0.5388
 epoch: 82, train_loss: 0.7282, test_loss: 0.8863, test_f1: 0.5487
 epoch: 83, train_loss: 0.7128, test_loss: 0.8725, test_f1: 0.5271
 epoch: 84, train_loss: 0.7173, test_loss: 0.8843, test_f1: 0.5339
 epoch: 85, train_loss: 0.7059, test_loss: 0.8992, test_f1: 0.5356
 epoch: 86, train_loss: 0.7092, test_loss: 0.9052, test_f1: 0.5392
 epoch: 87, train_loss: 0.7068, test_loss: 0.8833, test_f1: 0.5343
 epoch: 88, train_loss: 0.7151, test_loss: 0.9092, test_f1: 0.5242
 epoch: 89, train_loss: 0.7118, test_loss: 0.9445, test_f1: 0.5216
 epoch: 90, train_loss: 0.7110, test_loss: 0.8967, test_f1: 0.5283
 epoch: 91, train_loss: 0.7187, test_loss: 0.8861, test_f1: 0.5285
 epoch: 92, train_loss: 0.7081, test_loss: 0.9595, test_f1: 0.5261
 epoch: 93, train_loss: 0.7156, test_loss: 0.9295, test_f1: 0.5321
 epoch: 94, train_loss: 0.7049, test_loss: 0.9014, test_f1: 0.5328
 epoch: 95, train_loss: 0.6995, test_loss: 0.9118, test_f1: 0.5343
 epoch: 96, train_loss: 0.7127, test_loss: 0.9022, test_f1: 0.5333
 epoch: 97, train_loss: 0.7046, test_loss: 0.9249, test_f1: 0.5283
 epoch: 98, train_loss: 0.7049, test_loss: 0.9092, test_f1: 0.5304
 epoch: 99, train_loss: 0.6969, test_loss: 0.8513, test_f1: 0.5398
##################ITERATION #1 ****************************************
 epoch: 0, train_loss: 1.2953, test_loss: 1.2373, test_f1: 0.2909
 epoch: 1, train_loss: 1.1935, test_loss: 1.1386, test_f1: 0.3424
 epoch: 2, train_loss: 1.1407, test_loss: 1.0881, test_f1: 0.3269
 epoch: 3, train_loss: 1.0906, test_loss: 1.0784, test_f1: 0.3184
 epoch: 4, train_loss: 1.0601, test_loss: 1.0597, test_f1: 0.3639
 epoch: 5, train_loss: 1.0319, test_loss: 1.0696, test_f1: 0.4047
 epoch: 6, train_loss: 1.0246, test_loss: 1.0715, test_f1: 0.4122
 epoch: 7, train_loss: 0.9963, test_loss: 1.0260, test_f1: 0.4677
 epoch: 8, train_loss: 0.9976, test_loss: 1.0666, test_f1: 0.4494
 epoch: 9, train_loss: 0.9763, test_loss: 1.0402, test_f1: 0.4615
 epoch: 10, train_loss: 0.9675, test_loss: 1.0384, test_f1: 0.4648
 epoch: 11, train_loss: 0.9670, test_loss: 1.0424, test_f1: 0.4686
 epoch: 12, train_loss: 0.9568, test_loss: 1.0337, test_f1: 0.4979
 epoch: 13, train_loss: 0.9451, test_loss: 1.0248, test_f1: 0.4647
 epoch: 14, train_loss: 0.9391, test_loss: 1.0706, test_f1: 0.4349
 epoch: 15, train_loss: 0.9297, test_loss: 1.1056, test_f1: 0.4558
 epoch: 16, train_loss: 0.9277, test_loss: 1.1025, test_f1: 0.4656
 epoch: 17, train_loss: 0.9171, test_loss: 1.0750, test_f1: 0.4616
 epoch: 18, train_loss: 0.9115, test_loss: 1.0158, test_f1: 0.4772
 epoch: 19, train_loss: 0.8990, test_loss: 1.1253, test_f1: 0.4668
 epoch: 20, train_loss: 0.9106, test_loss: 1.0785, test_f1: 0.4711
 epoch: 21, train_loss: 0.8934, test_loss: 1.0065, test_f1: 0.4904
 epoch: 22, train_loss: 0.8857, test_loss: 1.0412, test_f1: 0.4708
 epoch: 23, train_loss: 0.8956, test_loss: 1.0140, test_f1: 0.4875
 epoch: 24, train_loss: 0.8840, test_loss: 0.9962, test_f1: 0.4944
 epoch: 25, train_loss: 0.8761, test_loss: 0.9730, test_f1: 0.5085
 epoch: 26, train_loss: 0.8741, test_loss: 1.0390, test_f1: 0.4843
 epoch: 27, train_loss: 0.8616, test_loss: 1.0052, test_f1: 0.5073
 epoch: 28, train_loss: 0.8782, test_loss: 1.0415, test_f1: 0.4854
 epoch: 29, train_loss: 0.8719, test_loss: 1.1030, test_f1: 0.4572
 epoch: 30, train_loss: 0.8632, test_loss: 0.9948, test_f1: 0.5045
 epoch: 31, train_loss: 0.8477, test_loss: 0.9659, test_f1: 0.5011
 epoch: 32, train_loss: 0.8613, test_loss: 1.2593, test_f1: 0.4128
 epoch: 33, train_loss: 0.8505, test_loss: 1.0779, test_f1: 0.4748
 epoch: 34, train_loss: 0.8486, test_loss: 1.0139, test_f1: 0.5020
 epoch: 35, train_loss: 0.8373, test_loss: 0.9907, test_f1: 0.4964
 epoch: 36, train_loss: 0.8339, test_loss: 0.9792, test_f1: 0.5133
 epoch: 37, train_loss: 0.8427, test_loss: 1.0678, test_f1: 0.4970
 epoch: 38, train_loss: 0.8367, test_loss: 0.9858, test_f1: 0.5131
 epoch: 39, train_loss: 0.8302, test_loss: 1.1344, test_f1: 0.4735
 epoch: 40, train_loss: 0.8254, test_loss: 1.0095, test_f1: 0.5111
 epoch: 41, train_loss: 0.8277, test_loss: 1.0072, test_f1: 0.5156
 epoch: 42, train_loss: 0.8277, test_loss: 1.0048, test_f1: 0.5110
 epoch: 43, train_loss: 0.8404, test_loss: 1.0172, test_f1: 0.5165
 epoch: 44, train_loss: 0.8317, test_loss: 1.0599, test_f1: 0.4966
 epoch: 45, train_loss: 0.8171, test_loss: 1.4286, test_f1: 0.4302
 epoch: 46, train_loss: 0.8235, test_loss: 1.0649, test_f1: 0.4831
 epoch: 47, train_loss: 0.8124, test_loss: 1.0057, test_f1: 0.5081
 epoch: 48, train_loss: 0.8289, test_loss: 1.0020, test_f1: 0.5101
 epoch: 49, train_loss: 0.8193, test_loss: 0.9963, test_f1: 0.5122
 epoch: 50, train_loss: 0.8115, test_loss: 1.1554, test_f1: 0.4552
 epoch: 51, train_loss: 0.7961, test_loss: 1.0709, test_f1: 0.4827
 epoch: 52, train_loss: 0.7912, test_loss: 1.0384, test_f1: 0.5049
 epoch: 53, train_loss: 0.7973, test_loss: 1.0153, test_f1: 0.4883
 epoch: 54, train_loss: 0.7852, test_loss: 1.0860, test_f1: 0.4819
 epoch: 55, train_loss: 0.7756, test_loss: 1.0090, test_f1: 0.4928
 epoch: 56, train_loss: 0.7770, test_loss: 1.0194, test_f1: 0.5033
 epoch: 57, train_loss: 0.7920, test_loss: 1.0297, test_f1: 0.5015
 epoch: 58, train_loss: 0.7824, test_loss: 1.0296, test_f1: 0.4986
 epoch: 59, train_loss: 0.7863, test_loss: 1.0701, test_f1: 0.4817
 epoch: 60, train_loss: 0.7819, test_loss: 1.0244, test_f1: 0.5000
 epoch: 61, train_loss: 0.7762, test_loss: 1.0110, test_f1: 0.5033
 epoch: 62, train_loss: 0.7850, test_loss: 1.0433, test_f1: 0.5023
 epoch: 63, train_loss: 0.7717, test_loss: 1.0604, test_f1: 0.4970
 epoch: 64, train_loss: 0.7671, test_loss: 1.0879, test_f1: 0.4933
 epoch: 65, train_loss: 0.7614, test_loss: 1.1115, test_f1: 0.4974
 epoch: 66, train_loss: 0.7717, test_loss: 1.0239, test_f1: 0.5098
 epoch: 67, train_loss: 0.7633, test_loss: 1.0291, test_f1: 0.5117
 epoch: 68, train_loss: 0.7637, test_loss: 1.0586, test_f1: 0.5067
 epoch: 69, train_loss: 0.7646, test_loss: 1.0961, test_f1: 0.5000
 epoch: 70, train_loss: 0.7725, test_loss: 1.0185, test_f1: 0.5052
 epoch: 71, train_loss: 0.7682, test_loss: 1.0524, test_f1: 0.4993
 epoch: 72, train_loss: 0.7669, test_loss: 1.0179, test_f1: 0.5069
 epoch: 73, train_loss: 0.7619, test_loss: 1.0355, test_f1: 0.5096
 epoch: 74, train_loss: 0.7656, test_loss: 1.1014, test_f1: 0.5236
 epoch: 75, train_loss: 0.7652, test_loss: 1.0674, test_f1: 0.5118
 epoch: 76, train_loss: 0.7456, test_loss: 1.0259, test_f1: 0.5175
 epoch: 77, train_loss: 0.7513, test_loss: 1.0666, test_f1: 0.4927
 epoch: 78, train_loss: 0.7605, test_loss: 1.0430, test_f1: 0.5018
 epoch: 79, train_loss: 0.7605, test_loss: 1.0337, test_f1: 0.5099
 epoch: 80, train_loss: 0.7471, test_loss: 1.0618, test_f1: 0.4991
 epoch: 81, train_loss: 0.7587, test_loss: 1.0515, test_f1: 0.5013
 epoch: 82, train_loss: 0.7445, test_loss: 1.1170, test_f1: 0.4994
 epoch: 83, train_loss: 0.7492, test_loss: 1.0311, test_f1: 0.5191
 epoch: 84, train_loss: 0.7463, test_loss: 1.0572, test_f1: 0.5028
 epoch: 85, train_loss: 0.7516, test_loss: 1.0840, test_f1: 0.4983
 epoch: 86, train_loss: 0.7519, test_loss: 1.0397, test_f1: 0.5188
 epoch: 87, train_loss: 0.7505, test_loss: 1.0268, test_f1: 0.5031
 epoch: 88, train_loss: 0.7388, test_loss: 1.0524, test_f1: 0.5134
 epoch: 89, train_loss: 0.7529, test_loss: 1.0383, test_f1: 0.5094
 epoch: 90, train_loss: 0.7541, test_loss: 1.0193, test_f1: 0.5187
 epoch: 91, train_loss: 0.7391, test_loss: 1.0204, test_f1: 0.5286
 epoch: 92, train_loss: 0.7430, test_loss: 1.0551, test_f1: 0.5052
 epoch: 93, train_loss: 0.7448, test_loss: 1.0024, test_f1: 0.5344
 epoch: 94, train_loss: 0.7518, test_loss: 1.0291, test_f1: 0.5228
 epoch: 95, train_loss: 0.7484, test_loss: 1.0612, test_f1: 0.5113
 epoch: 96, train_loss: 0.7308, test_loss: 1.0800, test_f1: 0.5059
 epoch: 97, train_loss: 0.7343, test_loss: 1.0981, test_f1: 0.5003
 epoch: 98, train_loss: 0.7502, test_loss: 1.0535, test_f1: 0.5166
 epoch: 99, train_loss: 0.7436, test_loss: 1.0807, test_f1: 0.4962
##################ITERATION #2 ****************************************
 epoch: 0, train_loss: 1.3073, test_loss: 1.2349, test_f1: 0.2286
 epoch: 1, train_loss: 1.1694, test_loss: 1.1745, test_f1: 0.3626
 epoch: 2, train_loss: 1.1156, test_loss: 1.1014, test_f1: 0.4187
 epoch: 3, train_loss: 1.0864, test_loss: 1.0661, test_f1: 0.3743
 epoch: 4, train_loss: 1.0739, test_loss: 1.1977, test_f1: 0.3513
 epoch: 5, train_loss: 1.0703, test_loss: 1.0824, test_f1: 0.4204
 epoch: 6, train_loss: 1.0549, test_loss: 1.0404, test_f1: 0.4367
 epoch: 7, train_loss: 1.0345, test_loss: 1.0361, test_f1: 0.4337
 epoch: 8, train_loss: 1.0327, test_loss: 1.0599, test_f1: 0.4487
 epoch: 9, train_loss: 1.0130, test_loss: 1.0200, test_f1: 0.4527
 epoch: 10, train_loss: 1.0083, test_loss: 0.9705, test_f1: 0.4467
 epoch: 11, train_loss: 0.9995, test_loss: 0.9750, test_f1: 0.4383
 epoch: 12, train_loss: 0.9900, test_loss: 1.0033, test_f1: 0.4829
 epoch: 13, train_loss: 1.0011, test_loss: 0.9463, test_f1: 0.4752
 epoch: 14, train_loss: 0.9836, test_loss: 0.9681, test_f1: 0.4977
 epoch: 15, train_loss: 0.9671, test_loss: 0.9807, test_f1: 0.4864
 epoch: 16, train_loss: 0.9731, test_loss: 0.9571, test_f1: 0.4889
 epoch: 17, train_loss: 0.9480, test_loss: 0.9666, test_f1: 0.5005
 epoch: 18, train_loss: 0.9484, test_loss: 0.9468, test_f1: 0.4765
 epoch: 19, train_loss: 0.9307, test_loss: 0.9502, test_f1: 0.4790
 epoch: 20, train_loss: 0.9309, test_loss: 0.9539, test_f1: 0.4840
 epoch: 21, train_loss: 0.9317, test_loss: 0.9425, test_f1: 0.4928
 epoch: 22, train_loss: 0.9177, test_loss: 1.0178, test_f1: 0.4873
 epoch: 23, train_loss: 0.9282, test_loss: 0.9532, test_f1: 0.4761
 epoch: 24, train_loss: 0.9153, test_loss: 0.9847, test_f1: 0.4919
 epoch: 25, train_loss: 0.9080, test_loss: 0.9267, test_f1: 0.5129
 epoch: 26, train_loss: 0.9009, test_loss: 0.9508, test_f1: 0.4967
 epoch: 27, train_loss: 0.8948, test_loss: 0.9179, test_f1: 0.5127
 epoch: 28, train_loss: 0.8847, test_loss: 1.0059, test_f1: 0.4721
 epoch: 29, train_loss: 0.8944, test_loss: 0.9248, test_f1: 0.4982
 epoch: 30, train_loss: 0.8805, test_loss: 0.8937, test_f1: 0.5064
 epoch: 31, train_loss: 0.8880, test_loss: 0.9059, test_f1: 0.5055
 epoch: 32, train_loss: 0.8735, test_loss: 0.9347, test_f1: 0.4959
 epoch: 33, train_loss: 0.8676, test_loss: 0.9482, test_f1: 0.4888
 epoch: 34, train_loss: 0.8708, test_loss: 0.9087, test_f1: 0.5112
 epoch: 35, train_loss: 0.8608, test_loss: 0.9277, test_f1: 0.5107
 epoch: 36, train_loss: 0.8706, test_loss: 0.9446, test_f1: 0.5103
 epoch: 37, train_loss: 0.8532, test_loss: 0.9090, test_f1: 0.5229
 epoch: 38, train_loss: 0.8755, test_loss: 0.9123, test_f1: 0.5003
 epoch: 39, train_loss: 0.8555, test_loss: 0.8934, test_f1: 0.5177
 epoch: 40, train_loss: 0.8418, test_loss: 0.8459, test_f1: 0.5199
 epoch: 41, train_loss: 0.8516, test_loss: 0.9436, test_f1: 0.4927
 epoch: 42, train_loss: 0.8528, test_loss: 0.8738, test_f1: 0.5305
 epoch: 43, train_loss: 0.8479, test_loss: 0.8579, test_f1: 0.5209
 epoch: 44, train_loss: 0.8353, test_loss: 0.9069, test_f1: 0.5162
 epoch: 45, train_loss: 0.8329, test_loss: 0.8877, test_f1: 0.5197
 epoch: 46, train_loss: 0.8394, test_loss: 0.9180, test_f1: 0.5059
 epoch: 47, train_loss: 0.8376, test_loss: 0.8801, test_f1: 0.5179
 epoch: 48, train_loss: 0.8303, test_loss: 0.8754, test_f1: 0.5115
 epoch: 49, train_loss: 0.8171, test_loss: 0.8407, test_f1: 0.5210
 epoch: 50, train_loss: 0.8255, test_loss: 0.8552, test_f1: 0.5312
 epoch: 51, train_loss: 0.8064, test_loss: 0.8361, test_f1: 0.5275
 epoch: 52, train_loss: 0.7999, test_loss: 0.8322, test_f1: 0.5172
 epoch: 53, train_loss: 0.8024, test_loss: 0.8548, test_f1: 0.5186
 epoch: 54, train_loss: 0.8154, test_loss: 0.8573, test_f1: 0.5242
 epoch: 55, train_loss: 0.8152, test_loss: 0.8547, test_f1: 0.5302
 epoch: 56, train_loss: 0.8072, test_loss: 0.8254, test_f1: 0.5272
 epoch: 57, train_loss: 0.7906, test_loss: 0.8458, test_f1: 0.5362
 epoch: 58, train_loss: 0.7997, test_loss: 0.8315, test_f1: 0.5274
 epoch: 59, train_loss: 0.7967, test_loss: 0.8470, test_f1: 0.5368
 epoch: 60, train_loss: 0.7904, test_loss: 0.8656, test_f1: 0.5258
 epoch: 61, train_loss: 0.7885, test_loss: 0.8350, test_f1: 0.5096
 epoch: 62, train_loss: 0.7896, test_loss: 0.8370, test_f1: 0.5358
 epoch: 63, train_loss: 0.7902, test_loss: 0.8324, test_f1: 0.5358
 epoch: 64, train_loss: 0.7828, test_loss: 0.8185, test_f1: 0.5418
 epoch: 65, train_loss: 0.7908, test_loss: 0.8475, test_f1: 0.5300
 epoch: 66, train_loss: 0.7902, test_loss: 0.8529, test_f1: 0.5321
 epoch: 67, train_loss: 0.7807, test_loss: 0.8636, test_f1: 0.5219
 epoch: 68, train_loss: 0.7855, test_loss: 0.8625, test_f1: 0.5275
 epoch: 69, train_loss: 0.7844, test_loss: 0.8288, test_f1: 0.5448
 epoch: 70, train_loss: 0.7802, test_loss: 0.8268, test_f1: 0.5375
 epoch: 71, train_loss: 0.7814, test_loss: 0.8446, test_f1: 0.5466
 epoch: 72, train_loss: 0.7734, test_loss: 0.8901, test_f1: 0.5246
 epoch: 73, train_loss: 0.7865, test_loss: 0.8186, test_f1: 0.5373
 epoch: 74, train_loss: 0.7782, test_loss: 0.8647, test_f1: 0.5254
 epoch: 75, train_loss: 0.7770, test_loss: 0.8557, test_f1: 0.5459
 epoch: 76, train_loss: 0.7769, test_loss: 0.9138, test_f1: 0.5202
 epoch: 77, train_loss: 0.7750, test_loss: 0.8539, test_f1: 0.5372
 epoch: 78, train_loss: 0.7607, test_loss: 0.8686, test_f1: 0.5311
 epoch: 79, train_loss: 0.7764, test_loss: 0.8712, test_f1: 0.5344
 epoch: 80, train_loss: 0.7761, test_loss: 0.9062, test_f1: 0.5173
 epoch: 81, train_loss: 0.7626, test_loss: 0.8458, test_f1: 0.5308
 epoch: 82, train_loss: 0.7701, test_loss: 0.8308, test_f1: 0.5398
 epoch: 83, train_loss: 0.7625, test_loss: 0.8276, test_f1: 0.5476
 epoch: 84, train_loss: 0.7826, test_loss: 0.8261, test_f1: 0.5340
 epoch: 85, train_loss: 0.7607, test_loss: 0.8629, test_f1: 0.5262
 epoch: 86, train_loss: 0.7710, test_loss: 0.8707, test_f1: 0.5228
 epoch: 87, train_loss: 0.7737, test_loss: 0.8449, test_f1: 0.5374
 epoch: 88, train_loss: 0.7676, test_loss: 0.8322, test_f1: 0.5406
 epoch: 89, train_loss: 0.7655, test_loss: 0.9232, test_f1: 0.5069
 epoch: 90, train_loss: 0.7561, test_loss: 0.8099, test_f1: 0.5402
 epoch: 91, train_loss: 0.7655, test_loss: 0.8706, test_f1: 0.5266
 epoch: 92, train_loss: 0.7716, test_loss: 0.8604, test_f1: 0.5282
 epoch: 93, train_loss: 0.7604, test_loss: 0.8342, test_f1: 0.5388
 epoch: 94, train_loss: 0.7549, test_loss: 0.8288, test_f1: 0.5510
 epoch: 95, train_loss: 0.7622, test_loss: 0.8596, test_f1: 0.5238
 epoch: 96, train_loss: 0.7615, test_loss: 0.8538, test_f1: 0.5423
 epoch: 97, train_loss: 0.7505, test_loss: 0.8735, test_f1: 0.5346
 epoch: 98, train_loss: 0.7493, test_loss: 0.8139, test_f1: 0.5384
 epoch: 99, train_loss: 0.7547, test_loss: 0.8419, test_f1: 0.5298
##################ITERATION #3 ****************************************
 epoch: 0, train_loss: 1.2703, test_loss: 1.2080, test_f1: 0.4027
 epoch: 1, train_loss: 1.1247, test_loss: 1.0612, test_f1: 0.4235
 epoch: 2, train_loss: 1.0885, test_loss: 1.0521, test_f1: 0.4274
 epoch: 3, train_loss: 1.0411, test_loss: 1.0176, test_f1: 0.4456
 epoch: 4, train_loss: 1.0236, test_loss: 0.9997, test_f1: 0.4462
 epoch: 5, train_loss: 1.0022, test_loss: 0.9743, test_f1: 0.4841
 epoch: 6, train_loss: 0.9800, test_loss: 0.9195, test_f1: 0.4653
 epoch: 7, train_loss: 0.9613, test_loss: 0.9326, test_f1: 0.4737
 epoch: 8, train_loss: 0.9369, test_loss: 0.9851, test_f1: 0.4756
 epoch: 9, train_loss: 0.9227, test_loss: 0.9789, test_f1: 0.4852
 epoch: 10, train_loss: 0.9309, test_loss: 0.9907, test_f1: 0.4610
 epoch: 11, train_loss: 0.9181, test_loss: 0.9489, test_f1: 0.5007
 epoch: 12, train_loss: 0.8918, test_loss: 0.9492, test_f1: 0.4868
 epoch: 13, train_loss: 0.9038, test_loss: 0.9824, test_f1: 0.5012
 epoch: 14, train_loss: 0.8918, test_loss: 1.0020, test_f1: 0.4898
 epoch: 15, train_loss: 0.8884, test_loss: 0.9502, test_f1: 0.5203
 epoch: 16, train_loss: 0.8764, test_loss: 0.9628, test_f1: 0.5102
 epoch: 17, train_loss: 0.8777, test_loss: 0.9393, test_f1: 0.5104
 epoch: 18, train_loss: 0.8700, test_loss: 0.9460, test_f1: 0.5218
 epoch: 19, train_loss: 0.8617, test_loss: 0.9282, test_f1: 0.5345
 epoch: 20, train_loss: 0.8564, test_loss: 0.9606, test_f1: 0.5353
 epoch: 21, train_loss: 0.8609, test_loss: 0.9366, test_f1: 0.5309
 epoch: 22, train_loss: 0.8482, test_loss: 0.9384, test_f1: 0.5329
 epoch: 23, train_loss: 0.8512, test_loss: 0.9518, test_f1: 0.5159
 epoch: 24, train_loss: 0.8402, test_loss: 0.9330, test_f1: 0.5189
 epoch: 25, train_loss: 0.8304, test_loss: 0.9427, test_f1: 0.5257
 epoch: 26, train_loss: 0.8327, test_loss: 0.9620, test_f1: 0.5101
 epoch: 27, train_loss: 0.8355, test_loss: 0.8858, test_f1: 0.5345
 epoch: 28, train_loss: 0.8182, test_loss: 0.9167, test_f1: 0.5368
 epoch: 29, train_loss: 0.8278, test_loss: 0.9092, test_f1: 0.5209
 epoch: 30, train_loss: 0.8227, test_loss: 0.9005, test_f1: 0.5372
 epoch: 31, train_loss: 0.8031, test_loss: 0.8795, test_f1: 0.5484
 epoch: 32, train_loss: 0.8051, test_loss: 0.9614, test_f1: 0.5272
 epoch: 33, train_loss: 0.8123, test_loss: 0.9468, test_f1: 0.5442
 epoch: 34, train_loss: 0.8073, test_loss: 0.9134, test_f1: 0.5469
 epoch: 35, train_loss: 0.7999, test_loss: 0.8258, test_f1: 0.5513
 epoch: 36, train_loss: 0.7914, test_loss: 0.8855, test_f1: 0.5377
 epoch: 37, train_loss: 0.8014, test_loss: 0.8755, test_f1: 0.5417
 epoch: 38, train_loss: 0.8067, test_loss: 0.8672, test_f1: 0.5361
 epoch: 39, train_loss: 0.7951, test_loss: 0.8818, test_f1: 0.5574
 epoch: 40, train_loss: 0.7923, test_loss: 0.9098, test_f1: 0.5419
 epoch: 41, train_loss: 0.7868, test_loss: 0.9110, test_f1: 0.5351
 epoch: 42, train_loss: 0.7866, test_loss: 0.9297, test_f1: 0.5446
 epoch: 43, train_loss: 0.7768, test_loss: 0.8666, test_f1: 0.5437
 epoch: 44, train_loss: 0.7875, test_loss: 0.8779, test_f1: 0.5505
 epoch: 45, train_loss: 0.7718, test_loss: 0.9065, test_f1: 0.5451
 epoch: 46, train_loss: 0.7859, test_loss: 0.9138, test_f1: 0.5556
 epoch: 47, train_loss: 0.7703, test_loss: 0.9258, test_f1: 0.5388
 epoch: 48, train_loss: 0.7719, test_loss: 0.8993, test_f1: 0.5548
 epoch: 49, train_loss: 0.7744, test_loss: 0.8851, test_f1: 0.5511
 epoch: 50, train_loss: 0.7660, test_loss: 0.8974, test_f1: 0.5398
 epoch: 51, train_loss: 0.7594, test_loss: 0.8824, test_f1: 0.5559
 epoch: 52, train_loss: 0.7613, test_loss: 0.8782, test_f1: 0.5628
 epoch: 53, train_loss: 0.7490, test_loss: 0.8884, test_f1: 0.5601
 epoch: 54, train_loss: 0.7471, test_loss: 0.9025, test_f1: 0.5561
 epoch: 55, train_loss: 0.7440, test_loss: 0.9288, test_f1: 0.5475
 epoch: 56, train_loss: 0.7541, test_loss: 0.8931, test_f1: 0.5532
 epoch: 57, train_loss: 0.7385, test_loss: 0.8786, test_f1: 0.5647
 epoch: 58, train_loss: 0.7267, test_loss: 0.8953, test_f1: 0.5574
 epoch: 59, train_loss: 0.7462, test_loss: 0.9198, test_f1: 0.5589
 epoch: 60, train_loss: 0.7383, test_loss: 0.8975, test_f1: 0.5485
 epoch: 61, train_loss: 0.7416, test_loss: 0.9107, test_f1: 0.5546
 epoch: 62, train_loss: 0.7321, test_loss: 0.9127, test_f1: 0.5473
 epoch: 63, train_loss: 0.7482, test_loss: 0.9128, test_f1: 0.5503
 epoch: 64, train_loss: 0.7425, test_loss: 0.9187, test_f1: 0.5635
 epoch: 65, train_loss: 0.7516, test_loss: 0.9233, test_f1: 0.5767
 epoch: 66, train_loss: 0.7448, test_loss: 0.8861, test_f1: 0.5651
 epoch: 67, train_loss: 0.7399, test_loss: 0.9302, test_f1: 0.5463
 epoch: 68, train_loss: 0.7441, test_loss: 0.8867, test_f1: 0.5593
 epoch: 69, train_loss: 0.7262, test_loss: 0.9100, test_f1: 0.5588
 epoch: 70, train_loss: 0.7255, test_loss: 0.9266, test_f1: 0.5513
 epoch: 71, train_loss: 0.7338, test_loss: 0.9251, test_f1: 0.5263
 epoch: 72, train_loss: 0.7333, test_loss: 0.9015, test_f1: 0.5657
 epoch: 73, train_loss: 0.7258, test_loss: 0.8689, test_f1: 0.5682
 epoch: 74, train_loss: 0.7331, test_loss: 0.9080, test_f1: 0.5508
 epoch: 75, train_loss: 0.7290, test_loss: 0.9407, test_f1: 0.5494
 epoch: 76, train_loss: 0.7262, test_loss: 0.8939, test_f1: 0.5587
 epoch: 77, train_loss: 0.7329, test_loss: 0.9058, test_f1: 0.5360
 epoch: 78, train_loss: 0.7241, test_loss: 0.9071, test_f1: 0.5528
 epoch: 79, train_loss: 0.7272, test_loss: 0.8730, test_f1: 0.5766
 epoch: 80, train_loss: 0.7154, test_loss: 0.8902, test_f1: 0.5830
 epoch: 81, train_loss: 0.7291, test_loss: 0.9356, test_f1: 0.5482
 epoch: 82, train_loss: 0.7217, test_loss: 0.8962, test_f1: 0.5530
 epoch: 83, train_loss: 0.7153, test_loss: 0.9023, test_f1: 0.5689
 epoch: 84, train_loss: 0.7239, test_loss: 0.9118, test_f1: 0.5574
 epoch: 85, train_loss: 0.7164, test_loss: 0.9096, test_f1: 0.5500
 epoch: 86, train_loss: 0.7361, test_loss: 0.9010, test_f1: 0.5781
 epoch: 87, train_loss: 0.7182, test_loss: 0.9162, test_f1: 0.5531
 epoch: 88, train_loss: 0.7112, test_loss: 0.9411, test_f1: 0.5448
 epoch: 89, train_loss: 0.7161, test_loss: 0.9035, test_f1: 0.5548
 epoch: 90, train_loss: 0.7152, test_loss: 0.9077, test_f1: 0.5619
 epoch: 91, train_loss: 0.7225, test_loss: 0.8642, test_f1: 0.5873
 epoch: 92, train_loss: 0.7193, test_loss: 0.9145, test_f1: 0.5664
 epoch: 93, train_loss: 0.7108, test_loss: 0.8969, test_f1: 0.5666
 epoch: 94, train_loss: 0.7170, test_loss: 0.9490, test_f1: 0.5542
 epoch: 95, train_loss: 0.7201, test_loss: 0.8471, test_f1: 0.5734
 epoch: 96, train_loss: 0.7034, test_loss: 0.8774, test_f1: 0.5668
 epoch: 97, train_loss: 0.7030, test_loss: 0.8698, test_f1: 0.5570
 epoch: 98, train_loss: 0.7072, test_loss: 0.8943, test_f1: 0.5481
 epoch: 99, train_loss: 0.7030, test_loss: 0.9140, test_f1: 0.5601
##################ITERATION #4 ****************************************
 epoch: 0, train_loss: 1.2820, test_loss: 1.1192, test_f1: 0.3348
 epoch: 1, train_loss: 1.1188, test_loss: 1.0559, test_f1: 0.3640
 epoch: 2, train_loss: 1.0826, test_loss: 1.0482, test_f1: 0.4437
 epoch: 3, train_loss: 1.0747, test_loss: 1.0528, test_f1: 0.4516
 epoch: 4, train_loss: 1.0500, test_loss: 1.0355, test_f1: 0.4682
 epoch: 5, train_loss: 1.0310, test_loss: 1.0323, test_f1: 0.4460
 epoch: 6, train_loss: 1.0070, test_loss: 1.0959, test_f1: 0.3701
 epoch: 7, train_loss: 0.9948, test_loss: 0.9910, test_f1: 0.4559
 epoch: 8, train_loss: 0.9910, test_loss: 0.9923, test_f1: 0.4843
 epoch: 9, train_loss: 0.9688, test_loss: 1.0027, test_f1: 0.4948
 epoch: 10, train_loss: 0.9716, test_loss: 0.9869, test_f1: 0.5010
 epoch: 11, train_loss: 0.9632, test_loss: 1.0308, test_f1: 0.4443
 epoch: 12, train_loss: 0.9526, test_loss: 0.9897, test_f1: 0.5102
 epoch: 13, train_loss: 0.9486, test_loss: 1.0074, test_f1: 0.5016
 epoch: 14, train_loss: 0.9313, test_loss: 1.0105, test_f1: 0.4881
 epoch: 15, train_loss: 0.9287, test_loss: 1.0162, test_f1: 0.4762
 epoch: 16, train_loss: 0.9332, test_loss: 0.9702, test_f1: 0.5112
 epoch: 17, train_loss: 0.9188, test_loss: 0.9927, test_f1: 0.5012
 epoch: 18, train_loss: 0.9051, test_loss: 0.9834, test_f1: 0.5263
 epoch: 19, train_loss: 0.9100, test_loss: 0.9767, test_f1: 0.5385
 epoch: 20, train_loss: 0.8996, test_loss: 1.0033, test_f1: 0.5245
 epoch: 21, train_loss: 0.8844, test_loss: 0.9925, test_f1: 0.5151
 epoch: 22, train_loss: 0.8935, test_loss: 0.9744, test_f1: 0.5237
 epoch: 23, train_loss: 0.8728, test_loss: 0.9688, test_f1: 0.5432
 epoch: 24, train_loss: 0.8728, test_loss: 0.9868, test_f1: 0.5362
 epoch: 25, train_loss: 0.8708, test_loss: 0.9904, test_f1: 0.5101
 epoch: 26, train_loss: 0.8723, test_loss: 0.9693, test_f1: 0.5366
 epoch: 27, train_loss: 0.8599, test_loss: 1.0053, test_f1: 0.5345
 epoch: 28, train_loss: 0.8623, test_loss: 0.9462, test_f1: 0.5327
 epoch: 29, train_loss: 0.8489, test_loss: 1.0316, test_f1: 0.5246
 epoch: 30, train_loss: 0.8574, test_loss: 0.9348, test_f1: 0.5596
 epoch: 31, train_loss: 0.8406, test_loss: 0.9813, test_f1: 0.5529
 epoch: 32, train_loss: 0.8425, test_loss: 0.9620, test_f1: 0.5463
 epoch: 33, train_loss: 0.8216, test_loss: 0.9847, test_f1: 0.5264
 epoch: 34, train_loss: 0.8331, test_loss: 0.9699, test_f1: 0.5275
 epoch: 35, train_loss: 0.8240, test_loss: 0.9644, test_f1: 0.5481
 epoch: 36, train_loss: 0.8327, test_loss: 0.9268, test_f1: 0.5480
 epoch: 37, train_loss: 0.8254, test_loss: 0.9335, test_f1: 0.5529
 epoch: 38, train_loss: 0.8230, test_loss: 0.9113, test_f1: 0.5550
 epoch: 39, train_loss: 0.8093, test_loss: 0.9321, test_f1: 0.5410
 epoch: 40, train_loss: 0.8194, test_loss: 0.9106, test_f1: 0.5449
 epoch: 41, train_loss: 0.7967, test_loss: 0.9148, test_f1: 0.5555
 epoch: 42, train_loss: 0.8058, test_loss: 0.9135, test_f1: 0.5601
 epoch: 43, train_loss: 0.8103, test_loss: 0.9196, test_f1: 0.5533
 epoch: 44, train_loss: 0.8059, test_loss: 0.9373, test_f1: 0.5430
 epoch: 45, train_loss: 0.8060, test_loss: 0.9438, test_f1: 0.5458
 epoch: 46, train_loss: 0.8018, test_loss: 0.9569, test_f1: 0.5375
 epoch: 47, train_loss: 0.8074, test_loss: 0.9358, test_f1: 0.5735
 epoch: 48, train_loss: 0.8071, test_loss: 0.9438, test_f1: 0.5478
 epoch: 49, train_loss: 0.7989, test_loss: 0.9108, test_f1: 0.5702
 epoch: 50, train_loss: 0.7852, test_loss: 0.9352, test_f1: 0.5709
 epoch: 51, train_loss: 0.7667, test_loss: 0.9133, test_f1: 0.5580
 epoch: 52, train_loss: 0.7631, test_loss: 0.9116, test_f1: 0.5553
 epoch: 53, train_loss: 0.7678, test_loss: 0.9422, test_f1: 0.5559
 epoch: 54, train_loss: 0.7655, test_loss: 0.9420, test_f1: 0.5535
 epoch: 55, train_loss: 0.7685, test_loss: 0.9243, test_f1: 0.5484
 epoch: 56, train_loss: 0.7687, test_loss: 0.9207, test_f1: 0.5691
 epoch: 57, train_loss: 0.7757, test_loss: 0.9143, test_f1: 0.5600
 epoch: 58, train_loss: 0.7517, test_loss: 0.9511, test_f1: 0.5591
 epoch: 59, train_loss: 0.7590, test_loss: 0.9655, test_f1: 0.5711
 epoch: 60, train_loss: 0.7553, test_loss: 0.9370, test_f1: 0.5684
 epoch: 61, train_loss: 0.7548, test_loss: 0.9367, test_f1: 0.5545
 epoch: 62, train_loss: 0.7505, test_loss: 0.9283, test_f1: 0.5519
 epoch: 63, train_loss: 0.7480, test_loss: 0.9411, test_f1: 0.5587
 epoch: 64, train_loss: 0.7446, test_loss: 0.9211, test_f1: 0.5847
 epoch: 65, train_loss: 0.7602, test_loss: 0.9420, test_f1: 0.5680
 epoch: 66, train_loss: 0.7645, test_loss: 0.9267, test_f1: 0.5634
 epoch: 67, train_loss: 0.7626, test_loss: 0.9254, test_f1: 0.5830
 epoch: 68, train_loss: 0.7436, test_loss: 0.9478, test_f1: 0.5716
 epoch: 69, train_loss: 0.7564, test_loss: 0.9132, test_f1: 0.5594
 epoch: 70, train_loss: 0.7477, test_loss: 0.9255, test_f1: 0.5671
 epoch: 71, train_loss: 0.7362, test_loss: 0.9129, test_f1: 0.5641
 epoch: 72, train_loss: 0.7488, test_loss: 0.9361, test_f1: 0.5461
 epoch: 73, train_loss: 0.7479, test_loss: 0.9434, test_f1: 0.5583
 epoch: 74, train_loss: 0.7333, test_loss: 0.9380, test_f1: 0.5559
 epoch: 75, train_loss: 0.7397, test_loss: 0.9675, test_f1: 0.5494
 epoch: 76, train_loss: 0.7381, test_loss: 0.9403, test_f1: 0.5610
 epoch: 77, train_loss: 0.7405, test_loss: 0.9272, test_f1: 0.5662
 epoch: 78, train_loss: 0.7383, test_loss: 0.9504, test_f1: 0.5364
 epoch: 79, train_loss: 0.7302, test_loss: 0.9255, test_f1: 0.5476
 epoch: 80, train_loss: 0.7401, test_loss: 0.9273, test_f1: 0.5734
 epoch: 81, train_loss: 0.7196, test_loss: 0.9314, test_f1: 0.5657
 epoch: 82, train_loss: 0.7332, test_loss: 0.9340, test_f1: 0.5567
 epoch: 83, train_loss: 0.7421, test_loss: 0.9170, test_f1: 0.5714
 epoch: 84, train_loss: 0.7328, test_loss: 0.9107, test_f1: 0.5723
 epoch: 85, train_loss: 0.7254, test_loss: 0.9449, test_f1: 0.5427
 epoch: 86, train_loss: 0.7366, test_loss: 0.9523, test_f1: 0.5644
 epoch: 87, train_loss: 0.7284, test_loss: 0.9352, test_f1: 0.5590
 epoch: 88, train_loss: 0.7254, test_loss: 0.9453, test_f1: 0.5637
 epoch: 89, train_loss: 0.7180, test_loss: 0.9318, test_f1: 0.5596
 epoch: 90, train_loss: 0.7372, test_loss: 0.9388, test_f1: 0.5587
 epoch: 91, train_loss: 0.7306, test_loss: 0.9553, test_f1: 0.5667
 epoch: 92, train_loss: 0.7294, test_loss: 0.9211, test_f1: 0.5923
 epoch: 93, train_loss: 0.7239, test_loss: 0.9171, test_f1: 0.5648
 epoch: 94, train_loss: 0.7234, test_loss: 0.9522, test_f1: 0.5810
 epoch: 95, train_loss: 0.7210, test_loss: 0.9597, test_f1: 0.5571
 epoch: 96, train_loss: 0.7274, test_loss: 0.9160, test_f1: 0.5735
 epoch: 97, train_loss: 0.7237, test_loss: 0.9405, test_f1: 0.5698
 epoch: 98, train_loss: 0.7185, test_loss: 0.9352, test_f1: 0.5589
 epoch: 99, train_loss: 0.7169, test_loss: 0.9446, test_f1: 0.5740
##################ITERATION #5 ****************************************
 epoch: 0, train_loss: 1.2891, test_loss: 1.1112, test_f1: 0.3805
 epoch: 1, train_loss: 1.1056, test_loss: 1.0358, test_f1: 0.4804
 epoch: 2, train_loss: 1.0717, test_loss: 1.0309, test_f1: 0.5148
 epoch: 3, train_loss: 1.0412, test_loss: 1.0210, test_f1: 0.4547
 epoch: 4, train_loss: 1.0258, test_loss: 1.0187, test_f1: 0.4908
 epoch: 5, train_loss: 1.0056, test_loss: 0.9978, test_f1: 0.4997
 epoch: 6, train_loss: 0.9831, test_loss: 0.9948, test_f1: 0.4961
 epoch: 7, train_loss: 0.9684, test_loss: 0.9731, test_f1: 0.5303
 epoch: 8, train_loss: 0.9738, test_loss: 0.9628, test_f1: 0.5228
 epoch: 9, train_loss: 0.9622, test_loss: 0.9587, test_f1: 0.5243
 epoch: 10, train_loss: 0.9454, test_loss: 0.9572, test_f1: 0.5371
 epoch: 11, train_loss: 0.9348, test_loss: 0.9601, test_f1: 0.5264
 epoch: 12, train_loss: 0.9252, test_loss: 0.9603, test_f1: 0.5143
 epoch: 13, train_loss: 0.9183, test_loss: 0.9410, test_f1: 0.5309
 epoch: 14, train_loss: 0.9124, test_loss: 0.9629, test_f1: 0.5083
 epoch: 15, train_loss: 0.9079, test_loss: 0.9561, test_f1: 0.5633
 epoch: 16, train_loss: 0.8999, test_loss: 0.9687, test_f1: 0.5156
 epoch: 17, train_loss: 0.9030, test_loss: 0.9609, test_f1: 0.5216
 epoch: 18, train_loss: 0.8881, test_loss: 0.9440, test_f1: 0.5462
 epoch: 19, train_loss: 0.8961, test_loss: 0.9451, test_f1: 0.5192
 epoch: 20, train_loss: 0.8744, test_loss: 0.9469, test_f1: 0.5230
 epoch: 21, train_loss: 0.8684, test_loss: 0.9500, test_f1: 0.5347
 epoch: 22, train_loss: 0.8569, test_loss: 0.9650, test_f1: 0.5114
 epoch: 23, train_loss: 0.8616, test_loss: 0.9863, test_f1: 0.5168
 epoch: 24, train_loss: 0.8555, test_loss: 0.9674, test_f1: 0.4985
 epoch: 25, train_loss: 0.8455, test_loss: 0.9259, test_f1: 0.5376
 epoch: 26, train_loss: 0.8458, test_loss: 0.9369, test_f1: 0.5262
 epoch: 27, train_loss: 0.8513, test_loss: 0.9301, test_f1: 0.5407
 epoch: 28, train_loss: 0.8300, test_loss: 0.9582, test_f1: 0.5416
 epoch: 29, train_loss: 0.8230, test_loss: 0.9524, test_f1: 0.5243
 epoch: 30, train_loss: 0.8412, test_loss: 0.9521, test_f1: 0.5359
 epoch: 31, train_loss: 0.8247, test_loss: 0.9650, test_f1: 0.5250
 epoch: 32, train_loss: 0.8201, test_loss: 0.9462, test_f1: 0.5482
 epoch: 33, train_loss: 0.8152, test_loss: 0.9428, test_f1: 0.5390
 epoch: 34, train_loss: 0.8059, test_loss: 0.9450, test_f1: 0.5257
 epoch: 35, train_loss: 0.8105, test_loss: 0.9270, test_f1: 0.5508
 epoch: 36, train_loss: 0.7973, test_loss: 0.9387, test_f1: 0.5488
 epoch: 37, train_loss: 0.7974, test_loss: 0.9455, test_f1: 0.5457
 epoch: 38, train_loss: 0.8098, test_loss: 0.9249, test_f1: 0.5425
 epoch: 39, train_loss: 0.7911, test_loss: 0.9272, test_f1: 0.5353
 epoch: 40, train_loss: 0.8004, test_loss: 0.9459, test_f1: 0.5494
 epoch: 41, train_loss: 0.7936, test_loss: 0.9281, test_f1: 0.5209
 epoch: 42, train_loss: 0.7985, test_loss: 0.9187, test_f1: 0.5439
 epoch: 43, train_loss: 0.7845, test_loss: 0.9575, test_f1: 0.5180
 epoch: 44, train_loss: 0.7804, test_loss: 0.9318, test_f1: 0.5457
 epoch: 45, train_loss: 0.7758, test_loss: 0.9301, test_f1: 0.5289
 epoch: 46, train_loss: 0.7710, test_loss: 0.9724, test_f1: 0.5229
 epoch: 47, train_loss: 0.7744, test_loss: 0.9262, test_f1: 0.5483
 epoch: 48, train_loss: 0.7675, test_loss: 0.9272, test_f1: 0.5307
 epoch: 49, train_loss: 0.7747, test_loss: 0.9307, test_f1: 0.5370
 epoch: 50, train_loss: 0.7684, test_loss: 0.9541, test_f1: 0.5363
 epoch: 51, train_loss: 0.7506, test_loss: 0.9160, test_f1: 0.5543
 epoch: 52, train_loss: 0.7422, test_loss: 0.9009, test_f1: 0.5309
 epoch: 53, train_loss: 0.7465, test_loss: 0.8967, test_f1: 0.5658
 epoch: 54, train_loss: 0.7422, test_loss: 0.9109, test_f1: 0.5373
 epoch: 55, train_loss: 0.7623, test_loss: 0.9055, test_f1: 0.5559
 epoch: 56, train_loss: 0.7497, test_loss: 0.9162, test_f1: 0.5516
 epoch: 57, train_loss: 0.7409, test_loss: 0.8888, test_f1: 0.5420
 epoch: 58, train_loss: 0.7395, test_loss: 0.8983, test_f1: 0.5523
 epoch: 59, train_loss: 0.7347, test_loss: 0.8984, test_f1: 0.5548
 epoch: 60, train_loss: 0.7446, test_loss: 0.9133, test_f1: 0.5471
 epoch: 61, train_loss: 0.7431, test_loss: 0.9056, test_f1: 0.5583
 epoch: 62, train_loss: 0.7357, test_loss: 0.9180, test_f1: 0.5608
 epoch: 63, train_loss: 0.7262, test_loss: 0.9120, test_f1: 0.5582
 epoch: 64, train_loss: 0.7269, test_loss: 0.9133, test_f1: 0.5459
 epoch: 65, train_loss: 0.7196, test_loss: 0.8827, test_f1: 0.5681
 epoch: 66, train_loss: 0.7155, test_loss: 0.9104, test_f1: 0.5469
 epoch: 67, train_loss: 0.7304, test_loss: 0.9244, test_f1: 0.5564
 epoch: 68, train_loss: 0.7253, test_loss: 0.9189, test_f1: 0.5574
 epoch: 69, train_loss: 0.7209, test_loss: 0.9437, test_f1: 0.5512
 epoch: 70, train_loss: 0.7206, test_loss: 0.9212, test_f1: 0.5451
 epoch: 71, train_loss: 0.7253, test_loss: 0.9352, test_f1: 0.5471
 epoch: 72, train_loss: 0.7264, test_loss: 0.9234, test_f1: 0.5577
 epoch: 73, train_loss: 0.7192, test_loss: 0.9190, test_f1: 0.5483
 epoch: 74, train_loss: 0.7126, test_loss: 0.9516, test_f1: 0.5462
 epoch: 75, train_loss: 0.7187, test_loss: 0.9287, test_f1: 0.5610
 epoch: 76, train_loss: 0.7245, test_loss: 0.9966, test_f1: 0.5438
 epoch: 77, train_loss: 0.7236, test_loss: 0.9650, test_f1: 0.5325
 epoch: 78, train_loss: 0.7282, test_loss: 0.9765, test_f1: 0.5377
 epoch: 79, train_loss: 0.7189, test_loss: 0.9881, test_f1: 0.5228
 epoch: 80, train_loss: 0.7205, test_loss: 0.9652, test_f1: 0.5312
 epoch: 81, train_loss: 0.7129, test_loss: 0.9734, test_f1: 0.5470
 epoch: 82, train_loss: 0.7069, test_loss: 0.9350, test_f1: 0.5435
 epoch: 83, train_loss: 0.7244, test_loss: 0.9500, test_f1: 0.5394
 epoch: 84, train_loss: 0.7208, test_loss: 0.9195, test_f1: 0.5411
 epoch: 85, train_loss: 0.7127, test_loss: 0.9236, test_f1: 0.5499
 epoch: 86, train_loss: 0.7151, test_loss: 0.9501, test_f1: 0.5324
 epoch: 87, train_loss: 0.7084, test_loss: 0.9981, test_f1: 0.5378
 epoch: 88, train_loss: 0.7021, test_loss: 0.9620, test_f1: 0.5307
 epoch: 89, train_loss: 0.7119, test_loss: 1.0368, test_f1: 0.5395
 epoch: 90, train_loss: 0.7068, test_loss: 0.9598, test_f1: 0.5307
 epoch: 91, train_loss: 0.7086, test_loss: 0.9655, test_f1: 0.5137
 epoch: 92, train_loss: 0.7140, test_loss: 0.9167, test_f1: 0.5470
 epoch: 93, train_loss: 0.7074, test_loss: 1.0110, test_f1: 0.5259
 epoch: 94, train_loss: 0.7107, test_loss: 0.9309, test_f1: 0.5595
 epoch: 95, train_loss: 0.7085, test_loss: 0.9728, test_f1: 0.5303
 epoch: 96, train_loss: 0.7040, test_loss: 0.9905, test_f1: 0.5215
 epoch: 97, train_loss: 0.6931, test_loss: 0.9828, test_f1: 0.5303
 epoch: 98, train_loss: 0.7014, test_loss: 0.9877, test_f1: 0.5251
 epoch: 99, train_loss: 0.7041, test_loss: 0.9500, test_f1: 0.5229
##################ITERATION #6 ****************************************
 epoch: 0, train_loss: 1.3545, test_loss: 1.1576, test_f1: 0.3474
 epoch: 1, train_loss: 1.1137, test_loss: 1.0751, test_f1: 0.3705
 epoch: 2, train_loss: 1.0848, test_loss: 1.0670, test_f1: 0.4103
 epoch: 3, train_loss: 1.0747, test_loss: 1.0685, test_f1: 0.4187
 epoch: 4, train_loss: 1.0442, test_loss: 1.0549, test_f1: 0.4433
 epoch: 5, train_loss: 1.0408, test_loss: 1.0494, test_f1: 0.4453
 epoch: 6, train_loss: 1.0321, test_loss: 1.0456, test_f1: 0.4507
 epoch: 7, train_loss: 1.0210, test_loss: 1.0334, test_f1: 0.4636
 epoch: 8, train_loss: 1.0198, test_loss: 1.0418, test_f1: 0.4583
 epoch: 9, train_loss: 0.9981, test_loss: 1.0566, test_f1: 0.4862
 epoch: 10, train_loss: 1.0069, test_loss: 1.0027, test_f1: 0.4905
 epoch: 11, train_loss: 0.9827, test_loss: 1.0067, test_f1: 0.4818
 epoch: 12, train_loss: 0.9836, test_loss: 1.0236, test_f1: 0.4607
 epoch: 13, train_loss: 0.9705, test_loss: 1.0013, test_f1: 0.4962
 epoch: 14, train_loss: 0.9710, test_loss: 1.0175, test_f1: 0.4646
 epoch: 15, train_loss: 0.9556, test_loss: 0.9767, test_f1: 0.5189
 epoch: 16, train_loss: 0.9480, test_loss: 0.9893, test_f1: 0.4838
 epoch: 17, train_loss: 0.9464, test_loss: 1.0088, test_f1: 0.4692
 epoch: 18, train_loss: 0.9440, test_loss: 0.9520, test_f1: 0.4925
 epoch: 19, train_loss: 0.9292, test_loss: 0.9771, test_f1: 0.5128
 epoch: 20, train_loss: 0.9306, test_loss: 1.0037, test_f1: 0.4855
 epoch: 21, train_loss: 0.9173, test_loss: 0.9730, test_f1: 0.4938
 epoch: 22, train_loss: 0.9188, test_loss: 0.9966, test_f1: 0.4546
 epoch: 23, train_loss: 0.9080, test_loss: 0.9369, test_f1: 0.5145
 epoch: 24, train_loss: 0.9086, test_loss: 0.9664, test_f1: 0.5024
 epoch: 25, train_loss: 0.8990, test_loss: 0.8848, test_f1: 0.5241
 epoch: 26, train_loss: 0.8888, test_loss: 0.9571, test_f1: 0.5090
 epoch: 27, train_loss: 0.8910, test_loss: 0.9064, test_f1: 0.5353
 epoch: 28, train_loss: 0.8869, test_loss: 0.9692, test_f1: 0.5039
 epoch: 29, train_loss: 0.8659, test_loss: 1.0090, test_f1: 0.4833
 epoch: 30, train_loss: 0.8716, test_loss: 0.9103, test_f1: 0.5410
 epoch: 31, train_loss: 0.8713, test_loss: 0.9571, test_f1: 0.5158
 epoch: 32, train_loss: 0.8739, test_loss: 0.9993, test_f1: 0.4775
 epoch: 33, train_loss: 0.8670, test_loss: 0.9511, test_f1: 0.5223
 epoch: 34, train_loss: 0.8543, test_loss: 0.9496, test_f1: 0.5064
 epoch: 35, train_loss: 0.8561, test_loss: 0.9106, test_f1: 0.5207
 epoch: 36, train_loss: 0.8508, test_loss: 0.9253, test_f1: 0.5177
 epoch: 37, train_loss: 0.8561, test_loss: 1.1156, test_f1: 0.4438
 epoch: 38, train_loss: 0.8557, test_loss: 0.9271, test_f1: 0.5242
 epoch: 39, train_loss: 0.8426, test_loss: 0.9924, test_f1: 0.4876
 epoch: 40, train_loss: 0.8434, test_loss: 1.0436, test_f1: 0.4660
 epoch: 41, train_loss: 0.8439, test_loss: 0.9952, test_f1: 0.4851
 epoch: 42, train_loss: 0.8440, test_loss: 1.0243, test_f1: 0.5194
 epoch: 43, train_loss: 0.8321, test_loss: 0.8930, test_f1: 0.5114
 epoch: 44, train_loss: 0.8261, test_loss: 0.9674, test_f1: 0.5198
 epoch: 45, train_loss: 0.8223, test_loss: 1.0448, test_f1: 0.4907
 epoch: 46, train_loss: 0.8212, test_loss: 0.9561, test_f1: 0.5053
 epoch: 47, train_loss: 0.8164, test_loss: 0.9506, test_f1: 0.5143
 epoch: 48, train_loss: 0.8141, test_loss: 0.9242, test_f1: 0.5141
 epoch: 49, train_loss: 0.8127, test_loss: 1.0527, test_f1: 0.5100
 epoch: 50, train_loss: 0.8221, test_loss: 0.9688, test_f1: 0.5090
 epoch: 51, train_loss: 0.7980, test_loss: 0.9807, test_f1: 0.5203
 epoch: 52, train_loss: 0.7937, test_loss: 1.0160, test_f1: 0.4951
 epoch: 53, train_loss: 0.7982, test_loss: 1.0151, test_f1: 0.5018
 epoch: 54, train_loss: 0.7921, test_loss: 0.9930, test_f1: 0.5169
 epoch: 55, train_loss: 0.7865, test_loss: 0.9511, test_f1: 0.5221
 epoch: 56, train_loss: 0.7897, test_loss: 0.9901, test_f1: 0.5120
 epoch: 57, train_loss: 0.7859, test_loss: 1.0203, test_f1: 0.4844
 epoch: 58, train_loss: 0.7903, test_loss: 0.9972, test_f1: 0.5010
 epoch: 59, train_loss: 0.7778, test_loss: 1.0751, test_f1: 0.4942
 epoch: 60, train_loss: 0.7794, test_loss: 1.0802, test_f1: 0.4640
 epoch: 61, train_loss: 0.7791, test_loss: 1.0825, test_f1: 0.4927
 epoch: 62, train_loss: 0.7807, test_loss: 1.0183, test_f1: 0.5240
 epoch: 63, train_loss: 0.7615, test_loss: 0.9944, test_f1: 0.5118
 epoch: 64, train_loss: 0.7846, test_loss: 0.9603, test_f1: 0.5304
 epoch: 65, train_loss: 0.7758, test_loss: 1.0837, test_f1: 0.5024
 epoch: 66, train_loss: 0.7777, test_loss: 1.0006, test_f1: 0.5098
 epoch: 67, train_loss: 0.7748, test_loss: 1.0481, test_f1: 0.5081
 epoch: 68, train_loss: 0.7710, test_loss: 1.0585, test_f1: 0.4992
 epoch: 69, train_loss: 0.7695, test_loss: 1.0238, test_f1: 0.5102
 epoch: 70, train_loss: 0.7624, test_loss: 1.0083, test_f1: 0.5075
 epoch: 71, train_loss: 0.7712, test_loss: 1.0722, test_f1: 0.5079
 epoch: 72, train_loss: 0.7562, test_loss: 1.0209, test_f1: 0.5185
 epoch: 73, train_loss: 0.7623, test_loss: 1.0358, test_f1: 0.4988
 epoch: 74, train_loss: 0.7516, test_loss: 0.9917, test_f1: 0.5110
 epoch: 75, train_loss: 0.7682, test_loss: 1.0512, test_f1: 0.5089
 epoch: 76, train_loss: 0.7680, test_loss: 1.0300, test_f1: 0.5051
 epoch: 77, train_loss: 0.7536, test_loss: 1.0513, test_f1: 0.5128
 epoch: 78, train_loss: 0.7564, test_loss: 1.0447, test_f1: 0.5115
 epoch: 79, train_loss: 0.7510, test_loss: 1.0514, test_f1: 0.5043
 epoch: 80, train_loss: 0.7631, test_loss: 1.0603, test_f1: 0.5117
 epoch: 81, train_loss: 0.7579, test_loss: 1.0491, test_f1: 0.5036
 epoch: 82, train_loss: 0.7435, test_loss: 0.9705, test_f1: 0.5326
 epoch: 83, train_loss: 0.7554, test_loss: 1.0289, test_f1: 0.5089
 epoch: 84, train_loss: 0.7530, test_loss: 0.9739, test_f1: 0.5264
 epoch: 85, train_loss: 0.7514, test_loss: 0.9642, test_f1: 0.5330
 epoch: 86, train_loss: 0.7447, test_loss: 1.0309, test_f1: 0.5202
 epoch: 87, train_loss: 0.7449, test_loss: 1.0077, test_f1: 0.5114
 epoch: 88, train_loss: 0.7579, test_loss: 1.0288, test_f1: 0.5194
 epoch: 89, train_loss: 0.7407, test_loss: 0.9799, test_f1: 0.5090
 epoch: 90, train_loss: 0.7455, test_loss: 1.0559, test_f1: 0.5237
 epoch: 91, train_loss: 0.7447, test_loss: 1.0239, test_f1: 0.5068
 epoch: 92, train_loss: 0.7407, test_loss: 0.9645, test_f1: 0.5420
 epoch: 93, train_loss: 0.7503, test_loss: 0.9551, test_f1: 0.5350
 epoch: 94, train_loss: 0.7425, test_loss: 0.9663, test_f1: 0.5181
 epoch: 95, train_loss: 0.7406, test_loss: 1.0406, test_f1: 0.5137
 epoch: 96, train_loss: 0.7409, test_loss: 1.0188, test_f1: 0.5230
 epoch: 97, train_loss: 0.7317, test_loss: 0.9819, test_f1: 0.5329
 epoch: 98, train_loss: 0.7409, test_loss: 1.0091, test_f1: 0.5307
 epoch: 99, train_loss: 0.7357, test_loss: 1.0122, test_f1: 0.5047
##################ITERATION #7 ****************************************
 epoch: 0, train_loss: 1.3068, test_loss: 1.1884, test_f1: 0.4465
 epoch: 1, train_loss: 1.1652, test_loss: 1.0545, test_f1: 0.4528
 epoch: 2, train_loss: 1.1086, test_loss: 1.0137, test_f1: 0.4747
 epoch: 3, train_loss: 1.0864, test_loss: 1.0060, test_f1: 0.4504
 epoch: 4, train_loss: 1.0481, test_loss: 1.0016, test_f1: 0.3979
 epoch: 5, train_loss: 1.0223, test_loss: 0.9709, test_f1: 0.4675
 epoch: 6, train_loss: 1.0048, test_loss: 0.9624, test_f1: 0.4807
 epoch: 7, train_loss: 0.9973, test_loss: 0.9423, test_f1: 0.4828
 epoch: 8, train_loss: 0.9811, test_loss: 0.9615, test_f1: 0.4847
 epoch: 9, train_loss: 0.9683, test_loss: 0.9545, test_f1: 0.4935
 epoch: 10, train_loss: 0.9605, test_loss: 0.9307, test_f1: 0.4894
 epoch: 11, train_loss: 0.9602, test_loss: 0.9517, test_f1: 0.5151
 epoch: 12, train_loss: 0.9474, test_loss: 0.9355, test_f1: 0.5067
 epoch: 13, train_loss: 0.9393, test_loss: 0.9570, test_f1: 0.5065
 epoch: 14, train_loss: 0.9257, test_loss: 0.9085, test_f1: 0.5138
 epoch: 15, train_loss: 0.9277, test_loss: 0.9520, test_f1: 0.4896
 epoch: 16, train_loss: 0.9071, test_loss: 1.0141, test_f1: 0.4815
 epoch: 17, train_loss: 0.9125, test_loss: 0.9448, test_f1: 0.4963
 epoch: 18, train_loss: 0.9009, test_loss: 0.9289, test_f1: 0.5422
 epoch: 19, train_loss: 0.8997, test_loss: 0.9396, test_f1: 0.5096
 epoch: 20, train_loss: 0.8830, test_loss: 0.9069, test_f1: 0.5365
 epoch: 21, train_loss: 0.8901, test_loss: 0.9567, test_f1: 0.5361
 epoch: 22, train_loss: 0.8944, test_loss: 0.9367, test_f1: 0.4979
 epoch: 23, train_loss: 0.8797, test_loss: 0.9053, test_f1: 0.5255
 epoch: 24, train_loss: 0.8816, test_loss: 0.9357, test_f1: 0.5344
 epoch: 25, train_loss: 0.8828, test_loss: 0.9069, test_f1: 0.5270
 epoch: 26, train_loss: 0.8611, test_loss: 0.9809, test_f1: 0.4960
 epoch: 27, train_loss: 0.8680, test_loss: 0.9670, test_f1: 0.5372
 epoch: 28, train_loss: 0.8614, test_loss: 0.9288, test_f1: 0.5166
 epoch: 29, train_loss: 0.8596, test_loss: 0.9682, test_f1: 0.5083
 epoch: 30, train_loss: 0.8503, test_loss: 0.8898, test_f1: 0.5436
 epoch: 31, train_loss: 0.8401, test_loss: 0.9345, test_f1: 0.5222
 epoch: 32, train_loss: 0.8407, test_loss: 0.9346, test_f1: 0.4970
 epoch: 33, train_loss: 0.8473, test_loss: 0.9423, test_f1: 0.5368
 epoch: 34, train_loss: 0.8330, test_loss: 0.8879, test_f1: 0.5479
 epoch: 35, train_loss: 0.8371, test_loss: 0.9995, test_f1: 0.4984
 epoch: 36, train_loss: 0.8248, test_loss: 0.9296, test_f1: 0.5290
 epoch: 37, train_loss: 0.8276, test_loss: 0.8922, test_f1: 0.5420
 epoch: 38, train_loss: 0.8316, test_loss: 0.8990, test_f1: 0.5276
 epoch: 39, train_loss: 0.8278, test_loss: 0.9799, test_f1: 0.5154
 epoch: 40, train_loss: 0.8244, test_loss: 0.9099, test_f1: 0.5322
 epoch: 41, train_loss: 0.8229, test_loss: 0.8829, test_f1: 0.5436
 epoch: 42, train_loss: 0.8216, test_loss: 0.9446, test_f1: 0.5081
 epoch: 43, train_loss: 0.8157, test_loss: 0.9579, test_f1: 0.5297
 epoch: 44, train_loss: 0.8261, test_loss: 0.8813, test_f1: 0.5456
 epoch: 45, train_loss: 0.8182, test_loss: 0.9146, test_f1: 0.5371
 epoch: 46, train_loss: 0.8158, test_loss: 0.8881, test_f1: 0.5508
 epoch: 47, train_loss: 0.8265, test_loss: 0.9028, test_f1: 0.5244
 epoch: 48, train_loss: 0.8008, test_loss: 0.9188, test_f1: 0.5212
 epoch: 49, train_loss: 0.8136, test_loss: 0.9173, test_f1: 0.5317
 epoch: 50, train_loss: 0.8069, test_loss: 0.9146, test_f1: 0.5400
 epoch: 51, train_loss: 0.7903, test_loss: 0.8776, test_f1: 0.5483
 epoch: 52, train_loss: 0.7852, test_loss: 0.8703, test_f1: 0.5480
 epoch: 53, train_loss: 0.7855, test_loss: 0.8630, test_f1: 0.5480
 epoch: 54, train_loss: 0.7749, test_loss: 0.8827, test_f1: 0.5566
 epoch: 55, train_loss: 0.7765, test_loss: 0.8789, test_f1: 0.5483
 epoch: 56, train_loss: 0.7820, test_loss: 0.9072, test_f1: 0.5444
 epoch: 57, train_loss: 0.7678, test_loss: 0.8875, test_f1: 0.5466
 epoch: 58, train_loss: 0.7791, test_loss: 0.8715, test_f1: 0.5501
 epoch: 59, train_loss: 0.7782, test_loss: 0.9030, test_f1: 0.5488
 epoch: 60, train_loss: 0.7583, test_loss: 0.8602, test_f1: 0.5595
 epoch: 61, train_loss: 0.7688, test_loss: 0.9179, test_f1: 0.5395
 epoch: 62, train_loss: 0.7818, test_loss: 0.8764, test_f1: 0.5427
 epoch: 63, train_loss: 0.7807, test_loss: 0.9016, test_f1: 0.5478
 epoch: 64, train_loss: 0.7783, test_loss: 0.8883, test_f1: 0.5462
 epoch: 65, train_loss: 0.7589, test_loss: 0.8888, test_f1: 0.5470
 epoch: 66, train_loss: 0.7672, test_loss: 0.9158, test_f1: 0.5472
 epoch: 67, train_loss: 0.7618, test_loss: 0.8789, test_f1: 0.5562
 epoch: 68, train_loss: 0.7649, test_loss: 0.8772, test_f1: 0.5594
 epoch: 69, train_loss: 0.7728, test_loss: 0.9322, test_f1: 0.5582
 epoch: 70, train_loss: 0.7650, test_loss: 0.9408, test_f1: 0.5158
 epoch: 71, train_loss: 0.7569, test_loss: 0.9216, test_f1: 0.5392
 epoch: 72, train_loss: 0.7513, test_loss: 0.8852, test_f1: 0.5466
 epoch: 73, train_loss: 0.7537, test_loss: 0.9021, test_f1: 0.5437
 epoch: 74, train_loss: 0.7628, test_loss: 0.8605, test_f1: 0.5786
 epoch: 75, train_loss: 0.7524, test_loss: 0.8573, test_f1: 0.5766
 epoch: 76, train_loss: 0.7615, test_loss: 0.9099, test_f1: 0.5393
 epoch: 77, train_loss: 0.7538, test_loss: 0.8998, test_f1: 0.5403
 epoch: 78, train_loss: 0.7569, test_loss: 0.8936, test_f1: 0.5390
 epoch: 79, train_loss: 0.7529, test_loss: 0.9387, test_f1: 0.5207
 epoch: 80, train_loss: 0.7540, test_loss: 0.8907, test_f1: 0.5552
 epoch: 81, train_loss: 0.7470, test_loss: 0.9417, test_f1: 0.5506
 epoch: 82, train_loss: 0.7434, test_loss: 0.9646, test_f1: 0.5311
 epoch: 83, train_loss: 0.7535, test_loss: 0.8778, test_f1: 0.5575
 epoch: 84, train_loss: 0.7399, test_loss: 0.8844, test_f1: 0.5569
 epoch: 85, train_loss: 0.7458, test_loss: 0.8756, test_f1: 0.5651
 epoch: 86, train_loss: 0.7442, test_loss: 0.8946, test_f1: 0.5398
 epoch: 87, train_loss: 0.7481, test_loss: 0.9250, test_f1: 0.5476
 epoch: 88, train_loss: 0.7505, test_loss: 0.8994, test_f1: 0.5664
 epoch: 89, train_loss: 0.7391, test_loss: 0.9272, test_f1: 0.5366
 epoch: 90, train_loss: 0.7385, test_loss: 0.9560, test_f1: 0.5270
 epoch: 91, train_loss: 0.7291, test_loss: 0.9205, test_f1: 0.5495
 epoch: 92, train_loss: 0.7392, test_loss: 0.8885, test_f1: 0.5575
 epoch: 93, train_loss: 0.7322, test_loss: 0.9125, test_f1: 0.5353
 epoch: 94, train_loss: 0.7426, test_loss: 0.8949, test_f1: 0.5561
 epoch: 95, train_loss: 0.7372, test_loss: 0.9071, test_f1: 0.5392
 epoch: 96, train_loss: 0.7375, test_loss: 0.9693, test_f1: 0.5446
 epoch: 97, train_loss: 0.7370, test_loss: 0.9456, test_f1: 0.5331
 epoch: 98, train_loss: 0.7484, test_loss: 0.9070, test_f1: 0.5529
 epoch: 99, train_loss: 0.7355, test_loss: 0.9088, test_f1: 0.5353
##################ITERATION #8 ****************************************
 epoch: 0, train_loss: 1.3832, test_loss: 1.2147, test_f1: 0.3352
 epoch: 1, train_loss: 1.1802, test_loss: 1.0997, test_f1: 0.4235
 epoch: 2, train_loss: 1.1243, test_loss: 1.0406, test_f1: 0.4358
 epoch: 3, train_loss: 1.0831, test_loss: 1.0179, test_f1: 0.4931
 epoch: 4, train_loss: 1.0681, test_loss: 1.0145, test_f1: 0.4813
 epoch: 5, train_loss: 1.0443, test_loss: 1.0024, test_f1: 0.4678
 epoch: 6, train_loss: 1.0293, test_loss: 1.0088, test_f1: 0.4811
 epoch: 7, train_loss: 1.0267, test_loss: 1.0081, test_f1: 0.4863
 epoch: 8, train_loss: 1.0174, test_loss: 1.0062, test_f1: 0.5020
 epoch: 9, train_loss: 0.9981, test_loss: 0.9897, test_f1: 0.4944
 epoch: 10, train_loss: 0.9886, test_loss: 0.9927, test_f1: 0.4902
 epoch: 11, train_loss: 0.9793, test_loss: 0.9962, test_f1: 0.4656
 epoch: 12, train_loss: 0.9757, test_loss: 0.9907, test_f1: 0.5243
 epoch: 13, train_loss: 0.9752, test_loss: 1.0048, test_f1: 0.4494
 epoch: 14, train_loss: 0.9704, test_loss: 0.9707, test_f1: 0.5236
 epoch: 15, train_loss: 0.9524, test_loss: 0.9597, test_f1: 0.5295
 epoch: 16, train_loss: 0.9521, test_loss: 0.9263, test_f1: 0.5220
 epoch: 17, train_loss: 0.9340, test_loss: 0.9796, test_f1: 0.5126
 epoch: 18, train_loss: 0.9263, test_loss: 0.9616, test_f1: 0.5369
 epoch: 19, train_loss: 0.9203, test_loss: 0.9400, test_f1: 0.5309
 epoch: 20, train_loss: 0.9267, test_loss: 0.8697, test_f1: 0.5662
 epoch: 21, train_loss: 0.9172, test_loss: 0.9409, test_f1: 0.5129
 epoch: 22, train_loss: 0.9137, test_loss: 0.8817, test_f1: 0.5340
 epoch: 23, train_loss: 0.9118, test_loss: 0.9526, test_f1: 0.5175
 epoch: 24, train_loss: 0.9131, test_loss: 0.9285, test_f1: 0.5137
 epoch: 25, train_loss: 0.8978, test_loss: 0.9191, test_f1: 0.5266
 epoch: 26, train_loss: 0.8810, test_loss: 0.9306, test_f1: 0.5018
 epoch: 27, train_loss: 0.8780, test_loss: 0.9529, test_f1: 0.5064
 epoch: 28, train_loss: 0.8727, test_loss: 0.9203, test_f1: 0.5386
 epoch: 29, train_loss: 0.8810, test_loss: 0.8939, test_f1: 0.5228
 epoch: 30, train_loss: 0.8714, test_loss: 0.9052, test_f1: 0.5358
 epoch: 31, train_loss: 0.8652, test_loss: 0.9208, test_f1: 0.5332
 epoch: 32, train_loss: 0.8603, test_loss: 0.9348, test_f1: 0.5464
 epoch: 33, train_loss: 0.8673, test_loss: 0.9501, test_f1: 0.5064
 epoch: 34, train_loss: 0.8542, test_loss: 0.9197, test_f1: 0.5331
 epoch: 35, train_loss: 0.8612, test_loss: 0.9668, test_f1: 0.5274
 epoch: 36, train_loss: 0.8504, test_loss: 0.9064, test_f1: 0.5474
 epoch: 37, train_loss: 0.8456, test_loss: 0.9411, test_f1: 0.5329
 epoch: 38, train_loss: 0.8450, test_loss: 0.9297, test_f1: 0.5439
 epoch: 39, train_loss: 0.8366, test_loss: 0.8965, test_f1: 0.5310
 epoch: 40, train_loss: 0.8386, test_loss: 0.8793, test_f1: 0.5543
 epoch: 41, train_loss: 0.8419, test_loss: 0.9212, test_f1: 0.5250
 epoch: 42, train_loss: 0.8324, test_loss: 0.9239, test_f1: 0.5395
 epoch: 43, train_loss: 0.8295, test_loss: 0.9218, test_f1: 0.5566
 epoch: 44, train_loss: 0.8256, test_loss: 0.9251, test_f1: 0.5242
 epoch: 45, train_loss: 0.8145, test_loss: 0.9205, test_f1: 0.5445
 epoch: 46, train_loss: 0.8223, test_loss: 0.8743, test_f1: 0.5598
 epoch: 47, train_loss: 0.8320, test_loss: 0.9166, test_f1: 0.5366
 epoch: 48, train_loss: 0.8189, test_loss: 0.9101, test_f1: 0.5528
 epoch: 49, train_loss: 0.8193, test_loss: 0.8833, test_f1: 0.5726
 epoch: 50, train_loss: 0.8182, test_loss: 0.9630, test_f1: 0.5381
 epoch: 51, train_loss: 0.8135, test_loss: 0.9478, test_f1: 0.5156
 epoch: 52, train_loss: 0.7968, test_loss: 0.9955, test_f1: 0.5362
 epoch: 53, train_loss: 0.7847, test_loss: 0.9350, test_f1: 0.5342
 epoch: 54, train_loss: 0.7814, test_loss: 0.9432, test_f1: 0.5204
 epoch: 55, train_loss: 0.7853, test_loss: 0.9247, test_f1: 0.5602
 epoch: 56, train_loss: 0.7785, test_loss: 0.9213, test_f1: 0.5449
 epoch: 57, train_loss: 0.7773, test_loss: 0.9371, test_f1: 0.5459
 epoch: 58, train_loss: 0.7879, test_loss: 0.9532, test_f1: 0.5403
 epoch: 59, train_loss: 0.7797, test_loss: 0.9166, test_f1: 0.5582
 epoch: 60, train_loss: 0.7851, test_loss: 0.9278, test_f1: 0.5539
 epoch: 61, train_loss: 0.7667, test_loss: 0.9355, test_f1: 0.5475
 epoch: 62, train_loss: 0.7805, test_loss: 0.9542, test_f1: 0.5291
 epoch: 63, train_loss: 0.7828, test_loss: 0.9320, test_f1: 0.5485
 epoch: 64, train_loss: 0.7738, test_loss: 0.9261, test_f1: 0.5626
 epoch: 65, train_loss: 0.7700, test_loss: 0.9302, test_f1: 0.5448
 epoch: 66, train_loss: 0.7699, test_loss: 0.9106, test_f1: 0.5493
 epoch: 67, train_loss: 0.7740, test_loss: 0.9535, test_f1: 0.5229
 epoch: 68, train_loss: 0.7728, test_loss: 0.9724, test_f1: 0.5381
 epoch: 69, train_loss: 0.7704, test_loss: 0.9250, test_f1: 0.5615
 epoch: 70, train_loss: 0.7620, test_loss: 0.9098, test_f1: 0.5543
 epoch: 71, train_loss: 0.7625, test_loss: 0.9388, test_f1: 0.5487
 epoch: 72, train_loss: 0.7497, test_loss: 0.9723, test_f1: 0.5440
 epoch: 73, train_loss: 0.7636, test_loss: 0.9245, test_f1: 0.5560
 epoch: 74, train_loss: 0.7505, test_loss: 0.9363, test_f1: 0.5470
 epoch: 75, train_loss: 0.7578, test_loss: 0.9340, test_f1: 0.5306
 epoch: 76, train_loss: 0.7585, test_loss: 0.9416, test_f1: 0.5520
 epoch: 77, train_loss: 0.7388, test_loss: 0.9582, test_f1: 0.5409
 epoch: 78, train_loss: 0.7505, test_loss: 0.9546, test_f1: 0.5265
 epoch: 79, train_loss: 0.7489, test_loss: 0.9455, test_f1: 0.5383
 epoch: 80, train_loss: 0.7527, test_loss: 0.9402, test_f1: 0.5608
 epoch: 81, train_loss: 0.7466, test_loss: 0.9353, test_f1: 0.5472
 epoch: 82, train_loss: 0.7607, test_loss: 0.9285, test_f1: 0.5702
 epoch: 83, train_loss: 0.7470, test_loss: 0.9295, test_f1: 0.5658
 epoch: 84, train_loss: 0.7486, test_loss: 0.9948, test_f1: 0.5300
 epoch: 85, train_loss: 0.7505, test_loss: 0.9597, test_f1: 0.5544
 epoch: 86, train_loss: 0.7378, test_loss: 0.9384, test_f1: 0.5647
 epoch: 87, train_loss: 0.7240, test_loss: 0.9564, test_f1: 0.5369
 epoch: 88, train_loss: 0.7474, test_loss: 0.9816, test_f1: 0.5444
 epoch: 89, train_loss: 0.7413, test_loss: 0.9642, test_f1: 0.5440
 epoch: 90, train_loss: 0.7395, test_loss: 0.9639, test_f1: 0.5489
 epoch: 91, train_loss: 0.7383, test_loss: 0.9290, test_f1: 0.5620
 epoch: 92, train_loss: 0.7332, test_loss: 0.9588, test_f1: 0.5619
 epoch: 93, train_loss: 0.7389, test_loss: 0.9509, test_f1: 0.5602
 epoch: 94, train_loss: 0.7357, test_loss: 0.9636, test_f1: 0.5649
 epoch: 95, train_loss: 0.7237, test_loss: 0.9470, test_f1: 0.5518
 epoch: 96, train_loss: 0.7341, test_loss: 0.9780, test_f1: 0.5514
 epoch: 97, train_loss: 0.7359, test_loss: 0.9670, test_f1: 0.5428
 epoch: 98, train_loss: 0.7268, test_loss: 0.9375, test_f1: 0.5472
 epoch: 99, train_loss: 0.7242, test_loss: 0.9417, test_f1: 0.5593
##################ITERATION #9 ****************************************
 epoch: 0, train_loss: 1.4887, test_loss: 1.2168, test_f1: 0.3266
 epoch: 1, train_loss: 1.2144, test_loss: 1.1115, test_f1: 0.4272
 epoch: 2, train_loss: 1.1624, test_loss: 1.0658, test_f1: 0.5076
 epoch: 3, train_loss: 1.1318, test_loss: 1.0363, test_f1: 0.4714
 epoch: 4, train_loss: 1.0866, test_loss: 0.9836, test_f1: 0.5210
 epoch: 5, train_loss: 1.0565, test_loss: 0.9722, test_f1: 0.5137
 epoch: 6, train_loss: 1.0305, test_loss: 0.9519, test_f1: 0.5137
 epoch: 7, train_loss: 1.0122, test_loss: 0.9778, test_f1: 0.4804
 epoch: 8, train_loss: 0.9958, test_loss: 0.9344, test_f1: 0.5143
 epoch: 9, train_loss: 0.9972, test_loss: 1.0047, test_f1: 0.4962
 epoch: 10, train_loss: 0.9784, test_loss: 0.9846, test_f1: 0.5026
 epoch: 11, train_loss: 0.9739, test_loss: 0.9122, test_f1: 0.5137
 epoch: 12, train_loss: 0.9704, test_loss: 0.9409, test_f1: 0.5017
 epoch: 13, train_loss: 0.9537, test_loss: 0.9512, test_f1: 0.5115
 epoch: 14, train_loss: 0.9402, test_loss: 0.9616, test_f1: 0.5060
 epoch: 15, train_loss: 0.9370, test_loss: 0.9341, test_f1: 0.4993
 epoch: 16, train_loss: 0.9397, test_loss: 0.8836, test_f1: 0.5022
 epoch: 17, train_loss: 0.9234, test_loss: 0.9532, test_f1: 0.4955
 epoch: 18, train_loss: 0.9167, test_loss: 0.9619, test_f1: 0.5087
 epoch: 19, train_loss: 0.9159, test_loss: 0.9193, test_f1: 0.5124
 epoch: 20, train_loss: 0.8932, test_loss: 0.9555, test_f1: 0.4967
 epoch: 21, train_loss: 0.9121, test_loss: 0.9302, test_f1: 0.5207
 epoch: 22, train_loss: 0.8991, test_loss: 0.9211, test_f1: 0.5255
 epoch: 23, train_loss: 0.8807, test_loss: 0.9304, test_f1: 0.5270
 epoch: 24, train_loss: 0.8814, test_loss: 0.9026, test_f1: 0.5482
 epoch: 25, train_loss: 0.8868, test_loss: 0.9319, test_f1: 0.5221
 epoch: 26, train_loss: 0.8775, test_loss: 0.9140, test_f1: 0.5143
 epoch: 27, train_loss: 0.8785, test_loss: 0.8854, test_f1: 0.5365
 epoch: 28, train_loss: 0.8713, test_loss: 0.9354, test_f1: 0.5138
 epoch: 29, train_loss: 0.8693, test_loss: 0.8889, test_f1: 0.5365
 epoch: 30, train_loss: 0.8717, test_loss: 0.8954, test_f1: 0.5354
 epoch: 31, train_loss: 0.8528, test_loss: 0.8975, test_f1: 0.5371
 epoch: 32, train_loss: 0.8361, test_loss: 0.8856, test_f1: 0.5327
 epoch: 33, train_loss: 0.8570, test_loss: 0.9296, test_f1: 0.5073
 epoch: 34, train_loss: 0.8546, test_loss: 0.9729, test_f1: 0.5078
 epoch: 35, train_loss: 0.8735, test_loss: 0.9270, test_f1: 0.5217
 epoch: 36, train_loss: 0.8482, test_loss: 0.9090, test_f1: 0.5211
 epoch: 37, train_loss: 0.8568, test_loss: 0.8898, test_f1: 0.5372
 epoch: 38, train_loss: 0.8414, test_loss: 0.8891, test_f1: 0.5247
 epoch: 39, train_loss: 0.8282, test_loss: 0.9200, test_f1: 0.5461
 epoch: 40, train_loss: 0.8318, test_loss: 0.8644, test_f1: 0.5447
 epoch: 41, train_loss: 0.8376, test_loss: 0.8928, test_f1: 0.5438
 epoch: 42, train_loss: 0.8293, test_loss: 0.9004, test_f1: 0.5492
 epoch: 43, train_loss: 0.8188, test_loss: 0.9153, test_f1: 0.5278
 epoch: 44, train_loss: 0.8266, test_loss: 0.8917, test_f1: 0.5267
 epoch: 45, train_loss: 0.8216, test_loss: 0.8986, test_f1: 0.5196
 epoch: 46, train_loss: 0.8114, test_loss: 0.9059, test_f1: 0.5151
 epoch: 47, train_loss: 0.7956, test_loss: 0.8759, test_f1: 0.5507
 epoch: 48, train_loss: 0.8050, test_loss: 0.8896, test_f1: 0.5217
 epoch: 49, train_loss: 0.8150, test_loss: 0.9060, test_f1: 0.5395
 epoch: 50, train_loss: 0.8100, test_loss: 0.9166, test_f1: 0.5237
 epoch: 51, train_loss: 0.7969, test_loss: 0.8674, test_f1: 0.5391
 epoch: 52, train_loss: 0.7951, test_loss: 0.8995, test_f1: 0.5269
 epoch: 53, train_loss: 0.7999, test_loss: 0.8837, test_f1: 0.5299
 epoch: 54, train_loss: 0.7848, test_loss: 0.8861, test_f1: 0.5380
 epoch: 55, train_loss: 0.7804, test_loss: 0.9066, test_f1: 0.5422
 epoch: 56, train_loss: 0.7854, test_loss: 0.8907, test_f1: 0.5276
 epoch: 57, train_loss: 0.7698, test_loss: 0.8967, test_f1: 0.5466
 epoch: 58, train_loss: 0.7826, test_loss: 0.8992, test_f1: 0.5297
 epoch: 59, train_loss: 0.7876, test_loss: 0.9115, test_f1: 0.5377
 epoch: 60, train_loss: 0.7820, test_loss: 0.9081, test_f1: 0.5269
 epoch: 61, train_loss: 0.7803, test_loss: 0.8986, test_f1: 0.5423
 epoch: 62, train_loss: 0.7756, test_loss: 0.9435, test_f1: 0.5195
 epoch: 63, train_loss: 0.7819, test_loss: 0.9063, test_f1: 0.5366
 epoch: 64, train_loss: 0.7743, test_loss: 0.9269, test_f1: 0.5272
 epoch: 65, train_loss: 0.7694, test_loss: 0.9490, test_f1: 0.5191
 epoch: 66, train_loss: 0.7726, test_loss: 0.9075, test_f1: 0.5306
 epoch: 67, train_loss: 0.7676, test_loss: 0.9226, test_f1: 0.5277
 epoch: 68, train_loss: 0.7765, test_loss: 0.9086, test_f1: 0.5318
 epoch: 69, train_loss: 0.7754, test_loss: 0.8989, test_f1: 0.5299
 epoch: 70, train_loss: 0.7720, test_loss: 0.9328, test_f1: 0.5329
 epoch: 71, train_loss: 0.7699, test_loss: 0.9026, test_f1: 0.5316
 epoch: 72, train_loss: 0.7602, test_loss: 0.9074, test_f1: 0.5341
 epoch: 73, train_loss: 0.7678, test_loss: 0.8952, test_f1: 0.5285
 epoch: 74, train_loss: 0.7641, test_loss: 0.9280, test_f1: 0.5236
 epoch: 75, train_loss: 0.7617, test_loss: 0.8990, test_f1: 0.5365
 epoch: 76, train_loss: 0.7648, test_loss: 0.9073, test_f1: 0.5309
 epoch: 77, train_loss: 0.7626, test_loss: 0.9390, test_f1: 0.5272
 epoch: 78, train_loss: 0.7540, test_loss: 0.9017, test_f1: 0.5333
 epoch: 79, train_loss: 0.7683, test_loss: 1.0454, test_f1: 0.5140
 epoch: 80, train_loss: 0.7738, test_loss: 0.9119, test_f1: 0.5228
 epoch: 81, train_loss: 0.7621, test_loss: 0.9276, test_f1: 0.5253
 epoch: 82, train_loss: 0.7611, test_loss: 0.9250, test_f1: 0.5317
 epoch: 83, train_loss: 0.7596, test_loss: 0.9098, test_f1: 0.5344
 epoch: 84, train_loss: 0.7468, test_loss: 0.9140, test_f1: 0.5280
 epoch: 85, train_loss: 0.7508, test_loss: 0.9015, test_f1: 0.5340
 epoch: 86, train_loss: 0.7400, test_loss: 0.9217, test_f1: 0.5334
 epoch: 87, train_loss: 0.7440, test_loss: 0.9379, test_f1: 0.5171
 epoch: 88, train_loss: 0.7567, test_loss: 0.9189, test_f1: 0.5335
 epoch: 89, train_loss: 0.7527, test_loss: 0.9023, test_f1: 0.5414
 epoch: 90, train_loss: 0.7562, test_loss: 0.9132, test_f1: 0.5346
 epoch: 91, train_loss: 0.7498, test_loss: 0.9851, test_f1: 0.5041
 epoch: 92, train_loss: 0.7552, test_loss: 0.8692, test_f1: 0.5427
 epoch: 93, train_loss: 0.7343, test_loss: 0.9144, test_f1: 0.5338
 epoch: 94, train_loss: 0.7355, test_loss: 0.8776, test_f1: 0.5368
 epoch: 95, train_loss: 0.7425, test_loss: 0.8683, test_f1: 0.5409
 epoch: 96, train_loss: 0.7391, test_loss: 0.8921, test_f1: 0.5378
 epoch: 97, train_loss: 0.7491, test_loss: 0.8862, test_f1: 0.5474
 epoch: 98, train_loss: 0.7510, test_loss: 0.9109, test_f1: 0.5420
 epoch: 99, train_loss: 0.7578, test_loss: 0.8946, test_f1: 0.5402

Training completed in 689.58 seconds
Best F1: 0.5923 at epoch 92
Mean F1 across iterations: 0.5626  0.0189
========================FINAL RESULTS================================
FEGIN weighted F1: 0.5923  0.0189
python main.py --data ltspice_examples --representation component_pin --model FEGIN --layers 4 --hiddens 16 --batch_size 64 --lr 0.001 --emb_size 250 --epochs 100 --save_appendix component_pin_L4_H16_BS64_LR0.001_E250 --no_val
-----



STDERR:
  File "main.py", line 370, in <module>
    main()
  File "main.py", line 254, in main
    dataset = dataset_class(
  File "/home/philip/projects/ltspice_examples_code_repo/Circuit-Completion-Using-GNNs/component_classification_with_link_prediction_head/evaluation/FEGIN/kernel/circuit_datasets.py", line 15, in __init__
    self.data, self.slices = torch.load(self.processed_paths[0])
  File "/home/philip/.local/lib/python3.8/site-packages/torch/serialization.py", line 1040, in load
    warnings.warn(
  File "/usr/lib/python3.8/warnings.py", line 109, in _showwarnmsg
    sw(msg.message, msg.category, msg.filename, msg.lineno,
  File "main.py", line 47, in warn_with_traceback
    traceback.print_stack(file=log)
/home/philip/projects/ltspice_examples_code_repo/Circuit-Completion-Using-GNNs/component_classification_with_link_prediction_head/evaluation/FEGIN/kernel/circuit_datasets.py:15: FutureWarning: You are using `torch.load` with `weights_only=False` (the current default value), which uses the default pickle module implicitly. It is possible to construct malicious pickle data which will execute arbitrary code during unpickling (See https://github.com/pytorch/pytorch/blob/main/SECURITY.md#untrusted-models for more details). In a future release, the default value for `weights_only` will be flipped to `True`. This limits the functions that could be executed during unpickling. Arbitrary objects will no longer be allowed to be loaded via this mode unless they are explicitly allowlisted by the user via `torch.serialization.add_safe_globals`. We recommend you start setting `weights_only=True` for any use case where you don't have full control of the loaded file. Please open an issue on GitHub for any issues related to this experimental feature.
  self.data, self.slices = torch.load(self.processed_paths[0])
