STDOUT:
Results will be saved in /home/philip/projects/ltspice_examples_code_repo/Circuit-Completion-Using-GNNs/component_classification_with_link_prediction_head/evaluation/FEGIN/results/model_FEGIN_dataset_ltspice_examples
Command line input: python main.py --data ltspice_examples --representation component_component --model FEGIN --layers 2 --hiddens 64 --batch_size 64 --lr 0.0001 --emb_size 128 --epochs 100 --save_appendix component_component_L2_H64_BS64_LR0.0001_E128 --no_val
 is saved.
-----
ltspice_examples - FEGIN
Using 2 layers, 64 hidden units, h = 2
Loading component_component representation dataset
ENTERED
Training FEGIN on component_component representation
Train: 3556, Test: 845
##################ITERATION #0 ****************************************
 epoch: 0, train_loss: 1.3872, test_loss: 1.3789, test_f1: 0.2515
 epoch: 1, train_loss: 1.3651, test_loss: 1.3565, test_f1: 0.2552
 epoch: 2, train_loss: 1.3444, test_loss: 1.3289, test_f1: 0.2530
 epoch: 3, train_loss: 1.3181, test_loss: 1.2956, test_f1: 0.2663
 epoch: 4, train_loss: 1.2894, test_loss: 1.2666, test_f1: 0.2611
 epoch: 5, train_loss: 1.2659, test_loss: 1.2403, test_f1: 0.3144
 epoch: 6, train_loss: 1.2452, test_loss: 1.2197, test_f1: 0.3383
 epoch: 7, train_loss: 1.2290, test_loss: 1.2003, test_f1: 0.3499
 epoch: 8, train_loss: 1.2128, test_loss: 1.1834, test_f1: 0.3470
 epoch: 9, train_loss: 1.2011, test_loss: 1.1658, test_f1: 0.3474
 epoch: 10, train_loss: 1.1873, test_loss: 1.1547, test_f1: 0.3599
 epoch: 11, train_loss: 1.1765, test_loss: 1.1430, test_f1: 0.3559
 epoch: 12, train_loss: 1.1683, test_loss: 1.1323, test_f1: 0.3659
 epoch: 13, train_loss: 1.1558, test_loss: 1.1213, test_f1: 0.3845
 epoch: 14, train_loss: 1.1479, test_loss: 1.1108, test_f1: 0.3989
 epoch: 15, train_loss: 1.1339, test_loss: 1.1030, test_f1: 0.4209
 epoch: 16, train_loss: 1.1288, test_loss: 1.0950, test_f1: 0.4270
 epoch: 17, train_loss: 1.1268, test_loss: 1.0861, test_f1: 0.4387
 epoch: 18, train_loss: 1.1142, test_loss: 1.0788, test_f1: 0.4443
 epoch: 19, train_loss: 1.1041, test_loss: 1.0707, test_f1: 0.4551
 epoch: 20, train_loss: 1.1042, test_loss: 1.0637, test_f1: 0.4549
 epoch: 21, train_loss: 1.0931, test_loss: 1.0597, test_f1: 0.4688
 epoch: 22, train_loss: 1.0817, test_loss: 1.0531, test_f1: 0.4660
 epoch: 23, train_loss: 1.0780, test_loss: 1.0428, test_f1: 0.4743
 epoch: 24, train_loss: 1.0693, test_loss: 1.0367, test_f1: 0.4770
 epoch: 25, train_loss: 1.0689, test_loss: 1.0274, test_f1: 0.4738
 epoch: 26, train_loss: 1.0611, test_loss: 1.0244, test_f1: 0.4739
 epoch: 27, train_loss: 1.0545, test_loss: 1.0183, test_f1: 0.4844
 epoch: 28, train_loss: 1.0501, test_loss: 1.0112, test_f1: 0.4859
 epoch: 29, train_loss: 1.0404, test_loss: 1.0017, test_f1: 0.4820
 epoch: 30, train_loss: 1.0344, test_loss: 0.9984, test_f1: 0.4765
 epoch: 31, train_loss: 1.0340, test_loss: 0.9937, test_f1: 0.4856
 epoch: 32, train_loss: 1.0245, test_loss: 0.9934, test_f1: 0.5013
 epoch: 33, train_loss: 1.0215, test_loss: 0.9807, test_f1: 0.4954
 epoch: 34, train_loss: 1.0126, test_loss: 0.9788, test_f1: 0.4808
 epoch: 35, train_loss: 1.0104, test_loss: 0.9739, test_f1: 0.4964
 epoch: 36, train_loss: 1.0003, test_loss: 0.9689, test_f1: 0.5047
 epoch: 37, train_loss: 0.9946, test_loss: 0.9645, test_f1: 0.5023
 epoch: 38, train_loss: 0.9885, test_loss: 0.9624, test_f1: 0.4900
 epoch: 39, train_loss: 0.9847, test_loss: 0.9642, test_f1: 0.4945
 epoch: 40, train_loss: 0.9851, test_loss: 0.9568, test_f1: 0.4944
 epoch: 41, train_loss: 0.9736, test_loss: 0.9563, test_f1: 0.4925
 epoch: 42, train_loss: 0.9744, test_loss: 0.9560, test_f1: 0.4903
 epoch: 43, train_loss: 0.9683, test_loss: 0.9497, test_f1: 0.4990
 epoch: 44, train_loss: 0.9532, test_loss: 0.9542, test_f1: 0.4911
 epoch: 45, train_loss: 0.9669, test_loss: 0.9526, test_f1: 0.4898
 epoch: 46, train_loss: 0.9465, test_loss: 0.9476, test_f1: 0.4925
 epoch: 47, train_loss: 0.9421, test_loss: 0.9371, test_f1: 0.5042
 epoch: 48, train_loss: 0.9466, test_loss: 0.9483, test_f1: 0.4941
 epoch: 49, train_loss: 0.9441, test_loss: 0.9518, test_f1: 0.4904
 epoch: 50, train_loss: 0.9410, test_loss: 0.9486, test_f1: 0.4972
 epoch: 51, train_loss: 0.9334, test_loss: 0.9481, test_f1: 0.4996
 epoch: 52, train_loss: 0.9315, test_loss: 0.9397, test_f1: 0.5073
 epoch: 53, train_loss: 0.9213, test_loss: 0.9349, test_f1: 0.4972
 epoch: 54, train_loss: 0.9239, test_loss: 0.9441, test_f1: 0.5102
 epoch: 55, train_loss: 0.9215, test_loss: 0.9431, test_f1: 0.4894
 epoch: 56, train_loss: 0.9233, test_loss: 0.9371, test_f1: 0.5103
 epoch: 57, train_loss: 0.9264, test_loss: 0.9493, test_f1: 0.5179
 epoch: 58, train_loss: 0.9137, test_loss: 0.9472, test_f1: 0.5182
 epoch: 59, train_loss: 0.9131, test_loss: 0.9457, test_f1: 0.5141
 epoch: 60, train_loss: 0.9184, test_loss: 0.9466, test_f1: 0.5207
 epoch: 61, train_loss: 0.9119, test_loss: 0.9428, test_f1: 0.5157
 epoch: 62, train_loss: 0.9190, test_loss: 0.9459, test_f1: 0.5015
 epoch: 63, train_loss: 0.9107, test_loss: 0.9488, test_f1: 0.5150
 epoch: 64, train_loss: 0.9037, test_loss: 0.9448, test_f1: 0.5130
 epoch: 65, train_loss: 0.9091, test_loss: 0.9417, test_f1: 0.5015
 epoch: 66, train_loss: 0.8997, test_loss: 0.9409, test_f1: 0.5219
 epoch: 67, train_loss: 0.8996, test_loss: 0.9436, test_f1: 0.5147
 epoch: 68, train_loss: 0.8968, test_loss: 0.9425, test_f1: 0.5129
 epoch: 69, train_loss: 0.8973, test_loss: 0.9508, test_f1: 0.5191
 epoch: 70, train_loss: 0.9019, test_loss: 0.9400, test_f1: 0.5099
 epoch: 71, train_loss: 0.9014, test_loss: 0.9445, test_f1: 0.5114
 epoch: 72, train_loss: 0.8994, test_loss: 0.9370, test_f1: 0.5048
 epoch: 73, train_loss: 0.9002, test_loss: 0.9432, test_f1: 0.5142
 epoch: 74, train_loss: 0.8896, test_loss: 0.9479, test_f1: 0.5140
 epoch: 75, train_loss: 0.8846, test_loss: 0.9457, test_f1: 0.5162
 epoch: 76, train_loss: 0.8920, test_loss: 0.9463, test_f1: 0.5163
 epoch: 77, train_loss: 0.8902, test_loss: 0.9449, test_f1: 0.5153
 epoch: 78, train_loss: 0.8907, test_loss: 0.9451, test_f1: 0.5190
 epoch: 79, train_loss: 0.8888, test_loss: 0.9522, test_f1: 0.5118
 epoch: 80, train_loss: 0.8843, test_loss: 0.9522, test_f1: 0.5086
 epoch: 81, train_loss: 0.8869, test_loss: 0.9503, test_f1: 0.5070
 epoch: 82, train_loss: 0.8817, test_loss: 0.9471, test_f1: 0.5109
 epoch: 83, train_loss: 0.8778, test_loss: 0.9590, test_f1: 0.4885
 epoch: 84, train_loss: 0.8858, test_loss: 0.9441, test_f1: 0.5151
 epoch: 85, train_loss: 0.8786, test_loss: 0.9453, test_f1: 0.5120
 epoch: 86, train_loss: 0.8789, test_loss: 0.9586, test_f1: 0.5110
 epoch: 87, train_loss: 0.8764, test_loss: 0.9546, test_f1: 0.5134
 epoch: 88, train_loss: 0.8797, test_loss: 0.9505, test_f1: 0.5019
 epoch: 89, train_loss: 0.8840, test_loss: 0.9554, test_f1: 0.5026
 epoch: 90, train_loss: 0.8741, test_loss: 0.9623, test_f1: 0.5051
 epoch: 91, train_loss: 0.8760, test_loss: 0.9568, test_f1: 0.5065
 epoch: 92, train_loss: 0.8764, test_loss: 0.9518, test_f1: 0.4987
 epoch: 93, train_loss: 0.8806, test_loss: 0.9658, test_f1: 0.5147
 epoch: 94, train_loss: 0.8739, test_loss: 0.9646, test_f1: 0.5104
 epoch: 95, train_loss: 0.8762, test_loss: 0.9634, test_f1: 0.5142
 epoch: 96, train_loss: 0.8662, test_loss: 0.9560, test_f1: 0.5115
 epoch: 97, train_loss: 0.8708, test_loss: 0.9595, test_f1: 0.4939
 epoch: 98, train_loss: 0.8681, test_loss: 0.9556, test_f1: 0.5159
 epoch: 99, train_loss: 0.8646, test_loss: 0.9542, test_f1: 0.5077
##################ITERATION #1 ****************************************
 epoch: 0, train_loss: 1.3478, test_loss: 1.3096, test_f1: 0.2274
 epoch: 1, train_loss: 1.2902, test_loss: 1.2707, test_f1: 0.2274
 epoch: 2, train_loss: 1.2642, test_loss: 1.2454, test_f1: 0.2274
 epoch: 3, train_loss: 1.2459, test_loss: 1.2268, test_f1: 0.2527
 epoch: 4, train_loss: 1.2300, test_loss: 1.2124, test_f1: 0.2638
 epoch: 5, train_loss: 1.2152, test_loss: 1.1931, test_f1: 0.3068
 epoch: 6, train_loss: 1.2055, test_loss: 1.1709, test_f1: 0.4096
 epoch: 7, train_loss: 1.1889, test_loss: 1.1568, test_f1: 0.4410
 epoch: 8, train_loss: 1.1734, test_loss: 1.1411, test_f1: 0.4208
 epoch: 9, train_loss: 1.1588, test_loss: 1.1209, test_f1: 0.4311
 epoch: 10, train_loss: 1.1429, test_loss: 1.1082, test_f1: 0.4178
 epoch: 11, train_loss: 1.1303, test_loss: 1.0939, test_f1: 0.4261
 epoch: 12, train_loss: 1.1182, test_loss: 1.0794, test_f1: 0.4323
 epoch: 13, train_loss: 1.1013, test_loss: 1.0603, test_f1: 0.4565
 epoch: 14, train_loss: 1.0956, test_loss: 1.0513, test_f1: 0.4456
 epoch: 15, train_loss: 1.0774, test_loss: 1.0343, test_f1: 0.4494
 epoch: 16, train_loss: 1.0692, test_loss: 1.0230, test_f1: 0.4657
 epoch: 17, train_loss: 1.0613, test_loss: 1.0185, test_f1: 0.4703
 epoch: 18, train_loss: 1.0520, test_loss: 1.0057, test_f1: 0.4686
 epoch: 19, train_loss: 1.0435, test_loss: 0.9991, test_f1: 0.4576
 epoch: 20, train_loss: 1.0364, test_loss: 0.9920, test_f1: 0.4724
 epoch: 21, train_loss: 1.0292, test_loss: 0.9889, test_f1: 0.4659
 epoch: 22, train_loss: 1.0306, test_loss: 0.9804, test_f1: 0.4838
 epoch: 23, train_loss: 1.0099, test_loss: 0.9742, test_f1: 0.4704
 epoch: 24, train_loss: 1.0046, test_loss: 0.9636, test_f1: 0.4899
 epoch: 25, train_loss: 1.0074, test_loss: 0.9647, test_f1: 0.4825
 epoch: 26, train_loss: 0.9943, test_loss: 0.9818, test_f1: 0.4963
 epoch: 27, train_loss: 0.9967, test_loss: 0.9650, test_f1: 0.4899
 epoch: 28, train_loss: 0.9760, test_loss: 0.9669, test_f1: 0.4938
 epoch: 29, train_loss: 0.9777, test_loss: 0.9629, test_f1: 0.4904
 epoch: 30, train_loss: 0.9762, test_loss: 0.9545, test_f1: 0.4976
 epoch: 31, train_loss: 0.9662, test_loss: 0.9675, test_f1: 0.5022
 epoch: 32, train_loss: 0.9624, test_loss: 0.9550, test_f1: 0.4850
 epoch: 33, train_loss: 0.9573, test_loss: 0.9657, test_f1: 0.4839
 epoch: 34, train_loss: 0.9592, test_loss: 0.9518, test_f1: 0.4936
 epoch: 35, train_loss: 0.9481, test_loss: 0.9658, test_f1: 0.5077
 epoch: 36, train_loss: 0.9544, test_loss: 0.9599, test_f1: 0.4799
 epoch: 37, train_loss: 0.9475, test_loss: 0.9468, test_f1: 0.4931
 epoch: 38, train_loss: 0.9302, test_loss: 0.9487, test_f1: 0.5002
 epoch: 39, train_loss: 0.9405, test_loss: 0.9521, test_f1: 0.5038
 epoch: 40, train_loss: 0.9319, test_loss: 0.9448, test_f1: 0.5019
 epoch: 41, train_loss: 0.9245, test_loss: 0.9662, test_f1: 0.4964
 epoch: 42, train_loss: 0.9233, test_loss: 0.9468, test_f1: 0.4774
 epoch: 43, train_loss: 0.9250, test_loss: 0.9322, test_f1: 0.5103
 epoch: 44, train_loss: 0.9164, test_loss: 0.9656, test_f1: 0.4950
 epoch: 45, train_loss: 0.9127, test_loss: 0.9680, test_f1: 0.4919
 epoch: 46, train_loss: 0.9164, test_loss: 0.9600, test_f1: 0.5026
 epoch: 47, train_loss: 0.9096, test_loss: 0.9612, test_f1: 0.4941
 epoch: 48, train_loss: 0.9052, test_loss: 0.9582, test_f1: 0.4834
 epoch: 49, train_loss: 0.9069, test_loss: 0.9619, test_f1: 0.5060
 epoch: 50, train_loss: 0.9047, test_loss: 0.9707, test_f1: 0.5030
 epoch: 51, train_loss: 0.8993, test_loss: 0.9586, test_f1: 0.4942
 epoch: 52, train_loss: 0.8963, test_loss: 0.9704, test_f1: 0.4986
 epoch: 53, train_loss: 0.8867, test_loss: 0.9634, test_f1: 0.4991
 epoch: 54, train_loss: 0.8870, test_loss: 0.9592, test_f1: 0.4952
 epoch: 55, train_loss: 0.8863, test_loss: 0.9602, test_f1: 0.4972
 epoch: 56, train_loss: 0.8830, test_loss: 0.9642, test_f1: 0.5016
 epoch: 57, train_loss: 0.8870, test_loss: 0.9638, test_f1: 0.5075
 epoch: 58, train_loss: 0.8831, test_loss: 0.9629, test_f1: 0.5031
 epoch: 59, train_loss: 0.8808, test_loss: 0.9680, test_f1: 0.5025
 epoch: 60, train_loss: 0.8841, test_loss: 0.9689, test_f1: 0.5053
 epoch: 61, train_loss: 0.8817, test_loss: 0.9692, test_f1: 0.5032
 epoch: 62, train_loss: 0.8824, test_loss: 0.9552, test_f1: 0.5047
 epoch: 63, train_loss: 0.8857, test_loss: 0.9652, test_f1: 0.5058
 epoch: 64, train_loss: 0.8773, test_loss: 0.9768, test_f1: 0.5069
 epoch: 65, train_loss: 0.8812, test_loss: 0.9635, test_f1: 0.5067
 epoch: 66, train_loss: 0.8757, test_loss: 0.9720, test_f1: 0.4992
 epoch: 67, train_loss: 0.8670, test_loss: 0.9563, test_f1: 0.5145
 epoch: 68, train_loss: 0.8788, test_loss: 0.9610, test_f1: 0.5084
 epoch: 69, train_loss: 0.8700, test_loss: 0.9576, test_f1: 0.5057
 epoch: 70, train_loss: 0.8691, test_loss: 0.9792, test_f1: 0.5043
 epoch: 71, train_loss: 0.8742, test_loss: 0.9772, test_f1: 0.5041
 epoch: 72, train_loss: 0.8746, test_loss: 0.9694, test_f1: 0.5040
 epoch: 73, train_loss: 0.8710, test_loss: 0.9636, test_f1: 0.5045
 epoch: 74, train_loss: 0.8685, test_loss: 0.9642, test_f1: 0.5062
 epoch: 75, train_loss: 0.8648, test_loss: 0.9735, test_f1: 0.5124
 epoch: 76, train_loss: 0.8668, test_loss: 0.9770, test_f1: 0.5090
 epoch: 77, train_loss: 0.8658, test_loss: 0.9685, test_f1: 0.5054
 epoch: 78, train_loss: 0.8669, test_loss: 0.9672, test_f1: 0.5092
 epoch: 79, train_loss: 0.8634, test_loss: 0.9891, test_f1: 0.5046
 epoch: 80, train_loss: 0.8685, test_loss: 0.9836, test_f1: 0.5074
 epoch: 81, train_loss: 0.8664, test_loss: 0.9657, test_f1: 0.5138
 epoch: 82, train_loss: 0.8590, test_loss: 0.9924, test_f1: 0.5089
 epoch: 83, train_loss: 0.8547, test_loss: 0.9714, test_f1: 0.5001
 epoch: 84, train_loss: 0.8635, test_loss: 0.9699, test_f1: 0.5078
 epoch: 85, train_loss: 0.8536, test_loss: 0.9889, test_f1: 0.5109
 epoch: 86, train_loss: 0.8533, test_loss: 0.9669, test_f1: 0.5176
 epoch: 87, train_loss: 0.8465, test_loss: 0.9801, test_f1: 0.5137
 epoch: 88, train_loss: 0.8522, test_loss: 0.9747, test_f1: 0.5014
 epoch: 89, train_loss: 0.8619, test_loss: 0.9696, test_f1: 0.5139
 epoch: 90, train_loss: 0.8467, test_loss: 0.9882, test_f1: 0.5079
 epoch: 91, train_loss: 0.8430, test_loss: 0.9763, test_f1: 0.5124
 epoch: 92, train_loss: 0.8427, test_loss: 0.9850, test_f1: 0.5069
 epoch: 93, train_loss: 0.8464, test_loss: 0.9968, test_f1: 0.5043
 epoch: 94, train_loss: 0.8524, test_loss: 0.9808, test_f1: 0.5162
 epoch: 95, train_loss: 0.8349, test_loss: 0.9947, test_f1: 0.5152
 epoch: 96, train_loss: 0.8436, test_loss: 0.9890, test_f1: 0.5149
 epoch: 97, train_loss: 0.8377, test_loss: 0.9755, test_f1: 0.5059
 epoch: 98, train_loss: 0.8420, test_loss: 0.9857, test_f1: 0.4895
 epoch: 99, train_loss: 0.8397, test_loss: 0.9891, test_f1: 0.5077
##################ITERATION #2 ****************************************
 epoch: 0, train_loss: 1.3690, test_loss: 1.3125, test_f1: 0.3332
 epoch: 1, train_loss: 1.2869, test_loss: 1.2478, test_f1: 0.3626
 epoch: 2, train_loss: 1.2617, test_loss: 1.2169, test_f1: 0.3802
 epoch: 3, train_loss: 1.2378, test_loss: 1.1948, test_f1: 0.4154
 epoch: 4, train_loss: 1.2220, test_loss: 1.1810, test_f1: 0.4199
 epoch: 5, train_loss: 1.2058, test_loss: 1.1633, test_f1: 0.4265
 epoch: 6, train_loss: 1.1996, test_loss: 1.1506, test_f1: 0.4253
 epoch: 7, train_loss: 1.1866, test_loss: 1.1351, test_f1: 0.4316
 epoch: 8, train_loss: 1.1751, test_loss: 1.1244, test_f1: 0.4316
 epoch: 9, train_loss: 1.1599, test_loss: 1.1145, test_f1: 0.4378
 epoch: 10, train_loss: 1.1445, test_loss: 1.1013, test_f1: 0.4416
 epoch: 11, train_loss: 1.1397, test_loss: 1.0901, test_f1: 0.4549
 epoch: 12, train_loss: 1.1325, test_loss: 1.0791, test_f1: 0.4505
 epoch: 13, train_loss: 1.1215, test_loss: 1.0676, test_f1: 0.4527
 epoch: 14, train_loss: 1.1133, test_loss: 1.0640, test_f1: 0.4498
 epoch: 15, train_loss: 1.1040, test_loss: 1.0523, test_f1: 0.4589
 epoch: 16, train_loss: 1.0972, test_loss: 1.0422, test_f1: 0.4516
 epoch: 17, train_loss: 1.0832, test_loss: 1.0365, test_f1: 0.4490
 epoch: 18, train_loss: 1.0762, test_loss: 1.0271, test_f1: 0.4579
 epoch: 19, train_loss: 1.0739, test_loss: 1.0185, test_f1: 0.4683
 epoch: 20, train_loss: 1.0603, test_loss: 1.0138, test_f1: 0.4910
 epoch: 21, train_loss: 1.0516, test_loss: 1.0063, test_f1: 0.4889
 epoch: 22, train_loss: 1.0482, test_loss: 0.9980, test_f1: 0.4675
 epoch: 23, train_loss: 1.0479, test_loss: 0.9957, test_f1: 0.4904
 epoch: 24, train_loss: 1.0442, test_loss: 0.9869, test_f1: 0.5014
 epoch: 25, train_loss: 1.0289, test_loss: 0.9832, test_f1: 0.5007
 epoch: 26, train_loss: 1.0224, test_loss: 0.9828, test_f1: 0.5038
 epoch: 27, train_loss: 1.0188, test_loss: 0.9749, test_f1: 0.4790
 epoch: 28, train_loss: 1.0148, test_loss: 0.9752, test_f1: 0.4960
 epoch: 29, train_loss: 1.0077, test_loss: 0.9723, test_f1: 0.4971
 epoch: 30, train_loss: 1.0044, test_loss: 0.9675, test_f1: 0.4912
 epoch: 31, train_loss: 1.0013, test_loss: 0.9610, test_f1: 0.4896
 epoch: 32, train_loss: 0.9943, test_loss: 0.9604, test_f1: 0.4878
 epoch: 33, train_loss: 0.9948, test_loss: 0.9552, test_f1: 0.4913
 epoch: 34, train_loss: 0.9794, test_loss: 0.9580, test_f1: 0.4908
 epoch: 35, train_loss: 0.9792, test_loss: 0.9532, test_f1: 0.4806
 epoch: 36, train_loss: 0.9784, test_loss: 0.9385, test_f1: 0.4702
 epoch: 37, train_loss: 0.9734, test_loss: 0.9493, test_f1: 0.4869
 epoch: 38, train_loss: 0.9684, test_loss: 0.9434, test_f1: 0.4815
 epoch: 39, train_loss: 0.9660, test_loss: 0.9652, test_f1: 0.4679
 epoch: 40, train_loss: 0.9590, test_loss: 0.9558, test_f1: 0.4646
 epoch: 41, train_loss: 0.9579, test_loss: 0.9391, test_f1: 0.5018
 epoch: 42, train_loss: 0.9512, test_loss: 0.9438, test_f1: 0.5117
 epoch: 43, train_loss: 0.9531, test_loss: 0.9377, test_f1: 0.4916
 epoch: 44, train_loss: 0.9394, test_loss: 0.9366, test_f1: 0.5018
 epoch: 45, train_loss: 0.9394, test_loss: 0.9560, test_f1: 0.4659
 epoch: 46, train_loss: 0.9389, test_loss: 0.9499, test_f1: 0.4725
 epoch: 47, train_loss: 0.9364, test_loss: 0.9489, test_f1: 0.5085
 epoch: 48, train_loss: 0.9291, test_loss: 0.9391, test_f1: 0.5120
 epoch: 49, train_loss: 0.9290, test_loss: 0.9455, test_f1: 0.5154
 epoch: 50, train_loss: 0.9277, test_loss: 0.9703, test_f1: 0.4784
 epoch: 51, train_loss: 0.9212, test_loss: 0.9497, test_f1: 0.5007
 epoch: 52, train_loss: 0.9172, test_loss: 0.9490, test_f1: 0.5147
 epoch: 53, train_loss: 0.9166, test_loss: 0.9856, test_f1: 0.4838
 epoch: 54, train_loss: 0.9167, test_loss: 0.9432, test_f1: 0.5207
 epoch: 55, train_loss: 0.9120, test_loss: 0.9626, test_f1: 0.4877
 epoch: 56, train_loss: 0.9075, test_loss: 0.9403, test_f1: 0.5226
 epoch: 57, train_loss: 0.9115, test_loss: 0.9455, test_f1: 0.5192
 epoch: 58, train_loss: 0.9150, test_loss: 0.9457, test_f1: 0.5004
 epoch: 59, train_loss: 0.9119, test_loss: 0.9535, test_f1: 0.4934
 epoch: 60, train_loss: 0.9051, test_loss: 0.9762, test_f1: 0.4872
 epoch: 61, train_loss: 0.9073, test_loss: 0.9507, test_f1: 0.5137
 epoch: 62, train_loss: 0.9070, test_loss: 0.9516, test_f1: 0.5216
 epoch: 63, train_loss: 0.8919, test_loss: 0.9522, test_f1: 0.5162
 epoch: 64, train_loss: 0.9035, test_loss: 0.9558, test_f1: 0.5115
 epoch: 65, train_loss: 0.8949, test_loss: 0.9723, test_f1: 0.4932
 epoch: 66, train_loss: 0.8969, test_loss: 0.9711, test_f1: 0.4894
 epoch: 67, train_loss: 0.8904, test_loss: 0.9727, test_f1: 0.4936
 epoch: 68, train_loss: 0.8922, test_loss: 0.9538, test_f1: 0.5196
 epoch: 69, train_loss: 0.8848, test_loss: 0.9852, test_f1: 0.4822
 epoch: 70, train_loss: 0.8929, test_loss: 1.0053, test_f1: 0.4875
 epoch: 71, train_loss: 0.8825, test_loss: 0.9507, test_f1: 0.5146
 epoch: 72, train_loss: 0.8901, test_loss: 0.9740, test_f1: 0.4838
 epoch: 73, train_loss: 0.8846, test_loss: 0.9688, test_f1: 0.4992
 epoch: 74, train_loss: 0.8833, test_loss: 0.9853, test_f1: 0.4793
 epoch: 75, train_loss: 0.8814, test_loss: 0.9631, test_f1: 0.5035
 epoch: 76, train_loss: 0.8718, test_loss: 0.9995, test_f1: 0.4855
 epoch: 77, train_loss: 0.8785, test_loss: 0.9872, test_f1: 0.5055
 epoch: 78, train_loss: 0.8717, test_loss: 0.9574, test_f1: 0.5183
 epoch: 79, train_loss: 0.8867, test_loss: 0.9814, test_f1: 0.4917
 epoch: 80, train_loss: 0.8756, test_loss: 0.9606, test_f1: 0.5177
 epoch: 81, train_loss: 0.8751, test_loss: 0.9575, test_f1: 0.5133
 epoch: 82, train_loss: 0.8713, test_loss: 0.9670, test_f1: 0.4902
 epoch: 83, train_loss: 0.8569, test_loss: 0.9590, test_f1: 0.5215
 epoch: 84, train_loss: 0.8815, test_loss: 0.9548, test_f1: 0.5159
 epoch: 85, train_loss: 0.8835, test_loss: 0.9987, test_f1: 0.4950
 epoch: 86, train_loss: 0.8650, test_loss: 0.9884, test_f1: 0.4957
 epoch: 87, train_loss: 0.8667, test_loss: 0.9728, test_f1: 0.5006
 epoch: 88, train_loss: 0.8698, test_loss: 0.9772, test_f1: 0.5101
 epoch: 89, train_loss: 0.8624, test_loss: 0.9557, test_f1: 0.5294
 epoch: 90, train_loss: 0.8638, test_loss: 0.9563, test_f1: 0.5125
 epoch: 91, train_loss: 0.8657, test_loss: 0.9747, test_f1: 0.4984
 epoch: 92, train_loss: 0.8581, test_loss: 0.9893, test_f1: 0.4929
 epoch: 93, train_loss: 0.8643, test_loss: 0.9628, test_f1: 0.5204
 epoch: 94, train_loss: 0.8658, test_loss: 0.9667, test_f1: 0.5190
 epoch: 95, train_loss: 0.8587, test_loss: 0.9919, test_f1: 0.4909
 epoch: 96, train_loss: 0.8525, test_loss: 0.9524, test_f1: 0.5207
 epoch: 97, train_loss: 0.8431, test_loss: 0.9725, test_f1: 0.5089
 epoch: 98, train_loss: 0.8591, test_loss: 0.9491, test_f1: 0.5157
 epoch: 99, train_loss: 0.8438, test_loss: 1.0034, test_f1: 0.4846
##################ITERATION #3 ****************************************
 epoch: 0, train_loss: 1.3073, test_loss: 1.2517, test_f1: 0.2642
 epoch: 1, train_loss: 1.2473, test_loss: 1.2043, test_f1: 0.3443
 epoch: 2, train_loss: 1.2252, test_loss: 1.1776, test_f1: 0.3943
 epoch: 3, train_loss: 1.1985, test_loss: 1.1580, test_f1: 0.4072
 epoch: 4, train_loss: 1.1886, test_loss: 1.1396, test_f1: 0.4221
 epoch: 5, train_loss: 1.1755, test_loss: 1.1263, test_f1: 0.4320
 epoch: 6, train_loss: 1.1619, test_loss: 1.1128, test_f1: 0.4343
 epoch: 7, train_loss: 1.1502, test_loss: 1.0997, test_f1: 0.4450
 epoch: 8, train_loss: 1.1422, test_loss: 1.0866, test_f1: 0.4229
 epoch: 9, train_loss: 1.1212, test_loss: 1.0794, test_f1: 0.4237
 epoch: 10, train_loss: 1.1222, test_loss: 1.0705, test_f1: 0.4363
 epoch: 11, train_loss: 1.1092, test_loss: 1.0658, test_f1: 0.4312
 epoch: 12, train_loss: 1.0948, test_loss: 1.0497, test_f1: 0.4434
 epoch: 13, train_loss: 1.0931, test_loss: 1.0463, test_f1: 0.4481
 epoch: 14, train_loss: 1.0828, test_loss: 1.0352, test_f1: 0.4608
 epoch: 15, train_loss: 1.0754, test_loss: 1.0279, test_f1: 0.4640
 epoch: 16, train_loss: 1.0634, test_loss: 1.0245, test_f1: 0.4710
 epoch: 17, train_loss: 1.0601, test_loss: 1.0149, test_f1: 0.4353
 epoch: 18, train_loss: 1.0551, test_loss: 1.0037, test_f1: 0.4623
 epoch: 19, train_loss: 1.0450, test_loss: 0.9995, test_f1: 0.4797
 epoch: 20, train_loss: 1.0403, test_loss: 1.0007, test_f1: 0.4718
 epoch: 21, train_loss: 1.0310, test_loss: 0.9883, test_f1: 0.4819
 epoch: 22, train_loss: 1.0273, test_loss: 0.9836, test_f1: 0.4783
 epoch: 23, train_loss: 1.0206, test_loss: 0.9829, test_f1: 0.4799
 epoch: 24, train_loss: 1.0149, test_loss: 0.9845, test_f1: 0.4546
 epoch: 25, train_loss: 1.0056, test_loss: 0.9835, test_f1: 0.4657
 epoch: 26, train_loss: 1.0008, test_loss: 0.9871, test_f1: 0.4718
 epoch: 27, train_loss: 0.9951, test_loss: 0.9814, test_f1: 0.4816
 epoch: 28, train_loss: 0.9935, test_loss: 0.9885, test_f1: 0.4734
 epoch: 29, train_loss: 0.9905, test_loss: 0.9796, test_f1: 0.4728
 epoch: 30, train_loss: 0.9856, test_loss: 0.9890, test_f1: 0.4732
 epoch: 31, train_loss: 0.9841, test_loss: 0.9797, test_f1: 0.4811
 epoch: 32, train_loss: 0.9735, test_loss: 0.9746, test_f1: 0.4754
 epoch: 33, train_loss: 0.9760, test_loss: 0.9804, test_f1: 0.4739
 epoch: 34, train_loss: 0.9603, test_loss: 0.9813, test_f1: 0.4763
 epoch: 35, train_loss: 0.9719, test_loss: 0.9841, test_f1: 0.4621
 epoch: 36, train_loss: 0.9573, test_loss: 0.9758, test_f1: 0.4868
 epoch: 37, train_loss: 0.9605, test_loss: 0.9801, test_f1: 0.4818
 epoch: 38, train_loss: 0.9511, test_loss: 0.9697, test_f1: 0.4884
 epoch: 39, train_loss: 0.9456, test_loss: 0.9858, test_f1: 0.4814
 epoch: 40, train_loss: 0.9551, test_loss: 0.9810, test_f1: 0.4944
 epoch: 41, train_loss: 0.9413, test_loss: 0.9800, test_f1: 0.4899
 epoch: 42, train_loss: 0.9425, test_loss: 0.9777, test_f1: 0.4891
 epoch: 43, train_loss: 0.9413, test_loss: 0.9733, test_f1: 0.5026
 epoch: 44, train_loss: 0.9272, test_loss: 0.9860, test_f1: 0.4897
 epoch: 45, train_loss: 0.9304, test_loss: 0.9747, test_f1: 0.4996
 epoch: 46, train_loss: 0.9201, test_loss: 0.9820, test_f1: 0.5052
 epoch: 47, train_loss: 0.9170, test_loss: 0.9612, test_f1: 0.4903
 epoch: 48, train_loss: 0.9127, test_loss: 0.9564, test_f1: 0.4943
 epoch: 49, train_loss: 0.9097, test_loss: 0.9764, test_f1: 0.5005
 epoch: 50, train_loss: 0.9076, test_loss: 0.9691, test_f1: 0.4935
 epoch: 51, train_loss: 0.9074, test_loss: 0.9763, test_f1: 0.5069
 epoch: 52, train_loss: 0.9063, test_loss: 0.9725, test_f1: 0.4967
 epoch: 53, train_loss: 0.9048, test_loss: 0.9669, test_f1: 0.4981
 epoch: 54, train_loss: 0.9090, test_loss: 0.9646, test_f1: 0.4926
 epoch: 55, train_loss: 0.9026, test_loss: 0.9739, test_f1: 0.4953
 epoch: 56, train_loss: 0.8951, test_loss: 0.9667, test_f1: 0.4912
 epoch: 57, train_loss: 0.8955, test_loss: 0.9705, test_f1: 0.5002
 epoch: 58, train_loss: 0.8998, test_loss: 0.9796, test_f1: 0.4886
 epoch: 59, train_loss: 0.8970, test_loss: 0.9677, test_f1: 0.4850
 epoch: 60, train_loss: 0.8881, test_loss: 0.9803, test_f1: 0.4847
 epoch: 61, train_loss: 0.8872, test_loss: 0.9779, test_f1: 0.4868
 epoch: 62, train_loss: 0.8873, test_loss: 0.9738, test_f1: 0.4819
 epoch: 63, train_loss: 0.8799, test_loss: 0.9694, test_f1: 0.4926
 epoch: 64, train_loss: 0.8868, test_loss: 0.9789, test_f1: 0.4919
 epoch: 65, train_loss: 0.8826, test_loss: 0.9820, test_f1: 0.4951
 epoch: 66, train_loss: 0.8822, test_loss: 0.9954, test_f1: 0.4843
 epoch: 67, train_loss: 0.8825, test_loss: 0.9797, test_f1: 0.4858
 epoch: 68, train_loss: 0.8848, test_loss: 0.9795, test_f1: 0.4873
 epoch: 69, train_loss: 0.8801, test_loss: 0.9827, test_f1: 0.4861
 epoch: 70, train_loss: 0.8669, test_loss: 0.9749, test_f1: 0.4882
 epoch: 71, train_loss: 0.8790, test_loss: 0.9765, test_f1: 0.4815
 epoch: 72, train_loss: 0.8662, test_loss: 0.9749, test_f1: 0.4853
 epoch: 73, train_loss: 0.8699, test_loss: 0.9854, test_f1: 0.4846
 epoch: 74, train_loss: 0.8731, test_loss: 0.9897, test_f1: 0.4808
 epoch: 75, train_loss: 0.8779, test_loss: 0.9911, test_f1: 0.4876
 epoch: 76, train_loss: 0.8690, test_loss: 0.9857, test_f1: 0.4884
 epoch: 77, train_loss: 0.8685, test_loss: 0.9931, test_f1: 0.4847
 epoch: 78, train_loss: 0.8674, test_loss: 1.0028, test_f1: 0.4816
 epoch: 79, train_loss: 0.8662, test_loss: 1.0010, test_f1: 0.4849
 epoch: 80, train_loss: 0.8706, test_loss: 1.0107, test_f1: 0.4842
 epoch: 81, train_loss: 0.8610, test_loss: 1.0091, test_f1: 0.4803
 epoch: 82, train_loss: 0.8677, test_loss: 1.0145, test_f1: 0.4787
 epoch: 83, train_loss: 0.8566, test_loss: 0.9930, test_f1: 0.4889
 epoch: 84, train_loss: 0.8481, test_loss: 0.9975, test_f1: 0.4835
 epoch: 85, train_loss: 0.8532, test_loss: 1.0015, test_f1: 0.4836
 epoch: 86, train_loss: 0.8535, test_loss: 0.9956, test_f1: 0.4758
 epoch: 87, train_loss: 0.8526, test_loss: 1.0083, test_f1: 0.4827
 epoch: 88, train_loss: 0.8490, test_loss: 1.0115, test_f1: 0.4762
 epoch: 89, train_loss: 0.8487, test_loss: 1.0004, test_f1: 0.4866
 epoch: 90, train_loss: 0.8521, test_loss: 1.0107, test_f1: 0.4809
 epoch: 91, train_loss: 0.8358, test_loss: 1.0171, test_f1: 0.4887
 epoch: 92, train_loss: 0.8498, test_loss: 1.0148, test_f1: 0.4797
 epoch: 93, train_loss: 0.8402, test_loss: 1.0080, test_f1: 0.4796
 epoch: 94, train_loss: 0.8333, test_loss: 1.0154, test_f1: 0.4826
 epoch: 95, train_loss: 0.8436, test_loss: 1.0103, test_f1: 0.4847
 epoch: 96, train_loss: 0.8346, test_loss: 1.0209, test_f1: 0.4841
 epoch: 97, train_loss: 0.8455, test_loss: 0.9931, test_f1: 0.4880
 epoch: 98, train_loss: 0.8366, test_loss: 1.0271, test_f1: 0.4778
 epoch: 99, train_loss: 0.8393, test_loss: 1.0220, test_f1: 0.4876
##################ITERATION #4 ****************************************
 epoch: 0, train_loss: 1.3428, test_loss: 1.2564, test_f1: 0.2422
 epoch: 1, train_loss: 1.2582, test_loss: 1.2078, test_f1: 0.3308
 epoch: 2, train_loss: 1.2466, test_loss: 1.1863, test_f1: 0.3765
 epoch: 3, train_loss: 1.2249, test_loss: 1.1683, test_f1: 0.3851
 epoch: 4, train_loss: 1.2053, test_loss: 1.1552, test_f1: 0.3789
 epoch: 5, train_loss: 1.1941, test_loss: 1.1446, test_f1: 0.4052
 epoch: 6, train_loss: 1.1805, test_loss: 1.1268, test_f1: 0.4117
 epoch: 7, train_loss: 1.1668, test_loss: 1.1187, test_f1: 0.4132
 epoch: 8, train_loss: 1.1597, test_loss: 1.1103, test_f1: 0.4437
 epoch: 9, train_loss: 1.1580, test_loss: 1.0975, test_f1: 0.4222
 epoch: 10, train_loss: 1.1478, test_loss: 1.0902, test_f1: 0.4469
 epoch: 11, train_loss: 1.1350, test_loss: 1.0826, test_f1: 0.4384
 epoch: 12, train_loss: 1.1224, test_loss: 1.0750, test_f1: 0.4389
 epoch: 13, train_loss: 1.1182, test_loss: 1.0653, test_f1: 0.4347
 epoch: 14, train_loss: 1.1085, test_loss: 1.0604, test_f1: 0.4493
 epoch: 15, train_loss: 1.0953, test_loss: 1.0593, test_f1: 0.4375
 epoch: 16, train_loss: 1.0865, test_loss: 1.0449, test_f1: 0.4486
 epoch: 17, train_loss: 1.0852, test_loss: 1.0394, test_f1: 0.4589
 epoch: 18, train_loss: 1.0704, test_loss: 1.0289, test_f1: 0.4588
 epoch: 19, train_loss: 1.0696, test_loss: 1.0288, test_f1: 0.4640
 epoch: 20, train_loss: 1.0633, test_loss: 1.0288, test_f1: 0.4522
 epoch: 21, train_loss: 1.0526, test_loss: 1.0256, test_f1: 0.4611
 epoch: 22, train_loss: 1.0575, test_loss: 1.0086, test_f1: 0.4614
 epoch: 23, train_loss: 1.0439, test_loss: 1.0036, test_f1: 0.4643
 epoch: 24, train_loss: 1.0392, test_loss: 0.9939, test_f1: 0.4775
 epoch: 25, train_loss: 1.0441, test_loss: 0.9895, test_f1: 0.4736
 epoch: 26, train_loss: 1.0322, test_loss: 0.9870, test_f1: 0.4513
 epoch: 27, train_loss: 1.0189, test_loss: 0.9788, test_f1: 0.4640
 epoch: 28, train_loss: 1.0241, test_loss: 0.9776, test_f1: 0.4676
 epoch: 29, train_loss: 1.0138, test_loss: 0.9795, test_f1: 0.4565
 epoch: 30, train_loss: 1.0116, test_loss: 0.9805, test_f1: 0.4660
 epoch: 31, train_loss: 0.9936, test_loss: 0.9663, test_f1: 0.4744
 epoch: 32, train_loss: 0.9876, test_loss: 0.9672, test_f1: 0.4697
 epoch: 33, train_loss: 0.9857, test_loss: 0.9606, test_f1: 0.4610
 epoch: 34, train_loss: 0.9852, test_loss: 0.9654, test_f1: 0.4824
 epoch: 35, train_loss: 0.9773, test_loss: 0.9586, test_f1: 0.4721
 epoch: 36, train_loss: 0.9753, test_loss: 0.9560, test_f1: 0.4715
 epoch: 37, train_loss: 0.9805, test_loss: 0.9496, test_f1: 0.4654
 epoch: 38, train_loss: 0.9702, test_loss: 0.9511, test_f1: 0.4562
 epoch: 39, train_loss: 0.9580, test_loss: 0.9349, test_f1: 0.4674
 epoch: 40, train_loss: 0.9582, test_loss: 0.9449, test_f1: 0.4866
 epoch: 41, train_loss: 0.9556, test_loss: 0.9413, test_f1: 0.4738
 epoch: 42, train_loss: 0.9470, test_loss: 0.9377, test_f1: 0.4814
 epoch: 43, train_loss: 0.9567, test_loss: 0.9371, test_f1: 0.4804
 epoch: 44, train_loss: 0.9473, test_loss: 0.9284, test_f1: 0.4684
 epoch: 45, train_loss: 0.9439, test_loss: 0.9338, test_f1: 0.4856
 epoch: 46, train_loss: 0.9416, test_loss: 0.9350, test_f1: 0.4868
 epoch: 47, train_loss: 0.9355, test_loss: 0.9302, test_f1: 0.4973
 epoch: 48, train_loss: 0.9268, test_loss: 0.9210, test_f1: 0.5160
 epoch: 49, train_loss: 0.9183, test_loss: 0.9259, test_f1: 0.5020
 epoch: 50, train_loss: 0.9326, test_loss: 0.9316, test_f1: 0.4917
 epoch: 51, train_loss: 0.9157, test_loss: 0.9282, test_f1: 0.4965
 epoch: 52, train_loss: 0.9228, test_loss: 0.9306, test_f1: 0.4977
 epoch: 53, train_loss: 0.9167, test_loss: 0.9221, test_f1: 0.5024
 epoch: 54, train_loss: 0.9227, test_loss: 0.9286, test_f1: 0.5043
 epoch: 55, train_loss: 0.9036, test_loss: 0.9265, test_f1: 0.4965
 epoch: 56, train_loss: 0.9071, test_loss: 0.9322, test_f1: 0.5054
 epoch: 57, train_loss: 0.9096, test_loss: 0.9302, test_f1: 0.5046
 epoch: 58, train_loss: 0.9132, test_loss: 0.9285, test_f1: 0.5052
 epoch: 59, train_loss: 0.9010, test_loss: 0.9266, test_f1: 0.5057
 epoch: 60, train_loss: 0.9032, test_loss: 0.9314, test_f1: 0.5014
 epoch: 61, train_loss: 0.9009, test_loss: 0.9301, test_f1: 0.4995
 epoch: 62, train_loss: 0.9055, test_loss: 0.9265, test_f1: 0.4879
 epoch: 63, train_loss: 0.9058, test_loss: 0.9410, test_f1: 0.4937
 epoch: 64, train_loss: 0.9001, test_loss: 0.9344, test_f1: 0.4873
 epoch: 65, train_loss: 0.9006, test_loss: 0.9358, test_f1: 0.5100
 epoch: 66, train_loss: 0.8907, test_loss: 0.9435, test_f1: 0.4778
 epoch: 67, train_loss: 0.8982, test_loss: 0.9307, test_f1: 0.4961
 epoch: 68, train_loss: 0.8882, test_loss: 0.9268, test_f1: 0.4839
 epoch: 69, train_loss: 0.8953, test_loss: 0.9494, test_f1: 0.4699
 epoch: 70, train_loss: 0.8849, test_loss: 0.9288, test_f1: 0.4997
 epoch: 71, train_loss: 0.8951, test_loss: 0.9424, test_f1: 0.4786
 epoch: 72, train_loss: 0.8857, test_loss: 0.9499, test_f1: 0.4861
 epoch: 73, train_loss: 0.8832, test_loss: 0.9329, test_f1: 0.4939
 epoch: 74, train_loss: 0.8825, test_loss: 0.9543, test_f1: 0.4712
 epoch: 75, train_loss: 0.8812, test_loss: 0.9437, test_f1: 0.4953
 epoch: 76, train_loss: 0.8786, test_loss: 0.9439, test_f1: 0.4858
 epoch: 77, train_loss: 0.8847, test_loss: 0.9319, test_f1: 0.4908
 epoch: 78, train_loss: 0.8841, test_loss: 0.9542, test_f1: 0.4854
 epoch: 79, train_loss: 0.8793, test_loss: 0.9470, test_f1: 0.4826
 epoch: 80, train_loss: 0.8766, test_loss: 0.9560, test_f1: 0.4923
 epoch: 81, train_loss: 0.8719, test_loss: 0.9413, test_f1: 0.4959
 epoch: 82, train_loss: 0.8809, test_loss: 0.9418, test_f1: 0.4963
 epoch: 83, train_loss: 0.8666, test_loss: 0.9586, test_f1: 0.4921
 epoch: 84, train_loss: 0.8589, test_loss: 0.9519, test_f1: 0.4888
 epoch: 85, train_loss: 0.8603, test_loss: 0.9602, test_f1: 0.4938
 epoch: 86, train_loss: 0.8673, test_loss: 0.9764, test_f1: 0.4804
 epoch: 87, train_loss: 0.8646, test_loss: 0.9567, test_f1: 0.4789
 epoch: 88, train_loss: 0.8581, test_loss: 0.9817, test_f1: 0.4818
 epoch: 89, train_loss: 0.8698, test_loss: 0.9514, test_f1: 0.4987
 epoch: 90, train_loss: 0.8659, test_loss: 0.9562, test_f1: 0.4894
 epoch: 91, train_loss: 0.8571, test_loss: 0.9559, test_f1: 0.4860
 epoch: 92, train_loss: 0.8605, test_loss: 0.9676, test_f1: 0.4872
 epoch: 93, train_loss: 0.8563, test_loss: 0.9605, test_f1: 0.4920
 epoch: 94, train_loss: 0.8525, test_loss: 0.9532, test_f1: 0.4815
 epoch: 95, train_loss: 0.8502, test_loss: 0.9887, test_f1: 0.4783
 epoch: 96, train_loss: 0.8523, test_loss: 0.9861, test_f1: 0.4843
 epoch: 97, train_loss: 0.8582, test_loss: 0.9622, test_f1: 0.4929
 epoch: 98, train_loss: 0.8589, test_loss: 0.9835, test_f1: 0.4817
 epoch: 99, train_loss: 0.8462, test_loss: 0.9815, test_f1: 0.4854
##################ITERATION #5 ****************************************
 epoch: 0, train_loss: 1.3594, test_loss: 1.2618, test_f1: 0.3170
 epoch: 1, train_loss: 1.2670, test_loss: 1.2158, test_f1: 0.3691
 epoch: 2, train_loss: 1.2383, test_loss: 1.1870, test_f1: 0.3833
 epoch: 3, train_loss: 1.2192, test_loss: 1.1686, test_f1: 0.3873
 epoch: 4, train_loss: 1.2072, test_loss: 1.1446, test_f1: 0.4015
 epoch: 5, train_loss: 1.1929, test_loss: 1.1261, test_f1: 0.4258
 epoch: 6, train_loss: 1.1651, test_loss: 1.1100, test_f1: 0.4377
 epoch: 7, train_loss: 1.1534, test_loss: 1.0929, test_f1: 0.4522
 epoch: 8, train_loss: 1.1406, test_loss: 1.0809, test_f1: 0.4541
 epoch: 9, train_loss: 1.1335, test_loss: 1.0694, test_f1: 0.4669
 epoch: 10, train_loss: 1.1144, test_loss: 1.0568, test_f1: 0.4702
 epoch: 11, train_loss: 1.1087, test_loss: 1.0490, test_f1: 0.4656
 epoch: 12, train_loss: 1.1003, test_loss: 1.0380, test_f1: 0.4587
 epoch: 13, train_loss: 1.0802, test_loss: 1.0302, test_f1: 0.4621
 epoch: 14, train_loss: 1.0815, test_loss: 1.0233, test_f1: 0.4651
 epoch: 15, train_loss: 1.0719, test_loss: 1.0205, test_f1: 0.4610
 epoch: 16, train_loss: 1.0613, test_loss: 1.0115, test_f1: 0.4628
 epoch: 17, train_loss: 1.0525, test_loss: 1.0161, test_f1: 0.4582
 epoch: 18, train_loss: 1.0447, test_loss: 1.0066, test_f1: 0.4630
 epoch: 19, train_loss: 1.0412, test_loss: 1.0043, test_f1: 0.4662
 epoch: 20, train_loss: 1.0221, test_loss: 1.0050, test_f1: 0.4655
 epoch: 21, train_loss: 1.0218, test_loss: 0.9959, test_f1: 0.4707
 epoch: 22, train_loss: 1.0168, test_loss: 0.9863, test_f1: 0.4681
 epoch: 23, train_loss: 1.0125, test_loss: 0.9938, test_f1: 0.4628
 epoch: 24, train_loss: 1.0108, test_loss: 1.0064, test_f1: 0.4610
 epoch: 25, train_loss: 0.9935, test_loss: 0.9764, test_f1: 0.4781
 epoch: 26, train_loss: 0.9887, test_loss: 0.9798, test_f1: 0.4717
 epoch: 27, train_loss: 0.9842, test_loss: 0.9749, test_f1: 0.4710
 epoch: 28, train_loss: 0.9824, test_loss: 0.9575, test_f1: 0.4734
 epoch: 29, train_loss: 0.9819, test_loss: 0.9776, test_f1: 0.4721
 epoch: 30, train_loss: 0.9775, test_loss: 0.9738, test_f1: 0.4727
 epoch: 31, train_loss: 0.9707, test_loss: 0.9588, test_f1: 0.4712
 epoch: 32, train_loss: 0.9672, test_loss: 0.9684, test_f1: 0.4825
 epoch: 33, train_loss: 0.9651, test_loss: 0.9952, test_f1: 0.4698
 epoch: 34, train_loss: 0.9507, test_loss: 0.9655, test_f1: 0.4710
 epoch: 35, train_loss: 0.9509, test_loss: 0.9746, test_f1: 0.4724
 epoch: 36, train_loss: 0.9584, test_loss: 0.9447, test_f1: 0.4906
 epoch: 37, train_loss: 0.9423, test_loss: 0.9419, test_f1: 0.4810
 epoch: 38, train_loss: 0.9466, test_loss: 0.9464, test_f1: 0.4892
 epoch: 39, train_loss: 0.9349, test_loss: 0.9526, test_f1: 0.4821
 epoch: 40, train_loss: 0.9394, test_loss: 0.9730, test_f1: 0.4872
 epoch: 41, train_loss: 0.9299, test_loss: 0.9562, test_f1: 0.4853
 epoch: 42, train_loss: 0.9280, test_loss: 0.9493, test_f1: 0.4979
 epoch: 43, train_loss: 0.9198, test_loss: 0.9630, test_f1: 0.4906
 epoch: 44, train_loss: 0.9149, test_loss: 0.9362, test_f1: 0.4943
 epoch: 45, train_loss: 0.9164, test_loss: 0.9960, test_f1: 0.4831
 epoch: 46, train_loss: 0.9184, test_loss: 0.9572, test_f1: 0.4879
 epoch: 47, train_loss: 0.9112, test_loss: 0.9334, test_f1: 0.5028
 epoch: 48, train_loss: 0.9081, test_loss: 0.9481, test_f1: 0.4964
 epoch: 49, train_loss: 0.9075, test_loss: 0.9441, test_f1: 0.4951
 epoch: 50, train_loss: 0.9065, test_loss: 0.9577, test_f1: 0.4897
 epoch: 51, train_loss: 0.8986, test_loss: 0.9738, test_f1: 0.4881
 epoch: 52, train_loss: 0.8902, test_loss: 0.9553, test_f1: 0.4994
 epoch: 53, train_loss: 0.8865, test_loss: 0.9804, test_f1: 0.4909
 epoch: 54, train_loss: 0.8878, test_loss: 0.9659, test_f1: 0.4851
 epoch: 55, train_loss: 0.8853, test_loss: 0.9634, test_f1: 0.4850
 epoch: 56, train_loss: 0.8797, test_loss: 0.9876, test_f1: 0.4808
 epoch: 57, train_loss: 0.8904, test_loss: 0.9636, test_f1: 0.4956
 epoch: 58, train_loss: 0.8782, test_loss: 0.9578, test_f1: 0.4903
 epoch: 59, train_loss: 0.8820, test_loss: 0.9844, test_f1: 0.4814
 epoch: 60, train_loss: 0.8738, test_loss: 0.9745, test_f1: 0.4773
 epoch: 61, train_loss: 0.8849, test_loss: 0.9787, test_f1: 0.4806
 epoch: 62, train_loss: 0.8717, test_loss: 0.9602, test_f1: 0.5078
 epoch: 63, train_loss: 0.8765, test_loss: 0.9896, test_f1: 0.4894
 epoch: 64, train_loss: 0.8688, test_loss: 0.9484, test_f1: 0.4967
 epoch: 65, train_loss: 0.8712, test_loss: 0.9710, test_f1: 0.5031
 epoch: 66, train_loss: 0.8699, test_loss: 0.9715, test_f1: 0.4930
 epoch: 67, train_loss: 0.8783, test_loss: 0.9652, test_f1: 0.4927
 epoch: 68, train_loss: 0.8663, test_loss: 0.9775, test_f1: 0.5003
 epoch: 69, train_loss: 0.8632, test_loss: 0.9757, test_f1: 0.5075
 epoch: 70, train_loss: 0.8741, test_loss: 0.9807, test_f1: 0.4947
 epoch: 71, train_loss: 0.8726, test_loss: 0.9601, test_f1: 0.5009
 epoch: 72, train_loss: 0.8686, test_loss: 0.9713, test_f1: 0.5040
 epoch: 73, train_loss: 0.8653, test_loss: 0.9726, test_f1: 0.4978
 epoch: 74, train_loss: 0.8648, test_loss: 0.9723, test_f1: 0.5057
 epoch: 75, train_loss: 0.8585, test_loss: 0.9584, test_f1: 0.5034
 epoch: 76, train_loss: 0.8504, test_loss: 0.9606, test_f1: 0.5010
 epoch: 77, train_loss: 0.8542, test_loss: 0.9838, test_f1: 0.5086
 epoch: 78, train_loss: 0.8535, test_loss: 0.9661, test_f1: 0.5181
 epoch: 79, train_loss: 0.8593, test_loss: 0.9903, test_f1: 0.5106
 epoch: 80, train_loss: 0.8478, test_loss: 0.9781, test_f1: 0.5109
 epoch: 81, train_loss: 0.8550, test_loss: 0.9704, test_f1: 0.5207
 epoch: 82, train_loss: 0.8507, test_loss: 0.9624, test_f1: 0.5058
 epoch: 83, train_loss: 0.8511, test_loss: 0.9724, test_f1: 0.4997
 epoch: 84, train_loss: 0.8460, test_loss: 0.9625, test_f1: 0.5158
 epoch: 85, train_loss: 0.8520, test_loss: 0.9884, test_f1: 0.5058
 epoch: 86, train_loss: 0.8490, test_loss: 0.9618, test_f1: 0.5117
 epoch: 87, train_loss: 0.8512, test_loss: 0.9783, test_f1: 0.5153
 epoch: 88, train_loss: 0.8399, test_loss: 0.9887, test_f1: 0.5023
 epoch: 89, train_loss: 0.8410, test_loss: 0.9914, test_f1: 0.5054
 epoch: 90, train_loss: 0.8457, test_loss: 0.9955, test_f1: 0.4996
 epoch: 91, train_loss: 0.8417, test_loss: 1.0006, test_f1: 0.5154
 epoch: 92, train_loss: 0.8443, test_loss: 0.9854, test_f1: 0.5149
 epoch: 93, train_loss: 0.8345, test_loss: 0.9870, test_f1: 0.5003
 epoch: 94, train_loss: 0.8388, test_loss: 1.0084, test_f1: 0.5092
 epoch: 95, train_loss: 0.8484, test_loss: 0.9612, test_f1: 0.5076
 epoch: 96, train_loss: 0.8384, test_loss: 0.9825, test_f1: 0.5185
 epoch: 97, train_loss: 0.8338, test_loss: 0.9799, test_f1: 0.5000
 epoch: 98, train_loss: 0.8419, test_loss: 0.9813, test_f1: 0.5016
 epoch: 99, train_loss: 0.8300, test_loss: 1.0207, test_f1: 0.4930
##################ITERATION #6 ****************************************
 epoch: 0, train_loss: 1.3361, test_loss: 1.2461, test_f1: 0.3136
 epoch: 1, train_loss: 1.2565, test_loss: 1.2093, test_f1: 0.4181
 epoch: 2, train_loss: 1.2314, test_loss: 1.1950, test_f1: 0.4096
 epoch: 3, train_loss: 1.2133, test_loss: 1.1740, test_f1: 0.4161
 epoch: 4, train_loss: 1.1957, test_loss: 1.1582, test_f1: 0.4375
 epoch: 5, train_loss: 1.1896, test_loss: 1.1440, test_f1: 0.4412
 epoch: 6, train_loss: 1.1684, test_loss: 1.1349, test_f1: 0.4533
 epoch: 7, train_loss: 1.1601, test_loss: 1.1195, test_f1: 0.4601
 epoch: 8, train_loss: 1.1501, test_loss: 1.1064, test_f1: 0.4660
 epoch: 9, train_loss: 1.1384, test_loss: 1.1087, test_f1: 0.4517
 epoch: 10, train_loss: 1.1300, test_loss: 1.0858, test_f1: 0.4691
 epoch: 11, train_loss: 1.1183, test_loss: 1.0841, test_f1: 0.4608
 epoch: 12, train_loss: 1.1163, test_loss: 1.0789, test_f1: 0.4509
 epoch: 13, train_loss: 1.1056, test_loss: 1.0697, test_f1: 0.4567
 epoch: 14, train_loss: 1.1040, test_loss: 1.0605, test_f1: 0.4646
 epoch: 15, train_loss: 1.0929, test_loss: 1.0450, test_f1: 0.4671
 epoch: 16, train_loss: 1.0882, test_loss: 1.0411, test_f1: 0.4631
 epoch: 17, train_loss: 1.0689, test_loss: 1.0336, test_f1: 0.4696
 epoch: 18, train_loss: 1.0665, test_loss: 1.0234, test_f1: 0.4792
 epoch: 19, train_loss: 1.0558, test_loss: 1.0232, test_f1: 0.4771
 epoch: 20, train_loss: 1.0474, test_loss: 1.0166, test_f1: 0.4763
 epoch: 21, train_loss: 1.0509, test_loss: 1.0159, test_f1: 0.4773
 epoch: 22, train_loss: 1.0376, test_loss: 1.0086, test_f1: 0.4694
 epoch: 23, train_loss: 1.0366, test_loss: 1.0063, test_f1: 0.4860
 epoch: 24, train_loss: 1.0398, test_loss: 0.9950, test_f1: 0.4883
 epoch: 25, train_loss: 1.0276, test_loss: 1.0117, test_f1: 0.4696
 epoch: 26, train_loss: 1.0189, test_loss: 0.9913, test_f1: 0.4850
 epoch: 27, train_loss: 1.0259, test_loss: 0.9927, test_f1: 0.4790
 epoch: 28, train_loss: 1.0217, test_loss: 0.9846, test_f1: 0.4838
 epoch: 29, train_loss: 1.0091, test_loss: 0.9880, test_f1: 0.4789
 epoch: 30, train_loss: 1.0108, test_loss: 0.9852, test_f1: 0.4767
 epoch: 31, train_loss: 0.9973, test_loss: 0.9831, test_f1: 0.4815
 epoch: 32, train_loss: 0.9959, test_loss: 0.9883, test_f1: 0.4738
 epoch: 33, train_loss: 0.9946, test_loss: 0.9787, test_f1: 0.4813
 epoch: 34, train_loss: 0.9936, test_loss: 0.9723, test_f1: 0.4772
 epoch: 35, train_loss: 0.9857, test_loss: 0.9818, test_f1: 0.4805
 epoch: 36, train_loss: 0.9816, test_loss: 0.9683, test_f1: 0.4838
 epoch: 37, train_loss: 0.9753, test_loss: 0.9584, test_f1: 0.4910
 epoch: 38, train_loss: 0.9731, test_loss: 0.9699, test_f1: 0.4814
 epoch: 39, train_loss: 0.9678, test_loss: 0.9484, test_f1: 0.4885
 epoch: 40, train_loss: 0.9589, test_loss: 0.9653, test_f1: 0.4921
 epoch: 41, train_loss: 0.9606, test_loss: 0.9600, test_f1: 0.4822
 epoch: 42, train_loss: 0.9619, test_loss: 0.9519, test_f1: 0.4874
 epoch: 43, train_loss: 0.9511, test_loss: 0.9515, test_f1: 0.5001
 epoch: 44, train_loss: 0.9545, test_loss: 0.9608, test_f1: 0.4894
 epoch: 45, train_loss: 0.9358, test_loss: 0.9536, test_f1: 0.4944
 epoch: 46, train_loss: 0.9388, test_loss: 0.9503, test_f1: 0.4930
 epoch: 47, train_loss: 0.9380, test_loss: 0.9512, test_f1: 0.4925
 epoch: 48, train_loss: 0.9290, test_loss: 0.9413, test_f1: 0.4880
 epoch: 49, train_loss: 0.9304, test_loss: 0.9600, test_f1: 0.4722
 epoch: 50, train_loss: 0.9376, test_loss: 0.9483, test_f1: 0.4869
 epoch: 51, train_loss: 0.9228, test_loss: 0.9515, test_f1: 0.4951
 epoch: 52, train_loss: 0.9054, test_loss: 0.9486, test_f1: 0.4981
 epoch: 53, train_loss: 0.9169, test_loss: 0.9452, test_f1: 0.4969
 epoch: 54, train_loss: 0.9145, test_loss: 0.9592, test_f1: 0.4905
 epoch: 55, train_loss: 0.9192, test_loss: 0.9497, test_f1: 0.4945
 epoch: 56, train_loss: 0.9212, test_loss: 0.9630, test_f1: 0.4861
 epoch: 57, train_loss: 0.9080, test_loss: 0.9590, test_f1: 0.4900
 epoch: 58, train_loss: 0.9089, test_loss: 0.9424, test_f1: 0.4966
 epoch: 59, train_loss: 0.8922, test_loss: 0.9488, test_f1: 0.4931
 epoch: 60, train_loss: 0.9085, test_loss: 0.9502, test_f1: 0.4925
 epoch: 61, train_loss: 0.9058, test_loss: 0.9469, test_f1: 0.4920
 epoch: 62, train_loss: 0.9030, test_loss: 0.9500, test_f1: 0.4974
 epoch: 63, train_loss: 0.8951, test_loss: 0.9537, test_f1: 0.4868
 epoch: 64, train_loss: 0.8959, test_loss: 0.9420, test_f1: 0.4927
 epoch: 65, train_loss: 0.8999, test_loss: 0.9478, test_f1: 0.5019
 epoch: 66, train_loss: 0.9026, test_loss: 0.9430, test_f1: 0.4946
 epoch: 67, train_loss: 0.9123, test_loss: 0.9617, test_f1: 0.4917
 epoch: 68, train_loss: 0.9018, test_loss: 0.9428, test_f1: 0.4997
 epoch: 69, train_loss: 0.8978, test_loss: 0.9566, test_f1: 0.4876
 epoch: 70, train_loss: 0.8832, test_loss: 0.9490, test_f1: 0.4865
 epoch: 71, train_loss: 0.8966, test_loss: 0.9429, test_f1: 0.5003
 epoch: 72, train_loss: 0.8870, test_loss: 0.9545, test_f1: 0.4963
 epoch: 73, train_loss: 0.8905, test_loss: 0.9593, test_f1: 0.4889
 epoch: 74, train_loss: 0.8834, test_loss: 0.9598, test_f1: 0.5021
 epoch: 75, train_loss: 0.8895, test_loss: 0.9445, test_f1: 0.5046
 epoch: 76, train_loss: 0.8767, test_loss: 0.9601, test_f1: 0.4960
 epoch: 77, train_loss: 0.8768, test_loss: 0.9556, test_f1: 0.5026
 epoch: 78, train_loss: 0.8879, test_loss: 0.9535, test_f1: 0.5039
 epoch: 79, train_loss: 0.8802, test_loss: 0.9497, test_f1: 0.5037
 epoch: 80, train_loss: 0.8665, test_loss: 0.9497, test_f1: 0.5026
 epoch: 81, train_loss: 0.8801, test_loss: 0.9671, test_f1: 0.4935
 epoch: 82, train_loss: 0.8759, test_loss: 0.9548, test_f1: 0.5086
 epoch: 83, train_loss: 0.8725, test_loss: 0.9571, test_f1: 0.5039
 epoch: 84, train_loss: 0.8766, test_loss: 0.9704, test_f1: 0.4982
 epoch: 85, train_loss: 0.8729, test_loss: 0.9562, test_f1: 0.4929
 epoch: 86, train_loss: 0.8724, test_loss: 0.9542, test_f1: 0.5027
 epoch: 87, train_loss: 0.8700, test_loss: 0.9576, test_f1: 0.4989
 epoch: 88, train_loss: 0.8765, test_loss: 0.9510, test_f1: 0.5122
 epoch: 89, train_loss: 0.8762, test_loss: 0.9614, test_f1: 0.5012
 epoch: 90, train_loss: 0.8713, test_loss: 0.9716, test_f1: 0.5141
 epoch: 91, train_loss: 0.8723, test_loss: 0.9638, test_f1: 0.5027
 epoch: 92, train_loss: 0.8655, test_loss: 0.9700, test_f1: 0.5007
 epoch: 93, train_loss: 0.8600, test_loss: 0.9553, test_f1: 0.5082
 epoch: 94, train_loss: 0.8764, test_loss: 0.9547, test_f1: 0.5083
 epoch: 95, train_loss: 0.8486, test_loss: 0.9601, test_f1: 0.5005
 epoch: 96, train_loss: 0.8709, test_loss: 0.9580, test_f1: 0.5184
 epoch: 97, train_loss: 0.8707, test_loss: 0.9595, test_f1: 0.5003
 epoch: 98, train_loss: 0.8622, test_loss: 0.9645, test_f1: 0.4837
 epoch: 99, train_loss: 0.8519, test_loss: 0.9603, test_f1: 0.5041
##################ITERATION #7 ****************************************
 epoch: 0, train_loss: 1.3316, test_loss: 1.2400, test_f1: 0.2922
 epoch: 1, train_loss: 1.2600, test_loss: 1.1660, test_f1: 0.4297
 epoch: 2, train_loss: 1.2222, test_loss: 1.1477, test_f1: 0.4455
 epoch: 3, train_loss: 1.1997, test_loss: 1.1312, test_f1: 0.4380
 epoch: 4, train_loss: 1.1943, test_loss: 1.1159, test_f1: 0.4479
 epoch: 5, train_loss: 1.1769, test_loss: 1.0988, test_f1: 0.4561
 epoch: 6, train_loss: 1.1654, test_loss: 1.0916, test_f1: 0.4667
 epoch: 7, train_loss: 1.1391, test_loss: 1.0740, test_f1: 0.4846
 epoch: 8, train_loss: 1.1260, test_loss: 1.0657, test_f1: 0.4827
 epoch: 9, train_loss: 1.1244, test_loss: 1.0572, test_f1: 0.4798
 epoch: 10, train_loss: 1.1108, test_loss: 1.0466, test_f1: 0.4574
 epoch: 11, train_loss: 1.0906, test_loss: 1.0412, test_f1: 0.4774
 epoch: 12, train_loss: 1.0918, test_loss: 1.0285, test_f1: 0.4940
 epoch: 13, train_loss: 1.0897, test_loss: 1.0244, test_f1: 0.4971
 epoch: 14, train_loss: 1.0762, test_loss: 1.0121, test_f1: 0.4882
 epoch: 15, train_loss: 1.0710, test_loss: 1.0071, test_f1: 0.4884
 epoch: 16, train_loss: 1.0565, test_loss: 1.0047, test_f1: 0.4876
 epoch: 17, train_loss: 1.0582, test_loss: 0.9967, test_f1: 0.4771
 epoch: 18, train_loss: 1.0434, test_loss: 0.9913, test_f1: 0.4749
 epoch: 19, train_loss: 1.0518, test_loss: 0.9897, test_f1: 0.4835
 epoch: 20, train_loss: 1.0527, test_loss: 0.9784, test_f1: 0.4821
 epoch: 21, train_loss: 1.0292, test_loss: 0.9780, test_f1: 0.4952
 epoch: 22, train_loss: 1.0320, test_loss: 0.9734, test_f1: 0.4796
 epoch: 23, train_loss: 1.0305, test_loss: 0.9692, test_f1: 0.4835
 epoch: 24, train_loss: 1.0158, test_loss: 0.9678, test_f1: 0.4935
 epoch: 25, train_loss: 1.0130, test_loss: 0.9597, test_f1: 0.5044
 epoch: 26, train_loss: 1.0062, test_loss: 0.9567, test_f1: 0.4847
 epoch: 27, train_loss: 1.0039, test_loss: 0.9540, test_f1: 0.4820
 epoch: 28, train_loss: 1.0030, test_loss: 0.9562, test_f1: 0.4864
 epoch: 29, train_loss: 0.9943, test_loss: 0.9534, test_f1: 0.4622
 epoch: 30, train_loss: 0.9909, test_loss: 0.9449, test_f1: 0.4875
 epoch: 31, train_loss: 0.9860, test_loss: 0.9455, test_f1: 0.4869
 epoch: 32, train_loss: 0.9925, test_loss: 0.9485, test_f1: 0.4775
 epoch: 33, train_loss: 0.9873, test_loss: 0.9439, test_f1: 0.4671
 epoch: 34, train_loss: 0.9833, test_loss: 0.9421, test_f1: 0.4759
 epoch: 35, train_loss: 0.9932, test_loss: 0.9395, test_f1: 0.4791
 epoch: 36, train_loss: 0.9742, test_loss: 0.9326, test_f1: 0.4792
 epoch: 37, train_loss: 0.9808, test_loss: 0.9485, test_f1: 0.4780
 epoch: 38, train_loss: 0.9682, test_loss: 0.9284, test_f1: 0.4754
 epoch: 39, train_loss: 0.9641, test_loss: 0.9288, test_f1: 0.4768
 epoch: 40, train_loss: 0.9637, test_loss: 0.9331, test_f1: 0.4938
 epoch: 41, train_loss: 0.9675, test_loss: 0.9353, test_f1: 0.4846
 epoch: 42, train_loss: 0.9560, test_loss: 0.9264, test_f1: 0.4785
 epoch: 43, train_loss: 0.9476, test_loss: 0.9331, test_f1: 0.4846
 epoch: 44, train_loss: 0.9511, test_loss: 0.9263, test_f1: 0.5033
 epoch: 45, train_loss: 0.9433, test_loss: 0.9272, test_f1: 0.4920
 epoch: 46, train_loss: 0.9437, test_loss: 0.9273, test_f1: 0.5002
 epoch: 47, train_loss: 0.9377, test_loss: 0.9315, test_f1: 0.4928
 epoch: 48, train_loss: 0.9253, test_loss: 0.9226, test_f1: 0.4948
 epoch: 49, train_loss: 0.9341, test_loss: 0.9257, test_f1: 0.4898
 epoch: 50, train_loss: 0.9289, test_loss: 0.9271, test_f1: 0.4792
 epoch: 51, train_loss: 0.9291, test_loss: 0.9236, test_f1: 0.4896
 epoch: 52, train_loss: 0.9299, test_loss: 0.9248, test_f1: 0.4844
 epoch: 53, train_loss: 0.9173, test_loss: 0.9211, test_f1: 0.4893
 epoch: 54, train_loss: 0.9279, test_loss: 0.9236, test_f1: 0.5002
 epoch: 55, train_loss: 0.9143, test_loss: 0.9203, test_f1: 0.4866
 epoch: 56, train_loss: 0.9159, test_loss: 0.9156, test_f1: 0.4874
 epoch: 57, train_loss: 0.9109, test_loss: 0.9261, test_f1: 0.4898
 epoch: 58, train_loss: 0.9137, test_loss: 0.9201, test_f1: 0.5035
 epoch: 59, train_loss: 0.9108, test_loss: 0.9302, test_f1: 0.4866
 epoch: 60, train_loss: 0.9173, test_loss: 0.9252, test_f1: 0.4958
 epoch: 61, train_loss: 0.9158, test_loss: 0.9247, test_f1: 0.5001
 epoch: 62, train_loss: 0.8997, test_loss: 0.9246, test_f1: 0.5012
 epoch: 63, train_loss: 0.9091, test_loss: 0.9256, test_f1: 0.5026
 epoch: 64, train_loss: 0.9106, test_loss: 0.9160, test_f1: 0.4921
 epoch: 65, train_loss: 0.9004, test_loss: 0.9190, test_f1: 0.4985
 epoch: 66, train_loss: 0.9044, test_loss: 0.9227, test_f1: 0.4994
 epoch: 67, train_loss: 0.8921, test_loss: 0.9235, test_f1: 0.4963
 epoch: 68, train_loss: 0.9050, test_loss: 0.9291, test_f1: 0.5024
 epoch: 69, train_loss: 0.8978, test_loss: 0.9155, test_f1: 0.4946
 epoch: 70, train_loss: 0.8940, test_loss: 0.9104, test_f1: 0.5040
 epoch: 71, train_loss: 0.9013, test_loss: 0.9197, test_f1: 0.4972
 epoch: 72, train_loss: 0.8986, test_loss: 0.9170, test_f1: 0.5020
 epoch: 73, train_loss: 0.9026, test_loss: 0.9257, test_f1: 0.5001
 epoch: 74, train_loss: 0.8906, test_loss: 0.9242, test_f1: 0.5025
 epoch: 75, train_loss: 0.8846, test_loss: 0.9220, test_f1: 0.4957
 epoch: 76, train_loss: 0.8934, test_loss: 0.9255, test_f1: 0.4963
 epoch: 77, train_loss: 0.9029, test_loss: 0.9261, test_f1: 0.5014
 epoch: 78, train_loss: 0.8826, test_loss: 0.9195, test_f1: 0.5009
 epoch: 79, train_loss: 0.8857, test_loss: 0.9134, test_f1: 0.5044
 epoch: 80, train_loss: 0.8834, test_loss: 0.9190, test_f1: 0.5001
 epoch: 81, train_loss: 0.8887, test_loss: 0.9219, test_f1: 0.4999
 epoch: 82, train_loss: 0.8805, test_loss: 0.9237, test_f1: 0.5026
 epoch: 83, train_loss: 0.8778, test_loss: 0.9258, test_f1: 0.5045
 epoch: 84, train_loss: 0.8751, test_loss: 0.9237, test_f1: 0.5094
 epoch: 85, train_loss: 0.8833, test_loss: 0.9219, test_f1: 0.5006
 epoch: 86, train_loss: 0.8749, test_loss: 0.9242, test_f1: 0.5014
 epoch: 87, train_loss: 0.8778, test_loss: 0.9260, test_f1: 0.5069
 epoch: 88, train_loss: 0.8695, test_loss: 0.9138, test_f1: 0.5272
 epoch: 89, train_loss: 0.8768, test_loss: 0.9253, test_f1: 0.4983
 epoch: 90, train_loss: 0.8663, test_loss: 0.9207, test_f1: 0.4966
 epoch: 91, train_loss: 0.8722, test_loss: 0.9266, test_f1: 0.5284
 epoch: 92, train_loss: 0.8690, test_loss: 0.9191, test_f1: 0.5253
 epoch: 93, train_loss: 0.8689, test_loss: 0.9193, test_f1: 0.5237
 epoch: 94, train_loss: 0.8741, test_loss: 0.9219, test_f1: 0.5249
 epoch: 95, train_loss: 0.8665, test_loss: 0.9265, test_f1: 0.5358
 epoch: 96, train_loss: 0.8671, test_loss: 0.9303, test_f1: 0.5326
 epoch: 97, train_loss: 0.8569, test_loss: 0.9321, test_f1: 0.5352
 epoch: 98, train_loss: 0.8667, test_loss: 0.9192, test_f1: 0.5321
 epoch: 99, train_loss: 0.8732, test_loss: 0.9213, test_f1: 0.5278
##################ITERATION #8 ****************************************
 epoch: 0, train_loss: 1.3539, test_loss: 1.2182, test_f1: 0.2539
 epoch: 1, train_loss: 1.2635, test_loss: 1.1548, test_f1: 0.3890
 epoch: 2, train_loss: 1.2494, test_loss: 1.1413, test_f1: 0.3916
 epoch: 3, train_loss: 1.2211, test_loss: 1.1301, test_f1: 0.4269
 epoch: 4, train_loss: 1.2011, test_loss: 1.1108, test_f1: 0.4567
 epoch: 5, train_loss: 1.1988, test_loss: 1.1118, test_f1: 0.4422
 epoch: 6, train_loss: 1.1742, test_loss: 1.1066, test_f1: 0.4506
 epoch: 7, train_loss: 1.1694, test_loss: 1.1030, test_f1: 0.4329
 epoch: 8, train_loss: 1.1632, test_loss: 1.0884, test_f1: 0.4694
 epoch: 9, train_loss: 1.1397, test_loss: 1.0964, test_f1: 0.4538
 epoch: 10, train_loss: 1.1349, test_loss: 1.0840, test_f1: 0.4628
 epoch: 11, train_loss: 1.1317, test_loss: 1.0767, test_f1: 0.4744
 epoch: 12, train_loss: 1.1151, test_loss: 1.0832, test_f1: 0.4452
 epoch: 13, train_loss: 1.1145, test_loss: 1.0683, test_f1: 0.4537
 epoch: 14, train_loss: 1.1062, test_loss: 1.0680, test_f1: 0.4401
 epoch: 15, train_loss: 1.1018, test_loss: 1.0595, test_f1: 0.4587
 epoch: 16, train_loss: 1.0960, test_loss: 1.0508, test_f1: 0.4746
 epoch: 17, train_loss: 1.0848, test_loss: 1.0532, test_f1: 0.4649
 epoch: 18, train_loss: 1.0855, test_loss: 1.0500, test_f1: 0.4385
 epoch: 19, train_loss: 1.0848, test_loss: 1.0457, test_f1: 0.4475
 epoch: 20, train_loss: 1.0755, test_loss: 1.0366, test_f1: 0.4524
 epoch: 21, train_loss: 1.0714, test_loss: 1.0274, test_f1: 0.4568
 epoch: 22, train_loss: 1.0695, test_loss: 1.0248, test_f1: 0.4568
 epoch: 23, train_loss: 1.0674, test_loss: 1.0273, test_f1: 0.4369
 epoch: 24, train_loss: 1.0557, test_loss: 1.0169, test_f1: 0.4562
 epoch: 25, train_loss: 1.0407, test_loss: 1.0217, test_f1: 0.4382
 epoch: 26, train_loss: 1.0428, test_loss: 1.0214, test_f1: 0.4462
 epoch: 27, train_loss: 1.0512, test_loss: 1.0185, test_f1: 0.4462
 epoch: 28, train_loss: 1.0338, test_loss: 1.0219, test_f1: 0.4473
 epoch: 29, train_loss: 1.0258, test_loss: 1.0185, test_f1: 0.4491
 epoch: 30, train_loss: 1.0323, test_loss: 1.0061, test_f1: 0.4535
 epoch: 31, train_loss: 1.0212, test_loss: 1.0192, test_f1: 0.4387
 epoch: 32, train_loss: 1.0181, test_loss: 1.0104, test_f1: 0.4534
 epoch: 33, train_loss: 1.0131, test_loss: 1.0061, test_f1: 0.4624
 epoch: 34, train_loss: 1.0077, test_loss: 0.9986, test_f1: 0.4677
 epoch: 35, train_loss: 1.0068, test_loss: 1.0107, test_f1: 0.4622
 epoch: 36, train_loss: 1.0029, test_loss: 0.9922, test_f1: 0.4711
 epoch: 37, train_loss: 1.0073, test_loss: 0.9940, test_f1: 0.4587
 epoch: 38, train_loss: 1.0029, test_loss: 0.9974, test_f1: 0.4608
 epoch: 39, train_loss: 0.9963, test_loss: 1.0029, test_f1: 0.4636
 epoch: 40, train_loss: 0.9846, test_loss: 0.9961, test_f1: 0.4733
 epoch: 41, train_loss: 0.9866, test_loss: 0.9889, test_f1: 0.4737
 epoch: 42, train_loss: 0.9834, test_loss: 0.9889, test_f1: 0.4709
 epoch: 43, train_loss: 0.9804, test_loss: 0.9926, test_f1: 0.4731
 epoch: 44, train_loss: 0.9765, test_loss: 0.9884, test_f1: 0.4781
 epoch: 45, train_loss: 0.9744, test_loss: 0.9906, test_f1: 0.4740
 epoch: 46, train_loss: 0.9692, test_loss: 0.9978, test_f1: 0.4693
 epoch: 47, train_loss: 0.9620, test_loss: 1.0076, test_f1: 0.4689
 epoch: 48, train_loss: 0.9670, test_loss: 0.9867, test_f1: 0.4789
 epoch: 49, train_loss: 0.9629, test_loss: 0.9967, test_f1: 0.4838
 epoch: 50, train_loss: 0.9395, test_loss: 0.9970, test_f1: 0.4757
 epoch: 51, train_loss: 0.9505, test_loss: 1.0036, test_f1: 0.4681
 epoch: 52, train_loss: 0.9491, test_loss: 0.9925, test_f1: 0.4872
 epoch: 53, train_loss: 0.9557, test_loss: 0.9892, test_f1: 0.4965
 epoch: 54, train_loss: 0.9509, test_loss: 0.9853, test_f1: 0.4940
 epoch: 55, train_loss: 0.9390, test_loss: 0.9993, test_f1: 0.4817
 epoch: 56, train_loss: 0.9435, test_loss: 0.9961, test_f1: 0.4829
 epoch: 57, train_loss: 0.9278, test_loss: 1.0009, test_f1: 0.4848
 epoch: 58, train_loss: 0.9317, test_loss: 1.0010, test_f1: 0.4944
 epoch: 59, train_loss: 0.9371, test_loss: 1.0052, test_f1: 0.4960
 epoch: 60, train_loss: 0.9284, test_loss: 1.0081, test_f1: 0.4855
 epoch: 61, train_loss: 0.9219, test_loss: 0.9996, test_f1: 0.4865
 epoch: 62, train_loss: 0.9355, test_loss: 0.9958, test_f1: 0.4912
 epoch: 63, train_loss: 0.9252, test_loss: 1.0046, test_f1: 0.4964
 epoch: 64, train_loss: 0.9362, test_loss: 1.0106, test_f1: 0.4891
 epoch: 65, train_loss: 0.9292, test_loss: 1.0005, test_f1: 0.5049
 epoch: 66, train_loss: 0.9138, test_loss: 1.0046, test_f1: 0.4941
 epoch: 67, train_loss: 0.9173, test_loss: 1.0099, test_f1: 0.4863
 epoch: 68, train_loss: 0.9347, test_loss: 1.0094, test_f1: 0.4967
 epoch: 69, train_loss: 0.9171, test_loss: 1.0092, test_f1: 0.5037
 epoch: 70, train_loss: 0.9127, test_loss: 1.0086, test_f1: 0.5012
 epoch: 71, train_loss: 0.9137, test_loss: 1.0166, test_f1: 0.4993
 epoch: 72, train_loss: 0.9196, test_loss: 1.0077, test_f1: 0.4945
 epoch: 73, train_loss: 0.9187, test_loss: 0.9991, test_f1: 0.5051
 epoch: 74, train_loss: 0.9121, test_loss: 0.9974, test_f1: 0.5048
 epoch: 75, train_loss: 0.9043, test_loss: 1.0034, test_f1: 0.5033
 epoch: 76, train_loss: 0.9236, test_loss: 1.0122, test_f1: 0.5167
 epoch: 77, train_loss: 0.9170, test_loss: 1.0025, test_f1: 0.5220
 epoch: 78, train_loss: 0.8994, test_loss: 1.0082, test_f1: 0.5087
 epoch: 79, train_loss: 0.9143, test_loss: 1.0190, test_f1: 0.4978
 epoch: 80, train_loss: 0.9064, test_loss: 1.0039, test_f1: 0.5129
 epoch: 81, train_loss: 0.9078, test_loss: 1.0086, test_f1: 0.5256
 epoch: 82, train_loss: 0.9080, test_loss: 1.0081, test_f1: 0.5060
 epoch: 83, train_loss: 0.9033, test_loss: 1.0183, test_f1: 0.5031
 epoch: 84, train_loss: 0.8926, test_loss: 1.0082, test_f1: 0.5120
 epoch: 85, train_loss: 0.9040, test_loss: 1.0182, test_f1: 0.5147
 epoch: 86, train_loss: 0.9065, test_loss: 1.0101, test_f1: 0.5087
 epoch: 87, train_loss: 0.8971, test_loss: 1.0140, test_f1: 0.5092
 epoch: 88, train_loss: 0.8928, test_loss: 1.0168, test_f1: 0.5046
 epoch: 89, train_loss: 0.8911, test_loss: 1.0103, test_f1: 0.5062
 epoch: 90, train_loss: 0.8953, test_loss: 1.0027, test_f1: 0.5141
 epoch: 91, train_loss: 0.8930, test_loss: 1.0057, test_f1: 0.5042
 epoch: 92, train_loss: 0.8968, test_loss: 1.0067, test_f1: 0.5101
 epoch: 93, train_loss: 0.8795, test_loss: 1.0242, test_f1: 0.5076
 epoch: 94, train_loss: 0.8869, test_loss: 1.0280, test_f1: 0.5043
 epoch: 95, train_loss: 0.8782, test_loss: 1.0320, test_f1: 0.5032
 epoch: 96, train_loss: 0.8895, test_loss: 1.0252, test_f1: 0.4990
 epoch: 97, train_loss: 0.8892, test_loss: 1.0237, test_f1: 0.4942
 epoch: 98, train_loss: 0.8861, test_loss: 1.0326, test_f1: 0.4985
 epoch: 99, train_loss: 0.8703, test_loss: 1.0251, test_f1: 0.5191
##################ITERATION #9 ****************************************
 epoch: 0, train_loss: 1.3752, test_loss: 1.2325, test_f1: 0.3550
 epoch: 1, train_loss: 1.2864, test_loss: 1.1933, test_f1: 0.3812
 epoch: 2, train_loss: 1.2486, test_loss: 1.1727, test_f1: 0.4082
 epoch: 3, train_loss: 1.2330, test_loss: 1.1653, test_f1: 0.4303
 epoch: 4, train_loss: 1.2150, test_loss: 1.1453, test_f1: 0.4399
 epoch: 5, train_loss: 1.2010, test_loss: 1.1278, test_f1: 0.4340
 epoch: 6, train_loss: 1.1766, test_loss: 1.1121, test_f1: 0.4351
 epoch: 7, train_loss: 1.1688, test_loss: 1.1133, test_f1: 0.4319
 epoch: 8, train_loss: 1.1493, test_loss: 1.0910, test_f1: 0.4388
 epoch: 9, train_loss: 1.1458, test_loss: 1.0818, test_f1: 0.4400
 epoch: 10, train_loss: 1.1341, test_loss: 1.0782, test_f1: 0.4531
 epoch: 11, train_loss: 1.1277, test_loss: 1.0672, test_f1: 0.4460
 epoch: 12, train_loss: 1.1176, test_loss: 1.0601, test_f1: 0.4492
 epoch: 13, train_loss: 1.1118, test_loss: 1.0512, test_f1: 0.4520
 epoch: 14, train_loss: 1.1001, test_loss: 1.0558, test_f1: 0.4493
 epoch: 15, train_loss: 1.1053, test_loss: 1.0754, test_f1: 0.4124
 epoch: 16, train_loss: 1.0942, test_loss: 1.0686, test_f1: 0.4181
 epoch: 17, train_loss: 1.0855, test_loss: 1.0331, test_f1: 0.4628
 epoch: 18, train_loss: 1.0836, test_loss: 1.0331, test_f1: 0.4595
 epoch: 19, train_loss: 1.0821, test_loss: 1.0250, test_f1: 0.4530
 epoch: 20, train_loss: 1.0639, test_loss: 1.0352, test_f1: 0.4362
 epoch: 21, train_loss: 1.0564, test_loss: 1.0200, test_f1: 0.4625
 epoch: 22, train_loss: 1.0579, test_loss: 1.0148, test_f1: 0.4718
 epoch: 23, train_loss: 1.0482, test_loss: 1.0023, test_f1: 0.4727
 epoch: 24, train_loss: 1.0489, test_loss: 1.0043, test_f1: 0.4748
 epoch: 25, train_loss: 1.0358, test_loss: 0.9962, test_f1: 0.4690
 epoch: 26, train_loss: 1.0394, test_loss: 0.9973, test_f1: 0.4804
 epoch: 27, train_loss: 1.0241, test_loss: 0.9954, test_f1: 0.4683
 epoch: 28, train_loss: 1.0137, test_loss: 1.0048, test_f1: 0.4713
 epoch: 29, train_loss: 1.0232, test_loss: 0.9940, test_f1: 0.4871
 epoch: 30, train_loss: 1.0111, test_loss: 0.9802, test_f1: 0.4768
 epoch: 31, train_loss: 1.0079, test_loss: 0.9896, test_f1: 0.4804
 epoch: 32, train_loss: 1.0120, test_loss: 0.9800, test_f1: 0.4814
 epoch: 33, train_loss: 0.9978, test_loss: 0.9746, test_f1: 0.4898
 epoch: 34, train_loss: 0.9972, test_loss: 0.9788, test_f1: 0.4813
 epoch: 35, train_loss: 0.9961, test_loss: 0.9833, test_f1: 0.4878
 epoch: 36, train_loss: 0.9859, test_loss: 1.0143, test_f1: 0.4543
 epoch: 37, train_loss: 0.9817, test_loss: 0.9775, test_f1: 0.4867
 epoch: 38, train_loss: 0.9840, test_loss: 0.9911, test_f1: 0.4948
 epoch: 39, train_loss: 0.9744, test_loss: 0.9633, test_f1: 0.4915
 epoch: 40, train_loss: 0.9800, test_loss: 0.9644, test_f1: 0.4916
 epoch: 41, train_loss: 0.9764, test_loss: 0.9673, test_f1: 0.4859
 epoch: 42, train_loss: 0.9591, test_loss: 0.9856, test_f1: 0.4968
 epoch: 43, train_loss: 0.9712, test_loss: 0.9935, test_f1: 0.4933
 epoch: 44, train_loss: 0.9667, test_loss: 0.9735, test_f1: 0.4974
 epoch: 45, train_loss: 0.9676, test_loss: 0.9834, test_f1: 0.4651
 epoch: 46, train_loss: 0.9502, test_loss: 0.9852, test_f1: 0.4909
 epoch: 47, train_loss: 0.9478, test_loss: 0.9675, test_f1: 0.5020
 epoch: 48, train_loss: 0.9455, test_loss: 0.9745, test_f1: 0.4985
 epoch: 49, train_loss: 0.9418, test_loss: 0.9637, test_f1: 0.4969
 epoch: 50, train_loss: 0.9407, test_loss: 0.9646, test_f1: 0.4920
 epoch: 51, train_loss: 0.9346, test_loss: 0.9622, test_f1: 0.4990
 epoch: 52, train_loss: 0.9208, test_loss: 0.9617, test_f1: 0.4983
 epoch: 53, train_loss: 0.9342, test_loss: 0.9750, test_f1: 0.4944
 epoch: 54, train_loss: 0.9259, test_loss: 0.9615, test_f1: 0.4984
 epoch: 55, train_loss: 0.9170, test_loss: 0.9632, test_f1: 0.4953
 epoch: 56, train_loss: 0.9261, test_loss: 0.9657, test_f1: 0.4940
 epoch: 57, train_loss: 0.9183, test_loss: 0.9560, test_f1: 0.5002
 epoch: 58, train_loss: 0.9163, test_loss: 0.9556, test_f1: 0.4975
 epoch: 59, train_loss: 0.9243, test_loss: 0.9579, test_f1: 0.4956
 epoch: 60, train_loss: 0.9150, test_loss: 0.9660, test_f1: 0.5076
 epoch: 61, train_loss: 0.9003, test_loss: 0.9660, test_f1: 0.4967
 epoch: 62, train_loss: 0.9183, test_loss: 0.9711, test_f1: 0.5028
 epoch: 63, train_loss: 0.9103, test_loss: 0.9634, test_f1: 0.5058
 epoch: 64, train_loss: 0.9086, test_loss: 0.9637, test_f1: 0.5048
 epoch: 65, train_loss: 0.9113, test_loss: 0.9826, test_f1: 0.4964
 epoch: 66, train_loss: 0.9089, test_loss: 0.9660, test_f1: 0.5050
 epoch: 67, train_loss: 0.9025, test_loss: 0.9719, test_f1: 0.4945
 epoch: 68, train_loss: 0.9034, test_loss: 0.9708, test_f1: 0.5046
 epoch: 69, train_loss: 0.9074, test_loss: 0.9637, test_f1: 0.5066
 epoch: 70, train_loss: 0.9038, test_loss: 1.0010, test_f1: 0.4752
 epoch: 71, train_loss: 0.9007, test_loss: 0.9692, test_f1: 0.4968
 epoch: 72, train_loss: 0.9070, test_loss: 0.9819, test_f1: 0.5069
 epoch: 73, train_loss: 0.8978, test_loss: 0.9696, test_f1: 0.5033
 epoch: 74, train_loss: 0.8956, test_loss: 0.9604, test_f1: 0.5044
 epoch: 75, train_loss: 0.8949, test_loss: 0.9741, test_f1: 0.5058
 epoch: 76, train_loss: 0.8952, test_loss: 0.9568, test_f1: 0.5040
 epoch: 77, train_loss: 0.8890, test_loss: 0.9804, test_f1: 0.5049
 epoch: 78, train_loss: 0.8952, test_loss: 0.9704, test_f1: 0.5051
 epoch: 79, train_loss: 0.8878, test_loss: 0.9709, test_f1: 0.5021
 epoch: 80, train_loss: 0.8942, test_loss: 0.9643, test_f1: 0.5027
 epoch: 81, train_loss: 0.8840, test_loss: 0.9619, test_f1: 0.5027
 epoch: 82, train_loss: 0.8860, test_loss: 0.9715, test_f1: 0.4953
 epoch: 83, train_loss: 0.8817, test_loss: 0.9683, test_f1: 0.5019
 epoch: 84, train_loss: 0.8803, test_loss: 0.9553, test_f1: 0.5090
 epoch: 85, train_loss: 0.8781, test_loss: 0.9646, test_f1: 0.5026
 epoch: 86, train_loss: 0.8893, test_loss: 0.9829, test_f1: 0.4935
 epoch: 87, train_loss: 0.8816, test_loss: 0.9533, test_f1: 0.5037
 epoch: 88, train_loss: 0.8864, test_loss: 0.9606, test_f1: 0.5029
 epoch: 89, train_loss: 0.8856, test_loss: 0.9622, test_f1: 0.5077
 epoch: 90, train_loss: 0.8796, test_loss: 0.9677, test_f1: 0.4968
 epoch: 91, train_loss: 0.8858, test_loss: 0.9742, test_f1: 0.4990
 epoch: 92, train_loss: 0.8669, test_loss: 0.9814, test_f1: 0.4936
 epoch: 93, train_loss: 0.8716, test_loss: 0.9677, test_f1: 0.5065
 epoch: 94, train_loss: 0.8721, test_loss: 0.9745, test_f1: 0.5101
 epoch: 95, train_loss: 0.8608, test_loss: 0.9666, test_f1: 0.4944
 epoch: 96, train_loss: 0.8711, test_loss: 0.9564, test_f1: 0.5025
 epoch: 97, train_loss: 0.8662, test_loss: 0.9836, test_f1: 0.5020
 epoch: 98, train_loss: 0.8660, test_loss: 0.9716, test_f1: 0.4963
 epoch: 99, train_loss: 0.8722, test_loss: 0.9694, test_f1: 0.4964

Training completed in 557.04 seconds
Best F1: 0.5358 at epoch 95
Mean F1 across iterations: 0.5202  0.0082
========================FINAL RESULTS================================
FEGIN weighted F1: 0.5358  0.0082
python main.py --data ltspice_examples --representation component_component --model FEGIN --layers 2 --hiddens 64 --batch_size 64 --lr 0.0001 --emb_size 128 --epochs 100 --save_appendix component_component_L2_H64_BS64_LR0.0001_E128 --no_val
-----



STDERR:
  File "main.py", line 370, in <module>
    main()
  File "main.py", line 254, in main
    dataset = dataset_class(
  File "/home/philip/projects/ltspice_examples_code_repo/Circuit-Completion-Using-GNNs/component_classification_with_link_prediction_head/evaluation/FEGIN/kernel/circuit_datasets.py", line 15, in __init__
    self.data, self.slices = torch.load(self.processed_paths[0])
  File "/home/philip/.local/lib/python3.8/site-packages/torch/serialization.py", line 1040, in load
    warnings.warn(
  File "/usr/lib/python3.8/warnings.py", line 109, in _showwarnmsg
    sw(msg.message, msg.category, msg.filename, msg.lineno,
  File "main.py", line 47, in warn_with_traceback
    traceback.print_stack(file=log)
/home/philip/projects/ltspice_examples_code_repo/Circuit-Completion-Using-GNNs/component_classification_with_link_prediction_head/evaluation/FEGIN/kernel/circuit_datasets.py:15: FutureWarning: You are using `torch.load` with `weights_only=False` (the current default value), which uses the default pickle module implicitly. It is possible to construct malicious pickle data which will execute arbitrary code during unpickling (See https://github.com/pytorch/pytorch/blob/main/SECURITY.md#untrusted-models for more details). In a future release, the default value for `weights_only` will be flipped to `True`. This limits the functions that could be executed during unpickling. Arbitrary objects will no longer be allowed to be loaded via this mode unless they are explicitly allowlisted by the user via `torch.serialization.add_safe_globals`. We recommend you start setting `weights_only=True` for any use case where you don't have full control of the loaded file. Please open an issue on GitHub for any issues related to this experimental feature.
  self.data, self.slices = torch.load(self.processed_paths[0])
