STDOUT:
Results will be saved in /home/philip/projects/ltspice_examples_code_repo/Circuit-Completion-Using-GNNs/component_classification_with_link_prediction_head/evaluation/FEGIN/results/model_FEGIN_dataset_ltspice_examples
Command line input: python main.py --data ltspice_examples --representation component_net --model FEGIN --layers 2 --hiddens 16 --batch_size 32 --lr 0.001 --emb_size 250 --epochs 100 --save_appendix component_net_L2_H16_BS32_LR0.001_E250 --no_val
 is saved.
-----
ltspice_examples - FEGIN
Using 2 layers, 16 hidden units, h = 2
Loading component_net representation dataset
ENTERED
Training FEGIN on component_net representation
Train: 3558, Test: 846
##################ITERATION #0 ****************************************
 epoch: 0, train_loss: 1.3455, test_loss: 1.2656, test_f1: 0.2270
 epoch: 1, train_loss: 1.2455, test_loss: 1.2094, test_f1: 0.2637
 epoch: 2, train_loss: 1.1990, test_loss: 1.1383, test_f1: 0.3633
 epoch: 3, train_loss: 1.1420, test_loss: 1.0698, test_f1: 0.3565
 epoch: 4, train_loss: 1.0840, test_loss: 1.0429, test_f1: 0.3569
 epoch: 5, train_loss: 1.0624, test_loss: 1.0467, test_f1: 0.3512
 epoch: 6, train_loss: 1.0441, test_loss: 1.0553, test_f1: 0.3489
 epoch: 7, train_loss: 1.0381, test_loss: 1.0280, test_f1: 0.3507
 epoch: 8, train_loss: 1.0270, test_loss: 1.0616, test_f1: 0.4395
 epoch: 9, train_loss: 1.0171, test_loss: 1.0095, test_f1: 0.4223
 epoch: 10, train_loss: 1.0032, test_loss: 1.0457, test_f1: 0.4550
 epoch: 11, train_loss: 0.9965, test_loss: 1.0439, test_f1: 0.5007
 epoch: 12, train_loss: 0.9939, test_loss: 1.0221, test_f1: 0.4563
 epoch: 13, train_loss: 0.9922, test_loss: 1.0369, test_f1: 0.4486
 epoch: 14, train_loss: 0.9821, test_loss: 0.9909, test_f1: 0.4685
 epoch: 15, train_loss: 0.9725, test_loss: 1.0108, test_f1: 0.4657
 epoch: 16, train_loss: 0.9656, test_loss: 0.9720, test_f1: 0.4685
 epoch: 17, train_loss: 0.9658, test_loss: 0.9482, test_f1: 0.4943
 epoch: 18, train_loss: 0.9562, test_loss: 0.9918, test_f1: 0.5034
 epoch: 19, train_loss: 0.9578, test_loss: 0.9174, test_f1: 0.5099
 epoch: 20, train_loss: 0.9565, test_loss: 1.0084, test_f1: 0.4801
 epoch: 21, train_loss: 0.9569, test_loss: 1.0160, test_f1: 0.4653
 epoch: 22, train_loss: 0.9466, test_loss: 0.9842, test_f1: 0.4929
 epoch: 23, train_loss: 0.9365, test_loss: 0.9584, test_f1: 0.4832
 epoch: 24, train_loss: 0.9483, test_loss: 0.9506, test_f1: 0.4896
 epoch: 25, train_loss: 0.9495, test_loss: 0.9988, test_f1: 0.4780
 epoch: 26, train_loss: 0.9419, test_loss: 0.9845, test_f1: 0.5035
 epoch: 27, train_loss: 0.9239, test_loss: 0.9820, test_f1: 0.4874
 epoch: 28, train_loss: 0.9268, test_loss: 0.9771, test_f1: 0.5055
 epoch: 29, train_loss: 0.9328, test_loss: 0.9591, test_f1: 0.4986
 epoch: 30, train_loss: 0.9210, test_loss: 0.9600, test_f1: 0.4986
 epoch: 31, train_loss: 0.9201, test_loss: 0.9929, test_f1: 0.5100
 epoch: 32, train_loss: 0.9203, test_loss: 1.0070, test_f1: 0.5288
 epoch: 33, train_loss: 0.9206, test_loss: 0.9611, test_f1: 0.5072
 epoch: 34, train_loss: 0.9039, test_loss: 0.9982, test_f1: 0.4979
 epoch: 35, train_loss: 0.9272, test_loss: 0.9757, test_f1: 0.4906
 epoch: 36, train_loss: 0.9106, test_loss: 0.9636, test_f1: 0.5087
 epoch: 37, train_loss: 0.9063, test_loss: 0.9763, test_f1: 0.5155
 epoch: 38, train_loss: 0.9160, test_loss: 0.9430, test_f1: 0.5331
 epoch: 39, train_loss: 0.9049, test_loss: 0.9844, test_f1: 0.5123
 epoch: 40, train_loss: 0.9018, test_loss: 0.9795, test_f1: 0.5335
 epoch: 41, train_loss: 0.8952, test_loss: 0.9796, test_f1: 0.5111
 epoch: 42, train_loss: 0.8984, test_loss: 0.9853, test_f1: 0.5251
 epoch: 43, train_loss: 0.8898, test_loss: 0.9781, test_f1: 0.5252
 epoch: 44, train_loss: 0.8947, test_loss: 0.9964, test_f1: 0.4822
 epoch: 45, train_loss: 0.9010, test_loss: 0.9649, test_f1: 0.5254
 epoch: 46, train_loss: 0.9028, test_loss: 0.9801, test_f1: 0.5014
 epoch: 47, train_loss: 0.8803, test_loss: 0.9894, test_f1: 0.5060
 epoch: 48, train_loss: 0.8865, test_loss: 0.9710, test_f1: 0.5132
 epoch: 49, train_loss: 0.8935, test_loss: 0.9646, test_f1: 0.4878
 epoch: 50, train_loss: 0.8843, test_loss: 0.9821, test_f1: 0.5502
 epoch: 51, train_loss: 0.8708, test_loss: 0.9696, test_f1: 0.5379
 epoch: 52, train_loss: 0.8706, test_loss: 0.9795, test_f1: 0.5258
 epoch: 53, train_loss: 0.8767, test_loss: 0.9836, test_f1: 0.5288
 epoch: 54, train_loss: 0.8777, test_loss: 0.9895, test_f1: 0.5025
 epoch: 55, train_loss: 0.8576, test_loss: 0.9586, test_f1: 0.5444
 epoch: 56, train_loss: 0.8638, test_loss: 0.9698, test_f1: 0.5424
 epoch: 57, train_loss: 0.8680, test_loss: 0.9864, test_f1: 0.5328
 epoch: 58, train_loss: 0.8599, test_loss: 0.9817, test_f1: 0.5467
 epoch: 59, train_loss: 0.8687, test_loss: 1.0210, test_f1: 0.5254
 epoch: 60, train_loss: 0.8684, test_loss: 0.9914, test_f1: 0.5302
 epoch: 61, train_loss: 0.8707, test_loss: 1.0196, test_f1: 0.5335
 epoch: 62, train_loss: 0.8671, test_loss: 1.0004, test_f1: 0.5257
 epoch: 63, train_loss: 0.8589, test_loss: 0.9936, test_f1: 0.5324
 epoch: 64, train_loss: 0.8660, test_loss: 1.0117, test_f1: 0.5097
 epoch: 65, train_loss: 0.8584, test_loss: 1.0231, test_f1: 0.5091
 epoch: 66, train_loss: 0.8650, test_loss: 1.0150, test_f1: 0.5563
 epoch: 67, train_loss: 0.8627, test_loss: 0.9937, test_f1: 0.5648
 epoch: 68, train_loss: 0.8625, test_loss: 0.9876, test_f1: 0.5415
 epoch: 69, train_loss: 0.8576, test_loss: 1.0201, test_f1: 0.5416
 epoch: 70, train_loss: 0.8609, test_loss: 1.0157, test_f1: 0.5096
 epoch: 71, train_loss: 0.8535, test_loss: 1.0217, test_f1: 0.5373
 epoch: 72, train_loss: 0.8635, test_loss: 1.0257, test_f1: 0.5087
 epoch: 73, train_loss: 0.8452, test_loss: 1.0378, test_f1: 0.5429
 epoch: 74, train_loss: 0.8591, test_loss: 0.9942, test_f1: 0.5588
 epoch: 75, train_loss: 0.8514, test_loss: 0.9893, test_f1: 0.5173
 epoch: 76, train_loss: 0.8571, test_loss: 0.9892, test_f1: 0.5381
 epoch: 77, train_loss: 0.8512, test_loss: 0.9886, test_f1: 0.5585
 epoch: 78, train_loss: 0.8486, test_loss: 0.9895, test_f1: 0.5328
 epoch: 79, train_loss: 0.8482, test_loss: 1.0280, test_f1: 0.5571
 epoch: 80, train_loss: 0.8549, test_loss: 1.0252, test_f1: 0.5252
 epoch: 81, train_loss: 0.8434, test_loss: 1.0334, test_f1: 0.5251
 epoch: 82, train_loss: 0.8471, test_loss: 0.9999, test_f1: 0.5729
 epoch: 83, train_loss: 0.8510, test_loss: 1.0178, test_f1: 0.5523
 epoch: 84, train_loss: 0.8478, test_loss: 1.0049, test_f1: 0.5668
 epoch: 85, train_loss: 0.8373, test_loss: 1.0061, test_f1: 0.5396
 epoch: 86, train_loss: 0.8434, test_loss: 0.9983, test_f1: 0.5668
 epoch: 87, train_loss: 0.8490, test_loss: 1.0169, test_f1: 0.5297
 epoch: 88, train_loss: 0.8504, test_loss: 1.0424, test_f1: 0.5271
 epoch: 89, train_loss: 0.8473, test_loss: 1.0286, test_f1: 0.5489
 epoch: 90, train_loss: 0.8452, test_loss: 1.0223, test_f1: 0.5620
 epoch: 91, train_loss: 0.8385, test_loss: 1.0076, test_f1: 0.5572
 epoch: 92, train_loss: 0.8318, test_loss: 1.0316, test_f1: 0.5516
 epoch: 93, train_loss: 0.8586, test_loss: 1.0563, test_f1: 0.5449
 epoch: 94, train_loss: 0.8499, test_loss: 1.0148, test_f1: 0.5520
 epoch: 95, train_loss: 0.8403, test_loss: 1.0248, test_f1: 0.5528
 epoch: 96, train_loss: 0.8345, test_loss: 1.0284, test_f1: 0.5708
 epoch: 97, train_loss: 0.8422, test_loss: 1.0410, test_f1: 0.5200
 epoch: 98, train_loss: 0.8402, test_loss: 1.0441, test_f1: 0.5483
 epoch: 99, train_loss: 0.8473, test_loss: 1.0291, test_f1: 0.5476
##################ITERATION #1 ****************************************
 epoch: 0, train_loss: 1.2441, test_loss: 1.1501, test_f1: 0.2603
 epoch: 1, train_loss: 1.1542, test_loss: 1.0640, test_f1: 0.3563
 epoch: 2, train_loss: 1.0949, test_loss: 1.0525, test_f1: 0.3769
 epoch: 3, train_loss: 1.0728, test_loss: 1.0432, test_f1: 0.4055
 epoch: 4, train_loss: 1.0528, test_loss: 1.0278, test_f1: 0.4279
 epoch: 5, train_loss: 1.0353, test_loss: 1.0389, test_f1: 0.4115
 epoch: 6, train_loss: 1.0254, test_loss: 1.0351, test_f1: 0.4816
 epoch: 7, train_loss: 1.0187, test_loss: 1.0092, test_f1: 0.4787
 epoch: 8, train_loss: 1.0039, test_loss: 1.0181, test_f1: 0.4812
 epoch: 9, train_loss: 0.9965, test_loss: 1.0057, test_f1: 0.4841
 epoch: 10, train_loss: 0.9947, test_loss: 1.0087, test_f1: 0.4912
 epoch: 11, train_loss: 0.9863, test_loss: 1.0126, test_f1: 0.4945
 epoch: 12, train_loss: 0.9767, test_loss: 1.0052, test_f1: 0.4948
 epoch: 13, train_loss: 0.9688, test_loss: 0.9861, test_f1: 0.4865
 epoch: 14, train_loss: 0.9621, test_loss: 0.9672, test_f1: 0.4932
 epoch: 15, train_loss: 0.9650, test_loss: 0.9782, test_f1: 0.5091
 epoch: 16, train_loss: 0.9636, test_loss: 1.0127, test_f1: 0.4969
 epoch: 17, train_loss: 0.9524, test_loss: 1.0018, test_f1: 0.4739
 epoch: 18, train_loss: 0.9545, test_loss: 0.9977, test_f1: 0.5024
 epoch: 19, train_loss: 0.9458, test_loss: 1.0178, test_f1: 0.4736
 epoch: 20, train_loss: 0.9452, test_loss: 1.0097, test_f1: 0.4907
 epoch: 21, train_loss: 0.9291, test_loss: 1.0139, test_f1: 0.5096
 epoch: 22, train_loss: 0.9410, test_loss: 1.0103, test_f1: 0.4962
 epoch: 23, train_loss: 0.9400, test_loss: 0.9867, test_f1: 0.5017
 epoch: 24, train_loss: 0.9404, test_loss: 0.9682, test_f1: 0.5205
 epoch: 25, train_loss: 0.9273, test_loss: 0.9765, test_f1: 0.5062
 epoch: 26, train_loss: 0.9248, test_loss: 0.9673, test_f1: 0.4988
 epoch: 27, train_loss: 0.9277, test_loss: 1.0041, test_f1: 0.5214
 epoch: 28, train_loss: 0.9217, test_loss: 0.9706, test_f1: 0.5113
 epoch: 29, train_loss: 0.9071, test_loss: 0.9767, test_f1: 0.5265
 epoch: 30, train_loss: 0.9132, test_loss: 0.9755, test_f1: 0.5084
 epoch: 31, train_loss: 0.9144, test_loss: 0.9493, test_f1: 0.5078
 epoch: 32, train_loss: 0.9115, test_loss: 0.9634, test_f1: 0.4996
 epoch: 33, train_loss: 0.9152, test_loss: 0.9621, test_f1: 0.5288
 epoch: 34, train_loss: 0.9029, test_loss: 0.9981, test_f1: 0.5204
 epoch: 35, train_loss: 0.9059, test_loss: 0.9726, test_f1: 0.5202
 epoch: 36, train_loss: 0.9065, test_loss: 1.0158, test_f1: 0.5523
 epoch: 37, train_loss: 0.9120, test_loss: 0.9663, test_f1: 0.5358
 epoch: 38, train_loss: 0.9001, test_loss: 0.9475, test_f1: 0.5238
 epoch: 39, train_loss: 0.8992, test_loss: 0.9645, test_f1: 0.5205
 epoch: 40, train_loss: 0.9013, test_loss: 0.9836, test_f1: 0.5417
 epoch: 41, train_loss: 0.9033, test_loss: 0.9639, test_f1: 0.5227
 epoch: 42, train_loss: 0.8957, test_loss: 0.9552, test_f1: 0.5155
 epoch: 43, train_loss: 0.8798, test_loss: 0.9476, test_f1: 0.5240
 epoch: 44, train_loss: 0.8849, test_loss: 0.9501, test_f1: 0.5332
 epoch: 45, train_loss: 0.8794, test_loss: 0.9928, test_f1: 0.5096
 epoch: 46, train_loss: 0.8840, test_loss: 0.9874, test_f1: 0.5102
 epoch: 47, train_loss: 0.8917, test_loss: 1.0137, test_f1: 0.5168
 epoch: 48, train_loss: 0.8862, test_loss: 0.9665, test_f1: 0.5158
 epoch: 49, train_loss: 0.8880, test_loss: 0.9820, test_f1: 0.5281
 epoch: 50, train_loss: 0.8736, test_loss: 0.9742, test_f1: 0.5314
 epoch: 51, train_loss: 0.8727, test_loss: 0.9623, test_f1: 0.5140
 epoch: 52, train_loss: 0.8717, test_loss: 0.9651, test_f1: 0.5225
 epoch: 53, train_loss: 0.8727, test_loss: 0.9717, test_f1: 0.5112
 epoch: 54, train_loss: 0.8672, test_loss: 0.9581, test_f1: 0.5242
 epoch: 55, train_loss: 0.8732, test_loss: 0.9689, test_f1: 0.5243
 epoch: 56, train_loss: 0.8763, test_loss: 0.9672, test_f1: 0.5260
 epoch: 57, train_loss: 0.8717, test_loss: 0.9635, test_f1: 0.5341
 epoch: 58, train_loss: 0.8681, test_loss: 0.9858, test_f1: 0.5007
 epoch: 59, train_loss: 0.8651, test_loss: 0.9617, test_f1: 0.5181
 epoch: 60, train_loss: 0.8565, test_loss: 0.9715, test_f1: 0.5161
 epoch: 61, train_loss: 0.8663, test_loss: 0.9804, test_f1: 0.5197
 epoch: 62, train_loss: 0.8643, test_loss: 0.9780, test_f1: 0.5052
 epoch: 63, train_loss: 0.8609, test_loss: 0.9660, test_f1: 0.5357
 epoch: 64, train_loss: 0.8601, test_loss: 0.9640, test_f1: 0.5201
 epoch: 65, train_loss: 0.8610, test_loss: 0.9835, test_f1: 0.5148
 epoch: 66, train_loss: 0.8641, test_loss: 0.9696, test_f1: 0.5338
 epoch: 67, train_loss: 0.8633, test_loss: 0.9608, test_f1: 0.5235
 epoch: 68, train_loss: 0.8516, test_loss: 0.9699, test_f1: 0.5329
 epoch: 69, train_loss: 0.8593, test_loss: 0.9755, test_f1: 0.5333
 epoch: 70, train_loss: 0.8553, test_loss: 0.9508, test_f1: 0.5310
 epoch: 71, train_loss: 0.8563, test_loss: 0.9536, test_f1: 0.5010
 epoch: 72, train_loss: 0.8445, test_loss: 0.9788, test_f1: 0.5269
 epoch: 73, train_loss: 0.8587, test_loss: 0.9846, test_f1: 0.5246
 epoch: 74, train_loss: 0.8565, test_loss: 0.9484, test_f1: 0.5174
 epoch: 75, train_loss: 0.8496, test_loss: 0.9657, test_f1: 0.5206
 epoch: 76, train_loss: 0.8573, test_loss: 1.0055, test_f1: 0.5053
 epoch: 77, train_loss: 0.8594, test_loss: 0.9787, test_f1: 0.5090
 epoch: 78, train_loss: 0.8436, test_loss: 0.9459, test_f1: 0.5197
 epoch: 79, train_loss: 0.8564, test_loss: 0.9475, test_f1: 0.5273
 epoch: 80, train_loss: 0.8441, test_loss: 0.9683, test_f1: 0.5025
 epoch: 81, train_loss: 0.8557, test_loss: 0.9805, test_f1: 0.5243
 epoch: 82, train_loss: 0.8496, test_loss: 0.9666, test_f1: 0.5287
 epoch: 83, train_loss: 0.8537, test_loss: 0.9811, test_f1: 0.5152
 epoch: 84, train_loss: 0.8484, test_loss: 0.9489, test_f1: 0.5291
 epoch: 85, train_loss: 0.8339, test_loss: 0.9601, test_f1: 0.5331
 epoch: 86, train_loss: 0.8476, test_loss: 0.9805, test_f1: 0.5277
 epoch: 87, train_loss: 0.8398, test_loss: 0.9600, test_f1: 0.5354
 epoch: 88, train_loss: 0.8419, test_loss: 0.9782, test_f1: 0.5194
 epoch: 89, train_loss: 0.8532, test_loss: 0.9903, test_f1: 0.5268
 epoch: 90, train_loss: 0.8459, test_loss: 0.9767, test_f1: 0.5342
 epoch: 91, train_loss: 0.8411, test_loss: 0.9588, test_f1: 0.5413
 epoch: 92, train_loss: 0.8482, test_loss: 0.9736, test_f1: 0.5171
 epoch: 93, train_loss: 0.8445, test_loss: 0.9961, test_f1: 0.5263
 epoch: 94, train_loss: 0.8415, test_loss: 0.9827, test_f1: 0.5165
 epoch: 95, train_loss: 0.8384, test_loss: 0.9543, test_f1: 0.5310
 epoch: 96, train_loss: 0.8280, test_loss: 0.9638, test_f1: 0.5349
 epoch: 97, train_loss: 0.8407, test_loss: 0.9750, test_f1: 0.5338
 epoch: 98, train_loss: 0.8505, test_loss: 0.9720, test_f1: 0.5252
 epoch: 99, train_loss: 0.8333, test_loss: 0.9696, test_f1: 0.5380
##################ITERATION #2 ****************************************
 epoch: 0, train_loss: 1.2203, test_loss: 1.0953, test_f1: 0.4072
 epoch: 1, train_loss: 1.1239, test_loss: 1.0595, test_f1: 0.3929
 epoch: 2, train_loss: 1.0869, test_loss: 1.0319, test_f1: 0.4283
 epoch: 3, train_loss: 1.0566, test_loss: 1.0150, test_f1: 0.4368
 epoch: 4, train_loss: 1.0314, test_loss: 1.0108, test_f1: 0.4444
 epoch: 5, train_loss: 1.0173, test_loss: 0.9917, test_f1: 0.4782
 epoch: 6, train_loss: 1.0074, test_loss: 0.9742, test_f1: 0.4766
 epoch: 7, train_loss: 0.9892, test_loss: 0.9752, test_f1: 0.4726
 epoch: 8, train_loss: 0.9917, test_loss: 0.9651, test_f1: 0.4781
 epoch: 9, train_loss: 0.9832, test_loss: 0.9612, test_f1: 0.4924
 epoch: 10, train_loss: 0.9783, test_loss: 0.9375, test_f1: 0.4865
 epoch: 11, train_loss: 0.9616, test_loss: 0.9488, test_f1: 0.5026
 epoch: 12, train_loss: 0.9551, test_loss: 0.9525, test_f1: 0.5111
 epoch: 13, train_loss: 0.9570, test_loss: 0.9640, test_f1: 0.4822
 epoch: 14, train_loss: 0.9540, test_loss: 0.9446, test_f1: 0.5278
 epoch: 15, train_loss: 0.9410, test_loss: 0.9528, test_f1: 0.5269
 epoch: 16, train_loss: 0.9569, test_loss: 0.9690, test_f1: 0.5070
 epoch: 17, train_loss: 0.9421, test_loss: 0.9555, test_f1: 0.4983
 epoch: 18, train_loss: 0.9434, test_loss: 0.9387, test_f1: 0.5287
 epoch: 19, train_loss: 0.9292, test_loss: 0.9573, test_f1: 0.5107
 epoch: 20, train_loss: 0.9268, test_loss: 0.9586, test_f1: 0.5069
 epoch: 21, train_loss: 0.9393, test_loss: 0.9490, test_f1: 0.5360
 epoch: 22, train_loss: 0.9159, test_loss: 0.9038, test_f1: 0.5320
 epoch: 23, train_loss: 0.9215, test_loss: 0.9198, test_f1: 0.5390
 epoch: 24, train_loss: 0.9266, test_loss: 0.9405, test_f1: 0.5252
 epoch: 25, train_loss: 0.9199, test_loss: 0.9463, test_f1: 0.5278
 epoch: 26, train_loss: 0.9122, test_loss: 0.9348, test_f1: 0.5250
 epoch: 27, train_loss: 0.9219, test_loss: 0.9220, test_f1: 0.5271
 epoch: 28, train_loss: 0.9110, test_loss: 0.8992, test_f1: 0.5186
 epoch: 29, train_loss: 0.9098, test_loss: 0.8884, test_f1: 0.5349
 epoch: 30, train_loss: 0.9051, test_loss: 0.9186, test_f1: 0.5195
 epoch: 31, train_loss: 0.9032, test_loss: 0.9244, test_f1: 0.5251
 epoch: 32, train_loss: 0.9083, test_loss: 0.9025, test_f1: 0.5312
 epoch: 33, train_loss: 0.9006, test_loss: 0.9173, test_f1: 0.5262
 epoch: 34, train_loss: 0.8993, test_loss: 0.8970, test_f1: 0.5326
 epoch: 35, train_loss: 0.8877, test_loss: 0.9319, test_f1: 0.5350
 epoch: 36, train_loss: 0.8896, test_loss: 0.9060, test_f1: 0.5313
 epoch: 37, train_loss: 0.8978, test_loss: 0.9328, test_f1: 0.5071
 epoch: 38, train_loss: 0.8956, test_loss: 0.9273, test_f1: 0.5304
 epoch: 39, train_loss: 0.8827, test_loss: 0.9378, test_f1: 0.5178
 epoch: 40, train_loss: 0.8795, test_loss: 0.9309, test_f1: 0.5253
 epoch: 41, train_loss: 0.8898, test_loss: 0.9069, test_f1: 0.5205
 epoch: 42, train_loss: 0.8895, test_loss: 0.9323, test_f1: 0.5275
 epoch: 43, train_loss: 0.8953, test_loss: 0.9502, test_f1: 0.5317
 epoch: 44, train_loss: 0.8834, test_loss: 0.9011, test_f1: 0.5428
 epoch: 45, train_loss: 0.8843, test_loss: 0.9002, test_f1: 0.5366
 epoch: 46, train_loss: 0.8728, test_loss: 0.9073, test_f1: 0.5345
 epoch: 47, train_loss: 0.8813, test_loss: 0.8970, test_f1: 0.5258
 epoch: 48, train_loss: 0.8829, test_loss: 0.9262, test_f1: 0.5344
 epoch: 49, train_loss: 0.8710, test_loss: 0.9054, test_f1: 0.5332
 epoch: 50, train_loss: 0.8672, test_loss: 0.9095, test_f1: 0.5320
 epoch: 51, train_loss: 0.8673, test_loss: 0.9012, test_f1: 0.5314
 epoch: 52, train_loss: 0.8587, test_loss: 0.8920, test_f1: 0.5357
 epoch: 53, train_loss: 0.8555, test_loss: 0.9155, test_f1: 0.5404
 epoch: 54, train_loss: 0.8622, test_loss: 0.9455, test_f1: 0.5272
 epoch: 55, train_loss: 0.8565, test_loss: 0.9097, test_f1: 0.5463
 epoch: 56, train_loss: 0.8545, test_loss: 0.9053, test_f1: 0.5348
 epoch: 57, train_loss: 0.8507, test_loss: 0.8859, test_f1: 0.5470
 epoch: 58, train_loss: 0.8536, test_loss: 0.8966, test_f1: 0.5446
 epoch: 59, train_loss: 0.8418, test_loss: 0.9155, test_f1: 0.5385
 epoch: 60, train_loss: 0.8594, test_loss: 0.9106, test_f1: 0.5376
 epoch: 61, train_loss: 0.8521, test_loss: 0.9206, test_f1: 0.5388
 epoch: 62, train_loss: 0.8586, test_loss: 0.9175, test_f1: 0.5389
 epoch: 63, train_loss: 0.8473, test_loss: 0.9207, test_f1: 0.5320
 epoch: 64, train_loss: 0.8509, test_loss: 0.9198, test_f1: 0.5372
 epoch: 65, train_loss: 0.8431, test_loss: 0.9343, test_f1: 0.5370
 epoch: 66, train_loss: 0.8502, test_loss: 0.9032, test_f1: 0.5334
 epoch: 67, train_loss: 0.8468, test_loss: 0.9056, test_f1: 0.5416
 epoch: 68, train_loss: 0.8414, test_loss: 0.9060, test_f1: 0.5418
 epoch: 69, train_loss: 0.8421, test_loss: 0.9219, test_f1: 0.5287
 epoch: 70, train_loss: 0.8496, test_loss: 0.9099, test_f1: 0.5435
 epoch: 71, train_loss: 0.8460, test_loss: 0.9226, test_f1: 0.5383
 epoch: 72, train_loss: 0.8439, test_loss: 0.9117, test_f1: 0.5394
 epoch: 73, train_loss: 0.8533, test_loss: 0.9268, test_f1: 0.5403
 epoch: 74, train_loss: 0.8358, test_loss: 0.9344, test_f1: 0.5266
 epoch: 75, train_loss: 0.8561, test_loss: 0.9034, test_f1: 0.5474
 epoch: 76, train_loss: 0.8369, test_loss: 0.9041, test_f1: 0.5386
 epoch: 77, train_loss: 0.8404, test_loss: 0.8938, test_f1: 0.5449
 epoch: 78, train_loss: 0.8366, test_loss: 0.9015, test_f1: 0.5473
 epoch: 79, train_loss: 0.8381, test_loss: 0.9315, test_f1: 0.5304
 epoch: 80, train_loss: 0.8350, test_loss: 0.9295, test_f1: 0.5328
 epoch: 81, train_loss: 0.8354, test_loss: 0.9097, test_f1: 0.5438
 epoch: 82, train_loss: 0.8423, test_loss: 0.9136, test_f1: 0.5407
 epoch: 83, train_loss: 0.8442, test_loss: 0.9132, test_f1: 0.5389
 epoch: 84, train_loss: 0.8382, test_loss: 0.9029, test_f1: 0.5461
 epoch: 85, train_loss: 0.8431, test_loss: 0.9100, test_f1: 0.5455
 epoch: 86, train_loss: 0.8294, test_loss: 0.9140, test_f1: 0.5397
 epoch: 87, train_loss: 0.8364, test_loss: 0.9012, test_f1: 0.5463
 epoch: 88, train_loss: 0.8411, test_loss: 0.8920, test_f1: 0.5532
 epoch: 89, train_loss: 0.8368, test_loss: 0.9249, test_f1: 0.5486
 epoch: 90, train_loss: 0.8340, test_loss: 0.9137, test_f1: 0.5524
 epoch: 91, train_loss: 0.8198, test_loss: 0.9302, test_f1: 0.5424
 epoch: 92, train_loss: 0.8209, test_loss: 0.9191, test_f1: 0.5411
 epoch: 93, train_loss: 0.8293, test_loss: 0.9170, test_f1: 0.5490
 epoch: 94, train_loss: 0.8286, test_loss: 0.9208, test_f1: 0.5466
 epoch: 95, train_loss: 0.8399, test_loss: 0.9090, test_f1: 0.5423
 epoch: 96, train_loss: 0.8464, test_loss: 0.9182, test_f1: 0.5470
 epoch: 97, train_loss: 0.8284, test_loss: 0.9134, test_f1: 0.5444
 epoch: 98, train_loss: 0.8258, test_loss: 0.9014, test_f1: 0.5437
 epoch: 99, train_loss: 0.8326, test_loss: 0.9226, test_f1: 0.5407
##################ITERATION #3 ****************************************
 epoch: 0, train_loss: 1.2374, test_loss: 1.1146, test_f1: 0.3799
 epoch: 1, train_loss: 1.1426, test_loss: 1.0624, test_f1: 0.4497
 epoch: 2, train_loss: 1.1102, test_loss: 1.0242, test_f1: 0.4599
 epoch: 3, train_loss: 1.0793, test_loss: 1.0141, test_f1: 0.4550
 epoch: 4, train_loss: 1.0545, test_loss: 1.0225, test_f1: 0.4294
 epoch: 5, train_loss: 1.0283, test_loss: 0.9898, test_f1: 0.4545
 epoch: 6, train_loss: 1.0227, test_loss: 0.9861, test_f1: 0.4470
 epoch: 7, train_loss: 1.0090, test_loss: 0.9940, test_f1: 0.4682
 epoch: 8, train_loss: 0.9973, test_loss: 0.9944, test_f1: 0.4495
 epoch: 9, train_loss: 0.9741, test_loss: 0.9733, test_f1: 0.4718
 epoch: 10, train_loss: 0.9746, test_loss: 0.9812, test_f1: 0.4799
 epoch: 11, train_loss: 0.9686, test_loss: 0.9551, test_f1: 0.4820
 epoch: 12, train_loss: 0.9778, test_loss: 0.9642, test_f1: 0.4689
 epoch: 13, train_loss: 0.9587, test_loss: 0.9663, test_f1: 0.4835
 epoch: 14, train_loss: 0.9571, test_loss: 0.9510, test_f1: 0.4896
 epoch: 15, train_loss: 0.9538, test_loss: 0.9920, test_f1: 0.4771
 epoch: 16, train_loss: 0.9416, test_loss: 0.9983, test_f1: 0.4734
 epoch: 17, train_loss: 0.9446, test_loss: 0.9917, test_f1: 0.4866
 epoch: 18, train_loss: 0.9424, test_loss: 0.9844, test_f1: 0.4849
 epoch: 19, train_loss: 0.9428, test_loss: 0.9682, test_f1: 0.4775
 epoch: 20, train_loss: 0.9282, test_loss: 1.0112, test_f1: 0.4894
 epoch: 21, train_loss: 0.9297, test_loss: 1.0439, test_f1: 0.4998
 epoch: 22, train_loss: 0.9345, test_loss: 0.9646, test_f1: 0.4937
 epoch: 23, train_loss: 0.9362, test_loss: 0.9613, test_f1: 0.5078
 epoch: 24, train_loss: 0.9339, test_loss: 0.9404, test_f1: 0.4855
 epoch: 25, train_loss: 0.9212, test_loss: 0.9796, test_f1: 0.4985
 epoch: 26, train_loss: 0.9173, test_loss: 0.9822, test_f1: 0.4923
 epoch: 27, train_loss: 0.9255, test_loss: 0.9711, test_f1: 0.4944
 epoch: 28, train_loss: 0.9253, test_loss: 0.9519, test_f1: 0.4973
 epoch: 29, train_loss: 0.9191, test_loss: 0.9490, test_f1: 0.4800
 epoch: 30, train_loss: 0.9148, test_loss: 1.0225, test_f1: 0.5066
 epoch: 31, train_loss: 0.9201, test_loss: 1.0467, test_f1: 0.4661
 epoch: 32, train_loss: 0.9079, test_loss: 0.9807, test_f1: 0.5077
 epoch: 33, train_loss: 0.9163, test_loss: 0.9836, test_f1: 0.4756
 epoch: 34, train_loss: 0.9141, test_loss: 1.0105, test_f1: 0.4986
 epoch: 35, train_loss: 0.9085, test_loss: 0.9689, test_f1: 0.4888
 epoch: 36, train_loss: 0.9159, test_loss: 0.9709, test_f1: 0.5067
 epoch: 37, train_loss: 0.9095, test_loss: 0.9329, test_f1: 0.4863
 epoch: 38, train_loss: 0.9117, test_loss: 0.9654, test_f1: 0.5112
 epoch: 39, train_loss: 0.8984, test_loss: 0.9650, test_f1: 0.5065
 epoch: 40, train_loss: 0.9211, test_loss: 0.9532, test_f1: 0.4945
 epoch: 41, train_loss: 0.9102, test_loss: 1.0013, test_f1: 0.4857
 epoch: 42, train_loss: 0.9080, test_loss: 0.9283, test_f1: 0.4913
 epoch: 43, train_loss: 0.8996, test_loss: 1.0011, test_f1: 0.4985
 epoch: 44, train_loss: 0.9066, test_loss: 0.9424, test_f1: 0.4874
 epoch: 45, train_loss: 0.9057, test_loss: 0.9611, test_f1: 0.4967
 epoch: 46, train_loss: 0.9016, test_loss: 0.9526, test_f1: 0.5138
 epoch: 47, train_loss: 0.9048, test_loss: 0.9079, test_f1: 0.5038
 epoch: 48, train_loss: 0.9074, test_loss: 0.9604, test_f1: 0.4989
 epoch: 49, train_loss: 0.8967, test_loss: 1.0000, test_f1: 0.4855
 epoch: 50, train_loss: 0.8988, test_loss: 1.0133, test_f1: 0.4931
 epoch: 51, train_loss: 0.8973, test_loss: 0.9580, test_f1: 0.5116
 epoch: 52, train_loss: 0.8962, test_loss: 0.9449, test_f1: 0.4975
 epoch: 53, train_loss: 0.8963, test_loss: 0.9583, test_f1: 0.4923
 epoch: 54, train_loss: 0.8857, test_loss: 0.9609, test_f1: 0.4995
 epoch: 55, train_loss: 0.8848, test_loss: 0.9456, test_f1: 0.4927
 epoch: 56, train_loss: 0.8809, test_loss: 0.9473, test_f1: 0.4963
 epoch: 57, train_loss: 0.8833, test_loss: 0.9794, test_f1: 0.4942
 epoch: 58, train_loss: 0.8839, test_loss: 0.9747, test_f1: 0.5009
 epoch: 59, train_loss: 0.8865, test_loss: 0.9971, test_f1: 0.4803
 epoch: 60, train_loss: 0.8816, test_loss: 0.9493, test_f1: 0.4978
 epoch: 61, train_loss: 0.8837, test_loss: 0.9371, test_f1: 0.5014
 epoch: 62, train_loss: 0.8848, test_loss: 0.9681, test_f1: 0.5064
 epoch: 63, train_loss: 0.8776, test_loss: 0.9375, test_f1: 0.5028
 epoch: 64, train_loss: 0.8870, test_loss: 0.9013, test_f1: 0.5116
 epoch: 65, train_loss: 0.8788, test_loss: 0.9133, test_f1: 0.5079
 epoch: 66, train_loss: 0.8829, test_loss: 0.9803, test_f1: 0.4924
 epoch: 67, train_loss: 0.8616, test_loss: 0.9689, test_f1: 0.4920
 epoch: 68, train_loss: 0.8781, test_loss: 0.9762, test_f1: 0.4912
 epoch: 69, train_loss: 0.8789, test_loss: 0.9670, test_f1: 0.5084
 epoch: 70, train_loss: 0.8719, test_loss: 0.9660, test_f1: 0.5026
 epoch: 71, train_loss: 0.8720, test_loss: 0.9547, test_f1: 0.5057
 epoch: 72, train_loss: 0.8780, test_loss: 0.9540, test_f1: 0.5155
 epoch: 73, train_loss: 0.8708, test_loss: 0.9579, test_f1: 0.5082
 epoch: 74, train_loss: 0.8733, test_loss: 0.9510, test_f1: 0.5167
 epoch: 75, train_loss: 0.8728, test_loss: 0.9458, test_f1: 0.5228
 epoch: 76, train_loss: 0.8746, test_loss: 0.9439, test_f1: 0.5039
 epoch: 77, train_loss: 0.8628, test_loss: 0.9608, test_f1: 0.5115
 epoch: 78, train_loss: 0.8759, test_loss: 0.9621, test_f1: 0.5050
 epoch: 79, train_loss: 0.8709, test_loss: 0.9233, test_f1: 0.5075
 epoch: 80, train_loss: 0.8595, test_loss: 0.9278, test_f1: 0.5115
 epoch: 81, train_loss: 0.8776, test_loss: 0.9470, test_f1: 0.5078
 epoch: 82, train_loss: 0.8748, test_loss: 0.9576, test_f1: 0.5065
 epoch: 83, train_loss: 0.8687, test_loss: 0.9558, test_f1: 0.5128
 epoch: 84, train_loss: 0.8712, test_loss: 0.9606, test_f1: 0.5067
 epoch: 85, train_loss: 0.8632, test_loss: 0.9541, test_f1: 0.5065
 epoch: 86, train_loss: 0.8632, test_loss: 0.9580, test_f1: 0.5058
 epoch: 87, train_loss: 0.8595, test_loss: 0.9593, test_f1: 0.5048
 epoch: 88, train_loss: 0.8641, test_loss: 0.9534, test_f1: 0.5162
 epoch: 89, train_loss: 0.8583, test_loss: 0.9732, test_f1: 0.5032
 epoch: 90, train_loss: 0.8676, test_loss: 0.9515, test_f1: 0.5048
 epoch: 91, train_loss: 0.8623, test_loss: 0.9531, test_f1: 0.5066
 epoch: 92, train_loss: 0.8598, test_loss: 0.9410, test_f1: 0.5157
 epoch: 93, train_loss: 0.8650, test_loss: 0.9402, test_f1: 0.5137
 epoch: 94, train_loss: 0.8655, test_loss: 0.9581, test_f1: 0.5149
 epoch: 95, train_loss: 0.8634, test_loss: 0.9496, test_f1: 0.5117
 epoch: 96, train_loss: 0.8601, test_loss: 0.9647, test_f1: 0.5187
 epoch: 97, train_loss: 0.8599, test_loss: 0.9522, test_f1: 0.5380
 epoch: 98, train_loss: 0.8506, test_loss: 0.9519, test_f1: 0.5117
 epoch: 99, train_loss: 0.8567, test_loss: 0.9487, test_f1: 0.5165
##################ITERATION #4 ****************************************
 epoch: 0, train_loss: 1.2743, test_loss: 1.0930, test_f1: 0.3673
 epoch: 1, train_loss: 1.1420, test_loss: 1.0449, test_f1: 0.3862
 epoch: 2, train_loss: 1.1030, test_loss: 1.0263, test_f1: 0.4173
 epoch: 3, train_loss: 1.0809, test_loss: 1.0111, test_f1: 0.4269
 epoch: 4, train_loss: 1.0549, test_loss: 1.0091, test_f1: 0.4459
 epoch: 5, train_loss: 1.0409, test_loss: 1.0095, test_f1: 0.4438
 epoch: 6, train_loss: 1.0272, test_loss: 1.0047, test_f1: 0.4395
 epoch: 7, train_loss: 1.0183, test_loss: 0.9908, test_f1: 0.4728
 epoch: 8, train_loss: 1.0108, test_loss: 0.9987, test_f1: 0.4353
 epoch: 9, train_loss: 1.0038, test_loss: 0.9829, test_f1: 0.4739
 epoch: 10, train_loss: 0.9910, test_loss: 0.9547, test_f1: 0.4886
 epoch: 11, train_loss: 0.9830, test_loss: 0.9817, test_f1: 0.4737
 epoch: 12, train_loss: 0.9852, test_loss: 0.9747, test_f1: 0.4856
 epoch: 13, train_loss: 0.9913, test_loss: 0.9550, test_f1: 0.4656
 epoch: 14, train_loss: 0.9754, test_loss: 0.9654, test_f1: 0.4862
 epoch: 15, train_loss: 0.9660, test_loss: 0.9940, test_f1: 0.4806
 epoch: 16, train_loss: 0.9564, test_loss: 0.9877, test_f1: 0.4499
 epoch: 17, train_loss: 0.9627, test_loss: 0.9677, test_f1: 0.4815
 epoch: 18, train_loss: 0.9652, test_loss: 0.9814, test_f1: 0.4894
 epoch: 19, train_loss: 0.9572, test_loss: 0.9929, test_f1: 0.4778
 epoch: 20, train_loss: 0.9593, test_loss: 0.9994, test_f1: 0.5054
 epoch: 21, train_loss: 0.9483, test_loss: 0.9580, test_f1: 0.4840
 epoch: 22, train_loss: 0.9495, test_loss: 0.9841, test_f1: 0.4980
 epoch: 23, train_loss: 0.9447, test_loss: 0.9754, test_f1: 0.4853
 epoch: 24, train_loss: 0.9439, test_loss: 0.9675, test_f1: 0.4939
 epoch: 25, train_loss: 0.9383, test_loss: 0.9703, test_f1: 0.5084
 epoch: 26, train_loss: 0.9343, test_loss: 0.9680, test_f1: 0.5011
 epoch: 27, train_loss: 0.9326, test_loss: 0.9410, test_f1: 0.4915
 epoch: 28, train_loss: 0.9370, test_loss: 0.9763, test_f1: 0.4847
 epoch: 29, train_loss: 0.9264, test_loss: 0.9672, test_f1: 0.5283
 epoch: 30, train_loss: 0.9162, test_loss: 0.9536, test_f1: 0.5147
 epoch: 31, train_loss: 0.9186, test_loss: 0.9784, test_f1: 0.5058
 epoch: 32, train_loss: 0.9318, test_loss: 0.9397, test_f1: 0.5166
 epoch: 33, train_loss: 0.9253, test_loss: 0.9478, test_f1: 0.5000
 epoch: 34, train_loss: 0.9044, test_loss: 0.9666, test_f1: 0.4987
 epoch: 35, train_loss: 0.9119, test_loss: 0.9885, test_f1: 0.5088
 epoch: 36, train_loss: 0.9171, test_loss: 0.9480, test_f1: 0.4961
 epoch: 37, train_loss: 0.9017, test_loss: 0.9505, test_f1: 0.5293
 epoch: 38, train_loss: 0.8982, test_loss: 0.9404, test_f1: 0.5214
 epoch: 39, train_loss: 0.8898, test_loss: 0.9538, test_f1: 0.5133
 epoch: 40, train_loss: 0.8970, test_loss: 0.9427, test_f1: 0.5229
 epoch: 41, train_loss: 0.8931, test_loss: 0.9382, test_f1: 0.5396
 epoch: 42, train_loss: 0.8906, test_loss: 0.9389, test_f1: 0.5263
 epoch: 43, train_loss: 0.8840, test_loss: 0.9545, test_f1: 0.5003
 epoch: 44, train_loss: 0.8829, test_loss: 0.9481, test_f1: 0.5352
 epoch: 45, train_loss: 0.8766, test_loss: 0.9397, test_f1: 0.5091
 epoch: 46, train_loss: 0.8720, test_loss: 0.9517, test_f1: 0.5124
 epoch: 47, train_loss: 0.8774, test_loss: 0.9320, test_f1: 0.5259
 epoch: 48, train_loss: 0.8720, test_loss: 0.9486, test_f1: 0.5197
 epoch: 49, train_loss: 0.8743, test_loss: 0.9517, test_f1: 0.5053
 epoch: 50, train_loss: 0.8692, test_loss: 0.9546, test_f1: 0.5132
 epoch: 51, train_loss: 0.8609, test_loss: 0.9208, test_f1: 0.5245
 epoch: 52, train_loss: 0.8651, test_loss: 0.9130, test_f1: 0.5217
 epoch: 53, train_loss: 0.8681, test_loss: 0.9161, test_f1: 0.5172
 epoch: 54, train_loss: 0.8536, test_loss: 0.9228, test_f1: 0.5358
 epoch: 55, train_loss: 0.8629, test_loss: 0.9186, test_f1: 0.5048
 epoch: 56, train_loss: 0.8540, test_loss: 0.9162, test_f1: 0.5256
 epoch: 57, train_loss: 0.8535, test_loss: 0.9089, test_f1: 0.5246
 epoch: 58, train_loss: 0.8405, test_loss: 0.9263, test_f1: 0.5278
 epoch: 59, train_loss: 0.8491, test_loss: 0.9241, test_f1: 0.5436
 epoch: 60, train_loss: 0.8494, test_loss: 0.9171, test_f1: 0.5323
 epoch: 61, train_loss: 0.8536, test_loss: 0.9198, test_f1: 0.5469
 epoch: 62, train_loss: 0.8389, test_loss: 0.9122, test_f1: 0.5461
 epoch: 63, train_loss: 0.8577, test_loss: 0.9072, test_f1: 0.5434
 epoch: 64, train_loss: 0.8513, test_loss: 0.9391, test_f1: 0.5288
 epoch: 65, train_loss: 0.8376, test_loss: 0.9301, test_f1: 0.5188
 epoch: 66, train_loss: 0.8491, test_loss: 0.9069, test_f1: 0.5171
 epoch: 67, train_loss: 0.8525, test_loss: 0.9065, test_f1: 0.5183
 epoch: 68, train_loss: 0.8496, test_loss: 0.8997, test_f1: 0.5254
 epoch: 69, train_loss: 0.8425, test_loss: 0.9102, test_f1: 0.5266
 epoch: 70, train_loss: 0.8417, test_loss: 0.9130, test_f1: 0.5312
 epoch: 71, train_loss: 0.8420, test_loss: 0.9119, test_f1: 0.5282
 epoch: 72, train_loss: 0.8370, test_loss: 0.9069, test_f1: 0.5500
 epoch: 73, train_loss: 0.8325, test_loss: 0.9042, test_f1: 0.5594
 epoch: 74, train_loss: 0.8440, test_loss: 0.9182, test_f1: 0.5391
 epoch: 75, train_loss: 0.8489, test_loss: 0.9227, test_f1: 0.5524
 epoch: 76, train_loss: 0.8282, test_loss: 0.9099, test_f1: 0.5578
 epoch: 77, train_loss: 0.8249, test_loss: 0.9263, test_f1: 0.5385
 epoch: 78, train_loss: 0.8316, test_loss: 0.9225, test_f1: 0.5179
 epoch: 79, train_loss: 0.8295, test_loss: 0.9155, test_f1: 0.5555
 epoch: 80, train_loss: 0.8379, test_loss: 0.9112, test_f1: 0.5336
 epoch: 81, train_loss: 0.8218, test_loss: 0.9327, test_f1: 0.5278
 epoch: 82, train_loss: 0.8253, test_loss: 0.9345, test_f1: 0.5251
 epoch: 83, train_loss: 0.8249, test_loss: 0.9336, test_f1: 0.5394
 epoch: 84, train_loss: 0.8353, test_loss: 0.9480, test_f1: 0.5104
 epoch: 85, train_loss: 0.8280, test_loss: 0.9303, test_f1: 0.5557
 epoch: 86, train_loss: 0.8238, test_loss: 0.9148, test_f1: 0.5140
 epoch: 87, train_loss: 0.8294, test_loss: 0.9360, test_f1: 0.5608
 epoch: 88, train_loss: 0.8180, test_loss: 0.9171, test_f1: 0.5315
 epoch: 89, train_loss: 0.8298, test_loss: 0.8949, test_f1: 0.5430
 epoch: 90, train_loss: 0.8283, test_loss: 0.9190, test_f1: 0.5216
 epoch: 91, train_loss: 0.8247, test_loss: 0.9368, test_f1: 0.5398
 epoch: 92, train_loss: 0.8182, test_loss: 0.9265, test_f1: 0.5415
 epoch: 93, train_loss: 0.8239, test_loss: 0.9114, test_f1: 0.5702
 epoch: 94, train_loss: 0.8195, test_loss: 0.8976, test_f1: 0.5840
 epoch: 95, train_loss: 0.8276, test_loss: 0.9270, test_f1: 0.5658
 epoch: 96, train_loss: 0.8180, test_loss: 0.9049, test_f1: 0.5299
 epoch: 97, train_loss: 0.8127, test_loss: 0.9461, test_f1: 0.5461
 epoch: 98, train_loss: 0.8171, test_loss: 0.9057, test_f1: 0.5692
 epoch: 99, train_loss: 0.8192, test_loss: 0.9023, test_f1: 0.5760
##################ITERATION #5 ****************************************
 epoch: 0, train_loss: 1.3203, test_loss: 1.0803, test_f1: 0.3848
 epoch: 1, train_loss: 1.1280, test_loss: 1.0581, test_f1: 0.3884
 epoch: 2, train_loss: 1.0924, test_loss: 1.0459, test_f1: 0.4111
 epoch: 3, train_loss: 1.0573, test_loss: 1.0269, test_f1: 0.4432
 epoch: 4, train_loss: 1.0495, test_loss: 1.0357, test_f1: 0.4458
 epoch: 5, train_loss: 1.0380, test_loss: 1.0253, test_f1: 0.4444
 epoch: 6, train_loss: 1.0286, test_loss: 1.0134, test_f1: 0.4660
 epoch: 7, train_loss: 1.0110, test_loss: 1.0135, test_f1: 0.4604
 epoch: 8, train_loss: 1.0062, test_loss: 1.0136, test_f1: 0.4919
 epoch: 9, train_loss: 0.9977, test_loss: 1.0077, test_f1: 0.4830
 epoch: 10, train_loss: 0.9960, test_loss: 1.0201, test_f1: 0.4985
 epoch: 11, train_loss: 0.9897, test_loss: 1.0210, test_f1: 0.4957
 epoch: 12, train_loss: 0.9891, test_loss: 0.9947, test_f1: 0.4860
 epoch: 13, train_loss: 0.9861, test_loss: 0.9919, test_f1: 0.4822
 epoch: 14, train_loss: 0.9782, test_loss: 0.9971, test_f1: 0.5050
 epoch: 15, train_loss: 0.9857, test_loss: 1.0197, test_f1: 0.4970
 epoch: 16, train_loss: 0.9639, test_loss: 1.0159, test_f1: 0.4884
 epoch: 17, train_loss: 0.9683, test_loss: 0.9975, test_f1: 0.4686
 epoch: 18, train_loss: 0.9640, test_loss: 1.0189, test_f1: 0.4955
 epoch: 19, train_loss: 0.9639, test_loss: 1.0023, test_f1: 0.4717
 epoch: 20, train_loss: 0.9551, test_loss: 1.0161, test_f1: 0.5025
 epoch: 21, train_loss: 0.9566, test_loss: 0.9924, test_f1: 0.4919
 epoch: 22, train_loss: 0.9435, test_loss: 0.9994, test_f1: 0.4791
 epoch: 23, train_loss: 0.9610, test_loss: 1.0015, test_f1: 0.4686
 epoch: 24, train_loss: 0.9515, test_loss: 1.0005, test_f1: 0.4727
 epoch: 25, train_loss: 0.9460, test_loss: 1.0260, test_f1: 0.5053
 epoch: 26, train_loss: 0.9529, test_loss: 0.9988, test_f1: 0.5304
 epoch: 27, train_loss: 0.9448, test_loss: 1.0135, test_f1: 0.5119
 epoch: 28, train_loss: 0.9403, test_loss: 0.9994, test_f1: 0.5036
 epoch: 29, train_loss: 0.9421, test_loss: 0.9932, test_f1: 0.5075
 epoch: 30, train_loss: 0.9367, test_loss: 0.9664, test_f1: 0.5045
 epoch: 31, train_loss: 0.9269, test_loss: 0.9827, test_f1: 0.4879
 epoch: 32, train_loss: 0.9350, test_loss: 1.0082, test_f1: 0.4921
 epoch: 33, train_loss: 0.9313, test_loss: 0.9796, test_f1: 0.5152
 epoch: 34, train_loss: 0.9303, test_loss: 1.0033, test_f1: 0.4909
 epoch: 35, train_loss: 0.9238, test_loss: 0.9948, test_f1: 0.5269
 epoch: 36, train_loss: 0.9298, test_loss: 0.9758, test_f1: 0.5128
 epoch: 37, train_loss: 0.9230, test_loss: 0.9817, test_f1: 0.4976
 epoch: 38, train_loss: 0.9206, test_loss: 1.0015, test_f1: 0.4876
 epoch: 39, train_loss: 0.9194, test_loss: 0.9547, test_f1: 0.5199
 epoch: 40, train_loss: 0.9232, test_loss: 0.9705, test_f1: 0.5206
 epoch: 41, train_loss: 0.9175, test_loss: 0.9891, test_f1: 0.5138
 epoch: 42, train_loss: 0.9119, test_loss: 0.9752, test_f1: 0.5192
 epoch: 43, train_loss: 0.9012, test_loss: 0.9802, test_f1: 0.5122
 epoch: 44, train_loss: 0.8998, test_loss: 0.9843, test_f1: 0.5322
 epoch: 45, train_loss: 0.9107, test_loss: 0.9831, test_f1: 0.4991
 epoch: 46, train_loss: 0.8991, test_loss: 0.9697, test_f1: 0.5141
 epoch: 47, train_loss: 0.9014, test_loss: 0.9338, test_f1: 0.5378
 epoch: 48, train_loss: 0.9127, test_loss: 1.0210, test_f1: 0.4940
 epoch: 49, train_loss: 0.8981, test_loss: 0.9872, test_f1: 0.5198
 epoch: 50, train_loss: 0.9004, test_loss: 0.9577, test_f1: 0.5231
 epoch: 51, train_loss: 0.8898, test_loss: 0.9695, test_f1: 0.5191
 epoch: 52, train_loss: 0.8799, test_loss: 0.9669, test_f1: 0.5239
 epoch: 53, train_loss: 0.8773, test_loss: 0.9535, test_f1: 0.5221
 epoch: 54, train_loss: 0.8812, test_loss: 0.9619, test_f1: 0.5206
 epoch: 55, train_loss: 0.8776, test_loss: 0.9441, test_f1: 0.5168
 epoch: 56, train_loss: 0.8877, test_loss: 0.9629, test_f1: 0.5303
 epoch: 57, train_loss: 0.8781, test_loss: 0.9562, test_f1: 0.5239
 epoch: 58, train_loss: 0.8739, test_loss: 0.9583, test_f1: 0.5359
 epoch: 59, train_loss: 0.8797, test_loss: 0.9486, test_f1: 0.5519
 epoch: 60, train_loss: 0.8688, test_loss: 0.9468, test_f1: 0.5349
 epoch: 61, train_loss: 0.8771, test_loss: 0.9709, test_f1: 0.5386
 epoch: 62, train_loss: 0.8738, test_loss: 0.9662, test_f1: 0.5202
 epoch: 63, train_loss: 0.8874, test_loss: 0.9640, test_f1: 0.5201
 epoch: 64, train_loss: 0.8698, test_loss: 0.9620, test_f1: 0.5256
 epoch: 65, train_loss: 0.8809, test_loss: 0.9679, test_f1: 0.5247
 epoch: 66, train_loss: 0.8797, test_loss: 0.9625, test_f1: 0.5318
 epoch: 67, train_loss: 0.8742, test_loss: 0.9541, test_f1: 0.5419
 epoch: 68, train_loss: 0.8701, test_loss: 0.9630, test_f1: 0.5284
 epoch: 69, train_loss: 0.8656, test_loss: 0.9496, test_f1: 0.5463
 epoch: 70, train_loss: 0.8673, test_loss: 0.9520, test_f1: 0.5404
 epoch: 71, train_loss: 0.8665, test_loss: 0.9546, test_f1: 0.5444
 epoch: 72, train_loss: 0.8688, test_loss: 0.9672, test_f1: 0.5575
 epoch: 73, train_loss: 0.8625, test_loss: 0.9520, test_f1: 0.5746
 epoch: 74, train_loss: 0.8623, test_loss: 0.9588, test_f1: 0.5543
 epoch: 75, train_loss: 0.8675, test_loss: 0.9759, test_f1: 0.5692
 epoch: 76, train_loss: 0.8838, test_loss: 0.9686, test_f1: 0.5533
 epoch: 77, train_loss: 0.8743, test_loss: 0.9575, test_f1: 0.5475
 epoch: 78, train_loss: 0.8549, test_loss: 0.9436, test_f1: 0.5594
 epoch: 79, train_loss: 0.8680, test_loss: 0.9411, test_f1: 0.5591
 epoch: 80, train_loss: 0.8592, test_loss: 0.9455, test_f1: 0.5416
 epoch: 81, train_loss: 0.8602, test_loss: 0.9480, test_f1: 0.5408
 epoch: 82, train_loss: 0.8699, test_loss: 0.9483, test_f1: 0.5579
 epoch: 83, train_loss: 0.8528, test_loss: 0.9528, test_f1: 0.5601
 epoch: 84, train_loss: 0.8597, test_loss: 0.9659, test_f1: 0.5358
 epoch: 85, train_loss: 0.8718, test_loss: 0.9431, test_f1: 0.5541
 epoch: 86, train_loss: 0.8567, test_loss: 0.9509, test_f1: 0.5627
 epoch: 87, train_loss: 0.8653, test_loss: 0.9546, test_f1: 0.5391
 epoch: 88, train_loss: 0.8515, test_loss: 0.9569, test_f1: 0.5404
 epoch: 89, train_loss: 0.8486, test_loss: 0.9694, test_f1: 0.5497
 epoch: 90, train_loss: 0.8539, test_loss: 0.9561, test_f1: 0.5562
 epoch: 91, train_loss: 0.8586, test_loss: 0.9457, test_f1: 0.5455
 epoch: 92, train_loss: 0.8537, test_loss: 0.9548, test_f1: 0.5432
 epoch: 93, train_loss: 0.8518, test_loss: 0.9589, test_f1: 0.5415
 epoch: 94, train_loss: 0.8405, test_loss: 0.9744, test_f1: 0.5442
 epoch: 95, train_loss: 0.8565, test_loss: 0.9773, test_f1: 0.5119
 epoch: 96, train_loss: 0.8585, test_loss: 0.9647, test_f1: 0.5432
 epoch: 97, train_loss: 0.8461, test_loss: 0.9503, test_f1: 0.5467
 epoch: 98, train_loss: 0.8521, test_loss: 0.9417, test_f1: 0.5337
 epoch: 99, train_loss: 0.8500, test_loss: 0.9551, test_f1: 0.5569
##################ITERATION #6 ****************************************
 epoch: 0, train_loss: 1.2522, test_loss: 1.0778, test_f1: 0.3457
 epoch: 1, train_loss: 1.1275, test_loss: 1.0418, test_f1: 0.3529
 epoch: 2, train_loss: 1.0796, test_loss: 1.0257, test_f1: 0.3718
 epoch: 3, train_loss: 1.0559, test_loss: 1.0239, test_f1: 0.4027
 epoch: 4, train_loss: 1.0382, test_loss: 1.0137, test_f1: 0.4071
 epoch: 5, train_loss: 1.0303, test_loss: 1.0028, test_f1: 0.4277
 epoch: 6, train_loss: 1.0027, test_loss: 1.0096, test_f1: 0.4622
 epoch: 7, train_loss: 0.9956, test_loss: 1.0064, test_f1: 0.4382
 epoch: 8, train_loss: 0.9910, test_loss: 0.9735, test_f1: 0.4405
 epoch: 9, train_loss: 0.9857, test_loss: 1.0234, test_f1: 0.4097
 epoch: 10, train_loss: 0.9717, test_loss: 0.9742, test_f1: 0.4845
 epoch: 11, train_loss: 0.9769, test_loss: 1.0121, test_f1: 0.4319
 epoch: 12, train_loss: 0.9755, test_loss: 0.9574, test_f1: 0.4845
 epoch: 13, train_loss: 0.9672, test_loss: 0.9549, test_f1: 0.4604
 epoch: 14, train_loss: 0.9644, test_loss: 0.9819, test_f1: 0.4778
 epoch: 15, train_loss: 0.9423, test_loss: 0.9802, test_f1: 0.4906
 epoch: 16, train_loss: 0.9419, test_loss: 0.9863, test_f1: 0.4812
 epoch: 17, train_loss: 0.9516, test_loss: 0.9828, test_f1: 0.4640
 epoch: 18, train_loss: 0.9374, test_loss: 0.9389, test_f1: 0.5163
 epoch: 19, train_loss: 0.9371, test_loss: 0.9421, test_f1: 0.4854
 epoch: 20, train_loss: 0.9479, test_loss: 0.9271, test_f1: 0.4660
 epoch: 21, train_loss: 0.9274, test_loss: 0.9464, test_f1: 0.4905
 epoch: 22, train_loss: 0.9212, test_loss: 0.9170, test_f1: 0.4741
 epoch: 23, train_loss: 0.9255, test_loss: 0.9305, test_f1: 0.5028
 epoch: 24, train_loss: 0.9338, test_loss: 0.9319, test_f1: 0.5180
 epoch: 25, train_loss: 0.9246, test_loss: 0.9474, test_f1: 0.4994
 epoch: 26, train_loss: 0.9146, test_loss: 0.9297, test_f1: 0.5203
 epoch: 27, train_loss: 0.9180, test_loss: 0.9017, test_f1: 0.5120
 epoch: 28, train_loss: 0.8979, test_loss: 0.9042, test_f1: 0.5308
 epoch: 29, train_loss: 0.9028, test_loss: 0.9045, test_f1: 0.5181
 epoch: 30, train_loss: 0.9081, test_loss: 0.9313, test_f1: 0.5139
 epoch: 31, train_loss: 0.8972, test_loss: 0.9200, test_f1: 0.5371
 epoch: 32, train_loss: 0.8932, test_loss: 0.9096, test_f1: 0.5318
 epoch: 33, train_loss: 0.8946, test_loss: 0.9339, test_f1: 0.5118
 epoch: 34, train_loss: 0.8910, test_loss: 0.9379, test_f1: 0.5168
 epoch: 35, train_loss: 0.8890, test_loss: 0.9090, test_f1: 0.5166
 epoch: 36, train_loss: 0.8883, test_loss: 0.9175, test_f1: 0.5031
 epoch: 37, train_loss: 0.8824, test_loss: 0.9024, test_f1: 0.5347
 epoch: 38, train_loss: 0.8767, test_loss: 0.9099, test_f1: 0.5381
 epoch: 39, train_loss: 0.8869, test_loss: 0.8934, test_f1: 0.5329
 epoch: 40, train_loss: 0.8867, test_loss: 0.8958, test_f1: 0.5302
 epoch: 41, train_loss: 0.8695, test_loss: 0.9136, test_f1: 0.5265
 epoch: 42, train_loss: 0.8732, test_loss: 0.9076, test_f1: 0.5162
 epoch: 43, train_loss: 0.8665, test_loss: 0.9129, test_f1: 0.5176
 epoch: 44, train_loss: 0.8743, test_loss: 0.9398, test_f1: 0.4992
 epoch: 45, train_loss: 0.8673, test_loss: 0.8784, test_f1: 0.5299
 epoch: 46, train_loss: 0.8680, test_loss: 0.9039, test_f1: 0.5148
 epoch: 47, train_loss: 0.8609, test_loss: 0.8950, test_f1: 0.5323
 epoch: 48, train_loss: 0.8644, test_loss: 0.8925, test_f1: 0.5272
 epoch: 49, train_loss: 0.8604, test_loss: 0.8820, test_f1: 0.5481
 epoch: 50, train_loss: 0.8531, test_loss: 0.9237, test_f1: 0.5265
 epoch: 51, train_loss: 0.8541, test_loss: 0.8855, test_f1: 0.5233
 epoch: 52, train_loss: 0.8434, test_loss: 0.8797, test_f1: 0.5368
 epoch: 53, train_loss: 0.8316, test_loss: 0.8583, test_f1: 0.5323
 epoch: 54, train_loss: 0.8397, test_loss: 0.8850, test_f1: 0.5203
 epoch: 55, train_loss: 0.8439, test_loss: 0.8887, test_f1: 0.5298
 epoch: 56, train_loss: 0.8395, test_loss: 0.8899, test_f1: 0.5333
 epoch: 57, train_loss: 0.8527, test_loss: 0.8757, test_f1: 0.5303
 epoch: 58, train_loss: 0.8349, test_loss: 0.8918, test_f1: 0.5316
 epoch: 59, train_loss: 0.8273, test_loss: 0.8879, test_f1: 0.5454
 epoch: 60, train_loss: 0.8317, test_loss: 0.8881, test_f1: 0.5342
 epoch: 61, train_loss: 0.8237, test_loss: 0.9049, test_f1: 0.5383
 epoch: 62, train_loss: 0.8289, test_loss: 0.8976, test_f1: 0.5352
 epoch: 63, train_loss: 0.8211, test_loss: 0.8809, test_f1: 0.5408
 epoch: 64, train_loss: 0.8231, test_loss: 0.8840, test_f1: 0.5415
 epoch: 65, train_loss: 0.8360, test_loss: 0.8744, test_f1: 0.5414
 epoch: 66, train_loss: 0.8264, test_loss: 0.8752, test_f1: 0.5409
 epoch: 67, train_loss: 0.8284, test_loss: 0.8907, test_f1: 0.5409
 epoch: 68, train_loss: 0.8387, test_loss: 0.8832, test_f1: 0.5346
 epoch: 69, train_loss: 0.8345, test_loss: 0.8714, test_f1: 0.5382
 epoch: 70, train_loss: 0.8254, test_loss: 0.8759, test_f1: 0.5481
 epoch: 71, train_loss: 0.8190, test_loss: 0.8861, test_f1: 0.5584
 epoch: 72, train_loss: 0.8146, test_loss: 0.8947, test_f1: 0.5544
 epoch: 73, train_loss: 0.8191, test_loss: 0.8769, test_f1: 0.5369
 epoch: 74, train_loss: 0.8148, test_loss: 0.8923, test_f1: 0.5283
 epoch: 75, train_loss: 0.8129, test_loss: 0.8801, test_f1: 0.5637
 epoch: 76, train_loss: 0.8109, test_loss: 0.8680, test_f1: 0.5623
 epoch: 77, train_loss: 0.8071, test_loss: 0.8808, test_f1: 0.5414
 epoch: 78, train_loss: 0.8179, test_loss: 0.8896, test_f1: 0.5607
 epoch: 79, train_loss: 0.8090, test_loss: 0.8821, test_f1: 0.5467
 epoch: 80, train_loss: 0.8181, test_loss: 0.8777, test_f1: 0.5745
 epoch: 81, train_loss: 0.8053, test_loss: 0.8753, test_f1: 0.5652
 epoch: 82, train_loss: 0.8166, test_loss: 0.8971, test_f1: 0.5423
 epoch: 83, train_loss: 0.8095, test_loss: 0.8837, test_f1: 0.5368
 epoch: 84, train_loss: 0.8005, test_loss: 0.9136, test_f1: 0.5366
 epoch: 85, train_loss: 0.8171, test_loss: 0.8868, test_f1: 0.5570
 epoch: 86, train_loss: 0.8109, test_loss: 0.8811, test_f1: 0.5685
 epoch: 87, train_loss: 0.8110, test_loss: 0.8836, test_f1: 0.5555
 epoch: 88, train_loss: 0.8193, test_loss: 0.8764, test_f1: 0.5643
 epoch: 89, train_loss: 0.8129, test_loss: 0.8768, test_f1: 0.5422
 epoch: 90, train_loss: 0.8144, test_loss: 0.8746, test_f1: 0.5509
 epoch: 91, train_loss: 0.7976, test_loss: 0.8710, test_f1: 0.5453
 epoch: 92, train_loss: 0.7997, test_loss: 0.8728, test_f1: 0.5590
 epoch: 93, train_loss: 0.7994, test_loss: 0.8844, test_f1: 0.5530
 epoch: 94, train_loss: 0.8081, test_loss: 0.8642, test_f1: 0.5374
 epoch: 95, train_loss: 0.7967, test_loss: 0.8700, test_f1: 0.5764
 epoch: 96, train_loss: 0.8034, test_loss: 0.8628, test_f1: 0.5924
 epoch: 97, train_loss: 0.8001, test_loss: 0.8632, test_f1: 0.5691
 epoch: 98, train_loss: 0.7916, test_loss: 0.8591, test_f1: 0.5479
 epoch: 99, train_loss: 0.8023, test_loss: 0.8794, test_f1: 0.5787
##################ITERATION #7 ****************************************
 epoch: 0, train_loss: 1.2627, test_loss: 1.0863, test_f1: 0.4196
 epoch: 1, train_loss: 1.1258, test_loss: 1.0509, test_f1: 0.4422
 epoch: 2, train_loss: 1.0921, test_loss: 1.0173, test_f1: 0.4344
 epoch: 3, train_loss: 1.0573, test_loss: 1.0008, test_f1: 0.4223
 epoch: 4, train_loss: 1.0562, test_loss: 0.9919, test_f1: 0.4262
 epoch: 5, train_loss: 1.0370, test_loss: 1.0196, test_f1: 0.4413
 epoch: 6, train_loss: 1.0261, test_loss: 0.9762, test_f1: 0.4235
 epoch: 7, train_loss: 1.0119, test_loss: 0.9883, test_f1: 0.4490
 epoch: 8, train_loss: 1.0135, test_loss: 1.0030, test_f1: 0.4451
 epoch: 9, train_loss: 0.9957, test_loss: 0.9640, test_f1: 0.4568
 epoch: 10, train_loss: 0.9904, test_loss: 0.9935, test_f1: 0.4565
 epoch: 11, train_loss: 0.9829, test_loss: 0.9874, test_f1: 0.4454
 epoch: 12, train_loss: 0.9822, test_loss: 0.9788, test_f1: 0.4589
 epoch: 13, train_loss: 0.9688, test_loss: 0.9992, test_f1: 0.4431
 epoch: 14, train_loss: 0.9714, test_loss: 0.9743, test_f1: 0.4694
 epoch: 15, train_loss: 0.9634, test_loss: 0.9859, test_f1: 0.4705
 epoch: 16, train_loss: 0.9570, test_loss: 0.9810, test_f1: 0.4561
 epoch: 17, train_loss: 0.9538, test_loss: 0.9877, test_f1: 0.4654
 epoch: 18, train_loss: 0.9428, test_loss: 1.0075, test_f1: 0.4446
 epoch: 19, train_loss: 0.9416, test_loss: 0.9707, test_f1: 0.4765
 epoch: 20, train_loss: 0.9259, test_loss: 0.9950, test_f1: 0.4672
 epoch: 21, train_loss: 0.9352, test_loss: 0.9895, test_f1: 0.4700
 epoch: 22, train_loss: 0.9247, test_loss: 0.9837, test_f1: 0.4711
 epoch: 23, train_loss: 0.9348, test_loss: 0.9823, test_f1: 0.4715
 epoch: 24, train_loss: 0.9242, test_loss: 1.0199, test_f1: 0.4686
 epoch: 25, train_loss: 0.9269, test_loss: 0.9784, test_f1: 0.4753
 epoch: 26, train_loss: 0.9297, test_loss: 0.9558, test_f1: 0.4746
 epoch: 27, train_loss: 0.9167, test_loss: 0.9566, test_f1: 0.4931
 epoch: 28, train_loss: 0.9280, test_loss: 0.9550, test_f1: 0.4829
 epoch: 29, train_loss: 0.9137, test_loss: 0.9480, test_f1: 0.4866
 epoch: 30, train_loss: 0.9165, test_loss: 0.9561, test_f1: 0.4968
 epoch: 31, train_loss: 0.9183, test_loss: 0.9535, test_f1: 0.4751
 epoch: 32, train_loss: 0.9043, test_loss: 0.9336, test_f1: 0.4884
 epoch: 33, train_loss: 0.9113, test_loss: 0.9748, test_f1: 0.4704
 epoch: 34, train_loss: 0.9018, test_loss: 0.9790, test_f1: 0.4806
 epoch: 35, train_loss: 0.9155, test_loss: 0.9483, test_f1: 0.5070
 epoch: 36, train_loss: 0.8893, test_loss: 0.9541, test_f1: 0.5016
 epoch: 37, train_loss: 0.8997, test_loss: 0.9640, test_f1: 0.4964
 epoch: 38, train_loss: 0.8997, test_loss: 0.9573, test_f1: 0.5168
 epoch: 39, train_loss: 0.8921, test_loss: 0.9702, test_f1: 0.4881
 epoch: 40, train_loss: 0.8845, test_loss: 0.9586, test_f1: 0.5086
 epoch: 41, train_loss: 0.8923, test_loss: 0.9671, test_f1: 0.4904
 epoch: 42, train_loss: 0.8943, test_loss: 0.9741, test_f1: 0.4838
 epoch: 43, train_loss: 0.8899, test_loss: 0.9697, test_f1: 0.5113
 epoch: 44, train_loss: 0.8924, test_loss: 0.9524, test_f1: 0.4973
 epoch: 45, train_loss: 0.8869, test_loss: 0.9766, test_f1: 0.5068
 epoch: 46, train_loss: 0.8848, test_loss: 0.9494, test_f1: 0.4962
 epoch: 47, train_loss: 0.8785, test_loss: 0.9699, test_f1: 0.4977
 epoch: 48, train_loss: 0.8818, test_loss: 0.9625, test_f1: 0.4921
 epoch: 49, train_loss: 0.8733, test_loss: 0.9533, test_f1: 0.5128
 epoch: 50, train_loss: 0.8710, test_loss: 0.9668, test_f1: 0.4956
 epoch: 51, train_loss: 0.8656, test_loss: 0.9482, test_f1: 0.5035
 epoch: 52, train_loss: 0.8668, test_loss: 0.9516, test_f1: 0.5033
 epoch: 53, train_loss: 0.8697, test_loss: 0.9793, test_f1: 0.4943
 epoch: 54, train_loss: 0.8485, test_loss: 0.9532, test_f1: 0.5121
 epoch: 55, train_loss: 0.8692, test_loss: 0.9714, test_f1: 0.5019
 epoch: 56, train_loss: 0.8584, test_loss: 0.9709, test_f1: 0.4962
 epoch: 57, train_loss: 0.8681, test_loss: 0.9867, test_f1: 0.5039
 epoch: 58, train_loss: 0.8565, test_loss: 0.9564, test_f1: 0.4989
 epoch: 59, train_loss: 0.8607, test_loss: 0.9721, test_f1: 0.5047
 epoch: 60, train_loss: 0.8541, test_loss: 0.9658, test_f1: 0.5044
 epoch: 61, train_loss: 0.8617, test_loss: 0.9565, test_f1: 0.5115
 epoch: 62, train_loss: 0.8614, test_loss: 0.9695, test_f1: 0.5044
 epoch: 63, train_loss: 0.8629, test_loss: 0.9782, test_f1: 0.5242
 epoch: 64, train_loss: 0.8516, test_loss: 0.9646, test_f1: 0.5038
 epoch: 65, train_loss: 0.8489, test_loss: 0.9772, test_f1: 0.5146
 epoch: 66, train_loss: 0.8582, test_loss: 0.9561, test_f1: 0.5172
 epoch: 67, train_loss: 0.8546, test_loss: 0.9942, test_f1: 0.5050
 epoch: 68, train_loss: 0.8614, test_loss: 0.9753, test_f1: 0.4992
 epoch: 69, train_loss: 0.8465, test_loss: 0.9855, test_f1: 0.5028
 epoch: 70, train_loss: 0.8508, test_loss: 0.9689, test_f1: 0.5042
 epoch: 71, train_loss: 0.8400, test_loss: 0.9610, test_f1: 0.5248
 epoch: 72, train_loss: 0.8472, test_loss: 0.9695, test_f1: 0.4985
 epoch: 73, train_loss: 0.8428, test_loss: 0.9618, test_f1: 0.5109
 epoch: 74, train_loss: 0.8481, test_loss: 0.9736, test_f1: 0.5062
 epoch: 75, train_loss: 0.8429, test_loss: 0.9726, test_f1: 0.5043
 epoch: 76, train_loss: 0.8537, test_loss: 0.9685, test_f1: 0.5106
 epoch: 77, train_loss: 0.8561, test_loss: 0.9907, test_f1: 0.5068
 epoch: 78, train_loss: 0.8392, test_loss: 0.9565, test_f1: 0.5043
 epoch: 79, train_loss: 0.8392, test_loss: 0.9639, test_f1: 0.5029
 epoch: 80, train_loss: 0.8296, test_loss: 0.9594, test_f1: 0.5106
 epoch: 81, train_loss: 0.8448, test_loss: 0.9559, test_f1: 0.5117
 epoch: 82, train_loss: 0.8421, test_loss: 0.9762, test_f1: 0.5020
 epoch: 83, train_loss: 0.8389, test_loss: 0.9574, test_f1: 0.5073
 epoch: 84, train_loss: 0.8397, test_loss: 0.9613, test_f1: 0.5178
 epoch: 85, train_loss: 0.8314, test_loss: 0.9845, test_f1: 0.4853
 epoch: 86, train_loss: 0.8260, test_loss: 0.9743, test_f1: 0.5046
 epoch: 87, train_loss: 0.8396, test_loss: 0.9548, test_f1: 0.5153
 epoch: 88, train_loss: 0.8332, test_loss: 0.9690, test_f1: 0.5138
 epoch: 89, train_loss: 0.8345, test_loss: 0.9774, test_f1: 0.5115
 epoch: 90, train_loss: 0.8319, test_loss: 0.9827, test_f1: 0.5103
 epoch: 91, train_loss: 0.8324, test_loss: 0.9872, test_f1: 0.4962
 epoch: 92, train_loss: 0.8259, test_loss: 0.9735, test_f1: 0.5040
 epoch: 93, train_loss: 0.8193, test_loss: 0.9898, test_f1: 0.5066
 epoch: 94, train_loss: 0.8386, test_loss: 0.9960, test_f1: 0.5021
 epoch: 95, train_loss: 0.8331, test_loss: 0.9748, test_f1: 0.5103
 epoch: 96, train_loss: 0.8289, test_loss: 0.9836, test_f1: 0.4932
 epoch: 97, train_loss: 0.8225, test_loss: 0.9790, test_f1: 0.5080
 epoch: 98, train_loss: 0.8221, test_loss: 1.0039, test_f1: 0.4945
 epoch: 99, train_loss: 0.8243, test_loss: 1.0122, test_f1: 0.4954
##################ITERATION #8 ****************************************
 epoch: 0, train_loss: 1.2815, test_loss: 1.0678, test_f1: 0.4059
 epoch: 1, train_loss: 1.1352, test_loss: 1.0343, test_f1: 0.4526
 epoch: 2, train_loss: 1.0872, test_loss: 1.0045, test_f1: 0.4656
 epoch: 3, train_loss: 1.0639, test_loss: 0.9965, test_f1: 0.4460
 epoch: 4, train_loss: 1.0293, test_loss: 0.9976, test_f1: 0.4630
 epoch: 5, train_loss: 1.0098, test_loss: 0.9848, test_f1: 0.4641
 epoch: 6, train_loss: 1.0033, test_loss: 0.9836, test_f1: 0.4740
 epoch: 7, train_loss: 1.0046, test_loss: 0.9899, test_f1: 0.4645
 epoch: 8, train_loss: 0.9874, test_loss: 0.9870, test_f1: 0.4763
 epoch: 9, train_loss: 0.9903, test_loss: 0.9637, test_f1: 0.4787
 epoch: 10, train_loss: 0.9772, test_loss: 0.9831, test_f1: 0.4881
 epoch: 11, train_loss: 0.9673, test_loss: 0.9681, test_f1: 0.4929
 epoch: 12, train_loss: 0.9659, test_loss: 0.9950, test_f1: 0.4933
 epoch: 13, train_loss: 0.9629, test_loss: 0.9555, test_f1: 0.5055
 epoch: 14, train_loss: 0.9661, test_loss: 0.9796, test_f1: 0.4964
 epoch: 15, train_loss: 0.9486, test_loss: 0.9449, test_f1: 0.5192
 epoch: 16, train_loss: 0.9355, test_loss: 0.9519, test_f1: 0.5141
 epoch: 17, train_loss: 0.9476, test_loss: 0.9707, test_f1: 0.5307
 epoch: 18, train_loss: 0.9535, test_loss: 0.9581, test_f1: 0.5071
 epoch: 19, train_loss: 0.9491, test_loss: 0.9576, test_f1: 0.5079
 epoch: 20, train_loss: 0.9387, test_loss: 0.9511, test_f1: 0.5151
 epoch: 21, train_loss: 0.9274, test_loss: 0.9587, test_f1: 0.5110
 epoch: 22, train_loss: 0.9458, test_loss: 0.9377, test_f1: 0.5164
 epoch: 23, train_loss: 0.9333, test_loss: 0.9323, test_f1: 0.5311
 epoch: 24, train_loss: 0.9170, test_loss: 0.9284, test_f1: 0.5238
 epoch: 25, train_loss: 0.9257, test_loss: 0.9338, test_f1: 0.5214
 epoch: 26, train_loss: 0.9195, test_loss: 0.9428, test_f1: 0.5059
 epoch: 27, train_loss: 0.9160, test_loss: 0.9391, test_f1: 0.5319
 epoch: 28, train_loss: 0.9226, test_loss: 0.9273, test_f1: 0.5274
 epoch: 29, train_loss: 0.9215, test_loss: 0.9338, test_f1: 0.5253
 epoch: 30, train_loss: 0.9222, test_loss: 0.9303, test_f1: 0.5276
 epoch: 31, train_loss: 0.9037, test_loss: 0.9352, test_f1: 0.5315
 epoch: 32, train_loss: 0.9092, test_loss: 0.9351, test_f1: 0.5284
 epoch: 33, train_loss: 0.9028, test_loss: 0.9365, test_f1: 0.5231
 epoch: 34, train_loss: 0.9089, test_loss: 0.9258, test_f1: 0.5377
 epoch: 35, train_loss: 0.9056, test_loss: 0.9286, test_f1: 0.5262
 epoch: 36, train_loss: 0.8975, test_loss: 0.9281, test_f1: 0.5172
 epoch: 37, train_loss: 0.9017, test_loss: 0.9142, test_f1: 0.5383
 epoch: 38, train_loss: 0.8922, test_loss: 0.9344, test_f1: 0.5276
 epoch: 39, train_loss: 0.8877, test_loss: 0.9017, test_f1: 0.5521
 epoch: 40, train_loss: 0.8816, test_loss: 0.9134, test_f1: 0.5435
 epoch: 41, train_loss: 0.9024, test_loss: 0.9199, test_f1: 0.5367
 epoch: 42, train_loss: 0.8788, test_loss: 0.9051, test_f1: 0.5380
 epoch: 43, train_loss: 0.8781, test_loss: 0.9104, test_f1: 0.5437
 epoch: 44, train_loss: 0.8776, test_loss: 0.9041, test_f1: 0.5441
 epoch: 45, train_loss: 0.8818, test_loss: 0.9028, test_f1: 0.5421
 epoch: 46, train_loss: 0.8871, test_loss: 0.9118, test_f1: 0.5296
 epoch: 47, train_loss: 0.8905, test_loss: 0.8916, test_f1: 0.5371
 epoch: 48, train_loss: 0.8865, test_loss: 0.9108, test_f1: 0.5424
 epoch: 49, train_loss: 0.8794, test_loss: 0.9070, test_f1: 0.5334
 epoch: 50, train_loss: 0.8698, test_loss: 0.8927, test_f1: 0.5486
 epoch: 51, train_loss: 0.8630, test_loss: 0.8890, test_f1: 0.5387
 epoch: 52, train_loss: 0.8699, test_loss: 0.8885, test_f1: 0.5439
 epoch: 53, train_loss: 0.8596, test_loss: 0.8980, test_f1: 0.5451
 epoch: 54, train_loss: 0.8715, test_loss: 0.8889, test_f1: 0.5469
 epoch: 55, train_loss: 0.8691, test_loss: 0.8877, test_f1: 0.5419
 epoch: 56, train_loss: 0.8645, test_loss: 0.9028, test_f1: 0.5359
 epoch: 57, train_loss: 0.8734, test_loss: 0.8878, test_f1: 0.5538
 epoch: 58, train_loss: 0.8691, test_loss: 0.9002, test_f1: 0.5404
 epoch: 59, train_loss: 0.8639, test_loss: 0.9004, test_f1: 0.5481
 epoch: 60, train_loss: 0.8595, test_loss: 0.8944, test_f1: 0.5488
 epoch: 61, train_loss: 0.8527, test_loss: 0.9067, test_f1: 0.5543
 epoch: 62, train_loss: 0.8618, test_loss: 0.8982, test_f1: 0.5467
 epoch: 63, train_loss: 0.8529, test_loss: 0.8913, test_f1: 0.5402
 epoch: 64, train_loss: 0.8602, test_loss: 0.8901, test_f1: 0.5358
 epoch: 65, train_loss: 0.8547, test_loss: 0.8871, test_f1: 0.5392
 epoch: 66, train_loss: 0.8592, test_loss: 0.8988, test_f1: 0.5348
 epoch: 67, train_loss: 0.8599, test_loss: 0.8852, test_f1: 0.5375
 epoch: 68, train_loss: 0.8537, test_loss: 0.8975, test_f1: 0.5254
 epoch: 69, train_loss: 0.8506, test_loss: 0.8924, test_f1: 0.5442
 epoch: 70, train_loss: 0.8580, test_loss: 0.8860, test_f1: 0.5350
 epoch: 71, train_loss: 0.8538, test_loss: 0.8961, test_f1: 0.5404
 epoch: 72, train_loss: 0.8550, test_loss: 0.8939, test_f1: 0.5546
 epoch: 73, train_loss: 0.8493, test_loss: 0.8824, test_f1: 0.5467
 epoch: 74, train_loss: 0.8560, test_loss: 0.8894, test_f1: 0.5439
 epoch: 75, train_loss: 0.8630, test_loss: 0.8948, test_f1: 0.5422
 epoch: 76, train_loss: 0.8515, test_loss: 0.9019, test_f1: 0.5401
 epoch: 77, train_loss: 0.8462, test_loss: 0.9025, test_f1: 0.5404
 epoch: 78, train_loss: 0.8518, test_loss: 0.8864, test_f1: 0.5451
 epoch: 79, train_loss: 0.8493, test_loss: 0.8799, test_f1: 0.5497
 epoch: 80, train_loss: 0.8451, test_loss: 0.8905, test_f1: 0.5430
 epoch: 81, train_loss: 0.8447, test_loss: 0.8888, test_f1: 0.5389
 epoch: 82, train_loss: 0.8451, test_loss: 0.8814, test_f1: 0.5484
 epoch: 83, train_loss: 0.8484, test_loss: 0.8861, test_f1: 0.5475
 epoch: 84, train_loss: 0.8589, test_loss: 0.8914, test_f1: 0.5462
 epoch: 85, train_loss: 0.8470, test_loss: 0.8928, test_f1: 0.5462
 epoch: 86, train_loss: 0.8445, test_loss: 0.8914, test_f1: 0.5515
 epoch: 87, train_loss: 0.8342, test_loss: 0.8836, test_f1: 0.5536
 epoch: 88, train_loss: 0.8385, test_loss: 0.8937, test_f1: 0.5492
 epoch: 89, train_loss: 0.8507, test_loss: 0.8873, test_f1: 0.5437
 epoch: 90, train_loss: 0.8465, test_loss: 0.8888, test_f1: 0.5477
 epoch: 91, train_loss: 0.8470, test_loss: 0.8951, test_f1: 0.5471
 epoch: 92, train_loss: 0.8482, test_loss: 0.8929, test_f1: 0.5462
 epoch: 93, train_loss: 0.8508, test_loss: 0.8715, test_f1: 0.5455
 epoch: 94, train_loss: 0.8530, test_loss: 0.8819, test_f1: 0.5289
 epoch: 95, train_loss: 0.8404, test_loss: 0.8840, test_f1: 0.5339
 epoch: 96, train_loss: 0.8333, test_loss: 0.8814, test_f1: 0.5530
 epoch: 97, train_loss: 0.8305, test_loss: 0.8840, test_f1: 0.5346
 epoch: 98, train_loss: 0.8325, test_loss: 0.8920, test_f1: 0.5498
 epoch: 99, train_loss: 0.8475, test_loss: 0.8940, test_f1: 0.5475
##################ITERATION #9 ****************************************
 epoch: 0, train_loss: 1.4436, test_loss: 1.2125, test_f1: 0.3910
 epoch: 1, train_loss: 1.1884, test_loss: 1.1021, test_f1: 0.4153
 epoch: 2, train_loss: 1.1252, test_loss: 1.0579, test_f1: 0.4690
 epoch: 3, train_loss: 1.0879, test_loss: 1.0488, test_f1: 0.4550
 epoch: 4, train_loss: 1.0722, test_loss: 1.0249, test_f1: 0.4573
 epoch: 5, train_loss: 1.0533, test_loss: 1.0258, test_f1: 0.4760
 epoch: 6, train_loss: 1.0385, test_loss: 1.0144, test_f1: 0.4918
 epoch: 7, train_loss: 1.0087, test_loss: 1.0172, test_f1: 0.4850
 epoch: 8, train_loss: 1.0144, test_loss: 0.9957, test_f1: 0.4664
 epoch: 9, train_loss: 1.0101, test_loss: 0.9950, test_f1: 0.4779
 epoch: 10, train_loss: 1.0009, test_loss: 0.9888, test_f1: 0.4841
 epoch: 11, train_loss: 1.0086, test_loss: 1.0067, test_f1: 0.4883
 epoch: 12, train_loss: 0.9872, test_loss: 0.9830, test_f1: 0.4863
 epoch: 13, train_loss: 0.9872, test_loss: 0.9909, test_f1: 0.5192
 epoch: 14, train_loss: 0.9892, test_loss: 0.9914, test_f1: 0.5117
 epoch: 15, train_loss: 0.9856, test_loss: 0.9888, test_f1: 0.5275
 epoch: 16, train_loss: 0.9738, test_loss: 0.9899, test_f1: 0.5391
 epoch: 17, train_loss: 0.9745, test_loss: 1.0037, test_f1: 0.5058
 epoch: 18, train_loss: 0.9657, test_loss: 0.9711, test_f1: 0.5068
 epoch: 19, train_loss: 0.9565, test_loss: 0.9801, test_f1: 0.5108
 epoch: 20, train_loss: 0.9618, test_loss: 0.9850, test_f1: 0.5091
 epoch: 21, train_loss: 0.9556, test_loss: 0.9803, test_f1: 0.4983
 epoch: 22, train_loss: 0.9404, test_loss: 0.9734, test_f1: 0.4836
 epoch: 23, train_loss: 0.9539, test_loss: 0.9750, test_f1: 0.4999
 epoch: 24, train_loss: 0.9502, test_loss: 0.9626, test_f1: 0.4990
 epoch: 25, train_loss: 0.9437, test_loss: 0.9452, test_f1: 0.4874
 epoch: 26, train_loss: 0.9429, test_loss: 0.9729, test_f1: 0.4949
 epoch: 27, train_loss: 0.9238, test_loss: 0.9684, test_f1: 0.5012
 epoch: 28, train_loss: 0.9442, test_loss: 0.9626, test_f1: 0.5045
 epoch: 29, train_loss: 0.9325, test_loss: 0.9170, test_f1: 0.5117
 epoch: 30, train_loss: 0.9241, test_loss: 0.9465, test_f1: 0.5011
 epoch: 31, train_loss: 0.9378, test_loss: 0.9657, test_f1: 0.5008
 epoch: 32, train_loss: 0.9300, test_loss: 0.9432, test_f1: 0.5007
 epoch: 33, train_loss: 0.9422, test_loss: 0.9704, test_f1: 0.5124
 epoch: 34, train_loss: 0.9312, test_loss: 0.9502, test_f1: 0.5187
 epoch: 35, train_loss: 0.9207, test_loss: 0.9531, test_f1: 0.5123
 epoch: 36, train_loss: 0.9269, test_loss: 0.9422, test_f1: 0.5085
 epoch: 37, train_loss: 0.9171, test_loss: 0.9149, test_f1: 0.5048
 epoch: 38, train_loss: 0.9242, test_loss: 0.9118, test_f1: 0.5017
 epoch: 39, train_loss: 0.9214, test_loss: 0.9387, test_f1: 0.5194
 epoch: 40, train_loss: 0.9087, test_loss: 0.9560, test_f1: 0.5147
 epoch: 41, train_loss: 0.9161, test_loss: 0.9309, test_f1: 0.5151
 epoch: 42, train_loss: 0.9107, test_loss: 0.9145, test_f1: 0.5162
 epoch: 43, train_loss: 0.9202, test_loss: 0.9102, test_f1: 0.5077
 epoch: 44, train_loss: 0.9151, test_loss: 0.9188, test_f1: 0.4977
 epoch: 45, train_loss: 0.9094, test_loss: 0.9150, test_f1: 0.5165
 epoch: 46, train_loss: 0.8960, test_loss: 0.9396, test_f1: 0.5048
 epoch: 47, train_loss: 0.9047, test_loss: 0.9166, test_f1: 0.5183
 epoch: 48, train_loss: 0.8981, test_loss: 0.9276, test_f1: 0.5100
 epoch: 49, train_loss: 0.9015, test_loss: 0.8866, test_f1: 0.5536
 epoch: 50, train_loss: 0.9084, test_loss: 0.9132, test_f1: 0.5434
 epoch: 51, train_loss: 0.8925, test_loss: 0.9095, test_f1: 0.5260
 epoch: 52, train_loss: 0.8796, test_loss: 0.9147, test_f1: 0.5245
 epoch: 53, train_loss: 0.8938, test_loss: 0.9244, test_f1: 0.5347
 epoch: 54, train_loss: 0.8859, test_loss: 0.9178, test_f1: 0.5226
 epoch: 55, train_loss: 0.8868, test_loss: 0.8916, test_f1: 0.5240
 epoch: 56, train_loss: 0.8770, test_loss: 0.8976, test_f1: 0.5170
 epoch: 57, train_loss: 0.8833, test_loss: 0.8832, test_f1: 0.5520
 epoch: 58, train_loss: 0.8767, test_loss: 0.9000, test_f1: 0.5313
 epoch: 59, train_loss: 0.8838, test_loss: 0.8941, test_f1: 0.5490
 epoch: 60, train_loss: 0.8773, test_loss: 0.8947, test_f1: 0.5253
 epoch: 61, train_loss: 0.8814, test_loss: 0.8921, test_f1: 0.5463
 epoch: 62, train_loss: 0.8737, test_loss: 0.9062, test_f1: 0.5287
 epoch: 63, train_loss: 0.8840, test_loss: 0.8868, test_f1: 0.5359
 epoch: 64, train_loss: 0.8705, test_loss: 0.8901, test_f1: 0.5325
 epoch: 65, train_loss: 0.8737, test_loss: 0.8983, test_f1: 0.5278
 epoch: 66, train_loss: 0.8791, test_loss: 0.8863, test_f1: 0.5152
 epoch: 67, train_loss: 0.8654, test_loss: 0.8953, test_f1: 0.5341
 epoch: 68, train_loss: 0.8682, test_loss: 0.8887, test_f1: 0.5222
 epoch: 69, train_loss: 0.8741, test_loss: 0.8852, test_f1: 0.5166
 epoch: 70, train_loss: 0.8562, test_loss: 0.8849, test_f1: 0.5123
 epoch: 71, train_loss: 0.8739, test_loss: 0.8988, test_f1: 0.5015
 epoch: 72, train_loss: 0.8614, test_loss: 0.8772, test_f1: 0.5308
 epoch: 73, train_loss: 0.8614, test_loss: 0.9275, test_f1: 0.5312
 epoch: 74, train_loss: 0.8547, test_loss: 0.8776, test_f1: 0.5166
 epoch: 75, train_loss: 0.8665, test_loss: 0.8815, test_f1: 0.5260
 epoch: 76, train_loss: 0.8695, test_loss: 0.9155, test_f1: 0.5447
 epoch: 77, train_loss: 0.8609, test_loss: 0.8866, test_f1: 0.5382
 epoch: 78, train_loss: 0.8600, test_loss: 0.8801, test_f1: 0.5297
 epoch: 79, train_loss: 0.8671, test_loss: 0.8617, test_f1: 0.5338
 epoch: 80, train_loss: 0.8559, test_loss: 0.8925, test_f1: 0.5225
 epoch: 81, train_loss: 0.8528, test_loss: 0.8713, test_f1: 0.5490
 epoch: 82, train_loss: 0.8584, test_loss: 0.8825, test_f1: 0.5256
 epoch: 83, train_loss: 0.8604, test_loss: 0.8831, test_f1: 0.5436
 epoch: 84, train_loss: 0.8557, test_loss: 0.8684, test_f1: 0.5337
 epoch: 85, train_loss: 0.8440, test_loss: 0.8730, test_f1: 0.5258
 epoch: 86, train_loss: 0.8570, test_loss: 0.8577, test_f1: 0.5159
 epoch: 87, train_loss: 0.8602, test_loss: 0.8563, test_f1: 0.5510
 epoch: 88, train_loss: 0.8485, test_loss: 0.8622, test_f1: 0.5463
 epoch: 89, train_loss: 0.8614, test_loss: 0.8744, test_f1: 0.5248
 epoch: 90, train_loss: 0.8540, test_loss: 0.8777, test_f1: 0.5228
 epoch: 91, train_loss: 0.8526, test_loss: 0.8865, test_f1: 0.5225
 epoch: 92, train_loss: 0.8537, test_loss: 0.8714, test_f1: 0.5604
 epoch: 93, train_loss: 0.8467, test_loss: 0.8700, test_f1: 0.5374
 epoch: 94, train_loss: 0.8498, test_loss: 0.8580, test_f1: 0.5320
 epoch: 95, train_loss: 0.8402, test_loss: 0.8800, test_f1: 0.5458
 epoch: 96, train_loss: 0.8452, test_loss: 0.8643, test_f1: 0.5720
 epoch: 97, train_loss: 0.8394, test_loss: 0.8846, test_f1: 0.5433
 epoch: 98, train_loss: 0.8426, test_loss: 0.8388, test_f1: 0.5522
 epoch: 99, train_loss: 0.8369, test_loss: 0.8783, test_f1: 0.5060

Training completed in 785.23 seconds
Best F1: 0.5924 at epoch 96
Mean F1 across iterations: 0.5619  0.0199
========================FINAL RESULTS================================
FEGIN weighted F1: 0.5924  0.0199
python main.py --data ltspice_examples --representation component_net --model FEGIN --layers 2 --hiddens 16 --batch_size 32 --lr 0.001 --emb_size 250 --epochs 100 --save_appendix component_net_L2_H16_BS32_LR0.001_E250 --no_val
-----



STDERR:
  File "main.py", line 370, in <module>
    main()
  File "main.py", line 254, in main
    dataset = dataset_class(
  File "/home/philip/projects/ltspice_examples_code_repo/Circuit-Completion-Using-GNNs/component_classification_with_link_prediction_head/evaluation/FEGIN/kernel/circuit_datasets.py", line 15, in __init__
    self.data, self.slices = torch.load(self.processed_paths[0])
  File "/home/philip/.local/lib/python3.8/site-packages/torch/serialization.py", line 1040, in load
    warnings.warn(
  File "/usr/lib/python3.8/warnings.py", line 109, in _showwarnmsg
    sw(msg.message, msg.category, msg.filename, msg.lineno,
  File "main.py", line 47, in warn_with_traceback
    traceback.print_stack(file=log)
/home/philip/projects/ltspice_examples_code_repo/Circuit-Completion-Using-GNNs/component_classification_with_link_prediction_head/evaluation/FEGIN/kernel/circuit_datasets.py:15: FutureWarning: You are using `torch.load` with `weights_only=False` (the current default value), which uses the default pickle module implicitly. It is possible to construct malicious pickle data which will execute arbitrary code during unpickling (See https://github.com/pytorch/pytorch/blob/main/SECURITY.md#untrusted-models for more details). In a future release, the default value for `weights_only` will be flipped to `True`. This limits the functions that could be executed during unpickling. Arbitrary objects will no longer be allowed to be loaded via this mode unless they are explicitly allowlisted by the user via `torch.serialization.add_safe_globals`. We recommend you start setting `weights_only=True` for any use case where you don't have full control of the loaded file. Please open an issue on GitHub for any issues related to this experimental feature.
  self.data, self.slices = torch.load(self.processed_paths[0])
