STDOUT:
Results will be saved in /home/philip/projects/ltspice_examples_code_repo/Circuit-Completion-Using-GNNs/component_classification_with_link_prediction_head/evaluation/FEGIN/results/model_FEGIN_dataset_ltspice_examples
Command line input: python main.py --data ltspice_examples --representation component_pin_net --model FEGIN --layers 5 --hiddens 32 --batch_size 128 --lr 0.0001 --emb_size 512 --epochs 100 --save_appendix component_pin_net_L5_H32_BS128_LR0.0001_E512 --no_val
 is saved.
-----
ltspice_examples - FEGIN
Using 5 layers, 32 hidden units, h = 2
Loading component_pin_net representation dataset
ENTERED
Training FEGIN on component_pin_net representation
Train: 3558, Test: 846
##################ITERATION #0 ****************************************
 epoch: 0, train_loss: 1.3972, test_loss: 1.3959, test_f1: 0.1004
 epoch: 1, train_loss: 1.3880, test_loss: 1.3918, test_f1: 0.1004
 epoch: 2, train_loss: 1.3809, test_loss: 1.3794, test_f1: 0.1004
 epoch: 3, train_loss: 1.3713, test_loss: 1.3675, test_f1: 0.1296
 epoch: 4, train_loss: 1.3599, test_loss: 1.3545, test_f1: 0.1759
 epoch: 5, train_loss: 1.3460, test_loss: 1.3393, test_f1: 0.2618
 epoch: 6, train_loss: 1.3293, test_loss: 1.3213, test_f1: 0.3012
 epoch: 7, train_loss: 1.3108, test_loss: 1.3025, test_f1: 0.2664
 epoch: 8, train_loss: 1.2914, test_loss: 1.2802, test_f1: 0.2415
 epoch: 9, train_loss: 1.2735, test_loss: 1.2619, test_f1: 0.2350
 epoch: 10, train_loss: 1.2582, test_loss: 1.2461, test_f1: 0.2310
 epoch: 11, train_loss: 1.2497, test_loss: 1.2333, test_f1: 0.2300
 epoch: 12, train_loss: 1.2356, test_loss: 1.2217, test_f1: 0.2295
 epoch: 13, train_loss: 1.2281, test_loss: 1.2128, test_f1: 0.2270
 epoch: 14, train_loss: 1.2156, test_loss: 1.2036, test_f1: 0.2270
 epoch: 15, train_loss: 1.2108, test_loss: 1.1941, test_f1: 0.2270
 epoch: 16, train_loss: 1.2074, test_loss: 1.1887, test_f1: 0.2392
 epoch: 17, train_loss: 1.1961, test_loss: 1.1815, test_f1: 0.2799
 epoch: 18, train_loss: 1.1913, test_loss: 1.1742, test_f1: 0.3141
 epoch: 19, train_loss: 1.1871, test_loss: 1.1687, test_f1: 0.3377
 epoch: 20, train_loss: 1.1816, test_loss: 1.1609, test_f1: 0.3344
 epoch: 21, train_loss: 1.1679, test_loss: 1.1535, test_f1: 0.3393
 epoch: 22, train_loss: 1.1683, test_loss: 1.1472, test_f1: 0.3403
 epoch: 23, train_loss: 1.1606, test_loss: 1.1395, test_f1: 0.3431
 epoch: 24, train_loss: 1.1507, test_loss: 1.1313, test_f1: 0.3720
 epoch: 25, train_loss: 1.1431, test_loss: 1.1254, test_f1: 0.3697
 epoch: 26, train_loss: 1.1371, test_loss: 1.1159, test_f1: 0.3958
 epoch: 27, train_loss: 1.1284, test_loss: 1.1118, test_f1: 0.3837
 epoch: 28, train_loss: 1.1171, test_loss: 1.0988, test_f1: 0.3977
 epoch: 29, train_loss: 1.1054, test_loss: 1.0953, test_f1: 0.4066
 epoch: 30, train_loss: 1.1004, test_loss: 1.0845, test_f1: 0.4091
 epoch: 31, train_loss: 1.0953, test_loss: 1.0795, test_f1: 0.4141
 epoch: 32, train_loss: 1.0877, test_loss: 1.0727, test_f1: 0.4094
 epoch: 33, train_loss: 1.0759, test_loss: 1.0663, test_f1: 0.4035
 epoch: 34, train_loss: 1.0787, test_loss: 1.0630, test_f1: 0.3867
 epoch: 35, train_loss: 1.0627, test_loss: 1.0573, test_f1: 0.3865
 epoch: 36, train_loss: 1.0560, test_loss: 1.0511, test_f1: 0.3990
 epoch: 37, train_loss: 1.0477, test_loss: 1.0536, test_f1: 0.4238
 epoch: 38, train_loss: 1.0459, test_loss: 1.0458, test_f1: 0.4289
 epoch: 39, train_loss: 1.0403, test_loss: 1.0445, test_f1: 0.4400
 epoch: 40, train_loss: 1.0337, test_loss: 1.0372, test_f1: 0.4430
 epoch: 41, train_loss: 1.0308, test_loss: 1.0359, test_f1: 0.4534
 epoch: 42, train_loss: 1.0216, test_loss: 1.0286, test_f1: 0.4570
 epoch: 43, train_loss: 1.0138, test_loss: 1.0249, test_f1: 0.4591
 epoch: 44, train_loss: 1.0124, test_loss: 1.0248, test_f1: 0.4407
 epoch: 45, train_loss: 1.0138, test_loss: 1.0273, test_f1: 0.4486
 epoch: 46, train_loss: 1.0059, test_loss: 1.0167, test_f1: 0.4825
 epoch: 47, train_loss: 0.9954, test_loss: 1.0138, test_f1: 0.4734
 epoch: 48, train_loss: 0.9886, test_loss: 1.0082, test_f1: 0.5028
 epoch: 49, train_loss: 0.9884, test_loss: 1.0288, test_f1: 0.4889
 epoch: 50, train_loss: 0.9828, test_loss: 1.0103, test_f1: 0.5115
 epoch: 51, train_loss: 0.9817, test_loss: 1.0132, test_f1: 0.5136
 epoch: 52, train_loss: 0.9814, test_loss: 1.0195, test_f1: 0.4995
 epoch: 53, train_loss: 0.9711, test_loss: 1.0035, test_f1: 0.5163
 epoch: 54, train_loss: 0.9731, test_loss: 1.0020, test_f1: 0.5030
 epoch: 55, train_loss: 0.9736, test_loss: 1.0061, test_f1: 0.5203
 epoch: 56, train_loss: 0.9679, test_loss: 1.0028, test_f1: 0.5256
 epoch: 57, train_loss: 0.9679, test_loss: 0.9995, test_f1: 0.5345
 epoch: 58, train_loss: 0.9664, test_loss: 0.9984, test_f1: 0.5211
 epoch: 59, train_loss: 0.9604, test_loss: 1.0007, test_f1: 0.5348
 epoch: 60, train_loss: 0.9576, test_loss: 1.0000, test_f1: 0.5268
 epoch: 61, train_loss: 0.9692, test_loss: 1.0042, test_f1: 0.5250
 epoch: 62, train_loss: 0.9566, test_loss: 1.0008, test_f1: 0.5283
 epoch: 63, train_loss: 0.9690, test_loss: 0.9978, test_f1: 0.5297
 epoch: 64, train_loss: 0.9548, test_loss: 0.9977, test_f1: 0.5329
 epoch: 65, train_loss: 0.9559, test_loss: 0.9940, test_f1: 0.5250
 epoch: 66, train_loss: 0.9552, test_loss: 0.9938, test_f1: 0.5344
 epoch: 67, train_loss: 0.9499, test_loss: 0.9946, test_f1: 0.5382
 epoch: 68, train_loss: 0.9466, test_loss: 0.9933, test_f1: 0.5379
 epoch: 69, train_loss: 0.9498, test_loss: 0.9893, test_f1: 0.5496
 epoch: 70, train_loss: 0.9505, test_loss: 0.9914, test_f1: 0.5389
 epoch: 71, train_loss: 0.9447, test_loss: 0.9916, test_f1: 0.5222
 epoch: 72, train_loss: 0.9487, test_loss: 0.9848, test_f1: 0.5204
 epoch: 73, train_loss: 0.9413, test_loss: 0.9880, test_f1: 0.5193
 epoch: 74, train_loss: 0.9413, test_loss: 0.9882, test_f1: 0.5229
 epoch: 75, train_loss: 0.9458, test_loss: 0.9887, test_f1: 0.5137
 epoch: 76, train_loss: 0.9450, test_loss: 0.9846, test_f1: 0.5234
 epoch: 77, train_loss: 0.9372, test_loss: 0.9866, test_f1: 0.5178
 epoch: 78, train_loss: 0.9392, test_loss: 0.9840, test_f1: 0.5203
 epoch: 79, train_loss: 0.9307, test_loss: 0.9841, test_f1: 0.5275
 epoch: 80, train_loss: 0.9303, test_loss: 0.9852, test_f1: 0.5227
 epoch: 81, train_loss: 0.9289, test_loss: 0.9799, test_f1: 0.5307
 epoch: 82, train_loss: 0.9275, test_loss: 0.9788, test_f1: 0.5268
 epoch: 83, train_loss: 0.9284, test_loss: 0.9859, test_f1: 0.5305
 epoch: 84, train_loss: 0.9337, test_loss: 0.9772, test_f1: 0.5193
 epoch: 85, train_loss: 0.9348, test_loss: 0.9795, test_f1: 0.5334
 epoch: 86, train_loss: 0.9319, test_loss: 0.9744, test_f1: 0.5266
 epoch: 87, train_loss: 0.9256, test_loss: 0.9782, test_f1: 0.5306
 epoch: 88, train_loss: 0.9226, test_loss: 0.9751, test_f1: 0.5370
 epoch: 89, train_loss: 0.9298, test_loss: 0.9772, test_f1: 0.5308
 epoch: 90, train_loss: 0.9211, test_loss: 0.9776, test_f1: 0.5323
 epoch: 91, train_loss: 0.9298, test_loss: 0.9769, test_f1: 0.5320
 epoch: 92, train_loss: 0.9178, test_loss: 0.9727, test_f1: 0.5281
 epoch: 93, train_loss: 0.9168, test_loss: 0.9737, test_f1: 0.5311
 epoch: 94, train_loss: 0.9109, test_loss: 0.9740, test_f1: 0.5296
 epoch: 95, train_loss: 0.9222, test_loss: 0.9773, test_f1: 0.5239
 epoch: 96, train_loss: 0.9219, test_loss: 0.9684, test_f1: 0.5326
 epoch: 97, train_loss: 0.9271, test_loss: 0.9714, test_f1: 0.5248
 epoch: 98, train_loss: 0.9161, test_loss: 0.9670, test_f1: 0.5256
 epoch: 99, train_loss: 0.9098, test_loss: 0.9692, test_f1: 0.5360
##################ITERATION #1 ****************************************
 epoch: 0, train_loss: 1.3658, test_loss: 1.3742, test_f1: 0.1004
 epoch: 1, train_loss: 1.3410, test_loss: 1.3626, test_f1: 0.1053
 epoch: 2, train_loss: 1.3237, test_loss: 1.3205, test_f1: 0.3242
 epoch: 3, train_loss: 1.3055, test_loss: 1.2961, test_f1: 0.3919
 epoch: 4, train_loss: 1.2855, test_loss: 1.2725, test_f1: 0.3871
 epoch: 5, train_loss: 1.2665, test_loss: 1.2509, test_f1: 0.3438
 epoch: 6, train_loss: 1.2446, test_loss: 1.2303, test_f1: 0.3451
 epoch: 7, train_loss: 1.2250, test_loss: 1.2085, test_f1: 0.3422
 epoch: 8, train_loss: 1.2068, test_loss: 1.1883, test_f1: 0.3460
 epoch: 9, train_loss: 1.1917, test_loss: 1.1731, test_f1: 0.3460
 epoch: 10, train_loss: 1.1748, test_loss: 1.1565, test_f1: 0.3460
 epoch: 11, train_loss: 1.1621, test_loss: 1.1415, test_f1: 0.3460
 epoch: 12, train_loss: 1.1478, test_loss: 1.1278, test_f1: 0.3441
 epoch: 13, train_loss: 1.1371, test_loss: 1.1156, test_f1: 0.3431
 epoch: 14, train_loss: 1.1273, test_loss: 1.1067, test_f1: 0.3411
 epoch: 15, train_loss: 1.1147, test_loss: 1.0968, test_f1: 0.3411
 epoch: 16, train_loss: 1.1052, test_loss: 1.0873, test_f1: 0.3421
 epoch: 17, train_loss: 1.0904, test_loss: 1.0814, test_f1: 0.3392
 epoch: 18, train_loss: 1.0830, test_loss: 1.0731, test_f1: 0.3359
 epoch: 19, train_loss: 1.0778, test_loss: 1.0681, test_f1: 0.3411
 epoch: 20, train_loss: 1.0749, test_loss: 1.0620, test_f1: 0.3387
 epoch: 21, train_loss: 1.0636, test_loss: 1.0600, test_f1: 0.3367
 epoch: 22, train_loss: 1.0586, test_loss: 1.0607, test_f1: 0.3357
 epoch: 23, train_loss: 1.0475, test_loss: 1.0539, test_f1: 0.3534
 epoch: 24, train_loss: 1.0406, test_loss: 1.0504, test_f1: 0.3563
 epoch: 25, train_loss: 1.0388, test_loss: 1.0555, test_f1: 0.3617
 epoch: 26, train_loss: 1.0366, test_loss: 1.0523, test_f1: 0.3891
 epoch: 27, train_loss: 1.0331, test_loss: 1.0460, test_f1: 0.4056
 epoch: 28, train_loss: 1.0301, test_loss: 1.0434, test_f1: 0.4196
 epoch: 29, train_loss: 1.0211, test_loss: 1.0452, test_f1: 0.4137
 epoch: 30, train_loss: 1.0221, test_loss: 1.0369, test_f1: 0.4314
 epoch: 31, train_loss: 1.0157, test_loss: 1.0368, test_f1: 0.4278
 epoch: 32, train_loss: 1.0116, test_loss: 1.0412, test_f1: 0.4324
 epoch: 33, train_loss: 1.0069, test_loss: 1.0228, test_f1: 0.4418
 epoch: 34, train_loss: 1.0048, test_loss: 1.0295, test_f1: 0.4512
 epoch: 35, train_loss: 0.9925, test_loss: 1.0159, test_f1: 0.4595
 epoch: 36, train_loss: 0.9936, test_loss: 1.0108, test_f1: 0.4571
 epoch: 37, train_loss: 0.9886, test_loss: 1.0154, test_f1: 0.4668
 epoch: 38, train_loss: 0.9861, test_loss: 1.0096, test_f1: 0.4670
 epoch: 39, train_loss: 0.9788, test_loss: 1.0184, test_f1: 0.4682
 epoch: 40, train_loss: 0.9722, test_loss: 0.9917, test_f1: 0.4772
 epoch: 41, train_loss: 0.9702, test_loss: 0.9989, test_f1: 0.5005
 epoch: 42, train_loss: 0.9677, test_loss: 0.9881, test_f1: 0.5069
 epoch: 43, train_loss: 0.9644, test_loss: 0.9896, test_f1: 0.4995
 epoch: 44, train_loss: 0.9624, test_loss: 0.9746, test_f1: 0.5105
 epoch: 45, train_loss: 0.9566, test_loss: 0.9707, test_f1: 0.5074
 epoch: 46, train_loss: 0.9490, test_loss: 0.9579, test_f1: 0.5131
 epoch: 47, train_loss: 0.9477, test_loss: 0.9678, test_f1: 0.5201
 epoch: 48, train_loss: 0.9459, test_loss: 0.9605, test_f1: 0.4989
 epoch: 49, train_loss: 0.9389, test_loss: 0.9622, test_f1: 0.5119
 epoch: 50, train_loss: 0.9293, test_loss: 0.9452, test_f1: 0.5180
 epoch: 51, train_loss: 0.9423, test_loss: 0.9538, test_f1: 0.5154
 epoch: 52, train_loss: 0.9313, test_loss: 0.9499, test_f1: 0.5128
 epoch: 53, train_loss: 0.9292, test_loss: 0.9539, test_f1: 0.5069
 epoch: 54, train_loss: 0.9278, test_loss: 0.9433, test_f1: 0.5157
 epoch: 55, train_loss: 0.9203, test_loss: 0.9454, test_f1: 0.5060
 epoch: 56, train_loss: 0.9265, test_loss: 0.9411, test_f1: 0.5260
 epoch: 57, train_loss: 0.9249, test_loss: 0.9432, test_f1: 0.5131
 epoch: 58, train_loss: 0.9210, test_loss: 0.9382, test_f1: 0.5064
 epoch: 59, train_loss: 0.9211, test_loss: 0.9372, test_f1: 0.5200
 epoch: 60, train_loss: 0.9170, test_loss: 0.9438, test_f1: 0.5229
 epoch: 61, train_loss: 0.9164, test_loss: 0.9416, test_f1: 0.5077
 epoch: 62, train_loss: 0.9109, test_loss: 0.9405, test_f1: 0.5083
 epoch: 63, train_loss: 0.9207, test_loss: 0.9336, test_f1: 0.5057
 epoch: 64, train_loss: 0.9151, test_loss: 0.9355, test_f1: 0.5070
 epoch: 65, train_loss: 0.9106, test_loss: 0.9336, test_f1: 0.5195
 epoch: 66, train_loss: 0.9142, test_loss: 0.9378, test_f1: 0.5214
 epoch: 67, train_loss: 0.9084, test_loss: 0.9289, test_f1: 0.5126
 epoch: 68, train_loss: 0.9050, test_loss: 0.9295, test_f1: 0.5162
 epoch: 69, train_loss: 0.9127, test_loss: 0.9244, test_f1: 0.5193
 epoch: 70, train_loss: 0.9098, test_loss: 0.9277, test_f1: 0.4995
 epoch: 71, train_loss: 0.9051, test_loss: 0.9272, test_f1: 0.5187
 epoch: 72, train_loss: 0.9074, test_loss: 0.9306, test_f1: 0.5238
 epoch: 73, train_loss: 0.9022, test_loss: 0.9217, test_f1: 0.5299
 epoch: 74, train_loss: 0.9043, test_loss: 0.9253, test_f1: 0.5228
 epoch: 75, train_loss: 0.8962, test_loss: 0.9187, test_f1: 0.5229
 epoch: 76, train_loss: 0.8997, test_loss: 0.9124, test_f1: 0.5355
 epoch: 77, train_loss: 0.9010, test_loss: 0.9143, test_f1: 0.5131
 epoch: 78, train_loss: 0.8979, test_loss: 0.9218, test_f1: 0.5216
 epoch: 79, train_loss: 0.8927, test_loss: 0.9165, test_f1: 0.5196
 epoch: 80, train_loss: 0.9040, test_loss: 0.9107, test_f1: 0.5131
 epoch: 81, train_loss: 0.8917, test_loss: 0.9131, test_f1: 0.5149
 epoch: 82, train_loss: 0.8945, test_loss: 0.9148, test_f1: 0.5238
 epoch: 83, train_loss: 0.8982, test_loss: 0.9080, test_f1: 0.5247
 epoch: 84, train_loss: 0.8908, test_loss: 0.9074, test_f1: 0.5245
 epoch: 85, train_loss: 0.8871, test_loss: 0.9121, test_f1: 0.5096
 epoch: 86, train_loss: 0.8870, test_loss: 0.9051, test_f1: 0.5299
 epoch: 87, train_loss: 0.8919, test_loss: 0.9115, test_f1: 0.5294
 epoch: 88, train_loss: 0.8932, test_loss: 0.9077, test_f1: 0.5176
 epoch: 89, train_loss: 0.8871, test_loss: 0.9028, test_f1: 0.5249
 epoch: 90, train_loss: 0.8862, test_loss: 0.9094, test_f1: 0.5254
 epoch: 91, train_loss: 0.8820, test_loss: 0.9015, test_f1: 0.5282
 epoch: 92, train_loss: 0.8895, test_loss: 0.8969, test_f1: 0.5331
 epoch: 93, train_loss: 0.8891, test_loss: 0.9088, test_f1: 0.5338
 epoch: 94, train_loss: 0.8834, test_loss: 0.8993, test_f1: 0.5346
 epoch: 95, train_loss: 0.8850, test_loss: 0.9150, test_f1: 0.5178
 epoch: 96, train_loss: 0.8761, test_loss: 0.9118, test_f1: 0.5141
 epoch: 97, train_loss: 0.8870, test_loss: 0.9138, test_f1: 0.5358
 epoch: 98, train_loss: 0.8881, test_loss: 0.9048, test_f1: 0.5315
 epoch: 99, train_loss: 0.8855, test_loss: 0.9145, test_f1: 0.5221
##################ITERATION #2 ****************************************
 epoch: 0, train_loss: 1.3183, test_loss: 1.3393, test_f1: 0.1125
 epoch: 1, train_loss: 1.2856, test_loss: 1.3105, test_f1: 0.2561
 epoch: 2, train_loss: 1.2651, test_loss: 1.2673, test_f1: 0.2971
 epoch: 3, train_loss: 1.2441, test_loss: 1.2377, test_f1: 0.3393
 epoch: 4, train_loss: 1.2242, test_loss: 1.2098, test_f1: 0.3377
 epoch: 5, train_loss: 1.2017, test_loss: 1.1870, test_f1: 0.3450
 epoch: 6, train_loss: 1.1803, test_loss: 1.1687, test_f1: 0.3296
 epoch: 7, train_loss: 1.1636, test_loss: 1.1504, test_f1: 0.3362
 epoch: 8, train_loss: 1.1465, test_loss: 1.1365, test_f1: 0.3237
 epoch: 9, train_loss: 1.1344, test_loss: 1.1257, test_f1: 0.3239
 epoch: 10, train_loss: 1.1163, test_loss: 1.1115, test_f1: 0.3227
 epoch: 11, train_loss: 1.1070, test_loss: 1.0993, test_f1: 0.3386
 epoch: 12, train_loss: 1.0902, test_loss: 1.0952, test_f1: 0.3487
 epoch: 13, train_loss: 1.0810, test_loss: 1.0832, test_f1: 0.3890
 epoch: 14, train_loss: 1.0700, test_loss: 1.0865, test_f1: 0.3760
 epoch: 15, train_loss: 1.0594, test_loss: 1.0722, test_f1: 0.4022
 epoch: 16, train_loss: 1.0454, test_loss: 1.0804, test_f1: 0.3875
 epoch: 17, train_loss: 1.0428, test_loss: 1.0570, test_f1: 0.4303
 epoch: 18, train_loss: 1.0311, test_loss: 1.0763, test_f1: 0.4045
 epoch: 19, train_loss: 1.0222, test_loss: 1.0423, test_f1: 0.4408
 epoch: 20, train_loss: 1.0166, test_loss: 1.0453, test_f1: 0.4461
 epoch: 21, train_loss: 1.0132, test_loss: 1.0531, test_f1: 0.4430
 epoch: 22, train_loss: 1.0093, test_loss: 1.0607, test_f1: 0.4262
 epoch: 23, train_loss: 1.0048, test_loss: 1.0318, test_f1: 0.4597
 epoch: 24, train_loss: 0.9963, test_loss: 1.0384, test_f1: 0.4549
 epoch: 25, train_loss: 0.9898, test_loss: 1.0436, test_f1: 0.4652
 epoch: 26, train_loss: 0.9812, test_loss: 1.0313, test_f1: 0.4583
 epoch: 27, train_loss: 0.9827, test_loss: 1.0258, test_f1: 0.4586
 epoch: 28, train_loss: 0.9746, test_loss: 1.0185, test_f1: 0.4634
 epoch: 29, train_loss: 0.9645, test_loss: 1.0099, test_f1: 0.4685
 epoch: 30, train_loss: 0.9634, test_loss: 1.0196, test_f1: 0.4580
 epoch: 31, train_loss: 0.9604, test_loss: 1.0012, test_f1: 0.4743
 epoch: 32, train_loss: 0.9578, test_loss: 1.0173, test_f1: 0.4660
 epoch: 33, train_loss: 0.9525, test_loss: 1.0120, test_f1: 0.4797
 epoch: 34, train_loss: 0.9545, test_loss: 1.0211, test_f1: 0.4624
 epoch: 35, train_loss: 0.9443, test_loss: 0.9996, test_f1: 0.4799
 epoch: 36, train_loss: 0.9477, test_loss: 0.9971, test_f1: 0.4893
 epoch: 37, train_loss: 0.9392, test_loss: 1.0078, test_f1: 0.4850
 epoch: 38, train_loss: 0.9364, test_loss: 0.9912, test_f1: 0.4923
 epoch: 39, train_loss: 0.9303, test_loss: 0.9988, test_f1: 0.4895
 epoch: 40, train_loss: 0.9225, test_loss: 0.9799, test_f1: 0.4985
 epoch: 41, train_loss: 0.9260, test_loss: 0.9802, test_f1: 0.4991
 epoch: 42, train_loss: 0.9204, test_loss: 0.9946, test_f1: 0.5174
 epoch: 43, train_loss: 0.9236, test_loss: 1.0051, test_f1: 0.4924
 epoch: 44, train_loss: 0.9240, test_loss: 1.0166, test_f1: 0.4894
 epoch: 45, train_loss: 0.9143, test_loss: 0.9768, test_f1: 0.5065
 epoch: 46, train_loss: 0.9223, test_loss: 0.9790, test_f1: 0.5060
 epoch: 47, train_loss: 0.9125, test_loss: 0.9644, test_f1: 0.5154
 epoch: 48, train_loss: 0.9121, test_loss: 1.0337, test_f1: 0.4855
 epoch: 49, train_loss: 0.9185, test_loss: 0.9534, test_f1: 0.5140
 epoch: 50, train_loss: 0.9115, test_loss: 0.9750, test_f1: 0.5228
 epoch: 51, train_loss: 0.9026, test_loss: 0.9740, test_f1: 0.5117
 epoch: 52, train_loss: 0.9036, test_loss: 0.9529, test_f1: 0.5075
 epoch: 53, train_loss: 0.8963, test_loss: 0.9536, test_f1: 0.5270
 epoch: 54, train_loss: 0.8983, test_loss: 0.9877, test_f1: 0.5116
 epoch: 55, train_loss: 0.9013, test_loss: 0.9774, test_f1: 0.5034
 epoch: 56, train_loss: 0.8933, test_loss: 0.9448, test_f1: 0.5202
 epoch: 57, train_loss: 0.8952, test_loss: 0.9369, test_f1: 0.5179
 epoch: 58, train_loss: 0.8909, test_loss: 0.9809, test_f1: 0.5169
 epoch: 59, train_loss: 0.8955, test_loss: 0.9562, test_f1: 0.5158
 epoch: 60, train_loss: 0.8924, test_loss: 0.9571, test_f1: 0.5161
 epoch: 61, train_loss: 0.8895, test_loss: 0.9411, test_f1: 0.5139
 epoch: 62, train_loss: 0.8875, test_loss: 0.9492, test_f1: 0.5218
 epoch: 63, train_loss: 0.8912, test_loss: 0.9732, test_f1: 0.5115
 epoch: 64, train_loss: 0.8851, test_loss: 0.9606, test_f1: 0.5122
 epoch: 65, train_loss: 0.8861, test_loss: 0.9391, test_f1: 0.5219
 epoch: 66, train_loss: 0.8855, test_loss: 0.9434, test_f1: 0.5253
 epoch: 67, train_loss: 0.8824, test_loss: 0.9496, test_f1: 0.5220
 epoch: 68, train_loss: 0.8784, test_loss: 0.9480, test_f1: 0.5260
 epoch: 69, train_loss: 0.8830, test_loss: 0.9443, test_f1: 0.5219
 epoch: 70, train_loss: 0.8802, test_loss: 0.9531, test_f1: 0.5230
 epoch: 71, train_loss: 0.8811, test_loss: 0.9436, test_f1: 0.5196
 epoch: 72, train_loss: 0.8743, test_loss: 0.9345, test_f1: 0.5155
 epoch: 73, train_loss: 0.8875, test_loss: 0.9263, test_f1: 0.5212
 epoch: 74, train_loss: 0.8777, test_loss: 0.9268, test_f1: 0.5219
 epoch: 75, train_loss: 0.8720, test_loss: 0.9353, test_f1: 0.5284
 epoch: 76, train_loss: 0.8653, test_loss: 0.9406, test_f1: 0.5326
 epoch: 77, train_loss: 0.8775, test_loss: 0.9535, test_f1: 0.5224
 epoch: 78, train_loss: 0.8744, test_loss: 0.9401, test_f1: 0.5264
 epoch: 79, train_loss: 0.8654, test_loss: 0.9332, test_f1: 0.5275
 epoch: 80, train_loss: 0.8802, test_loss: 0.9378, test_f1: 0.5202
 epoch: 81, train_loss: 0.8733, test_loss: 0.9467, test_f1: 0.5246
 epoch: 82, train_loss: 0.8715, test_loss: 0.9291, test_f1: 0.5235
 epoch: 83, train_loss: 0.8636, test_loss: 0.9334, test_f1: 0.5251
 epoch: 84, train_loss: 0.8676, test_loss: 0.9393, test_f1: 0.5215
 epoch: 85, train_loss: 0.8681, test_loss: 0.9485, test_f1: 0.5216
 epoch: 86, train_loss: 0.8641, test_loss: 0.9327, test_f1: 0.5209
 epoch: 87, train_loss: 0.8615, test_loss: 0.9342, test_f1: 0.5265
 epoch: 88, train_loss: 0.8677, test_loss: 0.9328, test_f1: 0.5265
 epoch: 89, train_loss: 0.8777, test_loss: 0.9391, test_f1: 0.5210
 epoch: 90, train_loss: 0.8657, test_loss: 0.9254, test_f1: 0.5310
 epoch: 91, train_loss: 0.8605, test_loss: 0.9192, test_f1: 0.5256
 epoch: 92, train_loss: 0.8573, test_loss: 0.9232, test_f1: 0.5373
 epoch: 93, train_loss: 0.8544, test_loss: 0.9367, test_f1: 0.5163
 epoch: 94, train_loss: 0.8566, test_loss: 0.9358, test_f1: 0.5255
 epoch: 95, train_loss: 0.8624, test_loss: 0.9189, test_f1: 0.5308
 epoch: 96, train_loss: 0.8575, test_loss: 0.9418, test_f1: 0.5220
 epoch: 97, train_loss: 0.8607, test_loss: 0.9472, test_f1: 0.5330
 epoch: 98, train_loss: 0.8544, test_loss: 0.9352, test_f1: 0.5292
 epoch: 99, train_loss: 0.8518, test_loss: 0.9261, test_f1: 0.5324
##################ITERATION #3 ****************************************
 epoch: 0, train_loss: 1.3147, test_loss: 1.3169, test_f1: 0.2270
 epoch: 1, train_loss: 1.2692, test_loss: 1.2703, test_f1: 0.2270
 epoch: 2, train_loss: 1.2417, test_loss: 1.2277, test_f1: 0.2978
 epoch: 3, train_loss: 1.2201, test_loss: 1.1942, test_f1: 0.3519
 epoch: 4, train_loss: 1.1994, test_loss: 1.1670, test_f1: 0.3425
 epoch: 5, train_loss: 1.1779, test_loss: 1.1445, test_f1: 0.3467
 epoch: 6, train_loss: 1.1596, test_loss: 1.1234, test_f1: 0.3621
 epoch: 7, train_loss: 1.1391, test_loss: 1.1054, test_f1: 0.3647
 epoch: 8, train_loss: 1.1275, test_loss: 1.0887, test_f1: 0.3940
 epoch: 9, train_loss: 1.1051, test_loss: 1.0732, test_f1: 0.4141
 epoch: 10, train_loss: 1.0898, test_loss: 1.0637, test_f1: 0.4280
 epoch: 11, train_loss: 1.0786, test_loss: 1.0540, test_f1: 0.4243
 epoch: 12, train_loss: 1.0662, test_loss: 1.0475, test_f1: 0.4242
 epoch: 13, train_loss: 1.0544, test_loss: 1.0389, test_f1: 0.4275
 epoch: 14, train_loss: 1.0428, test_loss: 1.0339, test_f1: 0.4342
 epoch: 15, train_loss: 1.0354, test_loss: 1.0257, test_f1: 0.4497
 epoch: 16, train_loss: 1.0263, test_loss: 1.0200, test_f1: 0.4535
 epoch: 17, train_loss: 1.0229, test_loss: 1.0151, test_f1: 0.4533
 epoch: 18, train_loss: 1.0100, test_loss: 1.0178, test_f1: 0.4617
 epoch: 19, train_loss: 1.0026, test_loss: 1.0090, test_f1: 0.4651
 epoch: 20, train_loss: 1.0032, test_loss: 1.0038, test_f1: 0.4655
 epoch: 21, train_loss: 0.9913, test_loss: 0.9995, test_f1: 0.4711
 epoch: 22, train_loss: 0.9829, test_loss: 0.9953, test_f1: 0.4772
 epoch: 23, train_loss: 0.9812, test_loss: 0.9898, test_f1: 0.4830
 epoch: 24, train_loss: 0.9771, test_loss: 0.9855, test_f1: 0.4783
 epoch: 25, train_loss: 0.9621, test_loss: 0.9841, test_f1: 0.4854
 epoch: 26, train_loss: 0.9616, test_loss: 0.9781, test_f1: 0.4913
 epoch: 27, train_loss: 0.9590, test_loss: 0.9860, test_f1: 0.4859
 epoch: 28, train_loss: 0.9559, test_loss: 0.9741, test_f1: 0.4805
 epoch: 29, train_loss: 0.9480, test_loss: 0.9986, test_f1: 0.4792
 epoch: 30, train_loss: 0.9428, test_loss: 0.9649, test_f1: 0.4962
 epoch: 31, train_loss: 0.9421, test_loss: 0.9679, test_f1: 0.4868
 epoch: 32, train_loss: 0.9356, test_loss: 0.9607, test_f1: 0.4994
 epoch: 33, train_loss: 0.9303, test_loss: 0.9656, test_f1: 0.4871
 epoch: 34, train_loss: 0.9251, test_loss: 0.9521, test_f1: 0.4975
 epoch: 35, train_loss: 0.9234, test_loss: 0.9594, test_f1: 0.4929
 epoch: 36, train_loss: 0.9110, test_loss: 0.9494, test_f1: 0.4952
 epoch: 37, train_loss: 0.9217, test_loss: 0.9502, test_f1: 0.4987
 epoch: 38, train_loss: 0.9155, test_loss: 0.9482, test_f1: 0.5089
 epoch: 39, train_loss: 0.9088, test_loss: 0.9455, test_f1: 0.5042
 epoch: 40, train_loss: 0.9071, test_loss: 0.9551, test_f1: 0.4976
 epoch: 41, train_loss: 0.9039, test_loss: 0.9512, test_f1: 0.5050
 epoch: 42, train_loss: 0.8938, test_loss: 0.9388, test_f1: 0.5098
 epoch: 43, train_loss: 0.9010, test_loss: 0.9321, test_f1: 0.5166
 epoch: 44, train_loss: 0.8921, test_loss: 0.9347, test_f1: 0.5126
 epoch: 45, train_loss: 0.8902, test_loss: 0.9221, test_f1: 0.5292
 epoch: 46, train_loss: 0.9001, test_loss: 0.9113, test_f1: 0.5278
 epoch: 47, train_loss: 0.8800, test_loss: 0.9103, test_f1: 0.5051
 epoch: 48, train_loss: 0.8845, test_loss: 0.9346, test_f1: 0.5043
 epoch: 49, train_loss: 0.8946, test_loss: 0.9409, test_f1: 0.5049
 epoch: 50, train_loss: 0.8772, test_loss: 0.9198, test_f1: 0.5125
 epoch: 51, train_loss: 0.8748, test_loss: 0.9343, test_f1: 0.5117
 epoch: 52, train_loss: 0.8667, test_loss: 0.9199, test_f1: 0.5130
 epoch: 53, train_loss: 0.8753, test_loss: 0.9082, test_f1: 0.5298
 epoch: 54, train_loss: 0.8624, test_loss: 0.9181, test_f1: 0.5076
 epoch: 55, train_loss: 0.8751, test_loss: 0.9085, test_f1: 0.5178
 epoch: 56, train_loss: 0.8682, test_loss: 0.9038, test_f1: 0.5185
 epoch: 57, train_loss: 0.8671, test_loss: 0.9155, test_f1: 0.5295
 epoch: 58, train_loss: 0.8637, test_loss: 0.9056, test_f1: 0.5231
 epoch: 59, train_loss: 0.8615, test_loss: 0.9109, test_f1: 0.5137
 epoch: 60, train_loss: 0.8626, test_loss: 0.9035, test_f1: 0.5280
 epoch: 61, train_loss: 0.8580, test_loss: 0.9021, test_f1: 0.5137
 epoch: 62, train_loss: 0.8555, test_loss: 0.9050, test_f1: 0.5273
 epoch: 63, train_loss: 0.8596, test_loss: 0.9046, test_f1: 0.5158
 epoch: 64, train_loss: 0.8654, test_loss: 0.9070, test_f1: 0.5158
 epoch: 65, train_loss: 0.8587, test_loss: 0.9027, test_f1: 0.5344
 epoch: 66, train_loss: 0.8564, test_loss: 0.9008, test_f1: 0.5256
 epoch: 67, train_loss: 0.8501, test_loss: 0.8960, test_f1: 0.5255
 epoch: 68, train_loss: 0.8556, test_loss: 0.9087, test_f1: 0.5176
 epoch: 69, train_loss: 0.8569, test_loss: 0.9042, test_f1: 0.5330
 epoch: 70, train_loss: 0.8545, test_loss: 0.9017, test_f1: 0.5312
 epoch: 71, train_loss: 0.8486, test_loss: 0.8967, test_f1: 0.5219
 epoch: 72, train_loss: 0.8445, test_loss: 0.8912, test_f1: 0.5333
 epoch: 73, train_loss: 0.8508, test_loss: 0.8901, test_f1: 0.5417
 epoch: 74, train_loss: 0.8465, test_loss: 0.9107, test_f1: 0.5142
 epoch: 75, train_loss: 0.8444, test_loss: 0.8900, test_f1: 0.5221
 epoch: 76, train_loss: 0.8451, test_loss: 0.8939, test_f1: 0.5318
 epoch: 77, train_loss: 0.8493, test_loss: 0.9055, test_f1: 0.5126
 epoch: 78, train_loss: 0.8353, test_loss: 0.8961, test_f1: 0.5398
 epoch: 79, train_loss: 0.8394, test_loss: 0.8931, test_f1: 0.5328
 epoch: 80, train_loss: 0.8509, test_loss: 0.9006, test_f1: 0.5340
 epoch: 81, train_loss: 0.8448, test_loss: 0.8989, test_f1: 0.5093
 epoch: 82, train_loss: 0.8369, test_loss: 0.8936, test_f1: 0.5249
 epoch: 83, train_loss: 0.8384, test_loss: 0.8967, test_f1: 0.5261
 epoch: 84, train_loss: 0.8283, test_loss: 0.8917, test_f1: 0.5324
 epoch: 85, train_loss: 0.8389, test_loss: 0.9041, test_f1: 0.5250
 epoch: 86, train_loss: 0.8300, test_loss: 0.9036, test_f1: 0.5316
 epoch: 87, train_loss: 0.8331, test_loss: 0.9029, test_f1: 0.5210
 epoch: 88, train_loss: 0.8352, test_loss: 0.8991, test_f1: 0.5221
 epoch: 89, train_loss: 0.8327, test_loss: 0.8903, test_f1: 0.5356
 epoch: 90, train_loss: 0.8299, test_loss: 0.9000, test_f1: 0.5368
 epoch: 91, train_loss: 0.8249, test_loss: 0.8993, test_f1: 0.5310
 epoch: 92, train_loss: 0.8303, test_loss: 0.8879, test_f1: 0.5234
 epoch: 93, train_loss: 0.8297, test_loss: 0.8844, test_f1: 0.5340
 epoch: 94, train_loss: 0.8264, test_loss: 0.8813, test_f1: 0.5471
 epoch: 95, train_loss: 0.8208, test_loss: 0.9144, test_f1: 0.5123
 epoch: 96, train_loss: 0.8234, test_loss: 0.8915, test_f1: 0.5383
 epoch: 97, train_loss: 0.8179, test_loss: 0.8856, test_f1: 0.5377
 epoch: 98, train_loss: 0.8298, test_loss: 0.8940, test_f1: 0.5322
 epoch: 99, train_loss: 0.8216, test_loss: 0.8868, test_f1: 0.5179
##################ITERATION #4 ****************************************
 epoch: 0, train_loss: 1.2859, test_loss: 1.3118, test_f1: 0.2270
 epoch: 1, train_loss: 1.2473, test_loss: 1.2771, test_f1: 0.2703
 epoch: 2, train_loss: 1.2308, test_loss: 1.2087, test_f1: 0.2829
 epoch: 3, train_loss: 1.2058, test_loss: 1.1738, test_f1: 0.3688
 epoch: 4, train_loss: 1.1832, test_loss: 1.1492, test_f1: 0.4160
 epoch: 5, train_loss: 1.1575, test_loss: 1.1177, test_f1: 0.4311
 epoch: 6, train_loss: 1.1342, test_loss: 1.0981, test_f1: 0.4506
 epoch: 7, train_loss: 1.1131, test_loss: 1.0790, test_f1: 0.4466
 epoch: 8, train_loss: 1.0952, test_loss: 1.0647, test_f1: 0.4527
 epoch: 9, train_loss: 1.0808, test_loss: 1.0517, test_f1: 0.4743
 epoch: 10, train_loss: 1.0668, test_loss: 1.0346, test_f1: 0.4700
 epoch: 11, train_loss: 1.0634, test_loss: 1.0318, test_f1: 0.4778
 epoch: 12, train_loss: 1.0455, test_loss: 1.0246, test_f1: 0.4738
 epoch: 13, train_loss: 1.0344, test_loss: 1.0191, test_f1: 0.4754
 epoch: 14, train_loss: 1.0309, test_loss: 1.0102, test_f1: 0.4814
 epoch: 15, train_loss: 1.0245, test_loss: 1.0056, test_f1: 0.4938
 epoch: 16, train_loss: 1.0147, test_loss: 0.9925, test_f1: 0.4819
 epoch: 17, train_loss: 1.0194, test_loss: 0.9904, test_f1: 0.4915
 epoch: 18, train_loss: 1.0029, test_loss: 0.9854, test_f1: 0.4776
 epoch: 19, train_loss: 1.0016, test_loss: 0.9834, test_f1: 0.4881
 epoch: 20, train_loss: 0.9908, test_loss: 0.9789, test_f1: 0.5020
 epoch: 21, train_loss: 0.9905, test_loss: 0.9789, test_f1: 0.5005
 epoch: 22, train_loss: 0.9913, test_loss: 0.9756, test_f1: 0.4957
 epoch: 23, train_loss: 0.9808, test_loss: 0.9653, test_f1: 0.4999
 epoch: 24, train_loss: 0.9776, test_loss: 0.9515, test_f1: 0.4968
 epoch: 25, train_loss: 0.9744, test_loss: 0.9629, test_f1: 0.4992
 epoch: 26, train_loss: 0.9693, test_loss: 0.9497, test_f1: 0.4982
 epoch: 27, train_loss: 0.9657, test_loss: 0.9448, test_f1: 0.5193
 epoch: 28, train_loss: 0.9641, test_loss: 0.9493, test_f1: 0.5078
 epoch: 29, train_loss: 0.9538, test_loss: 0.9542, test_f1: 0.4961
 epoch: 30, train_loss: 0.9585, test_loss: 0.9404, test_f1: 0.5204
 epoch: 31, train_loss: 0.9525, test_loss: 0.9394, test_f1: 0.5041
 epoch: 32, train_loss: 0.9483, test_loss: 0.9344, test_f1: 0.5089
 epoch: 33, train_loss: 0.9489, test_loss: 0.9320, test_f1: 0.5024
 epoch: 34, train_loss: 0.9409, test_loss: 0.9376, test_f1: 0.5160
 epoch: 35, train_loss: 0.9356, test_loss: 0.9288, test_f1: 0.5212
 epoch: 36, train_loss: 0.9399, test_loss: 0.9176, test_f1: 0.5108
 epoch: 37, train_loss: 0.9404, test_loss: 0.9168, test_f1: 0.5195
 epoch: 38, train_loss: 0.9295, test_loss: 0.9208, test_f1: 0.5156
 epoch: 39, train_loss: 0.9339, test_loss: 0.9209, test_f1: 0.5196
 epoch: 40, train_loss: 0.9209, test_loss: 0.9073, test_f1: 0.5218
 epoch: 41, train_loss: 0.9281, test_loss: 0.9103, test_f1: 0.5243
 epoch: 42, train_loss: 0.9238, test_loss: 0.9081, test_f1: 0.5247
 epoch: 43, train_loss: 0.9161, test_loss: 0.9142, test_f1: 0.5191
 epoch: 44, train_loss: 0.9193, test_loss: 0.9090, test_f1: 0.5178
 epoch: 45, train_loss: 0.9119, test_loss: 0.8980, test_f1: 0.5248
 epoch: 46, train_loss: 0.9173, test_loss: 0.8991, test_f1: 0.5253
 epoch: 47, train_loss: 0.9129, test_loss: 0.8961, test_f1: 0.5265
 epoch: 48, train_loss: 0.9081, test_loss: 0.8980, test_f1: 0.5166
 epoch: 49, train_loss: 0.8985, test_loss: 0.9031, test_f1: 0.5243
 epoch: 50, train_loss: 0.8971, test_loss: 0.8976, test_f1: 0.5237
 epoch: 51, train_loss: 0.8959, test_loss: 0.8913, test_f1: 0.5226
 epoch: 52, train_loss: 0.8969, test_loss: 0.8954, test_f1: 0.5218
 epoch: 53, train_loss: 0.9026, test_loss: 0.8930, test_f1: 0.5236
 epoch: 54, train_loss: 0.8893, test_loss: 0.8918, test_f1: 0.5232
 epoch: 55, train_loss: 0.8890, test_loss: 0.8831, test_f1: 0.5212
 epoch: 56, train_loss: 0.8910, test_loss: 0.8879, test_f1: 0.5249
 epoch: 57, train_loss: 0.8837, test_loss: 0.8847, test_f1: 0.5205
 epoch: 58, train_loss: 0.8826, test_loss: 0.8793, test_f1: 0.5265
 epoch: 59, train_loss: 0.8941, test_loss: 0.8798, test_f1: 0.5222
 epoch: 60, train_loss: 0.8911, test_loss: 0.8872, test_f1: 0.5252
 epoch: 61, train_loss: 0.8865, test_loss: 0.8712, test_f1: 0.5342
 epoch: 62, train_loss: 0.8866, test_loss: 0.8773, test_f1: 0.5278
 epoch: 63, train_loss: 0.8888, test_loss: 0.8760, test_f1: 0.5242
 epoch: 64, train_loss: 0.8817, test_loss: 0.8818, test_f1: 0.5252
 epoch: 65, train_loss: 0.8894, test_loss: 0.8726, test_f1: 0.5368
 epoch: 66, train_loss: 0.8796, test_loss: 0.8673, test_f1: 0.5389
 epoch: 67, train_loss: 0.8821, test_loss: 0.8719, test_f1: 0.5327
 epoch: 68, train_loss: 0.8747, test_loss: 0.8692, test_f1: 0.5370
 epoch: 69, train_loss: 0.8735, test_loss: 0.8687, test_f1: 0.5372
 epoch: 70, train_loss: 0.8713, test_loss: 0.8637, test_f1: 0.5388
 epoch: 71, train_loss: 0.8726, test_loss: 0.8713, test_f1: 0.5349
 epoch: 72, train_loss: 0.8702, test_loss: 0.8637, test_f1: 0.5288
 epoch: 73, train_loss: 0.8709, test_loss: 0.8672, test_f1: 0.5272
 epoch: 74, train_loss: 0.8701, test_loss: 0.8589, test_f1: 0.5434
 epoch: 75, train_loss: 0.8739, test_loss: 0.8604, test_f1: 0.5412
 epoch: 76, train_loss: 0.8649, test_loss: 0.8655, test_f1: 0.5283
 epoch: 77, train_loss: 0.8670, test_loss: 0.8603, test_f1: 0.5316
 epoch: 78, train_loss: 0.8654, test_loss: 0.8630, test_f1: 0.5386
 epoch: 79, train_loss: 0.8674, test_loss: 0.8575, test_f1: 0.5423
 epoch: 80, train_loss: 0.8630, test_loss: 0.8517, test_f1: 0.5435
 epoch: 81, train_loss: 0.8623, test_loss: 0.8535, test_f1: 0.5464
 epoch: 82, train_loss: 0.8711, test_loss: 0.8554, test_f1: 0.5382
 epoch: 83, train_loss: 0.8674, test_loss: 0.8596, test_f1: 0.5411
 epoch: 84, train_loss: 0.8619, test_loss: 0.8555, test_f1: 0.5397
 epoch: 85, train_loss: 0.8570, test_loss: 0.8541, test_f1: 0.5375
 epoch: 86, train_loss: 0.8604, test_loss: 0.8478, test_f1: 0.5485
 epoch: 87, train_loss: 0.8690, test_loss: 0.8537, test_f1: 0.5393
 epoch: 88, train_loss: 0.8623, test_loss: 0.8486, test_f1: 0.5487
 epoch: 89, train_loss: 0.8505, test_loss: 0.8429, test_f1: 0.5450
 epoch: 90, train_loss: 0.8591, test_loss: 0.8457, test_f1: 0.5399
 epoch: 91, train_loss: 0.8558, test_loss: 0.8531, test_f1: 0.5392
 epoch: 92, train_loss: 0.8566, test_loss: 0.8541, test_f1: 0.5399
 epoch: 93, train_loss: 0.8543, test_loss: 0.8560, test_f1: 0.5330
 epoch: 94, train_loss: 0.8569, test_loss: 0.8472, test_f1: 0.5406
 epoch: 95, train_loss: 0.8506, test_loss: 0.8448, test_f1: 0.5347
 epoch: 96, train_loss: 0.8495, test_loss: 0.8460, test_f1: 0.5433
 epoch: 97, train_loss: 0.8530, test_loss: 0.8543, test_f1: 0.5333
 epoch: 98, train_loss: 0.8572, test_loss: 0.8442, test_f1: 0.5353
 epoch: 99, train_loss: 0.8473, test_loss: 0.8407, test_f1: 0.5421
##################ITERATION #5 ****************************************
 epoch: 0, train_loss: 1.2807, test_loss: 1.3217, test_f1: 0.2270
 epoch: 1, train_loss: 1.2309, test_loss: 1.2835, test_f1: 0.2270
 epoch: 2, train_loss: 1.2059, test_loss: 1.1817, test_f1: 0.3360
 epoch: 3, train_loss: 1.1805, test_loss: 1.1367, test_f1: 0.4036
 epoch: 4, train_loss: 1.1487, test_loss: 1.1080, test_f1: 0.4058
 epoch: 5, train_loss: 1.1278, test_loss: 1.0913, test_f1: 0.4170
 epoch: 6, train_loss: 1.1079, test_loss: 1.0751, test_f1: 0.4357
 epoch: 7, train_loss: 1.0931, test_loss: 1.0637, test_f1: 0.4452
 epoch: 8, train_loss: 1.0780, test_loss: 1.0591, test_f1: 0.4496
 epoch: 9, train_loss: 1.0620, test_loss: 1.0532, test_f1: 0.4645
 epoch: 10, train_loss: 1.0573, test_loss: 1.0444, test_f1: 0.4635
 epoch: 11, train_loss: 1.0399, test_loss: 1.0397, test_f1: 0.4608
 epoch: 12, train_loss: 1.0351, test_loss: 1.0289, test_f1: 0.4599
 epoch: 13, train_loss: 1.0273, test_loss: 1.0268, test_f1: 0.4515
 epoch: 14, train_loss: 1.0141, test_loss: 1.0191, test_f1: 0.4724
 epoch: 15, train_loss: 1.0070, test_loss: 1.0127, test_f1: 0.4826
 epoch: 16, train_loss: 0.9980, test_loss: 1.0053, test_f1: 0.4823
 epoch: 17, train_loss: 0.9958, test_loss: 1.0190, test_f1: 0.4681
 epoch: 18, train_loss: 0.9963, test_loss: 1.0069, test_f1: 0.4801
 epoch: 19, train_loss: 0.9810, test_loss: 0.9915, test_f1: 0.4833
 epoch: 20, train_loss: 0.9778, test_loss: 0.9874, test_f1: 0.5046
 epoch: 21, train_loss: 0.9731, test_loss: 0.9899, test_f1: 0.4918
 epoch: 22, train_loss: 0.9635, test_loss: 0.9804, test_f1: 0.4984
 epoch: 23, train_loss: 0.9644, test_loss: 0.9714, test_f1: 0.5080
 epoch: 24, train_loss: 0.9540, test_loss: 0.9684, test_f1: 0.5085
 epoch: 25, train_loss: 0.9506, test_loss: 0.9631, test_f1: 0.5072
 epoch: 26, train_loss: 0.9424, test_loss: 0.9666, test_f1: 0.5124
 epoch: 27, train_loss: 0.9428, test_loss: 0.9581, test_f1: 0.5107
 epoch: 28, train_loss: 0.9419, test_loss: 0.9503, test_f1: 0.5053
 epoch: 29, train_loss: 0.9292, test_loss: 0.9616, test_f1: 0.5007
 epoch: 30, train_loss: 0.9274, test_loss: 0.9491, test_f1: 0.5073
 epoch: 31, train_loss: 0.9347, test_loss: 0.9428, test_f1: 0.5011
 epoch: 32, train_loss: 0.9279, test_loss: 0.9596, test_f1: 0.4929
 epoch: 33, train_loss: 0.9188, test_loss: 0.9421, test_f1: 0.5134
 epoch: 34, train_loss: 0.9150, test_loss: 0.9405, test_f1: 0.5096
 epoch: 35, train_loss: 0.9119, test_loss: 0.9515, test_f1: 0.5107
 epoch: 36, train_loss: 0.9190, test_loss: 0.9481, test_f1: 0.4957
 epoch: 37, train_loss: 0.9135, test_loss: 0.9414, test_f1: 0.5106
 epoch: 38, train_loss: 0.9035, test_loss: 0.9385, test_f1: 0.5134
 epoch: 39, train_loss: 0.9056, test_loss: 0.9519, test_f1: 0.5077
 epoch: 40, train_loss: 0.9069, test_loss: 0.9422, test_f1: 0.5195
 epoch: 41, train_loss: 0.8943, test_loss: 0.9119, test_f1: 0.5231
 epoch: 42, train_loss: 0.8943, test_loss: 0.9337, test_f1: 0.5143
 epoch: 43, train_loss: 0.8979, test_loss: 0.9251, test_f1: 0.5179
 epoch: 44, train_loss: 0.8930, test_loss: 0.9193, test_f1: 0.5165
 epoch: 45, train_loss: 0.8974, test_loss: 0.9211, test_f1: 0.5106
 epoch: 46, train_loss: 0.8839, test_loss: 0.9191, test_f1: 0.5130
 epoch: 47, train_loss: 0.8826, test_loss: 0.9411, test_f1: 0.5062
 epoch: 48, train_loss: 0.8823, test_loss: 0.9015, test_f1: 0.5178
 epoch: 49, train_loss: 0.8849, test_loss: 0.9012, test_f1: 0.5100
 epoch: 50, train_loss: 0.8755, test_loss: 0.9094, test_f1: 0.5208
 epoch: 51, train_loss: 0.8713, test_loss: 0.9025, test_f1: 0.5209
 epoch: 52, train_loss: 0.8761, test_loss: 0.8944, test_f1: 0.5259
 epoch: 53, train_loss: 0.8738, test_loss: 0.9001, test_f1: 0.5268
 epoch: 54, train_loss: 0.8753, test_loss: 0.8908, test_f1: 0.5202
 epoch: 55, train_loss: 0.8716, test_loss: 0.8952, test_f1: 0.5229
 epoch: 56, train_loss: 0.8695, test_loss: 0.9025, test_f1: 0.5321
 epoch: 57, train_loss: 0.8650, test_loss: 0.9000, test_f1: 0.5261
 epoch: 58, train_loss: 0.8632, test_loss: 0.8964, test_f1: 0.5339
 epoch: 59, train_loss: 0.8672, test_loss: 0.9006, test_f1: 0.5237
 epoch: 60, train_loss: 0.8637, test_loss: 0.8919, test_f1: 0.5243
 epoch: 61, train_loss: 0.8640, test_loss: 0.9003, test_f1: 0.5133
 epoch: 62, train_loss: 0.8545, test_loss: 0.8872, test_f1: 0.5274
 epoch: 63, train_loss: 0.8634, test_loss: 0.8983, test_f1: 0.5217
 epoch: 64, train_loss: 0.8649, test_loss: 0.8928, test_f1: 0.5202
 epoch: 65, train_loss: 0.8666, test_loss: 0.8991, test_f1: 0.5038
 epoch: 66, train_loss: 0.8544, test_loss: 0.8998, test_f1: 0.5221
 epoch: 67, train_loss: 0.8526, test_loss: 0.9084, test_f1: 0.5246
 epoch: 68, train_loss: 0.8577, test_loss: 0.8991, test_f1: 0.5183
 epoch: 69, train_loss: 0.8522, test_loss: 0.8825, test_f1: 0.5206
 epoch: 70, train_loss: 0.8606, test_loss: 0.9038, test_f1: 0.5193
 epoch: 71, train_loss: 0.8515, test_loss: 0.8959, test_f1: 0.5186
 epoch: 72, train_loss: 0.8551, test_loss: 0.8915, test_f1: 0.5213
 epoch: 73, train_loss: 0.8520, test_loss: 0.8954, test_f1: 0.5246
 epoch: 74, train_loss: 0.8569, test_loss: 0.8930, test_f1: 0.5214
 epoch: 75, train_loss: 0.8498, test_loss: 0.9004, test_f1: 0.5172
 epoch: 76, train_loss: 0.8457, test_loss: 0.8950, test_f1: 0.5243
 epoch: 77, train_loss: 0.8525, test_loss: 0.8939, test_f1: 0.5200
 epoch: 78, train_loss: 0.8471, test_loss: 0.9046, test_f1: 0.5196
 epoch: 79, train_loss: 0.8501, test_loss: 0.8920, test_f1: 0.5293
 epoch: 80, train_loss: 0.8530, test_loss: 0.8935, test_f1: 0.5301
 epoch: 81, train_loss: 0.8540, test_loss: 0.8921, test_f1: 0.5213
 epoch: 82, train_loss: 0.8466, test_loss: 0.8915, test_f1: 0.5204
 epoch: 83, train_loss: 0.8413, test_loss: 0.8851, test_f1: 0.5274
 epoch: 84, train_loss: 0.8396, test_loss: 0.8855, test_f1: 0.5219
 epoch: 85, train_loss: 0.8395, test_loss: 0.8867, test_f1: 0.5285
 epoch: 86, train_loss: 0.8389, test_loss: 0.8831, test_f1: 0.5346
 epoch: 87, train_loss: 0.8439, test_loss: 0.8876, test_f1: 0.5176
 epoch: 88, train_loss: 0.8393, test_loss: 0.8942, test_f1: 0.5183
 epoch: 89, train_loss: 0.8398, test_loss: 0.8953, test_f1: 0.5272
 epoch: 90, train_loss: 0.8396, test_loss: 0.8916, test_f1: 0.5264
 epoch: 91, train_loss: 0.8353, test_loss: 0.8985, test_f1: 0.5182
 epoch: 92, train_loss: 0.8345, test_loss: 0.8874, test_f1: 0.5243
 epoch: 93, train_loss: 0.8306, test_loss: 0.8784, test_f1: 0.5351
 epoch: 94, train_loss: 0.8332, test_loss: 0.8943, test_f1: 0.5271
 epoch: 95, train_loss: 0.8390, test_loss: 0.8901, test_f1: 0.5290
 epoch: 96, train_loss: 0.8421, test_loss: 0.9025, test_f1: 0.5232
 epoch: 97, train_loss: 0.8290, test_loss: 0.8899, test_f1: 0.5206
 epoch: 98, train_loss: 0.8204, test_loss: 0.8893, test_f1: 0.5245
 epoch: 99, train_loss: 0.8304, test_loss: 0.8987, test_f1: 0.5151
##################ITERATION #6 ****************************************
 epoch: 0, train_loss: 1.3132, test_loss: 1.3432, test_f1: 0.2270
 epoch: 1, train_loss: 1.2615, test_loss: 1.2657, test_f1: 0.2270
 epoch: 2, train_loss: 1.2421, test_loss: 1.1997, test_f1: 0.2270
 epoch: 3, train_loss: 1.2117, test_loss: 1.1619, test_f1: 0.2983
 epoch: 4, train_loss: 1.1869, test_loss: 1.1291, test_f1: 0.3337
 epoch: 5, train_loss: 1.1520, test_loss: 1.1024, test_f1: 0.3738
 epoch: 6, train_loss: 1.1293, test_loss: 1.0803, test_f1: 0.3934
 epoch: 7, train_loss: 1.1114, test_loss: 1.0606, test_f1: 0.4061
 epoch: 8, train_loss: 1.0977, test_loss: 1.0509, test_f1: 0.4126
 epoch: 9, train_loss: 1.0736, test_loss: 1.0454, test_f1: 0.4212
 epoch: 10, train_loss: 1.0680, test_loss: 1.0341, test_f1: 0.4243
 epoch: 11, train_loss: 1.0547, test_loss: 1.0327, test_f1: 0.4329
 epoch: 12, train_loss: 1.0470, test_loss: 1.0198, test_f1: 0.4335
 epoch: 13, train_loss: 1.0321, test_loss: 1.0190, test_f1: 0.4509
 epoch: 14, train_loss: 1.0312, test_loss: 1.0167, test_f1: 0.4411
 epoch: 15, train_loss: 1.0269, test_loss: 1.0193, test_f1: 0.4501
 epoch: 16, train_loss: 1.0216, test_loss: 1.0057, test_f1: 0.4599
 epoch: 17, train_loss: 1.0140, test_loss: 1.0046, test_f1: 0.4639
 epoch: 18, train_loss: 1.0044, test_loss: 0.9908, test_f1: 0.4820
 epoch: 19, train_loss: 1.0048, test_loss: 0.9909, test_f1: 0.4774
 epoch: 20, train_loss: 0.9989, test_loss: 0.9851, test_f1: 0.5018
 epoch: 21, train_loss: 0.9965, test_loss: 1.0053, test_f1: 0.4736
 epoch: 22, train_loss: 0.9851, test_loss: 0.9761, test_f1: 0.4961
 epoch: 23, train_loss: 0.9852, test_loss: 0.9808, test_f1: 0.4922
 epoch: 24, train_loss: 0.9784, test_loss: 0.9773, test_f1: 0.5039
 epoch: 25, train_loss: 0.9779, test_loss: 1.0053, test_f1: 0.4608
 epoch: 26, train_loss: 0.9682, test_loss: 0.9742, test_f1: 0.4937
 epoch: 27, train_loss: 0.9640, test_loss: 0.9562, test_f1: 0.5009
 epoch: 28, train_loss: 0.9615, test_loss: 0.9613, test_f1: 0.5037
 epoch: 29, train_loss: 0.9533, test_loss: 0.9697, test_f1: 0.4808
 epoch: 30, train_loss: 0.9515, test_loss: 0.9643, test_f1: 0.4868
 epoch: 31, train_loss: 0.9457, test_loss: 0.9651, test_f1: 0.4995
 epoch: 32, train_loss: 0.9475, test_loss: 0.9618, test_f1: 0.4909
 epoch: 33, train_loss: 0.9330, test_loss: 0.9725, test_f1: 0.4825
 epoch: 34, train_loss: 0.9380, test_loss: 0.9580, test_f1: 0.4979
 epoch: 35, train_loss: 0.9297, test_loss: 0.9423, test_f1: 0.4926
 epoch: 36, train_loss: 0.9345, test_loss: 0.9404, test_f1: 0.4986
 epoch: 37, train_loss: 0.9233, test_loss: 0.9403, test_f1: 0.5153
 epoch: 38, train_loss: 0.9199, test_loss: 0.9357, test_f1: 0.4942
 epoch: 39, train_loss: 0.9188, test_loss: 0.9326, test_f1: 0.5100
 epoch: 40, train_loss: 0.9143, test_loss: 0.9428, test_f1: 0.5164
 epoch: 41, train_loss: 0.9173, test_loss: 0.9295, test_f1: 0.5167
 epoch: 42, train_loss: 0.9201, test_loss: 0.9759, test_f1: 0.4998
 epoch: 43, train_loss: 0.9151, test_loss: 0.9370, test_f1: 0.5129
 epoch: 44, train_loss: 0.9081, test_loss: 0.9467, test_f1: 0.5292
 epoch: 45, train_loss: 0.9035, test_loss: 0.9326, test_f1: 0.5265
 epoch: 46, train_loss: 0.9053, test_loss: 0.9239, test_f1: 0.5196
 epoch: 47, train_loss: 0.8978, test_loss: 0.9210, test_f1: 0.5223
 epoch: 48, train_loss: 0.9059, test_loss: 0.9230, test_f1: 0.5257
 epoch: 49, train_loss: 0.8931, test_loss: 0.9133, test_f1: 0.5265
 epoch: 50, train_loss: 0.8911, test_loss: 0.9111, test_f1: 0.5310
 epoch: 51, train_loss: 0.8860, test_loss: 0.9135, test_f1: 0.5275
 epoch: 52, train_loss: 0.8841, test_loss: 0.9218, test_f1: 0.5271
 epoch: 53, train_loss: 0.8878, test_loss: 0.9146, test_f1: 0.5363
 epoch: 54, train_loss: 0.8846, test_loss: 0.9148, test_f1: 0.5331
 epoch: 55, train_loss: 0.8850, test_loss: 0.9203, test_f1: 0.5258
 epoch: 56, train_loss: 0.8718, test_loss: 0.9190, test_f1: 0.5287
 epoch: 57, train_loss: 0.8840, test_loss: 0.9169, test_f1: 0.5324
 epoch: 58, train_loss: 0.8769, test_loss: 0.9349, test_f1: 0.5187
 epoch: 59, train_loss: 0.8687, test_loss: 0.9112, test_f1: 0.5353
 epoch: 60, train_loss: 0.8712, test_loss: 0.9119, test_f1: 0.5291
 epoch: 61, train_loss: 0.8767, test_loss: 0.9206, test_f1: 0.5337
 epoch: 62, train_loss: 0.8715, test_loss: 0.9172, test_f1: 0.5330
 epoch: 63, train_loss: 0.8681, test_loss: 0.9057, test_f1: 0.5309
 epoch: 64, train_loss: 0.8712, test_loss: 0.9007, test_f1: 0.5331
 epoch: 65, train_loss: 0.8750, test_loss: 0.9111, test_f1: 0.5311
 epoch: 66, train_loss: 0.8693, test_loss: 0.9120, test_f1: 0.5336
 epoch: 67, train_loss: 0.8745, test_loss: 0.9070, test_f1: 0.5367
 epoch: 68, train_loss: 0.8609, test_loss: 0.9077, test_f1: 0.5427
 epoch: 69, train_loss: 0.8626, test_loss: 0.9104, test_f1: 0.5353
 epoch: 70, train_loss: 0.8708, test_loss: 0.9028, test_f1: 0.5310
 epoch: 71, train_loss: 0.8669, test_loss: 0.9107, test_f1: 0.5351
 epoch: 72, train_loss: 0.8615, test_loss: 0.9079, test_f1: 0.5369
 epoch: 73, train_loss: 0.8586, test_loss: 0.9029, test_f1: 0.5380
 epoch: 74, train_loss: 0.8655, test_loss: 0.9055, test_f1: 0.5376
 epoch: 75, train_loss: 0.8507, test_loss: 0.8996, test_f1: 0.5364
 epoch: 76, train_loss: 0.8619, test_loss: 0.9021, test_f1: 0.5347
 epoch: 77, train_loss: 0.8551, test_loss: 0.9037, test_f1: 0.5357
 epoch: 78, train_loss: 0.8597, test_loss: 0.9057, test_f1: 0.5383
 epoch: 79, train_loss: 0.8554, test_loss: 0.9169, test_f1: 0.5311
 epoch: 80, train_loss: 0.8484, test_loss: 0.9161, test_f1: 0.5453
 epoch: 81, train_loss: 0.8468, test_loss: 0.9046, test_f1: 0.5396
 epoch: 82, train_loss: 0.8514, test_loss: 0.9089, test_f1: 0.5399
 epoch: 83, train_loss: 0.8453, test_loss: 0.9114, test_f1: 0.5388
 epoch: 84, train_loss: 0.8549, test_loss: 0.9028, test_f1: 0.5475
 epoch: 85, train_loss: 0.8458, test_loss: 0.9110, test_f1: 0.5454
 epoch: 86, train_loss: 0.8505, test_loss: 0.9022, test_f1: 0.5320
 epoch: 87, train_loss: 0.8533, test_loss: 0.8909, test_f1: 0.5499
 epoch: 88, train_loss: 0.8530, test_loss: 0.8914, test_f1: 0.5441
 epoch: 89, train_loss: 0.8472, test_loss: 0.9023, test_f1: 0.5465
 epoch: 90, train_loss: 0.8532, test_loss: 0.8965, test_f1: 0.5464
 epoch: 91, train_loss: 0.8462, test_loss: 0.9021, test_f1: 0.5500
 epoch: 92, train_loss: 0.8400, test_loss: 0.8973, test_f1: 0.5470
 epoch: 93, train_loss: 0.8385, test_loss: 0.9033, test_f1: 0.5482
 epoch: 94, train_loss: 0.8432, test_loss: 0.9029, test_f1: 0.5360
 epoch: 95, train_loss: 0.8488, test_loss: 0.8990, test_f1: 0.5387
 epoch: 96, train_loss: 0.8412, test_loss: 0.9079, test_f1: 0.5397
 epoch: 97, train_loss: 0.8427, test_loss: 0.8973, test_f1: 0.5451
 epoch: 98, train_loss: 0.8365, test_loss: 0.8990, test_f1: 0.5520
 epoch: 99, train_loss: 0.8397, test_loss: 0.8998, test_f1: 0.5498
##################ITERATION #7 ****************************************
 epoch: 0, train_loss: 1.2961, test_loss: 1.3155, test_f1: 0.2270
 epoch: 1, train_loss: 1.2269, test_loss: 1.3025, test_f1: 0.2527
 epoch: 2, train_loss: 1.1839, test_loss: 1.1884, test_f1: 0.3456
 epoch: 3, train_loss: 1.1557, test_loss: 1.1089, test_f1: 0.4209
 epoch: 4, train_loss: 1.1287, test_loss: 1.0847, test_f1: 0.4283
 epoch: 5, train_loss: 1.1010, test_loss: 1.0714, test_f1: 0.4354
 epoch: 6, train_loss: 1.0887, test_loss: 1.0583, test_f1: 0.4361
 epoch: 7, train_loss: 1.0748, test_loss: 1.0512, test_f1: 0.4444
 epoch: 8, train_loss: 1.0580, test_loss: 1.0440, test_f1: 0.4462
 epoch: 9, train_loss: 1.0424, test_loss: 1.0351, test_f1: 0.4549
 epoch: 10, train_loss: 1.0356, test_loss: 1.0330, test_f1: 0.4568
 epoch: 11, train_loss: 1.0360, test_loss: 1.0353, test_f1: 0.4566
 epoch: 12, train_loss: 1.0201, test_loss: 1.0298, test_f1: 0.4681
 epoch: 13, train_loss: 1.0121, test_loss: 1.0288, test_f1: 0.4758
 epoch: 14, train_loss: 1.0121, test_loss: 1.0226, test_f1: 0.4824
 epoch: 15, train_loss: 1.0082, test_loss: 1.0152, test_f1: 0.4829
 epoch: 16, train_loss: 0.9994, test_loss: 1.0164, test_f1: 0.4829
 epoch: 17, train_loss: 0.9977, test_loss: 1.0152, test_f1: 0.4805
 epoch: 18, train_loss: 0.9867, test_loss: 1.0111, test_f1: 0.4818
 epoch: 19, train_loss: 0.9860, test_loss: 1.0140, test_f1: 0.4784
 epoch: 20, train_loss: 0.9740, test_loss: 1.0095, test_f1: 0.4834
 epoch: 21, train_loss: 0.9792, test_loss: 1.0086, test_f1: 0.4874
 epoch: 22, train_loss: 0.9734, test_loss: 1.0008, test_f1: 0.4895
 epoch: 23, train_loss: 0.9684, test_loss: 0.9913, test_f1: 0.5004
 epoch: 24, train_loss: 0.9627, test_loss: 1.0157, test_f1: 0.4869
 epoch: 25, train_loss: 0.9640, test_loss: 1.0014, test_f1: 0.4821
 epoch: 26, train_loss: 0.9575, test_loss: 1.0095, test_f1: 0.4844
 epoch: 27, train_loss: 0.9617, test_loss: 1.0061, test_f1: 0.4953
 epoch: 28, train_loss: 0.9552, test_loss: 1.0035, test_f1: 0.4879
 epoch: 29, train_loss: 0.9534, test_loss: 0.9968, test_f1: 0.4985
 epoch: 30, train_loss: 0.9511, test_loss: 0.9997, test_f1: 0.4928
 epoch: 31, train_loss: 0.9437, test_loss: 0.9892, test_f1: 0.4882
 epoch: 32, train_loss: 0.9335, test_loss: 0.9884, test_f1: 0.4980
 epoch: 33, train_loss: 0.9359, test_loss: 0.9953, test_f1: 0.4932
 epoch: 34, train_loss: 0.9489, test_loss: 0.9865, test_f1: 0.4998
 epoch: 35, train_loss: 0.9346, test_loss: 0.9984, test_f1: 0.4972
 epoch: 36, train_loss: 0.9254, test_loss: 0.9844, test_f1: 0.4997
 epoch: 37, train_loss: 0.9280, test_loss: 0.9922, test_f1: 0.4960
 epoch: 38, train_loss: 0.9295, test_loss: 0.9896, test_f1: 0.4937
 epoch: 39, train_loss: 0.9284, test_loss: 0.9957, test_f1: 0.5003
 epoch: 40, train_loss: 0.9202, test_loss: 1.0121, test_f1: 0.4910
 epoch: 41, train_loss: 0.9123, test_loss: 0.9936, test_f1: 0.5112
 epoch: 42, train_loss: 0.9149, test_loss: 0.9872, test_f1: 0.4982
 epoch: 43, train_loss: 0.9159, test_loss: 0.9876, test_f1: 0.5032
 epoch: 44, train_loss: 0.9147, test_loss: 0.9946, test_f1: 0.4949
 epoch: 45, train_loss: 0.9147, test_loss: 0.9847, test_f1: 0.5041
 epoch: 46, train_loss: 0.9155, test_loss: 0.9832, test_f1: 0.5057
 epoch: 47, train_loss: 0.9086, test_loss: 0.9848, test_f1: 0.5076
 epoch: 48, train_loss: 0.9062, test_loss: 0.9930, test_f1: 0.5117
 epoch: 49, train_loss: 0.8992, test_loss: 0.9885, test_f1: 0.5022
 epoch: 50, train_loss: 0.9054, test_loss: 0.9863, test_f1: 0.5066
 epoch: 51, train_loss: 0.8955, test_loss: 0.9985, test_f1: 0.5073
 epoch: 52, train_loss: 0.8931, test_loss: 1.0017, test_f1: 0.5142
 epoch: 53, train_loss: 0.8944, test_loss: 0.9858, test_f1: 0.5024
 epoch: 54, train_loss: 0.8971, test_loss: 0.9854, test_f1: 0.5076
 epoch: 55, train_loss: 0.8930, test_loss: 0.9923, test_f1: 0.5204
 epoch: 56, train_loss: 0.8962, test_loss: 0.9846, test_f1: 0.5084
 epoch: 57, train_loss: 0.8837, test_loss: 0.9877, test_f1: 0.5118
 epoch: 58, train_loss: 0.8811, test_loss: 0.9933, test_f1: 0.5102
 epoch: 59, train_loss: 0.8792, test_loss: 0.9835, test_f1: 0.5098
 epoch: 60, train_loss: 0.8836, test_loss: 0.9948, test_f1: 0.5029
 epoch: 61, train_loss: 0.8768, test_loss: 0.9959, test_f1: 0.5061
 epoch: 62, train_loss: 0.8840, test_loss: 0.9885, test_f1: 0.5152
 epoch: 63, train_loss: 0.8884, test_loss: 0.9870, test_f1: 0.5065
 epoch: 64, train_loss: 0.8776, test_loss: 0.9929, test_f1: 0.5080
 epoch: 65, train_loss: 0.8783, test_loss: 0.9951, test_f1: 0.5086
 epoch: 66, train_loss: 0.8797, test_loss: 1.0030, test_f1: 0.5077
 epoch: 67, train_loss: 0.8768, test_loss: 0.9998, test_f1: 0.5076
 epoch: 68, train_loss: 0.8712, test_loss: 0.9895, test_f1: 0.5064
 epoch: 69, train_loss: 0.8727, test_loss: 0.9989, test_f1: 0.5078
 epoch: 70, train_loss: 0.8779, test_loss: 0.9879, test_f1: 0.5118
 epoch: 71, train_loss: 0.8796, test_loss: 0.9839, test_f1: 0.5115
 epoch: 72, train_loss: 0.8740, test_loss: 0.9885, test_f1: 0.5084
 epoch: 73, train_loss: 0.8748, test_loss: 0.9867, test_f1: 0.5103
 epoch: 74, train_loss: 0.8763, test_loss: 0.9829, test_f1: 0.5114
 epoch: 75, train_loss: 0.8828, test_loss: 0.9872, test_f1: 0.5128
 epoch: 76, train_loss: 0.8698, test_loss: 0.9952, test_f1: 0.5066
 epoch: 77, train_loss: 0.8702, test_loss: 0.9882, test_f1: 0.5127
 epoch: 78, train_loss: 0.8796, test_loss: 0.9837, test_f1: 0.5133
 epoch: 79, train_loss: 0.8700, test_loss: 0.9949, test_f1: 0.5147
 epoch: 80, train_loss: 0.8579, test_loss: 0.9973, test_f1: 0.5098
 epoch: 81, train_loss: 0.8553, test_loss: 0.9914, test_f1: 0.5142
 epoch: 82, train_loss: 0.8650, test_loss: 0.9958, test_f1: 0.5244
 epoch: 83, train_loss: 0.8665, test_loss: 1.0012, test_f1: 0.5142
 epoch: 84, train_loss: 0.8644, test_loss: 0.9859, test_f1: 0.5113
 epoch: 85, train_loss: 0.8606, test_loss: 0.9962, test_f1: 0.5097
 epoch: 86, train_loss: 0.8623, test_loss: 1.0005, test_f1: 0.5191
 epoch: 87, train_loss: 0.8645, test_loss: 0.9884, test_f1: 0.5112
 epoch: 88, train_loss: 0.8704, test_loss: 0.9886, test_f1: 0.5146
 epoch: 89, train_loss: 0.8579, test_loss: 0.9927, test_f1: 0.5197
 epoch: 90, train_loss: 0.8647, test_loss: 1.0016, test_f1: 0.5119
 epoch: 91, train_loss: 0.8588, test_loss: 0.9989, test_f1: 0.5170
 epoch: 92, train_loss: 0.8722, test_loss: 0.9980, test_f1: 0.5127
 epoch: 93, train_loss: 0.8661, test_loss: 0.9920, test_f1: 0.5095
 epoch: 94, train_loss: 0.8592, test_loss: 0.9927, test_f1: 0.5134
 epoch: 95, train_loss: 0.8549, test_loss: 1.0001, test_f1: 0.5068
 epoch: 96, train_loss: 0.8607, test_loss: 0.9924, test_f1: 0.5168
 epoch: 97, train_loss: 0.8546, test_loss: 0.9919, test_f1: 0.5185
 epoch: 98, train_loss: 0.8511, test_loss: 0.9846, test_f1: 0.5122
 epoch: 99, train_loss: 0.8562, test_loss: 0.9999, test_f1: 0.5040
##################ITERATION #8 ****************************************
 epoch: 0, train_loss: 1.2825, test_loss: 1.3325, test_f1: 0.2270
 epoch: 1, train_loss: 1.2040, test_loss: 1.2908, test_f1: 0.2270
 epoch: 2, train_loss: 1.1897, test_loss: 1.1732, test_f1: 0.2501
 epoch: 3, train_loss: 1.1610, test_loss: 1.1065, test_f1: 0.3722
 epoch: 4, train_loss: 1.1457, test_loss: 1.0921, test_f1: 0.3875
 epoch: 5, train_loss: 1.1305, test_loss: 1.0835, test_f1: 0.4031
 epoch: 6, train_loss: 1.1056, test_loss: 1.0774, test_f1: 0.4306
 epoch: 7, train_loss: 1.0976, test_loss: 1.0657, test_f1: 0.4466
 epoch: 8, train_loss: 1.0841, test_loss: 1.0592, test_f1: 0.4570
 epoch: 9, train_loss: 1.0718, test_loss: 1.0509, test_f1: 0.4432
 epoch: 10, train_loss: 1.0557, test_loss: 1.0439, test_f1: 0.4511
 epoch: 11, train_loss: 1.0494, test_loss: 1.0354, test_f1: 0.4607
 epoch: 12, train_loss: 1.0402, test_loss: 1.0395, test_f1: 0.4742
 epoch: 13, train_loss: 1.0358, test_loss: 1.0344, test_f1: 0.4491
 epoch: 14, train_loss: 1.0234, test_loss: 1.0199, test_f1: 0.4625
 epoch: 15, train_loss: 1.0160, test_loss: 1.0121, test_f1: 0.4611
 epoch: 16, train_loss: 1.0114, test_loss: 1.0193, test_f1: 0.4773
 epoch: 17, train_loss: 1.0038, test_loss: 1.0102, test_f1: 0.4755
 epoch: 18, train_loss: 1.0008, test_loss: 1.0051, test_f1: 0.4803
 epoch: 19, train_loss: 0.9946, test_loss: 0.9947, test_f1: 0.4884
 epoch: 20, train_loss: 0.9843, test_loss: 0.9917, test_f1: 0.4888
 epoch: 21, train_loss: 0.9748, test_loss: 0.9856, test_f1: 0.4880
 epoch: 22, train_loss: 0.9880, test_loss: 0.9836, test_f1: 0.4754
 epoch: 23, train_loss: 0.9752, test_loss: 0.9780, test_f1: 0.4979
 epoch: 24, train_loss: 0.9810, test_loss: 0.9708, test_f1: 0.4977
 epoch: 25, train_loss: 0.9752, test_loss: 0.9717, test_f1: 0.4964
 epoch: 26, train_loss: 0.9675, test_loss: 0.9684, test_f1: 0.5042
 epoch: 27, train_loss: 0.9595, test_loss: 0.9566, test_f1: 0.5088
 epoch: 28, train_loss: 0.9595, test_loss: 0.9639, test_f1: 0.5071
 epoch: 29, train_loss: 0.9572, test_loss: 0.9599, test_f1: 0.4988
 epoch: 30, train_loss: 0.9555, test_loss: 0.9519, test_f1: 0.5057
 epoch: 31, train_loss: 0.9436, test_loss: 0.9388, test_f1: 0.5074
 epoch: 32, train_loss: 0.9390, test_loss: 0.9354, test_f1: 0.5137
 epoch: 33, train_loss: 0.9451, test_loss: 0.9257, test_f1: 0.5221
 epoch: 34, train_loss: 0.9408, test_loss: 0.9348, test_f1: 0.5082
 epoch: 35, train_loss: 0.9371, test_loss: 0.9326, test_f1: 0.5162
 epoch: 36, train_loss: 0.9382, test_loss: 0.9285, test_f1: 0.5162
 epoch: 37, train_loss: 0.9399, test_loss: 0.9174, test_f1: 0.5168
 epoch: 38, train_loss: 0.9230, test_loss: 0.9218, test_f1: 0.5180
 epoch: 39, train_loss: 0.9222, test_loss: 0.9117, test_f1: 0.5164
 epoch: 40, train_loss: 0.9183, test_loss: 0.9184, test_f1: 0.5161
 epoch: 41, train_loss: 0.9229, test_loss: 0.8987, test_f1: 0.5233
 epoch: 42, train_loss: 0.9178, test_loss: 0.9086, test_f1: 0.5224
 epoch: 43, train_loss: 0.9120, test_loss: 0.8979, test_f1: 0.5264
 epoch: 44, train_loss: 0.9146, test_loss: 0.8935, test_f1: 0.5225
 epoch: 45, train_loss: 0.9044, test_loss: 0.8992, test_f1: 0.5250
 epoch: 46, train_loss: 0.9066, test_loss: 0.9129, test_f1: 0.5170
 epoch: 47, train_loss: 0.9022, test_loss: 0.9023, test_f1: 0.5164
 epoch: 48, train_loss: 0.8980, test_loss: 0.9056, test_f1: 0.5211
 epoch: 49, train_loss: 0.9021, test_loss: 0.8976, test_f1: 0.5186
 epoch: 50, train_loss: 0.8930, test_loss: 0.8897, test_f1: 0.5210
 epoch: 51, train_loss: 0.8945, test_loss: 0.8958, test_f1: 0.5248
 epoch: 52, train_loss: 0.8866, test_loss: 0.8919, test_f1: 0.5273
 epoch: 53, train_loss: 0.8820, test_loss: 0.8947, test_f1: 0.5237
 epoch: 54, train_loss: 0.8837, test_loss: 0.8901, test_f1: 0.5220
 epoch: 55, train_loss: 0.8840, test_loss: 0.8872, test_f1: 0.5221
 epoch: 56, train_loss: 0.8765, test_loss: 0.8846, test_f1: 0.5269
 epoch: 57, train_loss: 0.8869, test_loss: 0.8795, test_f1: 0.5239
 epoch: 58, train_loss: 0.8776, test_loss: 0.8818, test_f1: 0.5181
 epoch: 59, train_loss: 0.8694, test_loss: 0.8865, test_f1: 0.5332
 epoch: 60, train_loss: 0.8764, test_loss: 0.8848, test_f1: 0.5339
 epoch: 61, train_loss: 0.8772, test_loss: 0.8898, test_f1: 0.5212
 epoch: 62, train_loss: 0.8734, test_loss: 0.8918, test_f1: 0.5372
 epoch: 63, train_loss: 0.8700, test_loss: 0.8777, test_f1: 0.5276
 epoch: 64, train_loss: 0.8697, test_loss: 0.8766, test_f1: 0.5294
 epoch: 65, train_loss: 0.8716, test_loss: 0.8679, test_f1: 0.5225
 epoch: 66, train_loss: 0.8741, test_loss: 0.8710, test_f1: 0.5213
 epoch: 67, train_loss: 0.8675, test_loss: 0.8624, test_f1: 0.5269
 epoch: 68, train_loss: 0.8741, test_loss: 0.8798, test_f1: 0.5246
 epoch: 69, train_loss: 0.8676, test_loss: 0.8765, test_f1: 0.5329
 epoch: 70, train_loss: 0.8649, test_loss: 0.8859, test_f1: 0.5152
 epoch: 71, train_loss: 0.8653, test_loss: 0.8796, test_f1: 0.5264
 epoch: 72, train_loss: 0.8556, test_loss: 0.8712, test_f1: 0.5247
 epoch: 73, train_loss: 0.8600, test_loss: 0.8709, test_f1: 0.5274
 epoch: 74, train_loss: 0.8648, test_loss: 0.8636, test_f1: 0.5272
 epoch: 75, train_loss: 0.8572, test_loss: 0.8705, test_f1: 0.5291
 epoch: 76, train_loss: 0.8574, test_loss: 0.8763, test_f1: 0.5251
 epoch: 77, train_loss: 0.8549, test_loss: 0.8749, test_f1: 0.5268
 epoch: 78, train_loss: 0.8549, test_loss: 0.8739, test_f1: 0.5212
 epoch: 79, train_loss: 0.8485, test_loss: 0.8728, test_f1: 0.5238
 epoch: 80, train_loss: 0.8481, test_loss: 0.8677, test_f1: 0.5302
 epoch: 81, train_loss: 0.8522, test_loss: 0.8685, test_f1: 0.5244
 epoch: 82, train_loss: 0.8532, test_loss: 0.8573, test_f1: 0.5420
 epoch: 83, train_loss: 0.8544, test_loss: 0.8533, test_f1: 0.5316
 epoch: 84, train_loss: 0.8481, test_loss: 0.8672, test_f1: 0.5490
 epoch: 85, train_loss: 0.8561, test_loss: 0.8630, test_f1: 0.5334
 epoch: 86, train_loss: 0.8599, test_loss: 0.8551, test_f1: 0.5335
 epoch: 87, train_loss: 0.8550, test_loss: 0.8598, test_f1: 0.5471
 epoch: 88, train_loss: 0.8490, test_loss: 0.8523, test_f1: 0.5364
 epoch: 89, train_loss: 0.8421, test_loss: 0.8729, test_f1: 0.5453
 epoch: 90, train_loss: 0.8467, test_loss: 0.8641, test_f1: 0.5244
 epoch: 91, train_loss: 0.8513, test_loss: 0.8690, test_f1: 0.5422
 epoch: 92, train_loss: 0.8411, test_loss: 0.8688, test_f1: 0.5482
 epoch: 93, train_loss: 0.8424, test_loss: 0.8571, test_f1: 0.5629
 epoch: 94, train_loss: 0.8369, test_loss: 0.8577, test_f1: 0.5469
 epoch: 95, train_loss: 0.8357, test_loss: 0.8563, test_f1: 0.5457
 epoch: 96, train_loss: 0.8421, test_loss: 0.8455, test_f1: 0.5483
 epoch: 97, train_loss: 0.8432, test_loss: 0.8658, test_f1: 0.5584
 epoch: 98, train_loss: 0.8277, test_loss: 0.8552, test_f1: 0.5545
 epoch: 99, train_loss: 0.8319, test_loss: 0.8556, test_f1: 0.5433
##################ITERATION #9 ****************************************
 epoch: 0, train_loss: 1.3034, test_loss: 1.3296, test_f1: 0.2270
 epoch: 1, train_loss: 1.2040, test_loss: 1.2437, test_f1: 0.2345
 epoch: 2, train_loss: 1.1686, test_loss: 1.1356, test_f1: 0.3767
 epoch: 3, train_loss: 1.1534, test_loss: 1.0998, test_f1: 0.3937
 epoch: 4, train_loss: 1.1231, test_loss: 1.0831, test_f1: 0.3997
 epoch: 5, train_loss: 1.1010, test_loss: 1.0687, test_f1: 0.4095
 epoch: 6, train_loss: 1.0874, test_loss: 1.0611, test_f1: 0.4376
 epoch: 7, train_loss: 1.0705, test_loss: 1.0571, test_f1: 0.4200
 epoch: 8, train_loss: 1.0591, test_loss: 1.0486, test_f1: 0.4448
 epoch: 9, train_loss: 1.0522, test_loss: 1.0379, test_f1: 0.4408
 epoch: 10, train_loss: 1.0359, test_loss: 1.0395, test_f1: 0.4623
 epoch: 11, train_loss: 1.0317, test_loss: 1.0372, test_f1: 0.4594
 epoch: 12, train_loss: 1.0304, test_loss: 1.0294, test_f1: 0.4794
 epoch: 13, train_loss: 1.0200, test_loss: 1.0253, test_f1: 0.4573
 epoch: 14, train_loss: 1.0093, test_loss: 1.0124, test_f1: 0.4640
 epoch: 15, train_loss: 1.0055, test_loss: 1.0109, test_f1: 0.4662
 epoch: 16, train_loss: 1.0014, test_loss: 1.0123, test_f1: 0.4728
 epoch: 17, train_loss: 0.9980, test_loss: 1.0004, test_f1: 0.4702
 epoch: 18, train_loss: 0.9913, test_loss: 1.0009, test_f1: 0.4724
 epoch: 19, train_loss: 0.9880, test_loss: 0.9975, test_f1: 0.4862
 epoch: 20, train_loss: 0.9786, test_loss: 0.9921, test_f1: 0.4949
 epoch: 21, train_loss: 0.9831, test_loss: 0.9938, test_f1: 0.4823
 epoch: 22, train_loss: 0.9746, test_loss: 0.9797, test_f1: 0.4932
 epoch: 23, train_loss: 0.9707, test_loss: 0.9781, test_f1: 0.4953
 epoch: 24, train_loss: 0.9660, test_loss: 0.9722, test_f1: 0.5018
 epoch: 25, train_loss: 0.9617, test_loss: 0.9739, test_f1: 0.4938
 epoch: 26, train_loss: 0.9578, test_loss: 0.9699, test_f1: 0.5167
 epoch: 27, train_loss: 0.9501, test_loss: 0.9692, test_f1: 0.5176
 epoch: 28, train_loss: 0.9526, test_loss: 0.9582, test_f1: 0.5008
 epoch: 29, train_loss: 0.9520, test_loss: 0.9558, test_f1: 0.5144
 epoch: 30, train_loss: 0.9453, test_loss: 0.9592, test_f1: 0.4949
 epoch: 31, train_loss: 0.9418, test_loss: 0.9619, test_f1: 0.5138
 epoch: 32, train_loss: 0.9385, test_loss: 0.9525, test_f1: 0.5216
 epoch: 33, train_loss: 0.9394, test_loss: 0.9587, test_f1: 0.5064
 epoch: 34, train_loss: 0.9302, test_loss: 0.9520, test_f1: 0.5143
 epoch: 35, train_loss: 0.9226, test_loss: 0.9476, test_f1: 0.5209
 epoch: 36, train_loss: 0.9237, test_loss: 0.9473, test_f1: 0.5287
 epoch: 37, train_loss: 0.9224, test_loss: 0.9379, test_f1: 0.5286
 epoch: 38, train_loss: 0.9166, test_loss: 0.9397, test_f1: 0.5218
 epoch: 39, train_loss: 0.9194, test_loss: 0.9437, test_f1: 0.5188
 epoch: 40, train_loss: 0.9066, test_loss: 0.9341, test_f1: 0.5312
 epoch: 41, train_loss: 0.9046, test_loss: 0.9438, test_f1: 0.5215
 epoch: 42, train_loss: 0.9081, test_loss: 0.9354, test_f1: 0.5218
 epoch: 43, train_loss: 0.9093, test_loss: 0.9384, test_f1: 0.5290
 epoch: 44, train_loss: 0.9005, test_loss: 0.9264, test_f1: 0.5323
 epoch: 45, train_loss: 0.8918, test_loss: 0.9246, test_f1: 0.5157
 epoch: 46, train_loss: 0.8929, test_loss: 0.9360, test_f1: 0.5182
 epoch: 47, train_loss: 0.8893, test_loss: 0.9285, test_f1: 0.5172
 epoch: 48, train_loss: 0.8885, test_loss: 0.9240, test_f1: 0.5025
 epoch: 49, train_loss: 0.8891, test_loss: 0.9354, test_f1: 0.5299
 epoch: 50, train_loss: 0.8789, test_loss: 0.9271, test_f1: 0.5170
 epoch: 51, train_loss: 0.8845, test_loss: 0.9236, test_f1: 0.5196
 epoch: 52, train_loss: 0.8914, test_loss: 0.9193, test_f1: 0.5093
 epoch: 53, train_loss: 0.8827, test_loss: 0.9167, test_f1: 0.5231
 epoch: 54, train_loss: 0.8718, test_loss: 0.9027, test_f1: 0.5271
 epoch: 55, train_loss: 0.8778, test_loss: 0.9153, test_f1: 0.5176
 epoch: 56, train_loss: 0.8788, test_loss: 0.9130, test_f1: 0.5244
 epoch: 57, train_loss: 0.8713, test_loss: 0.9010, test_f1: 0.5297
 epoch: 58, train_loss: 0.8858, test_loss: 0.9028, test_f1: 0.5372
 epoch: 59, train_loss: 0.8662, test_loss: 0.9057, test_f1: 0.5273
 epoch: 60, train_loss: 0.8760, test_loss: 0.9048, test_f1: 0.5255
 epoch: 61, train_loss: 0.8679, test_loss: 0.9071, test_f1: 0.5300
 epoch: 62, train_loss: 0.8705, test_loss: 0.9169, test_f1: 0.5143
 epoch: 63, train_loss: 0.8709, test_loss: 0.9197, test_f1: 0.5199
 epoch: 64, train_loss: 0.8648, test_loss: 0.9114, test_f1: 0.5244
 epoch: 65, train_loss: 0.8571, test_loss: 0.9033, test_f1: 0.5243
 epoch: 66, train_loss: 0.8553, test_loss: 0.9231, test_f1: 0.5260
 epoch: 67, train_loss: 0.8569, test_loss: 0.9033, test_f1: 0.5198
 epoch: 68, train_loss: 0.8681, test_loss: 0.9000, test_f1: 0.5174
 epoch: 69, train_loss: 0.8614, test_loss: 0.9016, test_f1: 0.5253
 epoch: 70, train_loss: 0.8697, test_loss: 0.8998, test_f1: 0.5259
 epoch: 71, train_loss: 0.8545, test_loss: 0.9176, test_f1: 0.5136
 epoch: 72, train_loss: 0.8579, test_loss: 0.9045, test_f1: 0.5235
 epoch: 73, train_loss: 0.8491, test_loss: 0.9011, test_f1: 0.5091
 epoch: 74, train_loss: 0.8367, test_loss: 0.9139, test_f1: 0.5160
 epoch: 75, train_loss: 0.8550, test_loss: 0.9093, test_f1: 0.5152
 epoch: 76, train_loss: 0.8541, test_loss: 0.8982, test_f1: 0.5219
 epoch: 77, train_loss: 0.8524, test_loss: 0.9044, test_f1: 0.5165
 epoch: 78, train_loss: 0.8564, test_loss: 0.8863, test_f1: 0.5294
 epoch: 79, train_loss: 0.8471, test_loss: 0.8967, test_f1: 0.5122
 epoch: 80, train_loss: 0.8463, test_loss: 0.8970, test_f1: 0.5224
 epoch: 81, train_loss: 0.8442, test_loss: 0.8911, test_f1: 0.5185
 epoch: 82, train_loss: 0.8412, test_loss: 0.9232, test_f1: 0.5071
 epoch: 83, train_loss: 0.8376, test_loss: 0.9019, test_f1: 0.5128
 epoch: 84, train_loss: 0.8422, test_loss: 0.9021, test_f1: 0.5216
 epoch: 85, train_loss: 0.8449, test_loss: 0.9029, test_f1: 0.5251
 epoch: 86, train_loss: 0.8356, test_loss: 0.8973, test_f1: 0.5353
 epoch: 87, train_loss: 0.8441, test_loss: 0.8930, test_f1: 0.5253
 epoch: 88, train_loss: 0.8283, test_loss: 0.8956, test_f1: 0.5180
 epoch: 89, train_loss: 0.8326, test_loss: 0.9033, test_f1: 0.5169
 epoch: 90, train_loss: 0.8260, test_loss: 0.8933, test_f1: 0.5263
 epoch: 91, train_loss: 0.8311, test_loss: 0.9009, test_f1: 0.5157
 epoch: 92, train_loss: 0.8369, test_loss: 0.9044, test_f1: 0.5301
 epoch: 93, train_loss: 0.8301, test_loss: 0.9024, test_f1: 0.5232
 epoch: 94, train_loss: 0.8315, test_loss: 0.8938, test_f1: 0.5241
 epoch: 95, train_loss: 0.8318, test_loss: 0.8897, test_f1: 0.5313
 epoch: 96, train_loss: 0.8253, test_loss: 0.8982, test_f1: 0.5269
 epoch: 97, train_loss: 0.8223, test_loss: 0.8981, test_f1: 0.5253
 epoch: 98, train_loss: 0.8212, test_loss: 0.8996, test_f1: 0.5182
 epoch: 99, train_loss: 0.8183, test_loss: 0.9048, test_f1: 0.5258

Training completed in 557.21 seconds
Best F1: 0.5629 at epoch 93
Mean F1 across iterations: 0.5430  0.0105
========================FINAL RESULTS================================
FEGIN weighted F1: 0.5629  0.0105
python main.py --data ltspice_examples --representation component_pin_net --model FEGIN --layers 5 --hiddens 32 --batch_size 128 --lr 0.0001 --emb_size 512 --epochs 100 --save_appendix component_pin_net_L5_H32_BS128_LR0.0001_E512 --no_val
-----



STDERR:
  File "main.py", line 370, in <module>
    main()
  File "main.py", line 254, in main
    dataset = dataset_class(
  File "/home/philip/projects/ltspice_examples_code_repo/Circuit-Completion-Using-GNNs/component_classification_with_link_prediction_head/evaluation/FEGIN/kernel/circuit_datasets.py", line 15, in __init__
    self.data, self.slices = torch.load(self.processed_paths[0])
  File "/home/philip/.local/lib/python3.8/site-packages/torch/serialization.py", line 1040, in load
    warnings.warn(
  File "/usr/lib/python3.8/warnings.py", line 109, in _showwarnmsg
    sw(msg.message, msg.category, msg.filename, msg.lineno,
  File "main.py", line 47, in warn_with_traceback
    traceback.print_stack(file=log)
/home/philip/projects/ltspice_examples_code_repo/Circuit-Completion-Using-GNNs/component_classification_with_link_prediction_head/evaluation/FEGIN/kernel/circuit_datasets.py:15: FutureWarning: You are using `torch.load` with `weights_only=False` (the current default value), which uses the default pickle module implicitly. It is possible to construct malicious pickle data which will execute arbitrary code during unpickling (See https://github.com/pytorch/pytorch/blob/main/SECURITY.md#untrusted-models for more details). In a future release, the default value for `weights_only` will be flipped to `True`. This limits the functions that could be executed during unpickling. Arbitrary objects will no longer be allowed to be loaded via this mode unless they are explicitly allowlisted by the user via `torch.serialization.add_safe_globals`. We recommend you start setting `weights_only=True` for any use case where you don't have full control of the loaded file. Please open an issue on GitHub for any issues related to this experimental feature.
  self.data, self.slices = torch.load(self.processed_paths[0])
