STDOUT:
Results will be saved in /home/philip/projects/ltspice_examples_code_repo/Circuit-Completion-Using-GNNs/component_classification_with_link_prediction_head/evaluation/FEGIN/results/model_FEGIN_dataset_ltspice_examples
Command line input: python main.py --data ltspice_examples --representation component_net --model FEGIN --layers 4 --hiddens 128 --batch_size 64 --lr 0.001 --emb_size 128 --epochs 100 --save_appendix component_net_L4_H128_BS64_LR0.001_E128 --no_val
 is saved.
-----
ltspice_examples - FEGIN
Using 4 layers, 128 hidden units, h = 2
Loading component_net representation dataset
Loading component_net representation data...
Loaded 4404 examples (component_net)
saving path: data/processed/ltspice_examples_component_net_processed.pt
ENTERED
Training FEGIN on component_net representation
Train: 3558, Test: 846
##################ITERATION #0 ****************************************
 epoch: 0, train_loss: 1.1821, test_loss: 1.0325, test_f1: 0.4742
 epoch: 1, train_loss: 0.9823, test_loss: 0.9562, test_f1: 0.5053
 epoch: 2, train_loss: 0.9356, test_loss: 0.9325, test_f1: 0.5255
 epoch: 3, train_loss: 0.9218, test_loss: 0.8766, test_f1: 0.5384
 epoch: 4, train_loss: 0.8950, test_loss: 0.8557, test_f1: 0.5661
 epoch: 5, train_loss: 0.8766, test_loss: 0.9152, test_f1: 0.5176
 epoch: 6, train_loss: 0.8486, test_loss: 0.9250, test_f1: 0.5386
 epoch: 7, train_loss: 0.8423, test_loss: 0.9511, test_f1: 0.5809
 epoch: 8, train_loss: 0.8210, test_loss: 0.9773, test_f1: 0.5403
 epoch: 9, train_loss: 0.8101, test_loss: 0.9282, test_f1: 0.5794
 epoch: 10, train_loss: 0.7884, test_loss: 0.9449, test_f1: 0.5777
 epoch: 11, train_loss: 0.7908, test_loss: 0.9421, test_f1: 0.6056
 epoch: 12, train_loss: 0.7760, test_loss: 0.9734, test_f1: 0.5941
 epoch: 13, train_loss: 0.7535, test_loss: 0.9347, test_f1: 0.6025
 epoch: 14, train_loss: 0.7333, test_loss: 0.9940, test_f1: 0.6054
 epoch: 15, train_loss: 0.7292, test_loss: 0.9311, test_f1: 0.6068
 epoch: 16, train_loss: 0.7272, test_loss: 0.8965, test_f1: 0.5991
 epoch: 17, train_loss: 0.7175, test_loss: 0.9637, test_f1: 0.6122
 epoch: 18, train_loss: 0.6975, test_loss: 1.0372, test_f1: 0.5650
 epoch: 19, train_loss: 0.6935, test_loss: 1.0992, test_f1: 0.5521
 epoch: 20, train_loss: 0.6885, test_loss: 0.9498, test_f1: 0.6206
 epoch: 21, train_loss: 0.6652, test_loss: 0.9502, test_f1: 0.6493
 epoch: 22, train_loss: 0.6607, test_loss: 1.0300, test_f1: 0.6308
 epoch: 23, train_loss: 0.6344, test_loss: 0.9388, test_f1: 0.6627
 epoch: 24, train_loss: 0.6448, test_loss: 0.9686, test_f1: 0.6368
 epoch: 25, train_loss: 0.6243, test_loss: 0.9379, test_f1: 0.6808
 epoch: 26, train_loss: 0.5991, test_loss: 1.0205, test_f1: 0.6332
 epoch: 27, train_loss: 0.5950, test_loss: 1.0097, test_f1: 0.6647
 epoch: 28, train_loss: 0.5661, test_loss: 1.0530, test_f1: 0.6078
 epoch: 29, train_loss: 0.5563, test_loss: 0.9644, test_f1: 0.6664
 epoch: 30, train_loss: 0.5605, test_loss: 1.0013, test_f1: 0.6539
 epoch: 31, train_loss: 0.5539, test_loss: 1.0736, test_f1: 0.6207
 epoch: 32, train_loss: 0.5594, test_loss: 0.9978, test_f1: 0.6461
 epoch: 33, train_loss: 0.5368, test_loss: 1.0137, test_f1: 0.6457
 epoch: 34, train_loss: 0.5187, test_loss: 1.0282, test_f1: 0.6508
 epoch: 35, train_loss: 0.5270, test_loss: 1.0658, test_f1: 0.6258
 epoch: 36, train_loss: 0.5251, test_loss: 1.0152, test_f1: 0.6418
 epoch: 37, train_loss: 0.4998, test_loss: 1.1725, test_f1: 0.6306
 epoch: 38, train_loss: 0.4891, test_loss: 1.2754, test_f1: 0.6010
 epoch: 39, train_loss: 0.4710, test_loss: 1.3135, test_f1: 0.6037
 epoch: 40, train_loss: 0.4849, test_loss: 1.2158, test_f1: 0.6256
 epoch: 41, train_loss: 0.4765, test_loss: 1.1054, test_f1: 0.6268
 epoch: 42, train_loss: 0.4463, test_loss: 1.2722, test_f1: 0.6403
 epoch: 43, train_loss: 0.4566, test_loss: 1.0989, test_f1: 0.6621
 epoch: 44, train_loss: 0.4090, test_loss: 1.2471, test_f1: 0.6487
 epoch: 45, train_loss: 0.4477, test_loss: 1.1889, test_f1: 0.6580
 epoch: 46, train_loss: 0.4326, test_loss: 1.2522, test_f1: 0.6422
 epoch: 47, train_loss: 0.4124, test_loss: 1.2340, test_f1: 0.6403
 epoch: 48, train_loss: 0.3874, test_loss: 1.3750, test_f1: 0.6513
 epoch: 49, train_loss: 0.3767, test_loss: 1.3878, test_f1: 0.6492
 epoch: 50, train_loss: 0.3921, test_loss: 1.2535, test_f1: 0.6517
 epoch: 51, train_loss: 0.3315, test_loss: 1.4233, test_f1: 0.6476
 epoch: 52, train_loss: 0.3289, test_loss: 1.4512, test_f1: 0.6488
 epoch: 53, train_loss: 0.3060, test_loss: 1.3883, test_f1: 0.6573
 epoch: 54, train_loss: 0.2984, test_loss: 1.5231, test_f1: 0.6406
 epoch: 55, train_loss: 0.2769, test_loss: 1.5233, test_f1: 0.6507
 epoch: 56, train_loss: 0.2787, test_loss: 1.5076, test_f1: 0.6603
 epoch: 57, train_loss: 0.2631, test_loss: 1.6870, test_f1: 0.6353
 epoch: 58, train_loss: 0.2946, test_loss: 1.5617, test_f1: 0.6332
 epoch: 59, train_loss: 0.2752, test_loss: 1.6015, test_f1: 0.6412
 epoch: 60, train_loss: 0.2794, test_loss: 1.6904, test_f1: 0.6479
 epoch: 61, train_loss: 0.2497, test_loss: 1.6912, test_f1: 0.6532
 epoch: 62, train_loss: 0.2715, test_loss: 1.5961, test_f1: 0.6491
 epoch: 63, train_loss: 0.2641, test_loss: 1.7452, test_f1: 0.6367
 epoch: 64, train_loss: 0.2564, test_loss: 1.7138, test_f1: 0.6483
 epoch: 65, train_loss: 0.2560, test_loss: 1.7656, test_f1: 0.6572
 epoch: 66, train_loss: 0.2422, test_loss: 1.8156, test_f1: 0.6507
 epoch: 67, train_loss: 0.2465, test_loss: 1.7983, test_f1: 0.6512
 epoch: 68, train_loss: 0.2337, test_loss: 1.9027, test_f1: 0.6523
 epoch: 69, train_loss: 0.2239, test_loss: 1.8429, test_f1: 0.6273
 epoch: 70, train_loss: 0.2328, test_loss: 1.8051, test_f1: 0.6340
 epoch: 71, train_loss: 0.2326, test_loss: 1.8645, test_f1: 0.6385
 epoch: 72, train_loss: 0.2077, test_loss: 1.9449, test_f1: 0.6535
 epoch: 73, train_loss: 0.2124, test_loss: 1.9147, test_f1: 0.6344
 epoch: 74, train_loss: 0.2141, test_loss: 1.8865, test_f1: 0.6380
 epoch: 75, train_loss: 0.2153, test_loss: 1.9435, test_f1: 0.6406
 epoch: 76, train_loss: 0.2192, test_loss: 1.8296, test_f1: 0.6289
 epoch: 77, train_loss: 0.1996, test_loss: 1.9427, test_f1: 0.6453
 epoch: 78, train_loss: 0.2090, test_loss: 2.0494, test_f1: 0.6325
 epoch: 79, train_loss: 0.2217, test_loss: 1.9861, test_f1: 0.6495
 epoch: 80, train_loss: 0.2143, test_loss: 1.8534, test_f1: 0.6369
 epoch: 81, train_loss: 0.1999, test_loss: 2.1140, test_f1: 0.6391
 epoch: 82, train_loss: 0.1998, test_loss: 2.1243, test_f1: 0.6339
 epoch: 83, train_loss: 0.2367, test_loss: 2.0568, test_f1: 0.6572
 epoch: 84, train_loss: 0.1787, test_loss: 2.1310, test_f1: 0.6366
 epoch: 85, train_loss: 0.2090, test_loss: 2.0632, test_f1: 0.6412
 epoch: 86, train_loss: 0.1990, test_loss: 2.0793, test_f1: 0.6499
 epoch: 87, train_loss: 0.1892, test_loss: 2.0810, test_f1: 0.6404
 epoch: 88, train_loss: 0.1858, test_loss: 2.1452, test_f1: 0.6383
 epoch: 89, train_loss: 0.1675, test_loss: 2.2210, test_f1: 0.6330
 epoch: 90, train_loss: 0.1738, test_loss: 2.1379, test_f1: 0.6532
 epoch: 91, train_loss: 0.1711, test_loss: 2.1687, test_f1: 0.6398
 epoch: 92, train_loss: 0.1651, test_loss: 2.2357, test_f1: 0.6501
 epoch: 93, train_loss: 0.1869, test_loss: 2.2630, test_f1: 0.6263
 epoch: 94, train_loss: 0.1996, test_loss: 2.3325, test_f1: 0.6276
 epoch: 95, train_loss: 0.1721, test_loss: 2.1439, test_f1: 0.6281
 epoch: 96, train_loss: 0.1680, test_loss: 2.3009, test_f1: 0.6120
 epoch: 97, train_loss: 0.1598, test_loss: 2.4330, test_f1: 0.6447
 epoch: 98, train_loss: 0.1688, test_loss: 2.3788, test_f1: 0.6311
 epoch: 99, train_loss: 0.1667, test_loss: 2.3128, test_f1: 0.6404
##################ITERATION #1 ****************************************
 epoch: 0, train_loss: 1.1129, test_loss: 0.9855, test_f1: 0.4947
 epoch: 1, train_loss: 0.9717, test_loss: 0.8998, test_f1: 0.5020
 epoch: 2, train_loss: 0.9214, test_loss: 0.9436, test_f1: 0.5643
 epoch: 3, train_loss: 0.8974, test_loss: 1.0158, test_f1: 0.5347
 epoch: 4, train_loss: 0.8722, test_loss: 0.9146, test_f1: 0.5676
 epoch: 5, train_loss: 0.8643, test_loss: 0.9385, test_f1: 0.5572
 epoch: 6, train_loss: 0.8473, test_loss: 0.9416, test_f1: 0.5677
 epoch: 7, train_loss: 0.8230, test_loss: 0.9655, test_f1: 0.5310
 epoch: 8, train_loss: 0.8042, test_loss: 1.0375, test_f1: 0.5700
 epoch: 9, train_loss: 0.8053, test_loss: 1.0016, test_f1: 0.5406
 epoch: 10, train_loss: 0.7923, test_loss: 0.9402, test_f1: 0.5786
 epoch: 11, train_loss: 0.7732, test_loss: 0.9161, test_f1: 0.6127
 epoch: 12, train_loss: 0.7747, test_loss: 0.9778, test_f1: 0.6174
 epoch: 13, train_loss: 0.7723, test_loss: 0.9521, test_f1: 0.5699
 epoch: 14, train_loss: 0.7456, test_loss: 0.9595, test_f1: 0.5809
 epoch: 15, train_loss: 0.7194, test_loss: 0.9680, test_f1: 0.6029
 epoch: 16, train_loss: 0.6990, test_loss: 0.9637, test_f1: 0.6388
 epoch: 17, train_loss: 0.6939, test_loss: 1.0049, test_f1: 0.6150
 epoch: 18, train_loss: 0.6958, test_loss: 1.0411, test_f1: 0.5695
 epoch: 19, train_loss: 0.6658, test_loss: 0.9596, test_f1: 0.6024
 epoch: 20, train_loss: 0.6671, test_loss: 1.0414, test_f1: 0.6156
 epoch: 21, train_loss: 0.6506, test_loss: 0.9749, test_f1: 0.5990
 epoch: 22, train_loss: 0.6523, test_loss: 0.9394, test_f1: 0.6333
 epoch: 23, train_loss: 0.6313, test_loss: 1.0664, test_f1: 0.6370
 epoch: 24, train_loss: 0.6140, test_loss: 1.0403, test_f1: 0.6149
 epoch: 25, train_loss: 0.5958, test_loss: 1.0777, test_f1: 0.6374
 epoch: 26, train_loss: 0.6105, test_loss: 1.0050, test_f1: 0.6455
 epoch: 27, train_loss: 0.5770, test_loss: 1.0945, test_f1: 0.6676
 epoch: 28, train_loss: 0.5807, test_loss: 1.0313, test_f1: 0.6317
 epoch: 29, train_loss: 0.5644, test_loss: 1.0610, test_f1: 0.5956
 epoch: 30, train_loss: 0.5532, test_loss: 1.0227, test_f1: 0.6625
 epoch: 31, train_loss: 0.5462, test_loss: 1.0347, test_f1: 0.6224
 epoch: 32, train_loss: 0.5185, test_loss: 1.1259, test_f1: 0.6637
 epoch: 33, train_loss: 0.5261, test_loss: 1.1703, test_f1: 0.6608
 epoch: 34, train_loss: 0.5255, test_loss: 1.1272, test_f1: 0.6882
 epoch: 35, train_loss: 0.4894, test_loss: 1.1454, test_f1: 0.6627
 epoch: 36, train_loss: 0.4942, test_loss: 1.1115, test_f1: 0.6729
 epoch: 37, train_loss: 0.4699, test_loss: 1.1240, test_f1: 0.6744
 epoch: 38, train_loss: 0.4674, test_loss: 1.2513, test_f1: 0.6075
 epoch: 39, train_loss: 0.4678, test_loss: 1.0530, test_f1: 0.6387
 epoch: 40, train_loss: 0.4554, test_loss: 1.1088, test_f1: 0.6624
 epoch: 41, train_loss: 0.4394, test_loss: 1.2129, test_f1: 0.6645
 epoch: 42, train_loss: 0.4423, test_loss: 1.3204, test_f1: 0.6080
 epoch: 43, train_loss: 0.4573, test_loss: 0.9779, test_f1: 0.6666
 epoch: 44, train_loss: 0.4108, test_loss: 1.3687, test_f1: 0.6344
 epoch: 45, train_loss: 0.4206, test_loss: 1.2198, test_f1: 0.6477
 epoch: 46, train_loss: 0.3980, test_loss: 1.3778, test_f1: 0.6449
 epoch: 47, train_loss: 0.4061, test_loss: 1.3284, test_f1: 0.6592
 epoch: 48, train_loss: 0.4064, test_loss: 1.3172, test_f1: 0.6493
 epoch: 49, train_loss: 0.4069, test_loss: 1.2813, test_f1: 0.6548
 epoch: 50, train_loss: 0.3809, test_loss: 1.2656, test_f1: 0.6832
 epoch: 51, train_loss: 0.3193, test_loss: 1.3941, test_f1: 0.6722
 epoch: 52, train_loss: 0.3048, test_loss: 1.3940, test_f1: 0.6799
 epoch: 53, train_loss: 0.3078, test_loss: 1.4426, test_f1: 0.6889
 epoch: 54, train_loss: 0.2778, test_loss: 1.5132, test_f1: 0.6859
 epoch: 55, train_loss: 0.2903, test_loss: 1.5326, test_f1: 0.6470
 epoch: 56, train_loss: 0.2788, test_loss: 1.6257, test_f1: 0.6796
 epoch: 57, train_loss: 0.2837, test_loss: 1.4853, test_f1: 0.6985
 epoch: 58, train_loss: 0.2717, test_loss: 1.5597, test_f1: 0.6978
 epoch: 59, train_loss: 0.2545, test_loss: 1.5420, test_f1: 0.6615
 epoch: 60, train_loss: 0.2549, test_loss: 1.6247, test_f1: 0.6943
 epoch: 61, train_loss: 0.2525, test_loss: 1.6454, test_f1: 0.6440
 epoch: 62, train_loss: 0.2663, test_loss: 1.6042, test_f1: 0.6609
 epoch: 63, train_loss: 0.2508, test_loss: 1.6673, test_f1: 0.6774
 epoch: 64, train_loss: 0.2452, test_loss: 1.7271, test_f1: 0.6550
 epoch: 65, train_loss: 0.2540, test_loss: 1.5179, test_f1: 0.6559
 epoch: 66, train_loss: 0.2575, test_loss: 1.6979, test_f1: 0.6760
 epoch: 67, train_loss: 0.2361, test_loss: 1.7069, test_f1: 0.6816
 epoch: 68, train_loss: 0.2278, test_loss: 1.7616, test_f1: 0.6888
 epoch: 69, train_loss: 0.2353, test_loss: 1.6122, test_f1: 0.6960
 epoch: 70, train_loss: 0.2079, test_loss: 1.7692, test_f1: 0.6426
 epoch: 71, train_loss: 0.2259, test_loss: 1.7886, test_f1: 0.6519
 epoch: 72, train_loss: 0.2252, test_loss: 1.7300, test_f1: 0.6453
 epoch: 73, train_loss: 0.2117, test_loss: 1.7200, test_f1: 0.6617
 epoch: 74, train_loss: 0.2189, test_loss: 1.8729, test_f1: 0.6735
 epoch: 75, train_loss: 0.2067, test_loss: 1.8369, test_f1: 0.6456
 epoch: 76, train_loss: 0.2042, test_loss: 1.8779, test_f1: 0.6431
 epoch: 77, train_loss: 0.2065, test_loss: 1.8659, test_f1: 0.6790
 epoch: 78, train_loss: 0.2071, test_loss: 1.8313, test_f1: 0.6706
 epoch: 79, train_loss: 0.1830, test_loss: 1.8716, test_f1: 0.6877
 epoch: 80, train_loss: 0.1838, test_loss: 1.8778, test_f1: 0.6686
 epoch: 81, train_loss: 0.2001, test_loss: 1.8625, test_f1: 0.6894
 epoch: 82, train_loss: 0.2273, test_loss: 1.9354, test_f1: 0.6505
 epoch: 83, train_loss: 0.1968, test_loss: 2.1515, test_f1: 0.6555
 epoch: 84, train_loss: 0.1932, test_loss: 1.8382, test_f1: 0.7028
 epoch: 85, train_loss: 0.1899, test_loss: 2.0248, test_f1: 0.6545
 epoch: 86, train_loss: 0.1727, test_loss: 2.0937, test_f1: 0.6588
 epoch: 87, train_loss: 0.1717, test_loss: 2.1002, test_f1: 0.6643
 epoch: 88, train_loss: 0.1814, test_loss: 2.0905, test_f1: 0.6729
 epoch: 89, train_loss: 0.1798, test_loss: 2.1125, test_f1: 0.6735
 epoch: 90, train_loss: 0.1904, test_loss: 1.8344, test_f1: 0.6871
 epoch: 91, train_loss: 0.1653, test_loss: 1.9822, test_f1: 0.6830
 epoch: 92, train_loss: 0.1691, test_loss: 2.0309, test_f1: 0.6725
 epoch: 93, train_loss: 0.1800, test_loss: 2.0403, test_f1: 0.6763
 epoch: 94, train_loss: 0.1846, test_loss: 2.0801, test_f1: 0.6523
 epoch: 95, train_loss: 0.1697, test_loss: 2.1021, test_f1: 0.6554
 epoch: 96, train_loss: 0.1820, test_loss: 1.8654, test_f1: 0.6608
 epoch: 97, train_loss: 0.1617, test_loss: 2.0816, test_f1: 0.6560
 epoch: 98, train_loss: 0.1709, test_loss: 1.9627, test_f1: 0.6716
 epoch: 99, train_loss: 0.1711, test_loss: 2.1240, test_f1: 0.6824
##################ITERATION #2 ****************************************
 epoch: 0, train_loss: 1.1784, test_loss: 1.0888, test_f1: 0.3715
 epoch: 1, train_loss: 0.9872, test_loss: 0.9431, test_f1: 0.4793
 epoch: 2, train_loss: 0.9455, test_loss: 0.9559, test_f1: 0.4876
 epoch: 3, train_loss: 0.9121, test_loss: 1.0175, test_f1: 0.4741
 epoch: 4, train_loss: 0.8900, test_loss: 0.9120, test_f1: 0.5382
 epoch: 5, train_loss: 0.8826, test_loss: 0.9558, test_f1: 0.5429
 epoch: 6, train_loss: 0.8800, test_loss: 0.9208, test_f1: 0.5463
 epoch: 7, train_loss: 0.8374, test_loss: 0.9079, test_f1: 0.5621
 epoch: 8, train_loss: 0.8306, test_loss: 0.9029, test_f1: 0.5312
 epoch: 9, train_loss: 0.8238, test_loss: 0.9660, test_f1: 0.5442
 epoch: 10, train_loss: 0.8007, test_loss: 0.9699, test_f1: 0.5403
 epoch: 11, train_loss: 0.7947, test_loss: 0.9515, test_f1: 0.5832
 epoch: 12, train_loss: 0.8026, test_loss: 0.9361, test_f1: 0.5522
 epoch: 13, train_loss: 0.7767, test_loss: 0.9583, test_f1: 0.5766
 epoch: 14, train_loss: 0.7808, test_loss: 0.9151, test_f1: 0.6024
 epoch: 15, train_loss: 0.7693, test_loss: 0.8846, test_f1: 0.5499
 epoch: 16, train_loss: 0.7549, test_loss: 0.9489, test_f1: 0.5702
 epoch: 17, train_loss: 0.7599, test_loss: 0.9863, test_f1: 0.5793
 epoch: 18, train_loss: 0.7467, test_loss: 0.9385, test_f1: 0.6091
 epoch: 19, train_loss: 0.7345, test_loss: 1.0050, test_f1: 0.5512
 epoch: 20, train_loss: 0.7091, test_loss: 1.0063, test_f1: 0.6091
 epoch: 21, train_loss: 0.7200, test_loss: 0.9783, test_f1: 0.6077
 epoch: 22, train_loss: 0.6999, test_loss: 1.0066, test_f1: 0.5932
 epoch: 23, train_loss: 0.6890, test_loss: 0.9936, test_f1: 0.6346
 epoch: 24, train_loss: 0.6878, test_loss: 1.0152, test_f1: 0.6514
 epoch: 25, train_loss: 0.6671, test_loss: 1.0260, test_f1: 0.6075
 epoch: 26, train_loss: 0.6548, test_loss: 1.0803, test_f1: 0.6430
 epoch: 27, train_loss: 0.6547, test_loss: 1.0328, test_f1: 0.6222
 epoch: 28, train_loss: 0.6448, test_loss: 1.1480, test_f1: 0.5243
 epoch: 29, train_loss: 0.6414, test_loss: 1.0527, test_f1: 0.6408
 epoch: 30, train_loss: 0.6231, test_loss: 1.0674, test_f1: 0.6222
 epoch: 31, train_loss: 0.6200, test_loss: 1.0354, test_f1: 0.6412
 epoch: 32, train_loss: 0.5897, test_loss: 1.0022, test_f1: 0.6565
 epoch: 33, train_loss: 0.6012, test_loss: 1.0622, test_f1: 0.6493
 epoch: 34, train_loss: 0.5832, test_loss: 1.1014, test_f1: 0.6273
 epoch: 35, train_loss: 0.5847, test_loss: 1.1861, test_f1: 0.6226
 epoch: 36, train_loss: 0.5498, test_loss: 1.0939, test_f1: 0.6321
 epoch: 37, train_loss: 0.5426, test_loss: 1.1799, test_f1: 0.6724
 epoch: 38, train_loss: 0.5358, test_loss: 1.1285, test_f1: 0.6330
 epoch: 39, train_loss: 0.5251, test_loss: 1.1608, test_f1: 0.6310
 epoch: 40, train_loss: 0.5219, test_loss: 1.0453, test_f1: 0.6684
 epoch: 41, train_loss: 0.5412, test_loss: 1.2068, test_f1: 0.6484
 epoch: 42, train_loss: 0.5048, test_loss: 1.1772, test_f1: 0.6831
 epoch: 43, train_loss: 0.4961, test_loss: 1.4546, test_f1: 0.5809
 epoch: 44, train_loss: 0.6070, test_loss: 1.1134, test_f1: 0.6090
 epoch: 45, train_loss: 0.5142, test_loss: 1.1383, test_f1: 0.6548
 epoch: 46, train_loss: 0.5040, test_loss: 1.2011, test_f1: 0.6082
 epoch: 47, train_loss: 0.4844, test_loss: 1.1458, test_f1: 0.6244
 epoch: 48, train_loss: 0.4847, test_loss: 1.2325, test_f1: 0.6390
 epoch: 49, train_loss: 0.4571, test_loss: 1.2684, test_f1: 0.6397
 epoch: 50, train_loss: 0.4579, test_loss: 1.2163, test_f1: 0.6611
 epoch: 51, train_loss: 0.4130, test_loss: 1.2287, test_f1: 0.6567
 epoch: 52, train_loss: 0.3792, test_loss: 1.2251, test_f1: 0.6636
 epoch: 53, train_loss: 0.3692, test_loss: 1.3415, test_f1: 0.6800
 epoch: 54, train_loss: 0.3409, test_loss: 1.3901, test_f1: 0.6550
 epoch: 55, train_loss: 0.3305, test_loss: 1.4179, test_f1: 0.6533
 epoch: 56, train_loss: 0.3429, test_loss: 1.4379, test_f1: 0.6618
 epoch: 57, train_loss: 0.3436, test_loss: 1.4502, test_f1: 0.6572
 epoch: 58, train_loss: 0.3016, test_loss: 1.4724, test_f1: 0.6567
 epoch: 59, train_loss: 0.3307, test_loss: 1.4237, test_f1: 0.6671
 epoch: 60, train_loss: 0.3107, test_loss: 1.4597, test_f1: 0.6562
 epoch: 61, train_loss: 0.2994, test_loss: 1.4776, test_f1: 0.6497
 epoch: 62, train_loss: 0.3119, test_loss: 1.4868, test_f1: 0.6501
 epoch: 63, train_loss: 0.2930, test_loss: 1.5516, test_f1: 0.6762
 epoch: 64, train_loss: 0.3067, test_loss: 1.4778, test_f1: 0.6497
 epoch: 65, train_loss: 0.3105, test_loss: 1.3945, test_f1: 0.6821
 epoch: 66, train_loss: 0.2922, test_loss: 1.4968, test_f1: 0.6525
 epoch: 67, train_loss: 0.2905, test_loss: 1.3451, test_f1: 0.6695
 epoch: 68, train_loss: 0.3006, test_loss: 1.4835, test_f1: 0.6373
 epoch: 69, train_loss: 0.2701, test_loss: 1.6331, test_f1: 0.6383
 epoch: 70, train_loss: 0.2773, test_loss: 1.5339, test_f1: 0.6512
 epoch: 71, train_loss: 0.2840, test_loss: 1.5937, test_f1: 0.6696
 epoch: 72, train_loss: 0.2696, test_loss: 1.5710, test_f1: 0.6507
 epoch: 73, train_loss: 0.2542, test_loss: 1.6348, test_f1: 0.6539
 epoch: 74, train_loss: 0.2615, test_loss: 1.5192, test_f1: 0.6764
 epoch: 75, train_loss: 0.2452, test_loss: 1.5919, test_f1: 0.6551
 epoch: 76, train_loss: 0.2531, test_loss: 1.5881, test_f1: 0.6521
 epoch: 77, train_loss: 0.2436, test_loss: 1.5999, test_f1: 0.6528
 epoch: 78, train_loss: 0.2446, test_loss: 1.6065, test_f1: 0.6519
 epoch: 79, train_loss: 0.2524, test_loss: 1.5591, test_f1: 0.6647
 epoch: 80, train_loss: 0.2522, test_loss: 1.5729, test_f1: 0.6389
 epoch: 81, train_loss: 0.2257, test_loss: 1.7428, test_f1: 0.6313
 epoch: 82, train_loss: 0.2365, test_loss: 1.7081, test_f1: 0.6640
 epoch: 83, train_loss: 0.2369, test_loss: 1.8015, test_f1: 0.6425
 epoch: 84, train_loss: 0.2495, test_loss: 1.7410, test_f1: 0.6371
 epoch: 85, train_loss: 0.2391, test_loss: 1.8183, test_f1: 0.6544
 epoch: 86, train_loss: 0.2278, test_loss: 1.8788, test_f1: 0.6614
 epoch: 87, train_loss: 0.2250, test_loss: 1.7866, test_f1: 0.6477
 epoch: 88, train_loss: 0.2296, test_loss: 2.0397, test_f1: 0.6538
 epoch: 89, train_loss: 0.2259, test_loss: 1.7517, test_f1: 0.6546
 epoch: 90, train_loss: 0.2029, test_loss: 1.9900, test_f1: 0.6381
 epoch: 91, train_loss: 0.2025, test_loss: 1.9297, test_f1: 0.6370
 epoch: 92, train_loss: 0.2007, test_loss: 1.9485, test_f1: 0.6551
 epoch: 93, train_loss: 0.1988, test_loss: 1.9669, test_f1: 0.6450
 epoch: 94, train_loss: 0.1905, test_loss: 2.0908, test_f1: 0.6494
 epoch: 95, train_loss: 0.2222, test_loss: 2.0813, test_f1: 0.6384
 epoch: 96, train_loss: 0.2075, test_loss: 1.8773, test_f1: 0.6512
 epoch: 97, train_loss: 0.2185, test_loss: 1.8166, test_f1: 0.6388
 epoch: 98, train_loss: 0.2042, test_loss: 1.9229, test_f1: 0.6328
 epoch: 99, train_loss: 0.2017, test_loss: 2.1155, test_f1: 0.6252
##################ITERATION #3 ****************************************
 epoch: 0, train_loss: 1.2434, test_loss: 1.0087, test_f1: 0.4768
 epoch: 1, train_loss: 0.9832, test_loss: 0.9324, test_f1: 0.5143
 epoch: 2, train_loss: 0.9467, test_loss: 0.9584, test_f1: 0.5405
 epoch: 3, train_loss: 0.9209, test_loss: 0.9282, test_f1: 0.5433
 epoch: 4, train_loss: 0.9148, test_loss: 0.9521, test_f1: 0.5408
 epoch: 5, train_loss: 0.8844, test_loss: 0.8756, test_f1: 0.5448
 epoch: 6, train_loss: 0.8650, test_loss: 0.9141, test_f1: 0.5457
 epoch: 7, train_loss: 0.8436, test_loss: 0.9165, test_f1: 0.5545
 epoch: 8, train_loss: 0.8268, test_loss: 0.9486, test_f1: 0.5949
 epoch: 9, train_loss: 0.8226, test_loss: 0.9531, test_f1: 0.5798
 epoch: 10, train_loss: 0.8014, test_loss: 0.9697, test_f1: 0.5395
 epoch: 11, train_loss: 0.7838, test_loss: 0.9740, test_f1: 0.5940
 epoch: 12, train_loss: 0.7787, test_loss: 0.9023, test_f1: 0.5852
 epoch: 13, train_loss: 0.7855, test_loss: 0.8625, test_f1: 0.5852
 epoch: 14, train_loss: 0.7637, test_loss: 0.9931, test_f1: 0.6034
 epoch: 15, train_loss: 0.7462, test_loss: 0.8959, test_f1: 0.6004
 epoch: 16, train_loss: 0.7270, test_loss: 0.9849, test_f1: 0.5759
 epoch: 17, train_loss: 0.7284, test_loss: 0.9202, test_f1: 0.5573
 epoch: 18, train_loss: 0.7210, test_loss: 0.9392, test_f1: 0.6126
 epoch: 19, train_loss: 0.7032, test_loss: 0.9419, test_f1: 0.6419
 epoch: 20, train_loss: 0.7146, test_loss: 0.9794, test_f1: 0.5949
 epoch: 21, train_loss: 0.6881, test_loss: 0.9293, test_f1: 0.6141
 epoch: 22, train_loss: 0.6597, test_loss: 0.9368, test_f1: 0.6282
 epoch: 23, train_loss: 0.6797, test_loss: 0.9122, test_f1: 0.6143
 epoch: 24, train_loss: 0.6553, test_loss: 0.9619, test_f1: 0.6154
 epoch: 25, train_loss: 0.6617, test_loss: 0.9910, test_f1: 0.6218
 epoch: 26, train_loss: 0.6616, test_loss: 1.0480, test_f1: 0.6097
 epoch: 27, train_loss: 0.6356, test_loss: 1.1936, test_f1: 0.5912
 epoch: 28, train_loss: 0.6355, test_loss: 0.9133, test_f1: 0.6418
 epoch: 29, train_loss: 0.6141, test_loss: 0.9799, test_f1: 0.6211
 epoch: 30, train_loss: 0.5909, test_loss: 0.9844, test_f1: 0.6098
 epoch: 31, train_loss: 0.5767, test_loss: 1.4409, test_f1: 0.5506
 epoch: 32, train_loss: 0.6119, test_loss: 0.9974, test_f1: 0.6484
 epoch: 33, train_loss: 0.5755, test_loss: 0.9682, test_f1: 0.6366
 epoch: 34, train_loss: 0.5617, test_loss: 1.0338, test_f1: 0.6084
 epoch: 35, train_loss: 0.5547, test_loss: 1.0076, test_f1: 0.6464
 epoch: 36, train_loss: 0.5534, test_loss: 1.2357, test_f1: 0.6157
 epoch: 37, train_loss: 0.5321, test_loss: 1.1130, test_f1: 0.6618
 epoch: 38, train_loss: 0.5147, test_loss: 1.1695, test_f1: 0.6270
 epoch: 39, train_loss: 0.5099, test_loss: 1.1024, test_f1: 0.6322
 epoch: 40, train_loss: 0.5093, test_loss: 1.0163, test_f1: 0.6512
 epoch: 41, train_loss: 0.5033, test_loss: 1.1637, test_f1: 0.6651
 epoch: 42, train_loss: 0.4808, test_loss: 1.3255, test_f1: 0.6527
 epoch: 43, train_loss: 0.4776, test_loss: 1.0461, test_f1: 0.6616
 epoch: 44, train_loss: 0.4654, test_loss: 1.2522, test_f1: 0.6166
 epoch: 45, train_loss: 0.4542, test_loss: 1.2020, test_f1: 0.6499
 epoch: 46, train_loss: 0.4556, test_loss: 1.0696, test_f1: 0.6707
 epoch: 47, train_loss: 0.4543, test_loss: 1.1350, test_f1: 0.6699
 epoch: 48, train_loss: 0.4553, test_loss: 1.1318, test_f1: 0.6402
 epoch: 49, train_loss: 0.4315, test_loss: 1.2000, test_f1: 0.6586
 epoch: 50, train_loss: 0.4507, test_loss: 1.2615, test_f1: 0.6193
 epoch: 51, train_loss: 0.3899, test_loss: 1.2701, test_f1: 0.6725
 epoch: 52, train_loss: 0.3595, test_loss: 1.2446, test_f1: 0.6609
 epoch: 53, train_loss: 0.3506, test_loss: 1.3224, test_f1: 0.6634
 epoch: 54, train_loss: 0.3329, test_loss: 1.2346, test_f1: 0.6810
 epoch: 55, train_loss: 0.3311, test_loss: 1.3467, test_f1: 0.6630
 epoch: 56, train_loss: 0.3127, test_loss: 1.3693, test_f1: 0.6593
 epoch: 57, train_loss: 0.3119, test_loss: 1.3158, test_f1: 0.6726
 epoch: 58, train_loss: 0.3126, test_loss: 1.4065, test_f1: 0.6337
 epoch: 59, train_loss: 0.3184, test_loss: 1.4103, test_f1: 0.6395
 epoch: 60, train_loss: 0.2952, test_loss: 1.3955, test_f1: 0.6420
 epoch: 61, train_loss: 0.3110, test_loss: 1.4353, test_f1: 0.6578
 epoch: 62, train_loss: 0.2834, test_loss: 1.5322, test_f1: 0.6514
 epoch: 63, train_loss: 0.2836, test_loss: 1.6453, test_f1: 0.6397
 epoch: 64, train_loss: 0.2875, test_loss: 1.4968, test_f1: 0.6540
 epoch: 65, train_loss: 0.2808, test_loss: 1.5956, test_f1: 0.6317
 epoch: 66, train_loss: 0.2724, test_loss: 1.5535, test_f1: 0.6585
 epoch: 67, train_loss: 0.2549, test_loss: 1.5927, test_f1: 0.6807
 epoch: 68, train_loss: 0.2693, test_loss: 1.6203, test_f1: 0.6494
 epoch: 69, train_loss: 0.2459, test_loss: 1.6584, test_f1: 0.6466
 epoch: 70, train_loss: 0.2518, test_loss: 1.5948, test_f1: 0.6688
 epoch: 71, train_loss: 0.2558, test_loss: 1.7454, test_f1: 0.6514
 epoch: 72, train_loss: 0.2483, test_loss: 1.6613, test_f1: 0.6471
 epoch: 73, train_loss: 0.2330, test_loss: 1.6508, test_f1: 0.6488
 epoch: 74, train_loss: 0.2501, test_loss: 1.5849, test_f1: 0.6790
 epoch: 75, train_loss: 0.2342, test_loss: 1.7974, test_f1: 0.6470
 epoch: 76, train_loss: 0.2519, test_loss: 1.7139, test_f1: 0.6619
 epoch: 77, train_loss: 0.2476, test_loss: 1.7832, test_f1: 0.6525
 epoch: 78, train_loss: 0.2365, test_loss: 1.6661, test_f1: 0.6541
 epoch: 79, train_loss: 0.2335, test_loss: 1.5636, test_f1: 0.6479
 epoch: 80, train_loss: 0.2310, test_loss: 1.6806, test_f1: 0.6724
 epoch: 81, train_loss: 0.2296, test_loss: 1.8297, test_f1: 0.6482
 epoch: 82, train_loss: 0.2086, test_loss: 1.8360, test_f1: 0.6135
 epoch: 83, train_loss: 0.2125, test_loss: 1.7783, test_f1: 0.6489
 epoch: 84, train_loss: 0.2153, test_loss: 1.7204, test_f1: 0.6625
 epoch: 85, train_loss: 0.2237, test_loss: 1.7236, test_f1: 0.6654
 epoch: 86, train_loss: 0.2079, test_loss: 1.8434, test_f1: 0.6527
 epoch: 87, train_loss: 0.2085, test_loss: 1.8592, test_f1: 0.6339
 epoch: 88, train_loss: 0.1922, test_loss: 1.8650, test_f1: 0.6408
 epoch: 89, train_loss: 0.2075, test_loss: 1.7898, test_f1: 0.6708
 epoch: 90, train_loss: 0.2116, test_loss: 1.8904, test_f1: 0.6343
 epoch: 91, train_loss: 0.1858, test_loss: 1.9412, test_f1: 0.6676
 epoch: 92, train_loss: 0.2188, test_loss: 1.8366, test_f1: 0.6468
 epoch: 93, train_loss: 0.1911, test_loss: 2.0284, test_f1: 0.6292
 epoch: 94, train_loss: 0.2015, test_loss: 1.9249, test_f1: 0.6291
 epoch: 95, train_loss: 0.2024, test_loss: 1.7914, test_f1: 0.6272
 epoch: 96, train_loss: 0.1814, test_loss: 1.8968, test_f1: 0.6230
 epoch: 97, train_loss: 0.1784, test_loss: 1.9773, test_f1: 0.6321
 epoch: 98, train_loss: 0.2094, test_loss: 1.8522, test_f1: 0.6374
 epoch: 99, train_loss: 0.1927, test_loss: 1.9042, test_f1: 0.6526
##################ITERATION #4 ****************************************
 epoch: 0, train_loss: 1.2630, test_loss: 1.0269, test_f1: 0.4833
 epoch: 1, train_loss: 0.9940, test_loss: 0.9996, test_f1: 0.4686
 epoch: 2, train_loss: 0.9348, test_loss: 0.9796, test_f1: 0.5026
 epoch: 3, train_loss: 0.9129, test_loss: 0.9488, test_f1: 0.5163
 epoch: 4, train_loss: 0.8888, test_loss: 0.9748, test_f1: 0.5589
 epoch: 5, train_loss: 0.8904, test_loss: 0.9531, test_f1: 0.5600
 epoch: 6, train_loss: 0.8713, test_loss: 0.9481, test_f1: 0.5088
 epoch: 7, train_loss: 0.8559, test_loss: 0.9805, test_f1: 0.5479
 epoch: 8, train_loss: 0.8501, test_loss: 0.9737, test_f1: 0.5655
 epoch: 9, train_loss: 0.8311, test_loss: 0.9178, test_f1: 0.5427
 epoch: 10, train_loss: 0.8115, test_loss: 0.9724, test_f1: 0.5614
 epoch: 11, train_loss: 0.7893, test_loss: 1.0052, test_f1: 0.5268
 epoch: 12, train_loss: 0.8179, test_loss: 1.0179, test_f1: 0.5905
 epoch: 13, train_loss: 0.7865, test_loss: 0.9847, test_f1: 0.5761
 epoch: 14, train_loss: 0.7881, test_loss: 1.0197, test_f1: 0.5843
 epoch: 15, train_loss: 0.7493, test_loss: 0.9775, test_f1: 0.6287
 epoch: 16, train_loss: 0.7443, test_loss: 1.0082, test_f1: 0.5777
 epoch: 17, train_loss: 0.7166, test_loss: 0.9439, test_f1: 0.6326
 epoch: 18, train_loss: 0.7196, test_loss: 0.9024, test_f1: 0.6094
 epoch: 19, train_loss: 0.7187, test_loss: 0.9866, test_f1: 0.6135
 epoch: 20, train_loss: 0.7086, test_loss: 1.0093, test_f1: 0.5703
 epoch: 21, train_loss: 0.6967, test_loss: 0.9402, test_f1: 0.6265
 epoch: 22, train_loss: 0.6742, test_loss: 1.0215, test_f1: 0.5829
 epoch: 23, train_loss: 0.6760, test_loss: 0.9904, test_f1: 0.6069
 epoch: 24, train_loss: 0.6707, test_loss: 0.9418, test_f1: 0.5968
 epoch: 25, train_loss: 0.6474, test_loss: 1.0272, test_f1: 0.6343
 epoch: 26, train_loss: 0.6587, test_loss: 1.0441, test_f1: 0.5915
 epoch: 27, train_loss: 0.6304, test_loss: 1.0154, test_f1: 0.6285
 epoch: 28, train_loss: 0.6085, test_loss: 1.0593, test_f1: 0.6258
 epoch: 29, train_loss: 0.6005, test_loss: 1.0671, test_f1: 0.6459
 epoch: 30, train_loss: 0.6114, test_loss: 0.9871, test_f1: 0.6250
 epoch: 31, train_loss: 0.5928, test_loss: 1.1319, test_f1: 0.6135
 epoch: 32, train_loss: 0.5950, test_loss: 1.0495, test_f1: 0.6069
 epoch: 33, train_loss: 0.5682, test_loss: 1.0261, test_f1: 0.6348
 epoch: 34, train_loss: 0.5575, test_loss: 1.1065, test_f1: 0.6485
 epoch: 35, train_loss: 0.5486, test_loss: 1.1207, test_f1: 0.6542
 epoch: 36, train_loss: 0.5390, test_loss: 1.1564, test_f1: 0.5944
 epoch: 37, train_loss: 0.5251, test_loss: 1.2106, test_f1: 0.6223
 epoch: 38, train_loss: 0.5323, test_loss: 1.1212, test_f1: 0.5904
 epoch: 39, train_loss: 0.5222, test_loss: 1.0079, test_f1: 0.6229
 epoch: 40, train_loss: 0.5153, test_loss: 1.1812, test_f1: 0.6064
 epoch: 41, train_loss: 0.4997, test_loss: 1.0630, test_f1: 0.6236
 epoch: 42, train_loss: 0.5040, test_loss: 1.0728, test_f1: 0.6391
 epoch: 43, train_loss: 0.4997, test_loss: 1.2182, test_f1: 0.6290
 epoch: 44, train_loss: 0.4879, test_loss: 1.1046, test_f1: 0.6540
 epoch: 45, train_loss: 0.4487, test_loss: 1.2416, test_f1: 0.6693
 epoch: 46, train_loss: 0.4755, test_loss: 1.1030, test_f1: 0.6611
 epoch: 47, train_loss: 0.4404, test_loss: 1.3774, test_f1: 0.5772
 epoch: 48, train_loss: 0.4469, test_loss: 1.2802, test_f1: 0.6462
 epoch: 49, train_loss: 0.4240, test_loss: 1.1006, test_f1: 0.6580
 epoch: 50, train_loss: 0.4384, test_loss: 1.2006, test_f1: 0.6488
 epoch: 51, train_loss: 0.3931, test_loss: 1.3713, test_f1: 0.6419
 epoch: 52, train_loss: 0.3478, test_loss: 1.3270, test_f1: 0.6508
 epoch: 53, train_loss: 0.3595, test_loss: 1.4077, test_f1: 0.6534
 epoch: 54, train_loss: 0.3411, test_loss: 1.3466, test_f1: 0.6731
 epoch: 55, train_loss: 0.3228, test_loss: 1.3971, test_f1: 0.6544
 epoch: 56, train_loss: 0.3303, test_loss: 1.4231, test_f1: 0.6704
 epoch: 57, train_loss: 0.3110, test_loss: 1.3588, test_f1: 0.6783
 epoch: 58, train_loss: 0.2994, test_loss: 1.4483, test_f1: 0.6804
 epoch: 59, train_loss: 0.3110, test_loss: 1.3832, test_f1: 0.6602
 epoch: 60, train_loss: 0.3200, test_loss: 1.4205, test_f1: 0.6882
 epoch: 61, train_loss: 0.3009, test_loss: 1.4276, test_f1: 0.6702
 epoch: 62, train_loss: 0.2827, test_loss: 1.5967, test_f1: 0.6522
 epoch: 63, train_loss: 0.2767, test_loss: 1.6234, test_f1: 0.6659
 epoch: 64, train_loss: 0.3014, test_loss: 1.5190, test_f1: 0.6364
 epoch: 65, train_loss: 0.2725, test_loss: 1.5668, test_f1: 0.6651
 epoch: 66, train_loss: 0.2616, test_loss: 1.5425, test_f1: 0.6676
 epoch: 67, train_loss: 0.2676, test_loss: 1.6301, test_f1: 0.6570
 epoch: 68, train_loss: 0.2682, test_loss: 1.5536, test_f1: 0.6541
 epoch: 69, train_loss: 0.2708, test_loss: 1.6005, test_f1: 0.6680
 epoch: 70, train_loss: 0.2627, test_loss: 1.6726, test_f1: 0.6534
 epoch: 71, train_loss: 0.2703, test_loss: 1.6428, test_f1: 0.6403
 epoch: 72, train_loss: 0.2685, test_loss: 1.6261, test_f1: 0.6640
 epoch: 73, train_loss: 0.2494, test_loss: 1.5737, test_f1: 0.6882
 epoch: 74, train_loss: 0.2510, test_loss: 1.6521, test_f1: 0.6553
 epoch: 75, train_loss: 0.2290, test_loss: 1.8474, test_f1: 0.6655
 epoch: 76, train_loss: 0.2484, test_loss: 1.8118, test_f1: 0.6667
 epoch: 77, train_loss: 0.2389, test_loss: 1.7143, test_f1: 0.6700
 epoch: 78, train_loss: 0.2455, test_loss: 1.7960, test_f1: 0.6498
 epoch: 79, train_loss: 0.2287, test_loss: 1.8374, test_f1: 0.6808
 epoch: 80, train_loss: 0.2360, test_loss: 1.6141, test_f1: 0.6685
 epoch: 81, train_loss: 0.2318, test_loss: 1.6668, test_f1: 0.6544
 epoch: 82, train_loss: 0.2432, test_loss: 1.6221, test_f1: 0.6599
 epoch: 83, train_loss: 0.2266, test_loss: 1.8070, test_f1: 0.6452
 epoch: 84, train_loss: 0.2186, test_loss: 1.8598, test_f1: 0.6688
 epoch: 85, train_loss: 0.2061, test_loss: 1.8581, test_f1: 0.6589
 epoch: 86, train_loss: 0.2141, test_loss: 1.7345, test_f1: 0.6692
 epoch: 87, train_loss: 0.2307, test_loss: 1.7670, test_f1: 0.6630
 epoch: 88, train_loss: 0.2217, test_loss: 1.9429, test_f1: 0.6790
 epoch: 89, train_loss: 0.2316, test_loss: 1.8312, test_f1: 0.6674
 epoch: 90, train_loss: 0.2097, test_loss: 1.7386, test_f1: 0.6611
 epoch: 91, train_loss: 0.2097, test_loss: 1.8675, test_f1: 0.6290
 epoch: 92, train_loss: 0.2024, test_loss: 1.8581, test_f1: 0.6473
 epoch: 93, train_loss: 0.1977, test_loss: 2.0150, test_f1: 0.6671
 epoch: 94, train_loss: 0.1992, test_loss: 1.9931, test_f1: 0.6763
 epoch: 95, train_loss: 0.1972, test_loss: 2.0419, test_f1: 0.6515
 epoch: 96, train_loss: 0.1964, test_loss: 1.8946, test_f1: 0.6689
 epoch: 97, train_loss: 0.1838, test_loss: 1.9340, test_f1: 0.6722
 epoch: 98, train_loss: 0.1885, test_loss: 2.0271, test_f1: 0.6738
 epoch: 99, train_loss: 0.1932, test_loss: 1.9252, test_f1: 0.6760
##################ITERATION #5 ****************************************
 epoch: 0, train_loss: 1.2619, test_loss: 1.0105, test_f1: 0.3888
 epoch: 1, train_loss: 0.9927, test_loss: 0.9348, test_f1: 0.4712
 epoch: 2, train_loss: 0.9587, test_loss: 0.9525, test_f1: 0.4659
 epoch: 3, train_loss: 0.9254, test_loss: 0.9665, test_f1: 0.4882
 epoch: 4, train_loss: 0.9091, test_loss: 0.9643, test_f1: 0.5191
 epoch: 5, train_loss: 0.8942, test_loss: 0.9574, test_f1: 0.5721
 epoch: 6, train_loss: 0.8637, test_loss: 0.9419, test_f1: 0.5841
 epoch: 7, train_loss: 0.8405, test_loss: 0.9097, test_f1: 0.5412
 epoch: 8, train_loss: 0.8316, test_loss: 0.8887, test_f1: 0.5429
 epoch: 9, train_loss: 0.8277, test_loss: 0.9663, test_f1: 0.5640
 epoch: 10, train_loss: 0.8335, test_loss: 0.9479, test_f1: 0.5734
 epoch: 11, train_loss: 0.8084, test_loss: 0.8737, test_f1: 0.5827
 epoch: 12, train_loss: 0.7895, test_loss: 0.9308, test_f1: 0.5730
 epoch: 13, train_loss: 0.7992, test_loss: 0.8816, test_f1: 0.5624
 epoch: 14, train_loss: 0.7828, test_loss: 0.9334, test_f1: 0.5835
 epoch: 15, train_loss: 0.7608, test_loss: 0.9322, test_f1: 0.5819
 epoch: 16, train_loss: 0.7473, test_loss: 0.9122, test_f1: 0.6035
 epoch: 17, train_loss: 0.7402, test_loss: 0.9424, test_f1: 0.6320
 epoch: 18, train_loss: 0.7237, test_loss: 0.9333, test_f1: 0.6081
 epoch: 19, train_loss: 0.7135, test_loss: 0.9741, test_f1: 0.6128
 epoch: 20, train_loss: 0.7009, test_loss: 0.9572, test_f1: 0.6042
 epoch: 21, train_loss: 0.6972, test_loss: 0.9360, test_f1: 0.6252
 epoch: 22, train_loss: 0.6717, test_loss: 0.9126, test_f1: 0.6469
 epoch: 23, train_loss: 0.6662, test_loss: 0.8859, test_f1: 0.5988
 epoch: 24, train_loss: 0.6724, test_loss: 1.0049, test_f1: 0.5948
 epoch: 25, train_loss: 0.6507, test_loss: 0.9639, test_f1: 0.6370
 epoch: 26, train_loss: 0.6672, test_loss: 0.9552, test_f1: 0.6180
 epoch: 27, train_loss: 0.6468, test_loss: 0.9580, test_f1: 0.5931
 epoch: 28, train_loss: 0.6156, test_loss: 0.9921, test_f1: 0.6151
 epoch: 29, train_loss: 0.6035, test_loss: 0.9652, test_f1: 0.5744
 epoch: 30, train_loss: 0.6036, test_loss: 1.0005, test_f1: 0.6161
 epoch: 31, train_loss: 0.6016, test_loss: 0.9880, test_f1: 0.6041
 epoch: 32, train_loss: 0.5855, test_loss: 1.0429, test_f1: 0.6489
 epoch: 33, train_loss: 0.5655, test_loss: 1.0154, test_f1: 0.6549
 epoch: 34, train_loss: 0.5645, test_loss: 0.9943, test_f1: 0.6458
 epoch: 35, train_loss: 0.5467, test_loss: 1.0851, test_f1: 0.6391
 epoch: 36, train_loss: 0.5510, test_loss: 1.1505, test_f1: 0.6465
 epoch: 37, train_loss: 0.5315, test_loss: 1.0223, test_f1: 0.6028
 epoch: 38, train_loss: 0.5234, test_loss: 1.1133, test_f1: 0.6284
 epoch: 39, train_loss: 0.5245, test_loss: 1.0901, test_f1: 0.6342
 epoch: 40, train_loss: 0.5231, test_loss: 1.1067, test_f1: 0.6310
 epoch: 41, train_loss: 0.5005, test_loss: 1.1034, test_f1: 0.6373
 epoch: 42, train_loss: 0.4957, test_loss: 1.1863, test_f1: 0.6245
 epoch: 43, train_loss: 0.4936, test_loss: 1.2377, test_f1: 0.6311
 epoch: 44, train_loss: 0.4858, test_loss: 1.1961, test_f1: 0.6441
 epoch: 45, train_loss: 0.4695, test_loss: 1.2256, test_f1: 0.6159
 epoch: 46, train_loss: 0.4761, test_loss: 1.1716, test_f1: 0.6439
 epoch: 47, train_loss: 0.4601, test_loss: 1.1885, test_f1: 0.6702
 epoch: 48, train_loss: 0.4219, test_loss: 1.2108, test_f1: 0.6587
 epoch: 49, train_loss: 0.4210, test_loss: 1.2400, test_f1: 0.6643
 epoch: 50, train_loss: 0.4397, test_loss: 1.2361, test_f1: 0.6382
 epoch: 51, train_loss: 0.3865, test_loss: 1.2727, test_f1: 0.6574
 epoch: 52, train_loss: 0.3658, test_loss: 1.2602, test_f1: 0.6453
 epoch: 53, train_loss: 0.3514, test_loss: 1.3125, test_f1: 0.6371
 epoch: 54, train_loss: 0.3469, test_loss: 1.3842, test_f1: 0.6252
 epoch: 55, train_loss: 0.3391, test_loss: 1.3010, test_f1: 0.6335
 epoch: 56, train_loss: 0.3256, test_loss: 1.3373, test_f1: 0.6600
 epoch: 57, train_loss: 0.3280, test_loss: 1.3416, test_f1: 0.6559
 epoch: 58, train_loss: 0.3248, test_loss: 1.4377, test_f1: 0.6595
 epoch: 59, train_loss: 0.3374, test_loss: 1.4829, test_f1: 0.6525
 epoch: 60, train_loss: 0.3043, test_loss: 1.4891, test_f1: 0.6390
 epoch: 61, train_loss: 0.3060, test_loss: 1.3716, test_f1: 0.6567
 epoch: 62, train_loss: 0.3081, test_loss: 1.4473, test_f1: 0.6599
 epoch: 63, train_loss: 0.2995, test_loss: 1.3646, test_f1: 0.6833
 epoch: 64, train_loss: 0.2954, test_loss: 1.4432, test_f1: 0.6454
 epoch: 65, train_loss: 0.3017, test_loss: 1.4755, test_f1: 0.6542
 epoch: 66, train_loss: 0.2883, test_loss: 1.5592, test_f1: 0.6379
 epoch: 67, train_loss: 0.2958, test_loss: 1.5093, test_f1: 0.6543
 epoch: 68, train_loss: 0.2746, test_loss: 1.6201, test_f1: 0.6541
 epoch: 69, train_loss: 0.2847, test_loss: 1.5958, test_f1: 0.6651
 epoch: 70, train_loss: 0.2758, test_loss: 1.6453, test_f1: 0.6637
 epoch: 71, train_loss: 0.2562, test_loss: 1.5722, test_f1: 0.6546
 epoch: 72, train_loss: 0.2625, test_loss: 1.6288, test_f1: 0.6338
 epoch: 73, train_loss: 0.2601, test_loss: 1.6683, test_f1: 0.6321
 epoch: 74, train_loss: 0.2577, test_loss: 1.7535, test_f1: 0.6342
 epoch: 75, train_loss: 0.2513, test_loss: 1.6389, test_f1: 0.6604
 epoch: 76, train_loss: 0.2538, test_loss: 1.6783, test_f1: 0.6458
 epoch: 77, train_loss: 0.2421, test_loss: 1.6445, test_f1: 0.6597
 epoch: 78, train_loss: 0.2424, test_loss: 1.7543, test_f1: 0.6567
 epoch: 79, train_loss: 0.2272, test_loss: 1.7058, test_f1: 0.6617
 epoch: 80, train_loss: 0.2391, test_loss: 1.7619, test_f1: 0.6433
 epoch: 81, train_loss: 0.2314, test_loss: 1.7261, test_f1: 0.6578
 epoch: 82, train_loss: 0.2328, test_loss: 1.8777, test_f1: 0.6476
 epoch: 83, train_loss: 0.2191, test_loss: 1.7545, test_f1: 0.6371
 epoch: 84, train_loss: 0.2235, test_loss: 1.7748, test_f1: 0.6766
 epoch: 85, train_loss: 0.2182, test_loss: 1.8997, test_f1: 0.6391
 epoch: 86, train_loss: 0.2118, test_loss: 1.7881, test_f1: 0.6690
 epoch: 87, train_loss: 0.2187, test_loss: 1.7911, test_f1: 0.6521
 epoch: 88, train_loss: 0.2166, test_loss: 1.7804, test_f1: 0.6595
 epoch: 89, train_loss: 0.2242, test_loss: 1.8062, test_f1: 0.6587
 epoch: 90, train_loss: 0.2116, test_loss: 1.8172, test_f1: 0.6531
 epoch: 91, train_loss: 0.2138, test_loss: 2.0108, test_f1: 0.6473
 epoch: 92, train_loss: 0.2006, test_loss: 1.9809, test_f1: 0.6466
 epoch: 93, train_loss: 0.2015, test_loss: 1.8882, test_f1: 0.6483
 epoch: 94, train_loss: 0.1838, test_loss: 1.9653, test_f1: 0.6439
 epoch: 95, train_loss: 0.2024, test_loss: 1.9216, test_f1: 0.6381
 epoch: 96, train_loss: 0.2116, test_loss: 1.8243, test_f1: 0.6249
 epoch: 97, train_loss: 0.2205, test_loss: 1.7148, test_f1: 0.6422
 epoch: 98, train_loss: 0.2063, test_loss: 1.8826, test_f1: 0.6456
 epoch: 99, train_loss: 0.1951, test_loss: 1.8527, test_f1: 0.6390
##################ITERATION #6 ****************************************
 epoch: 0, train_loss: 1.2874, test_loss: 0.9981, test_f1: 0.4686
 epoch: 1, train_loss: 0.9986, test_loss: 0.9715, test_f1: 0.4980
 epoch: 2, train_loss: 0.9706, test_loss: 0.9799, test_f1: 0.5304
 epoch: 3, train_loss: 0.9221, test_loss: 0.9584, test_f1: 0.5104
 epoch: 4, train_loss: 0.9004, test_loss: 0.9828, test_f1: 0.5198
 epoch: 5, train_loss: 0.8902, test_loss: 0.9258, test_f1: 0.5557
 epoch: 6, train_loss: 0.8677, test_loss: 0.9327, test_f1: 0.5068
 epoch: 7, train_loss: 0.8765, test_loss: 0.9230, test_f1: 0.5275
 epoch: 8, train_loss: 0.8338, test_loss: 0.9958, test_f1: 0.5194
 epoch: 9, train_loss: 0.8207, test_loss: 1.0001, test_f1: 0.5270
 epoch: 10, train_loss: 0.8167, test_loss: 0.8619, test_f1: 0.6032
 epoch: 11, train_loss: 0.8043, test_loss: 0.9534, test_f1: 0.5366
 epoch: 12, train_loss: 0.7886, test_loss: 0.9300, test_f1: 0.5824
 epoch: 13, train_loss: 0.7851, test_loss: 0.9424, test_f1: 0.5832
 epoch: 14, train_loss: 0.7736, test_loss: 0.9112, test_f1: 0.5531
 epoch: 15, train_loss: 0.7647, test_loss: 0.9563, test_f1: 0.5741
 epoch: 16, train_loss: 0.7510, test_loss: 1.0334, test_f1: 0.5797
 epoch: 17, train_loss: 0.7331, test_loss: 0.9024, test_f1: 0.6011
 epoch: 18, train_loss: 0.7292, test_loss: 0.9739, test_f1: 0.6065
 epoch: 19, train_loss: 0.7370, test_loss: 1.0002, test_f1: 0.5883
 epoch: 20, train_loss: 0.7076, test_loss: 0.9333, test_f1: 0.6175
 epoch: 21, train_loss: 0.7153, test_loss: 0.9394, test_f1: 0.5894
 epoch: 22, train_loss: 0.6936, test_loss: 0.9635, test_f1: 0.5925
 epoch: 23, train_loss: 0.6802, test_loss: 0.9514, test_f1: 0.5832
 epoch: 24, train_loss: 0.6840, test_loss: 0.9408, test_f1: 0.6305
 epoch: 25, train_loss: 0.6515, test_loss: 0.9802, test_f1: 0.6259
 epoch: 26, train_loss: 0.6423, test_loss: 1.0560, test_f1: 0.5920
 epoch: 27, train_loss: 0.6431, test_loss: 0.9228, test_f1: 0.6122
 epoch: 28, train_loss: 0.6273, test_loss: 1.0141, test_f1: 0.6467
 epoch: 29, train_loss: 0.6142, test_loss: 1.0189, test_f1: 0.6275
 epoch: 30, train_loss: 0.6119, test_loss: 0.8715, test_f1: 0.6190
 epoch: 31, train_loss: 0.6049, test_loss: 0.9095, test_f1: 0.6102
 epoch: 32, train_loss: 0.5839, test_loss: 1.0103, test_f1: 0.6513
 epoch: 33, train_loss: 0.5620, test_loss: 1.0273, test_f1: 0.6527
 epoch: 34, train_loss: 0.5622, test_loss: 1.2035, test_f1: 0.6039
 epoch: 35, train_loss: 0.5687, test_loss: 0.9813, test_f1: 0.6129
 epoch: 36, train_loss: 0.5636, test_loss: 0.9990, test_f1: 0.6674
 epoch: 37, train_loss: 0.5437, test_loss: 1.1858, test_f1: 0.6028
 epoch: 38, train_loss: 0.5462, test_loss: 1.0361, test_f1: 0.6812
 epoch: 39, train_loss: 0.5129, test_loss: 1.1760, test_f1: 0.6220
 epoch: 40, train_loss: 0.5152, test_loss: 1.1500, test_f1: 0.6609
 epoch: 41, train_loss: 0.5135, test_loss: 1.0887, test_f1: 0.6243
 epoch: 42, train_loss: 0.5063, test_loss: 1.1649, test_f1: 0.6452
 epoch: 43, train_loss: 0.4924, test_loss: 1.1510, test_f1: 0.6481
 epoch: 44, train_loss: 0.4946, test_loss: 1.0374, test_f1: 0.6406
 epoch: 45, train_loss: 0.4882, test_loss: 1.1305, test_f1: 0.6747
 epoch: 46, train_loss: 0.4734, test_loss: 1.1183, test_f1: 0.6461
 epoch: 47, train_loss: 0.4699, test_loss: 1.1870, test_f1: 0.6379
 epoch: 48, train_loss: 0.4624, test_loss: 1.1368, test_f1: 0.6695
 epoch: 49, train_loss: 0.4446, test_loss: 1.1500, test_f1: 0.6536
 epoch: 50, train_loss: 0.4427, test_loss: 1.1436, test_f1: 0.6132
 epoch: 51, train_loss: 0.3900, test_loss: 1.3093, test_f1: 0.6317
 epoch: 52, train_loss: 0.3744, test_loss: 1.2682, test_f1: 0.6680
 epoch: 53, train_loss: 0.3744, test_loss: 1.2444, test_f1: 0.6736
 epoch: 54, train_loss: 0.3657, test_loss: 1.2566, test_f1: 0.6818
 epoch: 55, train_loss: 0.3353, test_loss: 1.3814, test_f1: 0.6444
 epoch: 56, train_loss: 0.3378, test_loss: 1.3105, test_f1: 0.6411
 epoch: 57, train_loss: 0.3266, test_loss: 1.3675, test_f1: 0.6712
 epoch: 58, train_loss: 0.3198, test_loss: 1.4367, test_f1: 0.6570
 epoch: 59, train_loss: 0.3136, test_loss: 1.3667, test_f1: 0.6748
 epoch: 60, train_loss: 0.3169, test_loss: 1.3181, test_f1: 0.6439
 epoch: 61, train_loss: 0.3139, test_loss: 1.3806, test_f1: 0.6516
 epoch: 62, train_loss: 0.2971, test_loss: 1.4614, test_f1: 0.6564
 epoch: 63, train_loss: 0.2973, test_loss: 1.4005, test_f1: 0.6547
 epoch: 64, train_loss: 0.2956, test_loss: 1.4827, test_f1: 0.6758
 epoch: 65, train_loss: 0.2926, test_loss: 1.5939, test_f1: 0.6566
 epoch: 66, train_loss: 0.2831, test_loss: 1.5037, test_f1: 0.6642
 epoch: 67, train_loss: 0.2810, test_loss: 1.5229, test_f1: 0.6814
 epoch: 68, train_loss: 0.2951, test_loss: 1.4984, test_f1: 0.6624
 epoch: 69, train_loss: 0.2765, test_loss: 1.6130, test_f1: 0.6521
 epoch: 70, train_loss: 0.2694, test_loss: 1.6024, test_f1: 0.6468
 epoch: 71, train_loss: 0.2538, test_loss: 1.6345, test_f1: 0.6784
 epoch: 72, train_loss: 0.2626, test_loss: 1.5356, test_f1: 0.6437
 epoch: 73, train_loss: 0.2720, test_loss: 1.5992, test_f1: 0.6423
 epoch: 74, train_loss: 0.2800, test_loss: 1.6758, test_f1: 0.6321
 epoch: 75, train_loss: 0.2504, test_loss: 1.7165, test_f1: 0.6391
 epoch: 76, train_loss: 0.2497, test_loss: 1.7073, test_f1: 0.6630
 epoch: 77, train_loss: 0.2393, test_loss: 1.7288, test_f1: 0.6844
 epoch: 78, train_loss: 0.2381, test_loss: 1.6279, test_f1: 0.6352
 epoch: 79, train_loss: 0.2463, test_loss: 1.7293, test_f1: 0.6325
 epoch: 80, train_loss: 0.2483, test_loss: 1.6663, test_f1: 0.6793
 epoch: 81, train_loss: 0.2452, test_loss: 1.7297, test_f1: 0.6514
 epoch: 82, train_loss: 0.2279, test_loss: 1.6518, test_f1: 0.6657
 epoch: 83, train_loss: 0.2265, test_loss: 1.7368, test_f1: 0.6432
 epoch: 84, train_loss: 0.2028, test_loss: 1.8829, test_f1: 0.6582
 epoch: 85, train_loss: 0.2251, test_loss: 1.8222, test_f1: 0.6392
 epoch: 86, train_loss: 0.2366, test_loss: 1.8117, test_f1: 0.6435
 epoch: 87, train_loss: 0.2276, test_loss: 1.8720, test_f1: 0.6592
 epoch: 88, train_loss: 0.2044, test_loss: 1.8166, test_f1: 0.6433
 epoch: 89, train_loss: 0.2163, test_loss: 1.7931, test_f1: 0.6499
 epoch: 90, train_loss: 0.2249, test_loss: 1.8850, test_f1: 0.6481
 epoch: 91, train_loss: 0.2205, test_loss: 1.7649, test_f1: 0.6590
 epoch: 92, train_loss: 0.2020, test_loss: 1.8743, test_f1: 0.6547
 epoch: 93, train_loss: 0.2010, test_loss: 1.8698, test_f1: 0.6516
 epoch: 94, train_loss: 0.2047, test_loss: 1.9242, test_f1: 0.6383
 epoch: 95, train_loss: 0.1991, test_loss: 1.8517, test_f1: 0.6354
 epoch: 96, train_loss: 0.2019, test_loss: 1.9804, test_f1: 0.6585
 epoch: 97, train_loss: 0.2027, test_loss: 2.0191, test_f1: 0.6341
 epoch: 98, train_loss: 0.1978, test_loss: 1.9135, test_f1: 0.6680
 epoch: 99, train_loss: 0.1972, test_loss: 2.0417, test_f1: 0.6559
##################ITERATION #7 ****************************************
 epoch: 0, train_loss: 1.3334, test_loss: 0.9880, test_f1: 0.4408
 epoch: 1, train_loss: 0.9943, test_loss: 0.9869, test_f1: 0.4631
 epoch: 2, train_loss: 0.9378, test_loss: 0.9619, test_f1: 0.4958
 epoch: 3, train_loss: 0.9146, test_loss: 0.9683, test_f1: 0.5178
 epoch: 4, train_loss: 0.9001, test_loss: 0.9291, test_f1: 0.5284
 epoch: 5, train_loss: 0.8936, test_loss: 0.9640, test_f1: 0.5495
 epoch: 6, train_loss: 0.8804, test_loss: 0.9670, test_f1: 0.5383
 epoch: 7, train_loss: 0.8601, test_loss: 0.9295, test_f1: 0.5221
 epoch: 8, train_loss: 0.8392, test_loss: 0.9433, test_f1: 0.5497
 epoch: 9, train_loss: 0.8273, test_loss: 0.9081, test_f1: 0.5482
 epoch: 10, train_loss: 0.8208, test_loss: 0.8671, test_f1: 0.5784
 epoch: 11, train_loss: 0.7959, test_loss: 0.9055, test_f1: 0.5714
 epoch: 12, train_loss: 0.8045, test_loss: 0.9308, test_f1: 0.5940
 epoch: 13, train_loss: 0.7841, test_loss: 0.9370, test_f1: 0.6003
 epoch: 14, train_loss: 0.7799, test_loss: 0.9304, test_f1: 0.6077
 epoch: 15, train_loss: 0.7857, test_loss: 0.9833, test_f1: 0.5778
 epoch: 16, train_loss: 0.7600, test_loss: 0.9753, test_f1: 0.5928
 epoch: 17, train_loss: 0.7619, test_loss: 0.9797, test_f1: 0.5874
 epoch: 18, train_loss: 0.7350, test_loss: 0.9259, test_f1: 0.6240
 epoch: 19, train_loss: 0.7413, test_loss: 0.9970, test_f1: 0.5637
 epoch: 20, train_loss: 0.7201, test_loss: 0.9706, test_f1: 0.5624
 epoch: 21, train_loss: 0.7255, test_loss: 0.9312, test_f1: 0.5991
 epoch: 22, train_loss: 0.7085, test_loss: 0.9189, test_f1: 0.6072
 epoch: 23, train_loss: 0.6898, test_loss: 1.0269, test_f1: 0.6063
 epoch: 24, train_loss: 0.6983, test_loss: 1.0020, test_f1: 0.5909
 epoch: 25, train_loss: 0.6702, test_loss: 0.9977, test_f1: 0.6041
 epoch: 26, train_loss: 0.6692, test_loss: 0.9891, test_f1: 0.6051
 epoch: 27, train_loss: 0.6592, test_loss: 0.9865, test_f1: 0.5649
 epoch: 28, train_loss: 0.6363, test_loss: 1.0567, test_f1: 0.6190
 epoch: 29, train_loss: 0.6491, test_loss: 0.9594, test_f1: 0.6242
 epoch: 30, train_loss: 0.6219, test_loss: 0.9773, test_f1: 0.6287
 epoch: 31, train_loss: 0.6264, test_loss: 0.9851, test_f1: 0.6117
 epoch: 32, train_loss: 0.6410, test_loss: 0.9243, test_f1: 0.6260
 epoch: 33, train_loss: 0.6032, test_loss: 0.9991, test_f1: 0.6481
 epoch: 34, train_loss: 0.5925, test_loss: 1.0146, test_f1: 0.6034
 epoch: 35, train_loss: 0.5830, test_loss: 1.0599, test_f1: 0.6421
 epoch: 36, train_loss: 0.5991, test_loss: 1.1131, test_f1: 0.6431
 epoch: 37, train_loss: 0.5834, test_loss: 0.9102, test_f1: 0.6399
 epoch: 38, train_loss: 0.5551, test_loss: 0.9267, test_f1: 0.6582
 epoch: 39, train_loss: 0.5661, test_loss: 1.0137, test_f1: 0.6328
 epoch: 40, train_loss: 0.5463, test_loss: 0.9522, test_f1: 0.6697
 epoch: 41, train_loss: 0.5218, test_loss: 1.2436, test_f1: 0.6291
 epoch: 42, train_loss: 0.5446, test_loss: 1.1049, test_f1: 0.6067
 epoch: 43, train_loss: 0.5359, test_loss: 0.9901, test_f1: 0.6828
 epoch: 44, train_loss: 0.5389, test_loss: 1.0091, test_f1: 0.6553
 epoch: 45, train_loss: 0.5153, test_loss: 1.1333, test_f1: 0.6518
 epoch: 46, train_loss: 0.5079, test_loss: 1.0949, test_f1: 0.6682
 epoch: 47, train_loss: 0.4827, test_loss: 1.0224, test_f1: 0.6498
 epoch: 48, train_loss: 0.4970, test_loss: 1.0120, test_f1: 0.6469
 epoch: 49, train_loss: 0.4844, test_loss: 1.0947, test_f1: 0.6273
 epoch: 50, train_loss: 0.4584, test_loss: 1.3091, test_f1: 0.5864
 epoch: 51, train_loss: 0.4292, test_loss: 1.1866, test_f1: 0.6598
 epoch: 52, train_loss: 0.3969, test_loss: 1.1401, test_f1: 0.6720
 epoch: 53, train_loss: 0.3602, test_loss: 1.1560, test_f1: 0.6611
 epoch: 54, train_loss: 0.3669, test_loss: 1.2473, test_f1: 0.6633
 epoch: 55, train_loss: 0.3689, test_loss: 1.2246, test_f1: 0.6487
 epoch: 56, train_loss: 0.3579, test_loss: 1.2262, test_f1: 0.6760
 epoch: 57, train_loss: 0.3395, test_loss: 1.2756, test_f1: 0.6617
 epoch: 58, train_loss: 0.3558, test_loss: 1.2750, test_f1: 0.6718
 epoch: 59, train_loss: 0.3342, test_loss: 1.2959, test_f1: 0.6768
 epoch: 60, train_loss: 0.3421, test_loss: 1.1810, test_f1: 0.6570
 epoch: 61, train_loss: 0.3477, test_loss: 1.2766, test_f1: 0.6749
 epoch: 62, train_loss: 0.3322, test_loss: 1.3119, test_f1: 0.6611
 epoch: 63, train_loss: 0.3185, test_loss: 1.2870, test_f1: 0.6771
 epoch: 64, train_loss: 0.3149, test_loss: 1.3234, test_f1: 0.6650
 epoch: 65, train_loss: 0.3060, test_loss: 1.3979, test_f1: 0.6671
 epoch: 66, train_loss: 0.2893, test_loss: 1.3788, test_f1: 0.6673
 epoch: 67, train_loss: 0.3086, test_loss: 1.4590, test_f1: 0.6648
 epoch: 68, train_loss: 0.3064, test_loss: 1.4403, test_f1: 0.6563
 epoch: 69, train_loss: 0.2997, test_loss: 1.3944, test_f1: 0.6509
 epoch: 70, train_loss: 0.2930, test_loss: 1.3989, test_f1: 0.6693
 epoch: 71, train_loss: 0.3068, test_loss: 1.3683, test_f1: 0.6630
 epoch: 72, train_loss: 0.2986, test_loss: 1.3093, test_f1: 0.6937
 epoch: 73, train_loss: 0.2627, test_loss: 1.4470, test_f1: 0.6748
 epoch: 74, train_loss: 0.2619, test_loss: 1.3949, test_f1: 0.6600
 epoch: 75, train_loss: 0.2674, test_loss: 1.4190, test_f1: 0.6462
 epoch: 76, train_loss: 0.2741, test_loss: 1.5854, test_f1: 0.6540
 epoch: 77, train_loss: 0.2579, test_loss: 1.4332, test_f1: 0.6570
 epoch: 78, train_loss: 0.2722, test_loss: 1.4896, test_f1: 0.6592
 epoch: 79, train_loss: 0.2508, test_loss: 1.4067, test_f1: 0.6756
 epoch: 80, train_loss: 0.2557, test_loss: 1.4495, test_f1: 0.6728
 epoch: 81, train_loss: 0.2545, test_loss: 1.5842, test_f1: 0.6700
 epoch: 82, train_loss: 0.2508, test_loss: 1.5475, test_f1: 0.6575
 epoch: 83, train_loss: 0.2540, test_loss: 1.5586, test_f1: 0.6408
 epoch: 84, train_loss: 0.2503, test_loss: 1.5988, test_f1: 0.6511
 epoch: 85, train_loss: 0.2505, test_loss: 1.5210, test_f1: 0.6599
 epoch: 86, train_loss: 0.2494, test_loss: 1.4740, test_f1: 0.6643
 epoch: 87, train_loss: 0.2296, test_loss: 1.6145, test_f1: 0.6455
 epoch: 88, train_loss: 0.2278, test_loss: 1.5346, test_f1: 0.6632
 epoch: 89, train_loss: 0.2487, test_loss: 1.5697, test_f1: 0.6397
 epoch: 90, train_loss: 0.2381, test_loss: 1.6223, test_f1: 0.6586
 epoch: 91, train_loss: 0.2091, test_loss: 1.6987, test_f1: 0.6695
 epoch: 92, train_loss: 0.2252, test_loss: 1.6752, test_f1: 0.6454
 epoch: 93, train_loss: 0.2095, test_loss: 1.8190, test_f1: 0.6223
 epoch: 94, train_loss: 0.2227, test_loss: 1.8441, test_f1: 0.6170
 epoch: 95, train_loss: 0.2269, test_loss: 1.7226, test_f1: 0.6336
 epoch: 96, train_loss: 0.2142, test_loss: 1.6315, test_f1: 0.6816
 epoch: 97, train_loss: 0.2080, test_loss: 1.7313, test_f1: 0.6675
 epoch: 98, train_loss: 0.2272, test_loss: 1.7046, test_f1: 0.6599
 epoch: 99, train_loss: 0.2005, test_loss: 1.7435, test_f1: 0.6673
##################ITERATION #8 ****************************************
 epoch: 0, train_loss: 1.2898, test_loss: 1.0272, test_f1: 0.5057
 epoch: 1, train_loss: 1.0027, test_loss: 0.9670, test_f1: 0.5168
 epoch: 2, train_loss: 0.9513, test_loss: 0.9777, test_f1: 0.5261
 epoch: 3, train_loss: 0.9155, test_loss: 0.9163, test_f1: 0.5152
 epoch: 4, train_loss: 0.8868, test_loss: 0.9494, test_f1: 0.5286
 epoch: 5, train_loss: 0.8812, test_loss: 0.9162, test_f1: 0.5456
 epoch: 6, train_loss: 0.8674, test_loss: 0.9557, test_f1: 0.5330
 epoch: 7, train_loss: 0.8523, test_loss: 0.9680, test_f1: 0.5553
 epoch: 8, train_loss: 0.8312, test_loss: 0.9184, test_f1: 0.5400
 epoch: 9, train_loss: 0.8306, test_loss: 0.9171, test_f1: 0.5323
 epoch: 10, train_loss: 0.8202, test_loss: 0.9563, test_f1: 0.5609
 epoch: 11, train_loss: 0.8006, test_loss: 0.9635, test_f1: 0.5609
 epoch: 12, train_loss: 0.7991, test_loss: 0.9048, test_f1: 0.5695
 epoch: 13, train_loss: 0.7950, test_loss: 0.9450, test_f1: 0.5543
 epoch: 14, train_loss: 0.7771, test_loss: 0.9239, test_f1: 0.5987
 epoch: 15, train_loss: 0.7511, test_loss: 0.9671, test_f1: 0.5361
 epoch: 16, train_loss: 0.7477, test_loss: 0.9487, test_f1: 0.5917
 epoch: 17, train_loss: 0.7351, test_loss: 0.9676, test_f1: 0.5960
 epoch: 18, train_loss: 0.7272, test_loss: 0.9442, test_f1: 0.5729
 epoch: 19, train_loss: 0.7224, test_loss: 1.0023, test_f1: 0.5855
 epoch: 20, train_loss: 0.7090, test_loss: 1.0063, test_f1: 0.6067
 epoch: 21, train_loss: 0.7089, test_loss: 1.0345, test_f1: 0.6022
 epoch: 22, train_loss: 0.7035, test_loss: 1.0117, test_f1: 0.6053
 epoch: 23, train_loss: 0.6808, test_loss: 0.9954, test_f1: 0.6709
 epoch: 24, train_loss: 0.6770, test_loss: 0.9854, test_f1: 0.5991
 epoch: 25, train_loss: 0.6714, test_loss: 1.0021, test_f1: 0.5693
 epoch: 26, train_loss: 0.6573, test_loss: 0.9727, test_f1: 0.6391
 epoch: 27, train_loss: 0.6265, test_loss: 0.9845, test_f1: 0.6188
 epoch: 28, train_loss: 0.6443, test_loss: 1.0764, test_f1: 0.6286
 epoch: 29, train_loss: 0.6256, test_loss: 0.9760, test_f1: 0.6590
 epoch: 30, train_loss: 0.6196, test_loss: 0.9986, test_f1: 0.6004
 epoch: 31, train_loss: 0.6119, test_loss: 1.1458, test_f1: 0.5900
 epoch: 32, train_loss: 0.5999, test_loss: 1.0163, test_f1: 0.6270
 epoch: 33, train_loss: 0.5890, test_loss: 1.1239, test_f1: 0.6199
 epoch: 34, train_loss: 0.5907, test_loss: 1.2392, test_f1: 0.5963
 epoch: 35, train_loss: 0.5885, test_loss: 1.1014, test_f1: 0.6352
 epoch: 36, train_loss: 0.5701, test_loss: 1.1105, test_f1: 0.6201
 epoch: 37, train_loss: 0.5575, test_loss: 1.0517, test_f1: 0.6167
 epoch: 38, train_loss: 0.5725, test_loss: 1.0953, test_f1: 0.6112
 epoch: 39, train_loss: 0.5540, test_loss: 1.2031, test_f1: 0.6631
 epoch: 40, train_loss: 0.5260, test_loss: 1.1263, test_f1: 0.6386
 epoch: 41, train_loss: 0.5199, test_loss: 1.1198, test_f1: 0.6649
 epoch: 42, train_loss: 0.5107, test_loss: 1.0502, test_f1: 0.6672
 epoch: 43, train_loss: 0.5050, test_loss: 1.1692, test_f1: 0.6285
 epoch: 44, train_loss: 0.5018, test_loss: 1.2098, test_f1: 0.6559
 epoch: 45, train_loss: 0.4797, test_loss: 1.3285, test_f1: 0.6180
 epoch: 46, train_loss: 0.4981, test_loss: 1.1578, test_f1: 0.6968
 epoch: 47, train_loss: 0.4997, test_loss: 1.1423, test_f1: 0.6465
 epoch: 48, train_loss: 0.4696, test_loss: 1.1336, test_f1: 0.6696
 epoch: 49, train_loss: 0.4580, test_loss: 1.2468, test_f1: 0.6199
 epoch: 50, train_loss: 0.4537, test_loss: 1.4148, test_f1: 0.6050
 epoch: 51, train_loss: 0.4122, test_loss: 1.1986, test_f1: 0.6753
 epoch: 52, train_loss: 0.3957, test_loss: 1.2811, test_f1: 0.6640
 epoch: 53, train_loss: 0.3554, test_loss: 1.2376, test_f1: 0.6644
 epoch: 54, train_loss: 0.3613, test_loss: 1.4064, test_f1: 0.6501
 epoch: 55, train_loss: 0.3747, test_loss: 1.3168, test_f1: 0.6573
 epoch: 56, train_loss: 0.3544, test_loss: 1.3854, test_f1: 0.6483
 epoch: 57, train_loss: 0.3338, test_loss: 1.3618, test_f1: 0.6546
 epoch: 58, train_loss: 0.3280, test_loss: 1.4361, test_f1: 0.6453
 epoch: 59, train_loss: 0.3266, test_loss: 1.4579, test_f1: 0.6414
 epoch: 60, train_loss: 0.3176, test_loss: 1.4387, test_f1: 0.6672
 epoch: 61, train_loss: 0.3205, test_loss: 1.5673, test_f1: 0.6359
 epoch: 62, train_loss: 0.3273, test_loss: 1.3770, test_f1: 0.6835
 epoch: 63, train_loss: 0.3205, test_loss: 1.3397, test_f1: 0.6789
 epoch: 64, train_loss: 0.3007, test_loss: 1.5789, test_f1: 0.6472
 epoch: 65, train_loss: 0.3126, test_loss: 1.4933, test_f1: 0.6411
 epoch: 66, train_loss: 0.2980, test_loss: 1.5728, test_f1: 0.6772
 epoch: 67, train_loss: 0.3105, test_loss: 1.5434, test_f1: 0.6566
 epoch: 68, train_loss: 0.2929, test_loss: 1.5793, test_f1: 0.6505
 epoch: 69, train_loss: 0.3085, test_loss: 1.6128, test_f1: 0.6418
 epoch: 70, train_loss: 0.2873, test_loss: 1.6452, test_f1: 0.6529
 epoch: 71, train_loss: 0.2701, test_loss: 1.5812, test_f1: 0.6505
 epoch: 72, train_loss: 0.2649, test_loss: 1.6417, test_f1: 0.6590
 epoch: 73, train_loss: 0.2780, test_loss: 1.7131, test_f1: 0.6400
 epoch: 74, train_loss: 0.2796, test_loss: 1.5129, test_f1: 0.6655
 epoch: 75, train_loss: 0.2689, test_loss: 1.6870, test_f1: 0.6349
 epoch: 76, train_loss: 0.2633, test_loss: 1.6794, test_f1: 0.6623
 epoch: 77, train_loss: 0.2669, test_loss: 1.4964, test_f1: 0.6666
 epoch: 78, train_loss: 0.2558, test_loss: 1.5438, test_f1: 0.6453
 epoch: 79, train_loss: 0.2551, test_loss: 1.6274, test_f1: 0.6495
 epoch: 80, train_loss: 0.2535, test_loss: 1.6377, test_f1: 0.6385
 epoch: 81, train_loss: 0.2406, test_loss: 1.7868, test_f1: 0.6618
 epoch: 82, train_loss: 0.2556, test_loss: 1.7056, test_f1: 0.6491
 epoch: 83, train_loss: 0.2416, test_loss: 1.7573, test_f1: 0.6341
 epoch: 84, train_loss: 0.2549, test_loss: 1.6843, test_f1: 0.6441
 epoch: 85, train_loss: 0.2442, test_loss: 1.7043, test_f1: 0.6513
 epoch: 86, train_loss: 0.2181, test_loss: 1.8477, test_f1: 0.6579
 epoch: 87, train_loss: 0.2306, test_loss: 1.7767, test_f1: 0.6437
 epoch: 88, train_loss: 0.2447, test_loss: 1.6367, test_f1: 0.6683
 epoch: 89, train_loss: 0.2341, test_loss: 1.7248, test_f1: 0.6714
 epoch: 90, train_loss: 0.2372, test_loss: 1.6602, test_f1: 0.6500
 epoch: 91, train_loss: 0.2309, test_loss: 1.7444, test_f1: 0.6779
 epoch: 92, train_loss: 0.2175, test_loss: 1.7453, test_f1: 0.6704
 epoch: 93, train_loss: 0.2204, test_loss: 1.6993, test_f1: 0.6552
 epoch: 94, train_loss: 0.2241, test_loss: 1.7024, test_f1: 0.6538
 epoch: 95, train_loss: 0.1996, test_loss: 1.7519, test_f1: 0.6828
 epoch: 96, train_loss: 0.2029, test_loss: 1.7216, test_f1: 0.6649
 epoch: 97, train_loss: 0.2152, test_loss: 1.7019, test_f1: 0.6500
 epoch: 98, train_loss: 0.2211, test_loss: 1.7837, test_f1: 0.6609
 epoch: 99, train_loss: 0.2063, test_loss: 1.8124, test_f1: 0.6459
##################ITERATION #9 ****************************************
 epoch: 0, train_loss: 1.2592, test_loss: 1.1131, test_f1: 0.3719
 epoch: 1, train_loss: 0.9836, test_loss: 0.9346, test_f1: 0.4923
 epoch: 2, train_loss: 0.9365, test_loss: 0.9272, test_f1: 0.5157
 epoch: 3, train_loss: 0.9170, test_loss: 0.9488, test_f1: 0.5107
 epoch: 4, train_loss: 0.9017, test_loss: 0.9212, test_f1: 0.4898
 epoch: 5, train_loss: 0.8818, test_loss: 0.9206, test_f1: 0.5357
 epoch: 6, train_loss: 0.8774, test_loss: 0.9310, test_f1: 0.5432
 epoch: 7, train_loss: 0.8381, test_loss: 0.8949, test_f1: 0.5326
 epoch: 8, train_loss: 0.8261, test_loss: 0.9280, test_f1: 0.5712
 epoch: 9, train_loss: 0.8139, test_loss: 0.9808, test_f1: 0.5493
 epoch: 10, train_loss: 0.8086, test_loss: 0.9580, test_f1: 0.5639
 epoch: 11, train_loss: 0.7970, test_loss: 1.0148, test_f1: 0.5600
 epoch: 12, train_loss: 0.8023, test_loss: 0.9761, test_f1: 0.5438
 epoch: 13, train_loss: 0.7818, test_loss: 0.9933, test_f1: 0.5293
 epoch: 14, train_loss: 0.7910, test_loss: 0.9817, test_f1: 0.5882
 epoch: 15, train_loss: 0.7615, test_loss: 0.9986, test_f1: 0.5707
 epoch: 16, train_loss: 0.7425, test_loss: 0.9500, test_f1: 0.6038
 epoch: 17, train_loss: 0.7438, test_loss: 0.9470, test_f1: 0.5857
 epoch: 18, train_loss: 0.7297, test_loss: 0.9417, test_f1: 0.5923
 epoch: 19, train_loss: 0.7133, test_loss: 1.0504, test_f1: 0.6153
 epoch: 20, train_loss: 0.7258, test_loss: 0.9630, test_f1: 0.5637
 epoch: 21, train_loss: 0.6935, test_loss: 1.0637, test_f1: 0.5976
 epoch: 22, train_loss: 0.6971, test_loss: 1.0704, test_f1: 0.5617
 epoch: 23, train_loss: 0.6865, test_loss: 1.0443, test_f1: 0.5736
 epoch: 24, train_loss: 0.6867, test_loss: 1.0593, test_f1: 0.6288
 epoch: 25, train_loss: 0.6779, test_loss: 1.0646, test_f1: 0.6028
 epoch: 26, train_loss: 0.6491, test_loss: 1.0262, test_f1: 0.6123
 epoch: 27, train_loss: 0.6726, test_loss: 1.0072, test_f1: 0.5940
 epoch: 28, train_loss: 0.6349, test_loss: 1.1227, test_f1: 0.5828
 epoch: 29, train_loss: 0.6353, test_loss: 1.0554, test_f1: 0.6407
 epoch: 30, train_loss: 0.6370, test_loss: 0.9835, test_f1: 0.6079
 epoch: 31, train_loss: 0.6153, test_loss: 1.0032, test_f1: 0.6476
 epoch: 32, train_loss: 0.6043, test_loss: 1.1405, test_f1: 0.6119
 epoch: 33, train_loss: 0.6115, test_loss: 1.1966, test_f1: 0.6088
 epoch: 34, train_loss: 0.5919, test_loss: 1.1059, test_f1: 0.6282
 epoch: 35, train_loss: 0.5797, test_loss: 1.0957, test_f1: 0.6427
 epoch: 36, train_loss: 0.5742, test_loss: 1.2366, test_f1: 0.5579
 epoch: 37, train_loss: 0.5755, test_loss: 1.2408, test_f1: 0.5928
 epoch: 38, train_loss: 0.5510, test_loss: 1.1264, test_f1: 0.6268
 epoch: 39, train_loss: 0.5594, test_loss: 1.2200, test_f1: 0.6221
 epoch: 40, train_loss: 0.5530, test_loss: 1.1031, test_f1: 0.6218
 epoch: 41, train_loss: 0.5375, test_loss: 1.2943, test_f1: 0.6606
 epoch: 42, train_loss: 0.5316, test_loss: 1.2531, test_f1: 0.6322
 epoch: 43, train_loss: 0.5053, test_loss: 1.3046, test_f1: 0.6006
 epoch: 44, train_loss: 0.5161, test_loss: 1.2337, test_f1: 0.6476
 epoch: 45, train_loss: 0.5037, test_loss: 1.1736, test_f1: 0.6537
 epoch: 46, train_loss: 0.4850, test_loss: 1.3218, test_f1: 0.6399
 epoch: 47, train_loss: 0.4707, test_loss: 1.1324, test_f1: 0.6397
 epoch: 48, train_loss: 0.4761, test_loss: 1.3054, test_f1: 0.6301
 epoch: 49, train_loss: 0.4519, test_loss: 1.3235, test_f1: 0.6327
 epoch: 50, train_loss: 0.4815, test_loss: 1.2966, test_f1: 0.6097
 epoch: 51, train_loss: 0.4237, test_loss: 1.4119, test_f1: 0.6575
 epoch: 52, train_loss: 0.3915, test_loss: 1.4131, test_f1: 0.6516
 epoch: 53, train_loss: 0.3753, test_loss: 1.3828, test_f1: 0.6721
 epoch: 54, train_loss: 0.3678, test_loss: 1.5629, test_f1: 0.6522
 epoch: 55, train_loss: 0.3797, test_loss: 1.4692, test_f1: 0.6402
 epoch: 56, train_loss: 0.3670, test_loss: 1.4542, test_f1: 0.6764
 epoch: 57, train_loss: 0.3543, test_loss: 1.4968, test_f1: 0.6470
 epoch: 58, train_loss: 0.3402, test_loss: 1.5312, test_f1: 0.6601
 epoch: 59, train_loss: 0.3443, test_loss: 1.5335, test_f1: 0.6564
 epoch: 60, train_loss: 0.3322, test_loss: 1.5393, test_f1: 0.6962
 epoch: 61, train_loss: 0.3298, test_loss: 1.5746, test_f1: 0.6455
 epoch: 62, train_loss: 0.3356, test_loss: 1.5772, test_f1: 0.6510
 epoch: 63, train_loss: 0.3229, test_loss: 1.5533, test_f1: 0.6743
 epoch: 64, train_loss: 0.3047, test_loss: 1.4652, test_f1: 0.6696
 epoch: 65, train_loss: 0.3111, test_loss: 1.5365, test_f1: 0.6457
 epoch: 66, train_loss: 0.3086, test_loss: 1.6402, test_f1: 0.6603
 epoch: 67, train_loss: 0.3258, test_loss: 1.5732, test_f1: 0.6790
 epoch: 68, train_loss: 0.3029, test_loss: 1.6972, test_f1: 0.6374
 epoch: 69, train_loss: 0.3060, test_loss: 1.6064, test_f1: 0.6348
 epoch: 70, train_loss: 0.2878, test_loss: 1.7638, test_f1: 0.6316
 epoch: 71, train_loss: 0.2837, test_loss: 1.6998, test_f1: 0.6345
 epoch: 72, train_loss: 0.2820, test_loss: 1.6728, test_f1: 0.6613
 epoch: 73, train_loss: 0.2606, test_loss: 1.7056, test_f1: 0.6745
 epoch: 74, train_loss: 0.2919, test_loss: 1.7029, test_f1: 0.6314
 epoch: 75, train_loss: 0.2862, test_loss: 1.6186, test_f1: 0.6573
 epoch: 76, train_loss: 0.2768, test_loss: 1.6936, test_f1: 0.6599
 epoch: 77, train_loss: 0.2760, test_loss: 1.7505, test_f1: 0.6431
 epoch: 78, train_loss: 0.2807, test_loss: 1.6524, test_f1: 0.6591
 epoch: 79, train_loss: 0.2715, test_loss: 1.7292, test_f1: 0.6385
 epoch: 80, train_loss: 0.2818, test_loss: 1.7483, test_f1: 0.6467
 epoch: 81, train_loss: 0.2564, test_loss: 1.9325, test_f1: 0.6322
 epoch: 82, train_loss: 0.2486, test_loss: 1.8200, test_f1: 0.6304
 epoch: 83, train_loss: 0.2660, test_loss: 1.8230, test_f1: 0.6333
 epoch: 84, train_loss: 0.2735, test_loss: 1.7202, test_f1: 0.6313
 epoch: 85, train_loss: 0.2474, test_loss: 1.8689, test_f1: 0.6578
 epoch: 86, train_loss: 0.2502, test_loss: 1.7934, test_f1: 0.6441
 epoch: 87, train_loss: 0.2408, test_loss: 1.8867, test_f1: 0.6332
 epoch: 88, train_loss: 0.2507, test_loss: 1.9342, test_f1: 0.6394
 epoch: 89, train_loss: 0.2437, test_loss: 1.8664, test_f1: 0.6362
 epoch: 90, train_loss: 0.2286, test_loss: 1.8912, test_f1: 0.6428
 epoch: 91, train_loss: 0.2514, test_loss: 1.8513, test_f1: 0.6630
 epoch: 92, train_loss: 0.2465, test_loss: 1.8568, test_f1: 0.6420
 epoch: 93, train_loss: 0.2365, test_loss: 1.7852, test_f1: 0.6665
 epoch: 94, train_loss: 0.2317, test_loss: 1.8601, test_f1: 0.6693
 epoch: 95, train_loss: 0.2234, test_loss: 1.9730, test_f1: 0.6552
 epoch: 96, train_loss: 0.2521, test_loss: 1.8675, test_f1: 0.6357
 epoch: 97, train_loss: 0.2103, test_loss: 1.8988, test_f1: 0.6282
 epoch: 98, train_loss: 0.2150, test_loss: 1.9582, test_f1: 0.6490
 epoch: 99, train_loss: 0.2307, test_loss: 1.9304, test_f1: 0.6454

Training completed in 707.13 seconds
Best F1: 0.7028 at epoch 84
Mean F1 across iterations: 0.6890  0.0074
========================FINAL RESULTS================================
FEGIN weighted F1: 0.7028  0.0074
python main.py --data ltspice_examples --representation component_net --model FEGIN --layers 4 --hiddens 128 --batch_size 64 --lr 0.001 --emb_size 128 --epochs 100 --save_appendix component_net_L4_H128_BS64_LR0.001_E128 --no_val
-----



STDERR:
Processing...
Done!
  File "main.py", line 370, in <module>
    main()
  File "main.py", line 254, in main
    dataset = dataset_class(
  File "/home/philip/projects/ltspice_examples_code_repo/Circuit-Completion-Using-GNNs/component_classification_with_link_prediction_head/evaluation/FEGIN/kernel/circuit_datasets.py", line 15, in __init__
    self.data, self.slices = torch.load(self.processed_paths[0])
  File "/home/philip/.local/lib/python3.8/site-packages/torch/serialization.py", line 1040, in load
    warnings.warn(
  File "/usr/lib/python3.8/warnings.py", line 109, in _showwarnmsg
    sw(msg.message, msg.category, msg.filename, msg.lineno,
  File "main.py", line 47, in warn_with_traceback
    traceback.print_stack(file=log)
/home/philip/projects/ltspice_examples_code_repo/Circuit-Completion-Using-GNNs/component_classification_with_link_prediction_head/evaluation/FEGIN/kernel/circuit_datasets.py:15: FutureWarning: You are using `torch.load` with `weights_only=False` (the current default value), which uses the default pickle module implicitly. It is possible to construct malicious pickle data which will execute arbitrary code during unpickling (See https://github.com/pytorch/pytorch/blob/main/SECURITY.md#untrusted-models for more details). In a future release, the default value for `weights_only` will be flipped to `True`. This limits the functions that could be executed during unpickling. Arbitrary objects will no longer be allowed to be loaded via this mode unless they are explicitly allowlisted by the user via `torch.serialization.add_safe_globals`. We recommend you start setting `weights_only=True` for any use case where you don't have full control of the loaded file. Please open an issue on GitHub for any issues related to this experimental feature.
  self.data, self.slices = torch.load(self.processed_paths[0])
