STDOUT:
Results will be saved in /home/philip/projects/ltspice_examples_code_repo/Circuit-Completion-Using-GNNs/component_classification_with_link_prediction_head/evaluation/FEGIN/results/model_FEGIN_dataset_ltspice_examples
Command line input: python main.py --data ltspice_examples --representation component_pin_net --model FEGIN --layers 2 --hiddens 64 --batch_size 32 --lr 0.01 --emb_size 128 --epochs 100 --save_appendix component_pin_net_L2_H64_BS32_LR0.01_E128 --no_val
 is saved.
-----
ltspice_examples - FEGIN
Using 2 layers, 64 hidden units, h = 2
Loading component_pin_net representation dataset
ENTERED
Training FEGIN on component_pin_net representation
Train: 3558, Test: 846
##################ITERATION #0 ****************************************
 epoch: 0, train_loss: 1.1147, test_loss: 1.1443, test_f1: 0.4317
 epoch: 1, train_loss: 1.0062, test_loss: 1.2283, test_f1: 0.4366
 epoch: 2, train_loss: 0.9893, test_loss: 1.0223, test_f1: 0.4668
 epoch: 3, train_loss: 0.9629, test_loss: 0.9988, test_f1: 0.5443
 epoch: 4, train_loss: 0.9464, test_loss: 1.0058, test_f1: 0.5470
 epoch: 5, train_loss: 0.9307, test_loss: 0.9720, test_f1: 0.5118
 epoch: 6, train_loss: 0.9223, test_loss: 0.9308, test_f1: 0.4865
 epoch: 7, train_loss: 0.9280, test_loss: 0.9574, test_f1: 0.4736
 epoch: 8, train_loss: 0.9151, test_loss: 0.9154, test_f1: 0.4980
 epoch: 9, train_loss: 0.8884, test_loss: 1.1291, test_f1: 0.4616
 epoch: 10, train_loss: 0.8805, test_loss: 0.9258, test_f1: 0.5168
 epoch: 11, train_loss: 0.8664, test_loss: 0.9457, test_f1: 0.5210
 epoch: 12, train_loss: 0.8947, test_loss: 0.9049, test_f1: 0.5416
 epoch: 13, train_loss: 0.8805, test_loss: 0.9144, test_f1: 0.5779
 epoch: 14, train_loss: 0.8636, test_loss: 0.8684, test_f1: 0.5173
 epoch: 15, train_loss: 0.8484, test_loss: 0.8709, test_f1: 0.5925
 epoch: 16, train_loss: 0.8466, test_loss: 0.8532, test_f1: 0.5325
 epoch: 17, train_loss: 0.8476, test_loss: 0.8607, test_f1: 0.6028
 epoch: 18, train_loss: 0.8208, test_loss: 0.8622, test_f1: 0.5785
 epoch: 19, train_loss: 0.8177, test_loss: 0.8221, test_f1: 0.5568
 epoch: 20, train_loss: 0.8183, test_loss: 0.9690, test_f1: 0.5301
 epoch: 21, train_loss: 0.8149, test_loss: 0.8097, test_f1: 0.5698
 epoch: 22, train_loss: 0.8107, test_loss: 0.9129, test_f1: 0.5643
 epoch: 23, train_loss: 0.7945, test_loss: 0.8208, test_f1: 0.6284
 epoch: 24, train_loss: 0.7988, test_loss: 0.8759, test_f1: 0.5762
 epoch: 25, train_loss: 0.7833, test_loss: 0.8913, test_f1: 0.6026
 epoch: 26, train_loss: 0.8050, test_loss: 0.8639, test_f1: 0.5992
 epoch: 27, train_loss: 0.7930, test_loss: 0.8579, test_f1: 0.5907
 epoch: 28, train_loss: 0.7951, test_loss: 0.8000, test_f1: 0.5764
 epoch: 29, train_loss: 0.7725, test_loss: 0.8038, test_f1: 0.5728
 epoch: 30, train_loss: 0.7706, test_loss: 0.9334, test_f1: 0.5953
 epoch: 31, train_loss: 0.7622, test_loss: 0.9584, test_f1: 0.5922
 epoch: 32, train_loss: 0.7639, test_loss: 0.8226, test_f1: 0.6247
 epoch: 33, train_loss: 0.7547, test_loss: 0.8241, test_f1: 0.6318
 epoch: 34, train_loss: 0.7358, test_loss: 0.8402, test_f1: 0.5921
 epoch: 35, train_loss: 0.7454, test_loss: 0.8043, test_f1: 0.6536
 epoch: 36, train_loss: 0.7349, test_loss: 0.8428, test_f1: 0.6175
 epoch: 37, train_loss: 0.7416, test_loss: 0.8270, test_f1: 0.6422
 epoch: 38, train_loss: 0.7308, test_loss: 0.8315, test_f1: 0.6326
 epoch: 39, train_loss: 0.7289, test_loss: 0.8725, test_f1: 0.6378
 epoch: 40, train_loss: 0.7363, test_loss: 0.9661, test_f1: 0.5940
 epoch: 41, train_loss: 0.7199, test_loss: 0.7776, test_f1: 0.6222
 epoch: 42, train_loss: 0.7079, test_loss: 0.8380, test_f1: 0.6265
 epoch: 43, train_loss: 0.7198, test_loss: 1.0896, test_f1: 0.5924
 epoch: 44, train_loss: 0.7175, test_loss: 0.8295, test_f1: 0.6136
 epoch: 45, train_loss: 0.6991, test_loss: 0.8534, test_f1: 0.6110
 epoch: 46, train_loss: 0.7063, test_loss: 0.8258, test_f1: 0.6258
 epoch: 47, train_loss: 0.7049, test_loss: 1.0637, test_f1: 0.5753
 epoch: 48, train_loss: 0.6955, test_loss: 0.9276, test_f1: 0.5908
 epoch: 49, train_loss: 0.7023, test_loss: 0.8968, test_f1: 0.6369
 epoch: 50, train_loss: 0.6982, test_loss: 1.0063, test_f1: 0.6123
 epoch: 51, train_loss: 0.6562, test_loss: 0.8625, test_f1: 0.6417
 epoch: 52, train_loss: 0.6310, test_loss: 0.8651, test_f1: 0.6752
 epoch: 53, train_loss: 0.6105, test_loss: 0.9671, test_f1: 0.6428
 epoch: 54, train_loss: 0.6280, test_loss: 0.9224, test_f1: 0.6304
 epoch: 55, train_loss: 0.6189, test_loss: 0.9072, test_f1: 0.6132
 epoch: 56, train_loss: 0.6070, test_loss: 0.9481, test_f1: 0.6483
 epoch: 57, train_loss: 0.6128, test_loss: 0.9185, test_f1: 0.6360
 epoch: 58, train_loss: 0.6148, test_loss: 0.8774, test_f1: 0.6418
 epoch: 59, train_loss: 0.5962, test_loss: 0.9354, test_f1: 0.6316
 epoch: 60, train_loss: 0.6062, test_loss: 0.8963, test_f1: 0.6452
 epoch: 61, train_loss: 0.5950, test_loss: 0.9104, test_f1: 0.6615
 epoch: 62, train_loss: 0.5998, test_loss: 0.9114, test_f1: 0.6438
 epoch: 63, train_loss: 0.5922, test_loss: 0.9889, test_f1: 0.6285
 epoch: 64, train_loss: 0.5954, test_loss: 0.9357, test_f1: 0.6437
 epoch: 65, train_loss: 0.5950, test_loss: 0.9154, test_f1: 0.6390
 epoch: 66, train_loss: 0.5740, test_loss: 1.0086, test_f1: 0.6315
 epoch: 67, train_loss: 0.5867, test_loss: 0.8937, test_f1: 0.6210
 epoch: 68, train_loss: 0.5768, test_loss: 0.9447, test_f1: 0.6603
 epoch: 69, train_loss: 0.5873, test_loss: 0.9826, test_f1: 0.6520
 epoch: 70, train_loss: 0.5526, test_loss: 1.0401, test_f1: 0.6459
 epoch: 71, train_loss: 0.5690, test_loss: 0.8755, test_f1: 0.6626
 epoch: 72, train_loss: 0.5715, test_loss: 0.9057, test_f1: 0.6191
 epoch: 73, train_loss: 0.5720, test_loss: 0.9458, test_f1: 0.6324
 epoch: 74, train_loss: 0.5681, test_loss: 0.9025, test_f1: 0.6595
 epoch: 75, train_loss: 0.5745, test_loss: 0.9058, test_f1: 0.6582
 epoch: 76, train_loss: 0.5550, test_loss: 0.9553, test_f1: 0.6622
 epoch: 77, train_loss: 0.5603, test_loss: 0.9555, test_f1: 0.6522
 epoch: 78, train_loss: 0.5639, test_loss: 1.0010, test_f1: 0.6414
 epoch: 79, train_loss: 0.5523, test_loss: 0.9111, test_f1: 0.6839
 epoch: 80, train_loss: 0.5391, test_loss: 0.9520, test_f1: 0.6618
 epoch: 81, train_loss: 0.5356, test_loss: 0.9148, test_f1: 0.6217
 epoch: 82, train_loss: 0.5407, test_loss: 1.0132, test_f1: 0.6602
 epoch: 83, train_loss: 0.5346, test_loss: 0.9756, test_f1: 0.6770
 epoch: 84, train_loss: 0.5218, test_loss: 1.0171, test_f1: 0.6492
 epoch: 85, train_loss: 0.5214, test_loss: 1.2116, test_f1: 0.6525
 epoch: 86, train_loss: 0.5415, test_loss: 1.0002, test_f1: 0.6679
 epoch: 87, train_loss: 0.5251, test_loss: 0.9560, test_f1: 0.6782
 epoch: 88, train_loss: 0.5322, test_loss: 1.0640, test_f1: 0.6519
 epoch: 89, train_loss: 0.5385, test_loss: 0.9484, test_f1: 0.6348
 epoch: 90, train_loss: 0.5272, test_loss: 0.9998, test_f1: 0.6644
 epoch: 91, train_loss: 0.5380, test_loss: 1.0574, test_f1: 0.6690
 epoch: 92, train_loss: 0.5103, test_loss: 1.0503, test_f1: 0.6131
 epoch: 93, train_loss: 0.5151, test_loss: 1.0487, test_f1: 0.6522
 epoch: 94, train_loss: 0.5337, test_loss: 0.9814, test_f1: 0.6604
 epoch: 95, train_loss: 0.5173, test_loss: 1.0316, test_f1: 0.6539
 epoch: 96, train_loss: 0.5098, test_loss: 1.0329, test_f1: 0.6485
 epoch: 97, train_loss: 0.5162, test_loss: 1.1763, test_f1: 0.6486
 epoch: 98, train_loss: 0.5103, test_loss: 0.9967, test_f1: 0.6423
 epoch: 99, train_loss: 0.5125, test_loss: 1.0124, test_f1: 0.6533
##################ITERATION #1 ****************************************
 epoch: 0, train_loss: 1.1014, test_loss: 1.1178, test_f1: 0.4322
 epoch: 1, train_loss: 1.0104, test_loss: 1.1987, test_f1: 0.3909
 epoch: 2, train_loss: 0.9729, test_loss: 1.0110, test_f1: 0.4767
 epoch: 3, train_loss: 0.9415, test_loss: 0.9462, test_f1: 0.4831
 epoch: 4, train_loss: 0.9227, test_loss: 0.9665, test_f1: 0.5377
 epoch: 5, train_loss: 0.9114, test_loss: 0.9021, test_f1: 0.5503
 epoch: 6, train_loss: 0.8911, test_loss: 0.9069, test_f1: 0.5506
 epoch: 7, train_loss: 0.8776, test_loss: 0.8501, test_f1: 0.5775
 epoch: 8, train_loss: 0.8719, test_loss: 0.9051, test_f1: 0.5739
 epoch: 9, train_loss: 0.8745, test_loss: 0.9105, test_f1: 0.5667
 epoch: 10, train_loss: 0.8505, test_loss: 1.0358, test_f1: 0.4819
 epoch: 11, train_loss: 0.8389, test_loss: 1.2050, test_f1: 0.4813
 epoch: 12, train_loss: 0.8462, test_loss: 0.9183, test_f1: 0.5848
 epoch: 13, train_loss: 0.8238, test_loss: 0.8406, test_f1: 0.6473
 epoch: 14, train_loss: 0.8146, test_loss: 0.8782, test_f1: 0.6205
 epoch: 15, train_loss: 0.8370, test_loss: 0.9177, test_f1: 0.5576
 epoch: 16, train_loss: 0.8281, test_loss: 0.8637, test_f1: 0.5783
 epoch: 17, train_loss: 0.8226, test_loss: 0.8303, test_f1: 0.6018
 epoch: 18, train_loss: 0.7971, test_loss: 0.9538, test_f1: 0.5829
 epoch: 19, train_loss: 0.8064, test_loss: 0.9351, test_f1: 0.6478
 epoch: 20, train_loss: 0.7780, test_loss: 0.8377, test_f1: 0.6362
 epoch: 21, train_loss: 0.7947, test_loss: 0.8293, test_f1: 0.6193
 epoch: 22, train_loss: 0.7915, test_loss: 0.8600, test_f1: 0.6298
 epoch: 23, train_loss: 0.7898, test_loss: 0.9202, test_f1: 0.6059
 epoch: 24, train_loss: 0.7822, test_loss: 1.0617, test_f1: 0.5825
 epoch: 25, train_loss: 0.7949, test_loss: 0.9244, test_f1: 0.6311
 epoch: 26, train_loss: 0.7839, test_loss: 0.8541, test_f1: 0.6048
 epoch: 27, train_loss: 0.7578, test_loss: 0.8854, test_f1: 0.6241
 epoch: 28, train_loss: 0.7512, test_loss: 0.9376, test_f1: 0.6244
 epoch: 29, train_loss: 0.7504, test_loss: 0.8826, test_f1: 0.6499
 epoch: 30, train_loss: 0.7660, test_loss: 0.8431, test_f1: 0.6149
 epoch: 31, train_loss: 0.7537, test_loss: 0.9559, test_f1: 0.6013
 epoch: 32, train_loss: 0.7556, test_loss: 1.1087, test_f1: 0.6514
 epoch: 33, train_loss: 0.7567, test_loss: 0.9331, test_f1: 0.6162
 epoch: 34, train_loss: 0.7451, test_loss: 0.9356, test_f1: 0.5672
 epoch: 35, train_loss: 0.7367, test_loss: 1.0410, test_f1: 0.6124
 epoch: 36, train_loss: 0.7159, test_loss: 0.9371, test_f1: 0.6297
 epoch: 37, train_loss: 0.7372, test_loss: 0.9943, test_f1: 0.6554
 epoch: 38, train_loss: 0.7229, test_loss: 0.9921, test_f1: 0.6030
 epoch: 39, train_loss: 0.7200, test_loss: 0.9187, test_f1: 0.6076
 epoch: 40, train_loss: 0.7212, test_loss: 1.0113, test_f1: 0.6101
 epoch: 41, train_loss: 0.6994, test_loss: 0.9609, test_f1: 0.6374
 epoch: 42, train_loss: 0.7015, test_loss: 1.0012, test_f1: 0.6336
 epoch: 43, train_loss: 0.7212, test_loss: 0.9525, test_f1: 0.6258
 epoch: 44, train_loss: 0.7082, test_loss: 0.9918, test_f1: 0.6290
 epoch: 45, train_loss: 0.7016, test_loss: 0.8283, test_f1: 0.6554
 epoch: 46, train_loss: 0.7025, test_loss: 0.8754, test_f1: 0.5933
 epoch: 47, train_loss: 0.6989, test_loss: 0.9265, test_f1: 0.6142
 epoch: 48, train_loss: 0.7022, test_loss: 0.8515, test_f1: 0.6124
 epoch: 49, train_loss: 0.6954, test_loss: 0.8420, test_f1: 0.6258
 epoch: 50, train_loss: 0.7004, test_loss: 0.9292, test_f1: 0.6224
 epoch: 51, train_loss: 0.6473, test_loss: 1.0038, test_f1: 0.6547
 epoch: 52, train_loss: 0.6431, test_loss: 0.9270, test_f1: 0.6663
 epoch: 53, train_loss: 0.6290, test_loss: 0.9589, test_f1: 0.6518
 epoch: 54, train_loss: 0.6165, test_loss: 0.8834, test_f1: 0.6569
 epoch: 55, train_loss: 0.6100, test_loss: 0.9724, test_f1: 0.6708
 epoch: 56, train_loss: 0.6192, test_loss: 0.9491, test_f1: 0.6829
 epoch: 57, train_loss: 0.6149, test_loss: 0.8518, test_f1: 0.6508
 epoch: 58, train_loss: 0.6147, test_loss: 0.9030, test_f1: 0.6318
 epoch: 59, train_loss: 0.6063, test_loss: 1.0328, test_f1: 0.6505
 epoch: 60, train_loss: 0.6145, test_loss: 0.9168, test_f1: 0.6446
 epoch: 61, train_loss: 0.5977, test_loss: 0.9583, test_f1: 0.6620
 epoch: 62, train_loss: 0.6004, test_loss: 1.0566, test_f1: 0.6420
 epoch: 63, train_loss: 0.6069, test_loss: 0.9902, test_f1: 0.6452
 epoch: 64, train_loss: 0.5979, test_loss: 0.9496, test_f1: 0.6519
 epoch: 65, train_loss: 0.5878, test_loss: 0.9719, test_f1: 0.6555
 epoch: 66, train_loss: 0.5850, test_loss: 0.9215, test_f1: 0.6388
 epoch: 67, train_loss: 0.5742, test_loss: 0.9365, test_f1: 0.6400
 epoch: 68, train_loss: 0.5964, test_loss: 0.9180, test_f1: 0.6574
 epoch: 69, train_loss: 0.5854, test_loss: 1.0503, test_f1: 0.6260
 epoch: 70, train_loss: 0.5499, test_loss: 0.9305, test_f1: 0.6467
 epoch: 71, train_loss: 0.5715, test_loss: 0.9940, test_f1: 0.6689
 epoch: 72, train_loss: 0.5819, test_loss: 0.9660, test_f1: 0.6560
 epoch: 73, train_loss: 0.5451, test_loss: 1.1419, test_f1: 0.6284
 epoch: 74, train_loss: 0.5779, test_loss: 0.9758, test_f1: 0.6475
 epoch: 75, train_loss: 0.5639, test_loss: 0.9858, test_f1: 0.6540
 epoch: 76, train_loss: 0.5560, test_loss: 1.0502, test_f1: 0.6352
 epoch: 77, train_loss: 0.5652, test_loss: 1.0416, test_f1: 0.6320
 epoch: 78, train_loss: 0.5573, test_loss: 1.0023, test_f1: 0.6379
 epoch: 79, train_loss: 0.5519, test_loss: 1.1124, test_f1: 0.6545
 epoch: 80, train_loss: 0.5418, test_loss: 1.2059, test_f1: 0.6367
 epoch: 81, train_loss: 0.5567, test_loss: 1.0469, test_f1: 0.6591
 epoch: 82, train_loss: 0.5411, test_loss: 1.0025, test_f1: 0.6820
 epoch: 83, train_loss: 0.5677, test_loss: 0.9706, test_f1: 0.6522
 epoch: 84, train_loss: 0.5413, test_loss: 0.9962, test_f1: 0.6584
 epoch: 85, train_loss: 0.5281, test_loss: 0.9470, test_f1: 0.6640
 epoch: 86, train_loss: 0.5502, test_loss: 1.0203, test_f1: 0.6610
 epoch: 87, train_loss: 0.5401, test_loss: 1.1116, test_f1: 0.6648
 epoch: 88, train_loss: 0.5455, test_loss: 0.9260, test_f1: 0.6539
 epoch: 89, train_loss: 0.5470, test_loss: 0.9796, test_f1: 0.6784
 epoch: 90, train_loss: 0.5330, test_loss: 0.9643, test_f1: 0.6523
 epoch: 91, train_loss: 0.5394, test_loss: 0.9953, test_f1: 0.6582
 epoch: 92, train_loss: 0.5297, test_loss: 1.0040, test_f1: 0.6806
 epoch: 93, train_loss: 0.5300, test_loss: 0.9666, test_f1: 0.6718
 epoch: 94, train_loss: 0.5353, test_loss: 1.0186, test_f1: 0.6442
 epoch: 95, train_loss: 0.5327, test_loss: 0.9370, test_f1: 0.6774
 epoch: 96, train_loss: 0.5144, test_loss: 0.9888, test_f1: 0.6880
 epoch: 97, train_loss: 0.5351, test_loss: 0.9283, test_f1: 0.6592
 epoch: 98, train_loss: 0.5357, test_loss: 1.0004, test_f1: 0.6533
 epoch: 99, train_loss: 0.5155, test_loss: 1.1373, test_f1: 0.6279
##################ITERATION #2 ****************************************
 epoch: 0, train_loss: 1.1115, test_loss: 1.8758, test_f1: 0.2011
 epoch: 1, train_loss: 0.9941, test_loss: 1.0793, test_f1: 0.4229
 epoch: 2, train_loss: 0.9603, test_loss: 1.0003, test_f1: 0.4790
 epoch: 3, train_loss: 0.9625, test_loss: 0.9640, test_f1: 0.5074
 epoch: 4, train_loss: 0.9396, test_loss: 0.9278, test_f1: 0.5025
 epoch: 5, train_loss: 0.9420, test_loss: 0.8920, test_f1: 0.5042
 epoch: 6, train_loss: 0.9349, test_loss: 0.8839, test_f1: 0.4999
 epoch: 7, train_loss: 0.9088, test_loss: 0.8869, test_f1: 0.5101
 epoch: 8, train_loss: 0.9003, test_loss: 0.9588, test_f1: 0.5005
 epoch: 9, train_loss: 0.8936, test_loss: 1.0815, test_f1: 0.5255
 epoch: 10, train_loss: 0.8958, test_loss: 0.9141, test_f1: 0.5295
 epoch: 11, train_loss: 0.8891, test_loss: 0.9294, test_f1: 0.4962
 epoch: 12, train_loss: 0.8668, test_loss: 0.9791, test_f1: 0.5449
 epoch: 13, train_loss: 0.8626, test_loss: 0.8804, test_f1: 0.5281
 epoch: 14, train_loss: 0.8420, test_loss: 0.8412, test_f1: 0.5449
 epoch: 15, train_loss: 0.8523, test_loss: 0.8499, test_f1: 0.5476
 epoch: 16, train_loss: 0.8288, test_loss: 0.9327, test_f1: 0.5377
 epoch: 17, train_loss: 0.8384, test_loss: 0.8981, test_f1: 0.5280
 epoch: 18, train_loss: 0.8278, test_loss: 0.8320, test_f1: 0.5760
 epoch: 19, train_loss: 0.8192, test_loss: 0.8908, test_f1: 0.5242
 epoch: 20, train_loss: 0.8130, test_loss: 0.8728, test_f1: 0.5141
 epoch: 21, train_loss: 0.8310, test_loss: 0.8758, test_f1: 0.5830
 epoch: 22, train_loss: 0.8137, test_loss: 0.8508, test_f1: 0.5317
 epoch: 23, train_loss: 0.8318, test_loss: 0.8573, test_f1: 0.5567
 epoch: 24, train_loss: 0.8289, test_loss: 0.9351, test_f1: 0.5505
 epoch: 25, train_loss: 0.7911, test_loss: 0.8207, test_f1: 0.5839
 epoch: 26, train_loss: 0.8017, test_loss: 0.8625, test_f1: 0.5618
 epoch: 27, train_loss: 0.7895, test_loss: 0.9552, test_f1: 0.5083
 epoch: 28, train_loss: 0.7974, test_loss: 0.8547, test_f1: 0.5285
 epoch: 29, train_loss: 0.7807, test_loss: 0.9125, test_f1: 0.5579
 epoch: 30, train_loss: 0.7998, test_loss: 0.9036, test_f1: 0.5630
 epoch: 31, train_loss: 0.7974, test_loss: 0.8590, test_f1: 0.6029
 epoch: 32, train_loss: 0.8159, test_loss: 0.8970, test_f1: 0.5760
 epoch: 33, train_loss: 0.8041, test_loss: 0.8698, test_f1: 0.5462
 epoch: 34, train_loss: 0.7831, test_loss: 0.8664, test_f1: 0.6161
 epoch: 35, train_loss: 0.7626, test_loss: 1.0191, test_f1: 0.6021
 epoch: 36, train_loss: 0.7642, test_loss: 0.8480, test_f1: 0.6175
 epoch: 37, train_loss: 0.7568, test_loss: 0.8549, test_f1: 0.6009
 epoch: 38, train_loss: 0.7549, test_loss: 0.8977, test_f1: 0.5610
 epoch: 39, train_loss: 0.7684, test_loss: 0.9365, test_f1: 0.5985
 epoch: 40, train_loss: 0.7621, test_loss: 0.8288, test_f1: 0.6120
 epoch: 41, train_loss: 0.7443, test_loss: 0.8651, test_f1: 0.5761
 epoch: 42, train_loss: 0.7522, test_loss: 0.8726, test_f1: 0.6343
 epoch: 43, train_loss: 0.7358, test_loss: 0.9123, test_f1: 0.5742
 epoch: 44, train_loss: 0.7497, test_loss: 0.8677, test_f1: 0.5568
 epoch: 45, train_loss: 0.7445, test_loss: 0.9165, test_f1: 0.5705
 epoch: 46, train_loss: 0.7427, test_loss: 0.8414, test_f1: 0.6393
 epoch: 47, train_loss: 0.7287, test_loss: 0.9285, test_f1: 0.6188
 epoch: 48, train_loss: 0.7218, test_loss: 1.0477, test_f1: 0.5877
 epoch: 49, train_loss: 0.7138, test_loss: 0.9168, test_f1: 0.6231
 epoch: 50, train_loss: 0.7175, test_loss: 0.8585, test_f1: 0.6270
 epoch: 51, train_loss: 0.6933, test_loss: 0.8382, test_f1: 0.6254
 epoch: 52, train_loss: 0.6696, test_loss: 0.8820, test_f1: 0.6448
 epoch: 53, train_loss: 0.6809, test_loss: 0.8874, test_f1: 0.6450
 epoch: 54, train_loss: 0.6643, test_loss: 0.9485, test_f1: 0.5896
 epoch: 55, train_loss: 0.6500, test_loss: 0.8844, test_f1: 0.6444
 epoch: 56, train_loss: 0.6623, test_loss: 0.9008, test_f1: 0.6336
 epoch: 57, train_loss: 0.6577, test_loss: 0.8910, test_f1: 0.6280
 epoch: 58, train_loss: 0.6560, test_loss: 0.9108, test_f1: 0.6437
 epoch: 59, train_loss: 0.6429, test_loss: 0.9338, test_f1: 0.6657
 epoch: 60, train_loss: 0.6458, test_loss: 0.9815, test_f1: 0.6558
 epoch: 61, train_loss: 0.6376, test_loss: 0.9527, test_f1: 0.6552
 epoch: 62, train_loss: 0.6405, test_loss: 0.9836, test_f1: 0.6372
 epoch: 63, train_loss: 0.6223, test_loss: 1.0051, test_f1: 0.6355
 epoch: 64, train_loss: 0.6220, test_loss: 1.0047, test_f1: 0.6506
 epoch: 65, train_loss: 0.6307, test_loss: 0.9909, test_f1: 0.6534
 epoch: 66, train_loss: 0.6241, test_loss: 1.1226, test_f1: 0.6425
 epoch: 67, train_loss: 0.6255, test_loss: 1.0079, test_f1: 0.6533
 epoch: 68, train_loss: 0.6187, test_loss: 0.9797, test_f1: 0.6716
 epoch: 69, train_loss: 0.6293, test_loss: 1.0343, test_f1: 0.6595
 epoch: 70, train_loss: 0.6118, test_loss: 1.0376, test_f1: 0.6335
 epoch: 71, train_loss: 0.6008, test_loss: 1.0927, test_f1: 0.6674
 epoch: 72, train_loss: 0.6032, test_loss: 1.0903, test_f1: 0.6527
 epoch: 73, train_loss: 0.5963, test_loss: 1.0121, test_f1: 0.6626
 epoch: 74, train_loss: 0.6166, test_loss: 0.9765, test_f1: 0.6611
 epoch: 75, train_loss: 0.6344, test_loss: 1.0132, test_f1: 0.6524
 epoch: 76, train_loss: 0.5875, test_loss: 0.9985, test_f1: 0.6512
 epoch: 77, train_loss: 0.5922, test_loss: 1.0223, test_f1: 0.6387
 epoch: 78, train_loss: 0.5958, test_loss: 1.1876, test_f1: 0.6512
 epoch: 79, train_loss: 0.5940, test_loss: 1.0339, test_f1: 0.6526
 epoch: 80, train_loss: 0.5942, test_loss: 1.0656, test_f1: 0.6596
 epoch: 81, train_loss: 0.5960, test_loss: 0.9727, test_f1: 0.6431
 epoch: 82, train_loss: 0.5860, test_loss: 1.0483, test_f1: 0.6739
 epoch: 83, train_loss: 0.5762, test_loss: 0.9536, test_f1: 0.6665
 epoch: 84, train_loss: 0.5922, test_loss: 1.0113, test_f1: 0.6569
 epoch: 85, train_loss: 0.5812, test_loss: 0.9000, test_f1: 0.6840
 epoch: 86, train_loss: 0.5833, test_loss: 0.9928, test_f1: 0.6589
 epoch: 87, train_loss: 0.5798, test_loss: 0.9861, test_f1: 0.6368
 epoch: 88, train_loss: 0.5747, test_loss: 1.0529, test_f1: 0.6289
 epoch: 89, train_loss: 0.5807, test_loss: 0.9627, test_f1: 0.6577
 epoch: 90, train_loss: 0.5679, test_loss: 1.0404, test_f1: 0.6540
 epoch: 91, train_loss: 0.5620, test_loss: 1.1258, test_f1: 0.6596
 epoch: 92, train_loss: 0.5834, test_loss: 0.9653, test_f1: 0.6719
 epoch: 93, train_loss: 0.5783, test_loss: 1.0179, test_f1: 0.6455
 epoch: 94, train_loss: 0.5591, test_loss: 0.9773, test_f1: 0.6537
 epoch: 95, train_loss: 0.5720, test_loss: 1.0168, test_f1: 0.6709
 epoch: 96, train_loss: 0.5734, test_loss: 1.0111, test_f1: 0.6874
 epoch: 97, train_loss: 0.5648, test_loss: 0.9716, test_f1: 0.6693
 epoch: 98, train_loss: 0.5490, test_loss: 1.0389, test_f1: 0.6691
 epoch: 99, train_loss: 0.5608, test_loss: 1.0574, test_f1: 0.6612
##################ITERATION #3 ****************************************
 epoch: 0, train_loss: 1.1123, test_loss: 1.0538, test_f1: 0.4289
 epoch: 1, train_loss: 0.9976, test_loss: 1.0895, test_f1: 0.4813
 epoch: 2, train_loss: 0.9772, test_loss: 0.9996, test_f1: 0.5024
 epoch: 3, train_loss: 0.9446, test_loss: 0.9643, test_f1: 0.4797
 epoch: 4, train_loss: 0.9303, test_loss: 0.9762, test_f1: 0.4743
 epoch: 5, train_loss: 0.9305, test_loss: 0.9911, test_f1: 0.4932
 epoch: 6, train_loss: 0.8909, test_loss: 1.0029, test_f1: 0.4999
 epoch: 7, train_loss: 0.8939, test_loss: 0.9378, test_f1: 0.4752
 epoch: 8, train_loss: 0.9041, test_loss: 0.8964, test_f1: 0.5691
 epoch: 9, train_loss: 0.8810, test_loss: 0.9485, test_f1: 0.5329
 epoch: 10, train_loss: 0.8691, test_loss: 1.0006, test_f1: 0.5322
 epoch: 11, train_loss: 0.8475, test_loss: 0.9028, test_f1: 0.5242
 epoch: 12, train_loss: 0.8183, test_loss: 0.9128, test_f1: 0.5183
 epoch: 13, train_loss: 0.8355, test_loss: 0.9831, test_f1: 0.4963
 epoch: 14, train_loss: 0.8578, test_loss: 0.9649, test_f1: 0.5235
 epoch: 15, train_loss: 0.8386, test_loss: 0.8804, test_f1: 0.5553
 epoch: 16, train_loss: 0.8246, test_loss: 0.9028, test_f1: 0.5503
 epoch: 17, train_loss: 0.8114, test_loss: 0.9317, test_f1: 0.5951
 epoch: 18, train_loss: 0.8170, test_loss: 1.0273, test_f1: 0.5963
 epoch: 19, train_loss: 0.7921, test_loss: 0.8705, test_f1: 0.5765
 epoch: 20, train_loss: 0.7979, test_loss: 1.0029, test_f1: 0.5930
 epoch: 21, train_loss: 0.8035, test_loss: 0.9424, test_f1: 0.5751
 epoch: 22, train_loss: 0.7916, test_loss: 1.1477, test_f1: 0.5420
 epoch: 23, train_loss: 0.7814, test_loss: 0.9105, test_f1: 0.5464
 epoch: 24, train_loss: 0.7627, test_loss: 0.9537, test_f1: 0.5882
 epoch: 25, train_loss: 0.7869, test_loss: 1.0457, test_f1: 0.4935
 epoch: 26, train_loss: 0.7719, test_loss: 0.9291, test_f1: 0.5981
 epoch: 27, train_loss: 0.7893, test_loss: 0.9011, test_f1: 0.5568
 epoch: 28, train_loss: 0.7628, test_loss: 0.9386, test_f1: 0.5732
 epoch: 29, train_loss: 0.7682, test_loss: 0.9501, test_f1: 0.5643
 epoch: 30, train_loss: 0.7695, test_loss: 0.9362, test_f1: 0.6039
 epoch: 31, train_loss: 0.7407, test_loss: 0.9569, test_f1: 0.6031
 epoch: 32, train_loss: 0.7672, test_loss: 0.9594, test_f1: 0.5719
 epoch: 33, train_loss: 0.7501, test_loss: 0.9912, test_f1: 0.6157
 epoch: 34, train_loss: 0.7345, test_loss: 1.0281, test_f1: 0.6479
 epoch: 35, train_loss: 0.7490, test_loss: 0.9929, test_f1: 0.5881
 epoch: 36, train_loss: 0.7315, test_loss: 0.8772, test_f1: 0.6638
 epoch: 37, train_loss: 0.7186, test_loss: 0.9756, test_f1: 0.5892
 epoch: 38, train_loss: 0.7353, test_loss: 0.9859, test_f1: 0.6393
 epoch: 39, train_loss: 0.7247, test_loss: 0.8474, test_f1: 0.6194
 epoch: 40, train_loss: 0.7094, test_loss: 0.9628, test_f1: 0.6571
 epoch: 41, train_loss: 0.7092, test_loss: 0.9145, test_f1: 0.5814
 epoch: 42, train_loss: 0.7104, test_loss: 1.0256, test_f1: 0.6257
 epoch: 43, train_loss: 0.7084, test_loss: 0.9900, test_f1: 0.5878
 epoch: 44, train_loss: 0.7020, test_loss: 1.1337, test_f1: 0.6135
 epoch: 45, train_loss: 0.7031, test_loss: 0.9877, test_f1: 0.6552
 epoch: 46, train_loss: 0.6783, test_loss: 0.9980, test_f1: 0.6347
 epoch: 47, train_loss: 0.6720, test_loss: 1.1610, test_f1: 0.6321
 epoch: 48, train_loss: 0.6976, test_loss: 1.0053, test_f1: 0.6604
 epoch: 49, train_loss: 0.6719, test_loss: 1.3198, test_f1: 0.6060
 epoch: 50, train_loss: 0.6984, test_loss: 1.0468, test_f1: 0.6520
 epoch: 51, train_loss: 0.6384, test_loss: 1.0121, test_f1: 0.6865
 epoch: 52, train_loss: 0.6297, test_loss: 1.0088, test_f1: 0.6642
 epoch: 53, train_loss: 0.6224, test_loss: 1.0863, test_f1: 0.6680
 epoch: 54, train_loss: 0.6201, test_loss: 0.9994, test_f1: 0.6632
 epoch: 55, train_loss: 0.6000, test_loss: 1.1183, test_f1: 0.6556
 epoch: 56, train_loss: 0.6054, test_loss: 1.1212, test_f1: 0.6568
 epoch: 57, train_loss: 0.6223, test_loss: 1.1830, test_f1: 0.6561
 epoch: 58, train_loss: 0.5929, test_loss: 1.1166, test_f1: 0.6571
 epoch: 59, train_loss: 0.6060, test_loss: 1.1329, test_f1: 0.6812
 epoch: 60, train_loss: 0.6013, test_loss: 1.1037, test_f1: 0.6406
 epoch: 61, train_loss: 0.5939, test_loss: 1.2488, test_f1: 0.6614
 epoch: 62, train_loss: 0.5824, test_loss: 1.0937, test_f1: 0.6704
 epoch: 63, train_loss: 0.5894, test_loss: 1.1921, test_f1: 0.6567
 epoch: 64, train_loss: 0.5857, test_loss: 1.1246, test_f1: 0.6611
 epoch: 65, train_loss: 0.5698, test_loss: 1.2319, test_f1: 0.6791
 epoch: 66, train_loss: 0.5710, test_loss: 1.2326, test_f1: 0.6702
 epoch: 67, train_loss: 0.5852, test_loss: 1.1373, test_f1: 0.6994
 epoch: 68, train_loss: 0.5806, test_loss: 1.2481, test_f1: 0.6711
 epoch: 69, train_loss: 0.5762, test_loss: 1.1320, test_f1: 0.6756
 epoch: 70, train_loss: 0.5920, test_loss: 1.1973, test_f1: 0.6543
 epoch: 71, train_loss: 0.5662, test_loss: 1.1262, test_f1: 0.6471
 epoch: 72, train_loss: 0.5631, test_loss: 1.2432, test_f1: 0.6666
 epoch: 73, train_loss: 0.5701, test_loss: 1.0169, test_f1: 0.6776
 epoch: 74, train_loss: 0.5577, test_loss: 0.9731, test_f1: 0.6740
 epoch: 75, train_loss: 0.5529, test_loss: 1.1926, test_f1: 0.6811
 epoch: 76, train_loss: 0.5635, test_loss: 1.1242, test_f1: 0.6499
 epoch: 77, train_loss: 0.5412, test_loss: 1.1012, test_f1: 0.6871
 epoch: 78, train_loss: 0.5432, test_loss: 1.1065, test_f1: 0.6739
 epoch: 79, train_loss: 0.5535, test_loss: 1.2242, test_f1: 0.6617
 epoch: 80, train_loss: 0.5329, test_loss: 1.1225, test_f1: 0.6701
 epoch: 81, train_loss: 0.5523, test_loss: 1.0601, test_f1: 0.6740
 epoch: 82, train_loss: 0.5321, test_loss: 1.2282, test_f1: 0.6768
 epoch: 83, train_loss: 0.5520, test_loss: 1.0772, test_f1: 0.6632
 epoch: 84, train_loss: 0.5291, test_loss: 1.1629, test_f1: 0.6724
 epoch: 85, train_loss: 0.5448, test_loss: 1.1771, test_f1: 0.6633
 epoch: 86, train_loss: 0.5466, test_loss: 1.0030, test_f1: 0.6674
 epoch: 87, train_loss: 0.5409, test_loss: 1.1644, test_f1: 0.6713
 epoch: 88, train_loss: 0.5289, test_loss: 1.0844, test_f1: 0.6755
 epoch: 89, train_loss: 0.5200, test_loss: 1.0723, test_f1: 0.6687
 epoch: 90, train_loss: 0.5077, test_loss: 1.3084, test_f1: 0.6742
 epoch: 91, train_loss: 0.5218, test_loss: 1.1477, test_f1: 0.6601
 epoch: 92, train_loss: 0.5192, test_loss: 1.0784, test_f1: 0.6665
 epoch: 93, train_loss: 0.5114, test_loss: 1.1731, test_f1: 0.6628
 epoch: 94, train_loss: 0.5370, test_loss: 1.2255, test_f1: 0.6772
 epoch: 95, train_loss: 0.4968, test_loss: 1.2327, test_f1: 0.6528
 epoch: 96, train_loss: 0.5137, test_loss: 1.0947, test_f1: 0.6688
 epoch: 97, train_loss: 0.5130, test_loss: 1.0495, test_f1: 0.6674
 epoch: 98, train_loss: 0.5088, test_loss: 1.2352, test_f1: 0.6591
 epoch: 99, train_loss: 0.4955, test_loss: 1.2996, test_f1: 0.6652
##################ITERATION #4 ****************************************
 epoch: 0, train_loss: 1.0987, test_loss: 1.0558, test_f1: 0.4541
 epoch: 1, train_loss: 1.0100, test_loss: 1.0488, test_f1: 0.4495
 epoch: 2, train_loss: 0.9681, test_loss: 0.9299, test_f1: 0.4792
 epoch: 3, train_loss: 0.9425, test_loss: 0.9783, test_f1: 0.5024
 epoch: 4, train_loss: 0.9451, test_loss: 0.9263, test_f1: 0.5030
 epoch: 5, train_loss: 0.9340, test_loss: 1.0175, test_f1: 0.4768
 epoch: 6, train_loss: 0.9048, test_loss: 0.9831, test_f1: 0.5068
 epoch: 7, train_loss: 0.9167, test_loss: 0.9392, test_f1: 0.5317
 epoch: 8, train_loss: 0.8953, test_loss: 0.9431, test_f1: 0.4811
 epoch: 9, train_loss: 0.9012, test_loss: 0.8957, test_f1: 0.5331
 epoch: 10, train_loss: 0.8716, test_loss: 0.8879, test_f1: 0.5620
 epoch: 11, train_loss: 0.8595, test_loss: 0.9145, test_f1: 0.5409
 epoch: 12, train_loss: 0.8590, test_loss: 0.8304, test_f1: 0.5387
 epoch: 13, train_loss: 0.8620, test_loss: 0.8827, test_f1: 0.5334
 epoch: 14, train_loss: 0.8469, test_loss: 0.8765, test_f1: 0.5432
 epoch: 15, train_loss: 0.8515, test_loss: 0.8280, test_f1: 0.5568
 epoch: 16, train_loss: 0.8393, test_loss: 0.8714, test_f1: 0.5393
 epoch: 17, train_loss: 0.8306, test_loss: 0.9123, test_f1: 0.5752
 epoch: 18, train_loss: 0.8200, test_loss: 0.9013, test_f1: 0.5476
 epoch: 19, train_loss: 0.8093, test_loss: 0.8921, test_f1: 0.6117
 epoch: 20, train_loss: 0.8236, test_loss: 0.8161, test_f1: 0.5776
 epoch: 21, train_loss: 0.7979, test_loss: 0.9252, test_f1: 0.5448
 epoch: 22, train_loss: 0.8095, test_loss: 0.8633, test_f1: 0.5445
 epoch: 23, train_loss: 0.8163, test_loss: 0.9063, test_f1: 0.5538
 epoch: 24, train_loss: 0.8084, test_loss: 0.9540, test_f1: 0.5700
 epoch: 25, train_loss: 0.7784, test_loss: 0.9129, test_f1: 0.5906
 epoch: 26, train_loss: 0.7906, test_loss: 0.8913, test_f1: 0.6111
 epoch: 27, train_loss: 0.8065, test_loss: 0.9484, test_f1: 0.5863
 epoch: 28, train_loss: 0.7816, test_loss: 0.9436, test_f1: 0.5783
 epoch: 29, train_loss: 0.7827, test_loss: 0.9196, test_f1: 0.5630
 epoch: 30, train_loss: 0.7842, test_loss: 0.8591, test_f1: 0.6145
 epoch: 31, train_loss: 0.7644, test_loss: 0.9389, test_f1: 0.5883
 epoch: 32, train_loss: 0.7618, test_loss: 0.9121, test_f1: 0.6135
 epoch: 33, train_loss: 0.7790, test_loss: 1.0087, test_f1: 0.5745
 epoch: 34, train_loss: 0.7715, test_loss: 0.9479, test_f1: 0.5640
 epoch: 35, train_loss: 0.7540, test_loss: 0.9744, test_f1: 0.5995
 epoch: 36, train_loss: 0.7567, test_loss: 0.9585, test_f1: 0.6150
 epoch: 37, train_loss: 0.7418, test_loss: 0.9528, test_f1: 0.6311
 epoch: 38, train_loss: 0.7479, test_loss: 0.9750, test_f1: 0.6116
 epoch: 39, train_loss: 0.7729, test_loss: 0.8912, test_f1: 0.5829
 epoch: 40, train_loss: 0.7438, test_loss: 0.8960, test_f1: 0.6105
 epoch: 41, train_loss: 0.7341, test_loss: 0.9072, test_f1: 0.6227
 epoch: 42, train_loss: 0.7544, test_loss: 0.9096, test_f1: 0.6100
 epoch: 43, train_loss: 0.7397, test_loss: 0.9534, test_f1: 0.6212
 epoch: 44, train_loss: 0.7332, test_loss: 0.9048, test_f1: 0.5994
 epoch: 45, train_loss: 0.7243, test_loss: 1.0207, test_f1: 0.6094
 epoch: 46, train_loss: 0.7358, test_loss: 1.1278, test_f1: 0.5965
 epoch: 47, train_loss: 0.7430, test_loss: 1.0227, test_f1: 0.6211
 epoch: 48, train_loss: 0.7333, test_loss: 1.0177, test_f1: 0.6102
 epoch: 49, train_loss: 0.7458, test_loss: 1.0599, test_f1: 0.6521
 epoch: 50, train_loss: 0.7214, test_loss: 1.1099, test_f1: 0.6274
 epoch: 51, train_loss: 0.6978, test_loss: 1.1380, test_f1: 0.6328
 epoch: 52, train_loss: 0.6897, test_loss: 1.0639, test_f1: 0.6569
 epoch: 53, train_loss: 0.6798, test_loss: 1.0441, test_f1: 0.6478
 epoch: 54, train_loss: 0.6743, test_loss: 1.0854, test_f1: 0.6138
 epoch: 55, train_loss: 0.6573, test_loss: 1.0519, test_f1: 0.6480
 epoch: 56, train_loss: 0.6701, test_loss: 1.0885, test_f1: 0.6431
 epoch: 57, train_loss: 0.6651, test_loss: 1.0992, test_f1: 0.6414
 epoch: 58, train_loss: 0.6620, test_loss: 1.1551, test_f1: 0.6655
 epoch: 59, train_loss: 0.6554, test_loss: 1.1646, test_f1: 0.6386
 epoch: 60, train_loss: 0.6428, test_loss: 1.2432, test_f1: 0.6297
 epoch: 61, train_loss: 0.6349, test_loss: 1.1103, test_f1: 0.6485
 epoch: 62, train_loss: 0.6669, test_loss: 1.1898, test_f1: 0.6571
 epoch: 63, train_loss: 0.6501, test_loss: 1.1882, test_f1: 0.6559
 epoch: 64, train_loss: 0.6349, test_loss: 1.2432, test_f1: 0.6551
 epoch: 65, train_loss: 0.6438, test_loss: 1.2748, test_f1: 0.6474
 epoch: 66, train_loss: 0.6398, test_loss: 1.2909, test_f1: 0.6519
 epoch: 67, train_loss: 0.6402, test_loss: 1.2420, test_f1: 0.6388
 epoch: 68, train_loss: 0.6305, test_loss: 1.2482, test_f1: 0.6366
 epoch: 69, train_loss: 0.6298, test_loss: 1.1816, test_f1: 0.6395
 epoch: 70, train_loss: 0.6213, test_loss: 1.1568, test_f1: 0.6337
 epoch: 71, train_loss: 0.6308, test_loss: 1.1419, test_f1: 0.6439
 epoch: 72, train_loss: 0.6187, test_loss: 1.2169, test_f1: 0.6186
 epoch: 73, train_loss: 0.6345, test_loss: 1.1299, test_f1: 0.6215
 epoch: 74, train_loss: 0.6322, test_loss: 1.1357, test_f1: 0.6225
 epoch: 75, train_loss: 0.6138, test_loss: 1.1456, test_f1: 0.6361
 epoch: 76, train_loss: 0.6032, test_loss: 1.2223, test_f1: 0.6057
 epoch: 77, train_loss: 0.6279, test_loss: 1.1740, test_f1: 0.6528
 epoch: 78, train_loss: 0.6186, test_loss: 1.2776, test_f1: 0.6426
 epoch: 79, train_loss: 0.6179, test_loss: 1.1888, test_f1: 0.6549
 epoch: 80, train_loss: 0.6151, test_loss: 1.1353, test_f1: 0.6729
 epoch: 81, train_loss: 0.6075, test_loss: 1.1334, test_f1: 0.6414
 epoch: 82, train_loss: 0.6067, test_loss: 1.0556, test_f1: 0.6596
 epoch: 83, train_loss: 0.6109, test_loss: 1.0910, test_f1: 0.6419
 epoch: 84, train_loss: 0.5973, test_loss: 1.2411, test_f1: 0.6032
 epoch: 85, train_loss: 0.6384, test_loss: 1.1883, test_f1: 0.6509
 epoch: 86, train_loss: 0.6283, test_loss: 1.2429, test_f1: 0.6263
 epoch: 87, train_loss: 0.5942, test_loss: 1.1644, test_f1: 0.6615
 epoch: 88, train_loss: 0.5978, test_loss: 1.2314, test_f1: 0.6540
 epoch: 89, train_loss: 0.6139, test_loss: 1.3678, test_f1: 0.6255
 epoch: 90, train_loss: 0.6075, test_loss: 1.2314, test_f1: 0.6668
 epoch: 91, train_loss: 0.5946, test_loss: 1.1954, test_f1: 0.6611
 epoch: 92, train_loss: 0.5887, test_loss: 1.2552, test_f1: 0.6355
 epoch: 93, train_loss: 0.5827, test_loss: 1.2679, test_f1: 0.6297
 epoch: 94, train_loss: 0.5687, test_loss: 1.2429, test_f1: 0.6731
 epoch: 95, train_loss: 0.5872, test_loss: 1.3006, test_f1: 0.6361
 epoch: 96, train_loss: 0.5896, test_loss: 1.1946, test_f1: 0.6455
 epoch: 97, train_loss: 0.6062, test_loss: 1.1760, test_f1: 0.6394
 epoch: 98, train_loss: 0.5787, test_loss: 1.2863, test_f1: 0.6597
 epoch: 99, train_loss: 0.5894, test_loss: 1.2340, test_f1: 0.6503
##################ITERATION #5 ****************************************
 epoch: 0, train_loss: 1.0856, test_loss: 1.1059, test_f1: 0.4996
 epoch: 1, train_loss: 0.9832, test_loss: 0.9662, test_f1: 0.5119
 epoch: 2, train_loss: 0.9526, test_loss: 0.9645, test_f1: 0.5451
 epoch: 3, train_loss: 0.9240, test_loss: 0.9015, test_f1: 0.5652
 epoch: 4, train_loss: 0.9237, test_loss: 0.9852, test_f1: 0.5541
 epoch: 5, train_loss: 0.9009, test_loss: 0.9325, test_f1: 0.5529
 epoch: 6, train_loss: 0.8924, test_loss: 0.9499, test_f1: 0.4867
 epoch: 7, train_loss: 0.8869, test_loss: 0.9132, test_f1: 0.5655
 epoch: 8, train_loss: 0.8685, test_loss: 0.9751, test_f1: 0.4957
 epoch: 9, train_loss: 0.8692, test_loss: 0.8561, test_f1: 0.5929
 epoch: 10, train_loss: 0.8612, test_loss: 1.0863, test_f1: 0.5014
 epoch: 11, train_loss: 0.8542, test_loss: 0.8503, test_f1: 0.5956
 epoch: 12, train_loss: 0.8339, test_loss: 0.9409, test_f1: 0.5928
 epoch: 13, train_loss: 0.8641, test_loss: 0.9043, test_f1: 0.5370
 epoch: 14, train_loss: 0.8579, test_loss: 0.8480, test_f1: 0.5943
 epoch: 15, train_loss: 0.8697, test_loss: 0.8054, test_f1: 0.5765
 epoch: 16, train_loss: 0.8315, test_loss: 0.8161, test_f1: 0.5680
 epoch: 17, train_loss: 0.8104, test_loss: 0.7756, test_f1: 0.6132
 epoch: 18, train_loss: 0.8107, test_loss: 0.8921, test_f1: 0.5507
 epoch: 19, train_loss: 0.8064, test_loss: 0.7849, test_f1: 0.5581
 epoch: 20, train_loss: 0.8153, test_loss: 0.8960, test_f1: 0.5351
 epoch: 21, train_loss: 0.8282, test_loss: 0.8047, test_f1: 0.5898
 epoch: 22, train_loss: 0.7926, test_loss: 0.7974, test_f1: 0.5945
 epoch: 23, train_loss: 0.7922, test_loss: 0.7614, test_f1: 0.6010
 epoch: 24, train_loss: 0.7869, test_loss: 0.7909, test_f1: 0.5969
 epoch: 25, train_loss: 0.7750, test_loss: 0.8052, test_f1: 0.5870
 epoch: 26, train_loss: 0.7857, test_loss: 0.8139, test_f1: 0.5560
 epoch: 27, train_loss: 0.7680, test_loss: 0.8406, test_f1: 0.5603
 epoch: 28, train_loss: 0.8001, test_loss: 0.8172, test_f1: 0.6132
 epoch: 29, train_loss: 0.7809, test_loss: 0.8063, test_f1: 0.6053
 epoch: 30, train_loss: 0.7674, test_loss: 0.8507, test_f1: 0.6216
 epoch: 31, train_loss: 0.7472, test_loss: 0.8183, test_f1: 0.6052
 epoch: 32, train_loss: 0.7436, test_loss: 0.8032, test_f1: 0.6287
 epoch: 33, train_loss: 0.7551, test_loss: 0.8057, test_f1: 0.6017
 epoch: 34, train_loss: 0.7431, test_loss: 0.8302, test_f1: 0.6191
 epoch: 35, train_loss: 0.7444, test_loss: 0.7977, test_f1: 0.6077
 epoch: 36, train_loss: 0.7124, test_loss: 0.8418, test_f1: 0.6030
 epoch: 37, train_loss: 0.7303, test_loss: 0.7842, test_f1: 0.5946
 epoch: 38, train_loss: 0.7568, test_loss: 0.7810, test_f1: 0.6313
 epoch: 39, train_loss: 0.7247, test_loss: 0.8652, test_f1: 0.5695
 epoch: 40, train_loss: 0.7197, test_loss: 0.8418, test_f1: 0.5903
 epoch: 41, train_loss: 0.7153, test_loss: 0.7877, test_f1: 0.5513
 epoch: 42, train_loss: 0.7522, test_loss: 0.8307, test_f1: 0.6391
 epoch: 43, train_loss: 0.6994, test_loss: 0.7783, test_f1: 0.5920
 epoch: 44, train_loss: 0.6885, test_loss: 0.9013, test_f1: 0.5565
 epoch: 45, train_loss: 0.6957, test_loss: 0.8554, test_f1: 0.5787
 epoch: 46, train_loss: 0.6827, test_loss: 0.7804, test_f1: 0.6252
 epoch: 47, train_loss: 0.6878, test_loss: 0.8115, test_f1: 0.6187
 epoch: 48, train_loss: 0.6627, test_loss: 0.9474, test_f1: 0.5926
 epoch: 49, train_loss: 0.6761, test_loss: 1.0066, test_f1: 0.5454
 epoch: 50, train_loss: 0.6893, test_loss: 0.8271, test_f1: 0.6301
 epoch: 51, train_loss: 0.6462, test_loss: 0.7818, test_f1: 0.6390
 epoch: 52, train_loss: 0.6431, test_loss: 0.7919, test_f1: 0.6514
 epoch: 53, train_loss: 0.6160, test_loss: 0.8220, test_f1: 0.6439
 epoch: 54, train_loss: 0.6187, test_loss: 0.8338, test_f1: 0.6349
 epoch: 55, train_loss: 0.6312, test_loss: 0.7875, test_f1: 0.6645
 epoch: 56, train_loss: 0.6393, test_loss: 0.9122, test_f1: 0.6328
 epoch: 57, train_loss: 0.5966, test_loss: 0.7687, test_f1: 0.6626
 epoch: 58, train_loss: 0.5945, test_loss: 0.8282, test_f1: 0.6363
 epoch: 59, train_loss: 0.6124, test_loss: 0.7924, test_f1: 0.6501
 epoch: 60, train_loss: 0.6134, test_loss: 0.8243, test_f1: 0.6386
 epoch: 61, train_loss: 0.5996, test_loss: 0.8602, test_f1: 0.6281
 epoch: 62, train_loss: 0.6093, test_loss: 0.8338, test_f1: 0.6393
 epoch: 63, train_loss: 0.5886, test_loss: 0.8284, test_f1: 0.6398
 epoch: 64, train_loss: 0.6049, test_loss: 0.8673, test_f1: 0.6402
 epoch: 65, train_loss: 0.6151, test_loss: 0.9222, test_f1: 0.6317
 epoch: 66, train_loss: 0.5737, test_loss: 0.8903, test_f1: 0.6438
 epoch: 67, train_loss: 0.5693, test_loss: 0.8254, test_f1: 0.6338
 epoch: 68, train_loss: 0.6056, test_loss: 0.7693, test_f1: 0.6570
 epoch: 69, train_loss: 0.5618, test_loss: 0.8528, test_f1: 0.6564
 epoch: 70, train_loss: 0.5717, test_loss: 0.7954, test_f1: 0.6466
 epoch: 71, train_loss: 0.5795, test_loss: 0.8908, test_f1: 0.6434
 epoch: 72, train_loss: 0.5742, test_loss: 0.8657, test_f1: 0.6537
 epoch: 73, train_loss: 0.5587, test_loss: 0.9049, test_f1: 0.6566
 epoch: 74, train_loss: 0.5620, test_loss: 0.9791, test_f1: 0.6524
 epoch: 75, train_loss: 0.5705, test_loss: 0.8853, test_f1: 0.6515
 epoch: 76, train_loss: 0.5666, test_loss: 0.8856, test_f1: 0.6464
 epoch: 77, train_loss: 0.5663, test_loss: 0.8163, test_f1: 0.6506
 epoch: 78, train_loss: 0.5537, test_loss: 0.8518, test_f1: 0.6474
 epoch: 79, train_loss: 0.5688, test_loss: 0.8065, test_f1: 0.6684
 epoch: 80, train_loss: 0.5716, test_loss: 0.7649, test_f1: 0.6677
 epoch: 81, train_loss: 0.5513, test_loss: 0.8250, test_f1: 0.6769
 epoch: 82, train_loss: 0.5682, test_loss: 0.8223, test_f1: 0.6680
 epoch: 83, train_loss: 0.5385, test_loss: 0.7934, test_f1: 0.6554
 epoch: 84, train_loss: 0.5480, test_loss: 0.8497, test_f1: 0.6587
 epoch: 85, train_loss: 0.5520, test_loss: 0.9113, test_f1: 0.6598
 epoch: 86, train_loss: 0.5486, test_loss: 0.9274, test_f1: 0.6546
 epoch: 87, train_loss: 0.5537, test_loss: 0.8172, test_f1: 0.6801
 epoch: 88, train_loss: 0.5465, test_loss: 0.8853, test_f1: 0.6590
 epoch: 89, train_loss: 0.5142, test_loss: 0.8371, test_f1: 0.6401
 epoch: 90, train_loss: 0.5281, test_loss: 0.9278, test_f1: 0.6531
 epoch: 91, train_loss: 0.5469, test_loss: 0.8960, test_f1: 0.6632
 epoch: 92, train_loss: 0.5363, test_loss: 0.8111, test_f1: 0.6456
 epoch: 93, train_loss: 0.5208, test_loss: 1.0058, test_f1: 0.6497
 epoch: 94, train_loss: 0.5325, test_loss: 0.8601, test_f1: 0.6652
 epoch: 95, train_loss: 0.5445, test_loss: 0.8543, test_f1: 0.6611
 epoch: 96, train_loss: 0.5399, test_loss: 0.8521, test_f1: 0.6341
 epoch: 97, train_loss: 0.5364, test_loss: 0.8949, test_f1: 0.6524
 epoch: 98, train_loss: 0.5138, test_loss: 0.9753, test_f1: 0.6462
 epoch: 99, train_loss: 0.5253, test_loss: 0.9796, test_f1: 0.6595
##################ITERATION #6 ****************************************
 epoch: 0, train_loss: 1.0822, test_loss: 1.0366, test_f1: 0.5038
 epoch: 1, train_loss: 0.9713, test_loss: 1.0086, test_f1: 0.5010
 epoch: 2, train_loss: 0.9397, test_loss: 0.9203, test_f1: 0.5200
 epoch: 3, train_loss: 0.9246, test_loss: 0.8830, test_f1: 0.5637
 epoch: 4, train_loss: 0.9090, test_loss: 1.0272, test_f1: 0.4798
 epoch: 5, train_loss: 0.9028, test_loss: 0.9338, test_f1: 0.5215
 epoch: 6, train_loss: 0.8909, test_loss: 0.8963, test_f1: 0.5308
 epoch: 7, train_loss: 0.8642, test_loss: 0.8142, test_f1: 0.5668
 epoch: 8, train_loss: 0.8448, test_loss: 0.8712, test_f1: 0.5907
 epoch: 9, train_loss: 0.8484, test_loss: 0.8620, test_f1: 0.5450
 epoch: 10, train_loss: 0.8600, test_loss: 0.8770, test_f1: 0.5423
 epoch: 11, train_loss: 0.8408, test_loss: 0.8191, test_f1: 0.6249
 epoch: 12, train_loss: 0.8306, test_loss: 0.8369, test_f1: 0.6060
 epoch: 13, train_loss: 0.8262, test_loss: 0.7725, test_f1: 0.6069
 epoch: 14, train_loss: 0.8348, test_loss: 0.8519, test_f1: 0.5588
 epoch: 15, train_loss: 0.8267, test_loss: 0.7897, test_f1: 0.6386
 epoch: 16, train_loss: 0.8032, test_loss: 0.8215, test_f1: 0.6073
 epoch: 17, train_loss: 0.7869, test_loss: 0.8813, test_f1: 0.5757
 epoch: 18, train_loss: 0.7859, test_loss: 0.8975, test_f1: 0.6133
 epoch: 19, train_loss: 0.7913, test_loss: 0.8346, test_f1: 0.6446
 epoch: 20, train_loss: 0.7796, test_loss: 0.8224, test_f1: 0.5861
 epoch: 21, train_loss: 0.7823, test_loss: 0.8135, test_f1: 0.6225
 epoch: 22, train_loss: 0.7680, test_loss: 1.0117, test_f1: 0.5866
 epoch: 23, train_loss: 0.7722, test_loss: 0.9082, test_f1: 0.6118
 epoch: 24, train_loss: 0.7522, test_loss: 0.8769, test_f1: 0.6332
 epoch: 25, train_loss: 0.7624, test_loss: 0.8983, test_f1: 0.6079
 epoch: 26, train_loss: 0.7522, test_loss: 0.8985, test_f1: 0.6464
 epoch: 27, train_loss: 0.7513, test_loss: 1.0067, test_f1: 0.5835
 epoch: 28, train_loss: 0.7453, test_loss: 0.8786, test_f1: 0.6257
 epoch: 29, train_loss: 0.7410, test_loss: 0.8589, test_f1: 0.6510
 epoch: 30, train_loss: 0.7444, test_loss: 0.8466, test_f1: 0.6268
 epoch: 31, train_loss: 0.7319, test_loss: 0.7496, test_f1: 0.6328
 epoch: 32, train_loss: 0.7261, test_loss: 0.8835, test_f1: 0.6466
 epoch: 33, train_loss: 0.7010, test_loss: 0.8168, test_f1: 0.6838
 epoch: 34, train_loss: 0.7032, test_loss: 0.8774, test_f1: 0.6177
 epoch: 35, train_loss: 0.7044, test_loss: 0.7386, test_f1: 0.6394
 epoch: 36, train_loss: 0.6999, test_loss: 0.7944, test_f1: 0.6754
 epoch: 37, train_loss: 0.7002, test_loss: 0.7575, test_f1: 0.6575
 epoch: 38, train_loss: 0.6980, test_loss: 0.7876, test_f1: 0.6127
 epoch: 39, train_loss: 0.6994, test_loss: 0.7880, test_f1: 0.6383
 epoch: 40, train_loss: 0.7020, test_loss: 0.7438, test_f1: 0.6488
 epoch: 41, train_loss: 0.7006, test_loss: 0.7754, test_f1: 0.6418
 epoch: 42, train_loss: 0.6916, test_loss: 0.8564, test_f1: 0.6351
 epoch: 43, train_loss: 0.6845, test_loss: 0.7371, test_f1: 0.6590
 epoch: 44, train_loss: 0.6686, test_loss: 0.7502, test_f1: 0.6395
 epoch: 45, train_loss: 0.6732, test_loss: 0.7157, test_f1: 0.6837
 epoch: 46, train_loss: 0.6542, test_loss: 0.7590, test_f1: 0.6513
 epoch: 47, train_loss: 0.6615, test_loss: 0.7440, test_f1: 0.6674
 epoch: 48, train_loss: 0.6602, test_loss: 0.8361, test_f1: 0.6350
 epoch: 49, train_loss: 0.6827, test_loss: 0.8721, test_f1: 0.5850
 epoch: 50, train_loss: 0.6691, test_loss: 0.7579, test_f1: 0.6878
 epoch: 51, train_loss: 0.6202, test_loss: 0.7538, test_f1: 0.6629
 epoch: 52, train_loss: 0.5917, test_loss: 0.7215, test_f1: 0.6722
 epoch: 53, train_loss: 0.5906, test_loss: 0.7853, test_f1: 0.6443
 epoch: 54, train_loss: 0.5805, test_loss: 0.7472, test_f1: 0.6638
 epoch: 55, train_loss: 0.5780, test_loss: 0.7118, test_f1: 0.6694
 epoch: 56, train_loss: 0.5604, test_loss: 0.7033, test_f1: 0.6749
 epoch: 57, train_loss: 0.5882, test_loss: 0.7201, test_f1: 0.6881
 epoch: 58, train_loss: 0.5947, test_loss: 0.7290, test_f1: 0.6578
 epoch: 59, train_loss: 0.5742, test_loss: 0.7257, test_f1: 0.6759
 epoch: 60, train_loss: 0.5626, test_loss: 0.7488, test_f1: 0.6605
 epoch: 61, train_loss: 0.5487, test_loss: 0.7897, test_f1: 0.6678
 epoch: 62, train_loss: 0.5727, test_loss: 0.7065, test_f1: 0.6968
 epoch: 63, train_loss: 0.5547, test_loss: 0.7954, test_f1: 0.6684
 epoch: 64, train_loss: 0.5474, test_loss: 0.7086, test_f1: 0.6737
 epoch: 65, train_loss: 0.5530, test_loss: 0.7988, test_f1: 0.6817
 epoch: 66, train_loss: 0.5527, test_loss: 0.7572, test_f1: 0.6544
 epoch: 67, train_loss: 0.5342, test_loss: 0.7650, test_f1: 0.6626
 epoch: 68, train_loss: 0.5385, test_loss: 0.8101, test_f1: 0.6615
 epoch: 69, train_loss: 0.5522, test_loss: 0.7855, test_f1: 0.6737
 epoch: 70, train_loss: 0.5406, test_loss: 0.7448, test_f1: 0.6687
 epoch: 71, train_loss: 0.5288, test_loss: 0.7905, test_f1: 0.6759
 epoch: 72, train_loss: 0.5254, test_loss: 0.8910, test_f1: 0.6807
 epoch: 73, train_loss: 0.5348, test_loss: 0.8041, test_f1: 0.6828
 epoch: 74, train_loss: 0.5098, test_loss: 0.8566, test_f1: 0.7012
 epoch: 75, train_loss: 0.5232, test_loss: 0.8476, test_f1: 0.6702
 epoch: 76, train_loss: 0.5340, test_loss: 0.8199, test_f1: 0.6685
 epoch: 77, train_loss: 0.5221, test_loss: 0.7705, test_f1: 0.6877
 epoch: 78, train_loss: 0.5249, test_loss: 0.7608, test_f1: 0.6764
 epoch: 79, train_loss: 0.5257, test_loss: 0.6946, test_f1: 0.6710
 epoch: 80, train_loss: 0.5116, test_loss: 0.7159, test_f1: 0.6941
 epoch: 81, train_loss: 0.5036, test_loss: 0.7682, test_f1: 0.6866
 epoch: 82, train_loss: 0.5103, test_loss: 0.8235, test_f1: 0.6911
 epoch: 83, train_loss: 0.5110, test_loss: 0.7568, test_f1: 0.6889
 epoch: 84, train_loss: 0.5234, test_loss: 0.6945, test_f1: 0.6793
 epoch: 85, train_loss: 0.5170, test_loss: 0.6820, test_f1: 0.7083
 epoch: 86, train_loss: 0.4933, test_loss: 0.7318, test_f1: 0.6697
 epoch: 87, train_loss: 0.5001, test_loss: 0.7087, test_f1: 0.6888
 epoch: 88, train_loss: 0.4978, test_loss: 0.7281, test_f1: 0.6814
 epoch: 89, train_loss: 0.5030, test_loss: 0.7741, test_f1: 0.6735
 epoch: 90, train_loss: 0.4826, test_loss: 0.7981, test_f1: 0.6893
 epoch: 91, train_loss: 0.5203, test_loss: 0.6737, test_f1: 0.6896
 epoch: 92, train_loss: 0.4736, test_loss: 0.8186, test_f1: 0.6443
 epoch: 93, train_loss: 0.4935, test_loss: 0.7555, test_f1: 0.6675
 epoch: 94, train_loss: 0.5044, test_loss: 0.7234, test_f1: 0.6930
 epoch: 95, train_loss: 0.4920, test_loss: 0.7518, test_f1: 0.6870
 epoch: 96, train_loss: 0.4987, test_loss: 0.7768, test_f1: 0.6730
 epoch: 97, train_loss: 0.4934, test_loss: 0.7186, test_f1: 0.6824
 epoch: 98, train_loss: 0.4946, test_loss: 0.7571, test_f1: 0.6745
 epoch: 99, train_loss: 0.4766, test_loss: 0.7293, test_f1: 0.6740
##################ITERATION #7 ****************************************
 epoch: 0, train_loss: 1.0880, test_loss: 1.8482, test_f1: 0.2777
 epoch: 1, train_loss: 0.9904, test_loss: 0.9355, test_f1: 0.5214
 epoch: 2, train_loss: 0.9591, test_loss: 1.0631, test_f1: 0.4343
 epoch: 3, train_loss: 0.9460, test_loss: 0.9210, test_f1: 0.5010
 epoch: 4, train_loss: 0.9323, test_loss: 1.0029, test_f1: 0.5206
 epoch: 5, train_loss: 0.9287, test_loss: 1.0180, test_f1: 0.5156
 epoch: 6, train_loss: 0.9091, test_loss: 0.9491, test_f1: 0.4863
 epoch: 7, train_loss: 0.9185, test_loss: 1.0346, test_f1: 0.4629
 epoch: 8, train_loss: 0.8990, test_loss: 1.0172, test_f1: 0.4840
 epoch: 9, train_loss: 0.8942, test_loss: 1.0006, test_f1: 0.4951
 epoch: 10, train_loss: 0.8757, test_loss: 0.8978, test_f1: 0.5896
 epoch: 11, train_loss: 0.8633, test_loss: 0.8840, test_f1: 0.5578
 epoch: 12, train_loss: 0.8736, test_loss: 1.0693, test_f1: 0.5663
 epoch: 13, train_loss: 0.8672, test_loss: 0.9094, test_f1: 0.5130
 epoch: 14, train_loss: 0.8422, test_loss: 0.8482, test_f1: 0.6006
 epoch: 15, train_loss: 0.8293, test_loss: 0.9298, test_f1: 0.6018
 epoch: 16, train_loss: 0.8228, test_loss: 0.9609, test_f1: 0.5599
 epoch: 17, train_loss: 0.8136, test_loss: 0.9307, test_f1: 0.5362
 epoch: 18, train_loss: 0.8116, test_loss: 0.8332, test_f1: 0.5537
 epoch: 19, train_loss: 0.7980, test_loss: 0.8263, test_f1: 0.5689
 epoch: 20, train_loss: 0.7931, test_loss: 0.9145, test_f1: 0.5872
 epoch: 21, train_loss: 0.7807, test_loss: 0.9371, test_f1: 0.6105
 epoch: 22, train_loss: 0.7723, test_loss: 0.8054, test_f1: 0.5793
 epoch: 23, train_loss: 0.7755, test_loss: 0.8633, test_f1: 0.5977
 epoch: 24, train_loss: 0.7856, test_loss: 0.8660, test_f1: 0.5637
 epoch: 25, train_loss: 0.7932, test_loss: 0.7895, test_f1: 0.6390
 epoch: 26, train_loss: 0.7940, test_loss: 0.8335, test_f1: 0.6233
 epoch: 27, train_loss: 0.7716, test_loss: 0.8598, test_f1: 0.6364
 epoch: 28, train_loss: 0.7935, test_loss: 0.8252, test_f1: 0.5848
 epoch: 29, train_loss: 0.8180, test_loss: 0.7818, test_f1: 0.6235
 epoch: 30, train_loss: 0.7826, test_loss: 0.8368, test_f1: 0.5937
 epoch: 31, train_loss: 0.7769, test_loss: 0.7754, test_f1: 0.6386
 epoch: 32, train_loss: 0.7664, test_loss: 0.8093, test_f1: 0.5909
 epoch: 33, train_loss: 0.7507, test_loss: 0.8271, test_f1: 0.6099
 epoch: 34, train_loss: 0.7585, test_loss: 0.9799, test_f1: 0.5883
 epoch: 35, train_loss: 0.7443, test_loss: 0.9158, test_f1: 0.5413
 epoch: 36, train_loss: 0.7425, test_loss: 0.8304, test_f1: 0.6578
 epoch: 37, train_loss: 0.7281, test_loss: 0.9114, test_f1: 0.5710
 epoch: 38, train_loss: 0.7414, test_loss: 0.8826, test_f1: 0.5586
 epoch: 39, train_loss: 0.7091, test_loss: 0.9145, test_f1: 0.5961
 epoch: 40, train_loss: 0.7091, test_loss: 0.7961, test_f1: 0.6348
 epoch: 41, train_loss: 0.7243, test_loss: 0.8145, test_f1: 0.6505
 epoch: 42, train_loss: 0.7177, test_loss: 0.8299, test_f1: 0.6146
 epoch: 43, train_loss: 0.7112, test_loss: 0.8217, test_f1: 0.6132
 epoch: 44, train_loss: 0.7068, test_loss: 0.8176, test_f1: 0.6381
 epoch: 45, train_loss: 0.6893, test_loss: 0.8682, test_f1: 0.5914
 epoch: 46, train_loss: 0.7044, test_loss: 0.7985, test_f1: 0.6626
 epoch: 47, train_loss: 0.6993, test_loss: 0.7518, test_f1: 0.6427
 epoch: 48, train_loss: 0.6825, test_loss: 0.7956, test_f1: 0.6525
 epoch: 49, train_loss: 0.6823, test_loss: 1.0688, test_f1: 0.6053
 epoch: 50, train_loss: 0.6878, test_loss: 0.7172, test_f1: 0.6414
 epoch: 51, train_loss: 0.6430, test_loss: 0.7941, test_f1: 0.6608
 epoch: 52, train_loss: 0.6478, test_loss: 0.7477, test_f1: 0.6376
 epoch: 53, train_loss: 0.6223, test_loss: 0.7608, test_f1: 0.6676
 epoch: 54, train_loss: 0.6244, test_loss: 0.7860, test_f1: 0.6763
 epoch: 55, train_loss: 0.6166, test_loss: 0.7467, test_f1: 0.6543
 epoch: 56, train_loss: 0.6386, test_loss: 0.7472, test_f1: 0.6640
 epoch: 57, train_loss: 0.6452, test_loss: 0.7536, test_f1: 0.6648
 epoch: 58, train_loss: 0.6272, test_loss: 0.7662, test_f1: 0.7027
 epoch: 59, train_loss: 0.6146, test_loss: 0.8549, test_f1: 0.6075
 epoch: 60, train_loss: 0.6174, test_loss: 0.8055, test_f1: 0.6746
 epoch: 61, train_loss: 0.6105, test_loss: 0.8105, test_f1: 0.6765
 epoch: 62, train_loss: 0.6056, test_loss: 0.8379, test_f1: 0.6737
 epoch: 63, train_loss: 0.6138, test_loss: 0.7502, test_f1: 0.6971
 epoch: 64, train_loss: 0.6062, test_loss: 0.8602, test_f1: 0.6334
 epoch: 65, train_loss: 0.5945, test_loss: 0.8117, test_f1: 0.6475
 epoch: 66, train_loss: 0.5993, test_loss: 0.7553, test_f1: 0.6805
 epoch: 67, train_loss: 0.6044, test_loss: 0.8879, test_f1: 0.6303
 epoch: 68, train_loss: 0.5725, test_loss: 0.8747, test_f1: 0.6761
 epoch: 69, train_loss: 0.5848, test_loss: 0.8369, test_f1: 0.6512
 epoch: 70, train_loss: 0.5946, test_loss: 0.8317, test_f1: 0.6728
 epoch: 71, train_loss: 0.5795, test_loss: 0.9069, test_f1: 0.6686
 epoch: 72, train_loss: 0.5707, test_loss: 0.7453, test_f1: 0.6615
 epoch: 73, train_loss: 0.5756, test_loss: 0.7851, test_f1: 0.6714
 epoch: 74, train_loss: 0.5740, test_loss: 0.8499, test_f1: 0.6845
 epoch: 75, train_loss: 0.5609, test_loss: 0.8141, test_f1: 0.6475
 epoch: 76, train_loss: 0.5598, test_loss: 0.8800, test_f1: 0.6344
 epoch: 77, train_loss: 0.5838, test_loss: 0.7957, test_f1: 0.6692
 epoch: 78, train_loss: 0.5582, test_loss: 0.8660, test_f1: 0.6899
 epoch: 79, train_loss: 0.5703, test_loss: 0.7903, test_f1: 0.6301
 epoch: 80, train_loss: 0.5522, test_loss: 0.8478, test_f1: 0.6898
 epoch: 81, train_loss: 0.5707, test_loss: 0.8276, test_f1: 0.6670
 epoch: 82, train_loss: 0.5620, test_loss: 0.8137, test_f1: 0.6675
 epoch: 83, train_loss: 0.5604, test_loss: 0.7966, test_f1: 0.6595
 epoch: 84, train_loss: 0.5466, test_loss: 0.7709, test_f1: 0.6640
 epoch: 85, train_loss: 0.5438, test_loss: 0.7323, test_f1: 0.6657
 epoch: 86, train_loss: 0.5458, test_loss: 0.7654, test_f1: 0.6588
 epoch: 87, train_loss: 0.5592, test_loss: 0.8861, test_f1: 0.6636
 epoch: 88, train_loss: 0.5500, test_loss: 0.8115, test_f1: 0.6683
 epoch: 89, train_loss: 0.5486, test_loss: 0.7851, test_f1: 0.6884
 epoch: 90, train_loss: 0.5460, test_loss: 0.8417, test_f1: 0.6760
 epoch: 91, train_loss: 0.5472, test_loss: 0.7713, test_f1: 0.6706
 epoch: 92, train_loss: 0.5493, test_loss: 0.8527, test_f1: 0.6740
 epoch: 93, train_loss: 0.5368, test_loss: 0.6941, test_f1: 0.7005
 epoch: 94, train_loss: 0.5426, test_loss: 0.7954, test_f1: 0.6798
 epoch: 95, train_loss: 0.5359, test_loss: 0.7634, test_f1: 0.6872
 epoch: 96, train_loss: 0.5439, test_loss: 0.9140, test_f1: 0.6823
 epoch: 97, train_loss: 0.5323, test_loss: 0.8432, test_f1: 0.6684
 epoch: 98, train_loss: 0.5231, test_loss: 0.8442, test_f1: 0.6865
 epoch: 99, train_loss: 0.5320, test_loss: 0.8204, test_f1: 0.6742
##################ITERATION #8 ****************************************
 epoch: 0, train_loss: 1.1069, test_loss: 1.0588, test_f1: 0.4605
 epoch: 1, train_loss: 1.0156, test_loss: 0.9796, test_f1: 0.4544
 epoch: 2, train_loss: 0.9881, test_loss: 1.1094, test_f1: 0.3755
 epoch: 3, train_loss: 0.9756, test_loss: 0.9730, test_f1: 0.4932
 epoch: 4, train_loss: 0.9546, test_loss: 0.9545, test_f1: 0.4838
 epoch: 5, train_loss: 0.9887, test_loss: 0.9700, test_f1: 0.5263
 epoch: 6, train_loss: 0.9445, test_loss: 0.9961, test_f1: 0.5407
 epoch: 7, train_loss: 0.9357, test_loss: 0.9608, test_f1: 0.5200
 epoch: 8, train_loss: 0.9076, test_loss: 0.9149, test_f1: 0.5089
 epoch: 9, train_loss: 0.8997, test_loss: 0.8615, test_f1: 0.5731
 epoch: 10, train_loss: 0.8911, test_loss: 1.0240, test_f1: 0.4883
 epoch: 11, train_loss: 0.8772, test_loss: 0.8539, test_f1: 0.5399
 epoch: 12, train_loss: 0.8690, test_loss: 0.8926, test_f1: 0.5733
 epoch: 13, train_loss: 0.8455, test_loss: 0.8411, test_f1: 0.5813
 epoch: 14, train_loss: 0.8543, test_loss: 0.9880, test_f1: 0.5131
 epoch: 15, train_loss: 0.8219, test_loss: 0.8893, test_f1: 0.5671
 epoch: 16, train_loss: 0.8352, test_loss: 0.8744, test_f1: 0.5352
 epoch: 17, train_loss: 0.8348, test_loss: 0.8029, test_f1: 0.5788
 epoch: 18, train_loss: 0.8274, test_loss: 0.8597, test_f1: 0.5794
 epoch: 19, train_loss: 0.8432, test_loss: 0.8976, test_f1: 0.5617
 epoch: 20, train_loss: 0.8327, test_loss: 0.8953, test_f1: 0.5674
 epoch: 21, train_loss: 0.8095, test_loss: 0.8933, test_f1: 0.5424
 epoch: 22, train_loss: 0.8130, test_loss: 0.8147, test_f1: 0.5852
 epoch: 23, train_loss: 0.7938, test_loss: 0.8331, test_f1: 0.5992
 epoch: 24, train_loss: 0.7871, test_loss: 0.8263, test_f1: 0.6236
 epoch: 25, train_loss: 0.7749, test_loss: 0.8155, test_f1: 0.6038
 epoch: 26, train_loss: 0.7977, test_loss: 0.8350, test_f1: 0.5641
 epoch: 27, train_loss: 0.7731, test_loss: 0.8720, test_f1: 0.5953
 epoch: 28, train_loss: 0.7897, test_loss: 0.7944, test_f1: 0.6389
 epoch: 29, train_loss: 0.7660, test_loss: 0.8609, test_f1: 0.5942
 epoch: 30, train_loss: 0.7716, test_loss: 0.9615, test_f1: 0.5389
 epoch: 31, train_loss: 0.7631, test_loss: 0.8462, test_f1: 0.5757
 epoch: 32, train_loss: 0.7440, test_loss: 0.8267, test_f1: 0.5649
 epoch: 33, train_loss: 0.7577, test_loss: 0.8866, test_f1: 0.5905
 epoch: 34, train_loss: 0.7592, test_loss: 0.8891, test_f1: 0.6104
 epoch: 35, train_loss: 0.7608, test_loss: 0.8556, test_f1: 0.6036
 epoch: 36, train_loss: 0.7936, test_loss: 1.0131, test_f1: 0.5711
 epoch: 37, train_loss: 0.7453, test_loss: 0.8634, test_f1: 0.5962
 epoch: 38, train_loss: 0.7546, test_loss: 0.8421, test_f1: 0.6309
 epoch: 39, train_loss: 0.7320, test_loss: 0.8904, test_f1: 0.6128
 epoch: 40, train_loss: 0.7376, test_loss: 0.9303, test_f1: 0.6130
 epoch: 41, train_loss: 0.7345, test_loss: 0.8004, test_f1: 0.6494
 epoch: 42, train_loss: 0.7275, test_loss: 0.9066, test_f1: 0.6249
 epoch: 43, train_loss: 0.7220, test_loss: 0.8385, test_f1: 0.5892
 epoch: 44, train_loss: 0.7187, test_loss: 0.8334, test_f1: 0.6487
 epoch: 45, train_loss: 0.6966, test_loss: 0.9061, test_f1: 0.6498
 epoch: 46, train_loss: 0.7146, test_loss: 0.9107, test_f1: 0.6138
 epoch: 47, train_loss: 0.6942, test_loss: 0.8797, test_f1: 0.6271
 epoch: 48, train_loss: 0.7064, test_loss: 0.8588, test_f1: 0.6260
 epoch: 49, train_loss: 0.6982, test_loss: 0.9464, test_f1: 0.6169
 epoch: 50, train_loss: 0.6800, test_loss: 0.7480, test_f1: 0.6276
 epoch: 51, train_loss: 0.6668, test_loss: 0.7989, test_f1: 0.6248
 epoch: 52, train_loss: 0.6403, test_loss: 0.8900, test_f1: 0.6340
 epoch: 53, train_loss: 0.6275, test_loss: 0.9598, test_f1: 0.6239
 epoch: 54, train_loss: 0.6517, test_loss: 0.8855, test_f1: 0.6584
 epoch: 55, train_loss: 0.6340, test_loss: 0.8512, test_f1: 0.6619
 epoch: 56, train_loss: 0.6134, test_loss: 0.8816, test_f1: 0.6737
 epoch: 57, train_loss: 0.6108, test_loss: 0.9064, test_f1: 0.6859
 epoch: 58, train_loss: 0.6125, test_loss: 0.8336, test_f1: 0.6565
 epoch: 59, train_loss: 0.6009, test_loss: 0.9072, test_f1: 0.6647
 epoch: 60, train_loss: 0.5937, test_loss: 0.8494, test_f1: 0.6684
 epoch: 61, train_loss: 0.6169, test_loss: 0.9143, test_f1: 0.6700
 epoch: 62, train_loss: 0.5929, test_loss: 0.8945, test_f1: 0.6681
 epoch: 63, train_loss: 0.6059, test_loss: 0.8730, test_f1: 0.6901
 epoch: 64, train_loss: 0.5920, test_loss: 0.8663, test_f1: 0.6818
 epoch: 65, train_loss: 0.5880, test_loss: 0.8463, test_f1: 0.6370
 epoch: 66, train_loss: 0.5946, test_loss: 0.9061, test_f1: 0.6748
 epoch: 67, train_loss: 0.5993, test_loss: 0.9332, test_f1: 0.6574
 epoch: 68, train_loss: 0.5998, test_loss: 0.9325, test_f1: 0.6434
 epoch: 69, train_loss: 0.5734, test_loss: 0.9411, test_f1: 0.6564
 epoch: 70, train_loss: 0.5791, test_loss: 0.9237, test_f1: 0.6766
 epoch: 71, train_loss: 0.5833, test_loss: 0.9363, test_f1: 0.6491
 epoch: 72, train_loss: 0.5807, test_loss: 0.9193, test_f1: 0.6956
 epoch: 73, train_loss: 0.5605, test_loss: 0.9800, test_f1: 0.6755
 epoch: 74, train_loss: 0.5619, test_loss: 0.9186, test_f1: 0.6826
 epoch: 75, train_loss: 0.5708, test_loss: 0.9393, test_f1: 0.6833
 epoch: 76, train_loss: 0.5567, test_loss: 0.8953, test_f1: 0.6779
 epoch: 77, train_loss: 0.5641, test_loss: 0.9472, test_f1: 0.6524
 epoch: 78, train_loss: 0.5676, test_loss: 0.9373, test_f1: 0.6937
 epoch: 79, train_loss: 0.5562, test_loss: 0.9594, test_f1: 0.6676
 epoch: 80, train_loss: 0.5499, test_loss: 0.9430, test_f1: 0.6898
 epoch: 81, train_loss: 0.5440, test_loss: 0.9380, test_f1: 0.6738
 epoch: 82, train_loss: 0.5470, test_loss: 0.8879, test_f1: 0.6742
 epoch: 83, train_loss: 0.5547, test_loss: 1.0788, test_f1: 0.6705
 epoch: 84, train_loss: 0.5553, test_loss: 1.0030, test_f1: 0.6536
 epoch: 85, train_loss: 0.5463, test_loss: 1.0027, test_f1: 0.6462
 epoch: 86, train_loss: 0.5535, test_loss: 1.0237, test_f1: 0.6796
 epoch: 87, train_loss: 0.5405, test_loss: 1.0173, test_f1: 0.6733
 epoch: 88, train_loss: 0.5340, test_loss: 0.9377, test_f1: 0.6765
 epoch: 89, train_loss: 0.5296, test_loss: 0.9535, test_f1: 0.6774
 epoch: 90, train_loss: 0.5279, test_loss: 1.0029, test_f1: 0.6603
 epoch: 91, train_loss: 0.5289, test_loss: 0.9659, test_f1: 0.6617
 epoch: 92, train_loss: 0.5212, test_loss: 0.9899, test_f1: 0.6698
 epoch: 93, train_loss: 0.5204, test_loss: 1.0215, test_f1: 0.6633
 epoch: 94, train_loss: 0.5370, test_loss: 0.9740, test_f1: 0.6878
 epoch: 95, train_loss: 0.5079, test_loss: 0.9938, test_f1: 0.6922
 epoch: 96, train_loss: 0.5311, test_loss: 1.0221, test_f1: 0.6694
 epoch: 97, train_loss: 0.5312, test_loss: 0.9500, test_f1: 0.6641
 epoch: 98, train_loss: 0.5095, test_loss: 0.9398, test_f1: 0.6784
 epoch: 99, train_loss: 0.5233, test_loss: 1.0302, test_f1: 0.6513
##################ITERATION #9 ****************************************
 epoch: 0, train_loss: 1.0759, test_loss: 1.1081, test_f1: 0.4347
 epoch: 1, train_loss: 0.9951, test_loss: 1.0544, test_f1: 0.4948
 epoch: 2, train_loss: 0.9591, test_loss: 0.9671, test_f1: 0.5082
 epoch: 3, train_loss: 0.9462, test_loss: 0.9718, test_f1: 0.4765
 epoch: 4, train_loss: 0.9179, test_loss: 0.9174, test_f1: 0.5122
 epoch: 5, train_loss: 0.8982, test_loss: 0.9050, test_f1: 0.5222
 epoch: 6, train_loss: 0.9041, test_loss: 0.9475, test_f1: 0.5126
 epoch: 7, train_loss: 0.9047, test_loss: 0.9425, test_f1: 0.4780
 epoch: 8, train_loss: 0.8751, test_loss: 0.9435, test_f1: 0.4987
 epoch: 9, train_loss: 0.8831, test_loss: 0.9314, test_f1: 0.5273
 epoch: 10, train_loss: 0.8591, test_loss: 0.8933, test_f1: 0.5303
 epoch: 11, train_loss: 0.8568, test_loss: 0.9002, test_f1: 0.5247
 epoch: 12, train_loss: 0.8521, test_loss: 0.8348, test_f1: 0.6251
 epoch: 13, train_loss: 0.8592, test_loss: 0.9117, test_f1: 0.5717
 epoch: 14, train_loss: 0.8346, test_loss: 0.8779, test_f1: 0.5416
 epoch: 15, train_loss: 0.8196, test_loss: 0.9054, test_f1: 0.5756
 epoch: 16, train_loss: 0.8278, test_loss: 0.8489, test_f1: 0.6063
 epoch: 17, train_loss: 0.8196, test_loss: 0.9183, test_f1: 0.5378
 epoch: 18, train_loss: 0.8233, test_loss: 0.8868, test_f1: 0.5986
 epoch: 19, train_loss: 0.7899, test_loss: 0.8625, test_f1: 0.5515
 epoch: 20, train_loss: 0.7900, test_loss: 0.8958, test_f1: 0.6268
 epoch: 21, train_loss: 0.7692, test_loss: 0.8903, test_f1: 0.6257
 epoch: 22, train_loss: 0.7648, test_loss: 0.9097, test_f1: 0.6032
 epoch: 23, train_loss: 0.7674, test_loss: 0.9308, test_f1: 0.5505
 epoch: 24, train_loss: 0.7773, test_loss: 0.9336, test_f1: 0.5916
 epoch: 25, train_loss: 0.7589, test_loss: 0.9396, test_f1: 0.5249
 epoch: 26, train_loss: 0.7781, test_loss: 0.8307, test_f1: 0.6171
 epoch: 27, train_loss: 0.7561, test_loss: 1.0219, test_f1: 0.6172
 epoch: 28, train_loss: 0.7618, test_loss: 0.8102, test_f1: 0.5829
 epoch: 29, train_loss: 0.7544, test_loss: 0.8776, test_f1: 0.5931
 epoch: 30, train_loss: 0.7380, test_loss: 0.8706, test_f1: 0.5957
 epoch: 31, train_loss: 0.7317, test_loss: 0.8574, test_f1: 0.5701
 epoch: 32, train_loss: 0.7264, test_loss: 0.8077, test_f1: 0.5810
 epoch: 33, train_loss: 0.7424, test_loss: 0.8384, test_f1: 0.6237
 epoch: 34, train_loss: 0.7165, test_loss: 0.8691, test_f1: 0.6204
 epoch: 35, train_loss: 0.7247, test_loss: 0.8972, test_f1: 0.6255
 epoch: 36, train_loss: 0.7231, test_loss: 1.0447, test_f1: 0.5206
 epoch: 37, train_loss: 0.7649, test_loss: 0.8388, test_f1: 0.6194
 epoch: 38, train_loss: 0.7195, test_loss: 0.8728, test_f1: 0.5730
 epoch: 39, train_loss: 0.7105, test_loss: 0.9161, test_f1: 0.6090
 epoch: 40, train_loss: 0.7250, test_loss: 0.8462, test_f1: 0.6086
 epoch: 41, train_loss: 0.7201, test_loss: 0.8872, test_f1: 0.6328
 epoch: 42, train_loss: 0.7155, test_loss: 0.8005, test_f1: 0.6417
 epoch: 43, train_loss: 0.7057, test_loss: 0.8402, test_f1: 0.6156
 epoch: 44, train_loss: 0.6788, test_loss: 0.8637, test_f1: 0.6556
 epoch: 45, train_loss: 0.6798, test_loss: 0.7457, test_f1: 0.6115
 epoch: 46, train_loss: 0.6917, test_loss: 0.7863, test_f1: 0.6092
 epoch: 47, train_loss: 0.6593, test_loss: 0.9638, test_f1: 0.6265
 epoch: 48, train_loss: 0.6887, test_loss: 0.8089, test_f1: 0.6348
 epoch: 49, train_loss: 0.6764, test_loss: 0.7345, test_f1: 0.6280
 epoch: 50, train_loss: 0.6776, test_loss: 0.8813, test_f1: 0.6384
 epoch: 51, train_loss: 0.6356, test_loss: 0.7336, test_f1: 0.6419
 epoch: 52, train_loss: 0.6224, test_loss: 0.8300, test_f1: 0.6206
 epoch: 53, train_loss: 0.6201, test_loss: 0.9124, test_f1: 0.6485
 epoch: 54, train_loss: 0.6213, test_loss: 0.8033, test_f1: 0.6401
 epoch: 55, train_loss: 0.6224, test_loss: 0.8319, test_f1: 0.6312
 epoch: 56, train_loss: 0.6202, test_loss: 0.8454, test_f1: 0.6413
 epoch: 57, train_loss: 0.5943, test_loss: 0.9280, test_f1: 0.6167
 epoch: 58, train_loss: 0.6051, test_loss: 0.8979, test_f1: 0.6484
 epoch: 59, train_loss: 0.6147, test_loss: 0.9447, test_f1: 0.6426
 epoch: 60, train_loss: 0.6200, test_loss: 0.9001, test_f1: 0.6333
 epoch: 61, train_loss: 0.5952, test_loss: 0.8652, test_f1: 0.6473
 epoch: 62, train_loss: 0.6011, test_loss: 1.0122, test_f1: 0.6246
 epoch: 63, train_loss: 0.5923, test_loss: 0.9195, test_f1: 0.6322
 epoch: 64, train_loss: 0.5941, test_loss: 1.0002, test_f1: 0.6513
 epoch: 65, train_loss: 0.5899, test_loss: 0.9128, test_f1: 0.6262
 epoch: 66, train_loss: 0.5782, test_loss: 0.8601, test_f1: 0.6404
 epoch: 67, train_loss: 0.5664, test_loss: 0.9076, test_f1: 0.6548
 epoch: 68, train_loss: 0.5661, test_loss: 0.9412, test_f1: 0.6314
 epoch: 69, train_loss: 0.5810, test_loss: 0.9276, test_f1: 0.6387
 epoch: 70, train_loss: 0.5793, test_loss: 1.0451, test_f1: 0.6391
 epoch: 71, train_loss: 0.5935, test_loss: 0.9158, test_f1: 0.6383
 epoch: 72, train_loss: 0.5658, test_loss: 0.9039, test_f1: 0.6303
 epoch: 73, train_loss: 0.5628, test_loss: 0.9009, test_f1: 0.6347
 epoch: 74, train_loss: 0.5654, test_loss: 0.8628, test_f1: 0.6474
 epoch: 75, train_loss: 0.5528, test_loss: 0.8635, test_f1: 0.6483
 epoch: 76, train_loss: 0.5534, test_loss: 0.9801, test_f1: 0.6366
 epoch: 77, train_loss: 0.5531, test_loss: 1.0410, test_f1: 0.6539
 epoch: 78, train_loss: 0.5712, test_loss: 0.8964, test_f1: 0.6383
 epoch: 79, train_loss: 0.5663, test_loss: 1.0161, test_f1: 0.6479
 epoch: 80, train_loss: 0.5667, test_loss: 0.9592, test_f1: 0.6326
 epoch: 81, train_loss: 0.5718, test_loss: 1.0665, test_f1: 0.6412
 epoch: 82, train_loss: 0.5395, test_loss: 1.0271, test_f1: 0.6658
 epoch: 83, train_loss: 0.5454, test_loss: 0.9331, test_f1: 0.6385
 epoch: 84, train_loss: 0.5658, test_loss: 0.8913, test_f1: 0.6379
 epoch: 85, train_loss: 0.5451, test_loss: 0.8836, test_f1: 0.6417
 epoch: 86, train_loss: 0.5394, test_loss: 0.8263, test_f1: 0.6622
 epoch: 87, train_loss: 0.5336, test_loss: 0.9568, test_f1: 0.6481
 epoch: 88, train_loss: 0.5405, test_loss: 0.8694, test_f1: 0.6512
 epoch: 89, train_loss: 0.5372, test_loss: 0.9659, test_f1: 0.6524
 epoch: 90, train_loss: 0.5332, test_loss: 0.9347, test_f1: 0.6450
 epoch: 91, train_loss: 0.5411, test_loss: 1.0574, test_f1: 0.6412
 epoch: 92, train_loss: 0.5257, test_loss: 0.9473, test_f1: 0.6304
 epoch: 93, train_loss: 0.5362, test_loss: 1.0219, test_f1: 0.6463
 epoch: 94, train_loss: 0.5398, test_loss: 0.9943, test_f1: 0.6613
 epoch: 95, train_loss: 0.5227, test_loss: 1.0520, test_f1: 0.6376
 epoch: 96, train_loss: 0.5391, test_loss: 0.8768, test_f1: 0.6359
 epoch: 97, train_loss: 0.5268, test_loss: 0.9314, test_f1: 0.6610
 epoch: 98, train_loss: 0.5420, test_loss: 0.8414, test_f1: 0.6389
 epoch: 99, train_loss: 0.5376, test_loss: 0.9231, test_f1: 0.6461

Training completed in 816.97 seconds
Best F1: 0.7083 at epoch 85
Mean F1 across iterations: 0.6884  0.0127
========================FINAL RESULTS================================
FEGIN weighted F1: 0.7083  0.0127
python main.py --data ltspice_examples --representation component_pin_net --model FEGIN --layers 2 --hiddens 64 --batch_size 32 --lr 0.01 --emb_size 128 --epochs 100 --save_appendix component_pin_net_L2_H64_BS32_LR0.01_E128 --no_val
-----



STDERR:
  File "main.py", line 370, in <module>
    main()
  File "main.py", line 254, in main
    dataset = dataset_class(
  File "/home/philip/projects/ltspice_examples_code_repo/Circuit-Completion-Using-GNNs/component_classification_with_link_prediction_head/evaluation/FEGIN/kernel/circuit_datasets.py", line 15, in __init__
    self.data, self.slices = torch.load(self.processed_paths[0])
  File "/home/philip/.local/lib/python3.8/site-packages/torch/serialization.py", line 1040, in load
    warnings.warn(
  File "/usr/lib/python3.8/warnings.py", line 109, in _showwarnmsg
    sw(msg.message, msg.category, msg.filename, msg.lineno,
  File "main.py", line 47, in warn_with_traceback
    traceback.print_stack(file=log)
/home/philip/projects/ltspice_examples_code_repo/Circuit-Completion-Using-GNNs/component_classification_with_link_prediction_head/evaluation/FEGIN/kernel/circuit_datasets.py:15: FutureWarning: You are using `torch.load` with `weights_only=False` (the current default value), which uses the default pickle module implicitly. It is possible to construct malicious pickle data which will execute arbitrary code during unpickling (See https://github.com/pytorch/pytorch/blob/main/SECURITY.md#untrusted-models for more details). In a future release, the default value for `weights_only` will be flipped to `True`. This limits the functions that could be executed during unpickling. Arbitrary objects will no longer be allowed to be loaded via this mode unless they are explicitly allowlisted by the user via `torch.serialization.add_safe_globals`. We recommend you start setting `weights_only=True` for any use case where you don't have full control of the loaded file. Please open an issue on GitHub for any issues related to this experimental feature.
  self.data, self.slices = torch.load(self.processed_paths[0])
