STDOUT:
Results will be saved in /home/philip/projects/ltspice_examples_code_repo/Circuit-Completion-Using-GNNs/component_classification_with_link_prediction_head/evaluation/FEGIN/results/model_FEGIN_dataset_ltspice_examples
Command line input: python main.py --data ltspice_examples --representation component_net --model FEGIN --layers 6 --hiddens 128 --batch_size 256 --lr 0.0001 --emb_size 512 --epochs 100 --save_appendix component_net_L6_H128_BS256_LR0.0001_E512 --no_val
 is saved.
-----
ltspice_examples - FEGIN
Using 6 layers, 128 hidden units, h = 2
Loading component_net representation dataset
ENTERED
Training FEGIN on component_net representation
Train: 3558, Test: 846
##################ITERATION #0 ****************************************
 epoch: 0, train_loss: 1.3540, test_loss: 1.3629, test_f1: 0.2270
 epoch: 1, train_loss: 1.3329, test_loss: 1.3572, test_f1: 0.2270
 epoch: 2, train_loss: 1.3171, test_loss: 1.3432, test_f1: 0.2270
 epoch: 3, train_loss: 1.2981, test_loss: 1.3193, test_f1: 0.2270
 epoch: 4, train_loss: 1.2749, test_loss: 1.2857, test_f1: 0.2853
 epoch: 5, train_loss: 1.2499, test_loss: 1.2434, test_f1: 0.3214
 epoch: 6, train_loss: 1.2213, test_loss: 1.2078, test_f1: 0.3430
 epoch: 7, train_loss: 1.1950, test_loss: 1.1742, test_f1: 0.3493
 epoch: 8, train_loss: 1.1615, test_loss: 1.1439, test_f1: 0.3733
 epoch: 9, train_loss: 1.1374, test_loss: 1.1146, test_f1: 0.4087
 epoch: 10, train_loss: 1.1125, test_loss: 1.0904, test_f1: 0.4226
 epoch: 11, train_loss: 1.0902, test_loss: 1.0706, test_f1: 0.4597
 epoch: 12, train_loss: 1.0688, test_loss: 1.0469, test_f1: 0.4816
 epoch: 13, train_loss: 1.0457, test_loss: 1.0249, test_f1: 0.5161
 epoch: 14, train_loss: 1.0203, test_loss: 0.9946, test_f1: 0.5202
 epoch: 15, train_loss: 0.9953, test_loss: 0.9701, test_f1: 0.5432
 epoch: 16, train_loss: 0.9707, test_loss: 0.9608, test_f1: 0.5033
 epoch: 17, train_loss: 0.9497, test_loss: 0.9393, test_f1: 0.5206
 epoch: 18, train_loss: 0.9266, test_loss: 0.9249, test_f1: 0.5344
 epoch: 19, train_loss: 0.9070, test_loss: 0.9100, test_f1: 0.5448
 epoch: 20, train_loss: 0.8871, test_loss: 0.8949, test_f1: 0.5425
 epoch: 21, train_loss: 0.8726, test_loss: 0.8892, test_f1: 0.5453
 epoch: 22, train_loss: 0.8479, test_loss: 0.8961, test_f1: 0.5560
 epoch: 23, train_loss: 0.8402, test_loss: 0.8873, test_f1: 0.5367
 epoch: 24, train_loss: 0.8275, test_loss: 0.8680, test_f1: 0.5362
 epoch: 25, train_loss: 0.8169, test_loss: 0.8755, test_f1: 0.5510
 epoch: 26, train_loss: 0.8185, test_loss: 0.8850, test_f1: 0.5355
 epoch: 27, train_loss: 0.8093, test_loss: 0.8630, test_f1: 0.5477
 epoch: 28, train_loss: 0.8040, test_loss: 0.8633, test_f1: 0.5422
 epoch: 29, train_loss: 0.7859, test_loss: 0.8736, test_f1: 0.5423
 epoch: 30, train_loss: 0.7752, test_loss: 0.8707, test_f1: 0.5599
 epoch: 31, train_loss: 0.7620, test_loss: 0.8787, test_f1: 0.5430
 epoch: 32, train_loss: 0.7551, test_loss: 0.8728, test_f1: 0.5519
 epoch: 33, train_loss: 0.7526, test_loss: 0.8933, test_f1: 0.5456
 epoch: 34, train_loss: 0.7420, test_loss: 0.8818, test_f1: 0.5537
 epoch: 35, train_loss: 0.7422, test_loss: 0.9112, test_f1: 0.5349
 epoch: 36, train_loss: 0.7304, test_loss: 0.8977, test_f1: 0.5587
 epoch: 37, train_loss: 0.7195, test_loss: 0.8817, test_f1: 0.5804
 epoch: 38, train_loss: 0.7068, test_loss: 0.8912, test_f1: 0.5742
 epoch: 39, train_loss: 0.7075, test_loss: 0.8883, test_f1: 0.5662
 epoch: 40, train_loss: 0.7056, test_loss: 0.9239, test_f1: 0.5728
 epoch: 41, train_loss: 0.6945, test_loss: 0.9149, test_f1: 0.5686
 epoch: 42, train_loss: 0.6877, test_loss: 0.9037, test_f1: 0.5630
 epoch: 43, train_loss: 0.6798, test_loss: 0.8983, test_f1: 0.5559
 epoch: 44, train_loss: 0.6838, test_loss: 0.9005, test_f1: 0.5706
 epoch: 45, train_loss: 0.6637, test_loss: 0.9309, test_f1: 0.5578
 epoch: 46, train_loss: 0.6645, test_loss: 0.9238, test_f1: 0.5675
 epoch: 47, train_loss: 0.6634, test_loss: 0.9167, test_f1: 0.5990
 epoch: 48, train_loss: 0.6707, test_loss: 0.9679, test_f1: 0.5860
 epoch: 49, train_loss: 0.6612, test_loss: 0.9527, test_f1: 0.5796
 epoch: 50, train_loss: 0.6468, test_loss: 0.9530, test_f1: 0.5877
 epoch: 51, train_loss: 0.6303, test_loss: 0.9306, test_f1: 0.6002
 epoch: 52, train_loss: 0.6202, test_loss: 0.9302, test_f1: 0.6028
 epoch: 53, train_loss: 0.6201, test_loss: 0.9250, test_f1: 0.5946
 epoch: 54, train_loss: 0.6087, test_loss: 0.9387, test_f1: 0.5949
 epoch: 55, train_loss: 0.6133, test_loss: 0.9343, test_f1: 0.5904
 epoch: 56, train_loss: 0.6117, test_loss: 0.9557, test_f1: 0.5842
 epoch: 57, train_loss: 0.6009, test_loss: 0.9342, test_f1: 0.5908
 epoch: 58, train_loss: 0.6014, test_loss: 0.9647, test_f1: 0.5826
 epoch: 59, train_loss: 0.5904, test_loss: 0.9509, test_f1: 0.5967
 epoch: 60, train_loss: 0.5891, test_loss: 0.9462, test_f1: 0.5845
 epoch: 61, train_loss: 0.6006, test_loss: 0.9672, test_f1: 0.5888
 epoch: 62, train_loss: 0.5877, test_loss: 0.9462, test_f1: 0.6004
 epoch: 63, train_loss: 0.5829, test_loss: 0.9832, test_f1: 0.5769
 epoch: 64, train_loss: 0.5881, test_loss: 0.9624, test_f1: 0.5994
 epoch: 65, train_loss: 0.5806, test_loss: 0.9567, test_f1: 0.5926
 epoch: 66, train_loss: 0.5891, test_loss: 0.9879, test_f1: 0.5950
 epoch: 67, train_loss: 0.5817, test_loss: 0.9831, test_f1: 0.5946
 epoch: 68, train_loss: 0.5692, test_loss: 0.9711, test_f1: 0.5904
 epoch: 69, train_loss: 0.5707, test_loss: 0.9709, test_f1: 0.5976
 epoch: 70, train_loss: 0.5674, test_loss: 0.9945, test_f1: 0.5824
 epoch: 71, train_loss: 0.5642, test_loss: 0.9813, test_f1: 0.5885
 epoch: 72, train_loss: 0.5552, test_loss: 0.9649, test_f1: 0.6093
 epoch: 73, train_loss: 0.5556, test_loss: 1.0010, test_f1: 0.5979
 epoch: 74, train_loss: 0.5577, test_loss: 0.9927, test_f1: 0.5959
 epoch: 75, train_loss: 0.5539, test_loss: 0.9978, test_f1: 0.5961
 epoch: 76, train_loss: 0.5403, test_loss: 1.0214, test_f1: 0.5958
 epoch: 77, train_loss: 0.5494, test_loss: 1.0026, test_f1: 0.5950
 epoch: 78, train_loss: 0.5319, test_loss: 1.0034, test_f1: 0.6119
 epoch: 79, train_loss: 0.5424, test_loss: 1.0115, test_f1: 0.5910
 epoch: 80, train_loss: 0.5398, test_loss: 1.0521, test_f1: 0.5946
 epoch: 81, train_loss: 0.5282, test_loss: 1.0104, test_f1: 0.6158
 epoch: 82, train_loss: 0.5358, test_loss: 0.9988, test_f1: 0.5997
 epoch: 83, train_loss: 0.5357, test_loss: 1.0359, test_f1: 0.5995
 epoch: 84, train_loss: 0.5376, test_loss: 1.0226, test_f1: 0.6043
 epoch: 85, train_loss: 0.5183, test_loss: 1.0303, test_f1: 0.5942
 epoch: 86, train_loss: 0.5255, test_loss: 1.0422, test_f1: 0.5915
 epoch: 87, train_loss: 0.5165, test_loss: 1.0193, test_f1: 0.5940
 epoch: 88, train_loss: 0.5207, test_loss: 1.0265, test_f1: 0.5994
 epoch: 89, train_loss: 0.5166, test_loss: 1.0261, test_f1: 0.5975
 epoch: 90, train_loss: 0.5099, test_loss: 1.0292, test_f1: 0.5963
 epoch: 91, train_loss: 0.5008, test_loss: 1.0313, test_f1: 0.5920
 epoch: 92, train_loss: 0.5107, test_loss: 1.0627, test_f1: 0.5983
 epoch: 93, train_loss: 0.4938, test_loss: 1.0561, test_f1: 0.5940
 epoch: 94, train_loss: 0.5170, test_loss: 1.0565, test_f1: 0.6005
 epoch: 95, train_loss: 0.5126, test_loss: 1.0693, test_f1: 0.5911
 epoch: 96, train_loss: 0.4906, test_loss: 1.0559, test_f1: 0.5931
 epoch: 97, train_loss: 0.5002, test_loss: 1.0506, test_f1: 0.5959
 epoch: 98, train_loss: 0.4833, test_loss: 1.0206, test_f1: 0.6076
 epoch: 99, train_loss: 0.4846, test_loss: 1.0375, test_f1: 0.6090
##################ITERATION #1 ****************************************
 epoch: 0, train_loss: 1.3088, test_loss: 1.3467, test_f1: 0.2270
 epoch: 1, train_loss: 1.2552, test_loss: 1.3218, test_f1: 0.2270
 epoch: 2, train_loss: 1.2261, test_loss: 1.2825, test_f1: 0.2270
 epoch: 3, train_loss: 1.1954, test_loss: 1.2365, test_f1: 0.2814
 epoch: 4, train_loss: 1.1669, test_loss: 1.1746, test_f1: 0.3889
 epoch: 5, train_loss: 1.1379, test_loss: 1.1230, test_f1: 0.4323
 epoch: 6, train_loss: 1.1091, test_loss: 1.0768, test_f1: 0.4883
 epoch: 7, train_loss: 1.0846, test_loss: 1.0445, test_f1: 0.5095
 epoch: 8, train_loss: 1.0570, test_loss: 1.0143, test_f1: 0.5195
 epoch: 9, train_loss: 1.0326, test_loss: 0.9938, test_f1: 0.5305
 epoch: 10, train_loss: 1.0096, test_loss: 0.9668, test_f1: 0.5412
 epoch: 11, train_loss: 0.9815, test_loss: 0.9545, test_f1: 0.5257
 epoch: 12, train_loss: 0.9568, test_loss: 0.9371, test_f1: 0.5244
 epoch: 13, train_loss: 0.9436, test_loss: 0.9039, test_f1: 0.5505
 epoch: 14, train_loss: 0.9200, test_loss: 0.9176, test_f1: 0.5258
 epoch: 15, train_loss: 0.9056, test_loss: 0.8915, test_f1: 0.5706
 epoch: 16, train_loss: 0.8906, test_loss: 0.9220, test_f1: 0.5312
 epoch: 17, train_loss: 0.8750, test_loss: 0.9359, test_f1: 0.5252
 epoch: 18, train_loss: 0.8615, test_loss: 0.8758, test_f1: 0.5434
 epoch: 19, train_loss: 0.8508, test_loss: 0.8943, test_f1: 0.5291
 epoch: 20, train_loss: 0.8363, test_loss: 0.9172, test_f1: 0.5625
 epoch: 21, train_loss: 0.8264, test_loss: 0.8897, test_f1: 0.5312
 epoch: 22, train_loss: 0.8139, test_loss: 0.9128, test_f1: 0.5442
 epoch: 23, train_loss: 0.8003, test_loss: 0.9258, test_f1: 0.5594
 epoch: 24, train_loss: 0.7909, test_loss: 0.9198, test_f1: 0.5344
 epoch: 25, train_loss: 0.7840, test_loss: 0.9266, test_f1: 0.5402
 epoch: 26, train_loss: 0.7813, test_loss: 0.8607, test_f1: 0.5562
 epoch: 27, train_loss: 0.7699, test_loss: 0.9002, test_f1: 0.5759
 epoch: 28, train_loss: 0.7521, test_loss: 0.9149, test_f1: 0.5784
 epoch: 29, train_loss: 0.7499, test_loss: 0.9017, test_f1: 0.5786
 epoch: 30, train_loss: 0.7509, test_loss: 0.8964, test_f1: 0.5707
 epoch: 31, train_loss: 0.7294, test_loss: 0.9402, test_f1: 0.5748
 epoch: 32, train_loss: 0.7266, test_loss: 0.9002, test_f1: 0.5880
 epoch: 33, train_loss: 0.7168, test_loss: 0.9219, test_f1: 0.5787
 epoch: 34, train_loss: 0.7107, test_loss: 0.9515, test_f1: 0.5752
 epoch: 35, train_loss: 0.7032, test_loss: 0.9069, test_f1: 0.5957
 epoch: 36, train_loss: 0.7017, test_loss: 0.9535, test_f1: 0.5923
 epoch: 37, train_loss: 0.6900, test_loss: 0.9236, test_f1: 0.5850
 epoch: 38, train_loss: 0.6908, test_loss: 0.9339, test_f1: 0.5967
 epoch: 39, train_loss: 0.6924, test_loss: 0.9637, test_f1: 0.6113
 epoch: 40, train_loss: 0.6717, test_loss: 0.9169, test_f1: 0.5940
 epoch: 41, train_loss: 0.6699, test_loss: 0.9625, test_f1: 0.5841
 epoch: 42, train_loss: 0.6601, test_loss: 0.9503, test_f1: 0.5976
 epoch: 43, train_loss: 0.6653, test_loss: 0.9203, test_f1: 0.5959
 epoch: 44, train_loss: 0.6636, test_loss: 0.9534, test_f1: 0.6176
 epoch: 45, train_loss: 0.6532, test_loss: 0.9588, test_f1: 0.6031
 epoch: 46, train_loss: 0.6390, test_loss: 0.9733, test_f1: 0.5999
 epoch: 47, train_loss: 0.6439, test_loss: 0.9556, test_f1: 0.6100
 epoch: 48, train_loss: 0.6310, test_loss: 0.9609, test_f1: 0.5947
 epoch: 49, train_loss: 0.6171, test_loss: 0.9507, test_f1: 0.6041
 epoch: 50, train_loss: 0.6316, test_loss: 1.0157, test_f1: 0.6093
 epoch: 51, train_loss: 0.6080, test_loss: 0.9585, test_f1: 0.6047
 epoch: 52, train_loss: 0.5919, test_loss: 0.9847, test_f1: 0.6062
 epoch: 53, train_loss: 0.5968, test_loss: 0.9621, test_f1: 0.6074
 epoch: 54, train_loss: 0.5935, test_loss: 0.9785, test_f1: 0.5881
 epoch: 55, train_loss: 0.5898, test_loss: 0.9761, test_f1: 0.6008
 epoch: 56, train_loss: 0.5758, test_loss: 0.9898, test_f1: 0.6060
 epoch: 57, train_loss: 0.5789, test_loss: 0.9882, test_f1: 0.5984
 epoch: 58, train_loss: 0.5769, test_loss: 1.0017, test_f1: 0.6014
 epoch: 59, train_loss: 0.5741, test_loss: 0.9662, test_f1: 0.6284
 epoch: 60, train_loss: 0.5776, test_loss: 0.9745, test_f1: 0.6084
 epoch: 61, train_loss: 0.5621, test_loss: 1.0035, test_f1: 0.6078
 epoch: 62, train_loss: 0.5590, test_loss: 1.0135, test_f1: 0.6060
 epoch: 63, train_loss: 0.5588, test_loss: 1.0244, test_f1: 0.6053
 epoch: 64, train_loss: 0.5526, test_loss: 1.0147, test_f1: 0.5977
 epoch: 65, train_loss: 0.5541, test_loss: 1.0153, test_f1: 0.5937
 epoch: 66, train_loss: 0.5421, test_loss: 1.0062, test_f1: 0.6011
 epoch: 67, train_loss: 0.5372, test_loss: 1.0124, test_f1: 0.6030
 epoch: 68, train_loss: 0.5367, test_loss: 1.0051, test_f1: 0.6023
 epoch: 69, train_loss: 0.5304, test_loss: 1.0371, test_f1: 0.6115
 epoch: 70, train_loss: 0.5358, test_loss: 1.0312, test_f1: 0.5980
 epoch: 71, train_loss: 0.5247, test_loss: 1.0432, test_f1: 0.5943
 epoch: 72, train_loss: 0.5396, test_loss: 1.0260, test_f1: 0.6020
 epoch: 73, train_loss: 0.5378, test_loss: 1.0486, test_f1: 0.6052
 epoch: 74, train_loss: 0.5315, test_loss: 1.0310, test_f1: 0.6091
 epoch: 75, train_loss: 0.5236, test_loss: 1.0277, test_f1: 0.6182
 epoch: 76, train_loss: 0.5250, test_loss: 1.0519, test_f1: 0.6182
 epoch: 77, train_loss: 0.5137, test_loss: 1.0435, test_f1: 0.6069
 epoch: 78, train_loss: 0.5244, test_loss: 1.0381, test_f1: 0.6069
 epoch: 79, train_loss: 0.5197, test_loss: 1.0535, test_f1: 0.6094
 epoch: 80, train_loss: 0.5260, test_loss: 1.0488, test_f1: 0.6132
 epoch: 81, train_loss: 0.5151, test_loss: 1.0671, test_f1: 0.5963
 epoch: 82, train_loss: 0.5127, test_loss: 1.0343, test_f1: 0.6058
 epoch: 83, train_loss: 0.5009, test_loss: 1.0542, test_f1: 0.6077
 epoch: 84, train_loss: 0.5092, test_loss: 1.0689, test_f1: 0.6185
 epoch: 85, train_loss: 0.5079, test_loss: 1.0726, test_f1: 0.6160
 epoch: 86, train_loss: 0.4936, test_loss: 1.0633, test_f1: 0.6300
 epoch: 87, train_loss: 0.4876, test_loss: 1.0854, test_f1: 0.6121
 epoch: 88, train_loss: 0.4931, test_loss: 1.0655, test_f1: 0.6208
 epoch: 89, train_loss: 0.4922, test_loss: 1.0791, test_f1: 0.6136
 epoch: 90, train_loss: 0.4948, test_loss: 1.0645, test_f1: 0.6076
 epoch: 91, train_loss: 0.5008, test_loss: 1.0909, test_f1: 0.6153
 epoch: 92, train_loss: 0.4861, test_loss: 1.0634, test_f1: 0.6170
 epoch: 93, train_loss: 0.4674, test_loss: 1.0736, test_f1: 0.6103
 epoch: 94, train_loss: 0.4698, test_loss: 1.1240, test_f1: 0.6189
 epoch: 95, train_loss: 0.4855, test_loss: 1.0995, test_f1: 0.6150
 epoch: 96, train_loss: 0.4650, test_loss: 1.0900, test_f1: 0.6336
 epoch: 97, train_loss: 0.4583, test_loss: 1.1194, test_f1: 0.6137
 epoch: 98, train_loss: 0.4672, test_loss: 1.1230, test_f1: 0.6192
 epoch: 99, train_loss: 0.4599, test_loss: 1.1341, test_f1: 0.6189
##################ITERATION #2 ****************************************
 epoch: 0, train_loss: 1.2567, test_loss: 1.3379, test_f1: 0.2270
 epoch: 1, train_loss: 1.1754, test_loss: 1.3148, test_f1: 0.2270
 epoch: 2, train_loss: 1.1388, test_loss: 1.2498, test_f1: 0.3556
 epoch: 3, train_loss: 1.1000, test_loss: 1.1611, test_f1: 0.4338
 epoch: 4, train_loss: 1.0668, test_loss: 1.0876, test_f1: 0.4580
 epoch: 5, train_loss: 1.0398, test_loss: 1.0364, test_f1: 0.4688
 epoch: 6, train_loss: 1.0168, test_loss: 0.9928, test_f1: 0.4779
 epoch: 7, train_loss: 0.9943, test_loss: 0.9696, test_f1: 0.4969
 epoch: 8, train_loss: 0.9690, test_loss: 0.9507, test_f1: 0.4906
 epoch: 9, train_loss: 0.9486, test_loss: 0.9331, test_f1: 0.5000
 epoch: 10, train_loss: 0.9297, test_loss: 0.9296, test_f1: 0.5127
 epoch: 11, train_loss: 0.9115, test_loss: 0.9262, test_f1: 0.5150
 epoch: 12, train_loss: 0.9014, test_loss: 0.9162, test_f1: 0.5210
 epoch: 13, train_loss: 0.8813, test_loss: 0.9171, test_f1: 0.5300
 epoch: 14, train_loss: 0.8691, test_loss: 0.9353, test_f1: 0.5216
 epoch: 15, train_loss: 0.8633, test_loss: 0.9090, test_f1: 0.5122
 epoch: 16, train_loss: 0.8465, test_loss: 0.9004, test_f1: 0.5333
 epoch: 17, train_loss: 0.8343, test_loss: 0.9523, test_f1: 0.5260
 epoch: 18, train_loss: 0.8353, test_loss: 0.9153, test_f1: 0.5294
 epoch: 19, train_loss: 0.8157, test_loss: 0.9341, test_f1: 0.5310
 epoch: 20, train_loss: 0.8197, test_loss: 0.9235, test_f1: 0.5319
 epoch: 21, train_loss: 0.8012, test_loss: 0.9169, test_f1: 0.5425
 epoch: 22, train_loss: 0.7891, test_loss: 0.9349, test_f1: 0.5437
 epoch: 23, train_loss: 0.7919, test_loss: 0.9315, test_f1: 0.5308
 epoch: 24, train_loss: 0.7767, test_loss: 0.9235, test_f1: 0.5532
 epoch: 25, train_loss: 0.7562, test_loss: 0.9261, test_f1: 0.5632
 epoch: 26, train_loss: 0.7548, test_loss: 0.9081, test_f1: 0.5409
 epoch: 27, train_loss: 0.7517, test_loss: 0.9269, test_f1: 0.5495
 epoch: 28, train_loss: 0.7328, test_loss: 0.9408, test_f1: 0.5640
 epoch: 29, train_loss: 0.7282, test_loss: 0.9074, test_f1: 0.5767
 epoch: 30, train_loss: 0.7183, test_loss: 0.9064, test_f1: 0.5645
 epoch: 31, train_loss: 0.7133, test_loss: 0.9456, test_f1: 0.5659
 epoch: 32, train_loss: 0.7004, test_loss: 0.9125, test_f1: 0.5587
 epoch: 33, train_loss: 0.6916, test_loss: 0.9181, test_f1: 0.5955
 epoch: 34, train_loss: 0.6944, test_loss: 0.9003, test_f1: 0.5821
 epoch: 35, train_loss: 0.6677, test_loss: 0.9298, test_f1: 0.5854
 epoch: 36, train_loss: 0.6746, test_loss: 0.9162, test_f1: 0.5900
 epoch: 37, train_loss: 0.6726, test_loss: 0.9273, test_f1: 0.5916
 epoch: 38, train_loss: 0.6720, test_loss: 0.9058, test_f1: 0.6114
 epoch: 39, train_loss: 0.6658, test_loss: 0.9263, test_f1: 0.5927
 epoch: 40, train_loss: 0.6579, test_loss: 0.9131, test_f1: 0.6135
 epoch: 41, train_loss: 0.6510, test_loss: 0.9335, test_f1: 0.5736
 epoch: 42, train_loss: 0.6402, test_loss: 0.9208, test_f1: 0.5922
 epoch: 43, train_loss: 0.6355, test_loss: 0.9246, test_f1: 0.6020
 epoch: 44, train_loss: 0.6246, test_loss: 0.9140, test_f1: 0.6185
 epoch: 45, train_loss: 0.6231, test_loss: 0.9497, test_f1: 0.6081
 epoch: 46, train_loss: 0.6084, test_loss: 0.9391, test_f1: 0.6070
 epoch: 47, train_loss: 0.6161, test_loss: 0.9286, test_f1: 0.6011
 epoch: 48, train_loss: 0.5905, test_loss: 0.9358, test_f1: 0.6110
 epoch: 49, train_loss: 0.6052, test_loss: 0.9464, test_f1: 0.6157
 epoch: 50, train_loss: 0.6040, test_loss: 0.9579, test_f1: 0.5918
 epoch: 51, train_loss: 0.5788, test_loss: 0.9222, test_f1: 0.6167
 epoch: 52, train_loss: 0.5679, test_loss: 0.9328, test_f1: 0.6206
 epoch: 53, train_loss: 0.5546, test_loss: 0.9450, test_f1: 0.6167
 epoch: 54, train_loss: 0.5690, test_loss: 0.9377, test_f1: 0.6086
 epoch: 55, train_loss: 0.5651, test_loss: 0.9275, test_f1: 0.6219
 epoch: 56, train_loss: 0.5581, test_loss: 0.9326, test_f1: 0.6290
 epoch: 57, train_loss: 0.5581, test_loss: 0.9324, test_f1: 0.6167
 epoch: 58, train_loss: 0.5502, test_loss: 0.9383, test_f1: 0.6125
 epoch: 59, train_loss: 0.5451, test_loss: 0.9457, test_f1: 0.6077
 epoch: 60, train_loss: 0.5416, test_loss: 0.9337, test_f1: 0.6260
 epoch: 61, train_loss: 0.5390, test_loss: 0.9459, test_f1: 0.6208
 epoch: 62, train_loss: 0.5402, test_loss: 0.9723, test_f1: 0.6052
 epoch: 63, train_loss: 0.5296, test_loss: 0.9507, test_f1: 0.6318
 epoch: 64, train_loss: 0.5321, test_loss: 0.9906, test_f1: 0.6240
 epoch: 65, train_loss: 0.5260, test_loss: 0.9648, test_f1: 0.6307
 epoch: 66, train_loss: 0.5284, test_loss: 0.9810, test_f1: 0.6314
 epoch: 67, train_loss: 0.5182, test_loss: 0.9750, test_f1: 0.6047
 epoch: 68, train_loss: 0.5192, test_loss: 0.9878, test_f1: 0.6075
 epoch: 69, train_loss: 0.5070, test_loss: 0.9647, test_f1: 0.6242
 epoch: 70, train_loss: 0.5257, test_loss: 0.9904, test_f1: 0.6239
 epoch: 71, train_loss: 0.5070, test_loss: 0.9924, test_f1: 0.6269
 epoch: 72, train_loss: 0.5043, test_loss: 0.9795, test_f1: 0.6301
 epoch: 73, train_loss: 0.5142, test_loss: 0.9727, test_f1: 0.6252
 epoch: 74, train_loss: 0.4878, test_loss: 1.0123, test_f1: 0.6316
 epoch: 75, train_loss: 0.4972, test_loss: 0.9868, test_f1: 0.6211
 epoch: 76, train_loss: 0.4987, test_loss: 1.0171, test_f1: 0.6247
 epoch: 77, train_loss: 0.5025, test_loss: 1.0037, test_f1: 0.6261
 epoch: 78, train_loss: 0.4932, test_loss: 1.0149, test_f1: 0.6228
 epoch: 79, train_loss: 0.4959, test_loss: 1.0197, test_f1: 0.6172
 epoch: 80, train_loss: 0.4853, test_loss: 1.0243, test_f1: 0.6353
 epoch: 81, train_loss: 0.4800, test_loss: 1.0064, test_f1: 0.6350
 epoch: 82, train_loss: 0.4799, test_loss: 1.0494, test_f1: 0.6203
 epoch: 83, train_loss: 0.4800, test_loss: 1.0199, test_f1: 0.6339
 epoch: 84, train_loss: 0.4670, test_loss: 1.0553, test_f1: 0.6257
 epoch: 85, train_loss: 0.4749, test_loss: 1.0441, test_f1: 0.6357
 epoch: 86, train_loss: 0.4613, test_loss: 1.0952, test_f1: 0.6206
 epoch: 87, train_loss: 0.4650, test_loss: 1.0592, test_f1: 0.6337
 epoch: 88, train_loss: 0.4764, test_loss: 1.0758, test_f1: 0.6285
 epoch: 89, train_loss: 0.4562, test_loss: 1.0503, test_f1: 0.6309
 epoch: 90, train_loss: 0.4529, test_loss: 1.0696, test_f1: 0.6261
 epoch: 91, train_loss: 0.4607, test_loss: 1.0820, test_f1: 0.6254
 epoch: 92, train_loss: 0.4579, test_loss: 1.0849, test_f1: 0.6354
 epoch: 93, train_loss: 0.4453, test_loss: 1.0477, test_f1: 0.6228
 epoch: 94, train_loss: 0.4560, test_loss: 1.0758, test_f1: 0.6105
 epoch: 95, train_loss: 0.4358, test_loss: 1.1178, test_f1: 0.6203
 epoch: 96, train_loss: 0.4431, test_loss: 1.0766, test_f1: 0.6259
 epoch: 97, train_loss: 0.4383, test_loss: 1.1182, test_f1: 0.6320
 epoch: 98, train_loss: 0.4212, test_loss: 1.0819, test_f1: 0.6219
 epoch: 99, train_loss: 0.4327, test_loss: 1.0943, test_f1: 0.6284
##################ITERATION #3 ****************************************
 epoch: 0, train_loss: 1.2546, test_loss: 1.3368, test_f1: 0.2270
 epoch: 1, train_loss: 1.1677, test_loss: 1.3020, test_f1: 0.2295
 epoch: 2, train_loss: 1.1289, test_loss: 1.2415, test_f1: 0.3456
 epoch: 3, train_loss: 1.0923, test_loss: 1.1661, test_f1: 0.3876
 epoch: 4, train_loss: 1.0680, test_loss: 1.0947, test_f1: 0.4575
 epoch: 5, train_loss: 1.0486, test_loss: 1.0288, test_f1: 0.4797
 epoch: 6, train_loss: 1.0247, test_loss: 0.9955, test_f1: 0.4870
 epoch: 7, train_loss: 1.0109, test_loss: 0.9657, test_f1: 0.5122
 epoch: 8, train_loss: 0.9792, test_loss: 0.9517, test_f1: 0.5087
 epoch: 9, train_loss: 0.9595, test_loss: 0.9341, test_f1: 0.5040
 epoch: 10, train_loss: 0.9469, test_loss: 0.9425, test_f1: 0.5128
 epoch: 11, train_loss: 0.9358, test_loss: 0.9468, test_f1: 0.5409
 epoch: 12, train_loss: 0.9279, test_loss: 0.9138, test_f1: 0.5366
 epoch: 13, train_loss: 0.9109, test_loss: 0.9125, test_f1: 0.5179
 epoch: 14, train_loss: 0.8962, test_loss: 0.9180, test_f1: 0.5328
 epoch: 15, train_loss: 0.8865, test_loss: 0.8996, test_f1: 0.5768
 epoch: 16, train_loss: 0.8673, test_loss: 0.9096, test_f1: 0.5337
 epoch: 17, train_loss: 0.8652, test_loss: 0.9005, test_f1: 0.5583
 epoch: 18, train_loss: 0.8528, test_loss: 0.8998, test_f1: 0.5598
 epoch: 19, train_loss: 0.8417, test_loss: 0.9142, test_f1: 0.5498
 epoch: 20, train_loss: 0.8221, test_loss: 0.9356, test_f1: 0.5453
 epoch: 21, train_loss: 0.8205, test_loss: 0.9137, test_f1: 0.5436
 epoch: 22, train_loss: 0.8130, test_loss: 0.8877, test_f1: 0.5592
 epoch: 23, train_loss: 0.8031, test_loss: 0.9083, test_f1: 0.5641
 epoch: 24, train_loss: 0.8004, test_loss: 0.9173, test_f1: 0.5625
 epoch: 25, train_loss: 0.7946, test_loss: 0.8898, test_f1: 0.5893
 epoch: 26, train_loss: 0.7856, test_loss: 0.8981, test_f1: 0.5839
 epoch: 27, train_loss: 0.7741, test_loss: 0.8948, test_f1: 0.5761
 epoch: 28, train_loss: 0.7768, test_loss: 0.9165, test_f1: 0.5849
 epoch: 29, train_loss: 0.7672, test_loss: 0.9006, test_f1: 0.5985
 epoch: 30, train_loss: 0.7614, test_loss: 0.9156, test_f1: 0.5751
 epoch: 31, train_loss: 0.7427, test_loss: 0.8905, test_f1: 0.5957
 epoch: 32, train_loss: 0.7384, test_loss: 0.8871, test_f1: 0.5953
 epoch: 33, train_loss: 0.7286, test_loss: 0.9133, test_f1: 0.5854
 epoch: 34, train_loss: 0.7198, test_loss: 0.9165, test_f1: 0.6130
 epoch: 35, train_loss: 0.7188, test_loss: 0.9120, test_f1: 0.6063
 epoch: 36, train_loss: 0.7148, test_loss: 0.9202, test_f1: 0.6085
 epoch: 37, train_loss: 0.7010, test_loss: 0.9720, test_f1: 0.5678
 epoch: 38, train_loss: 0.7047, test_loss: 0.9158, test_f1: 0.6023
 epoch: 39, train_loss: 0.6850, test_loss: 0.9087, test_f1: 0.6123
 epoch: 40, train_loss: 0.6918, test_loss: 0.9159, test_f1: 0.6020
 epoch: 41, train_loss: 0.6881, test_loss: 0.9133, test_f1: 0.6158
 epoch: 42, train_loss: 0.6784, test_loss: 0.9198, test_f1: 0.6062
 epoch: 43, train_loss: 0.6723, test_loss: 0.9256, test_f1: 0.5983
 epoch: 44, train_loss: 0.6622, test_loss: 0.9226, test_f1: 0.6096
 epoch: 45, train_loss: 0.6554, test_loss: 0.9286, test_f1: 0.6022
 epoch: 46, train_loss: 0.6567, test_loss: 0.9753, test_f1: 0.5901
 epoch: 47, train_loss: 0.6472, test_loss: 0.9290, test_f1: 0.5953
 epoch: 48, train_loss: 0.6462, test_loss: 0.9419, test_f1: 0.6315
 epoch: 49, train_loss: 0.6430, test_loss: 0.9622, test_f1: 0.6107
 epoch: 50, train_loss: 0.6378, test_loss: 0.9436, test_f1: 0.5966
 epoch: 51, train_loss: 0.6264, test_loss: 0.9075, test_f1: 0.6168
 epoch: 52, train_loss: 0.6209, test_loss: 0.9241, test_f1: 0.6168
 epoch: 53, train_loss: 0.6050, test_loss: 0.9305, test_f1: 0.6193
 epoch: 54, train_loss: 0.6016, test_loss: 0.9244, test_f1: 0.6277
 epoch: 55, train_loss: 0.6007, test_loss: 0.9418, test_f1: 0.6224
 epoch: 56, train_loss: 0.6031, test_loss: 0.9270, test_f1: 0.6200
 epoch: 57, train_loss: 0.5912, test_loss: 0.9362, test_f1: 0.6219
 epoch: 58, train_loss: 0.5931, test_loss: 0.9550, test_f1: 0.6217
 epoch: 59, train_loss: 0.5881, test_loss: 0.9567, test_f1: 0.6240
 epoch: 60, train_loss: 0.5880, test_loss: 0.9541, test_f1: 0.6225
 epoch: 61, train_loss: 0.5822, test_loss: 0.9463, test_f1: 0.6202
 epoch: 62, train_loss: 0.5653, test_loss: 0.9494, test_f1: 0.6239
 epoch: 63, train_loss: 0.5845, test_loss: 0.9775, test_f1: 0.6261
 epoch: 64, train_loss: 0.5735, test_loss: 0.9635, test_f1: 0.6313
 epoch: 65, train_loss: 0.5696, test_loss: 0.9546, test_f1: 0.6330
 epoch: 66, train_loss: 0.5701, test_loss: 0.9503, test_f1: 0.6169
 epoch: 67, train_loss: 0.5674, test_loss: 0.9811, test_f1: 0.6298
 epoch: 68, train_loss: 0.5472, test_loss: 0.9800, test_f1: 0.6108
 epoch: 69, train_loss: 0.5511, test_loss: 0.9755, test_f1: 0.6275
 epoch: 70, train_loss: 0.5660, test_loss: 0.9853, test_f1: 0.6244
 epoch: 71, train_loss: 0.5455, test_loss: 0.9725, test_f1: 0.6213
 epoch: 72, train_loss: 0.5582, test_loss: 0.9899, test_f1: 0.6178
 epoch: 73, train_loss: 0.5378, test_loss: 0.9898, test_f1: 0.6215
 epoch: 74, train_loss: 0.5387, test_loss: 1.0032, test_f1: 0.6229
 epoch: 75, train_loss: 0.5484, test_loss: 0.9864, test_f1: 0.6175
 epoch: 76, train_loss: 0.5321, test_loss: 0.9987, test_f1: 0.6263
 epoch: 77, train_loss: 0.5271, test_loss: 1.0145, test_f1: 0.6196
 epoch: 78, train_loss: 0.5216, test_loss: 1.0166, test_f1: 0.6095
 epoch: 79, train_loss: 0.5300, test_loss: 1.0169, test_f1: 0.6196
 epoch: 80, train_loss: 0.5186, test_loss: 1.0084, test_f1: 0.6210
 epoch: 81, train_loss: 0.5166, test_loss: 1.0188, test_f1: 0.6184
 epoch: 82, train_loss: 0.5211, test_loss: 1.0252, test_f1: 0.6170
 epoch: 83, train_loss: 0.5140, test_loss: 1.0188, test_f1: 0.6088
 epoch: 84, train_loss: 0.5099, test_loss: 1.0187, test_f1: 0.6050
 epoch: 85, train_loss: 0.5178, test_loss: 1.0493, test_f1: 0.6185
 epoch: 86, train_loss: 0.5122, test_loss: 1.0324, test_f1: 0.6079
 epoch: 87, train_loss: 0.5114, test_loss: 1.0488, test_f1: 0.6212
 epoch: 88, train_loss: 0.5000, test_loss: 1.0557, test_f1: 0.6160
 epoch: 89, train_loss: 0.4976, test_loss: 1.0436, test_f1: 0.6242
 epoch: 90, train_loss: 0.4991, test_loss: 1.0500, test_f1: 0.6256
 epoch: 91, train_loss: 0.4974, test_loss: 1.0579, test_f1: 0.6097
 epoch: 92, train_loss: 0.5113, test_loss: 1.0737, test_f1: 0.6309
 epoch: 93, train_loss: 0.4999, test_loss: 1.0764, test_f1: 0.6205
 epoch: 94, train_loss: 0.4886, test_loss: 1.0732, test_f1: 0.6272
 epoch: 95, train_loss: 0.4955, test_loss: 1.0846, test_f1: 0.6303
 epoch: 96, train_loss: 0.4807, test_loss: 1.0776, test_f1: 0.6177
 epoch: 97, train_loss: 0.4929, test_loss: 1.1014, test_f1: 0.6217
 epoch: 98, train_loss: 0.4850, test_loss: 1.0711, test_f1: 0.6197
 epoch: 99, train_loss: 0.4928, test_loss: 1.0795, test_f1: 0.6221
##################ITERATION #4 ****************************************
 epoch: 0, train_loss: 1.2319, test_loss: 1.3526, test_f1: 0.2270
 epoch: 1, train_loss: 1.1377, test_loss: 1.3487, test_f1: 0.2434
 epoch: 2, train_loss: 1.0866, test_loss: 1.2393, test_f1: 0.3537
 epoch: 3, train_loss: 1.0567, test_loss: 1.1535, test_f1: 0.4197
 epoch: 4, train_loss: 1.0318, test_loss: 1.0831, test_f1: 0.4569
 epoch: 5, train_loss: 1.0015, test_loss: 1.0259, test_f1: 0.4722
 epoch: 6, train_loss: 0.9829, test_loss: 0.9887, test_f1: 0.4621
 epoch: 7, train_loss: 0.9583, test_loss: 0.9528, test_f1: 0.4987
 epoch: 8, train_loss: 0.9432, test_loss: 0.9447, test_f1: 0.5146
 epoch: 9, train_loss: 0.9241, test_loss: 0.9415, test_f1: 0.4973
 epoch: 10, train_loss: 0.9140, test_loss: 0.9481, test_f1: 0.5050
 epoch: 11, train_loss: 0.8912, test_loss: 0.9289, test_f1: 0.5253
 epoch: 12, train_loss: 0.8939, test_loss: 0.9353, test_f1: 0.5202
 epoch: 13, train_loss: 0.8746, test_loss: 0.9155, test_f1: 0.5293
 epoch: 14, train_loss: 0.8678, test_loss: 0.9178, test_f1: 0.5221
 epoch: 15, train_loss: 0.8516, test_loss: 0.9220, test_f1: 0.5262
 epoch: 16, train_loss: 0.8512, test_loss: 0.9242, test_f1: 0.5214
 epoch: 17, train_loss: 0.8332, test_loss: 0.9243, test_f1: 0.5368
 epoch: 18, train_loss: 0.8193, test_loss: 0.9277, test_f1: 0.5341
 epoch: 19, train_loss: 0.8051, test_loss: 0.9262, test_f1: 0.5281
 epoch: 20, train_loss: 0.7993, test_loss: 0.9163, test_f1: 0.5503
 epoch: 21, train_loss: 0.7971, test_loss: 0.9381, test_f1: 0.5491
 epoch: 22, train_loss: 0.7931, test_loss: 0.9166, test_f1: 0.5575
 epoch: 23, train_loss: 0.7744, test_loss: 0.9550, test_f1: 0.5540
 epoch: 24, train_loss: 0.7711, test_loss: 0.9052, test_f1: 0.5697
 epoch: 25, train_loss: 0.7666, test_loss: 0.9340, test_f1: 0.5457
 epoch: 26, train_loss: 0.7611, test_loss: 0.9535, test_f1: 0.5635
 epoch: 27, train_loss: 0.7456, test_loss: 0.9424, test_f1: 0.5599
 epoch: 28, train_loss: 0.7482, test_loss: 0.9348, test_f1: 0.5486
 epoch: 29, train_loss: 0.7279, test_loss: 0.9311, test_f1: 0.5524
 epoch: 30, train_loss: 0.7194, test_loss: 0.9362, test_f1: 0.5690
 epoch: 31, train_loss: 0.7213, test_loss: 0.9416, test_f1: 0.5635
 epoch: 32, train_loss: 0.7136, test_loss: 0.9236, test_f1: 0.5637
 epoch: 33, train_loss: 0.7172, test_loss: 0.9197, test_f1: 0.5797
 epoch: 34, train_loss: 0.6968, test_loss: 0.9203, test_f1: 0.5910
 epoch: 35, train_loss: 0.6797, test_loss: 0.9350, test_f1: 0.5732
 epoch: 36, train_loss: 0.6784, test_loss: 0.9294, test_f1: 0.6144
 epoch: 37, train_loss: 0.6842, test_loss: 0.9452, test_f1: 0.5796
 epoch: 38, train_loss: 0.6798, test_loss: 0.9460, test_f1: 0.5937
 epoch: 39, train_loss: 0.6751, test_loss: 0.9649, test_f1: 0.5873
 epoch: 40, train_loss: 0.6610, test_loss: 0.9745, test_f1: 0.5940
 epoch: 41, train_loss: 0.6546, test_loss: 0.9263, test_f1: 0.6264
 epoch: 42, train_loss: 0.6435, test_loss: 0.9939, test_f1: 0.5838
 epoch: 43, train_loss: 0.6403, test_loss: 0.9701, test_f1: 0.5933
 epoch: 44, train_loss: 0.6218, test_loss: 0.9533, test_f1: 0.6039
 epoch: 45, train_loss: 0.6198, test_loss: 0.9670, test_f1: 0.5958
 epoch: 46, train_loss: 0.6273, test_loss: 0.9722, test_f1: 0.6108
 epoch: 47, train_loss: 0.6240, test_loss: 0.9866, test_f1: 0.5905
 epoch: 48, train_loss: 0.6071, test_loss: 1.0249, test_f1: 0.5858
 epoch: 49, train_loss: 0.6049, test_loss: 0.9678, test_f1: 0.5972
 epoch: 50, train_loss: 0.6142, test_loss: 1.0210, test_f1: 0.5885
 epoch: 51, train_loss: 0.5931, test_loss: 1.0050, test_f1: 0.6031
 epoch: 52, train_loss: 0.5842, test_loss: 0.9737, test_f1: 0.5901
 epoch: 53, train_loss: 0.5832, test_loss: 0.9794, test_f1: 0.6022
 epoch: 54, train_loss: 0.5753, test_loss: 0.9675, test_f1: 0.6040
 epoch: 55, train_loss: 0.5686, test_loss: 0.9804, test_f1: 0.6073
 epoch: 56, train_loss: 0.5559, test_loss: 0.9743, test_f1: 0.6022
 epoch: 57, train_loss: 0.5601, test_loss: 0.9917, test_f1: 0.5959
 epoch: 58, train_loss: 0.5676, test_loss: 1.0007, test_f1: 0.6040
 epoch: 59, train_loss: 0.5525, test_loss: 0.9962, test_f1: 0.6021
 epoch: 60, train_loss: 0.5388, test_loss: 1.0181, test_f1: 0.6071
 epoch: 61, train_loss: 0.5391, test_loss: 0.9697, test_f1: 0.6130
 epoch: 62, train_loss: 0.5392, test_loss: 0.9897, test_f1: 0.6049
 epoch: 63, train_loss: 0.5399, test_loss: 0.9999, test_f1: 0.5929
 epoch: 64, train_loss: 0.5427, test_loss: 1.0290, test_f1: 0.6022
 epoch: 65, train_loss: 0.5441, test_loss: 0.9969, test_f1: 0.6016
 epoch: 66, train_loss: 0.5306, test_loss: 1.0277, test_f1: 0.5972
 epoch: 67, train_loss: 0.5287, test_loss: 1.0198, test_f1: 0.5907
 epoch: 68, train_loss: 0.5312, test_loss: 1.0566, test_f1: 0.6036
 epoch: 69, train_loss: 0.5206, test_loss: 1.0027, test_f1: 0.6131
 epoch: 70, train_loss: 0.5361, test_loss: 1.0662, test_f1: 0.5995
 epoch: 71, train_loss: 0.5186, test_loss: 1.0255, test_f1: 0.5868
 epoch: 72, train_loss: 0.5070, test_loss: 1.0601, test_f1: 0.5829
 epoch: 73, train_loss: 0.5002, test_loss: 1.0734, test_f1: 0.5976
 epoch: 74, train_loss: 0.5061, test_loss: 1.0403, test_f1: 0.6032
 epoch: 75, train_loss: 0.5127, test_loss: 1.0693, test_f1: 0.5933
 epoch: 76, train_loss: 0.5055, test_loss: 1.0586, test_f1: 0.6041
 epoch: 77, train_loss: 0.4994, test_loss: 1.0276, test_f1: 0.6035
 epoch: 78, train_loss: 0.4938, test_loss: 1.0728, test_f1: 0.6044
 epoch: 79, train_loss: 0.4895, test_loss: 1.0570, test_f1: 0.5990
 epoch: 80, train_loss: 0.4963, test_loss: 1.0246, test_f1: 0.6015
 epoch: 81, train_loss: 0.4821, test_loss: 1.0465, test_f1: 0.6053
 epoch: 82, train_loss: 0.4875, test_loss: 1.0488, test_f1: 0.6002
 epoch: 83, train_loss: 0.4897, test_loss: 1.0638, test_f1: 0.5919
 epoch: 84, train_loss: 0.5019, test_loss: 1.0744, test_f1: 0.5977
 epoch: 85, train_loss: 0.4826, test_loss: 1.0843, test_f1: 0.5911
 epoch: 86, train_loss: 0.4679, test_loss: 1.0739, test_f1: 0.5947
 epoch: 87, train_loss: 0.4771, test_loss: 1.0589, test_f1: 0.6050
 epoch: 88, train_loss: 0.4798, test_loss: 1.0837, test_f1: 0.5932
 epoch: 89, train_loss: 0.4588, test_loss: 1.0597, test_f1: 0.6241
 epoch: 90, train_loss: 0.4685, test_loss: 1.0710, test_f1: 0.6103
 epoch: 91, train_loss: 0.4496, test_loss: 1.1043, test_f1: 0.5974
 epoch: 92, train_loss: 0.4633, test_loss: 1.0951, test_f1: 0.5841
 epoch: 93, train_loss: 0.4507, test_loss: 1.1167, test_f1: 0.6100
 epoch: 94, train_loss: 0.4607, test_loss: 1.1385, test_f1: 0.5945
 epoch: 95, train_loss: 0.4472, test_loss: 1.1413, test_f1: 0.5966
 epoch: 96, train_loss: 0.4467, test_loss: 1.1627, test_f1: 0.6015
 epoch: 97, train_loss: 0.4662, test_loss: 1.1369, test_f1: 0.5925
 epoch: 98, train_loss: 0.4488, test_loss: 1.1442, test_f1: 0.6130
 epoch: 99, train_loss: 0.4384, test_loss: 1.1357, test_f1: 0.5965
##################ITERATION #5 ****************************************
 epoch: 0, train_loss: 1.2515, test_loss: 1.3420, test_f1: 0.2270
 epoch: 1, train_loss: 1.1541, test_loss: 1.3190, test_f1: 0.3496
 epoch: 2, train_loss: 1.1075, test_loss: 1.2600, test_f1: 0.3064
 epoch: 3, train_loss: 1.0680, test_loss: 1.1659, test_f1: 0.3670
 epoch: 4, train_loss: 1.0580, test_loss: 1.0769, test_f1: 0.4063
 epoch: 5, train_loss: 1.0207, test_loss: 1.0103, test_f1: 0.4682
 epoch: 6, train_loss: 1.0034, test_loss: 0.9557, test_f1: 0.4882
 epoch: 7, train_loss: 0.9814, test_loss: 0.9384, test_f1: 0.4893
 epoch: 8, train_loss: 0.9501, test_loss: 0.9297, test_f1: 0.5117
 epoch: 9, train_loss: 0.9518, test_loss: 0.9331, test_f1: 0.5223
 epoch: 10, train_loss: 0.9285, test_loss: 0.9270, test_f1: 0.5119
 epoch: 11, train_loss: 0.9126, test_loss: 0.9216, test_f1: 0.5124
 epoch: 12, train_loss: 0.9065, test_loss: 0.9177, test_f1: 0.5373
 epoch: 13, train_loss: 0.8847, test_loss: 0.9116, test_f1: 0.5340
 epoch: 14, train_loss: 0.8810, test_loss: 0.9248, test_f1: 0.5025
 epoch: 15, train_loss: 0.8674, test_loss: 0.9234, test_f1: 0.5112
 epoch: 16, train_loss: 0.8630, test_loss: 0.9219, test_f1: 0.5288
 epoch: 17, train_loss: 0.8560, test_loss: 0.9101, test_f1: 0.5383
 epoch: 18, train_loss: 0.8331, test_loss: 0.9243, test_f1: 0.5232
 epoch: 19, train_loss: 0.8246, test_loss: 0.9190, test_f1: 0.5453
 epoch: 20, train_loss: 0.8094, test_loss: 0.9320, test_f1: 0.5437
 epoch: 21, train_loss: 0.7953, test_loss: 0.9035, test_f1: 0.5644
 epoch: 22, train_loss: 0.7882, test_loss: 0.9102, test_f1: 0.5527
 epoch: 23, train_loss: 0.7920, test_loss: 0.9037, test_f1: 0.5491
 epoch: 24, train_loss: 0.7721, test_loss: 0.9256, test_f1: 0.5345
 epoch: 25, train_loss: 0.7775, test_loss: 0.9090, test_f1: 0.5444
 epoch: 26, train_loss: 0.7591, test_loss: 0.9376, test_f1: 0.5407
 epoch: 27, train_loss: 0.7587, test_loss: 0.9346, test_f1: 0.5631
 epoch: 28, train_loss: 0.7470, test_loss: 0.9454, test_f1: 0.5433
 epoch: 29, train_loss: 0.7409, test_loss: 0.9428, test_f1: 0.5546
 epoch: 30, train_loss: 0.7252, test_loss: 0.9276, test_f1: 0.5526
 epoch: 31, train_loss: 0.7182, test_loss: 0.9655, test_f1: 0.5570
 epoch: 32, train_loss: 0.7178, test_loss: 0.9702, test_f1: 0.5502
 epoch: 33, train_loss: 0.7127, test_loss: 0.9678, test_f1: 0.5657
 epoch: 34, train_loss: 0.7010, test_loss: 0.9584, test_f1: 0.5640
 epoch: 35, train_loss: 0.6958, test_loss: 0.9644, test_f1: 0.5867
 epoch: 36, train_loss: 0.6781, test_loss: 0.9800, test_f1: 0.5617
 epoch: 37, train_loss: 0.6793, test_loss: 0.9766, test_f1: 0.5768
 epoch: 38, train_loss: 0.6888, test_loss: 0.9954, test_f1: 0.5610
 epoch: 39, train_loss: 0.6866, test_loss: 0.9620, test_f1: 0.5910
 epoch: 40, train_loss: 0.6673, test_loss: 0.9760, test_f1: 0.5892
 epoch: 41, train_loss: 0.6677, test_loss: 0.9573, test_f1: 0.6053
 epoch: 42, train_loss: 0.6498, test_loss: 0.9996, test_f1: 0.6016
 epoch: 43, train_loss: 0.6509, test_loss: 0.9820, test_f1: 0.5982
 epoch: 44, train_loss: 0.6358, test_loss: 0.9896, test_f1: 0.6078
 epoch: 45, train_loss: 0.6397, test_loss: 0.9711, test_f1: 0.6068
 epoch: 46, train_loss: 0.6411, test_loss: 0.9908, test_f1: 0.5836
 epoch: 47, train_loss: 0.6184, test_loss: 1.0324, test_f1: 0.5855
 epoch: 48, train_loss: 0.6228, test_loss: 1.0011, test_f1: 0.5853
 epoch: 49, train_loss: 0.6076, test_loss: 1.0033, test_f1: 0.5900
 epoch: 50, train_loss: 0.6040, test_loss: 1.0695, test_f1: 0.6012
 epoch: 51, train_loss: 0.5934, test_loss: 0.9989, test_f1: 0.6157
 epoch: 52, train_loss: 0.5780, test_loss: 1.0370, test_f1: 0.6058
 epoch: 53, train_loss: 0.5844, test_loss: 0.9952, test_f1: 0.6159
 epoch: 54, train_loss: 0.5741, test_loss: 1.0276, test_f1: 0.6049
 epoch: 55, train_loss: 0.5811, test_loss: 1.0318, test_f1: 0.6059
 epoch: 56, train_loss: 0.5753, test_loss: 1.0387, test_f1: 0.6172
 epoch: 57, train_loss: 0.5607, test_loss: 1.0742, test_f1: 0.6112
 epoch: 58, train_loss: 0.5588, test_loss: 1.0529, test_f1: 0.6097
 epoch: 59, train_loss: 0.5613, test_loss: 1.0442, test_f1: 0.6181
 epoch: 60, train_loss: 0.5630, test_loss: 1.0313, test_f1: 0.6092
 epoch: 61, train_loss: 0.5568, test_loss: 1.0511, test_f1: 0.6231
 epoch: 62, train_loss: 0.5516, test_loss: 1.0283, test_f1: 0.6228
 epoch: 63, train_loss: 0.5528, test_loss: 1.0493, test_f1: 0.6073
 epoch: 64, train_loss: 0.5559, test_loss: 1.0770, test_f1: 0.6028
 epoch: 65, train_loss: 0.5446, test_loss: 1.0512, test_f1: 0.6224
 epoch: 66, train_loss: 0.5468, test_loss: 1.0921, test_f1: 0.6032
 epoch: 67, train_loss: 0.5435, test_loss: 1.0937, test_f1: 0.5989
 epoch: 68, train_loss: 0.5309, test_loss: 1.0855, test_f1: 0.6107
 epoch: 69, train_loss: 0.5251, test_loss: 1.0789, test_f1: 0.6097
 epoch: 70, train_loss: 0.5276, test_loss: 1.0801, test_f1: 0.6272
 epoch: 71, train_loss: 0.5220, test_loss: 1.1189, test_f1: 0.6214
 epoch: 72, train_loss: 0.5168, test_loss: 1.0947, test_f1: 0.6141
 epoch: 73, train_loss: 0.5352, test_loss: 1.0820, test_f1: 0.6191
 epoch: 74, train_loss: 0.5169, test_loss: 1.0965, test_f1: 0.6190
 epoch: 75, train_loss: 0.5121, test_loss: 1.1100, test_f1: 0.6048
 epoch: 76, train_loss: 0.5215, test_loss: 1.1188, test_f1: 0.6125
 epoch: 77, train_loss: 0.5240, test_loss: 1.0955, test_f1: 0.6196
 epoch: 78, train_loss: 0.5217, test_loss: 1.1068, test_f1: 0.6144
 epoch: 79, train_loss: 0.5105, test_loss: 1.0952, test_f1: 0.6053
 epoch: 80, train_loss: 0.5204, test_loss: 1.1100, test_f1: 0.6110
 epoch: 81, train_loss: 0.4955, test_loss: 1.0941, test_f1: 0.6180
 epoch: 82, train_loss: 0.5189, test_loss: 1.1322, test_f1: 0.5982
 epoch: 83, train_loss: 0.4858, test_loss: 1.0923, test_f1: 0.6012
 epoch: 84, train_loss: 0.5008, test_loss: 1.1476, test_f1: 0.5930
 epoch: 85, train_loss: 0.4876, test_loss: 1.1395, test_f1: 0.6179
 epoch: 86, train_loss: 0.4901, test_loss: 1.1236, test_f1: 0.6114
 epoch: 87, train_loss: 0.4763, test_loss: 1.1480, test_f1: 0.6203
 epoch: 88, train_loss: 0.4910, test_loss: 1.1448, test_f1: 0.5978
 epoch: 89, train_loss: 0.4800, test_loss: 1.1802, test_f1: 0.5925
 epoch: 90, train_loss: 0.4724, test_loss: 1.1779, test_f1: 0.6185
 epoch: 91, train_loss: 0.4709, test_loss: 1.1599, test_f1: 0.6256
 epoch: 92, train_loss: 0.4798, test_loss: 1.1860, test_f1: 0.6095
 epoch: 93, train_loss: 0.4661, test_loss: 1.1660, test_f1: 0.6083
 epoch: 94, train_loss: 0.4614, test_loss: 1.1339, test_f1: 0.6151
 epoch: 95, train_loss: 0.4557, test_loss: 1.1469, test_f1: 0.6105
 epoch: 96, train_loss: 0.4788, test_loss: 1.1420, test_f1: 0.6223
 epoch: 97, train_loss: 0.4567, test_loss: 1.1925, test_f1: 0.6086
 epoch: 98, train_loss: 0.4534, test_loss: 1.2021, test_f1: 0.6182
 epoch: 99, train_loss: 0.4529, test_loss: 1.2261, test_f1: 0.5974
##################ITERATION #6 ****************************************
 epoch: 0, train_loss: 1.2618, test_loss: 1.3889, test_f1: 0.1333
 epoch: 1, train_loss: 1.1448, test_loss: 1.4575, test_f1: 0.0610
 epoch: 2, train_loss: 1.1021, test_loss: 1.3817, test_f1: 0.1881
 epoch: 3, train_loss: 1.0790, test_loss: 1.2095, test_f1: 0.3465
 epoch: 4, train_loss: 1.0443, test_loss: 1.0575, test_f1: 0.4547
 epoch: 5, train_loss: 1.0292, test_loss: 1.0136, test_f1: 0.4691
 epoch: 6, train_loss: 1.0120, test_loss: 0.9787, test_f1: 0.5121
 epoch: 7, train_loss: 0.9865, test_loss: 0.9312, test_f1: 0.5245
 epoch: 8, train_loss: 0.9642, test_loss: 0.9170, test_f1: 0.5378
 epoch: 9, train_loss: 0.9483, test_loss: 0.9275, test_f1: 0.5303
 epoch: 10, train_loss: 0.9557, test_loss: 0.9452, test_f1: 0.5416
 epoch: 11, train_loss: 0.9312, test_loss: 0.8891, test_f1: 0.5531
 epoch: 12, train_loss: 0.9092, test_loss: 0.9056, test_f1: 0.5416
 epoch: 13, train_loss: 0.8995, test_loss: 0.9072, test_f1: 0.5734
 epoch: 14, train_loss: 0.8963, test_loss: 0.9158, test_f1: 0.5454
 epoch: 15, train_loss: 0.8719, test_loss: 0.8909, test_f1: 0.5711
 epoch: 16, train_loss: 0.8595, test_loss: 0.9163, test_f1: 0.5852
 epoch: 17, train_loss: 0.8576, test_loss: 0.8802, test_f1: 0.5913
 epoch: 18, train_loss: 0.8382, test_loss: 0.8774, test_f1: 0.5822
 epoch: 19, train_loss: 0.8335, test_loss: 0.8938, test_f1: 0.5837
 epoch: 20, train_loss: 0.8311, test_loss: 0.8677, test_f1: 0.5947
 epoch: 21, train_loss: 0.8086, test_loss: 0.9147, test_f1: 0.5897
 epoch: 22, train_loss: 0.8089, test_loss: 0.8819, test_f1: 0.5755
 epoch: 23, train_loss: 0.8008, test_loss: 0.8761, test_f1: 0.6249
 epoch: 24, train_loss: 0.7845, test_loss: 0.8761, test_f1: 0.6045
 epoch: 25, train_loss: 0.7830, test_loss: 0.8801, test_f1: 0.6062
 epoch: 26, train_loss: 0.7734, test_loss: 0.8963, test_f1: 0.5885
 epoch: 27, train_loss: 0.7687, test_loss: 0.8885, test_f1: 0.5999
 epoch: 28, train_loss: 0.7670, test_loss: 0.8908, test_f1: 0.6122
 epoch: 29, train_loss: 0.7549, test_loss: 0.8811, test_f1: 0.6160
 epoch: 30, train_loss: 0.7401, test_loss: 0.9109, test_f1: 0.6040
 epoch: 31, train_loss: 0.7360, test_loss: 0.8961, test_f1: 0.6393
 epoch: 32, train_loss: 0.7221, test_loss: 0.8890, test_f1: 0.6439
 epoch: 33, train_loss: 0.7212, test_loss: 0.9123, test_f1: 0.6192
 epoch: 34, train_loss: 0.7123, test_loss: 0.8814, test_f1: 0.6367
 epoch: 35, train_loss: 0.7017, test_loss: 0.8953, test_f1: 0.6186
 epoch: 36, train_loss: 0.7109, test_loss: 0.8884, test_f1: 0.6079
 epoch: 37, train_loss: 0.7090, test_loss: 0.9322, test_f1: 0.6186
 epoch: 38, train_loss: 0.6921, test_loss: 0.9048, test_f1: 0.6180
 epoch: 39, train_loss: 0.6845, test_loss: 0.9014, test_f1: 0.6276
 epoch: 40, train_loss: 0.6860, test_loss: 0.9270, test_f1: 0.6193
 epoch: 41, train_loss: 0.6748, test_loss: 0.8992, test_f1: 0.6416
 epoch: 42, train_loss: 0.6787, test_loss: 0.8970, test_f1: 0.6069
 epoch: 43, train_loss: 0.6614, test_loss: 0.9167, test_f1: 0.6417
 epoch: 44, train_loss: 0.6551, test_loss: 0.9043, test_f1: 0.6432
 epoch: 45, train_loss: 0.6619, test_loss: 0.9429, test_f1: 0.6344
 epoch: 46, train_loss: 0.6570, test_loss: 0.9287, test_f1: 0.6190
 epoch: 47, train_loss: 0.6509, test_loss: 0.9464, test_f1: 0.6233
 epoch: 48, train_loss: 0.6502, test_loss: 0.9441, test_f1: 0.6125
 epoch: 49, train_loss: 0.6223, test_loss: 0.9368, test_f1: 0.6337
 epoch: 50, train_loss: 0.6282, test_loss: 0.9541, test_f1: 0.6133
 epoch: 51, train_loss: 0.6169, test_loss: 0.9551, test_f1: 0.6361
 epoch: 52, train_loss: 0.5967, test_loss: 0.9285, test_f1: 0.6425
 epoch: 53, train_loss: 0.6036, test_loss: 0.9222, test_f1: 0.6497
 epoch: 54, train_loss: 0.6055, test_loss: 0.9302, test_f1: 0.6409
 epoch: 55, train_loss: 0.5932, test_loss: 0.9265, test_f1: 0.6429
 epoch: 56, train_loss: 0.6042, test_loss: 0.9417, test_f1: 0.6422
 epoch: 57, train_loss: 0.5844, test_loss: 0.9431, test_f1: 0.6293
 epoch: 58, train_loss: 0.5902, test_loss: 0.9367, test_f1: 0.6388
 epoch: 59, train_loss: 0.5756, test_loss: 0.9531, test_f1: 0.6334
 epoch: 60, train_loss: 0.5888, test_loss: 0.9486, test_f1: 0.6401
 epoch: 61, train_loss: 0.5828, test_loss: 0.9557, test_f1: 0.6428
 epoch: 62, train_loss: 0.5739, test_loss: 0.9391, test_f1: 0.6381
 epoch: 63, train_loss: 0.5759, test_loss: 0.9483, test_f1: 0.6483
 epoch: 64, train_loss: 0.5626, test_loss: 0.9632, test_f1: 0.6408
 epoch: 65, train_loss: 0.5613, test_loss: 0.9714, test_f1: 0.6337
 epoch: 66, train_loss: 0.5659, test_loss: 0.9713, test_f1: 0.6244
 epoch: 67, train_loss: 0.5589, test_loss: 0.9771, test_f1: 0.6568
 epoch: 68, train_loss: 0.5501, test_loss: 0.9774, test_f1: 0.6584
 epoch: 69, train_loss: 0.5462, test_loss: 0.9671, test_f1: 0.6452
 epoch: 70, train_loss: 0.5489, test_loss: 0.9647, test_f1: 0.6432
 epoch: 71, train_loss: 0.5527, test_loss: 0.9735, test_f1: 0.6527
 epoch: 72, train_loss: 0.5426, test_loss: 0.9799, test_f1: 0.6461
 epoch: 73, train_loss: 0.5517, test_loss: 0.9690, test_f1: 0.6501
 epoch: 74, train_loss: 0.5692, test_loss: 0.9610, test_f1: 0.6388
 epoch: 75, train_loss: 0.5497, test_loss: 0.9581, test_f1: 0.6614
 epoch: 76, train_loss: 0.5435, test_loss: 0.9663, test_f1: 0.6600
 epoch: 77, train_loss: 0.5415, test_loss: 0.9749, test_f1: 0.6546
 epoch: 78, train_loss: 0.5276, test_loss: 0.9844, test_f1: 0.6619
 epoch: 79, train_loss: 0.5421, test_loss: 0.9998, test_f1: 0.6421
 epoch: 80, train_loss: 0.5301, test_loss: 0.9971, test_f1: 0.6584
 epoch: 81, train_loss: 0.5330, test_loss: 0.9701, test_f1: 0.6597
 epoch: 82, train_loss: 0.5266, test_loss: 0.9733, test_f1: 0.6558
 epoch: 83, train_loss: 0.5241, test_loss: 0.9888, test_f1: 0.6345
 epoch: 84, train_loss: 0.5217, test_loss: 0.9933, test_f1: 0.6439
 epoch: 85, train_loss: 0.5132, test_loss: 1.0148, test_f1: 0.6448
 epoch: 86, train_loss: 0.5152, test_loss: 1.0114, test_f1: 0.6306
 epoch: 87, train_loss: 0.5077, test_loss: 1.0096, test_f1: 0.6483
 epoch: 88, train_loss: 0.5156, test_loss: 1.0050, test_f1: 0.6403
 epoch: 89, train_loss: 0.5170, test_loss: 1.0094, test_f1: 0.6501
 epoch: 90, train_loss: 0.5002, test_loss: 1.0184, test_f1: 0.6412
 epoch: 91, train_loss: 0.5020, test_loss: 1.0204, test_f1: 0.6397
 epoch: 92, train_loss: 0.5057, test_loss: 0.9906, test_f1: 0.6457
 epoch: 93, train_loss: 0.4934, test_loss: 1.0410, test_f1: 0.6521
 epoch: 94, train_loss: 0.4887, test_loss: 1.0040, test_f1: 0.6389
 epoch: 95, train_loss: 0.4950, test_loss: 1.0259, test_f1: 0.6422
 epoch: 96, train_loss: 0.4841, test_loss: 1.0294, test_f1: 0.6347
 epoch: 97, train_loss: 0.4907, test_loss: 1.0117, test_f1: 0.6531
 epoch: 98, train_loss: 0.4702, test_loss: 1.0185, test_f1: 0.6373
 epoch: 99, train_loss: 0.4888, test_loss: 1.0533, test_f1: 0.6456
##################ITERATION #7 ****************************************
 epoch: 0, train_loss: 1.2729, test_loss: 1.3180, test_f1: 0.2270
 epoch: 1, train_loss: 1.1312, test_loss: 1.3237, test_f1: 0.3223
 epoch: 2, train_loss: 1.0985, test_loss: 1.2724, test_f1: 0.3578
 epoch: 3, train_loss: 1.0629, test_loss: 1.1954, test_f1: 0.3921
 epoch: 4, train_loss: 1.0337, test_loss: 1.0824, test_f1: 0.4428
 epoch: 5, train_loss: 1.0182, test_loss: 0.9839, test_f1: 0.4885
 epoch: 6, train_loss: 0.9959, test_loss: 0.9428, test_f1: 0.5494
 epoch: 7, train_loss: 0.9700, test_loss: 0.9134, test_f1: 0.5525
 epoch: 8, train_loss: 0.9528, test_loss: 0.9098, test_f1: 0.5256
 epoch: 9, train_loss: 0.9483, test_loss: 0.9126, test_f1: 0.5378
 epoch: 10, train_loss: 0.9435, test_loss: 0.9043, test_f1: 0.5635
 epoch: 11, train_loss: 0.9168, test_loss: 0.9134, test_f1: 0.5375
 epoch: 12, train_loss: 0.9081, test_loss: 0.9024, test_f1: 0.5508
 epoch: 13, train_loss: 0.8983, test_loss: 0.9058, test_f1: 0.5554
 epoch: 14, train_loss: 0.8812, test_loss: 0.9050, test_f1: 0.5517
 epoch: 15, train_loss: 0.8858, test_loss: 0.8925, test_f1: 0.5627
 epoch: 16, train_loss: 0.8671, test_loss: 0.8931, test_f1: 0.5683
 epoch: 17, train_loss: 0.8588, test_loss: 0.9022, test_f1: 0.5702
 epoch: 18, train_loss: 0.8533, test_loss: 0.9078, test_f1: 0.5653
 epoch: 19, train_loss: 0.8411, test_loss: 0.8963, test_f1: 0.5583
 epoch: 20, train_loss: 0.8384, test_loss: 0.9061, test_f1: 0.5672
 epoch: 21, train_loss: 0.8279, test_loss: 0.9024, test_f1: 0.5907
 epoch: 22, train_loss: 0.8161, test_loss: 0.8955, test_f1: 0.5843
 epoch: 23, train_loss: 0.8133, test_loss: 0.8999, test_f1: 0.6015
 epoch: 24, train_loss: 0.7879, test_loss: 0.9033, test_f1: 0.6045
 epoch: 25, train_loss: 0.8039, test_loss: 0.9006, test_f1: 0.6008
 epoch: 26, train_loss: 0.7938, test_loss: 0.9153, test_f1: 0.5967
 epoch: 27, train_loss: 0.7751, test_loss: 0.9123, test_f1: 0.5909
 epoch: 28, train_loss: 0.7730, test_loss: 0.9016, test_f1: 0.6190
 epoch: 29, train_loss: 0.7767, test_loss: 0.9046, test_f1: 0.6059
 epoch: 30, train_loss: 0.7533, test_loss: 0.9109, test_f1: 0.6050
 epoch: 31, train_loss: 0.7442, test_loss: 0.9188, test_f1: 0.6049
 epoch: 32, train_loss: 0.7482, test_loss: 0.8821, test_f1: 0.6119
 epoch: 33, train_loss: 0.7401, test_loss: 0.9004, test_f1: 0.5949
 epoch: 34, train_loss: 0.7284, test_loss: 0.8985, test_f1: 0.6108
 epoch: 35, train_loss: 0.7247, test_loss: 0.9184, test_f1: 0.6096
 epoch: 36, train_loss: 0.7323, test_loss: 0.9195, test_f1: 0.6105
 epoch: 37, train_loss: 0.7208, test_loss: 0.9300, test_f1: 0.5762
 epoch: 38, train_loss: 0.7055, test_loss: 0.9090, test_f1: 0.6118
 epoch: 39, train_loss: 0.7127, test_loss: 0.9173, test_f1: 0.6144
 epoch: 40, train_loss: 0.7090, test_loss: 0.9241, test_f1: 0.6065
 epoch: 41, train_loss: 0.6958, test_loss: 0.9453, test_f1: 0.6078
 epoch: 42, train_loss: 0.6879, test_loss: 0.9218, test_f1: 0.6316
 epoch: 43, train_loss: 0.6748, test_loss: 0.9291, test_f1: 0.6183
 epoch: 44, train_loss: 0.6892, test_loss: 0.9392, test_f1: 0.6272
 epoch: 45, train_loss: 0.6727, test_loss: 0.9360, test_f1: 0.6170
 epoch: 46, train_loss: 0.6700, test_loss: 0.9418, test_f1: 0.6129
 epoch: 47, train_loss: 0.6509, test_loss: 0.9285, test_f1: 0.6289
 epoch: 48, train_loss: 0.6656, test_loss: 0.9246, test_f1: 0.6294
 epoch: 49, train_loss: 0.6506, test_loss: 0.9258, test_f1: 0.6297
 epoch: 50, train_loss: 0.6430, test_loss: 0.9315, test_f1: 0.6357
 epoch: 51, train_loss: 0.6353, test_loss: 0.9335, test_f1: 0.6377
 epoch: 52, train_loss: 0.6405, test_loss: 0.9334, test_f1: 0.6376
 epoch: 53, train_loss: 0.6220, test_loss: 0.9294, test_f1: 0.6374
 epoch: 54, train_loss: 0.6109, test_loss: 0.9338, test_f1: 0.6313
 epoch: 55, train_loss: 0.6099, test_loss: 0.9476, test_f1: 0.6363
 epoch: 56, train_loss: 0.6030, test_loss: 0.9477, test_f1: 0.6283
 epoch: 57, train_loss: 0.6082, test_loss: 0.9559, test_f1: 0.6347
 epoch: 58, train_loss: 0.6076, test_loss: 0.9695, test_f1: 0.6350
 epoch: 59, train_loss: 0.5958, test_loss: 0.9552, test_f1: 0.6383
 epoch: 60, train_loss: 0.5917, test_loss: 0.9524, test_f1: 0.6271
 epoch: 61, train_loss: 0.5871, test_loss: 0.9750, test_f1: 0.6292
 epoch: 62, train_loss: 0.5916, test_loss: 0.9486, test_f1: 0.6323
 epoch: 63, train_loss: 0.5783, test_loss: 0.9770, test_f1: 0.6144
 epoch: 64, train_loss: 0.5811, test_loss: 0.9550, test_f1: 0.6283
 epoch: 65, train_loss: 0.5808, test_loss: 0.9596, test_f1: 0.6422
 epoch: 66, train_loss: 0.5818, test_loss: 0.9601, test_f1: 0.6350
 epoch: 67, train_loss: 0.5801, test_loss: 0.9766, test_f1: 0.6238
 epoch: 68, train_loss: 0.5787, test_loss: 0.9621, test_f1: 0.6370
 epoch: 69, train_loss: 0.5715, test_loss: 0.9959, test_f1: 0.6234
 epoch: 70, train_loss: 0.5756, test_loss: 0.9812, test_f1: 0.6418
 epoch: 71, train_loss: 0.5666, test_loss: 1.0055, test_f1: 0.6058
 epoch: 72, train_loss: 0.5490, test_loss: 0.9917, test_f1: 0.6285
 epoch: 73, train_loss: 0.5708, test_loss: 0.9914, test_f1: 0.6220
 epoch: 74, train_loss: 0.5664, test_loss: 1.0083, test_f1: 0.6173
 epoch: 75, train_loss: 0.5620, test_loss: 1.0100, test_f1: 0.6011
 epoch: 76, train_loss: 0.5518, test_loss: 0.9873, test_f1: 0.6229
 epoch: 77, train_loss: 0.5501, test_loss: 1.0200, test_f1: 0.6105
 epoch: 78, train_loss: 0.5487, test_loss: 1.0017, test_f1: 0.6287
 epoch: 79, train_loss: 0.5600, test_loss: 1.0030, test_f1: 0.6268
 epoch: 80, train_loss: 0.5656, test_loss: 1.0389, test_f1: 0.6120
 epoch: 81, train_loss: 0.5487, test_loss: 1.0128, test_f1: 0.6196
 epoch: 82, train_loss: 0.5452, test_loss: 1.0034, test_f1: 0.6320
 epoch: 83, train_loss: 0.5337, test_loss: 1.0278, test_f1: 0.6152
 epoch: 84, train_loss: 0.5426, test_loss: 1.0152, test_f1: 0.6214
 epoch: 85, train_loss: 0.5334, test_loss: 1.0084, test_f1: 0.6237
 epoch: 86, train_loss: 0.5199, test_loss: 1.0076, test_f1: 0.6256
 epoch: 87, train_loss: 0.5246, test_loss: 1.0077, test_f1: 0.6223
 epoch: 88, train_loss: 0.5332, test_loss: 1.0403, test_f1: 0.6206
 epoch: 89, train_loss: 0.5158, test_loss: 1.0500, test_f1: 0.6127
 epoch: 90, train_loss: 0.5242, test_loss: 1.0236, test_f1: 0.6176
 epoch: 91, train_loss: 0.5239, test_loss: 1.0480, test_f1: 0.6199
 epoch: 92, train_loss: 0.5207, test_loss: 1.0332, test_f1: 0.6200
 epoch: 93, train_loss: 0.5127, test_loss: 1.0134, test_f1: 0.6292
 epoch: 94, train_loss: 0.5083, test_loss: 1.0222, test_f1: 0.6336
 epoch: 95, train_loss: 0.5028, test_loss: 1.0365, test_f1: 0.6377
 epoch: 96, train_loss: 0.4964, test_loss: 1.0522, test_f1: 0.6209
 epoch: 97, train_loss: 0.5070, test_loss: 1.0394, test_f1: 0.6323
 epoch: 98, train_loss: 0.5064, test_loss: 1.0454, test_f1: 0.6140
 epoch: 99, train_loss: 0.4943, test_loss: 1.0486, test_f1: 0.6252
##################ITERATION #8 ****************************************
 epoch: 0, train_loss: 1.2947, test_loss: 1.3932, test_f1: 0.1859
 epoch: 1, train_loss: 1.1527, test_loss: 1.4339, test_f1: 0.1641
 epoch: 2, train_loss: 1.1086, test_loss: 1.3186, test_f1: 0.2595
 epoch: 3, train_loss: 1.0705, test_loss: 1.1925, test_f1: 0.4157
 epoch: 4, train_loss: 1.0490, test_loss: 1.1130, test_f1: 0.4495
 epoch: 5, train_loss: 1.0194, test_loss: 1.0516, test_f1: 0.4529
 epoch: 6, train_loss: 1.0121, test_loss: 1.0018, test_f1: 0.4796
 epoch: 7, train_loss: 0.9862, test_loss: 0.9530, test_f1: 0.5115
 epoch: 8, train_loss: 0.9584, test_loss: 0.9278, test_f1: 0.5203
 epoch: 9, train_loss: 0.9481, test_loss: 0.9359, test_f1: 0.5155
 epoch: 10, train_loss: 0.9367, test_loss: 0.9156, test_f1: 0.5106
 epoch: 11, train_loss: 0.9226, test_loss: 0.9106, test_f1: 0.5226
 epoch: 12, train_loss: 0.9162, test_loss: 0.9187, test_f1: 0.5331
 epoch: 13, train_loss: 0.9033, test_loss: 0.8999, test_f1: 0.5271
 epoch: 14, train_loss: 0.8835, test_loss: 0.8959, test_f1: 0.5264
 epoch: 15, train_loss: 0.8781, test_loss: 0.8950, test_f1: 0.5370
 epoch: 16, train_loss: 0.8657, test_loss: 0.8853, test_f1: 0.5440
 epoch: 17, train_loss: 0.8500, test_loss: 0.8797, test_f1: 0.5411
 epoch: 18, train_loss: 0.8449, test_loss: 0.8777, test_f1: 0.5505
 epoch: 19, train_loss: 0.8265, test_loss: 0.8841, test_f1: 0.5437
 epoch: 20, train_loss: 0.8296, test_loss: 0.8844, test_f1: 0.5606
 epoch: 21, train_loss: 0.8183, test_loss: 0.8874, test_f1: 0.5588
 epoch: 22, train_loss: 0.8121, test_loss: 0.8643, test_f1: 0.5627
 epoch: 23, train_loss: 0.7983, test_loss: 0.8771, test_f1: 0.5550
 epoch: 24, train_loss: 0.7931, test_loss: 0.8700, test_f1: 0.5631
 epoch: 25, train_loss: 0.7824, test_loss: 0.8815, test_f1: 0.5745
 epoch: 26, train_loss: 0.7686, test_loss: 0.8950, test_f1: 0.5680
 epoch: 27, train_loss: 0.7773, test_loss: 0.8741, test_f1: 0.5799
 epoch: 28, train_loss: 0.7647, test_loss: 0.9006, test_f1: 0.5803
 epoch: 29, train_loss: 0.7575, test_loss: 0.8853, test_f1: 0.5819
 epoch: 30, train_loss: 0.7569, test_loss: 0.8772, test_f1: 0.5732
 epoch: 31, train_loss: 0.7550, test_loss: 0.9025, test_f1: 0.5684
 epoch: 32, train_loss: 0.7416, test_loss: 0.8913, test_f1: 0.5933
 epoch: 33, train_loss: 0.7441, test_loss: 0.8768, test_f1: 0.5803
 epoch: 34, train_loss: 0.7250, test_loss: 0.8636, test_f1: 0.5864
 epoch: 35, train_loss: 0.7171, test_loss: 0.9030, test_f1: 0.5750
 epoch: 36, train_loss: 0.7011, test_loss: 0.8954, test_f1: 0.5867
 epoch: 37, train_loss: 0.7005, test_loss: 0.9081, test_f1: 0.5987
 epoch: 38, train_loss: 0.7016, test_loss: 0.9019, test_f1: 0.5887
 epoch: 39, train_loss: 0.6864, test_loss: 0.9176, test_f1: 0.5879
 epoch: 40, train_loss: 0.6884, test_loss: 0.8933, test_f1: 0.6029
 epoch: 41, train_loss: 0.6890, test_loss: 0.9400, test_f1: 0.5867
 epoch: 42, train_loss: 0.6758, test_loss: 0.9511, test_f1: 0.5792
 epoch: 43, train_loss: 0.6652, test_loss: 0.9270, test_f1: 0.6032
 epoch: 44, train_loss: 0.6657, test_loss: 0.9337, test_f1: 0.5814
 epoch: 45, train_loss: 0.6614, test_loss: 0.9166, test_f1: 0.6086
 epoch: 46, train_loss: 0.6738, test_loss: 0.9347, test_f1: 0.5988
 epoch: 47, train_loss: 0.6499, test_loss: 0.9149, test_f1: 0.6072
 epoch: 48, train_loss: 0.6612, test_loss: 0.9077, test_f1: 0.6185
 epoch: 49, train_loss: 0.6430, test_loss: 0.9422, test_f1: 0.6033
 epoch: 50, train_loss: 0.6386, test_loss: 0.8850, test_f1: 0.6183
 epoch: 51, train_loss: 0.6267, test_loss: 0.9138, test_f1: 0.6157
 epoch: 52, train_loss: 0.6011, test_loss: 0.9181, test_f1: 0.6110
 epoch: 53, train_loss: 0.6053, test_loss: 0.9338, test_f1: 0.5968
 epoch: 54, train_loss: 0.6038, test_loss: 0.9431, test_f1: 0.5986
 epoch: 55, train_loss: 0.6130, test_loss: 0.9566, test_f1: 0.6093
 epoch: 56, train_loss: 0.5874, test_loss: 0.9492, test_f1: 0.6069
 epoch: 57, train_loss: 0.6092, test_loss: 0.9444, test_f1: 0.6032
 epoch: 58, train_loss: 0.5855, test_loss: 0.9552, test_f1: 0.6014
 epoch: 59, train_loss: 0.5927, test_loss: 0.9618, test_f1: 0.6092
 epoch: 60, train_loss: 0.5858, test_loss: 0.9630, test_f1: 0.6010
 epoch: 61, train_loss: 0.5978, test_loss: 0.9367, test_f1: 0.6099
 epoch: 62, train_loss: 0.5833, test_loss: 0.9571, test_f1: 0.6171
 epoch: 63, train_loss: 0.5814, test_loss: 0.9643, test_f1: 0.6089
 epoch: 64, train_loss: 0.5806, test_loss: 0.9657, test_f1: 0.5982
 epoch: 65, train_loss: 0.5612, test_loss: 0.9684, test_f1: 0.6160
 epoch: 66, train_loss: 0.5680, test_loss: 0.9831, test_f1: 0.6142
 epoch: 67, train_loss: 0.5671, test_loss: 0.9647, test_f1: 0.6033
 epoch: 68, train_loss: 0.5627, test_loss: 0.9547, test_f1: 0.6185
 epoch: 69, train_loss: 0.5724, test_loss: 0.9797, test_f1: 0.6185
 epoch: 70, train_loss: 0.5599, test_loss: 0.9913, test_f1: 0.5951
 epoch: 71, train_loss: 0.5591, test_loss: 0.9871, test_f1: 0.6251
 epoch: 72, train_loss: 0.5569, test_loss: 1.0047, test_f1: 0.6126
 epoch: 73, train_loss: 0.5515, test_loss: 0.9747, test_f1: 0.6159
 epoch: 74, train_loss: 0.5431, test_loss: 0.9710, test_f1: 0.6229
 epoch: 75, train_loss: 0.5436, test_loss: 0.9663, test_f1: 0.6235
 epoch: 76, train_loss: 0.5343, test_loss: 0.9862, test_f1: 0.6215
 epoch: 77, train_loss: 0.5491, test_loss: 0.9946, test_f1: 0.6301
 epoch: 78, train_loss: 0.5465, test_loss: 1.0003, test_f1: 0.6053
 epoch: 79, train_loss: 0.5460, test_loss: 1.0349, test_f1: 0.6202
 epoch: 80, train_loss: 0.5411, test_loss: 0.9891, test_f1: 0.6091
 epoch: 81, train_loss: 0.5349, test_loss: 0.9870, test_f1: 0.6226
 epoch: 82, train_loss: 0.5352, test_loss: 1.0133, test_f1: 0.6051
 epoch: 83, train_loss: 0.5245, test_loss: 1.0400, test_f1: 0.6185
 epoch: 84, train_loss: 0.5176, test_loss: 1.0102, test_f1: 0.6011
 epoch: 85, train_loss: 0.5160, test_loss: 1.0302, test_f1: 0.6000
 epoch: 86, train_loss: 0.5206, test_loss: 1.0055, test_f1: 0.6218
 epoch: 87, train_loss: 0.5054, test_loss: 1.0013, test_f1: 0.6303
 epoch: 88, train_loss: 0.5201, test_loss: 1.0068, test_f1: 0.6294
 epoch: 89, train_loss: 0.5125, test_loss: 1.0197, test_f1: 0.5997
 epoch: 90, train_loss: 0.4938, test_loss: 1.0120, test_f1: 0.6264
 epoch: 91, train_loss: 0.4998, test_loss: 1.0458, test_f1: 0.6205
 epoch: 92, train_loss: 0.4903, test_loss: 1.0193, test_f1: 0.6420
 epoch: 93, train_loss: 0.5071, test_loss: 1.0554, test_f1: 0.6133
 epoch: 94, train_loss: 0.4906, test_loss: 1.0547, test_f1: 0.6366
 epoch: 95, train_loss: 0.5110, test_loss: 1.0577, test_f1: 0.6266
 epoch: 96, train_loss: 0.5013, test_loss: 1.0332, test_f1: 0.6365
 epoch: 97, train_loss: 0.4974, test_loss: 1.0390, test_f1: 0.6361
 epoch: 98, train_loss: 0.5072, test_loss: 1.0587, test_f1: 0.6138
 epoch: 99, train_loss: 0.4792, test_loss: 1.0566, test_f1: 0.6270
##################ITERATION #9 ****************************************
 epoch: 0, train_loss: 1.2956, test_loss: 1.3111, test_f1: 0.2270
 epoch: 1, train_loss: 1.1496, test_loss: 1.3802, test_f1: 0.1663
 epoch: 2, train_loss: 1.1012, test_loss: 1.3171, test_f1: 0.2695
 epoch: 3, train_loss: 1.0594, test_loss: 1.1466, test_f1: 0.4454
 epoch: 4, train_loss: 1.0328, test_loss: 1.1111, test_f1: 0.4421
 epoch: 5, train_loss: 1.0271, test_loss: 1.0752, test_f1: 0.4502
 epoch: 6, train_loss: 1.0060, test_loss: 0.9847, test_f1: 0.4843
 epoch: 7, train_loss: 0.9834, test_loss: 0.9706, test_f1: 0.5124
 epoch: 8, train_loss: 0.9614, test_loss: 0.9487, test_f1: 0.5240
 epoch: 9, train_loss: 0.9572, test_loss: 0.9314, test_f1: 0.5338
 epoch: 10, train_loss: 0.9403, test_loss: 0.9365, test_f1: 0.5366
 epoch: 11, train_loss: 0.9258, test_loss: 0.9448, test_f1: 0.5371
 epoch: 12, train_loss: 0.9125, test_loss: 0.9517, test_f1: 0.5493
 epoch: 13, train_loss: 0.9172, test_loss: 0.9245, test_f1: 0.5662
 epoch: 14, train_loss: 0.8894, test_loss: 0.9151, test_f1: 0.5683
 epoch: 15, train_loss: 0.8744, test_loss: 0.9424, test_f1: 0.5555
 epoch: 16, train_loss: 0.8708, test_loss: 0.9378, test_f1: 0.5517
 epoch: 17, train_loss: 0.8654, test_loss: 0.9178, test_f1: 0.5644
 epoch: 18, train_loss: 0.8488, test_loss: 0.9119, test_f1: 0.5407
 epoch: 19, train_loss: 0.8348, test_loss: 0.9298, test_f1: 0.5667
 epoch: 20, train_loss: 0.8339, test_loss: 0.9178, test_f1: 0.5652
 epoch: 21, train_loss: 0.8270, test_loss: 0.9245, test_f1: 0.5353
 epoch: 22, train_loss: 0.8167, test_loss: 0.9312, test_f1: 0.5591
 epoch: 23, train_loss: 0.8152, test_loss: 0.9113, test_f1: 0.5760
 epoch: 24, train_loss: 0.7944, test_loss: 0.9232, test_f1: 0.5894
 epoch: 25, train_loss: 0.7891, test_loss: 0.9282, test_f1: 0.5899
 epoch: 26, train_loss: 0.7891, test_loss: 0.9368, test_f1: 0.5694
 epoch: 27, train_loss: 0.7796, test_loss: 0.9277, test_f1: 0.6053
 epoch: 28, train_loss: 0.7847, test_loss: 0.9412, test_f1: 0.5870
 epoch: 29, train_loss: 0.7650, test_loss: 0.9199, test_f1: 0.5774
 epoch: 30, train_loss: 0.7538, test_loss: 0.9298, test_f1: 0.5812
 epoch: 31, train_loss: 0.7482, test_loss: 0.9095, test_f1: 0.5769
 epoch: 32, train_loss: 0.7502, test_loss: 0.9295, test_f1: 0.5788
 epoch: 33, train_loss: 0.7375, test_loss: 0.9450, test_f1: 0.5875
 epoch: 34, train_loss: 0.7385, test_loss: 0.9263, test_f1: 0.5953
 epoch: 35, train_loss: 0.7297, test_loss: 0.9478, test_f1: 0.5948
 epoch: 36, train_loss: 0.7218, test_loss: 0.9233, test_f1: 0.5932
 epoch: 37, train_loss: 0.7197, test_loss: 0.9228, test_f1: 0.6145
 epoch: 38, train_loss: 0.7117, test_loss: 0.9659, test_f1: 0.5968
 epoch: 39, train_loss: 0.7021, test_loss: 0.9327, test_f1: 0.6082
 epoch: 40, train_loss: 0.6943, test_loss: 0.9507, test_f1: 0.5947
 epoch: 41, train_loss: 0.6826, test_loss: 0.9467, test_f1: 0.6049
 epoch: 42, train_loss: 0.6851, test_loss: 0.9648, test_f1: 0.5957
 epoch: 43, train_loss: 0.6827, test_loss: 0.9721, test_f1: 0.5950
 epoch: 44, train_loss: 0.6836, test_loss: 0.9478, test_f1: 0.6076
 epoch: 45, train_loss: 0.6765, test_loss: 0.9620, test_f1: 0.6148
 epoch: 46, train_loss: 0.6648, test_loss: 0.9701, test_f1: 0.5986
 epoch: 47, train_loss: 0.6675, test_loss: 0.9489, test_f1: 0.5916
 epoch: 48, train_loss: 0.6462, test_loss: 0.9868, test_f1: 0.5872
 epoch: 49, train_loss: 0.6537, test_loss: 1.0208, test_f1: 0.6024
 epoch: 50, train_loss: 0.6411, test_loss: 0.9584, test_f1: 0.6085
 epoch: 51, train_loss: 0.6343, test_loss: 0.9817, test_f1: 0.6072
 epoch: 52, train_loss: 0.6270, test_loss: 0.9866, test_f1: 0.5809
 epoch: 53, train_loss: 0.6168, test_loss: 0.9880, test_f1: 0.5891
 epoch: 54, train_loss: 0.6148, test_loss: 0.9865, test_f1: 0.5979
 epoch: 55, train_loss: 0.6253, test_loss: 0.9807, test_f1: 0.6000
 epoch: 56, train_loss: 0.6183, test_loss: 0.9687, test_f1: 0.6098
 epoch: 57, train_loss: 0.6034, test_loss: 0.9920, test_f1: 0.6068
 epoch: 58, train_loss: 0.6149, test_loss: 0.9791, test_f1: 0.6042
 epoch: 59, train_loss: 0.5898, test_loss: 0.9849, test_f1: 0.5928
 epoch: 60, train_loss: 0.5896, test_loss: 0.9872, test_f1: 0.6019
 epoch: 61, train_loss: 0.5935, test_loss: 0.9985, test_f1: 0.5975
 epoch: 62, train_loss: 0.6065, test_loss: 1.0023, test_f1: 0.6020
 epoch: 63, train_loss: 0.5928, test_loss: 1.0129, test_f1: 0.6051
 epoch: 64, train_loss: 0.5884, test_loss: 1.0463, test_f1: 0.5898
 epoch: 65, train_loss: 0.5844, test_loss: 1.0090, test_f1: 0.6100
 epoch: 66, train_loss: 0.5816, test_loss: 1.0003, test_f1: 0.6036
 epoch: 67, train_loss: 0.5786, test_loss: 1.0143, test_f1: 0.6052
 epoch: 68, train_loss: 0.5733, test_loss: 1.0063, test_f1: 0.6011
 epoch: 69, train_loss: 0.5661, test_loss: 1.0106, test_f1: 0.6014
 epoch: 70, train_loss: 0.5770, test_loss: 1.0224, test_f1: 0.6118
 epoch: 71, train_loss: 0.5761, test_loss: 1.0198, test_f1: 0.5980
 epoch: 72, train_loss: 0.5617, test_loss: 1.0558, test_f1: 0.6121
 epoch: 73, train_loss: 0.5826, test_loss: 1.0484, test_f1: 0.6042
 epoch: 74, train_loss: 0.5613, test_loss: 1.0486, test_f1: 0.6148
 epoch: 75, train_loss: 0.5646, test_loss: 1.0267, test_f1: 0.6227
 epoch: 76, train_loss: 0.5551, test_loss: 1.0038, test_f1: 0.6207
 epoch: 77, train_loss: 0.5329, test_loss: 1.0301, test_f1: 0.6157
 epoch: 78, train_loss: 0.5540, test_loss: 1.0597, test_f1: 0.6130
 epoch: 79, train_loss: 0.5478, test_loss: 1.0390, test_f1: 0.6134
 epoch: 80, train_loss: 0.5356, test_loss: 1.0315, test_f1: 0.6320
 epoch: 81, train_loss: 0.5457, test_loss: 1.0833, test_f1: 0.5966
 epoch: 82, train_loss: 0.5261, test_loss: 1.0696, test_f1: 0.6127
 epoch: 83, train_loss: 0.5319, test_loss: 1.0681, test_f1: 0.6082
 epoch: 84, train_loss: 0.5357, test_loss: 1.0683, test_f1: 0.6111
 epoch: 85, train_loss: 0.5299, test_loss: 1.0610, test_f1: 0.6125
 epoch: 86, train_loss: 0.5288, test_loss: 1.0771, test_f1: 0.6148
 epoch: 87, train_loss: 0.5294, test_loss: 1.0810, test_f1: 0.6045
 epoch: 88, train_loss: 0.5281, test_loss: 1.0806, test_f1: 0.6232
 epoch: 89, train_loss: 0.5387, test_loss: 1.0845, test_f1: 0.6192
 epoch: 90, train_loss: 0.5126, test_loss: 1.0867, test_f1: 0.6054
 epoch: 91, train_loss: 0.5239, test_loss: 1.1127, test_f1: 0.6091
 epoch: 92, train_loss: 0.5230, test_loss: 1.1047, test_f1: 0.6226
 epoch: 93, train_loss: 0.5316, test_loss: 1.0958, test_f1: 0.6130
 epoch: 94, train_loss: 0.5184, test_loss: 1.1173, test_f1: 0.6153
 epoch: 95, train_loss: 0.5152, test_loss: 1.1150, test_f1: 0.6198
 epoch: 96, train_loss: 0.5125, test_loss: 1.1046, test_f1: 0.6317
 epoch: 97, train_loss: 0.5005, test_loss: 1.1056, test_f1: 0.5993
 epoch: 98, train_loss: 0.4947, test_loss: 1.0832, test_f1: 0.6102
 epoch: 99, train_loss: 0.4991, test_loss: 1.1084, test_f1: 0.6283

Training completed in 453.47 seconds
Best F1: 0.6619 at epoch 78
Mean F1 across iterations: 0.6350  0.0116
========================FINAL RESULTS================================
FEGIN weighted F1: 0.6619  0.0116
python main.py --data ltspice_examples --representation component_net --model FEGIN --layers 6 --hiddens 128 --batch_size 256 --lr 0.0001 --emb_size 512 --epochs 100 --save_appendix component_net_L6_H128_BS256_LR0.0001_E512 --no_val
-----



STDERR:
  File "main.py", line 370, in <module>
    main()
  File "main.py", line 254, in main
    dataset = dataset_class(
  File "/home/philip/projects/ltspice_examples_code_repo/Circuit-Completion-Using-GNNs/component_classification_with_link_prediction_head/evaluation/FEGIN/kernel/circuit_datasets.py", line 15, in __init__
    self.data, self.slices = torch.load(self.processed_paths[0])
  File "/home/philip/.local/lib/python3.8/site-packages/torch/serialization.py", line 1040, in load
    warnings.warn(
  File "/usr/lib/python3.8/warnings.py", line 109, in _showwarnmsg
    sw(msg.message, msg.category, msg.filename, msg.lineno,
  File "main.py", line 47, in warn_with_traceback
    traceback.print_stack(file=log)
/home/philip/projects/ltspice_examples_code_repo/Circuit-Completion-Using-GNNs/component_classification_with_link_prediction_head/evaluation/FEGIN/kernel/circuit_datasets.py:15: FutureWarning: You are using `torch.load` with `weights_only=False` (the current default value), which uses the default pickle module implicitly. It is possible to construct malicious pickle data which will execute arbitrary code during unpickling (See https://github.com/pytorch/pytorch/blob/main/SECURITY.md#untrusted-models for more details). In a future release, the default value for `weights_only` will be flipped to `True`. This limits the functions that could be executed during unpickling. Arbitrary objects will no longer be allowed to be loaded via this mode unless they are explicitly allowlisted by the user via `torch.serialization.add_safe_globals`. We recommend you start setting `weights_only=True` for any use case where you don't have full control of the loaded file. Please open an issue on GitHub for any issues related to this experimental feature.
  self.data, self.slices = torch.load(self.processed_paths[0])
