STDOUT:
Results will be saved in /home/philip/projects/ltspice_examples_code_repo/Circuit-Completion-Using-GNNs/component_classification_with_link_prediction_head/evaluation/FEGIN/results/model_FEGIN_dataset_ltspice_examples
Command line input: python main.py --data ltspice_examples --representation component_net --model FEGIN --layers 2 --hiddens 128 --batch_size 256 --lr 0.001 --emb_size 250 --epochs 100 --save_appendix component_net_L2_H128_BS256_LR0.001_E250 --no_val
 is saved.
-----
ltspice_examples - FEGIN
Using 2 layers, 128 hidden units, h = 2
Loading component_net representation dataset
ENTERED
Training FEGIN on component_net representation
Train: 3558, Test: 846
##################ITERATION #0 ****************************************
 epoch: 0, train_loss: 1.2996, test_loss: 1.3034, test_f1: 0.2270
 epoch: 1, train_loss: 1.1809, test_loss: 1.2150, test_f1: 0.2651
 epoch: 2, train_loss: 1.0925, test_loss: 1.1028, test_f1: 0.4469
 epoch: 3, train_loss: 1.0115, test_loss: 1.0173, test_f1: 0.4567
 epoch: 4, train_loss: 0.9613, test_loss: 1.0020, test_f1: 0.4633
 epoch: 5, train_loss: 0.9368, test_loss: 1.0084, test_f1: 0.4859
 epoch: 6, train_loss: 0.9201, test_loss: 0.9271, test_f1: 0.5095
 epoch: 7, train_loss: 0.8902, test_loss: 0.9150, test_f1: 0.5284
 epoch: 8, train_loss: 0.8639, test_loss: 0.9355, test_f1: 0.5118
 epoch: 9, train_loss: 0.8589, test_loss: 1.0546, test_f1: 0.5105
 epoch: 10, train_loss: 0.8609, test_loss: 0.8920, test_f1: 0.5327
 epoch: 11, train_loss: 0.8477, test_loss: 0.9409, test_f1: 0.5249
 epoch: 12, train_loss: 0.8180, test_loss: 0.8841, test_f1: 0.5188
 epoch: 13, train_loss: 0.7999, test_loss: 0.9556, test_f1: 0.5406
 epoch: 14, train_loss: 0.7894, test_loss: 0.9235, test_f1: 0.5503
 epoch: 15, train_loss: 0.7739, test_loss: 1.0047, test_f1: 0.5420
 epoch: 16, train_loss: 0.7675, test_loss: 0.9286, test_f1: 0.5333
 epoch: 17, train_loss: 0.7713, test_loss: 1.0032, test_f1: 0.5271
 epoch: 18, train_loss: 0.7466, test_loss: 0.9448, test_f1: 0.5554
 epoch: 19, train_loss: 0.7251, test_loss: 0.9772, test_f1: 0.5987
 epoch: 20, train_loss: 0.7186, test_loss: 0.9915, test_f1: 0.6170
 epoch: 21, train_loss: 0.7226, test_loss: 0.9871, test_f1: 0.5934
 epoch: 22, train_loss: 0.7202, test_loss: 0.9659, test_f1: 0.5874
 epoch: 23, train_loss: 0.7022, test_loss: 0.9223, test_f1: 0.6383
 epoch: 24, train_loss: 0.6988, test_loss: 0.9506, test_f1: 0.6139
 epoch: 25, train_loss: 0.6751, test_loss: 0.9696, test_f1: 0.6287
 epoch: 26, train_loss: 0.6836, test_loss: 1.0486, test_f1: 0.6151
 epoch: 27, train_loss: 0.6602, test_loss: 0.9687, test_f1: 0.6150
 epoch: 28, train_loss: 0.6514, test_loss: 0.9860, test_f1: 0.6001
 epoch: 29, train_loss: 0.6298, test_loss: 1.0116, test_f1: 0.5756
 epoch: 30, train_loss: 0.6442, test_loss: 0.9966, test_f1: 0.6406
 epoch: 31, train_loss: 0.6334, test_loss: 1.0073, test_f1: 0.5833
 epoch: 32, train_loss: 0.6349, test_loss: 1.0272, test_f1: 0.5789
 epoch: 33, train_loss: 0.6141, test_loss: 0.9605, test_f1: 0.6278
 epoch: 34, train_loss: 0.6066, test_loss: 1.0219, test_f1: 0.6167
 epoch: 35, train_loss: 0.5942, test_loss: 1.0187, test_f1: 0.6124
 epoch: 36, train_loss: 0.5906, test_loss: 0.9934, test_f1: 0.6285
 epoch: 37, train_loss: 0.5856, test_loss: 1.0616, test_f1: 0.6551
 epoch: 38, train_loss: 0.5744, test_loss: 1.0529, test_f1: 0.6130
 epoch: 39, train_loss: 0.5737, test_loss: 1.0691, test_f1: 0.6340
 epoch: 40, train_loss: 0.5378, test_loss: 1.0984, test_f1: 0.6010
 epoch: 41, train_loss: 0.5317, test_loss: 1.2235, test_f1: 0.6074
 epoch: 42, train_loss: 0.5305, test_loss: 1.0933, test_f1: 0.6492
 epoch: 43, train_loss: 0.5346, test_loss: 1.0461, test_f1: 0.6244
 epoch: 44, train_loss: 0.5282, test_loss: 1.2408, test_f1: 0.5997
 epoch: 45, train_loss: 0.5063, test_loss: 1.2041, test_f1: 0.6310
 epoch: 46, train_loss: 0.5030, test_loss: 1.2027, test_f1: 0.6055
 epoch: 47, train_loss: 0.4991, test_loss: 1.1999, test_f1: 0.6327
 epoch: 48, train_loss: 0.5070, test_loss: 1.3239, test_f1: 0.6111
 epoch: 49, train_loss: 0.4988, test_loss: 1.2082, test_f1: 0.6120
 epoch: 50, train_loss: 0.4971, test_loss: 1.2245, test_f1: 0.6335
 epoch: 51, train_loss: 0.4532, test_loss: 1.1588, test_f1: 0.6464
 epoch: 52, train_loss: 0.4440, test_loss: 1.2029, test_f1: 0.6458
 epoch: 53, train_loss: 0.4195, test_loss: 1.2807, test_f1: 0.6275
 epoch: 54, train_loss: 0.4084, test_loss: 1.2905, test_f1: 0.6501
 epoch: 55, train_loss: 0.3935, test_loss: 1.3643, test_f1: 0.6349
 epoch: 56, train_loss: 0.3935, test_loss: 1.2847, test_f1: 0.6652
 epoch: 57, train_loss: 0.3886, test_loss: 1.3509, test_f1: 0.6495
 epoch: 58, train_loss: 0.3872, test_loss: 1.3110, test_f1: 0.6672
 epoch: 59, train_loss: 0.3742, test_loss: 1.3616, test_f1: 0.6522
 epoch: 60, train_loss: 0.3821, test_loss: 1.3990, test_f1: 0.6502
 epoch: 61, train_loss: 0.3702, test_loss: 1.4043, test_f1: 0.6527
 epoch: 62, train_loss: 0.3804, test_loss: 1.4756, test_f1: 0.6569
 epoch: 63, train_loss: 0.3582, test_loss: 1.4305, test_f1: 0.6822
 epoch: 64, train_loss: 0.3546, test_loss: 1.4447, test_f1: 0.6437
 epoch: 65, train_loss: 0.3566, test_loss: 1.4996, test_f1: 0.6362
 epoch: 66, train_loss: 0.3429, test_loss: 1.4604, test_f1: 0.6729
 epoch: 67, train_loss: 0.3489, test_loss: 1.3568, test_f1: 0.6458
 epoch: 68, train_loss: 0.3491, test_loss: 1.7023, test_f1: 0.6198
 epoch: 69, train_loss: 0.3457, test_loss: 1.4940, test_f1: 0.6470
 epoch: 70, train_loss: 0.3370, test_loss: 1.4336, test_f1: 0.6550
 epoch: 71, train_loss: 0.3346, test_loss: 1.5744, test_f1: 0.6328
 epoch: 72, train_loss: 0.3179, test_loss: 1.4699, test_f1: 0.6602
 epoch: 73, train_loss: 0.3242, test_loss: 1.6134, test_f1: 0.6171
 epoch: 74, train_loss: 0.3282, test_loss: 1.5774, test_f1: 0.6407
 epoch: 75, train_loss: 0.3278, test_loss: 1.6137, test_f1: 0.6521
 epoch: 76, train_loss: 0.3233, test_loss: 1.5966, test_f1: 0.6613
 epoch: 77, train_loss: 0.3101, test_loss: 1.6946, test_f1: 0.6268
 epoch: 78, train_loss: 0.3186, test_loss: 1.5160, test_f1: 0.6610
 epoch: 79, train_loss: 0.3115, test_loss: 1.6557, test_f1: 0.6165
 epoch: 80, train_loss: 0.2988, test_loss: 1.7031, test_f1: 0.6456
 epoch: 81, train_loss: 0.3037, test_loss: 1.8040, test_f1: 0.6361
 epoch: 82, train_loss: 0.2870, test_loss: 1.6493, test_f1: 0.6376
 epoch: 83, train_loss: 0.2762, test_loss: 1.6299, test_f1: 0.6513
 epoch: 84, train_loss: 0.2925, test_loss: 1.7256, test_f1: 0.6403
 epoch: 85, train_loss: 0.2885, test_loss: 1.7948, test_f1: 0.6500
 epoch: 86, train_loss: 0.2923, test_loss: 1.6962, test_f1: 0.6485
 epoch: 87, train_loss: 0.2875, test_loss: 1.6786, test_f1: 0.6340
 epoch: 88, train_loss: 0.2720, test_loss: 1.7296, test_f1: 0.6250
 epoch: 89, train_loss: 0.2746, test_loss: 1.8024, test_f1: 0.6552
 epoch: 90, train_loss: 0.2705, test_loss: 1.8090, test_f1: 0.6405
 epoch: 91, train_loss: 0.2695, test_loss: 1.6266, test_f1: 0.6810
 epoch: 92, train_loss: 0.2783, test_loss: 1.8460, test_f1: 0.6607
 epoch: 93, train_loss: 0.2892, test_loss: 1.7359, test_f1: 0.6573
 epoch: 94, train_loss: 0.2816, test_loss: 1.8855, test_f1: 0.6459
 epoch: 95, train_loss: 0.2595, test_loss: 1.8801, test_f1: 0.6603
 epoch: 96, train_loss: 0.2610, test_loss: 1.8591, test_f1: 0.6440
 epoch: 97, train_loss: 0.2490, test_loss: 1.9388, test_f1: 0.6487
 epoch: 98, train_loss: 0.2298, test_loss: 1.7923, test_f1: 0.6486
 epoch: 99, train_loss: 0.2260, test_loss: 1.9690, test_f1: 0.6422
##################ITERATION #1 ****************************************
 epoch: 0, train_loss: 1.2130, test_loss: 1.2648, test_f1: 0.2270
 epoch: 1, train_loss: 1.0493, test_loss: 1.1262, test_f1: 0.3308
 epoch: 2, train_loss: 0.9875, test_loss: 1.0179, test_f1: 0.4671
 epoch: 3, train_loss: 0.9485, test_loss: 0.9655, test_f1: 0.5233
 epoch: 4, train_loss: 0.9298, test_loss: 0.9577, test_f1: 0.4879
 epoch: 5, train_loss: 0.9016, test_loss: 0.9363, test_f1: 0.5388
 epoch: 6, train_loss: 0.8678, test_loss: 0.9463, test_f1: 0.5078
 epoch: 7, train_loss: 0.8669, test_loss: 0.9201, test_f1: 0.5329
 epoch: 8, train_loss: 0.8460, test_loss: 1.0186, test_f1: 0.5209
 epoch: 9, train_loss: 0.8569, test_loss: 0.9884, test_f1: 0.4867
 epoch: 10, train_loss: 0.8247, test_loss: 0.9187, test_f1: 0.5819
 epoch: 11, train_loss: 0.8038, test_loss: 0.9060, test_f1: 0.5545
 epoch: 12, train_loss: 0.7812, test_loss: 0.8953, test_f1: 0.6083
 epoch: 13, train_loss: 0.7725, test_loss: 0.9032, test_f1: 0.5458
 epoch: 14, train_loss: 0.7590, test_loss: 0.8766, test_f1: 0.5904
 epoch: 15, train_loss: 0.7518, test_loss: 0.9488, test_f1: 0.6260
 epoch: 16, train_loss: 0.7334, test_loss: 0.9570, test_f1: 0.5948
 epoch: 17, train_loss: 0.7377, test_loss: 0.8580, test_f1: 0.6457
 epoch: 18, train_loss: 0.7195, test_loss: 0.9438, test_f1: 0.5785
 epoch: 19, train_loss: 0.7005, test_loss: 0.9058, test_f1: 0.6416
 epoch: 20, train_loss: 0.6921, test_loss: 0.8990, test_f1: 0.5956
 epoch: 21, train_loss: 0.6905, test_loss: 0.9173, test_f1: 0.6284
 epoch: 22, train_loss: 0.6812, test_loss: 0.9798, test_f1: 0.6299
 epoch: 23, train_loss: 0.6733, test_loss: 0.9815, test_f1: 0.5946
 epoch: 24, train_loss: 0.6875, test_loss: 0.9559, test_f1: 0.6123
 epoch: 25, train_loss: 0.6387, test_loss: 0.9700, test_f1: 0.6294
 epoch: 26, train_loss: 0.6370, test_loss: 1.0383, test_f1: 0.6078
 epoch: 27, train_loss: 0.6372, test_loss: 1.0101, test_f1: 0.6362
 epoch: 28, train_loss: 0.6268, test_loss: 0.9705, test_f1: 0.6514
 epoch: 29, train_loss: 0.6232, test_loss: 0.9442, test_f1: 0.6343
 epoch: 30, train_loss: 0.6094, test_loss: 1.0058, test_f1: 0.6228
 epoch: 31, train_loss: 0.5986, test_loss: 1.0816, test_f1: 0.6318
 epoch: 32, train_loss: 0.5881, test_loss: 0.9708, test_f1: 0.6485
 epoch: 33, train_loss: 0.5762, test_loss: 0.9771, test_f1: 0.6630
 epoch: 34, train_loss: 0.5618, test_loss: 1.0087, test_f1: 0.6389
 epoch: 35, train_loss: 0.5556, test_loss: 1.0294, test_f1: 0.6485
 epoch: 36, train_loss: 0.5678, test_loss: 1.0923, test_f1: 0.6232
 epoch: 37, train_loss: 0.5584, test_loss: 1.0357, test_f1: 0.6598
 epoch: 38, train_loss: 0.5448, test_loss: 1.1824, test_f1: 0.6116
 epoch: 39, train_loss: 0.5550, test_loss: 1.0994, test_f1: 0.6142
 epoch: 40, train_loss: 0.5167, test_loss: 1.0924, test_f1: 0.6422
 epoch: 41, train_loss: 0.5147, test_loss: 1.0467, test_f1: 0.6616
 epoch: 42, train_loss: 0.5051, test_loss: 1.0585, test_f1: 0.6879
 epoch: 43, train_loss: 0.5154, test_loss: 1.0579, test_f1: 0.6367
 epoch: 44, train_loss: 0.4859, test_loss: 1.1640, test_f1: 0.6310
 epoch: 45, train_loss: 0.4918, test_loss: 1.2236, test_f1: 0.6039
 epoch: 46, train_loss: 0.4908, test_loss: 1.0304, test_f1: 0.6865
 epoch: 47, train_loss: 0.4969, test_loss: 1.1024, test_f1: 0.6505
 epoch: 48, train_loss: 0.4689, test_loss: 1.1187, test_f1: 0.6698
 epoch: 49, train_loss: 0.4655, test_loss: 1.3227, test_f1: 0.6000
 epoch: 50, train_loss: 0.4448, test_loss: 1.1478, test_f1: 0.6673
 epoch: 51, train_loss: 0.4164, test_loss: 1.1477, test_f1: 0.6862
 epoch: 52, train_loss: 0.4011, test_loss: 1.1419, test_f1: 0.6978
 epoch: 53, train_loss: 0.4028, test_loss: 1.1745, test_f1: 0.6607
 epoch: 54, train_loss: 0.3778, test_loss: 1.1785, test_f1: 0.7016
 epoch: 55, train_loss: 0.3704, test_loss: 1.2373, test_f1: 0.6790
 epoch: 56, train_loss: 0.3691, test_loss: 1.2463, test_f1: 0.6802
 epoch: 57, train_loss: 0.3707, test_loss: 1.2889, test_f1: 0.6238
 epoch: 58, train_loss: 0.3577, test_loss: 1.1861, test_f1: 0.6820
 epoch: 59, train_loss: 0.3613, test_loss: 1.2386, test_f1: 0.6980
 epoch: 60, train_loss: 0.3613, test_loss: 1.3019, test_f1: 0.6676
 epoch: 61, train_loss: 0.3521, test_loss: 1.2899, test_f1: 0.6773
 epoch: 62, train_loss: 0.3478, test_loss: 1.2828, test_f1: 0.6857
 epoch: 63, train_loss: 0.3379, test_loss: 1.4061, test_f1: 0.6607
 epoch: 64, train_loss: 0.3596, test_loss: 1.3261, test_f1: 0.6432
 epoch: 65, train_loss: 0.3348, test_loss: 1.3514, test_f1: 0.6812
 epoch: 66, train_loss: 0.3252, test_loss: 1.3595, test_f1: 0.6684
 epoch: 67, train_loss: 0.3309, test_loss: 1.3497, test_f1: 0.6722
 epoch: 68, train_loss: 0.3250, test_loss: 1.3649, test_f1: 0.6483
 epoch: 69, train_loss: 0.3242, test_loss: 1.3845, test_f1: 0.6873
 epoch: 70, train_loss: 0.3152, test_loss: 1.3791, test_f1: 0.6797
 epoch: 71, train_loss: 0.3042, test_loss: 1.4893, test_f1: 0.6567
 epoch: 72, train_loss: 0.3002, test_loss: 1.4318, test_f1: 0.6875
 epoch: 73, train_loss: 0.2865, test_loss: 1.5050, test_f1: 0.6737
 epoch: 74, train_loss: 0.3128, test_loss: 1.4122, test_f1: 0.6687
 epoch: 75, train_loss: 0.3058, test_loss: 1.4344, test_f1: 0.6840
 epoch: 76, train_loss: 0.3040, test_loss: 1.5489, test_f1: 0.6648
 epoch: 77, train_loss: 0.3000, test_loss: 1.6740, test_f1: 0.6525
 epoch: 78, train_loss: 0.3017, test_loss: 1.4393, test_f1: 0.6715
 epoch: 79, train_loss: 0.2790, test_loss: 1.5431, test_f1: 0.6690
 epoch: 80, train_loss: 0.2748, test_loss: 1.5232, test_f1: 0.6609
 epoch: 81, train_loss: 0.2831, test_loss: 1.4822, test_f1: 0.6871
 epoch: 82, train_loss: 0.2968, test_loss: 1.5143, test_f1: 0.6645
 epoch: 83, train_loss: 0.2760, test_loss: 1.7209, test_f1: 0.6437
 epoch: 84, train_loss: 0.2913, test_loss: 1.6175, test_f1: 0.6669
 epoch: 85, train_loss: 0.2814, test_loss: 1.5222, test_f1: 0.6784
 epoch: 86, train_loss: 0.2676, test_loss: 1.6286, test_f1: 0.6741
 epoch: 87, train_loss: 0.2638, test_loss: 1.5613, test_f1: 0.6843
 epoch: 88, train_loss: 0.2868, test_loss: 1.5880, test_f1: 0.6735
 epoch: 89, train_loss: 0.2597, test_loss: 1.6266, test_f1: 0.6650
 epoch: 90, train_loss: 0.2563, test_loss: 1.6592, test_f1: 0.6731
 epoch: 91, train_loss: 0.2527, test_loss: 1.5603, test_f1: 0.6766
 epoch: 92, train_loss: 0.2528, test_loss: 1.6714, test_f1: 0.6806
 epoch: 93, train_loss: 0.2630, test_loss: 1.7273, test_f1: 0.6516
 epoch: 94, train_loss: 0.2631, test_loss: 1.5170, test_f1: 0.6705
 epoch: 95, train_loss: 0.2379, test_loss: 1.5669, test_f1: 0.6726
 epoch: 96, train_loss: 0.2407, test_loss: 1.7818, test_f1: 0.6560
 epoch: 97, train_loss: 0.2377, test_loss: 1.7413, test_f1: 0.6696
 epoch: 98, train_loss: 0.2287, test_loss: 1.7403, test_f1: 0.6813
 epoch: 99, train_loss: 0.2274, test_loss: 1.8294, test_f1: 0.6547
##################ITERATION #2 ****************************************
 epoch: 0, train_loss: 1.2703, test_loss: 1.2632, test_f1: 0.2270
 epoch: 1, train_loss: 1.0428, test_loss: 1.1151, test_f1: 0.3386
 epoch: 2, train_loss: 0.9808, test_loss: 1.0439, test_f1: 0.3850
 epoch: 3, train_loss: 0.9493, test_loss: 1.0112, test_f1: 0.4627
 epoch: 4, train_loss: 0.9229, test_loss: 0.9631, test_f1: 0.4902
 epoch: 5, train_loss: 0.8942, test_loss: 0.9781, test_f1: 0.5043
 epoch: 6, train_loss: 0.8814, test_loss: 0.9329, test_f1: 0.5082
 epoch: 7, train_loss: 0.8570, test_loss: 0.8536, test_f1: 0.5461
 epoch: 8, train_loss: 0.8340, test_loss: 0.9206, test_f1: 0.5458
 epoch: 9, train_loss: 0.8262, test_loss: 0.9152, test_f1: 0.5758
 epoch: 10, train_loss: 0.8188, test_loss: 0.8856, test_f1: 0.6009
 epoch: 11, train_loss: 0.8179, test_loss: 0.9562, test_f1: 0.5456
 epoch: 12, train_loss: 0.7928, test_loss: 0.9187, test_f1: 0.5558
 epoch: 13, train_loss: 0.7760, test_loss: 0.9611, test_f1: 0.5721
 epoch: 14, train_loss: 0.7676, test_loss: 1.0297, test_f1: 0.5384
 epoch: 15, train_loss: 0.7596, test_loss: 0.9689, test_f1: 0.5800
 epoch: 16, train_loss: 0.7559, test_loss: 0.9099, test_f1: 0.6061
 epoch: 17, train_loss: 0.7413, test_loss: 0.8854, test_f1: 0.6074
 epoch: 18, train_loss: 0.7450, test_loss: 0.8705, test_f1: 0.6074
 epoch: 19, train_loss: 0.7214, test_loss: 0.9915, test_f1: 0.6089
 epoch: 20, train_loss: 0.7111, test_loss: 1.0852, test_f1: 0.5647
 epoch: 21, train_loss: 0.7097, test_loss: 1.0148, test_f1: 0.5501
 epoch: 22, train_loss: 0.6999, test_loss: 0.9402, test_f1: 0.6418
 epoch: 23, train_loss: 0.6764, test_loss: 1.0150, test_f1: 0.5712
 epoch: 24, train_loss: 0.6755, test_loss: 1.0968, test_f1: 0.5769
 epoch: 25, train_loss: 0.6651, test_loss: 0.9449, test_f1: 0.6148
 epoch: 26, train_loss: 0.6828, test_loss: 0.9797, test_f1: 0.6159
 epoch: 27, train_loss: 0.6775, test_loss: 1.0717, test_f1: 0.6098
 epoch: 28, train_loss: 0.6551, test_loss: 1.0086, test_f1: 0.6149
 epoch: 29, train_loss: 0.6391, test_loss: 0.9689, test_f1: 0.6199
 epoch: 30, train_loss: 0.6243, test_loss: 0.9642, test_f1: 0.6257
 epoch: 31, train_loss: 0.6303, test_loss: 1.0268, test_f1: 0.5875
 epoch: 32, train_loss: 0.6166, test_loss: 1.0935, test_f1: 0.5985
 epoch: 33, train_loss: 0.6065, test_loss: 0.9736, test_f1: 0.6369
 epoch: 34, train_loss: 0.6064, test_loss: 0.9902, test_f1: 0.6098
 epoch: 35, train_loss: 0.5975, test_loss: 1.0026, test_f1: 0.6176
 epoch: 36, train_loss: 0.5792, test_loss: 1.0848, test_f1: 0.6092
 epoch: 37, train_loss: 0.5758, test_loss: 1.0047, test_f1: 0.6441
 epoch: 38, train_loss: 0.5762, test_loss: 1.2315, test_f1: 0.6233
 epoch: 39, train_loss: 0.5670, test_loss: 1.0931, test_f1: 0.6413
 epoch: 40, train_loss: 0.5542, test_loss: 1.0509, test_f1: 0.6564
 epoch: 41, train_loss: 0.5576, test_loss: 1.1773, test_f1: 0.6136
 epoch: 42, train_loss: 0.5581, test_loss: 1.2130, test_f1: 0.6135
 epoch: 43, train_loss: 0.5450, test_loss: 1.0736, test_f1: 0.6244
 epoch: 44, train_loss: 0.5407, test_loss: 1.0375, test_f1: 0.6284
 epoch: 45, train_loss: 0.5101, test_loss: 1.1083, test_f1: 0.5972
 epoch: 46, train_loss: 0.4997, test_loss: 1.1043, test_f1: 0.6491
 epoch: 47, train_loss: 0.4935, test_loss: 1.1662, test_f1: 0.6561
 epoch: 48, train_loss: 0.4989, test_loss: 1.1326, test_f1: 0.6408
 epoch: 49, train_loss: 0.4969, test_loss: 1.1177, test_f1: 0.6293
 epoch: 50, train_loss: 0.4749, test_loss: 1.0440, test_f1: 0.6468
 epoch: 51, train_loss: 0.4570, test_loss: 1.1297, test_f1: 0.6696
 epoch: 52, train_loss: 0.4347, test_loss: 1.1559, test_f1: 0.6427
 epoch: 53, train_loss: 0.4336, test_loss: 1.1200, test_f1: 0.6703
 epoch: 54, train_loss: 0.4276, test_loss: 1.1871, test_f1: 0.6569
 epoch: 55, train_loss: 0.4248, test_loss: 1.1557, test_f1: 0.6451
 epoch: 56, train_loss: 0.4213, test_loss: 1.2554, test_f1: 0.6778
 epoch: 57, train_loss: 0.4111, test_loss: 1.1779, test_f1: 0.6801
 epoch: 58, train_loss: 0.4018, test_loss: 1.1901, test_f1: 0.6774
 epoch: 59, train_loss: 0.4028, test_loss: 1.1982, test_f1: 0.6773
 epoch: 60, train_loss: 0.4010, test_loss: 1.1862, test_f1: 0.6935
 epoch: 61, train_loss: 0.3938, test_loss: 1.1942, test_f1: 0.6747
 epoch: 62, train_loss: 0.3784, test_loss: 1.1840, test_f1: 0.6824
 epoch: 63, train_loss: 0.3829, test_loss: 1.2661, test_f1: 0.6707
 epoch: 64, train_loss: 0.3870, test_loss: 1.3145, test_f1: 0.6573
 epoch: 65, train_loss: 0.3702, test_loss: 1.1790, test_f1: 0.6761
 epoch: 66, train_loss: 0.3591, test_loss: 1.3128, test_f1: 0.6696
 epoch: 67, train_loss: 0.3752, test_loss: 1.3413, test_f1: 0.6690
 epoch: 68, train_loss: 0.3677, test_loss: 1.4013, test_f1: 0.6483
 epoch: 69, train_loss: 0.3668, test_loss: 1.3221, test_f1: 0.6670
 epoch: 70, train_loss: 0.3549, test_loss: 1.2230, test_f1: 0.6857
 epoch: 71, train_loss: 0.3541, test_loss: 1.3254, test_f1: 0.6728
 epoch: 72, train_loss: 0.3479, test_loss: 1.3994, test_f1: 0.6470
 epoch: 73, train_loss: 0.3457, test_loss: 1.3621, test_f1: 0.6765
 epoch: 74, train_loss: 0.3458, test_loss: 1.4031, test_f1: 0.6708
 epoch: 75, train_loss: 0.3471, test_loss: 1.3193, test_f1: 0.6769
 epoch: 76, train_loss: 0.3233, test_loss: 1.4172, test_f1: 0.6519
 epoch: 77, train_loss: 0.3274, test_loss: 1.4592, test_f1: 0.6778
 epoch: 78, train_loss: 0.3228, test_loss: 1.4488, test_f1: 0.6487
 epoch: 79, train_loss: 0.3348, test_loss: 1.4018, test_f1: 0.6582
 epoch: 80, train_loss: 0.3762, test_loss: 1.3483, test_f1: 0.6760
 epoch: 81, train_loss: 0.3425, test_loss: 1.4039, test_f1: 0.6677
 epoch: 82, train_loss: 0.3183, test_loss: 1.3584, test_f1: 0.6982
 epoch: 83, train_loss: 0.3152, test_loss: 1.3490, test_f1: 0.6677
 epoch: 84, train_loss: 0.3114, test_loss: 1.5256, test_f1: 0.6621
 epoch: 85, train_loss: 0.3298, test_loss: 1.5682, test_f1: 0.6558
 epoch: 86, train_loss: 0.3262, test_loss: 1.3977, test_f1: 0.6864
 epoch: 87, train_loss: 0.3191, test_loss: 1.4141, test_f1: 0.6750
 epoch: 88, train_loss: 0.3199, test_loss: 1.5115, test_f1: 0.6480
 epoch: 89, train_loss: 0.3071, test_loss: 1.4560, test_f1: 0.6710
 epoch: 90, train_loss: 0.3032, test_loss: 1.4643, test_f1: 0.6843
 epoch: 91, train_loss: 0.2924, test_loss: 1.4448, test_f1: 0.6752
 epoch: 92, train_loss: 0.3005, test_loss: 1.4347, test_f1: 0.6902
 epoch: 93, train_loss: 0.2949, test_loss: 1.5077, test_f1: 0.6725
 epoch: 94, train_loss: 0.2800, test_loss: 1.3787, test_f1: 0.6939
 epoch: 95, train_loss: 0.2975, test_loss: 1.4167, test_f1: 0.6750
 epoch: 96, train_loss: 0.2831, test_loss: 1.6829, test_f1: 0.6594
 epoch: 97, train_loss: 0.2671, test_loss: 1.5388, test_f1: 0.6604
 epoch: 98, train_loss: 0.2737, test_loss: 1.5228, test_f1: 0.6927
 epoch: 99, train_loss: 0.2643, test_loss: 1.7121, test_f1: 0.6501
##################ITERATION #3 ****************************************
 epoch: 0, train_loss: 1.3353, test_loss: 1.2772, test_f1: 0.2392
 epoch: 1, train_loss: 1.0470, test_loss: 1.1484, test_f1: 0.3165
 epoch: 2, train_loss: 0.9817, test_loss: 1.0317, test_f1: 0.4295
 epoch: 3, train_loss: 0.9400, test_loss: 0.9696, test_f1: 0.5109
 epoch: 4, train_loss: 0.9074, test_loss: 0.9494, test_f1: 0.5156
 epoch: 5, train_loss: 0.8897, test_loss: 0.9535, test_f1: 0.5185
 epoch: 6, train_loss: 0.8659, test_loss: 0.9050, test_f1: 0.5565
 epoch: 7, train_loss: 0.8434, test_loss: 0.8926, test_f1: 0.5568
 epoch: 8, train_loss: 0.8389, test_loss: 0.8839, test_f1: 0.5845
 epoch: 9, train_loss: 0.8186, test_loss: 0.9233, test_f1: 0.5761
 epoch: 10, train_loss: 0.8080, test_loss: 0.9210, test_f1: 0.5468
 epoch: 11, train_loss: 0.8028, test_loss: 0.9078, test_f1: 0.5628
 epoch: 12, train_loss: 0.7904, test_loss: 0.8925, test_f1: 0.5671
 epoch: 13, train_loss: 0.7745, test_loss: 0.9041, test_f1: 0.5736
 epoch: 14, train_loss: 0.7588, test_loss: 0.9142, test_f1: 0.5814
 epoch: 15, train_loss: 0.7502, test_loss: 0.8956, test_f1: 0.5723
 epoch: 16, train_loss: 0.7371, test_loss: 0.8956, test_f1: 0.5821
 epoch: 17, train_loss: 0.7269, test_loss: 0.9173, test_f1: 0.5821
 epoch: 18, train_loss: 0.7409, test_loss: 0.8458, test_f1: 0.5698
 epoch: 19, train_loss: 0.7256, test_loss: 0.9259, test_f1: 0.6115
 epoch: 20, train_loss: 0.7123, test_loss: 0.8448, test_f1: 0.6007
 epoch: 21, train_loss: 0.6927, test_loss: 0.8786, test_f1: 0.5909
 epoch: 22, train_loss: 0.6896, test_loss: 0.9409, test_f1: 0.5904
 epoch: 23, train_loss: 0.6696, test_loss: 0.8794, test_f1: 0.5851
 epoch: 24, train_loss: 0.6919, test_loss: 1.0947, test_f1: 0.5778
 epoch: 25, train_loss: 0.6866, test_loss: 0.8899, test_f1: 0.5818
 epoch: 26, train_loss: 0.6834, test_loss: 0.9169, test_f1: 0.5850
 epoch: 27, train_loss: 0.6563, test_loss: 0.9639, test_f1: 0.6012
 epoch: 28, train_loss: 0.6480, test_loss: 0.8706, test_f1: 0.6639
 epoch: 29, train_loss: 0.6460, test_loss: 0.9706, test_f1: 0.6060
 epoch: 30, train_loss: 0.6245, test_loss: 0.9446, test_f1: 0.6156
 epoch: 31, train_loss: 0.6266, test_loss: 0.9888, test_f1: 0.6259
 epoch: 32, train_loss: 0.6217, test_loss: 0.9539, test_f1: 0.6004
 epoch: 33, train_loss: 0.6046, test_loss: 0.9772, test_f1: 0.6317
 epoch: 34, train_loss: 0.5925, test_loss: 1.0198, test_f1: 0.5931
 epoch: 35, train_loss: 0.5994, test_loss: 1.0227, test_f1: 0.5873
 epoch: 36, train_loss: 0.5984, test_loss: 0.9299, test_f1: 0.6581
 epoch: 37, train_loss: 0.5781, test_loss: 1.0629, test_f1: 0.5929
 epoch: 38, train_loss: 0.5689, test_loss: 1.0853, test_f1: 0.6147
 epoch: 39, train_loss: 0.5675, test_loss: 1.0586, test_f1: 0.6023
 epoch: 40, train_loss: 0.5678, test_loss: 1.0068, test_f1: 0.6221
 epoch: 41, train_loss: 0.5752, test_loss: 0.9901, test_f1: 0.6468
 epoch: 42, train_loss: 0.5412, test_loss: 1.0388, test_f1: 0.6612
 epoch: 43, train_loss: 0.5132, test_loss: 1.0342, test_f1: 0.6602
 epoch: 44, train_loss: 0.5166, test_loss: 1.0027, test_f1: 0.6466
 epoch: 45, train_loss: 0.5416, test_loss: 1.2039, test_f1: 0.5980
 epoch: 46, train_loss: 0.5197, test_loss: 1.0216, test_f1: 0.6523
 epoch: 47, train_loss: 0.4951, test_loss: 1.0875, test_f1: 0.6740
 epoch: 48, train_loss: 0.5055, test_loss: 1.1121, test_f1: 0.6706
 epoch: 49, train_loss: 0.4928, test_loss: 1.0986, test_f1: 0.6570
 epoch: 50, train_loss: 0.4958, test_loss: 1.0156, test_f1: 0.6323
 epoch: 51, train_loss: 0.4719, test_loss: 1.1033, test_f1: 0.6449
 epoch: 52, train_loss: 0.4483, test_loss: 1.0598, test_f1: 0.6650
 epoch: 53, train_loss: 0.4556, test_loss: 1.0605, test_f1: 0.6653
 epoch: 54, train_loss: 0.4227, test_loss: 1.0731, test_f1: 0.6673
 epoch: 55, train_loss: 0.4269, test_loss: 1.1496, test_f1: 0.6450
 epoch: 56, train_loss: 0.4214, test_loss: 1.0960, test_f1: 0.6382
 epoch: 57, train_loss: 0.4086, test_loss: 1.1269, test_f1: 0.6696
 epoch: 58, train_loss: 0.3999, test_loss: 1.1472, test_f1: 0.6494
 epoch: 59, train_loss: 0.4100, test_loss: 1.2483, test_f1: 0.6457
 epoch: 60, train_loss: 0.4053, test_loss: 1.1869, test_f1: 0.6518
 epoch: 61, train_loss: 0.4093, test_loss: 1.1401, test_f1: 0.6502
 epoch: 62, train_loss: 0.3989, test_loss: 1.2583, test_f1: 0.6428
 epoch: 63, train_loss: 0.3937, test_loss: 1.1678, test_f1: 0.6589
 epoch: 64, train_loss: 0.3656, test_loss: 1.2316, test_f1: 0.6331
 epoch: 65, train_loss: 0.3767, test_loss: 1.2282, test_f1: 0.6394
 epoch: 66, train_loss: 0.3771, test_loss: 1.2955, test_f1: 0.6299
 epoch: 67, train_loss: 0.3774, test_loss: 1.2456, test_f1: 0.6543
 epoch: 68, train_loss: 0.3660, test_loss: 1.3663, test_f1: 0.6519
 epoch: 69, train_loss: 0.3686, test_loss: 1.3175, test_f1: 0.6350
 epoch: 70, train_loss: 0.3727, test_loss: 1.3048, test_f1: 0.6443
 epoch: 71, train_loss: 0.3645, test_loss: 1.2483, test_f1: 0.6491
 epoch: 72, train_loss: 0.3554, test_loss: 1.2998, test_f1: 0.6619
 epoch: 73, train_loss: 0.3609, test_loss: 1.3142, test_f1: 0.6421
 epoch: 74, train_loss: 0.3600, test_loss: 1.3456, test_f1: 0.6353
 epoch: 75, train_loss: 0.3643, test_loss: 1.2470, test_f1: 0.6365
 epoch: 76, train_loss: 0.3573, test_loss: 1.3207, test_f1: 0.6670
 epoch: 77, train_loss: 0.3529, test_loss: 1.3209, test_f1: 0.6724
 epoch: 78, train_loss: 0.3548, test_loss: 1.3232, test_f1: 0.6612
 epoch: 79, train_loss: 0.3533, test_loss: 1.3069, test_f1: 0.6369
 epoch: 80, train_loss: 0.3469, test_loss: 1.3073, test_f1: 0.6621
 epoch: 81, train_loss: 0.3225, test_loss: 1.4274, test_f1: 0.6433
 epoch: 82, train_loss: 0.3412, test_loss: 1.3916, test_f1: 0.6297
 epoch: 83, train_loss: 0.3322, test_loss: 1.3655, test_f1: 0.6332
 epoch: 84, train_loss: 0.3104, test_loss: 1.3467, test_f1: 0.6667
 epoch: 85, train_loss: 0.3167, test_loss: 1.4924, test_f1: 0.6486
 epoch: 86, train_loss: 0.3122, test_loss: 1.3598, test_f1: 0.6650
 epoch: 87, train_loss: 0.3063, test_loss: 1.4183, test_f1: 0.6481
 epoch: 88, train_loss: 0.3092, test_loss: 1.4331, test_f1: 0.6591
 epoch: 89, train_loss: 0.3109, test_loss: 1.5232, test_f1: 0.6371
 epoch: 90, train_loss: 0.3214, test_loss: 1.5085, test_f1: 0.6743
 epoch: 91, train_loss: 0.3449, test_loss: 1.5523, test_f1: 0.6273
 epoch: 92, train_loss: 0.3042, test_loss: 1.3965, test_f1: 0.6568
 epoch: 93, train_loss: 0.3176, test_loss: 1.4809, test_f1: 0.6396
 epoch: 94, train_loss: 0.3084, test_loss: 1.4576, test_f1: 0.6702
 epoch: 95, train_loss: 0.3012, test_loss: 1.4415, test_f1: 0.6620
 epoch: 96, train_loss: 0.3094, test_loss: 1.5883, test_f1: 0.6480
 epoch: 97, train_loss: 0.3035, test_loss: 1.4908, test_f1: 0.6485
 epoch: 98, train_loss: 0.3222, test_loss: 1.6751, test_f1: 0.6162
 epoch: 99, train_loss: 0.2908, test_loss: 1.4272, test_f1: 0.6690
##################ITERATION #4 ****************************************
 epoch: 0, train_loss: 1.4651, test_loss: 1.3403, test_f1: 0.2270
 epoch: 1, train_loss: 1.0900, test_loss: 1.2378, test_f1: 0.2270
 epoch: 2, train_loss: 0.9977, test_loss: 1.0158, test_f1: 0.4230
 epoch: 3, train_loss: 0.9549, test_loss: 0.9638, test_f1: 0.5088
 epoch: 4, train_loss: 0.9304, test_loss: 0.9659, test_f1: 0.5183
 epoch: 5, train_loss: 0.9029, test_loss: 0.9244, test_f1: 0.5199
 epoch: 6, train_loss: 0.8748, test_loss: 0.8768, test_f1: 0.5102
 epoch: 7, train_loss: 0.8626, test_loss: 0.9108, test_f1: 0.5433
 epoch: 8, train_loss: 0.8513, test_loss: 0.8703, test_f1: 0.5826
 epoch: 9, train_loss: 0.8376, test_loss: 0.9069, test_f1: 0.5456
 epoch: 10, train_loss: 0.8245, test_loss: 0.8926, test_f1: 0.5835
 epoch: 11, train_loss: 0.8141, test_loss: 0.9172, test_f1: 0.5563
 epoch: 12, train_loss: 0.7982, test_loss: 0.9351, test_f1: 0.5458
 epoch: 13, train_loss: 0.7825, test_loss: 0.8996, test_f1: 0.5732
 epoch: 14, train_loss: 0.7648, test_loss: 0.9836, test_f1: 0.5612
 epoch: 15, train_loss: 0.7622, test_loss: 0.8974, test_f1: 0.6183
 epoch: 16, train_loss: 0.7509, test_loss: 0.8607, test_f1: 0.6277
 epoch: 17, train_loss: 0.7365, test_loss: 0.9172, test_f1: 0.5883
 epoch: 18, train_loss: 0.7255, test_loss: 0.8876, test_f1: 0.5779
 epoch: 19, train_loss: 0.7180, test_loss: 0.8767, test_f1: 0.6087
 epoch: 20, train_loss: 0.7042, test_loss: 0.9035, test_f1: 0.5992
 epoch: 21, train_loss: 0.7083, test_loss: 0.8776, test_f1: 0.6053
 epoch: 22, train_loss: 0.6929, test_loss: 0.9004, test_f1: 0.6356
 epoch: 23, train_loss: 0.6870, test_loss: 1.0127, test_f1: 0.5731
 epoch: 24, train_loss: 0.6913, test_loss: 0.9011, test_f1: 0.6608
 epoch: 25, train_loss: 0.6760, test_loss: 0.9123, test_f1: 0.6340
 epoch: 26, train_loss: 0.6575, test_loss: 0.9059, test_f1: 0.6510
 epoch: 27, train_loss: 0.6509, test_loss: 0.8715, test_f1: 0.6461
 epoch: 28, train_loss: 0.6385, test_loss: 0.9060, test_f1: 0.6303
 epoch: 29, train_loss: 0.6373, test_loss: 0.8859, test_f1: 0.6467
 epoch: 30, train_loss: 0.6368, test_loss: 0.9266, test_f1: 0.6595
 epoch: 31, train_loss: 0.6132, test_loss: 0.8846, test_f1: 0.6427
 epoch: 32, train_loss: 0.6284, test_loss: 0.8838, test_f1: 0.6556
 epoch: 33, train_loss: 0.6075, test_loss: 0.9602, test_f1: 0.6192
 epoch: 34, train_loss: 0.5986, test_loss: 0.9363, test_f1: 0.6365
 epoch: 35, train_loss: 0.6103, test_loss: 0.9094, test_f1: 0.6635
 epoch: 36, train_loss: 0.5739, test_loss: 0.9437, test_f1: 0.6280
 epoch: 37, train_loss: 0.5736, test_loss: 1.0412, test_f1: 0.5805
 epoch: 38, train_loss: 0.5640, test_loss: 0.9447, test_f1: 0.6460
 epoch: 39, train_loss: 0.5593, test_loss: 0.9218, test_f1: 0.6435
 epoch: 40, train_loss: 0.5506, test_loss: 0.9411, test_f1: 0.6495
 epoch: 41, train_loss: 0.5488, test_loss: 0.9726, test_f1: 0.5988
 epoch: 42, train_loss: 0.5550, test_loss: 0.9279, test_f1: 0.6705
 epoch: 43, train_loss: 0.5536, test_loss: 0.8490, test_f1: 0.6723
 epoch: 44, train_loss: 0.5280, test_loss: 0.9064, test_f1: 0.6594
 epoch: 45, train_loss: 0.5197, test_loss: 1.0120, test_f1: 0.6582
 epoch: 46, train_loss: 0.5106, test_loss: 0.9021, test_f1: 0.6432
 epoch: 47, train_loss: 0.5077, test_loss: 0.9634, test_f1: 0.6377
 epoch: 48, train_loss: 0.5161, test_loss: 0.9458, test_f1: 0.6377
 epoch: 49, train_loss: 0.4843, test_loss: 0.9442, test_f1: 0.6593
 epoch: 50, train_loss: 0.4971, test_loss: 0.9408, test_f1: 0.6616
 epoch: 51, train_loss: 0.4657, test_loss: 1.0156, test_f1: 0.6653
 epoch: 52, train_loss: 0.4437, test_loss: 0.9746, test_f1: 0.6779
 epoch: 53, train_loss: 0.4449, test_loss: 0.9513, test_f1: 0.6715
 epoch: 54, train_loss: 0.4270, test_loss: 0.9805, test_f1: 0.6742
 epoch: 55, train_loss: 0.4190, test_loss: 1.0029, test_f1: 0.6692
 epoch: 56, train_loss: 0.4151, test_loss: 1.0224, test_f1: 0.6816
 epoch: 57, train_loss: 0.4118, test_loss: 1.0541, test_f1: 0.6792
 epoch: 58, train_loss: 0.4081, test_loss: 1.0232, test_f1: 0.6470
 epoch: 59, train_loss: 0.4046, test_loss: 0.9786, test_f1: 0.6886
 epoch: 60, train_loss: 0.4013, test_loss: 1.0546, test_f1: 0.6616
 epoch: 61, train_loss: 0.4028, test_loss: 1.0381, test_f1: 0.6678
 epoch: 62, train_loss: 0.4100, test_loss: 1.0988, test_f1: 0.6704
 epoch: 63, train_loss: 0.3976, test_loss: 1.2219, test_f1: 0.6250
 epoch: 64, train_loss: 0.4021, test_loss: 1.0845, test_f1: 0.6729
 epoch: 65, train_loss: 0.4058, test_loss: 1.0857, test_f1: 0.6861
 epoch: 66, train_loss: 0.3881, test_loss: 1.0845, test_f1: 0.6789
 epoch: 67, train_loss: 0.3802, test_loss: 1.1184, test_f1: 0.6629
 epoch: 68, train_loss: 0.3618, test_loss: 1.0416, test_f1: 0.6670
 epoch: 69, train_loss: 0.3626, test_loss: 1.1079, test_f1: 0.6618
 epoch: 70, train_loss: 0.3652, test_loss: 1.1455, test_f1: 0.6776
 epoch: 71, train_loss: 0.3788, test_loss: 1.1556, test_f1: 0.6590
 epoch: 72, train_loss: 0.3612, test_loss: 1.1494, test_f1: 0.6648
 epoch: 73, train_loss: 0.3613, test_loss: 1.1224, test_f1: 0.6793
 epoch: 74, train_loss: 0.3474, test_loss: 1.1696, test_f1: 0.6590
 epoch: 75, train_loss: 0.3564, test_loss: 1.1847, test_f1: 0.6609
 epoch: 76, train_loss: 0.3379, test_loss: 1.2307, test_f1: 0.6878
 epoch: 77, train_loss: 0.3496, test_loss: 1.1655, test_f1: 0.6770
 epoch: 78, train_loss: 0.3333, test_loss: 1.2540, test_f1: 0.6569
 epoch: 79, train_loss: 0.3406, test_loss: 1.1510, test_f1: 0.6858
 epoch: 80, train_loss: 0.3314, test_loss: 1.1908, test_f1: 0.6940
 epoch: 81, train_loss: 0.3282, test_loss: 1.1710, test_f1: 0.6494
 epoch: 82, train_loss: 0.3519, test_loss: 1.2834, test_f1: 0.6538
 epoch: 83, train_loss: 0.3400, test_loss: 1.1518, test_f1: 0.6812
 epoch: 84, train_loss: 0.3314, test_loss: 1.1714, test_f1: 0.6583
 epoch: 85, train_loss: 0.3256, test_loss: 1.2256, test_f1: 0.6956
 epoch: 86, train_loss: 0.3190, test_loss: 1.3529, test_f1: 0.6631
 epoch: 87, train_loss: 0.3153, test_loss: 1.3203, test_f1: 0.6529
 epoch: 88, train_loss: 0.3111, test_loss: 1.2076, test_f1: 0.6889
 epoch: 89, train_loss: 0.3249, test_loss: 1.2800, test_f1: 0.6757
 epoch: 90, train_loss: 0.3133, test_loss: 1.3913, test_f1: 0.6744
 epoch: 91, train_loss: 0.3170, test_loss: 1.2926, test_f1: 0.6900
 epoch: 92, train_loss: 0.3114, test_loss: 1.2587, test_f1: 0.6656
 epoch: 93, train_loss: 0.3037, test_loss: 1.3184, test_f1: 0.6970
 epoch: 94, train_loss: 0.2996, test_loss: 1.3295, test_f1: 0.6660
 epoch: 95, train_loss: 0.2922, test_loss: 1.4419, test_f1: 0.6542
 epoch: 96, train_loss: 0.2946, test_loss: 1.4392, test_f1: 0.6552
 epoch: 97, train_loss: 0.2868, test_loss: 1.3349, test_f1: 0.6964
 epoch: 98, train_loss: 0.2946, test_loss: 1.4029, test_f1: 0.6588
 epoch: 99, train_loss: 0.2962, test_loss: 1.4098, test_f1: 0.6888
##################ITERATION #5 ****************************************
 epoch: 0, train_loss: 1.7396, test_loss: 1.3719, test_f1: 0.2287
 epoch: 1, train_loss: 1.1177, test_loss: 1.1649, test_f1: 0.3322
 epoch: 2, train_loss: 1.0117, test_loss: 1.0228, test_f1: 0.4003
 epoch: 3, train_loss: 0.9527, test_loss: 0.9843, test_f1: 0.4584
 epoch: 4, train_loss: 0.9284, test_loss: 0.9538, test_f1: 0.4690
 epoch: 5, train_loss: 0.9056, test_loss: 0.9369, test_f1: 0.5080
 epoch: 6, train_loss: 0.8883, test_loss: 0.9519, test_f1: 0.5136
 epoch: 7, train_loss: 0.8643, test_loss: 0.9287, test_f1: 0.5289
 epoch: 8, train_loss: 0.8531, test_loss: 0.9187, test_f1: 0.5350
 epoch: 9, train_loss: 0.8322, test_loss: 0.9204, test_f1: 0.5436
 epoch: 10, train_loss: 0.8318, test_loss: 0.8802, test_f1: 0.5586
 epoch: 11, train_loss: 0.8081, test_loss: 0.9119, test_f1: 0.5669
 epoch: 12, train_loss: 0.8023, test_loss: 1.0377, test_f1: 0.5257
 epoch: 13, train_loss: 0.7947, test_loss: 0.9650, test_f1: 0.5597
 epoch: 14, train_loss: 0.7791, test_loss: 0.9315, test_f1: 0.5880
 epoch: 15, train_loss: 0.7766, test_loss: 0.9248, test_f1: 0.5850
 epoch: 16, train_loss: 0.7657, test_loss: 0.8925, test_f1: 0.6146
 epoch: 17, train_loss: 0.7462, test_loss: 0.8775, test_f1: 0.6496
 epoch: 18, train_loss: 0.7391, test_loss: 1.0061, test_f1: 0.5574
 epoch: 19, train_loss: 0.7248, test_loss: 0.9802, test_f1: 0.5829
 epoch: 20, train_loss: 0.7071, test_loss: 0.9260, test_f1: 0.5812
 epoch: 21, train_loss: 0.7081, test_loss: 0.9457, test_f1: 0.6201
 epoch: 22, train_loss: 0.7017, test_loss: 0.9469, test_f1: 0.6221
 epoch: 23, train_loss: 0.6838, test_loss: 0.9108, test_f1: 0.6442
 epoch: 24, train_loss: 0.6762, test_loss: 0.9117, test_f1: 0.6348
 epoch: 25, train_loss: 0.6765, test_loss: 0.9577, test_f1: 0.6112
 epoch: 26, train_loss: 0.6669, test_loss: 0.9897, test_f1: 0.6426
 epoch: 27, train_loss: 0.6644, test_loss: 0.9906, test_f1: 0.6466
 epoch: 28, train_loss: 0.6533, test_loss: 1.0730, test_f1: 0.5674
 epoch: 29, train_loss: 0.6448, test_loss: 0.9277, test_f1: 0.6408
 epoch: 30, train_loss: 0.6431, test_loss: 1.2797, test_f1: 0.5777
 epoch: 31, train_loss: 0.6398, test_loss: 0.9282, test_f1: 0.6626
 epoch: 32, train_loss: 0.6231, test_loss: 1.0207, test_f1: 0.6224
 epoch: 33, train_loss: 0.5910, test_loss: 0.9609, test_f1: 0.6619
 epoch: 34, train_loss: 0.5925, test_loss: 0.9949, test_f1: 0.6807
 epoch: 35, train_loss: 0.6024, test_loss: 1.0212, test_f1: 0.6375
 epoch: 36, train_loss: 0.5862, test_loss: 0.9979, test_f1: 0.6338
 epoch: 37, train_loss: 0.5780, test_loss: 1.0245, test_f1: 0.6621
 epoch: 38, train_loss: 0.5589, test_loss: 0.9697, test_f1: 0.6620
 epoch: 39, train_loss: 0.5541, test_loss: 0.9899, test_f1: 0.6645
 epoch: 40, train_loss: 0.5531, test_loss: 0.9544, test_f1: 0.6498
 epoch: 41, train_loss: 0.5404, test_loss: 1.0048, test_f1: 0.6630
 epoch: 42, train_loss: 0.5475, test_loss: 1.0254, test_f1: 0.6141
 epoch: 43, train_loss: 0.5332, test_loss: 1.0393, test_f1: 0.6193
 epoch: 44, train_loss: 0.5423, test_loss: 1.0234, test_f1: 0.6809
 epoch: 45, train_loss: 0.5177, test_loss: 1.0817, test_f1: 0.6742
 epoch: 46, train_loss: 0.5152, test_loss: 1.0399, test_f1: 0.6967
 epoch: 47, train_loss: 0.5136, test_loss: 1.0326, test_f1: 0.6673
 epoch: 48, train_loss: 0.4964, test_loss: 1.0445, test_f1: 0.6919
 epoch: 49, train_loss: 0.4977, test_loss: 1.0312, test_f1: 0.6948
 epoch: 50, train_loss: 0.4935, test_loss: 1.0830, test_f1: 0.6514
 epoch: 51, train_loss: 0.4750, test_loss: 1.0530, test_f1: 0.7003
 epoch: 52, train_loss: 0.4392, test_loss: 1.0578, test_f1: 0.6663
 epoch: 53, train_loss: 0.4260, test_loss: 1.0872, test_f1: 0.6676
 epoch: 54, train_loss: 0.4207, test_loss: 1.0948, test_f1: 0.6838
 epoch: 55, train_loss: 0.4281, test_loss: 1.1323, test_f1: 0.6691
 epoch: 56, train_loss: 0.4410, test_loss: 1.0528, test_f1: 0.6979
 epoch: 57, train_loss: 0.4208, test_loss: 1.1082, test_f1: 0.6808
 epoch: 58, train_loss: 0.4071, test_loss: 1.0929, test_f1: 0.6867
 epoch: 59, train_loss: 0.4187, test_loss: 1.1847, test_f1: 0.6583
 epoch: 60, train_loss: 0.4004, test_loss: 1.1087, test_f1: 0.7046
 epoch: 61, train_loss: 0.3955, test_loss: 1.1805, test_f1: 0.6901
 epoch: 62, train_loss: 0.4243, test_loss: 1.2173, test_f1: 0.6881
 epoch: 63, train_loss: 0.4092, test_loss: 1.1914, test_f1: 0.6812
 epoch: 64, train_loss: 0.3936, test_loss: 1.1734, test_f1: 0.6631
 epoch: 65, train_loss: 0.3870, test_loss: 1.1481, test_f1: 0.6861
 epoch: 66, train_loss: 0.3811, test_loss: 1.1367, test_f1: 0.6645
 epoch: 67, train_loss: 0.3713, test_loss: 1.1656, test_f1: 0.6814
 epoch: 68, train_loss: 0.3781, test_loss: 1.2822, test_f1: 0.6654
 epoch: 69, train_loss: 0.3686, test_loss: 1.1871, test_f1: 0.6750
 epoch: 70, train_loss: 0.3729, test_loss: 1.2582, test_f1: 0.6690
 epoch: 71, train_loss: 0.3577, test_loss: 1.2247, test_f1: 0.6840
 epoch: 72, train_loss: 0.3688, test_loss: 1.2236, test_f1: 0.6813
 epoch: 73, train_loss: 0.3550, test_loss: 1.2714, test_f1: 0.6698
 epoch: 74, train_loss: 0.3571, test_loss: 1.2913, test_f1: 0.6795
 epoch: 75, train_loss: 0.3540, test_loss: 1.2543, test_f1: 0.6825
 epoch: 76, train_loss: 0.3612, test_loss: 1.3205, test_f1: 0.6651
 epoch: 77, train_loss: 0.3576, test_loss: 1.3396, test_f1: 0.6549
 epoch: 78, train_loss: 0.3497, test_loss: 1.3753, test_f1: 0.6655
 epoch: 79, train_loss: 0.3456, test_loss: 1.3017, test_f1: 0.6790
 epoch: 80, train_loss: 0.3421, test_loss: 1.3403, test_f1: 0.6715
 epoch: 81, train_loss: 0.3342, test_loss: 1.2647, test_f1: 0.6753
 epoch: 82, train_loss: 0.3256, test_loss: 1.3342, test_f1: 0.6693
 epoch: 83, train_loss: 0.3279, test_loss: 1.4124, test_f1: 0.6569
 epoch: 84, train_loss: 0.3212, test_loss: 1.4335, test_f1: 0.6434
 epoch: 85, train_loss: 0.3371, test_loss: 1.3606, test_f1: 0.6613
 epoch: 86, train_loss: 0.3229, test_loss: 1.4503, test_f1: 0.6550
 epoch: 87, train_loss: 0.3220, test_loss: 1.5068, test_f1: 0.6446
 epoch: 88, train_loss: 0.3232, test_loss: 1.3752, test_f1: 0.6726
 epoch: 89, train_loss: 0.3266, test_loss: 1.3752, test_f1: 0.6821
 epoch: 90, train_loss: 0.3165, test_loss: 1.3110, test_f1: 0.6978
 epoch: 91, train_loss: 0.3204, test_loss: 1.3253, test_f1: 0.6634
 epoch: 92, train_loss: 0.2965, test_loss: 1.3558, test_f1: 0.6795
 epoch: 93, train_loss: 0.3007, test_loss: 1.4079, test_f1: 0.6835
 epoch: 94, train_loss: 0.2983, test_loss: 1.4005, test_f1: 0.6703
 epoch: 95, train_loss: 0.3082, test_loss: 1.4098, test_f1: 0.6728
 epoch: 96, train_loss: 0.2970, test_loss: 1.4393, test_f1: 0.6878
 epoch: 97, train_loss: 0.2964, test_loss: 1.3913, test_f1: 0.6781
 epoch: 98, train_loss: 0.3079, test_loss: 1.5733, test_f1: 0.6693
 epoch: 99, train_loss: 0.3068, test_loss: 1.4184, test_f1: 0.6793
##################ITERATION #6 ****************************************
 epoch: 0, train_loss: 1.6923, test_loss: 1.4125, test_f1: 0.2392
 epoch: 1, train_loss: 1.0789, test_loss: 1.1680, test_f1: 0.3633
 epoch: 2, train_loss: 1.0052, test_loss: 1.0224, test_f1: 0.4235
 epoch: 3, train_loss: 0.9594, test_loss: 1.0024, test_f1: 0.4295
 epoch: 4, train_loss: 0.9175, test_loss: 0.9906, test_f1: 0.4841
 epoch: 5, train_loss: 0.8917, test_loss: 0.9369, test_f1: 0.5052
 epoch: 6, train_loss: 0.8882, test_loss: 0.9232, test_f1: 0.5007
 epoch: 7, train_loss: 0.8700, test_loss: 0.8863, test_f1: 0.5387
 epoch: 8, train_loss: 0.8563, test_loss: 0.9511, test_f1: 0.5355
 epoch: 9, train_loss: 0.8358, test_loss: 0.9309, test_f1: 0.5723
 epoch: 10, train_loss: 0.8163, test_loss: 0.8513, test_f1: 0.5697
 epoch: 11, train_loss: 0.7985, test_loss: 0.9054, test_f1: 0.5503
 epoch: 12, train_loss: 0.7921, test_loss: 0.8802, test_f1: 0.5694
 epoch: 13, train_loss: 0.7864, test_loss: 0.8944, test_f1: 0.6019
 epoch: 14, train_loss: 0.7710, test_loss: 0.9441, test_f1: 0.5601
 epoch: 15, train_loss: 0.7770, test_loss: 0.9304, test_f1: 0.5441
 epoch: 16, train_loss: 0.7615, test_loss: 0.9307, test_f1: 0.5797
 epoch: 17, train_loss: 0.7439, test_loss: 0.8685, test_f1: 0.5848
 epoch: 18, train_loss: 0.7202, test_loss: 0.9222, test_f1: 0.5865
 epoch: 19, train_loss: 0.7144, test_loss: 0.8999, test_f1: 0.5848
 epoch: 20, train_loss: 0.7058, test_loss: 0.8901, test_f1: 0.6162
 epoch: 21, train_loss: 0.6977, test_loss: 0.8878, test_f1: 0.6004
 epoch: 22, train_loss: 0.7014, test_loss: 0.9221, test_f1: 0.5786
 epoch: 23, train_loss: 0.6784, test_loss: 0.9221, test_f1: 0.5965
 epoch: 24, train_loss: 0.6703, test_loss: 0.8396, test_f1: 0.6705
 epoch: 25, train_loss: 0.6656, test_loss: 0.8781, test_f1: 0.5943
 epoch: 26, train_loss: 0.6579, test_loss: 0.9344, test_f1: 0.5831
 epoch: 27, train_loss: 0.6593, test_loss: 0.9230, test_f1: 0.6198
 epoch: 28, train_loss: 0.6387, test_loss: 0.9761, test_f1: 0.5908
 epoch: 29, train_loss: 0.6446, test_loss: 0.9746, test_f1: 0.5938
 epoch: 30, train_loss: 0.6322, test_loss: 0.9274, test_f1: 0.6381
 epoch: 31, train_loss: 0.6106, test_loss: 0.8936, test_f1: 0.6357
 epoch: 32, train_loss: 0.6044, test_loss: 0.9395, test_f1: 0.6047
 epoch: 33, train_loss: 0.5992, test_loss: 0.8969, test_f1: 0.6014
 epoch: 34, train_loss: 0.5840, test_loss: 0.9741, test_f1: 0.5866
 epoch: 35, train_loss: 0.5999, test_loss: 0.9148, test_f1: 0.6714
 epoch: 36, train_loss: 0.6005, test_loss: 0.9875, test_f1: 0.5985
 epoch: 37, train_loss: 0.5824, test_loss: 1.0223, test_f1: 0.6099
 epoch: 38, train_loss: 0.5755, test_loss: 1.0032, test_f1: 0.5964
 epoch: 39, train_loss: 0.5629, test_loss: 0.9933, test_f1: 0.6285
 epoch: 40, train_loss: 0.5599, test_loss: 0.9228, test_f1: 0.6291
 epoch: 41, train_loss: 0.5605, test_loss: 0.9777, test_f1: 0.7040
 epoch: 42, train_loss: 0.5280, test_loss: 0.9605, test_f1: 0.6429
 epoch: 43, train_loss: 0.5416, test_loss: 0.9952, test_f1: 0.6397
 epoch: 44, train_loss: 0.5245, test_loss: 1.0762, test_f1: 0.6247
 epoch: 45, train_loss: 0.5026, test_loss: 1.0682, test_f1: 0.6691
 epoch: 46, train_loss: 0.5008, test_loss: 1.0585, test_f1: 0.6395
 epoch: 47, train_loss: 0.5195, test_loss: 1.0055, test_f1: 0.6546
 epoch: 48, train_loss: 0.4973, test_loss: 1.0333, test_f1: 0.6214
 epoch: 49, train_loss: 0.4919, test_loss: 1.0188, test_f1: 0.6607
 epoch: 50, train_loss: 0.4710, test_loss: 1.0260, test_f1: 0.6504
 epoch: 51, train_loss: 0.4607, test_loss: 1.0553, test_f1: 0.6258
 epoch: 52, train_loss: 0.4481, test_loss: 1.0478, test_f1: 0.6404
 epoch: 53, train_loss: 0.4309, test_loss: 1.0796, test_f1: 0.6617
 epoch: 54, train_loss: 0.4035, test_loss: 1.1267, test_f1: 0.6406
 epoch: 55, train_loss: 0.4256, test_loss: 1.1024, test_f1: 0.6353
 epoch: 56, train_loss: 0.4072, test_loss: 1.1021, test_f1: 0.6336
 epoch: 57, train_loss: 0.4029, test_loss: 1.1582, test_f1: 0.6374
 epoch: 58, train_loss: 0.4036, test_loss: 1.0961, test_f1: 0.6547
 epoch: 59, train_loss: 0.3931, test_loss: 1.1211, test_f1: 0.6547
 epoch: 60, train_loss: 0.3826, test_loss: 1.1554, test_f1: 0.6623
 epoch: 61, train_loss: 0.3983, test_loss: 1.2295, test_f1: 0.6098
 epoch: 62, train_loss: 0.3952, test_loss: 1.1520, test_f1: 0.6503
 epoch: 63, train_loss: 0.3937, test_loss: 1.1644, test_f1: 0.6533
 epoch: 64, train_loss: 0.3750, test_loss: 1.2037, test_f1: 0.6397
 epoch: 65, train_loss: 0.3745, test_loss: 1.1216, test_f1: 0.6583
 epoch: 66, train_loss: 0.3742, test_loss: 1.1631, test_f1: 0.6492
 epoch: 67, train_loss: 0.3713, test_loss: 1.1161, test_f1: 0.6589
 epoch: 68, train_loss: 0.3762, test_loss: 1.2082, test_f1: 0.6482
 epoch: 69, train_loss: 0.3558, test_loss: 1.2008, test_f1: 0.6541
 epoch: 70, train_loss: 0.3519, test_loss: 1.1604, test_f1: 0.6520
 epoch: 71, train_loss: 0.3751, test_loss: 1.2213, test_f1: 0.6473
 epoch: 72, train_loss: 0.3552, test_loss: 1.2203, test_f1: 0.6633
 epoch: 73, train_loss: 0.3558, test_loss: 1.2325, test_f1: 0.6531
 epoch: 74, train_loss: 0.3516, test_loss: 1.2236, test_f1: 0.6460
 epoch: 75, train_loss: 0.3624, test_loss: 1.2636, test_f1: 0.6668
 epoch: 76, train_loss: 0.3436, test_loss: 1.1757, test_f1: 0.6503
 epoch: 77, train_loss: 0.3434, test_loss: 1.2489, test_f1: 0.6666
 epoch: 78, train_loss: 0.3373, test_loss: 1.3563, test_f1: 0.6374
 epoch: 79, train_loss: 0.3434, test_loss: 1.2556, test_f1: 0.6684
 epoch: 80, train_loss: 0.3414, test_loss: 1.2792, test_f1: 0.6571
 epoch: 81, train_loss: 0.3337, test_loss: 1.4160, test_f1: 0.6524
 epoch: 82, train_loss: 0.3372, test_loss: 1.2586, test_f1: 0.6790
 epoch: 83, train_loss: 0.3300, test_loss: 1.3010, test_f1: 0.6621
 epoch: 84, train_loss: 0.3312, test_loss: 1.3143, test_f1: 0.6369
 epoch: 85, train_loss: 0.3146, test_loss: 1.3372, test_f1: 0.6561
 epoch: 86, train_loss: 0.3295, test_loss: 1.3534, test_f1: 0.6712
 epoch: 87, train_loss: 0.3031, test_loss: 1.2811, test_f1: 0.6305
 epoch: 88, train_loss: 0.2970, test_loss: 1.4189, test_f1: 0.6425
 epoch: 89, train_loss: 0.3099, test_loss: 1.3800, test_f1: 0.6652
 epoch: 90, train_loss: 0.3139, test_loss: 1.3452, test_f1: 0.6315
 epoch: 91, train_loss: 0.3142, test_loss: 1.3944, test_f1: 0.6680
 epoch: 92, train_loss: 0.3083, test_loss: 1.4062, test_f1: 0.6541
 epoch: 93, train_loss: 0.3014, test_loss: 1.3892, test_f1: 0.6663
 epoch: 94, train_loss: 0.3015, test_loss: 1.4219, test_f1: 0.6667
 epoch: 95, train_loss: 0.2942, test_loss: 1.4147, test_f1: 0.6623
 epoch: 96, train_loss: 0.2867, test_loss: 1.3919, test_f1: 0.6618
 epoch: 97, train_loss: 0.2940, test_loss: 1.4177, test_f1: 0.6584
 epoch: 98, train_loss: 0.2793, test_loss: 1.4222, test_f1: 0.6586
 epoch: 99, train_loss: 0.2824, test_loss: 1.4870, test_f1: 0.6458
##################ITERATION #7 ****************************************
 epoch: 0, train_loss: 1.6621, test_loss: 1.4239, test_f1: 0.2394
 epoch: 1, train_loss: 1.1022, test_loss: 1.1787, test_f1: 0.3486
 epoch: 2, train_loss: 1.0112, test_loss: 1.0185, test_f1: 0.4113
 epoch: 3, train_loss: 0.9738, test_loss: 0.9576, test_f1: 0.4412
 epoch: 4, train_loss: 0.9439, test_loss: 0.9568, test_f1: 0.4682
 epoch: 5, train_loss: 0.9157, test_loss: 0.9015, test_f1: 0.4755
 epoch: 6, train_loss: 0.8967, test_loss: 0.9048, test_f1: 0.4861
 epoch: 7, train_loss: 0.8881, test_loss: 0.9519, test_f1: 0.4889
 epoch: 8, train_loss: 0.8729, test_loss: 0.8921, test_f1: 0.5214
 epoch: 9, train_loss: 0.8524, test_loss: 0.9058, test_f1: 0.5220
 epoch: 10, train_loss: 0.8477, test_loss: 0.9483, test_f1: 0.5058
 epoch: 11, train_loss: 0.8273, test_loss: 0.8639, test_f1: 0.5350
 epoch: 12, train_loss: 0.8365, test_loss: 0.8733, test_f1: 0.5497
 epoch: 13, train_loss: 0.8165, test_loss: 0.9264, test_f1: 0.5518
 epoch: 14, train_loss: 0.8035, test_loss: 0.9689, test_f1: 0.5144
 epoch: 15, train_loss: 0.7939, test_loss: 0.8800, test_f1: 0.5397
 epoch: 16, train_loss: 0.7829, test_loss: 0.8964, test_f1: 0.5643
 epoch: 17, train_loss: 0.7746, test_loss: 0.9208, test_f1: 0.5366
 epoch: 18, train_loss: 0.7650, test_loss: 0.9153, test_f1: 0.5823
 epoch: 19, train_loss: 0.7651, test_loss: 0.9414, test_f1: 0.5638
 epoch: 20, train_loss: 0.7546, test_loss: 0.9062, test_f1: 0.5663
 epoch: 21, train_loss: 0.7226, test_loss: 0.9599, test_f1: 0.5458
 epoch: 22, train_loss: 0.7320, test_loss: 0.9752, test_f1: 0.5331
 epoch: 23, train_loss: 0.7253, test_loss: 1.1559, test_f1: 0.4828
 epoch: 24, train_loss: 0.7129, test_loss: 0.9115, test_f1: 0.5717
 epoch: 25, train_loss: 0.7041, test_loss: 0.9345, test_f1: 0.5809
 epoch: 26, train_loss: 0.7060, test_loss: 1.0017, test_f1: 0.5645
 epoch: 27, train_loss: 0.6864, test_loss: 0.8919, test_f1: 0.5884
 epoch: 28, train_loss: 0.6791, test_loss: 0.9288, test_f1: 0.5792
 epoch: 29, train_loss: 0.6722, test_loss: 0.9578, test_f1: 0.5925
 epoch: 30, train_loss: 0.6709, test_loss: 0.9919, test_f1: 0.5444
 epoch: 31, train_loss: 0.6539, test_loss: 0.9099, test_f1: 0.6065
 epoch: 32, train_loss: 0.6553, test_loss: 1.0523, test_f1: 0.5630
 epoch: 33, train_loss: 0.6369, test_loss: 0.9705, test_f1: 0.5591
 epoch: 34, train_loss: 0.6406, test_loss: 0.9437, test_f1: 0.6111
 epoch: 35, train_loss: 0.6311, test_loss: 1.0950, test_f1: 0.5824
 epoch: 36, train_loss: 0.6189, test_loss: 0.9634, test_f1: 0.6125
 epoch: 37, train_loss: 0.6080, test_loss: 1.0303, test_f1: 0.5785
 epoch: 38, train_loss: 0.6072, test_loss: 1.0175, test_f1: 0.5845
 epoch: 39, train_loss: 0.6091, test_loss: 0.9686, test_f1: 0.6199
 epoch: 40, train_loss: 0.5978, test_loss: 0.9909, test_f1: 0.5996
 epoch: 41, train_loss: 0.5875, test_loss: 1.0315, test_f1: 0.5973
 epoch: 42, train_loss: 0.6001, test_loss: 0.9644, test_f1: 0.6255
 epoch: 43, train_loss: 0.5698, test_loss: 0.9838, test_f1: 0.5864
 epoch: 44, train_loss: 0.5679, test_loss: 0.9174, test_f1: 0.6432
 epoch: 45, train_loss: 0.5608, test_loss: 0.9994, test_f1: 0.6071
 epoch: 46, train_loss: 0.5442, test_loss: 1.0962, test_f1: 0.6078
 epoch: 47, train_loss: 0.5370, test_loss: 1.0338, test_f1: 0.6110
 epoch: 48, train_loss: 0.5331, test_loss: 1.0515, test_f1: 0.6237
 epoch: 49, train_loss: 0.5364, test_loss: 1.0763, test_f1: 0.6146
 epoch: 50, train_loss: 0.5391, test_loss: 1.1146, test_f1: 0.6379
 epoch: 51, train_loss: 0.5213, test_loss: 1.0381, test_f1: 0.6416
 epoch: 52, train_loss: 0.4905, test_loss: 1.0560, test_f1: 0.6351
 epoch: 53, train_loss: 0.4792, test_loss: 1.0794, test_f1: 0.6185
 epoch: 54, train_loss: 0.4699, test_loss: 1.0257, test_f1: 0.6355
 epoch: 55, train_loss: 0.4766, test_loss: 1.0576, test_f1: 0.6410
 epoch: 56, train_loss: 0.4663, test_loss: 1.0701, test_f1: 0.6177
 epoch: 57, train_loss: 0.4608, test_loss: 1.0708, test_f1: 0.6251
 epoch: 58, train_loss: 0.4512, test_loss: 1.0732, test_f1: 0.6598
 epoch: 59, train_loss: 0.4426, test_loss: 1.0717, test_f1: 0.6587
 epoch: 60, train_loss: 0.4359, test_loss: 1.1240, test_f1: 0.6625
 epoch: 61, train_loss: 0.4428, test_loss: 1.0921, test_f1: 0.6446
 epoch: 62, train_loss: 0.4388, test_loss: 1.0799, test_f1: 0.6507
 epoch: 63, train_loss: 0.4267, test_loss: 1.1444, test_f1: 0.6406
 epoch: 64, train_loss: 0.4237, test_loss: 1.1172, test_f1: 0.6472
 epoch: 65, train_loss: 0.4108, test_loss: 1.1102, test_f1: 0.6215
 epoch: 66, train_loss: 0.4009, test_loss: 1.0756, test_f1: 0.6394
 epoch: 67, train_loss: 0.4146, test_loss: 1.0901, test_f1: 0.6364
 epoch: 68, train_loss: 0.4042, test_loss: 1.1814, test_f1: 0.6553
 epoch: 69, train_loss: 0.4062, test_loss: 1.1924, test_f1: 0.6471
 epoch: 70, train_loss: 0.4051, test_loss: 1.1703, test_f1: 0.6621
 epoch: 71, train_loss: 0.3887, test_loss: 1.1776, test_f1: 0.6492
 epoch: 72, train_loss: 0.3895, test_loss: 1.1890, test_f1: 0.6371
 epoch: 73, train_loss: 0.3860, test_loss: 1.2003, test_f1: 0.6488
 epoch: 74, train_loss: 0.3875, test_loss: 1.1319, test_f1: 0.6543
 epoch: 75, train_loss: 0.3935, test_loss: 1.1809, test_f1: 0.6382
 epoch: 76, train_loss: 0.3804, test_loss: 1.2010, test_f1: 0.6587
 epoch: 77, train_loss: 0.3613, test_loss: 1.2193, test_f1: 0.6439
 epoch: 78, train_loss: 0.3726, test_loss: 1.2703, test_f1: 0.6567
 epoch: 79, train_loss: 0.3642, test_loss: 1.1804, test_f1: 0.6893
 epoch: 80, train_loss: 0.3959, test_loss: 1.2217, test_f1: 0.6349
 epoch: 81, train_loss: 0.3616, test_loss: 1.2241, test_f1: 0.6402
 epoch: 82, train_loss: 0.3645, test_loss: 1.3418, test_f1: 0.6206
 epoch: 83, train_loss: 0.3563, test_loss: 1.1592, test_f1: 0.6449
 epoch: 84, train_loss: 0.3787, test_loss: 1.2588, test_f1: 0.6500
 epoch: 85, train_loss: 0.3721, test_loss: 1.2716, test_f1: 0.6416
 epoch: 86, train_loss: 0.3492, test_loss: 1.2374, test_f1: 0.6393
 epoch: 87, train_loss: 0.3515, test_loss: 1.2749, test_f1: 0.6462
 epoch: 88, train_loss: 0.3448, test_loss: 1.1729, test_f1: 0.6476
 epoch: 89, train_loss: 0.3538, test_loss: 1.3093, test_f1: 0.6633
 epoch: 90, train_loss: 0.3568, test_loss: 1.2665, test_f1: 0.6588
 epoch: 91, train_loss: 0.3295, test_loss: 1.3032, test_f1: 0.6592
 epoch: 92, train_loss: 0.3305, test_loss: 1.4355, test_f1: 0.6358
 epoch: 93, train_loss: 0.3401, test_loss: 1.1999, test_f1: 0.6763
 epoch: 94, train_loss: 0.3322, test_loss: 1.2320, test_f1: 0.6544
 epoch: 95, train_loss: 0.3302, test_loss: 1.3101, test_f1: 0.6495
 epoch: 96, train_loss: 0.3163, test_loss: 1.3596, test_f1: 0.6744
 epoch: 97, train_loss: 0.3214, test_loss: 1.4017, test_f1: 0.6505
 epoch: 98, train_loss: 0.3233, test_loss: 1.3580, test_f1: 0.6450
 epoch: 99, train_loss: 0.3209, test_loss: 1.2864, test_f1: 0.6636
##################ITERATION #8 ****************************************
 epoch: 0, train_loss: 2.0208, test_loss: 1.5436, test_f1: 0.2270
 epoch: 1, train_loss: 1.0986, test_loss: 1.2066, test_f1: 0.2968
 epoch: 2, train_loss: 1.0020, test_loss: 1.0644, test_f1: 0.3436
 epoch: 3, train_loss: 0.9700, test_loss: 0.9983, test_f1: 0.4001
 epoch: 4, train_loss: 0.9359, test_loss: 0.9866, test_f1: 0.4601
 epoch: 5, train_loss: 0.9204, test_loss: 0.9512, test_f1: 0.4784
 epoch: 6, train_loss: 0.8998, test_loss: 0.9534, test_f1: 0.4814
 epoch: 7, train_loss: 0.8799, test_loss: 0.9025, test_f1: 0.4982
 epoch: 8, train_loss: 0.8616, test_loss: 0.8745, test_f1: 0.5224
 epoch: 9, train_loss: 0.8407, test_loss: 0.8945, test_f1: 0.5057
 epoch: 10, train_loss: 0.8318, test_loss: 0.9273, test_f1: 0.5595
 epoch: 11, train_loss: 0.8343, test_loss: 0.8948, test_f1: 0.5206
 epoch: 12, train_loss: 0.8149, test_loss: 0.8859, test_f1: 0.5685
 epoch: 13, train_loss: 0.7962, test_loss: 0.8498, test_f1: 0.5751
 epoch: 14, train_loss: 0.7887, test_loss: 0.8831, test_f1: 0.5607
 epoch: 15, train_loss: 0.7684, test_loss: 0.9072, test_f1: 0.5527
 epoch: 16, train_loss: 0.7738, test_loss: 0.9330, test_f1: 0.5889
 epoch: 17, train_loss: 0.7469, test_loss: 0.8951, test_f1: 0.5599
 epoch: 18, train_loss: 0.7466, test_loss: 0.9458, test_f1: 0.5825
 epoch: 19, train_loss: 0.7563, test_loss: 0.9276, test_f1: 0.5519
 epoch: 20, train_loss: 0.7339, test_loss: 0.9373, test_f1: 0.5634
 epoch: 21, train_loss: 0.7194, test_loss: 0.9454, test_f1: 0.6113
 epoch: 22, train_loss: 0.7143, test_loss: 0.9308, test_f1: 0.5516
 epoch: 23, train_loss: 0.7057, test_loss: 1.0168, test_f1: 0.5350
 epoch: 24, train_loss: 0.6910, test_loss: 0.9115, test_f1: 0.6044
 epoch: 25, train_loss: 0.6777, test_loss: 1.1118, test_f1: 0.5278
 epoch: 26, train_loss: 0.6924, test_loss: 0.9234, test_f1: 0.5724
 epoch: 27, train_loss: 0.6902, test_loss: 0.8776, test_f1: 0.6170
 epoch: 28, train_loss: 0.6733, test_loss: 1.0019, test_f1: 0.5346
 epoch: 29, train_loss: 0.6610, test_loss: 0.9400, test_f1: 0.6212
 epoch: 30, train_loss: 0.6819, test_loss: 0.8831, test_f1: 0.5983
 epoch: 31, train_loss: 0.6492, test_loss: 0.9851, test_f1: 0.5588
 epoch: 32, train_loss: 0.6575, test_loss: 0.9195, test_f1: 0.6029
 epoch: 33, train_loss: 0.6161, test_loss: 0.9755, test_f1: 0.6303
 epoch: 34, train_loss: 0.6055, test_loss: 1.0602, test_f1: 0.6003
 epoch: 35, train_loss: 0.6026, test_loss: 0.9907, test_f1: 0.5714
 epoch: 36, train_loss: 0.5943, test_loss: 0.9959, test_f1: 0.6153
 epoch: 37, train_loss: 0.5952, test_loss: 0.9963, test_f1: 0.5931
 epoch: 38, train_loss: 0.6063, test_loss: 0.9873, test_f1: 0.5974
 epoch: 39, train_loss: 0.5880, test_loss: 0.9668, test_f1: 0.6499
 epoch: 40, train_loss: 0.5784, test_loss: 0.9203, test_f1: 0.6423
 epoch: 41, train_loss: 0.5745, test_loss: 0.9232, test_f1: 0.6215
 epoch: 42, train_loss: 0.5563, test_loss: 0.9931, test_f1: 0.5817
 epoch: 43, train_loss: 0.5541, test_loss: 0.9399, test_f1: 0.6371
 epoch: 44, train_loss: 0.5491, test_loss: 1.0070, test_f1: 0.6410
 epoch: 45, train_loss: 0.5325, test_loss: 0.9723, test_f1: 0.6320
 epoch: 46, train_loss: 0.5223, test_loss: 1.0249, test_f1: 0.6055
 epoch: 47, train_loss: 0.5369, test_loss: 0.9546, test_f1: 0.6209
 epoch: 48, train_loss: 0.5275, test_loss: 1.0189, test_f1: 0.6162
 epoch: 49, train_loss: 0.5260, test_loss: 1.1355, test_f1: 0.5840
 epoch: 50, train_loss: 0.4946, test_loss: 1.0074, test_f1: 0.6082
 epoch: 51, train_loss: 0.4743, test_loss: 0.9994, test_f1: 0.6480
 epoch: 52, train_loss: 0.4432, test_loss: 1.0348, test_f1: 0.6228
 epoch: 53, train_loss: 0.4482, test_loss: 1.0421, test_f1: 0.6290
 epoch: 54, train_loss: 0.4396, test_loss: 1.0835, test_f1: 0.6285
 epoch: 55, train_loss: 0.4262, test_loss: 1.0694, test_f1: 0.6205
 epoch: 56, train_loss: 0.4286, test_loss: 1.0471, test_f1: 0.6554
 epoch: 57, train_loss: 0.4193, test_loss: 1.1325, test_f1: 0.6348
 epoch: 58, train_loss: 0.4227, test_loss: 1.1092, test_f1: 0.6494
 epoch: 59, train_loss: 0.4132, test_loss: 1.0933, test_f1: 0.6381
 epoch: 60, train_loss: 0.3991, test_loss: 1.1024, test_f1: 0.6275
 epoch: 61, train_loss: 0.4063, test_loss: 1.1325, test_f1: 0.6189
 epoch: 62, train_loss: 0.4048, test_loss: 1.1415, test_f1: 0.6270
 epoch: 63, train_loss: 0.4000, test_loss: 1.1158, test_f1: 0.6312
 epoch: 64, train_loss: 0.3929, test_loss: 1.1299, test_f1: 0.6802
 epoch: 65, train_loss: 0.3951, test_loss: 1.1279, test_f1: 0.6354
 epoch: 66, train_loss: 0.3931, test_loss: 1.1623, test_f1: 0.6327
 epoch: 67, train_loss: 0.3868, test_loss: 1.1377, test_f1: 0.6527
 epoch: 68, train_loss: 0.3715, test_loss: 1.1390, test_f1: 0.6559
 epoch: 69, train_loss: 0.3742, test_loss: 1.2252, test_f1: 0.6057
 epoch: 70, train_loss: 0.3747, test_loss: 1.2611, test_f1: 0.6188
 epoch: 71, train_loss: 0.3801, test_loss: 1.2107, test_f1: 0.6295
 epoch: 72, train_loss: 0.3686, test_loss: 1.1567, test_f1: 0.6475
 epoch: 73, train_loss: 0.3680, test_loss: 1.1755, test_f1: 0.6423
 epoch: 74, train_loss: 0.3596, test_loss: 1.1085, test_f1: 0.6470
 epoch: 75, train_loss: 0.3648, test_loss: 1.3073, test_f1: 0.6079
 epoch: 76, train_loss: 0.3687, test_loss: 1.1642, test_f1: 0.6213
 epoch: 77, train_loss: 0.3683, test_loss: 1.1594, test_f1: 0.6448
 epoch: 78, train_loss: 0.3563, test_loss: 1.2015, test_f1: 0.6063
 epoch: 79, train_loss: 0.3431, test_loss: 1.2981, test_f1: 0.6282
 epoch: 80, train_loss: 0.3497, test_loss: 1.1982, test_f1: 0.6250
 epoch: 81, train_loss: 0.3427, test_loss: 1.2770, test_f1: 0.6149
 epoch: 82, train_loss: 0.3500, test_loss: 1.2896, test_f1: 0.6284
 epoch: 83, train_loss: 0.3517, test_loss: 1.2658, test_f1: 0.6379
 epoch: 84, train_loss: 0.3413, test_loss: 1.2111, test_f1: 0.6167
 epoch: 85, train_loss: 0.3330, test_loss: 1.3398, test_f1: 0.6319
 epoch: 86, train_loss: 0.3478, test_loss: 1.2227, test_f1: 0.6448
 epoch: 87, train_loss: 0.3417, test_loss: 1.3182, test_f1: 0.6274
 epoch: 88, train_loss: 0.3503, test_loss: 1.3354, test_f1: 0.6437
 epoch: 89, train_loss: 0.3214, test_loss: 1.2717, test_f1: 0.6319
 epoch: 90, train_loss: 0.3148, test_loss: 1.3491, test_f1: 0.6265
 epoch: 91, train_loss: 0.3342, test_loss: 1.2814, test_f1: 0.6470
 epoch: 92, train_loss: 0.3196, test_loss: 1.5954, test_f1: 0.5974
 epoch: 93, train_loss: 0.3335, test_loss: 1.2577, test_f1: 0.6468
 epoch: 94, train_loss: 0.3057, test_loss: 1.3228, test_f1: 0.6475
 epoch: 95, train_loss: 0.3255, test_loss: 1.2656, test_f1: 0.6465
 epoch: 96, train_loss: 0.3134, test_loss: 1.3671, test_f1: 0.6419
 epoch: 97, train_loss: 0.3036, test_loss: 1.4905, test_f1: 0.6343
 epoch: 98, train_loss: 0.3084, test_loss: 1.3121, test_f1: 0.6403
 epoch: 99, train_loss: 0.2813, test_loss: 1.2915, test_f1: 0.6459
##################ITERATION #9 ****************************************
 epoch: 0, train_loss: 1.8289, test_loss: 1.5220, test_f1: 0.2270
 epoch: 1, train_loss: 1.0799, test_loss: 1.1825, test_f1: 0.2639
 epoch: 2, train_loss: 1.0108, test_loss: 1.0298, test_f1: 0.3674
 epoch: 3, train_loss: 0.9587, test_loss: 0.9682, test_f1: 0.4466
 epoch: 4, train_loss: 0.9354, test_loss: 0.9504, test_f1: 0.4507
 epoch: 5, train_loss: 0.9163, test_loss: 0.9402, test_f1: 0.5192
 epoch: 6, train_loss: 0.8870, test_loss: 0.9066, test_f1: 0.5028
 epoch: 7, train_loss: 0.8789, test_loss: 0.9712, test_f1: 0.4922
 epoch: 8, train_loss: 0.8582, test_loss: 0.9544, test_f1: 0.5069
 epoch: 9, train_loss: 0.8422, test_loss: 0.9366, test_f1: 0.4989
 epoch: 10, train_loss: 0.8200, test_loss: 0.9202, test_f1: 0.4998
 epoch: 11, train_loss: 0.8126, test_loss: 0.9146, test_f1: 0.5183
 epoch: 12, train_loss: 0.8296, test_loss: 0.9028, test_f1: 0.5437
 epoch: 13, train_loss: 0.8042, test_loss: 0.9965, test_f1: 0.4698
 epoch: 14, train_loss: 0.7971, test_loss: 0.8709, test_f1: 0.5388
 epoch: 15, train_loss: 0.7831, test_loss: 0.8924, test_f1: 0.5465
 epoch: 16, train_loss: 0.7665, test_loss: 0.8992, test_f1: 0.5327
 epoch: 17, train_loss: 0.7506, test_loss: 0.9428, test_f1: 0.5470
 epoch: 18, train_loss: 0.7503, test_loss: 0.9126, test_f1: 0.5632
 epoch: 19, train_loss: 0.7500, test_loss: 0.8905, test_f1: 0.6058
 epoch: 20, train_loss: 0.7225, test_loss: 0.8897, test_f1: 0.5870
 epoch: 21, train_loss: 0.7148, test_loss: 0.9233, test_f1: 0.5485
 epoch: 22, train_loss: 0.7126, test_loss: 0.8976, test_f1: 0.5836
 epoch: 23, train_loss: 0.6979, test_loss: 0.8726, test_f1: 0.5894
 epoch: 24, train_loss: 0.6913, test_loss: 0.8282, test_f1: 0.5720
 epoch: 25, train_loss: 0.7034, test_loss: 0.9224, test_f1: 0.5638
 epoch: 26, train_loss: 0.6991, test_loss: 0.9570, test_f1: 0.5850
 epoch: 27, train_loss: 0.6790, test_loss: 0.8886, test_f1: 0.5962
 epoch: 28, train_loss: 0.6658, test_loss: 0.9193, test_f1: 0.5741
 epoch: 29, train_loss: 0.6541, test_loss: 0.8517, test_f1: 0.5799
 epoch: 30, train_loss: 0.6484, test_loss: 0.9255, test_f1: 0.6248
 epoch: 31, train_loss: 0.6381, test_loss: 0.9234, test_f1: 0.5707
 epoch: 32, train_loss: 0.6380, test_loss: 0.9028, test_f1: 0.6140
 epoch: 33, train_loss: 0.6268, test_loss: 0.9009, test_f1: 0.6409
 epoch: 34, train_loss: 0.6119, test_loss: 0.9146, test_f1: 0.5821
 epoch: 35, train_loss: 0.6104, test_loss: 0.9535, test_f1: 0.5894
 epoch: 36, train_loss: 0.6047, test_loss: 0.8752, test_f1: 0.6171
 epoch: 37, train_loss: 0.5860, test_loss: 1.0276, test_f1: 0.5730
 epoch: 38, train_loss: 0.5930, test_loss: 0.8703, test_f1: 0.6167
 epoch: 39, train_loss: 0.5827, test_loss: 0.9013, test_f1: 0.5996
 epoch: 40, train_loss: 0.5741, test_loss: 0.9891, test_f1: 0.6255
 epoch: 41, train_loss: 0.5667, test_loss: 0.9625, test_f1: 0.5971
 epoch: 42, train_loss: 0.5577, test_loss: 0.9443, test_f1: 0.6043
 epoch: 43, train_loss: 0.5710, test_loss: 0.9531, test_f1: 0.6452
 epoch: 44, train_loss: 0.5496, test_loss: 1.0082, test_f1: 0.6166
 epoch: 45, train_loss: 0.5363, test_loss: 0.9517, test_f1: 0.6520
 epoch: 46, train_loss: 0.5434, test_loss: 0.9407, test_f1: 0.6567
 epoch: 47, train_loss: 0.5168, test_loss: 0.9026, test_f1: 0.6105
 epoch: 48, train_loss: 0.5227, test_loss: 1.0216, test_f1: 0.6149
 epoch: 49, train_loss: 0.5209, test_loss: 0.8890, test_f1: 0.6519
 epoch: 50, train_loss: 0.5097, test_loss: 1.1097, test_f1: 0.5873
 epoch: 51, train_loss: 0.4935, test_loss: 0.9012, test_f1: 0.6460
 epoch: 52, train_loss: 0.4650, test_loss: 0.9285, test_f1: 0.6234
 epoch: 53, train_loss: 0.4489, test_loss: 0.9988, test_f1: 0.6253
 epoch: 54, train_loss: 0.4522, test_loss: 0.9611, test_f1: 0.6497
 epoch: 55, train_loss: 0.4484, test_loss: 1.0303, test_f1: 0.6374
 epoch: 56, train_loss: 0.4322, test_loss: 0.9984, test_f1: 0.6303
 epoch: 57, train_loss: 0.4304, test_loss: 0.9648, test_f1: 0.6307
 epoch: 58, train_loss: 0.4196, test_loss: 1.0140, test_f1: 0.6311
 epoch: 59, train_loss: 0.4152, test_loss: 1.1254, test_f1: 0.6123
 epoch: 60, train_loss: 0.4149, test_loss: 0.9951, test_f1: 0.6422
 epoch: 61, train_loss: 0.4253, test_loss: 1.0461, test_f1: 0.6288
 epoch: 62, train_loss: 0.4175, test_loss: 0.9707, test_f1: 0.6676
 epoch: 63, train_loss: 0.4139, test_loss: 1.0003, test_f1: 0.6133
 epoch: 64, train_loss: 0.4097, test_loss: 0.9693, test_f1: 0.6384
 epoch: 65, train_loss: 0.4002, test_loss: 1.0250, test_f1: 0.6328
 epoch: 66, train_loss: 0.4035, test_loss: 1.0324, test_f1: 0.6389
 epoch: 67, train_loss: 0.3912, test_loss: 1.0400, test_f1: 0.6412
 epoch: 68, train_loss: 0.4093, test_loss: 1.0863, test_f1: 0.6265
 epoch: 69, train_loss: 0.4154, test_loss: 1.1209, test_f1: 0.6500
 epoch: 70, train_loss: 0.3905, test_loss: 1.0544, test_f1: 0.6399
 epoch: 71, train_loss: 0.3890, test_loss: 1.0246, test_f1: 0.6546
 epoch: 72, train_loss: 0.3799, test_loss: 1.0895, test_f1: 0.6419
 epoch: 73, train_loss: 0.3747, test_loss: 1.0364, test_f1: 0.6448
 epoch: 74, train_loss: 0.3563, test_loss: 1.1180, test_f1: 0.6369
 epoch: 75, train_loss: 0.3623, test_loss: 1.1689, test_f1: 0.6278
 epoch: 76, train_loss: 0.3626, test_loss: 1.1308, test_f1: 0.6364
 epoch: 77, train_loss: 0.3614, test_loss: 1.0793, test_f1: 0.6375
 epoch: 78, train_loss: 0.3546, test_loss: 1.0038, test_f1: 0.6318
 epoch: 79, train_loss: 0.3629, test_loss: 1.0926, test_f1: 0.6441
 epoch: 80, train_loss: 0.3700, test_loss: 1.1464, test_f1: 0.6100
 epoch: 81, train_loss: 0.3625, test_loss: 1.1317, test_f1: 0.6271
 epoch: 82, train_loss: 0.3837, test_loss: 1.1327, test_f1: 0.6340
 epoch: 83, train_loss: 0.3619, test_loss: 1.0415, test_f1: 0.6484
 epoch: 84, train_loss: 0.3634, test_loss: 1.0219, test_f1: 0.6638
 epoch: 85, train_loss: 0.3559, test_loss: 1.2017, test_f1: 0.6266
 epoch: 86, train_loss: 0.3587, test_loss: 1.0985, test_f1: 0.6404
 epoch: 87, train_loss: 0.3439, test_loss: 1.1532, test_f1: 0.6389
 epoch: 88, train_loss: 0.3355, test_loss: 1.1872, test_f1: 0.6170
 epoch: 89, train_loss: 0.3584, test_loss: 1.1256, test_f1: 0.6446
 epoch: 90, train_loss: 0.3336, test_loss: 1.2319, test_f1: 0.6410
 epoch: 91, train_loss: 0.3348, test_loss: 1.1139, test_f1: 0.6487
 epoch: 92, train_loss: 0.3188, test_loss: 1.1457, test_f1: 0.6291
 epoch: 93, train_loss: 0.3311, test_loss: 1.2016, test_f1: 0.6298
 epoch: 94, train_loss: 0.3183, test_loss: 1.1951, test_f1: 0.6235
 epoch: 95, train_loss: 0.3256, test_loss: 1.1366, test_f1: 0.6434
 epoch: 96, train_loss: 0.3192, test_loss: 1.1862, test_f1: 0.6334
 epoch: 97, train_loss: 0.3061, test_loss: 1.3290, test_f1: 0.6215
 epoch: 98, train_loss: 0.3161, test_loss: 1.2036, test_f1: 0.6376
 epoch: 99, train_loss: 0.3019, test_loss: 1.2483, test_f1: 0.6329

Training completed in 374.55 seconds
Best F1: 0.7046 at epoch 60
Mean F1 across iterations: 0.6899  0.0125
========================FINAL RESULTS================================
FEGIN weighted F1: 0.7046  0.0125
python main.py --data ltspice_examples --representation component_net --model FEGIN --layers 2 --hiddens 128 --batch_size 256 --lr 0.001 --emb_size 250 --epochs 100 --save_appendix component_net_L2_H128_BS256_LR0.001_E250 --no_val
-----



STDERR:
  File "main.py", line 370, in <module>
    main()
  File "main.py", line 254, in main
    dataset = dataset_class(
  File "/home/philip/projects/ltspice_examples_code_repo/Circuit-Completion-Using-GNNs/component_classification_with_link_prediction_head/evaluation/FEGIN/kernel/circuit_datasets.py", line 15, in __init__
    self.data, self.slices = torch.load(self.processed_paths[0])
  File "/home/philip/.local/lib/python3.8/site-packages/torch/serialization.py", line 1040, in load
    warnings.warn(
  File "/usr/lib/python3.8/warnings.py", line 109, in _showwarnmsg
    sw(msg.message, msg.category, msg.filename, msg.lineno,
  File "main.py", line 47, in warn_with_traceback
    traceback.print_stack(file=log)
/home/philip/projects/ltspice_examples_code_repo/Circuit-Completion-Using-GNNs/component_classification_with_link_prediction_head/evaluation/FEGIN/kernel/circuit_datasets.py:15: FutureWarning: You are using `torch.load` with `weights_only=False` (the current default value), which uses the default pickle module implicitly. It is possible to construct malicious pickle data which will execute arbitrary code during unpickling (See https://github.com/pytorch/pytorch/blob/main/SECURITY.md#untrusted-models for more details). In a future release, the default value for `weights_only` will be flipped to `True`. This limits the functions that could be executed during unpickling. Arbitrary objects will no longer be allowed to be loaded via this mode unless they are explicitly allowlisted by the user via `torch.serialization.add_safe_globals`. We recommend you start setting `weights_only=True` for any use case where you don't have full control of the loaded file. Please open an issue on GitHub for any issues related to this experimental feature.
  self.data, self.slices = torch.load(self.processed_paths[0])
