STDOUT:
Results will be saved in /home/philip/projects/ltspice_examples_code_repo/Circuit-Completion-Using-GNNs/component_classification_with_link_prediction_head/evaluation/FEGIN/results/model_FEGIN_dataset_ltspice_examples
Command line input: python main.py --data ltspice_examples --representation component_net --model FEGIN --layers 4 --hiddens 32 --batch_size 256 --lr 0.0001 --emb_size 128 --epochs 100 --save_appendix component_net_L4_H32_BS256_LR0.0001_E128 --no_val
 is saved.
-----
ltspice_examples - FEGIN
Using 4 layers, 32 hidden units, h = 2
Loading component_net representation dataset
ENTERED
Training FEGIN on component_net representation
Train: 3558, Test: 846
##################ITERATION #0 ****************************************
 epoch: 0, train_loss: 1.3614, test_loss: 1.3607, test_f1: 0.2270
 epoch: 1, train_loss: 1.3572, test_loss: 1.3602, test_f1: 0.2270
 epoch: 2, train_loss: 1.3549, test_loss: 1.3598, test_f1: 0.2270
 epoch: 3, train_loss: 1.3517, test_loss: 1.3572, test_f1: 0.2270
 epoch: 4, train_loss: 1.3491, test_loss: 1.3531, test_f1: 0.2270
 epoch: 5, train_loss: 1.3461, test_loss: 1.3482, test_f1: 0.2270
 epoch: 6, train_loss: 1.3440, test_loss: 1.3440, test_f1: 0.2270
 epoch: 7, train_loss: 1.3394, test_loss: 1.3404, test_f1: 0.2270
 epoch: 8, train_loss: 1.3359, test_loss: 1.3360, test_f1: 0.2270
 epoch: 9, train_loss: 1.3330, test_loss: 1.3318, test_f1: 0.2270
 epoch: 10, train_loss: 1.3287, test_loss: 1.3278, test_f1: 0.2270
 epoch: 11, train_loss: 1.3255, test_loss: 1.3247, test_f1: 0.2270
 epoch: 12, train_loss: 1.3213, test_loss: 1.3204, test_f1: 0.2270
 epoch: 13, train_loss: 1.3177, test_loss: 1.3155, test_f1: 0.2270
 epoch: 14, train_loss: 1.3138, test_loss: 1.3114, test_f1: 0.2270
 epoch: 15, train_loss: 1.3090, test_loss: 1.3079, test_f1: 0.2320
 epoch: 16, train_loss: 1.3059, test_loss: 1.3037, test_f1: 0.2368
 epoch: 17, train_loss: 1.3005, test_loss: 1.3002, test_f1: 0.2416
 epoch: 18, train_loss: 1.2972, test_loss: 1.2962, test_f1: 0.2461
 epoch: 19, train_loss: 1.2940, test_loss: 1.2916, test_f1: 0.2506
 epoch: 20, train_loss: 1.2893, test_loss: 1.2877, test_f1: 0.2570
 epoch: 21, train_loss: 1.2827, test_loss: 1.2840, test_f1: 0.2611
 epoch: 22, train_loss: 1.2815, test_loss: 1.2806, test_f1: 0.2651
 epoch: 23, train_loss: 1.2760, test_loss: 1.2760, test_f1: 0.2711
 epoch: 24, train_loss: 1.2712, test_loss: 1.2711, test_f1: 0.2806
 epoch: 25, train_loss: 1.2668, test_loss: 1.2671, test_f1: 0.2867
 epoch: 26, train_loss: 1.2608, test_loss: 1.2632, test_f1: 0.2891
 epoch: 27, train_loss: 1.2590, test_loss: 1.2574, test_f1: 0.2979
 epoch: 28, train_loss: 1.2545, test_loss: 1.2534, test_f1: 0.3088
 epoch: 29, train_loss: 1.2467, test_loss: 1.2482, test_f1: 0.3146
 epoch: 30, train_loss: 1.2434, test_loss: 1.2423, test_f1: 0.3205
 epoch: 31, train_loss: 1.2378, test_loss: 1.2366, test_f1: 0.3282
 epoch: 32, train_loss: 1.2319, test_loss: 1.2299, test_f1: 0.3403
 epoch: 33, train_loss: 1.2282, test_loss: 1.2243, test_f1: 0.3485
 epoch: 34, train_loss: 1.2223, test_loss: 1.2174, test_f1: 0.3559
 epoch: 35, train_loss: 1.2175, test_loss: 1.2108, test_f1: 0.3634
 epoch: 36, train_loss: 1.2153, test_loss: 1.2038, test_f1: 0.3662
 epoch: 37, train_loss: 1.2054, test_loss: 1.1967, test_f1: 0.3688
 epoch: 38, train_loss: 1.1991, test_loss: 1.1901, test_f1: 0.3707
 epoch: 39, train_loss: 1.1942, test_loss: 1.1822, test_f1: 0.3779
 epoch: 40, train_loss: 1.1882, test_loss: 1.1742, test_f1: 0.3900
 epoch: 41, train_loss: 1.1794, test_loss: 1.1664, test_f1: 0.3948
 epoch: 42, train_loss: 1.1733, test_loss: 1.1600, test_f1: 0.3932
 epoch: 43, train_loss: 1.1628, test_loss: 1.1520, test_f1: 0.3965
 epoch: 44, train_loss: 1.1569, test_loss: 1.1449, test_f1: 0.4025
 epoch: 45, train_loss: 1.1494, test_loss: 1.1347, test_f1: 0.4111
 epoch: 46, train_loss: 1.1478, test_loss: 1.1288, test_f1: 0.4108
 epoch: 47, train_loss: 1.1359, test_loss: 1.1194, test_f1: 0.4212
 epoch: 48, train_loss: 1.1282, test_loss: 1.1123, test_f1: 0.4252
 epoch: 49, train_loss: 1.1250, test_loss: 1.1058, test_f1: 0.4257
 epoch: 50, train_loss: 1.1182, test_loss: 1.0981, test_f1: 0.4388
 epoch: 51, train_loss: 1.1167, test_loss: 1.0934, test_f1: 0.4463
 epoch: 52, train_loss: 1.1114, test_loss: 1.0904, test_f1: 0.4477
 epoch: 53, train_loss: 1.1054, test_loss: 1.0852, test_f1: 0.4501
 epoch: 54, train_loss: 1.1013, test_loss: 1.0815, test_f1: 0.4556
 epoch: 55, train_loss: 1.1029, test_loss: 1.0784, test_f1: 0.4646
 epoch: 56, train_loss: 1.0970, test_loss: 1.0747, test_f1: 0.4633
 epoch: 57, train_loss: 1.0930, test_loss: 1.0708, test_f1: 0.4721
 epoch: 58, train_loss: 1.0862, test_loss: 1.0676, test_f1: 0.4732
 epoch: 59, train_loss: 1.0855, test_loss: 1.0637, test_f1: 0.4756
 epoch: 60, train_loss: 1.0799, test_loss: 1.0612, test_f1: 0.4781
 epoch: 61, train_loss: 1.0808, test_loss: 1.0574, test_f1: 0.4809
 epoch: 62, train_loss: 1.0743, test_loss: 1.0535, test_f1: 0.4764
 epoch: 63, train_loss: 1.0743, test_loss: 1.0512, test_f1: 0.4817
 epoch: 64, train_loss: 1.0723, test_loss: 1.0478, test_f1: 0.4836
 epoch: 65, train_loss: 1.0625, test_loss: 1.0448, test_f1: 0.4888
 epoch: 66, train_loss: 1.0581, test_loss: 1.0396, test_f1: 0.4883
 epoch: 67, train_loss: 1.0621, test_loss: 1.0369, test_f1: 0.4913
 epoch: 68, train_loss: 1.0614, test_loss: 1.0352, test_f1: 0.4951
 epoch: 69, train_loss: 1.0558, test_loss: 1.0294, test_f1: 0.4980
 epoch: 70, train_loss: 1.0558, test_loss: 1.0291, test_f1: 0.5020
 epoch: 71, train_loss: 1.0525, test_loss: 1.0253, test_f1: 0.5075
 epoch: 72, train_loss: 1.0527, test_loss: 1.0220, test_f1: 0.5077
 epoch: 73, train_loss: 1.0410, test_loss: 1.0197, test_f1: 0.4992
 epoch: 74, train_loss: 1.0401, test_loss: 1.0168, test_f1: 0.5158
 epoch: 75, train_loss: 1.0402, test_loss: 1.0134, test_f1: 0.5081
 epoch: 76, train_loss: 1.0389, test_loss: 1.0097, test_f1: 0.5053
 epoch: 77, train_loss: 1.0325, test_loss: 1.0058, test_f1: 0.4993
 epoch: 78, train_loss: 1.0288, test_loss: 1.0049, test_f1: 0.5016
 epoch: 79, train_loss: 1.0242, test_loss: 1.0008, test_f1: 0.5086
 epoch: 80, train_loss: 1.0246, test_loss: 0.9996, test_f1: 0.5030
 epoch: 81, train_loss: 1.0279, test_loss: 0.9980, test_f1: 0.5092
 epoch: 82, train_loss: 1.0211, test_loss: 0.9947, test_f1: 0.5139
 epoch: 83, train_loss: 1.0191, test_loss: 0.9909, test_f1: 0.5176
 epoch: 84, train_loss: 1.0122, test_loss: 0.9873, test_f1: 0.5177
 epoch: 85, train_loss: 1.0146, test_loss: 0.9851, test_f1: 0.5125
 epoch: 86, train_loss: 1.0040, test_loss: 0.9809, test_f1: 0.5170
 epoch: 87, train_loss: 1.0112, test_loss: 0.9784, test_f1: 0.5120
 epoch: 88, train_loss: 1.0051, test_loss: 0.9759, test_f1: 0.5101
 epoch: 89, train_loss: 1.0085, test_loss: 0.9764, test_f1: 0.5081
 epoch: 90, train_loss: 0.9974, test_loss: 0.9740, test_f1: 0.5048
 epoch: 91, train_loss: 0.9971, test_loss: 0.9725, test_f1: 0.5062
 epoch: 92, train_loss: 0.9968, test_loss: 0.9716, test_f1: 0.5022
 epoch: 93, train_loss: 0.9931, test_loss: 0.9689, test_f1: 0.5085
 epoch: 94, train_loss: 0.9935, test_loss: 0.9655, test_f1: 0.5143
 epoch: 95, train_loss: 0.9847, test_loss: 0.9666, test_f1: 0.5127
 epoch: 96, train_loss: 0.9871, test_loss: 0.9621, test_f1: 0.5146
 epoch: 97, train_loss: 0.9781, test_loss: 0.9614, test_f1: 0.5172
 epoch: 98, train_loss: 0.9831, test_loss: 0.9581, test_f1: 0.5136
 epoch: 99, train_loss: 0.9782, test_loss: 0.9571, test_f1: 0.5164
##################ITERATION #1 ****************************************
 epoch: 0, train_loss: 1.3275, test_loss: 1.3360, test_f1: 0.2270
 epoch: 1, train_loss: 1.3201, test_loss: 1.3312, test_f1: 0.2270
 epoch: 2, train_loss: 1.3165, test_loss: 1.3252, test_f1: 0.2270
 epoch: 3, train_loss: 1.3115, test_loss: 1.3186, test_f1: 0.2270
 epoch: 4, train_loss: 1.3068, test_loss: 1.3136, test_f1: 0.2270
 epoch: 5, train_loss: 1.3008, test_loss: 1.3073, test_f1: 0.2270
 epoch: 6, train_loss: 1.2971, test_loss: 1.3014, test_f1: 0.2270
 epoch: 7, train_loss: 1.2913, test_loss: 1.2953, test_f1: 0.2270
 epoch: 8, train_loss: 1.2841, test_loss: 1.2893, test_f1: 0.2270
 epoch: 9, train_loss: 1.2805, test_loss: 1.2832, test_f1: 0.2270
 epoch: 10, train_loss: 1.2759, test_loss: 1.2776, test_f1: 0.2270
 epoch: 11, train_loss: 1.2679, test_loss: 1.2715, test_f1: 0.2270
 epoch: 12, train_loss: 1.2655, test_loss: 1.2656, test_f1: 0.2270
 epoch: 13, train_loss: 1.2601, test_loss: 1.2594, test_f1: 0.2270
 epoch: 14, train_loss: 1.2538, test_loss: 1.2533, test_f1: 0.2270
 epoch: 15, train_loss: 1.2497, test_loss: 1.2475, test_f1: 0.2270
 epoch: 16, train_loss: 1.2422, test_loss: 1.2415, test_f1: 0.2270
 epoch: 17, train_loss: 1.2375, test_loss: 1.2354, test_f1: 0.2461
 epoch: 18, train_loss: 1.2351, test_loss: 1.2291, test_f1: 0.2549
 epoch: 19, train_loss: 1.2274, test_loss: 1.2236, test_f1: 0.2728
 epoch: 20, train_loss: 1.2265, test_loss: 1.2189, test_f1: 0.2728
 epoch: 21, train_loss: 1.2213, test_loss: 1.2132, test_f1: 0.2783
 epoch: 22, train_loss: 1.2167, test_loss: 1.2070, test_f1: 0.2819
 epoch: 23, train_loss: 1.2124, test_loss: 1.2027, test_f1: 0.2921
 epoch: 24, train_loss: 1.2028, test_loss: 1.1957, test_f1: 0.3203
 epoch: 25, train_loss: 1.1985, test_loss: 1.1899, test_f1: 0.3365
 epoch: 26, train_loss: 1.1961, test_loss: 1.1842, test_f1: 0.3478
 epoch: 27, train_loss: 1.1932, test_loss: 1.1791, test_f1: 0.3642
 epoch: 28, train_loss: 1.1865, test_loss: 1.1727, test_f1: 0.3799
 epoch: 29, train_loss: 1.1835, test_loss: 1.1668, test_f1: 0.3932
 epoch: 30, train_loss: 1.1736, test_loss: 1.1606, test_f1: 0.4041
 epoch: 31, train_loss: 1.1678, test_loss: 1.1544, test_f1: 0.4101
 epoch: 32, train_loss: 1.1645, test_loss: 1.1481, test_f1: 0.4145
 epoch: 33, train_loss: 1.1630, test_loss: 1.1417, test_f1: 0.4278
 epoch: 34, train_loss: 1.1581, test_loss: 1.1347, test_f1: 0.4321
 epoch: 35, train_loss: 1.1433, test_loss: 1.1277, test_f1: 0.4458
 epoch: 36, train_loss: 1.1407, test_loss: 1.1200, test_f1: 0.4579
 epoch: 37, train_loss: 1.1383, test_loss: 1.1125, test_f1: 0.4563
 epoch: 38, train_loss: 1.1276, test_loss: 1.1058, test_f1: 0.4579
 epoch: 39, train_loss: 1.1219, test_loss: 1.0995, test_f1: 0.4660
 epoch: 40, train_loss: 1.1144, test_loss: 1.0922, test_f1: 0.4644
 epoch: 41, train_loss: 1.1179, test_loss: 1.0917, test_f1: 0.4636
 epoch: 42, train_loss: 1.1059, test_loss: 1.0793, test_f1: 0.4725
 epoch: 43, train_loss: 1.0986, test_loss: 1.0724, test_f1: 0.4764
 epoch: 44, train_loss: 1.0934, test_loss: 1.0683, test_f1: 0.4754
 epoch: 45, train_loss: 1.0862, test_loss: 1.0626, test_f1: 0.4722
 epoch: 46, train_loss: 1.0817, test_loss: 1.0540, test_f1: 0.4768
 epoch: 47, train_loss: 1.0735, test_loss: 1.0524, test_f1: 0.4798
 epoch: 48, train_loss: 1.0705, test_loss: 1.0428, test_f1: 0.4852
 epoch: 49, train_loss: 1.0625, test_loss: 1.0396, test_f1: 0.4801
 epoch: 50, train_loss: 1.0569, test_loss: 1.0324, test_f1: 0.4822
 epoch: 51, train_loss: 1.0508, test_loss: 1.0299, test_f1: 0.4887
 epoch: 52, train_loss: 1.0472, test_loss: 1.0277, test_f1: 0.4808
 epoch: 53, train_loss: 1.0428, test_loss: 1.0277, test_f1: 0.4766
 epoch: 54, train_loss: 1.0431, test_loss: 1.0218, test_f1: 0.4808
 epoch: 55, train_loss: 1.0353, test_loss: 1.0211, test_f1: 0.4788
 epoch: 56, train_loss: 1.0375, test_loss: 1.0181, test_f1: 0.4834
 epoch: 57, train_loss: 1.0357, test_loss: 1.0185, test_f1: 0.4797
 epoch: 58, train_loss: 1.0281, test_loss: 1.0146, test_f1: 0.4805
 epoch: 59, train_loss: 1.0284, test_loss: 1.0122, test_f1: 0.4791
 epoch: 60, train_loss: 1.0171, test_loss: 1.0094, test_f1: 0.4835
 epoch: 61, train_loss: 1.0194, test_loss: 1.0062, test_f1: 0.4800
 epoch: 62, train_loss: 1.0225, test_loss: 1.0051, test_f1: 0.4817
 epoch: 63, train_loss: 1.0086, test_loss: 1.0032, test_f1: 0.4809
 epoch: 64, train_loss: 1.0142, test_loss: 0.9997, test_f1: 0.4834
 epoch: 65, train_loss: 1.0046, test_loss: 0.9966, test_f1: 0.4837
 epoch: 66, train_loss: 1.0049, test_loss: 0.9948, test_f1: 0.4828
 epoch: 67, train_loss: 1.0060, test_loss: 0.9919, test_f1: 0.4892
 epoch: 68, train_loss: 1.0073, test_loss: 0.9953, test_f1: 0.4860
 epoch: 69, train_loss: 1.0033, test_loss: 0.9948, test_f1: 0.4837
 epoch: 70, train_loss: 1.0003, test_loss: 0.9909, test_f1: 0.4879
 epoch: 71, train_loss: 0.9958, test_loss: 0.9877, test_f1: 0.4838
 epoch: 72, train_loss: 0.9939, test_loss: 0.9919, test_f1: 0.4845
 epoch: 73, train_loss: 0.9857, test_loss: 0.9861, test_f1: 0.4842
 epoch: 74, train_loss: 0.9834, test_loss: 0.9848, test_f1: 0.4866
 epoch: 75, train_loss: 0.9919, test_loss: 0.9859, test_f1: 0.4835
 epoch: 76, train_loss: 0.9826, test_loss: 0.9860, test_f1: 0.4823
 epoch: 77, train_loss: 0.9852, test_loss: 0.9828, test_f1: 0.4843
 epoch: 78, train_loss: 0.9886, test_loss: 0.9807, test_f1: 0.4869
 epoch: 79, train_loss: 0.9777, test_loss: 0.9768, test_f1: 0.4877
 epoch: 80, train_loss: 0.9819, test_loss: 0.9772, test_f1: 0.4862
 epoch: 81, train_loss: 0.9750, test_loss: 0.9789, test_f1: 0.4890
 epoch: 82, train_loss: 0.9745, test_loss: 0.9758, test_f1: 0.4882
 epoch: 83, train_loss: 0.9625, test_loss: 0.9744, test_f1: 0.4882
 epoch: 84, train_loss: 0.9728, test_loss: 0.9740, test_f1: 0.4879
 epoch: 85, train_loss: 0.9715, test_loss: 0.9756, test_f1: 0.4879
 epoch: 86, train_loss: 0.9656, test_loss: 0.9702, test_f1: 0.4913
 epoch: 87, train_loss: 0.9688, test_loss: 0.9746, test_f1: 0.4891
 epoch: 88, train_loss: 0.9623, test_loss: 0.9686, test_f1: 0.4834
 epoch: 89, train_loss: 0.9622, test_loss: 0.9725, test_f1: 0.4892
 epoch: 90, train_loss: 0.9551, test_loss: 0.9717, test_f1: 0.4868
 epoch: 91, train_loss: 0.9587, test_loss: 0.9657, test_f1: 0.4880
 epoch: 92, train_loss: 0.9479, test_loss: 0.9730, test_f1: 0.4844
 epoch: 93, train_loss: 0.9582, test_loss: 0.9716, test_f1: 0.4902
 epoch: 94, train_loss: 0.9513, test_loss: 0.9641, test_f1: 0.4895
 epoch: 95, train_loss: 0.9454, test_loss: 0.9616, test_f1: 0.4951
 epoch: 96, train_loss: 0.9491, test_loss: 0.9618, test_f1: 0.4877
 epoch: 97, train_loss: 0.9504, test_loss: 0.9598, test_f1: 0.4876
 epoch: 98, train_loss: 0.9446, test_loss: 0.9603, test_f1: 0.4912
 epoch: 99, train_loss: 0.9440, test_loss: 0.9585, test_f1: 0.4938
##################ITERATION #2 ****************************************
 epoch: 0, train_loss: 1.3194, test_loss: 1.3270, test_f1: 0.2270
 epoch: 1, train_loss: 1.3086, test_loss: 1.3250, test_f1: 0.2270
 epoch: 2, train_loss: 1.2995, test_loss: 1.3160, test_f1: 0.2270
 epoch: 3, train_loss: 1.2881, test_loss: 1.3040, test_f1: 0.2270
 epoch: 4, train_loss: 1.2845, test_loss: 1.2924, test_f1: 0.2270
 epoch: 5, train_loss: 1.2773, test_loss: 1.2812, test_f1: 0.2851
 epoch: 6, train_loss: 1.2708, test_loss: 1.2638, test_f1: 0.3127
 epoch: 7, train_loss: 1.2607, test_loss: 1.2476, test_f1: 0.3258
 epoch: 8, train_loss: 1.2563, test_loss: 1.2378, test_f1: 0.3301
 epoch: 9, train_loss: 1.2471, test_loss: 1.2285, test_f1: 0.3307
 epoch: 10, train_loss: 1.2397, test_loss: 1.2194, test_f1: 0.3348
 epoch: 11, train_loss: 1.2368, test_loss: 1.2135, test_f1: 0.3368
 epoch: 12, train_loss: 1.2309, test_loss: 1.2071, test_f1: 0.3439
 epoch: 13, train_loss: 1.2247, test_loss: 1.2007, test_f1: 0.3566
 epoch: 14, train_loss: 1.2184, test_loss: 1.1941, test_f1: 0.3609
 epoch: 15, train_loss: 1.2185, test_loss: 1.1885, test_f1: 0.3617
 epoch: 16, train_loss: 1.2093, test_loss: 1.1839, test_f1: 0.3595
 epoch: 17, train_loss: 1.2051, test_loss: 1.1784, test_f1: 0.3604
 epoch: 18, train_loss: 1.1963, test_loss: 1.1729, test_f1: 0.3612
 epoch: 19, train_loss: 1.1978, test_loss: 1.1686, test_f1: 0.3646
 epoch: 20, train_loss: 1.1877, test_loss: 1.1640, test_f1: 0.3694
 epoch: 21, train_loss: 1.1826, test_loss: 1.1556, test_f1: 0.3754
 epoch: 22, train_loss: 1.1843, test_loss: 1.1514, test_f1: 0.3735
 epoch: 23, train_loss: 1.1743, test_loss: 1.1486, test_f1: 0.3763
 epoch: 24, train_loss: 1.1737, test_loss: 1.1461, test_f1: 0.3802
 epoch: 25, train_loss: 1.1644, test_loss: 1.1411, test_f1: 0.3864
 epoch: 26, train_loss: 1.1629, test_loss: 1.1373, test_f1: 0.4040
 epoch: 27, train_loss: 1.1582, test_loss: 1.1322, test_f1: 0.4055
 epoch: 28, train_loss: 1.1544, test_loss: 1.1282, test_f1: 0.4083
 epoch: 29, train_loss: 1.1545, test_loss: 1.1222, test_f1: 0.4082
 epoch: 30, train_loss: 1.1434, test_loss: 1.1163, test_f1: 0.4149
 epoch: 31, train_loss: 1.1417, test_loss: 1.1104, test_f1: 0.4297
 epoch: 32, train_loss: 1.1332, test_loss: 1.1091, test_f1: 0.4315
 epoch: 33, train_loss: 1.1267, test_loss: 1.1054, test_f1: 0.4419
 epoch: 34, train_loss: 1.1250, test_loss: 1.1002, test_f1: 0.4424
 epoch: 35, train_loss: 1.1241, test_loss: 1.0937, test_f1: 0.4510
 epoch: 36, train_loss: 1.1238, test_loss: 1.0908, test_f1: 0.4511
 epoch: 37, train_loss: 1.1188, test_loss: 1.0841, test_f1: 0.4572
 epoch: 38, train_loss: 1.1139, test_loss: 1.0807, test_f1: 0.4585
 epoch: 39, train_loss: 1.1100, test_loss: 1.0778, test_f1: 0.4578
 epoch: 40, train_loss: 1.1025, test_loss: 1.0720, test_f1: 0.4625
 epoch: 41, train_loss: 1.0969, test_loss: 1.0671, test_f1: 0.4650
 epoch: 42, train_loss: 1.0898, test_loss: 1.0623, test_f1: 0.4680
 epoch: 43, train_loss: 1.0840, test_loss: 1.0573, test_f1: 0.4707
 epoch: 44, train_loss: 1.0831, test_loss: 1.0524, test_f1: 0.4701
 epoch: 45, train_loss: 1.0801, test_loss: 1.0499, test_f1: 0.4746
 epoch: 46, train_loss: 1.0724, test_loss: 1.0462, test_f1: 0.4676
 epoch: 47, train_loss: 1.0724, test_loss: 1.0460, test_f1: 0.4626
 epoch: 48, train_loss: 1.0629, test_loss: 1.0411, test_f1: 0.4594
 epoch: 49, train_loss: 1.0596, test_loss: 1.0364, test_f1: 0.4551
 epoch: 50, train_loss: 1.0585, test_loss: 1.0339, test_f1: 0.4620
 epoch: 51, train_loss: 1.0493, test_loss: 1.0302, test_f1: 0.4669
 epoch: 52, train_loss: 1.0531, test_loss: 1.0288, test_f1: 0.4688
 epoch: 53, train_loss: 1.0493, test_loss: 1.0276, test_f1: 0.4691
 epoch: 54, train_loss: 1.0457, test_loss: 1.0260, test_f1: 0.4708
 epoch: 55, train_loss: 1.0480, test_loss: 1.0244, test_f1: 0.4703
 epoch: 56, train_loss: 1.0399, test_loss: 1.0230, test_f1: 0.4714
 epoch: 57, train_loss: 1.0368, test_loss: 1.0212, test_f1: 0.4726
 epoch: 58, train_loss: 1.0389, test_loss: 1.0208, test_f1: 0.4762
 epoch: 59, train_loss: 1.0376, test_loss: 1.0206, test_f1: 0.4752
 epoch: 60, train_loss: 1.0321, test_loss: 1.0191, test_f1: 0.4750
 epoch: 61, train_loss: 1.0300, test_loss: 1.0185, test_f1: 0.4774
 epoch: 62, train_loss: 1.0299, test_loss: 1.0169, test_f1: 0.4731
 epoch: 63, train_loss: 1.0309, test_loss: 1.0151, test_f1: 0.4756
 epoch: 64, train_loss: 1.0240, test_loss: 1.0138, test_f1: 0.4724
 epoch: 65, train_loss: 1.0215, test_loss: 1.0117, test_f1: 0.4742
 epoch: 66, train_loss: 1.0205, test_loss: 1.0108, test_f1: 0.4773
 epoch: 67, train_loss: 1.0177, test_loss: 1.0092, test_f1: 0.4755
 epoch: 68, train_loss: 1.0183, test_loss: 1.0077, test_f1: 0.4803
 epoch: 69, train_loss: 1.0200, test_loss: 1.0073, test_f1: 0.4800
 epoch: 70, train_loss: 1.0135, test_loss: 1.0071, test_f1: 0.4763
 epoch: 71, train_loss: 1.0078, test_loss: 1.0052, test_f1: 0.4784
 epoch: 72, train_loss: 1.0106, test_loss: 1.0040, test_f1: 0.4778
 epoch: 73, train_loss: 1.0061, test_loss: 1.0015, test_f1: 0.4776
 epoch: 74, train_loss: 1.0058, test_loss: 1.0010, test_f1: 0.4790
 epoch: 75, train_loss: 1.0059, test_loss: 1.0015, test_f1: 0.4805
 epoch: 76, train_loss: 1.0039, test_loss: 1.0003, test_f1: 0.4830
 epoch: 77, train_loss: 1.0040, test_loss: 0.9987, test_f1: 0.4826
 epoch: 78, train_loss: 0.9987, test_loss: 0.9980, test_f1: 0.4897
 epoch: 79, train_loss: 1.0084, test_loss: 0.9962, test_f1: 0.4865
 epoch: 80, train_loss: 0.9940, test_loss: 0.9955, test_f1: 0.4875
 epoch: 81, train_loss: 0.9959, test_loss: 0.9951, test_f1: 0.4805
 epoch: 82, train_loss: 0.9964, test_loss: 0.9946, test_f1: 0.4819
 epoch: 83, train_loss: 0.9888, test_loss: 0.9951, test_f1: 0.4831
 epoch: 84, train_loss: 0.9946, test_loss: 0.9941, test_f1: 0.4852
 epoch: 85, train_loss: 0.9818, test_loss: 0.9917, test_f1: 0.4831
 epoch: 86, train_loss: 0.9942, test_loss: 0.9911, test_f1: 0.4864
 epoch: 87, train_loss: 0.9869, test_loss: 0.9907, test_f1: 0.4868
 epoch: 88, train_loss: 0.9875, test_loss: 0.9899, test_f1: 0.4879
 epoch: 89, train_loss: 0.9841, test_loss: 0.9893, test_f1: 0.4857
 epoch: 90, train_loss: 0.9807, test_loss: 0.9889, test_f1: 0.4824
 epoch: 91, train_loss: 0.9832, test_loss: 0.9892, test_f1: 0.4788
 epoch: 92, train_loss: 0.9816, test_loss: 0.9877, test_f1: 0.4864
 epoch: 93, train_loss: 0.9843, test_loss: 0.9859, test_f1: 0.4843
 epoch: 94, train_loss: 0.9800, test_loss: 0.9841, test_f1: 0.4852
 epoch: 95, train_loss: 0.9790, test_loss: 0.9856, test_f1: 0.4797
 epoch: 96, train_loss: 0.9827, test_loss: 0.9833, test_f1: 0.4825
 epoch: 97, train_loss: 0.9744, test_loss: 0.9820, test_f1: 0.4854
 epoch: 98, train_loss: 0.9734, test_loss: 0.9829, test_f1: 0.4845
 epoch: 99, train_loss: 0.9728, test_loss: 0.9823, test_f1: 0.4855
##################ITERATION #3 ****************************************
 epoch: 0, train_loss: 1.3126, test_loss: 1.3198, test_f1: 0.2270
 epoch: 1, train_loss: 1.2945, test_loss: 1.3190, test_f1: 0.2270
 epoch: 2, train_loss: 1.2856, test_loss: 1.3096, test_f1: 0.2270
 epoch: 3, train_loss: 1.2773, test_loss: 1.2916, test_f1: 0.2270
 epoch: 4, train_loss: 1.2669, test_loss: 1.2736, test_f1: 0.2270
 epoch: 5, train_loss: 1.2606, test_loss: 1.2548, test_f1: 0.2295
 epoch: 6, train_loss: 1.2517, test_loss: 1.2404, test_f1: 0.2347
 epoch: 7, train_loss: 1.2431, test_loss: 1.2299, test_f1: 0.2698
 epoch: 8, train_loss: 1.2373, test_loss: 1.2227, test_f1: 0.2788
 epoch: 9, train_loss: 1.2298, test_loss: 1.2145, test_f1: 0.2832
 epoch: 10, train_loss: 1.2224, test_loss: 1.2073, test_f1: 0.3128
 epoch: 11, train_loss: 1.2150, test_loss: 1.1990, test_f1: 0.3326
 epoch: 12, train_loss: 1.2084, test_loss: 1.1922, test_f1: 0.3578
 epoch: 13, train_loss: 1.2041, test_loss: 1.1832, test_f1: 0.3712
 epoch: 14, train_loss: 1.1930, test_loss: 1.1745, test_f1: 0.3880
 epoch: 15, train_loss: 1.1864, test_loss: 1.1677, test_f1: 0.4049
 epoch: 16, train_loss: 1.1781, test_loss: 1.1591, test_f1: 0.4112
 epoch: 17, train_loss: 1.1696, test_loss: 1.1516, test_f1: 0.4170
 epoch: 18, train_loss: 1.1655, test_loss: 1.1423, test_f1: 0.4221
 epoch: 19, train_loss: 1.1632, test_loss: 1.1354, test_f1: 0.4196
 epoch: 20, train_loss: 1.1537, test_loss: 1.1290, test_f1: 0.4230
 epoch: 21, train_loss: 1.1457, test_loss: 1.1222, test_f1: 0.4267
 epoch: 22, train_loss: 1.1346, test_loss: 1.1130, test_f1: 0.4391
 epoch: 23, train_loss: 1.1299, test_loss: 1.1052, test_f1: 0.4355
 epoch: 24, train_loss: 1.1205, test_loss: 1.0963, test_f1: 0.4457
 epoch: 25, train_loss: 1.1169, test_loss: 1.0869, test_f1: 0.4512
 epoch: 26, train_loss: 1.1095, test_loss: 1.0819, test_f1: 0.4484
 epoch: 27, train_loss: 1.1031, test_loss: 1.0748, test_f1: 0.4474
 epoch: 28, train_loss: 1.0976, test_loss: 1.0678, test_f1: 0.4367
 epoch: 29, train_loss: 1.0891, test_loss: 1.0605, test_f1: 0.4366
 epoch: 30, train_loss: 1.0845, test_loss: 1.0541, test_f1: 0.4436
 epoch: 31, train_loss: 1.0756, test_loss: 1.0488, test_f1: 0.4401
 epoch: 32, train_loss: 1.0699, test_loss: 1.0441, test_f1: 0.4424
 epoch: 33, train_loss: 1.0674, test_loss: 1.0393, test_f1: 0.4443
 epoch: 34, train_loss: 1.0584, test_loss: 1.0334, test_f1: 0.4474
 epoch: 35, train_loss: 1.0534, test_loss: 1.0242, test_f1: 0.4558
 epoch: 36, train_loss: 1.0436, test_loss: 1.0232, test_f1: 0.4574
 epoch: 37, train_loss: 1.0412, test_loss: 1.0186, test_f1: 0.4604
 epoch: 38, train_loss: 1.0254, test_loss: 1.0103, test_f1: 0.4604
 epoch: 39, train_loss: 1.0252, test_loss: 1.0044, test_f1: 0.4633
 epoch: 40, train_loss: 1.0220, test_loss: 1.0056, test_f1: 0.4599
 epoch: 41, train_loss: 1.0113, test_loss: 1.0033, test_f1: 0.4604
 epoch: 42, train_loss: 1.0132, test_loss: 0.9980, test_f1: 0.4619
 epoch: 43, train_loss: 1.0125, test_loss: 0.9967, test_f1: 0.4641
 epoch: 44, train_loss: 0.9959, test_loss: 0.9944, test_f1: 0.4648
 epoch: 45, train_loss: 1.0008, test_loss: 0.9921, test_f1: 0.4678
 epoch: 46, train_loss: 0.9931, test_loss: 0.9900, test_f1: 0.4725
 epoch: 47, train_loss: 0.9927, test_loss: 0.9845, test_f1: 0.4647
 epoch: 48, train_loss: 0.9941, test_loss: 0.9844, test_f1: 0.4760
 epoch: 49, train_loss: 0.9811, test_loss: 0.9826, test_f1: 0.4729
 epoch: 50, train_loss: 0.9804, test_loss: 0.9804, test_f1: 0.4754
 epoch: 51, train_loss: 0.9792, test_loss: 0.9811, test_f1: 0.4793
 epoch: 52, train_loss: 0.9739, test_loss: 0.9839, test_f1: 0.4799
 epoch: 53, train_loss: 0.9732, test_loss: 0.9804, test_f1: 0.4788
 epoch: 54, train_loss: 0.9660, test_loss: 0.9817, test_f1: 0.4788
 epoch: 55, train_loss: 0.9619, test_loss: 0.9770, test_f1: 0.4781
 epoch: 56, train_loss: 0.9733, test_loss: 0.9772, test_f1: 0.4807
 epoch: 57, train_loss: 0.9635, test_loss: 0.9788, test_f1: 0.4769
 epoch: 58, train_loss: 0.9689, test_loss: 0.9763, test_f1: 0.4773
 epoch: 59, train_loss: 0.9625, test_loss: 0.9715, test_f1: 0.4737
 epoch: 60, train_loss: 0.9644, test_loss: 0.9678, test_f1: 0.4764
 epoch: 61, train_loss: 0.9627, test_loss: 0.9689, test_f1: 0.4774
 epoch: 62, train_loss: 0.9619, test_loss: 0.9671, test_f1: 0.4732
 epoch: 63, train_loss: 0.9560, test_loss: 0.9720, test_f1: 0.4821
 epoch: 64, train_loss: 0.9539, test_loss: 0.9737, test_f1: 0.4826
 epoch: 65, train_loss: 0.9513, test_loss: 0.9719, test_f1: 0.4825
 epoch: 66, train_loss: 0.9527, test_loss: 0.9698, test_f1: 0.4805
 epoch: 67, train_loss: 0.9494, test_loss: 0.9629, test_f1: 0.4784
 epoch: 68, train_loss: 0.9551, test_loss: 0.9653, test_f1: 0.4784
 epoch: 69, train_loss: 0.9434, test_loss: 0.9700, test_f1: 0.4807
 epoch: 70, train_loss: 0.9481, test_loss: 0.9653, test_f1: 0.4821
 epoch: 71, train_loss: 0.9386, test_loss: 0.9622, test_f1: 0.4787
 epoch: 72, train_loss: 0.9438, test_loss: 0.9699, test_f1: 0.4767
 epoch: 73, train_loss: 0.9455, test_loss: 0.9676, test_f1: 0.4759
 epoch: 74, train_loss: 0.9455, test_loss: 0.9723, test_f1: 0.4773
 epoch: 75, train_loss: 0.9461, test_loss: 0.9655, test_f1: 0.4773
 epoch: 76, train_loss: 0.9406, test_loss: 0.9673, test_f1: 0.4841
 epoch: 77, train_loss: 0.9356, test_loss: 0.9650, test_f1: 0.4819
 epoch: 78, train_loss: 0.9388, test_loss: 0.9665, test_f1: 0.4867
 epoch: 79, train_loss: 0.9344, test_loss: 0.9661, test_f1: 0.4865
 epoch: 80, train_loss: 0.9329, test_loss: 0.9626, test_f1: 0.4845
 epoch: 81, train_loss: 0.9360, test_loss: 0.9639, test_f1: 0.4885
 epoch: 82, train_loss: 0.9306, test_loss: 0.9584, test_f1: 0.4867
 epoch: 83, train_loss: 0.9335, test_loss: 0.9624, test_f1: 0.4899
 epoch: 84, train_loss: 0.9268, test_loss: 0.9642, test_f1: 0.4882
 epoch: 85, train_loss: 0.9232, test_loss: 0.9683, test_f1: 0.4877
 epoch: 86, train_loss: 0.9186, test_loss: 0.9618, test_f1: 0.4916
 epoch: 87, train_loss: 0.9197, test_loss: 0.9582, test_f1: 0.4929
 epoch: 88, train_loss: 0.9261, test_loss: 0.9599, test_f1: 0.4919
 epoch: 89, train_loss: 0.9168, test_loss: 0.9595, test_f1: 0.4896
 epoch: 90, train_loss: 0.9181, test_loss: 0.9582, test_f1: 0.4909
 epoch: 91, train_loss: 0.9284, test_loss: 0.9640, test_f1: 0.4919
 epoch: 92, train_loss: 0.9202, test_loss: 0.9685, test_f1: 0.4908
 epoch: 93, train_loss: 0.9188, test_loss: 0.9645, test_f1: 0.4927
 epoch: 94, train_loss: 0.9170, test_loss: 0.9619, test_f1: 0.4934
 epoch: 95, train_loss: 0.9215, test_loss: 0.9617, test_f1: 0.4910
 epoch: 96, train_loss: 0.9085, test_loss: 0.9612, test_f1: 0.4897
 epoch: 97, train_loss: 0.9112, test_loss: 0.9597, test_f1: 0.4958
 epoch: 98, train_loss: 0.9085, test_loss: 0.9598, test_f1: 0.4948
 epoch: 99, train_loss: 0.9109, test_loss: 0.9587, test_f1: 0.4973
##################ITERATION #4 ****************************************
 epoch: 0, train_loss: 1.3047, test_loss: 1.3173, test_f1: 0.2270
 epoch: 1, train_loss: 1.2791, test_loss: 1.3086, test_f1: 0.2270
 epoch: 2, train_loss: 1.2658, test_loss: 1.2912, test_f1: 0.2270
 epoch: 3, train_loss: 1.2581, test_loss: 1.2664, test_f1: 0.2270
 epoch: 4, train_loss: 1.2476, test_loss: 1.2441, test_f1: 0.2350
 epoch: 5, train_loss: 1.2410, test_loss: 1.2216, test_f1: 0.2668
 epoch: 6, train_loss: 1.2373, test_loss: 1.2063, test_f1: 0.2948
 epoch: 7, train_loss: 1.2268, test_loss: 1.1963, test_f1: 0.3069
 epoch: 8, train_loss: 1.2212, test_loss: 1.1885, test_f1: 0.3109
 epoch: 9, train_loss: 1.2159, test_loss: 1.1799, test_f1: 0.3179
 epoch: 10, train_loss: 1.2102, test_loss: 1.1723, test_f1: 0.3316
 epoch: 11, train_loss: 1.2063, test_loss: 1.1641, test_f1: 0.3344
 epoch: 12, train_loss: 1.1940, test_loss: 1.1587, test_f1: 0.3503
 epoch: 13, train_loss: 1.1922, test_loss: 1.1520, test_f1: 0.3701
 epoch: 14, train_loss: 1.1864, test_loss: 1.1438, test_f1: 0.3789
 epoch: 15, train_loss: 1.1722, test_loss: 1.1364, test_f1: 0.3767
 epoch: 16, train_loss: 1.1612, test_loss: 1.1324, test_f1: 0.3987
 epoch: 17, train_loss: 1.1603, test_loss: 1.1247, test_f1: 0.4065
 epoch: 18, train_loss: 1.1573, test_loss: 1.1153, test_f1: 0.4050
 epoch: 19, train_loss: 1.1434, test_loss: 1.1061, test_f1: 0.4100
 epoch: 20, train_loss: 1.1425, test_loss: 1.0987, test_f1: 0.4149
 epoch: 21, train_loss: 1.1362, test_loss: 1.0919, test_f1: 0.4165
 epoch: 22, train_loss: 1.1258, test_loss: 1.0868, test_f1: 0.4192
 epoch: 23, train_loss: 1.1200, test_loss: 1.0785, test_f1: 0.4242
 epoch: 24, train_loss: 1.1153, test_loss: 1.0724, test_f1: 0.4439
 epoch: 25, train_loss: 1.1118, test_loss: 1.0664, test_f1: 0.4449
 epoch: 26, train_loss: 1.0961, test_loss: 1.0584, test_f1: 0.4537
 epoch: 27, train_loss: 1.0901, test_loss: 1.0536, test_f1: 0.4569
 epoch: 28, train_loss: 1.0909, test_loss: 1.0461, test_f1: 0.4541
 epoch: 29, train_loss: 1.0806, test_loss: 1.0428, test_f1: 0.4573
 epoch: 30, train_loss: 1.0767, test_loss: 1.0343, test_f1: 0.4625
 epoch: 31, train_loss: 1.0597, test_loss: 1.0279, test_f1: 0.4679
 epoch: 32, train_loss: 1.0561, test_loss: 1.0171, test_f1: 0.4718
 epoch: 33, train_loss: 1.0518, test_loss: 1.0130, test_f1: 0.4727
 epoch: 34, train_loss: 1.0442, test_loss: 1.0132, test_f1: 0.4626
 epoch: 35, train_loss: 1.0371, test_loss: 1.0063, test_f1: 0.4652
 epoch: 36, train_loss: 1.0368, test_loss: 0.9978, test_f1: 0.4733
 epoch: 37, train_loss: 1.0280, test_loss: 0.9946, test_f1: 0.4674
 epoch: 38, train_loss: 1.0264, test_loss: 0.9886, test_f1: 0.4725
 epoch: 39, train_loss: 1.0200, test_loss: 0.9845, test_f1: 0.4725
 epoch: 40, train_loss: 1.0196, test_loss: 0.9861, test_f1: 0.4758
 epoch: 41, train_loss: 1.0205, test_loss: 0.9762, test_f1: 0.4837
 epoch: 42, train_loss: 1.0122, test_loss: 0.9719, test_f1: 0.4851
 epoch: 43, train_loss: 0.9966, test_loss: 0.9680, test_f1: 0.4796
 epoch: 44, train_loss: 1.0012, test_loss: 0.9659, test_f1: 0.4883
 epoch: 45, train_loss: 0.9992, test_loss: 0.9627, test_f1: 0.4901
 epoch: 46, train_loss: 0.9923, test_loss: 0.9620, test_f1: 0.4902
 epoch: 47, train_loss: 0.9809, test_loss: 0.9580, test_f1: 0.4928
 epoch: 48, train_loss: 0.9867, test_loss: 0.9585, test_f1: 0.4923
 epoch: 49, train_loss: 0.9781, test_loss: 0.9562, test_f1: 0.4924
 epoch: 50, train_loss: 0.9779, test_loss: 0.9615, test_f1: 0.4862
 epoch: 51, train_loss: 0.9727, test_loss: 0.9518, test_f1: 0.4911
 epoch: 52, train_loss: 0.9795, test_loss: 0.9524, test_f1: 0.4890
 epoch: 53, train_loss: 0.9676, test_loss: 0.9525, test_f1: 0.4920
 epoch: 54, train_loss: 0.9535, test_loss: 0.9524, test_f1: 0.4902
 epoch: 55, train_loss: 0.9707, test_loss: 0.9494, test_f1: 0.4940
 epoch: 56, train_loss: 0.9695, test_loss: 0.9492, test_f1: 0.4900
 epoch: 57, train_loss: 0.9637, test_loss: 0.9460, test_f1: 0.4982
 epoch: 58, train_loss: 0.9623, test_loss: 0.9516, test_f1: 0.4971
 epoch: 59, train_loss: 0.9561, test_loss: 0.9521, test_f1: 0.4941
 epoch: 60, train_loss: 0.9510, test_loss: 0.9502, test_f1: 0.4888
 epoch: 61, train_loss: 0.9567, test_loss: 0.9518, test_f1: 0.4894
 epoch: 62, train_loss: 0.9551, test_loss: 0.9509, test_f1: 0.4936
 epoch: 63, train_loss: 0.9630, test_loss: 0.9518, test_f1: 0.4919
 epoch: 64, train_loss: 0.9511, test_loss: 0.9483, test_f1: 0.5008
 epoch: 65, train_loss: 0.9495, test_loss: 0.9494, test_f1: 0.4960
 epoch: 66, train_loss: 0.9480, test_loss: 0.9458, test_f1: 0.4946
 epoch: 67, train_loss: 0.9460, test_loss: 0.9451, test_f1: 0.4943
 epoch: 68, train_loss: 0.9524, test_loss: 0.9465, test_f1: 0.4939
 epoch: 69, train_loss: 0.9502, test_loss: 0.9479, test_f1: 0.4933
 epoch: 70, train_loss: 0.9354, test_loss: 0.9437, test_f1: 0.4993
 epoch: 71, train_loss: 0.9431, test_loss: 0.9462, test_f1: 0.4940
 epoch: 72, train_loss: 0.9395, test_loss: 0.9461, test_f1: 0.4974
 epoch: 73, train_loss: 0.9394, test_loss: 0.9412, test_f1: 0.4995
 epoch: 74, train_loss: 0.9437, test_loss: 0.9444, test_f1: 0.4959
 epoch: 75, train_loss: 0.9332, test_loss: 0.9429, test_f1: 0.5008
 epoch: 76, train_loss: 0.9451, test_loss: 0.9409, test_f1: 0.5024
 epoch: 77, train_loss: 0.9275, test_loss: 0.9411, test_f1: 0.4965
 epoch: 78, train_loss: 0.9340, test_loss: 0.9428, test_f1: 0.4960
 epoch: 79, train_loss: 0.9247, test_loss: 0.9428, test_f1: 0.4956
 epoch: 80, train_loss: 0.9316, test_loss: 0.9424, test_f1: 0.4938
 epoch: 81, train_loss: 0.9325, test_loss: 0.9436, test_f1: 0.4915
 epoch: 82, train_loss: 0.9253, test_loss: 0.9432, test_f1: 0.4976
 epoch: 83, train_loss: 0.9272, test_loss: 0.9453, test_f1: 0.4942
 epoch: 84, train_loss: 0.9282, test_loss: 0.9421, test_f1: 0.4976
 epoch: 85, train_loss: 0.9216, test_loss: 0.9456, test_f1: 0.4949
 epoch: 86, train_loss: 0.9252, test_loss: 0.9482, test_f1: 0.4919
 epoch: 87, train_loss: 0.9161, test_loss: 0.9466, test_f1: 0.4980
 epoch: 88, train_loss: 0.9141, test_loss: 0.9448, test_f1: 0.4919
 epoch: 89, train_loss: 0.9229, test_loss: 0.9461, test_f1: 0.4967
 epoch: 90, train_loss: 0.9187, test_loss: 0.9539, test_f1: 0.4943
 epoch: 91, train_loss: 0.9132, test_loss: 0.9506, test_f1: 0.4884
 epoch: 92, train_loss: 0.9183, test_loss: 0.9423, test_f1: 0.4951
 epoch: 93, train_loss: 0.9152, test_loss: 0.9432, test_f1: 0.4961
 epoch: 94, train_loss: 0.9123, test_loss: 0.9450, test_f1: 0.5112
 epoch: 95, train_loss: 0.9069, test_loss: 0.9438, test_f1: 0.5083
 epoch: 96, train_loss: 0.9201, test_loss: 0.9435, test_f1: 0.4947
 epoch: 97, train_loss: 0.9146, test_loss: 0.9509, test_f1: 0.4939
 epoch: 98, train_loss: 0.9045, test_loss: 0.9540, test_f1: 0.4984
 epoch: 99, train_loss: 0.9041, test_loss: 0.9538, test_f1: 0.5054
##################ITERATION #5 ****************************************
 epoch: 0, train_loss: 1.3066, test_loss: 1.3312, test_f1: 0.2270
 epoch: 1, train_loss: 1.2756, test_loss: 1.3322, test_f1: 0.2270
 epoch: 2, train_loss: 1.2649, test_loss: 1.3302, test_f1: 0.2270
 epoch: 3, train_loss: 1.2493, test_loss: 1.3308, test_f1: 0.2270
 epoch: 4, train_loss: 1.2349, test_loss: 1.3085, test_f1: 0.2526
 epoch: 5, train_loss: 1.2255, test_loss: 1.2405, test_f1: 0.2653
 epoch: 6, train_loss: 1.2182, test_loss: 1.1959, test_f1: 0.2976
 epoch: 7, train_loss: 1.2138, test_loss: 1.1776, test_f1: 0.3065
 epoch: 8, train_loss: 1.2008, test_loss: 1.1666, test_f1: 0.3152
 epoch: 9, train_loss: 1.1920, test_loss: 1.1585, test_f1: 0.3433
 epoch: 10, train_loss: 1.1861, test_loss: 1.1507, test_f1: 0.3509
 epoch: 11, train_loss: 1.1847, test_loss: 1.1418, test_f1: 0.3601
 epoch: 12, train_loss: 1.1703, test_loss: 1.1340, test_f1: 0.3747
 epoch: 13, train_loss: 1.1715, test_loss: 1.1291, test_f1: 0.3836
 epoch: 14, train_loss: 1.1570, test_loss: 1.1215, test_f1: 0.3997
 epoch: 15, train_loss: 1.1538, test_loss: 1.1110, test_f1: 0.4153
 epoch: 16, train_loss: 1.1469, test_loss: 1.1072, test_f1: 0.4224
 epoch: 17, train_loss: 1.1422, test_loss: 1.1001, test_f1: 0.4269
 epoch: 18, train_loss: 1.1375, test_loss: 1.0944, test_f1: 0.4416
 epoch: 19, train_loss: 1.1302, test_loss: 1.0872, test_f1: 0.4558
 epoch: 20, train_loss: 1.1260, test_loss: 1.0821, test_f1: 0.4539
 epoch: 21, train_loss: 1.1160, test_loss: 1.0734, test_f1: 0.4635
 epoch: 22, train_loss: 1.1095, test_loss: 1.0655, test_f1: 0.4692
 epoch: 23, train_loss: 1.1098, test_loss: 1.0605, test_f1: 0.4638
 epoch: 24, train_loss: 1.1025, test_loss: 1.0572, test_f1: 0.4615
 epoch: 25, train_loss: 1.1010, test_loss: 1.0547, test_f1: 0.4549
 epoch: 26, train_loss: 1.0972, test_loss: 1.0463, test_f1: 0.4661
 epoch: 27, train_loss: 1.0827, test_loss: 1.0399, test_f1: 0.4696
 epoch: 28, train_loss: 1.0811, test_loss: 1.0337, test_f1: 0.4691
 epoch: 29, train_loss: 1.0782, test_loss: 1.0289, test_f1: 0.4713
 epoch: 30, train_loss: 1.0738, test_loss: 1.0237, test_f1: 0.4699
 epoch: 31, train_loss: 1.0663, test_loss: 1.0187, test_f1: 0.4728
 epoch: 32, train_loss: 1.0647, test_loss: 1.0161, test_f1: 0.4703
 epoch: 33, train_loss: 1.0542, test_loss: 1.0122, test_f1: 0.4633
 epoch: 34, train_loss: 1.0504, test_loss: 1.0039, test_f1: 0.4837
 epoch: 35, train_loss: 1.0450, test_loss: 1.0018, test_f1: 0.4775
 epoch: 36, train_loss: 1.0390, test_loss: 0.9977, test_f1: 0.4816
 epoch: 37, train_loss: 1.0368, test_loss: 0.9915, test_f1: 0.4918
 epoch: 38, train_loss: 1.0337, test_loss: 0.9912, test_f1: 0.4746
 epoch: 39, train_loss: 1.0343, test_loss: 0.9886, test_f1: 0.4806
 epoch: 40, train_loss: 1.0282, test_loss: 0.9865, test_f1: 0.4774
 epoch: 41, train_loss: 1.0194, test_loss: 0.9831, test_f1: 0.4815
 epoch: 42, train_loss: 1.0234, test_loss: 0.9839, test_f1: 0.4729
 epoch: 43, train_loss: 1.0243, test_loss: 0.9784, test_f1: 0.4881
 epoch: 44, train_loss: 1.0096, test_loss: 0.9754, test_f1: 0.4876
 epoch: 45, train_loss: 1.0037, test_loss: 0.9769, test_f1: 0.4875
 epoch: 46, train_loss: 1.0011, test_loss: 0.9769, test_f1: 0.4799
 epoch: 47, train_loss: 0.9973, test_loss: 0.9739, test_f1: 0.4879
 epoch: 48, train_loss: 1.0029, test_loss: 0.9664, test_f1: 0.4863
 epoch: 49, train_loss: 0.9991, test_loss: 0.9725, test_f1: 0.4839
 epoch: 50, train_loss: 0.9885, test_loss: 0.9671, test_f1: 0.4859
 epoch: 51, train_loss: 0.9888, test_loss: 0.9685, test_f1: 0.4814
 epoch: 52, train_loss: 0.9864, test_loss: 0.9694, test_f1: 0.4822
 epoch: 53, train_loss: 0.9828, test_loss: 0.9630, test_f1: 0.4893
 epoch: 54, train_loss: 0.9835, test_loss: 0.9649, test_f1: 0.4922
 epoch: 55, train_loss: 0.9923, test_loss: 0.9615, test_f1: 0.4886
 epoch: 56, train_loss: 0.9644, test_loss: 0.9601, test_f1: 0.4942
 epoch: 57, train_loss: 0.9836, test_loss: 0.9591, test_f1: 0.4896
 epoch: 58, train_loss: 0.9790, test_loss: 0.9628, test_f1: 0.4823
 epoch: 59, train_loss: 0.9631, test_loss: 0.9586, test_f1: 0.4913
 epoch: 60, train_loss: 0.9772, test_loss: 0.9594, test_f1: 0.4919
 epoch: 61, train_loss: 0.9728, test_loss: 0.9578, test_f1: 0.4913
 epoch: 62, train_loss: 0.9670, test_loss: 0.9555, test_f1: 0.4934
 epoch: 63, train_loss: 0.9627, test_loss: 0.9556, test_f1: 0.4947
 epoch: 64, train_loss: 0.9604, test_loss: 0.9561, test_f1: 0.4952
 epoch: 65, train_loss: 0.9667, test_loss: 0.9557, test_f1: 0.4881
 epoch: 66, train_loss: 0.9661, test_loss: 0.9562, test_f1: 0.4894
 epoch: 67, train_loss: 0.9672, test_loss: 0.9508, test_f1: 0.4894
 epoch: 68, train_loss: 0.9575, test_loss: 0.9523, test_f1: 0.4881
 epoch: 69, train_loss: 0.9660, test_loss: 0.9578, test_f1: 0.4835
 epoch: 70, train_loss: 0.9599, test_loss: 0.9504, test_f1: 0.4934
 epoch: 71, train_loss: 0.9682, test_loss: 0.9463, test_f1: 0.4899
 epoch: 72, train_loss: 0.9568, test_loss: 0.9521, test_f1: 0.4869
 epoch: 73, train_loss: 0.9529, test_loss: 0.9538, test_f1: 0.4875
 epoch: 74, train_loss: 0.9565, test_loss: 0.9511, test_f1: 0.4874
 epoch: 75, train_loss: 0.9488, test_loss: 0.9482, test_f1: 0.4887
 epoch: 76, train_loss: 0.9444, test_loss: 0.9459, test_f1: 0.4878
 epoch: 77, train_loss: 0.9415, test_loss: 0.9471, test_f1: 0.4848
 epoch: 78, train_loss: 0.9504, test_loss: 0.9527, test_f1: 0.4891
 epoch: 79, train_loss: 0.9427, test_loss: 0.9513, test_f1: 0.4922
 epoch: 80, train_loss: 0.9472, test_loss: 0.9552, test_f1: 0.4919
 epoch: 81, train_loss: 0.9513, test_loss: 0.9518, test_f1: 0.4886
 epoch: 82, train_loss: 0.9470, test_loss: 0.9500, test_f1: 0.4925
 epoch: 83, train_loss: 0.9443, test_loss: 0.9518, test_f1: 0.4901
 epoch: 84, train_loss: 0.9377, test_loss: 0.9481, test_f1: 0.4899
 epoch: 85, train_loss: 0.9414, test_loss: 0.9489, test_f1: 0.4911
 epoch: 86, train_loss: 0.9413, test_loss: 0.9435, test_f1: 0.4951
 epoch: 87, train_loss: 0.9384, test_loss: 0.9513, test_f1: 0.4937
 epoch: 88, train_loss: 0.9370, test_loss: 0.9498, test_f1: 0.4924
 epoch: 89, train_loss: 0.9333, test_loss: 0.9526, test_f1: 0.4948
 epoch: 90, train_loss: 0.9388, test_loss: 0.9527, test_f1: 0.5073
 epoch: 91, train_loss: 0.9357, test_loss: 0.9555, test_f1: 0.4965
 epoch: 92, train_loss: 0.9341, test_loss: 0.9460, test_f1: 0.4982
 epoch: 93, train_loss: 0.9304, test_loss: 0.9499, test_f1: 0.4954
 epoch: 94, train_loss: 0.9393, test_loss: 0.9450, test_f1: 0.5024
 epoch: 95, train_loss: 0.9295, test_loss: 0.9449, test_f1: 0.5031
 epoch: 96, train_loss: 0.9364, test_loss: 0.9446, test_f1: 0.5045
 epoch: 97, train_loss: 0.9338, test_loss: 0.9461, test_f1: 0.5024
 epoch: 98, train_loss: 0.9319, test_loss: 0.9400, test_f1: 0.5087
 epoch: 99, train_loss: 0.9248, test_loss: 0.9521, test_f1: 0.5057
##################ITERATION #6 ****************************************
 epoch: 0, train_loss: 1.3240, test_loss: 1.3129, test_f1: 0.2270
 epoch: 1, train_loss: 1.2803, test_loss: 1.3128, test_f1: 0.2270
 epoch: 2, train_loss: 1.2661, test_loss: 1.2949, test_f1: 0.2270
 epoch: 3, train_loss: 1.2429, test_loss: 1.2647, test_f1: 0.2270
 epoch: 4, train_loss: 1.2328, test_loss: 1.2226, test_f1: 0.2651
 epoch: 5, train_loss: 1.2285, test_loss: 1.1936, test_f1: 0.2765
 epoch: 6, train_loss: 1.2154, test_loss: 1.1763, test_f1: 0.2929
 epoch: 7, train_loss: 1.2051, test_loss: 1.1658, test_f1: 0.3045
 epoch: 8, train_loss: 1.1948, test_loss: 1.1547, test_f1: 0.3125
 epoch: 9, train_loss: 1.1893, test_loss: 1.1475, test_f1: 0.3287
 epoch: 10, train_loss: 1.1822, test_loss: 1.1387, test_f1: 0.3492
 epoch: 11, train_loss: 1.1762, test_loss: 1.1321, test_f1: 0.3531
 epoch: 12, train_loss: 1.1677, test_loss: 1.1238, test_f1: 0.3619
 epoch: 13, train_loss: 1.1606, test_loss: 1.1163, test_f1: 0.3697
 epoch: 14, train_loss: 1.1503, test_loss: 1.1084, test_f1: 0.3806
 epoch: 15, train_loss: 1.1455, test_loss: 1.0998, test_f1: 0.3840
 epoch: 16, train_loss: 1.1424, test_loss: 1.0924, test_f1: 0.3972
 epoch: 17, train_loss: 1.1373, test_loss: 1.0859, test_f1: 0.4184
 epoch: 18, train_loss: 1.1273, test_loss: 1.0774, test_f1: 0.4214
 epoch: 19, train_loss: 1.1222, test_loss: 1.0712, test_f1: 0.4193
 epoch: 20, train_loss: 1.1259, test_loss: 1.0652, test_f1: 0.4376
 epoch: 21, train_loss: 1.1070, test_loss: 1.0610, test_f1: 0.4425
 epoch: 22, train_loss: 1.1089, test_loss: 1.0563, test_f1: 0.4402
 epoch: 23, train_loss: 1.1046, test_loss: 1.0489, test_f1: 0.4367
 epoch: 24, train_loss: 1.0923, test_loss: 1.0425, test_f1: 0.4417
 epoch: 25, train_loss: 1.0918, test_loss: 1.0391, test_f1: 0.4624
 epoch: 26, train_loss: 1.0799, test_loss: 1.0339, test_f1: 0.4616
 epoch: 27, train_loss: 1.0863, test_loss: 1.0277, test_f1: 0.4605
 epoch: 28, train_loss: 1.0814, test_loss: 1.0232, test_f1: 0.4654
 epoch: 29, train_loss: 1.0669, test_loss: 1.0195, test_f1: 0.4635
 epoch: 30, train_loss: 1.0619, test_loss: 1.0157, test_f1: 0.4667
 epoch: 31, train_loss: 1.0576, test_loss: 1.0119, test_f1: 0.4690
 epoch: 32, train_loss: 1.0522, test_loss: 1.0095, test_f1: 0.4682
 epoch: 33, train_loss: 1.0547, test_loss: 1.0052, test_f1: 0.4728
 epoch: 34, train_loss: 1.0492, test_loss: 1.0005, test_f1: 0.4725
 epoch: 35, train_loss: 1.0544, test_loss: 0.9986, test_f1: 0.4664
 epoch: 36, train_loss: 1.0389, test_loss: 0.9922, test_f1: 0.4691
 epoch: 37, train_loss: 1.0339, test_loss: 0.9877, test_f1: 0.4702
 epoch: 38, train_loss: 1.0363, test_loss: 0.9860, test_f1: 0.4645
 epoch: 39, train_loss: 1.0280, test_loss: 0.9844, test_f1: 0.4616
 epoch: 40, train_loss: 1.0246, test_loss: 0.9792, test_f1: 0.4689
 epoch: 41, train_loss: 1.0202, test_loss: 0.9760, test_f1: 0.4777
 epoch: 42, train_loss: 1.0133, test_loss: 0.9740, test_f1: 0.4734
 epoch: 43, train_loss: 1.0165, test_loss: 0.9717, test_f1: 0.4733
 epoch: 44, train_loss: 1.0060, test_loss: 0.9666, test_f1: 0.4792
 epoch: 45, train_loss: 1.0079, test_loss: 0.9644, test_f1: 0.4753
 epoch: 46, train_loss: 0.9961, test_loss: 0.9620, test_f1: 0.4789
 epoch: 47, train_loss: 0.9939, test_loss: 0.9610, test_f1: 0.4877
 epoch: 48, train_loss: 0.9929, test_loss: 0.9535, test_f1: 0.5037
 epoch: 49, train_loss: 0.9989, test_loss: 0.9528, test_f1: 0.5088
 epoch: 50, train_loss: 0.9886, test_loss: 0.9493, test_f1: 0.5075
 epoch: 51, train_loss: 0.9924, test_loss: 0.9463, test_f1: 0.5081
 epoch: 52, train_loss: 0.9781, test_loss: 0.9436, test_f1: 0.5071
 epoch: 53, train_loss: 0.9809, test_loss: 0.9442, test_f1: 0.5045
 epoch: 54, train_loss: 0.9829, test_loss: 0.9441, test_f1: 0.5084
 epoch: 55, train_loss: 0.9851, test_loss: 0.9447, test_f1: 0.5080
 epoch: 56, train_loss: 0.9769, test_loss: 0.9407, test_f1: 0.5007
 epoch: 57, train_loss: 0.9819, test_loss: 0.9412, test_f1: 0.5100
 epoch: 58, train_loss: 0.9791, test_loss: 0.9387, test_f1: 0.5131
 epoch: 59, train_loss: 0.9789, test_loss: 0.9381, test_f1: 0.5151
 epoch: 60, train_loss: 0.9802, test_loss: 0.9366, test_f1: 0.5118
 epoch: 61, train_loss: 0.9835, test_loss: 0.9387, test_f1: 0.5119
 epoch: 62, train_loss: 0.9733, test_loss: 0.9349, test_f1: 0.5125
 epoch: 63, train_loss: 0.9661, test_loss: 0.9339, test_f1: 0.5121
 epoch: 64, train_loss: 0.9667, test_loss: 0.9329, test_f1: 0.5103
 epoch: 65, train_loss: 0.9658, test_loss: 0.9308, test_f1: 0.5138
 epoch: 66, train_loss: 0.9634, test_loss: 0.9295, test_f1: 0.5162
 epoch: 67, train_loss: 0.9614, test_loss: 0.9273, test_f1: 0.5165
 epoch: 68, train_loss: 0.9617, test_loss: 0.9282, test_f1: 0.5151
 epoch: 69, train_loss: 0.9587, test_loss: 0.9290, test_f1: 0.5115
 epoch: 70, train_loss: 0.9687, test_loss: 0.9284, test_f1: 0.5186
 epoch: 71, train_loss: 0.9664, test_loss: 0.9285, test_f1: 0.5184
 epoch: 72, train_loss: 0.9587, test_loss: 0.9245, test_f1: 0.5209
 epoch: 73, train_loss: 0.9609, test_loss: 0.9227, test_f1: 0.5194
 epoch: 74, train_loss: 0.9622, test_loss: 0.9234, test_f1: 0.5191
 epoch: 75, train_loss: 0.9521, test_loss: 0.9246, test_f1: 0.5207
 epoch: 76, train_loss: 0.9622, test_loss: 0.9223, test_f1: 0.5196
 epoch: 77, train_loss: 0.9493, test_loss: 0.9208, test_f1: 0.5169
 epoch: 78, train_loss: 0.9530, test_loss: 0.9197, test_f1: 0.5195
 epoch: 79, train_loss: 0.9498, test_loss: 0.9159, test_f1: 0.5228
 epoch: 80, train_loss: 0.9416, test_loss: 0.9169, test_f1: 0.5215
 epoch: 81, train_loss: 0.9440, test_loss: 0.9157, test_f1: 0.5196
 epoch: 82, train_loss: 0.9424, test_loss: 0.9159, test_f1: 0.5170
 epoch: 83, train_loss: 0.9465, test_loss: 0.9156, test_f1: 0.5172
 epoch: 84, train_loss: 0.9488, test_loss: 0.9133, test_f1: 0.5209
 epoch: 85, train_loss: 0.9431, test_loss: 0.9148, test_f1: 0.5175
 epoch: 86, train_loss: 0.9424, test_loss: 0.9134, test_f1: 0.5178
 epoch: 87, train_loss: 0.9464, test_loss: 0.9136, test_f1: 0.5215
 epoch: 88, train_loss: 0.9380, test_loss: 0.9110, test_f1: 0.5176
 epoch: 89, train_loss: 0.9367, test_loss: 0.9125, test_f1: 0.5185
 epoch: 90, train_loss: 0.9455, test_loss: 0.9126, test_f1: 0.5143
 epoch: 91, train_loss: 0.9342, test_loss: 0.9107, test_f1: 0.5206
 epoch: 92, train_loss: 0.9402, test_loss: 0.9110, test_f1: 0.5171
 epoch: 93, train_loss: 0.9343, test_loss: 0.9104, test_f1: 0.5210
 epoch: 94, train_loss: 0.9391, test_loss: 0.9133, test_f1: 0.5107
 epoch: 95, train_loss: 0.9327, test_loss: 0.9119, test_f1: 0.5213
 epoch: 96, train_loss: 0.9275, test_loss: 0.9124, test_f1: 0.5132
 epoch: 97, train_loss: 0.9341, test_loss: 0.9090, test_f1: 0.5196
 epoch: 98, train_loss: 0.9309, test_loss: 0.9059, test_f1: 0.5222
 epoch: 99, train_loss: 0.9234, test_loss: 0.9072, test_f1: 0.5230
##################ITERATION #7 ****************************************
 epoch: 0, train_loss: 1.3624, test_loss: 1.3363, test_f1: 0.2270
 epoch: 1, train_loss: 1.3116, test_loss: 1.3197, test_f1: 0.2270
 epoch: 2, train_loss: 1.2793, test_loss: 1.3103, test_f1: 0.2270
 epoch: 3, train_loss: 1.2722, test_loss: 1.2810, test_f1: 0.2270
 epoch: 4, train_loss: 1.2513, test_loss: 1.2404, test_f1: 0.2270
 epoch: 5, train_loss: 1.2347, test_loss: 1.2175, test_f1: 0.2439
 epoch: 6, train_loss: 1.2271, test_loss: 1.2056, test_f1: 0.2574
 epoch: 7, train_loss: 1.2201, test_loss: 1.1941, test_f1: 0.2744
 epoch: 8, train_loss: 1.2103, test_loss: 1.1834, test_f1: 0.3087
 epoch: 9, train_loss: 1.1962, test_loss: 1.1740, test_f1: 0.3370
 epoch: 10, train_loss: 1.1895, test_loss: 1.1654, test_f1: 0.3475
 epoch: 11, train_loss: 1.1826, test_loss: 1.1539, test_f1: 0.3692
 epoch: 12, train_loss: 1.1790, test_loss: 1.1449, test_f1: 0.3771
 epoch: 13, train_loss: 1.1770, test_loss: 1.1368, test_f1: 0.3952
 epoch: 14, train_loss: 1.1587, test_loss: 1.1281, test_f1: 0.4157
 epoch: 15, train_loss: 1.1533, test_loss: 1.1194, test_f1: 0.4338
 epoch: 16, train_loss: 1.1461, test_loss: 1.1108, test_f1: 0.4322
 epoch: 17, train_loss: 1.1319, test_loss: 1.1011, test_f1: 0.4307
 epoch: 18, train_loss: 1.1240, test_loss: 1.0917, test_f1: 0.4365
 epoch: 19, train_loss: 1.1153, test_loss: 1.0839, test_f1: 0.4387
 epoch: 20, train_loss: 1.1134, test_loss: 1.0755, test_f1: 0.4394
 epoch: 21, train_loss: 1.1031, test_loss: 1.0687, test_f1: 0.4447
 epoch: 22, train_loss: 1.0951, test_loss: 1.0615, test_f1: 0.4464
 epoch: 23, train_loss: 1.0826, test_loss: 1.0537, test_f1: 0.4502
 epoch: 24, train_loss: 1.0852, test_loss: 1.0455, test_f1: 0.4561
 epoch: 25, train_loss: 1.0819, test_loss: 1.0395, test_f1: 0.4662
 epoch: 26, train_loss: 1.0712, test_loss: 1.0320, test_f1: 0.4647
 epoch: 27, train_loss: 1.0678, test_loss: 1.0270, test_f1: 0.4681
 epoch: 28, train_loss: 1.0575, test_loss: 1.0204, test_f1: 0.4710
 epoch: 29, train_loss: 1.0560, test_loss: 1.0148, test_f1: 0.4694
 epoch: 30, train_loss: 1.0463, test_loss: 1.0112, test_f1: 0.4694
 epoch: 31, train_loss: 1.0493, test_loss: 1.0052, test_f1: 0.4721
 epoch: 32, train_loss: 1.0390, test_loss: 1.0015, test_f1: 0.4748
 epoch: 33, train_loss: 1.0306, test_loss: 0.9967, test_f1: 0.4738
 epoch: 34, train_loss: 1.0246, test_loss: 0.9940, test_f1: 0.4780
 epoch: 35, train_loss: 1.0251, test_loss: 0.9914, test_f1: 0.4783
 epoch: 36, train_loss: 1.0121, test_loss: 0.9906, test_f1: 0.4810
 epoch: 37, train_loss: 1.0131, test_loss: 0.9892, test_f1: 0.4787
 epoch: 38, train_loss: 1.0080, test_loss: 0.9838, test_f1: 0.4787
 epoch: 39, train_loss: 1.0010, test_loss: 0.9781, test_f1: 0.4806
 epoch: 40, train_loss: 1.0061, test_loss: 0.9775, test_f1: 0.4783
 epoch: 41, train_loss: 0.9904, test_loss: 0.9796, test_f1: 0.4743
 epoch: 42, train_loss: 1.0002, test_loss: 0.9773, test_f1: 0.4785
 epoch: 43, train_loss: 0.9869, test_loss: 0.9784, test_f1: 0.4801
 epoch: 44, train_loss: 0.9844, test_loss: 0.9797, test_f1: 0.4804
 epoch: 45, train_loss: 0.9802, test_loss: 0.9760, test_f1: 0.4877
 epoch: 46, train_loss: 0.9817, test_loss: 0.9710, test_f1: 0.4917
 epoch: 47, train_loss: 0.9771, test_loss: 0.9735, test_f1: 0.4890
 epoch: 48, train_loss: 0.9734, test_loss: 0.9682, test_f1: 0.4941
 epoch: 49, train_loss: 0.9732, test_loss: 0.9602, test_f1: 0.4983
 epoch: 50, train_loss: 0.9653, test_loss: 0.9635, test_f1: 0.5000
 epoch: 51, train_loss: 0.9590, test_loss: 0.9640, test_f1: 0.5032
 epoch: 52, train_loss: 0.9702, test_loss: 0.9689, test_f1: 0.4988
 epoch: 53, train_loss: 0.9699, test_loss: 0.9720, test_f1: 0.4982
 epoch: 54, train_loss: 0.9630, test_loss: 0.9711, test_f1: 0.4966
 epoch: 55, train_loss: 0.9592, test_loss: 0.9706, test_f1: 0.5001
 epoch: 56, train_loss: 0.9557, test_loss: 0.9660, test_f1: 0.5039
 epoch: 57, train_loss: 0.9593, test_loss: 0.9646, test_f1: 0.5036
 epoch: 58, train_loss: 0.9489, test_loss: 0.9663, test_f1: 0.5020
 epoch: 59, train_loss: 0.9564, test_loss: 0.9670, test_f1: 0.5027
 epoch: 60, train_loss: 0.9576, test_loss: 0.9689, test_f1: 0.5036
 epoch: 61, train_loss: 0.9536, test_loss: 0.9670, test_f1: 0.5031
 epoch: 62, train_loss: 0.9537, test_loss: 0.9663, test_f1: 0.5036
 epoch: 63, train_loss: 0.9606, test_loss: 0.9645, test_f1: 0.5023
 epoch: 64, train_loss: 0.9600, test_loss: 0.9694, test_f1: 0.5055
 epoch: 65, train_loss: 0.9570, test_loss: 0.9707, test_f1: 0.5029
 epoch: 66, train_loss: 0.9504, test_loss: 0.9733, test_f1: 0.5046
 epoch: 67, train_loss: 0.9532, test_loss: 0.9684, test_f1: 0.5068
 epoch: 68, train_loss: 0.9470, test_loss: 0.9674, test_f1: 0.5074
 epoch: 69, train_loss: 0.9490, test_loss: 0.9672, test_f1: 0.5055
 epoch: 70, train_loss: 0.9434, test_loss: 0.9759, test_f1: 0.5049
 epoch: 71, train_loss: 0.9492, test_loss: 0.9699, test_f1: 0.5026
 epoch: 72, train_loss: 0.9415, test_loss: 0.9696, test_f1: 0.5049
 epoch: 73, train_loss: 0.9442, test_loss: 0.9714, test_f1: 0.5064
 epoch: 74, train_loss: 0.9441, test_loss: 0.9718, test_f1: 0.5085
 epoch: 75, train_loss: 0.9430, test_loss: 0.9677, test_f1: 0.5071
 epoch: 76, train_loss: 0.9348, test_loss: 0.9732, test_f1: 0.5099
 epoch: 77, train_loss: 0.9372, test_loss: 0.9727, test_f1: 0.5107
 epoch: 78, train_loss: 0.9345, test_loss: 0.9686, test_f1: 0.5047
 epoch: 79, train_loss: 0.9377, test_loss: 0.9677, test_f1: 0.5071
 epoch: 80, train_loss: 0.9325, test_loss: 0.9743, test_f1: 0.5022
 epoch: 81, train_loss: 0.9406, test_loss: 0.9720, test_f1: 0.5012
 epoch: 82, train_loss: 0.9384, test_loss: 0.9714, test_f1: 0.5097
 epoch: 83, train_loss: 0.9350, test_loss: 0.9710, test_f1: 0.5069
 epoch: 84, train_loss: 0.9346, test_loss: 0.9708, test_f1: 0.5097
 epoch: 85, train_loss: 0.9346, test_loss: 0.9725, test_f1: 0.5111
 epoch: 86, train_loss: 0.9337, test_loss: 0.9710, test_f1: 0.5090
 epoch: 87, train_loss: 0.9234, test_loss: 0.9743, test_f1: 0.5025
 epoch: 88, train_loss: 0.9216, test_loss: 0.9776, test_f1: 0.5108
 epoch: 89, train_loss: 0.9394, test_loss: 0.9719, test_f1: 0.5082
 epoch: 90, train_loss: 0.9334, test_loss: 0.9728, test_f1: 0.5108
 epoch: 91, train_loss: 0.9219, test_loss: 0.9725, test_f1: 0.5087
 epoch: 92, train_loss: 0.9317, test_loss: 0.9704, test_f1: 0.5076
 epoch: 93, train_loss: 0.9337, test_loss: 0.9775, test_f1: 0.5047
 epoch: 94, train_loss: 0.9266, test_loss: 0.9730, test_f1: 0.5117
 epoch: 95, train_loss: 0.9241, test_loss: 0.9789, test_f1: 0.5105
 epoch: 96, train_loss: 0.9218, test_loss: 0.9767, test_f1: 0.5120
 epoch: 97, train_loss: 0.9187, test_loss: 0.9772, test_f1: 0.5105
 epoch: 98, train_loss: 0.9158, test_loss: 0.9743, test_f1: 0.5094
 epoch: 99, train_loss: 0.9221, test_loss: 0.9690, test_f1: 0.5051
##################ITERATION #8 ****************************************
 epoch: 0, train_loss: 1.3471, test_loss: 1.3136, test_f1: 0.2270
 epoch: 1, train_loss: 1.2762, test_loss: 1.2962, test_f1: 0.2270
 epoch: 2, train_loss: 1.2504, test_loss: 1.2833, test_f1: 0.2270
 epoch: 3, train_loss: 1.2300, test_loss: 1.2540, test_f1: 0.2526
 epoch: 4, train_loss: 1.2206, test_loss: 1.2114, test_f1: 0.2611
 epoch: 5, train_loss: 1.2084, test_loss: 1.1708, test_f1: 0.3369
 epoch: 6, train_loss: 1.2027, test_loss: 1.1525, test_f1: 0.3567
 epoch: 7, train_loss: 1.1887, test_loss: 1.1380, test_f1: 0.3697
 epoch: 8, train_loss: 1.1768, test_loss: 1.1293, test_f1: 0.3868
 epoch: 9, train_loss: 1.1761, test_loss: 1.1208, test_f1: 0.3974
 epoch: 10, train_loss: 1.1623, test_loss: 1.1125, test_f1: 0.4099
 epoch: 11, train_loss: 1.1581, test_loss: 1.1050, test_f1: 0.4232
 epoch: 12, train_loss: 1.1499, test_loss: 1.0973, test_f1: 0.4285
 epoch: 13, train_loss: 1.1391, test_loss: 1.0925, test_f1: 0.4389
 epoch: 14, train_loss: 1.1324, test_loss: 1.0848, test_f1: 0.4352
 epoch: 15, train_loss: 1.1385, test_loss: 1.0791, test_f1: 0.4475
 epoch: 16, train_loss: 1.1271, test_loss: 1.0704, test_f1: 0.4551
 epoch: 17, train_loss: 1.1153, test_loss: 1.0649, test_f1: 0.4550
 epoch: 18, train_loss: 1.1080, test_loss: 1.0573, test_f1: 0.4576
 epoch: 19, train_loss: 1.0985, test_loss: 1.0506, test_f1: 0.4625
 epoch: 20, train_loss: 1.1006, test_loss: 1.0442, test_f1: 0.4659
 epoch: 21, train_loss: 1.0832, test_loss: 1.0383, test_f1: 0.4701
 epoch: 22, train_loss: 1.0867, test_loss: 1.0315, test_f1: 0.4740
 epoch: 23, train_loss: 1.0893, test_loss: 1.0278, test_f1: 0.4759
 epoch: 24, train_loss: 1.0750, test_loss: 1.0211, test_f1: 0.4823
 epoch: 25, train_loss: 1.0591, test_loss: 1.0148, test_f1: 0.4734
 epoch: 26, train_loss: 1.0647, test_loss: 1.0101, test_f1: 0.4765
 epoch: 27, train_loss: 1.0579, test_loss: 1.0062, test_f1: 0.4730
 epoch: 28, train_loss: 1.0533, test_loss: 1.0017, test_f1: 0.4802
 epoch: 29, train_loss: 1.0466, test_loss: 0.9955, test_f1: 0.4814
 epoch: 30, train_loss: 1.0411, test_loss: 0.9926, test_f1: 0.4839
 epoch: 31, train_loss: 1.0316, test_loss: 0.9887, test_f1: 0.4814
 epoch: 32, train_loss: 1.0352, test_loss: 0.9846, test_f1: 0.4840
 epoch: 33, train_loss: 1.0247, test_loss: 0.9797, test_f1: 0.4860
 epoch: 34, train_loss: 1.0216, test_loss: 0.9779, test_f1: 0.4855
 epoch: 35, train_loss: 1.0180, test_loss: 0.9722, test_f1: 0.4858
 epoch: 36, train_loss: 1.0099, test_loss: 0.9709, test_f1: 0.4794
 epoch: 37, train_loss: 1.0028, test_loss: 0.9694, test_f1: 0.4773
 epoch: 38, train_loss: 1.0033, test_loss: 0.9655, test_f1: 0.4828
 epoch: 39, train_loss: 1.0003, test_loss: 0.9618, test_f1: 0.4803
 epoch: 40, train_loss: 1.0011, test_loss: 0.9599, test_f1: 0.4847
 epoch: 41, train_loss: 0.9867, test_loss: 0.9603, test_f1: 0.4832
 epoch: 42, train_loss: 0.9882, test_loss: 0.9598, test_f1: 0.4809
 epoch: 43, train_loss: 0.9873, test_loss: 0.9593, test_f1: 0.4862
 epoch: 44, train_loss: 0.9884, test_loss: 0.9558, test_f1: 0.4813
 epoch: 45, train_loss: 0.9794, test_loss: 0.9560, test_f1: 0.4840
 epoch: 46, train_loss: 0.9880, test_loss: 0.9520, test_f1: 0.4811
 epoch: 47, train_loss: 0.9747, test_loss: 0.9525, test_f1: 0.4845
 epoch: 48, train_loss: 0.9684, test_loss: 0.9499, test_f1: 0.5026
 epoch: 49, train_loss: 0.9751, test_loss: 0.9523, test_f1: 0.4976
 epoch: 50, train_loss: 0.9642, test_loss: 0.9527, test_f1: 0.4970
 epoch: 51, train_loss: 0.9675, test_loss: 0.9548, test_f1: 0.4953
 epoch: 52, train_loss: 0.9625, test_loss: 0.9529, test_f1: 0.4968
 epoch: 53, train_loss: 0.9502, test_loss: 0.9497, test_f1: 0.4976
 epoch: 54, train_loss: 0.9612, test_loss: 0.9493, test_f1: 0.5007
 epoch: 55, train_loss: 0.9560, test_loss: 0.9469, test_f1: 0.4987
 epoch: 56, train_loss: 0.9570, test_loss: 0.9475, test_f1: 0.5039
 epoch: 57, train_loss: 0.9613, test_loss: 0.9483, test_f1: 0.4995
 epoch: 58, train_loss: 0.9530, test_loss: 0.9477, test_f1: 0.4988
 epoch: 59, train_loss: 0.9461, test_loss: 0.9484, test_f1: 0.4998
 epoch: 60, train_loss: 0.9498, test_loss: 0.9464, test_f1: 0.5017
 epoch: 61, train_loss: 0.9522, test_loss: 0.9445, test_f1: 0.5011
 epoch: 62, train_loss: 0.9431, test_loss: 0.9480, test_f1: 0.5013
 epoch: 63, train_loss: 0.9539, test_loss: 0.9467, test_f1: 0.5021
 epoch: 64, train_loss: 0.9445, test_loss: 0.9513, test_f1: 0.5006
 epoch: 65, train_loss: 0.9472, test_loss: 0.9471, test_f1: 0.4995
 epoch: 66, train_loss: 0.9442, test_loss: 0.9420, test_f1: 0.4968
 epoch: 67, train_loss: 0.9475, test_loss: 0.9401, test_f1: 0.4980
 epoch: 68, train_loss: 0.9429, test_loss: 0.9412, test_f1: 0.5034
 epoch: 69, train_loss: 0.9525, test_loss: 0.9408, test_f1: 0.5006
 epoch: 70, train_loss: 0.9376, test_loss: 0.9467, test_f1: 0.5032
 epoch: 71, train_loss: 0.9375, test_loss: 0.9469, test_f1: 0.5006
 epoch: 72, train_loss: 0.9436, test_loss: 0.9445, test_f1: 0.5071
 epoch: 73, train_loss: 0.9321, test_loss: 0.9477, test_f1: 0.5041
 epoch: 74, train_loss: 0.9305, test_loss: 0.9378, test_f1: 0.5100
 epoch: 75, train_loss: 0.9338, test_loss: 0.9377, test_f1: 0.5037
 epoch: 76, train_loss: 0.9266, test_loss: 0.9350, test_f1: 0.5034
 epoch: 77, train_loss: 0.9307, test_loss: 0.9392, test_f1: 0.5073
 epoch: 78, train_loss: 0.9322, test_loss: 0.9383, test_f1: 0.5083
 epoch: 79, train_loss: 0.9336, test_loss: 0.9416, test_f1: 0.5096
 epoch: 80, train_loss: 0.9319, test_loss: 0.9398, test_f1: 0.5129
 epoch: 81, train_loss: 0.9282, test_loss: 0.9373, test_f1: 0.5112
 epoch: 82, train_loss: 0.9334, test_loss: 0.9425, test_f1: 0.5104
 epoch: 83, train_loss: 0.9209, test_loss: 0.9424, test_f1: 0.5154
 epoch: 84, train_loss: 0.9247, test_loss: 0.9374, test_f1: 0.5095
 epoch: 85, train_loss: 0.9273, test_loss: 0.9383, test_f1: 0.5058
 epoch: 86, train_loss: 0.9205, test_loss: 0.9384, test_f1: 0.5086
 epoch: 87, train_loss: 0.9273, test_loss: 0.9364, test_f1: 0.5106
 epoch: 88, train_loss: 0.9205, test_loss: 0.9366, test_f1: 0.5134
 epoch: 89, train_loss: 0.9230, test_loss: 0.9411, test_f1: 0.5159
 epoch: 90, train_loss: 0.9171, test_loss: 0.9349, test_f1: 0.5161
 epoch: 91, train_loss: 0.9164, test_loss: 0.9369, test_f1: 0.5170
 epoch: 92, train_loss: 0.9206, test_loss: 0.9414, test_f1: 0.5137
 epoch: 93, train_loss: 0.9149, test_loss: 0.9393, test_f1: 0.5165
 epoch: 94, train_loss: 0.9243, test_loss: 0.9398, test_f1: 0.5135
 epoch: 95, train_loss: 0.9164, test_loss: 0.9428, test_f1: 0.5096
 epoch: 96, train_loss: 0.9161, test_loss: 0.9432, test_f1: 0.5133
 epoch: 97, train_loss: 0.9107, test_loss: 0.9413, test_f1: 0.5121
 epoch: 98, train_loss: 0.9122, test_loss: 0.9385, test_f1: 0.5116
 epoch: 99, train_loss: 0.9126, test_loss: 0.9408, test_f1: 0.5106
##################ITERATION #9 ****************************************
 epoch: 0, train_loss: 1.4144, test_loss: 1.3787, test_f1: 0.2270
 epoch: 1, train_loss: 1.3368, test_loss: 1.3651, test_f1: 0.2270
 epoch: 2, train_loss: 1.2914, test_loss: 1.3371, test_f1: 0.2270
 epoch: 3, train_loss: 1.2666, test_loss: 1.2758, test_f1: 0.2569
 epoch: 4, train_loss: 1.2512, test_loss: 1.2199, test_f1: 0.3239
 epoch: 5, train_loss: 1.2315, test_loss: 1.1907, test_f1: 0.3464
 epoch: 6, train_loss: 1.2179, test_loss: 1.1741, test_f1: 0.3533
 epoch: 7, train_loss: 1.2059, test_loss: 1.1630, test_f1: 0.3534
 epoch: 8, train_loss: 1.1914, test_loss: 1.1520, test_f1: 0.3654
 epoch: 9, train_loss: 1.1843, test_loss: 1.1423, test_f1: 0.3590
 epoch: 10, train_loss: 1.1733, test_loss: 1.1320, test_f1: 0.3763
 epoch: 11, train_loss: 1.1636, test_loss: 1.1228, test_f1: 0.3933
 epoch: 12, train_loss: 1.1530, test_loss: 1.1121, test_f1: 0.4058
 epoch: 13, train_loss: 1.1525, test_loss: 1.1013, test_f1: 0.4245
 epoch: 14, train_loss: 1.1420, test_loss: 1.0931, test_f1: 0.4299
 epoch: 15, train_loss: 1.1297, test_loss: 1.0835, test_f1: 0.4330
 epoch: 16, train_loss: 1.1219, test_loss: 1.0769, test_f1: 0.4342
 epoch: 17, train_loss: 1.1113, test_loss: 1.0673, test_f1: 0.4351
 epoch: 18, train_loss: 1.1086, test_loss: 1.0612, test_f1: 0.4428
 epoch: 19, train_loss: 1.1030, test_loss: 1.0535, test_f1: 0.4463
 epoch: 20, train_loss: 1.0938, test_loss: 1.0462, test_f1: 0.4485
 epoch: 21, train_loss: 1.0904, test_loss: 1.0386, test_f1: 0.4502
 epoch: 22, train_loss: 1.0758, test_loss: 1.0342, test_f1: 0.4457
 epoch: 23, train_loss: 1.0723, test_loss: 1.0309, test_f1: 0.4417
 epoch: 24, train_loss: 1.0612, test_loss: 1.0254, test_f1: 0.4383
 epoch: 25, train_loss: 1.0622, test_loss: 1.0185, test_f1: 0.4541
 epoch: 26, train_loss: 1.0570, test_loss: 1.0187, test_f1: 0.4506
 epoch: 27, train_loss: 1.0528, test_loss: 1.0123, test_f1: 0.4599
 epoch: 28, train_loss: 1.0519, test_loss: 1.0093, test_f1: 0.4679
 epoch: 29, train_loss: 1.0360, test_loss: 1.0056, test_f1: 0.4640
 epoch: 30, train_loss: 1.0270, test_loss: 1.0023, test_f1: 0.4737
 epoch: 31, train_loss: 1.0262, test_loss: 0.9984, test_f1: 0.4734
 epoch: 32, train_loss: 1.0229, test_loss: 0.9970, test_f1: 0.4558
 epoch: 33, train_loss: 1.0277, test_loss: 0.9937, test_f1: 0.4664
 epoch: 34, train_loss: 1.0131, test_loss: 0.9936, test_f1: 0.4847
 epoch: 35, train_loss: 1.0098, test_loss: 0.9873, test_f1: 0.4828
 epoch: 36, train_loss: 1.0062, test_loss: 0.9879, test_f1: 0.4766
 epoch: 37, train_loss: 1.0045, test_loss: 0.9867, test_f1: 0.4707
 epoch: 38, train_loss: 1.0049, test_loss: 0.9808, test_f1: 0.4868
 epoch: 39, train_loss: 0.9999, test_loss: 0.9809, test_f1: 0.4826
 epoch: 40, train_loss: 0.9962, test_loss: 0.9812, test_f1: 0.4858
 epoch: 41, train_loss: 0.9908, test_loss: 0.9790, test_f1: 0.4765
 epoch: 42, train_loss: 0.9854, test_loss: 0.9758, test_f1: 0.4864
 epoch: 43, train_loss: 0.9906, test_loss: 0.9722, test_f1: 0.4808
 epoch: 44, train_loss: 0.9855, test_loss: 0.9721, test_f1: 0.4883
 epoch: 45, train_loss: 0.9714, test_loss: 0.9684, test_f1: 0.4851
 epoch: 46, train_loss: 0.9858, test_loss: 0.9713, test_f1: 0.4911
 epoch: 47, train_loss: 0.9687, test_loss: 0.9721, test_f1: 0.4931
 epoch: 48, train_loss: 0.9689, test_loss: 0.9692, test_f1: 0.4827
 epoch: 49, train_loss: 0.9702, test_loss: 0.9666, test_f1: 0.4822
 epoch: 50, train_loss: 0.9580, test_loss: 0.9667, test_f1: 0.4879
 epoch: 51, train_loss: 0.9618, test_loss: 0.9647, test_f1: 0.4890
 epoch: 52, train_loss: 0.9625, test_loss: 0.9624, test_f1: 0.4829
 epoch: 53, train_loss: 0.9580, test_loss: 0.9602, test_f1: 0.4802
 epoch: 54, train_loss: 0.9577, test_loss: 0.9598, test_f1: 0.4811
 epoch: 55, train_loss: 0.9554, test_loss: 0.9590, test_f1: 0.4904
 epoch: 56, train_loss: 0.9555, test_loss: 0.9598, test_f1: 0.4897
 epoch: 57, train_loss: 0.9492, test_loss: 0.9574, test_f1: 0.4911
 epoch: 58, train_loss: 0.9496, test_loss: 0.9570, test_f1: 0.4935
 epoch: 59, train_loss: 0.9446, test_loss: 0.9599, test_f1: 0.4892
 epoch: 60, train_loss: 0.9443, test_loss: 0.9558, test_f1: 0.4905
 epoch: 61, train_loss: 0.9439, test_loss: 0.9550, test_f1: 0.4928
 epoch: 62, train_loss: 0.9525, test_loss: 0.9547, test_f1: 0.4970
 epoch: 63, train_loss: 0.9478, test_loss: 0.9527, test_f1: 0.4917
 epoch: 64, train_loss: 0.9438, test_loss: 0.9543, test_f1: 0.4888
 epoch: 65, train_loss: 0.9412, test_loss: 0.9547, test_f1: 0.4869
 epoch: 66, train_loss: 0.9356, test_loss: 0.9559, test_f1: 0.4855
 epoch: 67, train_loss: 0.9403, test_loss: 0.9522, test_f1: 0.4933
 epoch: 68, train_loss: 0.9334, test_loss: 0.9539, test_f1: 0.4928
 epoch: 69, train_loss: 0.9351, test_loss: 0.9533, test_f1: 0.4902
 epoch: 70, train_loss: 0.9368, test_loss: 0.9547, test_f1: 0.4826
 epoch: 71, train_loss: 0.9331, test_loss: 0.9531, test_f1: 0.4880
 epoch: 72, train_loss: 0.9288, test_loss: 0.9526, test_f1: 0.4906
 epoch: 73, train_loss: 0.9337, test_loss: 0.9537, test_f1: 0.4957
 epoch: 74, train_loss: 0.9273, test_loss: 0.9534, test_f1: 0.4897
 epoch: 75, train_loss: 0.9297, test_loss: 0.9552, test_f1: 0.4884
 epoch: 76, train_loss: 0.9320, test_loss: 0.9555, test_f1: 0.4877
 epoch: 77, train_loss: 0.9225, test_loss: 0.9542, test_f1: 0.4855
 epoch: 78, train_loss: 0.9322, test_loss: 0.9501, test_f1: 0.4922
 epoch: 79, train_loss: 0.9221, test_loss: 0.9510, test_f1: 0.4939
 epoch: 80, train_loss: 0.9234, test_loss: 0.9496, test_f1: 0.4941
 epoch: 81, train_loss: 0.9147, test_loss: 0.9487, test_f1: 0.5019
 epoch: 82, train_loss: 0.9204, test_loss: 0.9490, test_f1: 0.4877
 epoch: 83, train_loss: 0.9216, test_loss: 0.9517, test_f1: 0.4850
 epoch: 84, train_loss: 0.9210, test_loss: 0.9464, test_f1: 0.4861
 epoch: 85, train_loss: 0.9206, test_loss: 0.9504, test_f1: 0.4882
 epoch: 86, train_loss: 0.9175, test_loss: 0.9463, test_f1: 0.4928
 epoch: 87, train_loss: 0.9192, test_loss: 0.9454, test_f1: 0.4864
 epoch: 88, train_loss: 0.9163, test_loss: 0.9446, test_f1: 0.4885
 epoch: 89, train_loss: 0.9093, test_loss: 0.9429, test_f1: 0.4906
 epoch: 90, train_loss: 0.9132, test_loss: 0.9444, test_f1: 0.4898
 epoch: 91, train_loss: 0.9117, test_loss: 0.9433, test_f1: 0.4904
 epoch: 92, train_loss: 0.9036, test_loss: 0.9406, test_f1: 0.4902
 epoch: 93, train_loss: 0.9133, test_loss: 0.9427, test_f1: 0.4872
 epoch: 94, train_loss: 0.9035, test_loss: 0.9444, test_f1: 0.4885
 epoch: 95, train_loss: 0.9026, test_loss: 0.9448, test_f1: 0.4892
 epoch: 96, train_loss: 0.9186, test_loss: 0.9422, test_f1: 0.4938
 epoch: 97, train_loss: 0.9049, test_loss: 0.9421, test_f1: 0.4922
 epoch: 98, train_loss: 0.9088, test_loss: 0.9439, test_f1: 0.4922
 epoch: 99, train_loss: 0.9057, test_loss: 0.9408, test_f1: 0.4898

Training completed in 396.61 seconds
Best F1: 0.5230 at epoch 99
Mean F1 across iterations: 0.5073  0.0104
========================FINAL RESULTS================================
FEGIN weighted F1: 0.5230  0.0104
python main.py --data ltspice_examples --representation component_net --model FEGIN --layers 4 --hiddens 32 --batch_size 256 --lr 0.0001 --emb_size 128 --epochs 100 --save_appendix component_net_L4_H32_BS256_LR0.0001_E128 --no_val
-----



STDERR:
  File "main.py", line 370, in <module>
    main()
  File "main.py", line 254, in main
    dataset = dataset_class(
  File "/home/philip/projects/ltspice_examples_code_repo/Circuit-Completion-Using-GNNs/component_classification_with_link_prediction_head/evaluation/FEGIN/kernel/circuit_datasets.py", line 15, in __init__
    self.data, self.slices = torch.load(self.processed_paths[0])
  File "/home/philip/.local/lib/python3.8/site-packages/torch/serialization.py", line 1040, in load
    warnings.warn(
  File "/usr/lib/python3.8/warnings.py", line 109, in _showwarnmsg
    sw(msg.message, msg.category, msg.filename, msg.lineno,
  File "main.py", line 47, in warn_with_traceback
    traceback.print_stack(file=log)
/home/philip/projects/ltspice_examples_code_repo/Circuit-Completion-Using-GNNs/component_classification_with_link_prediction_head/evaluation/FEGIN/kernel/circuit_datasets.py:15: FutureWarning: You are using `torch.load` with `weights_only=False` (the current default value), which uses the default pickle module implicitly. It is possible to construct malicious pickle data which will execute arbitrary code during unpickling (See https://github.com/pytorch/pytorch/blob/main/SECURITY.md#untrusted-models for more details). In a future release, the default value for `weights_only` will be flipped to `True`. This limits the functions that could be executed during unpickling. Arbitrary objects will no longer be allowed to be loaded via this mode unless they are explicitly allowlisted by the user via `torch.serialization.add_safe_globals`. We recommend you start setting `weights_only=True` for any use case where you don't have full control of the loaded file. Please open an issue on GitHub for any issues related to this experimental feature.
  self.data, self.slices = torch.load(self.processed_paths[0])
