STDOUT:
Results will be saved in /home/philip/projects/ltspice_examples_code_repo/Circuit-Completion-Using-GNNs/component_classification_with_link_prediction_head/evaluation/FEGIN/results/model_FEGIN_dataset_ltspice_demos
Command line input: python main.py --data ltspice_demos --representation component_pin --model FEGIN --layers 3 --hiddens 32 --batch_size 128 --lr 0.01 --emb_size 128 --epochs 100 --save_appendix component_pin_L3_H32_BS128_LR0.01_E128 --no_val
 is saved.
-----
ltspice_demos - FEGIN
Using 3 layers, 32 hidden units, h = 2
Loading component_pin representation dataset
ENTERED
Training FEGIN on component_pin representation
Train: 1565, Test: 383
##################ITERATION #0 ****************************************
 epoch: 0, train_loss: 1.2592, test_loss: 1.3255, test_f1: 0.2404
 epoch: 1, train_loss: 1.1484, test_loss: 1.3896, test_f1: 0.2848
 epoch: 2, train_loss: 1.0718, test_loss: 1.2568, test_f1: 0.3415
 epoch: 3, train_loss: 0.9939, test_loss: 1.2146, test_f1: 0.3582
 epoch: 4, train_loss: 0.9717, test_loss: 1.2418, test_f1: 0.4371
 epoch: 5, train_loss: 0.8884, test_loss: 1.1814, test_f1: 0.3854
 epoch: 6, train_loss: 0.8662, test_loss: 1.0189, test_f1: 0.4529
 epoch: 7, train_loss: 0.8137, test_loss: 1.3867, test_f1: 0.3682
 epoch: 8, train_loss: 0.8023, test_loss: 1.1170, test_f1: 0.4625
 epoch: 9, train_loss: 0.7861, test_loss: 0.9236, test_f1: 0.6008
 epoch: 10, train_loss: 0.7736, test_loss: 0.9327, test_f1: 0.5764
 epoch: 11, train_loss: 0.7557, test_loss: 1.2001, test_f1: 0.4865
 epoch: 12, train_loss: 0.7888, test_loss: 0.9934, test_f1: 0.5521
 epoch: 13, train_loss: 0.8010, test_loss: 0.9729, test_f1: 0.6085
 epoch: 14, train_loss: 0.7632, test_loss: 1.5500, test_f1: 0.3886
 epoch: 15, train_loss: 0.7498, test_loss: 1.3573, test_f1: 0.5180
 epoch: 16, train_loss: 0.7566, test_loss: 1.0838, test_f1: 0.5915
 epoch: 17, train_loss: 0.7352, test_loss: 1.0850, test_f1: 0.5148
 epoch: 18, train_loss: 0.7414, test_loss: 1.0600, test_f1: 0.4885
 epoch: 19, train_loss: 0.7297, test_loss: 1.1747, test_f1: 0.5288
 epoch: 20, train_loss: 0.7517, test_loss: 0.9415, test_f1: 0.5747
 epoch: 21, train_loss: 0.7250, test_loss: 1.0793, test_f1: 0.5965
 epoch: 22, train_loss: 0.7088, test_loss: 1.1137, test_f1: 0.5980
 epoch: 23, train_loss: 0.7652, test_loss: 1.6571, test_f1: 0.4683
 epoch: 24, train_loss: 0.7547, test_loss: 1.3714, test_f1: 0.4847
 epoch: 25, train_loss: 0.7612, test_loss: 1.1114, test_f1: 0.5175
 epoch: 26, train_loss: 0.7226, test_loss: 1.0169, test_f1: 0.5905
 epoch: 27, train_loss: 0.7191, test_loss: 0.9381, test_f1: 0.5960
 epoch: 28, train_loss: 0.6952, test_loss: 1.0110, test_f1: 0.6295
 epoch: 29, train_loss: 0.6784, test_loss: 1.0427, test_f1: 0.6014
 epoch: 30, train_loss: 0.6510, test_loss: 1.4760, test_f1: 0.5776
 epoch: 31, train_loss: 0.6476, test_loss: 1.1763, test_f1: 0.5533
 epoch: 32, train_loss: 0.6619, test_loss: 1.0703, test_f1: 0.5839
 epoch: 33, train_loss: 0.6645, test_loss: 1.0694, test_f1: 0.6108
 epoch: 34, train_loss: 0.6469, test_loss: 1.1065, test_f1: 0.5421
 epoch: 35, train_loss: 0.6230, test_loss: 1.0825, test_f1: 0.5730
 epoch: 36, train_loss: 0.6328, test_loss: 1.0180, test_f1: 0.6186
 epoch: 37, train_loss: 0.6462, test_loss: 1.0765, test_f1: 0.6255
 epoch: 38, train_loss: 0.6413, test_loss: 1.0191, test_f1: 0.5830
 epoch: 39, train_loss: 0.6019, test_loss: 1.2856, test_f1: 0.5966
 epoch: 40, train_loss: 0.6068, test_loss: 1.1959, test_f1: 0.5569
 epoch: 41, train_loss: 0.6001, test_loss: 0.9703, test_f1: 0.6248
 epoch: 42, train_loss: 0.5824, test_loss: 1.1168, test_f1: 0.6032
 epoch: 43, train_loss: 0.6076, test_loss: 1.1041, test_f1: 0.5685
 epoch: 44, train_loss: 0.5949, test_loss: 0.9761, test_f1: 0.6485
 epoch: 45, train_loss: 0.5560, test_loss: 1.2375, test_f1: 0.5964
 epoch: 46, train_loss: 0.5628, test_loss: 1.1673, test_f1: 0.5523
 epoch: 47, train_loss: 0.5982, test_loss: 1.3178, test_f1: 0.5613
 epoch: 48, train_loss: 0.5670, test_loss: 1.5600, test_f1: 0.6247
 epoch: 49, train_loss: 0.5687, test_loss: 1.1818, test_f1: 0.5667
 epoch: 50, train_loss: 0.5702, test_loss: 1.5963, test_f1: 0.5582
 epoch: 51, train_loss: 0.5724, test_loss: 1.1907, test_f1: 0.6410
 epoch: 52, train_loss: 0.5092, test_loss: 1.2716, test_f1: 0.6027
 epoch: 53, train_loss: 0.5245, test_loss: 1.2232, test_f1: 0.6353
 epoch: 54, train_loss: 0.5089, test_loss: 1.2662, test_f1: 0.5929
 epoch: 55, train_loss: 0.5114, test_loss: 1.1251, test_f1: 0.6180
 epoch: 56, train_loss: 0.5040, test_loss: 1.3550, test_f1: 0.6014
 epoch: 57, train_loss: 0.4765, test_loss: 1.2657, test_f1: 0.6141
 epoch: 58, train_loss: 0.4628, test_loss: 1.1879, test_f1: 0.6218
 epoch: 59, train_loss: 0.5008, test_loss: 1.1208, test_f1: 0.5955
 epoch: 60, train_loss: 0.4656, test_loss: 1.4384, test_f1: 0.6000
 epoch: 61, train_loss: 0.4876, test_loss: 1.0898, test_f1: 0.6168
 epoch: 62, train_loss: 0.4785, test_loss: 1.2214, test_f1: 0.6146
 epoch: 63, train_loss: 0.4514, test_loss: 1.3979, test_f1: 0.6027
 epoch: 64, train_loss: 0.4689, test_loss: 1.1906, test_f1: 0.6029
 epoch: 65, train_loss: 0.4589, test_loss: 1.2946, test_f1: 0.5877
 epoch: 66, train_loss: 0.4581, test_loss: 1.5125, test_f1: 0.6187
 epoch: 67, train_loss: 0.4664, test_loss: 1.1698, test_f1: 0.6219
 epoch: 68, train_loss: 0.4505, test_loss: 1.2251, test_f1: 0.6279
 epoch: 69, train_loss: 0.4613, test_loss: 1.1233, test_f1: 0.6542
 epoch: 70, train_loss: 0.4371, test_loss: 1.3680, test_f1: 0.6328
 epoch: 71, train_loss: 0.4308, test_loss: 1.2229, test_f1: 0.6123
 epoch: 72, train_loss: 0.4133, test_loss: 1.3020, test_f1: 0.6172
 epoch: 73, train_loss: 0.3966, test_loss: 1.4773, test_f1: 0.6213
 epoch: 74, train_loss: 0.3997, test_loss: 1.4857, test_f1: 0.6180
 epoch: 75, train_loss: 0.4033, test_loss: 1.3835, test_f1: 0.6006
 epoch: 76, train_loss: 0.4177, test_loss: 1.6163, test_f1: 0.6242
 epoch: 77, train_loss: 0.4040, test_loss: 1.3284, test_f1: 0.6384
 epoch: 78, train_loss: 0.3852, test_loss: 1.3208, test_f1: 0.6308
 epoch: 79, train_loss: 0.4119, test_loss: 1.3268, test_f1: 0.6037
 epoch: 80, train_loss: 0.4167, test_loss: 1.3466, test_f1: 0.6451
 epoch: 81, train_loss: 0.3781, test_loss: 1.2935, test_f1: 0.6249
 epoch: 82, train_loss: 0.4078, test_loss: 1.2791, test_f1: 0.6439
 epoch: 83, train_loss: 0.4041, test_loss: 1.2593, test_f1: 0.6154
 epoch: 84, train_loss: 0.4189, test_loss: 1.4907, test_f1: 0.6405
 epoch: 85, train_loss: 0.3838, test_loss: 1.5474, test_f1: 0.5903
 epoch: 86, train_loss: 0.3868, test_loss: 1.4602, test_f1: 0.6165
 epoch: 87, train_loss: 0.3928, test_loss: 1.5144, test_f1: 0.5848
 epoch: 88, train_loss: 0.3964, test_loss: 1.5440, test_f1: 0.6317
 epoch: 89, train_loss: 0.3977, test_loss: 1.5719, test_f1: 0.5713
 epoch: 90, train_loss: 0.3656, test_loss: 1.5038, test_f1: 0.6014
 epoch: 91, train_loss: 0.3605, test_loss: 1.7052, test_f1: 0.6053
 epoch: 92, train_loss: 0.3909, test_loss: 1.6082, test_f1: 0.6145
 epoch: 93, train_loss: 0.4179, test_loss: 1.4843, test_f1: 0.5735
 epoch: 94, train_loss: 0.3849, test_loss: 1.6183, test_f1: 0.6228
 epoch: 95, train_loss: 0.3952, test_loss: 1.5038, test_f1: 0.6042
 epoch: 96, train_loss: 0.3994, test_loss: 1.5348, test_f1: 0.5995
 epoch: 97, train_loss: 0.4051, test_loss: 1.5832, test_f1: 0.5813
 epoch: 98, train_loss: 0.3667, test_loss: 1.8466, test_f1: 0.5879
 epoch: 99, train_loss: 0.3310, test_loss: 1.6080, test_f1: 0.5881
##################ITERATION #1 ****************************************
 epoch: 0, train_loss: 1.0945, test_loss: 1.4634, test_f1: 0.2468
 epoch: 1, train_loss: 0.9506, test_loss: 1.5361, test_f1: 0.2714
 epoch: 2, train_loss: 0.8975, test_loss: 1.4871, test_f1: 0.2387
 epoch: 3, train_loss: 0.8544, test_loss: 1.4353, test_f1: 0.4150
 epoch: 4, train_loss: 0.8432, test_loss: 1.3846, test_f1: 0.4444
 epoch: 5, train_loss: 0.8351, test_loss: 1.2783, test_f1: 0.5310
 epoch: 6, train_loss: 0.8058, test_loss: 1.0709, test_f1: 0.5535
 epoch: 7, train_loss: 0.7951, test_loss: 1.0082, test_f1: 0.6039
 epoch: 8, train_loss: 0.7752, test_loss: 1.3143, test_f1: 0.4559
 epoch: 9, train_loss: 0.7697, test_loss: 1.0886, test_f1: 0.5631
 epoch: 10, train_loss: 0.7443, test_loss: 0.9860, test_f1: 0.6145
 epoch: 11, train_loss: 0.7789, test_loss: 1.0121, test_f1: 0.6213
 epoch: 12, train_loss: 0.7631, test_loss: 1.1674, test_f1: 0.5647
 epoch: 13, train_loss: 0.7427, test_loss: 0.9980, test_f1: 0.6047
 epoch: 14, train_loss: 0.7115, test_loss: 0.9535, test_f1: 0.5235
 epoch: 15, train_loss: 0.7217, test_loss: 1.2119, test_f1: 0.5480
 epoch: 16, train_loss: 0.7270, test_loss: 0.9810, test_f1: 0.5961
 epoch: 17, train_loss: 0.6963, test_loss: 1.0379, test_f1: 0.6059
 epoch: 18, train_loss: 0.6879, test_loss: 0.9423, test_f1: 0.6429
 epoch: 19, train_loss: 0.6591, test_loss: 1.0131, test_f1: 0.6436
 epoch: 20, train_loss: 0.6560, test_loss: 0.8912, test_f1: 0.6237
 epoch: 21, train_loss: 0.6921, test_loss: 1.2440, test_f1: 0.5313
 epoch: 22, train_loss: 0.6788, test_loss: 1.1487, test_f1: 0.5896
 epoch: 23, train_loss: 0.6787, test_loss: 0.9324, test_f1: 0.6641
 epoch: 24, train_loss: 0.7026, test_loss: 0.9609, test_f1: 0.5783
 epoch: 25, train_loss: 0.6493, test_loss: 1.2088, test_f1: 0.5727
 epoch: 26, train_loss: 0.6504, test_loss: 1.0664, test_f1: 0.6178
 epoch: 27, train_loss: 0.6441, test_loss: 0.9986, test_f1: 0.6172
 epoch: 28, train_loss: 0.6657, test_loss: 1.0189, test_f1: 0.5742
 epoch: 29, train_loss: 0.6290, test_loss: 0.9424, test_f1: 0.6234
 epoch: 30, train_loss: 0.6556, test_loss: 1.3442, test_f1: 0.6048
 epoch: 31, train_loss: 0.6183, test_loss: 1.2093, test_f1: 0.5329
 epoch: 32, train_loss: 0.5908, test_loss: 1.1182, test_f1: 0.6158
 epoch: 33, train_loss: 0.5792, test_loss: 0.9947, test_f1: 0.6045
 epoch: 34, train_loss: 0.6348, test_loss: 0.9852, test_f1: 0.5622
 epoch: 35, train_loss: 0.6670, test_loss: 1.0527, test_f1: 0.5555
 epoch: 36, train_loss: 0.6119, test_loss: 1.1632, test_f1: 0.5388
 epoch: 37, train_loss: 0.6034, test_loss: 1.2578, test_f1: 0.4924
 epoch: 38, train_loss: 0.6093, test_loss: 1.1837, test_f1: 0.5817
 epoch: 39, train_loss: 0.5880, test_loss: 2.0120, test_f1: 0.4333
 epoch: 40, train_loss: 0.6290, test_loss: 1.1088, test_f1: 0.5763
 epoch: 41, train_loss: 0.5916, test_loss: 1.3203, test_f1: 0.6070
 epoch: 42, train_loss: 0.5746, test_loss: 1.1219, test_f1: 0.6281
 epoch: 43, train_loss: 0.5520, test_loss: 1.1761, test_f1: 0.6258
 epoch: 44, train_loss: 0.5599, test_loss: 1.2009, test_f1: 0.5646
 epoch: 45, train_loss: 0.5992, test_loss: 0.9634, test_f1: 0.5776
 epoch: 46, train_loss: 0.5539, test_loss: 1.0725, test_f1: 0.6316
 epoch: 47, train_loss: 0.5804, test_loss: 1.3415, test_f1: 0.6133
 epoch: 48, train_loss: 0.5571, test_loss: 1.2255, test_f1: 0.5696
 epoch: 49, train_loss: 0.5520, test_loss: 1.1784, test_f1: 0.6420
 epoch: 50, train_loss: 0.5192, test_loss: 1.1955, test_f1: 0.6380
 epoch: 51, train_loss: 0.4864, test_loss: 1.2969, test_f1: 0.5732
 epoch: 52, train_loss: 0.4659, test_loss: 1.2440, test_f1: 0.6248
 epoch: 53, train_loss: 0.4655, test_loss: 1.3025, test_f1: 0.6107
 epoch: 54, train_loss: 0.4616, test_loss: 1.3413, test_f1: 0.6082
 epoch: 55, train_loss: 0.4601, test_loss: 1.2624, test_f1: 0.5953
 epoch: 56, train_loss: 0.4857, test_loss: 1.2988, test_f1: 0.6276
 epoch: 57, train_loss: 0.4507, test_loss: 1.2524, test_f1: 0.6298
 epoch: 58, train_loss: 0.4325, test_loss: 1.2291, test_f1: 0.6523
 epoch: 59, train_loss: 0.4111, test_loss: 1.4355, test_f1: 0.6327
 epoch: 60, train_loss: 0.3964, test_loss: 1.3553, test_f1: 0.6133
 epoch: 61, train_loss: 0.3873, test_loss: 1.4091, test_f1: 0.6426
 epoch: 62, train_loss: 0.4127, test_loss: 1.4259, test_f1: 0.6160
 epoch: 63, train_loss: 0.4042, test_loss: 1.2970, test_f1: 0.6009
 epoch: 64, train_loss: 0.3871, test_loss: 1.4818, test_f1: 0.6222
 epoch: 65, train_loss: 0.3672, test_loss: 1.4640, test_f1: 0.6561
 epoch: 66, train_loss: 0.3794, test_loss: 1.5239, test_f1: 0.5951
 epoch: 67, train_loss: 0.3760, test_loss: 1.3753, test_f1: 0.6345
 epoch: 68, train_loss: 0.3860, test_loss: 1.5321, test_f1: 0.6060
 epoch: 69, train_loss: 0.3741, test_loss: 1.5158, test_f1: 0.6702
 epoch: 70, train_loss: 0.3675, test_loss: 1.5819, test_f1: 0.6466
 epoch: 71, train_loss: 0.3579, test_loss: 1.6078, test_f1: 0.6362
 epoch: 72, train_loss: 0.3644, test_loss: 1.9535, test_f1: 0.5991
 epoch: 73, train_loss: 0.3732, test_loss: 1.7751, test_f1: 0.6409
 epoch: 74, train_loss: 0.4000, test_loss: 1.7371, test_f1: 0.6003
 epoch: 75, train_loss: 0.3822, test_loss: 1.6694, test_f1: 0.6064
 epoch: 76, train_loss: 0.3588, test_loss: 1.5234, test_f1: 0.6603
 epoch: 77, train_loss: 0.3622, test_loss: 1.6383, test_f1: 0.6026
 epoch: 78, train_loss: 0.3379, test_loss: 1.6421, test_f1: 0.6541
 epoch: 79, train_loss: 0.3634, test_loss: 1.5243, test_f1: 0.6414
 epoch: 80, train_loss: 0.3725, test_loss: 1.5144, test_f1: 0.6243
 epoch: 81, train_loss: 0.3823, test_loss: 1.7284, test_f1: 0.5832
 epoch: 82, train_loss: 0.3560, test_loss: 1.5893, test_f1: 0.6055
 epoch: 83, train_loss: 0.3464, test_loss: 1.4234, test_f1: 0.6342
 epoch: 84, train_loss: 0.3543, test_loss: 1.5640, test_f1: 0.6559
 epoch: 85, train_loss: 0.3859, test_loss: 1.7354, test_f1: 0.6041
 epoch: 86, train_loss: 0.3643, test_loss: 1.3958, test_f1: 0.6799
 epoch: 87, train_loss: 0.4441, test_loss: 1.5316, test_f1: 0.6238
 epoch: 88, train_loss: 0.4071, test_loss: 1.6891, test_f1: 0.5741
 epoch: 89, train_loss: 0.3644, test_loss: 1.6220, test_f1: 0.6098
 epoch: 90, train_loss: 0.3220, test_loss: 1.7606, test_f1: 0.6405
 epoch: 91, train_loss: 0.3350, test_loss: 1.9700, test_f1: 0.6205
 epoch: 92, train_loss: 0.3205, test_loss: 1.8583, test_f1: 0.6370
 epoch: 93, train_loss: 0.3132, test_loss: 1.9023, test_f1: 0.5988
 epoch: 94, train_loss: 0.3387, test_loss: 1.7798, test_f1: 0.6385
 epoch: 95, train_loss: 0.3080, test_loss: 1.9189, test_f1: 0.6080
 epoch: 96, train_loss: 0.3073, test_loss: 1.7282, test_f1: 0.6204
 epoch: 97, train_loss: 0.3066, test_loss: 1.9906, test_f1: 0.6303
 epoch: 98, train_loss: 0.3158, test_loss: 1.9758, test_f1: 0.6160
 epoch: 99, train_loss: 0.3240, test_loss: 1.7361, test_f1: 0.6501
##################ITERATION #2 ****************************************
 epoch: 0, train_loss: 1.1973, test_loss: 1.3246, test_f1: 0.3362
 epoch: 1, train_loss: 1.0063, test_loss: 1.2057, test_f1: 0.4560
 epoch: 2, train_loss: 0.9117, test_loss: 1.1344, test_f1: 0.4371
 epoch: 3, train_loss: 0.8532, test_loss: 1.1776, test_f1: 0.4475
 epoch: 4, train_loss: 0.8471, test_loss: 0.9888, test_f1: 0.5571
 epoch: 5, train_loss: 0.8239, test_loss: 1.0379, test_f1: 0.5429
 epoch: 6, train_loss: 0.8193, test_loss: 0.9325, test_f1: 0.5280
 epoch: 7, train_loss: 0.7931, test_loss: 0.9803, test_f1: 0.5397
 epoch: 8, train_loss: 0.7794, test_loss: 0.9468, test_f1: 0.5734
 epoch: 9, train_loss: 0.7887, test_loss: 1.1948, test_f1: 0.4924
 epoch: 10, train_loss: 0.7653, test_loss: 0.9721, test_f1: 0.5862
 epoch: 11, train_loss: 0.7778, test_loss: 1.2998, test_f1: 0.4511
 epoch: 12, train_loss: 0.7599, test_loss: 1.0709, test_f1: 0.5527
 epoch: 13, train_loss: 0.7542, test_loss: 0.9742, test_f1: 0.5568
 epoch: 14, train_loss: 0.7380, test_loss: 0.9948, test_f1: 0.5706
 epoch: 15, train_loss: 0.7080, test_loss: 1.1913, test_f1: 0.5414
 epoch: 16, train_loss: 0.7286, test_loss: 1.0284, test_f1: 0.5686
 epoch: 17, train_loss: 0.7076, test_loss: 1.0519, test_f1: 0.5795
 epoch: 18, train_loss: 0.7334, test_loss: 1.0733, test_f1: 0.5985
 epoch: 19, train_loss: 0.7021, test_loss: 1.1766, test_f1: 0.5308
 epoch: 20, train_loss: 0.6890, test_loss: 1.2598, test_f1: 0.5603
 epoch: 21, train_loss: 0.6818, test_loss: 1.0231, test_f1: 0.5535
 epoch: 22, train_loss: 0.6798, test_loss: 1.0262, test_f1: 0.5991
 epoch: 23, train_loss: 0.6758, test_loss: 1.0171, test_f1: 0.6005
 epoch: 24, train_loss: 0.6647, test_loss: 0.9764, test_f1: 0.6108
 epoch: 25, train_loss: 0.6983, test_loss: 1.1570, test_f1: 0.4909
 epoch: 26, train_loss: 0.6821, test_loss: 1.5924, test_f1: 0.4681
 epoch: 27, train_loss: 0.6752, test_loss: 1.0117, test_f1: 0.6349
 epoch: 28, train_loss: 0.6534, test_loss: 0.9650, test_f1: 0.6254
 epoch: 29, train_loss: 0.6527, test_loss: 1.0363, test_f1: 0.5739
 epoch: 30, train_loss: 0.6322, test_loss: 1.0731, test_f1: 0.5949
 epoch: 31, train_loss: 0.6477, test_loss: 1.0217, test_f1: 0.6005
 epoch: 32, train_loss: 0.6580, test_loss: 1.0449, test_f1: 0.6273
 epoch: 33, train_loss: 0.6400, test_loss: 1.0542, test_f1: 0.6025
 epoch: 34, train_loss: 0.6626, test_loss: 0.9606, test_f1: 0.6470
 epoch: 35, train_loss: 0.6342, test_loss: 1.0383, test_f1: 0.5863
 epoch: 36, train_loss: 0.6139, test_loss: 1.0821, test_f1: 0.5951
 epoch: 37, train_loss: 0.6213, test_loss: 1.0459, test_f1: 0.5879
 epoch: 38, train_loss: 0.6272, test_loss: 1.0932, test_f1: 0.5805
 epoch: 39, train_loss: 0.6541, test_loss: 0.9576, test_f1: 0.6324
 epoch: 40, train_loss: 0.6256, test_loss: 1.1608, test_f1: 0.5696
 epoch: 41, train_loss: 0.6143, test_loss: 0.9600, test_f1: 0.6175
 epoch: 42, train_loss: 0.6146, test_loss: 1.2032, test_f1: 0.5278
 epoch: 43, train_loss: 0.8286, test_loss: 1.2803, test_f1: 0.5050
 epoch: 44, train_loss: 0.7673, test_loss: 1.1047, test_f1: 0.5227
 epoch: 45, train_loss: 0.6983, test_loss: 1.0484, test_f1: 0.5840
 epoch: 46, train_loss: 0.6731, test_loss: 1.0247, test_f1: 0.6020
 epoch: 47, train_loss: 0.6359, test_loss: 1.1396, test_f1: 0.5295
 epoch: 48, train_loss: 0.6335, test_loss: 1.0965, test_f1: 0.5444
 epoch: 49, train_loss: 0.6205, test_loss: 1.0225, test_f1: 0.6298
 epoch: 50, train_loss: 0.5959, test_loss: 1.3049, test_f1: 0.6116
 epoch: 51, train_loss: 0.6105, test_loss: 0.9668, test_f1: 0.6805
 epoch: 52, train_loss: 0.5785, test_loss: 1.1247, test_f1: 0.6446
 epoch: 53, train_loss: 0.5574, test_loss: 0.9979, test_f1: 0.6178
 epoch: 54, train_loss: 0.5341, test_loss: 1.0483, test_f1: 0.6638
 epoch: 55, train_loss: 0.5481, test_loss: 0.9944, test_f1: 0.6566
 epoch: 56, train_loss: 0.5512, test_loss: 1.1157, test_f1: 0.5817
 epoch: 57, train_loss: 0.5273, test_loss: 1.0482, test_f1: 0.6350
 epoch: 58, train_loss: 0.5291, test_loss: 1.0894, test_f1: 0.6399
 epoch: 59, train_loss: 0.5288, test_loss: 1.1203, test_f1: 0.6545
 epoch: 60, train_loss: 0.5366, test_loss: 1.1995, test_f1: 0.5314
 epoch: 61, train_loss: 0.5136, test_loss: 1.0962, test_f1: 0.6578
 epoch: 62, train_loss: 0.5100, test_loss: 1.0622, test_f1: 0.6498
 epoch: 63, train_loss: 0.5035, test_loss: 1.1035, test_f1: 0.6383
 epoch: 64, train_loss: 0.5283, test_loss: 1.1446, test_f1: 0.5980
 epoch: 65, train_loss: 0.4906, test_loss: 1.1357, test_f1: 0.6214
 epoch: 66, train_loss: 0.4989, test_loss: 1.1682, test_f1: 0.6038
 epoch: 67, train_loss: 0.4731, test_loss: 1.1722, test_f1: 0.6674
 epoch: 68, train_loss: 0.4800, test_loss: 1.1120, test_f1: 0.6401
 epoch: 69, train_loss: 0.4503, test_loss: 1.1893, test_f1: 0.6294
 epoch: 70, train_loss: 0.4638, test_loss: 1.0837, test_f1: 0.6562
 epoch: 71, train_loss: 0.4359, test_loss: 1.3049, test_f1: 0.6038
 epoch: 72, train_loss: 0.4711, test_loss: 1.1822, test_f1: 0.6145
 epoch: 73, train_loss: 0.4845, test_loss: 1.0766, test_f1: 0.6378
 epoch: 74, train_loss: 0.4380, test_loss: 1.1549, test_f1: 0.6390
 epoch: 75, train_loss: 0.4680, test_loss: 1.0903, test_f1: 0.6702
 epoch: 76, train_loss: 0.4933, test_loss: 1.1281, test_f1: 0.6602
 epoch: 77, train_loss: 0.4798, test_loss: 1.1660, test_f1: 0.6353
 epoch: 78, train_loss: 0.4279, test_loss: 1.4051, test_f1: 0.5669
 epoch: 79, train_loss: 0.4453, test_loss: 1.2552, test_f1: 0.6297
 epoch: 80, train_loss: 0.4509, test_loss: 1.3208, test_f1: 0.6124
 epoch: 81, train_loss: 0.4494, test_loss: 1.1517, test_f1: 0.6551
 epoch: 82, train_loss: 0.4445, test_loss: 1.2725, test_f1: 0.6284
 epoch: 83, train_loss: 0.4221, test_loss: 1.1028, test_f1: 0.6884
 epoch: 84, train_loss: 0.4030, test_loss: 1.3310, test_f1: 0.6206
 epoch: 85, train_loss: 0.4076, test_loss: 1.2145, test_f1: 0.6207
 epoch: 86, train_loss: 0.4443, test_loss: 1.2580, test_f1: 0.6318
 epoch: 87, train_loss: 0.4249, test_loss: 1.3827, test_f1: 0.6077
 epoch: 88, train_loss: 0.4317, test_loss: 1.1508, test_f1: 0.6798
 epoch: 89, train_loss: 0.4232, test_loss: 1.2351, test_f1: 0.6479
 epoch: 90, train_loss: 0.4106, test_loss: 1.2813, test_f1: 0.6432
 epoch: 91, train_loss: 0.4376, test_loss: 1.1933, test_f1: 0.6389
 epoch: 92, train_loss: 0.4061, test_loss: 1.2413, test_f1: 0.6306
 epoch: 93, train_loss: 0.3853, test_loss: 1.2927, test_f1: 0.6616
 epoch: 94, train_loss: 0.3767, test_loss: 1.3157, test_f1: 0.6425
 epoch: 95, train_loss: 0.4161, test_loss: 1.3808, test_f1: 0.5972
 epoch: 96, train_loss: 0.4112, test_loss: 1.3605, test_f1: 0.6381
 epoch: 97, train_loss: 0.3787, test_loss: 1.3663, test_f1: 0.6404
 epoch: 98, train_loss: 0.3731, test_loss: 1.4996, test_f1: 0.6204
 epoch: 99, train_loss: 0.4070, test_loss: 1.3254, test_f1: 0.6343
##################ITERATION #3 ****************************************
 epoch: 0, train_loss: 1.2417, test_loss: 1.5445, test_f1: 0.2244
 epoch: 1, train_loss: 1.0320, test_loss: 1.3360, test_f1: 0.3501
 epoch: 2, train_loss: 0.9769, test_loss: 1.2194, test_f1: 0.4635
 epoch: 3, train_loss: 0.9490, test_loss: 1.3332, test_f1: 0.4769
 epoch: 4, train_loss: 0.8984, test_loss: 1.0316, test_f1: 0.5382
 epoch: 5, train_loss: 0.9407, test_loss: 1.4276, test_f1: 0.4091
 epoch: 6, train_loss: 0.9160, test_loss: 1.0103, test_f1: 0.5516
 epoch: 7, train_loss: 0.8854, test_loss: 1.2833, test_f1: 0.5265
 epoch: 8, train_loss: 0.8657, test_loss: 1.3317, test_f1: 0.5403
 epoch: 9, train_loss: 0.8400, test_loss: 1.0141, test_f1: 0.5619
 epoch: 10, train_loss: 0.8418, test_loss: 1.5651, test_f1: 0.4799
 epoch: 11, train_loss: 0.8303, test_loss: 1.2269, test_f1: 0.4682
 epoch: 12, train_loss: 0.8013, test_loss: 1.0717, test_f1: 0.5650
 epoch: 13, train_loss: 0.8180, test_loss: 1.0673, test_f1: 0.5657
 epoch: 14, train_loss: 0.7851, test_loss: 1.0440, test_f1: 0.5718
 epoch: 15, train_loss: 0.7733, test_loss: 1.0508, test_f1: 0.5892
 epoch: 16, train_loss: 0.7615, test_loss: 1.2495, test_f1: 0.5919
 epoch: 17, train_loss: 0.7408, test_loss: 1.0019, test_f1: 0.5872
 epoch: 18, train_loss: 0.7405, test_loss: 1.1028, test_f1: 0.5816
 epoch: 19, train_loss: 0.7600, test_loss: 1.3763, test_f1: 0.5454
 epoch: 20, train_loss: 0.7550, test_loss: 1.3402, test_f1: 0.5243
 epoch: 21, train_loss: 0.7172, test_loss: 1.2435, test_f1: 0.5767
 epoch: 22, train_loss: 0.7218, test_loss: 1.3435, test_f1: 0.5145
 epoch: 23, train_loss: 0.7264, test_loss: 1.0377, test_f1: 0.5947
 epoch: 24, train_loss: 0.7568, test_loss: 1.6915, test_f1: 0.5763
 epoch: 25, train_loss: 0.7284, test_loss: 1.1732, test_f1: 0.5777
 epoch: 26, train_loss: 0.7267, test_loss: 1.0596, test_f1: 0.6105
 epoch: 27, train_loss: 0.7793, test_loss: 1.2148, test_f1: 0.5713
 epoch: 28, train_loss: 0.7540, test_loss: 0.9864, test_f1: 0.5626
 epoch: 29, train_loss: 0.7185, test_loss: 1.1701, test_f1: 0.5571
 epoch: 30, train_loss: 0.6890, test_loss: 1.0758, test_f1: 0.6394
 epoch: 31, train_loss: 0.7013, test_loss: 1.0972, test_f1: 0.5848
 epoch: 32, train_loss: 0.6876, test_loss: 1.1764, test_f1: 0.5602
 epoch: 33, train_loss: 0.6936, test_loss: 1.2915, test_f1: 0.6477
 epoch: 34, train_loss: 0.6757, test_loss: 1.5148, test_f1: 0.5494
 epoch: 35, train_loss: 0.6728, test_loss: 1.4151, test_f1: 0.5956
 epoch: 36, train_loss: 0.6720, test_loss: 1.0895, test_f1: 0.6347
 epoch: 37, train_loss: 0.6589, test_loss: 1.3280, test_f1: 0.6093
 epoch: 38, train_loss: 0.6409, test_loss: 1.4223, test_f1: 0.5854
 epoch: 39, train_loss: 0.6427, test_loss: 1.8246, test_f1: 0.6018
 epoch: 40, train_loss: 0.6795, test_loss: 1.5341, test_f1: 0.4945
 epoch: 41, train_loss: 0.6553, test_loss: 1.4614, test_f1: 0.5114
 epoch: 42, train_loss: 0.6384, test_loss: 1.1873, test_f1: 0.5639
 epoch: 43, train_loss: 0.6479, test_loss: 1.1844, test_f1: 0.5281
 epoch: 44, train_loss: 0.6670, test_loss: 1.2421, test_f1: 0.6652
 epoch: 45, train_loss: 0.6968, test_loss: 1.4897, test_f1: 0.5253
 epoch: 46, train_loss: 0.6949, test_loss: 1.4024, test_f1: 0.5201
 epoch: 47, train_loss: 0.6702, test_loss: 1.2724, test_f1: 0.6069
 epoch: 48, train_loss: 0.6525, test_loss: 1.5164, test_f1: 0.4992
 epoch: 49, train_loss: 0.6318, test_loss: 1.4140, test_f1: 0.5926
 epoch: 50, train_loss: 0.6204, test_loss: 1.4471, test_f1: 0.6516
 epoch: 51, train_loss: 0.6113, test_loss: 1.4375, test_f1: 0.5842
 epoch: 52, train_loss: 0.5816, test_loss: 1.3942, test_f1: 0.6196
 epoch: 53, train_loss: 0.5685, test_loss: 1.3485, test_f1: 0.6375
 epoch: 54, train_loss: 0.5639, test_loss: 1.4557, test_f1: 0.5390
 epoch: 55, train_loss: 0.5677, test_loss: 1.5062, test_f1: 0.6638
 epoch: 56, train_loss: 0.5555, test_loss: 1.2755, test_f1: 0.5987
 epoch: 57, train_loss: 0.5491, test_loss: 1.2656, test_f1: 0.6145
 epoch: 58, train_loss: 0.5567, test_loss: 1.6713, test_f1: 0.5579
 epoch: 59, train_loss: 0.5358, test_loss: 1.2938, test_f1: 0.6056
 epoch: 60, train_loss: 0.5343, test_loss: 1.4487, test_f1: 0.5757
 epoch: 61, train_loss: 0.5378, test_loss: 1.2549, test_f1: 0.5651
 epoch: 62, train_loss: 0.5329, test_loss: 1.6164, test_f1: 0.5859
 epoch: 63, train_loss: 0.5200, test_loss: 1.3809, test_f1: 0.5721
 epoch: 64, train_loss: 0.5395, test_loss: 1.4732, test_f1: 0.5899
 epoch: 65, train_loss: 0.5283, test_loss: 1.2296, test_f1: 0.5907
 epoch: 66, train_loss: 0.5323, test_loss: 1.5964, test_f1: 0.6264
 epoch: 67, train_loss: 0.5121, test_loss: 1.3869, test_f1: 0.5883
 epoch: 68, train_loss: 0.5038, test_loss: 1.6111, test_f1: 0.6052
 epoch: 69, train_loss: 0.5066, test_loss: 1.2878, test_f1: 0.6055
 epoch: 70, train_loss: 0.4996, test_loss: 1.2565, test_f1: 0.5846
 epoch: 71, train_loss: 0.5342, test_loss: 1.6012, test_f1: 0.5871
 epoch: 72, train_loss: 0.5264, test_loss: 1.3757, test_f1: 0.5797
 epoch: 73, train_loss: 0.5163, test_loss: 1.7825, test_f1: 0.5723
 epoch: 74, train_loss: 0.5298, test_loss: 1.5810, test_f1: 0.6268
 epoch: 75, train_loss: 0.4873, test_loss: 1.4433, test_f1: 0.5833
 epoch: 76, train_loss: 0.4740, test_loss: 1.2083, test_f1: 0.5982
 epoch: 77, train_loss: 0.5020, test_loss: 1.3646, test_f1: 0.6068
 epoch: 78, train_loss: 0.4734, test_loss: 1.4117, test_f1: 0.5029
 epoch: 79, train_loss: 0.4783, test_loss: 1.2917, test_f1: 0.6334
 epoch: 80, train_loss: 0.4707, test_loss: 1.4816, test_f1: 0.6023
 epoch: 81, train_loss: 0.4764, test_loss: 1.3701, test_f1: 0.5886
 epoch: 82, train_loss: 0.4650, test_loss: 1.4904, test_f1: 0.6129
 epoch: 83, train_loss: 0.4635, test_loss: 1.6145, test_f1: 0.5653
 epoch: 84, train_loss: 0.5139, test_loss: 1.5068, test_f1: 0.5396
 epoch: 85, train_loss: 0.5230, test_loss: 1.9567, test_f1: 0.5907
 epoch: 86, train_loss: 0.4846, test_loss: 1.5093, test_f1: 0.6025
 epoch: 87, train_loss: 0.5055, test_loss: 1.2138, test_f1: 0.6403
 epoch: 88, train_loss: 0.4693, test_loss: 1.5958, test_f1: 0.5857
 epoch: 89, train_loss: 0.4632, test_loss: 1.7183, test_f1: 0.5023
 epoch: 90, train_loss: 0.4602, test_loss: 1.5318, test_f1: 0.5220
 epoch: 91, train_loss: 0.4619, test_loss: 1.9825, test_f1: 0.6126
 epoch: 92, train_loss: 0.4814, test_loss: 1.7506, test_f1: 0.5665
 epoch: 93, train_loss: 0.4491, test_loss: 1.5717, test_f1: 0.5826
 epoch: 94, train_loss: 0.4387, test_loss: 1.6128, test_f1: 0.5863
 epoch: 95, train_loss: 0.4226, test_loss: 1.6941, test_f1: 0.5713
 epoch: 96, train_loss: 0.4161, test_loss: 2.0595, test_f1: 0.5170
 epoch: 97, train_loss: 0.4283, test_loss: 1.7810, test_f1: 0.5548
 epoch: 98, train_loss: 0.4036, test_loss: 1.9496, test_f1: 0.5461
 epoch: 99, train_loss: 0.4078, test_loss: 1.6822, test_f1: 0.5999
##################ITERATION #4 ****************************************
 epoch: 0, train_loss: 1.1779, test_loss: 1.6340, test_f1: 0.3388
 epoch: 1, train_loss: 0.9797, test_loss: 1.2673, test_f1: 0.3327
 epoch: 2, train_loss: 0.9277, test_loss: 1.0901, test_f1: 0.5239
 epoch: 3, train_loss: 0.8775, test_loss: 1.0350, test_f1: 0.5239
 epoch: 4, train_loss: 0.8431, test_loss: 1.0063, test_f1: 0.5561
 epoch: 5, train_loss: 0.8188, test_loss: 1.0173, test_f1: 0.5270
 epoch: 6, train_loss: 0.8078, test_loss: 1.2116, test_f1: 0.4866
 epoch: 7, train_loss: 0.8417, test_loss: 1.4153, test_f1: 0.4758
 epoch: 8, train_loss: 0.8248, test_loss: 1.1685, test_f1: 0.5058
 epoch: 9, train_loss: 0.8150, test_loss: 1.7682, test_f1: 0.4746
 epoch: 10, train_loss: 0.7821, test_loss: 1.3601, test_f1: 0.4572
 epoch: 11, train_loss: 0.7498, test_loss: 1.1964, test_f1: 0.5276
 epoch: 12, train_loss: 0.7418, test_loss: 1.0418, test_f1: 0.6102
 epoch: 13, train_loss: 0.7520, test_loss: 1.0834, test_f1: 0.5578
 epoch: 14, train_loss: 0.7624, test_loss: 1.1334, test_f1: 0.5985
 epoch: 15, train_loss: 0.7541, test_loss: 1.0208, test_f1: 0.5612
 epoch: 16, train_loss: 0.7614, test_loss: 1.1767, test_f1: 0.5664
 epoch: 17, train_loss: 0.7369, test_loss: 1.4448, test_f1: 0.4929
 epoch: 18, train_loss: 0.7822, test_loss: 0.9543, test_f1: 0.5885
 epoch: 19, train_loss: 0.7466, test_loss: 1.1665, test_f1: 0.5945
 epoch: 20, train_loss: 0.7305, test_loss: 1.2172, test_f1: 0.5804
 epoch: 21, train_loss: 0.7113, test_loss: 0.9698, test_f1: 0.6494
 epoch: 22, train_loss: 0.7192, test_loss: 1.3557, test_f1: 0.5755
 epoch: 23, train_loss: 0.6979, test_loss: 1.0287, test_f1: 0.6554
 epoch: 24, train_loss: 0.7235, test_loss: 1.0068, test_f1: 0.5656
 epoch: 25, train_loss: 0.6997, test_loss: 1.2955, test_f1: 0.5983
 epoch: 26, train_loss: 0.7225, test_loss: 0.9821, test_f1: 0.6262
 epoch: 27, train_loss: 0.7619, test_loss: 1.1170, test_f1: 0.5484
 epoch: 28, train_loss: 0.7293, test_loss: 1.2393, test_f1: 0.5449
 epoch: 29, train_loss: 0.6734, test_loss: 1.1123, test_f1: 0.6230
 epoch: 30, train_loss: 0.6673, test_loss: 1.1757, test_f1: 0.6010
 epoch: 31, train_loss: 0.6627, test_loss: 1.5709, test_f1: 0.5942
 epoch: 32, train_loss: 0.7047, test_loss: 1.2436, test_f1: 0.5376
 epoch: 33, train_loss: 0.6882, test_loss: 1.0866, test_f1: 0.6526
 epoch: 34, train_loss: 0.6607, test_loss: 1.0305, test_f1: 0.5767
 epoch: 35, train_loss: 0.6497, test_loss: 1.1119, test_f1: 0.6252
 epoch: 36, train_loss: 0.6641, test_loss: 0.9733, test_f1: 0.6294
 epoch: 37, train_loss: 0.6517, test_loss: 1.3142, test_f1: 0.5891
 epoch: 38, train_loss: 0.6261, test_loss: 1.2344, test_f1: 0.5810
 epoch: 39, train_loss: 0.6133, test_loss: 1.3273, test_f1: 0.5941
 epoch: 40, train_loss: 0.6197, test_loss: 1.0825, test_f1: 0.5962
 epoch: 41, train_loss: 0.6086, test_loss: 1.1275, test_f1: 0.5484
 epoch: 42, train_loss: 0.6016, test_loss: 1.5772, test_f1: 0.5977
 epoch: 43, train_loss: 0.6024, test_loss: 1.1754, test_f1: 0.5651
 epoch: 44, train_loss: 0.5970, test_loss: 1.8446, test_f1: 0.5630
 epoch: 45, train_loss: 0.5971, test_loss: 1.2020, test_f1: 0.5873
 epoch: 46, train_loss: 0.5903, test_loss: 1.3950, test_f1: 0.5744
 epoch: 47, train_loss: 0.6309, test_loss: 1.2744, test_f1: 0.5710
 epoch: 48, train_loss: 0.5905, test_loss: 1.1266, test_f1: 0.5765
 epoch: 49, train_loss: 0.5824, test_loss: 1.3762, test_f1: 0.6407
 epoch: 50, train_loss: 0.5676, test_loss: 1.2722, test_f1: 0.5643
 epoch: 51, train_loss: 0.5546, test_loss: 1.2811, test_f1: 0.6257
 epoch: 52, train_loss: 0.5286, test_loss: 1.3279, test_f1: 0.6403
 epoch: 53, train_loss: 0.5201, test_loss: 1.3279, test_f1: 0.6302
 epoch: 54, train_loss: 0.5217, test_loss: 1.4588, test_f1: 0.6445
 epoch: 55, train_loss: 0.5078, test_loss: 1.3549, test_f1: 0.6551
 epoch: 56, train_loss: 0.4868, test_loss: 1.3569, test_f1: 0.5966
 epoch: 57, train_loss: 0.4826, test_loss: 1.2954, test_f1: 0.6081
 epoch: 58, train_loss: 0.4876, test_loss: 1.4433, test_f1: 0.6008
 epoch: 59, train_loss: 0.4695, test_loss: 1.4314, test_f1: 0.6220
 epoch: 60, train_loss: 0.4711, test_loss: 1.5513, test_f1: 0.6785
 epoch: 61, train_loss: 0.5409, test_loss: 1.4304, test_f1: 0.5370
 epoch: 62, train_loss: 0.5636, test_loss: 1.7132, test_f1: 0.5981
 epoch: 63, train_loss: 0.5378, test_loss: 1.4076, test_f1: 0.5870
 epoch: 64, train_loss: 0.5153, test_loss: 1.4584, test_f1: 0.5999
 epoch: 65, train_loss: 0.4811, test_loss: 1.3661, test_f1: 0.6372
 epoch: 66, train_loss: 0.4844, test_loss: 1.3543, test_f1: 0.6305
 epoch: 67, train_loss: 0.4771, test_loss: 1.3836, test_f1: 0.6392
 epoch: 68, train_loss: 0.4587, test_loss: 1.4635, test_f1: 0.6494
 epoch: 69, train_loss: 0.4835, test_loss: 1.3546, test_f1: 0.5921
 epoch: 70, train_loss: 0.4400, test_loss: 1.5320, test_f1: 0.6076
 epoch: 71, train_loss: 0.4593, test_loss: 1.3233, test_f1: 0.6208
 epoch: 72, train_loss: 0.4698, test_loss: 1.5654, test_f1: 0.5953
 epoch: 73, train_loss: 0.4476, test_loss: 1.5469, test_f1: 0.5747
 epoch: 74, train_loss: 0.4485, test_loss: 1.3711, test_f1: 0.6238
 epoch: 75, train_loss: 0.4885, test_loss: 1.4876, test_f1: 0.6054
 epoch: 76, train_loss: 0.4726, test_loss: 1.2522, test_f1: 0.6379
 epoch: 77, train_loss: 0.4564, test_loss: 1.3131, test_f1: 0.6352
 epoch: 78, train_loss: 0.4595, test_loss: 1.3583, test_f1: 0.6204
 epoch: 79, train_loss: 0.4506, test_loss: 1.4181, test_f1: 0.6510
 epoch: 80, train_loss: 0.4222, test_loss: 1.4065, test_f1: 0.5706
 epoch: 81, train_loss: 0.4287, test_loss: 1.5176, test_f1: 0.6643
 epoch: 82, train_loss: 0.4343, test_loss: 1.4215, test_f1: 0.5868
 epoch: 83, train_loss: 0.4424, test_loss: 1.4901, test_f1: 0.6286
 epoch: 84, train_loss: 0.4298, test_loss: 1.4874, test_f1: 0.6047
 epoch: 85, train_loss: 0.4182, test_loss: 1.4665, test_f1: 0.6253
 epoch: 86, train_loss: 0.4356, test_loss: 1.1975, test_f1: 0.6243
 epoch: 87, train_loss: 0.4164, test_loss: 1.4073, test_f1: 0.6242
 epoch: 88, train_loss: 0.4218, test_loss: 1.4650, test_f1: 0.6135
 epoch: 89, train_loss: 0.4084, test_loss: 1.5040, test_f1: 0.5816
 epoch: 90, train_loss: 0.4024, test_loss: 1.6727, test_f1: 0.6084
 epoch: 91, train_loss: 0.4454, test_loss: 1.5953, test_f1: 0.5767
 epoch: 92, train_loss: 0.4343, test_loss: 1.4831, test_f1: 0.5752
 epoch: 93, train_loss: 0.4158, test_loss: 1.6635, test_f1: 0.6123
 epoch: 94, train_loss: 0.4040, test_loss: 1.3098, test_f1: 0.6418
 epoch: 95, train_loss: 0.4074, test_loss: 1.3535, test_f1: 0.6714
 epoch: 96, train_loss: 0.4384, test_loss: 1.5774, test_f1: 0.6082
 epoch: 97, train_loss: 0.3803, test_loss: 1.3433, test_f1: 0.6200
 epoch: 98, train_loss: 0.4007, test_loss: 1.4235, test_f1: 0.6444
 epoch: 99, train_loss: 0.3869, test_loss: 1.4943, test_f1: 0.6283
##################ITERATION #5 ****************************************
 epoch: 0, train_loss: 1.2676, test_loss: 1.3283, test_f1: 0.1535
 epoch: 1, train_loss: 1.0516, test_loss: 1.3811, test_f1: 0.3820
 epoch: 2, train_loss: 0.9595, test_loss: 1.2486, test_f1: 0.4414
 epoch: 3, train_loss: 0.9022, test_loss: 1.1246, test_f1: 0.4921
 epoch: 4, train_loss: 0.8840, test_loss: 1.1106, test_f1: 0.4836
 epoch: 5, train_loss: 0.8494, test_loss: 1.3174, test_f1: 0.4867
 epoch: 6, train_loss: 0.8223, test_loss: 2.1454, test_f1: 0.3464
 epoch: 7, train_loss: 0.8270, test_loss: 1.0687, test_f1: 0.5142
 epoch: 8, train_loss: 0.8211, test_loss: 0.9883, test_f1: 0.5448
 epoch: 9, train_loss: 0.8152, test_loss: 1.2386, test_f1: 0.5752
 epoch: 10, train_loss: 0.7670, test_loss: 1.8548, test_f1: 0.4066
 epoch: 11, train_loss: 0.7824, test_loss: 1.9411, test_f1: 0.4407
 epoch: 12, train_loss: 0.7840, test_loss: 0.9874, test_f1: 0.5769
 epoch: 13, train_loss: 0.7606, test_loss: 5.3411, test_f1: 0.1967
 epoch: 14, train_loss: 0.7644, test_loss: 1.0067, test_f1: 0.5700
 epoch: 15, train_loss: 0.7569, test_loss: 1.0574, test_f1: 0.5614
 epoch: 16, train_loss: 0.7308, test_loss: 1.0060, test_f1: 0.5757
 epoch: 17, train_loss: 0.7429, test_loss: 1.1462, test_f1: 0.5720
 epoch: 18, train_loss: 0.7153, test_loss: 1.0647, test_f1: 0.5764
 epoch: 19, train_loss: 0.7326, test_loss: 1.8986, test_f1: 0.4639
 epoch: 20, train_loss: 0.7033, test_loss: 1.1238, test_f1: 0.5492
 epoch: 21, train_loss: 0.7061, test_loss: 1.0402, test_f1: 0.5644
 epoch: 22, train_loss: 0.6975, test_loss: 1.0410, test_f1: 0.5845
 epoch: 23, train_loss: 0.7127, test_loss: 1.0150, test_f1: 0.6336
 epoch: 24, train_loss: 0.7404, test_loss: 1.2973, test_f1: 0.5353
 epoch: 25, train_loss: 0.7061, test_loss: 1.1394, test_f1: 0.5985
 epoch: 26, train_loss: 0.6825, test_loss: 1.1393, test_f1: 0.5845
 epoch: 27, train_loss: 0.6906, test_loss: 1.2786, test_f1: 0.5585
 epoch: 28, train_loss: 0.6631, test_loss: 1.0499, test_f1: 0.5780
 epoch: 29, train_loss: 0.6687, test_loss: 1.2479, test_f1: 0.5188
 epoch: 30, train_loss: 0.6913, test_loss: 1.4697, test_f1: 0.5260
 epoch: 31, train_loss: 0.6610, test_loss: 0.9835, test_f1: 0.6081
 epoch: 32, train_loss: 0.6837, test_loss: 1.1176, test_f1: 0.5984
 epoch: 33, train_loss: 0.6796, test_loss: 1.2233, test_f1: 0.5706
 epoch: 34, train_loss: 0.6509, test_loss: 1.3014, test_f1: 0.5499
 epoch: 35, train_loss: 0.6290, test_loss: 1.2664, test_f1: 0.6337
 epoch: 36, train_loss: 0.6387, test_loss: 1.5034, test_f1: 0.5503
 epoch: 37, train_loss: 0.6405, test_loss: 1.2683, test_f1: 0.5947
 epoch: 38, train_loss: 0.6350, test_loss: 1.0614, test_f1: 0.6348
 epoch: 39, train_loss: 0.6653, test_loss: 1.1392, test_f1: 0.6048
 epoch: 40, train_loss: 0.6404, test_loss: 1.1763, test_f1: 0.5851
 epoch: 41, train_loss: 0.6114, test_loss: 1.4799, test_f1: 0.5798
 epoch: 42, train_loss: 0.6171, test_loss: 1.2703, test_f1: 0.6235
 epoch: 43, train_loss: 0.5878, test_loss: 1.4561, test_f1: 0.5605
 epoch: 44, train_loss: 0.6059, test_loss: 1.4205, test_f1: 0.5469
 epoch: 45, train_loss: 0.6024, test_loss: 1.6195, test_f1: 0.5523
 epoch: 46, train_loss: 0.6239, test_loss: 1.2215, test_f1: 0.5675
 epoch: 47, train_loss: 0.5961, test_loss: 1.3817, test_f1: 0.5266
 epoch: 48, train_loss: 0.5878, test_loss: 1.4931, test_f1: 0.5822
 epoch: 49, train_loss: 0.6067, test_loss: 1.5857, test_f1: 0.5787
 epoch: 50, train_loss: 0.6352, test_loss: 1.6347, test_f1: 0.5880
 epoch: 51, train_loss: 0.5798, test_loss: 1.2668, test_f1: 0.6220
 epoch: 52, train_loss: 0.5689, test_loss: 1.6704, test_f1: 0.5404
 epoch: 53, train_loss: 0.5366, test_loss: 1.3271, test_f1: 0.5960
 epoch: 54, train_loss: 0.5297, test_loss: 1.2733, test_f1: 0.6069
 epoch: 55, train_loss: 0.5004, test_loss: 1.2461, test_f1: 0.6427
 epoch: 56, train_loss: 0.4918, test_loss: 1.9359, test_f1: 0.6029
 epoch: 57, train_loss: 0.5075, test_loss: 1.6215, test_f1: 0.5956
 epoch: 58, train_loss: 0.4854, test_loss: 1.1779, test_f1: 0.6414
 epoch: 59, train_loss: 0.4852, test_loss: 1.8263, test_f1: 0.5963
 epoch: 60, train_loss: 0.5126, test_loss: 1.6047, test_f1: 0.6098
 epoch: 61, train_loss: 0.4693, test_loss: 1.3050, test_f1: 0.6400
 epoch: 62, train_loss: 0.4843, test_loss: 1.5028, test_f1: 0.6164
 epoch: 63, train_loss: 0.5106, test_loss: 1.4507, test_f1: 0.5765
 epoch: 64, train_loss: 0.5012, test_loss: 1.7536, test_f1: 0.5819
 epoch: 65, train_loss: 0.4814, test_loss: 1.2379, test_f1: 0.6403
 epoch: 66, train_loss: 0.4897, test_loss: 1.7326, test_f1: 0.5332
 epoch: 67, train_loss: 0.4676, test_loss: 1.5548, test_f1: 0.6245
 epoch: 68, train_loss: 0.4836, test_loss: 1.2315, test_f1: 0.6173
 epoch: 69, train_loss: 0.4686, test_loss: 1.5046, test_f1: 0.5791
 epoch: 70, train_loss: 0.4794, test_loss: 1.5475, test_f1: 0.5721
 epoch: 71, train_loss: 0.4584, test_loss: 1.4887, test_f1: 0.6043
 epoch: 72, train_loss: 0.4610, test_loss: 1.4148, test_f1: 0.5864
 epoch: 73, train_loss: 0.4240, test_loss: 1.4623, test_f1: 0.6183
 epoch: 74, train_loss: 0.4406, test_loss: 1.9146, test_f1: 0.5803
 epoch: 75, train_loss: 0.4608, test_loss: 1.3770, test_f1: 0.6262
 epoch: 76, train_loss: 0.4635, test_loss: 1.4646, test_f1: 0.5920
 epoch: 77, train_loss: 0.4467, test_loss: 1.8324, test_f1: 0.5818
 epoch: 78, train_loss: 0.4463, test_loss: 1.5616, test_f1: 0.6225
 epoch: 79, train_loss: 0.4492, test_loss: 2.4232, test_f1: 0.5491
 epoch: 80, train_loss: 0.4738, test_loss: 1.4403, test_f1: 0.6062
 epoch: 81, train_loss: 0.4267, test_loss: 1.7146, test_f1: 0.6164
 epoch: 82, train_loss: 0.4441, test_loss: 1.8268, test_f1: 0.6223
 epoch: 83, train_loss: 0.4570, test_loss: 1.6692, test_f1: 0.6247
 epoch: 84, train_loss: 0.4483, test_loss: 1.4619, test_f1: 0.6182
 epoch: 85, train_loss: 0.4543, test_loss: 2.7170, test_f1: 0.4683
 epoch: 86, train_loss: 0.4396, test_loss: 2.1970, test_f1: 0.5319
 epoch: 87, train_loss: 0.4283, test_loss: 2.1410, test_f1: 0.5649
 epoch: 88, train_loss: 0.3924, test_loss: 1.7064, test_f1: 0.6226
 epoch: 89, train_loss: 0.4188, test_loss: 1.6851, test_f1: 0.5951
 epoch: 90, train_loss: 0.4186, test_loss: 1.8615, test_f1: 0.6143
 epoch: 91, train_loss: 0.4303, test_loss: 1.5420, test_f1: 0.6383
 epoch: 92, train_loss: 0.4184, test_loss: 1.7682, test_f1: 0.6159
 epoch: 93, train_loss: 0.3776, test_loss: 1.6240, test_f1: 0.6016
 epoch: 94, train_loss: 0.3807, test_loss: 1.7508, test_f1: 0.5713
 epoch: 95, train_loss: 0.3971, test_loss: 1.9570, test_f1: 0.5810
 epoch: 96, train_loss: 0.3923, test_loss: 1.5279, test_f1: 0.6775
 epoch: 97, train_loss: 0.4069, test_loss: 1.9280, test_f1: 0.5710
 epoch: 98, train_loss: 0.3922, test_loss: 1.7006, test_f1: 0.6248
 epoch: 99, train_loss: 0.3893, test_loss: 2.3638, test_f1: 0.5664
##################ITERATION #6 ****************************************
 epoch: 0, train_loss: 1.2825, test_loss: 1.5039, test_f1: 0.3256
 epoch: 1, train_loss: 1.0486, test_loss: 1.4404, test_f1: 0.2354
 epoch: 2, train_loss: 0.9783, test_loss: 1.4576, test_f1: 0.2575
 epoch: 3, train_loss: 0.9508, test_loss: 1.0381, test_f1: 0.4797
 epoch: 4, train_loss: 0.9101, test_loss: 1.0198, test_f1: 0.5237
 epoch: 5, train_loss: 0.8691, test_loss: 0.9829, test_f1: 0.5465
 epoch: 6, train_loss: 0.8622, test_loss: 1.0295, test_f1: 0.4922
 epoch: 7, train_loss: 0.8464, test_loss: 0.9879, test_f1: 0.5625
 epoch: 8, train_loss: 0.8399, test_loss: 1.0590, test_f1: 0.5614
 epoch: 9, train_loss: 0.8126, test_loss: 1.0394, test_f1: 0.5118
 epoch: 10, train_loss: 0.8474, test_loss: 0.9772, test_f1: 0.5230
 epoch: 11, train_loss: 0.8207, test_loss: 1.1521, test_f1: 0.4936
 epoch: 12, train_loss: 0.7760, test_loss: 0.9555, test_f1: 0.5946
 epoch: 13, train_loss: 0.7793, test_loss: 1.0016, test_f1: 0.5589
 epoch: 14, train_loss: 0.7962, test_loss: 1.4358, test_f1: 0.4364
 epoch: 15, train_loss: 0.7794, test_loss: 0.9957, test_f1: 0.5664
 epoch: 16, train_loss: 0.7527, test_loss: 1.1569, test_f1: 0.5483
 epoch: 17, train_loss: 0.7526, test_loss: 1.0077, test_f1: 0.5749
 epoch: 18, train_loss: 0.7163, test_loss: 1.0368, test_f1: 0.5736
 epoch: 19, train_loss: 0.7397, test_loss: 1.0818, test_f1: 0.5605
 epoch: 20, train_loss: 0.7314, test_loss: 1.0420, test_f1: 0.5928
 epoch: 21, train_loss: 0.7361, test_loss: 0.9718, test_f1: 0.6100
 epoch: 22, train_loss: 0.7371, test_loss: 1.0434, test_f1: 0.5021
 epoch: 23, train_loss: 0.7149, test_loss: 1.0293, test_f1: 0.5566
 epoch: 24, train_loss: 0.7118, test_loss: 0.9725, test_f1: 0.5638
 epoch: 25, train_loss: 0.6784, test_loss: 1.1103, test_f1: 0.5337
 epoch: 26, train_loss: 0.6895, test_loss: 1.1572, test_f1: 0.5547
 epoch: 27, train_loss: 0.6847, test_loss: 1.1188, test_f1: 0.5203
 epoch: 28, train_loss: 0.6884, test_loss: 1.0982, test_f1: 0.5477
 epoch: 29, train_loss: 0.6692, test_loss: 1.1804, test_f1: 0.5301
 epoch: 30, train_loss: 0.6916, test_loss: 1.1328, test_f1: 0.5886
 epoch: 31, train_loss: 0.7040, test_loss: 1.3694, test_f1: 0.5320
 epoch: 32, train_loss: 0.7065, test_loss: 1.0785, test_f1: 0.5880
 epoch: 33, train_loss: 0.6974, test_loss: 0.9181, test_f1: 0.5786
 epoch: 34, train_loss: 0.6786, test_loss: 0.9575, test_f1: 0.6177
 epoch: 35, train_loss: 0.6625, test_loss: 0.9994, test_f1: 0.5905
 epoch: 36, train_loss: 0.6342, test_loss: 0.9811, test_f1: 0.6310
 epoch: 37, train_loss: 0.6309, test_loss: 1.0086, test_f1: 0.6174
 epoch: 38, train_loss: 0.6746, test_loss: 0.9475, test_f1: 0.6000
 epoch: 39, train_loss: 0.6596, test_loss: 1.0513, test_f1: 0.6078
 epoch: 40, train_loss: 0.6388, test_loss: 1.1097, test_f1: 0.6136
 epoch: 41, train_loss: 0.6060, test_loss: 1.0524, test_f1: 0.5937
 epoch: 42, train_loss: 0.6105, test_loss: 1.0562, test_f1: 0.5853
 epoch: 43, train_loss: 0.6054, test_loss: 1.1102, test_f1: 0.5891
 epoch: 44, train_loss: 0.6168, test_loss: 1.4450, test_f1: 0.5315
 epoch: 45, train_loss: 0.6054, test_loss: 1.1250, test_f1: 0.5700
 epoch: 46, train_loss: 0.6042, test_loss: 1.0052, test_f1: 0.6194
 epoch: 47, train_loss: 0.5948, test_loss: 1.1348, test_f1: 0.6196
 epoch: 48, train_loss: 0.5846, test_loss: 1.1571, test_f1: 0.5821
 epoch: 49, train_loss: 0.5738, test_loss: 1.0896, test_f1: 0.6408
 epoch: 50, train_loss: 0.5845, test_loss: 1.0916, test_f1: 0.6124
 epoch: 51, train_loss: 0.5601, test_loss: 1.0178, test_f1: 0.5913
 epoch: 52, train_loss: 0.5463, test_loss: 1.0505, test_f1: 0.6665
 epoch: 53, train_loss: 0.5223, test_loss: 1.1275, test_f1: 0.5609
 epoch: 54, train_loss: 0.5438, test_loss: 1.2223, test_f1: 0.6202
 epoch: 55, train_loss: 0.5071, test_loss: 1.1043, test_f1: 0.5922
 epoch: 56, train_loss: 0.5114, test_loss: 1.0971, test_f1: 0.5892
 epoch: 57, train_loss: 0.5154, test_loss: 1.2711, test_f1: 0.6124
 epoch: 58, train_loss: 0.4940, test_loss: 1.3077, test_f1: 0.5723
 epoch: 59, train_loss: 0.4852, test_loss: 1.1455, test_f1: 0.6129
 epoch: 60, train_loss: 0.4880, test_loss: 1.2398, test_f1: 0.5852
 epoch: 61, train_loss: 0.4794, test_loss: 1.2017, test_f1: 0.5771
 epoch: 62, train_loss: 0.4844, test_loss: 1.4065, test_f1: 0.5915
 epoch: 63, train_loss: 0.4920, test_loss: 1.3221, test_f1: 0.5905
 epoch: 64, train_loss: 0.4602, test_loss: 1.2554, test_f1: 0.5993
 epoch: 65, train_loss: 0.4603, test_loss: 1.5271, test_f1: 0.5059
 epoch: 66, train_loss: 0.4712, test_loss: 1.2534, test_f1: 0.5518
 epoch: 67, train_loss: 0.4612, test_loss: 1.1606, test_f1: 0.5828
 epoch: 68, train_loss: 0.4599, test_loss: 1.3783, test_f1: 0.5965
 epoch: 69, train_loss: 0.4471, test_loss: 1.3197, test_f1: 0.6214
 epoch: 70, train_loss: 0.4503, test_loss: 1.5322, test_f1: 0.5493
 epoch: 71, train_loss: 0.4425, test_loss: 1.1220, test_f1: 0.6002
 epoch: 72, train_loss: 0.4595, test_loss: 1.3520, test_f1: 0.5558
 epoch: 73, train_loss: 0.5007, test_loss: 1.4005, test_f1: 0.5174
 epoch: 74, train_loss: 0.5313, test_loss: 1.4100, test_f1: 0.5959
 epoch: 75, train_loss: 0.5148, test_loss: 1.0995, test_f1: 0.5948
 epoch: 76, train_loss: 0.4744, test_loss: 1.0104, test_f1: 0.6287
 epoch: 77, train_loss: 0.4420, test_loss: 1.2001, test_f1: 0.5561
 epoch: 78, train_loss: 0.4464, test_loss: 1.0666, test_f1: 0.6284
 epoch: 79, train_loss: 0.4330, test_loss: 1.1380, test_f1: 0.6292
 epoch: 80, train_loss: 0.4496, test_loss: 1.2210, test_f1: 0.5809
 epoch: 81, train_loss: 0.4181, test_loss: 1.4320, test_f1: 0.5660
 epoch: 82, train_loss: 0.4117, test_loss: 1.1767, test_f1: 0.6197
 epoch: 83, train_loss: 0.4186, test_loss: 1.3628, test_f1: 0.5832
 epoch: 84, train_loss: 0.4463, test_loss: 1.3212, test_f1: 0.5999
 epoch: 85, train_loss: 0.4382, test_loss: 1.1860, test_f1: 0.5871
 epoch: 86, train_loss: 0.4228, test_loss: 1.2599, test_f1: 0.6170
 epoch: 87, train_loss: 0.4155, test_loss: 1.2546, test_f1: 0.5807
 epoch: 88, train_loss: 0.3977, test_loss: 1.1752, test_f1: 0.6098
 epoch: 89, train_loss: 0.4135, test_loss: 1.1652, test_f1: 0.5945
 epoch: 90, train_loss: 0.3831, test_loss: 1.2719, test_f1: 0.6096
 epoch: 91, train_loss: 0.3980, test_loss: 1.2870, test_f1: 0.5850
 epoch: 92, train_loss: 0.3813, test_loss: 1.2718, test_f1: 0.6157
 epoch: 93, train_loss: 0.3831, test_loss: 1.2728, test_f1: 0.6370
 epoch: 94, train_loss: 0.3932, test_loss: 1.2204, test_f1: 0.6431
 epoch: 95, train_loss: 0.3963, test_loss: 1.3701, test_f1: 0.5979
 epoch: 96, train_loss: 0.3916, test_loss: 1.4064, test_f1: 0.5853
 epoch: 97, train_loss: 0.3765, test_loss: 1.3299, test_f1: 0.6186
 epoch: 98, train_loss: 0.3699, test_loss: 1.3204, test_f1: 0.6540
 epoch: 99, train_loss: 0.3983, test_loss: 1.6280, test_f1: 0.5073
##################ITERATION #7 ****************************************
 epoch: 0, train_loss: 1.2418, test_loss: 1.6523, test_f1: 0.3339
 epoch: 1, train_loss: 1.0163, test_loss: 1.3804, test_f1: 0.2886
 epoch: 2, train_loss: 0.9662, test_loss: 1.3067, test_f1: 0.4055
 epoch: 3, train_loss: 0.9173, test_loss: 1.1374, test_f1: 0.5310
 epoch: 4, train_loss: 0.8564, test_loss: 1.3292, test_f1: 0.3827
 epoch: 5, train_loss: 0.8607, test_loss: 1.1795, test_f1: 0.5130
 epoch: 6, train_loss: 0.8518, test_loss: 1.1853, test_f1: 0.4868
 epoch: 7, train_loss: 0.8313, test_loss: 0.9745, test_f1: 0.5747
 epoch: 8, train_loss: 0.8358, test_loss: 1.2499, test_f1: 0.4847
 epoch: 9, train_loss: 0.8275, test_loss: 1.0971, test_f1: 0.5137
 epoch: 10, train_loss: 0.8165, test_loss: 0.9306, test_f1: 0.6002
 epoch: 11, train_loss: 0.7849, test_loss: 0.9622, test_f1: 0.5762
 epoch: 12, train_loss: 0.7717, test_loss: 1.1710, test_f1: 0.5144
 epoch: 13, train_loss: 0.7732, test_loss: 0.9632, test_f1: 0.6051
 epoch: 14, train_loss: 0.7568, test_loss: 1.0212, test_f1: 0.5647
 epoch: 15, train_loss: 0.7317, test_loss: 0.9692, test_f1: 0.5793
 epoch: 16, train_loss: 0.7597, test_loss: 1.1223, test_f1: 0.5197
 epoch: 17, train_loss: 0.7695, test_loss: 1.2328, test_f1: 0.4845
 epoch: 18, train_loss: 0.7884, test_loss: 1.2347, test_f1: 0.5008
 epoch: 19, train_loss: 0.7381, test_loss: 1.5203, test_f1: 0.4894
 epoch: 20, train_loss: 0.7299, test_loss: 1.2317, test_f1: 0.5312
 epoch: 21, train_loss: 0.7233, test_loss: 1.0671, test_f1: 0.5537
 epoch: 22, train_loss: 0.7272, test_loss: 1.0208, test_f1: 0.5516
 epoch: 23, train_loss: 0.7274, test_loss: 1.0436, test_f1: 0.5785
 epoch: 24, train_loss: 0.7777, test_loss: 1.0443, test_f1: 0.6048
 epoch: 25, train_loss: 0.7512, test_loss: 1.1292, test_f1: 0.5575
 epoch: 26, train_loss: 0.7435, test_loss: 0.9656, test_f1: 0.5621
 epoch: 27, train_loss: 0.7219, test_loss: 1.0096, test_f1: 0.5743
 epoch: 28, train_loss: 0.7025, test_loss: 1.7611, test_f1: 0.5097
 epoch: 29, train_loss: 0.7020, test_loss: 1.8280, test_f1: 0.5090
 epoch: 30, train_loss: 0.7790, test_loss: 1.5071, test_f1: 0.4509
 epoch: 31, train_loss: 0.7498, test_loss: 1.0336, test_f1: 0.5655
 epoch: 32, train_loss: 0.7756, test_loss: 0.9737, test_f1: 0.5824
 epoch: 33, train_loss: 0.7407, test_loss: 1.0097, test_f1: 0.5870
 epoch: 34, train_loss: 0.7334, test_loss: 1.1774, test_f1: 0.5604
 epoch: 35, train_loss: 0.7708, test_loss: 1.0813, test_f1: 0.5864
 epoch: 36, train_loss: 0.7170, test_loss: 1.1692, test_f1: 0.4918
 epoch: 37, train_loss: 0.7127, test_loss: 1.0291, test_f1: 0.5855
 epoch: 38, train_loss: 0.7097, test_loss: 1.0014, test_f1: 0.5985
 epoch: 39, train_loss: 0.7001, test_loss: 1.1842, test_f1: 0.5832
 epoch: 40, train_loss: 0.6906, test_loss: 1.2153, test_f1: 0.5346
 epoch: 41, train_loss: 0.7016, test_loss: 1.1417, test_f1: 0.5439
 epoch: 42, train_loss: 0.6870, test_loss: 1.0848, test_f1: 0.5877
 epoch: 43, train_loss: 0.6718, test_loss: 1.2780, test_f1: 0.5396
 epoch: 44, train_loss: 0.6777, test_loss: 1.0626, test_f1: 0.5992
 epoch: 45, train_loss: 0.6933, test_loss: 1.0747, test_f1: 0.5797
 epoch: 46, train_loss: 0.6806, test_loss: 1.1343, test_f1: 0.5832
 epoch: 47, train_loss: 0.6813, test_loss: 0.9822, test_f1: 0.6180
 epoch: 48, train_loss: 0.6722, test_loss: 1.0230, test_f1: 0.6223
 epoch: 49, train_loss: 0.6857, test_loss: 1.1977, test_f1: 0.5299
 epoch: 50, train_loss: 0.6738, test_loss: 1.2874, test_f1: 0.5388
 epoch: 51, train_loss: 0.6455, test_loss: 1.1334, test_f1: 0.5605
 epoch: 52, train_loss: 0.6401, test_loss: 1.0968, test_f1: 0.5940
 epoch: 53, train_loss: 0.6421, test_loss: 1.1192, test_f1: 0.5796
 epoch: 54, train_loss: 0.6358, test_loss: 1.1243, test_f1: 0.5862
 epoch: 55, train_loss: 0.6587, test_loss: 0.9953, test_f1: 0.6056
 epoch: 56, train_loss: 0.6270, test_loss: 1.3402, test_f1: 0.5564
 epoch: 57, train_loss: 0.6240, test_loss: 1.1701, test_f1: 0.6003
 epoch: 58, train_loss: 0.6289, test_loss: 1.1256, test_f1: 0.6020
 epoch: 59, train_loss: 0.6180, test_loss: 1.0800, test_f1: 0.6016
 epoch: 60, train_loss: 0.6215, test_loss: 1.1353, test_f1: 0.5910
 epoch: 61, train_loss: 0.6141, test_loss: 1.2350, test_f1: 0.5714
 epoch: 62, train_loss: 0.6141, test_loss: 1.2299, test_f1: 0.5645
 epoch: 63, train_loss: 0.5925, test_loss: 1.2563, test_f1: 0.5618
 epoch: 64, train_loss: 0.6214, test_loss: 1.1870, test_f1: 0.5571
 epoch: 65, train_loss: 0.6162, test_loss: 1.6243, test_f1: 0.5293
 epoch: 66, train_loss: 0.5928, test_loss: 1.2673, test_f1: 0.5612
 epoch: 67, train_loss: 0.6120, test_loss: 1.1782, test_f1: 0.6316
 epoch: 68, train_loss: 0.6146, test_loss: 1.2966, test_f1: 0.6050
 epoch: 69, train_loss: 0.6022, test_loss: 1.2835, test_f1: 0.6063
 epoch: 70, train_loss: 0.6013, test_loss: 1.1887, test_f1: 0.6305
 epoch: 71, train_loss: 0.5920, test_loss: 1.3928, test_f1: 0.5968
 epoch: 72, train_loss: 0.6043, test_loss: 1.2498, test_f1: 0.6055
 epoch: 73, train_loss: 0.6231, test_loss: 1.1756, test_f1: 0.6408
 epoch: 74, train_loss: 0.6147, test_loss: 1.1970, test_f1: 0.6398
 epoch: 75, train_loss: 0.5937, test_loss: 1.9473, test_f1: 0.5463
 epoch: 76, train_loss: 0.5826, test_loss: 1.1840, test_f1: 0.6208
 epoch: 77, train_loss: 0.6122, test_loss: 1.2195, test_f1: 0.6036
 epoch: 78, train_loss: 0.5928, test_loss: 1.0558, test_f1: 0.6401
 epoch: 79, train_loss: 0.5884, test_loss: 1.2091, test_f1: 0.6030
 epoch: 80, train_loss: 0.5825, test_loss: 1.2856, test_f1: 0.5666
 epoch: 81, train_loss: 0.5840, test_loss: 1.1979, test_f1: 0.6399
 epoch: 82, train_loss: 0.5757, test_loss: 1.1288, test_f1: 0.6128
 epoch: 83, train_loss: 0.5770, test_loss: 1.1634, test_f1: 0.6505
 epoch: 84, train_loss: 0.5674, test_loss: 1.2828, test_f1: 0.6078
 epoch: 85, train_loss: 0.5482, test_loss: 1.3583, test_f1: 0.5904
 epoch: 86, train_loss: 0.5565, test_loss: 1.4736, test_f1: 0.6012
 epoch: 87, train_loss: 0.5596, test_loss: 1.4283, test_f1: 0.6290
 epoch: 88, train_loss: 0.5819, test_loss: 1.2372, test_f1: 0.6542
 epoch: 89, train_loss: 0.6000, test_loss: 1.2995, test_f1: 0.5767
 epoch: 90, train_loss: 0.6567, test_loss: 1.3771, test_f1: 0.5541
 epoch: 91, train_loss: 0.6400, test_loss: 1.5520, test_f1: 0.5467
 epoch: 92, train_loss: 0.5877, test_loss: 1.3169, test_f1: 0.5825
 epoch: 93, train_loss: 0.6083, test_loss: 1.0998, test_f1: 0.6013
 epoch: 94, train_loss: 0.5567, test_loss: 1.1617, test_f1: 0.6366
 epoch: 95, train_loss: 0.5702, test_loss: 1.1163, test_f1: 0.6269
 epoch: 96, train_loss: 0.5564, test_loss: 1.5145, test_f1: 0.5384
 epoch: 97, train_loss: 0.5822, test_loss: 2.0392, test_f1: 0.5649
 epoch: 98, train_loss: 0.5764, test_loss: 1.2061, test_f1: 0.6212
 epoch: 99, train_loss: 0.5910, test_loss: 1.4641, test_f1: 0.5548
##################ITERATION #8 ****************************************
 epoch: 0, train_loss: 1.2879, test_loss: 1.5031, test_f1: 0.3125
 epoch: 1, train_loss: 1.0135, test_loss: 1.3830, test_f1: 0.3589
 epoch: 2, train_loss: 0.9377, test_loss: 1.2836, test_f1: 0.4199
 epoch: 3, train_loss: 0.8810, test_loss: 1.2357, test_f1: 0.4415
 epoch: 4, train_loss: 0.8636, test_loss: 1.0649, test_f1: 0.5452
 epoch: 5, train_loss: 0.8421, test_loss: 1.0716, test_f1: 0.5123
 epoch: 6, train_loss: 0.8520, test_loss: 1.6403, test_f1: 0.4266
 epoch: 7, train_loss: 0.8428, test_loss: 1.5446, test_f1: 0.4618
 epoch: 8, train_loss: 0.8027, test_loss: 0.9928, test_f1: 0.5640
 epoch: 9, train_loss: 0.7839, test_loss: 1.0480, test_f1: 0.5840
 epoch: 10, train_loss: 0.7859, test_loss: 1.4421, test_f1: 0.4662
 epoch: 11, train_loss: 0.8043, test_loss: 1.1458, test_f1: 0.5306
 epoch: 12, train_loss: 0.7761, test_loss: 1.0324, test_f1: 0.5576
 epoch: 13, train_loss: 0.7888, test_loss: 1.0935, test_f1: 0.5110
 epoch: 14, train_loss: 0.7444, test_loss: 1.0537, test_f1: 0.5553
 epoch: 15, train_loss: 0.7363, test_loss: 2.2557, test_f1: 0.3972
 epoch: 16, train_loss: 0.7503, test_loss: 1.5458, test_f1: 0.4946
 epoch: 17, train_loss: 0.7390, test_loss: 1.0848, test_f1: 0.5902
 epoch: 18, train_loss: 0.7149, test_loss: 1.9077, test_f1: 0.4897
 epoch: 19, train_loss: 0.7298, test_loss: 1.1020, test_f1: 0.5718
 epoch: 20, train_loss: 0.7308, test_loss: 1.0110, test_f1: 0.5754
 epoch: 21, train_loss: 0.7204, test_loss: 1.0311, test_f1: 0.5958
 epoch: 22, train_loss: 0.7158, test_loss: 1.1348, test_f1: 0.5551
 epoch: 23, train_loss: 0.7238, test_loss: 0.9892, test_f1: 0.5854
 epoch: 24, train_loss: 0.7283, test_loss: 1.0656, test_f1: 0.5991
 epoch: 25, train_loss: 0.7170, test_loss: 0.9674, test_f1: 0.6191
 epoch: 26, train_loss: 0.7111, test_loss: 1.0195, test_f1: 0.5968
 epoch: 27, train_loss: 0.7369, test_loss: 1.1798, test_f1: 0.5253
 epoch: 28, train_loss: 0.7120, test_loss: 1.1048, test_f1: 0.5141
 epoch: 29, train_loss: 0.7112, test_loss: 0.9788, test_f1: 0.6129
 epoch: 30, train_loss: 0.6935, test_loss: 0.9762, test_f1: 0.5902
 epoch: 31, train_loss: 0.6823, test_loss: 1.0376, test_f1: 0.5963
 epoch: 32, train_loss: 0.6696, test_loss: 1.1930, test_f1: 0.6056
 epoch: 33, train_loss: 0.6798, test_loss: 1.0994, test_f1: 0.5774
 epoch: 34, train_loss: 0.6802, test_loss: 1.2915, test_f1: 0.3945
 epoch: 35, train_loss: 0.7254, test_loss: 1.7430, test_f1: 0.4343
 epoch: 36, train_loss: 0.7354, test_loss: 1.6667, test_f1: 0.4760
 epoch: 37, train_loss: 0.7180, test_loss: 1.0632, test_f1: 0.5929
 epoch: 38, train_loss: 0.6771, test_loss: 1.0445, test_f1: 0.5770
 epoch: 39, train_loss: 0.6700, test_loss: 1.0851, test_f1: 0.6037
 epoch: 40, train_loss: 0.6695, test_loss: 1.1645, test_f1: 0.6373
 epoch: 41, train_loss: 0.6717, test_loss: 1.2368, test_f1: 0.5908
 epoch: 42, train_loss: 0.6526, test_loss: 1.2326, test_f1: 0.6137
 epoch: 43, train_loss: 0.6874, test_loss: 1.1591, test_f1: 0.5960
 epoch: 44, train_loss: 0.6637, test_loss: 1.3300, test_f1: 0.4636
 epoch: 45, train_loss: 0.6489, test_loss: 1.3760, test_f1: 0.6189
 epoch: 46, train_loss: 0.6708, test_loss: 1.2968, test_f1: 0.4533
 epoch: 47, train_loss: 0.6807, test_loss: 1.3847, test_f1: 0.5879
 epoch: 48, train_loss: 0.6654, test_loss: 1.4680, test_f1: 0.5466
 epoch: 49, train_loss: 0.6446, test_loss: 1.1073, test_f1: 0.6276
 epoch: 50, train_loss: 0.6370, test_loss: 1.2991, test_f1: 0.6015
 epoch: 51, train_loss: 0.6476, test_loss: 1.3188, test_f1: 0.6067
 epoch: 52, train_loss: 0.6190, test_loss: 1.2150, test_f1: 0.6120
 epoch: 53, train_loss: 0.6089, test_loss: 1.1603, test_f1: 0.6017
 epoch: 54, train_loss: 0.5935, test_loss: 1.4140, test_f1: 0.6231
 epoch: 55, train_loss: 0.5672, test_loss: 1.4176, test_f1: 0.6175
 epoch: 56, train_loss: 0.5846, test_loss: 1.3520, test_f1: 0.6263
 epoch: 57, train_loss: 0.5688, test_loss: 1.5116, test_f1: 0.5765
 epoch: 58, train_loss: 0.6082, test_loss: 1.3573, test_f1: 0.5749
 epoch: 59, train_loss: 0.6034, test_loss: 1.4876, test_f1: 0.5647
 epoch: 60, train_loss: 0.6081, test_loss: 1.2652, test_f1: 0.6075
 epoch: 61, train_loss: 0.5817, test_loss: 1.5154, test_f1: 0.5676
 epoch: 62, train_loss: 0.5604, test_loss: 1.1984, test_f1: 0.6458
 epoch: 63, train_loss: 0.5510, test_loss: 1.2913, test_f1: 0.5443
 epoch: 64, train_loss: 0.5519, test_loss: 1.3709, test_f1: 0.5862
 epoch: 65, train_loss: 0.5666, test_loss: 1.4248, test_f1: 0.5555
 epoch: 66, train_loss: 0.5628, test_loss: 1.5136, test_f1: 0.6314
 epoch: 67, train_loss: 0.5556, test_loss: 1.4480, test_f1: 0.6011
 epoch: 68, train_loss: 0.5588, test_loss: 1.3242, test_f1: 0.5488
 epoch: 69, train_loss: 0.5481, test_loss: 1.2884, test_f1: 0.5612
 epoch: 70, train_loss: 0.5458, test_loss: 1.5112, test_f1: 0.5867
 epoch: 71, train_loss: 0.5456, test_loss: 1.4811, test_f1: 0.5410
 epoch: 72, train_loss: 0.5710, test_loss: 1.4300, test_f1: 0.6029
 epoch: 73, train_loss: 0.5614, test_loss: 1.5652, test_f1: 0.6043
 epoch: 74, train_loss: 0.5581, test_loss: 1.6348, test_f1: 0.6070
 epoch: 75, train_loss: 0.5247, test_loss: 1.6004, test_f1: 0.5818
 epoch: 76, train_loss: 0.5391, test_loss: 1.5364, test_f1: 0.6031
 epoch: 77, train_loss: 0.5656, test_loss: 1.7260, test_f1: 0.5406
 epoch: 78, train_loss: 0.5541, test_loss: 1.3317, test_f1: 0.6137
 epoch: 79, train_loss: 0.5409, test_loss: 1.3436, test_f1: 0.6318
 epoch: 80, train_loss: 0.5236, test_loss: 1.6405, test_f1: 0.6044
 epoch: 81, train_loss: 0.5223, test_loss: 1.5188, test_f1: 0.5755
 epoch: 82, train_loss: 0.5329, test_loss: 1.6538, test_f1: 0.6176
 epoch: 83, train_loss: 0.5333, test_loss: 1.3002, test_f1: 0.6439
 epoch: 84, train_loss: 0.4973, test_loss: 1.7171, test_f1: 0.5554
 epoch: 85, train_loss: 0.5161, test_loss: 1.5892, test_f1: 0.6137
 epoch: 86, train_loss: 0.5118, test_loss: 1.7352, test_f1: 0.5814
 epoch: 87, train_loss: 0.4893, test_loss: 1.5470, test_f1: 0.5764
 epoch: 88, train_loss: 0.4833, test_loss: 1.9352, test_f1: 0.4879
 epoch: 89, train_loss: 0.4957, test_loss: 2.3652, test_f1: 0.4965
 epoch: 90, train_loss: 0.5309, test_loss: 1.3505, test_f1: 0.5821
 epoch: 91, train_loss: 0.5122, test_loss: 1.5450, test_f1: 0.5060
 epoch: 92, train_loss: 0.5077, test_loss: 1.5665, test_f1: 0.6110
 epoch: 93, train_loss: 0.5179, test_loss: 1.7676, test_f1: 0.6183
 epoch: 94, train_loss: 0.5009, test_loss: 2.6945, test_f1: 0.5483
 epoch: 95, train_loss: 0.4854, test_loss: 1.7347, test_f1: 0.4873
 epoch: 96, train_loss: 0.4929, test_loss: 1.4117, test_f1: 0.5973
 epoch: 97, train_loss: 0.4902, test_loss: 1.5908, test_f1: 0.6000
 epoch: 98, train_loss: 0.4750, test_loss: 2.7384, test_f1: 0.5611
 epoch: 99, train_loss: 0.4657, test_loss: 2.0003, test_f1: 0.5850
##################ITERATION #9 ****************************************
 epoch: 0, train_loss: 1.3582, test_loss: 1.5636, test_f1: 0.3388
 epoch: 1, train_loss: 1.0632, test_loss: 1.4787, test_f1: 0.2668
 epoch: 2, train_loss: 0.9784, test_loss: 1.1484, test_f1: 0.5096
 epoch: 3, train_loss: 0.9543, test_loss: 1.1010, test_f1: 0.5540
 epoch: 4, train_loss: 0.9075, test_loss: 1.0168, test_f1: 0.5638
 epoch: 5, train_loss: 0.8741, test_loss: 0.9927, test_f1: 0.5845
 epoch: 6, train_loss: 0.8700, test_loss: 1.0557, test_f1: 0.5566
 epoch: 7, train_loss: 0.8303, test_loss: 1.0721, test_f1: 0.5676
 epoch: 8, train_loss: 0.8458, test_loss: 0.9945, test_f1: 0.5733
 epoch: 9, train_loss: 0.8202, test_loss: 1.0741, test_f1: 0.5150
 epoch: 10, train_loss: 0.8163, test_loss: 1.0447, test_f1: 0.6141
 epoch: 11, train_loss: 0.8183, test_loss: 0.9456, test_f1: 0.6016
 epoch: 12, train_loss: 0.7943, test_loss: 0.9779, test_f1: 0.5900
 epoch: 13, train_loss: 0.7842, test_loss: 0.9970, test_f1: 0.5591
 epoch: 14, train_loss: 0.7832, test_loss: 1.1423, test_f1: 0.5679
 epoch: 15, train_loss: 0.7603, test_loss: 1.0606, test_f1: 0.6051
 epoch: 16, train_loss: 0.7432, test_loss: 1.0392, test_f1: 0.5392
 epoch: 17, train_loss: 0.7387, test_loss: 1.0350, test_f1: 0.5167
 epoch: 18, train_loss: 0.7318, test_loss: 1.4134, test_f1: 0.4694
 epoch: 19, train_loss: 0.7393, test_loss: 0.9421, test_f1: 0.6061
 epoch: 20, train_loss: 0.7309, test_loss: 1.1617, test_f1: 0.5542
 epoch: 21, train_loss: 0.7228, test_loss: 1.0783, test_f1: 0.5816
 epoch: 22, train_loss: 0.7152, test_loss: 1.1415, test_f1: 0.5354
 epoch: 23, train_loss: 0.7270, test_loss: 1.0887, test_f1: 0.5977
 epoch: 24, train_loss: 0.7023, test_loss: 1.5943, test_f1: 0.5205
 epoch: 25, train_loss: 0.7913, test_loss: 1.1795, test_f1: 0.5275
 epoch: 26, train_loss: 0.7361, test_loss: 1.0048, test_f1: 0.6090
 epoch: 27, train_loss: 0.7114, test_loss: 1.2639, test_f1: 0.5452
 epoch: 28, train_loss: 0.7021, test_loss: 1.0267, test_f1: 0.6012
 epoch: 29, train_loss: 0.6909, test_loss: 1.0908, test_f1: 0.5883
 epoch: 30, train_loss: 0.6840, test_loss: 0.9464, test_f1: 0.6210
 epoch: 31, train_loss: 0.6903, test_loss: 1.2272, test_f1: 0.6315
 epoch: 32, train_loss: 0.6982, test_loss: 1.2447, test_f1: 0.6194
 epoch: 33, train_loss: 0.6767, test_loss: 1.0502, test_f1: 0.6018
 epoch: 34, train_loss: 0.6742, test_loss: 1.0388, test_f1: 0.6145
 epoch: 35, train_loss: 0.6491, test_loss: 0.9768, test_f1: 0.6293
 epoch: 36, train_loss: 0.6343, test_loss: 0.9832, test_f1: 0.6028
 epoch: 37, train_loss: 0.6413, test_loss: 1.1133, test_f1: 0.5972
 epoch: 38, train_loss: 0.6352, test_loss: 0.9495, test_f1: 0.6422
 epoch: 39, train_loss: 0.6304, test_loss: 1.0725, test_f1: 0.6239
 epoch: 40, train_loss: 0.6101, test_loss: 1.1972, test_f1: 0.6042
 epoch: 41, train_loss: 0.6283, test_loss: 1.9770, test_f1: 0.3999
 epoch: 42, train_loss: 0.6387, test_loss: 1.4237, test_f1: 0.6328
 epoch: 43, train_loss: 0.6173, test_loss: 1.4530, test_f1: 0.5433
 epoch: 44, train_loss: 0.5916, test_loss: 1.0483, test_f1: 0.6391
 epoch: 45, train_loss: 0.6123, test_loss: 1.2809, test_f1: 0.5847
 epoch: 46, train_loss: 0.6126, test_loss: 1.4002, test_f1: 0.5427
 epoch: 47, train_loss: 0.6161, test_loss: 1.4745, test_f1: 0.6168
 epoch: 48, train_loss: 0.6111, test_loss: 1.3490, test_f1: 0.5694
 epoch: 49, train_loss: 0.5829, test_loss: 1.0510, test_f1: 0.6362
 epoch: 50, train_loss: 0.5622, test_loss: 1.4181, test_f1: 0.6030
 epoch: 51, train_loss: 0.5832, test_loss: 1.3425, test_f1: 0.6301
 epoch: 52, train_loss: 0.5418, test_loss: 1.3057, test_f1: 0.5719
 epoch: 53, train_loss: 0.5390, test_loss: 1.4815, test_f1: 0.6124
 epoch: 54, train_loss: 0.5596, test_loss: 1.4673, test_f1: 0.6219
 epoch: 55, train_loss: 0.5210, test_loss: 1.3237, test_f1: 0.6410
 epoch: 56, train_loss: 0.5749, test_loss: 1.1052, test_f1: 0.6342
 epoch: 57, train_loss: 0.5500, test_loss: 1.1985, test_f1: 0.6429
 epoch: 58, train_loss: 0.5352, test_loss: 1.2365, test_f1: 0.6374
 epoch: 59, train_loss: 0.5118, test_loss: 1.2465, test_f1: 0.6472
 epoch: 60, train_loss: 0.4989, test_loss: 1.2516, test_f1: 0.6460
 epoch: 61, train_loss: 0.4753, test_loss: 1.3562, test_f1: 0.6229
 epoch: 62, train_loss: 0.4872, test_loss: 1.3979, test_f1: 0.6386
 epoch: 63, train_loss: 0.5199, test_loss: 1.2357, test_f1: 0.6355
 epoch: 64, train_loss: 0.5471, test_loss: 1.5161, test_f1: 0.5311
 epoch: 65, train_loss: 0.5181, test_loss: 1.8176, test_f1: 0.5834
 epoch: 66, train_loss: 0.4727, test_loss: 1.4559, test_f1: 0.5614
 epoch: 67, train_loss: 0.4766, test_loss: 1.4178, test_f1: 0.6425
 epoch: 68, train_loss: 0.4536, test_loss: 1.4144, test_f1: 0.6664
 epoch: 69, train_loss: 0.4623, test_loss: 1.5006, test_f1: 0.6224
 epoch: 70, train_loss: 0.4728, test_loss: 1.3926, test_f1: 0.6457
 epoch: 71, train_loss: 0.4704, test_loss: 1.5423, test_f1: 0.6281
 epoch: 72, train_loss: 0.4871, test_loss: 1.5777, test_f1: 0.6166
 epoch: 73, train_loss: 0.4739, test_loss: 1.5280, test_f1: 0.6697
 epoch: 74, train_loss: 0.4608, test_loss: 1.6057, test_f1: 0.6436
 epoch: 75, train_loss: 0.4718, test_loss: 1.3375, test_f1: 0.6531
 epoch: 76, train_loss: 0.4273, test_loss: 1.5582, test_f1: 0.6661
 epoch: 77, train_loss: 0.4383, test_loss: 1.7013, test_f1: 0.6360
 epoch: 78, train_loss: 0.4395, test_loss: 1.5298, test_f1: 0.6724
 epoch: 79, train_loss: 0.4221, test_loss: 1.7932, test_f1: 0.6713
 epoch: 80, train_loss: 0.4575, test_loss: 1.8076, test_f1: 0.6343
 epoch: 81, train_loss: 0.4280, test_loss: 1.5032, test_f1: 0.6347
 epoch: 82, train_loss: 0.4128, test_loss: 1.6313, test_f1: 0.6166
 epoch: 83, train_loss: 0.4642, test_loss: 1.8926, test_f1: 0.6290
 epoch: 84, train_loss: 0.4444, test_loss: 1.7521, test_f1: 0.6330
 epoch: 85, train_loss: 0.4093, test_loss: 1.5272, test_f1: 0.6382
 epoch: 86, train_loss: 0.3874, test_loss: 1.7759, test_f1: 0.6603
 epoch: 87, train_loss: 0.3832, test_loss: 1.6819, test_f1: 0.6397
 epoch: 88, train_loss: 0.3920, test_loss: 1.8916, test_f1: 0.6544
 epoch: 89, train_loss: 0.3943, test_loss: 1.7251, test_f1: 0.6443
 epoch: 90, train_loss: 0.4567, test_loss: 1.7762, test_f1: 0.6626
 epoch: 91, train_loss: 0.4097, test_loss: 1.9365, test_f1: 0.6673
 epoch: 92, train_loss: 0.3844, test_loss: 1.6656, test_f1: 0.6683
 epoch: 93, train_loss: 0.3597, test_loss: 1.6301, test_f1: 0.6705
 epoch: 94, train_loss: 0.3766, test_loss: 2.0661, test_f1: 0.6670
 epoch: 95, train_loss: 0.3680, test_loss: 1.9277, test_f1: 0.5875
 epoch: 96, train_loss: 0.3776, test_loss: 2.0064, test_f1: 0.6480
 epoch: 97, train_loss: 0.3937, test_loss: 1.7112, test_f1: 0.6243
 epoch: 98, train_loss: 0.3633, test_loss: 1.9088, test_f1: 0.6416
 epoch: 99, train_loss: 0.3730, test_loss: 1.6396, test_f1: 0.6408

Training completed in 336.99 seconds
Best F1: 0.6884 at epoch 83
Mean F1 across iterations: 0.6683  0.0129
========================FINAL RESULTS================================
FEGIN weighted F1: 0.6884  0.0129
python main.py --data ltspice_demos --representation component_pin --model FEGIN --layers 3 --hiddens 32 --batch_size 128 --lr 0.01 --emb_size 128 --epochs 100 --save_appendix component_pin_L3_H32_BS128_LR0.01_E128 --no_val
-----



STDERR:
  File "main.py", line 370, in <module>
    main()
  File "main.py", line 254, in main
    dataset = dataset_class(
  File "/home/philip/projects/ltspice_examples_code_repo/Circuit-Completion-Using-GNNs/component_classification_with_link_prediction_head/evaluation/FEGIN/kernel/circuit_datasets.py", line 15, in __init__
    self.data, self.slices = torch.load(self.processed_paths[0])
  File "/home/philip/.local/lib/python3.8/site-packages/torch/serialization.py", line 1040, in load
    warnings.warn(
  File "/usr/lib/python3.8/warnings.py", line 109, in _showwarnmsg
    sw(msg.message, msg.category, msg.filename, msg.lineno,
  File "main.py", line 47, in warn_with_traceback
    traceback.print_stack(file=log)
/home/philip/projects/ltspice_examples_code_repo/Circuit-Completion-Using-GNNs/component_classification_with_link_prediction_head/evaluation/FEGIN/kernel/circuit_datasets.py:15: FutureWarning: You are using `torch.load` with `weights_only=False` (the current default value), which uses the default pickle module implicitly. It is possible to construct malicious pickle data which will execute arbitrary code during unpickling (See https://github.com/pytorch/pytorch/blob/main/SECURITY.md#untrusted-models for more details). In a future release, the default value for `weights_only` will be flipped to `True`. This limits the functions that could be executed during unpickling. Arbitrary objects will no longer be allowed to be loaded via this mode unless they are explicitly allowlisted by the user via `torch.serialization.add_safe_globals`. We recommend you start setting `weights_only=True` for any use case where you don't have full control of the loaded file. Please open an issue on GitHub for any issues related to this experimental feature.
  self.data, self.slices = torch.load(self.processed_paths[0])
