STDOUT:
Results will be saved in /home/philip/projects/ltspice_examples_code_repo/Circuit-Completion-Using-GNNs/component_classification_with_link_prediction_head/evaluation/FEGIN/results/model_FEGIN_dataset_ltspice_demos
Command line input: python main.py --data ltspice_demos --representation component_pin --model FEGIN --layers 2 --hiddens 128 --batch_size 32 --lr 0.0001 --emb_size 128 --epochs 100 --save_appendix component_pin_L2_H128_BS32_LR0.0001_E128 --no_val
 is saved.
-----
ltspice_demos - FEGIN
Using 2 layers, 128 hidden units, h = 2
Loading component_pin representation dataset
ENTERED
Training FEGIN on component_pin representation
Train: 1565, Test: 383
##################ITERATION #0 ****************************************
 epoch: 0, train_loss: 1.3518, test_loss: 1.3472, test_f1: 0.3381
 epoch: 1, train_loss: 1.3004, test_loss: 1.3039, test_f1: 0.2850
 epoch: 2, train_loss: 1.2428, test_loss: 1.2570, test_f1: 0.2872
 epoch: 3, train_loss: 1.1858, test_loss: 1.2236, test_f1: 0.4237
 epoch: 4, train_loss: 1.1398, test_loss: 1.1910, test_f1: 0.4522
 epoch: 5, train_loss: 1.1031, test_loss: 1.1471, test_f1: 0.4533
 epoch: 6, train_loss: 1.0565, test_loss: 1.1174, test_f1: 0.4548
 epoch: 7, train_loss: 1.0252, test_loss: 1.0901, test_f1: 0.4567
 epoch: 8, train_loss: 1.0029, test_loss: 1.0635, test_f1: 0.4579
 epoch: 9, train_loss: 0.9810, test_loss: 1.0514, test_f1: 0.4527
 epoch: 10, train_loss: 0.9642, test_loss: 1.0397, test_f1: 0.4635
 epoch: 11, train_loss: 0.9475, test_loss: 1.0125, test_f1: 0.4514
 epoch: 12, train_loss: 0.9268, test_loss: 1.0214, test_f1: 0.4796
 epoch: 13, train_loss: 0.9066, test_loss: 0.9956, test_f1: 0.5376
 epoch: 14, train_loss: 0.8895, test_loss: 0.9873, test_f1: 0.5431
 epoch: 15, train_loss: 0.8760, test_loss: 0.9779, test_f1: 0.5709
 epoch: 16, train_loss: 0.8574, test_loss: 0.9610, test_f1: 0.5800
 epoch: 17, train_loss: 0.8434, test_loss: 0.9633, test_f1: 0.6132
 epoch: 18, train_loss: 0.8259, test_loss: 0.9716, test_f1: 0.6236
 epoch: 19, train_loss: 0.8008, test_loss: 0.9640, test_f1: 0.6066
 epoch: 20, train_loss: 0.7944, test_loss: 0.9623, test_f1: 0.6201
 epoch: 21, train_loss: 0.7736, test_loss: 0.9494, test_f1: 0.6307
 epoch: 22, train_loss: 0.7609, test_loss: 0.9514, test_f1: 0.6149
 epoch: 23, train_loss: 0.7536, test_loss: 0.9584, test_f1: 0.6111
 epoch: 24, train_loss: 0.7337, test_loss: 0.9534, test_f1: 0.6241
 epoch: 25, train_loss: 0.7155, test_loss: 0.9563, test_f1: 0.6030
 epoch: 26, train_loss: 0.7109, test_loss: 0.9484, test_f1: 0.5963
 epoch: 27, train_loss: 0.7022, test_loss: 0.9652, test_f1: 0.6147
 epoch: 28, train_loss: 0.6851, test_loss: 0.9653, test_f1: 0.5944
 epoch: 29, train_loss: 0.6889, test_loss: 0.9971, test_f1: 0.6006
 epoch: 30, train_loss: 0.6731, test_loss: 0.9511, test_f1: 0.6133
 epoch: 31, train_loss: 0.6668, test_loss: 0.9813, test_f1: 0.6125
 epoch: 32, train_loss: 0.6598, test_loss: 1.0224, test_f1: 0.5956
 epoch: 33, train_loss: 0.6610, test_loss: 0.9872, test_f1: 0.6131
 epoch: 34, train_loss: 0.6437, test_loss: 0.9763, test_f1: 0.6312
 epoch: 35, train_loss: 0.6286, test_loss: 1.0135, test_f1: 0.6196
 epoch: 36, train_loss: 0.6417, test_loss: 1.0251, test_f1: 0.5911
 epoch: 37, train_loss: 0.6296, test_loss: 0.9562, test_f1: 0.6046
 epoch: 38, train_loss: 0.6381, test_loss: 0.9885, test_f1: 0.6138
 epoch: 39, train_loss: 0.6135, test_loss: 1.0221, test_f1: 0.6100
 epoch: 40, train_loss: 0.6042, test_loss: 1.0357, test_f1: 0.6055
 epoch: 41, train_loss: 0.6084, test_loss: 1.0117, test_f1: 0.5983
 epoch: 42, train_loss: 0.5855, test_loss: 1.0487, test_f1: 0.6192
 epoch: 43, train_loss: 0.5733, test_loss: 0.9963, test_f1: 0.5930
 epoch: 44, train_loss: 0.5765, test_loss: 1.0489, test_f1: 0.6105
 epoch: 45, train_loss: 0.5845, test_loss: 1.0098, test_f1: 0.6200
 epoch: 46, train_loss: 0.5651, test_loss: 1.0450, test_f1: 0.5990
 epoch: 47, train_loss: 0.5837, test_loss: 1.0201, test_f1: 0.6327
 epoch: 48, train_loss: 0.5573, test_loss: 0.9857, test_f1: 0.6310
 epoch: 49, train_loss: 0.5478, test_loss: 0.9975, test_f1: 0.6416
 epoch: 50, train_loss: 0.5542, test_loss: 1.0799, test_f1: 0.5755
 epoch: 51, train_loss: 0.5223, test_loss: 1.0206, test_f1: 0.6216
 epoch: 52, train_loss: 0.5226, test_loss: 1.0866, test_f1: 0.5833
 epoch: 53, train_loss: 0.5206, test_loss: 1.0511, test_f1: 0.5831
 epoch: 54, train_loss: 0.5064, test_loss: 1.0094, test_f1: 0.6250
 epoch: 55, train_loss: 0.5140, test_loss: 1.0680, test_f1: 0.6173
 epoch: 56, train_loss: 0.5201, test_loss: 0.9972, test_f1: 0.6261
 epoch: 57, train_loss: 0.5055, test_loss: 1.0444, test_f1: 0.6045
 epoch: 58, train_loss: 0.4976, test_loss: 1.0475, test_f1: 0.6238
 epoch: 59, train_loss: 0.5099, test_loss: 1.0607, test_f1: 0.6081
 epoch: 60, train_loss: 0.4883, test_loss: 1.1199, test_f1: 0.5649
 epoch: 61, train_loss: 0.4776, test_loss: 1.1227, test_f1: 0.6127
 epoch: 62, train_loss: 0.4853, test_loss: 1.1185, test_f1: 0.6046
 epoch: 63, train_loss: 0.4868, test_loss: 1.1415, test_f1: 0.6068
 epoch: 64, train_loss: 0.4878, test_loss: 1.1300, test_f1: 0.5926
 epoch: 65, train_loss: 0.4923, test_loss: 1.0782, test_f1: 0.6215
 epoch: 66, train_loss: 0.4612, test_loss: 1.1274, test_f1: 0.6077
 epoch: 67, train_loss: 0.4783, test_loss: 1.1170, test_f1: 0.6121
 epoch: 68, train_loss: 0.4641, test_loss: 1.1473, test_f1: 0.6000
 epoch: 69, train_loss: 0.4571, test_loss: 1.1612, test_f1: 0.6125
 epoch: 70, train_loss: 0.4629, test_loss: 1.1318, test_f1: 0.6155
 epoch: 71, train_loss: 0.4549, test_loss: 1.1809, test_f1: 0.6155
 epoch: 72, train_loss: 0.4549, test_loss: 1.0768, test_f1: 0.6388
 epoch: 73, train_loss: 0.4489, test_loss: 1.1451, test_f1: 0.6209
 epoch: 74, train_loss: 0.4484, test_loss: 1.2372, test_f1: 0.5706
 epoch: 75, train_loss: 0.4401, test_loss: 1.2127, test_f1: 0.5968
 epoch: 76, train_loss: 0.4327, test_loss: 1.2235, test_f1: 0.5983
 epoch: 77, train_loss: 0.4424, test_loss: 1.1924, test_f1: 0.6184
 epoch: 78, train_loss: 0.4376, test_loss: 1.2112, test_f1: 0.5777
 epoch: 79, train_loss: 0.4232, test_loss: 1.1506, test_f1: 0.6330
 epoch: 80, train_loss: 0.4293, test_loss: 1.1911, test_f1: 0.6074
 epoch: 81, train_loss: 0.4293, test_loss: 1.2367, test_f1: 0.6035
 epoch: 82, train_loss: 0.4155, test_loss: 1.1922, test_f1: 0.6086
 epoch: 83, train_loss: 0.4220, test_loss: 1.2491, test_f1: 0.6046
 epoch: 84, train_loss: 0.4213, test_loss: 1.2144, test_f1: 0.6236
 epoch: 85, train_loss: 0.4279, test_loss: 1.2524, test_f1: 0.6127
 epoch: 86, train_loss: 0.4115, test_loss: 1.2216, test_f1: 0.6219
 epoch: 87, train_loss: 0.3928, test_loss: 1.2605, test_f1: 0.5838
 epoch: 88, train_loss: 0.4277, test_loss: 1.2324, test_f1: 0.6136
 epoch: 89, train_loss: 0.4211, test_loss: 1.2553, test_f1: 0.6068
 epoch: 90, train_loss: 0.4139, test_loss: 1.1808, test_f1: 0.6220
 epoch: 91, train_loss: 0.3986, test_loss: 1.2256, test_f1: 0.6290
 epoch: 92, train_loss: 0.3849, test_loss: 1.2171, test_f1: 0.6208
 epoch: 93, train_loss: 0.3834, test_loss: 1.2364, test_f1: 0.6180
 epoch: 94, train_loss: 0.3757, test_loss: 1.3294, test_f1: 0.6204
 epoch: 95, train_loss: 0.3838, test_loss: 1.2529, test_f1: 0.6382
 epoch: 96, train_loss: 0.3949, test_loss: 1.2930, test_f1: 0.6163
 epoch: 97, train_loss: 0.3876, test_loss: 1.3167, test_f1: 0.6279
 epoch: 98, train_loss: 0.3736, test_loss: 1.2304, test_f1: 0.6539
 epoch: 99, train_loss: 0.3807, test_loss: 1.3458, test_f1: 0.6330
##################ITERATION #1 ****************************************
 epoch: 0, train_loss: 1.2555, test_loss: 1.2926, test_f1: 0.2614
 epoch: 1, train_loss: 1.1782, test_loss: 1.2271, test_f1: 0.4041
 epoch: 2, train_loss: 1.1319, test_loss: 1.1863, test_f1: 0.4275
 epoch: 3, train_loss: 1.0716, test_loss: 1.1347, test_f1: 0.4212
 epoch: 4, train_loss: 1.0272, test_loss: 1.0953, test_f1: 0.4866
 epoch: 5, train_loss: 0.9852, test_loss: 1.0487, test_f1: 0.5264
 epoch: 6, train_loss: 0.9512, test_loss: 1.0333, test_f1: 0.5497
 epoch: 7, train_loss: 0.9181, test_loss: 1.0069, test_f1: 0.5490
 epoch: 8, train_loss: 0.9053, test_loss: 1.0142, test_f1: 0.5925
 epoch: 9, train_loss: 0.8735, test_loss: 0.9951, test_f1: 0.6004
 epoch: 10, train_loss: 0.8568, test_loss: 0.9873, test_f1: 0.6076
 epoch: 11, train_loss: 0.8388, test_loss: 0.9738, test_f1: 0.5994
 epoch: 12, train_loss: 0.8288, test_loss: 0.9735, test_f1: 0.6064
 epoch: 13, train_loss: 0.7963, test_loss: 0.9812, test_f1: 0.5770
 epoch: 14, train_loss: 0.7800, test_loss: 0.9896, test_f1: 0.5760
 epoch: 15, train_loss: 0.7729, test_loss: 0.9600, test_f1: 0.5965
 epoch: 16, train_loss: 0.7511, test_loss: 0.9929, test_f1: 0.5753
 epoch: 17, train_loss: 0.7370, test_loss: 1.0130, test_f1: 0.5866
 epoch: 18, train_loss: 0.7390, test_loss: 1.0152, test_f1: 0.5841
 epoch: 19, train_loss: 0.7198, test_loss: 1.0143, test_f1: 0.5829
 epoch: 20, train_loss: 0.7062, test_loss: 0.9867, test_f1: 0.5919
 epoch: 21, train_loss: 0.7110, test_loss: 0.9726, test_f1: 0.6059
 epoch: 22, train_loss: 0.6694, test_loss: 0.9876, test_f1: 0.6062
 epoch: 23, train_loss: 0.6760, test_loss: 1.0377, test_f1: 0.6050
 epoch: 24, train_loss: 0.6606, test_loss: 1.0415, test_f1: 0.6016
 epoch: 25, train_loss: 0.6648, test_loss: 1.0511, test_f1: 0.5872
 epoch: 26, train_loss: 0.6348, test_loss: 0.9881, test_f1: 0.5970
 epoch: 27, train_loss: 0.6472, test_loss: 1.0182, test_f1: 0.5842
 epoch: 28, train_loss: 0.6328, test_loss: 0.9765, test_f1: 0.6180
 epoch: 29, train_loss: 0.6159, test_loss: 1.0428, test_f1: 0.6013
 epoch: 30, train_loss: 0.6042, test_loss: 0.9851, test_f1: 0.5840
 epoch: 31, train_loss: 0.5900, test_loss: 1.0529, test_f1: 0.6105
 epoch: 32, train_loss: 0.5880, test_loss: 1.0283, test_f1: 0.5798
 epoch: 33, train_loss: 0.5806, test_loss: 1.0257, test_f1: 0.6023
 epoch: 34, train_loss: 0.5719, test_loss: 1.0522, test_f1: 0.5859
 epoch: 35, train_loss: 0.5823, test_loss: 1.0922, test_f1: 0.6304
 epoch: 36, train_loss: 0.5654, test_loss: 1.1228, test_f1: 0.5899
 epoch: 37, train_loss: 0.5627, test_loss: 1.1957, test_f1: 0.5867
 epoch: 38, train_loss: 0.5359, test_loss: 1.1057, test_f1: 0.6019
 epoch: 39, train_loss: 0.5416, test_loss: 1.0747, test_f1: 0.5895
 epoch: 40, train_loss: 0.5404, test_loss: 1.1786, test_f1: 0.5816
 epoch: 41, train_loss: 0.5154, test_loss: 1.1325, test_f1: 0.5900
 epoch: 42, train_loss: 0.4990, test_loss: 1.1590, test_f1: 0.5987
 epoch: 43, train_loss: 0.4982, test_loss: 1.1428, test_f1: 0.5826
 epoch: 44, train_loss: 0.5132, test_loss: 1.1177, test_f1: 0.6110
 epoch: 45, train_loss: 0.4940, test_loss: 1.2283, test_f1: 0.5929
 epoch: 46, train_loss: 0.4932, test_loss: 1.1936, test_f1: 0.5952
 epoch: 47, train_loss: 0.4713, test_loss: 1.2750, test_f1: 0.5964
 epoch: 48, train_loss: 0.4691, test_loss: 1.3630, test_f1: 0.5743
 epoch: 49, train_loss: 0.4679, test_loss: 1.2797, test_f1: 0.6136
 epoch: 50, train_loss: 0.4564, test_loss: 1.3691, test_f1: 0.6124
 epoch: 51, train_loss: 0.4349, test_loss: 1.3082, test_f1: 0.6131
 epoch: 52, train_loss: 0.4368, test_loss: 1.3317, test_f1: 0.6074
 epoch: 53, train_loss: 0.4278, test_loss: 1.3148, test_f1: 0.5998
 epoch: 54, train_loss: 0.4350, test_loss: 1.3099, test_f1: 0.6288
 epoch: 55, train_loss: 0.4350, test_loss: 1.2910, test_f1: 0.6128
 epoch: 56, train_loss: 0.4179, test_loss: 1.3791, test_f1: 0.6058
 epoch: 57, train_loss: 0.4356, test_loss: 1.3294, test_f1: 0.6285
 epoch: 58, train_loss: 0.4078, test_loss: 1.3582, test_f1: 0.6105
 epoch: 59, train_loss: 0.3913, test_loss: 1.3652, test_f1: 0.5964
 epoch: 60, train_loss: 0.4143, test_loss: 1.2927, test_f1: 0.6359
 epoch: 61, train_loss: 0.3990, test_loss: 1.3045, test_f1: 0.6229
 epoch: 62, train_loss: 0.3879, test_loss: 1.3935, test_f1: 0.5972
 epoch: 63, train_loss: 0.3834, test_loss: 1.3473, test_f1: 0.6233
 epoch: 64, train_loss: 0.3954, test_loss: 1.3826, test_f1: 0.6057
 epoch: 65, train_loss: 0.3902, test_loss: 1.4051, test_f1: 0.6219
 epoch: 66, train_loss: 0.3776, test_loss: 1.4316, test_f1: 0.5943
 epoch: 67, train_loss: 0.3747, test_loss: 1.3894, test_f1: 0.6258
 epoch: 68, train_loss: 0.3716, test_loss: 1.4091, test_f1: 0.6281
 epoch: 69, train_loss: 0.3753, test_loss: 1.4313, test_f1: 0.6196
 epoch: 70, train_loss: 0.3780, test_loss: 1.4989, test_f1: 0.6085
 epoch: 71, train_loss: 0.3737, test_loss: 1.4924, test_f1: 0.6007
 epoch: 72, train_loss: 0.3697, test_loss: 1.5185, test_f1: 0.5982
 epoch: 73, train_loss: 0.3577, test_loss: 1.4733, test_f1: 0.5968
 epoch: 74, train_loss: 0.3558, test_loss: 1.5600, test_f1: 0.6169
 epoch: 75, train_loss: 0.3549, test_loss: 1.5646, test_f1: 0.5963
 epoch: 76, train_loss: 0.3443, test_loss: 1.5804, test_f1: 0.6111
 epoch: 77, train_loss: 0.3404, test_loss: 1.5510, test_f1: 0.6156
 epoch: 78, train_loss: 0.3301, test_loss: 1.6120, test_f1: 0.6196
 epoch: 79, train_loss: 0.3364, test_loss: 1.5480, test_f1: 0.6278
 epoch: 80, train_loss: 0.3271, test_loss: 1.5399, test_f1: 0.6157
 epoch: 81, train_loss: 0.3288, test_loss: 1.5766, test_f1: 0.6147
 epoch: 82, train_loss: 0.3394, test_loss: 1.6234, test_f1: 0.6125
 epoch: 83, train_loss: 0.3484, test_loss: 1.6080, test_f1: 0.6231
 epoch: 84, train_loss: 0.3233, test_loss: 1.6276, test_f1: 0.6019
 epoch: 85, train_loss: 0.3239, test_loss: 1.6656, test_f1: 0.6147
 epoch: 86, train_loss: 0.3244, test_loss: 1.7139, test_f1: 0.6022
 epoch: 87, train_loss: 0.3170, test_loss: 1.6838, test_f1: 0.6027
 epoch: 88, train_loss: 0.3230, test_loss: 1.5687, test_f1: 0.6075
 epoch: 89, train_loss: 0.3235, test_loss: 1.7129, test_f1: 0.6069
 epoch: 90, train_loss: 0.3018, test_loss: 1.7085, test_f1: 0.6122
 epoch: 91, train_loss: 0.3056, test_loss: 1.6808, test_f1: 0.6127
 epoch: 92, train_loss: 0.3011, test_loss: 1.7076, test_f1: 0.6148
 epoch: 93, train_loss: 0.2909, test_loss: 1.6877, test_f1: 0.6107
 epoch: 94, train_loss: 0.2957, test_loss: 1.8033, test_f1: 0.6001
 epoch: 95, train_loss: 0.2868, test_loss: 1.7519, test_f1: 0.6045
 epoch: 96, train_loss: 0.2980, test_loss: 1.7360, test_f1: 0.6043
 epoch: 97, train_loss: 0.2963, test_loss: 1.7153, test_f1: 0.6097
 epoch: 98, train_loss: 0.3104, test_loss: 1.7689, test_f1: 0.6193
 epoch: 99, train_loss: 0.3014, test_loss: 1.7617, test_f1: 0.6132
##################ITERATION #2 ****************************************
 epoch: 0, train_loss: 1.2205, test_loss: 1.2567, test_f1: 0.3548
 epoch: 1, train_loss: 1.1241, test_loss: 1.1717, test_f1: 0.4394
 epoch: 2, train_loss: 1.0777, test_loss: 1.1334, test_f1: 0.4368
 epoch: 3, train_loss: 1.0347, test_loss: 1.0947, test_f1: 0.4944
 epoch: 4, train_loss: 0.9989, test_loss: 1.0611, test_f1: 0.5257
 epoch: 5, train_loss: 0.9646, test_loss: 1.0288, test_f1: 0.5425
 epoch: 6, train_loss: 0.9308, test_loss: 0.9980, test_f1: 0.5623
 epoch: 7, train_loss: 0.9139, test_loss: 0.9831, test_f1: 0.5921
 epoch: 8, train_loss: 0.8859, test_loss: 0.9690, test_f1: 0.6001
 epoch: 9, train_loss: 0.8656, test_loss: 0.9514, test_f1: 0.5933
 epoch: 10, train_loss: 0.8395, test_loss: 0.9490, test_f1: 0.5964
 epoch: 11, train_loss: 0.8206, test_loss: 0.9424, test_f1: 0.6035
 epoch: 12, train_loss: 0.8035, test_loss: 0.9455, test_f1: 0.6172
 epoch: 13, train_loss: 0.7911, test_loss: 0.9393, test_f1: 0.6225
 epoch: 14, train_loss: 0.7727, test_loss: 0.9494, test_f1: 0.6293
 epoch: 15, train_loss: 0.7380, test_loss: 0.9495, test_f1: 0.6011
 epoch: 16, train_loss: 0.7440, test_loss: 0.9387, test_f1: 0.6501
 epoch: 17, train_loss: 0.7224, test_loss: 0.9759, test_f1: 0.5983
 epoch: 18, train_loss: 0.7098, test_loss: 1.0025, test_f1: 0.5943
 epoch: 19, train_loss: 0.7007, test_loss: 1.0081, test_f1: 0.5871
 epoch: 20, train_loss: 0.6860, test_loss: 0.9940, test_f1: 0.6288
 epoch: 21, train_loss: 0.6936, test_loss: 0.9853, test_f1: 0.5957
 epoch: 22, train_loss: 0.6721, test_loss: 1.0530, test_f1: 0.6210
 epoch: 23, train_loss: 0.6682, test_loss: 0.9843, test_f1: 0.6340
 epoch: 24, train_loss: 0.6528, test_loss: 1.0076, test_f1: 0.6516
 epoch: 25, train_loss: 0.6436, test_loss: 1.0273, test_f1: 0.6399
 epoch: 26, train_loss: 0.6495, test_loss: 1.0213, test_f1: 0.6302
 epoch: 27, train_loss: 0.6195, test_loss: 1.1071, test_f1: 0.6258
 epoch: 28, train_loss: 0.6221, test_loss: 1.0410, test_f1: 0.6505
 epoch: 29, train_loss: 0.6164, test_loss: 1.0458, test_f1: 0.6335
 epoch: 30, train_loss: 0.6007, test_loss: 1.0746, test_f1: 0.6046
 epoch: 31, train_loss: 0.5985, test_loss: 1.0656, test_f1: 0.6209
 epoch: 32, train_loss: 0.5909, test_loss: 1.0851, test_f1: 0.6534
 epoch: 33, train_loss: 0.5707, test_loss: 1.0754, test_f1: 0.6397
 epoch: 34, train_loss: 0.5754, test_loss: 1.1206, test_f1: 0.6272
 epoch: 35, train_loss: 0.5704, test_loss: 1.1993, test_f1: 0.6077
 epoch: 36, train_loss: 0.5529, test_loss: 1.1191, test_f1: 0.6492
 epoch: 37, train_loss: 0.5612, test_loss: 1.1714, test_f1: 0.6175
 epoch: 38, train_loss: 0.5418, test_loss: 1.2107, test_f1: 0.5918
 epoch: 39, train_loss: 0.5329, test_loss: 1.1815, test_f1: 0.5833
 epoch: 40, train_loss: 0.5406, test_loss: 1.1835, test_f1: 0.6544
 epoch: 41, train_loss: 0.5228, test_loss: 1.2652, test_f1: 0.6035
 epoch: 42, train_loss: 0.5191, test_loss: 1.1383, test_f1: 0.6144
 epoch: 43, train_loss: 0.5125, test_loss: 1.2290, test_f1: 0.6234
 epoch: 44, train_loss: 0.5113, test_loss: 1.3111, test_f1: 0.6120
 epoch: 45, train_loss: 0.5099, test_loss: 1.2576, test_f1: 0.6170
 epoch: 46, train_loss: 0.4988, test_loss: 1.2357, test_f1: 0.6281
 epoch: 47, train_loss: 0.4741, test_loss: 1.2973, test_f1: 0.6238
 epoch: 48, train_loss: 0.4791, test_loss: 1.2654, test_f1: 0.6082
 epoch: 49, train_loss: 0.4841, test_loss: 1.2628, test_f1: 0.6141
 epoch: 50, train_loss: 0.4742, test_loss: 1.2440, test_f1: 0.6232
 epoch: 51, train_loss: 0.4566, test_loss: 1.2273, test_f1: 0.6245
 epoch: 52, train_loss: 0.4284, test_loss: 1.3616, test_f1: 0.6160
 epoch: 53, train_loss: 0.4341, test_loss: 1.2971, test_f1: 0.6238
 epoch: 54, train_loss: 0.4354, test_loss: 1.3314, test_f1: 0.6153
 epoch: 55, train_loss: 0.4331, test_loss: 1.3726, test_f1: 0.6128
 epoch: 56, train_loss: 0.4266, test_loss: 1.2857, test_f1: 0.6291
 epoch: 57, train_loss: 0.4153, test_loss: 1.3302, test_f1: 0.6032
 epoch: 58, train_loss: 0.4039, test_loss: 1.3082, test_f1: 0.5997
 epoch: 59, train_loss: 0.4224, test_loss: 1.4465, test_f1: 0.5968
 epoch: 60, train_loss: 0.4078, test_loss: 1.3731, test_f1: 0.6133
 epoch: 61, train_loss: 0.3947, test_loss: 1.4293, test_f1: 0.6140
 epoch: 62, train_loss: 0.4007, test_loss: 1.3825, test_f1: 0.6120
 epoch: 63, train_loss: 0.3973, test_loss: 1.4065, test_f1: 0.6234
 epoch: 64, train_loss: 0.4101, test_loss: 1.4100, test_f1: 0.6095
 epoch: 65, train_loss: 0.3857, test_loss: 1.4021, test_f1: 0.6168
 epoch: 66, train_loss: 0.3809, test_loss: 1.3286, test_f1: 0.6200
 epoch: 67, train_loss: 0.3836, test_loss: 1.4255, test_f1: 0.5966
 epoch: 68, train_loss: 0.3883, test_loss: 1.5462, test_f1: 0.5970
 epoch: 69, train_loss: 0.3829, test_loss: 1.4507, test_f1: 0.6032
 epoch: 70, train_loss: 0.3824, test_loss: 1.4835, test_f1: 0.5974
 epoch: 71, train_loss: 0.3775, test_loss: 1.4335, test_f1: 0.6133
 epoch: 72, train_loss: 0.3566, test_loss: 1.5926, test_f1: 0.5940
 epoch: 73, train_loss: 0.3698, test_loss: 1.5051, test_f1: 0.5937
 epoch: 74, train_loss: 0.3580, test_loss: 1.5502, test_f1: 0.6011
 epoch: 75, train_loss: 0.3468, test_loss: 1.5109, test_f1: 0.6121
 epoch: 76, train_loss: 0.3410, test_loss: 1.4623, test_f1: 0.5939
 epoch: 77, train_loss: 0.3500, test_loss: 1.5535, test_f1: 0.6065
 epoch: 78, train_loss: 0.3552, test_loss: 1.5173, test_f1: 0.5998
 epoch: 79, train_loss: 0.3695, test_loss: 1.5926, test_f1: 0.6026
 epoch: 80, train_loss: 0.3502, test_loss: 1.6218, test_f1: 0.6126
 epoch: 81, train_loss: 0.3363, test_loss: 1.6467, test_f1: 0.6113
 epoch: 82, train_loss: 0.3384, test_loss: 1.5784, test_f1: 0.6077
 epoch: 83, train_loss: 0.3448, test_loss: 1.6325, test_f1: 0.6293
 epoch: 84, train_loss: 0.3412, test_loss: 1.5781, test_f1: 0.5954
 epoch: 85, train_loss: 0.3396, test_loss: 1.5821, test_f1: 0.6068
 epoch: 86, train_loss: 0.3243, test_loss: 1.7596, test_f1: 0.6026
 epoch: 87, train_loss: 0.3317, test_loss: 1.6322, test_f1: 0.6067
 epoch: 88, train_loss: 0.3275, test_loss: 1.6264, test_f1: 0.5973
 epoch: 89, train_loss: 0.2909, test_loss: 1.6309, test_f1: 0.5910
 epoch: 90, train_loss: 0.3117, test_loss: 1.7212, test_f1: 0.5963
 epoch: 91, train_loss: 0.3019, test_loss: 1.5963, test_f1: 0.5979
 epoch: 92, train_loss: 0.3434, test_loss: 1.7083, test_f1: 0.5984
 epoch: 93, train_loss: 0.3115, test_loss: 1.6706, test_f1: 0.6062
 epoch: 94, train_loss: 0.2943, test_loss: 1.5861, test_f1: 0.6103
 epoch: 95, train_loss: 0.2990, test_loss: 1.8033, test_f1: 0.6037
 epoch: 96, train_loss: 0.3131, test_loss: 1.7284, test_f1: 0.5926
 epoch: 97, train_loss: 0.2955, test_loss: 1.7651, test_f1: 0.6048
 epoch: 98, train_loss: 0.2924, test_loss: 1.7343, test_f1: 0.5939
 epoch: 99, train_loss: 0.3075, test_loss: 1.7555, test_f1: 0.5980
##################ITERATION #3 ****************************************
 epoch: 0, train_loss: 1.2054, test_loss: 1.2297, test_f1: 0.3225
 epoch: 1, train_loss: 1.0931, test_loss: 1.1217, test_f1: 0.4811
 epoch: 2, train_loss: 1.0394, test_loss: 1.0867, test_f1: 0.5273
 epoch: 3, train_loss: 0.9962, test_loss: 1.0441, test_f1: 0.5303
 epoch: 4, train_loss: 0.9535, test_loss: 1.0170, test_f1: 0.5508
 epoch: 5, train_loss: 0.9097, test_loss: 0.9936, test_f1: 0.5818
 epoch: 6, train_loss: 0.8800, test_loss: 1.0012, test_f1: 0.5799
 epoch: 7, train_loss: 0.8493, test_loss: 0.9886, test_f1: 0.5846
 epoch: 8, train_loss: 0.8369, test_loss: 0.9337, test_f1: 0.5905
 epoch: 9, train_loss: 0.8017, test_loss: 0.9660, test_f1: 0.6123
 epoch: 10, train_loss: 0.7828, test_loss: 0.9906, test_f1: 0.5871
 epoch: 11, train_loss: 0.7769, test_loss: 0.9613, test_f1: 0.6022
 epoch: 12, train_loss: 0.7494, test_loss: 0.9532, test_f1: 0.5934
 epoch: 13, train_loss: 0.7480, test_loss: 0.9405, test_f1: 0.5933
 epoch: 14, train_loss: 0.7300, test_loss: 0.9520, test_f1: 0.6178
 epoch: 15, train_loss: 0.7146, test_loss: 0.9601, test_f1: 0.6006
 epoch: 16, train_loss: 0.7286, test_loss: 0.9487, test_f1: 0.5527
 epoch: 17, train_loss: 0.6938, test_loss: 0.9776, test_f1: 0.5821
 epoch: 18, train_loss: 0.6740, test_loss: 1.0054, test_f1: 0.5784
 epoch: 19, train_loss: 0.6804, test_loss: 1.0448, test_f1: 0.5698
 epoch: 20, train_loss: 0.6747, test_loss: 0.9706, test_f1: 0.5891
 epoch: 21, train_loss: 0.6776, test_loss: 0.9584, test_f1: 0.6038
 epoch: 22, train_loss: 0.6559, test_loss: 0.9997, test_f1: 0.6001
 epoch: 23, train_loss: 0.6586, test_loss: 1.0222, test_f1: 0.5718
 epoch: 24, train_loss: 0.6442, test_loss: 1.0168, test_f1: 0.5902
 epoch: 25, train_loss: 0.6250, test_loss: 0.9811, test_f1: 0.5588
 epoch: 26, train_loss: 0.6277, test_loss: 0.9789, test_f1: 0.5854
 epoch: 27, train_loss: 0.6136, test_loss: 1.0362, test_f1: 0.5733
 epoch: 28, train_loss: 0.5912, test_loss: 1.0335, test_f1: 0.5741
 epoch: 29, train_loss: 0.5977, test_loss: 1.0318, test_f1: 0.5991
 epoch: 30, train_loss: 0.5846, test_loss: 1.0678, test_f1: 0.5838
 epoch: 31, train_loss: 0.5949, test_loss: 1.1261, test_f1: 0.5632
 epoch: 32, train_loss: 0.5665, test_loss: 1.1097, test_f1: 0.5502
 epoch: 33, train_loss: 0.5743, test_loss: 1.0892, test_f1: 0.5830
 epoch: 34, train_loss: 0.5593, test_loss: 1.0803, test_f1: 0.5953
 epoch: 35, train_loss: 0.5520, test_loss: 1.0863, test_f1: 0.5811
 epoch: 36, train_loss: 0.5652, test_loss: 1.1075, test_f1: 0.6181
 epoch: 37, train_loss: 0.5474, test_loss: 1.0660, test_f1: 0.6201
 epoch: 38, train_loss: 0.5433, test_loss: 1.1116, test_f1: 0.5691
 epoch: 39, train_loss: 0.5518, test_loss: 1.0923, test_f1: 0.6211
 epoch: 40, train_loss: 0.5208, test_loss: 1.1065, test_f1: 0.6239
 epoch: 41, train_loss: 0.5256, test_loss: 1.1373, test_f1: 0.6134
 epoch: 42, train_loss: 0.5154, test_loss: 1.0951, test_f1: 0.6079
 epoch: 43, train_loss: 0.5220, test_loss: 1.0970, test_f1: 0.5957
 epoch: 44, train_loss: 0.5110, test_loss: 1.1083, test_f1: 0.6277
 epoch: 45, train_loss: 0.4813, test_loss: 1.1672, test_f1: 0.6220
 epoch: 46, train_loss: 0.4786, test_loss: 1.1979, test_f1: 0.5768
 epoch: 47, train_loss: 0.4842, test_loss: 1.2644, test_f1: 0.6011
 epoch: 48, train_loss: 0.4771, test_loss: 1.2179, test_f1: 0.6007
 epoch: 49, train_loss: 0.4859, test_loss: 1.1616, test_f1: 0.5659
 epoch: 50, train_loss: 0.4651, test_loss: 1.4158, test_f1: 0.5939
 epoch: 51, train_loss: 0.4576, test_loss: 1.2865, test_f1: 0.6139
 epoch: 52, train_loss: 0.4538, test_loss: 1.3087, test_f1: 0.6073
 epoch: 53, train_loss: 0.4486, test_loss: 1.2424, test_f1: 0.5977
 epoch: 54, train_loss: 0.4392, test_loss: 1.2844, test_f1: 0.6149
 epoch: 55, train_loss: 0.4356, test_loss: 1.2317, test_f1: 0.5935
 epoch: 56, train_loss: 0.4182, test_loss: 1.2621, test_f1: 0.5980
 epoch: 57, train_loss: 0.4205, test_loss: 1.3224, test_f1: 0.6155
 epoch: 58, train_loss: 0.4184, test_loss: 1.3110, test_f1: 0.6014
 epoch: 59, train_loss: 0.4198, test_loss: 1.2792, test_f1: 0.5975
 epoch: 60, train_loss: 0.4307, test_loss: 1.3403, test_f1: 0.6412
 epoch: 61, train_loss: 0.4003, test_loss: 1.3594, test_f1: 0.6185
 epoch: 62, train_loss: 0.4084, test_loss: 1.3249, test_f1: 0.6123
 epoch: 63, train_loss: 0.4220, test_loss: 1.3610, test_f1: 0.5995
 epoch: 64, train_loss: 0.4008, test_loss: 1.2669, test_f1: 0.6322
 epoch: 65, train_loss: 0.4036, test_loss: 1.3389, test_f1: 0.6240
 epoch: 66, train_loss: 0.3948, test_loss: 1.4215, test_f1: 0.6071
 epoch: 67, train_loss: 0.3818, test_loss: 1.4409, test_f1: 0.5912
 epoch: 68, train_loss: 0.3728, test_loss: 1.4104, test_f1: 0.6021
 epoch: 69, train_loss: 0.3793, test_loss: 1.3999, test_f1: 0.6084
 epoch: 70, train_loss: 0.3758, test_loss: 1.5079, test_f1: 0.6023
 epoch: 71, train_loss: 0.3894, test_loss: 1.3683, test_f1: 0.6217
 epoch: 72, train_loss: 0.3682, test_loss: 1.4867, test_f1: 0.6091
 epoch: 73, train_loss: 0.3823, test_loss: 1.4600, test_f1: 0.6088
 epoch: 74, train_loss: 0.3807, test_loss: 1.5598, test_f1: 0.5999
 epoch: 75, train_loss: 0.3628, test_loss: 1.4728, test_f1: 0.6260
 epoch: 76, train_loss: 0.3681, test_loss: 1.5272, test_f1: 0.6126
 epoch: 77, train_loss: 0.3734, test_loss: 1.4712, test_f1: 0.6278
 epoch: 78, train_loss: 0.3547, test_loss: 1.4779, test_f1: 0.6040
 epoch: 79, train_loss: 0.3629, test_loss: 1.5524, test_f1: 0.6187
 epoch: 80, train_loss: 0.3738, test_loss: 1.6764, test_f1: 0.6071
 epoch: 81, train_loss: 0.3425, test_loss: 1.6052, test_f1: 0.6064
 epoch: 82, train_loss: 0.3289, test_loss: 1.6444, test_f1: 0.6139
 epoch: 83, train_loss: 0.3523, test_loss: 1.7024, test_f1: 0.6071
 epoch: 84, train_loss: 0.3473, test_loss: 1.5792, test_f1: 0.6192
 epoch: 85, train_loss: 0.3228, test_loss: 1.6240, test_f1: 0.5986
 epoch: 86, train_loss: 0.3259, test_loss: 1.6052, test_f1: 0.6029
 epoch: 87, train_loss: 0.3364, test_loss: 1.6405, test_f1: 0.6171
 epoch: 88, train_loss: 0.3337, test_loss: 1.6760, test_f1: 0.6247
 epoch: 89, train_loss: 0.3216, test_loss: 1.7049, test_f1: 0.5958
 epoch: 90, train_loss: 0.3281, test_loss: 1.5999, test_f1: 0.6188
 epoch: 91, train_loss: 0.3083, test_loss: 1.7158, test_f1: 0.6283
 epoch: 92, train_loss: 0.3411, test_loss: 1.7631, test_f1: 0.6022
 epoch: 93, train_loss: 0.3260, test_loss: 1.6828, test_f1: 0.6038
 epoch: 94, train_loss: 0.3235, test_loss: 1.6895, test_f1: 0.6170
 epoch: 95, train_loss: 0.3206, test_loss: 1.7405, test_f1: 0.6052
 epoch: 96, train_loss: 0.3116, test_loss: 1.7755, test_f1: 0.6190
 epoch: 97, train_loss: 0.3170, test_loss: 1.7866, test_f1: 0.5996
 epoch: 98, train_loss: 0.3088, test_loss: 1.7986, test_f1: 0.5996
 epoch: 99, train_loss: 0.2871, test_loss: 1.7327, test_f1: 0.6076
##################ITERATION #4 ****************************************
 epoch: 0, train_loss: 1.1921, test_loss: 1.2076, test_f1: 0.3628
 epoch: 1, train_loss: 1.0787, test_loss: 1.1047, test_f1: 0.5124
 epoch: 2, train_loss: 1.0060, test_loss: 1.0620, test_f1: 0.5213
 epoch: 3, train_loss: 0.9796, test_loss: 1.0389, test_f1: 0.5399
 epoch: 4, train_loss: 0.9437, test_loss: 1.0018, test_f1: 0.5635
 epoch: 5, train_loss: 0.9220, test_loss: 1.0089, test_f1: 0.5221
 epoch: 6, train_loss: 0.8964, test_loss: 0.9758, test_f1: 0.5848
 epoch: 7, train_loss: 0.8815, test_loss: 0.9609, test_f1: 0.5701
 epoch: 8, train_loss: 0.8429, test_loss: 0.9594, test_f1: 0.5702
 epoch: 9, train_loss: 0.8223, test_loss: 0.9618, test_f1: 0.5663
 epoch: 10, train_loss: 0.8141, test_loss: 0.9507, test_f1: 0.5713
 epoch: 11, train_loss: 0.7914, test_loss: 0.9572, test_f1: 0.5786
 epoch: 12, train_loss: 0.7688, test_loss: 0.9579, test_f1: 0.5841
 epoch: 13, train_loss: 0.7534, test_loss: 0.9940, test_f1: 0.5726
 epoch: 14, train_loss: 0.7396, test_loss: 1.0045, test_f1: 0.5598
 epoch: 15, train_loss: 0.7353, test_loss: 0.9634, test_f1: 0.5677
 epoch: 16, train_loss: 0.7267, test_loss: 0.9642, test_f1: 0.5869
 epoch: 17, train_loss: 0.6928, test_loss: 1.0168, test_f1: 0.5798
 epoch: 18, train_loss: 0.7002, test_loss: 0.9973, test_f1: 0.5973
 epoch: 19, train_loss: 0.6868, test_loss: 1.0213, test_f1: 0.5762
 epoch: 20, train_loss: 0.6718, test_loss: 1.0769, test_f1: 0.5804
 epoch: 21, train_loss: 0.6634, test_loss: 1.0536, test_f1: 0.5577
 epoch: 22, train_loss: 0.6480, test_loss: 1.0881, test_f1: 0.5655
 epoch: 23, train_loss: 0.6454, test_loss: 1.0342, test_f1: 0.5615
 epoch: 24, train_loss: 0.6269, test_loss: 1.0821, test_f1: 0.5833
 epoch: 25, train_loss: 0.6176, test_loss: 1.1485, test_f1: 0.5839
 epoch: 26, train_loss: 0.6194, test_loss: 1.0655, test_f1: 0.5776
 epoch: 27, train_loss: 0.5935, test_loss: 1.1238, test_f1: 0.5799
 epoch: 28, train_loss: 0.6002, test_loss: 1.1691, test_f1: 0.5715
 epoch: 29, train_loss: 0.5899, test_loss: 1.1270, test_f1: 0.5755
 epoch: 30, train_loss: 0.5732, test_loss: 1.1596, test_f1: 0.5721
 epoch: 31, train_loss: 0.5805, test_loss: 1.1396, test_f1: 0.5475
 epoch: 32, train_loss: 0.5624, test_loss: 1.1906, test_f1: 0.5816
 epoch: 33, train_loss: 0.5487, test_loss: 1.2255, test_f1: 0.5685
 epoch: 34, train_loss: 0.5452, test_loss: 1.1764, test_f1: 0.5643
 epoch: 35, train_loss: 0.5383, test_loss: 1.3053, test_f1: 0.5771
 epoch: 36, train_loss: 0.5400, test_loss: 1.2082, test_f1: 0.5807
 epoch: 37, train_loss: 0.5392, test_loss: 1.3798, test_f1: 0.5687
 epoch: 38, train_loss: 0.5305, test_loss: 1.3321, test_f1: 0.5707
 epoch: 39, train_loss: 0.5284, test_loss: 1.2398, test_f1: 0.5991
 epoch: 40, train_loss: 0.5210, test_loss: 1.2469, test_f1: 0.5735
 epoch: 41, train_loss: 0.5290, test_loss: 1.3364, test_f1: 0.5832
 epoch: 42, train_loss: 0.4794, test_loss: 1.3852, test_f1: 0.5745
 epoch: 43, train_loss: 0.4876, test_loss: 1.3004, test_f1: 0.5979
 epoch: 44, train_loss: 0.4636, test_loss: 1.3315, test_f1: 0.5891
 epoch: 45, train_loss: 0.4811, test_loss: 1.4306, test_f1: 0.5818
 epoch: 46, train_loss: 0.4846, test_loss: 1.4395, test_f1: 0.5755
 epoch: 47, train_loss: 0.4650, test_loss: 1.3647, test_f1: 0.6150
 epoch: 48, train_loss: 0.4633, test_loss: 1.5277, test_f1: 0.5758
 epoch: 49, train_loss: 0.4284, test_loss: 1.4658, test_f1: 0.6042
 epoch: 50, train_loss: 0.4609, test_loss: 1.4348, test_f1: 0.6039
 epoch: 51, train_loss: 0.4336, test_loss: 1.4047, test_f1: 0.5985
 epoch: 52, train_loss: 0.4141, test_loss: 1.4990, test_f1: 0.5928
 epoch: 53, train_loss: 0.4052, test_loss: 1.4676, test_f1: 0.5896
 epoch: 54, train_loss: 0.4007, test_loss: 1.4994, test_f1: 0.6008
 epoch: 55, train_loss: 0.4036, test_loss: 1.4978, test_f1: 0.5916
 epoch: 56, train_loss: 0.3924, test_loss: 1.5637, test_f1: 0.5967
 epoch: 57, train_loss: 0.3866, test_loss: 1.5090, test_f1: 0.5768
 epoch: 58, train_loss: 0.4214, test_loss: 1.5065, test_f1: 0.6033
 epoch: 59, train_loss: 0.3925, test_loss: 1.5666, test_f1: 0.5913
 epoch: 60, train_loss: 0.3784, test_loss: 1.5747, test_f1: 0.5949
 epoch: 61, train_loss: 0.3707, test_loss: 1.6143, test_f1: 0.6123
 epoch: 62, train_loss: 0.3579, test_loss: 1.5835, test_f1: 0.6047
 epoch: 63, train_loss: 0.3689, test_loss: 1.6202, test_f1: 0.5851
 epoch: 64, train_loss: 0.3883, test_loss: 1.6577, test_f1: 0.5989
 epoch: 65, train_loss: 0.3634, test_loss: 1.6086, test_f1: 0.5923
 epoch: 66, train_loss: 0.3729, test_loss: 1.6188, test_f1: 0.5931
 epoch: 67, train_loss: 0.3488, test_loss: 1.6951, test_f1: 0.5998
 epoch: 68, train_loss: 0.3668, test_loss: 1.6266, test_f1: 0.5979
 epoch: 69, train_loss: 0.3543, test_loss: 1.6128, test_f1: 0.5947
 epoch: 70, train_loss: 0.3438, test_loss: 1.7202, test_f1: 0.5943
 epoch: 71, train_loss: 0.3433, test_loss: 1.6527, test_f1: 0.5989
 epoch: 72, train_loss: 0.3648, test_loss: 1.7394, test_f1: 0.6037
 epoch: 73, train_loss: 0.3370, test_loss: 1.7456, test_f1: 0.5835
 epoch: 74, train_loss: 0.3358, test_loss: 1.7051, test_f1: 0.6070
 epoch: 75, train_loss: 0.3470, test_loss: 1.7411, test_f1: 0.6019
 epoch: 76, train_loss: 0.3226, test_loss: 1.7600, test_f1: 0.5910
 epoch: 77, train_loss: 0.3219, test_loss: 1.8023, test_f1: 0.5922
 epoch: 78, train_loss: 0.3176, test_loss: 1.7172, test_f1: 0.6070
 epoch: 79, train_loss: 0.3236, test_loss: 1.9009, test_f1: 0.5980
 epoch: 80, train_loss: 0.3143, test_loss: 1.7733, test_f1: 0.5969
 epoch: 81, train_loss: 0.3174, test_loss: 1.8964, test_f1: 0.5926
 epoch: 82, train_loss: 0.3210, test_loss: 1.7595, test_f1: 0.6089
 epoch: 83, train_loss: 0.3127, test_loss: 1.8311, test_f1: 0.5954
 epoch: 84, train_loss: 0.3092, test_loss: 1.8327, test_f1: 0.6130
 epoch: 85, train_loss: 0.3157, test_loss: 1.8905, test_f1: 0.6069
 epoch: 86, train_loss: 0.3082, test_loss: 1.8411, test_f1: 0.6199
 epoch: 87, train_loss: 0.2952, test_loss: 1.8007, test_f1: 0.5970
 epoch: 88, train_loss: 0.2979, test_loss: 1.8382, test_f1: 0.6107
 epoch: 89, train_loss: 0.2814, test_loss: 1.9394, test_f1: 0.5850
 epoch: 90, train_loss: 0.2836, test_loss: 1.9173, test_f1: 0.5942
 epoch: 91, train_loss: 0.2906, test_loss: 1.8968, test_f1: 0.5877
 epoch: 92, train_loss: 0.2841, test_loss: 1.9702, test_f1: 0.5979
 epoch: 93, train_loss: 0.2728, test_loss: 2.0650, test_f1: 0.5782
 epoch: 94, train_loss: 0.2991, test_loss: 1.9414, test_f1: 0.6025
 epoch: 95, train_loss: 0.2841, test_loss: 2.0110, test_f1: 0.5818
 epoch: 96, train_loss: 0.2743, test_loss: 1.9867, test_f1: 0.6034
 epoch: 97, train_loss: 0.2822, test_loss: 1.9288, test_f1: 0.6044
 epoch: 98, train_loss: 0.2573, test_loss: 1.9893, test_f1: 0.6063
 epoch: 99, train_loss: 0.2632, test_loss: 2.0218, test_f1: 0.6025
##################ITERATION #5 ****************************************
 epoch: 0, train_loss: 1.1836, test_loss: 1.2501, test_f1: 0.2704
 epoch: 1, train_loss: 1.0694, test_loss: 1.1015, test_f1: 0.5005
 epoch: 2, train_loss: 1.0144, test_loss: 1.0711, test_f1: 0.5231
 epoch: 3, train_loss: 0.9959, test_loss: 1.0414, test_f1: 0.5598
 epoch: 4, train_loss: 0.9414, test_loss: 1.0336, test_f1: 0.5620
 epoch: 5, train_loss: 0.9229, test_loss: 1.0343, test_f1: 0.5559
 epoch: 6, train_loss: 0.8923, test_loss: 1.0173, test_f1: 0.5848
 epoch: 7, train_loss: 0.8677, test_loss: 1.0197, test_f1: 0.6006
 epoch: 8, train_loss: 0.8481, test_loss: 1.0074, test_f1: 0.5705
 epoch: 9, train_loss: 0.8267, test_loss: 1.0230, test_f1: 0.5866
 epoch: 10, train_loss: 0.8347, test_loss: 1.0092, test_f1: 0.6012
 epoch: 11, train_loss: 0.8003, test_loss: 0.9884, test_f1: 0.5929
 epoch: 12, train_loss: 0.7996, test_loss: 1.0103, test_f1: 0.6234
 epoch: 13, train_loss: 0.7676, test_loss: 0.9755, test_f1: 0.6452
 epoch: 14, train_loss: 0.7666, test_loss: 0.9998, test_f1: 0.6242
 epoch: 15, train_loss: 0.7513, test_loss: 1.0237, test_f1: 0.5931
 epoch: 16, train_loss: 0.7259, test_loss: 1.0052, test_f1: 0.6500
 epoch: 17, train_loss: 0.7277, test_loss: 0.9823, test_f1: 0.6321
 epoch: 18, train_loss: 0.7195, test_loss: 1.0104, test_f1: 0.6144
 epoch: 19, train_loss: 0.7032, test_loss: 1.0328, test_f1: 0.5900
 epoch: 20, train_loss: 0.7015, test_loss: 1.0545, test_f1: 0.6289
 epoch: 21, train_loss: 0.6913, test_loss: 1.0683, test_f1: 0.6133
 epoch: 22, train_loss: 0.6858, test_loss: 1.0164, test_f1: 0.6135
 epoch: 23, train_loss: 0.6858, test_loss: 1.0546, test_f1: 0.6012
 epoch: 24, train_loss: 0.6698, test_loss: 1.0160, test_f1: 0.5746
 epoch: 25, train_loss: 0.6682, test_loss: 1.1449, test_f1: 0.5712
 epoch: 26, train_loss: 0.6588, test_loss: 1.0375, test_f1: 0.6281
 epoch: 27, train_loss: 0.6519, test_loss: 1.0109, test_f1: 0.6031
 epoch: 28, train_loss: 0.6389, test_loss: 1.1261, test_f1: 0.5870
 epoch: 29, train_loss: 0.6194, test_loss: 1.0224, test_f1: 0.6202
 epoch: 30, train_loss: 0.6345, test_loss: 1.0648, test_f1: 0.6469
 epoch: 31, train_loss: 0.6149, test_loss: 1.0768, test_f1: 0.6009
 epoch: 32, train_loss: 0.6018, test_loss: 1.0314, test_f1: 0.6246
 epoch: 33, train_loss: 0.6024, test_loss: 1.1043, test_f1: 0.5917
 epoch: 34, train_loss: 0.5940, test_loss: 1.0702, test_f1: 0.6121
 epoch: 35, train_loss: 0.5684, test_loss: 1.1187, test_f1: 0.6001
 epoch: 36, train_loss: 0.5915, test_loss: 1.1062, test_f1: 0.5951
 epoch: 37, train_loss: 0.5699, test_loss: 1.0634, test_f1: 0.6036
 epoch: 38, train_loss: 0.5648, test_loss: 1.1332, test_f1: 0.5766
 epoch: 39, train_loss: 0.5613, test_loss: 1.0781, test_f1: 0.6142
 epoch: 40, train_loss: 0.5443, test_loss: 1.1562, test_f1: 0.5935
 epoch: 41, train_loss: 0.5680, test_loss: 1.1380, test_f1: 0.5972
 epoch: 42, train_loss: 0.5395, test_loss: 1.0789, test_f1: 0.6191
 epoch: 43, train_loss: 0.5476, test_loss: 1.1881, test_f1: 0.5701
 epoch: 44, train_loss: 0.5414, test_loss: 1.0791, test_f1: 0.6248
 epoch: 45, train_loss: 0.5290, test_loss: 1.1387, test_f1: 0.6546
 epoch: 46, train_loss: 0.5293, test_loss: 1.0982, test_f1: 0.5920
 epoch: 47, train_loss: 0.4973, test_loss: 1.1042, test_f1: 0.6196
 epoch: 48, train_loss: 0.5009, test_loss: 1.1458, test_f1: 0.6056
 epoch: 49, train_loss: 0.5039, test_loss: 1.0811, test_f1: 0.6582
 epoch: 50, train_loss: 0.5006, test_loss: 1.1998, test_f1: 0.6018
 epoch: 51, train_loss: 0.4612, test_loss: 1.1729, test_f1: 0.6169
 epoch: 52, train_loss: 0.4716, test_loss: 1.2355, test_f1: 0.6181
 epoch: 53, train_loss: 0.4585, test_loss: 1.1870, test_f1: 0.6112
 epoch: 54, train_loss: 0.4441, test_loss: 1.2181, test_f1: 0.6100
 epoch: 55, train_loss: 0.4695, test_loss: 1.2313, test_f1: 0.6165
 epoch: 56, train_loss: 0.4459, test_loss: 1.2120, test_f1: 0.6048
 epoch: 57, train_loss: 0.4371, test_loss: 1.2210, test_f1: 0.6205
 epoch: 58, train_loss: 0.4689, test_loss: 1.2275, test_f1: 0.6142
 epoch: 59, train_loss: 0.4491, test_loss: 1.2309, test_f1: 0.6090
 epoch: 60, train_loss: 0.4297, test_loss: 1.2612, test_f1: 0.6163
 epoch: 61, train_loss: 0.4306, test_loss: 1.2310, test_f1: 0.6281
 epoch: 62, train_loss: 0.4141, test_loss: 1.2741, test_f1: 0.6081
 epoch: 63, train_loss: 0.4455, test_loss: 1.2717, test_f1: 0.6227
 epoch: 64, train_loss: 0.4212, test_loss: 1.2554, test_f1: 0.6055
 epoch: 65, train_loss: 0.4136, test_loss: 1.3257, test_f1: 0.6168
 epoch: 66, train_loss: 0.4251, test_loss: 1.3262, test_f1: 0.5936
 epoch: 67, train_loss: 0.4236, test_loss: 1.3454, test_f1: 0.5947
 epoch: 68, train_loss: 0.4014, test_loss: 1.2767, test_f1: 0.6217
 epoch: 69, train_loss: 0.4217, test_loss: 1.3137, test_f1: 0.6138
 epoch: 70, train_loss: 0.3961, test_loss: 1.2904, test_f1: 0.6201
 epoch: 71, train_loss: 0.3933, test_loss: 1.3021, test_f1: 0.6619
 epoch: 72, train_loss: 0.3997, test_loss: 1.2914, test_f1: 0.6274
 epoch: 73, train_loss: 0.3938, test_loss: 1.3253, test_f1: 0.6168
 epoch: 74, train_loss: 0.4008, test_loss: 1.3817, test_f1: 0.5985
 epoch: 75, train_loss: 0.3957, test_loss: 1.3315, test_f1: 0.6197
 epoch: 76, train_loss: 0.4006, test_loss: 1.3708, test_f1: 0.6194
 epoch: 77, train_loss: 0.3950, test_loss: 1.3731, test_f1: 0.6137
 epoch: 78, train_loss: 0.4043, test_loss: 1.3831, test_f1: 0.6140
 epoch: 79, train_loss: 0.3762, test_loss: 1.3387, test_f1: 0.6409
 epoch: 80, train_loss: 0.3846, test_loss: 1.4514, test_f1: 0.5962
 epoch: 81, train_loss: 0.3708, test_loss: 1.3792, test_f1: 0.6290
 epoch: 82, train_loss: 0.3881, test_loss: 1.3095, test_f1: 0.6539
 epoch: 83, train_loss: 0.3563, test_loss: 1.3898, test_f1: 0.6138
 epoch: 84, train_loss: 0.3608, test_loss: 1.4024, test_f1: 0.6132
 epoch: 85, train_loss: 0.3390, test_loss: 1.4014, test_f1: 0.6417
 epoch: 86, train_loss: 0.3337, test_loss: 1.4388, test_f1: 0.6299
 epoch: 87, train_loss: 0.3394, test_loss: 1.4820, test_f1: 0.6114
 epoch: 88, train_loss: 0.3397, test_loss: 1.4849, test_f1: 0.6250
 epoch: 89, train_loss: 0.3655, test_loss: 1.4756, test_f1: 0.6249
 epoch: 90, train_loss: 0.3761, test_loss: 1.5497, test_f1: 0.6241
 epoch: 91, train_loss: 0.3514, test_loss: 1.4883, test_f1: 0.6221
 epoch: 92, train_loss: 0.3475, test_loss: 1.4322, test_f1: 0.6223
 epoch: 93, train_loss: 0.3579, test_loss: 1.4476, test_f1: 0.6098
 epoch: 94, train_loss: 0.3332, test_loss: 1.4365, test_f1: 0.6144
 epoch: 95, train_loss: 0.3341, test_loss: 1.4296, test_f1: 0.6274
 epoch: 96, train_loss: 0.3171, test_loss: 1.5073, test_f1: 0.6398
 epoch: 97, train_loss: 0.3280, test_loss: 1.4670, test_f1: 0.6632
 epoch: 98, train_loss: 0.3258, test_loss: 1.4977, test_f1: 0.6226
 epoch: 99, train_loss: 0.3221, test_loss: 1.4421, test_f1: 0.6543
##################ITERATION #6 ****************************************
 epoch: 0, train_loss: 1.2241, test_loss: 1.2288, test_f1: 0.3843
 epoch: 1, train_loss: 1.0734, test_loss: 1.1312, test_f1: 0.5047
 epoch: 2, train_loss: 1.0355, test_loss: 1.0945, test_f1: 0.5197
 epoch: 3, train_loss: 0.9823, test_loss: 1.0529, test_f1: 0.5439
 epoch: 4, train_loss: 0.9677, test_loss: 1.0246, test_f1: 0.5535
 epoch: 5, train_loss: 0.9320, test_loss: 1.0157, test_f1: 0.5337
 epoch: 6, train_loss: 0.9008, test_loss: 0.9856, test_f1: 0.5732
 epoch: 7, train_loss: 0.8883, test_loss: 0.9684, test_f1: 0.5862
 epoch: 8, train_loss: 0.8753, test_loss: 0.9775, test_f1: 0.5866
 epoch: 9, train_loss: 0.8339, test_loss: 0.9628, test_f1: 0.6031
 epoch: 10, train_loss: 0.8141, test_loss: 0.9781, test_f1: 0.5996
 epoch: 11, train_loss: 0.8122, test_loss: 0.9548, test_f1: 0.6042
 epoch: 12, train_loss: 0.8049, test_loss: 0.9708, test_f1: 0.6104
 epoch: 13, train_loss: 0.7923, test_loss: 0.9677, test_f1: 0.6191
 epoch: 14, train_loss: 0.7794, test_loss: 0.9652, test_f1: 0.6293
 epoch: 15, train_loss: 0.7623, test_loss: 0.9662, test_f1: 0.6250
 epoch: 16, train_loss: 0.7492, test_loss: 0.9434, test_f1: 0.6176
 epoch: 17, train_loss: 0.7307, test_loss: 0.9483, test_f1: 0.6211
 epoch: 18, train_loss: 0.7216, test_loss: 0.9575, test_f1: 0.6209
 epoch: 19, train_loss: 0.7110, test_loss: 0.9439, test_f1: 0.6427
 epoch: 20, train_loss: 0.7130, test_loss: 0.9703, test_f1: 0.6081
 epoch: 21, train_loss: 0.6984, test_loss: 1.0210, test_f1: 0.6340
 epoch: 22, train_loss: 0.6926, test_loss: 0.9533, test_f1: 0.6615
 epoch: 23, train_loss: 0.6942, test_loss: 0.9713, test_f1: 0.5906
 epoch: 24, train_loss: 0.6622, test_loss: 0.9547, test_f1: 0.6364
 epoch: 25, train_loss: 0.6670, test_loss: 0.9256, test_f1: 0.6537
 epoch: 26, train_loss: 0.6629, test_loss: 0.8829, test_f1: 0.6556
 epoch: 27, train_loss: 0.6586, test_loss: 0.9917, test_f1: 0.6316
 epoch: 28, train_loss: 0.6305, test_loss: 0.9397, test_f1: 0.6224
 epoch: 29, train_loss: 0.6498, test_loss: 1.0176, test_f1: 0.6395
 epoch: 30, train_loss: 0.6119, test_loss: 0.9564, test_f1: 0.6412
 epoch: 31, train_loss: 0.6133, test_loss: 0.9955, test_f1: 0.6329
 epoch: 32, train_loss: 0.6024, test_loss: 0.9642, test_f1: 0.6384
 epoch: 33, train_loss: 0.5980, test_loss: 1.0024, test_f1: 0.6202
 epoch: 34, train_loss: 0.5791, test_loss: 1.0061, test_f1: 0.6220
 epoch: 35, train_loss: 0.5622, test_loss: 1.0082, test_f1: 0.6513
 epoch: 36, train_loss: 0.5834, test_loss: 1.0784, test_f1: 0.6321
 epoch: 37, train_loss: 0.5749, test_loss: 0.9794, test_f1: 0.6481
 epoch: 38, train_loss: 0.5612, test_loss: 1.0151, test_f1: 0.6444
 epoch: 39, train_loss: 0.5555, test_loss: 1.1335, test_f1: 0.6037
 epoch: 40, train_loss: 0.5661, test_loss: 1.1137, test_f1: 0.6351
 epoch: 41, train_loss: 0.5536, test_loss: 1.1609, test_f1: 0.6160
 epoch: 42, train_loss: 0.5444, test_loss: 1.1257, test_f1: 0.5952
 epoch: 43, train_loss: 0.5497, test_loss: 1.1373, test_f1: 0.6532
 epoch: 44, train_loss: 0.5354, test_loss: 1.1268, test_f1: 0.6268
 epoch: 45, train_loss: 0.5187, test_loss: 1.0879, test_f1: 0.6387
 epoch: 46, train_loss: 0.5155, test_loss: 1.0868, test_f1: 0.6654
 epoch: 47, train_loss: 0.5067, test_loss: 1.1244, test_f1: 0.6343
 epoch: 48, train_loss: 0.5194, test_loss: 1.2054, test_f1: 0.6064
 epoch: 49, train_loss: 0.4971, test_loss: 1.2991, test_f1: 0.5977
 epoch: 50, train_loss: 0.4839, test_loss: 1.1853, test_f1: 0.6196
 epoch: 51, train_loss: 0.4784, test_loss: 1.1912, test_f1: 0.6211
 epoch: 52, train_loss: 0.4631, test_loss: 1.1649, test_f1: 0.6522
 epoch: 53, train_loss: 0.4681, test_loss: 1.1271, test_f1: 0.6419
 epoch: 54, train_loss: 0.4555, test_loss: 1.2029, test_f1: 0.6375
 epoch: 55, train_loss: 0.4855, test_loss: 1.1308, test_f1: 0.6523
 epoch: 56, train_loss: 0.4462, test_loss: 1.1480, test_f1: 0.6515
 epoch: 57, train_loss: 0.4439, test_loss: 1.1996, test_f1: 0.6772
 epoch: 58, train_loss: 0.4493, test_loss: 1.2425, test_f1: 0.6408
 epoch: 59, train_loss: 0.4518, test_loss: 1.2051, test_f1: 0.6390
 epoch: 60, train_loss: 0.4256, test_loss: 1.1985, test_f1: 0.6652
 epoch: 61, train_loss: 0.4220, test_loss: 1.1982, test_f1: 0.6626
 epoch: 62, train_loss: 0.4272, test_loss: 1.2325, test_f1: 0.6759
 epoch: 63, train_loss: 0.4388, test_loss: 1.2672, test_f1: 0.6109
 epoch: 64, train_loss: 0.4264, test_loss: 1.2139, test_f1: 0.6357
 epoch: 65, train_loss: 0.4030, test_loss: 1.2144, test_f1: 0.6433
 epoch: 66, train_loss: 0.4291, test_loss: 1.2095, test_f1: 0.6541
 epoch: 67, train_loss: 0.3970, test_loss: 1.2546, test_f1: 0.6492
 epoch: 68, train_loss: 0.3993, test_loss: 1.2569, test_f1: 0.6432
 epoch: 69, train_loss: 0.3971, test_loss: 1.2740, test_f1: 0.6243
 epoch: 70, train_loss: 0.3989, test_loss: 1.2084, test_f1: 0.6520
 epoch: 71, train_loss: 0.3882, test_loss: 1.3073, test_f1: 0.6371
 epoch: 72, train_loss: 0.4236, test_loss: 1.3311, test_f1: 0.6357
 epoch: 73, train_loss: 0.4118, test_loss: 1.3550, test_f1: 0.6145
 epoch: 74, train_loss: 0.3902, test_loss: 1.3633, test_f1: 0.6284
 epoch: 75, train_loss: 0.4018, test_loss: 1.2616, test_f1: 0.6777
 epoch: 76, train_loss: 0.3871, test_loss: 1.3499, test_f1: 0.6223
 epoch: 77, train_loss: 0.3897, test_loss: 1.3139, test_f1: 0.6532
 epoch: 78, train_loss: 0.3877, test_loss: 1.2906, test_f1: 0.6510
 epoch: 79, train_loss: 0.3817, test_loss: 1.3213, test_f1: 0.6396
 epoch: 80, train_loss: 0.3892, test_loss: 1.4858, test_f1: 0.6233
 epoch: 81, train_loss: 0.3792, test_loss: 1.4368, test_f1: 0.6478
 epoch: 82, train_loss: 0.4032, test_loss: 1.4127, test_f1: 0.6048
 epoch: 83, train_loss: 0.3715, test_loss: 1.3848, test_f1: 0.6416
 epoch: 84, train_loss: 0.3664, test_loss: 1.4836, test_f1: 0.6399
 epoch: 85, train_loss: 0.3645, test_loss: 1.4218, test_f1: 0.6288
 epoch: 86, train_loss: 0.3669, test_loss: 1.5150, test_f1: 0.6392
 epoch: 87, train_loss: 0.3553, test_loss: 1.5915, test_f1: 0.6377
 epoch: 88, train_loss: 0.3464, test_loss: 1.5560, test_f1: 0.6297
 epoch: 89, train_loss: 0.3457, test_loss: 1.4853, test_f1: 0.6507
 epoch: 90, train_loss: 0.3528, test_loss: 1.4805, test_f1: 0.6527
 epoch: 91, train_loss: 0.3368, test_loss: 1.6169, test_f1: 0.6233
 epoch: 92, train_loss: 0.3605, test_loss: 1.5734, test_f1: 0.6194
 epoch: 93, train_loss: 0.3393, test_loss: 1.6252, test_f1: 0.6204
 epoch: 94, train_loss: 0.3282, test_loss: 1.6093, test_f1: 0.6313
 epoch: 95, train_loss: 0.3349, test_loss: 1.5707, test_f1: 0.6442
 epoch: 96, train_loss: 0.3494, test_loss: 1.5733, test_f1: 0.6431
 epoch: 97, train_loss: 0.3427, test_loss: 1.6666, test_f1: 0.6051
 epoch: 98, train_loss: 0.3453, test_loss: 1.5382, test_f1: 0.6366
 epoch: 99, train_loss: 0.3310, test_loss: 1.6897, test_f1: 0.6177
##################ITERATION #7 ****************************************
 epoch: 0, train_loss: 1.2270, test_loss: 1.2790, test_f1: 0.2711
 epoch: 1, train_loss: 1.0605, test_loss: 1.1636, test_f1: 0.5552
 epoch: 2, train_loss: 1.0040, test_loss: 1.1323, test_f1: 0.5400
 epoch: 3, train_loss: 0.9811, test_loss: 1.0828, test_f1: 0.5467
 epoch: 4, train_loss: 0.9615, test_loss: 1.1076, test_f1: 0.5365
 epoch: 5, train_loss: 0.9428, test_loss: 1.0894, test_f1: 0.5279
 epoch: 6, train_loss: 0.9092, test_loss: 1.0949, test_f1: 0.5493
 epoch: 7, train_loss: 0.8771, test_loss: 1.0712, test_f1: 0.5316
 epoch: 8, train_loss: 0.8512, test_loss: 1.0838, test_f1: 0.5443
 epoch: 9, train_loss: 0.8470, test_loss: 1.0586, test_f1: 0.5643
 epoch: 10, train_loss: 0.8224, test_loss: 1.0528, test_f1: 0.5269
 epoch: 11, train_loss: 0.7970, test_loss: 1.0485, test_f1: 0.5625
 epoch: 12, train_loss: 0.7768, test_loss: 1.0453, test_f1: 0.5544
 epoch: 13, train_loss: 0.7629, test_loss: 1.0649, test_f1: 0.5545
 epoch: 14, train_loss: 0.7503, test_loss: 1.0572, test_f1: 0.5743
 epoch: 15, train_loss: 0.7483, test_loss: 1.0430, test_f1: 0.5441
 epoch: 16, train_loss: 0.7276, test_loss: 1.0598, test_f1: 0.6039
 epoch: 17, train_loss: 0.7281, test_loss: 1.1211, test_f1: 0.5615
 epoch: 18, train_loss: 0.7239, test_loss: 1.0703, test_f1: 0.5627
 epoch: 19, train_loss: 0.7027, test_loss: 1.0914, test_f1: 0.5586
 epoch: 20, train_loss: 0.6857, test_loss: 1.1481, test_f1: 0.5532
 epoch: 21, train_loss: 0.6803, test_loss: 1.0857, test_f1: 0.5657
 epoch: 22, train_loss: 0.6753, test_loss: 1.1085, test_f1: 0.5885
 epoch: 23, train_loss: 0.6655, test_loss: 1.1508, test_f1: 0.5475
 epoch: 24, train_loss: 0.6638, test_loss: 1.1077, test_f1: 0.5981
 epoch: 25, train_loss: 0.6592, test_loss: 1.1457, test_f1: 0.5724
 epoch: 26, train_loss: 0.6188, test_loss: 1.1886, test_f1: 0.5896
 epoch: 27, train_loss: 0.6292, test_loss: 1.1535, test_f1: 0.5635
 epoch: 28, train_loss: 0.6159, test_loss: 1.2575, test_f1: 0.5771
 epoch: 29, train_loss: 0.6031, test_loss: 1.1603, test_f1: 0.6005
 epoch: 30, train_loss: 0.6118, test_loss: 1.1546, test_f1: 0.5997
 epoch: 31, train_loss: 0.5827, test_loss: 1.2377, test_f1: 0.6033
 epoch: 32, train_loss: 0.6061, test_loss: 1.2128, test_f1: 0.5748
 epoch: 33, train_loss: 0.5863, test_loss: 1.2575, test_f1: 0.6066
 epoch: 34, train_loss: 0.5809, test_loss: 1.2914, test_f1: 0.5807
 epoch: 35, train_loss: 0.5643, test_loss: 1.1941, test_f1: 0.6155
 epoch: 36, train_loss: 0.5581, test_loss: 1.2365, test_f1: 0.5866
 epoch: 37, train_loss: 0.5517, test_loss: 1.1797, test_f1: 0.6436
 epoch: 38, train_loss: 0.5444, test_loss: 1.2065, test_f1: 0.6453
 epoch: 39, train_loss: 0.5306, test_loss: 1.2574, test_f1: 0.6015
 epoch: 40, train_loss: 0.5449, test_loss: 1.2699, test_f1: 0.6140
 epoch: 41, train_loss: 0.5212, test_loss: 1.2819, test_f1: 0.6036
 epoch: 42, train_loss: 0.5162, test_loss: 1.3013, test_f1: 0.5961
 epoch: 43, train_loss: 0.5081, test_loss: 1.2540, test_f1: 0.6370
 epoch: 44, train_loss: 0.5121, test_loss: 1.2261, test_f1: 0.6195
 epoch: 45, train_loss: 0.5081, test_loss: 1.2774, test_f1: 0.6379
 epoch: 46, train_loss: 0.4946, test_loss: 1.3275, test_f1: 0.6219
 epoch: 47, train_loss: 0.4983, test_loss: 1.3926, test_f1: 0.6153
 epoch: 48, train_loss: 0.4867, test_loss: 1.3506, test_f1: 0.6328
 epoch: 49, train_loss: 0.4703, test_loss: 1.3940, test_f1: 0.6399
 epoch: 50, train_loss: 0.4755, test_loss: 1.3600, test_f1: 0.6578
 epoch: 51, train_loss: 0.4614, test_loss: 1.3860, test_f1: 0.6497
 epoch: 52, train_loss: 0.4665, test_loss: 1.3602, test_f1: 0.6662
 epoch: 53, train_loss: 0.4351, test_loss: 1.4548, test_f1: 0.6239
 epoch: 54, train_loss: 0.4324, test_loss: 1.3631, test_f1: 0.6542
 epoch: 55, train_loss: 0.4343, test_loss: 1.4172, test_f1: 0.6560
 epoch: 56, train_loss: 0.4254, test_loss: 1.4089, test_f1: 0.6491
 epoch: 57, train_loss: 0.4189, test_loss: 1.4340, test_f1: 0.6544
 epoch: 58, train_loss: 0.4229, test_loss: 1.4406, test_f1: 0.6455
 epoch: 59, train_loss: 0.4280, test_loss: 1.5121, test_f1: 0.6373
 epoch: 60, train_loss: 0.4017, test_loss: 1.4814, test_f1: 0.6417
 epoch: 61, train_loss: 0.3948, test_loss: 1.4301, test_f1: 0.6371
 epoch: 62, train_loss: 0.4089, test_loss: 1.4970, test_f1: 0.6290
 epoch: 63, train_loss: 0.4048, test_loss: 1.5035, test_f1: 0.6413
 epoch: 64, train_loss: 0.4066, test_loss: 1.5238, test_f1: 0.6442
 epoch: 65, train_loss: 0.3902, test_loss: 1.4745, test_f1: 0.6577
 epoch: 66, train_loss: 0.3779, test_loss: 1.5420, test_f1: 0.6482
 epoch: 67, train_loss: 0.4007, test_loss: 1.5685, test_f1: 0.6317
 epoch: 68, train_loss: 0.3767, test_loss: 1.4928, test_f1: 0.6472
 epoch: 69, train_loss: 0.4000, test_loss: 1.5762, test_f1: 0.6229
 epoch: 70, train_loss: 0.3829, test_loss: 1.5533, test_f1: 0.6355
 epoch: 71, train_loss: 0.3711, test_loss: 1.6302, test_f1: 0.6357
 epoch: 72, train_loss: 0.3809, test_loss: 1.6216, test_f1: 0.6345
 epoch: 73, train_loss: 0.3767, test_loss: 1.5251, test_f1: 0.6538
 epoch: 74, train_loss: 0.3671, test_loss: 1.5912, test_f1: 0.6176
 epoch: 75, train_loss: 0.3591, test_loss: 1.6571, test_f1: 0.6511
 epoch: 76, train_loss: 0.3617, test_loss: 1.6599, test_f1: 0.6278
 epoch: 77, train_loss: 0.3546, test_loss: 1.6196, test_f1: 0.6319
 epoch: 78, train_loss: 0.3581, test_loss: 1.6734, test_f1: 0.6257
 epoch: 79, train_loss: 0.3426, test_loss: 1.6323, test_f1: 0.6360
 epoch: 80, train_loss: 0.3502, test_loss: 1.6647, test_f1: 0.6290
 epoch: 81, train_loss: 0.3319, test_loss: 1.6833, test_f1: 0.6310
 epoch: 82, train_loss: 0.3493, test_loss: 1.6985, test_f1: 0.6323
 epoch: 83, train_loss: 0.3328, test_loss: 1.7326, test_f1: 0.6314
 epoch: 84, train_loss: 0.3475, test_loss: 1.7530, test_f1: 0.6516
 epoch: 85, train_loss: 0.3283, test_loss: 1.6667, test_f1: 0.6385
 epoch: 86, train_loss: 0.3725, test_loss: 1.7616, test_f1: 0.6157
 epoch: 87, train_loss: 0.3312, test_loss: 1.7831, test_f1: 0.6263
 epoch: 88, train_loss: 0.3269, test_loss: 1.8131, test_f1: 0.6391
 epoch: 89, train_loss: 0.3260, test_loss: 1.8644, test_f1: 0.6313
 epoch: 90, train_loss: 0.3312, test_loss: 1.8397, test_f1: 0.6108
 epoch: 91, train_loss: 0.3147, test_loss: 1.9416, test_f1: 0.6186
 epoch: 92, train_loss: 0.3364, test_loss: 1.8949, test_f1: 0.6331
 epoch: 93, train_loss: 0.3225, test_loss: 1.8502, test_f1: 0.6326
 epoch: 94, train_loss: 0.3113, test_loss: 1.8678, test_f1: 0.6260
 epoch: 95, train_loss: 0.3127, test_loss: 1.9122, test_f1: 0.6212
 epoch: 96, train_loss: 0.3438, test_loss: 1.8358, test_f1: 0.6260
 epoch: 97, train_loss: 0.2922, test_loss: 1.8376, test_f1: 0.6409
 epoch: 98, train_loss: 0.3095, test_loss: 1.8614, test_f1: 0.6374
 epoch: 99, train_loss: 0.3233, test_loss: 1.8577, test_f1: 0.6314
##################ITERATION #8 ****************************************
 epoch: 0, train_loss: 1.2930, test_loss: 1.2608, test_f1: 0.3214
 epoch: 1, train_loss: 1.0989, test_loss: 1.1052, test_f1: 0.4702
 epoch: 2, train_loss: 1.0194, test_loss: 1.0699, test_f1: 0.4927
 epoch: 3, train_loss: 1.0120, test_loss: 1.0536, test_f1: 0.5228
 epoch: 4, train_loss: 0.9529, test_loss: 1.0371, test_f1: 0.5537
 epoch: 5, train_loss: 0.9310, test_loss: 1.0352, test_f1: 0.5473
 epoch: 6, train_loss: 0.8979, test_loss: 1.0250, test_f1: 0.5556
 epoch: 7, train_loss: 0.8816, test_loss: 1.0434, test_f1: 0.5489
 epoch: 8, train_loss: 0.8630, test_loss: 1.0248, test_f1: 0.5573
 epoch: 9, train_loss: 0.8353, test_loss: 1.0284, test_f1: 0.5570
 epoch: 10, train_loss: 0.8237, test_loss: 1.0225, test_f1: 0.5524
 epoch: 11, train_loss: 0.8057, test_loss: 1.0375, test_f1: 0.5571
 epoch: 12, train_loss: 0.8083, test_loss: 1.0440, test_f1: 0.5643
 epoch: 13, train_loss: 0.7811, test_loss: 1.0309, test_f1: 0.5582
 epoch: 14, train_loss: 0.7784, test_loss: 1.0422, test_f1: 0.5668
 epoch: 15, train_loss: 0.7656, test_loss: 1.0306, test_f1: 0.5878
 epoch: 16, train_loss: 0.7316, test_loss: 1.0587, test_f1: 0.5830
 epoch: 17, train_loss: 0.7438, test_loss: 1.0604, test_f1: 0.5785
 epoch: 18, train_loss: 0.7092, test_loss: 1.0572, test_f1: 0.6088
 epoch: 19, train_loss: 0.7228, test_loss: 1.0416, test_f1: 0.5885
 epoch: 20, train_loss: 0.7268, test_loss: 1.0557, test_f1: 0.5995
 epoch: 21, train_loss: 0.6875, test_loss: 1.0592, test_f1: 0.5897
 epoch: 22, train_loss: 0.6888, test_loss: 1.1449, test_f1: 0.6038
 epoch: 23, train_loss: 0.6712, test_loss: 1.0513, test_f1: 0.5902
 epoch: 24, train_loss: 0.6834, test_loss: 1.0520, test_f1: 0.6068
 epoch: 25, train_loss: 0.6681, test_loss: 1.0569, test_f1: 0.6000
 epoch: 26, train_loss: 0.6449, test_loss: 1.0293, test_f1: 0.6042
 epoch: 27, train_loss: 0.6427, test_loss: 1.0733, test_f1: 0.5731
 epoch: 28, train_loss: 0.6366, test_loss: 1.0657, test_f1: 0.5762
 epoch: 29, train_loss: 0.6231, test_loss: 1.0702, test_f1: 0.6070
 epoch: 30, train_loss: 0.6086, test_loss: 1.0879, test_f1: 0.6028
 epoch: 31, train_loss: 0.6073, test_loss: 1.1233, test_f1: 0.6255
 epoch: 32, train_loss: 0.6035, test_loss: 1.0937, test_f1: 0.6067
 epoch: 33, train_loss: 0.5786, test_loss: 1.1257, test_f1: 0.5983
 epoch: 34, train_loss: 0.5975, test_loss: 1.1057, test_f1: 0.6184
 epoch: 35, train_loss: 0.5617, test_loss: 1.1571, test_f1: 0.6233
 epoch: 36, train_loss: 0.5722, test_loss: 1.1572, test_f1: 0.5997
 epoch: 37, train_loss: 0.5669, test_loss: 1.2087, test_f1: 0.5753
 epoch: 38, train_loss: 0.5547, test_loss: 1.1446, test_f1: 0.6024
 epoch: 39, train_loss: 0.5454, test_loss: 1.1675, test_f1: 0.5935
 epoch: 40, train_loss: 0.5389, test_loss: 1.2367, test_f1: 0.6171
 epoch: 41, train_loss: 0.5360, test_loss: 1.1629, test_f1: 0.6271
 epoch: 42, train_loss: 0.5387, test_loss: 1.2313, test_f1: 0.6182
 epoch: 43, train_loss: 0.4944, test_loss: 1.2461, test_f1: 0.6057
 epoch: 44, train_loss: 0.5094, test_loss: 1.2173, test_f1: 0.5979
 epoch: 45, train_loss: 0.5200, test_loss: 1.2856, test_f1: 0.6157
 epoch: 46, train_loss: 0.4911, test_loss: 1.2166, test_f1: 0.6200
 epoch: 47, train_loss: 0.4984, test_loss: 1.2316, test_f1: 0.6065
 epoch: 48, train_loss: 0.4967, test_loss: 1.2876, test_f1: 0.6079
 epoch: 49, train_loss: 0.4809, test_loss: 1.3079, test_f1: 0.5839
 epoch: 50, train_loss: 0.4844, test_loss: 1.3492, test_f1: 0.5938
 epoch: 51, train_loss: 0.4512, test_loss: 1.3166, test_f1: 0.6120
 epoch: 52, train_loss: 0.4413, test_loss: 1.2977, test_f1: 0.6308
 epoch: 53, train_loss: 0.4270, test_loss: 1.3367, test_f1: 0.6118
 epoch: 54, train_loss: 0.4390, test_loss: 1.3832, test_f1: 0.6064
 epoch: 55, train_loss: 0.4296, test_loss: 1.3342, test_f1: 0.6115
 epoch: 56, train_loss: 0.4350, test_loss: 1.3226, test_f1: 0.6140
 epoch: 57, train_loss: 0.4209, test_loss: 1.3952, test_f1: 0.6088
 epoch: 58, train_loss: 0.4219, test_loss: 1.3636, test_f1: 0.6243
 epoch: 59, train_loss: 0.4326, test_loss: 1.3764, test_f1: 0.6031
 epoch: 60, train_loss: 0.4233, test_loss: 1.4422, test_f1: 0.5988
 epoch: 61, train_loss: 0.4243, test_loss: 1.3744, test_f1: 0.6100
 epoch: 62, train_loss: 0.4144, test_loss: 1.4855, test_f1: 0.5870
 epoch: 63, train_loss: 0.4084, test_loss: 1.4217, test_f1: 0.6076
 epoch: 64, train_loss: 0.4131, test_loss: 1.3953, test_f1: 0.6207
 epoch: 65, train_loss: 0.3986, test_loss: 1.4826, test_f1: 0.5977
 epoch: 66, train_loss: 0.3689, test_loss: 1.4572, test_f1: 0.6326
 epoch: 67, train_loss: 0.4002, test_loss: 1.4290, test_f1: 0.6220
 epoch: 68, train_loss: 0.3886, test_loss: 1.5018, test_f1: 0.6239
 epoch: 69, train_loss: 0.3781, test_loss: 1.4526, test_f1: 0.6307
 epoch: 70, train_loss: 0.3856, test_loss: 1.4825, test_f1: 0.6234
 epoch: 71, train_loss: 0.3626, test_loss: 1.5018, test_f1: 0.6253
 epoch: 72, train_loss: 0.3879, test_loss: 1.5688, test_f1: 0.5886
 epoch: 73, train_loss: 0.3641, test_loss: 1.5680, test_f1: 0.6045
 epoch: 74, train_loss: 0.3714, test_loss: 1.5337, test_f1: 0.6398
 epoch: 75, train_loss: 0.3875, test_loss: 1.5167, test_f1: 0.6135
 epoch: 76, train_loss: 0.3688, test_loss: 1.5334, test_f1: 0.6300
 epoch: 77, train_loss: 0.3603, test_loss: 1.5256, test_f1: 0.6376
 epoch: 78, train_loss: 0.3828, test_loss: 1.5682, test_f1: 0.6491
 epoch: 79, train_loss: 0.3470, test_loss: 1.6123, test_f1: 0.6504
 epoch: 80, train_loss: 0.3434, test_loss: 1.5466, test_f1: 0.6197
 epoch: 81, train_loss: 0.3317, test_loss: 1.7680, test_f1: 0.6058
 epoch: 82, train_loss: 0.3465, test_loss: 1.6348, test_f1: 0.6020
 epoch: 83, train_loss: 0.3342, test_loss: 1.6190, test_f1: 0.6275
 epoch: 84, train_loss: 0.3508, test_loss: 1.6024, test_f1: 0.6278
 epoch: 85, train_loss: 0.3403, test_loss: 1.5972, test_f1: 0.6237
 epoch: 86, train_loss: 0.3174, test_loss: 1.6509, test_f1: 0.6362
 epoch: 87, train_loss: 0.3300, test_loss: 1.6139, test_f1: 0.6130
 epoch: 88, train_loss: 0.3251, test_loss: 1.6725, test_f1: 0.6378
 epoch: 89, train_loss: 0.3496, test_loss: 1.6010, test_f1: 0.6227
 epoch: 90, train_loss: 0.3205, test_loss: 1.6879, test_f1: 0.6262
 epoch: 91, train_loss: 0.3312, test_loss: 1.7259, test_f1: 0.6256
 epoch: 92, train_loss: 0.3337, test_loss: 1.7138, test_f1: 0.6156
 epoch: 93, train_loss: 0.3279, test_loss: 1.7522, test_f1: 0.6192
 epoch: 94, train_loss: 0.3240, test_loss: 1.7909, test_f1: 0.6271
 epoch: 95, train_loss: 0.3272, test_loss: 1.7368, test_f1: 0.6168
 epoch: 96, train_loss: 0.2810, test_loss: 1.7418, test_f1: 0.6420
 epoch: 97, train_loss: 0.3276, test_loss: 1.7835, test_f1: 0.6303
 epoch: 98, train_loss: 0.2885, test_loss: 1.7796, test_f1: 0.6161
 epoch: 99, train_loss: 0.3000, test_loss: 1.7961, test_f1: 0.6190
##################ITERATION #9 ****************************************
 epoch: 0, train_loss: 1.2514, test_loss: 1.2690, test_f1: 0.3245
 epoch: 1, train_loss: 1.0443, test_loss: 1.0903, test_f1: 0.5658
 epoch: 2, train_loss: 0.9843, test_loss: 1.0374, test_f1: 0.5851
 epoch: 3, train_loss: 0.9400, test_loss: 1.0197, test_f1: 0.5785
 epoch: 4, train_loss: 0.9255, test_loss: 1.0224, test_f1: 0.5651
 epoch: 5, train_loss: 0.9003, test_loss: 0.9903, test_f1: 0.6066
 epoch: 6, train_loss: 0.8921, test_loss: 1.0055, test_f1: 0.5510
 epoch: 7, train_loss: 0.8539, test_loss: 1.0420, test_f1: 0.5502
 epoch: 8, train_loss: 0.8407, test_loss: 0.9842, test_f1: 0.5755
 epoch: 9, train_loss: 0.8230, test_loss: 0.9913, test_f1: 0.5685
 epoch: 10, train_loss: 0.7962, test_loss: 0.9816, test_f1: 0.5569
 epoch: 11, train_loss: 0.7990, test_loss: 0.9504, test_f1: 0.5642
 epoch: 12, train_loss: 0.7581, test_loss: 0.9505, test_f1: 0.5984
 epoch: 13, train_loss: 0.7543, test_loss: 0.9701, test_f1: 0.5823
 epoch: 14, train_loss: 0.7607, test_loss: 0.9460, test_f1: 0.5826
 epoch: 15, train_loss: 0.7374, test_loss: 0.9474, test_f1: 0.5721
 epoch: 16, train_loss: 0.7121, test_loss: 0.9933, test_f1: 0.5665
 epoch: 17, train_loss: 0.7263, test_loss: 1.0029, test_f1: 0.5886
 epoch: 18, train_loss: 0.6822, test_loss: 0.9606, test_f1: 0.6091
 epoch: 19, train_loss: 0.6882, test_loss: 0.9683, test_f1: 0.5927
 epoch: 20, train_loss: 0.6627, test_loss: 0.9795, test_f1: 0.5860
 epoch: 21, train_loss: 0.6366, test_loss: 1.0245, test_f1: 0.5791
 epoch: 22, train_loss: 0.6422, test_loss: 0.9606, test_f1: 0.6051
 epoch: 23, train_loss: 0.6252, test_loss: 0.9934, test_f1: 0.6053
 epoch: 24, train_loss: 0.6289, test_loss: 1.0356, test_f1: 0.5996
 epoch: 25, train_loss: 0.6307, test_loss: 1.0373, test_f1: 0.5782
 epoch: 26, train_loss: 0.6033, test_loss: 0.9910, test_f1: 0.6229
 epoch: 27, train_loss: 0.6074, test_loss: 1.0667, test_f1: 0.5930
 epoch: 28, train_loss: 0.5934, test_loss: 1.0115, test_f1: 0.6099
 epoch: 29, train_loss: 0.5949, test_loss: 1.0064, test_f1: 0.6132
 epoch: 30, train_loss: 0.5704, test_loss: 1.0261, test_f1: 0.5754
 epoch: 31, train_loss: 0.5645, test_loss: 1.0857, test_f1: 0.5871
 epoch: 32, train_loss: 0.5619, test_loss: 1.0663, test_f1: 0.6106
 epoch: 33, train_loss: 0.5557, test_loss: 1.0621, test_f1: 0.5804
 epoch: 34, train_loss: 0.5451, test_loss: 1.1098, test_f1: 0.5972
 epoch: 35, train_loss: 0.5593, test_loss: 1.0531, test_f1: 0.6057
 epoch: 36, train_loss: 0.5322, test_loss: 1.0728, test_f1: 0.6019
 epoch: 37, train_loss: 0.5275, test_loss: 1.0962, test_f1: 0.6048
 epoch: 38, train_loss: 0.4992, test_loss: 1.1354, test_f1: 0.5938
 epoch: 39, train_loss: 0.5187, test_loss: 1.1360, test_f1: 0.5944
 epoch: 40, train_loss: 0.5074, test_loss: 1.1090, test_f1: 0.5980
 epoch: 41, train_loss: 0.4941, test_loss: 1.1413, test_f1: 0.5917
 epoch: 42, train_loss: 0.4863, test_loss: 1.1718, test_f1: 0.6042
 epoch: 43, train_loss: 0.4837, test_loss: 1.2252, test_f1: 0.6072
 epoch: 44, train_loss: 0.4889, test_loss: 1.2392, test_f1: 0.6026
 epoch: 45, train_loss: 0.4737, test_loss: 1.1954, test_f1: 0.5933
 epoch: 46, train_loss: 0.4432, test_loss: 1.1463, test_f1: 0.6091
 epoch: 47, train_loss: 0.4683, test_loss: 1.1677, test_f1: 0.5947
 epoch: 48, train_loss: 0.4506, test_loss: 1.1202, test_f1: 0.6305
 epoch: 49, train_loss: 0.4517, test_loss: 1.2254, test_f1: 0.6292
 epoch: 50, train_loss: 0.4240, test_loss: 1.2162, test_f1: 0.6472
 epoch: 51, train_loss: 0.4132, test_loss: 1.1645, test_f1: 0.6207
 epoch: 52, train_loss: 0.4357, test_loss: 1.2219, test_f1: 0.6169
 epoch: 53, train_loss: 0.3911, test_loss: 1.2041, test_f1: 0.6258
 epoch: 54, train_loss: 0.4154, test_loss: 1.2250, test_f1: 0.6248
 epoch: 55, train_loss: 0.3861, test_loss: 1.2307, test_f1: 0.6238
 epoch: 56, train_loss: 0.3944, test_loss: 1.2874, test_f1: 0.6313
 epoch: 57, train_loss: 0.4030, test_loss: 1.3183, test_f1: 0.6241
 epoch: 58, train_loss: 0.3782, test_loss: 1.2919, test_f1: 0.6200
 epoch: 59, train_loss: 0.3909, test_loss: 1.3217, test_f1: 0.6281
 epoch: 60, train_loss: 0.3767, test_loss: 1.3151, test_f1: 0.6033
 epoch: 61, train_loss: 0.3834, test_loss: 1.3161, test_f1: 0.6251
 epoch: 62, train_loss: 0.3769, test_loss: 1.2926, test_f1: 0.6245
 epoch: 63, train_loss: 0.3608, test_loss: 1.2765, test_f1: 0.6232
 epoch: 64, train_loss: 0.3616, test_loss: 1.3181, test_f1: 0.6190
 epoch: 65, train_loss: 0.3723, test_loss: 1.3823, test_f1: 0.6272
 epoch: 66, train_loss: 0.3638, test_loss: 1.2886, test_f1: 0.6236
 epoch: 67, train_loss: 0.3552, test_loss: 1.3626, test_f1: 0.6197
 epoch: 68, train_loss: 0.3556, test_loss: 1.2840, test_f1: 0.6225
 epoch: 69, train_loss: 0.3328, test_loss: 1.3842, test_f1: 0.6343
 epoch: 70, train_loss: 0.3598, test_loss: 1.3436, test_f1: 0.6287
 epoch: 71, train_loss: 0.3357, test_loss: 1.3893, test_f1: 0.6133
 epoch: 72, train_loss: 0.3345, test_loss: 1.3583, test_f1: 0.6341
 epoch: 73, train_loss: 0.3442, test_loss: 1.3434, test_f1: 0.6135
 epoch: 74, train_loss: 0.3293, test_loss: 1.4138, test_f1: 0.6255
 epoch: 75, train_loss: 0.3379, test_loss: 1.3664, test_f1: 0.6436
 epoch: 76, train_loss: 0.3333, test_loss: 1.4026, test_f1: 0.6187
 epoch: 77, train_loss: 0.3185, test_loss: 1.4231, test_f1: 0.6106
 epoch: 78, train_loss: 0.3309, test_loss: 1.4867, test_f1: 0.6265
 epoch: 79, train_loss: 0.3176, test_loss: 1.5183, test_f1: 0.6179
 epoch: 80, train_loss: 0.3053, test_loss: 1.4681, test_f1: 0.6201
 epoch: 81, train_loss: 0.3156, test_loss: 1.5302, test_f1: 0.6148
 epoch: 82, train_loss: 0.3052, test_loss: 1.4871, test_f1: 0.6226
 epoch: 83, train_loss: 0.3178, test_loss: 1.4921, test_f1: 0.6205
 epoch: 84, train_loss: 0.3121, test_loss: 1.5676, test_f1: 0.6198
 epoch: 85, train_loss: 0.3033, test_loss: 1.5719, test_f1: 0.6305
 epoch: 86, train_loss: 0.3139, test_loss: 1.5452, test_f1: 0.5974
 epoch: 87, train_loss: 0.3036, test_loss: 1.5826, test_f1: 0.5993
 epoch: 88, train_loss: 0.2869, test_loss: 1.6063, test_f1: 0.6355
 epoch: 89, train_loss: 0.3018, test_loss: 1.5475, test_f1: 0.6333
 epoch: 90, train_loss: 0.3054, test_loss: 1.5548, test_f1: 0.6239
 epoch: 91, train_loss: 0.2897, test_loss: 1.5188, test_f1: 0.6409
 epoch: 92, train_loss: 0.2754, test_loss: 1.5578, test_f1: 0.6217
 epoch: 93, train_loss: 0.2990, test_loss: 1.5862, test_f1: 0.6332
 epoch: 94, train_loss: 0.2778, test_loss: 1.5844, test_f1: 0.6158
 epoch: 95, train_loss: 0.2768, test_loss: 1.5195, test_f1: 0.6478
 epoch: 96, train_loss: 0.2865, test_loss: 1.5159, test_f1: 0.6289
 epoch: 97, train_loss: 0.2934, test_loss: 1.5902, test_f1: 0.6124
 epoch: 98, train_loss: 0.2785, test_loss: 1.5019, test_f1: 0.6308
 epoch: 99, train_loss: 0.2717, test_loss: 1.6539, test_f1: 0.6210

Training completed in 511.23 seconds
Best F1: 0.6777 at epoch 75
Mean F1 across iterations: 0.6511  0.0155
========================FINAL RESULTS================================
FEGIN weighted F1: 0.6777  0.0155
python main.py --data ltspice_demos --representation component_pin --model FEGIN --layers 2 --hiddens 128 --batch_size 32 --lr 0.0001 --emb_size 128 --epochs 100 --save_appendix component_pin_L2_H128_BS32_LR0.0001_E128 --no_val
-----



STDERR:
  File "main.py", line 370, in <module>
    main()
  File "main.py", line 254, in main
    dataset = dataset_class(
  File "/home/philip/projects/ltspice_examples_code_repo/Circuit-Completion-Using-GNNs/component_classification_with_link_prediction_head/evaluation/FEGIN/kernel/circuit_datasets.py", line 15, in __init__
    self.data, self.slices = torch.load(self.processed_paths[0])
  File "/home/philip/.local/lib/python3.8/site-packages/torch/serialization.py", line 1040, in load
    warnings.warn(
  File "/usr/lib/python3.8/warnings.py", line 109, in _showwarnmsg
    sw(msg.message, msg.category, msg.filename, msg.lineno,
  File "main.py", line 47, in warn_with_traceback
    traceback.print_stack(file=log)
/home/philip/projects/ltspice_examples_code_repo/Circuit-Completion-Using-GNNs/component_classification_with_link_prediction_head/evaluation/FEGIN/kernel/circuit_datasets.py:15: FutureWarning: You are using `torch.load` with `weights_only=False` (the current default value), which uses the default pickle module implicitly. It is possible to construct malicious pickle data which will execute arbitrary code during unpickling (See https://github.com/pytorch/pytorch/blob/main/SECURITY.md#untrusted-models for more details). In a future release, the default value for `weights_only` will be flipped to `True`. This limits the functions that could be executed during unpickling. Arbitrary objects will no longer be allowed to be loaded via this mode unless they are explicitly allowlisted by the user via `torch.serialization.add_safe_globals`. We recommend you start setting `weights_only=True` for any use case where you don't have full control of the loaded file. Please open an issue on GitHub for any issues related to this experimental feature.
  self.data, self.slices = torch.load(self.processed_paths[0])
