STDOUT:
Results will be saved in /home/philip/projects/ltspice_examples_code_repo/Circuit-Completion-Using-GNNs/component_classification_with_link_prediction_head/evaluation/FEGIN/results/model_FEGIN_dataset_ltspice_examples
Command line input: python main.py --data ltspice_examples --representation component_pin_net --model FEGIN --layers 4 --hiddens 16 --batch_size 32 --lr 0.01 --emb_size 250 --epochs 100 --save_appendix component_pin_net_L4_H16_BS32_LR0.01_E250 --no_val
 is saved.
-----
ltspice_examples - FEGIN
Using 4 layers, 16 hidden units, h = 2
Loading component_pin_net representation dataset
ENTERED
Training FEGIN on component_pin_net representation
Train: 3558, Test: 846
##################ITERATION #0 ****************************************
 epoch: 0, train_loss: 1.1771, test_loss: 1.1077, test_f1: 0.3527
 epoch: 1, train_loss: 1.0529, test_loss: 1.0730, test_f1: 0.4526
 epoch: 2, train_loss: 1.0132, test_loss: 1.0242, test_f1: 0.4519
 epoch: 3, train_loss: 1.0031, test_loss: 0.9892, test_f1: 0.4803
 epoch: 4, train_loss: 1.0024, test_loss: 0.9941, test_f1: 0.4463
 epoch: 5, train_loss: 0.9961, test_loss: 0.9792, test_f1: 0.4573
 epoch: 6, train_loss: 0.9785, test_loss: 0.9497, test_f1: 0.4833
 epoch: 7, train_loss: 0.9596, test_loss: 1.0472, test_f1: 0.4285
 epoch: 8, train_loss: 0.9678, test_loss: 1.0304, test_f1: 0.4884
 epoch: 9, train_loss: 0.9660, test_loss: 1.0585, test_f1: 0.4704
 epoch: 10, train_loss: 0.9457, test_loss: 0.9693, test_f1: 0.4993
 epoch: 11, train_loss: 0.9464, test_loss: 1.0027, test_f1: 0.4775
 epoch: 12, train_loss: 0.9696, test_loss: 1.1006, test_f1: 0.4551
 epoch: 13, train_loss: 0.9897, test_loss: 1.0315, test_f1: 0.4794
 epoch: 14, train_loss: 0.9573, test_loss: 1.0169, test_f1: 0.5293
 epoch: 15, train_loss: 0.9571, test_loss: 1.0447, test_f1: 0.4830
 epoch: 16, train_loss: 0.9538, test_loss: 1.0277, test_f1: 0.4701
 epoch: 17, train_loss: 0.9366, test_loss: 1.0055, test_f1: 0.4927
 epoch: 18, train_loss: 0.9242, test_loss: 1.0022, test_f1: 0.4994
 epoch: 19, train_loss: 0.9288, test_loss: 1.0043, test_f1: 0.4975
 epoch: 20, train_loss: 0.9296, test_loss: 0.9560, test_f1: 0.4990
 epoch: 21, train_loss: 0.9303, test_loss: 0.9603, test_f1: 0.4979
 epoch: 22, train_loss: 0.9239, test_loss: 0.9528, test_f1: 0.5021
 epoch: 23, train_loss: 0.9174, test_loss: 0.9292, test_f1: 0.5402
 epoch: 24, train_loss: 0.9355, test_loss: 0.9755, test_f1: 0.5400
 epoch: 25, train_loss: 0.9117, test_loss: 0.9632, test_f1: 0.4921
 epoch: 26, train_loss: 0.9083, test_loss: 0.9547, test_f1: 0.5140
 epoch: 27, train_loss: 0.8909, test_loss: 0.9938, test_f1: 0.5226
 epoch: 28, train_loss: 0.8997, test_loss: 0.9878, test_f1: 0.5291
 epoch: 29, train_loss: 0.9070, test_loss: 0.9533, test_f1: 0.5376
 epoch: 30, train_loss: 0.9050, test_loss: 1.0047, test_f1: 0.5071
 epoch: 31, train_loss: 0.8908, test_loss: 0.9526, test_f1: 0.5170
 epoch: 32, train_loss: 0.8948, test_loss: 0.8931, test_f1: 0.5219
 epoch: 33, train_loss: 0.8729, test_loss: 0.9162, test_f1: 0.5144
 epoch: 34, train_loss: 0.8827, test_loss: 0.9398, test_f1: 0.5146
 epoch: 35, train_loss: 0.8767, test_loss: 0.9072, test_f1: 0.5346
 epoch: 36, train_loss: 0.8737, test_loss: 0.9152, test_f1: 0.5725
 epoch: 37, train_loss: 0.9097, test_loss: 0.9615, test_f1: 0.4622
 epoch: 38, train_loss: 0.8737, test_loss: 0.9462, test_f1: 0.5540
 epoch: 39, train_loss: 0.8688, test_loss: 0.8998, test_f1: 0.5303
 epoch: 40, train_loss: 0.8707, test_loss: 0.9007, test_f1: 0.5243
 epoch: 41, train_loss: 0.8683, test_loss: 0.9450, test_f1: 0.5188
 epoch: 42, train_loss: 0.8644, test_loss: 0.9061, test_f1: 0.5355
 epoch: 43, train_loss: 0.8592, test_loss: 0.9250, test_f1: 0.5557
 epoch: 44, train_loss: 0.8487, test_loss: 0.8862, test_f1: 0.5595
 epoch: 45, train_loss: 0.8583, test_loss: 0.9196, test_f1: 0.5310
 epoch: 46, train_loss: 0.8369, test_loss: 0.9290, test_f1: 0.5443
 epoch: 47, train_loss: 0.8323, test_loss: 0.9209, test_f1: 0.5453
 epoch: 48, train_loss: 0.8428, test_loss: 0.9111, test_f1: 0.5466
 epoch: 49, train_loss: 0.8613, test_loss: 0.8961, test_f1: 0.5424
 epoch: 50, train_loss: 0.8465, test_loss: 0.8444, test_f1: 0.5519
 epoch: 51, train_loss: 0.8262, test_loss: 0.8980, test_f1: 0.5377
 epoch: 52, train_loss: 0.8071, test_loss: 0.8842, test_f1: 0.5552
 epoch: 53, train_loss: 0.8138, test_loss: 0.8797, test_f1: 0.5496
 epoch: 54, train_loss: 0.8056, test_loss: 0.8536, test_f1: 0.5704
 epoch: 55, train_loss: 0.8028, test_loss: 0.8597, test_f1: 0.5685
 epoch: 56, train_loss: 0.7919, test_loss: 0.8677, test_f1: 0.5529
 epoch: 57, train_loss: 0.8044, test_loss: 0.8854, test_f1: 0.5563
 epoch: 58, train_loss: 0.8030, test_loss: 0.8588, test_f1: 0.5308
 epoch: 59, train_loss: 0.7994, test_loss: 0.8558, test_f1: 0.5755
 epoch: 60, train_loss: 0.8040, test_loss: 0.8433, test_f1: 0.5735
 epoch: 61, train_loss: 0.8033, test_loss: 0.8677, test_f1: 0.5812
 epoch: 62, train_loss: 0.7991, test_loss: 0.8799, test_f1: 0.5987
 epoch: 63, train_loss: 0.7904, test_loss: 0.8438, test_f1: 0.5931
 epoch: 64, train_loss: 0.7771, test_loss: 0.8946, test_f1: 0.5764
 epoch: 65, train_loss: 0.7859, test_loss: 0.8929, test_f1: 0.5610
 epoch: 66, train_loss: 0.7890, test_loss: 0.8909, test_f1: 0.5676
 epoch: 67, train_loss: 0.7890, test_loss: 0.9036, test_f1: 0.5365
 epoch: 68, train_loss: 0.7960, test_loss: 0.8553, test_f1: 0.5695
 epoch: 69, train_loss: 0.7852, test_loss: 0.8836, test_f1: 0.5713
 epoch: 70, train_loss: 0.7986, test_loss: 0.8631, test_f1: 0.5840
 epoch: 71, train_loss: 0.7874, test_loss: 0.8316, test_f1: 0.5806
 epoch: 72, train_loss: 0.7818, test_loss: 0.8636, test_f1: 0.5818
 epoch: 73, train_loss: 0.7732, test_loss: 0.8670, test_f1: 0.5660
 epoch: 74, train_loss: 0.7743, test_loss: 0.8609, test_f1: 0.6005
 epoch: 75, train_loss: 0.7840, test_loss: 0.8566, test_f1: 0.5469
 epoch: 76, train_loss: 0.7600, test_loss: 0.8871, test_f1: 0.5636
 epoch: 77, train_loss: 0.7731, test_loss: 0.8605, test_f1: 0.5736
 epoch: 78, train_loss: 0.7725, test_loss: 0.8839, test_f1: 0.5551
 epoch: 79, train_loss: 0.7775, test_loss: 0.8745, test_f1: 0.5428
 epoch: 80, train_loss: 0.7701, test_loss: 0.9133, test_f1: 0.5820
 epoch: 81, train_loss: 0.7858, test_loss: 0.8915, test_f1: 0.5660
 epoch: 82, train_loss: 0.7868, test_loss: 0.8849, test_f1: 0.5808
 epoch: 83, train_loss: 0.7723, test_loss: 0.8410, test_f1: 0.5815
 epoch: 84, train_loss: 0.7929, test_loss: 0.8245, test_f1: 0.5923
 epoch: 85, train_loss: 0.7773, test_loss: 0.8285, test_f1: 0.5918
 epoch: 86, train_loss: 0.7744, test_loss: 0.8522, test_f1: 0.5914
 epoch: 87, train_loss: 0.7689, test_loss: 0.8394, test_f1: 0.5986
 epoch: 88, train_loss: 0.7673, test_loss: 0.8246, test_f1: 0.5637
 epoch: 89, train_loss: 0.7604, test_loss: 0.8393, test_f1: 0.5857
 epoch: 90, train_loss: 0.7640, test_loss: 0.8467, test_f1: 0.6155
 epoch: 91, train_loss: 0.7631, test_loss: 0.8680, test_f1: 0.6068
 epoch: 92, train_loss: 0.7743, test_loss: 0.8172, test_f1: 0.5825
 epoch: 93, train_loss: 0.7533, test_loss: 0.8657, test_f1: 0.6144
 epoch: 94, train_loss: 0.7659, test_loss: 0.8363, test_f1: 0.5681
 epoch: 95, train_loss: 0.7686, test_loss: 0.8614, test_f1: 0.5689
 epoch: 96, train_loss: 0.7459, test_loss: 0.8744, test_f1: 0.5974
 epoch: 97, train_loss: 0.7623, test_loss: 0.8208, test_f1: 0.5947
 epoch: 98, train_loss: 0.7477, test_loss: 0.8433, test_f1: 0.5993
 epoch: 99, train_loss: 0.7575, test_loss: 0.8995, test_f1: 0.5820
##################ITERATION #1 ****************************************
 epoch: 0, train_loss: 1.0986, test_loss: 1.0792, test_f1: 0.4729
 epoch: 1, train_loss: 1.0051, test_loss: 1.0859, test_f1: 0.4763
 epoch: 2, train_loss: 0.9944, test_loss: 1.0012, test_f1: 0.4470
 epoch: 3, train_loss: 0.9771, test_loss: 1.0391, test_f1: 0.4595
 epoch: 4, train_loss: 0.9660, test_loss: 1.0165, test_f1: 0.5019
 epoch: 5, train_loss: 0.9492, test_loss: 1.0484, test_f1: 0.4714
 epoch: 6, train_loss: 0.9606, test_loss: 1.0087, test_f1: 0.4714
 epoch: 7, train_loss: 0.9517, test_loss: 0.9977, test_f1: 0.4864
 epoch: 8, train_loss: 0.9330, test_loss: 1.0162, test_f1: 0.5260
 epoch: 9, train_loss: 0.9382, test_loss: 1.0146, test_f1: 0.4937
 epoch: 10, train_loss: 0.9384, test_loss: 0.9832, test_f1: 0.4559
 epoch: 11, train_loss: 0.9240, test_loss: 0.9405, test_f1: 0.5205
 epoch: 12, train_loss: 0.9269, test_loss: 0.9489, test_f1: 0.5142
 epoch: 13, train_loss: 0.9234, test_loss: 0.9387, test_f1: 0.5545
 epoch: 14, train_loss: 0.9222, test_loss: 0.9897, test_f1: 0.5068
 epoch: 15, train_loss: 0.9133, test_loss: 0.9512, test_f1: 0.5050
 epoch: 16, train_loss: 0.9027, test_loss: 0.9341, test_f1: 0.5032
 epoch: 17, train_loss: 0.8971, test_loss: 0.9918, test_f1: 0.4877
 epoch: 18, train_loss: 0.8933, test_loss: 0.8814, test_f1: 0.5173
 epoch: 19, train_loss: 0.8792, test_loss: 0.9430, test_f1: 0.5008
 epoch: 20, train_loss: 0.8939, test_loss: 0.9554, test_f1: 0.5183
 epoch: 21, train_loss: 0.8908, test_loss: 0.8910, test_f1: 0.5517
 epoch: 22, train_loss: 0.8816, test_loss: 0.9101, test_f1: 0.5255
 epoch: 23, train_loss: 0.8803, test_loss: 0.8703, test_f1: 0.5765
 epoch: 24, train_loss: 0.8523, test_loss: 0.8854, test_f1: 0.5637
 epoch: 25, train_loss: 0.8763, test_loss: 0.8714, test_f1: 0.5333
 epoch: 26, train_loss: 0.8586, test_loss: 0.8680, test_f1: 0.6015
 epoch: 27, train_loss: 0.8461, test_loss: 0.8776, test_f1: 0.5282
 epoch: 28, train_loss: 0.8595, test_loss: 0.8382, test_f1: 0.6122
 epoch: 29, train_loss: 0.8637, test_loss: 0.8608, test_f1: 0.5399
 epoch: 30, train_loss: 0.8672, test_loss: 0.8741, test_f1: 0.5694
 epoch: 31, train_loss: 0.8557, test_loss: 0.8565, test_f1: 0.5858
 epoch: 32, train_loss: 0.8295, test_loss: 0.8629, test_f1: 0.5890
 epoch: 33, train_loss: 0.8424, test_loss: 0.8451, test_f1: 0.5945
 epoch: 34, train_loss: 0.8355, test_loss: 0.8047, test_f1: 0.6057
 epoch: 35, train_loss: 0.8238, test_loss: 0.8206, test_f1: 0.5874
 epoch: 36, train_loss: 0.8309, test_loss: 0.8065, test_f1: 0.5817
 epoch: 37, train_loss: 0.8343, test_loss: 0.8435, test_f1: 0.5999
 epoch: 38, train_loss: 0.8251, test_loss: 0.9913, test_f1: 0.5179
 epoch: 39, train_loss: 0.8282, test_loss: 0.8185, test_f1: 0.5912
 epoch: 40, train_loss: 0.8221, test_loss: 0.7628, test_f1: 0.6310
 epoch: 41, train_loss: 0.8174, test_loss: 0.7668, test_f1: 0.5811
 epoch: 42, train_loss: 0.8057, test_loss: 0.8918, test_f1: 0.5154
 epoch: 43, train_loss: 0.8081, test_loss: 0.7828, test_f1: 0.5651
 epoch: 44, train_loss: 0.8218, test_loss: 0.7669, test_f1: 0.6376
 epoch: 45, train_loss: 0.8165, test_loss: 0.7497, test_f1: 0.6384
 epoch: 46, train_loss: 0.8107, test_loss: 0.9193, test_f1: 0.5138
 epoch: 47, train_loss: 0.8226, test_loss: 0.8263, test_f1: 0.6054
 epoch: 48, train_loss: 0.8169, test_loss: 0.7771, test_f1: 0.5936
 epoch: 49, train_loss: 0.8100, test_loss: 0.7938, test_f1: 0.5745
 epoch: 50, train_loss: 0.8077, test_loss: 0.8340, test_f1: 0.5899
 epoch: 51, train_loss: 0.7787, test_loss: 0.7918, test_f1: 0.6035
 epoch: 52, train_loss: 0.7841, test_loss: 0.7251, test_f1: 0.6523
 epoch: 53, train_loss: 0.7646, test_loss: 0.7284, test_f1: 0.6201
 epoch: 54, train_loss: 0.7762, test_loss: 0.7425, test_f1: 0.6299
 epoch: 55, train_loss: 0.7784, test_loss: 0.7337, test_f1: 0.6098
 epoch: 56, train_loss: 0.7727, test_loss: 0.7326, test_f1: 0.6502
 epoch: 57, train_loss: 0.7599, test_loss: 0.7108, test_f1: 0.6338
 epoch: 58, train_loss: 0.7638, test_loss: 0.7451, test_f1: 0.6140
 epoch: 59, train_loss: 0.7469, test_loss: 0.7265, test_f1: 0.6136
 epoch: 60, train_loss: 0.7700, test_loss: 0.7297, test_f1: 0.6339
 epoch: 61, train_loss: 0.7575, test_loss: 0.7294, test_f1: 0.6306
 epoch: 62, train_loss: 0.7522, test_loss: 0.7481, test_f1: 0.6014
 epoch: 63, train_loss: 0.7540, test_loss: 0.7176, test_f1: 0.6209
 epoch: 64, train_loss: 0.7570, test_loss: 0.7548, test_f1: 0.6452
 epoch: 65, train_loss: 0.7539, test_loss: 0.7347, test_f1: 0.6311
 epoch: 66, train_loss: 0.7633, test_loss: 0.7517, test_f1: 0.6379
 epoch: 67, train_loss: 0.7585, test_loss: 0.7358, test_f1: 0.6146
 epoch: 68, train_loss: 0.7417, test_loss: 0.7428, test_f1: 0.6211
 epoch: 69, train_loss: 0.7461, test_loss: 0.7681, test_f1: 0.6208
 epoch: 70, train_loss: 0.7463, test_loss: 0.7286, test_f1: 0.6063
 epoch: 71, train_loss: 0.7528, test_loss: 0.7504, test_f1: 0.6151
 epoch: 72, train_loss: 0.7438, test_loss: 0.7030, test_f1: 0.6252
 epoch: 73, train_loss: 0.7445, test_loss: 0.7408, test_f1: 0.6114
 epoch: 74, train_loss: 0.7490, test_loss: 0.7511, test_f1: 0.5793
 epoch: 75, train_loss: 0.7506, test_loss: 0.7518, test_f1: 0.6451
 epoch: 76, train_loss: 0.7440, test_loss: 0.7594, test_f1: 0.6039
 epoch: 77, train_loss: 0.7358, test_loss: 0.7361, test_f1: 0.6430
 epoch: 78, train_loss: 0.7479, test_loss: 0.7788, test_f1: 0.6489
 epoch: 79, train_loss: 0.7359, test_loss: 0.7187, test_f1: 0.6449
 epoch: 80, train_loss: 0.7637, test_loss: 0.7091, test_f1: 0.6453
 epoch: 81, train_loss: 0.7493, test_loss: 0.7519, test_f1: 0.6540
 epoch: 82, train_loss: 0.7339, test_loss: 0.7544, test_f1: 0.6104
 epoch: 83, train_loss: 0.7369, test_loss: 0.7541, test_f1: 0.6630
 epoch: 84, train_loss: 0.7342, test_loss: 0.6963, test_f1: 0.6547
 epoch: 85, train_loss: 0.7537, test_loss: 0.7186, test_f1: 0.6406
 epoch: 86, train_loss: 0.7540, test_loss: 0.7294, test_f1: 0.6670
 epoch: 87, train_loss: 0.7326, test_loss: 0.7270, test_f1: 0.6249
 epoch: 88, train_loss: 0.7270, test_loss: 0.7398, test_f1: 0.6477
 epoch: 89, train_loss: 0.7351, test_loss: 0.7379, test_f1: 0.6404
 epoch: 90, train_loss: 0.7311, test_loss: 0.7203, test_f1: 0.6404
 epoch: 91, train_loss: 0.7350, test_loss: 0.7304, test_f1: 0.6340
 epoch: 92, train_loss: 0.7334, test_loss: 0.7076, test_f1: 0.6561
 epoch: 93, train_loss: 0.7282, test_loss: 0.7418, test_f1: 0.6031
 epoch: 94, train_loss: 0.7375, test_loss: 0.6959, test_f1: 0.6491
 epoch: 95, train_loss: 0.7217, test_loss: 0.7023, test_f1: 0.6628
 epoch: 96, train_loss: 0.7268, test_loss: 0.6973, test_f1: 0.6653
 epoch: 97, train_loss: 0.7524, test_loss: 0.7006, test_f1: 0.6433
 epoch: 98, train_loss: 0.7254, test_loss: 0.6882, test_f1: 0.6511
 epoch: 99, train_loss: 0.7326, test_loss: 0.6916, test_f1: 0.6546
##################ITERATION #2 ****************************************
 epoch: 0, train_loss: 1.1196, test_loss: 1.1007, test_f1: 0.3857
 epoch: 1, train_loss: 1.0374, test_loss: 1.0741, test_f1: 0.4067
 epoch: 2, train_loss: 1.0467, test_loss: 1.0360, test_f1: 0.4432
 epoch: 3, train_loss: 1.0035, test_loss: 1.0094, test_f1: 0.5114
 epoch: 4, train_loss: 0.9853, test_loss: 0.9608, test_f1: 0.5479
 epoch: 5, train_loss: 0.9641, test_loss: 0.9810, test_f1: 0.4925
 epoch: 6, train_loss: 0.9789, test_loss: 1.0440, test_f1: 0.4286
 epoch: 7, train_loss: 0.9827, test_loss: 0.9942, test_f1: 0.4839
 epoch: 8, train_loss: 0.9582, test_loss: 0.9868, test_f1: 0.4697
 epoch: 9, train_loss: 0.9426, test_loss: 0.9727, test_f1: 0.4745
 epoch: 10, train_loss: 0.9346, test_loss: 0.9963, test_f1: 0.4568
 epoch: 11, train_loss: 0.9305, test_loss: 1.0881, test_f1: 0.4331
 epoch: 12, train_loss: 0.9230, test_loss: 0.8982, test_f1: 0.5123
 epoch: 13, train_loss: 0.9307, test_loss: 0.8873, test_f1: 0.5336
 epoch: 14, train_loss: 0.9195, test_loss: 0.9507, test_f1: 0.5043
 epoch: 15, train_loss: 0.9186, test_loss: 0.9392, test_f1: 0.5202
 epoch: 16, train_loss: 0.8998, test_loss: 0.9602, test_f1: 0.5342
 epoch: 17, train_loss: 0.8945, test_loss: 0.9632, test_f1: 0.4738
 epoch: 18, train_loss: 0.9031, test_loss: 0.9122, test_f1: 0.5644
 epoch: 19, train_loss: 0.8973, test_loss: 0.8610, test_f1: 0.5394
 epoch: 20, train_loss: 0.8880, test_loss: 0.8785, test_f1: 0.5684
 epoch: 21, train_loss: 0.8919, test_loss: 0.9162, test_f1: 0.5148
 epoch: 22, train_loss: 0.8744, test_loss: 0.8937, test_f1: 0.5529
 epoch: 23, train_loss: 0.8833, test_loss: 0.8634, test_f1: 0.5483
 epoch: 24, train_loss: 0.8679, test_loss: 0.8822, test_f1: 0.5391
 epoch: 25, train_loss: 0.8569, test_loss: 0.8394, test_f1: 0.5880
 epoch: 26, train_loss: 0.8532, test_loss: 0.8531, test_f1: 0.5381
 epoch: 27, train_loss: 0.8649, test_loss: 0.9048, test_f1: 0.5988
 epoch: 28, train_loss: 0.8576, test_loss: 0.9639, test_f1: 0.4946
 epoch: 29, train_loss: 0.8496, test_loss: 0.8707, test_f1: 0.5744
 epoch: 30, train_loss: 0.8558, test_loss: 0.9957, test_f1: 0.5439
 epoch: 31, train_loss: 0.8560, test_loss: 0.9279, test_f1: 0.5382
 epoch: 32, train_loss: 0.8420, test_loss: 0.8590, test_f1: 0.5694
 epoch: 33, train_loss: 0.8493, test_loss: 0.8413, test_f1: 0.5468
 epoch: 34, train_loss: 0.8452, test_loss: 0.9191, test_f1: 0.5329
 epoch: 35, train_loss: 0.8444, test_loss: 0.8725, test_f1: 0.5587
 epoch: 36, train_loss: 0.8511, test_loss: 0.8923, test_f1: 0.5576
 epoch: 37, train_loss: 0.8587, test_loss: 0.8406, test_f1: 0.5474
 epoch: 38, train_loss: 0.8320, test_loss: 0.9189, test_f1: 0.5267
 epoch: 39, train_loss: 0.8435, test_loss: 0.8261, test_f1: 0.6092
 epoch: 40, train_loss: 0.8337, test_loss: 0.8553, test_f1: 0.5469
 epoch: 41, train_loss: 0.8275, test_loss: 0.9406, test_f1: 0.5710
 epoch: 42, train_loss: 0.8407, test_loss: 0.8356, test_f1: 0.5586
 epoch: 43, train_loss: 0.8199, test_loss: 0.8344, test_f1: 0.6199
 epoch: 44, train_loss: 0.8244, test_loss: 0.8661, test_f1: 0.5825
 epoch: 45, train_loss: 0.8407, test_loss: 0.8073, test_f1: 0.5609
 epoch: 46, train_loss: 0.8270, test_loss: 0.8147, test_f1: 0.5539
 epoch: 47, train_loss: 0.8604, test_loss: 0.8290, test_f1: 0.5950
 epoch: 48, train_loss: 0.8273, test_loss: 1.1165, test_f1: 0.4873
 epoch: 49, train_loss: 0.8154, test_loss: 0.8556, test_f1: 0.5825
 epoch: 50, train_loss: 0.8149, test_loss: 0.9361, test_f1: 0.5258
 epoch: 51, train_loss: 0.7916, test_loss: 0.8424, test_f1: 0.5687
 epoch: 52, train_loss: 0.7887, test_loss: 0.8241, test_f1: 0.6433
 epoch: 53, train_loss: 0.7802, test_loss: 0.8710, test_f1: 0.5643
 epoch: 54, train_loss: 0.7761, test_loss: 0.8022, test_f1: 0.6103
 epoch: 55, train_loss: 0.7841, test_loss: 0.8568, test_f1: 0.5819
 epoch: 56, train_loss: 0.7809, test_loss: 0.8534, test_f1: 0.5685
 epoch: 57, train_loss: 0.7712, test_loss: 0.8285, test_f1: 0.6405
 epoch: 58, train_loss: 0.7826, test_loss: 0.7671, test_f1: 0.6297
 epoch: 59, train_loss: 0.7724, test_loss: 0.8335, test_f1: 0.6497
 epoch: 60, train_loss: 0.7706, test_loss: 0.7998, test_f1: 0.6474
 epoch: 61, train_loss: 0.7769, test_loss: 0.7903, test_f1: 0.6316
 epoch: 62, train_loss: 0.7729, test_loss: 0.8342, test_f1: 0.6433
 epoch: 63, train_loss: 0.7611, test_loss: 0.7333, test_f1: 0.6220
 epoch: 64, train_loss: 0.7535, test_loss: 0.8375, test_f1: 0.6209
 epoch: 65, train_loss: 0.7660, test_loss: 0.8178, test_f1: 0.6409
 epoch: 66, train_loss: 0.7525, test_loss: 0.7383, test_f1: 0.6642
 epoch: 67, train_loss: 0.7485, test_loss: 0.8275, test_f1: 0.5756
 epoch: 68, train_loss: 0.7610, test_loss: 0.7571, test_f1: 0.6327
 epoch: 69, train_loss: 0.7596, test_loss: 0.8750, test_f1: 0.6070
 epoch: 70, train_loss: 0.7616, test_loss: 0.7910, test_f1: 0.6054
 epoch: 71, train_loss: 0.7497, test_loss: 0.8239, test_f1: 0.5811
 epoch: 72, train_loss: 0.7463, test_loss: 0.7278, test_f1: 0.6607
 epoch: 73, train_loss: 0.7608, test_loss: 0.7597, test_f1: 0.6421
 epoch: 74, train_loss: 0.7522, test_loss: 0.7879, test_f1: 0.6368
 epoch: 75, train_loss: 0.7385, test_loss: 0.8378, test_f1: 0.6444
 epoch: 76, train_loss: 0.7487, test_loss: 0.8215, test_f1: 0.6342
 epoch: 77, train_loss: 0.7599, test_loss: 0.8258, test_f1: 0.6542
 epoch: 78, train_loss: 0.7393, test_loss: 0.7630, test_f1: 0.6262
 epoch: 79, train_loss: 0.7552, test_loss: 0.8209, test_f1: 0.6357
 epoch: 80, train_loss: 0.7397, test_loss: 0.8452, test_f1: 0.6141
 epoch: 81, train_loss: 0.7426, test_loss: 0.7295, test_f1: 0.6548
 epoch: 82, train_loss: 0.7348, test_loss: 0.8511, test_f1: 0.5973
 epoch: 83, train_loss: 0.7447, test_loss: 0.8284, test_f1: 0.6173
 epoch: 84, train_loss: 0.7510, test_loss: 0.7968, test_f1: 0.6410
 epoch: 85, train_loss: 0.7402, test_loss: 0.7841, test_f1: 0.6255
 epoch: 86, train_loss: 0.7514, test_loss: 0.8287, test_f1: 0.6123
 epoch: 87, train_loss: 0.7520, test_loss: 0.7047, test_f1: 0.6636
 epoch: 88, train_loss: 0.7328, test_loss: 0.8009, test_f1: 0.6227
 epoch: 89, train_loss: 0.7284, test_loss: 0.8014, test_f1: 0.6463
 epoch: 90, train_loss: 0.7279, test_loss: 0.7649, test_f1: 0.6270
 epoch: 91, train_loss: 0.7263, test_loss: 0.8233, test_f1: 0.6212
 epoch: 92, train_loss: 0.7415, test_loss: 0.8216, test_f1: 0.6563
 epoch: 93, train_loss: 0.7290, test_loss: 0.8195, test_f1: 0.6274
 epoch: 94, train_loss: 0.7420, test_loss: 0.8937, test_f1: 0.5763
 epoch: 95, train_loss: 0.7186, test_loss: 0.7837, test_f1: 0.6387
 epoch: 96, train_loss: 0.7286, test_loss: 0.7902, test_f1: 0.6398
 epoch: 97, train_loss: 0.7428, test_loss: 0.8458, test_f1: 0.6267
 epoch: 98, train_loss: 0.7229, test_loss: 0.8079, test_f1: 0.6397
 epoch: 99, train_loss: 0.7221, test_loss: 0.8271, test_f1: 0.6017
##################ITERATION #3 ****************************************
 epoch: 0, train_loss: 1.1195, test_loss: 1.0691, test_f1: 0.4257
 epoch: 1, train_loss: 1.0021, test_loss: 1.0281, test_f1: 0.4586
 epoch: 2, train_loss: 1.0165, test_loss: 0.9833, test_f1: 0.4850
 epoch: 3, train_loss: 1.0062, test_loss: 1.0467, test_f1: 0.4466
 epoch: 4, train_loss: 0.9832, test_loss: 1.0085, test_f1: 0.4641
 epoch: 5, train_loss: 0.9797, test_loss: 0.9837, test_f1: 0.4887
 epoch: 6, train_loss: 0.9754, test_loss: 0.9610, test_f1: 0.4651
 epoch: 7, train_loss: 0.9848, test_loss: 0.9725, test_f1: 0.4632
 epoch: 8, train_loss: 0.9769, test_loss: 0.9973, test_f1: 0.4853
 epoch: 9, train_loss: 0.9535, test_loss: 0.9637, test_f1: 0.5175
 epoch: 10, train_loss: 0.9383, test_loss: 0.9584, test_f1: 0.4964
 epoch: 11, train_loss: 0.9508, test_loss: 1.0757, test_f1: 0.4534
 epoch: 12, train_loss: 0.9360, test_loss: 0.9452, test_f1: 0.5264
 epoch: 13, train_loss: 0.9168, test_loss: 0.9372, test_f1: 0.5280
 epoch: 14, train_loss: 0.9217, test_loss: 0.9633, test_f1: 0.5016
 epoch: 15, train_loss: 0.9191, test_loss: 0.9372, test_f1: 0.5014
 epoch: 16, train_loss: 0.9335, test_loss: 0.9789, test_f1: 0.4819
 epoch: 17, train_loss: 0.9081, test_loss: 0.9542, test_f1: 0.4978
 epoch: 18, train_loss: 0.9034, test_loss: 0.9684, test_f1: 0.4869
 epoch: 19, train_loss: 0.9023, test_loss: 0.9142, test_f1: 0.5325
 epoch: 20, train_loss: 0.8820, test_loss: 0.9208, test_f1: 0.5102
 epoch: 21, train_loss: 0.8865, test_loss: 0.9527, test_f1: 0.5205
 epoch: 22, train_loss: 0.8994, test_loss: 0.9141, test_f1: 0.5188
 epoch: 23, train_loss: 0.8776, test_loss: 0.9243, test_f1: 0.5372
 epoch: 24, train_loss: 0.8773, test_loss: 0.8938, test_f1: 0.5230
 epoch: 25, train_loss: 0.9125, test_loss: 1.0135, test_f1: 0.4689
 epoch: 26, train_loss: 1.0482, test_loss: 1.0217, test_f1: 0.4729
 epoch: 27, train_loss: 0.9934, test_loss: 0.9870, test_f1: 0.4828
 epoch: 28, train_loss: 0.9779, test_loss: 1.0021, test_f1: 0.4718
 epoch: 29, train_loss: 0.9704, test_loss: 1.0003, test_f1: 0.4665
 epoch: 30, train_loss: 0.9635, test_loss: 0.9856, test_f1: 0.4651
 epoch: 31, train_loss: 0.9473, test_loss: 0.9814, test_f1: 0.4768
 epoch: 32, train_loss: 0.9470, test_loss: 0.9565, test_f1: 0.4723
 epoch: 33, train_loss: 0.9421, test_loss: 1.0212, test_f1: 0.4624
 epoch: 34, train_loss: 0.9262, test_loss: 0.9773, test_f1: 0.5187
 epoch: 35, train_loss: 0.9331, test_loss: 0.9999, test_f1: 0.4817
 epoch: 36, train_loss: 0.9265, test_loss: 0.8878, test_f1: 0.5040
 epoch: 37, train_loss: 0.9261, test_loss: 0.9658, test_f1: 0.4952
 epoch: 38, train_loss: 0.9734, test_loss: 1.0075, test_f1: 0.4384
 epoch: 39, train_loss: 0.9626, test_loss: 0.9946, test_f1: 0.4787
 epoch: 40, train_loss: 0.9321, test_loss: 0.9851, test_f1: 0.4848
 epoch: 41, train_loss: 0.9287, test_loss: 1.0009, test_f1: 0.4858
 epoch: 42, train_loss: 0.9269, test_loss: 0.9354, test_f1: 0.5484
 epoch: 43, train_loss: 0.9143, test_loss: 1.0009, test_f1: 0.5561
 epoch: 44, train_loss: 0.9590, test_loss: 1.0502, test_f1: 0.5034
 epoch: 45, train_loss: 0.9220, test_loss: 1.0176, test_f1: 0.4645
 epoch: 46, train_loss: 0.9181, test_loss: 0.9448, test_f1: 0.4821
 epoch: 47, train_loss: 0.9154, test_loss: 0.9432, test_f1: 0.5235
 epoch: 48, train_loss: 0.9019, test_loss: 1.1360, test_f1: 0.4861
 epoch: 49, train_loss: 0.9074, test_loss: 0.9351, test_f1: 0.5230
 epoch: 50, train_loss: 0.9009, test_loss: 0.9087, test_f1: 0.5499
 epoch: 51, train_loss: 0.8720, test_loss: 0.9041, test_f1: 0.5319
 epoch: 52, train_loss: 0.8651, test_loss: 0.8723, test_f1: 0.5482
 epoch: 53, train_loss: 0.8582, test_loss: 0.8606, test_f1: 0.5365
 epoch: 54, train_loss: 0.8373, test_loss: 0.8712, test_f1: 0.5174
 epoch: 55, train_loss: 0.8545, test_loss: 0.8847, test_f1: 0.5374
 epoch: 56, train_loss: 0.8467, test_loss: 0.9102, test_f1: 0.5352
 epoch: 57, train_loss: 0.8451, test_loss: 0.8955, test_f1: 0.5403
 epoch: 58, train_loss: 0.8431, test_loss: 0.9546, test_f1: 0.5599
 epoch: 59, train_loss: 0.8382, test_loss: 0.9103, test_f1: 0.5608
 epoch: 60, train_loss: 0.8301, test_loss: 0.8822, test_f1: 0.5812
 epoch: 61, train_loss: 0.8169, test_loss: 0.9013, test_f1: 0.5392
 epoch: 62, train_loss: 0.8164, test_loss: 0.8625, test_f1: 0.5575
 epoch: 63, train_loss: 0.8218, test_loss: 0.8864, test_f1: 0.5345
 epoch: 64, train_loss: 0.8263, test_loss: 0.8813, test_f1: 0.5520
 epoch: 65, train_loss: 0.8341, test_loss: 0.8413, test_f1: 0.5428
 epoch: 66, train_loss: 0.8152, test_loss: 0.8858, test_f1: 0.5419
 epoch: 67, train_loss: 0.8072, test_loss: 0.9045, test_f1: 0.5401
 epoch: 68, train_loss: 0.8207, test_loss: 0.8961, test_f1: 0.5682
 epoch: 69, train_loss: 0.8202, test_loss: 0.8813, test_f1: 0.5546
 epoch: 70, train_loss: 0.7997, test_loss: 0.8955, test_f1: 0.5464
 epoch: 71, train_loss: 0.7983, test_loss: 0.9085, test_f1: 0.5419
 epoch: 72, train_loss: 0.8017, test_loss: 0.8695, test_f1: 0.5612
 epoch: 73, train_loss: 0.7997, test_loss: 0.9186, test_f1: 0.5482
 epoch: 74, train_loss: 0.8069, test_loss: 0.8988, test_f1: 0.5937
 epoch: 75, train_loss: 0.7978, test_loss: 0.8609, test_f1: 0.5545
 epoch: 76, train_loss: 0.7961, test_loss: 0.8111, test_f1: 0.5507
 epoch: 77, train_loss: 0.7879, test_loss: 0.8530, test_f1: 0.5616
 epoch: 78, train_loss: 0.7938, test_loss: 0.8627, test_f1: 0.5523
 epoch: 79, train_loss: 0.7870, test_loss: 0.9635, test_f1: 0.5394
 epoch: 80, train_loss: 0.7882, test_loss: 0.8716, test_f1: 0.5653
 epoch: 81, train_loss: 0.8107, test_loss: 0.8447, test_f1: 0.5564
 epoch: 82, train_loss: 0.7955, test_loss: 0.9180, test_f1: 0.5324
 epoch: 83, train_loss: 0.7763, test_loss: 0.8731, test_f1: 0.5755
 epoch: 84, train_loss: 0.7789, test_loss: 0.8541, test_f1: 0.5694
 epoch: 85, train_loss: 0.7852, test_loss: 0.9495, test_f1: 0.5279
 epoch: 86, train_loss: 0.7902, test_loss: 0.9084, test_f1: 0.5858
 epoch: 87, train_loss: 0.7712, test_loss: 0.8862, test_f1: 0.5553
 epoch: 88, train_loss: 0.7869, test_loss: 0.9284, test_f1: 0.5539
 epoch: 89, train_loss: 0.7784, test_loss: 0.8540, test_f1: 0.5626
 epoch: 90, train_loss: 0.7835, test_loss: 0.9033, test_f1: 0.5834
 epoch: 91, train_loss: 0.7714, test_loss: 0.8828, test_f1: 0.6285
 epoch: 92, train_loss: 0.7778, test_loss: 0.8494, test_f1: 0.5726
 epoch: 93, train_loss: 0.7821, test_loss: 0.7909, test_f1: 0.6342
 epoch: 94, train_loss: 0.7706, test_loss: 0.8571, test_f1: 0.5811
 epoch: 95, train_loss: 0.7866, test_loss: 0.8744, test_f1: 0.5488
 epoch: 96, train_loss: 0.7736, test_loss: 0.8410, test_f1: 0.5550
 epoch: 97, train_loss: 0.7624, test_loss: 0.8937, test_f1: 0.6426
 epoch: 98, train_loss: 0.7586, test_loss: 0.8713, test_f1: 0.5784
 epoch: 99, train_loss: 0.7757, test_loss: 0.8914, test_f1: 0.5848
##################ITERATION #4 ****************************************
 epoch: 0, train_loss: 1.1164, test_loss: 1.0568, test_f1: 0.3754
 epoch: 1, train_loss: 1.0156, test_loss: 1.0852, test_f1: 0.4000
 epoch: 2, train_loss: 1.0074, test_loss: 1.0165, test_f1: 0.5085
 epoch: 3, train_loss: 0.9864, test_loss: 1.0351, test_f1: 0.4816
 epoch: 4, train_loss: 0.9715, test_loss: 1.0019, test_f1: 0.4336
 epoch: 5, train_loss: 0.9681, test_loss: 1.0475, test_f1: 0.4802
 epoch: 6, train_loss: 0.9662, test_loss: 0.9603, test_f1: 0.5002
 epoch: 7, train_loss: 0.9438, test_loss: 1.0028, test_f1: 0.4920
 epoch: 8, train_loss: 0.9358, test_loss: 1.0265, test_f1: 0.4574
 epoch: 9, train_loss: 0.9361, test_loss: 1.1767, test_f1: 0.4481
 epoch: 10, train_loss: 0.9356, test_loss: 1.0463, test_f1: 0.4900
 epoch: 11, train_loss: 0.9255, test_loss: 0.9543, test_f1: 0.5358
 epoch: 12, train_loss: 0.9385, test_loss: 0.9105, test_f1: 0.5208
 epoch: 13, train_loss: 0.9218, test_loss: 0.9633, test_f1: 0.5461
 epoch: 14, train_loss: 0.9117, test_loss: 0.9534, test_f1: 0.5495
 epoch: 15, train_loss: 0.9265, test_loss: 0.9915, test_f1: 0.4820
 epoch: 16, train_loss: 0.9094, test_loss: 0.9209, test_f1: 0.5293
 epoch: 17, train_loss: 0.9131, test_loss: 0.9217, test_f1: 0.5084
 epoch: 18, train_loss: 0.9102, test_loss: 0.9324, test_f1: 0.5469
 epoch: 19, train_loss: 0.8882, test_loss: 0.8605, test_f1: 0.5474
 epoch: 20, train_loss: 0.9051, test_loss: 0.9557, test_f1: 0.4942
 epoch: 21, train_loss: 0.9002, test_loss: 0.9840, test_f1: 0.4967
 epoch: 22, train_loss: 0.8951, test_loss: 0.9291, test_f1: 0.5863
 epoch: 23, train_loss: 0.9198, test_loss: 0.9600, test_f1: 0.4791
 epoch: 24, train_loss: 0.8930, test_loss: 0.9110, test_f1: 0.5629
 epoch: 25, train_loss: 0.8916, test_loss: 0.9374, test_f1: 0.5391
 epoch: 26, train_loss: 0.8902, test_loss: 0.9274, test_f1: 0.5267
 epoch: 27, train_loss: 0.8899, test_loss: 1.0080, test_f1: 0.5262
 epoch: 28, train_loss: 0.9025, test_loss: 0.9205, test_f1: 0.5311
 epoch: 29, train_loss: 0.8864, test_loss: 0.8841, test_f1: 0.5423
 epoch: 30, train_loss: 0.8764, test_loss: 0.8967, test_f1: 0.5511
 epoch: 31, train_loss: 0.8713, test_loss: 0.9571, test_f1: 0.5522
 epoch: 32, train_loss: 0.8833, test_loss: 0.8845, test_f1: 0.5333
 epoch: 33, train_loss: 0.8610, test_loss: 0.8944, test_f1: 0.5632
 epoch: 34, train_loss: 0.8761, test_loss: 0.9191, test_f1: 0.5439
 epoch: 35, train_loss: 0.8596, test_loss: 0.9812, test_f1: 0.5143
 epoch: 36, train_loss: 0.8492, test_loss: 0.8757, test_f1: 0.5963
 epoch: 37, train_loss: 0.8614, test_loss: 0.8735, test_f1: 0.5683
 epoch: 38, train_loss: 0.8686, test_loss: 0.8940, test_f1: 0.5567
 epoch: 39, train_loss: 0.8557, test_loss: 0.8703, test_f1: 0.5355
 epoch: 40, train_loss: 0.8539, test_loss: 0.8842, test_f1: 0.5288
 epoch: 41, train_loss: 0.8646, test_loss: 0.8987, test_f1: 0.6018
 epoch: 42, train_loss: 0.8538, test_loss: 0.8822, test_f1: 0.6164
 epoch: 43, train_loss: 0.8570, test_loss: 0.9125, test_f1: 0.5198
 epoch: 44, train_loss: 0.8664, test_loss: 0.9008, test_f1: 0.5345
 epoch: 45, train_loss: 0.8537, test_loss: 0.8676, test_f1: 0.5801
 epoch: 46, train_loss: 0.8641, test_loss: 0.8818, test_f1: 0.5465
 epoch: 47, train_loss: 0.8483, test_loss: 0.8633, test_f1: 0.5387
 epoch: 48, train_loss: 0.8562, test_loss: 0.8475, test_f1: 0.6248
 epoch: 49, train_loss: 0.8657, test_loss: 0.8671, test_f1: 0.6077
 epoch: 50, train_loss: 0.8441, test_loss: 0.8289, test_f1: 0.5561
 epoch: 51, train_loss: 0.8239, test_loss: 0.8207, test_f1: 0.6041
 epoch: 52, train_loss: 0.8337, test_loss: 0.8437, test_f1: 0.6098
 epoch: 53, train_loss: 0.8133, test_loss: 0.8206, test_f1: 0.5936
 epoch: 54, train_loss: 0.8217, test_loss: 0.8622, test_f1: 0.5874
 epoch: 55, train_loss: 0.8006, test_loss: 0.8474, test_f1: 0.6021
 epoch: 56, train_loss: 0.8244, test_loss: 0.8477, test_f1: 0.5628
 epoch: 57, train_loss: 0.8142, test_loss: 0.8408, test_f1: 0.6087
 epoch: 58, train_loss: 0.8052, test_loss: 0.8757, test_f1: 0.5930
 epoch: 59, train_loss: 0.8025, test_loss: 0.8827, test_f1: 0.5626
 epoch: 60, train_loss: 0.8198, test_loss: 0.8365, test_f1: 0.5880
 epoch: 61, train_loss: 0.8037, test_loss: 0.8662, test_f1: 0.5834
 epoch: 62, train_loss: 0.8041, test_loss: 0.8542, test_f1: 0.5658
 epoch: 63, train_loss: 0.7917, test_loss: 0.8298, test_f1: 0.6035
 epoch: 64, train_loss: 0.7993, test_loss: 0.8356, test_f1: 0.5864
 epoch: 65, train_loss: 0.7905, test_loss: 0.8400, test_f1: 0.5965
 epoch: 66, train_loss: 0.8045, test_loss: 0.8344, test_f1: 0.5841
 epoch: 67, train_loss: 0.8058, test_loss: 0.8295, test_f1: 0.6354
 epoch: 68, train_loss: 0.7972, test_loss: 0.8473, test_f1: 0.5986
 epoch: 69, train_loss: 0.7987, test_loss: 0.8491, test_f1: 0.6157
 epoch: 70, train_loss: 0.7969, test_loss: 0.8629, test_f1: 0.6162
 epoch: 71, train_loss: 0.8106, test_loss: 0.8625, test_f1: 0.5934
 epoch: 72, train_loss: 0.7999, test_loss: 0.8432, test_f1: 0.6305
 epoch: 73, train_loss: 0.7973, test_loss: 0.8959, test_f1: 0.6120
 epoch: 74, train_loss: 0.7872, test_loss: 0.8325, test_f1: 0.5898
 epoch: 75, train_loss: 0.7819, test_loss: 0.8543, test_f1: 0.5853
 epoch: 76, train_loss: 0.7907, test_loss: 0.8381, test_f1: 0.5901
 epoch: 77, train_loss: 0.8051, test_loss: 0.8007, test_f1: 0.6443
 epoch: 78, train_loss: 0.7969, test_loss: 0.8423, test_f1: 0.5909
 epoch: 79, train_loss: 0.8001, test_loss: 0.8138, test_f1: 0.6301
 epoch: 80, train_loss: 0.7892, test_loss: 0.8891, test_f1: 0.5848
 epoch: 81, train_loss: 0.7945, test_loss: 0.8332, test_f1: 0.6099
 epoch: 82, train_loss: 0.7896, test_loss: 0.8979, test_f1: 0.6019
 epoch: 83, train_loss: 0.8043, test_loss: 0.8174, test_f1: 0.5938
 epoch: 84, train_loss: 0.7910, test_loss: 0.8592, test_f1: 0.6143
 epoch: 85, train_loss: 0.7841, test_loss: 0.8185, test_f1: 0.6323
 epoch: 86, train_loss: 0.8003, test_loss: 0.8493, test_f1: 0.5964
 epoch: 87, train_loss: 0.7949, test_loss: 0.8550, test_f1: 0.5782
 epoch: 88, train_loss: 0.7870, test_loss: 0.8407, test_f1: 0.6363
 epoch: 89, train_loss: 0.7773, test_loss: 0.8539, test_f1: 0.6065
 epoch: 90, train_loss: 0.7727, test_loss: 0.7667, test_f1: 0.5853
 epoch: 91, train_loss: 0.7728, test_loss: 0.8724, test_f1: 0.6353
 epoch: 92, train_loss: 0.7802, test_loss: 0.7811, test_f1: 0.6130
 epoch: 93, train_loss: 0.7906, test_loss: 0.8846, test_f1: 0.5976
 epoch: 94, train_loss: 0.7763, test_loss: 0.9296, test_f1: 0.5939
 epoch: 95, train_loss: 0.7727, test_loss: 0.8205, test_f1: 0.6346
 epoch: 96, train_loss: 0.7810, test_loss: 0.8379, test_f1: 0.5924
 epoch: 97, train_loss: 0.7824, test_loss: 0.8688, test_f1: 0.6161
 epoch: 98, train_loss: 0.7683, test_loss: 0.8449, test_f1: 0.6104
 epoch: 99, train_loss: 0.7865, test_loss: 0.8445, test_f1: 0.6266
##################ITERATION #5 ****************************************
 epoch: 0, train_loss: 1.1088, test_loss: 1.1662, test_f1: 0.4175
 epoch: 1, train_loss: 1.0333, test_loss: 1.0417, test_f1: 0.4132
 epoch: 2, train_loss: 1.0160, test_loss: 1.0654, test_f1: 0.4436
 epoch: 3, train_loss: 0.9979, test_loss: 1.1826, test_f1: 0.3939
 epoch: 4, train_loss: 0.9976, test_loss: 0.9999, test_f1: 0.5147
 epoch: 5, train_loss: 0.9914, test_loss: 0.9878, test_f1: 0.4562
 epoch: 6, train_loss: 0.9912, test_loss: 1.0883, test_f1: 0.4137
 epoch: 7, train_loss: 0.9812, test_loss: 1.0140, test_f1: 0.5137
 epoch: 8, train_loss: 0.9664, test_loss: 1.1933, test_f1: 0.4815
 epoch: 9, train_loss: 0.9840, test_loss: 0.9549, test_f1: 0.4869
 epoch: 10, train_loss: 0.9765, test_loss: 0.9888, test_f1: 0.5225
 epoch: 11, train_loss: 0.9617, test_loss: 0.9743, test_f1: 0.4879
 epoch: 12, train_loss: 0.9654, test_loss: 1.2396, test_f1: 0.3987
 epoch: 13, train_loss: 0.9518, test_loss: 0.9535, test_f1: 0.4955
 epoch: 14, train_loss: 0.9474, test_loss: 1.0054, test_f1: 0.4800
 epoch: 15, train_loss: 0.9406, test_loss: 0.9433, test_f1: 0.4870
 epoch: 16, train_loss: 0.9457, test_loss: 0.9539, test_f1: 0.4907
 epoch: 17, train_loss: 0.9535, test_loss: 0.9540, test_f1: 0.5122
 epoch: 18, train_loss: 0.9319, test_loss: 0.9015, test_f1: 0.5047
 epoch: 19, train_loss: 0.9319, test_loss: 0.9353, test_f1: 0.4976
 epoch: 20, train_loss: 0.9182, test_loss: 0.9085, test_f1: 0.5166
 epoch: 21, train_loss: 0.8992, test_loss: 0.9518, test_f1: 0.5292
 epoch: 22, train_loss: 0.9168, test_loss: 0.9180, test_f1: 0.5245
 epoch: 23, train_loss: 0.9088, test_loss: 0.8921, test_f1: 0.5121
 epoch: 24, train_loss: 0.9043, test_loss: 0.9226, test_f1: 0.5126
 epoch: 25, train_loss: 0.8965, test_loss: 1.6402, test_f1: 0.2949
 epoch: 26, train_loss: 0.9514, test_loss: 0.9638, test_f1: 0.5145
 epoch: 27, train_loss: 0.9297, test_loss: 0.9207, test_f1: 0.5184
 epoch: 28, train_loss: 0.9071, test_loss: 0.9106, test_f1: 0.5047
 epoch: 29, train_loss: 0.8947, test_loss: 0.8937, test_f1: 0.5575
 epoch: 30, train_loss: 0.8918, test_loss: 0.9138, test_f1: 0.5282
 epoch: 31, train_loss: 0.8919, test_loss: 0.8836, test_f1: 0.5483
 epoch: 32, train_loss: 0.8867, test_loss: 0.9282, test_f1: 0.5410
 epoch: 33, train_loss: 0.8873, test_loss: 0.8863, test_f1: 0.5347
 epoch: 34, train_loss: 0.8787, test_loss: 0.9437, test_f1: 0.5260
 epoch: 35, train_loss: 0.8774, test_loss: 0.9049, test_f1: 0.4968
 epoch: 36, train_loss: 0.8707, test_loss: 0.8735, test_f1: 0.5540
 epoch: 37, train_loss: 0.8869, test_loss: 0.8690, test_f1: 0.5490
 epoch: 38, train_loss: 0.8660, test_loss: 0.8555, test_f1: 0.5538
 epoch: 39, train_loss: 0.8563, test_loss: 0.9551, test_f1: 0.5637
 epoch: 40, train_loss: 0.8538, test_loss: 0.8942, test_f1: 0.5302
 epoch: 41, train_loss: 0.8449, test_loss: 0.8882, test_f1: 0.5427
 epoch: 42, train_loss: 0.8783, test_loss: 1.3229, test_f1: 0.3854
 epoch: 43, train_loss: 0.8862, test_loss: 0.8973, test_f1: 0.5187
 epoch: 44, train_loss: 0.8714, test_loss: 0.9261, test_f1: 0.5142
 epoch: 45, train_loss: 0.8825, test_loss: 0.8462, test_f1: 0.5393
 epoch: 46, train_loss: 0.8534, test_loss: 0.8726, test_f1: 0.5243
 epoch: 47, train_loss: 0.8637, test_loss: 0.8636, test_f1: 0.5445
 epoch: 48, train_loss: 0.8600, test_loss: 0.9036, test_f1: 0.5229
 epoch: 49, train_loss: 0.8526, test_loss: 0.8727, test_f1: 0.5352
 epoch: 50, train_loss: 0.8516, test_loss: 0.8751, test_f1: 0.5971
 epoch: 51, train_loss: 0.8336, test_loss: 0.8545, test_f1: 0.5491
 epoch: 52, train_loss: 0.8270, test_loss: 0.8487, test_f1: 0.5483
 epoch: 53, train_loss: 0.8220, test_loss: 0.8400, test_f1: 0.5758
 epoch: 54, train_loss: 0.8187, test_loss: 0.8626, test_f1: 0.5675
 epoch: 55, train_loss: 0.8062, test_loss: 0.8715, test_f1: 0.5599
 epoch: 56, train_loss: 0.8068, test_loss: 0.8756, test_f1: 0.5941
 epoch: 57, train_loss: 0.8159, test_loss: 0.8602, test_f1: 0.5439
 epoch: 58, train_loss: 0.8132, test_loss: 0.8468, test_f1: 0.5656
 epoch: 59, train_loss: 0.8213, test_loss: 0.8242, test_f1: 0.5809
 epoch: 60, train_loss: 0.7993, test_loss: 0.8596, test_f1: 0.5959
 epoch: 61, train_loss: 0.8119, test_loss: 0.8468, test_f1: 0.5654
 epoch: 62, train_loss: 0.8129, test_loss: 0.8525, test_f1: 0.6176
 epoch: 63, train_loss: 0.8038, test_loss: 0.8524, test_f1: 0.5593
 epoch: 64, train_loss: 0.8049, test_loss: 0.8419, test_f1: 0.5913
 epoch: 65, train_loss: 0.8072, test_loss: 0.8439, test_f1: 0.6114
 epoch: 66, train_loss: 0.8082, test_loss: 0.8685, test_f1: 0.5657
 epoch: 67, train_loss: 0.8017, test_loss: 0.8648, test_f1: 0.5643
 epoch: 68, train_loss: 0.8107, test_loss: 0.8509, test_f1: 0.5809
 epoch: 69, train_loss: 0.7860, test_loss: 0.8349, test_f1: 0.5899
 epoch: 70, train_loss: 0.7880, test_loss: 0.8653, test_f1: 0.6151
 epoch: 71, train_loss: 0.7952, test_loss: 0.8638, test_f1: 0.6018
 epoch: 72, train_loss: 0.7824, test_loss: 0.8603, test_f1: 0.5843
 epoch: 73, train_loss: 0.8014, test_loss: 0.9296, test_f1: 0.5937
 epoch: 74, train_loss: 0.8065, test_loss: 0.8532, test_f1: 0.5974
 epoch: 75, train_loss: 0.7980, test_loss: 0.8785, test_f1: 0.6378
 epoch: 76, train_loss: 0.7878, test_loss: 0.8803, test_f1: 0.5637
 epoch: 77, train_loss: 0.7807, test_loss: 0.8993, test_f1: 0.5933
 epoch: 78, train_loss: 0.7880, test_loss: 0.8415, test_f1: 0.6328
 epoch: 79, train_loss: 0.7789, test_loss: 0.8907, test_f1: 0.6025
 epoch: 80, train_loss: 0.7943, test_loss: 0.8758, test_f1: 0.5853
 epoch: 81, train_loss: 0.7903, test_loss: 0.8617, test_f1: 0.5963
 epoch: 82, train_loss: 0.7870, test_loss: 0.8261, test_f1: 0.6431
 epoch: 83, train_loss: 0.7844, test_loss: 0.8914, test_f1: 0.5917
 epoch: 84, train_loss: 0.7845, test_loss: 0.8926, test_f1: 0.5885
 epoch: 85, train_loss: 0.7972, test_loss: 0.8564, test_f1: 0.5894
 epoch: 86, train_loss: 0.7819, test_loss: 0.8694, test_f1: 0.6092
 epoch: 87, train_loss: 0.7754, test_loss: 0.8602, test_f1: 0.5943
 epoch: 88, train_loss: 0.7625, test_loss: 0.8958, test_f1: 0.5679
 epoch: 89, train_loss: 0.7792, test_loss: 0.8891, test_f1: 0.5603
 epoch: 90, train_loss: 0.7666, test_loss: 0.8091, test_f1: 0.6251
 epoch: 91, train_loss: 0.7634, test_loss: 0.8430, test_f1: 0.6053
 epoch: 92, train_loss: 0.7721, test_loss: 0.8505, test_f1: 0.6172
 epoch: 93, train_loss: 0.7594, test_loss: 0.8718, test_f1: 0.6009
 epoch: 94, train_loss: 0.7936, test_loss: 0.8678, test_f1: 0.6060
 epoch: 95, train_loss: 0.7758, test_loss: 0.8477, test_f1: 0.5810
 epoch: 96, train_loss: 0.7706, test_loss: 0.7939, test_f1: 0.5935
 epoch: 97, train_loss: 0.7858, test_loss: 0.8178, test_f1: 0.6111
 epoch: 98, train_loss: 0.7671, test_loss: 0.8492, test_f1: 0.5802
 epoch: 99, train_loss: 0.7561, test_loss: 0.8566, test_f1: 0.6131
##################ITERATION #6 ****************************************
 epoch: 0, train_loss: 1.1318, test_loss: 1.0760, test_f1: 0.3977
 epoch: 1, train_loss: 1.0295, test_loss: 1.0145, test_f1: 0.4402
 epoch: 2, train_loss: 1.0007, test_loss: 1.0402, test_f1: 0.4049
 epoch: 3, train_loss: 0.9840, test_loss: 1.1503, test_f1: 0.3849
 epoch: 4, train_loss: 0.9711, test_loss: 0.9607, test_f1: 0.5060
 epoch: 5, train_loss: 0.9551, test_loss: 0.9873, test_f1: 0.4827
 epoch: 6, train_loss: 0.9508, test_loss: 0.9855, test_f1: 0.4724
 epoch: 7, train_loss: 0.9643, test_loss: 0.9724, test_f1: 0.5089
 epoch: 8, train_loss: 0.9379, test_loss: 0.9541, test_f1: 0.5187
 epoch: 9, train_loss: 0.9319, test_loss: 0.9594, test_f1: 0.5084
 epoch: 10, train_loss: 0.9123, test_loss: 0.9896, test_f1: 0.5421
 epoch: 11, train_loss: 0.9335, test_loss: 0.9277, test_f1: 0.5077
 epoch: 12, train_loss: 0.9314, test_loss: 0.9173, test_f1: 0.5170
 epoch: 13, train_loss: 0.9410, test_loss: 0.9363, test_f1: 0.5481
 epoch: 14, train_loss: 0.9156, test_loss: 0.9421, test_f1: 0.5551
 epoch: 15, train_loss: 0.9096, test_loss: 0.9520, test_f1: 0.5514
 epoch: 16, train_loss: 0.9164, test_loss: 0.9625, test_f1: 0.5486
 epoch: 17, train_loss: 0.9060, test_loss: 1.0277, test_f1: 0.5344
 epoch: 18, train_loss: 0.9052, test_loss: 0.8631, test_f1: 0.5592
 epoch: 19, train_loss: 0.9102, test_loss: 0.9031, test_f1: 0.5191
 epoch: 20, train_loss: 0.8911, test_loss: 0.9425, test_f1: 0.5336
 epoch: 21, train_loss: 0.8868, test_loss: 0.9134, test_f1: 0.5676
 epoch: 22, train_loss: 0.8849, test_loss: 0.9167, test_f1: 0.5824
 epoch: 23, train_loss: 0.8796, test_loss: 0.9254, test_f1: 0.5590
 epoch: 24, train_loss: 0.8807, test_loss: 0.9273, test_f1: 0.5368
 epoch: 25, train_loss: 0.8911, test_loss: 0.9165, test_f1: 0.5462
 epoch: 26, train_loss: 0.8903, test_loss: 0.8820, test_f1: 0.5582
 epoch: 27, train_loss: 0.8614, test_loss: 1.0306, test_f1: 0.4992
 epoch: 28, train_loss: 0.8905, test_loss: 0.8901, test_f1: 0.5333
 epoch: 29, train_loss: 0.8883, test_loss: 0.8955, test_f1: 0.5547
 epoch: 30, train_loss: 0.8775, test_loss: 0.9038, test_f1: 0.5833
 epoch: 31, train_loss: 0.8702, test_loss: 0.9182, test_f1: 0.5397
 epoch: 32, train_loss: 0.8595, test_loss: 0.9059, test_f1: 0.5350
 epoch: 33, train_loss: 0.8513, test_loss: 0.9086, test_f1: 0.5509
 epoch: 34, train_loss: 0.8666, test_loss: 0.9574, test_f1: 0.5795
 epoch: 35, train_loss: 0.8761, test_loss: 0.9096, test_f1: 0.5199
 epoch: 36, train_loss: 0.8767, test_loss: 0.9153, test_f1: 0.5434
 epoch: 37, train_loss: 0.8883, test_loss: 0.8609, test_f1: 0.5462
 epoch: 38, train_loss: 0.8784, test_loss: 0.8835, test_f1: 0.5567
 epoch: 39, train_loss: 0.8667, test_loss: 0.8511, test_f1: 0.5420
 epoch: 40, train_loss: 0.8556, test_loss: 0.9149, test_f1: 0.5887
 epoch: 41, train_loss: 0.8475, test_loss: 0.8854, test_f1: 0.5350
 epoch: 42, train_loss: 0.8596, test_loss: 0.9267, test_f1: 0.5277
 epoch: 43, train_loss: 0.9568, test_loss: 0.9824, test_f1: 0.4708
 epoch: 44, train_loss: 0.9840, test_loss: 0.8976, test_f1: 0.5346
 epoch: 45, train_loss: 0.9493, test_loss: 0.9147, test_f1: 0.5081
 epoch: 46, train_loss: 0.9260, test_loss: 0.9217, test_f1: 0.5500
 epoch: 47, train_loss: 0.9128, test_loss: 0.9750, test_f1: 0.5110
 epoch: 48, train_loss: 0.9452, test_loss: 0.9544, test_f1: 0.5251
 epoch: 49, train_loss: 0.8952, test_loss: 0.9198, test_f1: 0.5471
 epoch: 50, train_loss: 0.8645, test_loss: 0.8943, test_f1: 0.5318
 epoch: 51, train_loss: 0.8494, test_loss: 0.8740, test_f1: 0.5584
 epoch: 52, train_loss: 0.8424, test_loss: 0.8757, test_f1: 0.5375
 epoch: 53, train_loss: 0.8395, test_loss: 0.8631, test_f1: 0.5625
 epoch: 54, train_loss: 0.8308, test_loss: 0.8699, test_f1: 0.5537
 epoch: 55, train_loss: 0.8431, test_loss: 0.9494, test_f1: 0.5481
 epoch: 56, train_loss: 0.8193, test_loss: 0.8590, test_f1: 0.5387
 epoch: 57, train_loss: 0.8168, test_loss: 0.8473, test_f1: 0.6259
 epoch: 58, train_loss: 0.8151, test_loss: 0.8727, test_f1: 0.5666
 epoch: 59, train_loss: 0.8229, test_loss: 0.8531, test_f1: 0.5884
 epoch: 60, train_loss: 0.8106, test_loss: 0.8944, test_f1: 0.5515
 epoch: 61, train_loss: 0.8084, test_loss: 0.8900, test_f1: 0.5527
 epoch: 62, train_loss: 0.8144, test_loss: 0.8699, test_f1: 0.6008
 epoch: 63, train_loss: 0.8063, test_loss: 0.8282, test_f1: 0.5511
 epoch: 64, train_loss: 0.8287, test_loss: 0.8484, test_f1: 0.5740
 epoch: 65, train_loss: 0.8078, test_loss: 0.8482, test_f1: 0.5904
 epoch: 66, train_loss: 0.7963, test_loss: 0.9289, test_f1: 0.5377
 epoch: 67, train_loss: 0.7985, test_loss: 0.8743, test_f1: 0.6041
 epoch: 68, train_loss: 0.7919, test_loss: 0.8938, test_f1: 0.5391
 epoch: 69, train_loss: 0.7966, test_loss: 0.9220, test_f1: 0.5620
 epoch: 70, train_loss: 0.7943, test_loss: 0.8813, test_f1: 0.5576
 epoch: 71, train_loss: 0.7903, test_loss: 0.9091, test_f1: 0.5600
 epoch: 72, train_loss: 0.8021, test_loss: 0.8617, test_f1: 0.6114
 epoch: 73, train_loss: 0.7991, test_loss: 0.8389, test_f1: 0.5907
 epoch: 74, train_loss: 0.7947, test_loss: 0.8756, test_f1: 0.5685
 epoch: 75, train_loss: 0.7943, test_loss: 0.9191, test_f1: 0.5786
 epoch: 76, train_loss: 0.7902, test_loss: 0.8438, test_f1: 0.5624
 epoch: 77, train_loss: 0.7770, test_loss: 0.8341, test_f1: 0.6194
 epoch: 78, train_loss: 0.7812, test_loss: 0.8406, test_f1: 0.5674
 epoch: 79, train_loss: 0.7873, test_loss: 0.8303, test_f1: 0.5945
 epoch: 80, train_loss: 0.7736, test_loss: 0.8563, test_f1: 0.6116
 epoch: 81, train_loss: 0.7804, test_loss: 0.8383, test_f1: 0.5742
 epoch: 82, train_loss: 0.7802, test_loss: 0.8400, test_f1: 0.5871
 epoch: 83, train_loss: 0.7741, test_loss: 0.8364, test_f1: 0.5612
 epoch: 84, train_loss: 0.7857, test_loss: 0.8123, test_f1: 0.5635
 epoch: 85, train_loss: 0.7888, test_loss: 0.8725, test_f1: 0.5529
 epoch: 86, train_loss: 0.7697, test_loss: 0.8255, test_f1: 0.5703
 epoch: 87, train_loss: 0.7807, test_loss: 0.8294, test_f1: 0.5683
 epoch: 88, train_loss: 0.7858, test_loss: 0.8376, test_f1: 0.5792
 epoch: 89, train_loss: 0.7870, test_loss: 0.8059, test_f1: 0.5971
 epoch: 90, train_loss: 0.7798, test_loss: 0.8156, test_f1: 0.5877
 epoch: 91, train_loss: 0.7683, test_loss: 0.8333, test_f1: 0.5878
 epoch: 92, train_loss: 0.7692, test_loss: 0.8681, test_f1: 0.5977
 epoch: 93, train_loss: 0.7655, test_loss: 0.8225, test_f1: 0.5842
 epoch: 94, train_loss: 0.7615, test_loss: 0.8377, test_f1: 0.5864
 epoch: 95, train_loss: 0.7703, test_loss: 0.8024, test_f1: 0.6001
 epoch: 96, train_loss: 0.7717, test_loss: 0.8336, test_f1: 0.5740
 epoch: 97, train_loss: 0.7671, test_loss: 0.8226, test_f1: 0.6078
 epoch: 98, train_loss: 0.7583, test_loss: 0.8304, test_f1: 0.5946
 epoch: 99, train_loss: 0.7736, test_loss: 0.8325, test_f1: 0.6037
##################ITERATION #7 ****************************************
 epoch: 0, train_loss: 1.1529, test_loss: 1.1618, test_f1: 0.3744
 epoch: 1, train_loss: 1.0483, test_loss: 1.0820, test_f1: 0.5304
 epoch: 2, train_loss: 1.0116, test_loss: 1.0901, test_f1: 0.4726
 epoch: 3, train_loss: 0.9992, test_loss: 1.0650, test_f1: 0.4824
 epoch: 4, train_loss: 0.9936, test_loss: 1.0480, test_f1: 0.4451
 epoch: 5, train_loss: 0.9955, test_loss: 1.0600, test_f1: 0.4660
 epoch: 6, train_loss: 0.9779, test_loss: 1.2628, test_f1: 0.4267
 epoch: 7, train_loss: 0.9619, test_loss: 0.9976, test_f1: 0.4908
 epoch: 8, train_loss: 0.9592, test_loss: 0.9702, test_f1: 0.5581
 epoch: 9, train_loss: 0.9529, test_loss: 0.9782, test_f1: 0.4892
 epoch: 10, train_loss: 0.9376, test_loss: 1.0797, test_f1: 0.4461
 epoch: 11, train_loss: 0.9408, test_loss: 0.9686, test_f1: 0.5066
 epoch: 12, train_loss: 0.9328, test_loss: 1.0177, test_f1: 0.4998
 epoch: 13, train_loss: 0.9273, test_loss: 0.9778, test_f1: 0.4995
 epoch: 14, train_loss: 0.9320, test_loss: 0.9740, test_f1: 0.5096
 epoch: 15, train_loss: 0.9115, test_loss: 0.8996, test_f1: 0.5144
 epoch: 16, train_loss: 0.9048, test_loss: 0.9639, test_f1: 0.5502
 epoch: 17, train_loss: 0.8997, test_loss: 0.9485, test_f1: 0.4969
 epoch: 18, train_loss: 0.8967, test_loss: 0.9869, test_f1: 0.4844
 epoch: 19, train_loss: 0.8983, test_loss: 0.9503, test_f1: 0.5111
 epoch: 20, train_loss: 0.9139, test_loss: 0.8961, test_f1: 0.5224
 epoch: 21, train_loss: 0.8967, test_loss: 0.9062, test_f1: 0.5238
 epoch: 22, train_loss: 0.8939, test_loss: 1.0105, test_f1: 0.5088
 epoch: 23, train_loss: 0.9086, test_loss: 0.9414, test_f1: 0.5128
 epoch: 24, train_loss: 0.8978, test_loss: 0.9030, test_f1: 0.5175
 epoch: 25, train_loss: 0.8747, test_loss: 0.8997, test_f1: 0.5277
 epoch: 26, train_loss: 0.8805, test_loss: 0.9754, test_f1: 0.5025
 epoch: 27, train_loss: 0.9259, test_loss: 1.0179, test_f1: 0.4657
 epoch: 28, train_loss: 0.8846, test_loss: 0.8676, test_f1: 0.5403
 epoch: 29, train_loss: 0.8842, test_loss: 0.8725, test_f1: 0.5649
 epoch: 30, train_loss: 0.8725, test_loss: 0.9596, test_f1: 0.5289
 epoch: 31, train_loss: 0.8752, test_loss: 0.9150, test_f1: 0.5395
 epoch: 32, train_loss: 0.8738, test_loss: 0.8611, test_f1: 0.5650
 epoch: 33, train_loss: 0.8844, test_loss: 0.9213, test_f1: 0.5241
 epoch: 34, train_loss: 0.8666, test_loss: 0.9085, test_f1: 0.5611
 epoch: 35, train_loss: 0.8701, test_loss: 0.9004, test_f1: 0.5473
 epoch: 36, train_loss: 0.8768, test_loss: 0.8591, test_f1: 0.5517
 epoch: 37, train_loss: 0.8630, test_loss: 0.8891, test_f1: 0.5368
 epoch: 38, train_loss: 0.8653, test_loss: 0.9298, test_f1: 0.5323
 epoch: 39, train_loss: 0.8894, test_loss: 1.0351, test_f1: 0.4724
 epoch: 40, train_loss: 0.8623, test_loss: 0.8838, test_f1: 0.5122
 epoch: 41, train_loss: 0.8594, test_loss: 0.8750, test_f1: 0.5321
 epoch: 42, train_loss: 0.8675, test_loss: 0.9624, test_f1: 0.5603
 epoch: 43, train_loss: 0.8652, test_loss: 0.8892, test_f1: 0.5565
 epoch: 44, train_loss: 0.8543, test_loss: 0.9638, test_f1: 0.5625
 epoch: 45, train_loss: 0.8623, test_loss: 0.8182, test_f1: 0.5985
 epoch: 46, train_loss: 0.8606, test_loss: 0.8789, test_f1: 0.5815
 epoch: 47, train_loss: 0.8481, test_loss: 0.8889, test_f1: 0.5254
 epoch: 48, train_loss: 0.8421, test_loss: 0.9504, test_f1: 0.5143
 epoch: 49, train_loss: 0.8581, test_loss: 0.8437, test_f1: 0.5871
 epoch: 50, train_loss: 0.8447, test_loss: 0.8194, test_f1: 0.5680
 epoch: 51, train_loss: 0.8228, test_loss: 0.8178, test_f1: 0.5843
 epoch: 52, train_loss: 0.8117, test_loss: 0.7990, test_f1: 0.5940
 epoch: 53, train_loss: 0.8019, test_loss: 0.8355, test_f1: 0.5579
 epoch: 54, train_loss: 0.8110, test_loss: 0.8362, test_f1: 0.5860
 epoch: 55, train_loss: 0.8087, test_loss: 0.8416, test_f1: 0.5923
 epoch: 56, train_loss: 0.7941, test_loss: 0.8328, test_f1: 0.6133
 epoch: 57, train_loss: 0.8160, test_loss: 0.8657, test_f1: 0.5926
 epoch: 58, train_loss: 0.7955, test_loss: 0.8429, test_f1: 0.6290
 epoch: 59, train_loss: 0.8026, test_loss: 0.8372, test_f1: 0.6019
 epoch: 60, train_loss: 0.8088, test_loss: 0.8009, test_f1: 0.5860
 epoch: 61, train_loss: 0.7943, test_loss: 0.8160, test_f1: 0.5893
 epoch: 62, train_loss: 0.8022, test_loss: 0.8750, test_f1: 0.5683
 epoch: 63, train_loss: 0.7967, test_loss: 0.8476, test_f1: 0.5927
 epoch: 64, train_loss: 0.7824, test_loss: 0.8778, test_f1: 0.6060
 epoch: 65, train_loss: 0.8026, test_loss: 0.8895, test_f1: 0.5716
 epoch: 66, train_loss: 0.7931, test_loss: 0.8440, test_f1: 0.6223
 epoch: 67, train_loss: 0.7898, test_loss: 0.9085, test_f1: 0.5530
 epoch: 68, train_loss: 0.7917, test_loss: 0.8349, test_f1: 0.5661
 epoch: 69, train_loss: 0.7891, test_loss: 0.8148, test_f1: 0.5850
 epoch: 70, train_loss: 0.7938, test_loss: 0.8746, test_f1: 0.5692
 epoch: 71, train_loss: 0.8043, test_loss: 0.8032, test_f1: 0.5979
 epoch: 72, train_loss: 0.7933, test_loss: 0.8404, test_f1: 0.6136
 epoch: 73, train_loss: 0.8030, test_loss: 0.8536, test_f1: 0.5977
 epoch: 74, train_loss: 0.7800, test_loss: 0.8509, test_f1: 0.5789
 epoch: 75, train_loss: 0.7873, test_loss: 0.8154, test_f1: 0.6078
 epoch: 76, train_loss: 0.7939, test_loss: 0.8506, test_f1: 0.5778
 epoch: 77, train_loss: 0.7784, test_loss: 0.9333, test_f1: 0.5884
 epoch: 78, train_loss: 0.7971, test_loss: 0.8984, test_f1: 0.5798
 epoch: 79, train_loss: 0.7876, test_loss: 0.8489, test_f1: 0.6111
 epoch: 80, train_loss: 0.7758, test_loss: 0.8267, test_f1: 0.5938
 epoch: 81, train_loss: 0.7846, test_loss: 0.8321, test_f1: 0.6167
 epoch: 82, train_loss: 0.7677, test_loss: 0.9063, test_f1: 0.5884
 epoch: 83, train_loss: 0.7856, test_loss: 0.8545, test_f1: 0.6138
 epoch: 84, train_loss: 0.7667, test_loss: 0.9092, test_f1: 0.5682
 epoch: 85, train_loss: 0.7649, test_loss: 0.9499, test_f1: 0.5984
 epoch: 86, train_loss: 0.7826, test_loss: 0.8946, test_f1: 0.6020
 epoch: 87, train_loss: 0.7612, test_loss: 0.8398, test_f1: 0.6053
 epoch: 88, train_loss: 0.7675, test_loss: 0.8876, test_f1: 0.6086
 epoch: 89, train_loss: 0.7645, test_loss: 0.8617, test_f1: 0.5815
 epoch: 90, train_loss: 0.7614, test_loss: 0.8516, test_f1: 0.6055
 epoch: 91, train_loss: 0.7523, test_loss: 0.9159, test_f1: 0.5726
 epoch: 92, train_loss: 0.7627, test_loss: 0.9253, test_f1: 0.6409
 epoch: 93, train_loss: 0.7670, test_loss: 0.8835, test_f1: 0.6124
 epoch: 94, train_loss: 0.7636, test_loss: 0.9560, test_f1: 0.5906
 epoch: 95, train_loss: 0.7616, test_loss: 0.8410, test_f1: 0.6382
 epoch: 96, train_loss: 0.7589, test_loss: 0.8882, test_f1: 0.6132
 epoch: 97, train_loss: 0.7739, test_loss: 0.8758, test_f1: 0.5879
 epoch: 98, train_loss: 0.7520, test_loss: 0.9171, test_f1: 0.5918
 epoch: 99, train_loss: 0.7612, test_loss: 0.8444, test_f1: 0.5923
##################ITERATION #8 ****************************************
 epoch: 0, train_loss: 1.1295, test_loss: 1.0401, test_f1: 0.4480
 epoch: 1, train_loss: 0.9994, test_loss: 0.9631, test_f1: 0.4661
 epoch: 2, train_loss: 0.9886, test_loss: 0.9792, test_f1: 0.4653
 epoch: 3, train_loss: 0.9734, test_loss: 0.9938, test_f1: 0.5092
 epoch: 4, train_loss: 0.9477, test_loss: 1.0013, test_f1: 0.4931
 epoch: 5, train_loss: 0.9688, test_loss: 0.9621, test_f1: 0.5186
 epoch: 6, train_loss: 0.9423, test_loss: 0.9819, test_f1: 0.5078
 epoch: 7, train_loss: 0.9391, test_loss: 0.9905, test_f1: 0.4945
 epoch: 8, train_loss: 0.9320, test_loss: 0.9400, test_f1: 0.4953
 epoch: 9, train_loss: 0.9249, test_loss: 0.9823, test_f1: 0.5047
 epoch: 10, train_loss: 0.9193, test_loss: 0.9336, test_f1: 0.5151
 epoch: 11, train_loss: 0.9061, test_loss: 1.0074, test_f1: 0.4268
 epoch: 12, train_loss: 0.9171, test_loss: 1.0676, test_f1: 0.4392
 epoch: 13, train_loss: 0.9255, test_loss: 0.9707, test_f1: 0.4677
 epoch: 14, train_loss: 0.9132, test_loss: 0.9186, test_f1: 0.5346
 epoch: 15, train_loss: 0.9076, test_loss: 0.9210, test_f1: 0.5073
 epoch: 16, train_loss: 0.8924, test_loss: 0.9780, test_f1: 0.5327
 epoch: 17, train_loss: 0.8831, test_loss: 0.9388, test_f1: 0.5352
 epoch: 18, train_loss: 0.8944, test_loss: 0.9019, test_f1: 0.5336
 epoch: 19, train_loss: 0.8817, test_loss: 0.9603, test_f1: 0.4876
 epoch: 20, train_loss: 0.8787, test_loss: 0.9809, test_f1: 0.5118
 epoch: 21, train_loss: 0.8846, test_loss: 0.9176, test_f1: 0.5657
 epoch: 22, train_loss: 0.8795, test_loss: 0.9504, test_f1: 0.5353
 epoch: 23, train_loss: 0.8634, test_loss: 0.8666, test_f1: 0.5371
 epoch: 24, train_loss: 0.8825, test_loss: 0.9161, test_f1: 0.5109
 epoch: 25, train_loss: 0.8628, test_loss: 0.9367, test_f1: 0.5931
 epoch: 26, train_loss: 0.8736, test_loss: 0.9671, test_f1: 0.5152
 epoch: 27, train_loss: 0.8824, test_loss: 0.9507, test_f1: 0.5183
 epoch: 28, train_loss: 0.9088, test_loss: 0.9134, test_f1: 0.5493
 epoch: 29, train_loss: 0.8831, test_loss: 1.5808, test_f1: 0.3194
 epoch: 30, train_loss: 0.8794, test_loss: 0.9280, test_f1: 0.5220
 epoch: 31, train_loss: 0.8693, test_loss: 0.9630, test_f1: 0.5278
 epoch: 32, train_loss: 0.8860, test_loss: 0.8846, test_f1: 0.5382
 epoch: 33, train_loss: 0.8666, test_loss: 0.9442, test_f1: 0.5440
 epoch: 34, train_loss: 0.8686, test_loss: 0.8794, test_f1: 0.5716
 epoch: 35, train_loss: 0.8729, test_loss: 0.9202, test_f1: 0.5362
 epoch: 36, train_loss: 0.8714, test_loss: 0.8927, test_f1: 0.5511
 epoch: 37, train_loss: 0.8600, test_loss: 0.9069, test_f1: 0.5409
 epoch: 38, train_loss: 0.8684, test_loss: 0.9393, test_f1: 0.5446
 epoch: 39, train_loss: 0.8607, test_loss: 0.9161, test_f1: 0.5370
 epoch: 40, train_loss: 0.8526, test_loss: 0.8344, test_f1: 0.5589
 epoch: 41, train_loss: 0.8545, test_loss: 0.8806, test_f1: 0.5476
 epoch: 42, train_loss: 0.8489, test_loss: 0.8775, test_f1: 0.5439
 epoch: 43, train_loss: 0.8351, test_loss: 0.8974, test_f1: 0.5785
 epoch: 44, train_loss: 0.8582, test_loss: 0.9067, test_f1: 0.5414
 epoch: 45, train_loss: 0.8569, test_loss: 0.8606, test_f1: 0.6038
 epoch: 46, train_loss: 0.8655, test_loss: 0.8397, test_f1: 0.5436
 epoch: 47, train_loss: 0.8416, test_loss: 0.8605, test_f1: 0.5365
 epoch: 48, train_loss: 0.8455, test_loss: 0.8589, test_f1: 0.5441
 epoch: 49, train_loss: 0.8410, test_loss: 0.9168, test_f1: 0.5866
 epoch: 50, train_loss: 0.8538, test_loss: 0.9040, test_f1: 0.5395
 epoch: 51, train_loss: 0.8327, test_loss: 0.8718, test_f1: 0.5500
 epoch: 52, train_loss: 0.8214, test_loss: 0.8185, test_f1: 0.5671
 epoch: 53, train_loss: 0.8246, test_loss: 0.8261, test_f1: 0.5900
 epoch: 54, train_loss: 0.8257, test_loss: 0.8487, test_f1: 0.5754
 epoch: 55, train_loss: 0.8056, test_loss: 0.8418, test_f1: 0.6179
 epoch: 56, train_loss: 0.8244, test_loss: 0.8530, test_f1: 0.5426
 epoch: 57, train_loss: 0.8030, test_loss: 0.8227, test_f1: 0.5667
 epoch: 58, train_loss: 0.8095, test_loss: 0.8641, test_f1: 0.5720
 epoch: 59, train_loss: 0.8071, test_loss: 0.8403, test_f1: 0.5657
 epoch: 60, train_loss: 0.8037, test_loss: 0.8709, test_f1: 0.5693
 epoch: 61, train_loss: 0.8163, test_loss: 0.9184, test_f1: 0.5587
 epoch: 62, train_loss: 0.8300, test_loss: 0.9085, test_f1: 0.5723
 epoch: 63, train_loss: 0.8031, test_loss: 0.8989, test_f1: 0.5428
 epoch: 64, train_loss: 0.8028, test_loss: 0.8395, test_f1: 0.5684
 epoch: 65, train_loss: 0.8105, test_loss: 0.8464, test_f1: 0.5361
 epoch: 66, train_loss: 0.7988, test_loss: 0.8021, test_f1: 0.6007
 epoch: 67, train_loss: 0.8004, test_loss: 0.8691, test_f1: 0.5413
 epoch: 68, train_loss: 0.7964, test_loss: 0.8946, test_f1: 0.5801
 epoch: 69, train_loss: 0.8156, test_loss: 0.8819, test_f1: 0.5375
 epoch: 70, train_loss: 0.8099, test_loss: 0.9283, test_f1: 0.5470
 epoch: 71, train_loss: 0.7964, test_loss: 0.8640, test_f1: 0.5679
 epoch: 72, train_loss: 0.8093, test_loss: 0.8698, test_f1: 0.5782
 epoch: 73, train_loss: 0.7963, test_loss: 0.8743, test_f1: 0.5481
 epoch: 74, train_loss: 0.7970, test_loss: 0.8689, test_f1: 0.5718
 epoch: 75, train_loss: 0.7955, test_loss: 0.8844, test_f1: 0.5492
 epoch: 76, train_loss: 0.7856, test_loss: 0.8976, test_f1: 0.5492
 epoch: 77, train_loss: 0.8063, test_loss: 0.8864, test_f1: 0.5321
 epoch: 78, train_loss: 0.8014, test_loss: 0.8835, test_f1: 0.5519
 epoch: 79, train_loss: 0.7901, test_loss: 0.8253, test_f1: 0.5894
 epoch: 80, train_loss: 0.7972, test_loss: 0.8569, test_f1: 0.5735
 epoch: 81, train_loss: 0.7943, test_loss: 0.8724, test_f1: 0.5983
 epoch: 82, train_loss: 0.7885, test_loss: 0.8834, test_f1: 0.5906
 epoch: 83, train_loss: 0.7889, test_loss: 0.8608, test_f1: 0.5596
 epoch: 84, train_loss: 0.7772, test_loss: 0.8108, test_f1: 0.6073
 epoch: 85, train_loss: 0.7759, test_loss: 0.8317, test_f1: 0.5588
 epoch: 86, train_loss: 0.8009, test_loss: 0.9448, test_f1: 0.5467
 epoch: 87, train_loss: 0.7786, test_loss: 0.8489, test_f1: 0.5445
 epoch: 88, train_loss: 0.7708, test_loss: 0.8262, test_f1: 0.5721
 epoch: 89, train_loss: 0.8017, test_loss: 0.8317, test_f1: 0.5605
 epoch: 90, train_loss: 0.7855, test_loss: 0.8448, test_f1: 0.5543
 epoch: 91, train_loss: 0.7777, test_loss: 0.9334, test_f1: 0.5382
 epoch: 92, train_loss: 0.7897, test_loss: 0.8575, test_f1: 0.5684
 epoch: 93, train_loss: 0.7771, test_loss: 0.8227, test_f1: 0.5939
 epoch: 94, train_loss: 0.7861, test_loss: 0.8233, test_f1: 0.5831
 epoch: 95, train_loss: 0.7932, test_loss: 0.8222, test_f1: 0.5870
 epoch: 96, train_loss: 0.7809, test_loss: 0.8473, test_f1: 0.5854
 epoch: 97, train_loss: 0.7874, test_loss: 0.8037, test_f1: 0.5911
 epoch: 98, train_loss: 0.7816, test_loss: 0.8251, test_f1: 0.5856
 epoch: 99, train_loss: 0.7854, test_loss: 0.9066, test_f1: 0.5584
##################ITERATION #9 ****************************************
 epoch: 0, train_loss: 1.1398, test_loss: 1.2004, test_f1: 0.4437
 epoch: 1, train_loss: 1.0484, test_loss: 1.0914, test_f1: 0.3624
 epoch: 2, train_loss: 1.0284, test_loss: 1.0683, test_f1: 0.5083
 epoch: 3, train_loss: 1.0213, test_loss: 1.0645, test_f1: 0.4254
 epoch: 4, train_loss: 1.0078, test_loss: 1.0700, test_f1: 0.4805
 epoch: 5, train_loss: 0.9952, test_loss: 1.0842, test_f1: 0.4986
 epoch: 6, train_loss: 0.9831, test_loss: 1.0403, test_f1: 0.4819
 epoch: 7, train_loss: 0.9741, test_loss: 1.0855, test_f1: 0.4891
 epoch: 8, train_loss: 0.9979, test_loss: 0.9997, test_f1: 0.4724
 epoch: 9, train_loss: 0.9927, test_loss: 1.0564, test_f1: 0.4560
 epoch: 10, train_loss: 0.9638, test_loss: 1.0208, test_f1: 0.4798
 epoch: 11, train_loss: 0.9679, test_loss: 1.0194, test_f1: 0.4633
 epoch: 12, train_loss: 0.9646, test_loss: 1.0159, test_f1: 0.5045
 epoch: 13, train_loss: 0.9376, test_loss: 1.0274, test_f1: 0.4934
 epoch: 14, train_loss: 0.9546, test_loss: 1.0856, test_f1: 0.4786
 epoch: 15, train_loss: 0.9306, test_loss: 1.0264, test_f1: 0.5033
 epoch: 16, train_loss: 0.9430, test_loss: 0.9813, test_f1: 0.5372
 epoch: 17, train_loss: 0.9270, test_loss: 1.0132, test_f1: 0.5060
 epoch: 18, train_loss: 0.9221, test_loss: 1.0339, test_f1: 0.4849
 epoch: 19, train_loss: 0.9145, test_loss: 0.9787, test_f1: 0.5191
 epoch: 20, train_loss: 0.9286, test_loss: 0.9361, test_f1: 0.5666
 epoch: 21, train_loss: 0.8950, test_loss: 0.9245, test_f1: 0.5216
 epoch: 22, train_loss: 0.8887, test_loss: 0.9241, test_f1: 0.5321
 epoch: 23, train_loss: 0.9006, test_loss: 0.9389, test_f1: 0.5544
 epoch: 24, train_loss: 0.9031, test_loss: 0.9818, test_f1: 0.5449
 epoch: 25, train_loss: 0.8777, test_loss: 0.9290, test_f1: 0.5261
 epoch: 26, train_loss: 0.8850, test_loss: 0.9567, test_f1: 0.5205
 epoch: 27, train_loss: 0.8829, test_loss: 0.9358, test_f1: 0.5108
 epoch: 28, train_loss: 0.9015, test_loss: 0.8936, test_f1: 0.5370
 epoch: 29, train_loss: 0.8745, test_loss: 0.9288, test_f1: 0.5231
 epoch: 30, train_loss: 0.8744, test_loss: 0.9304, test_f1: 0.5341
 epoch: 31, train_loss: 0.8730, test_loss: 0.9050, test_f1: 0.5075
 epoch: 32, train_loss: 0.8695, test_loss: 0.9437, test_f1: 0.5019
 epoch: 33, train_loss: 0.8805, test_loss: 0.8927, test_f1: 0.5234
 epoch: 34, train_loss: 0.8777, test_loss: 0.8600, test_f1: 0.5355
 epoch: 35, train_loss: 0.8599, test_loss: 0.9157, test_f1: 0.5715
 epoch: 36, train_loss: 0.8848, test_loss: 0.8997, test_f1: 0.5697
 epoch: 37, train_loss: 0.8545, test_loss: 0.8927, test_f1: 0.5360
 epoch: 38, train_loss: 0.8504, test_loss: 0.8827, test_f1: 0.5345
 epoch: 39, train_loss: 0.8628, test_loss: 0.9181, test_f1: 0.5344
 epoch: 40, train_loss: 0.8609, test_loss: 0.9398, test_f1: 0.5061
 epoch: 41, train_loss: 0.8607, test_loss: 0.8576, test_f1: 0.5447
 epoch: 42, train_loss: 0.8503, test_loss: 0.8782, test_f1: 0.5433
 epoch: 43, train_loss: 0.8521, test_loss: 0.8707, test_f1: 0.5290
 epoch: 44, train_loss: 0.8535, test_loss: 0.8635, test_f1: 0.5605
 epoch: 45, train_loss: 0.8479, test_loss: 0.8911, test_f1: 0.5225
 epoch: 46, train_loss: 0.8493, test_loss: 0.8459, test_f1: 0.5664
 epoch: 47, train_loss: 0.8267, test_loss: 0.9076, test_f1: 0.5288
 epoch: 48, train_loss: 0.8395, test_loss: 0.8665, test_f1: 0.5347
 epoch: 49, train_loss: 0.8530, test_loss: 0.8908, test_f1: 0.5755
 epoch: 50, train_loss: 0.8332, test_loss: 0.8467, test_f1: 0.5324
 epoch: 51, train_loss: 0.8237, test_loss: 0.8281, test_f1: 0.5478
 epoch: 52, train_loss: 0.8064, test_loss: 0.8166, test_f1: 0.5514
 epoch: 53, train_loss: 0.8106, test_loss: 0.8162, test_f1: 0.6044
 epoch: 54, train_loss: 0.8000, test_loss: 0.8367, test_f1: 0.5824
 epoch: 55, train_loss: 0.7980, test_loss: 0.8461, test_f1: 0.5729
 epoch: 56, train_loss: 0.8148, test_loss: 0.8326, test_f1: 0.5629
 epoch: 57, train_loss: 0.7963, test_loss: 0.8805, test_f1: 0.5477
 epoch: 58, train_loss: 0.7851, test_loss: 0.8543, test_f1: 0.5503
 epoch: 59, train_loss: 0.8176, test_loss: 0.8779, test_f1: 0.5704
 epoch: 60, train_loss: 0.8106, test_loss: 0.8322, test_f1: 0.5558
 epoch: 61, train_loss: 0.7979, test_loss: 0.8402, test_f1: 0.5727
 epoch: 62, train_loss: 0.7848, test_loss: 0.8153, test_f1: 0.5730
 epoch: 63, train_loss: 0.7944, test_loss: 0.8303, test_f1: 0.5689
 epoch: 64, train_loss: 0.7950, test_loss: 0.8599, test_f1: 0.5466
 epoch: 65, train_loss: 0.7939, test_loss: 0.8669, test_f1: 0.5771
 epoch: 66, train_loss: 0.7832, test_loss: 0.8431, test_f1: 0.5728
 epoch: 67, train_loss: 0.7840, test_loss: 0.8528, test_f1: 0.5420
 epoch: 68, train_loss: 0.7832, test_loss: 0.8615, test_f1: 0.5545
 epoch: 69, train_loss: 0.7908, test_loss: 0.8864, test_f1: 0.5525
 epoch: 70, train_loss: 0.7816, test_loss: 0.8267, test_f1: 0.5556
 epoch: 71, train_loss: 0.7809, test_loss: 0.8412, test_f1: 0.5406
 epoch: 72, train_loss: 0.7910, test_loss: 0.8876, test_f1: 0.5501
 epoch: 73, train_loss: 0.7794, test_loss: 0.8315, test_f1: 0.5647
 epoch: 74, train_loss: 0.7695, test_loss: 0.8416, test_f1: 0.5727
 epoch: 75, train_loss: 0.7755, test_loss: 0.8716, test_f1: 0.5194
 epoch: 76, train_loss: 0.7742, test_loss: 0.8395, test_f1: 0.6017
 epoch: 77, train_loss: 0.7755, test_loss: 0.8180, test_f1: 0.6208
 epoch: 78, train_loss: 0.7646, test_loss: 0.8526, test_f1: 0.5607
 epoch: 79, train_loss: 0.7650, test_loss: 0.8111, test_f1: 0.5895
 epoch: 80, train_loss: 0.7714, test_loss: 0.8177, test_f1: 0.5627
 epoch: 81, train_loss: 0.8263, test_loss: 0.8227, test_f1: 0.5362
 epoch: 82, train_loss: 0.7901, test_loss: 0.8208, test_f1: 0.5716
 epoch: 83, train_loss: 0.7950, test_loss: 0.8214, test_f1: 0.5596
 epoch: 84, train_loss: 0.7802, test_loss: 0.7889, test_f1: 0.6059
 epoch: 85, train_loss: 0.7717, test_loss: 0.8248, test_f1: 0.5602
 epoch: 86, train_loss: 0.7671, test_loss: 0.8234, test_f1: 0.5771
 epoch: 87, train_loss: 0.7716, test_loss: 0.7808, test_f1: 0.6040
 epoch: 88, train_loss: 0.7653, test_loss: 0.8253, test_f1: 0.5858
 epoch: 89, train_loss: 0.7732, test_loss: 0.8260, test_f1: 0.6038
 epoch: 90, train_loss: 0.7491, test_loss: 0.7950, test_f1: 0.5779
 epoch: 91, train_loss: 0.7645, test_loss: 0.8473, test_f1: 0.5820
 epoch: 92, train_loss: 0.7576, test_loss: 0.7893, test_f1: 0.6135
 epoch: 93, train_loss: 0.7541, test_loss: 0.8135, test_f1: 0.5633
 epoch: 94, train_loss: 0.7586, test_loss: 0.8235, test_f1: 0.5830
 epoch: 95, train_loss: 0.7716, test_loss: 0.8361, test_f1: 0.5786
 epoch: 96, train_loss: 0.7448, test_loss: 0.8323, test_f1: 0.6144
 epoch: 97, train_loss: 0.7570, test_loss: 0.8517, test_f1: 0.5618
 epoch: 98, train_loss: 0.7553, test_loss: 0.8333, test_f1: 0.6144
 epoch: 99, train_loss: 0.7537, test_loss: 0.8121, test_f1: 0.5903

Training completed in 1108.06 seconds
Best F1: 0.6670 at epoch 86
Mean F1 across iterations: 0.6382  0.0172
========================FINAL RESULTS================================
FEGIN weighted F1: 0.6670  0.0172
python main.py --data ltspice_examples --representation component_pin_net --model FEGIN --layers 4 --hiddens 16 --batch_size 32 --lr 0.01 --emb_size 250 --epochs 100 --save_appendix component_pin_net_L4_H16_BS32_LR0.01_E250 --no_val
-----



STDERR:
  File "main.py", line 370, in <module>
    main()
  File "main.py", line 254, in main
    dataset = dataset_class(
  File "/home/philip/projects/ltspice_examples_code_repo/Circuit-Completion-Using-GNNs/component_classification_with_link_prediction_head/evaluation/FEGIN/kernel/circuit_datasets.py", line 15, in __init__
    self.data, self.slices = torch.load(self.processed_paths[0])
  File "/home/philip/.local/lib/python3.8/site-packages/torch/serialization.py", line 1040, in load
    warnings.warn(
  File "/usr/lib/python3.8/warnings.py", line 109, in _showwarnmsg
    sw(msg.message, msg.category, msg.filename, msg.lineno,
  File "main.py", line 47, in warn_with_traceback
    traceback.print_stack(file=log)
/home/philip/projects/ltspice_examples_code_repo/Circuit-Completion-Using-GNNs/component_classification_with_link_prediction_head/evaluation/FEGIN/kernel/circuit_datasets.py:15: FutureWarning: You are using `torch.load` with `weights_only=False` (the current default value), which uses the default pickle module implicitly. It is possible to construct malicious pickle data which will execute arbitrary code during unpickling (See https://github.com/pytorch/pytorch/blob/main/SECURITY.md#untrusted-models for more details). In a future release, the default value for `weights_only` will be flipped to `True`. This limits the functions that could be executed during unpickling. Arbitrary objects will no longer be allowed to be loaded via this mode unless they are explicitly allowlisted by the user via `torch.serialization.add_safe_globals`. We recommend you start setting `weights_only=True` for any use case where you don't have full control of the loaded file. Please open an issue on GitHub for any issues related to this experimental feature.
  self.data, self.slices = torch.load(self.processed_paths[0])
