STDOUT:
Results will be saved in /home/philip/projects/ltspice_examples_code_repo/Circuit-Completion-Using-GNNs/component_classification_with_link_prediction_head/evaluation/FEGIN/results/model_FEGIN_dataset_ltspice_examples
Command line input: python main.py --data ltspice_examples --representation component_net --model FEGIN --layers 4 --hiddens 32 --batch_size 128 --lr 0.01 --emb_size 250 --epochs 100 --save_appendix component_net_L4_H32_BS128_LR0.01_E250 --no_val
 is saved.
-----
ltspice_examples - FEGIN
Using 4 layers, 32 hidden units, h = 2
Loading component_net representation dataset
ENTERED
Training FEGIN on component_net representation
Train: 3558, Test: 846
##################ITERATION #0 ****************************************
 epoch: 0, train_loss: 1.2470, test_loss: 1.1708, test_f1: 0.2952
 epoch: 1, train_loss: 1.0847, test_loss: 1.0239, test_f1: 0.4244
 epoch: 2, train_loss: 1.0093, test_loss: 1.0052, test_f1: 0.4313
 epoch: 3, train_loss: 0.9894, test_loss: 1.0330, test_f1: 0.4855
 epoch: 4, train_loss: 0.9652, test_loss: 1.0197, test_f1: 0.4573
 epoch: 5, train_loss: 0.9423, test_loss: 0.9324, test_f1: 0.4839
 epoch: 6, train_loss: 0.9402, test_loss: 0.9627, test_f1: 0.5288
 epoch: 7, train_loss: 0.9173, test_loss: 1.0285, test_f1: 0.4827
 epoch: 8, train_loss: 0.9231, test_loss: 0.9732, test_f1: 0.5201
 epoch: 9, train_loss: 0.9036, test_loss: 1.0095, test_f1: 0.5108
 epoch: 10, train_loss: 0.9028, test_loss: 1.0221, test_f1: 0.4862
 epoch: 11, train_loss: 0.9025, test_loss: 1.0375, test_f1: 0.5011
 epoch: 12, train_loss: 0.8829, test_loss: 0.9617, test_f1: 0.5339
 epoch: 13, train_loss: 0.8860, test_loss: 0.9673, test_f1: 0.4996
 epoch: 14, train_loss: 0.8757, test_loss: 0.9956, test_f1: 0.5309
 epoch: 15, train_loss: 0.8694, test_loss: 0.9286, test_f1: 0.5157
 epoch: 16, train_loss: 0.8632, test_loss: 0.9464, test_f1: 0.5330
 epoch: 17, train_loss: 0.8541, test_loss: 0.9438, test_f1: 0.5365
 epoch: 18, train_loss: 0.8267, test_loss: 1.0068, test_f1: 0.4832
 epoch: 19, train_loss: 0.8320, test_loss: 0.9439, test_f1: 0.5359
 epoch: 20, train_loss: 0.8284, test_loss: 1.0009, test_f1: 0.5504
 epoch: 21, train_loss: 0.8121, test_loss: 0.9771, test_f1: 0.5108
 epoch: 22, train_loss: 0.8029, test_loss: 1.0580, test_f1: 0.5129
 epoch: 23, train_loss: 0.8044, test_loss: 0.9408, test_f1: 0.5601
 epoch: 24, train_loss: 0.8159, test_loss: 0.9633, test_f1: 0.5578
 epoch: 25, train_loss: 0.8137, test_loss: 1.0077, test_f1: 0.5479
 epoch: 26, train_loss: 0.7939, test_loss: 1.0016, test_f1: 0.5495
 epoch: 27, train_loss: 0.7972, test_loss: 0.9298, test_f1: 0.5776
 epoch: 28, train_loss: 0.7874, test_loss: 1.0347, test_f1: 0.5741
 epoch: 29, train_loss: 0.7733, test_loss: 0.9765, test_f1: 0.5820
 epoch: 30, train_loss: 0.7945, test_loss: 0.9622, test_f1: 0.5223
 epoch: 31, train_loss: 0.7786, test_loss: 1.0099, test_f1: 0.5480
 epoch: 32, train_loss: 0.7579, test_loss: 1.0251, test_f1: 0.5462
 epoch: 33, train_loss: 0.7792, test_loss: 1.0047, test_f1: 0.5325
 epoch: 34, train_loss: 0.7648, test_loss: 1.0553, test_f1: 0.5315
 epoch: 35, train_loss: 0.7702, test_loss: 1.0546, test_f1: 0.5779
 epoch: 36, train_loss: 0.7544, test_loss: 0.9850, test_f1: 0.5483
 epoch: 37, train_loss: 0.7722, test_loss: 1.0768, test_f1: 0.5539
 epoch: 38, train_loss: 0.7539, test_loss: 1.0134, test_f1: 0.6056
 epoch: 39, train_loss: 0.7543, test_loss: 0.9997, test_f1: 0.5361
 epoch: 40, train_loss: 0.7400, test_loss: 1.0006, test_f1: 0.5446
 epoch: 41, train_loss: 0.7301, test_loss: 0.9926, test_f1: 0.5526
 epoch: 42, train_loss: 0.7342, test_loss: 1.1688, test_f1: 0.5325
 epoch: 43, train_loss: 0.7184, test_loss: 0.9793, test_f1: 0.5977
 epoch: 44, train_loss: 0.7351, test_loss: 0.9813, test_f1: 0.5930
 epoch: 45, train_loss: 0.7263, test_loss: 1.1605, test_f1: 0.5561
 epoch: 46, train_loss: 0.7128, test_loss: 0.9661, test_f1: 0.5846
 epoch: 47, train_loss: 0.7226, test_loss: 0.9691, test_f1: 0.6069
 epoch: 48, train_loss: 0.7020, test_loss: 1.0483, test_f1: 0.5908
 epoch: 49, train_loss: 0.7444, test_loss: 1.1375, test_f1: 0.5622
 epoch: 50, train_loss: 0.7149, test_loss: 0.9842, test_f1: 0.6028
 epoch: 51, train_loss: 0.6917, test_loss: 1.0236, test_f1: 0.6133
 epoch: 52, train_loss: 0.6800, test_loss: 1.0703, test_f1: 0.5913
 epoch: 53, train_loss: 0.6661, test_loss: 1.1019, test_f1: 0.5769
 epoch: 54, train_loss: 0.6607, test_loss: 1.0362, test_f1: 0.6350
 epoch: 55, train_loss: 0.6525, test_loss: 1.0438, test_f1: 0.6405
 epoch: 56, train_loss: 0.6463, test_loss: 1.1021, test_f1: 0.5898
 epoch: 57, train_loss: 0.6499, test_loss: 1.0416, test_f1: 0.6281
 epoch: 58, train_loss: 0.6419, test_loss: 1.0862, test_f1: 0.6170
 epoch: 59, train_loss: 0.6367, test_loss: 1.0532, test_f1: 0.6315
 epoch: 60, train_loss: 0.6485, test_loss: 1.1001, test_f1: 0.5955
 epoch: 61, train_loss: 0.6310, test_loss: 1.1123, test_f1: 0.6231
 epoch: 62, train_loss: 0.6324, test_loss: 1.1441, test_f1: 0.6020
 epoch: 63, train_loss: 0.6427, test_loss: 1.0827, test_f1: 0.6439
 epoch: 64, train_loss: 0.6135, test_loss: 1.0398, test_f1: 0.5913
 epoch: 65, train_loss: 0.6195, test_loss: 1.0043, test_f1: 0.6303
 epoch: 66, train_loss: 0.6195, test_loss: 1.0998, test_f1: 0.6479
 epoch: 67, train_loss: 0.6279, test_loss: 1.1346, test_f1: 0.6375
 epoch: 68, train_loss: 0.6267, test_loss: 1.1376, test_f1: 0.6475
 epoch: 69, train_loss: 0.6081, test_loss: 1.1069, test_f1: 0.6529
 epoch: 70, train_loss: 0.6062, test_loss: 1.1044, test_f1: 0.6475
 epoch: 71, train_loss: 0.6025, test_loss: 1.1587, test_f1: 0.6463
 epoch: 72, train_loss: 0.6115, test_loss: 1.1099, test_f1: 0.6083
 epoch: 73, train_loss: 0.5923, test_loss: 1.1030, test_f1: 0.6385
 epoch: 74, train_loss: 0.5824, test_loss: 1.1533, test_f1: 0.6274
 epoch: 75, train_loss: 0.5971, test_loss: 1.1447, test_f1: 0.6520
 epoch: 76, train_loss: 0.6051, test_loss: 1.0838, test_f1: 0.6302
 epoch: 77, train_loss: 0.5851, test_loss: 1.0782, test_f1: 0.6446
 epoch: 78, train_loss: 0.5827, test_loss: 1.2060, test_f1: 0.6532
 epoch: 79, train_loss: 0.5751, test_loss: 1.1470, test_f1: 0.6580
 epoch: 80, train_loss: 0.5966, test_loss: 1.0525, test_f1: 0.6581
 epoch: 81, train_loss: 0.5874, test_loss: 1.1921, test_f1: 0.6383
 epoch: 82, train_loss: 0.5875, test_loss: 1.1329, test_f1: 0.6552
 epoch: 83, train_loss: 0.5909, test_loss: 1.1057, test_f1: 0.6684
 epoch: 84, train_loss: 0.5841, test_loss: 1.1580, test_f1: 0.6255
 epoch: 85, train_loss: 0.5723, test_loss: 1.1556, test_f1: 0.6187
 epoch: 86, train_loss: 0.5662, test_loss: 1.1965, test_f1: 0.6244
 epoch: 87, train_loss: 0.5631, test_loss: 1.2845, test_f1: 0.6610
 epoch: 88, train_loss: 0.5801, test_loss: 1.2148, test_f1: 0.6406
 epoch: 89, train_loss: 0.5797, test_loss: 1.1797, test_f1: 0.6381
 epoch: 90, train_loss: 0.5655, test_loss: 1.1720, test_f1: 0.6445
 epoch: 91, train_loss: 0.5665, test_loss: 1.2627, test_f1: 0.6527
 epoch: 92, train_loss: 0.5533, test_loss: 1.2764, test_f1: 0.6537
 epoch: 93, train_loss: 0.5456, test_loss: 1.4120, test_f1: 0.6173
 epoch: 94, train_loss: 0.5764, test_loss: 1.2436, test_f1: 0.6525
 epoch: 95, train_loss: 0.5710, test_loss: 1.2225, test_f1: 0.6318
 epoch: 96, train_loss: 0.5491, test_loss: 1.2339, test_f1: 0.6433
 epoch: 97, train_loss: 0.5361, test_loss: 1.3108, test_f1: 0.6717
 epoch: 98, train_loss: 0.5383, test_loss: 1.3178, test_f1: 0.6383
 epoch: 99, train_loss: 0.5526, test_loss: 1.2192, test_f1: 0.6231
##################ITERATION #1 ****************************************
 epoch: 0, train_loss: 1.1675, test_loss: 1.2577, test_f1: 0.2657
 epoch: 1, train_loss: 1.0149, test_loss: 0.9964, test_f1: 0.4689
 epoch: 2, train_loss: 0.9823, test_loss: 0.9826, test_f1: 0.4956
 epoch: 3, train_loss: 0.9640, test_loss: 1.1403, test_f1: 0.3917
 epoch: 4, train_loss: 0.9505, test_loss: 1.0226, test_f1: 0.5220
 epoch: 5, train_loss: 0.9345, test_loss: 0.9706, test_f1: 0.5065
 epoch: 6, train_loss: 0.9108, test_loss: 0.9735, test_f1: 0.5362
 epoch: 7, train_loss: 0.9044, test_loss: 0.9442, test_f1: 0.5328
 epoch: 8, train_loss: 0.8900, test_loss: 1.0395, test_f1: 0.5037
 epoch: 9, train_loss: 0.9009, test_loss: 0.9386, test_f1: 0.5161
 epoch: 10, train_loss: 0.8878, test_loss: 0.9123, test_f1: 0.5080
 epoch: 11, train_loss: 0.8758, test_loss: 0.9795, test_f1: 0.4846
 epoch: 12, train_loss: 0.8801, test_loss: 0.9375, test_f1: 0.5498
 epoch: 13, train_loss: 0.8471, test_loss: 0.9560, test_f1: 0.5420
 epoch: 14, train_loss: 0.8558, test_loss: 0.9478, test_f1: 0.5782
 epoch: 15, train_loss: 0.8538, test_loss: 0.9746, test_f1: 0.5368
 epoch: 16, train_loss: 0.8489, test_loss: 0.9822, test_f1: 0.5153
 epoch: 17, train_loss: 0.8353, test_loss: 0.9437, test_f1: 0.5946
 epoch: 18, train_loss: 0.8285, test_loss: 0.9630, test_f1: 0.5070
 epoch: 19, train_loss: 0.8385, test_loss: 0.9115, test_f1: 0.5434
 epoch: 20, train_loss: 0.8242, test_loss: 0.9157, test_f1: 0.5920
 epoch: 21, train_loss: 0.8219, test_loss: 0.9635, test_f1: 0.5497
 epoch: 22, train_loss: 0.8138, test_loss: 0.8687, test_f1: 0.5442
 epoch: 23, train_loss: 0.8068, test_loss: 0.9557, test_f1: 0.5938
 epoch: 24, train_loss: 0.7822, test_loss: 0.9197, test_f1: 0.5664
 epoch: 25, train_loss: 0.7885, test_loss: 0.9184, test_f1: 0.6354
 epoch: 26, train_loss: 0.7744, test_loss: 0.8956, test_f1: 0.5967
 epoch: 27, train_loss: 0.7679, test_loss: 0.9675, test_f1: 0.6106
 epoch: 28, train_loss: 0.7774, test_loss: 1.0448, test_f1: 0.5567
 epoch: 29, train_loss: 0.7797, test_loss: 1.0268, test_f1: 0.5583
 epoch: 30, train_loss: 0.7665, test_loss: 0.9151, test_f1: 0.6272
 epoch: 31, train_loss: 0.7532, test_loss: 1.0185, test_f1: 0.6254
 epoch: 32, train_loss: 0.7683, test_loss: 0.8982, test_f1: 0.5872
 epoch: 33, train_loss: 0.7432, test_loss: 0.9373, test_f1: 0.6185
 epoch: 34, train_loss: 0.7601, test_loss: 0.9431, test_f1: 0.5891
 epoch: 35, train_loss: 0.7428, test_loss: 0.9260, test_f1: 0.5941
 epoch: 36, train_loss: 0.7477, test_loss: 0.8952, test_f1: 0.5990
 epoch: 37, train_loss: 0.7245, test_loss: 0.9290, test_f1: 0.6064
 epoch: 38, train_loss: 0.7457, test_loss: 0.9052, test_f1: 0.6186
 epoch: 39, train_loss: 0.7374, test_loss: 0.9370, test_f1: 0.6266
 epoch: 40, train_loss: 0.7247, test_loss: 0.8914, test_f1: 0.6303
 epoch: 41, train_loss: 0.7068, test_loss: 0.9758, test_f1: 0.6153
 epoch: 42, train_loss: 0.7277, test_loss: 0.8950, test_f1: 0.6388
 epoch: 43, train_loss: 0.7015, test_loss: 1.0174, test_f1: 0.5773
 epoch: 44, train_loss: 0.6958, test_loss: 0.9615, test_f1: 0.6091
 epoch: 45, train_loss: 0.7150, test_loss: 0.9725, test_f1: 0.5917
 epoch: 46, train_loss: 0.6875, test_loss: 0.9606, test_f1: 0.6106
 epoch: 47, train_loss: 0.7153, test_loss: 0.9970, test_f1: 0.5771
 epoch: 48, train_loss: 0.6835, test_loss: 0.9286, test_f1: 0.6524
 epoch: 49, train_loss: 0.6790, test_loss: 1.0120, test_f1: 0.6304
 epoch: 50, train_loss: 0.6723, test_loss: 0.9523, test_f1: 0.6136
 epoch: 51, train_loss: 0.6403, test_loss: 1.0508, test_f1: 0.6197
 epoch: 52, train_loss: 0.6334, test_loss: 0.9729, test_f1: 0.6448
 epoch: 53, train_loss: 0.6244, test_loss: 1.0324, test_f1: 0.6277
 epoch: 54, train_loss: 0.6304, test_loss: 1.0175, test_f1: 0.6382
 epoch: 55, train_loss: 0.6141, test_loss: 0.9898, test_f1: 0.6309
 epoch: 56, train_loss: 0.6073, test_loss: 0.9704, test_f1: 0.6473
 epoch: 57, train_loss: 0.6241, test_loss: 1.0572, test_f1: 0.6261
 epoch: 58, train_loss: 0.6280, test_loss: 1.0058, test_f1: 0.6033
 epoch: 59, train_loss: 0.6171, test_loss: 1.0049, test_f1: 0.6177
 epoch: 60, train_loss: 0.5898, test_loss: 1.0957, test_f1: 0.6403
 epoch: 61, train_loss: 0.6002, test_loss: 1.1809, test_f1: 0.6328
 epoch: 62, train_loss: 0.5964, test_loss: 1.0821, test_f1: 0.6268
 epoch: 63, train_loss: 0.5916, test_loss: 1.1295, test_f1: 0.6504
 epoch: 64, train_loss: 0.5926, test_loss: 1.0852, test_f1: 0.6419
 epoch: 65, train_loss: 0.5970, test_loss: 1.1160, test_f1: 0.6466
 epoch: 66, train_loss: 0.5821, test_loss: 1.0141, test_f1: 0.6472
 epoch: 67, train_loss: 0.5948, test_loss: 1.1675, test_f1: 0.6106
 epoch: 68, train_loss: 0.5790, test_loss: 1.1144, test_f1: 0.6425
 epoch: 69, train_loss: 0.5747, test_loss: 0.9792, test_f1: 0.6257
 epoch: 70, train_loss: 0.5771, test_loss: 1.1108, test_f1: 0.6255
 epoch: 71, train_loss: 0.5986, test_loss: 1.0271, test_f1: 0.6309
 epoch: 72, train_loss: 0.5705, test_loss: 1.0254, test_f1: 0.6167
 epoch: 73, train_loss: 0.5706, test_loss: 1.1363, test_f1: 0.6425
 epoch: 74, train_loss: 0.5628, test_loss: 1.0676, test_f1: 0.6431
 epoch: 75, train_loss: 0.5616, test_loss: 1.0651, test_f1: 0.6607
 epoch: 76, train_loss: 0.5695, test_loss: 1.2010, test_f1: 0.6148
 epoch: 77, train_loss: 0.5678, test_loss: 1.3974, test_f1: 0.6234
 epoch: 78, train_loss: 0.5726, test_loss: 1.1623, test_f1: 0.6360
 epoch: 79, train_loss: 0.5605, test_loss: 1.1110, test_f1: 0.6609
 epoch: 80, train_loss: 0.5670, test_loss: 1.3015, test_f1: 0.6352
 epoch: 81, train_loss: 0.5473, test_loss: 1.2013, test_f1: 0.6157
 epoch: 82, train_loss: 0.5445, test_loss: 1.1193, test_f1: 0.6337
 epoch: 83, train_loss: 0.5427, test_loss: 1.1567, test_f1: 0.6111
 epoch: 84, train_loss: 0.5481, test_loss: 1.1569, test_f1: 0.6444
 epoch: 85, train_loss: 0.5340, test_loss: 1.2181, test_f1: 0.6417
 epoch: 86, train_loss: 0.5271, test_loss: 1.2084, test_f1: 0.6323
 epoch: 87, train_loss: 0.5253, test_loss: 1.2274, test_f1: 0.6132
 epoch: 88, train_loss: 0.5351, test_loss: 1.1814, test_f1: 0.6396
 epoch: 89, train_loss: 0.5450, test_loss: 1.1161, test_f1: 0.6301
 epoch: 90, train_loss: 0.5426, test_loss: 1.1286, test_f1: 0.6439
 epoch: 91, train_loss: 0.5311, test_loss: 1.0794, test_f1: 0.6467
 epoch: 92, train_loss: 0.5364, test_loss: 1.2800, test_f1: 0.6228
 epoch: 93, train_loss: 0.5278, test_loss: 1.2701, test_f1: 0.6333
 epoch: 94, train_loss: 0.5367, test_loss: 1.2379, test_f1: 0.6256
 epoch: 95, train_loss: 0.5054, test_loss: 1.2113, test_f1: 0.6343
 epoch: 96, train_loss: 0.5242, test_loss: 1.1471, test_f1: 0.6410
 epoch: 97, train_loss: 0.4867, test_loss: 1.2841, test_f1: 0.6404
 epoch: 98, train_loss: 0.5091, test_loss: 1.3613, test_f1: 0.6356
 epoch: 99, train_loss: 0.5016, test_loss: 1.1916, test_f1: 0.6046
##################ITERATION #2 ****************************************
 epoch: 0, train_loss: 1.2398, test_loss: 1.2158, test_f1: 0.2442
 epoch: 1, train_loss: 1.0461, test_loss: 1.0179, test_f1: 0.4303
 epoch: 2, train_loss: 0.9999, test_loss: 0.9800, test_f1: 0.4989
 epoch: 3, train_loss: 0.9737, test_loss: 0.9765, test_f1: 0.4557
 epoch: 4, train_loss: 0.9613, test_loss: 1.0317, test_f1: 0.4824
 epoch: 5, train_loss: 0.9572, test_loss: 1.0072, test_f1: 0.4992
 epoch: 6, train_loss: 0.9674, test_loss: 1.0176, test_f1: 0.4903
 epoch: 7, train_loss: 0.9400, test_loss: 1.0277, test_f1: 0.4601
 epoch: 8, train_loss: 0.9091, test_loss: 0.9590, test_f1: 0.5511
 epoch: 9, train_loss: 0.9307, test_loss: 0.9572, test_f1: 0.5378
 epoch: 10, train_loss: 0.8979, test_loss: 0.9483, test_f1: 0.5247
 epoch: 11, train_loss: 0.8980, test_loss: 0.9693, test_f1: 0.5066
 epoch: 12, train_loss: 0.8830, test_loss: 0.9878, test_f1: 0.5127
 epoch: 13, train_loss: 0.8785, test_loss: 0.9378, test_f1: 0.5362
 epoch: 14, train_loss: 0.8812, test_loss: 0.9571, test_f1: 0.5211
 epoch: 15, train_loss: 0.8680, test_loss: 0.9699, test_f1: 0.5507
 epoch: 16, train_loss: 0.8811, test_loss: 0.9690, test_f1: 0.5541
 epoch: 17, train_loss: 0.8655, test_loss: 1.0362, test_f1: 0.5056
 epoch: 18, train_loss: 0.8601, test_loss: 0.9621, test_f1: 0.5366
 epoch: 19, train_loss: 0.8384, test_loss: 0.9241, test_f1: 0.5801
 epoch: 20, train_loss: 0.8295, test_loss: 0.9234, test_f1: 0.6009
 epoch: 21, train_loss: 0.8153, test_loss: 0.9371, test_f1: 0.5548
 epoch: 22, train_loss: 0.8314, test_loss: 1.0212, test_f1: 0.5131
 epoch: 23, train_loss: 0.8213, test_loss: 0.9832, test_f1: 0.5414
 epoch: 24, train_loss: 0.8243, test_loss: 1.0041, test_f1: 0.5297
 epoch: 25, train_loss: 0.8099, test_loss: 1.0563, test_f1: 0.5061
 epoch: 26, train_loss: 0.8203, test_loss: 0.9427, test_f1: 0.5665
 epoch: 27, train_loss: 0.8332, test_loss: 1.0273, test_f1: 0.5491
 epoch: 28, train_loss: 0.8125, test_loss: 0.9758, test_f1: 0.5937
 epoch: 29, train_loss: 0.7975, test_loss: 0.9829, test_f1: 0.5662
 epoch: 30, train_loss: 0.8081, test_loss: 0.9368, test_f1: 0.5914
 epoch: 31, train_loss: 0.7900, test_loss: 1.0130, test_f1: 0.5379
 epoch: 32, train_loss: 0.7881, test_loss: 0.9079, test_f1: 0.5955
 epoch: 33, train_loss: 0.7964, test_loss: 0.9803, test_f1: 0.5781
 epoch: 34, train_loss: 0.7873, test_loss: 0.9681, test_f1: 0.5875
 epoch: 35, train_loss: 0.7840, test_loss: 1.0148, test_f1: 0.6006
 epoch: 36, train_loss: 0.7794, test_loss: 0.9508, test_f1: 0.5691
 epoch: 37, train_loss: 0.7912, test_loss: 1.0389, test_f1: 0.5308
 epoch: 38, train_loss: 0.7917, test_loss: 0.9846, test_f1: 0.5475
 epoch: 39, train_loss: 0.7798, test_loss: 0.9762, test_f1: 0.5662
 epoch: 40, train_loss: 0.7610, test_loss: 0.9486, test_f1: 0.5889
 epoch: 41, train_loss: 0.7512, test_loss: 0.9728, test_f1: 0.5533
 epoch: 42, train_loss: 0.7501, test_loss: 0.9788, test_f1: 0.5595
 epoch: 43, train_loss: 0.7423, test_loss: 1.0085, test_f1: 0.6053
 epoch: 44, train_loss: 0.7506, test_loss: 1.0273, test_f1: 0.5406
 epoch: 45, train_loss: 0.7319, test_loss: 0.9484, test_f1: 0.5744
 epoch: 46, train_loss: 0.7481, test_loss: 0.9959, test_f1: 0.5654
 epoch: 47, train_loss: 0.7451, test_loss: 0.9194, test_f1: 0.5912
 epoch: 48, train_loss: 0.7357, test_loss: 0.9379, test_f1: 0.5909
 epoch: 49, train_loss: 0.7200, test_loss: 0.9604, test_f1: 0.6111
 epoch: 50, train_loss: 0.7351, test_loss: 0.9012, test_f1: 0.6105
 epoch: 51, train_loss: 0.7078, test_loss: 0.9870, test_f1: 0.6203
 epoch: 52, train_loss: 0.6915, test_loss: 0.9584, test_f1: 0.6268
 epoch: 53, train_loss: 0.6881, test_loss: 0.9399, test_f1: 0.6352
 epoch: 54, train_loss: 0.6611, test_loss: 0.9604, test_f1: 0.5901
 epoch: 55, train_loss: 0.6566, test_loss: 0.9647, test_f1: 0.6251
 epoch: 56, train_loss: 0.6735, test_loss: 1.0736, test_f1: 0.6442
 epoch: 57, train_loss: 0.6674, test_loss: 1.0838, test_f1: 0.5693
 epoch: 58, train_loss: 0.6652, test_loss: 1.0413, test_f1: 0.6261
 epoch: 59, train_loss: 0.6516, test_loss: 1.0154, test_f1: 0.6301
 epoch: 60, train_loss: 0.6395, test_loss: 0.9680, test_f1: 0.6346
 epoch: 61, train_loss: 0.6254, test_loss: 1.0691, test_f1: 0.6198
 epoch: 62, train_loss: 0.6472, test_loss: 1.0915, test_f1: 0.6379
 epoch: 63, train_loss: 0.6396, test_loss: 0.9901, test_f1: 0.6414
 epoch: 64, train_loss: 0.6405, test_loss: 1.0411, test_f1: 0.6249
 epoch: 65, train_loss: 0.6414, test_loss: 1.0111, test_f1: 0.6577
 epoch: 66, train_loss: 0.6362, test_loss: 1.0546, test_f1: 0.6376
 epoch: 67, train_loss: 0.6148, test_loss: 1.0596, test_f1: 0.6321
 epoch: 68, train_loss: 0.6209, test_loss: 1.0584, test_f1: 0.6437
 epoch: 69, train_loss: 0.6332, test_loss: 1.0144, test_f1: 0.6465
 epoch: 70, train_loss: 0.6321, test_loss: 1.0378, test_f1: 0.6152
 epoch: 71, train_loss: 0.6279, test_loss: 1.0955, test_f1: 0.5899
 epoch: 72, train_loss: 0.6329, test_loss: 0.9362, test_f1: 0.6378
 epoch: 73, train_loss: 0.6134, test_loss: 1.0378, test_f1: 0.6583
 epoch: 74, train_loss: 0.6024, test_loss: 0.9848, test_f1: 0.6316
 epoch: 75, train_loss: 0.6240, test_loss: 0.9561, test_f1: 0.6317
 epoch: 76, train_loss: 0.6062, test_loss: 1.0294, test_f1: 0.6375
 epoch: 77, train_loss: 0.6088, test_loss: 1.0593, test_f1: 0.6536
 epoch: 78, train_loss: 0.6085, test_loss: 0.9818, test_f1: 0.6546
 epoch: 79, train_loss: 0.5991, test_loss: 0.9498, test_f1: 0.6459
 epoch: 80, train_loss: 0.5776, test_loss: 1.0719, test_f1: 0.6108
 epoch: 81, train_loss: 0.5857, test_loss: 1.0992, test_f1: 0.6646
 epoch: 82, train_loss: 0.5948, test_loss: 1.1179, test_f1: 0.6394
 epoch: 83, train_loss: 0.5946, test_loss: 1.1501, test_f1: 0.6317
 epoch: 84, train_loss: 0.5822, test_loss: 1.0915, test_f1: 0.6291
 epoch: 85, train_loss: 0.6025, test_loss: 1.0809, test_f1: 0.6573
 epoch: 86, train_loss: 0.6037, test_loss: 1.1081, test_f1: 0.6397
 epoch: 87, train_loss: 0.5883, test_loss: 1.0281, test_f1: 0.6423
 epoch: 88, train_loss: 0.5850, test_loss: 1.0455, test_f1: 0.6622
 epoch: 89, train_loss: 0.5729, test_loss: 1.0810, test_f1: 0.6401
 epoch: 90, train_loss: 0.5727, test_loss: 0.9730, test_f1: 0.6232
 epoch: 91, train_loss: 0.5939, test_loss: 1.0793, test_f1: 0.6368
 epoch: 92, train_loss: 0.5857, test_loss: 1.1218, test_f1: 0.6554
 epoch: 93, train_loss: 0.5988, test_loss: 1.0934, test_f1: 0.6583
 epoch: 94, train_loss: 0.5736, test_loss: 1.0692, test_f1: 0.6327
 epoch: 95, train_loss: 0.5738, test_loss: 1.0944, test_f1: 0.6753
 epoch: 96, train_loss: 0.5942, test_loss: 1.1665, test_f1: 0.6229
 epoch: 97, train_loss: 0.5574, test_loss: 1.0937, test_f1: 0.6488
 epoch: 98, train_loss: 0.5688, test_loss: 1.0727, test_f1: 0.6195
 epoch: 99, train_loss: 0.5671, test_loss: 1.0525, test_f1: 0.6579
##################ITERATION #3 ****************************************
 epoch: 0, train_loss: 1.2520, test_loss: 1.1421, test_f1: 0.3405
 epoch: 1, train_loss: 1.0833, test_loss: 1.0269, test_f1: 0.4276
 epoch: 2, train_loss: 0.9974, test_loss: 0.9818, test_f1: 0.4854
 epoch: 3, train_loss: 0.9905, test_loss: 1.0269, test_f1: 0.4651
 epoch: 4, train_loss: 0.9761, test_loss: 1.0073, test_f1: 0.4623
 epoch: 5, train_loss: 0.9544, test_loss: 0.9479, test_f1: 0.5002
 epoch: 6, train_loss: 0.9421, test_loss: 0.9881, test_f1: 0.5030
 epoch: 7, train_loss: 0.9265, test_loss: 0.9853, test_f1: 0.4771
 epoch: 8, train_loss: 0.9509, test_loss: 0.9317, test_f1: 0.5223
 epoch: 9, train_loss: 0.9289, test_loss: 0.9826, test_f1: 0.5245
 epoch: 10, train_loss: 0.9235, test_loss: 0.9528, test_f1: 0.4811
 epoch: 11, train_loss: 0.9229, test_loss: 0.9366, test_f1: 0.4746
 epoch: 12, train_loss: 0.9043, test_loss: 1.0381, test_f1: 0.4929
 epoch: 13, train_loss: 0.9020, test_loss: 1.0689, test_f1: 0.5039
 epoch: 14, train_loss: 0.8950, test_loss: 0.8935, test_f1: 0.5085
 epoch: 15, train_loss: 0.8956, test_loss: 0.9789, test_f1: 0.4862
 epoch: 16, train_loss: 0.8829, test_loss: 1.0598, test_f1: 0.5083
 epoch: 17, train_loss: 0.8745, test_loss: 0.9988, test_f1: 0.5379
 epoch: 18, train_loss: 0.8629, test_loss: 1.0248, test_f1: 0.5215
 epoch: 19, train_loss: 0.8585, test_loss: 0.9814, test_f1: 0.5373
 epoch: 20, train_loss: 0.8586, test_loss: 0.9430, test_f1: 0.5192
 epoch: 21, train_loss: 0.8586, test_loss: 0.9304, test_f1: 0.5484
 epoch: 22, train_loss: 0.8563, test_loss: 0.9945, test_f1: 0.5096
 epoch: 23, train_loss: 0.8414, test_loss: 0.9631, test_f1: 0.5516
 epoch: 24, train_loss: 0.8366, test_loss: 0.9236, test_f1: 0.5528
 epoch: 25, train_loss: 0.8256, test_loss: 0.9170, test_f1: 0.5714
 epoch: 26, train_loss: 0.8287, test_loss: 0.9219, test_f1: 0.5936
 epoch: 27, train_loss: 0.8125, test_loss: 0.9631, test_f1: 0.5687
 epoch: 28, train_loss: 0.8149, test_loss: 0.8238, test_f1: 0.5550
 epoch: 29, train_loss: 0.8115, test_loss: 0.9083, test_f1: 0.5637
 epoch: 30, train_loss: 0.7909, test_loss: 1.0793, test_f1: 0.5255
 epoch: 31, train_loss: 0.8069, test_loss: 0.8332, test_f1: 0.5680
 epoch: 32, train_loss: 0.7886, test_loss: 0.8500, test_f1: 0.5612
 epoch: 33, train_loss: 0.7833, test_loss: 0.9466, test_f1: 0.5802
 epoch: 34, train_loss: 0.7923, test_loss: 0.9885, test_f1: 0.5202
 epoch: 35, train_loss: 0.7802, test_loss: 0.9652, test_f1: 0.5892
 epoch: 36, train_loss: 0.7659, test_loss: 0.9212, test_f1: 0.5698
 epoch: 37, train_loss: 0.7782, test_loss: 0.9249, test_f1: 0.5908
 epoch: 38, train_loss: 0.7607, test_loss: 0.8631, test_f1: 0.6040
 epoch: 39, train_loss: 0.7628, test_loss: 0.9643, test_f1: 0.5860
 epoch: 40, train_loss: 0.7752, test_loss: 0.9383, test_f1: 0.5405
 epoch: 41, train_loss: 0.7605, test_loss: 0.9644, test_f1: 0.5918
 epoch: 42, train_loss: 0.7473, test_loss: 0.9520, test_f1: 0.6118
 epoch: 43, train_loss: 0.7362, test_loss: 0.9822, test_f1: 0.5608
 epoch: 44, train_loss: 0.7304, test_loss: 1.0985, test_f1: 0.5727
 epoch: 45, train_loss: 0.7528, test_loss: 1.0220, test_f1: 0.5477
 epoch: 46, train_loss: 0.7329, test_loss: 0.8683, test_f1: 0.5714
 epoch: 47, train_loss: 0.7417, test_loss: 1.0336, test_f1: 0.5798
 epoch: 48, train_loss: 0.7364, test_loss: 1.0081, test_f1: 0.5763
 epoch: 49, train_loss: 0.7091, test_loss: 0.9713, test_f1: 0.5769
 epoch: 50, train_loss: 0.7235, test_loss: 1.0385, test_f1: 0.5841
 epoch: 51, train_loss: 0.6995, test_loss: 0.9228, test_f1: 0.6156
 epoch: 52, train_loss: 0.6611, test_loss: 0.9763, test_f1: 0.6080
 epoch: 53, train_loss: 0.6531, test_loss: 1.0155, test_f1: 0.6028
 epoch: 54, train_loss: 0.6632, test_loss: 0.9677, test_f1: 0.5916
 epoch: 55, train_loss: 0.6580, test_loss: 0.9126, test_f1: 0.5891
 epoch: 56, train_loss: 0.6429, test_loss: 0.9821, test_f1: 0.6188
 epoch: 57, train_loss: 0.6499, test_loss: 1.0005, test_f1: 0.6311
 epoch: 58, train_loss: 0.6625, test_loss: 0.9513, test_f1: 0.6241
 epoch: 59, train_loss: 0.6509, test_loss: 0.9545, test_f1: 0.6110
 epoch: 60, train_loss: 0.6382, test_loss: 1.0462, test_f1: 0.6609
 epoch: 61, train_loss: 0.6515, test_loss: 0.9871, test_f1: 0.5844
 epoch: 62, train_loss: 0.6403, test_loss: 1.0030, test_f1: 0.6015
 epoch: 63, train_loss: 0.6385, test_loss: 1.0026, test_f1: 0.6120
 epoch: 64, train_loss: 0.6439, test_loss: 1.0488, test_f1: 0.5840
 epoch: 65, train_loss: 0.6408, test_loss: 1.0296, test_f1: 0.6295
 epoch: 66, train_loss: 0.6264, test_loss: 1.0380, test_f1: 0.6067
 epoch: 67, train_loss: 0.6182, test_loss: 1.0914, test_f1: 0.6290
 epoch: 68, train_loss: 0.6165, test_loss: 1.0042, test_f1: 0.6075
 epoch: 69, train_loss: 0.6342, test_loss: 1.0619, test_f1: 0.6238
 epoch: 70, train_loss: 0.6018, test_loss: 1.0797, test_f1: 0.6156
 epoch: 71, train_loss: 0.6024, test_loss: 1.0825, test_f1: 0.6116
 epoch: 72, train_loss: 0.6103, test_loss: 1.0587, test_f1: 0.6244
 epoch: 73, train_loss: 0.6196, test_loss: 1.1142, test_f1: 0.6428
 epoch: 74, train_loss: 0.6175, test_loss: 1.0208, test_f1: 0.6032
 epoch: 75, train_loss: 0.6177, test_loss: 1.1072, test_f1: 0.6142
 epoch: 76, train_loss: 0.6027, test_loss: 1.1263, test_f1: 0.5921
 epoch: 77, train_loss: 0.6046, test_loss: 1.0744, test_f1: 0.6466
 epoch: 78, train_loss: 0.6090, test_loss: 1.0071, test_f1: 0.6493
 epoch: 79, train_loss: 0.5946, test_loss: 1.0314, test_f1: 0.6473
 epoch: 80, train_loss: 0.5789, test_loss: 1.0883, test_f1: 0.6347
 epoch: 81, train_loss: 0.5950, test_loss: 1.0660, test_f1: 0.6511
 epoch: 82, train_loss: 0.5924, test_loss: 0.9622, test_f1: 0.6516
 epoch: 83, train_loss: 0.5877, test_loss: 1.0922, test_f1: 0.6309
 epoch: 84, train_loss: 0.5860, test_loss: 1.1331, test_f1: 0.6273
 epoch: 85, train_loss: 0.5890, test_loss: 1.0697, test_f1: 0.6464
 epoch: 86, train_loss: 0.5815, test_loss: 1.0843, test_f1: 0.5897
 epoch: 87, train_loss: 0.5884, test_loss: 1.0868, test_f1: 0.6054
 epoch: 88, train_loss: 0.5873, test_loss: 1.1441, test_f1: 0.6165
 epoch: 89, train_loss: 0.5826, test_loss: 1.1117, test_f1: 0.6485
 epoch: 90, train_loss: 0.5813, test_loss: 1.1613, test_f1: 0.6244
 epoch: 91, train_loss: 0.5775, test_loss: 1.1586, test_f1: 0.6415
 epoch: 92, train_loss: 0.5799, test_loss: 1.0782, test_f1: 0.6577
 epoch: 93, train_loss: 0.5881, test_loss: 1.0562, test_f1: 0.6340
 epoch: 94, train_loss: 0.5990, test_loss: 1.2104, test_f1: 0.6043
 epoch: 95, train_loss: 0.5571, test_loss: 1.0923, test_f1: 0.6302
 epoch: 96, train_loss: 0.5612, test_loss: 1.1474, test_f1: 0.6243
 epoch: 97, train_loss: 0.5595, test_loss: 1.1880, test_f1: 0.6290
 epoch: 98, train_loss: 0.5799, test_loss: 1.1915, test_f1: 0.5986
 epoch: 99, train_loss: 0.5481, test_loss: 1.1599, test_f1: 0.6383
##################ITERATION #4 ****************************************
 epoch: 0, train_loss: 1.2448, test_loss: 1.2308, test_f1: 0.3588
 epoch: 1, train_loss: 1.0238, test_loss: 1.0107, test_f1: 0.4895
 epoch: 2, train_loss: 1.0015, test_loss: 1.0066, test_f1: 0.4690
 epoch: 3, train_loss: 0.9676, test_loss: 1.0888, test_f1: 0.4257
 epoch: 4, train_loss: 0.9620, test_loss: 0.9578, test_f1: 0.4938
 epoch: 5, train_loss: 0.9443, test_loss: 0.9193, test_f1: 0.5210
 epoch: 6, train_loss: 0.9387, test_loss: 1.0588, test_f1: 0.4713
 epoch: 7, train_loss: 0.9423, test_loss: 1.0135, test_f1: 0.4720
 epoch: 8, train_loss: 0.9344, test_loss: 1.0011, test_f1: 0.4939
 epoch: 9, train_loss: 0.9076, test_loss: 0.9467, test_f1: 0.4925
 epoch: 10, train_loss: 0.9087, test_loss: 0.9424, test_f1: 0.5098
 epoch: 11, train_loss: 0.8934, test_loss: 0.9825, test_f1: 0.4888
 epoch: 12, train_loss: 0.8773, test_loss: 1.0173, test_f1: 0.5100
 epoch: 13, train_loss: 0.8880, test_loss: 0.9567, test_f1: 0.5131
 epoch: 14, train_loss: 0.8827, test_loss: 0.9948, test_f1: 0.5014
 epoch: 15, train_loss: 0.8715, test_loss: 1.0014, test_f1: 0.4930
 epoch: 16, train_loss: 0.8661, test_loss: 1.0074, test_f1: 0.5435
 epoch: 17, train_loss: 0.8600, test_loss: 0.9927, test_f1: 0.5471
 epoch: 18, train_loss: 0.8478, test_loss: 1.0120, test_f1: 0.5099
 epoch: 19, train_loss: 0.8325, test_loss: 1.0794, test_f1: 0.4952
 epoch: 20, train_loss: 0.8457, test_loss: 1.0771, test_f1: 0.5395
 epoch: 21, train_loss: 0.8487, test_loss: 1.0522, test_f1: 0.5479
 epoch: 22, train_loss: 0.8483, test_loss: 1.0010, test_f1: 0.5497
 epoch: 23, train_loss: 0.8410, test_loss: 1.1380, test_f1: 0.4859
 epoch: 24, train_loss: 0.8310, test_loss: 1.0338, test_f1: 0.5418
 epoch: 25, train_loss: 0.8355, test_loss: 1.0235, test_f1: 0.5385
 epoch: 26, train_loss: 0.8154, test_loss: 0.9937, test_f1: 0.5576
 epoch: 27, train_loss: 0.8225, test_loss: 0.9710, test_f1: 0.5335
 epoch: 28, train_loss: 0.8199, test_loss: 1.0320, test_f1: 0.5484
 epoch: 29, train_loss: 0.8197, test_loss: 0.9229, test_f1: 0.5621
 epoch: 30, train_loss: 0.7993, test_loss: 1.0427, test_f1: 0.5863
 epoch: 31, train_loss: 0.8047, test_loss: 1.0142, test_f1: 0.5429
 epoch: 32, train_loss: 0.8069, test_loss: 0.9045, test_f1: 0.5990
 epoch: 33, train_loss: 0.8115, test_loss: 0.9689, test_f1: 0.5861
 epoch: 34, train_loss: 0.7882, test_loss: 1.0702, test_f1: 0.5466
 epoch: 35, train_loss: 0.8057, test_loss: 1.0243, test_f1: 0.5488
 epoch: 36, train_loss: 0.7944, test_loss: 1.0024, test_f1: 0.5745
 epoch: 37, train_loss: 0.7850, test_loss: 1.0031, test_f1: 0.5649
 epoch: 38, train_loss: 0.7980, test_loss: 0.9530, test_f1: 0.5442
 epoch: 39, train_loss: 0.7981, test_loss: 1.0418, test_f1: 0.5985
 epoch: 40, train_loss: 0.7757, test_loss: 1.0731, test_f1: 0.5729
 epoch: 41, train_loss: 0.7801, test_loss: 1.0256, test_f1: 0.5524
 epoch: 42, train_loss: 0.8003, test_loss: 1.0413, test_f1: 0.5821
 epoch: 43, train_loss: 0.7936, test_loss: 0.9190, test_f1: 0.5686
 epoch: 44, train_loss: 0.7700, test_loss: 0.9856, test_f1: 0.5789
 epoch: 45, train_loss: 0.7515, test_loss: 0.9678, test_f1: 0.5973
 epoch: 46, train_loss: 0.7528, test_loss: 1.0330, test_f1: 0.5822
 epoch: 47, train_loss: 0.7468, test_loss: 0.9418, test_f1: 0.5780
 epoch: 48, train_loss: 0.7513, test_loss: 1.0527, test_f1: 0.5631
 epoch: 49, train_loss: 0.7530, test_loss: 0.9807, test_f1: 0.5833
 epoch: 50, train_loss: 0.7319, test_loss: 1.0398, test_f1: 0.5675
 epoch: 51, train_loss: 0.7285, test_loss: 0.9810, test_f1: 0.5738
 epoch: 52, train_loss: 0.7163, test_loss: 1.0093, test_f1: 0.5715
 epoch: 53, train_loss: 0.7066, test_loss: 0.9920, test_f1: 0.6055
 epoch: 54, train_loss: 0.6984, test_loss: 1.0066, test_f1: 0.5805
 epoch: 55, train_loss: 0.6855, test_loss: 1.0179, test_f1: 0.5904
 epoch: 56, train_loss: 0.6951, test_loss: 1.0136, test_f1: 0.6005
 epoch: 57, train_loss: 0.6812, test_loss: 1.0301, test_f1: 0.6001
 epoch: 58, train_loss: 0.6837, test_loss: 1.0554, test_f1: 0.5858
 epoch: 59, train_loss: 0.6943, test_loss: 1.0469, test_f1: 0.6023
 epoch: 60, train_loss: 0.6800, test_loss: 0.9991, test_f1: 0.5891
 epoch: 61, train_loss: 0.6608, test_loss: 1.1705, test_f1: 0.5731
 epoch: 62, train_loss: 0.6599, test_loss: 1.0870, test_f1: 0.5839
 epoch: 63, train_loss: 0.6702, test_loss: 1.1110, test_f1: 0.6007
 epoch: 64, train_loss: 0.6571, test_loss: 1.0956, test_f1: 0.5988
 epoch: 65, train_loss: 0.6635, test_loss: 1.0740, test_f1: 0.5936
 epoch: 66, train_loss: 0.6591, test_loss: 1.0252, test_f1: 0.6014
 epoch: 67, train_loss: 0.6537, test_loss: 1.1567, test_f1: 0.6055
 epoch: 68, train_loss: 0.6544, test_loss: 1.1335, test_f1: 0.6086
 epoch: 69, train_loss: 0.6546, test_loss: 1.1988, test_f1: 0.5773
 epoch: 70, train_loss: 0.6600, test_loss: 1.0424, test_f1: 0.6071
 epoch: 71, train_loss: 0.6457, test_loss: 1.2193, test_f1: 0.6024
 epoch: 72, train_loss: 0.6417, test_loss: 1.1375, test_f1: 0.6092
 epoch: 73, train_loss: 0.6391, test_loss: 1.2531, test_f1: 0.5902
 epoch: 74, train_loss: 0.6394, test_loss: 1.2215, test_f1: 0.6061
 epoch: 75, train_loss: 0.6419, test_loss: 1.1352, test_f1: 0.6096
 epoch: 76, train_loss: 0.6270, test_loss: 1.2091, test_f1: 0.5859
 epoch: 77, train_loss: 0.6302, test_loss: 1.2580, test_f1: 0.6017
 epoch: 78, train_loss: 0.6314, test_loss: 1.2134, test_f1: 0.6058
 epoch: 79, train_loss: 0.6196, test_loss: 1.1538, test_f1: 0.6076
 epoch: 80, train_loss: 0.6288, test_loss: 1.1572, test_f1: 0.5914
 epoch: 81, train_loss: 0.6299, test_loss: 1.1688, test_f1: 0.6085
 epoch: 82, train_loss: 0.6309, test_loss: 1.2165, test_f1: 0.6000
 epoch: 83, train_loss: 0.6092, test_loss: 1.2111, test_f1: 0.5845
 epoch: 84, train_loss: 0.6219, test_loss: 1.1931, test_f1: 0.6079
 epoch: 85, train_loss: 0.6449, test_loss: 1.1516, test_f1: 0.6143
 epoch: 86, train_loss: 0.6097, test_loss: 1.1019, test_f1: 0.6319
 epoch: 87, train_loss: 0.6095, test_loss: 1.1940, test_f1: 0.6505
 epoch: 88, train_loss: 0.6025, test_loss: 1.2014, test_f1: 0.6202
 epoch: 89, train_loss: 0.5939, test_loss: 1.1430, test_f1: 0.6152
 epoch: 90, train_loss: 0.6040, test_loss: 1.1598, test_f1: 0.5955
 epoch: 91, train_loss: 0.5969, test_loss: 1.3109, test_f1: 0.6116
 epoch: 92, train_loss: 0.5988, test_loss: 1.2507, test_f1: 0.6100
 epoch: 93, train_loss: 0.6120, test_loss: 1.2941, test_f1: 0.5881
 epoch: 94, train_loss: 0.5983, test_loss: 1.1792, test_f1: 0.6237
 epoch: 95, train_loss: 0.5970, test_loss: 1.2739, test_f1: 0.6228
 epoch: 96, train_loss: 0.5865, test_loss: 1.1564, test_f1: 0.6356
 epoch: 97, train_loss: 0.5893, test_loss: 1.2333, test_f1: 0.6168
 epoch: 98, train_loss: 0.5818, test_loss: 1.3701, test_f1: 0.6072
 epoch: 99, train_loss: 0.5834, test_loss: 1.1443, test_f1: 0.6344
##################ITERATION #5 ****************************************
 epoch: 0, train_loss: 1.2620, test_loss: 1.2264, test_f1: 0.2894
 epoch: 1, train_loss: 1.0622, test_loss: 1.0664, test_f1: 0.4128
 epoch: 2, train_loss: 1.0112, test_loss: 1.0062, test_f1: 0.4531
 epoch: 3, train_loss: 0.9914, test_loss: 0.9669, test_f1: 0.4527
 epoch: 4, train_loss: 0.9890, test_loss: 1.0266, test_f1: 0.4354
 epoch: 5, train_loss: 0.9592, test_loss: 0.9533, test_f1: 0.4804
 epoch: 6, train_loss: 0.9491, test_loss: 0.9813, test_f1: 0.4551
 epoch: 7, train_loss: 0.9397, test_loss: 1.1207, test_f1: 0.4188
 epoch: 8, train_loss: 0.9377, test_loss: 1.0200, test_f1: 0.4846
 epoch: 9, train_loss: 0.9195, test_loss: 1.0209, test_f1: 0.4609
 epoch: 10, train_loss: 0.9238, test_loss: 0.9841, test_f1: 0.5112
 epoch: 11, train_loss: 0.9132, test_loss: 0.9874, test_f1: 0.4549
 epoch: 12, train_loss: 0.9078, test_loss: 0.9156, test_f1: 0.5005
 epoch: 13, train_loss: 0.9019, test_loss: 1.1090, test_f1: 0.4703
 epoch: 14, train_loss: 0.8849, test_loss: 1.0228, test_f1: 0.4898
 epoch: 15, train_loss: 0.8597, test_loss: 0.9740, test_f1: 0.5473
 epoch: 16, train_loss: 0.8734, test_loss: 1.0701, test_f1: 0.4574
 epoch: 17, train_loss: 0.8618, test_loss: 0.9633, test_f1: 0.5652
 epoch: 18, train_loss: 0.8561, test_loss: 0.9984, test_f1: 0.5200
 epoch: 19, train_loss: 0.8559, test_loss: 0.9980, test_f1: 0.5458
 epoch: 20, train_loss: 0.8683, test_loss: 1.0364, test_f1: 0.4540
 epoch: 21, train_loss: 0.8475, test_loss: 0.9602, test_f1: 0.5550
 epoch: 22, train_loss: 0.8462, test_loss: 0.9086, test_f1: 0.5453
 epoch: 23, train_loss: 0.8455, test_loss: 0.9159, test_f1: 0.5508
 epoch: 24, train_loss: 0.8220, test_loss: 0.9361, test_f1: 0.5621
 epoch: 25, train_loss: 0.8385, test_loss: 0.9480, test_f1: 0.5596
 epoch: 26, train_loss: 0.8349, test_loss: 0.9002, test_f1: 0.5537
 epoch: 27, train_loss: 0.8116, test_loss: 0.9905, test_f1: 0.4963
 epoch: 28, train_loss: 0.8259, test_loss: 0.9443, test_f1: 0.5345
 epoch: 29, train_loss: 0.8128, test_loss: 0.9389, test_f1: 0.5979
 epoch: 30, train_loss: 0.7841, test_loss: 0.8918, test_f1: 0.5697
 epoch: 31, train_loss: 0.8002, test_loss: 0.9378, test_f1: 0.5929
 epoch: 32, train_loss: 0.7827, test_loss: 0.9958, test_f1: 0.5695
 epoch: 33, train_loss: 0.7958, test_loss: 0.9361, test_f1: 0.5414
 epoch: 34, train_loss: 0.8063, test_loss: 0.9715, test_f1: 0.5659
 epoch: 35, train_loss: 0.7817, test_loss: 0.9466, test_f1: 0.5887
 epoch: 36, train_loss: 0.7820, test_loss: 0.9466, test_f1: 0.5576
 epoch: 37, train_loss: 0.7759, test_loss: 0.8823, test_f1: 0.5642
 epoch: 38, train_loss: 0.7626, test_loss: 1.0862, test_f1: 0.5354
 epoch: 39, train_loss: 0.7563, test_loss: 0.9646, test_f1: 0.5644
 epoch: 40, train_loss: 0.7762, test_loss: 0.9211, test_f1: 0.5878
 epoch: 41, train_loss: 0.7499, test_loss: 0.8527, test_f1: 0.5978
 epoch: 42, train_loss: 0.7457, test_loss: 0.9452, test_f1: 0.5553
 epoch: 43, train_loss: 0.7441, test_loss: 1.0170, test_f1: 0.5426
 epoch: 44, train_loss: 0.7625, test_loss: 1.0455, test_f1: 0.5324
 epoch: 45, train_loss: 0.7477, test_loss: 0.8395, test_f1: 0.6504
 epoch: 46, train_loss: 0.7454, test_loss: 0.8586, test_f1: 0.5499
 epoch: 47, train_loss: 0.7318, test_loss: 0.9428, test_f1: 0.5746
 epoch: 48, train_loss: 0.7989, test_loss: 0.9498, test_f1: 0.5634
 epoch: 49, train_loss: 0.7961, test_loss: 1.1620, test_f1: 0.5242
 epoch: 50, train_loss: 0.7619, test_loss: 0.9940, test_f1: 0.5119
 epoch: 51, train_loss: 0.7532, test_loss: 0.9869, test_f1: 0.5552
 epoch: 52, train_loss: 0.7323, test_loss: 0.9274, test_f1: 0.6181
 epoch: 53, train_loss: 0.7282, test_loss: 0.8910, test_f1: 0.6101
 epoch: 54, train_loss: 0.7159, test_loss: 0.9069, test_f1: 0.6341
 epoch: 55, train_loss: 0.7018, test_loss: 1.0006, test_f1: 0.5934
 epoch: 56, train_loss: 0.7054, test_loss: 0.8833, test_f1: 0.6165
 epoch: 57, train_loss: 0.7076, test_loss: 0.8989, test_f1: 0.5921
 epoch: 58, train_loss: 0.6955, test_loss: 0.9237, test_f1: 0.6169
 epoch: 59, train_loss: 0.6862, test_loss: 0.8767, test_f1: 0.6266
 epoch: 60, train_loss: 0.6853, test_loss: 0.8602, test_f1: 0.6423
 epoch: 61, train_loss: 0.6924, test_loss: 0.9891, test_f1: 0.6138
 epoch: 62, train_loss: 0.6781, test_loss: 0.9235, test_f1: 0.6002
 epoch: 63, train_loss: 0.6796, test_loss: 1.0782, test_f1: 0.5994
 epoch: 64, train_loss: 0.6770, test_loss: 1.0685, test_f1: 0.5930
 epoch: 65, train_loss: 0.6763, test_loss: 0.9570, test_f1: 0.6261
 epoch: 66, train_loss: 0.6674, test_loss: 1.0694, test_f1: 0.6329
 epoch: 67, train_loss: 0.6813, test_loss: 0.9827, test_f1: 0.6103
 epoch: 68, train_loss: 0.6634, test_loss: 0.9527, test_f1: 0.6283
 epoch: 69, train_loss: 0.6686, test_loss: 1.0065, test_f1: 0.6211
 epoch: 70, train_loss: 0.6670, test_loss: 0.9726, test_f1: 0.6518
 epoch: 71, train_loss: 0.6542, test_loss: 1.0978, test_f1: 0.5989
 epoch: 72, train_loss: 0.6546, test_loss: 0.9848, test_f1: 0.6151
 epoch: 73, train_loss: 0.6553, test_loss: 1.0035, test_f1: 0.6009
 epoch: 74, train_loss: 0.6546, test_loss: 1.0660, test_f1: 0.5821
 epoch: 75, train_loss: 0.6687, test_loss: 0.9941, test_f1: 0.6306
 epoch: 76, train_loss: 0.6636, test_loss: 1.0163, test_f1: 0.6424
 epoch: 77, train_loss: 0.6457, test_loss: 1.0182, test_f1: 0.6075
 epoch: 78, train_loss: 0.6406, test_loss: 1.0658, test_f1: 0.6436
 epoch: 79, train_loss: 0.6321, test_loss: 0.9687, test_f1: 0.6063
 epoch: 80, train_loss: 0.6425, test_loss: 1.1353, test_f1: 0.6199
 epoch: 81, train_loss: 0.6201, test_loss: 1.0447, test_f1: 0.5862
 epoch: 82, train_loss: 0.6274, test_loss: 1.1936, test_f1: 0.5636
 epoch: 83, train_loss: 0.6442, test_loss: 1.0910, test_f1: 0.6356
 epoch: 84, train_loss: 0.6443, test_loss: 1.0515, test_f1: 0.5898
 epoch: 85, train_loss: 0.6459, test_loss: 0.9354, test_f1: 0.6090
 epoch: 86, train_loss: 0.6315, test_loss: 1.0997, test_f1: 0.5870
 epoch: 87, train_loss: 0.6422, test_loss: 1.2244, test_f1: 0.5865
 epoch: 88, train_loss: 0.6264, test_loss: 1.0154, test_f1: 0.6410
 epoch: 89, train_loss: 0.6268, test_loss: 1.1326, test_f1: 0.6181
 epoch: 90, train_loss: 0.6211, test_loss: 1.0863, test_f1: 0.6442
 epoch: 91, train_loss: 0.6169, test_loss: 1.0325, test_f1: 0.6467
 epoch: 92, train_loss: 0.6296, test_loss: 1.1015, test_f1: 0.6258
 epoch: 93, train_loss: 0.6444, test_loss: 1.0482, test_f1: 0.6807
 epoch: 94, train_loss: 0.6134, test_loss: 1.0055, test_f1: 0.6262
 epoch: 95, train_loss: 0.5939, test_loss: 1.1035, test_f1: 0.6713
 epoch: 96, train_loss: 0.6078, test_loss: 1.0826, test_f1: 0.5997
 epoch: 97, train_loss: 0.6027, test_loss: 0.9675, test_f1: 0.6507
 epoch: 98, train_loss: 0.6023, test_loss: 1.0682, test_f1: 0.6679
 epoch: 99, train_loss: 0.6091, test_loss: 1.1415, test_f1: 0.6236
##################ITERATION #6 ****************************************
 epoch: 0, train_loss: 1.2665, test_loss: 1.2102, test_f1: 0.2928
 epoch: 1, train_loss: 1.0526, test_loss: 1.0346, test_f1: 0.4181
 epoch: 2, train_loss: 1.0030, test_loss: 1.0859, test_f1: 0.4410
 epoch: 3, train_loss: 0.9960, test_loss: 1.0496, test_f1: 0.4681
 epoch: 4, train_loss: 0.9666, test_loss: 1.0329, test_f1: 0.4299
 epoch: 5, train_loss: 0.9608, test_loss: 1.0644, test_f1: 0.5005
 epoch: 6, train_loss: 0.9508, test_loss: 0.9602, test_f1: 0.5217
 epoch: 7, train_loss: 0.9427, test_loss: 1.0160, test_f1: 0.5101
 epoch: 8, train_loss: 0.9216, test_loss: 1.0848, test_f1: 0.4695
 epoch: 9, train_loss: 0.9174, test_loss: 0.9761, test_f1: 0.5388
 epoch: 10, train_loss: 0.9128, test_loss: 1.0084, test_f1: 0.5098
 epoch: 11, train_loss: 0.8931, test_loss: 1.0400, test_f1: 0.4971
 epoch: 12, train_loss: 0.8959, test_loss: 0.9902, test_f1: 0.5119
 epoch: 13, train_loss: 0.8819, test_loss: 0.9941, test_f1: 0.5133
 epoch: 14, train_loss: 0.8864, test_loss: 1.0000, test_f1: 0.5048
 epoch: 15, train_loss: 0.8746, test_loss: 0.8847, test_f1: 0.5104
 epoch: 16, train_loss: 0.8600, test_loss: 0.9978, test_f1: 0.4790
 epoch: 17, train_loss: 0.8642, test_loss: 0.9224, test_f1: 0.5121
 epoch: 18, train_loss: 0.8557, test_loss: 0.9672, test_f1: 0.5118
 epoch: 19, train_loss: 0.8397, test_loss: 0.9190, test_f1: 0.5200
 epoch: 20, train_loss: 0.8333, test_loss: 1.0730, test_f1: 0.4797
 epoch: 21, train_loss: 0.8395, test_loss: 1.0593, test_f1: 0.5247
 epoch: 22, train_loss: 0.8347, test_loss: 0.9332, test_f1: 0.5299
 epoch: 23, train_loss: 0.8190, test_loss: 0.9636, test_f1: 0.5385
 epoch: 24, train_loss: 0.8169, test_loss: 0.8761, test_f1: 0.5418
 epoch: 25, train_loss: 0.8265, test_loss: 0.9228, test_f1: 0.5673
 epoch: 26, train_loss: 0.8108, test_loss: 0.9384, test_f1: 0.5325
 epoch: 27, train_loss: 0.7988, test_loss: 0.9267, test_f1: 0.5454
 epoch: 28, train_loss: 0.7999, test_loss: 0.9294, test_f1: 0.5558
 epoch: 29, train_loss: 0.8073, test_loss: 0.9551, test_f1: 0.5508
 epoch: 30, train_loss: 0.7938, test_loss: 0.9880, test_f1: 0.5532
 epoch: 31, train_loss: 0.8100, test_loss: 0.9328, test_f1: 0.5667
 epoch: 32, train_loss: 0.8087, test_loss: 0.9042, test_f1: 0.5562
 epoch: 33, train_loss: 0.7860, test_loss: 0.9473, test_f1: 0.5870
 epoch: 34, train_loss: 0.7801, test_loss: 1.0311, test_f1: 0.5352
 epoch: 35, train_loss: 0.7961, test_loss: 0.8960, test_f1: 0.5669
 epoch: 36, train_loss: 0.7724, test_loss: 0.9126, test_f1: 0.5620
 epoch: 37, train_loss: 0.7907, test_loss: 1.0144, test_f1: 0.5613
 epoch: 38, train_loss: 0.7751, test_loss: 0.9229, test_f1: 0.5349
 epoch: 39, train_loss: 0.7613, test_loss: 0.8628, test_f1: 0.5758
 epoch: 40, train_loss: 0.7580, test_loss: 0.9583, test_f1: 0.5872
 epoch: 41, train_loss: 0.7623, test_loss: 0.9183, test_f1: 0.6254
 epoch: 42, train_loss: 0.7489, test_loss: 0.8296, test_f1: 0.5737
 epoch: 43, train_loss: 0.7447, test_loss: 0.9287, test_f1: 0.5669
 epoch: 44, train_loss: 0.7447, test_loss: 0.9513, test_f1: 0.5392
 epoch: 45, train_loss: 0.7337, test_loss: 0.8681, test_f1: 0.6513
 epoch: 46, train_loss: 0.7474, test_loss: 0.9379, test_f1: 0.6052
 epoch: 47, train_loss: 0.7538, test_loss: 0.8900, test_f1: 0.6187
 epoch: 48, train_loss: 0.7533, test_loss: 0.8511, test_f1: 0.6158
 epoch: 49, train_loss: 0.7441, test_loss: 0.9045, test_f1: 0.5871
 epoch: 50, train_loss: 0.7272, test_loss: 0.9557, test_f1: 0.5899
 epoch: 51, train_loss: 0.7091, test_loss: 0.8608, test_f1: 0.6214
 epoch: 52, train_loss: 0.6823, test_loss: 0.8913, test_f1: 0.6279
 epoch: 53, train_loss: 0.6749, test_loss: 0.8795, test_f1: 0.6581
 epoch: 54, train_loss: 0.6716, test_loss: 0.8787, test_f1: 0.6342
 epoch: 55, train_loss: 0.6706, test_loss: 0.8923, test_f1: 0.6345
 epoch: 56, train_loss: 0.6649, test_loss: 0.9654, test_f1: 0.5929
 epoch: 57, train_loss: 0.6544, test_loss: 0.8716, test_f1: 0.6478
 epoch: 58, train_loss: 0.6558, test_loss: 0.9243, test_f1: 0.6369
 epoch: 59, train_loss: 0.6595, test_loss: 0.9405, test_f1: 0.6395
 epoch: 60, train_loss: 0.6501, test_loss: 0.8991, test_f1: 0.6606
 epoch: 61, train_loss: 0.6262, test_loss: 0.9218, test_f1: 0.6220
 epoch: 62, train_loss: 0.6582, test_loss: 0.8696, test_f1: 0.6424
 epoch: 63, train_loss: 0.6439, test_loss: 0.9481, test_f1: 0.6135
 epoch: 64, train_loss: 0.6402, test_loss: 0.9574, test_f1: 0.6115
 epoch: 65, train_loss: 0.6352, test_loss: 0.9437, test_f1: 0.6251
 epoch: 66, train_loss: 0.6337, test_loss: 0.9179, test_f1: 0.6217
 epoch: 67, train_loss: 0.6209, test_loss: 0.9620, test_f1: 0.6468
 epoch: 68, train_loss: 0.6131, test_loss: 1.0062, test_f1: 0.6476
 epoch: 69, train_loss: 0.6434, test_loss: 0.9139, test_f1: 0.6508
 epoch: 70, train_loss: 0.6432, test_loss: 1.0044, test_f1: 0.6345
 epoch: 71, train_loss: 0.6313, test_loss: 0.9668, test_f1: 0.6350
 epoch: 72, train_loss: 0.6409, test_loss: 0.9455, test_f1: 0.6563
 epoch: 73, train_loss: 0.6013, test_loss: 0.9543, test_f1: 0.6688
 epoch: 74, train_loss: 0.6201, test_loss: 0.9402, test_f1: 0.6551
 epoch: 75, train_loss: 0.5930, test_loss: 0.9942, test_f1: 0.6386
 epoch: 76, train_loss: 0.6211, test_loss: 1.0074, test_f1: 0.5874
 epoch: 77, train_loss: 0.6224, test_loss: 1.0120, test_f1: 0.6751
 epoch: 78, train_loss: 0.6194, test_loss: 0.9791, test_f1: 0.6165
 epoch: 79, train_loss: 0.6149, test_loss: 1.0259, test_f1: 0.6362
 epoch: 80, train_loss: 0.6080, test_loss: 1.0278, test_f1: 0.6533
 epoch: 81, train_loss: 0.5985, test_loss: 0.9263, test_f1: 0.6436
 epoch: 82, train_loss: 0.6094, test_loss: 0.9319, test_f1: 0.6214
 epoch: 83, train_loss: 0.5891, test_loss: 0.9575, test_f1: 0.6332
 epoch: 84, train_loss: 0.5878, test_loss: 0.9850, test_f1: 0.6228
 epoch: 85, train_loss: 0.6161, test_loss: 0.9813, test_f1: 0.6299
 epoch: 86, train_loss: 0.6027, test_loss: 0.9924, test_f1: 0.6108
 epoch: 87, train_loss: 0.5986, test_loss: 0.9458, test_f1: 0.6557
 epoch: 88, train_loss: 0.5890, test_loss: 0.9885, test_f1: 0.6586
 epoch: 89, train_loss: 0.5860, test_loss: 1.0313, test_f1: 0.6595
 epoch: 90, train_loss: 0.5635, test_loss: 1.0312, test_f1: 0.6564
 epoch: 91, train_loss: 0.5823, test_loss: 0.9841, test_f1: 0.6373
 epoch: 92, train_loss: 0.5776, test_loss: 1.0158, test_f1: 0.6828
 epoch: 93, train_loss: 0.5863, test_loss: 1.0625, test_f1: 0.6392
 epoch: 94, train_loss: 0.5832, test_loss: 0.9985, test_f1: 0.6629
 epoch: 95, train_loss: 0.5589, test_loss: 1.0216, test_f1: 0.6419
 epoch: 96, train_loss: 0.5653, test_loss: 0.9719, test_f1: 0.6553
 epoch: 97, train_loss: 0.5648, test_loss: 0.9739, test_f1: 0.6589
 epoch: 98, train_loss: 0.5606, test_loss: 1.0524, test_f1: 0.6490
 epoch: 99, train_loss: 0.5377, test_loss: 1.0168, test_f1: 0.6334
##################ITERATION #7 ****************************************
 epoch: 0, train_loss: 1.2164, test_loss: 1.2523, test_f1: 0.3709
 epoch: 1, train_loss: 1.0392, test_loss: 1.0320, test_f1: 0.4673
 epoch: 2, train_loss: 0.9899, test_loss: 1.0221, test_f1: 0.4471
 epoch: 3, train_loss: 0.9677, test_loss: 1.1401, test_f1: 0.4193
 epoch: 4, train_loss: 0.9673, test_loss: 1.0165, test_f1: 0.4981
 epoch: 5, train_loss: 0.9407, test_loss: 1.0037, test_f1: 0.4510
 epoch: 6, train_loss: 0.9133, test_loss: 1.0274, test_f1: 0.4717
 epoch: 7, train_loss: 0.9025, test_loss: 0.9440, test_f1: 0.5161
 epoch: 8, train_loss: 0.8910, test_loss: 0.9869, test_f1: 0.5097
 epoch: 9, train_loss: 0.9193, test_loss: 0.9722, test_f1: 0.5334
 epoch: 10, train_loss: 0.9057, test_loss: 0.9768, test_f1: 0.5183
 epoch: 11, train_loss: 0.8921, test_loss: 0.9974, test_f1: 0.5070
 epoch: 12, train_loss: 0.8782, test_loss: 0.9792, test_f1: 0.5363
 epoch: 13, train_loss: 0.8749, test_loss: 1.9846, test_f1: 0.3489
 epoch: 14, train_loss: 0.8911, test_loss: 0.9551, test_f1: 0.5246
 epoch: 15, train_loss: 0.8517, test_loss: 0.9700, test_f1: 0.5318
 epoch: 16, train_loss: 0.8636, test_loss: 0.9841, test_f1: 0.5332
 epoch: 17, train_loss: 0.8313, test_loss: 0.9342, test_f1: 0.5399
 epoch: 18, train_loss: 0.8259, test_loss: 0.9107, test_f1: 0.5267
 epoch: 19, train_loss: 0.8243, test_loss: 0.9312, test_f1: 0.5839
 epoch: 20, train_loss: 0.8118, test_loss: 0.9287, test_f1: 0.5349
 epoch: 21, train_loss: 0.8070, test_loss: 0.9797, test_f1: 0.5682
 epoch: 22, train_loss: 0.8160, test_loss: 0.9873, test_f1: 0.5639
 epoch: 23, train_loss: 0.8131, test_loss: 0.9241, test_f1: 0.5525
 epoch: 24, train_loss: 0.8247, test_loss: 0.9842, test_f1: 0.5929
 epoch: 25, train_loss: 0.7948, test_loss: 0.9552, test_f1: 0.5783
 epoch: 26, train_loss: 0.7924, test_loss: 0.9424, test_f1: 0.6003
 epoch: 27, train_loss: 0.7863, test_loss: 1.0108, test_f1: 0.5527
 epoch: 28, train_loss: 0.8131, test_loss: 0.9925, test_f1: 0.5828
 epoch: 29, train_loss: 0.7838, test_loss: 0.9674, test_f1: 0.5612
 epoch: 30, train_loss: 0.7885, test_loss: 0.9103, test_f1: 0.5701
 epoch: 31, train_loss: 0.7803, test_loss: 0.8938, test_f1: 0.6003
 epoch: 32, train_loss: 0.7676, test_loss: 0.9438, test_f1: 0.5994
 epoch: 33, train_loss: 0.7618, test_loss: 0.9277, test_f1: 0.5881
 epoch: 34, train_loss: 0.7589, test_loss: 0.9291, test_f1: 0.6166
 epoch: 35, train_loss: 0.7474, test_loss: 0.9172, test_f1: 0.6068
 epoch: 36, train_loss: 0.7575, test_loss: 1.0329, test_f1: 0.5459
 epoch: 37, train_loss: 0.7677, test_loss: 0.9812, test_f1: 0.5692
 epoch: 38, train_loss: 0.7431, test_loss: 1.0280, test_f1: 0.5881
 epoch: 39, train_loss: 0.7446, test_loss: 0.9641, test_f1: 0.5831
 epoch: 40, train_loss: 0.7528, test_loss: 0.9556, test_f1: 0.5808
 epoch: 41, train_loss: 0.7225, test_loss: 0.8725, test_f1: 0.6097
 epoch: 42, train_loss: 0.7358, test_loss: 1.0522, test_f1: 0.5734
 epoch: 43, train_loss: 0.7312, test_loss: 0.9289, test_f1: 0.6311
 epoch: 44, train_loss: 0.7547, test_loss: 1.0136, test_f1: 0.5675
 epoch: 45, train_loss: 0.7277, test_loss: 1.0219, test_f1: 0.5581
 epoch: 46, train_loss: 0.7338, test_loss: 0.9165, test_f1: 0.5846
 epoch: 47, train_loss: 0.7333, test_loss: 0.9719, test_f1: 0.5801
 epoch: 48, train_loss: 0.7368, test_loss: 0.9178, test_f1: 0.6230
 epoch: 49, train_loss: 0.7276, test_loss: 1.0116, test_f1: 0.5699
 epoch: 50, train_loss: 0.7162, test_loss: 0.9475, test_f1: 0.5777
 epoch: 51, train_loss: 0.6915, test_loss: 0.9800, test_f1: 0.6018
 epoch: 52, train_loss: 0.6769, test_loss: 0.9127, test_f1: 0.6399
 epoch: 53, train_loss: 0.6854, test_loss: 0.9565, test_f1: 0.6251
 epoch: 54, train_loss: 0.6639, test_loss: 1.0328, test_f1: 0.5860
 epoch: 55, train_loss: 0.6973, test_loss: 0.9646, test_f1: 0.5963
 epoch: 56, train_loss: 0.6771, test_loss: 0.9464, test_f1: 0.6131
 epoch: 57, train_loss: 0.6635, test_loss: 0.9790, test_f1: 0.6113
 epoch: 58, train_loss: 0.6710, test_loss: 0.9132, test_f1: 0.6239
 epoch: 59, train_loss: 0.6588, test_loss: 0.9479, test_f1: 0.5994
 epoch: 60, train_loss: 0.6365, test_loss: 0.9300, test_f1: 0.6596
 epoch: 61, train_loss: 0.6520, test_loss: 1.0151, test_f1: 0.5966
 epoch: 62, train_loss: 0.6539, test_loss: 0.9037, test_f1: 0.6068
 epoch: 63, train_loss: 0.6479, test_loss: 0.9399, test_f1: 0.6363
 epoch: 64, train_loss: 0.6598, test_loss: 0.9126, test_f1: 0.6280
 epoch: 65, train_loss: 0.6608, test_loss: 0.9811, test_f1: 0.6222
 epoch: 66, train_loss: 0.6574, test_loss: 0.9383, test_f1: 0.6259
 epoch: 67, train_loss: 0.6514, test_loss: 0.9868, test_f1: 0.6191
 epoch: 68, train_loss: 0.6426, test_loss: 0.9535, test_f1: 0.6420
 epoch: 69, train_loss: 0.6440, test_loss: 0.9607, test_f1: 0.6249
 epoch: 70, train_loss: 0.6211, test_loss: 1.0240, test_f1: 0.6103
 epoch: 71, train_loss: 0.6403, test_loss: 0.9964, test_f1: 0.6362
 epoch: 72, train_loss: 0.6233, test_loss: 0.9800, test_f1: 0.6219
 epoch: 73, train_loss: 0.6239, test_loss: 0.9518, test_f1: 0.6404
 epoch: 74, train_loss: 0.6293, test_loss: 0.9767, test_f1: 0.6364
 epoch: 75, train_loss: 0.6243, test_loss: 0.9800, test_f1: 0.6422
 epoch: 76, train_loss: 0.6324, test_loss: 0.9673, test_f1: 0.6132
 epoch: 77, train_loss: 0.6292, test_loss: 1.0936, test_f1: 0.6125
 epoch: 78, train_loss: 0.6278, test_loss: 0.9370, test_f1: 0.6102
 epoch: 79, train_loss: 0.6246, test_loss: 1.1498, test_f1: 0.6009
 epoch: 80, train_loss: 0.6131, test_loss: 0.9779, test_f1: 0.6217
 epoch: 81, train_loss: 0.6076, test_loss: 0.9499, test_f1: 0.6422
 epoch: 82, train_loss: 0.6104, test_loss: 0.9459, test_f1: 0.6300
 epoch: 83, train_loss: 0.6195, test_loss: 1.0114, test_f1: 0.6308
 epoch: 84, train_loss: 0.6240, test_loss: 0.9448, test_f1: 0.6562
 epoch: 85, train_loss: 0.6024, test_loss: 0.9932, test_f1: 0.6500
 epoch: 86, train_loss: 0.6049, test_loss: 1.1232, test_f1: 0.6130
 epoch: 87, train_loss: 0.6053, test_loss: 1.0723, test_f1: 0.6175
 epoch: 88, train_loss: 0.6201, test_loss: 1.0415, test_f1: 0.6329
 epoch: 89, train_loss: 0.6090, test_loss: 0.9828, test_f1: 0.6168
 epoch: 90, train_loss: 0.5945, test_loss: 0.9929, test_f1: 0.6483
 epoch: 91, train_loss: 0.5878, test_loss: 1.0178, test_f1: 0.6182
 epoch: 92, train_loss: 0.6035, test_loss: 0.9995, test_f1: 0.6349
 epoch: 93, train_loss: 0.5869, test_loss: 1.2123, test_f1: 0.5937
 epoch: 94, train_loss: 0.5891, test_loss: 1.0134, test_f1: 0.6500
 epoch: 95, train_loss: 0.5976, test_loss: 1.0507, test_f1: 0.6623
 epoch: 96, train_loss: 0.5869, test_loss: 0.9010, test_f1: 0.6919
 epoch: 97, train_loss: 0.6006, test_loss: 1.1024, test_f1: 0.6073
 epoch: 98, train_loss: 0.5798, test_loss: 0.9982, test_f1: 0.6531
 epoch: 99, train_loss: 0.6161, test_loss: 0.9616, test_f1: 0.6460
##################ITERATION #8 ****************************************
 epoch: 0, train_loss: 1.2677, test_loss: 1.1468, test_f1: 0.4013
 epoch: 1, train_loss: 1.0731, test_loss: 0.9791, test_f1: 0.4509
 epoch: 2, train_loss: 0.9945, test_loss: 0.9426, test_f1: 0.4577
 epoch: 3, train_loss: 0.9704, test_loss: 0.9159, test_f1: 0.4887
 epoch: 4, train_loss: 0.9523, test_loss: 0.9413, test_f1: 0.5106
 epoch: 5, train_loss: 0.9409, test_loss: 0.9838, test_f1: 0.4845
 epoch: 6, train_loss: 0.9339, test_loss: 0.9223, test_f1: 0.5410
 epoch: 7, train_loss: 0.9102, test_loss: 0.9465, test_f1: 0.4952
 epoch: 8, train_loss: 0.9183, test_loss: 0.9651, test_f1: 0.4888
 epoch: 9, train_loss: 0.8793, test_loss: 0.9538, test_f1: 0.5130
 epoch: 10, train_loss: 0.8804, test_loss: 0.9313, test_f1: 0.5055
 epoch: 11, train_loss: 0.8601, test_loss: 0.9674, test_f1: 0.5379
 epoch: 12, train_loss: 0.8760, test_loss: 0.9525, test_f1: 0.5198
 epoch: 13, train_loss: 0.8667, test_loss: 0.9548, test_f1: 0.5168
 epoch: 14, train_loss: 0.8482, test_loss: 0.8985, test_f1: 0.5760
 epoch: 15, train_loss: 0.8419, test_loss: 0.9839, test_f1: 0.5474
 epoch: 16, train_loss: 0.8379, test_loss: 0.8998, test_f1: 0.5694
 epoch: 17, train_loss: 0.8423, test_loss: 0.8982, test_f1: 0.5717
 epoch: 18, train_loss: 0.8253, test_loss: 0.9498, test_f1: 0.5771
 epoch: 19, train_loss: 0.8382, test_loss: 0.8624, test_f1: 0.5737
 epoch: 20, train_loss: 0.8118, test_loss: 0.9158, test_f1: 0.5589
 epoch: 21, train_loss: 0.8074, test_loss: 0.9483, test_f1: 0.5422
 epoch: 22, train_loss: 0.7950, test_loss: 0.8718, test_f1: 0.6132
 epoch: 23, train_loss: 0.7927, test_loss: 1.0420, test_f1: 0.5748
 epoch: 24, train_loss: 0.7716, test_loss: 0.8116, test_f1: 0.6234
 epoch: 25, train_loss: 0.7852, test_loss: 0.8384, test_f1: 0.5921
 epoch: 26, train_loss: 0.7793, test_loss: 0.8777, test_f1: 0.6257
 epoch: 27, train_loss: 0.7699, test_loss: 0.9423, test_f1: 0.5163
 epoch: 28, train_loss: 0.7756, test_loss: 0.8688, test_f1: 0.6445
 epoch: 29, train_loss: 0.7477, test_loss: 0.8559, test_f1: 0.5862
 epoch: 30, train_loss: 0.7601, test_loss: 0.8966, test_f1: 0.5774
 epoch: 31, train_loss: 0.7535, test_loss: 0.8642, test_f1: 0.6019
 epoch: 32, train_loss: 0.7442, test_loss: 0.9180, test_f1: 0.6197
 epoch: 33, train_loss: 0.7300, test_loss: 0.9098, test_f1: 0.5801
 epoch: 34, train_loss: 0.7495, test_loss: 0.9176, test_f1: 0.6087
 epoch: 35, train_loss: 0.7309, test_loss: 0.8631, test_f1: 0.6019
 epoch: 36, train_loss: 0.7272, test_loss: 0.9773, test_f1: 0.5524
 epoch: 37, train_loss: 0.7340, test_loss: 0.8575, test_f1: 0.6175
 epoch: 38, train_loss: 0.7097, test_loss: 0.8426, test_f1: 0.6317
 epoch: 39, train_loss: 0.7252, test_loss: 0.8957, test_f1: 0.6112
 epoch: 40, train_loss: 0.7286, test_loss: 0.8557, test_f1: 0.6130
 epoch: 41, train_loss: 0.7319, test_loss: 0.7911, test_f1: 0.5900
 epoch: 42, train_loss: 0.7055, test_loss: 0.8067, test_f1: 0.6556
 epoch: 43, train_loss: 0.6984, test_loss: 0.8737, test_f1: 0.6401
 epoch: 44, train_loss: 0.7186, test_loss: 0.8862, test_f1: 0.5909
 epoch: 45, train_loss: 0.7195, test_loss: 0.7895, test_f1: 0.6613
 epoch: 46, train_loss: 0.6910, test_loss: 0.8411, test_f1: 0.6252
 epoch: 47, train_loss: 0.6990, test_loss: 0.8093, test_f1: 0.6353
 epoch: 48, train_loss: 0.6884, test_loss: 0.8867, test_f1: 0.6096
 epoch: 49, train_loss: 0.6789, test_loss: 0.8346, test_f1: 0.6126
 epoch: 50, train_loss: 0.6734, test_loss: 0.8548, test_f1: 0.6492
 epoch: 51, train_loss: 0.6498, test_loss: 0.7853, test_f1: 0.6286
 epoch: 52, train_loss: 0.6379, test_loss: 0.7821, test_f1: 0.6320
 epoch: 53, train_loss: 0.6275, test_loss: 0.8294, test_f1: 0.6823
 epoch: 54, train_loss: 0.6268, test_loss: 0.8606, test_f1: 0.6392
 epoch: 55, train_loss: 0.6122, test_loss: 0.7998, test_f1: 0.6600
 epoch: 56, train_loss: 0.6249, test_loss: 0.8172, test_f1: 0.6567
 epoch: 57, train_loss: 0.6288, test_loss: 0.8641, test_f1: 0.6381
 epoch: 58, train_loss: 0.6142, test_loss: 0.7685, test_f1: 0.6698
 epoch: 59, train_loss: 0.5871, test_loss: 0.8535, test_f1: 0.6541
 epoch: 60, train_loss: 0.6091, test_loss: 0.9101, test_f1: 0.6604
 epoch: 61, train_loss: 0.6026, test_loss: 0.8040, test_f1: 0.6557
 epoch: 62, train_loss: 0.5868, test_loss: 0.8213, test_f1: 0.6413
 epoch: 63, train_loss: 0.5995, test_loss: 0.7784, test_f1: 0.6579
 epoch: 64, train_loss: 0.5969, test_loss: 0.7548, test_f1: 0.6771
 epoch: 65, train_loss: 0.6044, test_loss: 0.8327, test_f1: 0.6454
 epoch: 66, train_loss: 0.5940, test_loss: 0.8686, test_f1: 0.6376
 epoch: 67, train_loss: 0.5993, test_loss: 0.8347, test_f1: 0.6611
 epoch: 68, train_loss: 0.6007, test_loss: 0.8129, test_f1: 0.6652
 epoch: 69, train_loss: 0.5993, test_loss: 0.8818, test_f1: 0.6438
 epoch: 70, train_loss: 0.5934, test_loss: 0.8852, test_f1: 0.6266
 epoch: 71, train_loss: 0.5823, test_loss: 0.8120, test_f1: 0.6584
 epoch: 72, train_loss: 0.5719, test_loss: 0.8176, test_f1: 0.6629
 epoch: 73, train_loss: 0.5866, test_loss: 0.8773, test_f1: 0.6399
 epoch: 74, train_loss: 0.5849, test_loss: 0.8157, test_f1: 0.6550
 epoch: 75, train_loss: 0.5758, test_loss: 0.8896, test_f1: 0.6414
 epoch: 76, train_loss: 0.5788, test_loss: 0.8137, test_f1: 0.6316
 epoch: 77, train_loss: 0.5769, test_loss: 0.8270, test_f1: 0.6349
 epoch: 78, train_loss: 0.5658, test_loss: 0.8468, test_f1: 0.6699
 epoch: 79, train_loss: 0.5687, test_loss: 0.8432, test_f1: 0.6665
 epoch: 80, train_loss: 0.5597, test_loss: 0.8452, test_f1: 0.6555
 epoch: 81, train_loss: 0.5625, test_loss: 0.8311, test_f1: 0.6487
 epoch: 82, train_loss: 0.5810, test_loss: 0.8928, test_f1: 0.6579
 epoch: 83, train_loss: 0.5737, test_loss: 0.8549, test_f1: 0.6320
 epoch: 84, train_loss: 0.5651, test_loss: 0.8439, test_f1: 0.6837
 epoch: 85, train_loss: 0.5547, test_loss: 0.8109, test_f1: 0.6588
 epoch: 86, train_loss: 0.5674, test_loss: 0.8389, test_f1: 0.6585
 epoch: 87, train_loss: 0.5751, test_loss: 0.8815, test_f1: 0.6411
 epoch: 88, train_loss: 0.5536, test_loss: 0.8280, test_f1: 0.6596
 epoch: 89, train_loss: 0.5593, test_loss: 0.8308, test_f1: 0.6368
 epoch: 90, train_loss: 0.5324, test_loss: 0.9020, test_f1: 0.6402
 epoch: 91, train_loss: 0.5004, test_loss: 0.9806, test_f1: 0.6450
 epoch: 92, train_loss: 0.5353, test_loss: 0.8681, test_f1: 0.6697
 epoch: 93, train_loss: 0.5361, test_loss: 0.9173, test_f1: 0.6679
 epoch: 94, train_loss: 0.5531, test_loss: 0.9633, test_f1: 0.6682
 epoch: 95, train_loss: 0.5387, test_loss: 0.9602, test_f1: 0.6514
 epoch: 96, train_loss: 0.5279, test_loss: 0.9124, test_f1: 0.6831
 epoch: 97, train_loss: 0.5592, test_loss: 0.8218, test_f1: 0.6777
 epoch: 98, train_loss: 0.5620, test_loss: 0.9849, test_f1: 0.6325
 epoch: 99, train_loss: 0.5386, test_loss: 0.9813, test_f1: 0.6644
##################ITERATION #9 ****************************************
 epoch: 0, train_loss: 1.2285, test_loss: 1.2684, test_f1: 0.2755
 epoch: 1, train_loss: 1.0143, test_loss: 0.9674, test_f1: 0.4913
 epoch: 2, train_loss: 0.9815, test_loss: 1.0232, test_f1: 0.4662
 epoch: 3, train_loss: 0.9657, test_loss: 1.0079, test_f1: 0.5142
 epoch: 4, train_loss: 0.9434, test_loss: 0.9807, test_f1: 0.4971
 epoch: 5, train_loss: 0.9359, test_loss: 0.9798, test_f1: 0.5018
 epoch: 6, train_loss: 0.9192, test_loss: 1.0048, test_f1: 0.4900
 epoch: 7, train_loss: 0.9067, test_loss: 0.9864, test_f1: 0.5019
 epoch: 8, train_loss: 0.8946, test_loss: 1.0031, test_f1: 0.4938
 epoch: 9, train_loss: 0.8957, test_loss: 0.9896, test_f1: 0.5154
 epoch: 10, train_loss: 0.8833, test_loss: 0.9969, test_f1: 0.5291
 epoch: 11, train_loss: 0.8786, test_loss: 0.9541, test_f1: 0.5723
 epoch: 12, train_loss: 0.8656, test_loss: 1.0391, test_f1: 0.4975
 epoch: 13, train_loss: 0.8700, test_loss: 1.0167, test_f1: 0.5325
 epoch: 14, train_loss: 0.8605, test_loss: 1.0183, test_f1: 0.5261
 epoch: 15, train_loss: 0.8610, test_loss: 0.8945, test_f1: 0.5572
 epoch: 16, train_loss: 0.8552, test_loss: 0.9509, test_f1: 0.5595
 epoch: 17, train_loss: 0.8405, test_loss: 0.9423, test_f1: 0.5691
 epoch: 18, train_loss: 0.8412, test_loss: 0.9670, test_f1: 0.5352
 epoch: 19, train_loss: 0.8597, test_loss: 0.9513, test_f1: 0.5939
 epoch: 20, train_loss: 0.8507, test_loss: 0.9167, test_f1: 0.5352
 epoch: 21, train_loss: 0.8416, test_loss: 0.9417, test_f1: 0.5625
 epoch: 22, train_loss: 0.8150, test_loss: 0.9512, test_f1: 0.5498
 epoch: 23, train_loss: 0.8111, test_loss: 0.9193, test_f1: 0.5862
 epoch: 24, train_loss: 0.8008, test_loss: 0.8979, test_f1: 0.5780
 epoch: 25, train_loss: 0.7927, test_loss: 1.0809, test_f1: 0.4868
 epoch: 26, train_loss: 0.7938, test_loss: 0.9549, test_f1: 0.5540
 epoch: 27, train_loss: 0.7866, test_loss: 0.9572, test_f1: 0.6237
 epoch: 28, train_loss: 0.7674, test_loss: 0.8419, test_f1: 0.5911
 epoch: 29, train_loss: 0.7896, test_loss: 0.8704, test_f1: 0.5467
 epoch: 30, train_loss: 0.7717, test_loss: 0.8956, test_f1: 0.5654
 epoch: 31, train_loss: 0.7689, test_loss: 0.9338, test_f1: 0.5909
 epoch: 32, train_loss: 0.7504, test_loss: 1.0609, test_f1: 0.5770
 epoch: 33, train_loss: 0.7656, test_loss: 0.8922, test_f1: 0.5682
 epoch: 34, train_loss: 0.7733, test_loss: 0.8982, test_f1: 0.6071
 epoch: 35, train_loss: 0.7668, test_loss: 0.9260, test_f1: 0.5914
 epoch: 36, train_loss: 0.7369, test_loss: 0.8470, test_f1: 0.5943
 epoch: 37, train_loss: 0.7448, test_loss: 0.9542, test_f1: 0.5741
 epoch: 38, train_loss: 0.7502, test_loss: 0.9047, test_f1: 0.5649
 epoch: 39, train_loss: 0.7380, test_loss: 0.8754, test_f1: 0.5963
 epoch: 40, train_loss: 0.7175, test_loss: 0.9299, test_f1: 0.5206
 epoch: 41, train_loss: 0.7227, test_loss: 0.9155, test_f1: 0.6013
 epoch: 42, train_loss: 0.7202, test_loss: 0.8746, test_f1: 0.6055
 epoch: 43, train_loss: 0.7247, test_loss: 0.9172, test_f1: 0.5962
 epoch: 44, train_loss: 0.7212, test_loss: 0.8581, test_f1: 0.6047
 epoch: 45, train_loss: 0.7202, test_loss: 0.8362, test_f1: 0.5748
 epoch: 46, train_loss: 0.7245, test_loss: 1.0370, test_f1: 0.5643
 epoch: 47, train_loss: 0.7571, test_loss: 0.8757, test_f1: 0.5995
 epoch: 48, train_loss: 0.7254, test_loss: 0.8979, test_f1: 0.5790
 epoch: 49, train_loss: 0.7207, test_loss: 0.8234, test_f1: 0.6074
 epoch: 50, train_loss: 0.7128, test_loss: 0.8895, test_f1: 0.5728
 epoch: 51, train_loss: 0.6921, test_loss: 0.8625, test_f1: 0.6239
 epoch: 52, train_loss: 0.6806, test_loss: 0.8781, test_f1: 0.6113
 epoch: 53, train_loss: 0.6598, test_loss: 0.8605, test_f1: 0.6107
 epoch: 54, train_loss: 0.6554, test_loss: 0.8571, test_f1: 0.6241
 epoch: 55, train_loss: 0.6538, test_loss: 0.8931, test_f1: 0.6226
 epoch: 56, train_loss: 0.6476, test_loss: 0.8838, test_f1: 0.6352
 epoch: 57, train_loss: 0.6529, test_loss: 0.9287, test_f1: 0.5972
 epoch: 58, train_loss: 0.6280, test_loss: 0.8891, test_f1: 0.5973
 epoch: 59, train_loss: 0.6269, test_loss: 0.8917, test_f1: 0.6266
 epoch: 60, train_loss: 0.6303, test_loss: 0.8756, test_f1: 0.6449
 epoch: 61, train_loss: 0.6204, test_loss: 0.8682, test_f1: 0.6115
 epoch: 62, train_loss: 0.6220, test_loss: 0.9026, test_f1: 0.6212
 epoch: 63, train_loss: 0.6186, test_loss: 0.8733, test_f1: 0.6339
 epoch: 64, train_loss: 0.6161, test_loss: 0.8538, test_f1: 0.6576
 epoch: 65, train_loss: 0.6045, test_loss: 0.9214, test_f1: 0.6235
 epoch: 66, train_loss: 0.6202, test_loss: 0.8801, test_f1: 0.6061
 epoch: 67, train_loss: 0.6204, test_loss: 0.8895, test_f1: 0.6189
 epoch: 68, train_loss: 0.6085, test_loss: 1.0386, test_f1: 0.5945
 epoch: 69, train_loss: 0.6065, test_loss: 0.8999, test_f1: 0.5841
 epoch: 70, train_loss: 0.6143, test_loss: 0.9047, test_f1: 0.6223
 epoch: 71, train_loss: 0.6110, test_loss: 0.9074, test_f1: 0.6284
 epoch: 72, train_loss: 0.6090, test_loss: 0.9046, test_f1: 0.6254
 epoch: 73, train_loss: 0.5982, test_loss: 0.8628, test_f1: 0.6411
 epoch: 74, train_loss: 0.6037, test_loss: 0.9599, test_f1: 0.6360
 epoch: 75, train_loss: 0.6138, test_loss: 0.8294, test_f1: 0.6359
 epoch: 76, train_loss: 0.5799, test_loss: 0.9177, test_f1: 0.6404
 epoch: 77, train_loss: 0.5825, test_loss: 0.9217, test_f1: 0.6605
 epoch: 78, train_loss: 0.5907, test_loss: 0.9775, test_f1: 0.6305
 epoch: 79, train_loss: 0.5888, test_loss: 0.9299, test_f1: 0.6316
 epoch: 80, train_loss: 0.5854, test_loss: 0.9196, test_f1: 0.6392
 epoch: 81, train_loss: 0.5908, test_loss: 1.0364, test_f1: 0.5950
 epoch: 82, train_loss: 0.5827, test_loss: 0.8704, test_f1: 0.6540
 epoch: 83, train_loss: 0.5938, test_loss: 0.8764, test_f1: 0.6590
 epoch: 84, train_loss: 0.6004, test_loss: 0.9437, test_f1: 0.6321
 epoch: 85, train_loss: 0.5737, test_loss: 0.9080, test_f1: 0.6387
 epoch: 86, train_loss: 0.5753, test_loss: 0.8922, test_f1: 0.6283
 epoch: 87, train_loss: 0.5688, test_loss: 0.8783, test_f1: 0.6209
 epoch: 88, train_loss: 0.5846, test_loss: 0.8674, test_f1: 0.6515
 epoch: 89, train_loss: 0.5691, test_loss: 0.8844, test_f1: 0.6577
 epoch: 90, train_loss: 0.5670, test_loss: 0.8781, test_f1: 0.6465
 epoch: 91, train_loss: 0.5702, test_loss: 0.9873, test_f1: 0.6288
 epoch: 92, train_loss: 0.5559, test_loss: 0.9516, test_f1: 0.6617
 epoch: 93, train_loss: 0.5531, test_loss: 0.9561, test_f1: 0.6334
 epoch: 94, train_loss: 0.5460, test_loss: 0.9574, test_f1: 0.6601
 epoch: 95, train_loss: 0.5599, test_loss: 0.9993, test_f1: 0.6285
 epoch: 96, train_loss: 0.5696, test_loss: 0.8434, test_f1: 0.6728
 epoch: 97, train_loss: 0.5764, test_loss: 0.8715, test_f1: 0.6659
 epoch: 98, train_loss: 0.5449, test_loss: 0.9063, test_f1: 0.6681
 epoch: 99, train_loss: 0.5463, test_loss: 0.9505, test_f1: 0.6662

Training completed in 497.87 seconds
Best F1: 0.6919 at epoch 96
Mean F1 across iterations: 0.6731  0.0120
========================FINAL RESULTS================================
FEGIN weighted F1: 0.6919  0.0120
python main.py --data ltspice_examples --representation component_net --model FEGIN --layers 4 --hiddens 32 --batch_size 128 --lr 0.01 --emb_size 250 --epochs 100 --save_appendix component_net_L4_H32_BS128_LR0.01_E250 --no_val
-----



STDERR:
  File "main.py", line 370, in <module>
    main()
  File "main.py", line 254, in main
    dataset = dataset_class(
  File "/home/philip/projects/ltspice_examples_code_repo/Circuit-Completion-Using-GNNs/component_classification_with_link_prediction_head/evaluation/FEGIN/kernel/circuit_datasets.py", line 15, in __init__
    self.data, self.slices = torch.load(self.processed_paths[0])
  File "/home/philip/.local/lib/python3.8/site-packages/torch/serialization.py", line 1040, in load
    warnings.warn(
  File "/usr/lib/python3.8/warnings.py", line 109, in _showwarnmsg
    sw(msg.message, msg.category, msg.filename, msg.lineno,
  File "main.py", line 47, in warn_with_traceback
    traceback.print_stack(file=log)
/home/philip/projects/ltspice_examples_code_repo/Circuit-Completion-Using-GNNs/component_classification_with_link_prediction_head/evaluation/FEGIN/kernel/circuit_datasets.py:15: FutureWarning: You are using `torch.load` with `weights_only=False` (the current default value), which uses the default pickle module implicitly. It is possible to construct malicious pickle data which will execute arbitrary code during unpickling (See https://github.com/pytorch/pytorch/blob/main/SECURITY.md#untrusted-models for more details). In a future release, the default value for `weights_only` will be flipped to `True`. This limits the functions that could be executed during unpickling. Arbitrary objects will no longer be allowed to be loaded via this mode unless they are explicitly allowlisted by the user via `torch.serialization.add_safe_globals`. We recommend you start setting `weights_only=True` for any use case where you don't have full control of the loaded file. Please open an issue on GitHub for any issues related to this experimental feature.
  self.data, self.slices = torch.load(self.processed_paths[0])
