STDOUT:
Results will be saved in /home/philip/projects/ltspice_examples_code_repo/Circuit-Completion-Using-GNNs/component_classification_with_link_prediction_head/evaluation/FEGIN/results/model_FEGIN_dataset_ltspice_examples
Command line input: python main.py --data ltspice_examples --representation component_pin_net --model FEGIN --layers 5 --hiddens 128 --batch_size 256 --lr 0.01 --emb_size 512 --epochs 100 --save_appendix component_pin_net_L5_H128_BS256_LR0.01_E512 --no_val
 is saved.
-----
ltspice_examples - FEGIN
Using 5 layers, 128 hidden units, h = 2
Loading component_pin_net representation dataset
ENTERED
Training FEGIN on component_pin_net representation
Train: 3558, Test: 846
##################ITERATION #0 ****************************************
 epoch: 0, train_loss: 1.1712, test_loss: 1.1537, test_f1: 0.3234
 epoch: 1, train_loss: 1.0124, test_loss: 1.0460, test_f1: 0.4250
 epoch: 2, train_loss: 0.9660, test_loss: 1.0246, test_f1: 0.4441
 epoch: 3, train_loss: 0.9298, test_loss: 0.9505, test_f1: 0.4593
 epoch: 4, train_loss: 0.9234, test_loss: 1.0134, test_f1: 0.5087
 epoch: 5, train_loss: 0.8972, test_loss: 0.8834, test_f1: 0.5221
 epoch: 6, train_loss: 0.8774, test_loss: 0.9332, test_f1: 0.5218
 epoch: 7, train_loss: 0.8436, test_loss: 0.8379, test_f1: 0.5177
 epoch: 8, train_loss: 0.8289, test_loss: 1.0415, test_f1: 0.5113
 epoch: 9, train_loss: 0.8178, test_loss: 0.9627, test_f1: 0.5058
 epoch: 10, train_loss: 0.7810, test_loss: 0.9579, test_f1: 0.5095
 epoch: 11, train_loss: 0.7611, test_loss: 0.9070, test_f1: 0.5560
 epoch: 12, train_loss: 0.7370, test_loss: 0.7792, test_f1: 0.6326
 epoch: 13, train_loss: 0.7204, test_loss: 0.7664, test_f1: 0.6235
 epoch: 14, train_loss: 0.7188, test_loss: 0.9556, test_f1: 0.5693
 epoch: 15, train_loss: 0.7110, test_loss: 0.9133, test_f1: 0.5791
 epoch: 16, train_loss: 0.6938, test_loss: 0.8136, test_f1: 0.6370
 epoch: 17, train_loss: 0.6956, test_loss: 0.9012, test_f1: 0.5654
 epoch: 18, train_loss: 0.6624, test_loss: 1.1906, test_f1: 0.5408
 epoch: 19, train_loss: 0.6371, test_loss: 0.8560, test_f1: 0.6246
 epoch: 20, train_loss: 0.6473, test_loss: 0.9534, test_f1: 0.5752
 epoch: 21, train_loss: 0.6197, test_loss: 0.9344, test_f1: 0.6064
 epoch: 22, train_loss: 0.6010, test_loss: 0.7778, test_f1: 0.6157
 epoch: 23, train_loss: 0.6016, test_loss: 0.8996, test_f1: 0.5693
 epoch: 24, train_loss: 0.6158, test_loss: 0.8053, test_f1: 0.6221
 epoch: 25, train_loss: 0.5833, test_loss: 0.8867, test_f1: 0.5712
 epoch: 26, train_loss: 0.5699, test_loss: 0.8213, test_f1: 0.6481
 epoch: 27, train_loss: 0.5786, test_loss: 0.8443, test_f1: 0.6172
 epoch: 28, train_loss: 0.5759, test_loss: 0.8165, test_f1: 0.6323
 epoch: 29, train_loss: 0.5582, test_loss: 0.9099, test_f1: 0.6252
 epoch: 30, train_loss: 0.5489, test_loss: 1.1478, test_f1: 0.5792
 epoch: 31, train_loss: 0.5167, test_loss: 0.8886, test_f1: 0.6444
 epoch: 32, train_loss: 0.5222, test_loss: 0.7557, test_f1: 0.6581
 epoch: 33, train_loss: 0.5519, test_loss: 0.7313, test_f1: 0.6643
 epoch: 34, train_loss: 0.5121, test_loss: 0.9202, test_f1: 0.5821
 epoch: 35, train_loss: 0.4802, test_loss: 0.8594, test_f1: 0.6266
 epoch: 36, train_loss: 0.4672, test_loss: 0.9459, test_f1: 0.6256
 epoch: 37, train_loss: 0.4711, test_loss: 0.9215, test_f1: 0.6121
 epoch: 38, train_loss: 0.4919, test_loss: 0.8349, test_f1: 0.6565
 epoch: 39, train_loss: 0.4601, test_loss: 0.9215, test_f1: 0.6333
 epoch: 40, train_loss: 0.4430, test_loss: 1.2764, test_f1: 0.6182
 epoch: 41, train_loss: 0.4384, test_loss: 0.8619, test_f1: 0.6843
 epoch: 42, train_loss: 0.4338, test_loss: 0.9180, test_f1: 0.6721
 epoch: 43, train_loss: 0.4319, test_loss: 1.1607, test_f1: 0.5934
 epoch: 44, train_loss: 0.4147, test_loss: 1.1775, test_f1: 0.6261
 epoch: 45, train_loss: 0.4268, test_loss: 0.7994, test_f1: 0.6655
 epoch: 46, train_loss: 0.4143, test_loss: 1.0781, test_f1: 0.6083
 epoch: 47, train_loss: 0.3906, test_loss: 0.9466, test_f1: 0.6719
 epoch: 48, train_loss: 0.4414, test_loss: 0.8783, test_f1: 0.6626
 epoch: 49, train_loss: 0.3971, test_loss: 1.2385, test_f1: 0.6089
 epoch: 50, train_loss: 0.3942, test_loss: 0.9142, test_f1: 0.6744
 epoch: 51, train_loss: 0.3524, test_loss: 0.9775, test_f1: 0.6430
 epoch: 52, train_loss: 0.3353, test_loss: 0.9251, test_f1: 0.6721
 epoch: 53, train_loss: 0.3070, test_loss: 0.8735, test_f1: 0.6971
 epoch: 54, train_loss: 0.2830, test_loss: 0.9840, test_f1: 0.6870
 epoch: 55, train_loss: 0.2820, test_loss: 1.0180, test_f1: 0.6760
 epoch: 56, train_loss: 0.2776, test_loss: 1.0096, test_f1: 0.6674
 epoch: 57, train_loss: 0.2742, test_loss: 1.2049, test_f1: 0.6357
 epoch: 58, train_loss: 0.2826, test_loss: 1.1530, test_f1: 0.6759
 epoch: 59, train_loss: 0.2691, test_loss: 1.1652, test_f1: 0.6448
 epoch: 60, train_loss: 0.2534, test_loss: 0.9540, test_f1: 0.6829
 epoch: 61, train_loss: 0.2439, test_loss: 1.1609, test_f1: 0.6579
 epoch: 62, train_loss: 0.2443, test_loss: 1.0727, test_f1: 0.6769
 epoch: 63, train_loss: 0.2310, test_loss: 1.2788, test_f1: 0.6783
 epoch: 64, train_loss: 0.2339, test_loss: 1.0105, test_f1: 0.6988
 epoch: 65, train_loss: 0.2332, test_loss: 1.2865, test_f1: 0.6540
 epoch: 66, train_loss: 0.2146, test_loss: 1.1431, test_f1: 0.6748
 epoch: 67, train_loss: 0.2341, test_loss: 1.2020, test_f1: 0.6822
 epoch: 68, train_loss: 0.2218, test_loss: 1.2994, test_f1: 0.6361
 epoch: 69, train_loss: 0.2143, test_loss: 1.4976, test_f1: 0.6498
 epoch: 70, train_loss: 0.2205, test_loss: 1.3720, test_f1: 0.6753
 epoch: 71, train_loss: 0.2487, test_loss: 1.2687, test_f1: 0.6545
 epoch: 72, train_loss: 0.2430, test_loss: 1.3694, test_f1: 0.6762
 epoch: 73, train_loss: 0.2177, test_loss: 1.5047, test_f1: 0.6286
 epoch: 74, train_loss: 0.1953, test_loss: 1.3747, test_f1: 0.6814
 epoch: 75, train_loss: 0.1757, test_loss: 1.3447, test_f1: 0.6549
 epoch: 76, train_loss: 0.2136, test_loss: 1.2352, test_f1: 0.6655
 epoch: 77, train_loss: 0.2083, test_loss: 1.2832, test_f1: 0.6848
 epoch: 78, train_loss: 0.1986, test_loss: 1.2884, test_f1: 0.6723
 epoch: 79, train_loss: 0.1811, test_loss: 1.3013, test_f1: 0.6718
 epoch: 80, train_loss: 0.1790, test_loss: 1.4027, test_f1: 0.6742
 epoch: 81, train_loss: 0.1875, test_loss: 1.3690, test_f1: 0.6711
 epoch: 82, train_loss: 0.1993, test_loss: 1.1920, test_f1: 0.6671
 epoch: 83, train_loss: 0.1822, test_loss: 1.3975, test_f1: 0.6597
 epoch: 84, train_loss: 0.1869, test_loss: 1.4256, test_f1: 0.6467
 epoch: 85, train_loss: 0.1980, test_loss: 1.5096, test_f1: 0.6287
 epoch: 86, train_loss: 0.2008, test_loss: 1.3212, test_f1: 0.6542
 epoch: 87, train_loss: 0.2048, test_loss: 1.3302, test_f1: 0.6624
 epoch: 88, train_loss: 0.1952, test_loss: 1.3089, test_f1: 0.6458
 epoch: 89, train_loss: 0.1830, test_loss: 1.3660, test_f1: 0.6818
 epoch: 90, train_loss: 0.1610, test_loss: 1.4336, test_f1: 0.6727
 epoch: 91, train_loss: 0.1773, test_loss: 1.3846, test_f1: 0.6834
 epoch: 92, train_loss: 0.1863, test_loss: 1.3769, test_f1: 0.6497
 epoch: 93, train_loss: 0.1695, test_loss: 1.4697, test_f1: 0.6582
 epoch: 94, train_loss: 0.1600, test_loss: 1.3376, test_f1: 0.6812
 epoch: 95, train_loss: 0.1563, test_loss: 1.4446, test_f1: 0.6325
 epoch: 96, train_loss: 0.1497, test_loss: 1.5378, test_f1: 0.6704
 epoch: 97, train_loss: 0.1618, test_loss: 1.7840, test_f1: 0.6786
 epoch: 98, train_loss: 0.1655, test_loss: 1.4508, test_f1: 0.6698
 epoch: 99, train_loss: 0.1729, test_loss: 1.5586, test_f1: 0.6520
##################ITERATION #1 ****************************************
 epoch: 0, train_loss: 1.4002, test_loss: 1.8815, test_f1: 0.2303
 epoch: 1, train_loss: 1.0162, test_loss: 1.0505, test_f1: 0.3599
 epoch: 2, train_loss: 0.9641, test_loss: 1.0642, test_f1: 0.4966
 epoch: 3, train_loss: 0.9588, test_loss: 1.0226, test_f1: 0.4912
 epoch: 4, train_loss: 0.9250, test_loss: 1.0104, test_f1: 0.5137
 epoch: 5, train_loss: 0.9175, test_loss: 1.0065, test_f1: 0.5171
 epoch: 6, train_loss: 0.8858, test_loss: 0.9968, test_f1: 0.5341
 epoch: 7, train_loss: 0.8623, test_loss: 1.1604, test_f1: 0.4510
 epoch: 8, train_loss: 0.8568, test_loss: 0.9546, test_f1: 0.5258
 epoch: 9, train_loss: 0.8509, test_loss: 1.0202, test_f1: 0.5011
 epoch: 10, train_loss: 0.8264, test_loss: 0.9522, test_f1: 0.5232
 epoch: 11, train_loss: 0.8230, test_loss: 0.9274, test_f1: 0.5420
 epoch: 12, train_loss: 0.8159, test_loss: 1.3770, test_f1: 0.4010
 epoch: 13, train_loss: 0.8073, test_loss: 0.9800, test_f1: 0.5119
 epoch: 14, train_loss: 0.7775, test_loss: 1.0461, test_f1: 0.5667
 epoch: 15, train_loss: 0.7684, test_loss: 0.9259, test_f1: 0.5813
 epoch: 16, train_loss: 0.7651, test_loss: 1.0271, test_f1: 0.5439
 epoch: 17, train_loss: 0.7411, test_loss: 1.0601, test_f1: 0.5729
 epoch: 18, train_loss: 0.7246, test_loss: 0.9517, test_f1: 0.5623
 epoch: 19, train_loss: 0.7132, test_loss: 1.0352, test_f1: 0.5836
 epoch: 20, train_loss: 0.7163, test_loss: 1.0281, test_f1: 0.6127
 epoch: 21, train_loss: 0.7188, test_loss: 0.8616, test_f1: 0.6094
 epoch: 22, train_loss: 0.6879, test_loss: 0.9142, test_f1: 0.5702
 epoch: 23, train_loss: 0.6918, test_loss: 0.9478, test_f1: 0.6130
 epoch: 24, train_loss: 0.6836, test_loss: 0.8978, test_f1: 0.5759
 epoch: 25, train_loss: 0.6889, test_loss: 1.1282, test_f1: 0.5401
 epoch: 26, train_loss: 0.6761, test_loss: 1.0572, test_f1: 0.5850
 epoch: 27, train_loss: 0.6702, test_loss: 0.9576, test_f1: 0.6177
 epoch: 28, train_loss: 0.6608, test_loss: 0.8710, test_f1: 0.6330
 epoch: 29, train_loss: 0.6495, test_loss: 0.9044, test_f1: 0.6283
 epoch: 30, train_loss: 0.6472, test_loss: 1.0328, test_f1: 0.6001
 epoch: 31, train_loss: 0.6092, test_loss: 0.9722, test_f1: 0.6127
 epoch: 32, train_loss: 0.6125, test_loss: 1.0970, test_f1: 0.6292
 epoch: 33, train_loss: 0.6175, test_loss: 1.2497, test_f1: 0.5658
 epoch: 34, train_loss: 0.5956, test_loss: 1.0038, test_f1: 0.6405
 epoch: 35, train_loss: 0.5936, test_loss: 1.0366, test_f1: 0.6517
 epoch: 36, train_loss: 0.6008, test_loss: 0.9379, test_f1: 0.5977
 epoch: 37, train_loss: 0.5817, test_loss: 1.0309, test_f1: 0.6288
 epoch: 38, train_loss: 0.5641, test_loss: 0.9947, test_f1: 0.6497
 epoch: 39, train_loss: 0.5724, test_loss: 0.9085, test_f1: 0.6394
 epoch: 40, train_loss: 0.5724, test_loss: 0.9916, test_f1: 0.6292
 epoch: 41, train_loss: 0.5538, test_loss: 1.0261, test_f1: 0.6486
 epoch: 42, train_loss: 0.5399, test_loss: 1.1488, test_f1: 0.6337
 epoch: 43, train_loss: 0.5609, test_loss: 1.0553, test_f1: 0.6287
 epoch: 44, train_loss: 0.5589, test_loss: 1.0733, test_f1: 0.6172
 epoch: 45, train_loss: 0.5258, test_loss: 1.0391, test_f1: 0.6399
 epoch: 46, train_loss: 0.5053, test_loss: 1.0214, test_f1: 0.6591
 epoch: 47, train_loss: 0.5181, test_loss: 1.1264, test_f1: 0.6097
 epoch: 48, train_loss: 0.5280, test_loss: 1.3879, test_f1: 0.6132
 epoch: 49, train_loss: 0.5234, test_loss: 1.0293, test_f1: 0.6514
 epoch: 50, train_loss: 0.5134, test_loss: 1.1878, test_f1: 0.6444
 epoch: 51, train_loss: 0.4672, test_loss: 0.9521, test_f1: 0.6468
 epoch: 52, train_loss: 0.4439, test_loss: 1.0242, test_f1: 0.6553
 epoch: 53, train_loss: 0.4210, test_loss: 1.1755, test_f1: 0.6440
 epoch: 54, train_loss: 0.4096, test_loss: 1.1290, test_f1: 0.6471
 epoch: 55, train_loss: 0.3995, test_loss: 1.1078, test_f1: 0.6476
 epoch: 56, train_loss: 0.4054, test_loss: 1.2610, test_f1: 0.6429
 epoch: 57, train_loss: 0.3731, test_loss: 1.2306, test_f1: 0.6606
 epoch: 58, train_loss: 0.3782, test_loss: 1.1458, test_f1: 0.6537
 epoch: 59, train_loss: 0.3817, test_loss: 1.2470, test_f1: 0.6565
 epoch: 60, train_loss: 0.3506, test_loss: 1.2636, test_f1: 0.6589
 epoch: 61, train_loss: 0.3696, test_loss: 1.3564, test_f1: 0.6397
 epoch: 62, train_loss: 0.3450, test_loss: 1.2685, test_f1: 0.6646
 epoch: 63, train_loss: 0.3303, test_loss: 1.3616, test_f1: 0.6584
 epoch: 64, train_loss: 0.3470, test_loss: 1.1123, test_f1: 0.6791
 epoch: 65, train_loss: 0.3315, test_loss: 1.3258, test_f1: 0.6298
 epoch: 66, train_loss: 0.3447, test_loss: 1.3252, test_f1: 0.6897
 epoch: 67, train_loss: 0.3304, test_loss: 1.4275, test_f1: 0.6405
 epoch: 68, train_loss: 0.3665, test_loss: 1.3070, test_f1: 0.6531
 epoch: 69, train_loss: 0.3465, test_loss: 1.2383, test_f1: 0.6702
 epoch: 70, train_loss: 0.3472, test_loss: 1.2324, test_f1: 0.6606
 epoch: 71, train_loss: 0.3153, test_loss: 1.2342, test_f1: 0.6452
 epoch: 72, train_loss: 0.3127, test_loss: 1.4545, test_f1: 0.6659
 epoch: 73, train_loss: 0.3231, test_loss: 1.3211, test_f1: 0.6482
 epoch: 74, train_loss: 0.3252, test_loss: 1.1776, test_f1: 0.6691
 epoch: 75, train_loss: 0.3051, test_loss: 1.2708, test_f1: 0.6691
 epoch: 76, train_loss: 0.3024, test_loss: 1.3893, test_f1: 0.6713
 epoch: 77, train_loss: 0.3009, test_loss: 1.3257, test_f1: 0.6355
 epoch: 78, train_loss: 0.3045, test_loss: 1.3863, test_f1: 0.6695
 epoch: 79, train_loss: 0.2885, test_loss: 1.4829, test_f1: 0.6494
 epoch: 80, train_loss: 0.2846, test_loss: 1.5193, test_f1: 0.6367
 epoch: 81, train_loss: 0.2968, test_loss: 1.2561, test_f1: 0.6734
 epoch: 82, train_loss: 0.2732, test_loss: 1.4810, test_f1: 0.6718
 epoch: 83, train_loss: 0.2775, test_loss: 1.4618, test_f1: 0.6472
 epoch: 84, train_loss: 0.2861, test_loss: 1.4562, test_f1: 0.6856
 epoch: 85, train_loss: 0.2873, test_loss: 1.3806, test_f1: 0.6752
 epoch: 86, train_loss: 0.2844, test_loss: 1.4951, test_f1: 0.6458
 epoch: 87, train_loss: 0.2753, test_loss: 1.4855, test_f1: 0.6669
 epoch: 88, train_loss: 0.2870, test_loss: 1.2626, test_f1: 0.6835
 epoch: 89, train_loss: 0.2962, test_loss: 1.5545, test_f1: 0.6461
 epoch: 90, train_loss: 0.2810, test_loss: 1.5018, test_f1: 0.6767
 epoch: 91, train_loss: 0.2666, test_loss: 1.4251, test_f1: 0.6873
 epoch: 92, train_loss: 0.2789, test_loss: 1.3898, test_f1: 0.6743
 epoch: 93, train_loss: 0.2671, test_loss: 1.3855, test_f1: 0.6737
 epoch: 94, train_loss: 0.2543, test_loss: 1.6917, test_f1: 0.6622
 epoch: 95, train_loss: 0.2708, test_loss: 1.5325, test_f1: 0.6693
 epoch: 96, train_loss: 0.2575, test_loss: 1.3609, test_f1: 0.6741
 epoch: 97, train_loss: 0.2395, test_loss: 1.4679, test_f1: 0.6240
 epoch: 98, train_loss: 0.2712, test_loss: 1.4892, test_f1: 0.6647
 epoch: 99, train_loss: 0.2555, test_loss: 1.6139, test_f1: 0.6757
##################ITERATION #2 ****************************************
 epoch: 0, train_loss: 1.3475, test_loss: 1.5571, test_f1: 0.2579
 epoch: 1, train_loss: 1.0212, test_loss: 1.1768, test_f1: 0.3477
 epoch: 2, train_loss: 0.9591, test_loss: 1.0407, test_f1: 0.4956
 epoch: 3, train_loss: 0.9337, test_loss: 1.0044, test_f1: 0.4933
 epoch: 4, train_loss: 0.9081, test_loss: 1.0220, test_f1: 0.5459
 epoch: 5, train_loss: 0.8877, test_loss: 1.1503, test_f1: 0.5404
 epoch: 6, train_loss: 0.8870, test_loss: 1.0757, test_f1: 0.5238
 epoch: 7, train_loss: 0.8710, test_loss: 0.9857, test_f1: 0.5892
 epoch: 8, train_loss: 0.8576, test_loss: 1.0311, test_f1: 0.5319
 epoch: 9, train_loss: 0.8295, test_loss: 1.0733, test_f1: 0.5918
 epoch: 10, train_loss: 0.8349, test_loss: 1.1483, test_f1: 0.5335
 epoch: 11, train_loss: 0.8214, test_loss: 1.0000, test_f1: 0.5302
 epoch: 12, train_loss: 0.8210, test_loss: 1.2042, test_f1: 0.5521
 epoch: 13, train_loss: 0.8153, test_loss: 0.9153, test_f1: 0.5690
 epoch: 14, train_loss: 0.7820, test_loss: 1.0395, test_f1: 0.5752
 epoch: 15, train_loss: 0.7604, test_loss: 1.0271, test_f1: 0.5957
 epoch: 16, train_loss: 0.7615, test_loss: 1.0377, test_f1: 0.5603
 epoch: 17, train_loss: 0.7232, test_loss: 1.1633, test_f1: 0.5618
 epoch: 18, train_loss: 0.7121, test_loss: 1.2229, test_f1: 0.5343
 epoch: 19, train_loss: 0.7179, test_loss: 1.1034, test_f1: 0.5893
 epoch: 20, train_loss: 0.7025, test_loss: 1.0339, test_f1: 0.5525
 epoch: 21, train_loss: 0.6809, test_loss: 1.0424, test_f1: 0.5375
 epoch: 22, train_loss: 0.6792, test_loss: 1.1672, test_f1: 0.6007
 epoch: 23, train_loss: 0.6763, test_loss: 1.1285, test_f1: 0.6026
 epoch: 24, train_loss: 0.6511, test_loss: 1.1047, test_f1: 0.5856
 epoch: 25, train_loss: 0.6345, test_loss: 0.9874, test_f1: 0.6435
 epoch: 26, train_loss: 0.6103, test_loss: 1.0426, test_f1: 0.5962
 epoch: 27, train_loss: 0.6155, test_loss: 1.0199, test_f1: 0.6266
 epoch: 28, train_loss: 0.6413, test_loss: 1.0108, test_f1: 0.6396
 epoch: 29, train_loss: 0.6433, test_loss: 0.9023, test_f1: 0.6405
 epoch: 30, train_loss: 0.6175, test_loss: 1.0323, test_f1: 0.6440
 epoch: 31, train_loss: 0.5921, test_loss: 0.9980, test_f1: 0.6229
 epoch: 32, train_loss: 0.5986, test_loss: 1.0772, test_f1: 0.6103
 epoch: 33, train_loss: 0.5954, test_loss: 1.1098, test_f1: 0.6195
 epoch: 34, train_loss: 0.5915, test_loss: 1.0122, test_f1: 0.6567
 epoch: 35, train_loss: 0.5648, test_loss: 1.1766, test_f1: 0.5916
 epoch: 36, train_loss: 0.5701, test_loss: 1.1965, test_f1: 0.6440
 epoch: 37, train_loss: 0.5443, test_loss: 1.1812, test_f1: 0.6594
 epoch: 38, train_loss: 0.5319, test_loss: 1.0865, test_f1: 0.6527
 epoch: 39, train_loss: 0.5137, test_loss: 1.1768, test_f1: 0.6145
 epoch: 40, train_loss: 0.5347, test_loss: 1.1716, test_f1: 0.6019
 epoch: 41, train_loss: 0.5174, test_loss: 1.1410, test_f1: 0.6640
 epoch: 42, train_loss: 0.4896, test_loss: 1.0498, test_f1: 0.6625
 epoch: 43, train_loss: 0.4984, test_loss: 1.1346, test_f1: 0.6443
 epoch: 44, train_loss: 0.4821, test_loss: 1.2275, test_f1: 0.6275
 epoch: 45, train_loss: 0.4572, test_loss: 1.1985, test_f1: 0.6065
 epoch: 46, train_loss: 0.4587, test_loss: 1.1173, test_f1: 0.6198
 epoch: 47, train_loss: 0.4516, test_loss: 1.5880, test_f1: 0.5647
 epoch: 48, train_loss: 0.4777, test_loss: 1.3456, test_f1: 0.5857
 epoch: 49, train_loss: 0.4625, test_loss: 1.2464, test_f1: 0.6219
 epoch: 50, train_loss: 0.4539, test_loss: 1.2536, test_f1: 0.5935
 epoch: 51, train_loss: 0.3952, test_loss: 1.2085, test_f1: 0.6479
 epoch: 52, train_loss: 0.3720, test_loss: 1.1480, test_f1: 0.6659
 epoch: 53, train_loss: 0.3577, test_loss: 1.1779, test_f1: 0.6336
 epoch: 54, train_loss: 0.3338, test_loss: 1.2478, test_f1: 0.6598
 epoch: 55, train_loss: 0.3425, test_loss: 1.2674, test_f1: 0.6747
 epoch: 56, train_loss: 0.3349, test_loss: 1.4220, test_f1: 0.6578
 epoch: 57, train_loss: 0.3540, test_loss: 1.3566, test_f1: 0.6804
 epoch: 58, train_loss: 0.3487, test_loss: 1.4241, test_f1: 0.6240
 epoch: 59, train_loss: 0.3292, test_loss: 1.5340, test_f1: 0.6324
 epoch: 60, train_loss: 0.3185, test_loss: 1.4572, test_f1: 0.6542
 epoch: 61, train_loss: 0.2989, test_loss: 1.4420, test_f1: 0.6570
 epoch: 62, train_loss: 0.3010, test_loss: 1.3262, test_f1: 0.6533
 epoch: 63, train_loss: 0.2992, test_loss: 1.4690, test_f1: 0.6245
 epoch: 64, train_loss: 0.3106, test_loss: 1.4817, test_f1: 0.6636
 epoch: 65, train_loss: 0.2861, test_loss: 1.4825, test_f1: 0.6395
 epoch: 66, train_loss: 0.2912, test_loss: 1.5537, test_f1: 0.6712
 epoch: 67, train_loss: 0.2595, test_loss: 1.6626, test_f1: 0.6457
 epoch: 68, train_loss: 0.2690, test_loss: 1.5876, test_f1: 0.6210
 epoch: 69, train_loss: 0.2655, test_loss: 1.9311, test_f1: 0.5545
 epoch: 70, train_loss: 0.2750, test_loss: 1.7419, test_f1: 0.6577
 epoch: 71, train_loss: 0.2720, test_loss: 1.5808, test_f1: 0.6504
 epoch: 72, train_loss: 0.2783, test_loss: 1.8719, test_f1: 0.6281
 epoch: 73, train_loss: 0.2690, test_loss: 1.5489, test_f1: 0.6448
 epoch: 74, train_loss: 0.2604, test_loss: 1.6490, test_f1: 0.6530
 epoch: 75, train_loss: 0.2694, test_loss: 1.8160, test_f1: 0.6301
 epoch: 76, train_loss: 0.2671, test_loss: 1.5959, test_f1: 0.6594
 epoch: 77, train_loss: 0.2533, test_loss: 1.6565, test_f1: 0.6622
 epoch: 78, train_loss: 0.2530, test_loss: 2.1710, test_f1: 0.6108
 epoch: 79, train_loss: 0.2481, test_loss: 1.8170, test_f1: 0.5998
 epoch: 80, train_loss: 0.2320, test_loss: 1.8384, test_f1: 0.6331
 epoch: 81, train_loss: 0.2424, test_loss: 1.8543, test_f1: 0.6253
 epoch: 82, train_loss: 0.2560, test_loss: 1.7222, test_f1: 0.6351
 epoch: 83, train_loss: 0.2496, test_loss: 1.6843, test_f1: 0.6467
 epoch: 84, train_loss: 0.2460, test_loss: 1.6961, test_f1: 0.6450
 epoch: 85, train_loss: 0.2476, test_loss: 1.8577, test_f1: 0.5881
 epoch: 86, train_loss: 0.2302, test_loss: 1.6958, test_f1: 0.6491
 epoch: 87, train_loss: 0.2260, test_loss: 1.9125, test_f1: 0.6245
 epoch: 88, train_loss: 0.2420, test_loss: 1.6145, test_f1: 0.6700
 epoch: 89, train_loss: 0.2453, test_loss: 1.6149, test_f1: 0.6642
 epoch: 90, train_loss: 0.2391, test_loss: 1.7868, test_f1: 0.6540
 epoch: 91, train_loss: 0.2312, test_loss: 1.8462, test_f1: 0.6173
 epoch: 92, train_loss: 0.2175, test_loss: 1.7380, test_f1: 0.6187
 epoch: 93, train_loss: 0.2235, test_loss: 1.7632, test_f1: 0.6511
 epoch: 94, train_loss: 0.2062, test_loss: 1.4419, test_f1: 0.6595
 epoch: 95, train_loss: 0.1994, test_loss: 1.5675, test_f1: 0.6520
 epoch: 96, train_loss: 0.2299, test_loss: 1.8289, test_f1: 0.6173
 epoch: 97, train_loss: 0.2213, test_loss: 1.8874, test_f1: 0.6304
 epoch: 98, train_loss: 0.2061, test_loss: 1.7623, test_f1: 0.6552
 epoch: 99, train_loss: 0.1937, test_loss: 2.0858, test_f1: 0.6526
##################ITERATION #3 ****************************************
 epoch: 0, train_loss: 1.3197, test_loss: 1.2867, test_f1: 0.2678
 epoch: 1, train_loss: 1.1026, test_loss: 1.1301, test_f1: 0.3570
 epoch: 2, train_loss: 1.0688, test_loss: 1.0807, test_f1: 0.3675
 epoch: 3, train_loss: 1.0522, test_loss: 1.1337, test_f1: 0.3606
 epoch: 4, train_loss: 1.0359, test_loss: 1.1252, test_f1: 0.3575
 epoch: 5, train_loss: 1.0300, test_loss: 1.0852, test_f1: 0.3842
 epoch: 6, train_loss: 0.9950, test_loss: 1.0306, test_f1: 0.4479
 epoch: 7, train_loss: 0.9866, test_loss: 1.0762, test_f1: 0.4716
 epoch: 8, train_loss: 0.9676, test_loss: 1.0115, test_f1: 0.4697
 epoch: 9, train_loss: 0.9129, test_loss: 1.1590, test_f1: 0.5200
 epoch: 10, train_loss: 0.9018, test_loss: 0.9542, test_f1: 0.5414
 epoch: 11, train_loss: 0.8671, test_loss: 0.9692, test_f1: 0.5720
 epoch: 12, train_loss: 0.8467, test_loss: 0.9809, test_f1: 0.5196
 epoch: 13, train_loss: 0.8216, test_loss: 0.9035, test_f1: 0.5684
 epoch: 14, train_loss: 0.7991, test_loss: 0.8811, test_f1: 0.5607
 epoch: 15, train_loss: 0.7924, test_loss: 0.8864, test_f1: 0.5610
 epoch: 16, train_loss: 0.7908, test_loss: 0.9993, test_f1: 0.5376
 epoch: 17, train_loss: 0.7622, test_loss: 0.9438, test_f1: 0.5723
 epoch: 18, train_loss: 0.7580, test_loss: 1.2264, test_f1: 0.4690
 epoch: 19, train_loss: 0.7418, test_loss: 0.9140, test_f1: 0.5694
 epoch: 20, train_loss: 0.7080, test_loss: 0.9748, test_f1: 0.5441
 epoch: 21, train_loss: 0.7104, test_loss: 0.8453, test_f1: 0.5787
 epoch: 22, train_loss: 0.6996, test_loss: 0.8260, test_f1: 0.5935
 epoch: 23, train_loss: 0.6952, test_loss: 0.8827, test_f1: 0.6167
 epoch: 24, train_loss: 0.6830, test_loss: 0.8505, test_f1: 0.6009
 epoch: 25, train_loss: 0.6713, test_loss: 0.7680, test_f1: 0.5902
 epoch: 26, train_loss: 0.6666, test_loss: 0.8925, test_f1: 0.6088
 epoch: 27, train_loss: 0.6684, test_loss: 0.9188, test_f1: 0.6047
 epoch: 28, train_loss: 0.6296, test_loss: 1.0068, test_f1: 0.5754
 epoch: 29, train_loss: 0.6090, test_loss: 0.9479, test_f1: 0.6361
 epoch: 30, train_loss: 0.6091, test_loss: 0.7372, test_f1: 0.6473
 epoch: 31, train_loss: 0.6219, test_loss: 0.7896, test_f1: 0.6041
 epoch: 32, train_loss: 0.5978, test_loss: 0.9165, test_f1: 0.5947
 epoch: 33, train_loss: 0.6233, test_loss: 0.7864, test_f1: 0.6106
 epoch: 34, train_loss: 0.6243, test_loss: 0.8276, test_f1: 0.6503
 epoch: 35, train_loss: 0.5886, test_loss: 0.9647, test_f1: 0.6211
 epoch: 36, train_loss: 0.5610, test_loss: 0.8392, test_f1: 0.6449
 epoch: 37, train_loss: 0.5381, test_loss: 0.7712, test_f1: 0.6450
 epoch: 38, train_loss: 0.5713, test_loss: 1.2324, test_f1: 0.6126
 epoch: 39, train_loss: 0.5765, test_loss: 1.2377, test_f1: 0.5966
 epoch: 40, train_loss: 0.5244, test_loss: 0.9179, test_f1: 0.6105
 epoch: 41, train_loss: 0.5144, test_loss: 1.2531, test_f1: 0.5657
 epoch: 42, train_loss: 0.5452, test_loss: 0.8871, test_f1: 0.6266
 epoch: 43, train_loss: 0.5146, test_loss: 0.8448, test_f1: 0.6775
 epoch: 44, train_loss: 0.5173, test_loss: 0.9142, test_f1: 0.6629
 epoch: 45, train_loss: 0.5294, test_loss: 1.0927, test_f1: 0.5565
 epoch: 46, train_loss: 0.4943, test_loss: 0.9606, test_f1: 0.5938
 epoch: 47, train_loss: 0.4994, test_loss: 0.9773, test_f1: 0.6732
 epoch: 48, train_loss: 0.4956, test_loss: 1.0269, test_f1: 0.6353
 epoch: 49, train_loss: 0.4828, test_loss: 0.9141, test_f1: 0.6034
 epoch: 50, train_loss: 0.4660, test_loss: 0.9689, test_f1: 0.6466
 epoch: 51, train_loss: 0.4257, test_loss: 0.9084, test_f1: 0.6548
 epoch: 52, train_loss: 0.4113, test_loss: 0.8984, test_f1: 0.6440
 epoch: 53, train_loss: 0.4282, test_loss: 0.8466, test_f1: 0.6872
 epoch: 54, train_loss: 0.3966, test_loss: 0.8518, test_f1: 0.6599
 epoch: 55, train_loss: 0.3742, test_loss: 1.0105, test_f1: 0.6370
 epoch: 56, train_loss: 0.3743, test_loss: 1.0975, test_f1: 0.6419
 epoch: 57, train_loss: 0.3410, test_loss: 1.1582, test_f1: 0.6354
 epoch: 58, train_loss: 0.3489, test_loss: 1.0921, test_f1: 0.6384
 epoch: 59, train_loss: 0.3368, test_loss: 1.1382, test_f1: 0.6672
 epoch: 60, train_loss: 0.3369, test_loss: 1.3214, test_f1: 0.6486
 epoch: 61, train_loss: 0.3317, test_loss: 1.0444, test_f1: 0.6390
 epoch: 62, train_loss: 0.3136, test_loss: 1.1307, test_f1: 0.6646
 epoch: 63, train_loss: 0.3368, test_loss: 1.0369, test_f1: 0.6520
 epoch: 64, train_loss: 0.3428, test_loss: 0.9950, test_f1: 0.6654
 epoch: 65, train_loss: 0.3467, test_loss: 1.2199, test_f1: 0.6612
 epoch: 66, train_loss: 0.3139, test_loss: 1.2591, test_f1: 0.6650
 epoch: 67, train_loss: 0.3412, test_loss: 1.0685, test_f1: 0.6381
 epoch: 68, train_loss: 0.3106, test_loss: 1.0746, test_f1: 0.6472
 epoch: 69, train_loss: 0.2783, test_loss: 1.0932, test_f1: 0.6548
 epoch: 70, train_loss: 0.3027, test_loss: 1.3026, test_f1: 0.6693
 epoch: 71, train_loss: 0.3038, test_loss: 1.2269, test_f1: 0.6615
 epoch: 72, train_loss: 0.2862, test_loss: 1.1215, test_f1: 0.6648
 epoch: 73, train_loss: 0.2983, test_loss: 1.3186, test_f1: 0.6597
 epoch: 74, train_loss: 0.2890, test_loss: 1.0712, test_f1: 0.6836
 epoch: 75, train_loss: 0.2849, test_loss: 1.1548, test_f1: 0.6625
 epoch: 76, train_loss: 0.2924, test_loss: 1.2269, test_f1: 0.6303
 epoch: 77, train_loss: 0.2756, test_loss: 1.1893, test_f1: 0.6496
 epoch: 78, train_loss: 0.2684, test_loss: 1.3311, test_f1: 0.6482
 epoch: 79, train_loss: 0.2614, test_loss: 1.2101, test_f1: 0.6790
 epoch: 80, train_loss: 0.2734, test_loss: 1.1629, test_f1: 0.6805
 epoch: 81, train_loss: 0.2611, test_loss: 1.3588, test_f1: 0.6491
 epoch: 82, train_loss: 0.2416, test_loss: 1.1925, test_f1: 0.6548
 epoch: 83, train_loss: 0.2543, test_loss: 1.2855, test_f1: 0.6786
 epoch: 84, train_loss: 0.2426, test_loss: 1.0944, test_f1: 0.6866
 epoch: 85, train_loss: 0.2612, test_loss: 1.4204, test_f1: 0.6401
 epoch: 86, train_loss: 0.3099, test_loss: 1.1134, test_f1: 0.6410
 epoch: 87, train_loss: 0.2606, test_loss: 1.4584, test_f1: 0.6419
 epoch: 88, train_loss: 0.2733, test_loss: 1.3643, test_f1: 0.6514
 epoch: 89, train_loss: 0.2454, test_loss: 1.3585, test_f1: 0.6317
 epoch: 90, train_loss: 0.2725, test_loss: 1.3379, test_f1: 0.6774
 epoch: 91, train_loss: 0.2559, test_loss: 1.2358, test_f1: 0.6768
 epoch: 92, train_loss: 0.2509, test_loss: 1.1885, test_f1: 0.6813
 epoch: 93, train_loss: 0.2260, test_loss: 1.1818, test_f1: 0.6691
 epoch: 94, train_loss: 0.2281, test_loss: 1.2897, test_f1: 0.6816
 epoch: 95, train_loss: 0.2429, test_loss: 1.4350, test_f1: 0.6263
 epoch: 96, train_loss: 0.2437, test_loss: 1.5679, test_f1: 0.6502
 epoch: 97, train_loss: 0.2390, test_loss: 1.2995, test_f1: 0.6450
 epoch: 98, train_loss: 0.2599, test_loss: 1.3542, test_f1: 0.6370
 epoch: 99, train_loss: 0.2477, test_loss: 1.4040, test_f1: 0.6726
##################ITERATION #4 ****************************************
 epoch: 0, train_loss: 1.5062, test_loss: 1.6169, test_f1: 0.1427
 epoch: 1, train_loss: 1.0388, test_loss: 1.2020, test_f1: 0.3579
 epoch: 2, train_loss: 0.9774, test_loss: 1.0170, test_f1: 0.4878
 epoch: 3, train_loss: 0.9651, test_loss: 1.0077, test_f1: 0.5328
 epoch: 4, train_loss: 0.9381, test_loss: 0.9092, test_f1: 0.5401
 epoch: 5, train_loss: 0.9232, test_loss: 0.8965, test_f1: 0.5553
 epoch: 6, train_loss: 0.9024, test_loss: 1.0125, test_f1: 0.5178
 epoch: 7, train_loss: 0.8799, test_loss: 0.9594, test_f1: 0.5424
 epoch: 8, train_loss: 0.8590, test_loss: 0.9888, test_f1: 0.5102
 epoch: 9, train_loss: 0.8692, test_loss: 0.9892, test_f1: 0.5266
 epoch: 10, train_loss: 0.8435, test_loss: 0.8563, test_f1: 0.5157
 epoch: 11, train_loss: 0.8143, test_loss: 0.8705, test_f1: 0.5629
 epoch: 12, train_loss: 0.8097, test_loss: 1.1198, test_f1: 0.4399
 epoch: 13, train_loss: 0.8019, test_loss: 0.9531, test_f1: 0.5475
 epoch: 14, train_loss: 0.7796, test_loss: 0.9749, test_f1: 0.5354
 epoch: 15, train_loss: 0.7574, test_loss: 1.0037, test_f1: 0.5421
 epoch: 16, train_loss: 0.7320, test_loss: 0.9683, test_f1: 0.5422
 epoch: 17, train_loss: 0.7390, test_loss: 0.9483, test_f1: 0.5576
 epoch: 18, train_loss: 0.7417, test_loss: 0.9063, test_f1: 0.5470
 epoch: 19, train_loss: 0.7544, test_loss: 0.9026, test_f1: 0.5452
 epoch: 20, train_loss: 0.7238, test_loss: 0.9550, test_f1: 0.5397
 epoch: 21, train_loss: 0.7290, test_loss: 0.9619, test_f1: 0.5468
 epoch: 22, train_loss: 0.7088, test_loss: 0.8138, test_f1: 0.6152
 epoch: 23, train_loss: 0.6956, test_loss: 0.9166, test_f1: 0.5682
 epoch: 24, train_loss: 0.7223, test_loss: 1.1591, test_f1: 0.4475
 epoch: 25, train_loss: 0.6881, test_loss: 0.8249, test_f1: 0.6296
 epoch: 26, train_loss: 0.6703, test_loss: 0.9417, test_f1: 0.5653
 epoch: 27, train_loss: 0.6669, test_loss: 0.8691, test_f1: 0.6208
 epoch: 28, train_loss: 0.6266, test_loss: 1.0635, test_f1: 0.5844
 epoch: 29, train_loss: 0.6447, test_loss: 0.8469, test_f1: 0.6017
 epoch: 30, train_loss: 0.6426, test_loss: 0.8120, test_f1: 0.6191
 epoch: 31, train_loss: 0.6199, test_loss: 0.8058, test_f1: 0.6304
 epoch: 32, train_loss: 0.6108, test_loss: 0.8795, test_f1: 0.6251
 epoch: 33, train_loss: 0.6134, test_loss: 0.9565, test_f1: 0.6021
 epoch: 34, train_loss: 0.5792, test_loss: 0.9542, test_f1: 0.5934
 epoch: 35, train_loss: 0.5809, test_loss: 0.8298, test_f1: 0.6302
 epoch: 36, train_loss: 0.5922, test_loss: 1.0686, test_f1: 0.5706
 epoch: 37, train_loss: 0.5844, test_loss: 1.0277, test_f1: 0.6053
 epoch: 38, train_loss: 0.5981, test_loss: 0.8253, test_f1: 0.6340
 epoch: 39, train_loss: 0.6059, test_loss: 0.8032, test_f1: 0.6413
 epoch: 40, train_loss: 0.5855, test_loss: 1.0190, test_f1: 0.6099
 epoch: 41, train_loss: 0.5546, test_loss: 0.9436, test_f1: 0.6264
 epoch: 42, train_loss: 0.5358, test_loss: 0.8202, test_f1: 0.6392
 epoch: 43, train_loss: 0.5255, test_loss: 0.8639, test_f1: 0.5895
 epoch: 44, train_loss: 0.5337, test_loss: 0.9562, test_f1: 0.6084
 epoch: 45, train_loss: 0.5240, test_loss: 0.8940, test_f1: 0.6628
 epoch: 46, train_loss: 0.5282, test_loss: 0.7689, test_f1: 0.6533
 epoch: 47, train_loss: 0.5272, test_loss: 1.0430, test_f1: 0.6156
 epoch: 48, train_loss: 0.5031, test_loss: 0.9915, test_f1: 0.6417
 epoch: 49, train_loss: 0.4916, test_loss: 1.0288, test_f1: 0.5796
 epoch: 50, train_loss: 0.4765, test_loss: 0.9070, test_f1: 0.6129
 epoch: 51, train_loss: 0.4669, test_loss: 1.0559, test_f1: 0.6399
 epoch: 52, train_loss: 0.4206, test_loss: 1.1079, test_f1: 0.6615
 epoch: 53, train_loss: 0.4300, test_loss: 0.9858, test_f1: 0.6774
 epoch: 54, train_loss: 0.4158, test_loss: 1.0755, test_f1: 0.6750
 epoch: 55, train_loss: 0.4002, test_loss: 0.8665, test_f1: 0.6833
 epoch: 56, train_loss: 0.3959, test_loss: 0.9513, test_f1: 0.6759
 epoch: 57, train_loss: 0.3842, test_loss: 0.9334, test_f1: 0.6685
 epoch: 58, train_loss: 0.3590, test_loss: 1.0025, test_f1: 0.7068
 epoch: 59, train_loss: 0.3642, test_loss: 0.9240, test_f1: 0.6469
 epoch: 60, train_loss: 0.3554, test_loss: 0.9239, test_f1: 0.6663
 epoch: 61, train_loss: 0.3688, test_loss: 1.0410, test_f1: 0.6608
 epoch: 62, train_loss: 0.3465, test_loss: 0.9314, test_f1: 0.6650
 epoch: 63, train_loss: 0.3498, test_loss: 1.0470, test_f1: 0.6671
 epoch: 64, train_loss: 0.3703, test_loss: 1.0524, test_f1: 0.6504
 epoch: 65, train_loss: 0.3524, test_loss: 1.0345, test_f1: 0.6278
 epoch: 66, train_loss: 0.3563, test_loss: 1.2465, test_f1: 0.6731
 epoch: 67, train_loss: 0.3446, test_loss: 1.1657, test_f1: 0.6490
 epoch: 68, train_loss: 0.3283, test_loss: 1.1303, test_f1: 0.6202
 epoch: 69, train_loss: 0.3376, test_loss: 1.1420, test_f1: 0.6641
 epoch: 70, train_loss: 0.3406, test_loss: 1.0396, test_f1: 0.6393
 epoch: 71, train_loss: 0.3357, test_loss: 1.0639, test_f1: 0.6576
 epoch: 72, train_loss: 0.3097, test_loss: 1.1719, test_f1: 0.6559
 epoch: 73, train_loss: 0.2972, test_loss: 1.2015, test_f1: 0.6834
 epoch: 74, train_loss: 0.2954, test_loss: 1.1496, test_f1: 0.6534
 epoch: 75, train_loss: 0.3142, test_loss: 1.1778, test_f1: 0.6649
 epoch: 76, train_loss: 0.3055, test_loss: 1.3155, test_f1: 0.6834
 epoch: 77, train_loss: 0.2983, test_loss: 1.0275, test_f1: 0.6829
 epoch: 78, train_loss: 0.2959, test_loss: 1.0628, test_f1: 0.6396
 epoch: 79, train_loss: 0.2979, test_loss: 1.1919, test_f1: 0.6435
 epoch: 80, train_loss: 0.2968, test_loss: 1.0866, test_f1: 0.6564
 epoch: 81, train_loss: 0.2700, test_loss: 1.1802, test_f1: 0.6608
 epoch: 82, train_loss: 0.2633, test_loss: 1.2607, test_f1: 0.6477
 epoch: 83, train_loss: 0.2594, test_loss: 1.1690, test_f1: 0.6724
 epoch: 84, train_loss: 0.2642, test_loss: 1.2144, test_f1: 0.6583
 epoch: 85, train_loss: 0.2885, test_loss: 1.1251, test_f1: 0.6747
 epoch: 86, train_loss: 0.2657, test_loss: 1.1698, test_f1: 0.6414
 epoch: 87, train_loss: 0.2759, test_loss: 1.2574, test_f1: 0.6516
 epoch: 88, train_loss: 0.2754, test_loss: 1.2058, test_f1: 0.6531
 epoch: 89, train_loss: 0.2874, test_loss: 1.2179, test_f1: 0.6559
 epoch: 90, train_loss: 0.2887, test_loss: 1.2196, test_f1: 0.6324
 epoch: 91, train_loss: 0.2729, test_loss: 1.1379, test_f1: 0.6731
 epoch: 92, train_loss: 0.2705, test_loss: 1.2767, test_f1: 0.6009
 epoch: 93, train_loss: 0.2719, test_loss: 1.1693, test_f1: 0.6219
 epoch: 94, train_loss: 0.2777, test_loss: 1.4083, test_f1: 0.6124
 epoch: 95, train_loss: 0.2729, test_loss: 1.2001, test_f1: 0.6743
 epoch: 96, train_loss: 0.2832, test_loss: 1.1364, test_f1: 0.6416
 epoch: 97, train_loss: 0.2763, test_loss: 1.1820, test_f1: 0.6642
 epoch: 98, train_loss: 0.2623, test_loss: 1.4458, test_f1: 0.6115
 epoch: 99, train_loss: 0.2325, test_loss: 1.4041, test_f1: 0.6337
##################ITERATION #5 ****************************************
 epoch: 0, train_loss: 1.8517, test_loss: 4.0523, test_f1: 0.2471
 epoch: 1, train_loss: 1.0204, test_loss: 1.6240, test_f1: 0.3093
 epoch: 2, train_loss: 0.9792, test_loss: 1.0370, test_f1: 0.4957
 epoch: 3, train_loss: 0.9445, test_loss: 1.0758, test_f1: 0.5024
 epoch: 4, train_loss: 0.9245, test_loss: 1.0867, test_f1: 0.5205
 epoch: 5, train_loss: 0.9107, test_loss: 1.0396, test_f1: 0.4937
 epoch: 6, train_loss: 0.8942, test_loss: 0.9583, test_f1: 0.5457
 epoch: 7, train_loss: 0.8859, test_loss: 0.9762, test_f1: 0.5290
 epoch: 8, train_loss: 0.8552, test_loss: 0.9759, test_f1: 0.5441
 epoch: 9, train_loss: 0.8593, test_loss: 0.9318, test_f1: 0.5675
 epoch: 10, train_loss: 0.8608, test_loss: 1.0790, test_f1: 0.5084
 epoch: 11, train_loss: 0.8367, test_loss: 0.9850, test_f1: 0.5545
 epoch: 12, train_loss: 0.8556, test_loss: 0.9455, test_f1: 0.5649
 epoch: 13, train_loss: 0.8443, test_loss: 0.9693, test_f1: 0.5336
 epoch: 14, train_loss: 0.8186, test_loss: 0.8858, test_f1: 0.5430
 epoch: 15, train_loss: 0.7907, test_loss: 1.0453, test_f1: 0.5323
 epoch: 16, train_loss: 0.7656, test_loss: 0.9949, test_f1: 0.5218
 epoch: 17, train_loss: 0.7953, test_loss: 0.8775, test_f1: 0.5791
 epoch: 18, train_loss: 0.7541, test_loss: 0.9443, test_f1: 0.5411
 epoch: 19, train_loss: 0.7278, test_loss: 0.9079, test_f1: 0.5711
 epoch: 20, train_loss: 0.7289, test_loss: 1.1491, test_f1: 0.5466
 epoch: 21, train_loss: 0.7145, test_loss: 0.9075, test_f1: 0.5679
 epoch: 22, train_loss: 0.6974, test_loss: 0.9859, test_f1: 0.5801
 epoch: 23, train_loss: 0.6908, test_loss: 0.9331, test_f1: 0.5880
 epoch: 24, train_loss: 0.6904, test_loss: 0.9983, test_f1: 0.5844
 epoch: 25, train_loss: 0.6783, test_loss: 1.0429, test_f1: 0.5651
 epoch: 26, train_loss: 0.6642, test_loss: 1.0870, test_f1: 0.5455
 epoch: 27, train_loss: 0.6752, test_loss: 0.9018, test_f1: 0.5877
 epoch: 28, train_loss: 0.6529, test_loss: 1.0837, test_f1: 0.6036
 epoch: 29, train_loss: 0.6419, test_loss: 0.8097, test_f1: 0.6176
 epoch: 30, train_loss: 0.6452, test_loss: 0.9575, test_f1: 0.6338
 epoch: 31, train_loss: 0.6382, test_loss: 0.8893, test_f1: 0.6304
 epoch: 32, train_loss: 0.6234, test_loss: 1.0515, test_f1: 0.5945
 epoch: 33, train_loss: 0.6194, test_loss: 0.9343, test_f1: 0.5770
 epoch: 34, train_loss: 0.6256, test_loss: 1.0001, test_f1: 0.6105
 epoch: 35, train_loss: 0.5976, test_loss: 0.8910, test_f1: 0.6456
 epoch: 36, train_loss: 0.5917, test_loss: 1.2119, test_f1: 0.5791
 epoch: 37, train_loss: 0.5776, test_loss: 1.3379, test_f1: 0.5588
 epoch: 38, train_loss: 0.5693, test_loss: 1.2772, test_f1: 0.6165
 epoch: 39, train_loss: 0.5804, test_loss: 0.9996, test_f1: 0.6364
 epoch: 40, train_loss: 0.5685, test_loss: 0.8909, test_f1: 0.6387
 epoch: 41, train_loss: 0.5832, test_loss: 0.9868, test_f1: 0.6348
 epoch: 42, train_loss: 0.5659, test_loss: 1.0217, test_f1: 0.6335
 epoch: 43, train_loss: 0.5427, test_loss: 0.9470, test_f1: 0.5950
 epoch: 44, train_loss: 0.5409, test_loss: 1.4767, test_f1: 0.5577
 epoch: 45, train_loss: 0.5669, test_loss: 1.0674, test_f1: 0.6450
 epoch: 46, train_loss: 0.5256, test_loss: 1.2836, test_f1: 0.6311
 epoch: 47, train_loss: 0.5377, test_loss: 1.1989, test_f1: 0.6005
 epoch: 48, train_loss: 0.5081, test_loss: 1.1485, test_f1: 0.6384
 epoch: 49, train_loss: 0.5202, test_loss: 1.0144, test_f1: 0.6594
 epoch: 50, train_loss: 0.4981, test_loss: 1.0576, test_f1: 0.6172
 epoch: 51, train_loss: 0.4492, test_loss: 1.1715, test_f1: 0.6130
 epoch: 52, train_loss: 0.4204, test_loss: 1.3531, test_f1: 0.6454
 epoch: 53, train_loss: 0.4026, test_loss: 1.3121, test_f1: 0.6790
 epoch: 54, train_loss: 0.3935, test_loss: 1.5015, test_f1: 0.6368
 epoch: 55, train_loss: 0.3786, test_loss: 1.2286, test_f1: 0.6463
 epoch: 56, train_loss: 0.3720, test_loss: 1.5613, test_f1: 0.6453
 epoch: 57, train_loss: 0.3903, test_loss: 1.4190, test_f1: 0.6490
 epoch: 58, train_loss: 0.4080, test_loss: 1.3829, test_f1: 0.6364
 epoch: 59, train_loss: 0.3691, test_loss: 1.3216, test_f1: 0.6555
 epoch: 60, train_loss: 0.3659, test_loss: 1.5796, test_f1: 0.6401
 epoch: 61, train_loss: 0.3308, test_loss: 1.4048, test_f1: 0.6591
 epoch: 62, train_loss: 0.3362, test_loss: 1.7439, test_f1: 0.6670
 epoch: 63, train_loss: 0.3338, test_loss: 1.8954, test_f1: 0.6162
 epoch: 64, train_loss: 0.3386, test_loss: 1.6771, test_f1: 0.6233
 epoch: 65, train_loss: 0.3533, test_loss: 1.4419, test_f1: 0.6500
 epoch: 66, train_loss: 0.3395, test_loss: 1.4252, test_f1: 0.6559
 epoch: 67, train_loss: 0.3367, test_loss: 1.6366, test_f1: 0.6412
 epoch: 68, train_loss: 0.3288, test_loss: 1.3288, test_f1: 0.6302
 epoch: 69, train_loss: 0.3420, test_loss: 1.4401, test_f1: 0.6280
 epoch: 70, train_loss: 0.3232, test_loss: 1.6211, test_f1: 0.6320
 epoch: 71, train_loss: 0.3163, test_loss: 1.6084, test_f1: 0.6487
 epoch: 72, train_loss: 0.3066, test_loss: 1.7401, test_f1: 0.6298
 epoch: 73, train_loss: 0.3032, test_loss: 1.7007, test_f1: 0.6524
 epoch: 74, train_loss: 0.2881, test_loss: 1.7424, test_f1: 0.6524
 epoch: 75, train_loss: 0.2900, test_loss: 1.8194, test_f1: 0.6432
 epoch: 76, train_loss: 0.2962, test_loss: 1.8501, test_f1: 0.6387
 epoch: 77, train_loss: 0.2897, test_loss: 1.8219, test_f1: 0.6308
 epoch: 78, train_loss: 0.2735, test_loss: 1.8939, test_f1: 0.6522
 epoch: 79, train_loss: 0.2827, test_loss: 1.7099, test_f1: 0.6728
 epoch: 80, train_loss: 0.2792, test_loss: 2.1485, test_f1: 0.6559
 epoch: 81, train_loss: 0.2610, test_loss: 2.1446, test_f1: 0.6500
 epoch: 82, train_loss: 0.2431, test_loss: 1.7404, test_f1: 0.6322
 epoch: 83, train_loss: 0.2782, test_loss: 1.9809, test_f1: 0.6052
 epoch: 84, train_loss: 0.3142, test_loss: 1.2485, test_f1: 0.6738
 epoch: 85, train_loss: 0.2713, test_loss: 1.3158, test_f1: 0.6526
 epoch: 86, train_loss: 0.2621, test_loss: 1.8679, test_f1: 0.6346
 epoch: 87, train_loss: 0.2484, test_loss: 1.5257, test_f1: 0.6304
 epoch: 88, train_loss: 0.2527, test_loss: 1.6689, test_f1: 0.6696
 epoch: 89, train_loss: 0.2635, test_loss: 1.7024, test_f1: 0.6821
 epoch: 90, train_loss: 0.2416, test_loss: 1.8373, test_f1: 0.6275
 epoch: 91, train_loss: 0.2498, test_loss: 2.1106, test_f1: 0.6653
 epoch: 92, train_loss: 0.2546, test_loss: 1.7947, test_f1: 0.6607
 epoch: 93, train_loss: 0.2628, test_loss: 1.9434, test_f1: 0.6444
 epoch: 94, train_loss: 0.2278, test_loss: 1.7540, test_f1: 0.6637
 epoch: 95, train_loss: 0.2293, test_loss: 1.8606, test_f1: 0.6790
 epoch: 96, train_loss: 0.2251, test_loss: 1.5754, test_f1: 0.6430
 epoch: 97, train_loss: 0.2115, test_loss: 2.1021, test_f1: 0.6554
 epoch: 98, train_loss: 0.2361, test_loss: 1.8549, test_f1: 0.6589
 epoch: 99, train_loss: 0.2110, test_loss: 2.0612, test_f1: 0.6502
##################ITERATION #6 ****************************************
 epoch: 0, train_loss: 1.4904, test_loss: 2.0529, test_f1: 0.2548
 epoch: 1, train_loss: 1.0262, test_loss: 1.0943, test_f1: 0.4790
 epoch: 2, train_loss: 0.9643, test_loss: 0.9636, test_f1: 0.5298
 epoch: 3, train_loss: 0.9287, test_loss: 0.9629, test_f1: 0.5200
 epoch: 4, train_loss: 0.8946, test_loss: 0.9066, test_f1: 0.5499
 epoch: 5, train_loss: 0.8852, test_loss: 0.9016, test_f1: 0.5427
 epoch: 6, train_loss: 0.8449, test_loss: 0.9000, test_f1: 0.5798
 epoch: 7, train_loss: 0.8460, test_loss: 0.9141, test_f1: 0.5344
 epoch: 8, train_loss: 0.8453, test_loss: 0.9154, test_f1: 0.5354
 epoch: 9, train_loss: 0.8023, test_loss: 0.8688, test_f1: 0.5553
 epoch: 10, train_loss: 0.7840, test_loss: 0.8344, test_f1: 0.6276
 epoch: 11, train_loss: 0.7905, test_loss: 0.8618, test_f1: 0.5821
 epoch: 12, train_loss: 0.7487, test_loss: 0.8101, test_f1: 0.5960
 epoch: 13, train_loss: 0.7362, test_loss: 0.9393, test_f1: 0.5450
 epoch: 14, train_loss: 0.7487, test_loss: 0.8310, test_f1: 0.6258
 epoch: 15, train_loss: 0.7164, test_loss: 1.1409, test_f1: 0.5491
 epoch: 16, train_loss: 0.6933, test_loss: 1.0014, test_f1: 0.5439
 epoch: 17, train_loss: 0.6939, test_loss: 0.9580, test_f1: 0.5667
 epoch: 18, train_loss: 0.6799, test_loss: 0.8107, test_f1: 0.6203
 epoch: 19, train_loss: 0.6914, test_loss: 0.8762, test_f1: 0.6191
 epoch: 20, train_loss: 0.6652, test_loss: 0.8731, test_f1: 0.6576
 epoch: 21, train_loss: 0.6491, test_loss: 0.8609, test_f1: 0.6436
 epoch: 22, train_loss: 0.6504, test_loss: 0.7859, test_f1: 0.6240
 epoch: 23, train_loss: 0.6353, test_loss: 0.8454, test_f1: 0.6555
 epoch: 24, train_loss: 0.6337, test_loss: 0.9219, test_f1: 0.6103
 epoch: 25, train_loss: 0.6397, test_loss: 0.9587, test_f1: 0.6189
 epoch: 26, train_loss: 0.6245, test_loss: 0.8920, test_f1: 0.5854
 epoch: 27, train_loss: 0.6140, test_loss: 1.0217, test_f1: 0.5820
 epoch: 28, train_loss: 0.6097, test_loss: 0.9711, test_f1: 0.6044
 epoch: 29, train_loss: 0.5921, test_loss: 0.9931, test_f1: 0.6062
 epoch: 30, train_loss: 0.5960, test_loss: 0.9320, test_f1: 0.5915
 epoch: 31, train_loss: 0.5829, test_loss: 0.9792, test_f1: 0.5403
 epoch: 32, train_loss: 0.5669, test_loss: 0.8475, test_f1: 0.6088
 epoch: 33, train_loss: 0.5326, test_loss: 0.8310, test_f1: 0.6845
 epoch: 34, train_loss: 0.5722, test_loss: 0.9136, test_f1: 0.6246
 epoch: 35, train_loss: 0.5635, test_loss: 0.8241, test_f1: 0.6345
 epoch: 36, train_loss: 0.5616, test_loss: 1.2781, test_f1: 0.5474
 epoch: 37, train_loss: 0.5533, test_loss: 1.0254, test_f1: 0.6153
 epoch: 38, train_loss: 0.5377, test_loss: 1.0613, test_f1: 0.5798
 epoch: 39, train_loss: 0.5316, test_loss: 0.8715, test_f1: 0.6745
 epoch: 40, train_loss: 0.5454, test_loss: 1.0579, test_f1: 0.6160
 epoch: 41, train_loss: 0.5257, test_loss: 0.8614, test_f1: 0.6582
 epoch: 42, train_loss: 0.5035, test_loss: 0.8932, test_f1: 0.6555
 epoch: 43, train_loss: 0.4932, test_loss: 1.0449, test_f1: 0.6532
 epoch: 44, train_loss: 0.4811, test_loss: 0.9717, test_f1: 0.6901
 epoch: 45, train_loss: 0.4764, test_loss: 0.9669, test_f1: 0.6361
 epoch: 46, train_loss: 0.4636, test_loss: 1.0119, test_f1: 0.6267
 epoch: 47, train_loss: 0.4900, test_loss: 1.1380, test_f1: 0.6247
 epoch: 48, train_loss: 0.4673, test_loss: 1.1216, test_f1: 0.6173
 epoch: 49, train_loss: 0.5057, test_loss: 0.9668, test_f1: 0.6188
 epoch: 50, train_loss: 0.5083, test_loss: 0.9022, test_f1: 0.6537
 epoch: 51, train_loss: 0.4400, test_loss: 0.8587, test_f1: 0.6678
 epoch: 52, train_loss: 0.4052, test_loss: 0.9236, test_f1: 0.6566
 epoch: 53, train_loss: 0.3839, test_loss: 0.9610, test_f1: 0.6644
 epoch: 54, train_loss: 0.3597, test_loss: 1.0356, test_f1: 0.6603
 epoch: 55, train_loss: 0.3529, test_loss: 0.8780, test_f1: 0.6894
 epoch: 56, train_loss: 0.3490, test_loss: 1.0443, test_f1: 0.6483
 epoch: 57, train_loss: 0.3330, test_loss: 0.9893, test_f1: 0.6403
 epoch: 58, train_loss: 0.3357, test_loss: 1.0371, test_f1: 0.6473
 epoch: 59, train_loss: 0.3376, test_loss: 1.1036, test_f1: 0.6811
 epoch: 60, train_loss: 0.3268, test_loss: 1.1856, test_f1: 0.6673
 epoch: 61, train_loss: 0.3404, test_loss: 1.2343, test_f1: 0.6671
 epoch: 62, train_loss: 0.2943, test_loss: 1.2068, test_f1: 0.6358
 epoch: 63, train_loss: 0.3208, test_loss: 1.0122, test_f1: 0.6572
 epoch: 64, train_loss: 0.3341, test_loss: 1.2296, test_f1: 0.6634
 epoch: 65, train_loss: 0.3139, test_loss: 1.2058, test_f1: 0.6540
 epoch: 66, train_loss: 0.2911, test_loss: 1.1893, test_f1: 0.6604
 epoch: 67, train_loss: 0.3118, test_loss: 1.2992, test_f1: 0.6489
 epoch: 68, train_loss: 0.3296, test_loss: 1.1859, test_f1: 0.6480
 epoch: 69, train_loss: 0.3163, test_loss: 1.1429, test_f1: 0.6556
 epoch: 70, train_loss: 0.3043, test_loss: 1.2179, test_f1: 0.6535
 epoch: 71, train_loss: 0.2772, test_loss: 1.3273, test_f1: 0.6579
 epoch: 72, train_loss: 0.2927, test_loss: 1.1996, test_f1: 0.6311
 epoch: 73, train_loss: 0.2944, test_loss: 1.2509, test_f1: 0.6429
 epoch: 74, train_loss: 0.2907, test_loss: 1.2015, test_f1: 0.6477
 epoch: 75, train_loss: 0.2938, test_loss: 1.2317, test_f1: 0.6236
 epoch: 76, train_loss: 0.2956, test_loss: 1.2631, test_f1: 0.6413
 epoch: 77, train_loss: 0.2750, test_loss: 1.1762, test_f1: 0.6532
 epoch: 78, train_loss: 0.2763, test_loss: 1.3725, test_f1: 0.5976
 epoch: 79, train_loss: 0.2747, test_loss: 1.2713, test_f1: 0.6439
 epoch: 80, train_loss: 0.2624, test_loss: 1.3616, test_f1: 0.6669
 epoch: 81, train_loss: 0.2755, test_loss: 1.4719, test_f1: 0.6459
 epoch: 82, train_loss: 0.2715, test_loss: 1.4345, test_f1: 0.6258
 epoch: 83, train_loss: 0.2587, test_loss: 1.2222, test_f1: 0.6541
 epoch: 84, train_loss: 0.2511, test_loss: 1.3603, test_f1: 0.6503
 epoch: 85, train_loss: 0.2438, test_loss: 1.3183, test_f1: 0.6359
 epoch: 86, train_loss: 0.2709, test_loss: 1.3146, test_f1: 0.6362
 epoch: 87, train_loss: 0.2694, test_loss: 1.0846, test_f1: 0.6852
 epoch: 88, train_loss: 0.2472, test_loss: 1.2954, test_f1: 0.6417
 epoch: 89, train_loss: 0.2679, test_loss: 1.3203, test_f1: 0.6655
 epoch: 90, train_loss: 0.2620, test_loss: 1.3340, test_f1: 0.6402
 epoch: 91, train_loss: 0.2277, test_loss: 1.2398, test_f1: 0.6640
 epoch: 92, train_loss: 0.2486, test_loss: 1.2166, test_f1: 0.6517
 epoch: 93, train_loss: 0.2525, test_loss: 1.5037, test_f1: 0.6197
 epoch: 94, train_loss: 0.2361, test_loss: 1.2212, test_f1: 0.6388
 epoch: 95, train_loss: 0.2512, test_loss: 1.4241, test_f1: 0.6639
 epoch: 96, train_loss: 0.2182, test_loss: 1.2403, test_f1: 0.6621
 epoch: 97, train_loss: 0.2217, test_loss: 1.3267, test_f1: 0.6478
 epoch: 98, train_loss: 0.2304, test_loss: 1.5566, test_f1: 0.6226
 epoch: 99, train_loss: 0.2209, test_loss: 1.6176, test_f1: 0.6299
##################ITERATION #7 ****************************************
 epoch: 0, train_loss: 1.3640, test_loss: 1.8322, test_f1: 0.2702
 epoch: 1, train_loss: 1.0402, test_loss: 1.4229, test_f1: 0.3282
 epoch: 2, train_loss: 0.9749, test_loss: 1.1219, test_f1: 0.4217
 epoch: 3, train_loss: 0.9658, test_loss: 1.0805, test_f1: 0.4832
 epoch: 4, train_loss: 0.9285, test_loss: 1.0157, test_f1: 0.5188
 epoch: 5, train_loss: 0.9177, test_loss: 1.0638, test_f1: 0.5247
 epoch: 6, train_loss: 0.9010, test_loss: 0.9996, test_f1: 0.5007
 epoch: 7, train_loss: 0.8727, test_loss: 0.9634, test_f1: 0.5539
 epoch: 8, train_loss: 0.8659, test_loss: 1.0667, test_f1: 0.4849
 epoch: 9, train_loss: 0.8554, test_loss: 1.0037, test_f1: 0.5212
 epoch: 10, train_loss: 0.8497, test_loss: 0.9300, test_f1: 0.5922
 epoch: 11, train_loss: 0.8338, test_loss: 0.8575, test_f1: 0.5908
 epoch: 12, train_loss: 0.8130, test_loss: 0.8904, test_f1: 0.5716
 epoch: 13, train_loss: 0.8060, test_loss: 0.9102, test_f1: 0.5965
 epoch: 14, train_loss: 0.7846, test_loss: 0.9879, test_f1: 0.5712
 epoch: 15, train_loss: 0.7699, test_loss: 1.0069, test_f1: 0.5770
 epoch: 16, train_loss: 0.7659, test_loss: 0.9595, test_f1: 0.5493
 epoch: 17, train_loss: 0.7554, test_loss: 0.8619, test_f1: 0.6096
 epoch: 18, train_loss: 0.7341, test_loss: 0.8989, test_f1: 0.6043
 epoch: 19, train_loss: 0.7105, test_loss: 0.8953, test_f1: 0.5962
 epoch: 20, train_loss: 0.7035, test_loss: 1.1095, test_f1: 0.5000
 epoch: 21, train_loss: 0.6992, test_loss: 0.8519, test_f1: 0.6157
 epoch: 22, train_loss: 0.7001, test_loss: 0.8741, test_f1: 0.6088
 epoch: 23, train_loss: 0.6902, test_loss: 0.8426, test_f1: 0.6161
 epoch: 24, train_loss: 0.6863, test_loss: 0.8956, test_f1: 0.6163
 epoch: 25, train_loss: 0.6761, test_loss: 0.9491, test_f1: 0.5809
 epoch: 26, train_loss: 0.6461, test_loss: 0.8616, test_f1: 0.6367
 epoch: 27, train_loss: 0.6356, test_loss: 0.8946, test_f1: 0.6303
 epoch: 28, train_loss: 0.6440, test_loss: 0.8897, test_f1: 0.6058
 epoch: 29, train_loss: 0.6362, test_loss: 0.9882, test_f1: 0.6272
 epoch: 30, train_loss: 0.6397, test_loss: 1.4464, test_f1: 0.5202
 epoch: 31, train_loss: 0.6236, test_loss: 0.9113, test_f1: 0.6113
 epoch: 32, train_loss: 0.6086, test_loss: 0.7572, test_f1: 0.6694
 epoch: 33, train_loss: 0.5836, test_loss: 0.9968, test_f1: 0.5968
 epoch: 34, train_loss: 0.6027, test_loss: 0.9137, test_f1: 0.6238
 epoch: 35, train_loss: 0.6087, test_loss: 0.8035, test_f1: 0.6593
 epoch: 36, train_loss: 0.6343, test_loss: 0.8671, test_f1: 0.6517
 epoch: 37, train_loss: 0.6072, test_loss: 1.1118, test_f1: 0.5945
 epoch: 38, train_loss: 0.5738, test_loss: 0.7977, test_f1: 0.6173
 epoch: 39, train_loss: 0.5587, test_loss: 0.9405, test_f1: 0.5905
 epoch: 40, train_loss: 0.5373, test_loss: 1.1239, test_f1: 0.6002
 epoch: 41, train_loss: 0.5702, test_loss: 0.9349, test_f1: 0.6700
 epoch: 42, train_loss: 0.5357, test_loss: 0.9561, test_f1: 0.6376
 epoch: 43, train_loss: 0.5099, test_loss: 1.3895, test_f1: 0.4888
 epoch: 44, train_loss: 0.5245, test_loss: 1.0915, test_f1: 0.6318
 epoch: 45, train_loss: 0.5006, test_loss: 1.0465, test_f1: 0.6636
 epoch: 46, train_loss: 0.5155, test_loss: 1.0773, test_f1: 0.6388
 epoch: 47, train_loss: 0.5087, test_loss: 1.2050, test_f1: 0.6221
 epoch: 48, train_loss: 0.4841, test_loss: 0.9908, test_f1: 0.6222
 epoch: 49, train_loss: 0.4915, test_loss: 1.1079, test_f1: 0.6548
 epoch: 50, train_loss: 0.4979, test_loss: 1.0025, test_f1: 0.6449
 epoch: 51, train_loss: 0.4638, test_loss: 1.0062, test_f1: 0.6677
 epoch: 52, train_loss: 0.4170, test_loss: 1.1203, test_f1: 0.6621
 epoch: 53, train_loss: 0.3799, test_loss: 1.3084, test_f1: 0.6502
 epoch: 54, train_loss: 0.3667, test_loss: 1.1452, test_f1: 0.6757
 epoch: 55, train_loss: 0.3735, test_loss: 1.2958, test_f1: 0.6392
 epoch: 56, train_loss: 0.3821, test_loss: 1.2202, test_f1: 0.6808
 epoch: 57, train_loss: 0.3671, test_loss: 1.4910, test_f1: 0.6397
 epoch: 58, train_loss: 0.3739, test_loss: 1.3411, test_f1: 0.6635
 epoch: 59, train_loss: 0.3465, test_loss: 1.3126, test_f1: 0.6491
 epoch: 60, train_loss: 0.3311, test_loss: 1.5223, test_f1: 0.6320
 epoch: 61, train_loss: 0.3322, test_loss: 1.4159, test_f1: 0.6615
 epoch: 62, train_loss: 0.3249, test_loss: 1.3503, test_f1: 0.6337
 epoch: 63, train_loss: 0.3128, test_loss: 1.2632, test_f1: 0.6672
 epoch: 64, train_loss: 0.3233, test_loss: 1.2985, test_f1: 0.6574
 epoch: 65, train_loss: 0.3448, test_loss: 1.3363, test_f1: 0.6712
 epoch: 66, train_loss: 0.3337, test_loss: 1.4259, test_f1: 0.6582
 epoch: 67, train_loss: 0.3408, test_loss: 1.4593, test_f1: 0.6565
 epoch: 68, train_loss: 0.3328, test_loss: 1.4502, test_f1: 0.6574
 epoch: 69, train_loss: 0.3226, test_loss: 1.4676, test_f1: 0.6850
 epoch: 70, train_loss: 0.2999, test_loss: 1.4015, test_f1: 0.6522
 epoch: 71, train_loss: 0.3029, test_loss: 1.4887, test_f1: 0.6385
 epoch: 72, train_loss: 0.3038, test_loss: 1.3438, test_f1: 0.6832
 epoch: 73, train_loss: 0.2950, test_loss: 1.5580, test_f1: 0.6526
 epoch: 74, train_loss: 0.2977, test_loss: 1.5351, test_f1: 0.6547
 epoch: 75, train_loss: 0.3013, test_loss: 1.5051, test_f1: 0.6303
 epoch: 76, train_loss: 0.2879, test_loss: 1.4095, test_f1: 0.6422
 epoch: 77, train_loss: 0.2814, test_loss: 1.5223, test_f1: 0.6314
 epoch: 78, train_loss: 0.2828, test_loss: 1.4826, test_f1: 0.6800
 epoch: 79, train_loss: 0.2729, test_loss: 1.5086, test_f1: 0.6771
 epoch: 80, train_loss: 0.2847, test_loss: 1.4985, test_f1: 0.6764
 epoch: 81, train_loss: 0.2849, test_loss: 1.5058, test_f1: 0.6568
 epoch: 82, train_loss: 0.2748, test_loss: 1.5467, test_f1: 0.6545
 epoch: 83, train_loss: 0.2631, test_loss: 1.6061, test_f1: 0.6641
 epoch: 84, train_loss: 0.2550, test_loss: 1.7726, test_f1: 0.6512
 epoch: 85, train_loss: 0.3147, test_loss: 1.6738, test_f1: 0.6630
 epoch: 86, train_loss: 0.2995, test_loss: 1.6863, test_f1: 0.6394
 epoch: 87, train_loss: 0.2942, test_loss: 1.9844, test_f1: 0.5962
 epoch: 88, train_loss: 0.3005, test_loss: 1.6097, test_f1: 0.6509
 epoch: 89, train_loss: 0.2741, test_loss: 1.7588, test_f1: 0.6527
 epoch: 90, train_loss: 0.2487, test_loss: 1.7747, test_f1: 0.6995
 epoch: 91, train_loss: 0.2488, test_loss: 1.5937, test_f1: 0.7000
 epoch: 92, train_loss: 0.2628, test_loss: 1.7330, test_f1: 0.6590
 epoch: 93, train_loss: 0.2369, test_loss: 1.6505, test_f1: 0.6595
 epoch: 94, train_loss: 0.2621, test_loss: 1.7604, test_f1: 0.6280
 epoch: 95, train_loss: 0.2491, test_loss: 1.7454, test_f1: 0.6615
 epoch: 96, train_loss: 0.2374, test_loss: 1.8646, test_f1: 0.6607
 epoch: 97, train_loss: 0.2349, test_loss: 2.1732, test_f1: 0.6390
 epoch: 98, train_loss: 0.2338, test_loss: 2.1160, test_f1: 0.6752
 epoch: 99, train_loss: 0.2350, test_loss: 1.8791, test_f1: 0.6953
##################ITERATION #8 ****************************************
 epoch: 0, train_loss: 2.0668, test_loss: 1.8506, test_f1: 0.1689
 epoch: 1, train_loss: 1.2170, test_loss: 1.2000, test_f1: 0.2871
 epoch: 2, train_loss: 1.1196, test_loss: 1.1195, test_f1: 0.2903
 epoch: 3, train_loss: 1.0608, test_loss: 1.0614, test_f1: 0.4489
 epoch: 4, train_loss: 1.0221, test_loss: 1.0264, test_f1: 0.4644
 epoch: 5, train_loss: 0.9803, test_loss: 0.9990, test_f1: 0.4757
 epoch: 6, train_loss: 0.9669, test_loss: 1.0592, test_f1: 0.4981
 epoch: 7, train_loss: 0.9360, test_loss: 1.0838, test_f1: 0.5355
 epoch: 8, train_loss: 0.9219, test_loss: 1.0361, test_f1: 0.5459
 epoch: 9, train_loss: 0.9152, test_loss: 0.8946, test_f1: 0.5791
 epoch: 10, train_loss: 0.9016, test_loss: 1.0216, test_f1: 0.5031
 epoch: 11, train_loss: 0.8928, test_loss: 0.8807, test_f1: 0.5872
 epoch: 12, train_loss: 0.8919, test_loss: 0.9643, test_f1: 0.5149
 epoch: 13, train_loss: 0.8730, test_loss: 0.8808, test_f1: 0.5830
 epoch: 14, train_loss: 0.8525, test_loss: 1.0617, test_f1: 0.5543
 epoch: 15, train_loss: 0.8338, test_loss: 0.8960, test_f1: 0.5646
 epoch: 16, train_loss: 0.8275, test_loss: 0.8847, test_f1: 0.5615
 epoch: 17, train_loss: 0.8288, test_loss: 0.8787, test_f1: 0.5247
 epoch: 18, train_loss: 0.8109, test_loss: 0.8144, test_f1: 0.5921
 epoch: 19, train_loss: 0.8018, test_loss: 0.8589, test_f1: 0.5809
 epoch: 20, train_loss: 0.7991, test_loss: 0.9073, test_f1: 0.5467
 epoch: 21, train_loss: 0.7821, test_loss: 0.8104, test_f1: 0.6342
 epoch: 22, train_loss: 0.7627, test_loss: 0.9167, test_f1: 0.5578
 epoch: 23, train_loss: 0.7504, test_loss: 0.8460, test_f1: 0.5819
 epoch: 24, train_loss: 0.7519, test_loss: 0.7943, test_f1: 0.5945
 epoch: 25, train_loss: 0.7361, test_loss: 0.8106, test_f1: 0.6139
 epoch: 26, train_loss: 0.7216, test_loss: 0.7758, test_f1: 0.6432
 epoch: 27, train_loss: 0.7271, test_loss: 0.8383, test_f1: 0.6102
 epoch: 28, train_loss: 0.7267, test_loss: 1.0211, test_f1: 0.5492
 epoch: 29, train_loss: 0.7677, test_loss: 0.9227, test_f1: 0.5584
 epoch: 30, train_loss: 0.7349, test_loss: 0.8682, test_f1: 0.5702
 epoch: 31, train_loss: 0.7095, test_loss: 0.7826, test_f1: 0.6090
 epoch: 32, train_loss: 0.7126, test_loss: 0.8099, test_f1: 0.6230
 epoch: 33, train_loss: 0.6982, test_loss: 0.8396, test_f1: 0.6037
 epoch: 34, train_loss: 0.7009, test_loss: 0.7710, test_f1: 0.6493
 epoch: 35, train_loss: 0.7138, test_loss: 1.3567, test_f1: 0.4636
 epoch: 36, train_loss: 0.7062, test_loss: 0.8810, test_f1: 0.5687
 epoch: 37, train_loss: 0.7001, test_loss: 0.8153, test_f1: 0.6073
 epoch: 38, train_loss: 0.6862, test_loss: 0.7995, test_f1: 0.6214
 epoch: 39, train_loss: 0.6810, test_loss: 0.7343, test_f1: 0.6706
 epoch: 40, train_loss: 0.6710, test_loss: 0.9378, test_f1: 0.5935
 epoch: 41, train_loss: 0.6629, test_loss: 0.7512, test_f1: 0.6632
 epoch: 42, train_loss: 0.6449, test_loss: 0.7818, test_f1: 0.6485
 epoch: 43, train_loss: 0.6287, test_loss: 0.7511, test_f1: 0.6733
 epoch: 44, train_loss: 0.6142, test_loss: 0.7200, test_f1: 0.6691
 epoch: 45, train_loss: 0.6397, test_loss: 0.7601, test_f1: 0.6497
 epoch: 46, train_loss: 0.6395, test_loss: 0.9977, test_f1: 0.5410
 epoch: 47, train_loss: 0.6207, test_loss: 0.9008, test_f1: 0.5953
 epoch: 48, train_loss: 0.6277, test_loss: 0.8354, test_f1: 0.6492
 epoch: 49, train_loss: 0.6259, test_loss: 0.8173, test_f1: 0.6421
 epoch: 50, train_loss: 0.5973, test_loss: 0.7913, test_f1: 0.6326
 epoch: 51, train_loss: 0.5691, test_loss: 0.7344, test_f1: 0.6548
 epoch: 52, train_loss: 0.5451, test_loss: 0.7856, test_f1: 0.6591
 epoch: 53, train_loss: 0.5107, test_loss: 0.8059, test_f1: 0.6435
 epoch: 54, train_loss: 0.5063, test_loss: 0.8259, test_f1: 0.6459
 epoch: 55, train_loss: 0.4864, test_loss: 0.9282, test_f1: 0.6442
 epoch: 56, train_loss: 0.5037, test_loss: 0.7848, test_f1: 0.6965
 epoch: 57, train_loss: 0.4781, test_loss: 0.8227, test_f1: 0.6561
 epoch: 58, train_loss: 0.4691, test_loss: 0.8994, test_f1: 0.6417
 epoch: 59, train_loss: 0.4774, test_loss: 0.9585, test_f1: 0.6473
 epoch: 60, train_loss: 0.4711, test_loss: 1.0549, test_f1: 0.6408
 epoch: 61, train_loss: 0.4727, test_loss: 0.9287, test_f1: 0.6975
 epoch: 62, train_loss: 0.4346, test_loss: 0.9194, test_f1: 0.6763
 epoch: 63, train_loss: 0.4301, test_loss: 1.0013, test_f1: 0.6743
 epoch: 64, train_loss: 0.4366, test_loss: 1.0182, test_f1: 0.6762
 epoch: 65, train_loss: 0.4385, test_loss: 1.0484, test_f1: 0.6343
 epoch: 66, train_loss: 0.4442, test_loss: 1.0484, test_f1: 0.6922
 epoch: 67, train_loss: 0.4411, test_loss: 0.9752, test_f1: 0.6596
 epoch: 68, train_loss: 0.4275, test_loss: 1.0482, test_f1: 0.6499
 epoch: 69, train_loss: 0.4338, test_loss: 1.0477, test_f1: 0.6589
 epoch: 70, train_loss: 0.4403, test_loss: 1.0944, test_f1: 0.6568
 epoch: 71, train_loss: 0.4282, test_loss: 1.1270, test_f1: 0.6486
 epoch: 72, train_loss: 0.4169, test_loss: 1.1144, test_f1: 0.6546
 epoch: 73, train_loss: 0.3879, test_loss: 1.1226, test_f1: 0.6634
 epoch: 74, train_loss: 0.3998, test_loss: 0.9995, test_f1: 0.6606
 epoch: 75, train_loss: 0.4045, test_loss: 1.1787, test_f1: 0.6566
 epoch: 76, train_loss: 0.3948, test_loss: 1.2985, test_f1: 0.6523
 epoch: 77, train_loss: 0.4188, test_loss: 1.2261, test_f1: 0.6405
 epoch: 78, train_loss: 0.4101, test_loss: 1.1695, test_f1: 0.6617
 epoch: 79, train_loss: 0.4084, test_loss: 1.2041, test_f1: 0.6364
 epoch: 80, train_loss: 0.4203, test_loss: 0.9955, test_f1: 0.6395
 epoch: 81, train_loss: 0.4079, test_loss: 0.9591, test_f1: 0.6241
 epoch: 82, train_loss: 0.3938, test_loss: 1.0743, test_f1: 0.6519
 epoch: 83, train_loss: 0.3931, test_loss: 1.0146, test_f1: 0.6584
 epoch: 84, train_loss: 0.3677, test_loss: 1.2742, test_f1: 0.6264
 epoch: 85, train_loss: 0.3559, test_loss: 1.1836, test_f1: 0.6720
 epoch: 86, train_loss: 0.3568, test_loss: 1.0458, test_f1: 0.6798
 epoch: 87, train_loss: 0.3511, test_loss: 1.1432, test_f1: 0.6579
 epoch: 88, train_loss: 0.3521, test_loss: 1.1441, test_f1: 0.6444
 epoch: 89, train_loss: 0.3645, test_loss: 0.9016, test_f1: 0.6766
 epoch: 90, train_loss: 0.3752, test_loss: 1.0443, test_f1: 0.6398
 epoch: 91, train_loss: 0.3761, test_loss: 1.1098, test_f1: 0.6744
 epoch: 92, train_loss: 0.3641, test_loss: 1.2513, test_f1: 0.6096
 epoch: 93, train_loss: 0.3564, test_loss: 1.2817, test_f1: 0.6608
 epoch: 94, train_loss: 0.3548, test_loss: 1.1703, test_f1: 0.6722
 epoch: 95, train_loss: 0.3449, test_loss: 1.1739, test_f1: 0.6693
 epoch: 96, train_loss: 0.3258, test_loss: 1.2949, test_f1: 0.6299
 epoch: 97, train_loss: 0.3217, test_loss: 1.2048, test_f1: 0.6526
 epoch: 98, train_loss: 0.3323, test_loss: 1.3919, test_f1: 0.6263
 epoch: 99, train_loss: 0.3470, test_loss: 1.1692, test_f1: 0.6125
##################ITERATION #9 ****************************************
 epoch: 0, train_loss: 1.5089, test_loss: 1.8202, test_f1: 0.2670
 epoch: 1, train_loss: 1.0387, test_loss: 1.1482, test_f1: 0.3831
 epoch: 2, train_loss: 0.9974, test_loss: 1.0823, test_f1: 0.3854
 epoch: 3, train_loss: 0.9687, test_loss: 1.0067, test_f1: 0.4844
 epoch: 4, train_loss: 0.9432, test_loss: 0.9591, test_f1: 0.5027
 epoch: 5, train_loss: 0.9232, test_loss: 0.9323, test_f1: 0.5207
 epoch: 6, train_loss: 0.9124, test_loss: 1.0049, test_f1: 0.5629
 epoch: 7, train_loss: 0.8957, test_loss: 0.8813, test_f1: 0.5598
 epoch: 8, train_loss: 0.8924, test_loss: 0.9229, test_f1: 0.5684
 epoch: 9, train_loss: 0.8765, test_loss: 0.9204, test_f1: 0.5596
 epoch: 10, train_loss: 0.8768, test_loss: 0.8561, test_f1: 0.5763
 epoch: 11, train_loss: 0.8625, test_loss: 0.9049, test_f1: 0.5623
 epoch: 12, train_loss: 0.8446, test_loss: 0.9629, test_f1: 0.5298
 epoch: 13, train_loss: 0.8286, test_loss: 0.9960, test_f1: 0.5487
 epoch: 14, train_loss: 0.8322, test_loss: 0.9239, test_f1: 0.5513
 epoch: 15, train_loss: 0.8090, test_loss: 0.9070, test_f1: 0.5834
 epoch: 16, train_loss: 0.8091, test_loss: 0.8556, test_f1: 0.5903
 epoch: 17, train_loss: 0.7887, test_loss: 0.8403, test_f1: 0.6133
 epoch: 18, train_loss: 0.7681, test_loss: 0.7844, test_f1: 0.6359
 epoch: 19, train_loss: 0.7714, test_loss: 0.9166, test_f1: 0.5910
 epoch: 20, train_loss: 0.7647, test_loss: 0.9518, test_f1: 0.5873
 epoch: 21, train_loss: 0.7448, test_loss: 0.7769, test_f1: 0.6255
 epoch: 22, train_loss: 0.7512, test_loss: 0.8935, test_f1: 0.5999
 epoch: 23, train_loss: 0.7231, test_loss: 0.8790, test_f1: 0.6182
 epoch: 24, train_loss: 0.7216, test_loss: 0.8242, test_f1: 0.5897
 epoch: 25, train_loss: 0.7102, test_loss: 2.4991, test_f1: 0.2598
 epoch: 26, train_loss: 0.6876, test_loss: 0.7885, test_f1: 0.6164
 epoch: 27, train_loss: 0.6855, test_loss: 0.8468, test_f1: 0.6086
 epoch: 28, train_loss: 0.6750, test_loss: 0.7912, test_f1: 0.6117
 epoch: 29, train_loss: 0.6513, test_loss: 0.8162, test_f1: 0.6090
 epoch: 30, train_loss: 0.6598, test_loss: 1.1185, test_f1: 0.4931
 epoch: 31, train_loss: 0.6634, test_loss: 0.8148, test_f1: 0.6288
 epoch: 32, train_loss: 0.6568, test_loss: 0.8975, test_f1: 0.6094
 epoch: 33, train_loss: 0.6403, test_loss: 0.8465, test_f1: 0.6215
 epoch: 34, train_loss: 0.6477, test_loss: 0.8003, test_f1: 0.6432
 epoch: 35, train_loss: 0.6153, test_loss: 0.8502, test_f1: 0.6260
 epoch: 36, train_loss: 0.6197, test_loss: 0.7786, test_f1: 0.6519
 epoch: 37, train_loss: 0.6249, test_loss: 0.7354, test_f1: 0.6506
 epoch: 38, train_loss: 0.6080, test_loss: 0.9107, test_f1: 0.5906
 epoch: 39, train_loss: 0.5919, test_loss: 0.8544, test_f1: 0.6194
 epoch: 40, train_loss: 0.6096, test_loss: 0.7843, test_f1: 0.6218
 epoch: 41, train_loss: 0.5804, test_loss: 0.9841, test_f1: 0.5725
 epoch: 42, train_loss: 0.5523, test_loss: 0.8715, test_f1: 0.6032
 epoch: 43, train_loss: 0.5545, test_loss: 0.8865, test_f1: 0.6408
 epoch: 44, train_loss: 0.5833, test_loss: 1.2812, test_f1: 0.5435
 epoch: 45, train_loss: 0.5666, test_loss: 0.7535, test_f1: 0.6540
 epoch: 46, train_loss: 0.5492, test_loss: 0.7979, test_f1: 0.6417
 epoch: 47, train_loss: 0.5642, test_loss: 0.7676, test_f1: 0.6309
 epoch: 48, train_loss: 0.5628, test_loss: 0.9697, test_f1: 0.5673
 epoch: 49, train_loss: 0.5304, test_loss: 0.8716, test_f1: 0.6241
 epoch: 50, train_loss: 0.5477, test_loss: 1.1938, test_f1: 0.6134
 epoch: 51, train_loss: 0.4998, test_loss: 0.8134, test_f1: 0.6503
 epoch: 52, train_loss: 0.4636, test_loss: 0.8666, test_f1: 0.6541
 epoch: 53, train_loss: 0.4500, test_loss: 0.8721, test_f1: 0.6548
 epoch: 54, train_loss: 0.4220, test_loss: 0.8855, test_f1: 0.6461
 epoch: 55, train_loss: 0.4298, test_loss: 0.9456, test_f1: 0.6471
 epoch: 56, train_loss: 0.4113, test_loss: 0.9739, test_f1: 0.6668
 epoch: 57, train_loss: 0.3927, test_loss: 1.0589, test_f1: 0.6533
 epoch: 58, train_loss: 0.3872, test_loss: 0.9123, test_f1: 0.6662
 epoch: 59, train_loss: 0.3878, test_loss: 0.9944, test_f1: 0.6708
 epoch: 60, train_loss: 0.3858, test_loss: 0.9884, test_f1: 0.6572
 epoch: 61, train_loss: 0.3857, test_loss: 0.9229, test_f1: 0.6474
 epoch: 62, train_loss: 0.4054, test_loss: 0.9595, test_f1: 0.6814
 epoch: 63, train_loss: 0.3913, test_loss: 1.0117, test_f1: 0.6724
 epoch: 64, train_loss: 0.3652, test_loss: 1.1437, test_f1: 0.6501
 epoch: 65, train_loss: 0.3838, test_loss: 1.3078, test_f1: 0.6340
 epoch: 66, train_loss: 0.3780, test_loss: 1.0219, test_f1: 0.6476
 epoch: 67, train_loss: 0.3785, test_loss: 1.0670, test_f1: 0.6245
 epoch: 68, train_loss: 0.3992, test_loss: 1.0410, test_f1: 0.6681
 epoch: 69, train_loss: 0.3861, test_loss: 1.1479, test_f1: 0.6311
 epoch: 70, train_loss: 0.3588, test_loss: 0.9912, test_f1: 0.6410
 epoch: 71, train_loss: 0.3764, test_loss: 0.8763, test_f1: 0.6841
 epoch: 72, train_loss: 0.3716, test_loss: 1.0920, test_f1: 0.6869
 epoch: 73, train_loss: 0.3561, test_loss: 1.2516, test_f1: 0.6577
 epoch: 74, train_loss: 0.3527, test_loss: 1.2507, test_f1: 0.6255
 epoch: 75, train_loss: 0.3269, test_loss: 1.1772, test_f1: 0.6305
 epoch: 76, train_loss: 0.3107, test_loss: 1.2409, test_f1: 0.6607
 epoch: 77, train_loss: 0.3258, test_loss: 1.0054, test_f1: 0.6528
 epoch: 78, train_loss: 0.3223, test_loss: 1.1611, test_f1: 0.6578
 epoch: 79, train_loss: 0.3559, test_loss: 1.0069, test_f1: 0.6640
 epoch: 80, train_loss: 0.3360, test_loss: 0.9108, test_f1: 0.6828
 epoch: 81, train_loss: 0.3199, test_loss: 1.0394, test_f1: 0.6690
 epoch: 82, train_loss: 0.3038, test_loss: 0.9946, test_f1: 0.6949
 epoch: 83, train_loss: 0.3180, test_loss: 1.0284, test_f1: 0.6357
 epoch: 84, train_loss: 0.3134, test_loss: 1.1038, test_f1: 0.6653
 epoch: 85, train_loss: 0.3013, test_loss: 1.1048, test_f1: 0.6240
 epoch: 86, train_loss: 0.3044, test_loss: 1.3046, test_f1: 0.6314
 epoch: 87, train_loss: 0.2765, test_loss: 1.0004, test_f1: 0.6804
 epoch: 88, train_loss: 0.2933, test_loss: 1.0767, test_f1: 0.6815
 epoch: 89, train_loss: 0.2991, test_loss: 1.3465, test_f1: 0.6355
 epoch: 90, train_loss: 0.2635, test_loss: 1.3278, test_f1: 0.6431
 epoch: 91, train_loss: 0.2899, test_loss: 1.3897, test_f1: 0.6730
 epoch: 92, train_loss: 0.2937, test_loss: 1.3034, test_f1: 0.6403
 epoch: 93, train_loss: 0.2782, test_loss: 1.1723, test_f1: 0.6710
 epoch: 94, train_loss: 0.2992, test_loss: 1.2980, test_f1: 0.6415
 epoch: 95, train_loss: 0.3007, test_loss: 1.3433, test_f1: 0.6453
 epoch: 96, train_loss: 0.2769, test_loss: 1.3442, test_f1: 0.6561
 epoch: 97, train_loss: 0.2575, test_loss: 1.4376, test_f1: 0.6517
 epoch: 98, train_loss: 0.2896, test_loss: 1.1812, test_f1: 0.6701
 epoch: 99, train_loss: 0.2983, test_loss: 1.2562, test_f1: 0.6513

Training completed in 499.06 seconds
Best F1: 0.7068 at epoch 58
Mean F1 across iterations: 0.6928  0.0079
========================FINAL RESULTS================================
FEGIN weighted F1: 0.7068  0.0079
python main.py --data ltspice_examples --representation component_pin_net --model FEGIN --layers 5 --hiddens 128 --batch_size 256 --lr 0.01 --emb_size 512 --epochs 100 --save_appendix component_pin_net_L5_H128_BS256_LR0.01_E512 --no_val
-----



STDERR:
  File "main.py", line 370, in <module>
    main()
  File "main.py", line 254, in main
    dataset = dataset_class(
  File "/home/philip/projects/ltspice_examples_code_repo/Circuit-Completion-Using-GNNs/component_classification_with_link_prediction_head/evaluation/FEGIN/kernel/circuit_datasets.py", line 15, in __init__
    self.data, self.slices = torch.load(self.processed_paths[0])
  File "/home/philip/.local/lib/python3.8/site-packages/torch/serialization.py", line 1040, in load
    warnings.warn(
  File "/usr/lib/python3.8/warnings.py", line 109, in _showwarnmsg
    sw(msg.message, msg.category, msg.filename, msg.lineno,
  File "main.py", line 47, in warn_with_traceback
    traceback.print_stack(file=log)
/home/philip/projects/ltspice_examples_code_repo/Circuit-Completion-Using-GNNs/component_classification_with_link_prediction_head/evaluation/FEGIN/kernel/circuit_datasets.py:15: FutureWarning: You are using `torch.load` with `weights_only=False` (the current default value), which uses the default pickle module implicitly. It is possible to construct malicious pickle data which will execute arbitrary code during unpickling (See https://github.com/pytorch/pytorch/blob/main/SECURITY.md#untrusted-models for more details). In a future release, the default value for `weights_only` will be flipped to `True`. This limits the functions that could be executed during unpickling. Arbitrary objects will no longer be allowed to be loaded via this mode unless they are explicitly allowlisted by the user via `torch.serialization.add_safe_globals`. We recommend you start setting `weights_only=True` for any use case where you don't have full control of the loaded file. Please open an issue on GitHub for any issues related to this experimental feature.
  self.data, self.slices = torch.load(self.processed_paths[0])
