STDOUT:
Results will be saved in /home/philip/projects/ltspice_examples_code_repo/Circuit-Completion-Using-GNNs/component_classification_with_link_prediction_head/evaluation/FEGIN/results/model_FEGIN_dataset_ltspice_examples
Command line input: python main.py --data ltspice_examples --representation component_component --model FEGIN --layers 5 --hiddens 32 --batch_size 64 --lr 0.01 --emb_size 128 --epochs 100 --save_appendix component_component_L5_H32_BS64_LR0.01_E128 --no_val
 is saved.
-----
ltspice_examples - FEGIN
Using 5 layers, 32 hidden units, h = 2
Loading component_component representation dataset
ENTERED
Training FEGIN on component_component representation
Train: 3556, Test: 845
##################ITERATION #0 ****************************************
 epoch: 0, train_loss: 1.2648, test_loss: 1.3822, test_f1: 0.2630
 epoch: 1, train_loss: 1.1836, test_loss: 1.1043, test_f1: 0.4357
 epoch: 2, train_loss: 1.1317, test_loss: 1.1813, test_f1: 0.3722
 epoch: 3, train_loss: 1.0728, test_loss: 1.0275, test_f1: 0.4557
 epoch: 4, train_loss: 1.0559, test_loss: 0.9734, test_f1: 0.4687
 epoch: 5, train_loss: 1.0413, test_loss: 0.9670, test_f1: 0.4863
 epoch: 6, train_loss: 1.0147, test_loss: 0.9673, test_f1: 0.5412
 epoch: 7, train_loss: 1.0035, test_loss: 0.9346, test_f1: 0.5535
 epoch: 8, train_loss: 0.9751, test_loss: 1.0044, test_f1: 0.5254
 epoch: 9, train_loss: 0.9616, test_loss: 1.0110, test_f1: 0.4884
 epoch: 10, train_loss: 0.9516, test_loss: 0.9986, test_f1: 0.4945
 epoch: 11, train_loss: 0.9541, test_loss: 0.9571, test_f1: 0.4948
 epoch: 12, train_loss: 0.9577, test_loss: 1.0329, test_f1: 0.5439
 epoch: 13, train_loss: 0.9416, test_loss: 0.8633, test_f1: 0.5200
 epoch: 14, train_loss: 0.9474, test_loss: 1.0519, test_f1: 0.5023
 epoch: 15, train_loss: 0.9207, test_loss: 0.9975, test_f1: 0.5215
 epoch: 16, train_loss: 0.9256, test_loss: 1.1856, test_f1: 0.4566
 epoch: 17, train_loss: 0.9364, test_loss: 0.9401, test_f1: 0.4975
 epoch: 18, train_loss: 0.9632, test_loss: 1.0176, test_f1: 0.4880
 epoch: 19, train_loss: 0.9254, test_loss: 1.0518, test_f1: 0.4846
 epoch: 20, train_loss: 0.9123, test_loss: 1.0689, test_f1: 0.5291
 epoch: 21, train_loss: 0.9041, test_loss: 1.0576, test_f1: 0.4938
 epoch: 22, train_loss: 0.8843, test_loss: 1.0982, test_f1: 0.5048
 epoch: 23, train_loss: 0.8912, test_loss: 0.9901, test_f1: 0.4950
 epoch: 24, train_loss: 0.8895, test_loss: 1.0087, test_f1: 0.5251
 epoch: 25, train_loss: 0.8726, test_loss: 0.9871, test_f1: 0.5142
 epoch: 26, train_loss: 0.8676, test_loss: 1.0474, test_f1: 0.5094
 epoch: 27, train_loss: 0.8781, test_loss: 0.9989, test_f1: 0.4949
 epoch: 28, train_loss: 0.8622, test_loss: 1.2255, test_f1: 0.4818
 epoch: 29, train_loss: 0.8590, test_loss: 0.9744, test_f1: 0.5145
 epoch: 30, train_loss: 0.8545, test_loss: 1.0276, test_f1: 0.5225
 epoch: 31, train_loss: 0.8445, test_loss: 1.0314, test_f1: 0.5433
 epoch: 32, train_loss: 0.8550, test_loss: 1.0891, test_f1: 0.4624
 epoch: 33, train_loss: 0.8409, test_loss: 1.0596, test_f1: 0.4990
 epoch: 34, train_loss: 0.8407, test_loss: 1.1573, test_f1: 0.4906
 epoch: 35, train_loss: 0.8387, test_loss: 1.3358, test_f1: 0.5113
 epoch: 36, train_loss: 0.8375, test_loss: 1.1950, test_f1: 0.5365
 epoch: 37, train_loss: 0.8235, test_loss: 1.0499, test_f1: 0.5540
 epoch: 38, train_loss: 0.8411, test_loss: 1.0577, test_f1: 0.5180
 epoch: 39, train_loss: 0.8163, test_loss: 1.0435, test_f1: 0.5509
 epoch: 40, train_loss: 0.8148, test_loss: 1.1297, test_f1: 0.5660
 epoch: 41, train_loss: 0.8304, test_loss: 1.1291, test_f1: 0.5332
 epoch: 42, train_loss: 0.8109, test_loss: 1.0831, test_f1: 0.5338
 epoch: 43, train_loss: 0.8087, test_loss: 1.2256, test_f1: 0.5085
 epoch: 44, train_loss: 0.8218, test_loss: 1.2219, test_f1: 0.5380
 epoch: 45, train_loss: 0.7999, test_loss: 1.1011, test_f1: 0.5602
 epoch: 46, train_loss: 0.8047, test_loss: 1.1464, test_f1: 0.5620
 epoch: 47, train_loss: 0.7997, test_loss: 1.2442, test_f1: 0.5201
 epoch: 48, train_loss: 0.7984, test_loss: 1.0258, test_f1: 0.5577
 epoch: 49, train_loss: 0.7927, test_loss: 1.0997, test_f1: 0.5546
 epoch: 50, train_loss: 0.7767, test_loss: 1.3411, test_f1: 0.5309
 epoch: 51, train_loss: 0.7642, test_loss: 1.1626, test_f1: 0.5439
 epoch: 52, train_loss: 0.7382, test_loss: 1.2178, test_f1: 0.5225
 epoch: 53, train_loss: 0.7332, test_loss: 1.0860, test_f1: 0.5749
 epoch: 54, train_loss: 0.7450, test_loss: 1.0822, test_f1: 0.5733
 epoch: 55, train_loss: 0.7283, test_loss: 1.1670, test_f1: 0.5768
 epoch: 56, train_loss: 0.7266, test_loss: 1.2361, test_f1: 0.5777
 epoch: 57, train_loss: 0.7331, test_loss: 1.2674, test_f1: 0.5239
 epoch: 58, train_loss: 0.7042, test_loss: 1.2343, test_f1: 0.5631
 epoch: 59, train_loss: 0.7118, test_loss: 1.1628, test_f1: 0.5725
 epoch: 60, train_loss: 0.7191, test_loss: 1.1356, test_f1: 0.5784
 epoch: 61, train_loss: 0.7041, test_loss: 1.1583, test_f1: 0.5558
 epoch: 62, train_loss: 0.7117, test_loss: 1.1862, test_f1: 0.5579
 epoch: 63, train_loss: 0.7154, test_loss: 1.1612, test_f1: 0.5758
 epoch: 64, train_loss: 0.6982, test_loss: 1.2021, test_f1: 0.5551
 epoch: 65, train_loss: 0.6932, test_loss: 1.2000, test_f1: 0.5362
 epoch: 66, train_loss: 0.6978, test_loss: 1.1854, test_f1: 0.5839
 epoch: 67, train_loss: 0.7122, test_loss: 1.1821, test_f1: 0.5628
 epoch: 68, train_loss: 0.6860, test_loss: 1.2928, test_f1: 0.5629
 epoch: 69, train_loss: 0.6874, test_loss: 1.1438, test_f1: 0.5760
 epoch: 70, train_loss: 0.6881, test_loss: 1.1644, test_f1: 0.5613
 epoch: 71, train_loss: 0.6739, test_loss: 1.2896, test_f1: 0.5435
 epoch: 72, train_loss: 0.6835, test_loss: 1.2671, test_f1: 0.5226
 epoch: 73, train_loss: 0.6729, test_loss: 1.1031, test_f1: 0.5717
 epoch: 74, train_loss: 0.6937, test_loss: 1.1977, test_f1: 0.5574
 epoch: 75, train_loss: 0.6855, test_loss: 1.0773, test_f1: 0.5698
 epoch: 76, train_loss: 0.6646, test_loss: 1.3594, test_f1: 0.5510
 epoch: 77, train_loss: 0.6891, test_loss: 1.1457, test_f1: 0.5718
 epoch: 78, train_loss: 0.6833, test_loss: 1.2727, test_f1: 0.5499
 epoch: 79, train_loss: 0.6729, test_loss: 1.2825, test_f1: 0.5539
 epoch: 80, train_loss: 0.6600, test_loss: 1.4367, test_f1: 0.5564
 epoch: 81, train_loss: 0.6610, test_loss: 1.2273, test_f1: 0.5815
 epoch: 82, train_loss: 0.6855, test_loss: 1.2099, test_f1: 0.5942
 epoch: 83, train_loss: 0.6773, test_loss: 1.2426, test_f1: 0.5664
 epoch: 84, train_loss: 0.6527, test_loss: 1.1482, test_f1: 0.5818
 epoch: 85, train_loss: 0.6385, test_loss: 1.2879, test_f1: 0.5602
 epoch: 86, train_loss: 0.6465, test_loss: 1.2994, test_f1: 0.5468
 epoch: 87, train_loss: 0.6654, test_loss: 1.1298, test_f1: 0.5800
 epoch: 88, train_loss: 0.6551, test_loss: 1.1931, test_f1: 0.5716
 epoch: 89, train_loss: 0.6345, test_loss: 1.3219, test_f1: 0.5576
 epoch: 90, train_loss: 0.6599, test_loss: 1.2107, test_f1: 0.5423
 epoch: 91, train_loss: 0.6506, test_loss: 1.2622, test_f1: 0.5882
 epoch: 92, train_loss: 0.6583, test_loss: 1.2648, test_f1: 0.5949
 epoch: 93, train_loss: 0.6333, test_loss: 1.3391, test_f1: 0.5751
 epoch: 94, train_loss: 0.6389, test_loss: 1.2713, test_f1: 0.5766
 epoch: 95, train_loss: 0.6336, test_loss: 1.4541, test_f1: 0.5448
 epoch: 96, train_loss: 0.6119, test_loss: 1.3521, test_f1: 0.5998
 epoch: 97, train_loss: 0.6384, test_loss: 1.2884, test_f1: 0.5676
 epoch: 98, train_loss: 0.6163, test_loss: 1.6374, test_f1: 0.5481
 epoch: 99, train_loss: 0.6409, test_loss: 1.3157, test_f1: 0.5649
##################ITERATION #1 ****************************************
 epoch: 0, train_loss: 1.2578, test_loss: 1.1655, test_f1: 0.3777
 epoch: 1, train_loss: 1.1743, test_loss: 1.0599, test_f1: 0.4271
 epoch: 2, train_loss: 1.1229, test_loss: 1.0263, test_f1: 0.4683
 epoch: 3, train_loss: 1.0912, test_loss: 0.9857, test_f1: 0.4814
 epoch: 4, train_loss: 1.0597, test_loss: 1.0644, test_f1: 0.4046
 epoch: 5, train_loss: 1.0454, test_loss: 0.9666, test_f1: 0.4684
 epoch: 6, train_loss: 1.0464, test_loss: 0.9270, test_f1: 0.5038
 epoch: 7, train_loss: 0.9987, test_loss: 0.9541, test_f1: 0.4984
 epoch: 8, train_loss: 0.9817, test_loss: 0.9836, test_f1: 0.5009
 epoch: 9, train_loss: 0.9809, test_loss: 0.9069, test_f1: 0.4815
 epoch: 10, train_loss: 0.9718, test_loss: 0.9098, test_f1: 0.4765
 epoch: 11, train_loss: 0.9454, test_loss: 0.8678, test_f1: 0.5066
 epoch: 12, train_loss: 0.9474, test_loss: 0.8999, test_f1: 0.4731
 epoch: 13, train_loss: 1.0162, test_loss: 0.9845, test_f1: 0.4611
 epoch: 14, train_loss: 0.9806, test_loss: 0.9871, test_f1: 0.4803
 epoch: 15, train_loss: 0.9511, test_loss: 1.0380, test_f1: 0.5000
 epoch: 16, train_loss: 0.9374, test_loss: 1.0004, test_f1: 0.5339
 epoch: 17, train_loss: 0.9360, test_loss: 0.8993, test_f1: 0.5045
 epoch: 18, train_loss: 0.9205, test_loss: 0.9662, test_f1: 0.5336
 epoch: 19, train_loss: 0.9059, test_loss: 0.9296, test_f1: 0.5225
 epoch: 20, train_loss: 0.8955, test_loss: 0.9998, test_f1: 0.5190
 epoch: 21, train_loss: 0.8981, test_loss: 0.8317, test_f1: 0.5515
 epoch: 22, train_loss: 0.8826, test_loss: 0.9567, test_f1: 0.4998
 epoch: 23, train_loss: 0.9066, test_loss: 0.9606, test_f1: 0.5085
 epoch: 24, train_loss: 0.8889, test_loss: 0.9803, test_f1: 0.5217
 epoch: 25, train_loss: 0.8847, test_loss: 0.8363, test_f1: 0.5513
 epoch: 26, train_loss: 0.8930, test_loss: 0.8360, test_f1: 0.5542
 epoch: 27, train_loss: 0.8619, test_loss: 0.9244, test_f1: 0.5290
 epoch: 28, train_loss: 0.8633, test_loss: 0.9080, test_f1: 0.5586
 epoch: 29, train_loss: 0.8536, test_loss: 0.9479, test_f1: 0.5638
 epoch: 30, train_loss: 0.8610, test_loss: 0.9767, test_f1: 0.5303
 epoch: 31, train_loss: 0.8358, test_loss: 0.9477, test_f1: 0.5317
 epoch: 32, train_loss: 0.8574, test_loss: 0.9445, test_f1: 0.5358
 epoch: 33, train_loss: 0.8430, test_loss: 1.0183, test_f1: 0.5429
 epoch: 34, train_loss: 0.8484, test_loss: 1.0324, test_f1: 0.5080
 epoch: 35, train_loss: 0.8441, test_loss: 0.9391, test_f1: 0.5582
 epoch: 36, train_loss: 0.8461, test_loss: 0.9654, test_f1: 0.5440
 epoch: 37, train_loss: 0.8264, test_loss: 0.9931, test_f1: 0.5008
 epoch: 38, train_loss: 0.8511, test_loss: 0.9688, test_f1: 0.5834
 epoch: 39, train_loss: 0.8275, test_loss: 1.0554, test_f1: 0.5247
 epoch: 40, train_loss: 0.8289, test_loss: 1.0015, test_f1: 0.5616
 epoch: 41, train_loss: 0.8412, test_loss: 0.9842, test_f1: 0.5380
 epoch: 42, train_loss: 0.8228, test_loss: 0.9141, test_f1: 0.5517
 epoch: 43, train_loss: 0.8043, test_loss: 0.9496, test_f1: 0.5710
 epoch: 44, train_loss: 0.8048, test_loss: 0.9651, test_f1: 0.5826
 epoch: 45, train_loss: 0.8368, test_loss: 0.9287, test_f1: 0.5547
 epoch: 46, train_loss: 0.8157, test_loss: 0.9148, test_f1: 0.5667
 epoch: 47, train_loss: 0.8027, test_loss: 0.9417, test_f1: 0.5472
 epoch: 48, train_loss: 0.8100, test_loss: 0.9983, test_f1: 0.5685
 epoch: 49, train_loss: 0.7990, test_loss: 0.8955, test_f1: 0.5655
 epoch: 50, train_loss: 0.7914, test_loss: 0.8708, test_f1: 0.5766
 epoch: 51, train_loss: 0.7768, test_loss: 0.9309, test_f1: 0.5807
 epoch: 52, train_loss: 0.7413, test_loss: 0.9525, test_f1: 0.5727
 epoch: 53, train_loss: 0.7446, test_loss: 0.9489, test_f1: 0.5989
 epoch: 54, train_loss: 0.7349, test_loss: 0.9825, test_f1: 0.5673
 epoch: 55, train_loss: 0.7199, test_loss: 0.9187, test_f1: 0.6022
 epoch: 56, train_loss: 0.7369, test_loss: 1.0070, test_f1: 0.6041
 epoch: 57, train_loss: 0.7183, test_loss: 0.9264, test_f1: 0.5879
 epoch: 58, train_loss: 0.7200, test_loss: 0.9874, test_f1: 0.5697
 epoch: 59, train_loss: 0.7269, test_loss: 0.9520, test_f1: 0.5895
 epoch: 60, train_loss: 0.7123, test_loss: 0.9205, test_f1: 0.5929
 epoch: 61, train_loss: 0.7309, test_loss: 0.9528, test_f1: 0.5846
 epoch: 62, train_loss: 0.7293, test_loss: 0.9800, test_f1: 0.5742
 epoch: 63, train_loss: 0.7124, test_loss: 0.9438, test_f1: 0.5807
 epoch: 64, train_loss: 0.7167, test_loss: 0.9312, test_f1: 0.5943
 epoch: 65, train_loss: 0.7118, test_loss: 0.9331, test_f1: 0.5855
 epoch: 66, train_loss: 0.6922, test_loss: 0.9255, test_f1: 0.5911
 epoch: 67, train_loss: 0.7085, test_loss: 0.9442, test_f1: 0.5709
 epoch: 68, train_loss: 0.6969, test_loss: 1.0751, test_f1: 0.5588
 epoch: 69, train_loss: 0.6918, test_loss: 0.9825, test_f1: 0.5660
 epoch: 70, train_loss: 0.7079, test_loss: 0.9652, test_f1: 0.5838
 epoch: 71, train_loss: 0.6957, test_loss: 0.9718, test_f1: 0.5747
 epoch: 72, train_loss: 0.7176, test_loss: 1.0225, test_f1: 0.5609
 epoch: 73, train_loss: 0.6867, test_loss: 0.9991, test_f1: 0.5775
 epoch: 74, train_loss: 0.6905, test_loss: 1.0167, test_f1: 0.5883
 epoch: 75, train_loss: 0.6754, test_loss: 0.9804, test_f1: 0.5704
 epoch: 76, train_loss: 0.6751, test_loss: 1.0326, test_f1: 0.5670
 epoch: 77, train_loss: 0.6615, test_loss: 0.9882, test_f1: 0.5933
 epoch: 78, train_loss: 0.6631, test_loss: 1.0618, test_f1: 0.5731
 epoch: 79, train_loss: 0.6875, test_loss: 0.9370, test_f1: 0.5703
 epoch: 80, train_loss: 0.6733, test_loss: 1.1042, test_f1: 0.5831
 epoch: 81, train_loss: 0.6635, test_loss: 1.0415, test_f1: 0.5620
 epoch: 82, train_loss: 0.6570, test_loss: 1.0129, test_f1: 0.5700
 epoch: 83, train_loss: 0.6639, test_loss: 0.9726, test_f1: 0.5608
 epoch: 84, train_loss: 0.6721, test_loss: 0.9949, test_f1: 0.5596
 epoch: 85, train_loss: 0.6699, test_loss: 0.9063, test_f1: 0.5927
 epoch: 86, train_loss: 0.6635, test_loss: 1.0347, test_f1: 0.5782
 epoch: 87, train_loss: 0.6365, test_loss: 0.9553, test_f1: 0.5618
 epoch: 88, train_loss: 0.6644, test_loss: 0.9943, test_f1: 0.5735
 epoch: 89, train_loss: 0.6422, test_loss: 1.0632, test_f1: 0.5889
 epoch: 90, train_loss: 0.6473, test_loss: 1.0068, test_f1: 0.5618
 epoch: 91, train_loss: 0.6554, test_loss: 1.0407, test_f1: 0.5574
 epoch: 92, train_loss: 0.6366, test_loss: 1.0470, test_f1: 0.5740
 epoch: 93, train_loss: 0.6532, test_loss: 1.1034, test_f1: 0.5828
 epoch: 94, train_loss: 0.6472, test_loss: 0.9782, test_f1: 0.5449
 epoch: 95, train_loss: 0.6377, test_loss: 1.0771, test_f1: 0.5365
 epoch: 96, train_loss: 0.6404, test_loss: 1.0536, test_f1: 0.5671
 epoch: 97, train_loss: 0.6317, test_loss: 1.0422, test_f1: 0.5738
 epoch: 98, train_loss: 0.6489, test_loss: 1.1122, test_f1: 0.5404
 epoch: 99, train_loss: 0.6249, test_loss: 1.0409, test_f1: 0.5632
##################ITERATION #2 ****************************************
 epoch: 0, train_loss: 1.3012, test_loss: 1.2245, test_f1: 0.3295
 epoch: 1, train_loss: 1.2041, test_loss: 1.1196, test_f1: 0.4441
 epoch: 2, train_loss: 1.1442, test_loss: 1.0396, test_f1: 0.4826
 epoch: 3, train_loss: 1.1083, test_loss: 1.0241, test_f1: 0.4534
 epoch: 4, train_loss: 1.0661, test_loss: 1.0153, test_f1: 0.4422
 epoch: 5, train_loss: 1.0392, test_loss: 0.9481, test_f1: 0.4837
 epoch: 6, train_loss: 1.0097, test_loss: 0.9211, test_f1: 0.5041
 epoch: 7, train_loss: 0.9939, test_loss: 1.0009, test_f1: 0.4596
 epoch: 8, train_loss: 0.9722, test_loss: 0.9756, test_f1: 0.5009
 epoch: 9, train_loss: 0.9691, test_loss: 0.9993, test_f1: 0.4980
 epoch: 10, train_loss: 0.9407, test_loss: 0.9829, test_f1: 0.4962
 epoch: 11, train_loss: 0.9384, test_loss: 0.9673, test_f1: 0.4973
 epoch: 12, train_loss: 0.9501, test_loss: 0.9310, test_f1: 0.4913
 epoch: 13, train_loss: 0.9341, test_loss: 0.9024, test_f1: 0.4895
 epoch: 14, train_loss: 0.9286, test_loss: 0.9755, test_f1: 0.5102
 epoch: 15, train_loss: 0.9069, test_loss: 0.9834, test_f1: 0.5185
 epoch: 16, train_loss: 0.8982, test_loss: 0.9108, test_f1: 0.5430
 epoch: 17, train_loss: 0.8985, test_loss: 0.9491, test_f1: 0.4992
 epoch: 18, train_loss: 0.8965, test_loss: 1.0416, test_f1: 0.5235
 epoch: 19, train_loss: 0.8762, test_loss: 0.9724, test_f1: 0.5394
 epoch: 20, train_loss: 0.8901, test_loss: 1.1050, test_f1: 0.4724
 epoch: 21, train_loss: 0.8731, test_loss: 1.0185, test_f1: 0.5013
 epoch: 22, train_loss: 0.8794, test_loss: 1.0445, test_f1: 0.4937
 epoch: 23, train_loss: 0.8588, test_loss: 1.1166, test_f1: 0.4873
 epoch: 24, train_loss: 0.8962, test_loss: 0.9584, test_f1: 0.4932
 epoch: 25, train_loss: 0.8669, test_loss: 0.9733, test_f1: 0.5107
 epoch: 26, train_loss: 0.8477, test_loss: 1.0518, test_f1: 0.5364
 epoch: 27, train_loss: 0.8560, test_loss: 1.1462, test_f1: 0.4594
 epoch: 28, train_loss: 0.8508, test_loss: 1.1011, test_f1: 0.5210
 epoch: 29, train_loss: 0.8444, test_loss: 1.0889, test_f1: 0.4974
 epoch: 30, train_loss: 0.8309, test_loss: 0.9945, test_f1: 0.5121
 epoch: 31, train_loss: 0.8534, test_loss: 0.9951, test_f1: 0.4838
 epoch: 32, train_loss: 0.8255, test_loss: 1.0226, test_f1: 0.5127
 epoch: 33, train_loss: 0.8192, test_loss: 1.1432, test_f1: 0.5310
 epoch: 34, train_loss: 0.8365, test_loss: 0.9787, test_f1: 0.5140
 epoch: 35, train_loss: 0.8335, test_loss: 1.0496, test_f1: 0.5141
 epoch: 36, train_loss: 0.8136, test_loss: 0.9118, test_f1: 0.5323
 epoch: 37, train_loss: 0.8148, test_loss: 0.9500, test_f1: 0.5363
 epoch: 38, train_loss: 0.8064, test_loss: 1.0045, test_f1: 0.5328
 epoch: 39, train_loss: 0.7931, test_loss: 0.9672, test_f1: 0.5248
 epoch: 40, train_loss: 0.8074, test_loss: 1.0819, test_f1: 0.5223
 epoch: 41, train_loss: 0.8050, test_loss: 1.0246, test_f1: 0.5000
 epoch: 42, train_loss: 0.7951, test_loss: 1.3141, test_f1: 0.5055
 epoch: 43, train_loss: 0.8081, test_loss: 1.0344, test_f1: 0.5215
 epoch: 44, train_loss: 0.7797, test_loss: 1.0543, test_f1: 0.5175
 epoch: 45, train_loss: 0.7912, test_loss: 1.0899, test_f1: 0.5503
 epoch: 46, train_loss: 0.7985, test_loss: 1.2313, test_f1: 0.5154
 epoch: 47, train_loss: 0.7725, test_loss: 1.1724, test_f1: 0.4916
 epoch: 48, train_loss: 0.7909, test_loss: 0.9675, test_f1: 0.5441
 epoch: 49, train_loss: 0.7910, test_loss: 1.0404, test_f1: 0.5486
 epoch: 50, train_loss: 0.7728, test_loss: 1.1313, test_f1: 0.5226
 epoch: 51, train_loss: 0.7538, test_loss: 1.1087, test_f1: 0.5417
 epoch: 52, train_loss: 0.7400, test_loss: 1.0258, test_f1: 0.5719
 epoch: 53, train_loss: 0.7313, test_loss: 1.0588, test_f1: 0.5697
 epoch: 54, train_loss: 0.7280, test_loss: 1.1060, test_f1: 0.5573
 epoch: 55, train_loss: 0.7234, test_loss: 1.0027, test_f1: 0.5750
 epoch: 56, train_loss: 0.7144, test_loss: 1.0475, test_f1: 0.6025
 epoch: 57, train_loss: 0.7066, test_loss: 1.0566, test_f1: 0.5823
 epoch: 58, train_loss: 0.7153, test_loss: 1.2168, test_f1: 0.5832
 epoch: 59, train_loss: 0.7145, test_loss: 1.0983, test_f1: 0.5722
 epoch: 60, train_loss: 0.7040, test_loss: 1.2370, test_f1: 0.5304
 epoch: 61, train_loss: 0.7282, test_loss: 1.2147, test_f1: 0.5405
 epoch: 62, train_loss: 0.7077, test_loss: 1.0059, test_f1: 0.5642
 epoch: 63, train_loss: 0.7045, test_loss: 1.0813, test_f1: 0.5742
 epoch: 64, train_loss: 0.7017, test_loss: 1.1063, test_f1: 0.5458
 epoch: 65, train_loss: 0.6844, test_loss: 0.9985, test_f1: 0.5641
 epoch: 66, train_loss: 0.6992, test_loss: 1.0429, test_f1: 0.5626
 epoch: 67, train_loss: 0.7202, test_loss: 1.1575, test_f1: 0.5571
 epoch: 68, train_loss: 0.6903, test_loss: 1.1262, test_f1: 0.5952
 epoch: 69, train_loss: 0.7000, test_loss: 1.0716, test_f1: 0.5891
 epoch: 70, train_loss: 0.7093, test_loss: 1.1197, test_f1: 0.5702
 epoch: 71, train_loss: 0.6874, test_loss: 1.3920, test_f1: 0.5711
 epoch: 72, train_loss: 0.6832, test_loss: 1.2658, test_f1: 0.5779
 epoch: 73, train_loss: 0.6884, test_loss: 1.2827, test_f1: 0.5536
 epoch: 74, train_loss: 0.6797, test_loss: 1.3790, test_f1: 0.5225
 epoch: 75, train_loss: 0.6835, test_loss: 1.2077, test_f1: 0.5700
 epoch: 76, train_loss: 0.6775, test_loss: 1.1924, test_f1: 0.5698
 epoch: 77, train_loss: 0.6915, test_loss: 1.0556, test_f1: 0.6023
 epoch: 78, train_loss: 0.6850, test_loss: 1.0496, test_f1: 0.5947
 epoch: 79, train_loss: 0.6738, test_loss: 1.0491, test_f1: 0.5790
 epoch: 80, train_loss: 0.6749, test_loss: 1.1283, test_f1: 0.5733
 epoch: 81, train_loss: 0.6712, test_loss: 1.2499, test_f1: 0.5804
 epoch: 82, train_loss: 0.6687, test_loss: 1.1926, test_f1: 0.5823
 epoch: 83, train_loss: 0.6382, test_loss: 1.2019, test_f1: 0.5914
 epoch: 84, train_loss: 0.6514, test_loss: 1.1537, test_f1: 0.5945
 epoch: 85, train_loss: 0.6514, test_loss: 1.1498, test_f1: 0.5736
 epoch: 86, train_loss: 0.6476, test_loss: 1.2793, test_f1: 0.5700
 epoch: 87, train_loss: 0.6588, test_loss: 1.2899, test_f1: 0.5765
 epoch: 88, train_loss: 0.6595, test_loss: 1.2065, test_f1: 0.5667
 epoch: 89, train_loss: 0.6459, test_loss: 1.2471, test_f1: 0.5523
 epoch: 90, train_loss: 0.6359, test_loss: 1.1438, test_f1: 0.5818
 epoch: 91, train_loss: 0.6509, test_loss: 1.1244, test_f1: 0.5906
 epoch: 92, train_loss: 0.6476, test_loss: 1.3647, test_f1: 0.5586
 epoch: 93, train_loss: 0.6441, test_loss: 1.4118, test_f1: 0.5530
 epoch: 94, train_loss: 0.6331, test_loss: 1.2422, test_f1: 0.5873
 epoch: 95, train_loss: 0.6336, test_loss: 1.2529, test_f1: 0.5712
 epoch: 96, train_loss: 0.6485, test_loss: 1.1464, test_f1: 0.5649
 epoch: 97, train_loss: 0.6363, test_loss: 1.3299, test_f1: 0.5496
 epoch: 98, train_loss: 0.6366, test_loss: 1.5323, test_f1: 0.5640
 epoch: 99, train_loss: 0.6279, test_loss: 1.4705, test_f1: 0.5647
##################ITERATION #3 ****************************************
 epoch: 0, train_loss: 1.2832, test_loss: 1.2247, test_f1: 0.3427
 epoch: 1, train_loss: 1.2129, test_loss: 1.1744, test_f1: 0.3055
 epoch: 2, train_loss: 1.1847, test_loss: 1.1477, test_f1: 0.4003
 epoch: 3, train_loss: 1.1646, test_loss: 1.1031, test_f1: 0.4401
 epoch: 4, train_loss: 1.1252, test_loss: 1.0633, test_f1: 0.4736
 epoch: 5, train_loss: 1.1023, test_loss: 1.0095, test_f1: 0.4619
 epoch: 6, train_loss: 1.0661, test_loss: 0.9921, test_f1: 0.4524
 epoch: 7, train_loss: 1.0435, test_loss: 0.9467, test_f1: 0.4727
 epoch: 8, train_loss: 1.0255, test_loss: 1.0456, test_f1: 0.4190
 epoch: 9, train_loss: 1.0317, test_loss: 1.0042, test_f1: 0.4536
 epoch: 10, train_loss: 1.0209, test_loss: 1.0388, test_f1: 0.4594
 epoch: 11, train_loss: 1.0088, test_loss: 1.0598, test_f1: 0.4361
 epoch: 12, train_loss: 1.0044, test_loss: 1.0266, test_f1: 0.4555
 epoch: 13, train_loss: 0.9811, test_loss: 1.0029, test_f1: 0.4634
 epoch: 14, train_loss: 0.9643, test_loss: 0.9913, test_f1: 0.4722
 epoch: 15, train_loss: 0.9700, test_loss: 0.9898, test_f1: 0.4937
 epoch: 16, train_loss: 0.9603, test_loss: 1.0156, test_f1: 0.4942
 epoch: 17, train_loss: 0.9612, test_loss: 0.9754, test_f1: 0.4979
 epoch: 18, train_loss: 0.9343, test_loss: 1.0001, test_f1: 0.4995
 epoch: 19, train_loss: 0.9388, test_loss: 0.9519, test_f1: 0.5255
 epoch: 20, train_loss: 0.9389, test_loss: 0.9603, test_f1: 0.5126
 epoch: 21, train_loss: 0.9217, test_loss: 0.9809, test_f1: 0.5062
 epoch: 22, train_loss: 0.9082, test_loss: 0.9624, test_f1: 0.5016
 epoch: 23, train_loss: 0.9085, test_loss: 0.9188, test_f1: 0.5307
 epoch: 24, train_loss: 0.9056, test_loss: 0.9733, test_f1: 0.5369
 epoch: 25, train_loss: 0.8920, test_loss: 0.9566, test_f1: 0.5144
 epoch: 26, train_loss: 0.8916, test_loss: 0.9263, test_f1: 0.5474
 epoch: 27, train_loss: 0.8915, test_loss: 0.9712, test_f1: 0.4999
 epoch: 28, train_loss: 0.8906, test_loss: 0.9940, test_f1: 0.5125
 epoch: 29, train_loss: 0.8965, test_loss: 0.9668, test_f1: 0.5151
 epoch: 30, train_loss: 0.8700, test_loss: 1.0067, test_f1: 0.5293
 epoch: 31, train_loss: 0.8581, test_loss: 0.9192, test_f1: 0.5271
 epoch: 32, train_loss: 0.8693, test_loss: 0.9787, test_f1: 0.5276
 epoch: 33, train_loss: 0.8574, test_loss: 0.9270, test_f1: 0.5563
 epoch: 34, train_loss: 0.8528, test_loss: 0.9282, test_f1: 0.5547
 epoch: 35, train_loss: 0.8511, test_loss: 0.9377, test_f1: 0.5242
 epoch: 36, train_loss: 0.8461, test_loss: 0.9282, test_f1: 0.5572
 epoch: 37, train_loss: 0.8245, test_loss: 0.9140, test_f1: 0.5398
 epoch: 38, train_loss: 0.8210, test_loss: 0.9351, test_f1: 0.5710
 epoch: 39, train_loss: 0.8314, test_loss: 0.9584, test_f1: 0.5554
 epoch: 40, train_loss: 0.8319, test_loss: 0.8887, test_f1: 0.5546
 epoch: 41, train_loss: 0.8158, test_loss: 0.9704, test_f1: 0.5236
 epoch: 42, train_loss: 0.8107, test_loss: 1.0843, test_f1: 0.5221
 epoch: 43, train_loss: 0.8196, test_loss: 0.9178, test_f1: 0.5585
 epoch: 44, train_loss: 0.8228, test_loss: 0.9619, test_f1: 0.5448
 epoch: 45, train_loss: 0.8012, test_loss: 0.9647, test_f1: 0.5669
 epoch: 46, train_loss: 0.8143, test_loss: 0.9460, test_f1: 0.5626
 epoch: 47, train_loss: 0.8068, test_loss: 0.9907, test_f1: 0.5408
 epoch: 48, train_loss: 0.7911, test_loss: 1.0270, test_f1: 0.5470
 epoch: 49, train_loss: 0.7837, test_loss: 0.9678, test_f1: 0.5843
 epoch: 50, train_loss: 0.7932, test_loss: 0.9615, test_f1: 0.5298
 epoch: 51, train_loss: 0.7655, test_loss: 0.9648, test_f1: 0.5534
 epoch: 52, train_loss: 0.7325, test_loss: 0.9753, test_f1: 0.5733
 epoch: 53, train_loss: 0.7382, test_loss: 1.0059, test_f1: 0.5382
 epoch: 54, train_loss: 0.7278, test_loss: 0.9894, test_f1: 0.5801
 epoch: 55, train_loss: 0.7254, test_loss: 0.9426, test_f1: 0.5319
 epoch: 56, train_loss: 0.7335, test_loss: 0.8951, test_f1: 0.5749
 epoch: 57, train_loss: 0.7144, test_loss: 0.9013, test_f1: 0.5619
 epoch: 58, train_loss: 0.7205, test_loss: 0.9363, test_f1: 0.5793
 epoch: 59, train_loss: 0.7201, test_loss: 0.9325, test_f1: 0.5667
 epoch: 60, train_loss: 0.7094, test_loss: 0.8938, test_f1: 0.5720
 epoch: 61, train_loss: 0.7096, test_loss: 0.9751, test_f1: 0.5794
 epoch: 62, train_loss: 0.6982, test_loss: 0.9116, test_f1: 0.5806
 epoch: 63, train_loss: 0.7238, test_loss: 0.9030, test_f1: 0.5835
 epoch: 64, train_loss: 0.7172, test_loss: 0.9277, test_f1: 0.5908
 epoch: 65, train_loss: 0.7024, test_loss: 0.9752, test_f1: 0.5657
 epoch: 66, train_loss: 0.6987, test_loss: 0.9434, test_f1: 0.5976
 epoch: 67, train_loss: 0.7060, test_loss: 1.0004, test_f1: 0.5687
 epoch: 68, train_loss: 0.7081, test_loss: 0.9201, test_f1: 0.5834
 epoch: 69, train_loss: 0.6903, test_loss: 0.9728, test_f1: 0.5624
 epoch: 70, train_loss: 0.6789, test_loss: 1.0339, test_f1: 0.5699
 epoch: 71, train_loss: 0.6932, test_loss: 0.9930, test_f1: 0.5810
 epoch: 72, train_loss: 0.6885, test_loss: 1.0826, test_f1: 0.5491
 epoch: 73, train_loss: 0.6799, test_loss: 0.9048, test_f1: 0.5786
 epoch: 74, train_loss: 0.6817, test_loss: 0.9692, test_f1: 0.5912
 epoch: 75, train_loss: 0.6800, test_loss: 1.0030, test_f1: 0.5851
 epoch: 76, train_loss: 0.6719, test_loss: 1.0018, test_f1: 0.6029
 epoch: 77, train_loss: 0.6781, test_loss: 0.9388, test_f1: 0.5991
 epoch: 78, train_loss: 0.6817, test_loss: 0.9553, test_f1: 0.5898
 epoch: 79, train_loss: 0.6620, test_loss: 1.0939, test_f1: 0.5799
 epoch: 80, train_loss: 0.6669, test_loss: 1.0524, test_f1: 0.5706
 epoch: 81, train_loss: 0.6448, test_loss: 1.0453, test_f1: 0.5741
 epoch: 82, train_loss: 0.6744, test_loss: 1.1769, test_f1: 0.5627
 epoch: 83, train_loss: 0.6559, test_loss: 1.1195, test_f1: 0.5648
 epoch: 84, train_loss: 0.6578, test_loss: 0.9894, test_f1: 0.5939
 epoch: 85, train_loss: 0.6680, test_loss: 1.0526, test_f1: 0.5656
 epoch: 86, train_loss: 0.6465, test_loss: 0.9952, test_f1: 0.5815
 epoch: 87, train_loss: 0.6439, test_loss: 0.9907, test_f1: 0.5831
 epoch: 88, train_loss: 0.6589, test_loss: 1.0434, test_f1: 0.5494
 epoch: 89, train_loss: 0.6390, test_loss: 1.0397, test_f1: 0.5604
 epoch: 90, train_loss: 0.6458, test_loss: 1.0199, test_f1: 0.5759
 epoch: 91, train_loss: 0.6693, test_loss: 1.1297, test_f1: 0.5627
 epoch: 92, train_loss: 0.6495, test_loss: 0.9362, test_f1: 0.5978
 epoch: 93, train_loss: 0.6370, test_loss: 1.0332, test_f1: 0.5735
 epoch: 94, train_loss: 0.6329, test_loss: 1.1607, test_f1: 0.5664
 epoch: 95, train_loss: 0.6310, test_loss: 1.0073, test_f1: 0.5903
 epoch: 96, train_loss: 0.6356, test_loss: 1.0507, test_f1: 0.5856
 epoch: 97, train_loss: 0.6270, test_loss: 1.1405, test_f1: 0.5645
 epoch: 98, train_loss: 0.6298, test_loss: 1.0452, test_f1: 0.5912
 epoch: 99, train_loss: 0.6285, test_loss: 1.0752, test_f1: 0.5696
##################ITERATION #4 ****************************************
 epoch: 0, train_loss: 1.3208, test_loss: 1.1997, test_f1: 0.2944
 epoch: 1, train_loss: 1.2118, test_loss: 1.1292, test_f1: 0.4184
 epoch: 2, train_loss: 1.1712, test_loss: 1.0855, test_f1: 0.4513
 epoch: 3, train_loss: 1.1265, test_loss: 1.0523, test_f1: 0.4371
 epoch: 4, train_loss: 1.0760, test_loss: 1.0919, test_f1: 0.4493
 epoch: 5, train_loss: 1.0391, test_loss: 1.2216, test_f1: 0.4287
 epoch: 6, train_loss: 1.0238, test_loss: 0.9910, test_f1: 0.4835
 epoch: 7, train_loss: 1.0074, test_loss: 0.9481, test_f1: 0.4884
 epoch: 8, train_loss: 0.9987, test_loss: 0.9654, test_f1: 0.4986
 epoch: 9, train_loss: 0.9892, test_loss: 0.8805, test_f1: 0.4986
 epoch: 10, train_loss: 0.9631, test_loss: 1.0288, test_f1: 0.5076
 epoch: 11, train_loss: 0.9406, test_loss: 1.0201, test_f1: 0.5081
 epoch: 12, train_loss: 0.9349, test_loss: 1.0330, test_f1: 0.4672
 epoch: 13, train_loss: 0.9450, test_loss: 0.9282, test_f1: 0.5000
 epoch: 14, train_loss: 0.9289, test_loss: 0.9978, test_f1: 0.5151
 epoch: 15, train_loss: 0.9154, test_loss: 1.0534, test_f1: 0.4581
 epoch: 16, train_loss: 0.9177, test_loss: 0.9853, test_f1: 0.4914
 epoch: 17, train_loss: 0.9172, test_loss: 1.0046, test_f1: 0.5092
 epoch: 18, train_loss: 0.9211, test_loss: 1.0231, test_f1: 0.4707
 epoch: 19, train_loss: 0.9032, test_loss: 0.9880, test_f1: 0.4819
 epoch: 20, train_loss: 0.9014, test_loss: 0.9663, test_f1: 0.5007
 epoch: 21, train_loss: 0.8902, test_loss: 0.9757, test_f1: 0.5026
 epoch: 22, train_loss: 0.8735, test_loss: 0.9851, test_f1: 0.5066
 epoch: 23, train_loss: 0.8683, test_loss: 1.2101, test_f1: 0.4720
 epoch: 24, train_loss: 0.8742, test_loss: 0.9462, test_f1: 0.5228
 epoch: 25, train_loss: 0.8834, test_loss: 0.9986, test_f1: 0.5248
 epoch: 26, train_loss: 0.8751, test_loss: 0.9958, test_f1: 0.5386
 epoch: 27, train_loss: 0.8782, test_loss: 0.9833, test_f1: 0.5605
 epoch: 28, train_loss: 0.8725, test_loss: 0.9930, test_f1: 0.5499
 epoch: 29, train_loss: 0.8514, test_loss: 1.4746, test_f1: 0.4471
 epoch: 30, train_loss: 0.8791, test_loss: 0.9706, test_f1: 0.5215
 epoch: 31, train_loss: 0.8595, test_loss: 0.9674, test_f1: 0.5210
 epoch: 32, train_loss: 0.8558, test_loss: 0.9444, test_f1: 0.5155
 epoch: 33, train_loss: 0.8521, test_loss: 0.9733, test_f1: 0.5263
 epoch: 34, train_loss: 0.8562, test_loss: 0.9529, test_f1: 0.5121
 epoch: 35, train_loss: 0.8599, test_loss: 1.0151, test_f1: 0.5120
 epoch: 36, train_loss: 0.8525, test_loss: 1.0380, test_f1: 0.5189
 epoch: 37, train_loss: 0.8263, test_loss: 0.9580, test_f1: 0.5177
 epoch: 38, train_loss: 0.8683, test_loss: 0.9649, test_f1: 0.5374
 epoch: 39, train_loss: 0.8329, test_loss: 0.9791, test_f1: 0.5198
 epoch: 40, train_loss: 0.8216, test_loss: 0.9611, test_f1: 0.5623
 epoch: 41, train_loss: 0.8174, test_loss: 0.9832, test_f1: 0.5333
 epoch: 42, train_loss: 0.8369, test_loss: 0.9289, test_f1: 0.5427
 epoch: 43, train_loss: 0.8060, test_loss: 0.9694, test_f1: 0.5572
 epoch: 44, train_loss: 0.8192, test_loss: 0.9300, test_f1: 0.5206
 epoch: 45, train_loss: 0.8179, test_loss: 1.0679, test_f1: 0.5088
 epoch: 46, train_loss: 0.7904, test_loss: 1.1151, test_f1: 0.4927
 epoch: 47, train_loss: 0.8103, test_loss: 0.9886, test_f1: 0.5456
 epoch: 48, train_loss: 0.8076, test_loss: 0.9917, test_f1: 0.5165
 epoch: 49, train_loss: 0.7948, test_loss: 0.9310, test_f1: 0.5538
 epoch: 50, train_loss: 0.7953, test_loss: 1.0172, test_f1: 0.5490
 epoch: 51, train_loss: 0.7782, test_loss: 1.0480, test_f1: 0.5239
 epoch: 52, train_loss: 0.7609, test_loss: 1.1373, test_f1: 0.5389
 epoch: 53, train_loss: 0.7482, test_loss: 0.9587, test_f1: 0.5620
 epoch: 54, train_loss: 0.7574, test_loss: 1.1236, test_f1: 0.5474
 epoch: 55, train_loss: 0.7590, test_loss: 0.9461, test_f1: 0.5867
 epoch: 56, train_loss: 0.7451, test_loss: 0.9581, test_f1: 0.5833
 epoch: 57, train_loss: 0.7446, test_loss: 0.9868, test_f1: 0.5681
 epoch: 58, train_loss: 0.7455, test_loss: 1.0016, test_f1: 0.5707
 epoch: 59, train_loss: 0.7512, test_loss: 0.8996, test_f1: 0.5872
 epoch: 60, train_loss: 0.7441, test_loss: 1.0616, test_f1: 0.5489
 epoch: 61, train_loss: 0.7253, test_loss: 0.9478, test_f1: 0.5763
 epoch: 62, train_loss: 0.7174, test_loss: 0.9578, test_f1: 0.5494
 epoch: 63, train_loss: 0.7310, test_loss: 0.9378, test_f1: 0.5721
 epoch: 64, train_loss: 0.7322, test_loss: 1.1310, test_f1: 0.5585
 epoch: 65, train_loss: 0.7195, test_loss: 0.9554, test_f1: 0.5886
 epoch: 66, train_loss: 0.7329, test_loss: 0.9482, test_f1: 0.5880
 epoch: 67, train_loss: 0.7248, test_loss: 0.9893, test_f1: 0.5862
 epoch: 68, train_loss: 0.7241, test_loss: 1.0266, test_f1: 0.5520
 epoch: 69, train_loss: 0.7175, test_loss: 1.0413, test_f1: 0.5401
 epoch: 70, train_loss: 0.7179, test_loss: 0.9723, test_f1: 0.5908
 epoch: 71, train_loss: 0.7080, test_loss: 1.0856, test_f1: 0.5454
 epoch: 72, train_loss: 0.7145, test_loss: 1.1177, test_f1: 0.5521
 epoch: 73, train_loss: 0.7074, test_loss: 1.0021, test_f1: 0.5969
 epoch: 74, train_loss: 0.6878, test_loss: 1.1291, test_f1: 0.5552
 epoch: 75, train_loss: 0.7002, test_loss: 1.1471, test_f1: 0.5659
 epoch: 76, train_loss: 0.7009, test_loss: 0.9948, test_f1: 0.5798
 epoch: 77, train_loss: 0.7118, test_loss: 1.0801, test_f1: 0.5752
 epoch: 78, train_loss: 0.6993, test_loss: 1.1749, test_f1: 0.5529
 epoch: 79, train_loss: 0.6985, test_loss: 1.1682, test_f1: 0.5581
 epoch: 80, train_loss: 0.6898, test_loss: 1.2815, test_f1: 0.5650
 epoch: 81, train_loss: 0.6993, test_loss: 1.1187, test_f1: 0.5616
 epoch: 82, train_loss: 0.6727, test_loss: 1.0009, test_f1: 0.5708
 epoch: 83, train_loss: 0.6877, test_loss: 0.9446, test_f1: 0.5889
 epoch: 84, train_loss: 0.6823, test_loss: 1.1529, test_f1: 0.5803
 epoch: 85, train_loss: 0.6701, test_loss: 0.9540, test_f1: 0.5716
 epoch: 86, train_loss: 0.6649, test_loss: 1.1144, test_f1: 0.5449
 epoch: 87, train_loss: 0.6659, test_loss: 0.9661, test_f1: 0.5854
 epoch: 88, train_loss: 0.6603, test_loss: 1.0167, test_f1: 0.5996
 epoch: 89, train_loss: 0.6779, test_loss: 0.9758, test_f1: 0.6030
 epoch: 90, train_loss: 0.6796, test_loss: 0.9894, test_f1: 0.5862
 epoch: 91, train_loss: 0.6641, test_loss: 1.0209, test_f1: 0.5940
 epoch: 92, train_loss: 0.6744, test_loss: 1.0659, test_f1: 0.5736
 epoch: 93, train_loss: 0.6550, test_loss: 1.0383, test_f1: 0.5921
 epoch: 94, train_loss: 0.6644, test_loss: 1.0518, test_f1: 0.5413
 epoch: 95, train_loss: 0.6617, test_loss: 1.0323, test_f1: 0.5708
 epoch: 96, train_loss: 0.6613, test_loss: 1.0247, test_f1: 0.5632
 epoch: 97, train_loss: 0.6729, test_loss: 1.0002, test_f1: 0.6013
 epoch: 98, train_loss: 0.6539, test_loss: 1.1953, test_f1: 0.5443
 epoch: 99, train_loss: 0.6551, test_loss: 1.3061, test_f1: 0.5658
##################ITERATION #5 ****************************************
 epoch: 0, train_loss: 1.3262, test_loss: 1.2566, test_f1: 0.3223
 epoch: 1, train_loss: 1.2138, test_loss: 1.1509, test_f1: 0.3595
 epoch: 2, train_loss: 1.1790, test_loss: 1.0810, test_f1: 0.3989
 epoch: 3, train_loss: 1.1157, test_loss: 1.0835, test_f1: 0.4375
 epoch: 4, train_loss: 1.1073, test_loss: 1.0374, test_f1: 0.4688
 epoch: 5, train_loss: 1.0577, test_loss: 1.0458, test_f1: 0.4542
 epoch: 6, train_loss: 1.0516, test_loss: 1.0590, test_f1: 0.4577
 epoch: 7, train_loss: 1.0320, test_loss: 0.9595, test_f1: 0.4592
 epoch: 8, train_loss: 1.0160, test_loss: 1.0573, test_f1: 0.4486
 epoch: 9, train_loss: 1.0010, test_loss: 0.9927, test_f1: 0.4800
 epoch: 10, train_loss: 1.0042, test_loss: 0.9806, test_f1: 0.4760
 epoch: 11, train_loss: 0.9880, test_loss: 0.9921, test_f1: 0.4822
 epoch: 12, train_loss: 1.0107, test_loss: 1.0087, test_f1: 0.4821
 epoch: 13, train_loss: 0.9779, test_loss: 0.9610, test_f1: 0.4961
 epoch: 14, train_loss: 0.9670, test_loss: 1.0366, test_f1: 0.4967
 epoch: 15, train_loss: 0.9553, test_loss: 1.0234, test_f1: 0.4867
 epoch: 16, train_loss: 0.9550, test_loss: 1.0412, test_f1: 0.4754
 epoch: 17, train_loss: 0.9557, test_loss: 1.0227, test_f1: 0.4824
 epoch: 18, train_loss: 0.9475, test_loss: 1.0237, test_f1: 0.5017
 epoch: 19, train_loss: 0.9346, test_loss: 1.0415, test_f1: 0.4700
 epoch: 20, train_loss: 0.9307, test_loss: 1.0646, test_f1: 0.4751
 epoch: 21, train_loss: 0.9351, test_loss: 1.0261, test_f1: 0.5033
 epoch: 22, train_loss: 0.9263, test_loss: 1.0399, test_f1: 0.5069
 epoch: 23, train_loss: 0.9196, test_loss: 0.9773, test_f1: 0.5212
 epoch: 24, train_loss: 0.9318, test_loss: 1.0115, test_f1: 0.5109
 epoch: 25, train_loss: 0.9163, test_loss: 0.9874, test_f1: 0.5135
 epoch: 26, train_loss: 0.9140, test_loss: 1.0089, test_f1: 0.4996
 epoch: 27, train_loss: 0.9055, test_loss: 1.0547, test_f1: 0.4902
 epoch: 28, train_loss: 0.9085, test_loss: 1.0816, test_f1: 0.4901
 epoch: 29, train_loss: 0.9136, test_loss: 1.0962, test_f1: 0.5345
 epoch: 30, train_loss: 0.8918, test_loss: 1.0467, test_f1: 0.5307
 epoch: 31, train_loss: 0.8921, test_loss: 1.0489, test_f1: 0.4845
 epoch: 32, train_loss: 0.8853, test_loss: 1.0694, test_f1: 0.4842
 epoch: 33, train_loss: 0.8944, test_loss: 0.9819, test_f1: 0.5161
 epoch: 34, train_loss: 0.8923, test_loss: 1.0356, test_f1: 0.5298
 epoch: 35, train_loss: 0.8769, test_loss: 1.0284, test_f1: 0.5226
 epoch: 36, train_loss: 0.8851, test_loss: 1.0838, test_f1: 0.5105
 epoch: 37, train_loss: 0.8752, test_loss: 0.9955, test_f1: 0.5413
 epoch: 38, train_loss: 0.8645, test_loss: 1.0907, test_f1: 0.5065
 epoch: 39, train_loss: 0.8957, test_loss: 0.9894, test_f1: 0.5268
 epoch: 40, train_loss: 0.8631, test_loss: 1.0247, test_f1: 0.5020
 epoch: 41, train_loss: 0.8460, test_loss: 0.9330, test_f1: 0.5551
 epoch: 42, train_loss: 0.8456, test_loss: 0.9658, test_f1: 0.5158
 epoch: 43, train_loss: 0.8687, test_loss: 1.0000, test_f1: 0.5224
 epoch: 44, train_loss: 0.8458, test_loss: 0.9436, test_f1: 0.5150
 epoch: 45, train_loss: 0.8509, test_loss: 0.9844, test_f1: 0.5120
 epoch: 46, train_loss: 0.8491, test_loss: 0.9399, test_f1: 0.5255
 epoch: 47, train_loss: 0.8375, test_loss: 0.9816, test_f1: 0.5400
 epoch: 48, train_loss: 0.8281, test_loss: 1.0024, test_f1: 0.5209
 epoch: 49, train_loss: 0.8344, test_loss: 0.9525, test_f1: 0.5673
 epoch: 50, train_loss: 0.8259, test_loss: 1.0582, test_f1: 0.5211
 epoch: 51, train_loss: 0.7906, test_loss: 0.9744, test_f1: 0.5476
 epoch: 52, train_loss: 0.8004, test_loss: 1.0188, test_f1: 0.5590
 epoch: 53, train_loss: 0.7824, test_loss: 1.1029, test_f1: 0.5207
 epoch: 54, train_loss: 0.8271, test_loss: 1.0081, test_f1: 0.5542
 epoch: 55, train_loss: 0.7904, test_loss: 0.9576, test_f1: 0.5751
 epoch: 56, train_loss: 0.7939, test_loss: 0.9650, test_f1: 0.5427
 epoch: 57, train_loss: 0.7895, test_loss: 0.9395, test_f1: 0.5381
 epoch: 58, train_loss: 0.7731, test_loss: 0.9387, test_f1: 0.5767
 epoch: 59, train_loss: 0.7634, test_loss: 0.9554, test_f1: 0.5544
 epoch: 60, train_loss: 0.7679, test_loss: 0.9669, test_f1: 0.5568
 epoch: 61, train_loss: 0.7561, test_loss: 0.9941, test_f1: 0.5494
 epoch: 62, train_loss: 0.7585, test_loss: 1.0236, test_f1: 0.5454
 epoch: 63, train_loss: 0.7474, test_loss: 1.1382, test_f1: 0.5295
 epoch: 64, train_loss: 0.7574, test_loss: 0.9826, test_f1: 0.5436
 epoch: 65, train_loss: 0.7535, test_loss: 1.1523, test_f1: 0.5404
 epoch: 66, train_loss: 0.7502, test_loss: 0.9873, test_f1: 0.5483
 epoch: 67, train_loss: 0.7484, test_loss: 0.9625, test_f1: 0.5605
 epoch: 68, train_loss: 0.7452, test_loss: 1.0192, test_f1: 0.5547
 epoch: 69, train_loss: 0.7466, test_loss: 1.0019, test_f1: 0.5454
 epoch: 70, train_loss: 0.7463, test_loss: 0.9835, test_f1: 0.5640
 epoch: 71, train_loss: 0.7465, test_loss: 1.0950, test_f1: 0.5357
 epoch: 72, train_loss: 0.7423, test_loss: 1.0186, test_f1: 0.5361
 epoch: 73, train_loss: 0.7390, test_loss: 0.9542, test_f1: 0.5582
 epoch: 74, train_loss: 0.7451, test_loss: 0.9906, test_f1: 0.5321
 epoch: 75, train_loss: 0.7601, test_loss: 0.9747, test_f1: 0.5509
 epoch: 76, train_loss: 0.7339, test_loss: 1.0015, test_f1: 0.5580
 epoch: 77, train_loss: 0.7345, test_loss: 0.9627, test_f1: 0.5780
 epoch: 78, train_loss: 0.7237, test_loss: 0.9663, test_f1: 0.5667
 epoch: 79, train_loss: 0.7228, test_loss: 1.1673, test_f1: 0.5421
 epoch: 80, train_loss: 0.8459, test_loss: 0.9928, test_f1: 0.5472
 epoch: 81, train_loss: 0.7713, test_loss: 0.9535, test_f1: 0.5892
 epoch: 82, train_loss: 0.7431, test_loss: 0.9784, test_f1: 0.5933
 epoch: 83, train_loss: 0.7355, test_loss: 0.9974, test_f1: 0.5793
 epoch: 84, train_loss: 0.7456, test_loss: 0.9473, test_f1: 0.5575
 epoch: 85, train_loss: 0.7264, test_loss: 0.9320, test_f1: 0.5773
 epoch: 86, train_loss: 0.7224, test_loss: 0.9488, test_f1: 0.5793
 epoch: 87, train_loss: 0.7053, test_loss: 0.9590, test_f1: 0.5693
 epoch: 88, train_loss: 0.7193, test_loss: 0.9702, test_f1: 0.5678
 epoch: 89, train_loss: 0.7031, test_loss: 0.9963, test_f1: 0.5667
 epoch: 90, train_loss: 0.6903, test_loss: 0.9586, test_f1: 0.5831
 epoch: 91, train_loss: 0.7216, test_loss: 0.9894, test_f1: 0.5695
 epoch: 92, train_loss: 0.7129, test_loss: 0.9761, test_f1: 0.5668
 epoch: 93, train_loss: 0.7076, test_loss: 1.0765, test_f1: 0.5464
 epoch: 94, train_loss: 0.7037, test_loss: 1.0307, test_f1: 0.5537
 epoch: 95, train_loss: 0.7025, test_loss: 1.0852, test_f1: 0.5298
 epoch: 96, train_loss: 0.6972, test_loss: 0.9872, test_f1: 0.5631
 epoch: 97, train_loss: 0.6915, test_loss: 0.9883, test_f1: 0.5652
 epoch: 98, train_loss: 0.7051, test_loss: 1.0534, test_f1: 0.5612
 epoch: 99, train_loss: 0.7021, test_loss: 1.0180, test_f1: 0.5513
##################ITERATION #6 ****************************************
 epoch: 0, train_loss: 1.3045, test_loss: 1.2907, test_f1: 0.3449
 epoch: 1, train_loss: 1.2191, test_loss: 1.1337, test_f1: 0.4735
 epoch: 2, train_loss: 1.1550, test_loss: 1.0418, test_f1: 0.5125
 epoch: 3, train_loss: 1.1070, test_loss: 1.0052, test_f1: 0.4539
 epoch: 4, train_loss: 1.0703, test_loss: 1.1184, test_f1: 0.4307
 epoch: 5, train_loss: 1.0346, test_loss: 0.9377, test_f1: 0.4760
 epoch: 6, train_loss: 1.0054, test_loss: 0.9565, test_f1: 0.4485
 epoch: 7, train_loss: 1.0030, test_loss: 0.9883, test_f1: 0.4911
 epoch: 8, train_loss: 0.9816, test_loss: 1.4506, test_f1: 0.4754
 epoch: 9, train_loss: 0.9862, test_loss: 1.0332, test_f1: 0.4914
 epoch: 10, train_loss: 0.9820, test_loss: 0.9927, test_f1: 0.5068
 epoch: 11, train_loss: 0.9660, test_loss: 0.9455, test_f1: 0.4605
 epoch: 12, train_loss: 0.9807, test_loss: 0.8901, test_f1: 0.5091
 epoch: 13, train_loss: 0.9639, test_loss: 1.0393, test_f1: 0.4673
 epoch: 14, train_loss: 0.9453, test_loss: 0.9986, test_f1: 0.5027
 epoch: 15, train_loss: 0.9364, test_loss: 1.0324, test_f1: 0.5027
 epoch: 16, train_loss: 0.9233, test_loss: 0.9755, test_f1: 0.5096
 epoch: 17, train_loss: 0.9282, test_loss: 0.9084, test_f1: 0.4886
 epoch: 18, train_loss: 0.9234, test_loss: 1.0254, test_f1: 0.4826
 epoch: 19, train_loss: 0.9266, test_loss: 1.0208, test_f1: 0.4945
 epoch: 20, train_loss: 0.9334, test_loss: 0.9908, test_f1: 0.4982
 epoch: 21, train_loss: 0.9096, test_loss: 1.0039, test_f1: 0.4691
 epoch: 22, train_loss: 0.9131, test_loss: 0.9898, test_f1: 0.5037
 epoch: 23, train_loss: 0.8981, test_loss: 1.0334, test_f1: 0.4748
 epoch: 24, train_loss: 0.8948, test_loss: 0.9862, test_f1: 0.5056
 epoch: 25, train_loss: 0.8973, test_loss: 0.9867, test_f1: 0.5269
 epoch: 26, train_loss: 0.8729, test_loss: 1.0040, test_f1: 0.5151
 epoch: 27, train_loss: 0.8790, test_loss: 1.1757, test_f1: 0.4811
 epoch: 28, train_loss: 0.8778, test_loss: 0.9627, test_f1: 0.5067
 epoch: 29, train_loss: 0.8683, test_loss: 1.0897, test_f1: 0.4567
 epoch: 30, train_loss: 0.8916, test_loss: 0.9816, test_f1: 0.5029
 epoch: 31, train_loss: 0.8757, test_loss: 0.9498, test_f1: 0.5178
 epoch: 32, train_loss: 0.8702, test_loss: 1.0004, test_f1: 0.5082
 epoch: 33, train_loss: 0.8638, test_loss: 1.0366, test_f1: 0.4821
 epoch: 34, train_loss: 0.8680, test_loss: 1.0271, test_f1: 0.4935
 epoch: 35, train_loss: 0.8459, test_loss: 0.9848, test_f1: 0.5110
 epoch: 36, train_loss: 0.8549, test_loss: 0.9426, test_f1: 0.5261
 epoch: 37, train_loss: 0.8561, test_loss: 0.9580, test_f1: 0.5301
 epoch: 38, train_loss: 0.8394, test_loss: 0.9730, test_f1: 0.4989
 epoch: 39, train_loss: 0.8486, test_loss: 0.9789, test_f1: 0.5164
 epoch: 40, train_loss: 0.8384, test_loss: 1.0684, test_f1: 0.4988
 epoch: 41, train_loss: 0.8405, test_loss: 1.0309, test_f1: 0.5065
 epoch: 42, train_loss: 0.8304, test_loss: 1.0962, test_f1: 0.5030
 epoch: 43, train_loss: 0.8148, test_loss: 1.1993, test_f1: 0.4898
 epoch: 44, train_loss: 0.8170, test_loss: 0.9969, test_f1: 0.5082
 epoch: 45, train_loss: 0.8161, test_loss: 1.0558, test_f1: 0.4917
 epoch: 46, train_loss: 0.8212, test_loss: 1.0663, test_f1: 0.4990
 epoch: 47, train_loss: 0.8069, test_loss: 1.0646, test_f1: 0.4963
 epoch: 48, train_loss: 0.8262, test_loss: 1.0339, test_f1: 0.5086
 epoch: 49, train_loss: 0.8150, test_loss: 0.9864, test_f1: 0.4965
 epoch: 50, train_loss: 0.8227, test_loss: 1.0059, test_f1: 0.5108
 epoch: 51, train_loss: 0.7815, test_loss: 1.0126, test_f1: 0.5155
 epoch: 52, train_loss: 0.7607, test_loss: 0.9851, test_f1: 0.5352
 epoch: 53, train_loss: 0.7583, test_loss: 0.9581, test_f1: 0.5191
 epoch: 54, train_loss: 0.7624, test_loss: 0.9279, test_f1: 0.5364
 epoch: 55, train_loss: 0.7569, test_loss: 1.0242, test_f1: 0.5068
 epoch: 56, train_loss: 0.7433, test_loss: 0.9674, test_f1: 0.5180
 epoch: 57, train_loss: 0.7434, test_loss: 0.9425, test_f1: 0.5525
 epoch: 58, train_loss: 0.7411, test_loss: 1.0036, test_f1: 0.5152
 epoch: 59, train_loss: 0.7424, test_loss: 1.0655, test_f1: 0.5122
 epoch: 60, train_loss: 0.7455, test_loss: 0.9882, test_f1: 0.5394
 epoch: 61, train_loss: 0.7266, test_loss: 1.0214, test_f1: 0.4953
 epoch: 62, train_loss: 0.7413, test_loss: 0.9716, test_f1: 0.5301
 epoch: 63, train_loss: 0.7279, test_loss: 1.0254, test_f1: 0.5212
 epoch: 64, train_loss: 0.7573, test_loss: 0.9736, test_f1: 0.5497
 epoch: 65, train_loss: 0.7442, test_loss: 0.9685, test_f1: 0.5560
 epoch: 66, train_loss: 0.7313, test_loss: 1.0001, test_f1: 0.5166
 epoch: 67, train_loss: 0.7322, test_loss: 0.9645, test_f1: 0.5400
 epoch: 68, train_loss: 0.7141, test_loss: 1.0384, test_f1: 0.5234
 epoch: 69, train_loss: 0.7202, test_loss: 1.0531, test_f1: 0.5344
 epoch: 70, train_loss: 0.7216, test_loss: 0.9976, test_f1: 0.5415
 epoch: 71, train_loss: 0.7233, test_loss: 0.9588, test_f1: 0.5392
 epoch: 72, train_loss: 0.7119, test_loss: 1.0818, test_f1: 0.5244
 epoch: 73, train_loss: 0.7034, test_loss: 1.0039, test_f1: 0.5130
 epoch: 74, train_loss: 0.7032, test_loss: 0.9756, test_f1: 0.5120
 epoch: 75, train_loss: 0.7031, test_loss: 1.0465, test_f1: 0.5486
 epoch: 76, train_loss: 0.7218, test_loss: 0.9881, test_f1: 0.5429
 epoch: 77, train_loss: 0.6987, test_loss: 1.0403, test_f1: 0.5539
 epoch: 78, train_loss: 0.7098, test_loss: 1.0959, test_f1: 0.5476
 epoch: 79, train_loss: 0.7051, test_loss: 1.0905, test_f1: 0.5257
 epoch: 80, train_loss: 0.7110, test_loss: 1.0859, test_f1: 0.5613
 epoch: 81, train_loss: 0.6883, test_loss: 1.0500, test_f1: 0.5499
 epoch: 82, train_loss: 0.7156, test_loss: 0.9704, test_f1: 0.5611
 epoch: 83, train_loss: 0.6968, test_loss: 0.9963, test_f1: 0.5398
 epoch: 84, train_loss: 0.7103, test_loss: 1.1199, test_f1: 0.5083
 epoch: 85, train_loss: 0.7082, test_loss: 1.0073, test_f1: 0.5768
 epoch: 86, train_loss: 0.7078, test_loss: 0.9991, test_f1: 0.5706
 epoch: 87, train_loss: 0.7043, test_loss: 0.9943, test_f1: 0.5664
 epoch: 88, train_loss: 0.6951, test_loss: 1.0358, test_f1: 0.5664
 epoch: 89, train_loss: 0.7021, test_loss: 0.9553, test_f1: 0.5840
 epoch: 90, train_loss: 0.6946, test_loss: 1.0453, test_f1: 0.5730
 epoch: 91, train_loss: 0.6826, test_loss: 0.9915, test_f1: 0.5382
 epoch: 92, train_loss: 0.6842, test_loss: 0.9825, test_f1: 0.5662
 epoch: 93, train_loss: 0.6911, test_loss: 1.0880, test_f1: 0.5751
 epoch: 94, train_loss: 0.6902, test_loss: 0.9994, test_f1: 0.5567
 epoch: 95, train_loss: 0.6838, test_loss: 1.0090, test_f1: 0.5594
 epoch: 96, train_loss: 0.6920, test_loss: 0.9793, test_f1: 0.5740
 epoch: 97, train_loss: 0.6917, test_loss: 1.0056, test_f1: 0.5765
 epoch: 98, train_loss: 0.6709, test_loss: 1.0138, test_f1: 0.5640
 epoch: 99, train_loss: 0.6796, test_loss: 1.0387, test_f1: 0.5816
##################ITERATION #7 ****************************************
 epoch: 0, train_loss: 1.3143, test_loss: 1.2064, test_f1: 0.3322
 epoch: 1, train_loss: 1.2198, test_loss: 1.1321, test_f1: 0.4361
 epoch: 2, train_loss: 1.1728, test_loss: 1.1277, test_f1: 0.4623
 epoch: 3, train_loss: 1.1422, test_loss: 1.0374, test_f1: 0.4510
 epoch: 4, train_loss: 1.1058, test_loss: 1.0202, test_f1: 0.4497
 epoch: 5, train_loss: 1.0843, test_loss: 1.0006, test_f1: 0.4573
 epoch: 6, train_loss: 1.0343, test_loss: 1.0143, test_f1: 0.4394
 epoch: 7, train_loss: 1.0347, test_loss: 0.9438, test_f1: 0.4663
 epoch: 8, train_loss: 1.0101, test_loss: 0.9991, test_f1: 0.4863
 epoch: 9, train_loss: 0.9870, test_loss: 0.9646, test_f1: 0.4698
 epoch: 10, train_loss: 0.9540, test_loss: 0.9983, test_f1: 0.4566
 epoch: 11, train_loss: 0.9552, test_loss: 1.0211, test_f1: 0.4958
 epoch: 12, train_loss: 0.9555, test_loss: 1.1518, test_f1: 0.4489
 epoch: 13, train_loss: 0.9421, test_loss: 0.9941, test_f1: 0.4659
 epoch: 14, train_loss: 0.9380, test_loss: 0.9858, test_f1: 0.5012
 epoch: 15, train_loss: 0.9274, test_loss: 1.0696, test_f1: 0.4793
 epoch: 16, train_loss: 0.9272, test_loss: 0.9804, test_f1: 0.4730
 epoch: 17, train_loss: 0.9147, test_loss: 0.9960, test_f1: 0.5045
 epoch: 18, train_loss: 0.8952, test_loss: 0.9490, test_f1: 0.4992
 epoch: 19, train_loss: 0.9049, test_loss: 0.9620, test_f1: 0.4846
 epoch: 20, train_loss: 0.9192, test_loss: 1.0314, test_f1: 0.4700
 epoch: 21, train_loss: 0.8962, test_loss: 0.9902, test_f1: 0.5031
 epoch: 22, train_loss: 0.8905, test_loss: 1.0174, test_f1: 0.4942
 epoch: 23, train_loss: 0.8884, test_loss: 1.0481, test_f1: 0.4692
 epoch: 24, train_loss: 0.8890, test_loss: 0.9921, test_f1: 0.5048
 epoch: 25, train_loss: 0.8729, test_loss: 0.9099, test_f1: 0.5158
 epoch: 26, train_loss: 0.8707, test_loss: 1.0610, test_f1: 0.4899
 epoch: 27, train_loss: 0.8670, test_loss: 0.9504, test_f1: 0.5175
 epoch: 28, train_loss: 0.8702, test_loss: 0.9985, test_f1: 0.4937
 epoch: 29, train_loss: 0.8896, test_loss: 1.0815, test_f1: 0.4766
 epoch: 30, train_loss: 0.8774, test_loss: 0.9710, test_f1: 0.5088
 epoch: 31, train_loss: 0.8822, test_loss: 1.0220, test_f1: 0.4881
 epoch: 32, train_loss: 0.8709, test_loss: 0.9417, test_f1: 0.5135
 epoch: 33, train_loss: 0.8619, test_loss: 0.9821, test_f1: 0.4875
 epoch: 34, train_loss: 0.8519, test_loss: 0.9672, test_f1: 0.4996
 epoch: 35, train_loss: 0.8471, test_loss: 0.9760, test_f1: 0.5104
 epoch: 36, train_loss: 0.8438, test_loss: 1.0429, test_f1: 0.5056
 epoch: 37, train_loss: 0.8371, test_loss: 1.0084, test_f1: 0.5079
 epoch: 38, train_loss: 0.8555, test_loss: 1.0438, test_f1: 0.4936
 epoch: 39, train_loss: 0.8420, test_loss: 0.9811, test_f1: 0.5045
 epoch: 40, train_loss: 0.8363, test_loss: 0.9459, test_f1: 0.5214
 epoch: 41, train_loss: 0.8308, test_loss: 0.9820, test_f1: 0.4860
 epoch: 42, train_loss: 0.8127, test_loss: 1.0615, test_f1: 0.4937
 epoch: 43, train_loss: 0.8360, test_loss: 1.0569, test_f1: 0.4979
 epoch: 44, train_loss: 0.8221, test_loss: 1.0039, test_f1: 0.5322
 epoch: 45, train_loss: 0.8298, test_loss: 1.0145, test_f1: 0.5260
 epoch: 46, train_loss: 0.8289, test_loss: 0.9938, test_f1: 0.5114
 epoch: 47, train_loss: 0.8143, test_loss: 0.9949, test_f1: 0.4783
 epoch: 48, train_loss: 0.8229, test_loss: 0.9752, test_f1: 0.5174
 epoch: 49, train_loss: 0.8230, test_loss: 1.0279, test_f1: 0.5121
 epoch: 50, train_loss: 0.8012, test_loss: 1.0738, test_f1: 0.4759
 epoch: 51, train_loss: 0.7821, test_loss: 0.9756, test_f1: 0.5389
 epoch: 52, train_loss: 0.7691, test_loss: 1.0215, test_f1: 0.5011
 epoch: 53, train_loss: 0.7538, test_loss: 0.9888, test_f1: 0.5527
 epoch: 54, train_loss: 0.7679, test_loss: 0.9902, test_f1: 0.5061
 epoch: 55, train_loss: 0.7647, test_loss: 1.0166, test_f1: 0.5070
 epoch: 56, train_loss: 0.7578, test_loss: 0.9637, test_f1: 0.5493
 epoch: 57, train_loss: 0.7584, test_loss: 0.9576, test_f1: 0.5195
 epoch: 58, train_loss: 0.7509, test_loss: 0.9476, test_f1: 0.5505
 epoch: 59, train_loss: 0.7482, test_loss: 0.9769, test_f1: 0.5726
 epoch: 60, train_loss: 0.7524, test_loss: 0.9310, test_f1: 0.5527
 epoch: 61, train_loss: 0.7379, test_loss: 0.9506, test_f1: 0.5463
 epoch: 62, train_loss: 0.7301, test_loss: 1.0091, test_f1: 0.5326
 epoch: 63, train_loss: 0.7432, test_loss: 0.9749, test_f1: 0.5304
 epoch: 64, train_loss: 0.7278, test_loss: 0.9742, test_f1: 0.5417
 epoch: 65, train_loss: 0.7303, test_loss: 0.9882, test_f1: 0.5557
 epoch: 66, train_loss: 0.7240, test_loss: 0.9785, test_f1: 0.5143
 epoch: 67, train_loss: 0.7264, test_loss: 0.9699, test_f1: 0.5353
 epoch: 68, train_loss: 0.7238, test_loss: 0.9836, test_f1: 0.5575
 epoch: 69, train_loss: 0.7039, test_loss: 0.9774, test_f1: 0.5515
 epoch: 70, train_loss: 0.7321, test_loss: 0.9493, test_f1: 0.5583
 epoch: 71, train_loss: 0.7226, test_loss: 0.9544, test_f1: 0.5514
 epoch: 72, train_loss: 0.7319, test_loss: 1.0317, test_f1: 0.5491
 epoch: 73, train_loss: 0.7258, test_loss: 0.9937, test_f1: 0.5531
 epoch: 74, train_loss: 0.6953, test_loss: 0.9714, test_f1: 0.5407
 epoch: 75, train_loss: 0.7245, test_loss: 1.0026, test_f1: 0.5713
 epoch: 76, train_loss: 0.7176, test_loss: 0.9398, test_f1: 0.5556
 epoch: 77, train_loss: 0.7035, test_loss: 0.9280, test_f1: 0.5421
 epoch: 78, train_loss: 0.6967, test_loss: 0.9798, test_f1: 0.5549
 epoch: 79, train_loss: 0.7121, test_loss: 1.0133, test_f1: 0.5297
 epoch: 80, train_loss: 0.7220, test_loss: 0.9662, test_f1: 0.5625
 epoch: 81, train_loss: 0.6997, test_loss: 0.9980, test_f1: 0.5507
 epoch: 82, train_loss: 0.6828, test_loss: 1.0315, test_f1: 0.5563
 epoch: 83, train_loss: 0.6930, test_loss: 1.0563, test_f1: 0.5503
 epoch: 84, train_loss: 0.6984, test_loss: 1.0308, test_f1: 0.5576
 epoch: 85, train_loss: 0.6911, test_loss: 1.1559, test_f1: 0.5233
 epoch: 86, train_loss: 0.6986, test_loss: 1.0976, test_f1: 0.5400
 epoch: 87, train_loss: 0.6979, test_loss: 1.0221, test_f1: 0.5449
 epoch: 88, train_loss: 0.6831, test_loss: 1.0139, test_f1: 0.5802
 epoch: 89, train_loss: 0.6818, test_loss: 0.9734, test_f1: 0.5857
 epoch: 90, train_loss: 0.6773, test_loss: 0.9807, test_f1: 0.5804
 epoch: 91, train_loss: 0.6811, test_loss: 1.0020, test_f1: 0.5917
 epoch: 92, train_loss: 0.6896, test_loss: 0.9520, test_f1: 0.5682
 epoch: 93, train_loss: 0.6796, test_loss: 1.0604, test_f1: 0.5810
 epoch: 94, train_loss: 0.6820, test_loss: 1.1324, test_f1: 0.5460
 epoch: 95, train_loss: 0.6637, test_loss: 1.0515, test_f1: 0.5466
 epoch: 96, train_loss: 0.6608, test_loss: 1.0662, test_f1: 0.5623
 epoch: 97, train_loss: 0.6785, test_loss: 1.1124, test_f1: 0.5818
 epoch: 98, train_loss: 0.6519, test_loss: 1.0857, test_f1: 0.5497
 epoch: 99, train_loss: 0.6804, test_loss: 1.0058, test_f1: 0.5925
##################ITERATION #8 ****************************************
 epoch: 0, train_loss: 1.3021, test_loss: 1.2182, test_f1: 0.4012
 epoch: 1, train_loss: 1.2157, test_loss: 1.1384, test_f1: 0.4666
 epoch: 2, train_loss: 1.1744, test_loss: 1.1087, test_f1: 0.4373
 epoch: 3, train_loss: 1.1250, test_loss: 1.0259, test_f1: 0.5024
 epoch: 4, train_loss: 1.0830, test_loss: 1.0303, test_f1: 0.4847
 epoch: 5, train_loss: 1.0425, test_loss: 0.9846, test_f1: 0.4786
 epoch: 6, train_loss: 1.0320, test_loss: 0.9866, test_f1: 0.4893
 epoch: 7, train_loss: 1.0107, test_loss: 0.9382, test_f1: 0.5170
 epoch: 8, train_loss: 1.0042, test_loss: 1.0570, test_f1: 0.5081
 epoch: 9, train_loss: 0.9775, test_loss: 0.9645, test_f1: 0.5228
 epoch: 10, train_loss: 0.9599, test_loss: 1.0292, test_f1: 0.5072
 epoch: 11, train_loss: 0.9640, test_loss: 1.0062, test_f1: 0.5040
 epoch: 12, train_loss: 0.9444, test_loss: 0.9337, test_f1: 0.4859
 epoch: 13, train_loss: 0.9550, test_loss: 1.0468, test_f1: 0.4779
 epoch: 14, train_loss: 0.9324, test_loss: 1.0689, test_f1: 0.4942
 epoch: 15, train_loss: 0.9421, test_loss: 0.9437, test_f1: 0.4883
 epoch: 16, train_loss: 0.9024, test_loss: 1.1684, test_f1: 0.4565
 epoch: 17, train_loss: 0.9196, test_loss: 1.0441, test_f1: 0.4926
 epoch: 18, train_loss: 0.9067, test_loss: 1.0490, test_f1: 0.4708
 epoch: 19, train_loss: 0.9312, test_loss: 1.1249, test_f1: 0.4952
 epoch: 20, train_loss: 0.9120, test_loss: 1.0508, test_f1: 0.4974
 epoch: 21, train_loss: 0.8917, test_loss: 1.0552, test_f1: 0.5235
 epoch: 22, train_loss: 0.8873, test_loss: 1.0943, test_f1: 0.4873
 epoch: 23, train_loss: 0.8955, test_loss: 1.0086, test_f1: 0.5245
 epoch: 24, train_loss: 0.8708, test_loss: 1.0959, test_f1: 0.4998
 epoch: 25, train_loss: 0.9015, test_loss: 1.0767, test_f1: 0.4883
 epoch: 26, train_loss: 0.8756, test_loss: 1.0318, test_f1: 0.5083
 epoch: 27, train_loss: 0.8643, test_loss: 1.1317, test_f1: 0.4990
 epoch: 28, train_loss: 0.8617, test_loss: 1.2014, test_f1: 0.4989
 epoch: 29, train_loss: 0.8577, test_loss: 1.0844, test_f1: 0.5031
 epoch: 30, train_loss: 0.8622, test_loss: 1.1436, test_f1: 0.5074
 epoch: 31, train_loss: 0.8532, test_loss: 1.0455, test_f1: 0.5083
 epoch: 32, train_loss: 0.8519, test_loss: 1.1414, test_f1: 0.5005
 epoch: 33, train_loss: 0.8557, test_loss: 1.1767, test_f1: 0.5068
 epoch: 34, train_loss: 0.8437, test_loss: 1.2833, test_f1: 0.5021
 epoch: 35, train_loss: 0.8408, test_loss: 1.2846, test_f1: 0.4810
 epoch: 36, train_loss: 0.8439, test_loss: 1.0558, test_f1: 0.4853
 epoch: 37, train_loss: 0.8440, test_loss: 1.0924, test_f1: 0.5149
 epoch: 38, train_loss: 0.8596, test_loss: 1.2178, test_f1: 0.5042
 epoch: 39, train_loss: 0.8294, test_loss: 1.0827, test_f1: 0.5476
 epoch: 40, train_loss: 0.8142, test_loss: 1.1398, test_f1: 0.5477
 epoch: 41, train_loss: 0.8272, test_loss: 1.1223, test_f1: 0.5142
 epoch: 42, train_loss: 0.8417, test_loss: 1.1262, test_f1: 0.5381
 epoch: 43, train_loss: 0.8250, test_loss: 1.1172, test_f1: 0.5324
 epoch: 44, train_loss: 0.8103, test_loss: 1.3538, test_f1: 0.5275
 epoch: 45, train_loss: 0.8092, test_loss: 1.1027, test_f1: 0.5227
 epoch: 46, train_loss: 0.8117, test_loss: 1.1541, test_f1: 0.5138
 epoch: 47, train_loss: 0.8000, test_loss: 1.1615, test_f1: 0.5602
 epoch: 48, train_loss: 0.7987, test_loss: 1.2715, test_f1: 0.5054
 epoch: 49, train_loss: 0.7962, test_loss: 1.2767, test_f1: 0.5123
 epoch: 50, train_loss: 0.7980, test_loss: 1.2921, test_f1: 0.5317
 epoch: 51, train_loss: 0.7655, test_loss: 1.1798, test_f1: 0.5379
 epoch: 52, train_loss: 0.7572, test_loss: 1.1961, test_f1: 0.5459
 epoch: 53, train_loss: 0.7643, test_loss: 1.2758, test_f1: 0.5527
 epoch: 54, train_loss: 0.7507, test_loss: 1.3184, test_f1: 0.5228
 epoch: 55, train_loss: 0.7370, test_loss: 1.3159, test_f1: 0.5151
 epoch: 56, train_loss: 0.7437, test_loss: 1.4480, test_f1: 0.5190
 epoch: 57, train_loss: 0.7182, test_loss: 1.3064, test_f1: 0.5659
 epoch: 58, train_loss: 0.7249, test_loss: 1.2673, test_f1: 0.5625
 epoch: 59, train_loss: 0.7155, test_loss: 1.3433, test_f1: 0.5456
 epoch: 60, train_loss: 0.7335, test_loss: 1.3328, test_f1: 0.5401
 epoch: 61, train_loss: 0.7186, test_loss: 1.5369, test_f1: 0.5105
 epoch: 62, train_loss: 0.7197, test_loss: 1.5566, test_f1: 0.5270
 epoch: 63, train_loss: 0.7150, test_loss: 1.2477, test_f1: 0.5472
 epoch: 64, train_loss: 0.7113, test_loss: 1.4399, test_f1: 0.5590
 epoch: 65, train_loss: 0.7191, test_loss: 1.6225, test_f1: 0.5267
 epoch: 66, train_loss: 0.7149, test_loss: 1.4998, test_f1: 0.5608
 epoch: 67, train_loss: 0.7130, test_loss: 1.6838, test_f1: 0.5416
 epoch: 68, train_loss: 0.7235, test_loss: 1.6283, test_f1: 0.5368
 epoch: 69, train_loss: 0.7186, test_loss: 1.6158, test_f1: 0.5437
 epoch: 70, train_loss: 0.7023, test_loss: 1.6133, test_f1: 0.5410
 epoch: 71, train_loss: 0.6900, test_loss: 1.6804, test_f1: 0.5252
 epoch: 72, train_loss: 0.7026, test_loss: 1.4500, test_f1: 0.5609
 epoch: 73, train_loss: 0.6848, test_loss: 1.3089, test_f1: 0.5749
 epoch: 74, train_loss: 0.6995, test_loss: 1.3068, test_f1: 0.5613
 epoch: 75, train_loss: 0.6863, test_loss: 1.2878, test_f1: 0.5649
 epoch: 76, train_loss: 0.6874, test_loss: 1.7468, test_f1: 0.5525
 epoch: 77, train_loss: 0.6977, test_loss: 1.7123, test_f1: 0.5371
 epoch: 78, train_loss: 0.7000, test_loss: 1.2362, test_f1: 0.5580
 epoch: 79, train_loss: 0.6814, test_loss: 1.6766, test_f1: 0.5304
 epoch: 80, train_loss: 0.6849, test_loss: 1.8830, test_f1: 0.5381
 epoch: 81, train_loss: 0.6889, test_loss: 1.3547, test_f1: 0.5652
 epoch: 82, train_loss: 0.6742, test_loss: 1.4941, test_f1: 0.5450
 epoch: 83, train_loss: 0.6964, test_loss: 1.8444, test_f1: 0.5305
 epoch: 84, train_loss: 0.6660, test_loss: 1.7397, test_f1: 0.5322
 epoch: 85, train_loss: 0.6854, test_loss: 1.8188, test_f1: 0.5180
 epoch: 86, train_loss: 0.6617, test_loss: 1.6276, test_f1: 0.5448
 epoch: 87, train_loss: 0.6585, test_loss: 1.9799, test_f1: 0.5533
 epoch: 88, train_loss: 0.6679, test_loss: 1.7717, test_f1: 0.5505
 epoch: 89, train_loss: 0.6698, test_loss: 1.7366, test_f1: 0.5403
 epoch: 90, train_loss: 0.6899, test_loss: 1.7270, test_f1: 0.5451
 epoch: 91, train_loss: 0.6603, test_loss: 1.7160, test_f1: 0.5352
 epoch: 92, train_loss: 0.6594, test_loss: 1.4475, test_f1: 0.5508
 epoch: 93, train_loss: 0.6822, test_loss: 1.2127, test_f1: 0.5674
 epoch: 94, train_loss: 0.6529, test_loss: 1.6010, test_f1: 0.5430
 epoch: 95, train_loss: 0.6670, test_loss: 1.3973, test_f1: 0.5550
 epoch: 96, train_loss: 0.6591, test_loss: 1.5865, test_f1: 0.5593
 epoch: 97, train_loss: 0.6425, test_loss: 1.8591, test_f1: 0.5407
 epoch: 98, train_loss: 0.6725, test_loss: 1.8906, test_f1: 0.5414
 epoch: 99, train_loss: 0.6667, test_loss: 1.6655, test_f1: 0.5441
##################ITERATION #9 ****************************************
 epoch: 0, train_loss: 1.3289, test_loss: 1.3066, test_f1: 0.3105
 epoch: 1, train_loss: 1.2531, test_loss: 1.2041, test_f1: 0.3684
 epoch: 2, train_loss: 1.2006, test_loss: 1.1182, test_f1: 0.4694
 epoch: 3, train_loss: 1.1561, test_loss: 1.0795, test_f1: 0.4441
 epoch: 4, train_loss: 1.1246, test_loss: 1.0385, test_f1: 0.4749
 epoch: 5, train_loss: 1.0995, test_loss: 1.0393, test_f1: 0.4566
 epoch: 6, train_loss: 1.0778, test_loss: 0.9740, test_f1: 0.4998
 epoch: 7, train_loss: 1.0666, test_loss: 1.0431, test_f1: 0.4223
 epoch: 8, train_loss: 1.0789, test_loss: 1.0199, test_f1: 0.4354
 epoch: 9, train_loss: 1.0565, test_loss: 0.9750, test_f1: 0.4590
 epoch: 10, train_loss: 1.0309, test_loss: 0.9641, test_f1: 0.4776
 epoch: 11, train_loss: 1.0192, test_loss: 0.9553, test_f1: 0.4683
 epoch: 12, train_loss: 1.0039, test_loss: 0.8819, test_f1: 0.4993
 epoch: 13, train_loss: 1.0178, test_loss: 0.9807, test_f1: 0.4575
 epoch: 14, train_loss: 0.9894, test_loss: 1.0172, test_f1: 0.4501
 epoch: 15, train_loss: 0.9758, test_loss: 0.9834, test_f1: 0.4581
 epoch: 16, train_loss: 0.9731, test_loss: 5.7497, test_f1: 0.4690
 epoch: 17, train_loss: 0.9500, test_loss: 1.0367, test_f1: 0.4720
 epoch: 18, train_loss: 0.9519, test_loss: 0.9667, test_f1: 0.4948
 epoch: 19, train_loss: 0.9433, test_loss: 0.9267, test_f1: 0.4909
 epoch: 20, train_loss: 0.9347, test_loss: 0.9596, test_f1: 0.5064
 epoch: 21, train_loss: 0.9318, test_loss: 0.9769, test_f1: 0.5139
 epoch: 22, train_loss: 0.9275, test_loss: 0.9651, test_f1: 0.4948
 epoch: 23, train_loss: 0.9220, test_loss: 1.0237, test_f1: 0.4892
 epoch: 24, train_loss: 0.9069, test_loss: 0.9494, test_f1: 0.4917
 epoch: 25, train_loss: 0.9343, test_loss: 0.9909, test_f1: 0.4854
 epoch: 26, train_loss: 0.9159, test_loss: 0.9908, test_f1: 0.5001
 epoch: 27, train_loss: 0.9051, test_loss: 0.9859, test_f1: 0.5250
 epoch: 28, train_loss: 0.8939, test_loss: 1.0060, test_f1: 0.5071
 epoch: 29, train_loss: 0.8853, test_loss: 1.0152, test_f1: 0.5278
 epoch: 30, train_loss: 0.8957, test_loss: 1.0397, test_f1: 0.4805
 epoch: 31, train_loss: 0.8872, test_loss: 1.0918, test_f1: 0.4891
 epoch: 32, train_loss: 0.8920, test_loss: 0.9663, test_f1: 0.5145
 epoch: 33, train_loss: 0.9334, test_loss: 1.0437, test_f1: 0.5173
 epoch: 34, train_loss: 0.8946, test_loss: 1.0263, test_f1: 0.4948
 epoch: 35, train_loss: 0.8817, test_loss: 0.9909, test_f1: 0.5227
 epoch: 36, train_loss: 0.8649, test_loss: 0.9762, test_f1: 0.5133
 epoch: 37, train_loss: 0.8693, test_loss: 0.9865, test_f1: 0.5220
 epoch: 38, train_loss: 0.8477, test_loss: 1.0212, test_f1: 0.5102
 epoch: 39, train_loss: 0.8509, test_loss: 1.0264, test_f1: 0.4894
 epoch: 40, train_loss: 0.8470, test_loss: 1.0735, test_f1: 0.4958
 epoch: 41, train_loss: 0.8497, test_loss: 0.8903, test_f1: 0.5300
 epoch: 42, train_loss: 0.8608, test_loss: 1.0707, test_f1: 0.4908
 epoch: 43, train_loss: 0.8610, test_loss: 1.0329, test_f1: 0.4975
 epoch: 44, train_loss: 0.8360, test_loss: 1.0802, test_f1: 0.5134
 epoch: 45, train_loss: 0.8255, test_loss: 0.9795, test_f1: 0.5212
 epoch: 46, train_loss: 0.8309, test_loss: 1.0923, test_f1: 0.5079
 epoch: 47, train_loss: 0.8331, test_loss: 1.1124, test_f1: 0.4816
 epoch: 48, train_loss: 0.8223, test_loss: 1.0897, test_f1: 0.5246
 epoch: 49, train_loss: 0.9469, test_loss: 1.2677, test_f1: 0.3729
 epoch: 50, train_loss: 1.0666, test_loss: 0.9649, test_f1: 0.4764
 epoch: 51, train_loss: 1.0013, test_loss: 1.0230, test_f1: 0.4588
 epoch: 52, train_loss: 0.9535, test_loss: 1.0408, test_f1: 0.4881
 epoch: 53, train_loss: 0.9280, test_loss: 1.0460, test_f1: 0.4731
 epoch: 54, train_loss: 0.9184, test_loss: 1.0357, test_f1: 0.4874
 epoch: 55, train_loss: 0.8988, test_loss: 1.0365, test_f1: 0.4815
 epoch: 56, train_loss: 0.8963, test_loss: 1.0446, test_f1: 0.4933
 epoch: 57, train_loss: 0.8863, test_loss: 1.0678, test_f1: 0.4995
 epoch: 58, train_loss: 0.8773, test_loss: 1.0205, test_f1: 0.4957
 epoch: 59, train_loss: 0.8774, test_loss: 1.0040, test_f1: 0.5050
 epoch: 60, train_loss: 0.8784, test_loss: 1.0600, test_f1: 0.4923
 epoch: 61, train_loss: 0.8705, test_loss: 0.9853, test_f1: 0.4972
 epoch: 62, train_loss: 0.8614, test_loss: 1.0062, test_f1: 0.4994
 epoch: 63, train_loss: 0.8468, test_loss: 1.0362, test_f1: 0.5036
 epoch: 64, train_loss: 0.8603, test_loss: 1.0677, test_f1: 0.5121
 epoch: 65, train_loss: 0.8404, test_loss: 1.1571, test_f1: 0.4922
 epoch: 66, train_loss: 0.8472, test_loss: 1.0093, test_f1: 0.5110
 epoch: 67, train_loss: 0.8347, test_loss: 1.1633, test_f1: 0.4853
 epoch: 68, train_loss: 0.8437, test_loss: 1.0448, test_f1: 0.4984
 epoch: 69, train_loss: 0.8487, test_loss: 1.0222, test_f1: 0.5134
 epoch: 70, train_loss: 0.8272, test_loss: 1.0372, test_f1: 0.4991
 epoch: 71, train_loss: 0.8278, test_loss: 1.0043, test_f1: 0.5065
 epoch: 72, train_loss: 0.8157, test_loss: 1.0142, test_f1: 0.5021
 epoch: 73, train_loss: 0.8366, test_loss: 0.9685, test_f1: 0.4993
 epoch: 74, train_loss: 0.8350, test_loss: 1.0140, test_f1: 0.5178
 epoch: 75, train_loss: 0.8159, test_loss: 1.0121, test_f1: 0.5085
 epoch: 76, train_loss: 0.8184, test_loss: 0.9967, test_f1: 0.5108
 epoch: 77, train_loss: 0.8147, test_loss: 1.0292, test_f1: 0.5009
 epoch: 78, train_loss: 0.8102, test_loss: 1.0248, test_f1: 0.5063
 epoch: 79, train_loss: 0.7971, test_loss: 0.9884, test_f1: 0.5163
 epoch: 80, train_loss: 0.8008, test_loss: 0.9654, test_f1: 0.5034
 epoch: 81, train_loss: 0.8079, test_loss: 0.9172, test_f1: 0.5229
 epoch: 82, train_loss: 0.7996, test_loss: 1.0254, test_f1: 0.5003
 epoch: 83, train_loss: 0.7839, test_loss: 1.0006, test_f1: 0.5017
 epoch: 84, train_loss: 0.7950, test_loss: 0.9855, test_f1: 0.5060
 epoch: 85, train_loss: 0.7899, test_loss: 0.9749, test_f1: 0.4993
 epoch: 86, train_loss: 0.7925, test_loss: 1.0007, test_f1: 0.5068
 epoch: 87, train_loss: 0.7844, test_loss: 1.0523, test_f1: 0.5168
 epoch: 88, train_loss: 0.7849, test_loss: 1.0066, test_f1: 0.5161
 epoch: 89, train_loss: 0.7758, test_loss: 1.0155, test_f1: 0.5233
 epoch: 90, train_loss: 0.7978, test_loss: 1.0677, test_f1: 0.4917
 epoch: 91, train_loss: 0.7732, test_loss: 1.0318, test_f1: 0.5029
 epoch: 92, train_loss: 0.7683, test_loss: 1.0573, test_f1: 0.5246
 epoch: 93, train_loss: 0.7848, test_loss: 1.0279, test_f1: 0.5137
 epoch: 94, train_loss: 0.7708, test_loss: 1.0466, test_f1: 0.5125
 epoch: 95, train_loss: 0.7667, test_loss: 1.0577, test_f1: 0.5221
 epoch: 96, train_loss: 0.7514, test_loss: 1.0421, test_f1: 0.5103
 epoch: 97, train_loss: 0.7670, test_loss: 1.0981, test_f1: 0.4907
 epoch: 98, train_loss: 0.7744, test_loss: 0.9978, test_f1: 0.5310
 epoch: 99, train_loss: 0.7550, test_loss: 1.0522, test_f1: 0.5160

Training completed in 758.97 seconds
Best F1: 0.6041 at epoch 56
Mean F1 across iterations: 0.5888  0.0213
========================FINAL RESULTS================================
FEGIN weighted F1: 0.6041  0.0213
python main.py --data ltspice_examples --representation component_component --model FEGIN --layers 5 --hiddens 32 --batch_size 64 --lr 0.01 --emb_size 128 --epochs 100 --save_appendix component_component_L5_H32_BS64_LR0.01_E128 --no_val
-----



STDERR:
  File "main.py", line 370, in <module>
    main()
  File "main.py", line 254, in main
    dataset = dataset_class(
  File "/home/philip/projects/ltspice_examples_code_repo/Circuit-Completion-Using-GNNs/component_classification_with_link_prediction_head/evaluation/FEGIN/kernel/circuit_datasets.py", line 15, in __init__
    self.data, self.slices = torch.load(self.processed_paths[0])
  File "/home/philip/.local/lib/python3.8/site-packages/torch/serialization.py", line 1040, in load
    warnings.warn(
  File "/usr/lib/python3.8/warnings.py", line 109, in _showwarnmsg
    sw(msg.message, msg.category, msg.filename, msg.lineno,
  File "main.py", line 47, in warn_with_traceback
    traceback.print_stack(file=log)
/home/philip/projects/ltspice_examples_code_repo/Circuit-Completion-Using-GNNs/component_classification_with_link_prediction_head/evaluation/FEGIN/kernel/circuit_datasets.py:15: FutureWarning: You are using `torch.load` with `weights_only=False` (the current default value), which uses the default pickle module implicitly. It is possible to construct malicious pickle data which will execute arbitrary code during unpickling (See https://github.com/pytorch/pytorch/blob/main/SECURITY.md#untrusted-models for more details). In a future release, the default value for `weights_only` will be flipped to `True`. This limits the functions that could be executed during unpickling. Arbitrary objects will no longer be allowed to be loaded via this mode unless they are explicitly allowlisted by the user via `torch.serialization.add_safe_globals`. We recommend you start setting `weights_only=True` for any use case where you don't have full control of the loaded file. Please open an issue on GitHub for any issues related to this experimental feature.
  self.data, self.slices = torch.load(self.processed_paths[0])
