STDOUT:
Results will be saved in /home/philip/projects/ltspice_examples_code_repo/Circuit-Completion-Using-GNNs/component_classification_with_link_prediction_head/evaluation/FEGIN/results/model_FEGIN_dataset_ltspice_demos
Command line input: python main.py --data ltspice_demos --representation component_pin_net --model FEGIN --layers 3 --hiddens 32 --batch_size 64 --lr 0.01 --emb_size 512 --epochs 100 --save_appendix component_pin_net_L3_H32_BS64_LR0.01_E512 --no_val
 is saved.
-----
ltspice_demos - FEGIN
Using 3 layers, 32 hidden units, h = 2
Loading component_pin_net representation dataset
ENTERED
Training FEGIN on component_pin_net representation
Train: 1565, Test: 383
##################ITERATION #0 ****************************************
 epoch: 0, train_loss: 1.2335, test_loss: 1.2878, test_f1: 0.2281
 epoch: 1, train_loss: 1.1068, test_loss: 1.1941, test_f1: 0.3277
 epoch: 2, train_loss: 1.0496, test_loss: 1.1047, test_f1: 0.4203
 epoch: 3, train_loss: 1.0050, test_loss: 1.1484, test_f1: 0.4177
 epoch: 4, train_loss: 0.9770, test_loss: 1.1314, test_f1: 0.4425
 epoch: 5, train_loss: 0.9627, test_loss: 1.0440, test_f1: 0.4954
 epoch: 6, train_loss: 0.9428, test_loss: 1.0533, test_f1: 0.4315
 epoch: 7, train_loss: 0.9155, test_loss: 1.0503, test_f1: 0.4366
 epoch: 8, train_loss: 0.8993, test_loss: 1.0187, test_f1: 0.4971
 epoch: 9, train_loss: 0.8803, test_loss: 1.1035, test_f1: 0.4592
 epoch: 10, train_loss: 0.8572, test_loss: 1.1409, test_f1: 0.4687
 epoch: 11, train_loss: 0.8469, test_loss: 0.9675, test_f1: 0.5833
 epoch: 12, train_loss: 0.8339, test_loss: 1.4472, test_f1: 0.4782
 epoch: 13, train_loss: 0.8308, test_loss: 1.0689, test_f1: 0.4368
 epoch: 14, train_loss: 0.8315, test_loss: 1.0545, test_f1: 0.6064
 epoch: 15, train_loss: 0.8186, test_loss: 1.0368, test_f1: 0.5414
 epoch: 16, train_loss: 0.7877, test_loss: 1.0029, test_f1: 0.5196
 epoch: 17, train_loss: 0.7772, test_loss: 1.0523, test_f1: 0.5595
 epoch: 18, train_loss: 0.7831, test_loss: 1.0319, test_f1: 0.4803
 epoch: 19, train_loss: 0.7666, test_loss: 1.0223, test_f1: 0.5217
 epoch: 20, train_loss: 0.7604, test_loss: 1.1959, test_f1: 0.5201
 epoch: 21, train_loss: 0.7760, test_loss: 1.0171, test_f1: 0.5453
 epoch: 22, train_loss: 0.7269, test_loss: 1.2624, test_f1: 0.5510
 epoch: 23, train_loss: 0.7441, test_loss: 1.0046, test_f1: 0.5809
 epoch: 24, train_loss: 0.7083, test_loss: 1.0685, test_f1: 0.5809
 epoch: 25, train_loss: 0.7209, test_loss: 1.1385, test_f1: 0.4614
 epoch: 26, train_loss: 0.7248, test_loss: 1.0970, test_f1: 0.5794
 epoch: 27, train_loss: 0.7195, test_loss: 1.2917, test_f1: 0.4952
 epoch: 28, train_loss: 0.6970, test_loss: 1.2384, test_f1: 0.4572
 epoch: 29, train_loss: 0.7055, test_loss: 1.1252, test_f1: 0.5590
 epoch: 30, train_loss: 0.6958, test_loss: 1.2100, test_f1: 0.5326
 epoch: 31, train_loss: 0.6698, test_loss: 1.0605, test_f1: 0.5769
 epoch: 32, train_loss: 0.6670, test_loss: 1.1862, test_f1: 0.5976
 epoch: 33, train_loss: 0.7020, test_loss: 1.0333, test_f1: 0.6038
 epoch: 34, train_loss: 0.6871, test_loss: 1.0146, test_f1: 0.5918
 epoch: 35, train_loss: 0.6655, test_loss: 1.1750, test_f1: 0.5725
 epoch: 36, train_loss: 0.6423, test_loss: 1.3761, test_f1: 0.4341
 epoch: 37, train_loss: 0.6430, test_loss: 1.0756, test_f1: 0.5155
 epoch: 38, train_loss: 0.6632, test_loss: 1.0761, test_f1: 0.5633
 epoch: 39, train_loss: 0.6471, test_loss: 1.1078, test_f1: 0.5466
 epoch: 40, train_loss: 0.6268, test_loss: 1.0726, test_f1: 0.6105
 epoch: 41, train_loss: 0.6199, test_loss: 1.0798, test_f1: 0.5707
 epoch: 42, train_loss: 0.6076, test_loss: 1.1342, test_f1: 0.6411
 epoch: 43, train_loss: 0.6175, test_loss: 0.9864, test_f1: 0.6396
 epoch: 44, train_loss: 0.6180, test_loss: 1.1422, test_f1: 0.6112
 epoch: 45, train_loss: 0.6004, test_loss: 1.6238, test_f1: 0.5625
 epoch: 46, train_loss: 0.6335, test_loss: 1.0030, test_f1: 0.6429
 epoch: 47, train_loss: 0.5937, test_loss: 1.2031, test_f1: 0.5843
 epoch: 48, train_loss: 0.6611, test_loss: 0.9765, test_f1: 0.6570
 epoch: 49, train_loss: 0.6261, test_loss: 1.1394, test_f1: 0.6177
 epoch: 50, train_loss: 0.6064, test_loss: 1.3140, test_f1: 0.5566
 epoch: 51, train_loss: 0.5578, test_loss: 1.1487, test_f1: 0.6225
 epoch: 52, train_loss: 0.5229, test_loss: 1.0880, test_f1: 0.6635
 epoch: 53, train_loss: 0.5252, test_loss: 1.1546, test_f1: 0.6402
 epoch: 54, train_loss: 0.5097, test_loss: 1.1707, test_f1: 0.6425
 epoch: 55, train_loss: 0.5110, test_loss: 1.0425, test_f1: 0.6358
 epoch: 56, train_loss: 0.5182, test_loss: 1.0490, test_f1: 0.6898
 epoch: 57, train_loss: 0.5399, test_loss: 1.1284, test_f1: 0.6453
 epoch: 58, train_loss: 0.5117, test_loss: 1.1060, test_f1: 0.6457
 epoch: 59, train_loss: 0.5030, test_loss: 1.2296, test_f1: 0.6525
 epoch: 60, train_loss: 0.4863, test_loss: 1.0529, test_f1: 0.6741
 epoch: 61, train_loss: 0.4867, test_loss: 1.3649, test_f1: 0.6010
 epoch: 62, train_loss: 0.4906, test_loss: 1.1923, test_f1: 0.6103
 epoch: 63, train_loss: 0.4449, test_loss: 1.3007, test_f1: 0.6296
 epoch: 64, train_loss: 0.4688, test_loss: 1.1192, test_f1: 0.6657
 epoch: 65, train_loss: 0.4481, test_loss: 1.1698, test_f1: 0.6526
 epoch: 66, train_loss: 0.4826, test_loss: 1.1829, test_f1: 0.6812
 epoch: 67, train_loss: 0.4846, test_loss: 1.3002, test_f1: 0.6541
 epoch: 68, train_loss: 0.4845, test_loss: 1.1397, test_f1: 0.6681
 epoch: 69, train_loss: 0.4448, test_loss: 1.2941, test_f1: 0.6359
 epoch: 70, train_loss: 0.4376, test_loss: 1.1952, test_f1: 0.6615
 epoch: 71, train_loss: 0.4739, test_loss: 1.4097, test_f1: 0.5793
 epoch: 72, train_loss: 0.4493, test_loss: 1.1683, test_f1: 0.6558
 epoch: 73, train_loss: 0.4484, test_loss: 1.1848, test_f1: 0.6738
 epoch: 74, train_loss: 0.4677, test_loss: 1.3177, test_f1: 0.6496
 epoch: 75, train_loss: 0.4607, test_loss: 1.4253, test_f1: 0.6347
 epoch: 76, train_loss: 0.4215, test_loss: 1.3172, test_f1: 0.6730
 epoch: 77, train_loss: 0.4435, test_loss: 1.3614, test_f1: 0.6665
 epoch: 78, train_loss: 0.4432, test_loss: 1.4725, test_f1: 0.6258
 epoch: 79, train_loss: 0.4398, test_loss: 1.2625, test_f1: 0.6928
 epoch: 80, train_loss: 0.4231, test_loss: 1.2673, test_f1: 0.6646
 epoch: 81, train_loss: 0.4166, test_loss: 1.5485, test_f1: 0.6536
 epoch: 82, train_loss: 0.4307, test_loss: 1.2444, test_f1: 0.6847
 epoch: 83, train_loss: 0.4446, test_loss: 1.2015, test_f1: 0.6857
 epoch: 84, train_loss: 0.4151, test_loss: 1.3376, test_f1: 0.6982
 epoch: 85, train_loss: 0.4042, test_loss: 1.3346, test_f1: 0.6728
 epoch: 86, train_loss: 0.4125, test_loss: 1.3140, test_f1: 0.6600
 epoch: 87, train_loss: 0.4724, test_loss: 1.5727, test_f1: 0.5929
 epoch: 88, train_loss: 0.4317, test_loss: 1.3633, test_f1: 0.6165
 epoch: 89, train_loss: 0.4288, test_loss: 1.6440, test_f1: 0.5797
 epoch: 90, train_loss: 0.4237, test_loss: 1.2920, test_f1: 0.6568
 epoch: 91, train_loss: 0.4257, test_loss: 1.1843, test_f1: 0.6576
 epoch: 92, train_loss: 0.4062, test_loss: 1.4860, test_f1: 0.6204
 epoch: 93, train_loss: 0.4115, test_loss: 1.3570, test_f1: 0.6638
 epoch: 94, train_loss: 0.4332, test_loss: 1.4696, test_f1: 0.6400
 epoch: 95, train_loss: 0.4076, test_loss: 1.4081, test_f1: 0.6643
 epoch: 96, train_loss: 0.4023, test_loss: 1.6852, test_f1: 0.6058
 epoch: 97, train_loss: 0.4008, test_loss: 1.3021, test_f1: 0.6495
 epoch: 98, train_loss: 0.4089, test_loss: 1.2563, test_f1: 0.6594
 epoch: 99, train_loss: 0.3906, test_loss: 1.3632, test_f1: 0.6376
##################ITERATION #1 ****************************************
 epoch: 0, train_loss: 1.0839, test_loss: 1.4226, test_f1: 0.2281
 epoch: 1, train_loss: 0.9848, test_loss: 1.1843, test_f1: 0.3327
 epoch: 2, train_loss: 0.9471, test_loss: 1.0100, test_f1: 0.5293
 epoch: 3, train_loss: 0.9106, test_loss: 1.0208, test_f1: 0.5031
 epoch: 4, train_loss: 0.8868, test_loss: 1.0732, test_f1: 0.4425
 epoch: 5, train_loss: 0.8654, test_loss: 0.9445, test_f1: 0.5834
 epoch: 6, train_loss: 0.8469, test_loss: 1.0603, test_f1: 0.5535
 epoch: 7, train_loss: 0.8529, test_loss: 0.9677, test_f1: 0.5764
 epoch: 8, train_loss: 0.8636, test_loss: 0.9885, test_f1: 0.5062
 epoch: 9, train_loss: 0.8277, test_loss: 0.9566, test_f1: 0.5693
 epoch: 10, train_loss: 0.8176, test_loss: 1.2066, test_f1: 0.4929
 epoch: 11, train_loss: 0.8158, test_loss: 0.9942, test_f1: 0.5384
 epoch: 12, train_loss: 0.8076, test_loss: 1.1340, test_f1: 0.5007
 epoch: 13, train_loss: 0.7960, test_loss: 0.9592, test_f1: 0.6152
 epoch: 14, train_loss: 0.8019, test_loss: 1.0052, test_f1: 0.5627
 epoch: 15, train_loss: 0.7999, test_loss: 1.1737, test_f1: 0.5169
 epoch: 16, train_loss: 0.7787, test_loss: 1.0505, test_f1: 0.5692
 epoch: 17, train_loss: 0.7594, test_loss: 1.0050, test_f1: 0.6003
 epoch: 18, train_loss: 0.7388, test_loss: 1.3863, test_f1: 0.4934
 epoch: 19, train_loss: 0.7455, test_loss: 1.2809, test_f1: 0.4845
 epoch: 20, train_loss: 0.7357, test_loss: 1.1223, test_f1: 0.5546
 epoch: 21, train_loss: 0.7569, test_loss: 1.2131, test_f1: 0.4599
 epoch: 22, train_loss: 0.7539, test_loss: 0.9463, test_f1: 0.6137
 epoch: 23, train_loss: 0.7462, test_loss: 1.4209, test_f1: 0.4722
 epoch: 24, train_loss: 0.7301, test_loss: 1.0950, test_f1: 0.5845
 epoch: 25, train_loss: 0.7432, test_loss: 1.0120, test_f1: 0.5523
 epoch: 26, train_loss: 0.6940, test_loss: 1.3408, test_f1: 0.5160
 epoch: 27, train_loss: 0.7576, test_loss: 0.8917, test_f1: 0.6441
 epoch: 28, train_loss: 0.7193, test_loss: 1.2002, test_f1: 0.5322
 epoch: 29, train_loss: 0.7269, test_loss: 1.5373, test_f1: 0.4798
 epoch: 30, train_loss: 0.7433, test_loss: 1.0281, test_f1: 0.5618
 epoch: 31, train_loss: 0.6747, test_loss: 1.0627, test_f1: 0.6045
 epoch: 32, train_loss: 0.6707, test_loss: 1.5884, test_f1: 0.5077
 epoch: 33, train_loss: 0.6645, test_loss: 1.1063, test_f1: 0.6375
 epoch: 34, train_loss: 0.6502, test_loss: 1.2033, test_f1: 0.5609
 epoch: 35, train_loss: 0.6527, test_loss: 1.1549, test_f1: 0.6095
 epoch: 36, train_loss: 0.6664, test_loss: 1.0220, test_f1: 0.6048
 epoch: 37, train_loss: 0.6565, test_loss: 1.1426, test_f1: 0.6008
 epoch: 38, train_loss: 0.6265, test_loss: 1.2833, test_f1: 0.5282
 epoch: 39, train_loss: 0.6459, test_loss: 1.1129, test_f1: 0.6051
 epoch: 40, train_loss: 0.6785, test_loss: 1.2390, test_f1: 0.5571
 epoch: 41, train_loss: 0.6334, test_loss: 1.1051, test_f1: 0.6083
 epoch: 42, train_loss: 0.6345, test_loss: 1.4428, test_f1: 0.5048
 epoch: 43, train_loss: 0.6280, test_loss: 1.2402, test_f1: 0.5842
 epoch: 44, train_loss: 0.6975, test_loss: 1.0471, test_f1: 0.6125
 epoch: 45, train_loss: 0.6126, test_loss: 1.3535, test_f1: 0.5801
 epoch: 46, train_loss: 0.6255, test_loss: 1.1299, test_f1: 0.6007
 epoch: 47, train_loss: 0.6443, test_loss: 1.5284, test_f1: 0.5755
 epoch: 48, train_loss: 0.6439, test_loss: 1.0744, test_f1: 0.6247
 epoch: 49, train_loss: 0.5861, test_loss: 1.4127, test_f1: 0.5474
 epoch: 50, train_loss: 0.6094, test_loss: 1.3100, test_f1: 0.5517
 epoch: 51, train_loss: 0.5686, test_loss: 1.1192, test_f1: 0.6173
 epoch: 52, train_loss: 0.5589, test_loss: 1.1710, test_f1: 0.6275
 epoch: 53, train_loss: 0.5481, test_loss: 1.2440, test_f1: 0.5985
 epoch: 54, train_loss: 0.5366, test_loss: 1.2131, test_f1: 0.6262
 epoch: 55, train_loss: 0.5100, test_loss: 1.3151, test_f1: 0.6194
 epoch: 56, train_loss: 0.4952, test_loss: 1.3343, test_f1: 0.6362
 epoch: 57, train_loss: 0.5304, test_loss: 1.2756, test_f1: 0.6320
 epoch: 58, train_loss: 0.5021, test_loss: 2.0578, test_f1: 0.5568
 epoch: 59, train_loss: 0.5206, test_loss: 1.3964, test_f1: 0.6309
 epoch: 60, train_loss: 0.5262, test_loss: 1.4027, test_f1: 0.5805
 epoch: 61, train_loss: 0.5057, test_loss: 1.2094, test_f1: 0.5950
 epoch: 62, train_loss: 0.4988, test_loss: 1.7699, test_f1: 0.5976
 epoch: 63, train_loss: 0.5072, test_loss: 1.6640, test_f1: 0.5954
 epoch: 64, train_loss: 0.4866, test_loss: 1.5181, test_f1: 0.6494
 epoch: 65, train_loss: 0.4825, test_loss: 1.3448, test_f1: 0.6031
 epoch: 66, train_loss: 0.4809, test_loss: 1.5953, test_f1: 0.5892
 epoch: 67, train_loss: 0.4830, test_loss: 1.3760, test_f1: 0.6236
 epoch: 68, train_loss: 0.4753, test_loss: 1.4335, test_f1: 0.5532
 epoch: 69, train_loss: 0.4938, test_loss: 1.9458, test_f1: 0.5881
 epoch: 70, train_loss: 0.4765, test_loss: 1.7398, test_f1: 0.6290
 epoch: 71, train_loss: 0.4896, test_loss: 2.0353, test_f1: 0.6072
 epoch: 72, train_loss: 0.4958, test_loss: 1.3981, test_f1: 0.6486
 epoch: 73, train_loss: 0.4763, test_loss: 1.3629, test_f1: 0.6523
 epoch: 74, train_loss: 0.4828, test_loss: 1.6588, test_f1: 0.6251
 epoch: 75, train_loss: 0.4820, test_loss: 1.5949, test_f1: 0.5315
 epoch: 76, train_loss: 0.4851, test_loss: 1.6435, test_f1: 0.6182
 epoch: 77, train_loss: 0.4599, test_loss: 1.9385, test_f1: 0.6040
 epoch: 78, train_loss: 0.4604, test_loss: 1.6980, test_f1: 0.5478
 epoch: 79, train_loss: 0.4327, test_loss: 1.8471, test_f1: 0.5511
 epoch: 80, train_loss: 0.4766, test_loss: 1.8027, test_f1: 0.5885
 epoch: 81, train_loss: 0.4516, test_loss: 1.6084, test_f1: 0.5652
 epoch: 82, train_loss: 0.4744, test_loss: 1.4602, test_f1: 0.5614
 epoch: 83, train_loss: 0.4673, test_loss: 1.4569, test_f1: 0.6192
 epoch: 84, train_loss: 0.4339, test_loss: 1.5632, test_f1: 0.6302
 epoch: 85, train_loss: 0.4143, test_loss: 1.7624, test_f1: 0.5819
 epoch: 86, train_loss: 0.4448, test_loss: 1.5744, test_f1: 0.5994
 epoch: 87, train_loss: 0.4664, test_loss: 1.6524, test_f1: 0.6419
 epoch: 88, train_loss: 0.4397, test_loss: 1.9892, test_f1: 0.5902
 epoch: 89, train_loss: 0.4501, test_loss: 2.0076, test_f1: 0.6273
 epoch: 90, train_loss: 0.4197, test_loss: 1.8037, test_f1: 0.5938
 epoch: 91, train_loss: 0.4336, test_loss: 1.7493, test_f1: 0.5936
 epoch: 92, train_loss: 0.3826, test_loss: 1.7772, test_f1: 0.6093
 epoch: 93, train_loss: 0.4038, test_loss: 1.6504, test_f1: 0.6428
 epoch: 94, train_loss: 0.4076, test_loss: 1.7182, test_f1: 0.6177
 epoch: 95, train_loss: 0.4343, test_loss: 2.4244, test_f1: 0.5736
 epoch: 96, train_loss: 0.4292, test_loss: 1.6917, test_f1: 0.5972
 epoch: 97, train_loss: 0.4387, test_loss: 1.7225, test_f1: 0.6214
 epoch: 98, train_loss: 0.4284, test_loss: 2.3614, test_f1: 0.5341
 epoch: 99, train_loss: 0.4142, test_loss: 1.9771, test_f1: 0.5746
##################ITERATION #2 ****************************************
 epoch: 0, train_loss: 1.1629, test_loss: 1.3755, test_f1: 0.2278
 epoch: 1, train_loss: 0.9709, test_loss: 1.2570, test_f1: 0.4251
 epoch: 2, train_loss: 0.9431, test_loss: 1.0500, test_f1: 0.4949
 epoch: 3, train_loss: 0.8970, test_loss: 1.1119, test_f1: 0.4743
 epoch: 4, train_loss: 0.9039, test_loss: 1.0564, test_f1: 0.5273
 epoch: 5, train_loss: 0.8698, test_loss: 1.0391, test_f1: 0.5297
 epoch: 6, train_loss: 0.8441, test_loss: 1.0147, test_f1: 0.4668
 epoch: 7, train_loss: 0.8785, test_loss: 1.0547, test_f1: 0.5332
 epoch: 8, train_loss: 0.8371, test_loss: 1.0948, test_f1: 0.4276
 epoch: 9, train_loss: 0.8240, test_loss: 1.3781, test_f1: 0.4906
 epoch: 10, train_loss: 0.8169, test_loss: 1.1279, test_f1: 0.4541
 epoch: 11, train_loss: 0.7851, test_loss: 1.0476, test_f1: 0.5398
 epoch: 12, train_loss: 0.7786, test_loss: 1.1261, test_f1: 0.4846
 epoch: 13, train_loss: 0.7870, test_loss: 1.2265, test_f1: 0.4316
 epoch: 14, train_loss: 0.8029, test_loss: 1.1207, test_f1: 0.5174
 epoch: 15, train_loss: 0.7822, test_loss: 1.1713, test_f1: 0.5057
 epoch: 16, train_loss: 0.7758, test_loss: 1.1143, test_f1: 0.5158
 epoch: 17, train_loss: 0.7380, test_loss: 1.0662, test_f1: 0.5484
 epoch: 18, train_loss: 0.7346, test_loss: 1.1206, test_f1: 0.5203
 epoch: 19, train_loss: 0.7383, test_loss: 1.0728, test_f1: 0.5385
 epoch: 20, train_loss: 0.7315, test_loss: 1.0972, test_f1: 0.5788
 epoch: 21, train_loss: 0.7372, test_loss: 0.9835, test_f1: 0.6474
 epoch: 22, train_loss: 0.7448, test_loss: 1.0416, test_f1: 0.5178
 epoch: 23, train_loss: 0.6853, test_loss: 1.0089, test_f1: 0.6152
 epoch: 24, train_loss: 0.6929, test_loss: 1.1041, test_f1: 0.5129
 epoch: 25, train_loss: 0.6967, test_loss: 1.0776, test_f1: 0.5926
 epoch: 26, train_loss: 0.7098, test_loss: 1.0172, test_f1: 0.5904
 epoch: 27, train_loss: 0.6773, test_loss: 0.9869, test_f1: 0.5803
 epoch: 28, train_loss: 0.6563, test_loss: 0.9996, test_f1: 0.6046
 epoch: 29, train_loss: 0.6986, test_loss: 1.1009, test_f1: 0.5327
 epoch: 30, train_loss: 0.7119, test_loss: 1.3845, test_f1: 0.4882
 epoch: 31, train_loss: 0.6722, test_loss: 1.0629, test_f1: 0.5546
 epoch: 32, train_loss: 0.6858, test_loss: 1.1091, test_f1: 0.5675
 epoch: 33, train_loss: 0.6814, test_loss: 1.0348, test_f1: 0.5831
 epoch: 34, train_loss: 0.6589, test_loss: 1.2025, test_f1: 0.6082
 epoch: 35, train_loss: 0.6558, test_loss: 1.0733, test_f1: 0.5700
 epoch: 36, train_loss: 0.6666, test_loss: 1.0809, test_f1: 0.5623
 epoch: 37, train_loss: 0.6664, test_loss: 1.1089, test_f1: 0.5955
 epoch: 38, train_loss: 0.7010, test_loss: 1.1749, test_f1: 0.4678
 epoch: 39, train_loss: 0.6314, test_loss: 1.0056, test_f1: 0.5717
 epoch: 40, train_loss: 0.6247, test_loss: 1.1211, test_f1: 0.5918
 epoch: 41, train_loss: 0.6128, test_loss: 1.4161, test_f1: 0.5327
 epoch: 42, train_loss: 0.6178, test_loss: 1.1082, test_f1: 0.5481
 epoch: 43, train_loss: 0.6278, test_loss: 1.1229, test_f1: 0.5809
 epoch: 44, train_loss: 0.6179, test_loss: 1.1705, test_f1: 0.5700
 epoch: 45, train_loss: 0.5999, test_loss: 1.1666, test_f1: 0.5678
 epoch: 46, train_loss: 0.6161, test_loss: 1.0474, test_f1: 0.6130
 epoch: 47, train_loss: 0.5939, test_loss: 1.0514, test_f1: 0.5990
 epoch: 48, train_loss: 0.6047, test_loss: 1.1042, test_f1: 0.6129
 epoch: 49, train_loss: 0.6018, test_loss: 1.0270, test_f1: 0.6136
 epoch: 50, train_loss: 0.5837, test_loss: 1.4021, test_f1: 0.5266
 epoch: 51, train_loss: 0.5581, test_loss: 1.1241, test_f1: 0.5689
 epoch: 52, train_loss: 0.5435, test_loss: 1.1183, test_f1: 0.5769
 epoch: 53, train_loss: 0.5288, test_loss: 1.1715, test_f1: 0.6249
 epoch: 54, train_loss: 0.5269, test_loss: 1.1523, test_f1: 0.6165
 epoch: 55, train_loss: 0.5276, test_loss: 1.1850, test_f1: 0.6025
 epoch: 56, train_loss: 0.5322, test_loss: 1.2135, test_f1: 0.6110
 epoch: 57, train_loss: 0.5214, test_loss: 1.1877, test_f1: 0.6455
 epoch: 58, train_loss: 0.5067, test_loss: 1.3575, test_f1: 0.5714
 epoch: 59, train_loss: 0.5334, test_loss: 1.2691, test_f1: 0.5958
 epoch: 60, train_loss: 0.5321, test_loss: 1.4608, test_f1: 0.5557
 epoch: 61, train_loss: 0.5171, test_loss: 1.1766, test_f1: 0.5953
 epoch: 62, train_loss: 0.4898, test_loss: 1.1479, test_f1: 0.6327
 epoch: 63, train_loss: 0.5229, test_loss: 1.4060, test_f1: 0.5579
 epoch: 64, train_loss: 0.5308, test_loss: 1.3471, test_f1: 0.6116
 epoch: 65, train_loss: 0.5168, test_loss: 1.1859, test_f1: 0.6114
 epoch: 66, train_loss: 0.4872, test_loss: 1.2207, test_f1: 0.6565
 epoch: 67, train_loss: 0.4504, test_loss: 1.3134, test_f1: 0.6323
 epoch: 68, train_loss: 0.4866, test_loss: 1.3298, test_f1: 0.6084
 epoch: 69, train_loss: 0.4485, test_loss: 1.2398, test_f1: 0.6676
 epoch: 70, train_loss: 0.4774, test_loss: 1.3805, test_f1: 0.6198
 epoch: 71, train_loss: 0.4759, test_loss: 1.2046, test_f1: 0.6611
 epoch: 72, train_loss: 0.4601, test_loss: 1.1731, test_f1: 0.6563
 epoch: 73, train_loss: 0.4698, test_loss: 1.4022, test_f1: 0.6066
 epoch: 74, train_loss: 0.4589, test_loss: 1.3885, test_f1: 0.5981
 epoch: 75, train_loss: 0.4764, test_loss: 1.3311, test_f1: 0.6156
 epoch: 76, train_loss: 0.4823, test_loss: 1.2762, test_f1: 0.6327
 epoch: 77, train_loss: 0.4653, test_loss: 1.2791, test_f1: 0.6246
 epoch: 78, train_loss: 0.4166, test_loss: 1.7613, test_f1: 0.5599
 epoch: 79, train_loss: 0.4368, test_loss: 1.7054, test_f1: 0.5477
 epoch: 80, train_loss: 0.4566, test_loss: 1.2853, test_f1: 0.6410
 epoch: 81, train_loss: 0.4734, test_loss: 1.5181, test_f1: 0.6092
 epoch: 82, train_loss: 0.4538, test_loss: 1.5014, test_f1: 0.6096
 epoch: 83, train_loss: 0.4268, test_loss: 1.4857, test_f1: 0.5972
 epoch: 84, train_loss: 0.4345, test_loss: 1.6042, test_f1: 0.5979
 epoch: 85, train_loss: 0.4571, test_loss: 1.4279, test_f1: 0.6242
 epoch: 86, train_loss: 0.4613, test_loss: 1.4810, test_f1: 0.6210
 epoch: 87, train_loss: 0.4351, test_loss: 1.3368, test_f1: 0.6341
 epoch: 88, train_loss: 0.4577, test_loss: 1.3275, test_f1: 0.6240
 epoch: 89, train_loss: 0.4160, test_loss: 1.5687, test_f1: 0.6048
 epoch: 90, train_loss: 0.4151, test_loss: 1.4178, test_f1: 0.6165
 epoch: 91, train_loss: 0.4230, test_loss: 1.7700, test_f1: 0.5925
 epoch: 92, train_loss: 0.4229, test_loss: 1.6651, test_f1: 0.5998
 epoch: 93, train_loss: 0.4373, test_loss: 1.5226, test_f1: 0.5576
 epoch: 94, train_loss: 0.4240, test_loss: 1.4294, test_f1: 0.6469
 epoch: 95, train_loss: 0.4018, test_loss: 1.5185, test_f1: 0.6469
 epoch: 96, train_loss: 0.4004, test_loss: 1.4331, test_f1: 0.6325
 epoch: 97, train_loss: 0.3931, test_loss: 1.5534, test_f1: 0.6344
 epoch: 98, train_loss: 0.4042, test_loss: 1.5408, test_f1: 0.6031
 epoch: 99, train_loss: 0.3932, test_loss: 1.5514, test_f1: 0.5721
##################ITERATION #3 ****************************************
 epoch: 0, train_loss: 1.1509, test_loss: 1.1616, test_f1: 0.3881
 epoch: 1, train_loss: 0.9622, test_loss: 1.0415, test_f1: 0.4862
 epoch: 2, train_loss: 0.9073, test_loss: 1.0423, test_f1: 0.4796
 epoch: 3, train_loss: 0.8659, test_loss: 1.0324, test_f1: 0.5685
 epoch: 4, train_loss: 0.8708, test_loss: 1.0087, test_f1: 0.5142
 epoch: 5, train_loss: 0.8594, test_loss: 1.0807, test_f1: 0.5362
 epoch: 6, train_loss: 0.8476, test_loss: 1.1360, test_f1: 0.4977
 epoch: 7, train_loss: 0.8229, test_loss: 1.0665, test_f1: 0.5132
 epoch: 8, train_loss: 0.8347, test_loss: 1.0717, test_f1: 0.4821
 epoch: 9, train_loss: 0.8288, test_loss: 1.1487, test_f1: 0.4554
 epoch: 10, train_loss: 0.7691, test_loss: 1.0819, test_f1: 0.5435
 epoch: 11, train_loss: 0.7711, test_loss: 1.4340, test_f1: 0.4815
 epoch: 12, train_loss: 0.7627, test_loss: 1.1574, test_f1: 0.4608
 epoch: 13, train_loss: 0.8038, test_loss: 0.9748, test_f1: 0.5557
 epoch: 14, train_loss: 0.7687, test_loss: 1.0350, test_f1: 0.5207
 epoch: 15, train_loss: 0.7774, test_loss: 1.1972, test_f1: 0.5070
 epoch: 16, train_loss: 0.7324, test_loss: 1.5115, test_f1: 0.5018
 epoch: 17, train_loss: 0.7591, test_loss: 0.9986, test_f1: 0.6170
 epoch: 18, train_loss: 0.7300, test_loss: 1.0586, test_f1: 0.5276
 epoch: 19, train_loss: 0.7642, test_loss: 1.2861, test_f1: 0.3654
 epoch: 20, train_loss: 0.7654, test_loss: 2.0635, test_f1: 0.4644
 epoch: 21, train_loss: 0.7404, test_loss: 1.3075, test_f1: 0.5327
 epoch: 22, train_loss: 0.7167, test_loss: 1.0186, test_f1: 0.5734
 epoch: 23, train_loss: 0.7297, test_loss: 1.2169, test_f1: 0.5334
 epoch: 24, train_loss: 0.6940, test_loss: 1.3523, test_f1: 0.5385
 epoch: 25, train_loss: 0.6907, test_loss: 1.0803, test_f1: 0.5742
 epoch: 26, train_loss: 0.7083, test_loss: 1.2434, test_f1: 0.5247
 epoch: 27, train_loss: 0.6894, test_loss: 1.4333, test_f1: 0.5134
 epoch: 28, train_loss: 0.7183, test_loss: 1.1401, test_f1: 0.5526
 epoch: 29, train_loss: 0.6820, test_loss: 1.6215, test_f1: 0.4946
 epoch: 30, train_loss: 0.6896, test_loss: 1.6068, test_f1: 0.5329
 epoch: 31, train_loss: 0.6736, test_loss: 1.4892, test_f1: 0.4724
 epoch: 32, train_loss: 0.6696, test_loss: 1.4488, test_f1: 0.5085
 epoch: 33, train_loss: 0.6897, test_loss: 1.3745, test_f1: 0.5055
 epoch: 34, train_loss: 0.6493, test_loss: 1.4284, test_f1: 0.5850
 epoch: 35, train_loss: 0.6655, test_loss: 1.2689, test_f1: 0.5468
 epoch: 36, train_loss: 0.6909, test_loss: 1.4792, test_f1: 0.5171
 epoch: 37, train_loss: 0.6624, test_loss: 1.2439, test_f1: 0.5693
 epoch: 38, train_loss: 0.6509, test_loss: 1.5295, test_f1: 0.4809
 epoch: 39, train_loss: 0.6285, test_loss: 1.2370, test_f1: 0.4913
 epoch: 40, train_loss: 0.5969, test_loss: 1.3126, test_f1: 0.5455
 epoch: 41, train_loss: 0.6431, test_loss: 1.6717, test_f1: 0.4762
 epoch: 42, train_loss: 0.6339, test_loss: 1.3678, test_f1: 0.5482
 epoch: 43, train_loss: 0.6257, test_loss: 1.5764, test_f1: 0.5346
 epoch: 44, train_loss: 0.6188, test_loss: 1.3459, test_f1: 0.4805
 epoch: 45, train_loss: 0.6215, test_loss: 1.3713, test_f1: 0.5345
 epoch: 46, train_loss: 0.5886, test_loss: 1.7643, test_f1: 0.5542
 epoch: 47, train_loss: 0.6237, test_loss: 1.5110, test_f1: 0.5683
 epoch: 48, train_loss: 0.6380, test_loss: 1.2754, test_f1: 0.5511
 epoch: 49, train_loss: 0.5816, test_loss: 1.8024, test_f1: 0.5140
 epoch: 50, train_loss: 0.5898, test_loss: 1.3313, test_f1: 0.5863
 epoch: 51, train_loss: 0.5811, test_loss: 1.3857, test_f1: 0.5931
 epoch: 52, train_loss: 0.5522, test_loss: 1.3406, test_f1: 0.5936
 epoch: 53, train_loss: 0.5269, test_loss: 1.4329, test_f1: 0.6130
 epoch: 54, train_loss: 0.5204, test_loss: 1.5999, test_f1: 0.5936
 epoch: 55, train_loss: 0.5345, test_loss: 1.5044, test_f1: 0.5861
 epoch: 56, train_loss: 0.5223, test_loss: 1.4080, test_f1: 0.6117
 epoch: 57, train_loss: 0.5409, test_loss: 1.6520, test_f1: 0.5400
 epoch: 58, train_loss: 0.5088, test_loss: 1.4139, test_f1: 0.6470
 epoch: 59, train_loss: 0.4899, test_loss: 1.4606, test_f1: 0.6121
 epoch: 60, train_loss: 0.4840, test_loss: 1.6003, test_f1: 0.5860
 epoch: 61, train_loss: 0.4862, test_loss: 1.6378, test_f1: 0.5962
 epoch: 62, train_loss: 0.5217, test_loss: 1.4260, test_f1: 0.6264
 epoch: 63, train_loss: 0.4884, test_loss: 1.6815, test_f1: 0.5762
 epoch: 64, train_loss: 0.5188, test_loss: 1.5972, test_f1: 0.5944
 epoch: 65, train_loss: 0.5007, test_loss: 1.6514, test_f1: 0.6311
 epoch: 66, train_loss: 0.4443, test_loss: 1.6417, test_f1: 0.5962
 epoch: 67, train_loss: 0.4954, test_loss: 1.8628, test_f1: 0.6177
 epoch: 68, train_loss: 0.4880, test_loss: 1.6618, test_f1: 0.5908
 epoch: 69, train_loss: 0.4655, test_loss: 1.6388, test_f1: 0.5713
 epoch: 70, train_loss: 0.4851, test_loss: 1.4715, test_f1: 0.6100
 epoch: 71, train_loss: 0.4817, test_loss: 1.4451, test_f1: 0.5988
 epoch: 72, train_loss: 0.4868, test_loss: 1.5275, test_f1: 0.6618
 epoch: 73, train_loss: 0.4645, test_loss: 1.6580, test_f1: 0.6360
 epoch: 74, train_loss: 0.4902, test_loss: 1.6585, test_f1: 0.6108
 epoch: 75, train_loss: 0.4910, test_loss: 1.5801, test_f1: 0.5988
 epoch: 76, train_loss: 0.4643, test_loss: 1.5931, test_f1: 0.6382
 epoch: 77, train_loss: 0.4870, test_loss: 1.6170, test_f1: 0.5981
 epoch: 78, train_loss: 0.4809, test_loss: 1.4380, test_f1: 0.6641
 epoch: 79, train_loss: 0.4551, test_loss: 1.7531, test_f1: 0.6493
 epoch: 80, train_loss: 0.4418, test_loss: 1.8074, test_f1: 0.5845
 epoch: 81, train_loss: 0.4409, test_loss: 1.6611, test_f1: 0.6088
 epoch: 82, train_loss: 0.4694, test_loss: 1.5502, test_f1: 0.6369
 epoch: 83, train_loss: 0.4566, test_loss: 1.9960, test_f1: 0.6527
 epoch: 84, train_loss: 0.4632, test_loss: 1.8083, test_f1: 0.5364
 epoch: 85, train_loss: 0.4722, test_loss: 1.5366, test_f1: 0.6424
 epoch: 86, train_loss: 0.4639, test_loss: 1.6371, test_f1: 0.6221
 epoch: 87, train_loss: 0.4191, test_loss: 1.6996, test_f1: 0.6156
 epoch: 88, train_loss: 0.4473, test_loss: 1.6231, test_f1: 0.6325
 epoch: 89, train_loss: 0.4665, test_loss: 1.4622, test_f1: 0.6355
 epoch: 90, train_loss: 0.4510, test_loss: 1.4849, test_f1: 0.6795
 epoch: 91, train_loss: 0.4372, test_loss: 1.5314, test_f1: 0.6311
 epoch: 92, train_loss: 0.4230, test_loss: 1.4633, test_f1: 0.6326
 epoch: 93, train_loss: 0.4112, test_loss: 1.9316, test_f1: 0.6042
 epoch: 94, train_loss: 0.4293, test_loss: 1.6106, test_f1: 0.6289
 epoch: 95, train_loss: 0.4102, test_loss: 1.7031, test_f1: 0.6367
 epoch: 96, train_loss: 0.4148, test_loss: 1.9496, test_f1: 0.6041
 epoch: 97, train_loss: 0.4328, test_loss: 1.8623, test_f1: 0.6208
 epoch: 98, train_loss: 0.4513, test_loss: 1.6911, test_f1: 0.6239
 epoch: 99, train_loss: 0.4099, test_loss: 1.9286, test_f1: 0.6619
##################ITERATION #4 ****************************************
 epoch: 0, train_loss: 1.1159, test_loss: 1.7030, test_f1: 0.2149
 epoch: 1, train_loss: 0.9803, test_loss: 1.0315, test_f1: 0.4690
 epoch: 2, train_loss: 0.9344, test_loss: 1.1524, test_f1: 0.5272
 epoch: 3, train_loss: 0.8961, test_loss: 1.0624, test_f1: 0.4406
 epoch: 4, train_loss: 0.8625, test_loss: 1.0289, test_f1: 0.5119
 epoch: 5, train_loss: 0.8331, test_loss: 1.0631, test_f1: 0.5549
 epoch: 6, train_loss: 0.8505, test_loss: 1.0455, test_f1: 0.5147
 epoch: 7, train_loss: 0.8120, test_loss: 0.9820, test_f1: 0.5226
 epoch: 8, train_loss: 0.8179, test_loss: 1.4249, test_f1: 0.4603
 epoch: 9, train_loss: 0.8649, test_loss: 0.9505, test_f1: 0.5410
 epoch: 10, train_loss: 0.7982, test_loss: 1.0502, test_f1: 0.5411
 epoch: 11, train_loss: 0.7760, test_loss: 0.9766, test_f1: 0.5944
 epoch: 12, train_loss: 0.7564, test_loss: 0.9566, test_f1: 0.5772
 epoch: 13, train_loss: 0.7642, test_loss: 1.4982, test_f1: 0.4438
 epoch: 14, train_loss: 0.7395, test_loss: 1.3803, test_f1: 0.5246
 epoch: 15, train_loss: 0.7466, test_loss: 1.0324, test_f1: 0.5701
 epoch: 16, train_loss: 0.7466, test_loss: 1.1141, test_f1: 0.5357
 epoch: 17, train_loss: 0.7540, test_loss: 0.9797, test_f1: 0.5571
 epoch: 18, train_loss: 0.7533, test_loss: 1.0910, test_f1: 0.5278
 epoch: 19, train_loss: 0.7319, test_loss: 1.0038, test_f1: 0.5982
 epoch: 20, train_loss: 0.7146, test_loss: 1.0584, test_f1: 0.5478
 epoch: 21, train_loss: 0.6975, test_loss: 0.9270, test_f1: 0.6176
 epoch: 22, train_loss: 0.6906, test_loss: 1.0497, test_f1: 0.5523
 epoch: 23, train_loss: 0.6814, test_loss: 1.1464, test_f1: 0.5385
 epoch: 24, train_loss: 0.6937, test_loss: 1.0250, test_f1: 0.6102
 epoch: 25, train_loss: 0.7152, test_loss: 4.9221, test_f1: 0.2288
 epoch: 26, train_loss: 0.6553, test_loss: 1.3165, test_f1: 0.5057
 epoch: 27, train_loss: 0.6676, test_loss: 1.0881, test_f1: 0.5732
 epoch: 28, train_loss: 0.6473, test_loss: 1.0157, test_f1: 0.6424
 epoch: 29, train_loss: 0.6732, test_loss: 1.4657, test_f1: 0.4357
 epoch: 30, train_loss: 0.6737, test_loss: 1.0659, test_f1: 0.5538
 epoch: 31, train_loss: 0.6815, test_loss: 1.2548, test_f1: 0.5653
 epoch: 32, train_loss: 0.6802, test_loss: 1.1617, test_f1: 0.5648
 epoch: 33, train_loss: 0.6484, test_loss: 1.0951, test_f1: 0.6160
 epoch: 34, train_loss: 0.6561, test_loss: 1.1567, test_f1: 0.5419
 epoch: 35, train_loss: 0.6404, test_loss: 1.1046, test_f1: 0.6476
 epoch: 36, train_loss: 0.6184, test_loss: 1.0961, test_f1: 0.5997
 epoch: 37, train_loss: 0.6293, test_loss: 1.7005, test_f1: 0.4547
 epoch: 38, train_loss: 0.6137, test_loss: 1.1281, test_f1: 0.5183
 epoch: 39, train_loss: 0.6385, test_loss: 1.2553, test_f1: 0.5446
 epoch: 40, train_loss: 0.6141, test_loss: 1.1743, test_f1: 0.6205
 epoch: 41, train_loss: 0.5966, test_loss: 1.5295, test_f1: 0.4705
 epoch: 42, train_loss: 0.6038, test_loss: 1.3466, test_f1: 0.5536
 epoch: 43, train_loss: 0.6191, test_loss: 1.2185, test_f1: 0.6279
 epoch: 44, train_loss: 0.5986, test_loss: 1.1384, test_f1: 0.6351
 epoch: 45, train_loss: 0.6293, test_loss: 1.0906, test_f1: 0.5200
 epoch: 46, train_loss: 0.6153, test_loss: 1.2313, test_f1: 0.5717
 epoch: 47, train_loss: 0.5932, test_loss: 1.2950, test_f1: 0.5587
 epoch: 48, train_loss: 0.5978, test_loss: 1.1008, test_f1: 0.6262
 epoch: 49, train_loss: 0.5898, test_loss: 1.1603, test_f1: 0.5862
 epoch: 50, train_loss: 0.5766, test_loss: 1.1836, test_f1: 0.5584
 epoch: 51, train_loss: 0.5470, test_loss: 1.1805, test_f1: 0.6366
 epoch: 52, train_loss: 0.5324, test_loss: 1.2696, test_f1: 0.6143
 epoch: 53, train_loss: 0.5131, test_loss: 1.0854, test_f1: 0.6407
 epoch: 54, train_loss: 0.5075, test_loss: 1.1789, test_f1: 0.6190
 epoch: 55, train_loss: 0.5113, test_loss: 1.2153, test_f1: 0.6243
 epoch: 56, train_loss: 0.4954, test_loss: 1.1740, test_f1: 0.6420
 epoch: 57, train_loss: 0.5029, test_loss: 1.2783, test_f1: 0.5937
 epoch: 58, train_loss: 0.4701, test_loss: 1.5067, test_f1: 0.5986
 epoch: 59, train_loss: 0.4875, test_loss: 1.3190, test_f1: 0.6557
 epoch: 60, train_loss: 0.4815, test_loss: 1.4507, test_f1: 0.5165
 epoch: 61, train_loss: 0.4636, test_loss: 1.3121, test_f1: 0.6274
 epoch: 62, train_loss: 0.4724, test_loss: 1.3049, test_f1: 0.5847
 epoch: 63, train_loss: 0.5046, test_loss: 1.3729, test_f1: 0.5764
 epoch: 64, train_loss: 0.4655, test_loss: 1.2937, test_f1: 0.6556
 epoch: 65, train_loss: 0.4580, test_loss: 1.4042, test_f1: 0.5708
 epoch: 66, train_loss: 0.4822, test_loss: 1.3003, test_f1: 0.6476
 epoch: 67, train_loss: 0.4662, test_loss: 1.2631, test_f1: 0.6452
 epoch: 68, train_loss: 0.4485, test_loss: 1.3536, test_f1: 0.5430
 epoch: 69, train_loss: 0.4646, test_loss: 1.3135, test_f1: 0.6329
 epoch: 70, train_loss: 0.4510, test_loss: 1.3018, test_f1: 0.6026
 epoch: 71, train_loss: 0.4683, test_loss: 1.3748, test_f1: 0.6684
 epoch: 72, train_loss: 0.4468, test_loss: 1.5346, test_f1: 0.5757
 epoch: 73, train_loss: 0.4879, test_loss: 1.3905, test_f1: 0.5825
 epoch: 74, train_loss: 0.4421, test_loss: 1.3289, test_f1: 0.6629
 epoch: 75, train_loss: 0.4648, test_loss: 1.4120, test_f1: 0.5836
 epoch: 76, train_loss: 0.4457, test_loss: 1.5059, test_f1: 0.6155
 epoch: 77, train_loss: 0.4499, test_loss: 1.5461, test_f1: 0.6038
 epoch: 78, train_loss: 0.4670, test_loss: 1.3814, test_f1: 0.5908
 epoch: 79, train_loss: 0.4517, test_loss: 1.5766, test_f1: 0.5712
 epoch: 80, train_loss: 0.4623, test_loss: 1.4465, test_f1: 0.6060
 epoch: 81, train_loss: 0.4304, test_loss: 1.5255, test_f1: 0.6241
 epoch: 82, train_loss: 0.4722, test_loss: 1.4064, test_f1: 0.5902
 epoch: 83, train_loss: 0.4343, test_loss: 1.4733, test_f1: 0.5837
 epoch: 84, train_loss: 0.4196, test_loss: 1.3380, test_f1: 0.6249
 epoch: 85, train_loss: 0.4175, test_loss: 1.3727, test_f1: 0.5960
 epoch: 86, train_loss: 0.4260, test_loss: 1.6398, test_f1: 0.6007
 epoch: 87, train_loss: 0.4336, test_loss: 1.4658, test_f1: 0.5706
 epoch: 88, train_loss: 0.4434, test_loss: 1.3169, test_f1: 0.6016
 epoch: 89, train_loss: 0.3996, test_loss: 1.5597, test_f1: 0.6655
 epoch: 90, train_loss: 0.3866, test_loss: 1.3573, test_f1: 0.6183
 epoch: 91, train_loss: 0.4111, test_loss: 1.4106, test_f1: 0.6293
 epoch: 92, train_loss: 0.4081, test_loss: 1.5611, test_f1: 0.6429
 epoch: 93, train_loss: 0.4071, test_loss: 1.5230, test_f1: 0.6400
 epoch: 94, train_loss: 0.3971, test_loss: 1.4332, test_f1: 0.6187
 epoch: 95, train_loss: 0.4442, test_loss: 1.4574, test_f1: 0.5792
 epoch: 96, train_loss: 0.4304, test_loss: 1.4916, test_f1: 0.6209
 epoch: 97, train_loss: 0.3982, test_loss: 1.5511, test_f1: 0.6261
 epoch: 98, train_loss: 0.3964, test_loss: 1.5231, test_f1: 0.6091
 epoch: 99, train_loss: 0.3968, test_loss: 1.4315, test_f1: 0.6498
##################ITERATION #5 ****************************************
 epoch: 0, train_loss: 1.1692, test_loss: 1.5032, test_f1: 0.3038
 epoch: 1, train_loss: 1.0136, test_loss: 1.0562, test_f1: 0.5121
 epoch: 2, train_loss: 0.9434, test_loss: 1.0759, test_f1: 0.4976
 epoch: 3, train_loss: 0.9037, test_loss: 1.0139, test_f1: 0.5367
 epoch: 4, train_loss: 0.8622, test_loss: 1.0248, test_f1: 0.4556
 epoch: 5, train_loss: 0.8747, test_loss: 1.0367, test_f1: 0.4322
 epoch: 6, train_loss: 0.8393, test_loss: 1.0914, test_f1: 0.4879
 epoch: 7, train_loss: 0.8453, test_loss: 1.1895, test_f1: 0.4807
 epoch: 8, train_loss: 0.8381, test_loss: 1.0505, test_f1: 0.5389
 epoch: 9, train_loss: 0.8269, test_loss: 1.1289, test_f1: 0.5100
 epoch: 10, train_loss: 0.8158, test_loss: 0.9828, test_f1: 0.5764
 epoch: 11, train_loss: 0.8054, test_loss: 1.0480, test_f1: 0.5432
 epoch: 12, train_loss: 0.8015, test_loss: 1.0193, test_f1: 0.5810
 epoch: 13, train_loss: 0.7875, test_loss: 1.1618, test_f1: 0.5435
 epoch: 14, train_loss: 0.7719, test_loss: 0.9996, test_f1: 0.5910
 epoch: 15, train_loss: 0.7593, test_loss: 0.9391, test_f1: 0.6061
 epoch: 16, train_loss: 0.7720, test_loss: 1.0911, test_f1: 0.5101
 epoch: 17, train_loss: 0.7300, test_loss: 1.0584, test_f1: 0.5536
 epoch: 18, train_loss: 0.7629, test_loss: 1.0494, test_f1: 0.5309
 epoch: 19, train_loss: 0.7539, test_loss: 1.2790, test_f1: 0.5345
 epoch: 20, train_loss: 0.7362, test_loss: 1.0748, test_f1: 0.5211
 epoch: 21, train_loss: 0.7472, test_loss: 1.0345, test_f1: 0.5944
 epoch: 22, train_loss: 0.6834, test_loss: 1.0203, test_f1: 0.6132
 epoch: 23, train_loss: 0.6707, test_loss: 1.1055, test_f1: 0.5703
 epoch: 24, train_loss: 0.7038, test_loss: 1.1183, test_f1: 0.4766
 epoch: 25, train_loss: 0.7077, test_loss: 1.0126, test_f1: 0.6293
 epoch: 26, train_loss: 0.6674, test_loss: 1.2356, test_f1: 0.5153
 epoch: 27, train_loss: 0.6886, test_loss: 1.0943, test_f1: 0.5518
 epoch: 28, train_loss: 0.6718, test_loss: 1.0970, test_f1: 0.5106
 epoch: 29, train_loss: 0.6550, test_loss: 1.2475, test_f1: 0.5729
 epoch: 30, train_loss: 0.6892, test_loss: 2.2171, test_f1: 0.4663
 epoch: 31, train_loss: 0.6914, test_loss: 1.1006, test_f1: 0.5655
 epoch: 32, train_loss: 0.6794, test_loss: 1.1176, test_f1: 0.5295
 epoch: 33, train_loss: 0.6340, test_loss: 1.0323, test_f1: 0.6017
 epoch: 34, train_loss: 0.6545, test_loss: 1.0546, test_f1: 0.5249
 epoch: 35, train_loss: 0.6521, test_loss: 1.2228, test_f1: 0.5547
 epoch: 36, train_loss: 0.6255, test_loss: 1.1424, test_f1: 0.6102
 epoch: 37, train_loss: 0.6351, test_loss: 1.2787, test_f1: 0.5482
 epoch: 38, train_loss: 0.6157, test_loss: 1.3307, test_f1: 0.5917
 epoch: 39, train_loss: 0.6285, test_loss: 1.1313, test_f1: 0.5505
 epoch: 40, train_loss: 0.6207, test_loss: 1.3795, test_f1: 0.5141
 epoch: 41, train_loss: 0.6239, test_loss: 1.1896, test_f1: 0.5457
 epoch: 42, train_loss: 0.6548, test_loss: 1.1484, test_f1: 0.5604
 epoch: 43, train_loss: 0.6079, test_loss: 1.2169, test_f1: 0.5315
 epoch: 44, train_loss: 0.5926, test_loss: 1.4569, test_f1: 0.5500
 epoch: 45, train_loss: 0.6324, test_loss: 1.4572, test_f1: 0.4722
 epoch: 46, train_loss: 0.6197, test_loss: 1.4395, test_f1: 0.5240
 epoch: 47, train_loss: 0.5927, test_loss: 1.1871, test_f1: 0.6133
 epoch: 48, train_loss: 0.5763, test_loss: 1.2216, test_f1: 0.5495
 epoch: 49, train_loss: 0.5486, test_loss: 1.6816, test_f1: 0.5590
 epoch: 50, train_loss: 0.5897, test_loss: 1.3738, test_f1: 0.5657
 epoch: 51, train_loss: 0.5639, test_loss: 1.1190, test_f1: 0.5797
 epoch: 52, train_loss: 0.5396, test_loss: 1.0973, test_f1: 0.6364
 epoch: 53, train_loss: 0.5174, test_loss: 1.2268, test_f1: 0.6259
 epoch: 54, train_loss: 0.5117, test_loss: 1.2205, test_f1: 0.5817
 epoch: 55, train_loss: 0.5195, test_loss: 1.2233, test_f1: 0.6122
 epoch: 56, train_loss: 0.5159, test_loss: 1.2265, test_f1: 0.6203
 epoch: 57, train_loss: 0.4884, test_loss: 1.1751, test_f1: 0.6086
 epoch: 58, train_loss: 0.4723, test_loss: 1.3039, test_f1: 0.5969
 epoch: 59, train_loss: 0.4741, test_loss: 1.2984, test_f1: 0.5689
 epoch: 60, train_loss: 0.4907, test_loss: 1.2324, test_f1: 0.6113
 epoch: 61, train_loss: 0.4943, test_loss: 1.3790, test_f1: 0.6072
 epoch: 62, train_loss: 0.4778, test_loss: 1.2869, test_f1: 0.6230
 epoch: 63, train_loss: 0.4823, test_loss: 1.2926, test_f1: 0.6062
 epoch: 64, train_loss: 0.4890, test_loss: 1.3946, test_f1: 0.6087
 epoch: 65, train_loss: 0.4626, test_loss: 1.3939, test_f1: 0.5616
 epoch: 66, train_loss: 0.4639, test_loss: 1.4209, test_f1: 0.5916
 epoch: 67, train_loss: 0.4603, test_loss: 1.3690, test_f1: 0.5654
 epoch: 68, train_loss: 0.4770, test_loss: 1.4599, test_f1: 0.5903
 epoch: 69, train_loss: 0.4616, test_loss: 1.2501, test_f1: 0.5756
 epoch: 70, train_loss: 0.4421, test_loss: 1.5398, test_f1: 0.5261
 epoch: 71, train_loss: 0.4605, test_loss: 1.4499, test_f1: 0.5535
 epoch: 72, train_loss: 0.4794, test_loss: 1.4115, test_f1: 0.5872
 epoch: 73, train_loss: 0.4309, test_loss: 1.5101, test_f1: 0.5922
 epoch: 74, train_loss: 0.4495, test_loss: 1.4774, test_f1: 0.6082
 epoch: 75, train_loss: 0.4572, test_loss: 1.3631, test_f1: 0.5857
 epoch: 76, train_loss: 0.4565, test_loss: 1.2917, test_f1: 0.5718
 epoch: 77, train_loss: 0.4703, test_loss: 1.4485, test_f1: 0.5642
 epoch: 78, train_loss: 0.4357, test_loss: 1.3655, test_f1: 0.6212
 epoch: 79, train_loss: 0.4510, test_loss: 1.5008, test_f1: 0.5743
 epoch: 80, train_loss: 0.4517, test_loss: 1.4951, test_f1: 0.5952
 epoch: 81, train_loss: 0.4354, test_loss: 1.3695, test_f1: 0.5907
 epoch: 82, train_loss: 0.4175, test_loss: 1.6365, test_f1: 0.5824
 epoch: 83, train_loss: 0.4121, test_loss: 1.3767, test_f1: 0.5978
 epoch: 84, train_loss: 0.4253, test_loss: 1.3116, test_f1: 0.6123
 epoch: 85, train_loss: 0.4658, test_loss: 1.5336, test_f1: 0.5612
 epoch: 86, train_loss: 0.4407, test_loss: 1.4335, test_f1: 0.6243
 epoch: 87, train_loss: 0.4374, test_loss: 1.6238, test_f1: 0.5755
 epoch: 88, train_loss: 0.3994, test_loss: 1.5320, test_f1: 0.6202
 epoch: 89, train_loss: 0.4024, test_loss: 1.6721, test_f1: 0.6250
 epoch: 90, train_loss: 0.4211, test_loss: 1.5288, test_f1: 0.6488
 epoch: 91, train_loss: 0.3898, test_loss: 1.7800, test_f1: 0.5870
 epoch: 92, train_loss: 0.4014, test_loss: 1.5352, test_f1: 0.6031
 epoch: 93, train_loss: 0.4151, test_loss: 1.7583, test_f1: 0.5995
 epoch: 94, train_loss: 0.4045, test_loss: 1.5919, test_f1: 0.5789
 epoch: 95, train_loss: 0.4366, test_loss: 1.5168, test_f1: 0.5894
 epoch: 96, train_loss: 0.4142, test_loss: 1.5319, test_f1: 0.6186
 epoch: 97, train_loss: 0.4130, test_loss: 1.8727, test_f1: 0.5903
 epoch: 98, train_loss: 0.4352, test_loss: 1.7172, test_f1: 0.5533
 epoch: 99, train_loss: 0.4472, test_loss: 1.5877, test_f1: 0.5696
##################ITERATION #6 ****************************************
 epoch: 0, train_loss: 1.1642, test_loss: 1.4476, test_f1: 0.3016
 epoch: 1, train_loss: 1.0071, test_loss: 1.0865, test_f1: 0.4942
 epoch: 2, train_loss: 0.9427, test_loss: 1.0993, test_f1: 0.5352
 epoch: 3, train_loss: 0.9393, test_loss: 1.0117, test_f1: 0.5353
 epoch: 4, train_loss: 0.9093, test_loss: 0.9789, test_f1: 0.5672
 epoch: 5, train_loss: 0.8914, test_loss: 1.0141, test_f1: 0.5242
 epoch: 6, train_loss: 0.8408, test_loss: 1.0306, test_f1: 0.5611
 epoch: 7, train_loss: 0.8743, test_loss: 1.5718, test_f1: 0.3429
 epoch: 8, train_loss: 0.8458, test_loss: 1.0897, test_f1: 0.4225
 epoch: 9, train_loss: 0.8139, test_loss: 1.0177, test_f1: 0.5311
 epoch: 10, train_loss: 0.8237, test_loss: 1.0011, test_f1: 0.5002
 epoch: 11, train_loss: 0.8058, test_loss: 1.4391, test_f1: 0.5221
 epoch: 12, train_loss: 0.8096, test_loss: 1.0184, test_f1: 0.5446
 epoch: 13, train_loss: 0.7696, test_loss: 1.4021, test_f1: 0.4716
 epoch: 14, train_loss: 0.8221, test_loss: 1.1542, test_f1: 0.4591
 epoch: 15, train_loss: 0.7975, test_loss: 0.9484, test_f1: 0.5983
 epoch: 16, train_loss: 0.7794, test_loss: 1.1350, test_f1: 0.5564
 epoch: 17, train_loss: 0.7814, test_loss: 1.2276, test_f1: 0.5683
 epoch: 18, train_loss: 0.7567, test_loss: 1.2626, test_f1: 0.5511
 epoch: 19, train_loss: 0.7509, test_loss: 1.1275, test_f1: 0.4121
 epoch: 20, train_loss: 0.7455, test_loss: 1.0849, test_f1: 0.5695
 epoch: 21, train_loss: 0.7428, test_loss: 1.0689, test_f1: 0.6036
 epoch: 22, train_loss: 0.7158, test_loss: 1.1396, test_f1: 0.4530
 epoch: 23, train_loss: 0.7310, test_loss: 1.0759, test_f1: 0.5622
 epoch: 24, train_loss: 0.7388, test_loss: 1.2006, test_f1: 0.5295
 epoch: 25, train_loss: 0.7457, test_loss: 1.1129, test_f1: 0.4882
 epoch: 26, train_loss: 0.7074, test_loss: 1.0970, test_f1: 0.5602
 epoch: 27, train_loss: 0.7062, test_loss: 1.5013, test_f1: 0.5582
 epoch: 28, train_loss: 0.7057, test_loss: 1.0465, test_f1: 0.5576
 epoch: 29, train_loss: 0.7072, test_loss: 1.3022, test_f1: 0.3946
 epoch: 30, train_loss: 0.7323, test_loss: 1.2006, test_f1: 0.5611
 epoch: 31, train_loss: 0.7032, test_loss: 1.3459, test_f1: 0.5580
 epoch: 32, train_loss: 0.6716, test_loss: 1.3175, test_f1: 0.5611
 epoch: 33, train_loss: 0.6904, test_loss: 1.3340, test_f1: 0.5178
 epoch: 34, train_loss: 0.6733, test_loss: 1.2651, test_f1: 0.4878
 epoch: 35, train_loss: 0.6744, test_loss: 1.5101, test_f1: 0.5359
 epoch: 36, train_loss: 0.6515, test_loss: 1.8501, test_f1: 0.4193
 epoch: 37, train_loss: 0.6699, test_loss: 1.0908, test_f1: 0.5983
 epoch: 38, train_loss: 0.6808, test_loss: 1.0391, test_f1: 0.6039
 epoch: 39, train_loss: 0.6656, test_loss: 1.4372, test_f1: 0.5650
 epoch: 40, train_loss: 0.6563, test_loss: 1.6433, test_f1: 0.5421
 epoch: 41, train_loss: 0.6359, test_loss: 1.7082, test_f1: 0.5785
 epoch: 42, train_loss: 0.6545, test_loss: 1.3814, test_f1: 0.5573
 epoch: 43, train_loss: 0.6452, test_loss: 1.1888, test_f1: 0.5022
 epoch: 44, train_loss: 0.6308, test_loss: 2.0048, test_f1: 0.5362
 epoch: 45, train_loss: 0.6486, test_loss: 1.1466, test_f1: 0.5605
 epoch: 46, train_loss: 0.6480, test_loss: 1.2828, test_f1: 0.5978
 epoch: 47, train_loss: 0.6170, test_loss: 1.3484, test_f1: 0.5302
 epoch: 48, train_loss: 0.6284, test_loss: 1.6154, test_f1: 0.5019
 epoch: 49, train_loss: 0.6292, test_loss: 1.6446, test_f1: 0.5789
 epoch: 50, train_loss: 0.5837, test_loss: 1.2043, test_f1: 0.5824
 epoch: 51, train_loss: 0.6123, test_loss: 1.4004, test_f1: 0.6233
 epoch: 52, train_loss: 0.5617, test_loss: 1.1954, test_f1: 0.6143
 epoch: 53, train_loss: 0.5565, test_loss: 1.3127, test_f1: 0.6224
 epoch: 54, train_loss: 0.5568, test_loss: 1.2993, test_f1: 0.6036
 epoch: 55, train_loss: 0.5440, test_loss: 1.4726, test_f1: 0.5587
 epoch: 56, train_loss: 0.5224, test_loss: 1.3020, test_f1: 0.6223
 epoch: 57, train_loss: 0.5286, test_loss: 1.3024, test_f1: 0.6087
 epoch: 58, train_loss: 0.5336, test_loss: 1.6129, test_f1: 0.6014
 epoch: 59, train_loss: 0.5409, test_loss: 1.2748, test_f1: 0.5469
 epoch: 60, train_loss: 0.5404, test_loss: 1.3979, test_f1: 0.6231
 epoch: 61, train_loss: 0.5070, test_loss: 1.0833, test_f1: 0.6295
 epoch: 62, train_loss: 0.5203, test_loss: 1.5517, test_f1: 0.5864
 epoch: 63, train_loss: 0.5298, test_loss: 1.4261, test_f1: 0.5999
 epoch: 64, train_loss: 0.5178, test_loss: 1.4481, test_f1: 0.5951
 epoch: 65, train_loss: 0.5162, test_loss: 1.3541, test_f1: 0.6182
 epoch: 66, train_loss: 0.5365, test_loss: 1.3545, test_f1: 0.6060
 epoch: 67, train_loss: 0.4997, test_loss: 1.5975, test_f1: 0.6002
 epoch: 68, train_loss: 0.4976, test_loss: 1.4988, test_f1: 0.6472
 epoch: 69, train_loss: 0.5035, test_loss: 1.3097, test_f1: 0.5952
 epoch: 70, train_loss: 0.5150, test_loss: 1.4727, test_f1: 0.6002
 epoch: 71, train_loss: 0.4906, test_loss: 1.4007, test_f1: 0.6293
 epoch: 72, train_loss: 0.4730, test_loss: 1.5263, test_f1: 0.6080
 epoch: 73, train_loss: 0.4900, test_loss: 1.5871, test_f1: 0.5843
 epoch: 74, train_loss: 0.4723, test_loss: 1.3956, test_f1: 0.5927
 epoch: 75, train_loss: 0.4864, test_loss: 1.5945, test_f1: 0.5696
 epoch: 76, train_loss: 0.4985, test_loss: 1.3559, test_f1: 0.5972
 epoch: 77, train_loss: 0.4875, test_loss: 1.6498, test_f1: 0.5976
 epoch: 78, train_loss: 0.5054, test_loss: 1.6853, test_f1: 0.6223
 epoch: 79, train_loss: 0.4912, test_loss: 1.3015, test_f1: 0.6075
 epoch: 80, train_loss: 0.4888, test_loss: 1.7590, test_f1: 0.5740
 epoch: 81, train_loss: 0.4702, test_loss: 1.4756, test_f1: 0.6301
 epoch: 82, train_loss: 0.4837, test_loss: 1.4766, test_f1: 0.6030
 epoch: 83, train_loss: 0.4749, test_loss: 1.4030, test_f1: 0.5621
 epoch: 84, train_loss: 0.4699, test_loss: 1.7500, test_f1: 0.5600
 epoch: 85, train_loss: 0.4723, test_loss: 1.7386, test_f1: 0.5416
 epoch: 86, train_loss: 0.4808, test_loss: 1.3006, test_f1: 0.5864
 epoch: 87, train_loss: 0.4941, test_loss: 1.5198, test_f1: 0.6194
 epoch: 88, train_loss: 0.4497, test_loss: 2.0254, test_f1: 0.5536
 epoch: 89, train_loss: 0.4552, test_loss: 1.4416, test_f1: 0.5999
 epoch: 90, train_loss: 0.4543, test_loss: 1.3464, test_f1: 0.5884
 epoch: 91, train_loss: 0.4524, test_loss: 1.3581, test_f1: 0.5898
 epoch: 92, train_loss: 0.4347, test_loss: 1.7342, test_f1: 0.5927
 epoch: 93, train_loss: 0.4557, test_loss: 1.4027, test_f1: 0.5680
 epoch: 94, train_loss: 0.4772, test_loss: 1.7353, test_f1: 0.5705
 epoch: 95, train_loss: 0.4445, test_loss: 1.5057, test_f1: 0.6277
 epoch: 96, train_loss: 0.4495, test_loss: 1.6549, test_f1: 0.5985
 epoch: 97, train_loss: 0.4573, test_loss: 1.4798, test_f1: 0.5901
 epoch: 98, train_loss: 0.4521, test_loss: 1.8754, test_f1: 0.5845
 epoch: 99, train_loss: 0.4708, test_loss: 1.3665, test_f1: 0.5742
##################ITERATION #7 ****************************************
 epoch: 0, train_loss: 1.1716, test_loss: 1.6026, test_f1: 0.1432
 epoch: 1, train_loss: 0.9806, test_loss: 1.1405, test_f1: 0.5045
 epoch: 2, train_loss: 0.9454, test_loss: 1.0924, test_f1: 0.5176
 epoch: 3, train_loss: 0.9159, test_loss: 1.0109, test_f1: 0.5148
 epoch: 4, train_loss: 0.8986, test_loss: 1.1790, test_f1: 0.4757
 epoch: 5, train_loss: 0.9130, test_loss: 1.1546, test_f1: 0.4215
 epoch: 6, train_loss: 0.8505, test_loss: 1.0710, test_f1: 0.5330
 epoch: 7, train_loss: 0.8289, test_loss: 1.0985, test_f1: 0.4898
 epoch: 8, train_loss: 0.8404, test_loss: 0.9995, test_f1: 0.5485
 epoch: 9, train_loss: 0.8055, test_loss: 1.0322, test_f1: 0.5362
 epoch: 10, train_loss: 0.8041, test_loss: 1.0994, test_f1: 0.5245
 epoch: 11, train_loss: 0.8183, test_loss: 1.0420, test_f1: 0.5428
 epoch: 12, train_loss: 0.7943, test_loss: 1.1332, test_f1: 0.5084
 epoch: 13, train_loss: 0.8088, test_loss: 1.0207, test_f1: 0.5139
 epoch: 14, train_loss: 0.7756, test_loss: 1.3221, test_f1: 0.4126
 epoch: 15, train_loss: 0.7807, test_loss: 1.0287, test_f1: 0.5687
 epoch: 16, train_loss: 0.7620, test_loss: 1.1041, test_f1: 0.5224
 epoch: 17, train_loss: 0.7557, test_loss: 1.0795, test_f1: 0.5256
 epoch: 18, train_loss: 0.7499, test_loss: 1.2044, test_f1: 0.5274
 epoch: 19, train_loss: 0.7325, test_loss: 1.4391, test_f1: 0.5324
 epoch: 20, train_loss: 0.7321, test_loss: 1.3879, test_f1: 0.4705
 epoch: 21, train_loss: 0.7227, test_loss: 1.1073, test_f1: 0.5747
 epoch: 22, train_loss: 0.7300, test_loss: 1.1654, test_f1: 0.5221
 epoch: 23, train_loss: 0.7281, test_loss: 1.8877, test_f1: 0.5081
 epoch: 24, train_loss: 0.7412, test_loss: 0.9874, test_f1: 0.5968
 epoch: 25, train_loss: 0.7111, test_loss: 1.1767, test_f1: 0.5071
 epoch: 26, train_loss: 0.7220, test_loss: 1.6031, test_f1: 0.4714
 epoch: 27, train_loss: 0.6810, test_loss: 1.3476, test_f1: 0.5422
 epoch: 28, train_loss: 0.6698, test_loss: 1.4712, test_f1: 0.5579
 epoch: 29, train_loss: 0.7127, test_loss: 0.9760, test_f1: 0.6332
 epoch: 30, train_loss: 0.6729, test_loss: 1.8409, test_f1: 0.5075
 epoch: 31, train_loss: 0.6563, test_loss: 1.6094, test_f1: 0.4923
 epoch: 32, train_loss: 0.6670, test_loss: 1.4671, test_f1: 0.5259
 epoch: 33, train_loss: 0.6822, test_loss: 1.0544, test_f1: 0.5894
 epoch: 34, train_loss: 0.6799, test_loss: 1.2589, test_f1: 0.5356
 epoch: 35, train_loss: 0.6585, test_loss: 1.5752, test_f1: 0.5491
 epoch: 36, train_loss: 0.6727, test_loss: 1.2284, test_f1: 0.5698
 epoch: 37, train_loss: 0.6448, test_loss: 1.3384, test_f1: 0.5901
 epoch: 38, train_loss: 0.6227, test_loss: 1.9206, test_f1: 0.5198
 epoch: 39, train_loss: 0.6383, test_loss: 2.1957, test_f1: 0.5303
 epoch: 40, train_loss: 0.6275, test_loss: 1.6864, test_f1: 0.5670
 epoch: 41, train_loss: 0.6122, test_loss: 1.1167, test_f1: 0.5918
 epoch: 42, train_loss: 0.6101, test_loss: 1.4075, test_f1: 0.5422
 epoch: 43, train_loss: 0.6423, test_loss: 1.1804, test_f1: 0.6089
 epoch: 44, train_loss: 0.6335, test_loss: 1.5150, test_f1: 0.5395
 epoch: 45, train_loss: 0.6137, test_loss: 1.1169, test_f1: 0.5970
 epoch: 46, train_loss: 0.6073, test_loss: 1.1361, test_f1: 0.5656
 epoch: 47, train_loss: 0.6173, test_loss: 1.2362, test_f1: 0.5404
 epoch: 48, train_loss: 0.6208, test_loss: 1.2649, test_f1: 0.5906
 epoch: 49, train_loss: 0.5807, test_loss: 1.3451, test_f1: 0.5467
 epoch: 50, train_loss: 0.6112, test_loss: 2.0587, test_f1: 0.4673
 epoch: 51, train_loss: 0.5763, test_loss: 1.5886, test_f1: 0.5673
 epoch: 52, train_loss: 0.5381, test_loss: 1.3629, test_f1: 0.5975
 epoch: 53, train_loss: 0.5414, test_loss: 1.4905, test_f1: 0.5795
 epoch: 54, train_loss: 0.5215, test_loss: 1.3476, test_f1: 0.6102
 epoch: 55, train_loss: 0.4965, test_loss: 1.4508, test_f1: 0.5787
 epoch: 56, train_loss: 0.5103, test_loss: 1.2517, test_f1: 0.5765
 epoch: 57, train_loss: 0.5039, test_loss: 1.3218, test_f1: 0.6247
 epoch: 58, train_loss: 0.5092, test_loss: 1.4340, test_f1: 0.6020
 epoch: 59, train_loss: 0.5071, test_loss: 1.5366, test_f1: 0.5534
 epoch: 60, train_loss: 0.5059, test_loss: 1.4054, test_f1: 0.6018
 epoch: 61, train_loss: 0.5100, test_loss: 1.6400, test_f1: 0.5272
 epoch: 62, train_loss: 0.5531, test_loss: 1.5763, test_f1: 0.6152
 epoch: 63, train_loss: 0.5146, test_loss: 1.6000, test_f1: 0.6072
 epoch: 64, train_loss: 0.4822, test_loss: 1.2172, test_f1: 0.6094
 epoch: 65, train_loss: 0.5058, test_loss: 2.0916, test_f1: 0.5669
 epoch: 66, train_loss: 0.4896, test_loss: 1.8861, test_f1: 0.5641
 epoch: 67, train_loss: 0.4935, test_loss: 1.3751, test_f1: 0.6134
 epoch: 68, train_loss: 0.4804, test_loss: 1.2556, test_f1: 0.6616
 epoch: 69, train_loss: 0.4749, test_loss: 1.6483, test_f1: 0.5845
 epoch: 70, train_loss: 0.4807, test_loss: 1.1754, test_f1: 0.6436
 epoch: 71, train_loss: 0.4926, test_loss: 1.3480, test_f1: 0.6220
 epoch: 72, train_loss: 0.4943, test_loss: 2.0858, test_f1: 0.5250
 epoch: 73, train_loss: 0.4793, test_loss: 1.2734, test_f1: 0.6169
 epoch: 74, train_loss: 0.5294, test_loss: 1.2435, test_f1: 0.6228
 epoch: 75, train_loss: 0.4906, test_loss: 1.4240, test_f1: 0.5917
 epoch: 76, train_loss: 0.4595, test_loss: 1.4060, test_f1: 0.6094
 epoch: 77, train_loss: 0.4737, test_loss: 1.2231, test_f1: 0.6411
 epoch: 78, train_loss: 0.4703, test_loss: 1.5486, test_f1: 0.6043
 epoch: 79, train_loss: 0.4822, test_loss: 1.3492, test_f1: 0.6197
 epoch: 80, train_loss: 0.4694, test_loss: 1.7143, test_f1: 0.5976
 epoch: 81, train_loss: 0.4828, test_loss: 1.3597, test_f1: 0.6300
 epoch: 82, train_loss: 0.4374, test_loss: 1.4219, test_f1: 0.6096
 epoch: 83, train_loss: 0.4584, test_loss: 1.5873, test_f1: 0.5749
 epoch: 84, train_loss: 0.4625, test_loss: 1.5488, test_f1: 0.5877
 epoch: 85, train_loss: 0.4446, test_loss: 1.4311, test_f1: 0.6056
 epoch: 86, train_loss: 0.4677, test_loss: 1.3898, test_f1: 0.6274
 epoch: 87, train_loss: 0.4611, test_loss: 1.3704, test_f1: 0.6146
 epoch: 88, train_loss: 0.4520, test_loss: 1.4222, test_f1: 0.6076
 epoch: 89, train_loss: 0.4625, test_loss: 1.3268, test_f1: 0.5803
 epoch: 90, train_loss: 0.4255, test_loss: 1.3388, test_f1: 0.6372
 epoch: 91, train_loss: 0.4450, test_loss: 1.6043, test_f1: 0.5987
 epoch: 92, train_loss: 0.4330, test_loss: 1.5322, test_f1: 0.6234
 epoch: 93, train_loss: 0.4403, test_loss: 1.6533, test_f1: 0.6003
 epoch: 94, train_loss: 0.4262, test_loss: 1.4430, test_f1: 0.6242
 epoch: 95, train_loss: 0.4041, test_loss: 1.4342, test_f1: 0.6253
 epoch: 96, train_loss: 0.3938, test_loss: 1.5780, test_f1: 0.5872
 epoch: 97, train_loss: 0.4339, test_loss: 1.7803, test_f1: 0.6190
 epoch: 98, train_loss: 0.4284, test_loss: 1.3563, test_f1: 0.6257
 epoch: 99, train_loss: 0.4523, test_loss: 1.5509, test_f1: 0.6238
##################ITERATION #8 ****************************************
 epoch: 0, train_loss: 1.1361, test_loss: 1.2148, test_f1: 0.3263
 epoch: 1, train_loss: 0.9744, test_loss: 1.0601, test_f1: 0.5404
 epoch: 2, train_loss: 0.9280, test_loss: 1.0158, test_f1: 0.5390
 epoch: 3, train_loss: 0.8728, test_loss: 1.4088, test_f1: 0.4350
 epoch: 4, train_loss: 0.8656, test_loss: 1.2994, test_f1: 0.4548
 epoch: 5, train_loss: 0.8701, test_loss: 1.1313, test_f1: 0.5138
 epoch: 6, train_loss: 0.8408, test_loss: 1.0225, test_f1: 0.5792
 epoch: 7, train_loss: 0.8271, test_loss: 0.9613, test_f1: 0.5861
 epoch: 8, train_loss: 0.8041, test_loss: 1.0609, test_f1: 0.5549
 epoch: 9, train_loss: 0.8041, test_loss: 1.2422, test_f1: 0.5453
 epoch: 10, train_loss: 0.8015, test_loss: 1.1589, test_f1: 0.4938
 epoch: 11, train_loss: 0.8036, test_loss: 1.1565, test_f1: 0.4507
 epoch: 12, train_loss: 0.7776, test_loss: 1.0963, test_f1: 0.5281
 epoch: 13, train_loss: 0.7561, test_loss: 0.9833, test_f1: 0.5842
 epoch: 14, train_loss: 0.7377, test_loss: 1.1162, test_f1: 0.5889
 epoch: 15, train_loss: 0.7634, test_loss: 0.9938, test_f1: 0.5518
 epoch: 16, train_loss: 0.7512, test_loss: 1.0274, test_f1: 0.5843
 epoch: 17, train_loss: 0.7249, test_loss: 1.4016, test_f1: 0.5329
 epoch: 18, train_loss: 0.7343, test_loss: 1.0551, test_f1: 0.5341
 epoch: 19, train_loss: 0.7380, test_loss: 1.1005, test_f1: 0.5353
 epoch: 20, train_loss: 0.7312, test_loss: 1.1041, test_f1: 0.5170
 epoch: 21, train_loss: 0.7139, test_loss: 1.1058, test_f1: 0.5758
 epoch: 22, train_loss: 0.7214, test_loss: 1.1114, test_f1: 0.5324
 epoch: 23, train_loss: 0.7234, test_loss: 0.9686, test_f1: 0.6216
 epoch: 24, train_loss: 0.6989, test_loss: 1.2488, test_f1: 0.5504
 epoch: 25, train_loss: 0.7117, test_loss: 1.2037, test_f1: 0.5173
 epoch: 26, train_loss: 0.7302, test_loss: 1.0344, test_f1: 0.5601
 epoch: 27, train_loss: 0.6903, test_loss: 1.1137, test_f1: 0.5424
 epoch: 28, train_loss: 0.6483, test_loss: 0.9461, test_f1: 0.6263
 epoch: 29, train_loss: 0.6656, test_loss: 1.0882, test_f1: 0.5329
 epoch: 30, train_loss: 0.6397, test_loss: 1.2285, test_f1: 0.5981
 epoch: 31, train_loss: 0.6690, test_loss: 1.0724, test_f1: 0.5729
 epoch: 32, train_loss: 0.6437, test_loss: 1.1420, test_f1: 0.6165
 epoch: 33, train_loss: 0.6514, test_loss: 1.0805, test_f1: 0.6149
 epoch: 34, train_loss: 0.6186, test_loss: 1.0896, test_f1: 0.5705
 epoch: 35, train_loss: 0.6689, test_loss: 1.6272, test_f1: 0.5643
 epoch: 36, train_loss: 0.6350, test_loss: 1.2462, test_f1: 0.5842
 epoch: 37, train_loss: 0.6148, test_loss: 1.4925, test_f1: 0.5608
 epoch: 38, train_loss: 0.6549, test_loss: 1.0261, test_f1: 0.5953
 epoch: 39, train_loss: 0.6283, test_loss: 0.9952, test_f1: 0.5749
 epoch: 40, train_loss: 0.6372, test_loss: 1.2099, test_f1: 0.5512
 epoch: 41, train_loss: 0.6485, test_loss: 1.1391, test_f1: 0.5815
 epoch: 42, train_loss: 0.5909, test_loss: 2.3191, test_f1: 0.5803
 epoch: 43, train_loss: 0.6095, test_loss: 1.7739, test_f1: 0.4343
 epoch: 44, train_loss: 0.5823, test_loss: 1.2109, test_f1: 0.5781
 epoch: 45, train_loss: 0.5630, test_loss: 1.9559, test_f1: 0.5613
 epoch: 46, train_loss: 0.6166, test_loss: 0.9692, test_f1: 0.6616
 epoch: 47, train_loss: 0.5876, test_loss: 1.4448, test_f1: 0.5593
 epoch: 48, train_loss: 0.5496, test_loss: 1.5594, test_f1: 0.5861
 epoch: 49, train_loss: 0.5697, test_loss: 1.2553, test_f1: 0.6386
 epoch: 50, train_loss: 0.6031, test_loss: 1.1506, test_f1: 0.6035
 epoch: 51, train_loss: 0.5604, test_loss: 1.1210, test_f1: 0.6541
 epoch: 52, train_loss: 0.5093, test_loss: 1.3488, test_f1: 0.6538
 epoch: 53, train_loss: 0.5234, test_loss: 1.9376, test_f1: 0.5876
 epoch: 54, train_loss: 0.5070, test_loss: 1.3713, test_f1: 0.6667
 epoch: 55, train_loss: 0.4850, test_loss: 1.2846, test_f1: 0.6364
 epoch: 56, train_loss: 0.4699, test_loss: 1.6092, test_f1: 0.6216
 epoch: 57, train_loss: 0.5027, test_loss: 1.3080, test_f1: 0.6783
 epoch: 58, train_loss: 0.5121, test_loss: 1.7924, test_f1: 0.5976
 epoch: 59, train_loss: 0.4985, test_loss: 1.1815, test_f1: 0.6716
 epoch: 60, train_loss: 0.4792, test_loss: 1.2181, test_f1: 0.6355
 epoch: 61, train_loss: 0.4575, test_loss: 1.2124, test_f1: 0.6712
 epoch: 62, train_loss: 0.4821, test_loss: 1.4407, test_f1: 0.6593
 epoch: 63, train_loss: 0.4662, test_loss: 1.6172, test_f1: 0.6346
 epoch: 64, train_loss: 0.4488, test_loss: 1.4343, test_f1: 0.6388
 epoch: 65, train_loss: 0.4495, test_loss: 2.0268, test_f1: 0.6327
 epoch: 66, train_loss: 0.4704, test_loss: 1.5928, test_f1: 0.6820
 epoch: 67, train_loss: 0.4774, test_loss: 1.4498, test_f1: 0.6265
 epoch: 68, train_loss: 0.4602, test_loss: 1.3986, test_f1: 0.6432
 epoch: 69, train_loss: 0.4405, test_loss: 1.5988, test_f1: 0.6267
 epoch: 70, train_loss: 0.4454, test_loss: 1.5115, test_f1: 0.6390
 epoch: 71, train_loss: 0.4344, test_loss: 1.8895, test_f1: 0.6365
 epoch: 72, train_loss: 0.4274, test_loss: 1.4733, test_f1: 0.6207
 epoch: 73, train_loss: 0.4768, test_loss: 1.5494, test_f1: 0.6210
 epoch: 74, train_loss: 0.4484, test_loss: 1.4842, test_f1: 0.6188
 epoch: 75, train_loss: 0.4118, test_loss: 1.5544, test_f1: 0.6472
 epoch: 76, train_loss: 0.4728, test_loss: 1.5314, test_f1: 0.6032
 epoch: 77, train_loss: 0.4415, test_loss: 1.3614, test_f1: 0.6490
 epoch: 78, train_loss: 0.4708, test_loss: 1.6147, test_f1: 0.6457
 epoch: 79, train_loss: 0.4085, test_loss: 1.4571, test_f1: 0.6185
 epoch: 80, train_loss: 0.4016, test_loss: 2.1322, test_f1: 0.6607
 epoch: 81, train_loss: 0.4233, test_loss: 1.9622, test_f1: 0.5612
 epoch: 82, train_loss: 0.4721, test_loss: 1.8273, test_f1: 0.5802
 epoch: 83, train_loss: 0.4642, test_loss: 1.5641, test_f1: 0.6480
 epoch: 84, train_loss: 0.4387, test_loss: 1.3037, test_f1: 0.6674
 epoch: 85, train_loss: 0.4673, test_loss: 1.8167, test_f1: 0.6513
 epoch: 86, train_loss: 0.4443, test_loss: 1.5088, test_f1: 0.6330
 epoch: 87, train_loss: 0.4082, test_loss: 1.5206, test_f1: 0.6580
 epoch: 88, train_loss: 0.4157, test_loss: 1.7608, test_f1: 0.6345
 epoch: 89, train_loss: 0.4149, test_loss: 1.9469, test_f1: 0.6119
 epoch: 90, train_loss: 0.4200, test_loss: 1.7420, test_f1: 0.6344
 epoch: 91, train_loss: 0.4379, test_loss: 1.5718, test_f1: 0.6435
 epoch: 92, train_loss: 0.4385, test_loss: 1.6109, test_f1: 0.6460
 epoch: 93, train_loss: 0.4288, test_loss: 1.7406, test_f1: 0.6103
 epoch: 94, train_loss: 0.3970, test_loss: 1.4629, test_f1: 0.6818
 epoch: 95, train_loss: 0.3877, test_loss: 1.6526, test_f1: 0.6322
 epoch: 96, train_loss: 0.4212, test_loss: 1.7837, test_f1: 0.6626
 epoch: 97, train_loss: 0.3831, test_loss: 2.2826, test_f1: 0.6518
 epoch: 98, train_loss: 0.3891, test_loss: 2.3044, test_f1: 0.6366
 epoch: 99, train_loss: 0.3601, test_loss: 1.7507, test_f1: 0.6422
##################ITERATION #9 ****************************************
 epoch: 0, train_loss: 1.1559, test_loss: 1.3001, test_f1: 0.3052
 epoch: 1, train_loss: 0.9824, test_loss: 1.0676, test_f1: 0.5025
 epoch: 2, train_loss: 0.9548, test_loss: 1.0380, test_f1: 0.5323
 epoch: 3, train_loss: 0.9256, test_loss: 1.0200, test_f1: 0.5388
 epoch: 4, train_loss: 0.9027, test_loss: 1.1676, test_f1: 0.4219
 epoch: 5, train_loss: 0.8760, test_loss: 1.5941, test_f1: 0.4115
 epoch: 6, train_loss: 0.8976, test_loss: 1.0519, test_f1: 0.5233
 epoch: 7, train_loss: 0.8653, test_loss: 1.1419, test_f1: 0.5211
 epoch: 8, train_loss: 0.8786, test_loss: 1.0403, test_f1: 0.5423
 epoch: 9, train_loss: 0.8320, test_loss: 1.0110, test_f1: 0.6082
 epoch: 10, train_loss: 0.8324, test_loss: 1.0058, test_f1: 0.5506
 epoch: 11, train_loss: 0.8360, test_loss: 1.1668, test_f1: 0.5118
 epoch: 12, train_loss: 0.8161, test_loss: 1.2246, test_f1: 0.5035
 epoch: 13, train_loss: 0.7786, test_loss: 0.9784, test_f1: 0.5647
 epoch: 14, train_loss: 0.7981, test_loss: 1.0357, test_f1: 0.5008
 epoch: 15, train_loss: 0.8068, test_loss: 1.0297, test_f1: 0.5240
 epoch: 16, train_loss: 0.7749, test_loss: 1.0508, test_f1: 0.6030
 epoch: 17, train_loss: 0.8010, test_loss: 0.9674, test_f1: 0.6049
 epoch: 18, train_loss: 0.7612, test_loss: 1.2821, test_f1: 0.4866
 epoch: 19, train_loss: 0.7484, test_loss: 1.0273, test_f1: 0.6108
 epoch: 20, train_loss: 0.7497, test_loss: 1.1058, test_f1: 0.5649
 epoch: 21, train_loss: 0.7298, test_loss: 1.0428, test_f1: 0.5487
 epoch: 22, train_loss: 0.7120, test_loss: 1.0553, test_f1: 0.6036
 epoch: 23, train_loss: 0.6992, test_loss: 1.0592, test_f1: 0.5764
 epoch: 24, train_loss: 0.7244, test_loss: 1.0426, test_f1: 0.5409
 epoch: 25, train_loss: 0.7153, test_loss: 1.0908, test_f1: 0.6125
 epoch: 26, train_loss: 0.7302, test_loss: 0.9784, test_f1: 0.6348
 epoch: 27, train_loss: 0.6970, test_loss: 1.0140, test_f1: 0.5846
 epoch: 28, train_loss: 0.7341, test_loss: 1.0645, test_f1: 0.5824
 epoch: 29, train_loss: 0.7032, test_loss: 1.1045, test_f1: 0.5620
 epoch: 30, train_loss: 0.6863, test_loss: 1.0077, test_f1: 0.5750
 epoch: 31, train_loss: 0.6799, test_loss: 1.0421, test_f1: 0.5182
 epoch: 32, train_loss: 0.6925, test_loss: 1.2184, test_f1: 0.5905
 epoch: 33, train_loss: 0.6810, test_loss: 1.0991, test_f1: 0.5289
 epoch: 34, train_loss: 0.7096, test_loss: 1.0410, test_f1: 0.5891
 epoch: 35, train_loss: 0.7009, test_loss: 1.1517, test_f1: 0.5517
 epoch: 36, train_loss: 0.6933, test_loss: 1.0560, test_f1: 0.5522
 epoch: 37, train_loss: 0.6582, test_loss: 1.2293, test_f1: 0.5009
 epoch: 38, train_loss: 0.6305, test_loss: 1.3139, test_f1: 0.5807
 epoch: 39, train_loss: 0.6254, test_loss: 1.5430, test_f1: 0.5042
 epoch: 40, train_loss: 0.6293, test_loss: 1.1111, test_f1: 0.5754
 epoch: 41, train_loss: 0.6484, test_loss: 1.2824, test_f1: 0.5624
 epoch: 42, train_loss: 0.6323, test_loss: 2.0283, test_f1: 0.4387
 epoch: 43, train_loss: 0.6440, test_loss: 1.2445, test_f1: 0.5929
 epoch: 44, train_loss: 0.6373, test_loss: 1.0077, test_f1: 0.6424
 epoch: 45, train_loss: 0.6074, test_loss: 1.2921, test_f1: 0.5769
 epoch: 46, train_loss: 0.6084, test_loss: 1.4622, test_f1: 0.4841
 epoch: 47, train_loss: 0.6503, test_loss: 1.1449, test_f1: 0.5946
 epoch: 48, train_loss: 0.6275, test_loss: 1.8263, test_f1: 0.4855
 epoch: 49, train_loss: 0.6132, test_loss: 1.1137, test_f1: 0.5725
 epoch: 50, train_loss: 0.6160, test_loss: 1.1653, test_f1: 0.5739
 epoch: 51, train_loss: 0.5964, test_loss: 1.2472, test_f1: 0.5419
 epoch: 52, train_loss: 0.5446, test_loss: 1.2274, test_f1: 0.5764
 epoch: 53, train_loss: 0.5344, test_loss: 1.3432, test_f1: 0.5836
 epoch: 54, train_loss: 0.5668, test_loss: 1.3272, test_f1: 0.6068
 epoch: 55, train_loss: 0.5297, test_loss: 1.1506, test_f1: 0.5934
 epoch: 56, train_loss: 0.5314, test_loss: 1.2037, test_f1: 0.5529
 epoch: 57, train_loss: 0.5503, test_loss: 1.2421, test_f1: 0.5769
 epoch: 58, train_loss: 0.5192, test_loss: 1.3390, test_f1: 0.5731
 epoch: 59, train_loss: 0.4861, test_loss: 1.5696, test_f1: 0.5529
 epoch: 60, train_loss: 0.4827, test_loss: 1.2329, test_f1: 0.6284
 epoch: 61, train_loss: 0.5014, test_loss: 1.3340, test_f1: 0.5639
 epoch: 62, train_loss: 0.4906, test_loss: 1.5839, test_f1: 0.5800
 epoch: 63, train_loss: 0.5131, test_loss: 1.5733, test_f1: 0.5890
 epoch: 64, train_loss: 0.4944, test_loss: 1.2131, test_f1: 0.5717
 epoch: 65, train_loss: 0.4829, test_loss: 1.4766, test_f1: 0.5882
 epoch: 66, train_loss: 0.4796, test_loss: 1.5508, test_f1: 0.5689
 epoch: 67, train_loss: 0.4775, test_loss: 1.5561, test_f1: 0.5559
 epoch: 68, train_loss: 0.4626, test_loss: 1.3593, test_f1: 0.5860
 epoch: 69, train_loss: 0.4751, test_loss: 1.3327, test_f1: 0.5700
 epoch: 70, train_loss: 0.4679, test_loss: 1.2916, test_f1: 0.6013
 epoch: 71, train_loss: 0.4577, test_loss: 1.3324, test_f1: 0.6125
 epoch: 72, train_loss: 0.4589, test_loss: 1.4292, test_f1: 0.5792
 epoch: 73, train_loss: 0.4645, test_loss: 1.4162, test_f1: 0.5541
 epoch: 74, train_loss: 0.4530, test_loss: 1.2983, test_f1: 0.6053
 epoch: 75, train_loss: 0.4807, test_loss: 1.4975, test_f1: 0.5326
 epoch: 76, train_loss: 0.4417, test_loss: 1.4015, test_f1: 0.5887
 epoch: 77, train_loss: 0.4498, test_loss: 1.3229, test_f1: 0.5913
 epoch: 78, train_loss: 0.4649, test_loss: 1.4217, test_f1: 0.5658
 epoch: 79, train_loss: 0.4611, test_loss: 1.2456, test_f1: 0.6133
 epoch: 80, train_loss: 0.4476, test_loss: 1.5973, test_f1: 0.5519
 epoch: 81, train_loss: 0.4323, test_loss: 1.3539, test_f1: 0.5976
 epoch: 82, train_loss: 0.4482, test_loss: 1.2996, test_f1: 0.5875
 epoch: 83, train_loss: 0.4095, test_loss: 1.5179, test_f1: 0.5718
 epoch: 84, train_loss: 0.4615, test_loss: 1.4751, test_f1: 0.6085
 epoch: 85, train_loss: 0.4200, test_loss: 1.3633, test_f1: 0.5597
 epoch: 86, train_loss: 0.4389, test_loss: 1.5014, test_f1: 0.5802
 epoch: 87, train_loss: 0.4513, test_loss: 1.5090, test_f1: 0.5790
 epoch: 88, train_loss: 0.4743, test_loss: 1.4398, test_f1: 0.6191
 epoch: 89, train_loss: 0.4334, test_loss: 1.5296, test_f1: 0.5753
 epoch: 90, train_loss: 0.4375, test_loss: 1.3003, test_f1: 0.6055
 epoch: 91, train_loss: 0.4022, test_loss: 1.6525, test_f1: 0.5747
 epoch: 92, train_loss: 0.4082, test_loss: 1.4923, test_f1: 0.5870
 epoch: 93, train_loss: 0.4133, test_loss: 1.6171, test_f1: 0.5650
 epoch: 94, train_loss: 0.4018, test_loss: 1.4582, test_f1: 0.5822
 epoch: 95, train_loss: 0.4385, test_loss: 1.4608, test_f1: 0.6062
 epoch: 96, train_loss: 0.4280, test_loss: 1.4489, test_f1: 0.6343
 epoch: 97, train_loss: 0.4282, test_loss: 1.8474, test_f1: 0.5965
 epoch: 98, train_loss: 0.4033, test_loss: 1.5679, test_f1: 0.5660
 epoch: 99, train_loss: 0.4162, test_loss: 1.5407, test_f1: 0.5854

Training completed in 415.11 seconds
Best F1: 0.6982 at epoch 84
Mean F1 across iterations: 0.6648  0.0170
========================FINAL RESULTS================================
FEGIN weighted F1: 0.6982  0.0170
python main.py --data ltspice_demos --representation component_pin_net --model FEGIN --layers 3 --hiddens 32 --batch_size 64 --lr 0.01 --emb_size 512 --epochs 100 --save_appendix component_pin_net_L3_H32_BS64_LR0.01_E512 --no_val
-----



STDERR:
  File "main.py", line 370, in <module>
    main()
  File "main.py", line 254, in main
    dataset = dataset_class(
  File "/home/philip/projects/ltspice_examples_code_repo/Circuit-Completion-Using-GNNs/component_classification_with_link_prediction_head/evaluation/FEGIN/kernel/circuit_datasets.py", line 15, in __init__
    self.data, self.slices = torch.load(self.processed_paths[0])
  File "/home/philip/.local/lib/python3.8/site-packages/torch/serialization.py", line 1040, in load
    warnings.warn(
  File "/usr/lib/python3.8/warnings.py", line 109, in _showwarnmsg
    sw(msg.message, msg.category, msg.filename, msg.lineno,
  File "main.py", line 47, in warn_with_traceback
    traceback.print_stack(file=log)
/home/philip/projects/ltspice_examples_code_repo/Circuit-Completion-Using-GNNs/component_classification_with_link_prediction_head/evaluation/FEGIN/kernel/circuit_datasets.py:15: FutureWarning: You are using `torch.load` with `weights_only=False` (the current default value), which uses the default pickle module implicitly. It is possible to construct malicious pickle data which will execute arbitrary code during unpickling (See https://github.com/pytorch/pytorch/blob/main/SECURITY.md#untrusted-models for more details). In a future release, the default value for `weights_only` will be flipped to `True`. This limits the functions that could be executed during unpickling. Arbitrary objects will no longer be allowed to be loaded via this mode unless they are explicitly allowlisted by the user via `torch.serialization.add_safe_globals`. We recommend you start setting `weights_only=True` for any use case where you don't have full control of the loaded file. Please open an issue on GitHub for any issues related to this experimental feature.
  self.data, self.slices = torch.load(self.processed_paths[0])
