STDOUT:
Results will be saved in /home/philip/projects/ltspice_examples_code_repo/Circuit-Completion-Using-GNNs/component_classification_with_link_prediction_head/evaluation/FEGIN/results/model_FEGIN_dataset_ltspice_demos
Command line input: python main.py --data ltspice_demos --representation component_pin_net --model FEGIN --layers 6 --hiddens 64 --batch_size 64 --lr 0.001 --emb_size 512 --epochs 100 --save_appendix component_pin_net_L6_H64_BS64_LR0.001_E512 --no_val
 is saved.
-----
ltspice_demos - FEGIN
Using 6 layers, 64 hidden units, h = 2
Loading component_pin_net representation dataset
ENTERED
Training FEGIN on component_pin_net representation
Train: 1565, Test: 383
##################ITERATION #0 ****************************************
 epoch: 0, train_loss: 1.2787, test_loss: 1.3283, test_f1: 0.2281
 epoch: 1, train_loss: 1.1375, test_loss: 1.2395, test_f1: 0.3471
 epoch: 2, train_loss: 1.0971, test_loss: 1.1592, test_f1: 0.4315
 epoch: 3, train_loss: 1.0316, test_loss: 1.1188, test_f1: 0.4520
 epoch: 4, train_loss: 0.9935, test_loss: 1.0560, test_f1: 0.4943
 epoch: 5, train_loss: 0.9701, test_loss: 1.0557, test_f1: 0.4544
 epoch: 6, train_loss: 0.9313, test_loss: 1.0339, test_f1: 0.5313
 epoch: 7, train_loss: 0.9063, test_loss: 1.0502, test_f1: 0.5341
 epoch: 8, train_loss: 0.8902, test_loss: 1.0173, test_f1: 0.5394
 epoch: 9, train_loss: 0.8514, test_loss: 1.0283, test_f1: 0.5541
 epoch: 10, train_loss: 0.8313, test_loss: 1.0714, test_f1: 0.5561
 epoch: 11, train_loss: 0.7891, test_loss: 1.0406, test_f1: 0.5218
 epoch: 12, train_loss: 0.7735, test_loss: 1.0019, test_f1: 0.5483
 epoch: 13, train_loss: 0.7401, test_loss: 1.0344, test_f1: 0.6178
 epoch: 14, train_loss: 0.7239, test_loss: 1.0397, test_f1: 0.5983
 epoch: 15, train_loss: 0.7242, test_loss: 1.0118, test_f1: 0.5624
 epoch: 16, train_loss: 0.7296, test_loss: 1.0293, test_f1: 0.5937
 epoch: 17, train_loss: 0.7186, test_loss: 1.0610, test_f1: 0.5847
 epoch: 18, train_loss: 0.6951, test_loss: 1.1027, test_f1: 0.5521
 epoch: 19, train_loss: 0.6531, test_loss: 1.0581, test_f1: 0.6047
 epoch: 20, train_loss: 0.6392, test_loss: 1.0645, test_f1: 0.6045
 epoch: 21, train_loss: 0.6408, test_loss: 1.0412, test_f1: 0.5657
 epoch: 22, train_loss: 0.6075, test_loss: 1.1322, test_f1: 0.5644
 epoch: 23, train_loss: 0.6000, test_loss: 1.0959, test_f1: 0.5673
 epoch: 24, train_loss: 0.5801, test_loss: 1.1599, test_f1: 0.5856
 epoch: 25, train_loss: 0.5606, test_loss: 1.2606, test_f1: 0.5411
 epoch: 26, train_loss: 0.5686, test_loss: 1.1715, test_f1: 0.6085
 epoch: 27, train_loss: 0.5261, test_loss: 1.2938, test_f1: 0.6389
 epoch: 28, train_loss: 0.5166, test_loss: 1.4490, test_f1: 0.6026
 epoch: 29, train_loss: 0.5602, test_loss: 1.1290, test_f1: 0.6437
 epoch: 30, train_loss: 0.5404, test_loss: 1.2925, test_f1: 0.5832
 epoch: 31, train_loss: 0.5087, test_loss: 1.2930, test_f1: 0.6262
 epoch: 32, train_loss: 0.4995, test_loss: 1.2732, test_f1: 0.6438
 epoch: 33, train_loss: 0.4904, test_loss: 1.3862, test_f1: 0.6024
 epoch: 34, train_loss: 0.4544, test_loss: 1.2990, test_f1: 0.6293
 epoch: 35, train_loss: 0.4660, test_loss: 1.3001, test_f1: 0.6234
 epoch: 36, train_loss: 0.4731, test_loss: 1.3735, test_f1: 0.5774
 epoch: 37, train_loss: 0.4315, test_loss: 1.3972, test_f1: 0.5920
 epoch: 38, train_loss: 0.4419, test_loss: 1.5536, test_f1: 0.5865
 epoch: 39, train_loss: 0.4507, test_loss: 1.4581, test_f1: 0.5841
 epoch: 40, train_loss: 0.4247, test_loss: 1.4407, test_f1: 0.6069
 epoch: 41, train_loss: 0.3850, test_loss: 1.5194, test_f1: 0.5809
 epoch: 42, train_loss: 0.3667, test_loss: 1.5683, test_f1: 0.6052
 epoch: 43, train_loss: 0.4064, test_loss: 1.7549, test_f1: 0.5954
 epoch: 44, train_loss: 0.4085, test_loss: 1.5070, test_f1: 0.5941
 epoch: 45, train_loss: 0.3966, test_loss: 1.6185, test_f1: 0.5764
 epoch: 46, train_loss: 0.3725, test_loss: 1.5348, test_f1: 0.6509
 epoch: 47, train_loss: 0.3893, test_loss: 1.6276, test_f1: 0.6378
 epoch: 48, train_loss: 0.3351, test_loss: 1.5619, test_f1: 0.6237
 epoch: 49, train_loss: 0.3504, test_loss: 1.7104, test_f1: 0.5586
 epoch: 50, train_loss: 0.3476, test_loss: 1.6951, test_f1: 0.6033
 epoch: 51, train_loss: 0.2863, test_loss: 1.7785, test_f1: 0.6495
 epoch: 52, train_loss: 0.2648, test_loss: 1.7858, test_f1: 0.6397
 epoch: 53, train_loss: 0.2493, test_loss: 1.8937, test_f1: 0.5931
 epoch: 54, train_loss: 0.2416, test_loss: 2.0196, test_f1: 0.6135
 epoch: 55, train_loss: 0.2397, test_loss: 2.0049, test_f1: 0.6335
 epoch: 56, train_loss: 0.2215, test_loss: 1.9787, test_f1: 0.6315
 epoch: 57, train_loss: 0.2176, test_loss: 1.9999, test_f1: 0.6327
 epoch: 58, train_loss: 0.2140, test_loss: 2.1807, test_f1: 0.6229
 epoch: 59, train_loss: 0.2060, test_loss: 2.2826, test_f1: 0.5857
 epoch: 60, train_loss: 0.2040, test_loss: 2.3678, test_f1: 0.6035
 epoch: 61, train_loss: 0.1966, test_loss: 2.2783, test_f1: 0.6013
 epoch: 62, train_loss: 0.2113, test_loss: 2.3065, test_f1: 0.6173
 epoch: 63, train_loss: 0.2280, test_loss: 2.3144, test_f1: 0.5948
 epoch: 64, train_loss: 0.2132, test_loss: 2.3786, test_f1: 0.6478
 epoch: 65, train_loss: 0.1979, test_loss: 2.3372, test_f1: 0.5971
 epoch: 66, train_loss: 0.1729, test_loss: 2.5983, test_f1: 0.6120
 epoch: 67, train_loss: 0.1577, test_loss: 2.4217, test_f1: 0.6159
 epoch: 68, train_loss: 0.1805, test_loss: 2.6838, test_f1: 0.5993
 epoch: 69, train_loss: 0.2066, test_loss: 2.8243, test_f1: 0.5905
 epoch: 70, train_loss: 0.2054, test_loss: 2.5188, test_f1: 0.6451
 epoch: 71, train_loss: 0.1766, test_loss: 2.7212, test_f1: 0.6203
 epoch: 72, train_loss: 0.1552, test_loss: 2.8372, test_f1: 0.6078
 epoch: 73, train_loss: 0.1222, test_loss: 3.0022, test_f1: 0.6066
 epoch: 74, train_loss: 0.1427, test_loss: 2.8437, test_f1: 0.6134
 epoch: 75, train_loss: 0.1806, test_loss: 2.7931, test_f1: 0.6351
 epoch: 76, train_loss: 0.1800, test_loss: 3.0627, test_f1: 0.6031
 epoch: 77, train_loss: 0.1840, test_loss: 2.9006, test_f1: 0.6162
 epoch: 78, train_loss: 0.1581, test_loss: 2.7589, test_f1: 0.6237
 epoch: 79, train_loss: 0.1421, test_loss: 2.7615, test_f1: 0.6203
 epoch: 80, train_loss: 0.1526, test_loss: 2.9207, test_f1: 0.5894
 epoch: 81, train_loss: 0.1308, test_loss: 2.9015, test_f1: 0.6265
 epoch: 82, train_loss: 0.1216, test_loss: 2.9429, test_f1: 0.6238
 epoch: 83, train_loss: 0.1332, test_loss: 3.2762, test_f1: 0.5813
 epoch: 84, train_loss: 0.1442, test_loss: 2.8461, test_f1: 0.6625
 epoch: 85, train_loss: 0.1516, test_loss: 3.0758, test_f1: 0.5718
 epoch: 86, train_loss: 0.1426, test_loss: 3.0616, test_f1: 0.6172
 epoch: 87, train_loss: 0.1255, test_loss: 2.8926, test_f1: 0.6571
 epoch: 88, train_loss: 0.1288, test_loss: 2.9760, test_f1: 0.6020
 epoch: 89, train_loss: 0.1381, test_loss: 3.0643, test_f1: 0.6091
 epoch: 90, train_loss: 0.1228, test_loss: 3.1098, test_f1: 0.6129
 epoch: 91, train_loss: 0.1395, test_loss: 3.1643, test_f1: 0.6263
 epoch: 92, train_loss: 0.1092, test_loss: 3.1940, test_f1: 0.6189
 epoch: 93, train_loss: 0.0867, test_loss: 3.1450, test_f1: 0.6235
 epoch: 94, train_loss: 0.1409, test_loss: 3.0612, test_f1: 0.6720
 epoch: 95, train_loss: 0.1122, test_loss: 3.3189, test_f1: 0.6287
 epoch: 96, train_loss: 0.1132, test_loss: 3.0736, test_f1: 0.6149
 epoch: 97, train_loss: 0.1372, test_loss: 3.0188, test_f1: 0.6235
 epoch: 98, train_loss: 0.1181, test_loss: 3.2990, test_f1: 0.6142
 epoch: 99, train_loss: 0.1479, test_loss: 3.2734, test_f1: 0.6236
##################ITERATION #1 ****************************************
 epoch: 0, train_loss: 1.1747, test_loss: 1.3028, test_f1: 0.2281
 epoch: 1, train_loss: 1.0103, test_loss: 1.2786, test_f1: 0.2835
 epoch: 2, train_loss: 0.9787, test_loss: 1.0393, test_f1: 0.5388
 epoch: 3, train_loss: 0.9474, test_loss: 1.0271, test_f1: 0.5374
 epoch: 4, train_loss: 0.9295, test_loss: 1.0246, test_f1: 0.5267
 epoch: 5, train_loss: 0.8990, test_loss: 1.0039, test_f1: 0.5376
 epoch: 6, train_loss: 0.8938, test_loss: 1.0245, test_f1: 0.5576
 epoch: 7, train_loss: 0.8551, test_loss: 1.0175, test_f1: 0.5688
 epoch: 8, train_loss: 0.8375, test_loss: 1.0850, test_f1: 0.5606
 epoch: 9, train_loss: 0.8118, test_loss: 1.1489, test_f1: 0.5442
 epoch: 10, train_loss: 0.7851, test_loss: 1.0603, test_f1: 0.5702
 epoch: 11, train_loss: 0.7726, test_loss: 1.0935, test_f1: 0.5322
 epoch: 12, train_loss: 0.7315, test_loss: 1.1788, test_f1: 0.5625
 epoch: 13, train_loss: 0.7122, test_loss: 1.2770, test_f1: 0.5246
 epoch: 14, train_loss: 0.7075, test_loss: 1.0900, test_f1: 0.6162
 epoch: 15, train_loss: 0.6877, test_loss: 1.2161, test_f1: 0.5438
 epoch: 16, train_loss: 0.6755, test_loss: 1.1531, test_f1: 0.6041
 epoch: 17, train_loss: 0.6688, test_loss: 1.1243, test_f1: 0.6074
 epoch: 18, train_loss: 0.6473, test_loss: 1.3777, test_f1: 0.4874
 epoch: 19, train_loss: 0.6296, test_loss: 1.2581, test_f1: 0.5721
 epoch: 20, train_loss: 0.6336, test_loss: 1.1467, test_f1: 0.5931
 epoch: 21, train_loss: 0.5894, test_loss: 1.1704, test_f1: 0.5932
 epoch: 22, train_loss: 0.5793, test_loss: 1.2373, test_f1: 0.5932
 epoch: 23, train_loss: 0.5898, test_loss: 1.2928, test_f1: 0.5789
 epoch: 24, train_loss: 0.5616, test_loss: 1.2175, test_f1: 0.6498
 epoch: 25, train_loss: 0.5477, test_loss: 1.2899, test_f1: 0.6031
 epoch: 26, train_loss: 0.5302, test_loss: 1.3505, test_f1: 0.6015
 epoch: 27, train_loss: 0.5113, test_loss: 1.3739, test_f1: 0.6011
 epoch: 28, train_loss: 0.5048, test_loss: 1.4343, test_f1: 0.5985
 epoch: 29, train_loss: 0.4771, test_loss: 1.3299, test_f1: 0.6436
 epoch: 30, train_loss: 0.4925, test_loss: 1.5663, test_f1: 0.5949
 epoch: 31, train_loss: 0.4903, test_loss: 1.6924, test_f1: 0.5414
 epoch: 32, train_loss: 0.4894, test_loss: 1.2596, test_f1: 0.6295
 epoch: 33, train_loss: 0.4854, test_loss: 1.3261, test_f1: 0.6430
 epoch: 34, train_loss: 0.4705, test_loss: 1.4475, test_f1: 0.6666
 epoch: 35, train_loss: 0.4426, test_loss: 1.4850, test_f1: 0.6265
 epoch: 36, train_loss: 0.4195, test_loss: 1.6169, test_f1: 0.5972
 epoch: 37, train_loss: 0.4111, test_loss: 1.5986, test_f1: 0.6366
 epoch: 38, train_loss: 0.3832, test_loss: 1.6694, test_f1: 0.6379
 epoch: 39, train_loss: 0.3963, test_loss: 1.7783, test_f1: 0.6391
 epoch: 40, train_loss: 0.4225, test_loss: 1.6309, test_f1: 0.6406
 epoch: 41, train_loss: 0.4076, test_loss: 1.6005, test_f1: 0.6140
 epoch: 42, train_loss: 0.4148, test_loss: 1.6491, test_f1: 0.6480
 epoch: 43, train_loss: 0.3893, test_loss: 2.2576, test_f1: 0.6265
 epoch: 44, train_loss: 0.3814, test_loss: 1.8243, test_f1: 0.5563
 epoch: 45, train_loss: 0.3597, test_loss: 1.7041, test_f1: 0.6270
 epoch: 46, train_loss: 0.3679, test_loss: 1.9143, test_f1: 0.6089
 epoch: 47, train_loss: 0.3539, test_loss: 1.8869, test_f1: 0.6280
 epoch: 48, train_loss: 0.3311, test_loss: 1.9318, test_f1: 0.5803
 epoch: 49, train_loss: 0.3286, test_loss: 1.9475, test_f1: 0.6180
 epoch: 50, train_loss: 0.3262, test_loss: 1.8167, test_f1: 0.6403
 epoch: 51, train_loss: 0.2988, test_loss: 1.9528, test_f1: 0.6211
 epoch: 52, train_loss: 0.2479, test_loss: 1.9632, test_f1: 0.6294
 epoch: 53, train_loss: 0.2345, test_loss: 2.0011, test_f1: 0.6211
 epoch: 54, train_loss: 0.2288, test_loss: 2.1504, test_f1: 0.6183
 epoch: 55, train_loss: 0.1954, test_loss: 2.1843, test_f1: 0.6153
 epoch: 56, train_loss: 0.2028, test_loss: 2.1269, test_f1: 0.6313
 epoch: 57, train_loss: 0.2079, test_loss: 2.2630, test_f1: 0.6269
 epoch: 58, train_loss: 0.1881, test_loss: 2.3399, test_f1: 0.6287
 epoch: 59, train_loss: 0.1853, test_loss: 2.3284, test_f1: 0.6155
 epoch: 60, train_loss: 0.1807, test_loss: 2.3918, test_f1: 0.6180
 epoch: 61, train_loss: 0.1630, test_loss: 2.6255, test_f1: 0.6125
 epoch: 62, train_loss: 0.1958, test_loss: 2.5707, test_f1: 0.6267
 epoch: 63, train_loss: 0.2042, test_loss: 2.4283, test_f1: 0.6095
 epoch: 64, train_loss: 0.1818, test_loss: 2.4796, test_f1: 0.6153
 epoch: 65, train_loss: 0.1857, test_loss: 2.4264, test_f1: 0.6193
 epoch: 66, train_loss: 0.1790, test_loss: 2.6593, test_f1: 0.5996
 epoch: 67, train_loss: 0.1745, test_loss: 2.6186, test_f1: 0.6380
 epoch: 68, train_loss: 0.1563, test_loss: 2.7579, test_f1: 0.6139
 epoch: 69, train_loss: 0.1573, test_loss: 2.6673, test_f1: 0.6156
 epoch: 70, train_loss: 0.1552, test_loss: 2.8237, test_f1: 0.6147
 epoch: 71, train_loss: 0.1799, test_loss: 2.8492, test_f1: 0.6192
 epoch: 72, train_loss: 0.1621, test_loss: 2.5465, test_f1: 0.5932
 epoch: 73, train_loss: 0.1636, test_loss: 2.7799, test_f1: 0.6148
 epoch: 74, train_loss: 0.1654, test_loss: 3.0048, test_f1: 0.6104
 epoch: 75, train_loss: 0.1685, test_loss: 2.7483, test_f1: 0.6142
 epoch: 76, train_loss: 0.1363, test_loss: 2.7275, test_f1: 0.6246
 epoch: 77, train_loss: 0.1394, test_loss: 2.8834, test_f1: 0.6150
 epoch: 78, train_loss: 0.1418, test_loss: 3.1118, test_f1: 0.5954
 epoch: 79, train_loss: 0.1343, test_loss: 2.9956, test_f1: 0.5927
 epoch: 80, train_loss: 0.1810, test_loss: 2.9534, test_f1: 0.6057
 epoch: 81, train_loss: 0.1945, test_loss: 3.0715, test_f1: 0.5890
 epoch: 82, train_loss: 0.1642, test_loss: 2.9225, test_f1: 0.6258
 epoch: 83, train_loss: 0.1406, test_loss: 2.8957, test_f1: 0.6045
 epoch: 84, train_loss: 0.1447, test_loss: 3.0423, test_f1: 0.6457
 epoch: 85, train_loss: 0.1265, test_loss: 2.9252, test_f1: 0.6038
 epoch: 86, train_loss: 0.1109, test_loss: 3.0356, test_f1: 0.6231
 epoch: 87, train_loss: 0.1204, test_loss: 3.1830, test_f1: 0.6010
 epoch: 88, train_loss: 0.1229, test_loss: 2.9595, test_f1: 0.6304
 epoch: 89, train_loss: 0.1081, test_loss: 3.3740, test_f1: 0.5857
 epoch: 90, train_loss: 0.0939, test_loss: 3.4170, test_f1: 0.5829
 epoch: 91, train_loss: 0.1125, test_loss: 3.1919, test_f1: 0.5865
 epoch: 92, train_loss: 0.1474, test_loss: 3.0867, test_f1: 0.6248
 epoch: 93, train_loss: 0.1665, test_loss: 3.1278, test_f1: 0.6076
 epoch: 94, train_loss: 0.1707, test_loss: 3.3151, test_f1: 0.6011
 epoch: 95, train_loss: 0.1516, test_loss: 3.1706, test_f1: 0.5964
 epoch: 96, train_loss: 0.1355, test_loss: 3.2352, test_f1: 0.5999
 epoch: 97, train_loss: 0.1261, test_loss: 3.1154, test_f1: 0.6051
 epoch: 98, train_loss: 0.1104, test_loss: 3.3837, test_f1: 0.5826
 epoch: 99, train_loss: 0.1062, test_loss: 3.4415, test_f1: 0.6079
##################ITERATION #2 ****************************************
 epoch: 0, train_loss: 1.1643, test_loss: 1.3455, test_f1: 0.2281
 epoch: 1, train_loss: 1.0228, test_loss: 1.2172, test_f1: 0.3529
 epoch: 2, train_loss: 0.9708, test_loss: 1.1312, test_f1: 0.4572
 epoch: 3, train_loss: 0.9512, test_loss: 1.0361, test_f1: 0.5336
 epoch: 4, train_loss: 0.9177, test_loss: 1.0515, test_f1: 0.4977
 epoch: 5, train_loss: 0.8924, test_loss: 1.0036, test_f1: 0.5901
 epoch: 6, train_loss: 0.8698, test_loss: 1.0138, test_f1: 0.5652
 epoch: 7, train_loss: 0.8614, test_loss: 1.0401, test_f1: 0.5119
 epoch: 8, train_loss: 0.8264, test_loss: 1.0627, test_f1: 0.5478
 epoch: 9, train_loss: 0.7944, test_loss: 1.0322, test_f1: 0.5881
 epoch: 10, train_loss: 0.7748, test_loss: 1.0091, test_f1: 0.5782
 epoch: 11, train_loss: 0.7600, test_loss: 0.9912, test_f1: 0.6296
 epoch: 12, train_loss: 0.7115, test_loss: 1.1624, test_f1: 0.5231
 epoch: 13, train_loss: 0.6902, test_loss: 1.1398, test_f1: 0.5804
 epoch: 14, train_loss: 0.6934, test_loss: 1.0993, test_f1: 0.5953
 epoch: 15, train_loss: 0.6702, test_loss: 1.0326, test_f1: 0.6160
 epoch: 16, train_loss: 0.6616, test_loss: 1.0993, test_f1: 0.6350
 epoch: 17, train_loss: 0.6532, test_loss: 1.1245, test_f1: 0.6056
 epoch: 18, train_loss: 0.6508, test_loss: 1.1416, test_f1: 0.6085
 epoch: 19, train_loss: 0.6049, test_loss: 1.1693, test_f1: 0.6438
 epoch: 20, train_loss: 0.5827, test_loss: 1.2111, test_f1: 0.5826
 epoch: 21, train_loss: 0.5952, test_loss: 1.4256, test_f1: 0.6134
 epoch: 22, train_loss: 0.5789, test_loss: 1.3577, test_f1: 0.5536
 epoch: 23, train_loss: 0.5760, test_loss: 1.1699, test_f1: 0.6216
 epoch: 24, train_loss: 0.5276, test_loss: 1.2029, test_f1: 0.6249
 epoch: 25, train_loss: 0.5486, test_loss: 1.2754, test_f1: 0.6010
 epoch: 26, train_loss: 0.5241, test_loss: 1.2322, test_f1: 0.6320
 epoch: 27, train_loss: 0.5202, test_loss: 1.2319, test_f1: 0.6585
 epoch: 28, train_loss: 0.5225, test_loss: 1.1895, test_f1: 0.6360
 epoch: 29, train_loss: 0.4943, test_loss: 1.3089, test_f1: 0.6439
 epoch: 30, train_loss: 0.4892, test_loss: 1.2666, test_f1: 0.6153
 epoch: 31, train_loss: 0.4619, test_loss: 1.2597, test_f1: 0.6605
 epoch: 32, train_loss: 0.4470, test_loss: 1.3431, test_f1: 0.6156
 epoch: 33, train_loss: 0.4742, test_loss: 1.2703, test_f1: 0.6484
 epoch: 34, train_loss: 0.4688, test_loss: 1.3907, test_f1: 0.5887
 epoch: 35, train_loss: 0.4415, test_loss: 1.4204, test_f1: 0.6212
 epoch: 36, train_loss: 0.4251, test_loss: 1.2658, test_f1: 0.6750
 epoch: 37, train_loss: 0.4190, test_loss: 1.3846, test_f1: 0.6331
 epoch: 38, train_loss: 0.4158, test_loss: 1.4882, test_f1: 0.5820
 epoch: 39, train_loss: 0.4097, test_loss: 1.4466, test_f1: 0.6406
 epoch: 40, train_loss: 0.3901, test_loss: 1.3841, test_f1: 0.6291
 epoch: 41, train_loss: 0.3644, test_loss: 1.4658, test_f1: 0.6100
 epoch: 42, train_loss: 0.3752, test_loss: 1.5962, test_f1: 0.6520
 epoch: 43, train_loss: 0.3972, test_loss: 1.4187, test_f1: 0.6474
 epoch: 44, train_loss: 0.3722, test_loss: 1.4775, test_f1: 0.6551
 epoch: 45, train_loss: 0.3608, test_loss: 1.5318, test_f1: 0.6656
 epoch: 46, train_loss: 0.3814, test_loss: 1.4421, test_f1: 0.6471
 epoch: 47, train_loss: 0.3544, test_loss: 1.7458, test_f1: 0.6355
 epoch: 48, train_loss: 0.3757, test_loss: 1.6219, test_f1: 0.6468
 epoch: 49, train_loss: 0.3486, test_loss: 1.7165, test_f1: 0.6198
 epoch: 50, train_loss: 0.3137, test_loss: 1.7458, test_f1: 0.6400
 epoch: 51, train_loss: 0.2945, test_loss: 1.7500, test_f1: 0.6377
 epoch: 52, train_loss: 0.2659, test_loss: 1.7150, test_f1: 0.6593
 epoch: 53, train_loss: 0.2577, test_loss: 1.7247, test_f1: 0.6522
 epoch: 54, train_loss: 0.2433, test_loss: 1.8481, test_f1: 0.6409
 epoch: 55, train_loss: 0.2076, test_loss: 1.8804, test_f1: 0.6570
 epoch: 56, train_loss: 0.2289, test_loss: 1.8834, test_f1: 0.6400
 epoch: 57, train_loss: 0.2520, test_loss: 2.0465, test_f1: 0.6416
 epoch: 58, train_loss: 0.2249, test_loss: 2.0258, test_f1: 0.6270
 epoch: 59, train_loss: 0.2150, test_loss: 2.1335, test_f1: 0.6542
 epoch: 60, train_loss: 0.2043, test_loss: 2.0876, test_f1: 0.6334
 epoch: 61, train_loss: 0.2098, test_loss: 1.9982, test_f1: 0.6393
 epoch: 62, train_loss: 0.2208, test_loss: 2.1443, test_f1: 0.6426
 epoch: 63, train_loss: 0.2164, test_loss: 2.1757, test_f1: 0.6428
 epoch: 64, train_loss: 0.1967, test_loss: 2.2980, test_f1: 0.6275
 epoch: 65, train_loss: 0.1851, test_loss: 2.1764, test_f1: 0.6418
 epoch: 66, train_loss: 0.1749, test_loss: 2.2919, test_f1: 0.6434
 epoch: 67, train_loss: 0.1841, test_loss: 2.2464, test_f1: 0.6344
 epoch: 68, train_loss: 0.1543, test_loss: 2.4035, test_f1: 0.6139
 epoch: 69, train_loss: 0.1744, test_loss: 2.3309, test_f1: 0.6343
 epoch: 70, train_loss: 0.1828, test_loss: 2.3296, test_f1: 0.6384
 epoch: 71, train_loss: 0.1909, test_loss: 2.5048, test_f1: 0.6163
 epoch: 72, train_loss: 0.1725, test_loss: 2.3934, test_f1: 0.6223
 epoch: 73, train_loss: 0.1930, test_loss: 2.4178, test_f1: 0.6340
 epoch: 74, train_loss: 0.1775, test_loss: 2.4369, test_f1: 0.6158
 epoch: 75, train_loss: 0.1707, test_loss: 2.5181, test_f1: 0.6268
 epoch: 76, train_loss: 0.1984, test_loss: 2.4113, test_f1: 0.6080
 epoch: 77, train_loss: 0.1780, test_loss: 2.4574, test_f1: 0.6432
 epoch: 78, train_loss: 0.1795, test_loss: 2.5618, test_f1: 0.6134
 epoch: 79, train_loss: 0.1626, test_loss: 2.5622, test_f1: 0.6204
 epoch: 80, train_loss: 0.1576, test_loss: 2.5386, test_f1: 0.6373
 epoch: 81, train_loss: 0.1559, test_loss: 2.6604, test_f1: 0.6393
 epoch: 82, train_loss: 0.1460, test_loss: 2.6868, test_f1: 0.6091
 epoch: 83, train_loss: 0.1531, test_loss: 2.6462, test_f1: 0.6341
 epoch: 84, train_loss: 0.1386, test_loss: 2.7242, test_f1: 0.6219
 epoch: 85, train_loss: 0.1316, test_loss: 2.5257, test_f1: 0.6267
 epoch: 86, train_loss: 0.1346, test_loss: 2.8887, test_f1: 0.6403
 epoch: 87, train_loss: 0.1537, test_loss: 2.8696, test_f1: 0.6161
 epoch: 88, train_loss: 0.1441, test_loss: 3.0025, test_f1: 0.6250
 epoch: 89, train_loss: 0.1323, test_loss: 2.9298, test_f1: 0.6352
 epoch: 90, train_loss: 0.1423, test_loss: 2.9163, test_f1: 0.6207
 epoch: 91, train_loss: 0.1583, test_loss: 3.0435, test_f1: 0.6188
 epoch: 92, train_loss: 0.1170, test_loss: 3.0514, test_f1: 0.6212
 epoch: 93, train_loss: 0.1220, test_loss: 3.1262, test_f1: 0.6210
 epoch: 94, train_loss: 0.1181, test_loss: 3.0438, test_f1: 0.6420
 epoch: 95, train_loss: 0.1163, test_loss: 3.0102, test_f1: 0.6097
 epoch: 96, train_loss: 0.1341, test_loss: 2.9273, test_f1: 0.6206
 epoch: 97, train_loss: 0.1155, test_loss: 2.9769, test_f1: 0.6298
 epoch: 98, train_loss: 0.1260, test_loss: 3.0367, test_f1: 0.6273
 epoch: 99, train_loss: 0.1372, test_loss: 2.8506, test_f1: 0.6271
##################ITERATION #3 ****************************************
 epoch: 0, train_loss: 1.1957, test_loss: 1.4195, test_f1: 0.0831
 epoch: 1, train_loss: 1.0135, test_loss: 1.2458, test_f1: 0.3471
 epoch: 2, train_loss: 0.9736, test_loss: 1.0537, test_f1: 0.5259
 epoch: 3, train_loss: 0.9417, test_loss: 1.0861, test_f1: 0.5318
 epoch: 4, train_loss: 0.9287, test_loss: 1.0939, test_f1: 0.5079
 epoch: 5, train_loss: 0.8767, test_loss: 1.0302, test_f1: 0.5801
 epoch: 6, train_loss: 0.8387, test_loss: 1.0785, test_f1: 0.5501
 epoch: 7, train_loss: 0.8197, test_loss: 1.0791, test_f1: 0.5282
 epoch: 8, train_loss: 0.8314, test_loss: 1.0338, test_f1: 0.5808
 epoch: 9, train_loss: 0.7887, test_loss: 1.1181, test_f1: 0.5515
 epoch: 10, train_loss: 0.7959, test_loss: 1.1481, test_f1: 0.5302
 epoch: 11, train_loss: 0.7528, test_loss: 1.1171, test_f1: 0.5458
 epoch: 12, train_loss: 0.7288, test_loss: 1.1433, test_f1: 0.5168
 epoch: 13, train_loss: 0.7143, test_loss: 1.0746, test_f1: 0.5618
 epoch: 14, train_loss: 0.7232, test_loss: 1.2371, test_f1: 0.5163
 epoch: 15, train_loss: 0.6916, test_loss: 1.1465, test_f1: 0.5636
 epoch: 16, train_loss: 0.6738, test_loss: 1.2206, test_f1: 0.5519
 epoch: 17, train_loss: 0.6558, test_loss: 1.1775, test_f1: 0.5817
 epoch: 18, train_loss: 0.6174, test_loss: 1.1719, test_f1: 0.5772
 epoch: 19, train_loss: 0.5853, test_loss: 1.4205, test_f1: 0.5891
 epoch: 20, train_loss: 0.5873, test_loss: 1.2915, test_f1: 0.5863
 epoch: 21, train_loss: 0.6040, test_loss: 1.4144, test_f1: 0.5681
 epoch: 22, train_loss: 0.5524, test_loss: 1.3190, test_f1: 0.6025
 epoch: 23, train_loss: 0.5442, test_loss: 1.4235, test_f1: 0.5760
 epoch: 24, train_loss: 0.5622, test_loss: 1.2931, test_f1: 0.6063
 epoch: 25, train_loss: 0.5209, test_loss: 1.3525, test_f1: 0.6034
 epoch: 26, train_loss: 0.5253, test_loss: 1.4718, test_f1: 0.5189
 epoch: 27, train_loss: 0.5203, test_loss: 1.4002, test_f1: 0.5599
 epoch: 28, train_loss: 0.5031, test_loss: 1.2718, test_f1: 0.6273
 epoch: 29, train_loss: 0.4963, test_loss: 1.3823, test_f1: 0.6130
 epoch: 30, train_loss: 0.4943, test_loss: 1.3866, test_f1: 0.6159
 epoch: 31, train_loss: 0.4992, test_loss: 1.6705, test_f1: 0.5642
 epoch: 32, train_loss: 0.4376, test_loss: 1.5143, test_f1: 0.5974
 epoch: 33, train_loss: 0.4568, test_loss: 1.5174, test_f1: 0.6039
 epoch: 34, train_loss: 0.4639, test_loss: 1.4799, test_f1: 0.6378
 epoch: 35, train_loss: 0.4051, test_loss: 1.5094, test_f1: 0.6383
 epoch: 36, train_loss: 0.4073, test_loss: 1.5964, test_f1: 0.6082
 epoch: 37, train_loss: 0.4071, test_loss: 1.5981, test_f1: 0.5804
 epoch: 38, train_loss: 0.3910, test_loss: 1.6386, test_f1: 0.6252
 epoch: 39, train_loss: 0.3707, test_loss: 1.7346, test_f1: 0.6240
 epoch: 40, train_loss: 0.3585, test_loss: 1.7423, test_f1: 0.5968
 epoch: 41, train_loss: 0.4044, test_loss: 1.6202, test_f1: 0.6143
 epoch: 42, train_loss: 0.3969, test_loss: 1.5552, test_f1: 0.6530
 epoch: 43, train_loss: 0.3747, test_loss: 1.7818, test_f1: 0.5896
 epoch: 44, train_loss: 0.3815, test_loss: 1.8675, test_f1: 0.5959
 epoch: 45, train_loss: 0.3794, test_loss: 1.6765, test_f1: 0.6296
 epoch: 46, train_loss: 0.3199, test_loss: 1.8834, test_f1: 0.6182
 epoch: 47, train_loss: 0.3339, test_loss: 1.9150, test_f1: 0.5906
 epoch: 48, train_loss: 0.3095, test_loss: 2.0615, test_f1: 0.5782
 epoch: 49, train_loss: 0.3298, test_loss: 1.9018, test_f1: 0.6149
 epoch: 50, train_loss: 0.3129, test_loss: 1.9155, test_f1: 0.6174
 epoch: 51, train_loss: 0.2902, test_loss: 1.7975, test_f1: 0.6383
 epoch: 52, train_loss: 0.2458, test_loss: 1.9088, test_f1: 0.6192
 epoch: 53, train_loss: 0.2460, test_loss: 1.9575, test_f1: 0.6264
 epoch: 54, train_loss: 0.2321, test_loss: 1.9428, test_f1: 0.6480
 epoch: 55, train_loss: 0.2203, test_loss: 2.0239, test_f1: 0.6380
 epoch: 56, train_loss: 0.1947, test_loss: 1.9858, test_f1: 0.6321
 epoch: 57, train_loss: 0.2077, test_loss: 2.1650, test_f1: 0.6292
 epoch: 58, train_loss: 0.2080, test_loss: 2.0588, test_f1: 0.6314
 epoch: 59, train_loss: 0.1932, test_loss: 2.2255, test_f1: 0.6428
 epoch: 60, train_loss: 0.1872, test_loss: 2.2964, test_f1: 0.6236
 epoch: 61, train_loss: 0.1728, test_loss: 2.3036, test_f1: 0.6174
 epoch: 62, train_loss: 0.2041, test_loss: 2.3644, test_f1: 0.6151
 epoch: 63, train_loss: 0.1848, test_loss: 2.3650, test_f1: 0.6121
 epoch: 64, train_loss: 0.1908, test_loss: 2.3212, test_f1: 0.6132
 epoch: 65, train_loss: 0.2200, test_loss: 2.4569, test_f1: 0.6051
 epoch: 66, train_loss: 0.1603, test_loss: 2.4004, test_f1: 0.5959
 epoch: 67, train_loss: 0.1677, test_loss: 2.4274, test_f1: 0.6144
 epoch: 68, train_loss: 0.1811, test_loss: 2.4740, test_f1: 0.6128
 epoch: 69, train_loss: 0.1763, test_loss: 2.6976, test_f1: 0.6235
 epoch: 70, train_loss: 0.1550, test_loss: 2.7113, test_f1: 0.5814
 epoch: 71, train_loss: 0.1643, test_loss: 2.7279, test_f1: 0.6052
 epoch: 72, train_loss: 0.1650, test_loss: 2.4368, test_f1: 0.6410
 epoch: 73, train_loss: 0.1559, test_loss: 2.6427, test_f1: 0.6294
 epoch: 74, train_loss: 0.1635, test_loss: 2.5649, test_f1: 0.6303
 epoch: 75, train_loss: 0.1617, test_loss: 2.6685, test_f1: 0.6343
 epoch: 76, train_loss: 0.1641, test_loss: 2.7312, test_f1: 0.6208
 epoch: 77, train_loss: 0.1599, test_loss: 2.7221, test_f1: 0.6146
 epoch: 78, train_loss: 0.1513, test_loss: 2.7509, test_f1: 0.6014
 epoch: 79, train_loss: 0.1477, test_loss: 2.7883, test_f1: 0.6131
 epoch: 80, train_loss: 0.1475, test_loss: 2.9993, test_f1: 0.5954
 epoch: 81, train_loss: 0.1619, test_loss: 2.8046, test_f1: 0.6151
 epoch: 82, train_loss: 0.1676, test_loss: 2.8343, test_f1: 0.6165
 epoch: 83, train_loss: 0.1430, test_loss: 2.9124, test_f1: 0.6113
 epoch: 84, train_loss: 0.1561, test_loss: 2.8364, test_f1: 0.6214
 epoch: 85, train_loss: 0.1539, test_loss: 2.9059, test_f1: 0.6122
 epoch: 86, train_loss: 0.1701, test_loss: 2.8485, test_f1: 0.6040
 epoch: 87, train_loss: 0.1458, test_loss: 3.1082, test_f1: 0.6019
 epoch: 88, train_loss: 0.1358, test_loss: 3.0127, test_f1: 0.5723
 epoch: 89, train_loss: 0.1439, test_loss: 3.0777, test_f1: 0.5664
 epoch: 90, train_loss: 0.1314, test_loss: 2.7634, test_f1: 0.5985
 epoch: 91, train_loss: 0.1462, test_loss: 3.1773, test_f1: 0.6151
 epoch: 92, train_loss: 0.1233, test_loss: 3.0569, test_f1: 0.5612
 epoch: 93, train_loss: 0.1338, test_loss: 3.2731, test_f1: 0.6051
 epoch: 94, train_loss: 0.1319, test_loss: 3.0231, test_f1: 0.6082
 epoch: 95, train_loss: 0.1359, test_loss: 3.2932, test_f1: 0.5792
 epoch: 96, train_loss: 0.1262, test_loss: 3.2643, test_f1: 0.5903
 epoch: 97, train_loss: 0.1289, test_loss: 3.1718, test_f1: 0.6274
 epoch: 98, train_loss: 0.1263, test_loss: 3.1872, test_f1: 0.5969
 epoch: 99, train_loss: 0.1243, test_loss: 3.1470, test_f1: 0.6169
##################ITERATION #4 ****************************************
 epoch: 0, train_loss: 1.1827, test_loss: 1.3698, test_f1: 0.3373
 epoch: 1, train_loss: 1.0034, test_loss: 1.1694, test_f1: 0.4204
 epoch: 2, train_loss: 0.9553, test_loss: 1.1083, test_f1: 0.5090
 epoch: 3, train_loss: 0.9156, test_loss: 1.0257, test_f1: 0.5590
 epoch: 4, train_loss: 0.9134, test_loss: 1.0239, test_f1: 0.5505
 epoch: 5, train_loss: 0.8829, test_loss: 0.9731, test_f1: 0.5601
 epoch: 6, train_loss: 0.8455, test_loss: 0.9899, test_f1: 0.5901
 epoch: 7, train_loss: 0.8091, test_loss: 0.9793, test_f1: 0.6032
 epoch: 8, train_loss: 0.8000, test_loss: 1.0048, test_f1: 0.6158
 epoch: 9, train_loss: 0.7744, test_loss: 0.9811, test_f1: 0.6335
 epoch: 10, train_loss: 0.7480, test_loss: 0.9754, test_f1: 0.6058
 epoch: 11, train_loss: 0.7259, test_loss: 1.0104, test_f1: 0.5903
 epoch: 12, train_loss: 0.7016, test_loss: 1.0426, test_f1: 0.6454
 epoch: 13, train_loss: 0.6787, test_loss: 1.0889, test_f1: 0.5622
 epoch: 14, train_loss: 0.6976, test_loss: 1.0101, test_f1: 0.6159
 epoch: 15, train_loss: 0.6488, test_loss: 1.0040, test_f1: 0.6154
 epoch: 16, train_loss: 0.6463, test_loss: 1.1229, test_f1: 0.6440
 epoch: 17, train_loss: 0.6361, test_loss: 1.0450, test_f1: 0.6084
 epoch: 18, train_loss: 0.6336, test_loss: 1.1080, test_f1: 0.6319
 epoch: 19, train_loss: 0.6174, test_loss: 1.1785, test_f1: 0.6360
 epoch: 20, train_loss: 0.6081, test_loss: 1.2295, test_f1: 0.5703
 epoch: 21, train_loss: 0.6051, test_loss: 1.2359, test_f1: 0.5816
 epoch: 22, train_loss: 0.5636, test_loss: 1.1294, test_f1: 0.6078
 epoch: 23, train_loss: 0.5571, test_loss: 1.4321, test_f1: 0.5419
 epoch: 24, train_loss: 0.5599, test_loss: 1.3581, test_f1: 0.6207
 epoch: 25, train_loss: 0.5614, test_loss: 1.2644, test_f1: 0.6043
 epoch: 26, train_loss: 0.5596, test_loss: 1.3341, test_f1: 0.5457
 epoch: 27, train_loss: 0.5136, test_loss: 1.4116, test_f1: 0.5824
 epoch: 28, train_loss: 0.4984, test_loss: 1.5357, test_f1: 0.5968
 epoch: 29, train_loss: 0.5122, test_loss: 1.4454, test_f1: 0.5444
 epoch: 30, train_loss: 0.5033, test_loss: 1.4493, test_f1: 0.6417
 epoch: 31, train_loss: 0.5034, test_loss: 1.4978, test_f1: 0.5860
 epoch: 32, train_loss: 0.4761, test_loss: 1.5000, test_f1: 0.5504
 epoch: 33, train_loss: 0.4520, test_loss: 1.6693, test_f1: 0.5927
 epoch: 34, train_loss: 0.4708, test_loss: 1.5032, test_f1: 0.5980
 epoch: 35, train_loss: 0.4767, test_loss: 1.5624, test_f1: 0.6105
 epoch: 36, train_loss: 0.4514, test_loss: 1.5966, test_f1: 0.6035
 epoch: 37, train_loss: 0.4483, test_loss: 1.7470, test_f1: 0.6004
 epoch: 38, train_loss: 0.4093, test_loss: 1.9077, test_f1: 0.6033
 epoch: 39, train_loss: 0.3930, test_loss: 1.6853, test_f1: 0.6289
 epoch: 40, train_loss: 0.3941, test_loss: 1.7911, test_f1: 0.5670
 epoch: 41, train_loss: 0.4145, test_loss: 1.9230, test_f1: 0.6131
 epoch: 42, train_loss: 0.3887, test_loss: 2.2422, test_f1: 0.5849
 epoch: 43, train_loss: 0.4072, test_loss: 2.0255, test_f1: 0.5823
 epoch: 44, train_loss: 0.3917, test_loss: 1.9954, test_f1: 0.5746
 epoch: 45, train_loss: 0.4135, test_loss: 1.7897, test_f1: 0.6138
 epoch: 46, train_loss: 0.3711, test_loss: 1.9514, test_f1: 0.5717
 epoch: 47, train_loss: 0.3788, test_loss: 1.8938, test_f1: 0.6336
 epoch: 48, train_loss: 0.3418, test_loss: 2.0535, test_f1: 0.5801
 epoch: 49, train_loss: 0.3404, test_loss: 2.0948, test_f1: 0.5695
 epoch: 50, train_loss: 0.3547, test_loss: 2.1544, test_f1: 0.5707
 epoch: 51, train_loss: 0.2838, test_loss: 2.2140, test_f1: 0.6021
 epoch: 52, train_loss: 0.2962, test_loss: 2.2054, test_f1: 0.6081
 epoch: 53, train_loss: 0.2647, test_loss: 2.1996, test_f1: 0.5981
 epoch: 54, train_loss: 0.2762, test_loss: 2.2300, test_f1: 0.6015
 epoch: 55, train_loss: 0.2709, test_loss: 2.1461, test_f1: 0.6081
 epoch: 56, train_loss: 0.2487, test_loss: 2.4161, test_f1: 0.6207
 epoch: 57, train_loss: 0.2552, test_loss: 2.3896, test_f1: 0.6096
 epoch: 58, train_loss: 0.2664, test_loss: 2.4525, test_f1: 0.5843
 epoch: 59, train_loss: 0.2377, test_loss: 2.1945, test_f1: 0.5916
 epoch: 60, train_loss: 0.2315, test_loss: 2.4842, test_f1: 0.5989
 epoch: 61, train_loss: 0.2425, test_loss: 2.4005, test_f1: 0.5990
 epoch: 62, train_loss: 0.2286, test_loss: 2.4161, test_f1: 0.6019
 epoch: 63, train_loss: 0.2431, test_loss: 2.3031, test_f1: 0.5951
 epoch: 64, train_loss: 0.2417, test_loss: 2.3475, test_f1: 0.6360
 epoch: 65, train_loss: 0.2239, test_loss: 2.4738, test_f1: 0.6036
 epoch: 66, train_loss: 0.2155, test_loss: 2.6101, test_f1: 0.5949
 epoch: 67, train_loss: 0.2019, test_loss: 2.6226, test_f1: 0.5903
 epoch: 68, train_loss: 0.2208, test_loss: 2.6202, test_f1: 0.6071
 epoch: 69, train_loss: 0.2290, test_loss: 2.8571, test_f1: 0.5812
 epoch: 70, train_loss: 0.2099, test_loss: 2.7103, test_f1: 0.5740
 epoch: 71, train_loss: 0.2203, test_loss: 2.7274, test_f1: 0.5883
 epoch: 72, train_loss: 0.2053, test_loss: 2.7324, test_f1: 0.5768
 epoch: 73, train_loss: 0.2268, test_loss: 2.7275, test_f1: 0.5942
 epoch: 74, train_loss: 0.2358, test_loss: 2.9156, test_f1: 0.5826
 epoch: 75, train_loss: 0.2128, test_loss: 2.9163, test_f1: 0.5871
 epoch: 76, train_loss: 0.2117, test_loss: 2.9117, test_f1: 0.5354
 epoch: 77, train_loss: 0.2180, test_loss: 2.6828, test_f1: 0.5598
 epoch: 78, train_loss: 0.2291, test_loss: 3.0030, test_f1: 0.5538
 epoch: 79, train_loss: 0.2114, test_loss: 2.7213, test_f1: 0.5869
 epoch: 80, train_loss: 0.2114, test_loss: 2.9242, test_f1: 0.5730
 epoch: 81, train_loss: 0.2062, test_loss: 3.0322, test_f1: 0.5818
 epoch: 82, train_loss: 0.1966, test_loss: 2.7904, test_f1: 0.5784
 epoch: 83, train_loss: 0.1807, test_loss: 3.0265, test_f1: 0.5883
 epoch: 84, train_loss: 0.2062, test_loss: 2.8748, test_f1: 0.5673
 epoch: 85, train_loss: 0.2098, test_loss: 2.7368, test_f1: 0.5905
 epoch: 86, train_loss: 0.1936, test_loss: 2.6608, test_f1: 0.5753
 epoch: 87, train_loss: 0.1808, test_loss: 2.6748, test_f1: 0.5952
 epoch: 88, train_loss: 0.1967, test_loss: 2.6606, test_f1: 0.5953
 epoch: 89, train_loss: 0.1831, test_loss: 3.0784, test_f1: 0.5387
 epoch: 90, train_loss: 0.1642, test_loss: 3.0660, test_f1: 0.5741
 epoch: 91, train_loss: 0.1650, test_loss: 2.9236, test_f1: 0.5891
 epoch: 92, train_loss: 0.1837, test_loss: 3.2095, test_f1: 0.5333
 epoch: 93, train_loss: 0.1624, test_loss: 2.9247, test_f1: 0.5867
 epoch: 94, train_loss: 0.1582, test_loss: 3.2404, test_f1: 0.6055
 epoch: 95, train_loss: 0.1894, test_loss: 3.1954, test_f1: 0.5596
 epoch: 96, train_loss: 0.1890, test_loss: 3.2299, test_f1: 0.5424
 epoch: 97, train_loss: 0.1560, test_loss: 3.1775, test_f1: 0.5703
 epoch: 98, train_loss: 0.1445, test_loss: 3.2563, test_f1: 0.5632
 epoch: 99, train_loss: 0.1679, test_loss: 3.1698, test_f1: 0.5791
##################ITERATION #5 ****************************************
 epoch: 0, train_loss: 1.2531, test_loss: 1.3246, test_f1: 0.1368
 epoch: 1, train_loss: 1.0339, test_loss: 1.5100, test_f1: 0.2904
 epoch: 2, train_loss: 0.9671, test_loss: 0.9988, test_f1: 0.5845
 epoch: 3, train_loss: 0.9146, test_loss: 1.0275, test_f1: 0.4867
 epoch: 4, train_loss: 0.8891, test_loss: 1.0100, test_f1: 0.5066
 epoch: 5, train_loss: 0.8596, test_loss: 1.0280, test_f1: 0.5228
 epoch: 6, train_loss: 0.8497, test_loss: 1.0063, test_f1: 0.5632
 epoch: 7, train_loss: 0.8043, test_loss: 0.9966, test_f1: 0.5551
 epoch: 8, train_loss: 0.7884, test_loss: 1.0083, test_f1: 0.5700
 epoch: 9, train_loss: 0.7420, test_loss: 1.0180, test_f1: 0.5772
 epoch: 10, train_loss: 0.7217, test_loss: 1.1083, test_f1: 0.5204
 epoch: 11, train_loss: 0.7266, test_loss: 1.1988, test_f1: 0.5191
 epoch: 12, train_loss: 0.6894, test_loss: 1.0522, test_f1: 0.5890
 epoch: 13, train_loss: 0.7180, test_loss: 1.1024, test_f1: 0.5726
 epoch: 14, train_loss: 0.6732, test_loss: 1.1716, test_f1: 0.5597
 epoch: 15, train_loss: 0.6547, test_loss: 1.1117, test_f1: 0.5934
 epoch: 16, train_loss: 0.6466, test_loss: 1.1573, test_f1: 0.5839
 epoch: 17, train_loss: 0.6391, test_loss: 1.1710, test_f1: 0.5830
 epoch: 18, train_loss: 0.6219, test_loss: 1.2136, test_f1: 0.5791
 epoch: 19, train_loss: 0.6056, test_loss: 1.1248, test_f1: 0.5918
 epoch: 20, train_loss: 0.5799, test_loss: 1.2214, test_f1: 0.6081
 epoch: 21, train_loss: 0.5613, test_loss: 1.3026, test_f1: 0.5844
 epoch: 22, train_loss: 0.5721, test_loss: 1.2751, test_f1: 0.5749
 epoch: 23, train_loss: 0.5584, test_loss: 1.3236, test_f1: 0.6028
 epoch: 24, train_loss: 0.5583, test_loss: 1.2113, test_f1: 0.6078
 epoch: 25, train_loss: 0.5385, test_loss: 1.2845, test_f1: 0.6069
 epoch: 26, train_loss: 0.5311, test_loss: 1.3136, test_f1: 0.5720
 epoch: 27, train_loss: 0.5154, test_loss: 1.3098, test_f1: 0.6215
 epoch: 28, train_loss: 0.5067, test_loss: 1.3558, test_f1: 0.5795
 epoch: 29, train_loss: 0.4670, test_loss: 1.3073, test_f1: 0.6014
 epoch: 30, train_loss: 0.4578, test_loss: 1.3468, test_f1: 0.6301
 epoch: 31, train_loss: 0.4798, test_loss: 1.3982, test_f1: 0.6216
 epoch: 32, train_loss: 0.4633, test_loss: 1.5064, test_f1: 0.5794
 epoch: 33, train_loss: 0.4558, test_loss: 1.4714, test_f1: 0.6298
 epoch: 34, train_loss: 0.4450, test_loss: 1.5018, test_f1: 0.6047
 epoch: 35, train_loss: 0.4386, test_loss: 1.4818, test_f1: 0.5774
 epoch: 36, train_loss: 0.4144, test_loss: 1.4940, test_f1: 0.5801
 epoch: 37, train_loss: 0.4089, test_loss: 1.5741, test_f1: 0.6148
 epoch: 38, train_loss: 0.3946, test_loss: 1.4584, test_f1: 0.6015
 epoch: 39, train_loss: 0.4077, test_loss: 1.4210, test_f1: 0.5646
 epoch: 40, train_loss: 0.3960, test_loss: 1.6931, test_f1: 0.5922
 epoch: 41, train_loss: 0.3737, test_loss: 1.6190, test_f1: 0.6101
 epoch: 42, train_loss: 0.3610, test_loss: 1.6330, test_f1: 0.5974
 epoch: 43, train_loss: 0.3589, test_loss: 1.9597, test_f1: 0.5818
 epoch: 44, train_loss: 0.3988, test_loss: 1.8094, test_f1: 0.5716
 epoch: 45, train_loss: 0.3711, test_loss: 1.6015, test_f1: 0.6017
 epoch: 46, train_loss: 0.3335, test_loss: 1.8503, test_f1: 0.5644
 epoch: 47, train_loss: 0.3655, test_loss: 1.6422, test_f1: 0.6329
 epoch: 48, train_loss: 0.3399, test_loss: 1.6803, test_f1: 0.6111
 epoch: 49, train_loss: 0.3698, test_loss: 1.8081, test_f1: 0.6284
 epoch: 50, train_loss: 0.3262, test_loss: 1.7421, test_f1: 0.5658
 epoch: 51, train_loss: 0.2709, test_loss: 1.8440, test_f1: 0.5875
 epoch: 52, train_loss: 0.2552, test_loss: 1.8563, test_f1: 0.6153
 epoch: 53, train_loss: 0.2474, test_loss: 1.9120, test_f1: 0.6063
 epoch: 54, train_loss: 0.2395, test_loss: 2.0426, test_f1: 0.5944
 epoch: 55, train_loss: 0.2226, test_loss: 2.0785, test_f1: 0.6033
 epoch: 56, train_loss: 0.2152, test_loss: 2.0406, test_f1: 0.6377
 epoch: 57, train_loss: 0.2068, test_loss: 2.1961, test_f1: 0.5877
 epoch: 58, train_loss: 0.2093, test_loss: 2.1998, test_f1: 0.6080
 epoch: 59, train_loss: 0.2268, test_loss: 2.2310, test_f1: 0.6217
 epoch: 60, train_loss: 0.2039, test_loss: 2.2194, test_f1: 0.6067
 epoch: 61, train_loss: 0.2265, test_loss: 2.2150, test_f1: 0.6088
 epoch: 62, train_loss: 0.1998, test_loss: 2.2269, test_f1: 0.6279
 epoch: 63, train_loss: 0.2115, test_loss: 2.1377, test_f1: 0.6321
 epoch: 64, train_loss: 0.2083, test_loss: 2.2659, test_f1: 0.6146
 epoch: 65, train_loss: 0.1923, test_loss: 2.3741, test_f1: 0.6132
 epoch: 66, train_loss: 0.1893, test_loss: 2.3018, test_f1: 0.6241
 epoch: 67, train_loss: 0.1852, test_loss: 2.2727, test_f1: 0.6253
 epoch: 68, train_loss: 0.1876, test_loss: 2.3926, test_f1: 0.5884
 epoch: 69, train_loss: 0.1713, test_loss: 2.4702, test_f1: 0.6201
 epoch: 70, train_loss: 0.1870, test_loss: 2.4176, test_f1: 0.6109
 epoch: 71, train_loss: 0.1870, test_loss: 2.4702, test_f1: 0.5733
 epoch: 72, train_loss: 0.2018, test_loss: 2.4986, test_f1: 0.6136
 epoch: 73, train_loss: 0.1717, test_loss: 2.6302, test_f1: 0.6148
 epoch: 74, train_loss: 0.1552, test_loss: 2.5807, test_f1: 0.6176
 epoch: 75, train_loss: 0.1591, test_loss: 2.6104, test_f1: 0.5865
 epoch: 76, train_loss: 0.1764, test_loss: 2.6137, test_f1: 0.5924
 epoch: 77, train_loss: 0.1808, test_loss: 2.7254, test_f1: 0.6089
 epoch: 78, train_loss: 0.1745, test_loss: 2.5565, test_f1: 0.6149
 epoch: 79, train_loss: 0.1531, test_loss: 2.7249, test_f1: 0.5919
 epoch: 80, train_loss: 0.1541, test_loss: 2.5690, test_f1: 0.6150
 epoch: 81, train_loss: 0.1314, test_loss: 2.7385, test_f1: 0.6077
 epoch: 82, train_loss: 0.1449, test_loss: 2.6978, test_f1: 0.6269
 epoch: 83, train_loss: 0.1312, test_loss: 2.7220, test_f1: 0.6165
 epoch: 84, train_loss: 0.1421, test_loss: 2.7371, test_f1: 0.6309
 epoch: 85, train_loss: 0.1478, test_loss: 3.0162, test_f1: 0.5896
 epoch: 86, train_loss: 0.1521, test_loss: 2.7458, test_f1: 0.5869
 epoch: 87, train_loss: 0.1634, test_loss: 3.0186, test_f1: 0.6295
 epoch: 88, train_loss: 0.2101, test_loss: 2.8990, test_f1: 0.5868
 epoch: 89, train_loss: 0.2089, test_loss: 2.5390, test_f1: 0.5922
 epoch: 90, train_loss: 0.1646, test_loss: 2.7343, test_f1: 0.6207
 epoch: 91, train_loss: 0.1396, test_loss: 2.8014, test_f1: 0.6062
 epoch: 92, train_loss: 0.1406, test_loss: 3.0156, test_f1: 0.5782
 epoch: 93, train_loss: 0.1328, test_loss: 2.8768, test_f1: 0.6375
 epoch: 94, train_loss: 0.1350, test_loss: 2.8019, test_f1: 0.5940
 epoch: 95, train_loss: 0.1155, test_loss: 2.9393, test_f1: 0.5831
 epoch: 96, train_loss: 0.1131, test_loss: 3.1082, test_f1: 0.5908
 epoch: 97, train_loss: 0.1113, test_loss: 3.1429, test_f1: 0.6059
 epoch: 98, train_loss: 0.1403, test_loss: 2.9657, test_f1: 0.6029
 epoch: 99, train_loss: 0.1037, test_loss: 3.0163, test_f1: 0.6359
##################ITERATION #6 ****************************************
 epoch: 0, train_loss: 1.3324, test_loss: 1.3940, test_f1: 0.1365
 epoch: 1, train_loss: 1.1102, test_loss: 1.3354, test_f1: 0.3824
 epoch: 2, train_loss: 1.0358, test_loss: 1.0715, test_f1: 0.4631
 epoch: 3, train_loss: 0.9645, test_loss: 1.0763, test_f1: 0.5264
 epoch: 4, train_loss: 0.9051, test_loss: 1.0589, test_f1: 0.5209
 epoch: 5, train_loss: 0.8923, test_loss: 1.0490, test_f1: 0.5544
 epoch: 6, train_loss: 0.8919, test_loss: 1.0234, test_f1: 0.5587
 epoch: 7, train_loss: 0.8377, test_loss: 1.0261, test_f1: 0.5549
 epoch: 8, train_loss: 0.8170, test_loss: 1.0585, test_f1: 0.5601
 epoch: 9, train_loss: 0.8140, test_loss: 1.0825, test_f1: 0.5288
 epoch: 10, train_loss: 0.8046, test_loss: 1.0641, test_f1: 0.5259
 epoch: 11, train_loss: 0.7645, test_loss: 1.0696, test_f1: 0.5150
 epoch: 12, train_loss: 0.7588, test_loss: 0.9906, test_f1: 0.6004
 epoch: 13, train_loss: 0.7332, test_loss: 1.0486, test_f1: 0.5451
 epoch: 14, train_loss: 0.6908, test_loss: 1.0828, test_f1: 0.5607
 epoch: 15, train_loss: 0.7069, test_loss: 1.1911, test_f1: 0.5427
 epoch: 16, train_loss: 0.7084, test_loss: 1.1186, test_f1: 0.5357
 epoch: 17, train_loss: 0.6564, test_loss: 1.1300, test_f1: 0.5718
 epoch: 18, train_loss: 0.6783, test_loss: 1.1990, test_f1: 0.5502
 epoch: 19, train_loss: 0.6449, test_loss: 1.1689, test_f1: 0.5536
 epoch: 20, train_loss: 0.6123, test_loss: 1.2209, test_f1: 0.5052
 epoch: 21, train_loss: 0.6137, test_loss: 1.1685, test_f1: 0.5490
 epoch: 22, train_loss: 0.6028, test_loss: 1.2582, test_f1: 0.5427
 epoch: 23, train_loss: 0.5906, test_loss: 1.1280, test_f1: 0.5816
 epoch: 24, train_loss: 0.5828, test_loss: 1.2597, test_f1: 0.5619
 epoch: 25, train_loss: 0.5535, test_loss: 1.2081, test_f1: 0.5866
 epoch: 26, train_loss: 0.5723, test_loss: 1.2819, test_f1: 0.5972
 epoch: 27, train_loss: 0.5265, test_loss: 1.3098, test_f1: 0.5431
 epoch: 28, train_loss: 0.5155, test_loss: 1.2629, test_f1: 0.5895
 epoch: 29, train_loss: 0.5436, test_loss: 1.4165, test_f1: 0.6033
 epoch: 30, train_loss: 0.5050, test_loss: 1.3445, test_f1: 0.6316
 epoch: 31, train_loss: 0.4957, test_loss: 1.3184, test_f1: 0.5844
 epoch: 32, train_loss: 0.5288, test_loss: 1.4601, test_f1: 0.6012
 epoch: 33, train_loss: 0.5367, test_loss: 1.3062, test_f1: 0.5918
 epoch: 34, train_loss: 0.5134, test_loss: 1.5118, test_f1: 0.5856
 epoch: 35, train_loss: 0.5086, test_loss: 1.3014, test_f1: 0.5413
 epoch: 36, train_loss: 0.4563, test_loss: 1.3461, test_f1: 0.6507
 epoch: 37, train_loss: 0.4406, test_loss: 1.3238, test_f1: 0.6374
 epoch: 38, train_loss: 0.4367, test_loss: 1.4396, test_f1: 0.5971
 epoch: 39, train_loss: 0.4318, test_loss: 1.3976, test_f1: 0.6382
 epoch: 40, train_loss: 0.4292, test_loss: 1.4024, test_f1: 0.6335
 epoch: 41, train_loss: 0.4143, test_loss: 1.6045, test_f1: 0.6047
 epoch: 42, train_loss: 0.4123, test_loss: 1.4767, test_f1: 0.6007
 epoch: 43, train_loss: 0.4131, test_loss: 1.4305, test_f1: 0.6377
 epoch: 44, train_loss: 0.3776, test_loss: 1.6268, test_f1: 0.5653
 epoch: 45, train_loss: 0.3732, test_loss: 1.7737, test_f1: 0.5977
 epoch: 46, train_loss: 0.3472, test_loss: 1.6035, test_f1: 0.5876
 epoch: 47, train_loss: 0.3761, test_loss: 1.8047, test_f1: 0.6119
 epoch: 48, train_loss: 0.3716, test_loss: 1.6009, test_f1: 0.5486
 epoch: 49, train_loss: 0.3486, test_loss: 1.6772, test_f1: 0.5941
 epoch: 50, train_loss: 0.3405, test_loss: 1.6751, test_f1: 0.6070
 epoch: 51, train_loss: 0.3300, test_loss: 1.7152, test_f1: 0.5801
 epoch: 52, train_loss: 0.2995, test_loss: 1.8423, test_f1: 0.5517
 epoch: 53, train_loss: 0.2928, test_loss: 1.7553, test_f1: 0.5901
 epoch: 54, train_loss: 0.2692, test_loss: 1.8435, test_f1: 0.6023
 epoch: 55, train_loss: 0.2597, test_loss: 1.6395, test_f1: 0.6260
 epoch: 56, train_loss: 0.2529, test_loss: 1.8218, test_f1: 0.5840
 epoch: 57, train_loss: 0.2635, test_loss: 1.7660, test_f1: 0.5850
 epoch: 58, train_loss: 0.2538, test_loss: 1.8181, test_f1: 0.5900
 epoch: 59, train_loss: 0.2568, test_loss: 1.8776, test_f1: 0.6045
 epoch: 60, train_loss: 0.2627, test_loss: 1.8948, test_f1: 0.5734
 epoch: 61, train_loss: 0.2306, test_loss: 1.9428, test_f1: 0.5718
 epoch: 62, train_loss: 0.2213, test_loss: 2.0059, test_f1: 0.6241
 epoch: 63, train_loss: 0.2212, test_loss: 1.9086, test_f1: 0.6141
 epoch: 64, train_loss: 0.2016, test_loss: 1.8969, test_f1: 0.5981
 epoch: 65, train_loss: 0.2324, test_loss: 1.9924, test_f1: 0.6040
 epoch: 66, train_loss: 0.2117, test_loss: 2.0696, test_f1: 0.6062
 epoch: 67, train_loss: 0.1880, test_loss: 2.1172, test_f1: 0.5960
 epoch: 68, train_loss: 0.2205, test_loss: 2.1095, test_f1: 0.5814
 epoch: 69, train_loss: 0.2150, test_loss: 2.0226, test_f1: 0.6117
 epoch: 70, train_loss: 0.2151, test_loss: 2.0527, test_f1: 0.5764
 epoch: 71, train_loss: 0.1951, test_loss: 2.0976, test_f1: 0.6066
 epoch: 72, train_loss: 0.2187, test_loss: 2.1063, test_f1: 0.6124
 epoch: 73, train_loss: 0.1983, test_loss: 2.1846, test_f1: 0.6186
 epoch: 74, train_loss: 0.1801, test_loss: 2.1334, test_f1: 0.6307
 epoch: 75, train_loss: 0.2127, test_loss: 2.1287, test_f1: 0.5949
 epoch: 76, train_loss: 0.2009, test_loss: 2.4979, test_f1: 0.5401
 epoch: 77, train_loss: 0.2011, test_loss: 2.0618, test_f1: 0.6029
 epoch: 78, train_loss: 0.1627, test_loss: 2.1748, test_f1: 0.6050
 epoch: 79, train_loss: 0.1825, test_loss: 2.2870, test_f1: 0.6163
 epoch: 80, train_loss: 0.2016, test_loss: 2.3327, test_f1: 0.5742
 epoch: 81, train_loss: 0.2017, test_loss: 2.0973, test_f1: 0.5997
 epoch: 82, train_loss: 0.1607, test_loss: 2.3173, test_f1: 0.5830
 epoch: 83, train_loss: 0.1790, test_loss: 2.1189, test_f1: 0.6127
 epoch: 84, train_loss: 0.2000, test_loss: 2.3773, test_f1: 0.5695
 epoch: 85, train_loss: 0.1940, test_loss: 2.4106, test_f1: 0.5772
 epoch: 86, train_loss: 0.1761, test_loss: 2.3047, test_f1: 0.5630
 epoch: 87, train_loss: 0.1739, test_loss: 2.2864, test_f1: 0.6123
 epoch: 88, train_loss: 0.1761, test_loss: 2.3600, test_f1: 0.5998
 epoch: 89, train_loss: 0.1659, test_loss: 2.5421, test_f1: 0.5799
 epoch: 90, train_loss: 0.1843, test_loss: 2.2786, test_f1: 0.6038
 epoch: 91, train_loss: 0.1544, test_loss: 2.3640, test_f1: 0.5868
 epoch: 92, train_loss: 0.1805, test_loss: 2.4215, test_f1: 0.6022
 epoch: 93, train_loss: 0.1625, test_loss: 2.4610, test_f1: 0.5895
 epoch: 94, train_loss: 0.1679, test_loss: 2.6101, test_f1: 0.6045
 epoch: 95, train_loss: 0.1983, test_loss: 2.3248, test_f1: 0.6141
 epoch: 96, train_loss: 0.1683, test_loss: 2.4219, test_f1: 0.5707
 epoch: 97, train_loss: 0.1652, test_loss: 2.4682, test_f1: 0.5756
 epoch: 98, train_loss: 0.1615, test_loss: 2.4215, test_f1: 0.5970
 epoch: 99, train_loss: 0.1510, test_loss: 2.3540, test_f1: 0.5989
##################ITERATION #7 ****************************************
 epoch: 0, train_loss: 1.4114, test_loss: 1.7175, test_f1: 0.1365
 epoch: 1, train_loss: 1.0479, test_loss: 1.3960, test_f1: 0.2959
 epoch: 2, train_loss: 0.9607, test_loss: 1.1085, test_f1: 0.4686
 epoch: 3, train_loss: 0.9288, test_loss: 1.0541, test_f1: 0.5054
 epoch: 4, train_loss: 0.9059, test_loss: 1.0545, test_f1: 0.4897
 epoch: 5, train_loss: 0.8727, test_loss: 1.1242, test_f1: 0.4619
 epoch: 6, train_loss: 0.8555, test_loss: 1.0438, test_f1: 0.5411
 epoch: 7, train_loss: 0.8175, test_loss: 1.0219, test_f1: 0.5440
 epoch: 8, train_loss: 0.8012, test_loss: 1.0090, test_f1: 0.5884
 epoch: 9, train_loss: 0.7772, test_loss: 1.1891, test_f1: 0.4495
 epoch: 10, train_loss: 0.7488, test_loss: 1.0545, test_f1: 0.5627
 epoch: 11, train_loss: 0.7616, test_loss: 1.0499, test_f1: 0.5983
 epoch: 12, train_loss: 0.7231, test_loss: 1.0133, test_f1: 0.6108
 epoch: 13, train_loss: 0.7123, test_loss: 1.2011, test_f1: 0.5365
 epoch: 14, train_loss: 0.6669, test_loss: 1.1365, test_f1: 0.6236
 epoch: 15, train_loss: 0.6564, test_loss: 1.0469, test_f1: 0.6035
 epoch: 16, train_loss: 0.6470, test_loss: 1.1365, test_f1: 0.5653
 epoch: 17, train_loss: 0.6459, test_loss: 1.1785, test_f1: 0.5054
 epoch: 18, train_loss: 0.6168, test_loss: 1.1069, test_f1: 0.6070
 epoch: 19, train_loss: 0.6341, test_loss: 1.1884, test_f1: 0.5717
 epoch: 20, train_loss: 0.6105, test_loss: 1.1221, test_f1: 0.5926
 epoch: 21, train_loss: 0.5862, test_loss: 1.1770, test_f1: 0.5833
 epoch: 22, train_loss: 0.6058, test_loss: 1.2423, test_f1: 0.5992
 epoch: 23, train_loss: 0.5388, test_loss: 1.2935, test_f1: 0.5787
 epoch: 24, train_loss: 0.5599, test_loss: 1.2269, test_f1: 0.5856
 epoch: 25, train_loss: 0.5300, test_loss: 1.3004, test_f1: 0.6086
 epoch: 26, train_loss: 0.5368, test_loss: 1.2215, test_f1: 0.6461
 epoch: 27, train_loss: 0.5227, test_loss: 1.2852, test_f1: 0.5749
 epoch: 28, train_loss: 0.4993, test_loss: 1.2178, test_f1: 0.6170
 epoch: 29, train_loss: 0.4813, test_loss: 1.2526, test_f1: 0.6365
 epoch: 30, train_loss: 0.4798, test_loss: 1.2588, test_f1: 0.6444
 epoch: 31, train_loss: 0.4461, test_loss: 1.3099, test_f1: 0.6314
 epoch: 32, train_loss: 0.4866, test_loss: 1.4858, test_f1: 0.6003
 epoch: 33, train_loss: 0.4923, test_loss: 1.4869, test_f1: 0.5866
 epoch: 34, train_loss: 0.4373, test_loss: 1.4143, test_f1: 0.5898
 epoch: 35, train_loss: 0.4489, test_loss: 1.3621, test_f1: 0.6353
 epoch: 36, train_loss: 0.4240, test_loss: 1.3828, test_f1: 0.6349
 epoch: 37, train_loss: 0.4482, test_loss: 1.3057, test_f1: 0.6488
 epoch: 38, train_loss: 0.3873, test_loss: 1.3491, test_f1: 0.6286
 epoch: 39, train_loss: 0.3831, test_loss: 1.4780, test_f1: 0.6282
 epoch: 40, train_loss: 0.3675, test_loss: 1.4604, test_f1: 0.6150
 epoch: 41, train_loss: 0.4036, test_loss: 1.6879, test_f1: 0.5615
 epoch: 42, train_loss: 0.3620, test_loss: 1.5522, test_f1: 0.6005
 epoch: 43, train_loss: 0.3622, test_loss: 1.5818, test_f1: 0.6324
 epoch: 44, train_loss: 0.3632, test_loss: 1.4676, test_f1: 0.6239
 epoch: 45, train_loss: 0.3224, test_loss: 1.6611, test_f1: 0.6065
 epoch: 46, train_loss: 0.3470, test_loss: 1.7906, test_f1: 0.5946
 epoch: 47, train_loss: 0.3510, test_loss: 1.6479, test_f1: 0.6185
 epoch: 48, train_loss: 0.3391, test_loss: 1.6060, test_f1: 0.6070
 epoch: 49, train_loss: 0.3385, test_loss: 1.7251, test_f1: 0.6042
 epoch: 50, train_loss: 0.3561, test_loss: 1.6521, test_f1: 0.5837
 epoch: 51, train_loss: 0.3361, test_loss: 1.6716, test_f1: 0.6216
 epoch: 52, train_loss: 0.2709, test_loss: 1.7155, test_f1: 0.6014
 epoch: 53, train_loss: 0.2695, test_loss: 1.7322, test_f1: 0.6127
 epoch: 54, train_loss: 0.2362, test_loss: 1.7427, test_f1: 0.6185
 epoch: 55, train_loss: 0.2107, test_loss: 1.7469, test_f1: 0.6225
 epoch: 56, train_loss: 0.2081, test_loss: 1.8967, test_f1: 0.6441
 epoch: 57, train_loss: 0.2022, test_loss: 1.9761, test_f1: 0.6002
 epoch: 58, train_loss: 0.2218, test_loss: 1.8997, test_f1: 0.6324
 epoch: 59, train_loss: 0.2079, test_loss: 1.9489, test_f1: 0.6137
 epoch: 60, train_loss: 0.2317, test_loss: 1.9008, test_f1: 0.6055
 epoch: 61, train_loss: 0.2260, test_loss: 1.9042, test_f1: 0.5996
 epoch: 62, train_loss: 0.2102, test_loss: 1.9594, test_f1: 0.6156
 epoch: 63, train_loss: 0.1917, test_loss: 2.0045, test_f1: 0.6208
 epoch: 64, train_loss: 0.2023, test_loss: 2.0277, test_f1: 0.6162
 epoch: 65, train_loss: 0.1816, test_loss: 2.0841, test_f1: 0.6008
 epoch: 66, train_loss: 0.1971, test_loss: 1.9785, test_f1: 0.6174
 epoch: 67, train_loss: 0.1855, test_loss: 1.9857, test_f1: 0.6084
 epoch: 68, train_loss: 0.1993, test_loss: 2.0178, test_f1: 0.6326
 epoch: 69, train_loss: 0.1967, test_loss: 2.1516, test_f1: 0.6197
 epoch: 70, train_loss: 0.2116, test_loss: 2.1274, test_f1: 0.6218
 epoch: 71, train_loss: 0.1939, test_loss: 2.0900, test_f1: 0.6206
 epoch: 72, train_loss: 0.1974, test_loss: 2.0690, test_f1: 0.6329
 epoch: 73, train_loss: 0.1825, test_loss: 2.0297, test_f1: 0.6304
 epoch: 74, train_loss: 0.1702, test_loss: 2.0717, test_f1: 0.6057
 epoch: 75, train_loss: 0.1573, test_loss: 2.0930, test_f1: 0.6123
 epoch: 76, train_loss: 0.1716, test_loss: 2.2369, test_f1: 0.6181
 epoch: 77, train_loss: 0.1567, test_loss: 2.1794, test_f1: 0.6307
 epoch: 78, train_loss: 0.1682, test_loss: 2.1132, test_f1: 0.6290
 epoch: 79, train_loss: 0.1809, test_loss: 2.2266, test_f1: 0.6177
 epoch: 80, train_loss: 0.1579, test_loss: 2.3072, test_f1: 0.6302
 epoch: 81, train_loss: 0.1615, test_loss: 2.1315, test_f1: 0.6279
 epoch: 82, train_loss: 0.1646, test_loss: 2.2612, test_f1: 0.6005
 epoch: 83, train_loss: 0.1712, test_loss: 2.4012, test_f1: 0.6115
 epoch: 84, train_loss: 0.1478, test_loss: 2.3825, test_f1: 0.6303
 epoch: 85, train_loss: 0.1633, test_loss: 2.3301, test_f1: 0.6243
 epoch: 86, train_loss: 0.1516, test_loss: 2.3268, test_f1: 0.5913
 epoch: 87, train_loss: 0.1335, test_loss: 2.5327, test_f1: 0.6082
 epoch: 88, train_loss: 0.1640, test_loss: 2.4219, test_f1: 0.6133
 epoch: 89, train_loss: 0.1634, test_loss: 2.4824, test_f1: 0.6315
 epoch: 90, train_loss: 0.1331, test_loss: 2.5077, test_f1: 0.6324
 epoch: 91, train_loss: 0.1220, test_loss: 2.6558, test_f1: 0.6258
 epoch: 92, train_loss: 0.1269, test_loss: 2.5526, test_f1: 0.6001
 epoch: 93, train_loss: 0.1282, test_loss: 2.5944, test_f1: 0.6271
 epoch: 94, train_loss: 0.1420, test_loss: 2.5570, test_f1: 0.5963
 epoch: 95, train_loss: 0.1363, test_loss: 2.7720, test_f1: 0.6106
 epoch: 96, train_loss: 0.1474, test_loss: 2.5380, test_f1: 0.6217
 epoch: 97, train_loss: 0.1566, test_loss: 2.7215, test_f1: 0.6133
 epoch: 98, train_loss: 0.1734, test_loss: 2.5519, test_f1: 0.5892
 epoch: 99, train_loss: 0.1381, test_loss: 2.4550, test_f1: 0.5887
##################ITERATION #8 ****************************************
 epoch: 0, train_loss: 1.4742, test_loss: 1.5988, test_f1: 0.2995
 epoch: 1, train_loss: 1.1543, test_loss: 1.4041, test_f1: 0.2980
 epoch: 2, train_loss: 1.0564, test_loss: 1.1428, test_f1: 0.4924
 epoch: 3, train_loss: 0.9645, test_loss: 1.0721, test_f1: 0.5248
 epoch: 4, train_loss: 0.9506, test_loss: 1.0673, test_f1: 0.5470
 epoch: 5, train_loss: 0.9436, test_loss: 1.1465, test_f1: 0.5205
 epoch: 6, train_loss: 0.9007, test_loss: 1.0179, test_f1: 0.5395
 epoch: 7, train_loss: 0.8821, test_loss: 1.0485, test_f1: 0.5305
 epoch: 8, train_loss: 0.8582, test_loss: 1.0010, test_f1: 0.5706
 epoch: 9, train_loss: 0.8218, test_loss: 1.0420, test_f1: 0.5525
 epoch: 10, train_loss: 0.8055, test_loss: 1.0416, test_f1: 0.5845
 epoch: 11, train_loss: 0.7869, test_loss: 0.9833, test_f1: 0.5982
 epoch: 12, train_loss: 0.7613, test_loss: 1.0696, test_f1: 0.5877
 epoch: 13, train_loss: 0.7616, test_loss: 1.0161, test_f1: 0.5615
 epoch: 14, train_loss: 0.7410, test_loss: 1.1760, test_f1: 0.5415
 epoch: 15, train_loss: 0.7463, test_loss: 1.0418, test_f1: 0.6160
 epoch: 16, train_loss: 0.7239, test_loss: 0.9898, test_f1: 0.6212
 epoch: 17, train_loss: 0.6915, test_loss: 1.1076, test_f1: 0.5917
 epoch: 18, train_loss: 0.6739, test_loss: 1.0701, test_f1: 0.5568
 epoch: 19, train_loss: 0.6669, test_loss: 1.0098, test_f1: 0.6145
 epoch: 20, train_loss: 0.6543, test_loss: 1.0452, test_f1: 0.6080
 epoch: 21, train_loss: 0.6614, test_loss: 1.1107, test_f1: 0.6147
 epoch: 22, train_loss: 0.6354, test_loss: 1.1874, test_f1: 0.5831
 epoch: 23, train_loss: 0.5916, test_loss: 1.1258, test_f1: 0.6089
 epoch: 24, train_loss: 0.6114, test_loss: 1.1042, test_f1: 0.6002
 epoch: 25, train_loss: 0.5897, test_loss: 1.0962, test_f1: 0.5834
 epoch: 26, train_loss: 0.5692, test_loss: 1.1636, test_f1: 0.6068
 epoch: 27, train_loss: 0.5603, test_loss: 1.1802, test_f1: 0.6074
 epoch: 28, train_loss: 0.5576, test_loss: 1.1633, test_f1: 0.6150
 epoch: 29, train_loss: 0.5366, test_loss: 1.2172, test_f1: 0.6080
 epoch: 30, train_loss: 0.5319, test_loss: 1.2359, test_f1: 0.6139
 epoch: 31, train_loss: 0.5034, test_loss: 1.3577, test_f1: 0.5776
 epoch: 32, train_loss: 0.5147, test_loss: 1.2444, test_f1: 0.6351
 epoch: 33, train_loss: 0.4774, test_loss: 1.3813, test_f1: 0.6255
 epoch: 34, train_loss: 0.5024, test_loss: 1.3285, test_f1: 0.6410
 epoch: 35, train_loss: 0.4887, test_loss: 1.2653, test_f1: 0.6289
 epoch: 36, train_loss: 0.4887, test_loss: 1.2706, test_f1: 0.6343
 epoch: 37, train_loss: 0.4617, test_loss: 1.3875, test_f1: 0.6020
 epoch: 38, train_loss: 0.4816, test_loss: 1.3603, test_f1: 0.6127
 epoch: 39, train_loss: 0.4815, test_loss: 1.3402, test_f1: 0.6246
 epoch: 40, train_loss: 0.4411, test_loss: 1.4638, test_f1: 0.6146
 epoch: 41, train_loss: 0.4517, test_loss: 1.3870, test_f1: 0.6395
 epoch: 42, train_loss: 0.4668, test_loss: 1.4549, test_f1: 0.5956
 epoch: 43, train_loss: 0.4581, test_loss: 1.5640, test_f1: 0.5704
 epoch: 44, train_loss: 0.4111, test_loss: 1.4659, test_f1: 0.5922
 epoch: 45, train_loss: 0.3888, test_loss: 1.4290, test_f1: 0.6191
 epoch: 46, train_loss: 0.3729, test_loss: 1.5986, test_f1: 0.5766
 epoch: 47, train_loss: 0.3548, test_loss: 1.5719, test_f1: 0.6030
 epoch: 48, train_loss: 0.3827, test_loss: 1.5170, test_f1: 0.5697
 epoch: 49, train_loss: 0.3857, test_loss: 1.6137, test_f1: 0.6294
 epoch: 50, train_loss: 0.3554, test_loss: 1.8457, test_f1: 0.5682
 epoch: 51, train_loss: 0.3513, test_loss: 1.8224, test_f1: 0.5743
 epoch: 52, train_loss: 0.3020, test_loss: 1.7706, test_f1: 0.6012
 epoch: 53, train_loss: 0.2979, test_loss: 1.7492, test_f1: 0.6054
 epoch: 54, train_loss: 0.2930, test_loss: 1.7354, test_f1: 0.6320
 epoch: 55, train_loss: 0.2861, test_loss: 1.7692, test_f1: 0.6155
 epoch: 56, train_loss: 0.2906, test_loss: 1.7917, test_f1: 0.6157
 epoch: 57, train_loss: 0.2638, test_loss: 1.7987, test_f1: 0.6105
 epoch: 58, train_loss: 0.2645, test_loss: 1.8841, test_f1: 0.6083
 epoch: 59, train_loss: 0.2611, test_loss: 1.8682, test_f1: 0.5946
 epoch: 60, train_loss: 0.2570, test_loss: 1.8522, test_f1: 0.5965
 epoch: 61, train_loss: 0.2716, test_loss: 2.0249, test_f1: 0.5886
 epoch: 62, train_loss: 0.2532, test_loss: 1.9621, test_f1: 0.6114
 epoch: 63, train_loss: 0.2456, test_loss: 1.9882, test_f1: 0.5978
 epoch: 64, train_loss: 0.2186, test_loss: 1.9568, test_f1: 0.6062
 epoch: 65, train_loss: 0.2192, test_loss: 2.0506, test_f1: 0.5974
 epoch: 66, train_loss: 0.2351, test_loss: 1.9657, test_f1: 0.6181
 epoch: 67, train_loss: 0.2448, test_loss: 1.9817, test_f1: 0.6231
 epoch: 68, train_loss: 0.2035, test_loss: 2.1451, test_f1: 0.6285
 epoch: 69, train_loss: 0.1999, test_loss: 2.0578, test_f1: 0.5977
 epoch: 70, train_loss: 0.2609, test_loss: 2.0827, test_f1: 0.6082
 epoch: 71, train_loss: 0.2818, test_loss: 2.1751, test_f1: 0.6222
 epoch: 72, train_loss: 0.1915, test_loss: 2.1458, test_f1: 0.6063
 epoch: 73, train_loss: 0.2206, test_loss: 2.1647, test_f1: 0.6067
 epoch: 74, train_loss: 0.2513, test_loss: 2.0896, test_f1: 0.5985
 epoch: 75, train_loss: 0.2059, test_loss: 2.1467, test_f1: 0.6077
 epoch: 76, train_loss: 0.2196, test_loss: 2.0636, test_f1: 0.6042
 epoch: 77, train_loss: 0.1948, test_loss: 2.3042, test_f1: 0.5952
 epoch: 78, train_loss: 0.2101, test_loss: 2.0644, test_f1: 0.6104
 epoch: 79, train_loss: 0.1717, test_loss: 2.3988, test_f1: 0.5992
 epoch: 80, train_loss: 0.1980, test_loss: 2.4367, test_f1: 0.5945
 epoch: 81, train_loss: 0.1825, test_loss: 2.2979, test_f1: 0.5882
 epoch: 82, train_loss: 0.1960, test_loss: 2.2598, test_f1: 0.5939
 epoch: 83, train_loss: 0.2082, test_loss: 2.3628, test_f1: 0.5892
 epoch: 84, train_loss: 0.1887, test_loss: 2.1346, test_f1: 0.6034
 epoch: 85, train_loss: 0.2002, test_loss: 2.3555, test_f1: 0.5887
 epoch: 86, train_loss: 0.1699, test_loss: 2.5019, test_f1: 0.5499
 epoch: 87, train_loss: 0.1788, test_loss: 2.3182, test_f1: 0.6229
 epoch: 88, train_loss: 0.1726, test_loss: 2.5000, test_f1: 0.5850
 epoch: 89, train_loss: 0.1818, test_loss: 2.3457, test_f1: 0.6207
 epoch: 90, train_loss: 0.1867, test_loss: 2.4817, test_f1: 0.5926
 epoch: 91, train_loss: 0.2081, test_loss: 2.2782, test_f1: 0.5744
 epoch: 92, train_loss: 0.1860, test_loss: 2.4857, test_f1: 0.5937
 epoch: 93, train_loss: 0.1747, test_loss: 2.3658, test_f1: 0.5899
 epoch: 94, train_loss: 0.1905, test_loss: 2.5624, test_f1: 0.6121
 epoch: 95, train_loss: 0.2000, test_loss: 2.4498, test_f1: 0.5808
 epoch: 96, train_loss: 0.1712, test_loss: 2.4504, test_f1: 0.5959
 epoch: 97, train_loss: 0.1649, test_loss: 2.5482, test_f1: 0.6033
 epoch: 98, train_loss: 0.1714, test_loss: 2.5201, test_f1: 0.6088
 epoch: 99, train_loss: 0.1643, test_loss: 2.4402, test_f1: 0.6041
##################ITERATION #9 ****************************************
 epoch: 0, train_loss: 1.3691, test_loss: 1.2814, test_f1: 0.3297
 epoch: 1, train_loss: 1.0974, test_loss: 2.3897, test_f1: 0.1485
 epoch: 2, train_loss: 0.9763, test_loss: 1.0662, test_f1: 0.4394
 epoch: 3, train_loss: 0.9583, test_loss: 1.0939, test_f1: 0.5143
 epoch: 4, train_loss: 0.9169, test_loss: 1.0331, test_f1: 0.5740
 epoch: 5, train_loss: 0.8987, test_loss: 1.0456, test_f1: 0.5526
 epoch: 6, train_loss: 0.8777, test_loss: 1.0500, test_f1: 0.4964
 epoch: 7, train_loss: 0.8538, test_loss: 1.0754, test_f1: 0.5366
 epoch: 8, train_loss: 0.8251, test_loss: 1.0677, test_f1: 0.5163
 epoch: 9, train_loss: 0.8082, test_loss: 1.0196, test_f1: 0.5832
 epoch: 10, train_loss: 0.7823, test_loss: 1.0890, test_f1: 0.5354
 epoch: 11, train_loss: 0.7802, test_loss: 1.0945, test_f1: 0.5017
 epoch: 12, train_loss: 0.7495, test_loss: 1.0539, test_f1: 0.5922
 epoch: 13, train_loss: 0.7292, test_loss: 1.1550, test_f1: 0.5719
 epoch: 14, train_loss: 0.7237, test_loss: 1.1164, test_f1: 0.5986
 epoch: 15, train_loss: 0.7117, test_loss: 1.1132, test_f1: 0.5961
 epoch: 16, train_loss: 0.6957, test_loss: 1.1432, test_f1: 0.5746
 epoch: 17, train_loss: 0.6840, test_loss: 1.1752, test_f1: 0.5817
 epoch: 18, train_loss: 0.7001, test_loss: 1.1995, test_f1: 0.5454
 epoch: 19, train_loss: 0.6786, test_loss: 1.2086, test_f1: 0.5421
 epoch: 20, train_loss: 0.6579, test_loss: 1.2157, test_f1: 0.5761
 epoch: 21, train_loss: 0.6197, test_loss: 1.2217, test_f1: 0.5553
 epoch: 22, train_loss: 0.6151, test_loss: 1.2508, test_f1: 0.5973
 epoch: 23, train_loss: 0.5923, test_loss: 1.1240, test_f1: 0.6125
 epoch: 24, train_loss: 0.6209, test_loss: 1.2543, test_f1: 0.5530
 epoch: 25, train_loss: 0.5943, test_loss: 1.2852, test_f1: 0.5750
 epoch: 26, train_loss: 0.5681, test_loss: 1.4434, test_f1: 0.5537
 epoch: 27, train_loss: 0.5500, test_loss: 1.2833, test_f1: 0.6021
 epoch: 28, train_loss: 0.5195, test_loss: 1.3766, test_f1: 0.5752
 epoch: 29, train_loss: 0.5329, test_loss: 1.3026, test_f1: 0.5973
 epoch: 30, train_loss: 0.5066, test_loss: 1.3659, test_f1: 0.6308
 epoch: 31, train_loss: 0.4794, test_loss: 1.4199, test_f1: 0.6060
 epoch: 32, train_loss: 0.5014, test_loss: 1.4922, test_f1: 0.5733
 epoch: 33, train_loss: 0.4846, test_loss: 1.4380, test_f1: 0.5680
 epoch: 34, train_loss: 0.4734, test_loss: 1.3829, test_f1: 0.5903
 epoch: 35, train_loss: 0.4661, test_loss: 1.3954, test_f1: 0.5935
 epoch: 36, train_loss: 0.4785, test_loss: 1.4446, test_f1: 0.5991
 epoch: 37, train_loss: 0.4725, test_loss: 1.6806, test_f1: 0.5343
 epoch: 38, train_loss: 0.4740, test_loss: 1.4204, test_f1: 0.5844
 epoch: 39, train_loss: 0.4395, test_loss: 1.5349, test_f1: 0.5959
 epoch: 40, train_loss: 0.4432, test_loss: 1.6942, test_f1: 0.6251
 epoch: 41, train_loss: 0.4384, test_loss: 1.6252, test_f1: 0.6143
 epoch: 42, train_loss: 0.4085, test_loss: 1.5292, test_f1: 0.6225
 epoch: 43, train_loss: 0.4009, test_loss: 1.5415, test_f1: 0.6297
 epoch: 44, train_loss: 0.3993, test_loss: 1.5519, test_f1: 0.5671
 epoch: 45, train_loss: 0.4118, test_loss: 1.6252, test_f1: 0.5876
 epoch: 46, train_loss: 0.4318, test_loss: 1.6735, test_f1: 0.5983
 epoch: 47, train_loss: 0.4323, test_loss: 1.5588, test_f1: 0.6480
 epoch: 48, train_loss: 0.3554, test_loss: 1.7887, test_f1: 0.5849
 epoch: 49, train_loss: 0.3608, test_loss: 1.6467, test_f1: 0.6074
 epoch: 50, train_loss: 0.3437, test_loss: 1.7671, test_f1: 0.6240
 epoch: 51, train_loss: 0.3103, test_loss: 1.6759, test_f1: 0.6273
 epoch: 52, train_loss: 0.2709, test_loss: 1.7630, test_f1: 0.6186
 epoch: 53, train_loss: 0.2616, test_loss: 1.8628, test_f1: 0.6055
 epoch: 54, train_loss: 0.2797, test_loss: 1.8368, test_f1: 0.6370
 epoch: 55, train_loss: 0.2675, test_loss: 1.8277, test_f1: 0.6293
 epoch: 56, train_loss: 0.2428, test_loss: 1.8824, test_f1: 0.6298
 epoch: 57, train_loss: 0.2626, test_loss: 1.9771, test_f1: 0.6326
 epoch: 58, train_loss: 0.2510, test_loss: 1.9956, test_f1: 0.6198
 epoch: 59, train_loss: 0.2381, test_loss: 2.0709, test_f1: 0.6167
 epoch: 60, train_loss: 0.2304, test_loss: 1.9926, test_f1: 0.6357
 epoch: 61, train_loss: 0.2322, test_loss: 2.0389, test_f1: 0.6327
 epoch: 62, train_loss: 0.2143, test_loss: 2.1192, test_f1: 0.6176
 epoch: 63, train_loss: 0.2105, test_loss: 2.1138, test_f1: 0.6161
 epoch: 64, train_loss: 0.2168, test_loss: 2.2240, test_f1: 0.6037
 epoch: 65, train_loss: 0.2052, test_loss: 2.0772, test_f1: 0.6038
 epoch: 66, train_loss: 0.2011, test_loss: 2.1624, test_f1: 0.6122
 epoch: 67, train_loss: 0.2164, test_loss: 2.3279, test_f1: 0.5897
 epoch: 68, train_loss: 0.2273, test_loss: 2.2351, test_f1: 0.6131
 epoch: 69, train_loss: 0.2133, test_loss: 2.2662, test_f1: 0.6139
 epoch: 70, train_loss: 0.2222, test_loss: 2.2872, test_f1: 0.5901
 epoch: 71, train_loss: 0.2176, test_loss: 2.2832, test_f1: 0.6124
 epoch: 72, train_loss: 0.1888, test_loss: 2.3335, test_f1: 0.6001
 epoch: 73, train_loss: 0.1784, test_loss: 2.4635, test_f1: 0.5936
 epoch: 74, train_loss: 0.1904, test_loss: 2.3492, test_f1: 0.6047
 epoch: 75, train_loss: 0.1969, test_loss: 2.3408, test_f1: 0.5931
 epoch: 76, train_loss: 0.1970, test_loss: 2.4034, test_f1: 0.5881
 epoch: 77, train_loss: 0.1879, test_loss: 2.3905, test_f1: 0.6088
 epoch: 78, train_loss: 0.1991, test_loss: 2.4473, test_f1: 0.6159
 epoch: 79, train_loss: 0.1981, test_loss: 2.3180, test_f1: 0.5810
 epoch: 80, train_loss: 0.2060, test_loss: 2.4017, test_f1: 0.6107
 epoch: 81, train_loss: 0.1582, test_loss: 2.3446, test_f1: 0.6094
 epoch: 82, train_loss: 0.1701, test_loss: 2.5235, test_f1: 0.6036
 epoch: 83, train_loss: 0.1642, test_loss: 2.5578, test_f1: 0.6030
 epoch: 84, train_loss: 0.1663, test_loss: 2.3831, test_f1: 0.6503
 epoch: 85, train_loss: 0.1843, test_loss: 2.7172, test_f1: 0.5807
 epoch: 86, train_loss: 0.1752, test_loss: 2.7319, test_f1: 0.5906
 epoch: 87, train_loss: 0.1960, test_loss: 2.6982, test_f1: 0.6191
 epoch: 88, train_loss: 0.2224, test_loss: 2.5466, test_f1: 0.5945
 epoch: 89, train_loss: 0.1683, test_loss: 2.6666, test_f1: 0.6040
 epoch: 90, train_loss: 0.1428, test_loss: 2.5640, test_f1: 0.5946
 epoch: 91, train_loss: 0.1761, test_loss: 2.6551, test_f1: 0.6247
 epoch: 92, train_loss: 0.1667, test_loss: 2.6579, test_f1: 0.6282
 epoch: 93, train_loss: 0.1419, test_loss: 2.6149, test_f1: 0.5937
 epoch: 94, train_loss: 0.1402, test_loss: 2.7389, test_f1: 0.5954
 epoch: 95, train_loss: 0.1836, test_loss: 2.8474, test_f1: 0.5916
 epoch: 96, train_loss: 0.1652, test_loss: 2.6958, test_f1: 0.6062
 epoch: 97, train_loss: 0.1561, test_loss: 2.7934, test_f1: 0.6062
 epoch: 98, train_loss: 0.1427, test_loss: 2.7516, test_f1: 0.5708
 epoch: 99, train_loss: 0.1453, test_loss: 2.7661, test_f1: 0.5908

Training completed in 553.04 seconds
Best F1: 0.6750 at epoch 36
Mean F1 across iterations: 0.6540  0.0122
========================FINAL RESULTS================================
FEGIN weighted F1: 0.6750  0.0122
python main.py --data ltspice_demos --representation component_pin_net --model FEGIN --layers 6 --hiddens 64 --batch_size 64 --lr 0.001 --emb_size 512 --epochs 100 --save_appendix component_pin_net_L6_H64_BS64_LR0.001_E512 --no_val
-----



STDERR:
  File "main.py", line 370, in <module>
    main()
  File "main.py", line 254, in main
    dataset = dataset_class(
  File "/home/philip/projects/ltspice_examples_code_repo/Circuit-Completion-Using-GNNs/component_classification_with_link_prediction_head/evaluation/FEGIN/kernel/circuit_datasets.py", line 15, in __init__
    self.data, self.slices = torch.load(self.processed_paths[0])
  File "/home/philip/.local/lib/python3.8/site-packages/torch/serialization.py", line 1040, in load
    warnings.warn(
  File "/usr/lib/python3.8/warnings.py", line 109, in _showwarnmsg
    sw(msg.message, msg.category, msg.filename, msg.lineno,
  File "main.py", line 47, in warn_with_traceback
    traceback.print_stack(file=log)
/home/philip/projects/ltspice_examples_code_repo/Circuit-Completion-Using-GNNs/component_classification_with_link_prediction_head/evaluation/FEGIN/kernel/circuit_datasets.py:15: FutureWarning: You are using `torch.load` with `weights_only=False` (the current default value), which uses the default pickle module implicitly. It is possible to construct malicious pickle data which will execute arbitrary code during unpickling (See https://github.com/pytorch/pytorch/blob/main/SECURITY.md#untrusted-models for more details). In a future release, the default value for `weights_only` will be flipped to `True`. This limits the functions that could be executed during unpickling. Arbitrary objects will no longer be allowed to be loaded via this mode unless they are explicitly allowlisted by the user via `torch.serialization.add_safe_globals`. We recommend you start setting `weights_only=True` for any use case where you don't have full control of the loaded file. Please open an issue on GitHub for any issues related to this experimental feature.
  self.data, self.slices = torch.load(self.processed_paths[0])
