STDOUT:
Results will be saved in /home/philip/projects/ltspice_examples_code_repo/Circuit-Completion-Using-GNNs/component_classification_with_link_prediction_head/evaluation/FEGIN/results/model_FEGIN_dataset_ltspice_demos
Command line input: python main.py --data ltspice_demos --representation component_pin_net --model FEGIN --layers 6 --hiddens 32 --batch_size 128 --lr 0.0001 --emb_size 128 --epochs 100 --save_appendix component_pin_net_L6_H32_BS128_LR0.0001_E128 --no_val
 is saved.
-----
ltspice_demos - FEGIN
Using 6 layers, 32 hidden units, h = 2
Loading component_pin_net representation dataset
ENTERED
Training FEGIN on component_pin_net representation
Train: 1565, Test: 383
##################ITERATION #0 ****************************************
 epoch: 0, train_loss: 1.4095, test_loss: 1.4019, test_f1: 0.0301
 epoch: 1, train_loss: 1.4042, test_loss: 1.3985, test_f1: 0.0301
 epoch: 2, train_loss: 1.4011, test_loss: 1.3947, test_f1: 0.0301
 epoch: 3, train_loss: 1.3979, test_loss: 1.3938, test_f1: 0.0301
 epoch: 4, train_loss: 1.3952, test_loss: 1.3927, test_f1: 0.0982
 epoch: 5, train_loss: 1.3921, test_loss: 1.3907, test_f1: 0.1613
 epoch: 6, train_loss: 1.3897, test_loss: 1.3870, test_f1: 0.1913
 epoch: 7, train_loss: 1.3863, test_loss: 1.3823, test_f1: 0.3226
 epoch: 8, train_loss: 1.3835, test_loss: 1.3795, test_f1: 0.3642
 epoch: 9, train_loss: 1.3786, test_loss: 1.3757, test_f1: 0.3297
 epoch: 10, train_loss: 1.3740, test_loss: 1.3718, test_f1: 0.3214
 epoch: 11, train_loss: 1.3689, test_loss: 1.3665, test_f1: 0.3137
 epoch: 12, train_loss: 1.3632, test_loss: 1.3608, test_f1: 0.2977
 epoch: 13, train_loss: 1.3562, test_loss: 1.3534, test_f1: 0.3103
 epoch: 14, train_loss: 1.3479, test_loss: 1.3473, test_f1: 0.3040
 epoch: 15, train_loss: 1.3406, test_loss: 1.3392, test_f1: 0.2756
 epoch: 16, train_loss: 1.3321, test_loss: 1.3310, test_f1: 0.2674
 epoch: 17, train_loss: 1.3237, test_loss: 1.3223, test_f1: 0.2586
 epoch: 18, train_loss: 1.3155, test_loss: 1.3134, test_f1: 0.2586
 epoch: 19, train_loss: 1.3061, test_loss: 1.3036, test_f1: 0.2586
 epoch: 20, train_loss: 1.2943, test_loss: 1.2984, test_f1: 0.2586
 epoch: 21, train_loss: 1.2880, test_loss: 1.2885, test_f1: 0.2540
 epoch: 22, train_loss: 1.2783, test_loss: 1.2807, test_f1: 0.2586
 epoch: 23, train_loss: 1.2676, test_loss: 1.2755, test_f1: 0.2718
 epoch: 24, train_loss: 1.2618, test_loss: 1.2705, test_f1: 0.2718
 epoch: 25, train_loss: 1.2556, test_loss: 1.2599, test_f1: 0.2718
 epoch: 26, train_loss: 1.2467, test_loss: 1.2557, test_f1: 0.2831
 epoch: 27, train_loss: 1.2347, test_loss: 1.2489, test_f1: 0.2759
 epoch: 28, train_loss: 1.2222, test_loss: 1.2445, test_f1: 0.2793
 epoch: 29, train_loss: 1.2212, test_loss: 1.2363, test_f1: 0.2828
 epoch: 30, train_loss: 1.2073, test_loss: 1.2306, test_f1: 0.3187
 epoch: 31, train_loss: 1.2064, test_loss: 1.2276, test_f1: 0.3067
 epoch: 32, train_loss: 1.1955, test_loss: 1.2223, test_f1: 0.3215
 epoch: 33, train_loss: 1.1871, test_loss: 1.2176, test_f1: 0.3243
 epoch: 34, train_loss: 1.1877, test_loss: 1.2146, test_f1: 0.3249
 epoch: 35, train_loss: 1.1746, test_loss: 1.2047, test_f1: 0.3222
 epoch: 36, train_loss: 1.1631, test_loss: 1.1993, test_f1: 0.3249
 epoch: 37, train_loss: 1.1591, test_loss: 1.1974, test_f1: 0.3253
 epoch: 38, train_loss: 1.1524, test_loss: 1.1904, test_f1: 0.3693
 epoch: 39, train_loss: 1.1484, test_loss: 1.1884, test_f1: 0.3938
 epoch: 40, train_loss: 1.1352, test_loss: 1.1807, test_f1: 0.4211
 epoch: 41, train_loss: 1.1422, test_loss: 1.1763, test_f1: 0.4127
 epoch: 42, train_loss: 1.1292, test_loss: 1.1735, test_f1: 0.4131
 epoch: 43, train_loss: 1.1140, test_loss: 1.1678, test_f1: 0.4146
 epoch: 44, train_loss: 1.1134, test_loss: 1.1634, test_f1: 0.4122
 epoch: 45, train_loss: 1.1028, test_loss: 1.1566, test_f1: 0.4143
 epoch: 46, train_loss: 1.1013, test_loss: 1.1545, test_f1: 0.4151
 epoch: 47, train_loss: 1.0942, test_loss: 1.1463, test_f1: 0.4146
 epoch: 48, train_loss: 1.0846, test_loss: 1.1421, test_f1: 0.4122
 epoch: 49, train_loss: 1.0794, test_loss: 1.1378, test_f1: 0.4219
 epoch: 50, train_loss: 1.0746, test_loss: 1.1359, test_f1: 0.4154
 epoch: 51, train_loss: 1.0647, test_loss: 1.1325, test_f1: 0.4290
 epoch: 52, train_loss: 1.0621, test_loss: 1.1305, test_f1: 0.4325
 epoch: 53, train_loss: 1.0602, test_loss: 1.1277, test_f1: 0.4280
 epoch: 54, train_loss: 1.0585, test_loss: 1.1232, test_f1: 0.4317
 epoch: 55, train_loss: 1.0596, test_loss: 1.1222, test_f1: 0.4290
 epoch: 56, train_loss: 1.0610, test_loss: 1.1206, test_f1: 0.4286
 epoch: 57, train_loss: 1.0558, test_loss: 1.1176, test_f1: 0.4290
 epoch: 58, train_loss: 1.0528, test_loss: 1.1142, test_f1: 0.4338
 epoch: 59, train_loss: 1.0430, test_loss: 1.1134, test_f1: 0.4292
 epoch: 60, train_loss: 1.0451, test_loss: 1.1107, test_f1: 0.4302
 epoch: 61, train_loss: 1.0377, test_loss: 1.1118, test_f1: 0.4319
 epoch: 62, train_loss: 1.0520, test_loss: 1.1095, test_f1: 0.4315
 epoch: 63, train_loss: 1.0363, test_loss: 1.1089, test_f1: 0.4371
 epoch: 64, train_loss: 1.0420, test_loss: 1.1082, test_f1: 0.4319
 epoch: 65, train_loss: 1.0348, test_loss: 1.1024, test_f1: 0.4307
 epoch: 66, train_loss: 1.0438, test_loss: 1.1038, test_f1: 0.4373
 epoch: 67, train_loss: 1.0315, test_loss: 1.1034, test_f1: 0.4319
 epoch: 68, train_loss: 1.0322, test_loss: 1.0997, test_f1: 0.4297
 epoch: 69, train_loss: 1.0335, test_loss: 1.1010, test_f1: 0.4357
 epoch: 70, train_loss: 1.0229, test_loss: 1.0988, test_f1: 0.4373
 epoch: 71, train_loss: 1.0298, test_loss: 1.0952, test_f1: 0.4389
 epoch: 72, train_loss: 1.0158, test_loss: 1.0957, test_f1: 0.4373
 epoch: 73, train_loss: 1.0235, test_loss: 1.0962, test_f1: 0.4391
 epoch: 74, train_loss: 1.0241, test_loss: 1.0932, test_f1: 0.4547
 epoch: 75, train_loss: 1.0189, test_loss: 1.0950, test_f1: 0.4637
 epoch: 76, train_loss: 1.0140, test_loss: 1.0938, test_f1: 0.4541
 epoch: 77, train_loss: 1.0130, test_loss: 1.0927, test_f1: 0.4518
 epoch: 78, train_loss: 1.0188, test_loss: 1.0916, test_f1: 0.4661
 epoch: 79, train_loss: 1.0148, test_loss: 1.0912, test_f1: 0.4661
 epoch: 80, train_loss: 1.0093, test_loss: 1.0887, test_f1: 0.4685
 epoch: 81, train_loss: 1.0017, test_loss: 1.0878, test_f1: 0.4661
 epoch: 82, train_loss: 1.0026, test_loss: 1.0865, test_f1: 0.4614
 epoch: 83, train_loss: 1.0062, test_loss: 1.0838, test_f1: 0.4661
 epoch: 84, train_loss: 1.0020, test_loss: 1.0804, test_f1: 0.4634
 epoch: 85, train_loss: 1.0040, test_loss: 1.0849, test_f1: 0.4681
 epoch: 86, train_loss: 0.9987, test_loss: 1.0812, test_f1: 0.4695
 epoch: 87, train_loss: 0.9925, test_loss: 1.0836, test_f1: 0.4750
 epoch: 88, train_loss: 0.9966, test_loss: 1.0803, test_f1: 0.4721
 epoch: 89, train_loss: 0.9836, test_loss: 1.0785, test_f1: 0.4711
 epoch: 90, train_loss: 0.9867, test_loss: 1.0768, test_f1: 0.4726
 epoch: 91, train_loss: 0.9898, test_loss: 1.0712, test_f1: 0.4726
 epoch: 92, train_loss: 0.9876, test_loss: 1.0721, test_f1: 0.4776
 epoch: 93, train_loss: 0.9826, test_loss: 1.0737, test_f1: 0.4827
 epoch: 94, train_loss: 0.9784, test_loss: 1.0724, test_f1: 0.4776
 epoch: 95, train_loss: 0.9825, test_loss: 1.0714, test_f1: 0.4776
 epoch: 96, train_loss: 0.9782, test_loss: 1.0704, test_f1: 0.4721
 epoch: 97, train_loss: 0.9734, test_loss: 1.0726, test_f1: 0.4745
 epoch: 98, train_loss: 0.9820, test_loss: 1.0688, test_f1: 0.4776
 epoch: 99, train_loss: 0.9754, test_loss: 1.0703, test_f1: 0.4721
##################ITERATION #1 ****************************************
 epoch: 0, train_loss: 1.3794, test_loss: 1.3825, test_f1: 0.2281
 epoch: 1, train_loss: 1.3682, test_loss: 1.3801, test_f1: 0.2281
 epoch: 2, train_loss: 1.3609, test_loss: 1.3741, test_f1: 0.2281
 epoch: 3, train_loss: 1.3549, test_loss: 1.3681, test_f1: 0.2281
 epoch: 4, train_loss: 1.3480, test_loss: 1.3682, test_f1: 0.2281
 epoch: 5, train_loss: 1.3394, test_loss: 1.3597, test_f1: 0.2583
 epoch: 6, train_loss: 1.3324, test_loss: 1.3502, test_f1: 0.2867
 epoch: 7, train_loss: 1.3236, test_loss: 1.3427, test_f1: 0.3447
 epoch: 8, train_loss: 1.3154, test_loss: 1.3364, test_f1: 0.3427
 epoch: 9, train_loss: 1.3061, test_loss: 1.3296, test_f1: 0.3479
 epoch: 10, train_loss: 1.2983, test_loss: 1.3226, test_f1: 0.3444
 epoch: 11, train_loss: 1.2862, test_loss: 1.3149, test_f1: 0.3444
 epoch: 12, train_loss: 1.2746, test_loss: 1.3072, test_f1: 0.3457
 epoch: 13, train_loss: 1.2638, test_loss: 1.2999, test_f1: 0.3490
 epoch: 14, train_loss: 1.2480, test_loss: 1.2909, test_f1: 0.3456
 epoch: 15, train_loss: 1.2386, test_loss: 1.2830, test_f1: 0.3473
 epoch: 16, train_loss: 1.2254, test_loss: 1.2750, test_f1: 0.3817
 epoch: 17, train_loss: 1.2208, test_loss: 1.2658, test_f1: 0.3819
 epoch: 18, train_loss: 1.2014, test_loss: 1.2600, test_f1: 0.3861
 epoch: 19, train_loss: 1.2011, test_loss: 1.2531, test_f1: 0.4014
 epoch: 20, train_loss: 1.1859, test_loss: 1.2454, test_f1: 0.4015
 epoch: 21, train_loss: 1.1756, test_loss: 1.2386, test_f1: 0.4088
 epoch: 22, train_loss: 1.1669, test_loss: 1.2336, test_f1: 0.4220
 epoch: 23, train_loss: 1.1634, test_loss: 1.2273, test_f1: 0.4220
 epoch: 24, train_loss: 1.1553, test_loss: 1.2228, test_f1: 0.4347
 epoch: 25, train_loss: 1.1490, test_loss: 1.2177, test_f1: 0.4313
 epoch: 26, train_loss: 1.1420, test_loss: 1.2136, test_f1: 0.4366
 epoch: 27, train_loss: 1.1357, test_loss: 1.2081, test_f1: 0.4398
 epoch: 28, train_loss: 1.1223, test_loss: 1.2031, test_f1: 0.4398
 epoch: 29, train_loss: 1.1158, test_loss: 1.1983, test_f1: 0.4389
 epoch: 30, train_loss: 1.1085, test_loss: 1.1912, test_f1: 0.4416
 epoch: 31, train_loss: 1.1078, test_loss: 1.1885, test_f1: 0.4416
 epoch: 32, train_loss: 1.1085, test_loss: 1.1830, test_f1: 0.4416
 epoch: 33, train_loss: 1.0972, test_loss: 1.1807, test_f1: 0.4393
 epoch: 34, train_loss: 1.0946, test_loss: 1.1746, test_f1: 0.4419
 epoch: 35, train_loss: 1.0827, test_loss: 1.1701, test_f1: 0.4374
 epoch: 36, train_loss: 1.0785, test_loss: 1.1670, test_f1: 0.4467
 epoch: 37, train_loss: 1.0744, test_loss: 1.1656, test_f1: 0.4422
 epoch: 38, train_loss: 1.0650, test_loss: 1.1599, test_f1: 0.4396
 epoch: 39, train_loss: 1.0602, test_loss: 1.1570, test_f1: 0.4389
 epoch: 40, train_loss: 1.0499, test_loss: 1.1540, test_f1: 0.4371
 epoch: 41, train_loss: 1.0507, test_loss: 1.1489, test_f1: 0.4399
 epoch: 42, train_loss: 1.0550, test_loss: 1.1446, test_f1: 0.4459
 epoch: 43, train_loss: 1.0443, test_loss: 1.1421, test_f1: 0.4449
 epoch: 44, train_loss: 1.0420, test_loss: 1.1393, test_f1: 0.4477
 epoch: 45, train_loss: 1.0356, test_loss: 1.1402, test_f1: 0.4408
 epoch: 46, train_loss: 1.0361, test_loss: 1.1351, test_f1: 0.4356
 epoch: 47, train_loss: 1.0266, test_loss: 1.1327, test_f1: 0.4466
 epoch: 48, train_loss: 1.0270, test_loss: 1.1288, test_f1: 0.4519
 epoch: 49, train_loss: 1.0249, test_loss: 1.1267, test_f1: 0.4508
 epoch: 50, train_loss: 1.0209, test_loss: 1.1246, test_f1: 0.4466
 epoch: 51, train_loss: 1.0192, test_loss: 1.1256, test_f1: 0.4456
 epoch: 52, train_loss: 1.0182, test_loss: 1.1232, test_f1: 0.4438
 epoch: 53, train_loss: 1.0147, test_loss: 1.1265, test_f1: 0.4456
 epoch: 54, train_loss: 1.0151, test_loss: 1.1232, test_f1: 0.4461
 epoch: 55, train_loss: 1.0095, test_loss: 1.1216, test_f1: 0.4452
 epoch: 56, train_loss: 1.0096, test_loss: 1.1243, test_f1: 0.4452
 epoch: 57, train_loss: 1.0071, test_loss: 1.1215, test_f1: 0.4466
 epoch: 58, train_loss: 1.0008, test_loss: 1.1173, test_f1: 0.4438
 epoch: 59, train_loss: 1.0108, test_loss: 1.1180, test_f1: 0.4466
 epoch: 60, train_loss: 1.0032, test_loss: 1.1166, test_f1: 0.4513
 epoch: 61, train_loss: 1.0042, test_loss: 1.1192, test_f1: 0.4461
 epoch: 62, train_loss: 1.0040, test_loss: 1.1158, test_f1: 0.4466
 epoch: 63, train_loss: 0.9901, test_loss: 1.1140, test_f1: 0.4489
 epoch: 64, train_loss: 1.0003, test_loss: 1.1121, test_f1: 0.4415
 epoch: 65, train_loss: 0.9943, test_loss: 1.1094, test_f1: 0.4457
 epoch: 66, train_loss: 0.9887, test_loss: 1.1106, test_f1: 0.4443
 epoch: 67, train_loss: 0.9890, test_loss: 1.1131, test_f1: 0.4443
 epoch: 68, train_loss: 0.9949, test_loss: 1.1137, test_f1: 0.4484
 epoch: 69, train_loss: 0.9884, test_loss: 1.1109, test_f1: 0.4484
 epoch: 70, train_loss: 0.9894, test_loss: 1.1100, test_f1: 0.4484
 epoch: 71, train_loss: 0.9890, test_loss: 1.1091, test_f1: 0.4438
 epoch: 72, train_loss: 0.9888, test_loss: 1.1063, test_f1: 0.4520
 epoch: 73, train_loss: 0.9792, test_loss: 1.1071, test_f1: 0.4513
 epoch: 74, train_loss: 0.9833, test_loss: 1.1085, test_f1: 0.4489
 epoch: 75, train_loss: 0.9867, test_loss: 1.1094, test_f1: 0.4453
 epoch: 76, train_loss: 0.9832, test_loss: 1.1072, test_f1: 0.4443
 epoch: 77, train_loss: 0.9776, test_loss: 1.1069, test_f1: 0.4463
 epoch: 78, train_loss: 0.9807, test_loss: 1.1048, test_f1: 0.4496
 epoch: 79, train_loss: 0.9790, test_loss: 1.1037, test_f1: 0.4495
 epoch: 80, train_loss: 0.9745, test_loss: 1.1067, test_f1: 0.4443
 epoch: 81, train_loss: 0.9792, test_loss: 1.1080, test_f1: 0.4445
 epoch: 82, train_loss: 0.9759, test_loss: 1.1041, test_f1: 0.4449
 epoch: 83, train_loss: 0.9760, test_loss: 1.1062, test_f1: 0.4439
 epoch: 84, train_loss: 0.9724, test_loss: 1.1062, test_f1: 0.4445
 epoch: 85, train_loss: 0.9727, test_loss: 1.1105, test_f1: 0.4458
 epoch: 86, train_loss: 0.9770, test_loss: 1.1101, test_f1: 0.4493
 epoch: 87, train_loss: 0.9730, test_loss: 1.1056, test_f1: 0.4493
 epoch: 88, train_loss: 0.9676, test_loss: 1.1011, test_f1: 0.4602
 epoch: 89, train_loss: 0.9584, test_loss: 1.1033, test_f1: 0.4422
 epoch: 90, train_loss: 0.9692, test_loss: 1.1065, test_f1: 0.4478
 epoch: 91, train_loss: 0.9712, test_loss: 1.0989, test_f1: 0.4483
 epoch: 92, train_loss: 0.9645, test_loss: 1.1007, test_f1: 0.4670
 epoch: 93, train_loss: 0.9624, test_loss: 1.1013, test_f1: 0.4538
 epoch: 94, train_loss: 0.9625, test_loss: 1.1041, test_f1: 0.4602
 epoch: 95, train_loss: 0.9643, test_loss: 1.1043, test_f1: 0.4597
 epoch: 96, train_loss: 0.9661, test_loss: 1.0998, test_f1: 0.4591
 epoch: 97, train_loss: 0.9534, test_loss: 1.1010, test_f1: 0.4647
 epoch: 98, train_loss: 0.9656, test_loss: 1.0981, test_f1: 0.4675
 epoch: 99, train_loss: 0.9576, test_loss: 1.0994, test_f1: 0.4698
##################ITERATION #2 ****************************************
 epoch: 0, train_loss: 1.3576, test_loss: 1.3680, test_f1: 0.2281
 epoch: 1, train_loss: 1.3394, test_loss: 1.3720, test_f1: 0.2281
 epoch: 2, train_loss: 1.3300, test_loss: 1.3718, test_f1: 0.2281
 epoch: 3, train_loss: 1.3168, test_loss: 1.3628, test_f1: 0.2285
 epoch: 4, train_loss: 1.3062, test_loss: 1.3490, test_f1: 0.2642
 epoch: 5, train_loss: 1.2930, test_loss: 1.3369, test_f1: 0.3073
 epoch: 6, train_loss: 1.2794, test_loss: 1.3107, test_f1: 0.3118
 epoch: 7, train_loss: 1.2680, test_loss: 1.2917, test_f1: 0.3075
 epoch: 8, train_loss: 1.2526, test_loss: 1.2798, test_f1: 0.3030
 epoch: 9, train_loss: 1.2394, test_loss: 1.2700, test_f1: 0.3075
 epoch: 10, train_loss: 1.2238, test_loss: 1.2612, test_f1: 0.3630
 epoch: 11, train_loss: 1.2134, test_loss: 1.2506, test_f1: 0.3630
 epoch: 12, train_loss: 1.1904, test_loss: 1.2420, test_f1: 0.3755
 epoch: 13, train_loss: 1.1837, test_loss: 1.2318, test_f1: 0.4010
 epoch: 14, train_loss: 1.1752, test_loss: 1.2242, test_f1: 0.4083
 epoch: 15, train_loss: 1.1642, test_loss: 1.2182, test_f1: 0.4108
 epoch: 16, train_loss: 1.1479, test_loss: 1.2129, test_f1: 0.4238
 epoch: 17, train_loss: 1.1417, test_loss: 1.2075, test_f1: 0.4238
 epoch: 18, train_loss: 1.1344, test_loss: 1.2005, test_f1: 0.4211
 epoch: 19, train_loss: 1.1266, test_loss: 1.1936, test_f1: 0.4238
 epoch: 20, train_loss: 1.1228, test_loss: 1.1872, test_f1: 0.4242
 epoch: 21, train_loss: 1.1162, test_loss: 1.1832, test_f1: 0.4208
 epoch: 22, train_loss: 1.1092, test_loss: 1.1768, test_f1: 0.4147
 epoch: 23, train_loss: 1.0989, test_loss: 1.1731, test_f1: 0.4204
 epoch: 24, train_loss: 1.0926, test_loss: 1.1720, test_f1: 0.4275
 epoch: 25, train_loss: 1.0884, test_loss: 1.1657, test_f1: 0.4225
 epoch: 26, train_loss: 1.0883, test_loss: 1.1621, test_f1: 0.4200
 epoch: 27, train_loss: 1.0773, test_loss: 1.1586, test_f1: 0.4225
 epoch: 28, train_loss: 1.0708, test_loss: 1.1513, test_f1: 0.4217
 epoch: 29, train_loss: 1.0658, test_loss: 1.1485, test_f1: 0.4225
 epoch: 30, train_loss: 1.0688, test_loss: 1.1509, test_f1: 0.4125
 epoch: 31, train_loss: 1.0607, test_loss: 1.1421, test_f1: 0.4200
 epoch: 32, train_loss: 1.0577, test_loss: 1.1446, test_f1: 0.4193
 epoch: 33, train_loss: 1.0548, test_loss: 1.1386, test_f1: 0.4217
 epoch: 34, train_loss: 1.0494, test_loss: 1.1351, test_f1: 0.4221
 epoch: 35, train_loss: 1.0481, test_loss: 1.1341, test_f1: 0.4196
 epoch: 36, train_loss: 1.0397, test_loss: 1.1300, test_f1: 0.4226
 epoch: 37, train_loss: 1.0454, test_loss: 1.1293, test_f1: 0.4196
 epoch: 38, train_loss: 1.0308, test_loss: 1.1319, test_f1: 0.4193
 epoch: 39, train_loss: 1.0409, test_loss: 1.1223, test_f1: 0.4127
 epoch: 40, train_loss: 1.0306, test_loss: 1.1308, test_f1: 0.4099
 epoch: 41, train_loss: 1.0261, test_loss: 1.1246, test_f1: 0.4196
 epoch: 42, train_loss: 1.0251, test_loss: 1.1232, test_f1: 0.4221
 epoch: 43, train_loss: 1.0269, test_loss: 1.1222, test_f1: 0.4190
 epoch: 44, train_loss: 1.0154, test_loss: 1.1172, test_f1: 0.4221
 epoch: 45, train_loss: 1.0236, test_loss: 1.1143, test_f1: 0.4125
 epoch: 46, train_loss: 1.0182, test_loss: 1.1132, test_f1: 0.4193
 epoch: 47, train_loss: 1.0112, test_loss: 1.1096, test_f1: 0.4217
 epoch: 48, train_loss: 1.0100, test_loss: 1.1084, test_f1: 0.4217
 epoch: 49, train_loss: 1.0071, test_loss: 1.1043, test_f1: 0.4146
 epoch: 50, train_loss: 1.0074, test_loss: 1.1056, test_f1: 0.4193
 epoch: 51, train_loss: 1.0067, test_loss: 1.1053, test_f1: 0.4237
 epoch: 52, train_loss: 1.0057, test_loss: 1.1059, test_f1: 0.4233
 epoch: 53, train_loss: 1.0031, test_loss: 1.1040, test_f1: 0.4199
 epoch: 54, train_loss: 0.9993, test_loss: 1.1059, test_f1: 0.4154
 epoch: 55, train_loss: 1.0005, test_loss: 1.1062, test_f1: 0.4233
 epoch: 56, train_loss: 0.9967, test_loss: 1.1066, test_f1: 0.4208
 epoch: 57, train_loss: 0.9964, test_loss: 1.1070, test_f1: 0.4212
 epoch: 58, train_loss: 0.9995, test_loss: 1.1032, test_f1: 0.4199
 epoch: 59, train_loss: 0.9940, test_loss: 1.1047, test_f1: 0.4223
 epoch: 60, train_loss: 0.9936, test_loss: 1.1033, test_f1: 0.4217
 epoch: 61, train_loss: 0.9973, test_loss: 1.0977, test_f1: 0.4223
 epoch: 62, train_loss: 0.9899, test_loss: 1.1006, test_f1: 0.4233
 epoch: 63, train_loss: 0.9849, test_loss: 1.0996, test_f1: 0.4217
 epoch: 64, train_loss: 0.9866, test_loss: 1.1015, test_f1: 0.4222
 epoch: 65, train_loss: 0.9893, test_loss: 1.0959, test_f1: 0.4242
 epoch: 66, train_loss: 0.9837, test_loss: 1.0949, test_f1: 0.4222
 epoch: 67, train_loss: 0.9852, test_loss: 1.1005, test_f1: 0.4245
 epoch: 68, train_loss: 0.9817, test_loss: 1.0988, test_f1: 0.4245
 epoch: 69, train_loss: 0.9865, test_loss: 1.1002, test_f1: 0.4217
 epoch: 70, train_loss: 0.9882, test_loss: 1.1014, test_f1: 0.4242
 epoch: 71, train_loss: 0.9835, test_loss: 1.1030, test_f1: 0.4245
 epoch: 72, train_loss: 0.9835, test_loss: 1.1034, test_f1: 0.4247
 epoch: 73, train_loss: 0.9819, test_loss: 1.0956, test_f1: 0.4242
 epoch: 74, train_loss: 0.9857, test_loss: 1.0912, test_f1: 0.4257
 epoch: 75, train_loss: 0.9837, test_loss: 1.0917, test_f1: 0.4235
 epoch: 76, train_loss: 0.9771, test_loss: 1.0952, test_f1: 0.4233
 epoch: 77, train_loss: 0.9801, test_loss: 1.0942, test_f1: 0.4245
 epoch: 78, train_loss: 0.9775, test_loss: 1.0917, test_f1: 0.4242
 epoch: 79, train_loss: 0.9815, test_loss: 1.0875, test_f1: 0.4235
 epoch: 80, train_loss: 0.9789, test_loss: 1.0943, test_f1: 0.4275
 epoch: 81, train_loss: 0.9681, test_loss: 1.0975, test_f1: 0.4250
 epoch: 82, train_loss: 0.9759, test_loss: 1.0934, test_f1: 0.4270
 epoch: 83, train_loss: 0.9736, test_loss: 1.0938, test_f1: 0.4275
 epoch: 84, train_loss: 0.9718, test_loss: 1.0910, test_f1: 0.4300
 epoch: 85, train_loss: 0.9689, test_loss: 1.0852, test_f1: 0.4290
 epoch: 86, train_loss: 0.9655, test_loss: 1.0839, test_f1: 0.4262
 epoch: 87, train_loss: 0.9672, test_loss: 1.0839, test_f1: 0.4235
 epoch: 88, train_loss: 0.9683, test_loss: 1.0912, test_f1: 0.4275
 epoch: 89, train_loss: 0.9591, test_loss: 1.0882, test_f1: 0.4290
 epoch: 90, train_loss: 0.9653, test_loss: 1.0858, test_f1: 0.4235
 epoch: 91, train_loss: 0.9615, test_loss: 1.0891, test_f1: 0.4290
 epoch: 92, train_loss: 0.9744, test_loss: 1.0896, test_f1: 0.4257
 epoch: 93, train_loss: 0.9657, test_loss: 1.0885, test_f1: 0.4300
 epoch: 94, train_loss: 0.9623, test_loss: 1.0894, test_f1: 0.4300
 epoch: 95, train_loss: 0.9632, test_loss: 1.0904, test_f1: 0.4235
 epoch: 96, train_loss: 0.9592, test_loss: 1.0953, test_f1: 0.4275
 epoch: 97, train_loss: 0.9639, test_loss: 1.0905, test_f1: 0.4295
 epoch: 98, train_loss: 0.9613, test_loss: 1.0872, test_f1: 0.4275
 epoch: 99, train_loss: 0.9565, test_loss: 1.0875, test_f1: 0.4270
##################ITERATION #3 ****************************************
 epoch: 0, train_loss: 1.3482, test_loss: 1.3716, test_f1: 0.2281
 epoch: 1, train_loss: 1.3187, test_loss: 1.3703, test_f1: 0.2281
 epoch: 2, train_loss: 1.2997, test_loss: 1.3574, test_f1: 0.2281
 epoch: 3, train_loss: 1.2844, test_loss: 1.3424, test_f1: 0.2281
 epoch: 4, train_loss: 1.2639, test_loss: 1.3143, test_f1: 0.2842
 epoch: 5, train_loss: 1.2474, test_loss: 1.2910, test_f1: 0.2982
 epoch: 6, train_loss: 1.2348, test_loss: 1.2716, test_f1: 0.2938
 epoch: 7, train_loss: 1.2223, test_loss: 1.2594, test_f1: 0.3381
 epoch: 8, train_loss: 1.2074, test_loss: 1.2477, test_f1: 0.3556
 epoch: 9, train_loss: 1.1906, test_loss: 1.2359, test_f1: 0.3587
 epoch: 10, train_loss: 1.1811, test_loss: 1.2266, test_f1: 0.3619
 epoch: 11, train_loss: 1.1758, test_loss: 1.2188, test_f1: 0.3707
 epoch: 12, train_loss: 1.1631, test_loss: 1.2094, test_f1: 0.3707
 epoch: 13, train_loss: 1.1579, test_loss: 1.2035, test_f1: 0.3700
 epoch: 14, train_loss: 1.1444, test_loss: 1.1941, test_f1: 0.3782
 epoch: 15, train_loss: 1.1287, test_loss: 1.1853, test_f1: 0.3731
 epoch: 16, train_loss: 1.1313, test_loss: 1.1791, test_f1: 0.3827
 epoch: 17, train_loss: 1.1218, test_loss: 1.1727, test_f1: 0.4031
 epoch: 18, train_loss: 1.1148, test_loss: 1.1656, test_f1: 0.4321
 epoch: 19, train_loss: 1.1014, test_loss: 1.1594, test_f1: 0.4327
 epoch: 20, train_loss: 1.1034, test_loss: 1.1535, test_f1: 0.4321
 epoch: 21, train_loss: 1.1016, test_loss: 1.1497, test_f1: 0.4321
 epoch: 22, train_loss: 1.0842, test_loss: 1.1455, test_f1: 0.4321
 epoch: 23, train_loss: 1.0784, test_loss: 1.1411, test_f1: 0.4314
 epoch: 24, train_loss: 1.0741, test_loss: 1.1378, test_f1: 0.4309
 epoch: 25, train_loss: 1.0745, test_loss: 1.1333, test_f1: 0.4280
 epoch: 26, train_loss: 1.0671, test_loss: 1.1327, test_f1: 0.4300
 epoch: 27, train_loss: 1.0638, test_loss: 1.1265, test_f1: 0.4340
 epoch: 28, train_loss: 1.0574, test_loss: 1.1215, test_f1: 0.4346
 epoch: 29, train_loss: 1.0470, test_loss: 1.1186, test_f1: 0.4297
 epoch: 30, train_loss: 1.0472, test_loss: 1.1169, test_f1: 0.4300
 epoch: 31, train_loss: 1.0471, test_loss: 1.1126, test_f1: 0.4311
 epoch: 32, train_loss: 1.0342, test_loss: 1.1052, test_f1: 0.4336
 epoch: 33, train_loss: 1.0363, test_loss: 1.1072, test_f1: 0.4340
 epoch: 34, train_loss: 1.0370, test_loss: 1.1056, test_f1: 0.4329
 epoch: 35, train_loss: 1.0347, test_loss: 1.1058, test_f1: 0.4305
 epoch: 36, train_loss: 1.0226, test_loss: 1.1003, test_f1: 0.4275
 epoch: 37, train_loss: 1.0206, test_loss: 1.0970, test_f1: 0.4305
 epoch: 38, train_loss: 1.0157, test_loss: 1.0932, test_f1: 0.4316
 epoch: 39, train_loss: 1.0214, test_loss: 1.0947, test_f1: 0.4311
 epoch: 40, train_loss: 1.0132, test_loss: 1.0918, test_f1: 0.4316
 epoch: 41, train_loss: 1.0088, test_loss: 1.0904, test_f1: 0.4311
 epoch: 42, train_loss: 1.0112, test_loss: 1.0883, test_f1: 0.4340
 epoch: 43, train_loss: 1.0023, test_loss: 1.0830, test_f1: 0.4316
 epoch: 44, train_loss: 0.9984, test_loss: 1.0882, test_f1: 0.4316
 epoch: 45, train_loss: 1.0003, test_loss: 1.0870, test_f1: 0.4316
 epoch: 46, train_loss: 1.0005, test_loss: 1.0857, test_f1: 0.4340
 epoch: 47, train_loss: 1.0013, test_loss: 1.0827, test_f1: 0.4311
 epoch: 48, train_loss: 0.9864, test_loss: 1.0839, test_f1: 0.4280
 epoch: 49, train_loss: 0.9964, test_loss: 1.0791, test_f1: 0.4267
 epoch: 50, train_loss: 0.9890, test_loss: 1.0800, test_f1: 0.4316
 epoch: 51, train_loss: 0.9831, test_loss: 1.0819, test_f1: 0.4316
 epoch: 52, train_loss: 0.9907, test_loss: 1.0858, test_f1: 0.4329
 epoch: 53, train_loss: 0.9786, test_loss: 1.0796, test_f1: 0.4299
 epoch: 54, train_loss: 0.9888, test_loss: 1.0834, test_f1: 0.4293
 epoch: 55, train_loss: 0.9890, test_loss: 1.0788, test_f1: 0.4293
 epoch: 56, train_loss: 0.9892, test_loss: 1.0770, test_f1: 0.4322
 epoch: 57, train_loss: 0.9834, test_loss: 1.0782, test_f1: 0.4348
 epoch: 58, train_loss: 0.9834, test_loss: 1.0860, test_f1: 0.4316
 epoch: 59, train_loss: 0.9799, test_loss: 1.0788, test_f1: 0.4316
 epoch: 60, train_loss: 0.9796, test_loss: 1.0733, test_f1: 0.4318
 epoch: 61, train_loss: 0.9811, test_loss: 1.0789, test_f1: 0.4316
 epoch: 62, train_loss: 0.9742, test_loss: 1.0782, test_f1: 0.4293
 epoch: 63, train_loss: 0.9710, test_loss: 1.0770, test_f1: 0.4316
 epoch: 64, train_loss: 0.9796, test_loss: 1.0732, test_f1: 0.4318
 epoch: 65, train_loss: 0.9714, test_loss: 1.0714, test_f1: 0.4267
 epoch: 66, train_loss: 0.9747, test_loss: 1.0770, test_f1: 0.4293
 epoch: 67, train_loss: 0.9742, test_loss: 1.0715, test_f1: 0.4293
 epoch: 68, train_loss: 0.9752, test_loss: 1.0713, test_f1: 0.4316
 epoch: 69, train_loss: 0.9644, test_loss: 1.0732, test_f1: 0.4329
 epoch: 70, train_loss: 0.9676, test_loss: 1.0698, test_f1: 0.4329
 epoch: 71, train_loss: 0.9653, test_loss: 1.0710, test_f1: 0.4329
 epoch: 72, train_loss: 0.9691, test_loss: 1.0656, test_f1: 0.4299
 epoch: 73, train_loss: 0.9663, test_loss: 1.0696, test_f1: 0.4329
 epoch: 74, train_loss: 0.9695, test_loss: 1.0731, test_f1: 0.4295
 epoch: 75, train_loss: 0.9680, test_loss: 1.0740, test_f1: 0.4294
 epoch: 76, train_loss: 0.9687, test_loss: 1.0785, test_f1: 0.4316
 epoch: 77, train_loss: 0.9728, test_loss: 1.0723, test_f1: 0.4299
 epoch: 78, train_loss: 0.9607, test_loss: 1.0718, test_f1: 0.4290
 epoch: 79, train_loss: 0.9581, test_loss: 1.0711, test_f1: 0.4290
 epoch: 80, train_loss: 0.9608, test_loss: 1.0696, test_f1: 0.4299
 epoch: 81, train_loss: 0.9672, test_loss: 1.0693, test_f1: 0.4299
 epoch: 82, train_loss: 0.9546, test_loss: 1.0704, test_f1: 0.4329
 epoch: 83, train_loss: 0.9593, test_loss: 1.0756, test_f1: 0.4299
 epoch: 84, train_loss: 0.9666, test_loss: 1.0750, test_f1: 0.4329
 epoch: 85, train_loss: 0.9692, test_loss: 1.0702, test_f1: 0.4318
 epoch: 86, train_loss: 0.9653, test_loss: 1.0830, test_f1: 0.4346
 epoch: 87, train_loss: 0.9564, test_loss: 1.0712, test_f1: 0.4275
 epoch: 88, train_loss: 0.9593, test_loss: 1.0630, test_f1: 0.4300
 epoch: 89, train_loss: 0.9623, test_loss: 1.0650, test_f1: 0.4335
 epoch: 90, train_loss: 0.9522, test_loss: 1.0699, test_f1: 0.4335
 epoch: 91, train_loss: 0.9589, test_loss: 1.0655, test_f1: 0.4335
 epoch: 92, train_loss: 0.9574, test_loss: 1.0684, test_f1: 0.4293
 epoch: 93, train_loss: 0.9539, test_loss: 1.0724, test_f1: 0.4322
 epoch: 94, train_loss: 0.9494, test_loss: 1.0677, test_f1: 0.4306
 epoch: 95, train_loss: 0.9583, test_loss: 1.0606, test_f1: 0.4311
 epoch: 96, train_loss: 0.9536, test_loss: 1.0627, test_f1: 0.4335
 epoch: 97, train_loss: 0.9515, test_loss: 1.0583, test_f1: 0.4312
 epoch: 98, train_loss: 0.9592, test_loss: 1.0598, test_f1: 0.4329
 epoch: 99, train_loss: 0.9508, test_loss: 1.0654, test_f1: 0.4329
##################ITERATION #4 ****************************************
 epoch: 0, train_loss: 1.2933, test_loss: 1.3284, test_f1: 0.2281
 epoch: 1, train_loss: 1.2636, test_loss: 1.3220, test_f1: 0.2281
 epoch: 2, train_loss: 1.2525, test_loss: 1.3141, test_f1: 0.2281
 epoch: 3, train_loss: 1.2361, test_loss: 1.3043, test_f1: 0.2281
 epoch: 4, train_loss: 1.2290, test_loss: 1.3022, test_f1: 0.2281
 epoch: 5, train_loss: 1.2119, test_loss: 1.2855, test_f1: 0.2281
 epoch: 6, train_loss: 1.2057, test_loss: 1.2642, test_f1: 0.2281
 epoch: 7, train_loss: 1.1963, test_loss: 1.2495, test_f1: 0.2281
 epoch: 8, train_loss: 1.1844, test_loss: 1.2375, test_f1: 0.2732
 epoch: 9, train_loss: 1.1746, test_loss: 1.2301, test_f1: 0.2881
 epoch: 10, train_loss: 1.1691, test_loss: 1.2238, test_f1: 0.3026
 epoch: 11, train_loss: 1.1553, test_loss: 1.2163, test_f1: 0.3154
 epoch: 12, train_loss: 1.1501, test_loss: 1.2154, test_f1: 0.3585
 epoch: 13, train_loss: 1.1499, test_loss: 1.2121, test_f1: 0.4117
 epoch: 14, train_loss: 1.1317, test_loss: 1.2032, test_f1: 0.4275
 epoch: 15, train_loss: 1.1261, test_loss: 1.2016, test_f1: 0.4251
 epoch: 16, train_loss: 1.1226, test_loss: 1.1948, test_f1: 0.4250
 epoch: 17, train_loss: 1.1141, test_loss: 1.1894, test_f1: 0.4234
 epoch: 18, train_loss: 1.1088, test_loss: 1.1852, test_f1: 0.4208
 epoch: 19, train_loss: 1.1059, test_loss: 1.1768, test_f1: 0.4245
 epoch: 20, train_loss: 1.1028, test_loss: 1.1743, test_f1: 0.4211
 epoch: 21, train_loss: 1.0906, test_loss: 1.1670, test_f1: 0.4169
 epoch: 22, train_loss: 1.0826, test_loss: 1.1658, test_f1: 0.4168
 epoch: 23, train_loss: 1.0779, test_loss: 1.1585, test_f1: 0.4126
 epoch: 24, train_loss: 1.0826, test_loss: 1.1573, test_f1: 0.4191
 epoch: 25, train_loss: 1.0671, test_loss: 1.1571, test_f1: 0.4149
 epoch: 26, train_loss: 1.0611, test_loss: 1.1464, test_f1: 0.4156
 epoch: 27, train_loss: 1.0610, test_loss: 1.1457, test_f1: 0.4176
 epoch: 28, train_loss: 1.0544, test_loss: 1.1429, test_f1: 0.4244
 epoch: 29, train_loss: 1.0488, test_loss: 1.1414, test_f1: 0.4254
 epoch: 30, train_loss: 1.0487, test_loss: 1.1369, test_f1: 0.4261
 epoch: 31, train_loss: 1.0391, test_loss: 1.1338, test_f1: 0.4262
 epoch: 32, train_loss: 1.0358, test_loss: 1.1368, test_f1: 0.4214
 epoch: 33, train_loss: 1.0395, test_loss: 1.1387, test_f1: 0.4215
 epoch: 34, train_loss: 1.0356, test_loss: 1.1554, test_f1: 0.4289
 epoch: 35, train_loss: 1.0328, test_loss: 1.1380, test_f1: 0.4243
 epoch: 36, train_loss: 1.0236, test_loss: 1.1540, test_f1: 0.4261
 epoch: 37, train_loss: 1.0223, test_loss: 1.1376, test_f1: 0.4257
 epoch: 38, train_loss: 1.0287, test_loss: 1.1351, test_f1: 0.4305
 epoch: 39, train_loss: 1.0229, test_loss: 1.1298, test_f1: 0.4261
 epoch: 40, train_loss: 1.0164, test_loss: 1.1293, test_f1: 0.4202
 epoch: 41, train_loss: 1.0162, test_loss: 1.1270, test_f1: 0.4295
 epoch: 42, train_loss: 1.0177, test_loss: 1.1143, test_f1: 0.4291
 epoch: 43, train_loss: 1.0060, test_loss: 1.1262, test_f1: 0.4245
 epoch: 44, train_loss: 1.0111, test_loss: 1.1184, test_f1: 0.4278
 epoch: 45, train_loss: 1.0006, test_loss: 1.1074, test_f1: 0.4270
 epoch: 46, train_loss: 1.0116, test_loss: 1.1146, test_f1: 0.4243
 epoch: 47, train_loss: 0.9960, test_loss: 1.1274, test_f1: 0.4265
 epoch: 48, train_loss: 0.9986, test_loss: 1.1221, test_f1: 0.4261
 epoch: 49, train_loss: 0.9952, test_loss: 1.1169, test_f1: 0.4251
 epoch: 50, train_loss: 0.9949, test_loss: 1.1128, test_f1: 0.4294
 epoch: 51, train_loss: 0.9949, test_loss: 1.1103, test_f1: 0.4278
 epoch: 52, train_loss: 0.9892, test_loss: 1.1123, test_f1: 0.4296
 epoch: 53, train_loss: 0.9813, test_loss: 1.1078, test_f1: 0.4233
 epoch: 54, train_loss: 0.9925, test_loss: 1.1057, test_f1: 0.4293
 epoch: 55, train_loss: 0.9899, test_loss: 1.1075, test_f1: 0.4340
 epoch: 56, train_loss: 0.9851, test_loss: 1.1018, test_f1: 0.4340
 epoch: 57, train_loss: 0.9908, test_loss: 1.0997, test_f1: 0.4293
 epoch: 58, train_loss: 0.9809, test_loss: 1.1015, test_f1: 0.4294
 epoch: 59, train_loss: 0.9847, test_loss: 1.1124, test_f1: 0.4340
 epoch: 60, train_loss: 0.9868, test_loss: 1.1003, test_f1: 0.4340
 epoch: 61, train_loss: 0.9794, test_loss: 1.0999, test_f1: 0.4294
 epoch: 62, train_loss: 0.9901, test_loss: 1.1039, test_f1: 0.4260
 epoch: 63, train_loss: 0.9782, test_loss: 1.1025, test_f1: 0.4237
 epoch: 64, train_loss: 0.9784, test_loss: 1.1045, test_f1: 0.4405
 epoch: 65, train_loss: 0.9745, test_loss: 1.1094, test_f1: 0.4399
 epoch: 66, train_loss: 0.9755, test_loss: 1.1103, test_f1: 0.4405
 epoch: 67, train_loss: 0.9727, test_loss: 1.0993, test_f1: 0.4364
 epoch: 68, train_loss: 0.9720, test_loss: 1.0997, test_f1: 0.4275
 epoch: 69, train_loss: 0.9734, test_loss: 1.1051, test_f1: 0.4355
 epoch: 70, train_loss: 0.9734, test_loss: 1.1035, test_f1: 0.4340
 epoch: 71, train_loss: 0.9663, test_loss: 1.1031, test_f1: 0.4293
 epoch: 72, train_loss: 0.9720, test_loss: 1.1101, test_f1: 0.4374
 epoch: 73, train_loss: 0.9721, test_loss: 1.0956, test_f1: 0.4284
 epoch: 74, train_loss: 0.9648, test_loss: 1.1057, test_f1: 0.4334
 epoch: 75, train_loss: 0.9745, test_loss: 1.1076, test_f1: 0.4169
 epoch: 76, train_loss: 0.9715, test_loss: 1.1109, test_f1: 0.4355
 epoch: 77, train_loss: 0.9677, test_loss: 1.1061, test_f1: 0.4308
 epoch: 78, train_loss: 0.9733, test_loss: 1.1049, test_f1: 0.4331
 epoch: 79, train_loss: 0.9702, test_loss: 1.0990, test_f1: 0.4361
 epoch: 80, train_loss: 0.9651, test_loss: 1.1027, test_f1: 0.4361
 epoch: 81, train_loss: 0.9616, test_loss: 1.1142, test_f1: 0.4332
 epoch: 82, train_loss: 0.9689, test_loss: 1.1092, test_f1: 0.4308
 epoch: 83, train_loss: 0.9685, test_loss: 1.1009, test_f1: 0.4302
 epoch: 84, train_loss: 0.9561, test_loss: 1.1118, test_f1: 0.4256
 epoch: 85, train_loss: 0.9691, test_loss: 1.1260, test_f1: 0.4302
 epoch: 86, train_loss: 0.9636, test_loss: 1.1100, test_f1: 0.4229
 epoch: 87, train_loss: 0.9590, test_loss: 1.1071, test_f1: 0.4284
 epoch: 88, train_loss: 0.9642, test_loss: 1.1107, test_f1: 0.4279
 epoch: 89, train_loss: 0.9522, test_loss: 1.1071, test_f1: 0.4256
 epoch: 90, train_loss: 0.9643, test_loss: 1.1043, test_f1: 0.4261
 epoch: 91, train_loss: 0.9560, test_loss: 1.1076, test_f1: 0.4308
 epoch: 92, train_loss: 0.9582, test_loss: 1.1041, test_f1: 0.4355
 epoch: 93, train_loss: 0.9506, test_loss: 1.0950, test_f1: 0.4238
 epoch: 94, train_loss: 0.9597, test_loss: 1.1055, test_f1: 0.4266
 epoch: 95, train_loss: 0.9529, test_loss: 1.1092, test_f1: 0.4308
 epoch: 96, train_loss: 0.9529, test_loss: 1.1080, test_f1: 0.4256
 epoch: 97, train_loss: 0.9617, test_loss: 1.1105, test_f1: 0.4279
 epoch: 98, train_loss: 0.9566, test_loss: 1.1001, test_f1: 0.4261
 epoch: 99, train_loss: 0.9531, test_loss: 1.1029, test_f1: 0.4266
##################ITERATION #5 ****************************************
 epoch: 0, train_loss: 1.2847, test_loss: 1.3210, test_f1: 0.2281
 epoch: 1, train_loss: 1.2471, test_loss: 1.3122, test_f1: 0.2281
 epoch: 2, train_loss: 1.2365, test_loss: 1.2962, test_f1: 0.2281
 epoch: 3, train_loss: 1.2188, test_loss: 1.2732, test_f1: 0.2491
 epoch: 4, train_loss: 1.2021, test_loss: 1.2501, test_f1: 0.3072
 epoch: 5, train_loss: 1.1913, test_loss: 1.2348, test_f1: 0.3385
 epoch: 6, train_loss: 1.1832, test_loss: 1.2220, test_f1: 0.3385
 epoch: 7, train_loss: 1.1719, test_loss: 1.2107, test_f1: 0.3407
 epoch: 8, train_loss: 1.1569, test_loss: 1.2036, test_f1: 0.3719
 epoch: 9, train_loss: 1.1475, test_loss: 1.1942, test_f1: 0.3749
 epoch: 10, train_loss: 1.1364, test_loss: 1.1869, test_f1: 0.4004
 epoch: 11, train_loss: 1.1239, test_loss: 1.1774, test_f1: 0.4251
 epoch: 12, train_loss: 1.1176, test_loss: 1.1715, test_f1: 0.4313
 epoch: 13, train_loss: 1.1143, test_loss: 1.1646, test_f1: 0.4298
 epoch: 14, train_loss: 1.1034, test_loss: 1.1578, test_f1: 0.4309
 epoch: 15, train_loss: 1.0905, test_loss: 1.1506, test_f1: 0.4309
 epoch: 16, train_loss: 1.0838, test_loss: 1.1483, test_f1: 0.4303
 epoch: 17, train_loss: 1.0807, test_loss: 1.1411, test_f1: 0.4298
 epoch: 18, train_loss: 1.0724, test_loss: 1.1379, test_f1: 0.4298
 epoch: 19, train_loss: 1.0671, test_loss: 1.1349, test_f1: 0.4299
 epoch: 20, train_loss: 1.0636, test_loss: 1.1267, test_f1: 0.4304
 epoch: 21, train_loss: 1.0616, test_loss: 1.1223, test_f1: 0.4304
 epoch: 22, train_loss: 1.0587, test_loss: 1.1202, test_f1: 0.4309
 epoch: 23, train_loss: 1.0512, test_loss: 1.1185, test_f1: 0.4304
 epoch: 24, train_loss: 1.0493, test_loss: 1.1143, test_f1: 0.4309
 epoch: 25, train_loss: 1.0494, test_loss: 1.1139, test_f1: 0.4315
 epoch: 26, train_loss: 1.0381, test_loss: 1.1092, test_f1: 0.4315
 epoch: 27, train_loss: 1.0425, test_loss: 1.1056, test_f1: 0.4304
 epoch: 28, train_loss: 1.0331, test_loss: 1.1043, test_f1: 0.4315
 epoch: 29, train_loss: 1.0324, test_loss: 1.1025, test_f1: 0.4304
 epoch: 30, train_loss: 1.0281, test_loss: 1.1030, test_f1: 0.4315
 epoch: 31, train_loss: 1.0262, test_loss: 1.1026, test_f1: 0.4298
 epoch: 32, train_loss: 1.0255, test_loss: 1.0956, test_f1: 0.4329
 epoch: 33, train_loss: 1.0211, test_loss: 1.0941, test_f1: 0.4335
 epoch: 34, train_loss: 1.0139, test_loss: 1.0954, test_f1: 0.4309
 epoch: 35, train_loss: 1.0163, test_loss: 1.0963, test_f1: 0.4321
 epoch: 36, train_loss: 1.0106, test_loss: 1.0971, test_f1: 0.4309
 epoch: 37, train_loss: 1.0185, test_loss: 1.0898, test_f1: 0.4335
 epoch: 38, train_loss: 1.0094, test_loss: 1.0910, test_f1: 0.4309
 epoch: 39, train_loss: 1.0015, test_loss: 1.0832, test_f1: 0.4335
 epoch: 40, train_loss: 1.0069, test_loss: 1.0868, test_f1: 0.4347
 epoch: 41, train_loss: 1.0044, test_loss: 1.0814, test_f1: 0.4341
 epoch: 42, train_loss: 0.9933, test_loss: 1.0909, test_f1: 0.4493
 epoch: 43, train_loss: 0.9985, test_loss: 1.0859, test_f1: 0.4316
 epoch: 44, train_loss: 0.9943, test_loss: 1.0790, test_f1: 0.4299
 epoch: 45, train_loss: 0.9925, test_loss: 1.0740, test_f1: 0.4355
 epoch: 46, train_loss: 0.9956, test_loss: 1.0774, test_f1: 0.4341
 epoch: 47, train_loss: 0.9892, test_loss: 1.0743, test_f1: 0.4335
 epoch: 48, train_loss: 0.9935, test_loss: 1.0738, test_f1: 0.4342
 epoch: 49, train_loss: 1.0014, test_loss: 1.0769, test_f1: 0.4342
 epoch: 50, train_loss: 0.9887, test_loss: 1.0725, test_f1: 0.4307
 epoch: 51, train_loss: 0.9845, test_loss: 1.0758, test_f1: 0.4336
 epoch: 52, train_loss: 0.9854, test_loss: 1.0734, test_f1: 0.4336
 epoch: 53, train_loss: 0.9826, test_loss: 1.0703, test_f1: 0.4336
 epoch: 54, train_loss: 0.9806, test_loss: 1.0766, test_f1: 0.4336
 epoch: 55, train_loss: 0.9704, test_loss: 1.0761, test_f1: 0.4330
 epoch: 56, train_loss: 0.9758, test_loss: 1.0766, test_f1: 0.4335
 epoch: 57, train_loss: 0.9783, test_loss: 1.0778, test_f1: 0.4341
 epoch: 58, train_loss: 0.9763, test_loss: 1.0731, test_f1: 0.4335
 epoch: 59, train_loss: 0.9829, test_loss: 1.0759, test_f1: 0.4336
 epoch: 60, train_loss: 0.9733, test_loss: 1.0707, test_f1: 0.4336
 epoch: 61, train_loss: 0.9856, test_loss: 1.0739, test_f1: 0.4336
 epoch: 62, train_loss: 0.9701, test_loss: 1.0773, test_f1: 0.4289
 epoch: 63, train_loss: 0.9752, test_loss: 1.0716, test_f1: 0.4341
 epoch: 64, train_loss: 0.9727, test_loss: 1.0700, test_f1: 0.4387
 epoch: 65, train_loss: 0.9774, test_loss: 1.0640, test_f1: 0.4280
 epoch: 66, train_loss: 0.9780, test_loss: 1.0647, test_f1: 0.4335
 epoch: 67, train_loss: 0.9738, test_loss: 1.0649, test_f1: 0.4341
 epoch: 68, train_loss: 0.9736, test_loss: 1.0650, test_f1: 0.4288
 epoch: 69, train_loss: 0.9721, test_loss: 1.0658, test_f1: 0.4313
 epoch: 70, train_loss: 0.9697, test_loss: 1.0663, test_f1: 0.4335
 epoch: 71, train_loss: 0.9734, test_loss: 1.0651, test_f1: 0.4335
 epoch: 72, train_loss: 0.9686, test_loss: 1.0637, test_f1: 0.4290
 epoch: 73, train_loss: 0.9697, test_loss: 1.0653, test_f1: 0.4288
 epoch: 74, train_loss: 0.9704, test_loss: 1.0688, test_f1: 0.4324
 epoch: 75, train_loss: 0.9665, test_loss: 1.0684, test_f1: 0.4294
 epoch: 76, train_loss: 0.9682, test_loss: 1.0594, test_f1: 0.4293
 epoch: 77, train_loss: 0.9687, test_loss: 1.0618, test_f1: 0.4300
 epoch: 78, train_loss: 0.9628, test_loss: 1.0668, test_f1: 0.4341
 epoch: 79, train_loss: 0.9608, test_loss: 1.0705, test_f1: 0.4346
 epoch: 80, train_loss: 0.9616, test_loss: 1.0714, test_f1: 0.4340
 epoch: 81, train_loss: 0.9598, test_loss: 1.0654, test_f1: 0.4294
 epoch: 82, train_loss: 0.9621, test_loss: 1.0662, test_f1: 0.4300
 epoch: 83, train_loss: 0.9533, test_loss: 1.0648, test_f1: 0.4288
 epoch: 84, train_loss: 0.9574, test_loss: 1.0603, test_f1: 0.4313
 epoch: 85, train_loss: 0.9573, test_loss: 1.0605, test_f1: 0.4289
 epoch: 86, train_loss: 0.9512, test_loss: 1.0613, test_f1: 0.4289
 epoch: 87, train_loss: 0.9595, test_loss: 1.0646, test_f1: 0.4392
 epoch: 88, train_loss: 0.9497, test_loss: 1.0607, test_f1: 0.4360
 epoch: 89, train_loss: 0.9601, test_loss: 1.0614, test_f1: 0.4295
 epoch: 90, train_loss: 0.9565, test_loss: 1.0632, test_f1: 0.4288
 epoch: 91, train_loss: 0.9585, test_loss: 1.0599, test_f1: 0.4288
 epoch: 92, train_loss: 0.9501, test_loss: 1.0599, test_f1: 0.4288
 epoch: 93, train_loss: 0.9581, test_loss: 1.0607, test_f1: 0.4289
 epoch: 94, train_loss: 0.9569, test_loss: 1.0642, test_f1: 0.4382
 epoch: 95, train_loss: 0.9522, test_loss: 1.0627, test_f1: 0.4289
 epoch: 96, train_loss: 0.9443, test_loss: 1.0622, test_f1: 0.4360
 epoch: 97, train_loss: 0.9542, test_loss: 1.0602, test_f1: 0.4289
 epoch: 98, train_loss: 0.9433, test_loss: 1.0608, test_f1: 0.4300
 epoch: 99, train_loss: 0.9500, test_loss: 1.0674, test_f1: 0.4403
##################ITERATION #6 ****************************************
 epoch: 0, train_loss: 1.2514, test_loss: 1.3039, test_f1: 0.2281
 epoch: 1, train_loss: 1.2176, test_loss: 1.3031, test_f1: 0.2281
 epoch: 2, train_loss: 1.2014, test_loss: 1.2979, test_f1: 0.2281
 epoch: 3, train_loss: 1.1862, test_loss: 1.2951, test_f1: 0.2281
 epoch: 4, train_loss: 1.1722, test_loss: 1.2896, test_f1: 0.2281
 epoch: 5, train_loss: 1.1575, test_loss: 1.2837, test_f1: 0.2390
 epoch: 6, train_loss: 1.1540, test_loss: 1.2537, test_f1: 0.2441
 epoch: 7, train_loss: 1.1362, test_loss: 1.2045, test_f1: 0.2654
 epoch: 8, train_loss: 1.1311, test_loss: 1.1865, test_f1: 0.2997
 epoch: 9, train_loss: 1.1241, test_loss: 1.1815, test_f1: 0.3210
 epoch: 10, train_loss: 1.1161, test_loss: 1.1766, test_f1: 0.3303
 epoch: 11, train_loss: 1.1082, test_loss: 1.1661, test_f1: 0.3434
 epoch: 12, train_loss: 1.1008, test_loss: 1.1687, test_f1: 0.3093
 epoch: 13, train_loss: 1.0888, test_loss: 1.1575, test_f1: 0.3457
 epoch: 14, train_loss: 1.0870, test_loss: 1.1540, test_f1: 0.3483
 epoch: 15, train_loss: 1.0749, test_loss: 1.1490, test_f1: 0.3198
 epoch: 16, train_loss: 1.0650, test_loss: 1.1478, test_f1: 0.3187
 epoch: 17, train_loss: 1.0689, test_loss: 1.1361, test_f1: 0.3245
 epoch: 18, train_loss: 1.0546, test_loss: 1.1364, test_f1: 0.3220
 epoch: 19, train_loss: 1.0512, test_loss: 1.1357, test_f1: 0.3768
 epoch: 20, train_loss: 1.0497, test_loss: 1.1383, test_f1: 0.4046
 epoch: 21, train_loss: 1.0476, test_loss: 1.1305, test_f1: 0.3992
 epoch: 22, train_loss: 1.0329, test_loss: 1.1264, test_f1: 0.3970
 epoch: 23, train_loss: 1.0354, test_loss: 1.1209, test_f1: 0.3949
 epoch: 24, train_loss: 1.0289, test_loss: 1.1191, test_f1: 0.4052
 epoch: 25, train_loss: 1.0286, test_loss: 1.1254, test_f1: 0.4243
 epoch: 26, train_loss: 1.0279, test_loss: 1.1234, test_f1: 0.4248
 epoch: 27, train_loss: 1.0236, test_loss: 1.1140, test_f1: 0.4121
 epoch: 28, train_loss: 1.0155, test_loss: 1.1139, test_f1: 0.4174
 epoch: 29, train_loss: 1.0116, test_loss: 1.1197, test_f1: 0.4291
 epoch: 30, train_loss: 1.0065, test_loss: 1.1104, test_f1: 0.4250
 epoch: 31, train_loss: 1.0012, test_loss: 1.1078, test_f1: 0.4177
 epoch: 32, train_loss: 1.0036, test_loss: 1.1045, test_f1: 0.4280
 epoch: 33, train_loss: 0.9954, test_loss: 1.0974, test_f1: 0.4239
 epoch: 34, train_loss: 1.0018, test_loss: 1.1003, test_f1: 0.4239
 epoch: 35, train_loss: 0.9969, test_loss: 1.1025, test_f1: 0.4273
 epoch: 36, train_loss: 0.9879, test_loss: 1.0970, test_f1: 0.4105
 epoch: 37, train_loss: 0.9880, test_loss: 1.0993, test_f1: 0.4284
 epoch: 38, train_loss: 0.9892, test_loss: 1.0901, test_f1: 0.4213
 epoch: 39, train_loss: 0.9826, test_loss: 1.0934, test_f1: 0.4280
 epoch: 40, train_loss: 0.9810, test_loss: 1.0980, test_f1: 0.4291
 epoch: 41, train_loss: 0.9798, test_loss: 1.0875, test_f1: 0.4307
 epoch: 42, train_loss: 0.9677, test_loss: 1.0888, test_f1: 0.4285
 epoch: 43, train_loss: 0.9763, test_loss: 1.0883, test_f1: 0.4396
 epoch: 44, train_loss: 0.9688, test_loss: 1.0871, test_f1: 0.4327
 epoch: 45, train_loss: 0.9599, test_loss: 1.0857, test_f1: 0.4311
 epoch: 46, train_loss: 0.9651, test_loss: 1.0852, test_f1: 0.4324
 epoch: 47, train_loss: 0.9582, test_loss: 1.0975, test_f1: 0.4290
 epoch: 48, train_loss: 0.9635, test_loss: 1.0774, test_f1: 0.4183
 epoch: 49, train_loss: 0.9607, test_loss: 1.0727, test_f1: 0.4390
 epoch: 50, train_loss: 0.9592, test_loss: 1.0805, test_f1: 0.4456
 epoch: 51, train_loss: 0.9614, test_loss: 1.0761, test_f1: 0.4554
 epoch: 52, train_loss: 0.9432, test_loss: 1.0666, test_f1: 0.4617
 epoch: 53, train_loss: 0.9490, test_loss: 1.0607, test_f1: 0.4435
 epoch: 54, train_loss: 0.9495, test_loss: 1.0723, test_f1: 0.4593
 epoch: 55, train_loss: 0.9403, test_loss: 1.0839, test_f1: 0.4495
 epoch: 56, train_loss: 0.9383, test_loss: 1.0719, test_f1: 0.4407
 epoch: 57, train_loss: 0.9511, test_loss: 1.0750, test_f1: 0.4315
 epoch: 58, train_loss: 0.9388, test_loss: 1.0778, test_f1: 0.4478
 epoch: 59, train_loss: 0.9410, test_loss: 1.0648, test_f1: 0.4361
 epoch: 60, train_loss: 0.9409, test_loss: 1.0654, test_f1: 0.4406
 epoch: 61, train_loss: 0.9446, test_loss: 1.0712, test_f1: 0.4523
 epoch: 62, train_loss: 0.9325, test_loss: 1.0785, test_f1: 0.4606
 epoch: 63, train_loss: 0.9339, test_loss: 1.0714, test_f1: 0.4289
 epoch: 64, train_loss: 0.9289, test_loss: 1.0612, test_f1: 0.4414
 epoch: 65, train_loss: 0.9437, test_loss: 1.0671, test_f1: 0.4368
 epoch: 66, train_loss: 0.9364, test_loss: 1.0801, test_f1: 0.4438
 epoch: 67, train_loss: 0.9345, test_loss: 1.0654, test_f1: 0.4371
 epoch: 68, train_loss: 0.9294, test_loss: 1.0626, test_f1: 0.4470
 epoch: 69, train_loss: 0.9338, test_loss: 1.0763, test_f1: 0.4519
 epoch: 70, train_loss: 0.9294, test_loss: 1.0608, test_f1: 0.4556
 epoch: 71, train_loss: 0.9170, test_loss: 1.0592, test_f1: 0.4610
 epoch: 72, train_loss: 0.9281, test_loss: 1.0610, test_f1: 0.4474
 epoch: 73, train_loss: 0.9262, test_loss: 1.0622, test_f1: 0.4478
 epoch: 74, train_loss: 0.9195, test_loss: 1.0589, test_f1: 0.4431
 epoch: 75, train_loss: 0.9209, test_loss: 1.0570, test_f1: 0.4463
 epoch: 76, train_loss: 0.9214, test_loss: 1.0628, test_f1: 0.4523
 epoch: 77, train_loss: 0.9180, test_loss: 1.0683, test_f1: 0.4569
 epoch: 78, train_loss: 0.9172, test_loss: 1.0675, test_f1: 0.4641
 epoch: 79, train_loss: 0.9242, test_loss: 1.0555, test_f1: 0.4676
 epoch: 80, train_loss: 0.9202, test_loss: 1.0749, test_f1: 0.4649
 epoch: 81, train_loss: 0.9199, test_loss: 1.0680, test_f1: 0.4559
 epoch: 82, train_loss: 0.9160, test_loss: 1.0684, test_f1: 0.4779
 epoch: 83, train_loss: 0.9150, test_loss: 1.0529, test_f1: 0.4677
 epoch: 84, train_loss: 0.9263, test_loss: 1.0523, test_f1: 0.4677
 epoch: 85, train_loss: 0.9147, test_loss: 1.0596, test_f1: 0.4753
 epoch: 86, train_loss: 0.9153, test_loss: 1.0584, test_f1: 0.4715
 epoch: 87, train_loss: 0.9125, test_loss: 1.0524, test_f1: 0.4918
 epoch: 88, train_loss: 0.9129, test_loss: 1.0582, test_f1: 0.4766
 epoch: 89, train_loss: 0.9164, test_loss: 1.0622, test_f1: 0.4659
 epoch: 90, train_loss: 0.9034, test_loss: 1.0543, test_f1: 0.4756
 epoch: 91, train_loss: 0.9069, test_loss: 1.0656, test_f1: 0.4813
 epoch: 92, train_loss: 0.9131, test_loss: 1.0692, test_f1: 0.4906
 epoch: 93, train_loss: 0.9100, test_loss: 1.0516, test_f1: 0.4854
 epoch: 94, train_loss: 0.9002, test_loss: 1.0548, test_f1: 0.5091
 epoch: 95, train_loss: 0.8977, test_loss: 1.0472, test_f1: 0.4928
 epoch: 96, train_loss: 0.9080, test_loss: 1.0542, test_f1: 0.5002
 epoch: 97, train_loss: 0.9059, test_loss: 1.0485, test_f1: 0.5019
 epoch: 98, train_loss: 0.9099, test_loss: 1.0397, test_f1: 0.4861
 epoch: 99, train_loss: 0.9137, test_loss: 1.0470, test_f1: 0.4894
##################ITERATION #7 ****************************************
 epoch: 0, train_loss: 1.2720, test_loss: 1.3073, test_f1: 0.2281
 epoch: 1, train_loss: 1.2353, test_loss: 1.3048, test_f1: 0.2281
 epoch: 2, train_loss: 1.2245, test_loss: 1.2918, test_f1: 0.2281
 epoch: 3, train_loss: 1.2054, test_loss: 1.2805, test_f1: 0.2281
 epoch: 4, train_loss: 1.1923, test_loss: 1.2789, test_f1: 0.2281
 epoch: 5, train_loss: 1.1863, test_loss: 1.2668, test_f1: 0.2281
 epoch: 6, train_loss: 1.1625, test_loss: 1.2509, test_f1: 0.2339
 epoch: 7, train_loss: 1.1582, test_loss: 1.2270, test_f1: 0.2493
 epoch: 8, train_loss: 1.1498, test_loss: 1.2100, test_f1: 0.2678
 epoch: 9, train_loss: 1.1453, test_loss: 1.2016, test_f1: 0.3013
 epoch: 10, train_loss: 1.1263, test_loss: 1.1968, test_f1: 0.3154
 epoch: 11, train_loss: 1.1295, test_loss: 1.1895, test_f1: 0.3192
 epoch: 12, train_loss: 1.1146, test_loss: 1.1868, test_f1: 0.3172
 epoch: 13, train_loss: 1.1091, test_loss: 1.1837, test_f1: 0.3314
 epoch: 14, train_loss: 1.1023, test_loss: 1.1784, test_f1: 0.3214
 epoch: 15, train_loss: 1.0940, test_loss: 1.1769, test_f1: 0.3298
 epoch: 16, train_loss: 1.0872, test_loss: 1.1758, test_f1: 0.3386
 epoch: 17, train_loss: 1.0811, test_loss: 1.1714, test_f1: 0.3513
 epoch: 18, train_loss: 1.0746, test_loss: 1.1692, test_f1: 0.3450
 epoch: 19, train_loss: 1.0684, test_loss: 1.1646, test_f1: 0.3475
 epoch: 20, train_loss: 1.0657, test_loss: 1.1647, test_f1: 0.3652
 epoch: 21, train_loss: 1.0623, test_loss: 1.1645, test_f1: 0.3670
 epoch: 22, train_loss: 1.0534, test_loss: 1.1570, test_f1: 0.3832
 epoch: 23, train_loss: 1.0416, test_loss: 1.1593, test_f1: 0.3665
 epoch: 24, train_loss: 1.0431, test_loss: 1.1643, test_f1: 0.3986
 epoch: 25, train_loss: 1.0400, test_loss: 1.1629, test_f1: 0.3794
 epoch: 26, train_loss: 1.0381, test_loss: 1.1552, test_f1: 0.3736
 epoch: 27, train_loss: 1.0332, test_loss: 1.1596, test_f1: 0.3921
 epoch: 28, train_loss: 1.0371, test_loss: 1.1595, test_f1: 0.4069
 epoch: 29, train_loss: 1.0191, test_loss: 1.1590, test_f1: 0.3948
 epoch: 30, train_loss: 1.0152, test_loss: 1.1530, test_f1: 0.4018
 epoch: 31, train_loss: 1.0111, test_loss: 1.1621, test_f1: 0.3979
 epoch: 32, train_loss: 1.0124, test_loss: 1.1562, test_f1: 0.4123
 epoch: 33, train_loss: 1.0107, test_loss: 1.1586, test_f1: 0.4251
 epoch: 34, train_loss: 1.0107, test_loss: 1.1619, test_f1: 0.4053
 epoch: 35, train_loss: 1.0054, test_loss: 1.1560, test_f1: 0.4180
 epoch: 36, train_loss: 1.0055, test_loss: 1.1494, test_f1: 0.4038
 epoch: 37, train_loss: 0.9983, test_loss: 1.1569, test_f1: 0.4355
 epoch: 38, train_loss: 1.0040, test_loss: 1.1530, test_f1: 0.4198
 epoch: 39, train_loss: 0.9966, test_loss: 1.1565, test_f1: 0.4077
 epoch: 40, train_loss: 0.9971, test_loss: 1.1604, test_f1: 0.4285
 epoch: 41, train_loss: 0.9960, test_loss: 1.1554, test_f1: 0.4292
 epoch: 42, train_loss: 0.9880, test_loss: 1.1563, test_f1: 0.4241
 epoch: 43, train_loss: 0.9819, test_loss: 1.1556, test_f1: 0.4359
 epoch: 44, train_loss: 0.9780, test_loss: 1.1514, test_f1: 0.4223
 epoch: 45, train_loss: 0.9791, test_loss: 1.1516, test_f1: 0.4398
 epoch: 46, train_loss: 0.9750, test_loss: 1.1547, test_f1: 0.4192
 epoch: 47, train_loss: 0.9725, test_loss: 1.1637, test_f1: 0.4093
 epoch: 48, train_loss: 0.9741, test_loss: 1.1735, test_f1: 0.4391
 epoch: 49, train_loss: 0.9619, test_loss: 1.1637, test_f1: 0.4303
 epoch: 50, train_loss: 0.9701, test_loss: 1.1557, test_f1: 0.4554
 epoch: 51, train_loss: 0.9743, test_loss: 1.1652, test_f1: 0.4297
 epoch: 52, train_loss: 0.9703, test_loss: 1.1687, test_f1: 0.4281
 epoch: 53, train_loss: 0.9591, test_loss: 1.1698, test_f1: 0.4340
 epoch: 54, train_loss: 0.9579, test_loss: 1.1691, test_f1: 0.4381
 epoch: 55, train_loss: 0.9676, test_loss: 1.1718, test_f1: 0.4493
 epoch: 56, train_loss: 0.9546, test_loss: 1.1715, test_f1: 0.4398
 epoch: 57, train_loss: 0.9556, test_loss: 1.1752, test_f1: 0.4438
 epoch: 58, train_loss: 0.9596, test_loss: 1.1780, test_f1: 0.4378
 epoch: 59, train_loss: 0.9586, test_loss: 1.1849, test_f1: 0.4149
 epoch: 60, train_loss: 0.9548, test_loss: 1.1883, test_f1: 0.4023
 epoch: 61, train_loss: 0.9549, test_loss: 1.1887, test_f1: 0.4006
 epoch: 62, train_loss: 0.9562, test_loss: 1.1887, test_f1: 0.4302
 epoch: 63, train_loss: 0.9534, test_loss: 1.1895, test_f1: 0.4406
 epoch: 64, train_loss: 0.9519, test_loss: 1.1871, test_f1: 0.4345
 epoch: 65, train_loss: 0.9488, test_loss: 1.1848, test_f1: 0.4532
 epoch: 66, train_loss: 0.9476, test_loss: 1.1890, test_f1: 0.4519
 epoch: 67, train_loss: 0.9409, test_loss: 1.1902, test_f1: 0.4406
 epoch: 68, train_loss: 0.9495, test_loss: 1.1891, test_f1: 0.4528
 epoch: 69, train_loss: 0.9493, test_loss: 1.1929, test_f1: 0.4443
 epoch: 70, train_loss: 0.9476, test_loss: 1.1965, test_f1: 0.4575
 epoch: 71, train_loss: 0.9481, test_loss: 1.1961, test_f1: 0.4404
 epoch: 72, train_loss: 0.9389, test_loss: 1.1979, test_f1: 0.4437
 epoch: 73, train_loss: 0.9554, test_loss: 1.1920, test_f1: 0.4479
 epoch: 74, train_loss: 0.9365, test_loss: 1.1991, test_f1: 0.4429
 epoch: 75, train_loss: 0.9422, test_loss: 1.1985, test_f1: 0.4546
 epoch: 76, train_loss: 0.9278, test_loss: 1.2101, test_f1: 0.4579
 epoch: 77, train_loss: 0.9363, test_loss: 1.2072, test_f1: 0.4430
 epoch: 78, train_loss: 0.9465, test_loss: 1.1938, test_f1: 0.4495
 epoch: 79, train_loss: 0.9405, test_loss: 1.1949, test_f1: 0.4440
 epoch: 80, train_loss: 0.9271, test_loss: 1.2080, test_f1: 0.4367
 epoch: 81, train_loss: 0.9335, test_loss: 1.1949, test_f1: 0.4346
 epoch: 82, train_loss: 0.9266, test_loss: 1.1955, test_f1: 0.4561
 epoch: 83, train_loss: 0.9398, test_loss: 1.1967, test_f1: 0.4547
 epoch: 84, train_loss: 0.9404, test_loss: 1.2009, test_f1: 0.4523
 epoch: 85, train_loss: 0.9330, test_loss: 1.2124, test_f1: 0.4685
 epoch: 86, train_loss: 0.9284, test_loss: 1.2101, test_f1: 0.4698
 epoch: 87, train_loss: 0.9325, test_loss: 1.1914, test_f1: 0.4667
 epoch: 88, train_loss: 0.9340, test_loss: 1.2010, test_f1: 0.4853
 epoch: 89, train_loss: 0.9361, test_loss: 1.1999, test_f1: 0.4946
 epoch: 90, train_loss: 0.9247, test_loss: 1.2044, test_f1: 0.4872
 epoch: 91, train_loss: 0.9282, test_loss: 1.2027, test_f1: 0.4844
 epoch: 92, train_loss: 0.9227, test_loss: 1.2065, test_f1: 0.4678
 epoch: 93, train_loss: 0.9177, test_loss: 1.2033, test_f1: 0.4616
 epoch: 94, train_loss: 0.9176, test_loss: 1.1980, test_f1: 0.4750
 epoch: 95, train_loss: 0.9242, test_loss: 1.2113, test_f1: 0.4658
 epoch: 96, train_loss: 0.9345, test_loss: 1.2189, test_f1: 0.4671
 epoch: 97, train_loss: 0.9186, test_loss: 1.2231, test_f1: 0.4672
 epoch: 98, train_loss: 0.9179, test_loss: 1.2144, test_f1: 0.4648
 epoch: 99, train_loss: 0.9192, test_loss: 1.2138, test_f1: 0.4760
##################ITERATION #8 ****************************************
 epoch: 0, train_loss: 1.3066, test_loss: 1.3188, test_f1: 0.2281
 epoch: 1, train_loss: 1.2640, test_loss: 1.3176, test_f1: 0.2281
 epoch: 2, train_loss: 1.2534, test_loss: 1.3192, test_f1: 0.2281
 epoch: 3, train_loss: 1.2404, test_loss: 1.3048, test_f1: 0.2281
 epoch: 4, train_loss: 1.2268, test_loss: 1.2844, test_f1: 0.2281
 epoch: 5, train_loss: 1.2162, test_loss: 1.2728, test_f1: 0.2281
 epoch: 6, train_loss: 1.2155, test_loss: 1.2656, test_f1: 0.2281
 epoch: 7, train_loss: 1.2039, test_loss: 1.2599, test_f1: 0.2281
 epoch: 8, train_loss: 1.1934, test_loss: 1.2536, test_f1: 0.2281
 epoch: 9, train_loss: 1.1840, test_loss: 1.2468, test_f1: 0.2680
 epoch: 10, train_loss: 1.1735, test_loss: 1.2429, test_f1: 0.2583
 epoch: 11, train_loss: 1.1703, test_loss: 1.2356, test_f1: 0.2583
 epoch: 12, train_loss: 1.1617, test_loss: 1.2260, test_f1: 0.3062
 epoch: 13, train_loss: 1.1605, test_loss: 1.2163, test_f1: 0.3355
 epoch: 14, train_loss: 1.1520, test_loss: 1.2108, test_f1: 0.3480
 epoch: 15, train_loss: 1.1341, test_loss: 1.2026, test_f1: 0.3560
 epoch: 16, train_loss: 1.1296, test_loss: 1.1940, test_f1: 0.3256
 epoch: 17, train_loss: 1.1265, test_loss: 1.1879, test_f1: 0.3303
 epoch: 18, train_loss: 1.1114, test_loss: 1.1811, test_f1: 0.3628
 epoch: 19, train_loss: 1.1022, test_loss: 1.1683, test_f1: 0.3303
 epoch: 20, train_loss: 1.0947, test_loss: 1.1600, test_f1: 0.3316
 epoch: 21, train_loss: 1.0879, test_loss: 1.1652, test_f1: 0.3646
 epoch: 22, train_loss: 1.0884, test_loss: 1.1531, test_f1: 0.3640
 epoch: 23, train_loss: 1.0737, test_loss: 1.1421, test_f1: 0.3838
 epoch: 24, train_loss: 1.0588, test_loss: 1.1363, test_f1: 0.3770
 epoch: 25, train_loss: 1.0566, test_loss: 1.1331, test_f1: 0.3904
 epoch: 26, train_loss: 1.0475, test_loss: 1.1319, test_f1: 0.3650
 epoch: 27, train_loss: 1.0376, test_loss: 1.1227, test_f1: 0.3664
 epoch: 28, train_loss: 1.0408, test_loss: 1.1181, test_f1: 0.3955
 epoch: 29, train_loss: 1.0389, test_loss: 1.1180, test_f1: 0.4177
 epoch: 30, train_loss: 1.0364, test_loss: 1.1140, test_f1: 0.3999
 epoch: 31, train_loss: 1.0203, test_loss: 1.1061, test_f1: 0.3926
 epoch: 32, train_loss: 1.0189, test_loss: 1.1073, test_f1: 0.4086
 epoch: 33, train_loss: 1.0189, test_loss: 1.1013, test_f1: 0.4367
 epoch: 34, train_loss: 1.0202, test_loss: 1.0970, test_f1: 0.4147
 epoch: 35, train_loss: 1.0119, test_loss: 1.0916, test_f1: 0.4108
 epoch: 36, train_loss: 1.0075, test_loss: 1.1002, test_f1: 0.4224
 epoch: 37, train_loss: 1.0049, test_loss: 1.0956, test_f1: 0.4320
 epoch: 38, train_loss: 1.0030, test_loss: 1.0886, test_f1: 0.4370
 epoch: 39, train_loss: 1.0009, test_loss: 1.0960, test_f1: 0.4348
 epoch: 40, train_loss: 0.9951, test_loss: 1.0866, test_f1: 0.4354
 epoch: 41, train_loss: 0.9954, test_loss: 1.0866, test_f1: 0.4365
 epoch: 42, train_loss: 1.0038, test_loss: 1.0868, test_f1: 0.4359
 epoch: 43, train_loss: 0.9814, test_loss: 1.0754, test_f1: 0.4359
 epoch: 44, train_loss: 0.9791, test_loss: 1.0748, test_f1: 0.4365
 epoch: 45, train_loss: 0.9839, test_loss: 1.0779, test_f1: 0.4359
 epoch: 46, train_loss: 0.9834, test_loss: 1.0751, test_f1: 0.4336
 epoch: 47, train_loss: 0.9841, test_loss: 1.0786, test_f1: 0.4197
 epoch: 48, train_loss: 0.9684, test_loss: 1.0770, test_f1: 0.4367
 epoch: 49, train_loss: 0.9675, test_loss: 1.0750, test_f1: 0.4296
 epoch: 50, train_loss: 0.9716, test_loss: 1.0695, test_f1: 0.4366
 epoch: 51, train_loss: 0.9718, test_loss: 1.0686, test_f1: 0.4365
 epoch: 52, train_loss: 0.9583, test_loss: 1.0648, test_f1: 0.4365
 epoch: 53, train_loss: 0.9600, test_loss: 1.0693, test_f1: 0.4365
 epoch: 54, train_loss: 0.9693, test_loss: 1.0687, test_f1: 0.4294
 epoch: 55, train_loss: 0.9623, test_loss: 1.0709, test_f1: 0.4365
 epoch: 56, train_loss: 0.9585, test_loss: 1.0750, test_f1: 0.4365
 epoch: 57, train_loss: 0.9629, test_loss: 1.0732, test_f1: 0.4366
 epoch: 58, train_loss: 0.9596, test_loss: 1.0675, test_f1: 0.4367
 epoch: 59, train_loss: 0.9539, test_loss: 1.0725, test_f1: 0.4365
 epoch: 60, train_loss: 0.9582, test_loss: 1.0742, test_f1: 0.4365
 epoch: 61, train_loss: 0.9549, test_loss: 1.0754, test_f1: 0.4359
 epoch: 62, train_loss: 0.9514, test_loss: 1.0686, test_f1: 0.4391
 epoch: 63, train_loss: 0.9559, test_loss: 1.0690, test_f1: 0.4340
 epoch: 64, train_loss: 0.9511, test_loss: 1.0723, test_f1: 0.4340
 epoch: 65, train_loss: 0.9457, test_loss: 1.0702, test_f1: 0.4340
 epoch: 66, train_loss: 0.9485, test_loss: 1.0692, test_f1: 0.4340
 epoch: 67, train_loss: 0.9491, test_loss: 1.0703, test_f1: 0.4334
 epoch: 68, train_loss: 0.9422, test_loss: 1.0665, test_f1: 0.4343
 epoch: 69, train_loss: 0.9476, test_loss: 1.0728, test_f1: 0.4367
 epoch: 70, train_loss: 0.9505, test_loss: 1.0735, test_f1: 0.4318
 epoch: 71, train_loss: 0.9439, test_loss: 1.0692, test_f1: 0.4317
 epoch: 72, train_loss: 0.9416, test_loss: 1.0673, test_f1: 0.4341
 epoch: 73, train_loss: 0.9392, test_loss: 1.0673, test_f1: 0.4398
 epoch: 74, train_loss: 0.9422, test_loss: 1.0602, test_f1: 0.4354
 epoch: 75, train_loss: 0.9383, test_loss: 1.0608, test_f1: 0.4398
 epoch: 76, train_loss: 0.9405, test_loss: 1.0630, test_f1: 0.4398
 epoch: 77, train_loss: 0.9402, test_loss: 1.0679, test_f1: 0.4398
 epoch: 78, train_loss: 0.9381, test_loss: 1.0648, test_f1: 0.4360
 epoch: 79, train_loss: 0.9422, test_loss: 1.0704, test_f1: 0.4366
 epoch: 80, train_loss: 0.9349, test_loss: 1.0671, test_f1: 0.4348
 epoch: 81, train_loss: 0.9311, test_loss: 1.0673, test_f1: 0.4342
 epoch: 82, train_loss: 0.9385, test_loss: 1.0635, test_f1: 0.4320
 epoch: 83, train_loss: 0.9304, test_loss: 1.0618, test_f1: 0.4342
 epoch: 84, train_loss: 0.9283, test_loss: 1.0648, test_f1: 0.4391
 epoch: 85, train_loss: 0.9294, test_loss: 1.0672, test_f1: 0.4336
 epoch: 86, train_loss: 0.9349, test_loss: 1.0662, test_f1: 0.4311
 epoch: 87, train_loss: 0.9277, test_loss: 1.0655, test_f1: 0.4311
 epoch: 88, train_loss: 0.9208, test_loss: 1.0731, test_f1: 0.4333
 epoch: 89, train_loss: 0.9294, test_loss: 1.0668, test_f1: 0.4360
 epoch: 90, train_loss: 0.9196, test_loss: 1.0612, test_f1: 0.4360
 epoch: 91, train_loss: 0.9303, test_loss: 1.0758, test_f1: 0.4334
 epoch: 92, train_loss: 0.9281, test_loss: 1.0666, test_f1: 0.4336
 epoch: 93, train_loss: 0.9257, test_loss: 1.0647, test_f1: 0.4359
 epoch: 94, train_loss: 0.9235, test_loss: 1.0622, test_f1: 0.4366
 epoch: 95, train_loss: 0.9287, test_loss: 1.0615, test_f1: 0.4366
 epoch: 96, train_loss: 0.9211, test_loss: 1.0639, test_f1: 0.4366
 epoch: 97, train_loss: 0.9172, test_loss: 1.0596, test_f1: 0.4342
 epoch: 98, train_loss: 0.9255, test_loss: 1.0593, test_f1: 0.4429
 epoch: 99, train_loss: 0.9251, test_loss: 1.0576, test_f1: 0.4491
##################ITERATION #9 ****************************************
 epoch: 0, train_loss: 1.2692, test_loss: 1.3070, test_f1: 0.2281
 epoch: 1, train_loss: 1.2319, test_loss: 1.3168, test_f1: 0.2281
 epoch: 2, train_loss: 1.2183, test_loss: 1.3400, test_f1: 0.2281
 epoch: 3, train_loss: 1.1977, test_loss: 1.3135, test_f1: 0.2285
 epoch: 4, train_loss: 1.1860, test_loss: 1.2786, test_f1: 0.2387
 epoch: 5, train_loss: 1.1785, test_loss: 1.2500, test_f1: 0.2397
 epoch: 6, train_loss: 1.1663, test_loss: 1.2280, test_f1: 0.3109
 epoch: 7, train_loss: 1.1495, test_loss: 1.2133, test_f1: 0.3140
 epoch: 8, train_loss: 1.1371, test_loss: 1.2013, test_f1: 0.3109
 epoch: 9, train_loss: 1.1315, test_loss: 1.1946, test_f1: 0.3148
 epoch: 10, train_loss: 1.1219, test_loss: 1.1880, test_f1: 0.3206
 epoch: 11, train_loss: 1.1150, test_loss: 1.1799, test_f1: 0.3255
 epoch: 12, train_loss: 1.1140, test_loss: 1.1747, test_f1: 0.3264
 epoch: 13, train_loss: 1.0990, test_loss: 1.1706, test_f1: 0.3264
 epoch: 14, train_loss: 1.0952, test_loss: 1.1677, test_f1: 0.3237
 epoch: 15, train_loss: 1.0935, test_loss: 1.1618, test_f1: 0.3374
 epoch: 16, train_loss: 1.0911, test_loss: 1.1619, test_f1: 0.3264
 epoch: 17, train_loss: 1.0720, test_loss: 1.1557, test_f1: 0.3264
 epoch: 18, train_loss: 1.0737, test_loss: 1.1477, test_f1: 0.3295
 epoch: 19, train_loss: 1.0633, test_loss: 1.1486, test_f1: 0.3446
 epoch: 20, train_loss: 1.0755, test_loss: 1.1449, test_f1: 0.3465
 epoch: 21, train_loss: 1.0587, test_loss: 1.1404, test_f1: 0.3475
 epoch: 22, train_loss: 1.0570, test_loss: 1.1469, test_f1: 0.3431
 epoch: 23, train_loss: 1.0501, test_loss: 1.1392, test_f1: 0.3470
 epoch: 24, train_loss: 1.0458, test_loss: 1.1381, test_f1: 0.3467
 epoch: 25, train_loss: 1.0481, test_loss: 1.1334, test_f1: 0.3460
 epoch: 26, train_loss: 1.0404, test_loss: 1.1266, test_f1: 0.3515
 epoch: 27, train_loss: 1.0300, test_loss: 1.1316, test_f1: 0.3502
 epoch: 28, train_loss: 1.0226, test_loss: 1.1304, test_f1: 0.3604
 epoch: 29, train_loss: 1.0296, test_loss: 1.1250, test_f1: 0.3558
 epoch: 30, train_loss: 1.0222, test_loss: 1.1256, test_f1: 0.3604
 epoch: 31, train_loss: 1.0164, test_loss: 1.1315, test_f1: 0.3440
 epoch: 32, train_loss: 1.0173, test_loss: 1.1278, test_f1: 0.3489
 epoch: 33, train_loss: 1.0141, test_loss: 1.1249, test_f1: 0.3637
 epoch: 34, train_loss: 1.0114, test_loss: 1.1219, test_f1: 0.3882
 epoch: 35, train_loss: 0.9980, test_loss: 1.1207, test_f1: 0.3824
 epoch: 36, train_loss: 1.0080, test_loss: 1.1267, test_f1: 0.4000
 epoch: 37, train_loss: 1.0035, test_loss: 1.1204, test_f1: 0.3401
 epoch: 38, train_loss: 1.0008, test_loss: 1.1123, test_f1: 0.3564
 epoch: 39, train_loss: 0.9929, test_loss: 1.1197, test_f1: 0.3975
 epoch: 40, train_loss: 0.9921, test_loss: 1.1096, test_f1: 0.4031
 epoch: 41, train_loss: 0.9876, test_loss: 1.1124, test_f1: 0.3687
 epoch: 42, train_loss: 0.9903, test_loss: 1.1132, test_f1: 0.4125
 epoch: 43, train_loss: 0.9834, test_loss: 1.1039, test_f1: 0.3941
 epoch: 44, train_loss: 0.9915, test_loss: 1.1190, test_f1: 0.4065
 epoch: 45, train_loss: 0.9823, test_loss: 1.1071, test_f1: 0.4092
 epoch: 46, train_loss: 0.9815, test_loss: 1.1018, test_f1: 0.4070
 epoch: 47, train_loss: 0.9785, test_loss: 1.1000, test_f1: 0.4085
 epoch: 48, train_loss: 0.9700, test_loss: 1.1017, test_f1: 0.4136
 epoch: 49, train_loss: 0.9711, test_loss: 1.1028, test_f1: 0.4100
 epoch: 50, train_loss: 0.9703, test_loss: 1.0948, test_f1: 0.4067
 epoch: 51, train_loss: 0.9707, test_loss: 1.1041, test_f1: 0.4040
 epoch: 52, train_loss: 0.9685, test_loss: 1.0943, test_f1: 0.4290
 epoch: 53, train_loss: 0.9729, test_loss: 1.0943, test_f1: 0.4402
 epoch: 54, train_loss: 0.9700, test_loss: 1.0964, test_f1: 0.4218
 epoch: 55, train_loss: 0.9671, test_loss: 1.0934, test_f1: 0.4161
 epoch: 56, train_loss: 0.9678, test_loss: 1.0920, test_f1: 0.4161
 epoch: 57, train_loss: 0.9631, test_loss: 1.0858, test_f1: 0.4408
 epoch: 58, train_loss: 0.9607, test_loss: 1.0943, test_f1: 0.4273
 epoch: 59, train_loss: 0.9591, test_loss: 1.0976, test_f1: 0.4062
 epoch: 60, train_loss: 0.9552, test_loss: 1.0967, test_f1: 0.4200
 epoch: 61, train_loss: 0.9620, test_loss: 1.0950, test_f1: 0.4150
 epoch: 62, train_loss: 0.9594, test_loss: 1.0960, test_f1: 0.4157
 epoch: 63, train_loss: 0.9591, test_loss: 1.0927, test_f1: 0.4131
 epoch: 64, train_loss: 0.9452, test_loss: 1.0973, test_f1: 0.4344
 epoch: 65, train_loss: 0.9582, test_loss: 1.0985, test_f1: 0.4443
 epoch: 66, train_loss: 0.9588, test_loss: 1.0872, test_f1: 0.4478
 epoch: 67, train_loss: 0.9547, test_loss: 1.0914, test_f1: 0.4449
 epoch: 68, train_loss: 0.9546, test_loss: 1.0899, test_f1: 0.4346
 epoch: 69, train_loss: 0.9583, test_loss: 1.0916, test_f1: 0.4344
 epoch: 70, train_loss: 0.9497, test_loss: 1.0905, test_f1: 0.4145
 epoch: 71, train_loss: 0.9490, test_loss: 1.0898, test_f1: 0.4419
 epoch: 72, train_loss: 0.9479, test_loss: 1.0998, test_f1: 0.4463
 epoch: 73, train_loss: 0.9503, test_loss: 1.0900, test_f1: 0.4386
 epoch: 74, train_loss: 0.9528, test_loss: 1.0919, test_f1: 0.4419
 epoch: 75, train_loss: 0.9484, test_loss: 1.0996, test_f1: 0.4479
 epoch: 76, train_loss: 0.9469, test_loss: 1.0935, test_f1: 0.4419
 epoch: 77, train_loss: 0.9413, test_loss: 1.0918, test_f1: 0.4419
 epoch: 78, train_loss: 0.9407, test_loss: 1.0878, test_f1: 0.4406
 epoch: 79, train_loss: 0.9452, test_loss: 1.0904, test_f1: 0.4396
 epoch: 80, train_loss: 0.9498, test_loss: 1.0962, test_f1: 0.4419
 epoch: 81, train_loss: 0.9383, test_loss: 1.0968, test_f1: 0.4419
 epoch: 82, train_loss: 0.9450, test_loss: 1.0885, test_f1: 0.4444
 epoch: 83, train_loss: 0.9468, test_loss: 1.0909, test_f1: 0.4425
 epoch: 84, train_loss: 0.9395, test_loss: 1.0917, test_f1: 0.4443
 epoch: 85, train_loss: 0.9462, test_loss: 1.0939, test_f1: 0.4419
 epoch: 86, train_loss: 0.9527, test_loss: 1.0884, test_f1: 0.4419
 epoch: 87, train_loss: 0.9359, test_loss: 1.0934, test_f1: 0.4419
 epoch: 88, train_loss: 0.9393, test_loss: 1.1030, test_f1: 0.4398
 epoch: 89, train_loss: 0.9353, test_loss: 1.1035, test_f1: 0.4398
 epoch: 90, train_loss: 0.9348, test_loss: 1.0995, test_f1: 0.4400
 epoch: 91, train_loss: 0.9348, test_loss: 1.1005, test_f1: 0.4400
 epoch: 92, train_loss: 0.9326, test_loss: 1.1047, test_f1: 0.4419
 epoch: 93, train_loss: 0.9446, test_loss: 1.0996, test_f1: 0.4393
 epoch: 94, train_loss: 0.9357, test_loss: 1.1004, test_f1: 0.4429
 epoch: 95, train_loss: 0.9344, test_loss: 1.0971, test_f1: 0.4432
 epoch: 96, train_loss: 0.9358, test_loss: 1.0970, test_f1: 0.4400
 epoch: 97, train_loss: 0.9387, test_loss: 1.0982, test_f1: 0.4393
 epoch: 98, train_loss: 0.9343, test_loss: 1.0945, test_f1: 0.4400
 epoch: 99, train_loss: 0.9331, test_loss: 1.0988, test_f1: 0.4395

Training completed in 391.66 seconds
Best F1: 0.5091 at epoch 94
Mean F1 across iterations: 0.4608  0.0255
========================FINAL RESULTS================================
FEGIN weighted F1: 0.5091  0.0255
python main.py --data ltspice_demos --representation component_pin_net --model FEGIN --layers 6 --hiddens 32 --batch_size 128 --lr 0.0001 --emb_size 128 --epochs 100 --save_appendix component_pin_net_L6_H32_BS128_LR0.0001_E128 --no_val
-----



STDERR:
  File "main.py", line 370, in <module>
    main()
  File "main.py", line 254, in main
    dataset = dataset_class(
  File "/home/philip/projects/ltspice_examples_code_repo/Circuit-Completion-Using-GNNs/component_classification_with_link_prediction_head/evaluation/FEGIN/kernel/circuit_datasets.py", line 15, in __init__
    self.data, self.slices = torch.load(self.processed_paths[0])
  File "/home/philip/.local/lib/python3.8/site-packages/torch/serialization.py", line 1040, in load
    warnings.warn(
  File "/usr/lib/python3.8/warnings.py", line 109, in _showwarnmsg
    sw(msg.message, msg.category, msg.filename, msg.lineno,
  File "main.py", line 47, in warn_with_traceback
    traceback.print_stack(file=log)
/home/philip/projects/ltspice_examples_code_repo/Circuit-Completion-Using-GNNs/component_classification_with_link_prediction_head/evaluation/FEGIN/kernel/circuit_datasets.py:15: FutureWarning: You are using `torch.load` with `weights_only=False` (the current default value), which uses the default pickle module implicitly. It is possible to construct malicious pickle data which will execute arbitrary code during unpickling (See https://github.com/pytorch/pytorch/blob/main/SECURITY.md#untrusted-models for more details). In a future release, the default value for `weights_only` will be flipped to `True`. This limits the functions that could be executed during unpickling. Arbitrary objects will no longer be allowed to be loaded via this mode unless they are explicitly allowlisted by the user via `torch.serialization.add_safe_globals`. We recommend you start setting `weights_only=True` for any use case where you don't have full control of the loaded file. Please open an issue on GitHub for any issues related to this experimental feature.
  self.data, self.slices = torch.load(self.processed_paths[0])
