STDOUT:
Results will be saved in /home/philip/projects/ltspice_examples_code_repo/Circuit-Completion-Using-GNNs/component_classification_with_link_prediction_head/evaluation/FEGIN/results/model_FEGIN_dataset_ltspice_demos
Command line input: python main.py --data ltspice_demos --representation component_net --model FEGIN --layers 6 --hiddens 128 --batch_size 128 --lr 0.001 --emb_size 128 --epochs 100 --save_appendix component_net_L6_H128_BS128_LR0.001_E128 --no_val
 is saved.
-----
ltspice_demos - FEGIN
Using 6 layers, 128 hidden units, h = 2
Loading component_net representation dataset
ENTERED
Training FEGIN on component_net representation
Train: 1565, Test: 383
##################ITERATION #0 ****************************************
 epoch: 0, train_loss: 1.2544, test_loss: 1.3351, test_f1: 0.2281
 epoch: 1, train_loss: 1.1338, test_loss: 1.3102, test_f1: 0.2281
 epoch: 2, train_loss: 1.0940, test_loss: 1.2752, test_f1: 0.2491
 epoch: 3, train_loss: 1.0533, test_loss: 1.1304, test_f1: 0.4588
 epoch: 4, train_loss: 0.9967, test_loss: 1.1368, test_f1: 0.4891
 epoch: 5, train_loss: 0.9629, test_loss: 1.0275, test_f1: 0.5468
 epoch: 6, train_loss: 0.9298, test_loss: 1.0518, test_f1: 0.5288
 epoch: 7, train_loss: 0.8786, test_loss: 1.1116, test_f1: 0.5323
 epoch: 8, train_loss: 0.8854, test_loss: 1.0148, test_f1: 0.5749
 epoch: 9, train_loss: 0.8445, test_loss: 1.1304, test_f1: 0.5035
 epoch: 10, train_loss: 0.8364, test_loss: 1.1511, test_f1: 0.5045
 epoch: 11, train_loss: 0.8155, test_loss: 1.1292, test_f1: 0.5604
 epoch: 12, train_loss: 0.7938, test_loss: 1.1546, test_f1: 0.5593
 epoch: 13, train_loss: 0.7806, test_loss: 1.0982, test_f1: 0.5686
 epoch: 14, train_loss: 0.7853, test_loss: 1.2836, test_f1: 0.5415
 epoch: 15, train_loss: 0.7740, test_loss: 1.4989, test_f1: 0.5156
 epoch: 16, train_loss: 0.7593, test_loss: 1.1753, test_f1: 0.5761
 epoch: 17, train_loss: 0.7268, test_loss: 1.2369, test_f1: 0.5624
 epoch: 18, train_loss: 0.7292, test_loss: 1.3449, test_f1: 0.5756
 epoch: 19, train_loss: 0.7344, test_loss: 1.3347, test_f1: 0.5618
 epoch: 20, train_loss: 0.7285, test_loss: 1.2973, test_f1: 0.6158
 epoch: 21, train_loss: 0.7144, test_loss: 1.2853, test_f1: 0.5999
 epoch: 22, train_loss: 0.6735, test_loss: 1.4764, test_f1: 0.5733
 epoch: 23, train_loss: 0.6925, test_loss: 1.4065, test_f1: 0.5136
 epoch: 24, train_loss: 0.6393, test_loss: 1.4092, test_f1: 0.5764
 epoch: 25, train_loss: 0.6387, test_loss: 1.3906, test_f1: 0.5861
 epoch: 26, train_loss: 0.6298, test_loss: 1.6501, test_f1: 0.5437
 epoch: 27, train_loss: 0.6035, test_loss: 1.6187, test_f1: 0.5705
 epoch: 28, train_loss: 0.6110, test_loss: 1.5399, test_f1: 0.5772
 epoch: 29, train_loss: 0.5634, test_loss: 1.7579, test_f1: 0.5583
 epoch: 30, train_loss: 0.5807, test_loss: 1.5145, test_f1: 0.6035
 epoch: 31, train_loss: 0.5525, test_loss: 1.7904, test_f1: 0.5521
 epoch: 32, train_loss: 0.5486, test_loss: 1.7106, test_f1: 0.5568
 epoch: 33, train_loss: 0.5037, test_loss: 1.6193, test_f1: 0.5577
 epoch: 34, train_loss: 0.4976, test_loss: 1.7998, test_f1: 0.5686
 epoch: 35, train_loss: 0.5373, test_loss: 1.7810, test_f1: 0.6097
 epoch: 36, train_loss: 0.5155, test_loss: 1.9518, test_f1: 0.5725
 epoch: 37, train_loss: 0.5123, test_loss: 1.7382, test_f1: 0.5806
 epoch: 38, train_loss: 0.5418, test_loss: 1.7955, test_f1: 0.5849
 epoch: 39, train_loss: 0.5092, test_loss: 1.9622, test_f1: 0.5627
 epoch: 40, train_loss: 0.4702, test_loss: 1.9664, test_f1: 0.6031
 epoch: 41, train_loss: 0.4500, test_loss: 2.2875, test_f1: 0.5588
 epoch: 42, train_loss: 0.4778, test_loss: 1.9925, test_f1: 0.5740
 epoch: 43, train_loss: 0.4516, test_loss: 1.9662, test_f1: 0.5830
 epoch: 44, train_loss: 0.4095, test_loss: 2.3235, test_f1: 0.5586
 epoch: 45, train_loss: 0.4072, test_loss: 2.1581, test_f1: 0.5596
 epoch: 46, train_loss: 0.4390, test_loss: 2.4498, test_f1: 0.5590
 epoch: 47, train_loss: 0.4091, test_loss: 2.1902, test_f1: 0.5738
 epoch: 48, train_loss: 0.4376, test_loss: 2.1009, test_f1: 0.5588
 epoch: 49, train_loss: 0.4479, test_loss: 2.5741, test_f1: 0.5338
 epoch: 50, train_loss: 0.5018, test_loss: 2.2443, test_f1: 0.5005
 epoch: 51, train_loss: 0.4258, test_loss: 2.0172, test_f1: 0.5599
 epoch: 52, train_loss: 0.3956, test_loss: 2.0716, test_f1: 0.5738
 epoch: 53, train_loss: 0.3541, test_loss: 2.0633, test_f1: 0.6108
 epoch: 54, train_loss: 0.3451, test_loss: 2.3644, test_f1: 0.5706
 epoch: 55, train_loss: 0.3144, test_loss: 2.4339, test_f1: 0.5959
 epoch: 56, train_loss: 0.3061, test_loss: 2.4642, test_f1: 0.5923
 epoch: 57, train_loss: 0.3157, test_loss: 2.5480, test_f1: 0.5822
 epoch: 58, train_loss: 0.2956, test_loss: 2.5490, test_f1: 0.5766
 epoch: 59, train_loss: 0.3056, test_loss: 2.4964, test_f1: 0.6187
 epoch: 60, train_loss: 0.3235, test_loss: 2.5126, test_f1: 0.5830
 epoch: 61, train_loss: 0.2873, test_loss: 2.5855, test_f1: 0.5801
 epoch: 62, train_loss: 0.2684, test_loss: 2.7865, test_f1: 0.5769
 epoch: 63, train_loss: 0.2419, test_loss: 2.6668, test_f1: 0.6020
 epoch: 64, train_loss: 0.2717, test_loss: 2.7126, test_f1: 0.5852
 epoch: 65, train_loss: 0.2528, test_loss: 2.6282, test_f1: 0.5954
 epoch: 66, train_loss: 0.2442, test_loss: 2.8382, test_f1: 0.5936
 epoch: 67, train_loss: 0.2456, test_loss: 2.7936, test_f1: 0.5938
 epoch: 68, train_loss: 0.2402, test_loss: 2.9506, test_f1: 0.5612
 epoch: 69, train_loss: 0.2611, test_loss: 2.8219, test_f1: 0.5918
 epoch: 70, train_loss: 0.2803, test_loss: 2.6960, test_f1: 0.6125
 epoch: 71, train_loss: 0.2622, test_loss: 3.2834, test_f1: 0.5756
 epoch: 72, train_loss: 0.2410, test_loss: 2.9657, test_f1: 0.5901
 epoch: 73, train_loss: 0.2374, test_loss: 3.0441, test_f1: 0.5842
 epoch: 74, train_loss: 0.2408, test_loss: 2.9303, test_f1: 0.5867
 epoch: 75, train_loss: 0.2041, test_loss: 2.7719, test_f1: 0.6238
 epoch: 76, train_loss: 0.2333, test_loss: 3.0156, test_f1: 0.5967
 epoch: 77, train_loss: 0.2319, test_loss: 2.7613, test_f1: 0.6270
 epoch: 78, train_loss: 0.2220, test_loss: 2.9490, test_f1: 0.6053
 epoch: 79, train_loss: 0.2125, test_loss: 2.9263, test_f1: 0.6161
 epoch: 80, train_loss: 0.2241, test_loss: 3.1239, test_f1: 0.6150
 epoch: 81, train_loss: 0.2066, test_loss: 2.9318, test_f1: 0.6122
 epoch: 82, train_loss: 0.2387, test_loss: 2.8764, test_f1: 0.5813
 epoch: 83, train_loss: 0.2150, test_loss: 2.8729, test_f1: 0.6019
 epoch: 84, train_loss: 0.1957, test_loss: 3.1176, test_f1: 0.6107
 epoch: 85, train_loss: 0.2098, test_loss: 3.0329, test_f1: 0.6354
 epoch: 86, train_loss: 0.2148, test_loss: 3.1741, test_f1: 0.5994
 epoch: 87, train_loss: 0.1953, test_loss: 3.2166, test_f1: 0.6296
 epoch: 88, train_loss: 0.2029, test_loss: 3.0836, test_f1: 0.6083
 epoch: 89, train_loss: 0.1899, test_loss: 3.3650, test_f1: 0.5904
 epoch: 90, train_loss: 0.1937, test_loss: 3.2729, test_f1: 0.6151
 epoch: 91, train_loss: 0.1908, test_loss: 3.3767, test_f1: 0.6081
 epoch: 92, train_loss: 0.1904, test_loss: 3.0579, test_f1: 0.6300
 epoch: 93, train_loss: 0.1661, test_loss: 3.2462, test_f1: 0.6425
 epoch: 94, train_loss: 0.1774, test_loss: 3.2581, test_f1: 0.6124
 epoch: 95, train_loss: 0.1718, test_loss: 3.2872, test_f1: 0.6265
 epoch: 96, train_loss: 0.1601, test_loss: 3.3766, test_f1: 0.6169
 epoch: 97, train_loss: 0.1636, test_loss: 3.6535, test_f1: 0.6174
 epoch: 98, train_loss: 0.1638, test_loss: 3.4306, test_f1: 0.6303
 epoch: 99, train_loss: 0.1608, test_loss: 3.4724, test_f1: 0.6383
##################ITERATION #1 ****************************************
 epoch: 0, train_loss: 1.1701, test_loss: 1.3023, test_f1: 0.2281
 epoch: 1, train_loss: 1.0344, test_loss: 1.1979, test_f1: 0.3104
 epoch: 2, train_loss: 1.0056, test_loss: 1.2091, test_f1: 0.4131
 epoch: 3, train_loss: 0.9466, test_loss: 1.1891, test_f1: 0.3747
 epoch: 4, train_loss: 0.9355, test_loss: 1.1408, test_f1: 0.4647
 epoch: 5, train_loss: 0.9064, test_loss: 1.0434, test_f1: 0.5212
 epoch: 6, train_loss: 0.8801, test_loss: 1.0841, test_f1: 0.5276
 epoch: 7, train_loss: 0.8618, test_loss: 0.9981, test_f1: 0.5726
 epoch: 8, train_loss: 0.8158, test_loss: 1.1347, test_f1: 0.5030
 epoch: 9, train_loss: 0.7967, test_loss: 1.2204, test_f1: 0.4997
 epoch: 10, train_loss: 0.8155, test_loss: 1.0559, test_f1: 0.5641
 epoch: 11, train_loss: 0.8175, test_loss: 1.0976, test_f1: 0.5635
 epoch: 12, train_loss: 0.8017, test_loss: 1.2893, test_f1: 0.5190
 epoch: 13, train_loss: 0.7952, test_loss: 1.2147, test_f1: 0.4518
 epoch: 14, train_loss: 0.7845, test_loss: 1.2470, test_f1: 0.5410
 epoch: 15, train_loss: 0.7448, test_loss: 1.1030, test_f1: 0.6093
 epoch: 16, train_loss: 0.7161, test_loss: 1.1874, test_f1: 0.6006
 epoch: 17, train_loss: 0.7007, test_loss: 1.1488, test_f1: 0.6115
 epoch: 18, train_loss: 0.6803, test_loss: 1.2748, test_f1: 0.5829
 epoch: 19, train_loss: 0.6791, test_loss: 1.1693, test_f1: 0.6126
 epoch: 20, train_loss: 0.6623, test_loss: 1.3962, test_f1: 0.5491
 epoch: 21, train_loss: 0.6523, test_loss: 1.1504, test_f1: 0.5953
 epoch: 22, train_loss: 0.6648, test_loss: 1.4259, test_f1: 0.5566
 epoch: 23, train_loss: 0.6424, test_loss: 1.3466, test_f1: 0.5520
 epoch: 24, train_loss: 0.6238, test_loss: 1.2619, test_f1: 0.5742
 epoch: 25, train_loss: 0.6435, test_loss: 1.6528, test_f1: 0.5696
 epoch: 26, train_loss: 0.6168, test_loss: 1.3834, test_f1: 0.6034
 epoch: 27, train_loss: 0.5853, test_loss: 1.4907, test_f1: 0.5601
 epoch: 28, train_loss: 0.5543, test_loss: 1.3750, test_f1: 0.6356
 epoch: 29, train_loss: 0.5310, test_loss: 1.6054, test_f1: 0.6129
 epoch: 30, train_loss: 0.5302, test_loss: 1.5444, test_f1: 0.5867
 epoch: 31, train_loss: 0.5200, test_loss: 1.5787, test_f1: 0.5881
 epoch: 32, train_loss: 0.5713, test_loss: 1.7985, test_f1: 0.5619
 epoch: 33, train_loss: 0.5572, test_loss: 1.3214, test_f1: 0.6095
 epoch: 34, train_loss: 0.5399, test_loss: 1.5185, test_f1: 0.5880
 epoch: 35, train_loss: 0.5119, test_loss: 1.5817, test_f1: 0.5843
 epoch: 36, train_loss: 0.4950, test_loss: 1.4995, test_f1: 0.6230
 epoch: 37, train_loss: 0.5211, test_loss: 1.6186, test_f1: 0.5497
 epoch: 38, train_loss: 0.4993, test_loss: 1.7199, test_f1: 0.5782
 epoch: 39, train_loss: 0.4940, test_loss: 1.6614, test_f1: 0.5753
 epoch: 40, train_loss: 0.5093, test_loss: 1.5695, test_f1: 0.5853
 epoch: 41, train_loss: 0.4851, test_loss: 1.7832, test_f1: 0.5715
 epoch: 42, train_loss: 0.4976, test_loss: 1.8322, test_f1: 0.5640
 epoch: 43, train_loss: 0.4990, test_loss: 1.4690, test_f1: 0.6258
 epoch: 44, train_loss: 0.4682, test_loss: 1.4209, test_f1: 0.6451
 epoch: 45, train_loss: 0.4414, test_loss: 1.7470, test_f1: 0.5742
 epoch: 46, train_loss: 0.4117, test_loss: 1.6442, test_f1: 0.5976
 epoch: 47, train_loss: 0.3993, test_loss: 1.7276, test_f1: 0.5901
 epoch: 48, train_loss: 0.3965, test_loss: 1.5980, test_f1: 0.6363
 epoch: 49, train_loss: 0.3790, test_loss: 1.7977, test_f1: 0.6186
 epoch: 50, train_loss: 0.4171, test_loss: 1.7875, test_f1: 0.5884
 epoch: 51, train_loss: 0.3758, test_loss: 1.7995, test_f1: 0.5948
 epoch: 52, train_loss: 0.3460, test_loss: 1.9278, test_f1: 0.5953
 epoch: 53, train_loss: 0.3349, test_loss: 1.9801, test_f1: 0.6170
 epoch: 54, train_loss: 0.3348, test_loss: 1.9302, test_f1: 0.6528
 epoch: 55, train_loss: 0.3105, test_loss: 1.8909, test_f1: 0.6481
 epoch: 56, train_loss: 0.3402, test_loss: 2.1701, test_f1: 0.5847
 epoch: 57, train_loss: 0.3261, test_loss: 1.9472, test_f1: 0.6223
 epoch: 58, train_loss: 0.2867, test_loss: 1.8792, test_f1: 0.6242
 epoch: 59, train_loss: 0.2692, test_loss: 1.9650, test_f1: 0.6226
 epoch: 60, train_loss: 0.2668, test_loss: 2.1355, test_f1: 0.6260
 epoch: 61, train_loss: 0.2812, test_loss: 2.2276, test_f1: 0.5890
 epoch: 62, train_loss: 0.2444, test_loss: 2.1180, test_f1: 0.6143
 epoch: 63, train_loss: 0.2589, test_loss: 2.1815, test_f1: 0.6465
 epoch: 64, train_loss: 0.2995, test_loss: 2.1305, test_f1: 0.6108
 epoch: 65, train_loss: 0.2776, test_loss: 2.5724, test_f1: 0.6092
 epoch: 66, train_loss: 0.2822, test_loss: 2.3777, test_f1: 0.6066
 epoch: 67, train_loss: 0.2555, test_loss: 2.1671, test_f1: 0.6207
 epoch: 68, train_loss: 0.2540, test_loss: 2.3900, test_f1: 0.6106
 epoch: 69, train_loss: 0.2648, test_loss: 2.4977, test_f1: 0.5866
 epoch: 70, train_loss: 0.2541, test_loss: 2.2826, test_f1: 0.6455
 epoch: 71, train_loss: 0.2575, test_loss: 2.3032, test_f1: 0.6576
 epoch: 72, train_loss: 0.2476, test_loss: 2.4598, test_f1: 0.6355
 epoch: 73, train_loss: 0.2346, test_loss: 2.6006, test_f1: 0.6003
 epoch: 74, train_loss: 0.2142, test_loss: 2.5157, test_f1: 0.6184
 epoch: 75, train_loss: 0.2359, test_loss: 2.5921, test_f1: 0.6218
 epoch: 76, train_loss: 0.2693, test_loss: 2.9540, test_f1: 0.6174
 epoch: 77, train_loss: 0.2272, test_loss: 2.6449, test_f1: 0.6009
 epoch: 78, train_loss: 0.1888, test_loss: 2.7864, test_f1: 0.6196
 epoch: 79, train_loss: 0.1921, test_loss: 2.8046, test_f1: 0.6079
 epoch: 80, train_loss: 0.2104, test_loss: 2.6942, test_f1: 0.6263
 epoch: 81, train_loss: 0.2379, test_loss: 2.8449, test_f1: 0.5872
 epoch: 82, train_loss: 0.2129, test_loss: 2.9798, test_f1: 0.5894
 epoch: 83, train_loss: 0.2117, test_loss: 2.9764, test_f1: 0.6055
 epoch: 84, train_loss: 0.2109, test_loss: 2.8015, test_f1: 0.6169
 epoch: 85, train_loss: 0.2338, test_loss: 2.8473, test_f1: 0.6042
 epoch: 86, train_loss: 0.2061, test_loss: 2.9014, test_f1: 0.6228
 epoch: 87, train_loss: 0.2187, test_loss: 2.9071, test_f1: 0.6121
 epoch: 88, train_loss: 0.1913, test_loss: 2.8068, test_f1: 0.6140
 epoch: 89, train_loss: 0.2023, test_loss: 2.7418, test_f1: 0.6172
 epoch: 90, train_loss: 0.2039, test_loss: 2.9613, test_f1: 0.6373
 epoch: 91, train_loss: 0.2318, test_loss: 2.9774, test_f1: 0.6259
 epoch: 92, train_loss: 0.2231, test_loss: 3.1458, test_f1: 0.6009
 epoch: 93, train_loss: 0.2152, test_loss: 2.9468, test_f1: 0.6184
 epoch: 94, train_loss: 0.2102, test_loss: 3.0190, test_f1: 0.5935
 epoch: 95, train_loss: 0.2026, test_loss: 2.9776, test_f1: 0.5848
 epoch: 96, train_loss: 0.2164, test_loss: 2.8509, test_f1: 0.6177
 epoch: 97, train_loss: 0.2003, test_loss: 2.8781, test_f1: 0.6363
 epoch: 98, train_loss: 0.1762, test_loss: 2.7618, test_f1: 0.6463
 epoch: 99, train_loss: 0.1773, test_loss: 2.8069, test_f1: 0.6433
##################ITERATION #2 ****************************************
 epoch: 0, train_loss: 1.1465, test_loss: 1.3601, test_f1: 0.1384
 epoch: 1, train_loss: 1.0412, test_loss: 1.3289, test_f1: 0.1954
 epoch: 2, train_loss: 0.9650, test_loss: 1.1777, test_f1: 0.3084
 epoch: 3, train_loss: 0.9438, test_loss: 1.0796, test_f1: 0.4576
 epoch: 4, train_loss: 0.9187, test_loss: 1.0613, test_f1: 0.5051
 epoch: 5, train_loss: 0.8937, test_loss: 1.0806, test_f1: 0.4786
 epoch: 6, train_loss: 0.8571, test_loss: 1.0443, test_f1: 0.5655
 epoch: 7, train_loss: 0.8434, test_loss: 1.0960, test_f1: 0.5833
 epoch: 8, train_loss: 0.8246, test_loss: 1.1168, test_f1: 0.5920
 epoch: 9, train_loss: 0.8129, test_loss: 1.0942, test_f1: 0.5458
 epoch: 10, train_loss: 0.7919, test_loss: 1.0459, test_f1: 0.5633
 epoch: 11, train_loss: 0.7812, test_loss: 1.1179, test_f1: 0.5878
 epoch: 12, train_loss: 0.7564, test_loss: 1.1599, test_f1: 0.5616
 epoch: 13, train_loss: 0.7497, test_loss: 1.0820, test_f1: 0.5759
 epoch: 14, train_loss: 0.7445, test_loss: 1.0814, test_f1: 0.5838
 epoch: 15, train_loss: 0.7307, test_loss: 1.1090, test_f1: 0.5916
 epoch: 16, train_loss: 0.7237, test_loss: 1.2626, test_f1: 0.5452
 epoch: 17, train_loss: 0.7131, test_loss: 1.1758, test_f1: 0.5950
 epoch: 18, train_loss: 0.7158, test_loss: 1.1105, test_f1: 0.5950
 epoch: 19, train_loss: 0.6925, test_loss: 1.1130, test_f1: 0.5704
 epoch: 20, train_loss: 0.6834, test_loss: 1.2092, test_f1: 0.5900
 epoch: 21, train_loss: 0.6660, test_loss: 1.2997, test_f1: 0.5758
 epoch: 22, train_loss: 0.6609, test_loss: 1.2366, test_f1: 0.5996
 epoch: 23, train_loss: 0.6017, test_loss: 1.1761, test_f1: 0.6165
 epoch: 24, train_loss: 0.6105, test_loss: 1.3171, test_f1: 0.5700
 epoch: 25, train_loss: 0.6077, test_loss: 1.2220, test_f1: 0.6153
 epoch: 26, train_loss: 0.5805, test_loss: 1.4696, test_f1: 0.6076
 epoch: 27, train_loss: 0.5784, test_loss: 1.4193, test_f1: 0.6050
 epoch: 28, train_loss: 0.5474, test_loss: 1.7969, test_f1: 0.5770
 epoch: 29, train_loss: 0.5931, test_loss: 1.5329, test_f1: 0.5969
 epoch: 30, train_loss: 0.5985, test_loss: 1.6129, test_f1: 0.5700
 epoch: 31, train_loss: 0.5602, test_loss: 1.7068, test_f1: 0.5884
 epoch: 32, train_loss: 0.5288, test_loss: 1.4845, test_f1: 0.6142
 epoch: 33, train_loss: 0.5609, test_loss: 1.5753, test_f1: 0.5889
 epoch: 34, train_loss: 0.5448, test_loss: 1.4829, test_f1: 0.6077
 epoch: 35, train_loss: 0.5106, test_loss: 1.5714, test_f1: 0.5995
 epoch: 36, train_loss: 0.5191, test_loss: 1.6873, test_f1: 0.6140
 epoch: 37, train_loss: 0.5109, test_loss: 1.5376, test_f1: 0.6010
 epoch: 38, train_loss: 0.5355, test_loss: 1.6190, test_f1: 0.6052
 epoch: 39, train_loss: 0.5126, test_loss: 1.6076, test_f1: 0.6091
 epoch: 40, train_loss: 0.4910, test_loss: 1.6934, test_f1: 0.5853
 epoch: 41, train_loss: 0.4607, test_loss: 1.7795, test_f1: 0.5797
 epoch: 42, train_loss: 0.4319, test_loss: 1.8362, test_f1: 0.5779
 epoch: 43, train_loss: 0.4444, test_loss: 1.7521, test_f1: 0.5994
 epoch: 44, train_loss: 0.4423, test_loss: 1.6930, test_f1: 0.6029
 epoch: 45, train_loss: 0.4093, test_loss: 1.5876, test_f1: 0.6014
 epoch: 46, train_loss: 0.4188, test_loss: 2.0601, test_f1: 0.5682
 epoch: 47, train_loss: 0.4548, test_loss: 2.1089, test_f1: 0.5926
 epoch: 48, train_loss: 0.3936, test_loss: 1.8034, test_f1: 0.6018
 epoch: 49, train_loss: 0.3724, test_loss: 2.1659, test_f1: 0.5611
 epoch: 50, train_loss: 0.4131, test_loss: 2.0136, test_f1: 0.5394
 epoch: 51, train_loss: 0.3862, test_loss: 1.9830, test_f1: 0.5562
 epoch: 52, train_loss: 0.3319, test_loss: 1.9474, test_f1: 0.5642
 epoch: 53, train_loss: 0.3101, test_loss: 2.1409, test_f1: 0.5536
 epoch: 54, train_loss: 0.2919, test_loss: 2.2691, test_f1: 0.5682
 epoch: 55, train_loss: 0.2778, test_loss: 2.2420, test_f1: 0.5717
 epoch: 56, train_loss: 0.2922, test_loss: 1.9469, test_f1: 0.6035
 epoch: 57, train_loss: 0.2882, test_loss: 2.3535, test_f1: 0.5977
 epoch: 58, train_loss: 0.3410, test_loss: 2.2644, test_f1: 0.5854
 epoch: 59, train_loss: 0.3065, test_loss: 2.2500, test_f1: 0.5596
 epoch: 60, train_loss: 0.2744, test_loss: 2.2136, test_f1: 0.5864
 epoch: 61, train_loss: 0.2548, test_loss: 2.3086, test_f1: 0.5782
 epoch: 62, train_loss: 0.2491, test_loss: 2.3487, test_f1: 0.5892
 epoch: 63, train_loss: 0.2962, test_loss: 3.0260, test_f1: 0.5620
 epoch: 64, train_loss: 0.2707, test_loss: 2.2081, test_f1: 0.5910
 epoch: 65, train_loss: 0.2759, test_loss: 2.6626, test_f1: 0.5859
 epoch: 66, train_loss: 0.2833, test_loss: 2.5738, test_f1: 0.5712
 epoch: 67, train_loss: 0.2549, test_loss: 2.3973, test_f1: 0.5965
 epoch: 68, train_loss: 0.2499, test_loss: 2.4941, test_f1: 0.6021
 epoch: 69, train_loss: 0.2493, test_loss: 2.3921, test_f1: 0.6104
 epoch: 70, train_loss: 0.2287, test_loss: 2.4968, test_f1: 0.5798
 epoch: 71, train_loss: 0.2596, test_loss: 2.7371, test_f1: 0.5665
 epoch: 72, train_loss: 0.2492, test_loss: 2.8022, test_f1: 0.5897
 epoch: 73, train_loss: 0.2141, test_loss: 2.8229, test_f1: 0.5904
 epoch: 74, train_loss: 0.2093, test_loss: 2.7298, test_f1: 0.5806
 epoch: 75, train_loss: 0.2731, test_loss: 2.4093, test_f1: 0.5987
 epoch: 76, train_loss: 0.2811, test_loss: 2.5931, test_f1: 0.5958
 epoch: 77, train_loss: 0.2584, test_loss: 2.5449, test_f1: 0.5835
 epoch: 78, train_loss: 0.2224, test_loss: 2.7865, test_f1: 0.5800
 epoch: 79, train_loss: 0.2184, test_loss: 2.6382, test_f1: 0.5972
 epoch: 80, train_loss: 0.2307, test_loss: 2.5523, test_f1: 0.5905
 epoch: 81, train_loss: 0.2064, test_loss: 2.6260, test_f1: 0.5910
 epoch: 82, train_loss: 0.2151, test_loss: 2.7114, test_f1: 0.5786
 epoch: 83, train_loss: 0.1984, test_loss: 2.8494, test_f1: 0.5896
 epoch: 84, train_loss: 0.2024, test_loss: 2.9983, test_f1: 0.5900
 epoch: 85, train_loss: 0.1764, test_loss: 3.1123, test_f1: 0.5877
 epoch: 86, train_loss: 0.2146, test_loss: 3.5111, test_f1: 0.6171
 epoch: 87, train_loss: 0.2241, test_loss: 2.5886, test_f1: 0.6435
 epoch: 88, train_loss: 0.2091, test_loss: 2.6969, test_f1: 0.5981
 epoch: 89, train_loss: 0.1936, test_loss: 2.7752, test_f1: 0.5698
 epoch: 90, train_loss: 0.1869, test_loss: 2.9204, test_f1: 0.5848
 epoch: 91, train_loss: 0.1952, test_loss: 3.2220, test_f1: 0.6034
 epoch: 92, train_loss: 0.2263, test_loss: 2.9515, test_f1: 0.5734
 epoch: 93, train_loss: 0.1950, test_loss: 2.9459, test_f1: 0.5591
 epoch: 94, train_loss: 0.1858, test_loss: 2.9333, test_f1: 0.5780
 epoch: 95, train_loss: 0.1784, test_loss: 3.0567, test_f1: 0.5841
 epoch: 96, train_loss: 0.1970, test_loss: 3.1970, test_f1: 0.5749
 epoch: 97, train_loss: 0.2099, test_loss: 3.1040, test_f1: 0.6038
 epoch: 98, train_loss: 0.1788, test_loss: 2.9237, test_f1: 0.6245
 epoch: 99, train_loss: 0.1988, test_loss: 3.0598, test_f1: 0.5973
##################ITERATION #3 ****************************************
 epoch: 0, train_loss: 1.2037, test_loss: 1.3094, test_f1: 0.2387
 epoch: 1, train_loss: 1.0414, test_loss: 1.3197, test_f1: 0.2101
 epoch: 2, train_loss: 1.0051, test_loss: 1.1651, test_f1: 0.4751
 epoch: 3, train_loss: 0.9460, test_loss: 1.0806, test_f1: 0.4419
 epoch: 4, train_loss: 0.9238, test_loss: 1.0495, test_f1: 0.5523
 epoch: 5, train_loss: 0.9001, test_loss: 1.1192, test_f1: 0.5455
 epoch: 6, train_loss: 0.8724, test_loss: 1.0958, test_f1: 0.5379
 epoch: 7, train_loss: 0.8898, test_loss: 1.0236, test_f1: 0.5635
 epoch: 8, train_loss: 0.8596, test_loss: 1.0716, test_f1: 0.5506
 epoch: 9, train_loss: 0.8444, test_loss: 1.2170, test_f1: 0.5415
 epoch: 10, train_loss: 0.8412, test_loss: 0.9819, test_f1: 0.5824
 epoch: 11, train_loss: 0.8260, test_loss: 1.1457, test_f1: 0.5568
 epoch: 12, train_loss: 0.7878, test_loss: 1.0465, test_f1: 0.5671
 epoch: 13, train_loss: 0.7855, test_loss: 1.1223, test_f1: 0.5642
 epoch: 14, train_loss: 0.7655, test_loss: 1.2203, test_f1: 0.5945
 epoch: 15, train_loss: 0.7633, test_loss: 1.1765, test_f1: 0.5734
 epoch: 16, train_loss: 0.7705, test_loss: 1.2130, test_f1: 0.5752
 epoch: 17, train_loss: 0.7492, test_loss: 1.1386, test_f1: 0.6159
 epoch: 18, train_loss: 0.7248, test_loss: 1.0925, test_f1: 0.6129
 epoch: 19, train_loss: 0.7125, test_loss: 1.1730, test_f1: 0.5663
 epoch: 20, train_loss: 0.6923, test_loss: 1.0779, test_f1: 0.6199
 epoch: 21, train_loss: 0.6695, test_loss: 1.2890, test_f1: 0.5722
 epoch: 22, train_loss: 0.6453, test_loss: 1.4405, test_f1: 0.5747
 epoch: 23, train_loss: 0.6838, test_loss: 1.3239, test_f1: 0.6012
 epoch: 24, train_loss: 0.6894, test_loss: 1.2133, test_f1: 0.6124
 epoch: 25, train_loss: 0.6523, test_loss: 1.4276, test_f1: 0.5814
 epoch: 26, train_loss: 0.6365, test_loss: 1.1689, test_f1: 0.5853
 epoch: 27, train_loss: 0.6204, test_loss: 1.2496, test_f1: 0.5848
 epoch: 28, train_loss: 0.5956, test_loss: 1.6420, test_f1: 0.5596
 epoch: 29, train_loss: 0.6422, test_loss: 1.3766, test_f1: 0.5814
 epoch: 30, train_loss: 0.6322, test_loss: 1.6252, test_f1: 0.5412
 epoch: 31, train_loss: 0.6224, test_loss: 1.6795, test_f1: 0.5928
 epoch: 32, train_loss: 0.6146, test_loss: 1.3933, test_f1: 0.5938
 epoch: 33, train_loss: 0.5486, test_loss: 1.4373, test_f1: 0.5553
 epoch: 34, train_loss: 0.5197, test_loss: 1.4017, test_f1: 0.6169
 epoch: 35, train_loss: 0.5349, test_loss: 1.8683, test_f1: 0.5670
 epoch: 36, train_loss: 0.4977, test_loss: 1.7719, test_f1: 0.5996
 epoch: 37, train_loss: 0.4979, test_loss: 1.7123, test_f1: 0.5724
 epoch: 38, train_loss: 0.4786, test_loss: 1.6683, test_f1: 0.6204
 epoch: 39, train_loss: 0.4755, test_loss: 1.8788, test_f1: 0.5970
 epoch: 40, train_loss: 0.4742, test_loss: 2.0015, test_f1: 0.6113
 epoch: 41, train_loss: 0.4751, test_loss: 1.8393, test_f1: 0.5952
 epoch: 42, train_loss: 0.4674, test_loss: 1.7787, test_f1: 0.6297
 epoch: 43, train_loss: 0.4672, test_loss: 2.0114, test_f1: 0.6039
 epoch: 44, train_loss: 0.4472, test_loss: 1.7850, test_f1: 0.5983
 epoch: 45, train_loss: 0.4380, test_loss: 1.7442, test_f1: 0.5960
 epoch: 46, train_loss: 0.4391, test_loss: 1.6808, test_f1: 0.6338
 epoch: 47, train_loss: 0.4651, test_loss: 1.7501, test_f1: 0.5895
 epoch: 48, train_loss: 0.4283, test_loss: 1.9755, test_f1: 0.5720
 epoch: 49, train_loss: 0.4742, test_loss: 1.8469, test_f1: 0.6047
 epoch: 50, train_loss: 0.4047, test_loss: 1.9363, test_f1: 0.6001
 epoch: 51, train_loss: 0.3790, test_loss: 1.9749, test_f1: 0.6041
 epoch: 52, train_loss: 0.3563, test_loss: 1.9910, test_f1: 0.6095
 epoch: 53, train_loss: 0.3360, test_loss: 2.2653, test_f1: 0.6030
 epoch: 54, train_loss: 0.3274, test_loss: 2.0430, test_f1: 0.5907
 epoch: 55, train_loss: 0.3459, test_loss: 2.3450, test_f1: 0.5633
 epoch: 56, train_loss: 0.3173, test_loss: 2.4283, test_f1: 0.6022
 epoch: 57, train_loss: 0.3056, test_loss: 2.6282, test_f1: 0.5744
 epoch: 58, train_loss: 0.3246, test_loss: 2.3611, test_f1: 0.5822
 epoch: 59, train_loss: 0.3192, test_loss: 2.2376, test_f1: 0.6045
 epoch: 60, train_loss: 0.3007, test_loss: 2.4685, test_f1: 0.5854
 epoch: 61, train_loss: 0.2889, test_loss: 2.5881, test_f1: 0.5832
 epoch: 62, train_loss: 0.2721, test_loss: 2.1958, test_f1: 0.6000
 epoch: 63, train_loss: 0.2765, test_loss: 2.2967, test_f1: 0.5937
 epoch: 64, train_loss: 0.2835, test_loss: 2.4878, test_f1: 0.5704
 epoch: 65, train_loss: 0.3158, test_loss: 2.2011, test_f1: 0.6320
 epoch: 66, train_loss: 0.2907, test_loss: 2.2556, test_f1: 0.5999
 epoch: 67, train_loss: 0.2832, test_loss: 2.4314, test_f1: 0.5831
 epoch: 68, train_loss: 0.2445, test_loss: 2.6993, test_f1: 0.5886
 epoch: 69, train_loss: 0.3139, test_loss: 2.5553, test_f1: 0.5991
 epoch: 70, train_loss: 0.2563, test_loss: 2.9229, test_f1: 0.5792
 epoch: 71, train_loss: 0.2337, test_loss: 2.4709, test_f1: 0.5949
 epoch: 72, train_loss: 0.2584, test_loss: 2.8986, test_f1: 0.5791
 epoch: 73, train_loss: 0.2466, test_loss: 2.7907, test_f1: 0.5838
 epoch: 74, train_loss: 0.2660, test_loss: 2.9700, test_f1: 0.5861
 epoch: 75, train_loss: 0.2437, test_loss: 2.7447, test_f1: 0.6097
 epoch: 76, train_loss: 0.2254, test_loss: 2.6702, test_f1: 0.6015
 epoch: 77, train_loss: 0.2237, test_loss: 2.9478, test_f1: 0.5733
 epoch: 78, train_loss: 0.2265, test_loss: 2.8615, test_f1: 0.5977
 epoch: 79, train_loss: 0.2312, test_loss: 2.7275, test_f1: 0.6203
 epoch: 80, train_loss: 0.2363, test_loss: 2.6282, test_f1: 0.6022
 epoch: 81, train_loss: 0.2502, test_loss: 3.1131, test_f1: 0.5786
 epoch: 82, train_loss: 0.2866, test_loss: 2.7245, test_f1: 0.5734
 epoch: 83, train_loss: 0.2867, test_loss: 2.8390, test_f1: 0.5972
 epoch: 84, train_loss: 0.2454, test_loss: 2.6410, test_f1: 0.6101
 epoch: 85, train_loss: 0.2164, test_loss: 2.8141, test_f1: 0.5751
 epoch: 86, train_loss: 0.2201, test_loss: 2.6885, test_f1: 0.5885
 epoch: 87, train_loss: 0.2173, test_loss: 2.7549, test_f1: 0.5816
 epoch: 88, train_loss: 0.2196, test_loss: 2.8067, test_f1: 0.5804
 epoch: 89, train_loss: 0.2038, test_loss: 2.6544, test_f1: 0.6005
 epoch: 90, train_loss: 0.2042, test_loss: 2.5535, test_f1: 0.5999
 epoch: 91, train_loss: 0.2673, test_loss: 3.0160, test_f1: 0.5862
 epoch: 92, train_loss: 0.2626, test_loss: 2.6640, test_f1: 0.5717
 epoch: 93, train_loss: 0.2067, test_loss: 2.5417, test_f1: 0.5645
 epoch: 94, train_loss: 0.1843, test_loss: 2.5265, test_f1: 0.5791
 epoch: 95, train_loss: 0.1879, test_loss: 2.5307, test_f1: 0.5945
 epoch: 96, train_loss: 0.1884, test_loss: 2.8687, test_f1: 0.6089
 epoch: 97, train_loss: 0.2043, test_loss: 2.8331, test_f1: 0.6055
 epoch: 98, train_loss: 0.1793, test_loss: 2.9146, test_f1: 0.5753
 epoch: 99, train_loss: 0.1591, test_loss: 2.9785, test_f1: 0.6068
##################ITERATION #4 ****************************************
 epoch: 0, train_loss: 1.1821, test_loss: 1.3625, test_f1: 0.2063
 epoch: 1, train_loss: 1.0535, test_loss: 1.6256, test_f1: 0.1749
 epoch: 2, train_loss: 0.9782, test_loss: 1.2884, test_f1: 0.3869
 epoch: 3, train_loss: 0.9381, test_loss: 1.1977, test_f1: 0.4756
 epoch: 4, train_loss: 0.9298, test_loss: 1.1465, test_f1: 0.5433
 epoch: 5, train_loss: 0.8884, test_loss: 1.1043, test_f1: 0.5495
 epoch: 6, train_loss: 0.8889, test_loss: 1.0597, test_f1: 0.5596
 epoch: 7, train_loss: 0.8415, test_loss: 1.0723, test_f1: 0.5269
 epoch: 8, train_loss: 0.8472, test_loss: 1.0297, test_f1: 0.5897
 epoch: 9, train_loss: 0.8325, test_loss: 1.0654, test_f1: 0.5710
 epoch: 10, train_loss: 0.8230, test_loss: 1.1913, test_f1: 0.5612
 epoch: 11, train_loss: 0.8151, test_loss: 1.1908, test_f1: 0.5391
 epoch: 12, train_loss: 0.8275, test_loss: 1.1653, test_f1: 0.5432
 epoch: 13, train_loss: 0.8097, test_loss: 1.2692, test_f1: 0.5433
 epoch: 14, train_loss: 0.7899, test_loss: 1.1653, test_f1: 0.5574
 epoch: 15, train_loss: 0.7894, test_loss: 1.0526, test_f1: 0.5678
 epoch: 16, train_loss: 0.7850, test_loss: 1.1658, test_f1: 0.5430
 epoch: 17, train_loss: 0.7648, test_loss: 1.4209, test_f1: 0.5536
 epoch: 18, train_loss: 0.7779, test_loss: 1.2488, test_f1: 0.5944
 epoch: 19, train_loss: 0.7456, test_loss: 1.1686, test_f1: 0.5746
 epoch: 20, train_loss: 0.7306, test_loss: 1.3057, test_f1: 0.5547
 epoch: 21, train_loss: 0.7094, test_loss: 1.3198, test_f1: 0.5742
 epoch: 22, train_loss: 0.7109, test_loss: 1.2761, test_f1: 0.6213
 epoch: 23, train_loss: 0.6989, test_loss: 1.2638, test_f1: 0.5761
 epoch: 24, train_loss: 0.6737, test_loss: 1.2646, test_f1: 0.5832
 epoch: 25, train_loss: 0.6806, test_loss: 1.2878, test_f1: 0.5313
 epoch: 26, train_loss: 0.6555, test_loss: 1.2490, test_f1: 0.5801
 epoch: 27, train_loss: 0.6460, test_loss: 1.2935, test_f1: 0.6198
 epoch: 28, train_loss: 0.6217, test_loss: 1.2768, test_f1: 0.6016
 epoch: 29, train_loss: 0.6092, test_loss: 1.3342, test_f1: 0.5715
 epoch: 30, train_loss: 0.6102, test_loss: 1.4006, test_f1: 0.5772
 epoch: 31, train_loss: 0.6017, test_loss: 1.4631, test_f1: 0.6070
 epoch: 32, train_loss: 0.6384, test_loss: 1.4715, test_f1: 0.5917
 epoch: 33, train_loss: 0.6680, test_loss: 1.3284, test_f1: 0.5930
 epoch: 34, train_loss: 0.6079, test_loss: 1.4588, test_f1: 0.5980
 epoch: 35, train_loss: 0.5934, test_loss: 1.2129, test_f1: 0.6296
 epoch: 36, train_loss: 0.5794, test_loss: 1.5378, test_f1: 0.5541
 epoch: 37, train_loss: 0.5397, test_loss: 1.5501, test_f1: 0.5726
 epoch: 38, train_loss: 0.5537, test_loss: 1.6131, test_f1: 0.5913
 epoch: 39, train_loss: 0.5580, test_loss: 1.2847, test_f1: 0.6661
 epoch: 40, train_loss: 0.5561, test_loss: 1.5583, test_f1: 0.6142
 epoch: 41, train_loss: 0.5133, test_loss: 1.3978, test_f1: 0.6105
 epoch: 42, train_loss: 0.5218, test_loss: 1.6660, test_f1: 0.5781
 epoch: 43, train_loss: 0.5120, test_loss: 1.7282, test_f1: 0.5786
 epoch: 44, train_loss: 0.5156, test_loss: 1.5128, test_f1: 0.6061
 epoch: 45, train_loss: 0.5207, test_loss: 1.7318, test_f1: 0.6056
 epoch: 46, train_loss: 0.5305, test_loss: 1.6529, test_f1: 0.6134
 epoch: 47, train_loss: 0.5066, test_loss: 1.6504, test_f1: 0.5952
 epoch: 48, train_loss: 0.4808, test_loss: 1.6166, test_f1: 0.6146
 epoch: 49, train_loss: 0.4553, test_loss: 1.6489, test_f1: 0.6262
 epoch: 50, train_loss: 0.4742, test_loss: 1.8715, test_f1: 0.5834
 epoch: 51, train_loss: 0.4180, test_loss: 1.7087, test_f1: 0.5840
 epoch: 52, train_loss: 0.4032, test_loss: 1.6614, test_f1: 0.6002
 epoch: 53, train_loss: 0.3623, test_loss: 1.8063, test_f1: 0.6088
 epoch: 54, train_loss: 0.3863, test_loss: 1.7332, test_f1: 0.6268
 epoch: 55, train_loss: 0.3494, test_loss: 1.9915, test_f1: 0.6097
 epoch: 56, train_loss: 0.3775, test_loss: 1.7527, test_f1: 0.6255
 epoch: 57, train_loss: 0.3842, test_loss: 1.9294, test_f1: 0.6183
 epoch: 58, train_loss: 0.3573, test_loss: 1.9973, test_f1: 0.6151
 epoch: 59, train_loss: 0.3542, test_loss: 1.9269, test_f1: 0.6314
 epoch: 60, train_loss: 0.3417, test_loss: 1.8655, test_f1: 0.6035
 epoch: 61, train_loss: 0.3101, test_loss: 2.0795, test_f1: 0.6041
 epoch: 62, train_loss: 0.3286, test_loss: 1.8807, test_f1: 0.6232
 epoch: 63, train_loss: 0.3272, test_loss: 1.9884, test_f1: 0.6212
 epoch: 64, train_loss: 0.3195, test_loss: 2.1539, test_f1: 0.5975
 epoch: 65, train_loss: 0.3322, test_loss: 2.1104, test_f1: 0.6365
 epoch: 66, train_loss: 0.3002, test_loss: 2.1355, test_f1: 0.6188
 epoch: 67, train_loss: 0.3154, test_loss: 2.1379, test_f1: 0.6122
 epoch: 68, train_loss: 0.3017, test_loss: 2.1493, test_f1: 0.6002
 epoch: 69, train_loss: 0.2913, test_loss: 2.1409, test_f1: 0.6178
 epoch: 70, train_loss: 0.2620, test_loss: 2.4271, test_f1: 0.6134
 epoch: 71, train_loss: 0.2678, test_loss: 2.2845, test_f1: 0.6277
 epoch: 72, train_loss: 0.2590, test_loss: 2.3953, test_f1: 0.6179
 epoch: 73, train_loss: 0.2908, test_loss: 2.5207, test_f1: 0.6085
 epoch: 74, train_loss: 0.2546, test_loss: 2.4101, test_f1: 0.6370
 epoch: 75, train_loss: 0.2853, test_loss: 2.5673, test_f1: 0.6218
 epoch: 76, train_loss: 0.2644, test_loss: 2.4760, test_f1: 0.6051
 epoch: 77, train_loss: 0.2664, test_loss: 2.4054, test_f1: 0.6016
 epoch: 78, train_loss: 0.2683, test_loss: 2.4950, test_f1: 0.6245
 epoch: 79, train_loss: 0.2506, test_loss: 2.6712, test_f1: 0.6302
 epoch: 80, train_loss: 0.2682, test_loss: 2.4137, test_f1: 0.6119
 epoch: 81, train_loss: 0.2702, test_loss: 2.5288, test_f1: 0.6264
 epoch: 82, train_loss: 0.2694, test_loss: 2.6524, test_f1: 0.6167
 epoch: 83, train_loss: 0.2307, test_loss: 2.6121, test_f1: 0.6265
 epoch: 84, train_loss: 0.2410, test_loss: 2.6639, test_f1: 0.6063
 epoch: 85, train_loss: 0.2250, test_loss: 2.6344, test_f1: 0.6208
 epoch: 86, train_loss: 0.2287, test_loss: 2.6952, test_f1: 0.6181
 epoch: 87, train_loss: 0.2408, test_loss: 2.7865, test_f1: 0.6091
 epoch: 88, train_loss: 0.2273, test_loss: 2.9028, test_f1: 0.6186
 epoch: 89, train_loss: 0.2488, test_loss: 2.8885, test_f1: 0.6371
 epoch: 90, train_loss: 0.2413, test_loss: 2.8009, test_f1: 0.5937
 epoch: 91, train_loss: 0.2431, test_loss: 3.0143, test_f1: 0.5825
 epoch: 92, train_loss: 0.2555, test_loss: 2.5581, test_f1: 0.5985
 epoch: 93, train_loss: 0.2577, test_loss: 2.8908, test_f1: 0.6062
 epoch: 94, train_loss: 0.2906, test_loss: 2.9797, test_f1: 0.5966
 epoch: 95, train_loss: 0.2530, test_loss: 2.7435, test_f1: 0.6101
 epoch: 96, train_loss: 0.2041, test_loss: 2.8206, test_f1: 0.5784
 epoch: 97, train_loss: 0.1931, test_loss: 2.8308, test_f1: 0.6067
 epoch: 98, train_loss: 0.2520, test_loss: 2.9551, test_f1: 0.6244
 epoch: 99, train_loss: 0.2182, test_loss: 2.7214, test_f1: 0.6290
##################ITERATION #5 ****************************************
 epoch: 0, train_loss: 1.2078, test_loss: 1.3281, test_f1: 0.2782
 epoch: 1, train_loss: 1.0296, test_loss: 1.3488, test_f1: 0.2071
 epoch: 2, train_loss: 0.9798, test_loss: 1.2215, test_f1: 0.2159
 epoch: 3, train_loss: 0.9359, test_loss: 1.1687, test_f1: 0.3284
 epoch: 4, train_loss: 0.9147, test_loss: 1.1402, test_f1: 0.4606
 epoch: 5, train_loss: 0.8849, test_loss: 1.0596, test_f1: 0.5479
 epoch: 6, train_loss: 0.8704, test_loss: 1.0629, test_f1: 0.5810
 epoch: 7, train_loss: 0.8636, test_loss: 1.0213, test_f1: 0.5858
 epoch: 8, train_loss: 0.8506, test_loss: 1.1157, test_f1: 0.6013
 epoch: 9, train_loss: 0.8329, test_loss: 1.3002, test_f1: 0.5589
 epoch: 10, train_loss: 0.8116, test_loss: 1.0409, test_f1: 0.5784
 epoch: 11, train_loss: 0.8258, test_loss: 1.1633, test_f1: 0.5767
 epoch: 12, train_loss: 0.7749, test_loss: 1.1320, test_f1: 0.5654
 epoch: 13, train_loss: 0.7705, test_loss: 1.1444, test_f1: 0.5698
 epoch: 14, train_loss: 0.7449, test_loss: 1.2254, test_f1: 0.6065
 epoch: 15, train_loss: 0.7320, test_loss: 1.3121, test_f1: 0.5712
 epoch: 16, train_loss: 0.7045, test_loss: 1.3098, test_f1: 0.6161
 epoch: 17, train_loss: 0.7242, test_loss: 1.3735, test_f1: 0.5629
 epoch: 18, train_loss: 0.7358, test_loss: 1.2927, test_f1: 0.5849
 epoch: 19, train_loss: 0.7176, test_loss: 1.2188, test_f1: 0.5902
 epoch: 20, train_loss: 0.6767, test_loss: 1.2630, test_f1: 0.6039
 epoch: 21, train_loss: 0.6842, test_loss: 1.3083, test_f1: 0.5769
 epoch: 22, train_loss: 0.6844, test_loss: 1.4466, test_f1: 0.5768
 epoch: 23, train_loss: 0.7011, test_loss: 1.4213, test_f1: 0.5705
 epoch: 24, train_loss: 0.6596, test_loss: 1.3927, test_f1: 0.6140
 epoch: 25, train_loss: 0.6326, test_loss: 1.7396, test_f1: 0.5412
 epoch: 26, train_loss: 0.6320, test_loss: 1.4629, test_f1: 0.6138
 epoch: 27, train_loss: 0.6457, test_loss: 1.5890, test_f1: 0.5789
 epoch: 28, train_loss: 0.6068, test_loss: 1.4130, test_f1: 0.5868
 epoch: 29, train_loss: 0.5740, test_loss: 1.5642, test_f1: 0.5828
 epoch: 30, train_loss: 0.5823, test_loss: 1.6641, test_f1: 0.5978
 epoch: 31, train_loss: 0.6051, test_loss: 1.6161, test_f1: 0.5657
 epoch: 32, train_loss: 0.5834, test_loss: 1.5500, test_f1: 0.6557
 epoch: 33, train_loss: 0.5575, test_loss: 1.5179, test_f1: 0.5863
 epoch: 34, train_loss: 0.5412, test_loss: 1.7049, test_f1: 0.6025
 epoch: 35, train_loss: 0.5071, test_loss: 1.5644, test_f1: 0.6274
 epoch: 36, train_loss: 0.5272, test_loss: 1.8250, test_f1: 0.6258
 epoch: 37, train_loss: 0.5479, test_loss: 1.6641, test_f1: 0.5972
 epoch: 38, train_loss: 0.5356, test_loss: 1.7038, test_f1: 0.5551
 epoch: 39, train_loss: 0.5354, test_loss: 1.5500, test_f1: 0.5965
 epoch: 40, train_loss: 0.5154, test_loss: 1.7296, test_f1: 0.6091
 epoch: 41, train_loss: 0.4860, test_loss: 1.9169, test_f1: 0.5658
 epoch: 42, train_loss: 0.4556, test_loss: 1.8449, test_f1: 0.5636
 epoch: 43, train_loss: 0.4775, test_loss: 1.7722, test_f1: 0.5946
 epoch: 44, train_loss: 0.4514, test_loss: 1.9295, test_f1: 0.6111
 epoch: 45, train_loss: 0.4388, test_loss: 1.8572, test_f1: 0.5863
 epoch: 46, train_loss: 0.4540, test_loss: 2.2383, test_f1: 0.5972
 epoch: 47, train_loss: 0.4270, test_loss: 2.4887, test_f1: 0.5502
 epoch: 48, train_loss: 0.4431, test_loss: 1.7907, test_f1: 0.6192
 epoch: 49, train_loss: 0.4281, test_loss: 1.9173, test_f1: 0.5944
 epoch: 50, train_loss: 0.4885, test_loss: 1.9058, test_f1: 0.6070
 epoch: 51, train_loss: 0.4221, test_loss: 1.7827, test_f1: 0.6000
 epoch: 52, train_loss: 0.3858, test_loss: 1.8013, test_f1: 0.6075
 epoch: 53, train_loss: 0.3433, test_loss: 1.7567, test_f1: 0.6387
 epoch: 54, train_loss: 0.3335, test_loss: 1.9165, test_f1: 0.6088
 epoch: 55, train_loss: 0.3133, test_loss: 1.8942, test_f1: 0.6204
 epoch: 56, train_loss: 0.3308, test_loss: 2.1148, test_f1: 0.6076
 epoch: 57, train_loss: 0.2977, test_loss: 2.1128, test_f1: 0.5883
 epoch: 58, train_loss: 0.3038, test_loss: 2.1364, test_f1: 0.6215
 epoch: 59, train_loss: 0.2967, test_loss: 2.3695, test_f1: 0.5860
 epoch: 60, train_loss: 0.2729, test_loss: 2.3853, test_f1: 0.6042
 epoch: 61, train_loss: 0.3089, test_loss: 2.3718, test_f1: 0.5980
 epoch: 62, train_loss: 0.3168, test_loss: 2.3283, test_f1: 0.5980
 epoch: 63, train_loss: 0.3098, test_loss: 2.3922, test_f1: 0.6025
 epoch: 64, train_loss: 0.3037, test_loss: 2.0827, test_f1: 0.6369
 epoch: 65, train_loss: 0.2950, test_loss: 2.0393, test_f1: 0.6579
 epoch: 66, train_loss: 0.2974, test_loss: 2.4979, test_f1: 0.5721
 epoch: 67, train_loss: 0.2988, test_loss: 2.5196, test_f1: 0.5883
 epoch: 68, train_loss: 0.2789, test_loss: 2.4813, test_f1: 0.6099
 epoch: 69, train_loss: 0.2463, test_loss: 2.4105, test_f1: 0.6064
 epoch: 70, train_loss: 0.2563, test_loss: 2.4501, test_f1: 0.6059
 epoch: 71, train_loss: 0.2504, test_loss: 2.4985, test_f1: 0.6408
 epoch: 72, train_loss: 0.2804, test_loss: 2.6768, test_f1: 0.5613
 epoch: 73, train_loss: 0.2543, test_loss: 2.6021, test_f1: 0.6036
 epoch: 74, train_loss: 0.2895, test_loss: 2.5298, test_f1: 0.5976
 epoch: 75, train_loss: 0.2429, test_loss: 2.6772, test_f1: 0.5920
 epoch: 76, train_loss: 0.2601, test_loss: 2.4639, test_f1: 0.6296
 epoch: 77, train_loss: 0.2620, test_loss: 2.9020, test_f1: 0.6048
 epoch: 78, train_loss: 0.2283, test_loss: 2.8180, test_f1: 0.6125
 epoch: 79, train_loss: 0.2396, test_loss: 2.8476, test_f1: 0.5992
 epoch: 80, train_loss: 0.2409, test_loss: 2.9140, test_f1: 0.6097
 epoch: 81, train_loss: 0.2612, test_loss: 2.9413, test_f1: 0.6189
 epoch: 82, train_loss: 0.2470, test_loss: 2.9335, test_f1: 0.6191
 epoch: 83, train_loss: 0.2342, test_loss: 2.5835, test_f1: 0.6396
 epoch: 84, train_loss: 0.2253, test_loss: 2.6457, test_f1: 0.6270
 epoch: 85, train_loss: 0.2179, test_loss: 2.6100, test_f1: 0.6512
 epoch: 86, train_loss: 0.2146, test_loss: 2.7767, test_f1: 0.5863
 epoch: 87, train_loss: 0.2520, test_loss: 2.7417, test_f1: 0.6198
 epoch: 88, train_loss: 0.2099, test_loss: 2.6745, test_f1: 0.6468
 epoch: 89, train_loss: 0.2061, test_loss: 3.0336, test_f1: 0.5951
 epoch: 90, train_loss: 0.2101, test_loss: 3.0551, test_f1: 0.5905
 epoch: 91, train_loss: 0.2009, test_loss: 3.3941, test_f1: 0.6161
 epoch: 92, train_loss: 0.1819, test_loss: 3.2912, test_f1: 0.6073
 epoch: 93, train_loss: 0.2027, test_loss: 3.1889, test_f1: 0.6001
 epoch: 94, train_loss: 0.1762, test_loss: 3.1688, test_f1: 0.6133
 epoch: 95, train_loss: 0.1995, test_loss: 3.3309, test_f1: 0.5955
 epoch: 96, train_loss: 0.2006, test_loss: 3.1155, test_f1: 0.6182
 epoch: 97, train_loss: 0.2070, test_loss: 3.2069, test_f1: 0.6284
 epoch: 98, train_loss: 0.2232, test_loss: 3.1839, test_f1: 0.6037
 epoch: 99, train_loss: 0.2323, test_loss: 3.0764, test_f1: 0.5879
##################ITERATION #6 ****************************************
 epoch: 0, train_loss: 1.2113, test_loss: 1.2703, test_f1: 0.2957
 epoch: 1, train_loss: 1.0612, test_loss: 1.2413, test_f1: 0.3297
 epoch: 2, train_loss: 0.9732, test_loss: 1.1865, test_f1: 0.4212
 epoch: 3, train_loss: 0.9336, test_loss: 1.1129, test_f1: 0.4743
 epoch: 4, train_loss: 0.9263, test_loss: 1.0552, test_f1: 0.4776
 epoch: 5, train_loss: 0.9103, test_loss: 1.1099, test_f1: 0.4922
 epoch: 6, train_loss: 0.8806, test_loss: 1.0927, test_f1: 0.5329
 epoch: 7, train_loss: 0.8552, test_loss: 1.0023, test_f1: 0.5718
 epoch: 8, train_loss: 0.8389, test_loss: 1.0715, test_f1: 0.5635
 epoch: 9, train_loss: 0.8355, test_loss: 1.1193, test_f1: 0.5599
 epoch: 10, train_loss: 0.8528, test_loss: 1.1682, test_f1: 0.5486
 epoch: 11, train_loss: 0.8261, test_loss: 1.0471, test_f1: 0.5604
 epoch: 12, train_loss: 0.8169, test_loss: 1.1186, test_f1: 0.5518
 epoch: 13, train_loss: 0.7613, test_loss: 1.0123, test_f1: 0.5594
 epoch: 14, train_loss: 0.7352, test_loss: 1.2425, test_f1: 0.5851
 epoch: 15, train_loss: 0.7361, test_loss: 1.3405, test_f1: 0.5248
 epoch: 16, train_loss: 0.7446, test_loss: 1.2386, test_f1: 0.5636
 epoch: 17, train_loss: 0.7436, test_loss: 1.3960, test_f1: 0.5751
 epoch: 18, train_loss: 0.7208, test_loss: 1.2862, test_f1: 0.5797
 epoch: 19, train_loss: 0.7303, test_loss: 1.3565, test_f1: 0.5513
 epoch: 20, train_loss: 0.7005, test_loss: 1.3023, test_f1: 0.5326
 epoch: 21, train_loss: 0.6925, test_loss: 1.4041, test_f1: 0.5489
 epoch: 22, train_loss: 0.6595, test_loss: 1.2201, test_f1: 0.6102
 epoch: 23, train_loss: 0.6522, test_loss: 1.2947, test_f1: 0.5886
 epoch: 24, train_loss: 0.6444, test_loss: 1.2942, test_f1: 0.5972
 epoch: 25, train_loss: 0.6252, test_loss: 1.5033, test_f1: 0.5721
 epoch: 26, train_loss: 0.6081, test_loss: 1.4106, test_f1: 0.5896
 epoch: 27, train_loss: 0.5972, test_loss: 1.5820, test_f1: 0.5740
 epoch: 28, train_loss: 0.5991, test_loss: 1.4870, test_f1: 0.5433
 epoch: 29, train_loss: 0.5541, test_loss: 1.6811, test_f1: 0.5933
 epoch: 30, train_loss: 0.5856, test_loss: 1.6366, test_f1: 0.6000
 epoch: 31, train_loss: 0.5990, test_loss: 1.6697, test_f1: 0.5579
 epoch: 32, train_loss: 0.6001, test_loss: 1.5903, test_f1: 0.5835
 epoch: 33, train_loss: 0.5784, test_loss: 1.5152, test_f1: 0.5945
 epoch: 34, train_loss: 0.5520, test_loss: 1.7356, test_f1: 0.5900
 epoch: 35, train_loss: 0.5572, test_loss: 1.5227, test_f1: 0.5689
 epoch: 36, train_loss: 0.5442, test_loss: 1.3394, test_f1: 0.6314
 epoch: 37, train_loss: 0.5150, test_loss: 1.5607, test_f1: 0.5933
 epoch: 38, train_loss: 0.4985, test_loss: 1.6793, test_f1: 0.5936
 epoch: 39, train_loss: 0.4775, test_loss: 1.5676, test_f1: 0.5959
 epoch: 40, train_loss: 0.4807, test_loss: 1.7668, test_f1: 0.5991
 epoch: 41, train_loss: 0.4781, test_loss: 1.8973, test_f1: 0.6257
 epoch: 42, train_loss: 0.4941, test_loss: 2.0663, test_f1: 0.5654
 epoch: 43, train_loss: 0.4895, test_loss: 1.7778, test_f1: 0.5866
 epoch: 44, train_loss: 0.4798, test_loss: 1.6571, test_f1: 0.5826
 epoch: 45, train_loss: 0.4774, test_loss: 1.8925, test_f1: 0.5900
 epoch: 46, train_loss: 0.4191, test_loss: 1.8058, test_f1: 0.5471
 epoch: 47, train_loss: 0.4579, test_loss: 1.8825, test_f1: 0.5959
 epoch: 48, train_loss: 0.4204, test_loss: 2.0340, test_f1: 0.6200
 epoch: 49, train_loss: 0.3988, test_loss: 2.0493, test_f1: 0.5925
 epoch: 50, train_loss: 0.4104, test_loss: 2.0817, test_f1: 0.6079
 epoch: 51, train_loss: 0.3968, test_loss: 1.9906, test_f1: 0.6163
 epoch: 52, train_loss: 0.3440, test_loss: 2.0718, test_f1: 0.5908
 epoch: 53, train_loss: 0.3153, test_loss: 2.2328, test_f1: 0.5852
 epoch: 54, train_loss: 0.3435, test_loss: 2.1464, test_f1: 0.5856
 epoch: 55, train_loss: 0.3426, test_loss: 2.4032, test_f1: 0.5849
 epoch: 56, train_loss: 0.3355, test_loss: 2.2073, test_f1: 0.5956
 epoch: 57, train_loss: 0.3040, test_loss: 2.2830, test_f1: 0.5825
 epoch: 58, train_loss: 0.2854, test_loss: 2.4466, test_f1: 0.6124
 epoch: 59, train_loss: 0.2920, test_loss: 2.3877, test_f1: 0.6037
 epoch: 60, train_loss: 0.2798, test_loss: 2.4597, test_f1: 0.6085
 epoch: 61, train_loss: 0.2552, test_loss: 2.6459, test_f1: 0.5894
 epoch: 62, train_loss: 0.2456, test_loss: 2.4355, test_f1: 0.6108
 epoch: 63, train_loss: 0.2493, test_loss: 2.5398, test_f1: 0.5824
 epoch: 64, train_loss: 0.2698, test_loss: 2.6768, test_f1: 0.5982
 epoch: 65, train_loss: 0.2414, test_loss: 2.7114, test_f1: 0.5492
 epoch: 66, train_loss: 0.2809, test_loss: 2.9933, test_f1: 0.5843
 epoch: 67, train_loss: 0.2596, test_loss: 2.7866, test_f1: 0.5745
 epoch: 68, train_loss: 0.2439, test_loss: 2.9802, test_f1: 0.5747
 epoch: 69, train_loss: 0.2306, test_loss: 2.6720, test_f1: 0.5870
 epoch: 70, train_loss: 0.2953, test_loss: 3.2038, test_f1: 0.5537
 epoch: 71, train_loss: 0.2829, test_loss: 2.6003, test_f1: 0.5597
 epoch: 72, train_loss: 0.2672, test_loss: 2.6378, test_f1: 0.5673
 epoch: 73, train_loss: 0.2592, test_loss: 2.8548, test_f1: 0.5797
 epoch: 74, train_loss: 0.2537, test_loss: 2.9729, test_f1: 0.5542
 epoch: 75, train_loss: 0.2675, test_loss: 2.5590, test_f1: 0.5740
 epoch: 76, train_loss: 0.2633, test_loss: 2.5031, test_f1: 0.5825
 epoch: 77, train_loss: 0.2753, test_loss: 2.6023, test_f1: 0.5857
 epoch: 78, train_loss: 0.2518, test_loss: 2.7875, test_f1: 0.5751
 epoch: 79, train_loss: 0.2330, test_loss: 2.6509, test_f1: 0.5909
 epoch: 80, train_loss: 0.2361, test_loss: 3.0833, test_f1: 0.5754
 epoch: 81, train_loss: 0.2174, test_loss: 2.8535, test_f1: 0.5920
 epoch: 82, train_loss: 0.2123, test_loss: 2.9986, test_f1: 0.5563
 epoch: 83, train_loss: 0.2428, test_loss: 3.0441, test_f1: 0.5785
 epoch: 84, train_loss: 0.2157, test_loss: 3.0036, test_f1: 0.5719
 epoch: 85, train_loss: 0.2675, test_loss: 3.0113, test_f1: 0.5806
 epoch: 86, train_loss: 0.2171, test_loss: 2.8102, test_f1: 0.5884
 epoch: 87, train_loss: 0.2036, test_loss: 2.9312, test_f1: 0.5699
 epoch: 88, train_loss: 0.2274, test_loss: 2.9496, test_f1: 0.5670
 epoch: 89, train_loss: 0.2690, test_loss: 3.3278, test_f1: 0.5537
 epoch: 90, train_loss: 0.2675, test_loss: 3.3037, test_f1: 0.5968
 epoch: 91, train_loss: 0.2737, test_loss: 3.4706, test_f1: 0.5768
 epoch: 92, train_loss: 0.2389, test_loss: 3.0855, test_f1: 0.5530
 epoch: 93, train_loss: 0.2266, test_loss: 3.2225, test_f1: 0.5608
 epoch: 94, train_loss: 0.2251, test_loss: 2.9630, test_f1: 0.5764
 epoch: 95, train_loss: 0.2194, test_loss: 3.2021, test_f1: 0.5759
 epoch: 96, train_loss: 0.2071, test_loss: 3.0629, test_f1: 0.5665
 epoch: 97, train_loss: 0.1959, test_loss: 3.0749, test_f1: 0.5708
 epoch: 98, train_loss: 0.1904, test_loss: 3.4976, test_f1: 0.5819
 epoch: 99, train_loss: 0.1897, test_loss: 3.4636, test_f1: 0.5732
##################ITERATION #7 ****************************************
 epoch: 0, train_loss: 1.2936, test_loss: 1.3444, test_f1: 0.1365
 epoch: 1, train_loss: 1.0719, test_loss: 1.3263, test_f1: 0.1965
 epoch: 2, train_loss: 1.0261, test_loss: 1.2811, test_f1: 0.2701
 epoch: 3, train_loss: 0.9783, test_loss: 1.1988, test_f1: 0.4277
 epoch: 4, train_loss: 0.9894, test_loss: 1.0744, test_f1: 0.5143
 epoch: 5, train_loss: 0.9183, test_loss: 1.1011, test_f1: 0.5269
 epoch: 6, train_loss: 0.8950, test_loss: 1.1001, test_f1: 0.5302
 epoch: 7, train_loss: 0.8831, test_loss: 1.0826, test_f1: 0.5163
 epoch: 8, train_loss: 0.8490, test_loss: 1.1144, test_f1: 0.5686
 epoch: 9, train_loss: 0.8517, test_loss: 1.1941, test_f1: 0.5512
 epoch: 10, train_loss: 0.8364, test_loss: 1.0256, test_f1: 0.5909
 epoch: 11, train_loss: 0.8126, test_loss: 1.1217, test_f1: 0.5801
 epoch: 12, train_loss: 0.7993, test_loss: 1.0716, test_f1: 0.5780
 epoch: 13, train_loss: 0.7946, test_loss: 1.1685, test_f1: 0.5515
 epoch: 14, train_loss: 0.7767, test_loss: 1.1744, test_f1: 0.5952
 epoch: 15, train_loss: 0.7535, test_loss: 1.1401, test_f1: 0.5941
 epoch: 16, train_loss: 0.7398, test_loss: 1.2519, test_f1: 0.6331
 epoch: 17, train_loss: 0.7233, test_loss: 1.1461, test_f1: 0.5714
 epoch: 18, train_loss: 0.7323, test_loss: 1.2041, test_f1: 0.5849
 epoch: 19, train_loss: 0.7280, test_loss: 1.2130, test_f1: 0.5535
 epoch: 20, train_loss: 0.7556, test_loss: 1.2425, test_f1: 0.5752
 epoch: 21, train_loss: 0.7162, test_loss: 1.1056, test_f1: 0.6355
 epoch: 22, train_loss: 0.7123, test_loss: 1.1891, test_f1: 0.6118
 epoch: 23, train_loss: 0.7154, test_loss: 1.4028, test_f1: 0.5962
 epoch: 24, train_loss: 0.6758, test_loss: 1.3626, test_f1: 0.5883
 epoch: 25, train_loss: 0.6628, test_loss: 1.2230, test_f1: 0.6482
 epoch: 26, train_loss: 0.6498, test_loss: 1.3421, test_f1: 0.6215
 epoch: 27, train_loss: 0.6504, test_loss: 1.4474, test_f1: 0.6139
 epoch: 28, train_loss: 0.6516, test_loss: 1.2919, test_f1: 0.6348
 epoch: 29, train_loss: 0.6620, test_loss: 1.3783, test_f1: 0.6058
 epoch: 30, train_loss: 0.6221, test_loss: 1.3157, test_f1: 0.6457
 epoch: 31, train_loss: 0.5774, test_loss: 1.2917, test_f1: 0.5878
 epoch: 32, train_loss: 0.5686, test_loss: 1.3587, test_f1: 0.6525
 epoch: 33, train_loss: 0.5693, test_loss: 1.4742, test_f1: 0.6375
 epoch: 34, train_loss: 0.6213, test_loss: 1.5591, test_f1: 0.6072
 epoch: 35, train_loss: 0.5649, test_loss: 1.5643, test_f1: 0.5947
 epoch: 36, train_loss: 0.5427, test_loss: 1.7306, test_f1: 0.5958
 epoch: 37, train_loss: 0.5420, test_loss: 1.5928, test_f1: 0.6275
 epoch: 38, train_loss: 0.5174, test_loss: 1.5579, test_f1: 0.6417
 epoch: 39, train_loss: 0.5451, test_loss: 1.4353, test_f1: 0.5810
 epoch: 40, train_loss: 0.4921, test_loss: 1.6384, test_f1: 0.5981
 epoch: 41, train_loss: 0.5008, test_loss: 1.5817, test_f1: 0.6112
 epoch: 42, train_loss: 0.4941, test_loss: 1.5239, test_f1: 0.6578
 epoch: 43, train_loss: 0.4981, test_loss: 1.3912, test_f1: 0.6353
 epoch: 44, train_loss: 0.5263, test_loss: 1.3920, test_f1: 0.6145
 epoch: 45, train_loss: 0.5072, test_loss: 1.3559, test_f1: 0.6291
 epoch: 46, train_loss: 0.4672, test_loss: 1.5333, test_f1: 0.6082
 epoch: 47, train_loss: 0.4245, test_loss: 1.7253, test_f1: 0.5490
 epoch: 48, train_loss: 0.4591, test_loss: 1.5281, test_f1: 0.5964
 epoch: 49, train_loss: 0.4396, test_loss: 1.6357, test_f1: 0.6215
 epoch: 50, train_loss: 0.4282, test_loss: 1.7452, test_f1: 0.6054
 epoch: 51, train_loss: 0.3818, test_loss: 1.9617, test_f1: 0.6009
 epoch: 52, train_loss: 0.3455, test_loss: 1.7154, test_f1: 0.6645
 epoch: 53, train_loss: 0.3488, test_loss: 1.8539, test_f1: 0.6321
 epoch: 54, train_loss: 0.3194, test_loss: 1.8344, test_f1: 0.6277
 epoch: 55, train_loss: 0.3391, test_loss: 2.0165, test_f1: 0.5907
 epoch: 56, train_loss: 0.3283, test_loss: 1.8361, test_f1: 0.6254
 epoch: 57, train_loss: 0.3520, test_loss: 1.8793, test_f1: 0.6198
 epoch: 58, train_loss: 0.3268, test_loss: 1.9436, test_f1: 0.6208
 epoch: 59, train_loss: 0.2988, test_loss: 1.8852, test_f1: 0.6293
 epoch: 60, train_loss: 0.3160, test_loss: 1.9713, test_f1: 0.6242
 epoch: 61, train_loss: 0.3040, test_loss: 2.0506, test_f1: 0.6190
 epoch: 62, train_loss: 0.3117, test_loss: 1.8807, test_f1: 0.6642
 epoch: 63, train_loss: 0.2881, test_loss: 2.0426, test_f1: 0.6193
 epoch: 64, train_loss: 0.2871, test_loss: 2.0235, test_f1: 0.6440
 epoch: 65, train_loss: 0.3214, test_loss: 1.8265, test_f1: 0.6204
 epoch: 66, train_loss: 0.2997, test_loss: 1.9984, test_f1: 0.6028
 epoch: 67, train_loss: 0.3319, test_loss: 1.8518, test_f1: 0.6304
 epoch: 68, train_loss: 0.2831, test_loss: 1.9500, test_f1: 0.6170
 epoch: 69, train_loss: 0.2898, test_loss: 2.1503, test_f1: 0.6085
 epoch: 70, train_loss: 0.2647, test_loss: 2.1153, test_f1: 0.6389
 epoch: 71, train_loss: 0.2670, test_loss: 2.3774, test_f1: 0.6112
 epoch: 72, train_loss: 0.2858, test_loss: 2.4119, test_f1: 0.6080
 epoch: 73, train_loss: 0.2865, test_loss: 2.1839, test_f1: 0.6257
 epoch: 74, train_loss: 0.3084, test_loss: 2.2406, test_f1: 0.5918
 epoch: 75, train_loss: 0.2946, test_loss: 2.1240, test_f1: 0.5820
 epoch: 76, train_loss: 0.2440, test_loss: 2.1690, test_f1: 0.6181
 epoch: 77, train_loss: 0.2305, test_loss: 2.2624, test_f1: 0.6048
 epoch: 78, train_loss: 0.2560, test_loss: 2.2719, test_f1: 0.6272
 epoch: 79, train_loss: 0.2230, test_loss: 2.4309, test_f1: 0.5737
 epoch: 80, train_loss: 0.2005, test_loss: 2.4947, test_f1: 0.6043
 epoch: 81, train_loss: 0.2487, test_loss: 2.7087, test_f1: 0.6156
 epoch: 82, train_loss: 0.2381, test_loss: 2.7204, test_f1: 0.5980
 epoch: 83, train_loss: 0.2202, test_loss: 2.3390, test_f1: 0.6026
 epoch: 84, train_loss: 0.2099, test_loss: 2.6710, test_f1: 0.6163
 epoch: 85, train_loss: 0.2023, test_loss: 2.8010, test_f1: 0.5837
 epoch: 86, train_loss: 0.2326, test_loss: 2.4636, test_f1: 0.6067
 epoch: 87, train_loss: 0.2617, test_loss: 2.5375, test_f1: 0.6112
 epoch: 88, train_loss: 0.2488, test_loss: 2.5096, test_f1: 0.6156
 epoch: 89, train_loss: 0.2241, test_loss: 2.6009, test_f1: 0.5893
 epoch: 90, train_loss: 0.2045, test_loss: 2.8724, test_f1: 0.5882
 epoch: 91, train_loss: 0.2168, test_loss: 2.6928, test_f1: 0.5857
 epoch: 92, train_loss: 0.2133, test_loss: 2.3990, test_f1: 0.6272
 epoch: 93, train_loss: 0.2213, test_loss: 2.4344, test_f1: 0.6227
 epoch: 94, train_loss: 0.2194, test_loss: 2.4882, test_f1: 0.6062
 epoch: 95, train_loss: 0.2372, test_loss: 2.4965, test_f1: 0.6174
 epoch: 96, train_loss: 0.2532, test_loss: 2.4609, test_f1: 0.6138
 epoch: 97, train_loss: 0.2147, test_loss: 2.5979, test_f1: 0.6073
 epoch: 98, train_loss: 0.2328, test_loss: 2.4250, test_f1: 0.5890
 epoch: 99, train_loss: 0.2142, test_loss: 2.4883, test_f1: 0.6103
##################ITERATION #8 ****************************************
 epoch: 0, train_loss: 1.2718, test_loss: 1.3196, test_f1: 0.1365
 epoch: 1, train_loss: 1.1084, test_loss: 1.3139, test_f1: 0.2665
 epoch: 2, train_loss: 1.0034, test_loss: 1.2412, test_f1: 0.3569
 epoch: 3, train_loss: 0.9942, test_loss: 1.1582, test_f1: 0.4546
 epoch: 4, train_loss: 0.9528, test_loss: 1.1706, test_f1: 0.4391
 epoch: 5, train_loss: 0.9177, test_loss: 1.1402, test_f1: 0.5228
 epoch: 6, train_loss: 0.9265, test_loss: 1.1225, test_f1: 0.5339
 epoch: 7, train_loss: 0.8909, test_loss: 1.1683, test_f1: 0.5384
 epoch: 8, train_loss: 0.8689, test_loss: 1.0827, test_f1: 0.5669
 epoch: 9, train_loss: 0.8451, test_loss: 1.1133, test_f1: 0.5676
 epoch: 10, train_loss: 0.8412, test_loss: 1.1080, test_f1: 0.5613
 epoch: 11, train_loss: 0.8120, test_loss: 1.0683, test_f1: 0.5837
 epoch: 12, train_loss: 0.8006, test_loss: 1.0928, test_f1: 0.5691
 epoch: 13, train_loss: 0.7661, test_loss: 1.1227, test_f1: 0.5669
 epoch: 14, train_loss: 0.7640, test_loss: 1.1278, test_f1: 0.5609
 epoch: 15, train_loss: 0.7571, test_loss: 1.1438, test_f1: 0.5844
 epoch: 16, train_loss: 0.7343, test_loss: 1.3227, test_f1: 0.4995
 epoch: 17, train_loss: 0.7897, test_loss: 1.2511, test_f1: 0.5581
 epoch: 18, train_loss: 0.7472, test_loss: 1.0756, test_f1: 0.5861
 epoch: 19, train_loss: 0.7248, test_loss: 1.1973, test_f1: 0.6119
 epoch: 20, train_loss: 0.6974, test_loss: 1.1919, test_f1: 0.5816
 epoch: 21, train_loss: 0.7103, test_loss: 1.1777, test_f1: 0.6366
 epoch: 22, train_loss: 0.6838, test_loss: 1.2912, test_f1: 0.5933
 epoch: 23, train_loss: 0.6898, test_loss: 1.1251, test_f1: 0.6306
 epoch: 24, train_loss: 0.6895, test_loss: 1.2718, test_f1: 0.5704
 epoch: 25, train_loss: 0.6748, test_loss: 1.6228, test_f1: 0.5428
 epoch: 26, train_loss: 0.6503, test_loss: 1.3020, test_f1: 0.6001
 epoch: 27, train_loss: 0.6465, test_loss: 1.2567, test_f1: 0.5884
 epoch: 28, train_loss: 0.6568, test_loss: 1.2890, test_f1: 0.5957
 epoch: 29, train_loss: 0.6293, test_loss: 1.3062, test_f1: 0.5552
 epoch: 30, train_loss: 0.6339, test_loss: 1.3699, test_f1: 0.6224
 epoch: 31, train_loss: 0.6467, test_loss: 1.6374, test_f1: 0.4946
 epoch: 32, train_loss: 0.6238, test_loss: 1.3280, test_f1: 0.6013
 epoch: 33, train_loss: 0.5762, test_loss: 1.3934, test_f1: 0.5987
 epoch: 34, train_loss: 0.5758, test_loss: 1.4321, test_f1: 0.5644
 epoch: 35, train_loss: 0.6350, test_loss: 1.3777, test_f1: 0.6160
 epoch: 36, train_loss: 0.5617, test_loss: 1.6381, test_f1: 0.5912
 epoch: 37, train_loss: 0.6318, test_loss: 1.4144, test_f1: 0.5634
 epoch: 38, train_loss: 0.6365, test_loss: 1.5836, test_f1: 0.5432
 epoch: 39, train_loss: 0.6066, test_loss: 1.4100, test_f1: 0.5497
 epoch: 40, train_loss: 0.5997, test_loss: 1.3833, test_f1: 0.5690
 epoch: 41, train_loss: 0.5645, test_loss: 1.4322, test_f1: 0.6110
 epoch: 42, train_loss: 0.5400, test_loss: 1.4383, test_f1: 0.5594
 epoch: 43, train_loss: 0.5214, test_loss: 1.4260, test_f1: 0.5873
 epoch: 44, train_loss: 0.4791, test_loss: 1.3282, test_f1: 0.6261
 epoch: 45, train_loss: 0.4929, test_loss: 1.5483, test_f1: 0.6052
 epoch: 46, train_loss: 0.4992, test_loss: 1.7671, test_f1: 0.5961
 epoch: 47, train_loss: 0.4945, test_loss: 1.4620, test_f1: 0.6119
 epoch: 48, train_loss: 0.5004, test_loss: 1.6432, test_f1: 0.5817
 epoch: 49, train_loss: 0.5212, test_loss: 1.7183, test_f1: 0.6298
 epoch: 50, train_loss: 0.4781, test_loss: 1.5163, test_f1: 0.6156
 epoch: 51, train_loss: 0.4528, test_loss: 1.6773, test_f1: 0.6208
 epoch: 52, train_loss: 0.4165, test_loss: 1.7195, test_f1: 0.5849
 epoch: 53, train_loss: 0.4067, test_loss: 1.7280, test_f1: 0.5890
 epoch: 54, train_loss: 0.3723, test_loss: 1.6763, test_f1: 0.6082
 epoch: 55, train_loss: 0.3822, test_loss: 1.8864, test_f1: 0.5959
 epoch: 56, train_loss: 0.4012, test_loss: 1.7788, test_f1: 0.6326
 epoch: 57, train_loss: 0.4127, test_loss: 1.7564, test_f1: 0.6163
 epoch: 58, train_loss: 0.4008, test_loss: 2.0258, test_f1: 0.5732
 epoch: 59, train_loss: 0.4168, test_loss: 2.0339, test_f1: 0.6003
 epoch: 60, train_loss: 0.3910, test_loss: 1.8803, test_f1: 0.5898
 epoch: 61, train_loss: 0.3645, test_loss: 1.8478, test_f1: 0.5915
 epoch: 62, train_loss: 0.3582, test_loss: 1.9638, test_f1: 0.5959
 epoch: 63, train_loss: 0.3464, test_loss: 1.9508, test_f1: 0.6133
 epoch: 64, train_loss: 0.3257, test_loss: 1.9910, test_f1: 0.5976
 epoch: 65, train_loss: 0.3336, test_loss: 2.1664, test_f1: 0.5871
 epoch: 66, train_loss: 0.3309, test_loss: 2.0188, test_f1: 0.6047
 epoch: 67, train_loss: 0.2993, test_loss: 2.2220, test_f1: 0.6069
 epoch: 68, train_loss: 0.3168, test_loss: 1.9990, test_f1: 0.6424
 epoch: 69, train_loss: 0.3133, test_loss: 2.3138, test_f1: 0.6159
 epoch: 70, train_loss: 0.3377, test_loss: 1.9825, test_f1: 0.5878
 epoch: 71, train_loss: 0.3343, test_loss: 2.1293, test_f1: 0.6171
 epoch: 72, train_loss: 0.3207, test_loss: 1.9349, test_f1: 0.6217
 epoch: 73, train_loss: 0.3244, test_loss: 1.8862, test_f1: 0.6244
 epoch: 74, train_loss: 0.3004, test_loss: 1.7816, test_f1: 0.6396
 epoch: 75, train_loss: 0.3001, test_loss: 2.0398, test_f1: 0.6265
 epoch: 76, train_loss: 0.2816, test_loss: 2.2615, test_f1: 0.5995
 epoch: 77, train_loss: 0.2921, test_loss: 2.1183, test_f1: 0.6024
 epoch: 78, train_loss: 0.2782, test_loss: 2.1722, test_f1: 0.5910
 epoch: 79, train_loss: 0.2730, test_loss: 2.1979, test_f1: 0.6315
 epoch: 80, train_loss: 0.2927, test_loss: 2.4393, test_f1: 0.6049
 epoch: 81, train_loss: 0.3131, test_loss: 2.5020, test_f1: 0.6124
 epoch: 82, train_loss: 0.3379, test_loss: 2.4579, test_f1: 0.5939
 epoch: 83, train_loss: 0.3282, test_loss: 2.0619, test_f1: 0.6451
 epoch: 84, train_loss: 0.3198, test_loss: 2.2890, test_f1: 0.5981
 epoch: 85, train_loss: 0.3203, test_loss: 2.1205, test_f1: 0.6192
 epoch: 86, train_loss: 0.3204, test_loss: 2.2367, test_f1: 0.5954
 epoch: 87, train_loss: 0.2852, test_loss: 2.2337, test_f1: 0.6243
 epoch: 88, train_loss: 0.2742, test_loss: 2.0894, test_f1: 0.6448
 epoch: 89, train_loss: 0.2546, test_loss: 2.3498, test_f1: 0.6273
 epoch: 90, train_loss: 0.2465, test_loss: 2.1036, test_f1: 0.6295
 epoch: 91, train_loss: 0.2789, test_loss: 2.3468, test_f1: 0.5911
 epoch: 92, train_loss: 0.2348, test_loss: 2.3522, test_f1: 0.6158
 epoch: 93, train_loss: 0.2503, test_loss: 2.2581, test_f1: 0.6493
 epoch: 94, train_loss: 0.2393, test_loss: 2.3417, test_f1: 0.6240
 epoch: 95, train_loss: 0.2624, test_loss: 2.1829, test_f1: 0.6153
 epoch: 96, train_loss: 0.2667, test_loss: 2.5403, test_f1: 0.5800
 epoch: 97, train_loss: 0.2584, test_loss: 2.5115, test_f1: 0.5945
 epoch: 98, train_loss: 0.2786, test_loss: 2.7329, test_f1: 0.6230
 epoch: 99, train_loss: 0.2546, test_loss: 2.5345, test_f1: 0.6312
##################ITERATION #9 ****************************************
 epoch: 0, train_loss: 1.2347, test_loss: 1.3813, test_f1: 0.1365
 epoch: 1, train_loss: 1.0655, test_loss: 1.2945, test_f1: 0.2161
 epoch: 2, train_loss: 0.9814, test_loss: 1.1971, test_f1: 0.2323
 epoch: 3, train_loss: 0.9310, test_loss: 1.1902, test_f1: 0.3800
 epoch: 4, train_loss: 0.9042, test_loss: 1.0638, test_f1: 0.5181
 epoch: 5, train_loss: 0.8787, test_loss: 1.1392, test_f1: 0.5364
 epoch: 6, train_loss: 0.8608, test_loss: 1.1076, test_f1: 0.5004
 epoch: 7, train_loss: 0.8585, test_loss: 1.0683, test_f1: 0.5565
 epoch: 8, train_loss: 0.8524, test_loss: 1.0199, test_f1: 0.5650
 epoch: 9, train_loss: 0.8313, test_loss: 1.0892, test_f1: 0.5697
 epoch: 10, train_loss: 0.8106, test_loss: 1.0096, test_f1: 0.6023
 epoch: 11, train_loss: 0.8293, test_loss: 1.1435, test_f1: 0.5621
 epoch: 12, train_loss: 0.8140, test_loss: 1.0157, test_f1: 0.5765
 epoch: 13, train_loss: 0.8039, test_loss: 1.0413, test_f1: 0.5880
 epoch: 14, train_loss: 0.7603, test_loss: 1.0321, test_f1: 0.5698
 epoch: 15, train_loss: 0.7613, test_loss: 1.0583, test_f1: 0.6036
 epoch: 16, train_loss: 0.7566, test_loss: 1.0841, test_f1: 0.5705
 epoch: 17, train_loss: 0.7645, test_loss: 1.0523, test_f1: 0.6075
 epoch: 18, train_loss: 0.7179, test_loss: 1.1498, test_f1: 0.6175
 epoch: 19, train_loss: 0.7010, test_loss: 1.5615, test_f1: 0.5254
 epoch: 20, train_loss: 0.7105, test_loss: 1.2561, test_f1: 0.6112
 epoch: 21, train_loss: 0.7126, test_loss: 1.2142, test_f1: 0.5601
 epoch: 22, train_loss: 0.7200, test_loss: 1.2808, test_f1: 0.5469
 epoch: 23, train_loss: 0.6765, test_loss: 1.2971, test_f1: 0.6125
 epoch: 24, train_loss: 0.6568, test_loss: 1.3150, test_f1: 0.6120
 epoch: 25, train_loss: 0.6597, test_loss: 1.3113, test_f1: 0.5904
 epoch: 26, train_loss: 0.6422, test_loss: 1.3226, test_f1: 0.6335
 epoch: 27, train_loss: 0.6218, test_loss: 1.3355, test_f1: 0.6328
 epoch: 28, train_loss: 0.6365, test_loss: 1.1907, test_f1: 0.6039
 epoch: 29, train_loss: 0.6631, test_loss: 1.3605, test_f1: 0.5665
 epoch: 30, train_loss: 0.6523, test_loss: 1.2054, test_f1: 0.5867
 epoch: 31, train_loss: 0.6246, test_loss: 1.2374, test_f1: 0.6067
 epoch: 32, train_loss: 0.5866, test_loss: 1.1220, test_f1: 0.6167
 epoch: 33, train_loss: 0.6470, test_loss: 1.3024, test_f1: 0.5447
 epoch: 34, train_loss: 0.6131, test_loss: 1.2363, test_f1: 0.6348
 epoch: 35, train_loss: 0.5763, test_loss: 1.4119, test_f1: 0.5788
 epoch: 36, train_loss: 0.5556, test_loss: 1.3740, test_f1: 0.5989
 epoch: 37, train_loss: 0.5282, test_loss: 1.5190, test_f1: 0.6155
 epoch: 38, train_loss: 0.5395, test_loss: 1.4869, test_f1: 0.5730
 epoch: 39, train_loss: 0.5264, test_loss: 1.7695, test_f1: 0.6045
 epoch: 40, train_loss: 0.5190, test_loss: 1.3881, test_f1: 0.6316
 epoch: 41, train_loss: 0.5187, test_loss: 1.4531, test_f1: 0.6153
 epoch: 42, train_loss: 0.4882, test_loss: 1.8828, test_f1: 0.6006
 epoch: 43, train_loss: 0.4791, test_loss: 1.6713, test_f1: 0.6325
 epoch: 44, train_loss: 0.4709, test_loss: 1.7303, test_f1: 0.5926
 epoch: 45, train_loss: 0.5233, test_loss: 1.7289, test_f1: 0.5858
 epoch: 46, train_loss: 0.5363, test_loss: 1.7001, test_f1: 0.5861
 epoch: 47, train_loss: 0.5056, test_loss: 1.6089, test_f1: 0.6116
 epoch: 48, train_loss: 0.5045, test_loss: 1.5749, test_f1: 0.5999
 epoch: 49, train_loss: 0.4857, test_loss: 1.4264, test_f1: 0.6184
 epoch: 50, train_loss: 0.4594, test_loss: 1.6456, test_f1: 0.5992
 epoch: 51, train_loss: 0.4079, test_loss: 1.5730, test_f1: 0.5868
 epoch: 52, train_loss: 0.3851, test_loss: 1.6965, test_f1: 0.5896
 epoch: 53, train_loss: 0.3565, test_loss: 1.6655, test_f1: 0.6121
 epoch: 54, train_loss: 0.3631, test_loss: 1.7490, test_f1: 0.6155
 epoch: 55, train_loss: 0.3485, test_loss: 1.7314, test_f1: 0.6381
 epoch: 56, train_loss: 0.3357, test_loss: 1.8269, test_f1: 0.6036
 epoch: 57, train_loss: 0.3394, test_loss: 1.8424, test_f1: 0.5860
 epoch: 58, train_loss: 0.3312, test_loss: 1.7796, test_f1: 0.6068
 epoch: 59, train_loss: 0.3380, test_loss: 1.8761, test_f1: 0.6358
 epoch: 60, train_loss: 0.3345, test_loss: 1.8424, test_f1: 0.6155
 epoch: 61, train_loss: 0.3183, test_loss: 1.9285, test_f1: 0.6306
 epoch: 62, train_loss: 0.3269, test_loss: 1.8771, test_f1: 0.5895
 epoch: 63, train_loss: 0.3091, test_loss: 2.0785, test_f1: 0.6036
 epoch: 64, train_loss: 0.3192, test_loss: 1.9117, test_f1: 0.5773
 epoch: 65, train_loss: 0.2764, test_loss: 1.8088, test_f1: 0.6232
 epoch: 66, train_loss: 0.3026, test_loss: 1.9878, test_f1: 0.6391
 epoch: 67, train_loss: 0.2926, test_loss: 1.9820, test_f1: 0.6111
 epoch: 68, train_loss: 0.2745, test_loss: 2.0624, test_f1: 0.6090
 epoch: 69, train_loss: 0.3056, test_loss: 2.0626, test_f1: 0.6223
 epoch: 70, train_loss: 0.3082, test_loss: 2.1748, test_f1: 0.6026
 epoch: 71, train_loss: 0.2854, test_loss: 2.1537, test_f1: 0.6200
 epoch: 72, train_loss: 0.2866, test_loss: 2.2345, test_f1: 0.6012
 epoch: 73, train_loss: 0.2627, test_loss: 2.4149, test_f1: 0.5759
 epoch: 74, train_loss: 0.2612, test_loss: 2.5065, test_f1: 0.5726
 epoch: 75, train_loss: 0.2568, test_loss: 2.3852, test_f1: 0.5960
 epoch: 76, train_loss: 0.2641, test_loss: 2.5565, test_f1: 0.5793
 epoch: 77, train_loss: 0.2524, test_loss: 2.4288, test_f1: 0.5978
 epoch: 78, train_loss: 0.2361, test_loss: 2.3367, test_f1: 0.5767
 epoch: 79, train_loss: 0.2446, test_loss: 2.7464, test_f1: 0.5662
 epoch: 80, train_loss: 0.2119, test_loss: 2.4190, test_f1: 0.5808
 epoch: 81, train_loss: 0.2196, test_loss: 2.5282, test_f1: 0.5971
 epoch: 82, train_loss: 0.2303, test_loss: 2.7174, test_f1: 0.5688
 epoch: 83, train_loss: 0.2324, test_loss: 3.2435, test_f1: 0.5610
 epoch: 84, train_loss: 0.2504, test_loss: 2.6754, test_f1: 0.5913
 epoch: 85, train_loss: 0.2294, test_loss: 2.6896, test_f1: 0.6214
 epoch: 86, train_loss: 0.2543, test_loss: 2.7877, test_f1: 0.5796
 epoch: 87, train_loss: 0.2446, test_loss: 2.9280, test_f1: 0.5793
 epoch: 88, train_loss: 0.2648, test_loss: 2.6553, test_f1: 0.6180
 epoch: 89, train_loss: 0.2917, test_loss: 2.6421, test_f1: 0.5727
 epoch: 90, train_loss: 0.2750, test_loss: 2.7004, test_f1: 0.6100
 epoch: 91, train_loss: 0.2829, test_loss: 2.4966, test_f1: 0.5800
 epoch: 92, train_loss: 0.2334, test_loss: 2.6313, test_f1: 0.5623
 epoch: 93, train_loss: 0.2114, test_loss: 2.7811, test_f1: 0.5676
 epoch: 94, train_loss: 0.2006, test_loss: 2.6008, test_f1: 0.5771
 epoch: 95, train_loss: 0.1992, test_loss: 2.6508, test_f1: 0.6054
 epoch: 96, train_loss: 0.2088, test_loss: 2.5267, test_f1: 0.5995
 epoch: 97, train_loss: 0.2447, test_loss: 2.7696, test_f1: 0.5903
 epoch: 98, train_loss: 0.2359, test_loss: 2.9883, test_f1: 0.5852
 epoch: 99, train_loss: 0.2135, test_loss: 3.2735, test_f1: 0.5839

Training completed in 392.44 seconds
Best F1: 0.6661 at epoch 39
Mean F1 across iterations: 0.6485  0.0118
========================FINAL RESULTS================================
FEGIN weighted F1: 0.6661  0.0118
python main.py --data ltspice_demos --representation component_net --model FEGIN --layers 6 --hiddens 128 --batch_size 128 --lr 0.001 --emb_size 128 --epochs 100 --save_appendix component_net_L6_H128_BS128_LR0.001_E128 --no_val
-----



STDERR:
  File "main.py", line 370, in <module>
    main()
  File "main.py", line 254, in main
    dataset = dataset_class(
  File "/home/philip/projects/ltspice_examples_code_repo/Circuit-Completion-Using-GNNs/component_classification_with_link_prediction_head/evaluation/FEGIN/kernel/circuit_datasets.py", line 15, in __init__
    self.data, self.slices = torch.load(self.processed_paths[0])
  File "/home/philip/.local/lib/python3.8/site-packages/torch/serialization.py", line 1040, in load
    warnings.warn(
  File "/usr/lib/python3.8/warnings.py", line 109, in _showwarnmsg
    sw(msg.message, msg.category, msg.filename, msg.lineno,
  File "main.py", line 47, in warn_with_traceback
    traceback.print_stack(file=log)
/home/philip/projects/ltspice_examples_code_repo/Circuit-Completion-Using-GNNs/component_classification_with_link_prediction_head/evaluation/FEGIN/kernel/circuit_datasets.py:15: FutureWarning: You are using `torch.load` with `weights_only=False` (the current default value), which uses the default pickle module implicitly. It is possible to construct malicious pickle data which will execute arbitrary code during unpickling (See https://github.com/pytorch/pytorch/blob/main/SECURITY.md#untrusted-models for more details). In a future release, the default value for `weights_only` will be flipped to `True`. This limits the functions that could be executed during unpickling. Arbitrary objects will no longer be allowed to be loaded via this mode unless they are explicitly allowlisted by the user via `torch.serialization.add_safe_globals`. We recommend you start setting `weights_only=True` for any use case where you don't have full control of the loaded file. Please open an issue on GitHub for any issues related to this experimental feature.
  self.data, self.slices = torch.load(self.processed_paths[0])
