STDOUT:
Results will be saved in /home/philip/projects/ltspice_examples_code_repo/Circuit-Completion-Using-GNNs/component_classification_with_link_prediction_head/evaluation/FEGIN/results/model_FEGIN_dataset_ltspice_examples
Command line input: python main.py --data ltspice_examples --representation component_pin --model FEGIN --layers 3 --hiddens 16 --batch_size 256 --lr 0.1 --emb_size 128 --epochs 100 --save_appendix component_pin_L3_H16_BS256_LR0.1_E128 --no_val
 is saved.
-----
ltspice_examples - FEGIN
Using 3 layers, 16 hidden units, h = 2
Loading component_pin representation dataset
ENTERED
Training FEGIN on component_pin representation
Train: 3560, Test: 848
##################ITERATION #0 ****************************************
 epoch: 0, train_loss: 1.3298, test_loss: 1.3634, test_f1: 0.2929
 epoch: 1, train_loss: 1.1810, test_loss: 1.2115, test_f1: 0.3090
 epoch: 2, train_loss: 1.0762, test_loss: 1.1098, test_f1: 0.3326
 epoch: 3, train_loss: 1.0563, test_loss: 1.1352, test_f1: 0.3751
 epoch: 4, train_loss: 1.0503, test_loss: 1.2120, test_f1: 0.3528
 epoch: 5, train_loss: 1.0458, test_loss: 1.0823, test_f1: 0.4135
 epoch: 6, train_loss: 1.0386, test_loss: 1.1088, test_f1: 0.4444
 epoch: 7, train_loss: 1.0319, test_loss: 2.0385, test_f1: 0.2224
 epoch: 8, train_loss: 1.0257, test_loss: 1.0344, test_f1: 0.4445
 epoch: 9, train_loss: 1.0182, test_loss: 1.1786, test_f1: 0.4173
 epoch: 10, train_loss: 1.0055, test_loss: 0.9746, test_f1: 0.4631
 epoch: 11, train_loss: 0.9924, test_loss: 0.9849, test_f1: 0.4567
 epoch: 12, train_loss: 0.9833, test_loss: 0.9851, test_f1: 0.4924
 epoch: 13, train_loss: 1.0060, test_loss: 1.0417, test_f1: 0.4710
 epoch: 14, train_loss: 0.9945, test_loss: 1.1295, test_f1: 0.4595
 epoch: 15, train_loss: 1.0084, test_loss: 0.9360, test_f1: 0.4985
 epoch: 16, train_loss: 1.0017, test_loss: 0.9876, test_f1: 0.4710
 epoch: 17, train_loss: 0.9844, test_loss: 1.1412, test_f1: 0.4295
 epoch: 18, train_loss: 0.9660, test_loss: 0.9571, test_f1: 0.4977
 epoch: 19, train_loss: 0.9602, test_loss: 0.9353, test_f1: 0.5121
 epoch: 20, train_loss: 0.9755, test_loss: 0.9900, test_f1: 0.4582
 epoch: 21, train_loss: 0.9325, test_loss: 0.9526, test_f1: 0.5180
 epoch: 22, train_loss: 0.9467, test_loss: 0.9962, test_f1: 0.5072
 epoch: 23, train_loss: 0.9289, test_loss: 1.0584, test_f1: 0.4866
 epoch: 24, train_loss: 0.9190, test_loss: 0.9078, test_f1: 0.4366
 epoch: 25, train_loss: 0.9159, test_loss: 1.0146, test_f1: 0.5057
 epoch: 26, train_loss: 0.9205, test_loss: 1.2331, test_f1: 0.4244
 epoch: 27, train_loss: 0.9584, test_loss: 1.0116, test_f1: 0.4670
 epoch: 28, train_loss: 0.9380, test_loss: 0.9550, test_f1: 0.4869
 epoch: 29, train_loss: 0.9186, test_loss: 0.9288, test_f1: 0.4912
 epoch: 30, train_loss: 0.9451, test_loss: 0.8512, test_f1: 0.5276
 epoch: 31, train_loss: 0.9241, test_loss: 0.9456, test_f1: 0.4860
 epoch: 32, train_loss: 0.9095, test_loss: 0.9402, test_f1: 0.5268
 epoch: 33, train_loss: 0.9123, test_loss: 0.9212, test_f1: 0.5164
 epoch: 34, train_loss: 0.9120, test_loss: 0.9730, test_f1: 0.4353
 epoch: 35, train_loss: 0.9010, test_loss: 0.9571, test_f1: 0.5275
 epoch: 36, train_loss: 0.9271, test_loss: 0.9421, test_f1: 0.4392
 epoch: 37, train_loss: 0.9061, test_loss: 0.9170, test_f1: 0.4950
 epoch: 38, train_loss: 0.9318, test_loss: 0.9652, test_f1: 0.4927
 epoch: 39, train_loss: 0.9284, test_loss: 1.1761, test_f1: 0.5003
 epoch: 40, train_loss: 0.9195, test_loss: 1.0464, test_f1: 0.4828
 epoch: 41, train_loss: 0.9259, test_loss: 1.3151, test_f1: 0.4582
 epoch: 42, train_loss: 0.9144, test_loss: 1.0330, test_f1: 0.4961
 epoch: 43, train_loss: 0.9167, test_loss: 0.9499, test_f1: 0.5640
 epoch: 44, train_loss: 0.9016, test_loss: 0.9716, test_f1: 0.4432
 epoch: 45, train_loss: 0.8898, test_loss: 0.9297, test_f1: 0.4985
 epoch: 46, train_loss: 0.9104, test_loss: 0.9778, test_f1: 0.5150
 epoch: 47, train_loss: 0.8970, test_loss: 0.9551, test_f1: 0.4357
 epoch: 48, train_loss: 0.9002, test_loss: 1.1400, test_f1: 0.4693
 epoch: 49, train_loss: 0.9161, test_loss: 0.9307, test_f1: 0.5048
 epoch: 50, train_loss: 0.9019, test_loss: 0.9255, test_f1: 0.5076
 epoch: 51, train_loss: 0.8804, test_loss: 1.0106, test_f1: 0.5069
 epoch: 52, train_loss: 0.8707, test_loss: 0.8666, test_f1: 0.5425
 epoch: 53, train_loss: 0.8774, test_loss: 0.8816, test_f1: 0.5008
 epoch: 54, train_loss: 0.8677, test_loss: 0.9199, test_f1: 0.5196
 epoch: 55, train_loss: 0.8559, test_loss: 1.0103, test_f1: 0.4853
 epoch: 56, train_loss: 0.8751, test_loss: 0.9320, test_f1: 0.5262
 epoch: 57, train_loss: 0.8708, test_loss: 0.9778, test_f1: 0.4452
 epoch: 58, train_loss: 0.8755, test_loss: 0.9335, test_f1: 0.5206
 epoch: 59, train_loss: 0.8655, test_loss: 0.9025, test_f1: 0.5273
 epoch: 60, train_loss: 0.8597, test_loss: 0.9651, test_f1: 0.5257
 epoch: 61, train_loss: 0.8751, test_loss: 0.8465, test_f1: 0.5635
 epoch: 62, train_loss: 0.8574, test_loss: 1.0016, test_f1: 0.5127
 epoch: 63, train_loss: 0.8384, test_loss: 0.9406, test_f1: 0.5478
 epoch: 64, train_loss: 0.8493, test_loss: 0.9466, test_f1: 0.5614
 epoch: 65, train_loss: 0.8382, test_loss: 0.8942, test_f1: 0.5093
 epoch: 66, train_loss: 0.8404, test_loss: 0.9145, test_f1: 0.5331
 epoch: 67, train_loss: 0.8485, test_loss: 0.9057, test_f1: 0.5183
 epoch: 68, train_loss: 0.8284, test_loss: 0.8868, test_f1: 0.5213
 epoch: 69, train_loss: 0.8420, test_loss: 0.8876, test_f1: 0.4872
 epoch: 70, train_loss: 0.8530, test_loss: 0.8859, test_f1: 0.5070
 epoch: 71, train_loss: 0.8461, test_loss: 1.0225, test_f1: 0.5039
 epoch: 72, train_loss: 0.8248, test_loss: 0.8436, test_f1: 0.5267
 epoch: 73, train_loss: 0.8154, test_loss: 1.0254, test_f1: 0.5162
 epoch: 74, train_loss: 0.8431, test_loss: 0.9538, test_f1: 0.5035
 epoch: 75, train_loss: 0.8432, test_loss: 0.9775, test_f1: 0.5264
 epoch: 76, train_loss: 0.8363, test_loss: 1.1652, test_f1: 0.5176
 epoch: 77, train_loss: 0.8426, test_loss: 1.2396, test_f1: 0.5048
 epoch: 78, train_loss: 0.8224, test_loss: 0.9674, test_f1: 0.5416
 epoch: 79, train_loss: 0.8110, test_loss: 0.9071, test_f1: 0.5258
 epoch: 80, train_loss: 0.8276, test_loss: 1.0111, test_f1: 0.5317
 epoch: 81, train_loss: 0.8263, test_loss: 0.9994, test_f1: 0.5178
 epoch: 82, train_loss: 0.8329, test_loss: 0.9410, test_f1: 0.5179
 epoch: 83, train_loss: 0.8297, test_loss: 0.9806, test_f1: 0.5376
 epoch: 84, train_loss: 0.8125, test_loss: 0.8402, test_f1: 0.5268
 epoch: 85, train_loss: 0.8122, test_loss: 1.6385, test_f1: 0.4645
 epoch: 86, train_loss: 0.8263, test_loss: 1.2228, test_f1: 0.4893
 epoch: 87, train_loss: 0.8207, test_loss: 0.9453, test_f1: 0.5484
 epoch: 88, train_loss: 0.8278, test_loss: 0.9591, test_f1: 0.5214
 epoch: 89, train_loss: 0.8216, test_loss: 1.0132, test_f1: 0.4771
 epoch: 90, train_loss: 0.8229, test_loss: 0.9082, test_f1: 0.5406
 epoch: 91, train_loss: 0.8175, test_loss: 1.2029, test_f1: 0.4286
 epoch: 92, train_loss: 0.8517, test_loss: 1.1129, test_f1: 0.5001
 epoch: 93, train_loss: 0.8386, test_loss: 0.9796, test_f1: 0.5034
 epoch: 94, train_loss: 0.8189, test_loss: 0.9534, test_f1: 0.5518
 epoch: 95, train_loss: 0.8187, test_loss: 0.8675, test_f1: 0.5512
 epoch: 96, train_loss: 0.8341, test_loss: 0.8921, test_f1: 0.5277
 epoch: 97, train_loss: 0.8159, test_loss: 1.0119, test_f1: 0.5633
 epoch: 98, train_loss: 0.8144, test_loss: 0.8942, test_f1: 0.5795
 epoch: 99, train_loss: 0.8317, test_loss: 1.2388, test_f1: 0.4713
##################ITERATION #1 ****************************************
 epoch: 0, train_loss: 1.3439, test_loss: 1.2965, test_f1: 0.2518
 epoch: 1, train_loss: 1.2756, test_loss: 1.2483, test_f1: 0.3009
 epoch: 2, train_loss: 1.2094, test_loss: 1.2511, test_f1: 0.3018
 epoch: 3, train_loss: 1.1361, test_loss: 1.3036, test_f1: 0.3267
 epoch: 4, train_loss: 1.1026, test_loss: 1.1142, test_f1: 0.3391
 epoch: 5, train_loss: 1.0895, test_loss: 1.4022, test_f1: 0.3242
 epoch: 6, train_loss: 1.0817, test_loss: 1.1704, test_f1: 0.3457
 epoch: 7, train_loss: 1.0839, test_loss: 1.3788, test_f1: 0.3156
 epoch: 8, train_loss: 1.0687, test_loss: 1.1485, test_f1: 0.3364
 epoch: 9, train_loss: 1.0857, test_loss: 1.1055, test_f1: 0.3370
 epoch: 10, train_loss: 1.0798, test_loss: 2.9141, test_f1: 0.2288
 epoch: 11, train_loss: 1.0970, test_loss: 1.1145, test_f1: 0.3363
 epoch: 12, train_loss: 1.0915, test_loss: 1.1602, test_f1: 0.3472
 epoch: 13, train_loss: 1.0778, test_loss: 1.5652, test_f1: 0.2860
 epoch: 14, train_loss: 1.0661, test_loss: 1.3039, test_f1: 0.3294
 epoch: 15, train_loss: 1.0607, test_loss: 1.0779, test_f1: 0.3500
 epoch: 16, train_loss: 1.0629, test_loss: 1.2893, test_f1: 0.3442
 epoch: 17, train_loss: 1.0510, test_loss: 1.2239, test_f1: 0.3448
 epoch: 18, train_loss: 1.0421, test_loss: 1.0505, test_f1: 0.3788
 epoch: 19, train_loss: 1.0519, test_loss: 1.2242, test_f1: 0.3431
 epoch: 20, train_loss: 1.0441, test_loss: 1.0480, test_f1: 0.3582
 epoch: 21, train_loss: 1.0375, test_loss: 1.0757, test_f1: 0.3393
 epoch: 22, train_loss: 1.0421, test_loss: 1.1073, test_f1: 0.3925
 epoch: 23, train_loss: 1.0501, test_loss: 1.2371, test_f1: 0.2439
 epoch: 24, train_loss: 1.0533, test_loss: 1.2372, test_f1: 0.3384
 epoch: 25, train_loss: 1.0270, test_loss: 1.1032, test_f1: 0.3347
 epoch: 26, train_loss: 1.0133, test_loss: 1.3172, test_f1: 0.3511
 epoch: 27, train_loss: 1.0046, test_loss: 1.3245, test_f1: 0.3606
 epoch: 28, train_loss: 0.9861, test_loss: 1.2012, test_f1: 0.3503
 epoch: 29, train_loss: 0.9809, test_loss: 0.9988, test_f1: 0.3541
 epoch: 30, train_loss: 0.9765, test_loss: 1.1137, test_f1: 0.3350
 epoch: 31, train_loss: 0.9981, test_loss: 1.1692, test_f1: 0.3443
 epoch: 32, train_loss: 0.9887, test_loss: 1.1977, test_f1: 0.3565
 epoch: 33, train_loss: 1.0191, test_loss: 1.0605, test_f1: 0.4268
 epoch: 34, train_loss: 0.9925, test_loss: 0.9855, test_f1: 0.3533
 epoch: 35, train_loss: 0.9750, test_loss: 1.0689, test_f1: 0.3502
 epoch: 36, train_loss: 0.9870, test_loss: 0.9968, test_f1: 0.3490
 epoch: 37, train_loss: 0.9787, test_loss: 1.1240, test_f1: 0.3371
 epoch: 38, train_loss: 0.9767, test_loss: 1.0384, test_f1: 0.3423
 epoch: 39, train_loss: 1.0126, test_loss: 1.6354, test_f1: 0.3135
 epoch: 40, train_loss: 1.0121, test_loss: 1.0614, test_f1: 0.4425
 epoch: 41, train_loss: 0.9933, test_loss: 1.1226, test_f1: 0.4458
 epoch: 42, train_loss: 1.0035, test_loss: 1.1020, test_f1: 0.4005
 epoch: 43, train_loss: 0.9738, test_loss: 1.1176, test_f1: 0.4896
 epoch: 44, train_loss: 0.9839, test_loss: 1.6721, test_f1: 0.2994
 epoch: 45, train_loss: 0.9695, test_loss: 1.1622, test_f1: 0.3858
 epoch: 46, train_loss: 0.9675, test_loss: 1.0580, test_f1: 0.4738
 epoch: 47, train_loss: 1.0181, test_loss: 1.0216, test_f1: 0.3935
 epoch: 48, train_loss: 0.9835, test_loss: 0.9588, test_f1: 0.4915
 epoch: 49, train_loss: 0.9812, test_loss: 0.9414, test_f1: 0.4524
 epoch: 50, train_loss: 0.9643, test_loss: 1.0176, test_f1: 0.5021
 epoch: 51, train_loss: 0.9448, test_loss: 0.9989, test_f1: 0.5019
 epoch: 52, train_loss: 0.9319, test_loss: 0.9089, test_f1: 0.5066
 epoch: 53, train_loss: 0.9340, test_loss: 0.9477, test_f1: 0.4711
 epoch: 54, train_loss: 0.9434, test_loss: 0.8915, test_f1: 0.4997
 epoch: 55, train_loss: 0.9136, test_loss: 0.9637, test_f1: 0.4682
 epoch: 56, train_loss: 0.9118, test_loss: 1.2765, test_f1: 0.4445
 epoch: 57, train_loss: 0.9058, test_loss: 0.9118, test_f1: 0.5203
 epoch: 58, train_loss: 0.8979, test_loss: 1.0134, test_f1: 0.4139
 epoch: 59, train_loss: 0.9130, test_loss: 0.8963, test_f1: 0.5187
 epoch: 60, train_loss: 0.8941, test_loss: 0.8867, test_f1: 0.5140
 epoch: 61, train_loss: 0.8876, test_loss: 0.9748, test_f1: 0.4885
 epoch: 62, train_loss: 0.8876, test_loss: 0.8724, test_f1: 0.4676
 epoch: 63, train_loss: 0.8860, test_loss: 0.8691, test_f1: 0.5121
 epoch: 64, train_loss: 0.8847, test_loss: 0.9054, test_f1: 0.5302
 epoch: 65, train_loss: 0.9048, test_loss: 1.0634, test_f1: 0.5250
 epoch: 66, train_loss: 0.8889, test_loss: 0.9979, test_f1: 0.4521
 epoch: 67, train_loss: 0.9002, test_loss: 0.9591, test_f1: 0.5090
 epoch: 68, train_loss: 0.8628, test_loss: 1.0774, test_f1: 0.4852
 epoch: 69, train_loss: 0.8848, test_loss: 1.2553, test_f1: 0.4639
 epoch: 70, train_loss: 0.8728, test_loss: 0.9516, test_f1: 0.5072
 epoch: 71, train_loss: 0.8660, test_loss: 0.9781, test_f1: 0.5206
 epoch: 72, train_loss: 0.8586, test_loss: 1.1042, test_f1: 0.5274
 epoch: 73, train_loss: 0.8710, test_loss: 1.1599, test_f1: 0.5209
 epoch: 74, train_loss: 0.8746, test_loss: 0.9212, test_f1: 0.5124
 epoch: 75, train_loss: 0.8656, test_loss: 0.9258, test_f1: 0.5286
 epoch: 76, train_loss: 0.8607, test_loss: 1.0293, test_f1: 0.5303
 epoch: 77, train_loss: 0.8707, test_loss: 0.8817, test_f1: 0.5184
 epoch: 78, train_loss: 0.8671, test_loss: 1.2482, test_f1: 0.5188
 epoch: 79, train_loss: 0.8519, test_loss: 1.0720, test_f1: 0.5216
 epoch: 80, train_loss: 0.8733, test_loss: 0.9936, test_f1: 0.5241
 epoch: 81, train_loss: 0.8552, test_loss: 1.4194, test_f1: 0.4605
 epoch: 82, train_loss: 0.8554, test_loss: 1.0295, test_f1: 0.4893
 epoch: 83, train_loss: 0.8461, test_loss: 0.9930, test_f1: 0.4874
 epoch: 84, train_loss: 0.9167, test_loss: 1.0910, test_f1: 0.4912
 epoch: 85, train_loss: 0.9085, test_loss: 1.3955, test_f1: 0.4311
 epoch: 86, train_loss: 0.8969, test_loss: 1.1388, test_f1: 0.5320
 epoch: 87, train_loss: 0.8780, test_loss: 1.0087, test_f1: 0.5238
 epoch: 88, train_loss: 0.8729, test_loss: 0.9259, test_f1: 0.5104
 epoch: 89, train_loss: 0.8668, test_loss: 1.0540, test_f1: 0.5146
 epoch: 90, train_loss: 0.8705, test_loss: 1.2323, test_f1: 0.5163
 epoch: 91, train_loss: 0.8769, test_loss: 1.2453, test_f1: 0.5212
 epoch: 92, train_loss: 0.8810, test_loss: 1.0403, test_f1: 0.5162
 epoch: 93, train_loss: 0.8818, test_loss: 1.0162, test_f1: 0.5085
 epoch: 94, train_loss: 0.8670, test_loss: 1.1011, test_f1: 0.5208
 epoch: 95, train_loss: 0.8548, test_loss: 1.0160, test_f1: 0.5282
 epoch: 96, train_loss: 0.8468, test_loss: 0.9443, test_f1: 0.5365
 epoch: 97, train_loss: 0.8404, test_loss: 1.0079, test_f1: 0.5224
 epoch: 98, train_loss: 0.8376, test_loss: 1.0634, test_f1: 0.5219
 epoch: 99, train_loss: 0.8491, test_loss: 1.0314, test_f1: 0.5214
##################ITERATION #2 ****************************************
 epoch: 0, train_loss: 1.5497, test_loss: 1.8272, test_f1: 0.2260
 epoch: 1, train_loss: 1.2771, test_loss: 1.2853, test_f1: 0.2260
 epoch: 2, train_loss: 1.2647, test_loss: 1.2784, test_f1: 0.2260
 epoch: 3, train_loss: 1.2646, test_loss: 1.2636, test_f1: 0.2260
 epoch: 4, train_loss: 1.2599, test_loss: 1.2668, test_f1: 0.2260
 epoch: 5, train_loss: 1.2489, test_loss: 1.2320, test_f1: 0.2260
 epoch: 6, train_loss: 1.2532, test_loss: 1.2298, test_f1: 0.2260
 epoch: 7, train_loss: 1.2679, test_loss: 1.2278, test_f1: 0.2260
 epoch: 8, train_loss: 1.2429, test_loss: 1.2367, test_f1: 0.2260
 epoch: 9, train_loss: 1.2221, test_loss: 1.1655, test_f1: 0.3150
 epoch: 10, train_loss: 1.1632, test_loss: 1.2947, test_f1: 0.2824
 epoch: 11, train_loss: 1.1337, test_loss: 1.4213, test_f1: 0.3227
 epoch: 12, train_loss: 1.1030, test_loss: 1.1716, test_f1: 0.3400
 epoch: 13, train_loss: 1.1002, test_loss: 1.1255, test_f1: 0.3352
 epoch: 14, train_loss: 1.0932, test_loss: 1.1083, test_f1: 0.3383
 epoch: 15, train_loss: 1.0698, test_loss: 1.0955, test_f1: 0.3421
 epoch: 16, train_loss: 1.0696, test_loss: 1.0813, test_f1: 0.3521
 epoch: 17, train_loss: 1.0594, test_loss: 1.1203, test_f1: 0.3423
 epoch: 18, train_loss: 1.0504, test_loss: 1.1179, test_f1: 0.3434
 epoch: 19, train_loss: 1.0503, test_loss: 1.3046, test_f1: 0.3084
 epoch: 20, train_loss: 1.0484, test_loss: 1.1491, test_f1: 0.3410
 epoch: 21, train_loss: 1.0466, test_loss: 1.0812, test_f1: 0.3470
 epoch: 22, train_loss: 1.0376, test_loss: 1.2442, test_f1: 0.3093
 epoch: 23, train_loss: 1.0409, test_loss: 1.1224, test_f1: 0.3438
 epoch: 24, train_loss: 1.0372, test_loss: 1.1315, test_f1: 0.3441
 epoch: 25, train_loss: 1.0311, test_loss: 1.3040, test_f1: 0.3205
 epoch: 26, train_loss: 1.0344, test_loss: 1.2023, test_f1: 0.3239
 epoch: 27, train_loss: 1.0421, test_loss: 1.2281, test_f1: 0.3359
 epoch: 28, train_loss: 1.0343, test_loss: 1.1312, test_f1: 0.3431
 epoch: 29, train_loss: 1.0315, test_loss: 1.5004, test_f1: 0.3094
 epoch: 30, train_loss: 1.0323, test_loss: 1.1088, test_f1: 0.3469
 epoch: 31, train_loss: 1.0329, test_loss: 1.2205, test_f1: 0.3410
 epoch: 32, train_loss: 1.0427, test_loss: 1.1360, test_f1: 0.3456
 epoch: 33, train_loss: 1.0478, test_loss: 1.2172, test_f1: 0.3321
 epoch: 34, train_loss: 1.0644, test_loss: 1.3280, test_f1: 0.3251
 epoch: 35, train_loss: 1.0563, test_loss: 1.2736, test_f1: 0.3401
 epoch: 36, train_loss: 1.0479, test_loss: 1.1187, test_f1: 0.3453
 epoch: 37, train_loss: 1.0377, test_loss: 1.4646, test_f1: 0.3461
 epoch: 38, train_loss: 1.0594, test_loss: 1.1477, test_f1: 0.3321
 epoch: 39, train_loss: 1.0537, test_loss: 1.1049, test_f1: 0.3441
 epoch: 40, train_loss: 1.0329, test_loss: 1.1268, test_f1: 0.3292
 epoch: 41, train_loss: 1.0292, test_loss: 1.1304, test_f1: 0.3453
 epoch: 42, train_loss: 1.0429, test_loss: 1.2430, test_f1: 0.3152
 epoch: 43, train_loss: 1.0401, test_loss: 1.1271, test_f1: 0.3316
 epoch: 44, train_loss: 1.0351, test_loss: 1.0982, test_f1: 0.3435
 epoch: 45, train_loss: 1.0259, test_loss: 1.1741, test_f1: 0.3312
 epoch: 46, train_loss: 1.0204, test_loss: 1.1064, test_f1: 0.3445
 epoch: 47, train_loss: 1.0142, test_loss: 1.1898, test_f1: 0.3321
 epoch: 48, train_loss: 1.0489, test_loss: 1.1607, test_f1: 0.3371
 epoch: 49, train_loss: 1.0523, test_loss: 1.3012, test_f1: 0.3240
 epoch: 50, train_loss: 1.0464, test_loss: 1.1271, test_f1: 0.3400
 epoch: 51, train_loss: 1.0220, test_loss: 1.0969, test_f1: 0.3447
 epoch: 52, train_loss: 1.0195, test_loss: 1.1400, test_f1: 0.3381
 epoch: 53, train_loss: 1.0167, test_loss: 1.1111, test_f1: 0.3442
 epoch: 54, train_loss: 1.0125, test_loss: 1.1608, test_f1: 0.3381
 epoch: 55, train_loss: 1.0131, test_loss: 1.1011, test_f1: 0.3505
 epoch: 56, train_loss: 1.0088, test_loss: 1.1451, test_f1: 0.3410
 epoch: 57, train_loss: 1.0055, test_loss: 1.1177, test_f1: 0.3445
 epoch: 58, train_loss: 1.0147, test_loss: 1.1442, test_f1: 0.3417
 epoch: 59, train_loss: 1.0097, test_loss: 1.6371, test_f1: 0.2866
 epoch: 60, train_loss: 0.9992, test_loss: 1.1404, test_f1: 0.3387
 epoch: 61, train_loss: 0.9937, test_loss: 1.1179, test_f1: 0.3426
 epoch: 62, train_loss: 0.9995, test_loss: 1.1051, test_f1: 0.3445
 epoch: 63, train_loss: 1.0088, test_loss: 1.1094, test_f1: 0.3454
 epoch: 64, train_loss: 1.0045, test_loss: 1.1291, test_f1: 0.3473
 epoch: 65, train_loss: 1.0020, test_loss: 1.1351, test_f1: 0.3417
 epoch: 66, train_loss: 0.9897, test_loss: 1.0955, test_f1: 0.3524
 epoch: 67, train_loss: 0.9862, test_loss: 1.1101, test_f1: 0.3479
 epoch: 68, train_loss: 0.9911, test_loss: 1.1872, test_f1: 0.3329
 epoch: 69, train_loss: 0.9945, test_loss: 1.1149, test_f1: 0.3429
 epoch: 70, train_loss: 0.9865, test_loss: 1.1013, test_f1: 0.3526
 epoch: 71, train_loss: 0.9862, test_loss: 1.0932, test_f1: 0.3528
 epoch: 72, train_loss: 0.9832, test_loss: 1.1062, test_f1: 0.3511
 epoch: 73, train_loss: 0.9875, test_loss: 1.1075, test_f1: 0.3526
 epoch: 74, train_loss: 0.9819, test_loss: 1.1174, test_f1: 0.3429
 epoch: 75, train_loss: 0.9956, test_loss: 1.1169, test_f1: 0.3436
 epoch: 76, train_loss: 0.9891, test_loss: 1.1087, test_f1: 0.3529
 epoch: 77, train_loss: 0.9833, test_loss: 1.1343, test_f1: 0.3391
 epoch: 78, train_loss: 0.9737, test_loss: 1.1329, test_f1: 0.3456
 epoch: 79, train_loss: 0.9740, test_loss: 1.1001, test_f1: 0.3426
 epoch: 80, train_loss: 0.9763, test_loss: 1.1101, test_f1: 0.3482
 epoch: 81, train_loss: 0.9746, test_loss: 1.0995, test_f1: 0.3472
 epoch: 82, train_loss: 0.9803, test_loss: 1.0867, test_f1: 0.3543
 epoch: 83, train_loss: 0.9934, test_loss: 1.1143, test_f1: 0.3436
 epoch: 84, train_loss: 0.9734, test_loss: 1.3533, test_f1: 0.3123
 epoch: 85, train_loss: 0.9653, test_loss: 1.1607, test_f1: 0.3398
 epoch: 86, train_loss: 0.9781, test_loss: 1.1412, test_f1: 0.3468
 epoch: 87, train_loss: 0.9988, test_loss: 1.1373, test_f1: 0.3398
 epoch: 88, train_loss: 0.9818, test_loss: 1.1821, test_f1: 0.3361
 epoch: 89, train_loss: 0.9878, test_loss: 1.4754, test_f1: 0.3060
 epoch: 90, train_loss: 1.0200, test_loss: 1.4468, test_f1: 0.2875
 epoch: 91, train_loss: 1.0171, test_loss: 1.2390, test_f1: 0.3352
 epoch: 92, train_loss: 1.0123, test_loss: 1.1042, test_f1: 0.3495
 epoch: 93, train_loss: 1.0049, test_loss: 1.1477, test_f1: 0.3301
 epoch: 94, train_loss: 0.9940, test_loss: 1.1560, test_f1: 0.3525
 epoch: 95, train_loss: 0.9788, test_loss: 1.1042, test_f1: 0.3488
 epoch: 96, train_loss: 0.9889, test_loss: 1.5450, test_f1: 0.2864
 epoch: 97, train_loss: 0.9888, test_loss: 1.0942, test_f1: 0.4432
 epoch: 98, train_loss: 0.9772, test_loss: 1.1056, test_f1: 0.4373
 epoch: 99, train_loss: 0.9741, test_loss: 1.0904, test_f1: 0.4496
##################ITERATION #3 ****************************************
 epoch: 0, train_loss: 1.3602, test_loss: 1.2798, test_f1: 0.2753
 epoch: 1, train_loss: 1.1502, test_loss: 1.1612, test_f1: 0.3204
 epoch: 2, train_loss: 1.1189, test_loss: 1.1247, test_f1: 0.3377
 epoch: 3, train_loss: 1.1123, test_loss: 1.0979, test_f1: 0.3520
 epoch: 4, train_loss: 1.0937, test_loss: 1.0715, test_f1: 0.3447
 epoch: 5, train_loss: 1.0922, test_loss: 1.1821, test_f1: 0.3079
 epoch: 6, train_loss: 1.0918, test_loss: 1.0772, test_f1: 0.3778
 epoch: 7, train_loss: 1.0820, test_loss: 1.0984, test_f1: 0.4176
 epoch: 8, train_loss: 1.0779, test_loss: 1.0760, test_f1: 0.3391
 epoch: 9, train_loss: 1.0695, test_loss: 1.0953, test_f1: 0.3403
 epoch: 10, train_loss: 1.0722, test_loss: 1.0677, test_f1: 0.3410
 epoch: 11, train_loss: 1.0516, test_loss: 1.0551, test_f1: 0.4335
 epoch: 12, train_loss: 1.0477, test_loss: 1.0691, test_f1: 0.3999
 epoch: 13, train_loss: 1.0491, test_loss: 1.0877, test_f1: 0.4048
 epoch: 14, train_loss: 1.0384, test_loss: 1.0920, test_f1: 0.3959
 epoch: 15, train_loss: 1.0437, test_loss: 1.0629, test_f1: 0.3410
 epoch: 16, train_loss: 1.0373, test_loss: 1.0847, test_f1: 0.3937
 epoch: 17, train_loss: 1.0300, test_loss: 1.0732, test_f1: 0.4665
 epoch: 18, train_loss: 1.0412, test_loss: 1.0215, test_f1: 0.3500
 epoch: 19, train_loss: 1.0367, test_loss: 1.0336, test_f1: 0.3429
 epoch: 20, train_loss: 1.0438, test_loss: 1.0979, test_f1: 0.3602
 epoch: 21, train_loss: 1.0300, test_loss: 1.0181, test_f1: 0.3672
 epoch: 22, train_loss: 1.0352, test_loss: 1.0482, test_f1: 0.4464
 epoch: 23, train_loss: 1.0267, test_loss: 1.0264, test_f1: 0.4379
 epoch: 24, train_loss: 1.0161, test_loss: 1.0611, test_f1: 0.4202
 epoch: 25, train_loss: 1.0262, test_loss: 1.0413, test_f1: 0.3497
 epoch: 26, train_loss: 1.0072, test_loss: 1.0707, test_f1: 0.4748
 epoch: 27, train_loss: 1.0091, test_loss: 1.1221, test_f1: 0.3833
 epoch: 28, train_loss: 1.0583, test_loss: 1.0577, test_f1: 0.4527
 epoch: 29, train_loss: 1.0274, test_loss: 1.0700, test_f1: 0.4943
 epoch: 30, train_loss: 1.0026, test_loss: 1.0765, test_f1: 0.4742
 epoch: 31, train_loss: 0.9984, test_loss: 1.0553, test_f1: 0.4508
 epoch: 32, train_loss: 1.0138, test_loss: 1.1404, test_f1: 0.4368
 epoch: 33, train_loss: 1.0190, test_loss: 1.0174, test_f1: 0.4896
 epoch: 34, train_loss: 1.0285, test_loss: 1.0241, test_f1: 0.4614
 epoch: 35, train_loss: 1.0083, test_loss: 1.0907, test_f1: 0.4465
 epoch: 36, train_loss: 1.0171, test_loss: 1.0830, test_f1: 0.4568
 epoch: 37, train_loss: 0.9946, test_loss: 1.1012, test_f1: 0.4429
 epoch: 38, train_loss: 0.9883, test_loss: 1.1040, test_f1: 0.4318
 epoch: 39, train_loss: 0.9750, test_loss: 0.9974, test_f1: 0.5529
 epoch: 40, train_loss: 1.0121, test_loss: 1.1643, test_f1: 0.4605
 epoch: 41, train_loss: 0.9996, test_loss: 1.0150, test_f1: 0.5007
 epoch: 42, train_loss: 0.9829, test_loss: 1.0272, test_f1: 0.5391
 epoch: 43, train_loss: 0.9789, test_loss: 1.1692, test_f1: 0.3192
 epoch: 44, train_loss: 0.9863, test_loss: 1.0020, test_f1: 0.5309
 epoch: 45, train_loss: 0.9832, test_loss: 1.0743, test_f1: 0.4935
 epoch: 46, train_loss: 0.9785, test_loss: 1.0788, test_f1: 0.4541
 epoch: 47, train_loss: 0.9999, test_loss: 1.0147, test_f1: 0.4707
 epoch: 48, train_loss: 0.9884, test_loss: 1.0656, test_f1: 0.4715
 epoch: 49, train_loss: 0.9723, test_loss: 1.0038, test_f1: 0.4790
 epoch: 50, train_loss: 0.9807, test_loss: 1.0014, test_f1: 0.5031
 epoch: 51, train_loss: 0.9509, test_loss: 0.9876, test_f1: 0.5103
 epoch: 52, train_loss: 0.9376, test_loss: 1.0115, test_f1: 0.4769
 epoch: 53, train_loss: 0.9343, test_loss: 0.9755, test_f1: 0.4867
 epoch: 54, train_loss: 0.9241, test_loss: 1.0442, test_f1: 0.4816
 epoch: 55, train_loss: 0.9467, test_loss: 0.9746, test_f1: 0.5149
 epoch: 56, train_loss: 0.9409, test_loss: 0.9893, test_f1: 0.4940
 epoch: 57, train_loss: 0.9234, test_loss: 0.9988, test_f1: 0.4944
 epoch: 58, train_loss: 0.9297, test_loss: 0.9761, test_f1: 0.4979
 epoch: 59, train_loss: 0.9214, test_loss: 0.9784, test_f1: 0.4930
 epoch: 60, train_loss: 0.9231, test_loss: 1.0040, test_f1: 0.4843
 epoch: 61, train_loss: 0.9098, test_loss: 0.9967, test_f1: 0.4788
 epoch: 62, train_loss: 0.9132, test_loss: 0.9684, test_f1: 0.5102
 epoch: 63, train_loss: 0.9017, test_loss: 0.9803, test_f1: 0.5020
 epoch: 64, train_loss: 0.9049, test_loss: 0.9438, test_f1: 0.5535
 epoch: 65, train_loss: 0.8874, test_loss: 0.9786, test_f1: 0.5187
 epoch: 66, train_loss: 0.8996, test_loss: 0.9932, test_f1: 0.5066
 epoch: 67, train_loss: 0.9063, test_loss: 0.9776, test_f1: 0.4825
 epoch: 68, train_loss: 0.9080, test_loss: 0.9648, test_f1: 0.5014
 epoch: 69, train_loss: 0.9209, test_loss: 1.0240, test_f1: 0.5153
 epoch: 70, train_loss: 0.9108, test_loss: 0.9739, test_f1: 0.5472
 epoch: 71, train_loss: 0.9004, test_loss: 0.9771, test_f1: 0.5205
 epoch: 72, train_loss: 0.9108, test_loss: 0.9558, test_f1: 0.5569
 epoch: 73, train_loss: 0.9196, test_loss: 0.9396, test_f1: 0.5265
 epoch: 74, train_loss: 0.9043, test_loss: 0.9541, test_f1: 0.5094
 epoch: 75, train_loss: 0.8990, test_loss: 0.9887, test_f1: 0.5060
 epoch: 76, train_loss: 0.8964, test_loss: 1.0472, test_f1: 0.5253
 epoch: 77, train_loss: 0.8950, test_loss: 1.1438, test_f1: 0.4918
 epoch: 78, train_loss: 0.8890, test_loss: 0.9559, test_f1: 0.5505
 epoch: 79, train_loss: 0.8876, test_loss: 0.9502, test_f1: 0.4928
 epoch: 80, train_loss: 0.8998, test_loss: 0.9898, test_f1: 0.5014
 epoch: 81, train_loss: 0.8837, test_loss: 0.9234, test_f1: 0.5729
 epoch: 82, train_loss: 0.8792, test_loss: 0.9231, test_f1: 0.5229
 epoch: 83, train_loss: 0.8794, test_loss: 1.0000, test_f1: 0.4921
 epoch: 84, train_loss: 0.8961, test_loss: 0.9740, test_f1: 0.5016
 epoch: 85, train_loss: 0.8877, test_loss: 1.0304, test_f1: 0.4688
 epoch: 86, train_loss: 0.8814, test_loss: 0.9714, test_f1: 0.5718
 epoch: 87, train_loss: 0.8726, test_loss: 0.9526, test_f1: 0.5072
 epoch: 88, train_loss: 0.8882, test_loss: 0.9623, test_f1: 0.5617
 epoch: 89, train_loss: 0.8890, test_loss: 1.1032, test_f1: 0.4920
 epoch: 90, train_loss: 0.8817, test_loss: 0.9777, test_f1: 0.5259
 epoch: 91, train_loss: 0.8764, test_loss: 0.9148, test_f1: 0.5283
 epoch: 92, train_loss: 0.8862, test_loss: 0.9892, test_f1: 0.4994
 epoch: 93, train_loss: 0.8856, test_loss: 0.9800, test_f1: 0.5265
 epoch: 94, train_loss: 0.8661, test_loss: 0.9512, test_f1: 0.5378
 epoch: 95, train_loss: 0.8694, test_loss: 0.9623, test_f1: 0.5539
 epoch: 96, train_loss: 0.8769, test_loss: 1.0363, test_f1: 0.4882
 epoch: 97, train_loss: 0.8730, test_loss: 0.9532, test_f1: 0.5264
 epoch: 98, train_loss: 0.8791, test_loss: 0.9239, test_f1: 0.5377
 epoch: 99, train_loss: 0.8835, test_loss: 0.9736, test_f1: 0.5187
##################ITERATION #4 ****************************************
 epoch: 0, train_loss: 1.2783, test_loss: 1.3082, test_f1: 0.3383
 epoch: 1, train_loss: 1.1255, test_loss: 1.1953, test_f1: 0.3177
 epoch: 2, train_loss: 1.1007, test_loss: 1.1152, test_f1: 0.3391
 epoch: 3, train_loss: 1.1100, test_loss: 1.4033, test_f1: 0.3000
 epoch: 4, train_loss: 1.0809, test_loss: 1.1185, test_f1: 0.3804
 epoch: 5, train_loss: 1.0766, test_loss: 1.0819, test_f1: 0.3406
 epoch: 6, train_loss: 1.0693, test_loss: 1.1962, test_f1: 0.3320
 epoch: 7, train_loss: 1.0574, test_loss: 1.0943, test_f1: 0.4254
 epoch: 8, train_loss: 1.0538, test_loss: 1.0571, test_f1: 0.3371
 epoch: 9, train_loss: 1.0706, test_loss: 1.1301, test_f1: 0.3367
 epoch: 10, train_loss: 1.0560, test_loss: 1.1123, test_f1: 0.3679
 epoch: 11, train_loss: 1.0582, test_loss: 1.1720, test_f1: 0.3428
 epoch: 12, train_loss: 1.0465, test_loss: 1.1473, test_f1: 0.4782
 epoch: 13, train_loss: 1.0642, test_loss: 1.0827, test_f1: 0.4680
 epoch: 14, train_loss: 1.0493, test_loss: 1.0741, test_f1: 0.4374
 epoch: 15, train_loss: 1.0515, test_loss: 1.0366, test_f1: 0.4421
 epoch: 16, train_loss: 1.0465, test_loss: 1.0323, test_f1: 0.4350
 epoch: 17, train_loss: 1.0451, test_loss: 1.0788, test_f1: 0.3724
 epoch: 18, train_loss: 1.0235, test_loss: 1.1475, test_f1: 0.4102
 epoch: 19, train_loss: 1.0051, test_loss: 1.0840, test_f1: 0.4477
 epoch: 20, train_loss: 1.0248, test_loss: 1.0736, test_f1: 0.4330
 epoch: 21, train_loss: 1.0092, test_loss: 0.9996, test_f1: 0.4866
 epoch: 22, train_loss: 0.9748, test_loss: 1.0059, test_f1: 0.4816
 epoch: 23, train_loss: 0.9740, test_loss: 0.9889, test_f1: 0.4891
 epoch: 24, train_loss: 0.9709, test_loss: 1.0518, test_f1: 0.4854
 epoch: 25, train_loss: 0.9601, test_loss: 1.2062, test_f1: 0.4122
 epoch: 26, train_loss: 0.9556, test_loss: 1.0046, test_f1: 0.5123
 epoch: 27, train_loss: 0.9628, test_loss: 1.0881, test_f1: 0.4437
 epoch: 28, train_loss: 0.9768, test_loss: 1.0506, test_f1: 0.4322
 epoch: 29, train_loss: 0.9763, test_loss: 1.1019, test_f1: 0.4609
 epoch: 30, train_loss: 0.9840, test_loss: 1.0519, test_f1: 0.4390
 epoch: 31, train_loss: 0.9635, test_loss: 1.2072, test_f1: 0.4072
 epoch: 32, train_loss: 0.9503, test_loss: 1.1358, test_f1: 0.4299
 epoch: 33, train_loss: 0.9337, test_loss: 1.0543, test_f1: 0.4543
 epoch: 34, train_loss: 0.9351, test_loss: 0.9940, test_f1: 0.5035
 epoch: 35, train_loss: 0.9281, test_loss: 0.9614, test_f1: 0.5187
 epoch: 36, train_loss: 0.9378, test_loss: 1.0403, test_f1: 0.4489
 epoch: 37, train_loss: 0.9183, test_loss: 1.0489, test_f1: 0.5306
 epoch: 38, train_loss: 0.9520, test_loss: 0.9544, test_f1: 0.5090
 epoch: 39, train_loss: 0.9244, test_loss: 0.9306, test_f1: 0.5143
 epoch: 40, train_loss: 0.9262, test_loss: 1.0712, test_f1: 0.4748
 epoch: 41, train_loss: 0.9228, test_loss: 0.9200, test_f1: 0.5226
 epoch: 42, train_loss: 0.9093, test_loss: 0.9797, test_f1: 0.4932
 epoch: 43, train_loss: 0.8996, test_loss: 1.0802, test_f1: 0.4847
 epoch: 44, train_loss: 0.9096, test_loss: 0.9710, test_f1: 0.4873
 epoch: 45, train_loss: 0.9046, test_loss: 0.9253, test_f1: 0.5264
 epoch: 46, train_loss: 0.8981, test_loss: 1.0240, test_f1: 0.5331
 epoch: 47, train_loss: 0.9091, test_loss: 1.1856, test_f1: 0.4148
 epoch: 48, train_loss: 0.9421, test_loss: 1.0186, test_f1: 0.5224
 epoch: 49, train_loss: 0.9197, test_loss: 1.0379, test_f1: 0.4203
 epoch: 50, train_loss: 0.9082, test_loss: 1.1954, test_f1: 0.4203
 epoch: 51, train_loss: 0.9129, test_loss: 1.1013, test_f1: 0.5025
 epoch: 52, train_loss: 0.8976, test_loss: 1.0198, test_f1: 0.5277
 epoch: 53, train_loss: 0.8774, test_loss: 0.9729, test_f1: 0.5067
 epoch: 54, train_loss: 0.8649, test_loss: 0.9147, test_f1: 0.5383
 epoch: 55, train_loss: 0.8560, test_loss: 0.9466, test_f1: 0.5387
 epoch: 56, train_loss: 0.8570, test_loss: 0.9714, test_f1: 0.5416
 epoch: 57, train_loss: 0.8694, test_loss: 0.9156, test_f1: 0.5617
 epoch: 58, train_loss: 0.8563, test_loss: 1.1823, test_f1: 0.3896
 epoch: 59, train_loss: 0.8701, test_loss: 0.9266, test_f1: 0.5076
 epoch: 60, train_loss: 0.8764, test_loss: 0.9318, test_f1: 0.5260
 epoch: 61, train_loss: 0.8560, test_loss: 0.9383, test_f1: 0.5114
 epoch: 62, train_loss: 0.8661, test_loss: 0.8915, test_f1: 0.5601
 epoch: 63, train_loss: 0.8455, test_loss: 0.9663, test_f1: 0.5477
 epoch: 64, train_loss: 0.8599, test_loss: 0.9319, test_f1: 0.5571
 epoch: 65, train_loss: 0.8445, test_loss: 0.9344, test_f1: 0.4904
 epoch: 66, train_loss: 0.8433, test_loss: 0.9247, test_f1: 0.5195
 epoch: 67, train_loss: 0.8570, test_loss: 0.9227, test_f1: 0.5588
 epoch: 68, train_loss: 0.8374, test_loss: 0.9542, test_f1: 0.5468
 epoch: 69, train_loss: 0.8418, test_loss: 0.9231, test_f1: 0.5157
 epoch: 70, train_loss: 0.8395, test_loss: 0.8803, test_f1: 0.6043
 epoch: 71, train_loss: 0.8389, test_loss: 0.9064, test_f1: 0.5945
 epoch: 72, train_loss: 0.8460, test_loss: 0.9466, test_f1: 0.5659
 epoch: 73, train_loss: 0.8555, test_loss: 0.9261, test_f1: 0.5376
 epoch: 74, train_loss: 0.8676, test_loss: 0.9669, test_f1: 0.5500
 epoch: 75, train_loss: 0.8468, test_loss: 0.9199, test_f1: 0.5448
 epoch: 76, train_loss: 0.8300, test_loss: 0.9843, test_f1: 0.5940
 epoch: 77, train_loss: 0.8275, test_loss: 0.9748, test_f1: 0.5977
 epoch: 78, train_loss: 0.8275, test_loss: 0.8587, test_f1: 0.5478
 epoch: 79, train_loss: 0.8372, test_loss: 0.9183, test_f1: 0.5339
 epoch: 80, train_loss: 0.8435, test_loss: 0.8668, test_f1: 0.5551
 epoch: 81, train_loss: 0.8202, test_loss: 0.9430, test_f1: 0.5659
 epoch: 82, train_loss: 0.8349, test_loss: 0.8947, test_f1: 0.5435
 epoch: 83, train_loss: 0.8132, test_loss: 1.0636, test_f1: 0.4724
 epoch: 84, train_loss: 0.8321, test_loss: 0.9507, test_f1: 0.5351
 epoch: 85, train_loss: 0.8579, test_loss: 0.9955, test_f1: 0.5395
 epoch: 86, train_loss: 0.8452, test_loss: 0.9617, test_f1: 0.5408
 epoch: 87, train_loss: 0.8221, test_loss: 0.9400, test_f1: 0.5775
 epoch: 88, train_loss: 0.8331, test_loss: 0.9753, test_f1: 0.5141
 epoch: 89, train_loss: 0.8326, test_loss: 1.0008, test_f1: 0.5085
 epoch: 90, train_loss: 0.8113, test_loss: 1.0134, test_f1: 0.5188
 epoch: 91, train_loss: 0.8386, test_loss: 0.8772, test_f1: 0.5334
 epoch: 92, train_loss: 0.8346, test_loss: 0.8669, test_f1: 0.5318
 epoch: 93, train_loss: 0.8472, test_loss: 0.9690, test_f1: 0.5148
 epoch: 94, train_loss: 0.8415, test_loss: 0.9436, test_f1: 0.5337
 epoch: 95, train_loss: 0.8264, test_loss: 0.9021, test_f1: 0.5732
 epoch: 96, train_loss: 0.8245, test_loss: 0.9047, test_f1: 0.5239
 epoch: 97, train_loss: 0.8487, test_loss: 0.8902, test_f1: 0.5206
 epoch: 98, train_loss: 0.8401, test_loss: 0.8723, test_f1: 0.5321
 epoch: 99, train_loss: 0.8161, test_loss: 0.9124, test_f1: 0.5068
##################ITERATION #5 ****************************************
 epoch: 0, train_loss: 1.3679, test_loss: 1.4665, test_f1: 0.0808
 epoch: 1, train_loss: 1.1532, test_loss: 1.3055, test_f1: 0.2260
 epoch: 2, train_loss: 1.0965, test_loss: 1.1113, test_f1: 0.3573
 epoch: 3, train_loss: 1.0787, test_loss: 1.0852, test_f1: 0.3391
 epoch: 4, train_loss: 1.0633, test_loss: 1.6330, test_f1: 0.3079
 epoch: 5, train_loss: 1.0476, test_loss: 1.1437, test_f1: 0.3688
 epoch: 6, train_loss: 1.0462, test_loss: 1.0349, test_f1: 0.4504
 epoch: 7, train_loss: 1.0106, test_loss: 1.4492, test_f1: 0.3985
 epoch: 8, train_loss: 1.0216, test_loss: 1.0335, test_f1: 0.4583
 epoch: 9, train_loss: 1.0224, test_loss: 1.4471, test_f1: 0.4658
 epoch: 10, train_loss: 1.0321, test_loss: 0.9928, test_f1: 0.4771
 epoch: 11, train_loss: 1.0231, test_loss: 1.1357, test_f1: 0.3820
 epoch: 12, train_loss: 1.0227, test_loss: 0.9695, test_f1: 0.4767
 epoch: 13, train_loss: 1.0043, test_loss: 1.0718, test_f1: 0.4718
 epoch: 14, train_loss: 0.9974, test_loss: 0.9713, test_f1: 0.4628
 epoch: 15, train_loss: 1.0028, test_loss: 1.0168, test_f1: 0.4851
 epoch: 16, train_loss: 1.0028, test_loss: 0.9455, test_f1: 0.4895
 epoch: 17, train_loss: 0.9869, test_loss: 1.0272, test_f1: 0.4680
 epoch: 18, train_loss: 0.9880, test_loss: 1.0469, test_f1: 0.4263
 epoch: 19, train_loss: 0.9783, test_loss: 0.9541, test_f1: 0.4661
 epoch: 20, train_loss: 0.9818, test_loss: 1.0082, test_f1: 0.4827
 epoch: 21, train_loss: 0.9890, test_loss: 0.9415, test_f1: 0.5085
 epoch: 22, train_loss: 0.9891, test_loss: 1.0730, test_f1: 0.4200
 epoch: 23, train_loss: 0.9919, test_loss: 0.9727, test_f1: 0.4716
 epoch: 24, train_loss: 0.9658, test_loss: 0.9213, test_f1: 0.4815
 epoch: 25, train_loss: 0.9621, test_loss: 1.1450, test_f1: 0.3522
 epoch: 26, train_loss: 0.9689, test_loss: 1.1534, test_f1: 0.3951
 epoch: 27, train_loss: 0.9745, test_loss: 0.9821, test_f1: 0.4760
 epoch: 28, train_loss: 0.9569, test_loss: 0.9802, test_f1: 0.5164
 epoch: 29, train_loss: 0.9532, test_loss: 0.9452, test_f1: 0.5248
 epoch: 30, train_loss: 0.9507, test_loss: 0.9884, test_f1: 0.5036
 epoch: 31, train_loss: 0.9417, test_loss: 1.1690, test_f1: 0.4155
 epoch: 32, train_loss: 0.9690, test_loss: 0.9673, test_f1: 0.4982
 epoch: 33, train_loss: 0.9528, test_loss: 1.0002, test_f1: 0.4688
 epoch: 34, train_loss: 0.9518, test_loss: 0.9946, test_f1: 0.4864
 epoch: 35, train_loss: 0.9503, test_loss: 0.9425, test_f1: 0.5090
 epoch: 36, train_loss: 0.9517, test_loss: 1.1209, test_f1: 0.4743
 epoch: 37, train_loss: 0.9698, test_loss: 1.0763, test_f1: 0.4287
 epoch: 38, train_loss: 0.9441, test_loss: 0.9335, test_f1: 0.4814
 epoch: 39, train_loss: 0.9505, test_loss: 0.9562, test_f1: 0.5315
 epoch: 40, train_loss: 0.9606, test_loss: 1.0788, test_f1: 0.4598
 epoch: 41, train_loss: 0.9254, test_loss: 0.9261, test_f1: 0.5331
 epoch: 42, train_loss: 0.9311, test_loss: 0.9246, test_f1: 0.5322
 epoch: 43, train_loss: 0.9563, test_loss: 1.0026, test_f1: 0.4515
 epoch: 44, train_loss: 0.9542, test_loss: 0.9988, test_f1: 0.5144
 epoch: 45, train_loss: 0.9395, test_loss: 0.9278, test_f1: 0.5239
 epoch: 46, train_loss: 0.9459, test_loss: 1.1017, test_f1: 0.4858
 epoch: 47, train_loss: 0.9448, test_loss: 0.9827, test_f1: 0.5013
 epoch: 48, train_loss: 0.9493, test_loss: 1.1229, test_f1: 0.4656
 epoch: 49, train_loss: 0.9375, test_loss: 1.0342, test_f1: 0.4769
 epoch: 50, train_loss: 0.9292, test_loss: 0.9768, test_f1: 0.5126
 epoch: 51, train_loss: 0.9213, test_loss: 0.9735, test_f1: 0.5341
 epoch: 52, train_loss: 0.9197, test_loss: 0.9712, test_f1: 0.5095
 epoch: 53, train_loss: 0.8985, test_loss: 0.9760, test_f1: 0.5138
 epoch: 54, train_loss: 0.8932, test_loss: 1.0639, test_f1: 0.4877
 epoch: 55, train_loss: 0.8924, test_loss: 1.0125, test_f1: 0.5902
 epoch: 56, train_loss: 0.8916, test_loss: 0.9756, test_f1: 0.5251
 epoch: 57, train_loss: 0.9164, test_loss: 0.9739, test_f1: 0.5170
 epoch: 58, train_loss: 0.8898, test_loss: 0.8725, test_f1: 0.5379
 epoch: 59, train_loss: 0.8897, test_loss: 0.9525, test_f1: 0.5032
 epoch: 60, train_loss: 0.8863, test_loss: 0.9580, test_f1: 0.5279
 epoch: 61, train_loss: 0.8775, test_loss: 1.0193, test_f1: 0.5500
 epoch: 62, train_loss: 0.8809, test_loss: 1.0573, test_f1: 0.5252
 epoch: 63, train_loss: 0.8940, test_loss: 0.9890, test_f1: 0.5153
 epoch: 64, train_loss: 0.8765, test_loss: 1.0176, test_f1: 0.5201
 epoch: 65, train_loss: 0.8823, test_loss: 0.9799, test_f1: 0.5282
 epoch: 66, train_loss: 0.8842, test_loss: 0.9827, test_f1: 0.5851
 epoch: 67, train_loss: 0.9181, test_loss: 0.9570, test_f1: 0.5067
 epoch: 68, train_loss: 0.9071, test_loss: 0.9105, test_f1: 0.5701
 epoch: 69, train_loss: 0.8883, test_loss: 0.9564, test_f1: 0.5374
 epoch: 70, train_loss: 0.8778, test_loss: 0.9880, test_f1: 0.5429
 epoch: 71, train_loss: 0.8648, test_loss: 1.0199, test_f1: 0.5086
 epoch: 72, train_loss: 0.8744, test_loss: 1.1354, test_f1: 0.4995
 epoch: 73, train_loss: 0.8904, test_loss: 0.9850, test_f1: 0.5241
 epoch: 74, train_loss: 0.8842, test_loss: 0.9462, test_f1: 0.5310
 epoch: 75, train_loss: 0.8667, test_loss: 0.9956, test_f1: 0.4941
 epoch: 76, train_loss: 0.8695, test_loss: 1.0423, test_f1: 0.5190
 epoch: 77, train_loss: 0.8789, test_loss: 1.0163, test_f1: 0.5391
 epoch: 78, train_loss: 0.8826, test_loss: 0.9824, test_f1: 0.4870
 epoch: 79, train_loss: 0.8714, test_loss: 1.0596, test_f1: 0.5349
 epoch: 80, train_loss: 0.8793, test_loss: 1.1556, test_f1: 0.4809
 epoch: 81, train_loss: 0.8681, test_loss: 1.0335, test_f1: 0.5215
 epoch: 82, train_loss: 0.8643, test_loss: 1.0790, test_f1: 0.5279
 epoch: 83, train_loss: 0.8706, test_loss: 1.0713, test_f1: 0.5135
 epoch: 84, train_loss: 0.8458, test_loss: 1.1332, test_f1: 0.5360
 epoch: 85, train_loss: 0.8547, test_loss: 1.1502, test_f1: 0.5204
 epoch: 86, train_loss: 0.8633, test_loss: 1.0144, test_f1: 0.5024
 epoch: 87, train_loss: 0.8700, test_loss: 1.0421, test_f1: 0.5280
 epoch: 88, train_loss: 0.8544, test_loss: 1.0967, test_f1: 0.5238
 epoch: 89, train_loss: 0.8684, test_loss: 1.2208, test_f1: 0.5043
 epoch: 90, train_loss: 0.8774, test_loss: 1.1191, test_f1: 0.5066
 epoch: 91, train_loss: 0.8593, test_loss: 0.9793, test_f1: 0.5342
 epoch: 92, train_loss: 0.8673, test_loss: 0.9507, test_f1: 0.5319
 epoch: 93, train_loss: 0.8773, test_loss: 1.0703, test_f1: 0.4764
 epoch: 94, train_loss: 0.8771, test_loss: 1.0711, test_f1: 0.5481
 epoch: 95, train_loss: 0.8544, test_loss: 1.0220, test_f1: 0.5416
 epoch: 96, train_loss: 0.8659, test_loss: 1.1107, test_f1: 0.5087
 epoch: 97, train_loss: 0.8651, test_loss: 1.0229, test_f1: 0.5322
 epoch: 98, train_loss: 0.8607, test_loss: 0.9713, test_f1: 0.5294
 epoch: 99, train_loss: 0.8423, test_loss: 1.1405, test_f1: 0.5387
##################ITERATION #6 ****************************************
 epoch: 0, train_loss: 1.2619, test_loss: 1.4687, test_f1: 0.3648
 epoch: 1, train_loss: 1.0942, test_loss: 1.2101, test_f1: 0.3603
 epoch: 2, train_loss: 1.0670, test_loss: 1.0953, test_f1: 0.3926
 epoch: 3, train_loss: 1.0598, test_loss: 1.4294, test_f1: 0.3087
 epoch: 4, train_loss: 1.0603, test_loss: 1.1450, test_f1: 0.4279
 epoch: 5, train_loss: 1.0395, test_loss: 1.0877, test_f1: 0.4630
 epoch: 6, train_loss: 1.0169, test_loss: 1.0425, test_f1: 0.4796
 epoch: 7, train_loss: 1.0000, test_loss: 1.1504, test_f1: 0.4465
 epoch: 8, train_loss: 0.9914, test_loss: 1.1053, test_f1: 0.4040
 epoch: 9, train_loss: 0.9848, test_loss: 1.1605, test_f1: 0.4800
 epoch: 10, train_loss: 0.9736, test_loss: 1.0727, test_f1: 0.4997
 epoch: 11, train_loss: 0.9560, test_loss: 0.9404, test_f1: 0.4952
 epoch: 12, train_loss: 0.9601, test_loss: 1.0044, test_f1: 0.4962
 epoch: 13, train_loss: 0.9583, test_loss: 1.0874, test_f1: 0.4719
 epoch: 14, train_loss: 0.9414, test_loss: 0.9760, test_f1: 0.5130
 epoch: 15, train_loss: 0.9491, test_loss: 0.9648, test_f1: 0.5349
 epoch: 16, train_loss: 0.9528, test_loss: 1.4421, test_f1: 0.2758
 epoch: 17, train_loss: 0.9682, test_loss: 0.9741, test_f1: 0.5547
 epoch: 18, train_loss: 0.9455, test_loss: 1.0419, test_f1: 0.4235
 epoch: 19, train_loss: 0.9486, test_loss: 0.9033, test_f1: 0.5168
 epoch: 20, train_loss: 0.9204, test_loss: 0.9712, test_f1: 0.5155
 epoch: 21, train_loss: 0.9310, test_loss: 0.9969, test_f1: 0.5021
 epoch: 22, train_loss: 0.9229, test_loss: 1.0114, test_f1: 0.5066
 epoch: 23, train_loss: 0.9175, test_loss: 0.9763, test_f1: 0.4983
 epoch: 24, train_loss: 0.9019, test_loss: 0.9646, test_f1: 0.4961
 epoch: 25, train_loss: 0.9354, test_loss: 1.0001, test_f1: 0.5072
 epoch: 26, train_loss: 0.9271, test_loss: 1.2376, test_f1: 0.4668
 epoch: 27, train_loss: 0.9231, test_loss: 1.0237, test_f1: 0.5185
 epoch: 28, train_loss: 0.8969, test_loss: 1.1243, test_f1: 0.4536
 epoch: 29, train_loss: 0.9107, test_loss: 1.0225, test_f1: 0.5176
 epoch: 30, train_loss: 0.8917, test_loss: 1.1262, test_f1: 0.4947
 epoch: 31, train_loss: 0.9074, test_loss: 0.9615, test_f1: 0.5209
 epoch: 32, train_loss: 0.8991, test_loss: 1.2465, test_f1: 0.4542
 epoch: 33, train_loss: 0.9149, test_loss: 1.0575, test_f1: 0.5206
 epoch: 34, train_loss: 0.9048, test_loss: 1.1552, test_f1: 0.5267
 epoch: 35, train_loss: 0.9121, test_loss: 1.0992, test_f1: 0.4930
 epoch: 36, train_loss: 0.9234, test_loss: 0.9646, test_f1: 0.4957
 epoch: 37, train_loss: 0.9180, test_loss: 0.9990, test_f1: 0.5048
 epoch: 38, train_loss: 0.9143, test_loss: 1.0921, test_f1: 0.4781
 epoch: 39, train_loss: 0.9053, test_loss: 0.9634, test_f1: 0.5804
 epoch: 40, train_loss: 0.8906, test_loss: 1.2022, test_f1: 0.4930
 epoch: 41, train_loss: 0.8850, test_loss: 1.0273, test_f1: 0.5692
 epoch: 42, train_loss: 0.8897, test_loss: 1.0089, test_f1: 0.5405
 epoch: 43, train_loss: 0.8817, test_loss: 1.1040, test_f1: 0.5007
 epoch: 44, train_loss: 0.9032, test_loss: 1.1336, test_f1: 0.4876
 epoch: 45, train_loss: 0.9033, test_loss: 1.0600, test_f1: 0.4969
 epoch: 46, train_loss: 0.9008, test_loss: 1.0405, test_f1: 0.5048
 epoch: 47, train_loss: 0.8923, test_loss: 0.9801, test_f1: 0.5263
 epoch: 48, train_loss: 0.8752, test_loss: 1.1845, test_f1: 0.5543
 epoch: 49, train_loss: 0.8927, test_loss: 1.1193, test_f1: 0.5584
 epoch: 50, train_loss: 0.8850, test_loss: 0.8828, test_f1: 0.5860
 epoch: 51, train_loss: 0.8742, test_loss: 0.9173, test_f1: 0.5477
 epoch: 52, train_loss: 0.8476, test_loss: 0.9863, test_f1: 0.5358
 epoch: 53, train_loss: 0.8314, test_loss: 1.1216, test_f1: 0.5256
 epoch: 54, train_loss: 0.8372, test_loss: 1.0724, test_f1: 0.5289
 epoch: 55, train_loss: 0.8370, test_loss: 1.0745, test_f1: 0.5892
 epoch: 56, train_loss: 0.8180, test_loss: 1.0419, test_f1: 0.5871
 epoch: 57, train_loss: 0.8171, test_loss: 1.0933, test_f1: 0.5460
 epoch: 58, train_loss: 0.8287, test_loss: 1.1004, test_f1: 0.5322
 epoch: 59, train_loss: 0.8331, test_loss: 1.0968, test_f1: 0.5672
 epoch: 60, train_loss: 0.8195, test_loss: 1.1631, test_f1: 0.5387
 epoch: 61, train_loss: 0.8233, test_loss: 1.1226, test_f1: 0.4905
 epoch: 62, train_loss: 0.8081, test_loss: 1.1399, test_f1: 0.5204
 epoch: 63, train_loss: 0.8340, test_loss: 1.0296, test_f1: 0.5733
 epoch: 64, train_loss: 0.8152, test_loss: 1.2113, test_f1: 0.5160
 epoch: 65, train_loss: 0.8252, test_loss: 1.1973, test_f1: 0.5156
 epoch: 66, train_loss: 0.8229, test_loss: 1.1324, test_f1: 0.5372
 epoch: 67, train_loss: 0.8299, test_loss: 1.1200, test_f1: 0.5491
 epoch: 68, train_loss: 0.8123, test_loss: 1.2372, test_f1: 0.4976
 epoch: 69, train_loss: 0.8100, test_loss: 1.0464, test_f1: 0.5611
 epoch: 70, train_loss: 0.8449, test_loss: 1.4290, test_f1: 0.4800
 epoch: 71, train_loss: 0.8195, test_loss: 1.1808, test_f1: 0.5140
 epoch: 72, train_loss: 0.8058, test_loss: 1.0743, test_f1: 0.5479
 epoch: 73, train_loss: 0.8278, test_loss: 1.0593, test_f1: 0.5377
 epoch: 74, train_loss: 0.8005, test_loss: 1.0868, test_f1: 0.5192
 epoch: 75, train_loss: 0.8012, test_loss: 1.1456, test_f1: 0.5717
 epoch: 76, train_loss: 0.7998, test_loss: 1.0100, test_f1: 0.5781
 epoch: 77, train_loss: 0.8188, test_loss: 1.1272, test_f1: 0.5464
 epoch: 78, train_loss: 0.7832, test_loss: 1.2130, test_f1: 0.5864
 epoch: 79, train_loss: 0.8158, test_loss: 1.2902, test_f1: 0.5184
 epoch: 80, train_loss: 0.8128, test_loss: 1.2088, test_f1: 0.5406
 epoch: 81, train_loss: 0.8117, test_loss: 1.0598, test_f1: 0.5310
 epoch: 82, train_loss: 0.7993, test_loss: 1.1436, test_f1: 0.5345
 epoch: 83, train_loss: 0.7911, test_loss: 1.0313, test_f1: 0.5419
 epoch: 84, train_loss: 0.8130, test_loss: 1.2084, test_f1: 0.5246
 epoch: 85, train_loss: 0.8156, test_loss: 0.8750, test_f1: 0.5200
 epoch: 86, train_loss: 0.8020, test_loss: 0.8884, test_f1: 0.5390
 epoch: 87, train_loss: 0.8208, test_loss: 1.0673, test_f1: 0.5279
 epoch: 88, train_loss: 0.7977, test_loss: 0.9970, test_f1: 0.5193
 epoch: 89, train_loss: 0.8209, test_loss: 1.0243, test_f1: 0.5308
 epoch: 90, train_loss: 0.8085, test_loss: 0.9473, test_f1: 0.5391
 epoch: 91, train_loss: 0.7960, test_loss: 0.9170, test_f1: 0.5409
 epoch: 92, train_loss: 0.7962, test_loss: 1.1690, test_f1: 0.4963
 epoch: 93, train_loss: 0.8152, test_loss: 1.2012, test_f1: 0.5859
 epoch: 94, train_loss: 0.7966, test_loss: 1.1539, test_f1: 0.5903
 epoch: 95, train_loss: 0.8146, test_loss: 1.0747, test_f1: 0.5557
 epoch: 96, train_loss: 0.8019, test_loss: 1.5303, test_f1: 0.4966
 epoch: 97, train_loss: 0.8016, test_loss: 1.1775, test_f1: 0.5286
 epoch: 98, train_loss: 0.7763, test_loss: 1.1807, test_f1: 0.5715
 epoch: 99, train_loss: 0.7865, test_loss: 0.9929, test_f1: 0.5374
##################ITERATION #7 ****************************************
 epoch: 0, train_loss: 1.3028, test_loss: 1.2991, test_f1: 0.2472
 epoch: 1, train_loss: 1.1090, test_loss: 1.0813, test_f1: 0.4641
 epoch: 2, train_loss: 1.0825, test_loss: 1.0891, test_f1: 0.3373
 epoch: 3, train_loss: 1.0772, test_loss: 1.1730, test_f1: 0.3132
 epoch: 4, train_loss: 1.0691, test_loss: 1.1933, test_f1: 0.3534
 epoch: 5, train_loss: 1.0648, test_loss: 1.1057, test_f1: 0.3581
 epoch: 6, train_loss: 1.0541, test_loss: 1.1159, test_f1: 0.4089
 epoch: 7, train_loss: 1.0396, test_loss: 1.1825, test_f1: 0.3545
 epoch: 8, train_loss: 1.0434, test_loss: 1.1089, test_f1: 0.4110
 epoch: 9, train_loss: 1.0370, test_loss: 1.2254, test_f1: 0.3810
 epoch: 10, train_loss: 1.0515, test_loss: 1.1331, test_f1: 0.3936
 epoch: 11, train_loss: 1.0429, test_loss: 1.1103, test_f1: 0.3872
 epoch: 12, train_loss: 1.0369, test_loss: 1.0868, test_f1: 0.4756
 epoch: 13, train_loss: 1.0061, test_loss: 1.2171, test_f1: 0.3860
 epoch: 14, train_loss: 0.9926, test_loss: 1.1157, test_f1: 0.4943
 epoch: 15, train_loss: 1.0038, test_loss: 1.0677, test_f1: 0.4292
 epoch: 16, train_loss: 1.0016, test_loss: 1.0740, test_f1: 0.4225
 epoch: 17, train_loss: 0.9961, test_loss: 1.0613, test_f1: 0.3906
 epoch: 18, train_loss: 0.9618, test_loss: 1.0059, test_f1: 0.4919
 epoch: 19, train_loss: 0.9793, test_loss: 1.1079, test_f1: 0.4627
 epoch: 20, train_loss: 0.9642, test_loss: 1.0401, test_f1: 0.4565
 epoch: 21, train_loss: 0.9521, test_loss: 1.1667, test_f1: 0.4559
 epoch: 22, train_loss: 0.9745, test_loss: 1.0710, test_f1: 0.4779
 epoch: 23, train_loss: 0.9595, test_loss: 1.1479, test_f1: 0.4010
 epoch: 24, train_loss: 0.9614, test_loss: 1.1287, test_f1: 0.4339
 epoch: 25, train_loss: 0.9572, test_loss: 1.0277, test_f1: 0.4537
 epoch: 26, train_loss: 0.9854, test_loss: 1.0403, test_f1: 0.4721
 epoch: 27, train_loss: 0.9421, test_loss: 1.0455, test_f1: 0.4833
 epoch: 28, train_loss: 0.9644, test_loss: 1.1085, test_f1: 0.3541
 epoch: 29, train_loss: 0.9776, test_loss: 1.3376, test_f1: 0.3899
 epoch: 30, train_loss: 0.9570, test_loss: 0.9925, test_f1: 0.5174
 epoch: 31, train_loss: 0.9650, test_loss: 1.1135, test_f1: 0.4026
 epoch: 32, train_loss: 0.9872, test_loss: 1.0498, test_f1: 0.4472
 epoch: 33, train_loss: 0.9470, test_loss: 1.4807, test_f1: 0.3938
 epoch: 34, train_loss: 0.9615, test_loss: 1.1324, test_f1: 0.4767
 epoch: 35, train_loss: 0.9684, test_loss: 1.0150, test_f1: 0.4813
 epoch: 36, train_loss: 0.9459, test_loss: 1.0626, test_f1: 0.4715
 epoch: 37, train_loss: 0.9396, test_loss: 1.0835, test_f1: 0.5043
 epoch: 38, train_loss: 0.9396, test_loss: 1.0614, test_f1: 0.4758
 epoch: 39, train_loss: 0.9592, test_loss: 1.3312, test_f1: 0.4474
 epoch: 40, train_loss: 0.9718, test_loss: 1.1590, test_f1: 0.3498
 epoch: 41, train_loss: 0.9633, test_loss: 1.1027, test_f1: 0.4766
 epoch: 42, train_loss: 0.9609, test_loss: 1.0446, test_f1: 0.4743
 epoch: 43, train_loss: 0.9438, test_loss: 0.9705, test_f1: 0.4698
 epoch: 44, train_loss: 0.9447, test_loss: 1.1778, test_f1: 0.4578
 epoch: 45, train_loss: 0.9512, test_loss: 0.9646, test_f1: 0.4889
 epoch: 46, train_loss: 0.9386, test_loss: 1.0301, test_f1: 0.4645
 epoch: 47, train_loss: 0.9220, test_loss: 0.9846, test_f1: 0.5155
 epoch: 48, train_loss: 0.9246, test_loss: 0.9853, test_f1: 0.5486
 epoch: 49, train_loss: 0.9153, test_loss: 0.9635, test_f1: 0.5043
 epoch: 50, train_loss: 0.9287, test_loss: 1.0955, test_f1: 0.4783
 epoch: 51, train_loss: 0.9180, test_loss: 1.0043, test_f1: 0.4702
 epoch: 52, train_loss: 0.8973, test_loss: 1.1348, test_f1: 0.4779
 epoch: 53, train_loss: 0.9178, test_loss: 1.0089, test_f1: 0.5279
 epoch: 54, train_loss: 0.8915, test_loss: 1.0912, test_f1: 0.4935
 epoch: 55, train_loss: 0.8905, test_loss: 0.9687, test_f1: 0.5178
 epoch: 56, train_loss: 0.8906, test_loss: 1.0143, test_f1: 0.5167
 epoch: 57, train_loss: 0.8881, test_loss: 0.9779, test_f1: 0.5279
 epoch: 58, train_loss: 0.8850, test_loss: 1.0843, test_f1: 0.5322
 epoch: 59, train_loss: 0.8983, test_loss: 1.1654, test_f1: 0.4711
 epoch: 60, train_loss: 0.8945, test_loss: 0.9751, test_f1: 0.5063
 epoch: 61, train_loss: 0.8730, test_loss: 1.0790, test_f1: 0.5096
 epoch: 62, train_loss: 0.8729, test_loss: 1.0087, test_f1: 0.4985
 epoch: 63, train_loss: 0.8817, test_loss: 1.1403, test_f1: 0.4994
 epoch: 64, train_loss: 0.8921, test_loss: 0.9998, test_f1: 0.4981
 epoch: 65, train_loss: 0.8951, test_loss: 1.0399, test_f1: 0.4427
 epoch: 66, train_loss: 0.9128, test_loss: 1.0902, test_f1: 0.4613
 epoch: 67, train_loss: 0.8797, test_loss: 0.9407, test_f1: 0.4994
 epoch: 68, train_loss: 0.8750, test_loss: 1.1195, test_f1: 0.5054
 epoch: 69, train_loss: 0.8831, test_loss: 1.1196, test_f1: 0.4565
 epoch: 70, train_loss: 0.8771, test_loss: 0.9542, test_f1: 0.4953
 epoch: 71, train_loss: 0.8821, test_loss: 1.0251, test_f1: 0.5000
 epoch: 72, train_loss: 0.8680, test_loss: 1.0883, test_f1: 0.5028
 epoch: 73, train_loss: 0.8925, test_loss: 0.9837, test_f1: 0.5108
 epoch: 74, train_loss: 0.8731, test_loss: 1.0641, test_f1: 0.4952
 epoch: 75, train_loss: 0.8777, test_loss: 1.0869, test_f1: 0.4895
 epoch: 76, train_loss: 0.8718, test_loss: 1.0013, test_f1: 0.5071
 epoch: 77, train_loss: 0.8764, test_loss: 1.0398, test_f1: 0.5155
 epoch: 78, train_loss: 0.8937, test_loss: 1.0082, test_f1: 0.5136
 epoch: 79, train_loss: 0.8794, test_loss: 1.0181, test_f1: 0.5262
 epoch: 80, train_loss: 0.8535, test_loss: 1.2706, test_f1: 0.4636
 epoch: 81, train_loss: 0.8808, test_loss: 1.0387, test_f1: 0.4996
 epoch: 82, train_loss: 0.8815, test_loss: 1.2882, test_f1: 0.4628
 epoch: 83, train_loss: 0.8810, test_loss: 1.0069, test_f1: 0.5023
 epoch: 84, train_loss: 0.8729, test_loss: 1.1728, test_f1: 0.4686
 epoch: 85, train_loss: 0.8643, test_loss: 1.0323, test_f1: 0.5344
 epoch: 86, train_loss: 0.8495, test_loss: 1.0986, test_f1: 0.5049
 epoch: 87, train_loss: 0.8573, test_loss: 1.0658, test_f1: 0.5185
 epoch: 88, train_loss: 0.8524, test_loss: 1.1048, test_f1: 0.4963
 epoch: 89, train_loss: 0.8546, test_loss: 1.0708, test_f1: 0.4563
 epoch: 90, train_loss: 0.8599, test_loss: 0.9542, test_f1: 0.5324
 epoch: 91, train_loss: 0.8616, test_loss: 0.9643, test_f1: 0.5326
 epoch: 92, train_loss: 0.8526, test_loss: 1.0648, test_f1: 0.5163
 epoch: 93, train_loss: 0.8494, test_loss: 1.0362, test_f1: 0.5064
 epoch: 94, train_loss: 0.8481, test_loss: 1.2322, test_f1: 0.4567
 epoch: 95, train_loss: 0.8539, test_loss: 1.1644, test_f1: 0.5032
 epoch: 96, train_loss: 0.8481, test_loss: 1.2108, test_f1: 0.4696
 epoch: 97, train_loss: 0.8489, test_loss: 1.0622, test_f1: 0.5055
 epoch: 98, train_loss: 0.8528, test_loss: 1.1222, test_f1: 0.4818
 epoch: 99, train_loss: 0.8531, test_loss: 1.0291, test_f1: 0.4931
##################ITERATION #8 ****************************************
 epoch: 0, train_loss: 1.3507, test_loss: 1.4001, test_f1: 0.2688
 epoch: 1, train_loss: 1.1955, test_loss: 1.1637, test_f1: 0.3312
 epoch: 2, train_loss: 1.1063, test_loss: 1.1275, test_f1: 0.3331
 epoch: 3, train_loss: 1.1325, test_loss: 1.1574, test_f1: 0.3316
 epoch: 4, train_loss: 1.0870, test_loss: 1.1149, test_f1: 0.3400
 epoch: 5, train_loss: 1.0815, test_loss: 1.3354, test_f1: 0.3132
 epoch: 6, train_loss: 1.0652, test_loss: 1.2543, test_f1: 0.3346
 epoch: 7, train_loss: 1.0743, test_loss: 1.3833, test_f1: 0.3243
 epoch: 8, train_loss: 1.0671, test_loss: 1.1371, test_f1: 0.3890
 epoch: 9, train_loss: 1.0624, test_loss: 1.1300, test_f1: 0.3429
 epoch: 10, train_loss: 1.0549, test_loss: 1.1843, test_f1: 0.3447
 epoch: 11, train_loss: 1.0569, test_loss: 1.0721, test_f1: 0.3447
 epoch: 12, train_loss: 1.0470, test_loss: 1.2458, test_f1: 0.4138
 epoch: 13, train_loss: 1.0424, test_loss: 1.0193, test_f1: 0.4381
 epoch: 14, train_loss: 1.0454, test_loss: 1.1485, test_f1: 0.3597
 epoch: 15, train_loss: 1.0406, test_loss: 1.1419, test_f1: 0.4246
 epoch: 16, train_loss: 1.0168, test_loss: 1.0648, test_f1: 0.4243
 epoch: 17, train_loss: 1.0044, test_loss: 1.1811, test_f1: 0.3330
 epoch: 18, train_loss: 1.0194, test_loss: 1.0902, test_f1: 0.4252
 epoch: 19, train_loss: 0.9993, test_loss: 1.1207, test_f1: 0.4599
 epoch: 20, train_loss: 1.0007, test_loss: 1.0461, test_f1: 0.4733
 epoch: 21, train_loss: 0.9892, test_loss: 9.0647, test_f1: 0.2155
 epoch: 22, train_loss: 1.0254, test_loss: 1.2207, test_f1: 0.4571
 epoch: 23, train_loss: 1.0155, test_loss: 1.1354, test_f1: 0.4606
 epoch: 24, train_loss: 0.9961, test_loss: 1.0522, test_f1: 0.4348
 epoch: 25, train_loss: 0.9756, test_loss: 1.0719, test_f1: 0.4305
 epoch: 26, train_loss: 0.9659, test_loss: 1.0422, test_f1: 0.4146
 epoch: 27, train_loss: 0.9750, test_loss: 1.0287, test_f1: 0.4619
 epoch: 28, train_loss: 0.9689, test_loss: 1.0911, test_f1: 0.4461
 epoch: 29, train_loss: 0.9868, test_loss: 1.0997, test_f1: 0.5163
 epoch: 30, train_loss: 0.9667, test_loss: 1.0803, test_f1: 0.4949
 epoch: 31, train_loss: 0.9571, test_loss: 1.0258, test_f1: 0.5129
 epoch: 32, train_loss: 0.9591, test_loss: 1.1057, test_f1: 0.3943
 epoch: 33, train_loss: 0.9588, test_loss: 0.9462, test_f1: 0.5017
 epoch: 34, train_loss: 0.9519, test_loss: 1.0668, test_f1: 0.4787
 epoch: 35, train_loss: 0.9563, test_loss: 1.1011, test_f1: 0.4789
 epoch: 36, train_loss: 0.9437, test_loss: 1.0825, test_f1: 0.4902
 epoch: 37, train_loss: 0.9385, test_loss: 1.1084, test_f1: 0.5408
 epoch: 38, train_loss: 0.9339, test_loss: 1.0464, test_f1: 0.4987
 epoch: 39, train_loss: 0.9334, test_loss: 1.0911, test_f1: 0.4998
 epoch: 40, train_loss: 0.9300, test_loss: 1.1588, test_f1: 0.5397
 epoch: 41, train_loss: 0.9173, test_loss: 1.0117, test_f1: 0.4740
 epoch: 42, train_loss: 0.9232, test_loss: 1.0713, test_f1: 0.5056
 epoch: 43, train_loss: 0.9272, test_loss: 1.0048, test_f1: 0.4983
 epoch: 44, train_loss: 0.9250, test_loss: 1.1093, test_f1: 0.4488
 epoch: 45, train_loss: 0.9342, test_loss: 1.0217, test_f1: 0.4705
 epoch: 46, train_loss: 0.9374, test_loss: 1.0898, test_f1: 0.4864
 epoch: 47, train_loss: 0.9288, test_loss: 1.0764, test_f1: 0.5107
 epoch: 48, train_loss: 0.9518, test_loss: 1.0563, test_f1: 0.4720
 epoch: 49, train_loss: 0.9259, test_loss: 0.9747, test_f1: 0.5736
 epoch: 50, train_loss: 0.9037, test_loss: 1.0399, test_f1: 0.4821
 epoch: 51, train_loss: 0.8892, test_loss: 1.0377, test_f1: 0.4976
 epoch: 52, train_loss: 0.8871, test_loss: 0.9961, test_f1: 0.5421
 epoch: 53, train_loss: 0.8834, test_loss: 0.9201, test_f1: 0.5197
 epoch: 54, train_loss: 0.8827, test_loss: 1.0169, test_f1: 0.5127
 epoch: 55, train_loss: 0.8752, test_loss: 0.9389, test_f1: 0.5249
 epoch: 56, train_loss: 0.8621, test_loss: 0.9558, test_f1: 0.5208
 epoch: 57, train_loss: 0.8651, test_loss: 0.9480, test_f1: 0.5562
 epoch: 58, train_loss: 0.8561, test_loss: 1.0240, test_f1: 0.5153
 epoch: 59, train_loss: 0.8588, test_loss: 0.9894, test_f1: 0.4871
 epoch: 60, train_loss: 0.8638, test_loss: 1.0806, test_f1: 0.5195
 epoch: 61, train_loss: 0.8581, test_loss: 1.0196, test_f1: 0.5515
 epoch: 62, train_loss: 0.8454, test_loss: 0.9246, test_f1: 0.5399
 epoch: 63, train_loss: 0.8492, test_loss: 0.9601, test_f1: 0.5457
 epoch: 64, train_loss: 0.8464, test_loss: 0.9923, test_f1: 0.4970
 epoch: 65, train_loss: 0.8519, test_loss: 0.9582, test_f1: 0.5271
 epoch: 66, train_loss: 0.8628, test_loss: 1.0129, test_f1: 0.5116
 epoch: 67, train_loss: 0.8310, test_loss: 0.9644, test_f1: 0.5222
 epoch: 68, train_loss: 0.8271, test_loss: 0.9370, test_f1: 0.5302
 epoch: 69, train_loss: 0.8358, test_loss: 1.0014, test_f1: 0.5246
 epoch: 70, train_loss: 0.8430, test_loss: 0.9272, test_f1: 0.5217
 epoch: 71, train_loss: 0.8256, test_loss: 1.1224, test_f1: 0.4977
 epoch: 72, train_loss: 0.8454, test_loss: 1.0317, test_f1: 0.5157
 epoch: 73, train_loss: 0.8456, test_loss: 0.9688, test_f1: 0.5902
 epoch: 74, train_loss: 0.8264, test_loss: 0.9839, test_f1: 0.5794
 epoch: 75, train_loss: 0.8284, test_loss: 0.9129, test_f1: 0.5455
 epoch: 76, train_loss: 0.8323, test_loss: 1.0786, test_f1: 0.4951
 epoch: 77, train_loss: 0.8383, test_loss: 0.9653, test_f1: 0.5140
 epoch: 78, train_loss: 0.8316, test_loss: 1.0217, test_f1: 0.5332
 epoch: 79, train_loss: 0.8187, test_loss: 0.9301, test_f1: 0.5784
 epoch: 80, train_loss: 0.8213, test_loss: 0.9824, test_f1: 0.5189
 epoch: 81, train_loss: 0.8326, test_loss: 0.9700, test_f1: 0.5390
 epoch: 82, train_loss: 0.8259, test_loss: 0.9692, test_f1: 0.5243
 epoch: 83, train_loss: 0.8059, test_loss: 0.9783, test_f1: 0.4929
 epoch: 84, train_loss: 0.8236, test_loss: 0.9348, test_f1: 0.5344
 epoch: 85, train_loss: 0.8346, test_loss: 0.9408, test_f1: 0.5767
 epoch: 86, train_loss: 0.8290, test_loss: 0.9493, test_f1: 0.5342
 epoch: 87, train_loss: 0.8153, test_loss: 1.0807, test_f1: 0.5322
 epoch: 88, train_loss: 0.8180, test_loss: 1.0445, test_f1: 0.4971
 epoch: 89, train_loss: 0.8336, test_loss: 1.0180, test_f1: 0.5152
 epoch: 90, train_loss: 0.8098, test_loss: 1.1233, test_f1: 0.4987
 epoch: 91, train_loss: 0.8269, test_loss: 1.0406, test_f1: 0.4927
 epoch: 92, train_loss: 0.8121, test_loss: 0.9351, test_f1: 0.5426
 epoch: 93, train_loss: 0.8193, test_loss: 1.0321, test_f1: 0.5604
 epoch: 94, train_loss: 0.7979, test_loss: 1.1043, test_f1: 0.4969
 epoch: 95, train_loss: 0.8036, test_loss: 1.0274, test_f1: 0.5300
 epoch: 96, train_loss: 0.8025, test_loss: 0.9258, test_f1: 0.5981
 epoch: 97, train_loss: 0.7964, test_loss: 1.0011, test_f1: 0.5671
 epoch: 98, train_loss: 0.7945, test_loss: 0.9713, test_f1: 0.5326
 epoch: 99, train_loss: 0.7950, test_loss: 0.9504, test_f1: 0.5433
##################ITERATION #9 ****************************************
 epoch: 0, train_loss: 1.3825, test_loss: 2.3478, test_f1: 0.1917
 epoch: 1, train_loss: 1.1248, test_loss: 1.3304, test_f1: 0.3108
 epoch: 2, train_loss: 1.0861, test_loss: 1.2024, test_f1: 0.3644
 epoch: 3, train_loss: 1.0937, test_loss: 1.3218, test_f1: 0.3397
 epoch: 4, train_loss: 1.0705, test_loss: 1.1039, test_f1: 0.3472
 epoch: 5, train_loss: 1.0631, test_loss: 1.2243, test_f1: 0.3360
 epoch: 6, train_loss: 1.0590, test_loss: 1.1796, test_f1: 0.3548
 epoch: 7, train_loss: 1.0657, test_loss: 1.1567, test_f1: 0.3615
 epoch: 8, train_loss: 1.0554, test_loss: 1.1515, test_f1: 0.3728
 epoch: 9, train_loss: 1.0391, test_loss: 1.4222, test_f1: 0.3166
 epoch: 10, train_loss: 1.0396, test_loss: 1.0911, test_f1: 0.3488
 epoch: 11, train_loss: 1.0398, test_loss: 1.0606, test_f1: 0.4908
 epoch: 12, train_loss: 1.0385, test_loss: 1.2447, test_f1: 0.4253
 epoch: 13, train_loss: 1.0282, test_loss: 1.1813, test_f1: 0.4057
 epoch: 14, train_loss: 1.0306, test_loss: 1.0228, test_f1: 0.4449
 epoch: 15, train_loss: 1.0089, test_loss: 1.0724, test_f1: 0.4313
 epoch: 16, train_loss: 1.0065, test_loss: 1.0405, test_f1: 0.4903
 epoch: 17, train_loss: 1.0202, test_loss: 1.4014, test_f1: 0.3458
 epoch: 18, train_loss: 0.9948, test_loss: 1.0196, test_f1: 0.4967
 epoch: 19, train_loss: 0.9718, test_loss: 1.0074, test_f1: 0.4882
 epoch: 20, train_loss: 0.9835, test_loss: 1.4057, test_f1: 0.2606
 epoch: 21, train_loss: 0.9837, test_loss: 7.6537, test_f1: 0.3427
 epoch: 22, train_loss: 0.9719, test_loss: 1.0761, test_f1: 0.4520
 epoch: 23, train_loss: 0.9618, test_loss: 1.0206, test_f1: 0.4987
 epoch: 24, train_loss: 0.9520, test_loss: 1.0044, test_f1: 0.4677
 epoch: 25, train_loss: 0.9365, test_loss: 0.9976, test_f1: 0.4809
 epoch: 26, train_loss: 0.9451, test_loss: 0.9736, test_f1: 0.5119
 epoch: 27, train_loss: 0.9487, test_loss: 1.0076, test_f1: 0.4596
 epoch: 28, train_loss: 0.9419, test_loss: 0.9338, test_f1: 0.4527
 epoch: 29, train_loss: 0.9236, test_loss: 1.0626, test_f1: 0.4544
 epoch: 30, train_loss: 0.9504, test_loss: 1.2477, test_f1: 0.4111
 epoch: 31, train_loss: 0.9256, test_loss: 0.9788, test_f1: 0.5545
 epoch: 32, train_loss: 0.9270, test_loss: 0.9480, test_f1: 0.4934
 epoch: 33, train_loss: 0.9210, test_loss: 1.0036, test_f1: 0.5065
 epoch: 34, train_loss: 0.9517, test_loss: 1.0169, test_f1: 0.4366
 epoch: 35, train_loss: 0.9230, test_loss: 1.0246, test_f1: 0.4280
 epoch: 36, train_loss: 0.9044, test_loss: 0.9866, test_f1: 0.4694
 epoch: 37, train_loss: 0.8982, test_loss: 1.0396, test_f1: 0.4563
 epoch: 38, train_loss: 0.9085, test_loss: 0.9857, test_f1: 0.4525
 epoch: 39, train_loss: 0.9124, test_loss: 0.9718, test_f1: 0.4903
 epoch: 40, train_loss: 0.9133, test_loss: 0.9918, test_f1: 0.4968
 epoch: 41, train_loss: 0.9388, test_loss: 0.9647, test_f1: 0.4725
 epoch: 42, train_loss: 0.9344, test_loss: 1.0202, test_f1: 0.4969
 epoch: 43, train_loss: 0.9189, test_loss: 1.1076, test_f1: 0.4156
 epoch: 44, train_loss: 0.8990, test_loss: 1.0472, test_f1: 0.4894
 epoch: 45, train_loss: 0.9218, test_loss: 1.0080, test_f1: 0.4951
 epoch: 46, train_loss: 0.9039, test_loss: 0.9516, test_f1: 0.5399
 epoch: 47, train_loss: 0.9183, test_loss: 0.9976, test_f1: 0.4761
 epoch: 48, train_loss: 0.9118, test_loss: 1.2791, test_f1: 0.3555
 epoch: 49, train_loss: 0.9190, test_loss: 0.9860, test_f1: 0.5184
 epoch: 50, train_loss: 0.9080, test_loss: 1.0214, test_f1: 0.4371
 epoch: 51, train_loss: 0.8804, test_loss: 1.0815, test_f1: 0.4546
 epoch: 52, train_loss: 0.8831, test_loss: 1.0054, test_f1: 0.4738
 epoch: 53, train_loss: 0.8655, test_loss: 0.9082, test_f1: 0.4953
 epoch: 54, train_loss: 0.8753, test_loss: 0.9244, test_f1: 0.4819
 epoch: 55, train_loss: 0.8508, test_loss: 0.9423, test_f1: 0.4941
 epoch: 56, train_loss: 0.8758, test_loss: 1.0477, test_f1: 0.4563
 epoch: 57, train_loss: 0.8545, test_loss: 1.0516, test_f1: 0.5080
 epoch: 58, train_loss: 0.8622, test_loss: 0.9565, test_f1: 0.5056
 epoch: 59, train_loss: 0.8585, test_loss: 0.9907, test_f1: 0.5034
 epoch: 60, train_loss: 0.8535, test_loss: 0.8783, test_f1: 0.5313
 epoch: 61, train_loss: 0.8512, test_loss: 0.9553, test_f1: 0.5085
 epoch: 62, train_loss: 0.8561, test_loss: 0.9192, test_f1: 0.5679
 epoch: 63, train_loss: 0.8673, test_loss: 0.9144, test_f1: 0.5060
 epoch: 64, train_loss: 0.8516, test_loss: 0.9235, test_f1: 0.5288
 epoch: 65, train_loss: 0.8553, test_loss: 0.9393, test_f1: 0.4854
 epoch: 66, train_loss: 0.8484, test_loss: 1.0009, test_f1: 0.4694
 epoch: 67, train_loss: 0.8506, test_loss: 0.9967, test_f1: 0.4734
 epoch: 68, train_loss: 0.8530, test_loss: 1.0057, test_f1: 0.4601
 epoch: 69, train_loss: 0.8531, test_loss: 1.0079, test_f1: 0.4652
 epoch: 70, train_loss: 0.8544, test_loss: 0.9405, test_f1: 0.4825
 epoch: 71, train_loss: 0.8603, test_loss: 0.9235, test_f1: 0.5334
 epoch: 72, train_loss: 0.8590, test_loss: 0.9552, test_f1: 0.4715
 epoch: 73, train_loss: 0.8632, test_loss: 0.9611, test_f1: 0.4739
 epoch: 74, train_loss: 0.8485, test_loss: 0.9770, test_f1: 0.4856
 epoch: 75, train_loss: 0.8363, test_loss: 1.0673, test_f1: 0.4697
 epoch: 76, train_loss: 0.8525, test_loss: 1.0018, test_f1: 0.4657
 epoch: 77, train_loss: 0.8590, test_loss: 0.8934, test_f1: 0.5143
 epoch: 78, train_loss: 0.8708, test_loss: 1.0122, test_f1: 0.4717
 epoch: 79, train_loss: 0.8563, test_loss: 0.9092, test_f1: 0.5289
 epoch: 80, train_loss: 0.8428, test_loss: 0.9864, test_f1: 0.4629
 epoch: 81, train_loss: 0.8537, test_loss: 0.9995, test_f1: 0.4766
 epoch: 82, train_loss: 0.8545, test_loss: 0.9271, test_f1: 0.4643
 epoch: 83, train_loss: 0.8483, test_loss: 1.0573, test_f1: 0.4606
 epoch: 84, train_loss: 0.8450, test_loss: 0.8927, test_f1: 0.4914
 epoch: 85, train_loss: 0.8511, test_loss: 0.9673, test_f1: 0.4873
 epoch: 86, train_loss: 0.8613, test_loss: 0.9192, test_f1: 0.5575
 epoch: 87, train_loss: 0.8398, test_loss: 0.9380, test_f1: 0.4792
 epoch: 88, train_loss: 0.8394, test_loss: 0.9332, test_f1: 0.4955
 epoch: 89, train_loss: 0.8349, test_loss: 0.9461, test_f1: 0.4759
 epoch: 90, train_loss: 0.8553, test_loss: 0.9588, test_f1: 0.4674
 epoch: 91, train_loss: 0.8574, test_loss: 0.9641, test_f1: 0.4785
 epoch: 92, train_loss: 0.8325, test_loss: 0.9773, test_f1: 0.5176
 epoch: 93, train_loss: 0.8443, test_loss: 0.9472, test_f1: 0.5194
 epoch: 94, train_loss: 0.8486, test_loss: 0.9061, test_f1: 0.5227
 epoch: 95, train_loss: 0.8408, test_loss: 1.0414, test_f1: 0.5036
 epoch: 96, train_loss: 0.8470, test_loss: 1.1437, test_f1: 0.4927
 epoch: 97, train_loss: 0.8529, test_loss: 0.9012, test_f1: 0.5120
 epoch: 98, train_loss: 0.8456, test_loss: 0.9029, test_f1: 0.5045
 epoch: 99, train_loss: 0.8329, test_loss: 1.1831, test_f1: 0.4429

Training completed in 402.12 seconds
Best F1: 0.6043 at epoch 70
Mean F1 across iterations: 0.5638  0.0431
========================FINAL RESULTS================================
FEGIN weighted F1: 0.6043  0.0431
python main.py --data ltspice_examples --representation component_pin --model FEGIN --layers 3 --hiddens 16 --batch_size 256 --lr 0.1 --emb_size 128 --epochs 100 --save_appendix component_pin_L3_H16_BS256_LR0.1_E128 --no_val
-----



STDERR:
  File "main.py", line 370, in <module>
    main()
  File "main.py", line 254, in main
    dataset = dataset_class(
  File "/home/philip/projects/ltspice_examples_code_repo/Circuit-Completion-Using-GNNs/component_classification_with_link_prediction_head/evaluation/FEGIN/kernel/circuit_datasets.py", line 15, in __init__
    self.data, self.slices = torch.load(self.processed_paths[0])
  File "/home/philip/.local/lib/python3.8/site-packages/torch/serialization.py", line 1040, in load
    warnings.warn(
  File "/usr/lib/python3.8/warnings.py", line 109, in _showwarnmsg
    sw(msg.message, msg.category, msg.filename, msg.lineno,
  File "main.py", line 47, in warn_with_traceback
    traceback.print_stack(file=log)
/home/philip/projects/ltspice_examples_code_repo/Circuit-Completion-Using-GNNs/component_classification_with_link_prediction_head/evaluation/FEGIN/kernel/circuit_datasets.py:15: FutureWarning: You are using `torch.load` with `weights_only=False` (the current default value), which uses the default pickle module implicitly. It is possible to construct malicious pickle data which will execute arbitrary code during unpickling (See https://github.com/pytorch/pytorch/blob/main/SECURITY.md#untrusted-models for more details). In a future release, the default value for `weights_only` will be flipped to `True`. This limits the functions that could be executed during unpickling. Arbitrary objects will no longer be allowed to be loaded via this mode unless they are explicitly allowlisted by the user via `torch.serialization.add_safe_globals`. We recommend you start setting `weights_only=True` for any use case where you don't have full control of the loaded file. Please open an issue on GitHub for any issues related to this experimental feature.
  self.data, self.slices = torch.load(self.processed_paths[0])
