STDOUT:
Results will be saved in /home/philip/projects/ltspice_examples_code_repo/Circuit-Completion-Using-GNNs/component_classification_with_link_prediction_head/evaluation/FEGIN/results/model_FEGIN_dataset_ltspice_examples
Command line input: python main.py --data ltspice_examples --representation component_net --model FEGIN --layers 5 --hiddens 64 --batch_size 128 --lr 0.0001 --emb_size 512 --epochs 100 --save_appendix component_net_L5_H64_BS128_LR0.0001_E512 --no_val
 is saved.
-----
ltspice_examples - FEGIN
Using 5 layers, 64 hidden units, h = 2
Loading component_net representation dataset
ENTERED
Training FEGIN on component_net representation
Train: 3558, Test: 846
##################ITERATION #0 ****************************************
 epoch: 0, train_loss: 1.4016, test_loss: 1.3970, test_f1: 0.0793
 epoch: 1, train_loss: 1.3827, test_loss: 1.3818, test_f1: 0.2021
 epoch: 2, train_loss: 1.3661, test_loss: 1.3565, test_f1: 0.3940
 epoch: 3, train_loss: 1.3441, test_loss: 1.3294, test_f1: 0.3630
 epoch: 4, train_loss: 1.3191, test_loss: 1.3019, test_f1: 0.3281
 epoch: 5, train_loss: 1.2906, test_loss: 1.2721, test_f1: 0.3149
 epoch: 6, train_loss: 1.2630, test_loss: 1.2478, test_f1: 0.3156
 epoch: 7, train_loss: 1.2378, test_loss: 1.2239, test_f1: 0.3302
 epoch: 8, train_loss: 1.2163, test_loss: 1.2028, test_f1: 0.3436
 epoch: 9, train_loss: 1.1950, test_loss: 1.1817, test_f1: 0.3405
 epoch: 10, train_loss: 1.1820, test_loss: 1.1625, test_f1: 0.3481
 epoch: 11, train_loss: 1.1649, test_loss: 1.1437, test_f1: 0.3507
 epoch: 12, train_loss: 1.1432, test_loss: 1.1259, test_f1: 0.3499
 epoch: 13, train_loss: 1.1305, test_loss: 1.1059, test_f1: 0.3681
 epoch: 14, train_loss: 1.1157, test_loss: 1.0937, test_f1: 0.4015
 epoch: 15, train_loss: 1.1016, test_loss: 1.0786, test_f1: 0.4485
 epoch: 16, train_loss: 1.0856, test_loss: 1.0649, test_f1: 0.4779
 epoch: 17, train_loss: 1.0756, test_loss: 1.0511, test_f1: 0.4906
 epoch: 18, train_loss: 1.0558, test_loss: 1.0378, test_f1: 0.5032
 epoch: 19, train_loss: 1.0485, test_loss: 1.0345, test_f1: 0.5151
 epoch: 20, train_loss: 1.0279, test_loss: 1.0136, test_f1: 0.5285
 epoch: 21, train_loss: 1.0156, test_loss: 0.9929, test_f1: 0.5268
 epoch: 22, train_loss: 0.9996, test_loss: 0.9829, test_f1: 0.5293
 epoch: 23, train_loss: 0.9971, test_loss: 0.9648, test_f1: 0.5349
 epoch: 24, train_loss: 0.9738, test_loss: 0.9573, test_f1: 0.5328
 epoch: 25, train_loss: 0.9597, test_loss: 0.9805, test_f1: 0.5171
 epoch: 26, train_loss: 0.9436, test_loss: 0.9430, test_f1: 0.5234
 epoch: 27, train_loss: 0.9387, test_loss: 0.9426, test_f1: 0.5193
 epoch: 28, train_loss: 0.9186, test_loss: 0.9340, test_f1: 0.5216
 epoch: 29, train_loss: 0.9100, test_loss: 0.9491, test_f1: 0.5032
 epoch: 30, train_loss: 0.9070, test_loss: 0.9127, test_f1: 0.5371
 epoch: 31, train_loss: 0.8968, test_loss: 0.9337, test_f1: 0.5211
 epoch: 32, train_loss: 0.8939, test_loss: 0.9416, test_f1: 0.5228
 epoch: 33, train_loss: 0.8833, test_loss: 0.9377, test_f1: 0.5143
 epoch: 34, train_loss: 0.8855, test_loss: 0.9038, test_f1: 0.5366
 epoch: 35, train_loss: 0.8746, test_loss: 0.9599, test_f1: 0.5009
 epoch: 36, train_loss: 0.8688, test_loss: 0.9159, test_f1: 0.5141
 epoch: 37, train_loss: 0.8568, test_loss: 0.9364, test_f1: 0.5178
 epoch: 38, train_loss: 0.8540, test_loss: 0.9122, test_f1: 0.5299
 epoch: 39, train_loss: 0.8537, test_loss: 0.9272, test_f1: 0.5206
 epoch: 40, train_loss: 0.8495, test_loss: 0.9339, test_f1: 0.5229
 epoch: 41, train_loss: 0.8395, test_loss: 0.8922, test_f1: 0.5371
 epoch: 42, train_loss: 0.8454, test_loss: 0.9308, test_f1: 0.5314
 epoch: 43, train_loss: 0.8281, test_loss: 0.9310, test_f1: 0.5287
 epoch: 44, train_loss: 0.8201, test_loss: 0.9568, test_f1: 0.5299
 epoch: 45, train_loss: 0.8298, test_loss: 0.9238, test_f1: 0.5341
 epoch: 46, train_loss: 0.8097, test_loss: 0.9429, test_f1: 0.5333
 epoch: 47, train_loss: 0.8132, test_loss: 0.9388, test_f1: 0.5320
 epoch: 48, train_loss: 0.8077, test_loss: 0.9544, test_f1: 0.5377
 epoch: 49, train_loss: 0.8029, test_loss: 0.9350, test_f1: 0.5483
 epoch: 50, train_loss: 0.8025, test_loss: 0.9434, test_f1: 0.5310
 epoch: 51, train_loss: 0.8011, test_loss: 0.9262, test_f1: 0.5384
 epoch: 52, train_loss: 0.7782, test_loss: 0.9386, test_f1: 0.5296
 epoch: 53, train_loss: 0.7748, test_loss: 0.9381, test_f1: 0.5397
 epoch: 54, train_loss: 0.7803, test_loss: 0.9424, test_f1: 0.5506
 epoch: 55, train_loss: 0.7782, test_loss: 0.9421, test_f1: 0.5404
 epoch: 56, train_loss: 0.7837, test_loss: 0.9430, test_f1: 0.5382
 epoch: 57, train_loss: 0.7781, test_loss: 0.9351, test_f1: 0.5431
 epoch: 58, train_loss: 0.7834, test_loss: 0.9708, test_f1: 0.5352
 epoch: 59, train_loss: 0.7825, test_loss: 0.9373, test_f1: 0.5461
 epoch: 60, train_loss: 0.7777, test_loss: 0.9577, test_f1: 0.5317
 epoch: 61, train_loss: 0.7687, test_loss: 0.9518, test_f1: 0.5462
 epoch: 62, train_loss: 0.7624, test_loss: 0.9748, test_f1: 0.5306
 epoch: 63, train_loss: 0.7846, test_loss: 0.9610, test_f1: 0.5341
 epoch: 64, train_loss: 0.7752, test_loss: 0.9574, test_f1: 0.5262
 epoch: 65, train_loss: 0.7607, test_loss: 0.9574, test_f1: 0.5461
 epoch: 66, train_loss: 0.7716, test_loss: 0.9459, test_f1: 0.5352
 epoch: 67, train_loss: 0.7609, test_loss: 0.9743, test_f1: 0.5314
 epoch: 68, train_loss: 0.7675, test_loss: 0.9532, test_f1: 0.5464
 epoch: 69, train_loss: 0.7610, test_loss: 0.9556, test_f1: 0.5462
 epoch: 70, train_loss: 0.7674, test_loss: 0.9473, test_f1: 0.5551
 epoch: 71, train_loss: 0.7616, test_loss: 0.9597, test_f1: 0.5445
 epoch: 72, train_loss: 0.7549, test_loss: 0.9789, test_f1: 0.5423
 epoch: 73, train_loss: 0.7552, test_loss: 0.9649, test_f1: 0.5353
 epoch: 74, train_loss: 0.7498, test_loss: 0.9718, test_f1: 0.5346
 epoch: 75, train_loss: 0.7545, test_loss: 0.9589, test_f1: 0.5546
 epoch: 76, train_loss: 0.7514, test_loss: 0.9694, test_f1: 0.5820
 epoch: 77, train_loss: 0.7482, test_loss: 0.9570, test_f1: 0.5760
 epoch: 78, train_loss: 0.7416, test_loss: 0.9650, test_f1: 0.5798
 epoch: 79, train_loss: 0.7504, test_loss: 0.9595, test_f1: 0.5798
 epoch: 80, train_loss: 0.7466, test_loss: 0.9662, test_f1: 0.5783
 epoch: 81, train_loss: 0.7473, test_loss: 0.9531, test_f1: 0.5888
 epoch: 82, train_loss: 0.7384, test_loss: 0.9737, test_f1: 0.5944
 epoch: 83, train_loss: 0.7470, test_loss: 0.9610, test_f1: 0.5751
 epoch: 84, train_loss: 0.7391, test_loss: 0.9678, test_f1: 0.5754
 epoch: 85, train_loss: 0.7455, test_loss: 0.9679, test_f1: 0.5717
 epoch: 86, train_loss: 0.7299, test_loss: 0.9698, test_f1: 0.5762
 epoch: 87, train_loss: 0.7459, test_loss: 0.9676, test_f1: 0.5947
 epoch: 88, train_loss: 0.7330, test_loss: 0.9571, test_f1: 0.5815
 epoch: 89, train_loss: 0.7345, test_loss: 0.9584, test_f1: 0.5927
 epoch: 90, train_loss: 0.7372, test_loss: 0.9682, test_f1: 0.5836
 epoch: 91, train_loss: 0.7253, test_loss: 0.9715, test_f1: 0.5876
 epoch: 92, train_loss: 0.7261, test_loss: 0.9689, test_f1: 0.5886
 epoch: 93, train_loss: 0.7284, test_loss: 0.9698, test_f1: 0.5843
 epoch: 94, train_loss: 0.7289, test_loss: 0.9704, test_f1: 0.6042
 epoch: 95, train_loss: 0.7241, test_loss: 0.9907, test_f1: 0.5806
 epoch: 96, train_loss: 0.7217, test_loss: 0.9864, test_f1: 0.5892
 epoch: 97, train_loss: 0.7337, test_loss: 0.9772, test_f1: 0.5814
 epoch: 98, train_loss: 0.7247, test_loss: 0.9713, test_f1: 0.5884
 epoch: 99, train_loss: 0.7277, test_loss: 0.9796, test_f1: 0.5832
##################ITERATION #1 ****************************************
 epoch: 0, train_loss: 1.3274, test_loss: 1.3644, test_f1: 0.2270
 epoch: 1, train_loss: 1.2850, test_loss: 1.3183, test_f1: 0.2489
 epoch: 2, train_loss: 1.2586, test_loss: 1.2567, test_f1: 0.3592
 epoch: 3, train_loss: 1.2355, test_loss: 1.2094, test_f1: 0.3880
 epoch: 4, train_loss: 1.2123, test_loss: 1.1791, test_f1: 0.3987
 epoch: 5, train_loss: 1.1874, test_loss: 1.1571, test_f1: 0.4122
 epoch: 6, train_loss: 1.1664, test_loss: 1.1336, test_f1: 0.4349
 epoch: 7, train_loss: 1.1449, test_loss: 1.1069, test_f1: 0.4388
 epoch: 8, train_loss: 1.1202, test_loss: 1.0850, test_f1: 0.4500
 epoch: 9, train_loss: 1.0981, test_loss: 1.0686, test_f1: 0.4543
 epoch: 10, train_loss: 1.0794, test_loss: 1.0456, test_f1: 0.4600
 epoch: 11, train_loss: 1.0564, test_loss: 1.0225, test_f1: 0.4677
 epoch: 12, train_loss: 1.0417, test_loss: 1.0286, test_f1: 0.4710
 epoch: 13, train_loss: 1.0186, test_loss: 0.9918, test_f1: 0.4867
 epoch: 14, train_loss: 1.0079, test_loss: 0.9809, test_f1: 0.4930
 epoch: 15, train_loss: 0.9962, test_loss: 0.9746, test_f1: 0.4878
 epoch: 16, train_loss: 0.9791, test_loss: 0.9654, test_f1: 0.4795
 epoch: 17, train_loss: 0.9665, test_loss: 0.9467, test_f1: 0.4901
 epoch: 18, train_loss: 0.9557, test_loss: 0.9500, test_f1: 0.4989
 epoch: 19, train_loss: 0.9439, test_loss: 0.9369, test_f1: 0.4923
 epoch: 20, train_loss: 0.9312, test_loss: 0.9349, test_f1: 0.4897
 epoch: 21, train_loss: 0.9341, test_loss: 0.9294, test_f1: 0.5070
 epoch: 22, train_loss: 0.9184, test_loss: 0.9246, test_f1: 0.5008
 epoch: 23, train_loss: 0.9212, test_loss: 0.9203, test_f1: 0.5002
 epoch: 24, train_loss: 0.9100, test_loss: 0.9200, test_f1: 0.5130
 epoch: 25, train_loss: 0.8943, test_loss: 0.9448, test_f1: 0.5058
 epoch: 26, train_loss: 0.8983, test_loss: 0.9440, test_f1: 0.4935
 epoch: 27, train_loss: 0.8885, test_loss: 0.9136, test_f1: 0.5122
 epoch: 28, train_loss: 0.8678, test_loss: 0.8953, test_f1: 0.5159
 epoch: 29, train_loss: 0.8687, test_loss: 0.9422, test_f1: 0.5003
 epoch: 30, train_loss: 0.8614, test_loss: 0.9133, test_f1: 0.5150
 epoch: 31, train_loss: 0.8645, test_loss: 0.9235, test_f1: 0.5111
 epoch: 32, train_loss: 0.8581, test_loss: 0.9158, test_f1: 0.5075
 epoch: 33, train_loss: 0.8505, test_loss: 0.9344, test_f1: 0.4966
 epoch: 34, train_loss: 0.8455, test_loss: 0.9138, test_f1: 0.5145
 epoch: 35, train_loss: 0.8267, test_loss: 0.9247, test_f1: 0.5200
 epoch: 36, train_loss: 0.8404, test_loss: 0.9420, test_f1: 0.5219
 epoch: 37, train_loss: 0.8314, test_loss: 0.9120, test_f1: 0.5284
 epoch: 38, train_loss: 0.8376, test_loss: 0.9123, test_f1: 0.5286
 epoch: 39, train_loss: 0.8175, test_loss: 0.9218, test_f1: 0.5283
 epoch: 40, train_loss: 0.8252, test_loss: 0.9157, test_f1: 0.5216
 epoch: 41, train_loss: 0.8205, test_loss: 0.9588, test_f1: 0.5095
 epoch: 42, train_loss: 0.8054, test_loss: 0.9543, test_f1: 0.5090
 epoch: 43, train_loss: 0.8089, test_loss: 0.9093, test_f1: 0.5267
 epoch: 44, train_loss: 0.8086, test_loss: 0.9442, test_f1: 0.5274
 epoch: 45, train_loss: 0.8043, test_loss: 0.9479, test_f1: 0.5280
 epoch: 46, train_loss: 0.8019, test_loss: 0.9728, test_f1: 0.5203
 epoch: 47, train_loss: 0.7991, test_loss: 0.9262, test_f1: 0.5445
 epoch: 48, train_loss: 0.8030, test_loss: 0.9440, test_f1: 0.5363
 epoch: 49, train_loss: 0.7883, test_loss: 0.9554, test_f1: 0.5568
 epoch: 50, train_loss: 0.7918, test_loss: 0.9436, test_f1: 0.5484
 epoch: 51, train_loss: 0.7739, test_loss: 0.9422, test_f1: 0.5469
 epoch: 52, train_loss: 0.7809, test_loss: 0.9622, test_f1: 0.5518
 epoch: 53, train_loss: 0.7646, test_loss: 0.9517, test_f1: 0.5588
 epoch: 54, train_loss: 0.7695, test_loss: 0.9660, test_f1: 0.5516
 epoch: 55, train_loss: 0.7789, test_loss: 0.9572, test_f1: 0.5417
 epoch: 56, train_loss: 0.7884, test_loss: 0.9324, test_f1: 0.5562
 epoch: 57, train_loss: 0.7763, test_loss: 0.9538, test_f1: 0.5600
 epoch: 58, train_loss: 0.7665, test_loss: 0.9635, test_f1: 0.5571
 epoch: 59, train_loss: 0.7684, test_loss: 0.9436, test_f1: 0.5580
 epoch: 60, train_loss: 0.7573, test_loss: 0.9373, test_f1: 0.5502
 epoch: 61, train_loss: 0.7748, test_loss: 0.9500, test_f1: 0.5510
 epoch: 62, train_loss: 0.7644, test_loss: 0.9585, test_f1: 0.5544
 epoch: 63, train_loss: 0.7557, test_loss: 0.9721, test_f1: 0.5540
 epoch: 64, train_loss: 0.7580, test_loss: 0.9656, test_f1: 0.5471
 epoch: 65, train_loss: 0.7540, test_loss: 0.9621, test_f1: 0.5458
 epoch: 66, train_loss: 0.7596, test_loss: 0.9592, test_f1: 0.5462
 epoch: 67, train_loss: 0.7610, test_loss: 0.9663, test_f1: 0.5524
 epoch: 68, train_loss: 0.7449, test_loss: 0.9584, test_f1: 0.5549
 epoch: 69, train_loss: 0.7523, test_loss: 0.9481, test_f1: 0.5724
 epoch: 70, train_loss: 0.7571, test_loss: 0.9603, test_f1: 0.5425
 epoch: 71, train_loss: 0.7480, test_loss: 0.9751, test_f1: 0.5574
 epoch: 72, train_loss: 0.7390, test_loss: 0.9612, test_f1: 0.5464
 epoch: 73, train_loss: 0.7467, test_loss: 0.9829, test_f1: 0.5613
 epoch: 74, train_loss: 0.7474, test_loss: 0.9877, test_f1: 0.5478
 epoch: 75, train_loss: 0.7456, test_loss: 0.9563, test_f1: 0.5693
 epoch: 76, train_loss: 0.7552, test_loss: 0.9762, test_f1: 0.5596
 epoch: 77, train_loss: 0.7414, test_loss: 0.9625, test_f1: 0.5701
 epoch: 78, train_loss: 0.7412, test_loss: 0.9780, test_f1: 0.5550
 epoch: 79, train_loss: 0.7447, test_loss: 0.9698, test_f1: 0.5820
 epoch: 80, train_loss: 0.7396, test_loss: 0.9572, test_f1: 0.5722
 epoch: 81, train_loss: 0.7379, test_loss: 0.9808, test_f1: 0.5696
 epoch: 82, train_loss: 0.7386, test_loss: 0.9702, test_f1: 0.5648
 epoch: 83, train_loss: 0.7337, test_loss: 0.9767, test_f1: 0.5694
 epoch: 84, train_loss: 0.7339, test_loss: 0.9929, test_f1: 0.5738
 epoch: 85, train_loss: 0.7415, test_loss: 0.9793, test_f1: 0.5669
 epoch: 86, train_loss: 0.7326, test_loss: 0.9846, test_f1: 0.5656
 epoch: 87, train_loss: 0.7364, test_loss: 0.9793, test_f1: 0.5648
 epoch: 88, train_loss: 0.7230, test_loss: 0.9884, test_f1: 0.5653
 epoch: 89, train_loss: 0.7374, test_loss: 0.9762, test_f1: 0.5666
 epoch: 90, train_loss: 0.7205, test_loss: 0.9820, test_f1: 0.5731
 epoch: 91, train_loss: 0.7170, test_loss: 0.9662, test_f1: 0.5778
 epoch: 92, train_loss: 0.7138, test_loss: 0.9832, test_f1: 0.5689
 epoch: 93, train_loss: 0.7192, test_loss: 0.9884, test_f1: 0.5764
 epoch: 94, train_loss: 0.7170, test_loss: 0.9898, test_f1: 0.5675
 epoch: 95, train_loss: 0.7168, test_loss: 0.9953, test_f1: 0.5714
 epoch: 96, train_loss: 0.7093, test_loss: 0.9730, test_f1: 0.5780
 epoch: 97, train_loss: 0.7163, test_loss: 0.9863, test_f1: 0.5683
 epoch: 98, train_loss: 0.7142, test_loss: 0.9901, test_f1: 0.5721
 epoch: 99, train_loss: 0.7288, test_loss: 0.9947, test_f1: 0.5680
##################ITERATION #2 ****************************************
 epoch: 0, train_loss: 1.2949, test_loss: 1.3297, test_f1: 0.2270
 epoch: 1, train_loss: 1.2384, test_loss: 1.2574, test_f1: 0.2814
 epoch: 2, train_loss: 1.2100, test_loss: 1.1908, test_f1: 0.3357
 epoch: 3, train_loss: 1.1860, test_loss: 1.1416, test_f1: 0.4220
 epoch: 4, train_loss: 1.1595, test_loss: 1.1121, test_f1: 0.4402
 epoch: 5, train_loss: 1.1324, test_loss: 1.0872, test_f1: 0.4479
 epoch: 6, train_loss: 1.1100, test_loss: 1.0588, test_f1: 0.4724
 epoch: 7, train_loss: 1.0864, test_loss: 1.0418, test_f1: 0.4715
 epoch: 8, train_loss: 1.0732, test_loss: 1.0178, test_f1: 0.4825
 epoch: 9, train_loss: 1.0533, test_loss: 1.0113, test_f1: 0.4751
 epoch: 10, train_loss: 1.0348, test_loss: 0.9877, test_f1: 0.4769
 epoch: 11, train_loss: 1.0144, test_loss: 0.9709, test_f1: 0.4910
 epoch: 12, train_loss: 1.0154, test_loss: 0.9589, test_f1: 0.4997
 epoch: 13, train_loss: 0.9911, test_loss: 0.9523, test_f1: 0.5046
 epoch: 14, train_loss: 0.9749, test_loss: 0.9424, test_f1: 0.5010
 epoch: 15, train_loss: 0.9709, test_loss: 0.9390, test_f1: 0.5013
 epoch: 16, train_loss: 0.9616, test_loss: 0.9449, test_f1: 0.4926
 epoch: 17, train_loss: 0.9571, test_loss: 0.9518, test_f1: 0.4881
 epoch: 18, train_loss: 0.9442, test_loss: 0.9279, test_f1: 0.5058
 epoch: 19, train_loss: 0.9357, test_loss: 0.9226, test_f1: 0.5107
 epoch: 20, train_loss: 0.9317, test_loss: 0.9151, test_f1: 0.5115
 epoch: 21, train_loss: 0.9332, test_loss: 0.9219, test_f1: 0.5143
 epoch: 22, train_loss: 0.9194, test_loss: 0.9230, test_f1: 0.5033
 epoch: 23, train_loss: 0.9109, test_loss: 0.9273, test_f1: 0.5162
 epoch: 24, train_loss: 0.9000, test_loss: 0.9616, test_f1: 0.5082
 epoch: 25, train_loss: 0.9008, test_loss: 0.9389, test_f1: 0.5118
 epoch: 26, train_loss: 0.8897, test_loss: 0.9439, test_f1: 0.5166
 epoch: 27, train_loss: 0.8905, test_loss: 0.9344, test_f1: 0.5234
 epoch: 28, train_loss: 0.8809, test_loss: 0.9097, test_f1: 0.5478
 epoch: 29, train_loss: 0.8716, test_loss: 0.9435, test_f1: 0.5246
 epoch: 30, train_loss: 0.8694, test_loss: 0.9461, test_f1: 0.5182
 epoch: 31, train_loss: 0.8693, test_loss: 0.9812, test_f1: 0.5194
 epoch: 32, train_loss: 0.8675, test_loss: 0.9856, test_f1: 0.5213
 epoch: 33, train_loss: 0.8605, test_loss: 0.9380, test_f1: 0.5135
 epoch: 34, train_loss: 0.8617, test_loss: 0.9523, test_f1: 0.5307
 epoch: 35, train_loss: 0.8518, test_loss: 0.9219, test_f1: 0.5313
 epoch: 36, train_loss: 0.8533, test_loss: 0.9432, test_f1: 0.5366
 epoch: 37, train_loss: 0.8546, test_loss: 0.9446, test_f1: 0.5481
 epoch: 38, train_loss: 0.8515, test_loss: 0.9768, test_f1: 0.5293
 epoch: 39, train_loss: 0.8345, test_loss: 0.9567, test_f1: 0.5312
 epoch: 40, train_loss: 0.8452, test_loss: 0.9169, test_f1: 0.5418
 epoch: 41, train_loss: 0.8390, test_loss: 0.9913, test_f1: 0.5360
 epoch: 42, train_loss: 0.8381, test_loss: 0.9536, test_f1: 0.5422
 epoch: 43, train_loss: 0.8332, test_loss: 0.9516, test_f1: 0.5265
 epoch: 44, train_loss: 0.8316, test_loss: 0.9174, test_f1: 0.5382
 epoch: 45, train_loss: 0.8266, test_loss: 0.9576, test_f1: 0.5536
 epoch: 46, train_loss: 0.8108, test_loss: 0.9450, test_f1: 0.5407
 epoch: 47, train_loss: 0.8202, test_loss: 0.9766, test_f1: 0.5390
 epoch: 48, train_loss: 0.8066, test_loss: 0.9461, test_f1: 0.5299
 epoch: 49, train_loss: 0.8139, test_loss: 0.9691, test_f1: 0.5442
 epoch: 50, train_loss: 0.8061, test_loss: 0.9353, test_f1: 0.5441
 epoch: 51, train_loss: 0.8056, test_loss: 0.9587, test_f1: 0.5516
 epoch: 52, train_loss: 0.8055, test_loss: 0.9503, test_f1: 0.5359
 epoch: 53, train_loss: 0.7964, test_loss: 0.9713, test_f1: 0.5502
 epoch: 54, train_loss: 0.7911, test_loss: 0.9569, test_f1: 0.5429
 epoch: 55, train_loss: 0.7931, test_loss: 0.9549, test_f1: 0.5438
 epoch: 56, train_loss: 0.7895, test_loss: 0.9400, test_f1: 0.5523
 epoch: 57, train_loss: 0.7815, test_loss: 0.9622, test_f1: 0.5530
 epoch: 58, train_loss: 0.7871, test_loss: 0.9642, test_f1: 0.5493
 epoch: 59, train_loss: 0.7819, test_loss: 0.9708, test_f1: 0.5486
 epoch: 60, train_loss: 0.7860, test_loss: 0.9707, test_f1: 0.5515
 epoch: 61, train_loss: 0.7913, test_loss: 0.9841, test_f1: 0.5454
 epoch: 62, train_loss: 0.7893, test_loss: 0.9678, test_f1: 0.5526
 epoch: 63, train_loss: 0.7754, test_loss: 0.9740, test_f1: 0.5577
 epoch: 64, train_loss: 0.7782, test_loss: 0.9714, test_f1: 0.5584
 epoch: 65, train_loss: 0.7870, test_loss: 0.9678, test_f1: 0.5421
 epoch: 66, train_loss: 0.7746, test_loss: 0.9519, test_f1: 0.5602
 epoch: 67, train_loss: 0.7751, test_loss: 0.9727, test_f1: 0.5557
 epoch: 68, train_loss: 0.7755, test_loss: 0.9700, test_f1: 0.5729
 epoch: 69, train_loss: 0.7672, test_loss: 0.9641, test_f1: 0.5511
 epoch: 70, train_loss: 0.7677, test_loss: 0.9665, test_f1: 0.5717
 epoch: 71, train_loss: 0.7782, test_loss: 0.9715, test_f1: 0.5521
 epoch: 72, train_loss: 0.7622, test_loss: 0.9710, test_f1: 0.5504
 epoch: 73, train_loss: 0.7614, test_loss: 0.9692, test_f1: 0.5580
 epoch: 74, train_loss: 0.7726, test_loss: 0.9714, test_f1: 0.5595
 epoch: 75, train_loss: 0.7690, test_loss: 0.9765, test_f1: 0.5479
 epoch: 76, train_loss: 0.7579, test_loss: 0.9771, test_f1: 0.5639
 epoch: 77, train_loss: 0.7634, test_loss: 0.9752, test_f1: 0.5627
 epoch: 78, train_loss: 0.7584, test_loss: 0.9892, test_f1: 0.5666
 epoch: 79, train_loss: 0.7564, test_loss: 0.9706, test_f1: 0.5662
 epoch: 80, train_loss: 0.7536, test_loss: 0.9701, test_f1: 0.5561
 epoch: 81, train_loss: 0.7474, test_loss: 0.9747, test_f1: 0.5689
 epoch: 82, train_loss: 0.7608, test_loss: 0.9648, test_f1: 0.5736
 epoch: 83, train_loss: 0.7515, test_loss: 0.9826, test_f1: 0.5605
 epoch: 84, train_loss: 0.7441, test_loss: 0.9585, test_f1: 0.5688
 epoch: 85, train_loss: 0.7484, test_loss: 0.9780, test_f1: 0.5772
 epoch: 86, train_loss: 0.7489, test_loss: 0.9685, test_f1: 0.5615
 epoch: 87, train_loss: 0.7529, test_loss: 0.9746, test_f1: 0.5674
 epoch: 88, train_loss: 0.7468, test_loss: 0.9649, test_f1: 0.5705
 epoch: 89, train_loss: 0.7447, test_loss: 0.9739, test_f1: 0.5614
 epoch: 90, train_loss: 0.7468, test_loss: 0.9702, test_f1: 0.5684
 epoch: 91, train_loss: 0.7405, test_loss: 0.9751, test_f1: 0.5461
 epoch: 92, train_loss: 0.7434, test_loss: 0.9758, test_f1: 0.5687
 epoch: 93, train_loss: 0.7479, test_loss: 0.9739, test_f1: 0.5811
 epoch: 94, train_loss: 0.7474, test_loss: 0.9728, test_f1: 0.5739
 epoch: 95, train_loss: 0.7409, test_loss: 0.9873, test_f1: 0.5714
 epoch: 96, train_loss: 0.7327, test_loss: 0.9700, test_f1: 0.5700
 epoch: 97, train_loss: 0.7351, test_loss: 0.9913, test_f1: 0.5643
 epoch: 98, train_loss: 0.7360, test_loss: 0.9834, test_f1: 0.5689
 epoch: 99, train_loss: 0.7334, test_loss: 0.9763, test_f1: 0.5718
##################ITERATION #3 ****************************************
 epoch: 0, train_loss: 1.2695, test_loss: 1.3310, test_f1: 0.2320
 epoch: 1, train_loss: 1.2113, test_loss: 1.2212, test_f1: 0.4005
 epoch: 2, train_loss: 1.1836, test_loss: 1.1491, test_f1: 0.3982
 epoch: 3, train_loss: 1.1578, test_loss: 1.1102, test_f1: 0.4257
 epoch: 4, train_loss: 1.1385, test_loss: 1.0833, test_f1: 0.4440
 epoch: 5, train_loss: 1.1197, test_loss: 1.0568, test_f1: 0.4467
 epoch: 6, train_loss: 1.0951, test_loss: 1.0392, test_f1: 0.4564
 epoch: 7, train_loss: 1.0794, test_loss: 1.0152, test_f1: 0.4745
 epoch: 8, train_loss: 1.0604, test_loss: 1.0043, test_f1: 0.4819
 epoch: 9, train_loss: 1.0467, test_loss: 0.9797, test_f1: 0.4930
 epoch: 10, train_loss: 1.0317, test_loss: 0.9668, test_f1: 0.5086
 epoch: 11, train_loss: 1.0203, test_loss: 0.9611, test_f1: 0.5045
 epoch: 12, train_loss: 0.9973, test_loss: 0.9523, test_f1: 0.5009
 epoch: 13, train_loss: 0.9960, test_loss: 0.9433, test_f1: 0.5053
 epoch: 14, train_loss: 0.9881, test_loss: 0.9332, test_f1: 0.5163
 epoch: 15, train_loss: 0.9705, test_loss: 0.9305, test_f1: 0.5226
 epoch: 16, train_loss: 0.9611, test_loss: 0.9256, test_f1: 0.5217
 epoch: 17, train_loss: 0.9514, test_loss: 0.9140, test_f1: 0.5110
 epoch: 18, train_loss: 0.9458, test_loss: 0.9014, test_f1: 0.5171
 epoch: 19, train_loss: 0.9370, test_loss: 0.8991, test_f1: 0.5132
 epoch: 20, train_loss: 0.9360, test_loss: 0.9079, test_f1: 0.5306
 epoch: 21, train_loss: 0.9239, test_loss: 0.9043, test_f1: 0.5368
 epoch: 22, train_loss: 0.9088, test_loss: 0.9034, test_f1: 0.5417
 epoch: 23, train_loss: 0.9084, test_loss: 0.8928, test_f1: 0.5475
 epoch: 24, train_loss: 0.8988, test_loss: 0.8854, test_f1: 0.5385
 epoch: 25, train_loss: 0.8916, test_loss: 0.8944, test_f1: 0.5272
 epoch: 26, train_loss: 0.8870, test_loss: 0.8897, test_f1: 0.5410
 epoch: 27, train_loss: 0.8827, test_loss: 0.8989, test_f1: 0.5259
 epoch: 28, train_loss: 0.8889, test_loss: 0.8899, test_f1: 0.5333
 epoch: 29, train_loss: 0.8746, test_loss: 0.8803, test_f1: 0.5255
 epoch: 30, train_loss: 0.8650, test_loss: 0.8875, test_f1: 0.5437
 epoch: 31, train_loss: 0.8618, test_loss: 0.8925, test_f1: 0.5371
 epoch: 32, train_loss: 0.8607, test_loss: 0.8737, test_f1: 0.5360
 epoch: 33, train_loss: 0.8559, test_loss: 0.8888, test_f1: 0.5538
 epoch: 34, train_loss: 0.8482, test_loss: 0.9023, test_f1: 0.5367
 epoch: 35, train_loss: 0.8497, test_loss: 0.8981, test_f1: 0.5486
 epoch: 36, train_loss: 0.8436, test_loss: 0.8789, test_f1: 0.5497
 epoch: 37, train_loss: 0.8392, test_loss: 0.9000, test_f1: 0.5376
 epoch: 38, train_loss: 0.8360, test_loss: 0.8911, test_f1: 0.5272
 epoch: 39, train_loss: 0.8376, test_loss: 0.8867, test_f1: 0.5570
 epoch: 40, train_loss: 0.8202, test_loss: 0.9068, test_f1: 0.5321
 epoch: 41, train_loss: 0.8237, test_loss: 0.9024, test_f1: 0.5389
 epoch: 42, train_loss: 0.8187, test_loss: 0.8924, test_f1: 0.5501
 epoch: 43, train_loss: 0.8177, test_loss: 0.8993, test_f1: 0.5297
 epoch: 44, train_loss: 0.8234, test_loss: 0.8954, test_f1: 0.5393
 epoch: 45, train_loss: 0.8125, test_loss: 0.9054, test_f1: 0.5396
 epoch: 46, train_loss: 0.8116, test_loss: 0.9118, test_f1: 0.5334
 epoch: 47, train_loss: 0.8131, test_loss: 0.8921, test_f1: 0.5565
 epoch: 48, train_loss: 0.8101, test_loss: 0.9072, test_f1: 0.5665
 epoch: 49, train_loss: 0.7926, test_loss: 0.8913, test_f1: 0.5372
 epoch: 50, train_loss: 0.8016, test_loss: 0.9058, test_f1: 0.5352
 epoch: 51, train_loss: 0.7979, test_loss: 0.9013, test_f1: 0.5416
 epoch: 52, train_loss: 0.7803, test_loss: 0.8930, test_f1: 0.5359
 epoch: 53, train_loss: 0.7867, test_loss: 0.9006, test_f1: 0.5495
 epoch: 54, train_loss: 0.7820, test_loss: 0.9015, test_f1: 0.5456
 epoch: 55, train_loss: 0.7827, test_loss: 0.9007, test_f1: 0.5541
 epoch: 56, train_loss: 0.7798, test_loss: 0.9022, test_f1: 0.5488
 epoch: 57, train_loss: 0.7793, test_loss: 0.9033, test_f1: 0.5465
 epoch: 58, train_loss: 0.7811, test_loss: 0.9105, test_f1: 0.5572
 epoch: 59, train_loss: 0.7778, test_loss: 0.9066, test_f1: 0.5787
 epoch: 60, train_loss: 0.7790, test_loss: 0.9091, test_f1: 0.5766
 epoch: 61, train_loss: 0.7752, test_loss: 0.9011, test_f1: 0.5678
 epoch: 62, train_loss: 0.7607, test_loss: 0.9048, test_f1: 0.5785
 epoch: 63, train_loss: 0.7665, test_loss: 0.9027, test_f1: 0.5694
 epoch: 64, train_loss: 0.7641, test_loss: 0.9024, test_f1: 0.5773
 epoch: 65, train_loss: 0.7640, test_loss: 0.8996, test_f1: 0.5743
 epoch: 66, train_loss: 0.7664, test_loss: 0.9061, test_f1: 0.5712
 epoch: 67, train_loss: 0.7595, test_loss: 0.9099, test_f1: 0.5770
 epoch: 68, train_loss: 0.7629, test_loss: 0.9138, test_f1: 0.5664
 epoch: 69, train_loss: 0.7553, test_loss: 0.8983, test_f1: 0.5707
 epoch: 70, train_loss: 0.7602, test_loss: 0.9223, test_f1: 0.5691
 epoch: 71, train_loss: 0.7566, test_loss: 0.9135, test_f1: 0.5734
 epoch: 72, train_loss: 0.7503, test_loss: 0.9022, test_f1: 0.5680
 epoch: 73, train_loss: 0.7631, test_loss: 0.9095, test_f1: 0.5796
 epoch: 74, train_loss: 0.7488, test_loss: 0.9152, test_f1: 0.5855
 epoch: 75, train_loss: 0.7511, test_loss: 0.9099, test_f1: 0.5662
 epoch: 76, train_loss: 0.7503, test_loss: 0.8948, test_f1: 0.5684
 epoch: 77, train_loss: 0.7320, test_loss: 0.9119, test_f1: 0.5745
 epoch: 78, train_loss: 0.7410, test_loss: 0.9055, test_f1: 0.5757
 epoch: 79, train_loss: 0.7422, test_loss: 0.9041, test_f1: 0.5668
 epoch: 80, train_loss: 0.7414, test_loss: 0.9115, test_f1: 0.5703
 epoch: 81, train_loss: 0.7379, test_loss: 0.9161, test_f1: 0.5784
 epoch: 82, train_loss: 0.7382, test_loss: 0.9140, test_f1: 0.5642
 epoch: 83, train_loss: 0.7344, test_loss: 0.9159, test_f1: 0.5596
 epoch: 84, train_loss: 0.7354, test_loss: 0.9103, test_f1: 0.5753
 epoch: 85, train_loss: 0.7365, test_loss: 0.9172, test_f1: 0.5769
 epoch: 86, train_loss: 0.7330, test_loss: 0.9090, test_f1: 0.5728
 epoch: 87, train_loss: 0.7391, test_loss: 0.9085, test_f1: 0.5758
 epoch: 88, train_loss: 0.7244, test_loss: 0.9260, test_f1: 0.5699
 epoch: 89, train_loss: 0.7212, test_loss: 0.9056, test_f1: 0.5910
 epoch: 90, train_loss: 0.7301, test_loss: 0.9212, test_f1: 0.5775
 epoch: 91, train_loss: 0.7275, test_loss: 0.9145, test_f1: 0.5637
 epoch: 92, train_loss: 0.7244, test_loss: 0.9218, test_f1: 0.5613
 epoch: 93, train_loss: 0.7210, test_loss: 0.9201, test_f1: 0.5663
 epoch: 94, train_loss: 0.7275, test_loss: 0.9252, test_f1: 0.5726
 epoch: 95, train_loss: 0.7301, test_loss: 0.9219, test_f1: 0.5731
 epoch: 96, train_loss: 0.7222, test_loss: 0.9225, test_f1: 0.5774
 epoch: 97, train_loss: 0.7176, test_loss: 0.9276, test_f1: 0.5659
 epoch: 98, train_loss: 0.7135, test_loss: 0.9179, test_f1: 0.5808
 epoch: 99, train_loss: 0.7177, test_loss: 0.9275, test_f1: 0.5719
##################ITERATION #4 ****************************************
 epoch: 0, train_loss: 1.2763, test_loss: 1.3360, test_f1: 0.3228
 epoch: 1, train_loss: 1.1896, test_loss: 1.2047, test_f1: 0.3305
 epoch: 2, train_loss: 1.1555, test_loss: 1.1204, test_f1: 0.4166
 epoch: 3, train_loss: 1.1341, test_loss: 1.0708, test_f1: 0.4408
 epoch: 4, train_loss: 1.1041, test_loss: 1.0460, test_f1: 0.4508
 epoch: 5, train_loss: 1.0805, test_loss: 1.0199, test_f1: 0.4542
 epoch: 6, train_loss: 1.0523, test_loss: 0.9982, test_f1: 0.4483
 epoch: 7, train_loss: 1.0416, test_loss: 0.9833, test_f1: 0.4787
 epoch: 8, train_loss: 1.0247, test_loss: 0.9710, test_f1: 0.4885
 epoch: 9, train_loss: 1.0107, test_loss: 0.9568, test_f1: 0.4841
 epoch: 10, train_loss: 0.9924, test_loss: 0.9473, test_f1: 0.4975
 epoch: 11, train_loss: 0.9866, test_loss: 0.9346, test_f1: 0.4976
 epoch: 12, train_loss: 0.9831, test_loss: 0.9308, test_f1: 0.5084
 epoch: 13, train_loss: 0.9670, test_loss: 0.9233, test_f1: 0.5086
 epoch: 14, train_loss: 0.9501, test_loss: 0.9201, test_f1: 0.5086
 epoch: 15, train_loss: 0.9480, test_loss: 0.9181, test_f1: 0.5171
 epoch: 16, train_loss: 0.9383, test_loss: 0.9050, test_f1: 0.5100
 epoch: 17, train_loss: 0.9354, test_loss: 0.9058, test_f1: 0.5188
 epoch: 18, train_loss: 0.9249, test_loss: 0.9115, test_f1: 0.5160
 epoch: 19, train_loss: 0.9235, test_loss: 0.9054, test_f1: 0.5258
 epoch: 20, train_loss: 0.9112, test_loss: 0.9165, test_f1: 0.5326
 epoch: 21, train_loss: 0.8964, test_loss: 0.9095, test_f1: 0.5341
 epoch: 22, train_loss: 0.8957, test_loss: 0.9110, test_f1: 0.5281
 epoch: 23, train_loss: 0.9000, test_loss: 0.9047, test_f1: 0.5267
 epoch: 24, train_loss: 0.8871, test_loss: 0.9089, test_f1: 0.5498
 epoch: 25, train_loss: 0.8929, test_loss: 0.9263, test_f1: 0.5491
 epoch: 26, train_loss: 0.8801, test_loss: 0.9220, test_f1: 0.5340
 epoch: 27, train_loss: 0.8731, test_loss: 0.9111, test_f1: 0.5343
 epoch: 28, train_loss: 0.8765, test_loss: 0.9092, test_f1: 0.5355
 epoch: 29, train_loss: 0.8640, test_loss: 0.8997, test_f1: 0.5389
 epoch: 30, train_loss: 0.8546, test_loss: 0.9095, test_f1: 0.5443
 epoch: 31, train_loss: 0.8669, test_loss: 0.9040, test_f1: 0.5454
 epoch: 32, train_loss: 0.8519, test_loss: 0.9220, test_f1: 0.5474
 epoch: 33, train_loss: 0.8496, test_loss: 0.9253, test_f1: 0.5527
 epoch: 34, train_loss: 0.8447, test_loss: 0.9295, test_f1: 0.5556
 epoch: 35, train_loss: 0.8454, test_loss: 0.9242, test_f1: 0.5552
 epoch: 36, train_loss: 0.8391, test_loss: 0.9093, test_f1: 0.5451
 epoch: 37, train_loss: 0.8412, test_loss: 0.9182, test_f1: 0.5430
 epoch: 38, train_loss: 0.8386, test_loss: 0.9296, test_f1: 0.5357
 epoch: 39, train_loss: 0.8290, test_loss: 0.9154, test_f1: 0.5469
 epoch: 40, train_loss: 0.8296, test_loss: 0.9215, test_f1: 0.5456
 epoch: 41, train_loss: 0.8193, test_loss: 0.9389, test_f1: 0.5278
 epoch: 42, train_loss: 0.8169, test_loss: 0.9193, test_f1: 0.5443
 epoch: 43, train_loss: 0.8176, test_loss: 0.9221, test_f1: 0.5546
 epoch: 44, train_loss: 0.8165, test_loss: 0.9221, test_f1: 0.5400
 epoch: 45, train_loss: 0.8154, test_loss: 0.9104, test_f1: 0.5515
 epoch: 46, train_loss: 0.8070, test_loss: 0.9241, test_f1: 0.5495
 epoch: 47, train_loss: 0.8002, test_loss: 0.9258, test_f1: 0.5551
 epoch: 48, train_loss: 0.8035, test_loss: 0.9286, test_f1: 0.5480
 epoch: 49, train_loss: 0.7979, test_loss: 0.9240, test_f1: 0.5483
 epoch: 50, train_loss: 0.8031, test_loss: 0.9294, test_f1: 0.5470
 epoch: 51, train_loss: 0.7936, test_loss: 0.9289, test_f1: 0.5516
 epoch: 52, train_loss: 0.7845, test_loss: 0.9291, test_f1: 0.5525
 epoch: 53, train_loss: 0.7819, test_loss: 0.9256, test_f1: 0.5581
 epoch: 54, train_loss: 0.7847, test_loss: 0.9231, test_f1: 0.5585
 epoch: 55, train_loss: 0.7717, test_loss: 0.9288, test_f1: 0.5532
 epoch: 56, train_loss: 0.7812, test_loss: 0.9348, test_f1: 0.5600
 epoch: 57, train_loss: 0.7672, test_loss: 0.9358, test_f1: 0.5644
 epoch: 58, train_loss: 0.7808, test_loss: 0.9251, test_f1: 0.5636
 epoch: 59, train_loss: 0.7725, test_loss: 0.9310, test_f1: 0.5663
 epoch: 60, train_loss: 0.7761, test_loss: 0.9265, test_f1: 0.5666
 epoch: 61, train_loss: 0.7743, test_loss: 0.9335, test_f1: 0.5586
 epoch: 62, train_loss: 0.7743, test_loss: 0.9243, test_f1: 0.5599
 epoch: 63, train_loss: 0.7767, test_loss: 0.9301, test_f1: 0.5666
 epoch: 64, train_loss: 0.7630, test_loss: 0.9304, test_f1: 0.5641
 epoch: 65, train_loss: 0.7709, test_loss: 0.9381, test_f1: 0.5651
 epoch: 66, train_loss: 0.7682, test_loss: 0.9339, test_f1: 0.5675
 epoch: 67, train_loss: 0.7593, test_loss: 0.9259, test_f1: 0.5632
 epoch: 68, train_loss: 0.7580, test_loss: 0.9254, test_f1: 0.5792
 epoch: 69, train_loss: 0.7587, test_loss: 0.9417, test_f1: 0.5729
 epoch: 70, train_loss: 0.7629, test_loss: 0.9444, test_f1: 0.5589
 epoch: 71, train_loss: 0.7663, test_loss: 0.9458, test_f1: 0.5591
 epoch: 72, train_loss: 0.7658, test_loss: 0.9501, test_f1: 0.5773
 epoch: 73, train_loss: 0.7499, test_loss: 0.9390, test_f1: 0.5608
 epoch: 74, train_loss: 0.7556, test_loss: 0.9470, test_f1: 0.5610
 epoch: 75, train_loss: 0.7442, test_loss: 0.9521, test_f1: 0.5681
 epoch: 76, train_loss: 0.7521, test_loss: 0.9293, test_f1: 0.5738
 epoch: 77, train_loss: 0.7549, test_loss: 0.9333, test_f1: 0.5706
 epoch: 78, train_loss: 0.7517, test_loss: 0.9504, test_f1: 0.5722
 epoch: 79, train_loss: 0.7486, test_loss: 0.9456, test_f1: 0.5793
 epoch: 80, train_loss: 0.7535, test_loss: 0.9339, test_f1: 0.5688
 epoch: 81, train_loss: 0.7409, test_loss: 0.9470, test_f1: 0.5764
 epoch: 82, train_loss: 0.7401, test_loss: 0.9566, test_f1: 0.5759
 epoch: 83, train_loss: 0.7453, test_loss: 0.9365, test_f1: 0.5801
 epoch: 84, train_loss: 0.7360, test_loss: 0.9608, test_f1: 0.5758
 epoch: 85, train_loss: 0.7324, test_loss: 0.9483, test_f1: 0.5775
 epoch: 86, train_loss: 0.7482, test_loss: 0.9486, test_f1: 0.5679
 epoch: 87, train_loss: 0.7459, test_loss: 0.9524, test_f1: 0.5724
 epoch: 88, train_loss: 0.7402, test_loss: 0.9469, test_f1: 0.5886
 epoch: 89, train_loss: 0.7366, test_loss: 0.9544, test_f1: 0.5791
 epoch: 90, train_loss: 0.7429, test_loss: 0.9503, test_f1: 0.5815
 epoch: 91, train_loss: 0.7414, test_loss: 0.9506, test_f1: 0.5803
 epoch: 92, train_loss: 0.7350, test_loss: 0.9540, test_f1: 0.5764
 epoch: 93, train_loss: 0.7426, test_loss: 0.9508, test_f1: 0.5821
 epoch: 94, train_loss: 0.7344, test_loss: 0.9338, test_f1: 0.5807
 epoch: 95, train_loss: 0.7267, test_loss: 0.9555, test_f1: 0.5780
 epoch: 96, train_loss: 0.7322, test_loss: 0.9533, test_f1: 0.5822
 epoch: 97, train_loss: 0.7377, test_loss: 0.9485, test_f1: 0.5867
 epoch: 98, train_loss: 0.7296, test_loss: 0.9415, test_f1: 0.5848
 epoch: 99, train_loss: 0.7241, test_loss: 0.9441, test_f1: 0.5826
##################ITERATION #5 ****************************************
 epoch: 0, train_loss: 1.2616, test_loss: 1.3483, test_f1: 0.3374
 epoch: 1, train_loss: 1.1901, test_loss: 1.2298, test_f1: 0.3253
 epoch: 2, train_loss: 1.1627, test_loss: 1.1458, test_f1: 0.3747
 epoch: 3, train_loss: 1.1449, test_loss: 1.1107, test_f1: 0.3861
 epoch: 4, train_loss: 1.1183, test_loss: 1.0840, test_f1: 0.4174
 epoch: 5, train_loss: 1.1049, test_loss: 1.0616, test_f1: 0.4335
 epoch: 6, train_loss: 1.0787, test_loss: 1.0427, test_f1: 0.4391
 epoch: 7, train_loss: 1.0658, test_loss: 1.0213, test_f1: 0.4516
 epoch: 8, train_loss: 1.0430, test_loss: 1.0156, test_f1: 0.4545
 epoch: 9, train_loss: 1.0394, test_loss: 0.9991, test_f1: 0.4683
 epoch: 10, train_loss: 1.0228, test_loss: 0.9926, test_f1: 0.4750
 epoch: 11, train_loss: 1.0106, test_loss: 0.9745, test_f1: 0.4784
 epoch: 12, train_loss: 1.0061, test_loss: 0.9692, test_f1: 0.4786
 epoch: 13, train_loss: 0.9968, test_loss: 0.9736, test_f1: 0.4870
 epoch: 14, train_loss: 0.9759, test_loss: 0.9580, test_f1: 0.5022
 epoch: 15, train_loss: 0.9658, test_loss: 0.9488, test_f1: 0.4960
 epoch: 16, train_loss: 0.9579, test_loss: 0.9506, test_f1: 0.4986
 epoch: 17, train_loss: 0.9523, test_loss: 0.9313, test_f1: 0.5156
 epoch: 18, train_loss: 0.9399, test_loss: 0.9423, test_f1: 0.5131
 epoch: 19, train_loss: 0.9259, test_loss: 0.9240, test_f1: 0.5154
 epoch: 20, train_loss: 0.9306, test_loss: 0.9350, test_f1: 0.5257
 epoch: 21, train_loss: 0.9146, test_loss: 0.9391, test_f1: 0.5294
 epoch: 22, train_loss: 0.9116, test_loss: 0.9337, test_f1: 0.5241
 epoch: 23, train_loss: 0.9038, test_loss: 0.9253, test_f1: 0.5371
 epoch: 24, train_loss: 0.9038, test_loss: 0.9305, test_f1: 0.5407
 epoch: 25, train_loss: 0.8984, test_loss: 0.9366, test_f1: 0.5413
 epoch: 26, train_loss: 0.8936, test_loss: 0.9277, test_f1: 0.5450
 epoch: 27, train_loss: 0.8741, test_loss: 0.9189, test_f1: 0.5368
 epoch: 28, train_loss: 0.8756, test_loss: 0.9213, test_f1: 0.5455
 epoch: 29, train_loss: 0.8802, test_loss: 0.9324, test_f1: 0.5470
 epoch: 30, train_loss: 0.8685, test_loss: 0.9261, test_f1: 0.5547
 epoch: 31, train_loss: 0.8604, test_loss: 0.9250, test_f1: 0.5518
 epoch: 32, train_loss: 0.8557, test_loss: 0.9179, test_f1: 0.5488
 epoch: 33, train_loss: 0.8597, test_loss: 0.9287, test_f1: 0.5395
 epoch: 34, train_loss: 0.8632, test_loss: 0.9328, test_f1: 0.5348
 epoch: 35, train_loss: 0.8508, test_loss: 0.9219, test_f1: 0.5485
 epoch: 36, train_loss: 0.8427, test_loss: 0.9178, test_f1: 0.5549
 epoch: 37, train_loss: 0.8360, test_loss: 0.9250, test_f1: 0.5560
 epoch: 38, train_loss: 0.8303, test_loss: 0.9276, test_f1: 0.5529
 epoch: 39, train_loss: 0.8254, test_loss: 0.9233, test_f1: 0.5629
 epoch: 40, train_loss: 0.8225, test_loss: 0.9238, test_f1: 0.5504
 epoch: 41, train_loss: 0.8212, test_loss: 0.9195, test_f1: 0.5512
 epoch: 42, train_loss: 0.8185, test_loss: 0.9179, test_f1: 0.5623
 epoch: 43, train_loss: 0.8187, test_loss: 0.9277, test_f1: 0.5606
 epoch: 44, train_loss: 0.8095, test_loss: 0.9276, test_f1: 0.5532
 epoch: 45, train_loss: 0.8074, test_loss: 0.9240, test_f1: 0.5598
 epoch: 46, train_loss: 0.8081, test_loss: 0.9322, test_f1: 0.5479
 epoch: 47, train_loss: 0.8009, test_loss: 0.9324, test_f1: 0.5556
 epoch: 48, train_loss: 0.8082, test_loss: 0.9476, test_f1: 0.5591
 epoch: 49, train_loss: 0.7906, test_loss: 0.9415, test_f1: 0.5537
 epoch: 50, train_loss: 0.7954, test_loss: 0.9407, test_f1: 0.5672
 epoch: 51, train_loss: 0.7762, test_loss: 0.9418, test_f1: 0.5649
 epoch: 52, train_loss: 0.7834, test_loss: 0.9376, test_f1: 0.5597
 epoch: 53, train_loss: 0.7787, test_loss: 0.9303, test_f1: 0.5621
 epoch: 54, train_loss: 0.7687, test_loss: 0.9286, test_f1: 0.5737
 epoch: 55, train_loss: 0.7735, test_loss: 0.9319, test_f1: 0.5580
 epoch: 56, train_loss: 0.7819, test_loss: 0.9312, test_f1: 0.5584
 epoch: 57, train_loss: 0.7661, test_loss: 0.9473, test_f1: 0.5558
 epoch: 58, train_loss: 0.7774, test_loss: 0.9330, test_f1: 0.5615
 epoch: 59, train_loss: 0.7684, test_loss: 0.9330, test_f1: 0.5531
 epoch: 60, train_loss: 0.7658, test_loss: 0.9370, test_f1: 0.5646
 epoch: 61, train_loss: 0.7744, test_loss: 0.9343, test_f1: 0.5610
 epoch: 62, train_loss: 0.7618, test_loss: 0.9364, test_f1: 0.5596
 epoch: 63, train_loss: 0.7598, test_loss: 0.9482, test_f1: 0.5551
 epoch: 64, train_loss: 0.7637, test_loss: 0.9597, test_f1: 0.5645
 epoch: 65, train_loss: 0.7579, test_loss: 0.9526, test_f1: 0.5615
 epoch: 66, train_loss: 0.7654, test_loss: 0.9423, test_f1: 0.5583
 epoch: 67, train_loss: 0.7535, test_loss: 0.9416, test_f1: 0.5577
 epoch: 68, train_loss: 0.7428, test_loss: 0.9441, test_f1: 0.5578
 epoch: 69, train_loss: 0.7491, test_loss: 0.9467, test_f1: 0.5655
 epoch: 70, train_loss: 0.7626, test_loss: 0.9451, test_f1: 0.5707
 epoch: 71, train_loss: 0.7564, test_loss: 0.9577, test_f1: 0.5644
 epoch: 72, train_loss: 0.7457, test_loss: 0.9439, test_f1: 0.5667
 epoch: 73, train_loss: 0.7481, test_loss: 0.9599, test_f1: 0.5645
 epoch: 74, train_loss: 0.7393, test_loss: 0.9507, test_f1: 0.5602
 epoch: 75, train_loss: 0.7530, test_loss: 0.9569, test_f1: 0.5604
 epoch: 76, train_loss: 0.7498, test_loss: 0.9402, test_f1: 0.5691
 epoch: 77, train_loss: 0.7358, test_loss: 0.9403, test_f1: 0.5720
 epoch: 78, train_loss: 0.7521, test_loss: 0.9367, test_f1: 0.5665
 epoch: 79, train_loss: 0.7342, test_loss: 0.9441, test_f1: 0.5631
 epoch: 80, train_loss: 0.7427, test_loss: 0.9489, test_f1: 0.5579
 epoch: 81, train_loss: 0.7354, test_loss: 0.9491, test_f1: 0.5584
 epoch: 82, train_loss: 0.7248, test_loss: 0.9686, test_f1: 0.5535
 epoch: 83, train_loss: 0.7366, test_loss: 0.9491, test_f1: 0.5625
 epoch: 84, train_loss: 0.7308, test_loss: 0.9524, test_f1: 0.5595
 epoch: 85, train_loss: 0.7200, test_loss: 0.9527, test_f1: 0.5763
 epoch: 86, train_loss: 0.7271, test_loss: 0.9666, test_f1: 0.5634
 epoch: 87, train_loss: 0.7268, test_loss: 0.9583, test_f1: 0.5604
 epoch: 88, train_loss: 0.7345, test_loss: 0.9676, test_f1: 0.5626
 epoch: 89, train_loss: 0.7208, test_loss: 0.9594, test_f1: 0.5683
 epoch: 90, train_loss: 0.7232, test_loss: 0.9557, test_f1: 0.5623
 epoch: 91, train_loss: 0.7199, test_loss: 0.9667, test_f1: 0.5646
 epoch: 92, train_loss: 0.7160, test_loss: 0.9629, test_f1: 0.5685
 epoch: 93, train_loss: 0.7047, test_loss: 0.9616, test_f1: 0.5656
 epoch: 94, train_loss: 0.7147, test_loss: 0.9685, test_f1: 0.5598
 epoch: 95, train_loss: 0.7201, test_loss: 0.9579, test_f1: 0.5673
 epoch: 96, train_loss: 0.7055, test_loss: 0.9606, test_f1: 0.5776
 epoch: 97, train_loss: 0.7162, test_loss: 0.9564, test_f1: 0.5684
 epoch: 98, train_loss: 0.7107, test_loss: 0.9677, test_f1: 0.5668
 epoch: 99, train_loss: 0.7110, test_loss: 0.9561, test_f1: 0.5773
##################ITERATION #6 ****************************************
 epoch: 0, train_loss: 1.3133, test_loss: 1.3548, test_f1: 0.2724
 epoch: 1, train_loss: 1.2042, test_loss: 1.2213, test_f1: 0.3000
 epoch: 2, train_loss: 1.1635, test_loss: 1.1159, test_f1: 0.4155
 epoch: 3, train_loss: 1.1324, test_loss: 1.0729, test_f1: 0.4435
 epoch: 4, train_loss: 1.1051, test_loss: 1.0462, test_f1: 0.4750
 epoch: 5, train_loss: 1.0816, test_loss: 1.0279, test_f1: 0.4692
 epoch: 6, train_loss: 1.0591, test_loss: 1.0000, test_f1: 0.4872
 epoch: 7, train_loss: 1.0390, test_loss: 0.9759, test_f1: 0.5001
 epoch: 8, train_loss: 1.0357, test_loss: 0.9787, test_f1: 0.4952
 epoch: 9, train_loss: 1.0147, test_loss: 0.9501, test_f1: 0.5154
 epoch: 10, train_loss: 1.0039, test_loss: 0.9455, test_f1: 0.5071
 epoch: 11, train_loss: 0.9978, test_loss: 0.9377, test_f1: 0.5073
 epoch: 12, train_loss: 0.9796, test_loss: 0.9308, test_f1: 0.5170
 epoch: 13, train_loss: 0.9740, test_loss: 0.9304, test_f1: 0.5163
 epoch: 14, train_loss: 0.9646, test_loss: 0.9168, test_f1: 0.5356
 epoch: 15, train_loss: 0.9502, test_loss: 0.9170, test_f1: 0.5194
 epoch: 16, train_loss: 0.9509, test_loss: 0.9185, test_f1: 0.5191
 epoch: 17, train_loss: 0.9281, test_loss: 0.9142, test_f1: 0.5239
 epoch: 18, train_loss: 0.9213, test_loss: 0.9053, test_f1: 0.5309
 epoch: 19, train_loss: 0.9148, test_loss: 0.9182, test_f1: 0.5289
 epoch: 20, train_loss: 0.9128, test_loss: 0.9019, test_f1: 0.5452
 epoch: 21, train_loss: 0.9143, test_loss: 0.9122, test_f1: 0.5146
 epoch: 22, train_loss: 0.8987, test_loss: 0.9018, test_f1: 0.5314
 epoch: 23, train_loss: 0.9075, test_loss: 0.9137, test_f1: 0.5371
 epoch: 24, train_loss: 0.8941, test_loss: 0.9237, test_f1: 0.5149
 epoch: 25, train_loss: 0.8938, test_loss: 0.9129, test_f1: 0.5250
 epoch: 26, train_loss: 0.8839, test_loss: 0.9044, test_f1: 0.5436
 epoch: 27, train_loss: 0.8766, test_loss: 0.9218, test_f1: 0.5387
 epoch: 28, train_loss: 0.8812, test_loss: 0.9069, test_f1: 0.5398
 epoch: 29, train_loss: 0.8723, test_loss: 0.9200, test_f1: 0.5282
 epoch: 30, train_loss: 0.8694, test_loss: 0.9173, test_f1: 0.5328
 epoch: 31, train_loss: 0.8628, test_loss: 0.9135, test_f1: 0.5388
 epoch: 32, train_loss: 0.8642, test_loss: 0.9061, test_f1: 0.5451
 epoch: 33, train_loss: 0.8567, test_loss: 0.9195, test_f1: 0.5363
 epoch: 34, train_loss: 0.8598, test_loss: 0.9241, test_f1: 0.5361
 epoch: 35, train_loss: 0.8467, test_loss: 0.9213, test_f1: 0.5356
 epoch: 36, train_loss: 0.8526, test_loss: 0.9110, test_f1: 0.5404
 epoch: 37, train_loss: 0.8533, test_loss: 0.9103, test_f1: 0.5334
 epoch: 38, train_loss: 0.8377, test_loss: 0.9075, test_f1: 0.5356
 epoch: 39, train_loss: 0.8333, test_loss: 0.9165, test_f1: 0.5480
 epoch: 40, train_loss: 0.8300, test_loss: 0.9239, test_f1: 0.5324
 epoch: 41, train_loss: 0.8280, test_loss: 0.9111, test_f1: 0.5322
 epoch: 42, train_loss: 0.8319, test_loss: 0.9253, test_f1: 0.5316
 epoch: 43, train_loss: 0.8235, test_loss: 0.9467, test_f1: 0.5350
 epoch: 44, train_loss: 0.8212, test_loss: 0.9421, test_f1: 0.5301
 epoch: 45, train_loss: 0.8344, test_loss: 0.9419, test_f1: 0.5298
 epoch: 46, train_loss: 0.8165, test_loss: 0.9085, test_f1: 0.5504
 epoch: 47, train_loss: 0.8219, test_loss: 0.9331, test_f1: 0.5373
 epoch: 48, train_loss: 0.8119, test_loss: 0.9281, test_f1: 0.5456
 epoch: 49, train_loss: 0.8028, test_loss: 0.9193, test_f1: 0.5434
 epoch: 50, train_loss: 0.8096, test_loss: 0.9455, test_f1: 0.5387
 epoch: 51, train_loss: 0.7914, test_loss: 0.9257, test_f1: 0.5400
 epoch: 52, train_loss: 0.8015, test_loss: 0.9517, test_f1: 0.5397
 epoch: 53, train_loss: 0.7942, test_loss: 0.9492, test_f1: 0.5278
 epoch: 54, train_loss: 0.7933, test_loss: 0.9305, test_f1: 0.5412
 epoch: 55, train_loss: 0.7934, test_loss: 0.9411, test_f1: 0.5394
 epoch: 56, train_loss: 0.7871, test_loss: 0.9288, test_f1: 0.5376
 epoch: 57, train_loss: 0.7883, test_loss: 0.9424, test_f1: 0.5394
 epoch: 58, train_loss: 0.7924, test_loss: 0.9444, test_f1: 0.5371
 epoch: 59, train_loss: 0.7753, test_loss: 0.9497, test_f1: 0.5443
 epoch: 60, train_loss: 0.7938, test_loss: 0.9431, test_f1: 0.5475
 epoch: 61, train_loss: 0.7788, test_loss: 0.9350, test_f1: 0.5522
 epoch: 62, train_loss: 0.7885, test_loss: 0.9518, test_f1: 0.5488
 epoch: 63, train_loss: 0.7827, test_loss: 0.9253, test_f1: 0.5633
 epoch: 64, train_loss: 0.7799, test_loss: 0.9255, test_f1: 0.5582
 epoch: 65, train_loss: 0.7767, test_loss: 0.9238, test_f1: 0.5449
 epoch: 66, train_loss: 0.7748, test_loss: 0.9357, test_f1: 0.5556
 epoch: 67, train_loss: 0.7666, test_loss: 0.9365, test_f1: 0.5570
 epoch: 68, train_loss: 0.7750, test_loss: 0.9390, test_f1: 0.5549
 epoch: 69, train_loss: 0.7782, test_loss: 0.9373, test_f1: 0.5524
 epoch: 70, train_loss: 0.7697, test_loss: 0.9270, test_f1: 0.5451
 epoch: 71, train_loss: 0.7789, test_loss: 0.9593, test_f1: 0.5473
 epoch: 72, train_loss: 0.7557, test_loss: 0.9464, test_f1: 0.5645
 epoch: 73, train_loss: 0.7640, test_loss: 0.9503, test_f1: 0.5587
 epoch: 74, train_loss: 0.7639, test_loss: 0.9398, test_f1: 0.5678
 epoch: 75, train_loss: 0.7664, test_loss: 0.9496, test_f1: 0.5603
 epoch: 76, train_loss: 0.7645, test_loss: 0.9476, test_f1: 0.5579
 epoch: 77, train_loss: 0.7631, test_loss: 0.9306, test_f1: 0.5757
 epoch: 78, train_loss: 0.7648, test_loss: 0.9491, test_f1: 0.5643
 epoch: 79, train_loss: 0.7666, test_loss: 0.9469, test_f1: 0.5555
 epoch: 80, train_loss: 0.7542, test_loss: 0.9372, test_f1: 0.5603
 epoch: 81, train_loss: 0.7633, test_loss: 0.9529, test_f1: 0.5619
 epoch: 82, train_loss: 0.7608, test_loss: 0.9479, test_f1: 0.5652
 epoch: 83, train_loss: 0.7577, test_loss: 0.9683, test_f1: 0.5535
 epoch: 84, train_loss: 0.7579, test_loss: 0.9694, test_f1: 0.5568
 epoch: 85, train_loss: 0.7500, test_loss: 0.9581, test_f1: 0.5604
 epoch: 86, train_loss: 0.7533, test_loss: 0.9633, test_f1: 0.5687
 epoch: 87, train_loss: 0.7578, test_loss: 0.9693, test_f1: 0.5655
 epoch: 88, train_loss: 0.7420, test_loss: 0.9686, test_f1: 0.5471
 epoch: 89, train_loss: 0.7525, test_loss: 0.9710, test_f1: 0.5652
 epoch: 90, train_loss: 0.7439, test_loss: 0.9712, test_f1: 0.5650
 epoch: 91, train_loss: 0.7492, test_loss: 0.9681, test_f1: 0.5603
 epoch: 92, train_loss: 0.7422, test_loss: 0.9692, test_f1: 0.5619
 epoch: 93, train_loss: 0.7380, test_loss: 0.9859, test_f1: 0.5570
 epoch: 94, train_loss: 0.7442, test_loss: 0.9820, test_f1: 0.5530
 epoch: 95, train_loss: 0.7542, test_loss: 0.9914, test_f1: 0.5708
 epoch: 96, train_loss: 0.7393, test_loss: 0.9642, test_f1: 0.5595
 epoch: 97, train_loss: 0.7439, test_loss: 0.9836, test_f1: 0.5663
 epoch: 98, train_loss: 0.7427, test_loss: 0.9840, test_f1: 0.5703
 epoch: 99, train_loss: 0.7309, test_loss: 0.9722, test_f1: 0.5685
##################ITERATION #7 ****************************************
 epoch: 0, train_loss: 1.2840, test_loss: 1.2988, test_f1: 0.2549
 epoch: 1, train_loss: 1.1835, test_loss: 1.1978, test_f1: 0.3482
 epoch: 2, train_loss: 1.1462, test_loss: 1.1046, test_f1: 0.4183
 epoch: 3, train_loss: 1.1313, test_loss: 1.0527, test_f1: 0.4596
 epoch: 4, train_loss: 1.0917, test_loss: 1.0322, test_f1: 0.4750
 epoch: 5, train_loss: 1.0803, test_loss: 1.0097, test_f1: 0.4953
 epoch: 6, train_loss: 1.0591, test_loss: 0.9945, test_f1: 0.4835
 epoch: 7, train_loss: 1.0381, test_loss: 0.9829, test_f1: 0.4874
 epoch: 8, train_loss: 1.0229, test_loss: 0.9688, test_f1: 0.4895
 epoch: 9, train_loss: 1.0103, test_loss: 0.9649, test_f1: 0.4854
 epoch: 10, train_loss: 1.0057, test_loss: 0.9523, test_f1: 0.4829
 epoch: 11, train_loss: 0.9911, test_loss: 0.9392, test_f1: 0.4926
 epoch: 12, train_loss: 0.9813, test_loss: 0.9405, test_f1: 0.4898
 epoch: 13, train_loss: 0.9690, test_loss: 0.9393, test_f1: 0.5083
 epoch: 14, train_loss: 0.9630, test_loss: 0.9179, test_f1: 0.5181
 epoch: 15, train_loss: 0.9462, test_loss: 0.9228, test_f1: 0.5226
 epoch: 16, train_loss: 0.9376, test_loss: 0.9180, test_f1: 0.5251
 epoch: 17, train_loss: 0.9312, test_loss: 0.9091, test_f1: 0.5293
 epoch: 18, train_loss: 0.9362, test_loss: 0.8979, test_f1: 0.5278
 epoch: 19, train_loss: 0.9239, test_loss: 0.9072, test_f1: 0.5300
 epoch: 20, train_loss: 0.9065, test_loss: 0.9069, test_f1: 0.5343
 epoch: 21, train_loss: 0.9119, test_loss: 0.9002, test_f1: 0.5417
 epoch: 22, train_loss: 0.9099, test_loss: 0.8960, test_f1: 0.5350
 epoch: 23, train_loss: 0.8841, test_loss: 0.9002, test_f1: 0.5338
 epoch: 24, train_loss: 0.8904, test_loss: 0.8852, test_f1: 0.5389
 epoch: 25, train_loss: 0.8838, test_loss: 0.9049, test_f1: 0.5502
 epoch: 26, train_loss: 0.8831, test_loss: 0.8991, test_f1: 0.5452
 epoch: 27, train_loss: 0.8706, test_loss: 0.8937, test_f1: 0.5429
 epoch: 28, train_loss: 0.8666, test_loss: 0.8998, test_f1: 0.5399
 epoch: 29, train_loss: 0.8620, test_loss: 0.9075, test_f1: 0.5303
 epoch: 30, train_loss: 0.8615, test_loss: 0.8941, test_f1: 0.5599
 epoch: 31, train_loss: 0.8551, test_loss: 0.9091, test_f1: 0.5370
 epoch: 32, train_loss: 0.8568, test_loss: 0.8957, test_f1: 0.5519
 epoch: 33, train_loss: 0.8432, test_loss: 0.8911, test_f1: 0.5500
 epoch: 34, train_loss: 0.8383, test_loss: 0.8898, test_f1: 0.5717
 epoch: 35, train_loss: 0.8313, test_loss: 0.9082, test_f1: 0.5678
 epoch: 36, train_loss: 0.8281, test_loss: 0.8973, test_f1: 0.5593
 epoch: 37, train_loss: 0.8248, test_loss: 0.8966, test_f1: 0.5573
 epoch: 38, train_loss: 0.8240, test_loss: 0.9073, test_f1: 0.5596
 epoch: 39, train_loss: 0.8261, test_loss: 0.9011, test_f1: 0.5854
 epoch: 40, train_loss: 0.8214, test_loss: 0.8980, test_f1: 0.5917
 epoch: 41, train_loss: 0.8190, test_loss: 0.9247, test_f1: 0.5746
 epoch: 42, train_loss: 0.8098, test_loss: 0.9091, test_f1: 0.5763
 epoch: 43, train_loss: 0.8002, test_loss: 0.9102, test_f1: 0.5727
 epoch: 44, train_loss: 0.8106, test_loss: 0.9100, test_f1: 0.5686
 epoch: 45, train_loss: 0.7983, test_loss: 0.9218, test_f1: 0.5800
 epoch: 46, train_loss: 0.7952, test_loss: 0.9263, test_f1: 0.5845
 epoch: 47, train_loss: 0.7969, test_loss: 0.8965, test_f1: 0.5990
 epoch: 48, train_loss: 0.7916, test_loss: 0.9072, test_f1: 0.5778
 epoch: 49, train_loss: 0.7829, test_loss: 0.9096, test_f1: 0.5795
 epoch: 50, train_loss: 0.7735, test_loss: 0.9117, test_f1: 0.5755
 epoch: 51, train_loss: 0.7670, test_loss: 0.9055, test_f1: 0.5813
 epoch: 52, train_loss: 0.7699, test_loss: 0.9086, test_f1: 0.5876
 epoch: 53, train_loss: 0.7684, test_loss: 0.9146, test_f1: 0.5819
 epoch: 54, train_loss: 0.7690, test_loss: 0.9132, test_f1: 0.5788
 epoch: 55, train_loss: 0.7649, test_loss: 0.9095, test_f1: 0.5978
 epoch: 56, train_loss: 0.7604, test_loss: 0.9223, test_f1: 0.5711
 epoch: 57, train_loss: 0.7533, test_loss: 0.9069, test_f1: 0.5859
 epoch: 58, train_loss: 0.7577, test_loss: 0.9177, test_f1: 0.6001
 epoch: 59, train_loss: 0.7652, test_loss: 0.9127, test_f1: 0.5914
 epoch: 60, train_loss: 0.7485, test_loss: 0.9142, test_f1: 0.5951
 epoch: 61, train_loss: 0.7584, test_loss: 0.9224, test_f1: 0.5913
 epoch: 62, train_loss: 0.7502, test_loss: 0.9234, test_f1: 0.6024
 epoch: 63, train_loss: 0.7640, test_loss: 0.9250, test_f1: 0.5876
 epoch: 64, train_loss: 0.7461, test_loss: 0.9315, test_f1: 0.5850
 epoch: 65, train_loss: 0.7503, test_loss: 0.9267, test_f1: 0.5974
 epoch: 66, train_loss: 0.7384, test_loss: 0.9267, test_f1: 0.5826
 epoch: 67, train_loss: 0.7532, test_loss: 0.9228, test_f1: 0.5957
 epoch: 68, train_loss: 0.7457, test_loss: 0.9254, test_f1: 0.5942
 epoch: 69, train_loss: 0.7397, test_loss: 0.9212, test_f1: 0.6047
 epoch: 70, train_loss: 0.7401, test_loss: 0.9223, test_f1: 0.6079
 epoch: 71, train_loss: 0.7394, test_loss: 0.9358, test_f1: 0.5965
 epoch: 72, train_loss: 0.7332, test_loss: 0.9195, test_f1: 0.5963
 epoch: 73, train_loss: 0.7353, test_loss: 0.9241, test_f1: 0.5949
 epoch: 74, train_loss: 0.7358, test_loss: 0.9260, test_f1: 0.5987
 epoch: 75, train_loss: 0.7429, test_loss: 0.9197, test_f1: 0.6041
 epoch: 76, train_loss: 0.7363, test_loss: 0.9142, test_f1: 0.6118
 epoch: 77, train_loss: 0.7204, test_loss: 0.9262, test_f1: 0.5991
 epoch: 78, train_loss: 0.7283, test_loss: 0.9263, test_f1: 0.5966
 epoch: 79, train_loss: 0.7256, test_loss: 0.9252, test_f1: 0.6051
 epoch: 80, train_loss: 0.7174, test_loss: 0.9388, test_f1: 0.6078
 epoch: 81, train_loss: 0.7236, test_loss: 0.9387, test_f1: 0.6083
 epoch: 82, train_loss: 0.7277, test_loss: 0.9333, test_f1: 0.6064
 epoch: 83, train_loss: 0.7279, test_loss: 0.9377, test_f1: 0.6044
 epoch: 84, train_loss: 0.7285, test_loss: 0.9188, test_f1: 0.6098
 epoch: 85, train_loss: 0.7190, test_loss: 0.9304, test_f1: 0.6099
 epoch: 86, train_loss: 0.7168, test_loss: 0.9346, test_f1: 0.6032
 epoch: 87, train_loss: 0.7138, test_loss: 0.9310, test_f1: 0.6099
 epoch: 88, train_loss: 0.7110, test_loss: 0.9377, test_f1: 0.6079
 epoch: 89, train_loss: 0.7217, test_loss: 0.9380, test_f1: 0.6102
 epoch: 90, train_loss: 0.7180, test_loss: 0.9365, test_f1: 0.6149
 epoch: 91, train_loss: 0.7062, test_loss: 0.9340, test_f1: 0.5981
 epoch: 92, train_loss: 0.7107, test_loss: 0.9345, test_f1: 0.5944
 epoch: 93, train_loss: 0.7050, test_loss: 0.9363, test_f1: 0.5998
 epoch: 94, train_loss: 0.6961, test_loss: 0.9323, test_f1: 0.6107
 epoch: 95, train_loss: 0.7013, test_loss: 0.9289, test_f1: 0.6157
 epoch: 96, train_loss: 0.6984, test_loss: 0.9439, test_f1: 0.6061
 epoch: 97, train_loss: 0.7174, test_loss: 0.9242, test_f1: 0.6215
 epoch: 98, train_loss: 0.6960, test_loss: 0.9461, test_f1: 0.6216
 epoch: 99, train_loss: 0.7146, test_loss: 0.9368, test_f1: 0.6118
##################ITERATION #8 ****************************************
 epoch: 0, train_loss: 1.3113, test_loss: 1.3148, test_f1: 0.2295
 epoch: 1, train_loss: 1.1887, test_loss: 1.1697, test_f1: 0.3544
 epoch: 2, train_loss: 1.1431, test_loss: 1.0568, test_f1: 0.4834
 epoch: 3, train_loss: 1.1094, test_loss: 1.0180, test_f1: 0.5069
 epoch: 4, train_loss: 1.0879, test_loss: 0.9990, test_f1: 0.5148
 epoch: 5, train_loss: 1.0678, test_loss: 0.9777, test_f1: 0.5184
 epoch: 6, train_loss: 1.0564, test_loss: 0.9679, test_f1: 0.5187
 epoch: 7, train_loss: 1.0419, test_loss: 0.9661, test_f1: 0.5097
 epoch: 8, train_loss: 1.0293, test_loss: 0.9594, test_f1: 0.5055
 epoch: 9, train_loss: 1.0136, test_loss: 0.9434, test_f1: 0.5238
 epoch: 10, train_loss: 1.0008, test_loss: 0.9431, test_f1: 0.5068
 epoch: 11, train_loss: 0.9992, test_loss: 0.9387, test_f1: 0.5132
 epoch: 12, train_loss: 0.9870, test_loss: 0.9324, test_f1: 0.5199
 epoch: 13, train_loss: 0.9757, test_loss: 0.9401, test_f1: 0.5094
 epoch: 14, train_loss: 0.9756, test_loss: 0.9325, test_f1: 0.5399
 epoch: 15, train_loss: 0.9679, test_loss: 0.9261, test_f1: 0.5460
 epoch: 16, train_loss: 0.9518, test_loss: 0.9289, test_f1: 0.5296
 epoch: 17, train_loss: 0.9546, test_loss: 0.9331, test_f1: 0.5314
 epoch: 18, train_loss: 0.9420, test_loss: 0.9268, test_f1: 0.5323
 epoch: 19, train_loss: 0.9379, test_loss: 0.9402, test_f1: 0.5408
 epoch: 20, train_loss: 0.9309, test_loss: 0.9377, test_f1: 0.5300
 epoch: 21, train_loss: 0.9225, test_loss: 0.9340, test_f1: 0.5365
 epoch: 22, train_loss: 0.9202, test_loss: 0.9294, test_f1: 0.5311
 epoch: 23, train_loss: 0.9198, test_loss: 0.9267, test_f1: 0.5340
 epoch: 24, train_loss: 0.9153, test_loss: 0.9324, test_f1: 0.5362
 epoch: 25, train_loss: 0.8995, test_loss: 0.9291, test_f1: 0.5451
 epoch: 26, train_loss: 0.9084, test_loss: 0.9467, test_f1: 0.5389
 epoch: 27, train_loss: 0.8918, test_loss: 0.9377, test_f1: 0.5509
 epoch: 28, train_loss: 0.8897, test_loss: 0.9297, test_f1: 0.5480
 epoch: 29, train_loss: 0.8835, test_loss: 0.9300, test_f1: 0.5424
 epoch: 30, train_loss: 0.8884, test_loss: 0.9418, test_f1: 0.5378
 epoch: 31, train_loss: 0.8868, test_loss: 0.9389, test_f1: 0.5546
 epoch: 32, train_loss: 0.8752, test_loss: 0.9340, test_f1: 0.5540
 epoch: 33, train_loss: 0.8672, test_loss: 0.9523, test_f1: 0.5466
 epoch: 34, train_loss: 0.8700, test_loss: 0.9480, test_f1: 0.5460
 epoch: 35, train_loss: 0.8577, test_loss: 0.9307, test_f1: 0.5523
 epoch: 36, train_loss: 0.8541, test_loss: 0.9589, test_f1: 0.5474
 epoch: 37, train_loss: 0.8616, test_loss: 0.9420, test_f1: 0.5665
 epoch: 38, train_loss: 0.8588, test_loss: 0.9398, test_f1: 0.5605
 epoch: 39, train_loss: 0.8495, test_loss: 0.9527, test_f1: 0.5566
 epoch: 40, train_loss: 0.8663, test_loss: 0.9620, test_f1: 0.5693
 epoch: 41, train_loss: 0.8391, test_loss: 0.9569, test_f1: 0.5669
 epoch: 42, train_loss: 0.8384, test_loss: 0.9555, test_f1: 0.5656
 epoch: 43, train_loss: 0.8337, test_loss: 0.9698, test_f1: 0.5710
 epoch: 44, train_loss: 0.8254, test_loss: 0.9621, test_f1: 0.5771
 epoch: 45, train_loss: 0.8200, test_loss: 0.9546, test_f1: 0.5722
 epoch: 46, train_loss: 0.8193, test_loss: 0.9606, test_f1: 0.5722
 epoch: 47, train_loss: 0.8189, test_loss: 0.9656, test_f1: 0.5612
 epoch: 48, train_loss: 0.8281, test_loss: 0.9665, test_f1: 0.5667
 epoch: 49, train_loss: 0.8145, test_loss: 0.9654, test_f1: 0.5780
 epoch: 50, train_loss: 0.8174, test_loss: 0.9680, test_f1: 0.5673
 epoch: 51, train_loss: 0.8122, test_loss: 0.9647, test_f1: 0.5693
 epoch: 52, train_loss: 0.8097, test_loss: 0.9658, test_f1: 0.5785
 epoch: 53, train_loss: 0.7997, test_loss: 0.9662, test_f1: 0.5828
 epoch: 54, train_loss: 0.7982, test_loss: 0.9641, test_f1: 0.5813
 epoch: 55, train_loss: 0.8007, test_loss: 0.9763, test_f1: 0.5640
 epoch: 56, train_loss: 0.7935, test_loss: 0.9619, test_f1: 0.5750
 epoch: 57, train_loss: 0.7913, test_loss: 0.9626, test_f1: 0.5776
 epoch: 58, train_loss: 0.7871, test_loss: 0.9610, test_f1: 0.5759
 epoch: 59, train_loss: 0.8013, test_loss: 0.9684, test_f1: 0.5832
 epoch: 60, train_loss: 0.7939, test_loss: 0.9607, test_f1: 0.5879
 epoch: 61, train_loss: 0.7941, test_loss: 0.9562, test_f1: 0.5869
 epoch: 62, train_loss: 0.7734, test_loss: 0.9480, test_f1: 0.5825
 epoch: 63, train_loss: 0.7979, test_loss: 0.9641, test_f1: 0.5710
 epoch: 64, train_loss: 0.8025, test_loss: 0.9631, test_f1: 0.5806
 epoch: 65, train_loss: 0.7909, test_loss: 0.9519, test_f1: 0.5925
 epoch: 66, train_loss: 0.7941, test_loss: 0.9591, test_f1: 0.5886
 epoch: 67, train_loss: 0.7835, test_loss: 0.9677, test_f1: 0.5811
 epoch: 68, train_loss: 0.7928, test_loss: 0.9614, test_f1: 0.5802
 epoch: 69, train_loss: 0.7837, test_loss: 0.9634, test_f1: 0.5894
 epoch: 70, train_loss: 0.7864, test_loss: 0.9550, test_f1: 0.5845
 epoch: 71, train_loss: 0.7748, test_loss: 0.9649, test_f1: 0.5882
 epoch: 72, train_loss: 0.7820, test_loss: 0.9626, test_f1: 0.5929
 epoch: 73, train_loss: 0.7764, test_loss: 0.9648, test_f1: 0.5892
 epoch: 74, train_loss: 0.7778, test_loss: 0.9620, test_f1: 0.5914
 epoch: 75, train_loss: 0.7707, test_loss: 0.9645, test_f1: 0.5819
 epoch: 76, train_loss: 0.7718, test_loss: 0.9696, test_f1: 0.5831
 epoch: 77, train_loss: 0.7706, test_loss: 0.9623, test_f1: 0.5911
 epoch: 78, train_loss: 0.7690, test_loss: 0.9662, test_f1: 0.5900
 epoch: 79, train_loss: 0.7679, test_loss: 0.9611, test_f1: 0.5880
 epoch: 80, train_loss: 0.7711, test_loss: 0.9641, test_f1: 0.5914
 epoch: 81, train_loss: 0.7595, test_loss: 0.9606, test_f1: 0.5918
 epoch: 82, train_loss: 0.7729, test_loss: 0.9658, test_f1: 0.5933
 epoch: 83, train_loss: 0.7671, test_loss: 0.9610, test_f1: 0.5924
 epoch: 84, train_loss: 0.7738, test_loss: 0.9730, test_f1: 0.5824
 epoch: 85, train_loss: 0.7572, test_loss: 0.9685, test_f1: 0.5871
 epoch: 86, train_loss: 0.7565, test_loss: 0.9823, test_f1: 0.5752
 epoch: 87, train_loss: 0.7557, test_loss: 0.9603, test_f1: 0.5753
 epoch: 88, train_loss: 0.7557, test_loss: 0.9541, test_f1: 0.5885
 epoch: 89, train_loss: 0.7670, test_loss: 0.9773, test_f1: 0.5746
 epoch: 90, train_loss: 0.7543, test_loss: 0.9767, test_f1: 0.5764
 epoch: 91, train_loss: 0.7558, test_loss: 0.9657, test_f1: 0.5898
 epoch: 92, train_loss: 0.7533, test_loss: 0.9647, test_f1: 0.5836
 epoch: 93, train_loss: 0.7583, test_loss: 0.9750, test_f1: 0.5840
 epoch: 94, train_loss: 0.7581, test_loss: 0.9601, test_f1: 0.5870
 epoch: 95, train_loss: 0.7468, test_loss: 0.9642, test_f1: 0.5851
 epoch: 96, train_loss: 0.7485, test_loss: 0.9751, test_f1: 0.5855
 epoch: 97, train_loss: 0.7514, test_loss: 0.9580, test_f1: 0.5998
 epoch: 98, train_loss: 0.7514, test_loss: 0.9617, test_f1: 0.5997
 epoch: 99, train_loss: 0.7446, test_loss: 0.9764, test_f1: 0.5958
##################ITERATION #9 ****************************************
 epoch: 0, train_loss: 1.2909, test_loss: 1.3560, test_f1: 0.2715
 epoch: 1, train_loss: 1.1823, test_loss: 1.1725, test_f1: 0.3865
 epoch: 2, train_loss: 1.1473, test_loss: 1.0843, test_f1: 0.4351
 epoch: 3, train_loss: 1.1187, test_loss: 1.0407, test_f1: 0.4629
 epoch: 4, train_loss: 1.0878, test_loss: 1.0225, test_f1: 0.4652
 epoch: 5, train_loss: 1.0780, test_loss: 1.0025, test_f1: 0.4813
 epoch: 6, train_loss: 1.0602, test_loss: 0.9865, test_f1: 0.4781
 epoch: 7, train_loss: 1.0371, test_loss: 0.9788, test_f1: 0.4763
 epoch: 8, train_loss: 1.0125, test_loss: 0.9699, test_f1: 0.4836
 epoch: 9, train_loss: 1.0104, test_loss: 0.9662, test_f1: 0.5008
 epoch: 10, train_loss: 1.0037, test_loss: 0.9629, test_f1: 0.5082
 epoch: 11, train_loss: 0.9943, test_loss: 0.9591, test_f1: 0.5091
 epoch: 12, train_loss: 0.9711, test_loss: 0.9647, test_f1: 0.5037
 epoch: 13, train_loss: 0.9677, test_loss: 0.9588, test_f1: 0.5028
 epoch: 14, train_loss: 0.9606, test_loss: 0.9548, test_f1: 0.5162
 epoch: 15, train_loss: 0.9428, test_loss: 0.9546, test_f1: 0.5193
 epoch: 16, train_loss: 0.9339, test_loss: 0.9547, test_f1: 0.5051
 epoch: 17, train_loss: 0.9351, test_loss: 0.9438, test_f1: 0.5253
 epoch: 18, train_loss: 0.9278, test_loss: 0.9529, test_f1: 0.5284
 epoch: 19, train_loss: 0.9210, test_loss: 0.9542, test_f1: 0.5263
 epoch: 20, train_loss: 0.9172, test_loss: 0.9633, test_f1: 0.5275
 epoch: 21, train_loss: 0.9130, test_loss: 0.9517, test_f1: 0.5316
 epoch: 22, train_loss: 0.9055, test_loss: 0.9486, test_f1: 0.5246
 epoch: 23, train_loss: 0.8957, test_loss: 0.9555, test_f1: 0.5461
 epoch: 24, train_loss: 0.8957, test_loss: 0.9502, test_f1: 0.5452
 epoch: 25, train_loss: 0.8833, test_loss: 0.9516, test_f1: 0.5359
 epoch: 26, train_loss: 0.8876, test_loss: 0.9626, test_f1: 0.5350
 epoch: 27, train_loss: 0.8797, test_loss: 0.9552, test_f1: 0.5473
 epoch: 28, train_loss: 0.8714, test_loss: 0.9609, test_f1: 0.5319
 epoch: 29, train_loss: 0.8761, test_loss: 0.9640, test_f1: 0.5374
 epoch: 30, train_loss: 0.8635, test_loss: 0.9606, test_f1: 0.5430
 epoch: 31, train_loss: 0.8615, test_loss: 0.9534, test_f1: 0.5372
 epoch: 32, train_loss: 0.8649, test_loss: 0.9678, test_f1: 0.5370
 epoch: 33, train_loss: 0.8558, test_loss: 0.9664, test_f1: 0.5373
 epoch: 34, train_loss: 0.8405, test_loss: 0.9672, test_f1: 0.5400
 epoch: 35, train_loss: 0.8430, test_loss: 0.9633, test_f1: 0.5323
 epoch: 36, train_loss: 0.8342, test_loss: 0.9546, test_f1: 0.5602
 epoch: 37, train_loss: 0.8412, test_loss: 0.9661, test_f1: 0.5552
 epoch: 38, train_loss: 0.8257, test_loss: 0.9715, test_f1: 0.5468
 epoch: 39, train_loss: 0.8426, test_loss: 0.9668, test_f1: 0.5406
 epoch: 40, train_loss: 0.8292, test_loss: 0.9613, test_f1: 0.5462
 epoch: 41, train_loss: 0.8233, test_loss: 0.9676, test_f1: 0.5431
 epoch: 42, train_loss: 0.8258, test_loss: 0.9594, test_f1: 0.5584
 epoch: 43, train_loss: 0.8163, test_loss: 0.9471, test_f1: 0.5649
 epoch: 44, train_loss: 0.8139, test_loss: 0.9600, test_f1: 0.5425
 epoch: 45, train_loss: 0.8113, test_loss: 0.9601, test_f1: 0.5516
 epoch: 46, train_loss: 0.8183, test_loss: 0.9648, test_f1: 0.5626
 epoch: 47, train_loss: 0.7968, test_loss: 0.9684, test_f1: 0.5579
 epoch: 48, train_loss: 0.8104, test_loss: 0.9683, test_f1: 0.5642
 epoch: 49, train_loss: 0.8012, test_loss: 0.9832, test_f1: 0.5500
 epoch: 50, train_loss: 0.7894, test_loss: 0.9605, test_f1: 0.5475
 epoch: 51, train_loss: 0.7846, test_loss: 0.9554, test_f1: 0.5479
 epoch: 52, train_loss: 0.7860, test_loss: 0.9624, test_f1: 0.5742
 epoch: 53, train_loss: 0.7715, test_loss: 0.9550, test_f1: 0.5771
 epoch: 54, train_loss: 0.7822, test_loss: 0.9665, test_f1: 0.5482
 epoch: 55, train_loss: 0.7773, test_loss: 0.9681, test_f1: 0.5558
 epoch: 56, train_loss: 0.7741, test_loss: 0.9713, test_f1: 0.5605
 epoch: 57, train_loss: 0.7652, test_loss: 0.9626, test_f1: 0.5674
 epoch: 58, train_loss: 0.7638, test_loss: 0.9690, test_f1: 0.5530
 epoch: 59, train_loss: 0.7654, test_loss: 0.9702, test_f1: 0.5660
 epoch: 60, train_loss: 0.7693, test_loss: 0.9693, test_f1: 0.5631
 epoch: 61, train_loss: 0.7711, test_loss: 0.9736, test_f1: 0.5651
 epoch: 62, train_loss: 0.7741, test_loss: 0.9645, test_f1: 0.5706
 epoch: 63, train_loss: 0.7581, test_loss: 0.9649, test_f1: 0.5646
 epoch: 64, train_loss: 0.7618, test_loss: 0.9664, test_f1: 0.5686
 epoch: 65, train_loss: 0.7636, test_loss: 0.9623, test_f1: 0.5620
 epoch: 66, train_loss: 0.7667, test_loss: 0.9637, test_f1: 0.5692
 epoch: 67, train_loss: 0.7530, test_loss: 0.9719, test_f1: 0.5604
 epoch: 68, train_loss: 0.7557, test_loss: 0.9611, test_f1: 0.5734
 epoch: 69, train_loss: 0.7525, test_loss: 0.9627, test_f1: 0.5700
 epoch: 70, train_loss: 0.7626, test_loss: 0.9629, test_f1: 0.5751
 epoch: 71, train_loss: 0.7571, test_loss: 0.9643, test_f1: 0.5594
 epoch: 72, train_loss: 0.7540, test_loss: 0.9538, test_f1: 0.5717
 epoch: 73, train_loss: 0.7490, test_loss: 0.9605, test_f1: 0.5774
 epoch: 74, train_loss: 0.7371, test_loss: 0.9593, test_f1: 0.5702
 epoch: 75, train_loss: 0.7519, test_loss: 0.9754, test_f1: 0.5676
 epoch: 76, train_loss: 0.7428, test_loss: 0.9783, test_f1: 0.5580
 epoch: 77, train_loss: 0.7358, test_loss: 0.9691, test_f1: 0.5613
 epoch: 78, train_loss: 0.7295, test_loss: 0.9667, test_f1: 0.5679
 epoch: 79, train_loss: 0.7330, test_loss: 0.9576, test_f1: 0.5825
 epoch: 80, train_loss: 0.7399, test_loss: 0.9649, test_f1: 0.5736
 epoch: 81, train_loss: 0.7372, test_loss: 0.9699, test_f1: 0.5699
 epoch: 82, train_loss: 0.7411, test_loss: 0.9873, test_f1: 0.5638
 epoch: 83, train_loss: 0.7268, test_loss: 0.9854, test_f1: 0.5616
 epoch: 84, train_loss: 0.7367, test_loss: 0.9792, test_f1: 0.5865
 epoch: 85, train_loss: 0.7231, test_loss: 0.9653, test_f1: 0.5879
 epoch: 86, train_loss: 0.7389, test_loss: 0.9683, test_f1: 0.5542
 epoch: 87, train_loss: 0.7292, test_loss: 0.9804, test_f1: 0.5676
 epoch: 88, train_loss: 0.7447, test_loss: 0.9746, test_f1: 0.5751
 epoch: 89, train_loss: 0.7182, test_loss: 0.9819, test_f1: 0.5768
 epoch: 90, train_loss: 0.7197, test_loss: 0.9757, test_f1: 0.5856
 epoch: 91, train_loss: 0.7183, test_loss: 0.9689, test_f1: 0.5913
 epoch: 92, train_loss: 0.7187, test_loss: 0.9782, test_f1: 0.5870
 epoch: 93, train_loss: 0.7202, test_loss: 0.9710, test_f1: 0.5884
 epoch: 94, train_loss: 0.7225, test_loss: 0.9732, test_f1: 0.5787
 epoch: 95, train_loss: 0.7165, test_loss: 0.9736, test_f1: 0.5820
 epoch: 96, train_loss: 0.7096, test_loss: 0.9715, test_f1: 0.5872
 epoch: 97, train_loss: 0.7189, test_loss: 0.9721, test_f1: 0.5882
 epoch: 98, train_loss: 0.7148, test_loss: 0.9717, test_f1: 0.5913
 epoch: 99, train_loss: 0.7080, test_loss: 0.9674, test_f1: 0.5867

Training completed in 522.52 seconds
Best F1: 0.6216 at epoch 98
Mean F1 across iterations: 0.5913  0.0134
========================FINAL RESULTS================================
FEGIN weighted F1: 0.6216  0.0134
python main.py --data ltspice_examples --representation component_net --model FEGIN --layers 5 --hiddens 64 --batch_size 128 --lr 0.0001 --emb_size 512 --epochs 100 --save_appendix component_net_L5_H64_BS128_LR0.0001_E512 --no_val
-----



STDERR:
  File "main.py", line 370, in <module>
    main()
  File "main.py", line 254, in main
    dataset = dataset_class(
  File "/home/philip/projects/ltspice_examples_code_repo/Circuit-Completion-Using-GNNs/component_classification_with_link_prediction_head/evaluation/FEGIN/kernel/circuit_datasets.py", line 15, in __init__
    self.data, self.slices = torch.load(self.processed_paths[0])
  File "/home/philip/.local/lib/python3.8/site-packages/torch/serialization.py", line 1040, in load
    warnings.warn(
  File "/usr/lib/python3.8/warnings.py", line 109, in _showwarnmsg
    sw(msg.message, msg.category, msg.filename, msg.lineno,
  File "main.py", line 47, in warn_with_traceback
    traceback.print_stack(file=log)
/home/philip/projects/ltspice_examples_code_repo/Circuit-Completion-Using-GNNs/component_classification_with_link_prediction_head/evaluation/FEGIN/kernel/circuit_datasets.py:15: FutureWarning: You are using `torch.load` with `weights_only=False` (the current default value), which uses the default pickle module implicitly. It is possible to construct malicious pickle data which will execute arbitrary code during unpickling (See https://github.com/pytorch/pytorch/blob/main/SECURITY.md#untrusted-models for more details). In a future release, the default value for `weights_only` will be flipped to `True`. This limits the functions that could be executed during unpickling. Arbitrary objects will no longer be allowed to be loaded via this mode unless they are explicitly allowlisted by the user via `torch.serialization.add_safe_globals`. We recommend you start setting `weights_only=True` for any use case where you don't have full control of the loaded file. Please open an issue on GitHub for any issues related to this experimental feature.
  self.data, self.slices = torch.load(self.processed_paths[0])
