STDOUT:
Results will be saved in /home/philip/projects/llm_inference_code_repo/Circuit-Completion-Using-GNNs/component_classification_with_link_prediction_head/evaluation/FEGIN/results/model_FEGIN_dataset_ltspice_examples
Command line input: python main.py --data ltspice_examples --representation component_pin_net --model FEGIN --layers 6 --hiddens 16 --batch_size 64 --lr 0.01 --emb_size 512 --epochs 100 --save_appendix component_pin_net_L6_H16_BS64_LR0.01_E512 --no_val
 is saved.
-----
ltspice_examples - FEGIN
Using 6 layers, 16 hidden units, h = 2
Loading component_pin_net representation dataset
ENTERED
Training FEGIN on component_pin_net representation
Train: 3558, Test: 846
##################ITERATION #0 ****************************************
 epoch: 0, train_loss: 1.2924, test_loss: 1.6109, test_f1: 0.2631
 epoch: 1, train_loss: 1.0672, test_loss: 1.0509, test_f1: 0.4144
 epoch: 2, train_loss: 1.0337, test_loss: 1.0318, test_f1: 0.4572
 epoch: 3, train_loss: 1.0053, test_loss: 1.0156, test_f1: 0.4811
 epoch: 4, train_loss: 0.9800, test_loss: 1.0415, test_f1: 0.4730
 epoch: 5, train_loss: 0.9724, test_loss: 1.0070, test_f1: 0.4759
 epoch: 6, train_loss: 0.9656, test_loss: 0.9414, test_f1: 0.4955
 epoch: 7, train_loss: 0.9727, test_loss: 0.9605, test_f1: 0.4554
 epoch: 8, train_loss: 0.9562, test_loss: 1.0149, test_f1: 0.4763
 epoch: 9, train_loss: 0.9507, test_loss: 0.9656, test_f1: 0.4891
 epoch: 10, train_loss: 0.9421, test_loss: 0.9828, test_f1: 0.5096
 epoch: 11, train_loss: 0.9889, test_loss: 0.9788, test_f1: 0.4876
 epoch: 12, train_loss: 0.9408, test_loss: 0.9916, test_f1: 0.4637
 epoch: 13, train_loss: 0.9208, test_loss: 0.9663, test_f1: 0.5059
 epoch: 14, train_loss: 0.9220, test_loss: 0.9718, test_f1: 0.5028
 epoch: 15, train_loss: 0.9289, test_loss: 0.9679, test_f1: 0.4840
 epoch: 16, train_loss: 0.9165, test_loss: 0.9640, test_f1: 0.5113
 epoch: 17, train_loss: 0.9368, test_loss: 0.9832, test_f1: 0.5074
 epoch: 18, train_loss: 0.9081, test_loss: 0.9928, test_f1: 0.5050
 epoch: 19, train_loss: 0.8997, test_loss: 0.8864, test_f1: 0.5156
 epoch: 20, train_loss: 0.8968, test_loss: 0.9151, test_f1: 0.5193
 epoch: 21, train_loss: 0.9003, test_loss: 0.8909, test_f1: 0.5074
 epoch: 22, train_loss: 0.8961, test_loss: 0.9590, test_f1: 0.5044
 epoch: 23, train_loss: 0.9065, test_loss: 0.9611, test_f1: 0.5065
 epoch: 24, train_loss: 0.9014, test_loss: 0.9052, test_f1: 0.5663
 epoch: 25, train_loss: 0.8903, test_loss: 0.9018, test_f1: 0.5133
 epoch: 26, train_loss: 0.8840, test_loss: 0.9073, test_f1: 0.5504
 epoch: 27, train_loss: 0.8843, test_loss: 0.9605, test_f1: 0.4990
 epoch: 28, train_loss: 0.8819, test_loss: 0.8841, test_f1: 0.5276
 epoch: 29, train_loss: 0.9070, test_loss: 0.9370, test_f1: 0.5486
 epoch: 30, train_loss: 0.9140, test_loss: 0.9159, test_f1: 0.5448
 epoch: 31, train_loss: 0.8965, test_loss: 0.9259, test_f1: 0.5123
 epoch: 32, train_loss: 0.8802, test_loss: 0.8873, test_f1: 0.5531
 epoch: 33, train_loss: 0.8799, test_loss: 0.8437, test_f1: 0.6029
 epoch: 34, train_loss: 0.8725, test_loss: 0.9253, test_f1: 0.5584
 epoch: 35, train_loss: 0.8602, test_loss: 0.8435, test_f1: 0.5499
 epoch: 36, train_loss: 0.8646, test_loss: 0.8364, test_f1: 0.5552
 epoch: 37, train_loss: 0.8475, test_loss: 0.8889, test_f1: 0.6036
 epoch: 38, train_loss: 0.8521, test_loss: 0.8385, test_f1: 0.5697
 epoch: 39, train_loss: 0.8598, test_loss: 0.8963, test_f1: 0.5356
 epoch: 40, train_loss: 0.8503, test_loss: 0.8393, test_f1: 0.5600
 epoch: 41, train_loss: 0.8411, test_loss: 0.8958, test_f1: 0.6033
 epoch: 42, train_loss: 0.8405, test_loss: 0.8945, test_f1: 0.5590
 epoch: 43, train_loss: 0.8333, test_loss: 0.8460, test_f1: 0.5857
 epoch: 44, train_loss: 0.8285, test_loss: 0.8208, test_f1: 0.6186
 epoch: 45, train_loss: 0.8336, test_loss: 0.8683, test_f1: 0.5644
 epoch: 46, train_loss: 0.8333, test_loss: 0.9337, test_f1: 0.5612
 epoch: 47, train_loss: 0.8307, test_loss: 0.8173, test_f1: 0.5561
 epoch: 48, train_loss: 0.8419, test_loss: 0.8887, test_f1: 0.5894
 epoch: 49, train_loss: 0.8190, test_loss: 0.8534, test_f1: 0.5878
 epoch: 50, train_loss: 0.8459, test_loss: 0.8649, test_f1: 0.6083
 epoch: 51, train_loss: 0.8173, test_loss: 0.8225, test_f1: 0.5960
 epoch: 52, train_loss: 0.7971, test_loss: 0.8198, test_f1: 0.6257
 epoch: 53, train_loss: 0.8032, test_loss: 0.7902, test_f1: 0.6394
 epoch: 54, train_loss: 0.7931, test_loss: 0.8293, test_f1: 0.6241
 epoch: 55, train_loss: 0.7911, test_loss: 0.8438, test_f1: 0.6189
 epoch: 56, train_loss: 0.7898, test_loss: 0.8266, test_f1: 0.6291
 epoch: 57, train_loss: 0.7846, test_loss: 0.8266, test_f1: 0.6212
 epoch: 58, train_loss: 0.7876, test_loss: 0.8436, test_f1: 0.6175
 epoch: 59, train_loss: 0.7904, test_loss: 0.8589, test_f1: 0.6296
 epoch: 60, train_loss: 0.7939, test_loss: 0.8156, test_f1: 0.6259
 epoch: 61, train_loss: 0.7820, test_loss: 0.8851, test_f1: 0.6028
 epoch: 62, train_loss: 0.7856, test_loss: 0.8188, test_f1: 0.6337
 epoch: 63, train_loss: 0.7790, test_loss: 0.8847, test_f1: 0.5674
 epoch: 64, train_loss: 0.7833, test_loss: 0.8351, test_f1: 0.6136
 epoch: 65, train_loss: 0.7747, test_loss: 0.8528, test_f1: 0.6175
 epoch: 66, train_loss: 0.7857, test_loss: 0.8554, test_f1: 0.6148
 epoch: 67, train_loss: 0.7698, test_loss: 0.8454, test_f1: 0.5919
 epoch: 68, train_loss: 0.7761, test_loss: 0.8230, test_f1: 0.6177
 epoch: 69, train_loss: 0.7771, test_loss: 0.8234, test_f1: 0.6034
 epoch: 70, train_loss: 0.7594, test_loss: 0.8453, test_f1: 0.6182
 epoch: 71, train_loss: 0.7708, test_loss: 0.8303, test_f1: 0.5953
 epoch: 72, train_loss: 0.7676, test_loss: 0.8414, test_f1: 0.6407
 epoch: 73, train_loss: 0.7846, test_loss: 0.8136, test_f1: 0.6150
 epoch: 74, train_loss: 0.7800, test_loss: 0.8255, test_f1: 0.6490
 epoch: 75, train_loss: 0.7796, test_loss: 0.8311, test_f1: 0.6297
 epoch: 76, train_loss: 0.7796, test_loss: 0.8401, test_f1: 0.6475
 epoch: 77, train_loss: 0.7737, test_loss: 0.8486, test_f1: 0.6512
 epoch: 78, train_loss: 0.7724, test_loss: 0.8815, test_f1: 0.6174
 epoch: 79, train_loss: 0.7523, test_loss: 0.8670, test_f1: 0.6080
 epoch: 80, train_loss: 0.7691, test_loss: 0.8249, test_f1: 0.6433
 epoch: 81, train_loss: 0.7701, test_loss: 0.8511, test_f1: 0.5997
 epoch: 82, train_loss: 0.7681, test_loss: 0.8432, test_f1: 0.6144
 epoch: 83, train_loss: 0.7639, test_loss: 0.8292, test_f1: 0.6373
 epoch: 84, train_loss: 0.7506, test_loss: 0.8319, test_f1: 0.6371
 epoch: 85, train_loss: 0.7711, test_loss: 0.8370, test_f1: 0.6376
 epoch: 86, train_loss: 0.7641, test_loss: 0.8499, test_f1: 0.6356
 epoch: 87, train_loss: 0.7618, test_loss: 0.8323, test_f1: 0.6373
 epoch: 88, train_loss: 0.7598, test_loss: 0.8052, test_f1: 0.6540
 epoch: 89, train_loss: 0.7555, test_loss: 0.8623, test_f1: 0.6325
 epoch: 90, train_loss: 0.7573, test_loss: 0.8300, test_f1: 0.6511
 epoch: 91, train_loss: 0.7480, test_loss: 0.8025, test_f1: 0.6468
 epoch: 92, train_loss: 0.7473, test_loss: 0.8291, test_f1: 0.6619
 epoch: 93, train_loss: 0.7481, test_loss: 0.8924, test_f1: 0.5912
 epoch: 94, train_loss: 0.7552, test_loss: 0.8311, test_f1: 0.6427
 epoch: 95, train_loss: 0.7458, test_loss: 0.8143, test_f1: 0.6575
 epoch: 96, train_loss: 0.7368, test_loss: 0.8899, test_f1: 0.6386
 epoch: 97, train_loss: 0.7460, test_loss: 0.8356, test_f1: 0.6206
 epoch: 98, train_loss: 0.7410, test_loss: 0.8274, test_f1: 0.6370
 epoch: 99, train_loss: 0.7444, test_loss: 0.8269, test_f1: 0.6418
##################ITERATION #1 ****************************************
 epoch: 0, train_loss: 1.1304, test_loss: 1.1842, test_f1: 0.3985
 epoch: 1, train_loss: 1.0314, test_loss: 1.1005, test_f1: 0.4205
 epoch: 2, train_loss: 1.0107, test_loss: 1.0497, test_f1: 0.4518
 epoch: 3, train_loss: 0.9950, test_loss: 1.0530, test_f1: 0.4458
 epoch: 4, train_loss: 0.9931, test_loss: 1.0601, test_f1: 0.4308
 epoch: 5, train_loss: 0.9761, test_loss: 0.9787, test_f1: 0.5009
 epoch: 6, train_loss: 0.9545, test_loss: 0.9908, test_f1: 0.4992
 epoch: 7, train_loss: 0.9345, test_loss: 0.9705, test_f1: 0.5372
 epoch: 8, train_loss: 0.9383, test_loss: 0.9467, test_f1: 0.5177
 epoch: 9, train_loss: 0.9279, test_loss: 1.0651, test_f1: 0.4536
 epoch: 10, train_loss: 0.9229, test_loss: 0.9823, test_f1: 0.4742
 epoch: 11, train_loss: 0.8981, test_loss: 0.9475, test_f1: 0.5362
 epoch: 12, train_loss: 0.9034, test_loss: 1.0022, test_f1: 0.5198
 epoch: 13, train_loss: 0.8980, test_loss: 0.9324, test_f1: 0.5278
 epoch: 14, train_loss: 0.8903, test_loss: 0.9255, test_f1: 0.5435
 epoch: 15, train_loss: 0.8813, test_loss: 1.0733, test_f1: 0.4716
 epoch: 16, train_loss: 0.8898, test_loss: 0.9307, test_f1: 0.5443
 epoch: 17, train_loss: 0.8961, test_loss: 0.9762, test_f1: 0.5028
 epoch: 18, train_loss: 0.8971, test_loss: 0.9269, test_f1: 0.5070
 epoch: 19, train_loss: 0.8539, test_loss: 0.8913, test_f1: 0.5131
 epoch: 20, train_loss: 0.8606, test_loss: 0.8834, test_f1: 0.5182
 epoch: 21, train_loss: 0.8536, test_loss: 0.8804, test_f1: 0.5158
 epoch: 22, train_loss: 0.8455, test_loss: 0.8546, test_f1: 0.5786
 epoch: 23, train_loss: 0.8432, test_loss: 0.8322, test_f1: 0.5315
 epoch: 24, train_loss: 0.8601, test_loss: 0.8867, test_f1: 0.5227
 epoch: 25, train_loss: 0.8579, test_loss: 0.8963, test_f1: 0.5472
 epoch: 26, train_loss: 0.8457, test_loss: 0.8670, test_f1: 0.5646
 epoch: 27, train_loss: 0.8348, test_loss: 0.8799, test_f1: 0.5463
 epoch: 28, train_loss: 0.8498, test_loss: 0.9475, test_f1: 0.4991
 epoch: 29, train_loss: 0.8304, test_loss: 0.8103, test_f1: 0.5561
 epoch: 30, train_loss: 0.8351, test_loss: 0.8732, test_f1: 0.5502
 epoch: 31, train_loss: 0.8310, test_loss: 0.8254, test_f1: 0.5519
 epoch: 32, train_loss: 0.8203, test_loss: 0.8451, test_f1: 0.5796
 epoch: 33, train_loss: 0.8127, test_loss: 0.8263, test_f1: 0.5387
 epoch: 34, train_loss: 0.8213, test_loss: 0.8609, test_f1: 0.5446
 epoch: 35, train_loss: 0.8086, test_loss: 0.7948, test_f1: 0.5492
 epoch: 36, train_loss: 0.8115, test_loss: 0.7783, test_f1: 0.6114
 epoch: 37, train_loss: 0.8022, test_loss: 0.8755, test_f1: 0.5684
 epoch: 38, train_loss: 0.8117, test_loss: 0.8700, test_f1: 0.5681
 epoch: 39, train_loss: 0.7908, test_loss: 0.7656, test_f1: 0.5720
 epoch: 40, train_loss: 0.7892, test_loss: 0.8111, test_f1: 0.5537
 epoch: 41, train_loss: 0.8013, test_loss: 0.8039, test_f1: 0.5757
 epoch: 42, train_loss: 0.7920, test_loss: 0.8637, test_f1: 0.5616
 epoch: 43, train_loss: 0.7865, test_loss: 0.8481, test_f1: 0.5614
 epoch: 44, train_loss: 0.7872, test_loss: 0.8398, test_f1: 0.5886
 epoch: 45, train_loss: 0.7931, test_loss: 0.8217, test_f1: 0.5604
 epoch: 46, train_loss: 0.8191, test_loss: 0.8205, test_f1: 0.5231
 epoch: 47, train_loss: 0.8062, test_loss: 0.8674, test_f1: 0.5506
 epoch: 48, train_loss: 0.7851, test_loss: 0.7344, test_f1: 0.5950
 epoch: 49, train_loss: 0.7853, test_loss: 0.8081, test_f1: 0.6053
 epoch: 50, train_loss: 0.7894, test_loss: 0.7866, test_f1: 0.5941
 epoch: 51, train_loss: 0.7553, test_loss: 0.7961, test_f1: 0.6018
 epoch: 52, train_loss: 0.7551, test_loss: 0.7113, test_f1: 0.6542
 epoch: 53, train_loss: 0.7476, test_loss: 0.7693, test_f1: 0.6353
 epoch: 54, train_loss: 0.7520, test_loss: 0.7446, test_f1: 0.6148
 epoch: 55, train_loss: 0.7368, test_loss: 0.7397, test_f1: 0.6233
 epoch: 56, train_loss: 0.7291, test_loss: 0.7464, test_f1: 0.6586
 epoch: 57, train_loss: 0.7423, test_loss: 0.7458, test_f1: 0.6258
 epoch: 58, train_loss: 0.7247, test_loss: 0.7969, test_f1: 0.6147
 epoch: 59, train_loss: 0.7275, test_loss: 0.7554, test_f1: 0.5857
 epoch: 60, train_loss: 0.7393, test_loss: 0.7314, test_f1: 0.6321
 epoch: 61, train_loss: 0.7362, test_loss: 0.7707, test_f1: 0.5969
 epoch: 62, train_loss: 0.7332, test_loss: 0.7995, test_f1: 0.5794
 epoch: 63, train_loss: 0.7380, test_loss: 0.7264, test_f1: 0.6236
 epoch: 64, train_loss: 0.7208, test_loss: 0.7760, test_f1: 0.5950
 epoch: 65, train_loss: 0.7335, test_loss: 0.7498, test_f1: 0.6154
 epoch: 66, train_loss: 0.7336, test_loss: 0.7406, test_f1: 0.6336
 epoch: 67, train_loss: 0.7173, test_loss: 0.7523, test_f1: 0.6161
 epoch: 68, train_loss: 0.7306, test_loss: 0.7632, test_f1: 0.6101
 epoch: 69, train_loss: 0.7259, test_loss: 0.7382, test_f1: 0.6556
 epoch: 70, train_loss: 0.7259, test_loss: 0.7360, test_f1: 0.5950
 epoch: 71, train_loss: 0.7140, test_loss: 0.7163, test_f1: 0.6318
 epoch: 72, train_loss: 0.7051, test_loss: 0.7642, test_f1: 0.6355
 epoch: 73, train_loss: 0.7268, test_loss: 0.7787, test_f1: 0.5925
 epoch: 74, train_loss: 0.7167, test_loss: 0.7554, test_f1: 0.6361
 epoch: 75, train_loss: 0.6981, test_loss: 0.7450, test_f1: 0.6514
 epoch: 76, train_loss: 0.7132, test_loss: 0.7456, test_f1: 0.6325
 epoch: 77, train_loss: 0.7129, test_loss: 0.7359, test_f1: 0.6303
 epoch: 78, train_loss: 0.7192, test_loss: 0.7334, test_f1: 0.6212
 epoch: 79, train_loss: 0.7118, test_loss: 0.7203, test_f1: 0.6237
 epoch: 80, train_loss: 0.7059, test_loss: 0.7773, test_f1: 0.6393
 epoch: 81, train_loss: 0.7157, test_loss: 0.7378, test_f1: 0.6299
 epoch: 82, train_loss: 0.7169, test_loss: 0.7615, test_f1: 0.5966
 epoch: 83, train_loss: 0.7031, test_loss: 0.7451, test_f1: 0.6462
 epoch: 84, train_loss: 0.7081, test_loss: 0.7463, test_f1: 0.6114
 epoch: 85, train_loss: 0.7084, test_loss: 0.7795, test_f1: 0.6026
 epoch: 86, train_loss: 0.6951, test_loss: 0.7384, test_f1: 0.6346
 epoch: 87, train_loss: 0.6955, test_loss: 0.7530, test_f1: 0.6368
 epoch: 88, train_loss: 0.7063, test_loss: 0.7409, test_f1: 0.6480
 epoch: 89, train_loss: 0.7085, test_loss: 0.7434, test_f1: 0.6347
 epoch: 90, train_loss: 0.7007, test_loss: 0.7682, test_f1: 0.6134
 epoch: 91, train_loss: 0.7130, test_loss: 0.7501, test_f1: 0.5991
 epoch: 92, train_loss: 0.7004, test_loss: 0.7502, test_f1: 0.6150
 epoch: 93, train_loss: 0.7047, test_loss: 0.7584, test_f1: 0.6353
 epoch: 94, train_loss: 0.6874, test_loss: 0.7660, test_f1: 0.6402
 epoch: 95, train_loss: 0.6979, test_loss: 0.7335, test_f1: 0.6413
 epoch: 96, train_loss: 0.6974, test_loss: 0.7115, test_f1: 0.6641
 epoch: 97, train_loss: 0.6901, test_loss: 0.7233, test_f1: 0.6701
 epoch: 98, train_loss: 0.6916, test_loss: 0.7379, test_f1: 0.6239
 epoch: 99, train_loss: 0.6911, test_loss: 0.7171, test_f1: 0.6676
##################ITERATION #2 ****************************************
 epoch: 0, train_loss: 1.1427, test_loss: 1.0703, test_f1: 0.4389
 epoch: 1, train_loss: 1.0223, test_loss: 1.0096, test_f1: 0.4731
 epoch: 2, train_loss: 1.0031, test_loss: 1.0459, test_f1: 0.4522
 epoch: 3, train_loss: 0.9847, test_loss: 0.9791, test_f1: 0.4704
 epoch: 4, train_loss: 0.9708, test_loss: 1.0004, test_f1: 0.4501
 epoch: 5, train_loss: 0.9692, test_loss: 1.0512, test_f1: 0.4498
 epoch: 6, train_loss: 0.9714, test_loss: 1.0069, test_f1: 0.4838
 epoch: 7, train_loss: 0.9556, test_loss: 0.9715, test_f1: 0.5096
 epoch: 8, train_loss: 0.9508, test_loss: 1.0101, test_f1: 0.4863
 epoch: 9, train_loss: 0.9479, test_loss: 0.9831, test_f1: 0.4925
 epoch: 10, train_loss: 0.9395, test_loss: 0.9652, test_f1: 0.5462
 epoch: 11, train_loss: 0.9316, test_loss: 0.9508, test_f1: 0.5019
 epoch: 12, train_loss: 0.9299, test_loss: 0.9364, test_f1: 0.5075
 epoch: 13, train_loss: 0.9226, test_loss: 0.9541, test_f1: 0.5073
 epoch: 14, train_loss: 0.9030, test_loss: 0.9387, test_f1: 0.5352
 epoch: 15, train_loss: 0.9401, test_loss: 0.9595, test_f1: 0.5100
 epoch: 16, train_loss: 0.9111, test_loss: 1.0402, test_f1: 0.4837
 epoch: 17, train_loss: 0.8993, test_loss: 0.9567, test_f1: 0.4952
 epoch: 18, train_loss: 0.9490, test_loss: 1.0972, test_f1: 0.4514
 epoch: 19, train_loss: 0.9439, test_loss: 1.1266, test_f1: 0.3789
 epoch: 20, train_loss: 0.9415, test_loss: 1.0187, test_f1: 0.4664
 epoch: 21, train_loss: 0.9186, test_loss: 1.0461, test_f1: 0.5018
 epoch: 22, train_loss: 0.9177, test_loss: 0.9529, test_f1: 0.5330
 epoch: 23, train_loss: 0.8819, test_loss: 0.9927, test_f1: 0.5238
 epoch: 24, train_loss: 0.8869, test_loss: 0.9667, test_f1: 0.4995
 epoch: 25, train_loss: 1.0572, test_loss: 1.0240, test_f1: 0.4575
 epoch: 26, train_loss: 0.9836, test_loss: 1.0025, test_f1: 0.4758
 epoch: 27, train_loss: 0.9731, test_loss: 1.2428, test_f1: 0.4165
 epoch: 28, train_loss: 0.9784, test_loss: 0.9814, test_f1: 0.5196
 epoch: 29, train_loss: 0.9543, test_loss: 0.9892, test_f1: 0.4958
 epoch: 30, train_loss: 0.9367, test_loss: 1.0315, test_f1: 0.5049
 epoch: 31, train_loss: 0.9312, test_loss: 0.9815, test_f1: 0.5119
 epoch: 32, train_loss: 0.9218, test_loss: 0.9958, test_f1: 0.4906
 epoch: 33, train_loss: 0.9421, test_loss: 0.9516, test_f1: 0.4880
 epoch: 34, train_loss: 0.9336, test_loss: 1.0002, test_f1: 0.4953
 epoch: 35, train_loss: 0.9254, test_loss: 0.9566, test_f1: 0.4713
 epoch: 36, train_loss: 0.9135, test_loss: 1.0083, test_f1: 0.4979
 epoch: 37, train_loss: 0.9091, test_loss: 0.9126, test_f1: 0.5089
 epoch: 38, train_loss: 0.8969, test_loss: 0.9110, test_f1: 0.5180
 epoch: 39, train_loss: 0.9059, test_loss: 1.0067, test_f1: 0.4838
 epoch: 40, train_loss: 0.8829, test_loss: 0.9324, test_f1: 0.5401
 epoch: 41, train_loss: 0.8807, test_loss: 0.9399, test_f1: 0.5128
 epoch: 42, train_loss: 0.8718, test_loss: 0.9321, test_f1: 0.5192
 epoch: 43, train_loss: 0.8706, test_loss: 0.9400, test_f1: 0.4933
 epoch: 44, train_loss: 0.8672, test_loss: 0.9117, test_f1: 0.5499
 epoch: 45, train_loss: 0.8592, test_loss: 0.8845, test_f1: 0.5574
 epoch: 46, train_loss: 0.8566, test_loss: 0.9316, test_f1: 0.5136
 epoch: 47, train_loss: 0.8717, test_loss: 0.8942, test_f1: 0.5592
 epoch: 48, train_loss: 0.8621, test_loss: 0.8860, test_f1: 0.5969
 epoch: 49, train_loss: 0.8497, test_loss: 0.9333, test_f1: 0.5255
 epoch: 50, train_loss: 0.8558, test_loss: 0.8847, test_f1: 0.5400
 epoch: 51, train_loss: 0.8259, test_loss: 0.8696, test_f1: 0.5898
 epoch: 52, train_loss: 0.8223, test_loss: 0.9008, test_f1: 0.5419
 epoch: 53, train_loss: 0.8208, test_loss: 0.8809, test_f1: 0.5655
 epoch: 54, train_loss: 0.8230, test_loss: 0.8618, test_f1: 0.5556
 epoch: 55, train_loss: 0.8171, test_loss: 0.8514, test_f1: 0.5762
 epoch: 56, train_loss: 0.8056, test_loss: 0.8524, test_f1: 0.5780
 epoch: 57, train_loss: 0.8139, test_loss: 0.8893, test_f1: 0.5540
 epoch: 58, train_loss: 0.8210, test_loss: 0.8550, test_f1: 0.5639
 epoch: 59, train_loss: 0.8026, test_loss: 0.8151, test_f1: 0.5860
 epoch: 60, train_loss: 0.7933, test_loss: 0.8476, test_f1: 0.5501
 epoch: 61, train_loss: 0.7990, test_loss: 0.8515, test_f1: 0.5798
 epoch: 62, train_loss: 0.7917, test_loss: 0.9264, test_f1: 0.5624
 epoch: 63, train_loss: 0.7941, test_loss: 0.8527, test_f1: 0.5801
 epoch: 64, train_loss: 0.7965, test_loss: 0.8590, test_f1: 0.5699
 epoch: 65, train_loss: 0.8035, test_loss: 0.8659, test_f1: 0.5924
 epoch: 66, train_loss: 0.7940, test_loss: 0.8450, test_f1: 0.6102
 epoch: 67, train_loss: 0.7972, test_loss: 0.9029, test_f1: 0.5701
 epoch: 68, train_loss: 0.7906, test_loss: 0.8594, test_f1: 0.5990
 epoch: 69, train_loss: 0.7932, test_loss: 0.8954, test_f1: 0.5659
 epoch: 70, train_loss: 0.7837, test_loss: 1.0198, test_f1: 0.5373
 epoch: 71, train_loss: 0.7965, test_loss: 0.8928, test_f1: 0.5648
 epoch: 72, train_loss: 0.7951, test_loss: 0.9514, test_f1: 0.5126
 epoch: 73, train_loss: 0.8017, test_loss: 0.8675, test_f1: 0.5596
 epoch: 74, train_loss: 0.7869, test_loss: 0.8564, test_f1: 0.5770
 epoch: 75, train_loss: 0.8063, test_loss: 0.8758, test_f1: 0.5779
 epoch: 76, train_loss: 0.8058, test_loss: 1.0088, test_f1: 0.5151
 epoch: 77, train_loss: 0.7825, test_loss: 0.9125, test_f1: 0.5739
 epoch: 78, train_loss: 0.7915, test_loss: 0.8502, test_f1: 0.5778
 epoch: 79, train_loss: 0.7860, test_loss: 0.8949, test_f1: 0.5617
 epoch: 80, train_loss: 0.7982, test_loss: 0.8732, test_f1: 0.5768
 epoch: 81, train_loss: 0.7773, test_loss: 0.8787, test_f1: 0.5795
 epoch: 82, train_loss: 0.7886, test_loss: 0.8530, test_f1: 0.5971
 epoch: 83, train_loss: 0.7827, test_loss: 0.8497, test_f1: 0.6102
 epoch: 84, train_loss: 0.7970, test_loss: 0.9402, test_f1: 0.5437
 epoch: 85, train_loss: 0.8167, test_loss: 0.8600, test_f1: 0.5846
 epoch: 86, train_loss: 0.7851, test_loss: 0.8473, test_f1: 0.6034
 epoch: 87, train_loss: 0.7881, test_loss: 0.8714, test_f1: 0.6077
 epoch: 88, train_loss: 0.7866, test_loss: 0.8425, test_f1: 0.5962
 epoch: 89, train_loss: 0.7853, test_loss: 0.8588, test_f1: 0.5870
 epoch: 90, train_loss: 0.7890, test_loss: 0.8611, test_f1: 0.5792
 epoch: 91, train_loss: 0.7914, test_loss: 0.8410, test_f1: 0.5691
 epoch: 92, train_loss: 0.7949, test_loss: 0.8518, test_f1: 0.5846
 epoch: 93, train_loss: 0.7916, test_loss: 0.8253, test_f1: 0.6213
 epoch: 94, train_loss: 0.7647, test_loss: 0.8624, test_f1: 0.5986
 epoch: 95, train_loss: 0.7614, test_loss: 0.8892, test_f1: 0.6094
 epoch: 96, train_loss: 0.7870, test_loss: 0.8755, test_f1: 0.6069
 epoch: 97, train_loss: 0.7696, test_loss: 0.8739, test_f1: 0.5994
 epoch: 98, train_loss: 0.7793, test_loss: 0.9338, test_f1: 0.5797
 epoch: 99, train_loss: 0.7759, test_loss: 0.8648, test_f1: 0.5857
##################ITERATION #3 ****************************************
 epoch: 0, train_loss: 1.1522, test_loss: 1.0431, test_f1: 0.4965
 epoch: 1, train_loss: 1.0318, test_loss: 1.0555, test_f1: 0.3943
 epoch: 2, train_loss: 1.0037, test_loss: 1.0477, test_f1: 0.4069
 epoch: 3, train_loss: 0.9891, test_loss: 1.1185, test_f1: 0.4282
 epoch: 4, train_loss: 0.9665, test_loss: 0.9823, test_f1: 0.4695
 epoch: 5, train_loss: 0.9642, test_loss: 0.9510, test_f1: 0.4821
 epoch: 6, train_loss: 0.9546, test_loss: 1.0277, test_f1: 0.4934
 epoch: 7, train_loss: 0.9497, test_loss: 1.1220, test_f1: 0.4582
 epoch: 8, train_loss: 0.9390, test_loss: 0.9990, test_f1: 0.5140
 epoch: 9, train_loss: 0.9421, test_loss: 0.9372, test_f1: 0.5507
 epoch: 10, train_loss: 0.9363, test_loss: 0.9502, test_f1: 0.4973
 epoch: 11, train_loss: 0.9290, test_loss: 0.9431, test_f1: 0.4435
 epoch: 12, train_loss: 0.9078, test_loss: 0.9284, test_f1: 0.5775
 epoch: 13, train_loss: 0.9183, test_loss: 1.0631, test_f1: 0.4624
 epoch: 14, train_loss: 0.9073, test_loss: 1.0482, test_f1: 0.4757
 epoch: 15, train_loss: 0.8971, test_loss: 0.9847, test_f1: 0.4840
 epoch: 16, train_loss: 0.8842, test_loss: 0.9557, test_f1: 0.5705
 epoch: 17, train_loss: 0.8720, test_loss: 1.0090, test_f1: 0.4437
 epoch: 18, train_loss: 0.8817, test_loss: 0.9366, test_f1: 0.5651
 epoch: 19, train_loss: 0.8670, test_loss: 0.9561, test_f1: 0.5353
 epoch: 20, train_loss: 0.8897, test_loss: 0.9661, test_f1: 0.5234
 epoch: 21, train_loss: 0.9025, test_loss: 0.9625, test_f1: 0.5214
 epoch: 22, train_loss: 0.8786, test_loss: 0.8780, test_f1: 0.4936
 epoch: 23, train_loss: 0.8656, test_loss: 0.9106, test_f1: 0.5371
 epoch: 24, train_loss: 0.8517, test_loss: 0.8866, test_f1: 0.5882
 epoch: 25, train_loss: 0.8559, test_loss: 0.9090, test_f1: 0.5373
 epoch: 26, train_loss: 0.8451, test_loss: 0.8867, test_f1: 0.5606
 epoch: 27, train_loss: 0.8546, test_loss: 0.8891, test_f1: 0.5587
 epoch: 28, train_loss: 0.8326, test_loss: 0.9197, test_f1: 0.5637
 epoch: 29, train_loss: 0.8368, test_loss: 0.8993, test_f1: 0.5505
 epoch: 30, train_loss: 0.8287, test_loss: 0.8665, test_f1: 0.5596
 epoch: 31, train_loss: 0.8420, test_loss: 0.9756, test_f1: 0.5208
 epoch: 32, train_loss: 0.8435, test_loss: 0.9665, test_f1: 0.5560
 epoch: 33, train_loss: 0.8237, test_loss: 0.8658, test_f1: 0.5884
 epoch: 34, train_loss: 0.8215, test_loss: 0.8282, test_f1: 0.6045
 epoch: 35, train_loss: 0.8237, test_loss: 0.9213, test_f1: 0.5299
 epoch: 36, train_loss: 0.8327, test_loss: 0.8832, test_f1: 0.5330
 epoch: 37, train_loss: 0.8337, test_loss: 0.8864, test_f1: 0.5657
 epoch: 38, train_loss: 0.8163, test_loss: 0.9681, test_f1: 0.5406
 epoch: 39, train_loss: 0.8118, test_loss: 0.9097, test_f1: 0.5364
 epoch: 40, train_loss: 0.8161, test_loss: 0.9047, test_f1: 0.5297
 epoch: 41, train_loss: 0.8113, test_loss: 0.9170, test_f1: 0.5382
 epoch: 42, train_loss: 0.7975, test_loss: 0.9221, test_f1: 0.5601
 epoch: 43, train_loss: 0.7956, test_loss: 0.9508, test_f1: 0.5344
 epoch: 44, train_loss: 0.8074, test_loss: 0.8300, test_f1: 0.5750
 epoch: 45, train_loss: 0.7956, test_loss: 0.9037, test_f1: 0.5804
 epoch: 46, train_loss: 0.7897, test_loss: 0.9129, test_f1: 0.5552
 epoch: 47, train_loss: 0.8174, test_loss: 0.9185, test_f1: 0.5194
 epoch: 48, train_loss: 0.8125, test_loss: 0.8994, test_f1: 0.5727
 epoch: 49, train_loss: 0.8022, test_loss: 0.8857, test_f1: 0.5468
 epoch: 50, train_loss: 0.7930, test_loss: 0.9018, test_f1: 0.5469
 epoch: 51, train_loss: 0.7636, test_loss: 0.8899, test_f1: 0.5836
 epoch: 52, train_loss: 0.7544, test_loss: 0.9111, test_f1: 0.5850
 epoch: 53, train_loss: 0.7550, test_loss: 0.8840, test_f1: 0.6247
 epoch: 54, train_loss: 0.7511, test_loss: 0.8954, test_f1: 0.6200
 epoch: 55, train_loss: 0.7613, test_loss: 0.8901, test_f1: 0.6293
 epoch: 56, train_loss: 0.7435, test_loss: 0.9224, test_f1: 0.6122
 epoch: 57, train_loss: 0.7471, test_loss: 0.9024, test_f1: 0.6021
 epoch: 58, train_loss: 0.7428, test_loss: 0.9111, test_f1: 0.5916
 epoch: 59, train_loss: 0.7639, test_loss: 0.9370, test_f1: 0.5977
 epoch: 60, train_loss: 0.7457, test_loss: 0.9065, test_f1: 0.6043
 epoch: 61, train_loss: 0.7357, test_loss: 0.9261, test_f1: 0.5706
 epoch: 62, train_loss: 0.7469, test_loss: 0.8848, test_f1: 0.6227
 epoch: 63, train_loss: 0.7277, test_loss: 0.9499, test_f1: 0.6210
 epoch: 64, train_loss: 0.7269, test_loss: 0.9331, test_f1: 0.5969
 epoch: 65, train_loss: 0.7577, test_loss: 0.8924, test_f1: 0.5848
 epoch: 66, train_loss: 0.7350, test_loss: 0.8894, test_f1: 0.5787
 epoch: 67, train_loss: 0.7416, test_loss: 0.9366, test_f1: 0.5735
 epoch: 68, train_loss: 0.7302, test_loss: 0.9327, test_f1: 0.6048
 epoch: 69, train_loss: 0.7297, test_loss: 0.9133, test_f1: 0.5858
 epoch: 70, train_loss: 0.7399, test_loss: 0.9082, test_f1: 0.6149
 epoch: 71, train_loss: 0.7385, test_loss: 0.9321, test_f1: 0.5952
 epoch: 72, train_loss: 0.7418, test_loss: 0.8871, test_f1: 0.6190
 epoch: 73, train_loss: 0.7350, test_loss: 0.9051, test_f1: 0.6289
 epoch: 74, train_loss: 0.7231, test_loss: 0.8579, test_f1: 0.6393
 epoch: 75, train_loss: 0.7225, test_loss: 0.8687, test_f1: 0.6229
 epoch: 76, train_loss: 0.7252, test_loss: 0.8877, test_f1: 0.6242
 epoch: 77, train_loss: 0.7255, test_loss: 0.9258, test_f1: 0.6328
 epoch: 78, train_loss: 0.7305, test_loss: 0.9325, test_f1: 0.5855
 epoch: 79, train_loss: 0.7231, test_loss: 0.9170, test_f1: 0.5895
 epoch: 80, train_loss: 0.7109, test_loss: 0.8974, test_f1: 0.6443
 epoch: 81, train_loss: 0.7232, test_loss: 0.9257, test_f1: 0.6243
 epoch: 82, train_loss: 0.7200, test_loss: 0.9435, test_f1: 0.6314
 epoch: 83, train_loss: 0.7231, test_loss: 0.9547, test_f1: 0.5801
 epoch: 84, train_loss: 0.7311, test_loss: 0.9202, test_f1: 0.6112
 epoch: 85, train_loss: 0.7215, test_loss: 0.9013, test_f1: 0.5913
 epoch: 86, train_loss: 0.7183, test_loss: 0.9372, test_f1: 0.6179
 epoch: 87, train_loss: 0.7177, test_loss: 0.9594, test_f1: 0.6018
 epoch: 88, train_loss: 0.7106, test_loss: 0.9020, test_f1: 0.6175
 epoch: 89, train_loss: 0.7168, test_loss: 0.8687, test_f1: 0.6514
 epoch: 90, train_loss: 0.7224, test_loss: 0.8975, test_f1: 0.6065
 epoch: 91, train_loss: 0.7205, test_loss: 0.8885, test_f1: 0.5840
 epoch: 92, train_loss: 0.7023, test_loss: 0.8686, test_f1: 0.6113
 epoch: 93, train_loss: 0.7229, test_loss: 0.8811, test_f1: 0.6266
 epoch: 94, train_loss: 0.7140, test_loss: 0.8700, test_f1: 0.6263
 epoch: 95, train_loss: 0.7132, test_loss: 0.8477, test_f1: 0.6459
 epoch: 96, train_loss: 0.7133, test_loss: 0.9097, test_f1: 0.5978
 epoch: 97, train_loss: 0.7145, test_loss: 0.9269, test_f1: 0.6255
 epoch: 98, train_loss: 0.7059, test_loss: 0.9091, test_f1: 0.6250
 epoch: 99, train_loss: 0.6974, test_loss: 0.9363, test_f1: 0.6528
##################ITERATION #4 ****************************************
 epoch: 0, train_loss: 1.1398, test_loss: 1.1291, test_f1: 0.3518
 epoch: 1, train_loss: 1.0598, test_loss: 1.1116, test_f1: 0.3549
 epoch: 2, train_loss: 1.0311, test_loss: 1.0717, test_f1: 0.4642
 epoch: 3, train_loss: 1.0149, test_loss: 1.0874, test_f1: 0.4505
 epoch: 4, train_loss: 0.9968, test_loss: 1.1103, test_f1: 0.3770
 epoch: 5, train_loss: 0.9921, test_loss: 1.0791, test_f1: 0.4856
 epoch: 6, train_loss: 0.9905, test_loss: 1.2140, test_f1: 0.3827
 epoch: 7, train_loss: 1.0200, test_loss: 1.0824, test_f1: 0.4054
 epoch: 8, train_loss: 0.9880, test_loss: 1.0229, test_f1: 0.4605
 epoch: 9, train_loss: 0.9712, test_loss: 0.9969, test_f1: 0.4706
 epoch: 10, train_loss: 1.0023, test_loss: 1.0689, test_f1: 0.4065
 epoch: 11, train_loss: 0.9728, test_loss: 0.9961, test_f1: 0.4559
 epoch: 12, train_loss: 0.9709, test_loss: 1.2268, test_f1: 0.4560
 epoch: 13, train_loss: 0.9690, test_loss: 0.9878, test_f1: 0.4581
 epoch: 14, train_loss: 0.9557, test_loss: 1.0201, test_f1: 0.4901
 epoch: 15, train_loss: 0.9430, test_loss: 1.0137, test_f1: 0.4721
 epoch: 16, train_loss: 0.9259, test_loss: 0.9674, test_f1: 0.4904
 epoch: 17, train_loss: 0.9475, test_loss: 1.0540, test_f1: 0.4554
 epoch: 18, train_loss: 0.9313, test_loss: 1.0047, test_f1: 0.4843
 epoch: 19, train_loss: 0.9337, test_loss: 1.0414, test_f1: 0.4891
 epoch: 20, train_loss: 0.9222, test_loss: 0.9639, test_f1: 0.4923
 epoch: 21, train_loss: 0.9305, test_loss: 0.9803, test_f1: 0.4916
 epoch: 22, train_loss: 0.9082, test_loss: 0.9796, test_f1: 0.5051
 epoch: 23, train_loss: 0.9031, test_loss: 0.9452, test_f1: 0.5126
 epoch: 24, train_loss: 0.9032, test_loss: 0.9649, test_f1: 0.5019
 epoch: 25, train_loss: 0.8908, test_loss: 0.9660, test_f1: 0.5399
 epoch: 26, train_loss: 0.8940, test_loss: 0.9901, test_f1: 0.4599
 epoch: 27, train_loss: 0.9206, test_loss: 1.0048, test_f1: 0.4867
 epoch: 28, train_loss: 0.9308, test_loss: 0.9629, test_f1: 0.5018
 epoch: 29, train_loss: 0.8976, test_loss: 0.9231, test_f1: 0.5077
 epoch: 30, train_loss: 0.8961, test_loss: 0.9610, test_f1: 0.4893
 epoch: 31, train_loss: 0.8953, test_loss: 0.9399, test_f1: 0.5052
 epoch: 32, train_loss: 0.8742, test_loss: 0.9840, test_f1: 0.5297
 epoch: 33, train_loss: 0.8868, test_loss: 0.9784, test_f1: 0.5274
 epoch: 34, train_loss: 0.8830, test_loss: 0.9783, test_f1: 0.4815
 epoch: 35, train_loss: 0.8793, test_loss: 0.9663, test_f1: 0.5177
 epoch: 36, train_loss: 0.8780, test_loss: 0.9509, test_f1: 0.4981
 epoch: 37, train_loss: 0.8898, test_loss: 0.9220, test_f1: 0.4919
 epoch: 38, train_loss: 0.8718, test_loss: 1.0023, test_f1: 0.4930
 epoch: 39, train_loss: 0.8726, test_loss: 0.9056, test_f1: 0.5078
 epoch: 40, train_loss: 0.8531, test_loss: 0.9841, test_f1: 0.4995
 epoch: 41, train_loss: 0.8615, test_loss: 1.0232, test_f1: 0.4836
 epoch: 42, train_loss: 0.8826, test_loss: 0.9994, test_f1: 0.5206
 epoch: 43, train_loss: 0.8653, test_loss: 0.9880, test_f1: 0.4961
 epoch: 44, train_loss: 0.8623, test_loss: 0.9526, test_f1: 0.5094
 epoch: 45, train_loss: 0.8611, test_loss: 0.9598, test_f1: 0.5182
 epoch: 46, train_loss: 0.8592, test_loss: 1.0239, test_f1: 0.4538
 epoch: 47, train_loss: 0.8722, test_loss: 0.9378, test_f1: 0.5083
 epoch: 48, train_loss: 0.8514, test_loss: 0.9204, test_f1: 0.5306
 epoch: 49, train_loss: 0.8487, test_loss: 0.8944, test_f1: 0.5370
 epoch: 50, train_loss: 0.8588, test_loss: 0.9307, test_f1: 0.5239
 epoch: 51, train_loss: 0.8381, test_loss: 0.9173, test_f1: 0.5344
 epoch: 52, train_loss: 0.8296, test_loss: 0.9331, test_f1: 0.5262
 epoch: 53, train_loss: 0.8090, test_loss: 0.9266, test_f1: 0.5392
 epoch: 54, train_loss: 0.8247, test_loss: 0.9520, test_f1: 0.5280
 epoch: 55, train_loss: 0.8218, test_loss: 1.0017, test_f1: 0.5162
 epoch: 56, train_loss: 0.8105, test_loss: 0.9232, test_f1: 0.5851
 epoch: 57, train_loss: 0.8127, test_loss: 0.9492, test_f1: 0.5242
 epoch: 58, train_loss: 0.8092, test_loss: 0.9265, test_f1: 0.6076
 epoch: 59, train_loss: 0.8193, test_loss: 0.9348, test_f1: 0.5374
 epoch: 60, train_loss: 0.8093, test_loss: 0.9384, test_f1: 0.5341
 epoch: 61, train_loss: 0.8106, test_loss: 0.9565, test_f1: 0.5664
 epoch: 62, train_loss: 0.7951, test_loss: 0.9043, test_f1: 0.5630
 epoch: 63, train_loss: 0.8061, test_loss: 0.9302, test_f1: 0.5402
 epoch: 64, train_loss: 0.8029, test_loss: 0.9379, test_f1: 0.5966
 epoch: 65, train_loss: 0.8030, test_loss: 0.9385, test_f1: 0.5464
 epoch: 66, train_loss: 0.8082, test_loss: 1.0205, test_f1: 0.5209
 epoch: 67, train_loss: 0.8327, test_loss: 0.9667, test_f1: 0.5290
 epoch: 68, train_loss: 0.8028, test_loss: 0.9159, test_f1: 0.5919
 epoch: 69, train_loss: 0.7978, test_loss: 0.9515, test_f1: 0.5395
 epoch: 70, train_loss: 0.7986, test_loss: 0.9212, test_f1: 0.5640
 epoch: 71, train_loss: 0.7991, test_loss: 0.9425, test_f1: 0.5596
 epoch: 72, train_loss: 0.7905, test_loss: 0.9624, test_f1: 0.5428
 epoch: 73, train_loss: 0.7903, test_loss: 0.9274, test_f1: 0.6053
 epoch: 74, train_loss: 0.8030, test_loss: 0.9599, test_f1: 0.5514
 epoch: 75, train_loss: 0.7928, test_loss: 0.9255, test_f1: 0.5991
 epoch: 76, train_loss: 0.8090, test_loss: 0.9196, test_f1: 0.5953
 epoch: 77, train_loss: 0.7942, test_loss: 0.9228, test_f1: 0.5843
 epoch: 78, train_loss: 0.7939, test_loss: 0.9670, test_f1: 0.5629
 epoch: 79, train_loss: 0.7969, test_loss: 0.9584, test_f1: 0.5479
 epoch: 80, train_loss: 0.7815, test_loss: 0.9452, test_f1: 0.5853
 epoch: 81, train_loss: 0.7794, test_loss: 0.9349, test_f1: 0.5464
 epoch: 82, train_loss: 0.7759, test_loss: 0.9477, test_f1: 0.5974
 epoch: 83, train_loss: 0.7755, test_loss: 0.9291, test_f1: 0.5588
 epoch: 84, train_loss: 0.7724, test_loss: 0.9656, test_f1: 0.5628
 epoch: 85, train_loss: 0.7974, test_loss: 0.9531, test_f1: 0.5408
 epoch: 86, train_loss: 0.7837, test_loss: 0.9345, test_f1: 0.5773
 epoch: 87, train_loss: 0.7836, test_loss: 0.9391, test_f1: 0.5307
 epoch: 88, train_loss: 0.7664, test_loss: 0.9659, test_f1: 0.5873
 epoch: 89, train_loss: 0.7796, test_loss: 0.9363, test_f1: 0.6045
 epoch: 90, train_loss: 0.7901, test_loss: 0.9335, test_f1: 0.5611
 epoch: 91, train_loss: 0.7701, test_loss: 0.9292, test_f1: 0.5723
 epoch: 92, train_loss: 0.7813, test_loss: 0.9948, test_f1: 0.5738
 epoch: 93, train_loss: 0.7717, test_loss: 0.9511, test_f1: 0.5970
 epoch: 94, train_loss: 0.7861, test_loss: 0.9408, test_f1: 0.6039
 epoch: 95, train_loss: 0.7691, test_loss: 0.9034, test_f1: 0.5626
 epoch: 96, train_loss: 0.7856, test_loss: 0.9723, test_f1: 0.5532
 epoch: 97, train_loss: 0.7847, test_loss: 0.9632, test_f1: 0.5691
 epoch: 98, train_loss: 0.7722, test_loss: 0.9128, test_f1: 0.6098
 epoch: 99, train_loss: 0.7655, test_loss: 0.9146, test_f1: 0.6129
##################ITERATION #5 ****************************************
 epoch: 0, train_loss: 1.1409, test_loss: 1.1295, test_f1: 0.3666
 epoch: 1, train_loss: 1.0518, test_loss: 1.0684, test_f1: 0.5028
 epoch: 2, train_loss: 0.9946, test_loss: 1.2263, test_f1: 0.4077
 epoch: 3, train_loss: 0.9898, test_loss: 1.0588, test_f1: 0.4421
 epoch: 4, train_loss: 0.9890, test_loss: 1.0290, test_f1: 0.4761
 epoch: 5, train_loss: 0.9684, test_loss: 1.0328, test_f1: 0.4950
 epoch: 6, train_loss: 0.9732, test_loss: 0.9769, test_f1: 0.5309
 epoch: 7, train_loss: 0.9640, test_loss: 0.9699, test_f1: 0.5284
 epoch: 8, train_loss: 0.9484, test_loss: 1.0762, test_f1: 0.4228
 epoch: 9, train_loss: 0.9383, test_loss: 1.0694, test_f1: 0.4835
 epoch: 10, train_loss: 0.9284, test_loss: 0.8934, test_f1: 0.5581
 epoch: 11, train_loss: 0.9488, test_loss: 1.0014, test_f1: 0.5156
 epoch: 12, train_loss: 0.9464, test_loss: 0.9304, test_f1: 0.4823
 epoch: 13, train_loss: 0.9289, test_loss: 1.0009, test_f1: 0.4847
 epoch: 14, train_loss: 0.9196, test_loss: 0.9399, test_f1: 0.4692
 epoch: 15, train_loss: 0.8995, test_loss: 1.0163, test_f1: 0.4899
 epoch: 16, train_loss: 0.9051, test_loss: 0.9810, test_f1: 0.4831
 epoch: 17, train_loss: 0.8925, test_loss: 1.0869, test_f1: 0.4675
 epoch: 18, train_loss: 0.8826, test_loss: 0.9892, test_f1: 0.5149
 epoch: 19, train_loss: 0.8970, test_loss: 0.8618, test_f1: 0.5212
 epoch: 20, train_loss: 0.8866, test_loss: 0.9474, test_f1: 0.5010
 epoch: 21, train_loss: 0.8701, test_loss: 0.8969, test_f1: 0.5174
 epoch: 22, train_loss: 0.8500, test_loss: 1.1938, test_f1: 0.4046
 epoch: 23, train_loss: 0.8673, test_loss: 0.9002, test_f1: 0.5410
 epoch: 24, train_loss: 0.8469, test_loss: 0.9185, test_f1: 0.5757
 epoch: 25, train_loss: 0.8486, test_loss: 0.9027, test_f1: 0.5485
 epoch: 26, train_loss: 0.8543, test_loss: 0.9052, test_f1: 0.5234
 epoch: 27, train_loss: 0.8293, test_loss: 0.8935, test_f1: 0.5615
 epoch: 28, train_loss: 0.8382, test_loss: 0.8692, test_f1: 0.5256
 epoch: 29, train_loss: 0.8194, test_loss: 0.8877, test_f1: 0.5350
 epoch: 30, train_loss: 0.8322, test_loss: 0.9171, test_f1: 0.5125
 epoch: 31, train_loss: 0.8270, test_loss: 1.0109, test_f1: 0.4589
 epoch: 32, train_loss: 0.8553, test_loss: 0.9329, test_f1: 0.5046
 epoch: 33, train_loss: 0.8189, test_loss: 0.8696, test_f1: 0.5374
 epoch: 34, train_loss: 0.8212, test_loss: 0.9293, test_f1: 0.5404
 epoch: 35, train_loss: 0.8346, test_loss: 1.2771, test_f1: 0.4347
 epoch: 36, train_loss: 0.8630, test_loss: 0.9371, test_f1: 0.5132
 epoch: 37, train_loss: 0.8280, test_loss: 0.8528, test_f1: 0.6042
 epoch: 38, train_loss: 0.8168, test_loss: 0.9372, test_f1: 0.5367
 epoch: 39, train_loss: 0.8132, test_loss: 0.8320, test_f1: 0.5561
 epoch: 40, train_loss: 0.8027, test_loss: 0.8759, test_f1: 0.5473
 epoch: 41, train_loss: 0.8046, test_loss: 0.8353, test_f1: 0.6053
 epoch: 42, train_loss: 0.7864, test_loss: 0.8122, test_f1: 0.6107
 epoch: 43, train_loss: 0.7921, test_loss: 0.8607, test_f1: 0.5477
 epoch: 44, train_loss: 0.7942, test_loss: 0.8937, test_f1: 0.5491
 epoch: 45, train_loss: 0.7754, test_loss: 0.8389, test_f1: 0.5587
 epoch: 46, train_loss: 0.7847, test_loss: 0.8194, test_f1: 0.5712
 epoch: 47, train_loss: 0.7689, test_loss: 0.9758, test_f1: 0.5593
 epoch: 48, train_loss: 0.8034, test_loss: 0.7756, test_f1: 0.5887
 epoch: 49, train_loss: 0.7887, test_loss: 0.8348, test_f1: 0.5502
 epoch: 50, train_loss: 0.7788, test_loss: 0.7654, test_f1: 0.5591
 epoch: 51, train_loss: 0.7609, test_loss: 0.8309, test_f1: 0.5838
 epoch: 52, train_loss: 0.7506, test_loss: 0.8388, test_f1: 0.5714
 epoch: 53, train_loss: 0.7530, test_loss: 0.7722, test_f1: 0.5778
 epoch: 54, train_loss: 0.7545, test_loss: 0.7851, test_f1: 0.5654
 epoch: 55, train_loss: 0.7460, test_loss: 0.8400, test_f1: 0.5862
 epoch: 56, train_loss: 0.7371, test_loss: 0.8859, test_f1: 0.5391
 epoch: 57, train_loss: 0.7303, test_loss: 0.8663, test_f1: 0.5721
 epoch: 58, train_loss: 0.7493, test_loss: 0.8094, test_f1: 0.6012
 epoch: 59, train_loss: 0.7279, test_loss: 0.8261, test_f1: 0.5730
 epoch: 60, train_loss: 0.7400, test_loss: 0.7934, test_f1: 0.5666
 epoch: 61, train_loss: 0.7426, test_loss: 0.8168, test_f1: 0.6067
 epoch: 62, train_loss: 0.7393, test_loss: 0.8234, test_f1: 0.5853
 epoch: 63, train_loss: 0.7306, test_loss: 0.8901, test_f1: 0.5741
 epoch: 64, train_loss: 0.7168, test_loss: 0.8613, test_f1: 0.5844
 epoch: 65, train_loss: 0.7202, test_loss: 0.8321, test_f1: 0.5842
 epoch: 66, train_loss: 0.7287, test_loss: 0.8636, test_f1: 0.5557
 epoch: 67, train_loss: 0.7220, test_loss: 0.8195, test_f1: 0.6258
 epoch: 68, train_loss: 0.7150, test_loss: 0.8438, test_f1: 0.6067
 epoch: 69, train_loss: 0.7360, test_loss: 0.8768, test_f1: 0.5704
 epoch: 70, train_loss: 0.7218, test_loss: 0.8850, test_f1: 0.5880
 epoch: 71, train_loss: 0.7256, test_loss: 0.9056, test_f1: 0.5761
 epoch: 72, train_loss: 0.7199, test_loss: 0.8084, test_f1: 0.5664
 epoch: 73, train_loss: 0.7263, test_loss: 0.8752, test_f1: 0.6049
 epoch: 74, train_loss: 0.7206, test_loss: 0.8137, test_f1: 0.6072
 epoch: 75, train_loss: 0.7135, test_loss: 0.8407, test_f1: 0.5877
 epoch: 76, train_loss: 0.7253, test_loss: 0.8680, test_f1: 0.5569
 epoch: 77, train_loss: 0.7121, test_loss: 0.8058, test_f1: 0.6038
 epoch: 78, train_loss: 0.7126, test_loss: 0.8447, test_f1: 0.5728
 epoch: 79, train_loss: 0.7238, test_loss: 0.8313, test_f1: 0.6070
 epoch: 80, train_loss: 0.7102, test_loss: 0.8891, test_f1: 0.6004
 epoch: 81, train_loss: 0.7112, test_loss: 0.9085, test_f1: 0.5803
 epoch: 82, train_loss: 0.7095, test_loss: 0.8284, test_f1: 0.5991
 epoch: 83, train_loss: 0.7080, test_loss: 0.8425, test_f1: 0.5966
 epoch: 84, train_loss: 0.7343, test_loss: 0.8391, test_f1: 0.5944
 epoch: 85, train_loss: 0.7137, test_loss: 0.7698, test_f1: 0.6007
 epoch: 86, train_loss: 0.7204, test_loss: 0.8092, test_f1: 0.6022
 epoch: 87, train_loss: 0.7018, test_loss: 0.7959, test_f1: 0.5953
 epoch: 88, train_loss: 0.7132, test_loss: 0.8137, test_f1: 0.6084
 epoch: 89, train_loss: 0.7219, test_loss: 0.8826, test_f1: 0.5590
 epoch: 90, train_loss: 0.7054, test_loss: 0.8807, test_f1: 0.5965
 epoch: 91, train_loss: 0.7200, test_loss: 0.8165, test_f1: 0.6137
 epoch: 92, train_loss: 0.6987, test_loss: 0.9636, test_f1: 0.5350
 epoch: 93, train_loss: 0.7143, test_loss: 0.7937, test_f1: 0.5840
 epoch: 94, train_loss: 0.6909, test_loss: 0.8207, test_f1: 0.5583
 epoch: 95, train_loss: 0.7079, test_loss: 0.8027, test_f1: 0.5836
 epoch: 96, train_loss: 0.6889, test_loss: 0.8137, test_f1: 0.5857
 epoch: 97, train_loss: 0.6844, test_loss: 0.8008, test_f1: 0.5931
 epoch: 98, train_loss: 0.6944, test_loss: 0.8880, test_f1: 0.6031
 epoch: 99, train_loss: 0.7002, test_loss: 0.8456, test_f1: 0.5895
##################ITERATION #6 ****************************************
 epoch: 0, train_loss: 1.1343, test_loss: 1.0699, test_f1: 0.4202
 epoch: 1, train_loss: 1.0221, test_loss: 1.0117, test_f1: 0.4748
 epoch: 2, train_loss: 1.0049, test_loss: 1.0575, test_f1: 0.4552
 epoch: 3, train_loss: 1.0070, test_loss: 1.0554, test_f1: 0.4473
 epoch: 4, train_loss: 0.9903, test_loss: 0.9726, test_f1: 0.4973
 epoch: 5, train_loss: 0.9692, test_loss: 0.9820, test_f1: 0.4854
 epoch: 6, train_loss: 0.9634, test_loss: 0.9939, test_f1: 0.4753
 epoch: 7, train_loss: 0.9608, test_loss: 1.0409, test_f1: 0.4991
 epoch: 8, train_loss: 0.9530, test_loss: 1.0052, test_f1: 0.4823
 epoch: 9, train_loss: 0.9575, test_loss: 0.9307, test_f1: 0.4885
 epoch: 10, train_loss: 0.9371, test_loss: 0.9518, test_f1: 0.4843
 epoch: 11, train_loss: 0.9364, test_loss: 0.9599, test_f1: 0.4903
 epoch: 12, train_loss: 0.9241, test_loss: 0.9531, test_f1: 0.4808
 epoch: 13, train_loss: 0.9261, test_loss: 0.9275, test_f1: 0.5181
 epoch: 14, train_loss: 0.9382, test_loss: 0.9333, test_f1: 0.5470
 epoch: 15, train_loss: 0.9437, test_loss: 1.0386, test_f1: 0.4468
 epoch: 16, train_loss: 0.9374, test_loss: 0.9705, test_f1: 0.4829
 epoch: 17, train_loss: 0.9413, test_loss: 0.9094, test_f1: 0.4828
 epoch: 18, train_loss: 0.9163, test_loss: 0.9391, test_f1: 0.4720
 epoch: 19, train_loss: 0.8998, test_loss: 0.9877, test_f1: 0.4786
 epoch: 20, train_loss: 0.9054, test_loss: 0.8705, test_f1: 0.5256
 epoch: 21, train_loss: 0.8969, test_loss: 0.9329, test_f1: 0.4886
 epoch: 22, train_loss: 0.8963, test_loss: 0.9744, test_f1: 0.4736
 epoch: 23, train_loss: 0.9106, test_loss: 0.9372, test_f1: 0.4940
 epoch: 24, train_loss: 0.9035, test_loss: 0.9427, test_f1: 0.5104
 epoch: 25, train_loss: 0.8907, test_loss: 0.8682, test_f1: 0.5156
 epoch: 26, train_loss: 0.8919, test_loss: 0.8925, test_f1: 0.5236
 epoch: 27, train_loss: 0.8796, test_loss: 0.9008, test_f1: 0.5094
 epoch: 28, train_loss: 0.8881, test_loss: 0.8853, test_f1: 0.5345
 epoch: 29, train_loss: 0.8853, test_loss: 1.0484, test_f1: 0.4263
 epoch: 30, train_loss: 0.8937, test_loss: 0.8939, test_f1: 0.4999
 epoch: 31, train_loss: 0.8731, test_loss: 1.0023, test_f1: 0.4834
 epoch: 32, train_loss: 0.8725, test_loss: 0.8740, test_f1: 0.5368
 epoch: 33, train_loss: 0.8636, test_loss: 0.9487, test_f1: 0.5151
 epoch: 34, train_loss: 0.8690, test_loss: 0.8652, test_f1: 0.5771
 epoch: 35, train_loss: 0.8694, test_loss: 0.8604, test_f1: 0.5091
 epoch: 36, train_loss: 0.8595, test_loss: 0.8373, test_f1: 0.5503
 epoch: 37, train_loss: 0.8373, test_loss: 0.8376, test_f1: 0.5803
 epoch: 38, train_loss: 0.8290, test_loss: 0.8816, test_f1: 0.5558
 epoch: 39, train_loss: 0.8409, test_loss: 0.9366, test_f1: 0.5032
 epoch: 40, train_loss: 0.8459, test_loss: 0.8574, test_f1: 0.5500
 epoch: 41, train_loss: 0.8358, test_loss: 0.8591, test_f1: 0.5642
 epoch: 42, train_loss: 0.8369, test_loss: 0.9763, test_f1: 0.5294
 epoch: 43, train_loss: 0.8804, test_loss: 0.9263, test_f1: 0.5529
 epoch: 44, train_loss: 0.8351, test_loss: 0.9660, test_f1: 0.5077
 epoch: 45, train_loss: 0.8416, test_loss: 0.8397, test_f1: 0.6002
 epoch: 46, train_loss: 0.8113, test_loss: 1.1166, test_f1: 0.4711
 epoch: 47, train_loss: 0.8186, test_loss: 0.8278, test_f1: 0.6214
 epoch: 48, train_loss: 0.8360, test_loss: 1.0537, test_f1: 0.4564
 epoch: 49, train_loss: 0.8365, test_loss: 1.2333, test_f1: 0.4561
 epoch: 50, train_loss: 0.8458, test_loss: 0.8622, test_f1: 0.5797
 epoch: 51, train_loss: 0.8082, test_loss: 0.8476, test_f1: 0.6319
 epoch: 52, train_loss: 0.8037, test_loss: 0.8447, test_f1: 0.6155
 epoch: 53, train_loss: 0.7947, test_loss: 0.8089, test_f1: 0.5883
 epoch: 54, train_loss: 0.7746, test_loss: 0.8297, test_f1: 0.5687
 epoch: 55, train_loss: 0.7867, test_loss: 0.8127, test_f1: 0.6224
 epoch: 56, train_loss: 0.7773, test_loss: 0.8482, test_f1: 0.6088
 epoch: 57, train_loss: 0.7728, test_loss: 0.9222, test_f1: 0.5974
 epoch: 58, train_loss: 0.7782, test_loss: 0.7739, test_f1: 0.6309
 epoch: 59, train_loss: 0.7685, test_loss: 0.8218, test_f1: 0.5941
 epoch: 60, train_loss: 0.7759, test_loss: 0.8402, test_f1: 0.5695
 epoch: 61, train_loss: 0.7778, test_loss: 0.8282, test_f1: 0.5952
 epoch: 62, train_loss: 0.7676, test_loss: 0.8251, test_f1: 0.6123
 epoch: 63, train_loss: 0.7709, test_loss: 0.8311, test_f1: 0.5827
 epoch: 64, train_loss: 0.7663, test_loss: 0.8100, test_f1: 0.5548
 epoch: 65, train_loss: 0.7674, test_loss: 0.8303, test_f1: 0.5975
 epoch: 66, train_loss: 0.7689, test_loss: 0.8414, test_f1: 0.5737
 epoch: 67, train_loss: 0.7591, test_loss: 0.8245, test_f1: 0.6222
 epoch: 68, train_loss: 0.7574, test_loss: 0.8147, test_f1: 0.6203
 epoch: 69, train_loss: 0.7520, test_loss: 0.8386, test_f1: 0.5890
 epoch: 70, train_loss: 0.7504, test_loss: 0.7903, test_f1: 0.6337
 epoch: 71, train_loss: 0.7533, test_loss: 0.8023, test_f1: 0.6060
 epoch: 72, train_loss: 0.7509, test_loss: 0.8344, test_f1: 0.6088
 epoch: 73, train_loss: 0.7529, test_loss: 0.8105, test_f1: 0.5994
 epoch: 74, train_loss: 0.7556, test_loss: 0.8296, test_f1: 0.5872
 epoch: 75, train_loss: 0.7735, test_loss: 0.8561, test_f1: 0.5812
 epoch: 76, train_loss: 0.7514, test_loss: 0.8112, test_f1: 0.6225
 epoch: 77, train_loss: 0.7464, test_loss: 0.8406, test_f1: 0.6480
 epoch: 78, train_loss: 0.7595, test_loss: 0.8588, test_f1: 0.6300
 epoch: 79, train_loss: 0.7558, test_loss: 0.8562, test_f1: 0.5597
 epoch: 80, train_loss: 0.7407, test_loss: 0.8800, test_f1: 0.5534
 epoch: 81, train_loss: 0.7490, test_loss: 0.8694, test_f1: 0.6081
 epoch: 82, train_loss: 0.7390, test_loss: 0.8096, test_f1: 0.6454
 epoch: 83, train_loss: 0.7440, test_loss: 0.8296, test_f1: 0.6324
 epoch: 84, train_loss: 0.7435, test_loss: 0.8591, test_f1: 0.6409
 epoch: 85, train_loss: 0.7535, test_loss: 0.8343, test_f1: 0.6317
 epoch: 86, train_loss: 0.7423, test_loss: 0.8027, test_f1: 0.6407
 epoch: 87, train_loss: 0.7491, test_loss: 0.8107, test_f1: 0.6558
 epoch: 88, train_loss: 0.7479, test_loss: 0.8730, test_f1: 0.6058
 epoch: 89, train_loss: 0.7451, test_loss: 0.8242, test_f1: 0.6443
 epoch: 90, train_loss: 0.7359, test_loss: 0.8194, test_f1: 0.6220
 epoch: 91, train_loss: 0.7159, test_loss: 0.8401, test_f1: 0.5696
 epoch: 92, train_loss: 0.7318, test_loss: 0.8227, test_f1: 0.6288
 epoch: 93, train_loss: 0.7216, test_loss: 0.8586, test_f1: 0.6452
 epoch: 94, train_loss: 0.7312, test_loss: 0.8492, test_f1: 0.6213
 epoch: 95, train_loss: 0.7422, test_loss: 0.8223, test_f1: 0.6397
 epoch: 96, train_loss: 0.7306, test_loss: 0.8555, test_f1: 0.5797
 epoch: 97, train_loss: 0.7295, test_loss: 0.8235, test_f1: 0.6361
 epoch: 98, train_loss: 0.7356, test_loss: 0.8372, test_f1: 0.6295
 epoch: 99, train_loss: 0.7179, test_loss: 0.8439, test_f1: 0.6397
##################ITERATION #7 ****************************************
 epoch: 0, train_loss: 1.1072, test_loss: 1.2305, test_f1: 0.3638
 epoch: 1, train_loss: 1.0008, test_loss: 0.9960, test_f1: 0.4720
 epoch: 2, train_loss: 0.9813, test_loss: 1.0530, test_f1: 0.5174
 epoch: 3, train_loss: 0.9761, test_loss: 0.9853, test_f1: 0.4837
 epoch: 4, train_loss: 0.9747, test_loss: 1.0002, test_f1: 0.4881
 epoch: 5, train_loss: 0.9616, test_loss: 1.0036, test_f1: 0.4639
 epoch: 6, train_loss: 0.9614, test_loss: 1.1315, test_f1: 0.3479
 epoch: 7, train_loss: 0.9786, test_loss: 0.9670, test_f1: 0.4855
 epoch: 8, train_loss: 0.9506, test_loss: 1.0409, test_f1: 0.4375
 epoch: 9, train_loss: 0.9533, test_loss: 1.0410, test_f1: 0.4820
 epoch: 10, train_loss: 0.9397, test_loss: 1.0341, test_f1: 0.4846
 epoch: 11, train_loss: 0.9472, test_loss: 1.0660, test_f1: 0.4657
 epoch: 12, train_loss: 0.9375, test_loss: 0.9982, test_f1: 0.5023
 epoch: 13, train_loss: 0.9346, test_loss: 1.0062, test_f1: 0.4993
 epoch: 14, train_loss: 0.9272, test_loss: 0.9828, test_f1: 0.4817
 epoch: 15, train_loss: 0.9249, test_loss: 1.0006, test_f1: 0.5059
 epoch: 16, train_loss: 0.9258, test_loss: 0.9968, test_f1: 0.4785
 epoch: 17, train_loss: 0.9385, test_loss: 0.9897, test_f1: 0.4890
 epoch: 18, train_loss: 0.9199, test_loss: 0.9439, test_f1: 0.4954
 epoch: 19, train_loss: 0.9135, test_loss: 1.0195, test_f1: 0.4879
 epoch: 20, train_loss: 0.8980, test_loss: 0.9777, test_f1: 0.5478
 epoch: 21, train_loss: 0.9015, test_loss: 0.9919, test_f1: 0.4868
 epoch: 22, train_loss: 0.9031, test_loss: 0.9705, test_f1: 0.5005
 epoch: 23, train_loss: 0.9108, test_loss: 0.9485, test_f1: 0.5246
 epoch: 24, train_loss: 0.8830, test_loss: 0.9370, test_f1: 0.5040
 epoch: 25, train_loss: 0.8767, test_loss: 0.8813, test_f1: 0.5087
 epoch: 26, train_loss: 0.8783, test_loss: 0.9621, test_f1: 0.4806
 epoch: 27, train_loss: 0.8987, test_loss: 1.0803, test_f1: 0.4748
 epoch: 28, train_loss: 0.8787, test_loss: 0.9900, test_f1: 0.4976
 epoch: 29, train_loss: 0.8818, test_loss: 0.9597, test_f1: 0.5167
 epoch: 30, train_loss: 0.8641, test_loss: 1.0684, test_f1: 0.4652
 epoch: 31, train_loss: 0.8799, test_loss: 0.9713, test_f1: 0.5778
 epoch: 32, train_loss: 0.8862, test_loss: 0.9442, test_f1: 0.4993
 epoch: 33, train_loss: 0.8673, test_loss: 0.9592, test_f1: 0.4747
 epoch: 34, train_loss: 0.8800, test_loss: 0.9426, test_f1: 0.5409
 epoch: 35, train_loss: 0.8457, test_loss: 0.9365, test_f1: 0.5479
 epoch: 36, train_loss: 0.8564, test_loss: 0.9347, test_f1: 0.5022
 epoch: 37, train_loss: 0.8439, test_loss: 1.0571, test_f1: 0.4823
 epoch: 38, train_loss: 0.8748, test_loss: 0.9356, test_f1: 0.5197
 epoch: 39, train_loss: 0.8618, test_loss: 0.8978, test_f1: 0.5496
 epoch: 40, train_loss: 0.8531, test_loss: 0.9071, test_f1: 0.5418
 epoch: 41, train_loss: 0.8414, test_loss: 0.9651, test_f1: 0.5374
 epoch: 42, train_loss: 0.8337, test_loss: 0.8853, test_f1: 0.5737
 epoch: 43, train_loss: 0.8420, test_loss: 0.8917, test_f1: 0.6122
 epoch: 44, train_loss: 0.8545, test_loss: 0.8910, test_f1: 0.5524
 epoch: 45, train_loss: 0.8432, test_loss: 0.9269, test_f1: 0.5430
 epoch: 46, train_loss: 0.8270, test_loss: 0.8639, test_f1: 0.5635
 epoch: 47, train_loss: 0.8252, test_loss: 0.8639, test_f1: 0.5580
 epoch: 48, train_loss: 0.8410, test_loss: 1.0144, test_f1: 0.4833
 epoch: 49, train_loss: 0.8430, test_loss: 0.9222, test_f1: 0.5542
 epoch: 50, train_loss: 0.8404, test_loss: 0.9064, test_f1: 0.5731
 epoch: 51, train_loss: 0.8069, test_loss: 0.8381, test_f1: 0.5791
 epoch: 52, train_loss: 0.8025, test_loss: 0.8303, test_f1: 0.5697
 epoch: 53, train_loss: 0.7869, test_loss: 0.8452, test_f1: 0.5738
 epoch: 54, train_loss: 0.7853, test_loss: 0.8808, test_f1: 0.5336
 epoch: 55, train_loss: 0.7807, test_loss: 0.8945, test_f1: 0.5568
 epoch: 56, train_loss: 0.7796, test_loss: 0.8725, test_f1: 0.5813
 epoch: 57, train_loss: 0.7773, test_loss: 0.9553, test_f1: 0.5368
 epoch: 58, train_loss: 0.7817, test_loss: 0.8080, test_f1: 0.5771
 epoch: 59, train_loss: 0.7874, test_loss: 0.8187, test_f1: 0.6132
 epoch: 60, train_loss: 0.7689, test_loss: 0.8090, test_f1: 0.6167
 epoch: 61, train_loss: 0.7718, test_loss: 0.8114, test_f1: 0.5975
 epoch: 62, train_loss: 0.7778, test_loss: 0.8473, test_f1: 0.5495
 epoch: 63, train_loss: 0.7833, test_loss: 0.7909, test_f1: 0.5657
 epoch: 64, train_loss: 0.7749, test_loss: 0.8697, test_f1: 0.5730
 epoch: 65, train_loss: 0.7579, test_loss: 0.8017, test_f1: 0.5718
 epoch: 66, train_loss: 0.7651, test_loss: 0.9018, test_f1: 0.5627
 epoch: 67, train_loss: 0.7678, test_loss: 0.8552, test_f1: 0.5633
 epoch: 68, train_loss: 0.7618, test_loss: 0.7860, test_f1: 0.5968
 epoch: 69, train_loss: 0.7622, test_loss: 0.7794, test_f1: 0.5983
 epoch: 70, train_loss: 0.7641, test_loss: 0.8673, test_f1: 0.5703
 epoch: 71, train_loss: 0.7531, test_loss: 0.8577, test_f1: 0.5898
 epoch: 72, train_loss: 0.7533, test_loss: 0.8342, test_f1: 0.6128
 epoch: 73, train_loss: 0.7416, test_loss: 0.8349, test_f1: 0.5928
 epoch: 74, train_loss: 0.7585, test_loss: 0.8188, test_f1: 0.6119
 epoch: 75, train_loss: 0.7438, test_loss: 0.7766, test_f1: 0.6223
 epoch: 76, train_loss: 0.7449, test_loss: 0.8572, test_f1: 0.5831
 epoch: 77, train_loss: 0.7487, test_loss: 0.8222, test_f1: 0.5897
 epoch: 78, train_loss: 0.7480, test_loss: 0.8695, test_f1: 0.6070
 epoch: 79, train_loss: 0.7417, test_loss: 0.8808, test_f1: 0.5851
 epoch: 80, train_loss: 0.7321, test_loss: 0.8304, test_f1: 0.5794
 epoch: 81, train_loss: 0.7383, test_loss: 0.9277, test_f1: 0.6070
 epoch: 82, train_loss: 0.7482, test_loss: 0.8837, test_f1: 0.5876
 epoch: 83, train_loss: 0.7397, test_loss: 0.8592, test_f1: 0.5886
 epoch: 84, train_loss: 0.7401, test_loss: 0.9080, test_f1: 0.5615
 epoch: 85, train_loss: 0.7312, test_loss: 0.8056, test_f1: 0.6036
 epoch: 86, train_loss: 0.7371, test_loss: 0.8046, test_f1: 0.6162
 epoch: 87, train_loss: 0.7261, test_loss: 0.8664, test_f1: 0.5642
 epoch: 88, train_loss: 0.7270, test_loss: 0.8647, test_f1: 0.5894
 epoch: 89, train_loss: 0.7241, test_loss: 0.7895, test_f1: 0.5831
 epoch: 90, train_loss: 0.7225, test_loss: 0.8887, test_f1: 0.6075
 epoch: 91, train_loss: 0.7314, test_loss: 0.8013, test_f1: 0.6280
 epoch: 92, train_loss: 0.7277, test_loss: 0.8128, test_f1: 0.6129
 epoch: 93, train_loss: 0.7163, test_loss: 0.8015, test_f1: 0.6092
 epoch: 94, train_loss: 0.7183, test_loss: 0.8000, test_f1: 0.6044
 epoch: 95, train_loss: 0.7250, test_loss: 0.8704, test_f1: 0.5868
 epoch: 96, train_loss: 0.7242, test_loss: 0.8422, test_f1: 0.6196
 epoch: 97, train_loss: 0.7171, test_loss: 0.8013, test_f1: 0.6068
 epoch: 98, train_loss: 0.7100, test_loss: 0.8163, test_f1: 0.5751
 epoch: 99, train_loss: 0.7167, test_loss: 0.8256, test_f1: 0.5793
##################ITERATION #8 ****************************************
 epoch: 0, train_loss: 1.1617, test_loss: 1.1555, test_f1: 0.3823
 epoch: 1, train_loss: 1.0448, test_loss: 1.0245, test_f1: 0.4400
 epoch: 2, train_loss: 1.0121, test_loss: 0.9762, test_f1: 0.4462
 epoch: 3, train_loss: 1.0009, test_loss: 1.0269, test_f1: 0.4890
 epoch: 4, train_loss: 1.0139, test_loss: 1.0820, test_f1: 0.3991
 epoch: 5, train_loss: 1.0068, test_loss: 1.0571, test_f1: 0.4559
 epoch: 6, train_loss: 0.9848, test_loss: 1.0144, test_f1: 0.4965
 epoch: 7, train_loss: 0.9684, test_loss: 1.0314, test_f1: 0.4696
 epoch: 8, train_loss: 0.9634, test_loss: 0.9462, test_f1: 0.4793
 epoch: 9, train_loss: 0.9546, test_loss: 1.0284, test_f1: 0.5117
 epoch: 10, train_loss: 0.9442, test_loss: 0.9782, test_f1: 0.4953
 epoch: 11, train_loss: 0.9425, test_loss: 0.9848, test_f1: 0.5050
 epoch: 12, train_loss: 0.9528, test_loss: 1.0096, test_f1: 0.4383
 epoch: 13, train_loss: 0.9435, test_loss: 0.9764, test_f1: 0.4665
 epoch: 14, train_loss: 0.9215, test_loss: 0.9371, test_f1: 0.5102
 epoch: 15, train_loss: 0.8987, test_loss: 1.0665, test_f1: 0.5015
 epoch: 16, train_loss: 0.9019, test_loss: 1.0009, test_f1: 0.4885
 epoch: 17, train_loss: 0.8827, test_loss: 0.9899, test_f1: 0.5510
 epoch: 18, train_loss: 0.9045, test_loss: 0.9655, test_f1: 0.4867
 epoch: 19, train_loss: 0.9088, test_loss: 0.9199, test_f1: 0.5245
 epoch: 20, train_loss: 0.8765, test_loss: 0.9148, test_f1: 0.5618
 epoch: 21, train_loss: 0.9027, test_loss: 0.9483, test_f1: 0.5120
 epoch: 22, train_loss: 0.8812, test_loss: 0.9326, test_f1: 0.4912
 epoch: 23, train_loss: 0.8664, test_loss: 1.0944, test_f1: 0.4782
 epoch: 24, train_loss: 0.8679, test_loss: 0.8925, test_f1: 0.5537
 epoch: 25, train_loss: 0.8487, test_loss: 0.8976, test_f1: 0.5338
 epoch: 26, train_loss: 0.8554, test_loss: 1.0743, test_f1: 0.4763
 epoch: 27, train_loss: 0.8415, test_loss: 0.9351, test_f1: 0.5184
 epoch: 28, train_loss: 0.8493, test_loss: 0.8888, test_f1: 0.5987
 epoch: 29, train_loss: 0.8395, test_loss: 0.8954, test_f1: 0.5578
 epoch: 30, train_loss: 0.8397, test_loss: 0.9485, test_f1: 0.5631
 epoch: 31, train_loss: 0.8411, test_loss: 0.9095, test_f1: 0.5401
 epoch: 32, train_loss: 0.8231, test_loss: 0.8599, test_f1: 0.5764
 epoch: 33, train_loss: 0.8379, test_loss: 0.9040, test_f1: 0.5490
 epoch: 34, train_loss: 0.8146, test_loss: 0.8827, test_f1: 0.5198
 epoch: 35, train_loss: 0.8355, test_loss: 0.8831, test_f1: 0.5257
 epoch: 36, train_loss: 0.8271, test_loss: 0.8625, test_f1: 0.5400
 epoch: 37, train_loss: 0.8272, test_loss: 0.8587, test_f1: 0.5624
 epoch: 38, train_loss: 0.8302, test_loss: 0.8349, test_f1: 0.5746
 epoch: 39, train_loss: 0.8257, test_loss: 0.8531, test_f1: 0.5533
 epoch: 40, train_loss: 0.8235, test_loss: 0.8923, test_f1: 0.5886
 epoch: 41, train_loss: 0.7979, test_loss: 0.8711, test_f1: 0.5589
 epoch: 42, train_loss: 0.8195, test_loss: 0.8705, test_f1: 0.5686
 epoch: 43, train_loss: 0.8132, test_loss: 0.8698, test_f1: 0.5458
 epoch: 44, train_loss: 0.8040, test_loss: 0.8387, test_f1: 0.5474
 epoch: 45, train_loss: 0.7864, test_loss: 0.8587, test_f1: 0.5510
 epoch: 46, train_loss: 0.8043, test_loss: 0.8732, test_f1: 0.6205
 epoch: 47, train_loss: 0.7998, test_loss: 0.8749, test_f1: 0.5597
 epoch: 48, train_loss: 0.8065, test_loss: 0.8547, test_f1: 0.5556
 epoch: 49, train_loss: 0.8208, test_loss: 0.8737, test_f1: 0.5927
 epoch: 50, train_loss: 0.7871, test_loss: 0.8624, test_f1: 0.5377
 epoch: 51, train_loss: 0.7655, test_loss: 0.8755, test_f1: 0.6279
 epoch: 52, train_loss: 0.7651, test_loss: 0.8376, test_f1: 0.5855
 epoch: 53, train_loss: 0.7641, test_loss: 0.8643, test_f1: 0.5865
 epoch: 54, train_loss: 0.7646, test_loss: 0.8913, test_f1: 0.5655
 epoch: 55, train_loss: 0.7570, test_loss: 0.8570, test_f1: 0.6238
 epoch: 56, train_loss: 0.7699, test_loss: 0.8323, test_f1: 0.6170
 epoch: 57, train_loss: 0.7477, test_loss: 0.8721, test_f1: 0.5716
 epoch: 58, train_loss: 0.7598, test_loss: 0.8505, test_f1: 0.5913
 epoch: 59, train_loss: 0.7626, test_loss: 0.8607, test_f1: 0.6212
 epoch: 60, train_loss: 0.7437, test_loss: 0.8419, test_f1: 0.5856
 epoch: 61, train_loss: 0.7509, test_loss: 0.8533, test_f1: 0.6245
 epoch: 62, train_loss: 0.7403, test_loss: 0.8505, test_f1: 0.5882
 epoch: 63, train_loss: 0.7582, test_loss: 0.8803, test_f1: 0.5632
 epoch: 64, train_loss: 0.7403, test_loss: 0.8546, test_f1: 0.6272
 epoch: 65, train_loss: 0.7249, test_loss: 0.8764, test_f1: 0.5987
 epoch: 66, train_loss: 0.7542, test_loss: 0.8714, test_f1: 0.5994
 epoch: 67, train_loss: 0.7330, test_loss: 0.8520, test_f1: 0.5857
 epoch: 68, train_loss: 0.7457, test_loss: 0.8773, test_f1: 0.6203
 epoch: 69, train_loss: 0.7357, test_loss: 0.8683, test_f1: 0.6462
 epoch: 70, train_loss: 0.7230, test_loss: 0.8881, test_f1: 0.6053
 epoch: 71, train_loss: 0.7190, test_loss: 0.8556, test_f1: 0.6027
 epoch: 72, train_loss: 0.7215, test_loss: 0.8599, test_f1: 0.6033
 epoch: 73, train_loss: 0.7359, test_loss: 0.8690, test_f1: 0.5890
 epoch: 74, train_loss: 0.7465, test_loss: 0.8883, test_f1: 0.5945
 epoch: 75, train_loss: 0.7611, test_loss: 0.9293, test_f1: 0.5338
 epoch: 76, train_loss: 0.7665, test_loss: 0.8828, test_f1: 0.6041
 epoch: 77, train_loss: 0.7569, test_loss: 0.8802, test_f1: 0.6249
 epoch: 78, train_loss: 0.7388, test_loss: 0.8883, test_f1: 0.5855
 epoch: 79, train_loss: 0.7332, test_loss: 0.8368, test_f1: 0.6276
 epoch: 80, train_loss: 0.7244, test_loss: 0.8478, test_f1: 0.6034
 epoch: 81, train_loss: 0.7265, test_loss: 0.8633, test_f1: 0.6357
 epoch: 82, train_loss: 0.7230, test_loss: 0.8799, test_f1: 0.5772
 epoch: 83, train_loss: 0.7294, test_loss: 0.8648, test_f1: 0.5971
 epoch: 84, train_loss: 0.7331, test_loss: 0.8665, test_f1: 0.5902
 epoch: 85, train_loss: 0.7276, test_loss: 0.8553, test_f1: 0.5874
 epoch: 86, train_loss: 0.7283, test_loss: 0.8830, test_f1: 0.6170
 epoch: 87, train_loss: 0.7336, test_loss: 0.8322, test_f1: 0.6167
 epoch: 88, train_loss: 0.7154, test_loss: 0.8468, test_f1: 0.6087
 epoch: 89, train_loss: 0.7111, test_loss: 0.8253, test_f1: 0.6227
 epoch: 90, train_loss: 0.7103, test_loss: 0.8776, test_f1: 0.6216
 epoch: 91, train_loss: 0.7125, test_loss: 0.8628, test_f1: 0.6336
 epoch: 92, train_loss: 0.7142, test_loss: 0.8476, test_f1: 0.6322
 epoch: 93, train_loss: 0.7255, test_loss: 0.8654, test_f1: 0.5898
 epoch: 94, train_loss: 0.7049, test_loss: 0.9036, test_f1: 0.6097
 epoch: 95, train_loss: 0.7113, test_loss: 0.8477, test_f1: 0.6267
 epoch: 96, train_loss: 0.7138, test_loss: 0.8481, test_f1: 0.5967
 epoch: 97, train_loss: 0.7060, test_loss: 0.8697, test_f1: 0.6155
 epoch: 98, train_loss: 0.7207, test_loss: 0.8683, test_f1: 0.6017
 epoch: 99, train_loss: 0.7053, test_loss: 0.9155, test_f1: 0.6101
##################ITERATION #9 ****************************************
 epoch: 0, train_loss: 1.1193, test_loss: 1.0834, test_f1: 0.3696
 epoch: 1, train_loss: 1.0078, test_loss: 1.0184, test_f1: 0.4430
 epoch: 2, train_loss: 0.9816, test_loss: 1.0511, test_f1: 0.4827
 epoch: 3, train_loss: 0.9802, test_loss: 1.0727, test_f1: 0.4898
 epoch: 4, train_loss: 0.9752, test_loss: 0.9762, test_f1: 0.4782
 epoch: 5, train_loss: 0.9596, test_loss: 1.0256, test_f1: 0.4574
 epoch: 6, train_loss: 0.9503, test_loss: 0.9435, test_f1: 0.4586
 epoch: 7, train_loss: 0.9457, test_loss: 1.0082, test_f1: 0.4793
 epoch: 8, train_loss: 0.9397, test_loss: 0.9369, test_f1: 0.4824
 epoch: 9, train_loss: 0.9461, test_loss: 1.0300, test_f1: 0.4619
 epoch: 10, train_loss: 0.9217, test_loss: 1.0203, test_f1: 0.4657
 epoch: 11, train_loss: 0.9247, test_loss: 1.0321, test_f1: 0.4704
 epoch: 12, train_loss: 0.9076, test_loss: 1.0009, test_f1: 0.4749
 epoch: 13, train_loss: 0.9068, test_loss: 0.9661, test_f1: 0.5040
 epoch: 14, train_loss: 0.8968, test_loss: 1.0650, test_f1: 0.4775
 epoch: 15, train_loss: 0.9031, test_loss: 0.9916, test_f1: 0.5033
 epoch: 16, train_loss: 0.8890, test_loss: 0.9581, test_f1: 0.5021
 epoch: 17, train_loss: 0.9073, test_loss: 0.9554, test_f1: 0.5178
 epoch: 18, train_loss: 0.8935, test_loss: 0.9451, test_f1: 0.5027
 epoch: 19, train_loss: 0.8731, test_loss: 0.9852, test_f1: 0.5519
 epoch: 20, train_loss: 0.8926, test_loss: 0.9558, test_f1: 0.5242
 epoch: 21, train_loss: 0.8852, test_loss: 1.0097, test_f1: 0.4584
 epoch: 22, train_loss: 0.8738, test_loss: 0.9560, test_f1: 0.5115
 epoch: 23, train_loss: 0.8823, test_loss: 0.9422, test_f1: 0.5048
 epoch: 24, train_loss: 0.8595, test_loss: 0.9296, test_f1: 0.5294
 epoch: 25, train_loss: 0.8528, test_loss: 0.9429, test_f1: 0.5883
 epoch: 26, train_loss: 0.8456, test_loss: 0.9415, test_f1: 0.5040
 epoch: 27, train_loss: 0.8441, test_loss: 0.9310, test_f1: 0.5287
 epoch: 28, train_loss: 0.8590, test_loss: 0.9649, test_f1: 0.4871
 epoch: 29, train_loss: 0.8623, test_loss: 0.9267, test_f1: 0.5242
 epoch: 30, train_loss: 0.8631, test_loss: 0.9307, test_f1: 0.5171
 epoch: 31, train_loss: 0.8507, test_loss: 0.9198, test_f1: 0.5670
 epoch: 32, train_loss: 0.8585, test_loss: 0.9031, test_f1: 0.5632
 epoch: 33, train_loss: 0.8395, test_loss: 0.9156, test_f1: 0.5791
 epoch: 34, train_loss: 0.8413, test_loss: 0.9020, test_f1: 0.5899
 epoch: 35, train_loss: 0.8304, test_loss: 0.9601, test_f1: 0.5537
 epoch: 36, train_loss: 0.8482, test_loss: 0.9371, test_f1: 0.5504
 epoch: 37, train_loss: 0.8459, test_loss: 0.9408, test_f1: 0.5572
 epoch: 38, train_loss: 0.8341, test_loss: 0.9120, test_f1: 0.5686
 epoch: 39, train_loss: 0.8284, test_loss: 0.9252, test_f1: 0.4999
 epoch: 40, train_loss: 0.8273, test_loss: 0.8841, test_f1: 0.5888
 epoch: 41, train_loss: 0.8226, test_loss: 1.0336, test_f1: 0.5291
 epoch: 42, train_loss: 0.8543, test_loss: 0.9250, test_f1: 0.5552
 epoch: 43, train_loss: 0.8376, test_loss: 0.8571, test_f1: 0.5960
 epoch: 44, train_loss: 0.8137, test_loss: 0.9001, test_f1: 0.5696
 epoch: 45, train_loss: 0.8071, test_loss: 1.0108, test_f1: 0.5437
 epoch: 46, train_loss: 0.8164, test_loss: 0.9141, test_f1: 0.5731
 epoch: 47, train_loss: 0.8113, test_loss: 0.9432, test_f1: 0.5442
 epoch: 48, train_loss: 0.8076, test_loss: 0.8937, test_f1: 0.6197
 epoch: 49, train_loss: 0.7985, test_loss: 0.9152, test_f1: 0.5867
 epoch: 50, train_loss: 0.7994, test_loss: 0.8577, test_f1: 0.5639
 epoch: 51, train_loss: 0.7831, test_loss: 0.8498, test_f1: 0.6037
 epoch: 52, train_loss: 0.7744, test_loss: 0.8538, test_f1: 0.6342
 epoch: 53, train_loss: 0.7847, test_loss: 0.8849, test_f1: 0.5638
 epoch: 54, train_loss: 0.7766, test_loss: 0.8788, test_f1: 0.6037
 epoch: 55, train_loss: 0.7658, test_loss: 0.8505, test_f1: 0.6175
 epoch: 56, train_loss: 0.7567, test_loss: 0.8978, test_f1: 0.6127
 epoch: 57, train_loss: 0.7541, test_loss: 0.8603, test_f1: 0.6120
 epoch: 58, train_loss: 0.7672, test_loss: 0.8640, test_f1: 0.6124
 epoch: 59, train_loss: 0.7504, test_loss: 0.8486, test_f1: 0.6067
 epoch: 60, train_loss: 0.7594, test_loss: 0.8638, test_f1: 0.5899
 epoch: 61, train_loss: 0.7455, test_loss: 0.8600, test_f1: 0.6012
 epoch: 62, train_loss: 0.7524, test_loss: 0.8798, test_f1: 0.6212
 epoch: 63, train_loss: 0.7752, test_loss: 0.8571, test_f1: 0.6344
 epoch: 64, train_loss: 0.7464, test_loss: 0.8502, test_f1: 0.6074
 epoch: 65, train_loss: 0.7541, test_loss: 0.8726, test_f1: 0.6045
 epoch: 66, train_loss: 0.7528, test_loss: 0.8382, test_f1: 0.6223
 epoch: 67, train_loss: 0.7380, test_loss: 0.8338, test_f1: 0.6338
 epoch: 68, train_loss: 0.7501, test_loss: 0.8402, test_f1: 0.6182
 epoch: 69, train_loss: 0.7407, test_loss: 0.8470, test_f1: 0.6081
 epoch: 70, train_loss: 0.7546, test_loss: 0.8329, test_f1: 0.6332
 epoch: 71, train_loss: 0.7379, test_loss: 0.8310, test_f1: 0.6367
 epoch: 72, train_loss: 0.7438, test_loss: 0.8253, test_f1: 0.6304
 epoch: 73, train_loss: 0.7466, test_loss: 0.8518, test_f1: 0.6276
 epoch: 74, train_loss: 0.7268, test_loss: 0.8573, test_f1: 0.6224
 epoch: 75, train_loss: 0.7250, test_loss: 0.8216, test_f1: 0.6243
 epoch: 76, train_loss: 0.7283, test_loss: 0.8471, test_f1: 0.6340
 epoch: 77, train_loss: 0.7250, test_loss: 0.8579, test_f1: 0.6172
 epoch: 78, train_loss: 0.7378, test_loss: 0.8646, test_f1: 0.6126
 epoch: 79, train_loss: 0.7343, test_loss: 0.8397, test_f1: 0.6102
 epoch: 80, train_loss: 0.7285, test_loss: 0.8608, test_f1: 0.6349
 epoch: 81, train_loss: 0.7136, test_loss: 0.8368, test_f1: 0.6338
 epoch: 82, train_loss: 0.7304, test_loss: 0.8601, test_f1: 0.5949
 epoch: 83, train_loss: 0.7296, test_loss: 0.8247, test_f1: 0.6208
 epoch: 84, train_loss: 0.7223, test_loss: 0.8340, test_f1: 0.6184
 epoch: 85, train_loss: 0.7313, test_loss: 0.8228, test_f1: 0.6032
 epoch: 86, train_loss: 0.7169, test_loss: 0.8335, test_f1: 0.6249
 epoch: 87, train_loss: 0.7188, test_loss: 0.8404, test_f1: 0.6365
 epoch: 88, train_loss: 0.7123, test_loss: 0.8466, test_f1: 0.6426
 epoch: 89, train_loss: 0.7141, test_loss: 0.8529, test_f1: 0.6313
 epoch: 90, train_loss: 0.7038, test_loss: 0.8515, test_f1: 0.6238
 epoch: 91, train_loss: 0.7092, test_loss: 0.8349, test_f1: 0.6301
 epoch: 92, train_loss: 0.6956, test_loss: 0.8747, test_f1: 0.6119
 epoch: 93, train_loss: 0.6985, test_loss: 0.8498, test_f1: 0.6284
 epoch: 94, train_loss: 0.6968, test_loss: 0.8396, test_f1: 0.6286
 epoch: 95, train_loss: 0.7153, test_loss: 0.8229, test_f1: 0.6283
 epoch: 96, train_loss: 0.6942, test_loss: 0.8426, test_f1: 0.6321
 epoch: 97, train_loss: 0.7195, test_loss: 0.8935, test_f1: 0.5887
 epoch: 98, train_loss: 0.7170, test_loss: 0.8661, test_f1: 0.6110
 epoch: 99, train_loss: 0.7174, test_loss: 0.8570, test_f1: 0.6327

Training completed in 1064.62 seconds
Best F1: 0.6701 at epoch 97
Mean F1 across iterations: 0.6417  0.0180
========================FINAL RESULTS================================
FEGIN weighted F1: 0.6701  0.0180
python main.py --data ltspice_examples --representation component_pin_net --model FEGIN --layers 6 --hiddens 16 --batch_size 64 --lr 0.01 --emb_size 512 --epochs 100 --save_appendix component_pin_net_L6_H16_BS64_LR0.01_E512 --no_val
-----



STDERR:
  File "main.py", line 370, in <module>
    main()
  File "main.py", line 254, in main
    dataset = dataset_class(
  File "/home/philip/projects/llm_inference_code_repo/Circuit-Completion-Using-GNNs/component_classification_with_link_prediction_head/evaluation/FEGIN/kernel/circuit_datasets.py", line 15, in __init__
    self.data, self.slices = torch.load(self.processed_paths[0])
  File "/home/philip/.local/lib/python3.8/site-packages/torch/serialization.py", line 1040, in load
    warnings.warn(
  File "/usr/lib/python3.8/warnings.py", line 109, in _showwarnmsg
    sw(msg.message, msg.category, msg.filename, msg.lineno,
  File "main.py", line 47, in warn_with_traceback
    traceback.print_stack(file=log)
/home/philip/projects/llm_inference_code_repo/Circuit-Completion-Using-GNNs/component_classification_with_link_prediction_head/evaluation/FEGIN/kernel/circuit_datasets.py:15: FutureWarning: You are using `torch.load` with `weights_only=False` (the current default value), which uses the default pickle module implicitly. It is possible to construct malicious pickle data which will execute arbitrary code during unpickling (See https://github.com/pytorch/pytorch/blob/main/SECURITY.md#untrusted-models for more details). In a future release, the default value for `weights_only` will be flipped to `True`. This limits the functions that could be executed during unpickling. Arbitrary objects will no longer be allowed to be loaded via this mode unless they are explicitly allowlisted by the user via `torch.serialization.add_safe_globals`. We recommend you start setting `weights_only=True` for any use case where you don't have full control of the loaded file. Please open an issue on GitHub for any issues related to this experimental feature.
  self.data, self.slices = torch.load(self.processed_paths[0])
