STDOUT:
Results will be saved in /home/philip/projects/ltspice_examples_code_repo/Circuit-Completion-Using-GNNs/component_classification_with_link_prediction_head/evaluation/FEGIN/results/model_FEGIN_dataset_ltspice_examples
Command line input: python main.py --data ltspice_examples --representation component_net --model FEGIN --layers 2 --hiddens 128 --batch_size 256 --lr 0.001 --emb_size 250 --epochs 100 --save_appendix component_net_L2_H128_BS256_LR0.001_E250 --no_val
 is saved.
-----
ltspice_examples - FEGIN
Using 2 layers, 128 hidden units, h = 2
Loading component_net representation dataset
ENTERED
Training FEGIN on component_net representation
Train: 3558, Test: 846
##################ITERATION #0 ****************************************
 epoch: 0, train_loss: 1.2998, test_loss: 1.3035, test_f1: 0.2270
 epoch: 1, train_loss: 1.1813, test_loss: 1.2161, test_f1: 0.2651
 epoch: 2, train_loss: 1.0936, test_loss: 1.1052, test_f1: 0.4473
 epoch: 3, train_loss: 1.0121, test_loss: 1.0434, test_f1: 0.4439
 epoch: 4, train_loss: 0.9635, test_loss: 1.0774, test_f1: 0.3922
 epoch: 5, train_loss: 0.9368, test_loss: 0.9456, test_f1: 0.5377
 epoch: 6, train_loss: 0.9182, test_loss: 0.9204, test_f1: 0.4985
 epoch: 7, train_loss: 0.8920, test_loss: 0.9347, test_f1: 0.5183
 epoch: 8, train_loss: 0.8693, test_loss: 0.9456, test_f1: 0.4929
 epoch: 9, train_loss: 0.8609, test_loss: 1.0415, test_f1: 0.5112
 epoch: 10, train_loss: 0.8591, test_loss: 0.9386, test_f1: 0.5567
 epoch: 11, train_loss: 0.8438, test_loss: 0.9031, test_f1: 0.5305
 epoch: 12, train_loss: 0.8224, test_loss: 0.8820, test_f1: 0.5259
 epoch: 13, train_loss: 0.8030, test_loss: 0.9083, test_f1: 0.5485
 epoch: 14, train_loss: 0.7925, test_loss: 0.9749, test_f1: 0.5483
 epoch: 15, train_loss: 0.7730, test_loss: 0.9171, test_f1: 0.5337
 epoch: 16, train_loss: 0.7709, test_loss: 0.9471, test_f1: 0.5399
 epoch: 17, train_loss: 0.7686, test_loss: 0.9451, test_f1: 0.5274
 epoch: 18, train_loss: 0.7416, test_loss: 0.9804, test_f1: 0.5719
 epoch: 19, train_loss: 0.7203, test_loss: 0.9912, test_f1: 0.5905
 epoch: 20, train_loss: 0.7112, test_loss: 0.9783, test_f1: 0.5702
 epoch: 21, train_loss: 0.7158, test_loss: 0.9507, test_f1: 0.6275
 epoch: 22, train_loss: 0.7130, test_loss: 0.9262, test_f1: 0.5536
 epoch: 23, train_loss: 0.7108, test_loss: 0.9299, test_f1: 0.6045
 epoch: 24, train_loss: 0.7093, test_loss: 0.9841, test_f1: 0.6133
 epoch: 25, train_loss: 0.6821, test_loss: 0.9718, test_f1: 0.5958
 epoch: 26, train_loss: 0.6780, test_loss: 0.9503, test_f1: 0.6476
 epoch: 27, train_loss: 0.6721, test_loss: 0.9583, test_f1: 0.5984
 epoch: 28, train_loss: 0.6479, test_loss: 0.9949, test_f1: 0.5651
 epoch: 29, train_loss: 0.6315, test_loss: 1.0709, test_f1: 0.5595
 epoch: 30, train_loss: 0.6395, test_loss: 0.9732, test_f1: 0.6684
 epoch: 31, train_loss: 0.6297, test_loss: 1.0932, test_f1: 0.6003
 epoch: 32, train_loss: 0.6284, test_loss: 1.0255, test_f1: 0.6137
 epoch: 33, train_loss: 0.6157, test_loss: 1.0381, test_f1: 0.6062
 epoch: 34, train_loss: 0.6131, test_loss: 1.0048, test_f1: 0.6524
 epoch: 35, train_loss: 0.5931, test_loss: 0.9977, test_f1: 0.6317
 epoch: 36, train_loss: 0.5830, test_loss: 1.0269, test_f1: 0.6399
 epoch: 37, train_loss: 0.5755, test_loss: 1.0806, test_f1: 0.6159
 epoch: 38, train_loss: 0.5917, test_loss: 1.0594, test_f1: 0.6218
 epoch: 39, train_loss: 0.5795, test_loss: 1.0938, test_f1: 0.6130
 epoch: 40, train_loss: 0.5591, test_loss: 1.0223, test_f1: 0.6139
 epoch: 41, train_loss: 0.5345, test_loss: 1.1203, test_f1: 0.6151
 epoch: 42, train_loss: 0.5338, test_loss: 1.0602, test_f1: 0.6532
 epoch: 43, train_loss: 0.5322, test_loss: 1.1215, test_f1: 0.6308
 epoch: 44, train_loss: 0.5220, test_loss: 1.1500, test_f1: 0.6201
 epoch: 45, train_loss: 0.5060, test_loss: 1.1684, test_f1: 0.6444
 epoch: 46, train_loss: 0.5093, test_loss: 1.1238, test_f1: 0.6418
 epoch: 47, train_loss: 0.5147, test_loss: 1.1422, test_f1: 0.6262
 epoch: 48, train_loss: 0.5077, test_loss: 1.1589, test_f1: 0.6299
 epoch: 49, train_loss: 0.5214, test_loss: 1.1214, test_f1: 0.6117
 epoch: 50, train_loss: 0.5268, test_loss: 1.1515, test_f1: 0.6144
 epoch: 51, train_loss: 0.4720, test_loss: 1.1118, test_f1: 0.6561
 epoch: 52, train_loss: 0.4468, test_loss: 1.1691, test_f1: 0.6366
 epoch: 53, train_loss: 0.4351, test_loss: 1.1789, test_f1: 0.6419
 epoch: 54, train_loss: 0.4231, test_loss: 1.2047, test_f1: 0.6420
 epoch: 55, train_loss: 0.4060, test_loss: 1.2058, test_f1: 0.6266
 epoch: 56, train_loss: 0.4101, test_loss: 1.2005, test_f1: 0.6583
 epoch: 57, train_loss: 0.4098, test_loss: 1.1821, test_f1: 0.6504
 epoch: 58, train_loss: 0.4099, test_loss: 1.2422, test_f1: 0.6589
 epoch: 59, train_loss: 0.4025, test_loss: 1.2264, test_f1: 0.6363
 epoch: 60, train_loss: 0.4021, test_loss: 1.2505, test_f1: 0.6442
 epoch: 61, train_loss: 0.3843, test_loss: 1.2928, test_f1: 0.6528
 epoch: 62, train_loss: 0.3830, test_loss: 1.3451, test_f1: 0.6535
 epoch: 63, train_loss: 0.3722, test_loss: 1.3976, test_f1: 0.6259
 epoch: 64, train_loss: 0.3659, test_loss: 1.3398, test_f1: 0.6336
 epoch: 65, train_loss: 0.3779, test_loss: 1.3314, test_f1: 0.6554
 epoch: 66, train_loss: 0.3704, test_loss: 1.3643, test_f1: 0.6364
 epoch: 67, train_loss: 0.3495, test_loss: 1.3251, test_f1: 0.6301
 epoch: 68, train_loss: 0.3589, test_loss: 1.4535, test_f1: 0.6044
 epoch: 69, train_loss: 0.3710, test_loss: 1.3790, test_f1: 0.6630
 epoch: 70, train_loss: 0.3547, test_loss: 1.3711, test_f1: 0.6517
 epoch: 71, train_loss: 0.3497, test_loss: 1.4140, test_f1: 0.6269
 epoch: 72, train_loss: 0.3382, test_loss: 1.4759, test_f1: 0.6548
 epoch: 73, train_loss: 0.3428, test_loss: 1.3563, test_f1: 0.6547
 epoch: 74, train_loss: 0.3507, test_loss: 1.4455, test_f1: 0.6263
 epoch: 75, train_loss: 0.3454, test_loss: 1.4199, test_f1: 0.6556
 epoch: 76, train_loss: 0.3287, test_loss: 1.5175, test_f1: 0.6501
 epoch: 77, train_loss: 0.3263, test_loss: 1.5342, test_f1: 0.6304
 epoch: 78, train_loss: 0.3340, test_loss: 1.5391, test_f1: 0.6400
 epoch: 79, train_loss: 0.3146, test_loss: 1.5032, test_f1: 0.6381
 epoch: 80, train_loss: 0.3232, test_loss: 1.6375, test_f1: 0.6282
 epoch: 81, train_loss: 0.3134, test_loss: 1.4903, test_f1: 0.6263
 epoch: 82, train_loss: 0.3122, test_loss: 1.5805, test_f1: 0.6302
 epoch: 83, train_loss: 0.3020, test_loss: 1.5452, test_f1: 0.6361
 epoch: 84, train_loss: 0.2954, test_loss: 1.7710, test_f1: 0.6229
 epoch: 85, train_loss: 0.2994, test_loss: 1.6916, test_f1: 0.6378
 epoch: 86, train_loss: 0.2976, test_loss: 1.7241, test_f1: 0.6338
 epoch: 87, train_loss: 0.2812, test_loss: 1.6482, test_f1: 0.6530
 epoch: 88, train_loss: 0.2788, test_loss: 1.6335, test_f1: 0.6218
 epoch: 89, train_loss: 0.2770, test_loss: 1.6445, test_f1: 0.6529
 epoch: 90, train_loss: 0.2961, test_loss: 1.6734, test_f1: 0.6274
 epoch: 91, train_loss: 0.2818, test_loss: 1.7551, test_f1: 0.6175
 epoch: 92, train_loss: 0.2825, test_loss: 1.9089, test_f1: 0.6237
 epoch: 93, train_loss: 0.2666, test_loss: 1.7947, test_f1: 0.6496
 epoch: 94, train_loss: 0.2813, test_loss: 1.6086, test_f1: 0.6315
 epoch: 95, train_loss: 0.2687, test_loss: 1.7965, test_f1: 0.6354
 epoch: 96, train_loss: 0.2780, test_loss: 1.6769, test_f1: 0.6243
 epoch: 97, train_loss: 0.2663, test_loss: 1.9461, test_f1: 0.6385
 epoch: 98, train_loss: 0.2417, test_loss: 1.8893, test_f1: 0.6311
 epoch: 99, train_loss: 0.2477, test_loss: 1.9490, test_f1: 0.6259
##################ITERATION #1 ****************************************
 epoch: 0, train_loss: 1.2049, test_loss: 1.2615, test_f1: 0.2270
 epoch: 1, train_loss: 1.0438, test_loss: 1.1116, test_f1: 0.3528
 epoch: 2, train_loss: 0.9888, test_loss: 1.0160, test_f1: 0.4480
 epoch: 3, train_loss: 0.9417, test_loss: 0.9402, test_f1: 0.5172
 epoch: 4, train_loss: 0.9267, test_loss: 0.9429, test_f1: 0.5207
 epoch: 5, train_loss: 0.9013, test_loss: 0.9484, test_f1: 0.5136
 epoch: 6, train_loss: 0.8773, test_loss: 0.9471, test_f1: 0.5126
 epoch: 7, train_loss: 0.8706, test_loss: 0.8777, test_f1: 0.5213
 epoch: 8, train_loss: 0.8460, test_loss: 0.8948, test_f1: 0.5496
 epoch: 9, train_loss: 0.8445, test_loss: 0.9686, test_f1: 0.5180
 epoch: 10, train_loss: 0.8148, test_loss: 0.9000, test_f1: 0.6216
 epoch: 11, train_loss: 0.8065, test_loss: 0.8641, test_f1: 0.5731
 epoch: 12, train_loss: 0.7861, test_loss: 0.8726, test_f1: 0.5888
 epoch: 13, train_loss: 0.7835, test_loss: 0.9577, test_f1: 0.5545
 epoch: 14, train_loss: 0.7734, test_loss: 0.8736, test_f1: 0.5704
 epoch: 15, train_loss: 0.7587, test_loss: 0.9681, test_f1: 0.5949
 epoch: 16, train_loss: 0.7426, test_loss: 0.9498, test_f1: 0.5813
 epoch: 17, train_loss: 0.7402, test_loss: 0.9438, test_f1: 0.6037
 epoch: 18, train_loss: 0.7203, test_loss: 0.9502, test_f1: 0.5905
 epoch: 19, train_loss: 0.7004, test_loss: 0.9337, test_f1: 0.6194
 epoch: 20, train_loss: 0.6840, test_loss: 0.8788, test_f1: 0.6038
 epoch: 21, train_loss: 0.6886, test_loss: 0.9467, test_f1: 0.6330
 epoch: 22, train_loss: 0.6697, test_loss: 1.0104, test_f1: 0.6055
 epoch: 23, train_loss: 0.6612, test_loss: 0.9271, test_f1: 0.6041
 epoch: 24, train_loss: 0.6753, test_loss: 0.9608, test_f1: 0.6113
 epoch: 25, train_loss: 0.6469, test_loss: 0.9210, test_f1: 0.6125
 epoch: 26, train_loss: 0.6341, test_loss: 1.0273, test_f1: 0.5656
 epoch: 27, train_loss: 0.6418, test_loss: 1.0349, test_f1: 0.6435
 epoch: 28, train_loss: 0.6316, test_loss: 0.9458, test_f1: 0.6211
 epoch: 29, train_loss: 0.6214, test_loss: 0.9322, test_f1: 0.6517
 epoch: 30, train_loss: 0.6144, test_loss: 1.0002, test_f1: 0.6445
 epoch: 31, train_loss: 0.5871, test_loss: 0.9634, test_f1: 0.6592
 epoch: 32, train_loss: 0.5844, test_loss: 0.9943, test_f1: 0.6581
 epoch: 33, train_loss: 0.5851, test_loss: 0.9739, test_f1: 0.6621
 epoch: 34, train_loss: 0.5619, test_loss: 0.9846, test_f1: 0.6330
 epoch: 35, train_loss: 0.5651, test_loss: 0.9851, test_f1: 0.6358
 epoch: 36, train_loss: 0.5511, test_loss: 1.1276, test_f1: 0.6073
 epoch: 37, train_loss: 0.5565, test_loss: 0.9606, test_f1: 0.6412
 epoch: 38, train_loss: 0.5526, test_loss: 1.1535, test_f1: 0.6122
 epoch: 39, train_loss: 0.5286, test_loss: 0.9921, test_f1: 0.6362
 epoch: 40, train_loss: 0.5167, test_loss: 1.0018, test_f1: 0.6631
 epoch: 41, train_loss: 0.5120, test_loss: 0.9776, test_f1: 0.6319
 epoch: 42, train_loss: 0.5014, test_loss: 1.0887, test_f1: 0.6445
 epoch: 43, train_loss: 0.5149, test_loss: 1.0345, test_f1: 0.6428
 epoch: 44, train_loss: 0.4868, test_loss: 1.0419, test_f1: 0.6501
 epoch: 45, train_loss: 0.4967, test_loss: 1.0207, test_f1: 0.6638
 epoch: 46, train_loss: 0.4835, test_loss: 1.0990, test_f1: 0.6424
 epoch: 47, train_loss: 0.4764, test_loss: 1.0701, test_f1: 0.6286
 epoch: 48, train_loss: 0.4616, test_loss: 1.0304, test_f1: 0.6763
 epoch: 49, train_loss: 0.4572, test_loss: 1.1514, test_f1: 0.6583
 epoch: 50, train_loss: 0.4293, test_loss: 1.1793, test_f1: 0.6612
 epoch: 51, train_loss: 0.4236, test_loss: 1.0835, test_f1: 0.6483
 epoch: 52, train_loss: 0.3936, test_loss: 1.1109, test_f1: 0.6807
 epoch: 53, train_loss: 0.3926, test_loss: 1.1463, test_f1: 0.6455
 epoch: 54, train_loss: 0.3808, test_loss: 1.1347, test_f1: 0.6562
 epoch: 55, train_loss: 0.3660, test_loss: 1.1328, test_f1: 0.6586
 epoch: 56, train_loss: 0.3685, test_loss: 1.1387, test_f1: 0.6453
 epoch: 57, train_loss: 0.3837, test_loss: 1.1470, test_f1: 0.6529
 epoch: 58, train_loss: 0.3675, test_loss: 1.1124, test_f1: 0.6578
 epoch: 59, train_loss: 0.3736, test_loss: 1.1486, test_f1: 0.6702
 epoch: 60, train_loss: 0.3559, test_loss: 1.1810, test_f1: 0.6435
 epoch: 61, train_loss: 0.3672, test_loss: 1.2042, test_f1: 0.6599
 epoch: 62, train_loss: 0.3476, test_loss: 1.2491, test_f1: 0.6413
 epoch: 63, train_loss: 0.3561, test_loss: 1.2091, test_f1: 0.6474
 epoch: 64, train_loss: 0.3587, test_loss: 1.1754, test_f1: 0.6695
 epoch: 65, train_loss: 0.3349, test_loss: 1.2735, test_f1: 0.6617
 epoch: 66, train_loss: 0.3287, test_loss: 1.3448, test_f1: 0.6321
 epoch: 67, train_loss: 0.3324, test_loss: 1.3647, test_f1: 0.6451
 epoch: 68, train_loss: 0.3244, test_loss: 1.2485, test_f1: 0.6460
 epoch: 69, train_loss: 0.3269, test_loss: 1.3469, test_f1: 0.6468
 epoch: 70, train_loss: 0.3340, test_loss: 1.2937, test_f1: 0.6664
 epoch: 71, train_loss: 0.3230, test_loss: 1.4216, test_f1: 0.6425
 epoch: 72, train_loss: 0.3394, test_loss: 1.2795, test_f1: 0.6539
 epoch: 73, train_loss: 0.3152, test_loss: 1.3775, test_f1: 0.6453
 epoch: 74, train_loss: 0.3288, test_loss: 1.4114, test_f1: 0.6516
 epoch: 75, train_loss: 0.3241, test_loss: 1.3544, test_f1: 0.6478
 epoch: 76, train_loss: 0.3046, test_loss: 1.4094, test_f1: 0.6727
 epoch: 77, train_loss: 0.3035, test_loss: 1.2815, test_f1: 0.6612
 epoch: 78, train_loss: 0.3012, test_loss: 1.3632, test_f1: 0.6627
 epoch: 79, train_loss: 0.2898, test_loss: 1.5282, test_f1: 0.6397
 epoch: 80, train_loss: 0.2810, test_loss: 1.5051, test_f1: 0.6427
 epoch: 81, train_loss: 0.2842, test_loss: 1.5393, test_f1: 0.6598
 epoch: 82, train_loss: 0.2927, test_loss: 1.5055, test_f1: 0.6468
 epoch: 83, train_loss: 0.2911, test_loss: 1.5298, test_f1: 0.6128
 epoch: 84, train_loss: 0.2811, test_loss: 1.6130, test_f1: 0.6314
 epoch: 85, train_loss: 0.2764, test_loss: 1.4472, test_f1: 0.6459
 epoch: 86, train_loss: 0.2734, test_loss: 1.5202, test_f1: 0.6608
 epoch: 87, train_loss: 0.2724, test_loss: 1.5248, test_f1: 0.6385
 epoch: 88, train_loss: 0.2740, test_loss: 1.5258, test_f1: 0.6395
 epoch: 89, train_loss: 0.2698, test_loss: 1.5186, test_f1: 0.6596
 epoch: 90, train_loss: 0.2610, test_loss: 1.4232, test_f1: 0.6472
 epoch: 91, train_loss: 0.2548, test_loss: 1.6207, test_f1: 0.6534
 epoch: 92, train_loss: 0.2628, test_loss: 1.5816, test_f1: 0.6429
 epoch: 93, train_loss: 0.2665, test_loss: 1.6448, test_f1: 0.6508
 epoch: 94, train_loss: 0.2727, test_loss: 1.6209, test_f1: 0.6646
 epoch: 95, train_loss: 0.2492, test_loss: 1.5590, test_f1: 0.6449
 epoch: 96, train_loss: 0.2534, test_loss: 1.6283, test_f1: 0.6328
 epoch: 97, train_loss: 0.2484, test_loss: 1.7863, test_f1: 0.6233
 epoch: 98, train_loss: 0.2477, test_loss: 1.6193, test_f1: 0.6584
 epoch: 99, train_loss: 0.2406, test_loss: 1.6599, test_f1: 0.6574
##################ITERATION #2 ****************************************
 epoch: 0, train_loss: 1.2503, test_loss: 1.2875, test_f1: 0.2270
 epoch: 1, train_loss: 1.0419, test_loss: 1.1122, test_f1: 0.3327
 epoch: 2, train_loss: 0.9654, test_loss: 1.0097, test_f1: 0.4069
 epoch: 3, train_loss: 0.9374, test_loss: 0.9692, test_f1: 0.4896
 epoch: 4, train_loss: 0.9256, test_loss: 0.9298, test_f1: 0.5355
 epoch: 5, train_loss: 0.8919, test_loss: 0.9740, test_f1: 0.5322
 epoch: 6, train_loss: 0.8726, test_loss: 0.9677, test_f1: 0.5227
 epoch: 7, train_loss: 0.8515, test_loss: 0.9051, test_f1: 0.5453
 epoch: 8, train_loss: 0.8319, test_loss: 0.9139, test_f1: 0.5104
 epoch: 9, train_loss: 0.8223, test_loss: 0.9231, test_f1: 0.5751
 epoch: 10, train_loss: 0.8146, test_loss: 0.8589, test_f1: 0.5675
 epoch: 11, train_loss: 0.8083, test_loss: 0.9816, test_f1: 0.5802
 epoch: 12, train_loss: 0.7971, test_loss: 0.9420, test_f1: 0.5250
 epoch: 13, train_loss: 0.7718, test_loss: 0.9185, test_f1: 0.5709
 epoch: 14, train_loss: 0.7634, test_loss: 0.9457, test_f1: 0.5923
 epoch: 15, train_loss: 0.7552, test_loss: 0.9393, test_f1: 0.5940
 epoch: 16, train_loss: 0.7441, test_loss: 0.9568, test_f1: 0.5879
 epoch: 17, train_loss: 0.7530, test_loss: 0.8744, test_f1: 0.6534
 epoch: 18, train_loss: 0.7369, test_loss: 0.9002, test_f1: 0.5966
 epoch: 19, train_loss: 0.7147, test_loss: 1.2005, test_f1: 0.5428
 epoch: 20, train_loss: 0.7050, test_loss: 1.0411, test_f1: 0.5704
 epoch: 21, train_loss: 0.7102, test_loss: 0.9975, test_f1: 0.5835
 epoch: 22, train_loss: 0.7108, test_loss: 0.9770, test_f1: 0.6135
 epoch: 23, train_loss: 0.6825, test_loss: 0.9225, test_f1: 0.6094
 epoch: 24, train_loss: 0.6728, test_loss: 0.9068, test_f1: 0.6435
 epoch: 25, train_loss: 0.6626, test_loss: 0.9788, test_f1: 0.5890
 epoch: 26, train_loss: 0.6655, test_loss: 1.0244, test_f1: 0.6052
 epoch: 27, train_loss: 0.6544, test_loss: 1.0088, test_f1: 0.6240
 epoch: 28, train_loss: 0.6455, test_loss: 0.9825, test_f1: 0.5810
 epoch: 29, train_loss: 0.6343, test_loss: 0.9850, test_f1: 0.6546
 epoch: 30, train_loss: 0.6353, test_loss: 1.0566, test_f1: 0.5978
 epoch: 31, train_loss: 0.6122, test_loss: 1.0202, test_f1: 0.6419
 epoch: 32, train_loss: 0.6137, test_loss: 1.1458, test_f1: 0.5824
 epoch: 33, train_loss: 0.5923, test_loss: 1.0636, test_f1: 0.5930
 epoch: 34, train_loss: 0.5954, test_loss: 0.9912, test_f1: 0.5952
 epoch: 35, train_loss: 0.5980, test_loss: 1.3168, test_f1: 0.5526
 epoch: 36, train_loss: 0.5851, test_loss: 1.1148, test_f1: 0.6147
 epoch: 37, train_loss: 0.5744, test_loss: 1.0689, test_f1: 0.6166
 epoch: 38, train_loss: 0.5593, test_loss: 1.0420, test_f1: 0.6746
 epoch: 39, train_loss: 0.5409, test_loss: 1.0687, test_f1: 0.6366
 epoch: 40, train_loss: 0.5446, test_loss: 1.0503, test_f1: 0.6476
 epoch: 41, train_loss: 0.5426, test_loss: 1.0203, test_f1: 0.6242
 epoch: 42, train_loss: 0.5460, test_loss: 1.0364, test_f1: 0.6920
 epoch: 43, train_loss: 0.5211, test_loss: 1.0245, test_f1: 0.6870
 epoch: 44, train_loss: 0.5267, test_loss: 1.0437, test_f1: 0.6424
 epoch: 45, train_loss: 0.5074, test_loss: 1.0714, test_f1: 0.6198
 epoch: 46, train_loss: 0.5016, test_loss: 1.2057, test_f1: 0.6164
 epoch: 47, train_loss: 0.4987, test_loss: 1.1933, test_f1: 0.6621
 epoch: 48, train_loss: 0.4907, test_loss: 1.1183, test_f1: 0.6596
 epoch: 49, train_loss: 0.4753, test_loss: 1.0660, test_f1: 0.7055
 epoch: 50, train_loss: 0.4782, test_loss: 1.2319, test_f1: 0.6299
 epoch: 51, train_loss: 0.4459, test_loss: 1.1557, test_f1: 0.6572
 epoch: 52, train_loss: 0.4347, test_loss: 1.0952, test_f1: 0.6852
 epoch: 53, train_loss: 0.4303, test_loss: 1.1679, test_f1: 0.6873
 epoch: 54, train_loss: 0.4204, test_loss: 1.1140, test_f1: 0.6815
 epoch: 55, train_loss: 0.4076, test_loss: 1.1790, test_f1: 0.7161
 epoch: 56, train_loss: 0.4097, test_loss: 1.1699, test_f1: 0.7092
 epoch: 57, train_loss: 0.3947, test_loss: 1.1875, test_f1: 0.6815
 epoch: 58, train_loss: 0.3954, test_loss: 1.1518, test_f1: 0.6754
 epoch: 59, train_loss: 0.3915, test_loss: 1.1462, test_f1: 0.7226
 epoch: 60, train_loss: 0.3797, test_loss: 1.1915, test_f1: 0.6953
 epoch: 61, train_loss: 0.3761, test_loss: 1.2902, test_f1: 0.6552
 epoch: 62, train_loss: 0.3699, test_loss: 1.2632, test_f1: 0.6830
 epoch: 63, train_loss: 0.3759, test_loss: 1.2778, test_f1: 0.6743
 epoch: 64, train_loss: 0.3861, test_loss: 1.2244, test_f1: 0.6557
 epoch: 65, train_loss: 0.3688, test_loss: 1.2339, test_f1: 0.6671
 epoch: 66, train_loss: 0.3549, test_loss: 1.2951, test_f1: 0.7060
 epoch: 67, train_loss: 0.3653, test_loss: 1.3052, test_f1: 0.6973
 epoch: 68, train_loss: 0.3563, test_loss: 1.3749, test_f1: 0.6316
 epoch: 69, train_loss: 0.3615, test_loss: 1.3657, test_f1: 0.6516
 epoch: 70, train_loss: 0.3518, test_loss: 1.2441, test_f1: 0.6944
 epoch: 71, train_loss: 0.3417, test_loss: 1.4126, test_f1: 0.6764
 epoch: 72, train_loss: 0.3317, test_loss: 1.5141, test_f1: 0.6242
 epoch: 73, train_loss: 0.3474, test_loss: 1.2839, test_f1: 0.6889
 epoch: 74, train_loss: 0.3355, test_loss: 1.3756, test_f1: 0.6925
 epoch: 75, train_loss: 0.3386, test_loss: 1.3614, test_f1: 0.6823
 epoch: 76, train_loss: 0.3233, test_loss: 1.2960, test_f1: 0.6943
 epoch: 77, train_loss: 0.3356, test_loss: 1.4529, test_f1: 0.6425
 epoch: 78, train_loss: 0.3293, test_loss: 1.4081, test_f1: 0.6471
 epoch: 79, train_loss: 0.3073, test_loss: 1.3491, test_f1: 0.6709
 epoch: 80, train_loss: 0.3222, test_loss: 1.4113, test_f1: 0.6554
 epoch: 81, train_loss: 0.3116, test_loss: 1.4901, test_f1: 0.6524
 epoch: 82, train_loss: 0.3110, test_loss: 1.4320, test_f1: 0.6517
 epoch: 83, train_loss: 0.3060, test_loss: 1.5501, test_f1: 0.6507
 epoch: 84, train_loss: 0.3057, test_loss: 1.4830, test_f1: 0.6659
 epoch: 85, train_loss: 0.3156, test_loss: 1.5510, test_f1: 0.6577
 epoch: 86, train_loss: 0.3122, test_loss: 1.6018, test_f1: 0.6199
 epoch: 87, train_loss: 0.3288, test_loss: 1.4087, test_f1: 0.6805
 epoch: 88, train_loss: 0.3010, test_loss: 1.4406, test_f1: 0.6741
 epoch: 89, train_loss: 0.2852, test_loss: 1.4333, test_f1: 0.6761
 epoch: 90, train_loss: 0.2847, test_loss: 1.4997, test_f1: 0.6833
 epoch: 91, train_loss: 0.2750, test_loss: 1.5248, test_f1: 0.7048
 epoch: 92, train_loss: 0.2826, test_loss: 1.5641, test_f1: 0.6827
 epoch: 93, train_loss: 0.2662, test_loss: 1.4711, test_f1: 0.6881
 epoch: 94, train_loss: 0.2761, test_loss: 1.5470, test_f1: 0.6505
 epoch: 95, train_loss: 0.2770, test_loss: 1.7546, test_f1: 0.6788
 epoch: 96, train_loss: 0.2715, test_loss: 1.5268, test_f1: 0.6693
 epoch: 97, train_loss: 0.2548, test_loss: 1.6100, test_f1: 0.6395
 epoch: 98, train_loss: 0.2645, test_loss: 1.6003, test_f1: 0.6604
 epoch: 99, train_loss: 0.2584, test_loss: 1.6335, test_f1: 0.6636
##################ITERATION #3 ****************************************
 epoch: 0, train_loss: 1.3580, test_loss: 1.2921, test_f1: 0.2494
 epoch: 1, train_loss: 1.0796, test_loss: 1.2142, test_f1: 0.2758
 epoch: 2, train_loss: 1.0016, test_loss: 1.0496, test_f1: 0.4050
 epoch: 3, train_loss: 0.9445, test_loss: 0.9737, test_f1: 0.4838
 epoch: 4, train_loss: 0.9112, test_loss: 0.9251, test_f1: 0.5101
 epoch: 5, train_loss: 0.8762, test_loss: 0.8913, test_f1: 0.5395
 epoch: 6, train_loss: 0.8638, test_loss: 0.8774, test_f1: 0.5724
 epoch: 7, train_loss: 0.8402, test_loss: 0.8717, test_f1: 0.5645
 epoch: 8, train_loss: 0.8285, test_loss: 0.8895, test_f1: 0.5786
 epoch: 9, train_loss: 0.8134, test_loss: 0.8846, test_f1: 0.6011
 epoch: 10, train_loss: 0.7989, test_loss: 0.8749, test_f1: 0.5680
 epoch: 11, train_loss: 0.7823, test_loss: 0.8569, test_f1: 0.6312
 epoch: 12, train_loss: 0.7761, test_loss: 0.9045, test_f1: 0.6026
 epoch: 13, train_loss: 0.7717, test_loss: 0.8580, test_f1: 0.5789
 epoch: 14, train_loss: 0.7623, test_loss: 0.9290, test_f1: 0.6077
 epoch: 15, train_loss: 0.7308, test_loss: 0.9141, test_f1: 0.5904
 epoch: 16, train_loss: 0.7298, test_loss: 0.8950, test_f1: 0.5673
 epoch: 17, train_loss: 0.7245, test_loss: 0.9049, test_f1: 0.6024
 epoch: 18, train_loss: 0.7174, test_loss: 0.9006, test_f1: 0.5896
 epoch: 19, train_loss: 0.7121, test_loss: 0.8688, test_f1: 0.6109
 epoch: 20, train_loss: 0.6975, test_loss: 0.9104, test_f1: 0.5840
 epoch: 21, train_loss: 0.6847, test_loss: 0.9148, test_f1: 0.6164
 epoch: 22, train_loss: 0.6849, test_loss: 1.0195, test_f1: 0.5737
 epoch: 23, train_loss: 0.6767, test_loss: 0.9214, test_f1: 0.6142
 epoch: 24, train_loss: 0.6762, test_loss: 1.0210, test_f1: 0.6091
 epoch: 25, train_loss: 0.6800, test_loss: 0.9279, test_f1: 0.5772
 epoch: 26, train_loss: 0.6778, test_loss: 1.0273, test_f1: 0.5421
 epoch: 27, train_loss: 0.6564, test_loss: 0.9854, test_f1: 0.6167
 epoch: 28, train_loss: 0.6505, test_loss: 0.9458, test_f1: 0.6445
 epoch: 29, train_loss: 0.6347, test_loss: 0.9606, test_f1: 0.6238
 epoch: 30, train_loss: 0.6149, test_loss: 0.9343, test_f1: 0.5921
 epoch: 31, train_loss: 0.6267, test_loss: 0.9731, test_f1: 0.6284
 epoch: 32, train_loss: 0.6217, test_loss: 0.9352, test_f1: 0.6187
 epoch: 33, train_loss: 0.5996, test_loss: 1.0290, test_f1: 0.5800
 epoch: 34, train_loss: 0.5724, test_loss: 0.9808, test_f1: 0.6298
 epoch: 35, train_loss: 0.5793, test_loss: 0.9961, test_f1: 0.6344
 epoch: 36, train_loss: 0.5767, test_loss: 0.9772, test_f1: 0.5976
 epoch: 37, train_loss: 0.5797, test_loss: 1.0359, test_f1: 0.6278
 epoch: 38, train_loss: 0.5565, test_loss: 0.9931, test_f1: 0.6299
 epoch: 39, train_loss: 0.5624, test_loss: 1.0411, test_f1: 0.6162
 epoch: 40, train_loss: 0.5532, test_loss: 1.0091, test_f1: 0.6330
 epoch: 41, train_loss: 0.5476, test_loss: 1.0498, test_f1: 0.6331
 epoch: 42, train_loss: 0.5232, test_loss: 1.0970, test_f1: 0.6122
 epoch: 43, train_loss: 0.5167, test_loss: 0.9809, test_f1: 0.6749
 epoch: 44, train_loss: 0.5076, test_loss: 1.0867, test_f1: 0.6372
 epoch: 45, train_loss: 0.5309, test_loss: 1.1702, test_f1: 0.6178
 epoch: 46, train_loss: 0.5122, test_loss: 1.0408, test_f1: 0.6249
 epoch: 47, train_loss: 0.4872, test_loss: 1.0485, test_f1: 0.6725
 epoch: 48, train_loss: 0.4819, test_loss: 1.1099, test_f1: 0.6431
 epoch: 49, train_loss: 0.4841, test_loss: 1.1593, test_f1: 0.6233
 epoch: 50, train_loss: 0.4715, test_loss: 1.0505, test_f1: 0.6335
 epoch: 51, train_loss: 0.4608, test_loss: 1.0938, test_f1: 0.6425
 epoch: 52, train_loss: 0.4341, test_loss: 1.0635, test_f1: 0.6541
 epoch: 53, train_loss: 0.4352, test_loss: 1.1380, test_f1: 0.6501
 epoch: 54, train_loss: 0.4067, test_loss: 1.1434, test_f1: 0.6425
 epoch: 55, train_loss: 0.4207, test_loss: 1.1532, test_f1: 0.6417
 epoch: 56, train_loss: 0.4161, test_loss: 1.0633, test_f1: 0.6423
 epoch: 57, train_loss: 0.4164, test_loss: 1.1622, test_f1: 0.6532
 epoch: 58, train_loss: 0.4080, test_loss: 1.1609, test_f1: 0.6549
 epoch: 59, train_loss: 0.3994, test_loss: 1.1768, test_f1: 0.6431
 epoch: 60, train_loss: 0.3999, test_loss: 1.1986, test_f1: 0.6447
 epoch: 61, train_loss: 0.3994, test_loss: 1.2469, test_f1: 0.6317
 epoch: 62, train_loss: 0.3876, test_loss: 1.2414, test_f1: 0.6636
 epoch: 63, train_loss: 0.3920, test_loss: 1.1581, test_f1: 0.6427
 epoch: 64, train_loss: 0.3597, test_loss: 1.2010, test_f1: 0.6669
 epoch: 65, train_loss: 0.3703, test_loss: 1.2956, test_f1: 0.6368
 epoch: 66, train_loss: 0.3636, test_loss: 1.2467, test_f1: 0.6552
 epoch: 67, train_loss: 0.3663, test_loss: 1.3021, test_f1: 0.6430
 epoch: 68, train_loss: 0.3412, test_loss: 1.3175, test_f1: 0.6588
 epoch: 69, train_loss: 0.3407, test_loss: 1.2869, test_f1: 0.6584
 epoch: 70, train_loss: 0.3452, test_loss: 1.3311, test_f1: 0.6506
 epoch: 71, train_loss: 0.3539, test_loss: 1.3032, test_f1: 0.6568
 epoch: 72, train_loss: 0.3387, test_loss: 1.3595, test_f1: 0.6544
 epoch: 73, train_loss: 0.3495, test_loss: 1.3549, test_f1: 0.6358
 epoch: 74, train_loss: 0.3505, test_loss: 1.3208, test_f1: 0.6629
 epoch: 75, train_loss: 0.3575, test_loss: 1.3425, test_f1: 0.6327
 epoch: 76, train_loss: 0.3341, test_loss: 1.4781, test_f1: 0.6070
 epoch: 77, train_loss: 0.3335, test_loss: 1.3618, test_f1: 0.6583
 epoch: 78, train_loss: 0.3350, test_loss: 1.3863, test_f1: 0.6506
 epoch: 79, train_loss: 0.3406, test_loss: 1.2593, test_f1: 0.6559
 epoch: 80, train_loss: 0.3350, test_loss: 1.5028, test_f1: 0.6367
 epoch: 81, train_loss: 0.3174, test_loss: 1.3931, test_f1: 0.6505
 epoch: 82, train_loss: 0.3330, test_loss: 1.3896, test_f1: 0.6441
 epoch: 83, train_loss: 0.3192, test_loss: 1.3752, test_f1: 0.6778
 epoch: 84, train_loss: 0.3014, test_loss: 1.3951, test_f1: 0.6583
 epoch: 85, train_loss: 0.3100, test_loss: 1.5317, test_f1: 0.6225
 epoch: 86, train_loss: 0.2992, test_loss: 1.5354, test_f1: 0.6464
 epoch: 87, train_loss: 0.3055, test_loss: 1.4290, test_f1: 0.6560
 epoch: 88, train_loss: 0.2998, test_loss: 1.5738, test_f1: 0.6451
 epoch: 89, train_loss: 0.3134, test_loss: 1.4374, test_f1: 0.6531
 epoch: 90, train_loss: 0.3031, test_loss: 1.4677, test_f1: 0.6647
 epoch: 91, train_loss: 0.3180, test_loss: 1.4513, test_f1: 0.6494
 epoch: 92, train_loss: 0.3011, test_loss: 1.5194, test_f1: 0.6584
 epoch: 93, train_loss: 0.3032, test_loss: 1.4691, test_f1: 0.6506
 epoch: 94, train_loss: 0.2878, test_loss: 1.6824, test_f1: 0.6427
 epoch: 95, train_loss: 0.3003, test_loss: 1.4356, test_f1: 0.6441
 epoch: 96, train_loss: 0.3035, test_loss: 1.5705, test_f1: 0.6499
 epoch: 97, train_loss: 0.2905, test_loss: 1.5953, test_f1: 0.6360
 epoch: 98, train_loss: 0.2970, test_loss: 1.5782, test_f1: 0.6557
 epoch: 99, train_loss: 0.2691, test_loss: 1.4480, test_f1: 0.6662
##################ITERATION #4 ****************************************
 epoch: 0, train_loss: 1.4814, test_loss: 1.3476, test_f1: 0.2270
 epoch: 1, train_loss: 1.1131, test_loss: 1.2839, test_f1: 0.2301
 epoch: 2, train_loss: 1.0382, test_loss: 1.1039, test_f1: 0.4286
 epoch: 3, train_loss: 0.9743, test_loss: 0.9948, test_f1: 0.4361
 epoch: 4, train_loss: 0.9421, test_loss: 1.0060, test_f1: 0.5169
 epoch: 5, train_loss: 0.9065, test_loss: 0.9560, test_f1: 0.5460
 epoch: 6, train_loss: 0.8911, test_loss: 0.9110, test_f1: 0.4956
 epoch: 7, train_loss: 0.8682, test_loss: 0.9460, test_f1: 0.5388
 epoch: 8, train_loss: 0.8727, test_loss: 0.9395, test_f1: 0.5612
 epoch: 9, train_loss: 0.8396, test_loss: 0.9404, test_f1: 0.5216
 epoch: 10, train_loss: 0.8348, test_loss: 0.8748, test_f1: 0.5888
 epoch: 11, train_loss: 0.8181, test_loss: 0.9133, test_f1: 0.5708
 epoch: 12, train_loss: 0.8072, test_loss: 0.9153, test_f1: 0.5408
 epoch: 13, train_loss: 0.7902, test_loss: 0.9249, test_f1: 0.5548
 epoch: 14, train_loss: 0.7651, test_loss: 0.9095, test_f1: 0.6182
 epoch: 15, train_loss: 0.7627, test_loss: 0.9112, test_f1: 0.5726
 epoch: 16, train_loss: 0.7601, test_loss: 0.8745, test_f1: 0.6155
 epoch: 17, train_loss: 0.7400, test_loss: 0.9342, test_f1: 0.5822
 epoch: 18, train_loss: 0.7299, test_loss: 0.8891, test_f1: 0.5662
 epoch: 19, train_loss: 0.7320, test_loss: 0.9764, test_f1: 0.5770
 epoch: 20, train_loss: 0.7210, test_loss: 0.9097, test_f1: 0.6162
 epoch: 21, train_loss: 0.7158, test_loss: 0.9093, test_f1: 0.5994
 epoch: 22, train_loss: 0.7064, test_loss: 0.9301, test_f1: 0.6183
 epoch: 23, train_loss: 0.6851, test_loss: 0.9422, test_f1: 0.6117
 epoch: 24, train_loss: 0.6691, test_loss: 0.9742, test_f1: 0.6020
 epoch: 25, train_loss: 0.6791, test_loss: 0.9314, test_f1: 0.6279
 epoch: 26, train_loss: 0.6676, test_loss: 0.8953, test_f1: 0.6051
 epoch: 27, train_loss: 0.6576, test_loss: 0.9201, test_f1: 0.6183
 epoch: 28, train_loss: 0.6605, test_loss: 0.9568, test_f1: 0.6444
 epoch: 29, train_loss: 0.6376, test_loss: 0.8775, test_f1: 0.6174
 epoch: 30, train_loss: 0.6441, test_loss: 0.9253, test_f1: 0.6442
 epoch: 31, train_loss: 0.6311, test_loss: 0.8695, test_f1: 0.6485
 epoch: 32, train_loss: 0.6172, test_loss: 0.9552, test_f1: 0.6476
 epoch: 33, train_loss: 0.6210, test_loss: 0.9228, test_f1: 0.6589
 epoch: 34, train_loss: 0.5958, test_loss: 0.9782, test_f1: 0.6379
 epoch: 35, train_loss: 0.5962, test_loss: 0.9799, test_f1: 0.6573
 epoch: 36, train_loss: 0.5892, test_loss: 0.9926, test_f1: 0.6454
 epoch: 37, train_loss: 0.5934, test_loss: 1.0538, test_f1: 0.6004
 epoch: 38, train_loss: 0.5741, test_loss: 0.9806, test_f1: 0.6055
 epoch: 39, train_loss: 0.5677, test_loss: 1.0056, test_f1: 0.6161
 epoch: 40, train_loss: 0.5576, test_loss: 1.0361, test_f1: 0.6344
 epoch: 41, train_loss: 0.5637, test_loss: 0.9961, test_f1: 0.6572
 epoch: 42, train_loss: 0.5652, test_loss: 1.0957, test_f1: 0.6047
 epoch: 43, train_loss: 0.5498, test_loss: 0.9160, test_f1: 0.6742
 epoch: 44, train_loss: 0.5433, test_loss: 1.0965, test_f1: 0.6318
 epoch: 45, train_loss: 0.5297, test_loss: 1.0729, test_f1: 0.6532
 epoch: 46, train_loss: 0.5263, test_loss: 1.0007, test_f1: 0.6726
 epoch: 47, train_loss: 0.5149, test_loss: 1.0264, test_f1: 0.6415
 epoch: 48, train_loss: 0.5167, test_loss: 1.0911, test_f1: 0.6417
 epoch: 49, train_loss: 0.5021, test_loss: 0.9986, test_f1: 0.6289
 epoch: 50, train_loss: 0.4911, test_loss: 1.0700, test_f1: 0.6592
 epoch: 51, train_loss: 0.4671, test_loss: 1.0155, test_f1: 0.6841
 epoch: 52, train_loss: 0.4476, test_loss: 1.1109, test_f1: 0.6676
 epoch: 53, train_loss: 0.4446, test_loss: 1.1240, test_f1: 0.6423
 epoch: 54, train_loss: 0.4260, test_loss: 1.1219, test_f1: 0.6503
 epoch: 55, train_loss: 0.4212, test_loss: 1.1955, test_f1: 0.6764
 epoch: 56, train_loss: 0.4209, test_loss: 1.2000, test_f1: 0.6678
 epoch: 57, train_loss: 0.4228, test_loss: 1.1850, test_f1: 0.6633
 epoch: 58, train_loss: 0.4077, test_loss: 1.2247, test_f1: 0.6374
 epoch: 59, train_loss: 0.3984, test_loss: 1.2025, test_f1: 0.6385
 epoch: 60, train_loss: 0.4131, test_loss: 1.2597, test_f1: 0.6451
 epoch: 61, train_loss: 0.4057, test_loss: 1.2838, test_f1: 0.6529
 epoch: 62, train_loss: 0.4022, test_loss: 1.1803, test_f1: 0.6717
 epoch: 63, train_loss: 0.3862, test_loss: 1.3116, test_f1: 0.6570
 epoch: 64, train_loss: 0.3911, test_loss: 1.3452, test_f1: 0.6606
 epoch: 65, train_loss: 0.3890, test_loss: 1.2151, test_f1: 0.6671
 epoch: 66, train_loss: 0.3807, test_loss: 1.2272, test_f1: 0.6925
 epoch: 67, train_loss: 0.3824, test_loss: 1.2452, test_f1: 0.6456
 epoch: 68, train_loss: 0.3664, test_loss: 1.3054, test_f1: 0.6751
 epoch: 69, train_loss: 0.3681, test_loss: 1.3038, test_f1: 0.6441
 epoch: 70, train_loss: 0.3630, test_loss: 1.2847, test_f1: 0.6836
 epoch: 71, train_loss: 0.3705, test_loss: 1.3300, test_f1: 0.6562
 epoch: 72, train_loss: 0.3581, test_loss: 1.2359, test_f1: 0.6656
 epoch: 73, train_loss: 0.3747, test_loss: 1.3193, test_f1: 0.6690
 epoch: 74, train_loss: 0.3551, test_loss: 1.2838, test_f1: 0.6544
 epoch: 75, train_loss: 0.3732, test_loss: 1.3832, test_f1: 0.6438
 epoch: 76, train_loss: 0.3582, test_loss: 1.3435, test_f1: 0.6624
 epoch: 77, train_loss: 0.3484, test_loss: 1.3270, test_f1: 0.6719
 epoch: 78, train_loss: 0.3475, test_loss: 1.4163, test_f1: 0.6584
 epoch: 79, train_loss: 0.3389, test_loss: 1.3783, test_f1: 0.6840
 epoch: 80, train_loss: 0.3334, test_loss: 1.5016, test_f1: 0.6536
 epoch: 81, train_loss: 0.3408, test_loss: 1.3592, test_f1: 0.6697
 epoch: 82, train_loss: 0.3360, test_loss: 1.4328, test_f1: 0.6454
 epoch: 83, train_loss: 0.3363, test_loss: 1.4870, test_f1: 0.6527
 epoch: 84, train_loss: 0.3450, test_loss: 1.4769, test_f1: 0.6329
 epoch: 85, train_loss: 0.3343, test_loss: 1.4202, test_f1: 0.6741
 epoch: 86, train_loss: 0.3047, test_loss: 1.4446, test_f1: 0.6430
 epoch: 87, train_loss: 0.3192, test_loss: 1.4458, test_f1: 0.6757
 epoch: 88, train_loss: 0.3178, test_loss: 1.4523, test_f1: 0.6674
 epoch: 89, train_loss: 0.3164, test_loss: 1.4537, test_f1: 0.6777
 epoch: 90, train_loss: 0.3008, test_loss: 1.4928, test_f1: 0.6681
 epoch: 91, train_loss: 0.3037, test_loss: 1.4952, test_f1: 0.6476
 epoch: 92, train_loss: 0.2955, test_loss: 1.5464, test_f1: 0.6583
 epoch: 93, train_loss: 0.2858, test_loss: 1.5219, test_f1: 0.6592
 epoch: 94, train_loss: 0.2973, test_loss: 1.5646, test_f1: 0.6395
 epoch: 95, train_loss: 0.2909, test_loss: 1.5680, test_f1: 0.6513
 epoch: 96, train_loss: 0.2885, test_loss: 1.5261, test_f1: 0.6544
 epoch: 97, train_loss: 0.3049, test_loss: 1.7170, test_f1: 0.6483
 epoch: 98, train_loss: 0.3130, test_loss: 1.6364, test_f1: 0.6519
 epoch: 99, train_loss: 0.2997, test_loss: 1.5769, test_f1: 0.6577
##################ITERATION #5 ****************************************
 epoch: 0, train_loss: 1.8128, test_loss: 1.4541, test_f1: 0.2319
 epoch: 1, train_loss: 1.1341, test_loss: 1.3086, test_f1: 0.2936
 epoch: 2, train_loss: 1.0169, test_loss: 1.0879, test_f1: 0.3880
 epoch: 3, train_loss: 0.9678, test_loss: 1.0130, test_f1: 0.4608
 epoch: 4, train_loss: 0.9374, test_loss: 0.9462, test_f1: 0.4868
 epoch: 5, train_loss: 0.9191, test_loss: 0.9439, test_f1: 0.4963
 epoch: 6, train_loss: 0.8948, test_loss: 0.9448, test_f1: 0.5049
 epoch: 7, train_loss: 0.8681, test_loss: 0.9066, test_f1: 0.5323
 epoch: 8, train_loss: 0.8555, test_loss: 0.9162, test_f1: 0.5506
 epoch: 9, train_loss: 0.8407, test_loss: 0.9030, test_f1: 0.5214
 epoch: 10, train_loss: 0.8343, test_loss: 0.9002, test_f1: 0.5481
 epoch: 11, train_loss: 0.8209, test_loss: 0.9239, test_f1: 0.5312
 epoch: 12, train_loss: 0.7957, test_loss: 0.9120, test_f1: 0.5107
 epoch: 13, train_loss: 0.7811, test_loss: 0.8810, test_f1: 0.5660
 epoch: 14, train_loss: 0.7786, test_loss: 0.8804, test_f1: 0.5902
 epoch: 15, train_loss: 0.7731, test_loss: 0.8401, test_f1: 0.5741
 epoch: 16, train_loss: 0.7505, test_loss: 0.9253, test_f1: 0.5293
 epoch: 17, train_loss: 0.7416, test_loss: 0.8607, test_f1: 0.5980
 epoch: 18, train_loss: 0.7404, test_loss: 0.9437, test_f1: 0.5329
 epoch: 19, train_loss: 0.7272, test_loss: 0.9094, test_f1: 0.5572
 epoch: 20, train_loss: 0.7166, test_loss: 0.9033, test_f1: 0.5697
 epoch: 21, train_loss: 0.7153, test_loss: 0.9033, test_f1: 0.6157
 epoch: 22, train_loss: 0.7124, test_loss: 0.9000, test_f1: 0.5919
 epoch: 23, train_loss: 0.7068, test_loss: 0.9361, test_f1: 0.5913
 epoch: 24, train_loss: 0.6822, test_loss: 0.8649, test_f1: 0.6380
 epoch: 25, train_loss: 0.6672, test_loss: 0.8810, test_f1: 0.6096
 epoch: 26, train_loss: 0.6697, test_loss: 0.8894, test_f1: 0.5944
 epoch: 27, train_loss: 0.6764, test_loss: 0.9021, test_f1: 0.6089
 epoch: 28, train_loss: 0.6695, test_loss: 0.9019, test_f1: 0.5928
 epoch: 29, train_loss: 0.6509, test_loss: 0.8539, test_f1: 0.6532
 epoch: 30, train_loss: 0.6310, test_loss: 0.9654, test_f1: 0.6043
 epoch: 31, train_loss: 0.6484, test_loss: 0.9620, test_f1: 0.6466
 epoch: 32, train_loss: 0.6264, test_loss: 0.9244, test_f1: 0.6346
 epoch: 33, train_loss: 0.6049, test_loss: 0.9117, test_f1: 0.6350
 epoch: 34, train_loss: 0.5983, test_loss: 0.9164, test_f1: 0.6432
 epoch: 35, train_loss: 0.6093, test_loss: 1.0055, test_f1: 0.5745
 epoch: 36, train_loss: 0.6064, test_loss: 0.9314, test_f1: 0.6212
 epoch: 37, train_loss: 0.6007, test_loss: 0.9300, test_f1: 0.6667
 epoch: 38, train_loss: 0.5658, test_loss: 0.8937, test_f1: 0.6635
 epoch: 39, train_loss: 0.5768, test_loss: 0.9588, test_f1: 0.6412
 epoch: 40, train_loss: 0.5647, test_loss: 0.9790, test_f1: 0.6283
 epoch: 41, train_loss: 0.5591, test_loss: 0.9542, test_f1: 0.6276
 epoch: 42, train_loss: 0.5624, test_loss: 0.9291, test_f1: 0.6561
 epoch: 43, train_loss: 0.5613, test_loss: 0.9125, test_f1: 0.6460
 epoch: 44, train_loss: 0.5517, test_loss: 0.9021, test_f1: 0.6308
 epoch: 45, train_loss: 0.5275, test_loss: 0.9877, test_f1: 0.6497
 epoch: 46, train_loss: 0.5195, test_loss: 0.9300, test_f1: 0.6994
 epoch: 47, train_loss: 0.5174, test_loss: 0.9388, test_f1: 0.6629
 epoch: 48, train_loss: 0.5187, test_loss: 1.0372, test_f1: 0.6361
 epoch: 49, train_loss: 0.5055, test_loss: 0.9800, test_f1: 0.6558
 epoch: 50, train_loss: 0.5032, test_loss: 0.9948, test_f1: 0.6518
 epoch: 51, train_loss: 0.4802, test_loss: 0.9928, test_f1: 0.6562
 epoch: 52, train_loss: 0.4670, test_loss: 0.9887, test_f1: 0.6665
 epoch: 53, train_loss: 0.4476, test_loss: 1.0539, test_f1: 0.6458
 epoch: 54, train_loss: 0.4505, test_loss: 0.9601, test_f1: 0.7001
 epoch: 55, train_loss: 0.4391, test_loss: 1.0287, test_f1: 0.6567
 epoch: 56, train_loss: 0.4524, test_loss: 1.0121, test_f1: 0.6450
 epoch: 57, train_loss: 0.4385, test_loss: 0.9866, test_f1: 0.6772
 epoch: 58, train_loss: 0.4206, test_loss: 1.0560, test_f1: 0.6557
 epoch: 59, train_loss: 0.4362, test_loss: 1.0410, test_f1: 0.6635
 epoch: 60, train_loss: 0.4097, test_loss: 1.0265, test_f1: 0.6685
 epoch: 61, train_loss: 0.4112, test_loss: 1.0454, test_f1: 0.6643
 epoch: 62, train_loss: 0.4357, test_loss: 1.0732, test_f1: 0.6318
 epoch: 63, train_loss: 0.4134, test_loss: 1.0671, test_f1: 0.6611
 epoch: 64, train_loss: 0.4005, test_loss: 1.0331, test_f1: 0.6730
 epoch: 65, train_loss: 0.3987, test_loss: 1.0403, test_f1: 0.6666
 epoch: 66, train_loss: 0.3795, test_loss: 1.0479, test_f1: 0.6604
 epoch: 67, train_loss: 0.3889, test_loss: 1.0346, test_f1: 0.6745
 epoch: 68, train_loss: 0.3934, test_loss: 1.0770, test_f1: 0.6619
 epoch: 69, train_loss: 0.3792, test_loss: 1.0654, test_f1: 0.6824
 epoch: 70, train_loss: 0.3946, test_loss: 1.1710, test_f1: 0.6386
 epoch: 71, train_loss: 0.3850, test_loss: 1.1125, test_f1: 0.6872
 epoch: 72, train_loss: 0.3821, test_loss: 1.1905, test_f1: 0.6278
 epoch: 73, train_loss: 0.3800, test_loss: 1.1329, test_f1: 0.6728
 epoch: 74, train_loss: 0.3736, test_loss: 1.1146, test_f1: 0.6892
 epoch: 75, train_loss: 0.3733, test_loss: 1.1683, test_f1: 0.6693
 epoch: 76, train_loss: 0.3735, test_loss: 1.1507, test_f1: 0.6653
 epoch: 77, train_loss: 0.3849, test_loss: 1.1226, test_f1: 0.6573
 epoch: 78, train_loss: 0.3829, test_loss: 1.3194, test_f1: 0.6417
 epoch: 79, train_loss: 0.3567, test_loss: 1.2815, test_f1: 0.6315
 epoch: 80, train_loss: 0.3621, test_loss: 1.2076, test_f1: 0.6605
 epoch: 81, train_loss: 0.3869, test_loss: 1.1689, test_f1: 0.6656
 epoch: 82, train_loss: 0.3610, test_loss: 1.1508, test_f1: 0.6628
 epoch: 83, train_loss: 0.3508, test_loss: 1.1106, test_f1: 0.6731
 epoch: 84, train_loss: 0.3492, test_loss: 1.2384, test_f1: 0.6605
 epoch: 85, train_loss: 0.3484, test_loss: 1.2398, test_f1: 0.6511
 epoch: 86, train_loss: 0.3365, test_loss: 1.3903, test_f1: 0.6330
 epoch: 87, train_loss: 0.3528, test_loss: 1.2287, test_f1: 0.6763
 epoch: 88, train_loss: 0.3512, test_loss: 1.1873, test_f1: 0.6728
 epoch: 89, train_loss: 0.3450, test_loss: 1.2509, test_f1: 0.6723
 epoch: 90, train_loss: 0.3394, test_loss: 1.1956, test_f1: 0.6445
 epoch: 91, train_loss: 0.3325, test_loss: 1.3340, test_f1: 0.6672
 epoch: 92, train_loss: 0.3255, test_loss: 1.2524, test_f1: 0.6729
 epoch: 93, train_loss: 0.3115, test_loss: 1.3948, test_f1: 0.6500
 epoch: 94, train_loss: 0.3197, test_loss: 1.3207, test_f1: 0.6795
 epoch: 95, train_loss: 0.3160, test_loss: 1.2088, test_f1: 0.6573
 epoch: 96, train_loss: 0.3031, test_loss: 1.3296, test_f1: 0.6801
 epoch: 97, train_loss: 0.2908, test_loss: 1.3384, test_f1: 0.6469
 epoch: 98, train_loss: 0.3104, test_loss: 1.2829, test_f1: 0.6473
 epoch: 99, train_loss: 0.3011, test_loss: 1.2205, test_f1: 0.6678
##################ITERATION #6 ****************************************
 epoch: 0, train_loss: 1.7474, test_loss: 1.2461, test_f1: 0.2736
 epoch: 1, train_loss: 1.1243, test_loss: 1.1016, test_f1: 0.4797
 epoch: 2, train_loss: 1.0204, test_loss: 1.0115, test_f1: 0.4223
 epoch: 3, train_loss: 0.9670, test_loss: 1.0317, test_f1: 0.4105
 epoch: 4, train_loss: 0.9445, test_loss: 0.9584, test_f1: 0.4655
 epoch: 5, train_loss: 0.9171, test_loss: 0.9325, test_f1: 0.5105
 epoch: 6, train_loss: 0.8915, test_loss: 0.8912, test_f1: 0.5319
 epoch: 7, train_loss: 0.8777, test_loss: 0.8926, test_f1: 0.5417
 epoch: 8, train_loss: 0.8631, test_loss: 0.9447, test_f1: 0.5298
 epoch: 9, train_loss: 0.8493, test_loss: 0.9209, test_f1: 0.5637
 epoch: 10, train_loss: 0.8220, test_loss: 0.9217, test_f1: 0.5510
 epoch: 11, train_loss: 0.8190, test_loss: 1.0003, test_f1: 0.5365
 epoch: 12, train_loss: 0.8170, test_loss: 0.9078, test_f1: 0.5889
 epoch: 13, train_loss: 0.7946, test_loss: 0.9343, test_f1: 0.5617
 epoch: 14, train_loss: 0.7799, test_loss: 0.9709, test_f1: 0.5466
 epoch: 15, train_loss: 0.7688, test_loss: 0.9167, test_f1: 0.5677
 epoch: 16, train_loss: 0.7708, test_loss: 0.8782, test_f1: 0.5805
 epoch: 17, train_loss: 0.7635, test_loss: 0.9681, test_f1: 0.5526
 epoch: 18, train_loss: 0.7406, test_loss: 0.9555, test_f1: 0.5897
 epoch: 19, train_loss: 0.7267, test_loss: 0.9614, test_f1: 0.5299
 epoch: 20, train_loss: 0.7284, test_loss: 0.9914, test_f1: 0.5937
 epoch: 21, train_loss: 0.7069, test_loss: 1.0087, test_f1: 0.5757
 epoch: 22, train_loss: 0.7142, test_loss: 0.9360, test_f1: 0.5555
 epoch: 23, train_loss: 0.6970, test_loss: 0.9879, test_f1: 0.5671
 epoch: 24, train_loss: 0.6810, test_loss: 0.9225, test_f1: 0.6072
 epoch: 25, train_loss: 0.6832, test_loss: 0.9517, test_f1: 0.5846
 epoch: 26, train_loss: 0.6700, test_loss: 1.0360, test_f1: 0.5809
 epoch: 27, train_loss: 0.6793, test_loss: 0.9907, test_f1: 0.6349
 epoch: 28, train_loss: 0.6624, test_loss: 0.9178, test_f1: 0.5779
 epoch: 29, train_loss: 0.6606, test_loss: 1.0368, test_f1: 0.5427
 epoch: 30, train_loss: 0.6663, test_loss: 1.0153, test_f1: 0.5696
 epoch: 31, train_loss: 0.6403, test_loss: 0.9599, test_f1: 0.6010
 epoch: 32, train_loss: 0.6325, test_loss: 0.9859, test_f1: 0.5986
 epoch: 33, train_loss: 0.6144, test_loss: 0.9771, test_f1: 0.6246
 epoch: 34, train_loss: 0.6310, test_loss: 1.0606, test_f1: 0.5493
 epoch: 35, train_loss: 0.6220, test_loss: 1.0244, test_f1: 0.5937
 epoch: 36, train_loss: 0.6055, test_loss: 0.9994, test_f1: 0.5794
 epoch: 37, train_loss: 0.6012, test_loss: 1.1085, test_f1: 0.5754
 epoch: 38, train_loss: 0.6042, test_loss: 0.9800, test_f1: 0.5976
 epoch: 39, train_loss: 0.5889, test_loss: 1.0020, test_f1: 0.6397
 epoch: 40, train_loss: 0.5836, test_loss: 1.0011, test_f1: 0.5889
 epoch: 41, train_loss: 0.5893, test_loss: 1.1151, test_f1: 0.5789
 epoch: 42, train_loss: 0.5604, test_loss: 1.0806, test_f1: 0.6431
 epoch: 43, train_loss: 0.5582, test_loss: 1.0477, test_f1: 0.6360
 epoch: 44, train_loss: 0.5592, test_loss: 1.0943, test_f1: 0.6152
 epoch: 45, train_loss: 0.5407, test_loss: 1.1063, test_f1: 0.6160
 epoch: 46, train_loss: 0.5427, test_loss: 1.0649, test_f1: 0.5967
 epoch: 47, train_loss: 0.5390, test_loss: 1.1318, test_f1: 0.6510
 epoch: 48, train_loss: 0.5221, test_loss: 1.1879, test_f1: 0.5859
 epoch: 49, train_loss: 0.5194, test_loss: 1.0988, test_f1: 0.6123
 epoch: 50, train_loss: 0.5172, test_loss: 1.1519, test_f1: 0.6016
 epoch: 51, train_loss: 0.5032, test_loss: 1.0971, test_f1: 0.6585
 epoch: 52, train_loss: 0.4652, test_loss: 1.1140, test_f1: 0.6409
 epoch: 53, train_loss: 0.4601, test_loss: 1.0956, test_f1: 0.6471
 epoch: 54, train_loss: 0.4476, test_loss: 1.1743, test_f1: 0.6352
 epoch: 55, train_loss: 0.4548, test_loss: 1.1205, test_f1: 0.6359
 epoch: 56, train_loss: 0.4386, test_loss: 1.1834, test_f1: 0.6353
 epoch: 57, train_loss: 0.4256, test_loss: 1.1578, test_f1: 0.6377
 epoch: 58, train_loss: 0.4222, test_loss: 1.1963, test_f1: 0.6341
 epoch: 59, train_loss: 0.4241, test_loss: 1.2327, test_f1: 0.6596
 epoch: 60, train_loss: 0.4195, test_loss: 1.2204, test_f1: 0.6330
 epoch: 61, train_loss: 0.4090, test_loss: 1.2909, test_f1: 0.6402
 epoch: 62, train_loss: 0.4286, test_loss: 1.1779, test_f1: 0.6235
 epoch: 63, train_loss: 0.3978, test_loss: 1.2051, test_f1: 0.6421
 epoch: 64, train_loss: 0.3960, test_loss: 1.3071, test_f1: 0.6289
 epoch: 65, train_loss: 0.3979, test_loss: 1.2204, test_f1: 0.6570
 epoch: 66, train_loss: 0.3934, test_loss: 1.2978, test_f1: 0.6525
 epoch: 67, train_loss: 0.3792, test_loss: 1.2870, test_f1: 0.6334
 epoch: 68, train_loss: 0.3806, test_loss: 1.3005, test_f1: 0.6066
 epoch: 69, train_loss: 0.3789, test_loss: 1.2611, test_f1: 0.6473
 epoch: 70, train_loss: 0.3735, test_loss: 1.2798, test_f1: 0.6550
 epoch: 71, train_loss: 0.3851, test_loss: 1.3612, test_f1: 0.6508
 epoch: 72, train_loss: 0.3721, test_loss: 1.2644, test_f1: 0.6594
 epoch: 73, train_loss: 0.3784, test_loss: 1.3348, test_f1: 0.6403
 epoch: 74, train_loss: 0.3708, test_loss: 1.3145, test_f1: 0.6575
 epoch: 75, train_loss: 0.3614, test_loss: 1.2784, test_f1: 0.6648
 epoch: 76, train_loss: 0.3570, test_loss: 1.3798, test_f1: 0.6512
 epoch: 77, train_loss: 0.3628, test_loss: 1.3749, test_f1: 0.6694
 epoch: 78, train_loss: 0.3550, test_loss: 1.3307, test_f1: 0.6610
 epoch: 79, train_loss: 0.3529, test_loss: 1.3444, test_f1: 0.6438
 epoch: 80, train_loss: 0.3641, test_loss: 1.3545, test_f1: 0.6435
 epoch: 81, train_loss: 0.3457, test_loss: 1.4110, test_f1: 0.6390
 epoch: 82, train_loss: 0.3460, test_loss: 1.2991, test_f1: 0.6720
 epoch: 83, train_loss: 0.3484, test_loss: 1.4840, test_f1: 0.6144
 epoch: 84, train_loss: 0.3447, test_loss: 1.3928, test_f1: 0.6267
 epoch: 85, train_loss: 0.3236, test_loss: 1.4055, test_f1: 0.6496
 epoch: 86, train_loss: 0.3562, test_loss: 1.4686, test_f1: 0.6529
 epoch: 87, train_loss: 0.3401, test_loss: 1.5210, test_f1: 0.6332
 epoch: 88, train_loss: 0.3240, test_loss: 1.4406, test_f1: 0.6554
 epoch: 89, train_loss: 0.3306, test_loss: 1.3922, test_f1: 0.6383
 epoch: 90, train_loss: 0.3421, test_loss: 1.3974, test_f1: 0.6514
 epoch: 91, train_loss: 0.3230, test_loss: 1.4381, test_f1: 0.6565
 epoch: 92, train_loss: 0.3208, test_loss: 1.4658, test_f1: 0.6455
 epoch: 93, train_loss: 0.3195, test_loss: 1.4936, test_f1: 0.6514
 epoch: 94, train_loss: 0.3079, test_loss: 1.4874, test_f1: 0.6350
 epoch: 95, train_loss: 0.3057, test_loss: 1.5657, test_f1: 0.6407
 epoch: 96, train_loss: 0.2892, test_loss: 1.5682, test_f1: 0.6427
 epoch: 97, train_loss: 0.3045, test_loss: 1.4975, test_f1: 0.6570
 epoch: 98, train_loss: 0.3106, test_loss: 1.5027, test_f1: 0.6390
 epoch: 99, train_loss: 0.2964, test_loss: 1.4680, test_f1: 0.6415
##################ITERATION #7 ****************************************
 epoch: 0, train_loss: 1.6284, test_loss: 1.4398, test_f1: 0.2417
 epoch: 1, train_loss: 1.1211, test_loss: 1.2053, test_f1: 0.3524
 epoch: 2, train_loss: 0.9926, test_loss: 1.0089, test_f1: 0.4493
 epoch: 3, train_loss: 0.9699, test_loss: 0.9589, test_f1: 0.4479
 epoch: 4, train_loss: 0.9392, test_loss: 0.9095, test_f1: 0.5056
 epoch: 5, train_loss: 0.9010, test_loss: 0.9056, test_f1: 0.5070
 epoch: 6, train_loss: 0.8866, test_loss: 0.9059, test_f1: 0.5297
 epoch: 7, train_loss: 0.8799, test_loss: 0.9347, test_f1: 0.5439
 epoch: 8, train_loss: 0.8709, test_loss: 0.8906, test_f1: 0.5562
 epoch: 9, train_loss: 0.8423, test_loss: 0.8939, test_f1: 0.5547
 epoch: 10, train_loss: 0.8294, test_loss: 0.9144, test_f1: 0.5509
 epoch: 11, train_loss: 0.8249, test_loss: 0.9542, test_f1: 0.5243
 epoch: 12, train_loss: 0.8222, test_loss: 0.9129, test_f1: 0.5519
 epoch: 13, train_loss: 0.8125, test_loss: 0.8756, test_f1: 0.5609
 epoch: 14, train_loss: 0.7888, test_loss: 0.9205, test_f1: 0.5602
 epoch: 15, train_loss: 0.7877, test_loss: 0.8922, test_f1: 0.5698
 epoch: 16, train_loss: 0.7814, test_loss: 0.8974, test_f1: 0.5717
 epoch: 17, train_loss: 0.7643, test_loss: 0.9154, test_f1: 0.5696
 epoch: 18, train_loss: 0.7687, test_loss: 0.9325, test_f1: 0.5801
 epoch: 19, train_loss: 0.7613, test_loss: 0.9264, test_f1: 0.5402
 epoch: 20, train_loss: 0.7609, test_loss: 0.8948, test_f1: 0.5914
 epoch: 21, train_loss: 0.7417, test_loss: 0.9313, test_f1: 0.5636
 epoch: 22, train_loss: 0.7380, test_loss: 0.9409, test_f1: 0.5750
 epoch: 23, train_loss: 0.7206, test_loss: 0.9333, test_f1: 0.5767
 epoch: 24, train_loss: 0.6960, test_loss: 0.9435, test_f1: 0.5928
 epoch: 25, train_loss: 0.6835, test_loss: 0.9482, test_f1: 0.5510
 epoch: 26, train_loss: 0.6959, test_loss: 1.0097, test_f1: 0.5593
 epoch: 27, train_loss: 0.6959, test_loss: 0.9009, test_f1: 0.5972
 epoch: 28, train_loss: 0.6660, test_loss: 0.9781, test_f1: 0.5572
 epoch: 29, train_loss: 0.6744, test_loss: 0.9154, test_f1: 0.6164
 epoch: 30, train_loss: 0.6694, test_loss: 1.0277, test_f1: 0.5860
 epoch: 31, train_loss: 0.6662, test_loss: 0.9656, test_f1: 0.6039
 epoch: 32, train_loss: 0.6654, test_loss: 0.9823, test_f1: 0.5970
 epoch: 33, train_loss: 0.6535, test_loss: 0.9585, test_f1: 0.5896
 epoch: 34, train_loss: 0.6330, test_loss: 0.9742, test_f1: 0.6232
 epoch: 35, train_loss: 0.6111, test_loss: 0.9651, test_f1: 0.5830
 epoch: 36, train_loss: 0.6151, test_loss: 0.9433, test_f1: 0.6208
 epoch: 37, train_loss: 0.6197, test_loss: 1.0586, test_f1: 0.5897
 epoch: 38, train_loss: 0.5997, test_loss: 1.0094, test_f1: 0.6083
 epoch: 39, train_loss: 0.6084, test_loss: 1.0438, test_f1: 0.5962
 epoch: 40, train_loss: 0.6046, test_loss: 1.1489, test_f1: 0.5789
 epoch: 41, train_loss: 0.5927, test_loss: 1.0259, test_f1: 0.6051
 epoch: 42, train_loss: 0.5967, test_loss: 1.0064, test_f1: 0.5887
 epoch: 43, train_loss: 0.6006, test_loss: 0.9643, test_f1: 0.6212
 epoch: 44, train_loss: 0.5857, test_loss: 1.0428, test_f1: 0.5688
 epoch: 45, train_loss: 0.5675, test_loss: 1.0117, test_f1: 0.6060
 epoch: 46, train_loss: 0.5517, test_loss: 1.0329, test_f1: 0.6089
 epoch: 47, train_loss: 0.5456, test_loss: 1.1687, test_f1: 0.5908
 epoch: 48, train_loss: 0.5394, test_loss: 1.0830, test_f1: 0.6027
 epoch: 49, train_loss: 0.5434, test_loss: 1.1866, test_f1: 0.5867
 epoch: 50, train_loss: 0.5409, test_loss: 1.0759, test_f1: 0.6067
 epoch: 51, train_loss: 0.5187, test_loss: 1.0432, test_f1: 0.6308
 epoch: 52, train_loss: 0.4885, test_loss: 1.0606, test_f1: 0.5942
 epoch: 53, train_loss: 0.4747, test_loss: 1.0917, test_f1: 0.6273
 epoch: 54, train_loss: 0.4608, test_loss: 1.1228, test_f1: 0.6230
 epoch: 55, train_loss: 0.4707, test_loss: 1.0734, test_f1: 0.6250
 epoch: 56, train_loss: 0.4756, test_loss: 1.1741, test_f1: 0.6194
 epoch: 57, train_loss: 0.4688, test_loss: 1.1352, test_f1: 0.6126
 epoch: 58, train_loss: 0.4535, test_loss: 1.1377, test_f1: 0.6289
 epoch: 59, train_loss: 0.4556, test_loss: 1.1945, test_f1: 0.6334
 epoch: 60, train_loss: 0.4469, test_loss: 1.2214, test_f1: 0.6320
 epoch: 61, train_loss: 0.4579, test_loss: 1.1512, test_f1: 0.6495
 epoch: 62, train_loss: 0.4672, test_loss: 1.1262, test_f1: 0.6114
 epoch: 63, train_loss: 0.4170, test_loss: 1.2306, test_f1: 0.6138
 epoch: 64, train_loss: 0.4300, test_loss: 1.1654, test_f1: 0.6403
 epoch: 65, train_loss: 0.4430, test_loss: 1.2007, test_f1: 0.6019
 epoch: 66, train_loss: 0.4223, test_loss: 1.1594, test_f1: 0.6269
 epoch: 67, train_loss: 0.4244, test_loss: 1.1757, test_f1: 0.6441
 epoch: 68, train_loss: 0.4172, test_loss: 1.3340, test_f1: 0.6166
 epoch: 69, train_loss: 0.4126, test_loss: 1.2810, test_f1: 0.6229
 epoch: 70, train_loss: 0.4157, test_loss: 1.3188, test_f1: 0.6194
 epoch: 71, train_loss: 0.4110, test_loss: 1.1878, test_f1: 0.6286
 epoch: 72, train_loss: 0.4081, test_loss: 1.2031, test_f1: 0.6002
 epoch: 73, train_loss: 0.3874, test_loss: 1.2639, test_f1: 0.6389
 epoch: 74, train_loss: 0.4018, test_loss: 1.2286, test_f1: 0.6372
 epoch: 75, train_loss: 0.3851, test_loss: 1.3342, test_f1: 0.6170
 epoch: 76, train_loss: 0.4007, test_loss: 1.2796, test_f1: 0.6206
 epoch: 77, train_loss: 0.3843, test_loss: 1.3210, test_f1: 0.6361
 epoch: 78, train_loss: 0.3822, test_loss: 1.1858, test_f1: 0.6444
 epoch: 79, train_loss: 0.3834, test_loss: 1.2209, test_f1: 0.6353
 epoch: 80, train_loss: 0.3837, test_loss: 1.2626, test_f1: 0.6147
 epoch: 81, train_loss: 0.3630, test_loss: 1.2817, test_f1: 0.6160
 epoch: 82, train_loss: 0.3667, test_loss: 1.3747, test_f1: 0.6176
 epoch: 83, train_loss: 0.3671, test_loss: 1.2716, test_f1: 0.6339
 epoch: 84, train_loss: 0.3632, test_loss: 1.3966, test_f1: 0.6408
 epoch: 85, train_loss: 0.3749, test_loss: 1.3608, test_f1: 0.6345
 epoch: 86, train_loss: 0.3678, test_loss: 1.3073, test_f1: 0.6449
 epoch: 87, train_loss: 0.3584, test_loss: 1.3125, test_f1: 0.6297
 epoch: 88, train_loss: 0.3651, test_loss: 1.4308, test_f1: 0.6339
 epoch: 89, train_loss: 0.3537, test_loss: 1.4086, test_f1: 0.6271
 epoch: 90, train_loss: 0.3642, test_loss: 1.3098, test_f1: 0.6341
 epoch: 91, train_loss: 0.3534, test_loss: 1.4319, test_f1: 0.6456
 epoch: 92, train_loss: 0.3502, test_loss: 1.4696, test_f1: 0.6277
 epoch: 93, train_loss: 0.3651, test_loss: 1.4476, test_f1: 0.6262
 epoch: 94, train_loss: 0.3474, test_loss: 1.3771, test_f1: 0.6268
 epoch: 95, train_loss: 0.3473, test_loss: 1.4371, test_f1: 0.6475
 epoch: 96, train_loss: 0.3495, test_loss: 1.4283, test_f1: 0.6420
 epoch: 97, train_loss: 0.3419, test_loss: 1.3878, test_f1: 0.6315
 epoch: 98, train_loss: 0.3448, test_loss: 1.5699, test_f1: 0.6240
 epoch: 99, train_loss: 0.3350, test_loss: 1.4152, test_f1: 0.6201
##################ITERATION #8 ****************************************
 epoch: 0, train_loss: 2.0118, test_loss: 1.7007, test_f1: 0.2392
 epoch: 1, train_loss: 1.1062, test_loss: 1.3309, test_f1: 0.2416
 epoch: 2, train_loss: 1.0153, test_loss: 1.0649, test_f1: 0.3628
 epoch: 3, train_loss: 0.9646, test_loss: 0.9577, test_f1: 0.4417
 epoch: 4, train_loss: 0.9224, test_loss: 0.9448, test_f1: 0.4882
 epoch: 5, train_loss: 0.9068, test_loss: 0.9187, test_f1: 0.5081
 epoch: 6, train_loss: 0.8842, test_loss: 0.9238, test_f1: 0.5114
 epoch: 7, train_loss: 0.8676, test_loss: 0.8972, test_f1: 0.5413
 epoch: 8, train_loss: 0.8514, test_loss: 0.8945, test_f1: 0.5388
 epoch: 9, train_loss: 0.8469, test_loss: 0.8973, test_f1: 0.5458
 epoch: 10, train_loss: 0.8277, test_loss: 0.8956, test_f1: 0.5422
 epoch: 11, train_loss: 0.8285, test_loss: 0.8805, test_f1: 0.5531
 epoch: 12, train_loss: 0.8071, test_loss: 0.9097, test_f1: 0.5455
 epoch: 13, train_loss: 0.7920, test_loss: 0.9516, test_f1: 0.5548
 epoch: 14, train_loss: 0.7929, test_loss: 0.9240, test_f1: 0.5628
 epoch: 15, train_loss: 0.7660, test_loss: 0.9727, test_f1: 0.5638
 epoch: 16, train_loss: 0.7797, test_loss: 0.9151, test_f1: 0.5895
 epoch: 17, train_loss: 0.7409, test_loss: 0.9493, test_f1: 0.5613
 epoch: 18, train_loss: 0.7541, test_loss: 0.9274, test_f1: 0.5665
 epoch: 19, train_loss: 0.7589, test_loss: 0.9008, test_f1: 0.5691
 epoch: 20, train_loss: 0.7356, test_loss: 1.0578, test_f1: 0.5254
 epoch: 21, train_loss: 0.7241, test_loss: 0.9503, test_f1: 0.5574
 epoch: 22, train_loss: 0.7280, test_loss: 0.9239, test_f1: 0.5487
 epoch: 23, train_loss: 0.7052, test_loss: 0.9760, test_f1: 0.5487
 epoch: 24, train_loss: 0.6921, test_loss: 0.9419, test_f1: 0.5874
 epoch: 25, train_loss: 0.6816, test_loss: 0.9054, test_f1: 0.6215
 epoch: 26, train_loss: 0.6758, test_loss: 0.9901, test_f1: 0.5794
 epoch: 27, train_loss: 0.6959, test_loss: 1.0315, test_f1: 0.5492
 epoch: 28, train_loss: 0.6774, test_loss: 0.9543, test_f1: 0.6004
 epoch: 29, train_loss: 0.6632, test_loss: 0.9917, test_f1: 0.6020
 epoch: 30, train_loss: 0.6851, test_loss: 0.9731, test_f1: 0.5801
 epoch: 31, train_loss: 0.6587, test_loss: 0.9567, test_f1: 0.5525
 epoch: 32, train_loss: 0.6655, test_loss: 1.0319, test_f1: 0.5919
 epoch: 33, train_loss: 0.6362, test_loss: 0.9959, test_f1: 0.6150
 epoch: 34, train_loss: 0.6212, test_loss: 1.0068, test_f1: 0.5850
 epoch: 35, train_loss: 0.6163, test_loss: 1.0617, test_f1: 0.5703
 epoch: 36, train_loss: 0.5997, test_loss: 1.0572, test_f1: 0.5814
 epoch: 37, train_loss: 0.5974, test_loss: 1.0403, test_f1: 0.5707
 epoch: 38, train_loss: 0.6074, test_loss: 1.0231, test_f1: 0.6085
 epoch: 39, train_loss: 0.5884, test_loss: 0.9690, test_f1: 0.6028
 epoch: 40, train_loss: 0.5960, test_loss: 1.0622, test_f1: 0.6205
 epoch: 41, train_loss: 0.6064, test_loss: 1.0147, test_f1: 0.6122
 epoch: 42, train_loss: 0.5823, test_loss: 0.9693, test_f1: 0.6141
 epoch: 43, train_loss: 0.5605, test_loss: 1.0026, test_f1: 0.6002
 epoch: 44, train_loss: 0.5723, test_loss: 1.0244, test_f1: 0.5978
 epoch: 45, train_loss: 0.5473, test_loss: 1.0227, test_f1: 0.5917
 epoch: 46, train_loss: 0.5321, test_loss: 1.1076, test_f1: 0.6250
 epoch: 47, train_loss: 0.5282, test_loss: 1.0593, test_f1: 0.6400
 epoch: 48, train_loss: 0.5481, test_loss: 0.9402, test_f1: 0.6297
 epoch: 49, train_loss: 0.5283, test_loss: 1.0355, test_f1: 0.6174
 epoch: 50, train_loss: 0.5184, test_loss: 1.0777, test_f1: 0.6157
 epoch: 51, train_loss: 0.4856, test_loss: 1.0578, test_f1: 0.6339
 epoch: 52, train_loss: 0.4674, test_loss: 1.0555, test_f1: 0.6364
 epoch: 53, train_loss: 0.4435, test_loss: 1.0601, test_f1: 0.6148
 epoch: 54, train_loss: 0.4472, test_loss: 1.0534, test_f1: 0.6503
 epoch: 55, train_loss: 0.4295, test_loss: 1.1831, test_f1: 0.6270
 epoch: 56, train_loss: 0.4535, test_loss: 1.0731, test_f1: 0.6377
 epoch: 57, train_loss: 0.4498, test_loss: 1.1765, test_f1: 0.6167
 epoch: 58, train_loss: 0.4483, test_loss: 1.1376, test_f1: 0.6344
 epoch: 59, train_loss: 0.4219, test_loss: 1.1787, test_f1: 0.6335
 epoch: 60, train_loss: 0.4272, test_loss: 1.1444, test_f1: 0.6240
 epoch: 61, train_loss: 0.4181, test_loss: 1.0993, test_f1: 0.6268
 epoch: 62, train_loss: 0.4272, test_loss: 1.1082, test_f1: 0.6186
 epoch: 63, train_loss: 0.4037, test_loss: 1.1151, test_f1: 0.6561
 epoch: 64, train_loss: 0.4140, test_loss: 1.1005, test_f1: 0.6416
 epoch: 65, train_loss: 0.3980, test_loss: 1.1954, test_f1: 0.6452
 epoch: 66, train_loss: 0.3900, test_loss: 1.2218, test_f1: 0.6403
 epoch: 67, train_loss: 0.4012, test_loss: 1.1833, test_f1: 0.6457
 epoch: 68, train_loss: 0.3914, test_loss: 1.2344, test_f1: 0.6683
 epoch: 69, train_loss: 0.3954, test_loss: 1.2007, test_f1: 0.6394
 epoch: 70, train_loss: 0.3922, test_loss: 1.2165, test_f1: 0.6345
 epoch: 71, train_loss: 0.3863, test_loss: 1.1743, test_f1: 0.6541
 epoch: 72, train_loss: 0.3778, test_loss: 1.2345, test_f1: 0.6413
 epoch: 73, train_loss: 0.3770, test_loss: 1.2262, test_f1: 0.6387
 epoch: 74, train_loss: 0.3641, test_loss: 1.1832, test_f1: 0.6532
 epoch: 75, train_loss: 0.3654, test_loss: 1.2167, test_f1: 0.6543
 epoch: 76, train_loss: 0.3652, test_loss: 1.1755, test_f1: 0.6488
 epoch: 77, train_loss: 0.3700, test_loss: 1.1921, test_f1: 0.6301
 epoch: 78, train_loss: 0.3688, test_loss: 1.2574, test_f1: 0.6167
 epoch: 79, train_loss: 0.3495, test_loss: 1.2821, test_f1: 0.6251
 epoch: 80, train_loss: 0.3576, test_loss: 1.2788, test_f1: 0.6403
 epoch: 81, train_loss: 0.3540, test_loss: 1.2838, test_f1: 0.6105
 epoch: 82, train_loss: 0.3844, test_loss: 1.2379, test_f1: 0.6568
 epoch: 83, train_loss: 0.3649, test_loss: 1.2707, test_f1: 0.6474
 epoch: 84, train_loss: 0.3623, test_loss: 1.3722, test_f1: 0.6137
 epoch: 85, train_loss: 0.3444, test_loss: 1.2263, test_f1: 0.6297
 epoch: 86, train_loss: 0.3405, test_loss: 1.3151, test_f1: 0.6251
 epoch: 87, train_loss: 0.3452, test_loss: 1.3238, test_f1: 0.6524
 epoch: 88, train_loss: 0.3412, test_loss: 1.2466, test_f1: 0.6496
 epoch: 89, train_loss: 0.3212, test_loss: 1.2806, test_f1: 0.6521
 epoch: 90, train_loss: 0.3288, test_loss: 1.4513, test_f1: 0.6309
 epoch: 91, train_loss: 0.3340, test_loss: 1.3001, test_f1: 0.6640
 epoch: 92, train_loss: 0.3221, test_loss: 1.3411, test_f1: 0.6247
 epoch: 93, train_loss: 0.3303, test_loss: 1.4315, test_f1: 0.6525
 epoch: 94, train_loss: 0.3278, test_loss: 1.2888, test_f1: 0.6372
 epoch: 95, train_loss: 0.3250, test_loss: 1.3720, test_f1: 0.6390
 epoch: 96, train_loss: 0.3236, test_loss: 1.4250, test_f1: 0.6262
 epoch: 97, train_loss: 0.3180, test_loss: 1.3510, test_f1: 0.6479
 epoch: 98, train_loss: 0.3385, test_loss: 1.4462, test_f1: 0.6354
 epoch: 99, train_loss: 0.3065, test_loss: 1.3021, test_f1: 0.6368
##################ITERATION #9 ****************************************
 epoch: 0, train_loss: 1.8309, test_loss: 1.8114, test_f1: 0.2270
 epoch: 1, train_loss: 1.1115, test_loss: 1.1986, test_f1: 0.2601
 epoch: 2, train_loss: 0.9979, test_loss: 1.0796, test_f1: 0.3533
 epoch: 3, train_loss: 0.9498, test_loss: 1.0462, test_f1: 0.4083
 epoch: 4, train_loss: 0.9293, test_loss: 0.9983, test_f1: 0.4429
 epoch: 5, train_loss: 0.9001, test_loss: 0.9750, test_f1: 0.4856
 epoch: 6, train_loss: 0.8929, test_loss: 0.9364, test_f1: 0.4921
 epoch: 7, train_loss: 0.8680, test_loss: 0.9467, test_f1: 0.5123
 epoch: 8, train_loss: 0.8406, test_loss: 0.9361, test_f1: 0.5414
 epoch: 9, train_loss: 0.8322, test_loss: 0.9372, test_f1: 0.5345
 epoch: 10, train_loss: 0.8162, test_loss: 0.9020, test_f1: 0.5334
 epoch: 11, train_loss: 0.8063, test_loss: 0.9010, test_f1: 0.5433
 epoch: 12, train_loss: 0.8152, test_loss: 0.8965, test_f1: 0.5337
 epoch: 13, train_loss: 0.7902, test_loss: 0.9115, test_f1: 0.5314
 epoch: 14, train_loss: 0.7795, test_loss: 0.9005, test_f1: 0.5773
 epoch: 15, train_loss: 0.7575, test_loss: 0.8974, test_f1: 0.5632
 epoch: 16, train_loss: 0.7495, test_loss: 0.9301, test_f1: 0.5517
 epoch: 17, train_loss: 0.7440, test_loss: 0.9404, test_f1: 0.5494
 epoch: 18, train_loss: 0.7260, test_loss: 0.8873, test_f1: 0.5825
 epoch: 19, train_loss: 0.7237, test_loss: 0.8932, test_f1: 0.5783
 epoch: 20, train_loss: 0.7203, test_loss: 0.9040, test_f1: 0.5623
 epoch: 21, train_loss: 0.6999, test_loss: 0.9231, test_f1: 0.5737
 epoch: 22, train_loss: 0.7023, test_loss: 1.0023, test_f1: 0.5426
 epoch: 23, train_loss: 0.6960, test_loss: 0.8996, test_f1: 0.6011
 epoch: 24, train_loss: 0.6941, test_loss: 0.8789, test_f1: 0.5848
 epoch: 25, train_loss: 0.6772, test_loss: 0.9102, test_f1: 0.5886
 epoch: 26, train_loss: 0.6705, test_loss: 0.9469, test_f1: 0.5654
 epoch: 27, train_loss: 0.6686, test_loss: 0.9051, test_f1: 0.6057
 epoch: 28, train_loss: 0.6557, test_loss: 0.9569, test_f1: 0.5674
 epoch: 29, train_loss: 0.6465, test_loss: 0.8518, test_f1: 0.5935
 epoch: 30, train_loss: 0.6405, test_loss: 0.9461, test_f1: 0.5815
 epoch: 31, train_loss: 0.6213, test_loss: 0.9662, test_f1: 0.5890
 epoch: 32, train_loss: 0.6328, test_loss: 0.9376, test_f1: 0.6255
 epoch: 33, train_loss: 0.6113, test_loss: 0.9018, test_f1: 0.6293
 epoch: 34, train_loss: 0.5903, test_loss: 0.9230, test_f1: 0.5777
 epoch: 35, train_loss: 0.5904, test_loss: 0.9399, test_f1: 0.5843
 epoch: 36, train_loss: 0.5893, test_loss: 0.9792, test_f1: 0.6558
 epoch: 37, train_loss: 0.5754, test_loss: 1.0721, test_f1: 0.6157
 epoch: 38, train_loss: 0.5539, test_loss: 0.9322, test_f1: 0.6346
 epoch: 39, train_loss: 0.5649, test_loss: 0.9940, test_f1: 0.5828
 epoch: 40, train_loss: 0.5657, test_loss: 0.9940, test_f1: 0.6166
 epoch: 41, train_loss: 0.5698, test_loss: 1.0406, test_f1: 0.6318
 epoch: 42, train_loss: 0.5621, test_loss: 0.8811, test_f1: 0.6319
 epoch: 43, train_loss: 0.5485, test_loss: 1.0525, test_f1: 0.6183
 epoch: 44, train_loss: 0.5549, test_loss: 1.0477, test_f1: 0.6321
 epoch: 45, train_loss: 0.5494, test_loss: 0.9465, test_f1: 0.6378
 epoch: 46, train_loss: 0.5343, test_loss: 0.9322, test_f1: 0.6340
 epoch: 47, train_loss: 0.5000, test_loss: 1.0036, test_f1: 0.6212
 epoch: 48, train_loss: 0.5091, test_loss: 1.1319, test_f1: 0.5910
 epoch: 49, train_loss: 0.5111, test_loss: 0.9980, test_f1: 0.6191
 epoch: 50, train_loss: 0.4842, test_loss: 1.0693, test_f1: 0.6064
 epoch: 51, train_loss: 0.4778, test_loss: 1.0525, test_f1: 0.6443
 epoch: 52, train_loss: 0.4668, test_loss: 0.9689, test_f1: 0.6504
 epoch: 53, train_loss: 0.4416, test_loss: 1.0071, test_f1: 0.6485
 epoch: 54, train_loss: 0.4378, test_loss: 1.0508, test_f1: 0.6529
 epoch: 55, train_loss: 0.4307, test_loss: 1.0430, test_f1: 0.6423
 epoch: 56, train_loss: 0.4193, test_loss: 1.0305, test_f1: 0.6381
 epoch: 57, train_loss: 0.4146, test_loss: 1.0696, test_f1: 0.6420
 epoch: 58, train_loss: 0.4077, test_loss: 1.1020, test_f1: 0.6579
 epoch: 59, train_loss: 0.4109, test_loss: 1.1132, test_f1: 0.6491
 epoch: 60, train_loss: 0.4112, test_loss: 1.0868, test_f1: 0.6273
 epoch: 61, train_loss: 0.4172, test_loss: 1.1251, test_f1: 0.6851
 epoch: 62, train_loss: 0.3982, test_loss: 1.0809, test_f1: 0.6353
 epoch: 63, train_loss: 0.3888, test_loss: 1.1130, test_f1: 0.6458
 epoch: 64, train_loss: 0.3930, test_loss: 1.1019, test_f1: 0.6273
 epoch: 65, train_loss: 0.4009, test_loss: 1.1177, test_f1: 0.6499
 epoch: 66, train_loss: 0.3911, test_loss: 1.0925, test_f1: 0.6499
 epoch: 67, train_loss: 0.3862, test_loss: 1.1044, test_f1: 0.6647
 epoch: 68, train_loss: 0.3951, test_loss: 1.2481, test_f1: 0.6242
 epoch: 69, train_loss: 0.4016, test_loss: 1.1424, test_f1: 0.6632
 epoch: 70, train_loss: 0.3817, test_loss: 1.1547, test_f1: 0.6612
 epoch: 71, train_loss: 0.3672, test_loss: 1.0910, test_f1: 0.6735
 epoch: 72, train_loss: 0.3502, test_loss: 1.2073, test_f1: 0.6614
 epoch: 73, train_loss: 0.3576, test_loss: 1.2354, test_f1: 0.6581
 epoch: 74, train_loss: 0.3494, test_loss: 1.2374, test_f1: 0.6593
 epoch: 75, train_loss: 0.3512, test_loss: 1.2293, test_f1: 0.6429
 epoch: 76, train_loss: 0.3625, test_loss: 1.2688, test_f1: 0.6333
 epoch: 77, train_loss: 0.3587, test_loss: 1.2277, test_f1: 0.6504
 epoch: 78, train_loss: 0.3447, test_loss: 1.2090, test_f1: 0.6412
 epoch: 79, train_loss: 0.3624, test_loss: 1.2622, test_f1: 0.6782
 epoch: 80, train_loss: 0.3491, test_loss: 1.2222, test_f1: 0.6590
 epoch: 81, train_loss: 0.3408, test_loss: 1.1754, test_f1: 0.6455
 epoch: 82, train_loss: 0.3546, test_loss: 1.2446, test_f1: 0.6513
 epoch: 83, train_loss: 0.3447, test_loss: 1.3921, test_f1: 0.6283
 epoch: 84, train_loss: 0.3569, test_loss: 1.1947, test_f1: 0.6627
 epoch: 85, train_loss: 0.3497, test_loss: 1.2387, test_f1: 0.6403
 epoch: 86, train_loss: 0.3391, test_loss: 1.3091, test_f1: 0.6604
 epoch: 87, train_loss: 0.3276, test_loss: 1.2217, test_f1: 0.6894
 epoch: 88, train_loss: 0.3331, test_loss: 1.2729, test_f1: 0.6307
 epoch: 89, train_loss: 0.3273, test_loss: 1.3159, test_f1: 0.6519
 epoch: 90, train_loss: 0.3229, test_loss: 1.3627, test_f1: 0.6542
 epoch: 91, train_loss: 0.3103, test_loss: 1.2806, test_f1: 0.6563
 epoch: 92, train_loss: 0.3044, test_loss: 1.3677, test_f1: 0.6637
 epoch: 93, train_loss: 0.3077, test_loss: 1.4137, test_f1: 0.6651
 epoch: 94, train_loss: 0.3216, test_loss: 1.3184, test_f1: 0.6639
 epoch: 95, train_loss: 0.3351, test_loss: 1.3079, test_f1: 0.6425
 epoch: 96, train_loss: 0.3082, test_loss: 1.3277, test_f1: 0.6546
 epoch: 97, train_loss: 0.3055, test_loss: 1.4020, test_f1: 0.6709
 epoch: 98, train_loss: 0.3233, test_loss: 1.4750, test_f1: 0.6521
 epoch: 99, train_loss: 0.3080, test_loss: 1.3969, test_f1: 0.6409

Training completed in 383.19 seconds
Best F1: 0.7226 at epoch 59
Mean F1 across iterations: 0.6821  0.0192
========================FINAL RESULTS================================
FEGIN weighted F1: 0.7226  0.0192
python main.py --data ltspice_examples --representation component_net --model FEGIN --layers 2 --hiddens 128 --batch_size 256 --lr 0.001 --emb_size 250 --epochs 100 --save_appendix component_net_L2_H128_BS256_LR0.001_E250 --no_val
-----



STDERR:
  File "main.py", line 370, in <module>
    main()
  File "main.py", line 254, in main
    dataset = dataset_class(
  File "/home/philip/projects/ltspice_examples_code_repo/Circuit-Completion-Using-GNNs/component_classification_with_link_prediction_head/evaluation/FEGIN/kernel/circuit_datasets.py", line 15, in __init__
    self.data, self.slices = torch.load(self.processed_paths[0])
  File "/home/philip/.local/lib/python3.8/site-packages/torch/serialization.py", line 1040, in load
    warnings.warn(
  File "/usr/lib/python3.8/warnings.py", line 109, in _showwarnmsg
    sw(msg.message, msg.category, msg.filename, msg.lineno,
  File "main.py", line 47, in warn_with_traceback
    traceback.print_stack(file=log)
/home/philip/projects/ltspice_examples_code_repo/Circuit-Completion-Using-GNNs/component_classification_with_link_prediction_head/evaluation/FEGIN/kernel/circuit_datasets.py:15: FutureWarning: You are using `torch.load` with `weights_only=False` (the current default value), which uses the default pickle module implicitly. It is possible to construct malicious pickle data which will execute arbitrary code during unpickling (See https://github.com/pytorch/pytorch/blob/main/SECURITY.md#untrusted-models for more details). In a future release, the default value for `weights_only` will be flipped to `True`. This limits the functions that could be executed during unpickling. Arbitrary objects will no longer be allowed to be loaded via this mode unless they are explicitly allowlisted by the user via `torch.serialization.add_safe_globals`. We recommend you start setting `weights_only=True` for any use case where you don't have full control of the loaded file. Please open an issue on GitHub for any issues related to this experimental feature.
  self.data, self.slices = torch.load(self.processed_paths[0])
