STDOUT:
Results will be saved in /home/philip/projects/ltspice_examples_code_repo/Circuit-Completion-Using-GNNs/component_classification_with_link_prediction_head/evaluation/FEGIN/results/model_FEGIN_dataset_ltspice_demos
Command line input: python main.py --data ltspice_demos --representation component_pin_net --model FEGIN --layers 5 --hiddens 32 --batch_size 32 --lr 0.001 --emb_size 128 --epochs 100 --save_appendix component_pin_net_L5_H32_BS32_LR0.001_E128 --no_val
 is saved.
-----
ltspice_demos - FEGIN
Using 5 layers, 32 hidden units, h = 2
Loading component_pin_net representation dataset
ENTERED
Training FEGIN on component_pin_net representation
Train: 1565, Test: 383
##################ITERATION #0 ****************************************
 epoch: 0, train_loss: 1.2840, test_loss: 1.3038, test_f1: 0.3232
 epoch: 1, train_loss: 1.1518, test_loss: 1.1982, test_f1: 0.4039
 epoch: 2, train_loss: 1.1184, test_loss: 1.1556, test_f1: 0.4460
 epoch: 3, train_loss: 1.0785, test_loss: 1.1227, test_f1: 0.4472
 epoch: 4, train_loss: 1.0300, test_loss: 1.0932, test_f1: 0.4685
 epoch: 5, train_loss: 0.9958, test_loss: 1.0678, test_f1: 0.4604
 epoch: 6, train_loss: 0.9836, test_loss: 1.0496, test_f1: 0.4968
 epoch: 7, train_loss: 0.9708, test_loss: 1.0357, test_f1: 0.5052
 epoch: 8, train_loss: 0.9591, test_loss: 1.0397, test_f1: 0.5239
 epoch: 9, train_loss: 0.9466, test_loss: 1.0509, test_f1: 0.5315
 epoch: 10, train_loss: 0.9321, test_loss: 1.0175, test_f1: 0.5582
 epoch: 11, train_loss: 0.9227, test_loss: 1.0681, test_f1: 0.5128
 epoch: 12, train_loss: 0.9168, test_loss: 1.0088, test_f1: 0.5337
 epoch: 13, train_loss: 0.8996, test_loss: 0.9709, test_f1: 0.5798
 epoch: 14, train_loss: 0.8749, test_loss: 0.9977, test_f1: 0.5590
 epoch: 15, train_loss: 0.8716, test_loss: 1.0356, test_f1: 0.5644
 epoch: 16, train_loss: 0.8530, test_loss: 1.0564, test_f1: 0.5406
 epoch: 17, train_loss: 0.8558, test_loss: 1.0113, test_f1: 0.5798
 epoch: 18, train_loss: 0.8354, test_loss: 0.9788, test_f1: 0.5961
 epoch: 19, train_loss: 0.8030, test_loss: 1.0081, test_f1: 0.5871
 epoch: 20, train_loss: 0.7971, test_loss: 1.0168, test_f1: 0.5865
 epoch: 21, train_loss: 0.7758, test_loss: 0.9937, test_f1: 0.5328
 epoch: 22, train_loss: 0.7691, test_loss: 0.9712, test_f1: 0.5576
 epoch: 23, train_loss: 0.7385, test_loss: 1.0129, test_f1: 0.5413
 epoch: 24, train_loss: 0.7320, test_loss: 1.0331, test_f1: 0.5405
 epoch: 25, train_loss: 0.7491, test_loss: 1.1104, test_f1: 0.4812
 epoch: 26, train_loss: 0.7442, test_loss: 0.9473, test_f1: 0.5717
 epoch: 27, train_loss: 0.7289, test_loss: 1.0209, test_f1: 0.5598
 epoch: 28, train_loss: 0.7077, test_loss: 1.1080, test_f1: 0.6231
 epoch: 29, train_loss: 0.6976, test_loss: 0.9477, test_f1: 0.6096
 epoch: 30, train_loss: 0.6851, test_loss: 1.0056, test_f1: 0.6009
 epoch: 31, train_loss: 0.6891, test_loss: 1.0149, test_f1: 0.6139
 epoch: 32, train_loss: 0.6676, test_loss: 0.9910, test_f1: 0.6252
 epoch: 33, train_loss: 0.6675, test_loss: 1.0536, test_f1: 0.5847
 epoch: 34, train_loss: 0.6439, test_loss: 0.9953, test_f1: 0.6260
 epoch: 35, train_loss: 0.6260, test_loss: 1.0485, test_f1: 0.6328
 epoch: 36, train_loss: 0.6178, test_loss: 0.9814, test_f1: 0.6503
 epoch: 37, train_loss: 0.6080, test_loss: 1.0311, test_f1: 0.5840
 epoch: 38, train_loss: 0.5929, test_loss: 1.0782, test_f1: 0.6125
 epoch: 39, train_loss: 0.6214, test_loss: 1.0351, test_f1: 0.5739
 epoch: 40, train_loss: 0.6003, test_loss: 0.9871, test_f1: 0.6280
 epoch: 41, train_loss: 0.5836, test_loss: 1.0231, test_f1: 0.6194
 epoch: 42, train_loss: 0.5916, test_loss: 1.1572, test_f1: 0.6327
 epoch: 43, train_loss: 0.5766, test_loss: 1.1339, test_f1: 0.5871
 epoch: 44, train_loss: 0.5807, test_loss: 1.0393, test_f1: 0.6443
 epoch: 45, train_loss: 0.5388, test_loss: 1.1379, test_f1: 0.6053
 epoch: 46, train_loss: 0.5702, test_loss: 1.0886, test_f1: 0.6136
 epoch: 47, train_loss: 0.5642, test_loss: 1.2214, test_f1: 0.5979
 epoch: 48, train_loss: 0.5399, test_loss: 1.1617, test_f1: 0.5996
 epoch: 49, train_loss: 0.5519, test_loss: 1.1361, test_f1: 0.6108
 epoch: 50, train_loss: 0.5196, test_loss: 1.1582, test_f1: 0.6023
 epoch: 51, train_loss: 0.5093, test_loss: 1.1258, test_f1: 0.6524
 epoch: 52, train_loss: 0.4742, test_loss: 1.1548, test_f1: 0.6262
 epoch: 53, train_loss: 0.4802, test_loss: 1.1699, test_f1: 0.6067
 epoch: 54, train_loss: 0.4676, test_loss: 1.2290, test_f1: 0.6085
 epoch: 55, train_loss: 0.4463, test_loss: 1.1896, test_f1: 0.6262
 epoch: 56, train_loss: 0.4440, test_loss: 1.2438, test_f1: 0.6177
 epoch: 57, train_loss: 0.4367, test_loss: 1.2585, test_f1: 0.6361
 epoch: 58, train_loss: 0.4344, test_loss: 1.2325, test_f1: 0.6121
 epoch: 59, train_loss: 0.4480, test_loss: 1.3400, test_f1: 0.6098
 epoch: 60, train_loss: 0.4333, test_loss: 1.2833, test_f1: 0.6180
 epoch: 61, train_loss: 0.4354, test_loss: 1.4151, test_f1: 0.5991
 epoch: 62, train_loss: 0.4307, test_loss: 1.2286, test_f1: 0.6456
 epoch: 63, train_loss: 0.4256, test_loss: 1.3015, test_f1: 0.6429
 epoch: 64, train_loss: 0.4236, test_loss: 1.2980, test_f1: 0.6160
 epoch: 65, train_loss: 0.4048, test_loss: 1.3700, test_f1: 0.5908
 epoch: 66, train_loss: 0.4141, test_loss: 1.3460, test_f1: 0.6203
 epoch: 67, train_loss: 0.4057, test_loss: 1.4207, test_f1: 0.6180
 epoch: 68, train_loss: 0.3649, test_loss: 1.5248, test_f1: 0.5967
 epoch: 69, train_loss: 0.3896, test_loss: 1.4950, test_f1: 0.6044
 epoch: 70, train_loss: 0.3678, test_loss: 1.4718, test_f1: 0.6058
 epoch: 71, train_loss: 0.3749, test_loss: 1.5455, test_f1: 0.6134
 epoch: 72, train_loss: 0.3493, test_loss: 1.4529, test_f1: 0.6136
 epoch: 73, train_loss: 0.3676, test_loss: 1.7052, test_f1: 0.6145
 epoch: 74, train_loss: 0.3745, test_loss: 1.5733, test_f1: 0.6194
 epoch: 75, train_loss: 0.3642, test_loss: 1.6749, test_f1: 0.6063
 epoch: 76, train_loss: 0.3562, test_loss: 1.5913, test_f1: 0.6184
 epoch: 77, train_loss: 0.3595, test_loss: 1.6477, test_f1: 0.6202
 epoch: 78, train_loss: 0.3542, test_loss: 1.7351, test_f1: 0.6075
 epoch: 79, train_loss: 0.3509, test_loss: 1.6068, test_f1: 0.6188
 epoch: 80, train_loss: 0.3361, test_loss: 1.7481, test_f1: 0.6060
 epoch: 81, train_loss: 0.3548, test_loss: 1.9450, test_f1: 0.6129
 epoch: 82, train_loss: 0.3273, test_loss: 1.8011, test_f1: 0.6085
 epoch: 83, train_loss: 0.3534, test_loss: 1.6597, test_f1: 0.6153
 epoch: 84, train_loss: 0.3385, test_loss: 1.7734, test_f1: 0.5829
 epoch: 85, train_loss: 0.3378, test_loss: 1.8170, test_f1: 0.5843
 epoch: 86, train_loss: 0.3326, test_loss: 1.8138, test_f1: 0.6186
 epoch: 87, train_loss: 0.3360, test_loss: 1.9821, test_f1: 0.6059
 epoch: 88, train_loss: 0.3218, test_loss: 1.8174, test_f1: 0.6283
 epoch: 89, train_loss: 0.3196, test_loss: 2.0073, test_f1: 0.6001
 epoch: 90, train_loss: 0.3196, test_loss: 1.8465, test_f1: 0.6201
 epoch: 91, train_loss: 0.2945, test_loss: 1.9156, test_f1: 0.6193
 epoch: 92, train_loss: 0.3059, test_loss: 1.8102, test_f1: 0.6148
 epoch: 93, train_loss: 0.3105, test_loss: 1.8030, test_f1: 0.6181
 epoch: 94, train_loss: 0.3033, test_loss: 1.9656, test_f1: 0.5894
 epoch: 95, train_loss: 0.3002, test_loss: 2.1141, test_f1: 0.5788
 epoch: 96, train_loss: 0.2916, test_loss: 2.0329, test_f1: 0.6012
 epoch: 97, train_loss: 0.2801, test_loss: 1.9329, test_f1: 0.6112
 epoch: 98, train_loss: 0.3026, test_loss: 2.0222, test_f1: 0.6165
 epoch: 99, train_loss: 0.2806, test_loss: 2.0761, test_f1: 0.6117
##################ITERATION #1 ****************************************
 epoch: 0, train_loss: 1.1818, test_loss: 1.1902, test_f1: 0.4096
 epoch: 1, train_loss: 1.0426, test_loss: 1.0700, test_f1: 0.5241
 epoch: 2, train_loss: 1.0012, test_loss: 1.0290, test_f1: 0.5591
 epoch: 3, train_loss: 0.9707, test_loss: 1.0035, test_f1: 0.5189
 epoch: 4, train_loss: 0.9442, test_loss: 1.0326, test_f1: 0.5120
 epoch: 5, train_loss: 0.9412, test_loss: 0.9998, test_f1: 0.5235
 epoch: 6, train_loss: 0.9229, test_loss: 1.0057, test_f1: 0.5635
 epoch: 7, train_loss: 0.9113, test_loss: 0.9868, test_f1: 0.5366
 epoch: 8, train_loss: 0.9131, test_loss: 1.0135, test_f1: 0.5428
 epoch: 9, train_loss: 0.8863, test_loss: 0.9794, test_f1: 0.5603
 epoch: 10, train_loss: 0.8767, test_loss: 1.0055, test_f1: 0.5615
 epoch: 11, train_loss: 0.8726, test_loss: 1.0303, test_f1: 0.5603
 epoch: 12, train_loss: 0.8703, test_loss: 1.0063, test_f1: 0.5907
 epoch: 13, train_loss: 0.8477, test_loss: 1.0061, test_f1: 0.5656
 epoch: 14, train_loss: 0.8306, test_loss: 1.0185, test_f1: 0.5313
 epoch: 15, train_loss: 0.8149, test_loss: 1.0174, test_f1: 0.5622
 epoch: 16, train_loss: 0.8196, test_loss: 0.9968, test_f1: 0.5954
 epoch: 17, train_loss: 0.7984, test_loss: 1.0116, test_f1: 0.5520
 epoch: 18, train_loss: 0.7753, test_loss: 1.2872, test_f1: 0.4564
 epoch: 19, train_loss: 0.7814, test_loss: 1.0713, test_f1: 0.5603
 epoch: 20, train_loss: 0.7715, test_loss: 0.9783, test_f1: 0.5943
 epoch: 21, train_loss: 0.7563, test_loss: 1.1930, test_f1: 0.4829
 epoch: 22, train_loss: 0.7400, test_loss: 1.0050, test_f1: 0.5849
 epoch: 23, train_loss: 0.7359, test_loss: 1.0846, test_f1: 0.5765
 epoch: 24, train_loss: 0.7152, test_loss: 0.9930, test_f1: 0.6134
 epoch: 25, train_loss: 0.7060, test_loss: 1.0026, test_f1: 0.5943
 epoch: 26, train_loss: 0.6889, test_loss: 1.0214, test_f1: 0.6156
 epoch: 27, train_loss: 0.6848, test_loss: 1.1899, test_f1: 0.5498
 epoch: 28, train_loss: 0.6903, test_loss: 1.0637, test_f1: 0.5675
 epoch: 29, train_loss: 0.6728, test_loss: 1.1603, test_f1: 0.5326
 epoch: 30, train_loss: 0.6428, test_loss: 1.0960, test_f1: 0.5593
 epoch: 31, train_loss: 0.6700, test_loss: 1.0496, test_f1: 0.6020
 epoch: 32, train_loss: 0.6661, test_loss: 1.1260, test_f1: 0.6175
 epoch: 33, train_loss: 0.6375, test_loss: 1.1378, test_f1: 0.5980
 epoch: 34, train_loss: 0.6441, test_loss: 1.1662, test_f1: 0.6147
 epoch: 35, train_loss: 0.6323, test_loss: 1.1371, test_f1: 0.6219
 epoch: 36, train_loss: 0.6109, test_loss: 1.1559, test_f1: 0.5984
 epoch: 37, train_loss: 0.6317, test_loss: 1.1121, test_f1: 0.6050
 epoch: 38, train_loss: 0.6132, test_loss: 1.2307, test_f1: 0.5602
 epoch: 39, train_loss: 0.5973, test_loss: 1.2209, test_f1: 0.5834
 epoch: 40, train_loss: 0.6006, test_loss: 1.1330, test_f1: 0.6141
 epoch: 41, train_loss: 0.5943, test_loss: 1.2296, test_f1: 0.6111
 epoch: 42, train_loss: 0.5990, test_loss: 1.2010, test_f1: 0.5929
 epoch: 43, train_loss: 0.5914, test_loss: 1.1254, test_f1: 0.6324
 epoch: 44, train_loss: 0.5869, test_loss: 1.1548, test_f1: 0.6104
 epoch: 45, train_loss: 0.5623, test_loss: 1.2164, test_f1: 0.6191
 epoch: 46, train_loss: 0.5489, test_loss: 1.2284, test_f1: 0.5884
 epoch: 47, train_loss: 0.5658, test_loss: 1.2167, test_f1: 0.6237
 epoch: 48, train_loss: 0.5462, test_loss: 1.2747, test_f1: 0.6239
 epoch: 49, train_loss: 0.5534, test_loss: 1.2282, test_f1: 0.6453
 epoch: 50, train_loss: 0.5405, test_loss: 1.2925, test_f1: 0.5953
 epoch: 51, train_loss: 0.4813, test_loss: 1.2302, test_f1: 0.6053
 epoch: 52, train_loss: 0.4784, test_loss: 1.2586, test_f1: 0.6194
 epoch: 53, train_loss: 0.4633, test_loss: 1.3594, test_f1: 0.6262
 epoch: 54, train_loss: 0.4646, test_loss: 1.3351, test_f1: 0.6191
 epoch: 55, train_loss: 0.4621, test_loss: 1.2858, test_f1: 0.6130
 epoch: 56, train_loss: 0.4671, test_loss: 1.3521, test_f1: 0.6124
 epoch: 57, train_loss: 0.4651, test_loss: 1.4744, test_f1: 0.6195
 epoch: 58, train_loss: 0.4651, test_loss: 1.3509, test_f1: 0.6217
 epoch: 59, train_loss: 0.4625, test_loss: 1.3363, test_f1: 0.6525
 epoch: 60, train_loss: 0.4303, test_loss: 1.4139, test_f1: 0.6099
 epoch: 61, train_loss: 0.4473, test_loss: 1.4315, test_f1: 0.6333
 epoch: 62, train_loss: 0.4355, test_loss: 1.3890, test_f1: 0.6178
 epoch: 63, train_loss: 0.4449, test_loss: 1.4373, test_f1: 0.6027
 epoch: 64, train_loss: 0.4334, test_loss: 1.4076, test_f1: 0.6211
 epoch: 65, train_loss: 0.4270, test_loss: 1.5549, test_f1: 0.6010
 epoch: 66, train_loss: 0.4139, test_loss: 1.4697, test_f1: 0.6443
 epoch: 67, train_loss: 0.4145, test_loss: 1.5260, test_f1: 0.5844
 epoch: 68, train_loss: 0.4285, test_loss: 1.7529, test_f1: 0.5872
 epoch: 69, train_loss: 0.4069, test_loss: 1.5981, test_f1: 0.6116
 epoch: 70, train_loss: 0.4047, test_loss: 1.5117, test_f1: 0.5950
 epoch: 71, train_loss: 0.3940, test_loss: 1.6241, test_f1: 0.5983
 epoch: 72, train_loss: 0.4145, test_loss: 1.6061, test_f1: 0.5942
 epoch: 73, train_loss: 0.3782, test_loss: 1.6340, test_f1: 0.6274
 epoch: 74, train_loss: 0.3757, test_loss: 1.5017, test_f1: 0.6260
 epoch: 75, train_loss: 0.3558, test_loss: 1.6818, test_f1: 0.6176
 epoch: 76, train_loss: 0.3716, test_loss: 1.6829, test_f1: 0.6315
 epoch: 77, train_loss: 0.3682, test_loss: 1.6722, test_f1: 0.6166
 epoch: 78, train_loss: 0.3644, test_loss: 1.6203, test_f1: 0.6445
 epoch: 79, train_loss: 0.3465, test_loss: 1.6705, test_f1: 0.6119
 epoch: 80, train_loss: 0.3476, test_loss: 1.7608, test_f1: 0.6281
 epoch: 81, train_loss: 0.3326, test_loss: 1.8742, test_f1: 0.5928
 epoch: 82, train_loss: 0.3821, test_loss: 1.6865, test_f1: 0.6351
 epoch: 83, train_loss: 0.3656, test_loss: 1.7630, test_f1: 0.6170
 epoch: 84, train_loss: 0.3644, test_loss: 1.7767, test_f1: 0.6254
 epoch: 85, train_loss: 0.3268, test_loss: 1.7333, test_f1: 0.6295
 epoch: 86, train_loss: 0.3560, test_loss: 1.6652, test_f1: 0.6035
 epoch: 87, train_loss: 0.3236, test_loss: 1.7906, test_f1: 0.6282
 epoch: 88, train_loss: 0.3442, test_loss: 1.8290, test_f1: 0.6012
 epoch: 89, train_loss: 0.3478, test_loss: 1.9289, test_f1: 0.6249
 epoch: 90, train_loss: 0.3179, test_loss: 1.8464, test_f1: 0.6170
 epoch: 91, train_loss: 0.3116, test_loss: 1.8309, test_f1: 0.6179
 epoch: 92, train_loss: 0.3335, test_loss: 1.8865, test_f1: 0.6227
 epoch: 93, train_loss: 0.3465, test_loss: 1.7795, test_f1: 0.6230
 epoch: 94, train_loss: 0.3283, test_loss: 1.8736, test_f1: 0.6236
 epoch: 95, train_loss: 0.3069, test_loss: 1.9699, test_f1: 0.6259
 epoch: 96, train_loss: 0.3167, test_loss: 1.9729, test_f1: 0.6068
 epoch: 97, train_loss: 0.3020, test_loss: 1.9244, test_f1: 0.6156
 epoch: 98, train_loss: 0.3271, test_loss: 1.9874, test_f1: 0.6229
 epoch: 99, train_loss: 0.3059, test_loss: 1.9857, test_f1: 0.6276
##################ITERATION #2 ****************************************
 epoch: 0, train_loss: 1.1753, test_loss: 1.3187, test_f1: 0.2740
 epoch: 1, train_loss: 1.0549, test_loss: 1.0960, test_f1: 0.4954
 epoch: 2, train_loss: 1.0180, test_loss: 1.0397, test_f1: 0.5297
 epoch: 3, train_loss: 0.9845, test_loss: 1.0223, test_f1: 0.5303
 epoch: 4, train_loss: 0.9549, test_loss: 1.0229, test_f1: 0.5469
 epoch: 5, train_loss: 0.9322, test_loss: 1.0162, test_f1: 0.5169
 epoch: 6, train_loss: 0.9196, test_loss: 0.9931, test_f1: 0.5500
 epoch: 7, train_loss: 0.9038, test_loss: 1.0108, test_f1: 0.5561
 epoch: 8, train_loss: 0.8885, test_loss: 0.9879, test_f1: 0.5442
 epoch: 9, train_loss: 0.8714, test_loss: 0.9831, test_f1: 0.5575
 epoch: 10, train_loss: 0.8527, test_loss: 1.0646, test_f1: 0.5344
 epoch: 11, train_loss: 0.8406, test_loss: 1.0063, test_f1: 0.6452
 epoch: 12, train_loss: 0.8365, test_loss: 1.0200, test_f1: 0.6149
 epoch: 13, train_loss: 0.8109, test_loss: 0.9632, test_f1: 0.6162
 epoch: 14, train_loss: 0.7748, test_loss: 1.0201, test_f1: 0.5525
 epoch: 15, train_loss: 0.7740, test_loss: 0.9497, test_f1: 0.6378
 epoch: 16, train_loss: 0.7563, test_loss: 1.1212, test_f1: 0.5388
 epoch: 17, train_loss: 0.7581, test_loss: 1.0243, test_f1: 0.6132
 epoch: 18, train_loss: 0.7321, test_loss: 1.0318, test_f1: 0.6137
 epoch: 19, train_loss: 0.7245, test_loss: 0.9605, test_f1: 0.6491
 epoch: 20, train_loss: 0.7286, test_loss: 1.0332, test_f1: 0.5903
 epoch: 21, train_loss: 0.7113, test_loss: 0.9724, test_f1: 0.6107
 epoch: 22, train_loss: 0.6897, test_loss: 1.0073, test_f1: 0.5920
 epoch: 23, train_loss: 0.6900, test_loss: 1.0312, test_f1: 0.5657
 epoch: 24, train_loss: 0.6841, test_loss: 1.0048, test_f1: 0.6146
 epoch: 25, train_loss: 0.6870, test_loss: 1.0562, test_f1: 0.6108
 epoch: 26, train_loss: 0.6611, test_loss: 1.0218, test_f1: 0.6157
 epoch: 27, train_loss: 0.6727, test_loss: 1.1577, test_f1: 0.5936
 epoch: 28, train_loss: 0.6563, test_loss: 1.0506, test_f1: 0.6051
 epoch: 29, train_loss: 0.6669, test_loss: 1.0589, test_f1: 0.6165
 epoch: 30, train_loss: 0.6357, test_loss: 1.0258, test_f1: 0.6482
 epoch: 31, train_loss: 0.6337, test_loss: 1.0770, test_f1: 0.5974
 epoch: 32, train_loss: 0.6146, test_loss: 1.1601, test_f1: 0.5938
 epoch: 33, train_loss: 0.6114, test_loss: 1.0794, test_f1: 0.6468
 epoch: 34, train_loss: 0.6303, test_loss: 1.1485, test_f1: 0.5921
 epoch: 35, train_loss: 0.6003, test_loss: 1.1030, test_f1: 0.6197
 epoch: 36, train_loss: 0.5991, test_loss: 1.0694, test_f1: 0.6104
 epoch: 37, train_loss: 0.5583, test_loss: 1.1443, test_f1: 0.6390
 epoch: 38, train_loss: 0.5619, test_loss: 1.1858, test_f1: 0.6160
 epoch: 39, train_loss: 0.5678, test_loss: 1.3305, test_f1: 0.5882
 epoch: 40, train_loss: 0.6024, test_loss: 1.1721, test_f1: 0.5684
 epoch: 41, train_loss: 0.5704, test_loss: 1.2359, test_f1: 0.6050
 epoch: 42, train_loss: 0.5606, test_loss: 1.2786, test_f1: 0.6314
 epoch: 43, train_loss: 0.5574, test_loss: 1.2263, test_f1: 0.6280
 epoch: 44, train_loss: 0.5500, test_loss: 1.1532, test_f1: 0.6168
 epoch: 45, train_loss: 0.5510, test_loss: 1.3267, test_f1: 0.5819
 epoch: 46, train_loss: 0.4937, test_loss: 1.3676, test_f1: 0.5945
 epoch: 47, train_loss: 0.5169, test_loss: 1.3194, test_f1: 0.5972
 epoch: 48, train_loss: 0.5322, test_loss: 1.4122, test_f1: 0.5832
 epoch: 49, train_loss: 0.5356, test_loss: 1.2531, test_f1: 0.6165
 epoch: 50, train_loss: 0.4996, test_loss: 1.2345, test_f1: 0.6284
 epoch: 51, train_loss: 0.4584, test_loss: 1.2800, test_f1: 0.6121
 epoch: 52, train_loss: 0.4683, test_loss: 1.2725, test_f1: 0.6424
 epoch: 53, train_loss: 0.4325, test_loss: 1.4062, test_f1: 0.6314
 epoch: 54, train_loss: 0.4371, test_loss: 1.4283, test_f1: 0.6298
 epoch: 55, train_loss: 0.4016, test_loss: 1.4397, test_f1: 0.6460
 epoch: 56, train_loss: 0.4335, test_loss: 1.4796, test_f1: 0.6384
 epoch: 57, train_loss: 0.3952, test_loss: 1.4146, test_f1: 0.6314
 epoch: 58, train_loss: 0.3915, test_loss: 1.5190, test_f1: 0.6267
 epoch: 59, train_loss: 0.4079, test_loss: 1.4842, test_f1: 0.6572
 epoch: 60, train_loss: 0.3872, test_loss: 1.4752, test_f1: 0.6390
 epoch: 61, train_loss: 0.3999, test_loss: 1.5618, test_f1: 0.6385
 epoch: 62, train_loss: 0.4041, test_loss: 1.6153, test_f1: 0.6315
 epoch: 63, train_loss: 0.3875, test_loss: 1.6524, test_f1: 0.6019
 epoch: 64, train_loss: 0.3911, test_loss: 1.6575, test_f1: 0.6326
 epoch: 65, train_loss: 0.4077, test_loss: 1.7179, test_f1: 0.6142
 epoch: 66, train_loss: 0.3648, test_loss: 1.7128, test_f1: 0.6152
 epoch: 67, train_loss: 0.3684, test_loss: 1.6635, test_f1: 0.6341
 epoch: 68, train_loss: 0.3593, test_loss: 1.6473, test_f1: 0.6186
 epoch: 69, train_loss: 0.3705, test_loss: 1.6139, test_f1: 0.6326
 epoch: 70, train_loss: 0.3551, test_loss: 1.6213, test_f1: 0.6384
 epoch: 71, train_loss: 0.3669, test_loss: 1.7988, test_f1: 0.6201
 epoch: 72, train_loss: 0.3457, test_loss: 1.8289, test_f1: 0.5959
 epoch: 73, train_loss: 0.3586, test_loss: 1.8009, test_f1: 0.6332
 epoch: 74, train_loss: 0.3558, test_loss: 1.8140, test_f1: 0.6224
 epoch: 75, train_loss: 0.3434, test_loss: 1.8665, test_f1: 0.6276
 epoch: 76, train_loss: 0.3570, test_loss: 1.7769, test_f1: 0.6256
 epoch: 77, train_loss: 0.3482, test_loss: 1.9301, test_f1: 0.6136
 epoch: 78, train_loss: 0.3349, test_loss: 1.8485, test_f1: 0.6328
 epoch: 79, train_loss: 0.3391, test_loss: 1.7900, test_f1: 0.6423
 epoch: 80, train_loss: 0.3201, test_loss: 1.7660, test_f1: 0.6296
 epoch: 81, train_loss: 0.3343, test_loss: 1.8785, test_f1: 0.6139
 epoch: 82, train_loss: 0.3477, test_loss: 1.9888, test_f1: 0.6153
 epoch: 83, train_loss: 0.3514, test_loss: 1.8396, test_f1: 0.6231
 epoch: 84, train_loss: 0.3506, test_loss: 1.9551, test_f1: 0.6073
 epoch: 85, train_loss: 0.3227, test_loss: 1.9332, test_f1: 0.6144
 epoch: 86, train_loss: 0.3241, test_loss: 1.8446, test_f1: 0.6082
 epoch: 87, train_loss: 0.2947, test_loss: 1.9691, test_f1: 0.6217
 epoch: 88, train_loss: 0.2839, test_loss: 2.0432, test_f1: 0.6096
 epoch: 89, train_loss: 0.3143, test_loss: 1.9631, test_f1: 0.6109
 epoch: 90, train_loss: 0.3043, test_loss: 2.0848, test_f1: 0.6074
 epoch: 91, train_loss: 0.3229, test_loss: 1.9816, test_f1: 0.6234
 epoch: 92, train_loss: 0.2952, test_loss: 2.1452, test_f1: 0.6145
 epoch: 93, train_loss: 0.2933, test_loss: 2.1435, test_f1: 0.6170
 epoch: 94, train_loss: 0.2800, test_loss: 2.1999, test_f1: 0.6105
 epoch: 95, train_loss: 0.2934, test_loss: 2.1075, test_f1: 0.6389
 epoch: 96, train_loss: 0.3122, test_loss: 1.9823, test_f1: 0.6271
 epoch: 97, train_loss: 0.2781, test_loss: 2.0618, test_f1: 0.6166
 epoch: 98, train_loss: 0.2842, test_loss: 2.1723, test_f1: 0.6136
 epoch: 99, train_loss: 0.2831, test_loss: 2.1090, test_f1: 0.5961
##################ITERATION #3 ****************************************
 epoch: 0, train_loss: 1.1651, test_loss: 1.2270, test_f1: 0.2290
 epoch: 1, train_loss: 1.0210, test_loss: 1.0253, test_f1: 0.4922
 epoch: 2, train_loss: 0.9733, test_loss: 0.9951, test_f1: 0.5353
 epoch: 3, train_loss: 0.9512, test_loss: 1.0008, test_f1: 0.5283
 epoch: 4, train_loss: 0.9361, test_loss: 0.9851, test_f1: 0.5352
 epoch: 5, train_loss: 0.9075, test_loss: 1.0006, test_f1: 0.5295
 epoch: 6, train_loss: 0.8891, test_loss: 0.9943, test_f1: 0.5306
 epoch: 7, train_loss: 0.8623, test_loss: 1.0304, test_f1: 0.5360
 epoch: 8, train_loss: 0.8614, test_loss: 1.0471, test_f1: 0.5344
 epoch: 9, train_loss: 0.8445, test_loss: 1.0587, test_f1: 0.5221
 epoch: 10, train_loss: 0.8399, test_loss: 1.0023, test_f1: 0.5556
 epoch: 11, train_loss: 0.8285, test_loss: 1.0876, test_f1: 0.5154
 epoch: 12, train_loss: 0.8031, test_loss: 1.0781, test_f1: 0.5245
 epoch: 13, train_loss: 0.8092, test_loss: 1.0951, test_f1: 0.5698
 epoch: 14, train_loss: 0.7891, test_loss: 1.0486, test_f1: 0.6037
 epoch: 15, train_loss: 0.7754, test_loss: 1.1806, test_f1: 0.5693
 epoch: 16, train_loss: 0.7615, test_loss: 1.2258, test_f1: 0.5814
 epoch: 17, train_loss: 0.7633, test_loss: 1.2697, test_f1: 0.5357
 epoch: 18, train_loss: 0.7422, test_loss: 1.2812, test_f1: 0.5527
 epoch: 19, train_loss: 0.7319, test_loss: 1.2385, test_f1: 0.5534
 epoch: 20, train_loss: 0.7273, test_loss: 1.1977, test_f1: 0.5455
 epoch: 21, train_loss: 0.7129, test_loss: 1.2537, test_f1: 0.5259
 epoch: 22, train_loss: 0.6997, test_loss: 1.3395, test_f1: 0.5144
 epoch: 23, train_loss: 0.7149, test_loss: 1.3995, test_f1: 0.5817
 epoch: 24, train_loss: 0.7044, test_loss: 1.4979, test_f1: 0.5307
 epoch: 25, train_loss: 0.6911, test_loss: 1.3104, test_f1: 0.5466
 epoch: 26, train_loss: 0.6824, test_loss: 1.4777, test_f1: 0.4941
 epoch: 27, train_loss: 0.6671, test_loss: 1.2789, test_f1: 0.4907
 epoch: 28, train_loss: 0.6307, test_loss: 1.2465, test_f1: 0.5893
 epoch: 29, train_loss: 0.6598, test_loss: 1.2280, test_f1: 0.5768
 epoch: 30, train_loss: 0.6598, test_loss: 1.3358, test_f1: 0.5644
 epoch: 31, train_loss: 0.6851, test_loss: 1.6162, test_f1: 0.5672
 epoch: 32, train_loss: 0.6340, test_loss: 1.3417, test_f1: 0.5522
 epoch: 33, train_loss: 0.6376, test_loss: 1.2820, test_f1: 0.5759
 epoch: 34, train_loss: 0.6541, test_loss: 1.3255, test_f1: 0.5570
 epoch: 35, train_loss: 0.6461, test_loss: 1.2377, test_f1: 0.6119
 epoch: 36, train_loss: 0.6048, test_loss: 1.5135, test_f1: 0.5647
 epoch: 37, train_loss: 0.5905, test_loss: 1.5913, test_f1: 0.5373
 epoch: 38, train_loss: 0.5920, test_loss: 1.6379, test_f1: 0.5663
 epoch: 39, train_loss: 0.6223, test_loss: 1.3948, test_f1: 0.5672
 epoch: 40, train_loss: 0.5839, test_loss: 1.2895, test_f1: 0.5959
 epoch: 41, train_loss: 0.5831, test_loss: 1.4818, test_f1: 0.5293
 epoch: 42, train_loss: 0.5583, test_loss: 1.4532, test_f1: 0.5967
 epoch: 43, train_loss: 0.5727, test_loss: 1.5493, test_f1: 0.5715
 epoch: 44, train_loss: 0.5812, test_loss: 1.3899, test_f1: 0.5487
 epoch: 45, train_loss: 0.5606, test_loss: 1.4699, test_f1: 0.5555
 epoch: 46, train_loss: 0.5572, test_loss: 1.3692, test_f1: 0.6008
 epoch: 47, train_loss: 0.5849, test_loss: 1.4278, test_f1: 0.5480
 epoch: 48, train_loss: 0.5616, test_loss: 1.7849, test_f1: 0.5673
 epoch: 49, train_loss: 0.5565, test_loss: 1.2126, test_f1: 0.6125
 epoch: 50, train_loss: 0.5530, test_loss: 1.3667, test_f1: 0.5899
 epoch: 51, train_loss: 0.4965, test_loss: 1.3509, test_f1: 0.5980
 epoch: 52, train_loss: 0.4881, test_loss: 1.4193, test_f1: 0.5921
 epoch: 53, train_loss: 0.4885, test_loss: 1.5179, test_f1: 0.5878
 epoch: 54, train_loss: 0.4910, test_loss: 1.4659, test_f1: 0.5993
 epoch: 55, train_loss: 0.4739, test_loss: 1.5431, test_f1: 0.5913
 epoch: 56, train_loss: 0.4657, test_loss: 1.6462, test_f1: 0.5712
 epoch: 57, train_loss: 0.4680, test_loss: 1.5881, test_f1: 0.5582
 epoch: 58, train_loss: 0.4622, test_loss: 1.5519, test_f1: 0.6018
 epoch: 59, train_loss: 0.4664, test_loss: 1.6094, test_f1: 0.6026
 epoch: 60, train_loss: 0.4579, test_loss: 1.6068, test_f1: 0.5983
 epoch: 61, train_loss: 0.4524, test_loss: 1.5820, test_f1: 0.6166
 epoch: 62, train_loss: 0.4584, test_loss: 1.5904, test_f1: 0.6189
 epoch: 63, train_loss: 0.4500, test_loss: 1.7939, test_f1: 0.5765
 epoch: 64, train_loss: 0.4388, test_loss: 1.5957, test_f1: 0.5792
 epoch: 65, train_loss: 0.4203, test_loss: 1.6971, test_f1: 0.5620
 epoch: 66, train_loss: 0.4231, test_loss: 1.5986, test_f1: 0.5970
 epoch: 67, train_loss: 0.4386, test_loss: 1.8392, test_f1: 0.5804
 epoch: 68, train_loss: 0.4296, test_loss: 1.7207, test_f1: 0.5951
 epoch: 69, train_loss: 0.4203, test_loss: 1.7857, test_f1: 0.5906
 epoch: 70, train_loss: 0.4195, test_loss: 1.7017, test_f1: 0.5842
 epoch: 71, train_loss: 0.3757, test_loss: 1.8210, test_f1: 0.5932
 epoch: 72, train_loss: 0.4080, test_loss: 1.8066, test_f1: 0.5996
 epoch: 73, train_loss: 0.4159, test_loss: 1.7786, test_f1: 0.5804
 epoch: 74, train_loss: 0.3830, test_loss: 1.8718, test_f1: 0.5863
 epoch: 75, train_loss: 0.4160, test_loss: 1.6802, test_f1: 0.6139
 epoch: 76, train_loss: 0.4033, test_loss: 1.8206, test_f1: 0.6045
 epoch: 77, train_loss: 0.3651, test_loss: 1.8399, test_f1: 0.5798
 epoch: 78, train_loss: 0.3651, test_loss: 1.7285, test_f1: 0.6260
 epoch: 79, train_loss: 0.3718, test_loss: 1.8243, test_f1: 0.6049
 epoch: 80, train_loss: 0.3857, test_loss: 1.9022, test_f1: 0.5933
 epoch: 81, train_loss: 0.3792, test_loss: 1.8009, test_f1: 0.5787
 epoch: 82, train_loss: 0.3794, test_loss: 1.9379, test_f1: 0.5947
 epoch: 83, train_loss: 0.3864, test_loss: 1.8668, test_f1: 0.5826
 epoch: 84, train_loss: 0.3754, test_loss: 1.9405, test_f1: 0.5795
 epoch: 85, train_loss: 0.3702, test_loss: 1.8693, test_f1: 0.5827
 epoch: 86, train_loss: 0.3603, test_loss: 1.8884, test_f1: 0.5999
 epoch: 87, train_loss: 0.3693, test_loss: 1.8958, test_f1: 0.5988
 epoch: 88, train_loss: 0.3517, test_loss: 1.8536, test_f1: 0.6075
 epoch: 89, train_loss: 0.3635, test_loss: 1.9674, test_f1: 0.5945
 epoch: 90, train_loss: 0.3346, test_loss: 1.9557, test_f1: 0.5764
 epoch: 91, train_loss: 0.3359, test_loss: 1.9814, test_f1: 0.6019
 epoch: 92, train_loss: 0.3474, test_loss: 1.9957, test_f1: 0.5615
 epoch: 93, train_loss: 0.3482, test_loss: 1.9183, test_f1: 0.6158
 epoch: 94, train_loss: 0.3483, test_loss: 2.0876, test_f1: 0.5993
 epoch: 95, train_loss: 0.3325, test_loss: 2.1997, test_f1: 0.5794
 epoch: 96, train_loss: 0.3276, test_loss: 2.0118, test_f1: 0.5786
 epoch: 97, train_loss: 0.3268, test_loss: 2.0807, test_f1: 0.5923
 epoch: 98, train_loss: 0.3416, test_loss: 2.1264, test_f1: 0.5633
 epoch: 99, train_loss: 0.3260, test_loss: 2.2864, test_f1: 0.5861
##################ITERATION #4 ****************************************
 epoch: 0, train_loss: 1.2602, test_loss: 1.3840, test_f1: 0.1477
 epoch: 1, train_loss: 1.0402, test_loss: 1.0815, test_f1: 0.4497
 epoch: 2, train_loss: 0.9957, test_loss: 1.0749, test_f1: 0.4650
 epoch: 3, train_loss: 0.9678, test_loss: 1.0775, test_f1: 0.4822
 epoch: 4, train_loss: 0.9695, test_loss: 1.0164, test_f1: 0.5231
 epoch: 5, train_loss: 0.9401, test_loss: 1.0347, test_f1: 0.4936
 epoch: 6, train_loss: 0.9355, test_loss: 1.0489, test_f1: 0.5497
 epoch: 7, train_loss: 0.9250, test_loss: 1.0151, test_f1: 0.5447
 epoch: 8, train_loss: 0.9091, test_loss: 1.0052, test_f1: 0.5047
 epoch: 9, train_loss: 0.8893, test_loss: 0.9934, test_f1: 0.4805
 epoch: 10, train_loss: 0.8837, test_loss: 1.0207, test_f1: 0.5526
 epoch: 11, train_loss: 0.8796, test_loss: 0.9988, test_f1: 0.5680
 epoch: 12, train_loss: 0.8614, test_loss: 1.0015, test_f1: 0.5464
 epoch: 13, train_loss: 0.8289, test_loss: 0.9697, test_f1: 0.5403
 epoch: 14, train_loss: 0.8206, test_loss: 0.9797, test_f1: 0.5660
 epoch: 15, train_loss: 0.8043, test_loss: 0.9604, test_f1: 0.5827
 epoch: 16, train_loss: 0.8157, test_loss: 0.9730, test_f1: 0.5886
 epoch: 17, train_loss: 0.8001, test_loss: 0.9704, test_f1: 0.5757
 epoch: 18, train_loss: 0.7773, test_loss: 0.9549, test_f1: 0.5924
 epoch: 19, train_loss: 0.7767, test_loss: 0.9847, test_f1: 0.6173
 epoch: 20, train_loss: 0.7520, test_loss: 0.9992, test_f1: 0.6241
 epoch: 21, train_loss: 0.7633, test_loss: 0.9964, test_f1: 0.6092
 epoch: 22, train_loss: 0.7281, test_loss: 0.9799, test_f1: 0.5812
 epoch: 23, train_loss: 0.7359, test_loss: 1.0670, test_f1: 0.5396
 epoch: 24, train_loss: 0.7386, test_loss: 0.9518, test_f1: 0.5980
 epoch: 25, train_loss: 0.7157, test_loss: 1.0968, test_f1: 0.5634
 epoch: 26, train_loss: 0.7085, test_loss: 1.0348, test_f1: 0.6134
 epoch: 27, train_loss: 0.6747, test_loss: 1.1495, test_f1: 0.5983
 epoch: 28, train_loss: 0.6894, test_loss: 1.1622, test_f1: 0.5789
 epoch: 29, train_loss: 0.6581, test_loss: 1.1523, test_f1: 0.5980
 epoch: 30, train_loss: 0.6491, test_loss: 1.1584, test_f1: 0.6220
 epoch: 31, train_loss: 0.6426, test_loss: 1.2297, test_f1: 0.5306
 epoch: 32, train_loss: 0.6439, test_loss: 1.1930, test_f1: 0.6028
 epoch: 33, train_loss: 0.6518, test_loss: 1.2362, test_f1: 0.5756
 epoch: 34, train_loss: 0.6382, test_loss: 1.2323, test_f1: 0.6148
 epoch: 35, train_loss: 0.6304, test_loss: 1.2133, test_f1: 0.5840
 epoch: 36, train_loss: 0.6227, test_loss: 1.2228, test_f1: 0.6124
 epoch: 37, train_loss: 0.6080, test_loss: 1.1965, test_f1: 0.5885
 epoch: 38, train_loss: 0.5840, test_loss: 1.3174, test_f1: 0.6282
 epoch: 39, train_loss: 0.5887, test_loss: 1.4357, test_f1: 0.6175
 epoch: 40, train_loss: 0.5886, test_loss: 1.3688, test_f1: 0.6130
 epoch: 41, train_loss: 0.5446, test_loss: 1.3434, test_f1: 0.6171
 epoch: 42, train_loss: 0.5426, test_loss: 1.3556, test_f1: 0.6000
 epoch: 43, train_loss: 0.5716, test_loss: 1.2569, test_f1: 0.6289
 epoch: 44, train_loss: 0.5691, test_loss: 1.2808, test_f1: 0.6136
 epoch: 45, train_loss: 0.5475, test_loss: 1.4467, test_f1: 0.5958
 epoch: 46, train_loss: 0.5539, test_loss: 1.3163, test_f1: 0.6168
 epoch: 47, train_loss: 0.5095, test_loss: 1.3103, test_f1: 0.6188
 epoch: 48, train_loss: 0.5401, test_loss: 1.4762, test_f1: 0.6106
 epoch: 49, train_loss: 0.5449, test_loss: 1.3723, test_f1: 0.6107
 epoch: 50, train_loss: 0.5553, test_loss: 1.3087, test_f1: 0.6397
 epoch: 51, train_loss: 0.4899, test_loss: 1.3475, test_f1: 0.6169
 epoch: 52, train_loss: 0.4670, test_loss: 1.4134, test_f1: 0.6084
 epoch: 53, train_loss: 0.4753, test_loss: 1.4328, test_f1: 0.5995
 epoch: 54, train_loss: 0.4424, test_loss: 1.4507, test_f1: 0.6048
 epoch: 55, train_loss: 0.4393, test_loss: 1.4727, test_f1: 0.6135
 epoch: 56, train_loss: 0.4141, test_loss: 1.5976, test_f1: 0.6248
 epoch: 57, train_loss: 0.4279, test_loss: 1.4481, test_f1: 0.6079
 epoch: 58, train_loss: 0.4319, test_loss: 1.5499, test_f1: 0.6393
 epoch: 59, train_loss: 0.4119, test_loss: 1.5620, test_f1: 0.5924
 epoch: 60, train_loss: 0.4145, test_loss: 1.5334, test_f1: 0.6369
 epoch: 61, train_loss: 0.4344, test_loss: 1.5301, test_f1: 0.6007
 epoch: 62, train_loss: 0.4127, test_loss: 1.6063, test_f1: 0.6266
 epoch: 63, train_loss: 0.4129, test_loss: 1.7565, test_f1: 0.5924
 epoch: 64, train_loss: 0.4133, test_loss: 1.7662, test_f1: 0.6189
 epoch: 65, train_loss: 0.3822, test_loss: 1.7278, test_f1: 0.6082
 epoch: 66, train_loss: 0.4188, test_loss: 1.7323, test_f1: 0.6076
 epoch: 67, train_loss: 0.3994, test_loss: 1.6528, test_f1: 0.6370
 epoch: 68, train_loss: 0.3809, test_loss: 1.8028, test_f1: 0.6095
 epoch: 69, train_loss: 0.3846, test_loss: 1.7385, test_f1: 0.6117
 epoch: 70, train_loss: 0.4000, test_loss: 1.9155, test_f1: 0.6155
 epoch: 71, train_loss: 0.3664, test_loss: 1.7783, test_f1: 0.6344
 epoch: 72, train_loss: 0.3907, test_loss: 1.7467, test_f1: 0.6285
 epoch: 73, train_loss: 0.3671, test_loss: 1.7832, test_f1: 0.6315
 epoch: 74, train_loss: 0.3453, test_loss: 1.8150, test_f1: 0.6104
 epoch: 75, train_loss: 0.3788, test_loss: 1.8402, test_f1: 0.6100
 epoch: 76, train_loss: 0.3843, test_loss: 1.7866, test_f1: 0.6063
 epoch: 77, train_loss: 0.3562, test_loss: 1.9791, test_f1: 0.6075
 epoch: 78, train_loss: 0.3454, test_loss: 1.9803, test_f1: 0.6188
 epoch: 79, train_loss: 0.3493, test_loss: 1.8624, test_f1: 0.6301
 epoch: 80, train_loss: 0.3559, test_loss: 1.8352, test_f1: 0.6306
 epoch: 81, train_loss: 0.3484, test_loss: 1.8979, test_f1: 0.6138
 epoch: 82, train_loss: 0.3888, test_loss: 2.0544, test_f1: 0.5889
 epoch: 83, train_loss: 0.3530, test_loss: 1.9387, test_f1: 0.6105
 epoch: 84, train_loss: 0.3524, test_loss: 1.9810, test_f1: 0.5928
 epoch: 85, train_loss: 0.3320, test_loss: 2.0649, test_f1: 0.6048
 epoch: 86, train_loss: 0.3446, test_loss: 2.0603, test_f1: 0.5989
 epoch: 87, train_loss: 0.3325, test_loss: 1.9560, test_f1: 0.6159
 epoch: 88, train_loss: 0.3074, test_loss: 2.0357, test_f1: 0.6195
 epoch: 89, train_loss: 0.3353, test_loss: 2.0118, test_f1: 0.6112
 epoch: 90, train_loss: 0.3313, test_loss: 2.0275, test_f1: 0.6168
 epoch: 91, train_loss: 0.3279, test_loss: 2.1315, test_f1: 0.6179
 epoch: 92, train_loss: 0.3372, test_loss: 2.1633, test_f1: 0.5841
 epoch: 93, train_loss: 0.3230, test_loss: 2.1451, test_f1: 0.5700
 epoch: 94, train_loss: 0.3146, test_loss: 2.1059, test_f1: 0.5924
 epoch: 95, train_loss: 0.3334, test_loss: 2.2281, test_f1: 0.6001
 epoch: 96, train_loss: 0.3280, test_loss: 2.3872, test_f1: 0.5779
 epoch: 97, train_loss: 0.3258, test_loss: 2.2386, test_f1: 0.6164
 epoch: 98, train_loss: 0.3310, test_loss: 2.0329, test_f1: 0.6213
 epoch: 99, train_loss: 0.3156, test_loss: 2.2291, test_f1: 0.5871
##################ITERATION #5 ****************************************
 epoch: 0, train_loss: 1.2978, test_loss: 1.3827, test_f1: 0.1454
 epoch: 1, train_loss: 1.0835, test_loss: 1.0708, test_f1: 0.5051
 epoch: 2, train_loss: 1.0246, test_loss: 1.0367, test_f1: 0.5172
 epoch: 3, train_loss: 0.9894, test_loss: 1.0114, test_f1: 0.5609
 epoch: 4, train_loss: 0.9390, test_loss: 1.0192, test_f1: 0.5370
 epoch: 5, train_loss: 0.9158, test_loss: 1.0467, test_f1: 0.4992
 epoch: 6, train_loss: 0.8933, test_loss: 1.0357, test_f1: 0.5377
 epoch: 7, train_loss: 0.8687, test_loss: 0.9901, test_f1: 0.5962
 epoch: 8, train_loss: 0.8548, test_loss: 1.0054, test_f1: 0.5390
 epoch: 9, train_loss: 0.8604, test_loss: 1.0211, test_f1: 0.5584
 epoch: 10, train_loss: 0.8114, test_loss: 1.0122, test_f1: 0.5818
 epoch: 11, train_loss: 0.8119, test_loss: 0.9878, test_f1: 0.6192
 epoch: 12, train_loss: 0.8213, test_loss: 0.9871, test_f1: 0.5706
 epoch: 13, train_loss: 0.8287, test_loss: 0.9582, test_f1: 0.5871
 epoch: 14, train_loss: 0.7924, test_loss: 0.9707, test_f1: 0.6268
 epoch: 15, train_loss: 0.7837, test_loss: 0.9430, test_f1: 0.6219
 epoch: 16, train_loss: 0.7584, test_loss: 0.9923, test_f1: 0.6064
 epoch: 17, train_loss: 0.7504, test_loss: 0.9849, test_f1: 0.6047
 epoch: 18, train_loss: 0.7310, test_loss: 0.9523, test_f1: 0.6062
 epoch: 19, train_loss: 0.7444, test_loss: 0.9610, test_f1: 0.6291
 epoch: 20, train_loss: 0.7578, test_loss: 0.9798, test_f1: 0.5844
 epoch: 21, train_loss: 0.7123, test_loss: 0.9461, test_f1: 0.6251
 epoch: 22, train_loss: 0.6865, test_loss: 0.9584, test_f1: 0.6141
 epoch: 23, train_loss: 0.6823, test_loss: 1.0348, test_f1: 0.5848
 epoch: 24, train_loss: 0.6985, test_loss: 1.0134, test_f1: 0.6166
 epoch: 25, train_loss: 0.6613, test_loss: 0.9907, test_f1: 0.6026
 epoch: 26, train_loss: 0.6525, test_loss: 1.0322, test_f1: 0.6003
 epoch: 27, train_loss: 0.6691, test_loss: 0.9981, test_f1: 0.5906
 epoch: 28, train_loss: 0.6616, test_loss: 0.9817, test_f1: 0.6372
 epoch: 29, train_loss: 0.6518, test_loss: 0.9860, test_f1: 0.6433
 epoch: 30, train_loss: 0.6137, test_loss: 1.0150, test_f1: 0.6290
 epoch: 31, train_loss: 0.6220, test_loss: 1.0209, test_f1: 0.6466
 epoch: 32, train_loss: 0.6065, test_loss: 0.9907, test_f1: 0.6328
 epoch: 33, train_loss: 0.6066, test_loss: 0.9680, test_f1: 0.6453
 epoch: 34, train_loss: 0.6118, test_loss: 1.1578, test_f1: 0.5858
 epoch: 35, train_loss: 0.6034, test_loss: 1.0469, test_f1: 0.6441
 epoch: 36, train_loss: 0.5971, test_loss: 1.0457, test_f1: 0.6479
 epoch: 37, train_loss: 0.5892, test_loss: 1.1099, test_f1: 0.6083
 epoch: 38, train_loss: 0.5776, test_loss: 1.0889, test_f1: 0.6299
 epoch: 39, train_loss: 0.6089, test_loss: 1.0763, test_f1: 0.6433
 epoch: 40, train_loss: 0.5734, test_loss: 1.0841, test_f1: 0.6333
 epoch: 41, train_loss: 0.5991, test_loss: 1.0883, test_f1: 0.6396
 epoch: 42, train_loss: 0.5616, test_loss: 1.1905, test_f1: 0.6023
 epoch: 43, train_loss: 0.5327, test_loss: 1.2139, test_f1: 0.6179
 epoch: 44, train_loss: 0.5407, test_loss: 1.2419, test_f1: 0.6238
 epoch: 45, train_loss: 0.5427, test_loss: 1.1404, test_f1: 0.6410
 epoch: 46, train_loss: 0.5316, test_loss: 1.1228, test_f1: 0.6656
 epoch: 47, train_loss: 0.5316, test_loss: 1.0511, test_f1: 0.6804
 epoch: 48, train_loss: 0.5255, test_loss: 1.1311, test_f1: 0.6489
 epoch: 49, train_loss: 0.5355, test_loss: 1.0862, test_f1: 0.6261
 epoch: 50, train_loss: 0.5162, test_loss: 1.1774, test_f1: 0.6104
 epoch: 51, train_loss: 0.4831, test_loss: 1.1355, test_f1: 0.6822
 epoch: 52, train_loss: 0.4501, test_loss: 1.1560, test_f1: 0.6428
 epoch: 53, train_loss: 0.4477, test_loss: 1.2079, test_f1: 0.6332
 epoch: 54, train_loss: 0.4435, test_loss: 1.1852, test_f1: 0.6395
 epoch: 55, train_loss: 0.4227, test_loss: 1.2412, test_f1: 0.6189
 epoch: 56, train_loss: 0.4296, test_loss: 1.2353, test_f1: 0.6109
 epoch: 57, train_loss: 0.4473, test_loss: 1.3180, test_f1: 0.6171
 epoch: 58, train_loss: 0.4040, test_loss: 1.2058, test_f1: 0.6324
 epoch: 59, train_loss: 0.4259, test_loss: 1.2326, test_f1: 0.6403
 epoch: 60, train_loss: 0.4037, test_loss: 1.3307, test_f1: 0.6353
 epoch: 61, train_loss: 0.4043, test_loss: 1.3226, test_f1: 0.6595
 epoch: 62, train_loss: 0.3908, test_loss: 1.2876, test_f1: 0.6416
 epoch: 63, train_loss: 0.4112, test_loss: 1.3474, test_f1: 0.6261
 epoch: 64, train_loss: 0.4026, test_loss: 1.4206, test_f1: 0.6099
 epoch: 65, train_loss: 0.3835, test_loss: 1.3933, test_f1: 0.6238
 epoch: 66, train_loss: 0.3700, test_loss: 1.4159, test_f1: 0.6441
 epoch: 67, train_loss: 0.3788, test_loss: 1.3168, test_f1: 0.6418
 epoch: 68, train_loss: 0.3939, test_loss: 1.2868, test_f1: 0.6497
 epoch: 69, train_loss: 0.3630, test_loss: 1.4005, test_f1: 0.6222
 epoch: 70, train_loss: 0.3834, test_loss: 1.3359, test_f1: 0.6390
 epoch: 71, train_loss: 0.3724, test_loss: 1.3901, test_f1: 0.6370
 epoch: 72, train_loss: 0.3667, test_loss: 1.3524, test_f1: 0.6543
 epoch: 73, train_loss: 0.3718, test_loss: 1.3470, test_f1: 0.6610
 epoch: 74, train_loss: 0.3914, test_loss: 1.3800, test_f1: 0.6506
 epoch: 75, train_loss: 0.3721, test_loss: 1.4030, test_f1: 0.6407
 epoch: 76, train_loss: 0.3658, test_loss: 1.4513, test_f1: 0.6231
 epoch: 77, train_loss: 0.3553, test_loss: 1.5179, test_f1: 0.6233
 epoch: 78, train_loss: 0.3299, test_loss: 1.5693, test_f1: 0.6061
 epoch: 79, train_loss: 0.3502, test_loss: 1.3680, test_f1: 0.6242
 epoch: 80, train_loss: 0.3856, test_loss: 1.5569, test_f1: 0.6260
 epoch: 81, train_loss: 0.3503, test_loss: 1.5873, test_f1: 0.6157
 epoch: 82, train_loss: 0.3904, test_loss: 1.5073, test_f1: 0.6223
 epoch: 83, train_loss: 0.3173, test_loss: 1.4398, test_f1: 0.6535
 epoch: 84, train_loss: 0.3459, test_loss: 1.6060, test_f1: 0.6269
 epoch: 85, train_loss: 0.3468, test_loss: 1.5808, test_f1: 0.6323
 epoch: 86, train_loss: 0.3370, test_loss: 1.5628, test_f1: 0.6105
 epoch: 87, train_loss: 0.3405, test_loss: 1.6008, test_f1: 0.6167
 epoch: 88, train_loss: 0.3246, test_loss: 1.7283, test_f1: 0.6115
 epoch: 89, train_loss: 0.3283, test_loss: 1.7044, test_f1: 0.6192
 epoch: 90, train_loss: 0.3432, test_loss: 1.5671, test_f1: 0.6272
 epoch: 91, train_loss: 0.3140, test_loss: 1.5569, test_f1: 0.6498
 epoch: 92, train_loss: 0.3330, test_loss: 1.6484, test_f1: 0.5846
 epoch: 93, train_loss: 0.3183, test_loss: 1.6696, test_f1: 0.6503
 epoch: 94, train_loss: 0.3051, test_loss: 1.7590, test_f1: 0.6081
 epoch: 95, train_loss: 0.3254, test_loss: 1.6806, test_f1: 0.5964
 epoch: 96, train_loss: 0.3215, test_loss: 1.7353, test_f1: 0.6001
 epoch: 97, train_loss: 0.3385, test_loss: 1.6807, test_f1: 0.6209
 epoch: 98, train_loss: 0.2990, test_loss: 1.7565, test_f1: 0.6130
 epoch: 99, train_loss: 0.3122, test_loss: 1.6099, test_f1: 0.6447
##################ITERATION #6 ****************************************
 epoch: 0, train_loss: 1.2432, test_loss: 2.1907, test_f1: 0.0847
 epoch: 1, train_loss: 1.0550, test_loss: 1.1457, test_f1: 0.4375
 epoch: 2, train_loss: 1.0117, test_loss: 1.0841, test_f1: 0.4988
 epoch: 3, train_loss: 0.9710, test_loss: 1.0321, test_f1: 0.5646
 epoch: 4, train_loss: 0.9642, test_loss: 1.0614, test_f1: 0.5101
 epoch: 5, train_loss: 0.9407, test_loss: 1.0519, test_f1: 0.5848
 epoch: 6, train_loss: 0.9507, test_loss: 1.0046, test_f1: 0.6156
 epoch: 7, train_loss: 0.9134, test_loss: 1.0273, test_f1: 0.5496
 epoch: 8, train_loss: 0.9021, test_loss: 1.0104, test_f1: 0.5764
 epoch: 9, train_loss: 0.8677, test_loss: 0.9811, test_f1: 0.5894
 epoch: 10, train_loss: 0.8895, test_loss: 0.9891, test_f1: 0.5628
 epoch: 11, train_loss: 0.8458, test_loss: 0.9941, test_f1: 0.6097
 epoch: 12, train_loss: 0.8405, test_loss: 0.9925, test_f1: 0.5780
 epoch: 13, train_loss: 0.8298, test_loss: 0.9472, test_f1: 0.6170
 epoch: 14, train_loss: 0.8202, test_loss: 0.9733, test_f1: 0.5952
 epoch: 15, train_loss: 0.8003, test_loss: 0.9700, test_f1: 0.5983
 epoch: 16, train_loss: 0.8003, test_loss: 1.0050, test_f1: 0.5983
 epoch: 17, train_loss: 0.7679, test_loss: 0.9791, test_f1: 0.5879
 epoch: 18, train_loss: 0.7545, test_loss: 0.9899, test_f1: 0.5915
 epoch: 19, train_loss: 0.7319, test_loss: 1.0339, test_f1: 0.6187
 epoch: 20, train_loss: 0.7497, test_loss: 0.9795, test_f1: 0.5988
 epoch: 21, train_loss: 0.7436, test_loss: 1.0787, test_f1: 0.5801
 epoch: 22, train_loss: 0.7176, test_loss: 1.0423, test_f1: 0.6022
 epoch: 23, train_loss: 0.7173, test_loss: 1.0322, test_f1: 0.6147
 epoch: 24, train_loss: 0.6818, test_loss: 1.1214, test_f1: 0.5909
 epoch: 25, train_loss: 0.6903, test_loss: 1.0857, test_f1: 0.5884
 epoch: 26, train_loss: 0.6878, test_loss: 1.0988, test_f1: 0.6000
 epoch: 27, train_loss: 0.6578, test_loss: 1.1839, test_f1: 0.5737
 epoch: 28, train_loss: 0.6793, test_loss: 1.1675, test_f1: 0.5482
 epoch: 29, train_loss: 0.6681, test_loss: 1.1859, test_f1: 0.5319
 epoch: 30, train_loss: 0.6505, test_loss: 1.0752, test_f1: 0.6118
 epoch: 31, train_loss: 0.6624, test_loss: 1.1018, test_f1: 0.5896
 epoch: 32, train_loss: 0.6384, test_loss: 1.2613, test_f1: 0.5884
 epoch: 33, train_loss: 0.6403, test_loss: 1.1351, test_f1: 0.6219
 epoch: 34, train_loss: 0.6200, test_loss: 1.2709, test_f1: 0.5170
 epoch: 35, train_loss: 0.6106, test_loss: 1.2120, test_f1: 0.5825
 epoch: 36, train_loss: 0.6123, test_loss: 1.1526, test_f1: 0.6186
 epoch: 37, train_loss: 0.6196, test_loss: 1.1891, test_f1: 0.6299
 epoch: 38, train_loss: 0.6299, test_loss: 1.3564, test_f1: 0.5822
 epoch: 39, train_loss: 0.5811, test_loss: 1.1055, test_f1: 0.6214
 epoch: 40, train_loss: 0.6198, test_loss: 1.2775, test_f1: 0.5463
 epoch: 41, train_loss: 0.6027, test_loss: 1.2063, test_f1: 0.6129
 epoch: 42, train_loss: 0.5617, test_loss: 1.2174, test_f1: 0.5813
 epoch: 43, train_loss: 0.5779, test_loss: 1.2996, test_f1: 0.6004
 epoch: 44, train_loss: 0.5549, test_loss: 1.3701, test_f1: 0.5987
 epoch: 45, train_loss: 0.5475, test_loss: 1.2285, test_f1: 0.5971
 epoch: 46, train_loss: 0.5557, test_loss: 1.2907, test_f1: 0.6103
 epoch: 47, train_loss: 0.5311, test_loss: 1.2367, test_f1: 0.5866
 epoch: 48, train_loss: 0.5399, test_loss: 1.4273, test_f1: 0.6212
 epoch: 49, train_loss: 0.5286, test_loss: 1.4150, test_f1: 0.5970
 epoch: 50, train_loss: 0.5507, test_loss: 1.4466, test_f1: 0.5903
 epoch: 51, train_loss: 0.5198, test_loss: 1.3472, test_f1: 0.5911
 epoch: 52, train_loss: 0.4791, test_loss: 1.4204, test_f1: 0.5913
 epoch: 53, train_loss: 0.4712, test_loss: 1.4194, test_f1: 0.5944
 epoch: 54, train_loss: 0.4606, test_loss: 1.4093, test_f1: 0.5812
 epoch: 55, train_loss: 0.4576, test_loss: 1.5251, test_f1: 0.5516
 epoch: 56, train_loss: 0.4608, test_loss: 1.4532, test_f1: 0.6054
 epoch: 57, train_loss: 0.4543, test_loss: 1.3754, test_f1: 0.5875
 epoch: 58, train_loss: 0.4634, test_loss: 1.5788, test_f1: 0.5857
 epoch: 59, train_loss: 0.4298, test_loss: 1.4949, test_f1: 0.6183
 epoch: 60, train_loss: 0.4247, test_loss: 1.4795, test_f1: 0.6104
 epoch: 61, train_loss: 0.4368, test_loss: 1.5207, test_f1: 0.6141
 epoch: 62, train_loss: 0.4294, test_loss: 1.6959, test_f1: 0.5817
 epoch: 63, train_loss: 0.4165, test_loss: 1.5078, test_f1: 0.5896
 epoch: 64, train_loss: 0.4397, test_loss: 1.5418, test_f1: 0.6100
 epoch: 65, train_loss: 0.4346, test_loss: 1.6284, test_f1: 0.5923
 epoch: 66, train_loss: 0.4184, test_loss: 1.7180, test_f1: 0.5918
 epoch: 67, train_loss: 0.4193, test_loss: 1.7356, test_f1: 0.5823
 epoch: 68, train_loss: 0.3884, test_loss: 1.5916, test_f1: 0.5889
 epoch: 69, train_loss: 0.4169, test_loss: 1.5714, test_f1: 0.5842
 epoch: 70, train_loss: 0.4134, test_loss: 1.7792, test_f1: 0.5656
 epoch: 71, train_loss: 0.3911, test_loss: 1.7075, test_f1: 0.5945
 epoch: 72, train_loss: 0.4191, test_loss: 1.6795, test_f1: 0.5823
 epoch: 73, train_loss: 0.3919, test_loss: 1.7522, test_f1: 0.5559
 epoch: 74, train_loss: 0.3944, test_loss: 1.7448, test_f1: 0.5798
 epoch: 75, train_loss: 0.3779, test_loss: 1.8312, test_f1: 0.5729
 epoch: 76, train_loss: 0.3700, test_loss: 2.0068, test_f1: 0.5771
 epoch: 77, train_loss: 0.3829, test_loss: 1.9775, test_f1: 0.5650
 epoch: 78, train_loss: 0.4006, test_loss: 1.8200, test_f1: 0.5777
 epoch: 79, train_loss: 0.3984, test_loss: 1.7762, test_f1: 0.6075
 epoch: 80, train_loss: 0.3777, test_loss: 1.9659, test_f1: 0.5900
 epoch: 81, train_loss: 0.3679, test_loss: 1.6463, test_f1: 0.6019
 epoch: 82, train_loss: 0.3765, test_loss: 1.8842, test_f1: 0.5833
 epoch: 83, train_loss: 0.3589, test_loss: 1.9614, test_f1: 0.5612
 epoch: 84, train_loss: 0.3647, test_loss: 1.8361, test_f1: 0.5877
 epoch: 85, train_loss: 0.3673, test_loss: 1.7418, test_f1: 0.6023
 epoch: 86, train_loss: 0.3660, test_loss: 1.8448, test_f1: 0.5872
 epoch: 87, train_loss: 0.3674, test_loss: 1.8906, test_f1: 0.5932
 epoch: 88, train_loss: 0.3670, test_loss: 1.9626, test_f1: 0.5828
 epoch: 89, train_loss: 0.3446, test_loss: 1.7655, test_f1: 0.6325
 epoch: 90, train_loss: 0.3236, test_loss: 2.0358, test_f1: 0.6156
 epoch: 91, train_loss: 0.3086, test_loss: 1.9497, test_f1: 0.6225
 epoch: 92, train_loss: 0.3632, test_loss: 2.0818, test_f1: 0.6029
 epoch: 93, train_loss: 0.3509, test_loss: 1.7979, test_f1: 0.6329
 epoch: 94, train_loss: 0.3258, test_loss: 1.9471, test_f1: 0.5709
 epoch: 95, train_loss: 0.3446, test_loss: 1.8976, test_f1: 0.6196
 epoch: 96, train_loss: 0.3159, test_loss: 1.9021, test_f1: 0.6370
 epoch: 97, train_loss: 0.3313, test_loss: 1.8938, test_f1: 0.6166
 epoch: 98, train_loss: 0.3052, test_loss: 2.1339, test_f1: 0.5903
 epoch: 99, train_loss: 0.3504, test_loss: 2.0979, test_f1: 0.5755
##################ITERATION #7 ****************************************
 epoch: 0, train_loss: 1.3554, test_loss: 1.2814, test_f1: 0.3000
 epoch: 1, train_loss: 1.1481, test_loss: 1.1135, test_f1: 0.5130
 epoch: 2, train_loss: 1.0543, test_loss: 1.0916, test_f1: 0.4998
 epoch: 3, train_loss: 0.9980, test_loss: 1.0538, test_f1: 0.4872
 epoch: 4, train_loss: 0.9852, test_loss: 1.0657, test_f1: 0.5346
 epoch: 5, train_loss: 0.9441, test_loss: 1.0156, test_f1: 0.5610
 epoch: 6, train_loss: 0.9285, test_loss: 1.0047, test_f1: 0.5702
 epoch: 7, train_loss: 0.9207, test_loss: 1.0105, test_f1: 0.5403
 epoch: 8, train_loss: 0.9154, test_loss: 1.0001, test_f1: 0.5569
 epoch: 9, train_loss: 0.9217, test_loss: 0.9727, test_f1: 0.5887
 epoch: 10, train_loss: 0.9073, test_loss: 0.9711, test_f1: 0.5829
 epoch: 11, train_loss: 0.8692, test_loss: 0.9746, test_f1: 0.5601
 epoch: 12, train_loss: 0.8738, test_loss: 0.9594, test_f1: 0.5849
 epoch: 13, train_loss: 0.8396, test_loss: 0.9769, test_f1: 0.5354
 epoch: 14, train_loss: 0.8269, test_loss: 0.9777, test_f1: 0.5565
 epoch: 15, train_loss: 0.8278, test_loss: 0.9941, test_f1: 0.5872
 epoch: 16, train_loss: 0.8069, test_loss: 0.9985, test_f1: 0.5870
 epoch: 17, train_loss: 0.8034, test_loss: 0.9877, test_f1: 0.5938
 epoch: 18, train_loss: 0.7921, test_loss: 0.9572, test_f1: 0.6462
 epoch: 19, train_loss: 0.7700, test_loss: 0.9774, test_f1: 0.6278
 epoch: 20, train_loss: 0.7469, test_loss: 0.9940, test_f1: 0.6090
 epoch: 21, train_loss: 0.7275, test_loss: 1.0312, test_f1: 0.6079
 epoch: 22, train_loss: 0.7238, test_loss: 0.9887, test_f1: 0.6348
 epoch: 23, train_loss: 0.7328, test_loss: 1.1025, test_f1: 0.5827
 epoch: 24, train_loss: 0.7198, test_loss: 1.0228, test_f1: 0.6114
 epoch: 25, train_loss: 0.7174, test_loss: 1.0517, test_f1: 0.5910
 epoch: 26, train_loss: 0.7059, test_loss: 1.0326, test_f1: 0.6234
 epoch: 27, train_loss: 0.6807, test_loss: 1.0536, test_f1: 0.6036
 epoch: 28, train_loss: 0.6960, test_loss: 1.1157, test_f1: 0.5897
 epoch: 29, train_loss: 0.6680, test_loss: 1.1127, test_f1: 0.5913
 epoch: 30, train_loss: 0.6864, test_loss: 1.0809, test_f1: 0.6259
 epoch: 31, train_loss: 0.6652, test_loss: 1.0959, test_f1: 0.5996
 epoch: 32, train_loss: 0.6548, test_loss: 1.0420, test_f1: 0.6361
 epoch: 33, train_loss: 0.6406, test_loss: 1.1140, test_f1: 0.5954
 epoch: 34, train_loss: 0.6423, test_loss: 1.1895, test_f1: 0.6055
 epoch: 35, train_loss: 0.6248, test_loss: 1.1747, test_f1: 0.6067
 epoch: 36, train_loss: 0.6143, test_loss: 1.0997, test_f1: 0.6256
 epoch: 37, train_loss: 0.6155, test_loss: 1.1314, test_f1: 0.6214
 epoch: 38, train_loss: 0.5954, test_loss: 1.1816, test_f1: 0.6041
 epoch: 39, train_loss: 0.5934, test_loss: 1.0821, test_f1: 0.6536
 epoch: 40, train_loss: 0.5761, test_loss: 1.1906, test_f1: 0.6149
 epoch: 41, train_loss: 0.5625, test_loss: 1.1919, test_f1: 0.6156
 epoch: 42, train_loss: 0.5912, test_loss: 1.2143, test_f1: 0.5961
 epoch: 43, train_loss: 0.5591, test_loss: 1.1797, test_f1: 0.6040
 epoch: 44, train_loss: 0.5518, test_loss: 1.2836, test_f1: 0.6121
 epoch: 45, train_loss: 0.5726, test_loss: 1.2480, test_f1: 0.6282
 epoch: 46, train_loss: 0.5447, test_loss: 1.2028, test_f1: 0.6018
 epoch: 47, train_loss: 0.5733, test_loss: 1.1772, test_f1: 0.6380
 epoch: 48, train_loss: 0.5564, test_loss: 1.2735, test_f1: 0.6232
 epoch: 49, train_loss: 0.5503, test_loss: 1.2569, test_f1: 0.6170
 epoch: 50, train_loss: 0.5536, test_loss: 1.4913, test_f1: 0.5587
 epoch: 51, train_loss: 0.4968, test_loss: 1.3199, test_f1: 0.6085
 epoch: 52, train_loss: 0.4892, test_loss: 1.3508, test_f1: 0.5995
 epoch: 53, train_loss: 0.4730, test_loss: 1.3062, test_f1: 0.6142
 epoch: 54, train_loss: 0.4504, test_loss: 1.3251, test_f1: 0.6359
 epoch: 55, train_loss: 0.4545, test_loss: 1.3870, test_f1: 0.6097
 epoch: 56, train_loss: 0.4311, test_loss: 1.3339, test_f1: 0.6258
 epoch: 57, train_loss: 0.4340, test_loss: 1.3680, test_f1: 0.6025
 epoch: 58, train_loss: 0.4307, test_loss: 1.4519, test_f1: 0.6221
 epoch: 59, train_loss: 0.4242, test_loss: 1.5022, test_f1: 0.6050
 epoch: 60, train_loss: 0.4207, test_loss: 1.3797, test_f1: 0.6294
 epoch: 61, train_loss: 0.4523, test_loss: 1.4600, test_f1: 0.6121
 epoch: 62, train_loss: 0.4160, test_loss: 1.4771, test_f1: 0.6170
 epoch: 63, train_loss: 0.4104, test_loss: 1.4356, test_f1: 0.6325
 epoch: 64, train_loss: 0.4218, test_loss: 1.5516, test_f1: 0.6279
 epoch: 65, train_loss: 0.4301, test_loss: 1.5492, test_f1: 0.6221
 epoch: 66, train_loss: 0.3960, test_loss: 1.6147, test_f1: 0.6038
 epoch: 67, train_loss: 0.4022, test_loss: 1.6375, test_f1: 0.6193
 epoch: 68, train_loss: 0.3827, test_loss: 1.5675, test_f1: 0.6058
 epoch: 69, train_loss: 0.4141, test_loss: 1.6649, test_f1: 0.6114
 epoch: 70, train_loss: 0.3833, test_loss: 1.5686, test_f1: 0.6276
 epoch: 71, train_loss: 0.4145, test_loss: 1.6024, test_f1: 0.5988
 epoch: 72, train_loss: 0.4203, test_loss: 1.6025, test_f1: 0.6252
 epoch: 73, train_loss: 0.3893, test_loss: 1.5502, test_f1: 0.6107
 epoch: 74, train_loss: 0.3686, test_loss: 1.5615, test_f1: 0.6455
 epoch: 75, train_loss: 0.3888, test_loss: 1.5709, test_f1: 0.6161
 epoch: 76, train_loss: 0.3916, test_loss: 1.7252, test_f1: 0.6075
 epoch: 77, train_loss: 0.3691, test_loss: 1.6127, test_f1: 0.6192
 epoch: 78, train_loss: 0.3689, test_loss: 1.6715, test_f1: 0.6204
 epoch: 79, train_loss: 0.3840, test_loss: 1.6258, test_f1: 0.6285
 epoch: 80, train_loss: 0.3652, test_loss: 1.5680, test_f1: 0.6399
 epoch: 81, train_loss: 0.3570, test_loss: 1.7036, test_f1: 0.6154
 epoch: 82, train_loss: 0.3575, test_loss: 1.7855, test_f1: 0.5914
 epoch: 83, train_loss: 0.3524, test_loss: 1.8111, test_f1: 0.6063
 epoch: 84, train_loss: 0.3388, test_loss: 1.7097, test_f1: 0.6022
 epoch: 85, train_loss: 0.3586, test_loss: 1.8061, test_f1: 0.6459
 epoch: 86, train_loss: 0.3851, test_loss: 1.8453, test_f1: 0.5936
 epoch: 87, train_loss: 0.3716, test_loss: 1.7637, test_f1: 0.6211
 epoch: 88, train_loss: 0.3709, test_loss: 1.7145, test_f1: 0.6045
 epoch: 89, train_loss: 0.3275, test_loss: 1.8109, test_f1: 0.6098
 epoch: 90, train_loss: 0.3591, test_loss: 1.7166, test_f1: 0.6049
 epoch: 91, train_loss: 0.3413, test_loss: 1.7276, test_f1: 0.6017
 epoch: 92, train_loss: 0.3318, test_loss: 1.8503, test_f1: 0.6269
 epoch: 93, train_loss: 0.3256, test_loss: 1.7658, test_f1: 0.6237
 epoch: 94, train_loss: 0.3533, test_loss: 1.7880, test_f1: 0.6266
 epoch: 95, train_loss: 0.3220, test_loss: 1.7978, test_f1: 0.5993
 epoch: 96, train_loss: 0.3659, test_loss: 1.8704, test_f1: 0.6074
 epoch: 97, train_loss: 0.3391, test_loss: 1.7948, test_f1: 0.5987
 epoch: 98, train_loss: 0.3120, test_loss: 1.8368, test_f1: 0.6048
 epoch: 99, train_loss: 0.3129, test_loss: 1.8603, test_f1: 0.5999
##################ITERATION #8 ****************************************
 epoch: 0, train_loss: 1.2929, test_loss: 1.4877, test_f1: 0.1579
 epoch: 1, train_loss: 1.0029, test_loss: 1.0507, test_f1: 0.4960
 epoch: 2, train_loss: 0.9603, test_loss: 1.0721, test_f1: 0.5259
 epoch: 3, train_loss: 0.9185, test_loss: 1.0930, test_f1: 0.5316
 epoch: 4, train_loss: 0.9097, test_loss: 1.0671, test_f1: 0.5652
 epoch: 5, train_loss: 0.8949, test_loss: 1.0448, test_f1: 0.5571
 epoch: 6, train_loss: 0.8559, test_loss: 1.0557, test_f1: 0.5331
 epoch: 7, train_loss: 0.8342, test_loss: 1.0670, test_f1: 0.5509
 epoch: 8, train_loss: 0.8088, test_loss: 1.0516, test_f1: 0.5175
 epoch: 9, train_loss: 0.8063, test_loss: 1.0101, test_f1: 0.5332
 epoch: 10, train_loss: 0.8031, test_loss: 1.0633, test_f1: 0.5934
 epoch: 11, train_loss: 0.7724, test_loss: 1.1691, test_f1: 0.5766
 epoch: 12, train_loss: 0.7941, test_loss: 1.1207, test_f1: 0.5632
 epoch: 13, train_loss: 0.7884, test_loss: 1.0110, test_f1: 0.5662
 epoch: 14, train_loss: 0.7713, test_loss: 1.0473, test_f1: 0.5768
 epoch: 15, train_loss: 0.7509, test_loss: 1.0467, test_f1: 0.5710
 epoch: 16, train_loss: 0.7289, test_loss: 1.0875, test_f1: 0.5244
 epoch: 17, train_loss: 0.6972, test_loss: 1.0693, test_f1: 0.5901
 epoch: 18, train_loss: 0.7016, test_loss: 1.0243, test_f1: 0.6008
 epoch: 19, train_loss: 0.6939, test_loss: 1.0184, test_f1: 0.6121
 epoch: 20, train_loss: 0.6689, test_loss: 1.0073, test_f1: 0.5980
 epoch: 21, train_loss: 0.6703, test_loss: 1.0800, test_f1: 0.5912
 epoch: 22, train_loss: 0.6564, test_loss: 1.3336, test_f1: 0.5696
 epoch: 23, train_loss: 0.6365, test_loss: 1.0585, test_f1: 0.5923
 epoch: 24, train_loss: 0.6361, test_loss: 1.0891, test_f1: 0.5572
 epoch: 25, train_loss: 0.6376, test_loss: 1.1901, test_f1: 0.5667
 epoch: 26, train_loss: 0.6506, test_loss: 1.3024, test_f1: 0.5662
 epoch: 27, train_loss: 0.6055, test_loss: 1.1264, test_f1: 0.5991
 epoch: 28, train_loss: 0.5892, test_loss: 1.1787, test_f1: 0.6137
 epoch: 29, train_loss: 0.5891, test_loss: 1.1806, test_f1: 0.5976
 epoch: 30, train_loss: 0.5828, test_loss: 1.2641, test_f1: 0.5723
 epoch: 31, train_loss: 0.5758, test_loss: 1.1919, test_f1: 0.5863
 epoch: 32, train_loss: 0.5874, test_loss: 1.4200, test_f1: 0.5248
 epoch: 33, train_loss: 0.5917, test_loss: 1.2746, test_f1: 0.5928
 epoch: 34, train_loss: 0.5591, test_loss: 1.1362, test_f1: 0.6184
 epoch: 35, train_loss: 0.5354, test_loss: 1.3628, test_f1: 0.5564
 epoch: 36, train_loss: 0.5431, test_loss: 1.4427, test_f1: 0.5582
 epoch: 37, train_loss: 0.5461, test_loss: 1.3489, test_f1: 0.5531
 epoch: 38, train_loss: 0.5322, test_loss: 1.6550, test_f1: 0.5393
 epoch: 39, train_loss: 0.5616, test_loss: 1.4231, test_f1: 0.5808
 epoch: 40, train_loss: 0.5426, test_loss: 1.2941, test_f1: 0.5789
 epoch: 41, train_loss: 0.5343, test_loss: 1.2170, test_f1: 0.6350
 epoch: 42, train_loss: 0.5279, test_loss: 1.2540, test_f1: 0.6168
 epoch: 43, train_loss: 0.5008, test_loss: 1.4134, test_f1: 0.6238
 epoch: 44, train_loss: 0.4831, test_loss: 1.4080, test_f1: 0.6319
 epoch: 45, train_loss: 0.5088, test_loss: 1.2138, test_f1: 0.6263
 epoch: 46, train_loss: 0.5078, test_loss: 1.2670, test_f1: 0.5807
 epoch: 47, train_loss: 0.4675, test_loss: 1.3067, test_f1: 0.6286
 epoch: 48, train_loss: 0.4792, test_loss: 1.3985, test_f1: 0.5858
 epoch: 49, train_loss: 0.5383, test_loss: 1.4676, test_f1: 0.5611
 epoch: 50, train_loss: 0.5196, test_loss: 1.3350, test_f1: 0.6003
 epoch: 51, train_loss: 0.4257, test_loss: 1.3301, test_f1: 0.5987
 epoch: 52, train_loss: 0.4108, test_loss: 1.4241, test_f1: 0.6315
 epoch: 53, train_loss: 0.4261, test_loss: 1.4436, test_f1: 0.6266
 epoch: 54, train_loss: 0.4109, test_loss: 1.4782, test_f1: 0.6252
 epoch: 55, train_loss: 0.3979, test_loss: 1.6301, test_f1: 0.5924
 epoch: 56, train_loss: 0.3950, test_loss: 1.5451, test_f1: 0.6184
 epoch: 57, train_loss: 0.4054, test_loss: 1.5021, test_f1: 0.6181
 epoch: 58, train_loss: 0.3926, test_loss: 1.6548, test_f1: 0.5748
 epoch: 59, train_loss: 0.3858, test_loss: 1.5064, test_f1: 0.6223
 epoch: 60, train_loss: 0.3857, test_loss: 1.6620, test_f1: 0.5929
 epoch: 61, train_loss: 0.3902, test_loss: 1.6234, test_f1: 0.5934
 epoch: 62, train_loss: 0.3545, test_loss: 1.6732, test_f1: 0.6394
 epoch: 63, train_loss: 0.3795, test_loss: 1.5389, test_f1: 0.6165
 epoch: 64, train_loss: 0.3672, test_loss: 1.5627, test_f1: 0.6193
 epoch: 65, train_loss: 0.3729, test_loss: 1.6854, test_f1: 0.6031
 epoch: 66, train_loss: 0.3954, test_loss: 1.6415, test_f1: 0.5922
 epoch: 67, train_loss: 0.3836, test_loss: 1.5838, test_f1: 0.6212
 epoch: 68, train_loss: 0.3719, test_loss: 1.6553, test_f1: 0.6174
 epoch: 69, train_loss: 0.3538, test_loss: 1.7685, test_f1: 0.5984
 epoch: 70, train_loss: 0.3526, test_loss: 1.8786, test_f1: 0.5863
 epoch: 71, train_loss: 0.3395, test_loss: 1.8237, test_f1: 0.5868
 epoch: 72, train_loss: 0.3396, test_loss: 1.7366, test_f1: 0.6005
 epoch: 73, train_loss: 0.3348, test_loss: 1.8067, test_f1: 0.5836
 epoch: 74, train_loss: 0.3291, test_loss: 1.7034, test_f1: 0.6200
 epoch: 75, train_loss: 0.3056, test_loss: 1.7773, test_f1: 0.6026
 epoch: 76, train_loss: 0.3288, test_loss: 1.7674, test_f1: 0.6141
 epoch: 77, train_loss: 0.3260, test_loss: 1.7952, test_f1: 0.6184
 epoch: 78, train_loss: 0.3177, test_loss: 1.7811, test_f1: 0.6105
 epoch: 79, train_loss: 0.3545, test_loss: 1.9337, test_f1: 0.5893
 epoch: 80, train_loss: 0.3321, test_loss: 1.9083, test_f1: 0.5839
 epoch: 81, train_loss: 0.3264, test_loss: 1.9159, test_f1: 0.5947
 epoch: 82, train_loss: 0.3286, test_loss: 1.8189, test_f1: 0.6068
 epoch: 83, train_loss: 0.3079, test_loss: 2.0280, test_f1: 0.5819
 epoch: 84, train_loss: 0.3190, test_loss: 1.9634, test_f1: 0.6090
 epoch: 85, train_loss: 0.3017, test_loss: 1.9821, test_f1: 0.5956
 epoch: 86, train_loss: 0.3110, test_loss: 1.9994, test_f1: 0.6004
 epoch: 87, train_loss: 0.3183, test_loss: 1.8884, test_f1: 0.5707
 epoch: 88, train_loss: 0.3122, test_loss: 1.9845, test_f1: 0.5943
 epoch: 89, train_loss: 0.2960, test_loss: 2.0791, test_f1: 0.5905
 epoch: 90, train_loss: 0.3023, test_loss: 2.1628, test_f1: 0.5940
 epoch: 91, train_loss: 0.3221, test_loss: 2.0839, test_f1: 0.5877
 epoch: 92, train_loss: 0.2988, test_loss: 2.0450, test_f1: 0.5879
 epoch: 93, train_loss: 0.3183, test_loss: 2.1655, test_f1: 0.5631
 epoch: 94, train_loss: 0.2735, test_loss: 2.0738, test_f1: 0.6031
 epoch: 95, train_loss: 0.2900, test_loss: 1.9520, test_f1: 0.6351
 epoch: 96, train_loss: 0.2695, test_loss: 2.0466, test_f1: 0.6045
 epoch: 97, train_loss: 0.2607, test_loss: 2.1665, test_f1: 0.5777
 epoch: 98, train_loss: 0.2438, test_loss: 2.1505, test_f1: 0.5807
 epoch: 99, train_loss: 0.2783, test_loss: 2.0930, test_f1: 0.6122
##################ITERATION #9 ****************************************
 epoch: 0, train_loss: 1.4120, test_loss: 1.2540, test_f1: 0.3941
 epoch: 1, train_loss: 1.0822, test_loss: 1.1286, test_f1: 0.4542
 epoch: 2, train_loss: 1.0076, test_loss: 1.0946, test_f1: 0.4766
 epoch: 3, train_loss: 0.9810, test_loss: 1.0658, test_f1: 0.4762
 epoch: 4, train_loss: 0.9468, test_loss: 1.1062, test_f1: 0.4684
 epoch: 5, train_loss: 0.9194, test_loss: 1.0710, test_f1: 0.5237
 epoch: 6, train_loss: 0.9092, test_loss: 1.0374, test_f1: 0.5277
 epoch: 7, train_loss: 0.9011, test_loss: 1.0615, test_f1: 0.5211
 epoch: 8, train_loss: 0.8683, test_loss: 1.0609, test_f1: 0.5374
 epoch: 9, train_loss: 0.8618, test_loss: 1.0782, test_f1: 0.5691
 epoch: 10, train_loss: 0.8517, test_loss: 1.0921, test_f1: 0.5523
 epoch: 11, train_loss: 0.8384, test_loss: 1.0408, test_f1: 0.5830
 epoch: 12, train_loss: 0.8201, test_loss: 1.0485, test_f1: 0.5317
 epoch: 13, train_loss: 0.7898, test_loss: 1.0353, test_f1: 0.5629
 epoch: 14, train_loss: 0.7852, test_loss: 1.0678, test_f1: 0.5869
 epoch: 15, train_loss: 0.7786, test_loss: 1.1524, test_f1: 0.5232
 epoch: 16, train_loss: 0.7520, test_loss: 1.0317, test_f1: 0.6226
 epoch: 17, train_loss: 0.7303, test_loss: 1.0479, test_f1: 0.6001
 epoch: 18, train_loss: 0.7150, test_loss: 1.0491, test_f1: 0.6158
 epoch: 19, train_loss: 0.6978, test_loss: 1.0977, test_f1: 0.5824
 epoch: 20, train_loss: 0.7016, test_loss: 1.0823, test_f1: 0.5761
 epoch: 21, train_loss: 0.6880, test_loss: 1.0894, test_f1: 0.5788
 epoch: 22, train_loss: 0.6567, test_loss: 1.0789, test_f1: 0.5937
 epoch: 23, train_loss: 0.6585, test_loss: 1.3010, test_f1: 0.5571
 epoch: 24, train_loss: 0.6711, test_loss: 1.1054, test_f1: 0.5900
 epoch: 25, train_loss: 0.6726, test_loss: 1.0572, test_f1: 0.5757
 epoch: 26, train_loss: 0.6596, test_loss: 1.0411, test_f1: 0.6469
 epoch: 27, train_loss: 0.6325, test_loss: 1.1467, test_f1: 0.5823
 epoch: 28, train_loss: 0.6354, test_loss: 1.2455, test_f1: 0.5789
 epoch: 29, train_loss: 0.6150, test_loss: 1.1558, test_f1: 0.5879
 epoch: 30, train_loss: 0.6022, test_loss: 1.2195, test_f1: 0.6120
 epoch: 31, train_loss: 0.5922, test_loss: 1.0878, test_f1: 0.6196
 epoch: 32, train_loss: 0.5935, test_loss: 1.2033, test_f1: 0.6143
 epoch: 33, train_loss: 0.6109, test_loss: 1.2201, test_f1: 0.5622
 epoch: 34, train_loss: 0.6115, test_loss: 1.1924, test_f1: 0.6341
 epoch: 35, train_loss: 0.5755, test_loss: 1.2998, test_f1: 0.5487
 epoch: 36, train_loss: 0.5744, test_loss: 1.1720, test_f1: 0.6249
 epoch: 37, train_loss: 0.5646, test_loss: 1.3652, test_f1: 0.5703
 epoch: 38, train_loss: 0.5649, test_loss: 1.3418, test_f1: 0.5869
 epoch: 39, train_loss: 0.5700, test_loss: 1.2424, test_f1: 0.5919
 epoch: 40, train_loss: 0.5547, test_loss: 1.2765, test_f1: 0.6324
 epoch: 41, train_loss: 0.5528, test_loss: 1.2804, test_f1: 0.6231
 epoch: 42, train_loss: 0.5324, test_loss: 1.4188, test_f1: 0.5887
 epoch: 43, train_loss: 0.5393, test_loss: 1.2743, test_f1: 0.6241
 epoch: 44, train_loss: 0.5125, test_loss: 1.4050, test_f1: 0.6170
 epoch: 45, train_loss: 0.5002, test_loss: 1.5379, test_f1: 0.5597
 epoch: 46, train_loss: 0.5124, test_loss: 1.4253, test_f1: 0.6184
 epoch: 47, train_loss: 0.5068, test_loss: 1.3927, test_f1: 0.6293
 epoch: 48, train_loss: 0.5067, test_loss: 1.3394, test_f1: 0.5645
 epoch: 49, train_loss: 0.4895, test_loss: 1.3030, test_f1: 0.6241
 epoch: 50, train_loss: 0.4903, test_loss: 1.3055, test_f1: 0.6664
 epoch: 51, train_loss: 0.4408, test_loss: 1.3308, test_f1: 0.6366
 epoch: 52, train_loss: 0.4014, test_loss: 1.3647, test_f1: 0.6365
 epoch: 53, train_loss: 0.4101, test_loss: 1.4221, test_f1: 0.6404
 epoch: 54, train_loss: 0.4199, test_loss: 1.5364, test_f1: 0.6144
 epoch: 55, train_loss: 0.4214, test_loss: 1.4315, test_f1: 0.6560
 epoch: 56, train_loss: 0.4200, test_loss: 1.5014, test_f1: 0.5938
 epoch: 57, train_loss: 0.3761, test_loss: 1.5212, test_f1: 0.6157
 epoch: 58, train_loss: 0.3736, test_loss: 1.4984, test_f1: 0.6483
 epoch: 59, train_loss: 0.3882, test_loss: 1.5463, test_f1: 0.6300
 epoch: 60, train_loss: 0.3739, test_loss: 1.5301, test_f1: 0.6335
 epoch: 61, train_loss: 0.3692, test_loss: 1.6745, test_f1: 0.5874
 epoch: 62, train_loss: 0.4238, test_loss: 1.5333, test_f1: 0.6441
 epoch: 63, train_loss: 0.3773, test_loss: 1.6367, test_f1: 0.6330
 epoch: 64, train_loss: 0.3922, test_loss: 1.5353, test_f1: 0.6328
 epoch: 65, train_loss: 0.3445, test_loss: 1.6048, test_f1: 0.6006
 epoch: 66, train_loss: 0.3627, test_loss: 1.6055, test_f1: 0.6383
 epoch: 67, train_loss: 0.3670, test_loss: 1.7222, test_f1: 0.6311
 epoch: 68, train_loss: 0.3339, test_loss: 1.6495, test_f1: 0.6302
 epoch: 69, train_loss: 0.3289, test_loss: 1.6753, test_f1: 0.5922
 epoch: 70, train_loss: 0.3706, test_loss: 1.7101, test_f1: 0.6226
 epoch: 71, train_loss: 0.3453, test_loss: 1.6673, test_f1: 0.6316
 epoch: 72, train_loss: 0.3581, test_loss: 1.7310, test_f1: 0.6145
 epoch: 73, train_loss: 0.3337, test_loss: 1.8547, test_f1: 0.5954
 epoch: 74, train_loss: 0.3617, test_loss: 1.6701, test_f1: 0.6370
 epoch: 75, train_loss: 0.3485, test_loss: 1.7142, test_f1: 0.5942
 epoch: 76, train_loss: 0.3516, test_loss: 1.7228, test_f1: 0.6048
 epoch: 77, train_loss: 0.3263, test_loss: 1.8900, test_f1: 0.5952
 epoch: 78, train_loss: 0.3258, test_loss: 1.6703, test_f1: 0.6519
 epoch: 79, train_loss: 0.3465, test_loss: 1.7376, test_f1: 0.6233
 epoch: 80, train_loss: 0.3191, test_loss: 1.8966, test_f1: 0.5977
 epoch: 81, train_loss: 0.3264, test_loss: 1.7762, test_f1: 0.6248
 epoch: 82, train_loss: 0.2996, test_loss: 1.7912, test_f1: 0.6080
 epoch: 83, train_loss: 0.3147, test_loss: 1.8851, test_f1: 0.6230
 epoch: 84, train_loss: 0.3223, test_loss: 1.7660, test_f1: 0.6192
 epoch: 85, train_loss: 0.3202, test_loss: 1.8453, test_f1: 0.5883
 epoch: 86, train_loss: 0.3253, test_loss: 1.9355, test_f1: 0.6084
 epoch: 87, train_loss: 0.3018, test_loss: 1.9630, test_f1: 0.5922
 epoch: 88, train_loss: 0.3211, test_loss: 1.8796, test_f1: 0.5983
 epoch: 89, train_loss: 0.3092, test_loss: 1.9817, test_f1: 0.5885
 epoch: 90, train_loss: 0.2914, test_loss: 1.9929, test_f1: 0.5823
 epoch: 91, train_loss: 0.3061, test_loss: 1.9231, test_f1: 0.6060
 epoch: 92, train_loss: 0.3108, test_loss: 1.9656, test_f1: 0.6168
 epoch: 93, train_loss: 0.2780, test_loss: 1.9013, test_f1: 0.6469
 epoch: 94, train_loss: 0.3293, test_loss: 1.9484, test_f1: 0.6110
 epoch: 95, train_loss: 0.3028, test_loss: 1.9532, test_f1: 0.6469
 epoch: 96, train_loss: 0.3245, test_loss: 1.8824, test_f1: 0.6288
 epoch: 97, train_loss: 0.2753, test_loss: 1.9189, test_f1: 0.6189
 epoch: 98, train_loss: 0.3018, test_loss: 1.9091, test_f1: 0.6553
 epoch: 99, train_loss: 0.2887, test_loss: 2.0603, test_f1: 0.6309

Training completed in 1084.90 seconds
Best F1: 0.6822 at epoch 51
Mean F1 across iterations: 0.6506  0.0153
========================FINAL RESULTS================================
FEGIN weighted F1: 0.6822  0.0153
python main.py --data ltspice_demos --representation component_pin_net --model FEGIN --layers 5 --hiddens 32 --batch_size 32 --lr 0.001 --emb_size 128 --epochs 100 --save_appendix component_pin_net_L5_H32_BS32_LR0.001_E128 --no_val
-----



STDERR:
  File "main.py", line 370, in <module>
    main()
  File "main.py", line 254, in main
    dataset = dataset_class(
  File "/home/philip/projects/ltspice_examples_code_repo/Circuit-Completion-Using-GNNs/component_classification_with_link_prediction_head/evaluation/FEGIN/kernel/circuit_datasets.py", line 15, in __init__
    self.data, self.slices = torch.load(self.processed_paths[0])
  File "/home/philip/.local/lib/python3.8/site-packages/torch/serialization.py", line 1040, in load
    warnings.warn(
  File "/usr/lib/python3.8/warnings.py", line 109, in _showwarnmsg
    sw(msg.message, msg.category, msg.filename, msg.lineno,
  File "main.py", line 47, in warn_with_traceback
    traceback.print_stack(file=log)
/home/philip/projects/ltspice_examples_code_repo/Circuit-Completion-Using-GNNs/component_classification_with_link_prediction_head/evaluation/FEGIN/kernel/circuit_datasets.py:15: FutureWarning: You are using `torch.load` with `weights_only=False` (the current default value), which uses the default pickle module implicitly. It is possible to construct malicious pickle data which will execute arbitrary code during unpickling (See https://github.com/pytorch/pytorch/blob/main/SECURITY.md#untrusted-models for more details). In a future release, the default value for `weights_only` will be flipped to `True`. This limits the functions that could be executed during unpickling. Arbitrary objects will no longer be allowed to be loaded via this mode unless they are explicitly allowlisted by the user via `torch.serialization.add_safe_globals`. We recommend you start setting `weights_only=True` for any use case where you don't have full control of the loaded file. Please open an issue on GitHub for any issues related to this experimental feature.
  self.data, self.slices = torch.load(self.processed_paths[0])
