STDOUT:
Results will be saved in /home/philip/projects/ltspice_examples_code_repo/Circuit-Completion-Using-GNNs/component_classification_with_link_prediction_head/evaluation/FEGIN/results/model_FEGIN_dataset_ltspice_demos
Command line input: python main.py --data ltspice_demos --representation component_pin_net --model FEGIN --layers 2 --hiddens 64 --batch_size 256 --lr 0.01 --emb_size 128 --epochs 100 --save_appendix component_pin_net_L2_H64_BS256_LR0.01_E128 --no_val
 is saved.
-----
ltspice_demos - FEGIN
Using 2 layers, 64 hidden units, h = 2
Loading component_pin_net representation dataset
ENTERED
Training FEGIN on component_pin_net representation
Train: 1565, Test: 383
##################ITERATION #0 ****************************************
 epoch: 0, train_loss: 1.2459, test_loss: 1.3400, test_f1: 0.3368
 epoch: 1, train_loss: 1.0936, test_loss: 1.7467, test_f1: 0.1365
 epoch: 2, train_loss: 1.0315, test_loss: 1.5010, test_f1: 0.2722
 epoch: 3, train_loss: 0.9901, test_loss: 1.5609, test_f1: 0.1589
 epoch: 4, train_loss: 0.9705, test_loss: 1.2978, test_f1: 0.4149
 epoch: 5, train_loss: 0.9449, test_loss: 1.3199, test_f1: 0.2491
 epoch: 6, train_loss: 0.9359, test_loss: 1.1762, test_f1: 0.4573
 epoch: 7, train_loss: 0.9150, test_loss: 1.1136, test_f1: 0.5255
 epoch: 8, train_loss: 0.8830, test_loss: 1.1226, test_f1: 0.4862
 epoch: 9, train_loss: 0.8645, test_loss: 1.0547, test_f1: 0.4266
 epoch: 10, train_loss: 0.8458, test_loss: 1.0812, test_f1: 0.4315
 epoch: 11, train_loss: 0.8354, test_loss: 1.0848, test_f1: 0.4384
 epoch: 12, train_loss: 0.8296, test_loss: 1.2245, test_f1: 0.4290
 epoch: 13, train_loss: 0.8366, test_loss: 1.1398, test_f1: 0.5435
 epoch: 14, train_loss: 0.8043, test_loss: 1.9710, test_f1: 0.3679
 epoch: 15, train_loss: 0.8013, test_loss: 1.3968, test_f1: 0.4701
 epoch: 16, train_loss: 0.7836, test_loss: 0.9750, test_f1: 0.5608
 epoch: 17, train_loss: 0.7329, test_loss: 1.2613, test_f1: 0.4788
 epoch: 18, train_loss: 0.7219, test_loss: 1.1111, test_f1: 0.5237
 epoch: 19, train_loss: 0.7307, test_loss: 0.9672, test_f1: 0.5637
 epoch: 20, train_loss: 0.7252, test_loss: 1.0270, test_f1: 0.5273
 epoch: 21, train_loss: 0.7284, test_loss: 1.0745, test_f1: 0.4564
 epoch: 22, train_loss: 0.6954, test_loss: 0.9659, test_f1: 0.5415
 epoch: 23, train_loss: 0.6803, test_loss: 0.8504, test_f1: 0.6403
 epoch: 24, train_loss: 0.6656, test_loss: 1.0489, test_f1: 0.5432
 epoch: 25, train_loss: 0.6571, test_loss: 1.8286, test_f1: 0.3854
 epoch: 26, train_loss: 0.7136, test_loss: 1.6174, test_f1: 0.4680
 epoch: 27, train_loss: 0.7294, test_loss: 0.9583, test_f1: 0.5954
 epoch: 28, train_loss: 0.7010, test_loss: 0.9960, test_f1: 0.6013
 epoch: 29, train_loss: 0.6861, test_loss: 1.0383, test_f1: 0.5928
 epoch: 30, train_loss: 0.6512, test_loss: 0.8944, test_f1: 0.6619
 epoch: 31, train_loss: 0.6726, test_loss: 1.1190, test_f1: 0.4877
 epoch: 32, train_loss: 0.6695, test_loss: 1.1166, test_f1: 0.4867
 epoch: 33, train_loss: 0.6535, test_loss: 1.0828, test_f1: 0.4993
 epoch: 34, train_loss: 0.6277, test_loss: 0.9403, test_f1: 0.5815
 epoch: 35, train_loss: 0.6306, test_loss: 1.1439, test_f1: 0.5159
 epoch: 36, train_loss: 0.6302, test_loss: 1.3933, test_f1: 0.5189
 epoch: 37, train_loss: 0.6017, test_loss: 1.1109, test_f1: 0.5869
 epoch: 38, train_loss: 0.5848, test_loss: 1.1923, test_f1: 0.5386
 epoch: 39, train_loss: 0.6010, test_loss: 1.1121, test_f1: 0.6116
 epoch: 40, train_loss: 0.5782, test_loss: 1.2573, test_f1: 0.5442
 epoch: 41, train_loss: 0.6015, test_loss: 1.4993, test_f1: 0.4675
 epoch: 42, train_loss: 0.5741, test_loss: 1.3833, test_f1: 0.5133
 epoch: 43, train_loss: 0.5814, test_loss: 1.1280, test_f1: 0.5991
 epoch: 44, train_loss: 0.5580, test_loss: 1.4354, test_f1: 0.5416
 epoch: 45, train_loss: 0.6004, test_loss: 1.4700, test_f1: 0.5784
 epoch: 46, train_loss: 0.5985, test_loss: 0.9683, test_f1: 0.6320
 epoch: 47, train_loss: 0.5792, test_loss: 1.1406, test_f1: 0.5480
 epoch: 48, train_loss: 0.5774, test_loss: 1.5402, test_f1: 0.5358
 epoch: 49, train_loss: 0.5821, test_loss: 1.1906, test_f1: 0.5455
 epoch: 50, train_loss: 0.5694, test_loss: 1.0382, test_f1: 0.6254
 epoch: 51, train_loss: 0.5539, test_loss: 1.0568, test_f1: 0.6436
 epoch: 52, train_loss: 0.5138, test_loss: 1.0374, test_f1: 0.6196
 epoch: 53, train_loss: 0.4908, test_loss: 1.1487, test_f1: 0.5599
 epoch: 54, train_loss: 0.4725, test_loss: 1.1512, test_f1: 0.6102
 epoch: 55, train_loss: 0.4836, test_loss: 1.1338, test_f1: 0.6152
 epoch: 56, train_loss: 0.4530, test_loss: 1.0852, test_f1: 0.6451
 epoch: 57, train_loss: 0.4292, test_loss: 1.3418, test_f1: 0.6150
 epoch: 58, train_loss: 0.4078, test_loss: 1.2651, test_f1: 0.6275
 epoch: 59, train_loss: 0.4508, test_loss: 1.2858, test_f1: 0.6204
 epoch: 60, train_loss: 0.4253, test_loss: 1.2767, test_f1: 0.5756
 epoch: 61, train_loss: 0.4123, test_loss: 1.2007, test_f1: 0.6178
 epoch: 62, train_loss: 0.3996, test_loss: 1.1782, test_f1: 0.6263
 epoch: 63, train_loss: 0.3938, test_loss: 1.2187, test_f1: 0.6340
 epoch: 64, train_loss: 0.3958, test_loss: 1.2434, test_f1: 0.6297
 epoch: 65, train_loss: 0.4380, test_loss: 1.3157, test_f1: 0.5457
 epoch: 66, train_loss: 0.4793, test_loss: 0.9889, test_f1: 0.6279
 epoch: 67, train_loss: 0.4175, test_loss: 1.1009, test_f1: 0.6249
 epoch: 68, train_loss: 0.4376, test_loss: 1.3132, test_f1: 0.6273
 epoch: 69, train_loss: 0.4233, test_loss: 1.2839, test_f1: 0.6434
 epoch: 70, train_loss: 0.4242, test_loss: 1.1875, test_f1: 0.6381
 epoch: 71, train_loss: 0.3853, test_loss: 1.1295, test_f1: 0.6390
 epoch: 72, train_loss: 0.3909, test_loss: 1.1839, test_f1: 0.6554
 epoch: 73, train_loss: 0.3955, test_loss: 1.3126, test_f1: 0.6220
 epoch: 74, train_loss: 0.4603, test_loss: 1.3490, test_f1: 0.5677
 epoch: 75, train_loss: 0.4606, test_loss: 1.3715, test_f1: 0.5845
 epoch: 76, train_loss: 0.4292, test_loss: 1.2629, test_f1: 0.5899
 epoch: 77, train_loss: 0.4202, test_loss: 1.3270, test_f1: 0.6272
 epoch: 78, train_loss: 0.3821, test_loss: 1.2859, test_f1: 0.5854
 epoch: 79, train_loss: 0.3812, test_loss: 1.3671, test_f1: 0.5958
 epoch: 80, train_loss: 0.3800, test_loss: 1.4421, test_f1: 0.6349
 epoch: 81, train_loss: 0.3681, test_loss: 1.5609, test_f1: 0.5849
 epoch: 82, train_loss: 0.3543, test_loss: 1.4390, test_f1: 0.6164
 epoch: 83, train_loss: 0.3838, test_loss: 1.5044, test_f1: 0.6114
 epoch: 84, train_loss: 0.3412, test_loss: 1.3155, test_f1: 0.6357
 epoch: 85, train_loss: 0.3559, test_loss: 1.3803, test_f1: 0.6179
 epoch: 86, train_loss: 0.3535, test_loss: 1.2944, test_f1: 0.6433
 epoch: 87, train_loss: 0.3152, test_loss: 1.2524, test_f1: 0.6335
 epoch: 88, train_loss: 0.3279, test_loss: 1.3895, test_f1: 0.6181
 epoch: 89, train_loss: 0.3567, test_loss: 1.5023, test_f1: 0.6020
 epoch: 90, train_loss: 0.3283, test_loss: 1.6996, test_f1: 0.5698
 epoch: 91, train_loss: 0.3568, test_loss: 1.9302, test_f1: 0.5945
 epoch: 92, train_loss: 0.3413, test_loss: 1.6579, test_f1: 0.6185
 epoch: 93, train_loss: 0.3465, test_loss: 1.5498, test_f1: 0.6402
 epoch: 94, train_loss: 0.3403, test_loss: 1.4968, test_f1: 0.6286
 epoch: 95, train_loss: 0.3128, test_loss: 1.4624, test_f1: 0.6330
 epoch: 96, train_loss: 0.3436, test_loss: 1.2848, test_f1: 0.6363
 epoch: 97, train_loss: 0.3271, test_loss: 1.2057, test_f1: 0.6668
 epoch: 98, train_loss: 0.3359, test_loss: 1.6939, test_f1: 0.6069
 epoch: 99, train_loss: 0.3464, test_loss: 1.5660, test_f1: 0.6212
##################ITERATION #1 ****************************************
 epoch: 0, train_loss: 1.1993, test_loss: 1.3053, test_f1: 0.2583
 epoch: 1, train_loss: 1.0413, test_loss: 1.3959, test_f1: 0.2537
 epoch: 2, train_loss: 0.9692, test_loss: 1.6260, test_f1: 0.1377
 epoch: 3, train_loss: 0.9402, test_loss: 1.2445, test_f1: 0.3745
 epoch: 4, train_loss: 0.8951, test_loss: 1.3235, test_f1: 0.3424
 epoch: 5, train_loss: 0.8838, test_loss: 1.1913, test_f1: 0.4833
 epoch: 6, train_loss: 0.8518, test_loss: 1.0759, test_f1: 0.5179
 epoch: 7, train_loss: 0.8259, test_loss: 1.0376, test_f1: 0.5131
 epoch: 8, train_loss: 0.8008, test_loss: 1.0483, test_f1: 0.5407
 epoch: 9, train_loss: 0.7903, test_loss: 0.9633, test_f1: 0.5730
 epoch: 10, train_loss: 0.7766, test_loss: 1.0577, test_f1: 0.5482
 epoch: 11, train_loss: 0.7862, test_loss: 1.0674, test_f1: 0.5181
 epoch: 12, train_loss: 0.7989, test_loss: 1.0228, test_f1: 0.4786
 epoch: 13, train_loss: 0.7941, test_loss: 1.0105, test_f1: 0.5405
 epoch: 14, train_loss: 0.8027, test_loss: 1.0848, test_f1: 0.5282
 epoch: 15, train_loss: 0.7710, test_loss: 1.1157, test_f1: 0.4406
 epoch: 16, train_loss: 0.7713, test_loss: 1.1605, test_f1: 0.4760
 epoch: 17, train_loss: 0.7661, test_loss: 1.9337, test_f1: 0.4013
 epoch: 18, train_loss: 0.7452, test_loss: 1.3111, test_f1: 0.4553
 epoch: 19, train_loss: 0.7340, test_loss: 1.1575, test_f1: 0.4754
 epoch: 20, train_loss: 0.6978, test_loss: 1.3108, test_f1: 0.4233
 epoch: 21, train_loss: 0.6838, test_loss: 1.1112, test_f1: 0.5124
 epoch: 22, train_loss: 0.6662, test_loss: 0.9759, test_f1: 0.5910
 epoch: 23, train_loss: 0.6753, test_loss: 1.0846, test_f1: 0.6109
 epoch: 24, train_loss: 0.6348, test_loss: 1.1909, test_f1: 0.5225
 epoch: 25, train_loss: 0.6400, test_loss: 1.1476, test_f1: 0.5174
 epoch: 26, train_loss: 0.6738, test_loss: 1.1146, test_f1: 0.6004
 epoch: 27, train_loss: 0.6508, test_loss: 1.2382, test_f1: 0.5114
 epoch: 28, train_loss: 0.6605, test_loss: 1.0826, test_f1: 0.5944
 epoch: 29, train_loss: 0.6649, test_loss: 1.2548, test_f1: 0.5762
 epoch: 30, train_loss: 0.6352, test_loss: 1.0607, test_f1: 0.5942
 epoch: 31, train_loss: 0.6458, test_loss: 1.3446, test_f1: 0.4803
 epoch: 32, train_loss: 0.6309, test_loss: 1.1055, test_f1: 0.4966
 epoch: 33, train_loss: 0.5904, test_loss: 1.1037, test_f1: 0.6321
 epoch: 34, train_loss: 0.5863, test_loss: 1.2466, test_f1: 0.6296
 epoch: 35, train_loss: 0.5913, test_loss: 1.2909, test_f1: 0.6078
 epoch: 36, train_loss: 0.5896, test_loss: 1.4969, test_f1: 0.5301
 epoch: 37, train_loss: 0.5949, test_loss: 1.4966, test_f1: 0.4915
 epoch: 38, train_loss: 0.6488, test_loss: 1.8959, test_f1: 0.4744
 epoch: 39, train_loss: 0.6523, test_loss: 1.4237, test_f1: 0.5174
 epoch: 40, train_loss: 0.6256, test_loss: 1.0345, test_f1: 0.5744
 epoch: 41, train_loss: 0.6337, test_loss: 1.7921, test_f1: 0.5345
 epoch: 42, train_loss: 0.6339, test_loss: 1.8880, test_f1: 0.4478
 epoch: 43, train_loss: 0.5949, test_loss: 2.0187, test_f1: 0.4278
 epoch: 44, train_loss: 0.6504, test_loss: 1.5611, test_f1: 0.5074
 epoch: 45, train_loss: 0.6015, test_loss: 1.3372, test_f1: 0.6106
 epoch: 46, train_loss: 0.5430, test_loss: 1.1124, test_f1: 0.6194
 epoch: 47, train_loss: 0.6240, test_loss: 1.1180, test_f1: 0.5896
 epoch: 48, train_loss: 0.6423, test_loss: 1.1108, test_f1: 0.5836
 epoch: 49, train_loss: 0.5960, test_loss: 1.1505, test_f1: 0.5901
 epoch: 50, train_loss: 0.5622, test_loss: 1.1866, test_f1: 0.6033
 epoch: 51, train_loss: 0.5398, test_loss: 1.2072, test_f1: 0.6318
 epoch: 52, train_loss: 0.5011, test_loss: 1.2136, test_f1: 0.6359
 epoch: 53, train_loss: 0.4975, test_loss: 1.2225, test_f1: 0.6473
 epoch: 54, train_loss: 0.4839, test_loss: 1.3583, test_f1: 0.5908
 epoch: 55, train_loss: 0.4693, test_loss: 1.2532, test_f1: 0.6360
 epoch: 56, train_loss: 0.4643, test_loss: 1.1950, test_f1: 0.6113
 epoch: 57, train_loss: 0.4456, test_loss: 1.3916, test_f1: 0.5917
 epoch: 58, train_loss: 0.4481, test_loss: 1.4675, test_f1: 0.5965
 epoch: 59, train_loss: 0.4253, test_loss: 1.5673, test_f1: 0.6365
 epoch: 60, train_loss: 0.4549, test_loss: 1.5720, test_f1: 0.6092
 epoch: 61, train_loss: 0.4185, test_loss: 1.6056, test_f1: 0.6175
 epoch: 62, train_loss: 0.4374, test_loss: 1.4234, test_f1: 0.6155
 epoch: 63, train_loss: 0.4413, test_loss: 1.4746, test_f1: 0.6329
 epoch: 64, train_loss: 0.4200, test_loss: 1.7390, test_f1: 0.6063
 epoch: 65, train_loss: 0.4152, test_loss: 1.5401, test_f1: 0.6801
 epoch: 66, train_loss: 0.4035, test_loss: 1.5168, test_f1: 0.6270
 epoch: 67, train_loss: 0.4117, test_loss: 1.7480, test_f1: 0.5432
 epoch: 68, train_loss: 0.4103, test_loss: 1.6565, test_f1: 0.6224
 epoch: 69, train_loss: 0.4079, test_loss: 1.7289, test_f1: 0.6055
 epoch: 70, train_loss: 0.4401, test_loss: 1.6882, test_f1: 0.6242
 epoch: 71, train_loss: 0.4174, test_loss: 1.4510, test_f1: 0.6251
 epoch: 72, train_loss: 0.4187, test_loss: 1.4648, test_f1: 0.6113
 epoch: 73, train_loss: 0.4228, test_loss: 1.9575, test_f1: 0.5681
 epoch: 74, train_loss: 0.3960, test_loss: 1.7703, test_f1: 0.6108
 epoch: 75, train_loss: 0.3723, test_loss: 1.6871, test_f1: 0.5883
 epoch: 76, train_loss: 0.3814, test_loss: 1.6668, test_f1: 0.6287
 epoch: 77, train_loss: 0.3705, test_loss: 1.5849, test_f1: 0.6609
 epoch: 78, train_loss: 0.3934, test_loss: 2.1076, test_f1: 0.5781
 epoch: 79, train_loss: 0.3911, test_loss: 2.0058, test_f1: 0.6131
 epoch: 80, train_loss: 0.4109, test_loss: 2.0298, test_f1: 0.6333
 epoch: 81, train_loss: 0.4108, test_loss: 2.7073, test_f1: 0.6251
 epoch: 82, train_loss: 0.3829, test_loss: 2.2757, test_f1: 0.5992
 epoch: 83, train_loss: 0.3774, test_loss: 1.5200, test_f1: 0.6278
 epoch: 84, train_loss: 0.3545, test_loss: 1.5351, test_f1: 0.5699
 epoch: 85, train_loss: 0.3810, test_loss: 1.5979, test_f1: 0.6283
 epoch: 86, train_loss: 0.3330, test_loss: 1.6657, test_f1: 0.6010
 epoch: 87, train_loss: 0.3452, test_loss: 1.5887, test_f1: 0.6469
 epoch: 88, train_loss: 0.3480, test_loss: 1.6857, test_f1: 0.6288
 epoch: 89, train_loss: 0.3168, test_loss: 1.8099, test_f1: 0.5914
 epoch: 90, train_loss: 0.3237, test_loss: 2.0356, test_f1: 0.6206
 epoch: 91, train_loss: 0.3375, test_loss: 2.0915, test_f1: 0.5954
 epoch: 92, train_loss: 0.3445, test_loss: 2.4337, test_f1: 0.5771
 epoch: 93, train_loss: 0.3438, test_loss: 2.6276, test_f1: 0.6028
 epoch: 94, train_loss: 0.3440, test_loss: 2.6007, test_f1: 0.5956
 epoch: 95, train_loss: 0.3408, test_loss: 1.8604, test_f1: 0.6209
 epoch: 96, train_loss: 0.3362, test_loss: 2.1135, test_f1: 0.5813
 epoch: 97, train_loss: 0.3842, test_loss: 2.2785, test_f1: 0.5641
 epoch: 98, train_loss: 0.3756, test_loss: 2.2356, test_f1: 0.5817
 epoch: 99, train_loss: 0.3245, test_loss: 1.8154, test_f1: 0.6460
##################ITERATION #2 ****************************************
 epoch: 0, train_loss: 1.4282, test_loss: 1.4577, test_f1: 0.3232
 epoch: 1, train_loss: 1.0534, test_loss: 1.4196, test_f1: 0.1365
 epoch: 2, train_loss: 0.9871, test_loss: 1.3817, test_f1: 0.1453
 epoch: 3, train_loss: 0.9527, test_loss: 1.2574, test_f1: 0.2512
 epoch: 4, train_loss: 0.9243, test_loss: 1.0931, test_f1: 0.4772
 epoch: 5, train_loss: 0.9203, test_loss: 1.0456, test_f1: 0.5065
 epoch: 6, train_loss: 0.9005, test_loss: 1.0225, test_f1: 0.5524
 epoch: 7, train_loss: 0.8896, test_loss: 1.0095, test_f1: 0.5366
 epoch: 8, train_loss: 0.8744, test_loss: 0.9732, test_f1: 0.5850
 epoch: 9, train_loss: 0.8507, test_loss: 1.0220, test_f1: 0.5499
 epoch: 10, train_loss: 0.8478, test_loss: 0.9790, test_f1: 0.6031
 epoch: 11, train_loss: 0.8377, test_loss: 1.0532, test_f1: 0.5463
 epoch: 12, train_loss: 0.8348, test_loss: 1.0413, test_f1: 0.5798
 epoch: 13, train_loss: 0.8253, test_loss: 1.6443, test_f1: 0.3188
 epoch: 14, train_loss: 0.7929, test_loss: 1.1569, test_f1: 0.4992
 epoch: 15, train_loss: 0.7872, test_loss: 1.0743, test_f1: 0.5455
 epoch: 16, train_loss: 0.7774, test_loss: 1.1353, test_f1: 0.5260
 epoch: 17, train_loss: 0.7603, test_loss: 1.1843, test_f1: 0.5363
 epoch: 18, train_loss: 0.7513, test_loss: 1.0559, test_f1: 0.5439
 epoch: 19, train_loss: 0.7607, test_loss: 1.1153, test_f1: 0.5534
 epoch: 20, train_loss: 0.7830, test_loss: 1.0460, test_f1: 0.4665
 epoch: 21, train_loss: 0.7551, test_loss: 0.9656, test_f1: 0.6056
 epoch: 22, train_loss: 0.7177, test_loss: 0.9877, test_f1: 0.6021
 epoch: 23, train_loss: 0.6875, test_loss: 1.0680, test_f1: 0.5761
 epoch: 24, train_loss: 0.7035, test_loss: 1.2379, test_f1: 0.5296
 epoch: 25, train_loss: 0.7062, test_loss: 1.0567, test_f1: 0.5081
 epoch: 26, train_loss: 0.6943, test_loss: 1.1691, test_f1: 0.4895
 epoch: 27, train_loss: 0.7005, test_loss: 1.1208, test_f1: 0.5085
 epoch: 28, train_loss: 0.6903, test_loss: 1.1026, test_f1: 0.5629
 epoch: 29, train_loss: 0.6626, test_loss: 1.2579, test_f1: 0.5719
 epoch: 30, train_loss: 0.6570, test_loss: 1.1981, test_f1: 0.5458
 epoch: 31, train_loss: 0.6335, test_loss: 1.1381, test_f1: 0.6072
 epoch: 32, train_loss: 0.6358, test_loss: 1.2626, test_f1: 0.5512
 epoch: 33, train_loss: 0.6527, test_loss: 1.2936, test_f1: 0.5747
 epoch: 34, train_loss: 0.6129, test_loss: 1.3642, test_f1: 0.5745
 epoch: 35, train_loss: 0.6929, test_loss: 1.9127, test_f1: 0.4387
 epoch: 36, train_loss: 0.6529, test_loss: 1.7282, test_f1: 0.4805
 epoch: 37, train_loss: 0.6452, test_loss: 1.5640, test_f1: 0.4664
 epoch: 38, train_loss: 0.6519, test_loss: 1.1928, test_f1: 0.5796
 epoch: 39, train_loss: 0.6068, test_loss: 1.2027, test_f1: 0.5402
 epoch: 40, train_loss: 0.6360, test_loss: 1.3518, test_f1: 0.5558
 epoch: 41, train_loss: 0.5991, test_loss: 1.4742, test_f1: 0.5175
 epoch: 42, train_loss: 0.6300, test_loss: 1.5061, test_f1: 0.5078
 epoch: 43, train_loss: 0.5992, test_loss: 1.4118, test_f1: 0.5073
 epoch: 44, train_loss: 0.6131, test_loss: 1.2433, test_f1: 0.6220
 epoch: 45, train_loss: 0.6515, test_loss: 1.2619, test_f1: 0.5359
 epoch: 46, train_loss: 0.6517, test_loss: 1.5158, test_f1: 0.4442
 epoch: 47, train_loss: 0.6327, test_loss: 1.2623, test_f1: 0.5508
 epoch: 48, train_loss: 0.6011, test_loss: 1.1037, test_f1: 0.4997
 epoch: 49, train_loss: 0.5820, test_loss: 1.2124, test_f1: 0.5462
 epoch: 50, train_loss: 0.5989, test_loss: 1.3494, test_f1: 0.5365
 epoch: 51, train_loss: 0.5661, test_loss: 1.1249, test_f1: 0.5836
 epoch: 52, train_loss: 0.5634, test_loss: 1.0617, test_f1: 0.5954
 epoch: 53, train_loss: 0.5217, test_loss: 1.0859, test_f1: 0.6063
 epoch: 54, train_loss: 0.5250, test_loss: 1.0874, test_f1: 0.6213
 epoch: 55, train_loss: 0.4942, test_loss: 1.0774, test_f1: 0.5924
 epoch: 56, train_loss: 0.4754, test_loss: 1.1351, test_f1: 0.5812
 epoch: 57, train_loss: 0.4681, test_loss: 1.3590, test_f1: 0.5797
 epoch: 58, train_loss: 0.4882, test_loss: 1.3251, test_f1: 0.5902
 epoch: 59, train_loss: 0.4529, test_loss: 1.3295, test_f1: 0.6089
 epoch: 60, train_loss: 0.4502, test_loss: 1.3380, test_f1: 0.5778
 epoch: 61, train_loss: 0.4692, test_loss: 1.2122, test_f1: 0.6471
 epoch: 62, train_loss: 0.4694, test_loss: 1.4021, test_f1: 0.5946
 epoch: 63, train_loss: 0.4461, test_loss: 1.5697, test_f1: 0.5933
 epoch: 64, train_loss: 0.4330, test_loss: 1.4525, test_f1: 0.5646
 epoch: 65, train_loss: 0.4328, test_loss: 1.3876, test_f1: 0.5975
 epoch: 66, train_loss: 0.4170, test_loss: 1.6561, test_f1: 0.5957
 epoch: 67, train_loss: 0.4230, test_loss: 1.5667, test_f1: 0.6038
 epoch: 68, train_loss: 0.3873, test_loss: 1.5561, test_f1: 0.5945
 epoch: 69, train_loss: 0.4046, test_loss: 1.6889, test_f1: 0.5565
 epoch: 70, train_loss: 0.4074, test_loss: 1.3483, test_f1: 0.5800
 epoch: 71, train_loss: 0.3800, test_loss: 1.3814, test_f1: 0.5593
 epoch: 72, train_loss: 0.3795, test_loss: 2.2500, test_f1: 0.5486
 epoch: 73, train_loss: 0.4014, test_loss: 3.1975, test_f1: 0.4749
 epoch: 74, train_loss: 0.4126, test_loss: 1.5366, test_f1: 0.5869
 epoch: 75, train_loss: 0.3947, test_loss: 1.6102, test_f1: 0.5516
 epoch: 76, train_loss: 0.3878, test_loss: 1.4357, test_f1: 0.6200
 epoch: 77, train_loss: 0.3837, test_loss: 1.4844, test_f1: 0.6206
 epoch: 78, train_loss: 0.3707, test_loss: 1.4565, test_f1: 0.6314
 epoch: 79, train_loss: 0.3755, test_loss: 1.6741, test_f1: 0.5692
 epoch: 80, train_loss: 0.3779, test_loss: 2.1312, test_f1: 0.5146
 epoch: 81, train_loss: 0.4000, test_loss: 1.6195, test_f1: 0.5056
 epoch: 82, train_loss: 0.3731, test_loss: 1.6837, test_f1: 0.5714
 epoch: 83, train_loss: 0.3769, test_loss: 1.8007, test_f1: 0.5877
 epoch: 84, train_loss: 0.3841, test_loss: 1.7507, test_f1: 0.5856
 epoch: 85, train_loss: 0.3656, test_loss: 1.5404, test_f1: 0.5874
 epoch: 86, train_loss: 0.3618, test_loss: 1.5571, test_f1: 0.6171
 epoch: 87, train_loss: 0.3561, test_loss: 1.5636, test_f1: 0.5795
 epoch: 88, train_loss: 0.3302, test_loss: 1.7756, test_f1: 0.5872
 epoch: 89, train_loss: 0.3419, test_loss: 2.2676, test_f1: 0.5719
 epoch: 90, train_loss: 0.3494, test_loss: 1.7044, test_f1: 0.5945
 epoch: 91, train_loss: 0.3833, test_loss: 1.5906, test_f1: 0.5999
 epoch: 92, train_loss: 0.3684, test_loss: 1.9904, test_f1: 0.5626
 epoch: 93, train_loss: 0.3759, test_loss: 1.8685, test_f1: 0.5521
 epoch: 94, train_loss: 0.3920, test_loss: 1.5170, test_f1: 0.5822
 epoch: 95, train_loss: 0.3869, test_loss: 1.9681, test_f1: 0.5021
 epoch: 96, train_loss: 0.3797, test_loss: 2.3058, test_f1: 0.5614
 epoch: 97, train_loss: 0.3667, test_loss: 2.0435, test_f1: 0.5801
 epoch: 98, train_loss: 0.3603, test_loss: 1.7058, test_f1: 0.5880
 epoch: 99, train_loss: 0.3133, test_loss: 1.7022, test_f1: 0.5767
##################ITERATION #3 ****************************************
 epoch: 0, train_loss: 1.4594, test_loss: 1.5967, test_f1: 0.2281
 epoch: 1, train_loss: 1.0251, test_loss: 1.5512, test_f1: 0.1365
 epoch: 2, train_loss: 0.9402, test_loss: 1.3834, test_f1: 0.1453
 epoch: 3, train_loss: 0.9130, test_loss: 1.2640, test_f1: 0.2019
 epoch: 4, train_loss: 0.8782, test_loss: 1.1229, test_f1: 0.4187
 epoch: 5, train_loss: 0.8651, test_loss: 1.1912, test_f1: 0.4041
 epoch: 6, train_loss: 0.8258, test_loss: 1.0824, test_f1: 0.4125
 epoch: 7, train_loss: 0.8069, test_loss: 1.0489, test_f1: 0.5088
 epoch: 8, train_loss: 0.7950, test_loss: 1.1234, test_f1: 0.4601
 epoch: 9, train_loss: 0.7815, test_loss: 1.0788, test_f1: 0.5185
 epoch: 10, train_loss: 0.7946, test_loss: 1.0376, test_f1: 0.5092
 epoch: 11, train_loss: 0.7889, test_loss: 0.9917, test_f1: 0.5349
 epoch: 12, train_loss: 0.7693, test_loss: 1.0144, test_f1: 0.5777
 epoch: 13, train_loss: 0.7730, test_loss: 1.4839, test_f1: 0.4280
 epoch: 14, train_loss: 0.7625, test_loss: 1.0453, test_f1: 0.5927
 epoch: 15, train_loss: 0.7499, test_loss: 1.0520, test_f1: 0.5714
 epoch: 16, train_loss: 0.7458, test_loss: 1.0590, test_f1: 0.5215
 epoch: 17, train_loss: 0.7314, test_loss: 1.0821, test_f1: 0.5273
 epoch: 18, train_loss: 0.7336, test_loss: 1.1635, test_f1: 0.5182
 epoch: 19, train_loss: 0.7199, test_loss: 1.0339, test_f1: 0.5603
 epoch: 20, train_loss: 0.7335, test_loss: 1.0411, test_f1: 0.5664
 epoch: 21, train_loss: 0.6906, test_loss: 1.0083, test_f1: 0.5878
 epoch: 22, train_loss: 0.6844, test_loss: 1.0596, test_f1: 0.6105
 epoch: 23, train_loss: 0.7065, test_loss: 1.0644, test_f1: 0.5464
 epoch: 24, train_loss: 0.6513, test_loss: 1.3837, test_f1: 0.4963
 epoch: 25, train_loss: 0.6736, test_loss: 1.0517, test_f1: 0.5652
 epoch: 26, train_loss: 0.6527, test_loss: 1.1096, test_f1: 0.5041
 epoch: 27, train_loss: 0.6621, test_loss: 1.1566, test_f1: 0.5883
 epoch: 28, train_loss: 0.6645, test_loss: 1.3687, test_f1: 0.5030
 epoch: 29, train_loss: 0.6580, test_loss: 1.1921, test_f1: 0.5539
 epoch: 30, train_loss: 0.6847, test_loss: 1.3867, test_f1: 0.4913
 epoch: 31, train_loss: 0.6788, test_loss: 2.1744, test_f1: 0.3455
 epoch: 32, train_loss: 0.6669, test_loss: 1.4827, test_f1: 0.5163
 epoch: 33, train_loss: 0.6538, test_loss: 1.1650, test_f1: 0.5475
 epoch: 34, train_loss: 0.6578, test_loss: 1.1417, test_f1: 0.5835
 epoch: 35, train_loss: 0.6428, test_loss: 1.0952, test_f1: 0.6387
 epoch: 36, train_loss: 0.6220, test_loss: 1.2455, test_f1: 0.6077
 epoch: 37, train_loss: 0.6267, test_loss: 1.2996, test_f1: 0.6038
 epoch: 38, train_loss: 0.6787, test_loss: 1.1463, test_f1: 0.5546
 epoch: 39, train_loss: 0.6822, test_loss: 1.1015, test_f1: 0.5684
 epoch: 40, train_loss: 0.6825, test_loss: 1.2035, test_f1: 0.5204
 epoch: 41, train_loss: 0.6277, test_loss: 1.0885, test_f1: 0.5742
 epoch: 42, train_loss: 0.6404, test_loss: 1.1437, test_f1: 0.5713
 epoch: 43, train_loss: 0.6061, test_loss: 1.1952, test_f1: 0.5420
 epoch: 44, train_loss: 0.6044, test_loss: 1.2990, test_f1: 0.5059
 epoch: 45, train_loss: 0.5933, test_loss: 1.2464, test_f1: 0.5844
 epoch: 46, train_loss: 0.5733, test_loss: 1.8818, test_f1: 0.4739
 epoch: 47, train_loss: 0.5891, test_loss: 1.2438, test_f1: 0.6417
 epoch: 48, train_loss: 0.6131, test_loss: 1.2887, test_f1: 0.5976
 epoch: 49, train_loss: 0.5808, test_loss: 1.4249, test_f1: 0.5706
 epoch: 50, train_loss: 0.5397, test_loss: 1.4836, test_f1: 0.5561
 epoch: 51, train_loss: 0.5517, test_loss: 1.4151, test_f1: 0.4955
 epoch: 52, train_loss: 0.5288, test_loss: 1.2476, test_f1: 0.5187
 epoch: 53, train_loss: 0.5152, test_loss: 1.3876, test_f1: 0.5152
 epoch: 54, train_loss: 0.5337, test_loss: 1.3618, test_f1: 0.5473
 epoch: 55, train_loss: 0.5512, test_loss: 1.2320, test_f1: 0.5639
 epoch: 56, train_loss: 0.5495, test_loss: 1.2850, test_f1: 0.5182
 epoch: 57, train_loss: 0.5084, test_loss: 1.2933, test_f1: 0.5366
 epoch: 58, train_loss: 0.4817, test_loss: 1.4534, test_f1: 0.5587
 epoch: 59, train_loss: 0.4944, test_loss: 1.5788, test_f1: 0.5360
 epoch: 60, train_loss: 0.5091, test_loss: 1.3553, test_f1: 0.5314
 epoch: 61, train_loss: 0.5085, test_loss: 1.3221, test_f1: 0.5584
 epoch: 62, train_loss: 0.4934, test_loss: 1.2720, test_f1: 0.5547
 epoch: 63, train_loss: 0.4668, test_loss: 1.4420, test_f1: 0.5374
 epoch: 64, train_loss: 0.4700, test_loss: 1.4474, test_f1: 0.5338
 epoch: 65, train_loss: 0.4808, test_loss: 1.2891, test_f1: 0.5595
 epoch: 66, train_loss: 0.4979, test_loss: 1.5359, test_f1: 0.5167
 epoch: 67, train_loss: 0.4657, test_loss: 1.5884, test_f1: 0.5106
 epoch: 68, train_loss: 0.4676, test_loss: 1.3209, test_f1: 0.5847
 epoch: 69, train_loss: 0.4344, test_loss: 1.3298, test_f1: 0.5601
 epoch: 70, train_loss: 0.4393, test_loss: 1.5208, test_f1: 0.5247
 epoch: 71, train_loss: 0.4421, test_loss: 1.3209, test_f1: 0.5579
 epoch: 72, train_loss: 0.4209, test_loss: 1.3148, test_f1: 0.5569
 epoch: 73, train_loss: 0.4352, test_loss: 1.3608, test_f1: 0.5547
 epoch: 74, train_loss: 0.4288, test_loss: 1.6500, test_f1: 0.5119
 epoch: 75, train_loss: 0.4511, test_loss: 1.2712, test_f1: 0.5764
 epoch: 76, train_loss: 0.4953, test_loss: 1.3805, test_f1: 0.5949
 epoch: 77, train_loss: 0.4597, test_loss: 1.8518, test_f1: 0.5269
 epoch: 78, train_loss: 0.4406, test_loss: 1.2924, test_f1: 0.5797
 epoch: 79, train_loss: 0.4411, test_loss: 1.2673, test_f1: 0.5552
 epoch: 80, train_loss: 0.4331, test_loss: 1.8019, test_f1: 0.5020
 epoch: 81, train_loss: 0.4418, test_loss: 1.3660, test_f1: 0.5886
 epoch: 82, train_loss: 0.4176, test_loss: 1.3577, test_f1: 0.6048
 epoch: 83, train_loss: 0.4190, test_loss: 1.5790, test_f1: 0.4977
 epoch: 84, train_loss: 0.4275, test_loss: 1.4445, test_f1: 0.5674
 epoch: 85, train_loss: 0.4055, test_loss: 1.6510, test_f1: 0.5733
 epoch: 86, train_loss: 0.4295, test_loss: 1.5346, test_f1: 0.5665
 epoch: 87, train_loss: 0.4128, test_loss: 1.2994, test_f1: 0.5379
 epoch: 88, train_loss: 0.3991, test_loss: 1.3249, test_f1: 0.5895
 epoch: 89, train_loss: 0.4084, test_loss: 1.5862, test_f1: 0.5251
 epoch: 90, train_loss: 0.4071, test_loss: 1.8247, test_f1: 0.5452
 epoch: 91, train_loss: 0.4232, test_loss: 1.6553, test_f1: 0.5809
 epoch: 92, train_loss: 0.4070, test_loss: 1.5079, test_f1: 0.5932
 epoch: 93, train_loss: 0.4233, test_loss: 1.5443, test_f1: 0.6084
 epoch: 94, train_loss: 0.4214, test_loss: 1.5201, test_f1: 0.5578
 epoch: 95, train_loss: 0.3898, test_loss: 1.6101, test_f1: 0.5696
 epoch: 96, train_loss: 0.3670, test_loss: 1.5848, test_f1: 0.5750
 epoch: 97, train_loss: 0.3626, test_loss: 1.6364, test_f1: 0.5777
 epoch: 98, train_loss: 0.4059, test_loss: 1.5491, test_f1: 0.5966
 epoch: 99, train_loss: 0.3815, test_loss: 1.3621, test_f1: 0.5858
##################ITERATION #4 ****************************************
 epoch: 0, train_loss: 1.5285, test_loss: 1.7766, test_f1: 0.2281
 epoch: 1, train_loss: 1.0530, test_loss: 1.5772, test_f1: 0.2306
 epoch: 2, train_loss: 0.9543, test_loss: 1.3731, test_f1: 0.2934
 epoch: 3, train_loss: 0.9214, test_loss: 1.2545, test_f1: 0.3895
 epoch: 4, train_loss: 0.8871, test_loss: 1.1600, test_f1: 0.5515
 epoch: 5, train_loss: 0.8917, test_loss: 1.0884, test_f1: 0.5615
 epoch: 6, train_loss: 0.8636, test_loss: 1.0013, test_f1: 0.5942
 epoch: 7, train_loss: 0.8174, test_loss: 1.0505, test_f1: 0.5814
 epoch: 8, train_loss: 0.8233, test_loss: 1.3583, test_f1: 0.4387
 epoch: 9, train_loss: 0.8104, test_loss: 1.1517, test_f1: 0.4979
 epoch: 10, train_loss: 0.8017, test_loss: 1.0139, test_f1: 0.5631
 epoch: 11, train_loss: 0.7599, test_loss: 1.0083, test_f1: 0.5857
 epoch: 12, train_loss: 0.7522, test_loss: 1.0298, test_f1: 0.5619
 epoch: 13, train_loss: 0.7624, test_loss: 0.9920, test_f1: 0.5857
 epoch: 14, train_loss: 0.7444, test_loss: 1.0992, test_f1: 0.5497
 epoch: 15, train_loss: 0.7207, test_loss: 1.0144, test_f1: 0.5671
 epoch: 16, train_loss: 0.7247, test_loss: 1.8332, test_f1: 0.4555
 epoch: 17, train_loss: 0.7592, test_loss: 1.0811, test_f1: 0.5171
 epoch: 18, train_loss: 0.7300, test_loss: 0.9830, test_f1: 0.5992
 epoch: 19, train_loss: 0.7496, test_loss: 1.8080, test_f1: 0.3797
 epoch: 20, train_loss: 0.7824, test_loss: 1.8034, test_f1: 0.4162
 epoch: 21, train_loss: 0.7365, test_loss: 1.6603, test_f1: 0.3873
 epoch: 22, train_loss: 0.6846, test_loss: 1.2938, test_f1: 0.4673
 epoch: 23, train_loss: 0.6962, test_loss: 1.0394, test_f1: 0.5738
 epoch: 24, train_loss: 0.6446, test_loss: 1.0456, test_f1: 0.5871
 epoch: 25, train_loss: 0.6351, test_loss: 1.1150, test_f1: 0.5371
 epoch: 26, train_loss: 0.6465, test_loss: 1.9204, test_f1: 0.4169
 epoch: 27, train_loss: 0.6344, test_loss: 1.1144, test_f1: 0.5600
 epoch: 28, train_loss: 0.6411, test_loss: 1.1089, test_f1: 0.5752
 epoch: 29, train_loss: 0.6302, test_loss: 1.1655, test_f1: 0.5575
 epoch: 30, train_loss: 0.6390, test_loss: 1.2310, test_f1: 0.5112
 epoch: 31, train_loss: 0.6355, test_loss: 1.5635, test_f1: 0.5203
 epoch: 32, train_loss: 0.6518, test_loss: 1.4216, test_f1: 0.4950
 epoch: 33, train_loss: 0.6394, test_loss: 1.0957, test_f1: 0.5551
 epoch: 34, train_loss: 0.6136, test_loss: 1.3904, test_f1: 0.4796
 epoch: 35, train_loss: 0.6067, test_loss: 1.1220, test_f1: 0.5887
 epoch: 36, train_loss: 0.6503, test_loss: 1.1824, test_f1: 0.5502
 epoch: 37, train_loss: 0.6129, test_loss: 1.2714, test_f1: 0.5329
 epoch: 38, train_loss: 0.5807, test_loss: 1.1607, test_f1: 0.5536
 epoch: 39, train_loss: 0.6233, test_loss: 1.9141, test_f1: 0.4310
 epoch: 40, train_loss: 0.5986, test_loss: 2.2635, test_f1: 0.3678
 epoch: 41, train_loss: 0.6137, test_loss: 1.6186, test_f1: 0.4543
 epoch: 42, train_loss: 0.5899, test_loss: 1.1668, test_f1: 0.5072
 epoch: 43, train_loss: 0.5839, test_loss: 1.5787, test_f1: 0.4584
 epoch: 44, train_loss: 0.5521, test_loss: 1.4024, test_f1: 0.4988
 epoch: 45, train_loss: 0.5380, test_loss: 1.2929, test_f1: 0.5816
 epoch: 46, train_loss: 0.5588, test_loss: 1.7859, test_f1: 0.4761
 epoch: 47, train_loss: 0.5186, test_loss: 1.6082, test_f1: 0.5480
 epoch: 48, train_loss: 0.5272, test_loss: 1.2548, test_f1: 0.5622
 epoch: 49, train_loss: 0.5183, test_loss: 1.2676, test_f1: 0.5815
 epoch: 50, train_loss: 0.5530, test_loss: 1.2050, test_f1: 0.5642
 epoch: 51, train_loss: 0.5224, test_loss: 1.2632, test_f1: 0.5698
 epoch: 52, train_loss: 0.4852, test_loss: 1.5519, test_f1: 0.5918
 epoch: 53, train_loss: 0.4660, test_loss: 1.2028, test_f1: 0.6319
 epoch: 54, train_loss: 0.4596, test_loss: 1.3092, test_f1: 0.5994
 epoch: 55, train_loss: 0.4456, test_loss: 1.2441, test_f1: 0.6037
 epoch: 56, train_loss: 0.4576, test_loss: 1.2981, test_f1: 0.5933
 epoch: 57, train_loss: 0.4543, test_loss: 1.2687, test_f1: 0.5979
 epoch: 58, train_loss: 0.4522, test_loss: 1.3763, test_f1: 0.5375
 epoch: 59, train_loss: 0.4216, test_loss: 1.3598, test_f1: 0.5704
 epoch: 60, train_loss: 0.4311, test_loss: 1.3444, test_f1: 0.5815
 epoch: 61, train_loss: 0.4445, test_loss: 1.3782, test_f1: 0.5957
 epoch: 62, train_loss: 0.4320, test_loss: 1.4338, test_f1: 0.5375
 epoch: 63, train_loss: 0.4218, test_loss: 1.6527, test_f1: 0.5002
 epoch: 64, train_loss: 0.4352, test_loss: 1.5199, test_f1: 0.5482
 epoch: 65, train_loss: 0.4127, test_loss: 1.6759, test_f1: 0.5514
 epoch: 66, train_loss: 0.3970, test_loss: 1.4388, test_f1: 0.5725
 epoch: 67, train_loss: 0.3892, test_loss: 1.6813, test_f1: 0.5202
 epoch: 68, train_loss: 0.4150, test_loss: 1.7696, test_f1: 0.5592
 epoch: 69, train_loss: 0.4090, test_loss: 1.6822, test_f1: 0.5718
 epoch: 70, train_loss: 0.4193, test_loss: 1.4743, test_f1: 0.5691
 epoch: 71, train_loss: 0.4133, test_loss: 1.5623, test_f1: 0.5666
 epoch: 72, train_loss: 0.4015, test_loss: 1.5308, test_f1: 0.6295
 epoch: 73, train_loss: 0.3996, test_loss: 1.4351, test_f1: 0.6177
 epoch: 74, train_loss: 0.3880, test_loss: 1.3928, test_f1: 0.5816
 epoch: 75, train_loss: 0.3789, test_loss: 1.5395, test_f1: 0.5912
 epoch: 76, train_loss: 0.3737, test_loss: 1.4887, test_f1: 0.6299
 epoch: 77, train_loss: 0.3428, test_loss: 1.4231, test_f1: 0.5720
 epoch: 78, train_loss: 0.3617, test_loss: 1.4474, test_f1: 0.5865
 epoch: 79, train_loss: 0.3525, test_loss: 1.5794, test_f1: 0.5838
 epoch: 80, train_loss: 0.3676, test_loss: 1.8279, test_f1: 0.5725
 epoch: 81, train_loss: 0.3444, test_loss: 2.5401, test_f1: 0.4994
 epoch: 82, train_loss: 0.3671, test_loss: 2.0638, test_f1: 0.5191
 epoch: 83, train_loss: 0.3673, test_loss: 1.7324, test_f1: 0.5524
 epoch: 84, train_loss: 0.3788, test_loss: 1.6216, test_f1: 0.5765
 epoch: 85, train_loss: 0.3678, test_loss: 1.7627, test_f1: 0.5837
 epoch: 86, train_loss: 0.3650, test_loss: 1.7078, test_f1: 0.5777
 epoch: 87, train_loss: 0.3714, test_loss: 1.6652, test_f1: 0.5866
 epoch: 88, train_loss: 0.3816, test_loss: 2.1521, test_f1: 0.5773
 epoch: 89, train_loss: 0.3965, test_loss: 1.5491, test_f1: 0.5649
 epoch: 90, train_loss: 0.4103, test_loss: 1.3785, test_f1: 0.5757
 epoch: 91, train_loss: 0.3442, test_loss: 1.3456, test_f1: 0.5956
 epoch: 92, train_loss: 0.3682, test_loss: 1.4390, test_f1: 0.6290
 epoch: 93, train_loss: 0.3699, test_loss: 1.7523, test_f1: 0.6115
 epoch: 94, train_loss: 0.3524, test_loss: 2.2107, test_f1: 0.5108
 epoch: 95, train_loss: 0.3498, test_loss: 1.7325, test_f1: 0.5646
 epoch: 96, train_loss: 0.3239, test_loss: 1.8639, test_f1: 0.5734
 epoch: 97, train_loss: 0.3415, test_loss: 1.7147, test_f1: 0.5448
 epoch: 98, train_loss: 0.3125, test_loss: 1.6268, test_f1: 0.5850
 epoch: 99, train_loss: 0.3188, test_loss: 1.6155, test_f1: 0.5794
##################ITERATION #5 ****************************************
 epoch: 0, train_loss: 1.8125, test_loss: 1.7234, test_f1: 0.2583
 epoch: 1, train_loss: 1.0510, test_loss: 1.4926, test_f1: 0.1742
 epoch: 2, train_loss: 0.9784, test_loss: 1.4817, test_f1: 0.1432
 epoch: 3, train_loss: 0.9339, test_loss: 1.4291, test_f1: 0.2115
 epoch: 4, train_loss: 0.8888, test_loss: 1.3196, test_f1: 0.3885
 epoch: 5, train_loss: 0.8554, test_loss: 1.3112, test_f1: 0.4405
 epoch: 6, train_loss: 0.8376, test_loss: 1.1410, test_f1: 0.5370
 epoch: 7, train_loss: 0.8396, test_loss: 1.0995, test_f1: 0.5224
 epoch: 8, train_loss: 0.8074, test_loss: 1.0119, test_f1: 0.5805
 epoch: 9, train_loss: 0.8106, test_loss: 0.9665, test_f1: 0.5798
 epoch: 10, train_loss: 0.8144, test_loss: 1.2895, test_f1: 0.4612
 epoch: 11, train_loss: 0.8109, test_loss: 1.2285, test_f1: 0.4802
 epoch: 12, train_loss: 0.7688, test_loss: 1.1552, test_f1: 0.4869
 epoch: 13, train_loss: 0.7473, test_loss: 1.1076, test_f1: 0.5279
 epoch: 14, train_loss: 0.7170, test_loss: 1.1667, test_f1: 0.5414
 epoch: 15, train_loss: 0.7918, test_loss: 1.1514, test_f1: 0.4888
 epoch: 16, train_loss: 0.7450, test_loss: 1.1286, test_f1: 0.4991
 epoch: 17, train_loss: 0.7096, test_loss: 1.0582, test_f1: 0.5322
 epoch: 18, train_loss: 0.7238, test_loss: 1.4819, test_f1: 0.4057
 epoch: 19, train_loss: 0.6818, test_loss: 1.0038, test_f1: 0.5669
 epoch: 20, train_loss: 0.6833, test_loss: 1.0590, test_f1: 0.5476
 epoch: 21, train_loss: 0.6977, test_loss: 1.3656, test_f1: 0.5119
 epoch: 22, train_loss: 0.6972, test_loss: 1.1690, test_f1: 0.5159
 epoch: 23, train_loss: 0.7117, test_loss: 1.1829, test_f1: 0.5353
 epoch: 24, train_loss: 0.6689, test_loss: 1.1814, test_f1: 0.5298
 epoch: 25, train_loss: 0.6608, test_loss: 1.3284, test_f1: 0.5353
 epoch: 26, train_loss: 0.6200, test_loss: 1.5618, test_f1: 0.4991
 epoch: 27, train_loss: 0.6392, test_loss: 1.5697, test_f1: 0.4523
 epoch: 28, train_loss: 0.6364, test_loss: 1.2637, test_f1: 0.5276
 epoch: 29, train_loss: 0.6387, test_loss: 1.5454, test_f1: 0.5039
 epoch: 30, train_loss: 0.5924, test_loss: 1.2604, test_f1: 0.5679
 epoch: 31, train_loss: 0.6251, test_loss: 1.2050, test_f1: 0.4895
 epoch: 32, train_loss: 0.6546, test_loss: 1.1464, test_f1: 0.5524
 epoch: 33, train_loss: 0.6225, test_loss: 1.4895, test_f1: 0.5041
 epoch: 34, train_loss: 0.6037, test_loss: 1.2394, test_f1: 0.4691
 epoch: 35, train_loss: 0.6113, test_loss: 1.6587, test_f1: 0.4640
 epoch: 36, train_loss: 0.6077, test_loss: 1.5341, test_f1: 0.4743
 epoch: 37, train_loss: 0.5958, test_loss: 1.3540, test_f1: 0.5097
 epoch: 38, train_loss: 0.5711, test_loss: 1.9974, test_f1: 0.4497
 epoch: 39, train_loss: 0.6184, test_loss: 1.9205, test_f1: 0.4136
 epoch: 40, train_loss: 0.6645, test_loss: 2.1676, test_f1: 0.4178
 epoch: 41, train_loss: 0.6707, test_loss: 3.5441, test_f1: 0.3210
 epoch: 42, train_loss: 0.6214, test_loss: 1.6013, test_f1: 0.4839
 epoch: 43, train_loss: 0.6039, test_loss: 1.1627, test_f1: 0.4927
 epoch: 44, train_loss: 0.6033, test_loss: 1.1741, test_f1: 0.5384
 epoch: 45, train_loss: 0.6525, test_loss: 1.1888, test_f1: 0.5262
 epoch: 46, train_loss: 0.6094, test_loss: 1.4751, test_f1: 0.5048
 epoch: 47, train_loss: 0.5717, test_loss: 1.4837, test_f1: 0.4667
 epoch: 48, train_loss: 0.5455, test_loss: 1.6502, test_f1: 0.4801
 epoch: 49, train_loss: 0.5461, test_loss: 1.2857, test_f1: 0.5567
 epoch: 50, train_loss: 0.5481, test_loss: 1.3702, test_f1: 0.5225
 epoch: 51, train_loss: 0.5281, test_loss: 1.2742, test_f1: 0.5647
 epoch: 52, train_loss: 0.4984, test_loss: 1.2653, test_f1: 0.5484
 epoch: 53, train_loss: 0.5013, test_loss: 1.3991, test_f1: 0.5552
 epoch: 54, train_loss: 0.4777, test_loss: 1.6366, test_f1: 0.5341
 epoch: 55, train_loss: 0.4845, test_loss: 1.5351, test_f1: 0.5728
 epoch: 56, train_loss: 0.4381, test_loss: 1.4766, test_f1: 0.5556
 epoch: 57, train_loss: 0.4513, test_loss: 1.3493, test_f1: 0.5600
 epoch: 58, train_loss: 0.4336, test_loss: 1.3987, test_f1: 0.5521
 epoch: 59, train_loss: 0.4498, test_loss: 1.3971, test_f1: 0.5347
 epoch: 60, train_loss: 0.4016, test_loss: 1.3832, test_f1: 0.6188
 epoch: 61, train_loss: 0.4222, test_loss: 1.4225, test_f1: 0.5903
 epoch: 62, train_loss: 0.4070, test_loss: 1.5400, test_f1: 0.5649
 epoch: 63, train_loss: 0.4211, test_loss: 1.6268, test_f1: 0.5668
 epoch: 64, train_loss: 0.3956, test_loss: 1.6727, test_f1: 0.5377
 epoch: 65, train_loss: 0.3906, test_loss: 1.5969, test_f1: 0.5670
 epoch: 66, train_loss: 0.3862, test_loss: 1.5356, test_f1: 0.5524
 epoch: 67, train_loss: 0.3849, test_loss: 1.4471, test_f1: 0.5766
 epoch: 68, train_loss: 0.3885, test_loss: 1.5375, test_f1: 0.5638
 epoch: 69, train_loss: 0.3571, test_loss: 1.7310, test_f1: 0.5428
 epoch: 70, train_loss: 0.4380, test_loss: 1.6869, test_f1: 0.5834
 epoch: 71, train_loss: 0.4111, test_loss: 1.3447, test_f1: 0.5896
 epoch: 72, train_loss: 0.4263, test_loss: 1.5404, test_f1: 0.5302
 epoch: 73, train_loss: 0.4367, test_loss: 2.0674, test_f1: 0.4702
 epoch: 74, train_loss: 0.4233, test_loss: 2.4793, test_f1: 0.4540
 epoch: 75, train_loss: 0.4590, test_loss: 1.6023, test_f1: 0.5905
 epoch: 76, train_loss: 0.4341, test_loss: 1.4844, test_f1: 0.5892
 epoch: 77, train_loss: 0.4464, test_loss: 1.5232, test_f1: 0.5845
 epoch: 78, train_loss: 0.4175, test_loss: 1.7070, test_f1: 0.5116
 epoch: 79, train_loss: 0.3987, test_loss: 1.7253, test_f1: 0.5546
 epoch: 80, train_loss: 0.4080, test_loss: 1.7384, test_f1: 0.5575
 epoch: 81, train_loss: 0.3748, test_loss: 1.6980, test_f1: 0.5880
 epoch: 82, train_loss: 0.3586, test_loss: 1.7984, test_f1: 0.5442
 epoch: 83, train_loss: 0.3433, test_loss: 1.4547, test_f1: 0.6122
 epoch: 84, train_loss: 0.3506, test_loss: 1.7363, test_f1: 0.5576
 epoch: 85, train_loss: 0.4015, test_loss: 1.8046, test_f1: 0.5398
 epoch: 86, train_loss: 0.3337, test_loss: 1.7644, test_f1: 0.5713
 epoch: 87, train_loss: 0.3172, test_loss: 1.7837, test_f1: 0.5690
 epoch: 88, train_loss: 0.3481, test_loss: 1.7549, test_f1: 0.5644
 epoch: 89, train_loss: 0.3210, test_loss: 1.7454, test_f1: 0.5717
 epoch: 90, train_loss: 0.3336, test_loss: 1.9126, test_f1: 0.5426
 epoch: 91, train_loss: 0.3655, test_loss: 2.0194, test_f1: 0.5485
 epoch: 92, train_loss: 0.3317, test_loss: 1.9192, test_f1: 0.5589
 epoch: 93, train_loss: 0.3140, test_loss: 1.8602, test_f1: 0.5835
 epoch: 94, train_loss: 0.3323, test_loss: 2.2242, test_f1: 0.5394
 epoch: 95, train_loss: 0.3255, test_loss: 2.3096, test_f1: 0.5426
 epoch: 96, train_loss: 0.3071, test_loss: 2.2064, test_f1: 0.5345
 epoch: 97, train_loss: 0.3012, test_loss: 1.8656, test_f1: 0.5797
 epoch: 98, train_loss: 0.3223, test_loss: 1.8703, test_f1: 0.6131
 epoch: 99, train_loss: 0.2868, test_loss: 2.1834, test_f1: 0.5664
##################ITERATION #6 ****************************************
 epoch: 0, train_loss: 1.5541, test_loss: 1.8111, test_f1: 0.3038
 epoch: 1, train_loss: 1.0281, test_loss: 1.6593, test_f1: 0.1365
 epoch: 2, train_loss: 0.9761, test_loss: 1.5808, test_f1: 0.1368
 epoch: 3, train_loss: 0.9388, test_loss: 1.4458, test_f1: 0.3776
 epoch: 4, train_loss: 0.9052, test_loss: 1.3275, test_f1: 0.3927
 epoch: 5, train_loss: 0.8861, test_loss: 1.1380, test_f1: 0.4662
 epoch: 6, train_loss: 0.8526, test_loss: 1.1742, test_f1: 0.4100
 epoch: 7, train_loss: 0.8589, test_loss: 1.0284, test_f1: 0.5506
 epoch: 8, train_loss: 0.8620, test_loss: 1.0491, test_f1: 0.5769
 epoch: 9, train_loss: 0.8238, test_loss: 1.1629, test_f1: 0.4967
 epoch: 10, train_loss: 0.8254, test_loss: 1.2475, test_f1: 0.4255
 epoch: 11, train_loss: 0.7833, test_loss: 1.0753, test_f1: 0.5447
 epoch: 12, train_loss: 0.7732, test_loss: 0.9951, test_f1: 0.5727
 epoch: 13, train_loss: 0.7554, test_loss: 1.1565, test_f1: 0.4902
 epoch: 14, train_loss: 0.7582, test_loss: 1.0895, test_f1: 0.5258
 epoch: 15, train_loss: 0.7457, test_loss: 1.1253, test_f1: 0.4731
 epoch: 16, train_loss: 0.7514, test_loss: 1.0462, test_f1: 0.5588
 epoch: 17, train_loss: 0.7441, test_loss: 1.0845, test_f1: 0.5110
 epoch: 18, train_loss: 0.7181, test_loss: 1.0806, test_f1: 0.5604
 epoch: 19, train_loss: 0.6978, test_loss: 1.1675, test_f1: 0.4518
 epoch: 20, train_loss: 0.6988, test_loss: 1.1457, test_f1: 0.4538
 epoch: 21, train_loss: 0.6700, test_loss: 1.1942, test_f1: 0.5742
 epoch: 22, train_loss: 0.6723, test_loss: 1.1254, test_f1: 0.5519
 epoch: 23, train_loss: 0.6658, test_loss: 1.3214, test_f1: 0.4310
 epoch: 24, train_loss: 0.6789, test_loss: 1.0484, test_f1: 0.5932
 epoch: 25, train_loss: 0.6458, test_loss: 1.3362, test_f1: 0.4591
 epoch: 26, train_loss: 0.6402, test_loss: 1.1829, test_f1: 0.4549
 epoch: 27, train_loss: 0.6737, test_loss: 1.3012, test_f1: 0.4538
 epoch: 28, train_loss: 0.6517, test_loss: 1.2026, test_f1: 0.5078
 epoch: 29, train_loss: 0.6083, test_loss: 1.2449, test_f1: 0.4983
 epoch: 30, train_loss: 0.6011, test_loss: 1.0263, test_f1: 0.5827
 epoch: 31, train_loss: 0.5724, test_loss: 1.3508, test_f1: 0.4692
 epoch: 32, train_loss: 0.5507, test_loss: 1.1619, test_f1: 0.5147
 epoch: 33, train_loss: 0.5705, test_loss: 1.1108, test_f1: 0.5732
 epoch: 34, train_loss: 0.5774, test_loss: 1.4498, test_f1: 0.4879
 epoch: 35, train_loss: 0.5418, test_loss: 1.9550, test_f1: 0.4737
 epoch: 36, train_loss: 0.5689, test_loss: 1.2938, test_f1: 0.4959
 epoch: 37, train_loss: 0.5978, test_loss: 1.7755, test_f1: 0.5030
 epoch: 38, train_loss: 0.5804, test_loss: 1.5397, test_f1: 0.4929
 epoch: 39, train_loss: 0.5705, test_loss: 1.1433, test_f1: 0.5796
 epoch: 40, train_loss: 0.5689, test_loss: 1.0622, test_f1: 0.5830
 epoch: 41, train_loss: 0.6154, test_loss: 1.8841, test_f1: 0.4134
 epoch: 42, train_loss: 0.6458, test_loss: 1.6549, test_f1: 0.5479
 epoch: 43, train_loss: 0.5892, test_loss: 1.7941, test_f1: 0.4771
 epoch: 44, train_loss: 0.5795, test_loss: 1.3937, test_f1: 0.5068
 epoch: 45, train_loss: 0.5580, test_loss: 1.3452, test_f1: 0.5076
 epoch: 46, train_loss: 0.5585, test_loss: 1.1700, test_f1: 0.5713
 epoch: 47, train_loss: 0.5159, test_loss: 1.3262, test_f1: 0.4884
 epoch: 48, train_loss: 0.5585, test_loss: 1.3248, test_f1: 0.5231
 epoch: 49, train_loss: 0.5890, test_loss: 1.3514, test_f1: 0.4609
 epoch: 50, train_loss: 0.5781, test_loss: 1.2458, test_f1: 0.5324
 epoch: 51, train_loss: 0.5247, test_loss: 1.1850, test_f1: 0.5531
 epoch: 52, train_loss: 0.4793, test_loss: 1.1877, test_f1: 0.6018
 epoch: 53, train_loss: 0.4458, test_loss: 1.4246, test_f1: 0.5807
 epoch: 54, train_loss: 0.4382, test_loss: 1.4482, test_f1: 0.5796
 epoch: 55, train_loss: 0.4694, test_loss: 1.2293, test_f1: 0.5969
 epoch: 56, train_loss: 0.4315, test_loss: 1.2666, test_f1: 0.5844
 epoch: 57, train_loss: 0.4239, test_loss: 1.2551, test_f1: 0.5929
 epoch: 58, train_loss: 0.3982, test_loss: 1.3336, test_f1: 0.5645
 epoch: 59, train_loss: 0.3935, test_loss: 1.5545, test_f1: 0.5367
 epoch: 60, train_loss: 0.3962, test_loss: 1.6230, test_f1: 0.5733
 epoch: 61, train_loss: 0.4016, test_loss: 1.7366, test_f1: 0.4999
 epoch: 62, train_loss: 0.4008, test_loss: 1.4823, test_f1: 0.6081
 epoch: 63, train_loss: 0.3888, test_loss: 2.1083, test_f1: 0.5353
 epoch: 64, train_loss: 0.3654, test_loss: 1.7898, test_f1: 0.5466
 epoch: 65, train_loss: 0.3666, test_loss: 1.6111, test_f1: 0.5523
 epoch: 66, train_loss: 0.4381, test_loss: 1.3417, test_f1: 0.6184
 epoch: 67, train_loss: 0.4045, test_loss: 1.7515, test_f1: 0.5682
 epoch: 68, train_loss: 0.3913, test_loss: 1.3790, test_f1: 0.6711
 epoch: 69, train_loss: 0.3858, test_loss: 1.2739, test_f1: 0.6454
 epoch: 70, train_loss: 0.3854, test_loss: 1.5399, test_f1: 0.5923
 epoch: 71, train_loss: 0.4124, test_loss: 1.5607, test_f1: 0.6068
 epoch: 72, train_loss: 0.4046, test_loss: 1.7419, test_f1: 0.5655
 epoch: 73, train_loss: 0.4075, test_loss: 1.7547, test_f1: 0.5915
 epoch: 74, train_loss: 0.3813, test_loss: 1.5307, test_f1: 0.6037
 epoch: 75, train_loss: 0.3530, test_loss: 1.3839, test_f1: 0.6176
 epoch: 76, train_loss: 0.3624, test_loss: 1.4618, test_f1: 0.6264
 epoch: 77, train_loss: 0.3300, test_loss: 1.5299, test_f1: 0.6200
 epoch: 78, train_loss: 0.3458, test_loss: 1.5248, test_f1: 0.5998
 epoch: 79, train_loss: 0.3340, test_loss: 1.4604, test_f1: 0.5920
 epoch: 80, train_loss: 0.3334, test_loss: 1.5310, test_f1: 0.6257
 epoch: 81, train_loss: 0.3349, test_loss: 1.5608, test_f1: 0.6023
 epoch: 82, train_loss: 0.3296, test_loss: 1.3757, test_f1: 0.6308
 epoch: 83, train_loss: 0.4097, test_loss: 1.7547, test_f1: 0.5797
 epoch: 84, train_loss: 0.3818, test_loss: 1.7409, test_f1: 0.5516
 epoch: 85, train_loss: 0.3876, test_loss: 1.6492, test_f1: 0.5971
 epoch: 86, train_loss: 0.3182, test_loss: 1.4386, test_f1: 0.6255
 epoch: 87, train_loss: 0.3282, test_loss: 1.5748, test_f1: 0.6114
 epoch: 88, train_loss: 0.3232, test_loss: 1.3938, test_f1: 0.6126
 epoch: 89, train_loss: 0.3242, test_loss: 1.5110, test_f1: 0.6359
 epoch: 90, train_loss: 0.3180, test_loss: 1.5100, test_f1: 0.6387
 epoch: 91, train_loss: 0.2971, test_loss: 1.9847, test_f1: 0.5469
 epoch: 92, train_loss: 0.3344, test_loss: 2.0927, test_f1: 0.5411
 epoch: 93, train_loss: 0.3211, test_loss: 1.7739, test_f1: 0.5641
 epoch: 94, train_loss: 0.3153, test_loss: 1.5803, test_f1: 0.6119
 epoch: 95, train_loss: 0.3272, test_loss: 1.4588, test_f1: 0.6316
 epoch: 96, train_loss: 0.2960, test_loss: 1.3930, test_f1: 0.6551
 epoch: 97, train_loss: 0.3050, test_loss: 1.5853, test_f1: 0.6042
 epoch: 98, train_loss: 0.2990, test_loss: 1.5549, test_f1: 0.6100
 epoch: 99, train_loss: 0.3049, test_loss: 1.5556, test_f1: 0.5921
##################ITERATION #7 ****************************************
 epoch: 0, train_loss: 1.8845, test_loss: 1.4556, test_f1: 0.3282
 epoch: 1, train_loss: 1.0641, test_loss: 1.2722, test_f1: 0.3060
 epoch: 2, train_loss: 0.9968, test_loss: 1.2117, test_f1: 0.2641
 epoch: 3, train_loss: 0.9639, test_loss: 1.1309, test_f1: 0.4526
 epoch: 4, train_loss: 0.9351, test_loss: 1.0607, test_f1: 0.5225
 epoch: 5, train_loss: 0.9213, test_loss: 1.1153, test_f1: 0.4840
 epoch: 6, train_loss: 0.8935, test_loss: 1.3068, test_f1: 0.3848
 epoch: 7, train_loss: 0.8866, test_loss: 1.0734, test_f1: 0.5342
 epoch: 8, train_loss: 0.8769, test_loss: 1.0396, test_f1: 0.5604
 epoch: 9, train_loss: 0.8575, test_loss: 1.1996, test_f1: 0.4834
 epoch: 10, train_loss: 0.8604, test_loss: 1.1165, test_f1: 0.4561
 epoch: 11, train_loss: 0.8233, test_loss: 1.5804, test_f1: 0.4014
 epoch: 12, train_loss: 0.8263, test_loss: 1.0759, test_f1: 0.5428
 epoch: 13, train_loss: 0.8136, test_loss: 1.1161, test_f1: 0.4466
 epoch: 14, train_loss: 0.8100, test_loss: 1.0741, test_f1: 0.5560
 epoch: 15, train_loss: 0.8099, test_loss: 1.0234, test_f1: 0.5071
 epoch: 16, train_loss: 0.8212, test_loss: 1.0024, test_f1: 0.5497
 epoch: 17, train_loss: 0.7906, test_loss: 1.0832, test_f1: 0.5093
 epoch: 18, train_loss: 0.7777, test_loss: 1.2582, test_f1: 0.3714
 epoch: 19, train_loss: 0.7478, test_loss: 1.0440, test_f1: 0.5297
 epoch: 20, train_loss: 0.7638, test_loss: 1.2506, test_f1: 0.4728
 epoch: 21, train_loss: 0.8210, test_loss: 1.9885, test_f1: 0.4282
 epoch: 22, train_loss: 0.7601, test_loss: 1.1247, test_f1: 0.5036
 epoch: 23, train_loss: 0.7240, test_loss: 1.1309, test_f1: 0.5232
 epoch: 24, train_loss: 0.7083, test_loss: 1.1066, test_f1: 0.5455
 epoch: 25, train_loss: 0.7252, test_loss: 1.1814, test_f1: 0.5298
 epoch: 26, train_loss: 0.7096, test_loss: 1.0871, test_f1: 0.5112
 epoch: 27, train_loss: 0.6952, test_loss: 1.2121, test_f1: 0.4831
 epoch: 28, train_loss: 0.7193, test_loss: 1.5179, test_f1: 0.4998
 epoch: 29, train_loss: 0.7149, test_loss: 1.5274, test_f1: 0.5192
 epoch: 30, train_loss: 0.6977, test_loss: 1.1819, test_f1: 0.5453
 epoch: 31, train_loss: 0.7247, test_loss: 1.2529, test_f1: 0.5580
 epoch: 32, train_loss: 0.6902, test_loss: 1.2351, test_f1: 0.5422
 epoch: 33, train_loss: 0.6622, test_loss: 1.3353, test_f1: 0.5475
 epoch: 34, train_loss: 0.6825, test_loss: 1.3635, test_f1: 0.4307
 epoch: 35, train_loss: 0.6698, test_loss: 1.0805, test_f1: 0.5755
 epoch: 36, train_loss: 0.6624, test_loss: 1.2182, test_f1: 0.5287
 epoch: 37, train_loss: 0.6475, test_loss: 1.1115, test_f1: 0.5508
 epoch: 38, train_loss: 0.6517, test_loss: 1.1137, test_f1: 0.5748
 epoch: 39, train_loss: 0.6179, test_loss: 1.4468, test_f1: 0.5512
 epoch: 40, train_loss: 0.6151, test_loss: 1.1050, test_f1: 0.5424
 epoch: 41, train_loss: 0.6165, test_loss: 1.0719, test_f1: 0.5733
 epoch: 42, train_loss: 0.6157, test_loss: 1.4699, test_f1: 0.5772
 epoch: 43, train_loss: 0.6120, test_loss: 1.3338, test_f1: 0.5539
 epoch: 44, train_loss: 0.6677, test_loss: 1.2385, test_f1: 0.5435
 epoch: 45, train_loss: 0.6571, test_loss: 1.1122, test_f1: 0.6169
 epoch: 46, train_loss: 0.6240, test_loss: 1.1205, test_f1: 0.6350
 epoch: 47, train_loss: 0.6205, test_loss: 1.2004, test_f1: 0.5667
 epoch: 48, train_loss: 0.6082, test_loss: 1.4092, test_f1: 0.4207
 epoch: 49, train_loss: 0.6316, test_loss: 1.2682, test_f1: 0.5790
 epoch: 50, train_loss: 0.5978, test_loss: 1.2057, test_f1: 0.6146
 epoch: 51, train_loss: 0.5710, test_loss: 1.0791, test_f1: 0.6405
 epoch: 52, train_loss: 0.5427, test_loss: 1.1242, test_f1: 0.6055
 epoch: 53, train_loss: 0.5293, test_loss: 1.2349, test_f1: 0.5395
 epoch: 54, train_loss: 0.5368, test_loss: 1.4086, test_f1: 0.5519
 epoch: 55, train_loss: 0.5367, test_loss: 1.3955, test_f1: 0.6141
 epoch: 56, train_loss: 0.5156, test_loss: 1.3218, test_f1: 0.5531
 epoch: 57, train_loss: 0.5019, test_loss: 1.2734, test_f1: 0.6077
 epoch: 58, train_loss: 0.5408, test_loss: 1.3217, test_f1: 0.5785
 epoch: 59, train_loss: 0.5090, test_loss: 1.4849, test_f1: 0.5932
 epoch: 60, train_loss: 0.4975, test_loss: 1.5094, test_f1: 0.5941
 epoch: 61, train_loss: 0.4928, test_loss: 1.4381, test_f1: 0.5530
 epoch: 62, train_loss: 0.4799, test_loss: 1.2600, test_f1: 0.6058
 epoch: 63, train_loss: 0.4670, test_loss: 1.3030, test_f1: 0.5955
 epoch: 64, train_loss: 0.4771, test_loss: 1.5647, test_f1: 0.5208
 epoch: 65, train_loss: 0.4849, test_loss: 1.3576, test_f1: 0.5640
 epoch: 66, train_loss: 0.4903, test_loss: 1.4715, test_f1: 0.5698
 epoch: 67, train_loss: 0.4683, test_loss: 1.5890, test_f1: 0.6207
 epoch: 68, train_loss: 0.4552, test_loss: 1.5006, test_f1: 0.5831
 epoch: 69, train_loss: 0.4471, test_loss: 1.7133, test_f1: 0.5866
 epoch: 70, train_loss: 0.4528, test_loss: 1.6251, test_f1: 0.5946
 epoch: 71, train_loss: 0.4417, test_loss: 1.5231, test_f1: 0.6001
 epoch: 72, train_loss: 0.4467, test_loss: 1.6491, test_f1: 0.5468
 epoch: 73, train_loss: 0.4258, test_loss: 1.6437, test_f1: 0.5687
 epoch: 74, train_loss: 0.4133, test_loss: 1.8862, test_f1: 0.5717
 epoch: 75, train_loss: 0.4277, test_loss: 1.4411, test_f1: 0.6195
 epoch: 76, train_loss: 0.4153, test_loss: 1.3704, test_f1: 0.5953
 epoch: 77, train_loss: 0.4551, test_loss: 1.4213, test_f1: 0.5890
 epoch: 78, train_loss: 0.4649, test_loss: 1.4748, test_f1: 0.5833
 epoch: 79, train_loss: 0.4045, test_loss: 1.6864, test_f1: 0.5945
 epoch: 80, train_loss: 0.4086, test_loss: 1.8468, test_f1: 0.5897
 epoch: 81, train_loss: 0.3955, test_loss: 1.4697, test_f1: 0.5903
 epoch: 82, train_loss: 0.3873, test_loss: 2.1103, test_f1: 0.5418
 epoch: 83, train_loss: 0.3808, test_loss: 1.5788, test_f1: 0.5639
 epoch: 84, train_loss: 0.4293, test_loss: 1.5905, test_f1: 0.6025
 epoch: 85, train_loss: 0.4127, test_loss: 1.6619, test_f1: 0.5851
 epoch: 86, train_loss: 0.4067, test_loss: 1.4315, test_f1: 0.5884
 epoch: 87, train_loss: 0.3602, test_loss: 1.4447, test_f1: 0.6289
 epoch: 88, train_loss: 0.4101, test_loss: 1.7282, test_f1: 0.5784
 epoch: 89, train_loss: 0.4247, test_loss: 1.8189, test_f1: 0.5724
 epoch: 90, train_loss: 0.3996, test_loss: 1.9740, test_f1: 0.5898
 epoch: 91, train_loss: 0.3585, test_loss: 1.5592, test_f1: 0.6068
 epoch: 92, train_loss: 0.3649, test_loss: 1.4362, test_f1: 0.5668
 epoch: 93, train_loss: 0.4180, test_loss: 1.6010, test_f1: 0.5869
 epoch: 94, train_loss: 0.3619, test_loss: 1.2834, test_f1: 0.6016
 epoch: 95, train_loss: 0.4067, test_loss: 1.1815, test_f1: 0.6404
 epoch: 96, train_loss: 0.4178, test_loss: 1.4334, test_f1: 0.5484
 epoch: 97, train_loss: 0.3632, test_loss: 1.5061, test_f1: 0.5521
 epoch: 98, train_loss: 0.3706, test_loss: 2.1826, test_f1: 0.5459
 epoch: 99, train_loss: 0.3581, test_loss: 2.2677, test_f1: 0.5652
##################ITERATION #8 ****************************************
 epoch: 0, train_loss: 1.4933, test_loss: 1.5137, test_f1: 0.3232
 epoch: 1, train_loss: 1.0804, test_loss: 1.5716, test_f1: 0.1420
 epoch: 2, train_loss: 0.9851, test_loss: 1.5053, test_f1: 0.3117
 epoch: 3, train_loss: 0.9568, test_loss: 1.3325, test_f1: 0.2849
 epoch: 4, train_loss: 0.9111, test_loss: 1.2504, test_f1: 0.4083
 epoch: 5, train_loss: 0.9105, test_loss: 1.1305, test_f1: 0.4163
 epoch: 6, train_loss: 0.8735, test_loss: 1.0272, test_f1: 0.5178
 epoch: 7, train_loss: 0.8537, test_loss: 1.0463, test_f1: 0.5380
 epoch: 8, train_loss: 0.8338, test_loss: 1.0175, test_f1: 0.5195
 epoch: 9, train_loss: 0.8178, test_loss: 1.0424, test_f1: 0.5463
 epoch: 10, train_loss: 0.8001, test_loss: 1.2166, test_f1: 0.4017
 epoch: 11, train_loss: 0.7799, test_loss: 1.1484, test_f1: 0.4843
 epoch: 12, train_loss: 0.7803, test_loss: 1.0388, test_f1: 0.5860
 epoch: 13, train_loss: 0.7750, test_loss: 1.1476, test_f1: 0.5281
 epoch: 14, train_loss: 0.7588, test_loss: 1.0938, test_f1: 0.5743
 epoch: 15, train_loss: 0.7687, test_loss: 1.1955, test_f1: 0.4887
 epoch: 16, train_loss: 0.7427, test_loss: 1.0009, test_f1: 0.5829
 epoch: 17, train_loss: 0.7523, test_loss: 1.2100, test_f1: 0.5503
 epoch: 18, train_loss: 0.7673, test_loss: 1.5340, test_f1: 0.4568
 epoch: 19, train_loss: 0.7343, test_loss: 1.3273, test_f1: 0.5013
 epoch: 20, train_loss: 0.7047, test_loss: 1.1216, test_f1: 0.5524
 epoch: 21, train_loss: 0.7027, test_loss: 1.3155, test_f1: 0.4442
 epoch: 22, train_loss: 0.7357, test_loss: 3.0111, test_f1: 0.3400
 epoch: 23, train_loss: 0.7501, test_loss: 1.2494, test_f1: 0.5160
 epoch: 24, train_loss: 0.7846, test_loss: 1.1874, test_f1: 0.4512
 epoch: 25, train_loss: 0.7431, test_loss: 1.1189, test_f1: 0.5016
 epoch: 26, train_loss: 0.7188, test_loss: 1.2279, test_f1: 0.4754
 epoch: 27, train_loss: 0.6880, test_loss: 1.0538, test_f1: 0.6043
 epoch: 28, train_loss: 0.6994, test_loss: 1.0127, test_f1: 0.5216
 epoch: 29, train_loss: 0.6808, test_loss: 2.2285, test_f1: 0.3349
 epoch: 30, train_loss: 0.6467, test_loss: 0.9971, test_f1: 0.6101
 epoch: 31, train_loss: 0.5967, test_loss: 1.0600, test_f1: 0.5460
 epoch: 32, train_loss: 0.6283, test_loss: 1.1279, test_f1: 0.5392
 epoch: 33, train_loss: 0.5914, test_loss: 2.0526, test_f1: 0.3779
 epoch: 34, train_loss: 0.6375, test_loss: 3.4394, test_f1: 0.3806
 epoch: 35, train_loss: 0.6580, test_loss: 1.6884, test_f1: 0.3993
 epoch: 36, train_loss: 0.6462, test_loss: 1.0930, test_f1: 0.5297
 epoch: 37, train_loss: 0.6288, test_loss: 1.0005, test_f1: 0.6122
 epoch: 38, train_loss: 0.6515, test_loss: 1.2669, test_f1: 0.4415
 epoch: 39, train_loss: 0.6292, test_loss: 1.0096, test_f1: 0.6038
 epoch: 40, train_loss: 0.6452, test_loss: 1.1208, test_f1: 0.5970
 epoch: 41, train_loss: 0.5782, test_loss: 1.3171, test_f1: 0.5674
 epoch: 42, train_loss: 0.5702, test_loss: 1.1213, test_f1: 0.5941
 epoch: 43, train_loss: 0.5385, test_loss: 1.1889, test_f1: 0.5924
 epoch: 44, train_loss: 0.5516, test_loss: 1.2924, test_f1: 0.6071
 epoch: 45, train_loss: 0.5358, test_loss: 1.1491, test_f1: 0.5742
 epoch: 46, train_loss: 0.5380, test_loss: 1.1163, test_f1: 0.6019
 epoch: 47, train_loss: 0.5270, test_loss: 1.4035, test_f1: 0.5880
 epoch: 48, train_loss: 0.5315, test_loss: 1.4131, test_f1: 0.5918
 epoch: 49, train_loss: 0.5123, test_loss: 1.6274, test_f1: 0.4848
 epoch: 50, train_loss: 0.5091, test_loss: 1.5529, test_f1: 0.6072
 epoch: 51, train_loss: 0.4736, test_loss: 1.5310, test_f1: 0.6268
 epoch: 52, train_loss: 0.4862, test_loss: 1.5340, test_f1: 0.5573
 epoch: 53, train_loss: 0.4959, test_loss: 1.3378, test_f1: 0.5942
 epoch: 54, train_loss: 0.4577, test_loss: 1.2331, test_f1: 0.6132
 epoch: 55, train_loss: 0.4624, test_loss: 1.4157, test_f1: 0.5929
 epoch: 56, train_loss: 0.4338, test_loss: 1.4688, test_f1: 0.6159
 epoch: 57, train_loss: 0.4423, test_loss: 1.2810, test_f1: 0.5984
 epoch: 58, train_loss: 0.4277, test_loss: 1.6137, test_f1: 0.5632
 epoch: 59, train_loss: 0.4267, test_loss: 1.5664, test_f1: 0.5850
 epoch: 60, train_loss: 0.4347, test_loss: 1.5058, test_f1: 0.5506
 epoch: 61, train_loss: 0.4288, test_loss: 1.3891, test_f1: 0.5851
 epoch: 62, train_loss: 0.4182, test_loss: 1.5969, test_f1: 0.5937
 epoch: 63, train_loss: 0.4323, test_loss: 1.7667, test_f1: 0.5823
 epoch: 64, train_loss: 0.4206, test_loss: 1.8992, test_f1: 0.5606
 epoch: 65, train_loss: 0.4188, test_loss: 1.6267, test_f1: 0.5574
 epoch: 66, train_loss: 0.3917, test_loss: 1.8391, test_f1: 0.5781
 epoch: 67, train_loss: 0.3998, test_loss: 1.5231, test_f1: 0.5727
 epoch: 68, train_loss: 0.4403, test_loss: 1.7976, test_f1: 0.5602
 epoch: 69, train_loss: 0.3899, test_loss: 1.6009, test_f1: 0.6047
 epoch: 70, train_loss: 0.3950, test_loss: 1.5855, test_f1: 0.5763
 epoch: 71, train_loss: 0.3903, test_loss: 1.6460, test_f1: 0.5847
 epoch: 72, train_loss: 0.3873, test_loss: 1.7352, test_f1: 0.5882
 epoch: 73, train_loss: 0.3533, test_loss: 1.6434, test_f1: 0.6136
 epoch: 74, train_loss: 0.3599, test_loss: 1.9089, test_f1: 0.5692
 epoch: 75, train_loss: 0.3589, test_loss: 2.0729, test_f1: 0.5539
 epoch: 76, train_loss: 0.3531, test_loss: 1.8663, test_f1: 0.5770
 epoch: 77, train_loss: 0.4037, test_loss: 1.9745, test_f1: 0.5981
 epoch: 78, train_loss: 0.3492, test_loss: 1.8153, test_f1: 0.5794
 epoch: 79, train_loss: 0.3887, test_loss: 1.6069, test_f1: 0.5760
 epoch: 80, train_loss: 0.3585, test_loss: 1.8984, test_f1: 0.5909
 epoch: 81, train_loss: 0.3676, test_loss: 1.9405, test_f1: 0.6077
 epoch: 82, train_loss: 0.3579, test_loss: 1.9061, test_f1: 0.5631
 epoch: 83, train_loss: 0.3647, test_loss: 1.9806, test_f1: 0.5782
 epoch: 84, train_loss: 0.3906, test_loss: 1.7913, test_f1: 0.6081
 epoch: 85, train_loss: 0.4436, test_loss: 2.1253, test_f1: 0.5298
 epoch: 86, train_loss: 0.3899, test_loss: 1.9121, test_f1: 0.6255
 epoch: 87, train_loss: 0.3742, test_loss: 1.6649, test_f1: 0.6229
 epoch: 88, train_loss: 0.3589, test_loss: 1.6831, test_f1: 0.5670
 epoch: 89, train_loss: 0.3470, test_loss: 2.0757, test_f1: 0.5271
 epoch: 90, train_loss: 0.3267, test_loss: 2.1407, test_f1: 0.6071
 epoch: 91, train_loss: 0.3708, test_loss: 2.2243, test_f1: 0.6047
 epoch: 92, train_loss: 0.3340, test_loss: 2.0059, test_f1: 0.6090
 epoch: 93, train_loss: 0.3343, test_loss: 1.8978, test_f1: 0.5422
 epoch: 94, train_loss: 0.3348, test_loss: 1.7738, test_f1: 0.5717
 epoch: 95, train_loss: 0.3121, test_loss: 1.5450, test_f1: 0.6044
 epoch: 96, train_loss: 0.3659, test_loss: 1.6493, test_f1: 0.5850
 epoch: 97, train_loss: 0.3330, test_loss: 1.6213, test_f1: 0.6057
 epoch: 98, train_loss: 0.3349, test_loss: 1.7913, test_f1: 0.5662
 epoch: 99, train_loss: 0.3534, test_loss: 1.8146, test_f1: 0.5758
##################ITERATION #9 ****************************************
 epoch: 0, train_loss: 1.7621, test_loss: 1.4439, test_f1: 0.1368
 epoch: 1, train_loss: 1.0448, test_loss: 1.5105, test_f1: 0.3232
 epoch: 2, train_loss: 0.9576, test_loss: 1.5341, test_f1: 0.2583
 epoch: 3, train_loss: 0.9373, test_loss: 1.6219, test_f1: 0.3232
 epoch: 4, train_loss: 0.9071, test_loss: 1.5071, test_f1: 0.3086
 epoch: 5, train_loss: 0.8749, test_loss: 1.4252, test_f1: 0.3981
 epoch: 6, train_loss: 0.8958, test_loss: 1.0892, test_f1: 0.5377
 epoch: 7, train_loss: 0.8306, test_loss: 1.3213, test_f1: 0.3322
 epoch: 8, train_loss: 0.8129, test_loss: 1.0180, test_f1: 0.5976
 epoch: 9, train_loss: 0.7964, test_loss: 1.0371, test_f1: 0.5988
 epoch: 10, train_loss: 0.8115, test_loss: 1.0168, test_f1: 0.5765
 epoch: 11, train_loss: 0.7976, test_loss: 1.4625, test_f1: 0.3666
 epoch: 12, train_loss: 0.7982, test_loss: 1.0276, test_f1: 0.5477
 epoch: 13, train_loss: 0.7643, test_loss: 1.1242, test_f1: 0.5118
 epoch: 14, train_loss: 0.7664, test_loss: 1.2279, test_f1: 0.4923
 epoch: 15, train_loss: 0.7286, test_loss: 1.1724, test_f1: 0.4818
 epoch: 16, train_loss: 0.7351, test_loss: 1.4291, test_f1: 0.4629
 epoch: 17, train_loss: 0.7520, test_loss: 1.1320, test_f1: 0.5428
 epoch: 18, train_loss: 0.7344, test_loss: 1.1484, test_f1: 0.5535
 epoch: 19, train_loss: 0.7695, test_loss: 1.1006, test_f1: 0.5021
 epoch: 20, train_loss: 0.7228, test_loss: 1.1157, test_f1: 0.5254
 epoch: 21, train_loss: 0.7232, test_loss: 1.0544, test_f1: 0.5398
 epoch: 22, train_loss: 0.7347, test_loss: 1.1328, test_f1: 0.5507
 epoch: 23, train_loss: 0.7118, test_loss: 1.1433, test_f1: 0.5672
 epoch: 24, train_loss: 0.6865, test_loss: 1.1420, test_f1: 0.5566
 epoch: 25, train_loss: 0.6882, test_loss: 1.0259, test_f1: 0.5609
 epoch: 26, train_loss: 0.6567, test_loss: 1.1454, test_f1: 0.5160
 epoch: 27, train_loss: 0.6262, test_loss: 1.2042, test_f1: 0.5718
 epoch: 28, train_loss: 0.6199, test_loss: 1.2046, test_f1: 0.5925
 epoch: 29, train_loss: 0.6303, test_loss: 1.2227, test_f1: 0.6195
 epoch: 30, train_loss: 0.6392, test_loss: 1.3730, test_f1: 0.5542
 epoch: 31, train_loss: 0.6546, test_loss: 1.3332, test_f1: 0.5443
 epoch: 32, train_loss: 0.6165, test_loss: 1.6910, test_f1: 0.4122
 epoch: 33, train_loss: 0.6357, test_loss: 1.6735, test_f1: 0.5027
 epoch: 34, train_loss: 0.6205, test_loss: 1.3984, test_f1: 0.5161
 epoch: 35, train_loss: 0.5964, test_loss: 1.7193, test_f1: 0.5235
 epoch: 36, train_loss: 0.6193, test_loss: 1.3684, test_f1: 0.5160
 epoch: 37, train_loss: 0.5639, test_loss: 1.5181, test_f1: 0.5005
 epoch: 38, train_loss: 0.5981, test_loss: 1.1550, test_f1: 0.5912
 epoch: 39, train_loss: 0.5935, test_loss: 1.3920, test_f1: 0.5128
 epoch: 40, train_loss: 0.6270, test_loss: 1.4456, test_f1: 0.5620
 epoch: 41, train_loss: 0.6202, test_loss: 1.5824, test_f1: 0.5434
 epoch: 42, train_loss: 0.6020, test_loss: 1.7863, test_f1: 0.4266
 epoch: 43, train_loss: 0.5849, test_loss: 1.6234, test_f1: 0.4808
 epoch: 44, train_loss: 0.5990, test_loss: 1.8764, test_f1: 0.3817
 epoch: 45, train_loss: 0.5835, test_loss: 1.7697, test_f1: 0.5460
 epoch: 46, train_loss: 0.5877, test_loss: 1.6575, test_f1: 0.5401
 epoch: 47, train_loss: 0.5824, test_loss: 1.1938, test_f1: 0.6083
 epoch: 48, train_loss: 0.5713, test_loss: 1.4097, test_f1: 0.4611
 epoch: 49, train_loss: 0.5824, test_loss: 1.4929, test_f1: 0.4952
 epoch: 50, train_loss: 0.5758, test_loss: 1.5789, test_f1: 0.4998
 epoch: 51, train_loss: 0.5799, test_loss: 1.2682, test_f1: 0.5325
 epoch: 52, train_loss: 0.4975, test_loss: 1.1973, test_f1: 0.6380
 epoch: 53, train_loss: 0.4790, test_loss: 1.2004, test_f1: 0.6374
 epoch: 54, train_loss: 0.5078, test_loss: 1.2477, test_f1: 0.5375
 epoch: 55, train_loss: 0.4952, test_loss: 1.3526, test_f1: 0.5389
 epoch: 56, train_loss: 0.4925, test_loss: 1.3372, test_f1: 0.6019
 epoch: 57, train_loss: 0.4553, test_loss: 1.5438, test_f1: 0.5678
 epoch: 58, train_loss: 0.4444, test_loss: 1.3954, test_f1: 0.5642
 epoch: 59, train_loss: 0.4679, test_loss: 1.3017, test_f1: 0.6234
 epoch: 60, train_loss: 0.4212, test_loss: 1.3389, test_f1: 0.6044
 epoch: 61, train_loss: 0.4620, test_loss: 1.3594, test_f1: 0.5903
 epoch: 62, train_loss: 0.4574, test_loss: 1.4948, test_f1: 0.5722
 epoch: 63, train_loss: 0.4559, test_loss: 1.5367, test_f1: 0.5530
 epoch: 64, train_loss: 0.4434, test_loss: 1.9515, test_f1: 0.5074
 epoch: 65, train_loss: 0.4384, test_loss: 1.4411, test_f1: 0.5563
 epoch: 66, train_loss: 0.4043, test_loss: 1.5554, test_f1: 0.5621
 epoch: 67, train_loss: 0.3886, test_loss: 1.5536, test_f1: 0.5698
 epoch: 68, train_loss: 0.4007, test_loss: 1.4127, test_f1: 0.5053
 epoch: 69, train_loss: 0.4345, test_loss: 1.3016, test_f1: 0.5808
 epoch: 70, train_loss: 0.4119, test_loss: 1.4256, test_f1: 0.5723
 epoch: 71, train_loss: 0.3896, test_loss: 1.4040, test_f1: 0.5549
 epoch: 72, train_loss: 0.3864, test_loss: 1.5621, test_f1: 0.5194
 epoch: 73, train_loss: 0.3735, test_loss: 1.5583, test_f1: 0.5959
 epoch: 74, train_loss: 0.3813, test_loss: 1.5408, test_f1: 0.5488
 epoch: 75, train_loss: 0.3898, test_loss: 1.6912, test_f1: 0.5677
 epoch: 76, train_loss: 0.3698, test_loss: 1.7580, test_f1: 0.5573
 epoch: 77, train_loss: 0.3637, test_loss: 1.8342, test_f1: 0.5327
 epoch: 78, train_loss: 0.3610, test_loss: 2.0196, test_f1: 0.4893
 epoch: 79, train_loss: 0.3682, test_loss: 2.0491, test_f1: 0.5100
 epoch: 80, train_loss: 0.3866, test_loss: 1.5135, test_f1: 0.6323
 epoch: 81, train_loss: 0.3918, test_loss: 1.7528, test_f1: 0.5384
 epoch: 82, train_loss: 0.3736, test_loss: 1.6662, test_f1: 0.5796
 epoch: 83, train_loss: 0.3481, test_loss: 2.0628, test_f1: 0.5118
 epoch: 84, train_loss: 0.3523, test_loss: 1.7153, test_f1: 0.5749
 epoch: 85, train_loss: 0.3599, test_loss: 1.8481, test_f1: 0.5596
 epoch: 86, train_loss: 0.3513, test_loss: 1.7429, test_f1: 0.5786
 epoch: 87, train_loss: 0.3334, test_loss: 1.6967, test_f1: 0.5987
 epoch: 88, train_loss: 0.3466, test_loss: 1.7171, test_f1: 0.5870
 epoch: 89, train_loss: 0.3459, test_loss: 1.9999, test_f1: 0.5284
 epoch: 90, train_loss: 0.3485, test_loss: 1.8286, test_f1: 0.5732
 epoch: 91, train_loss: 0.3253, test_loss: 2.1106, test_f1: 0.5626
 epoch: 92, train_loss: 0.3611, test_loss: 1.8991, test_f1: 0.5801
 epoch: 93, train_loss: 0.3658, test_loss: 1.6181, test_f1: 0.6070
 epoch: 94, train_loss: 0.3431, test_loss: 1.6486, test_f1: 0.5995
 epoch: 95, train_loss: 0.3343, test_loss: 1.7164, test_f1: 0.5600
 epoch: 96, train_loss: 0.3066, test_loss: 1.7633, test_f1: 0.6085
 epoch: 97, train_loss: 0.3261, test_loss: 1.8415, test_f1: 0.5448
 epoch: 98, train_loss: 0.3134, test_loss: 1.8494, test_f1: 0.5329
 epoch: 99, train_loss: 0.3256, test_loss: 1.9757, test_f1: 0.5621

Training completed in 297.66 seconds
Best F1: 0.6801 at epoch 65
Mean F1 across iterations: 0.6463  0.0191
========================FINAL RESULTS================================
FEGIN weighted F1: 0.6801  0.0191
python main.py --data ltspice_demos --representation component_pin_net --model FEGIN --layers 2 --hiddens 64 --batch_size 256 --lr 0.01 --emb_size 128 --epochs 100 --save_appendix component_pin_net_L2_H64_BS256_LR0.01_E128 --no_val
-----



STDERR:
  File "main.py", line 370, in <module>
    main()
  File "main.py", line 254, in main
    dataset = dataset_class(
  File "/home/philip/projects/ltspice_examples_code_repo/Circuit-Completion-Using-GNNs/component_classification_with_link_prediction_head/evaluation/FEGIN/kernel/circuit_datasets.py", line 15, in __init__
    self.data, self.slices = torch.load(self.processed_paths[0])
  File "/home/philip/.local/lib/python3.8/site-packages/torch/serialization.py", line 1040, in load
    warnings.warn(
  File "/usr/lib/python3.8/warnings.py", line 109, in _showwarnmsg
    sw(msg.message, msg.category, msg.filename, msg.lineno,
  File "main.py", line 47, in warn_with_traceback
    traceback.print_stack(file=log)
/home/philip/projects/ltspice_examples_code_repo/Circuit-Completion-Using-GNNs/component_classification_with_link_prediction_head/evaluation/FEGIN/kernel/circuit_datasets.py:15: FutureWarning: You are using `torch.load` with `weights_only=False` (the current default value), which uses the default pickle module implicitly. It is possible to construct malicious pickle data which will execute arbitrary code during unpickling (See https://github.com/pytorch/pytorch/blob/main/SECURITY.md#untrusted-models for more details). In a future release, the default value for `weights_only` will be flipped to `True`. This limits the functions that could be executed during unpickling. Arbitrary objects will no longer be allowed to be loaded via this mode unless they are explicitly allowlisted by the user via `torch.serialization.add_safe_globals`. We recommend you start setting `weights_only=True` for any use case where you don't have full control of the loaded file. Please open an issue on GitHub for any issues related to this experimental feature.
  self.data, self.slices = torch.load(self.processed_paths[0])
