STDOUT:
Results will be saved in /home/philip/projects/ltspice_examples_code_repo/Circuit-Completion-Using-GNNs/component_classification_with_link_prediction_head/evaluation/FEGIN/results/model_FEGIN_dataset_ltspice_examples
Command line input: python main.py --data ltspice_examples --representation component_pin --model FEGIN --layers 2 --hiddens 128 --batch_size 128 --lr 0.001 --emb_size 250 --epochs 100 --save_appendix component_pin_L2_H128_BS128_LR0.001_E250 --no_val
 is saved.
-----
ltspice_examples - FEGIN
Using 2 layers, 128 hidden units, h = 2
Loading component_pin representation dataset
ENTERED
Training FEGIN on component_pin representation
Train: 3560, Test: 848
##################ITERATION #0 ****************************************
 epoch: 0, train_loss: 1.2108, test_loss: 1.2506, test_f1: 0.2260
 epoch: 1, train_loss: 1.0318, test_loss: 1.0462, test_f1: 0.3500
 epoch: 2, train_loss: 0.9793, test_loss: 1.0620, test_f1: 0.4025
 epoch: 3, train_loss: 0.9394, test_loss: 0.9688, test_f1: 0.4925
 epoch: 4, train_loss: 0.9052, test_loss: 0.9370, test_f1: 0.5154
 epoch: 5, train_loss: 0.8585, test_loss: 0.9183, test_f1: 0.5287
 epoch: 6, train_loss: 0.8274, test_loss: 0.9037, test_f1: 0.5759
 epoch: 7, train_loss: 0.8089, test_loss: 0.8941, test_f1: 0.5386
 epoch: 8, train_loss: 0.7873, test_loss: 0.9607, test_f1: 0.4750
 epoch: 9, train_loss: 0.7631, test_loss: 0.8794, test_f1: 0.5390
 epoch: 10, train_loss: 0.7317, test_loss: 0.9217, test_f1: 0.5538
 epoch: 11, train_loss: 0.7135, test_loss: 0.9114, test_f1: 0.5579
 epoch: 12, train_loss: 0.7000, test_loss: 0.9019, test_f1: 0.5537
 epoch: 13, train_loss: 0.6873, test_loss: 0.8529, test_f1: 0.5626
 epoch: 14, train_loss: 0.6862, test_loss: 1.0035, test_f1: 0.5199
 epoch: 15, train_loss: 0.6626, test_loss: 1.0148, test_f1: 0.5720
 epoch: 16, train_loss: 0.6699, test_loss: 0.9938, test_f1: 0.5425
 epoch: 17, train_loss: 0.6368, test_loss: 0.8935, test_f1: 0.5738
 epoch: 18, train_loss: 0.6344, test_loss: 0.8513, test_f1: 0.6237
 epoch: 19, train_loss: 0.6084, test_loss: 0.9586, test_f1: 0.5529
 epoch: 20, train_loss: 0.5978, test_loss: 0.8594, test_f1: 0.6338
 epoch: 21, train_loss: 0.5854, test_loss: 0.9480, test_f1: 0.5840
 epoch: 22, train_loss: 0.5919, test_loss: 1.0536, test_f1: 0.5836
 epoch: 23, train_loss: 0.5881, test_loss: 1.0147, test_f1: 0.6082
 epoch: 24, train_loss: 0.5600, test_loss: 1.0744, test_f1: 0.6123
 epoch: 25, train_loss: 0.5615, test_loss: 0.8633, test_f1: 0.6190
 epoch: 26, train_loss: 0.5403, test_loss: 1.2361, test_f1: 0.6198
 epoch: 27, train_loss: 0.5290, test_loss: 1.1016, test_f1: 0.6117
 epoch: 28, train_loss: 0.5309, test_loss: 1.0388, test_f1: 0.6100
 epoch: 29, train_loss: 0.5081, test_loss: 0.9366, test_f1: 0.6291
 epoch: 30, train_loss: 0.4969, test_loss: 1.0176, test_f1: 0.6007
 epoch: 31, train_loss: 0.4957, test_loss: 1.1303, test_f1: 0.6290
 epoch: 32, train_loss: 0.4848, test_loss: 1.1818, test_f1: 0.6230
 epoch: 33, train_loss: 0.4800, test_loss: 1.0165, test_f1: 0.6379
 epoch: 34, train_loss: 0.4810, test_loss: 1.0608, test_f1: 0.6160
 epoch: 35, train_loss: 0.4587, test_loss: 1.1175, test_f1: 0.6047
 epoch: 36, train_loss: 0.4485, test_loss: 0.9733, test_f1: 0.6602
 epoch: 37, train_loss: 0.4458, test_loss: 1.0277, test_f1: 0.6134
 epoch: 38, train_loss: 0.4238, test_loss: 0.9622, test_f1: 0.6369
 epoch: 39, train_loss: 0.4080, test_loss: 1.1192, test_f1: 0.6419
 epoch: 40, train_loss: 0.3976, test_loss: 1.0561, test_f1: 0.6441
 epoch: 41, train_loss: 0.4105, test_loss: 1.1127, test_f1: 0.6555
 epoch: 42, train_loss: 0.4069, test_loss: 0.9763, test_f1: 0.6107
 epoch: 43, train_loss: 0.3810, test_loss: 1.2677, test_f1: 0.6351
 epoch: 44, train_loss: 0.3828, test_loss: 1.2805, test_f1: 0.6288
 epoch: 45, train_loss: 0.3768, test_loss: 0.9748, test_f1: 0.6700
 epoch: 46, train_loss: 0.3908, test_loss: 1.1928, test_f1: 0.6148
 epoch: 47, train_loss: 0.3588, test_loss: 0.9861, test_f1: 0.6520
 epoch: 48, train_loss: 0.3551, test_loss: 1.1656, test_f1: 0.6518
 epoch: 49, train_loss: 0.3557, test_loss: 1.2040, test_f1: 0.6394
 epoch: 50, train_loss: 0.3557, test_loss: 1.1681, test_f1: 0.6801
 epoch: 51, train_loss: 0.3158, test_loss: 1.1423, test_f1: 0.6604
 epoch: 52, train_loss: 0.2842, test_loss: 1.0936, test_f1: 0.6699
 epoch: 53, train_loss: 0.2666, test_loss: 1.0505, test_f1: 0.6880
 epoch: 54, train_loss: 0.2460, test_loss: 1.2377, test_f1: 0.6607
 epoch: 55, train_loss: 0.2595, test_loss: 1.1410, test_f1: 0.6817
 epoch: 56, train_loss: 0.2561, test_loss: 1.1403, test_f1: 0.6549
 epoch: 57, train_loss: 0.2364, test_loss: 1.4029, test_f1: 0.6844
 epoch: 58, train_loss: 0.2506, test_loss: 1.2837, test_f1: 0.6799
 epoch: 59, train_loss: 0.2356, test_loss: 1.5319, test_f1: 0.6451
 epoch: 60, train_loss: 0.2418, test_loss: 1.3727, test_f1: 0.6909
 epoch: 61, train_loss: 0.2402, test_loss: 1.3828, test_f1: 0.6405
 epoch: 62, train_loss: 0.2376, test_loss: 1.5095, test_f1: 0.6455
 epoch: 63, train_loss: 0.2325, test_loss: 1.2732, test_f1: 0.6660
 epoch: 64, train_loss: 0.2297, test_loss: 1.4328, test_f1: 0.6235
 epoch: 65, train_loss: 0.2140, test_loss: 1.3329, test_f1: 0.6772
 epoch: 66, train_loss: 0.2115, test_loss: 1.5390, test_f1: 0.6539
 epoch: 67, train_loss: 0.2106, test_loss: 1.3445, test_f1: 0.6657
 epoch: 68, train_loss: 0.2094, test_loss: 1.3164, test_f1: 0.6625
 epoch: 69, train_loss: 0.2070, test_loss: 1.4938, test_f1: 0.6753
 epoch: 70, train_loss: 0.2018, test_loss: 1.5075, test_f1: 0.6274
 epoch: 71, train_loss: 0.2048, test_loss: 1.5067, test_f1: 0.6660
 epoch: 72, train_loss: 0.1974, test_loss: 1.4025, test_f1: 0.6620
 epoch: 73, train_loss: 0.1977, test_loss: 1.7547, test_f1: 0.6425
 epoch: 74, train_loss: 0.1971, test_loss: 1.6024, test_f1: 0.6742
 epoch: 75, train_loss: 0.1746, test_loss: 1.5490, test_f1: 0.6920
 epoch: 76, train_loss: 0.1686, test_loss: 1.4919, test_f1: 0.6416
 epoch: 77, train_loss: 0.1820, test_loss: 1.5198, test_f1: 0.6586
 epoch: 78, train_loss: 0.1729, test_loss: 1.5919, test_f1: 0.6723
 epoch: 79, train_loss: 0.1662, test_loss: 1.7432, test_f1: 0.6857
 epoch: 80, train_loss: 0.1737, test_loss: 1.6829, test_f1: 0.6495
 epoch: 81, train_loss: 0.1750, test_loss: 1.6473, test_f1: 0.6793
 epoch: 82, train_loss: 0.1626, test_loss: 1.7502, test_f1: 0.6462
 epoch: 83, train_loss: 0.1813, test_loss: 1.7120, test_f1: 0.6611
 epoch: 84, train_loss: 0.1609, test_loss: 1.7355, test_f1: 0.6609
 epoch: 85, train_loss: 0.1654, test_loss: 1.8237, test_f1: 0.6630
 epoch: 86, train_loss: 0.1735, test_loss: 1.8521, test_f1: 0.6311
 epoch: 87, train_loss: 0.1653, test_loss: 1.7831, test_f1: 0.6428
 epoch: 88, train_loss: 0.1604, test_loss: 1.9319, test_f1: 0.6357
 epoch: 89, train_loss: 0.1906, test_loss: 1.7695, test_f1: 0.6492
 epoch: 90, train_loss: 0.1638, test_loss: 1.7173, test_f1: 0.6597
 epoch: 91, train_loss: 0.1677, test_loss: 1.6669, test_f1: 0.6503
 epoch: 92, train_loss: 0.1487, test_loss: 1.7841, test_f1: 0.6656
 epoch: 93, train_loss: 0.1404, test_loss: 1.7494, test_f1: 0.6549
 epoch: 94, train_loss: 0.1464, test_loss: 1.9124, test_f1: 0.6581
 epoch: 95, train_loss: 0.1571, test_loss: 2.0272, test_f1: 0.6510
 epoch: 96, train_loss: 0.1512, test_loss: 1.9620, test_f1: 0.6265
 epoch: 97, train_loss: 0.1353, test_loss: 1.9788, test_f1: 0.6454
 epoch: 98, train_loss: 0.1259, test_loss: 2.0489, test_f1: 0.6349
 epoch: 99, train_loss: 0.1414, test_loss: 1.8632, test_f1: 0.6544
##################ITERATION #1 ****************************************
 epoch: 0, train_loss: 1.1100, test_loss: 1.1397, test_f1: 0.3700
 epoch: 1, train_loss: 0.9607, test_loss: 1.1774, test_f1: 0.3934
 epoch: 2, train_loss: 0.9099, test_loss: 1.0098, test_f1: 0.4958
 epoch: 3, train_loss: 0.8660, test_loss: 0.9120, test_f1: 0.5431
 epoch: 4, train_loss: 0.8324, test_loss: 1.0633, test_f1: 0.5037
 epoch: 5, train_loss: 0.7918, test_loss: 0.9580, test_f1: 0.4998
 epoch: 6, train_loss: 0.7779, test_loss: 0.9063, test_f1: 0.6104
 epoch: 7, train_loss: 0.7536, test_loss: 0.9117, test_f1: 0.5724
 epoch: 8, train_loss: 0.7348, test_loss: 0.8917, test_f1: 0.5847
 epoch: 9, train_loss: 0.7359, test_loss: 0.8941, test_f1: 0.5620
 epoch: 10, train_loss: 0.7263, test_loss: 0.7695, test_f1: 0.6422
 epoch: 11, train_loss: 0.6871, test_loss: 0.8954, test_f1: 0.5763
 epoch: 12, train_loss: 0.6694, test_loss: 0.8124, test_f1: 0.6541
 epoch: 13, train_loss: 0.6609, test_loss: 0.8390, test_f1: 0.6450
 epoch: 14, train_loss: 0.6608, test_loss: 0.9589, test_f1: 0.5732
 epoch: 15, train_loss: 0.6336, test_loss: 0.9268, test_f1: 0.6300
 epoch: 16, train_loss: 0.6196, test_loss: 0.8636, test_f1: 0.6225
 epoch: 17, train_loss: 0.5908, test_loss: 0.8434, test_f1: 0.6224
 epoch: 18, train_loss: 0.5945, test_loss: 0.8985, test_f1: 0.6128
 epoch: 19, train_loss: 0.5791, test_loss: 0.9748, test_f1: 0.6412
 epoch: 20, train_loss: 0.5958, test_loss: 1.0429, test_f1: 0.6020
 epoch: 21, train_loss: 0.5588, test_loss: 0.7865, test_f1: 0.6668
 epoch: 22, train_loss: 0.5559, test_loss: 0.9011, test_f1: 0.6517
 epoch: 23, train_loss: 0.5319, test_loss: 0.9030, test_f1: 0.6308
 epoch: 24, train_loss: 0.5194, test_loss: 0.9775, test_f1: 0.6367
 epoch: 25, train_loss: 0.5343, test_loss: 0.9280, test_f1: 0.6309
 epoch: 26, train_loss: 0.5086, test_loss: 0.9687, test_f1: 0.6188
 epoch: 27, train_loss: 0.5197, test_loss: 1.0100, test_f1: 0.5863
 epoch: 28, train_loss: 0.5027, test_loss: 1.0573, test_f1: 0.6305
 epoch: 29, train_loss: 0.4992, test_loss: 0.9288, test_f1: 0.6173
 epoch: 30, train_loss: 0.4829, test_loss: 0.9110, test_f1: 0.6741
 epoch: 31, train_loss: 0.4740, test_loss: 0.9451, test_f1: 0.6454
 epoch: 32, train_loss: 0.4534, test_loss: 0.9810, test_f1: 0.6235
 epoch: 33, train_loss: 0.4413, test_loss: 1.0511, test_f1: 0.6565
 epoch: 34, train_loss: 0.4362, test_loss: 0.9683, test_f1: 0.6462
 epoch: 35, train_loss: 0.4310, test_loss: 0.8858, test_f1: 0.6780
 epoch: 36, train_loss: 0.4163, test_loss: 1.1402, test_f1: 0.6444
 epoch: 37, train_loss: 0.4050, test_loss: 1.1600, test_f1: 0.6537
 epoch: 38, train_loss: 0.3917, test_loss: 1.0573, test_f1: 0.6275
 epoch: 39, train_loss: 0.4018, test_loss: 1.1931, test_f1: 0.6096
 epoch: 40, train_loss: 0.3788, test_loss: 1.1343, test_f1: 0.6354
 epoch: 41, train_loss: 0.3454, test_loss: 1.0742, test_f1: 0.6004
 epoch: 42, train_loss: 0.3598, test_loss: 1.1632, test_f1: 0.6299
 epoch: 43, train_loss: 0.3657, test_loss: 1.1176, test_f1: 0.6321
 epoch: 44, train_loss: 0.3692, test_loss: 1.0694, test_f1: 0.6156
 epoch: 45, train_loss: 0.3513, test_loss: 1.0563, test_f1: 0.6596
 epoch: 46, train_loss: 0.3198, test_loss: 1.0509, test_f1: 0.6799
 epoch: 47, train_loss: 0.3082, test_loss: 1.1963, test_f1: 0.6617
 epoch: 48, train_loss: 0.3236, test_loss: 1.3191, test_f1: 0.6614
 epoch: 49, train_loss: 0.3464, test_loss: 1.1861, test_f1: 0.6530
 epoch: 50, train_loss: 0.3201, test_loss: 1.2449, test_f1: 0.6715
 epoch: 51, train_loss: 0.2759, test_loss: 1.1510, test_f1: 0.6590
 epoch: 52, train_loss: 0.2355, test_loss: 1.2868, test_f1: 0.6631
 epoch: 53, train_loss: 0.2485, test_loss: 1.2491, test_f1: 0.6639
 epoch: 54, train_loss: 0.2463, test_loss: 1.3030, test_f1: 0.6626
 epoch: 55, train_loss: 0.2243, test_loss: 1.3763, test_f1: 0.6710
 epoch: 56, train_loss: 0.2296, test_loss: 1.5121, test_f1: 0.6147
 epoch: 57, train_loss: 0.2151, test_loss: 1.4138, test_f1: 0.6653
 epoch: 58, train_loss: 0.2234, test_loss: 1.3642, test_f1: 0.6571
 epoch: 59, train_loss: 0.2396, test_loss: 1.4484, test_f1: 0.6521
 epoch: 60, train_loss: 0.2143, test_loss: 1.3112, test_f1: 0.6793
 epoch: 61, train_loss: 0.2248, test_loss: 1.6302, test_f1: 0.6652
 epoch: 62, train_loss: 0.2029, test_loss: 1.3789, test_f1: 0.6508
 epoch: 63, train_loss: 0.1967, test_loss: 1.4323, test_f1: 0.6543
 epoch: 64, train_loss: 0.1908, test_loss: 1.6242, test_f1: 0.6367
 epoch: 65, train_loss: 0.2035, test_loss: 1.5427, test_f1: 0.6525
 epoch: 66, train_loss: 0.1938, test_loss: 1.4474, test_f1: 0.6572
 epoch: 67, train_loss: 0.1851, test_loss: 1.4068, test_f1: 0.6843
 epoch: 68, train_loss: 0.1886, test_loss: 1.5615, test_f1: 0.6358
 epoch: 69, train_loss: 0.1930, test_loss: 1.5753, test_f1: 0.6604
 epoch: 70, train_loss: 0.1904, test_loss: 1.7366, test_f1: 0.6711
 epoch: 71, train_loss: 0.1732, test_loss: 1.6416, test_f1: 0.6756
 epoch: 72, train_loss: 0.1867, test_loss: 1.6242, test_f1: 0.6747
 epoch: 73, train_loss: 0.1732, test_loss: 1.6508, test_f1: 0.6799
 epoch: 74, train_loss: 0.1720, test_loss: 1.5883, test_f1: 0.6778
 epoch: 75, train_loss: 0.1793, test_loss: 1.6885, test_f1: 0.6340
 epoch: 76, train_loss: 0.1736, test_loss: 1.6772, test_f1: 0.6504
 epoch: 77, train_loss: 0.1808, test_loss: 1.7455, test_f1: 0.6617
 epoch: 78, train_loss: 0.1800, test_loss: 1.5153, test_f1: 0.6835
 epoch: 79, train_loss: 0.1636, test_loss: 1.7030, test_f1: 0.6659
 epoch: 80, train_loss: 0.1635, test_loss: 1.9295, test_f1: 0.6417
 epoch: 81, train_loss: 0.1644, test_loss: 1.7672, test_f1: 0.6843
 epoch: 82, train_loss: 0.1726, test_loss: 1.6535, test_f1: 0.6639
 epoch: 83, train_loss: 0.1566, test_loss: 1.7171, test_f1: 0.6478
 epoch: 84, train_loss: 0.1508, test_loss: 1.7114, test_f1: 0.6739
 epoch: 85, train_loss: 0.1488, test_loss: 1.8635, test_f1: 0.6454
 epoch: 86, train_loss: 0.1476, test_loss: 1.8912, test_f1: 0.6660
 epoch: 87, train_loss: 0.1746, test_loss: 1.7329, test_f1: 0.6806
 epoch: 88, train_loss: 0.1684, test_loss: 1.8043, test_f1: 0.6648
 epoch: 89, train_loss: 0.1459, test_loss: 1.8714, test_f1: 0.6721
 epoch: 90, train_loss: 0.1469, test_loss: 1.9984, test_f1: 0.6659
 epoch: 91, train_loss: 0.1390, test_loss: 1.9663, test_f1: 0.6831
 epoch: 92, train_loss: 0.1376, test_loss: 2.1607, test_f1: 0.6254
 epoch: 93, train_loss: 0.1440, test_loss: 1.9370, test_f1: 0.6489
 epoch: 94, train_loss: 0.1317, test_loss: 2.0066, test_f1: 0.6614
 epoch: 95, train_loss: 0.1450, test_loss: 2.1591, test_f1: 0.6559
 epoch: 96, train_loss: 0.1425, test_loss: 1.9279, test_f1: 0.6709
 epoch: 97, train_loss: 0.1450, test_loss: 2.0344, test_f1: 0.6321
 epoch: 98, train_loss: 0.1528, test_loss: 1.8712, test_f1: 0.6473
 epoch: 99, train_loss: 0.1232, test_loss: 1.8418, test_f1: 0.6584
##################ITERATION #2 ****************************************
 epoch: 0, train_loss: 1.1446, test_loss: 1.1967, test_f1: 0.2599
 epoch: 1, train_loss: 0.9526, test_loss: 0.9538, test_f1: 0.4978
 epoch: 2, train_loss: 0.8843, test_loss: 0.9283, test_f1: 0.5506
 epoch: 3, train_loss: 0.8427, test_loss: 0.9412, test_f1: 0.5585
 epoch: 4, train_loss: 0.8243, test_loss: 0.9226, test_f1: 0.5926
 epoch: 5, train_loss: 0.8034, test_loss: 0.8936, test_f1: 0.6151
 epoch: 6, train_loss: 0.7904, test_loss: 0.8747, test_f1: 0.5904
 epoch: 7, train_loss: 0.7484, test_loss: 0.8824, test_f1: 0.6072
 epoch: 8, train_loss: 0.7295, test_loss: 0.9248, test_f1: 0.6027
 epoch: 9, train_loss: 0.7059, test_loss: 0.8331, test_f1: 0.6286
 epoch: 10, train_loss: 0.7002, test_loss: 0.8815, test_f1: 0.5899
 epoch: 11, train_loss: 0.6912, test_loss: 0.8608, test_f1: 0.6265
 epoch: 12, train_loss: 0.6764, test_loss: 0.8913, test_f1: 0.5985
 epoch: 13, train_loss: 0.6416, test_loss: 0.8354, test_f1: 0.6006
 epoch: 14, train_loss: 0.6434, test_loss: 0.8061, test_f1: 0.6458
 epoch: 15, train_loss: 0.6303, test_loss: 0.8070, test_f1: 0.6259
 epoch: 16, train_loss: 0.6181, test_loss: 0.9084, test_f1: 0.6459
 epoch: 17, train_loss: 0.5996, test_loss: 0.9611, test_f1: 0.5898
 epoch: 18, train_loss: 0.6145, test_loss: 0.8697, test_f1: 0.6279
 epoch: 19, train_loss: 0.5939, test_loss: 0.8721, test_f1: 0.6539
 epoch: 20, train_loss: 0.5776, test_loss: 0.8185, test_f1: 0.6531
 epoch: 21, train_loss: 0.5721, test_loss: 0.8365, test_f1: 0.6596
 epoch: 22, train_loss: 0.5579, test_loss: 0.9938, test_f1: 0.6079
 epoch: 23, train_loss: 0.5376, test_loss: 0.8316, test_f1: 0.6508
 epoch: 24, train_loss: 0.5387, test_loss: 0.8473, test_f1: 0.6504
 epoch: 25, train_loss: 0.5224, test_loss: 1.0991, test_f1: 0.6179
 epoch: 26, train_loss: 0.5168, test_loss: 0.9248, test_f1: 0.6343
 epoch: 27, train_loss: 0.4910, test_loss: 0.9070, test_f1: 0.6901
 epoch: 28, train_loss: 0.4989, test_loss: 1.0708, test_f1: 0.6372
 epoch: 29, train_loss: 0.4993, test_loss: 0.8053, test_f1: 0.6829
 epoch: 30, train_loss: 0.4724, test_loss: 0.9481, test_f1: 0.6825
 epoch: 31, train_loss: 0.4586, test_loss: 0.8608, test_f1: 0.6638
 epoch: 32, train_loss: 0.4355, test_loss: 0.8732, test_f1: 0.6829
 epoch: 33, train_loss: 0.4148, test_loss: 0.9292, test_f1: 0.6916
 epoch: 34, train_loss: 0.4126, test_loss: 1.0203, test_f1: 0.6307
 epoch: 35, train_loss: 0.4074, test_loss: 1.0508, test_f1: 0.6285
 epoch: 36, train_loss: 0.4023, test_loss: 0.9541, test_f1: 0.6692
 epoch: 37, train_loss: 0.4030, test_loss: 0.9717, test_f1: 0.6297
 epoch: 38, train_loss: 0.4000, test_loss: 1.0522, test_f1: 0.6513
 epoch: 39, train_loss: 0.3778, test_loss: 1.2920, test_f1: 0.6576
 epoch: 40, train_loss: 0.3760, test_loss: 0.9682, test_f1: 0.6720
 epoch: 41, train_loss: 0.3569, test_loss: 1.0772, test_f1: 0.6631
 epoch: 42, train_loss: 0.3692, test_loss: 1.0272, test_f1: 0.6600
 epoch: 43, train_loss: 0.3636, test_loss: 0.9828, test_f1: 0.6772
 epoch: 44, train_loss: 0.3639, test_loss: 0.9415, test_f1: 0.7110
 epoch: 45, train_loss: 0.3308, test_loss: 1.2948, test_f1: 0.6628
 epoch: 46, train_loss: 0.3352, test_loss: 1.1570, test_f1: 0.6446
 epoch: 47, train_loss: 0.3387, test_loss: 1.1090, test_f1: 0.6804
 epoch: 48, train_loss: 0.3563, test_loss: 1.1963, test_f1: 0.6800
 epoch: 49, train_loss: 0.3265, test_loss: 1.0082, test_f1: 0.6582
 epoch: 50, train_loss: 0.3168, test_loss: 1.0646, test_f1: 0.6942
 epoch: 51, train_loss: 0.2710, test_loss: 1.2067, test_f1: 0.6577
 epoch: 52, train_loss: 0.2626, test_loss: 1.1344, test_f1: 0.6594
 epoch: 53, train_loss: 0.2465, test_loss: 1.1792, test_f1: 0.6851
 epoch: 54, train_loss: 0.2293, test_loss: 1.1792, test_f1: 0.6857
 epoch: 55, train_loss: 0.2243, test_loss: 1.3106, test_f1: 0.6631
 epoch: 56, train_loss: 0.2390, test_loss: 1.1807, test_f1: 0.6948
 epoch: 57, train_loss: 0.2156, test_loss: 1.2780, test_f1: 0.6904
 epoch: 58, train_loss: 0.2178, test_loss: 1.2729, test_f1: 0.6673
 epoch: 59, train_loss: 0.2177, test_loss: 1.2405, test_f1: 0.6908
 epoch: 60, train_loss: 0.2105, test_loss: 1.3239, test_f1: 0.6519
 epoch: 61, train_loss: 0.2030, test_loss: 1.2371, test_f1: 0.6958
 epoch: 62, train_loss: 0.2049, test_loss: 1.3686, test_f1: 0.6752
 epoch: 63, train_loss: 0.1982, test_loss: 1.2904, test_f1: 0.6838
 epoch: 64, train_loss: 0.2154, test_loss: 1.3098, test_f1: 0.7122
 epoch: 65, train_loss: 0.2110, test_loss: 1.3189, test_f1: 0.6786
 epoch: 66, train_loss: 0.1949, test_loss: 1.4649, test_f1: 0.6519
 epoch: 67, train_loss: 0.1864, test_loss: 1.2798, test_f1: 0.6991
 epoch: 68, train_loss: 0.1917, test_loss: 1.3500, test_f1: 0.6827
 epoch: 69, train_loss: 0.1706, test_loss: 1.5233, test_f1: 0.6641
 epoch: 70, train_loss: 0.2025, test_loss: 1.3947, test_f1: 0.6717
 epoch: 71, train_loss: 0.1729, test_loss: 1.5013, test_f1: 0.6738
 epoch: 72, train_loss: 0.1677, test_loss: 1.6313, test_f1: 0.6166
 epoch: 73, train_loss: 0.1786, test_loss: 1.4156, test_f1: 0.6784
 epoch: 74, train_loss: 0.1666, test_loss: 1.2580, test_f1: 0.6699
 epoch: 75, train_loss: 0.1741, test_loss: 1.4163, test_f1: 0.6546
 epoch: 76, train_loss: 0.1788, test_loss: 1.4344, test_f1: 0.6809
 epoch: 77, train_loss: 0.1702, test_loss: 1.4666, test_f1: 0.6803
 epoch: 78, train_loss: 0.1525, test_loss: 1.5031, test_f1: 0.6774
 epoch: 79, train_loss: 0.1648, test_loss: 1.4556, test_f1: 0.6845
 epoch: 80, train_loss: 0.1796, test_loss: 1.5255, test_f1: 0.6707
 epoch: 81, train_loss: 0.1722, test_loss: 1.6030, test_f1: 0.6441
 epoch: 82, train_loss: 0.1801, test_loss: 1.4764, test_f1: 0.6976
 epoch: 83, train_loss: 0.1593, test_loss: 1.6579, test_f1: 0.6761
 epoch: 84, train_loss: 0.1634, test_loss: 1.7238, test_f1: 0.6452
 epoch: 85, train_loss: 0.1675, test_loss: 1.4822, test_f1: 0.6881
 epoch: 86, train_loss: 0.1490, test_loss: 1.7021, test_f1: 0.6639
 epoch: 87, train_loss: 0.1419, test_loss: 1.7139, test_f1: 0.6440
 epoch: 88, train_loss: 0.1510, test_loss: 1.5899, test_f1: 0.6603
 epoch: 89, train_loss: 0.1482, test_loss: 1.5639, test_f1: 0.6777
 epoch: 90, train_loss: 0.1330, test_loss: 1.7951, test_f1: 0.6222
 epoch: 91, train_loss: 0.1502, test_loss: 1.6659, test_f1: 0.6989
 epoch: 92, train_loss: 0.1413, test_loss: 1.5987, test_f1: 0.6642
 epoch: 93, train_loss: 0.1346, test_loss: 1.7385, test_f1: 0.6782
 epoch: 94, train_loss: 0.1306, test_loss: 1.7414, test_f1: 0.6764
 epoch: 95, train_loss: 0.1401, test_loss: 1.8526, test_f1: 0.6186
 epoch: 96, train_loss: 0.1325, test_loss: 1.8416, test_f1: 0.6771
 epoch: 97, train_loss: 0.1522, test_loss: 1.8068, test_f1: 0.6749
 epoch: 98, train_loss: 0.1596, test_loss: 1.8560, test_f1: 0.6566
 epoch: 99, train_loss: 0.1457, test_loss: 1.7137, test_f1: 0.6297
##################ITERATION #3 ****************************************
 epoch: 0, train_loss: 1.2305, test_loss: 1.1913, test_f1: 0.3099
 epoch: 1, train_loss: 1.0077, test_loss: 0.9758, test_f1: 0.5238
 epoch: 2, train_loss: 0.9450, test_loss: 0.9104, test_f1: 0.5585
 epoch: 3, train_loss: 0.8991, test_loss: 0.8810, test_f1: 0.5457
 epoch: 4, train_loss: 0.8568, test_loss: 0.8714, test_f1: 0.5656
 epoch: 5, train_loss: 0.8474, test_loss: 0.9146, test_f1: 0.5549
 epoch: 6, train_loss: 0.8247, test_loss: 0.7743, test_f1: 0.6172
 epoch: 7, train_loss: 0.7972, test_loss: 0.8830, test_f1: 0.5774
 epoch: 8, train_loss: 0.7754, test_loss: 0.8499, test_f1: 0.5780
 epoch: 9, train_loss: 0.7594, test_loss: 0.7949, test_f1: 0.6208
 epoch: 10, train_loss: 0.7551, test_loss: 0.9738, test_f1: 0.5908
 epoch: 11, train_loss: 0.7229, test_loss: 0.8755, test_f1: 0.6108
 epoch: 12, train_loss: 0.7085, test_loss: 0.8101, test_f1: 0.6395
 epoch: 13, train_loss: 0.7050, test_loss: 0.8849, test_f1: 0.6265
 epoch: 14, train_loss: 0.6957, test_loss: 0.9636, test_f1: 0.5957
 epoch: 15, train_loss: 0.6898, test_loss: 0.9979, test_f1: 0.6073
 epoch: 16, train_loss: 0.6787, test_loss: 0.8927, test_f1: 0.5952
 epoch: 17, train_loss: 0.6527, test_loss: 0.8266, test_f1: 0.6414
 epoch: 18, train_loss: 0.6336, test_loss: 0.7628, test_f1: 0.6218
 epoch: 19, train_loss: 0.6514, test_loss: 0.8236, test_f1: 0.6221
 epoch: 20, train_loss: 0.6404, test_loss: 0.8343, test_f1: 0.6322
 epoch: 21, train_loss: 0.5962, test_loss: 0.9364, test_f1: 0.6210
 epoch: 22, train_loss: 0.5886, test_loss: 0.8997, test_f1: 0.5930
 epoch: 23, train_loss: 0.5871, test_loss: 0.8449, test_f1: 0.6698
 epoch: 24, train_loss: 0.5803, test_loss: 0.8705, test_f1: 0.6184
 epoch: 25, train_loss: 0.5702, test_loss: 0.8084, test_f1: 0.6488
 epoch: 26, train_loss: 0.5564, test_loss: 0.8673, test_f1: 0.6172
 epoch: 27, train_loss: 0.5335, test_loss: 0.9754, test_f1: 0.6519
 epoch: 28, train_loss: 0.5352, test_loss: 0.8097, test_f1: 0.6627
 epoch: 29, train_loss: 0.5045, test_loss: 0.9853, test_f1: 0.5986
 epoch: 30, train_loss: 0.5204, test_loss: 0.9343, test_f1: 0.6186
 epoch: 31, train_loss: 0.5049, test_loss: 0.9074, test_f1: 0.6372
 epoch: 32, train_loss: 0.4917, test_loss: 1.0787, test_f1: 0.5998
 epoch: 33, train_loss: 0.4948, test_loss: 1.0977, test_f1: 0.6271
 epoch: 34, train_loss: 0.4620, test_loss: 0.9503, test_f1: 0.6582
 epoch: 35, train_loss: 0.4531, test_loss: 0.9200, test_f1: 0.6598
 epoch: 36, train_loss: 0.4616, test_loss: 1.0828, test_f1: 0.6211
 epoch: 37, train_loss: 0.4561, test_loss: 0.9304, test_f1: 0.6495
 epoch: 38, train_loss: 0.4346, test_loss: 0.9981, test_f1: 0.6328
 epoch: 39, train_loss: 0.4288, test_loss: 1.0254, test_f1: 0.6519
 epoch: 40, train_loss: 0.4218, test_loss: 1.1540, test_f1: 0.6340
 epoch: 41, train_loss: 0.4387, test_loss: 0.9502, test_f1: 0.6571
 epoch: 42, train_loss: 0.3902, test_loss: 1.3305, test_f1: 0.5882
 epoch: 43, train_loss: 0.4061, test_loss: 1.1350, test_f1: 0.6154
 epoch: 44, train_loss: 0.3889, test_loss: 1.0648, test_f1: 0.6417
 epoch: 45, train_loss: 0.4098, test_loss: 1.1090, test_f1: 0.6458
 epoch: 46, train_loss: 0.3742, test_loss: 1.1020, test_f1: 0.6463
 epoch: 47, train_loss: 0.3643, test_loss: 1.0643, test_f1: 0.6180
 epoch: 48, train_loss: 0.3604, test_loss: 1.1415, test_f1: 0.6312
 epoch: 49, train_loss: 0.3629, test_loss: 0.9853, test_f1: 0.6799
 epoch: 50, train_loss: 0.3802, test_loss: 0.9972, test_f1: 0.6578
 epoch: 51, train_loss: 0.3240, test_loss: 1.0729, test_f1: 0.6403
 epoch: 52, train_loss: 0.3075, test_loss: 1.0081, test_f1: 0.6757
 epoch: 53, train_loss: 0.2865, test_loss: 1.0071, test_f1: 0.6918
 epoch: 54, train_loss: 0.2764, test_loss: 1.0555, test_f1: 0.6895
 epoch: 55, train_loss: 0.2670, test_loss: 1.1191, test_f1: 0.6687
 epoch: 56, train_loss: 0.2557, test_loss: 1.0509, test_f1: 0.6713
 epoch: 57, train_loss: 0.2701, test_loss: 1.1711, test_f1: 0.6491
 epoch: 58, train_loss: 0.2865, test_loss: 1.1105, test_f1: 0.6722
 epoch: 59, train_loss: 0.2656, test_loss: 1.0942, test_f1: 0.6928
 epoch: 60, train_loss: 0.2655, test_loss: 1.0865, test_f1: 0.6779
 epoch: 61, train_loss: 0.2629, test_loss: 1.2833, test_f1: 0.6673
 epoch: 62, train_loss: 0.2523, test_loss: 1.1661, test_f1: 0.6797
 epoch: 63, train_loss: 0.2313, test_loss: 1.1257, test_f1: 0.6831
 epoch: 64, train_loss: 0.2282, test_loss: 1.2670, test_f1: 0.6727
 epoch: 65, train_loss: 0.2274, test_loss: 1.2113, test_f1: 0.6776
 epoch: 66, train_loss: 0.2402, test_loss: 1.2585, test_f1: 0.6755
 epoch: 67, train_loss: 0.2152, test_loss: 1.1905, test_f1: 0.6695
 epoch: 68, train_loss: 0.2240, test_loss: 1.2489, test_f1: 0.6478
 epoch: 69, train_loss: 0.2061, test_loss: 1.2477, test_f1: 0.6763
 epoch: 70, train_loss: 0.2112, test_loss: 1.3386, test_f1: 0.6867
 epoch: 71, train_loss: 0.2172, test_loss: 1.4822, test_f1: 0.6249
 epoch: 72, train_loss: 0.2309, test_loss: 1.2214, test_f1: 0.6406
 epoch: 73, train_loss: 0.2121, test_loss: 1.3442, test_f1: 0.6921
 epoch: 74, train_loss: 0.2176, test_loss: 1.3027, test_f1: 0.6487
 epoch: 75, train_loss: 0.2143, test_loss: 1.2462, test_f1: 0.6806
 epoch: 76, train_loss: 0.2067, test_loss: 1.4927, test_f1: 0.6337
 epoch: 77, train_loss: 0.1973, test_loss: 1.3996, test_f1: 0.6492
 epoch: 78, train_loss: 0.2031, test_loss: 1.4274, test_f1: 0.6415
 epoch: 79, train_loss: 0.1850, test_loss: 1.3902, test_f1: 0.6865
 epoch: 80, train_loss: 0.2016, test_loss: 1.3036, test_f1: 0.6527
 epoch: 81, train_loss: 0.1761, test_loss: 1.3637, test_f1: 0.6464
 epoch: 82, train_loss: 0.1887, test_loss: 1.3893, test_f1: 0.6687
 epoch: 83, train_loss: 0.1952, test_loss: 1.4289, test_f1: 0.6594
 epoch: 84, train_loss: 0.1937, test_loss: 1.2897, test_f1: 0.6627
 epoch: 85, train_loss: 0.2052, test_loss: 1.3584, test_f1: 0.6681
 epoch: 86, train_loss: 0.1862, test_loss: 1.7253, test_f1: 0.6389
 epoch: 87, train_loss: 0.1856, test_loss: 1.5136, test_f1: 0.6404
 epoch: 88, train_loss: 0.1861, test_loss: 1.4870, test_f1: 0.6620
 epoch: 89, train_loss: 0.1761, test_loss: 1.5156, test_f1: 0.6351
 epoch: 90, train_loss: 0.1709, test_loss: 1.5434, test_f1: 0.6210
 epoch: 91, train_loss: 0.1725, test_loss: 1.3597, test_f1: 0.6942
 epoch: 92, train_loss: 0.1748, test_loss: 1.5912, test_f1: 0.6512
 epoch: 93, train_loss: 0.1654, test_loss: 1.4922, test_f1: 0.6744
 epoch: 94, train_loss: 0.1776, test_loss: 1.5412, test_f1: 0.6421
 epoch: 95, train_loss: 0.1677, test_loss: 1.5587, test_f1: 0.6427
 epoch: 96, train_loss: 0.1878, test_loss: 1.5456, test_f1: 0.6338
 epoch: 97, train_loss: 0.1698, test_loss: 1.3012, test_f1: 0.6851
 epoch: 98, train_loss: 0.1500, test_loss: 1.4658, test_f1: 0.6856
 epoch: 99, train_loss: 0.1467, test_loss: 1.6554, test_f1: 0.6424
##################ITERATION #4 ****************************************
 epoch: 0, train_loss: 1.3613, test_loss: 1.2638, test_f1: 0.2311
 epoch: 1, train_loss: 0.9800, test_loss: 0.9759, test_f1: 0.4875
 epoch: 2, train_loss: 0.9317, test_loss: 0.9124, test_f1: 0.5850
 epoch: 3, train_loss: 0.8828, test_loss: 0.8966, test_f1: 0.5916
 epoch: 4, train_loss: 0.8462, test_loss: 0.9319, test_f1: 0.5444
 epoch: 5, train_loss: 0.8155, test_loss: 0.9039, test_f1: 0.5730
 epoch: 6, train_loss: 0.8013, test_loss: 1.0246, test_f1: 0.5229
 epoch: 7, train_loss: 0.7816, test_loss: 0.9224, test_f1: 0.5451
 epoch: 8, train_loss: 0.7637, test_loss: 0.9074, test_f1: 0.5773
 epoch: 9, train_loss: 0.7552, test_loss: 0.8848, test_f1: 0.5477
 epoch: 10, train_loss: 0.7467, test_loss: 0.8231, test_f1: 0.6006
 epoch: 11, train_loss: 0.6924, test_loss: 0.8631, test_f1: 0.6198
 epoch: 12, train_loss: 0.6744, test_loss: 0.8515, test_f1: 0.6078
 epoch: 13, train_loss: 0.6850, test_loss: 0.8468, test_f1: 0.6087
 epoch: 14, train_loss: 0.6674, test_loss: 0.8735, test_f1: 0.6264
 epoch: 15, train_loss: 0.6708, test_loss: 0.9976, test_f1: 0.5616
 epoch: 16, train_loss: 0.6292, test_loss: 0.8635, test_f1: 0.6283
 epoch: 17, train_loss: 0.6163, test_loss: 0.8788, test_f1: 0.6374
 epoch: 18, train_loss: 0.6223, test_loss: 0.8728, test_f1: 0.6322
 epoch: 19, train_loss: 0.6328, test_loss: 1.0220, test_f1: 0.5559
 epoch: 20, train_loss: 0.5941, test_loss: 0.9192, test_f1: 0.6021
 epoch: 21, train_loss: 0.5843, test_loss: 0.9286, test_f1: 0.5798
 epoch: 22, train_loss: 0.5857, test_loss: 0.9446, test_f1: 0.6223
 epoch: 23, train_loss: 0.5608, test_loss: 0.8738, test_f1: 0.6518
 epoch: 24, train_loss: 0.5424, test_loss: 0.9562, test_f1: 0.5916
 epoch: 25, train_loss: 0.5371, test_loss: 0.9604, test_f1: 0.6675
 epoch: 26, train_loss: 0.5237, test_loss: 0.8217, test_f1: 0.6505
 epoch: 27, train_loss: 0.5301, test_loss: 0.9069, test_f1: 0.6379
 epoch: 28, train_loss: 0.5202, test_loss: 0.9012, test_f1: 0.6237
 epoch: 29, train_loss: 0.5110, test_loss: 1.1073, test_f1: 0.5879
 epoch: 30, train_loss: 0.4906, test_loss: 0.8814, test_f1: 0.6256
 epoch: 31, train_loss: 0.4755, test_loss: 0.9355, test_f1: 0.6160
 epoch: 32, train_loss: 0.5007, test_loss: 0.9556, test_f1: 0.6231
 epoch: 33, train_loss: 0.4785, test_loss: 0.9789, test_f1: 0.6751
 epoch: 34, train_loss: 0.4603, test_loss: 1.0087, test_f1: 0.6166
 epoch: 35, train_loss: 0.4476, test_loss: 0.9490, test_f1: 0.6639
 epoch: 36, train_loss: 0.4393, test_loss: 1.0408, test_f1: 0.6389
 epoch: 37, train_loss: 0.4471, test_loss: 0.9798, test_f1: 0.6428
 epoch: 38, train_loss: 0.4256, test_loss: 1.0230, test_f1: 0.6311
 epoch: 39, train_loss: 0.4190, test_loss: 1.0515, test_f1: 0.6208
 epoch: 40, train_loss: 0.4118, test_loss: 1.0220, test_f1: 0.6152
 epoch: 41, train_loss: 0.3899, test_loss: 1.0973, test_f1: 0.6321
 epoch: 42, train_loss: 0.4294, test_loss: 0.9902, test_f1: 0.6416
 epoch: 43, train_loss: 0.4007, test_loss: 1.0958, test_f1: 0.6438
 epoch: 44, train_loss: 0.3976, test_loss: 1.0744, test_f1: 0.6505
 epoch: 45, train_loss: 0.3884, test_loss: 1.1248, test_f1: 0.6570
 epoch: 46, train_loss: 0.3777, test_loss: 0.9913, test_f1: 0.6713
 epoch: 47, train_loss: 0.3871, test_loss: 1.0119, test_f1: 0.6633
 epoch: 48, train_loss: 0.3571, test_loss: 1.0644, test_f1: 0.6532
 epoch: 49, train_loss: 0.3657, test_loss: 1.0853, test_f1: 0.6630
 epoch: 50, train_loss: 0.3388, test_loss: 1.0486, test_f1: 0.6433
 epoch: 51, train_loss: 0.3245, test_loss: 1.1572, test_f1: 0.6735
 epoch: 52, train_loss: 0.2840, test_loss: 1.1403, test_f1: 0.6732
 epoch: 53, train_loss: 0.2860, test_loss: 1.1755, test_f1: 0.6402
 epoch: 54, train_loss: 0.2601, test_loss: 1.1289, test_f1: 0.6682
 epoch: 55, train_loss: 0.2570, test_loss: 1.2113, test_f1: 0.6543
 epoch: 56, train_loss: 0.2485, test_loss: 1.2675, test_f1: 0.6612
 epoch: 57, train_loss: 0.2683, test_loss: 1.2301, test_f1: 0.6669
 epoch: 58, train_loss: 0.2505, test_loss: 1.4999, test_f1: 0.6114
 epoch: 59, train_loss: 0.2530, test_loss: 1.2032, test_f1: 0.6643
 epoch: 60, train_loss: 0.2562, test_loss: 1.2461, test_f1: 0.6593
 epoch: 61, train_loss: 0.2427, test_loss: 1.2671, test_f1: 0.6644
 epoch: 62, train_loss: 0.2456, test_loss: 1.3951, test_f1: 0.6657
 epoch: 63, train_loss: 0.2633, test_loss: 1.3957, test_f1: 0.6230
 epoch: 64, train_loss: 0.2561, test_loss: 1.3032, test_f1: 0.6814
 epoch: 65, train_loss: 0.2335, test_loss: 1.3480, test_f1: 0.6494
 epoch: 66, train_loss: 0.2359, test_loss: 1.3083, test_f1: 0.6618
 epoch: 67, train_loss: 0.2240, test_loss: 1.4314, test_f1: 0.6480
 epoch: 68, train_loss: 0.2276, test_loss: 1.3972, test_f1: 0.6686
 epoch: 69, train_loss: 0.2148, test_loss: 1.4766, test_f1: 0.6555
 epoch: 70, train_loss: 0.2095, test_loss: 1.4193, test_f1: 0.6595
 epoch: 71, train_loss: 0.2070, test_loss: 1.3909, test_f1: 0.6598
 epoch: 72, train_loss: 0.2369, test_loss: 1.4765, test_f1: 0.6597
 epoch: 73, train_loss: 0.2156, test_loss: 1.3713, test_f1: 0.6647
 epoch: 74, train_loss: 0.2284, test_loss: 1.4662, test_f1: 0.6552
 epoch: 75, train_loss: 0.2049, test_loss: 1.5052, test_f1: 0.6524
 epoch: 76, train_loss: 0.2092, test_loss: 1.4806, test_f1: 0.6763
 epoch: 77, train_loss: 0.2011, test_loss: 1.5471, test_f1: 0.6538
 epoch: 78, train_loss: 0.1970, test_loss: 1.6012, test_f1: 0.6595
 epoch: 79, train_loss: 0.1965, test_loss: 1.6053, test_f1: 0.6264
 epoch: 80, train_loss: 0.1855, test_loss: 1.6551, test_f1: 0.6743
 epoch: 81, train_loss: 0.2062, test_loss: 1.4911, test_f1: 0.6611
 epoch: 82, train_loss: 0.1985, test_loss: 1.8291, test_f1: 0.6177
 epoch: 83, train_loss: 0.1886, test_loss: 1.6194, test_f1: 0.6427
 epoch: 84, train_loss: 0.1915, test_loss: 1.4908, test_f1: 0.6440
 epoch: 85, train_loss: 0.1821, test_loss: 1.4225, test_f1: 0.6836
 epoch: 86, train_loss: 0.1793, test_loss: 1.7472, test_f1: 0.6521
 epoch: 87, train_loss: 0.1909, test_loss: 1.5400, test_f1: 0.6426
 epoch: 88, train_loss: 0.1821, test_loss: 1.7086, test_f1: 0.6471
 epoch: 89, train_loss: 0.1808, test_loss: 1.7363, test_f1: 0.6454
 epoch: 90, train_loss: 0.1767, test_loss: 1.8860, test_f1: 0.6572
 epoch: 91, train_loss: 0.1665, test_loss: 1.6142, test_f1: 0.6473
 epoch: 92, train_loss: 0.1884, test_loss: 1.6185, test_f1: 0.6131
 epoch: 93, train_loss: 0.1796, test_loss: 1.9176, test_f1: 0.6574
 epoch: 94, train_loss: 0.1639, test_loss: 1.8358, test_f1: 0.6529
 epoch: 95, train_loss: 0.1483, test_loss: 1.7413, test_f1: 0.6366
 epoch: 96, train_loss: 0.1584, test_loss: 1.6696, test_f1: 0.6476
 epoch: 97, train_loss: 0.1614, test_loss: 1.9452, test_f1: 0.6394
 epoch: 98, train_loss: 0.1866, test_loss: 1.7083, test_f1: 0.5936
 epoch: 99, train_loss: 0.1882, test_loss: 1.7006, test_f1: 0.6323
##################ITERATION #5 ****************************************
 epoch: 0, train_loss: 1.5170, test_loss: 1.2571, test_f1: 0.3372
 epoch: 1, train_loss: 1.0231, test_loss: 1.0180, test_f1: 0.5142
 epoch: 2, train_loss: 0.9544, test_loss: 0.9585, test_f1: 0.5297
 epoch: 3, train_loss: 0.9257, test_loss: 0.9450, test_f1: 0.5372
 epoch: 4, train_loss: 0.8807, test_loss: 0.9093, test_f1: 0.5648
 epoch: 5, train_loss: 0.8616, test_loss: 0.8640, test_f1: 0.5619
 epoch: 6, train_loss: 0.8378, test_loss: 0.9445, test_f1: 0.5351
 epoch: 7, train_loss: 0.8084, test_loss: 0.9504, test_f1: 0.5800
 epoch: 8, train_loss: 0.7968, test_loss: 0.8937, test_f1: 0.6010
 epoch: 9, train_loss: 0.7763, test_loss: 0.9369, test_f1: 0.5502
 epoch: 10, train_loss: 0.7517, test_loss: 0.9359, test_f1: 0.5557
 epoch: 11, train_loss: 0.7459, test_loss: 0.7891, test_f1: 0.6615
 epoch: 12, train_loss: 0.7302, test_loss: 0.8727, test_f1: 0.5998
 epoch: 13, train_loss: 0.6935, test_loss: 0.8906, test_f1: 0.6026
 epoch: 14, train_loss: 0.6865, test_loss: 0.7911, test_f1: 0.6268
 epoch: 15, train_loss: 0.6757, test_loss: 0.8046, test_f1: 0.6379
 epoch: 16, train_loss: 0.6616, test_loss: 0.9270, test_f1: 0.6003
 epoch: 17, train_loss: 0.6415, test_loss: 0.8165, test_f1: 0.6363
 epoch: 18, train_loss: 0.6441, test_loss: 0.9305, test_f1: 0.6044
 epoch: 19, train_loss: 0.6270, test_loss: 0.7982, test_f1: 0.6442
 epoch: 20, train_loss: 0.6196, test_loss: 0.8062, test_f1: 0.6501
 epoch: 21, train_loss: 0.6220, test_loss: 0.9626, test_f1: 0.6040
 epoch: 22, train_loss: 0.6011, test_loss: 0.8085, test_f1: 0.6434
 epoch: 23, train_loss: 0.5694, test_loss: 0.8109, test_f1: 0.6567
 epoch: 24, train_loss: 0.5730, test_loss: 0.8851, test_f1: 0.6155
 epoch: 25, train_loss: 0.5684, test_loss: 0.8113, test_f1: 0.6338
 epoch: 26, train_loss: 0.5482, test_loss: 0.8876, test_f1: 0.6468
 epoch: 27, train_loss: 0.5468, test_loss: 0.9429, test_f1: 0.5967
 epoch: 28, train_loss: 0.5249, test_loss: 0.8489, test_f1: 0.6340
 epoch: 29, train_loss: 0.5035, test_loss: 0.9957, test_f1: 0.5761
 epoch: 30, train_loss: 0.5304, test_loss: 0.9531, test_f1: 0.6049
 epoch: 31, train_loss: 0.4943, test_loss: 0.8508, test_f1: 0.6273
 epoch: 32, train_loss: 0.4942, test_loss: 0.9809, test_f1: 0.5754
 epoch: 33, train_loss: 0.4977, test_loss: 0.9987, test_f1: 0.6285
 epoch: 34, train_loss: 0.4635, test_loss: 0.8701, test_f1: 0.6490
 epoch: 35, train_loss: 0.4564, test_loss: 0.9565, test_f1: 0.6526
 epoch: 36, train_loss: 0.4575, test_loss: 0.9994, test_f1: 0.6313
 epoch: 37, train_loss: 0.4602, test_loss: 0.8820, test_f1: 0.6567
 epoch: 38, train_loss: 0.4339, test_loss: 0.8813, test_f1: 0.6441
 epoch: 39, train_loss: 0.4227, test_loss: 1.0676, test_f1: 0.6159
 epoch: 40, train_loss: 0.4251, test_loss: 1.0828, test_f1: 0.6039
 epoch: 41, train_loss: 0.4089, test_loss: 0.9787, test_f1: 0.6614
 epoch: 42, train_loss: 0.4043, test_loss: 1.0768, test_f1: 0.6122
 epoch: 43, train_loss: 0.4089, test_loss: 1.0462, test_f1: 0.6434
 epoch: 44, train_loss: 0.4014, test_loss: 1.0723, test_f1: 0.6093
 epoch: 45, train_loss: 0.4129, test_loss: 0.9462, test_f1: 0.6645
 epoch: 46, train_loss: 0.3878, test_loss: 1.0095, test_f1: 0.6219
 epoch: 47, train_loss: 0.3702, test_loss: 1.1461, test_f1: 0.6202
 epoch: 48, train_loss: 0.3717, test_loss: 1.1681, test_f1: 0.6187
 epoch: 49, train_loss: 0.3675, test_loss: 1.1704, test_f1: 0.6000
 epoch: 50, train_loss: 0.3521, test_loss: 1.1843, test_f1: 0.6320
 epoch: 51, train_loss: 0.3372, test_loss: 1.0150, test_f1: 0.6661
 epoch: 52, train_loss: 0.2979, test_loss: 1.0132, test_f1: 0.6686
 epoch: 53, train_loss: 0.3002, test_loss: 1.0152, test_f1: 0.6840
 epoch: 54, train_loss: 0.2943, test_loss: 1.1792, test_f1: 0.6326
 epoch: 55, train_loss: 0.2742, test_loss: 1.0827, test_f1: 0.6599
 epoch: 56, train_loss: 0.2591, test_loss: 1.3262, test_f1: 0.6409
 epoch: 57, train_loss: 0.2796, test_loss: 1.2505, test_f1: 0.6302
 epoch: 58, train_loss: 0.2693, test_loss: 1.2801, test_f1: 0.6457
 epoch: 59, train_loss: 0.2684, test_loss: 1.1334, test_f1: 0.6636
 epoch: 60, train_loss: 0.2684, test_loss: 1.3102, test_f1: 0.6487
 epoch: 61, train_loss: 0.2504, test_loss: 1.1697, test_f1: 0.6811
 epoch: 62, train_loss: 0.2444, test_loss: 1.2339, test_f1: 0.6562
 epoch: 63, train_loss: 0.2464, test_loss: 1.3222, test_f1: 0.6676
 epoch: 64, train_loss: 0.2423, test_loss: 1.3767, test_f1: 0.6293
 epoch: 65, train_loss: 0.2239, test_loss: 1.2567, test_f1: 0.6719
 epoch: 66, train_loss: 0.2636, test_loss: 1.4407, test_f1: 0.5973
 epoch: 67, train_loss: 0.2697, test_loss: 1.4792, test_f1: 0.6246
 epoch: 68, train_loss: 0.2428, test_loss: 1.2663, test_f1: 0.6625
 epoch: 69, train_loss: 0.2335, test_loss: 1.2049, test_f1: 0.6690
 epoch: 70, train_loss: 0.2507, test_loss: 1.4212, test_f1: 0.6169
 epoch: 71, train_loss: 0.2320, test_loss: 1.2613, test_f1: 0.6559
 epoch: 72, train_loss: 0.2502, test_loss: 1.2654, test_f1: 0.6593
 epoch: 73, train_loss: 0.2300, test_loss: 1.2290, test_f1: 0.6581
 epoch: 74, train_loss: 0.2003, test_loss: 1.4243, test_f1: 0.6192
 epoch: 75, train_loss: 0.2225, test_loss: 1.4790, test_f1: 0.6552
 epoch: 76, train_loss: 0.2172, test_loss: 1.2786, test_f1: 0.6609
 epoch: 77, train_loss: 0.2058, test_loss: 1.7200, test_f1: 0.6107
 epoch: 78, train_loss: 0.2146, test_loss: 1.2675, test_f1: 0.6450
 epoch: 79, train_loss: 0.2024, test_loss: 1.5153, test_f1: 0.6534
 epoch: 80, train_loss: 0.2209, test_loss: 1.4497, test_f1: 0.6324
 epoch: 81, train_loss: 0.1979, test_loss: 1.5363, test_f1: 0.6514
 epoch: 82, train_loss: 0.2094, test_loss: 1.5567, test_f1: 0.6482
 epoch: 83, train_loss: 0.1956, test_loss: 1.4461, test_f1: 0.6473
 epoch: 84, train_loss: 0.2040, test_loss: 1.4879, test_f1: 0.6323
 epoch: 85, train_loss: 0.1916, test_loss: 1.4447, test_f1: 0.6204
 epoch: 86, train_loss: 0.1912, test_loss: 1.6797, test_f1: 0.6108
 epoch: 87, train_loss: 0.2039, test_loss: 1.6476, test_f1: 0.6261
 epoch: 88, train_loss: 0.2109, test_loss: 1.5788, test_f1: 0.6220
 epoch: 89, train_loss: 0.1982, test_loss: 1.4088, test_f1: 0.6790
 epoch: 90, train_loss: 0.1802, test_loss: 1.5763, test_f1: 0.6172
 epoch: 91, train_loss: 0.1894, test_loss: 1.7363, test_f1: 0.6280
 epoch: 92, train_loss: 0.1674, test_loss: 1.4507, test_f1: 0.6412
 epoch: 93, train_loss: 0.1755, test_loss: 1.6186, test_f1: 0.6343
 epoch: 94, train_loss: 0.1816, test_loss: 1.6760, test_f1: 0.6268
 epoch: 95, train_loss: 0.1967, test_loss: 1.5390, test_f1: 0.6189
 epoch: 96, train_loss: 0.1782, test_loss: 1.7065, test_f1: 0.6148
 epoch: 97, train_loss: 0.1821, test_loss: 1.5278, test_f1: 0.6514
 epoch: 98, train_loss: 0.1697, test_loss: 1.5962, test_f1: 0.6291
 epoch: 99, train_loss: 0.1653, test_loss: 1.5051, test_f1: 0.6235
##################ITERATION #6 ****************************************
 epoch: 0, train_loss: 1.4709, test_loss: 1.3386, test_f1: 0.2260
 epoch: 1, train_loss: 0.9873, test_loss: 0.9924, test_f1: 0.5085
 epoch: 2, train_loss: 0.9256, test_loss: 0.9556, test_f1: 0.5439
 epoch: 3, train_loss: 0.9037, test_loss: 0.9038, test_f1: 0.5759
 epoch: 4, train_loss: 0.8642, test_loss: 0.9330, test_f1: 0.5835
 epoch: 5, train_loss: 0.8307, test_loss: 0.9055, test_f1: 0.5869
 epoch: 6, train_loss: 0.8205, test_loss: 0.9808, test_f1: 0.5471
 epoch: 7, train_loss: 0.8042, test_loss: 0.8498, test_f1: 0.6389
 epoch: 8, train_loss: 0.7641, test_loss: 0.8652, test_f1: 0.5551
 epoch: 9, train_loss: 0.7492, test_loss: 0.8573, test_f1: 0.5834
 epoch: 10, train_loss: 0.7334, test_loss: 1.0027, test_f1: 0.5022
 epoch: 11, train_loss: 0.7318, test_loss: 0.8477, test_f1: 0.6156
 epoch: 12, train_loss: 0.7023, test_loss: 0.8256, test_f1: 0.6191
 epoch: 13, train_loss: 0.6998, test_loss: 0.8779, test_f1: 0.6142
 epoch: 14, train_loss: 0.6977, test_loss: 0.8688, test_f1: 0.6216
 epoch: 15, train_loss: 0.6869, test_loss: 0.8766, test_f1: 0.6209
 epoch: 16, train_loss: 0.6428, test_loss: 0.8874, test_f1: 0.6151
 epoch: 17, train_loss: 0.6484, test_loss: 0.8553, test_f1: 0.6170
 epoch: 18, train_loss: 0.6183, test_loss: 0.9047, test_f1: 0.6283
 epoch: 19, train_loss: 0.5997, test_loss: 0.8780, test_f1: 0.6120
 epoch: 20, train_loss: 0.6043, test_loss: 0.8204, test_f1: 0.6494
 epoch: 21, train_loss: 0.6010, test_loss: 0.8995, test_f1: 0.6262
 epoch: 22, train_loss: 0.5928, test_loss: 0.8498, test_f1: 0.6335
 epoch: 23, train_loss: 0.5934, test_loss: 1.0678, test_f1: 0.5831
 epoch: 24, train_loss: 0.5595, test_loss: 0.9897, test_f1: 0.5875
 epoch: 25, train_loss: 0.5569, test_loss: 1.2699, test_f1: 0.5675
 epoch: 26, train_loss: 0.5354, test_loss: 0.9927, test_f1: 0.6089
 epoch: 27, train_loss: 0.5538, test_loss: 0.8854, test_f1: 0.6556
 epoch: 28, train_loss: 0.5270, test_loss: 0.9111, test_f1: 0.6362
 epoch: 29, train_loss: 0.5192, test_loss: 0.9269, test_f1: 0.6645
 epoch: 30, train_loss: 0.5127, test_loss: 0.9889, test_f1: 0.6328
 epoch: 31, train_loss: 0.5093, test_loss: 0.9166, test_f1: 0.6375
 epoch: 32, train_loss: 0.4964, test_loss: 0.9015, test_f1: 0.6509
 epoch: 33, train_loss: 0.4712, test_loss: 1.0617, test_f1: 0.6182
 epoch: 34, train_loss: 0.4722, test_loss: 0.9385, test_f1: 0.6573
 epoch: 35, train_loss: 0.4704, test_loss: 1.0180, test_f1: 0.6381
 epoch: 36, train_loss: 0.4528, test_loss: 0.9398, test_f1: 0.6307
 epoch: 37, train_loss: 0.4388, test_loss: 0.9581, test_f1: 0.6340
 epoch: 38, train_loss: 0.4431, test_loss: 0.9550, test_f1: 0.6292
 epoch: 39, train_loss: 0.4259, test_loss: 1.0168, test_f1: 0.6390
 epoch: 40, train_loss: 0.4403, test_loss: 1.1108, test_f1: 0.6264
 epoch: 41, train_loss: 0.4363, test_loss: 0.9907, test_f1: 0.6600
 epoch: 42, train_loss: 0.4149, test_loss: 0.9615, test_f1: 0.6783
 epoch: 43, train_loss: 0.4042, test_loss: 1.0464, test_f1: 0.6425
 epoch: 44, train_loss: 0.3837, test_loss: 0.9617, test_f1: 0.6794
 epoch: 45, train_loss: 0.3772, test_loss: 1.0902, test_f1: 0.6480
 epoch: 46, train_loss: 0.3862, test_loss: 1.0215, test_f1: 0.6747
 epoch: 47, train_loss: 0.3864, test_loss: 1.0170, test_f1: 0.6881
 epoch: 48, train_loss: 0.3783, test_loss: 0.9669, test_f1: 0.6679
 epoch: 49, train_loss: 0.3645, test_loss: 1.1424, test_f1: 0.6329
 epoch: 50, train_loss: 0.3573, test_loss: 1.3602, test_f1: 0.5893
 epoch: 51, train_loss: 0.3363, test_loss: 1.0613, test_f1: 0.6754
 epoch: 52, train_loss: 0.2981, test_loss: 1.1145, test_f1: 0.6798
 epoch: 53, train_loss: 0.2912, test_loss: 1.1042, test_f1: 0.6785
 epoch: 54, train_loss: 0.2946, test_loss: 1.0787, test_f1: 0.6697
 epoch: 55, train_loss: 0.2846, test_loss: 1.1414, test_f1: 0.6376
 epoch: 56, train_loss: 0.2698, test_loss: 1.1760, test_f1: 0.6754
 epoch: 57, train_loss: 0.2646, test_loss: 1.1394, test_f1: 0.6693
 epoch: 58, train_loss: 0.2707, test_loss: 1.3106, test_f1: 0.6325
 epoch: 59, train_loss: 0.2637, test_loss: 1.1905, test_f1: 0.6718
 epoch: 60, train_loss: 0.2563, test_loss: 1.1910, test_f1: 0.6668
 epoch: 61, train_loss: 0.2501, test_loss: 1.2588, test_f1: 0.6787
 epoch: 62, train_loss: 0.2546, test_loss: 1.2705, test_f1: 0.6683
 epoch: 63, train_loss: 0.2351, test_loss: 1.2922, test_f1: 0.6709
 epoch: 64, train_loss: 0.2376, test_loss: 1.2858, test_f1: 0.6666
 epoch: 65, train_loss: 0.2434, test_loss: 1.2033, test_f1: 0.6680
 epoch: 66, train_loss: 0.2397, test_loss: 1.4154, test_f1: 0.6186
 epoch: 67, train_loss: 0.2233, test_loss: 1.3788, test_f1: 0.6583
 epoch: 68, train_loss: 0.2362, test_loss: 1.4062, test_f1: 0.6450
 epoch: 69, train_loss: 0.2394, test_loss: 1.3486, test_f1: 0.6722
 epoch: 70, train_loss: 0.2215, test_loss: 1.3592, test_f1: 0.6326
 epoch: 71, train_loss: 0.2177, test_loss: 1.5541, test_f1: 0.6151
 epoch: 72, train_loss: 0.2271, test_loss: 1.5132, test_f1: 0.6391
 epoch: 73, train_loss: 0.2085, test_loss: 1.5277, test_f1: 0.6217
 epoch: 74, train_loss: 0.2181, test_loss: 1.4132, test_f1: 0.6528
 epoch: 75, train_loss: 0.2272, test_loss: 1.3595, test_f1: 0.6665
 epoch: 76, train_loss: 0.2053, test_loss: 1.5043, test_f1: 0.6239
 epoch: 77, train_loss: 0.2055, test_loss: 1.4639, test_f1: 0.6402
 epoch: 78, train_loss: 0.2095, test_loss: 1.5202, test_f1: 0.6410
 epoch: 79, train_loss: 0.2079, test_loss: 1.3303, test_f1: 0.6525
 epoch: 80, train_loss: 0.1955, test_loss: 1.3748, test_f1: 0.6712
 epoch: 81, train_loss: 0.2038, test_loss: 1.4970, test_f1: 0.6726
 epoch: 82, train_loss: 0.2003, test_loss: 1.5268, test_f1: 0.6741
 epoch: 83, train_loss: 0.2063, test_loss: 1.4880, test_f1: 0.6672
 epoch: 84, train_loss: 0.1899, test_loss: 1.4840, test_f1: 0.6426
 epoch: 85, train_loss: 0.1874, test_loss: 1.6858, test_f1: 0.6308
 epoch: 86, train_loss: 0.1857, test_loss: 1.6810, test_f1: 0.6343
 epoch: 87, train_loss: 0.1932, test_loss: 1.5812, test_f1: 0.6288
 epoch: 88, train_loss: 0.1935, test_loss: 1.6006, test_f1: 0.6415
 epoch: 89, train_loss: 0.1799, test_loss: 1.6836, test_f1: 0.6250
 epoch: 90, train_loss: 0.1754, test_loss: 1.6822, test_f1: 0.6236
 epoch: 91, train_loss: 0.1797, test_loss: 1.6835, test_f1: 0.6109
 epoch: 92, train_loss: 0.1640, test_loss: 1.7103, test_f1: 0.6296
 epoch: 93, train_loss: 0.1735, test_loss: 1.6650, test_f1: 0.6621
 epoch: 94, train_loss: 0.1871, test_loss: 1.8097, test_f1: 0.6091
 epoch: 95, train_loss: 0.1732, test_loss: 1.7167, test_f1: 0.6625
 epoch: 96, train_loss: 0.1815, test_loss: 1.6540, test_f1: 0.6469
 epoch: 97, train_loss: 0.1718, test_loss: 1.5590, test_f1: 0.6643
 epoch: 98, train_loss: 0.1588, test_loss: 2.1088, test_f1: 0.6046
 epoch: 99, train_loss: 0.1609, test_loss: 1.6809, test_f1: 0.6433
##################ITERATION #7 ****************************************
 epoch: 0, train_loss: 1.5768, test_loss: 1.2197, test_f1: 0.3722
 epoch: 1, train_loss: 1.0118, test_loss: 1.0624, test_f1: 0.4350
 epoch: 2, train_loss: 0.9523, test_loss: 0.9613, test_f1: 0.5342
 epoch: 3, train_loss: 0.9096, test_loss: 0.9206, test_f1: 0.5716
 epoch: 4, train_loss: 0.8788, test_loss: 0.9275, test_f1: 0.5764
 epoch: 5, train_loss: 0.8499, test_loss: 0.9299, test_f1: 0.6141
 epoch: 6, train_loss: 0.8422, test_loss: 0.9410, test_f1: 0.5935
 epoch: 7, train_loss: 0.8098, test_loss: 0.9401, test_f1: 0.5549
 epoch: 8, train_loss: 0.7936, test_loss: 0.9904, test_f1: 0.5175
 epoch: 9, train_loss: 0.7679, test_loss: 0.8949, test_f1: 0.5763
 epoch: 10, train_loss: 0.7478, test_loss: 0.9955, test_f1: 0.5529
 epoch: 11, train_loss: 0.7383, test_loss: 1.0033, test_f1: 0.5757
 epoch: 12, train_loss: 0.7159, test_loss: 0.9260, test_f1: 0.5849
 epoch: 13, train_loss: 0.7031, test_loss: 0.8684, test_f1: 0.6041
 epoch: 14, train_loss: 0.6789, test_loss: 0.8751, test_f1: 0.5952
 epoch: 15, train_loss: 0.6738, test_loss: 0.9198, test_f1: 0.5530
 epoch: 16, train_loss: 0.6703, test_loss: 0.8702, test_f1: 0.6350
 epoch: 17, train_loss: 0.6484, test_loss: 0.9239, test_f1: 0.5864
 epoch: 18, train_loss: 0.6488, test_loss: 0.8489, test_f1: 0.6240
 epoch: 19, train_loss: 0.6218, test_loss: 0.8190, test_f1: 0.6471
 epoch: 20, train_loss: 0.6316, test_loss: 0.9087, test_f1: 0.6227
 epoch: 21, train_loss: 0.6047, test_loss: 0.8944, test_f1: 0.5893
 epoch: 22, train_loss: 0.6010, test_loss: 0.9937, test_f1: 0.5738
 epoch: 23, train_loss: 0.5827, test_loss: 0.8961, test_f1: 0.6298
 epoch: 24, train_loss: 0.5883, test_loss: 0.9193, test_f1: 0.5962
 epoch: 25, train_loss: 0.5624, test_loss: 0.8618, test_f1: 0.6411
 epoch: 26, train_loss: 0.5370, test_loss: 0.8247, test_f1: 0.6755
 epoch: 27, train_loss: 0.5531, test_loss: 0.9180, test_f1: 0.6069
 epoch: 28, train_loss: 0.5356, test_loss: 0.8258, test_f1: 0.6571
 epoch: 29, train_loss: 0.4988, test_loss: 0.8880, test_f1: 0.6374
 epoch: 30, train_loss: 0.5133, test_loss: 0.8910, test_f1: 0.6373
 epoch: 31, train_loss: 0.5034, test_loss: 0.9097, test_f1: 0.6053
 epoch: 32, train_loss: 0.4981, test_loss: 0.8743, test_f1: 0.6602
 epoch: 33, train_loss: 0.4902, test_loss: 0.9414, test_f1: 0.5891
 epoch: 34, train_loss: 0.4827, test_loss: 0.9235, test_f1: 0.6371
 epoch: 35, train_loss: 0.4742, test_loss: 0.9374, test_f1: 0.6291
 epoch: 36, train_loss: 0.4681, test_loss: 0.7649, test_f1: 0.6745
 epoch: 37, train_loss: 0.4596, test_loss: 0.9975, test_f1: 0.6357
 epoch: 38, train_loss: 0.4592, test_loss: 0.8868, test_f1: 0.6409
 epoch: 39, train_loss: 0.4390, test_loss: 0.8548, test_f1: 0.6477
 epoch: 40, train_loss: 0.4210, test_loss: 0.8406, test_f1: 0.6688
 epoch: 41, train_loss: 0.4341, test_loss: 0.9594, test_f1: 0.6224
 epoch: 42, train_loss: 0.4230, test_loss: 0.9274, test_f1: 0.6655
 epoch: 43, train_loss: 0.4243, test_loss: 1.0934, test_f1: 0.5899
 epoch: 44, train_loss: 0.4169, test_loss: 0.9050, test_f1: 0.6440
 epoch: 45, train_loss: 0.4123, test_loss: 0.9862, test_f1: 0.6280
 epoch: 46, train_loss: 0.4040, test_loss: 1.0278, test_f1: 0.6350
 epoch: 47, train_loss: 0.3995, test_loss: 0.9221, test_f1: 0.6595
 epoch: 48, train_loss: 0.4021, test_loss: 0.8827, test_f1: 0.6567
 epoch: 49, train_loss: 0.3840, test_loss: 0.9814, test_f1: 0.6625
 epoch: 50, train_loss: 0.3622, test_loss: 1.0037, test_f1: 0.6661
 epoch: 51, train_loss: 0.3432, test_loss: 0.9711, test_f1: 0.6572
 epoch: 52, train_loss: 0.3099, test_loss: 0.9542, test_f1: 0.6713
 epoch: 53, train_loss: 0.3188, test_loss: 0.9888, test_f1: 0.6804
 epoch: 54, train_loss: 0.2942, test_loss: 1.0688, test_f1: 0.6321
 epoch: 55, train_loss: 0.2856, test_loss: 0.9738, test_f1: 0.6762
 epoch: 56, train_loss: 0.2697, test_loss: 1.0191, test_f1: 0.6755
 epoch: 57, train_loss: 0.2846, test_loss: 0.9798, test_f1: 0.6569
 epoch: 58, train_loss: 0.2738, test_loss: 1.0734, test_f1: 0.6676
 epoch: 59, train_loss: 0.2734, test_loss: 1.0439, test_f1: 0.6716
 epoch: 60, train_loss: 0.2751, test_loss: 0.9937, test_f1: 0.6714
 epoch: 61, train_loss: 0.2738, test_loss: 1.1666, test_f1: 0.6498
 epoch: 62, train_loss: 0.2672, test_loss: 1.0174, test_f1: 0.6773
 epoch: 63, train_loss: 0.2735, test_loss: 1.1370, test_f1: 0.6471
 epoch: 64, train_loss: 0.2526, test_loss: 1.1930, test_f1: 0.6674
 epoch: 65, train_loss: 0.2538, test_loss: 1.1305, test_f1: 0.6537
 epoch: 66, train_loss: 0.2596, test_loss: 1.1588, test_f1: 0.6400
 epoch: 67, train_loss: 0.2542, test_loss: 1.1455, test_f1: 0.6584
 epoch: 68, train_loss: 0.2442, test_loss: 1.1313, test_f1: 0.6362
 epoch: 69, train_loss: 0.2451, test_loss: 1.0864, test_f1: 0.6638
 epoch: 70, train_loss: 0.2426, test_loss: 1.0543, test_f1: 0.6656
 epoch: 71, train_loss: 0.2393, test_loss: 1.1762, test_f1: 0.6485
 epoch: 72, train_loss: 0.2525, test_loss: 1.2031, test_f1: 0.6608
 epoch: 73, train_loss: 0.2300, test_loss: 1.2515, test_f1: 0.6553
 epoch: 74, train_loss: 0.2458, test_loss: 1.2433, test_f1: 0.6565
 epoch: 75, train_loss: 0.2229, test_loss: 1.1326, test_f1: 0.6637
 epoch: 76, train_loss: 0.2358, test_loss: 1.1503, test_f1: 0.6521
 epoch: 77, train_loss: 0.2366, test_loss: 1.2037, test_f1: 0.6557
 epoch: 78, train_loss: 0.2298, test_loss: 1.2266, test_f1: 0.6754
 epoch: 79, train_loss: 0.2289, test_loss: 1.2327, test_f1: 0.6685
 epoch: 80, train_loss: 0.2196, test_loss: 1.1595, test_f1: 0.6590
 epoch: 81, train_loss: 0.2264, test_loss: 1.3026, test_f1: 0.6497
 epoch: 82, train_loss: 0.2257, test_loss: 1.2025, test_f1: 0.6608
 epoch: 83, train_loss: 0.2056, test_loss: 1.1956, test_f1: 0.6745
 epoch: 84, train_loss: 0.2017, test_loss: 1.5642, test_f1: 0.6012
 epoch: 85, train_loss: 0.2039, test_loss: 1.2459, test_f1: 0.6615
 epoch: 86, train_loss: 0.1937, test_loss: 1.2668, test_f1: 0.6489
 epoch: 87, train_loss: 0.2113, test_loss: 1.2845, test_f1: 0.6461
 epoch: 88, train_loss: 0.1923, test_loss: 1.4213, test_f1: 0.6336
 epoch: 89, train_loss: 0.1926, test_loss: 1.2825, test_f1: 0.6708
 epoch: 90, train_loss: 0.2031, test_loss: 1.4132, test_f1: 0.6489
 epoch: 91, train_loss: 0.2034, test_loss: 1.3801, test_f1: 0.6564
 epoch: 92, train_loss: 0.1925, test_loss: 1.3391, test_f1: 0.6587
 epoch: 93, train_loss: 0.1925, test_loss: 1.2948, test_f1: 0.6728
 epoch: 94, train_loss: 0.1864, test_loss: 1.3064, test_f1: 0.6590
 epoch: 95, train_loss: 0.1750, test_loss: 1.4150, test_f1: 0.6146
 epoch: 96, train_loss: 0.1895, test_loss: 1.3206, test_f1: 0.6693
 epoch: 97, train_loss: 0.1749, test_loss: 1.5059, test_f1: 0.6112
 epoch: 98, train_loss: 0.1797, test_loss: 1.3927, test_f1: 0.6563
 epoch: 99, train_loss: 0.1827, test_loss: 1.5430, test_f1: 0.6283
##################ITERATION #8 ****************************************
 epoch: 0, train_loss: 1.5641, test_loss: 1.1862, test_f1: 0.2597
 epoch: 1, train_loss: 1.0250, test_loss: 0.9810, test_f1: 0.4918
 epoch: 2, train_loss: 0.9627, test_loss: 0.9507, test_f1: 0.5405
 epoch: 3, train_loss: 0.9344, test_loss: 0.9209, test_f1: 0.5466
 epoch: 4, train_loss: 0.9035, test_loss: 0.9289, test_f1: 0.5554
 epoch: 5, train_loss: 0.8880, test_loss: 0.8734, test_f1: 0.5924
 epoch: 6, train_loss: 0.8449, test_loss: 0.8811, test_f1: 0.5747
 epoch: 7, train_loss: 0.8370, test_loss: 0.9150, test_f1: 0.5819
 epoch: 8, train_loss: 0.8022, test_loss: 0.9086, test_f1: 0.5937
 epoch: 9, train_loss: 0.7844, test_loss: 0.8892, test_f1: 0.6092
 epoch: 10, train_loss: 0.7593, test_loss: 0.9125, test_f1: 0.5876
 epoch: 11, train_loss: 0.7369, test_loss: 0.7918, test_f1: 0.6301
 epoch: 12, train_loss: 0.7232, test_loss: 0.8390, test_f1: 0.5841
 epoch: 13, train_loss: 0.7192, test_loss: 0.8546, test_f1: 0.6154
 epoch: 14, train_loss: 0.6951, test_loss: 0.8872, test_f1: 0.6257
 epoch: 15, train_loss: 0.6831, test_loss: 0.8365, test_f1: 0.6342
 epoch: 16, train_loss: 0.6757, test_loss: 0.9252, test_f1: 0.6044
 epoch: 17, train_loss: 0.6640, test_loss: 0.9257, test_f1: 0.5937
 epoch: 18, train_loss: 0.6551, test_loss: 0.8531, test_f1: 0.6489
 epoch: 19, train_loss: 0.6484, test_loss: 0.8951, test_f1: 0.6033
 epoch: 20, train_loss: 0.6299, test_loss: 0.8228, test_f1: 0.6263
 epoch: 21, train_loss: 0.6166, test_loss: 0.8629, test_f1: 0.6602
 epoch: 22, train_loss: 0.6025, test_loss: 0.8488, test_f1: 0.6369
 epoch: 23, train_loss: 0.6087, test_loss: 0.8775, test_f1: 0.6188
 epoch: 24, train_loss: 0.5839, test_loss: 0.8199, test_f1: 0.6425
 epoch: 25, train_loss: 0.5877, test_loss: 0.8739, test_f1: 0.6538
 epoch: 26, train_loss: 0.5657, test_loss: 0.8262, test_f1: 0.6544
 epoch: 27, train_loss: 0.5676, test_loss: 0.8649, test_f1: 0.6607
 epoch: 28, train_loss: 0.5434, test_loss: 1.0670, test_f1: 0.6063
 epoch: 29, train_loss: 0.5524, test_loss: 0.9672, test_f1: 0.5941
 epoch: 30, train_loss: 0.5305, test_loss: 0.9015, test_f1: 0.6320
 epoch: 31, train_loss: 0.5262, test_loss: 0.8805, test_f1: 0.6663
 epoch: 32, train_loss: 0.5266, test_loss: 1.0178, test_f1: 0.6260
 epoch: 33, train_loss: 0.5006, test_loss: 0.9756, test_f1: 0.6434
 epoch: 34, train_loss: 0.4957, test_loss: 0.8781, test_f1: 0.6392
 epoch: 35, train_loss: 0.4868, test_loss: 0.9286, test_f1: 0.6612
 epoch: 36, train_loss: 0.4698, test_loss: 0.9448, test_f1: 0.6669
 epoch: 37, train_loss: 0.4585, test_loss: 0.8914, test_f1: 0.6812
 epoch: 38, train_loss: 0.4556, test_loss: 0.9219, test_f1: 0.6545
 epoch: 39, train_loss: 0.4582, test_loss: 0.9642, test_f1: 0.6555
 epoch: 40, train_loss: 0.4461, test_loss: 0.9769, test_f1: 0.6382
 epoch: 41, train_loss: 0.4307, test_loss: 1.0066, test_f1: 0.6665
 epoch: 42, train_loss: 0.4259, test_loss: 1.0102, test_f1: 0.6533
 epoch: 43, train_loss: 0.4114, test_loss: 1.2357, test_f1: 0.6019
 epoch: 44, train_loss: 0.4113, test_loss: 0.9702, test_f1: 0.6508
 epoch: 45, train_loss: 0.4474, test_loss: 1.1458, test_f1: 0.5740
 epoch: 46, train_loss: 0.4152, test_loss: 1.0460, test_f1: 0.6677
 epoch: 47, train_loss: 0.4217, test_loss: 1.0105, test_f1: 0.6656
 epoch: 48, train_loss: 0.4091, test_loss: 0.9657, test_f1: 0.6330
 epoch: 49, train_loss: 0.3906, test_loss: 1.1592, test_f1: 0.6326
 epoch: 50, train_loss: 0.3952, test_loss: 1.1260, test_f1: 0.6317
 epoch: 51, train_loss: 0.3266, test_loss: 1.0528, test_f1: 0.6627
 epoch: 52, train_loss: 0.3141, test_loss: 1.0681, test_f1: 0.6685
 epoch: 53, train_loss: 0.3187, test_loss: 1.1233, test_f1: 0.6560
 epoch: 54, train_loss: 0.3051, test_loss: 1.1493, test_f1: 0.6585
 epoch: 55, train_loss: 0.2855, test_loss: 1.2020, test_f1: 0.6737
 epoch: 56, train_loss: 0.2880, test_loss: 1.1234, test_f1: 0.6823
 epoch: 57, train_loss: 0.2949, test_loss: 1.2056, test_f1: 0.6830
 epoch: 58, train_loss: 0.2831, test_loss: 1.2222, test_f1: 0.6682
 epoch: 59, train_loss: 0.2938, test_loss: 1.1116, test_f1: 0.6765
 epoch: 60, train_loss: 0.2762, test_loss: 1.2526, test_f1: 0.6492
 epoch: 61, train_loss: 0.2858, test_loss: 1.2570, test_f1: 0.6569
 epoch: 62, train_loss: 0.2751, test_loss: 1.1165, test_f1: 0.6860
 epoch: 63, train_loss: 0.2609, test_loss: 1.1761, test_f1: 0.6932
 epoch: 64, train_loss: 0.2449, test_loss: 1.1290, test_f1: 0.6909
 epoch: 65, train_loss: 0.2583, test_loss: 1.1961, test_f1: 0.6810
 epoch: 66, train_loss: 0.2456, test_loss: 1.1618, test_f1: 0.6703
 epoch: 67, train_loss: 0.2533, test_loss: 1.2944, test_f1: 0.6625
 epoch: 68, train_loss: 0.2541, test_loss: 1.3174, test_f1: 0.6754
 epoch: 69, train_loss: 0.2230, test_loss: 1.2400, test_f1: 0.6871
 epoch: 70, train_loss: 0.2394, test_loss: 1.2622, test_f1: 0.6660
 epoch: 71, train_loss: 0.2466, test_loss: 1.2950, test_f1: 0.6750
 epoch: 72, train_loss: 0.2528, test_loss: 1.3054, test_f1: 0.6652
 epoch: 73, train_loss: 0.2575, test_loss: 1.1909, test_f1: 0.6833
 epoch: 74, train_loss: 0.2517, test_loss: 1.2953, test_f1: 0.6750
 epoch: 75, train_loss: 0.2526, test_loss: 1.2436, test_f1: 0.6909
 epoch: 76, train_loss: 0.2301, test_loss: 1.4047, test_f1: 0.6839
 epoch: 77, train_loss: 0.2355, test_loss: 1.2718, test_f1: 0.6973
 epoch: 78, train_loss: 0.2645, test_loss: 1.3189, test_f1: 0.6650
 epoch: 79, train_loss: 0.2283, test_loss: 1.2527, test_f1: 0.6839
 epoch: 80, train_loss: 0.2198, test_loss: 1.3831, test_f1: 0.6808
 epoch: 81, train_loss: 0.2225, test_loss: 1.2760, test_f1: 0.6997
 epoch: 82, train_loss: 0.2188, test_loss: 1.3614, test_f1: 0.6642
 epoch: 83, train_loss: 0.2228, test_loss: 1.5934, test_f1: 0.6529
 epoch: 84, train_loss: 0.2001, test_loss: 1.3559, test_f1: 0.6766
 epoch: 85, train_loss: 0.2034, test_loss: 1.3895, test_f1: 0.6526
 epoch: 86, train_loss: 0.2288, test_loss: 1.2696, test_f1: 0.6792
 epoch: 87, train_loss: 0.2120, test_loss: 1.4266, test_f1: 0.6573
 epoch: 88, train_loss: 0.2044, test_loss: 1.3927, test_f1: 0.6750
 epoch: 89, train_loss: 0.2072, test_loss: 1.4508, test_f1: 0.6694
 epoch: 90, train_loss: 0.1966, test_loss: 1.4413, test_f1: 0.6745
 epoch: 91, train_loss: 0.2127, test_loss: 1.3293, test_f1: 0.6727
 epoch: 92, train_loss: 0.1978, test_loss: 1.4775, test_f1: 0.6971
 epoch: 93, train_loss: 0.1905, test_loss: 1.4179, test_f1: 0.6653
 epoch: 94, train_loss: 0.1962, test_loss: 1.3736, test_f1: 0.6691
 epoch: 95, train_loss: 0.1926, test_loss: 1.4799, test_f1: 0.6803
 epoch: 96, train_loss: 0.1913, test_loss: 1.6183, test_f1: 0.6516
 epoch: 97, train_loss: 0.2000, test_loss: 1.5250, test_f1: 0.6683
 epoch: 98, train_loss: 0.1945, test_loss: 1.4433, test_f1: 0.6804
 epoch: 99, train_loss: 0.1788, test_loss: 1.4617, test_f1: 0.6598
##################ITERATION #9 ****************************************
 epoch: 0, train_loss: 1.4312, test_loss: 1.1481, test_f1: 0.2597
 epoch: 1, train_loss: 0.9840, test_loss: 1.0298, test_f1: 0.4519
 epoch: 2, train_loss: 0.9356, test_loss: 0.9748, test_f1: 0.4958
 epoch: 3, train_loss: 0.8956, test_loss: 0.9691, test_f1: 0.5441
 epoch: 4, train_loss: 0.8633, test_loss: 1.1615, test_f1: 0.5414
 epoch: 5, train_loss: 0.8432, test_loss: 0.9347, test_f1: 0.5799
 epoch: 6, train_loss: 0.8198, test_loss: 0.8710, test_f1: 0.5276
 epoch: 7, train_loss: 0.7986, test_loss: 0.9524, test_f1: 0.5637
 epoch: 8, train_loss: 0.7825, test_loss: 0.8900, test_f1: 0.5726
 epoch: 9, train_loss: 0.7565, test_loss: 0.8345, test_f1: 0.5736
 epoch: 10, train_loss: 0.7302, test_loss: 0.9145, test_f1: 0.5899
 epoch: 11, train_loss: 0.7401, test_loss: 0.8575, test_f1: 0.5803
 epoch: 12, train_loss: 0.7102, test_loss: 0.8571, test_f1: 0.6252
 epoch: 13, train_loss: 0.6944, test_loss: 0.8593, test_f1: 0.5712
 epoch: 14, train_loss: 0.6743, test_loss: 0.8038, test_f1: 0.6459
 epoch: 15, train_loss: 0.6650, test_loss: 0.9181, test_f1: 0.6195
 epoch: 16, train_loss: 0.6471, test_loss: 0.8684, test_f1: 0.6492
 epoch: 17, train_loss: 0.6509, test_loss: 0.8876, test_f1: 0.6124
 epoch: 18, train_loss: 0.6319, test_loss: 0.8858, test_f1: 0.6089
 epoch: 19, train_loss: 0.6201, test_loss: 0.8559, test_f1: 0.6155
 epoch: 20, train_loss: 0.6201, test_loss: 0.9215, test_f1: 0.6076
 epoch: 21, train_loss: 0.6101, test_loss: 0.8785, test_f1: 0.6304
 epoch: 22, train_loss: 0.5991, test_loss: 0.9209, test_f1: 0.6275
 epoch: 23, train_loss: 0.5824, test_loss: 1.0249, test_f1: 0.5437
 epoch: 24, train_loss: 0.5606, test_loss: 0.8979, test_f1: 0.6262
 epoch: 25, train_loss: 0.5652, test_loss: 0.9032, test_f1: 0.6249
 epoch: 26, train_loss: 0.5583, test_loss: 0.8515, test_f1: 0.6559
 epoch: 27, train_loss: 0.5305, test_loss: 0.8220, test_f1: 0.6681
 epoch: 28, train_loss: 0.5057, test_loss: 0.8868, test_f1: 0.6414
 epoch: 29, train_loss: 0.5056, test_loss: 0.9380, test_f1: 0.5976
 epoch: 30, train_loss: 0.4977, test_loss: 1.1016, test_f1: 0.5944
 epoch: 31, train_loss: 0.5113, test_loss: 0.9225, test_f1: 0.6643
 epoch: 32, train_loss: 0.4812, test_loss: 0.8994, test_f1: 0.6323
 epoch: 33, train_loss: 0.4896, test_loss: 0.9037, test_f1: 0.6466
 epoch: 34, train_loss: 0.4774, test_loss: 0.9446, test_f1: 0.6700
 epoch: 35, train_loss: 0.4645, test_loss: 0.9364, test_f1: 0.6358
 epoch: 36, train_loss: 0.4508, test_loss: 0.8875, test_f1: 0.6293
 epoch: 37, train_loss: 0.4222, test_loss: 0.9490, test_f1: 0.6491
 epoch: 38, train_loss: 0.4349, test_loss: 1.0772, test_f1: 0.6513
 epoch: 39, train_loss: 0.4252, test_loss: 0.8774, test_f1: 0.6746
 epoch: 40, train_loss: 0.4122, test_loss: 1.1723, test_f1: 0.6156
 epoch: 41, train_loss: 0.4060, test_loss: 0.9849, test_f1: 0.6526
 epoch: 42, train_loss: 0.3975, test_loss: 1.0821, test_f1: 0.6489
 epoch: 43, train_loss: 0.3971, test_loss: 0.9733, test_f1: 0.6424
 epoch: 44, train_loss: 0.3831, test_loss: 1.2300, test_f1: 0.6226
 epoch: 45, train_loss: 0.3974, test_loss: 1.0833, test_f1: 0.6459
 epoch: 46, train_loss: 0.3928, test_loss: 1.3959, test_f1: 0.6080
 epoch: 47, train_loss: 0.3667, test_loss: 1.2478, test_f1: 0.6121
 epoch: 48, train_loss: 0.3473, test_loss: 1.0217, test_f1: 0.6855
 epoch: 49, train_loss: 0.3585, test_loss: 1.0800, test_f1: 0.6209
 epoch: 50, train_loss: 0.3500, test_loss: 1.2507, test_f1: 0.6338
 epoch: 51, train_loss: 0.3384, test_loss: 1.2050, test_f1: 0.6298
 epoch: 52, train_loss: 0.3096, test_loss: 1.2389, test_f1: 0.6474
 epoch: 53, train_loss: 0.2786, test_loss: 1.1463, test_f1: 0.6902
 epoch: 54, train_loss: 0.2613, test_loss: 1.2501, test_f1: 0.6720
 epoch: 55, train_loss: 0.2628, test_loss: 1.1902, test_f1: 0.6679
 epoch: 56, train_loss: 0.2736, test_loss: 1.2451, test_f1: 0.6821
 epoch: 57, train_loss: 0.2730, test_loss: 1.3008, test_f1: 0.6689
 epoch: 58, train_loss: 0.2459, test_loss: 1.2576, test_f1: 0.6867
 epoch: 59, train_loss: 0.2626, test_loss: 1.3233, test_f1: 0.6600
 epoch: 60, train_loss: 0.2541, test_loss: 1.5114, test_f1: 0.6137
 epoch: 61, train_loss: 0.2451, test_loss: 1.2713, test_f1: 0.6766
 epoch: 62, train_loss: 0.2322, test_loss: 1.4381, test_f1: 0.6634
 epoch: 63, train_loss: 0.2217, test_loss: 1.3055, test_f1: 0.6724
 epoch: 64, train_loss: 0.2305, test_loss: 1.5614, test_f1: 0.6477
 epoch: 65, train_loss: 0.2313, test_loss: 1.2777, test_f1: 0.6718
 epoch: 66, train_loss: 0.2338, test_loss: 1.4302, test_f1: 0.6731
 epoch: 67, train_loss: 0.2353, test_loss: 1.5398, test_f1: 0.6621
 epoch: 68, train_loss: 0.2140, test_loss: 1.4897, test_f1: 0.6441
 epoch: 69, train_loss: 0.2169, test_loss: 1.4177, test_f1: 0.6744
 epoch: 70, train_loss: 0.2100, test_loss: 1.5179, test_f1: 0.6236
 epoch: 71, train_loss: 0.1952, test_loss: 1.5579, test_f1: 0.6803
 epoch: 72, train_loss: 0.2037, test_loss: 1.5791, test_f1: 0.6505
 epoch: 73, train_loss: 0.2036, test_loss: 1.4624, test_f1: 0.6479
 epoch: 74, train_loss: 0.2183, test_loss: 1.5399, test_f1: 0.6543
 epoch: 75, train_loss: 0.1980, test_loss: 1.4169, test_f1: 0.6817
 epoch: 76, train_loss: 0.1972, test_loss: 1.6468, test_f1: 0.6323
 epoch: 77, train_loss: 0.2040, test_loss: 1.7998, test_f1: 0.6265
 epoch: 78, train_loss: 0.2097, test_loss: 1.4393, test_f1: 0.6904
 epoch: 79, train_loss: 0.1998, test_loss: 1.6918, test_f1: 0.6523
 epoch: 80, train_loss: 0.2000, test_loss: 1.5486, test_f1: 0.6491
 epoch: 81, train_loss: 0.1992, test_loss: 1.6799, test_f1: 0.6367
 epoch: 82, train_loss: 0.1838, test_loss: 1.6679, test_f1: 0.6387
 epoch: 83, train_loss: 0.1807, test_loss: 1.5048, test_f1: 0.6727
 epoch: 84, train_loss: 0.1945, test_loss: 1.4964, test_f1: 0.6748
 epoch: 85, train_loss: 0.1883, test_loss: 1.5263, test_f1: 0.6587
 epoch: 86, train_loss: 0.1808, test_loss: 1.5653, test_f1: 0.6751
 epoch: 87, train_loss: 0.1811, test_loss: 1.5802, test_f1: 0.6775
 epoch: 88, train_loss: 0.1781, test_loss: 1.6967, test_f1: 0.6550
 epoch: 89, train_loss: 0.1918, test_loss: 1.6988, test_f1: 0.6577
 epoch: 90, train_loss: 0.1801, test_loss: 1.7181, test_f1: 0.6555
 epoch: 91, train_loss: 0.1651, test_loss: 1.6964, test_f1: 0.6722
 epoch: 92, train_loss: 0.1699, test_loss: 1.5044, test_f1: 0.6724
 epoch: 93, train_loss: 0.1741, test_loss: 1.8171, test_f1: 0.6166
 epoch: 94, train_loss: 0.1660, test_loss: 1.6986, test_f1: 0.6472
 epoch: 95, train_loss: 0.1786, test_loss: 1.7376, test_f1: 0.6444
 epoch: 96, train_loss: 0.1689, test_loss: 1.7937, test_f1: 0.6494
 epoch: 97, train_loss: 0.1592, test_loss: 2.3691, test_f1: 0.6339
 epoch: 98, train_loss: 0.1625, test_loss: 1.7388, test_f1: 0.6725
 epoch: 99, train_loss: 0.1642, test_loss: 1.5404, test_f1: 0.6912

Training completed in 471.71 seconds
Best F1: 0.7122 at epoch 64
Mean F1 across iterations: 0.6910  0.0090
========================FINAL RESULTS================================
FEGIN weighted F1: 0.7122  0.0090
python main.py --data ltspice_examples --representation component_pin --model FEGIN --layers 2 --hiddens 128 --batch_size 128 --lr 0.001 --emb_size 250 --epochs 100 --save_appendix component_pin_L2_H128_BS128_LR0.001_E250 --no_val
-----



STDERR:
  File "main.py", line 370, in <module>
    main()
  File "main.py", line 254, in main
    dataset = dataset_class(
  File "/home/philip/projects/ltspice_examples_code_repo/Circuit-Completion-Using-GNNs/component_classification_with_link_prediction_head/evaluation/FEGIN/kernel/circuit_datasets.py", line 15, in __init__
    self.data, self.slices = torch.load(self.processed_paths[0])
  File "/home/philip/.local/lib/python3.8/site-packages/torch/serialization.py", line 1040, in load
    warnings.warn(
  File "/usr/lib/python3.8/warnings.py", line 109, in _showwarnmsg
    sw(msg.message, msg.category, msg.filename, msg.lineno,
  File "main.py", line 47, in warn_with_traceback
    traceback.print_stack(file=log)
/home/philip/projects/ltspice_examples_code_repo/Circuit-Completion-Using-GNNs/component_classification_with_link_prediction_head/evaluation/FEGIN/kernel/circuit_datasets.py:15: FutureWarning: You are using `torch.load` with `weights_only=False` (the current default value), which uses the default pickle module implicitly. It is possible to construct malicious pickle data which will execute arbitrary code during unpickling (See https://github.com/pytorch/pytorch/blob/main/SECURITY.md#untrusted-models for more details). In a future release, the default value for `weights_only` will be flipped to `True`. This limits the functions that could be executed during unpickling. Arbitrary objects will no longer be allowed to be loaded via this mode unless they are explicitly allowlisted by the user via `torch.serialization.add_safe_globals`. We recommend you start setting `weights_only=True` for any use case where you don't have full control of the loaded file. Please open an issue on GitHub for any issues related to this experimental feature.
  self.data, self.slices = torch.load(self.processed_paths[0])
