STDOUT:
Results will be saved in /home/philip/projects/ltspice_examples_code_repo/Circuit-Completion-Using-GNNs/component_classification_with_link_prediction_head/evaluation/FEGIN/results/model_FEGIN_dataset_ltspice_examples
Command line input: python main.py --data ltspice_examples --representation component_component --model FEGIN --layers 4 --hiddens 64 --batch_size 64 --lr 0.0001 --emb_size 250 --epochs 100 --save_appendix component_component_L4_H64_BS64_LR0.0001_E250 --no_val
 is saved.
-----
ltspice_examples - FEGIN
Using 4 layers, 64 hidden units, h = 2
Loading component_component representation dataset
ENTERED
Training FEGIN on component_component representation
Train: 3556, Test: 845
##################ITERATION #0 ****************************************
 epoch: 0, train_loss: 1.3625, test_loss: 1.3549, test_f1: 0.2274
 epoch: 1, train_loss: 1.3369, test_loss: 1.3303, test_f1: 0.2274
 epoch: 2, train_loss: 1.3116, test_loss: 1.2983, test_f1: 0.2274
 epoch: 3, train_loss: 1.2819, test_loss: 1.2710, test_f1: 0.2274
 epoch: 4, train_loss: 1.2661, test_loss: 1.2486, test_f1: 0.2274
 epoch: 5, train_loss: 1.2523, test_loss: 1.2285, test_f1: 0.2274
 epoch: 6, train_loss: 1.2353, test_loss: 1.2155, test_f1: 0.2399
 epoch: 7, train_loss: 1.2247, test_loss: 1.1983, test_f1: 0.2681
 epoch: 8, train_loss: 1.2126, test_loss: 1.1856, test_f1: 0.3310
 epoch: 9, train_loss: 1.1992, test_loss: 1.1704, test_f1: 0.3790
 epoch: 10, train_loss: 1.1875, test_loss: 1.1510, test_f1: 0.3690
 epoch: 11, train_loss: 1.1724, test_loss: 1.1396, test_f1: 0.3811
 epoch: 12, train_loss: 1.1569, test_loss: 1.1194, test_f1: 0.3858
 epoch: 13, train_loss: 1.1440, test_loss: 1.1056, test_f1: 0.3877
 epoch: 14, train_loss: 1.1348, test_loss: 1.0930, test_f1: 0.3848
 epoch: 15, train_loss: 1.1220, test_loss: 1.0768, test_f1: 0.3941
 epoch: 16, train_loss: 1.1096, test_loss: 1.0685, test_f1: 0.4540
 epoch: 17, train_loss: 1.1032, test_loss: 1.0625, test_f1: 0.4632
 epoch: 18, train_loss: 1.0908, test_loss: 1.0538, test_f1: 0.4502
 epoch: 19, train_loss: 1.0763, test_loss: 1.0485, test_f1: 0.4638
 epoch: 20, train_loss: 1.0687, test_loss: 1.0415, test_f1: 0.4744
 epoch: 21, train_loss: 1.0609, test_loss: 1.0406, test_f1: 0.4707
 epoch: 22, train_loss: 1.0555, test_loss: 1.0226, test_f1: 0.4815
 epoch: 23, train_loss: 1.0429, test_loss: 1.0178, test_f1: 0.4763
 epoch: 24, train_loss: 1.0334, test_loss: 1.0176, test_f1: 0.4746
 epoch: 25, train_loss: 1.0344, test_loss: 1.0130, test_f1: 0.4749
 epoch: 26, train_loss: 1.0133, test_loss: 1.0208, test_f1: 0.4764
 epoch: 27, train_loss: 1.0125, test_loss: 1.0348, test_f1: 0.4686
 epoch: 28, train_loss: 1.0120, test_loss: 1.0032, test_f1: 0.4882
 epoch: 29, train_loss: 1.0029, test_loss: 0.9927, test_f1: 0.4811
 epoch: 30, train_loss: 0.9933, test_loss: 0.9949, test_f1: 0.4881
 epoch: 31, train_loss: 0.9900, test_loss: 0.9842, test_f1: 0.4913
 epoch: 32, train_loss: 0.9903, test_loss: 0.9852, test_f1: 0.4869
 epoch: 33, train_loss: 0.9859, test_loss: 0.9955, test_f1: 0.4971
 epoch: 34, train_loss: 0.9774, test_loss: 0.9805, test_f1: 0.4841
 epoch: 35, train_loss: 0.9752, test_loss: 0.9980, test_f1: 0.4898
 epoch: 36, train_loss: 0.9687, test_loss: 0.9793, test_f1: 0.4693
 epoch: 37, train_loss: 0.9691, test_loss: 0.9868, test_f1: 0.4697
 epoch: 38, train_loss: 0.9592, test_loss: 0.9745, test_f1: 0.4946
 epoch: 39, train_loss: 0.9504, test_loss: 0.9789, test_f1: 0.4909
 epoch: 40, train_loss: 0.9579, test_loss: 0.9813, test_f1: 0.4815
 epoch: 41, train_loss: 0.9523, test_loss: 0.9888, test_f1: 0.4708
 epoch: 42, train_loss: 0.9474, test_loss: 0.9771, test_f1: 0.4936
 epoch: 43, train_loss: 0.9371, test_loss: 0.9650, test_f1: 0.5012
 epoch: 44, train_loss: 0.9393, test_loss: 0.9533, test_f1: 0.4979
 epoch: 45, train_loss: 0.9244, test_loss: 0.9732, test_f1: 0.4884
 epoch: 46, train_loss: 0.9367, test_loss: 0.9839, test_f1: 0.4822
 epoch: 47, train_loss: 0.9299, test_loss: 0.9793, test_f1: 0.4909
 epoch: 48, train_loss: 0.9260, test_loss: 0.9775, test_f1: 0.4929
 epoch: 49, train_loss: 0.9095, test_loss: 0.9778, test_f1: 0.4815
 epoch: 50, train_loss: 0.9196, test_loss: 0.9737, test_f1: 0.4835
 epoch: 51, train_loss: 0.9213, test_loss: 0.9642, test_f1: 0.4984
 epoch: 52, train_loss: 0.9043, test_loss: 0.9693, test_f1: 0.4805
 epoch: 53, train_loss: 0.9142, test_loss: 0.9750, test_f1: 0.4867
 epoch: 54, train_loss: 0.9041, test_loss: 0.9798, test_f1: 0.4891
 epoch: 55, train_loss: 0.8958, test_loss: 0.9685, test_f1: 0.4939
 epoch: 56, train_loss: 0.8958, test_loss: 0.9960, test_f1: 0.4878
 epoch: 57, train_loss: 0.8898, test_loss: 0.9786, test_f1: 0.4987
 epoch: 58, train_loss: 0.9002, test_loss: 0.9845, test_f1: 0.4932
 epoch: 59, train_loss: 0.8886, test_loss: 0.9663, test_f1: 0.5090
 epoch: 60, train_loss: 0.9011, test_loss: 0.9653, test_f1: 0.4944
 epoch: 61, train_loss: 0.8854, test_loss: 0.9854, test_f1: 0.4854
 epoch: 62, train_loss: 0.8829, test_loss: 0.9769, test_f1: 0.5040
 epoch: 63, train_loss: 0.8842, test_loss: 0.9711, test_f1: 0.4982
 epoch: 64, train_loss: 0.9021, test_loss: 0.9624, test_f1: 0.5045
 epoch: 65, train_loss: 0.8835, test_loss: 0.9793, test_f1: 0.4919
 epoch: 66, train_loss: 0.8902, test_loss: 0.9661, test_f1: 0.4964
 epoch: 67, train_loss: 0.8837, test_loss: 0.9768, test_f1: 0.4992
 epoch: 68, train_loss: 0.8749, test_loss: 0.9604, test_f1: 0.5176
 epoch: 69, train_loss: 0.8807, test_loss: 0.9605, test_f1: 0.5049
 epoch: 70, train_loss: 0.8580, test_loss: 0.9786, test_f1: 0.4942
 epoch: 71, train_loss: 0.8752, test_loss: 0.9735, test_f1: 0.4950
 epoch: 72, train_loss: 0.8679, test_loss: 0.9719, test_f1: 0.4961
 epoch: 73, train_loss: 0.8786, test_loss: 0.9687, test_f1: 0.4915
 epoch: 74, train_loss: 0.8637, test_loss: 0.9718, test_f1: 0.4874
 epoch: 75, train_loss: 0.8703, test_loss: 0.9763, test_f1: 0.5191
 epoch: 76, train_loss: 0.8621, test_loss: 0.9751, test_f1: 0.5011
 epoch: 77, train_loss: 0.8686, test_loss: 0.9692, test_f1: 0.5038
 epoch: 78, train_loss: 0.8650, test_loss: 0.9792, test_f1: 0.4997
 epoch: 79, train_loss: 0.8635, test_loss: 0.9758, test_f1: 0.5071
 epoch: 80, train_loss: 0.8615, test_loss: 0.9797, test_f1: 0.4980
 epoch: 81, train_loss: 0.8686, test_loss: 0.9863, test_f1: 0.5030
 epoch: 82, train_loss: 0.8677, test_loss: 0.9659, test_f1: 0.4961
 epoch: 83, train_loss: 0.8570, test_loss: 0.9723, test_f1: 0.5159
 epoch: 84, train_loss: 0.8508, test_loss: 0.9781, test_f1: 0.5081
 epoch: 85, train_loss: 0.8512, test_loss: 0.9788, test_f1: 0.5168
 epoch: 86, train_loss: 0.8442, test_loss: 0.9901, test_f1: 0.4989
 epoch: 87, train_loss: 0.8630, test_loss: 0.9617, test_f1: 0.5051
 epoch: 88, train_loss: 0.8484, test_loss: 0.9563, test_f1: 0.5106
 epoch: 89, train_loss: 0.8442, test_loss: 0.9951, test_f1: 0.5036
 epoch: 90, train_loss: 0.8550, test_loss: 0.9729, test_f1: 0.5030
 epoch: 91, train_loss: 0.8536, test_loss: 0.9748, test_f1: 0.5260
 epoch: 92, train_loss: 0.8421, test_loss: 0.9891, test_f1: 0.5090
 epoch: 93, train_loss: 0.8359, test_loss: 0.9647, test_f1: 0.5191
 epoch: 94, train_loss: 0.8485, test_loss: 0.9800, test_f1: 0.5091
 epoch: 95, train_loss: 0.8460, test_loss: 0.9904, test_f1: 0.4930
 epoch: 96, train_loss: 0.8572, test_loss: 0.9767, test_f1: 0.5094
 epoch: 97, train_loss: 0.8526, test_loss: 0.9659, test_f1: 0.5055
 epoch: 98, train_loss: 0.8371, test_loss: 0.9757, test_f1: 0.5086
 epoch: 99, train_loss: 0.8315, test_loss: 0.9863, test_f1: 0.4964
##################ITERATION #1 ****************************************
 epoch: 0, train_loss: 1.3513, test_loss: 1.3035, test_f1: 0.2573
 epoch: 1, train_loss: 1.2846, test_loss: 1.2533, test_f1: 0.2695
 epoch: 2, train_loss: 1.2543, test_loss: 1.2225, test_f1: 0.2844
 epoch: 3, train_loss: 1.2325, test_loss: 1.1974, test_f1: 0.3452
 epoch: 4, train_loss: 1.2151, test_loss: 1.1798, test_f1: 0.3845
 epoch: 5, train_loss: 1.1981, test_loss: 1.1617, test_f1: 0.4006
 epoch: 6, train_loss: 1.1934, test_loss: 1.1477, test_f1: 0.4199
 epoch: 7, train_loss: 1.1711, test_loss: 1.1307, test_f1: 0.4180
 epoch: 8, train_loss: 1.1656, test_loss: 1.1197, test_f1: 0.4241
 epoch: 9, train_loss: 1.1535, test_loss: 1.1084, test_f1: 0.4325
 epoch: 10, train_loss: 1.1421, test_loss: 1.0981, test_f1: 0.4450
 epoch: 11, train_loss: 1.1276, test_loss: 1.0960, test_f1: 0.4402
 epoch: 12, train_loss: 1.1229, test_loss: 1.0819, test_f1: 0.4544
 epoch: 13, train_loss: 1.1134, test_loss: 1.0751, test_f1: 0.4566
 epoch: 14, train_loss: 1.1030, test_loss: 1.0711, test_f1: 0.4589
 epoch: 15, train_loss: 1.0987, test_loss: 1.0702, test_f1: 0.4548
 epoch: 16, train_loss: 1.0947, test_loss: 1.0649, test_f1: 0.4586
 epoch: 17, train_loss: 1.0852, test_loss: 1.0631, test_f1: 0.4571
 epoch: 18, train_loss: 1.0811, test_loss: 1.0524, test_f1: 0.4666
 epoch: 19, train_loss: 1.0730, test_loss: 1.0492, test_f1: 0.4767
 epoch: 20, train_loss: 1.0619, test_loss: 1.0400, test_f1: 0.4724
 epoch: 21, train_loss: 1.0606, test_loss: 1.0406, test_f1: 0.4771
 epoch: 22, train_loss: 1.0518, test_loss: 1.0311, test_f1: 0.4712
 epoch: 23, train_loss: 1.0463, test_loss: 1.0399, test_f1: 0.4727
 epoch: 24, train_loss: 1.0379, test_loss: 1.0280, test_f1: 0.4726
 epoch: 25, train_loss: 1.0396, test_loss: 1.0175, test_f1: 0.4869
 epoch: 26, train_loss: 1.0362, test_loss: 1.0188, test_f1: 0.4834
 epoch: 27, train_loss: 1.0152, test_loss: 1.0312, test_f1: 0.4757
 epoch: 28, train_loss: 1.0165, test_loss: 1.0265, test_f1: 0.4867
 epoch: 29, train_loss: 1.0180, test_loss: 1.0308, test_f1: 0.4753
 epoch: 30, train_loss: 1.0067, test_loss: 1.0185, test_f1: 0.4976
 epoch: 31, train_loss: 1.0108, test_loss: 1.0129, test_f1: 0.4850
 epoch: 32, train_loss: 1.0004, test_loss: 1.0154, test_f1: 0.4836
 epoch: 33, train_loss: 0.9900, test_loss: 1.0202, test_f1: 0.4755
 epoch: 34, train_loss: 0.9860, test_loss: 1.0348, test_f1: 0.4715
 epoch: 35, train_loss: 0.9851, test_loss: 1.0192, test_f1: 0.4833
 epoch: 36, train_loss: 0.9686, test_loss: 1.0385, test_f1: 0.4552
 epoch: 37, train_loss: 0.9571, test_loss: 1.0066, test_f1: 0.4776
 epoch: 38, train_loss: 0.9580, test_loss: 1.0268, test_f1: 0.4694
 epoch: 39, train_loss: 0.9527, test_loss: 1.0390, test_f1: 0.4603
 epoch: 40, train_loss: 0.9461, test_loss: 1.0035, test_f1: 0.4797
 epoch: 41, train_loss: 0.9418, test_loss: 1.0318, test_f1: 0.4619
 epoch: 42, train_loss: 0.9309, test_loss: 1.0147, test_f1: 0.4706
 epoch: 43, train_loss: 0.9338, test_loss: 1.0260, test_f1: 0.4724
 epoch: 44, train_loss: 0.9333, test_loss: 1.0324, test_f1: 0.4625
 epoch: 45, train_loss: 0.9256, test_loss: 1.0376, test_f1: 0.4828
 epoch: 46, train_loss: 0.9198, test_loss: 1.0360, test_f1: 0.4686
 epoch: 47, train_loss: 0.9258, test_loss: 1.0392, test_f1: 0.4774
 epoch: 48, train_loss: 0.9202, test_loss: 1.0417, test_f1: 0.4749
 epoch: 49, train_loss: 0.9025, test_loss: 1.0311, test_f1: 0.4639
 epoch: 50, train_loss: 0.8982, test_loss: 1.0527, test_f1: 0.4719
 epoch: 51, train_loss: 0.8898, test_loss: 1.0484, test_f1: 0.4687
 epoch: 52, train_loss: 0.8867, test_loss: 1.0348, test_f1: 0.4758
 epoch: 53, train_loss: 0.8790, test_loss: 1.0281, test_f1: 0.4705
 epoch: 54, train_loss: 0.8733, test_loss: 1.0460, test_f1: 0.4809
 epoch: 55, train_loss: 0.8843, test_loss: 1.0307, test_f1: 0.4801
 epoch: 56, train_loss: 0.8807, test_loss: 1.0387, test_f1: 0.4766
 epoch: 57, train_loss: 0.8761, test_loss: 1.0358, test_f1: 0.4828
 epoch: 58, train_loss: 0.8731, test_loss: 1.0445, test_f1: 0.4745
 epoch: 59, train_loss: 0.8750, test_loss: 1.0430, test_f1: 0.4825
 epoch: 60, train_loss: 0.8785, test_loss: 1.0146, test_f1: 0.4791
 epoch: 61, train_loss: 0.8623, test_loss: 1.0522, test_f1: 0.4741
 epoch: 62, train_loss: 0.8705, test_loss: 1.0465, test_f1: 0.4713
 epoch: 63, train_loss: 0.8613, test_loss: 1.0557, test_f1: 0.4639
 epoch: 64, train_loss: 0.8636, test_loss: 1.0557, test_f1: 0.4605
 epoch: 65, train_loss: 0.8621, test_loss: 1.0581, test_f1: 0.4768
 epoch: 66, train_loss: 0.8595, test_loss: 1.0534, test_f1: 0.4642
 epoch: 67, train_loss: 0.8578, test_loss: 1.0535, test_f1: 0.4730
 epoch: 68, train_loss: 0.8582, test_loss: 1.0684, test_f1: 0.4799
 epoch: 69, train_loss: 0.8596, test_loss: 1.0650, test_f1: 0.4772
 epoch: 70, train_loss: 0.8473, test_loss: 1.0717, test_f1: 0.4510
 epoch: 71, train_loss: 0.8628, test_loss: 1.0628, test_f1: 0.4770
 epoch: 72, train_loss: 0.8374, test_loss: 1.0748, test_f1: 0.4742
 epoch: 73, train_loss: 0.8458, test_loss: 1.0856, test_f1: 0.4562
 epoch: 74, train_loss: 0.8399, test_loss: 1.0885, test_f1: 0.4571
 epoch: 75, train_loss: 0.8415, test_loss: 1.1007, test_f1: 0.4769
 epoch: 76, train_loss: 0.8203, test_loss: 1.0956, test_f1: 0.4674
 epoch: 77, train_loss: 0.8325, test_loss: 1.0834, test_f1: 0.4639
 epoch: 78, train_loss: 0.8271, test_loss: 1.1044, test_f1: 0.4454
 epoch: 79, train_loss: 0.8269, test_loss: 1.0706, test_f1: 0.4835
 epoch: 80, train_loss: 0.8343, test_loss: 1.0983, test_f1: 0.4808
 epoch: 81, train_loss: 0.8235, test_loss: 1.0847, test_f1: 0.4867
 epoch: 82, train_loss: 0.8288, test_loss: 1.1108, test_f1: 0.4494
 epoch: 83, train_loss: 0.8230, test_loss: 1.0994, test_f1: 0.4779
 epoch: 84, train_loss: 0.8255, test_loss: 1.1102, test_f1: 0.4699
 epoch: 85, train_loss: 0.8139, test_loss: 1.1101, test_f1: 0.4739
 epoch: 86, train_loss: 0.8112, test_loss: 1.1103, test_f1: 0.4643
 epoch: 87, train_loss: 0.8137, test_loss: 1.1320, test_f1: 0.4506
 epoch: 88, train_loss: 0.8207, test_loss: 1.1506, test_f1: 0.4570
 epoch: 89, train_loss: 0.8145, test_loss: 1.1341, test_f1: 0.4593
 epoch: 90, train_loss: 0.8168, test_loss: 1.1515, test_f1: 0.4372
 epoch: 91, train_loss: 0.8077, test_loss: 1.1338, test_f1: 0.4557
 epoch: 92, train_loss: 0.8014, test_loss: 1.1068, test_f1: 0.4746
 epoch: 93, train_loss: 0.8071, test_loss: 1.1244, test_f1: 0.4580
 epoch: 94, train_loss: 0.8136, test_loss: 1.1485, test_f1: 0.4426
 epoch: 95, train_loss: 0.8081, test_loss: 1.1319, test_f1: 0.4725
 epoch: 96, train_loss: 0.7999, test_loss: 1.1253, test_f1: 0.4808
 epoch: 97, train_loss: 0.8114, test_loss: 1.1425, test_f1: 0.4557
 epoch: 98, train_loss: 0.7970, test_loss: 1.1290, test_f1: 0.4885
 epoch: 99, train_loss: 0.8075, test_loss: 1.1574, test_f1: 0.4653
##################ITERATION #2 ****************************************
 epoch: 0, train_loss: 1.3150, test_loss: 1.2970, test_f1: 0.2943
 epoch: 1, train_loss: 1.2577, test_loss: 1.2358, test_f1: 0.3156
 epoch: 2, train_loss: 1.2353, test_loss: 1.2153, test_f1: 0.3553
 epoch: 3, train_loss: 1.2203, test_loss: 1.1980, test_f1: 0.3701
 epoch: 4, train_loss: 1.2109, test_loss: 1.1814, test_f1: 0.3875
 epoch: 5, train_loss: 1.2008, test_loss: 1.1639, test_f1: 0.3990
 epoch: 6, train_loss: 1.1873, test_loss: 1.1529, test_f1: 0.4325
 epoch: 7, train_loss: 1.1765, test_loss: 1.1366, test_f1: 0.4334
 epoch: 8, train_loss: 1.1617, test_loss: 1.1286, test_f1: 0.4229
 epoch: 9, train_loss: 1.1519, test_loss: 1.1131, test_f1: 0.4151
 epoch: 10, train_loss: 1.1405, test_loss: 1.1061, test_f1: 0.4239
 epoch: 11, train_loss: 1.1242, test_loss: 1.0888, test_f1: 0.4300
 epoch: 12, train_loss: 1.1217, test_loss: 1.0785, test_f1: 0.4523
 epoch: 13, train_loss: 1.1084, test_loss: 1.0702, test_f1: 0.4481
 epoch: 14, train_loss: 1.1025, test_loss: 1.0592, test_f1: 0.4330
 epoch: 15, train_loss: 1.0908, test_loss: 1.0572, test_f1: 0.4671
 epoch: 16, train_loss: 1.0828, test_loss: 1.0424, test_f1: 0.4571
 epoch: 17, train_loss: 1.0698, test_loss: 1.0412, test_f1: 0.4674
 epoch: 18, train_loss: 1.0602, test_loss: 1.0261, test_f1: 0.4653
 epoch: 19, train_loss: 1.0521, test_loss: 1.0225, test_f1: 0.4677
 epoch: 20, train_loss: 1.0477, test_loss: 1.0231, test_f1: 0.4593
 epoch: 21, train_loss: 1.0406, test_loss: 1.0134, test_f1: 0.4741
 epoch: 22, train_loss: 1.0303, test_loss: 1.0055, test_f1: 0.4581
 epoch: 23, train_loss: 1.0128, test_loss: 1.0033, test_f1: 0.4673
 epoch: 24, train_loss: 1.0106, test_loss: 0.9920, test_f1: 0.4571
 epoch: 25, train_loss: 1.0045, test_loss: 0.9881, test_f1: 0.4573
 epoch: 26, train_loss: 1.0008, test_loss: 0.9674, test_f1: 0.4658
 epoch: 27, train_loss: 0.9844, test_loss: 0.9673, test_f1: 0.4587
 epoch: 28, train_loss: 0.9865, test_loss: 0.9644, test_f1: 0.4652
 epoch: 29, train_loss: 0.9729, test_loss: 0.9651, test_f1: 0.4681
 epoch: 30, train_loss: 0.9738, test_loss: 0.9818, test_f1: 0.4759
 epoch: 31, train_loss: 0.9611, test_loss: 0.9790, test_f1: 0.4705
 epoch: 32, train_loss: 0.9536, test_loss: 0.9664, test_f1: 0.4666
 epoch: 33, train_loss: 0.9557, test_loss: 0.9787, test_f1: 0.4535
 epoch: 34, train_loss: 0.9474, test_loss: 0.9678, test_f1: 0.4542
 epoch: 35, train_loss: 0.9354, test_loss: 0.9621, test_f1: 0.4792
 epoch: 36, train_loss: 0.9310, test_loss: 0.9618, test_f1: 0.4735
 epoch: 37, train_loss: 0.9286, test_loss: 0.9772, test_f1: 0.4604
 epoch: 38, train_loss: 0.9301, test_loss: 0.9500, test_f1: 0.4734
 epoch: 39, train_loss: 0.9277, test_loss: 0.9516, test_f1: 0.4997
 epoch: 40, train_loss: 0.9140, test_loss: 0.9514, test_f1: 0.4772
 epoch: 41, train_loss: 0.9085, test_loss: 0.9389, test_f1: 0.4996
 epoch: 42, train_loss: 0.9055, test_loss: 0.9493, test_f1: 0.4916
 epoch: 43, train_loss: 0.8994, test_loss: 0.9578, test_f1: 0.4978
 epoch: 44, train_loss: 0.8955, test_loss: 0.9462, test_f1: 0.4958
 epoch: 45, train_loss: 0.8912, test_loss: 0.9473, test_f1: 0.5024
 epoch: 46, train_loss: 0.8857, test_loss: 0.9603, test_f1: 0.4927
 epoch: 47, train_loss: 0.8813, test_loss: 0.9438, test_f1: 0.5079
 epoch: 48, train_loss: 0.8847, test_loss: 0.9653, test_f1: 0.5008
 epoch: 49, train_loss: 0.8793, test_loss: 0.9492, test_f1: 0.5107
 epoch: 50, train_loss: 0.8715, test_loss: 0.9404, test_f1: 0.5090
 epoch: 51, train_loss: 0.8622, test_loss: 0.9516, test_f1: 0.5048
 epoch: 52, train_loss: 0.8605, test_loss: 0.9476, test_f1: 0.5079
 epoch: 53, train_loss: 0.8536, test_loss: 0.9575, test_f1: 0.5001
 epoch: 54, train_loss: 0.8531, test_loss: 0.9520, test_f1: 0.5103
 epoch: 55, train_loss: 0.8435, test_loss: 0.9608, test_f1: 0.5018
 epoch: 56, train_loss: 0.8504, test_loss: 0.9499, test_f1: 0.5094
 epoch: 57, train_loss: 0.8427, test_loss: 0.9674, test_f1: 0.5156
 epoch: 58, train_loss: 0.8546, test_loss: 0.9595, test_f1: 0.5179
 epoch: 59, train_loss: 0.8410, test_loss: 0.9540, test_f1: 0.5162
 epoch: 60, train_loss: 0.8464, test_loss: 0.9734, test_f1: 0.5124
 epoch: 61, train_loss: 0.8368, test_loss: 0.9583, test_f1: 0.5078
 epoch: 62, train_loss: 0.8399, test_loss: 0.9683, test_f1: 0.5099
 epoch: 63, train_loss: 0.8382, test_loss: 0.9569, test_f1: 0.5138
 epoch: 64, train_loss: 0.8383, test_loss: 0.9607, test_f1: 0.4979
 epoch: 65, train_loss: 0.8288, test_loss: 0.9802, test_f1: 0.5151
 epoch: 66, train_loss: 0.8165, test_loss: 0.9660, test_f1: 0.5091
 epoch: 67, train_loss: 0.8206, test_loss: 0.9779, test_f1: 0.5185
 epoch: 68, train_loss: 0.8318, test_loss: 0.9677, test_f1: 0.5089
 epoch: 69, train_loss: 0.8247, test_loss: 0.9692, test_f1: 0.5116
 epoch: 70, train_loss: 0.8183, test_loss: 0.9805, test_f1: 0.5100
 epoch: 71, train_loss: 0.8256, test_loss: 0.9730, test_f1: 0.5012
 epoch: 72, train_loss: 0.8073, test_loss: 0.9737, test_f1: 0.5177
 epoch: 73, train_loss: 0.8086, test_loss: 0.9930, test_f1: 0.4900
 epoch: 74, train_loss: 0.8204, test_loss: 0.9778, test_f1: 0.4907
 epoch: 75, train_loss: 0.8107, test_loss: 0.9664, test_f1: 0.4884
 epoch: 76, train_loss: 0.8122, test_loss: 0.9946, test_f1: 0.4952
 epoch: 77, train_loss: 0.8108, test_loss: 0.9675, test_f1: 0.4947
 epoch: 78, train_loss: 0.8058, test_loss: 0.9822, test_f1: 0.5134
 epoch: 79, train_loss: 0.7948, test_loss: 0.9831, test_f1: 0.5006
 epoch: 80, train_loss: 0.8073, test_loss: 1.0003, test_f1: 0.4937
 epoch: 81, train_loss: 0.7968, test_loss: 0.9819, test_f1: 0.5104
 epoch: 82, train_loss: 0.7994, test_loss: 0.9943, test_f1: 0.4947
 epoch: 83, train_loss: 0.8083, test_loss: 0.9728, test_f1: 0.4889
 epoch: 84, train_loss: 0.8070, test_loss: 0.9913, test_f1: 0.5082
 epoch: 85, train_loss: 0.8065, test_loss: 0.9752, test_f1: 0.5154
 epoch: 86, train_loss: 0.8033, test_loss: 0.9715, test_f1: 0.4890
 epoch: 87, train_loss: 0.7936, test_loss: 0.9912, test_f1: 0.5137
 epoch: 88, train_loss: 0.7937, test_loss: 0.9761, test_f1: 0.5115
 epoch: 89, train_loss: 0.7989, test_loss: 0.9912, test_f1: 0.5021
 epoch: 90, train_loss: 0.7965, test_loss: 0.9768, test_f1: 0.4955
 epoch: 91, train_loss: 0.8082, test_loss: 0.9822, test_f1: 0.5149
 epoch: 92, train_loss: 0.7855, test_loss: 1.0048, test_f1: 0.5001
 epoch: 93, train_loss: 0.7872, test_loss: 0.9866, test_f1: 0.4911
 epoch: 94, train_loss: 0.7943, test_loss: 0.9818, test_f1: 0.4949
 epoch: 95, train_loss: 0.7868, test_loss: 0.9959, test_f1: 0.4918
 epoch: 96, train_loss: 0.7957, test_loss: 1.0040, test_f1: 0.4823
 epoch: 97, train_loss: 0.7853, test_loss: 0.9876, test_f1: 0.4870
 epoch: 98, train_loss: 0.7741, test_loss: 0.9995, test_f1: 0.4919
 epoch: 99, train_loss: 0.7786, test_loss: 1.0008, test_f1: 0.5197
##################ITERATION #3 ****************************************
 epoch: 0, train_loss: 1.3074, test_loss: 1.2580, test_f1: 0.2826
 epoch: 1, train_loss: 1.2529, test_loss: 1.2209, test_f1: 0.3243
 epoch: 2, train_loss: 1.2328, test_loss: 1.2011, test_f1: 0.3482
 epoch: 3, train_loss: 1.2138, test_loss: 1.1843, test_f1: 0.3912
 epoch: 4, train_loss: 1.2049, test_loss: 1.1704, test_f1: 0.4050
 epoch: 5, train_loss: 1.1918, test_loss: 1.1578, test_f1: 0.4018
 epoch: 6, train_loss: 1.1756, test_loss: 1.1451, test_f1: 0.4188
 epoch: 7, train_loss: 1.1683, test_loss: 1.1407, test_f1: 0.4170
 epoch: 8, train_loss: 1.1588, test_loss: 1.1275, test_f1: 0.4132
 epoch: 9, train_loss: 1.1482, test_loss: 1.1232, test_f1: 0.4483
 epoch: 10, train_loss: 1.1430, test_loss: 1.1169, test_f1: 0.4319
 epoch: 11, train_loss: 1.1328, test_loss: 1.1111, test_f1: 0.4304
 epoch: 12, train_loss: 1.1243, test_loss: 1.0983, test_f1: 0.4291
 epoch: 13, train_loss: 1.1132, test_loss: 1.0934, test_f1: 0.4326
 epoch: 14, train_loss: 1.1044, test_loss: 1.0938, test_f1: 0.4320
 epoch: 15, train_loss: 1.0982, test_loss: 1.0783, test_f1: 0.4370
 epoch: 16, train_loss: 1.0925, test_loss: 1.0818, test_f1: 0.4440
 epoch: 17, train_loss: 1.0933, test_loss: 1.0706, test_f1: 0.4431
 epoch: 18, train_loss: 1.0662, test_loss: 1.0721, test_f1: 0.4540
 epoch: 19, train_loss: 1.0668, test_loss: 1.0604, test_f1: 0.4672
 epoch: 20, train_loss: 1.0629, test_loss: 1.0545, test_f1: 0.4542
 epoch: 21, train_loss: 1.0609, test_loss: 1.0604, test_f1: 0.4617
 epoch: 22, train_loss: 1.0446, test_loss: 1.0520, test_f1: 0.4593
 epoch: 23, train_loss: 1.0434, test_loss: 1.0453, test_f1: 0.4774
 epoch: 24, train_loss: 1.0420, test_loss: 1.0446, test_f1: 0.4770
 epoch: 25, train_loss: 1.0317, test_loss: 1.0558, test_f1: 0.4719
 epoch: 26, train_loss: 1.0258, test_loss: 1.0458, test_f1: 0.4837
 epoch: 27, train_loss: 1.0271, test_loss: 1.0499, test_f1: 0.4703
 epoch: 28, train_loss: 1.0215, test_loss: 1.0367, test_f1: 0.4906
 epoch: 29, train_loss: 1.0183, test_loss: 1.0460, test_f1: 0.4613
 epoch: 30, train_loss: 1.0004, test_loss: 1.0293, test_f1: 0.4762
 epoch: 31, train_loss: 1.0034, test_loss: 1.0519, test_f1: 0.4647
 epoch: 32, train_loss: 0.9946, test_loss: 1.0350, test_f1: 0.4913
 epoch: 33, train_loss: 0.9955, test_loss: 1.0422, test_f1: 0.4733
 epoch: 34, train_loss: 0.9764, test_loss: 1.0256, test_f1: 0.4992
 epoch: 35, train_loss: 0.9757, test_loss: 1.0351, test_f1: 0.4916
 epoch: 36, train_loss: 0.9710, test_loss: 1.0432, test_f1: 0.4839
 epoch: 37, train_loss: 0.9725, test_loss: 1.0508, test_f1: 0.4783
 epoch: 38, train_loss: 0.9627, test_loss: 1.0360, test_f1: 0.4919
 epoch: 39, train_loss: 0.9601, test_loss: 1.0317, test_f1: 0.5065
 epoch: 40, train_loss: 0.9495, test_loss: 1.0358, test_f1: 0.4986
 epoch: 41, train_loss: 0.9502, test_loss: 1.0313, test_f1: 0.4943
 epoch: 42, train_loss: 0.9504, test_loss: 1.0246, test_f1: 0.4862
 epoch: 43, train_loss: 0.9442, test_loss: 1.0514, test_f1: 0.4886
 epoch: 44, train_loss: 0.9476, test_loss: 1.0286, test_f1: 0.4868
 epoch: 45, train_loss: 0.9326, test_loss: 1.0354, test_f1: 0.5032
 epoch: 46, train_loss: 0.9249, test_loss: 1.0342, test_f1: 0.5029
 epoch: 47, train_loss: 0.9210, test_loss: 1.0327, test_f1: 0.5099
 epoch: 48, train_loss: 0.9300, test_loss: 1.0392, test_f1: 0.5086
 epoch: 49, train_loss: 0.9259, test_loss: 1.0237, test_f1: 0.5237
 epoch: 50, train_loss: 0.9185, test_loss: 1.0152, test_f1: 0.4985
 epoch: 51, train_loss: 0.9039, test_loss: 1.0261, test_f1: 0.5038
 epoch: 52, train_loss: 0.8945, test_loss: 1.0267, test_f1: 0.4932
 epoch: 53, train_loss: 0.8967, test_loss: 1.0248, test_f1: 0.5098
 epoch: 54, train_loss: 0.8991, test_loss: 1.0308, test_f1: 0.4960
 epoch: 55, train_loss: 0.8882, test_loss: 1.0344, test_f1: 0.4879
 epoch: 56, train_loss: 0.8895, test_loss: 1.0289, test_f1: 0.4993
 epoch: 57, train_loss: 0.8839, test_loss: 1.0376, test_f1: 0.5023
 epoch: 58, train_loss: 0.8836, test_loss: 1.0314, test_f1: 0.4955
 epoch: 59, train_loss: 0.8787, test_loss: 1.0269, test_f1: 0.4954
 epoch: 60, train_loss: 0.8814, test_loss: 1.0327, test_f1: 0.4971
 epoch: 61, train_loss: 0.8900, test_loss: 1.0252, test_f1: 0.4916
 epoch: 62, train_loss: 0.8708, test_loss: 1.0266, test_f1: 0.5051
 epoch: 63, train_loss: 0.8701, test_loss: 1.0282, test_f1: 0.5077
 epoch: 64, train_loss: 0.8763, test_loss: 1.0473, test_f1: 0.5101
 epoch: 65, train_loss: 0.8861, test_loss: 1.0258, test_f1: 0.5142
 epoch: 66, train_loss: 0.8740, test_loss: 1.0363, test_f1: 0.5109
 epoch: 67, train_loss: 0.8720, test_loss: 1.0485, test_f1: 0.4906
 epoch: 68, train_loss: 0.8716, test_loss: 1.0353, test_f1: 0.5153
 epoch: 69, train_loss: 0.8720, test_loss: 1.0196, test_f1: 0.5203
 epoch: 70, train_loss: 0.8563, test_loss: 1.0380, test_f1: 0.4965
 epoch: 71, train_loss: 0.8699, test_loss: 1.0423, test_f1: 0.5141
 epoch: 72, train_loss: 0.8618, test_loss: 1.0529, test_f1: 0.5036
 epoch: 73, train_loss: 0.8702, test_loss: 1.0248, test_f1: 0.5085
 epoch: 74, train_loss: 0.8542, test_loss: 1.0545, test_f1: 0.4953
 epoch: 75, train_loss: 0.8443, test_loss: 1.0342, test_f1: 0.5163
 epoch: 76, train_loss: 0.8623, test_loss: 1.0418, test_f1: 0.5108
 epoch: 77, train_loss: 0.8538, test_loss: 1.0234, test_f1: 0.5108
 epoch: 78, train_loss: 0.8494, test_loss: 1.0286, test_f1: 0.5112
 epoch: 79, train_loss: 0.8507, test_loss: 1.0485, test_f1: 0.5100
 epoch: 80, train_loss: 0.8424, test_loss: 1.0480, test_f1: 0.5101
 epoch: 81, train_loss: 0.8422, test_loss: 1.0302, test_f1: 0.5166
 epoch: 82, train_loss: 0.8473, test_loss: 1.0588, test_f1: 0.5199
 epoch: 83, train_loss: 0.8390, test_loss: 1.0655, test_f1: 0.5133
 epoch: 84, train_loss: 0.8439, test_loss: 1.0456, test_f1: 0.5266
 epoch: 85, train_loss: 0.8381, test_loss: 1.0362, test_f1: 0.5275
 epoch: 86, train_loss: 0.8371, test_loss: 1.0581, test_f1: 0.5010
 epoch: 87, train_loss: 0.8314, test_loss: 1.0456, test_f1: 0.5125
 epoch: 88, train_loss: 0.8276, test_loss: 1.0409, test_f1: 0.5180
 epoch: 89, train_loss: 0.8402, test_loss: 1.0534, test_f1: 0.5053
 epoch: 90, train_loss: 0.8319, test_loss: 1.0406, test_f1: 0.5236
 epoch: 91, train_loss: 0.8243, test_loss: 1.0556, test_f1: 0.5149
 epoch: 92, train_loss: 0.8298, test_loss: 1.0498, test_f1: 0.5147
 epoch: 93, train_loss: 0.8266, test_loss: 1.0639, test_f1: 0.5061
 epoch: 94, train_loss: 0.8194, test_loss: 1.0615, test_f1: 0.5154
 epoch: 95, train_loss: 0.8178, test_loss: 1.0731, test_f1: 0.5044
 epoch: 96, train_loss: 0.8250, test_loss: 1.0539, test_f1: 0.5048
 epoch: 97, train_loss: 0.8196, test_loss: 1.0535, test_f1: 0.5006
 epoch: 98, train_loss: 0.8120, test_loss: 1.0634, test_f1: 0.5093
 epoch: 99, train_loss: 0.8142, test_loss: 1.0642, test_f1: 0.5012
##################ITERATION #4 ****************************************
 epoch: 0, train_loss: 1.3064, test_loss: 1.2637, test_f1: 0.3041
 epoch: 1, train_loss: 1.2466, test_loss: 1.2168, test_f1: 0.3511
 epoch: 2, train_loss: 1.2308, test_loss: 1.1961, test_f1: 0.3580
 epoch: 3, train_loss: 1.2116, test_loss: 1.1878, test_f1: 0.4102
 epoch: 4, train_loss: 1.2065, test_loss: 1.1740, test_f1: 0.4138
 epoch: 5, train_loss: 1.1936, test_loss: 1.1627, test_f1: 0.3993
 epoch: 6, train_loss: 1.1902, test_loss: 1.1575, test_f1: 0.4024
 epoch: 7, train_loss: 1.1747, test_loss: 1.1467, test_f1: 0.4201
 epoch: 8, train_loss: 1.1664, test_loss: 1.1406, test_f1: 0.4068
 epoch: 9, train_loss: 1.1481, test_loss: 1.1289, test_f1: 0.4038
 epoch: 10, train_loss: 1.1586, test_loss: 1.1224, test_f1: 0.4068
 epoch: 11, train_loss: 1.1395, test_loss: 1.1210, test_f1: 0.4061
 epoch: 12, train_loss: 1.1379, test_loss: 1.1085, test_f1: 0.4245
 epoch: 13, train_loss: 1.1277, test_loss: 1.1042, test_f1: 0.4168
 epoch: 14, train_loss: 1.1156, test_loss: 1.0969, test_f1: 0.4287
 epoch: 15, train_loss: 1.1069, test_loss: 1.0892, test_f1: 0.4207
 epoch: 16, train_loss: 1.1182, test_loss: 1.0778, test_f1: 0.4242
 epoch: 17, train_loss: 1.1082, test_loss: 1.0795, test_f1: 0.4142
 epoch: 18, train_loss: 1.1037, test_loss: 1.0618, test_f1: 0.4427
 epoch: 19, train_loss: 1.0922, test_loss: 1.0628, test_f1: 0.4493
 epoch: 20, train_loss: 1.0903, test_loss: 1.0637, test_f1: 0.4500
 epoch: 21, train_loss: 1.0789, test_loss: 1.0556, test_f1: 0.4309
 epoch: 22, train_loss: 1.0755, test_loss: 1.0566, test_f1: 0.4341
 epoch: 23, train_loss: 1.0649, test_loss: 1.0470, test_f1: 0.4446
 epoch: 24, train_loss: 1.0634, test_loss: 1.0331, test_f1: 0.4534
 epoch: 25, train_loss: 1.0572, test_loss: 1.0273, test_f1: 0.4573
 epoch: 26, train_loss: 1.0444, test_loss: 1.0207, test_f1: 0.4696
 epoch: 27, train_loss: 1.0334, test_loss: 1.0140, test_f1: 0.4849
 epoch: 28, train_loss: 1.0323, test_loss: 1.0170, test_f1: 0.4664
 epoch: 29, train_loss: 1.0299, test_loss: 1.0090, test_f1: 0.4692
 epoch: 30, train_loss: 1.0258, test_loss: 1.0042, test_f1: 0.4677
 epoch: 31, train_loss: 1.0116, test_loss: 0.9871, test_f1: 0.4553
 epoch: 32, train_loss: 1.0116, test_loss: 0.9828, test_f1: 0.4797
 epoch: 33, train_loss: 1.0116, test_loss: 0.9880, test_f1: 0.4751
 epoch: 34, train_loss: 1.0053, test_loss: 0.9932, test_f1: 0.4803
 epoch: 35, train_loss: 0.9980, test_loss: 0.9776, test_f1: 0.4912
 epoch: 36, train_loss: 0.9911, test_loss: 0.9789, test_f1: 0.4652
 epoch: 37, train_loss: 0.9871, test_loss: 0.9780, test_f1: 0.4663
 epoch: 38, train_loss: 0.9863, test_loss: 0.9678, test_f1: 0.4657
 epoch: 39, train_loss: 0.9646, test_loss: 0.9696, test_f1: 0.4755
 epoch: 40, train_loss: 0.9700, test_loss: 0.9884, test_f1: 0.4753
 epoch: 41, train_loss: 0.9640, test_loss: 0.9918, test_f1: 0.4614
 epoch: 42, train_loss: 0.9555, test_loss: 0.9804, test_f1: 0.4770
 epoch: 43, train_loss: 0.9590, test_loss: 0.9704, test_f1: 0.4667
 epoch: 44, train_loss: 0.9466, test_loss: 0.9726, test_f1: 0.4734
 epoch: 45, train_loss: 0.9507, test_loss: 0.9742, test_f1: 0.4682
 epoch: 46, train_loss: 0.9420, test_loss: 0.9663, test_f1: 0.4760
 epoch: 47, train_loss: 0.9396, test_loss: 0.9689, test_f1: 0.4680
 epoch: 48, train_loss: 0.9434, test_loss: 0.9581, test_f1: 0.4742
 epoch: 49, train_loss: 0.9272, test_loss: 0.9614, test_f1: 0.4620
 epoch: 50, train_loss: 0.9242, test_loss: 0.9645, test_f1: 0.4869
 epoch: 51, train_loss: 0.9218, test_loss: 0.9790, test_f1: 0.4646
 epoch: 52, train_loss: 0.9023, test_loss: 0.9586, test_f1: 0.4835
 epoch: 53, train_loss: 0.9029, test_loss: 0.9691, test_f1: 0.4865
 epoch: 54, train_loss: 0.9009, test_loss: 0.9785, test_f1: 0.4836
 epoch: 55, train_loss: 0.9008, test_loss: 0.9884, test_f1: 0.4995
 epoch: 56, train_loss: 0.8976, test_loss: 0.9733, test_f1: 0.4721
 epoch: 57, train_loss: 0.9062, test_loss: 0.9758, test_f1: 0.4909
 epoch: 58, train_loss: 0.8915, test_loss: 0.9931, test_f1: 0.4765
 epoch: 59, train_loss: 0.9003, test_loss: 1.0415, test_f1: 0.4972
 epoch: 60, train_loss: 0.8880, test_loss: 0.9761, test_f1: 0.4883
 epoch: 61, train_loss: 0.8923, test_loss: 0.9756, test_f1: 0.4846
 epoch: 62, train_loss: 0.8912, test_loss: 0.9666, test_f1: 0.4873
 epoch: 63, train_loss: 0.8868, test_loss: 0.9698, test_f1: 0.4895
 epoch: 64, train_loss: 0.8998, test_loss: 0.9627, test_f1: 0.5049
 epoch: 65, train_loss: 0.8777, test_loss: 0.9762, test_f1: 0.4974
 epoch: 66, train_loss: 0.8671, test_loss: 0.9767, test_f1: 0.4828
 epoch: 67, train_loss: 0.8792, test_loss: 0.9796, test_f1: 0.4834
 epoch: 68, train_loss: 0.8773, test_loss: 0.9910, test_f1: 0.4800
 epoch: 69, train_loss: 0.8763, test_loss: 0.9857, test_f1: 0.4932
 epoch: 70, train_loss: 0.8704, test_loss: 0.9904, test_f1: 0.4912
 epoch: 71, train_loss: 0.8650, test_loss: 0.9767, test_f1: 0.4885
 epoch: 72, train_loss: 0.8639, test_loss: 0.9812, test_f1: 0.4917
 epoch: 73, train_loss: 0.8645, test_loss: 0.9887, test_f1: 0.4837
 epoch: 74, train_loss: 0.8700, test_loss: 0.9879, test_f1: 0.5002
 epoch: 75, train_loss: 0.8642, test_loss: 0.9898, test_f1: 0.5007
 epoch: 76, train_loss: 0.8632, test_loss: 0.9980, test_f1: 0.4913
 epoch: 77, train_loss: 0.8545, test_loss: 0.9822, test_f1: 0.4965
 epoch: 78, train_loss: 0.8527, test_loss: 1.0019, test_f1: 0.4927
 epoch: 79, train_loss: 0.8635, test_loss: 0.9843, test_f1: 0.5039
 epoch: 80, train_loss: 0.8551, test_loss: 1.0014, test_f1: 0.4969
 epoch: 81, train_loss: 0.8659, test_loss: 0.9920, test_f1: 0.4923
 epoch: 82, train_loss: 0.8396, test_loss: 0.9994, test_f1: 0.4874
 epoch: 83, train_loss: 0.8460, test_loss: 1.0056, test_f1: 0.4965
 epoch: 84, train_loss: 0.8506, test_loss: 0.9872, test_f1: 0.5070
 epoch: 85, train_loss: 0.8434, test_loss: 1.0048, test_f1: 0.4968
 epoch: 86, train_loss: 0.8366, test_loss: 1.0119, test_f1: 0.5001
 epoch: 87, train_loss: 0.8340, test_loss: 1.0145, test_f1: 0.4945
 epoch: 88, train_loss: 0.8400, test_loss: 1.0208, test_f1: 0.4846
 epoch: 89, train_loss: 0.8349, test_loss: 1.0117, test_f1: 0.4933
 epoch: 90, train_loss: 0.8375, test_loss: 1.0172, test_f1: 0.4975
 epoch: 91, train_loss: 0.8463, test_loss: 1.0322, test_f1: 0.4923
 epoch: 92, train_loss: 0.8355, test_loss: 1.0257, test_f1: 0.5054
 epoch: 93, train_loss: 0.8320, test_loss: 1.0234, test_f1: 0.4954
 epoch: 94, train_loss: 0.8263, test_loss: 1.0849, test_f1: 0.5152
 epoch: 95, train_loss: 0.8306, test_loss: 1.0347, test_f1: 0.4967
 epoch: 96, train_loss: 0.8326, test_loss: 1.0498, test_f1: 0.5098
 epoch: 97, train_loss: 0.8224, test_loss: 1.0597, test_f1: 0.5113
 epoch: 98, train_loss: 0.8348, test_loss: 1.0475, test_f1: 0.5116
 epoch: 99, train_loss: 0.8320, test_loss: 1.0189, test_f1: 0.4947
##################ITERATION #5 ****************************************
 epoch: 0, train_loss: 1.3050, test_loss: 1.2598, test_f1: 0.3109
 epoch: 1, train_loss: 1.2417, test_loss: 1.1902, test_f1: 0.3734
 epoch: 2, train_loss: 1.2173, test_loss: 1.1729, test_f1: 0.3831
 epoch: 3, train_loss: 1.2000, test_loss: 1.1543, test_f1: 0.4186
 epoch: 4, train_loss: 1.1823, test_loss: 1.1453, test_f1: 0.4080
 epoch: 5, train_loss: 1.1831, test_loss: 1.1343, test_f1: 0.4258
 epoch: 6, train_loss: 1.1640, test_loss: 1.1331, test_f1: 0.4046
 epoch: 7, train_loss: 1.1644, test_loss: 1.1251, test_f1: 0.4271
 epoch: 8, train_loss: 1.1486, test_loss: 1.1136, test_f1: 0.4290
 epoch: 9, train_loss: 1.1463, test_loss: 1.1229, test_f1: 0.4173
 epoch: 10, train_loss: 1.1412, test_loss: 1.1104, test_f1: 0.4272
 epoch: 11, train_loss: 1.1209, test_loss: 1.1049, test_f1: 0.4267
 epoch: 12, train_loss: 1.1270, test_loss: 1.0988, test_f1: 0.4256
 epoch: 13, train_loss: 1.1188, test_loss: 1.0888, test_f1: 0.4338
 epoch: 14, train_loss: 1.1051, test_loss: 1.0907, test_f1: 0.4239
 epoch: 15, train_loss: 1.1037, test_loss: 1.0793, test_f1: 0.4275
 epoch: 16, train_loss: 1.0951, test_loss: 1.0646, test_f1: 0.4303
 epoch: 17, train_loss: 1.0826, test_loss: 1.0733, test_f1: 0.4261
 epoch: 18, train_loss: 1.0867, test_loss: 1.0728, test_f1: 0.4221
 epoch: 19, train_loss: 1.0827, test_loss: 1.0666, test_f1: 0.4332
 epoch: 20, train_loss: 1.0795, test_loss: 1.0658, test_f1: 0.4294
 epoch: 21, train_loss: 1.0644, test_loss: 1.0520, test_f1: 0.4351
 epoch: 22, train_loss: 1.0615, test_loss: 1.0470, test_f1: 0.4380
 epoch: 23, train_loss: 1.0520, test_loss: 1.0428, test_f1: 0.4424
 epoch: 24, train_loss: 1.0613, test_loss: 1.0486, test_f1: 0.4238
 epoch: 25, train_loss: 1.0427, test_loss: 1.0342, test_f1: 0.4297
 epoch: 26, train_loss: 1.0443, test_loss: 1.0363, test_f1: 0.4373
 epoch: 27, train_loss: 1.0388, test_loss: 1.0299, test_f1: 0.4398
 epoch: 28, train_loss: 1.0268, test_loss: 1.0297, test_f1: 0.4346
 epoch: 29, train_loss: 1.0284, test_loss: 1.0294, test_f1: 0.4240
 epoch: 30, train_loss: 1.0245, test_loss: 1.0211, test_f1: 0.4319
 epoch: 31, train_loss: 1.0075, test_loss: 1.0050, test_f1: 0.4289
 epoch: 32, train_loss: 1.0070, test_loss: 0.9987, test_f1: 0.4399
 epoch: 33, train_loss: 0.9943, test_loss: 1.0305, test_f1: 0.4320
 epoch: 34, train_loss: 0.9845, test_loss: 1.0134, test_f1: 0.4477
 epoch: 35, train_loss: 0.9924, test_loss: 0.9991, test_f1: 0.4434
 epoch: 36, train_loss: 0.9797, test_loss: 1.0116, test_f1: 0.4299
 epoch: 37, train_loss: 0.9632, test_loss: 0.9948, test_f1: 0.4471
 epoch: 38, train_loss: 0.9669, test_loss: 0.9842, test_f1: 0.4488
 epoch: 39, train_loss: 0.9773, test_loss: 1.0265, test_f1: 0.4347
 epoch: 40, train_loss: 0.9727, test_loss: 1.0029, test_f1: 0.4472
 epoch: 41, train_loss: 0.9566, test_loss: 0.9994, test_f1: 0.4555
 epoch: 42, train_loss: 0.9647, test_loss: 1.0167, test_f1: 0.4487
 epoch: 43, train_loss: 0.9491, test_loss: 1.0013, test_f1: 0.4579
 epoch: 44, train_loss: 0.9472, test_loss: 0.9839, test_f1: 0.4588
 epoch: 45, train_loss: 0.9422, test_loss: 0.9820, test_f1: 0.4653
 epoch: 46, train_loss: 0.9294, test_loss: 0.9899, test_f1: 0.4628
 epoch: 47, train_loss: 0.9438, test_loss: 0.9779, test_f1: 0.4639
 epoch: 48, train_loss: 0.9336, test_loss: 1.0089, test_f1: 0.4635
 epoch: 49, train_loss: 0.9350, test_loss: 1.0021, test_f1: 0.4687
 epoch: 50, train_loss: 0.9199, test_loss: 0.9910, test_f1: 0.4671
 epoch: 51, train_loss: 0.9194, test_loss: 1.0011, test_f1: 0.4751
 epoch: 52, train_loss: 0.9151, test_loss: 0.9966, test_f1: 0.4717
 epoch: 53, train_loss: 0.9083, test_loss: 0.9975, test_f1: 0.4617
 epoch: 54, train_loss: 0.9018, test_loss: 0.9924, test_f1: 0.4703
 epoch: 55, train_loss: 0.8966, test_loss: 0.9962, test_f1: 0.4629
 epoch: 56, train_loss: 0.9084, test_loss: 0.9846, test_f1: 0.4731
 epoch: 57, train_loss: 0.8999, test_loss: 0.9732, test_f1: 0.4684
 epoch: 58, train_loss: 0.8944, test_loss: 0.9852, test_f1: 0.4679
 epoch: 59, train_loss: 0.9106, test_loss: 1.0183, test_f1: 0.4673
 epoch: 60, train_loss: 0.8961, test_loss: 0.9889, test_f1: 0.4686
 epoch: 61, train_loss: 0.8924, test_loss: 1.0197, test_f1: 0.4595
 epoch: 62, train_loss: 0.8873, test_loss: 1.0141, test_f1: 0.4612
 epoch: 63, train_loss: 0.8917, test_loss: 1.0145, test_f1: 0.4562
 epoch: 64, train_loss: 0.8765, test_loss: 0.9918, test_f1: 0.4762
 epoch: 65, train_loss: 0.8854, test_loss: 0.9935, test_f1: 0.4499
 epoch: 66, train_loss: 0.8838, test_loss: 1.0307, test_f1: 0.4613
 epoch: 67, train_loss: 0.8751, test_loss: 1.0246, test_f1: 0.4564
 epoch: 68, train_loss: 0.8710, test_loss: 0.9862, test_f1: 0.4718
 epoch: 69, train_loss: 0.8696, test_loss: 0.9889, test_f1: 0.4785
 epoch: 70, train_loss: 0.8751, test_loss: 1.0039, test_f1: 0.4638
 epoch: 71, train_loss: 0.8905, test_loss: 1.0089, test_f1: 0.4926
 epoch: 72, train_loss: 0.8709, test_loss: 1.0250, test_f1: 0.4598
 epoch: 73, train_loss: 0.8688, test_loss: 1.0120, test_f1: 0.4568
 epoch: 74, train_loss: 0.8676, test_loss: 0.9956, test_f1: 0.4707
 epoch: 75, train_loss: 0.8633, test_loss: 1.0419, test_f1: 0.4541
 epoch: 76, train_loss: 0.8756, test_loss: 0.9978, test_f1: 0.4753
 epoch: 77, train_loss: 0.8639, test_loss: 0.9919, test_f1: 0.4809
 epoch: 78, train_loss: 0.8612, test_loss: 0.9869, test_f1: 0.4753
 epoch: 79, train_loss: 0.8648, test_loss: 0.9956, test_f1: 0.4639
 epoch: 80, train_loss: 0.8587, test_loss: 1.0374, test_f1: 0.4547
 epoch: 81, train_loss: 0.8519, test_loss: 1.0309, test_f1: 0.4755
 epoch: 82, train_loss: 0.8504, test_loss: 1.0071, test_f1: 0.4804
 epoch: 83, train_loss: 0.8454, test_loss: 1.0053, test_f1: 0.4759
 epoch: 84, train_loss: 0.8468, test_loss: 1.0376, test_f1: 0.4682
 epoch: 85, train_loss: 0.8571, test_loss: 1.0089, test_f1: 0.4694
 epoch: 86, train_loss: 0.8602, test_loss: 1.0225, test_f1: 0.4724
 epoch: 87, train_loss: 0.8405, test_loss: 1.0401, test_f1: 0.4644
 epoch: 88, train_loss: 0.8383, test_loss: 1.0426, test_f1: 0.4683
 epoch: 89, train_loss: 0.8497, test_loss: 1.0255, test_f1: 0.4821
 epoch: 90, train_loss: 0.8374, test_loss: 1.0374, test_f1: 0.4751
 epoch: 91, train_loss: 0.8445, test_loss: 1.0175, test_f1: 0.4735
 epoch: 92, train_loss: 0.8347, test_loss: 1.0393, test_f1: 0.4723
 epoch: 93, train_loss: 0.8307, test_loss: 1.0521, test_f1: 0.4643
 epoch: 94, train_loss: 0.8360, test_loss: 1.0511, test_f1: 0.4655
 epoch: 95, train_loss: 0.8332, test_loss: 1.0380, test_f1: 0.4692
 epoch: 96, train_loss: 0.8461, test_loss: 1.0187, test_f1: 0.4674
 epoch: 97, train_loss: 0.8247, test_loss: 1.0404, test_f1: 0.4749
 epoch: 98, train_loss: 0.8181, test_loss: 1.0566, test_f1: 0.4689
 epoch: 99, train_loss: 0.8238, test_loss: 1.0137, test_f1: 0.4887
##################ITERATION #6 ****************************************
 epoch: 0, train_loss: 1.3093, test_loss: 1.2433, test_f1: 0.3470
 epoch: 1, train_loss: 1.2351, test_loss: 1.1976, test_f1: 0.4122
 epoch: 2, train_loss: 1.2040, test_loss: 1.1715, test_f1: 0.4378
 epoch: 3, train_loss: 1.1872, test_loss: 1.1556, test_f1: 0.4322
 epoch: 4, train_loss: 1.1741, test_loss: 1.1400, test_f1: 0.4403
 epoch: 5, train_loss: 1.1598, test_loss: 1.1269, test_f1: 0.4405
 epoch: 6, train_loss: 1.1458, test_loss: 1.1203, test_f1: 0.4430
 epoch: 7, train_loss: 1.1287, test_loss: 1.1014, test_f1: 0.4460
 epoch: 8, train_loss: 1.1243, test_loss: 1.0864, test_f1: 0.4556
 epoch: 9, train_loss: 1.1087, test_loss: 1.0838, test_f1: 0.4547
 epoch: 10, train_loss: 1.1122, test_loss: 1.0728, test_f1: 0.4676
 epoch: 11, train_loss: 1.0955, test_loss: 1.0683, test_f1: 0.4755
 epoch: 12, train_loss: 1.0819, test_loss: 1.0599, test_f1: 0.4562
 epoch: 13, train_loss: 1.0819, test_loss: 1.0556, test_f1: 0.4673
 epoch: 14, train_loss: 1.0572, test_loss: 1.0427, test_f1: 0.4718
 epoch: 15, train_loss: 1.0564, test_loss: 1.0378, test_f1: 0.4691
 epoch: 16, train_loss: 1.0577, test_loss: 1.0329, test_f1: 0.4742
 epoch: 17, train_loss: 1.0423, test_loss: 1.0310, test_f1: 0.4726
 epoch: 18, train_loss: 1.0389, test_loss: 1.0280, test_f1: 0.4575
 epoch: 19, train_loss: 1.0279, test_loss: 1.0260, test_f1: 0.4471
 epoch: 20, train_loss: 1.0245, test_loss: 1.0215, test_f1: 0.4634
 epoch: 21, train_loss: 1.0212, test_loss: 1.0026, test_f1: 0.4555
 epoch: 22, train_loss: 1.0154, test_loss: 1.0081, test_f1: 0.4749
 epoch: 23, train_loss: 1.0108, test_loss: 1.0051, test_f1: 0.4742
 epoch: 24, train_loss: 1.0037, test_loss: 1.0059, test_f1: 0.4650
 epoch: 25, train_loss: 0.9942, test_loss: 1.0106, test_f1: 0.4816
 epoch: 26, train_loss: 0.9941, test_loss: 1.0100, test_f1: 0.4881
 epoch: 27, train_loss: 0.9838, test_loss: 0.9996, test_f1: 0.4810
 epoch: 28, train_loss: 0.9734, test_loss: 0.9949, test_f1: 0.4807
 epoch: 29, train_loss: 0.9825, test_loss: 0.9988, test_f1: 0.4794
 epoch: 30, train_loss: 0.9883, test_loss: 0.9975, test_f1: 0.4597
 epoch: 31, train_loss: 0.9766, test_loss: 0.9852, test_f1: 0.4708
 epoch: 32, train_loss: 0.9596, test_loss: 0.9775, test_f1: 0.4720
 epoch: 33, train_loss: 0.9568, test_loss: 0.9951, test_f1: 0.4677
 epoch: 34, train_loss: 0.9507, test_loss: 0.9802, test_f1: 0.4751
 epoch: 35, train_loss: 0.9536, test_loss: 0.9859, test_f1: 0.4751
 epoch: 36, train_loss: 0.9517, test_loss: 0.9795, test_f1: 0.4743
 epoch: 37, train_loss: 0.9556, test_loss: 0.9861, test_f1: 0.4728
 epoch: 38, train_loss: 0.9481, test_loss: 0.9809, test_f1: 0.4883
 epoch: 39, train_loss: 0.9233, test_loss: 0.9773, test_f1: 0.4856
 epoch: 40, train_loss: 0.9258, test_loss: 0.9846, test_f1: 0.4897
 epoch: 41, train_loss: 0.9335, test_loss: 0.9781, test_f1: 0.4694
 epoch: 42, train_loss: 0.9226, test_loss: 0.9883, test_f1: 0.4815
 epoch: 43, train_loss: 0.9202, test_loss: 0.9780, test_f1: 0.4870
 epoch: 44, train_loss: 0.9148, test_loss: 0.9809, test_f1: 0.4813
 epoch: 45, train_loss: 0.9193, test_loss: 0.9756, test_f1: 0.4956
 epoch: 46, train_loss: 0.9130, test_loss: 0.9784, test_f1: 0.4845
 epoch: 47, train_loss: 0.8986, test_loss: 0.9736, test_f1: 0.4790
 epoch: 48, train_loss: 0.9052, test_loss: 0.9855, test_f1: 0.4954
 epoch: 49, train_loss: 0.8964, test_loss: 0.9906, test_f1: 0.4873
 epoch: 50, train_loss: 0.8967, test_loss: 0.9969, test_f1: 0.4712
 epoch: 51, train_loss: 0.8861, test_loss: 0.9933, test_f1: 0.4907
 epoch: 52, train_loss: 0.8852, test_loss: 0.9910, test_f1: 0.4918
 epoch: 53, train_loss: 0.8906, test_loss: 1.0049, test_f1: 0.4934
 epoch: 54, train_loss: 0.8875, test_loss: 0.9895, test_f1: 0.4947
 epoch: 55, train_loss: 0.8732, test_loss: 1.0051, test_f1: 0.4850
 epoch: 56, train_loss: 0.8806, test_loss: 0.9906, test_f1: 0.4876
 epoch: 57, train_loss: 0.8663, test_loss: 0.9960, test_f1: 0.4867
 epoch: 58, train_loss: 0.8687, test_loss: 0.9946, test_f1: 0.4872
 epoch: 59, train_loss: 0.8832, test_loss: 0.9956, test_f1: 0.4826
 epoch: 60, train_loss: 0.8785, test_loss: 1.0109, test_f1: 0.4847
 epoch: 61, train_loss: 0.8710, test_loss: 1.0056, test_f1: 0.4762
 epoch: 62, train_loss: 0.8735, test_loss: 1.0065, test_f1: 0.4869
 epoch: 63, train_loss: 0.8622, test_loss: 1.0039, test_f1: 0.4846
 epoch: 64, train_loss: 0.8570, test_loss: 1.0063, test_f1: 0.4907
 epoch: 65, train_loss: 0.8557, test_loss: 1.0112, test_f1: 0.4865
 epoch: 66, train_loss: 0.8705, test_loss: 1.0192, test_f1: 0.4824
 epoch: 67, train_loss: 0.8691, test_loss: 1.0006, test_f1: 0.4917
 epoch: 68, train_loss: 0.8477, test_loss: 1.0048, test_f1: 0.4798
 epoch: 69, train_loss: 0.8542, test_loss: 0.9926, test_f1: 0.4843
 epoch: 70, train_loss: 0.8617, test_loss: 1.0165, test_f1: 0.4851
 epoch: 71, train_loss: 0.8623, test_loss: 0.9966, test_f1: 0.4822
 epoch: 72, train_loss: 0.8482, test_loss: 1.0012, test_f1: 0.4895
 epoch: 73, train_loss: 0.8508, test_loss: 1.0060, test_f1: 0.4962
 epoch: 74, train_loss: 0.8465, test_loss: 1.0142, test_f1: 0.4820
 epoch: 75, train_loss: 0.8398, test_loss: 1.0151, test_f1: 0.4911
 epoch: 76, train_loss: 0.8584, test_loss: 1.0229, test_f1: 0.4793
 epoch: 77, train_loss: 0.8525, test_loss: 1.0289, test_f1: 0.4924
 epoch: 78, train_loss: 0.8538, test_loss: 1.0320, test_f1: 0.4872
 epoch: 79, train_loss: 0.8400, test_loss: 1.0364, test_f1: 0.4757
 epoch: 80, train_loss: 0.8501, test_loss: 1.0230, test_f1: 0.4784
 epoch: 81, train_loss: 0.8363, test_loss: 1.0308, test_f1: 0.4865
 epoch: 82, train_loss: 0.8350, test_loss: 1.0189, test_f1: 0.4882
 epoch: 83, train_loss: 0.8306, test_loss: 1.0165, test_f1: 0.4822
 epoch: 84, train_loss: 0.8263, test_loss: 1.0399, test_f1: 0.4846
 epoch: 85, train_loss: 0.8363, test_loss: 1.0464, test_f1: 0.4805
 epoch: 86, train_loss: 0.8357, test_loss: 1.0147, test_f1: 0.4983
 epoch: 87, train_loss: 0.8308, test_loss: 1.0321, test_f1: 0.4956
 epoch: 88, train_loss: 0.8228, test_loss: 1.0264, test_f1: 0.4855
 epoch: 89, train_loss: 0.8275, test_loss: 1.0457, test_f1: 0.4897
 epoch: 90, train_loss: 0.8168, test_loss: 1.0466, test_f1: 0.4859
 epoch: 91, train_loss: 0.8273, test_loss: 1.0298, test_f1: 0.4953
 epoch: 92, train_loss: 0.8190, test_loss: 1.0439, test_f1: 0.4790
 epoch: 93, train_loss: 0.8176, test_loss: 1.0264, test_f1: 0.4705
 epoch: 94, train_loss: 0.8201, test_loss: 1.0432, test_f1: 0.4914
 epoch: 95, train_loss: 0.8082, test_loss: 1.0433, test_f1: 0.4878
 epoch: 96, train_loss: 0.8130, test_loss: 1.0405, test_f1: 0.4877
 epoch: 97, train_loss: 0.8294, test_loss: 1.0351, test_f1: 0.4857
 epoch: 98, train_loss: 0.8159, test_loss: 1.0291, test_f1: 0.4787
 epoch: 99, train_loss: 0.8277, test_loss: 1.0318, test_f1: 0.4926
##################ITERATION #7 ****************************************
 epoch: 0, train_loss: 1.3040, test_loss: 1.2426, test_f1: 0.3755
 epoch: 1, train_loss: 1.2384, test_loss: 1.1981, test_f1: 0.4046
 epoch: 2, train_loss: 1.2213, test_loss: 1.1662, test_f1: 0.4203
 epoch: 3, train_loss: 1.1932, test_loss: 1.1415, test_f1: 0.4240
 epoch: 4, train_loss: 1.1855, test_loss: 1.1266, test_f1: 0.4292
 epoch: 5, train_loss: 1.1598, test_loss: 1.1137, test_f1: 0.4385
 epoch: 6, train_loss: 1.1654, test_loss: 1.1001, test_f1: 0.4358
 epoch: 7, train_loss: 1.1457, test_loss: 1.0945, test_f1: 0.4303
 epoch: 8, train_loss: 1.1444, test_loss: 1.0852, test_f1: 0.4426
 epoch: 9, train_loss: 1.1225, test_loss: 1.0755, test_f1: 0.4246
 epoch: 10, train_loss: 1.1253, test_loss: 1.0740, test_f1: 0.4464
 epoch: 11, train_loss: 1.1098, test_loss: 1.0638, test_f1: 0.4501
 epoch: 12, train_loss: 1.0995, test_loss: 1.0497, test_f1: 0.4525
 epoch: 13, train_loss: 1.0879, test_loss: 1.0490, test_f1: 0.4456
 epoch: 14, train_loss: 1.0787, test_loss: 1.0409, test_f1: 0.4580
 epoch: 15, train_loss: 1.0721, test_loss: 1.0427, test_f1: 0.4761
 epoch: 16, train_loss: 1.0710, test_loss: 1.0313, test_f1: 0.4611
 epoch: 17, train_loss: 1.0737, test_loss: 1.0298, test_f1: 0.4636
 epoch: 18, train_loss: 1.0610, test_loss: 1.0303, test_f1: 0.4588
 epoch: 19, train_loss: 1.0516, test_loss: 1.0210, test_f1: 0.4680
 epoch: 20, train_loss: 1.0439, test_loss: 1.0356, test_f1: 0.4499
 epoch: 21, train_loss: 1.0312, test_loss: 1.0231, test_f1: 0.4655
 epoch: 22, train_loss: 1.0460, test_loss: 1.0190, test_f1: 0.4536
 epoch: 23, train_loss: 1.0247, test_loss: 1.0121, test_f1: 0.4590
 epoch: 24, train_loss: 1.0276, test_loss: 1.0069, test_f1: 0.4749
 epoch: 25, train_loss: 1.0179, test_loss: 1.0138, test_f1: 0.4692
 epoch: 26, train_loss: 1.0163, test_loss: 1.0160, test_f1: 0.4528
 epoch: 27, train_loss: 1.0087, test_loss: 1.0078, test_f1: 0.4680
 epoch: 28, train_loss: 1.0076, test_loss: 1.0106, test_f1: 0.4718
 epoch: 29, train_loss: 0.9979, test_loss: 1.0017, test_f1: 0.4573
 epoch: 30, train_loss: 0.9890, test_loss: 1.0057, test_f1: 0.4722
 epoch: 31, train_loss: 0.9864, test_loss: 1.0023, test_f1: 0.4575
 epoch: 32, train_loss: 0.9996, test_loss: 1.0114, test_f1: 0.4530
 epoch: 33, train_loss: 0.9814, test_loss: 1.0053, test_f1: 0.4606
 epoch: 34, train_loss: 0.9602, test_loss: 1.0084, test_f1: 0.4442
 epoch: 35, train_loss: 0.9619, test_loss: 1.0114, test_f1: 0.4433
 epoch: 36, train_loss: 0.9736, test_loss: 1.0023, test_f1: 0.4683
 epoch: 37, train_loss: 0.9672, test_loss: 1.0012, test_f1: 0.4626
 epoch: 38, train_loss: 0.9555, test_loss: 1.0031, test_f1: 0.4529
 epoch: 39, train_loss: 0.9540, test_loss: 0.9981, test_f1: 0.4651
 epoch: 40, train_loss: 0.9359, test_loss: 1.0021, test_f1: 0.4550
 epoch: 41, train_loss: 0.9446, test_loss: 0.9816, test_f1: 0.4641
 epoch: 42, train_loss: 0.9383, test_loss: 0.9959, test_f1: 0.4614
 epoch: 43, train_loss: 0.9292, test_loss: 0.9918, test_f1: 0.4750
 epoch: 44, train_loss: 0.9397, test_loss: 0.9872, test_f1: 0.4702
 epoch: 45, train_loss: 0.9295, test_loss: 1.0103, test_f1: 0.4558
 epoch: 46, train_loss: 0.9279, test_loss: 0.9983, test_f1: 0.4633
 epoch: 47, train_loss: 0.9115, test_loss: 1.0075, test_f1: 0.4712
 epoch: 48, train_loss: 0.9172, test_loss: 1.0162, test_f1: 0.4799
 epoch: 49, train_loss: 0.9156, test_loss: 1.0275, test_f1: 0.4675
 epoch: 50, train_loss: 0.9064, test_loss: 1.0262, test_f1: 0.4752
 epoch: 51, train_loss: 0.9024, test_loss: 0.9980, test_f1: 0.4735
 epoch: 52, train_loss: 0.9009, test_loss: 1.0204, test_f1: 0.4736
 epoch: 53, train_loss: 0.8959, test_loss: 0.9989, test_f1: 0.4878
 epoch: 54, train_loss: 0.8940, test_loss: 1.0113, test_f1: 0.4776
 epoch: 55, train_loss: 0.8800, test_loss: 1.0053, test_f1: 0.4702
 epoch: 56, train_loss: 0.8862, test_loss: 1.0228, test_f1: 0.4719
 epoch: 57, train_loss: 0.8862, test_loss: 1.0291, test_f1: 0.4832
 epoch: 58, train_loss: 0.8869, test_loss: 1.0152, test_f1: 0.4803
 epoch: 59, train_loss: 0.8643, test_loss: 1.0323, test_f1: 0.4803
 epoch: 60, train_loss: 0.8865, test_loss: 1.0289, test_f1: 0.4728
 epoch: 61, train_loss: 0.8755, test_loss: 1.0442, test_f1: 0.4711
 epoch: 62, train_loss: 0.8798, test_loss: 1.0398, test_f1: 0.4669
 epoch: 63, train_loss: 0.8759, test_loss: 1.0377, test_f1: 0.4778
 epoch: 64, train_loss: 0.8747, test_loss: 1.0390, test_f1: 0.4704
 epoch: 65, train_loss: 0.8698, test_loss: 1.0423, test_f1: 0.4653
 epoch: 66, train_loss: 0.8636, test_loss: 1.0450, test_f1: 0.4647
 epoch: 67, train_loss: 0.8728, test_loss: 1.0390, test_f1: 0.4762
 epoch: 68, train_loss: 0.8573, test_loss: 1.0265, test_f1: 0.4766
 epoch: 69, train_loss: 0.8570, test_loss: 1.0258, test_f1: 0.4736
 epoch: 70, train_loss: 0.8616, test_loss: 1.0355, test_f1: 0.4801
 epoch: 71, train_loss: 0.8572, test_loss: 1.0254, test_f1: 0.4747
 epoch: 72, train_loss: 0.8645, test_loss: 1.0236, test_f1: 0.4909
 epoch: 73, train_loss: 0.8614, test_loss: 1.0315, test_f1: 0.4841
 epoch: 74, train_loss: 0.8629, test_loss: 1.0449, test_f1: 0.4862
 epoch: 75, train_loss: 0.8613, test_loss: 1.0319, test_f1: 0.4847
 epoch: 76, train_loss: 0.8433, test_loss: 1.0472, test_f1: 0.4871
 epoch: 77, train_loss: 0.8548, test_loss: 1.0397, test_f1: 0.4896
 epoch: 78, train_loss: 0.8406, test_loss: 1.0564, test_f1: 0.4768
 epoch: 79, train_loss: 0.8460, test_loss: 1.0319, test_f1: 0.4996
 epoch: 80, train_loss: 0.8345, test_loss: 1.0345, test_f1: 0.4925
 epoch: 81, train_loss: 0.8425, test_loss: 1.0320, test_f1: 0.4968
 epoch: 82, train_loss: 0.8618, test_loss: 1.0417, test_f1: 0.4993
 epoch: 83, train_loss: 0.8391, test_loss: 1.0279, test_f1: 0.4878
 epoch: 84, train_loss: 0.8375, test_loss: 1.0364, test_f1: 0.4937
 epoch: 85, train_loss: 0.8367, test_loss: 1.0544, test_f1: 0.4927
 epoch: 86, train_loss: 0.8331, test_loss: 1.0447, test_f1: 0.4860
 epoch: 87, train_loss: 0.8263, test_loss: 1.0424, test_f1: 0.4982
 epoch: 88, train_loss: 0.8344, test_loss: 1.0563, test_f1: 0.4904
 epoch: 89, train_loss: 0.8368, test_loss: 1.0282, test_f1: 0.5005
 epoch: 90, train_loss: 0.8254, test_loss: 1.0455, test_f1: 0.5037
 epoch: 91, train_loss: 0.8159, test_loss: 1.0394, test_f1: 0.4975
 epoch: 92, train_loss: 0.8156, test_loss: 1.0641, test_f1: 0.4871
 epoch: 93, train_loss: 0.8159, test_loss: 1.0445, test_f1: 0.5002
 epoch: 94, train_loss: 0.8177, test_loss: 1.0438, test_f1: 0.5020
 epoch: 95, train_loss: 0.8255, test_loss: 1.0463, test_f1: 0.4936
 epoch: 96, train_loss: 0.8177, test_loss: 1.0406, test_f1: 0.5016
 epoch: 97, train_loss: 0.7982, test_loss: 1.0598, test_f1: 0.4931
 epoch: 98, train_loss: 0.8112, test_loss: 1.0390, test_f1: 0.4903
 epoch: 99, train_loss: 0.8221, test_loss: 1.0535, test_f1: 0.4961
##################ITERATION #8 ****************************************
 epoch: 0, train_loss: 1.3220, test_loss: 1.1949, test_f1: 0.4016
 epoch: 1, train_loss: 1.2419, test_loss: 1.1615, test_f1: 0.4250
 epoch: 2, train_loss: 1.2210, test_loss: 1.1399, test_f1: 0.4500
 epoch: 3, train_loss: 1.2004, test_loss: 1.1281, test_f1: 0.4548
 epoch: 4, train_loss: 1.1928, test_loss: 1.1094, test_f1: 0.4575
 epoch: 5, train_loss: 1.1646, test_loss: 1.0991, test_f1: 0.4520
 epoch: 6, train_loss: 1.1647, test_loss: 1.1075, test_f1: 0.4269
 epoch: 7, train_loss: 1.1360, test_loss: 1.0837, test_f1: 0.4488
 epoch: 8, train_loss: 1.1332, test_loss: 1.0626, test_f1: 0.4744
 epoch: 9, train_loss: 1.1184, test_loss: 1.0685, test_f1: 0.4484
 epoch: 10, train_loss: 1.1104, test_loss: 1.0526, test_f1: 0.4492
 epoch: 11, train_loss: 1.0968, test_loss: 1.0450, test_f1: 0.4605
 epoch: 12, train_loss: 1.0832, test_loss: 1.0363, test_f1: 0.4543
 epoch: 13, train_loss: 1.0883, test_loss: 1.0304, test_f1: 0.4677
 epoch: 14, train_loss: 1.0731, test_loss: 1.0205, test_f1: 0.4579
 epoch: 15, train_loss: 1.0694, test_loss: 1.0079, test_f1: 0.4554
 epoch: 16, train_loss: 1.0614, test_loss: 0.9996, test_f1: 0.4701
 epoch: 17, train_loss: 1.0644, test_loss: 1.0082, test_f1: 0.4701
 epoch: 18, train_loss: 1.0561, test_loss: 0.9979, test_f1: 0.4656
 epoch: 19, train_loss: 1.0536, test_loss: 1.0199, test_f1: 0.4566
 epoch: 20, train_loss: 1.0467, test_loss: 0.9954, test_f1: 0.4675
 epoch: 21, train_loss: 1.0354, test_loss: 0.9959, test_f1: 0.4646
 epoch: 22, train_loss: 1.0253, test_loss: 0.9801, test_f1: 0.4596
 epoch: 23, train_loss: 1.0352, test_loss: 0.9737, test_f1: 0.4661
 epoch: 24, train_loss: 1.0170, test_loss: 0.9735, test_f1: 0.4768
 epoch: 25, train_loss: 1.0255, test_loss: 0.9780, test_f1: 0.4686
 epoch: 26, train_loss: 1.0083, test_loss: 0.9699, test_f1: 0.4811
 epoch: 27, train_loss: 1.0158, test_loss: 0.9792, test_f1: 0.4585
 epoch: 28, train_loss: 1.0015, test_loss: 0.9771, test_f1: 0.4621
 epoch: 29, train_loss: 1.0084, test_loss: 0.9747, test_f1: 0.4646
 epoch: 30, train_loss: 0.9935, test_loss: 0.9941, test_f1: 0.4615
 epoch: 31, train_loss: 0.9863, test_loss: 0.9614, test_f1: 0.4577
 epoch: 32, train_loss: 0.9811, test_loss: 0.9571, test_f1: 0.4779
 epoch: 33, train_loss: 0.9906, test_loss: 0.9572, test_f1: 0.4818
 epoch: 34, train_loss: 0.9901, test_loss: 0.9503, test_f1: 0.4778
 epoch: 35, train_loss: 0.9798, test_loss: 0.9626, test_f1: 0.4755
 epoch: 36, train_loss: 0.9601, test_loss: 0.9566, test_f1: 0.4639
 epoch: 37, train_loss: 0.9588, test_loss: 0.9571, test_f1: 0.4600
 epoch: 38, train_loss: 0.9663, test_loss: 0.9536, test_f1: 0.4633
 epoch: 39, train_loss: 0.9585, test_loss: 0.9442, test_f1: 0.4676
 epoch: 40, train_loss: 0.9557, test_loss: 0.9472, test_f1: 0.4795
 epoch: 41, train_loss: 0.9500, test_loss: 0.9526, test_f1: 0.4660
 epoch: 42, train_loss: 0.9620, test_loss: 0.9431, test_f1: 0.4746
 epoch: 43, train_loss: 0.9455, test_loss: 0.9395, test_f1: 0.4925
 epoch: 44, train_loss: 0.9463, test_loss: 0.9459, test_f1: 0.4892
 epoch: 45, train_loss: 0.9468, test_loss: 0.9408, test_f1: 0.4831
 epoch: 46, train_loss: 0.9280, test_loss: 0.9466, test_f1: 0.4885
 epoch: 47, train_loss: 0.9280, test_loss: 0.9596, test_f1: 0.4920
 epoch: 48, train_loss: 0.9352, test_loss: 0.9214, test_f1: 0.5081
 epoch: 49, train_loss: 0.9316, test_loss: 0.9515, test_f1: 0.4818
 epoch: 50, train_loss: 0.9258, test_loss: 0.9542, test_f1: 0.5049
 epoch: 51, train_loss: 0.9179, test_loss: 0.9358, test_f1: 0.5104
 epoch: 52, train_loss: 0.9154, test_loss: 0.9544, test_f1: 0.4873
 epoch: 53, train_loss: 0.9070, test_loss: 0.9502, test_f1: 0.4883
 epoch: 54, train_loss: 0.9125, test_loss: 0.9358, test_f1: 0.4941
 epoch: 55, train_loss: 0.9174, test_loss: 0.9412, test_f1: 0.4949
 epoch: 56, train_loss: 0.9143, test_loss: 0.9461, test_f1: 0.4874
 epoch: 57, train_loss: 0.9034, test_loss: 0.9429, test_f1: 0.4995
 epoch: 58, train_loss: 0.9038, test_loss: 0.9558, test_f1: 0.4796
 epoch: 59, train_loss: 0.8997, test_loss: 0.9399, test_f1: 0.5029
 epoch: 60, train_loss: 0.8835, test_loss: 0.9412, test_f1: 0.5069
 epoch: 61, train_loss: 0.9005, test_loss: 0.9446, test_f1: 0.5026
 epoch: 62, train_loss: 0.8990, test_loss: 0.9555, test_f1: 0.4916
 epoch: 63, train_loss: 0.9058, test_loss: 0.9495, test_f1: 0.4918
 epoch: 64, train_loss: 0.8985, test_loss: 0.9274, test_f1: 0.4983
 epoch: 65, train_loss: 0.8973, test_loss: 0.9464, test_f1: 0.4950
 epoch: 66, train_loss: 0.8853, test_loss: 0.9528, test_f1: 0.5000
 epoch: 67, train_loss: 0.8840, test_loss: 0.9361, test_f1: 0.4869
 epoch: 68, train_loss: 0.8802, test_loss: 0.9416, test_f1: 0.4969
 epoch: 69, train_loss: 0.8975, test_loss: 0.9409, test_f1: 0.4997
 epoch: 70, train_loss: 0.8847, test_loss: 0.9322, test_f1: 0.5040
 epoch: 71, train_loss: 0.8770, test_loss: 0.9434, test_f1: 0.5022
 epoch: 72, train_loss: 0.8734, test_loss: 0.9268, test_f1: 0.5007
 epoch: 73, train_loss: 0.8617, test_loss: 0.9837, test_f1: 0.4978
 epoch: 74, train_loss: 0.8804, test_loss: 0.9338, test_f1: 0.5081
 epoch: 75, train_loss: 0.8806, test_loss: 0.9527, test_f1: 0.4972
 epoch: 76, train_loss: 0.8736, test_loss: 0.9299, test_f1: 0.5110
 epoch: 77, train_loss: 0.8791, test_loss: 0.9375, test_f1: 0.5122
 epoch: 78, train_loss: 0.8709, test_loss: 0.9246, test_f1: 0.5298
 epoch: 79, train_loss: 0.8631, test_loss: 0.9348, test_f1: 0.5194
 epoch: 80, train_loss: 0.8623, test_loss: 0.9306, test_f1: 0.5086
 epoch: 81, train_loss: 0.8675, test_loss: 0.9331, test_f1: 0.4983
 epoch: 82, train_loss: 0.8633, test_loss: 0.9347, test_f1: 0.5129
 epoch: 83, train_loss: 0.8623, test_loss: 0.9293, test_f1: 0.5020
 epoch: 84, train_loss: 0.8633, test_loss: 0.9621, test_f1: 0.4881
 epoch: 85, train_loss: 0.8653, test_loss: 0.9459, test_f1: 0.5124
 epoch: 86, train_loss: 0.8746, test_loss: 0.9250, test_f1: 0.4918
 epoch: 87, train_loss: 0.8491, test_loss: 0.9269, test_f1: 0.4959
 epoch: 88, train_loss: 0.8466, test_loss: 0.9247, test_f1: 0.5110
 epoch: 89, train_loss: 0.8504, test_loss: 0.9208, test_f1: 0.4995
 epoch: 90, train_loss: 0.8523, test_loss: 0.9290, test_f1: 0.4911
 epoch: 91, train_loss: 0.8395, test_loss: 0.9404, test_f1: 0.5123
 epoch: 92, train_loss: 0.8523, test_loss: 0.9414, test_f1: 0.5034
 epoch: 93, train_loss: 0.8435, test_loss: 0.9295, test_f1: 0.5241
 epoch: 94, train_loss: 0.8435, test_loss: 0.9691, test_f1: 0.4926
 epoch: 95, train_loss: 0.8490, test_loss: 0.9460, test_f1: 0.5011
 epoch: 96, train_loss: 0.8365, test_loss: 0.9406, test_f1: 0.5043
 epoch: 97, train_loss: 0.8343, test_loss: 0.9307, test_f1: 0.4966
 epoch: 98, train_loss: 0.8397, test_loss: 0.9588, test_f1: 0.5107
 epoch: 99, train_loss: 0.8425, test_loss: 0.9497, test_f1: 0.5007
##################ITERATION #9 ****************************************
 epoch: 0, train_loss: 1.3291, test_loss: 1.2411, test_f1: 0.3132
 epoch: 1, train_loss: 1.2563, test_loss: 1.1964, test_f1: 0.4184
 epoch: 2, train_loss: 1.2303, test_loss: 1.1904, test_f1: 0.4328
 epoch: 3, train_loss: 1.2125, test_loss: 1.1810, test_f1: 0.4520
 epoch: 4, train_loss: 1.1801, test_loss: 1.1520, test_f1: 0.4637
 epoch: 5, train_loss: 1.1718, test_loss: 1.1171, test_f1: 0.4739
 epoch: 6, train_loss: 1.1649, test_loss: 1.1081, test_f1: 0.4806
 epoch: 7, train_loss: 1.1662, test_loss: 1.1068, test_f1: 0.4754
 epoch: 8, train_loss: 1.1365, test_loss: 1.0860, test_f1: 0.4819
 epoch: 9, train_loss: 1.1360, test_loss: 1.0775, test_f1: 0.4868
 epoch: 10, train_loss: 1.1205, test_loss: 1.0934, test_f1: 0.4586
 epoch: 11, train_loss: 1.1045, test_loss: 1.0510, test_f1: 0.4737
 epoch: 12, train_loss: 1.1038, test_loss: 1.0446, test_f1: 0.4761
 epoch: 13, train_loss: 1.0893, test_loss: 1.0413, test_f1: 0.4680
 epoch: 14, train_loss: 1.0826, test_loss: 1.0346, test_f1: 0.4675
 epoch: 15, train_loss: 1.0696, test_loss: 1.0345, test_f1: 0.4693
 epoch: 16, train_loss: 1.0771, test_loss: 1.0360, test_f1: 0.4734
 epoch: 17, train_loss: 1.0729, test_loss: 1.0237, test_f1: 0.4764
 epoch: 18, train_loss: 1.0571, test_loss: 1.0217, test_f1: 0.4527
 epoch: 19, train_loss: 1.0456, test_loss: 0.9981, test_f1: 0.4877
 epoch: 20, train_loss: 1.0492, test_loss: 1.0070, test_f1: 0.4722
 epoch: 21, train_loss: 1.0454, test_loss: 0.9929, test_f1: 0.4801
 epoch: 22, train_loss: 1.0352, test_loss: 0.9884, test_f1: 0.4844
 epoch: 23, train_loss: 1.0314, test_loss: 0.9795, test_f1: 0.4721
 epoch: 24, train_loss: 1.0260, test_loss: 0.9946, test_f1: 0.4670
 epoch: 25, train_loss: 1.0208, test_loss: 1.0030, test_f1: 0.4616
 epoch: 26, train_loss: 1.0208, test_loss: 0.9936, test_f1: 0.4861
 epoch: 27, train_loss: 1.0068, test_loss: 0.9962, test_f1: 0.4667
 epoch: 28, train_loss: 0.9977, test_loss: 0.9909, test_f1: 0.4855
 epoch: 29, train_loss: 0.9955, test_loss: 0.9905, test_f1: 0.4848
 epoch: 30, train_loss: 0.9905, test_loss: 1.0003, test_f1: 0.4758
 epoch: 31, train_loss: 0.9895, test_loss: 0.9996, test_f1: 0.4815
 epoch: 32, train_loss: 0.9837, test_loss: 0.9982, test_f1: 0.4735
 epoch: 33, train_loss: 0.9701, test_loss: 1.0141, test_f1: 0.4468
 epoch: 34, train_loss: 0.9784, test_loss: 1.0004, test_f1: 0.4901
 epoch: 35, train_loss: 0.9653, test_loss: 1.0088, test_f1: 0.4726
 epoch: 36, train_loss: 0.9703, test_loss: 1.0081, test_f1: 0.4908
 epoch: 37, train_loss: 0.9527, test_loss: 1.0217, test_f1: 0.4891
 epoch: 38, train_loss: 0.9623, test_loss: 0.9948, test_f1: 0.4754
 epoch: 39, train_loss: 0.9568, test_loss: 0.9704, test_f1: 0.4778
 epoch: 40, train_loss: 0.9546, test_loss: 0.9666, test_f1: 0.4783
 epoch: 41, train_loss: 0.9478, test_loss: 0.9653, test_f1: 0.4691
 epoch: 42, train_loss: 0.9405, test_loss: 0.9913, test_f1: 0.4762
 epoch: 43, train_loss: 0.9374, test_loss: 0.9986, test_f1: 0.4710
 epoch: 44, train_loss: 0.9273, test_loss: 1.0410, test_f1: 0.4488
 epoch: 45, train_loss: 0.9334, test_loss: 0.9995, test_f1: 0.4935
 epoch: 46, train_loss: 0.9200, test_loss: 0.9921, test_f1: 0.4765
 epoch: 47, train_loss: 0.9324, test_loss: 1.0035, test_f1: 0.4942
 epoch: 48, train_loss: 0.9159, test_loss: 1.0198, test_f1: 0.5006
 epoch: 49, train_loss: 0.9164, test_loss: 1.0224, test_f1: 0.4818
 epoch: 50, train_loss: 0.9080, test_loss: 1.0630, test_f1: 0.4817
 epoch: 51, train_loss: 0.9130, test_loss: 1.0307, test_f1: 0.4853
 epoch: 52, train_loss: 0.9072, test_loss: 1.0122, test_f1: 0.4719
 epoch: 53, train_loss: 0.9076, test_loss: 1.0494, test_f1: 0.4821
 epoch: 54, train_loss: 0.8946, test_loss: 0.9980, test_f1: 0.4986
 epoch: 55, train_loss: 0.8972, test_loss: 0.9969, test_f1: 0.4938
 epoch: 56, train_loss: 0.8990, test_loss: 0.9998, test_f1: 0.5145
 epoch: 57, train_loss: 0.8920, test_loss: 1.0056, test_f1: 0.5046
 epoch: 58, train_loss: 0.9010, test_loss: 1.0368, test_f1: 0.4741
 epoch: 59, train_loss: 0.8942, test_loss: 1.0520, test_f1: 0.4978
 epoch: 60, train_loss: 0.8837, test_loss: 1.0239, test_f1: 0.5004
 epoch: 61, train_loss: 0.9003, test_loss: 1.0135, test_f1: 0.4901
 epoch: 62, train_loss: 0.8853, test_loss: 1.0062, test_f1: 0.5014
 epoch: 63, train_loss: 0.8860, test_loss: 1.0442, test_f1: 0.4903
 epoch: 64, train_loss: 0.8831, test_loss: 1.0709, test_f1: 0.4880
 epoch: 65, train_loss: 0.8743, test_loss: 1.1009, test_f1: 0.4834
 epoch: 66, train_loss: 0.8680, test_loss: 1.0652, test_f1: 0.4891
 epoch: 67, train_loss: 0.8723, test_loss: 1.0507, test_f1: 0.4811
 epoch: 68, train_loss: 0.8699, test_loss: 1.0950, test_f1: 0.4694
 epoch: 69, train_loss: 0.8651, test_loss: 1.0825, test_f1: 0.4696
 epoch: 70, train_loss: 0.8692, test_loss: 1.0725, test_f1: 0.4742
 epoch: 71, train_loss: 0.8660, test_loss: 1.0504, test_f1: 0.4930
 epoch: 72, train_loss: 0.8698, test_loss: 1.0960, test_f1: 0.4852
 epoch: 73, train_loss: 0.8640, test_loss: 1.0545, test_f1: 0.4953
 epoch: 74, train_loss: 0.8526, test_loss: 1.0818, test_f1: 0.4912
 epoch: 75, train_loss: 0.8627, test_loss: 1.1131, test_f1: 0.4745
 epoch: 76, train_loss: 0.8786, test_loss: 1.0971, test_f1: 0.4855
 epoch: 77, train_loss: 0.8568, test_loss: 1.1019, test_f1: 0.4801
 epoch: 78, train_loss: 0.8583, test_loss: 1.1177, test_f1: 0.4737
 epoch: 79, train_loss: 0.8526, test_loss: 1.1238, test_f1: 0.4770
 epoch: 80, train_loss: 0.8593, test_loss: 1.1146, test_f1: 0.4933
 epoch: 81, train_loss: 0.8660, test_loss: 1.0924, test_f1: 0.4961
 epoch: 82, train_loss: 0.8511, test_loss: 1.0980, test_f1: 0.4809
 epoch: 83, train_loss: 0.8547, test_loss: 1.0867, test_f1: 0.4907
 epoch: 84, train_loss: 0.8539, test_loss: 1.0927, test_f1: 0.4924
 epoch: 85, train_loss: 0.8399, test_loss: 1.1308, test_f1: 0.4901
 epoch: 86, train_loss: 0.8608, test_loss: 1.1098, test_f1: 0.4864
 epoch: 87, train_loss: 0.8383, test_loss: 1.1562, test_f1: 0.4809
 epoch: 88, train_loss: 0.8487, test_loss: 1.1250, test_f1: 0.5033
 epoch: 89, train_loss: 0.8413, test_loss: 1.1414, test_f1: 0.4893
 epoch: 90, train_loss: 0.8405, test_loss: 1.1427, test_f1: 0.5069
 epoch: 91, train_loss: 0.8308, test_loss: 1.1293, test_f1: 0.5065
 epoch: 92, train_loss: 0.8344, test_loss: 1.1401, test_f1: 0.4939
 epoch: 93, train_loss: 0.8362, test_loss: 1.1396, test_f1: 0.5224
 epoch: 94, train_loss: 0.8271, test_loss: 1.1546, test_f1: 0.5109
 epoch: 95, train_loss: 0.8371, test_loss: 1.1547, test_f1: 0.5145
 epoch: 96, train_loss: 0.8267, test_loss: 1.1732, test_f1: 0.5045
 epoch: 97, train_loss: 0.8306, test_loss: 1.1579, test_f1: 0.5133
 epoch: 98, train_loss: 0.8324, test_loss: 1.1724, test_f1: 0.5051
 epoch: 99, train_loss: 0.8164, test_loss: 1.1686, test_f1: 0.4972

Training completed in 675.11 seconds
Best F1: 0.5298 at epoch 78
Mean F1 across iterations: 0.5133  0.0132
========================FINAL RESULTS================================
FEGIN weighted F1: 0.5298  0.0132
python main.py --data ltspice_examples --representation component_component --model FEGIN --layers 4 --hiddens 64 --batch_size 64 --lr 0.0001 --emb_size 250 --epochs 100 --save_appendix component_component_L4_H64_BS64_LR0.0001_E250 --no_val
-----



STDERR:
  File "main.py", line 370, in <module>
    main()
  File "main.py", line 254, in main
    dataset = dataset_class(
  File "/home/philip/projects/ltspice_examples_code_repo/Circuit-Completion-Using-GNNs/component_classification_with_link_prediction_head/evaluation/FEGIN/kernel/circuit_datasets.py", line 15, in __init__
    self.data, self.slices = torch.load(self.processed_paths[0])
  File "/home/philip/.local/lib/python3.8/site-packages/torch/serialization.py", line 1040, in load
    warnings.warn(
  File "/usr/lib/python3.8/warnings.py", line 109, in _showwarnmsg
    sw(msg.message, msg.category, msg.filename, msg.lineno,
  File "main.py", line 47, in warn_with_traceback
    traceback.print_stack(file=log)
/home/philip/projects/ltspice_examples_code_repo/Circuit-Completion-Using-GNNs/component_classification_with_link_prediction_head/evaluation/FEGIN/kernel/circuit_datasets.py:15: FutureWarning: You are using `torch.load` with `weights_only=False` (the current default value), which uses the default pickle module implicitly. It is possible to construct malicious pickle data which will execute arbitrary code during unpickling (See https://github.com/pytorch/pytorch/blob/main/SECURITY.md#untrusted-models for more details). In a future release, the default value for `weights_only` will be flipped to `True`. This limits the functions that could be executed during unpickling. Arbitrary objects will no longer be allowed to be loaded via this mode unless they are explicitly allowlisted by the user via `torch.serialization.add_safe_globals`. We recommend you start setting `weights_only=True` for any use case where you don't have full control of the loaded file. Please open an issue on GitHub for any issues related to this experimental feature.
  self.data, self.slices = torch.load(self.processed_paths[0])
