STDOUT:
Results will be saved in /home/philip/projects/ltspice_examples_code_repo/Circuit-Completion-Using-GNNs/component_classification_with_link_prediction_head/evaluation/FEGIN/results/model_FEGIN_dataset_ltspice_examples
Command line input: python main.py --data ltspice_examples --representation component_pin --model FEGIN --layers 6 --hiddens 64 --batch_size 128 --lr 0.0001 --emb_size 250 --epochs 100 --save_appendix component_pin_L6_H64_BS128_LR0.0001_E250 --no_val
 is saved.
-----
ltspice_examples - FEGIN
Using 6 layers, 64 hidden units, h = 2
Loading component_pin representation dataset
ENTERED
Training FEGIN on component_pin representation
Train: 3560, Test: 848
##################ITERATION #0 ****************************************
 epoch: 0, train_loss: 1.3880, test_loss: 1.3844, test_f1: 0.1747
 epoch: 1, train_loss: 1.3702, test_loss: 1.3740, test_f1: 0.3282
 epoch: 2, train_loss: 1.3521, test_loss: 1.3471, test_f1: 0.2458
 epoch: 3, train_loss: 1.3261, test_loss: 1.3161, test_f1: 0.2260
 epoch: 4, train_loss: 1.2957, test_loss: 1.2824, test_f1: 0.2260
 epoch: 5, train_loss: 1.2692, test_loss: 1.2559, test_f1: 0.2260
 epoch: 6, train_loss: 1.2471, test_loss: 1.2335, test_f1: 0.2260
 epoch: 7, train_loss: 1.2306, test_loss: 1.2131, test_f1: 0.2260
 epoch: 8, train_loss: 1.2137, test_loss: 1.1920, test_f1: 0.2260
 epoch: 9, train_loss: 1.2027, test_loss: 1.1747, test_f1: 0.2286
 epoch: 10, train_loss: 1.1872, test_loss: 1.1602, test_f1: 0.3227
 epoch: 11, train_loss: 1.1718, test_loss: 1.1477, test_f1: 0.3480
 epoch: 12, train_loss: 1.1550, test_loss: 1.1330, test_f1: 0.3544
 epoch: 13, train_loss: 1.1368, test_loss: 1.1179, test_f1: 0.3533
 epoch: 14, train_loss: 1.1181, test_loss: 1.1017, test_f1: 0.4061
 epoch: 15, train_loss: 1.0950, test_loss: 1.0813, test_f1: 0.4228
 epoch: 16, train_loss: 1.0769, test_loss: 1.0589, test_f1: 0.4338
 epoch: 17, train_loss: 1.0532, test_loss: 1.0508, test_f1: 0.4468
 epoch: 18, train_loss: 1.0400, test_loss: 1.0334, test_f1: 0.4463
 epoch: 19, train_loss: 1.0202, test_loss: 1.0145, test_f1: 0.4313
 epoch: 20, train_loss: 1.0065, test_loss: 1.0145, test_f1: 0.4572
 epoch: 21, train_loss: 1.0073, test_loss: 1.0028, test_f1: 0.4454
 epoch: 22, train_loss: 0.9912, test_loss: 1.0100, test_f1: 0.4285
 epoch: 23, train_loss: 0.9819, test_loss: 1.0069, test_f1: 0.4277
 epoch: 24, train_loss: 0.9733, test_loss: 0.9980, test_f1: 0.4363
 epoch: 25, train_loss: 0.9689, test_loss: 1.0042, test_f1: 0.4971
 epoch: 26, train_loss: 0.9577, test_loss: 0.9989, test_f1: 0.4564
 epoch: 27, train_loss: 0.9611, test_loss: 0.9842, test_f1: 0.4607
 epoch: 28, train_loss: 0.9500, test_loss: 0.9969, test_f1: 0.5106
 epoch: 29, train_loss: 0.9470, test_loss: 0.9824, test_f1: 0.4710
 epoch: 30, train_loss: 0.9384, test_loss: 0.9942, test_f1: 0.4830
 epoch: 31, train_loss: 0.9402, test_loss: 0.9896, test_f1: 0.4837
 epoch: 32, train_loss: 0.9272, test_loss: 0.9896, test_f1: 0.5020
 epoch: 33, train_loss: 0.9299, test_loss: 0.9509, test_f1: 0.5205
 epoch: 34, train_loss: 0.9286, test_loss: 0.9839, test_f1: 0.4947
 epoch: 35, train_loss: 0.9198, test_loss: 0.9810, test_f1: 0.5267
 epoch: 36, train_loss: 0.9170, test_loss: 0.9806, test_f1: 0.5130
 epoch: 37, train_loss: 0.9111, test_loss: 0.9707, test_f1: 0.5306
 epoch: 38, train_loss: 0.9045, test_loss: 0.9769, test_f1: 0.5263
 epoch: 39, train_loss: 0.9066, test_loss: 0.9844, test_f1: 0.5281
 epoch: 40, train_loss: 0.9021, test_loss: 0.9793, test_f1: 0.5207
 epoch: 41, train_loss: 0.8913, test_loss: 0.9645, test_f1: 0.5125
 epoch: 42, train_loss: 0.9014, test_loss: 0.9472, test_f1: 0.5272
 epoch: 43, train_loss: 0.8818, test_loss: 0.9541, test_f1: 0.4910
 epoch: 44, train_loss: 0.8862, test_loss: 0.9592, test_f1: 0.5197
 epoch: 45, train_loss: 0.8707, test_loss: 0.9523, test_f1: 0.5350
 epoch: 46, train_loss: 0.8822, test_loss: 0.9583, test_f1: 0.5109
 epoch: 47, train_loss: 0.8742, test_loss: 0.9449, test_f1: 0.5246
 epoch: 48, train_loss: 0.8627, test_loss: 0.9280, test_f1: 0.5263
 epoch: 49, train_loss: 0.8687, test_loss: 0.9417, test_f1: 0.5035
 epoch: 50, train_loss: 0.8612, test_loss: 0.9592, test_f1: 0.5119
 epoch: 51, train_loss: 0.8555, test_loss: 0.9371, test_f1: 0.5178
 epoch: 52, train_loss: 0.8511, test_loss: 0.9470, test_f1: 0.5151
 epoch: 53, train_loss: 0.8462, test_loss: 0.9249, test_f1: 0.5198
 epoch: 54, train_loss: 0.8353, test_loss: 0.9321, test_f1: 0.5299
 epoch: 55, train_loss: 0.8414, test_loss: 0.9293, test_f1: 0.5251
 epoch: 56, train_loss: 0.8362, test_loss: 0.9199, test_f1: 0.5310
 epoch: 57, train_loss: 0.8404, test_loss: 0.9277, test_f1: 0.5207
 epoch: 58, train_loss: 0.8350, test_loss: 0.9313, test_f1: 0.5141
 epoch: 59, train_loss: 0.8281, test_loss: 0.9137, test_f1: 0.5356
 epoch: 60, train_loss: 0.8233, test_loss: 0.9394, test_f1: 0.5285
 epoch: 61, train_loss: 0.8221, test_loss: 0.9369, test_f1: 0.5297
 epoch: 62, train_loss: 0.8153, test_loss: 0.9314, test_f1: 0.5232
 epoch: 63, train_loss: 0.8175, test_loss: 0.9421, test_f1: 0.5221
 epoch: 64, train_loss: 0.8252, test_loss: 0.9315, test_f1: 0.5286
 epoch: 65, train_loss: 0.8120, test_loss: 0.9491, test_f1: 0.5279
 epoch: 66, train_loss: 0.8128, test_loss: 0.9397, test_f1: 0.5159
 epoch: 67, train_loss: 0.8124, test_loss: 0.9122, test_f1: 0.5276
 epoch: 68, train_loss: 0.8160, test_loss: 0.9316, test_f1: 0.5302
 epoch: 69, train_loss: 0.8156, test_loss: 0.9326, test_f1: 0.5333
 epoch: 70, train_loss: 0.8061, test_loss: 0.9334, test_f1: 0.5387
 epoch: 71, train_loss: 0.8155, test_loss: 0.9429, test_f1: 0.5347
 epoch: 72, train_loss: 0.8010, test_loss: 0.9287, test_f1: 0.5406
 epoch: 73, train_loss: 0.8004, test_loss: 0.9247, test_f1: 0.5393
 epoch: 74, train_loss: 0.7981, test_loss: 0.9466, test_f1: 0.5404
 epoch: 75, train_loss: 0.7928, test_loss: 0.9244, test_f1: 0.5285
 epoch: 76, train_loss: 0.7894, test_loss: 0.9406, test_f1: 0.5345
 epoch: 77, train_loss: 0.7847, test_loss: 0.9275, test_f1: 0.5363
 epoch: 78, train_loss: 0.7864, test_loss: 0.9448, test_f1: 0.5485
 epoch: 79, train_loss: 0.7867, test_loss: 0.9310, test_f1: 0.5365
 epoch: 80, train_loss: 0.7982, test_loss: 0.9270, test_f1: 0.5364
 epoch: 81, train_loss: 0.7854, test_loss: 0.9488, test_f1: 0.5269
 epoch: 82, train_loss: 0.7855, test_loss: 0.9448, test_f1: 0.5208
 epoch: 83, train_loss: 0.7794, test_loss: 0.9312, test_f1: 0.5379
 epoch: 84, train_loss: 0.7799, test_loss: 0.9256, test_f1: 0.5389
 epoch: 85, train_loss: 0.7772, test_loss: 0.9410, test_f1: 0.5253
 epoch: 86, train_loss: 0.7781, test_loss: 0.9333, test_f1: 0.5449
 epoch: 87, train_loss: 0.7659, test_loss: 0.9400, test_f1: 0.5419
 epoch: 88, train_loss: 0.7658, test_loss: 0.9102, test_f1: 0.5501
 epoch: 89, train_loss: 0.7629, test_loss: 0.9201, test_f1: 0.5379
 epoch: 90, train_loss: 0.7589, test_loss: 0.9271, test_f1: 0.5371
 epoch: 91, train_loss: 0.7652, test_loss: 0.9272, test_f1: 0.5371
 epoch: 92, train_loss: 0.7519, test_loss: 0.9174, test_f1: 0.5332
 epoch: 93, train_loss: 0.7604, test_loss: 0.9181, test_f1: 0.5546
 epoch: 94, train_loss: 0.7614, test_loss: 0.9234, test_f1: 0.5397
 epoch: 95, train_loss: 0.7544, test_loss: 0.9407, test_f1: 0.5336
 epoch: 96, train_loss: 0.7523, test_loss: 0.9267, test_f1: 0.5400
 epoch: 97, train_loss: 0.7507, test_loss: 0.9318, test_f1: 0.5409
 epoch: 98, train_loss: 0.7476, test_loss: 0.9157, test_f1: 0.5532
 epoch: 99, train_loss: 0.7476, test_loss: 0.9409, test_f1: 0.5335
##################ITERATION #1 ****************************************
 epoch: 0, train_loss: 1.3542, test_loss: 1.3575, test_f1: 0.2462
 epoch: 1, train_loss: 1.3109, test_loss: 1.3439, test_f1: 0.2260
 epoch: 2, train_loss: 1.2771, test_loss: 1.2670, test_f1: 0.2429
 epoch: 3, train_loss: 1.2422, test_loss: 1.2164, test_f1: 0.3299
 epoch: 4, train_loss: 1.2046, test_loss: 1.1768, test_f1: 0.3352
 epoch: 5, train_loss: 1.1722, test_loss: 1.1411, test_f1: 0.3410
 epoch: 6, train_loss: 1.1405, test_loss: 1.1143, test_f1: 0.3418
 epoch: 7, train_loss: 1.1095, test_loss: 1.0916, test_f1: 0.3360
 epoch: 8, train_loss: 1.0860, test_loss: 1.0693, test_f1: 0.3577
 epoch: 9, train_loss: 1.0593, test_loss: 1.0586, test_f1: 0.3787
 epoch: 10, train_loss: 1.0408, test_loss: 1.0472, test_f1: 0.4170
 epoch: 11, train_loss: 1.0280, test_loss: 1.0377, test_f1: 0.4202
 epoch: 12, train_loss: 1.0217, test_loss: 1.0313, test_f1: 0.4551
 epoch: 13, train_loss: 1.0036, test_loss: 1.0257, test_f1: 0.4460
 epoch: 14, train_loss: 0.9964, test_loss: 1.0230, test_f1: 0.4662
 epoch: 15, train_loss: 0.9877, test_loss: 1.0112, test_f1: 0.4963
 epoch: 16, train_loss: 0.9750, test_loss: 1.0062, test_f1: 0.4822
 epoch: 17, train_loss: 0.9638, test_loss: 1.0065, test_f1: 0.5103
 epoch: 18, train_loss: 0.9681, test_loss: 0.9954, test_f1: 0.5249
 epoch: 19, train_loss: 0.9451, test_loss: 0.9947, test_f1: 0.5272
 epoch: 20, train_loss: 0.9460, test_loss: 0.9964, test_f1: 0.5080
 epoch: 21, train_loss: 0.9301, test_loss: 0.9852, test_f1: 0.5152
 epoch: 22, train_loss: 0.9300, test_loss: 0.9880, test_f1: 0.5423
 epoch: 23, train_loss: 0.9223, test_loss: 0.9831, test_f1: 0.5063
 epoch: 24, train_loss: 0.9126, test_loss: 0.9718, test_f1: 0.5135
 epoch: 25, train_loss: 0.9049, test_loss: 0.9737, test_f1: 0.5109
 epoch: 26, train_loss: 0.8929, test_loss: 0.9791, test_f1: 0.5193
 epoch: 27, train_loss: 0.8905, test_loss: 0.9773, test_f1: 0.5204
 epoch: 28, train_loss: 0.8854, test_loss: 0.9664, test_f1: 0.5255
 epoch: 29, train_loss: 0.8735, test_loss: 0.9865, test_f1: 0.5229
 epoch: 30, train_loss: 0.8729, test_loss: 0.9744, test_f1: 0.5280
 epoch: 31, train_loss: 0.8732, test_loss: 0.9787, test_f1: 0.5143
 epoch: 32, train_loss: 0.8691, test_loss: 0.9866, test_f1: 0.5180
 epoch: 33, train_loss: 0.8567, test_loss: 0.9639, test_f1: 0.5354
 epoch: 34, train_loss: 0.8488, test_loss: 0.9766, test_f1: 0.5001
 epoch: 35, train_loss: 0.8443, test_loss: 0.9751, test_f1: 0.5099
 epoch: 36, train_loss: 0.8471, test_loss: 0.9708, test_f1: 0.5067
 epoch: 37, train_loss: 0.8257, test_loss: 0.9589, test_f1: 0.5116
 epoch: 38, train_loss: 0.8266, test_loss: 0.9792, test_f1: 0.5142
 epoch: 39, train_loss: 0.8215, test_loss: 0.9467, test_f1: 0.5340
 epoch: 40, train_loss: 0.8191, test_loss: 0.9662, test_f1: 0.5368
 epoch: 41, train_loss: 0.8049, test_loss: 0.9610, test_f1: 0.5314
 epoch: 42, train_loss: 0.8021, test_loss: 0.9663, test_f1: 0.5080
 epoch: 43, train_loss: 0.7933, test_loss: 0.9498, test_f1: 0.5220
 epoch: 44, train_loss: 0.8010, test_loss: 0.9621, test_f1: 0.5422
 epoch: 45, train_loss: 0.7929, test_loss: 0.9699, test_f1: 0.5231
 epoch: 46, train_loss: 0.7845, test_loss: 0.9608, test_f1: 0.5146
 epoch: 47, train_loss: 0.7909, test_loss: 0.9588, test_f1: 0.5185
 epoch: 48, train_loss: 0.7765, test_loss: 0.9537, test_f1: 0.5252
 epoch: 49, train_loss: 0.7732, test_loss: 0.9630, test_f1: 0.5191
 epoch: 50, train_loss: 0.7582, test_loss: 0.9489, test_f1: 0.5381
 epoch: 51, train_loss: 0.7584, test_loss: 0.9625, test_f1: 0.5072
 epoch: 52, train_loss: 0.7570, test_loss: 0.9374, test_f1: 0.5478
 epoch: 53, train_loss: 0.7490, test_loss: 0.9472, test_f1: 0.5319
 epoch: 54, train_loss: 0.7516, test_loss: 0.9408, test_f1: 0.5387
 epoch: 55, train_loss: 0.7361, test_loss: 0.9345, test_f1: 0.5364
 epoch: 56, train_loss: 0.7390, test_loss: 0.9474, test_f1: 0.5276
 epoch: 57, train_loss: 0.7361, test_loss: 0.9628, test_f1: 0.5300
 epoch: 58, train_loss: 0.7355, test_loss: 0.9387, test_f1: 0.5435
 epoch: 59, train_loss: 0.7391, test_loss: 0.9656, test_f1: 0.5289
 epoch: 60, train_loss: 0.7324, test_loss: 0.9515, test_f1: 0.5397
 epoch: 61, train_loss: 0.7261, test_loss: 0.9671, test_f1: 0.5195
 epoch: 62, train_loss: 0.7318, test_loss: 0.9580, test_f1: 0.5295
 epoch: 63, train_loss: 0.7345, test_loss: 0.9532, test_f1: 0.5400
 epoch: 64, train_loss: 0.7257, test_loss: 0.9518, test_f1: 0.5221
 epoch: 65, train_loss: 0.7196, test_loss: 0.9539, test_f1: 0.5320
 epoch: 66, train_loss: 0.7206, test_loss: 0.9708, test_f1: 0.5429
 epoch: 67, train_loss: 0.7114, test_loss: 0.9694, test_f1: 0.5176
 epoch: 68, train_loss: 0.7117, test_loss: 0.9716, test_f1: 0.5333
 epoch: 69, train_loss: 0.7118, test_loss: 0.9684, test_f1: 0.5354
 epoch: 70, train_loss: 0.7091, test_loss: 0.9727, test_f1: 0.5341
 epoch: 71, train_loss: 0.6996, test_loss: 0.9796, test_f1: 0.5266
 epoch: 72, train_loss: 0.7105, test_loss: 0.9838, test_f1: 0.5256
 epoch: 73, train_loss: 0.7093, test_loss: 0.9848, test_f1: 0.5353
 epoch: 74, train_loss: 0.6961, test_loss: 0.9701, test_f1: 0.5180
 epoch: 75, train_loss: 0.7086, test_loss: 0.9518, test_f1: 0.5439
 epoch: 76, train_loss: 0.7084, test_loss: 0.9785, test_f1: 0.5265
 epoch: 77, train_loss: 0.7006, test_loss: 0.9851, test_f1: 0.5435
 epoch: 78, train_loss: 0.6867, test_loss: 0.9925, test_f1: 0.5297
 epoch: 79, train_loss: 0.6858, test_loss: 0.9805, test_f1: 0.5227
 epoch: 80, train_loss: 0.6989, test_loss: 0.9870, test_f1: 0.5214
 epoch: 81, train_loss: 0.7006, test_loss: 0.9928, test_f1: 0.5143
 epoch: 82, train_loss: 0.6815, test_loss: 1.0016, test_f1: 0.5205
 epoch: 83, train_loss: 0.6892, test_loss: 0.9846, test_f1: 0.5220
 epoch: 84, train_loss: 0.6854, test_loss: 0.9908, test_f1: 0.5260
 epoch: 85, train_loss: 0.6879, test_loss: 1.0022, test_f1: 0.5104
 epoch: 86, train_loss: 0.6803, test_loss: 0.9998, test_f1: 0.5237
 epoch: 87, train_loss: 0.6858, test_loss: 0.9905, test_f1: 0.5306
 epoch: 88, train_loss: 0.6719, test_loss: 0.9903, test_f1: 0.5296
 epoch: 89, train_loss: 0.6694, test_loss: 0.9910, test_f1: 0.5228
 epoch: 90, train_loss: 0.6730, test_loss: 1.0108, test_f1: 0.5315
 epoch: 91, train_loss: 0.6670, test_loss: 1.0072, test_f1: 0.5169
 epoch: 92, train_loss: 0.6701, test_loss: 1.0135, test_f1: 0.5171
 epoch: 93, train_loss: 0.6675, test_loss: 1.0266, test_f1: 0.5175
 epoch: 94, train_loss: 0.6809, test_loss: 1.0152, test_f1: 0.5262
 epoch: 95, train_loss: 0.6682, test_loss: 1.0215, test_f1: 0.5197
 epoch: 96, train_loss: 0.6825, test_loss: 1.0162, test_f1: 0.5186
 epoch: 97, train_loss: 0.6613, test_loss: 1.0122, test_f1: 0.5200
 epoch: 98, train_loss: 0.6612, test_loss: 1.0088, test_f1: 0.5226
 epoch: 99, train_loss: 0.6612, test_loss: 1.0078, test_f1: 0.5255
##################ITERATION #2 ****************************************
 epoch: 0, train_loss: 1.3279, test_loss: 1.3424, test_f1: 0.2260
 epoch: 1, train_loss: 1.2845, test_loss: 1.2943, test_f1: 0.2757
 epoch: 2, train_loss: 1.2514, test_loss: 1.2283, test_f1: 0.3715
 epoch: 3, train_loss: 1.2148, test_loss: 1.1805, test_f1: 0.4229
 epoch: 4, train_loss: 1.1829, test_loss: 1.1408, test_f1: 0.4203
 epoch: 5, train_loss: 1.1466, test_loss: 1.1062, test_f1: 0.4398
 epoch: 6, train_loss: 1.1136, test_loss: 1.0808, test_f1: 0.4249
 epoch: 7, train_loss: 1.0868, test_loss: 1.0632, test_f1: 0.4284
 epoch: 8, train_loss: 1.0564, test_loss: 1.0380, test_f1: 0.4389
 epoch: 9, train_loss: 1.0438, test_loss: 1.0241, test_f1: 0.4524
 epoch: 10, train_loss: 1.0251, test_loss: 1.0185, test_f1: 0.4498
 epoch: 11, train_loss: 1.0168, test_loss: 1.0161, test_f1: 0.4488
 epoch: 12, train_loss: 0.9972, test_loss: 0.9987, test_f1: 0.4625
 epoch: 13, train_loss: 0.9874, test_loss: 1.0008, test_f1: 0.4789
 epoch: 14, train_loss: 0.9738, test_loss: 0.9746, test_f1: 0.4785
 epoch: 15, train_loss: 0.9630, test_loss: 0.9851, test_f1: 0.4770
 epoch: 16, train_loss: 0.9502, test_loss: 0.9846, test_f1: 0.4824
 epoch: 17, train_loss: 0.9400, test_loss: 0.9493, test_f1: 0.4791
 epoch: 18, train_loss: 0.9356, test_loss: 0.9600, test_f1: 0.4712
 epoch: 19, train_loss: 0.9343, test_loss: 0.9500, test_f1: 0.4871
 epoch: 20, train_loss: 0.9192, test_loss: 0.9458, test_f1: 0.4774
 epoch: 21, train_loss: 0.9069, test_loss: 0.9433, test_f1: 0.4908
 epoch: 22, train_loss: 0.9015, test_loss: 0.9347, test_f1: 0.5065
 epoch: 23, train_loss: 0.8960, test_loss: 0.9304, test_f1: 0.5012
 epoch: 24, train_loss: 0.8929, test_loss: 0.9422, test_f1: 0.4985
 epoch: 25, train_loss: 0.8755, test_loss: 0.9388, test_f1: 0.4982
 epoch: 26, train_loss: 0.8771, test_loss: 0.9132, test_f1: 0.5043
 epoch: 27, train_loss: 0.8631, test_loss: 0.9625, test_f1: 0.4965
 epoch: 28, train_loss: 0.8662, test_loss: 0.9249, test_f1: 0.4901
 epoch: 29, train_loss: 0.8519, test_loss: 0.9619, test_f1: 0.4903
 epoch: 30, train_loss: 0.8533, test_loss: 0.9509, test_f1: 0.4901
 epoch: 31, train_loss: 0.8458, test_loss: 0.9249, test_f1: 0.5090
 epoch: 32, train_loss: 0.8354, test_loss: 0.9513, test_f1: 0.4864
 epoch: 33, train_loss: 0.8393, test_loss: 0.9484, test_f1: 0.5053
 epoch: 34, train_loss: 0.8281, test_loss: 0.9345, test_f1: 0.4953
 epoch: 35, train_loss: 0.8300, test_loss: 0.9416, test_f1: 0.5021
 epoch: 36, train_loss: 0.8144, test_loss: 0.9340, test_f1: 0.5028
 epoch: 37, train_loss: 0.7951, test_loss: 0.9553, test_f1: 0.4936
 epoch: 38, train_loss: 0.7988, test_loss: 0.9313, test_f1: 0.5069
 epoch: 39, train_loss: 0.7916, test_loss: 0.9197, test_f1: 0.4954
 epoch: 40, train_loss: 0.7958, test_loss: 0.9341, test_f1: 0.5022
 epoch: 41, train_loss: 0.7956, test_loss: 0.9465, test_f1: 0.5005
 epoch: 42, train_loss: 0.7893, test_loss: 0.9086, test_f1: 0.5193
 epoch: 43, train_loss: 0.7752, test_loss: 1.0077, test_f1: 0.4971
 epoch: 44, train_loss: 0.7717, test_loss: 0.9768, test_f1: 0.4950
 epoch: 45, train_loss: 0.7665, test_loss: 0.9828, test_f1: 0.5098
 epoch: 46, train_loss: 0.7644, test_loss: 0.9697, test_f1: 0.5092
 epoch: 47, train_loss: 0.7618, test_loss: 0.9687, test_f1: 0.5059
 epoch: 48, train_loss: 0.7633, test_loss: 0.9549, test_f1: 0.5157
 epoch: 49, train_loss: 0.7445, test_loss: 0.9504, test_f1: 0.5065
 epoch: 50, train_loss: 0.7466, test_loss: 0.9367, test_f1: 0.5267
 epoch: 51, train_loss: 0.7323, test_loss: 0.9766, test_f1: 0.5126
 epoch: 52, train_loss: 0.7347, test_loss: 0.9953, test_f1: 0.5107
 epoch: 53, train_loss: 0.7412, test_loss: 1.0023, test_f1: 0.5115
 epoch: 54, train_loss: 0.7278, test_loss: 0.9883, test_f1: 0.5157
 epoch: 55, train_loss: 0.7241, test_loss: 0.9923, test_f1: 0.5075
 epoch: 56, train_loss: 0.7174, test_loss: 1.0183, test_f1: 0.5101
 epoch: 57, train_loss: 0.7240, test_loss: 0.9683, test_f1: 0.5163
 epoch: 58, train_loss: 0.7128, test_loss: 0.9770, test_f1: 0.5239
 epoch: 59, train_loss: 0.7194, test_loss: 1.0223, test_f1: 0.5115
 epoch: 60, train_loss: 0.7119, test_loss: 1.0199, test_f1: 0.5077
 epoch: 61, train_loss: 0.7102, test_loss: 0.9868, test_f1: 0.5444
 epoch: 62, train_loss: 0.7093, test_loss: 0.9891, test_f1: 0.5225
 epoch: 63, train_loss: 0.7083, test_loss: 1.0000, test_f1: 0.5232
 epoch: 64, train_loss: 0.7109, test_loss: 0.9772, test_f1: 0.5386
 epoch: 65, train_loss: 0.7045, test_loss: 1.0141, test_f1: 0.5154
 epoch: 66, train_loss: 0.6974, test_loss: 1.0428, test_f1: 0.5074
 epoch: 67, train_loss: 0.7048, test_loss: 1.0649, test_f1: 0.4984
 epoch: 68, train_loss: 0.6911, test_loss: 1.0823, test_f1: 0.5029
 epoch: 69, train_loss: 0.6983, test_loss: 1.0130, test_f1: 0.5206
 epoch: 70, train_loss: 0.6908, test_loss: 1.0140, test_f1: 0.5233
 epoch: 71, train_loss: 0.6882, test_loss: 1.0104, test_f1: 0.5191
 epoch: 72, train_loss: 0.6851, test_loss: 1.0264, test_f1: 0.5212
 epoch: 73, train_loss: 0.6973, test_loss: 1.0095, test_f1: 0.5093
 epoch: 74, train_loss: 0.7044, test_loss: 1.1020, test_f1: 0.5300
 epoch: 75, train_loss: 0.6984, test_loss: 1.0434, test_f1: 0.5216
 epoch: 76, train_loss: 0.6856, test_loss: 1.0976, test_f1: 0.5158
 epoch: 77, train_loss: 0.6852, test_loss: 1.0194, test_f1: 0.5230
 epoch: 78, train_loss: 0.6816, test_loss: 1.0378, test_f1: 0.5301
 epoch: 79, train_loss: 0.6747, test_loss: 1.0617, test_f1: 0.5161
 epoch: 80, train_loss: 0.6791, test_loss: 1.0608, test_f1: 0.5105
 epoch: 81, train_loss: 0.6731, test_loss: 1.0857, test_f1: 0.5372
 epoch: 82, train_loss: 0.6698, test_loss: 1.1075, test_f1: 0.5087
 epoch: 83, train_loss: 0.6811, test_loss: 1.1340, test_f1: 0.5123
 epoch: 84, train_loss: 0.6726, test_loss: 1.0982, test_f1: 0.5263
 epoch: 85, train_loss: 0.6729, test_loss: 1.0604, test_f1: 0.5082
 epoch: 86, train_loss: 0.6738, test_loss: 1.1077, test_f1: 0.5240
 epoch: 87, train_loss: 0.6746, test_loss: 1.0569, test_f1: 0.5296
 epoch: 88, train_loss: 0.6534, test_loss: 1.0741, test_f1: 0.5357
 epoch: 89, train_loss: 0.6714, test_loss: 1.0585, test_f1: 0.5181
 epoch: 90, train_loss: 0.6681, test_loss: 1.0722, test_f1: 0.5437
 epoch: 91, train_loss: 0.6657, test_loss: 1.1421, test_f1: 0.5022
 epoch: 92, train_loss: 0.6642, test_loss: 1.0780, test_f1: 0.5309
 epoch: 93, train_loss: 0.6557, test_loss: 1.0483, test_f1: 0.5497
 epoch: 94, train_loss: 0.6695, test_loss: 1.1218, test_f1: 0.5221
 epoch: 95, train_loss: 0.6615, test_loss: 1.0552, test_f1: 0.5204
 epoch: 96, train_loss: 0.6601, test_loss: 1.0896, test_f1: 0.5257
 epoch: 97, train_loss: 0.6547, test_loss: 1.1262, test_f1: 0.5238
 epoch: 98, train_loss: 0.6499, test_loss: 1.1014, test_f1: 0.5097
 epoch: 99, train_loss: 0.6601, test_loss: 1.1393, test_f1: 0.5010
##################ITERATION #3 ****************************************
 epoch: 0, train_loss: 1.2985, test_loss: 1.3069, test_f1: 0.2260
 epoch: 1, train_loss: 1.2500, test_loss: 1.2772, test_f1: 0.2260
 epoch: 2, train_loss: 1.2177, test_loss: 1.2146, test_f1: 0.2408
 epoch: 3, train_loss: 1.1835, test_loss: 1.1390, test_f1: 0.4459
 epoch: 4, train_loss: 1.1522, test_loss: 1.0998, test_f1: 0.4581
 epoch: 5, train_loss: 1.1207, test_loss: 1.0713, test_f1: 0.4619
 epoch: 6, train_loss: 1.0925, test_loss: 1.0445, test_f1: 0.4601
 epoch: 7, train_loss: 1.0672, test_loss: 1.0237, test_f1: 0.4834
 epoch: 8, train_loss: 1.0487, test_loss: 1.0098, test_f1: 0.4939
 epoch: 9, train_loss: 1.0311, test_loss: 0.9961, test_f1: 0.4891
 epoch: 10, train_loss: 1.0129, test_loss: 0.9853, test_f1: 0.4862
 epoch: 11, train_loss: 0.9939, test_loss: 0.9756, test_f1: 0.4889
 epoch: 12, train_loss: 0.9884, test_loss: 0.9639, test_f1: 0.4921
 epoch: 13, train_loss: 0.9689, test_loss: 0.9594, test_f1: 0.4851
 epoch: 14, train_loss: 0.9605, test_loss: 0.9584, test_f1: 0.4890
 epoch: 15, train_loss: 0.9410, test_loss: 0.9524, test_f1: 0.4828
 epoch: 16, train_loss: 0.9332, test_loss: 0.9426, test_f1: 0.4837
 epoch: 17, train_loss: 0.9311, test_loss: 0.9524, test_f1: 0.4849
 epoch: 18, train_loss: 0.9250, test_loss: 0.9366, test_f1: 0.4839
 epoch: 19, train_loss: 0.9088, test_loss: 0.9397, test_f1: 0.4882
 epoch: 20, train_loss: 0.9085, test_loss: 0.9371, test_f1: 0.5021
 epoch: 21, train_loss: 0.8967, test_loss: 0.9409, test_f1: 0.5021
 epoch: 22, train_loss: 0.8888, test_loss: 0.9225, test_f1: 0.4982
 epoch: 23, train_loss: 0.8780, test_loss: 0.9155, test_f1: 0.5132
 epoch: 24, train_loss: 0.8688, test_loss: 0.9250, test_f1: 0.4987
 epoch: 25, train_loss: 0.8684, test_loss: 0.9177, test_f1: 0.4996
 epoch: 26, train_loss: 0.8610, test_loss: 0.9278, test_f1: 0.4990
 epoch: 27, train_loss: 0.8610, test_loss: 0.9246, test_f1: 0.5091
 epoch: 28, train_loss: 0.8382, test_loss: 0.9329, test_f1: 0.5070
 epoch: 29, train_loss: 0.8405, test_loss: 0.9331, test_f1: 0.5180
 epoch: 30, train_loss: 0.8346, test_loss: 0.9116, test_f1: 0.5243
 epoch: 31, train_loss: 0.8275, test_loss: 0.9341, test_f1: 0.5026
 epoch: 32, train_loss: 0.8217, test_loss: 0.9035, test_f1: 0.5251
 epoch: 33, train_loss: 0.8158, test_loss: 0.9405, test_f1: 0.5110
 epoch: 34, train_loss: 0.8084, test_loss: 0.9204, test_f1: 0.5247
 epoch: 35, train_loss: 0.7992, test_loss: 0.9438, test_f1: 0.5255
 epoch: 36, train_loss: 0.7985, test_loss: 0.9173, test_f1: 0.5353
 epoch: 37, train_loss: 0.7932, test_loss: 0.9093, test_f1: 0.5225
 epoch: 38, train_loss: 0.7889, test_loss: 0.8851, test_f1: 0.5470
 epoch: 39, train_loss: 0.7813, test_loss: 0.9123, test_f1: 0.5387
 epoch: 40, train_loss: 0.7756, test_loss: 0.9134, test_f1: 0.5445
 epoch: 41, train_loss: 0.7595, test_loss: 0.9143, test_f1: 0.5425
 epoch: 42, train_loss: 0.7670, test_loss: 0.8958, test_f1: 0.5347
 epoch: 43, train_loss: 0.7646, test_loss: 0.9068, test_f1: 0.5420
 epoch: 44, train_loss: 0.7495, test_loss: 0.9015, test_f1: 0.5326
 epoch: 45, train_loss: 0.7464, test_loss: 0.9155, test_f1: 0.5608
 epoch: 46, train_loss: 0.7360, test_loss: 0.9323, test_f1: 0.5375
 epoch: 47, train_loss: 0.7441, test_loss: 0.9187, test_f1: 0.5532
 epoch: 48, train_loss: 0.7379, test_loss: 0.9364, test_f1: 0.5458
 epoch: 49, train_loss: 0.7141, test_loss: 0.9308, test_f1: 0.5525
 epoch: 50, train_loss: 0.7231, test_loss: 0.9395, test_f1: 0.5411
 epoch: 51, train_loss: 0.7061, test_loss: 0.9279, test_f1: 0.5547
 epoch: 52, train_loss: 0.7003, test_loss: 0.9526, test_f1: 0.5397
 epoch: 53, train_loss: 0.7193, test_loss: 0.9473, test_f1: 0.5345
 epoch: 54, train_loss: 0.6979, test_loss: 0.9340, test_f1: 0.5562
 epoch: 55, train_loss: 0.6961, test_loss: 0.9502, test_f1: 0.5507
 epoch: 56, train_loss: 0.6945, test_loss: 0.9302, test_f1: 0.5479
 epoch: 57, train_loss: 0.7018, test_loss: 0.9232, test_f1: 0.5518
 epoch: 58, train_loss: 0.6941, test_loss: 0.9401, test_f1: 0.5467
 epoch: 59, train_loss: 0.6815, test_loss: 0.9385, test_f1: 0.5448
 epoch: 60, train_loss: 0.6870, test_loss: 0.9339, test_f1: 0.5446
 epoch: 61, train_loss: 0.6812, test_loss: 0.9447, test_f1: 0.5531
 epoch: 62, train_loss: 0.6840, test_loss: 0.9338, test_f1: 0.5362
 epoch: 63, train_loss: 0.6753, test_loss: 0.9611, test_f1: 0.5496
 epoch: 64, train_loss: 0.6722, test_loss: 0.9413, test_f1: 0.5512
 epoch: 65, train_loss: 0.6691, test_loss: 0.9356, test_f1: 0.5546
 epoch: 66, train_loss: 0.6569, test_loss: 0.9398, test_f1: 0.5511
 epoch: 67, train_loss: 0.6806, test_loss: 0.9559, test_f1: 0.5513
 epoch: 68, train_loss: 0.6617, test_loss: 0.9509, test_f1: 0.5396
 epoch: 69, train_loss: 0.6680, test_loss: 0.9583, test_f1: 0.5523
 epoch: 70, train_loss: 0.6668, test_loss: 0.9482, test_f1: 0.5402
 epoch: 71, train_loss: 0.6520, test_loss: 0.9476, test_f1: 0.5488
 epoch: 72, train_loss: 0.6659, test_loss: 0.9756, test_f1: 0.5406
 epoch: 73, train_loss: 0.6528, test_loss: 0.9525, test_f1: 0.5534
 epoch: 74, train_loss: 0.6595, test_loss: 0.9609, test_f1: 0.5544
 epoch: 75, train_loss: 0.6528, test_loss: 0.9708, test_f1: 0.5513
 epoch: 76, train_loss: 0.6436, test_loss: 0.9641, test_f1: 0.5540
 epoch: 77, train_loss: 0.6438, test_loss: 0.9589, test_f1: 0.5457
 epoch: 78, train_loss: 0.6496, test_loss: 0.9552, test_f1: 0.5507
 epoch: 79, train_loss: 0.6429, test_loss: 0.9648, test_f1: 0.5571
 epoch: 80, train_loss: 0.6578, test_loss: 0.9539, test_f1: 0.5471
 epoch: 81, train_loss: 0.6436, test_loss: 0.9672, test_f1: 0.5439
 epoch: 82, train_loss: 0.6422, test_loss: 0.9792, test_f1: 0.5556
 epoch: 83, train_loss: 0.6321, test_loss: 0.9740, test_f1: 0.5394
 epoch: 84, train_loss: 0.6330, test_loss: 0.9610, test_f1: 0.5477
 epoch: 85, train_loss: 0.6399, test_loss: 0.9877, test_f1: 0.5443
 epoch: 86, train_loss: 0.6352, test_loss: 0.9651, test_f1: 0.5568
 epoch: 87, train_loss: 0.6323, test_loss: 0.9755, test_f1: 0.5596
 epoch: 88, train_loss: 0.6169, test_loss: 0.9837, test_f1: 0.5534
 epoch: 89, train_loss: 0.6312, test_loss: 0.9679, test_f1: 0.5598
 epoch: 90, train_loss: 0.6183, test_loss: 0.9657, test_f1: 0.5461
 epoch: 91, train_loss: 0.6270, test_loss: 0.9767, test_f1: 0.5538
 epoch: 92, train_loss: 0.6418, test_loss: 0.9783, test_f1: 0.5474
 epoch: 93, train_loss: 0.6270, test_loss: 0.9728, test_f1: 0.5544
 epoch: 94, train_loss: 0.6220, test_loss: 0.9769, test_f1: 0.5465
 epoch: 95, train_loss: 0.6180, test_loss: 0.9829, test_f1: 0.5508
 epoch: 96, train_loss: 0.6159, test_loss: 0.9756, test_f1: 0.5527
 epoch: 97, train_loss: 0.6216, test_loss: 0.9943, test_f1: 0.5455
 epoch: 98, train_loss: 0.6088, test_loss: 0.9835, test_f1: 0.5523
 epoch: 99, train_loss: 0.6192, test_loss: 0.9989, test_f1: 0.5478
##################ITERATION #4 ****************************************
 epoch: 0, train_loss: 1.2849, test_loss: 1.2878, test_f1: 0.2260
 epoch: 1, train_loss: 1.2327, test_loss: 1.2505, test_f1: 0.2260
 epoch: 2, train_loss: 1.1968, test_loss: 1.1652, test_f1: 0.3219
 epoch: 3, train_loss: 1.1610, test_loss: 1.1136, test_f1: 0.4233
 epoch: 4, train_loss: 1.1248, test_loss: 1.0796, test_f1: 0.4630
 epoch: 5, train_loss: 1.0891, test_loss: 1.0536, test_f1: 0.4628
 epoch: 6, train_loss: 1.0606, test_loss: 1.0335, test_f1: 0.4558
 epoch: 7, train_loss: 1.0399, test_loss: 1.0238, test_f1: 0.4609
 epoch: 8, train_loss: 1.0169, test_loss: 1.0083, test_f1: 0.4627
 epoch: 9, train_loss: 1.0041, test_loss: 1.0067, test_f1: 0.4661
 epoch: 10, train_loss: 0.9953, test_loss: 1.0140, test_f1: 0.4637
 epoch: 11, train_loss: 0.9759, test_loss: 0.9944, test_f1: 0.4678
 epoch: 12, train_loss: 0.9615, test_loss: 0.9968, test_f1: 0.5040
 epoch: 13, train_loss: 0.9583, test_loss: 0.9836, test_f1: 0.4922
 epoch: 14, train_loss: 0.9442, test_loss: 0.9811, test_f1: 0.4933
 epoch: 15, train_loss: 0.9362, test_loss: 0.9818, test_f1: 0.5013
 epoch: 16, train_loss: 0.9245, test_loss: 0.9748, test_f1: 0.5047
 epoch: 17, train_loss: 0.9058, test_loss: 0.9696, test_f1: 0.5185
 epoch: 18, train_loss: 0.9115, test_loss: 0.9681, test_f1: 0.5237
 epoch: 19, train_loss: 0.9007, test_loss: 0.9683, test_f1: 0.5185
 epoch: 20, train_loss: 0.8982, test_loss: 0.9529, test_f1: 0.5301
 epoch: 21, train_loss: 0.8929, test_loss: 0.9449, test_f1: 0.5174
 epoch: 22, train_loss: 0.8756, test_loss: 0.9480, test_f1: 0.5311
 epoch: 23, train_loss: 0.8603, test_loss: 0.9509, test_f1: 0.5238
 epoch: 24, train_loss: 0.8704, test_loss: 0.9690, test_f1: 0.5316
 epoch: 25, train_loss: 0.8529, test_loss: 0.9618, test_f1: 0.5229
 epoch: 26, train_loss: 0.8546, test_loss: 0.9378, test_f1: 0.5371
 epoch: 27, train_loss: 0.8420, test_loss: 0.9509, test_f1: 0.5243
 epoch: 28, train_loss: 0.8451, test_loss: 0.9333, test_f1: 0.5295
 epoch: 29, train_loss: 0.8415, test_loss: 0.9874, test_f1: 0.5289
 epoch: 30, train_loss: 0.8224, test_loss: 0.9326, test_f1: 0.5452
 epoch: 31, train_loss: 0.8329, test_loss: 0.9623, test_f1: 0.5324
 epoch: 32, train_loss: 0.8217, test_loss: 0.9468, test_f1: 0.5244
 epoch: 33, train_loss: 0.8074, test_loss: 0.9523, test_f1: 0.5370
 epoch: 34, train_loss: 0.8056, test_loss: 0.9757, test_f1: 0.5337
 epoch: 35, train_loss: 0.8033, test_loss: 0.9560, test_f1: 0.5397
 epoch: 36, train_loss: 0.7979, test_loss: 0.9577, test_f1: 0.5429
 epoch: 37, train_loss: 0.7967, test_loss: 0.9618, test_f1: 0.5431
 epoch: 38, train_loss: 0.7858, test_loss: 0.9503, test_f1: 0.5387
 epoch: 39, train_loss: 0.7749, test_loss: 0.9537, test_f1: 0.5368
 epoch: 40, train_loss: 0.7787, test_loss: 0.9620, test_f1: 0.5472
 epoch: 41, train_loss: 0.7719, test_loss: 0.9818, test_f1: 0.5343
 epoch: 42, train_loss: 0.7673, test_loss: 0.9416, test_f1: 0.5580
 epoch: 43, train_loss: 0.7629, test_loss: 0.9739, test_f1: 0.5410
 epoch: 44, train_loss: 0.7546, test_loss: 0.9481, test_f1: 0.5379
 epoch: 45, train_loss: 0.7571, test_loss: 0.9732, test_f1: 0.5490
 epoch: 46, train_loss: 0.7453, test_loss: 0.9399, test_f1: 0.5421
 epoch: 47, train_loss: 0.7397, test_loss: 0.9564, test_f1: 0.5433
 epoch: 48, train_loss: 0.7400, test_loss: 0.9458, test_f1: 0.5424
 epoch: 49, train_loss: 0.7457, test_loss: 0.9808, test_f1: 0.5330
 epoch: 50, train_loss: 0.7295, test_loss: 0.9789, test_f1: 0.5445
 epoch: 51, train_loss: 0.7251, test_loss: 0.9464, test_f1: 0.5501
 epoch: 52, train_loss: 0.7234, test_loss: 0.9628, test_f1: 0.5480
 epoch: 53, train_loss: 0.7113, test_loss: 0.9700, test_f1: 0.5493
 epoch: 54, train_loss: 0.7190, test_loss: 0.9640, test_f1: 0.5483
 epoch: 55, train_loss: 0.7169, test_loss: 0.9703, test_f1: 0.5398
 epoch: 56, train_loss: 0.7116, test_loss: 0.9686, test_f1: 0.5468
 epoch: 57, train_loss: 0.7041, test_loss: 0.9701, test_f1: 0.5420
 epoch: 58, train_loss: 0.7140, test_loss: 0.9561, test_f1: 0.5565
 epoch: 59, train_loss: 0.7054, test_loss: 0.9525, test_f1: 0.5437
 epoch: 60, train_loss: 0.6951, test_loss: 0.9544, test_f1: 0.5500
 epoch: 61, train_loss: 0.7098, test_loss: 0.9789, test_f1: 0.5375
 epoch: 62, train_loss: 0.7016, test_loss: 0.9837, test_f1: 0.5442
 epoch: 63, train_loss: 0.6888, test_loss: 0.9686, test_f1: 0.5455
 epoch: 64, train_loss: 0.6827, test_loss: 0.9837, test_f1: 0.5429
 epoch: 65, train_loss: 0.7018, test_loss: 0.9637, test_f1: 0.5350
 epoch: 66, train_loss: 0.6962, test_loss: 0.9755, test_f1: 0.5402
 epoch: 67, train_loss: 0.6967, test_loss: 0.9756, test_f1: 0.5475
 epoch: 68, train_loss: 0.6875, test_loss: 0.9568, test_f1: 0.5525
 epoch: 69, train_loss: 0.6872, test_loss: 0.9695, test_f1: 0.5437
 epoch: 70, train_loss: 0.6838, test_loss: 0.9707, test_f1: 0.5464
 epoch: 71, train_loss: 0.6858, test_loss: 0.9866, test_f1: 0.5450
 epoch: 72, train_loss: 0.6850, test_loss: 0.9807, test_f1: 0.5481
 epoch: 73, train_loss: 0.6734, test_loss: 0.9876, test_f1: 0.5432
 epoch: 74, train_loss: 0.6771, test_loss: 0.9811, test_f1: 0.5365
 epoch: 75, train_loss: 0.6800, test_loss: 0.9791, test_f1: 0.5328
 epoch: 76, train_loss: 0.6740, test_loss: 0.9841, test_f1: 0.5389
 epoch: 77, train_loss: 0.6648, test_loss: 0.9620, test_f1: 0.5381
 epoch: 78, train_loss: 0.6591, test_loss: 1.0037, test_f1: 0.5372
 epoch: 79, train_loss: 0.6674, test_loss: 0.9885, test_f1: 0.5515
 epoch: 80, train_loss: 0.6578, test_loss: 0.9788, test_f1: 0.5418
 epoch: 81, train_loss: 0.6628, test_loss: 1.0028, test_f1: 0.5359
 epoch: 82, train_loss: 0.6624, test_loss: 0.9622, test_f1: 0.5468
 epoch: 83, train_loss: 0.6777, test_loss: 0.9909, test_f1: 0.5406
 epoch: 84, train_loss: 0.6540, test_loss: 0.9870, test_f1: 0.5472
 epoch: 85, train_loss: 0.6583, test_loss: 0.9842, test_f1: 0.5372
 epoch: 86, train_loss: 0.6571, test_loss: 0.9776, test_f1: 0.5379
 epoch: 87, train_loss: 0.6500, test_loss: 0.9873, test_f1: 0.5394
 epoch: 88, train_loss: 0.6494, test_loss: 1.0087, test_f1: 0.5475
 epoch: 89, train_loss: 0.6476, test_loss: 0.9681, test_f1: 0.5469
 epoch: 90, train_loss: 0.6555, test_loss: 0.9688, test_f1: 0.5450
 epoch: 91, train_loss: 0.6608, test_loss: 0.9807, test_f1: 0.5409
 epoch: 92, train_loss: 0.6607, test_loss: 0.9971, test_f1: 0.5387
 epoch: 93, train_loss: 0.6538, test_loss: 0.9909, test_f1: 0.5465
 epoch: 94, train_loss: 0.6547, test_loss: 0.9855, test_f1: 0.5513
 epoch: 95, train_loss: 0.6375, test_loss: 0.9993, test_f1: 0.5391
 epoch: 96, train_loss: 0.6441, test_loss: 1.0044, test_f1: 0.5449
 epoch: 97, train_loss: 0.6424, test_loss: 0.9992, test_f1: 0.5483
 epoch: 98, train_loss: 0.6388, test_loss: 1.0069, test_f1: 0.5382
 epoch: 99, train_loss: 0.6383, test_loss: 1.0031, test_f1: 0.5388
##################ITERATION #5 ****************************************
 epoch: 0, train_loss: 1.2856, test_loss: 1.2909, test_f1: 0.2260
 epoch: 1, train_loss: 1.1875, test_loss: 1.2094, test_f1: 0.3138
 epoch: 2, train_loss: 1.1515, test_loss: 1.1028, test_f1: 0.4470
 epoch: 3, train_loss: 1.1228, test_loss: 1.0617, test_f1: 0.4685
 epoch: 4, train_loss: 1.0942, test_loss: 1.0404, test_f1: 0.4564
 epoch: 5, train_loss: 1.0620, test_loss: 1.0115, test_f1: 0.4916
 epoch: 6, train_loss: 1.0432, test_loss: 0.9941, test_f1: 0.4722
 epoch: 7, train_loss: 1.0281, test_loss: 0.9763, test_f1: 0.4872
 epoch: 8, train_loss: 1.0118, test_loss: 0.9634, test_f1: 0.4844
 epoch: 9, train_loss: 0.9897, test_loss: 0.9567, test_f1: 0.4919
 epoch: 10, train_loss: 0.9719, test_loss: 0.9545, test_f1: 0.4790
 epoch: 11, train_loss: 0.9568, test_loss: 0.9541, test_f1: 0.4798
 epoch: 12, train_loss: 0.9464, test_loss: 0.9315, test_f1: 0.4833
 epoch: 13, train_loss: 0.9349, test_loss: 0.9413, test_f1: 0.4960
 epoch: 14, train_loss: 0.9279, test_loss: 0.9400, test_f1: 0.4920
 epoch: 15, train_loss: 0.9079, test_loss: 0.9141, test_f1: 0.4957
 epoch: 16, train_loss: 0.9072, test_loss: 0.9245, test_f1: 0.5152
 epoch: 17, train_loss: 0.9038, test_loss: 0.9182, test_f1: 0.5307
 epoch: 18, train_loss: 0.8967, test_loss: 0.9488, test_f1: 0.5147
 epoch: 19, train_loss: 0.8824, test_loss: 0.9232, test_f1: 0.5238
 epoch: 20, train_loss: 0.8829, test_loss: 0.9295, test_f1: 0.5277
 epoch: 21, train_loss: 0.8672, test_loss: 0.9295, test_f1: 0.5304
 epoch: 22, train_loss: 0.8505, test_loss: 0.9111, test_f1: 0.5261
 epoch: 23, train_loss: 0.8578, test_loss: 0.9441, test_f1: 0.5147
 epoch: 24, train_loss: 0.8569, test_loss: 0.9116, test_f1: 0.5411
 epoch: 25, train_loss: 0.8363, test_loss: 0.9118, test_f1: 0.5287
 epoch: 26, train_loss: 0.8347, test_loss: 0.8894, test_f1: 0.5408
 epoch: 27, train_loss: 0.8282, test_loss: 0.9064, test_f1: 0.5223
 epoch: 28, train_loss: 0.8205, test_loss: 0.9098, test_f1: 0.5267
 epoch: 29, train_loss: 0.8222, test_loss: 0.9149, test_f1: 0.5103
 epoch: 30, train_loss: 0.8112, test_loss: 0.8794, test_f1: 0.5319
 epoch: 31, train_loss: 0.8069, test_loss: 0.8820, test_f1: 0.5346
 epoch: 32, train_loss: 0.8022, test_loss: 0.8940, test_f1: 0.5329
 epoch: 33, train_loss: 0.7957, test_loss: 0.9049, test_f1: 0.5274
 epoch: 34, train_loss: 0.7948, test_loss: 0.8717, test_f1: 0.5347
 epoch: 35, train_loss: 0.7874, test_loss: 0.8894, test_f1: 0.5223
 epoch: 36, train_loss: 0.7842, test_loss: 0.8940, test_f1: 0.5413
 epoch: 37, train_loss: 0.7761, test_loss: 0.9024, test_f1: 0.5195
 epoch: 38, train_loss: 0.7719, test_loss: 0.8987, test_f1: 0.5296
 epoch: 39, train_loss: 0.7646, test_loss: 0.8857, test_f1: 0.5316
 epoch: 40, train_loss: 0.7556, test_loss: 0.8683, test_f1: 0.5480
 epoch: 41, train_loss: 0.7486, test_loss: 0.9092, test_f1: 0.5292
 epoch: 42, train_loss: 0.7541, test_loss: 0.9089, test_f1: 0.5328
 epoch: 43, train_loss: 0.7446, test_loss: 0.8757, test_f1: 0.5420
 epoch: 44, train_loss: 0.7446, test_loss: 0.9586, test_f1: 0.5167
 epoch: 45, train_loss: 0.7370, test_loss: 0.8593, test_f1: 0.5455
 epoch: 46, train_loss: 0.7342, test_loss: 0.8916, test_f1: 0.5452
 epoch: 47, train_loss: 0.7288, test_loss: 0.8992, test_f1: 0.5370
 epoch: 48, train_loss: 0.7334, test_loss: 0.8981, test_f1: 0.5313
 epoch: 49, train_loss: 0.7313, test_loss: 0.9390, test_f1: 0.5356
 epoch: 50, train_loss: 0.7168, test_loss: 0.9298, test_f1: 0.5308
 epoch: 51, train_loss: 0.7087, test_loss: 0.9084, test_f1: 0.5282
 epoch: 52, train_loss: 0.7059, test_loss: 0.9211, test_f1: 0.5307
 epoch: 53, train_loss: 0.6957, test_loss: 0.9006, test_f1: 0.5357
 epoch: 54, train_loss: 0.6998, test_loss: 0.9354, test_f1: 0.5325
 epoch: 55, train_loss: 0.6997, test_loss: 0.9162, test_f1: 0.5383
 epoch: 56, train_loss: 0.6951, test_loss: 0.9066, test_f1: 0.5341
 epoch: 57, train_loss: 0.6891, test_loss: 0.9281, test_f1: 0.5339
 epoch: 58, train_loss: 0.6861, test_loss: 0.9082, test_f1: 0.5365
 epoch: 59, train_loss: 0.6746, test_loss: 0.9219, test_f1: 0.5384
 epoch: 60, train_loss: 0.6854, test_loss: 0.9117, test_f1: 0.5378
 epoch: 61, train_loss: 0.6796, test_loss: 0.9289, test_f1: 0.5296
 epoch: 62, train_loss: 0.6789, test_loss: 0.9279, test_f1: 0.5391
 epoch: 63, train_loss: 0.6801, test_loss: 0.9533, test_f1: 0.5307
 epoch: 64, train_loss: 0.6761, test_loss: 0.9348, test_f1: 0.5403
 epoch: 65, train_loss: 0.6713, test_loss: 0.9443, test_f1: 0.5330
 epoch: 66, train_loss: 0.6753, test_loss: 0.9560, test_f1: 0.5318
 epoch: 67, train_loss: 0.6586, test_loss: 0.9272, test_f1: 0.5420
 epoch: 68, train_loss: 0.6638, test_loss: 0.9168, test_f1: 0.5357
 epoch: 69, train_loss: 0.6633, test_loss: 0.9089, test_f1: 0.5419
 epoch: 70, train_loss: 0.6567, test_loss: 0.9274, test_f1: 0.5391
 epoch: 71, train_loss: 0.6736, test_loss: 0.9596, test_f1: 0.5348
 epoch: 72, train_loss: 0.6499, test_loss: 0.9346, test_f1: 0.5402
 epoch: 73, train_loss: 0.6589, test_loss: 0.9448, test_f1: 0.5421
 epoch: 74, train_loss: 0.6478, test_loss: 0.9432, test_f1: 0.5414
 epoch: 75, train_loss: 0.6537, test_loss: 0.9429, test_f1: 0.5518
 epoch: 76, train_loss: 0.6676, test_loss: 0.9598, test_f1: 0.5370
 epoch: 77, train_loss: 0.6466, test_loss: 0.9733, test_f1: 0.5373
 epoch: 78, train_loss: 0.6400, test_loss: 0.9582, test_f1: 0.5375
 epoch: 79, train_loss: 0.6526, test_loss: 0.9511, test_f1: 0.5440
 epoch: 80, train_loss: 0.6403, test_loss: 0.9538, test_f1: 0.5518
 epoch: 81, train_loss: 0.6443, test_loss: 0.9583, test_f1: 0.5373
 epoch: 82, train_loss: 0.6357, test_loss: 0.9691, test_f1: 0.5370
 epoch: 83, train_loss: 0.6335, test_loss: 0.9649, test_f1: 0.5474
 epoch: 84, train_loss: 0.6362, test_loss: 0.9775, test_f1: 0.5415
 epoch: 85, train_loss: 0.6414, test_loss: 0.9847, test_f1: 0.5407
 epoch: 86, train_loss: 0.6387, test_loss: 0.9682, test_f1: 0.5442
 epoch: 87, train_loss: 0.6412, test_loss: 0.9778, test_f1: 0.5411
 epoch: 88, train_loss: 0.6264, test_loss: 0.9483, test_f1: 0.5520
 epoch: 89, train_loss: 0.6286, test_loss: 1.0135, test_f1: 0.5432
 epoch: 90, train_loss: 0.6315, test_loss: 0.9918, test_f1: 0.5408
 epoch: 91, train_loss: 0.6243, test_loss: 0.9920, test_f1: 0.5416
 epoch: 92, train_loss: 0.6316, test_loss: 1.0427, test_f1: 0.5359
 epoch: 93, train_loss: 0.6206, test_loss: 1.0177, test_f1: 0.5402
 epoch: 94, train_loss: 0.6204, test_loss: 1.0195, test_f1: 0.5406
 epoch: 95, train_loss: 0.6133, test_loss: 1.0168, test_f1: 0.5471
 epoch: 96, train_loss: 0.6219, test_loss: 0.9912, test_f1: 0.5426
 epoch: 97, train_loss: 0.6159, test_loss: 1.0040, test_f1: 0.5461
 epoch: 98, train_loss: 0.6012, test_loss: 1.0165, test_f1: 0.5465
 epoch: 99, train_loss: 0.6204, test_loss: 1.0071, test_f1: 0.5415
##################ITERATION #6 ****************************************
 epoch: 0, train_loss: 1.2876, test_loss: 1.2765, test_f1: 0.2260
 epoch: 1, train_loss: 1.1831, test_loss: 1.1889, test_f1: 0.3136
 epoch: 2, train_loss: 1.1414, test_loss: 1.0822, test_f1: 0.4513
 epoch: 3, train_loss: 1.1065, test_loss: 1.0308, test_f1: 0.4712
 epoch: 4, train_loss: 1.0755, test_loss: 1.0108, test_f1: 0.4773
 epoch: 5, train_loss: 1.0449, test_loss: 0.9962, test_f1: 0.4718
 epoch: 6, train_loss: 1.0170, test_loss: 0.9820, test_f1: 0.4835
 epoch: 7, train_loss: 1.0089, test_loss: 0.9661, test_f1: 0.4890
 epoch: 8, train_loss: 0.9833, test_loss: 0.9704, test_f1: 0.4715
 epoch: 9, train_loss: 0.9752, test_loss: 0.9679, test_f1: 0.4790
 epoch: 10, train_loss: 0.9639, test_loss: 0.9552, test_f1: 0.4964
 epoch: 11, train_loss: 0.9436, test_loss: 0.9549, test_f1: 0.5017
 epoch: 12, train_loss: 0.9397, test_loss: 0.9385, test_f1: 0.5103
 epoch: 13, train_loss: 0.9332, test_loss: 0.9474, test_f1: 0.5042
 epoch: 14, train_loss: 0.9207, test_loss: 0.9512, test_f1: 0.5013
 epoch: 15, train_loss: 0.9128, test_loss: 0.9450, test_f1: 0.5055
 epoch: 16, train_loss: 0.8949, test_loss: 0.9237, test_f1: 0.5031
 epoch: 17, train_loss: 0.8908, test_loss: 0.9372, test_f1: 0.5035
 epoch: 18, train_loss: 0.8878, test_loss: 0.9350, test_f1: 0.5067
 epoch: 19, train_loss: 0.8755, test_loss: 0.9428, test_f1: 0.5061
 epoch: 20, train_loss: 0.8716, test_loss: 0.8963, test_f1: 0.5300
 epoch: 21, train_loss: 0.8670, test_loss: 0.9265, test_f1: 0.5088
 epoch: 22, train_loss: 0.8565, test_loss: 0.9138, test_f1: 0.5255
 epoch: 23, train_loss: 0.8498, test_loss: 0.9295, test_f1: 0.5448
 epoch: 24, train_loss: 0.8372, test_loss: 0.9490, test_f1: 0.5180
 epoch: 25, train_loss: 0.8380, test_loss: 0.9670, test_f1: 0.5145
 epoch: 26, train_loss: 0.8334, test_loss: 0.9245, test_f1: 0.5360
 epoch: 27, train_loss: 0.8243, test_loss: 0.9102, test_f1: 0.5432
 epoch: 28, train_loss: 0.8184, test_loss: 0.9088, test_f1: 0.5453
 epoch: 29, train_loss: 0.8099, test_loss: 0.9117, test_f1: 0.5322
 epoch: 30, train_loss: 0.8014, test_loss: 0.9203, test_f1: 0.5398
 epoch: 31, train_loss: 0.7982, test_loss: 0.9778, test_f1: 0.5175
 epoch: 32, train_loss: 0.7955, test_loss: 0.8984, test_f1: 0.5447
 epoch: 33, train_loss: 0.7907, test_loss: 0.9365, test_f1: 0.5465
 epoch: 34, train_loss: 0.7768, test_loss: 0.9103, test_f1: 0.5484
 epoch: 35, train_loss: 0.7822, test_loss: 0.9464, test_f1: 0.5473
 epoch: 36, train_loss: 0.7771, test_loss: 0.8954, test_f1: 0.5518
 epoch: 37, train_loss: 0.7737, test_loss: 0.9088, test_f1: 0.5603
 epoch: 38, train_loss: 0.7655, test_loss: 0.9427, test_f1: 0.5432
 epoch: 39, train_loss: 0.7620, test_loss: 0.9182, test_f1: 0.5399
 epoch: 40, train_loss: 0.7437, test_loss: 0.8931, test_f1: 0.5494
 epoch: 41, train_loss: 0.7482, test_loss: 0.9407, test_f1: 0.5597
 epoch: 42, train_loss: 0.7407, test_loss: 0.8983, test_f1: 0.5620
 epoch: 43, train_loss: 0.7363, test_loss: 0.9016, test_f1: 0.5634
 epoch: 44, train_loss: 0.7369, test_loss: 0.9442, test_f1: 0.5563
 epoch: 45, train_loss: 0.7259, test_loss: 0.9212, test_f1: 0.5430
 epoch: 46, train_loss: 0.7289, test_loss: 0.9520, test_f1: 0.5526
 epoch: 47, train_loss: 0.7347, test_loss: 0.9230, test_f1: 0.5661
 epoch: 48, train_loss: 0.7190, test_loss: 0.9752, test_f1: 0.5689
 epoch: 49, train_loss: 0.7106, test_loss: 0.9446, test_f1: 0.5870
 epoch: 50, train_loss: 0.7080, test_loss: 0.9605, test_f1: 0.5571
 epoch: 51, train_loss: 0.7099, test_loss: 0.9465, test_f1: 0.5519
 epoch: 52, train_loss: 0.6953, test_loss: 0.9416, test_f1: 0.5729
 epoch: 53, train_loss: 0.6882, test_loss: 0.9602, test_f1: 0.5581
 epoch: 54, train_loss: 0.6912, test_loss: 0.9540, test_f1: 0.5676
 epoch: 55, train_loss: 0.6989, test_loss: 0.9464, test_f1: 0.5639
 epoch: 56, train_loss: 0.6900, test_loss: 0.9556, test_f1: 0.5538
 epoch: 57, train_loss: 0.6866, test_loss: 0.9582, test_f1: 0.5595
 epoch: 58, train_loss: 0.7004, test_loss: 0.9588, test_f1: 0.5506
 epoch: 59, train_loss: 0.6775, test_loss: 0.9845, test_f1: 0.5699
 epoch: 60, train_loss: 0.6678, test_loss: 0.9566, test_f1: 0.5529
 epoch: 61, train_loss: 0.6807, test_loss: 0.9755, test_f1: 0.5563
 epoch: 62, train_loss: 0.6683, test_loss: 0.9593, test_f1: 0.5477
 epoch: 63, train_loss: 0.6700, test_loss: 0.9840, test_f1: 0.5363
 epoch: 64, train_loss: 0.6760, test_loss: 0.9650, test_f1: 0.5484
 epoch: 65, train_loss: 0.6724, test_loss: 0.9760, test_f1: 0.5506
 epoch: 66, train_loss: 0.6815, test_loss: 0.9916, test_f1: 0.5606
 epoch: 67, train_loss: 0.6788, test_loss: 0.9356, test_f1: 0.5505
 epoch: 68, train_loss: 0.6651, test_loss: 0.9816, test_f1: 0.5593
 epoch: 69, train_loss: 0.6536, test_loss: 0.9740, test_f1: 0.5607
 epoch: 70, train_loss: 0.6540, test_loss: 0.9751, test_f1: 0.5522
 epoch: 71, train_loss: 0.6562, test_loss: 1.0033, test_f1: 0.5489
 epoch: 72, train_loss: 0.6686, test_loss: 0.9791, test_f1: 0.5573
 epoch: 73, train_loss: 0.6550, test_loss: 1.0136, test_f1: 0.5474
 epoch: 74, train_loss: 0.6641, test_loss: 0.9530, test_f1: 0.5527
 epoch: 75, train_loss: 0.6563, test_loss: 0.9549, test_f1: 0.5695
 epoch: 76, train_loss: 0.6518, test_loss: 0.9902, test_f1: 0.5648
 epoch: 77, train_loss: 0.6453, test_loss: 0.9914, test_f1: 0.5507
 epoch: 78, train_loss: 0.6550, test_loss: 0.9837, test_f1: 0.5604
 epoch: 79, train_loss: 0.6344, test_loss: 1.0134, test_f1: 0.5508
 epoch: 80, train_loss: 0.6521, test_loss: 0.9923, test_f1: 0.5637
 epoch: 81, train_loss: 0.6530, test_loss: 0.9961, test_f1: 0.5500
 epoch: 82, train_loss: 0.6401, test_loss: 0.9922, test_f1: 0.5619
 epoch: 83, train_loss: 0.6479, test_loss: 1.0016, test_f1: 0.5593
 epoch: 84, train_loss: 0.6305, test_loss: 1.0176, test_f1: 0.5555
 epoch: 85, train_loss: 0.6343, test_loss: 0.9996, test_f1: 0.5618
 epoch: 86, train_loss: 0.6258, test_loss: 1.0070, test_f1: 0.5590
 epoch: 87, train_loss: 0.6416, test_loss: 1.0057, test_f1: 0.5506
 epoch: 88, train_loss: 0.6289, test_loss: 1.0180, test_f1: 0.5484
 epoch: 89, train_loss: 0.6315, test_loss: 1.0261, test_f1: 0.5604
 epoch: 90, train_loss: 0.6410, test_loss: 1.0130, test_f1: 0.5648
 epoch: 91, train_loss: 0.6379, test_loss: 1.0066, test_f1: 0.5537
 epoch: 92, train_loss: 0.6294, test_loss: 0.9865, test_f1: 0.5618
 epoch: 93, train_loss: 0.6302, test_loss: 1.0223, test_f1: 0.5730
 epoch: 94, train_loss: 0.6260, test_loss: 1.0001, test_f1: 0.5536
 epoch: 95, train_loss: 0.6268, test_loss: 1.0259, test_f1: 0.5765
 epoch: 96, train_loss: 0.6191, test_loss: 1.0297, test_f1: 0.5708
 epoch: 97, train_loss: 0.6354, test_loss: 1.0083, test_f1: 0.5742
 epoch: 98, train_loss: 0.6305, test_loss: 1.0337, test_f1: 0.5601
 epoch: 99, train_loss: 0.6157, test_loss: 1.0274, test_f1: 0.5625
##################ITERATION #7 ****************************************
 epoch: 0, train_loss: 1.2725, test_loss: 1.2971, test_f1: 0.2554
 epoch: 1, train_loss: 1.2034, test_loss: 1.2322, test_f1: 0.3228
 epoch: 2, train_loss: 1.1575, test_loss: 1.1297, test_f1: 0.4469
 epoch: 3, train_loss: 1.1188, test_loss: 1.0669, test_f1: 0.4710
 epoch: 4, train_loss: 1.0967, test_loss: 1.0435, test_f1: 0.4685
 epoch: 5, train_loss: 1.0681, test_loss: 1.0202, test_f1: 0.4706
 epoch: 6, train_loss: 1.0437, test_loss: 1.0150, test_f1: 0.4734
 epoch: 7, train_loss: 1.0348, test_loss: 1.0159, test_f1: 0.4599
 epoch: 8, train_loss: 1.0215, test_loss: 0.9962, test_f1: 0.4813
 epoch: 9, train_loss: 1.0113, test_loss: 1.0148, test_f1: 0.4727
 epoch: 10, train_loss: 1.0018, test_loss: 1.0026, test_f1: 0.4764
 epoch: 11, train_loss: 0.9920, test_loss: 1.0113, test_f1: 0.4650
 epoch: 12, train_loss: 0.9804, test_loss: 0.9823, test_f1: 0.4963
 epoch: 13, train_loss: 0.9820, test_loss: 0.9783, test_f1: 0.4900
 epoch: 14, train_loss: 0.9702, test_loss: 0.9791, test_f1: 0.4876
 epoch: 15, train_loss: 0.9584, test_loss: 0.9704, test_f1: 0.4899
 epoch: 16, train_loss: 0.9457, test_loss: 0.9540, test_f1: 0.4892
 epoch: 17, train_loss: 0.9382, test_loss: 0.9816, test_f1: 0.4961
 epoch: 18, train_loss: 0.9288, test_loss: 0.9587, test_f1: 0.5098
 epoch: 19, train_loss: 0.9168, test_loss: 0.9522, test_f1: 0.5175
 epoch: 20, train_loss: 0.9167, test_loss: 0.9620, test_f1: 0.5141
 epoch: 21, train_loss: 0.9129, test_loss: 0.9445, test_f1: 0.5147
 epoch: 22, train_loss: 0.9053, test_loss: 0.9749, test_f1: 0.5220
 epoch: 23, train_loss: 0.9032, test_loss: 0.9548, test_f1: 0.5149
 epoch: 24, train_loss: 0.8844, test_loss: 0.9709, test_f1: 0.5112
 epoch: 25, train_loss: 0.8880, test_loss: 0.9547, test_f1: 0.5172
 epoch: 26, train_loss: 0.8759, test_loss: 0.9515, test_f1: 0.5112
 epoch: 27, train_loss: 0.8692, test_loss: 0.9666, test_f1: 0.5116
 epoch: 28, train_loss: 0.8684, test_loss: 0.9471, test_f1: 0.5243
 epoch: 29, train_loss: 0.8544, test_loss: 0.9513, test_f1: 0.5068
 epoch: 30, train_loss: 0.8547, test_loss: 0.9351, test_f1: 0.5131
 epoch: 31, train_loss: 0.8481, test_loss: 0.9452, test_f1: 0.5139
 epoch: 32, train_loss: 0.8338, test_loss: 0.8837, test_f1: 0.5346
 epoch: 33, train_loss: 0.8428, test_loss: 0.9255, test_f1: 0.5309
 epoch: 34, train_loss: 0.8394, test_loss: 0.9078, test_f1: 0.5299
 epoch: 35, train_loss: 0.8318, test_loss: 0.9559, test_f1: 0.5272
 epoch: 36, train_loss: 0.8265, test_loss: 0.9273, test_f1: 0.5318
 epoch: 37, train_loss: 0.8207, test_loss: 0.9005, test_f1: 0.5305
 epoch: 38, train_loss: 0.8167, test_loss: 0.9192, test_f1: 0.5205
 epoch: 39, train_loss: 0.8020, test_loss: 0.9200, test_f1: 0.5114
 epoch: 40, train_loss: 0.7923, test_loss: 0.9011, test_f1: 0.5320
 epoch: 41, train_loss: 0.7981, test_loss: 0.8974, test_f1: 0.5154
 epoch: 42, train_loss: 0.7850, test_loss: 0.9151, test_f1: 0.5361
 epoch: 43, train_loss: 0.7873, test_loss: 0.9377, test_f1: 0.5058
 epoch: 44, train_loss: 0.7764, test_loss: 0.9046, test_f1: 0.5389
 epoch: 45, train_loss: 0.7867, test_loss: 0.9196, test_f1: 0.5244
 epoch: 46, train_loss: 0.7677, test_loss: 0.9257, test_f1: 0.5361
 epoch: 47, train_loss: 0.7664, test_loss: 0.8925, test_f1: 0.5329
 epoch: 48, train_loss: 0.7745, test_loss: 0.9439, test_f1: 0.5188
 epoch: 49, train_loss: 0.7651, test_loss: 0.9247, test_f1: 0.5412
 epoch: 50, train_loss: 0.7538, test_loss: 0.9131, test_f1: 0.5398
 epoch: 51, train_loss: 0.7493, test_loss: 0.9238, test_f1: 0.5432
 epoch: 52, train_loss: 0.7400, test_loss: 0.9397, test_f1: 0.5300
 epoch: 53, train_loss: 0.7395, test_loss: 0.9687, test_f1: 0.5224
 epoch: 54, train_loss: 0.7372, test_loss: 0.9523, test_f1: 0.5301
 epoch: 55, train_loss: 0.7288, test_loss: 0.9456, test_f1: 0.5200
 epoch: 56, train_loss: 0.7340, test_loss: 0.9420, test_f1: 0.5384
 epoch: 57, train_loss: 0.7254, test_loss: 0.9794, test_f1: 0.5223
 epoch: 58, train_loss: 0.7268, test_loss: 0.9396, test_f1: 0.5154
 epoch: 59, train_loss: 0.7382, test_loss: 0.9545, test_f1: 0.5235
 epoch: 60, train_loss: 0.7383, test_loss: 0.9449, test_f1: 0.5322
 epoch: 61, train_loss: 0.7251, test_loss: 0.9461, test_f1: 0.5415
 epoch: 62, train_loss: 0.7262, test_loss: 0.9635, test_f1: 0.5284
 epoch: 63, train_loss: 0.7241, test_loss: 0.9423, test_f1: 0.5132
 epoch: 64, train_loss: 0.7226, test_loss: 0.9595, test_f1: 0.5159
 epoch: 65, train_loss: 0.7154, test_loss: 0.9557, test_f1: 0.5365
 epoch: 66, train_loss: 0.7064, test_loss: 0.9635, test_f1: 0.5216
 epoch: 67, train_loss: 0.7204, test_loss: 0.9455, test_f1: 0.5303
 epoch: 68, train_loss: 0.7113, test_loss: 0.9779, test_f1: 0.5191
 epoch: 69, train_loss: 0.7089, test_loss: 0.9789, test_f1: 0.5253
 epoch: 70, train_loss: 0.7079, test_loss: 0.9738, test_f1: 0.5332
 epoch: 71, train_loss: 0.7163, test_loss: 0.9480, test_f1: 0.5320
 epoch: 72, train_loss: 0.6986, test_loss: 0.9685, test_f1: 0.5278
 epoch: 73, train_loss: 0.6970, test_loss: 0.9732, test_f1: 0.5275
 epoch: 74, train_loss: 0.6985, test_loss: 0.9541, test_f1: 0.5388
 epoch: 75, train_loss: 0.6869, test_loss: 0.9791, test_f1: 0.5233
 epoch: 76, train_loss: 0.6910, test_loss: 0.9850, test_f1: 0.5175
 epoch: 77, train_loss: 0.6863, test_loss: 1.0069, test_f1: 0.5191
 epoch: 78, train_loss: 0.6875, test_loss: 1.0018, test_f1: 0.5383
 epoch: 79, train_loss: 0.6886, test_loss: 1.0135, test_f1: 0.5211
 epoch: 80, train_loss: 0.6821, test_loss: 1.0083, test_f1: 0.5244
 epoch: 81, train_loss: 0.6992, test_loss: 1.0124, test_f1: 0.5311
 epoch: 82, train_loss: 0.6838, test_loss: 1.0092, test_f1: 0.5249
 epoch: 83, train_loss: 0.6850, test_loss: 0.9987, test_f1: 0.5266
 epoch: 84, train_loss: 0.6748, test_loss: 1.0283, test_f1: 0.5224
 epoch: 85, train_loss: 0.6752, test_loss: 0.9974, test_f1: 0.5169
 epoch: 86, train_loss: 0.6884, test_loss: 0.9871, test_f1: 0.5312
 epoch: 87, train_loss: 0.6646, test_loss: 0.9940, test_f1: 0.5234
 epoch: 88, train_loss: 0.6710, test_loss: 1.0349, test_f1: 0.5242
 epoch: 89, train_loss: 0.6853, test_loss: 1.0330, test_f1: 0.5215
 epoch: 90, train_loss: 0.6693, test_loss: 0.9905, test_f1: 0.5187
 epoch: 91, train_loss: 0.6734, test_loss: 1.0279, test_f1: 0.5259
 epoch: 92, train_loss: 0.6691, test_loss: 1.0300, test_f1: 0.5126
 epoch: 93, train_loss: 0.6617, test_loss: 1.0310, test_f1: 0.5189
 epoch: 94, train_loss: 0.6742, test_loss: 1.0311, test_f1: 0.5235
 epoch: 95, train_loss: 0.6632, test_loss: 1.0342, test_f1: 0.5277
 epoch: 96, train_loss: 0.6651, test_loss: 1.0100, test_f1: 0.5162
 epoch: 97, train_loss: 0.6560, test_loss: 1.0320, test_f1: 0.5236
 epoch: 98, train_loss: 0.6541, test_loss: 1.0714, test_f1: 0.5218
 epoch: 99, train_loss: 0.6544, test_loss: 1.0510, test_f1: 0.5156
##################ITERATION #8 ****************************************
 epoch: 0, train_loss: 1.2624, test_loss: 1.2605, test_f1: 0.2260
 epoch: 1, train_loss: 1.1812, test_loss: 1.1431, test_f1: 0.4086
 epoch: 2, train_loss: 1.1423, test_loss: 1.0644, test_f1: 0.4743
 epoch: 3, train_loss: 1.1140, test_loss: 1.0256, test_f1: 0.5135
 epoch: 4, train_loss: 1.0917, test_loss: 1.0113, test_f1: 0.5089
 epoch: 5, train_loss: 1.0761, test_loss: 0.9967, test_f1: 0.5049
 epoch: 6, train_loss: 1.0610, test_loss: 0.9856, test_f1: 0.4867
 epoch: 7, train_loss: 1.0482, test_loss: 0.9741, test_f1: 0.4828
 epoch: 8, train_loss: 1.0260, test_loss: 0.9777, test_f1: 0.4732
 epoch: 9, train_loss: 1.0311, test_loss: 0.9665, test_f1: 0.4716
 epoch: 10, train_loss: 1.0109, test_loss: 0.9709, test_f1: 0.4872
 epoch: 11, train_loss: 0.9964, test_loss: 0.9697, test_f1: 0.4760
 epoch: 12, train_loss: 0.9886, test_loss: 0.9555, test_f1: 0.4987
 epoch: 13, train_loss: 0.9771, test_loss: 0.9512, test_f1: 0.4918
 epoch: 14, train_loss: 0.9716, test_loss: 0.9598, test_f1: 0.5011
 epoch: 15, train_loss: 0.9603, test_loss: 0.9473, test_f1: 0.5030
 epoch: 16, train_loss: 0.9644, test_loss: 0.9534, test_f1: 0.5057
 epoch: 17, train_loss: 0.9494, test_loss: 0.9612, test_f1: 0.5058
 epoch: 18, train_loss: 0.9442, test_loss: 0.9502, test_f1: 0.5225
 epoch: 19, train_loss: 0.9269, test_loss: 0.9519, test_f1: 0.5023
 epoch: 20, train_loss: 0.9296, test_loss: 0.9523, test_f1: 0.5037
 epoch: 21, train_loss: 0.9260, test_loss: 0.9583, test_f1: 0.5197
 epoch: 22, train_loss: 0.9191, test_loss: 0.9586, test_f1: 0.5236
 epoch: 23, train_loss: 0.9142, test_loss: 0.9586, test_f1: 0.5118
 epoch: 24, train_loss: 0.9063, test_loss: 0.9570, test_f1: 0.5295
 epoch: 25, train_loss: 0.9054, test_loss: 0.9613, test_f1: 0.5284
 epoch: 26, train_loss: 0.8930, test_loss: 0.9586, test_f1: 0.5236
 epoch: 27, train_loss: 0.8785, test_loss: 0.9521, test_f1: 0.5349
 epoch: 28, train_loss: 0.8832, test_loss: 0.9570, test_f1: 0.5384
 epoch: 29, train_loss: 0.8807, test_loss: 0.9599, test_f1: 0.5502
 epoch: 30, train_loss: 0.8684, test_loss: 0.9794, test_f1: 0.5368
 epoch: 31, train_loss: 0.8709, test_loss: 0.9694, test_f1: 0.5376
 epoch: 32, train_loss: 0.8482, test_loss: 0.9377, test_f1: 0.5414
 epoch: 33, train_loss: 0.8681, test_loss: 0.9483, test_f1: 0.5523
 epoch: 34, train_loss: 0.8460, test_loss: 0.9285, test_f1: 0.5494
 epoch: 35, train_loss: 0.8421, test_loss: 0.9628, test_f1: 0.5418
 epoch: 36, train_loss: 0.8450, test_loss: 0.9730, test_f1: 0.5283
 epoch: 37, train_loss: 0.8367, test_loss: 0.9397, test_f1: 0.5444
 epoch: 38, train_loss: 0.8370, test_loss: 0.9582, test_f1: 0.5325
 epoch: 39, train_loss: 0.8201, test_loss: 0.9447, test_f1: 0.5487
 epoch: 40, train_loss: 0.8218, test_loss: 0.9704, test_f1: 0.5452
 epoch: 41, train_loss: 0.8096, test_loss: 0.9378, test_f1: 0.5607
 epoch: 42, train_loss: 0.8096, test_loss: 0.9540, test_f1: 0.5392
 epoch: 43, train_loss: 0.7945, test_loss: 0.9597, test_f1: 0.5474
 epoch: 44, train_loss: 0.7975, test_loss: 0.9798, test_f1: 0.5465
 epoch: 45, train_loss: 0.7988, test_loss: 0.9717, test_f1: 0.5416
 epoch: 46, train_loss: 0.7868, test_loss: 0.9424, test_f1: 0.5633
 epoch: 47, train_loss: 0.7890, test_loss: 0.9454, test_f1: 0.5698
 epoch: 48, train_loss: 0.7803, test_loss: 0.9619, test_f1: 0.5525
 epoch: 49, train_loss: 0.7763, test_loss: 0.9624, test_f1: 0.5527
 epoch: 50, train_loss: 0.7821, test_loss: 0.9521, test_f1: 0.5744
 epoch: 51, train_loss: 0.7767, test_loss: 0.9490, test_f1: 0.5609
 epoch: 52, train_loss: 0.7686, test_loss: 0.9558, test_f1: 0.5545
 epoch: 53, train_loss: 0.7588, test_loss: 0.9392, test_f1: 0.5588
 epoch: 54, train_loss: 0.7546, test_loss: 0.9576, test_f1: 0.5548
 epoch: 55, train_loss: 0.7503, test_loss: 0.9455, test_f1: 0.5599
 epoch: 56, train_loss: 0.7534, test_loss: 0.9572, test_f1: 0.5591
 epoch: 57, train_loss: 0.7567, test_loss: 0.9618, test_f1: 0.5560
 epoch: 58, train_loss: 0.7430, test_loss: 0.9436, test_f1: 0.5677
 epoch: 59, train_loss: 0.7446, test_loss: 0.9596, test_f1: 0.5634
 epoch: 60, train_loss: 0.7341, test_loss: 0.9768, test_f1: 0.5554
 epoch: 61, train_loss: 0.7331, test_loss: 0.9537, test_f1: 0.5697
 epoch: 62, train_loss: 0.7620, test_loss: 0.9593, test_f1: 0.5566
 epoch: 63, train_loss: 0.7358, test_loss: 0.9659, test_f1: 0.5562
 epoch: 64, train_loss: 0.7461, test_loss: 0.9719, test_f1: 0.5533
 epoch: 65, train_loss: 0.7343, test_loss: 0.9666, test_f1: 0.5636
 epoch: 66, train_loss: 0.7311, test_loss: 0.9597, test_f1: 0.5629
 epoch: 67, train_loss: 0.7206, test_loss: 0.9639, test_f1: 0.5659
 epoch: 68, train_loss: 0.7266, test_loss: 0.9552, test_f1: 0.5669
 epoch: 69, train_loss: 0.7275, test_loss: 0.9695, test_f1: 0.5604
 epoch: 70, train_loss: 0.7154, test_loss: 0.9753, test_f1: 0.5626
 epoch: 71, train_loss: 0.7256, test_loss: 0.9867, test_f1: 0.5493
 epoch: 72, train_loss: 0.7129, test_loss: 0.9644, test_f1: 0.5633
 epoch: 73, train_loss: 0.7000, test_loss: 0.9833, test_f1: 0.5622
 epoch: 74, train_loss: 0.7197, test_loss: 0.9527, test_f1: 0.5679
 epoch: 75, train_loss: 0.7195, test_loss: 0.9727, test_f1: 0.5721
 epoch: 76, train_loss: 0.7149, test_loss: 0.9838, test_f1: 0.5665
 epoch: 77, train_loss: 0.6995, test_loss: 0.9814, test_f1: 0.5723
 epoch: 78, train_loss: 0.7028, test_loss: 0.9542, test_f1: 0.5665
 epoch: 79, train_loss: 0.7099, test_loss: 0.9678, test_f1: 0.5689
 epoch: 80, train_loss: 0.6993, test_loss: 0.9777, test_f1: 0.5723
 epoch: 81, train_loss: 0.6968, test_loss: 0.9896, test_f1: 0.5655
 epoch: 82, train_loss: 0.7011, test_loss: 0.9772, test_f1: 0.5698
 epoch: 83, train_loss: 0.6852, test_loss: 0.9633, test_f1: 0.5807
 epoch: 84, train_loss: 0.7034, test_loss: 0.9689, test_f1: 0.5669
 epoch: 85, train_loss: 0.6850, test_loss: 0.9555, test_f1: 0.5682
 epoch: 86, train_loss: 0.6919, test_loss: 0.9800, test_f1: 0.5743
 epoch: 87, train_loss: 0.6968, test_loss: 0.9789, test_f1: 0.5642
 epoch: 88, train_loss: 0.6805, test_loss: 0.9937, test_f1: 0.5645
 epoch: 89, train_loss: 0.6832, test_loss: 0.9874, test_f1: 0.5697
 epoch: 90, train_loss: 0.6880, test_loss: 0.9845, test_f1: 0.5714
 epoch: 91, train_loss: 0.6889, test_loss: 0.9718, test_f1: 0.5717
 epoch: 92, train_loss: 0.6830, test_loss: 0.9861, test_f1: 0.5638
 epoch: 93, train_loss: 0.6752, test_loss: 0.9808, test_f1: 0.5661
 epoch: 94, train_loss: 0.6804, test_loss: 0.9977, test_f1: 0.5554
 epoch: 95, train_loss: 0.6857, test_loss: 0.9752, test_f1: 0.5710
 epoch: 96, train_loss: 0.6767, test_loss: 0.9979, test_f1: 0.5728
 epoch: 97, train_loss: 0.6703, test_loss: 1.0005, test_f1: 0.5710
 epoch: 98, train_loss: 0.6619, test_loss: 0.9953, test_f1: 0.5870
 epoch: 99, train_loss: 0.6658, test_loss: 1.0070, test_f1: 0.5725
##################ITERATION #9 ****************************************
 epoch: 0, train_loss: 1.2812, test_loss: 1.2736, test_f1: 0.3203
 epoch: 1, train_loss: 1.1717, test_loss: 1.1724, test_f1: 0.3827
 epoch: 2, train_loss: 1.1335, test_loss: 1.0740, test_f1: 0.4873
 epoch: 3, train_loss: 1.0943, test_loss: 1.0385, test_f1: 0.4847
 epoch: 4, train_loss: 1.0837, test_loss: 1.0251, test_f1: 0.4790
 epoch: 5, train_loss: 1.0491, test_loss: 1.0040, test_f1: 0.4861
 epoch: 6, train_loss: 1.0386, test_loss: 0.9843, test_f1: 0.4903
 epoch: 7, train_loss: 1.0240, test_loss: 0.9826, test_f1: 0.4871
 epoch: 8, train_loss: 1.0085, test_loss: 0.9700, test_f1: 0.4967
 epoch: 9, train_loss: 0.9894, test_loss: 0.9701, test_f1: 0.4910
 epoch: 10, train_loss: 0.9805, test_loss: 0.9711, test_f1: 0.4814
 epoch: 11, train_loss: 0.9666, test_loss: 0.9511, test_f1: 0.5004
 epoch: 12, train_loss: 0.9602, test_loss: 0.9478, test_f1: 0.5012
 epoch: 13, train_loss: 0.9534, test_loss: 0.9487, test_f1: 0.4905
 epoch: 14, train_loss: 0.9373, test_loss: 0.9492, test_f1: 0.4922
 epoch: 15, train_loss: 0.9346, test_loss: 0.9359, test_f1: 0.5044
 epoch: 16, train_loss: 0.9209, test_loss: 0.9258, test_f1: 0.5133
 epoch: 17, train_loss: 0.9147, test_loss: 0.9252, test_f1: 0.5176
 epoch: 18, train_loss: 0.9050, test_loss: 0.9476, test_f1: 0.4996
 epoch: 19, train_loss: 0.9029, test_loss: 0.9288, test_f1: 0.5244
 epoch: 20, train_loss: 0.8971, test_loss: 0.9409, test_f1: 0.5201
 epoch: 21, train_loss: 0.8844, test_loss: 0.9319, test_f1: 0.5155
 epoch: 22, train_loss: 0.8751, test_loss: 0.9293, test_f1: 0.5255
 epoch: 23, train_loss: 0.8693, test_loss: 0.9102, test_f1: 0.5394
 epoch: 24, train_loss: 0.8715, test_loss: 0.9131, test_f1: 0.5308
 epoch: 25, train_loss: 0.8702, test_loss: 0.9086, test_f1: 0.5241
 epoch: 26, train_loss: 0.8593, test_loss: 0.9339, test_f1: 0.5550
 epoch: 27, train_loss: 0.8501, test_loss: 0.9128, test_f1: 0.5462
 epoch: 28, train_loss: 0.8365, test_loss: 0.9180, test_f1: 0.5433
 epoch: 29, train_loss: 0.8336, test_loss: 0.9169, test_f1: 0.5570
 epoch: 30, train_loss: 0.8321, test_loss: 0.9049, test_f1: 0.5393
 epoch: 31, train_loss: 0.8210, test_loss: 0.9277, test_f1: 0.5522
 epoch: 32, train_loss: 0.8109, test_loss: 0.9193, test_f1: 0.5374
 epoch: 33, train_loss: 0.8087, test_loss: 0.9293, test_f1: 0.5645
 epoch: 34, train_loss: 0.8060, test_loss: 0.9275, test_f1: 0.5606
 epoch: 35, train_loss: 0.8056, test_loss: 0.9114, test_f1: 0.5606
 epoch: 36, train_loss: 0.8131, test_loss: 0.9279, test_f1: 0.5389
 epoch: 37, train_loss: 0.8002, test_loss: 0.9353, test_f1: 0.5359
 epoch: 38, train_loss: 0.7962, test_loss: 0.9122, test_f1: 0.5404
 epoch: 39, train_loss: 0.7860, test_loss: 0.9178, test_f1: 0.5407
 epoch: 40, train_loss: 0.7756, test_loss: 0.9317, test_f1: 0.5456
 epoch: 41, train_loss: 0.7742, test_loss: 0.9326, test_f1: 0.5586
 epoch: 42, train_loss: 0.7706, test_loss: 0.9025, test_f1: 0.5589
 epoch: 43, train_loss: 0.7672, test_loss: 0.9200, test_f1: 0.5472
 epoch: 44, train_loss: 0.7645, test_loss: 0.9294, test_f1: 0.5484
 epoch: 45, train_loss: 0.7478, test_loss: 0.9157, test_f1: 0.5424
 epoch: 46, train_loss: 0.7485, test_loss: 0.9354, test_f1: 0.5446
 epoch: 47, train_loss: 0.7437, test_loss: 0.9064, test_f1: 0.5642
 epoch: 48, train_loss: 0.7499, test_loss: 0.9360, test_f1: 0.5507
 epoch: 49, train_loss: 0.7480, test_loss: 0.9295, test_f1: 0.5493
 epoch: 50, train_loss: 0.7409, test_loss: 0.9359, test_f1: 0.5472
 epoch: 51, train_loss: 0.7311, test_loss: 0.9329, test_f1: 0.5519
 epoch: 52, train_loss: 0.7311, test_loss: 0.9367, test_f1: 0.5721
 epoch: 53, train_loss: 0.7282, test_loss: 0.9332, test_f1: 0.5530
 epoch: 54, train_loss: 0.7287, test_loss: 0.9223, test_f1: 0.5531
 epoch: 55, train_loss: 0.7173, test_loss: 0.9232, test_f1: 0.5519
 epoch: 56, train_loss: 0.7161, test_loss: 0.9460, test_f1: 0.5490
 epoch: 57, train_loss: 0.7058, test_loss: 0.9340, test_f1: 0.5701
 epoch: 58, train_loss: 0.7121, test_loss: 0.9360, test_f1: 0.5444
 epoch: 59, train_loss: 0.7033, test_loss: 0.9369, test_f1: 0.5572
 epoch: 60, train_loss: 0.7118, test_loss: 0.9357, test_f1: 0.5526
 epoch: 61, train_loss: 0.7043, test_loss: 0.9448, test_f1: 0.5370
 epoch: 62, train_loss: 0.6998, test_loss: 0.9535, test_f1: 0.5475
 epoch: 63, train_loss: 0.6957, test_loss: 0.9556, test_f1: 0.5580
 epoch: 64, train_loss: 0.7122, test_loss: 0.9627, test_f1: 0.5623
 epoch: 65, train_loss: 0.7148, test_loss: 0.9285, test_f1: 0.5299
 epoch: 66, train_loss: 0.7026, test_loss: 0.9508, test_f1: 0.5340
 epoch: 67, train_loss: 0.7016, test_loss: 0.9591, test_f1: 0.5385
 epoch: 68, train_loss: 0.6828, test_loss: 0.9743, test_f1: 0.5446
 epoch: 69, train_loss: 0.6933, test_loss: 0.9602, test_f1: 0.5519
 epoch: 70, train_loss: 0.6933, test_loss: 0.9406, test_f1: 0.5430
 epoch: 71, train_loss: 0.6859, test_loss: 0.9477, test_f1: 0.5496
 epoch: 72, train_loss: 0.6818, test_loss: 0.9567, test_f1: 0.5424
 epoch: 73, train_loss: 0.6994, test_loss: 0.9545, test_f1: 0.5566
 epoch: 74, train_loss: 0.6805, test_loss: 0.9833, test_f1: 0.5474
 epoch: 75, train_loss: 0.6786, test_loss: 0.9712, test_f1: 0.5563
 epoch: 76, train_loss: 0.6808, test_loss: 0.9910, test_f1: 0.5443
 epoch: 77, train_loss: 0.6895, test_loss: 0.9721, test_f1: 0.5468
 epoch: 78, train_loss: 0.6751, test_loss: 0.9722, test_f1: 0.5518
 epoch: 79, train_loss: 0.6800, test_loss: 0.9594, test_f1: 0.5427
 epoch: 80, train_loss: 0.6749, test_loss: 0.9464, test_f1: 0.5491
 epoch: 81, train_loss: 0.6660, test_loss: 0.9665, test_f1: 0.5568
 epoch: 82, train_loss: 0.6700, test_loss: 0.9446, test_f1: 0.5486
 epoch: 83, train_loss: 0.6637, test_loss: 0.9736, test_f1: 0.5555
 epoch: 84, train_loss: 0.6572, test_loss: 0.9640, test_f1: 0.5453
 epoch: 85, train_loss: 0.6599, test_loss: 0.9709, test_f1: 0.5535
 epoch: 86, train_loss: 0.6614, test_loss: 0.9758, test_f1: 0.5536
 epoch: 87, train_loss: 0.6691, test_loss: 0.9908, test_f1: 0.5501
 epoch: 88, train_loss: 0.6457, test_loss: 0.9981, test_f1: 0.5494
 epoch: 89, train_loss: 0.6638, test_loss: 0.9863, test_f1: 0.5554
 epoch: 90, train_loss: 0.6726, test_loss: 0.9816, test_f1: 0.5428
 epoch: 91, train_loss: 0.6625, test_loss: 0.9669, test_f1: 0.5539
 epoch: 92, train_loss: 0.6524, test_loss: 0.9719, test_f1: 0.5571
 epoch: 93, train_loss: 0.6468, test_loss: 0.9540, test_f1: 0.5639
 epoch: 94, train_loss: 0.6557, test_loss: 0.9870, test_f1: 0.5598
 epoch: 95, train_loss: 0.6686, test_loss: 0.9656, test_f1: 0.5510
 epoch: 96, train_loss: 0.6512, test_loss: 0.9764, test_f1: 0.5621
 epoch: 97, train_loss: 0.6493, test_loss: 0.9882, test_f1: 0.5591
 epoch: 98, train_loss: 0.6436, test_loss: 0.9545, test_f1: 0.5590
 epoch: 99, train_loss: 0.6598, test_loss: 0.9752, test_f1: 0.5655

Training completed in 579.83 seconds
Best F1: 0.5870 at epoch 49
Mean F1 across iterations: 0.5612  0.0149
========================FINAL RESULTS================================
FEGIN weighted F1: 0.5870  0.0149
python main.py --data ltspice_examples --representation component_pin --model FEGIN --layers 6 --hiddens 64 --batch_size 128 --lr 0.0001 --emb_size 250 --epochs 100 --save_appendix component_pin_L6_H64_BS128_LR0.0001_E250 --no_val
-----



STDERR:
  File "main.py", line 370, in <module>
    main()
  File "main.py", line 254, in main
    dataset = dataset_class(
  File "/home/philip/projects/ltspice_examples_code_repo/Circuit-Completion-Using-GNNs/component_classification_with_link_prediction_head/evaluation/FEGIN/kernel/circuit_datasets.py", line 15, in __init__
    self.data, self.slices = torch.load(self.processed_paths[0])
  File "/home/philip/.local/lib/python3.8/site-packages/torch/serialization.py", line 1040, in load
    warnings.warn(
  File "/usr/lib/python3.8/warnings.py", line 109, in _showwarnmsg
    sw(msg.message, msg.category, msg.filename, msg.lineno,
  File "main.py", line 47, in warn_with_traceback
    traceback.print_stack(file=log)
/home/philip/projects/ltspice_examples_code_repo/Circuit-Completion-Using-GNNs/component_classification_with_link_prediction_head/evaluation/FEGIN/kernel/circuit_datasets.py:15: FutureWarning: You are using `torch.load` with `weights_only=False` (the current default value), which uses the default pickle module implicitly. It is possible to construct malicious pickle data which will execute arbitrary code during unpickling (See https://github.com/pytorch/pytorch/blob/main/SECURITY.md#untrusted-models for more details). In a future release, the default value for `weights_only` will be flipped to `True`. This limits the functions that could be executed during unpickling. Arbitrary objects will no longer be allowed to be loaded via this mode unless they are explicitly allowlisted by the user via `torch.serialization.add_safe_globals`. We recommend you start setting `weights_only=True` for any use case where you don't have full control of the loaded file. Please open an issue on GitHub for any issues related to this experimental feature.
  self.data, self.slices = torch.load(self.processed_paths[0])
