STDOUT:
Results will be saved in /home/philip/projects/ltspice_examples_code_repo/Circuit-Completion-Using-GNNs/component_classification_with_link_prediction_head/evaluation/FEGIN/results/model_FEGIN_dataset_ltspice_demos
Command line input: python main.py --data ltspice_demos --representation component_pin --model FEGIN --layers 3 --hiddens 16 --batch_size 256 --lr 0.1 --emb_size 128 --epochs 100 --save_appendix component_pin_L3_H16_BS256_LR0.1_E128 --no_val
 is saved.
-----
ltspice_demos - FEGIN
Using 3 layers, 16 hidden units, h = 2
Loading component_pin representation dataset
ENTERED
Training FEGIN on component_pin representation
Train: 1565, Test: 383
##################ITERATION #0 ****************************************
 epoch: 0, train_loss: 1.3871, test_loss: 1.3043, test_f1: 0.2248
 epoch: 1, train_loss: 1.2694, test_loss: 1.2984, test_f1: 0.2281
 epoch: 2, train_loss: 1.2498, test_loss: 1.3105, test_f1: 0.2138
 epoch: 3, train_loss: 1.2442, test_loss: 1.3716, test_f1: 0.2304
 epoch: 4, train_loss: 1.2239, test_loss: 1.3237, test_f1: 0.3234
 epoch: 5, train_loss: 1.2169, test_loss: 1.2514, test_f1: 0.3405
 epoch: 6, train_loss: 1.1835, test_loss: 1.2577, test_f1: 0.3364
 epoch: 7, train_loss: 1.1384, test_loss: 1.4327, test_f1: 0.2700
 epoch: 8, train_loss: 1.0997, test_loss: 1.5853, test_f1: 0.3265
 epoch: 9, train_loss: 1.0925, test_loss: 1.6455, test_f1: 0.2671
 epoch: 10, train_loss: 1.0815, test_loss: 1.1273, test_f1: 0.3395
 epoch: 11, train_loss: 1.0644, test_loss: 1.1687, test_f1: 0.3852
 epoch: 12, train_loss: 1.0481, test_loss: 1.1280, test_f1: 0.4339
 epoch: 13, train_loss: 1.0544, test_loss: 1.1155, test_f1: 0.3420
 epoch: 14, train_loss: 1.0606, test_loss: 1.3530, test_f1: 0.2828
 epoch: 15, train_loss: 1.0611, test_loss: 1.1084, test_f1: 0.3438
 epoch: 16, train_loss: 1.0741, test_loss: 1.1429, test_f1: 0.3344
 epoch: 17, train_loss: 1.0710, test_loss: 1.1548, test_f1: 0.3638
 epoch: 18, train_loss: 1.0474, test_loss: 1.1777, test_f1: 0.3932
 epoch: 19, train_loss: 1.0380, test_loss: 1.1435, test_f1: 0.3585
 epoch: 20, train_loss: 1.0343, test_loss: 1.1269, test_f1: 0.3370
 epoch: 21, train_loss: 1.0389, test_loss: 1.1513, test_f1: 0.3344
 epoch: 22, train_loss: 1.0385, test_loss: 1.1783, test_f1: 0.3915
 epoch: 23, train_loss: 1.0384, test_loss: 1.1855, test_f1: 0.3599
 epoch: 24, train_loss: 1.0393, test_loss: 1.1315, test_f1: 0.3697
 epoch: 25, train_loss: 1.0301, test_loss: 1.1464, test_f1: 0.4620
 epoch: 26, train_loss: 1.0378, test_loss: 1.1776, test_f1: 0.4568
 epoch: 27, train_loss: 1.0427, test_loss: 1.1241, test_f1: 0.3840
 epoch: 28, train_loss: 1.0388, test_loss: 1.1092, test_f1: 0.4360
 epoch: 29, train_loss: 1.0313, test_loss: 1.0916, test_f1: 0.4397
 epoch: 30, train_loss: 1.0189, test_loss: 1.1281, test_f1: 0.3669
 epoch: 31, train_loss: 1.0522, test_loss: 1.1753, test_f1: 0.3594
 epoch: 32, train_loss: 1.0598, test_loss: 1.1193, test_f1: 0.4541
 epoch: 33, train_loss: 1.0338, test_loss: 1.0994, test_f1: 0.4597
 epoch: 34, train_loss: 1.0232, test_loss: 1.0998, test_f1: 0.3444
 epoch: 35, train_loss: 1.0424, test_loss: 1.1330, test_f1: 0.3373
 epoch: 36, train_loss: 1.0483, test_loss: 1.1071, test_f1: 0.4090
 epoch: 37, train_loss: 1.0328, test_loss: 1.1097, test_f1: 0.3702
 epoch: 38, train_loss: 1.0195, test_loss: 1.1136, test_f1: 0.4137
 epoch: 39, train_loss: 1.0383, test_loss: 1.1206, test_f1: 0.3344
 epoch: 40, train_loss: 1.0274, test_loss: 1.1097, test_f1: 0.4830
 epoch: 41, train_loss: 1.0483, test_loss: 1.1160, test_f1: 0.3344
 epoch: 42, train_loss: 1.0320, test_loss: 1.1121, test_f1: 0.4267
 epoch: 43, train_loss: 1.0313, test_loss: 1.1194, test_f1: 0.3395
 epoch: 44, train_loss: 1.0235, test_loss: 1.0883, test_f1: 0.3444
 epoch: 45, train_loss: 1.0170, test_loss: 1.1164, test_f1: 0.4757
 epoch: 46, train_loss: 1.0074, test_loss: 1.1146, test_f1: 0.3602
 epoch: 47, train_loss: 1.0250, test_loss: 1.1034, test_f1: 0.3395
 epoch: 48, train_loss: 1.0404, test_loss: 1.1382, test_f1: 0.4641
 epoch: 49, train_loss: 1.0409, test_loss: 1.1037, test_f1: 0.4267
 epoch: 50, train_loss: 1.0124, test_loss: 1.1111, test_f1: 0.3698
 epoch: 51, train_loss: 1.0214, test_loss: 1.1102, test_f1: 0.3344
 epoch: 52, train_loss: 1.0423, test_loss: 1.1348, test_f1: 0.3268
 epoch: 53, train_loss: 1.0548, test_loss: 1.1319, test_f1: 0.4519
 epoch: 54, train_loss: 1.0438, test_loss: 1.1024, test_f1: 0.4596
 epoch: 55, train_loss: 1.0187, test_loss: 1.1020, test_f1: 0.4690
 epoch: 56, train_loss: 1.0109, test_loss: 1.0830, test_f1: 0.4050
 epoch: 57, train_loss: 1.0128, test_loss: 1.0869, test_f1: 0.3602
 epoch: 58, train_loss: 1.0113, test_loss: 1.0894, test_f1: 0.4633
 epoch: 59, train_loss: 1.0242, test_loss: 1.1105, test_f1: 0.4589
 epoch: 60, train_loss: 1.0439, test_loss: 1.1085, test_f1: 0.4455
 epoch: 61, train_loss: 1.0361, test_loss: 1.0998, test_f1: 0.4101
 epoch: 62, train_loss: 1.0234, test_loss: 1.1139, test_f1: 0.4222
 epoch: 63, train_loss: 1.0227, test_loss: 1.0776, test_f1: 0.4703
 epoch: 64, train_loss: 1.0217, test_loss: 1.0747, test_f1: 0.4560
 epoch: 65, train_loss: 1.0182, test_loss: 1.0748, test_f1: 0.4220
 epoch: 66, train_loss: 1.0148, test_loss: 1.0834, test_f1: 0.4712
 epoch: 67, train_loss: 1.0130, test_loss: 1.0728, test_f1: 0.4710
 epoch: 68, train_loss: 1.0105, test_loss: 1.0680, test_f1: 0.4715
 epoch: 69, train_loss: 1.0097, test_loss: 1.0674, test_f1: 0.4771
 epoch: 70, train_loss: 1.0078, test_loss: 1.0857, test_f1: 0.4704
 epoch: 71, train_loss: 1.0044, test_loss: 1.0866, test_f1: 0.3982
 epoch: 72, train_loss: 1.0030, test_loss: 1.0945, test_f1: 0.4731
 epoch: 73, train_loss: 0.9976, test_loss: 1.0967, test_f1: 0.4681
 epoch: 74, train_loss: 0.9971, test_loss: 1.0827, test_f1: 0.4430
 epoch: 75, train_loss: 0.9994, test_loss: 1.0836, test_f1: 0.4674
 epoch: 76, train_loss: 0.9908, test_loss: 1.0678, test_f1: 0.4428
 epoch: 77, train_loss: 0.9911, test_loss: 1.0688, test_f1: 0.4682
 epoch: 78, train_loss: 1.0015, test_loss: 1.0723, test_f1: 0.4525
 epoch: 79, train_loss: 0.9919, test_loss: 1.0881, test_f1: 0.3965
 epoch: 80, train_loss: 0.9936, test_loss: 1.0867, test_f1: 0.4723
 epoch: 81, train_loss: 1.0239, test_loss: 1.0702, test_f1: 0.4281
 epoch: 82, train_loss: 1.0494, test_loss: 1.1086, test_f1: 0.3344
 epoch: 83, train_loss: 1.0527, test_loss: 1.0950, test_f1: 0.4457
 epoch: 84, train_loss: 1.0425, test_loss: 1.1046, test_f1: 0.4304
 epoch: 85, train_loss: 1.0261, test_loss: 1.0906, test_f1: 0.4733
 epoch: 86, train_loss: 1.0242, test_loss: 1.0830, test_f1: 0.4782
 epoch: 87, train_loss: 1.0107, test_loss: 1.0755, test_f1: 0.4173
 epoch: 88, train_loss: 1.0007, test_loss: 1.0861, test_f1: 0.4696
 epoch: 89, train_loss: 1.0051, test_loss: 1.0763, test_f1: 0.4318
 epoch: 90, train_loss: 1.0077, test_loss: 1.0896, test_f1: 0.3697
 epoch: 91, train_loss: 0.9903, test_loss: 1.0895, test_f1: 0.4414
 epoch: 92, train_loss: 0.9943, test_loss: 1.0845, test_f1: 0.4482
 epoch: 93, train_loss: 0.9927, test_loss: 1.0903, test_f1: 0.3395
 epoch: 94, train_loss: 1.0437, test_loss: 1.1189, test_f1: 0.3317
 epoch: 95, train_loss: 1.0284, test_loss: 1.1331, test_f1: 0.4131
 epoch: 96, train_loss: 1.0254, test_loss: 1.0892, test_f1: 0.4414
 epoch: 97, train_loss: 1.0092, test_loss: 1.1075, test_f1: 0.4669
 epoch: 98, train_loss: 1.0308, test_loss: 1.5632, test_f1: 0.2862
 epoch: 99, train_loss: 1.0353, test_loss: 1.0983, test_f1: 0.3297
##################ITERATION #1 ****************************************
 epoch: 0, train_loss: 1.2838, test_loss: 2.3728, test_f1: 0.1371
 epoch: 1, train_loss: 1.2603, test_loss: 1.2988, test_f1: 0.2244
 epoch: 2, train_loss: 1.2360, test_loss: 1.2616, test_f1: 0.2281
 epoch: 3, train_loss: 1.2275, test_loss: 1.2864, test_f1: 0.2281
 epoch: 4, train_loss: 1.1851, test_loss: 1.2917, test_f1: 0.2281
 epoch: 5, train_loss: 1.1626, test_loss: 1.2088, test_f1: 0.2336
 epoch: 6, train_loss: 1.1262, test_loss: 1.1376, test_f1: 0.3346
 epoch: 7, train_loss: 1.1144, test_loss: 1.1244, test_f1: 0.3146
 epoch: 8, train_loss: 1.1304, test_loss: 1.2032, test_f1: 0.2675
 epoch: 9, train_loss: 1.1062, test_loss: 1.1442, test_f1: 0.3290
 epoch: 10, train_loss: 1.0918, test_loss: 1.2423, test_f1: 0.2934
 epoch: 11, train_loss: 1.0793, test_loss: 1.1423, test_f1: 0.3290
 epoch: 12, train_loss: 1.0599, test_loss: 1.2565, test_f1: 0.2972
 epoch: 13, train_loss: 1.0377, test_loss: 1.1144, test_f1: 0.3853
 epoch: 14, train_loss: 1.0381, test_loss: 1.0936, test_f1: 0.4091
 epoch: 15, train_loss: 1.0154, test_loss: 1.0667, test_f1: 0.4290
 epoch: 16, train_loss: 0.9975, test_loss: 1.0836, test_f1: 0.4198
 epoch: 17, train_loss: 0.9767, test_loss: 1.0544, test_f1: 0.4234
 epoch: 18, train_loss: 0.9621, test_loss: 1.0612, test_f1: 0.4440
 epoch: 19, train_loss: 0.9606, test_loss: 1.0185, test_f1: 0.4339
 epoch: 20, train_loss: 0.9462, test_loss: 1.0696, test_f1: 0.4361
 epoch: 21, train_loss: 0.9566, test_loss: 1.0188, test_f1: 0.4496
 epoch: 22, train_loss: 0.9377, test_loss: 1.2443, test_f1: 0.4462
 epoch: 23, train_loss: 0.9294, test_loss: 1.0197, test_f1: 0.4690
 epoch: 24, train_loss: 0.9267, test_loss: 1.0465, test_f1: 0.4283
 epoch: 25, train_loss: 0.9232, test_loss: 1.0415, test_f1: 0.4367
 epoch: 26, train_loss: 0.9486, test_loss: 1.0353, test_f1: 0.4416
 epoch: 27, train_loss: 0.9162, test_loss: 1.1045, test_f1: 0.4316
 epoch: 28, train_loss: 0.9147, test_loss: 1.1417, test_f1: 0.3934
 epoch: 29, train_loss: 0.9118, test_loss: 1.0209, test_f1: 0.4240
 epoch: 30, train_loss: 0.9211, test_loss: 1.0123, test_f1: 0.4453
 epoch: 31, train_loss: 0.9087, test_loss: 1.8421, test_f1: 0.3864
 epoch: 32, train_loss: 0.9366, test_loss: 1.0161, test_f1: 0.4585
 epoch: 33, train_loss: 0.9779, test_loss: 1.0060, test_f1: 0.4334
 epoch: 34, train_loss: 0.9391, test_loss: 1.0799, test_f1: 0.3945
 epoch: 35, train_loss: 0.9338, test_loss: 1.0529, test_f1: 0.4260
 epoch: 36, train_loss: 0.9687, test_loss: 1.1395, test_f1: 0.3373
 epoch: 37, train_loss: 1.0033, test_loss: 1.1280, test_f1: 0.3928
 epoch: 38, train_loss: 0.9440, test_loss: 1.5875, test_f1: 0.3373
 epoch: 39, train_loss: 0.9477, test_loss: 1.0997, test_f1: 0.3947
 epoch: 40, train_loss: 0.9759, test_loss: 1.0416, test_f1: 0.4315
 epoch: 41, train_loss: 0.9562, test_loss: 1.0838, test_f1: 0.4170
 epoch: 42, train_loss: 0.9835, test_loss: 1.0499, test_f1: 0.3798
 epoch: 43, train_loss: 1.0274, test_loss: 1.1947, test_f1: 0.3486
 epoch: 44, train_loss: 0.9966, test_loss: 1.1216, test_f1: 0.4102
 epoch: 45, train_loss: 0.9650, test_loss: 1.0784, test_f1: 0.4225
 epoch: 46, train_loss: 0.9503, test_loss: 1.0552, test_f1: 0.4213
 epoch: 47, train_loss: 0.9406, test_loss: 1.0503, test_f1: 0.4291
 epoch: 48, train_loss: 0.9380, test_loss: 1.0358, test_f1: 0.4323
 epoch: 49, train_loss: 0.9426, test_loss: 1.0230, test_f1: 0.4435
 epoch: 50, train_loss: 0.9445, test_loss: 1.0207, test_f1: 0.5267
 epoch: 51, train_loss: 0.9125, test_loss: 1.0367, test_f1: 0.4301
 epoch: 52, train_loss: 0.9210, test_loss: 1.0344, test_f1: 0.4236
 epoch: 53, train_loss: 0.9091, test_loss: 1.0259, test_f1: 0.4254
 epoch: 54, train_loss: 0.9335, test_loss: 1.0025, test_f1: 0.4333
 epoch: 55, train_loss: 0.9216, test_loss: 1.0126, test_f1: 0.4477
 epoch: 56, train_loss: 0.9210, test_loss: 1.0219, test_f1: 0.4459
 epoch: 57, train_loss: 0.9005, test_loss: 1.0176, test_f1: 0.4460
 epoch: 58, train_loss: 0.9136, test_loss: 1.0699, test_f1: 0.4407
 epoch: 59, train_loss: 0.9138, test_loss: 1.0463, test_f1: 0.4484
 epoch: 60, train_loss: 0.9027, test_loss: 1.0748, test_f1: 0.4481
 epoch: 61, train_loss: 0.9022, test_loss: 0.9968, test_f1: 0.4406
 epoch: 62, train_loss: 0.9132, test_loss: 0.9934, test_f1: 0.4408
 epoch: 63, train_loss: 0.9097, test_loss: 1.1047, test_f1: 0.4371
 epoch: 64, train_loss: 0.9058, test_loss: 1.1077, test_f1: 0.4976
 epoch: 65, train_loss: 0.8857, test_loss: 1.0077, test_f1: 0.4364
 epoch: 66, train_loss: 0.8828, test_loss: 1.0226, test_f1: 0.4283
 epoch: 67, train_loss: 0.8880, test_loss: 1.0044, test_f1: 0.4385
 epoch: 68, train_loss: 0.8822, test_loss: 0.9838, test_f1: 0.4626
 epoch: 69, train_loss: 0.8825, test_loss: 1.1057, test_f1: 0.4297
 epoch: 70, train_loss: 0.8733, test_loss: 1.0208, test_f1: 0.4546
 epoch: 71, train_loss: 0.8823, test_loss: 1.1312, test_f1: 0.4724
 epoch: 72, train_loss: 0.8647, test_loss: 1.0045, test_f1: 0.4497
 epoch: 73, train_loss: 0.8634, test_loss: 0.9991, test_f1: 0.4534
 epoch: 74, train_loss: 0.8770, test_loss: 1.0773, test_f1: 0.4459
 epoch: 75, train_loss: 0.9314, test_loss: 1.1417, test_f1: 0.4274
 epoch: 76, train_loss: 0.9051, test_loss: 1.7061, test_f1: 0.3278
 epoch: 77, train_loss: 0.9123, test_loss: 1.1552, test_f1: 0.4262
 epoch: 78, train_loss: 0.9161, test_loss: 1.0177, test_f1: 0.4516
 epoch: 79, train_loss: 0.9152, test_loss: 0.9622, test_f1: 0.4473
 epoch: 80, train_loss: 0.9065, test_loss: 0.9710, test_f1: 0.4516
 epoch: 81, train_loss: 0.8948, test_loss: 0.9822, test_f1: 0.4434
 epoch: 82, train_loss: 0.8896, test_loss: 0.9807, test_f1: 0.4426
 epoch: 83, train_loss: 0.8761, test_loss: 0.9885, test_f1: 0.4494
 epoch: 84, train_loss: 0.8785, test_loss: 0.9780, test_f1: 0.4477
 epoch: 85, train_loss: 0.8513, test_loss: 1.0011, test_f1: 0.4377
 epoch: 86, train_loss: 0.8505, test_loss: 1.0473, test_f1: 0.4620
 epoch: 87, train_loss: 0.8597, test_loss: 0.9820, test_f1: 0.5043
 epoch: 88, train_loss: 0.8440, test_loss: 1.0278, test_f1: 0.4336
 epoch: 89, train_loss: 0.8592, test_loss: 1.0615, test_f1: 0.4596
 epoch: 90, train_loss: 0.8291, test_loss: 1.0193, test_f1: 0.4852
 epoch: 91, train_loss: 0.8300, test_loss: 1.0481, test_f1: 0.4789
 epoch: 92, train_loss: 0.8309, test_loss: 1.0304, test_f1: 0.4803
 epoch: 93, train_loss: 0.8241, test_loss: 0.9948, test_f1: 0.4914
 epoch: 94, train_loss: 0.8310, test_loss: 1.0012, test_f1: 0.4908
 epoch: 95, train_loss: 0.8449, test_loss: 1.0697, test_f1: 0.4224
 epoch: 96, train_loss: 0.8642, test_loss: 0.9823, test_f1: 0.4570
 epoch: 97, train_loss: 0.8251, test_loss: 1.0780, test_f1: 0.4471
 epoch: 98, train_loss: 0.8367, test_loss: 1.1371, test_f1: 0.4384
 epoch: 99, train_loss: 0.8365, test_loss: 1.0561, test_f1: 0.4635
##################ITERATION #2 ****************************************
 epoch: 0, train_loss: 1.5319, test_loss: 1.3679, test_f1: 0.2281
 epoch: 1, train_loss: 1.2700, test_loss: 1.3452, test_f1: 0.2404
 epoch: 2, train_loss: 1.2580, test_loss: 1.3094, test_f1: 0.2248
 epoch: 3, train_loss: 1.2563, test_loss: 1.3121, test_f1: 0.2436
 epoch: 4, train_loss: 1.2602, test_loss: 1.3057, test_f1: 0.2281
 epoch: 5, train_loss: 1.2623, test_loss: 1.3144, test_f1: 0.2281
 epoch: 6, train_loss: 1.2496, test_loss: 1.2878, test_f1: 0.2281
 epoch: 7, train_loss: 1.2508, test_loss: 1.3053, test_f1: 0.1836
 epoch: 8, train_loss: 1.2442, test_loss: 1.3413, test_f1: 0.2404
 epoch: 9, train_loss: 1.2241, test_loss: 1.3144, test_f1: 0.2770
 epoch: 10, train_loss: 1.2016, test_loss: 2.3300, test_f1: 0.0931
 epoch: 11, train_loss: 1.1876, test_loss: 2.7354, test_f1: 0.0507
 epoch: 12, train_loss: 1.1604, test_loss: 1.2687, test_f1: 0.3095
 epoch: 13, train_loss: 1.1595, test_loss: 1.5494, test_f1: 0.2229
 epoch: 14, train_loss: 1.1304, test_loss: 1.1733, test_f1: 0.3384
 epoch: 15, train_loss: 1.0637, test_loss: 1.0999, test_f1: 0.4063
 epoch: 16, train_loss: 1.0065, test_loss: 1.3964, test_f1: 0.3144
 epoch: 17, train_loss: 1.0527, test_loss: 1.1571, test_f1: 0.3493
 epoch: 18, train_loss: 1.0184, test_loss: 1.2337, test_f1: 0.3812
 epoch: 19, train_loss: 1.0227, test_loss: 1.1246, test_f1: 0.4136
 epoch: 20, train_loss: 0.9790, test_loss: 1.0513, test_f1: 0.4335
 epoch: 21, train_loss: 0.9614, test_loss: 1.1182, test_f1: 0.4233
 epoch: 22, train_loss: 0.9756, test_loss: 1.0524, test_f1: 0.4270
 epoch: 23, train_loss: 0.9695, test_loss: 1.0693, test_f1: 0.4113
 epoch: 24, train_loss: 0.9774, test_loss: 1.0690, test_f1: 0.4075
 epoch: 25, train_loss: 0.9688, test_loss: 1.0484, test_f1: 0.4210
 epoch: 26, train_loss: 0.9671, test_loss: 1.0575, test_f1: 0.4183
 epoch: 27, train_loss: 0.9407, test_loss: 1.0570, test_f1: 0.4314
 epoch: 28, train_loss: 0.9985, test_loss: 1.2682, test_f1: 0.3882
 epoch: 29, train_loss: 0.9536, test_loss: 1.0323, test_f1: 0.4255
 epoch: 30, train_loss: 0.9567, test_loss: 1.0460, test_f1: 0.4260
 epoch: 31, train_loss: 0.9452, test_loss: 1.0378, test_f1: 0.4340
 epoch: 32, train_loss: 0.9367, test_loss: 1.0219, test_f1: 0.4296
 epoch: 33, train_loss: 0.9569, test_loss: 1.0910, test_f1: 0.4041
 epoch: 34, train_loss: 0.9579, test_loss: 1.0390, test_f1: 0.4336
 epoch: 35, train_loss: 0.9398, test_loss: 1.2062, test_f1: 0.3340
 epoch: 36, train_loss: 1.0493, test_loss: 1.2019, test_f1: 0.3409
 epoch: 37, train_loss: 1.0623, test_loss: 1.1861, test_f1: 0.3346
 epoch: 38, train_loss: 1.0351, test_loss: 1.3517, test_f1: 0.3908
 epoch: 39, train_loss: 0.9777, test_loss: 1.1637, test_f1: 0.4065
 epoch: 40, train_loss: 1.0865, test_loss: 1.1071, test_f1: 0.3719
 epoch: 41, train_loss: 1.0645, test_loss: 1.1024, test_f1: 0.3835
 epoch: 42, train_loss: 1.0444, test_loss: 1.1134, test_f1: 0.3248
 epoch: 43, train_loss: 1.0589, test_loss: 1.1584, test_f1: 0.4014
 epoch: 44, train_loss: 1.0153, test_loss: 1.2125, test_f1: 0.3802
 epoch: 45, train_loss: 0.9934, test_loss: 1.3744, test_f1: 0.2662
 epoch: 46, train_loss: 0.9666, test_loss: 1.9059, test_f1: 0.2363
 epoch: 47, train_loss: 0.9543, test_loss: 1.0621, test_f1: 0.4313
 epoch: 48, train_loss: 0.9537, test_loss: 1.0598, test_f1: 0.4203
 epoch: 49, train_loss: 0.9563, test_loss: 1.0486, test_f1: 0.4217
 epoch: 50, train_loss: 0.9592, test_loss: 1.0314, test_f1: 0.4346
 epoch: 51, train_loss: 0.9330, test_loss: 1.0267, test_f1: 0.4401
 epoch: 52, train_loss: 0.9378, test_loss: 1.0390, test_f1: 0.4296
 epoch: 53, train_loss: 0.9297, test_loss: 1.0302, test_f1: 0.4296
 epoch: 54, train_loss: 0.9196, test_loss: 1.0233, test_f1: 0.4214
 epoch: 55, train_loss: 0.9263, test_loss: 1.0416, test_f1: 0.4296
 epoch: 56, train_loss: 0.9192, test_loss: 1.0331, test_f1: 0.4272
 epoch: 57, train_loss: 0.9197, test_loss: 1.0363, test_f1: 0.4308
 epoch: 58, train_loss: 0.9494, test_loss: 1.0333, test_f1: 0.4270
 epoch: 59, train_loss: 0.9514, test_loss: 1.0548, test_f1: 0.4170
 epoch: 60, train_loss: 0.9368, test_loss: 1.0392, test_f1: 0.4217
 epoch: 61, train_loss: 0.9386, test_loss: 1.0076, test_f1: 0.4425
 epoch: 62, train_loss: 0.9439, test_loss: 1.0485, test_f1: 0.4348
 epoch: 63, train_loss: 0.9657, test_loss: 1.1390, test_f1: 0.3942
 epoch: 64, train_loss: 0.9421, test_loss: 1.0490, test_f1: 0.4197
 epoch: 65, train_loss: 0.9509, test_loss: 1.0379, test_f1: 0.4331
 epoch: 66, train_loss: 0.9203, test_loss: 1.0707, test_f1: 0.4170
 epoch: 67, train_loss: 0.9306, test_loss: 1.0828, test_f1: 0.4079
 epoch: 68, train_loss: 0.9241, test_loss: 0.9956, test_f1: 0.4306
 epoch: 69, train_loss: 0.9279, test_loss: 0.9914, test_f1: 0.4392
 epoch: 70, train_loss: 0.9080, test_loss: 1.0255, test_f1: 0.4239
 epoch: 71, train_loss: 0.9192, test_loss: 1.0155, test_f1: 0.4331
 epoch: 72, train_loss: 0.9166, test_loss: 0.9953, test_f1: 0.4366
 epoch: 73, train_loss: 0.9198, test_loss: 1.0112, test_f1: 0.4296
 epoch: 74, train_loss: 0.9087, test_loss: 1.0160, test_f1: 0.4296
 epoch: 75, train_loss: 0.8971, test_loss: 1.0266, test_f1: 0.4321
 epoch: 76, train_loss: 0.9266, test_loss: 1.0157, test_f1: 0.4321
 epoch: 77, train_loss: 0.8983, test_loss: 1.1697, test_f1: 0.4105
 epoch: 78, train_loss: 0.9158, test_loss: 1.0286, test_f1: 0.5257
 epoch: 79, train_loss: 0.8989, test_loss: 1.0603, test_f1: 0.4193
 epoch: 80, train_loss: 0.8983, test_loss: 1.0797, test_f1: 0.4101
 epoch: 81, train_loss: 0.9037, test_loss: 1.0687, test_f1: 0.4159
 epoch: 82, train_loss: 0.8855, test_loss: 1.0250, test_f1: 0.4254
 epoch: 83, train_loss: 0.8880, test_loss: 1.0220, test_f1: 0.4184
 epoch: 84, train_loss: 0.8893, test_loss: 1.0276, test_f1: 0.4184
 epoch: 85, train_loss: 0.8839, test_loss: 1.0494, test_f1: 0.4208
 epoch: 86, train_loss: 0.8895, test_loss: 1.0734, test_f1: 0.4173
 epoch: 87, train_loss: 0.8974, test_loss: 1.0630, test_f1: 0.4141
 epoch: 88, train_loss: 0.9572, test_loss: 1.1226, test_f1: 0.3968
 epoch: 89, train_loss: 0.9385, test_loss: 1.0352, test_f1: 0.4266
 epoch: 90, train_loss: 0.9406, test_loss: 25.2376, test_f1: 0.4092
 epoch: 91, train_loss: 0.9574, test_loss: 1.0508, test_f1: 0.4244
 epoch: 92, train_loss: 0.9693, test_loss: 1.0543, test_f1: 0.4094
 epoch: 93, train_loss: 0.9359, test_loss: 1.2164, test_f1: 0.3889
 epoch: 94, train_loss: 0.9437, test_loss: 1.0422, test_f1: 0.4221
 epoch: 95, train_loss: 0.9280, test_loss: 1.0502, test_f1: 0.4119
 epoch: 96, train_loss: 0.9462, test_loss: 1.1790, test_f1: 0.3907
 epoch: 97, train_loss: 0.9255, test_loss: 1.2932, test_f1: 0.3944
 epoch: 98, train_loss: 0.9264, test_loss: 1.3045, test_f1: 0.3586
 epoch: 99, train_loss: 0.9287, test_loss: 1.1624, test_f1: 0.3744
##################ITERATION #3 ****************************************
 epoch: 0, train_loss: 1.3485, test_loss: 1.3277, test_f1: 0.2281
 epoch: 1, train_loss: 1.2732, test_loss: 1.3092, test_f1: 0.2281
 epoch: 2, train_loss: 1.2541, test_loss: 1.2992, test_f1: 0.2281
 epoch: 3, train_loss: 1.2548, test_loss: 1.3085, test_f1: 0.2281
 epoch: 4, train_loss: 1.2575, test_loss: 1.3154, test_f1: 0.2281
 epoch: 5, train_loss: 1.2570, test_loss: 1.3015, test_f1: 0.2281
 epoch: 6, train_loss: 1.2593, test_loss: 1.3000, test_f1: 0.2281
 epoch: 7, train_loss: 1.2549, test_loss: 1.3215, test_f1: 0.2281
 epoch: 8, train_loss: 1.2570, test_loss: 1.3124, test_f1: 0.2281
 epoch: 9, train_loss: 1.2649, test_loss: 1.3184, test_f1: 0.2281
 epoch: 10, train_loss: 1.2636, test_loss: 1.3022, test_f1: 0.2281
 epoch: 11, train_loss: 1.2555, test_loss: 1.3161, test_f1: 0.2281
 epoch: 12, train_loss: 1.2579, test_loss: 1.3056, test_f1: 0.2281
 epoch: 13, train_loss: 1.2542, test_loss: 1.3074, test_f1: 0.2281
 epoch: 14, train_loss: 1.2549, test_loss: 1.3084, test_f1: 0.2281
 epoch: 15, train_loss: 1.2555, test_loss: 1.3006, test_f1: 0.2281
 epoch: 16, train_loss: 1.2527, test_loss: 1.3149, test_f1: 0.2281
 epoch: 17, train_loss: 1.2532, test_loss: 1.3194, test_f1: 0.2281
 epoch: 18, train_loss: 1.2270, test_loss: 1.6839, test_f1: 0.2034
 epoch: 19, train_loss: 1.2043, test_loss: 1.6389, test_f1: 0.2435
 epoch: 20, train_loss: 1.1943, test_loss: 1.1842, test_f1: 0.3399
 epoch: 21, train_loss: 1.1745, test_loss: 1.1713, test_f1: 0.3413
 epoch: 22, train_loss: 1.1542, test_loss: 2.0783, test_f1: 0.2378
 epoch: 23, train_loss: 1.1734, test_loss: 1.4753, test_f1: 0.3178
 epoch: 24, train_loss: 1.1542, test_loss: 1.2324, test_f1: 0.3380
 epoch: 25, train_loss: 1.1300, test_loss: 1.6599, test_f1: 0.2178
 epoch: 26, train_loss: 1.0906, test_loss: 1.6039, test_f1: 0.2872
 epoch: 27, train_loss: 1.0429, test_loss: 1.7444, test_f1: 0.3280
 epoch: 28, train_loss: 1.0394, test_loss: 1.1281, test_f1: 0.3935
 epoch: 29, train_loss: 0.9917, test_loss: 1.3388, test_f1: 0.3810
 epoch: 30, train_loss: 0.9392, test_loss: 1.1568, test_f1: 0.4281
 epoch: 31, train_loss: 0.9677, test_loss: 2.0366, test_f1: 0.2613
 epoch: 32, train_loss: 0.9928, test_loss: 1.8233, test_f1: 0.2845
 epoch: 33, train_loss: 0.9947, test_loss: 1.2011, test_f1: 0.3934
 epoch: 34, train_loss: 1.0045, test_loss: 1.3828, test_f1: 0.3774
 epoch: 35, train_loss: 0.9747, test_loss: 1.4038, test_f1: 0.3176
 epoch: 36, train_loss: 0.9526, test_loss: 1.6600, test_f1: 0.2882
 epoch: 37, train_loss: 0.9593, test_loss: 1.3872, test_f1: 0.3481
 epoch: 38, train_loss: 0.9539, test_loss: 1.5975, test_f1: 0.3416
 epoch: 39, train_loss: 0.9062, test_loss: 1.2501, test_f1: 0.3722
 epoch: 40, train_loss: 0.9005, test_loss: 1.1831, test_f1: 0.3815
 epoch: 41, train_loss: 0.9810, test_loss: 1.2533, test_f1: 0.3237
 epoch: 42, train_loss: 0.9403, test_loss: 1.3007, test_f1: 0.3908
 epoch: 43, train_loss: 0.9164, test_loss: 1.0986, test_f1: 0.4362
 epoch: 44, train_loss: 0.9334, test_loss: 1.2537, test_f1: 0.4281
 epoch: 45, train_loss: 0.9230, test_loss: 1.2989, test_f1: 0.3888
 epoch: 46, train_loss: 0.9371, test_loss: 1.3743, test_f1: 0.4199
 epoch: 47, train_loss: 0.9146, test_loss: 1.2899, test_f1: 0.4240
 epoch: 48, train_loss: 0.9031, test_loss: 1.2229, test_f1: 0.4336
 epoch: 49, train_loss: 0.9127, test_loss: 1.5136, test_f1: 0.4066
 epoch: 50, train_loss: 0.8914, test_loss: 1.0651, test_f1: 0.4403
 epoch: 51, train_loss: 0.9179, test_loss: 1.5256, test_f1: 0.4268
 epoch: 52, train_loss: 0.9686, test_loss: 1.2024, test_f1: 0.4492
 epoch: 53, train_loss: 0.9358, test_loss: 1.0445, test_f1: 0.4331
 epoch: 54, train_loss: 0.9391, test_loss: 0.9983, test_f1: 0.4477
 epoch: 55, train_loss: 0.9022, test_loss: 1.5066, test_f1: 0.4067
 epoch: 56, train_loss: 0.9043, test_loss: 1.0690, test_f1: 0.4416
 epoch: 57, train_loss: 0.9016, test_loss: 1.1897, test_f1: 0.4255
 epoch: 58, train_loss: 0.8888, test_loss: 1.2589, test_f1: 0.3982
 epoch: 59, train_loss: 0.9300, test_loss: 1.1918, test_f1: 0.3914
 epoch: 60, train_loss: 0.9034, test_loss: 1.1007, test_f1: 0.4260
 epoch: 61, train_loss: 0.8646, test_loss: 1.2661, test_f1: 0.4167
 epoch: 62, train_loss: 0.8735, test_loss: 1.2781, test_f1: 0.4100
 epoch: 63, train_loss: 0.8769, test_loss: 1.0924, test_f1: 0.4401
 epoch: 64, train_loss: 0.8952, test_loss: 1.1887, test_f1: 0.4522
 epoch: 65, train_loss: 0.8783, test_loss: 1.0423, test_f1: 0.4677
 epoch: 66, train_loss: 0.8625, test_loss: 1.0574, test_f1: 0.5264
 epoch: 67, train_loss: 0.8647, test_loss: 1.2410, test_f1: 0.4398
 epoch: 68, train_loss: 0.8612, test_loss: 1.1990, test_f1: 0.4368
 epoch: 69, train_loss: 0.8667, test_loss: 1.1986, test_f1: 0.4499
 epoch: 70, train_loss: 0.8577, test_loss: 1.4309, test_f1: 0.4394
 epoch: 71, train_loss: 0.8445, test_loss: 1.3275, test_f1: 0.4371
 epoch: 72, train_loss: 0.8462, test_loss: 1.0307, test_f1: 0.4519
 epoch: 73, train_loss: 0.8350, test_loss: 1.2147, test_f1: 0.4532
 epoch: 74, train_loss: 0.8420, test_loss: 1.8109, test_f1: 0.4247
 epoch: 75, train_loss: 0.8326, test_loss: 1.4852, test_f1: 0.4361
 epoch: 76, train_loss: 0.8305, test_loss: 1.9092, test_f1: 0.4340
 epoch: 77, train_loss: 0.8490, test_loss: 1.1207, test_f1: 0.4681
 epoch: 78, train_loss: 0.8320, test_loss: 1.2249, test_f1: 0.4124
 epoch: 79, train_loss: 0.8369, test_loss: 1.2310, test_f1: 0.4621
 epoch: 80, train_loss: 0.8536, test_loss: 1.1330, test_f1: 0.5203
 epoch: 81, train_loss: 0.8480, test_loss: 1.0358, test_f1: 0.4664
 epoch: 82, train_loss: 0.8637, test_loss: 1.1314, test_f1: 0.4576
 epoch: 83, train_loss: 0.8462, test_loss: 1.3846, test_f1: 0.4161
 epoch: 84, train_loss: 0.8448, test_loss: 1.2818, test_f1: 0.5159
 epoch: 85, train_loss: 0.9165, test_loss: 1.5665, test_f1: 0.3811
 epoch: 86, train_loss: 0.9201, test_loss: 1.6409, test_f1: 0.3860
 epoch: 87, train_loss: 0.9459, test_loss: 1.3225, test_f1: 0.3982
 epoch: 88, train_loss: 0.9240, test_loss: 1.8919, test_f1: 0.4152
 epoch: 89, train_loss: 0.9136, test_loss: 1.5602, test_f1: 0.4116
 epoch: 90, train_loss: 0.9111, test_loss: 1.2649, test_f1: 0.4097
 epoch: 91, train_loss: 0.8868, test_loss: 1.2339, test_f1: 0.3935
 epoch: 92, train_loss: 0.8745, test_loss: 22.5644, test_f1: 0.2382
 epoch: 93, train_loss: 0.8513, test_loss: 1.1311, test_f1: 0.4564
 epoch: 94, train_loss: 0.8616, test_loss: 1.5467, test_f1: 0.4228
 epoch: 95, train_loss: 0.9304, test_loss: 1.0237, test_f1: 0.4647
 epoch: 96, train_loss: 0.8885, test_loss: 1.1304, test_f1: 0.4401
 epoch: 97, train_loss: 0.8710, test_loss: 1.1685, test_f1: 0.4349
 epoch: 98, train_loss: 0.8723, test_loss: 1.0126, test_f1: 0.4515
 epoch: 99, train_loss: 0.9012, test_loss: 1.0205, test_f1: 0.4503
##################ITERATION #4 ****************************************
 epoch: 0, train_loss: 1.4485, test_loss: 1.6533, test_f1: 0.2281
 epoch: 1, train_loss: 1.1945, test_loss: 2.0626, test_f1: 0.1043
 epoch: 2, train_loss: 1.1247, test_loss: 5.6727, test_f1: 0.0554
 epoch: 3, train_loss: 1.1099, test_loss: 2.6659, test_f1: 0.2122
 epoch: 4, train_loss: 1.0893, test_loss: 1.1234, test_f1: 0.3324
 epoch: 5, train_loss: 1.0684, test_loss: 1.1228, test_f1: 0.3370
 epoch: 6, train_loss: 1.0683, test_loss: 1.1267, test_f1: 0.3395
 epoch: 7, train_loss: 1.0516, test_loss: 1.1342, test_f1: 0.3395
 epoch: 8, train_loss: 1.0687, test_loss: 1.1388, test_f1: 0.3395
 epoch: 9, train_loss: 1.0491, test_loss: 1.1157, test_f1: 0.3725
 epoch: 10, train_loss: 1.0485, test_loss: 1.1167, test_f1: 0.3395
 epoch: 11, train_loss: 1.0470, test_loss: 1.1018, test_f1: 0.3395
 epoch: 12, train_loss: 1.0499, test_loss: 1.1241, test_f1: 0.3395
 epoch: 13, train_loss: 1.0541, test_loss: 1.1138, test_f1: 0.3395
 epoch: 14, train_loss: 1.0394, test_loss: 1.1140, test_f1: 0.3395
 epoch: 15, train_loss: 1.0330, test_loss: 1.1169, test_f1: 0.3241
 epoch: 16, train_loss: 1.0385, test_loss: 1.1170, test_f1: 0.3395
 epoch: 17, train_loss: 1.0434, test_loss: 1.1101, test_f1: 0.4442
 epoch: 18, train_loss: 1.0271, test_loss: 1.1293, test_f1: 0.3205
 epoch: 19, train_loss: 1.0466, test_loss: 1.1046, test_f1: 0.3444
 epoch: 20, train_loss: 1.0358, test_loss: 1.0945, test_f1: 0.3610
 epoch: 21, train_loss: 1.0431, test_loss: 1.1172, test_f1: 0.3395
 epoch: 22, train_loss: 1.0234, test_loss: 1.0844, test_f1: 0.3408
 epoch: 23, train_loss: 1.0167, test_loss: 1.1295, test_f1: 0.2651
 epoch: 24, train_loss: 1.0273, test_loss: 1.0904, test_f1: 0.4097
 epoch: 25, train_loss: 1.0223, test_loss: 2.7458, test_f1: 0.2890
 epoch: 26, train_loss: 1.0174, test_loss: 1.9522, test_f1: 0.2617
 epoch: 27, train_loss: 0.9984, test_loss: 1.1399, test_f1: 0.3468
 epoch: 28, train_loss: 1.0072, test_loss: 1.1794, test_f1: 0.3906
 epoch: 29, train_loss: 1.0485, test_loss: 1.1497, test_f1: 0.3344
 epoch: 30, train_loss: 1.0314, test_loss: 1.1601, test_f1: 0.3971
 epoch: 31, train_loss: 1.0378, test_loss: 1.2500, test_f1: 0.3922
 epoch: 32, train_loss: 0.9929, test_loss: 1.0591, test_f1: 0.4110
 epoch: 33, train_loss: 0.9816, test_loss: 1.0379, test_f1: 0.4072
 epoch: 34, train_loss: 0.9848, test_loss: 1.1268, test_f1: 0.4078
 epoch: 35, train_loss: 0.9898, test_loss: 1.0825, test_f1: 0.4458
 epoch: 36, train_loss: 1.0448, test_loss: 1.3097, test_f1: 0.2702
 epoch: 37, train_loss: 1.0050, test_loss: 1.1404, test_f1: 0.3999
 epoch: 38, train_loss: 1.0235, test_loss: 1.2606, test_f1: 0.3875
 epoch: 39, train_loss: 1.0159, test_loss: 1.1738, test_f1: 0.3317
 epoch: 40, train_loss: 1.0235, test_loss: 1.1194, test_f1: 0.2942
 epoch: 41, train_loss: 1.0115, test_loss: 1.0821, test_f1: 0.3531
 epoch: 42, train_loss: 0.9857, test_loss: 1.0225, test_f1: 0.5294
 epoch: 43, train_loss: 0.9807, test_loss: 1.2485, test_f1: 0.3793
 epoch: 44, train_loss: 0.9783, test_loss: 1.0406, test_f1: 0.4302
 epoch: 45, train_loss: 0.9680, test_loss: 1.0813, test_f1: 0.4145
 epoch: 46, train_loss: 0.9674, test_loss: 1.0077, test_f1: 0.4410
 epoch: 47, train_loss: 0.9486, test_loss: 0.9992, test_f1: 0.4399
 epoch: 48, train_loss: 0.9741, test_loss: 1.1034, test_f1: 0.3969
 epoch: 49, train_loss: 0.9623, test_loss: 1.0188, test_f1: 0.4370
 epoch: 50, train_loss: 0.9481, test_loss: 1.0865, test_f1: 0.4818
 epoch: 51, train_loss: 0.9198, test_loss: 1.0238, test_f1: 0.4223
 epoch: 52, train_loss: 0.9152, test_loss: 0.9773, test_f1: 0.5471
 epoch: 53, train_loss: 0.9018, test_loss: 0.9830, test_f1: 0.4517
 epoch: 54, train_loss: 0.8938, test_loss: 0.9928, test_f1: 0.4417
 epoch: 55, train_loss: 0.8991, test_loss: 1.0132, test_f1: 0.4368
 epoch: 56, train_loss: 0.8928, test_loss: 0.9806, test_f1: 0.4495
 epoch: 57, train_loss: 0.8805, test_loss: 1.0231, test_f1: 0.4170
 epoch: 58, train_loss: 0.8901, test_loss: 1.0010, test_f1: 0.4348
 epoch: 59, train_loss: 0.8736, test_loss: 0.9586, test_f1: 0.4366
 epoch: 60, train_loss: 0.8837, test_loss: 0.9785, test_f1: 0.4356
 epoch: 61, train_loss: 0.8889, test_loss: 0.9851, test_f1: 0.4132
 epoch: 62, train_loss: 0.8771, test_loss: 1.0271, test_f1: 0.4296
 epoch: 63, train_loss: 0.9096, test_loss: 0.9684, test_f1: 0.4370
 epoch: 64, train_loss: 0.8903, test_loss: 0.9513, test_f1: 0.4599
 epoch: 65, train_loss: 0.8789, test_loss: 0.9627, test_f1: 0.4418
 epoch: 66, train_loss: 0.8822, test_loss: 0.9710, test_f1: 0.4382
 epoch: 67, train_loss: 0.8776, test_loss: 0.9900, test_f1: 0.4194
 epoch: 68, train_loss: 0.9397, test_loss: 1.9491, test_f1: 0.3030
 epoch: 69, train_loss: 0.9779, test_loss: 1.1253, test_f1: 0.4082
 epoch: 70, train_loss: 0.9632, test_loss: 1.3513, test_f1: 0.2721
 epoch: 71, train_loss: 0.9918, test_loss: 6.1169, test_f1: 0.2226
 epoch: 72, train_loss: 0.9962, test_loss: 2.4054, test_f1: 0.3125
 epoch: 73, train_loss: 1.0202, test_loss: 2.5662, test_f1: 0.2594
 epoch: 74, train_loss: 1.0055, test_loss: 2.2002, test_f1: 0.2628
 epoch: 75, train_loss: 0.9545, test_loss: 1.6844, test_f1: 0.3268
 epoch: 76, train_loss: 0.9880, test_loss: 1.1459, test_f1: 0.4139
 epoch: 77, train_loss: 0.9746, test_loss: 1.0130, test_f1: 0.4744
 epoch: 78, train_loss: 0.9463, test_loss: 1.0646, test_f1: 0.4171
 epoch: 79, train_loss: 0.9246, test_loss: 1.0026, test_f1: 0.4348
 epoch: 80, train_loss: 0.9176, test_loss: 0.9725, test_f1: 0.4299
 epoch: 81, train_loss: 0.9111, test_loss: 0.9850, test_f1: 0.4287
 epoch: 82, train_loss: 0.9027, test_loss: 0.9810, test_f1: 0.4374
 epoch: 83, train_loss: 0.9000, test_loss: 0.9661, test_f1: 0.5246
 epoch: 84, train_loss: 0.9123, test_loss: 0.9869, test_f1: 0.4426
 epoch: 85, train_loss: 0.8972, test_loss: 0.9859, test_f1: 0.4956
 epoch: 86, train_loss: 0.9335, test_loss: 1.0252, test_f1: 0.4769
 epoch: 87, train_loss: 0.9466, test_loss: 0.9651, test_f1: 0.4306
 epoch: 88, train_loss: 0.9182, test_loss: 0.9877, test_f1: 0.5203
 epoch: 89, train_loss: 0.9064, test_loss: 0.9923, test_f1: 0.4296
 epoch: 90, train_loss: 0.8989, test_loss: 0.9952, test_f1: 0.5077
 epoch: 91, train_loss: 0.9050, test_loss: 0.9605, test_f1: 0.4279
 epoch: 92, train_loss: 0.9108, test_loss: 0.9784, test_f1: 0.4642
 epoch: 93, train_loss: 0.9219, test_loss: 1.0165, test_f1: 0.4992
 epoch: 94, train_loss: 0.9275, test_loss: 1.0295, test_f1: 0.5192
 epoch: 95, train_loss: 0.8991, test_loss: 0.9744, test_f1: 0.5206
 epoch: 96, train_loss: 0.8986, test_loss: 0.9673, test_f1: 0.4394
 epoch: 97, train_loss: 0.8938, test_loss: 0.9512, test_f1: 0.5448
 epoch: 98, train_loss: 0.8875, test_loss: 0.9539, test_f1: 0.5568
 epoch: 99, train_loss: 0.8863, test_loss: 1.0380, test_f1: 0.3996
##################ITERATION #5 ****************************************
 epoch: 0, train_loss: 1.3256, test_loss: 1.3773, test_f1: 0.2461
 epoch: 1, train_loss: 1.2754, test_loss: 1.3360, test_f1: 0.2281
 epoch: 2, train_loss: 1.2220, test_loss: 1.2444, test_f1: 0.2053
 epoch: 3, train_loss: 1.1312, test_loss: 1.1618, test_f1: 0.3262
 epoch: 4, train_loss: 1.1016, test_loss: 1.2835, test_f1: 0.2491
 epoch: 5, train_loss: 1.0748, test_loss: 1.3167, test_f1: 0.2491
 epoch: 6, train_loss: 1.0682, test_loss: 1.2464, test_f1: 0.3290
 epoch: 7, train_loss: 1.0493, test_loss: 1.2161, test_f1: 0.3290
 epoch: 8, train_loss: 1.0662, test_loss: 3.5387, test_f1: 0.2529
 epoch: 9, train_loss: 1.0900, test_loss: 1.1753, test_f1: 0.3356
 epoch: 10, train_loss: 1.0750, test_loss: 1.1437, test_f1: 0.3395
 epoch: 11, train_loss: 1.0710, test_loss: 1.1435, test_f1: 0.2413
 epoch: 12, train_loss: 1.0766, test_loss: 1.1538, test_f1: 0.3290
 epoch: 13, train_loss: 1.0592, test_loss: 1.2280, test_f1: 0.3270
 epoch: 14, train_loss: 1.0801, test_loss: 1.2967, test_f1: 0.2759
 epoch: 15, train_loss: 1.1025, test_loss: 1.2229, test_f1: 0.3261
 epoch: 16, train_loss: 1.0635, test_loss: 1.6316, test_f1: 0.4071
 epoch: 17, train_loss: 1.0996, test_loss: 1.2472, test_f1: 0.3606
 epoch: 18, train_loss: 1.1274, test_loss: 1.1514, test_f1: 0.3450
 epoch: 19, train_loss: 1.0798, test_loss: 1.1261, test_f1: 0.3542
 epoch: 20, train_loss: 1.0634, test_loss: 1.1486, test_f1: 0.3344
 epoch: 21, train_loss: 1.0630, test_loss: 1.1463, test_f1: 0.3339
 epoch: 22, train_loss: 1.0577, test_loss: 1.1415, test_f1: 0.3358
 epoch: 23, train_loss: 1.0398, test_loss: 1.1353, test_f1: 0.3395
 epoch: 24, train_loss: 1.0502, test_loss: 1.1624, test_f1: 0.3507
 epoch: 25, train_loss: 1.0408, test_loss: 1.1407, test_f1: 0.3344
 epoch: 26, train_loss: 1.0563, test_loss: 1.1410, test_f1: 0.3381
 epoch: 27, train_loss: 1.0368, test_loss: 1.1647, test_f1: 0.3370
 epoch: 28, train_loss: 1.0436, test_loss: 1.1450, test_f1: 0.3414
 epoch: 29, train_loss: 1.0405, test_loss: 1.1502, test_f1: 0.3348
 epoch: 30, train_loss: 1.0831, test_loss: 1.2269, test_f1: 0.2913
 epoch: 31, train_loss: 1.0790, test_loss: 1.1157, test_f1: 0.3395
 epoch: 32, train_loss: 1.0601, test_loss: 1.1397, test_f1: 0.4301
 epoch: 33, train_loss: 1.0600, test_loss: 1.3839, test_f1: 0.3159
 epoch: 34, train_loss: 1.0442, test_loss: 1.4122, test_f1: 0.3065
 epoch: 35, train_loss: 1.0427, test_loss: 1.1635, test_f1: 0.2914
 epoch: 36, train_loss: 1.0299, test_loss: 1.1245, test_f1: 0.3383
 epoch: 37, train_loss: 1.0552, test_loss: 1.1527, test_f1: 0.3344
 epoch: 38, train_loss: 1.0596, test_loss: 1.1553, test_f1: 0.3290
 epoch: 39, train_loss: 1.0533, test_loss: 1.1329, test_f1: 0.3290
 epoch: 40, train_loss: 1.0470, test_loss: 1.1506, test_f1: 0.4144
 epoch: 41, train_loss: 1.0452, test_loss: 1.1292, test_f1: 0.3344
 epoch: 42, train_loss: 1.0508, test_loss: 1.1091, test_f1: 0.3395
 epoch: 43, train_loss: 1.0401, test_loss: 1.1287, test_f1: 0.3395
 epoch: 44, train_loss: 1.0280, test_loss: 1.1267, test_f1: 0.2432
 epoch: 45, train_loss: 1.0411, test_loss: 1.1264, test_f1: 0.3395
 epoch: 46, train_loss: 1.0406, test_loss: 1.1631, test_f1: 0.3344
 epoch: 47, train_loss: 1.1382, test_loss: 1.1296, test_f1: 0.3625
 epoch: 48, train_loss: 1.1611, test_loss: 2.0027, test_f1: 0.2890
 epoch: 49, train_loss: 1.1075, test_loss: 2.2763, test_f1: 0.3256
 epoch: 50, train_loss: 1.1186, test_loss: 1.1506, test_f1: 0.3290
 epoch: 51, train_loss: 1.0756, test_loss: 1.3481, test_f1: 0.2441
 epoch: 52, train_loss: 1.0882, test_loss: 1.2164, test_f1: 0.3018
 epoch: 53, train_loss: 1.0757, test_loss: 1.1486, test_f1: 0.3290
 epoch: 54, train_loss: 1.0716, test_loss: 1.1458, test_f1: 0.3290
 epoch: 55, train_loss: 1.0737, test_loss: 1.1539, test_f1: 0.3290
 epoch: 56, train_loss: 1.0722, test_loss: 1.1555, test_f1: 0.3290
 epoch: 57, train_loss: 1.0716, test_loss: 1.1561, test_f1: 0.3290
 epoch: 58, train_loss: 1.0734, test_loss: 1.1527, test_f1: 0.3290
 epoch: 59, train_loss: 1.0736, test_loss: 1.1473, test_f1: 0.3290
 epoch: 60, train_loss: 1.0730, test_loss: 1.1495, test_f1: 0.3290
 epoch: 61, train_loss: 1.0746, test_loss: 1.1580, test_f1: 0.3290
 epoch: 62, train_loss: 1.0764, test_loss: 1.1615, test_f1: 0.3290
 epoch: 63, train_loss: 1.0754, test_loss: 1.1517, test_f1: 0.3290
 epoch: 64, train_loss: 1.0718, test_loss: 1.1465, test_f1: 0.3290
 epoch: 65, train_loss: 1.0721, test_loss: 1.1497, test_f1: 0.3290
 epoch: 66, train_loss: 1.0714, test_loss: 1.1508, test_f1: 0.3290
 epoch: 67, train_loss: 1.0708, test_loss: 1.1524, test_f1: 0.3290
 epoch: 68, train_loss: 1.0684, test_loss: 1.1483, test_f1: 0.3290
 epoch: 69, train_loss: 1.0643, test_loss: 1.1175, test_f1: 0.3395
 epoch: 70, train_loss: 1.0545, test_loss: 1.1224, test_f1: 0.3395
 epoch: 71, train_loss: 1.0562, test_loss: 1.1547, test_f1: 0.3290
 epoch: 72, train_loss: 1.0658, test_loss: 1.1162, test_f1: 0.3395
 epoch: 73, train_loss: 1.0468, test_loss: 1.1188, test_f1: 0.3395
 epoch: 74, train_loss: 1.0472, test_loss: 1.1214, test_f1: 0.3395
 epoch: 75, train_loss: 1.0691, test_loss: 1.1623, test_f1: 0.3290
 epoch: 76, train_loss: 1.0595, test_loss: 1.1613, test_f1: 0.3290
 epoch: 77, train_loss: 1.0636, test_loss: 1.1423, test_f1: 0.3344
 epoch: 78, train_loss: 1.0550, test_loss: 1.1181, test_f1: 0.3395
 epoch: 79, train_loss: 1.0426, test_loss: 1.1001, test_f1: 0.3444
 epoch: 80, train_loss: 1.0527, test_loss: 1.1179, test_f1: 0.3395
 epoch: 81, train_loss: 1.0533, test_loss: 1.1224, test_f1: 0.3395
 epoch: 82, train_loss: 1.0529, test_loss: 1.1249, test_f1: 0.3395
 epoch: 83, train_loss: 1.0443, test_loss: 1.1200, test_f1: 0.3395
 epoch: 84, train_loss: 1.0532, test_loss: 1.1269, test_f1: 0.3370
 epoch: 85, train_loss: 1.0440, test_loss: 1.1222, test_f1: 0.3395
 epoch: 86, train_loss: 1.0439, test_loss: 1.1322, test_f1: 0.3395
 epoch: 87, train_loss: 1.0360, test_loss: 1.1290, test_f1: 0.3395
 epoch: 88, train_loss: 1.0563, test_loss: 1.1202, test_f1: 0.3395
 epoch: 89, train_loss: 1.0520, test_loss: 1.1361, test_f1: 0.3344
 epoch: 90, train_loss: 1.0618, test_loss: 1.1341, test_f1: 0.3344
 epoch: 91, train_loss: 1.0461, test_loss: 1.1244, test_f1: 0.3395
 epoch: 92, train_loss: 1.0452, test_loss: 1.1212, test_f1: 0.3389
 epoch: 93, train_loss: 1.0408, test_loss: 1.1196, test_f1: 0.3395
 epoch: 94, train_loss: 1.0314, test_loss: 1.1272, test_f1: 0.3395
 epoch: 95, train_loss: 1.0428, test_loss: 1.1257, test_f1: 0.3395
 epoch: 96, train_loss: 1.0292, test_loss: 1.1231, test_f1: 0.3395
 epoch: 97, train_loss: 1.0332, test_loss: 1.1215, test_f1: 0.3395
 epoch: 98, train_loss: 1.0357, test_loss: 1.1275, test_f1: 0.3372
 epoch: 99, train_loss: 1.0254, test_loss: 1.1165, test_f1: 0.3395
##################ITERATION #6 ****************************************
 epoch: 0, train_loss: 1.3276, test_loss: 1.3560, test_f1: 0.2281
 epoch: 1, train_loss: 1.2190, test_loss: 1.2700, test_f1: 0.3396
 epoch: 2, train_loss: 1.1573, test_loss: 1.2004, test_f1: 0.4458
 epoch: 3, train_loss: 1.1137, test_loss: 1.1383, test_f1: 0.4500
 epoch: 4, train_loss: 1.1031, test_loss: 1.2765, test_f1: 0.3612
 epoch: 5, train_loss: 1.0489, test_loss: 1.1184, test_f1: 0.3434
 epoch: 6, train_loss: 1.0423, test_loss: 1.1271, test_f1: 0.3345
 epoch: 7, train_loss: 1.0372, test_loss: 1.0895, test_f1: 0.3344
 epoch: 8, train_loss: 1.0048, test_loss: 1.3085, test_f1: 0.3290
 epoch: 9, train_loss: 0.9840, test_loss: 1.0374, test_f1: 0.4269
 epoch: 10, train_loss: 0.9508, test_loss: 1.0656, test_f1: 0.5146
 epoch: 11, train_loss: 0.9576, test_loss: 1.1094, test_f1: 0.4943
 epoch: 12, train_loss: 0.9350, test_loss: 1.0643, test_f1: 0.5310
 epoch: 13, train_loss: 0.9529, test_loss: 1.1601, test_f1: 0.3999
 epoch: 14, train_loss: 0.8957, test_loss: 1.1367, test_f1: 0.3780
 epoch: 15, train_loss: 0.9124, test_loss: 1.0396, test_f1: 0.4228
 epoch: 16, train_loss: 0.8871, test_loss: 1.2548, test_f1: 0.4927
 epoch: 17, train_loss: 0.8839, test_loss: 3.1517, test_f1: 0.2311
 epoch: 18, train_loss: 0.9647, test_loss: 1.0090, test_f1: 0.5077
 epoch: 19, train_loss: 0.9325, test_loss: 1.1507, test_f1: 0.5102
 epoch: 20, train_loss: 0.9191, test_loss: 1.0855, test_f1: 0.4074
 epoch: 21, train_loss: 0.9006, test_loss: 0.9556, test_f1: 0.5333
 epoch: 22, train_loss: 0.8642, test_loss: 0.9436, test_f1: 0.4331
 epoch: 23, train_loss: 0.8725, test_loss: 2.7474, test_f1: 0.3817
 epoch: 24, train_loss: 0.8569, test_loss: 1.8301, test_f1: 0.4045
 epoch: 25, train_loss: 0.9085, test_loss: 1.1424, test_f1: 0.4083
 epoch: 26, train_loss: 0.8869, test_loss: 1.2272, test_f1: 0.4910
 epoch: 27, train_loss: 0.8597, test_loss: 1.2300, test_f1: 0.4917
 epoch: 28, train_loss: 0.9108, test_loss: 1.0884, test_f1: 0.4192
 epoch: 29, train_loss: 0.8775, test_loss: 0.9157, test_f1: 0.5634
 epoch: 30, train_loss: 0.8519, test_loss: 1.0825, test_f1: 0.5097
 epoch: 31, train_loss: 0.8833, test_loss: 0.9262, test_f1: 0.4674
 epoch: 32, train_loss: 0.8826, test_loss: 1.0192, test_f1: 0.4141
 epoch: 33, train_loss: 0.9297, test_loss: 1.6275, test_f1: 0.3801
 epoch: 34, train_loss: 0.9030, test_loss: 3.3687, test_f1: 0.3131
 epoch: 35, train_loss: 0.8963, test_loss: 1.7432, test_f1: 0.4169
 epoch: 36, train_loss: 0.8684, test_loss: 1.2499, test_f1: 0.4383
 epoch: 37, train_loss: 0.8581, test_loss: 1.1355, test_f1: 0.4600
 epoch: 38, train_loss: 0.8547, test_loss: 2.3524, test_f1: 0.3408
 epoch: 39, train_loss: 0.8498, test_loss: 1.9499, test_f1: 0.3549
 epoch: 40, train_loss: 0.8643, test_loss: 1.1400, test_f1: 0.4665
 epoch: 41, train_loss: 0.8976, test_loss: 1.0974, test_f1: 0.5339
 epoch: 42, train_loss: 0.8668, test_loss: 1.2800, test_f1: 0.5310
 epoch: 43, train_loss: 0.8570, test_loss: 0.9958, test_f1: 0.5054
 epoch: 44, train_loss: 0.8242, test_loss: 1.3094, test_f1: 0.4453
 epoch: 45, train_loss: 0.8262, test_loss: 1.0654, test_f1: 0.5237
 epoch: 46, train_loss: 0.8576, test_loss: 1.0721, test_f1: 0.4434
 epoch: 47, train_loss: 0.8340, test_loss: 1.3317, test_f1: 0.5195
 epoch: 48, train_loss: 0.8941, test_loss: 1.0228, test_f1: 0.4449
 epoch: 49, train_loss: 0.8781, test_loss: 0.9987, test_f1: 0.4332
 epoch: 50, train_loss: 0.8784, test_loss: 0.9715, test_f1: 0.5393
 epoch: 51, train_loss: 0.8333, test_loss: 0.9896, test_f1: 0.5261
 epoch: 52, train_loss: 0.8415, test_loss: 1.2513, test_f1: 0.4724
 epoch: 53, train_loss: 0.8321, test_loss: 0.9839, test_f1: 0.4402
 epoch: 54, train_loss: 0.8334, test_loss: 1.0181, test_f1: 0.4444
 epoch: 55, train_loss: 0.8226, test_loss: 0.9927, test_f1: 0.4451
 epoch: 56, train_loss: 0.8287, test_loss: 0.9725, test_f1: 0.4419
 epoch: 57, train_loss: 0.8436, test_loss: 1.2851, test_f1: 0.4402
 epoch: 58, train_loss: 0.8140, test_loss: 1.3602, test_f1: 0.4585
 epoch: 59, train_loss: 0.8234, test_loss: 1.3271, test_f1: 0.4397
 epoch: 60, train_loss: 0.8032, test_loss: 1.6877, test_f1: 0.5226
 epoch: 61, train_loss: 0.8143, test_loss: 1.5107, test_f1: 0.4449
 epoch: 62, train_loss: 0.7998, test_loss: 1.6469, test_f1: 0.5319
 epoch: 63, train_loss: 0.7911, test_loss: 2.3518, test_f1: 0.4329
 epoch: 64, train_loss: 0.8258, test_loss: 2.0699, test_f1: 0.3786
 epoch: 65, train_loss: 0.8290, test_loss: 2.1985, test_f1: 0.4434
 epoch: 66, train_loss: 0.8321, test_loss: 2.5814, test_f1: 0.4767
 epoch: 67, train_loss: 0.8072, test_loss: 1.4177, test_f1: 0.4970
 epoch: 68, train_loss: 0.8126, test_loss: 1.1642, test_f1: 0.4253
 epoch: 69, train_loss: 0.8020, test_loss: 1.2082, test_f1: 0.4988
 epoch: 70, train_loss: 0.8113, test_loss: 1.1445, test_f1: 0.4791
 epoch: 71, train_loss: 0.8045, test_loss: 1.2022, test_f1: 0.4483
 epoch: 72, train_loss: 0.7970, test_loss: 2.1607, test_f1: 0.3999
 epoch: 73, train_loss: 0.8152, test_loss: 1.6253, test_f1: 0.4325
 epoch: 74, train_loss: 0.8022, test_loss: 2.1088, test_f1: 0.3671
 epoch: 75, train_loss: 0.8138, test_loss: 1.7721, test_f1: 0.4833
 epoch: 76, train_loss: 0.8092, test_loss: 1.3231, test_f1: 0.5661
 epoch: 77, train_loss: 0.8365, test_loss: 1.1618, test_f1: 0.5091
 epoch: 78, train_loss: 0.8116, test_loss: 1.4388, test_f1: 0.4377
 epoch: 79, train_loss: 0.8164, test_loss: 1.5963, test_f1: 0.4586
 epoch: 80, train_loss: 0.7870, test_loss: 1.4714, test_f1: 0.5382
 epoch: 81, train_loss: 0.8064, test_loss: 1.2301, test_f1: 0.4403
 epoch: 82, train_loss: 0.8036, test_loss: 1.1064, test_f1: 0.4421
 epoch: 83, train_loss: 0.8024, test_loss: 1.0858, test_f1: 0.5249
 epoch: 84, train_loss: 0.7877, test_loss: 1.5119, test_f1: 0.4528
 epoch: 85, train_loss: 0.7833, test_loss: 2.4134, test_f1: 0.4608
 epoch: 86, train_loss: 0.7843, test_loss: 2.9830, test_f1: 0.4007
 epoch: 87, train_loss: 0.7849, test_loss: 1.5138, test_f1: 0.5288
 epoch: 88, train_loss: 0.7954, test_loss: 1.2647, test_f1: 0.5110
 epoch: 89, train_loss: 0.8121, test_loss: 1.5468, test_f1: 0.4395
 epoch: 90, train_loss: 0.7931, test_loss: 1.4087, test_f1: 0.4630
 epoch: 91, train_loss: 0.7920, test_loss: 1.3300, test_f1: 0.5224
 epoch: 92, train_loss: 0.7803, test_loss: 1.2776, test_f1: 0.4728
 epoch: 93, train_loss: 0.7800, test_loss: 1.0267, test_f1: 0.4962
 epoch: 94, train_loss: 0.7762, test_loss: 1.3548, test_f1: 0.4101
 epoch: 95, train_loss: 0.7998, test_loss: 1.0679, test_f1: 0.4386
 epoch: 96, train_loss: 0.8230, test_loss: 1.1909, test_f1: 0.4295
 epoch: 97, train_loss: 0.8377, test_loss: 1.6418, test_f1: 0.4883
 epoch: 98, train_loss: 0.8520, test_loss: 1.2601, test_f1: 0.4110
 epoch: 99, train_loss: 0.8330, test_loss: 1.4235, test_f1: 0.4288
##################ITERATION #7 ****************************************
 epoch: 0, train_loss: 1.3435, test_loss: 1.4649, test_f1: 0.2327
 epoch: 1, train_loss: 1.2099, test_loss: 1.3415, test_f1: 0.2285
 epoch: 2, train_loss: 1.1224, test_loss: 1.1895, test_f1: 0.3017
 epoch: 3, train_loss: 1.1193, test_loss: 2.5031, test_f1: 0.2134
 epoch: 4, train_loss: 1.0929, test_loss: 1.4410, test_f1: 0.2825
 epoch: 5, train_loss: 1.0672, test_loss: 1.3837, test_f1: 0.1394
 epoch: 6, train_loss: 1.0477, test_loss: 1.2105, test_f1: 0.3233
 epoch: 7, train_loss: 1.0493, test_loss: 1.1341, test_f1: 0.3317
 epoch: 8, train_loss: 1.0356, test_loss: 1.3730, test_f1: 0.2336
 epoch: 9, train_loss: 1.0265, test_loss: 10.4924, test_f1: 0.2626
 epoch: 10, train_loss: 1.0968, test_loss: 2.5041, test_f1: 0.2273
 epoch: 11, train_loss: 1.0803, test_loss: 4.8380, test_f1: 0.2321
 epoch: 12, train_loss: 1.0666, test_loss: 2.2861, test_f1: 0.2849
 epoch: 13, train_loss: 1.0453, test_loss: 1.1442, test_f1: 0.4467
 epoch: 14, train_loss: 1.0320, test_loss: 1.1164, test_f1: 0.4349
 epoch: 15, train_loss: 1.0301, test_loss: 1.1065, test_f1: 0.3395
 epoch: 16, train_loss: 1.0317, test_loss: 1.1240, test_f1: 0.4585
 epoch: 17, train_loss: 1.0194, test_loss: 1.1178, test_f1: 0.3395
 epoch: 18, train_loss: 1.0304, test_loss: 1.1432, test_f1: 0.3593
 epoch: 19, train_loss: 1.0270, test_loss: 1.1123, test_f1: 0.3657
 epoch: 20, train_loss: 1.0241, test_loss: 1.1130, test_f1: 0.4538
 epoch: 21, train_loss: 1.0204, test_loss: 1.1239, test_f1: 0.4336
 epoch: 22, train_loss: 0.9949, test_loss: 1.1136, test_f1: 0.4521
 epoch: 23, train_loss: 0.9879, test_loss: 1.1357, test_f1: 0.4110
 epoch: 24, train_loss: 0.9953, test_loss: 1.1203, test_f1: 0.3451
 epoch: 25, train_loss: 1.0075, test_loss: 1.0791, test_f1: 0.3444
 epoch: 26, train_loss: 1.0035, test_loss: 1.3172, test_f1: 0.3112
 epoch: 27, train_loss: 1.0113, test_loss: 1.0720, test_f1: 0.3387
 epoch: 28, train_loss: 0.9950, test_loss: 1.0801, test_f1: 0.3345
 epoch: 29, train_loss: 0.9819, test_loss: 1.1031, test_f1: 0.3921
 epoch: 30, train_loss: 1.0459, test_loss: 1.2691, test_f1: 0.3424
 epoch: 31, train_loss: 1.0425, test_loss: 1.1543, test_f1: 0.3943
 epoch: 32, train_loss: 1.0288, test_loss: 1.5197, test_f1: 0.2559
 epoch: 33, train_loss: 1.0533, test_loss: 1.2519, test_f1: 0.3051
 epoch: 34, train_loss: 1.0303, test_loss: 1.0956, test_f1: 0.3980
 epoch: 35, train_loss: 0.9922, test_loss: 1.0736, test_f1: 0.3420
 epoch: 36, train_loss: 0.9804, test_loss: 1.0606, test_f1: 0.4401
 epoch: 37, train_loss: 0.9706, test_loss: 1.3730, test_f1: 0.3748
 epoch: 38, train_loss: 0.9698, test_loss: 1.1409, test_f1: 0.4164
 epoch: 39, train_loss: 0.9701, test_loss: 1.0657, test_f1: 0.4101
 epoch: 40, train_loss: 0.9824, test_loss: 1.1024, test_f1: 0.4688
 epoch: 41, train_loss: 1.0023, test_loss: 1.0871, test_f1: 0.4509
 epoch: 42, train_loss: 0.9631, test_loss: 1.0928, test_f1: 0.4251
 epoch: 43, train_loss: 0.9475, test_loss: 1.0391, test_f1: 0.4177
 epoch: 44, train_loss: 0.9516, test_loss: 1.1628, test_f1: 0.4072
 epoch: 45, train_loss: 0.9621, test_loss: 1.7758, test_f1: 0.3788
 epoch: 46, train_loss: 0.9341, test_loss: 1.2386, test_f1: 0.3798
 epoch: 47, train_loss: 0.9691, test_loss: 1.0631, test_f1: 0.4154
 epoch: 48, train_loss: 0.9265, test_loss: 1.0323, test_f1: 0.4148
 epoch: 49, train_loss: 0.9476, test_loss: 1.1606, test_f1: 0.4113
 epoch: 50, train_loss: 0.9096, test_loss: 1.2934, test_f1: 0.4090
 epoch: 51, train_loss: 0.9015, test_loss: 1.0478, test_f1: 0.4262
 epoch: 52, train_loss: 0.8826, test_loss: 1.0033, test_f1: 0.4124
 epoch: 53, train_loss: 0.8638, test_loss: 1.0077, test_f1: 0.4328
 epoch: 54, train_loss: 0.8613, test_loss: 1.0921, test_f1: 0.3843
 epoch: 55, train_loss: 0.8676, test_loss: 1.0789, test_f1: 0.4317
 epoch: 56, train_loss: 0.8641, test_loss: 1.0454, test_f1: 0.4274
 epoch: 57, train_loss: 0.8536, test_loss: 1.0702, test_f1: 0.4229
 epoch: 58, train_loss: 0.8623, test_loss: 0.9895, test_f1: 0.4645
 epoch: 59, train_loss: 0.8476, test_loss: 0.9751, test_f1: 0.4574
 epoch: 60, train_loss: 0.8825, test_loss: 1.1028, test_f1: 0.4439
 epoch: 61, train_loss: 0.8869, test_loss: 1.0395, test_f1: 0.4512
 epoch: 62, train_loss: 0.8784, test_loss: 0.9548, test_f1: 0.4597
 epoch: 63, train_loss: 0.8970, test_loss: 1.1066, test_f1: 0.4261
 epoch: 64, train_loss: 0.8888, test_loss: 1.0274, test_f1: 0.4475
 epoch: 65, train_loss: 0.8632, test_loss: 0.9796, test_f1: 0.4704
 epoch: 66, train_loss: 0.8408, test_loss: 0.9652, test_f1: 0.4723
 epoch: 67, train_loss: 0.8584, test_loss: 1.0254, test_f1: 0.4573
 epoch: 68, train_loss: 0.8789, test_loss: 1.3930, test_f1: 0.4246
 epoch: 69, train_loss: 0.8594, test_loss: 1.9598, test_f1: 0.3703
 epoch: 70, train_loss: 0.8463, test_loss: 1.2796, test_f1: 0.4085
 epoch: 71, train_loss: 0.8332, test_loss: 1.0416, test_f1: 0.4205
 epoch: 72, train_loss: 0.8703, test_loss: 1.1084, test_f1: 0.4483
 epoch: 73, train_loss: 0.9790, test_loss: 1.5165, test_f1: 0.2967
 epoch: 74, train_loss: 1.1265, test_loss: 1.4224, test_f1: 0.3034
 epoch: 75, train_loss: 0.9337, test_loss: 2.1411, test_f1: 0.3466
 epoch: 76, train_loss: 0.9285, test_loss: 1.0356, test_f1: 0.4432
 epoch: 77, train_loss: 0.9173, test_loss: 0.9897, test_f1: 0.4469
 epoch: 78, train_loss: 0.8955, test_loss: 0.9590, test_f1: 0.4501
 epoch: 79, train_loss: 0.8776, test_loss: 0.9606, test_f1: 0.4539
 epoch: 80, train_loss: 0.8911, test_loss: 1.0624, test_f1: 0.4195
 epoch: 81, train_loss: 0.8633, test_loss: 0.9661, test_f1: 0.4687
 epoch: 82, train_loss: 0.8602, test_loss: 1.1231, test_f1: 0.4055
 epoch: 83, train_loss: 0.8641, test_loss: 1.0806, test_f1: 0.4241
 epoch: 84, train_loss: 0.8476, test_loss: 0.9241, test_f1: 0.4803
 epoch: 85, train_loss: 0.8455, test_loss: 0.9991, test_f1: 0.4551
 epoch: 86, train_loss: 0.8659, test_loss: 0.9374, test_f1: 0.5053
 epoch: 87, train_loss: 0.8871, test_loss: 1.1231, test_f1: 0.4567
 epoch: 88, train_loss: 0.8508, test_loss: 1.2877, test_f1: 0.4141
 epoch: 89, train_loss: 0.8622, test_loss: 1.0395, test_f1: 0.4385
 epoch: 90, train_loss: 0.8407, test_loss: 1.3190, test_f1: 0.4025
 epoch: 91, train_loss: 0.8435, test_loss: 1.6992, test_f1: 0.3249
 epoch: 92, train_loss: 0.8336, test_loss: 1.5323, test_f1: 0.3947
 epoch: 93, train_loss: 0.8842, test_loss: 1.5268, test_f1: 0.3606
 epoch: 94, train_loss: 0.8989, test_loss: 1.3430, test_f1: 0.3745
 epoch: 95, train_loss: 0.8848, test_loss: 1.5021, test_f1: 0.3930
 epoch: 96, train_loss: 0.8895, test_loss: 1.0486, test_f1: 0.4535
 epoch: 97, train_loss: 0.8685, test_loss: 0.9791, test_f1: 0.4576
 epoch: 98, train_loss: 0.8736, test_loss: 0.9501, test_f1: 0.4788
 epoch: 99, train_loss: 0.8901, test_loss: 1.0780, test_f1: 0.4557
##################ITERATION #8 ****************************************
 epoch: 0, train_loss: 1.4560, test_loss: 1.4405, test_f1: 0.2281
 epoch: 1, train_loss: 1.3291, test_loss: 1.4044, test_f1: 0.2281
 epoch: 2, train_loss: 1.3025, test_loss: 1.3530, test_f1: 0.2281
 epoch: 3, train_loss: 1.2731, test_loss: 1.3194, test_f1: 0.2281
 epoch: 4, train_loss: 1.2598, test_loss: 1.3034, test_f1: 0.2281
 epoch: 5, train_loss: 1.2548, test_loss: 1.2997, test_f1: 0.2281
 epoch: 6, train_loss: 1.2539, test_loss: 1.3007, test_f1: 0.2281
 epoch: 7, train_loss: 1.2523, test_loss: 1.3044, test_f1: 0.2281
 epoch: 8, train_loss: 1.2525, test_loss: 1.3093, test_f1: 0.2281
 epoch: 9, train_loss: 1.2529, test_loss: 1.3102, test_f1: 0.2281
 epoch: 10, train_loss: 1.2536, test_loss: 1.3069, test_f1: 0.2281
 epoch: 11, train_loss: 1.2528, test_loss: 1.3061, test_f1: 0.2281
 epoch: 12, train_loss: 1.2530, test_loss: 1.3058, test_f1: 0.2281
 epoch: 13, train_loss: 1.2525, test_loss: 1.3038, test_f1: 0.2281
 epoch: 14, train_loss: 1.2533, test_loss: 1.3031, test_f1: 0.2281
 epoch: 15, train_loss: 1.2527, test_loss: 1.3042, test_f1: 0.2281
 epoch: 16, train_loss: 1.2520, test_loss: 1.3074, test_f1: 0.2281
 epoch: 17, train_loss: 1.2526, test_loss: 1.3095, test_f1: 0.2281
 epoch: 18, train_loss: 1.2535, test_loss: 1.3076, test_f1: 0.2281
 epoch: 19, train_loss: 1.2519, test_loss: 1.3028, test_f1: 0.2281
 epoch: 20, train_loss: 1.2528, test_loss: 1.3032, test_f1: 0.2281
 epoch: 21, train_loss: 1.2524, test_loss: 1.3031, test_f1: 0.2281
 epoch: 22, train_loss: 1.2523, test_loss: 1.3049, test_f1: 0.2281
 epoch: 23, train_loss: 1.2525, test_loss: 1.3048, test_f1: 0.2281
 epoch: 24, train_loss: 1.2528, test_loss: 1.3057, test_f1: 0.2281
 epoch: 25, train_loss: 1.2523, test_loss: 1.3041, test_f1: 0.2281
 epoch: 26, train_loss: 1.2526, test_loss: 1.3029, test_f1: 0.2281
 epoch: 27, train_loss: 1.2540, test_loss: 1.3018, test_f1: 0.2281
 epoch: 28, train_loss: 1.2533, test_loss: 1.3017, test_f1: 0.2281
 epoch: 29, train_loss: 1.2535, test_loss: 1.3039, test_f1: 0.2281
 epoch: 30, train_loss: 1.2530, test_loss: 1.3122, test_f1: 0.2281
 epoch: 31, train_loss: 1.2538, test_loss: 1.3098, test_f1: 0.2281
 epoch: 32, train_loss: 1.2522, test_loss: 1.3037, test_f1: 0.2281
 epoch: 33, train_loss: 1.2520, test_loss: 1.3088, test_f1: 0.2281
 epoch: 34, train_loss: 1.2529, test_loss: 1.3096, test_f1: 0.2281
 epoch: 35, train_loss: 1.2522, test_loss: 1.3052, test_f1: 0.2281
 epoch: 36, train_loss: 1.2523, test_loss: 1.3027, test_f1: 0.2281
 epoch: 37, train_loss: 1.2521, test_loss: 1.3041, test_f1: 0.2281
 epoch: 38, train_loss: 1.2520, test_loss: 1.3051, test_f1: 0.2281
 epoch: 39, train_loss: 1.2518, test_loss: 1.3040, test_f1: 0.2281
 epoch: 40, train_loss: 1.2524, test_loss: 1.3026, test_f1: 0.2281
 epoch: 41, train_loss: 1.2526, test_loss: 1.3046, test_f1: 0.2281
 epoch: 42, train_loss: 1.2522, test_loss: 1.3048, test_f1: 0.2281
 epoch: 43, train_loss: 1.2519, test_loss: 1.3084, test_f1: 0.2281
 epoch: 44, train_loss: 1.2526, test_loss: 1.3080, test_f1: 0.2281
 epoch: 45, train_loss: 1.2526, test_loss: 1.3080, test_f1: 0.2281
 epoch: 46, train_loss: 1.2537, test_loss: 1.3074, test_f1: 0.2281
 epoch: 47, train_loss: 1.2521, test_loss: 1.3060, test_f1: 0.2281
 epoch: 48, train_loss: 1.2523, test_loss: 1.3046, test_f1: 0.2281
 epoch: 49, train_loss: 1.2530, test_loss: 1.3019, test_f1: 0.2281
 epoch: 50, train_loss: 1.2530, test_loss: 1.3032, test_f1: 0.2281
 epoch: 51, train_loss: 1.2541, test_loss: 1.3045, test_f1: 0.2281
 epoch: 52, train_loss: 1.2533, test_loss: 1.3042, test_f1: 0.2281
 epoch: 53, train_loss: 1.2529, test_loss: 1.3056, test_f1: 0.2281
 epoch: 54, train_loss: 1.2527, test_loss: 1.3063, test_f1: 0.2281
 epoch: 55, train_loss: 1.2529, test_loss: 1.3044, test_f1: 0.2281
 epoch: 56, train_loss: 1.2525, test_loss: 1.3046, test_f1: 0.2281
 epoch: 57, train_loss: 1.2526, test_loss: 1.3073, test_f1: 0.2281
 epoch: 58, train_loss: 1.2526, test_loss: 1.3078, test_f1: 0.2281
 epoch: 59, train_loss: 1.2525, test_loss: 1.3078, test_f1: 0.2281
 epoch: 60, train_loss: 1.2522, test_loss: 1.3068, test_f1: 0.2281
 epoch: 61, train_loss: 1.2521, test_loss: 1.3057, test_f1: 0.2281
 epoch: 62, train_loss: 1.2527, test_loss: 1.3034, test_f1: 0.2281
 epoch: 63, train_loss: 1.2531, test_loss: 1.3015, test_f1: 0.2281
 epoch: 64, train_loss: 1.2527, test_loss: 1.3006, test_f1: 0.2281
 epoch: 65, train_loss: 1.2532, test_loss: 1.3012, test_f1: 0.2281
 epoch: 66, train_loss: 1.2529, test_loss: 1.3026, test_f1: 0.2281
 epoch: 67, train_loss: 1.2527, test_loss: 1.3051, test_f1: 0.2281
 epoch: 68, train_loss: 1.2523, test_loss: 1.3050, test_f1: 0.2281
 epoch: 69, train_loss: 1.2521, test_loss: 1.3058, test_f1: 0.2281
 epoch: 70, train_loss: 1.2520, test_loss: 1.3046, test_f1: 0.2281
 epoch: 71, train_loss: 1.2522, test_loss: 1.3043, test_f1: 0.2281
 epoch: 72, train_loss: 1.2524, test_loss: 1.3040, test_f1: 0.2281
 epoch: 73, train_loss: 1.2525, test_loss: 1.3066, test_f1: 0.2281
 epoch: 74, train_loss: 1.2530, test_loss: 1.3075, test_f1: 0.2281
 epoch: 75, train_loss: 1.2522, test_loss: 1.3057, test_f1: 0.2281
 epoch: 76, train_loss: 1.2524, test_loss: 1.3045, test_f1: 0.2281
 epoch: 77, train_loss: 1.2524, test_loss: 1.3019, test_f1: 0.2281
 epoch: 78, train_loss: 1.2523, test_loss: 1.3024, test_f1: 0.2281
 epoch: 79, train_loss: 1.2529, test_loss: 1.3040, test_f1: 0.2281
 epoch: 80, train_loss: 1.2520, test_loss: 1.3025, test_f1: 0.2281
 epoch: 81, train_loss: 1.2530, test_loss: 1.3025, test_f1: 0.2281
 epoch: 82, train_loss: 1.2533, test_loss: 1.3026, test_f1: 0.2281
 epoch: 83, train_loss: 1.2524, test_loss: 1.3044, test_f1: 0.2281
 epoch: 84, train_loss: 1.2526, test_loss: 1.3050, test_f1: 0.2281
 epoch: 85, train_loss: 1.2520, test_loss: 1.3045, test_f1: 0.2281
 epoch: 86, train_loss: 1.2519, test_loss: 1.3039, test_f1: 0.2281
 epoch: 87, train_loss: 1.2526, test_loss: 1.3023, test_f1: 0.2281
 epoch: 88, train_loss: 1.2525, test_loss: 1.3020, test_f1: 0.2281
 epoch: 89, train_loss: 1.2522, test_loss: 1.3044, test_f1: 0.2281
 epoch: 90, train_loss: 1.2520, test_loss: 1.3049, test_f1: 0.2281
 epoch: 91, train_loss: 1.2520, test_loss: 1.3048, test_f1: 0.2281
 epoch: 92, train_loss: 1.2523, test_loss: 1.3054, test_f1: 0.2281
 epoch: 93, train_loss: 1.2523, test_loss: 1.3058, test_f1: 0.2281
 epoch: 94, train_loss: 1.2520, test_loss: 1.3043, test_f1: 0.2281
 epoch: 95, train_loss: 1.2520, test_loss: 1.3037, test_f1: 0.2281
 epoch: 96, train_loss: 1.2521, test_loss: 1.3030, test_f1: 0.2281
 epoch: 97, train_loss: 1.2525, test_loss: 1.3012, test_f1: 0.2281
 epoch: 98, train_loss: 1.2526, test_loss: 1.3014, test_f1: 0.2281
 epoch: 99, train_loss: 1.2524, test_loss: 1.3020, test_f1: 0.2281
##################ITERATION #9 ****************************************
 epoch: 0, train_loss: 1.3066, test_loss: 1.3253, test_f1: 0.2281
 epoch: 1, train_loss: 1.2618, test_loss: 1.3161, test_f1: 0.2281
 epoch: 2, train_loss: 1.2556, test_loss: 1.3046, test_f1: 0.2281
 epoch: 3, train_loss: 1.2535, test_loss: 1.3019, test_f1: 0.2281
 epoch: 4, train_loss: 1.2555, test_loss: 1.3020, test_f1: 0.2281
 epoch: 5, train_loss: 1.2534, test_loss: 1.3037, test_f1: 0.2281
 epoch: 6, train_loss: 1.2529, test_loss: 1.3065, test_f1: 0.2281
 epoch: 7, train_loss: 1.2527, test_loss: 1.3018, test_f1: 0.2281
 epoch: 8, train_loss: 1.2532, test_loss: 1.3017, test_f1: 0.2281
 epoch: 9, train_loss: 1.2534, test_loss: 1.3019, test_f1: 0.2281
 epoch: 10, train_loss: 1.2526, test_loss: 1.3053, test_f1: 0.2281
 epoch: 11, train_loss: 1.2525, test_loss: 1.3062, test_f1: 0.2281
 epoch: 12, train_loss: 1.2527, test_loss: 1.3052, test_f1: 0.2281
 epoch: 13, train_loss: 1.2559, test_loss: 1.3086, test_f1: 0.2281
 epoch: 14, train_loss: 1.2531, test_loss: 1.3061, test_f1: 0.2281
 epoch: 15, train_loss: 1.2541, test_loss: 1.3082, test_f1: 0.1365
 epoch: 16, train_loss: 1.2546, test_loss: 1.3003, test_f1: 0.2281
 epoch: 17, train_loss: 1.2554, test_loss: 1.3020, test_f1: 0.2281
 epoch: 18, train_loss: 1.2561, test_loss: 1.3006, test_f1: 0.2281
 epoch: 19, train_loss: 1.2527, test_loss: 1.3024, test_f1: 0.2281
 epoch: 20, train_loss: 1.2532, test_loss: 1.3055, test_f1: 0.2281
 epoch: 21, train_loss: 1.2523, test_loss: 1.3033, test_f1: 0.2281
 epoch: 22, train_loss: 1.2521, test_loss: 1.3057, test_f1: 0.2281
 epoch: 23, train_loss: 1.2523, test_loss: 1.3071, test_f1: 0.2281
 epoch: 24, train_loss: 1.2535, test_loss: 1.3093, test_f1: 0.2281
 epoch: 25, train_loss: 1.2527, test_loss: 1.3040, test_f1: 0.2281
 epoch: 26, train_loss: 1.2523, test_loss: 1.3020, test_f1: 0.2281
 epoch: 27, train_loss: 1.2540, test_loss: 1.3053, test_f1: 0.2281
 epoch: 28, train_loss: 1.2530, test_loss: 1.3029, test_f1: 0.2281
 epoch: 29, train_loss: 1.2525, test_loss: 1.3056, test_f1: 0.2281
 epoch: 30, train_loss: 1.2535, test_loss: 1.3039, test_f1: 0.2281
 epoch: 31, train_loss: 1.2532, test_loss: 1.3050, test_f1: 0.2281
 epoch: 32, train_loss: 1.2522, test_loss: 1.3044, test_f1: 0.2281
 epoch: 33, train_loss: 1.2532, test_loss: 1.3028, test_f1: 0.2281
 epoch: 34, train_loss: 1.2520, test_loss: 1.3013, test_f1: 0.2281
 epoch: 35, train_loss: 1.2527, test_loss: 1.3031, test_f1: 0.2281
 epoch: 36, train_loss: 1.2526, test_loss: 1.3062, test_f1: 0.2281
 epoch: 37, train_loss: 1.2535, test_loss: 1.3046, test_f1: 0.2281
 epoch: 38, train_loss: 1.2539, test_loss: 1.3014, test_f1: 0.2281
 epoch: 39, train_loss: 1.2547, test_loss: 1.3018, test_f1: 0.2281
 epoch: 40, train_loss: 1.2536, test_loss: 1.3098, test_f1: 0.2281
 epoch: 41, train_loss: 1.2530, test_loss: 1.3087, test_f1: 0.2281
 epoch: 42, train_loss: 1.2520, test_loss: 1.3049, test_f1: 0.2281
 epoch: 43, train_loss: 1.2525, test_loss: 1.3016, test_f1: 0.2281
 epoch: 44, train_loss: 1.2542, test_loss: 1.3003, test_f1: 0.2281
 epoch: 45, train_loss: 1.2530, test_loss: 1.3027, test_f1: 0.2281
 epoch: 46, train_loss: 1.2525, test_loss: 1.3022, test_f1: 0.2281
 epoch: 47, train_loss: 1.2527, test_loss: 1.3052, test_f1: 0.2281
 epoch: 48, train_loss: 1.2529, test_loss: 1.3077, test_f1: 0.2281
 epoch: 49, train_loss: 1.2525, test_loss: 1.3062, test_f1: 0.2281
 epoch: 50, train_loss: 1.2525, test_loss: 1.3042, test_f1: 0.2281
 epoch: 51, train_loss: 1.2522, test_loss: 1.3042, test_f1: 0.2281
 epoch: 52, train_loss: 1.2520, test_loss: 1.3031, test_f1: 0.2281
 epoch: 53, train_loss: 1.2522, test_loss: 1.3022, test_f1: 0.2281
 epoch: 54, train_loss: 1.2523, test_loss: 1.3023, test_f1: 0.2281
 epoch: 55, train_loss: 1.2519, test_loss: 1.3050, test_f1: 0.2281
 epoch: 56, train_loss: 1.2525, test_loss: 1.3075, test_f1: 0.2281
 epoch: 57, train_loss: 1.2529, test_loss: 1.3087, test_f1: 0.2281
 epoch: 58, train_loss: 1.2526, test_loss: 1.3086, test_f1: 0.2281
 epoch: 59, train_loss: 1.2527, test_loss: 1.3080, test_f1: 0.2281
 epoch: 60, train_loss: 1.2528, test_loss: 1.3072, test_f1: 0.2281
 epoch: 61, train_loss: 1.2522, test_loss: 1.3040, test_f1: 0.2281
 epoch: 62, train_loss: 1.2525, test_loss: 1.3027, test_f1: 0.2281
 epoch: 63, train_loss: 1.2526, test_loss: 1.3023, test_f1: 0.2281
 epoch: 64, train_loss: 1.2525, test_loss: 1.3029, test_f1: 0.2281
 epoch: 65, train_loss: 1.2521, test_loss: 1.3032, test_f1: 0.2281
 epoch: 66, train_loss: 1.2522, test_loss: 1.3049, test_f1: 0.2281
 epoch: 67, train_loss: 1.2523, test_loss: 1.3032, test_f1: 0.2281
 epoch: 68, train_loss: 1.2524, test_loss: 1.3018, test_f1: 0.2281
 epoch: 69, train_loss: 1.2525, test_loss: 1.3012, test_f1: 0.2281
 epoch: 70, train_loss: 1.2526, test_loss: 1.3021, test_f1: 0.2281
 epoch: 71, train_loss: 1.2524, test_loss: 1.3063, test_f1: 0.2281
 epoch: 72, train_loss: 1.2527, test_loss: 1.3106, test_f1: 0.2281
 epoch: 73, train_loss: 1.2532, test_loss: 1.3117, test_f1: 0.2281
 epoch: 74, train_loss: 1.2525, test_loss: 1.3080, test_f1: 0.2281
 epoch: 75, train_loss: 1.2522, test_loss: 1.3052, test_f1: 0.2281
 epoch: 76, train_loss: 1.2523, test_loss: 1.3021, test_f1: 0.2281
 epoch: 77, train_loss: 1.2526, test_loss: 1.3027, test_f1: 0.2281
 epoch: 78, train_loss: 1.2523, test_loss: 1.3043, test_f1: 0.2281
 epoch: 79, train_loss: 1.2524, test_loss: 1.3066, test_f1: 0.2281
 epoch: 80, train_loss: 1.2526, test_loss: 1.3052, test_f1: 0.2281
 epoch: 81, train_loss: 1.2526, test_loss: 1.3051, test_f1: 0.2281
 epoch: 82, train_loss: 1.2525, test_loss: 1.3065, test_f1: 0.2281
 epoch: 83, train_loss: 1.2525, test_loss: 1.3069, test_f1: 0.2281
 epoch: 84, train_loss: 1.2521, test_loss: 1.3050, test_f1: 0.2281
 epoch: 85, train_loss: 1.2520, test_loss: 1.3042, test_f1: 0.2281
 epoch: 86, train_loss: 1.2524, test_loss: 1.3028, test_f1: 0.2281
 epoch: 87, train_loss: 1.2522, test_loss: 1.3037, test_f1: 0.2281
 epoch: 88, train_loss: 1.2521, test_loss: 1.3048, test_f1: 0.2281
 epoch: 89, train_loss: 1.2521, test_loss: 1.3039, test_f1: 0.2281
 epoch: 90, train_loss: 1.2528, test_loss: 1.3022, test_f1: 0.2281
 epoch: 91, train_loss: 1.2527, test_loss: 1.3053, test_f1: 0.2281
 epoch: 92, train_loss: 1.2523, test_loss: 1.3085, test_f1: 0.2281
 epoch: 93, train_loss: 1.2530, test_loss: 1.3084, test_f1: 0.2281
 epoch: 94, train_loss: 1.2529, test_loss: 1.3069, test_f1: 0.2281
 epoch: 95, train_loss: 1.2525, test_loss: 1.3013, test_f1: 0.2281
 epoch: 96, train_loss: 1.2526, test_loss: 1.3001, test_f1: 0.2281
 epoch: 97, train_loss: 1.2530, test_loss: 1.2998, test_f1: 0.2281
 epoch: 98, train_loss: 1.2530, test_loss: 1.3009, test_f1: 0.2281
 epoch: 99, train_loss: 1.2521, test_loss: 1.3033, test_f1: 0.2281

Training completed in 297.74 seconds
Best F1: 0.5661 at epoch 76
Mean F1 across iterations: 0.4576  0.1203
========================FINAL RESULTS================================
FEGIN weighted F1: 0.5661  0.1203
python main.py --data ltspice_demos --representation component_pin --model FEGIN --layers 3 --hiddens 16 --batch_size 256 --lr 0.1 --emb_size 128 --epochs 100 --save_appendix component_pin_L3_H16_BS256_LR0.1_E128 --no_val
-----



STDERR:
  File "main.py", line 370, in <module>
    main()
  File "main.py", line 254, in main
    dataset = dataset_class(
  File "/home/philip/projects/ltspice_examples_code_repo/Circuit-Completion-Using-GNNs/component_classification_with_link_prediction_head/evaluation/FEGIN/kernel/circuit_datasets.py", line 15, in __init__
    self.data, self.slices = torch.load(self.processed_paths[0])
  File "/home/philip/.local/lib/python3.8/site-packages/torch/serialization.py", line 1040, in load
    warnings.warn(
  File "/usr/lib/python3.8/warnings.py", line 109, in _showwarnmsg
    sw(msg.message, msg.category, msg.filename, msg.lineno,
  File "main.py", line 47, in warn_with_traceback
    traceback.print_stack(file=log)
/home/philip/projects/ltspice_examples_code_repo/Circuit-Completion-Using-GNNs/component_classification_with_link_prediction_head/evaluation/FEGIN/kernel/circuit_datasets.py:15: FutureWarning: You are using `torch.load` with `weights_only=False` (the current default value), which uses the default pickle module implicitly. It is possible to construct malicious pickle data which will execute arbitrary code during unpickling (See https://github.com/pytorch/pytorch/blob/main/SECURITY.md#untrusted-models for more details). In a future release, the default value for `weights_only` will be flipped to `True`. This limits the functions that could be executed during unpickling. Arbitrary objects will no longer be allowed to be loaded via this mode unless they are explicitly allowlisted by the user via `torch.serialization.add_safe_globals`. We recommend you start setting `weights_only=True` for any use case where you don't have full control of the loaded file. Please open an issue on GitHub for any issues related to this experimental feature.
  self.data, self.slices = torch.load(self.processed_paths[0])
