STDOUT:
Results will be saved in /home/philip/projects/ltspice_examples_code_repo/Circuit-Completion-Using-GNNs/component_classification_with_link_prediction_head/evaluation/FEGIN/results/model_FEGIN_dataset_ltspice_demos
Command line input: python main.py --data ltspice_demos --representation component_component --model FEGIN --layers 5 --hiddens 32 --batch_size 64 --lr 0.01 --emb_size 250 --epochs 100 --save_appendix component_component_L5_H32_BS64_LR0.01_E250 --no_val
 is saved.
-----
ltspice_demos - FEGIN
Using 5 layers, 32 hidden units, h = 2
Loading component_component representation dataset
ENTERED
Training FEGIN on component_component representation
Train: 1565, Test: 383
##################ITERATION #0 ****************************************
 epoch: 0, train_loss: 1.2519, test_loss: 1.3462, test_f1: 0.3108
 epoch: 1, train_loss: 1.2082, test_loss: 1.2624, test_f1: 0.2329
 epoch: 2, train_loss: 1.1526, test_loss: 1.2553, test_f1: 0.4107
 epoch: 3, train_loss: 1.1365, test_loss: 1.4764, test_f1: 0.3163
 epoch: 4, train_loss: 1.0969, test_loss: 1.3556, test_f1: 0.3628
 epoch: 5, train_loss: 1.0737, test_loss: 1.3570, test_f1: 0.4079
 epoch: 6, train_loss: 1.0447, test_loss: 1.5359, test_f1: 0.3736
 epoch: 7, train_loss: 1.0402, test_loss: 1.2275, test_f1: 0.3646
 epoch: 8, train_loss: 1.0075, test_loss: 1.5933, test_f1: 0.4243
 epoch: 9, train_loss: 0.9625, test_loss: 1.5274, test_f1: 0.3386
 epoch: 10, train_loss: 0.9385, test_loss: 1.3217, test_f1: 0.3457
 epoch: 11, train_loss: 0.9041, test_loss: 1.2199, test_f1: 0.4620
 epoch: 12, train_loss: 0.8829, test_loss: 1.0289, test_f1: 0.5474
 epoch: 13, train_loss: 0.8970, test_loss: 1.2445, test_f1: 0.4836
 epoch: 14, train_loss: 0.8721, test_loss: 1.0962, test_f1: 0.4712
 epoch: 15, train_loss: 0.8681, test_loss: 1.1037, test_f1: 0.5530
 epoch: 16, train_loss: 0.8479, test_loss: 1.0482, test_f1: 0.5187
 epoch: 17, train_loss: 0.8632, test_loss: 1.0492, test_f1: 0.5473
 epoch: 18, train_loss: 0.8415, test_loss: 1.0544, test_f1: 0.5210
 epoch: 19, train_loss: 0.8549, test_loss: 1.0869, test_f1: 0.5535
 epoch: 20, train_loss: 0.8534, test_loss: 2.4099, test_f1: 0.3717
 epoch: 21, train_loss: 0.8303, test_loss: 1.0813, test_f1: 0.5072
 epoch: 22, train_loss: 0.8282, test_loss: 1.1496, test_f1: 0.5258
 epoch: 23, train_loss: 0.8238, test_loss: 1.1450, test_f1: 0.5616
 epoch: 24, train_loss: 0.8199, test_loss: 1.0443, test_f1: 0.5951
 epoch: 25, train_loss: 0.8101, test_loss: 1.0980, test_f1: 0.4421
 epoch: 26, train_loss: 0.7817, test_loss: 1.0835, test_f1: 0.6061
 epoch: 27, train_loss: 0.7777, test_loss: 1.0668, test_f1: 0.5645
 epoch: 28, train_loss: 0.7771, test_loss: 1.0747, test_f1: 0.5915
 epoch: 29, train_loss: 0.7752, test_loss: 1.0318, test_f1: 0.6285
 epoch: 30, train_loss: 0.8372, test_loss: 1.0591, test_f1: 0.4845
 epoch: 31, train_loss: 0.8281, test_loss: 0.9935, test_f1: 0.6021
 epoch: 32, train_loss: 0.7730, test_loss: 1.0062, test_f1: 0.5850
 epoch: 33, train_loss: 0.7832, test_loss: 1.0196, test_f1: 0.5963
 epoch: 34, train_loss: 0.7540, test_loss: 1.0441, test_f1: 0.5943
 epoch: 35, train_loss: 0.7315, test_loss: 1.2004, test_f1: 0.5607
 epoch: 36, train_loss: 0.7397, test_loss: 1.0298, test_f1: 0.5916
 epoch: 37, train_loss: 0.7489, test_loss: 1.1939, test_f1: 0.5770
 epoch: 38, train_loss: 0.7223, test_loss: 1.0470, test_f1: 0.6260
 epoch: 39, train_loss: 0.7460, test_loss: 1.0646, test_f1: 0.6144
 epoch: 40, train_loss: 0.7289, test_loss: 1.2383, test_f1: 0.6039
 epoch: 41, train_loss: 0.7210, test_loss: 1.0534, test_f1: 0.5757
 epoch: 42, train_loss: 0.7428, test_loss: 1.3314, test_f1: 0.5562
 epoch: 43, train_loss: 0.7257, test_loss: 1.1506, test_f1: 0.5503
 epoch: 44, train_loss: 0.7321, test_loss: 1.1339, test_f1: 0.6351
 epoch: 45, train_loss: 0.7432, test_loss: 1.0292, test_f1: 0.6069
 epoch: 46, train_loss: 0.7162, test_loss: 1.2127, test_f1: 0.5833
 epoch: 47, train_loss: 0.6990, test_loss: 1.1451, test_f1: 0.6142
 epoch: 48, train_loss: 0.7031, test_loss: 1.1180, test_f1: 0.6216
 epoch: 49, train_loss: 0.7015, test_loss: 1.1798, test_f1: 0.5883
 epoch: 50, train_loss: 0.6783, test_loss: 1.1448, test_f1: 0.6139
 epoch: 51, train_loss: 0.6648, test_loss: 1.2048, test_f1: 0.6532
 epoch: 52, train_loss: 0.6302, test_loss: 1.1285, test_f1: 0.6459
 epoch: 53, train_loss: 0.6280, test_loss: 1.2035, test_f1: 0.5837
 epoch: 54, train_loss: 0.6302, test_loss: 1.2561, test_f1: 0.6213
 epoch: 55, train_loss: 0.6051, test_loss: 1.2793, test_f1: 0.5755
 epoch: 56, train_loss: 0.6138, test_loss: 1.4456, test_f1: 0.5999
 epoch: 57, train_loss: 0.6203, test_loss: 1.4080, test_f1: 0.6022
 epoch: 58, train_loss: 0.6258, test_loss: 1.3334, test_f1: 0.5841
 epoch: 59, train_loss: 0.6001, test_loss: 1.4618, test_f1: 0.6345
 epoch: 60, train_loss: 0.6008, test_loss: 1.2298, test_f1: 0.6405
 epoch: 61, train_loss: 0.5878, test_loss: 1.3425, test_f1: 0.5623
 epoch: 62, train_loss: 0.5887, test_loss: 1.2936, test_f1: 0.6166
 epoch: 63, train_loss: 0.5716, test_loss: 1.4449, test_f1: 0.6073
 epoch: 64, train_loss: 0.5982, test_loss: 1.4709, test_f1: 0.6222
 epoch: 65, train_loss: 0.5641, test_loss: 1.4638, test_f1: 0.5944
 epoch: 66, train_loss: 0.5647, test_loss: 1.3448, test_f1: 0.5985
 epoch: 67, train_loss: 0.5767, test_loss: 1.3133, test_f1: 0.6255
 epoch: 68, train_loss: 0.5917, test_loss: 1.3006, test_f1: 0.6117
 epoch: 69, train_loss: 0.5654, test_loss: 1.4651, test_f1: 0.6185
 epoch: 70, train_loss: 0.5625, test_loss: 1.4281, test_f1: 0.6220
 epoch: 71, train_loss: 0.5725, test_loss: 1.3188, test_f1: 0.5933
 epoch: 72, train_loss: 0.5429, test_loss: 1.4715, test_f1: 0.5992
 epoch: 73, train_loss: 0.5589, test_loss: 1.5224, test_f1: 0.5766
 epoch: 74, train_loss: 0.5391, test_loss: 1.4344, test_f1: 0.5918
 epoch: 75, train_loss: 0.5300, test_loss: 1.4505, test_f1: 0.6141
 epoch: 76, train_loss: 0.5521, test_loss: 1.5212, test_f1: 0.6213
 epoch: 77, train_loss: 0.5418, test_loss: 1.5025, test_f1: 0.5897
 epoch: 78, train_loss: 0.5318, test_loss: 1.6880, test_f1: 0.6121
 epoch: 79, train_loss: 0.5193, test_loss: 1.6325, test_f1: 0.6027
 epoch: 80, train_loss: 0.5249, test_loss: 1.6037, test_f1: 0.6452
 epoch: 81, train_loss: 0.5252, test_loss: 1.6154, test_f1: 0.6446
 epoch: 82, train_loss: 0.5225, test_loss: 1.6047, test_f1: 0.6317
 epoch: 83, train_loss: 0.4834, test_loss: 1.6386, test_f1: 0.6231
 epoch: 84, train_loss: 0.5141, test_loss: 1.8022, test_f1: 0.5837
 epoch: 85, train_loss: 0.5545, test_loss: 1.6215, test_f1: 0.6056
 epoch: 86, train_loss: 0.5288, test_loss: 1.7729, test_f1: 0.6342
 epoch: 87, train_loss: 0.5050, test_loss: 1.7677, test_f1: 0.6012
 epoch: 88, train_loss: 0.5159, test_loss: 1.6805, test_f1: 0.5814
 epoch: 89, train_loss: 0.5203, test_loss: 1.5979, test_f1: 0.6081
 epoch: 90, train_loss: 0.4943, test_loss: 1.5507, test_f1: 0.6048
 epoch: 91, train_loss: 0.5291, test_loss: 1.4647, test_f1: 0.6286
 epoch: 92, train_loss: 0.5244, test_loss: 1.6397, test_f1: 0.5903
 epoch: 93, train_loss: 0.4856, test_loss: 1.6741, test_f1: 0.5931
 epoch: 94, train_loss: 0.4743, test_loss: 1.7482, test_f1: 0.5956
 epoch: 95, train_loss: 0.4986, test_loss: 1.4709, test_f1: 0.6067
 epoch: 96, train_loss: 0.4874, test_loss: 1.8751, test_f1: 0.5607
 epoch: 97, train_loss: 0.4818, test_loss: 1.8144, test_f1: 0.5719
 epoch: 98, train_loss: 0.4969, test_loss: 1.6125, test_f1: 0.6484
 epoch: 99, train_loss: 0.4756, test_loss: 1.9459, test_f1: 0.6024
##################ITERATION #1 ****************************************
 epoch: 0, train_loss: 1.2816, test_loss: 1.3377, test_f1: 0.3195
 epoch: 1, train_loss: 1.2082, test_loss: 1.1959, test_f1: 0.3899
 epoch: 2, train_loss: 1.1411, test_loss: 1.1901, test_f1: 0.4388
 epoch: 3, train_loss: 1.0985, test_loss: 1.1974, test_f1: 0.4243
 epoch: 4, train_loss: 1.0394, test_loss: 1.2482, test_f1: 0.4178
 epoch: 5, train_loss: 0.9882, test_loss: 1.1638, test_f1: 0.5264
 epoch: 6, train_loss: 0.9806, test_loss: 1.3533, test_f1: 0.4523
 epoch: 7, train_loss: 0.9370, test_loss: 1.1601, test_f1: 0.4828
 epoch: 8, train_loss: 0.9247, test_loss: 1.0889, test_f1: 0.4079
 epoch: 9, train_loss: 0.8861, test_loss: 1.0520, test_f1: 0.4366
 epoch: 10, train_loss: 0.9285, test_loss: 1.0503, test_f1: 0.5522
 epoch: 11, train_loss: 0.8880, test_loss: 1.0212, test_f1: 0.5363
 epoch: 12, train_loss: 0.8770, test_loss: 1.3011, test_f1: 0.3438
 epoch: 13, train_loss: 0.8914, test_loss: 1.1150, test_f1: 0.3980
 epoch: 14, train_loss: 0.8901, test_loss: 1.0676, test_f1: 0.4247
 epoch: 15, train_loss: 0.8636, test_loss: 1.0517, test_f1: 0.5652
 epoch: 16, train_loss: 0.8618, test_loss: 1.1173, test_f1: 0.4506
 epoch: 17, train_loss: 0.8305, test_loss: 1.1002, test_f1: 0.5068
 epoch: 18, train_loss: 0.8605, test_loss: 1.0864, test_f1: 0.4929
 epoch: 19, train_loss: 0.8496, test_loss: 1.0099, test_f1: 0.5070
 epoch: 20, train_loss: 0.7952, test_loss: 1.1839, test_f1: 0.5679
 epoch: 21, train_loss: 0.8187, test_loss: 1.0092, test_f1: 0.5478
 epoch: 22, train_loss: 0.8178, test_loss: 1.2606, test_f1: 0.5279
 epoch: 23, train_loss: 0.8149, test_loss: 1.1759, test_f1: 0.4576
 epoch: 24, train_loss: 0.8666, test_loss: 1.1656, test_f1: 0.4186
 epoch: 25, train_loss: 0.8236, test_loss: 1.0843, test_f1: 0.5440
 epoch: 26, train_loss: 0.7852, test_loss: 1.1641, test_f1: 0.4729
 epoch: 27, train_loss: 0.8021, test_loss: 1.0902, test_f1: 0.5206
 epoch: 28, train_loss: 0.8009, test_loss: 1.0532, test_f1: 0.5635
 epoch: 29, train_loss: 0.7926, test_loss: 1.1113, test_f1: 0.4899
 epoch: 30, train_loss: 0.7627, test_loss: 1.5827, test_f1: 0.4543
 epoch: 31, train_loss: 0.7667, test_loss: 1.1542, test_f1: 0.4954
 epoch: 32, train_loss: 0.8296, test_loss: 1.2439, test_f1: 0.4903
 epoch: 33, train_loss: 0.7525, test_loss: 1.0968, test_f1: 0.5629
 epoch: 34, train_loss: 0.7624, test_loss: 1.1368, test_f1: 0.5607
 epoch: 35, train_loss: 0.7599, test_loss: 1.4562, test_f1: 0.5092
 epoch: 36, train_loss: 0.7743, test_loss: 1.4948, test_f1: 0.4216
 epoch: 37, train_loss: 0.7453, test_loss: 1.0938, test_f1: 0.5644
 epoch: 38, train_loss: 0.7356, test_loss: 1.1792, test_f1: 0.5209
 epoch: 39, train_loss: 0.7188, test_loss: 1.2249, test_f1: 0.5460
 epoch: 40, train_loss: 0.7453, test_loss: 1.1447, test_f1: 0.5866
 epoch: 41, train_loss: 0.7226, test_loss: 1.1164, test_f1: 0.5815
 epoch: 42, train_loss: 0.7171, test_loss: 1.0969, test_f1: 0.5429
 epoch: 43, train_loss: 0.7238, test_loss: 1.9909, test_f1: 0.3928
 epoch: 44, train_loss: 0.7475, test_loss: 1.1612, test_f1: 0.5953
 epoch: 45, train_loss: 0.7304, test_loss: 1.2059, test_f1: 0.5186
 epoch: 46, train_loss: 0.7178, test_loss: 1.1264, test_f1: 0.5244
 epoch: 47, train_loss: 0.7193, test_loss: 1.2805, test_f1: 0.5322
 epoch: 48, train_loss: 0.7005, test_loss: 1.0945, test_f1: 0.5102
 epoch: 49, train_loss: 0.6934, test_loss: 1.1190, test_f1: 0.5762
 epoch: 50, train_loss: 0.7032, test_loss: 1.0837, test_f1: 0.5796
 epoch: 51, train_loss: 0.6826, test_loss: 1.3059, test_f1: 0.4771
 epoch: 52, train_loss: 0.6769, test_loss: 1.2076, test_f1: 0.5426
 epoch: 53, train_loss: 0.6619, test_loss: 1.3013, test_f1: 0.5670
 epoch: 54, train_loss: 0.6533, test_loss: 1.2213, test_f1: 0.5772
 epoch: 55, train_loss: 0.6562, test_loss: 1.2829, test_f1: 0.5739
 epoch: 56, train_loss: 0.6233, test_loss: 1.3626, test_f1: 0.5361
 epoch: 57, train_loss: 0.6444, test_loss: 1.2892, test_f1: 0.5868
 epoch: 58, train_loss: 0.6093, test_loss: 1.3194, test_f1: 0.5995
 epoch: 59, train_loss: 0.6106, test_loss: 1.3645, test_f1: 0.6098
 epoch: 60, train_loss: 0.6341, test_loss: 1.5419, test_f1: 0.4892
 epoch: 61, train_loss: 0.6227, test_loss: 1.3110, test_f1: 0.5446
 epoch: 62, train_loss: 0.6134, test_loss: 1.4009, test_f1: 0.5825
 epoch: 63, train_loss: 0.6114, test_loss: 1.4040, test_f1: 0.5901
 epoch: 64, train_loss: 0.6031, test_loss: 1.4928, test_f1: 0.6212
 epoch: 65, train_loss: 0.6228, test_loss: 1.2289, test_f1: 0.6149
 epoch: 66, train_loss: 0.5925, test_loss: 1.6583, test_f1: 0.5154
 epoch: 67, train_loss: 0.5956, test_loss: 1.4778, test_f1: 0.5672
 epoch: 68, train_loss: 0.6217, test_loss: 1.4363, test_f1: 0.5700
 epoch: 69, train_loss: 0.6027, test_loss: 1.3749, test_f1: 0.5521
 epoch: 70, train_loss: 0.5972, test_loss: 1.3364, test_f1: 0.6080
 epoch: 71, train_loss: 0.5786, test_loss: 1.6928, test_f1: 0.5537
 epoch: 72, train_loss: 0.5681, test_loss: 1.2815, test_f1: 0.6131
 epoch: 73, train_loss: 0.5730, test_loss: 1.6611, test_f1: 0.5522
 epoch: 74, train_loss: 0.5775, test_loss: 1.5394, test_f1: 0.5685
 epoch: 75, train_loss: 0.5744, test_loss: 1.5018, test_f1: 0.5608
 epoch: 76, train_loss: 0.5624, test_loss: 1.5038, test_f1: 0.5669
 epoch: 77, train_loss: 0.5792, test_loss: 1.4699, test_f1: 0.5597
 epoch: 78, train_loss: 0.5355, test_loss: 1.6578, test_f1: 0.5500
 epoch: 79, train_loss: 0.5388, test_loss: 1.6934, test_f1: 0.5426
 epoch: 80, train_loss: 0.6582, test_loss: 1.3417, test_f1: 0.5436
 epoch: 81, train_loss: 0.6209, test_loss: 1.2833, test_f1: 0.5748
 epoch: 82, train_loss: 0.5817, test_loss: 1.3086, test_f1: 0.5904
 epoch: 83, train_loss: 0.5836, test_loss: 1.2472, test_f1: 0.5902
 epoch: 84, train_loss: 0.5946, test_loss: 1.3732, test_f1: 0.5898
 epoch: 85, train_loss: 0.5575, test_loss: 1.3741, test_f1: 0.5630
 epoch: 86, train_loss: 0.6152, test_loss: 1.3399, test_f1: 0.5826
 epoch: 87, train_loss: 0.6147, test_loss: 1.3055, test_f1: 0.6067
 epoch: 88, train_loss: 0.5600, test_loss: 1.3072, test_f1: 0.6062
 epoch: 89, train_loss: 0.5639, test_loss: 1.4164, test_f1: 0.5899
 epoch: 90, train_loss: 0.5508, test_loss: 1.4394, test_f1: 0.6026
 epoch: 91, train_loss: 0.5441, test_loss: 1.5211, test_f1: 0.5574
 epoch: 92, train_loss: 0.5487, test_loss: 1.5277, test_f1: 0.6006
 epoch: 93, train_loss: 0.5364, test_loss: 1.5397, test_f1: 0.5496
 epoch: 94, train_loss: 0.5641, test_loss: 1.7940, test_f1: 0.5726
 epoch: 95, train_loss: 0.5412, test_loss: 1.5427, test_f1: 0.5888
 epoch: 96, train_loss: 0.5405, test_loss: 1.6783, test_f1: 0.5255
 epoch: 97, train_loss: 0.6118, test_loss: 1.7213, test_f1: 0.5577
 epoch: 98, train_loss: 0.5981, test_loss: 1.5393, test_f1: 0.5660
 epoch: 99, train_loss: 0.5374, test_loss: 1.3799, test_f1: 0.6118
##################ITERATION #2 ****************************************
 epoch: 0, train_loss: 1.3018, test_loss: 1.3922, test_f1: 0.2617
 epoch: 1, train_loss: 1.2129, test_loss: 1.2708, test_f1: 0.2407
 epoch: 2, train_loss: 1.1901, test_loss: 1.2312, test_f1: 0.3110
 epoch: 3, train_loss: 1.1579, test_loss: 1.2346, test_f1: 0.2869
 epoch: 4, train_loss: 1.1323, test_loss: 1.3753, test_f1: 0.3557
 epoch: 5, train_loss: 1.1417, test_loss: 1.2594, test_f1: 0.4190
 epoch: 6, train_loss: 1.0932, test_loss: 1.4223, test_f1: 0.2391
 epoch: 7, train_loss: 1.0802, test_loss: 1.4106, test_f1: 0.2896
 epoch: 8, train_loss: 1.0497, test_loss: 1.1799, test_f1: 0.4202
 epoch: 9, train_loss: 1.0430, test_loss: 1.2854, test_f1: 0.3139
 epoch: 10, train_loss: 1.0358, test_loss: 1.2308, test_f1: 0.3605
 epoch: 11, train_loss: 1.0075, test_loss: 1.1850, test_f1: 0.3943
 epoch: 12, train_loss: 0.9805, test_loss: 1.3300, test_f1: 0.3830
 epoch: 13, train_loss: 0.9530, test_loss: 1.1756, test_f1: 0.4600
 epoch: 14, train_loss: 0.9263, test_loss: 1.7527, test_f1: 0.3019
 epoch: 15, train_loss: 0.9155, test_loss: 1.0963, test_f1: 0.5451
 epoch: 16, train_loss: 0.9013, test_loss: 1.1396, test_f1: 0.4634
 epoch: 17, train_loss: 0.8894, test_loss: 2.8522, test_f1: 0.2827
 epoch: 18, train_loss: 0.8698, test_loss: 1.0304, test_f1: 0.4547
 epoch: 19, train_loss: 0.8948, test_loss: 1.0952, test_f1: 0.4746
 epoch: 20, train_loss: 0.8906, test_loss: 1.3020, test_f1: 0.4074
 epoch: 21, train_loss: 0.8598, test_loss: 1.0300, test_f1: 0.5348
 epoch: 22, train_loss: 0.8250, test_loss: 1.0248, test_f1: 0.6003
 epoch: 23, train_loss: 0.8246, test_loss: 1.4478, test_f1: 0.4716
 epoch: 24, train_loss: 0.8330, test_loss: 1.0277, test_f1: 0.5242
 epoch: 25, train_loss: 0.8273, test_loss: 1.0129, test_f1: 0.5034
 epoch: 26, train_loss: 0.8259, test_loss: 1.0257, test_f1: 0.5663
 epoch: 27, train_loss: 0.8156, test_loss: 1.0508, test_f1: 0.5868
 epoch: 28, train_loss: 0.8592, test_loss: 1.0862, test_f1: 0.5370
 epoch: 29, train_loss: 0.8183, test_loss: 1.1620, test_f1: 0.4918
 epoch: 30, train_loss: 0.7810, test_loss: 1.0069, test_f1: 0.5902
 epoch: 31, train_loss: 0.7676, test_loss: 1.1784, test_f1: 0.5115
 epoch: 32, train_loss: 0.7974, test_loss: 1.0917, test_f1: 0.5582
 epoch: 33, train_loss: 0.7638, test_loss: 1.6114, test_f1: 0.4332
 epoch: 34, train_loss: 0.7755, test_loss: 1.0972, test_f1: 0.5586
 epoch: 35, train_loss: 0.7449, test_loss: 1.3514, test_f1: 0.5191
 epoch: 36, train_loss: 0.7732, test_loss: 1.0325, test_f1: 0.5617
 epoch: 37, train_loss: 0.7587, test_loss: 0.9807, test_f1: 0.6076
 epoch: 38, train_loss: 0.7697, test_loss: 0.9662, test_f1: 0.6259
 epoch: 39, train_loss: 0.7318, test_loss: 1.0759, test_f1: 0.5831
 epoch: 40, train_loss: 0.7333, test_loss: 1.0620, test_f1: 0.5964
 epoch: 41, train_loss: 0.7306, test_loss: 1.1063, test_f1: 0.5850
 epoch: 42, train_loss: 0.7125, test_loss: 1.0616, test_f1: 0.6051
 epoch: 43, train_loss: 0.7146, test_loss: 1.3366, test_f1: 0.5280
 epoch: 44, train_loss: 0.7076, test_loss: 1.2511, test_f1: 0.5126
 epoch: 45, train_loss: 0.7078, test_loss: 1.0962, test_f1: 0.5839
 epoch: 46, train_loss: 0.6994, test_loss: 1.2455, test_f1: 0.5466
 epoch: 47, train_loss: 0.7166, test_loss: 1.1253, test_f1: 0.5598
 epoch: 48, train_loss: 0.7331, test_loss: 1.1201, test_f1: 0.5430
 epoch: 49, train_loss: 0.7384, test_loss: 1.1922, test_f1: 0.5238
 epoch: 50, train_loss: 0.7025, test_loss: 1.0480, test_f1: 0.5699
 epoch: 51, train_loss: 0.6647, test_loss: 1.1572, test_f1: 0.5790
 epoch: 52, train_loss: 0.6267, test_loss: 1.1335, test_f1: 0.5767
 epoch: 53, train_loss: 0.6290, test_loss: 1.2133, test_f1: 0.5825
 epoch: 54, train_loss: 0.6293, test_loss: 1.7629, test_f1: 0.4941
 epoch: 55, train_loss: 0.6232, test_loss: 1.2115, test_f1: 0.5609
 epoch: 56, train_loss: 0.6185, test_loss: 1.2705, test_f1: 0.6041
 epoch: 57, train_loss: 0.5895, test_loss: 1.2403, test_f1: 0.5881
 epoch: 58, train_loss: 0.6070, test_loss: 1.5202, test_f1: 0.5089
 epoch: 59, train_loss: 0.6144, test_loss: 1.2977, test_f1: 0.6013
 epoch: 60, train_loss: 0.6115, test_loss: 1.2839, test_f1: 0.5599
 epoch: 61, train_loss: 0.6031, test_loss: 1.3837, test_f1: 0.5957
 epoch: 62, train_loss: 0.5770, test_loss: 1.3823, test_f1: 0.5907
 epoch: 63, train_loss: 0.6003, test_loss: 1.4040, test_f1: 0.5503
 epoch: 64, train_loss: 0.5947, test_loss: 1.4375, test_f1: 0.5512
 epoch: 65, train_loss: 0.5920, test_loss: 1.8766, test_f1: 0.5110
 epoch: 66, train_loss: 0.5697, test_loss: 1.4543, test_f1: 0.6364
 epoch: 67, train_loss: 0.5728, test_loss: 1.5600, test_f1: 0.5667
 epoch: 68, train_loss: 0.5893, test_loss: 1.5400, test_f1: 0.5046
 epoch: 69, train_loss: 0.5842, test_loss: 1.1945, test_f1: 0.6326
 epoch: 70, train_loss: 0.5433, test_loss: 1.3749, test_f1: 0.5634
 epoch: 71, train_loss: 0.5575, test_loss: 1.3793, test_f1: 0.5637
 epoch: 72, train_loss: 0.5376, test_loss: 1.4688, test_f1: 0.5717
 epoch: 73, train_loss: 0.5441, test_loss: 2.2737, test_f1: 0.4885
 epoch: 74, train_loss: 0.5542, test_loss: 1.4382, test_f1: 0.5692
 epoch: 75, train_loss: 0.5378, test_loss: 1.8632, test_f1: 0.5080
 epoch: 76, train_loss: 0.5308, test_loss: 1.2778, test_f1: 0.5496
 epoch: 77, train_loss: 0.5757, test_loss: 1.2255, test_f1: 0.6104
 epoch: 78, train_loss: 0.5754, test_loss: 1.3304, test_f1: 0.5716
 epoch: 79, train_loss: 0.5308, test_loss: 1.2729, test_f1: 0.5869
 epoch: 80, train_loss: 0.5242, test_loss: 1.3412, test_f1: 0.5507
 epoch: 81, train_loss: 0.5090, test_loss: 1.3196, test_f1: 0.6099
 epoch: 82, train_loss: 0.5095, test_loss: 1.6525, test_f1: 0.5410
 epoch: 83, train_loss: 0.5460, test_loss: 1.3737, test_f1: 0.5713
 epoch: 84, train_loss: 0.5080, test_loss: 1.4968, test_f1: 0.5684
 epoch: 85, train_loss: 0.5160, test_loss: 1.3925, test_f1: 0.5592
 epoch: 86, train_loss: 0.4995, test_loss: 1.6892, test_f1: 0.5485
 epoch: 87, train_loss: 0.5002, test_loss: 1.4911, test_f1: 0.5296
 epoch: 88, train_loss: 0.4843, test_loss: 1.4234, test_f1: 0.5655
 epoch: 89, train_loss: 0.5015, test_loss: 1.4899, test_f1: 0.6083
 epoch: 90, train_loss: 0.4880, test_loss: 1.3986, test_f1: 0.5584
 epoch: 91, train_loss: 0.4802, test_loss: 1.5746, test_f1: 0.5719
 epoch: 92, train_loss: 0.5341, test_loss: 1.6565, test_f1: 0.5371
 epoch: 93, train_loss: 0.4941, test_loss: 1.6308, test_f1: 0.5477
 epoch: 94, train_loss: 0.4869, test_loss: 1.6329, test_f1: 0.5487
 epoch: 95, train_loss: 0.5130, test_loss: 1.6161, test_f1: 0.5792
 epoch: 96, train_loss: 0.4886, test_loss: 1.4511, test_f1: 0.5215
 epoch: 97, train_loss: 0.4860, test_loss: 1.3542, test_f1: 0.5745
 epoch: 98, train_loss: 0.5164, test_loss: 1.7084, test_f1: 0.5354
 epoch: 99, train_loss: 0.4683, test_loss: 1.3086, test_f1: 0.6135
##################ITERATION #3 ****************************************
 epoch: 0, train_loss: 1.3050, test_loss: 1.2878, test_f1: 0.3468
 epoch: 1, train_loss: 1.2217, test_loss: 1.2434, test_f1: 0.3566
 epoch: 2, train_loss: 1.1826, test_loss: 1.2736, test_f1: 0.4016
 epoch: 3, train_loss: 1.1447, test_loss: 1.2570, test_f1: 0.3643
 epoch: 4, train_loss: 1.1040, test_loss: 1.1757, test_f1: 0.4492
 epoch: 5, train_loss: 1.0479, test_loss: 1.2121, test_f1: 0.4908
 epoch: 6, train_loss: 1.0312, test_loss: 1.1529, test_f1: 0.4760
 epoch: 7, train_loss: 1.0123, test_loss: 1.1348, test_f1: 0.4655
 epoch: 8, train_loss: 0.9515, test_loss: 1.3519, test_f1: 0.5250
 epoch: 9, train_loss: 0.9666, test_loss: 1.1675, test_f1: 0.4634
 epoch: 10, train_loss: 0.9491, test_loss: 1.1238, test_f1: 0.5722
 epoch: 11, train_loss: 0.9246, test_loss: 1.1337, test_f1: 0.4692
 epoch: 12, train_loss: 0.9188, test_loss: 1.1187, test_f1: 0.5102
 epoch: 13, train_loss: 0.9091, test_loss: 1.1147, test_f1: 0.5564
 epoch: 14, train_loss: 0.9418, test_loss: 1.0244, test_f1: 0.5741
 epoch: 15, train_loss: 0.9024, test_loss: 1.0538, test_f1: 0.5605
 epoch: 16, train_loss: 0.8906, test_loss: 1.1074, test_f1: 0.5531
 epoch: 17, train_loss: 0.9021, test_loss: 1.0990, test_f1: 0.5972
 epoch: 18, train_loss: 0.8678, test_loss: 1.1253, test_f1: 0.5089
 epoch: 19, train_loss: 0.8757, test_loss: 1.2433, test_f1: 0.4852
 epoch: 20, train_loss: 0.8646, test_loss: 1.0658, test_f1: 0.5501
 epoch: 21, train_loss: 0.8597, test_loss: 1.0678, test_f1: 0.5778
 epoch: 22, train_loss: 0.8712, test_loss: 1.1682, test_f1: 0.5436
 epoch: 23, train_loss: 0.8537, test_loss: 1.0218, test_f1: 0.5348
 epoch: 24, train_loss: 0.8392, test_loss: 1.5003, test_f1: 0.4701
 epoch: 25, train_loss: 0.8475, test_loss: 1.1779, test_f1: 0.5770
 epoch: 26, train_loss: 0.8556, test_loss: 1.3271, test_f1: 0.4918
 epoch: 27, train_loss: 0.8443, test_loss: 1.0886, test_f1: 0.5500
 epoch: 28, train_loss: 0.8404, test_loss: 1.1001, test_f1: 0.5616
 epoch: 29, train_loss: 0.8456, test_loss: 1.0286, test_f1: 0.5769
 epoch: 30, train_loss: 0.7985, test_loss: 1.1187, test_f1: 0.5384
 epoch: 31, train_loss: 0.8082, test_loss: 1.0713, test_f1: 0.5724
 epoch: 32, train_loss: 0.8169, test_loss: 1.2005, test_f1: 0.5545
 epoch: 33, train_loss: 0.8173, test_loss: 1.0654, test_f1: 0.5198
 epoch: 34, train_loss: 0.8065, test_loss: 1.0894, test_f1: 0.5710
 epoch: 35, train_loss: 0.7885, test_loss: 1.2246, test_f1: 0.5588
 epoch: 36, train_loss: 0.7876, test_loss: 1.2086, test_f1: 0.5146
 epoch: 37, train_loss: 0.7891, test_loss: 1.1810, test_f1: 0.5888
 epoch: 38, train_loss: 0.7990, test_loss: 1.1849, test_f1: 0.5562
 epoch: 39, train_loss: 0.7735, test_loss: 1.1826, test_f1: 0.6015
 epoch: 40, train_loss: 0.7934, test_loss: 1.1448, test_f1: 0.5812
 epoch: 41, train_loss: 0.7908, test_loss: 1.4453, test_f1: 0.5166
 epoch: 42, train_loss: 0.7659, test_loss: 1.0789, test_f1: 0.5906
 epoch: 43, train_loss: 0.7756, test_loss: 1.2232, test_f1: 0.5486
 epoch: 44, train_loss: 0.7626, test_loss: 1.3076, test_f1: 0.4583
 epoch: 45, train_loss: 0.7640, test_loss: 1.8343, test_f1: 0.5174
 epoch: 46, train_loss: 0.7828, test_loss: 1.1718, test_f1: 0.5651
 epoch: 47, train_loss: 0.7621, test_loss: 0.9751, test_f1: 0.6119
 epoch: 48, train_loss: 0.7615, test_loss: 1.2083, test_f1: 0.5649
 epoch: 49, train_loss: 0.7366, test_loss: 1.2774, test_f1: 0.5976
 epoch: 50, train_loss: 0.7300, test_loss: 1.1619, test_f1: 0.5926
 epoch: 51, train_loss: 0.7109, test_loss: 1.2227, test_f1: 0.5900
 epoch: 52, train_loss: 0.6908, test_loss: 1.2412, test_f1: 0.6196
 epoch: 53, train_loss: 0.6916, test_loss: 1.2196, test_f1: 0.5962
 epoch: 54, train_loss: 0.6862, test_loss: 1.2702, test_f1: 0.6041
 epoch: 55, train_loss: 0.6908, test_loss: 1.1722, test_f1: 0.6152
 epoch: 56, train_loss: 0.6892, test_loss: 1.0997, test_f1: 0.5954
 epoch: 57, train_loss: 0.6613, test_loss: 1.1080, test_f1: 0.6174
 epoch: 58, train_loss: 0.6805, test_loss: 1.2939, test_f1: 0.5835
 epoch: 59, train_loss: 0.6797, test_loss: 1.1880, test_f1: 0.6298
 epoch: 60, train_loss: 0.6738, test_loss: 1.2157, test_f1: 0.6018
 epoch: 61, train_loss: 0.6662, test_loss: 1.1600, test_f1: 0.6313
 epoch: 62, train_loss: 0.6620, test_loss: 1.3740, test_f1: 0.6233
 epoch: 63, train_loss: 0.6511, test_loss: 1.1273, test_f1: 0.6102
 epoch: 64, train_loss: 0.6350, test_loss: 1.3231, test_f1: 0.6101
 epoch: 65, train_loss: 0.6537, test_loss: 1.2840, test_f1: 0.6052
 epoch: 66, train_loss: 0.6447, test_loss: 1.1798, test_f1: 0.5984
 epoch: 67, train_loss: 0.6351, test_loss: 1.3313, test_f1: 0.6220
 epoch: 68, train_loss: 0.6254, test_loss: 1.1481, test_f1: 0.6144
 epoch: 69, train_loss: 0.6398, test_loss: 1.2055, test_f1: 0.6618
 epoch: 70, train_loss: 0.6152, test_loss: 1.2031, test_f1: 0.5930
 epoch: 71, train_loss: 0.6365, test_loss: 1.2549, test_f1: 0.5983
 epoch: 72, train_loss: 0.6486, test_loss: 1.1590, test_f1: 0.5871
 epoch: 73, train_loss: 0.6246, test_loss: 1.1711, test_f1: 0.6252
 epoch: 74, train_loss: 0.6376, test_loss: 1.0884, test_f1: 0.6281
 epoch: 75, train_loss: 0.6338, test_loss: 1.1419, test_f1: 0.6219
 epoch: 76, train_loss: 0.6057, test_loss: 1.2222, test_f1: 0.6106
 epoch: 77, train_loss: 0.6107, test_loss: 1.1191, test_f1: 0.6400
 epoch: 78, train_loss: 0.6201, test_loss: 1.2617, test_f1: 0.5978
 epoch: 79, train_loss: 0.6493, test_loss: 1.0859, test_f1: 0.6209
 epoch: 80, train_loss: 0.6194, test_loss: 1.0376, test_f1: 0.6369
 epoch: 81, train_loss: 0.5951, test_loss: 1.1352, test_f1: 0.6266
 epoch: 82, train_loss: 0.6069, test_loss: 1.1950, test_f1: 0.6185
 epoch: 83, train_loss: 0.5518, test_loss: 1.1411, test_f1: 0.6532
 epoch: 84, train_loss: 0.5782, test_loss: 1.1043, test_f1: 0.6327
 epoch: 85, train_loss: 0.5862, test_loss: 1.2761, test_f1: 0.6035
 epoch: 86, train_loss: 0.5928, test_loss: 1.1837, test_f1: 0.6121
 epoch: 87, train_loss: 0.5960, test_loss: 1.1269, test_f1: 0.6237
 epoch: 88, train_loss: 0.6032, test_loss: 1.2452, test_f1: 0.6315
 epoch: 89, train_loss: 0.5810, test_loss: 1.1494, test_f1: 0.6494
 epoch: 90, train_loss: 0.5568, test_loss: 1.1644, test_f1: 0.6383
 epoch: 91, train_loss: 0.5455, test_loss: 1.1645, test_f1: 0.6685
 epoch: 92, train_loss: 0.5472, test_loss: 1.2197, test_f1: 0.6187
 epoch: 93, train_loss: 0.5367, test_loss: 1.2263, test_f1: 0.6396
 epoch: 94, train_loss: 0.5708, test_loss: 1.1539, test_f1: 0.6202
 epoch: 95, train_loss: 0.5512, test_loss: 1.2473, test_f1: 0.5871
 epoch: 96, train_loss: 0.5518, test_loss: 1.3182, test_f1: 0.6408
 epoch: 97, train_loss: 0.5621, test_loss: 1.2588, test_f1: 0.6060
 epoch: 98, train_loss: 0.5351, test_loss: 1.2883, test_f1: 0.6018
 epoch: 99, train_loss: 0.5405, test_loss: 1.2217, test_f1: 0.6327
##################ITERATION #4 ****************************************
 epoch: 0, train_loss: 1.3738, test_loss: 1.3321, test_f1: 0.3422
 epoch: 1, train_loss: 1.2135, test_loss: 1.2337, test_f1: 0.3063
 epoch: 2, train_loss: 1.1662, test_loss: 1.1815, test_f1: 0.4211
 epoch: 3, train_loss: 1.1160, test_loss: 1.1681, test_f1: 0.4526
 epoch: 4, train_loss: 1.1001, test_loss: 1.2854, test_f1: 0.3560
 epoch: 5, train_loss: 1.0427, test_loss: 1.1658, test_f1: 0.4693
 epoch: 6, train_loss: 1.0341, test_loss: 1.1791, test_f1: 0.4710
 epoch: 7, train_loss: 1.0017, test_loss: 1.1760, test_f1: 0.4253
 epoch: 8, train_loss: 0.9612, test_loss: 1.1381, test_f1: 0.4963
 epoch: 9, train_loss: 0.9261, test_loss: 1.0277, test_f1: 0.5406
 epoch: 10, train_loss: 0.8865, test_loss: 1.3578, test_f1: 0.3884
 epoch: 11, train_loss: 0.8873, test_loss: 1.1640, test_f1: 0.4491
 epoch: 12, train_loss: 0.8881, test_loss: 1.0404, test_f1: 0.5677
 epoch: 13, train_loss: 0.8776, test_loss: 1.1160, test_f1: 0.4923
 epoch: 14, train_loss: 0.8723, test_loss: 1.1884, test_f1: 0.4761
 epoch: 15, train_loss: 0.8842, test_loss: 1.0565, test_f1: 0.5011
 epoch: 16, train_loss: 0.8562, test_loss: 1.1895, test_f1: 0.4783
 epoch: 17, train_loss: 0.8433, test_loss: 1.0143, test_f1: 0.5630
 epoch: 18, train_loss: 0.8464, test_loss: 1.0767, test_f1: 0.5070
 epoch: 19, train_loss: 0.8258, test_loss: 1.1543, test_f1: 0.4936
 epoch: 20, train_loss: 0.8113, test_loss: 1.0751, test_f1: 0.5656
 epoch: 21, train_loss: 0.7944, test_loss: 1.0861, test_f1: 0.5461
 epoch: 22, train_loss: 0.7904, test_loss: 1.0792, test_f1: 0.5393
 epoch: 23, train_loss: 0.7990, test_loss: 1.1148, test_f1: 0.5585
 epoch: 24, train_loss: 0.7818, test_loss: 2.2648, test_f1: 0.2901
 epoch: 25, train_loss: 0.8052, test_loss: 1.3712, test_f1: 0.5275
 epoch: 26, train_loss: 0.7813, test_loss: 1.2785, test_f1: 0.5312
 epoch: 27, train_loss: 0.7715, test_loss: 1.1593, test_f1: 0.5406
 epoch: 28, train_loss: 0.7797, test_loss: 1.3058, test_f1: 0.4934
 epoch: 29, train_loss: 0.8028, test_loss: 1.2491, test_f1: 0.4796
 epoch: 30, train_loss: 0.7994, test_loss: 1.4508, test_f1: 0.4975
 epoch: 31, train_loss: 0.7831, test_loss: 1.0918, test_f1: 0.5103
 epoch: 32, train_loss: 0.7715, test_loss: 1.2107, test_f1: 0.5183
 epoch: 33, train_loss: 0.7782, test_loss: 1.3177, test_f1: 0.4918
 epoch: 34, train_loss: 0.7871, test_loss: 1.3841, test_f1: 0.5071
 epoch: 35, train_loss: 0.7620, test_loss: 1.1561, test_f1: 0.5357
 epoch: 36, train_loss: 0.7627, test_loss: 1.2369, test_f1: 0.5302
 epoch: 37, train_loss: 0.7421, test_loss: 1.1492, test_f1: 0.5513
 epoch: 38, train_loss: 0.7344, test_loss: 1.2098, test_f1: 0.5542
 epoch: 39, train_loss: 0.7352, test_loss: 1.6178, test_f1: 0.4571
 epoch: 40, train_loss: 0.7311, test_loss: 1.4689, test_f1: 0.5798
 epoch: 41, train_loss: 0.7312, test_loss: 1.2612, test_f1: 0.5192
 epoch: 42, train_loss: 0.7131, test_loss: 1.4951, test_f1: 0.5222
 epoch: 43, train_loss: 0.7259, test_loss: 1.6334, test_f1: 0.5227
 epoch: 44, train_loss: 0.7272, test_loss: 1.2269, test_f1: 0.5202
 epoch: 45, train_loss: 0.7219, test_loss: 1.3101, test_f1: 0.5501
 epoch: 46, train_loss: 0.8072, test_loss: 1.1896, test_f1: 0.5200
 epoch: 47, train_loss: 0.7774, test_loss: 1.2746, test_f1: 0.5468
 epoch: 48, train_loss: 0.7464, test_loss: 1.1840, test_f1: 0.5299
 epoch: 49, train_loss: 0.7390, test_loss: 1.1353, test_f1: 0.5721
 epoch: 50, train_loss: 0.7244, test_loss: 1.1073, test_f1: 0.6016
 epoch: 51, train_loss: 0.6940, test_loss: 1.2740, test_f1: 0.5620
 epoch: 52, train_loss: 0.6767, test_loss: 1.1418, test_f1: 0.6201
 epoch: 53, train_loss: 0.6708, test_loss: 1.3552, test_f1: 0.5314
 epoch: 54, train_loss: 0.6915, test_loss: 1.2000, test_f1: 0.5215
 epoch: 55, train_loss: 0.6706, test_loss: 1.2717, test_f1: 0.5588
 epoch: 56, train_loss: 0.6686, test_loss: 1.2175, test_f1: 0.5816
 epoch: 57, train_loss: 0.6368, test_loss: 1.4392, test_f1: 0.5776
 epoch: 58, train_loss: 0.6417, test_loss: 1.2561, test_f1: 0.5457
 epoch: 59, train_loss: 0.6445, test_loss: 1.2399, test_f1: 0.5733
 epoch: 60, train_loss: 0.6164, test_loss: 1.2369, test_f1: 0.5922
 epoch: 61, train_loss: 0.6483, test_loss: 1.4186, test_f1: 0.5208
 epoch: 62, train_loss: 0.6366, test_loss: 1.3585, test_f1: 0.5648
 epoch: 63, train_loss: 0.6171, test_loss: 1.4083, test_f1: 0.5765
 epoch: 64, train_loss: 0.6028, test_loss: 1.4783, test_f1: 0.5443
 epoch: 65, train_loss: 0.6546, test_loss: 1.2634, test_f1: 0.5770
 epoch: 66, train_loss: 0.6313, test_loss: 1.5224, test_f1: 0.5219
 epoch: 67, train_loss: 0.5982, test_loss: 1.3391, test_f1: 0.5859
 epoch: 68, train_loss: 0.5935, test_loss: 1.7288, test_f1: 0.5021
 epoch: 69, train_loss: 0.6072, test_loss: 1.4058, test_f1: 0.6055
 epoch: 70, train_loss: 0.5908, test_loss: 1.4094, test_f1: 0.5819
 epoch: 71, train_loss: 0.5952, test_loss: 1.5069, test_f1: 0.5569
 epoch: 72, train_loss: 0.5916, test_loss: 1.5503, test_f1: 0.5765
 epoch: 73, train_loss: 0.5810, test_loss: 1.6032, test_f1: 0.5340
 epoch: 74, train_loss: 0.5827, test_loss: 1.7663, test_f1: 0.5565
 epoch: 75, train_loss: 0.5999, test_loss: 1.6456, test_f1: 0.5407
 epoch: 76, train_loss: 0.6131, test_loss: 1.3118, test_f1: 0.5600
 epoch: 77, train_loss: 0.6033, test_loss: 1.2819, test_f1: 0.5700
 epoch: 78, train_loss: 0.5752, test_loss: 1.4488, test_f1: 0.5727
 epoch: 79, train_loss: 0.5664, test_loss: 1.7036, test_f1: 0.5668
 epoch: 80, train_loss: 0.5647, test_loss: 1.4295, test_f1: 0.5856
 epoch: 81, train_loss: 0.5943, test_loss: 1.5898, test_f1: 0.5346
 epoch: 82, train_loss: 0.5850, test_loss: 1.4641, test_f1: 0.5568
 epoch: 83, train_loss: 0.5554, test_loss: 1.4754, test_f1: 0.5704
 epoch: 84, train_loss: 0.5571, test_loss: 1.5243, test_f1: 0.5797
 epoch: 85, train_loss: 0.5611, test_loss: 1.7656, test_f1: 0.5275
 epoch: 86, train_loss: 0.5499, test_loss: 1.4918, test_f1: 0.5341
 epoch: 87, train_loss: 0.5224, test_loss: 1.8301, test_f1: 0.5616
 epoch: 88, train_loss: 0.5449, test_loss: 1.6962, test_f1: 0.5464
 epoch: 89, train_loss: 0.5399, test_loss: 1.7657, test_f1: 0.5332
 epoch: 90, train_loss: 0.5458, test_loss: 1.8745, test_f1: 0.5467
 epoch: 91, train_loss: 0.5395, test_loss: 1.4591, test_f1: 0.6101
 epoch: 92, train_loss: 0.5367, test_loss: 1.6213, test_f1: 0.5900
 epoch: 93, train_loss: 0.5468, test_loss: 1.6909, test_f1: 0.5406
 epoch: 94, train_loss: 0.5310, test_loss: 1.6372, test_f1: 0.5775
 epoch: 95, train_loss: 0.5253, test_loss: 1.6129, test_f1: 0.5607
 epoch: 96, train_loss: 0.5207, test_loss: 1.6446, test_f1: 0.5858
 epoch: 97, train_loss: 0.5084, test_loss: 2.0187, test_f1: 0.5502
 epoch: 98, train_loss: 0.5427, test_loss: 1.6137, test_f1: 0.5830
 epoch: 99, train_loss: 0.5390, test_loss: 1.4835, test_f1: 0.5617
##################ITERATION #5 ****************************************
 epoch: 0, train_loss: 1.3025, test_loss: 1.2935, test_f1: 0.2551
 epoch: 1, train_loss: 1.1854, test_loss: 1.3008, test_f1: 0.3169
 epoch: 2, train_loss: 1.1335, test_loss: 1.2406, test_f1: 0.3376
 epoch: 3, train_loss: 1.0782, test_loss: 1.2127, test_f1: 0.3298
 epoch: 4, train_loss: 1.0440, test_loss: 1.2286, test_f1: 0.3686
 epoch: 5, train_loss: 1.0297, test_loss: 1.1773, test_f1: 0.4458
 epoch: 6, train_loss: 0.9869, test_loss: 1.2905, test_f1: 0.3539
 epoch: 7, train_loss: 1.0167, test_loss: 1.2454, test_f1: 0.4610
 epoch: 8, train_loss: 0.9724, test_loss: 1.2176, test_f1: 0.3471
 epoch: 9, train_loss: 0.9463, test_loss: 1.1960, test_f1: 0.4805
 epoch: 10, train_loss: 0.9323, test_loss: 1.1610, test_f1: 0.3814
 epoch: 11, train_loss: 0.9319, test_loss: 1.1101, test_f1: 0.4788
 epoch: 12, train_loss: 0.9151, test_loss: 1.1210, test_f1: 0.4842
 epoch: 13, train_loss: 0.9121, test_loss: 1.1641, test_f1: 0.4920
 epoch: 14, train_loss: 0.9115, test_loss: 1.0772, test_f1: 0.4544
 epoch: 15, train_loss: 0.9001, test_loss: 1.2051, test_f1: 0.5198
 epoch: 16, train_loss: 0.9037, test_loss: 1.1854, test_f1: 0.4782
 epoch: 17, train_loss: 0.8772, test_loss: 1.1263, test_f1: 0.5268
 epoch: 18, train_loss: 0.8588, test_loss: 1.1256, test_f1: 0.4767
 epoch: 19, train_loss: 0.8651, test_loss: 1.1827, test_f1: 0.4527
 epoch: 20, train_loss: 0.8768, test_loss: 1.5550, test_f1: 0.3840
 epoch: 21, train_loss: 0.8617, test_loss: 1.0760, test_f1: 0.5316
 epoch: 22, train_loss: 0.8473, test_loss: 1.7453, test_f1: 0.3808
 epoch: 23, train_loss: 0.8386, test_loss: 1.1200, test_f1: 0.5738
 epoch: 24, train_loss: 0.8333, test_loss: 1.1170, test_f1: 0.5136
 epoch: 25, train_loss: 0.8386, test_loss: 1.0312, test_f1: 0.5153
 epoch: 26, train_loss: 0.8323, test_loss: 1.1654, test_f1: 0.5041
 epoch: 27, train_loss: 0.8416, test_loss: 1.1571, test_f1: 0.4816
 epoch: 28, train_loss: 0.8517, test_loss: 1.1359, test_f1: 0.5260
 epoch: 29, train_loss: 0.8329, test_loss: 1.0725, test_f1: 0.5669
 epoch: 30, train_loss: 0.8220, test_loss: 1.2535, test_f1: 0.4932
 epoch: 31, train_loss: 0.7913, test_loss: 1.1659, test_f1: 0.5165
 epoch: 32, train_loss: 0.8221, test_loss: 1.2725, test_f1: 0.4461
 epoch: 33, train_loss: 0.8203, test_loss: 1.1131, test_f1: 0.5019
 epoch: 34, train_loss: 0.8028, test_loss: 1.1326, test_f1: 0.4989
 epoch: 35, train_loss: 0.7740, test_loss: 1.0727, test_f1: 0.5798
 epoch: 36, train_loss: 0.7820, test_loss: 1.0679, test_f1: 0.5812
 epoch: 37, train_loss: 0.7522, test_loss: 1.1145, test_f1: 0.5456
 epoch: 38, train_loss: 0.8236, test_loss: 1.2383, test_f1: 0.4885
 epoch: 39, train_loss: 0.8146, test_loss: 0.9931, test_f1: 0.6103
 epoch: 40, train_loss: 0.7791, test_loss: 1.0344, test_f1: 0.5717
 epoch: 41, train_loss: 0.7681, test_loss: 1.1248, test_f1: 0.5651
 epoch: 42, train_loss: 0.7578, test_loss: 1.2324, test_f1: 0.5845
 epoch: 43, train_loss: 0.7442, test_loss: 1.0325, test_f1: 0.5693
 epoch: 44, train_loss: 0.7693, test_loss: 1.2257, test_f1: 0.5491
 epoch: 45, train_loss: 0.7753, test_loss: 1.2217, test_f1: 0.5506
 epoch: 46, train_loss: 0.7320, test_loss: 1.0432, test_f1: 0.5805
 epoch: 47, train_loss: 0.7405, test_loss: 1.1637, test_f1: 0.5783
 epoch: 48, train_loss: 0.7335, test_loss: 1.2872, test_f1: 0.5359
 epoch: 49, train_loss: 0.7161, test_loss: 1.5154, test_f1: 0.4817
 epoch: 50, train_loss: 0.7405, test_loss: 1.1461, test_f1: 0.5334
 epoch: 51, train_loss: 0.7132, test_loss: 1.0043, test_f1: 0.6379
 epoch: 52, train_loss: 0.6739, test_loss: 1.2311, test_f1: 0.5798
 epoch: 53, train_loss: 0.6705, test_loss: 1.1146, test_f1: 0.6134
 epoch: 54, train_loss: 0.6649, test_loss: 1.2361, test_f1: 0.5848
 epoch: 55, train_loss: 0.6457, test_loss: 1.1477, test_f1: 0.5863
 epoch: 56, train_loss: 0.6580, test_loss: 1.3514, test_f1: 0.5364
 epoch: 57, train_loss: 0.6732, test_loss: 1.2004, test_f1: 0.5727
 epoch: 58, train_loss: 0.6618, test_loss: 1.2177, test_f1: 0.5870
 epoch: 59, train_loss: 0.6533, test_loss: 1.1830, test_f1: 0.6102
 epoch: 60, train_loss: 0.6216, test_loss: 1.1992, test_f1: 0.6248
 epoch: 61, train_loss: 0.6432, test_loss: 1.3310, test_f1: 0.5590
 epoch: 62, train_loss: 0.6209, test_loss: 1.2611, test_f1: 0.5896
 epoch: 63, train_loss: 0.6077, test_loss: 1.4437, test_f1: 0.5275
 epoch: 64, train_loss: 0.6139, test_loss: 1.3337, test_f1: 0.5878
 epoch: 65, train_loss: 0.5972, test_loss: 1.2507, test_f1: 0.5973
 epoch: 66, train_loss: 0.5994, test_loss: 1.2632, test_f1: 0.5478
 epoch: 67, train_loss: 0.6180, test_loss: 1.2535, test_f1: 0.6031
 epoch: 68, train_loss: 0.6154, test_loss: 1.3075, test_f1: 0.6042
 epoch: 69, train_loss: 0.6043, test_loss: 1.4692, test_f1: 0.5615
 epoch: 70, train_loss: 0.6137, test_loss: 1.1315, test_f1: 0.6070
 epoch: 71, train_loss: 0.5968, test_loss: 1.2095, test_f1: 0.5789
 epoch: 72, train_loss: 0.5844, test_loss: 1.2634, test_f1: 0.5754
 epoch: 73, train_loss: 0.5958, test_loss: 1.4806, test_f1: 0.5049
 epoch: 74, train_loss: 0.6215, test_loss: 1.2042, test_f1: 0.5994
 epoch: 75, train_loss: 0.6123, test_loss: 1.2339, test_f1: 0.5892
 epoch: 76, train_loss: 0.5764, test_loss: 1.1707, test_f1: 0.5735
 epoch: 77, train_loss: 0.5728, test_loss: 1.3253, test_f1: 0.5556
 epoch: 78, train_loss: 0.5762, test_loss: 1.3794, test_f1: 0.5306
 epoch: 79, train_loss: 0.7162, test_loss: 1.2439, test_f1: 0.5828
 epoch: 80, train_loss: 0.6242, test_loss: 1.2294, test_f1: 0.5834
 epoch: 81, train_loss: 0.6007, test_loss: 1.2600, test_f1: 0.6125
 epoch: 82, train_loss: 0.5556, test_loss: 1.3121, test_f1: 0.5941
 epoch: 83, train_loss: 0.5585, test_loss: 1.4856, test_f1: 0.5597
 epoch: 84, train_loss: 0.5860, test_loss: 1.3998, test_f1: 0.5715
 epoch: 85, train_loss: 0.5484, test_loss: 1.4311, test_f1: 0.5529
 epoch: 86, train_loss: 0.5727, test_loss: 1.3628, test_f1: 0.5812
 epoch: 87, train_loss: 0.5480, test_loss: 1.3667, test_f1: 0.5805
 epoch: 88, train_loss: 0.5436, test_loss: 1.5017, test_f1: 0.5551
 epoch: 89, train_loss: 0.5189, test_loss: 1.3097, test_f1: 0.5573
 epoch: 90, train_loss: 0.5392, test_loss: 1.8158, test_f1: 0.5352
 epoch: 91, train_loss: 0.5161, test_loss: 1.7428, test_f1: 0.5585
 epoch: 92, train_loss: 0.5026, test_loss: 2.4951, test_f1: 0.5943
 epoch: 93, train_loss: 0.5015, test_loss: 1.7718, test_f1: 0.5384
 epoch: 94, train_loss: 0.4963, test_loss: 1.6419, test_f1: 0.5374
 epoch: 95, train_loss: 0.5017, test_loss: 2.0040, test_f1: 0.5733
 epoch: 96, train_loss: 0.5227, test_loss: 1.7325, test_f1: 0.5417
 epoch: 97, train_loss: 0.5438, test_loss: 1.5942, test_f1: 0.5969
 epoch: 98, train_loss: 0.5112, test_loss: 1.4686, test_f1: 0.5985
 epoch: 99, train_loss: 0.5053, test_loss: 1.5417, test_f1: 0.5741
##################ITERATION #6 ****************************************
 epoch: 0, train_loss: 1.2883, test_loss: 1.2368, test_f1: 0.3547
 epoch: 1, train_loss: 1.1537, test_loss: 1.1635, test_f1: 0.4176
 epoch: 2, train_loss: 1.0851, test_loss: 1.1656, test_f1: 0.4514
 epoch: 3, train_loss: 1.0311, test_loss: 1.0878, test_f1: 0.5180
 epoch: 4, train_loss: 1.0001, test_loss: 1.1850, test_f1: 0.4286
 epoch: 5, train_loss: 1.0092, test_loss: 1.0636, test_f1: 0.4117
 epoch: 6, train_loss: 0.9924, test_loss: 1.0295, test_f1: 0.5070
 epoch: 7, train_loss: 0.9954, test_loss: 1.1251, test_f1: 0.4652
 epoch: 8, train_loss: 0.9337, test_loss: 1.1038, test_f1: 0.4887
 epoch: 9, train_loss: 0.9222, test_loss: 1.0956, test_f1: 0.5233
 epoch: 10, train_loss: 0.9456, test_loss: 1.1188, test_f1: 0.5047
 epoch: 11, train_loss: 0.9070, test_loss: 1.0696, test_f1: 0.5457
 epoch: 12, train_loss: 0.8986, test_loss: 1.1265, test_f1: 0.4724
 epoch: 13, train_loss: 0.8849, test_loss: 1.0916, test_f1: 0.5463
 epoch: 14, train_loss: 0.8942, test_loss: 1.2376, test_f1: 0.5519
 epoch: 15, train_loss: 0.8588, test_loss: 1.1250, test_f1: 0.5444
 epoch: 16, train_loss: 0.8685, test_loss: 1.2095, test_f1: 0.5827
 epoch: 17, train_loss: 0.8516, test_loss: 1.1399, test_f1: 0.4296
 epoch: 18, train_loss: 0.8522, test_loss: 1.1415, test_f1: 0.4978
 epoch: 19, train_loss: 0.8262, test_loss: 1.1237, test_f1: 0.5686
 epoch: 20, train_loss: 0.8344, test_loss: 1.1172, test_f1: 0.5223
 epoch: 21, train_loss: 0.8377, test_loss: 1.3049, test_f1: 0.5208
 epoch: 22, train_loss: 0.8262, test_loss: 1.2744, test_f1: 0.5057
 epoch: 23, train_loss: 0.8459, test_loss: 1.0123, test_f1: 0.5341
 epoch: 24, train_loss: 0.8233, test_loss: 1.1076, test_f1: 0.5756
 epoch: 25, train_loss: 0.8246, test_loss: 1.0906, test_f1: 0.5288
 epoch: 26, train_loss: 0.8111, test_loss: 1.0766, test_f1: 0.5490
 epoch: 27, train_loss: 0.8226, test_loss: 1.1361, test_f1: 0.5166
 epoch: 28, train_loss: 0.7923, test_loss: 1.2197, test_f1: 0.5360
 epoch: 29, train_loss: 0.7876, test_loss: 1.1899, test_f1: 0.5638
 epoch: 30, train_loss: 0.8300, test_loss: 1.1855, test_f1: 0.5191
 epoch: 31, train_loss: 0.8010, test_loss: 1.0491, test_f1: 0.5311
 epoch: 32, train_loss: 0.8026, test_loss: 1.3000, test_f1: 0.4941
 epoch: 33, train_loss: 0.8002, test_loss: 1.0756, test_f1: 0.5818
 epoch: 34, train_loss: 0.8097, test_loss: 1.1947, test_f1: 0.4994
 epoch: 35, train_loss: 0.8048, test_loss: 1.0204, test_f1: 0.5792
 epoch: 36, train_loss: 0.7775, test_loss: 1.3419, test_f1: 0.5216
 epoch: 37, train_loss: 0.7635, test_loss: 1.3175, test_f1: 0.5665
 epoch: 38, train_loss: 0.7731, test_loss: 1.0685, test_f1: 0.5335
 epoch: 39, train_loss: 0.7592, test_loss: 1.1353, test_f1: 0.5825
 epoch: 40, train_loss: 0.7830, test_loss: 1.4335, test_f1: 0.5411
 epoch: 41, train_loss: 0.8330, test_loss: 1.1058, test_f1: 0.5792
 epoch: 42, train_loss: 0.7881, test_loss: 1.1064, test_f1: 0.6021
 epoch: 43, train_loss: 0.7560, test_loss: 1.0584, test_f1: 0.5998
 epoch: 44, train_loss: 0.7538, test_loss: 1.3115, test_f1: 0.5305
 epoch: 45, train_loss: 0.7489, test_loss: 1.0703, test_f1: 0.5580
 epoch: 46, train_loss: 0.7436, test_loss: 1.1830, test_f1: 0.5739
 epoch: 47, train_loss: 0.7581, test_loss: 1.1809, test_f1: 0.6338
 epoch: 48, train_loss: 0.7535, test_loss: 1.0739, test_f1: 0.6056
 epoch: 49, train_loss: 0.7290, test_loss: 1.1972, test_f1: 0.5805
 epoch: 50, train_loss: 0.7366, test_loss: 1.1451, test_f1: 0.5314
 epoch: 51, train_loss: 0.6939, test_loss: 1.1160, test_f1: 0.6199
 epoch: 52, train_loss: 0.6897, test_loss: 1.0681, test_f1: 0.6217
 epoch: 53, train_loss: 0.6678, test_loss: 1.1110, test_f1: 0.5978
 epoch: 54, train_loss: 0.6635, test_loss: 1.0830, test_f1: 0.5948
 epoch: 55, train_loss: 0.6618, test_loss: 1.1248, test_f1: 0.6011
 epoch: 56, train_loss: 0.6549, test_loss: 1.1322, test_f1: 0.6304
 epoch: 57, train_loss: 0.6653, test_loss: 1.2952, test_f1: 0.6028
 epoch: 58, train_loss: 0.6692, test_loss: 1.1234, test_f1: 0.6012
 epoch: 59, train_loss: 0.6724, test_loss: 1.2327, test_f1: 0.5444
 epoch: 60, train_loss: 0.6388, test_loss: 1.1704, test_f1: 0.5815
 epoch: 61, train_loss: 0.6543, test_loss: 1.1911, test_f1: 0.5704
 epoch: 62, train_loss: 0.6611, test_loss: 1.1655, test_f1: 0.5893
 epoch: 63, train_loss: 0.6828, test_loss: 1.2267, test_f1: 0.5565
 epoch: 64, train_loss: 0.6525, test_loss: 1.1304, test_f1: 0.5648
 epoch: 65, train_loss: 0.6273, test_loss: 1.1939, test_f1: 0.5885
 epoch: 66, train_loss: 0.6179, test_loss: 1.4196, test_f1: 0.5228
 epoch: 67, train_loss: 0.6584, test_loss: 1.1911, test_f1: 0.6036
 epoch: 68, train_loss: 0.6520, test_loss: 1.0969, test_f1: 0.5884
 epoch: 69, train_loss: 0.6171, test_loss: 1.1992, test_f1: 0.5786
 epoch: 70, train_loss: 0.6160, test_loss: 1.1843, test_f1: 0.5705
 epoch: 71, train_loss: 0.6396, test_loss: 1.2173, test_f1: 0.6196
 epoch: 72, train_loss: 0.6317, test_loss: 1.2030, test_f1: 0.5559
 epoch: 73, train_loss: 0.6423, test_loss: 1.2137, test_f1: 0.5859
 epoch: 74, train_loss: 0.6443, test_loss: 1.4561, test_f1: 0.5723
 epoch: 75, train_loss: 0.6375, test_loss: 1.2568, test_f1: 0.5566
 epoch: 76, train_loss: 0.6458, test_loss: 1.1602, test_f1: 0.5990
 epoch: 77, train_loss: 0.6234, test_loss: 1.1507, test_f1: 0.6039
 epoch: 78, train_loss: 0.6301, test_loss: 1.2783, test_f1: 0.5731
 epoch: 79, train_loss: 0.6464, test_loss: 1.1560, test_f1: 0.6084
 epoch: 80, train_loss: 0.6092, test_loss: 1.2036, test_f1: 0.5907
 epoch: 81, train_loss: 0.6188, test_loss: 1.2351, test_f1: 0.5689
 epoch: 82, train_loss: 0.5879, test_loss: 1.3649, test_f1: 0.5669
 epoch: 83, train_loss: 0.5919, test_loss: 1.4290, test_f1: 0.5895
 epoch: 84, train_loss: 0.6384, test_loss: 1.3319, test_f1: 0.5574
 epoch: 85, train_loss: 0.6307, test_loss: 1.3287, test_f1: 0.5503
 epoch: 86, train_loss: 0.6073, test_loss: 1.2174, test_f1: 0.6018
 epoch: 87, train_loss: 0.6183, test_loss: 1.2616, test_f1: 0.5916
 epoch: 88, train_loss: 0.5853, test_loss: 1.2568, test_f1: 0.6256
 epoch: 89, train_loss: 0.6024, test_loss: 1.2534, test_f1: 0.6079
 epoch: 90, train_loss: 0.5754, test_loss: 1.2103, test_f1: 0.6084
 epoch: 91, train_loss: 0.5934, test_loss: 1.2133, test_f1: 0.5818
 epoch: 92, train_loss: 0.5867, test_loss: 1.2595, test_f1: 0.5933
 epoch: 93, train_loss: 0.5976, test_loss: 1.3300, test_f1: 0.5764
 epoch: 94, train_loss: 0.5732, test_loss: 1.2416, test_f1: 0.6011
 epoch: 95, train_loss: 0.5735, test_loss: 1.3737, test_f1: 0.5440
 epoch: 96, train_loss: 0.5561, test_loss: 1.4752, test_f1: 0.5909
 epoch: 97, train_loss: 0.5570, test_loss: 1.2170, test_f1: 0.5987
 epoch: 98, train_loss: 0.5990, test_loss: 1.2472, test_f1: 0.5919
 epoch: 99, train_loss: 0.6014, test_loss: 1.2484, test_f1: 0.5844
##################ITERATION #7 ****************************************
 epoch: 0, train_loss: 1.3058, test_loss: 1.3910, test_f1: 0.3637
 epoch: 1, train_loss: 1.2328, test_loss: 1.2851, test_f1: 0.3412
 epoch: 2, train_loss: 1.1877, test_loss: 1.3565, test_f1: 0.2759
 epoch: 3, train_loss: 1.1248, test_loss: 1.2995, test_f1: 0.3636
 epoch: 4, train_loss: 1.0857, test_loss: 1.2192, test_f1: 0.4116
 epoch: 5, train_loss: 1.0464, test_loss: 1.2865, test_f1: 0.4042
 epoch: 6, train_loss: 0.9866, test_loss: 1.1647, test_f1: 0.5114
 epoch: 7, train_loss: 0.9862, test_loss: 2.4260, test_f1: 0.3403
 epoch: 8, train_loss: 0.9919, test_loss: 1.1237, test_f1: 0.5487
 epoch: 9, train_loss: 0.9412, test_loss: 1.1691, test_f1: 0.4668
 epoch: 10, train_loss: 0.9109, test_loss: 1.1099, test_f1: 0.5447
 epoch: 11, train_loss: 0.9530, test_loss: 1.2391, test_f1: 0.4278
 epoch: 12, train_loss: 0.8997, test_loss: 1.0302, test_f1: 0.5945
 epoch: 13, train_loss: 0.9046, test_loss: 1.0564, test_f1: 0.5501
 epoch: 14, train_loss: 0.8969, test_loss: 1.0577, test_f1: 0.5627
 epoch: 15, train_loss: 0.9186, test_loss: 1.0724, test_f1: 0.4981
 epoch: 16, train_loss: 0.8856, test_loss: 1.2219, test_f1: 0.4434
 epoch: 17, train_loss: 0.8801, test_loss: 1.0545, test_f1: 0.5231
 epoch: 18, train_loss: 0.8427, test_loss: 1.0863, test_f1: 0.5331
 epoch: 19, train_loss: 0.8773, test_loss: 1.1107, test_f1: 0.5427
 epoch: 20, train_loss: 0.8426, test_loss: 1.1238, test_f1: 0.4919
 epoch: 21, train_loss: 0.8612, test_loss: 1.6026, test_f1: 0.4979
 epoch: 22, train_loss: 0.8433, test_loss: 1.0817, test_f1: 0.5338
 epoch: 23, train_loss: 0.8292, test_loss: 1.0399, test_f1: 0.4952
 epoch: 24, train_loss: 0.8329, test_loss: 1.0168, test_f1: 0.5377
 epoch: 25, train_loss: 0.8110, test_loss: 1.2035, test_f1: 0.5741
 epoch: 26, train_loss: 0.8373, test_loss: 1.2421, test_f1: 0.4297
 epoch: 27, train_loss: 0.8165, test_loss: 1.1271, test_f1: 0.5595
 epoch: 28, train_loss: 0.8026, test_loss: 1.0600, test_f1: 0.5575
 epoch: 29, train_loss: 0.7923, test_loss: 1.0565, test_f1: 0.5660
 epoch: 30, train_loss: 0.7880, test_loss: 1.1130, test_f1: 0.5715
 epoch: 31, train_loss: 0.7701, test_loss: 1.1535, test_f1: 0.5313
 epoch: 32, train_loss: 0.7679, test_loss: 1.1197, test_f1: 0.5686
 epoch: 33, train_loss: 0.7604, test_loss: 1.2838, test_f1: 0.5527
 epoch: 34, train_loss: 0.7843, test_loss: 1.0801, test_f1: 0.5499
 epoch: 35, train_loss: 0.7709, test_loss: 1.1702, test_f1: 0.5277
 epoch: 36, train_loss: 0.7728, test_loss: 1.5599, test_f1: 0.4846
 epoch: 37, train_loss: 0.7611, test_loss: 1.2084, test_f1: 0.5330
 epoch: 38, train_loss: 0.7573, test_loss: 1.3905, test_f1: 0.5380
 epoch: 39, train_loss: 0.7788, test_loss: 1.0755, test_f1: 0.6020
 epoch: 40, train_loss: 0.7696, test_loss: 1.3048, test_f1: 0.5010
 epoch: 41, train_loss: 0.7769, test_loss: 1.2020, test_f1: 0.4789
 epoch: 42, train_loss: 0.7468, test_loss: 1.0319, test_f1: 0.5773
 epoch: 43, train_loss: 0.7376, test_loss: 1.1756, test_f1: 0.5541
 epoch: 44, train_loss: 0.7058, test_loss: 1.2656, test_f1: 0.5222
 epoch: 45, train_loss: 0.6976, test_loss: 1.1802, test_f1: 0.5736
 epoch: 46, train_loss: 0.7241, test_loss: 1.3927, test_f1: 0.5086
 epoch: 47, train_loss: 0.7310, test_loss: 1.2932, test_f1: 0.5053
 epoch: 48, train_loss: 0.7178, test_loss: 1.3169, test_f1: 0.5768
 epoch: 49, train_loss: 0.7563, test_loss: 1.5283, test_f1: 0.5298
 epoch: 50, train_loss: 0.7458, test_loss: 1.1624, test_f1: 0.5381
 epoch: 51, train_loss: 0.6832, test_loss: 1.1247, test_f1: 0.6041
 epoch: 52, train_loss: 0.6629, test_loss: 1.1155, test_f1: 0.6005
 epoch: 53, train_loss: 0.6763, test_loss: 1.2268, test_f1: 0.5511
 epoch: 54, train_loss: 0.6484, test_loss: 1.1774, test_f1: 0.5664
 epoch: 55, train_loss: 0.6476, test_loss: 1.1527, test_f1: 0.6094
 epoch: 56, train_loss: 0.6313, test_loss: 1.4032, test_f1: 0.5256
 epoch: 57, train_loss: 0.6564, test_loss: 1.2336, test_f1: 0.5641
 epoch: 58, train_loss: 0.6558, test_loss: 1.5930, test_f1: 0.5303
 epoch: 59, train_loss: 0.6253, test_loss: 1.4361, test_f1: 0.5525
 epoch: 60, train_loss: 0.6298, test_loss: 1.1611, test_f1: 0.6186
 epoch: 61, train_loss: 0.6259, test_loss: 1.4419, test_f1: 0.5702
 epoch: 62, train_loss: 0.6172, test_loss: 1.3962, test_f1: 0.5322
 epoch: 63, train_loss: 0.6033, test_loss: 1.3962, test_f1: 0.5530
 epoch: 64, train_loss: 0.6304, test_loss: 1.2498, test_f1: 0.5561
 epoch: 65, train_loss: 0.6067, test_loss: 1.3289, test_f1: 0.5492
 epoch: 66, train_loss: 0.5980, test_loss: 1.3730, test_f1: 0.5666
 epoch: 67, train_loss: 0.5858, test_loss: 1.6802, test_f1: 0.5319
 epoch: 68, train_loss: 0.6123, test_loss: 1.6011, test_f1: 0.5130
 epoch: 69, train_loss: 0.6007, test_loss: 1.3921, test_f1: 0.4948
 epoch: 70, train_loss: 0.6021, test_loss: 1.7414, test_f1: 0.5343
 epoch: 71, train_loss: 0.5879, test_loss: 1.3989, test_f1: 0.5837
 epoch: 72, train_loss: 0.5876, test_loss: 1.6959, test_f1: 0.5242
 epoch: 73, train_loss: 0.5717, test_loss: 1.3410, test_f1: 0.5450
 epoch: 74, train_loss: 0.5899, test_loss: 1.3629, test_f1: 0.5496
 epoch: 75, train_loss: 0.5708, test_loss: 1.6036, test_f1: 0.5199
 epoch: 76, train_loss: 0.5750, test_loss: 1.4417, test_f1: 0.5613
 epoch: 77, train_loss: 0.5861, test_loss: 1.4941, test_f1: 0.5361
 epoch: 78, train_loss: 0.6026, test_loss: 1.4980, test_f1: 0.5586
 epoch: 79, train_loss: 0.5572, test_loss: 1.8089, test_f1: 0.5432
 epoch: 80, train_loss: 0.5833, test_loss: 1.4534, test_f1: 0.5688
 epoch: 81, train_loss: 0.5446, test_loss: 1.6734, test_f1: 0.5386
 epoch: 82, train_loss: 0.5647, test_loss: 1.5356, test_f1: 0.5674
 epoch: 83, train_loss: 0.5766, test_loss: 1.8741, test_f1: 0.5460
 epoch: 84, train_loss: 0.5626, test_loss: 1.5256, test_f1: 0.5231
 epoch: 85, train_loss: 0.6007, test_loss: 1.4694, test_f1: 0.6089
 epoch: 86, train_loss: 0.5637, test_loss: 1.5555, test_f1: 0.5368
 epoch: 87, train_loss: 0.5764, test_loss: 1.5484, test_f1: 0.5250
 epoch: 88, train_loss: 0.5482, test_loss: 1.7490, test_f1: 0.5293
 epoch: 89, train_loss: 0.5332, test_loss: 1.7029, test_f1: 0.5473
 epoch: 90, train_loss: 0.5453, test_loss: 1.8382, test_f1: 0.5158
 epoch: 91, train_loss: 0.5596, test_loss: 1.7235, test_f1: 0.5422
 epoch: 92, train_loss: 0.5714, test_loss: 1.7632, test_f1: 0.5511
 epoch: 93, train_loss: 0.5504, test_loss: 1.7538, test_f1: 0.5270
 epoch: 94, train_loss: 0.5516, test_loss: 1.7452, test_f1: 0.5462
 epoch: 95, train_loss: 0.5172, test_loss: 1.7133, test_f1: 0.5491
 epoch: 96, train_loss: 0.5486, test_loss: 1.7783, test_f1: 0.5630
 epoch: 97, train_loss: 0.5406, test_loss: 2.0746, test_f1: 0.4976
 epoch: 98, train_loss: 0.5805, test_loss: 1.7003, test_f1: 0.5352
 epoch: 99, train_loss: 0.5741, test_loss: 1.6091, test_f1: 0.5723
##################ITERATION #8 ****************************************
 epoch: 0, train_loss: 1.2751, test_loss: 1.2675, test_f1: 0.3357
 epoch: 1, train_loss: 1.1396, test_loss: 1.3268, test_f1: 0.2429
 epoch: 2, train_loss: 1.0744, test_loss: 1.2515, test_f1: 0.3938
 epoch: 3, train_loss: 1.0487, test_loss: 1.2390, test_f1: 0.4521
 epoch: 4, train_loss: 1.0093, test_loss: 1.1043, test_f1: 0.4603
 epoch: 5, train_loss: 1.0023, test_loss: 1.1291, test_f1: 0.3950
 epoch: 6, train_loss: 0.9756, test_loss: 1.3468, test_f1: 0.3518
 epoch: 7, train_loss: 0.9506, test_loss: 1.1775, test_f1: 0.5096
 epoch: 8, train_loss: 0.9096, test_loss: 1.0667, test_f1: 0.4540
 epoch: 9, train_loss: 0.9415, test_loss: 1.0605, test_f1: 0.5306
 epoch: 10, train_loss: 0.9046, test_loss: 1.2844, test_f1: 0.3949
 epoch: 11, train_loss: 0.9192, test_loss: 1.1251, test_f1: 0.5059
 epoch: 12, train_loss: 0.9034, test_loss: 1.0536, test_f1: 0.5275
 epoch: 13, train_loss: 0.9049, test_loss: 1.0278, test_f1: 0.5030
 epoch: 14, train_loss: 0.8776, test_loss: 1.1574, test_f1: 0.4782
 epoch: 15, train_loss: 0.8930, test_loss: 1.3969, test_f1: 0.3980
 epoch: 16, train_loss: 0.8776, test_loss: 1.1732, test_f1: 0.5542
 epoch: 17, train_loss: 0.8587, test_loss: 1.0976, test_f1: 0.5471
 epoch: 18, train_loss: 0.8756, test_loss: 1.0418, test_f1: 0.5480
 epoch: 19, train_loss: 0.8687, test_loss: 1.1163, test_f1: 0.4947
 epoch: 20, train_loss: 0.8640, test_loss: 1.3314, test_f1: 0.4100
 epoch: 21, train_loss: 0.9481, test_loss: 1.0221, test_f1: 0.5209
 epoch: 22, train_loss: 0.8922, test_loss: 1.3297, test_f1: 0.4566
 epoch: 23, train_loss: 0.8701, test_loss: 1.0545, test_f1: 0.5416
 epoch: 24, train_loss: 0.8622, test_loss: 1.0251, test_f1: 0.5664
 epoch: 25, train_loss: 0.8611, test_loss: 1.2404, test_f1: 0.4625
 epoch: 26, train_loss: 0.8828, test_loss: 1.1957, test_f1: 0.4027
 epoch: 27, train_loss: 0.9186, test_loss: 1.2454, test_f1: 0.4982
 epoch: 28, train_loss: 0.8552, test_loss: 1.1217, test_f1: 0.5030
 epoch: 29, train_loss: 0.8222, test_loss: 1.2688, test_f1: 0.5466
 epoch: 30, train_loss: 0.8094, test_loss: 1.0246, test_f1: 0.5715
 epoch: 31, train_loss: 0.8086, test_loss: 1.0734, test_f1: 0.5457
 epoch: 32, train_loss: 0.8154, test_loss: 1.0714, test_f1: 0.5405
 epoch: 33, train_loss: 0.8250, test_loss: 1.0635, test_f1: 0.5473
 epoch: 34, train_loss: 0.8533, test_loss: 1.4617, test_f1: 0.4211
 epoch: 35, train_loss: 0.7931, test_loss: 1.1085, test_f1: 0.5412
 epoch: 36, train_loss: 0.8272, test_loss: 1.0456, test_f1: 0.5583
 epoch: 37, train_loss: 0.8071, test_loss: 1.1044, test_f1: 0.5395
 epoch: 38, train_loss: 0.7956, test_loss: 1.1142, test_f1: 0.5493
 epoch: 39, train_loss: 0.7886, test_loss: 1.1019, test_f1: 0.5354
 epoch: 40, train_loss: 0.8177, test_loss: 1.2164, test_f1: 0.4095
 epoch: 41, train_loss: 0.7934, test_loss: 1.1562, test_f1: 0.5258
 epoch: 42, train_loss: 0.7700, test_loss: 1.0813, test_f1: 0.5534
 epoch: 43, train_loss: 0.7716, test_loss: 1.1038, test_f1: 0.5210
 epoch: 44, train_loss: 0.7449, test_loss: 1.0931, test_f1: 0.5633
 epoch: 45, train_loss: 0.7751, test_loss: 1.1037, test_f1: 0.5474
 epoch: 46, train_loss: 0.7491, test_loss: 1.3536, test_f1: 0.5549
 epoch: 47, train_loss: 0.7445, test_loss: 1.1058, test_f1: 0.5670
 epoch: 48, train_loss: 0.7484, test_loss: 1.1815, test_f1: 0.5304
 epoch: 49, train_loss: 0.7574, test_loss: 1.1140, test_f1: 0.5864
 epoch: 50, train_loss: 0.7331, test_loss: 1.0148, test_f1: 0.6205
 epoch: 51, train_loss: 0.7074, test_loss: 1.2940, test_f1: 0.5341
 epoch: 52, train_loss: 0.6972, test_loss: 1.1278, test_f1: 0.5655
 epoch: 53, train_loss: 0.6877, test_loss: 1.1080, test_f1: 0.5386
 epoch: 54, train_loss: 0.6698, test_loss: 1.0908, test_f1: 0.5574
 epoch: 55, train_loss: 0.6578, test_loss: 1.1039, test_f1: 0.5816
 epoch: 56, train_loss: 0.6788, test_loss: 1.0842, test_f1: 0.6060
 epoch: 57, train_loss: 0.6793, test_loss: 1.1595, test_f1: 0.5926
 epoch: 58, train_loss: 0.6573, test_loss: 1.1692, test_f1: 0.5377
 epoch: 59, train_loss: 0.6555, test_loss: 1.2646, test_f1: 0.5754
 epoch: 60, train_loss: 0.6375, test_loss: 1.0604, test_f1: 0.6201
 epoch: 61, train_loss: 0.6346, test_loss: 1.2973, test_f1: 0.5445
 epoch: 62, train_loss: 0.6321, test_loss: 1.1957, test_f1: 0.5892
 epoch: 63, train_loss: 0.6462, test_loss: 1.2413, test_f1: 0.5273
 epoch: 64, train_loss: 0.6531, test_loss: 1.3007, test_f1: 0.5368
 epoch: 65, train_loss: 0.6823, test_loss: 1.1534, test_f1: 0.5821
 epoch: 66, train_loss: 0.6287, test_loss: 1.2012, test_f1: 0.5738
 epoch: 67, train_loss: 0.6628, test_loss: 1.2092, test_f1: 0.5797
 epoch: 68, train_loss: 0.6396, test_loss: 1.2175, test_f1: 0.5717
 epoch: 69, train_loss: 0.6124, test_loss: 1.2349, test_f1: 0.5529
 epoch: 70, train_loss: 0.5946, test_loss: 1.1821, test_f1: 0.5896
 epoch: 71, train_loss: 0.6021, test_loss: 1.3562, test_f1: 0.5599
 epoch: 72, train_loss: 0.6226, test_loss: 1.2873, test_f1: 0.5451
 epoch: 73, train_loss: 0.6159, test_loss: 1.2052, test_f1: 0.5663
 epoch: 74, train_loss: 0.6093, test_loss: 1.2766, test_f1: 0.5674
 epoch: 75, train_loss: 0.6378, test_loss: 1.3351, test_f1: 0.5258
 epoch: 76, train_loss: 0.6382, test_loss: 1.2529, test_f1: 0.5693
 epoch: 77, train_loss: 0.6447, test_loss: 1.2459, test_f1: 0.5561
 epoch: 78, train_loss: 0.6081, test_loss: 1.1926, test_f1: 0.5706
 epoch: 79, train_loss: 0.6092, test_loss: 1.2993, test_f1: 0.5825
 epoch: 80, train_loss: 0.6064, test_loss: 1.2175, test_f1: 0.6019
 epoch: 81, train_loss: 0.5743, test_loss: 1.3324, test_f1: 0.5219
 epoch: 82, train_loss: 0.6121, test_loss: 1.2160, test_f1: 0.5775
 epoch: 83, train_loss: 0.6352, test_loss: 1.2606, test_f1: 0.5376
 epoch: 84, train_loss: 0.5721, test_loss: 1.2602, test_f1: 0.5684
 epoch: 85, train_loss: 0.5947, test_loss: 1.4266, test_f1: 0.5421
 epoch: 86, train_loss: 0.5844, test_loss: 1.3261, test_f1: 0.5669
 epoch: 87, train_loss: 0.5687, test_loss: 1.2979, test_f1: 0.5502
 epoch: 88, train_loss: 0.5755, test_loss: 1.4316, test_f1: 0.5826
 epoch: 89, train_loss: 0.5763, test_loss: 1.4684, test_f1: 0.5595
 epoch: 90, train_loss: 0.5750, test_loss: 1.3934, test_f1: 0.5880
 epoch: 91, train_loss: 0.5903, test_loss: 1.4165, test_f1: 0.5816
 epoch: 92, train_loss: 0.5486, test_loss: 1.3283, test_f1: 0.5854
 epoch: 93, train_loss: 0.6131, test_loss: 1.3963, test_f1: 0.5745
 epoch: 94, train_loss: 0.5702, test_loss: 1.4118, test_f1: 0.5823
 epoch: 95, train_loss: 0.5286, test_loss: 1.4082, test_f1: 0.5640
 epoch: 96, train_loss: 0.5528, test_loss: 1.3567, test_f1: 0.5741
 epoch: 97, train_loss: 0.5808, test_loss: 1.3678, test_f1: 0.5741
 epoch: 98, train_loss: 0.5688, test_loss: 1.3622, test_f1: 0.5603
 epoch: 99, train_loss: 0.5696, test_loss: 1.3806, test_f1: 0.5624
##################ITERATION #9 ****************************************
 epoch: 0, train_loss: 1.2933, test_loss: 1.2794, test_f1: 0.4053
 epoch: 1, train_loss: 1.1739, test_loss: 1.2044, test_f1: 0.4472
 epoch: 2, train_loss: 1.0607, test_loss: 1.3192, test_f1: 0.4141
 epoch: 3, train_loss: 1.0541, test_loss: 1.2396, test_f1: 0.4587
 epoch: 4, train_loss: 0.9992, test_loss: 1.1219, test_f1: 0.5305
 epoch: 5, train_loss: 0.9646, test_loss: 1.2283, test_f1: 0.4699
 epoch: 6, train_loss: 0.9700, test_loss: 1.2587, test_f1: 0.4633
 epoch: 7, train_loss: 0.9514, test_loss: 1.1121, test_f1: 0.5073
 epoch: 8, train_loss: 0.9138, test_loss: 1.1581, test_f1: 0.4903
 epoch: 9, train_loss: 0.9159, test_loss: 1.2222, test_f1: 0.5156
 epoch: 10, train_loss: 0.8811, test_loss: 1.1071, test_f1: 0.5215
 epoch: 11, train_loss: 0.8740, test_loss: 1.1798, test_f1: 0.5103
 epoch: 12, train_loss: 0.8878, test_loss: 1.1114, test_f1: 0.5063
 epoch: 13, train_loss: 0.8985, test_loss: 1.0251, test_f1: 0.5628
 epoch: 14, train_loss: 0.8350, test_loss: 1.1487, test_f1: 0.5001
 epoch: 15, train_loss: 0.8290, test_loss: 1.2345, test_f1: 0.5066
 epoch: 16, train_loss: 0.8301, test_loss: 1.1671, test_f1: 0.5411
 epoch: 17, train_loss: 0.8232, test_loss: 1.1821, test_f1: 0.5000
 epoch: 18, train_loss: 0.7950, test_loss: 1.3834, test_f1: 0.5375
 epoch: 19, train_loss: 0.8057, test_loss: 1.1941, test_f1: 0.5167
 epoch: 20, train_loss: 0.8146, test_loss: 1.3094, test_f1: 0.4846
 epoch: 21, train_loss: 0.8170, test_loss: 1.2619, test_f1: 0.5244
 epoch: 22, train_loss: 0.8026, test_loss: 1.1630, test_f1: 0.5654
 epoch: 23, train_loss: 0.8080, test_loss: 1.2503, test_f1: 0.5105
 epoch: 24, train_loss: 0.8620, test_loss: 1.1583, test_f1: 0.5553
 epoch: 25, train_loss: 0.8253, test_loss: 1.1024, test_f1: 0.5432
 epoch: 26, train_loss: 0.7737, test_loss: 1.0939, test_f1: 0.5471
 epoch: 27, train_loss: 0.7789, test_loss: 1.2744, test_f1: 0.4276
 epoch: 28, train_loss: 0.7956, test_loss: 1.1568, test_f1: 0.5167
 epoch: 29, train_loss: 0.7813, test_loss: 1.6182, test_f1: 0.4393
 epoch: 30, train_loss: 0.7627, test_loss: 1.4460, test_f1: 0.5342
 epoch: 31, train_loss: 0.7731, test_loss: 1.5642, test_f1: 0.5036
 epoch: 32, train_loss: 0.7721, test_loss: 1.4300, test_f1: 0.4609
 epoch: 33, train_loss: 0.7675, test_loss: 1.2961, test_f1: 0.5139
 epoch: 34, train_loss: 0.7166, test_loss: 1.2455, test_f1: 0.5563
 epoch: 35, train_loss: 0.7362, test_loss: 1.0150, test_f1: 0.5835
 epoch: 36, train_loss: 0.7551, test_loss: 1.4896, test_f1: 0.5381
 epoch: 37, train_loss: 0.7423, test_loss: 1.2931, test_f1: 0.5064
 epoch: 38, train_loss: 0.7452, test_loss: 1.2848, test_f1: 0.5169
 epoch: 39, train_loss: 0.7389, test_loss: 1.3030, test_f1: 0.4995
 epoch: 40, train_loss: 0.7590, test_loss: 1.2856, test_f1: 0.4771
 epoch: 41, train_loss: 0.7328, test_loss: 1.0949, test_f1: 0.6268
 epoch: 42, train_loss: 0.7165, test_loss: 1.1731, test_f1: 0.5539
 epoch: 43, train_loss: 0.6910, test_loss: 1.2178, test_f1: 0.5523
 epoch: 44, train_loss: 0.6911, test_loss: 1.4387, test_f1: 0.5005
 epoch: 45, train_loss: 0.6707, test_loss: 1.4770, test_f1: 0.5163
 epoch: 46, train_loss: 0.6962, test_loss: 1.1587, test_f1: 0.5886
 epoch: 47, train_loss: 0.6455, test_loss: 1.2478, test_f1: 0.5538
 epoch: 48, train_loss: 0.6589, test_loss: 1.7591, test_f1: 0.5124
 epoch: 49, train_loss: 0.6796, test_loss: 1.1372, test_f1: 0.5984
 epoch: 50, train_loss: 0.6966, test_loss: 1.3419, test_f1: 0.5467
 epoch: 51, train_loss: 0.6419, test_loss: 1.3332, test_f1: 0.5151
 epoch: 52, train_loss: 0.6424, test_loss: 1.5496, test_f1: 0.5405
 epoch: 53, train_loss: 0.6224, test_loss: 1.5115, test_f1: 0.5091
 epoch: 54, train_loss: 0.6245, test_loss: 1.4790, test_f1: 0.5384
 epoch: 55, train_loss: 0.6017, test_loss: 1.4219, test_f1: 0.5080
 epoch: 56, train_loss: 0.6229, test_loss: 1.7783, test_f1: 0.5058
 epoch: 57, train_loss: 0.6041, test_loss: 1.4730, test_f1: 0.5622
 epoch: 58, train_loss: 0.5960, test_loss: 1.5098, test_f1: 0.6050
 epoch: 59, train_loss: 0.5918, test_loss: 1.4952, test_f1: 0.5231
 epoch: 60, train_loss: 0.5650, test_loss: 1.4893, test_f1: 0.5608
 epoch: 61, train_loss: 0.5689, test_loss: 1.3697, test_f1: 0.5425
 epoch: 62, train_loss: 0.6009, test_loss: 1.3609, test_f1: 0.5846
 epoch: 63, train_loss: 0.5785, test_loss: 1.4405, test_f1: 0.5343
 epoch: 64, train_loss: 0.5781, test_loss: 1.2100, test_f1: 0.5953
 epoch: 65, train_loss: 0.6072, test_loss: 1.2186, test_f1: 0.5528
 epoch: 66, train_loss: 0.5684, test_loss: 1.3315, test_f1: 0.5630
 epoch: 67, train_loss: 0.5818, test_loss: 1.6583, test_f1: 0.5375
 epoch: 68, train_loss: 0.5937, test_loss: 1.7021, test_f1: 0.5820
 epoch: 69, train_loss: 0.5729, test_loss: 1.4906, test_f1: 0.5715
 epoch: 70, train_loss: 0.5374, test_loss: 1.6933, test_f1: 0.5335
 epoch: 71, train_loss: 0.5512, test_loss: 1.9557, test_f1: 0.5367
 epoch: 72, train_loss: 0.5607, test_loss: 1.4883, test_f1: 0.5361
 epoch: 73, train_loss: 0.5559, test_loss: 1.3070, test_f1: 0.5906
 epoch: 74, train_loss: 0.5385, test_loss: 1.8584, test_f1: 0.5223
 epoch: 75, train_loss: 0.5673, test_loss: 1.3473, test_f1: 0.5838
 epoch: 76, train_loss: 0.5291, test_loss: 1.6104, test_f1: 0.5361
 epoch: 77, train_loss: 0.5293, test_loss: 1.5258, test_f1: 0.5141
 epoch: 78, train_loss: 0.5360, test_loss: 1.6647, test_f1: 0.5631
 epoch: 79, train_loss: 0.5390, test_loss: 1.7188, test_f1: 0.5614
 epoch: 80, train_loss: 0.5194, test_loss: 1.4512, test_f1: 0.5629
 epoch: 81, train_loss: 0.5228, test_loss: 1.6079, test_f1: 0.5504
 epoch: 82, train_loss: 0.5129, test_loss: 1.3297, test_f1: 0.5357
 epoch: 83, train_loss: 0.5005, test_loss: 1.2830, test_f1: 0.5563
 epoch: 84, train_loss: 0.5461, test_loss: 1.3677, test_f1: 0.5682
 epoch: 85, train_loss: 0.5583, test_loss: 1.4384, test_f1: 0.5294
 epoch: 86, train_loss: 0.5459, test_loss: 1.4409, test_f1: 0.5663
 epoch: 87, train_loss: 0.5533, test_loss: 1.6757, test_f1: 0.6001
 epoch: 88, train_loss: 0.5223, test_loss: 1.3257, test_f1: 0.5749
 epoch: 89, train_loss: 0.5069, test_loss: 1.2813, test_f1: 0.5758
 epoch: 90, train_loss: 0.5402, test_loss: 1.5252, test_f1: 0.5036
 epoch: 91, train_loss: 0.5081, test_loss: 1.3741, test_f1: 0.5719
 epoch: 92, train_loss: 0.5173, test_loss: 1.3942, test_f1: 0.6255
 epoch: 93, train_loss: 0.5329, test_loss: 1.3635, test_f1: 0.6013
 epoch: 94, train_loss: 0.5422, test_loss: 1.4026, test_f1: 0.5707
 epoch: 95, train_loss: 0.4925, test_loss: 1.3852, test_f1: 0.5724
 epoch: 96, train_loss: 0.4950, test_loss: 1.3720, test_f1: 0.5641
 epoch: 97, train_loss: 0.4767, test_loss: 1.4152, test_f1: 0.5854
 epoch: 98, train_loss: 0.4802, test_loss: 1.3534, test_f1: 0.5721
 epoch: 99, train_loss: 0.4864, test_loss: 1.5662, test_f1: 0.6039

Training completed in 489.74 seconds
Best F1: 0.6685 at epoch 91
Mean F1 across iterations: 0.6337  0.0155
========================FINAL RESULTS================================
FEGIN weighted F1: 0.6685  0.0155
python main.py --data ltspice_demos --representation component_component --model FEGIN --layers 5 --hiddens 32 --batch_size 64 --lr 0.01 --emb_size 250 --epochs 100 --save_appendix component_component_L5_H32_BS64_LR0.01_E250 --no_val
-----



STDERR:
  File "main.py", line 370, in <module>
    main()
  File "main.py", line 254, in main
    dataset = dataset_class(
  File "/home/philip/projects/ltspice_examples_code_repo/Circuit-Completion-Using-GNNs/component_classification_with_link_prediction_head/evaluation/FEGIN/kernel/circuit_datasets.py", line 15, in __init__
    self.data, self.slices = torch.load(self.processed_paths[0])
  File "/home/philip/.local/lib/python3.8/site-packages/torch/serialization.py", line 1040, in load
    warnings.warn(
  File "/usr/lib/python3.8/warnings.py", line 109, in _showwarnmsg
    sw(msg.message, msg.category, msg.filename, msg.lineno,
  File "main.py", line 47, in warn_with_traceback
    traceback.print_stack(file=log)
/home/philip/projects/ltspice_examples_code_repo/Circuit-Completion-Using-GNNs/component_classification_with_link_prediction_head/evaluation/FEGIN/kernel/circuit_datasets.py:15: FutureWarning: You are using `torch.load` with `weights_only=False` (the current default value), which uses the default pickle module implicitly. It is possible to construct malicious pickle data which will execute arbitrary code during unpickling (See https://github.com/pytorch/pytorch/blob/main/SECURITY.md#untrusted-models for more details). In a future release, the default value for `weights_only` will be flipped to `True`. This limits the functions that could be executed during unpickling. Arbitrary objects will no longer be allowed to be loaded via this mode unless they are explicitly allowlisted by the user via `torch.serialization.add_safe_globals`. We recommend you start setting `weights_only=True` for any use case where you don't have full control of the loaded file. Please open an issue on GitHub for any issues related to this experimental feature.
  self.data, self.slices = torch.load(self.processed_paths[0])
