STDOUT:
Results will be saved in /home/philip/projects/ltspice_examples_code_repo/Circuit-Completion-Using-GNNs/component_classification_with_link_prediction_head/evaluation/FEGIN/results/model_FEGIN_dataset_ltspice_demos
Command line input: python main.py --data ltspice_demos --representation component_pin_net --model FEGIN --layers 3 --hiddens 32 --batch_size 64 --lr 0.01 --emb_size 512 --epochs 100 --save_appendix component_pin_net_L3_H32_BS64_LR0.01_E512 --no_val
 is saved.
-----
ltspice_demos - FEGIN
Using 3 layers, 32 hidden units, h = 2
Loading component_pin_net representation dataset
ENTERED
Training FEGIN on component_pin_net representation
Train: 1565, Test: 383
##################ITERATION #0 ****************************************
 epoch: 0, train_loss: 1.2305, test_loss: 1.2797, test_f1: 0.2281
 epoch: 1, train_loss: 1.1036, test_loss: 1.2655, test_f1: 0.2421
 epoch: 2, train_loss: 1.0609, test_loss: 1.1395, test_f1: 0.4311
 epoch: 3, train_loss: 1.0143, test_loss: 1.0762, test_f1: 0.4510
 epoch: 4, train_loss: 0.9980, test_loss: 1.0733, test_f1: 0.4798
 epoch: 5, train_loss: 0.9873, test_loss: 1.0723, test_f1: 0.4107
 epoch: 6, train_loss: 0.9776, test_loss: 1.0868, test_f1: 0.4202
 epoch: 7, train_loss: 0.9372, test_loss: 1.0769, test_f1: 0.4357
 epoch: 8, train_loss: 0.9383, test_loss: 1.0034, test_f1: 0.4628
 epoch: 9, train_loss: 0.9366, test_loss: 1.1133, test_f1: 0.5447
 epoch: 10, train_loss: 0.9008, test_loss: 1.0813, test_f1: 0.5416
 epoch: 11, train_loss: 0.8951, test_loss: 1.0828, test_f1: 0.4824
 epoch: 12, train_loss: 0.8633, test_loss: 0.9934, test_f1: 0.5240
 epoch: 13, train_loss: 0.8271, test_loss: 0.9984, test_f1: 0.5539
 epoch: 14, train_loss: 0.8384, test_loss: 1.0364, test_f1: 0.5049
 epoch: 15, train_loss: 0.8268, test_loss: 1.0139, test_f1: 0.5545
 epoch: 16, train_loss: 0.8012, test_loss: 0.9152, test_f1: 0.5209
 epoch: 17, train_loss: 0.8119, test_loss: 0.9146, test_f1: 0.5819
 epoch: 18, train_loss: 0.7919, test_loss: 0.9665, test_f1: 0.5892
 epoch: 19, train_loss: 0.7873, test_loss: 0.9900, test_f1: 0.4844
 epoch: 20, train_loss: 0.8038, test_loss: 1.0241, test_f1: 0.6078
 epoch: 21, train_loss: 0.7599, test_loss: 0.9703, test_f1: 0.5839
 epoch: 22, train_loss: 0.7707, test_loss: 1.3958, test_f1: 0.3773
 epoch: 23, train_loss: 0.7643, test_loss: 0.9731, test_f1: 0.5582
 epoch: 24, train_loss: 0.7359, test_loss: 0.9142, test_f1: 0.5856
 epoch: 25, train_loss: 0.7353, test_loss: 0.9385, test_f1: 0.5711
 epoch: 26, train_loss: 0.7373, test_loss: 0.9232, test_f1: 0.6172
 epoch: 27, train_loss: 0.7350, test_loss: 1.0797, test_f1: 0.5480
 epoch: 28, train_loss: 0.7357, test_loss: 1.0372, test_f1: 0.4991
 epoch: 29, train_loss: 0.7018, test_loss: 1.4345, test_f1: 0.4524
 epoch: 30, train_loss: 0.7074, test_loss: 1.1458, test_f1: 0.5066
 epoch: 31, train_loss: 0.7085, test_loss: 0.9535, test_f1: 0.6062
 epoch: 32, train_loss: 0.6638, test_loss: 1.0063, test_f1: 0.5967
 epoch: 33, train_loss: 0.6842, test_loss: 1.1219, test_f1: 0.5565
 epoch: 34, train_loss: 0.7156, test_loss: 1.1286, test_f1: 0.5145
 epoch: 35, train_loss: 0.6867, test_loss: 1.0033, test_f1: 0.5938
 epoch: 36, train_loss: 0.6568, test_loss: 1.0510, test_f1: 0.6095
 epoch: 37, train_loss: 0.6498, test_loss: 1.0376, test_f1: 0.6561
 epoch: 38, train_loss: 0.6572, test_loss: 1.0992, test_f1: 0.5619
 epoch: 39, train_loss: 0.6761, test_loss: 1.0333, test_f1: 0.5665
 epoch: 40, train_loss: 0.6402, test_loss: 1.0977, test_f1: 0.5782
 epoch: 41, train_loss: 0.6270, test_loss: 1.1020, test_f1: 0.6349
 epoch: 42, train_loss: 0.6157, test_loss: 1.1483, test_f1: 0.6182
 epoch: 43, train_loss: 0.6454, test_loss: 1.0677, test_f1: 0.6221
 epoch: 44, train_loss: 0.6341, test_loss: 1.0719, test_f1: 0.5862
 epoch: 45, train_loss: 0.6068, test_loss: 1.0858, test_f1: 0.6361
 epoch: 46, train_loss: 0.6165, test_loss: 1.2092, test_f1: 0.5458
 epoch: 47, train_loss: 0.6050, test_loss: 1.0593, test_f1: 0.5844
 epoch: 48, train_loss: 0.6120, test_loss: 1.5184, test_f1: 0.4638
 epoch: 49, train_loss: 0.6241, test_loss: 1.2810, test_f1: 0.5783
 epoch: 50, train_loss: 0.6028, test_loss: 1.1535, test_f1: 0.5979
 epoch: 51, train_loss: 0.5818, test_loss: 1.0079, test_f1: 0.6409
 epoch: 52, train_loss: 0.5697, test_loss: 1.1815, test_f1: 0.5806
 epoch: 53, train_loss: 0.5393, test_loss: 1.1820, test_f1: 0.6151
 epoch: 54, train_loss: 0.5618, test_loss: 1.1339, test_f1: 0.6408
 epoch: 55, train_loss: 0.5368, test_loss: 1.1177, test_f1: 0.6334
 epoch: 56, train_loss: 0.5245, test_loss: 1.1654, test_f1: 0.6525
 epoch: 57, train_loss: 0.5176, test_loss: 1.1425, test_f1: 0.6563
 epoch: 58, train_loss: 0.5041, test_loss: 1.2162, test_f1: 0.6284
 epoch: 59, train_loss: 0.5089, test_loss: 1.3270, test_f1: 0.6072
 epoch: 60, train_loss: 0.5077, test_loss: 1.3023, test_f1: 0.6494
 epoch: 61, train_loss: 0.4968, test_loss: 1.2817, test_f1: 0.5432
 epoch: 62, train_loss: 0.5089, test_loss: 1.2503, test_f1: 0.6320
 epoch: 63, train_loss: 0.5017, test_loss: 1.2630, test_f1: 0.6110
 epoch: 64, train_loss: 0.5121, test_loss: 1.3270, test_f1: 0.6366
 epoch: 65, train_loss: 0.5056, test_loss: 1.4257, test_f1: 0.5903
 epoch: 66, train_loss: 0.4944, test_loss: 1.2258, test_f1: 0.6377
 epoch: 67, train_loss: 0.4743, test_loss: 1.3069, test_f1: 0.6150
 epoch: 68, train_loss: 0.4903, test_loss: 1.3785, test_f1: 0.6268
 epoch: 69, train_loss: 0.4614, test_loss: 1.3868, test_f1: 0.6160
 epoch: 70, train_loss: 0.4796, test_loss: 1.3085, test_f1: 0.6669
 epoch: 71, train_loss: 0.5090, test_loss: 1.3215, test_f1: 0.6431
 epoch: 72, train_loss: 0.4458, test_loss: 1.2302, test_f1: 0.6369
 epoch: 73, train_loss: 0.4654, test_loss: 1.5214, test_f1: 0.6033
 epoch: 74, train_loss: 0.4744, test_loss: 1.2822, test_f1: 0.5583
 epoch: 75, train_loss: 0.4515, test_loss: 1.3461, test_f1: 0.6540
 epoch: 76, train_loss: 0.4526, test_loss: 1.3530, test_f1: 0.6167
 epoch: 77, train_loss: 0.4779, test_loss: 1.3332, test_f1: 0.6471
 epoch: 78, train_loss: 0.4610, test_loss: 1.2991, test_f1: 0.6008
 epoch: 79, train_loss: 0.4893, test_loss: 1.3478, test_f1: 0.6341
 epoch: 80, train_loss: 0.4529, test_loss: 1.4546, test_f1: 0.6107
 epoch: 81, train_loss: 0.4512, test_loss: 1.2998, test_f1: 0.6480
 epoch: 82, train_loss: 0.4501, test_loss: 1.3803, test_f1: 0.6533
 epoch: 83, train_loss: 0.4154, test_loss: 1.4127, test_f1: 0.6316
 epoch: 84, train_loss: 0.4190, test_loss: 1.5548, test_f1: 0.6284
 epoch: 85, train_loss: 0.3982, test_loss: 1.4580, test_f1: 0.6444
 epoch: 86, train_loss: 0.4522, test_loss: 1.7757, test_f1: 0.5974
 epoch: 87, train_loss: 0.4556, test_loss: 1.4947, test_f1: 0.5924
 epoch: 88, train_loss: 0.4560, test_loss: 1.4546, test_f1: 0.6431
 epoch: 89, train_loss: 0.4474, test_loss: 1.4036, test_f1: 0.6420
 epoch: 90, train_loss: 0.4276, test_loss: 1.5870, test_f1: 0.5994
 epoch: 91, train_loss: 0.4416, test_loss: 1.4477, test_f1: 0.6146
 epoch: 92, train_loss: 0.4496, test_loss: 1.3487, test_f1: 0.6165
 epoch: 93, train_loss: 0.4148, test_loss: 1.5172, test_f1: 0.6085
 epoch: 94, train_loss: 0.4533, test_loss: 1.6065, test_f1: 0.6074
 epoch: 95, train_loss: 0.4602, test_loss: 1.5920, test_f1: 0.5872
 epoch: 96, train_loss: 0.4088, test_loss: 1.4178, test_f1: 0.6158
 epoch: 97, train_loss: 0.3929, test_loss: 1.4132, test_f1: 0.6799
 epoch: 98, train_loss: 0.4234, test_loss: 1.4820, test_f1: 0.6164
 epoch: 99, train_loss: 0.4193, test_loss: 1.4243, test_f1: 0.6512
##################ITERATION #1 ****************************************
 epoch: 0, train_loss: 1.0830, test_loss: 1.4765, test_f1: 0.2281
 epoch: 1, train_loss: 0.9854, test_loss: 1.1348, test_f1: 0.4416
 epoch: 2, train_loss: 0.9278, test_loss: 1.0997, test_f1: 0.5070
 epoch: 3, train_loss: 0.9089, test_loss: 0.9961, test_f1: 0.5038
 epoch: 4, train_loss: 0.8990, test_loss: 1.0874, test_f1: 0.5440
 epoch: 5, train_loss: 0.8750, test_loss: 1.1054, test_f1: 0.5254
 epoch: 6, train_loss: 0.8653, test_loss: 0.9948, test_f1: 0.5198
 epoch: 7, train_loss: 0.8641, test_loss: 0.9855, test_f1: 0.5485
 epoch: 8, train_loss: 0.8602, test_loss: 0.9961, test_f1: 0.5811
 epoch: 9, train_loss: 0.8327, test_loss: 0.9858, test_f1: 0.5770
 epoch: 10, train_loss: 0.8422, test_loss: 0.9947, test_f1: 0.5632
 epoch: 11, train_loss: 0.8280, test_loss: 1.4479, test_f1: 0.3456
 epoch: 12, train_loss: 0.8218, test_loss: 1.1601, test_f1: 0.4030
 epoch: 13, train_loss: 0.8484, test_loss: 1.1357, test_f1: 0.5080
 epoch: 14, train_loss: 0.8354, test_loss: 0.9769, test_f1: 0.5559
 epoch: 15, train_loss: 0.8074, test_loss: 1.0114, test_f1: 0.5834
 epoch: 16, train_loss: 0.7825, test_loss: 1.0170, test_f1: 0.5398
 epoch: 17, train_loss: 0.7883, test_loss: 1.1174, test_f1: 0.4992
 epoch: 18, train_loss: 0.8058, test_loss: 0.9819, test_f1: 0.5950
 epoch: 19, train_loss: 0.7798, test_loss: 1.0327, test_f1: 0.5195
 epoch: 20, train_loss: 0.7696, test_loss: 1.0053, test_f1: 0.5977
 epoch: 21, train_loss: 0.7776, test_loss: 1.1678, test_f1: 0.4523
 epoch: 22, train_loss: 0.7578, test_loss: 0.9784, test_f1: 0.5440
 epoch: 23, train_loss: 0.7550, test_loss: 1.0005, test_f1: 0.5647
 epoch: 24, train_loss: 0.7501, test_loss: 1.4013, test_f1: 0.4803
 epoch: 25, train_loss: 0.7624, test_loss: 0.9952, test_f1: 0.5773
 epoch: 26, train_loss: 0.7650, test_loss: 1.0182, test_f1: 0.6091
 epoch: 27, train_loss: 0.7658, test_loss: 1.0184, test_f1: 0.5785
 epoch: 28, train_loss: 0.7401, test_loss: 1.0691, test_f1: 0.5962
 epoch: 29, train_loss: 0.7380, test_loss: 1.0608, test_f1: 0.5627
 epoch: 30, train_loss: 0.7246, test_loss: 1.1311, test_f1: 0.5610
 epoch: 31, train_loss: 0.7096, test_loss: 1.1428, test_f1: 0.5361
 epoch: 32, train_loss: 0.6962, test_loss: 1.2019, test_f1: 0.4774
 epoch: 33, train_loss: 0.7019, test_loss: 1.1229, test_f1: 0.5636
 epoch: 34, train_loss: 0.7126, test_loss: 1.2606, test_f1: 0.4290
 epoch: 35, train_loss: 0.6816, test_loss: 1.1794, test_f1: 0.5381
 epoch: 36, train_loss: 0.6812, test_loss: 1.4481, test_f1: 0.4705
 epoch: 37, train_loss: 0.6792, test_loss: 1.0721, test_f1: 0.6047
 epoch: 38, train_loss: 0.6473, test_loss: 1.8364, test_f1: 0.4157
 epoch: 39, train_loss: 0.6626, test_loss: 1.0170, test_f1: 0.5743
 epoch: 40, train_loss: 0.6759, test_loss: 1.0531, test_f1: 0.5262
 epoch: 41, train_loss: 0.6739, test_loss: 1.0517, test_f1: 0.5375
 epoch: 42, train_loss: 0.6488, test_loss: 1.3924, test_f1: 0.5212
 epoch: 43, train_loss: 0.6746, test_loss: 1.0180, test_f1: 0.5893
 epoch: 44, train_loss: 0.6305, test_loss: 1.5342, test_f1: 0.4661
 epoch: 45, train_loss: 0.6285, test_loss: 1.0845, test_f1: 0.5704
 epoch: 46, train_loss: 0.6114, test_loss: 1.1844, test_f1: 0.5870
 epoch: 47, train_loss: 0.6715, test_loss: 1.1236, test_f1: 0.5764
 epoch: 48, train_loss: 0.6267, test_loss: 1.1277, test_f1: 0.5815
 epoch: 49, train_loss: 0.6370, test_loss: 1.2086, test_f1: 0.5816
 epoch: 50, train_loss: 0.6028, test_loss: 1.3046, test_f1: 0.5531
 epoch: 51, train_loss: 0.5826, test_loss: 1.0858, test_f1: 0.5967
 epoch: 52, train_loss: 0.5523, test_loss: 1.0786, test_f1: 0.6107
 epoch: 53, train_loss: 0.5558, test_loss: 1.1924, test_f1: 0.5879
 epoch: 54, train_loss: 0.5466, test_loss: 1.1294, test_f1: 0.6169
 epoch: 55, train_loss: 0.5320, test_loss: 1.1280, test_f1: 0.6108
 epoch: 56, train_loss: 0.5241, test_loss: 1.2598, test_f1: 0.5733
 epoch: 57, train_loss: 0.5592, test_loss: 1.1425, test_f1: 0.6340
 epoch: 58, train_loss: 0.5375, test_loss: 1.1771, test_f1: 0.6142
 epoch: 59, train_loss: 0.5042, test_loss: 1.2154, test_f1: 0.6126
 epoch: 60, train_loss: 0.4933, test_loss: 1.3727, test_f1: 0.5010
 epoch: 61, train_loss: 0.4970, test_loss: 1.5247, test_f1: 0.5855
 epoch: 62, train_loss: 0.5201, test_loss: 1.1879, test_f1: 0.5974
 epoch: 63, train_loss: 0.4893, test_loss: 1.2731, test_f1: 0.6174
 epoch: 64, train_loss: 0.5025, test_loss: 1.3988, test_f1: 0.6000
 epoch: 65, train_loss: 0.5133, test_loss: 1.2919, test_f1: 0.6011
 epoch: 66, train_loss: 0.5456, test_loss: 1.3506, test_f1: 0.5493
 epoch: 67, train_loss: 0.5384, test_loss: 1.2164, test_f1: 0.6292
 epoch: 68, train_loss: 0.4986, test_loss: 1.1794, test_f1: 0.6219
 epoch: 69, train_loss: 0.5019, test_loss: 1.3076, test_f1: 0.6345
 epoch: 70, train_loss: 0.4834, test_loss: 1.2996, test_f1: 0.5934
 epoch: 71, train_loss: 0.5130, test_loss: 1.5370, test_f1: 0.5757
 epoch: 72, train_loss: 0.4913, test_loss: 1.2947, test_f1: 0.6127
 epoch: 73, train_loss: 0.4685, test_loss: 1.2879, test_f1: 0.6369
 epoch: 74, train_loss: 0.4710, test_loss: 1.3568, test_f1: 0.6342
 epoch: 75, train_loss: 0.5037, test_loss: 1.3351, test_f1: 0.6172
 epoch: 76, train_loss: 0.4765, test_loss: 1.4612, test_f1: 0.5606
 epoch: 77, train_loss: 0.4533, test_loss: 1.3268, test_f1: 0.5798
 epoch: 78, train_loss: 0.4250, test_loss: 1.5170, test_f1: 0.5748
 epoch: 79, train_loss: 0.4496, test_loss: 1.4437, test_f1: 0.6086
 epoch: 80, train_loss: 0.4849, test_loss: 1.3730, test_f1: 0.5348
 epoch: 81, train_loss: 0.4624, test_loss: 1.3077, test_f1: 0.6201
 epoch: 82, train_loss: 0.4655, test_loss: 1.5695, test_f1: 0.6037
 epoch: 83, train_loss: 0.4829, test_loss: 1.2343, test_f1: 0.6267
 epoch: 84, train_loss: 0.4702, test_loss: 1.3286, test_f1: 0.6048
 epoch: 85, train_loss: 0.4331, test_loss: 1.4148, test_f1: 0.6077
 epoch: 86, train_loss: 0.4445, test_loss: 1.3708, test_f1: 0.6170
 epoch: 87, train_loss: 0.4506, test_loss: 1.3543, test_f1: 0.6480
 epoch: 88, train_loss: 0.4635, test_loss: 1.3432, test_f1: 0.5846
 epoch: 89, train_loss: 0.4236, test_loss: 1.5371, test_f1: 0.5873
 epoch: 90, train_loss: 0.4337, test_loss: 1.3976, test_f1: 0.5708
 epoch: 91, train_loss: 0.4205, test_loss: 1.4654, test_f1: 0.6158
 epoch: 92, train_loss: 0.4161, test_loss: 1.3938, test_f1: 0.6181
 epoch: 93, train_loss: 0.4007, test_loss: 1.4908, test_f1: 0.6194
 epoch: 94, train_loss: 0.4460, test_loss: 1.4785, test_f1: 0.6128
 epoch: 95, train_loss: 0.4585, test_loss: 1.3777, test_f1: 0.6079
 epoch: 96, train_loss: 0.4614, test_loss: 1.2824, test_f1: 0.6394
 epoch: 97, train_loss: 0.4364, test_loss: 1.4100, test_f1: 0.6156
 epoch: 98, train_loss: 0.4421, test_loss: 1.4270, test_f1: 0.6228
 epoch: 99, train_loss: 0.4328, test_loss: 1.3494, test_f1: 0.6134
##################ITERATION #2 ****************************************
 epoch: 0, train_loss: 1.1614, test_loss: 1.3291, test_f1: 0.2722
 epoch: 1, train_loss: 0.9795, test_loss: 1.1298, test_f1: 0.4990
 epoch: 2, train_loss: 0.9291, test_loss: 1.0331, test_f1: 0.5294
 epoch: 3, train_loss: 0.9006, test_loss: 1.0373, test_f1: 0.5265
 epoch: 4, train_loss: 0.8880, test_loss: 1.0383, test_f1: 0.5330
 epoch: 5, train_loss: 0.8423, test_loss: 1.0799, test_f1: 0.5283
 epoch: 6, train_loss: 0.8459, test_loss: 0.9857, test_f1: 0.5490
 epoch: 7, train_loss: 0.8566, test_loss: 1.2073, test_f1: 0.3972
 epoch: 8, train_loss: 0.8593, test_loss: 1.0200, test_f1: 0.5734
 epoch: 9, train_loss: 0.8294, test_loss: 1.0731, test_f1: 0.5220
 epoch: 10, train_loss: 0.7919, test_loss: 1.3570, test_f1: 0.3762
 epoch: 11, train_loss: 0.7879, test_loss: 1.0168, test_f1: 0.5840
 epoch: 12, train_loss: 0.7805, test_loss: 1.2223, test_f1: 0.5401
 epoch: 13, train_loss: 0.7731, test_loss: 1.0458, test_f1: 0.5574
 epoch: 14, train_loss: 0.8386, test_loss: 1.0050, test_f1: 0.5478
 epoch: 15, train_loss: 0.7981, test_loss: 1.1930, test_f1: 0.4925
 epoch: 16, train_loss: 0.7813, test_loss: 1.0093, test_f1: 0.5851
 epoch: 17, train_loss: 0.7782, test_loss: 1.1578, test_f1: 0.5486
 epoch: 18, train_loss: 0.7335, test_loss: 1.0290, test_f1: 0.5752
 epoch: 19, train_loss: 0.7291, test_loss: 1.1307, test_f1: 0.5692
 epoch: 20, train_loss: 0.7324, test_loss: 1.0715, test_f1: 0.5375
 epoch: 21, train_loss: 0.7342, test_loss: 1.2085, test_f1: 0.5515
 epoch: 22, train_loss: 0.7319, test_loss: 1.3300, test_f1: 0.5509
 epoch: 23, train_loss: 0.7241, test_loss: 1.1282, test_f1: 0.5388
 epoch: 24, train_loss: 0.7390, test_loss: 1.1435, test_f1: 0.5495
 epoch: 25, train_loss: 0.7051, test_loss: 1.1592, test_f1: 0.4765
 epoch: 26, train_loss: 0.7095, test_loss: 1.0803, test_f1: 0.5577
 epoch: 27, train_loss: 0.6803, test_loss: 1.0716, test_f1: 0.5721
 epoch: 28, train_loss: 0.6916, test_loss: 1.2393, test_f1: 0.5230
 epoch: 29, train_loss: 0.7236, test_loss: 1.4352, test_f1: 0.5270
 epoch: 30, train_loss: 0.6996, test_loss: 1.1301, test_f1: 0.5971
 epoch: 31, train_loss: 0.6742, test_loss: 1.0567, test_f1: 0.6109
 epoch: 32, train_loss: 0.6921, test_loss: 1.1871, test_f1: 0.5268
 epoch: 33, train_loss: 0.6642, test_loss: 1.3645, test_f1: 0.5155
 epoch: 34, train_loss: 0.6770, test_loss: 1.1660, test_f1: 0.5571
 epoch: 35, train_loss: 0.6869, test_loss: 1.2268, test_f1: 0.5501
 epoch: 36, train_loss: 0.6604, test_loss: 1.1835, test_f1: 0.5956
 epoch: 37, train_loss: 0.6553, test_loss: 1.2667, test_f1: 0.4918
 epoch: 38, train_loss: 0.6515, test_loss: 1.3391, test_f1: 0.5057
 epoch: 39, train_loss: 0.6579, test_loss: 1.4621, test_f1: 0.4778
 epoch: 40, train_loss: 0.6501, test_loss: 1.3017, test_f1: 0.6130
 epoch: 41, train_loss: 0.6286, test_loss: 1.1022, test_f1: 0.6360
 epoch: 42, train_loss: 0.6155, test_loss: 1.1709, test_f1: 0.6281
 epoch: 43, train_loss: 0.6088, test_loss: 1.1630, test_f1: 0.6042
 epoch: 44, train_loss: 0.5905, test_loss: 1.4706, test_f1: 0.5155
 epoch: 45, train_loss: 0.6262, test_loss: 1.3386, test_f1: 0.5485
 epoch: 46, train_loss: 0.6126, test_loss: 1.1408, test_f1: 0.5781
 epoch: 47, train_loss: 0.6476, test_loss: 1.4932, test_f1: 0.5832
 epoch: 48, train_loss: 0.6467, test_loss: 1.1852, test_f1: 0.5751
 epoch: 49, train_loss: 0.6311, test_loss: 1.3327, test_f1: 0.5439
 epoch: 50, train_loss: 0.5938, test_loss: 1.5314, test_f1: 0.4945
 epoch: 51, train_loss: 0.5774, test_loss: 1.2264, test_f1: 0.6645
 epoch: 52, train_loss: 0.5302, test_loss: 1.1734, test_f1: 0.6269
 epoch: 53, train_loss: 0.5406, test_loss: 1.1749, test_f1: 0.6202
 epoch: 54, train_loss: 0.5070, test_loss: 1.2186, test_f1: 0.6428
 epoch: 55, train_loss: 0.5250, test_loss: 1.4420, test_f1: 0.6022
 epoch: 56, train_loss: 0.5283, test_loss: 1.2364, test_f1: 0.6433
 epoch: 57, train_loss: 0.5109, test_loss: 1.2841, test_f1: 0.5897
 epoch: 58, train_loss: 0.5161, test_loss: 1.3344, test_f1: 0.5963
 epoch: 59, train_loss: 0.5111, test_loss: 1.4883, test_f1: 0.5797
 epoch: 60, train_loss: 0.4896, test_loss: 1.2444, test_f1: 0.6539
 epoch: 61, train_loss: 0.5125, test_loss: 1.3733, test_f1: 0.6215
 epoch: 62, train_loss: 0.5082, test_loss: 1.2496, test_f1: 0.6219
 epoch: 63, train_loss: 0.5141, test_loss: 1.4466, test_f1: 0.5826
 epoch: 64, train_loss: 0.5305, test_loss: 1.3487, test_f1: 0.6140
 epoch: 65, train_loss: 0.5176, test_loss: 1.2979, test_f1: 0.6086
 epoch: 66, train_loss: 0.4980, test_loss: 1.5362, test_f1: 0.5769
 epoch: 67, train_loss: 0.4590, test_loss: 1.5392, test_f1: 0.6554
 epoch: 68, train_loss: 0.4970, test_loss: 1.4416, test_f1: 0.5981
 epoch: 69, train_loss: 0.4840, test_loss: 1.3503, test_f1: 0.6537
 epoch: 70, train_loss: 0.4800, test_loss: 1.3196, test_f1: 0.5833
 epoch: 71, train_loss: 0.4981, test_loss: 1.4130, test_f1: 0.5925
 epoch: 72, train_loss: 0.4630, test_loss: 1.4030, test_f1: 0.6243
 epoch: 73, train_loss: 0.4447, test_loss: 1.4933, test_f1: 0.5933
 epoch: 74, train_loss: 0.4749, test_loss: 1.3296, test_f1: 0.6289
 epoch: 75, train_loss: 0.5028, test_loss: 1.4338, test_f1: 0.5750
 epoch: 76, train_loss: 0.4907, test_loss: 1.3380, test_f1: 0.6183
 epoch: 77, train_loss: 0.4866, test_loss: 1.5029, test_f1: 0.6468
 epoch: 78, train_loss: 0.4475, test_loss: 1.5089, test_f1: 0.5959
 epoch: 79, train_loss: 0.4515, test_loss: 1.5207, test_f1: 0.5774
 epoch: 80, train_loss: 0.4716, test_loss: 1.4839, test_f1: 0.6191
 epoch: 81, train_loss: 0.4801, test_loss: 1.4863, test_f1: 0.6507
 epoch: 82, train_loss: 0.4663, test_loss: 1.4241, test_f1: 0.6294
 epoch: 83, train_loss: 0.4605, test_loss: 1.3692, test_f1: 0.6141
 epoch: 84, train_loss: 0.4880, test_loss: 1.6416, test_f1: 0.6255
 epoch: 85, train_loss: 0.4536, test_loss: 1.4208, test_f1: 0.6217
 epoch: 86, train_loss: 0.4739, test_loss: 1.4508, test_f1: 0.5969
 epoch: 87, train_loss: 0.4352, test_loss: 1.3660, test_f1: 0.6380
 epoch: 88, train_loss: 0.4467, test_loss: 1.8603, test_f1: 0.5386
 epoch: 89, train_loss: 0.4324, test_loss: 1.4473, test_f1: 0.6578
 epoch: 90, train_loss: 0.4405, test_loss: 1.5760, test_f1: 0.6155
 epoch: 91, train_loss: 0.4432, test_loss: 1.6790, test_f1: 0.5566
 epoch: 92, train_loss: 0.4276, test_loss: 1.3925, test_f1: 0.6278
 epoch: 93, train_loss: 0.4423, test_loss: 1.6202, test_f1: 0.5742
 epoch: 94, train_loss: 0.4128, test_loss: 1.8057, test_f1: 0.5930
 epoch: 95, train_loss: 0.4284, test_loss: 1.4907, test_f1: 0.7029
 epoch: 96, train_loss: 0.4000, test_loss: 1.7462, test_f1: 0.6039
 epoch: 97, train_loss: 0.4143, test_loss: 1.3697, test_f1: 0.6735
 epoch: 98, train_loss: 0.4046, test_loss: 1.4744, test_f1: 0.6474
 epoch: 99, train_loss: 0.4213, test_loss: 1.6018, test_f1: 0.5742
##################ITERATION #3 ****************************************
 epoch: 0, train_loss: 1.1241, test_loss: 1.2312, test_f1: 0.3180
 epoch: 1, train_loss: 0.9820, test_loss: 1.0186, test_f1: 0.4830
 epoch: 2, train_loss: 0.9335, test_loss: 1.0267, test_f1: 0.5206
 epoch: 3, train_loss: 0.9049, test_loss: 1.0664, test_f1: 0.5364
 epoch: 4, train_loss: 0.9123, test_loss: 1.0331, test_f1: 0.5111
 epoch: 5, train_loss: 0.8817, test_loss: 0.9902, test_f1: 0.5415
 epoch: 6, train_loss: 0.8743, test_loss: 1.0181, test_f1: 0.4244
 epoch: 7, train_loss: 0.8639, test_loss: 0.9623, test_f1: 0.5508
 epoch: 8, train_loss: 0.8479, test_loss: 1.2038, test_f1: 0.4322
 epoch: 9, train_loss: 0.8117, test_loss: 1.0044, test_f1: 0.5325
 epoch: 10, train_loss: 0.8118, test_loss: 1.0637, test_f1: 0.5310
 epoch: 11, train_loss: 0.8038, test_loss: 1.2798, test_f1: 0.4314
 epoch: 12, train_loss: 0.8075, test_loss: 1.2347, test_f1: 0.5144
 epoch: 13, train_loss: 0.8711, test_loss: 1.2514, test_f1: 0.3986
 epoch: 14, train_loss: 0.8161, test_loss: 1.1314, test_f1: 0.5589
 epoch: 15, train_loss: 0.8309, test_loss: 1.0367, test_f1: 0.5388
 epoch: 16, train_loss: 0.7910, test_loss: 1.1725, test_f1: 0.4715
 epoch: 17, train_loss: 0.7749, test_loss: 1.0307, test_f1: 0.5568
 epoch: 18, train_loss: 0.7489, test_loss: 1.0841, test_f1: 0.5529
 epoch: 19, train_loss: 0.7605, test_loss: 1.0937, test_f1: 0.5507
 epoch: 20, train_loss: 0.7468, test_loss: 1.0939, test_f1: 0.5302
 epoch: 21, train_loss: 0.7221, test_loss: 1.0941, test_f1: 0.6107
 epoch: 22, train_loss: 0.7385, test_loss: 1.1296, test_f1: 0.5462
 epoch: 23, train_loss: 0.7206, test_loss: 1.1718, test_f1: 0.5190
 epoch: 24, train_loss: 0.7149, test_loss: 1.0884, test_f1: 0.5442
 epoch: 25, train_loss: 0.7127, test_loss: 1.9672, test_f1: 0.4963
 epoch: 26, train_loss: 0.7105, test_loss: 1.0376, test_f1: 0.5367
 epoch: 27, train_loss: 0.6932, test_loss: 1.0436, test_f1: 0.6204
 epoch: 28, train_loss: 0.7132, test_loss: 1.1275, test_f1: 0.5585
 epoch: 29, train_loss: 0.7264, test_loss: 1.8526, test_f1: 0.4879
 epoch: 30, train_loss: 0.6881, test_loss: 1.1126, test_f1: 0.5953
 epoch: 31, train_loss: 0.6542, test_loss: 1.0201, test_f1: 0.6094
 epoch: 32, train_loss: 0.6735, test_loss: 1.5101, test_f1: 0.4625
 epoch: 33, train_loss: 0.6667, test_loss: 1.2065, test_f1: 0.4699
 epoch: 34, train_loss: 0.6840, test_loss: 1.0985, test_f1: 0.6411
 epoch: 35, train_loss: 0.6999, test_loss: 1.2601, test_f1: 0.6238
 epoch: 36, train_loss: 0.6649, test_loss: 0.9996, test_f1: 0.6046
 epoch: 37, train_loss: 0.6745, test_loss: 1.2459, test_f1: 0.6423
 epoch: 38, train_loss: 0.6599, test_loss: 1.0069, test_f1: 0.6536
 epoch: 39, train_loss: 0.6261, test_loss: 1.1631, test_f1: 0.5536
 epoch: 40, train_loss: 0.6336, test_loss: 1.3560, test_f1: 0.6093
 epoch: 41, train_loss: 0.6422, test_loss: 1.1410, test_f1: 0.5545
 epoch: 42, train_loss: 0.6389, test_loss: 1.4619, test_f1: 0.6395
 epoch: 43, train_loss: 0.6388, test_loss: 1.0532, test_f1: 0.6367
 epoch: 44, train_loss: 0.6022, test_loss: 1.1449, test_f1: 0.6094
 epoch: 45, train_loss: 0.6345, test_loss: 1.6927, test_f1: 0.5015
 epoch: 46, train_loss: 0.6321, test_loss: 1.0885, test_f1: 0.6467
 epoch: 47, train_loss: 0.6379, test_loss: 1.1983, test_f1: 0.5952
 epoch: 48, train_loss: 0.6608, test_loss: 1.1165, test_f1: 0.5866
 epoch: 49, train_loss: 0.6157, test_loss: 1.0487, test_f1: 0.5924
 epoch: 50, train_loss: 0.6074, test_loss: 1.3561, test_f1: 0.6318
 epoch: 51, train_loss: 0.5818, test_loss: 1.1702, test_f1: 0.6306
 epoch: 52, train_loss: 0.5574, test_loss: 1.2125, test_f1: 0.6113
 epoch: 53, train_loss: 0.5209, test_loss: 1.3381, test_f1: 0.5982
 epoch: 54, train_loss: 0.5241, test_loss: 1.2979, test_f1: 0.6313
 epoch: 55, train_loss: 0.5420, test_loss: 1.1842, test_f1: 0.6164
 epoch: 56, train_loss: 0.5115, test_loss: 1.2302, test_f1: 0.6366
 epoch: 57, train_loss: 0.5232, test_loss: 1.2833, test_f1: 0.6213
 epoch: 58, train_loss: 0.5396, test_loss: 1.3278, test_f1: 0.6411
 epoch: 59, train_loss: 0.5273, test_loss: 1.2848, test_f1: 0.6203
 epoch: 60, train_loss: 0.5184, test_loss: 1.1932, test_f1: 0.6310
 epoch: 61, train_loss: 0.5178, test_loss: 1.2189, test_f1: 0.6289
 epoch: 62, train_loss: 0.5178, test_loss: 1.3574, test_f1: 0.6340
 epoch: 63, train_loss: 0.5008, test_loss: 1.4112, test_f1: 0.5856
 epoch: 64, train_loss: 0.5136, test_loss: 1.4630, test_f1: 0.6115
 epoch: 65, train_loss: 0.5196, test_loss: 1.3684, test_f1: 0.6110
 epoch: 66, train_loss: 0.4844, test_loss: 1.3914, test_f1: 0.6387
 epoch: 67, train_loss: 0.4892, test_loss: 1.2786, test_f1: 0.6244
 epoch: 68, train_loss: 0.4956, test_loss: 1.4967, test_f1: 0.5901
 epoch: 69, train_loss: 0.4931, test_loss: 1.3812, test_f1: 0.6249
 epoch: 70, train_loss: 0.4924, test_loss: 1.3512, test_f1: 0.6389
 epoch: 71, train_loss: 0.5018, test_loss: 1.3300, test_f1: 0.6368
 epoch: 72, train_loss: 0.4942, test_loss: 1.2634, test_f1: 0.6682
 epoch: 73, train_loss: 0.4824, test_loss: 1.3279, test_f1: 0.6307
 epoch: 74, train_loss: 0.4967, test_loss: 1.2938, test_f1: 0.6324
 epoch: 75, train_loss: 0.4689, test_loss: 1.3249, test_f1: 0.6427
 epoch: 76, train_loss: 0.4882, test_loss: 1.4394, test_f1: 0.5892
 epoch: 77, train_loss: 0.4768, test_loss: 1.4393, test_f1: 0.5927
 epoch: 78, train_loss: 0.4590, test_loss: 1.3308, test_f1: 0.6168
 epoch: 79, train_loss: 0.4571, test_loss: 1.2958, test_f1: 0.6430
 epoch: 80, train_loss: 0.4708, test_loss: 1.4133, test_f1: 0.6393
 epoch: 81, train_loss: 0.4733, test_loss: 1.5409, test_f1: 0.5566
 epoch: 82, train_loss: 0.4752, test_loss: 1.3970, test_f1: 0.6372
 epoch: 83, train_loss: 0.4839, test_loss: 1.3387, test_f1: 0.6299
 epoch: 84, train_loss: 0.4541, test_loss: 1.3481, test_f1: 0.6304
 epoch: 85, train_loss: 0.4549, test_loss: 1.4603, test_f1: 0.6175
 epoch: 86, train_loss: 0.4848, test_loss: 1.3486, test_f1: 0.6340
 epoch: 87, train_loss: 0.4432, test_loss: 1.3854, test_f1: 0.5869
 epoch: 88, train_loss: 0.4587, test_loss: 1.3284, test_f1: 0.6349
 epoch: 89, train_loss: 0.4688, test_loss: 1.3509, test_f1: 0.6569
 epoch: 90, train_loss: 0.4495, test_loss: 1.6559, test_f1: 0.5583
 epoch: 91, train_loss: 0.4885, test_loss: 1.3343, test_f1: 0.6284
 epoch: 92, train_loss: 0.4444, test_loss: 1.4107, test_f1: 0.6408
 epoch: 93, train_loss: 0.4535, test_loss: 1.4113, test_f1: 0.6201
 epoch: 94, train_loss: 0.4546, test_loss: 1.5002, test_f1: 0.6144
 epoch: 95, train_loss: 0.4561, test_loss: 1.4589, test_f1: 0.6281
 epoch: 96, train_loss: 0.4401, test_loss: 1.4826, test_f1: 0.6009
 epoch: 97, train_loss: 0.4658, test_loss: 1.3632, test_f1: 0.5968
 epoch: 98, train_loss: 0.4518, test_loss: 1.3675, test_f1: 0.6356
 epoch: 99, train_loss: 0.4206, test_loss: 1.4621, test_f1: 0.6015
##################ITERATION #4 ****************************************
 epoch: 0, train_loss: 1.1342, test_loss: 1.1908, test_f1: 0.3716
 epoch: 1, train_loss: 0.9411, test_loss: 1.0874, test_f1: 0.5141
 epoch: 2, train_loss: 0.9038, test_loss: 1.1105, test_f1: 0.4804
 epoch: 3, train_loss: 0.8728, test_loss: 1.2161, test_f1: 0.5222
 epoch: 4, train_loss: 0.8617, test_loss: 0.9712, test_f1: 0.5243
 epoch: 5, train_loss: 0.8432, test_loss: 1.0097, test_f1: 0.5297
 epoch: 6, train_loss: 0.7993, test_loss: 0.9810, test_f1: 0.5886
 epoch: 7, train_loss: 0.8113, test_loss: 1.5589, test_f1: 0.4159
 epoch: 8, train_loss: 0.7876, test_loss: 1.0395, test_f1: 0.5383
 epoch: 9, train_loss: 0.8149, test_loss: 0.9556, test_f1: 0.5505
 epoch: 10, train_loss: 0.7877, test_loss: 0.9854, test_f1: 0.5522
 epoch: 11, train_loss: 0.7798, test_loss: 1.1166, test_f1: 0.4762
 epoch: 12, train_loss: 0.7593, test_loss: 1.3556, test_f1: 0.5109
 epoch: 13, train_loss: 0.7249, test_loss: 1.0138, test_f1: 0.5725
 epoch: 14, train_loss: 0.7240, test_loss: 1.0114, test_f1: 0.5791
 epoch: 15, train_loss: 0.7565, test_loss: 0.9980, test_f1: 0.5900
 epoch: 16, train_loss: 0.7397, test_loss: 1.0501, test_f1: 0.5059
 epoch: 17, train_loss: 0.7128, test_loss: 1.5707, test_f1: 0.4749
 epoch: 18, train_loss: 0.7752, test_loss: 1.1449, test_f1: 0.5633
 epoch: 19, train_loss: 0.7286, test_loss: 1.0784, test_f1: 0.5044
 epoch: 20, train_loss: 0.7323, test_loss: 1.2635, test_f1: 0.5703
 epoch: 21, train_loss: 0.7152, test_loss: 0.9538, test_f1: 0.6554
 epoch: 22, train_loss: 0.7435, test_loss: 1.0354, test_f1: 0.5640
 epoch: 23, train_loss: 0.6993, test_loss: 1.5433, test_f1: 0.5210
 epoch: 24, train_loss: 0.6933, test_loss: 1.2993, test_f1: 0.4694
 epoch: 25, train_loss: 0.6664, test_loss: 1.3283, test_f1: 0.4895
 epoch: 26, train_loss: 0.6652, test_loss: 1.2370, test_f1: 0.4805
 epoch: 27, train_loss: 0.6566, test_loss: 1.2094, test_f1: 0.5824
 epoch: 28, train_loss: 0.6546, test_loss: 1.1227, test_f1: 0.5981
 epoch: 29, train_loss: 0.6308, test_loss: 1.0498, test_f1: 0.6025
 epoch: 30, train_loss: 0.6158, test_loss: 1.1152, test_f1: 0.5706
 epoch: 31, train_loss: 0.6455, test_loss: 1.1427, test_f1: 0.5571
 epoch: 32, train_loss: 0.6634, test_loss: 1.6306, test_f1: 0.4051
 epoch: 33, train_loss: 0.6341, test_loss: 0.9782, test_f1: 0.6317
 epoch: 34, train_loss: 0.6395, test_loss: 1.1142, test_f1: 0.5604
 epoch: 35, train_loss: 0.6353, test_loss: 1.3323, test_f1: 0.5205
 epoch: 36, train_loss: 0.6183, test_loss: 1.1002, test_f1: 0.5714
 epoch: 37, train_loss: 0.6638, test_loss: 1.1594, test_f1: 0.5147
 epoch: 38, train_loss: 0.6569, test_loss: 1.1257, test_f1: 0.5842
 epoch: 39, train_loss: 0.6189, test_loss: 1.0659, test_f1: 0.5621
 epoch: 40, train_loss: 0.6081, test_loss: 1.2078, test_f1: 0.5574
 epoch: 41, train_loss: 0.5744, test_loss: 1.1457, test_f1: 0.6258
 epoch: 42, train_loss: 0.5739, test_loss: 1.1514, test_f1: 0.6483
 epoch: 43, train_loss: 0.6002, test_loss: 1.5483, test_f1: 0.5482
 epoch: 44, train_loss: 0.5526, test_loss: 1.3500, test_f1: 0.6090
 epoch: 45, train_loss: 0.5642, test_loss: 1.2433, test_f1: 0.5856
 epoch: 46, train_loss: 0.5619, test_loss: 1.2505, test_f1: 0.5985
 epoch: 47, train_loss: 0.5923, test_loss: 1.0662, test_f1: 0.6204
 epoch: 48, train_loss: 0.5580, test_loss: 1.1417, test_f1: 0.6154
 epoch: 49, train_loss: 0.5639, test_loss: 1.2287, test_f1: 0.6228
 epoch: 50, train_loss: 0.5464, test_loss: 1.1493, test_f1: 0.6280
 epoch: 51, train_loss: 0.5332, test_loss: 1.1246, test_f1: 0.6604
 epoch: 52, train_loss: 0.5180, test_loss: 1.2493, test_f1: 0.5861
 epoch: 53, train_loss: 0.4695, test_loss: 1.3000, test_f1: 0.6241
 epoch: 54, train_loss: 0.4707, test_loss: 1.2595, test_f1: 0.6330
 epoch: 55, train_loss: 0.4448, test_loss: 1.2247, test_f1: 0.6328
 epoch: 56, train_loss: 0.4758, test_loss: 1.2315, test_f1: 0.6694
 epoch: 57, train_loss: 0.4416, test_loss: 1.4025, test_f1: 0.6398
 epoch: 58, train_loss: 0.4413, test_loss: 1.2286, test_f1: 0.6279
 epoch: 59, train_loss: 0.4446, test_loss: 1.2701, test_f1: 0.6397
 epoch: 60, train_loss: 0.4416, test_loss: 1.4854, test_f1: 0.5797
 epoch: 61, train_loss: 0.4346, test_loss: 1.3015, test_f1: 0.6501
 epoch: 62, train_loss: 0.4611, test_loss: 1.2888, test_f1: 0.6139
 epoch: 63, train_loss: 0.4946, test_loss: 1.4562, test_f1: 0.5704
 epoch: 64, train_loss: 0.4372, test_loss: 1.2859, test_f1: 0.6371
 epoch: 65, train_loss: 0.4240, test_loss: 1.4542, test_f1: 0.5993
 epoch: 66, train_loss: 0.4425, test_loss: 1.5690, test_f1: 0.5109
 epoch: 67, train_loss: 0.4579, test_loss: 1.3529, test_f1: 0.6082
 epoch: 68, train_loss: 0.4850, test_loss: 1.4466, test_f1: 0.5745
 epoch: 69, train_loss: 0.4451, test_loss: 1.3231, test_f1: 0.6451
 epoch: 70, train_loss: 0.4392, test_loss: 1.4247, test_f1: 0.6445
 epoch: 71, train_loss: 0.4134, test_loss: 1.4240, test_f1: 0.6316
 epoch: 72, train_loss: 0.3979, test_loss: 1.4033, test_f1: 0.6180
 epoch: 73, train_loss: 0.3987, test_loss: 1.5939, test_f1: 0.5980
 epoch: 74, train_loss: 0.4019, test_loss: 1.3416, test_f1: 0.5992
 epoch: 75, train_loss: 0.3970, test_loss: 1.4286, test_f1: 0.6371
 epoch: 76, train_loss: 0.4168, test_loss: 1.2754, test_f1: 0.6383
 epoch: 77, train_loss: 0.4066, test_loss: 1.4983, test_f1: 0.5695
 epoch: 78, train_loss: 0.4194, test_loss: 1.5213, test_f1: 0.5954
 epoch: 79, train_loss: 0.4533, test_loss: 1.3267, test_f1: 0.6290
 epoch: 80, train_loss: 0.4070, test_loss: 1.5349, test_f1: 0.6125
 epoch: 81, train_loss: 0.4011, test_loss: 1.3899, test_f1: 0.6337
 epoch: 82, train_loss: 0.3992, test_loss: 1.6193, test_f1: 0.6069
 epoch: 83, train_loss: 0.4029, test_loss: 1.5454, test_f1: 0.6048
 epoch: 84, train_loss: 0.3802, test_loss: 1.3218, test_f1: 0.6511
 epoch: 85, train_loss: 0.3766, test_loss: 1.4809, test_f1: 0.6164
 epoch: 86, train_loss: 0.4209, test_loss: 1.3760, test_f1: 0.6050
 epoch: 87, train_loss: 0.4276, test_loss: 1.3879, test_f1: 0.5944
 epoch: 88, train_loss: 0.3941, test_loss: 1.4423, test_f1: 0.5866
 epoch: 89, train_loss: 0.3714, test_loss: 1.4518, test_f1: 0.6161
 epoch: 90, train_loss: 0.3660, test_loss: 1.4495, test_f1: 0.6150
 epoch: 91, train_loss: 0.3940, test_loss: 1.5906, test_f1: 0.5889
 epoch: 92, train_loss: 0.4013, test_loss: 1.4390, test_f1: 0.6246
 epoch: 93, train_loss: 0.3982, test_loss: 1.3287, test_f1: 0.6567
 epoch: 94, train_loss: 0.3577, test_loss: 1.5617, test_f1: 0.6245
 epoch: 95, train_loss: 0.3950, test_loss: 1.5143, test_f1: 0.6266
 epoch: 96, train_loss: 0.3953, test_loss: 1.4497, test_f1: 0.6256
 epoch: 97, train_loss: 0.3824, test_loss: 1.6705, test_f1: 0.5695
 epoch: 98, train_loss: 0.3443, test_loss: 1.4197, test_f1: 0.6450
 epoch: 99, train_loss: 0.3596, test_loss: 1.2843, test_f1: 0.6545
##################ITERATION #5 ****************************************
 epoch: 0, train_loss: 1.1619, test_loss: 1.7035, test_f1: 0.3231
 epoch: 1, train_loss: 1.0093, test_loss: 1.2022, test_f1: 0.4114
 epoch: 2, train_loss: 0.9466, test_loss: 1.0997, test_f1: 0.4815
 epoch: 3, train_loss: 0.9243, test_loss: 1.0724, test_f1: 0.4890
 epoch: 4, train_loss: 0.9005, test_loss: 1.0255, test_f1: 0.5611
 epoch: 5, train_loss: 0.8685, test_loss: 1.0923, test_f1: 0.5197
 epoch: 6, train_loss: 0.8360, test_loss: 1.2017, test_f1: 0.5247
 epoch: 7, train_loss: 0.8255, test_loss: 1.4380, test_f1: 0.3934
 epoch: 8, train_loss: 0.8092, test_loss: 2.0110, test_f1: 0.3275
 epoch: 9, train_loss: 0.8077, test_loss: 1.0920, test_f1: 0.4467
 epoch: 10, train_loss: 0.8061, test_loss: 1.1506, test_f1: 0.5018
 epoch: 11, train_loss: 0.8042, test_loss: 1.1847, test_f1: 0.4917
 epoch: 12, train_loss: 0.7919, test_loss: 1.1410, test_f1: 0.4865
 epoch: 13, train_loss: 0.7626, test_loss: 1.5397, test_f1: 0.3873
 epoch: 14, train_loss: 0.7622, test_loss: 1.2075, test_f1: 0.5093
 epoch: 15, train_loss: 0.7576, test_loss: 1.1714, test_f1: 0.4515
 epoch: 16, train_loss: 0.7612, test_loss: 1.0981, test_f1: 0.5721
 epoch: 17, train_loss: 0.6997, test_loss: 1.1895, test_f1: 0.5030
 epoch: 18, train_loss: 0.7460, test_loss: 1.2295, test_f1: 0.5115
 epoch: 19, train_loss: 0.7269, test_loss: 1.1894, test_f1: 0.5732
 epoch: 20, train_loss: 0.7284, test_loss: 1.1338, test_f1: 0.5684
 epoch: 21, train_loss: 0.7494, test_loss: 1.1760, test_f1: 0.5547
 epoch: 22, train_loss: 0.6954, test_loss: 1.1028, test_f1: 0.5532
 epoch: 23, train_loss: 0.6853, test_loss: 1.1850, test_f1: 0.5623
 epoch: 24, train_loss: 0.7074, test_loss: 1.1525, test_f1: 0.5481
 epoch: 25, train_loss: 0.6918, test_loss: 1.1093, test_f1: 0.5586
 epoch: 26, train_loss: 0.7048, test_loss: 1.1025, test_f1: 0.5581
 epoch: 27, train_loss: 0.7107, test_loss: 1.2596, test_f1: 0.5067
 epoch: 28, train_loss: 0.6921, test_loss: 1.0306, test_f1: 0.6013
 epoch: 29, train_loss: 0.7015, test_loss: 1.1024, test_f1: 0.5682
 epoch: 30, train_loss: 0.6737, test_loss: 1.2725, test_f1: 0.5761
 epoch: 31, train_loss: 0.6329, test_loss: 1.4242, test_f1: 0.5434
 epoch: 32, train_loss: 0.7093, test_loss: 1.1440, test_f1: 0.5151
 epoch: 33, train_loss: 0.6786, test_loss: 1.4468, test_f1: 0.5269
 epoch: 34, train_loss: 0.6512, test_loss: 1.2041, test_f1: 0.5589
 epoch: 35, train_loss: 0.6651, test_loss: 1.4219, test_f1: 0.5322
 epoch: 36, train_loss: 0.6382, test_loss: 1.0989, test_f1: 0.5681
 epoch: 37, train_loss: 0.6459, test_loss: 1.5160, test_f1: 0.5197
 epoch: 38, train_loss: 0.6201, test_loss: 1.2626, test_f1: 0.5232
 epoch: 39, train_loss: 0.5933, test_loss: 1.5491, test_f1: 0.6064
 epoch: 40, train_loss: 0.6075, test_loss: 1.3005, test_f1: 0.5318
 epoch: 41, train_loss: 0.6402, test_loss: 1.5293, test_f1: 0.5557
 epoch: 42, train_loss: 0.6322, test_loss: 1.1194, test_f1: 0.6354
 epoch: 43, train_loss: 0.5972, test_loss: 1.2643, test_f1: 0.5771
 epoch: 44, train_loss: 0.6088, test_loss: 1.2667, test_f1: 0.4979
 epoch: 45, train_loss: 0.6578, test_loss: 1.1837, test_f1: 0.5146
 epoch: 46, train_loss: 0.5805, test_loss: 1.3459, test_f1: 0.6053
 epoch: 47, train_loss: 0.6082, test_loss: 1.0939, test_f1: 0.6505
 epoch: 48, train_loss: 0.6189, test_loss: 1.1268, test_f1: 0.6099
 epoch: 49, train_loss: 0.5837, test_loss: 1.3546, test_f1: 0.5700
 epoch: 50, train_loss: 0.5914, test_loss: 1.5320, test_f1: 0.5648
 epoch: 51, train_loss: 0.5409, test_loss: 1.1496, test_f1: 0.5997
 epoch: 52, train_loss: 0.5154, test_loss: 1.1480, test_f1: 0.6301
 epoch: 53, train_loss: 0.4828, test_loss: 1.2833, test_f1: 0.6090
 epoch: 54, train_loss: 0.5212, test_loss: 1.2044, test_f1: 0.6157
 epoch: 55, train_loss: 0.5035, test_loss: 1.3859, test_f1: 0.5814
 epoch: 56, train_loss: 0.5032, test_loss: 1.2576, test_f1: 0.6054
 epoch: 57, train_loss: 0.5032, test_loss: 1.2461, test_f1: 0.6466
 epoch: 58, train_loss: 0.4459, test_loss: 1.3000, test_f1: 0.6315
 epoch: 59, train_loss: 0.4864, test_loss: 1.2980, test_f1: 0.5851
 epoch: 60, train_loss: 0.4760, test_loss: 1.4803, test_f1: 0.6013
 epoch: 61, train_loss: 0.4858, test_loss: 1.2499, test_f1: 0.6392
 epoch: 62, train_loss: 0.4594, test_loss: 1.2761, test_f1: 0.6281
 epoch: 63, train_loss: 0.4606, test_loss: 1.2569, test_f1: 0.6407
 epoch: 64, train_loss: 0.4578, test_loss: 1.4039, test_f1: 0.6506
 epoch: 65, train_loss: 0.4594, test_loss: 1.4901, test_f1: 0.6300
 epoch: 66, train_loss: 0.4507, test_loss: 1.4194, test_f1: 0.6064
 epoch: 67, train_loss: 0.4393, test_loss: 1.3194, test_f1: 0.6494
 epoch: 68, train_loss: 0.4206, test_loss: 1.5797, test_f1: 0.6147
 epoch: 69, train_loss: 0.4542, test_loss: 1.4639, test_f1: 0.6218
 epoch: 70, train_loss: 0.4304, test_loss: 1.4033, test_f1: 0.5423
 epoch: 71, train_loss: 0.4203, test_loss: 1.4418, test_f1: 0.6501
 epoch: 72, train_loss: 0.4728, test_loss: 1.6362, test_f1: 0.6074
 epoch: 73, train_loss: 0.4460, test_loss: 1.3687, test_f1: 0.6543
 epoch: 74, train_loss: 0.4487, test_loss: 1.8887, test_f1: 0.5600
 epoch: 75, train_loss: 0.4140, test_loss: 1.4720, test_f1: 0.6089
 epoch: 76, train_loss: 0.4313, test_loss: 1.3598, test_f1: 0.6104
 epoch: 77, train_loss: 0.4007, test_loss: 1.4019, test_f1: 0.6746
 epoch: 78, train_loss: 0.4199, test_loss: 1.4542, test_f1: 0.5795
 epoch: 79, train_loss: 0.4441, test_loss: 1.4311, test_f1: 0.6008
 epoch: 80, train_loss: 0.4170, test_loss: 1.4941, test_f1: 0.5961
 epoch: 81, train_loss: 0.4138, test_loss: 1.4246, test_f1: 0.6244
 epoch: 82, train_loss: 0.3959, test_loss: 1.6643, test_f1: 0.5700
 epoch: 83, train_loss: 0.4049, test_loss: 1.6163, test_f1: 0.6029
 epoch: 84, train_loss: 0.4133, test_loss: 1.7943, test_f1: 0.5574
 epoch: 85, train_loss: 0.4271, test_loss: 1.2326, test_f1: 0.6220
 epoch: 86, train_loss: 0.4105, test_loss: 1.5345, test_f1: 0.5506
 epoch: 87, train_loss: 0.3993, test_loss: 1.7516, test_f1: 0.5944
 epoch: 88, train_loss: 0.3954, test_loss: 1.5889, test_f1: 0.6129
 epoch: 89, train_loss: 0.4228, test_loss: 1.3961, test_f1: 0.6375
 epoch: 90, train_loss: 0.4237, test_loss: 1.6031, test_f1: 0.6030
 epoch: 91, train_loss: 0.3680, test_loss: 1.8014, test_f1: 0.5745
 epoch: 92, train_loss: 0.3919, test_loss: 1.4236, test_f1: 0.6384
 epoch: 93, train_loss: 0.3913, test_loss: 1.4214, test_f1: 0.5836
 epoch: 94, train_loss: 0.3948, test_loss: 1.7563, test_f1: 0.5988
 epoch: 95, train_loss: 0.4000, test_loss: 1.5020, test_f1: 0.6159
 epoch: 96, train_loss: 0.3786, test_loss: 1.5367, test_f1: 0.5885
 epoch: 97, train_loss: 0.3912, test_loss: 1.5149, test_f1: 0.6037
 epoch: 98, train_loss: 0.3911, test_loss: 1.3685, test_f1: 0.6268
 epoch: 99, train_loss: 0.3919, test_loss: 1.5709, test_f1: 0.5774
##################ITERATION #6 ****************************************
 epoch: 0, train_loss: 1.1706, test_loss: 1.2578, test_f1: 0.3733
 epoch: 1, train_loss: 1.0374, test_loss: 1.4055, test_f1: 0.3042
 epoch: 2, train_loss: 0.9483, test_loss: 1.0379, test_f1: 0.4873
 epoch: 3, train_loss: 0.9274, test_loss: 1.0782, test_f1: 0.5021
 epoch: 4, train_loss: 0.9118, test_loss: 1.0743, test_f1: 0.4056
 epoch: 5, train_loss: 0.8653, test_loss: 1.1239, test_f1: 0.5396
 epoch: 6, train_loss: 0.8516, test_loss: 1.0398, test_f1: 0.5984
 epoch: 7, train_loss: 0.8490, test_loss: 1.5474, test_f1: 0.4425
 epoch: 8, train_loss: 0.8587, test_loss: 1.6591, test_f1: 0.4715
 epoch: 9, train_loss: 0.8360, test_loss: 1.0336, test_f1: 0.5150
 epoch: 10, train_loss: 0.8353, test_loss: 1.0443, test_f1: 0.5589
 epoch: 11, train_loss: 0.7913, test_loss: 1.0497, test_f1: 0.5196
 epoch: 12, train_loss: 0.7957, test_loss: 1.4043, test_f1: 0.4889
 epoch: 13, train_loss: 0.7694, test_loss: 1.0163, test_f1: 0.5619
 epoch: 14, train_loss: 0.7779, test_loss: 1.4290, test_f1: 0.4903
 epoch: 15, train_loss: 0.7663, test_loss: 1.0133, test_f1: 0.6441
 epoch: 16, train_loss: 0.7584, test_loss: 1.2384, test_f1: 0.5193
 epoch: 17, train_loss: 0.7830, test_loss: 1.3094, test_f1: 0.5204
 epoch: 18, train_loss: 0.7359, test_loss: 1.2552, test_f1: 0.5066
 epoch: 19, train_loss: 0.7430, test_loss: 1.1007, test_f1: 0.5829
 epoch: 20, train_loss: 0.7542, test_loss: 1.1375, test_f1: 0.5394
 epoch: 21, train_loss: 0.7235, test_loss: 1.0751, test_f1: 0.6086
 epoch: 22, train_loss: 0.7273, test_loss: 1.1147, test_f1: 0.5723
 epoch: 23, train_loss: 0.7255, test_loss: 1.2446, test_f1: 0.5521
 epoch: 24, train_loss: 0.7197, test_loss: 1.0689, test_f1: 0.6204
 epoch: 25, train_loss: 0.7252, test_loss: 1.3123, test_f1: 0.4881
 epoch: 26, train_loss: 0.7039, test_loss: 1.0735, test_f1: 0.5682
 epoch: 27, train_loss: 0.7044, test_loss: 1.1844, test_f1: 0.5267
 epoch: 28, train_loss: 0.7383, test_loss: 1.2897, test_f1: 0.5239
 epoch: 29, train_loss: 0.7696, test_loss: 1.2465, test_f1: 0.5368
 epoch: 30, train_loss: 0.7255, test_loss: 1.4762, test_f1: 0.4980
 epoch: 31, train_loss: 0.7256, test_loss: 1.1805, test_f1: 0.5309
 epoch: 32, train_loss: 0.6632, test_loss: 1.0680, test_f1: 0.5968
 epoch: 33, train_loss: 0.6881, test_loss: 1.1038, test_f1: 0.5607
 epoch: 34, train_loss: 0.6686, test_loss: 1.1465, test_f1: 0.5894
 epoch: 35, train_loss: 0.6645, test_loss: 1.0363, test_f1: 0.6431
 epoch: 36, train_loss: 0.6490, test_loss: 1.1406, test_f1: 0.5788
 epoch: 37, train_loss: 0.6878, test_loss: 1.1187, test_f1: 0.5933
 epoch: 38, train_loss: 0.6690, test_loss: 1.1789, test_f1: 0.6142
 epoch: 39, train_loss: 0.6653, test_loss: 1.4830, test_f1: 0.4906
 epoch: 40, train_loss: 0.6643, test_loss: 1.1210, test_f1: 0.6102
 epoch: 41, train_loss: 0.6408, test_loss: 1.0619, test_f1: 0.6186
 epoch: 42, train_loss: 0.6279, test_loss: 1.3477, test_f1: 0.5278
 epoch: 43, train_loss: 0.6383, test_loss: 1.2856, test_f1: 0.5861
 epoch: 44, train_loss: 0.6120, test_loss: 1.4903, test_f1: 0.5246
 epoch: 45, train_loss: 0.6260, test_loss: 1.3836, test_f1: 0.4910
 epoch: 46, train_loss: 0.6461, test_loss: 1.0109, test_f1: 0.6855
 epoch: 47, train_loss: 0.6174, test_loss: 1.1242, test_f1: 0.6165
 epoch: 48, train_loss: 0.6186, test_loss: 1.4876, test_f1: 0.5232
 epoch: 49, train_loss: 0.6324, test_loss: 1.4023, test_f1: 0.5752
 epoch: 50, train_loss: 0.6115, test_loss: 1.1351, test_f1: 0.5905
 epoch: 51, train_loss: 0.6305, test_loss: 1.1375, test_f1: 0.6199
 epoch: 52, train_loss: 0.5783, test_loss: 1.2211, test_f1: 0.6475
 epoch: 53, train_loss: 0.5420, test_loss: 1.1214, test_f1: 0.6011
 epoch: 54, train_loss: 0.5306, test_loss: 1.3993, test_f1: 0.6000
 epoch: 55, train_loss: 0.5451, test_loss: 1.1211, test_f1: 0.6261
 epoch: 56, train_loss: 0.5577, test_loss: 1.2509, test_f1: 0.6390
 epoch: 57, train_loss: 0.5235, test_loss: 1.1521, test_f1: 0.6410
 epoch: 58, train_loss: 0.5220, test_loss: 1.2888, test_f1: 0.6711
 epoch: 59, train_loss: 0.5139, test_loss: 1.1614, test_f1: 0.5706
 epoch: 60, train_loss: 0.5200, test_loss: 1.2076, test_f1: 0.6401
 epoch: 61, train_loss: 0.5348, test_loss: 1.2699, test_f1: 0.6072
 epoch: 62, train_loss: 0.4983, test_loss: 1.5293, test_f1: 0.5929
 epoch: 63, train_loss: 0.5103, test_loss: 1.3438, test_f1: 0.6036
 epoch: 64, train_loss: 0.5148, test_loss: 1.2928, test_f1: 0.5948
 epoch: 65, train_loss: 0.5308, test_loss: 1.1323, test_f1: 0.6430
 epoch: 66, train_loss: 0.5343, test_loss: 1.2719, test_f1: 0.6145
 epoch: 67, train_loss: 0.4956, test_loss: 1.5611, test_f1: 0.6114
 epoch: 68, train_loss: 0.4875, test_loss: 1.3610, test_f1: 0.6003
 epoch: 69, train_loss: 0.4866, test_loss: 1.7643, test_f1: 0.5716
 epoch: 70, train_loss: 0.5093, test_loss: 1.2636, test_f1: 0.6161
 epoch: 71, train_loss: 0.5264, test_loss: 1.2438, test_f1: 0.6297
 epoch: 72, train_loss: 0.5238, test_loss: 1.4433, test_f1: 0.5834
 epoch: 73, train_loss: 0.5054, test_loss: 1.4981, test_f1: 0.6312
 epoch: 74, train_loss: 0.5297, test_loss: 1.3000, test_f1: 0.5935
 epoch: 75, train_loss: 0.5266, test_loss: 1.2701, test_f1: 0.6238
 epoch: 76, train_loss: 0.4818, test_loss: 1.3520, test_f1: 0.6198
 epoch: 77, train_loss: 0.4827, test_loss: 1.3325, test_f1: 0.6294
 epoch: 78, train_loss: 0.5178, test_loss: 1.2843, test_f1: 0.6455
 epoch: 79, train_loss: 0.4678, test_loss: 1.5399, test_f1: 0.5902
 epoch: 80, train_loss: 0.4951, test_loss: 1.3759, test_f1: 0.6044
 epoch: 81, train_loss: 0.4473, test_loss: 1.3482, test_f1: 0.5925
 epoch: 82, train_loss: 0.4745, test_loss: 1.4293, test_f1: 0.6137
 epoch: 83, train_loss: 0.4886, test_loss: 1.3432, test_f1: 0.6182
 epoch: 84, train_loss: 0.4833, test_loss: 1.4064, test_f1: 0.5999
 epoch: 85, train_loss: 0.4823, test_loss: 1.6360, test_f1: 0.5674
 epoch: 86, train_loss: 0.4930, test_loss: 1.2173, test_f1: 0.5884
 epoch: 87, train_loss: 0.4818, test_loss: 1.3252, test_f1: 0.5888
 epoch: 88, train_loss: 0.4473, test_loss: 1.3915, test_f1: 0.6161
 epoch: 89, train_loss: 0.4512, test_loss: 1.6114, test_f1: 0.5495
 epoch: 90, train_loss: 0.4464, test_loss: 1.2640, test_f1: 0.6522
 epoch: 91, train_loss: 0.4544, test_loss: 1.4097, test_f1: 0.6035
 epoch: 92, train_loss: 0.4480, test_loss: 1.5145, test_f1: 0.6005
 epoch: 93, train_loss: 0.4288, test_loss: 1.5156, test_f1: 0.6305
 epoch: 94, train_loss: 0.4813, test_loss: 1.4373, test_f1: 0.6336
 epoch: 95, train_loss: 0.4541, test_loss: 1.6622, test_f1: 0.5774
 epoch: 96, train_loss: 0.4647, test_loss: 1.5721, test_f1: 0.6169
 epoch: 97, train_loss: 0.4959, test_loss: 1.3637, test_f1: 0.5738
 epoch: 98, train_loss: 0.4443, test_loss: 1.2655, test_f1: 0.5852
 epoch: 99, train_loss: 0.4653, test_loss: 1.3978, test_f1: 0.6093
##################ITERATION #7 ****************************************
 epoch: 0, train_loss: 1.1857, test_loss: 1.2676, test_f1: 0.3794
 epoch: 1, train_loss: 0.9663, test_loss: 1.0523, test_f1: 0.5228
 epoch: 2, train_loss: 0.9470, test_loss: 1.0756, test_f1: 0.5294
 epoch: 3, train_loss: 0.9232, test_loss: 1.0235, test_f1: 0.5457
 epoch: 4, train_loss: 0.8749, test_loss: 1.0374, test_f1: 0.5482
 epoch: 5, train_loss: 0.8886, test_loss: 1.0496, test_f1: 0.5086
 epoch: 6, train_loss: 0.8603, test_loss: 1.0473, test_f1: 0.5457
 epoch: 7, train_loss: 0.8129, test_loss: 1.3674, test_f1: 0.3927
 epoch: 8, train_loss: 0.8436, test_loss: 1.2808, test_f1: 0.4600
 epoch: 9, train_loss: 0.8027, test_loss: 1.0196, test_f1: 0.5393
 epoch: 10, train_loss: 0.7904, test_loss: 1.0744, test_f1: 0.5345
 epoch: 11, train_loss: 0.7761, test_loss: 0.9324, test_f1: 0.6314
 epoch: 12, train_loss: 0.7544, test_loss: 1.0492, test_f1: 0.5070
 epoch: 13, train_loss: 0.7790, test_loss: 1.3009, test_f1: 0.4885
 epoch: 14, train_loss: 0.7331, test_loss: 1.4127, test_f1: 0.3982
 epoch: 15, train_loss: 0.7685, test_loss: 1.3681, test_f1: 0.4560
 epoch: 16, train_loss: 0.7935, test_loss: 1.2098, test_f1: 0.5097
 epoch: 17, train_loss: 0.7339, test_loss: 1.0045, test_f1: 0.5800
 epoch: 18, train_loss: 0.7404, test_loss: 1.0526, test_f1: 0.6168
 epoch: 19, train_loss: 0.7353, test_loss: 1.1077, test_f1: 0.5157
 epoch: 20, train_loss: 0.7298, test_loss: 1.4526, test_f1: 0.4681
 epoch: 21, train_loss: 0.7232, test_loss: 1.2203, test_f1: 0.5012
 epoch: 22, train_loss: 0.7229, test_loss: 1.2041, test_f1: 0.4949
 epoch: 23, train_loss: 0.7065, test_loss: 1.1044, test_f1: 0.5546
 epoch: 24, train_loss: 0.7056, test_loss: 1.2447, test_f1: 0.5215
 epoch: 25, train_loss: 0.7112, test_loss: 1.1016, test_f1: 0.5590
 epoch: 26, train_loss: 0.6824, test_loss: 1.1166, test_f1: 0.5513
 epoch: 27, train_loss: 0.7019, test_loss: 1.0280, test_f1: 0.5627
 epoch: 28, train_loss: 0.6672, test_loss: 1.0721, test_f1: 0.5279
 epoch: 29, train_loss: 0.6640, test_loss: 1.2595, test_f1: 0.5044
 epoch: 30, train_loss: 0.6540, test_loss: 1.2206, test_f1: 0.4893
 epoch: 31, train_loss: 0.6658, test_loss: 1.3257, test_f1: 0.5600
 epoch: 32, train_loss: 0.6747, test_loss: 1.2134, test_f1: 0.5896
 epoch: 33, train_loss: 0.6675, test_loss: 1.0541, test_f1: 0.5563
 epoch: 34, train_loss: 0.6681, test_loss: 0.9674, test_f1: 0.5965
 epoch: 35, train_loss: 0.6368, test_loss: 1.0847, test_f1: 0.6182
 epoch: 36, train_loss: 0.6436, test_loss: 1.2373, test_f1: 0.5021
 epoch: 37, train_loss: 0.6551, test_loss: 1.2231, test_f1: 0.5785
 epoch: 38, train_loss: 0.6347, test_loss: 1.2995, test_f1: 0.5079
 epoch: 39, train_loss: 0.6358, test_loss: 1.2109, test_f1: 0.5127
 epoch: 40, train_loss: 0.6518, test_loss: 1.0985, test_f1: 0.5904
 epoch: 41, train_loss: 0.6107, test_loss: 1.0582, test_f1: 0.5704
 epoch: 42, train_loss: 0.6151, test_loss: 1.2397, test_f1: 0.5549
 epoch: 43, train_loss: 0.6026, test_loss: 1.3181, test_f1: 0.5798
 epoch: 44, train_loss: 0.6114, test_loss: 1.0704, test_f1: 0.5689
 epoch: 45, train_loss: 0.6207, test_loss: 1.4019, test_f1: 0.5746
 epoch: 46, train_loss: 0.5908, test_loss: 1.4517, test_f1: 0.5244
 epoch: 47, train_loss: 0.6029, test_loss: 1.2949, test_f1: 0.5356
 epoch: 48, train_loss: 0.6228, test_loss: 1.4570, test_f1: 0.5235
 epoch: 49, train_loss: 0.5967, test_loss: 1.2562, test_f1: 0.4993
 epoch: 50, train_loss: 0.6149, test_loss: 1.1096, test_f1: 0.5803
 epoch: 51, train_loss: 0.5604, test_loss: 1.4417, test_f1: 0.4943
 epoch: 52, train_loss: 0.5668, test_loss: 1.1740, test_f1: 0.5707
 epoch: 53, train_loss: 0.5175, test_loss: 1.2567, test_f1: 0.6036
 epoch: 54, train_loss: 0.5123, test_loss: 1.2638, test_f1: 0.6043
 epoch: 55, train_loss: 0.4825, test_loss: 1.2202, test_f1: 0.6177
 epoch: 56, train_loss: 0.4776, test_loss: 1.2311, test_f1: 0.5951
 epoch: 57, train_loss: 0.5261, test_loss: 1.3964, test_f1: 0.5169
 epoch: 58, train_loss: 0.5129, test_loss: 1.2563, test_f1: 0.6033
 epoch: 59, train_loss: 0.5018, test_loss: 1.3759, test_f1: 0.5436
 epoch: 60, train_loss: 0.5424, test_loss: 1.2523, test_f1: 0.6025
 epoch: 61, train_loss: 0.5343, test_loss: 1.2301, test_f1: 0.6376
 epoch: 62, train_loss: 0.4956, test_loss: 1.3602, test_f1: 0.5908
 epoch: 63, train_loss: 0.4889, test_loss: 1.2382, test_f1: 0.5946
 epoch: 64, train_loss: 0.4862, test_loss: 1.2031, test_f1: 0.6269
 epoch: 65, train_loss: 0.4706, test_loss: 1.2842, test_f1: 0.5966
 epoch: 66, train_loss: 0.4647, test_loss: 1.5754, test_f1: 0.5520
 epoch: 67, train_loss: 0.4547, test_loss: 1.5783, test_f1: 0.5400
 epoch: 68, train_loss: 0.4536, test_loss: 1.3587, test_f1: 0.5930
 epoch: 69, train_loss: 0.4537, test_loss: 1.5070, test_f1: 0.6167
 epoch: 70, train_loss: 0.4639, test_loss: 1.2947, test_f1: 0.5614
 epoch: 71, train_loss: 0.4730, test_loss: 1.3958, test_f1: 0.6035
 epoch: 72, train_loss: 0.4538, test_loss: 1.5114, test_f1: 0.5907
 epoch: 73, train_loss: 0.4625, test_loss: 1.4485, test_f1: 0.5871
 epoch: 74, train_loss: 0.5016, test_loss: 1.3222, test_f1: 0.6001
 epoch: 75, train_loss: 0.4677, test_loss: 1.3387, test_f1: 0.6366
 epoch: 76, train_loss: 0.4490, test_loss: 1.3866, test_f1: 0.6211
 epoch: 77, train_loss: 0.4521, test_loss: 1.4786, test_f1: 0.5572
 epoch: 78, train_loss: 0.4799, test_loss: 1.5811, test_f1: 0.5572
 epoch: 79, train_loss: 0.4895, test_loss: 1.5217, test_f1: 0.5829
 epoch: 80, train_loss: 0.4744, test_loss: 1.5120, test_f1: 0.5125
 epoch: 81, train_loss: 0.4280, test_loss: 1.3975, test_f1: 0.5963
 epoch: 82, train_loss: 0.4574, test_loss: 1.4447, test_f1: 0.5933
 epoch: 83, train_loss: 0.4384, test_loss: 1.4502, test_f1: 0.5873
 epoch: 84, train_loss: 0.4365, test_loss: 1.3809, test_f1: 0.6412
 epoch: 85, train_loss: 0.4275, test_loss: 1.5351, test_f1: 0.5932
 epoch: 86, train_loss: 0.4422, test_loss: 1.5440, test_f1: 0.6057
 epoch: 87, train_loss: 0.4468, test_loss: 1.3278, test_f1: 0.6276
 epoch: 88, train_loss: 0.4373, test_loss: 1.6219, test_f1: 0.5681
 epoch: 89, train_loss: 0.4408, test_loss: 1.5515, test_f1: 0.5827
 epoch: 90, train_loss: 0.4064, test_loss: 1.4349, test_f1: 0.6084
 epoch: 91, train_loss: 0.4023, test_loss: 1.5627, test_f1: 0.5730
 epoch: 92, train_loss: 0.4202, test_loss: 1.4252, test_f1: 0.6164
 epoch: 93, train_loss: 0.4238, test_loss: 1.4330, test_f1: 0.6243
 epoch: 94, train_loss: 0.4175, test_loss: 1.4532, test_f1: 0.6107
 epoch: 95, train_loss: 0.4037, test_loss: 1.3140, test_f1: 0.6093
 epoch: 96, train_loss: 0.4179, test_loss: 2.0480, test_f1: 0.5790
 epoch: 97, train_loss: 0.3944, test_loss: 1.6053, test_f1: 0.5852
 epoch: 98, train_loss: 0.3997, test_loss: 1.3120, test_f1: 0.6546
 epoch: 99, train_loss: 0.3993, test_loss: 1.4095, test_f1: 0.5879
##################ITERATION #8 ****************************************
 epoch: 0, train_loss: 1.1474, test_loss: 1.3841, test_f1: 0.1915
 epoch: 1, train_loss: 0.9845, test_loss: 1.1032, test_f1: 0.4411
 epoch: 2, train_loss: 0.9471, test_loss: 1.0300, test_f1: 0.5188
 epoch: 3, train_loss: 0.9030, test_loss: 1.0258, test_f1: 0.5815
 epoch: 4, train_loss: 0.8634, test_loss: 1.0094, test_f1: 0.5187
 epoch: 5, train_loss: 0.8555, test_loss: 1.0648, test_f1: 0.5045
 epoch: 6, train_loss: 0.8373, test_loss: 1.1719, test_f1: 0.4232
 epoch: 7, train_loss: 0.8422, test_loss: 1.0006, test_f1: 0.5791
 epoch: 8, train_loss: 0.8317, test_loss: 1.0187, test_f1: 0.5594
 epoch: 9, train_loss: 0.7995, test_loss: 1.1500, test_f1: 0.5442
 epoch: 10, train_loss: 0.7935, test_loss: 1.0848, test_f1: 0.5252
 epoch: 11, train_loss: 0.7756, test_loss: 1.0547, test_f1: 0.5432
 epoch: 12, train_loss: 0.7638, test_loss: 1.0443, test_f1: 0.6029
 epoch: 13, train_loss: 0.7609, test_loss: 1.0526, test_f1: 0.5016
 epoch: 14, train_loss: 0.7449, test_loss: 1.3425, test_f1: 0.5504
 epoch: 15, train_loss: 0.7187, test_loss: 1.2573, test_f1: 0.5157
 epoch: 16, train_loss: 0.7221, test_loss: 1.0234, test_f1: 0.5946
 epoch: 17, train_loss: 0.6876, test_loss: 1.1627, test_f1: 0.5793
 epoch: 18, train_loss: 0.7228, test_loss: 1.3112, test_f1: 0.4918
 epoch: 19, train_loss: 0.7253, test_loss: 1.0352, test_f1: 0.5661
 epoch: 20, train_loss: 0.6986, test_loss: 1.0069, test_f1: 0.6002
 epoch: 21, train_loss: 0.7110, test_loss: 1.2458, test_f1: 0.4309
 epoch: 22, train_loss: 0.7163, test_loss: 0.9716, test_f1: 0.5951
 epoch: 23, train_loss: 0.7110, test_loss: 1.0916, test_f1: 0.5211
 epoch: 24, train_loss: 0.6976, test_loss: 1.2557, test_f1: 0.5568
 epoch: 25, train_loss: 0.7067, test_loss: 0.9579, test_f1: 0.6549
 epoch: 26, train_loss: 0.7175, test_loss: 1.1658, test_f1: 0.5671
 epoch: 27, train_loss: 0.6592, test_loss: 0.9970, test_f1: 0.6109
 epoch: 28, train_loss: 0.6544, test_loss: 1.2719, test_f1: 0.5983
 epoch: 29, train_loss: 0.6885, test_loss: 1.1097, test_f1: 0.6068
 epoch: 30, train_loss: 0.6439, test_loss: 1.0777, test_f1: 0.6104
 epoch: 31, train_loss: 0.6850, test_loss: 0.9906, test_f1: 0.6183
 epoch: 32, train_loss: 0.6410, test_loss: 1.0231, test_f1: 0.6436
 epoch: 33, train_loss: 0.6411, test_loss: 1.3201, test_f1: 0.5632
 epoch: 34, train_loss: 0.6138, test_loss: 1.3081, test_f1: 0.5471
 epoch: 35, train_loss: 0.6290, test_loss: 1.1255, test_f1: 0.5535
 epoch: 36, train_loss: 0.6195, test_loss: 1.3184, test_f1: 0.5127
 epoch: 37, train_loss: 0.6316, test_loss: 2.2876, test_f1: 0.4690
 epoch: 38, train_loss: 0.6735, test_loss: 1.5911, test_f1: 0.4506
 epoch: 39, train_loss: 0.6528, test_loss: 1.3510, test_f1: 0.5340
 epoch: 40, train_loss: 0.6151, test_loss: 1.6617, test_f1: 0.4393
 epoch: 41, train_loss: 0.6372, test_loss: 1.2903, test_f1: 0.4771
 epoch: 42, train_loss: 0.6048, test_loss: 1.6922, test_f1: 0.5595
 epoch: 43, train_loss: 0.5956, test_loss: 1.2941, test_f1: 0.5219
 epoch: 44, train_loss: 0.6414, test_loss: 1.1252, test_f1: 0.6265
 epoch: 45, train_loss: 0.6004, test_loss: 1.1781, test_f1: 0.5437
 epoch: 46, train_loss: 0.6231, test_loss: 1.9074, test_f1: 0.4684
 epoch: 47, train_loss: 0.5485, test_loss: 1.1157, test_f1: 0.6191
 epoch: 48, train_loss: 0.5566, test_loss: 1.5020, test_f1: 0.5597
 epoch: 49, train_loss: 0.6014, test_loss: 1.0593, test_f1: 0.6405
 epoch: 50, train_loss: 0.5779, test_loss: 1.5821, test_f1: 0.5760
 epoch: 51, train_loss: 0.5435, test_loss: 1.3564, test_f1: 0.5847
 epoch: 52, train_loss: 0.4996, test_loss: 1.2490, test_f1: 0.6244
 epoch: 53, train_loss: 0.5239, test_loss: 1.2672, test_f1: 0.6275
 epoch: 54, train_loss: 0.4797, test_loss: 1.2610, test_f1: 0.6161
 epoch: 55, train_loss: 0.4715, test_loss: 1.2777, test_f1: 0.6347
 epoch: 56, train_loss: 0.5092, test_loss: 1.5238, test_f1: 0.5540
 epoch: 57, train_loss: 0.4875, test_loss: 1.3079, test_f1: 0.6031
 epoch: 58, train_loss: 0.4969, test_loss: 1.3706, test_f1: 0.6083
 epoch: 59, train_loss: 0.4897, test_loss: 2.6902, test_f1: 0.5199
 epoch: 60, train_loss: 0.4733, test_loss: 1.4990, test_f1: 0.6102
 epoch: 61, train_loss: 0.4519, test_loss: 2.1031, test_f1: 0.5547
 epoch: 62, train_loss: 0.4786, test_loss: 1.3820, test_f1: 0.6467
 epoch: 63, train_loss: 0.4594, test_loss: 1.4757, test_f1: 0.5713
 epoch: 64, train_loss: 0.4434, test_loss: 1.4855, test_f1: 0.6144
 epoch: 65, train_loss: 0.4584, test_loss: 1.4066, test_f1: 0.6312
 epoch: 66, train_loss: 0.4573, test_loss: 1.9632, test_f1: 0.5526
 epoch: 67, train_loss: 0.4703, test_loss: 1.8245, test_f1: 0.6175
 epoch: 68, train_loss: 0.4513, test_loss: 1.6027, test_f1: 0.6195
 epoch: 69, train_loss: 0.4231, test_loss: 1.6152, test_f1: 0.5484
 epoch: 70, train_loss: 0.4742, test_loss: 1.3513, test_f1: 0.6578
 epoch: 71, train_loss: 0.4388, test_loss: 1.6612, test_f1: 0.6183
 epoch: 72, train_loss: 0.4304, test_loss: 1.9331, test_f1: 0.5726
 epoch: 73, train_loss: 0.4786, test_loss: 1.3862, test_f1: 0.6406
 epoch: 74, train_loss: 0.4446, test_loss: 1.5665, test_f1: 0.6025
 epoch: 75, train_loss: 0.4265, test_loss: 1.6731, test_f1: 0.5478
 epoch: 76, train_loss: 0.4323, test_loss: 1.7746, test_f1: 0.5808
 epoch: 77, train_loss: 0.4433, test_loss: 1.6771, test_f1: 0.6273
 epoch: 78, train_loss: 0.4317, test_loss: 1.5282, test_f1: 0.5837
 epoch: 79, train_loss: 0.4513, test_loss: 2.0320, test_f1: 0.5493
 epoch: 80, train_loss: 0.4038, test_loss: 1.8991, test_f1: 0.6282
 epoch: 81, train_loss: 0.3899, test_loss: 1.8155, test_f1: 0.6095
 epoch: 82, train_loss: 0.4243, test_loss: 1.9782, test_f1: 0.6098
 epoch: 83, train_loss: 0.4505, test_loss: 1.5660, test_f1: 0.5879
 epoch: 84, train_loss: 0.4122, test_loss: 1.8902, test_f1: 0.6157
 epoch: 85, train_loss: 0.4346, test_loss: 1.4099, test_f1: 0.6596
 epoch: 86, train_loss: 0.4212, test_loss: 1.9563, test_f1: 0.6196
 epoch: 87, train_loss: 0.4531, test_loss: 1.5464, test_f1: 0.6172
 epoch: 88, train_loss: 0.4257, test_loss: 1.8477, test_f1: 0.6251
 epoch: 89, train_loss: 0.4221, test_loss: 2.1262, test_f1: 0.5558
 epoch: 90, train_loss: 0.4564, test_loss: 1.4753, test_f1: 0.6628
 epoch: 91, train_loss: 0.3898, test_loss: 1.8548, test_f1: 0.5969
 epoch: 92, train_loss: 0.4090, test_loss: 2.0456, test_f1: 0.5833
 epoch: 93, train_loss: 0.4024, test_loss: 1.9346, test_f1: 0.5425
 epoch: 94, train_loss: 0.3964, test_loss: 2.1178, test_f1: 0.6041
 epoch: 95, train_loss: 0.3926, test_loss: 1.7180, test_f1: 0.6359
 epoch: 96, train_loss: 0.4050, test_loss: 1.7586, test_f1: 0.6432
 epoch: 97, train_loss: 0.3827, test_loss: 2.0586, test_f1: 0.6119
 epoch: 98, train_loss: 0.3923, test_loss: 1.8250, test_f1: 0.6368
 epoch: 99, train_loss: 0.3784, test_loss: 1.6294, test_f1: 0.6397
##################ITERATION #9 ****************************************
 epoch: 0, train_loss: 1.1794, test_loss: 1.3002, test_f1: 0.3312
 epoch: 1, train_loss: 1.0146, test_loss: 1.1333, test_f1: 0.4476
 epoch: 2, train_loss: 0.9759, test_loss: 1.0676, test_f1: 0.5100
 epoch: 3, train_loss: 0.9496, test_loss: 1.0730, test_f1: 0.5289
 epoch: 4, train_loss: 0.9165, test_loss: 1.0413, test_f1: 0.5021
 epoch: 5, train_loss: 0.8973, test_loss: 1.0435, test_f1: 0.5498
 epoch: 6, train_loss: 0.9037, test_loss: 1.0783, test_f1: 0.5005
 epoch: 7, train_loss: 0.8609, test_loss: 1.0510, test_f1: 0.5268
 epoch: 8, train_loss: 0.8434, test_loss: 1.1975, test_f1: 0.5145
 epoch: 9, train_loss: 0.8404, test_loss: 1.2489, test_f1: 0.4541
 epoch: 10, train_loss: 0.8162, test_loss: 1.0752, test_f1: 0.5391
 epoch: 11, train_loss: 0.8086, test_loss: 1.4654, test_f1: 0.4374
 epoch: 12, train_loss: 0.7969, test_loss: 1.2296, test_f1: 0.5476
 epoch: 13, train_loss: 0.7784, test_loss: 1.3533, test_f1: 0.4817
 epoch: 14, train_loss: 0.7942, test_loss: 1.5002, test_f1: 0.4538
 epoch: 15, train_loss: 0.7841, test_loss: 1.1578, test_f1: 0.4727
 epoch: 16, train_loss: 0.7681, test_loss: 1.0311, test_f1: 0.5915
 epoch: 17, train_loss: 0.7838, test_loss: 1.3388, test_f1: 0.5044
 epoch: 18, train_loss: 0.7781, test_loss: 1.0604, test_f1: 0.5692
 epoch: 19, train_loss: 0.7445, test_loss: 1.0665, test_f1: 0.6067
 epoch: 20, train_loss: 0.7680, test_loss: 1.5272, test_f1: 0.4437
 epoch: 21, train_loss: 0.7632, test_loss: 1.1614, test_f1: 0.5322
 epoch: 22, train_loss: 0.7367, test_loss: 1.1811, test_f1: 0.5167
 epoch: 23, train_loss: 0.7104, test_loss: 1.1713, test_f1: 0.5323
 epoch: 24, train_loss: 0.7165, test_loss: 1.3251, test_f1: 0.5318
 epoch: 25, train_loss: 0.6949, test_loss: 1.3080, test_f1: 0.5015
 epoch: 26, train_loss: 0.7082, test_loss: 1.1456, test_f1: 0.5658
 epoch: 27, train_loss: 0.7104, test_loss: 1.2551, test_f1: 0.5468
 epoch: 28, train_loss: 0.6981, test_loss: 1.1130, test_f1: 0.5627
 epoch: 29, train_loss: 0.6968, test_loss: 2.1176, test_f1: 0.4269
 epoch: 30, train_loss: 0.6820, test_loss: 1.2193, test_f1: 0.5602
 epoch: 31, train_loss: 0.6792, test_loss: 1.2391, test_f1: 0.5855
 epoch: 32, train_loss: 0.6737, test_loss: 1.2156, test_f1: 0.5977
 epoch: 33, train_loss: 0.6921, test_loss: 1.1530, test_f1: 0.6127
 epoch: 34, train_loss: 0.6803, test_loss: 1.3985, test_f1: 0.5659
 epoch: 35, train_loss: 0.6780, test_loss: 2.1660, test_f1: 0.4587
 epoch: 36, train_loss: 0.6751, test_loss: 1.2351, test_f1: 0.5870
 epoch: 37, train_loss: 0.6422, test_loss: 1.5681, test_f1: 0.5700
 epoch: 38, train_loss: 0.6666, test_loss: 1.6254, test_f1: 0.5211
 epoch: 39, train_loss: 0.6411, test_loss: 1.3022, test_f1: 0.5760
 epoch: 40, train_loss: 0.6310, test_loss: 1.4384, test_f1: 0.4783
 epoch: 41, train_loss: 0.6205, test_loss: 1.3431, test_f1: 0.5755
 epoch: 42, train_loss: 0.6217, test_loss: 1.1992, test_f1: 0.6303
 epoch: 43, train_loss: 0.5913, test_loss: 1.8621, test_f1: 0.5457
 epoch: 44, train_loss: 0.6170, test_loss: 1.7282, test_f1: 0.6119
 epoch: 45, train_loss: 0.6660, test_loss: 2.0319, test_f1: 0.4665
 epoch: 46, train_loss: 0.6142, test_loss: 1.1789, test_f1: 0.6256
 epoch: 47, train_loss: 0.6149, test_loss: 1.2664, test_f1: 0.5984
 epoch: 48, train_loss: 0.5798, test_loss: 1.2756, test_f1: 0.6072
 epoch: 49, train_loss: 0.6330, test_loss: 1.1009, test_f1: 0.5712
 epoch: 50, train_loss: 0.6210, test_loss: 1.5969, test_f1: 0.5792
 epoch: 51, train_loss: 0.5629, test_loss: 1.2212, test_f1: 0.5712
 epoch: 52, train_loss: 0.5239, test_loss: 1.3135, test_f1: 0.6384
 epoch: 53, train_loss: 0.5084, test_loss: 1.2084, test_f1: 0.5677
 epoch: 54, train_loss: 0.5196, test_loss: 1.5653, test_f1: 0.6252
 epoch: 55, train_loss: 0.5264, test_loss: 1.3848, test_f1: 0.6132
 epoch: 56, train_loss: 0.5027, test_loss: 1.4574, test_f1: 0.6356
 epoch: 57, train_loss: 0.5199, test_loss: 1.6087, test_f1: 0.6131
 epoch: 58, train_loss: 0.5127, test_loss: 1.7788, test_f1: 0.5905
 epoch: 59, train_loss: 0.4994, test_loss: 2.0030, test_f1: 0.6089
 epoch: 60, train_loss: 0.4934, test_loss: 2.0077, test_f1: 0.6114
 epoch: 61, train_loss: 0.4808, test_loss: 2.0570, test_f1: 0.5877
 epoch: 62, train_loss: 0.5163, test_loss: 1.6661, test_f1: 0.6181
 epoch: 63, train_loss: 0.5075, test_loss: 1.9820, test_f1: 0.5952
 epoch: 64, train_loss: 0.4644, test_loss: 1.5154, test_f1: 0.5974
 epoch: 65, train_loss: 0.4707, test_loss: 1.4128, test_f1: 0.5974
 epoch: 66, train_loss: 0.4604, test_loss: 2.2233, test_f1: 0.6012
 epoch: 67, train_loss: 0.4872, test_loss: 1.5037, test_f1: 0.5780
 epoch: 68, train_loss: 0.4592, test_loss: 2.0117, test_f1: 0.5498
 epoch: 69, train_loss: 0.4778, test_loss: 1.6855, test_f1: 0.6031
 epoch: 70, train_loss: 0.4917, test_loss: 1.3565, test_f1: 0.6496
 epoch: 71, train_loss: 0.4851, test_loss: 1.4089, test_f1: 0.6258
 epoch: 72, train_loss: 0.4484, test_loss: 1.9373, test_f1: 0.5729
 epoch: 73, train_loss: 0.4874, test_loss: 1.7481, test_f1: 0.5890
 epoch: 74, train_loss: 0.4588, test_loss: 1.6906, test_f1: 0.6080
 epoch: 75, train_loss: 0.4462, test_loss: 1.6149, test_f1: 0.6064
 epoch: 76, train_loss: 0.4184, test_loss: 1.8661, test_f1: 0.6153
 epoch: 77, train_loss: 0.4469, test_loss: 2.0429, test_f1: 0.6382
 epoch: 78, train_loss: 0.4718, test_loss: 2.6862, test_f1: 0.5936
 epoch: 79, train_loss: 0.4234, test_loss: 2.2258, test_f1: 0.6090
 epoch: 80, train_loss: 0.3970, test_loss: 1.4269, test_f1: 0.6417
 epoch: 81, train_loss: 0.4127, test_loss: 1.6534, test_f1: 0.6018
 epoch: 82, train_loss: 0.4403, test_loss: 1.9362, test_f1: 0.5752
 epoch: 83, train_loss: 0.4606, test_loss: 1.9009, test_f1: 0.5520
 epoch: 84, train_loss: 0.4661, test_loss: 1.5771, test_f1: 0.5894
 epoch: 85, train_loss: 0.4116, test_loss: 1.4321, test_f1: 0.5960
 epoch: 86, train_loss: 0.4245, test_loss: 2.2063, test_f1: 0.6098
 epoch: 87, train_loss: 0.4362, test_loss: 1.9092, test_f1: 0.6204
 epoch: 88, train_loss: 0.4480, test_loss: 1.4731, test_f1: 0.6068
 epoch: 89, train_loss: 0.4134, test_loss: 1.7351, test_f1: 0.6067
 epoch: 90, train_loss: 0.4243, test_loss: 2.2193, test_f1: 0.5787
 epoch: 91, train_loss: 0.4163, test_loss: 1.5205, test_f1: 0.6200
 epoch: 92, train_loss: 0.4177, test_loss: 1.4978, test_f1: 0.6225
 epoch: 93, train_loss: 0.4108, test_loss: 2.2615, test_f1: 0.5996
 epoch: 94, train_loss: 0.3798, test_loss: 2.3245, test_f1: 0.5912
 epoch: 95, train_loss: 0.4287, test_loss: 1.8461, test_f1: 0.6401
 epoch: 96, train_loss: 0.4032, test_loss: 1.8006, test_f1: 0.6279
 epoch: 97, train_loss: 0.4292, test_loss: 2.4178, test_f1: 0.6219
 epoch: 98, train_loss: 0.4295, test_loss: 2.2561, test_f1: 0.6002
 epoch: 99, train_loss: 0.4090, test_loss: 2.2513, test_f1: 0.6291

Training completed in 416.20 seconds
Best F1: 0.7029 at epoch 95
Mean F1 across iterations: 0.6696  0.0162
========================FINAL RESULTS================================
FEGIN weighted F1: 0.7029  0.0162
python main.py --data ltspice_demos --representation component_pin_net --model FEGIN --layers 3 --hiddens 32 --batch_size 64 --lr 0.01 --emb_size 512 --epochs 100 --save_appendix component_pin_net_L3_H32_BS64_LR0.01_E512 --no_val
-----



STDERR:
  File "main.py", line 370, in <module>
    main()
  File "main.py", line 254, in main
    dataset = dataset_class(
  File "/home/philip/projects/ltspice_examples_code_repo/Circuit-Completion-Using-GNNs/component_classification_with_link_prediction_head/evaluation/FEGIN/kernel/circuit_datasets.py", line 15, in __init__
    self.data, self.slices = torch.load(self.processed_paths[0])
  File "/home/philip/.local/lib/python3.8/site-packages/torch/serialization.py", line 1040, in load
    warnings.warn(
  File "/usr/lib/python3.8/warnings.py", line 109, in _showwarnmsg
    sw(msg.message, msg.category, msg.filename, msg.lineno,
  File "main.py", line 47, in warn_with_traceback
    traceback.print_stack(file=log)
/home/philip/projects/ltspice_examples_code_repo/Circuit-Completion-Using-GNNs/component_classification_with_link_prediction_head/evaluation/FEGIN/kernel/circuit_datasets.py:15: FutureWarning: You are using `torch.load` with `weights_only=False` (the current default value), which uses the default pickle module implicitly. It is possible to construct malicious pickle data which will execute arbitrary code during unpickling (See https://github.com/pytorch/pytorch/blob/main/SECURITY.md#untrusted-models for more details). In a future release, the default value for `weights_only` will be flipped to `True`. This limits the functions that could be executed during unpickling. Arbitrary objects will no longer be allowed to be loaded via this mode unless they are explicitly allowlisted by the user via `torch.serialization.add_safe_globals`. We recommend you start setting `weights_only=True` for any use case where you don't have full control of the loaded file. Please open an issue on GitHub for any issues related to this experimental feature.
  self.data, self.slices = torch.load(self.processed_paths[0])
