STDOUT:
Results will be saved in /home/philip/projects/ltspice_examples_code_repo/Circuit-Completion-Using-GNNs/component_classification_with_link_prediction_head/evaluation/FEGIN/results/model_FEGIN_dataset_ltspice_demos
Command line input: python main.py --data ltspice_demos --representation component_pin_net --model FEGIN --layers 2 --hiddens 32 --batch_size 256 --lr 0.1 --emb_size 250 --epochs 100 --save_appendix component_pin_net_L2_H32_BS256_LR0.1_E250 --no_val
 is saved.
-----
ltspice_demos - FEGIN
Using 2 layers, 32 hidden units, h = 2
Loading component_pin_net representation dataset
ENTERED
Training FEGIN on component_pin_net representation
Train: 1565, Test: 383
##################ITERATION #0 ****************************************
 epoch: 0, train_loss: 1.3023, test_loss: 1.3387, test_f1: 0.3237
 epoch: 1, train_loss: 1.1976, test_loss: 1.4226, test_f1: 0.2331
 epoch: 2, train_loss: 1.1122, test_loss: 1.4040, test_f1: 0.2680
 epoch: 3, train_loss: 1.0881, test_loss: 1.1387, test_f1: 0.3290
 epoch: 4, train_loss: 1.1219, test_loss: 10.8183, test_f1: 0.1103
 epoch: 5, train_loss: 1.0913, test_loss: 3.8630, test_f1: 0.2330
 epoch: 6, train_loss: 1.1184, test_loss: 1.2258, test_f1: 0.3138
 epoch: 7, train_loss: 1.0577, test_loss: 1.1404, test_f1: 0.4209
 epoch: 8, train_loss: 1.0390, test_loss: 1.1440, test_f1: 0.3288
 epoch: 9, train_loss: 1.0280, test_loss: 1.1107, test_f1: 0.4280
 epoch: 10, train_loss: 1.0059, test_loss: 1.1116, test_f1: 0.3290
 epoch: 11, train_loss: 1.0043, test_loss: 1.0887, test_f1: 0.4562
 epoch: 12, train_loss: 0.9937, test_loss: 1.0913, test_f1: 0.3402
 epoch: 13, train_loss: 1.0255, test_loss: 1.0867, test_f1: 0.3475
 epoch: 14, train_loss: 1.0020, test_loss: 1.0920, test_f1: 0.3333
 epoch: 15, train_loss: 1.0018, test_loss: 1.1677, test_f1: 0.3279
 epoch: 16, train_loss: 1.0141, test_loss: 1.0978, test_f1: 0.3965
 epoch: 17, train_loss: 0.9948, test_loss: 1.1061, test_f1: 0.4027
 epoch: 18, train_loss: 0.9967, test_loss: 1.1705, test_f1: 0.4570
 epoch: 19, train_loss: 0.9941, test_loss: 1.2143, test_f1: 0.3290
 epoch: 20, train_loss: 1.0021, test_loss: 1.1185, test_f1: 0.3438
 epoch: 21, train_loss: 0.9857, test_loss: 1.1059, test_f1: 0.3302
 epoch: 22, train_loss: 0.9937, test_loss: 1.0833, test_f1: 0.3599
 epoch: 23, train_loss: 0.9724, test_loss: 1.0829, test_f1: 0.3322
 epoch: 24, train_loss: 1.0166, test_loss: 1.1183, test_f1: 0.3290
 epoch: 25, train_loss: 1.0311, test_loss: 1.1499, test_f1: 0.3317
 epoch: 26, train_loss: 1.0335, test_loss: 1.4155, test_f1: 0.2281
 epoch: 27, train_loss: 1.0321, test_loss: 1.1334, test_f1: 0.4619
 epoch: 28, train_loss: 1.0252, test_loss: 1.0935, test_f1: 0.3670
 epoch: 29, train_loss: 0.9937, test_loss: 3.1769, test_f1: 0.3153
 epoch: 30, train_loss: 1.0223, test_loss: 1.0404, test_f1: 0.4157
 epoch: 31, train_loss: 1.0009, test_loss: 1.1379, test_f1: 0.4462
 epoch: 32, train_loss: 0.9913, test_loss: 1.2521, test_f1: 0.3290
 epoch: 33, train_loss: 0.9833, test_loss: 1.3042, test_f1: 0.3543
 epoch: 34, train_loss: 0.9757, test_loss: 1.0619, test_f1: 0.3652
 epoch: 35, train_loss: 0.9637, test_loss: 1.1502, test_f1: 0.4124
 epoch: 36, train_loss: 0.9680, test_loss: 1.6723, test_f1: 0.4179
 epoch: 37, train_loss: 0.9866, test_loss: 1.0979, test_f1: 0.4217
 epoch: 38, train_loss: 0.9666, test_loss: 1.0827, test_f1: 0.4142
 epoch: 39, train_loss: 0.9733, test_loss: 1.1228, test_f1: 0.3337
 epoch: 40, train_loss: 1.0146, test_loss: 1.2021, test_f1: 0.3016
 epoch: 41, train_loss: 1.0027, test_loss: 1.2970, test_f1: 0.2727
 epoch: 42, train_loss: 1.0118, test_loss: 1.1984, test_f1: 0.3083
 epoch: 43, train_loss: 0.9718, test_loss: 1.1512, test_f1: 0.3748
 epoch: 44, train_loss: 0.9669, test_loss: 1.1587, test_f1: 0.3205
 epoch: 45, train_loss: 0.9790, test_loss: 1.1795, test_f1: 0.3344
 epoch: 46, train_loss: 0.9569, test_loss: 1.0865, test_f1: 0.4524
 epoch: 47, train_loss: 0.9979, test_loss: 1.3184, test_f1: 0.4246
 epoch: 48, train_loss: 0.9839, test_loss: 1.0697, test_f1: 0.3624
 epoch: 49, train_loss: 0.9578, test_loss: 1.0550, test_f1: 0.4177
 epoch: 50, train_loss: 0.9539, test_loss: 1.0841, test_f1: 0.3395
 epoch: 51, train_loss: 0.9594, test_loss: 1.0834, test_f1: 0.3400
 epoch: 52, train_loss: 0.9568, test_loss: 1.0031, test_f1: 0.3693
 epoch: 53, train_loss: 0.9374, test_loss: 1.0502, test_f1: 0.3662
 epoch: 54, train_loss: 0.9557, test_loss: 1.0301, test_f1: 0.3671
 epoch: 55, train_loss: 0.9336, test_loss: 1.0371, test_f1: 0.4817
 epoch: 56, train_loss: 0.9224, test_loss: 1.0134, test_f1: 0.5618
 epoch: 57, train_loss: 0.9301, test_loss: 1.0227, test_f1: 0.3959
 epoch: 58, train_loss: 0.9247, test_loss: 1.0981, test_f1: 0.4763
 epoch: 59, train_loss: 0.9109, test_loss: 1.0572, test_f1: 0.5242
 epoch: 60, train_loss: 0.8958, test_loss: 0.9666, test_f1: 0.4259
 epoch: 61, train_loss: 0.8725, test_loss: 1.0617, test_f1: 0.3639
 epoch: 62, train_loss: 0.8569, test_loss: 1.7455, test_f1: 0.3272
 epoch: 63, train_loss: 0.8609, test_loss: 0.9531, test_f1: 0.4921
 epoch: 64, train_loss: 0.8774, test_loss: 1.0440, test_f1: 0.3856
 epoch: 65, train_loss: 0.8749, test_loss: 0.9971, test_f1: 0.4389
 epoch: 66, train_loss: 0.8671, test_loss: 1.0093, test_f1: 0.5194
 epoch: 67, train_loss: 0.8401, test_loss: 0.9831, test_f1: 0.5606
 epoch: 68, train_loss: 0.8766, test_loss: 1.0007, test_f1: 0.4121
 epoch: 69, train_loss: 0.8737, test_loss: 1.0038, test_f1: 0.5188
 epoch: 70, train_loss: 0.8793, test_loss: 0.9969, test_f1: 0.4270
 epoch: 71, train_loss: 0.8745, test_loss: 0.9717, test_f1: 0.4371
 epoch: 72, train_loss: 0.9085, test_loss: 1.0237, test_f1: 0.3688
 epoch: 73, train_loss: 0.9040, test_loss: 1.0227, test_f1: 0.3999
 epoch: 74, train_loss: 0.8959, test_loss: 1.0090, test_f1: 0.4265
 epoch: 75, train_loss: 0.8926, test_loss: 0.9769, test_f1: 0.4334
 epoch: 76, train_loss: 0.8704, test_loss: 0.9645, test_f1: 0.4974
 epoch: 77, train_loss: 0.8775, test_loss: 1.0299, test_f1: 0.5695
 epoch: 78, train_loss: 0.8571, test_loss: 0.9738, test_f1: 0.4363
 epoch: 79, train_loss: 0.8679, test_loss: 0.9744, test_f1: 0.5164
 epoch: 80, train_loss: 0.8476, test_loss: 1.3893, test_f1: 0.5063
 epoch: 81, train_loss: 0.8456, test_loss: 1.4349, test_f1: 0.4456
 epoch: 82, train_loss: 0.8529, test_loss: 0.9713, test_f1: 0.4314
 epoch: 83, train_loss: 0.8545, test_loss: 0.9526, test_f1: 0.5329
 epoch: 84, train_loss: 0.8496, test_loss: 0.9726, test_f1: 0.5713
 epoch: 85, train_loss: 0.8401, test_loss: 1.1169, test_f1: 0.5251
 epoch: 86, train_loss: 0.8477, test_loss: 1.0024, test_f1: 0.4623
 epoch: 87, train_loss: 0.8490, test_loss: 0.9882, test_f1: 0.5504
 epoch: 88, train_loss: 0.9110, test_loss: 1.0642, test_f1: 0.4730
 epoch: 89, train_loss: 0.9576, test_loss: 1.0487, test_f1: 0.5063
 epoch: 90, train_loss: 0.9278, test_loss: 1.1193, test_f1: 0.5436
 epoch: 91, train_loss: 0.9306, test_loss: 1.0053, test_f1: 0.4368
 epoch: 92, train_loss: 0.9073, test_loss: 1.0196, test_f1: 0.4270
 epoch: 93, train_loss: 0.8592, test_loss: 1.1074, test_f1: 0.4072
 epoch: 94, train_loss: 0.8626, test_loss: 1.0382, test_f1: 0.4116
 epoch: 95, train_loss: 0.8615, test_loss: 0.9830, test_f1: 0.4337
 epoch: 96, train_loss: 0.8526, test_loss: 0.9793, test_f1: 0.5590
 epoch: 97, train_loss: 0.8725, test_loss: 1.0116, test_f1: 0.4254
 epoch: 98, train_loss: 0.8604, test_loss: 0.9571, test_f1: 0.4382
 epoch: 99, train_loss: 0.8731, test_loss: 1.0526, test_f1: 0.5496
##################ITERATION #1 ****************************************
 epoch: 0, train_loss: 1.3179, test_loss: 1.2991, test_f1: 0.2281
 epoch: 1, train_loss: 1.2546, test_loss: 1.3094, test_f1: 0.2281
 epoch: 2, train_loss: 1.2539, test_loss: 1.3191, test_f1: 0.2281
 epoch: 3, train_loss: 1.2557, test_loss: 1.3152, test_f1: 0.2281
 epoch: 4, train_loss: 1.2539, test_loss: 1.3054, test_f1: 0.2281
 epoch: 5, train_loss: 1.2531, test_loss: 1.3014, test_f1: 0.2281
 epoch: 6, train_loss: 1.2533, test_loss: 1.3047, test_f1: 0.2281
 epoch: 7, train_loss: 1.2545, test_loss: 1.3092, test_f1: 0.2281
 epoch: 8, train_loss: 1.2530, test_loss: 1.3061, test_f1: 0.2281
 epoch: 9, train_loss: 1.2533, test_loss: 1.3043, test_f1: 0.2281
 epoch: 10, train_loss: 1.2531, test_loss: 1.3033, test_f1: 0.2281
 epoch: 11, train_loss: 1.2530, test_loss: 1.3058, test_f1: 0.2281
 epoch: 12, train_loss: 1.2533, test_loss: 1.3042, test_f1: 0.2281
 epoch: 13, train_loss: 1.2524, test_loss: 1.3030, test_f1: 0.2281
 epoch: 14, train_loss: 1.2523, test_loss: 1.3012, test_f1: 0.2281
 epoch: 15, train_loss: 1.2536, test_loss: 1.2995, test_f1: 0.2281
 epoch: 16, train_loss: 1.2541, test_loss: 1.3028, test_f1: 0.2281
 epoch: 17, train_loss: 1.2525, test_loss: 1.3022, test_f1: 0.2281
 epoch: 18, train_loss: 1.2523, test_loss: 1.3052, test_f1: 0.2281
 epoch: 19, train_loss: 1.2531, test_loss: 1.3078, test_f1: 0.2281
 epoch: 20, train_loss: 1.2528, test_loss: 1.3104, test_f1: 0.2281
 epoch: 21, train_loss: 1.2528, test_loss: 1.3085, test_f1: 0.2281
 epoch: 22, train_loss: 1.2523, test_loss: 1.3042, test_f1: 0.2281
 epoch: 23, train_loss: 1.2526, test_loss: 1.3021, test_f1: 0.2281
 epoch: 24, train_loss: 1.2527, test_loss: 1.3064, test_f1: 0.2281
 epoch: 25, train_loss: 1.2522, test_loss: 1.3040, test_f1: 0.2281
 epoch: 26, train_loss: 1.2521, test_loss: 1.3025, test_f1: 0.2281
 epoch: 27, train_loss: 1.2534, test_loss: 1.3025, test_f1: 0.2281
 epoch: 28, train_loss: 1.2543, test_loss: 1.3056, test_f1: 0.2281
 epoch: 29, train_loss: 1.2528, test_loss: 1.3052, test_f1: 0.2281
 epoch: 30, train_loss: 1.2531, test_loss: 1.3088, test_f1: 0.2281
 epoch: 31, train_loss: 1.2541, test_loss: 1.3105, test_f1: 0.2281
 epoch: 32, train_loss: 1.2532, test_loss: 1.3063, test_f1: 0.2281
 epoch: 33, train_loss: 1.2524, test_loss: 1.3053, test_f1: 0.2281
 epoch: 34, train_loss: 1.2537, test_loss: 1.3049, test_f1: 0.2281
 epoch: 35, train_loss: 1.2529, test_loss: 1.3033, test_f1: 0.2281
 epoch: 36, train_loss: 1.2524, test_loss: 1.3059, test_f1: 0.2281
 epoch: 37, train_loss: 1.2524, test_loss: 1.3072, test_f1: 0.2281
 epoch: 38, train_loss: 1.2528, test_loss: 1.3044, test_f1: 0.2281
 epoch: 39, train_loss: 1.2531, test_loss: 1.3050, test_f1: 0.2281
 epoch: 40, train_loss: 1.2543, test_loss: 1.3024, test_f1: 0.2281
 epoch: 41, train_loss: 1.2529, test_loss: 1.3053, test_f1: 0.2281
 epoch: 42, train_loss: 1.2524, test_loss: 1.3085, test_f1: 0.2281
 epoch: 43, train_loss: 1.2535, test_loss: 1.3086, test_f1: 0.2281
 epoch: 44, train_loss: 1.2531, test_loss: 1.3051, test_f1: 0.2281
 epoch: 45, train_loss: 1.2526, test_loss: 1.3060, test_f1: 0.2281
 epoch: 46, train_loss: 1.2521, test_loss: 1.3054, test_f1: 0.2281
 epoch: 47, train_loss: 1.2527, test_loss: 1.3037, test_f1: 0.2281
 epoch: 48, train_loss: 1.2523, test_loss: 1.3046, test_f1: 0.2281
 epoch: 49, train_loss: 1.2523, test_loss: 1.3058, test_f1: 0.2281
 epoch: 50, train_loss: 1.2528, test_loss: 1.3054, test_f1: 0.2281
 epoch: 51, train_loss: 1.2520, test_loss: 1.3043, test_f1: 0.2281
 epoch: 52, train_loss: 1.2529, test_loss: 1.3014, test_f1: 0.2281
 epoch: 53, train_loss: 1.2533, test_loss: 1.3020, test_f1: 0.2281
 epoch: 54, train_loss: 1.2521, test_loss: 1.3046, test_f1: 0.2281
 epoch: 55, train_loss: 1.2528, test_loss: 1.3091, test_f1: 0.2281
 epoch: 56, train_loss: 1.2536, test_loss: 1.3095, test_f1: 0.2281
 epoch: 57, train_loss: 1.2526, test_loss: 1.3060, test_f1: 0.2281
 epoch: 58, train_loss: 1.2521, test_loss: 1.3047, test_f1: 0.2281
 epoch: 59, train_loss: 1.2520, test_loss: 1.3038, test_f1: 0.2281
 epoch: 60, train_loss: 1.2523, test_loss: 1.3047, test_f1: 0.2281
 epoch: 61, train_loss: 1.2521, test_loss: 1.3037, test_f1: 0.2281
 epoch: 62, train_loss: 1.2520, test_loss: 1.3018, test_f1: 0.2281
 epoch: 63, train_loss: 1.2523, test_loss: 1.3028, test_f1: 0.2281
 epoch: 64, train_loss: 1.2525, test_loss: 1.3053, test_f1: 0.2281
 epoch: 65, train_loss: 1.2525, test_loss: 1.3075, test_f1: 0.2281
 epoch: 66, train_loss: 1.2524, test_loss: 1.3081, test_f1: 0.2281
 epoch: 67, train_loss: 1.2524, test_loss: 1.3086, test_f1: 0.2281
 epoch: 68, train_loss: 1.2526, test_loss: 1.3109, test_f1: 0.2281
 epoch: 69, train_loss: 1.2531, test_loss: 1.3104, test_f1: 0.2281
 epoch: 70, train_loss: 1.2527, test_loss: 1.3075, test_f1: 0.2281
 epoch: 71, train_loss: 1.2527, test_loss: 1.3048, test_f1: 0.2281
 epoch: 72, train_loss: 1.2525, test_loss: 1.3046, test_f1: 0.2281
 epoch: 73, train_loss: 1.2522, test_loss: 1.3043, test_f1: 0.2281
 epoch: 74, train_loss: 1.2522, test_loss: 1.3045, test_f1: 0.2281
 epoch: 75, train_loss: 1.2525, test_loss: 1.3059, test_f1: 0.2281
 epoch: 76, train_loss: 1.2527, test_loss: 1.3063, test_f1: 0.2281
 epoch: 77, train_loss: 1.2519, test_loss: 1.3058, test_f1: 0.2281
 epoch: 78, train_loss: 1.2523, test_loss: 1.3059, test_f1: 0.2281
 epoch: 79, train_loss: 1.2524, test_loss: 1.3047, test_f1: 0.2281
 epoch: 80, train_loss: 1.2520, test_loss: 1.3035, test_f1: 0.2281
 epoch: 81, train_loss: 1.2523, test_loss: 1.3036, test_f1: 0.2281
 epoch: 82, train_loss: 1.2523, test_loss: 1.3042, test_f1: 0.2281
 epoch: 83, train_loss: 1.2527, test_loss: 1.3063, test_f1: 0.2281
 epoch: 84, train_loss: 1.2525, test_loss: 1.3082, test_f1: 0.2281
 epoch: 85, train_loss: 1.2527, test_loss: 1.3085, test_f1: 0.2281
 epoch: 86, train_loss: 1.2524, test_loss: 1.3050, test_f1: 0.2281
 epoch: 87, train_loss: 1.2520, test_loss: 1.3052, test_f1: 0.2281
 epoch: 88, train_loss: 1.2522, test_loss: 1.3044, test_f1: 0.2281
 epoch: 89, train_loss: 1.2525, test_loss: 1.3036, test_f1: 0.2281
 epoch: 90, train_loss: 1.2522, test_loss: 1.3036, test_f1: 0.2281
 epoch: 91, train_loss: 1.2521, test_loss: 1.3052, test_f1: 0.2281
 epoch: 92, train_loss: 1.2524, test_loss: 1.3066, test_f1: 0.2281
 epoch: 93, train_loss: 1.2523, test_loss: 1.3058, test_f1: 0.2281
 epoch: 94, train_loss: 1.2527, test_loss: 1.3047, test_f1: 0.2281
 epoch: 95, train_loss: 1.2520, test_loss: 1.3031, test_f1: 0.2281
 epoch: 96, train_loss: 1.2523, test_loss: 1.3036, test_f1: 0.2281
 epoch: 97, train_loss: 1.2522, test_loss: 1.3044, test_f1: 0.2281
 epoch: 98, train_loss: 1.2522, test_loss: 1.3029, test_f1: 0.2281
 epoch: 99, train_loss: 1.2524, test_loss: 1.3027, test_f1: 0.2281
##################ITERATION #2 ****************************************
 epoch: 0, train_loss: 1.2632, test_loss: 1.3128, test_f1: 0.2281
 epoch: 1, train_loss: 1.3812, test_loss: 1.3087, test_f1: 0.2281
 epoch: 2, train_loss: 1.2534, test_loss: 1.3046, test_f1: 0.2281
 epoch: 3, train_loss: 1.2543, test_loss: 1.3005, test_f1: 0.2281
 epoch: 4, train_loss: 1.2530, test_loss: 1.3018, test_f1: 0.2281
 epoch: 5, train_loss: 1.2525, test_loss: 1.3045, test_f1: 0.2281
 epoch: 6, train_loss: 1.2521, test_loss: 1.3056, test_f1: 0.2281
 epoch: 7, train_loss: 1.2537, test_loss: 1.3083, test_f1: 0.2281
 epoch: 8, train_loss: 1.2537, test_loss: 1.3056, test_f1: 0.2281
 epoch: 9, train_loss: 1.2529, test_loss: 1.3064, test_f1: 0.2281
 epoch: 10, train_loss: 1.2525, test_loss: 1.3051, test_f1: 0.2281
 epoch: 11, train_loss: 1.2530, test_loss: 1.3027, test_f1: 0.2281
 epoch: 12, train_loss: 1.2522, test_loss: 1.3055, test_f1: 0.2281
 epoch: 13, train_loss: 1.2523, test_loss: 1.3032, test_f1: 0.2281
 epoch: 14, train_loss: 1.2525, test_loss: 1.3023, test_f1: 0.2281
 epoch: 15, train_loss: 1.2521, test_loss: 1.3040, test_f1: 0.2281
 epoch: 16, train_loss: 1.2532, test_loss: 1.3098, test_f1: 0.2281
 epoch: 17, train_loss: 1.2538, test_loss: 1.3103, test_f1: 0.2281
 epoch: 18, train_loss: 1.2522, test_loss: 1.3049, test_f1: 0.2281
 epoch: 19, train_loss: 1.2550, test_loss: 1.3021, test_f1: 0.2281
 epoch: 20, train_loss: 1.2532, test_loss: 1.3049, test_f1: 0.2281
 epoch: 21, train_loss: 1.2523, test_loss: 1.3066, test_f1: 0.2281
 epoch: 22, train_loss: 1.2533, test_loss: 1.3054, test_f1: 0.2281
 epoch: 23, train_loss: 1.2527, test_loss: 1.3046, test_f1: 0.2281
 epoch: 24, train_loss: 1.2528, test_loss: 1.3038, test_f1: 0.2281
 epoch: 25, train_loss: 1.2527, test_loss: 1.3091, test_f1: 0.2281
 epoch: 26, train_loss: 1.2541, test_loss: 1.3069, test_f1: 0.2281
 epoch: 27, train_loss: 1.2525, test_loss: 1.3031, test_f1: 0.2281
 epoch: 28, train_loss: 1.2520, test_loss: 1.3036, test_f1: 0.2281
 epoch: 29, train_loss: 1.2528, test_loss: 1.3037, test_f1: 0.2281
 epoch: 30, train_loss: 1.2534, test_loss: 1.3042, test_f1: 0.2281
 epoch: 31, train_loss: 1.2528, test_loss: 1.3061, test_f1: 0.2281
 epoch: 32, train_loss: 1.2528, test_loss: 1.3061, test_f1: 0.2281
 epoch: 33, train_loss: 1.2531, test_loss: 1.3074, test_f1: 0.2281
 epoch: 34, train_loss: 1.2525, test_loss: 1.3063, test_f1: 0.2281
 epoch: 35, train_loss: 1.2526, test_loss: 1.3076, test_f1: 0.2281
 epoch: 36, train_loss: 1.2530, test_loss: 1.3028, test_f1: 0.2281
 epoch: 37, train_loss: 1.2521, test_loss: 1.3036, test_f1: 0.2281
 epoch: 38, train_loss: 1.2530, test_loss: 1.3076, test_f1: 0.2281
 epoch: 39, train_loss: 1.2529, test_loss: 1.3084, test_f1: 0.2281
 epoch: 40, train_loss: 1.2524, test_loss: 1.3033, test_f1: 0.2281
 epoch: 41, train_loss: 1.2526, test_loss: 1.3020, test_f1: 0.2281
 epoch: 42, train_loss: 1.2538, test_loss: 1.3075, test_f1: 0.2281
 epoch: 43, train_loss: 1.2524, test_loss: 1.3061, test_f1: 0.2281
 epoch: 44, train_loss: 1.2534, test_loss: 1.3049, test_f1: 0.2281
 epoch: 45, train_loss: 1.2525, test_loss: 1.3050, test_f1: 0.2281
 epoch: 46, train_loss: 1.2553, test_loss: 1.3085, test_f1: 0.2281
 epoch: 47, train_loss: 1.2524, test_loss: 1.3070, test_f1: 0.2281
 epoch: 48, train_loss: 1.2533, test_loss: 1.3107, test_f1: 0.2281
 epoch: 49, train_loss: 1.2531, test_loss: 1.3064, test_f1: 0.2281
 epoch: 50, train_loss: 1.2522, test_loss: 1.3008, test_f1: 0.2281
 epoch: 51, train_loss: 1.2533, test_loss: 1.3017, test_f1: 0.2281
 epoch: 52, train_loss: 1.2530, test_loss: 1.3018, test_f1: 0.2281
 epoch: 53, train_loss: 1.2528, test_loss: 1.3016, test_f1: 0.2281
 epoch: 54, train_loss: 1.2524, test_loss: 1.3034, test_f1: 0.2281
 epoch: 55, train_loss: 1.2523, test_loss: 1.3035, test_f1: 0.2281
 epoch: 56, train_loss: 1.2521, test_loss: 1.3048, test_f1: 0.2281
 epoch: 57, train_loss: 1.2520, test_loss: 1.3041, test_f1: 0.2281
 epoch: 58, train_loss: 1.2522, test_loss: 1.3034, test_f1: 0.2281
 epoch: 59, train_loss: 1.2530, test_loss: 1.3053, test_f1: 0.2281
 epoch: 60, train_loss: 1.2541, test_loss: 1.3069, test_f1: 0.2281
 epoch: 61, train_loss: 1.2526, test_loss: 1.3036, test_f1: 0.2281
 epoch: 62, train_loss: 1.2528, test_loss: 1.3014, test_f1: 0.2281
 epoch: 63, train_loss: 1.2540, test_loss: 1.2997, test_f1: 0.2281
 epoch: 64, train_loss: 1.2544, test_loss: 1.3001, test_f1: 0.2281
 epoch: 65, train_loss: 1.2521, test_loss: 1.3043, test_f1: 0.2281
 epoch: 66, train_loss: 1.2525, test_loss: 1.3078, test_f1: 0.2281
 epoch: 67, train_loss: 1.2526, test_loss: 1.3085, test_f1: 0.2281
 epoch: 68, train_loss: 1.2526, test_loss: 1.3093, test_f1: 0.2281
 epoch: 69, train_loss: 1.2525, test_loss: 1.3082, test_f1: 0.2281
 epoch: 70, train_loss: 1.2524, test_loss: 1.3063, test_f1: 0.2281
 epoch: 71, train_loss: 1.2526, test_loss: 1.3052, test_f1: 0.2281
 epoch: 72, train_loss: 1.2528, test_loss: 1.3051, test_f1: 0.2281
 epoch: 73, train_loss: 1.2520, test_loss: 1.3051, test_f1: 0.2281
 epoch: 74, train_loss: 1.2522, test_loss: 1.3050, test_f1: 0.2281
 epoch: 75, train_loss: 1.2525, test_loss: 1.3069, test_f1: 0.2281
 epoch: 76, train_loss: 1.2523, test_loss: 1.3068, test_f1: 0.2281
 epoch: 77, train_loss: 1.2521, test_loss: 1.3045, test_f1: 0.2281
 epoch: 78, train_loss: 1.2527, test_loss: 1.3005, test_f1: 0.2281
 epoch: 79, train_loss: 1.2530, test_loss: 1.3008, test_f1: 0.2281
 epoch: 80, train_loss: 1.2528, test_loss: 1.3045, test_f1: 0.2281
 epoch: 81, train_loss: 1.2540, test_loss: 1.3060, test_f1: 0.2281
 epoch: 82, train_loss: 1.2525, test_loss: 1.3063, test_f1: 0.2281
 epoch: 83, train_loss: 1.2525, test_loss: 1.3070, test_f1: 0.2281
 epoch: 84, train_loss: 1.2526, test_loss: 1.3070, test_f1: 0.2281
 epoch: 85, train_loss: 1.2525, test_loss: 1.3064, test_f1: 0.2281
 epoch: 86, train_loss: 1.2519, test_loss: 1.3081, test_f1: 0.2281
 epoch: 87, train_loss: 1.2531, test_loss: 1.3092, test_f1: 0.2281
 epoch: 88, train_loss: 1.2525, test_loss: 1.3057, test_f1: 0.2281
 epoch: 89, train_loss: 1.2523, test_loss: 1.3031, test_f1: 0.2281
 epoch: 90, train_loss: 1.2525, test_loss: 1.3010, test_f1: 0.2281
 epoch: 91, train_loss: 1.2523, test_loss: 1.3024, test_f1: 0.2281
 epoch: 92, train_loss: 1.2523, test_loss: 1.3043, test_f1: 0.2281
 epoch: 93, train_loss: 1.2523, test_loss: 1.3043, test_f1: 0.2281
 epoch: 94, train_loss: 1.2523, test_loss: 1.3059, test_f1: 0.2281
 epoch: 95, train_loss: 1.2521, test_loss: 1.3045, test_f1: 0.2281
 epoch: 96, train_loss: 1.2521, test_loss: 1.3030, test_f1: 0.2281
 epoch: 97, train_loss: 1.2528, test_loss: 1.3001, test_f1: 0.2281
 epoch: 98, train_loss: 1.2530, test_loss: 1.2997, test_f1: 0.2281
 epoch: 99, train_loss: 1.2537, test_loss: 1.2993, test_f1: 0.2281
##################ITERATION #3 ****************************************
 epoch: 0, train_loss: 1.2555, test_loss: 1.3217, test_f1: 0.1365
 epoch: 1, train_loss: 1.2617, test_loss: 1.3255, test_f1: 0.1365
 epoch: 2, train_loss: 1.2566, test_loss: 1.3107, test_f1: 0.2281
 epoch: 3, train_loss: 1.2529, test_loss: 1.3024, test_f1: 0.2281
 epoch: 4, train_loss: 1.2532, test_loss: 1.3010, test_f1: 0.2281
 epoch: 5, train_loss: 1.2526, test_loss: 1.3065, test_f1: 0.2281
 epoch: 6, train_loss: 1.2526, test_loss: 1.3100, test_f1: 0.2281
 epoch: 7, train_loss: 1.2525, test_loss: 1.3080, test_f1: 0.2281
 epoch: 8, train_loss: 1.2531, test_loss: 1.3073, test_f1: 0.2281
 epoch: 9, train_loss: 1.2533, test_loss: 1.3028, test_f1: 0.2281
 epoch: 10, train_loss: 1.2528, test_loss: 1.3059, test_f1: 0.2281
 epoch: 11, train_loss: 1.2529, test_loss: 1.3091, test_f1: 0.2281
 epoch: 12, train_loss: 1.2537, test_loss: 1.3074, test_f1: 0.2281
 epoch: 13, train_loss: 1.2543, test_loss: 1.3061, test_f1: 0.2281
 epoch: 14, train_loss: 1.2523, test_loss: 1.3008, test_f1: 0.2281
 epoch: 15, train_loss: 1.2535, test_loss: 1.2991, test_f1: 0.2281
 epoch: 16, train_loss: 1.2530, test_loss: 1.3048, test_f1: 0.2281
 epoch: 17, train_loss: 1.2522, test_loss: 1.3055, test_f1: 0.2281
 epoch: 18, train_loss: 1.2527, test_loss: 1.3009, test_f1: 0.2281
 epoch: 19, train_loss: 1.2534, test_loss: 1.2999, test_f1: 0.2281
 epoch: 20, train_loss: 1.2546, test_loss: 1.3021, test_f1: 0.2281
 epoch: 21, train_loss: 1.2527, test_loss: 1.3069, test_f1: 0.2281
 epoch: 22, train_loss: 1.2539, test_loss: 1.3114, test_f1: 0.2281
 epoch: 23, train_loss: 1.2559, test_loss: 1.3147, test_f1: 0.1365
 epoch: 24, train_loss: 1.2548, test_loss: 1.3086, test_f1: 0.2281
 epoch: 25, train_loss: 1.2531, test_loss: 1.3101, test_f1: 0.2281
 epoch: 26, train_loss: 1.2528, test_loss: 1.3088, test_f1: 0.2281
 epoch: 27, train_loss: 1.2537, test_loss: 1.3033, test_f1: 0.2281
 epoch: 28, train_loss: 1.2526, test_loss: 1.3025, test_f1: 0.2281
 epoch: 29, train_loss: 1.2528, test_loss: 1.3045, test_f1: 0.2281
 epoch: 30, train_loss: 1.2525, test_loss: 1.3025, test_f1: 0.2281
 epoch: 31, train_loss: 1.2522, test_loss: 1.3016, test_f1: 0.2281
 epoch: 32, train_loss: 1.2532, test_loss: 1.3066, test_f1: 0.2281
 epoch: 33, train_loss: 1.2530, test_loss: 1.3080, test_f1: 0.2281
 epoch: 34, train_loss: 1.2527, test_loss: 1.3047, test_f1: 0.2281
 epoch: 35, train_loss: 1.2533, test_loss: 1.3041, test_f1: 0.2281
 epoch: 36, train_loss: 1.2535, test_loss: 1.3079, test_f1: 0.2281
 epoch: 37, train_loss: 1.2529, test_loss: 1.3096, test_f1: 0.2281
 epoch: 38, train_loss: 1.2527, test_loss: 1.3080, test_f1: 0.2281
 epoch: 39, train_loss: 1.2536, test_loss: 1.3049, test_f1: 0.2281
 epoch: 40, train_loss: 1.2527, test_loss: 1.3058, test_f1: 0.2281
 epoch: 41, train_loss: 1.2525, test_loss: 1.3059, test_f1: 0.2281
 epoch: 42, train_loss: 1.2532, test_loss: 1.3072, test_f1: 0.2281
 epoch: 43, train_loss: 1.2528, test_loss: 1.3026, test_f1: 0.2281
 epoch: 44, train_loss: 1.2539, test_loss: 1.3036, test_f1: 0.2281
 epoch: 45, train_loss: 1.2524, test_loss: 1.3041, test_f1: 0.2281
 epoch: 46, train_loss: 1.2525, test_loss: 1.3057, test_f1: 0.2281
 epoch: 47, train_loss: 1.2529, test_loss: 1.3042, test_f1: 0.2281
 epoch: 48, train_loss: 1.2522, test_loss: 1.3060, test_f1: 0.2281
 epoch: 49, train_loss: 1.2529, test_loss: 1.3091, test_f1: 0.2281
 epoch: 50, train_loss: 1.2529, test_loss: 1.3064, test_f1: 0.2281
 epoch: 51, train_loss: 1.2529, test_loss: 1.3055, test_f1: 0.2281
 epoch: 52, train_loss: 1.2527, test_loss: 1.3059, test_f1: 0.2281
 epoch: 53, train_loss: 1.2522, test_loss: 1.3043, test_f1: 0.2281
 epoch: 54, train_loss: 1.2524, test_loss: 1.3030, test_f1: 0.2281
 epoch: 55, train_loss: 1.2524, test_loss: 1.3019, test_f1: 0.2281
 epoch: 56, train_loss: 1.2525, test_loss: 1.3017, test_f1: 0.2281
 epoch: 57, train_loss: 1.2525, test_loss: 1.3014, test_f1: 0.2281
 epoch: 58, train_loss: 1.2529, test_loss: 1.3007, test_f1: 0.2281
 epoch: 59, train_loss: 1.2526, test_loss: 1.3024, test_f1: 0.2281
 epoch: 60, train_loss: 1.2521, test_loss: 1.3059, test_f1: 0.2281
 epoch: 61, train_loss: 1.2522, test_loss: 1.3084, test_f1: 0.2281
 epoch: 62, train_loss: 1.2525, test_loss: 1.3046, test_f1: 0.2281
 epoch: 63, train_loss: 1.2520, test_loss: 1.3022, test_f1: 0.2281
 epoch: 64, train_loss: 1.2523, test_loss: 1.3021, test_f1: 0.2281
 epoch: 65, train_loss: 1.2523, test_loss: 1.3012, test_f1: 0.2281
 epoch: 66, train_loss: 1.2530, test_loss: 1.2998, test_f1: 0.2281
 epoch: 67, train_loss: 1.2527, test_loss: 1.3020, test_f1: 0.2281
 epoch: 68, train_loss: 1.2527, test_loss: 1.3053, test_f1: 0.2281
 epoch: 69, train_loss: 1.2526, test_loss: 1.3066, test_f1: 0.2281
 epoch: 70, train_loss: 1.2527, test_loss: 1.3061, test_f1: 0.2281
 epoch: 71, train_loss: 1.2524, test_loss: 1.3053, test_f1: 0.2281
 epoch: 72, train_loss: 1.2522, test_loss: 1.3049, test_f1: 0.2281
 epoch: 73, train_loss: 1.2522, test_loss: 1.3034, test_f1: 0.2281
 epoch: 74, train_loss: 1.2527, test_loss: 1.3008, test_f1: 0.2281
 epoch: 75, train_loss: 1.2527, test_loss: 1.3032, test_f1: 0.2281
 epoch: 76, train_loss: 1.2532, test_loss: 1.3056, test_f1: 0.2281
 epoch: 77, train_loss: 1.2529, test_loss: 1.3051, test_f1: 0.2281
 epoch: 78, train_loss: 1.2519, test_loss: 1.3048, test_f1: 0.2281
 epoch: 79, train_loss: 1.2521, test_loss: 1.3042, test_f1: 0.2281
 epoch: 80, train_loss: 1.2522, test_loss: 1.3041, test_f1: 0.2281
 epoch: 81, train_loss: 1.2522, test_loss: 1.3032, test_f1: 0.2281
 epoch: 82, train_loss: 1.2522, test_loss: 1.3031, test_f1: 0.2281
 epoch: 83, train_loss: 1.2525, test_loss: 1.3050, test_f1: 0.2281
 epoch: 84, train_loss: 1.2522, test_loss: 1.3058, test_f1: 0.2281
 epoch: 85, train_loss: 1.2526, test_loss: 1.3059, test_f1: 0.2281
 epoch: 86, train_loss: 1.2527, test_loss: 1.3027, test_f1: 0.2281
 epoch: 87, train_loss: 1.2524, test_loss: 1.3028, test_f1: 0.2281
 epoch: 88, train_loss: 1.2526, test_loss: 1.3041, test_f1: 0.2281
 epoch: 89, train_loss: 1.2527, test_loss: 1.3054, test_f1: 0.2281
 epoch: 90, train_loss: 1.2531, test_loss: 1.3063, test_f1: 0.2281
 epoch: 91, train_loss: 1.2529, test_loss: 1.3050, test_f1: 0.2281
 epoch: 92, train_loss: 1.2525, test_loss: 1.3026, test_f1: 0.2281
 epoch: 93, train_loss: 1.2529, test_loss: 1.3014, test_f1: 0.2281
 epoch: 94, train_loss: 1.2530, test_loss: 1.3035, test_f1: 0.2281
 epoch: 95, train_loss: 1.2527, test_loss: 1.3033, test_f1: 0.2281
 epoch: 96, train_loss: 1.2526, test_loss: 1.3036, test_f1: 0.2281
 epoch: 97, train_loss: 1.2523, test_loss: 1.3047, test_f1: 0.2281
 epoch: 98, train_loss: 1.2523, test_loss: 1.3033, test_f1: 0.2281
 epoch: 99, train_loss: 1.2518, test_loss: 1.3031, test_f1: 0.2281
##################ITERATION #4 ****************************************
 epoch: 0, train_loss: 1.2917, test_loss: 3.6775, test_f1: 0.1365
 epoch: 1, train_loss: 1.2591, test_loss: 1.3014, test_f1: 0.2281
 epoch: 2, train_loss: 1.2534, test_loss: 1.3037, test_f1: 0.2281
 epoch: 3, train_loss: 1.2532, test_loss: 1.3054, test_f1: 0.2281
 epoch: 4, train_loss: 1.2540, test_loss: 1.3029, test_f1: 0.2281
 epoch: 5, train_loss: 1.2527, test_loss: 1.3042, test_f1: 0.2281
 epoch: 6, train_loss: 1.2531, test_loss: 1.3051, test_f1: 0.2281
 epoch: 7, train_loss: 1.2537, test_loss: 1.3061, test_f1: 0.2281
 epoch: 8, train_loss: 1.2537, test_loss: 1.3121, test_f1: 0.2281
 epoch: 9, train_loss: 1.2541, test_loss: 1.3094, test_f1: 0.2281
 epoch: 10, train_loss: 1.2536, test_loss: 1.3042, test_f1: 0.2281
 epoch: 11, train_loss: 1.2523, test_loss: 1.3027, test_f1: 0.2281
 epoch: 12, train_loss: 1.2529, test_loss: 1.3027, test_f1: 0.2281
 epoch: 13, train_loss: 1.2529, test_loss: 1.3093, test_f1: 0.2281
 epoch: 14, train_loss: 1.2543, test_loss: 1.3062, test_f1: 0.2281
 epoch: 15, train_loss: 1.2532, test_loss: 1.3051, test_f1: 0.2281
 epoch: 16, train_loss: 1.2526, test_loss: 1.3088, test_f1: 0.2281
 epoch: 17, train_loss: 1.2537, test_loss: 1.3141, test_f1: 0.1365
 epoch: 18, train_loss: 1.2548, test_loss: 1.3080, test_f1: 0.2281
 epoch: 19, train_loss: 1.2525, test_loss: 1.3075, test_f1: 0.2281
 epoch: 20, train_loss: 1.2553, test_loss: 1.3063, test_f1: 0.2281
 epoch: 21, train_loss: 1.2523, test_loss: 1.3050, test_f1: 0.2281
 epoch: 22, train_loss: 1.2533, test_loss: 1.3079, test_f1: 0.2281
 epoch: 23, train_loss: 1.2530, test_loss: 1.3057, test_f1: 0.2281
 epoch: 24, train_loss: 1.2524, test_loss: 1.3035, test_f1: 0.2281
 epoch: 25, train_loss: 1.2527, test_loss: 1.3018, test_f1: 0.2281
 epoch: 26, train_loss: 1.2542, test_loss: 1.3048, test_f1: 0.2281
 epoch: 27, train_loss: 1.2520, test_loss: 1.3104, test_f1: 0.2281
 epoch: 28, train_loss: 1.2535, test_loss: 1.3101, test_f1: 0.2281
 epoch: 29, train_loss: 1.2537, test_loss: 1.3029, test_f1: 0.2281
 epoch: 30, train_loss: 1.2525, test_loss: 1.3024, test_f1: 0.2281
 epoch: 31, train_loss: 1.2569, test_loss: 1.3088, test_f1: 0.1365
 epoch: 32, train_loss: 1.2547, test_loss: 1.3100, test_f1: 0.2281
 epoch: 33, train_loss: 1.2529, test_loss: 1.3081, test_f1: 0.2281
 epoch: 34, train_loss: 1.2527, test_loss: 1.3088, test_f1: 0.2281
 epoch: 35, train_loss: 1.2541, test_loss: 1.3095, test_f1: 0.2281
 epoch: 36, train_loss: 1.2541, test_loss: 1.3032, test_f1: 0.2281
 epoch: 37, train_loss: 1.2523, test_loss: 1.3069, test_f1: 0.2281
 epoch: 38, train_loss: 1.2528, test_loss: 1.3046, test_f1: 0.2281
 epoch: 39, train_loss: 1.2520, test_loss: 1.3032, test_f1: 0.2281
 epoch: 40, train_loss: 1.2527, test_loss: 1.3089, test_f1: 0.2281
 epoch: 41, train_loss: 1.2534, test_loss: 1.3073, test_f1: 0.2281
 epoch: 42, train_loss: 1.2531, test_loss: 1.3040, test_f1: 0.2281
 epoch: 43, train_loss: 1.2528, test_loss: 1.3029, test_f1: 0.2281
 epoch: 44, train_loss: 1.2534, test_loss: 1.3071, test_f1: 0.2281
 epoch: 45, train_loss: 1.2526, test_loss: 1.3068, test_f1: 0.2281
 epoch: 46, train_loss: 1.2520, test_loss: 1.3051, test_f1: 0.2281
 epoch: 47, train_loss: 1.2531, test_loss: 1.3043, test_f1: 0.2281
 epoch: 48, train_loss: 1.2533, test_loss: 1.3036, test_f1: 0.2281
 epoch: 49, train_loss: 1.2551, test_loss: 1.3060, test_f1: 0.2281
 epoch: 50, train_loss: 1.2535, test_loss: 1.3041, test_f1: 0.2281
 epoch: 51, train_loss: 1.2523, test_loss: 1.3044, test_f1: 0.2281
 epoch: 52, train_loss: 1.2523, test_loss: 1.3056, test_f1: 0.2281
 epoch: 53, train_loss: 1.2523, test_loss: 1.3078, test_f1: 0.2281
 epoch: 54, train_loss: 1.2524, test_loss: 1.3102, test_f1: 0.2281
 epoch: 55, train_loss: 1.2529, test_loss: 1.3071, test_f1: 0.2281
 epoch: 56, train_loss: 1.2525, test_loss: 1.3061, test_f1: 0.2281
 epoch: 57, train_loss: 1.2525, test_loss: 1.3056, test_f1: 0.2281
 epoch: 58, train_loss: 1.2523, test_loss: 1.3044, test_f1: 0.2281
 epoch: 59, train_loss: 1.2524, test_loss: 1.3033, test_f1: 0.2281
 epoch: 60, train_loss: 1.2525, test_loss: 1.3018, test_f1: 0.2281
 epoch: 61, train_loss: 1.2524, test_loss: 1.3027, test_f1: 0.2281
 epoch: 62, train_loss: 1.2525, test_loss: 1.3044, test_f1: 0.2281
 epoch: 63, train_loss: 1.2520, test_loss: 1.3067, test_f1: 0.2281
 epoch: 64, train_loss: 1.2520, test_loss: 1.3079, test_f1: 0.2281
 epoch: 65, train_loss: 1.2528, test_loss: 1.3087, test_f1: 0.2281
 epoch: 66, train_loss: 1.2523, test_loss: 1.3040, test_f1: 0.2281
 epoch: 67, train_loss: 1.2521, test_loss: 1.3000, test_f1: 0.2281
 epoch: 68, train_loss: 1.2533, test_loss: 1.2999, test_f1: 0.2281
 epoch: 69, train_loss: 1.2533, test_loss: 1.3021, test_f1: 0.2281
 epoch: 70, train_loss: 1.2521, test_loss: 1.3048, test_f1: 0.2281
 epoch: 71, train_loss: 1.2522, test_loss: 1.3060, test_f1: 0.2281
 epoch: 72, train_loss: 1.2520, test_loss: 1.3048, test_f1: 0.2281
 epoch: 73, train_loss: 1.2523, test_loss: 1.3059, test_f1: 0.2281
 epoch: 74, train_loss: 1.2523, test_loss: 1.3051, test_f1: 0.2281
 epoch: 75, train_loss: 1.2524, test_loss: 1.3070, test_f1: 0.2281
 epoch: 76, train_loss: 1.2524, test_loss: 1.3075, test_f1: 0.2281
 epoch: 77, train_loss: 1.2526, test_loss: 1.3040, test_f1: 0.2281
 epoch: 78, train_loss: 1.2527, test_loss: 1.3012, test_f1: 0.2281
 epoch: 79, train_loss: 1.2532, test_loss: 1.3011, test_f1: 0.2281
 epoch: 80, train_loss: 1.2527, test_loss: 1.3050, test_f1: 0.2281
 epoch: 81, train_loss: 1.2527, test_loss: 1.3066, test_f1: 0.2281
 epoch: 82, train_loss: 1.2529, test_loss: 1.3039, test_f1: 0.2281
 epoch: 83, train_loss: 1.2521, test_loss: 1.3038, test_f1: 0.2281
 epoch: 84, train_loss: 1.2522, test_loss: 1.3027, test_f1: 0.2281
 epoch: 85, train_loss: 1.2524, test_loss: 1.3023, test_f1: 0.2281
 epoch: 86, train_loss: 1.2524, test_loss: 1.3036, test_f1: 0.2281
 epoch: 87, train_loss: 1.2522, test_loss: 1.3053, test_f1: 0.2281
 epoch: 88, train_loss: 1.2523, test_loss: 1.3042, test_f1: 0.2281
 epoch: 89, train_loss: 1.2523, test_loss: 1.3031, test_f1: 0.2281
 epoch: 90, train_loss: 1.2524, test_loss: 1.3024, test_f1: 0.2281
 epoch: 91, train_loss: 1.2524, test_loss: 1.3037, test_f1: 0.2281
 epoch: 92, train_loss: 1.2521, test_loss: 1.3035, test_f1: 0.2281
 epoch: 93, train_loss: 1.2523, test_loss: 1.3037, test_f1: 0.2281
 epoch: 94, train_loss: 1.2526, test_loss: 1.3060, test_f1: 0.2281
 epoch: 95, train_loss: 1.2530, test_loss: 1.3086, test_f1: 0.2281
 epoch: 96, train_loss: 1.2529, test_loss: 1.3077, test_f1: 0.2281
 epoch: 97, train_loss: 1.2526, test_loss: 1.3083, test_f1: 0.2281
 epoch: 98, train_loss: 1.2525, test_loss: 1.3063, test_f1: 0.2281
 epoch: 99, train_loss: 1.2527, test_loss: 1.3054, test_f1: 0.2281
##################ITERATION #5 ****************************************
 epoch: 0, train_loss: 1.2544, test_loss: 1.3129, test_f1: 0.1365
 epoch: 1, train_loss: 1.2554, test_loss: 1.3143, test_f1: 0.2281
 epoch: 2, train_loss: 1.2534, test_loss: 1.3089, test_f1: 0.2281
 epoch: 3, train_loss: 1.2532, test_loss: 2.1806, test_f1: 0.2433
 epoch: 4, train_loss: 1.1902, test_loss: 1.3288, test_f1: 0.3006
 epoch: 5, train_loss: 1.1618, test_loss: 1.1138, test_f1: 0.2474
 epoch: 6, train_loss: 1.1024, test_loss: 1.2959, test_f1: 0.2631
 epoch: 7, train_loss: 1.0580, test_loss: 1.1475, test_f1: 0.3290
 epoch: 8, train_loss: 1.0551, test_loss: 1.1220, test_f1: 0.3395
 epoch: 9, train_loss: 1.0392, test_loss: 1.1661, test_f1: 0.3290
 epoch: 10, train_loss: 1.0400, test_loss: 1.2021, test_f1: 0.3262
 epoch: 11, train_loss: 1.0894, test_loss: 1.1633, test_f1: 0.3406
 epoch: 12, train_loss: 1.0826, test_loss: 1.1904, test_f1: 0.3205
 epoch: 13, train_loss: 1.0794, test_loss: 1.1530, test_f1: 0.3290
 epoch: 14, train_loss: 1.0588, test_loss: 1.1022, test_f1: 0.3461
 epoch: 15, train_loss: 1.0509, test_loss: 1.1651, test_f1: 0.3207
 epoch: 16, train_loss: 1.0337, test_loss: 1.1173, test_f1: 0.3395
 epoch: 17, train_loss: 1.0244, test_loss: 1.1698, test_f1: 0.3234
 epoch: 18, train_loss: 1.0215, test_loss: 1.1770, test_f1: 0.3205
 epoch: 19, train_loss: 1.0344, test_loss: 1.2100, test_f1: 0.3083
 epoch: 20, train_loss: 1.0346, test_loss: 1.1539, test_f1: 0.3317
 epoch: 21, train_loss: 1.0311, test_loss: 1.1686, test_f1: 0.3262
 epoch: 22, train_loss: 1.0279, test_loss: 1.1503, test_f1: 0.3317
 epoch: 23, train_loss: 1.0274, test_loss: 1.1750, test_f1: 0.3290
 epoch: 24, train_loss: 1.0360, test_loss: 1.1330, test_f1: 0.3370
 epoch: 25, train_loss: 1.0240, test_loss: 1.2774, test_f1: 0.2983
 epoch: 26, train_loss: 1.0247, test_loss: 1.1647, test_f1: 0.3290
 epoch: 27, train_loss: 1.0252, test_loss: 1.1647, test_f1: 0.3317
 epoch: 28, train_loss: 1.0171, test_loss: 1.1112, test_f1: 0.3415
 epoch: 29, train_loss: 1.0152, test_loss: 1.1640, test_f1: 0.3317
 epoch: 30, train_loss: 1.0100, test_loss: 1.2292, test_f1: 0.3146
 epoch: 31, train_loss: 1.0239, test_loss: 1.2270, test_f1: 0.3305
 epoch: 32, train_loss: 1.0238, test_loss: 1.1095, test_f1: 0.3376
 epoch: 33, train_loss: 1.0179, test_loss: 1.1554, test_f1: 0.3317
 epoch: 34, train_loss: 1.0081, test_loss: 1.1920, test_f1: 0.3262
 epoch: 35, train_loss: 1.0163, test_loss: 1.2228, test_f1: 0.2196
 epoch: 36, train_loss: 1.0232, test_loss: 1.2703, test_f1: 0.2984
 epoch: 37, train_loss: 1.1399, test_loss: 1.2039, test_f1: 0.3146
 epoch: 38, train_loss: 1.0477, test_loss: 1.1457, test_f1: 0.3336
 epoch: 39, train_loss: 1.0617, test_loss: 15.0663, test_f1: 0.2659
 epoch: 40, train_loss: 1.0780, test_loss: 1.1378, test_f1: 0.3344
 epoch: 41, train_loss: 1.0717, test_loss: 1.1849, test_f1: 0.3176
 epoch: 42, train_loss: 1.0887, test_loss: 1.1061, test_f1: 0.3444
 epoch: 43, train_loss: 1.0754, test_loss: 1.1843, test_f1: 0.3205
 epoch: 44, train_loss: 1.0991, test_loss: 1.2983, test_f1: 0.2675
 epoch: 45, train_loss: 1.0896, test_loss: 1.1692, test_f1: 0.3205
 epoch: 46, train_loss: 1.2328, test_loss: 1.1468, test_f1: 0.3290
 epoch: 47, train_loss: 1.0877, test_loss: 1.1236, test_f1: 0.3370
 epoch: 48, train_loss: 1.0837, test_loss: 1.1345, test_f1: 0.3344
 epoch: 49, train_loss: 1.0673, test_loss: 1.1043, test_f1: 0.3444
 epoch: 50, train_loss: 1.0704, test_loss: 1.1267, test_f1: 0.3395
 epoch: 51, train_loss: 1.0575, test_loss: 1.1269, test_f1: 0.3395
 epoch: 52, train_loss: 1.0623, test_loss: 1.1511, test_f1: 0.3317
 epoch: 53, train_loss: 1.0639, test_loss: 1.1555, test_f1: 0.3290
 epoch: 54, train_loss: 1.0671, test_loss: 1.1522, test_f1: 0.3290
 epoch: 55, train_loss: 1.0605, test_loss: 1.1217, test_f1: 0.3395
 epoch: 56, train_loss: 1.0982, test_loss: 1.2172, test_f1: 0.3018
 epoch: 57, train_loss: 1.1024, test_loss: 1.2502, test_f1: 0.2913
 epoch: 58, train_loss: 1.0752, test_loss: 1.1476, test_f1: 0.3317
 epoch: 59, train_loss: 1.0661, test_loss: 1.1221, test_f1: 0.3395
 epoch: 60, train_loss: 1.0614, test_loss: 1.1192, test_f1: 0.3395
 epoch: 61, train_loss: 1.0573, test_loss: 1.1177, test_f1: 0.3395
 epoch: 62, train_loss: 1.0569, test_loss: 1.1175, test_f1: 0.3395
 epoch: 63, train_loss: 1.0513, test_loss: 1.1521, test_f1: 0.3290
 epoch: 64, train_loss: 1.0795, test_loss: 1.3735, test_f1: 0.2281
 epoch: 65, train_loss: 1.1715, test_loss: 1.3630, test_f1: 0.2281
 epoch: 66, train_loss: 1.2142, test_loss: 1.3420, test_f1: 0.2281
 epoch: 67, train_loss: 1.1632, test_loss: 1.2574, test_f1: 0.2759
 epoch: 68, train_loss: 1.1482, test_loss: 1.1907, test_f1: 0.3083
 epoch: 69, train_loss: 1.1183, test_loss: 1.1449, test_f1: 0.3290
 epoch: 70, train_loss: 1.1078, test_loss: 1.1460, test_f1: 0.3290
 epoch: 71, train_loss: 1.1008, test_loss: 1.1483, test_f1: 0.3290
 epoch: 72, train_loss: 1.0933, test_loss: 1.1482, test_f1: 0.3290
 epoch: 73, train_loss: 1.0933, test_loss: 1.1514, test_f1: 0.3290
 epoch: 74, train_loss: 1.0930, test_loss: 1.1480, test_f1: 0.3290
 epoch: 75, train_loss: 1.0774, test_loss: 1.1463, test_f1: 0.3290
 epoch: 76, train_loss: 1.0631, test_loss: 1.1468, test_f1: 0.3290
 epoch: 77, train_loss: 1.0539, test_loss: 1.1429, test_f1: 0.3317
 epoch: 78, train_loss: 1.0615, test_loss: 1.1452, test_f1: 0.3317
 epoch: 79, train_loss: 1.0510, test_loss: 1.1458, test_f1: 0.3317
 epoch: 80, train_loss: 1.0533, test_loss: 2.0396, test_f1: 0.2402
 epoch: 81, train_loss: 1.2625, test_loss: 1.1562, test_f1: 0.3290
 epoch: 82, train_loss: 1.0651, test_loss: 1.1533, test_f1: 0.3290
 epoch: 83, train_loss: 1.0627, test_loss: 1.1542, test_f1: 0.3290
 epoch: 84, train_loss: 1.0617, test_loss: 1.1570, test_f1: 0.3290
 epoch: 85, train_loss: 1.0642, test_loss: 1.1533, test_f1: 0.3290
 epoch: 86, train_loss: 1.0634, test_loss: 1.1441, test_f1: 0.3317
 epoch: 87, train_loss: 1.0761, test_loss: 1.1539, test_f1: 0.3290
 epoch: 88, train_loss: 1.0650, test_loss: 1.1557, test_f1: 0.3290
 epoch: 89, train_loss: 1.0593, test_loss: 1.1537, test_f1: 0.3290
 epoch: 90, train_loss: 1.0568, test_loss: 1.1530, test_f1: 0.3290
 epoch: 91, train_loss: 1.0572, test_loss: 1.1520, test_f1: 0.3290
 epoch: 92, train_loss: 1.0579, test_loss: 1.1534, test_f1: 0.3290
 epoch: 93, train_loss: 1.0577, test_loss: 1.1543, test_f1: 0.3290
 epoch: 94, train_loss: 1.0506, test_loss: 1.1540, test_f1: 0.3290
 epoch: 95, train_loss: 1.0634, test_loss: 1.1455, test_f1: 0.3317
 epoch: 96, train_loss: 1.0569, test_loss: 1.1539, test_f1: 0.3290
 epoch: 97, train_loss: 1.0680, test_loss: 1.1547, test_f1: 0.3290
 epoch: 98, train_loss: 1.0731, test_loss: 1.1620, test_f1: 0.3262
 epoch: 99, train_loss: 1.0793, test_loss: 1.1653, test_f1: 0.3234
##################ITERATION #6 ****************************************
 epoch: 0, train_loss: 1.3183, test_loss: 1.3361, test_f1: 0.2281
 epoch: 1, train_loss: 1.2719, test_loss: 1.3167, test_f1: 0.2281
 epoch: 2, train_loss: 1.2652, test_loss: 1.3075, test_f1: 0.2281
 epoch: 3, train_loss: 1.2543, test_loss: 1.3063, test_f1: 0.2281
 epoch: 4, train_loss: 1.2546, test_loss: 1.3046, test_f1: 0.2281
 epoch: 5, train_loss: 1.2536, test_loss: 1.3029, test_f1: 0.2281
 epoch: 6, train_loss: 1.2529, test_loss: 1.3017, test_f1: 0.2281
 epoch: 7, train_loss: 1.2526, test_loss: 1.3030, test_f1: 0.2281
 epoch: 8, train_loss: 1.2524, test_loss: 1.3062, test_f1: 0.2281
 epoch: 9, train_loss: 1.2527, test_loss: 1.3041, test_f1: 0.2281
 epoch: 10, train_loss: 1.2521, test_loss: 1.3039, test_f1: 0.2281
 epoch: 11, train_loss: 1.2528, test_loss: 1.3025, test_f1: 0.2281
 epoch: 12, train_loss: 1.2533, test_loss: 1.3054, test_f1: 0.2281
 epoch: 13, train_loss: 1.2525, test_loss: 1.3079, test_f1: 0.2281
 epoch: 14, train_loss: 1.2533, test_loss: 1.3058, test_f1: 0.2281
 epoch: 15, train_loss: 1.2529, test_loss: 1.3058, test_f1: 0.2281
 epoch: 16, train_loss: 1.2526, test_loss: 1.3069, test_f1: 0.2281
 epoch: 17, train_loss: 1.2533, test_loss: 1.3040, test_f1: 0.2281
 epoch: 18, train_loss: 1.2523, test_loss: 1.3035, test_f1: 0.2281
 epoch: 19, train_loss: 1.2533, test_loss: 1.3060, test_f1: 0.2281
 epoch: 20, train_loss: 1.2525, test_loss: 1.3054, test_f1: 0.2281
 epoch: 21, train_loss: 1.2541, test_loss: 1.3096, test_f1: 0.2281
 epoch: 22, train_loss: 1.2541, test_loss: 1.3072, test_f1: 0.2281
 epoch: 23, train_loss: 1.2530, test_loss: 1.3105, test_f1: 0.2281
 epoch: 24, train_loss: 1.2534, test_loss: 1.3056, test_f1: 0.2281
 epoch: 25, train_loss: 1.2536, test_loss: 1.3044, test_f1: 0.2281
 epoch: 26, train_loss: 1.2531, test_loss: 1.3020, test_f1: 0.2281
 epoch: 27, train_loss: 1.2525, test_loss: 1.3024, test_f1: 0.2281
 epoch: 28, train_loss: 1.2532, test_loss: 1.3022, test_f1: 0.2281
 epoch: 29, train_loss: 1.2530, test_loss: 1.3081, test_f1: 0.2281
 epoch: 30, train_loss: 1.2548, test_loss: 1.3134, test_f1: 0.2281
 epoch: 31, train_loss: 1.2542, test_loss: 1.3086, test_f1: 0.2281
 epoch: 32, train_loss: 1.2558, test_loss: 1.3044, test_f1: 0.2281
 epoch: 33, train_loss: 1.2545, test_loss: 1.3035, test_f1: 0.2281
 epoch: 34, train_loss: 1.2522, test_loss: 1.3087, test_f1: 0.2281
 epoch: 35, train_loss: 1.2529, test_loss: 1.3080, test_f1: 0.2281
 epoch: 36, train_loss: 1.2528, test_loss: 1.3041, test_f1: 0.2281
 epoch: 37, train_loss: 1.2522, test_loss: 1.3027, test_f1: 0.2281
 epoch: 38, train_loss: 1.2531, test_loss: 1.3049, test_f1: 0.2281
 epoch: 39, train_loss: 1.2525, test_loss: 1.3052, test_f1: 0.2281
 epoch: 40, train_loss: 1.2522, test_loss: 1.3057, test_f1: 0.2281
 epoch: 41, train_loss: 1.2547, test_loss: 1.3031, test_f1: 0.2281
 epoch: 42, train_loss: 1.2531, test_loss: 1.3059, test_f1: 0.2281
 epoch: 43, train_loss: 1.2523, test_loss: 1.3086, test_f1: 0.2281
 epoch: 44, train_loss: 1.2525, test_loss: 1.3082, test_f1: 0.2281
 epoch: 45, train_loss: 1.2527, test_loss: 1.3117, test_f1: 0.2281
 epoch: 46, train_loss: 1.2548, test_loss: 1.3130, test_f1: 0.2281
 epoch: 47, train_loss: 1.2553, test_loss: 1.3090, test_f1: 0.2281
 epoch: 48, train_loss: 1.2531, test_loss: 1.3021, test_f1: 0.2281
 epoch: 49, train_loss: 1.2528, test_loss: 1.3033, test_f1: 0.2281
 epoch: 50, train_loss: 1.2525, test_loss: 1.3061, test_f1: 0.2281
 epoch: 51, train_loss: 1.2527, test_loss: 1.3058, test_f1: 0.2281
 epoch: 52, train_loss: 1.2527, test_loss: 1.3037, test_f1: 0.2281
 epoch: 53, train_loss: 1.2527, test_loss: 1.3045, test_f1: 0.2281
 epoch: 54, train_loss: 1.2522, test_loss: 1.3028, test_f1: 0.2281
 epoch: 55, train_loss: 1.2528, test_loss: 1.3017, test_f1: 0.2281
 epoch: 56, train_loss: 1.2533, test_loss: 1.3028, test_f1: 0.2281
 epoch: 57, train_loss: 1.2545, test_loss: 1.3044, test_f1: 0.2281
 epoch: 58, train_loss: 1.2544, test_loss: 1.3047, test_f1: 0.2281
 epoch: 59, train_loss: 1.2523, test_loss: 1.3076, test_f1: 0.2281
 epoch: 60, train_loss: 1.2523, test_loss: 1.3081, test_f1: 0.2281
 epoch: 61, train_loss: 1.2525, test_loss: 1.3080, test_f1: 0.2281
 epoch: 62, train_loss: 1.2523, test_loss: 1.3070, test_f1: 0.2281
 epoch: 63, train_loss: 1.2522, test_loss: 1.3038, test_f1: 0.2281
 epoch: 64, train_loss: 1.2523, test_loss: 1.3025, test_f1: 0.2281
 epoch: 65, train_loss: 1.2525, test_loss: 1.3056, test_f1: 0.2281
 epoch: 66, train_loss: 1.2522, test_loss: 1.3077, test_f1: 0.2281
 epoch: 67, train_loss: 1.2528, test_loss: 1.3092, test_f1: 0.2281
 epoch: 68, train_loss: 1.2531, test_loss: 1.3089, test_f1: 0.2281
 epoch: 69, train_loss: 1.2527, test_loss: 1.3078, test_f1: 0.2281
 epoch: 70, train_loss: 1.2535, test_loss: 1.3087, test_f1: 0.2281
 epoch: 71, train_loss: 1.2529, test_loss: 1.3067, test_f1: 0.2281
 epoch: 72, train_loss: 1.2522, test_loss: 1.3055, test_f1: 0.2281
 epoch: 73, train_loss: 1.2525, test_loss: 1.3064, test_f1: 0.2281
 epoch: 74, train_loss: 1.2524, test_loss: 1.3062, test_f1: 0.2281
 epoch: 75, train_loss: 1.2522, test_loss: 1.3063, test_f1: 0.2281
 epoch: 76, train_loss: 1.2522, test_loss: 1.3080, test_f1: 0.2281
 epoch: 77, train_loss: 1.2526, test_loss: 1.3097, test_f1: 0.2281
 epoch: 78, train_loss: 1.2528, test_loss: 1.3087, test_f1: 0.2281
 epoch: 79, train_loss: 1.2530, test_loss: 1.3079, test_f1: 0.2281
 epoch: 80, train_loss: 1.2523, test_loss: 1.3059, test_f1: 0.2281
 epoch: 81, train_loss: 1.2522, test_loss: 1.3050, test_f1: 0.2281
 epoch: 82, train_loss: 1.2522, test_loss: 1.3058, test_f1: 0.2281
 epoch: 83, train_loss: 1.2523, test_loss: 1.3040, test_f1: 0.2281
 epoch: 84, train_loss: 1.2522, test_loss: 1.3025, test_f1: 0.2281
 epoch: 85, train_loss: 1.2523, test_loss: 1.3037, test_f1: 0.2281
 epoch: 86, train_loss: 1.2524, test_loss: 1.3049, test_f1: 0.2281
 epoch: 87, train_loss: 1.2522, test_loss: 1.3075, test_f1: 0.2281
 epoch: 88, train_loss: 1.2524, test_loss: 1.3074, test_f1: 0.2281
 epoch: 89, train_loss: 1.2525, test_loss: 1.3087, test_f1: 0.2281
 epoch: 90, train_loss: 1.2530, test_loss: 1.3093, test_f1: 0.2281
 epoch: 91, train_loss: 1.2527, test_loss: 1.3059, test_f1: 0.2281
 epoch: 92, train_loss: 1.2522, test_loss: 1.3021, test_f1: 0.2281
 epoch: 93, train_loss: 1.2526, test_loss: 1.3026, test_f1: 0.2281
 epoch: 94, train_loss: 1.2524, test_loss: 1.3021, test_f1: 0.2281
 epoch: 95, train_loss: 1.2528, test_loss: 1.3021, test_f1: 0.2281
 epoch: 96, train_loss: 1.2524, test_loss: 1.3033, test_f1: 0.2281
 epoch: 97, train_loss: 1.2520, test_loss: 1.3074, test_f1: 0.2281
 epoch: 98, train_loss: 1.2524, test_loss: 1.3077, test_f1: 0.2281
 epoch: 99, train_loss: 1.2524, test_loss: 1.3060, test_f1: 0.2281
##################ITERATION #7 ****************************************
 epoch: 0, train_loss: 1.2546, test_loss: 1.3111, test_f1: 0.2281
 epoch: 1, train_loss: 1.2546, test_loss: 1.3146, test_f1: 0.2281
 epoch: 2, train_loss: 1.2533, test_loss: 1.3075, test_f1: 0.2281
 epoch: 3, train_loss: 1.2552, test_loss: 1.3023, test_f1: 0.2281
 epoch: 4, train_loss: 1.2528, test_loss: 1.3039, test_f1: 0.2281
 epoch: 5, train_loss: 1.2530, test_loss: 1.3020, test_f1: 0.2281
 epoch: 6, train_loss: 1.2532, test_loss: 1.3031, test_f1: 0.2281
 epoch: 7, train_loss: 1.2528, test_loss: 1.3016, test_f1: 0.2281
 epoch: 8, train_loss: 1.2530, test_loss: 1.3024, test_f1: 0.2281
 epoch: 9, train_loss: 1.2521, test_loss: 1.3034, test_f1: 0.2281
 epoch: 10, train_loss: 1.2531, test_loss: 1.3010, test_f1: 0.2281
 epoch: 11, train_loss: 1.2539, test_loss: 1.2995, test_f1: 0.2281
 epoch: 12, train_loss: 1.2537, test_loss: 1.3007, test_f1: 0.2281
 epoch: 13, train_loss: 1.2528, test_loss: 1.3060, test_f1: 0.2281
 epoch: 14, train_loss: 1.2522, test_loss: 1.3083, test_f1: 0.2281
 epoch: 15, train_loss: 1.2530, test_loss: 1.3064, test_f1: 0.2281
 epoch: 16, train_loss: 1.2526, test_loss: 1.3058, test_f1: 0.2281
 epoch: 17, train_loss: 1.2527, test_loss: 1.3064, test_f1: 0.2281
 epoch: 18, train_loss: 1.2537, test_loss: 1.3106, test_f1: 0.2281
 epoch: 19, train_loss: 1.2533, test_loss: 1.3077, test_f1: 0.2281
 epoch: 20, train_loss: 1.2533, test_loss: 1.3011, test_f1: 0.2281
 epoch: 21, train_loss: 1.2537, test_loss: 1.2991, test_f1: 0.2281
 epoch: 22, train_loss: 1.2533, test_loss: 1.3032, test_f1: 0.2281
 epoch: 23, train_loss: 1.2524, test_loss: 1.3071, test_f1: 0.2281
 epoch: 24, train_loss: 1.2531, test_loss: 1.3083, test_f1: 0.2281
 epoch: 25, train_loss: 1.2527, test_loss: 1.3062, test_f1: 0.2281
 epoch: 26, train_loss: 1.2533, test_loss: 1.3066, test_f1: 0.2281
 epoch: 27, train_loss: 1.2523, test_loss: 1.3026, test_f1: 0.2281
 epoch: 28, train_loss: 1.2531, test_loss: 1.3042, test_f1: 0.2281
 epoch: 29, train_loss: 1.2529, test_loss: 1.3051, test_f1: 0.2281
 epoch: 30, train_loss: 1.2522, test_loss: 1.3071, test_f1: 0.2281
 epoch: 31, train_loss: 1.2524, test_loss: 1.3091, test_f1: 0.2281
 epoch: 32, train_loss: 1.2533, test_loss: 1.3065, test_f1: 0.2281
 epoch: 33, train_loss: 1.2528, test_loss: 1.3053, test_f1: 0.2281
 epoch: 34, train_loss: 1.2530, test_loss: 1.3041, test_f1: 0.2281
 epoch: 35, train_loss: 1.2530, test_loss: 1.3077, test_f1: 0.2281
 epoch: 36, train_loss: 1.2524, test_loss: 1.3097, test_f1: 0.2281
 epoch: 37, train_loss: 1.2543, test_loss: 1.3045, test_f1: 0.2281
 epoch: 38, train_loss: 1.2536, test_loss: 1.3061, test_f1: 0.2281
 epoch: 39, train_loss: 1.2530, test_loss: 1.3022, test_f1: 0.2281
 epoch: 40, train_loss: 1.2539, test_loss: 1.3035, test_f1: 0.2281
 epoch: 41, train_loss: 1.2535, test_loss: 1.3026, test_f1: 0.2281
 epoch: 42, train_loss: 1.2523, test_loss: 1.3063, test_f1: 0.2281
 epoch: 43, train_loss: 1.2525, test_loss: 1.3083, test_f1: 0.2281
 epoch: 44, train_loss: 1.2527, test_loss: 1.3054, test_f1: 0.2281
 epoch: 45, train_loss: 1.2522, test_loss: 1.3037, test_f1: 0.2281
 epoch: 46, train_loss: 1.2522, test_loss: 1.3083, test_f1: 0.2281
 epoch: 47, train_loss: 1.2530, test_loss: 1.3083, test_f1: 0.2281
 epoch: 48, train_loss: 1.2528, test_loss: 1.3054, test_f1: 0.2281
 epoch: 49, train_loss: 1.2523, test_loss: 1.3069, test_f1: 0.2281
 epoch: 50, train_loss: 1.2527, test_loss: 1.3072, test_f1: 0.2281
 epoch: 51, train_loss: 1.2526, test_loss: 1.3080, test_f1: 0.2281
 epoch: 52, train_loss: 1.2525, test_loss: 1.3079, test_f1: 0.2281
 epoch: 53, train_loss: 1.2524, test_loss: 1.3057, test_f1: 0.2281
 epoch: 54, train_loss: 1.2527, test_loss: 1.3070, test_f1: 0.2281
 epoch: 55, train_loss: 1.2534, test_loss: 1.3067, test_f1: 0.2281
 epoch: 56, train_loss: 1.2520, test_loss: 1.3077, test_f1: 0.2281
 epoch: 57, train_loss: 1.2529, test_loss: 1.3077, test_f1: 0.2281
 epoch: 58, train_loss: 1.2533, test_loss: 1.3033, test_f1: 0.2281
 epoch: 59, train_loss: 1.2526, test_loss: 1.3025, test_f1: 0.2281
 epoch: 60, train_loss: 1.2522, test_loss: 1.3047, test_f1: 0.2281
 epoch: 61, train_loss: 1.2526, test_loss: 1.3065, test_f1: 0.2281
 epoch: 62, train_loss: 1.2528, test_loss: 1.3062, test_f1: 0.2281
 epoch: 63, train_loss: 1.2521, test_loss: 1.3059, test_f1: 0.2281
 epoch: 64, train_loss: 1.2527, test_loss: 1.3046, test_f1: 0.2281
 epoch: 65, train_loss: 1.2525, test_loss: 1.3041, test_f1: 0.2281
 epoch: 66, train_loss: 1.2525, test_loss: 1.3044, test_f1: 0.2281
 epoch: 67, train_loss: 1.2521, test_loss: 1.3047, test_f1: 0.2281
 epoch: 68, train_loss: 1.2520, test_loss: 1.3031, test_f1: 0.2281
 epoch: 69, train_loss: 1.2527, test_loss: 1.3027, test_f1: 0.2281
 epoch: 70, train_loss: 1.2522, test_loss: 1.3026, test_f1: 0.2281
 epoch: 71, train_loss: 1.2529, test_loss: 1.3036, test_f1: 0.2281
 epoch: 72, train_loss: 1.2533, test_loss: 1.3060, test_f1: 0.2281
 epoch: 73, train_loss: 1.2524, test_loss: 1.3071, test_f1: 0.2281
 epoch: 74, train_loss: 1.2520, test_loss: 1.3059, test_f1: 0.2281
 epoch: 75, train_loss: 1.2521, test_loss: 1.3036, test_f1: 0.2281
 epoch: 76, train_loss: 1.2522, test_loss: 1.3032, test_f1: 0.2281
 epoch: 77, train_loss: 1.2524, test_loss: 1.3045, test_f1: 0.2281
 epoch: 78, train_loss: 1.2522, test_loss: 1.3053, test_f1: 0.2281
 epoch: 79, train_loss: 1.2523, test_loss: 1.3076, test_f1: 0.2281
 epoch: 80, train_loss: 1.2524, test_loss: 1.3064, test_f1: 0.2281
 epoch: 81, train_loss: 1.2522, test_loss: 1.3060, test_f1: 0.2281
 epoch: 82, train_loss: 1.2521, test_loss: 1.3045, test_f1: 0.2281
 epoch: 83, train_loss: 1.2527, test_loss: 1.3040, test_f1: 0.2281
 epoch: 84, train_loss: 1.2523, test_loss: 1.3034, test_f1: 0.2281
 epoch: 85, train_loss: 1.2527, test_loss: 1.3057, test_f1: 0.2281
 epoch: 86, train_loss: 1.2530, test_loss: 1.3049, test_f1: 0.2281
 epoch: 87, train_loss: 1.2532, test_loss: 1.3057, test_f1: 0.2281
 epoch: 88, train_loss: 1.2524, test_loss: 1.3066, test_f1: 0.2281
 epoch: 89, train_loss: 1.2521, test_loss: 1.3053, test_f1: 0.2281
 epoch: 90, train_loss: 1.2529, test_loss: 1.3038, test_f1: 0.2281
 epoch: 91, train_loss: 1.2527, test_loss: 1.3083, test_f1: 0.2281
 epoch: 92, train_loss: 1.2533, test_loss: 1.3083, test_f1: 0.2281
 epoch: 93, train_loss: 1.2528, test_loss: 1.3068, test_f1: 0.2281
 epoch: 94, train_loss: 1.2524, test_loss: 1.3061, test_f1: 0.2281
 epoch: 95, train_loss: 1.2522, test_loss: 1.3030, test_f1: 0.2281
 epoch: 96, train_loss: 1.2522, test_loss: 1.3024, test_f1: 0.2281
 epoch: 97, train_loss: 1.2523, test_loss: 1.3042, test_f1: 0.2281
 epoch: 98, train_loss: 1.2523, test_loss: 1.3075, test_f1: 0.2281
 epoch: 99, train_loss: 1.2528, test_loss: 1.3090, test_f1: 0.2281
##################ITERATION #8 ****************************************
 epoch: 0, train_loss: 1.2592, test_loss: 13.3383, test_f1: 0.2281
 epoch: 1, train_loss: 1.4340, test_loss: 1.3047, test_f1: 0.2281
 epoch: 2, train_loss: 1.2519, test_loss: 1.3048, test_f1: 0.2281
 epoch: 3, train_loss: 1.2545, test_loss: 1.3073, test_f1: 0.2281
 epoch: 4, train_loss: 1.2529, test_loss: 1.3064, test_f1: 0.2281
 epoch: 5, train_loss: 1.2528, test_loss: 1.3047, test_f1: 0.2281
 epoch: 6, train_loss: 1.2523, test_loss: 1.3015, test_f1: 0.2281
 epoch: 7, train_loss: 1.2534, test_loss: 1.3005, test_f1: 0.2281
 epoch: 8, train_loss: 1.2537, test_loss: 1.2996, test_f1: 0.2281
 epoch: 9, train_loss: 1.2525, test_loss: 1.3053, test_f1: 0.2281
 epoch: 10, train_loss: 1.2521, test_loss: 1.3099, test_f1: 0.2281
 epoch: 11, train_loss: 1.2541, test_loss: 1.3111, test_f1: 0.2281
 epoch: 12, train_loss: 1.2531, test_loss: 1.3026, test_f1: 0.2281
 epoch: 13, train_loss: 1.2532, test_loss: 1.3010, test_f1: 0.2281
 epoch: 14, train_loss: 1.2523, test_loss: 1.3060, test_f1: 0.2281
 epoch: 15, train_loss: 1.2553, test_loss: 1.3100, test_f1: 0.2281
 epoch: 16, train_loss: 1.2532, test_loss: 1.3050, test_f1: 0.2281
 epoch: 17, train_loss: 1.2521, test_loss: 1.3004, test_f1: 0.2281
 epoch: 18, train_loss: 1.2536, test_loss: 1.3029, test_f1: 0.2281
 epoch: 19, train_loss: 1.2530, test_loss: 1.3075, test_f1: 0.2281
 epoch: 20, train_loss: 1.2528, test_loss: 1.3126, test_f1: 0.2281
 epoch: 21, train_loss: 1.2553, test_loss: 1.3150, test_f1: 0.2281
 epoch: 22, train_loss: 1.2538, test_loss: 1.3067, test_f1: 0.2281
 epoch: 23, train_loss: 1.2526, test_loss: 1.3030, test_f1: 0.2281
 epoch: 24, train_loss: 1.2533, test_loss: 1.3042, test_f1: 0.2281
 epoch: 25, train_loss: 1.2527, test_loss: 1.3031, test_f1: 0.2281
 epoch: 26, train_loss: 1.2526, test_loss: 1.3035, test_f1: 0.2281
 epoch: 27, train_loss: 1.2521, test_loss: 1.3067, test_f1: 0.2281
 epoch: 28, train_loss: 1.2526, test_loss: 1.3043, test_f1: 0.2281
 epoch: 29, train_loss: 1.2533, test_loss: 1.3003, test_f1: 0.2281
 epoch: 30, train_loss: 1.2542, test_loss: 1.3083, test_f1: 0.2281
 epoch: 31, train_loss: 1.2526, test_loss: 1.3098, test_f1: 0.2281
 epoch: 32, train_loss: 1.2536, test_loss: 1.3103, test_f1: 0.2281
 epoch: 33, train_loss: 1.2531, test_loss: 1.3042, test_f1: 0.2281
 epoch: 34, train_loss: 1.2529, test_loss: 1.3012, test_f1: 0.2281
 epoch: 35, train_loss: 1.2524, test_loss: 1.3039, test_f1: 0.2281
 epoch: 36, train_loss: 1.2529, test_loss: 1.3064, test_f1: 0.2281
 epoch: 37, train_loss: 1.2531, test_loss: 1.3076, test_f1: 0.2281
 epoch: 38, train_loss: 1.2523, test_loss: 1.3088, test_f1: 0.2281
 epoch: 39, train_loss: 1.2528, test_loss: 1.3052, test_f1: 0.2281
 epoch: 40, train_loss: 1.2521, test_loss: 1.3032, test_f1: 0.2281
 epoch: 41, train_loss: 1.2526, test_loss: 1.3048, test_f1: 0.2281
 epoch: 42, train_loss: 1.2537, test_loss: 1.3059, test_f1: 0.2281
 epoch: 43, train_loss: 1.2539, test_loss: 1.3154, test_f1: 0.1365
 epoch: 44, train_loss: 1.2575, test_loss: 1.3112, test_f1: 0.2281
 epoch: 45, train_loss: 1.2528, test_loss: 1.3044, test_f1: 0.2281
 epoch: 46, train_loss: 1.2533, test_loss: 1.3040, test_f1: 0.2281
 epoch: 47, train_loss: 1.2530, test_loss: 1.3055, test_f1: 0.2281
 epoch: 48, train_loss: 1.2533, test_loss: 1.3098, test_f1: 0.2281
 epoch: 49, train_loss: 1.2532, test_loss: 1.3094, test_f1: 0.2281
 epoch: 50, train_loss: 1.2522, test_loss: 1.3047, test_f1: 0.2281
 epoch: 51, train_loss: 1.2521, test_loss: 1.3046, test_f1: 0.2281
 epoch: 52, train_loss: 1.2531, test_loss: 1.3054, test_f1: 0.2281
 epoch: 53, train_loss: 1.2527, test_loss: 1.3045, test_f1: 0.2281
 epoch: 54, train_loss: 1.2518, test_loss: 1.3040, test_f1: 0.2281
 epoch: 55, train_loss: 1.2525, test_loss: 1.3026, test_f1: 0.2281
 epoch: 56, train_loss: 1.2525, test_loss: 1.3023, test_f1: 0.2281
 epoch: 57, train_loss: 1.2528, test_loss: 1.3032, test_f1: 0.2281
 epoch: 58, train_loss: 1.2525, test_loss: 1.3041, test_f1: 0.2281
 epoch: 59, train_loss: 1.2522, test_loss: 1.3058, test_f1: 0.2281
 epoch: 60, train_loss: 1.2521, test_loss: 1.3061, test_f1: 0.2281
 epoch: 61, train_loss: 1.2524, test_loss: 1.3041, test_f1: 0.2281
 epoch: 62, train_loss: 1.2529, test_loss: 1.3027, test_f1: 0.2281
 epoch: 63, train_loss: 1.2526, test_loss: 1.3038, test_f1: 0.2281
 epoch: 64, train_loss: 1.2523, test_loss: 1.3035, test_f1: 0.2281
 epoch: 65, train_loss: 1.2521, test_loss: 1.3027, test_f1: 0.2281
 epoch: 66, train_loss: 1.2522, test_loss: 1.3026, test_f1: 0.2281
 epoch: 67, train_loss: 1.2522, test_loss: 1.3024, test_f1: 0.2281
 epoch: 68, train_loss: 1.2526, test_loss: 1.3039, test_f1: 0.2281
 epoch: 69, train_loss: 1.2527, test_loss: 1.3044, test_f1: 0.2281
 epoch: 70, train_loss: 1.2522, test_loss: 1.3063, test_f1: 0.2281
 epoch: 71, train_loss: 1.2528, test_loss: 1.3074, test_f1: 0.2281
 epoch: 72, train_loss: 1.2532, test_loss: 1.3082, test_f1: 0.2281
 epoch: 73, train_loss: 1.2521, test_loss: 1.3058, test_f1: 0.2281
 epoch: 74, train_loss: 1.2523, test_loss: 1.3066, test_f1: 0.2281
 epoch: 75, train_loss: 1.2530, test_loss: 1.3053, test_f1: 0.2281
 epoch: 76, train_loss: 1.2528, test_loss: 1.3037, test_f1: 0.2281
 epoch: 77, train_loss: 1.2526, test_loss: 1.3066, test_f1: 0.2281
 epoch: 78, train_loss: 1.2528, test_loss: 1.3086, test_f1: 0.2281
 epoch: 79, train_loss: 1.2532, test_loss: 1.3101, test_f1: 0.2281
 epoch: 80, train_loss: 1.2530, test_loss: 1.3063, test_f1: 0.2281
 epoch: 81, train_loss: 1.2524, test_loss: 1.3052, test_f1: 0.2281
 epoch: 82, train_loss: 1.2523, test_loss: 1.3052, test_f1: 0.2281
 epoch: 83, train_loss: 1.2523, test_loss: 1.3053, test_f1: 0.2281
 epoch: 84, train_loss: 1.2534, test_loss: 1.3022, test_f1: 0.2281
 epoch: 85, train_loss: 1.2527, test_loss: 1.3006, test_f1: 0.2281
 epoch: 86, train_loss: 1.2527, test_loss: 1.3042, test_f1: 0.2281
 epoch: 87, train_loss: 1.2531, test_loss: 1.3067, test_f1: 0.2281
 epoch: 88, train_loss: 1.2527, test_loss: 1.3075, test_f1: 0.2281
 epoch: 89, train_loss: 1.2524, test_loss: 1.3097, test_f1: 0.2281
 epoch: 90, train_loss: 1.2530, test_loss: 1.3082, test_f1: 0.2281
 epoch: 91, train_loss: 1.2522, test_loss: 1.3045, test_f1: 0.2281
 epoch: 92, train_loss: 1.2521, test_loss: 1.3034, test_f1: 0.2281
 epoch: 93, train_loss: 1.2525, test_loss: 1.3025, test_f1: 0.2281
 epoch: 94, train_loss: 1.2524, test_loss: 1.3041, test_f1: 0.2281
 epoch: 95, train_loss: 1.2522, test_loss: 1.3035, test_f1: 0.2281
 epoch: 96, train_loss: 1.2523, test_loss: 1.3028, test_f1: 0.2281
 epoch: 97, train_loss: 1.2522, test_loss: 1.3047, test_f1: 0.2281
 epoch: 98, train_loss: 1.2522, test_loss: 1.3068, test_f1: 0.2281
 epoch: 99, train_loss: 1.2522, test_loss: 1.3060, test_f1: 0.2281
##################ITERATION #9 ****************************************
 epoch: 0, train_loss: 1.2599, test_loss: 1.3013, test_f1: 0.2281
 epoch: 1, train_loss: 1.2554, test_loss: 1.3088, test_f1: 0.2281
 epoch: 2, train_loss: 1.2544, test_loss: 1.3085, test_f1: 0.2281
 epoch: 3, train_loss: 1.2529, test_loss: 1.3089, test_f1: 0.2281
 epoch: 4, train_loss: 1.2528, test_loss: 1.3036, test_f1: 0.2281
 epoch: 5, train_loss: 1.2530, test_loss: 1.3024, test_f1: 0.2281
 epoch: 6, train_loss: 1.2524, test_loss: 1.3025, test_f1: 0.2281
 epoch: 7, train_loss: 1.2523, test_loss: 1.3062, test_f1: 0.2281
 epoch: 8, train_loss: 1.2530, test_loss: 1.3074, test_f1: 0.2281
 epoch: 9, train_loss: 1.2525, test_loss: 1.3029, test_f1: 0.2281
 epoch: 10, train_loss: 1.2523, test_loss: 1.3047, test_f1: 0.2281
 epoch: 11, train_loss: 1.2524, test_loss: 1.3041, test_f1: 0.2281
 epoch: 12, train_loss: 1.2525, test_loss: 1.3031, test_f1: 0.2281
 epoch: 13, train_loss: 1.2536, test_loss: 1.3010, test_f1: 0.2281
 epoch: 14, train_loss: 1.2550, test_loss: 1.3005, test_f1: 0.2281
 epoch: 15, train_loss: 1.2542, test_loss: 1.3026, test_f1: 0.2281
 epoch: 16, train_loss: 1.2539, test_loss: 1.3097, test_f1: 0.2281
 epoch: 17, train_loss: 1.2534, test_loss: 1.3097, test_f1: 0.2281
 epoch: 18, train_loss: 1.2531, test_loss: 1.3123, test_f1: 0.2281
 epoch: 19, train_loss: 1.2537, test_loss: 1.3063, test_f1: 0.2281
 epoch: 20, train_loss: 1.2527, test_loss: 1.3034, test_f1: 0.2281
 epoch: 21, train_loss: 1.2547, test_loss: 1.3095, test_f1: 0.2281
 epoch: 22, train_loss: 1.2540, test_loss: 1.3117, test_f1: 0.2281
 epoch: 23, train_loss: 1.2537, test_loss: 1.3051, test_f1: 0.2281
 epoch: 24, train_loss: 1.2524, test_loss: 1.3020, test_f1: 0.2281
 epoch: 25, train_loss: 1.2525, test_loss: 1.3048, test_f1: 0.2281
 epoch: 26, train_loss: 1.2522, test_loss: 1.3061, test_f1: 0.2281
 epoch: 27, train_loss: 1.2529, test_loss: 1.3072, test_f1: 0.2281
 epoch: 28, train_loss: 1.2531, test_loss: 1.3072, test_f1: 0.2281
 epoch: 29, train_loss: 1.2533, test_loss: 1.3043, test_f1: 0.2281
 epoch: 30, train_loss: 1.2529, test_loss: 1.3032, test_f1: 0.2281
 epoch: 31, train_loss: 1.2523, test_loss: 1.3050, test_f1: 0.2281
 epoch: 32, train_loss: 1.2525, test_loss: 1.3070, test_f1: 0.2281
 epoch: 33, train_loss: 1.2537, test_loss: 1.3101, test_f1: 0.2281
 epoch: 34, train_loss: 1.2530, test_loss: 1.3035, test_f1: 0.2281
 epoch: 35, train_loss: 1.2531, test_loss: 1.3078, test_f1: 0.2281
 epoch: 36, train_loss: 1.2533, test_loss: 1.3067, test_f1: 0.2281
 epoch: 37, train_loss: 1.2529, test_loss: 1.3057, test_f1: 0.2281
 epoch: 38, train_loss: 1.2527, test_loss: 1.3040, test_f1: 0.2281
 epoch: 39, train_loss: 1.2533, test_loss: 1.3052, test_f1: 0.2281
 epoch: 40, train_loss: 1.2524, test_loss: 1.3052, test_f1: 0.2281
 epoch: 41, train_loss: 1.2530, test_loss: 1.3091, test_f1: 0.2281
 epoch: 42, train_loss: 1.2540, test_loss: 1.3064, test_f1: 0.2281
 epoch: 43, train_loss: 1.2545, test_loss: 1.3120, test_f1: 0.2281
 epoch: 44, train_loss: 1.2527, test_loss: 1.3030, test_f1: 0.2281
 epoch: 45, train_loss: 1.2525, test_loss: 1.3011, test_f1: 0.2281
 epoch: 46, train_loss: 1.2529, test_loss: 1.3011, test_f1: 0.2281
 epoch: 47, train_loss: 1.2525, test_loss: 1.3039, test_f1: 0.2281
 epoch: 48, train_loss: 1.2521, test_loss: 1.3064, test_f1: 0.2281
 epoch: 49, train_loss: 1.2531, test_loss: 1.3100, test_f1: 0.2281
 epoch: 50, train_loss: 1.2531, test_loss: 1.3103, test_f1: 0.2281
 epoch: 51, train_loss: 1.2529, test_loss: 1.3098, test_f1: 0.2281
 epoch: 52, train_loss: 1.2526, test_loss: 1.3095, test_f1: 0.2281
 epoch: 53, train_loss: 1.2532, test_loss: 1.3088, test_f1: 0.2281
 epoch: 54, train_loss: 1.2526, test_loss: 1.3051, test_f1: 0.2281
 epoch: 55, train_loss: 1.2526, test_loss: 1.3033, test_f1: 0.2281
 epoch: 56, train_loss: 1.2527, test_loss: 1.3033, test_f1: 0.2281
 epoch: 57, train_loss: 1.2521, test_loss: 1.3035, test_f1: 0.2281
 epoch: 58, train_loss: 1.2540, test_loss: 1.3049, test_f1: 0.2281
 epoch: 59, train_loss: 1.2539, test_loss: 1.3032, test_f1: 0.2281
 epoch: 60, train_loss: 1.2527, test_loss: 1.3018, test_f1: 0.2281
 epoch: 61, train_loss: 1.2521, test_loss: 1.3034, test_f1: 0.2281
 epoch: 62, train_loss: 1.2525, test_loss: 1.3057, test_f1: 0.2281
 epoch: 63, train_loss: 1.2531, test_loss: 1.3052, test_f1: 0.2281
 epoch: 64, train_loss: 1.2523, test_loss: 1.3043, test_f1: 0.2281
 epoch: 65, train_loss: 1.2522, test_loss: 1.3056, test_f1: 0.2281
 epoch: 66, train_loss: 1.2527, test_loss: 1.3076, test_f1: 0.2281
 epoch: 67, train_loss: 1.2534, test_loss: 1.3083, test_f1: 0.2281
 epoch: 68, train_loss: 1.2520, test_loss: 1.3066, test_f1: 0.2281
 epoch: 69, train_loss: 1.2533, test_loss: 1.3049, test_f1: 0.2281
 epoch: 70, train_loss: 1.2535, test_loss: 1.3030, test_f1: 0.2281
 epoch: 71, train_loss: 1.2528, test_loss: 1.3028, test_f1: 0.2281
 epoch: 72, train_loss: 1.2523, test_loss: 1.3037, test_f1: 0.2281
 epoch: 73, train_loss: 1.2523, test_loss: 1.3051, test_f1: 0.2281
 epoch: 74, train_loss: 1.2525, test_loss: 1.3048, test_f1: 0.2281
 epoch: 75, train_loss: 1.2528, test_loss: 1.3079, test_f1: 0.2281
 epoch: 76, train_loss: 1.2530, test_loss: 1.3064, test_f1: 0.2281
 epoch: 77, train_loss: 1.2521, test_loss: 1.3045, test_f1: 0.2281
 epoch: 78, train_loss: 1.2527, test_loss: 1.3028, test_f1: 0.2281
 epoch: 79, train_loss: 1.2525, test_loss: 1.3053, test_f1: 0.2281
 epoch: 80, train_loss: 1.2523, test_loss: 1.3057, test_f1: 0.2281
 epoch: 81, train_loss: 1.2522, test_loss: 1.3062, test_f1: 0.2281
 epoch: 82, train_loss: 1.2527, test_loss: 1.3051, test_f1: 0.2281
 epoch: 83, train_loss: 1.2523, test_loss: 1.3036, test_f1: 0.2281
 epoch: 84, train_loss: 1.2521, test_loss: 1.3059, test_f1: 0.2281
 epoch: 85, train_loss: 1.2527, test_loss: 1.3072, test_f1: 0.2281
 epoch: 86, train_loss: 1.2526, test_loss: 1.3051, test_f1: 0.2281
 epoch: 87, train_loss: 1.2521, test_loss: 1.3045, test_f1: 0.2281
 epoch: 88, train_loss: 1.2523, test_loss: 1.3069, test_f1: 0.2281
 epoch: 89, train_loss: 1.2533, test_loss: 1.3049, test_f1: 0.2281
 epoch: 90, train_loss: 1.2528, test_loss: 1.3025, test_f1: 0.2281
 epoch: 91, train_loss: 1.2529, test_loss: 1.3018, test_f1: 0.2281
 epoch: 92, train_loss: 1.2525, test_loss: 1.3026, test_f1: 0.2281
 epoch: 93, train_loss: 1.2523, test_loss: 1.3030, test_f1: 0.2281
 epoch: 94, train_loss: 1.2528, test_loss: 1.3029, test_f1: 0.2281
 epoch: 95, train_loss: 1.2527, test_loss: 1.3035, test_f1: 0.2281
 epoch: 96, train_loss: 1.2524, test_loss: 1.3032, test_f1: 0.2281
 epoch: 97, train_loss: 1.2529, test_loss: 1.3053, test_f1: 0.2281
 epoch: 98, train_loss: 1.2525, test_loss: 1.3060, test_f1: 0.2281
 epoch: 99, train_loss: 1.2520, test_loss: 1.3054, test_f1: 0.2281

Training completed in 293.35 seconds
Best F1: 0.5713 at epoch 84
Mean F1 across iterations: 0.2742  0.1051
========================FINAL RESULTS================================
FEGIN weighted F1: 0.5713  0.1051
python main.py --data ltspice_demos --representation component_pin_net --model FEGIN --layers 2 --hiddens 32 --batch_size 256 --lr 0.1 --emb_size 250 --epochs 100 --save_appendix component_pin_net_L2_H32_BS256_LR0.1_E250 --no_val
-----



STDERR:
  File "main.py", line 370, in <module>
    main()
  File "main.py", line 254, in main
    dataset = dataset_class(
  File "/home/philip/projects/ltspice_examples_code_repo/Circuit-Completion-Using-GNNs/component_classification_with_link_prediction_head/evaluation/FEGIN/kernel/circuit_datasets.py", line 15, in __init__
    self.data, self.slices = torch.load(self.processed_paths[0])
  File "/home/philip/.local/lib/python3.8/site-packages/torch/serialization.py", line 1040, in load
    warnings.warn(
  File "/usr/lib/python3.8/warnings.py", line 109, in _showwarnmsg
    sw(msg.message, msg.category, msg.filename, msg.lineno,
  File "main.py", line 47, in warn_with_traceback
    traceback.print_stack(file=log)
/home/philip/projects/ltspice_examples_code_repo/Circuit-Completion-Using-GNNs/component_classification_with_link_prediction_head/evaluation/FEGIN/kernel/circuit_datasets.py:15: FutureWarning: You are using `torch.load` with `weights_only=False` (the current default value), which uses the default pickle module implicitly. It is possible to construct malicious pickle data which will execute arbitrary code during unpickling (See https://github.com/pytorch/pytorch/blob/main/SECURITY.md#untrusted-models for more details). In a future release, the default value for `weights_only` will be flipped to `True`. This limits the functions that could be executed during unpickling. Arbitrary objects will no longer be allowed to be loaded via this mode unless they are explicitly allowlisted by the user via `torch.serialization.add_safe_globals`. We recommend you start setting `weights_only=True` for any use case where you don't have full control of the loaded file. Please open an issue on GitHub for any issues related to this experimental feature.
  self.data, self.slices = torch.load(self.processed_paths[0])
