STDOUT:
Results will be saved in /home/philip/projects/ltspice_examples_code_repo/Circuit-Completion-Using-GNNs/component_classification_with_link_prediction_head/evaluation/FEGIN/results/model_FEGIN_dataset_ltspice_examples
Command line input: python main.py --data ltspice_examples --representation component_pin --model FEGIN --layers 6 --hiddens 128 --batch_size 64 --lr 0.0001 --emb_size 512 --epochs 100 --save_appendix component_pin_L6_H128_BS64_LR0.0001_E512 --no_val
 is saved.
-----
ltspice_examples - FEGIN
Using 6 layers, 128 hidden units, h = 2
Loading component_pin representation dataset
ENTERED
Training FEGIN on component_pin representation
Train: 3560, Test: 848
##################ITERATION #0 ****************************************
 epoch: 0, train_loss: 1.3536, test_loss: 1.3295, test_f1: 0.2260
 epoch: 1, train_loss: 1.2768, test_loss: 1.2406, test_f1: 0.2260
 epoch: 2, train_loss: 1.2124, test_loss: 1.1658, test_f1: 0.3391
 epoch: 3, train_loss: 1.1409, test_loss: 1.1075, test_f1: 0.3317
 epoch: 4, train_loss: 1.0753, test_loss: 1.0546, test_f1: 0.3520
 epoch: 5, train_loss: 1.0312, test_loss: 1.0386, test_f1: 0.3445
 epoch: 6, train_loss: 1.0046, test_loss: 1.0156, test_f1: 0.3558
 epoch: 7, train_loss: 0.9833, test_loss: 0.9971, test_f1: 0.4258
 epoch: 8, train_loss: 0.9633, test_loss: 0.9920, test_f1: 0.4454
 epoch: 9, train_loss: 0.9432, test_loss: 0.9958, test_f1: 0.4804
 epoch: 10, train_loss: 0.9260, test_loss: 0.9928, test_f1: 0.4970
 epoch: 11, train_loss: 0.9141, test_loss: 0.9645, test_f1: 0.4859
 epoch: 12, train_loss: 0.8998, test_loss: 0.9216, test_f1: 0.5069
 epoch: 13, train_loss: 0.8865, test_loss: 0.9376, test_f1: 0.5209
 epoch: 14, train_loss: 0.8731, test_loss: 0.9342, test_f1: 0.5143
 epoch: 15, train_loss: 0.8486, test_loss: 0.9094, test_f1: 0.5287
 epoch: 16, train_loss: 0.8406, test_loss: 1.0435, test_f1: 0.5368
 epoch: 17, train_loss: 0.8223, test_loss: 0.9231, test_f1: 0.5581
 epoch: 18, train_loss: 0.8118, test_loss: 0.9213, test_f1: 0.5327
 epoch: 19, train_loss: 0.7933, test_loss: 0.9315, test_f1: 0.5283
 epoch: 20, train_loss: 0.7765, test_loss: 0.8665, test_f1: 0.5621
 epoch: 21, train_loss: 0.7809, test_loss: 0.9141, test_f1: 0.5202
 epoch: 22, train_loss: 0.7640, test_loss: 0.8806, test_f1: 0.5632
 epoch: 23, train_loss: 0.7381, test_loss: 0.8765, test_f1: 0.5742
 epoch: 24, train_loss: 0.7461, test_loss: 0.8771, test_f1: 0.5582
 epoch: 25, train_loss: 0.7287, test_loss: 0.8524, test_f1: 0.5694
 epoch: 26, train_loss: 0.7281, test_loss: 0.8718, test_f1: 0.5913
 epoch: 27, train_loss: 0.7109, test_loss: 0.8394, test_f1: 0.6059
 epoch: 28, train_loss: 0.7020, test_loss: 0.8939, test_f1: 0.5595
 epoch: 29, train_loss: 0.6907, test_loss: 0.8650, test_f1: 0.5891
 epoch: 30, train_loss: 0.6802, test_loss: 0.8623, test_f1: 0.5802
 epoch: 31, train_loss: 0.6796, test_loss: 0.8508, test_f1: 0.5948
 epoch: 32, train_loss: 0.6770, test_loss: 0.8509, test_f1: 0.5767
 epoch: 33, train_loss: 0.6555, test_loss: 0.8198, test_f1: 0.5766
 epoch: 34, train_loss: 0.6498, test_loss: 0.8895, test_f1: 0.5932
 epoch: 35, train_loss: 0.6383, test_loss: 0.8585, test_f1: 0.5822
 epoch: 36, train_loss: 0.6402, test_loss: 0.8085, test_f1: 0.5872
 epoch: 37, train_loss: 0.6260, test_loss: 0.8744, test_f1: 0.5884
 epoch: 38, train_loss: 0.6135, test_loss: 0.8891, test_f1: 0.5742
 epoch: 39, train_loss: 0.6226, test_loss: 0.8910, test_f1: 0.5904
 epoch: 40, train_loss: 0.5970, test_loss: 0.9249, test_f1: 0.5809
 epoch: 41, train_loss: 0.5992, test_loss: 0.9340, test_f1: 0.5738
 epoch: 42, train_loss: 0.5969, test_loss: 0.9135, test_f1: 0.5834
 epoch: 43, train_loss: 0.6000, test_loss: 0.9162, test_f1: 0.6042
 epoch: 44, train_loss: 0.5880, test_loss: 0.8982, test_f1: 0.5901
 epoch: 45, train_loss: 0.5700, test_loss: 0.9144, test_f1: 0.5888
 epoch: 46, train_loss: 0.5733, test_loss: 0.9231, test_f1: 0.5906
 epoch: 47, train_loss: 0.5646, test_loss: 0.9024, test_f1: 0.5964
 epoch: 48, train_loss: 0.5538, test_loss: 0.9886, test_f1: 0.5923
 epoch: 49, train_loss: 0.5511, test_loss: 0.9101, test_f1: 0.6128
 epoch: 50, train_loss: 0.5465, test_loss: 0.9040, test_f1: 0.6060
 epoch: 51, train_loss: 0.5158, test_loss: 0.8869, test_f1: 0.5893
 epoch: 52, train_loss: 0.5304, test_loss: 0.9311, test_f1: 0.6018
 epoch: 53, train_loss: 0.5012, test_loss: 0.9819, test_f1: 0.6053
 epoch: 54, train_loss: 0.5110, test_loss: 0.9485, test_f1: 0.6058
 epoch: 55, train_loss: 0.5071, test_loss: 0.9767, test_f1: 0.5915
 epoch: 56, train_loss: 0.5018, test_loss: 0.9941, test_f1: 0.6051
 epoch: 57, train_loss: 0.4908, test_loss: 1.0017, test_f1: 0.6209
 epoch: 58, train_loss: 0.5013, test_loss: 1.0056, test_f1: 0.6060
 epoch: 59, train_loss: 0.4867, test_loss: 0.9899, test_f1: 0.6055
 epoch: 60, train_loss: 0.4895, test_loss: 1.0474, test_f1: 0.5964
 epoch: 61, train_loss: 0.4786, test_loss: 0.9514, test_f1: 0.6233
 epoch: 62, train_loss: 0.4745, test_loss: 0.9789, test_f1: 0.6181
 epoch: 63, train_loss: 0.4819, test_loss: 1.0082, test_f1: 0.5924
 epoch: 64, train_loss: 0.4851, test_loss: 1.0008, test_f1: 0.6048
 epoch: 65, train_loss: 0.4770, test_loss: 1.0694, test_f1: 0.6057
 epoch: 66, train_loss: 0.4716, test_loss: 1.0173, test_f1: 0.6164
 epoch: 67, train_loss: 0.4695, test_loss: 1.0391, test_f1: 0.6214
 epoch: 68, train_loss: 0.4737, test_loss: 1.0664, test_f1: 0.6239
 epoch: 69, train_loss: 0.4667, test_loss: 1.0597, test_f1: 0.6223
 epoch: 70, train_loss: 0.4566, test_loss: 1.1134, test_f1: 0.6005
 epoch: 71, train_loss: 0.4590, test_loss: 1.0616, test_f1: 0.6188
 epoch: 72, train_loss: 0.4529, test_loss: 1.0313, test_f1: 0.6218
 epoch: 73, train_loss: 0.4645, test_loss: 1.0505, test_f1: 0.6149
 epoch: 74, train_loss: 0.4428, test_loss: 1.1183, test_f1: 0.6231
 epoch: 75, train_loss: 0.4385, test_loss: 1.0739, test_f1: 0.6071
 epoch: 76, train_loss: 0.4396, test_loss: 1.1257, test_f1: 0.6219
 epoch: 77, train_loss: 0.4407, test_loss: 1.1060, test_f1: 0.6073
 epoch: 78, train_loss: 0.4495, test_loss: 1.0701, test_f1: 0.6124
 epoch: 79, train_loss: 0.4346, test_loss: 1.0670, test_f1: 0.6272
 epoch: 80, train_loss: 0.4341, test_loss: 1.1033, test_f1: 0.6173
 epoch: 81, train_loss: 0.4234, test_loss: 1.1122, test_f1: 0.6359
 epoch: 82, train_loss: 0.4261, test_loss: 1.1253, test_f1: 0.6204
 epoch: 83, train_loss: 0.4275, test_loss: 1.1413, test_f1: 0.6301
 epoch: 84, train_loss: 0.4160, test_loss: 1.0641, test_f1: 0.6242
 epoch: 85, train_loss: 0.4198, test_loss: 1.1028, test_f1: 0.6157
 epoch: 86, train_loss: 0.4186, test_loss: 1.1720, test_f1: 0.6263
 epoch: 87, train_loss: 0.4171, test_loss: 1.1548, test_f1: 0.6333
 epoch: 88, train_loss: 0.4059, test_loss: 1.1413, test_f1: 0.6151
 epoch: 89, train_loss: 0.4050, test_loss: 1.1589, test_f1: 0.6133
 epoch: 90, train_loss: 0.3914, test_loss: 1.1427, test_f1: 0.6285
 epoch: 91, train_loss: 0.3898, test_loss: 1.1887, test_f1: 0.6430
 epoch: 92, train_loss: 0.4057, test_loss: 1.1606, test_f1: 0.6387
 epoch: 93, train_loss: 0.4083, test_loss: 1.2108, test_f1: 0.6337
 epoch: 94, train_loss: 0.4030, test_loss: 1.1936, test_f1: 0.6286
 epoch: 95, train_loss: 0.3959, test_loss: 1.2229, test_f1: 0.6420
 epoch: 96, train_loss: 0.3921, test_loss: 1.2659, test_f1: 0.6240
 epoch: 97, train_loss: 0.3939, test_loss: 1.2255, test_f1: 0.6350
 epoch: 98, train_loss: 0.3848, test_loss: 1.2010, test_f1: 0.6476
 epoch: 99, train_loss: 0.3927, test_loss: 1.2472, test_f1: 0.6217
##################ITERATION #1 ****************************************
 epoch: 0, train_loss: 1.2688, test_loss: 1.2206, test_f1: 0.2260
 epoch: 1, train_loss: 1.1268, test_loss: 1.0717, test_f1: 0.4028
 epoch: 2, train_loss: 1.0559, test_loss: 1.0319, test_f1: 0.4737
 epoch: 3, train_loss: 1.0046, test_loss: 1.0081, test_f1: 0.4774
 epoch: 4, train_loss: 0.9719, test_loss: 0.9865, test_f1: 0.4996
 epoch: 5, train_loss: 0.9359, test_loss: 0.9735, test_f1: 0.5014
 epoch: 6, train_loss: 0.9217, test_loss: 0.9801, test_f1: 0.5119
 epoch: 7, train_loss: 0.9048, test_loss: 0.9699, test_f1: 0.5083
 epoch: 8, train_loss: 0.8877, test_loss: 0.9532, test_f1: 0.5138
 epoch: 9, train_loss: 0.8600, test_loss: 0.9630, test_f1: 0.5037
 epoch: 10, train_loss: 0.8566, test_loss: 0.9437, test_f1: 0.5411
 epoch: 11, train_loss: 0.8346, test_loss: 0.9420, test_f1: 0.5487
 epoch: 12, train_loss: 0.8291, test_loss: 0.9671, test_f1: 0.5307
 epoch: 13, train_loss: 0.8030, test_loss: 0.9359, test_f1: 0.5403
 epoch: 14, train_loss: 0.7914, test_loss: 0.9433, test_f1: 0.5521
 epoch: 15, train_loss: 0.7791, test_loss: 0.9827, test_f1: 0.5211
 epoch: 16, train_loss: 0.7665, test_loss: 0.9459, test_f1: 0.5504
 epoch: 17, train_loss: 0.7673, test_loss: 0.9261, test_f1: 0.5603
 epoch: 18, train_loss: 0.7499, test_loss: 0.9341, test_f1: 0.5513
 epoch: 19, train_loss: 0.7352, test_loss: 0.9344, test_f1: 0.5673
 epoch: 20, train_loss: 0.7232, test_loss: 0.9235, test_f1: 0.5680
 epoch: 21, train_loss: 0.7244, test_loss: 0.9241, test_f1: 0.5770
 epoch: 22, train_loss: 0.7076, test_loss: 0.9363, test_f1: 0.5571
 epoch: 23, train_loss: 0.6949, test_loss: 0.9153, test_f1: 0.5701
 epoch: 24, train_loss: 0.6897, test_loss: 0.9132, test_f1: 0.5799
 epoch: 25, train_loss: 0.6843, test_loss: 0.9301, test_f1: 0.5830
 epoch: 26, train_loss: 0.6733, test_loss: 0.9080, test_f1: 0.6057
 epoch: 27, train_loss: 0.6600, test_loss: 0.9399, test_f1: 0.5803
 epoch: 28, train_loss: 0.6579, test_loss: 0.9436, test_f1: 0.5753
 epoch: 29, train_loss: 0.6517, test_loss: 0.9474, test_f1: 0.5888
 epoch: 30, train_loss: 0.6354, test_loss: 0.9692, test_f1: 0.5502
 epoch: 31, train_loss: 0.6332, test_loss: 0.9522, test_f1: 0.5552
 epoch: 32, train_loss: 0.6239, test_loss: 0.9229, test_f1: 0.6073
 epoch: 33, train_loss: 0.6192, test_loss: 0.9495, test_f1: 0.5709
 epoch: 34, train_loss: 0.6214, test_loss: 0.9207, test_f1: 0.6095
 epoch: 35, train_loss: 0.6061, test_loss: 0.9092, test_f1: 0.5839
 epoch: 36, train_loss: 0.6045, test_loss: 0.9779, test_f1: 0.5547
 epoch: 37, train_loss: 0.5888, test_loss: 0.9812, test_f1: 0.5905
 epoch: 38, train_loss: 0.5839, test_loss: 0.9620, test_f1: 0.5983
 epoch: 39, train_loss: 0.5870, test_loss: 0.9688, test_f1: 0.6097
 epoch: 40, train_loss: 0.5697, test_loss: 0.9692, test_f1: 0.6164
 epoch: 41, train_loss: 0.5502, test_loss: 0.9327, test_f1: 0.6222
 epoch: 42, train_loss: 0.5594, test_loss: 0.9768, test_f1: 0.5954
 epoch: 43, train_loss: 0.5490, test_loss: 1.0172, test_f1: 0.6181
 epoch: 44, train_loss: 0.5442, test_loss: 0.9831, test_f1: 0.6088
 epoch: 45, train_loss: 0.5467, test_loss: 0.9642, test_f1: 0.6064
 epoch: 46, train_loss: 0.5335, test_loss: 1.0183, test_f1: 0.6046
 epoch: 47, train_loss: 0.5356, test_loss: 1.0223, test_f1: 0.6018
 epoch: 48, train_loss: 0.5169, test_loss: 1.0432, test_f1: 0.6154
 epoch: 49, train_loss: 0.5168, test_loss: 1.0321, test_f1: 0.5819
 epoch: 50, train_loss: 0.5175, test_loss: 1.0835, test_f1: 0.5887
 epoch: 51, train_loss: 0.4869, test_loss: 1.0213, test_f1: 0.5956
 epoch: 52, train_loss: 0.4700, test_loss: 1.0346, test_f1: 0.6181
 epoch: 53, train_loss: 0.4821, test_loss: 1.0602, test_f1: 0.6083
 epoch: 54, train_loss: 0.4711, test_loss: 1.0734, test_f1: 0.6238
 epoch: 55, train_loss: 0.4577, test_loss: 1.1000, test_f1: 0.6039
 epoch: 56, train_loss: 0.4599, test_loss: 1.0564, test_f1: 0.6261
 epoch: 57, train_loss: 0.4538, test_loss: 1.1095, test_f1: 0.6085
 epoch: 58, train_loss: 0.4541, test_loss: 1.1008, test_f1: 0.6163
 epoch: 59, train_loss: 0.4471, test_loss: 1.1499, test_f1: 0.5886
 epoch: 60, train_loss: 0.4514, test_loss: 1.0682, test_f1: 0.6312
 epoch: 61, train_loss: 0.4422, test_loss: 1.1346, test_f1: 0.5914
 epoch: 62, train_loss: 0.4471, test_loss: 1.1168, test_f1: 0.6129
 epoch: 63, train_loss: 0.4407, test_loss: 1.1869, test_f1: 0.5790
 epoch: 64, train_loss: 0.4355, test_loss: 1.1737, test_f1: 0.6126
 epoch: 65, train_loss: 0.4398, test_loss: 1.1477, test_f1: 0.6037
 epoch: 66, train_loss: 0.4393, test_loss: 1.1294, test_f1: 0.6162
 epoch: 67, train_loss: 0.4256, test_loss: 1.1902, test_f1: 0.6033
 epoch: 68, train_loss: 0.4236, test_loss: 1.1786, test_f1: 0.6058
 epoch: 69, train_loss: 0.4270, test_loss: 1.2092, test_f1: 0.6187
 epoch: 70, train_loss: 0.4091, test_loss: 1.2123, test_f1: 0.6055
 epoch: 71, train_loss: 0.4087, test_loss: 1.2184, test_f1: 0.6214
 epoch: 72, train_loss: 0.4185, test_loss: 1.2289, test_f1: 0.6264
 epoch: 73, train_loss: 0.4172, test_loss: 1.2747, test_f1: 0.6071
 epoch: 74, train_loss: 0.4197, test_loss: 1.2454, test_f1: 0.6143
 epoch: 75, train_loss: 0.4256, test_loss: 1.2007, test_f1: 0.6190
 epoch: 76, train_loss: 0.4100, test_loss: 1.2449, test_f1: 0.6128
 epoch: 77, train_loss: 0.4116, test_loss: 1.2592, test_f1: 0.6178
 epoch: 78, train_loss: 0.4086, test_loss: 1.1867, test_f1: 0.6003
 epoch: 79, train_loss: 0.4101, test_loss: 1.2780, test_f1: 0.6256
 epoch: 80, train_loss: 0.3985, test_loss: 1.2329, test_f1: 0.6165
 epoch: 81, train_loss: 0.4021, test_loss: 1.2349, test_f1: 0.6281
 epoch: 82, train_loss: 0.3856, test_loss: 1.2785, test_f1: 0.6156
 epoch: 83, train_loss: 0.3932, test_loss: 1.2626, test_f1: 0.6273
 epoch: 84, train_loss: 0.3793, test_loss: 1.2845, test_f1: 0.6218
 epoch: 85, train_loss: 0.3813, test_loss: 1.2922, test_f1: 0.6140
 epoch: 86, train_loss: 0.3662, test_loss: 1.3352, test_f1: 0.6050
 epoch: 87, train_loss: 0.3723, test_loss: 1.3357, test_f1: 0.5872
 epoch: 88, train_loss: 0.3729, test_loss: 1.2751, test_f1: 0.6142
 epoch: 89, train_loss: 0.3593, test_loss: 1.2951, test_f1: 0.6110
 epoch: 90, train_loss: 0.3757, test_loss: 1.3346, test_f1: 0.6122
 epoch: 91, train_loss: 0.3586, test_loss: 1.3654, test_f1: 0.6281
 epoch: 92, train_loss: 0.3616, test_loss: 1.3590, test_f1: 0.6064
 epoch: 93, train_loss: 0.3673, test_loss: 1.3148, test_f1: 0.6125
 epoch: 94, train_loss: 0.3768, test_loss: 1.3470, test_f1: 0.6175
 epoch: 95, train_loss: 0.3774, test_loss: 1.2627, test_f1: 0.6164
 epoch: 96, train_loss: 0.3490, test_loss: 1.3686, test_f1: 0.6136
 epoch: 97, train_loss: 0.3656, test_loss: 1.4507, test_f1: 0.6093
 epoch: 98, train_loss: 0.3553, test_loss: 1.3176, test_f1: 0.6209
 epoch: 99, train_loss: 0.3662, test_loss: 1.4071, test_f1: 0.6252
##################ITERATION #2 ****************************************
 epoch: 0, train_loss: 1.2276, test_loss: 1.1857, test_f1: 0.3321
 epoch: 1, train_loss: 1.1163, test_loss: 1.0579, test_f1: 0.4530
 epoch: 2, train_loss: 1.0538, test_loss: 1.0223, test_f1: 0.4954
 epoch: 3, train_loss: 1.0140, test_loss: 1.0164, test_f1: 0.4824
 epoch: 4, train_loss: 0.9853, test_loss: 0.9588, test_f1: 0.5256
 epoch: 5, train_loss: 0.9611, test_loss: 0.9577, test_f1: 0.5492
 epoch: 6, train_loss: 0.9339, test_loss: 0.9786, test_f1: 0.5185
 epoch: 7, train_loss: 0.9233, test_loss: 0.9961, test_f1: 0.4874
 epoch: 8, train_loss: 0.9053, test_loss: 0.9412, test_f1: 0.5017
 epoch: 9, train_loss: 0.8787, test_loss: 0.9086, test_f1: 0.5654
 epoch: 10, train_loss: 0.8599, test_loss: 0.9280, test_f1: 0.5332
 epoch: 11, train_loss: 0.8500, test_loss: 0.8964, test_f1: 0.5886
 epoch: 12, train_loss: 0.8251, test_loss: 0.8896, test_f1: 0.5974
 epoch: 13, train_loss: 0.8141, test_loss: 0.9135, test_f1: 0.5551
 epoch: 14, train_loss: 0.8001, test_loss: 0.8741, test_f1: 0.5861
 epoch: 15, train_loss: 0.7903, test_loss: 0.8869, test_f1: 0.6017
 epoch: 16, train_loss: 0.7755, test_loss: 0.8754, test_f1: 0.5833
 epoch: 17, train_loss: 0.7697, test_loss: 0.8963, test_f1: 0.6106
 epoch: 18, train_loss: 0.7502, test_loss: 0.8972, test_f1: 0.5811
 epoch: 19, train_loss: 0.7412, test_loss: 0.9071, test_f1: 0.5828
 epoch: 20, train_loss: 0.7287, test_loss: 0.8680, test_f1: 0.5882
 epoch: 21, train_loss: 0.7242, test_loss: 0.8650, test_f1: 0.6064
 epoch: 22, train_loss: 0.7155, test_loss: 0.9225, test_f1: 0.5789
 epoch: 23, train_loss: 0.7135, test_loss: 0.8662, test_f1: 0.6145
 epoch: 24, train_loss: 0.7111, test_loss: 0.9281, test_f1: 0.6011
 epoch: 25, train_loss: 0.6810, test_loss: 0.9230, test_f1: 0.6023
 epoch: 26, train_loss: 0.6834, test_loss: 0.9017, test_f1: 0.5977
 epoch: 27, train_loss: 0.6748, test_loss: 0.8603, test_f1: 0.6128
 epoch: 28, train_loss: 0.6757, test_loss: 0.8788, test_f1: 0.6100
 epoch: 29, train_loss: 0.6510, test_loss: 0.9469, test_f1: 0.5828
 epoch: 30, train_loss: 0.6391, test_loss: 0.8944, test_f1: 0.6157
 epoch: 31, train_loss: 0.6425, test_loss: 0.8737, test_f1: 0.6257
 epoch: 32, train_loss: 0.6354, test_loss: 0.8740, test_f1: 0.6166
 epoch: 33, train_loss: 0.6252, test_loss: 0.8739, test_f1: 0.6277
 epoch: 34, train_loss: 0.6188, test_loss: 0.8820, test_f1: 0.6076
 epoch: 35, train_loss: 0.6273, test_loss: 0.8849, test_f1: 0.6376
 epoch: 36, train_loss: 0.6093, test_loss: 0.9114, test_f1: 0.6235
 epoch: 37, train_loss: 0.5955, test_loss: 0.8665, test_f1: 0.6199
 epoch: 38, train_loss: 0.5906, test_loss: 0.9700, test_f1: 0.6070
 epoch: 39, train_loss: 0.5879, test_loss: 0.8784, test_f1: 0.6552
 epoch: 40, train_loss: 0.5744, test_loss: 0.9042, test_f1: 0.5977
 epoch: 41, train_loss: 0.5717, test_loss: 0.8867, test_f1: 0.6283
 epoch: 42, train_loss: 0.5622, test_loss: 0.8668, test_f1: 0.6434
 epoch: 43, train_loss: 0.5577, test_loss: 0.9467, test_f1: 0.6329
 epoch: 44, train_loss: 0.5526, test_loss: 0.9772, test_f1: 0.6371
 epoch: 45, train_loss: 0.5506, test_loss: 0.9741, test_f1: 0.6406
 epoch: 46, train_loss: 0.5456, test_loss: 0.9565, test_f1: 0.6311
 epoch: 47, train_loss: 0.5312, test_loss: 1.0344, test_f1: 0.6370
 epoch: 48, train_loss: 0.5416, test_loss: 0.9062, test_f1: 0.6507
 epoch: 49, train_loss: 0.5364, test_loss: 0.9182, test_f1: 0.6533
 epoch: 50, train_loss: 0.5147, test_loss: 0.9321, test_f1: 0.6522
 epoch: 51, train_loss: 0.4993, test_loss: 0.8994, test_f1: 0.6540
 epoch: 52, train_loss: 0.4812, test_loss: 0.8704, test_f1: 0.6578
 epoch: 53, train_loss: 0.5000, test_loss: 0.9207, test_f1: 0.6618
 epoch: 54, train_loss: 0.4861, test_loss: 0.9243, test_f1: 0.6510
 epoch: 55, train_loss: 0.4760, test_loss: 0.9208, test_f1: 0.6697
 epoch: 56, train_loss: 0.4688, test_loss: 0.9211, test_f1: 0.6581
 epoch: 57, train_loss: 0.4682, test_loss: 0.9091, test_f1: 0.6695
 epoch: 58, train_loss: 0.4704, test_loss: 0.9392, test_f1: 0.6667
 epoch: 59, train_loss: 0.4623, test_loss: 1.0151, test_f1: 0.6752
 epoch: 60, train_loss: 0.4756, test_loss: 0.9519, test_f1: 0.6754
 epoch: 61, train_loss: 0.4678, test_loss: 0.9594, test_f1: 0.6800
 epoch: 62, train_loss: 0.4428, test_loss: 0.9246, test_f1: 0.6676
 epoch: 63, train_loss: 0.4395, test_loss: 0.9499, test_f1: 0.6668
 epoch: 64, train_loss: 0.4448, test_loss: 0.9629, test_f1: 0.6443
 epoch: 65, train_loss: 0.4343, test_loss: 0.9971, test_f1: 0.6742
 epoch: 66, train_loss: 0.4337, test_loss: 0.9719, test_f1: 0.6642
 epoch: 67, train_loss: 0.4419, test_loss: 0.9753, test_f1: 0.6865
 epoch: 68, train_loss: 0.4375, test_loss: 0.9939, test_f1: 0.6629
 epoch: 69, train_loss: 0.4257, test_loss: 1.0138, test_f1: 0.6730
 epoch: 70, train_loss: 0.4219, test_loss: 1.0265, test_f1: 0.6873
 epoch: 71, train_loss: 0.4286, test_loss: 1.0252, test_f1: 0.6638
 epoch: 72, train_loss: 0.4294, test_loss: 1.0297, test_f1: 0.6896
 epoch: 73, train_loss: 0.4146, test_loss: 0.9799, test_f1: 0.6733
 epoch: 74, train_loss: 0.4075, test_loss: 1.0348, test_f1: 0.6807
 epoch: 75, train_loss: 0.4095, test_loss: 1.0594, test_f1: 0.6740
 epoch: 76, train_loss: 0.4087, test_loss: 1.0543, test_f1: 0.6713
 epoch: 77, train_loss: 0.4016, test_loss: 1.0535, test_f1: 0.6706
 epoch: 78, train_loss: 0.4032, test_loss: 1.0504, test_f1: 0.6754
 epoch: 79, train_loss: 0.4083, test_loss: 1.0957, test_f1: 0.6521
 epoch: 80, train_loss: 0.4003, test_loss: 1.1348, test_f1: 0.6797
 epoch: 81, train_loss: 0.4155, test_loss: 1.0144, test_f1: 0.6600
 epoch: 82, train_loss: 0.3881, test_loss: 1.0962, test_f1: 0.6585
 epoch: 83, train_loss: 0.3995, test_loss: 1.1233, test_f1: 0.6462
 epoch: 84, train_loss: 0.3970, test_loss: 1.0698, test_f1: 0.6953
 epoch: 85, train_loss: 0.3897, test_loss: 1.1003, test_f1: 0.6468
 epoch: 86, train_loss: 0.3750, test_loss: 1.1324, test_f1: 0.6576
 epoch: 87, train_loss: 0.3918, test_loss: 1.2054, test_f1: 0.6551
 epoch: 88, train_loss: 0.3729, test_loss: 1.0949, test_f1: 0.6623
 epoch: 89, train_loss: 0.3716, test_loss: 1.0591, test_f1: 0.6475
 epoch: 90, train_loss: 0.3882, test_loss: 1.1401, test_f1: 0.6532
 epoch: 91, train_loss: 0.3694, test_loss: 1.1801, test_f1: 0.6401
 epoch: 92, train_loss: 0.3662, test_loss: 1.1199, test_f1: 0.6630
 epoch: 93, train_loss: 0.3796, test_loss: 1.0827, test_f1: 0.6643
 epoch: 94, train_loss: 0.3694, test_loss: 1.1129, test_f1: 0.6672
 epoch: 95, train_loss: 0.3506, test_loss: 1.0976, test_f1: 0.6512
 epoch: 96, train_loss: 0.3585, test_loss: 1.1642, test_f1: 0.6552
 epoch: 97, train_loss: 0.3560, test_loss: 1.1840, test_f1: 0.6475
 epoch: 98, train_loss: 0.3452, test_loss: 1.0677, test_f1: 0.6630
 epoch: 99, train_loss: 0.3545, test_loss: 1.1816, test_f1: 0.6676
##################ITERATION #3 ****************************************
 epoch: 0, train_loss: 1.2183, test_loss: 1.1931, test_f1: 0.3535
 epoch: 1, train_loss: 1.0912, test_loss: 1.0250, test_f1: 0.5039
 epoch: 2, train_loss: 1.0362, test_loss: 0.9900, test_f1: 0.5262
 epoch: 3, train_loss: 0.9964, test_loss: 0.9743, test_f1: 0.5302
 epoch: 4, train_loss: 0.9722, test_loss: 0.9577, test_f1: 0.5119
 epoch: 5, train_loss: 0.9531, test_loss: 0.9514, test_f1: 0.5105
 epoch: 6, train_loss: 0.9384, test_loss: 0.9494, test_f1: 0.5194
 epoch: 7, train_loss: 0.9077, test_loss: 0.9356, test_f1: 0.5341
 epoch: 8, train_loss: 0.8867, test_loss: 0.9363, test_f1: 0.5229
 epoch: 9, train_loss: 0.8620, test_loss: 0.9411, test_f1: 0.5356
 epoch: 10, train_loss: 0.8546, test_loss: 0.9240, test_f1: 0.5510
 epoch: 11, train_loss: 0.8442, test_loss: 0.9298, test_f1: 0.5705
 epoch: 12, train_loss: 0.8167, test_loss: 0.9270, test_f1: 0.5590
 epoch: 13, train_loss: 0.8030, test_loss: 0.9332, test_f1: 0.5583
 epoch: 14, train_loss: 0.7986, test_loss: 0.9226, test_f1: 0.5769
 epoch: 15, train_loss: 0.7836, test_loss: 0.8867, test_f1: 0.5728
 epoch: 16, train_loss: 0.7716, test_loss: 0.9373, test_f1: 0.5729
 epoch: 17, train_loss: 0.7584, test_loss: 0.9102, test_f1: 0.5819
 epoch: 18, train_loss: 0.7535, test_loss: 0.9628, test_f1: 0.5573
 epoch: 19, train_loss: 0.7320, test_loss: 0.9527, test_f1: 0.6075
 epoch: 20, train_loss: 0.7260, test_loss: 0.9512, test_f1: 0.5839
 epoch: 21, train_loss: 0.7199, test_loss: 0.9527, test_f1: 0.5996
 epoch: 22, train_loss: 0.7078, test_loss: 0.9992, test_f1: 0.5750
 epoch: 23, train_loss: 0.6954, test_loss: 0.9584, test_f1: 0.5958
 epoch: 24, train_loss: 0.6657, test_loss: 0.9817, test_f1: 0.6011
 epoch: 25, train_loss: 0.6775, test_loss: 0.9740, test_f1: 0.6172
 epoch: 26, train_loss: 0.6566, test_loss: 0.9829, test_f1: 0.5843
 epoch: 27, train_loss: 0.6427, test_loss: 0.9969, test_f1: 0.6222
 epoch: 28, train_loss: 0.6515, test_loss: 0.9210, test_f1: 0.6265
 epoch: 29, train_loss: 0.6318, test_loss: 0.9399, test_f1: 0.5999
 epoch: 30, train_loss: 0.6304, test_loss: 0.9346, test_f1: 0.6183
 epoch: 31, train_loss: 0.6257, test_loss: 1.0227, test_f1: 0.6046
 epoch: 32, train_loss: 0.6123, test_loss: 0.9977, test_f1: 0.6276
 epoch: 33, train_loss: 0.6122, test_loss: 0.9437, test_f1: 0.6178
 epoch: 34, train_loss: 0.5933, test_loss: 0.9720, test_f1: 0.5934
 epoch: 35, train_loss: 0.5828, test_loss: 0.9715, test_f1: 0.6280
 epoch: 36, train_loss: 0.5884, test_loss: 1.0873, test_f1: 0.6030
 epoch: 37, train_loss: 0.5873, test_loss: 1.0248, test_f1: 0.6311
 epoch: 38, train_loss: 0.5821, test_loss: 1.0076, test_f1: 0.6214
 epoch: 39, train_loss: 0.5829, test_loss: 1.0944, test_f1: 0.6023
 epoch: 40, train_loss: 0.5610, test_loss: 1.0253, test_f1: 0.6193
 epoch: 41, train_loss: 0.5646, test_loss: 1.1406, test_f1: 0.6495
 epoch: 42, train_loss: 0.5404, test_loss: 1.0939, test_f1: 0.6258
 epoch: 43, train_loss: 0.5524, test_loss: 1.1363, test_f1: 0.6350
 epoch: 44, train_loss: 0.5360, test_loss: 1.0786, test_f1: 0.6131
 epoch: 45, train_loss: 0.5282, test_loss: 1.1046, test_f1: 0.6109
 epoch: 46, train_loss: 0.5259, test_loss: 1.1063, test_f1: 0.6284
 epoch: 47, train_loss: 0.5104, test_loss: 1.1051, test_f1: 0.6075
 epoch: 48, train_loss: 0.5167, test_loss: 1.0874, test_f1: 0.6247
 epoch: 49, train_loss: 0.5024, test_loss: 1.0643, test_f1: 0.6175
 epoch: 50, train_loss: 0.5144, test_loss: 1.1387, test_f1: 0.6080
 epoch: 51, train_loss: 0.4851, test_loss: 1.1700, test_f1: 0.6080
 epoch: 52, train_loss: 0.4685, test_loss: 1.1580, test_f1: 0.6116
 epoch: 53, train_loss: 0.4636, test_loss: 1.1588, test_f1: 0.6107
 epoch: 54, train_loss: 0.4606, test_loss: 1.1862, test_f1: 0.6195
 epoch: 55, train_loss: 0.4571, test_loss: 1.1713, test_f1: 0.6128
 epoch: 56, train_loss: 0.4412, test_loss: 1.1765, test_f1: 0.6243
 epoch: 57, train_loss: 0.4530, test_loss: 1.2443, test_f1: 0.6111
 epoch: 58, train_loss: 0.4537, test_loss: 1.2121, test_f1: 0.6293
 epoch: 59, train_loss: 0.4598, test_loss: 1.2307, test_f1: 0.6307
 epoch: 60, train_loss: 0.4351, test_loss: 1.2314, test_f1: 0.6159
 epoch: 61, train_loss: 0.4534, test_loss: 1.2593, test_f1: 0.6224
 epoch: 62, train_loss: 0.4260, test_loss: 1.2442, test_f1: 0.6145
 epoch: 63, train_loss: 0.4346, test_loss: 1.2684, test_f1: 0.6225
 epoch: 64, train_loss: 0.4323, test_loss: 1.2671, test_f1: 0.6323
 epoch: 65, train_loss: 0.4266, test_loss: 1.3411, test_f1: 0.6122
 epoch: 66, train_loss: 0.4203, test_loss: 1.2594, test_f1: 0.6307
 epoch: 67, train_loss: 0.4065, test_loss: 1.2803, test_f1: 0.6268
 epoch: 68, train_loss: 0.4277, test_loss: 1.2148, test_f1: 0.6345
 epoch: 69, train_loss: 0.4193, test_loss: 1.2720, test_f1: 0.6298
 epoch: 70, train_loss: 0.4045, test_loss: 1.2877, test_f1: 0.6265
 epoch: 71, train_loss: 0.4106, test_loss: 1.3719, test_f1: 0.6251
 epoch: 72, train_loss: 0.4130, test_loss: 1.3418, test_f1: 0.6312
 epoch: 73, train_loss: 0.3983, test_loss: 1.3274, test_f1: 0.6345
 epoch: 74, train_loss: 0.3953, test_loss: 1.3376, test_f1: 0.6275
 epoch: 75, train_loss: 0.4019, test_loss: 1.3149, test_f1: 0.6322
 epoch: 76, train_loss: 0.3933, test_loss: 1.4002, test_f1: 0.6284
 epoch: 77, train_loss: 0.3912, test_loss: 1.3291, test_f1: 0.6323
 epoch: 78, train_loss: 0.3893, test_loss: 1.2960, test_f1: 0.6538
 epoch: 79, train_loss: 0.3966, test_loss: 1.3398, test_f1: 0.6448
 epoch: 80, train_loss: 0.3750, test_loss: 1.3746, test_f1: 0.6293
 epoch: 81, train_loss: 0.3847, test_loss: 1.3582, test_f1: 0.6290
 epoch: 82, train_loss: 0.3836, test_loss: 1.3551, test_f1: 0.6161
 epoch: 83, train_loss: 0.3673, test_loss: 1.3894, test_f1: 0.6286
 epoch: 84, train_loss: 0.3694, test_loss: 1.4266, test_f1: 0.6068
 epoch: 85, train_loss: 0.3600, test_loss: 1.3388, test_f1: 0.6337
 epoch: 86, train_loss: 0.3727, test_loss: 1.4138, test_f1: 0.6201
 epoch: 87, train_loss: 0.3612, test_loss: 1.4045, test_f1: 0.6532
 epoch: 88, train_loss: 0.3652, test_loss: 1.5910, test_f1: 0.6121
 epoch: 89, train_loss: 0.3565, test_loss: 1.5422, test_f1: 0.6225
 epoch: 90, train_loss: 0.3611, test_loss: 1.4182, test_f1: 0.6618
 epoch: 91, train_loss: 0.3467, test_loss: 1.5097, test_f1: 0.6344
 epoch: 92, train_loss: 0.3437, test_loss: 1.4795, test_f1: 0.6367
 epoch: 93, train_loss: 0.3447, test_loss: 1.5554, test_f1: 0.6298
 epoch: 94, train_loss: 0.3532, test_loss: 1.5899, test_f1: 0.6527
 epoch: 95, train_loss: 0.3438, test_loss: 1.5244, test_f1: 0.6496
 epoch: 96, train_loss: 0.3366, test_loss: 1.5549, test_f1: 0.6221
 epoch: 97, train_loss: 0.3454, test_loss: 1.6223, test_f1: 0.6271
 epoch: 98, train_loss: 0.3419, test_loss: 1.6487, test_f1: 0.6312
 epoch: 99, train_loss: 0.3261, test_loss: 1.5902, test_f1: 0.6248
##################ITERATION #4 ****************************************
 epoch: 0, train_loss: 1.1838, test_loss: 1.1411, test_f1: 0.4333
 epoch: 1, train_loss: 1.0628, test_loss: 1.0141, test_f1: 0.4352
 epoch: 2, train_loss: 1.0248, test_loss: 0.9759, test_f1: 0.4940
 epoch: 3, train_loss: 0.9963, test_loss: 0.9666, test_f1: 0.5077
 epoch: 4, train_loss: 0.9648, test_loss: 0.9461, test_f1: 0.5079
 epoch: 5, train_loss: 0.9372, test_loss: 0.9480, test_f1: 0.5107
 epoch: 6, train_loss: 0.9323, test_loss: 0.9318, test_f1: 0.5284
 epoch: 7, train_loss: 0.8985, test_loss: 0.9439, test_f1: 0.5550
 epoch: 8, train_loss: 0.8866, test_loss: 0.9318, test_f1: 0.5334
 epoch: 9, train_loss: 0.8654, test_loss: 0.9439, test_f1: 0.5404
 epoch: 10, train_loss: 0.8521, test_loss: 0.9221, test_f1: 0.5332
 epoch: 11, train_loss: 0.8349, test_loss: 0.9320, test_f1: 0.5443
 epoch: 12, train_loss: 0.8155, test_loss: 0.9320, test_f1: 0.5524
 epoch: 13, train_loss: 0.8094, test_loss: 0.9216, test_f1: 0.5523
 epoch: 14, train_loss: 0.7938, test_loss: 0.9082, test_f1: 0.5507
 epoch: 15, train_loss: 0.7748, test_loss: 0.9180, test_f1: 0.5731
 epoch: 16, train_loss: 0.7747, test_loss: 0.9642, test_f1: 0.5424
 epoch: 17, train_loss: 0.7507, test_loss: 0.9208, test_f1: 0.5645
 epoch: 18, train_loss: 0.7395, test_loss: 0.9160, test_f1: 0.5617
 epoch: 19, train_loss: 0.7322, test_loss: 0.9430, test_f1: 0.5541
 epoch: 20, train_loss: 0.7346, test_loss: 0.9362, test_f1: 0.5596
 epoch: 21, train_loss: 0.6992, test_loss: 0.9451, test_f1: 0.5753
 epoch: 22, train_loss: 0.6986, test_loss: 0.9269, test_f1: 0.5775
 epoch: 23, train_loss: 0.6942, test_loss: 0.9904, test_f1: 0.5528
 epoch: 24, train_loss: 0.6832, test_loss: 0.9318, test_f1: 0.5720
 epoch: 25, train_loss: 0.6718, test_loss: 1.0082, test_f1: 0.5560
 epoch: 26, train_loss: 0.6613, test_loss: 0.9283, test_f1: 0.5899
 epoch: 27, train_loss: 0.6710, test_loss: 0.9003, test_f1: 0.6012
 epoch: 28, train_loss: 0.6547, test_loss: 0.9307, test_f1: 0.6012
 epoch: 29, train_loss: 0.6520, test_loss: 0.9481, test_f1: 0.5855
 epoch: 30, train_loss: 0.6394, test_loss: 0.9789, test_f1: 0.5754
 epoch: 31, train_loss: 0.6281, test_loss: 0.9133, test_f1: 0.6357
 epoch: 32, train_loss: 0.6076, test_loss: 0.9480, test_f1: 0.5888
 epoch: 33, train_loss: 0.6249, test_loss: 0.9805, test_f1: 0.5734
 epoch: 34, train_loss: 0.6019, test_loss: 0.9283, test_f1: 0.5939
 epoch: 35, train_loss: 0.6072, test_loss: 0.9495, test_f1: 0.5865
 epoch: 36, train_loss: 0.5943, test_loss: 0.9430, test_f1: 0.5851
 epoch: 37, train_loss: 0.5825, test_loss: 0.9537, test_f1: 0.6108
 epoch: 38, train_loss: 0.5724, test_loss: 0.9620, test_f1: 0.6004
 epoch: 39, train_loss: 0.5707, test_loss: 0.9352, test_f1: 0.5876
 epoch: 40, train_loss: 0.5537, test_loss: 0.9677, test_f1: 0.5756
 epoch: 41, train_loss: 0.5480, test_loss: 0.9473, test_f1: 0.6107
 epoch: 42, train_loss: 0.5281, test_loss: 0.9440, test_f1: 0.6269
 epoch: 43, train_loss: 0.5584, test_loss: 0.9337, test_f1: 0.6181
 epoch: 44, train_loss: 0.5226, test_loss: 0.9701, test_f1: 0.6151
 epoch: 45, train_loss: 0.5436, test_loss: 0.9531, test_f1: 0.6271
 epoch: 46, train_loss: 0.5185, test_loss: 0.9382, test_f1: 0.6282
 epoch: 47, train_loss: 0.4939, test_loss: 1.0114, test_f1: 0.6219
 epoch: 48, train_loss: 0.5217, test_loss: 1.0269, test_f1: 0.6162
 epoch: 49, train_loss: 0.5021, test_loss: 0.9596, test_f1: 0.6192
 epoch: 50, train_loss: 0.4913, test_loss: 0.9771, test_f1: 0.6341
 epoch: 51, train_loss: 0.4802, test_loss: 0.9674, test_f1: 0.6216
 epoch: 52, train_loss: 0.4655, test_loss: 0.9121, test_f1: 0.6299
 epoch: 53, train_loss: 0.4563, test_loss: 1.0238, test_f1: 0.6195
 epoch: 54, train_loss: 0.4615, test_loss: 0.9779, test_f1: 0.6299
 epoch: 55, train_loss: 0.4547, test_loss: 0.9751, test_f1: 0.6295
 epoch: 56, train_loss: 0.4478, test_loss: 0.9426, test_f1: 0.6560
 epoch: 57, train_loss: 0.4437, test_loss: 0.9866, test_f1: 0.6204
 epoch: 58, train_loss: 0.4531, test_loss: 0.9629, test_f1: 0.6273
 epoch: 59, train_loss: 0.4331, test_loss: 0.9264, test_f1: 0.6361
 epoch: 60, train_loss: 0.4355, test_loss: 0.9396, test_f1: 0.6588
 epoch: 61, train_loss: 0.4313, test_loss: 1.0042, test_f1: 0.6467
 epoch: 62, train_loss: 0.4245, test_loss: 0.9778, test_f1: 0.6472
 epoch: 63, train_loss: 0.4118, test_loss: 0.9684, test_f1: 0.6458
 epoch: 64, train_loss: 0.4218, test_loss: 0.9430, test_f1: 0.6544
 epoch: 65, train_loss: 0.4128, test_loss: 0.9647, test_f1: 0.6505
 epoch: 66, train_loss: 0.4111, test_loss: 0.9789, test_f1: 0.6496
 epoch: 67, train_loss: 0.4204, test_loss: 1.0874, test_f1: 0.6203
 epoch: 68, train_loss: 0.3958, test_loss: 1.0209, test_f1: 0.6389
 epoch: 69, train_loss: 0.3977, test_loss: 1.0055, test_f1: 0.6309
 epoch: 70, train_loss: 0.3958, test_loss: 1.0181, test_f1: 0.6327
 epoch: 71, train_loss: 0.4080, test_loss: 1.0174, test_f1: 0.6485
 epoch: 72, train_loss: 0.4036, test_loss: 1.0375, test_f1: 0.6354
 epoch: 73, train_loss: 0.3872, test_loss: 1.0675, test_f1: 0.6427
 epoch: 74, train_loss: 0.4090, test_loss: 1.0141, test_f1: 0.6393
 epoch: 75, train_loss: 0.3895, test_loss: 1.0074, test_f1: 0.6290
 epoch: 76, train_loss: 0.3770, test_loss: 0.9715, test_f1: 0.6414
 epoch: 77, train_loss: 0.3892, test_loss: 1.0318, test_f1: 0.6574
 epoch: 78, train_loss: 0.3756, test_loss: 1.0513, test_f1: 0.6478
 epoch: 79, train_loss: 0.3829, test_loss: 1.0895, test_f1: 0.6548
 epoch: 80, train_loss: 0.3793, test_loss: 1.0204, test_f1: 0.6577
 epoch: 81, train_loss: 0.3806, test_loss: 1.1399, test_f1: 0.6258
 epoch: 82, train_loss: 0.3829, test_loss: 1.0637, test_f1: 0.6201
 epoch: 83, train_loss: 0.3641, test_loss: 1.0865, test_f1: 0.6334
 epoch: 84, train_loss: 0.3544, test_loss: 1.1939, test_f1: 0.6276
 epoch: 85, train_loss: 0.3639, test_loss: 1.1444, test_f1: 0.6228
 epoch: 86, train_loss: 0.3568, test_loss: 1.1196, test_f1: 0.6562
 epoch: 87, train_loss: 0.3571, test_loss: 1.1884, test_f1: 0.6454
 epoch: 88, train_loss: 0.3481, test_loss: 1.1801, test_f1: 0.6374
 epoch: 89, train_loss: 0.3611, test_loss: 1.1312, test_f1: 0.6311
 epoch: 90, train_loss: 0.3518, test_loss: 1.1591, test_f1: 0.6384
 epoch: 91, train_loss: 0.3511, test_loss: 1.1236, test_f1: 0.6491
 epoch: 92, train_loss: 0.3310, test_loss: 1.1790, test_f1: 0.6242
 epoch: 93, train_loss: 0.3344, test_loss: 1.1851, test_f1: 0.6286
 epoch: 94, train_loss: 0.3454, test_loss: 1.2287, test_f1: 0.6466
 epoch: 95, train_loss: 0.3349, test_loss: 1.2154, test_f1: 0.6302
 epoch: 96, train_loss: 0.3397, test_loss: 1.2575, test_f1: 0.6197
 epoch: 97, train_loss: 0.3260, test_loss: 1.3228, test_f1: 0.6294
 epoch: 98, train_loss: 0.3266, test_loss: 1.2926, test_f1: 0.6359
 epoch: 99, train_loss: 0.3359, test_loss: 1.4506, test_f1: 0.6289
##################ITERATION #5 ****************************************
 epoch: 0, train_loss: 1.2096, test_loss: 1.1236, test_f1: 0.3932
 epoch: 1, train_loss: 1.0743, test_loss: 0.9951, test_f1: 0.5076
 epoch: 2, train_loss: 1.0279, test_loss: 0.9644, test_f1: 0.4804
 epoch: 3, train_loss: 0.9985, test_loss: 0.9629, test_f1: 0.4516
 epoch: 4, train_loss: 0.9688, test_loss: 0.9195, test_f1: 0.4855
 epoch: 5, train_loss: 0.9414, test_loss: 0.9338, test_f1: 0.4868
 epoch: 6, train_loss: 0.9320, test_loss: 0.9025, test_f1: 0.5373
 epoch: 7, train_loss: 0.9118, test_loss: 0.9035, test_f1: 0.5378
 epoch: 8, train_loss: 0.8997, test_loss: 0.9086, test_f1: 0.5480
 epoch: 9, train_loss: 0.8803, test_loss: 0.9618, test_f1: 0.5304
 epoch: 10, train_loss: 0.8609, test_loss: 0.9109, test_f1: 0.5601
 epoch: 11, train_loss: 0.8504, test_loss: 0.8766, test_f1: 0.5595
 epoch: 12, train_loss: 0.8328, test_loss: 0.8807, test_f1: 0.5662
 epoch: 13, train_loss: 0.8326, test_loss: 0.8905, test_f1: 0.5842
 epoch: 14, train_loss: 0.8166, test_loss: 0.8688, test_f1: 0.5747
 epoch: 15, train_loss: 0.8119, test_loss: 0.8768, test_f1: 0.5752
 epoch: 16, train_loss: 0.8010, test_loss: 0.8709, test_f1: 0.5734
 epoch: 17, train_loss: 0.7776, test_loss: 0.9309, test_f1: 0.5461
 epoch: 18, train_loss: 0.7711, test_loss: 0.8584, test_f1: 0.6091
 epoch: 19, train_loss: 0.7568, test_loss: 0.8939, test_f1: 0.5940
 epoch: 20, train_loss: 0.7504, test_loss: 0.9578, test_f1: 0.5734
 epoch: 21, train_loss: 0.7405, test_loss: 0.8921, test_f1: 0.5907
 epoch: 22, train_loss: 0.7245, test_loss: 0.8922, test_f1: 0.5752
 epoch: 23, train_loss: 0.7192, test_loss: 0.9176, test_f1: 0.5799
 epoch: 24, train_loss: 0.7167, test_loss: 0.8863, test_f1: 0.5774
 epoch: 25, train_loss: 0.7095, test_loss: 0.9033, test_f1: 0.5973
 epoch: 26, train_loss: 0.7053, test_loss: 0.8816, test_f1: 0.5915
 epoch: 27, train_loss: 0.6945, test_loss: 0.9376, test_f1: 0.5752
 epoch: 28, train_loss: 0.6835, test_loss: 0.9861, test_f1: 0.5641
 epoch: 29, train_loss: 0.6780, test_loss: 0.9149, test_f1: 0.6015
 epoch: 30, train_loss: 0.6745, test_loss: 0.8858, test_f1: 0.6012
 epoch: 31, train_loss: 0.6457, test_loss: 0.9486, test_f1: 0.6025
 epoch: 32, train_loss: 0.6478, test_loss: 0.9071, test_f1: 0.6039
 epoch: 33, train_loss: 0.6341, test_loss: 0.8732, test_f1: 0.6146
 epoch: 34, train_loss: 0.6366, test_loss: 0.9142, test_f1: 0.5913
 epoch: 35, train_loss: 0.6326, test_loss: 0.9838, test_f1: 0.5785
 epoch: 36, train_loss: 0.6302, test_loss: 0.9012, test_f1: 0.5961
 epoch: 37, train_loss: 0.6120, test_loss: 0.9584, test_f1: 0.5881
 epoch: 38, train_loss: 0.5961, test_loss: 0.8850, test_f1: 0.6048
 epoch: 39, train_loss: 0.5931, test_loss: 0.9413, test_f1: 0.6238
 epoch: 40, train_loss: 0.6133, test_loss: 0.8122, test_f1: 0.6049
 epoch: 41, train_loss: 0.5967, test_loss: 0.9104, test_f1: 0.5903
 epoch: 42, train_loss: 0.5875, test_loss: 0.9300, test_f1: 0.6021
 epoch: 43, train_loss: 0.5794, test_loss: 0.8919, test_f1: 0.6057
 epoch: 44, train_loss: 0.5675, test_loss: 0.9457, test_f1: 0.5879
 epoch: 45, train_loss: 0.5621, test_loss: 0.9045, test_f1: 0.6148
 epoch: 46, train_loss: 0.5631, test_loss: 0.9162, test_f1: 0.6073
 epoch: 47, train_loss: 0.5413, test_loss: 0.9072, test_f1: 0.6270
 epoch: 48, train_loss: 0.5315, test_loss: 0.9441, test_f1: 0.6508
 epoch: 49, train_loss: 0.5365, test_loss: 0.9383, test_f1: 0.6114
 epoch: 50, train_loss: 0.5398, test_loss: 1.0122, test_f1: 0.6010
 epoch: 51, train_loss: 0.5067, test_loss: 0.9682, test_f1: 0.5896
 epoch: 52, train_loss: 0.4986, test_loss: 1.0209, test_f1: 0.6068
 epoch: 53, train_loss: 0.4953, test_loss: 0.9996, test_f1: 0.5887
 epoch: 54, train_loss: 0.4773, test_loss: 0.9991, test_f1: 0.6079
 epoch: 55, train_loss: 0.4861, test_loss: 1.0020, test_f1: 0.6072
 epoch: 56, train_loss: 0.4787, test_loss: 1.0766, test_f1: 0.6035
 epoch: 57, train_loss: 0.4631, test_loss: 0.9043, test_f1: 0.6245
 epoch: 58, train_loss: 0.4611, test_loss: 1.0314, test_f1: 0.6064
 epoch: 59, train_loss: 0.4724, test_loss: 1.0504, test_f1: 0.6120
 epoch: 60, train_loss: 0.4690, test_loss: 1.0155, test_f1: 0.6268
 epoch: 61, train_loss: 0.4503, test_loss: 1.0062, test_f1: 0.6104
 epoch: 62, train_loss: 0.4584, test_loss: 1.0492, test_f1: 0.6169
 epoch: 63, train_loss: 0.4445, test_loss: 1.0672, test_f1: 0.6039
 epoch: 64, train_loss: 0.4560, test_loss: 1.0819, test_f1: 0.6392
 epoch: 65, train_loss: 0.4447, test_loss: 1.0627, test_f1: 0.6480
 epoch: 66, train_loss: 0.4470, test_loss: 1.0571, test_f1: 0.6190
 epoch: 67, train_loss: 0.4318, test_loss: 1.0282, test_f1: 0.6350
 epoch: 68, train_loss: 0.4361, test_loss: 1.0773, test_f1: 0.6288
 epoch: 69, train_loss: 0.4267, test_loss: 1.0708, test_f1: 0.6371
 epoch: 70, train_loss: 0.4231, test_loss: 1.1030, test_f1: 0.6428
 epoch: 71, train_loss: 0.4152, test_loss: 1.0798, test_f1: 0.6396
 epoch: 72, train_loss: 0.4117, test_loss: 1.0621, test_f1: 0.6385
 epoch: 73, train_loss: 0.4248, test_loss: 1.1585, test_f1: 0.6306
 epoch: 74, train_loss: 0.4136, test_loss: 1.0470, test_f1: 0.6354
 epoch: 75, train_loss: 0.4170, test_loss: 1.0618, test_f1: 0.6207
 epoch: 76, train_loss: 0.4071, test_loss: 1.1098, test_f1: 0.6406
 epoch: 77, train_loss: 0.4191, test_loss: 1.0338, test_f1: 0.6317
 epoch: 78, train_loss: 0.4040, test_loss: 1.0885, test_f1: 0.6219
 epoch: 79, train_loss: 0.4072, test_loss: 1.0513, test_f1: 0.6327
 epoch: 80, train_loss: 0.4039, test_loss: 1.0474, test_f1: 0.6317
 epoch: 81, train_loss: 0.3912, test_loss: 1.0849, test_f1: 0.6391
 epoch: 82, train_loss: 0.4026, test_loss: 1.0689, test_f1: 0.6366
 epoch: 83, train_loss: 0.3865, test_loss: 1.1315, test_f1: 0.6453
 epoch: 84, train_loss: 0.3854, test_loss: 1.1222, test_f1: 0.6380
 epoch: 85, train_loss: 0.3881, test_loss: 1.1602, test_f1: 0.6473
 epoch: 86, train_loss: 0.3610, test_loss: 1.0587, test_f1: 0.6332
 epoch: 87, train_loss: 0.3692, test_loss: 1.0928, test_f1: 0.6436
 epoch: 88, train_loss: 0.3707, test_loss: 1.1791, test_f1: 0.6337
 epoch: 89, train_loss: 0.3790, test_loss: 1.1605, test_f1: 0.6256
 epoch: 90, train_loss: 0.3757, test_loss: 1.1306, test_f1: 0.6307
 epoch: 91, train_loss: 0.3772, test_loss: 1.0573, test_f1: 0.6506
 epoch: 92, train_loss: 0.3651, test_loss: 1.1064, test_f1: 0.6225
 epoch: 93, train_loss: 0.3648, test_loss: 1.0936, test_f1: 0.6340
 epoch: 94, train_loss: 0.3465, test_loss: 1.0682, test_f1: 0.6311
 epoch: 95, train_loss: 0.3543, test_loss: 1.1742, test_f1: 0.6375
 epoch: 96, train_loss: 0.3586, test_loss: 1.1271, test_f1: 0.6339
 epoch: 97, train_loss: 0.3700, test_loss: 1.1545, test_f1: 0.6318
 epoch: 98, train_loss: 0.3527, test_loss: 1.0347, test_f1: 0.6537
 epoch: 99, train_loss: 0.3531, test_loss: 1.1180, test_f1: 0.6551
##################ITERATION #6 ****************************************
 epoch: 0, train_loss: 1.1968, test_loss: 1.1436, test_f1: 0.3868
 epoch: 1, train_loss: 1.0777, test_loss: 0.9814, test_f1: 0.4995
 epoch: 2, train_loss: 1.0252, test_loss: 0.9554, test_f1: 0.4836
 epoch: 3, train_loss: 0.9978, test_loss: 0.9337, test_f1: 0.5317
 epoch: 4, train_loss: 0.9654, test_loss: 0.9236, test_f1: 0.5448
 epoch: 5, train_loss: 0.9539, test_loss: 0.9149, test_f1: 0.5257
 epoch: 6, train_loss: 0.9332, test_loss: 0.8998, test_f1: 0.5214
 epoch: 7, train_loss: 0.9205, test_loss: 0.8982, test_f1: 0.5311
 epoch: 8, train_loss: 0.9030, test_loss: 0.8726, test_f1: 0.5609
 epoch: 9, train_loss: 0.8953, test_loss: 0.8563, test_f1: 0.5616
 epoch: 10, train_loss: 0.8876, test_loss: 0.8715, test_f1: 0.5499
 epoch: 11, train_loss: 0.8626, test_loss: 0.8767, test_f1: 0.5667
 epoch: 12, train_loss: 0.8473, test_loss: 0.8522, test_f1: 0.5636
 epoch: 13, train_loss: 0.8483, test_loss: 0.8776, test_f1: 0.5728
 epoch: 14, train_loss: 0.8184, test_loss: 0.8883, test_f1: 0.5526
 epoch: 15, train_loss: 0.8178, test_loss: 0.8853, test_f1: 0.5925
 epoch: 16, train_loss: 0.8007, test_loss: 0.8533, test_f1: 0.6051
 epoch: 17, train_loss: 0.8001, test_loss: 0.8954, test_f1: 0.5842
 epoch: 18, train_loss: 0.7757, test_loss: 0.9060, test_f1: 0.5895
 epoch: 19, train_loss: 0.7703, test_loss: 0.8810, test_f1: 0.5808
 epoch: 20, train_loss: 0.7653, test_loss: 0.8779, test_f1: 0.5841
 epoch: 21, train_loss: 0.7576, test_loss: 0.8578, test_f1: 0.6090
 epoch: 22, train_loss: 0.7541, test_loss: 0.8603, test_f1: 0.6121
 epoch: 23, train_loss: 0.7438, test_loss: 0.9130, test_f1: 0.6095
 epoch: 24, train_loss: 0.7284, test_loss: 0.8383, test_f1: 0.6086
 epoch: 25, train_loss: 0.7383, test_loss: 0.8601, test_f1: 0.6051
 epoch: 26, train_loss: 0.7219, test_loss: 0.8868, test_f1: 0.5937
 epoch: 27, train_loss: 0.6994, test_loss: 0.8256, test_f1: 0.5968
 epoch: 28, train_loss: 0.6974, test_loss: 0.8978, test_f1: 0.6035
 epoch: 29, train_loss: 0.6982, test_loss: 0.8931, test_f1: 0.6180
 epoch: 30, train_loss: 0.6851, test_loss: 0.8867, test_f1: 0.6193
 epoch: 31, train_loss: 0.6632, test_loss: 0.8964, test_f1: 0.6039
 epoch: 32, train_loss: 0.6518, test_loss: 0.8656, test_f1: 0.6254
 epoch: 33, train_loss: 0.6621, test_loss: 0.9151, test_f1: 0.5990
 epoch: 34, train_loss: 0.6559, test_loss: 0.8867, test_f1: 0.6140
 epoch: 35, train_loss: 0.6597, test_loss: 0.8683, test_f1: 0.6279
 epoch: 36, train_loss: 0.6446, test_loss: 0.8576, test_f1: 0.6303
 epoch: 37, train_loss: 0.6387, test_loss: 0.8779, test_f1: 0.6215
 epoch: 38, train_loss: 0.6247, test_loss: 0.8915, test_f1: 0.6439
 epoch: 39, train_loss: 0.6162, test_loss: 0.8392, test_f1: 0.6370
 epoch: 40, train_loss: 0.5989, test_loss: 0.8762, test_f1: 0.6227
 epoch: 41, train_loss: 0.6038, test_loss: 0.8753, test_f1: 0.6522
 epoch: 42, train_loss: 0.6043, test_loss: 0.8868, test_f1: 0.6188
 epoch: 43, train_loss: 0.6055, test_loss: 0.8158, test_f1: 0.6507
 epoch: 44, train_loss: 0.5887, test_loss: 0.8481, test_f1: 0.6029
 epoch: 45, train_loss: 0.5720, test_loss: 0.8629, test_f1: 0.6476
 epoch: 46, train_loss: 0.5701, test_loss: 0.8387, test_f1: 0.6181
 epoch: 47, train_loss: 0.5773, test_loss: 0.9314, test_f1: 0.6343
 epoch: 48, train_loss: 0.5540, test_loss: 0.7990, test_f1: 0.6413
 epoch: 49, train_loss: 0.5538, test_loss: 0.8686, test_f1: 0.6268
 epoch: 50, train_loss: 0.5580, test_loss: 0.8102, test_f1: 0.6511
 epoch: 51, train_loss: 0.5241, test_loss: 0.8938, test_f1: 0.6244
 epoch: 52, train_loss: 0.5109, test_loss: 0.8476, test_f1: 0.6302
 epoch: 53, train_loss: 0.5001, test_loss: 0.9161, test_f1: 0.6261
 epoch: 54, train_loss: 0.5152, test_loss: 0.8693, test_f1: 0.6321
 epoch: 55, train_loss: 0.5170, test_loss: 0.8671, test_f1: 0.6331
 epoch: 56, train_loss: 0.4996, test_loss: 0.8928, test_f1: 0.6404
 epoch: 57, train_loss: 0.5031, test_loss: 0.8869, test_f1: 0.6118
 epoch: 58, train_loss: 0.4902, test_loss: 0.8589, test_f1: 0.6574
 epoch: 59, train_loss: 0.4762, test_loss: 0.8674, test_f1: 0.6366
 epoch: 60, train_loss: 0.4908, test_loss: 0.9021, test_f1: 0.6455
 epoch: 61, train_loss: 0.4838, test_loss: 0.9124, test_f1: 0.6376
 epoch: 62, train_loss: 0.4756, test_loss: 0.8923, test_f1: 0.6351
 epoch: 63, train_loss: 0.4860, test_loss: 0.9246, test_f1: 0.6446
 epoch: 64, train_loss: 0.4764, test_loss: 0.8846, test_f1: 0.6431
 epoch: 65, train_loss: 0.4658, test_loss: 0.9167, test_f1: 0.6363
 epoch: 66, train_loss: 0.4634, test_loss: 0.9252, test_f1: 0.6326
 epoch: 67, train_loss: 0.4652, test_loss: 0.9078, test_f1: 0.6513
 epoch: 68, train_loss: 0.4717, test_loss: 0.9168, test_f1: 0.6369
 epoch: 69, train_loss: 0.4523, test_loss: 0.8971, test_f1: 0.6313
 epoch: 70, train_loss: 0.4545, test_loss: 0.9354, test_f1: 0.6315
 epoch: 71, train_loss: 0.4629, test_loss: 0.8925, test_f1: 0.6408
 epoch: 72, train_loss: 0.4641, test_loss: 0.9581, test_f1: 0.6210
 epoch: 73, train_loss: 0.4426, test_loss: 0.9888, test_f1: 0.6238
 epoch: 74, train_loss: 0.4394, test_loss: 0.9740, test_f1: 0.6416
 epoch: 75, train_loss: 0.4327, test_loss: 0.9339, test_f1: 0.6383
 epoch: 76, train_loss: 0.4328, test_loss: 0.9247, test_f1: 0.6454
 epoch: 77, train_loss: 0.4275, test_loss: 0.9675, test_f1: 0.6243
 epoch: 78, train_loss: 0.4415, test_loss: 0.8643, test_f1: 0.6334
 epoch: 79, train_loss: 0.4181, test_loss: 0.8843, test_f1: 0.6379
 epoch: 80, train_loss: 0.4346, test_loss: 0.8521, test_f1: 0.6515
 epoch: 81, train_loss: 0.4270, test_loss: 0.8929, test_f1: 0.6456
 epoch: 82, train_loss: 0.4167, test_loss: 0.9014, test_f1: 0.6554
 epoch: 83, train_loss: 0.4133, test_loss: 0.9520, test_f1: 0.6388
 epoch: 84, train_loss: 0.4199, test_loss: 0.9050, test_f1: 0.6603
 epoch: 85, train_loss: 0.4117, test_loss: 0.9212, test_f1: 0.6472
 epoch: 86, train_loss: 0.4138, test_loss: 0.9956, test_f1: 0.6271
 epoch: 87, train_loss: 0.4086, test_loss: 0.9501, test_f1: 0.6491
 epoch: 88, train_loss: 0.4171, test_loss: 0.8957, test_f1: 0.6469
 epoch: 89, train_loss: 0.4244, test_loss: 0.9312, test_f1: 0.6338
 epoch: 90, train_loss: 0.4021, test_loss: 0.9798, test_f1: 0.6468
 epoch: 91, train_loss: 0.4047, test_loss: 0.9790, test_f1: 0.6438
 epoch: 92, train_loss: 0.3868, test_loss: 0.9174, test_f1: 0.6619
 epoch: 93, train_loss: 0.3918, test_loss: 0.9395, test_f1: 0.6397
 epoch: 94, train_loss: 0.3995, test_loss: 0.9824, test_f1: 0.6391
 epoch: 95, train_loss: 0.3985, test_loss: 1.0347, test_f1: 0.6364
 epoch: 96, train_loss: 0.3761, test_loss: 1.0308, test_f1: 0.6599
 epoch: 97, train_loss: 0.3875, test_loss: 1.0353, test_f1: 0.6554
 epoch: 98, train_loss: 0.3871, test_loss: 1.0188, test_f1: 0.6589
 epoch: 99, train_loss: 0.3848, test_loss: 1.0744, test_f1: 0.6477
##################ITERATION #7 ****************************************
 epoch: 0, train_loss: 1.2191, test_loss: 1.0954, test_f1: 0.4226
 epoch: 1, train_loss: 1.0696, test_loss: 0.9979, test_f1: 0.4890
 epoch: 2, train_loss: 1.0330, test_loss: 0.9777, test_f1: 0.5022
 epoch: 3, train_loss: 1.0009, test_loss: 0.9507, test_f1: 0.4781
 epoch: 4, train_loss: 0.9761, test_loss: 0.9473, test_f1: 0.4979
 epoch: 5, train_loss: 0.9484, test_loss: 0.9305, test_f1: 0.4821
 epoch: 6, train_loss: 0.9325, test_loss: 0.9252, test_f1: 0.5224
 epoch: 7, train_loss: 0.9225, test_loss: 0.9254, test_f1: 0.4910
 epoch: 8, train_loss: 0.8992, test_loss: 0.9143, test_f1: 0.5287
 epoch: 9, train_loss: 0.8925, test_loss: 0.9137, test_f1: 0.5326
 epoch: 10, train_loss: 0.8682, test_loss: 0.9406, test_f1: 0.5404
 epoch: 11, train_loss: 0.8640, test_loss: 0.9573, test_f1: 0.4928
 epoch: 12, train_loss: 0.8559, test_loss: 0.8915, test_f1: 0.5441
 epoch: 13, train_loss: 0.8369, test_loss: 0.8856, test_f1: 0.5533
 epoch: 14, train_loss: 0.8251, test_loss: 0.9422, test_f1: 0.5617
 epoch: 15, train_loss: 0.8149, test_loss: 0.9093, test_f1: 0.5242
 epoch: 16, train_loss: 0.7941, test_loss: 1.0258, test_f1: 0.5392
 epoch: 17, train_loss: 0.7984, test_loss: 0.8616, test_f1: 0.5949
 epoch: 18, train_loss: 0.7838, test_loss: 0.9364, test_f1: 0.5464
 epoch: 19, train_loss: 0.7655, test_loss: 0.9176, test_f1: 0.5701
 epoch: 20, train_loss: 0.7667, test_loss: 0.9185, test_f1: 0.5663
 epoch: 21, train_loss: 0.7569, test_loss: 0.8691, test_f1: 0.5915
 epoch: 22, train_loss: 0.7392, test_loss: 0.8705, test_f1: 0.5934
 epoch: 23, train_loss: 0.7405, test_loss: 0.8984, test_f1: 0.5844
 epoch: 24, train_loss: 0.7176, test_loss: 0.8969, test_f1: 0.6054
 epoch: 25, train_loss: 0.7090, test_loss: 0.9927, test_f1: 0.5970
 epoch: 26, train_loss: 0.7151, test_loss: 0.9428, test_f1: 0.5744
 epoch: 27, train_loss: 0.6982, test_loss: 0.8685, test_f1: 0.5869
 epoch: 28, train_loss: 0.6925, test_loss: 0.8519, test_f1: 0.5921
 epoch: 29, train_loss: 0.6645, test_loss: 0.8555, test_f1: 0.5993
 epoch: 30, train_loss: 0.6587, test_loss: 0.8604, test_f1: 0.6118
 epoch: 31, train_loss: 0.6696, test_loss: 0.8588, test_f1: 0.6039
 epoch: 32, train_loss: 0.6470, test_loss: 0.8581, test_f1: 0.6039
 epoch: 33, train_loss: 0.6518, test_loss: 0.8611, test_f1: 0.6039
 epoch: 34, train_loss: 0.6431, test_loss: 0.9508, test_f1: 0.6009
 epoch: 35, train_loss: 0.6401, test_loss: 0.8300, test_f1: 0.6449
 epoch: 36, train_loss: 0.6353, test_loss: 0.8117, test_f1: 0.6340
 epoch: 37, train_loss: 0.6358, test_loss: 0.8681, test_f1: 0.6156
 epoch: 38, train_loss: 0.6203, test_loss: 0.9199, test_f1: 0.5911
 epoch: 39, train_loss: 0.6079, test_loss: 0.9246, test_f1: 0.6111
 epoch: 40, train_loss: 0.6012, test_loss: 0.8337, test_f1: 0.6175
 epoch: 41, train_loss: 0.5978, test_loss: 0.9115, test_f1: 0.6153
 epoch: 42, train_loss: 0.5877, test_loss: 0.8567, test_f1: 0.6226
 epoch: 43, train_loss: 0.5865, test_loss: 0.9505, test_f1: 0.6293
 epoch: 44, train_loss: 0.6051, test_loss: 0.8383, test_f1: 0.6137
 epoch: 45, train_loss: 0.5775, test_loss: 0.8597, test_f1: 0.6399
 epoch: 46, train_loss: 0.5741, test_loss: 0.9475, test_f1: 0.6263
 epoch: 47, train_loss: 0.5679, test_loss: 0.8739, test_f1: 0.6410
 epoch: 48, train_loss: 0.5429, test_loss: 0.9705, test_f1: 0.6116
 epoch: 49, train_loss: 0.5486, test_loss: 0.8498, test_f1: 0.6436
 epoch: 50, train_loss: 0.5565, test_loss: 0.8433, test_f1: 0.6291
 epoch: 51, train_loss: 0.5239, test_loss: 0.8201, test_f1: 0.6471
 epoch: 52, train_loss: 0.5247, test_loss: 0.8097, test_f1: 0.6464
 epoch: 53, train_loss: 0.5185, test_loss: 0.8557, test_f1: 0.6429
 epoch: 54, train_loss: 0.5025, test_loss: 0.8170, test_f1: 0.6661
 epoch: 55, train_loss: 0.5019, test_loss: 0.9353, test_f1: 0.6493
 epoch: 56, train_loss: 0.4936, test_loss: 0.8989, test_f1: 0.6440
 epoch: 57, train_loss: 0.4947, test_loss: 0.8753, test_f1: 0.6445
 epoch: 58, train_loss: 0.4872, test_loss: 0.8692, test_f1: 0.6448
 epoch: 59, train_loss: 0.4882, test_loss: 0.8328, test_f1: 0.6586
 epoch: 60, train_loss: 0.4708, test_loss: 0.8631, test_f1: 0.6414
 epoch: 61, train_loss: 0.4724, test_loss: 0.8738, test_f1: 0.6614
 epoch: 62, train_loss: 0.4813, test_loss: 0.8973, test_f1: 0.6568
 epoch: 63, train_loss: 0.4693, test_loss: 0.8636, test_f1: 0.6635
 epoch: 64, train_loss: 0.4697, test_loss: 0.8885, test_f1: 0.6634
 epoch: 65, train_loss: 0.4720, test_loss: 0.9838, test_f1: 0.6555
 epoch: 66, train_loss: 0.4488, test_loss: 0.8916, test_f1: 0.6625
 epoch: 67, train_loss: 0.4617, test_loss: 0.8860, test_f1: 0.6613
 epoch: 68, train_loss: 0.4527, test_loss: 0.9257, test_f1: 0.6655
 epoch: 69, train_loss: 0.4541, test_loss: 0.9187, test_f1: 0.6709
 epoch: 70, train_loss: 0.4423, test_loss: 0.8782, test_f1: 0.6804
 epoch: 71, train_loss: 0.4519, test_loss: 0.9597, test_f1: 0.6778
 epoch: 72, train_loss: 0.4499, test_loss: 0.8572, test_f1: 0.6705
 epoch: 73, train_loss: 0.4423, test_loss: 0.9137, test_f1: 0.6845
 epoch: 74, train_loss: 0.4266, test_loss: 0.8837, test_f1: 0.6729
 epoch: 75, train_loss: 0.4408, test_loss: 0.9044, test_f1: 0.6705
 epoch: 76, train_loss: 0.4468, test_loss: 0.9614, test_f1: 0.6598
 epoch: 77, train_loss: 0.4329, test_loss: 0.8902, test_f1: 0.6754
 epoch: 78, train_loss: 0.4290, test_loss: 0.9081, test_f1: 0.6793
 epoch: 79, train_loss: 0.4209, test_loss: 0.9607, test_f1: 0.6662
 epoch: 80, train_loss: 0.4204, test_loss: 0.9885, test_f1: 0.6807
 epoch: 81, train_loss: 0.4172, test_loss: 0.9739, test_f1: 0.6675
 epoch: 82, train_loss: 0.4184, test_loss: 0.9705, test_f1: 0.6677
 epoch: 83, train_loss: 0.4138, test_loss: 0.9117, test_f1: 0.6791
 epoch: 84, train_loss: 0.4171, test_loss: 0.9594, test_f1: 0.6839
 epoch: 85, train_loss: 0.4184, test_loss: 1.0706, test_f1: 0.6659
 epoch: 86, train_loss: 0.4209, test_loss: 0.9526, test_f1: 0.6829
 epoch: 87, train_loss: 0.4047, test_loss: 0.9909, test_f1: 0.6818
 epoch: 88, train_loss: 0.3922, test_loss: 1.0168, test_f1: 0.6827
 epoch: 89, train_loss: 0.4045, test_loss: 0.9030, test_f1: 0.6810
 epoch: 90, train_loss: 0.4070, test_loss: 0.9479, test_f1: 0.6632
 epoch: 91, train_loss: 0.4005, test_loss: 0.9749, test_f1: 0.6720
 epoch: 92, train_loss: 0.3844, test_loss: 0.9707, test_f1: 0.6824
 epoch: 93, train_loss: 0.3889, test_loss: 0.9907, test_f1: 0.6832
 epoch: 94, train_loss: 0.3836, test_loss: 1.0164, test_f1: 0.6783
 epoch: 95, train_loss: 0.3983, test_loss: 1.0153, test_f1: 0.6689
 epoch: 96, train_loss: 0.3922, test_loss: 1.0672, test_f1: 0.6752
 epoch: 97, train_loss: 0.3877, test_loss: 1.0381, test_f1: 0.6655
 epoch: 98, train_loss: 0.3787, test_loss: 1.0880, test_f1: 0.6679
 epoch: 99, train_loss: 0.3761, test_loss: 1.0387, test_f1: 0.6634
##################ITERATION #8 ****************************************
 epoch: 0, train_loss: 1.2248, test_loss: 1.0925, test_f1: 0.3947
 epoch: 1, train_loss: 1.0778, test_loss: 0.9783, test_f1: 0.4896
 epoch: 2, train_loss: 1.0390, test_loss: 0.9844, test_f1: 0.4916
 epoch: 3, train_loss: 0.9985, test_loss: 0.9536, test_f1: 0.5016
 epoch: 4, train_loss: 0.9684, test_loss: 0.9499, test_f1: 0.4938
 epoch: 5, train_loss: 0.9524, test_loss: 0.9301, test_f1: 0.5251
 epoch: 6, train_loss: 0.9281, test_loss: 0.9213, test_f1: 0.5227
 epoch: 7, train_loss: 0.9072, test_loss: 0.9198, test_f1: 0.5322
 epoch: 8, train_loss: 0.8968, test_loss: 0.9130, test_f1: 0.5332
 epoch: 9, train_loss: 0.8903, test_loss: 0.8860, test_f1: 0.5606
 epoch: 10, train_loss: 0.8699, test_loss: 0.8965, test_f1: 0.5495
 epoch: 11, train_loss: 0.8614, test_loss: 0.8844, test_f1: 0.5641
 epoch: 12, train_loss: 0.8565, test_loss: 0.8982, test_f1: 0.5535
 epoch: 13, train_loss: 0.8525, test_loss: 0.9075, test_f1: 0.5573
 epoch: 14, train_loss: 0.8246, test_loss: 0.8749, test_f1: 0.5729
 epoch: 15, train_loss: 0.8117, test_loss: 0.8827, test_f1: 0.5696
 epoch: 16, train_loss: 0.7953, test_loss: 0.8797, test_f1: 0.5629
 epoch: 17, train_loss: 0.7914, test_loss: 0.8677, test_f1: 0.5710
 epoch: 18, train_loss: 0.7759, test_loss: 0.8847, test_f1: 0.5671
 epoch: 19, train_loss: 0.7808, test_loss: 0.8787, test_f1: 0.5894
 epoch: 20, train_loss: 0.7805, test_loss: 0.8907, test_f1: 0.5814
 epoch: 21, train_loss: 0.7676, test_loss: 0.8929, test_f1: 0.5724
 epoch: 22, train_loss: 0.7531, test_loss: 0.9155, test_f1: 0.5903
 epoch: 23, train_loss: 0.7384, test_loss: 0.8974, test_f1: 0.5777
 epoch: 24, train_loss: 0.7296, test_loss: 0.8785, test_f1: 0.5972
 epoch: 25, train_loss: 0.7309, test_loss: 0.9087, test_f1: 0.6095
 epoch: 26, train_loss: 0.7148, test_loss: 0.8873, test_f1: 0.6124
 epoch: 27, train_loss: 0.7088, test_loss: 0.8838, test_f1: 0.6108
 epoch: 28, train_loss: 0.7033, test_loss: 0.8851, test_f1: 0.5874
 epoch: 29, train_loss: 0.6898, test_loss: 0.8631, test_f1: 0.6163
 epoch: 30, train_loss: 0.6947, test_loss: 0.8839, test_f1: 0.6094
 epoch: 31, train_loss: 0.6727, test_loss: 0.9073, test_f1: 0.6007
 epoch: 32, train_loss: 0.6885, test_loss: 0.8779, test_f1: 0.5898
 epoch: 33, train_loss: 0.6676, test_loss: 0.9001, test_f1: 0.6058
 epoch: 34, train_loss: 0.6599, test_loss: 0.8944, test_f1: 0.6195
 epoch: 35, train_loss: 0.6612, test_loss: 0.8563, test_f1: 0.6243
 epoch: 36, train_loss: 0.6539, test_loss: 0.9127, test_f1: 0.6318
 epoch: 37, train_loss: 0.6392, test_loss: 0.8841, test_f1: 0.6211
 epoch: 38, train_loss: 0.6330, test_loss: 0.9028, test_f1: 0.6051
 epoch: 39, train_loss: 0.6388, test_loss: 0.8793, test_f1: 0.6224
 epoch: 40, train_loss: 0.6206, test_loss: 0.8732, test_f1: 0.6183
 epoch: 41, train_loss: 0.6246, test_loss: 0.8905, test_f1: 0.6249
 epoch: 42, train_loss: 0.6186, test_loss: 0.8726, test_f1: 0.6394
 epoch: 43, train_loss: 0.6194, test_loss: 0.9060, test_f1: 0.6201
 epoch: 44, train_loss: 0.6091, test_loss: 0.8922, test_f1: 0.6193
 epoch: 45, train_loss: 0.5869, test_loss: 0.8352, test_f1: 0.6344
 epoch: 46, train_loss: 0.5880, test_loss: 0.9577, test_f1: 0.6173
 epoch: 47, train_loss: 0.5901, test_loss: 0.9216, test_f1: 0.6477
 epoch: 48, train_loss: 0.5907, test_loss: 0.9154, test_f1: 0.6285
 epoch: 49, train_loss: 0.5667, test_loss: 0.9217, test_f1: 0.6387
 epoch: 50, train_loss: 0.5816, test_loss: 0.9232, test_f1: 0.6214
 epoch: 51, train_loss: 0.5668, test_loss: 0.8968, test_f1: 0.6328
 epoch: 52, train_loss: 0.5501, test_loss: 0.8756, test_f1: 0.6277
 epoch: 53, train_loss: 0.5324, test_loss: 0.9082, test_f1: 0.6392
 epoch: 54, train_loss: 0.5153, test_loss: 0.8799, test_f1: 0.6393
 epoch: 55, train_loss: 0.5324, test_loss: 0.9001, test_f1: 0.6400
 epoch: 56, train_loss: 0.5230, test_loss: 0.9057, test_f1: 0.6398
 epoch: 57, train_loss: 0.5067, test_loss: 0.9345, test_f1: 0.6273
 epoch: 58, train_loss: 0.5127, test_loss: 0.9189, test_f1: 0.6366
 epoch: 59, train_loss: 0.5063, test_loss: 0.8625, test_f1: 0.6342
 epoch: 60, train_loss: 0.5117, test_loss: 0.8878, test_f1: 0.6376
 epoch: 61, train_loss: 0.5033, test_loss: 0.9728, test_f1: 0.6204
 epoch: 62, train_loss: 0.4911, test_loss: 0.8882, test_f1: 0.6463
 epoch: 63, train_loss: 0.5004, test_loss: 0.8900, test_f1: 0.6544
 epoch: 64, train_loss: 0.5035, test_loss: 0.8732, test_f1: 0.6522
 epoch: 65, train_loss: 0.4886, test_loss: 0.9297, test_f1: 0.6445
 epoch: 66, train_loss: 0.4861, test_loss: 0.9352, test_f1: 0.6344
 epoch: 67, train_loss: 0.4820, test_loss: 0.9233, test_f1: 0.6526
 epoch: 68, train_loss: 0.4740, test_loss: 0.9214, test_f1: 0.6594
 epoch: 69, train_loss: 0.4707, test_loss: 0.9450, test_f1: 0.6355
 epoch: 70, train_loss: 0.4701, test_loss: 0.9183, test_f1: 0.6377
 epoch: 71, train_loss: 0.4893, test_loss: 0.9441, test_f1: 0.6355
 epoch: 72, train_loss: 0.4727, test_loss: 0.9385, test_f1: 0.6465
 epoch: 73, train_loss: 0.4677, test_loss: 0.9630, test_f1: 0.6688
 epoch: 74, train_loss: 0.4708, test_loss: 0.9916, test_f1: 0.6560
 epoch: 75, train_loss: 0.4602, test_loss: 0.9518, test_f1: 0.6537
 epoch: 76, train_loss: 0.4588, test_loss: 0.9895, test_f1: 0.6691
 epoch: 77, train_loss: 0.4637, test_loss: 0.9514, test_f1: 0.6522
 epoch: 78, train_loss: 0.4574, test_loss: 0.9655, test_f1: 0.6383
 epoch: 79, train_loss: 0.4576, test_loss: 0.9709, test_f1: 0.6537
 epoch: 80, train_loss: 0.4573, test_loss: 0.9682, test_f1: 0.6329
 epoch: 81, train_loss: 0.4418, test_loss: 0.9957, test_f1: 0.6443
 epoch: 82, train_loss: 0.4418, test_loss: 1.0093, test_f1: 0.6283
 epoch: 83, train_loss: 0.4531, test_loss: 0.9585, test_f1: 0.6599
 epoch: 84, train_loss: 0.4287, test_loss: 0.9538, test_f1: 0.6524
 epoch: 85, train_loss: 0.4340, test_loss: 1.0082, test_f1: 0.6343
 epoch: 86, train_loss: 0.4421, test_loss: 0.9709, test_f1: 0.6518
 epoch: 87, train_loss: 0.4251, test_loss: 0.9938, test_f1: 0.6564
 epoch: 88, train_loss: 0.4222, test_loss: 0.9612, test_f1: 0.6520
 epoch: 89, train_loss: 0.4330, test_loss: 1.0114, test_f1: 0.6372
 epoch: 90, train_loss: 0.4156, test_loss: 1.0010, test_f1: 0.6679
 epoch: 91, train_loss: 0.4169, test_loss: 0.9845, test_f1: 0.6688
 epoch: 92, train_loss: 0.4148, test_loss: 1.0032, test_f1: 0.6554
 epoch: 93, train_loss: 0.4126, test_loss: 1.0209, test_f1: 0.6635
 epoch: 94, train_loss: 0.4126, test_loss: 1.0097, test_f1: 0.6799
 epoch: 95, train_loss: 0.4116, test_loss: 1.0743, test_f1: 0.6469
 epoch: 96, train_loss: 0.4130, test_loss: 1.0220, test_f1: 0.6515
 epoch: 97, train_loss: 0.4188, test_loss: 0.9836, test_f1: 0.6695
 epoch: 98, train_loss: 0.4009, test_loss: 0.9587, test_f1: 0.6493
 epoch: 99, train_loss: 0.4003, test_loss: 1.0169, test_f1: 0.6333
##################ITERATION #9 ****************************************
 epoch: 0, train_loss: 1.2079, test_loss: 1.1067, test_f1: 0.3844
 epoch: 1, train_loss: 1.0262, test_loss: 0.9891, test_f1: 0.4928
 epoch: 2, train_loss: 0.9990, test_loss: 0.9860, test_f1: 0.5397
 epoch: 3, train_loss: 0.9694, test_loss: 0.9757, test_f1: 0.5337
 epoch: 4, train_loss: 0.9461, test_loss: 0.9865, test_f1: 0.5428
 epoch: 5, train_loss: 0.9155, test_loss: 0.9663, test_f1: 0.5333
 epoch: 6, train_loss: 0.9092, test_loss: 0.9593, test_f1: 0.5597
 epoch: 7, train_loss: 0.8978, test_loss: 0.9571, test_f1: 0.5506
 epoch: 8, train_loss: 0.8813, test_loss: 0.9603, test_f1: 0.5418
 epoch: 9, train_loss: 0.8684, test_loss: 0.9653, test_f1: 0.5581
 epoch: 10, train_loss: 0.8461, test_loss: 0.9558, test_f1: 0.5783
 epoch: 11, train_loss: 0.8166, test_loss: 0.9536, test_f1: 0.5774
 epoch: 12, train_loss: 0.8182, test_loss: 0.9906, test_f1: 0.5439
 epoch: 13, train_loss: 0.8081, test_loss: 0.9797, test_f1: 0.5499
 epoch: 14, train_loss: 0.7931, test_loss: 0.9398, test_f1: 0.5882
 epoch: 15, train_loss: 0.7863, test_loss: 0.9677, test_f1: 0.5953
 epoch: 16, train_loss: 0.7742, test_loss: 0.9273, test_f1: 0.5882
 epoch: 17, train_loss: 0.7578, test_loss: 0.9379, test_f1: 0.5852
 epoch: 18, train_loss: 0.7440, test_loss: 0.9366, test_f1: 0.5797
 epoch: 19, train_loss: 0.7439, test_loss: 0.9671, test_f1: 0.5733
 epoch: 20, train_loss: 0.7283, test_loss: 0.9515, test_f1: 0.6027
 epoch: 21, train_loss: 0.7195, test_loss: 0.9351, test_f1: 0.5992
 epoch: 22, train_loss: 0.7077, test_loss: 0.9400, test_f1: 0.5960
 epoch: 23, train_loss: 0.6955, test_loss: 0.9417, test_f1: 0.6079
 epoch: 24, train_loss: 0.6972, test_loss: 0.9422, test_f1: 0.6188
 epoch: 25, train_loss: 0.6853, test_loss: 0.9098, test_f1: 0.6127
 epoch: 26, train_loss: 0.6785, test_loss: 0.9597, test_f1: 0.5993
 epoch: 27, train_loss: 0.6819, test_loss: 0.9095, test_f1: 0.5972
 epoch: 28, train_loss: 0.6659, test_loss: 0.9481, test_f1: 0.6106
 epoch: 29, train_loss: 0.6565, test_loss: 0.9563, test_f1: 0.5821
 epoch: 30, train_loss: 0.6480, test_loss: 0.9079, test_f1: 0.6134
 epoch: 31, train_loss: 0.6450, test_loss: 0.9378, test_f1: 0.6130
 epoch: 32, train_loss: 0.6362, test_loss: 0.9175, test_f1: 0.6063
 epoch: 33, train_loss: 0.6288, test_loss: 0.9211, test_f1: 0.6051
 epoch: 34, train_loss: 0.6070, test_loss: 0.9326, test_f1: 0.6154
 epoch: 35, train_loss: 0.6258, test_loss: 0.8928, test_f1: 0.6266
 epoch: 36, train_loss: 0.5941, test_loss: 0.9784, test_f1: 0.5873
 epoch: 37, train_loss: 0.5924, test_loss: 0.9484, test_f1: 0.6292
 epoch: 38, train_loss: 0.5822, test_loss: 0.9091, test_f1: 0.6395
 epoch: 39, train_loss: 0.5917, test_loss: 0.9069, test_f1: 0.6126
 epoch: 40, train_loss: 0.5676, test_loss: 0.9191, test_f1: 0.6409
 epoch: 41, train_loss: 0.5653, test_loss: 0.9378, test_f1: 0.6201
 epoch: 42, train_loss: 0.5645, test_loss: 0.8794, test_f1: 0.6487
 epoch: 43, train_loss: 0.5729, test_loss: 0.9028, test_f1: 0.6332
 epoch: 44, train_loss: 0.5504, test_loss: 0.9188, test_f1: 0.6351
 epoch: 45, train_loss: 0.5356, test_loss: 0.9362, test_f1: 0.6253
 epoch: 46, train_loss: 0.5415, test_loss: 0.9277, test_f1: 0.6333
 epoch: 47, train_loss: 0.5500, test_loss: 0.9245, test_f1: 0.6265
 epoch: 48, train_loss: 0.5253, test_loss: 0.9394, test_f1: 0.6536
 epoch: 49, train_loss: 0.5270, test_loss: 0.9493, test_f1: 0.6284
 epoch: 50, train_loss: 0.5189, test_loss: 1.0027, test_f1: 0.6244
 epoch: 51, train_loss: 0.4894, test_loss: 0.9439, test_f1: 0.6443
 epoch: 52, train_loss: 0.4747, test_loss: 0.9489, test_f1: 0.6480
 epoch: 53, train_loss: 0.4822, test_loss: 0.9687, test_f1: 0.6438
 epoch: 54, train_loss: 0.4734, test_loss: 0.9869, test_f1: 0.6317
 epoch: 55, train_loss: 0.4624, test_loss: 0.9377, test_f1: 0.6459
 epoch: 56, train_loss: 0.4785, test_loss: 1.0100, test_f1: 0.6139
 epoch: 57, train_loss: 0.4646, test_loss: 1.0453, test_f1: 0.6190
 epoch: 58, train_loss: 0.4599, test_loss: 0.9574, test_f1: 0.6593
 epoch: 59, train_loss: 0.4514, test_loss: 0.9776, test_f1: 0.6418
 epoch: 60, train_loss: 0.4537, test_loss: 0.9669, test_f1: 0.6430
 epoch: 61, train_loss: 0.4513, test_loss: 0.9667, test_f1: 0.6577
 epoch: 62, train_loss: 0.4559, test_loss: 0.9920, test_f1: 0.6375
 epoch: 63, train_loss: 0.4319, test_loss: 0.9850, test_f1: 0.6549
 epoch: 64, train_loss: 0.4423, test_loss: 0.9758, test_f1: 0.6549
 epoch: 65, train_loss: 0.4297, test_loss: 0.9904, test_f1: 0.6409
 epoch: 66, train_loss: 0.4240, test_loss: 1.0228, test_f1: 0.6512
 epoch: 67, train_loss: 0.4239, test_loss: 1.0597, test_f1: 0.6397
 epoch: 68, train_loss: 0.4200, test_loss: 1.0310, test_f1: 0.6608
 epoch: 69, train_loss: 0.4178, test_loss: 1.0439, test_f1: 0.6383
 epoch: 70, train_loss: 0.4191, test_loss: 1.0517, test_f1: 0.6276
 epoch: 71, train_loss: 0.4302, test_loss: 1.0420, test_f1: 0.6517
 epoch: 72, train_loss: 0.3995, test_loss: 1.1259, test_f1: 0.6443
 epoch: 73, train_loss: 0.3902, test_loss: 1.1092, test_f1: 0.6327
 epoch: 74, train_loss: 0.3855, test_loss: 1.0895, test_f1: 0.6596
 epoch: 75, train_loss: 0.3954, test_loss: 1.0540, test_f1: 0.6582
 epoch: 76, train_loss: 0.3914, test_loss: 1.0855, test_f1: 0.6521
 epoch: 77, train_loss: 0.3965, test_loss: 1.0816, test_f1: 0.6392
 epoch: 78, train_loss: 0.3787, test_loss: 1.0904, test_f1: 0.6501
 epoch: 79, train_loss: 0.3811, test_loss: 1.1585, test_f1: 0.6263
 epoch: 80, train_loss: 0.3791, test_loss: 1.0986, test_f1: 0.6488
 epoch: 81, train_loss: 0.3807, test_loss: 1.0918, test_f1: 0.6455
 epoch: 82, train_loss: 0.3916, test_loss: 1.1573, test_f1: 0.6556
 epoch: 83, train_loss: 0.3740, test_loss: 1.1665, test_f1: 0.6224
 epoch: 84, train_loss: 0.3583, test_loss: 1.2224, test_f1: 0.6500
 epoch: 85, train_loss: 0.3706, test_loss: 1.1445, test_f1: 0.6538
 epoch: 86, train_loss: 0.3719, test_loss: 1.2329, test_f1: 0.6378
 epoch: 87, train_loss: 0.3640, test_loss: 1.1964, test_f1: 0.6566
 epoch: 88, train_loss: 0.3781, test_loss: 1.2565, test_f1: 0.6479
 epoch: 89, train_loss: 0.3666, test_loss: 1.1851, test_f1: 0.6456
 epoch: 90, train_loss: 0.3557, test_loss: 1.2040, test_f1: 0.6380
 epoch: 91, train_loss: 0.3465, test_loss: 1.2035, test_f1: 0.6404
 epoch: 92, train_loss: 0.3380, test_loss: 1.2444, test_f1: 0.6630
 epoch: 93, train_loss: 0.3405, test_loss: 1.3099, test_f1: 0.6375
 epoch: 94, train_loss: 0.3511, test_loss: 1.2446, test_f1: 0.6573
 epoch: 95, train_loss: 0.3490, test_loss: 1.3268, test_f1: 0.6525
 epoch: 96, train_loss: 0.3398, test_loss: 1.3815, test_f1: 0.6293
 epoch: 97, train_loss: 0.3249, test_loss: 1.3847, test_f1: 0.6289
 epoch: 98, train_loss: 0.3277, test_loss: 1.2582, test_f1: 0.6520
 epoch: 99, train_loss: 0.3269, test_loss: 1.2481, test_f1: 0.6376

Training completed in 903.99 seconds
Best F1: 0.6953 at epoch 84
Mean F1 across iterations: 0.6639  0.0176
========================FINAL RESULTS================================
FEGIN weighted F1: 0.6953  0.0176
python main.py --data ltspice_examples --representation component_pin --model FEGIN --layers 6 --hiddens 128 --batch_size 64 --lr 0.0001 --emb_size 512 --epochs 100 --save_appendix component_pin_L6_H128_BS64_LR0.0001_E512 --no_val
-----



STDERR:
  File "main.py", line 370, in <module>
    main()
  File "main.py", line 254, in main
    dataset = dataset_class(
  File "/home/philip/projects/ltspice_examples_code_repo/Circuit-Completion-Using-GNNs/component_classification_with_link_prediction_head/evaluation/FEGIN/kernel/circuit_datasets.py", line 15, in __init__
    self.data, self.slices = torch.load(self.processed_paths[0])
  File "/home/philip/.local/lib/python3.8/site-packages/torch/serialization.py", line 1040, in load
    warnings.warn(
  File "/usr/lib/python3.8/warnings.py", line 109, in _showwarnmsg
    sw(msg.message, msg.category, msg.filename, msg.lineno,
  File "main.py", line 47, in warn_with_traceback
    traceback.print_stack(file=log)
/home/philip/projects/ltspice_examples_code_repo/Circuit-Completion-Using-GNNs/component_classification_with_link_prediction_head/evaluation/FEGIN/kernel/circuit_datasets.py:15: FutureWarning: You are using `torch.load` with `weights_only=False` (the current default value), which uses the default pickle module implicitly. It is possible to construct malicious pickle data which will execute arbitrary code during unpickling (See https://github.com/pytorch/pytorch/blob/main/SECURITY.md#untrusted-models for more details). In a future release, the default value for `weights_only` will be flipped to `True`. This limits the functions that could be executed during unpickling. Arbitrary objects will no longer be allowed to be loaded via this mode unless they are explicitly allowlisted by the user via `torch.serialization.add_safe_globals`. We recommend you start setting `weights_only=True` for any use case where you don't have full control of the loaded file. Please open an issue on GitHub for any issues related to this experimental feature.
  self.data, self.slices = torch.load(self.processed_paths[0])
