STDOUT:
Results will be saved in /home/philip/projects/ltspice_examples_code_repo/Circuit-Completion-Using-GNNs/component_classification_with_link_prediction_head/evaluation/FEGIN/results/model_FEGIN_dataset_ltspice_demos
Command line input: python main.py --data ltspice_demos --representation component_pin --model FEGIN --layers 5 --hiddens 32 --batch_size 32 --lr 0.0001 --emb_size 250 --epochs 100 --save_appendix component_pin_L5_H32_BS32_LR0.0001_E250 --no_val
 is saved.
-----
ltspice_demos - FEGIN
Using 5 layers, 32 hidden units, h = 2
Loading component_pin representation dataset
ENTERED
Training FEGIN on component_pin representation
Train: 1565, Test: 383
##################ITERATION #0 ****************************************
 epoch: 0, train_loss: 1.4223, test_loss: 1.4096, test_f1: 0.0507
 epoch: 1, train_loss: 1.4072, test_loss: 1.3998, test_f1: 0.0507
 epoch: 2, train_loss: 1.3933, test_loss: 1.3882, test_f1: 0.0664
 epoch: 3, train_loss: 1.3759, test_loss: 1.3756, test_f1: 0.2033
 epoch: 4, train_loss: 1.3550, test_loss: 1.3599, test_f1: 0.3062
 epoch: 5, train_loss: 1.3277, test_loss: 1.3406, test_f1: 0.3213
 epoch: 6, train_loss: 1.2990, test_loss: 1.3189, test_f1: 0.3264
 epoch: 7, train_loss: 1.2737, test_loss: 1.2988, test_f1: 0.3266
 epoch: 8, train_loss: 1.2430, test_loss: 1.2815, test_f1: 0.3360
 epoch: 9, train_loss: 1.2280, test_loss: 1.2710, test_f1: 0.3360
 epoch: 10, train_loss: 1.2077, test_loss: 1.2612, test_f1: 0.3378
 epoch: 11, train_loss: 1.1959, test_loss: 1.2552, test_f1: 0.3378
 epoch: 12, train_loss: 1.1880, test_loss: 1.2470, test_f1: 0.3439
 epoch: 13, train_loss: 1.1769, test_loss: 1.2412, test_f1: 0.3562
 epoch: 14, train_loss: 1.1670, test_loss: 1.2324, test_f1: 0.3720
 epoch: 15, train_loss: 1.1637, test_loss: 1.2290, test_f1: 0.3615
 epoch: 16, train_loss: 1.1545, test_loss: 1.2201, test_f1: 0.3481
 epoch: 17, train_loss: 1.1472, test_loss: 1.2087, test_f1: 0.3485
 epoch: 18, train_loss: 1.1416, test_loss: 1.2063, test_f1: 0.3656
 epoch: 19, train_loss: 1.1328, test_loss: 1.2010, test_f1: 0.3574
 epoch: 20, train_loss: 1.1287, test_loss: 1.1863, test_f1: 0.3558
 epoch: 21, train_loss: 1.1204, test_loss: 1.1902, test_f1: 0.3605
 epoch: 22, train_loss: 1.1211, test_loss: 1.1710, test_f1: 0.3351
 epoch: 23, train_loss: 1.1116, test_loss: 1.1683, test_f1: 0.4026
 epoch: 24, train_loss: 1.1097, test_loss: 1.1572, test_f1: 0.3792
 epoch: 25, train_loss: 1.1078, test_loss: 1.1541, test_f1: 0.4122
 epoch: 26, train_loss: 1.1016, test_loss: 1.1438, test_f1: 0.3653
 epoch: 27, train_loss: 1.0946, test_loss: 1.1419, test_f1: 0.4439
 epoch: 28, train_loss: 1.0918, test_loss: 1.1388, test_f1: 0.4441
 epoch: 29, train_loss: 1.0915, test_loss: 1.1302, test_f1: 0.4203
 epoch: 30, train_loss: 1.0728, test_loss: 1.1343, test_f1: 0.4671
 epoch: 31, train_loss: 1.0715, test_loss: 1.1247, test_f1: 0.4523
 epoch: 32, train_loss: 1.0588, test_loss: 1.1113, test_f1: 0.4352
 epoch: 33, train_loss: 1.0665, test_loss: 1.1105, test_f1: 0.4426
 epoch: 34, train_loss: 1.0570, test_loss: 1.1091, test_f1: 0.4244
 epoch: 35, train_loss: 1.0475, test_loss: 1.1037, test_f1: 0.4243
 epoch: 36, train_loss: 1.0455, test_loss: 1.0995, test_f1: 0.4196
 epoch: 37, train_loss: 1.0369, test_loss: 1.0943, test_f1: 0.4110
 epoch: 38, train_loss: 1.0236, test_loss: 1.0902, test_f1: 0.4052
 epoch: 39, train_loss: 1.0286, test_loss: 1.0927, test_f1: 0.4161
 epoch: 40, train_loss: 1.0261, test_loss: 1.0779, test_f1: 0.4366
 epoch: 41, train_loss: 1.0124, test_loss: 1.0793, test_f1: 0.4269
 epoch: 42, train_loss: 1.0055, test_loss: 1.0684, test_f1: 0.4409
 epoch: 43, train_loss: 0.9951, test_loss: 1.0645, test_f1: 0.4267
 epoch: 44, train_loss: 0.9977, test_loss: 1.0687, test_f1: 0.4108
 epoch: 45, train_loss: 0.9787, test_loss: 1.0685, test_f1: 0.4180
 epoch: 46, train_loss: 0.9808, test_loss: 1.0516, test_f1: 0.4311
 epoch: 47, train_loss: 0.9655, test_loss: 1.0551, test_f1: 0.4452
 epoch: 48, train_loss: 0.9601, test_loss: 1.0551, test_f1: 0.4283
 epoch: 49, train_loss: 0.9483, test_loss: 1.0578, test_f1: 0.4323
 epoch: 50, train_loss: 0.9539, test_loss: 1.0578, test_f1: 0.4297
 epoch: 51, train_loss: 0.9389, test_loss: 1.0416, test_f1: 0.4578
 epoch: 52, train_loss: 0.9363, test_loss: 1.0450, test_f1: 0.4228
 epoch: 53, train_loss: 0.9328, test_loss: 1.0383, test_f1: 0.4411
 epoch: 54, train_loss: 0.9327, test_loss: 1.0380, test_f1: 0.4418
 epoch: 55, train_loss: 0.9326, test_loss: 1.0471, test_f1: 0.4147
 epoch: 56, train_loss: 0.9221, test_loss: 1.0382, test_f1: 0.4792
 epoch: 57, train_loss: 0.9211, test_loss: 1.0345, test_f1: 0.4661
 epoch: 58, train_loss: 0.9223, test_loss: 1.0370, test_f1: 0.4601
 epoch: 59, train_loss: 0.9056, test_loss: 1.0515, test_f1: 0.4557
 epoch: 60, train_loss: 0.9124, test_loss: 1.0230, test_f1: 0.4501
 epoch: 61, train_loss: 0.9105, test_loss: 1.0325, test_f1: 0.4478
 epoch: 62, train_loss: 0.9072, test_loss: 1.0551, test_f1: 0.4414
 epoch: 63, train_loss: 0.9130, test_loss: 1.0431, test_f1: 0.4583
 epoch: 64, train_loss: 0.9234, test_loss: 1.0334, test_f1: 0.4683
 epoch: 65, train_loss: 0.9080, test_loss: 1.0617, test_f1: 0.4772
 epoch: 66, train_loss: 0.8907, test_loss: 1.0247, test_f1: 0.4496
 epoch: 67, train_loss: 0.8961, test_loss: 1.0254, test_f1: 0.4634
 epoch: 68, train_loss: 0.8885, test_loss: 1.0362, test_f1: 0.4689
 epoch: 69, train_loss: 0.9021, test_loss: 1.0421, test_f1: 0.4923
 epoch: 70, train_loss: 0.8863, test_loss: 1.0222, test_f1: 0.4907
 epoch: 71, train_loss: 0.8898, test_loss: 1.0432, test_f1: 0.4859
 epoch: 72, train_loss: 0.8777, test_loss: 1.0365, test_f1: 0.4698
 epoch: 73, train_loss: 0.8892, test_loss: 1.0156, test_f1: 0.4919
 epoch: 74, train_loss: 0.8804, test_loss: 1.0258, test_f1: 0.5087
 epoch: 75, train_loss: 0.8748, test_loss: 1.0199, test_f1: 0.4834
 epoch: 76, train_loss: 0.8763, test_loss: 1.0195, test_f1: 0.4967
 epoch: 77, train_loss: 0.8785, test_loss: 1.0237, test_f1: 0.5122
 epoch: 78, train_loss: 0.8632, test_loss: 1.0308, test_f1: 0.4987
 epoch: 79, train_loss: 0.8807, test_loss: 1.0239, test_f1: 0.5168
 epoch: 80, train_loss: 0.8786, test_loss: 1.0545, test_f1: 0.4953
 epoch: 81, train_loss: 0.8640, test_loss: 1.0202, test_f1: 0.5038
 epoch: 82, train_loss: 0.8612, test_loss: 1.0321, test_f1: 0.5111
 epoch: 83, train_loss: 0.8665, test_loss: 1.0294, test_f1: 0.5364
 epoch: 84, train_loss: 0.8666, test_loss: 1.0305, test_f1: 0.5119
 epoch: 85, train_loss: 0.8567, test_loss: 1.0232, test_f1: 0.5042
 epoch: 86, train_loss: 0.8580, test_loss: 1.0269, test_f1: 0.5256
 epoch: 87, train_loss: 0.8611, test_loss: 1.0054, test_f1: 0.5184
 epoch: 88, train_loss: 0.8570, test_loss: 1.0037, test_f1: 0.5131
 epoch: 89, train_loss: 0.8514, test_loss: 1.0074, test_f1: 0.5186
 epoch: 90, train_loss: 0.8630, test_loss: 1.0157, test_f1: 0.5379
 epoch: 91, train_loss: 0.8606, test_loss: 1.0162, test_f1: 0.5145
 epoch: 92, train_loss: 0.8438, test_loss: 1.0129, test_f1: 0.5323
 epoch: 93, train_loss: 0.8549, test_loss: 1.0025, test_f1: 0.5379
 epoch: 94, train_loss: 0.8446, test_loss: 1.0166, test_f1: 0.5353
 epoch: 95, train_loss: 0.8548, test_loss: 1.0197, test_f1: 0.5470
 epoch: 96, train_loss: 0.8487, test_loss: 1.0083, test_f1: 0.5543
 epoch: 97, train_loss: 0.8406, test_loss: 1.0102, test_f1: 0.5670
 epoch: 98, train_loss: 0.8329, test_loss: 1.0425, test_f1: 0.5313
 epoch: 99, train_loss: 0.8354, test_loss: 1.0140, test_f1: 0.5569
##################ITERATION #1 ****************************************
 epoch: 0, train_loss: 1.3982, test_loss: 1.3873, test_f1: 0.0510
 epoch: 1, train_loss: 1.3445, test_loss: 1.3592, test_f1: 0.2263
 epoch: 2, train_loss: 1.3076, test_loss: 1.3350, test_f1: 0.2990
 epoch: 3, train_loss: 1.2760, test_loss: 1.3106, test_f1: 0.3074
 epoch: 4, train_loss: 1.2487, test_loss: 1.2898, test_f1: 0.3064
 epoch: 5, train_loss: 1.2222, test_loss: 1.2772, test_f1: 0.2912
 epoch: 6, train_loss: 1.2024, test_loss: 1.2749, test_f1: 0.2937
 epoch: 7, train_loss: 1.1954, test_loss: 1.2650, test_f1: 0.2899
 epoch: 8, train_loss: 1.1842, test_loss: 1.2583, test_f1: 0.2959
 epoch: 9, train_loss: 1.1778, test_loss: 1.2621, test_f1: 0.2990
 epoch: 10, train_loss: 1.1632, test_loss: 1.2546, test_f1: 0.3259
 epoch: 11, train_loss: 1.1617, test_loss: 1.2512, test_f1: 0.3286
 epoch: 12, train_loss: 1.1472, test_loss: 1.2463, test_f1: 0.3677
 epoch: 13, train_loss: 1.1364, test_loss: 1.2377, test_f1: 0.3806
 epoch: 14, train_loss: 1.1431, test_loss: 1.2294, test_f1: 0.3874
 epoch: 15, train_loss: 1.1154, test_loss: 1.2280, test_f1: 0.3621
 epoch: 16, train_loss: 1.1147, test_loss: 1.2290, test_f1: 0.3685
 epoch: 17, train_loss: 1.1073, test_loss: 1.2189, test_f1: 0.3453
 epoch: 18, train_loss: 1.1002, test_loss: 1.2097, test_f1: 0.3505
 epoch: 19, train_loss: 1.0858, test_loss: 1.1950, test_f1: 0.3770
 epoch: 20, train_loss: 1.0857, test_loss: 1.2171, test_f1: 0.3473
 epoch: 21, train_loss: 1.0730, test_loss: 1.1968, test_f1: 0.3485
 epoch: 22, train_loss: 1.0621, test_loss: 1.2027, test_f1: 0.3657
 epoch: 23, train_loss: 1.0596, test_loss: 1.1861, test_f1: 0.3754
 epoch: 24, train_loss: 1.0579, test_loss: 1.1832, test_f1: 0.3768
 epoch: 25, train_loss: 1.0451, test_loss: 1.1785, test_f1: 0.3774
 epoch: 26, train_loss: 1.0313, test_loss: 1.1869, test_f1: 0.3786
 epoch: 27, train_loss: 1.0459, test_loss: 1.1776, test_f1: 0.3686
 epoch: 28, train_loss: 1.0230, test_loss: 1.1754, test_f1: 0.3639
 epoch: 29, train_loss: 1.0175, test_loss: 1.1736, test_f1: 0.3896
 epoch: 30, train_loss: 1.0220, test_loss: 1.1667, test_f1: 0.3600
 epoch: 31, train_loss: 1.0117, test_loss: 1.1559, test_f1: 0.3753
 epoch: 32, train_loss: 0.9994, test_loss: 1.1551, test_f1: 0.3813
 epoch: 33, train_loss: 1.0102, test_loss: 1.1656, test_f1: 0.3899
 epoch: 34, train_loss: 0.9985, test_loss: 1.1497, test_f1: 0.3789
 epoch: 35, train_loss: 0.9860, test_loss: 1.1374, test_f1: 0.3754
 epoch: 36, train_loss: 0.9794, test_loss: 1.1152, test_f1: 0.3747
 epoch: 37, train_loss: 0.9904, test_loss: 1.1289, test_f1: 0.3882
 epoch: 38, train_loss: 0.9834, test_loss: 1.1540, test_f1: 0.3921
 epoch: 39, train_loss: 0.9657, test_loss: 1.1418, test_f1: 0.3740
 epoch: 40, train_loss: 0.9732, test_loss: 1.1380, test_f1: 0.3942
 epoch: 41, train_loss: 0.9650, test_loss: 1.1248, test_f1: 0.3838
 epoch: 42, train_loss: 0.9651, test_loss: 1.1600, test_f1: 0.3997
 epoch: 43, train_loss: 0.9589, test_loss: 1.1374, test_f1: 0.3934
 epoch: 44, train_loss: 0.9469, test_loss: 1.1479, test_f1: 0.4013
 epoch: 45, train_loss: 0.9381, test_loss: 1.1131, test_f1: 0.3998
 epoch: 46, train_loss: 0.9362, test_loss: 1.1316, test_f1: 0.3854
 epoch: 47, train_loss: 0.9369, test_loss: 1.0806, test_f1: 0.4299
 epoch: 48, train_loss: 0.9390, test_loss: 1.0975, test_f1: 0.3946
 epoch: 49, train_loss: 0.9362, test_loss: 1.1260, test_f1: 0.4154
 epoch: 50, train_loss: 0.9223, test_loss: 1.1060, test_f1: 0.4118
 epoch: 51, train_loss: 0.9186, test_loss: 1.0777, test_f1: 0.4313
 epoch: 52, train_loss: 0.9121, test_loss: 1.0860, test_f1: 0.4235
 epoch: 53, train_loss: 0.9228, test_loss: 1.1152, test_f1: 0.4196
 epoch: 54, train_loss: 0.9096, test_loss: 1.0769, test_f1: 0.4293
 epoch: 55, train_loss: 0.9196, test_loss: 1.0877, test_f1: 0.4447
 epoch: 56, train_loss: 0.9093, test_loss: 1.0866, test_f1: 0.4182
 epoch: 57, train_loss: 0.9117, test_loss: 1.0851, test_f1: 0.4157
 epoch: 58, train_loss: 0.9066, test_loss: 1.0920, test_f1: 0.4326
 epoch: 59, train_loss: 0.9131, test_loss: 1.0812, test_f1: 0.4358
 epoch: 60, train_loss: 0.8948, test_loss: 1.0905, test_f1: 0.4282
 epoch: 61, train_loss: 0.9087, test_loss: 1.1127, test_f1: 0.4288
 epoch: 62, train_loss: 0.8908, test_loss: 1.0815, test_f1: 0.4340
 epoch: 63, train_loss: 0.9000, test_loss: 1.0771, test_f1: 0.4446
 epoch: 64, train_loss: 0.9069, test_loss: 1.0753, test_f1: 0.4637
 epoch: 65, train_loss: 0.9010, test_loss: 1.0775, test_f1: 0.4439
 epoch: 66, train_loss: 0.8984, test_loss: 1.0957, test_f1: 0.4386
 epoch: 67, train_loss: 0.9021, test_loss: 1.0830, test_f1: 0.4370
 epoch: 68, train_loss: 0.8973, test_loss: 1.1156, test_f1: 0.4277
 epoch: 69, train_loss: 0.8937, test_loss: 1.0898, test_f1: 0.4293
 epoch: 70, train_loss: 0.9018, test_loss: 1.0989, test_f1: 0.4471
 epoch: 71, train_loss: 0.8857, test_loss: 1.0921, test_f1: 0.4367
 epoch: 72, train_loss: 0.8989, test_loss: 1.1171, test_f1: 0.4348
 epoch: 73, train_loss: 0.8762, test_loss: 1.0894, test_f1: 0.4258
 epoch: 74, train_loss: 0.8853, test_loss: 1.0914, test_f1: 0.4394
 epoch: 75, train_loss: 0.8709, test_loss: 1.0983, test_f1: 0.4139
 epoch: 76, train_loss: 0.8711, test_loss: 1.1086, test_f1: 0.4308
 epoch: 77, train_loss: 0.8871, test_loss: 1.1043, test_f1: 0.4490
 epoch: 78, train_loss: 0.8684, test_loss: 1.1130, test_f1: 0.4157
 epoch: 79, train_loss: 0.8734, test_loss: 1.1005, test_f1: 0.4499
 epoch: 80, train_loss: 0.8683, test_loss: 1.0941, test_f1: 0.4355
 epoch: 81, train_loss: 0.8825, test_loss: 1.1141, test_f1: 0.4348
 epoch: 82, train_loss: 0.8746, test_loss: 1.0954, test_f1: 0.4538
 epoch: 83, train_loss: 0.8703, test_loss: 1.1049, test_f1: 0.4502
 epoch: 84, train_loss: 0.8608, test_loss: 1.0907, test_f1: 0.4679
 epoch: 85, train_loss: 0.8780, test_loss: 1.0937, test_f1: 0.4277
 epoch: 86, train_loss: 0.8744, test_loss: 1.0712, test_f1: 0.4588
 epoch: 87, train_loss: 0.8653, test_loss: 1.1110, test_f1: 0.4386
 epoch: 88, train_loss: 0.8560, test_loss: 1.0845, test_f1: 0.4572
 epoch: 89, train_loss: 0.8705, test_loss: 1.1041, test_f1: 0.4488
 epoch: 90, train_loss: 0.8672, test_loss: 1.1101, test_f1: 0.4280
 epoch: 91, train_loss: 0.8442, test_loss: 1.1113, test_f1: 0.4572
 epoch: 92, train_loss: 0.8610, test_loss: 1.1116, test_f1: 0.4226
 epoch: 93, train_loss: 0.8590, test_loss: 1.0988, test_f1: 0.4570
 epoch: 94, train_loss: 0.8615, test_loss: 1.0947, test_f1: 0.4500
 epoch: 95, train_loss: 0.8586, test_loss: 1.1040, test_f1: 0.4684
 epoch: 96, train_loss: 0.8589, test_loss: 1.0993, test_f1: 0.4665
 epoch: 97, train_loss: 0.8508, test_loss: 1.1217, test_f1: 0.4335
 epoch: 98, train_loss: 0.8761, test_loss: 1.1361, test_f1: 0.4416
 epoch: 99, train_loss: 0.8517, test_loss: 1.1107, test_f1: 0.4523
##################ITERATION #2 ****************************************
 epoch: 0, train_loss: 1.3359, test_loss: 1.3356, test_f1: 0.2281
 epoch: 1, train_loss: 1.2808, test_loss: 1.3100, test_f1: 0.2426
 epoch: 2, train_loss: 1.2527, test_loss: 1.2951, test_f1: 0.2498
 epoch: 3, train_loss: 1.2356, test_loss: 1.2812, test_f1: 0.2440
 epoch: 4, train_loss: 1.2180, test_loss: 1.2682, test_f1: 0.2437
 epoch: 5, train_loss: 1.2006, test_loss: 1.2514, test_f1: 0.2599
 epoch: 6, train_loss: 1.1771, test_loss: 1.2419, test_f1: 0.3024
 epoch: 7, train_loss: 1.1690, test_loss: 1.2286, test_f1: 0.3420
 epoch: 8, train_loss: 1.1526, test_loss: 1.2209, test_f1: 0.3348
 epoch: 9, train_loss: 1.1336, test_loss: 1.2063, test_f1: 0.3306
 epoch: 10, train_loss: 1.1210, test_loss: 1.1910, test_f1: 0.3274
 epoch: 11, train_loss: 1.1175, test_loss: 1.1802, test_f1: 0.3267
 epoch: 12, train_loss: 1.1018, test_loss: 1.1719, test_f1: 0.3336
 epoch: 13, train_loss: 1.0964, test_loss: 1.1618, test_f1: 0.3236
 epoch: 14, train_loss: 1.0814, test_loss: 1.1487, test_f1: 0.3305
 epoch: 15, train_loss: 1.0689, test_loss: 1.1453, test_f1: 0.3445
 epoch: 16, train_loss: 1.0545, test_loss: 1.1431, test_f1: 0.3564
 epoch: 17, train_loss: 1.0445, test_loss: 1.1314, test_f1: 0.3966
 epoch: 18, train_loss: 1.0373, test_loss: 1.1266, test_f1: 0.3948
 epoch: 19, train_loss: 1.0248, test_loss: 1.1277, test_f1: 0.3897
 epoch: 20, train_loss: 1.0245, test_loss: 1.1283, test_f1: 0.3896
 epoch: 21, train_loss: 1.0188, test_loss: 1.1276, test_f1: 0.3943
 epoch: 22, train_loss: 1.0192, test_loss: 1.1066, test_f1: 0.3995
 epoch: 23, train_loss: 1.0092, test_loss: 1.1037, test_f1: 0.3890
 epoch: 24, train_loss: 0.9990, test_loss: 1.1011, test_f1: 0.4058
 epoch: 25, train_loss: 0.9888, test_loss: 1.1109, test_f1: 0.4217
 epoch: 26, train_loss: 0.9809, test_loss: 1.1067, test_f1: 0.3928
 epoch: 27, train_loss: 0.9849, test_loss: 1.0904, test_f1: 0.4065
 epoch: 28, train_loss: 0.9679, test_loss: 1.1162, test_f1: 0.3900
 epoch: 29, train_loss: 0.9680, test_loss: 1.1046, test_f1: 0.4041
 epoch: 30, train_loss: 0.9604, test_loss: 1.1037, test_f1: 0.3947
 epoch: 31, train_loss: 0.9641, test_loss: 1.0874, test_f1: 0.4087
 epoch: 32, train_loss: 0.9622, test_loss: 1.1090, test_f1: 0.3920
 epoch: 33, train_loss: 0.9582, test_loss: 1.0923, test_f1: 0.4160
 epoch: 34, train_loss: 0.9430, test_loss: 1.0736, test_f1: 0.4038
 epoch: 35, train_loss: 0.9439, test_loss: 1.0872, test_f1: 0.4053
 epoch: 36, train_loss: 0.9435, test_loss: 1.0916, test_f1: 0.4034
 epoch: 37, train_loss: 0.9250, test_loss: 1.1019, test_f1: 0.4163
 epoch: 38, train_loss: 0.9390, test_loss: 1.0875, test_f1: 0.4169
 epoch: 39, train_loss: 0.9359, test_loss: 1.0962, test_f1: 0.4012
 epoch: 40, train_loss: 0.9316, test_loss: 1.0719, test_f1: 0.4343
 epoch: 41, train_loss: 0.9203, test_loss: 1.1070, test_f1: 0.4102
 epoch: 42, train_loss: 0.9211, test_loss: 1.0838, test_f1: 0.4365
 epoch: 43, train_loss: 0.9181, test_loss: 1.1213, test_f1: 0.4176
 epoch: 44, train_loss: 0.9088, test_loss: 1.1119, test_f1: 0.4187
 epoch: 45, train_loss: 0.9125, test_loss: 1.0940, test_f1: 0.4340
 epoch: 46, train_loss: 0.9053, test_loss: 1.0998, test_f1: 0.4386
 epoch: 47, train_loss: 0.8902, test_loss: 1.1267, test_f1: 0.4437
 epoch: 48, train_loss: 0.9019, test_loss: 1.1010, test_f1: 0.4524
 epoch: 49, train_loss: 0.8912, test_loss: 1.0857, test_f1: 0.4389
 epoch: 50, train_loss: 0.8924, test_loss: 1.1296, test_f1: 0.4431
 epoch: 51, train_loss: 0.8894, test_loss: 1.0862, test_f1: 0.4520
 epoch: 52, train_loss: 0.8819, test_loss: 1.0652, test_f1: 0.4528
 epoch: 53, train_loss: 0.8863, test_loss: 1.0744, test_f1: 0.4765
 epoch: 54, train_loss: 0.8703, test_loss: 1.0931, test_f1: 0.4653
 epoch: 55, train_loss: 0.8671, test_loss: 1.0636, test_f1: 0.4653
 epoch: 56, train_loss: 0.8860, test_loss: 1.0876, test_f1: 0.4799
 epoch: 57, train_loss: 0.8742, test_loss: 1.0781, test_f1: 0.4646
 epoch: 58, train_loss: 0.8729, test_loss: 1.1149, test_f1: 0.4971
 epoch: 59, train_loss: 0.8645, test_loss: 1.1137, test_f1: 0.4773
 epoch: 60, train_loss: 0.8755, test_loss: 1.1306, test_f1: 0.4763
 epoch: 61, train_loss: 0.8638, test_loss: 1.1214, test_f1: 0.4747
 epoch: 62, train_loss: 0.8673, test_loss: 1.1103, test_f1: 0.4787
 epoch: 63, train_loss: 0.8595, test_loss: 1.0670, test_f1: 0.5024
 epoch: 64, train_loss: 0.8606, test_loss: 1.1176, test_f1: 0.4826
 epoch: 65, train_loss: 0.8678, test_loss: 1.0793, test_f1: 0.4930
 epoch: 66, train_loss: 0.8572, test_loss: 1.1043, test_f1: 0.4961
 epoch: 67, train_loss: 0.8536, test_loss: 1.0969, test_f1: 0.4905
 epoch: 68, train_loss: 0.8486, test_loss: 1.0977, test_f1: 0.4906
 epoch: 69, train_loss: 0.8550, test_loss: 1.0860, test_f1: 0.5173
 epoch: 70, train_loss: 0.8571, test_loss: 1.1349, test_f1: 0.4897
 epoch: 71, train_loss: 0.8570, test_loss: 1.0481, test_f1: 0.5192
 epoch: 72, train_loss: 0.8519, test_loss: 1.0685, test_f1: 0.4910
 epoch: 73, train_loss: 0.8514, test_loss: 1.0734, test_f1: 0.5111
 epoch: 74, train_loss: 0.8554, test_loss: 1.0810, test_f1: 0.5032
 epoch: 75, train_loss: 0.8496, test_loss: 1.0680, test_f1: 0.4967
 epoch: 76, train_loss: 0.8394, test_loss: 1.0548, test_f1: 0.4968
 epoch: 77, train_loss: 0.8513, test_loss: 1.0821, test_f1: 0.5046
 epoch: 78, train_loss: 0.8421, test_loss: 1.0949, test_f1: 0.4870
 epoch: 79, train_loss: 0.8367, test_loss: 1.0562, test_f1: 0.5148
 epoch: 80, train_loss: 0.8385, test_loss: 1.0900, test_f1: 0.5028
 epoch: 81, train_loss: 0.8371, test_loss: 1.1352, test_f1: 0.4923
 epoch: 82, train_loss: 0.8460, test_loss: 1.0806, test_f1: 0.5086
 epoch: 83, train_loss: 0.8421, test_loss: 1.0889, test_f1: 0.4925
 epoch: 84, train_loss: 0.8379, test_loss: 1.1307, test_f1: 0.5135
 epoch: 85, train_loss: 0.8205, test_loss: 1.0976, test_f1: 0.4936
 epoch: 86, train_loss: 0.8323, test_loss: 1.1195, test_f1: 0.4964
 epoch: 87, train_loss: 0.8363, test_loss: 1.0968, test_f1: 0.5039
 epoch: 88, train_loss: 0.8218, test_loss: 1.1394, test_f1: 0.5066
 epoch: 89, train_loss: 0.8332, test_loss: 1.1132, test_f1: 0.5042
 epoch: 90, train_loss: 0.8265, test_loss: 1.0749, test_f1: 0.5006
 epoch: 91, train_loss: 0.8331, test_loss: 1.1255, test_f1: 0.5053
 epoch: 92, train_loss: 0.8181, test_loss: 1.1346, test_f1: 0.4973
 epoch: 93, train_loss: 0.8303, test_loss: 1.0917, test_f1: 0.5021
 epoch: 94, train_loss: 0.8276, test_loss: 1.1417, test_f1: 0.5169
 epoch: 95, train_loss: 0.8127, test_loss: 1.1243, test_f1: 0.5015
 epoch: 96, train_loss: 0.8116, test_loss: 1.1089, test_f1: 0.5106
 epoch: 97, train_loss: 0.8084, test_loss: 1.1351, test_f1: 0.5082
 epoch: 98, train_loss: 0.8210, test_loss: 1.0657, test_f1: 0.5154
 epoch: 99, train_loss: 0.8241, test_loss: 1.0978, test_f1: 0.5026
##################ITERATION #3 ****************************************
 epoch: 0, train_loss: 1.3617, test_loss: 1.3448, test_f1: 0.2284
 epoch: 1, train_loss: 1.2972, test_loss: 1.3225, test_f1: 0.2351
 epoch: 2, train_loss: 1.2631, test_loss: 1.2983, test_f1: 0.2281
 epoch: 3, train_loss: 1.2397, test_loss: 1.2849, test_f1: 0.2302
 epoch: 4, train_loss: 1.2265, test_loss: 1.2719, test_f1: 0.2366
 epoch: 5, train_loss: 1.2099, test_loss: 1.2574, test_f1: 0.2425
 epoch: 6, train_loss: 1.1889, test_loss: 1.2464, test_f1: 0.2548
 epoch: 7, train_loss: 1.1806, test_loss: 1.2416, test_f1: 0.2925
 epoch: 8, train_loss: 1.1597, test_loss: 1.2291, test_f1: 0.3247
 epoch: 9, train_loss: 1.1499, test_loss: 1.2184, test_f1: 0.3428
 epoch: 10, train_loss: 1.1396, test_loss: 1.2163, test_f1: 0.3513
 epoch: 11, train_loss: 1.1148, test_loss: 1.1988, test_f1: 0.3633
 epoch: 12, train_loss: 1.1068, test_loss: 1.1944, test_f1: 0.3808
 epoch: 13, train_loss: 1.0937, test_loss: 1.1760, test_f1: 0.3774
 epoch: 14, train_loss: 1.0829, test_loss: 1.1766, test_f1: 0.3703
 epoch: 15, train_loss: 1.0686, test_loss: 1.1687, test_f1: 0.3662
 epoch: 16, train_loss: 1.0656, test_loss: 1.1587, test_f1: 0.3968
 epoch: 17, train_loss: 1.0588, test_loss: 1.1517, test_f1: 0.3964
 epoch: 18, train_loss: 1.0456, test_loss: 1.1324, test_f1: 0.4202
 epoch: 19, train_loss: 1.0377, test_loss: 1.1298, test_f1: 0.4268
 epoch: 20, train_loss: 1.0157, test_loss: 1.1209, test_f1: 0.4091
 epoch: 21, train_loss: 1.0242, test_loss: 1.1079, test_f1: 0.4356
 epoch: 22, train_loss: 1.0159, test_loss: 1.1103, test_f1: 0.4146
 epoch: 23, train_loss: 1.0055, test_loss: 1.1009, test_f1: 0.4298
 epoch: 24, train_loss: 1.0060, test_loss: 1.0965, test_f1: 0.4486
 epoch: 25, train_loss: 0.9940, test_loss: 1.0893, test_f1: 0.4573
 epoch: 26, train_loss: 0.9879, test_loss: 1.0755, test_f1: 0.4518
 epoch: 27, train_loss: 0.9877, test_loss: 1.0940, test_f1: 0.4359
 epoch: 28, train_loss: 0.9839, test_loss: 1.0792, test_f1: 0.4629
 epoch: 29, train_loss: 0.9753, test_loss: 1.0824, test_f1: 0.4665
 epoch: 30, train_loss: 0.9672, test_loss: 1.0707, test_f1: 0.4654
 epoch: 31, train_loss: 0.9658, test_loss: 1.0506, test_f1: 0.4832
 epoch: 32, train_loss: 0.9635, test_loss: 1.0509, test_f1: 0.4973
 epoch: 33, train_loss: 0.9551, test_loss: 1.0535, test_f1: 0.4674
 epoch: 34, train_loss: 0.9587, test_loss: 1.0562, test_f1: 0.4732
 epoch: 35, train_loss: 0.9494, test_loss: 1.0579, test_f1: 0.4788
 epoch: 36, train_loss: 0.9463, test_loss: 1.0522, test_f1: 0.4783
 epoch: 37, train_loss: 0.9322, test_loss: 1.0342, test_f1: 0.5005
 epoch: 38, train_loss: 0.9413, test_loss: 1.0453, test_f1: 0.4830
 epoch: 39, train_loss: 0.9355, test_loss: 1.0388, test_f1: 0.4904
 epoch: 40, train_loss: 0.9190, test_loss: 1.0404, test_f1: 0.4915
 epoch: 41, train_loss: 0.9268, test_loss: 1.0395, test_f1: 0.4876
 epoch: 42, train_loss: 0.9284, test_loss: 1.0407, test_f1: 0.5023
 epoch: 43, train_loss: 0.9306, test_loss: 1.0429, test_f1: 0.4960
 epoch: 44, train_loss: 0.9125, test_loss: 1.0470, test_f1: 0.4908
 epoch: 45, train_loss: 0.9135, test_loss: 1.0406, test_f1: 0.5052
 epoch: 46, train_loss: 0.9064, test_loss: 1.0332, test_f1: 0.4998
 epoch: 47, train_loss: 0.9090, test_loss: 1.0315, test_f1: 0.5084
 epoch: 48, train_loss: 0.9146, test_loss: 1.0326, test_f1: 0.5102
 epoch: 49, train_loss: 0.9067, test_loss: 1.0299, test_f1: 0.5099
 epoch: 50, train_loss: 0.9028, test_loss: 1.0329, test_f1: 0.5220
 epoch: 51, train_loss: 0.8926, test_loss: 1.0298, test_f1: 0.5068
 epoch: 52, train_loss: 0.8932, test_loss: 1.0275, test_f1: 0.5152
 epoch: 53, train_loss: 0.8923, test_loss: 1.0201, test_f1: 0.5221
 epoch: 54, train_loss: 0.8930, test_loss: 1.0354, test_f1: 0.5091
 epoch: 55, train_loss: 0.8884, test_loss: 1.0456, test_f1: 0.5063
 epoch: 56, train_loss: 0.8899, test_loss: 1.0403, test_f1: 0.5002
 epoch: 57, train_loss: 0.8783, test_loss: 1.0298, test_f1: 0.5080
 epoch: 58, train_loss: 0.8901, test_loss: 1.0330, test_f1: 0.5191
 epoch: 59, train_loss: 0.8870, test_loss: 1.0102, test_f1: 0.5260
 epoch: 60, train_loss: 0.8830, test_loss: 1.0252, test_f1: 0.5203
 epoch: 61, train_loss: 0.8791, test_loss: 1.0248, test_f1: 0.5123
 epoch: 62, train_loss: 0.8724, test_loss: 1.0166, test_f1: 0.5187
 epoch: 63, train_loss: 0.8859, test_loss: 1.0254, test_f1: 0.5223
 epoch: 64, train_loss: 0.8811, test_loss: 1.0155, test_f1: 0.5205
 epoch: 65, train_loss: 0.8764, test_loss: 1.0162, test_f1: 0.5176
 epoch: 66, train_loss: 0.8781, test_loss: 1.0136, test_f1: 0.5173
 epoch: 67, train_loss: 0.8712, test_loss: 1.0011, test_f1: 0.5145
 epoch: 68, train_loss: 0.8811, test_loss: 1.0229, test_f1: 0.5293
 epoch: 69, train_loss: 0.8822, test_loss: 0.9971, test_f1: 0.5217
 epoch: 70, train_loss: 0.8752, test_loss: 1.0248, test_f1: 0.5054
 epoch: 71, train_loss: 0.8634, test_loss: 1.0122, test_f1: 0.5199
 epoch: 72, train_loss: 0.8534, test_loss: 1.0052, test_f1: 0.5202
 epoch: 73, train_loss: 0.8529, test_loss: 1.0065, test_f1: 0.5382
 epoch: 74, train_loss: 0.8535, test_loss: 1.0097, test_f1: 0.5218
 epoch: 75, train_loss: 0.8524, test_loss: 1.0131, test_f1: 0.5247
 epoch: 76, train_loss: 0.8492, test_loss: 1.0124, test_f1: 0.5231
 epoch: 77, train_loss: 0.8661, test_loss: 1.0163, test_f1: 0.5003
 epoch: 78, train_loss: 0.8576, test_loss: 1.0119, test_f1: 0.5082
 epoch: 79, train_loss: 0.8443, test_loss: 1.0315, test_f1: 0.5057
 epoch: 80, train_loss: 0.8434, test_loss: 1.0265, test_f1: 0.5156
 epoch: 81, train_loss: 0.8560, test_loss: 1.0292, test_f1: 0.5057
 epoch: 82, train_loss: 0.8503, test_loss: 1.0195, test_f1: 0.5090
 epoch: 83, train_loss: 0.8447, test_loss: 1.0088, test_f1: 0.5227
 epoch: 84, train_loss: 0.8483, test_loss: 1.0152, test_f1: 0.5125
 epoch: 85, train_loss: 0.8493, test_loss: 1.0122, test_f1: 0.5244
 epoch: 86, train_loss: 0.8393, test_loss: 1.0120, test_f1: 0.5054
 epoch: 87, train_loss: 0.8309, test_loss: 0.9994, test_f1: 0.5251
 epoch: 88, train_loss: 0.8493, test_loss: 1.0243, test_f1: 0.5175
 epoch: 89, train_loss: 0.8447, test_loss: 1.0103, test_f1: 0.5137
 epoch: 90, train_loss: 0.8286, test_loss: 1.0194, test_f1: 0.5140
 epoch: 91, train_loss: 0.8333, test_loss: 1.0169, test_f1: 0.5192
 epoch: 92, train_loss: 0.8472, test_loss: 1.0258, test_f1: 0.5268
 epoch: 93, train_loss: 0.8383, test_loss: 1.0077, test_f1: 0.5167
 epoch: 94, train_loss: 0.8416, test_loss: 1.0264, test_f1: 0.5260
 epoch: 95, train_loss: 0.8412, test_loss: 1.0302, test_f1: 0.5256
 epoch: 96, train_loss: 0.8333, test_loss: 1.0303, test_f1: 0.5138
 epoch: 97, train_loss: 0.8268, test_loss: 1.0415, test_f1: 0.5239
 epoch: 98, train_loss: 0.8343, test_loss: 1.0209, test_f1: 0.5050
 epoch: 99, train_loss: 0.8318, test_loss: 1.0242, test_f1: 0.5154
##################ITERATION #4 ****************************************
 epoch: 0, train_loss: 1.3233, test_loss: 1.3386, test_f1: 0.2238
 epoch: 1, train_loss: 1.2656, test_loss: 1.3590, test_f1: 0.2530
 epoch: 2, train_loss: 1.2428, test_loss: 1.3172, test_f1: 0.2417
 epoch: 3, train_loss: 1.2264, test_loss: 1.2997, test_f1: 0.2294
 epoch: 4, train_loss: 1.2128, test_loss: 1.2931, test_f1: 0.2531
 epoch: 5, train_loss: 1.1899, test_loss: 1.2872, test_f1: 0.2646
 epoch: 6, train_loss: 1.1883, test_loss: 1.2833, test_f1: 0.2631
 epoch: 7, train_loss: 1.1864, test_loss: 1.2503, test_f1: 0.2685
 epoch: 8, train_loss: 1.1744, test_loss: 1.2384, test_f1: 0.3054
 epoch: 9, train_loss: 1.1595, test_loss: 1.2191, test_f1: 0.3302
 epoch: 10, train_loss: 1.1425, test_loss: 1.2005, test_f1: 0.3354
 epoch: 11, train_loss: 1.1463, test_loss: 1.1918, test_f1: 0.3610
 epoch: 12, train_loss: 1.1225, test_loss: 1.1751, test_f1: 0.3641
 epoch: 13, train_loss: 1.1109, test_loss: 1.1600, test_f1: 0.3690
 epoch: 14, train_loss: 1.0990, test_loss: 1.1453, test_f1: 0.3659
 epoch: 15, train_loss: 1.0953, test_loss: 1.1403, test_f1: 0.3970
 epoch: 16, train_loss: 1.0892, test_loss: 1.1344, test_f1: 0.4078
 epoch: 17, train_loss: 1.0765, test_loss: 1.1275, test_f1: 0.4167
 epoch: 18, train_loss: 1.0626, test_loss: 1.1192, test_f1: 0.4242
 epoch: 19, train_loss: 1.0549, test_loss: 1.0982, test_f1: 0.3982
 epoch: 20, train_loss: 1.0535, test_loss: 1.1059, test_f1: 0.4431
 epoch: 21, train_loss: 1.0453, test_loss: 1.0693, test_f1: 0.4164
 epoch: 22, train_loss: 1.0233, test_loss: 1.0957, test_f1: 0.4226
 epoch: 23, train_loss: 1.0166, test_loss: 1.0662, test_f1: 0.4619
 epoch: 24, train_loss: 1.0165, test_loss: 1.0776, test_f1: 0.4235
 epoch: 25, train_loss: 0.9995, test_loss: 1.0834, test_f1: 0.4514
 epoch: 26, train_loss: 0.9947, test_loss: 1.0712, test_f1: 0.4652
 epoch: 27, train_loss: 0.9934, test_loss: 1.0418, test_f1: 0.4753
 epoch: 28, train_loss: 0.9826, test_loss: 1.0619, test_f1: 0.4758
 epoch: 29, train_loss: 0.9747, test_loss: 1.0743, test_f1: 0.4658
 epoch: 30, train_loss: 0.9599, test_loss: 1.0207, test_f1: 0.5002
 epoch: 31, train_loss: 0.9642, test_loss: 1.0543, test_f1: 0.4973
 epoch: 32, train_loss: 0.9754, test_loss: 1.0212, test_f1: 0.5014
 epoch: 33, train_loss: 0.9586, test_loss: 1.0128, test_f1: 0.5165
 epoch: 34, train_loss: 0.9484, test_loss: 1.0266, test_f1: 0.5100
 epoch: 35, train_loss: 0.9572, test_loss: 1.0209, test_f1: 0.4988
 epoch: 36, train_loss: 0.9300, test_loss: 1.0315, test_f1: 0.5186
 epoch: 37, train_loss: 0.9300, test_loss: 1.0592, test_f1: 0.5085
 epoch: 38, train_loss: 0.9322, test_loss: 1.0735, test_f1: 0.5212
 epoch: 39, train_loss: 0.9309, test_loss: 1.0073, test_f1: 0.5423
 epoch: 40, train_loss: 0.9216, test_loss: 0.9987, test_f1: 0.5565
 epoch: 41, train_loss: 0.9191, test_loss: 1.0109, test_f1: 0.5527
 epoch: 42, train_loss: 0.9175, test_loss: 0.9938, test_f1: 0.5523
 epoch: 43, train_loss: 0.9047, test_loss: 0.9884, test_f1: 0.5671
 epoch: 44, train_loss: 0.9176, test_loss: 0.9955, test_f1: 0.5477
 epoch: 45, train_loss: 0.9083, test_loss: 1.0097, test_f1: 0.5717
 epoch: 46, train_loss: 0.9140, test_loss: 0.9904, test_f1: 0.5752
 epoch: 47, train_loss: 0.8979, test_loss: 1.0544, test_f1: 0.5431
 epoch: 48, train_loss: 0.8962, test_loss: 0.9972, test_f1: 0.5501
 epoch: 49, train_loss: 0.8972, test_loss: 1.0051, test_f1: 0.5581
 epoch: 50, train_loss: 0.9028, test_loss: 0.9731, test_f1: 0.5661
 epoch: 51, train_loss: 0.8867, test_loss: 0.9818, test_f1: 0.5909
 epoch: 52, train_loss: 0.8827, test_loss: 1.0154, test_f1: 0.5567
 epoch: 53, train_loss: 0.8741, test_loss: 0.9950, test_f1: 0.5783
 epoch: 54, train_loss: 0.8759, test_loss: 1.0102, test_f1: 0.5421
 epoch: 55, train_loss: 0.8825, test_loss: 1.0072, test_f1: 0.5448
 epoch: 56, train_loss: 0.8784, test_loss: 1.0073, test_f1: 0.5794
 epoch: 57, train_loss: 0.8869, test_loss: 0.9919, test_f1: 0.5803
 epoch: 58, train_loss: 0.8752, test_loss: 1.0283, test_f1: 0.5561
 epoch: 59, train_loss: 0.8742, test_loss: 1.0226, test_f1: 0.5654
 epoch: 60, train_loss: 0.8747, test_loss: 1.0023, test_f1: 0.5722
 epoch: 61, train_loss: 0.8812, test_loss: 1.0019, test_f1: 0.5613
 epoch: 62, train_loss: 0.8650, test_loss: 0.9960, test_f1: 0.5471
 epoch: 63, train_loss: 0.8704, test_loss: 1.0366, test_f1: 0.5395
 epoch: 64, train_loss: 0.8688, test_loss: 1.0238, test_f1: 0.5854
 epoch: 65, train_loss: 0.8604, test_loss: 1.0571, test_f1: 0.5507
 epoch: 66, train_loss: 0.8683, test_loss: 1.0265, test_f1: 0.5505
 epoch: 67, train_loss: 0.8643, test_loss: 0.9856, test_f1: 0.5528
 epoch: 68, train_loss: 0.8715, test_loss: 1.0116, test_f1: 0.5611
 epoch: 69, train_loss: 0.8562, test_loss: 1.0118, test_f1: 0.5628
 epoch: 70, train_loss: 0.8679, test_loss: 1.0370, test_f1: 0.5612
 epoch: 71, train_loss: 0.8605, test_loss: 1.0147, test_f1: 0.5704
 epoch: 72, train_loss: 0.8484, test_loss: 1.0054, test_f1: 0.5620
 epoch: 73, train_loss: 0.8490, test_loss: 1.0483, test_f1: 0.5687
 epoch: 74, train_loss: 0.8623, test_loss: 1.0354, test_f1: 0.5619
 epoch: 75, train_loss: 0.8542, test_loss: 0.9998, test_f1: 0.5520
 epoch: 76, train_loss: 0.8668, test_loss: 1.0172, test_f1: 0.5660
 epoch: 77, train_loss: 0.8545, test_loss: 1.0087, test_f1: 0.5715
 epoch: 78, train_loss: 0.8506, test_loss: 0.9849, test_f1: 0.5537
 epoch: 79, train_loss: 0.8468, test_loss: 1.0429, test_f1: 0.5558
 epoch: 80, train_loss: 0.8400, test_loss: 1.0392, test_f1: 0.5452
 epoch: 81, train_loss: 0.8525, test_loss: 1.0062, test_f1: 0.5496
 epoch: 82, train_loss: 0.8538, test_loss: 1.0295, test_f1: 0.5584
 epoch: 83, train_loss: 0.8604, test_loss: 1.0514, test_f1: 0.5735
 epoch: 84, train_loss: 0.8419, test_loss: 1.0265, test_f1: 0.5612
 epoch: 85, train_loss: 0.8374, test_loss: 1.0187, test_f1: 0.5432
 epoch: 86, train_loss: 0.8569, test_loss: 1.0313, test_f1: 0.5757
 epoch: 87, train_loss: 0.8273, test_loss: 1.0086, test_f1: 0.5566
 epoch: 88, train_loss: 0.8220, test_loss: 1.0117, test_f1: 0.5706
 epoch: 89, train_loss: 0.8470, test_loss: 1.0488, test_f1: 0.5565
 epoch: 90, train_loss: 0.8255, test_loss: 1.0410, test_f1: 0.5365
 epoch: 91, train_loss: 0.8432, test_loss: 1.0358, test_f1: 0.5377
 epoch: 92, train_loss: 0.8238, test_loss: 1.0239, test_f1: 0.5506
 epoch: 93, train_loss: 0.8441, test_loss: 1.0282, test_f1: 0.5512
 epoch: 94, train_loss: 0.8278, test_loss: 1.0438, test_f1: 0.5383
 epoch: 95, train_loss: 0.8284, test_loss: 1.0713, test_f1: 0.5590
 epoch: 96, train_loss: 0.8294, test_loss: 1.0535, test_f1: 0.5567
 epoch: 97, train_loss: 0.8270, test_loss: 1.0493, test_f1: 0.5610
 epoch: 98, train_loss: 0.8271, test_loss: 1.0371, test_f1: 0.5428
 epoch: 99, train_loss: 0.8299, test_loss: 1.0493, test_f1: 0.5408
##################ITERATION #5 ****************************************
 epoch: 0, train_loss: 1.3098, test_loss: 1.3297, test_f1: 0.2905
 epoch: 1, train_loss: 1.2729, test_loss: 1.3069, test_f1: 0.2862
 epoch: 2, train_loss: 1.2535, test_loss: 1.2991, test_f1: 0.2653
 epoch: 3, train_loss: 1.2367, test_loss: 1.2926, test_f1: 0.2626
 epoch: 4, train_loss: 1.2201, test_loss: 1.2914, test_f1: 0.2553
 epoch: 5, train_loss: 1.1999, test_loss: 1.2746, test_f1: 0.2573
 epoch: 6, train_loss: 1.1894, test_loss: 1.2510, test_f1: 0.2909
 epoch: 7, train_loss: 1.1767, test_loss: 1.2553, test_f1: 0.3212
 epoch: 8, train_loss: 1.1628, test_loss: 1.2205, test_f1: 0.3249
 epoch: 9, train_loss: 1.1530, test_loss: 1.2082, test_f1: 0.3536
 epoch: 10, train_loss: 1.1371, test_loss: 1.1996, test_f1: 0.3658
 epoch: 11, train_loss: 1.1253, test_loss: 1.2184, test_f1: 0.3799
 epoch: 12, train_loss: 1.1256, test_loss: 1.1932, test_f1: 0.4183
 epoch: 13, train_loss: 1.1106, test_loss: 1.1769, test_f1: 0.4316
 epoch: 14, train_loss: 1.1022, test_loss: 1.1566, test_f1: 0.4369
 epoch: 15, train_loss: 1.0954, test_loss: 1.1491, test_f1: 0.4305
 epoch: 16, train_loss: 1.0752, test_loss: 1.1435, test_f1: 0.4506
 epoch: 17, train_loss: 1.0665, test_loss: 1.1362, test_f1: 0.4504
 epoch: 18, train_loss: 1.0451, test_loss: 1.1156, test_f1: 0.4504
 epoch: 19, train_loss: 1.0379, test_loss: 1.1133, test_f1: 0.4584
 epoch: 20, train_loss: 1.0347, test_loss: 1.1030, test_f1: 0.4574
 epoch: 21, train_loss: 1.0180, test_loss: 1.0879, test_f1: 0.4517
 epoch: 22, train_loss: 1.0142, test_loss: 1.0924, test_f1: 0.4873
 epoch: 23, train_loss: 1.0128, test_loss: 1.0742, test_f1: 0.4824
 epoch: 24, train_loss: 0.9854, test_loss: 1.0994, test_f1: 0.4762
 epoch: 25, train_loss: 0.9900, test_loss: 1.0730, test_f1: 0.4962
 epoch: 26, train_loss: 0.9866, test_loss: 1.0668, test_f1: 0.4894
 epoch: 27, train_loss: 0.9784, test_loss: 1.0599, test_f1: 0.4872
 epoch: 28, train_loss: 0.9750, test_loss: 1.0600, test_f1: 0.4994
 epoch: 29, train_loss: 0.9731, test_loss: 1.0599, test_f1: 0.4964
 epoch: 30, train_loss: 0.9486, test_loss: 1.0462, test_f1: 0.5234
 epoch: 31, train_loss: 0.9526, test_loss: 1.0565, test_f1: 0.5033
 epoch: 32, train_loss: 0.9530, test_loss: 1.1047, test_f1: 0.5012
 epoch: 33, train_loss: 0.9373, test_loss: 1.0764, test_f1: 0.4944
 epoch: 34, train_loss: 0.9434, test_loss: 1.0480, test_f1: 0.4993
 epoch: 35, train_loss: 0.9401, test_loss: 1.0338, test_f1: 0.5313
 epoch: 36, train_loss: 0.9332, test_loss: 1.0492, test_f1: 0.5126
 epoch: 37, train_loss: 0.9288, test_loss: 1.0451, test_f1: 0.4993
 epoch: 38, train_loss: 0.9275, test_loss: 1.0902, test_f1: 0.5198
 epoch: 39, train_loss: 0.9232, test_loss: 1.0415, test_f1: 0.5069
 epoch: 40, train_loss: 0.9126, test_loss: 1.0736, test_f1: 0.5123
 epoch: 41, train_loss: 0.9203, test_loss: 1.0686, test_f1: 0.5136
 epoch: 42, train_loss: 0.8970, test_loss: 1.0873, test_f1: 0.5132
 epoch: 43, train_loss: 0.8961, test_loss: 1.0691, test_f1: 0.5162
 epoch: 44, train_loss: 0.9130, test_loss: 1.0936, test_f1: 0.5080
 epoch: 45, train_loss: 0.9026, test_loss: 1.0844, test_f1: 0.5239
 epoch: 46, train_loss: 0.8939, test_loss: 1.0313, test_f1: 0.5031
 epoch: 47, train_loss: 0.9018, test_loss: 1.0326, test_f1: 0.5363
 epoch: 48, train_loss: 0.8957, test_loss: 1.0306, test_f1: 0.5323
 epoch: 49, train_loss: 0.8862, test_loss: 1.0444, test_f1: 0.5504
 epoch: 50, train_loss: 0.8836, test_loss: 1.0280, test_f1: 0.5475
 epoch: 51, train_loss: 0.8783, test_loss: 1.0546, test_f1: 0.5383
 epoch: 52, train_loss: 0.8772, test_loss: 1.0390, test_f1: 0.5388
 epoch: 53, train_loss: 0.8779, test_loss: 1.0380, test_f1: 0.5487
 epoch: 54, train_loss: 0.8753, test_loss: 1.0454, test_f1: 0.5473
 epoch: 55, train_loss: 0.8678, test_loss: 1.0389, test_f1: 0.5572
 epoch: 56, train_loss: 0.8613, test_loss: 1.0354, test_f1: 0.5495
 epoch: 57, train_loss: 0.8698, test_loss: 1.0447, test_f1: 0.5383
 epoch: 58, train_loss: 0.8614, test_loss: 1.0412, test_f1: 0.5552
 epoch: 59, train_loss: 0.8558, test_loss: 1.0460, test_f1: 0.5580
 epoch: 60, train_loss: 0.8655, test_loss: 1.0618, test_f1: 0.5355
 epoch: 61, train_loss: 0.8604, test_loss: 1.0416, test_f1: 0.5528
 epoch: 62, train_loss: 0.8601, test_loss: 1.0506, test_f1: 0.5636
 epoch: 63, train_loss: 0.8765, test_loss: 1.0319, test_f1: 0.5582
 epoch: 64, train_loss: 0.8562, test_loss: 1.0362, test_f1: 0.5563
 epoch: 65, train_loss: 0.8526, test_loss: 1.0346, test_f1: 0.5578
 epoch: 66, train_loss: 0.8449, test_loss: 1.0404, test_f1: 0.5633
 epoch: 67, train_loss: 0.8552, test_loss: 1.0184, test_f1: 0.5610
 epoch: 68, train_loss: 0.8483, test_loss: 1.0471, test_f1: 0.5514
 epoch: 69, train_loss: 0.8514, test_loss: 1.0434, test_f1: 0.5663
 epoch: 70, train_loss: 0.8414, test_loss: 1.0471, test_f1: 0.5452
 epoch: 71, train_loss: 0.8596, test_loss: 1.0307, test_f1: 0.5677
 epoch: 72, train_loss: 0.8433, test_loss: 1.0125, test_f1: 0.5633
 epoch: 73, train_loss: 0.8377, test_loss: 1.0463, test_f1: 0.5450
 epoch: 74, train_loss: 0.8492, test_loss: 1.0389, test_f1: 0.5626
 epoch: 75, train_loss: 0.8510, test_loss: 1.0405, test_f1: 0.5645
 epoch: 76, train_loss: 0.8413, test_loss: 1.0436, test_f1: 0.5679
 epoch: 77, train_loss: 0.8363, test_loss: 1.0345, test_f1: 0.5482
 epoch: 78, train_loss: 0.8361, test_loss: 1.0267, test_f1: 0.5445
 epoch: 79, train_loss: 0.8270, test_loss: 1.0418, test_f1: 0.5590
 epoch: 80, train_loss: 0.8493, test_loss: 1.0391, test_f1: 0.5504
 epoch: 81, train_loss: 0.8326, test_loss: 1.0223, test_f1: 0.5658
 epoch: 82, train_loss: 0.8426, test_loss: 1.0300, test_f1: 0.5617
 epoch: 83, train_loss: 0.8446, test_loss: 1.0721, test_f1: 0.5383
 epoch: 84, train_loss: 0.8199, test_loss: 1.0328, test_f1: 0.5574
 epoch: 85, train_loss: 0.8252, test_loss: 1.0185, test_f1: 0.5662
 epoch: 86, train_loss: 0.8232, test_loss: 1.0352, test_f1: 0.5555
 epoch: 87, train_loss: 0.8253, test_loss: 1.0461, test_f1: 0.5618
 epoch: 88, train_loss: 0.8209, test_loss: 1.0389, test_f1: 0.5595
 epoch: 89, train_loss: 0.8192, test_loss: 1.0350, test_f1: 0.5656
 epoch: 90, train_loss: 0.8215, test_loss: 1.0373, test_f1: 0.5634
 epoch: 91, train_loss: 0.8244, test_loss: 1.0288, test_f1: 0.5736
 epoch: 92, train_loss: 0.8144, test_loss: 1.0278, test_f1: 0.5633
 epoch: 93, train_loss: 0.8136, test_loss: 1.0238, test_f1: 0.5742
 epoch: 94, train_loss: 0.8207, test_loss: 1.0088, test_f1: 0.5660
 epoch: 95, train_loss: 0.8323, test_loss: 1.0457, test_f1: 0.5487
 epoch: 96, train_loss: 0.8022, test_loss: 1.0348, test_f1: 0.5711
 epoch: 97, train_loss: 0.8186, test_loss: 1.0310, test_f1: 0.5541
 epoch: 98, train_loss: 0.7996, test_loss: 1.0634, test_f1: 0.5608
 epoch: 99, train_loss: 0.8260, test_loss: 1.0247, test_f1: 0.5519
##################ITERATION #6 ****************************************
 epoch: 0, train_loss: 1.3072, test_loss: 1.3125, test_f1: 0.2325
 epoch: 1, train_loss: 1.2234, test_loss: 1.2628, test_f1: 0.2913
 epoch: 2, train_loss: 1.1961, test_loss: 1.2433, test_f1: 0.3367
 epoch: 3, train_loss: 1.1767, test_loss: 1.2306, test_f1: 0.3401
 epoch: 4, train_loss: 1.1526, test_loss: 1.1974, test_f1: 0.3662
 epoch: 5, train_loss: 1.1203, test_loss: 1.1901, test_f1: 0.3387
 epoch: 6, train_loss: 1.1225, test_loss: 1.1621, test_f1: 0.3703
 epoch: 7, train_loss: 1.1083, test_loss: 1.1592, test_f1: 0.3850
 epoch: 8, train_loss: 1.0816, test_loss: 1.1504, test_f1: 0.3887
 epoch: 9, train_loss: 1.0781, test_loss: 1.1395, test_f1: 0.4269
 epoch: 10, train_loss: 1.0739, test_loss: 1.1248, test_f1: 0.4374
 epoch: 11, train_loss: 1.0623, test_loss: 1.1216, test_f1: 0.4206
 epoch: 12, train_loss: 1.0550, test_loss: 1.1134, test_f1: 0.4339
 epoch: 13, train_loss: 1.0399, test_loss: 1.0935, test_f1: 0.4274
 epoch: 14, train_loss: 1.0310, test_loss: 1.1028, test_f1: 0.4210
 epoch: 15, train_loss: 1.0342, test_loss: 1.1005, test_f1: 0.4263
 epoch: 16, train_loss: 1.0186, test_loss: 1.0949, test_f1: 0.4207
 epoch: 17, train_loss: 1.0156, test_loss: 1.1071, test_f1: 0.4229
 epoch: 18, train_loss: 1.0137, test_loss: 1.1081, test_f1: 0.4206
 epoch: 19, train_loss: 1.0017, test_loss: 1.1064, test_f1: 0.4246
 epoch: 20, train_loss: 0.9915, test_loss: 1.0979, test_f1: 0.4527
 epoch: 21, train_loss: 0.9823, test_loss: 1.1014, test_f1: 0.4638
 epoch: 22, train_loss: 0.9942, test_loss: 1.0791, test_f1: 0.4537
 epoch: 23, train_loss: 0.9840, test_loss: 1.1002, test_f1: 0.4571
 epoch: 24, train_loss: 0.9704, test_loss: 1.0770, test_f1: 0.4448
 epoch: 25, train_loss: 0.9708, test_loss: 1.0905, test_f1: 0.4480
 epoch: 26, train_loss: 0.9683, test_loss: 1.0818, test_f1: 0.4377
 epoch: 27, train_loss: 0.9681, test_loss: 1.0711, test_f1: 0.4460
 epoch: 28, train_loss: 0.9644, test_loss: 1.0694, test_f1: 0.4484
 epoch: 29, train_loss: 0.9628, test_loss: 1.0738, test_f1: 0.4540
 epoch: 30, train_loss: 0.9479, test_loss: 1.0815, test_f1: 0.4619
 epoch: 31, train_loss: 0.9535, test_loss: 1.0855, test_f1: 0.4672
 epoch: 32, train_loss: 0.9469, test_loss: 1.0717, test_f1: 0.4711
 epoch: 33, train_loss: 0.9404, test_loss: 1.1134, test_f1: 0.4701
 epoch: 34, train_loss: 0.9394, test_loss: 1.0843, test_f1: 0.4807
 epoch: 35, train_loss: 0.9263, test_loss: 1.1158, test_f1: 0.4867
 epoch: 36, train_loss: 0.9206, test_loss: 1.1084, test_f1: 0.4846
 epoch: 37, train_loss: 0.9299, test_loss: 1.0928, test_f1: 0.4884
 epoch: 38, train_loss: 0.9288, test_loss: 1.0993, test_f1: 0.4988
 epoch: 39, train_loss: 0.9251, test_loss: 1.0491, test_f1: 0.5046
 epoch: 40, train_loss: 0.9320, test_loss: 1.1635, test_f1: 0.5024
 epoch: 41, train_loss: 0.9224, test_loss: 1.1170, test_f1: 0.5160
 epoch: 42, train_loss: 0.9194, test_loss: 1.1079, test_f1: 0.5099
 epoch: 43, train_loss: 0.9222, test_loss: 1.1051, test_f1: 0.5074
 epoch: 44, train_loss: 0.9119, test_loss: 1.0860, test_f1: 0.5054
 epoch: 45, train_loss: 0.9045, test_loss: 1.1834, test_f1: 0.5230
 epoch: 46, train_loss: 0.9060, test_loss: 1.1647, test_f1: 0.5234
 epoch: 47, train_loss: 0.9012, test_loss: 1.1135, test_f1: 0.5237
 epoch: 48, train_loss: 0.8872, test_loss: 1.1736, test_f1: 0.5170
 epoch: 49, train_loss: 0.8897, test_loss: 1.2366, test_f1: 0.5239
 epoch: 50, train_loss: 0.8935, test_loss: 1.2673, test_f1: 0.5110
 epoch: 51, train_loss: 0.8950, test_loss: 1.2625, test_f1: 0.5184
 epoch: 52, train_loss: 0.8915, test_loss: 1.2192, test_f1: 0.5248
 epoch: 53, train_loss: 0.8897, test_loss: 1.1923, test_f1: 0.5257
 epoch: 54, train_loss: 0.8890, test_loss: 1.2077, test_f1: 0.5280
 epoch: 55, train_loss: 0.8765, test_loss: 1.2590, test_f1: 0.5091
 epoch: 56, train_loss: 0.8819, test_loss: 1.2581, test_f1: 0.5249
 epoch: 57, train_loss: 0.8849, test_loss: 1.2947, test_f1: 0.5251
 epoch: 58, train_loss: 0.8790, test_loss: 1.3263, test_f1: 0.5149
 epoch: 59, train_loss: 0.8815, test_loss: 1.2023, test_f1: 0.5315
 epoch: 60, train_loss: 0.8778, test_loss: 1.2273, test_f1: 0.5261
 epoch: 61, train_loss: 0.8606, test_loss: 1.2157, test_f1: 0.5302
 epoch: 62, train_loss: 0.8737, test_loss: 1.2185, test_f1: 0.5301
 epoch: 63, train_loss: 0.8672, test_loss: 1.2777, test_f1: 0.5266
 epoch: 64, train_loss: 0.8653, test_loss: 1.2488, test_f1: 0.5385
 epoch: 65, train_loss: 0.8722, test_loss: 1.1984, test_f1: 0.5301
 epoch: 66, train_loss: 0.8644, test_loss: 1.1723, test_f1: 0.5268
 epoch: 67, train_loss: 0.8710, test_loss: 1.3241, test_f1: 0.5158
 epoch: 68, train_loss: 0.8690, test_loss: 1.2267, test_f1: 0.5301
 epoch: 69, train_loss: 0.8637, test_loss: 1.2367, test_f1: 0.5095
 epoch: 70, train_loss: 0.8546, test_loss: 1.2249, test_f1: 0.5183
 epoch: 71, train_loss: 0.8611, test_loss: 1.2551, test_f1: 0.5300
 epoch: 72, train_loss: 0.8588, test_loss: 1.2349, test_f1: 0.5254
 epoch: 73, train_loss: 0.8644, test_loss: 1.2438, test_f1: 0.5377
 epoch: 74, train_loss: 0.8588, test_loss: 1.1789, test_f1: 0.5242
 epoch: 75, train_loss: 0.8605, test_loss: 1.2335, test_f1: 0.5239
 epoch: 76, train_loss: 0.8498, test_loss: 1.1609, test_f1: 0.5254
 epoch: 77, train_loss: 0.8365, test_loss: 1.2919, test_f1: 0.5335
 epoch: 78, train_loss: 0.8498, test_loss: 1.2439, test_f1: 0.5218
 epoch: 79, train_loss: 0.8543, test_loss: 1.2907, test_f1: 0.5242
 epoch: 80, train_loss: 0.8484, test_loss: 1.2812, test_f1: 0.5206
 epoch: 81, train_loss: 0.8449, test_loss: 1.3336, test_f1: 0.5121
 epoch: 82, train_loss: 0.8530, test_loss: 1.2387, test_f1: 0.5214
 epoch: 83, train_loss: 0.8439, test_loss: 1.2733, test_f1: 0.5193
 epoch: 84, train_loss: 0.8308, test_loss: 1.2534, test_f1: 0.5103
 epoch: 85, train_loss: 0.8455, test_loss: 1.2641, test_f1: 0.5130
 epoch: 86, train_loss: 0.8453, test_loss: 1.3401, test_f1: 0.5083
 epoch: 87, train_loss: 0.8439, test_loss: 1.3396, test_f1: 0.5153
 epoch: 88, train_loss: 0.8401, test_loss: 1.1765, test_f1: 0.5330
 epoch: 89, train_loss: 0.8213, test_loss: 1.3806, test_f1: 0.5139
 epoch: 90, train_loss: 0.8449, test_loss: 1.2677, test_f1: 0.5225
 epoch: 91, train_loss: 0.8298, test_loss: 1.2978, test_f1: 0.5330
 epoch: 92, train_loss: 0.8405, test_loss: 1.2704, test_f1: 0.5221
 epoch: 93, train_loss: 0.8358, test_loss: 1.2027, test_f1: 0.5222
 epoch: 94, train_loss: 0.8277, test_loss: 1.2760, test_f1: 0.5258
 epoch: 95, train_loss: 0.8328, test_loss: 1.2231, test_f1: 0.5264
 epoch: 96, train_loss: 0.8274, test_loss: 1.3101, test_f1: 0.5221
 epoch: 97, train_loss: 0.8166, test_loss: 1.2981, test_f1: 0.5310
 epoch: 98, train_loss: 0.8363, test_loss: 1.2315, test_f1: 0.5145
 epoch: 99, train_loss: 0.8162, test_loss: 1.3863, test_f1: 0.5244
##################ITERATION #7 ****************************************
 epoch: 0, train_loss: 1.3175, test_loss: 1.3611, test_f1: 0.2349
 epoch: 1, train_loss: 1.2461, test_loss: 1.3068, test_f1: 0.2504
 epoch: 2, train_loss: 1.2152, test_loss: 1.2873, test_f1: 0.2864
 epoch: 3, train_loss: 1.1786, test_loss: 1.2574, test_f1: 0.3153
 epoch: 4, train_loss: 1.1777, test_loss: 1.2363, test_f1: 0.3451
 epoch: 5, train_loss: 1.1637, test_loss: 1.2177, test_f1: 0.3244
 epoch: 6, train_loss: 1.1301, test_loss: 1.1998, test_f1: 0.3309
 epoch: 7, train_loss: 1.1182, test_loss: 1.1878, test_f1: 0.3291
 epoch: 8, train_loss: 1.1166, test_loss: 1.1760, test_f1: 0.3304
 epoch: 9, train_loss: 1.1009, test_loss: 1.1691, test_f1: 0.3595
 epoch: 10, train_loss: 1.0891, test_loss: 1.1573, test_f1: 0.3407
 epoch: 11, train_loss: 1.0735, test_loss: 1.1507, test_f1: 0.3331
 epoch: 12, train_loss: 1.0665, test_loss: 1.1487, test_f1: 0.3653
 epoch: 13, train_loss: 1.0469, test_loss: 1.1361, test_f1: 0.3691
 epoch: 14, train_loss: 1.0564, test_loss: 1.1205, test_f1: 0.3719
 epoch: 15, train_loss: 1.0310, test_loss: 1.1122, test_f1: 0.3667
 epoch: 16, train_loss: 1.0375, test_loss: 1.1068, test_f1: 0.3786
 epoch: 17, train_loss: 1.0151, test_loss: 1.1023, test_f1: 0.3961
 epoch: 18, train_loss: 1.0244, test_loss: 1.0870, test_f1: 0.4072
 epoch: 19, train_loss: 1.0081, test_loss: 1.0917, test_f1: 0.4363
 epoch: 20, train_loss: 0.9951, test_loss: 1.0856, test_f1: 0.4206
 epoch: 21, train_loss: 0.9884, test_loss: 1.0756, test_f1: 0.4464
 epoch: 22, train_loss: 0.9956, test_loss: 1.0714, test_f1: 0.4512
 epoch: 23, train_loss: 0.9880, test_loss: 1.0727, test_f1: 0.4362
 epoch: 24, train_loss: 0.9808, test_loss: 1.0633, test_f1: 0.4556
 epoch: 25, train_loss: 0.9772, test_loss: 1.0645, test_f1: 0.4528
 epoch: 26, train_loss: 0.9701, test_loss: 1.0697, test_f1: 0.4678
 epoch: 27, train_loss: 0.9688, test_loss: 1.0599, test_f1: 0.4625
 epoch: 28, train_loss: 0.9579, test_loss: 1.0581, test_f1: 0.4744
 epoch: 29, train_loss: 0.9590, test_loss: 1.0620, test_f1: 0.4793
 epoch: 30, train_loss: 0.9513, test_loss: 1.0560, test_f1: 0.4850
 epoch: 31, train_loss: 0.9349, test_loss: 1.0535, test_f1: 0.4781
 epoch: 32, train_loss: 0.9443, test_loss: 1.0624, test_f1: 0.4826
 epoch: 33, train_loss: 0.9343, test_loss: 1.0588, test_f1: 0.4953
 epoch: 34, train_loss: 0.9348, test_loss: 1.0587, test_f1: 0.4898
 epoch: 35, train_loss: 0.9283, test_loss: 1.0565, test_f1: 0.4847
 epoch: 36, train_loss: 0.9211, test_loss: 1.0568, test_f1: 0.4956
 epoch: 37, train_loss: 0.9165, test_loss: 1.0531, test_f1: 0.5031
 epoch: 38, train_loss: 0.9106, test_loss: 1.0479, test_f1: 0.5018
 epoch: 39, train_loss: 0.9093, test_loss: 1.0480, test_f1: 0.5061
 epoch: 40, train_loss: 0.9040, test_loss: 1.0378, test_f1: 0.5075
 epoch: 41, train_loss: 0.9080, test_loss: 1.0380, test_f1: 0.5158
 epoch: 42, train_loss: 0.8997, test_loss: 1.0267, test_f1: 0.5076
 epoch: 43, train_loss: 0.9033, test_loss: 1.0271, test_f1: 0.5194
 epoch: 44, train_loss: 0.8946, test_loss: 1.0443, test_f1: 0.5059
 epoch: 45, train_loss: 0.8888, test_loss: 1.0265, test_f1: 0.5189
 epoch: 46, train_loss: 0.8875, test_loss: 1.0353, test_f1: 0.5100
 epoch: 47, train_loss: 0.8811, test_loss: 1.0310, test_f1: 0.5172
 epoch: 48, train_loss: 0.8738, test_loss: 1.0583, test_f1: 0.5204
 epoch: 49, train_loss: 0.8705, test_loss: 1.0502, test_f1: 0.5128
 epoch: 50, train_loss: 0.8707, test_loss: 1.0299, test_f1: 0.5094
 epoch: 51, train_loss: 0.8619, test_loss: 1.0369, test_f1: 0.5099
 epoch: 52, train_loss: 0.8732, test_loss: 1.0210, test_f1: 0.5092
 epoch: 53, train_loss: 0.8757, test_loss: 1.0311, test_f1: 0.5073
 epoch: 54, train_loss: 0.8658, test_loss: 1.0159, test_f1: 0.5134
 epoch: 55, train_loss: 0.8646, test_loss: 1.0167, test_f1: 0.5146
 epoch: 56, train_loss: 0.8573, test_loss: 1.0325, test_f1: 0.5120
 epoch: 57, train_loss: 0.8455, test_loss: 1.0309, test_f1: 0.4946
 epoch: 58, train_loss: 0.8733, test_loss: 1.0435, test_f1: 0.4970
 epoch: 59, train_loss: 0.8464, test_loss: 1.0265, test_f1: 0.5176
 epoch: 60, train_loss: 0.8464, test_loss: 1.0353, test_f1: 0.5147
 epoch: 61, train_loss: 0.8537, test_loss: 1.0372, test_f1: 0.4977
 epoch: 62, train_loss: 0.8542, test_loss: 1.0173, test_f1: 0.5169
 epoch: 63, train_loss: 0.8463, test_loss: 1.0313, test_f1: 0.5087
 epoch: 64, train_loss: 0.8531, test_loss: 1.0285, test_f1: 0.5136
 epoch: 65, train_loss: 0.8571, test_loss: 1.0271, test_f1: 0.5041
 epoch: 66, train_loss: 0.8516, test_loss: 1.0074, test_f1: 0.5092
 epoch: 67, train_loss: 0.8393, test_loss: 1.0238, test_f1: 0.5045
 epoch: 68, train_loss: 0.8373, test_loss: 1.0152, test_f1: 0.5129
 epoch: 69, train_loss: 0.8502, test_loss: 1.0185, test_f1: 0.4989
 epoch: 70, train_loss: 0.8453, test_loss: 1.0369, test_f1: 0.5073
 epoch: 71, train_loss: 0.8379, test_loss: 1.0305, test_f1: 0.4926
 epoch: 72, train_loss: 0.8318, test_loss: 1.0742, test_f1: 0.4866
 epoch: 73, train_loss: 0.8256, test_loss: 1.0316, test_f1: 0.4934
 epoch: 74, train_loss: 0.8291, test_loss: 1.0139, test_f1: 0.5039
 epoch: 75, train_loss: 0.8322, test_loss: 1.0312, test_f1: 0.4959
 epoch: 76, train_loss: 0.8302, test_loss: 1.0365, test_f1: 0.5043
 epoch: 77, train_loss: 0.8263, test_loss: 1.0155, test_f1: 0.5163
 epoch: 78, train_loss: 0.8317, test_loss: 1.0258, test_f1: 0.5073
 epoch: 79, train_loss: 0.8156, test_loss: 1.0186, test_f1: 0.5122
 epoch: 80, train_loss: 0.8195, test_loss: 1.0254, test_f1: 0.5124
 epoch: 81, train_loss: 0.8168, test_loss: 1.0317, test_f1: 0.4979
 epoch: 82, train_loss: 0.8146, test_loss: 1.0214, test_f1: 0.5165
 epoch: 83, train_loss: 0.8197, test_loss: 1.0175, test_f1: 0.5118
 epoch: 84, train_loss: 0.8336, test_loss: 1.0275, test_f1: 0.5230
 epoch: 85, train_loss: 0.8111, test_loss: 1.0290, test_f1: 0.5045
 epoch: 86, train_loss: 0.8166, test_loss: 1.0091, test_f1: 0.5265
 epoch: 87, train_loss: 0.8287, test_loss: 1.0134, test_f1: 0.5243
 epoch: 88, train_loss: 0.8218, test_loss: 1.0107, test_f1: 0.5086
 epoch: 89, train_loss: 0.8072, test_loss: 1.0032, test_f1: 0.5226
 epoch: 90, train_loss: 0.8049, test_loss: 1.0057, test_f1: 0.5149
 epoch: 91, train_loss: 0.8022, test_loss: 1.0194, test_f1: 0.5155
 epoch: 92, train_loss: 0.8124, test_loss: 1.0414, test_f1: 0.4886
 epoch: 93, train_loss: 0.7982, test_loss: 1.0534, test_f1: 0.5245
 epoch: 94, train_loss: 0.8145, test_loss: 1.0159, test_f1: 0.5351
 epoch: 95, train_loss: 0.8138, test_loss: 1.0469, test_f1: 0.5195
 epoch: 96, train_loss: 0.7926, test_loss: 1.0055, test_f1: 0.5367
 epoch: 97, train_loss: 0.7947, test_loss: 0.9998, test_f1: 0.5408
 epoch: 98, train_loss: 0.8039, test_loss: 1.0027, test_f1: 0.5417
 epoch: 99, train_loss: 0.7929, test_loss: 0.9934, test_f1: 0.5339
##################ITERATION #8 ****************************************
 epoch: 0, train_loss: 1.3418, test_loss: 1.3812, test_f1: 0.2735
 epoch: 1, train_loss: 1.2398, test_loss: 1.2877, test_f1: 0.2368
 epoch: 2, train_loss: 1.2157, test_loss: 1.2591, test_f1: 0.2539
 epoch: 3, train_loss: 1.1927, test_loss: 1.2402, test_f1: 0.2806
 epoch: 4, train_loss: 1.1846, test_loss: 1.2180, test_f1: 0.3065
 epoch: 5, train_loss: 1.1647, test_loss: 1.2138, test_f1: 0.3417
 epoch: 6, train_loss: 1.1444, test_loss: 1.2010, test_f1: 0.3745
 epoch: 7, train_loss: 1.1314, test_loss: 1.1818, test_f1: 0.3768
 epoch: 8, train_loss: 1.1047, test_loss: 1.1716, test_f1: 0.3790
 epoch: 9, train_loss: 1.1048, test_loss: 1.1666, test_f1: 0.3926
 epoch: 10, train_loss: 1.0913, test_loss: 1.1618, test_f1: 0.4028
 epoch: 11, train_loss: 1.0887, test_loss: 1.1536, test_f1: 0.3936
 epoch: 12, train_loss: 1.0831, test_loss: 1.1341, test_f1: 0.4322
 epoch: 13, train_loss: 1.0558, test_loss: 1.1311, test_f1: 0.4331
 epoch: 14, train_loss: 1.0443, test_loss: 1.1439, test_f1: 0.4299
 epoch: 15, train_loss: 1.0489, test_loss: 1.1335, test_f1: 0.4445
 epoch: 16, train_loss: 1.0448, test_loss: 1.1348, test_f1: 0.4414
 epoch: 17, train_loss: 1.0279, test_loss: 1.1162, test_f1: 0.4444
 epoch: 18, train_loss: 1.0173, test_loss: 1.1047, test_f1: 0.4450
 epoch: 19, train_loss: 1.0247, test_loss: 1.1123, test_f1: 0.4400
 epoch: 20, train_loss: 1.0033, test_loss: 1.1062, test_f1: 0.4708
 epoch: 21, train_loss: 0.9970, test_loss: 1.0808, test_f1: 0.4656
 epoch: 22, train_loss: 0.9987, test_loss: 1.0989, test_f1: 0.4551
 epoch: 23, train_loss: 1.0076, test_loss: 1.0770, test_f1: 0.4734
 epoch: 24, train_loss: 0.9893, test_loss: 1.0926, test_f1: 0.4942
 epoch: 25, train_loss: 0.9803, test_loss: 1.0936, test_f1: 0.4970
 epoch: 26, train_loss: 0.9891, test_loss: 1.0968, test_f1: 0.4878
 epoch: 27, train_loss: 0.9702, test_loss: 1.0793, test_f1: 0.5130
 epoch: 28, train_loss: 0.9641, test_loss: 1.0782, test_f1: 0.5114
 epoch: 29, train_loss: 0.9530, test_loss: 1.0778, test_f1: 0.5034
 epoch: 30, train_loss: 0.9538, test_loss: 1.0717, test_f1: 0.5113
 epoch: 31, train_loss: 0.9535, test_loss: 1.0805, test_f1: 0.4979
 epoch: 32, train_loss: 0.9473, test_loss: 1.0789, test_f1: 0.4993
 epoch: 33, train_loss: 0.9420, test_loss: 1.0491, test_f1: 0.4989
 epoch: 34, train_loss: 0.9345, test_loss: 1.0406, test_f1: 0.5225
 epoch: 35, train_loss: 0.9167, test_loss: 1.0333, test_f1: 0.5314
 epoch: 36, train_loss: 0.9341, test_loss: 1.0274, test_f1: 0.5242
 epoch: 37, train_loss: 0.9276, test_loss: 1.0267, test_f1: 0.5497
 epoch: 38, train_loss: 0.9094, test_loss: 1.0287, test_f1: 0.5443
 epoch: 39, train_loss: 0.9253, test_loss: 1.0096, test_f1: 0.5323
 epoch: 40, train_loss: 0.9033, test_loss: 1.0459, test_f1: 0.5329
 epoch: 41, train_loss: 0.9040, test_loss: 1.0523, test_f1: 0.5400
 epoch: 42, train_loss: 0.9014, test_loss: 1.0718, test_f1: 0.5258
 epoch: 43, train_loss: 0.8995, test_loss: 1.0499, test_f1: 0.5421
 epoch: 44, train_loss: 0.8944, test_loss: 1.0335, test_f1: 0.5337
 epoch: 45, train_loss: 0.8886, test_loss: 1.0153, test_f1: 0.5294
 epoch: 46, train_loss: 0.8821, test_loss: 1.0045, test_f1: 0.5493
 epoch: 47, train_loss: 0.8778, test_loss: 0.9909, test_f1: 0.5574
 epoch: 48, train_loss: 0.8943, test_loss: 0.9930, test_f1: 0.5559
 epoch: 49, train_loss: 0.8766, test_loss: 0.9824, test_f1: 0.5605
 epoch: 50, train_loss: 0.8771, test_loss: 0.9856, test_f1: 0.5716
 epoch: 51, train_loss: 0.8662, test_loss: 1.0035, test_f1: 0.5606
 epoch: 52, train_loss: 0.8636, test_loss: 0.9940, test_f1: 0.5669
 epoch: 53, train_loss: 0.8693, test_loss: 0.9887, test_f1: 0.5640
 epoch: 54, train_loss: 0.8577, test_loss: 0.9881, test_f1: 0.5769
 epoch: 55, train_loss: 0.8614, test_loss: 0.9855, test_f1: 0.5683
 epoch: 56, train_loss: 0.8560, test_loss: 0.9903, test_f1: 0.5608
 epoch: 57, train_loss: 0.8502, test_loss: 0.9842, test_f1: 0.5579
 epoch: 58, train_loss: 0.8568, test_loss: 0.9736, test_f1: 0.5728
 epoch: 59, train_loss: 0.8353, test_loss: 0.9874, test_f1: 0.5801
 epoch: 60, train_loss: 0.8510, test_loss: 0.9820, test_f1: 0.5748
 epoch: 61, train_loss: 0.8477, test_loss: 0.9846, test_f1: 0.5786
 epoch: 62, train_loss: 0.8381, test_loss: 0.9812, test_f1: 0.5863
 epoch: 63, train_loss: 0.8336, test_loss: 0.9901, test_f1: 0.5798
 epoch: 64, train_loss: 0.8166, test_loss: 0.9754, test_f1: 0.5925
 epoch: 65, train_loss: 0.8471, test_loss: 0.9805, test_f1: 0.5767
 epoch: 66, train_loss: 0.8505, test_loss: 0.9912, test_f1: 0.5768
 epoch: 67, train_loss: 0.8441, test_loss: 0.9872, test_f1: 0.5827
 epoch: 68, train_loss: 0.8489, test_loss: 0.9794, test_f1: 0.5597
 epoch: 69, train_loss: 0.8478, test_loss: 0.9719, test_f1: 0.5762
 epoch: 70, train_loss: 0.8340, test_loss: 0.9858, test_f1: 0.5704
 epoch: 71, train_loss: 0.8279, test_loss: 0.9910, test_f1: 0.5793
 epoch: 72, train_loss: 0.8119, test_loss: 0.9794, test_f1: 0.5726
 epoch: 73, train_loss: 0.8240, test_loss: 0.9765, test_f1: 0.5843
 epoch: 74, train_loss: 0.8271, test_loss: 0.9826, test_f1: 0.5804
 epoch: 75, train_loss: 0.8224, test_loss: 0.9897, test_f1: 0.5723
 epoch: 76, train_loss: 0.8117, test_loss: 0.9734, test_f1: 0.5781
 epoch: 77, train_loss: 0.8074, test_loss: 0.9833, test_f1: 0.5482
 epoch: 78, train_loss: 0.8086, test_loss: 0.9761, test_f1: 0.5961
 epoch: 79, train_loss: 0.8208, test_loss: 0.9819, test_f1: 0.6009
 epoch: 80, train_loss: 0.8065, test_loss: 0.9798, test_f1: 0.5673
 epoch: 81, train_loss: 0.8148, test_loss: 0.9768, test_f1: 0.5560
 epoch: 82, train_loss: 0.7949, test_loss: 0.9800, test_f1: 0.5626
 epoch: 83, train_loss: 0.8118, test_loss: 0.9824, test_f1: 0.5816
 epoch: 84, train_loss: 0.8020, test_loss: 0.9696, test_f1: 0.5788
 epoch: 85, train_loss: 0.8107, test_loss: 0.9803, test_f1: 0.5667
 epoch: 86, train_loss: 0.7862, test_loss: 0.9908, test_f1: 0.5652
 epoch: 87, train_loss: 0.8017, test_loss: 0.9795, test_f1: 0.5710
 epoch: 88, train_loss: 0.7951, test_loss: 0.9887, test_f1: 0.5622
 epoch: 89, train_loss: 0.8056, test_loss: 1.0012, test_f1: 0.5617
 epoch: 90, train_loss: 0.7841, test_loss: 0.9844, test_f1: 0.5584
 epoch: 91, train_loss: 0.8000, test_loss: 0.9783, test_f1: 0.5751
 epoch: 92, train_loss: 0.7923, test_loss: 1.0096, test_f1: 0.5782
 epoch: 93, train_loss: 0.7820, test_loss: 0.9999, test_f1: 0.5485
 epoch: 94, train_loss: 0.7771, test_loss: 0.9923, test_f1: 0.5379
 epoch: 95, train_loss: 0.7774, test_loss: 0.9971, test_f1: 0.5279
 epoch: 96, train_loss: 0.7818, test_loss: 0.9914, test_f1: 0.5456
 epoch: 97, train_loss: 0.7765, test_loss: 1.0003, test_f1: 0.5633
 epoch: 98, train_loss: 0.7817, test_loss: 0.9916, test_f1: 0.5576
 epoch: 99, train_loss: 0.7872, test_loss: 1.0041, test_f1: 0.5530
##################ITERATION #9 ****************************************
 epoch: 0, train_loss: 1.3009, test_loss: 1.3113, test_f1: 0.2407
 epoch: 1, train_loss: 1.2173, test_loss: 1.2297, test_f1: 0.3127
 epoch: 2, train_loss: 1.1717, test_loss: 1.2016, test_f1: 0.3701
 epoch: 3, train_loss: 1.1505, test_loss: 1.1875, test_f1: 0.3805
 epoch: 4, train_loss: 1.1248, test_loss: 1.1642, test_f1: 0.3631
 epoch: 5, train_loss: 1.0947, test_loss: 1.1535, test_f1: 0.3627
 epoch: 6, train_loss: 1.0783, test_loss: 1.1247, test_f1: 0.3643
 epoch: 7, train_loss: 1.0562, test_loss: 1.1140, test_f1: 0.3844
 epoch: 8, train_loss: 1.0517, test_loss: 1.1099, test_f1: 0.3638
 epoch: 9, train_loss: 1.0284, test_loss: 1.1140, test_f1: 0.4434
 epoch: 10, train_loss: 1.0302, test_loss: 1.0781, test_f1: 0.4009
 epoch: 11, train_loss: 1.0148, test_loss: 1.0802, test_f1: 0.4721
 epoch: 12, train_loss: 1.0013, test_loss: 1.0617, test_f1: 0.4849
 epoch: 13, train_loss: 0.9985, test_loss: 1.0608, test_f1: 0.4962
 epoch: 14, train_loss: 0.9814, test_loss: 1.0671, test_f1: 0.5114
 epoch: 15, train_loss: 0.9863, test_loss: 1.0650, test_f1: 0.5073
 epoch: 16, train_loss: 0.9686, test_loss: 1.0590, test_f1: 0.5247
 epoch: 17, train_loss: 0.9566, test_loss: 1.0523, test_f1: 0.5263
 epoch: 18, train_loss: 0.9533, test_loss: 1.0374, test_f1: 0.5372
 epoch: 19, train_loss: 0.9447, test_loss: 1.0597, test_f1: 0.5308
 epoch: 20, train_loss: 0.9470, test_loss: 1.0567, test_f1: 0.5140
 epoch: 21, train_loss: 0.9349, test_loss: 1.0477, test_f1: 0.5354
 epoch: 22, train_loss: 0.9322, test_loss: 1.0200, test_f1: 0.5317
 epoch: 23, train_loss: 0.9315, test_loss: 1.0119, test_f1: 0.5322
 epoch: 24, train_loss: 0.9248, test_loss: 1.0144, test_f1: 0.5523
 epoch: 25, train_loss: 0.9241, test_loss: 1.0040, test_f1: 0.5316
 epoch: 26, train_loss: 0.9213, test_loss: 0.9955, test_f1: 0.5730
 epoch: 27, train_loss: 0.9201, test_loss: 1.0254, test_f1: 0.5717
 epoch: 28, train_loss: 0.9129, test_loss: 1.0131, test_f1: 0.5358
 epoch: 29, train_loss: 0.8977, test_loss: 0.9964, test_f1: 0.5398
 epoch: 30, train_loss: 0.9069, test_loss: 0.9880, test_f1: 0.5694
 epoch: 31, train_loss: 0.8957, test_loss: 0.9752, test_f1: 0.5791
 epoch: 32, train_loss: 0.8866, test_loss: 0.9915, test_f1: 0.5605
 epoch: 33, train_loss: 0.9014, test_loss: 0.9867, test_f1: 0.5717
 epoch: 34, train_loss: 0.8872, test_loss: 1.0103, test_f1: 0.5625
 epoch: 35, train_loss: 0.8824, test_loss: 0.9871, test_f1: 0.5552
 epoch: 36, train_loss: 0.8785, test_loss: 0.9836, test_f1: 0.5556
 epoch: 37, train_loss: 0.8872, test_loss: 0.9743, test_f1: 0.5574
 epoch: 38, train_loss: 0.8795, test_loss: 0.9731, test_f1: 0.5754
 epoch: 39, train_loss: 0.8712, test_loss: 0.9851, test_f1: 0.5536
 epoch: 40, train_loss: 0.8650, test_loss: 0.9896, test_f1: 0.5399
 epoch: 41, train_loss: 0.8477, test_loss: 0.9724, test_f1: 0.5596
 epoch: 42, train_loss: 0.8409, test_loss: 0.9832, test_f1: 0.5576
 epoch: 43, train_loss: 0.8628, test_loss: 0.9774, test_f1: 0.5730
 epoch: 44, train_loss: 0.8528, test_loss: 0.9681, test_f1: 0.5655
 epoch: 45, train_loss: 0.8495, test_loss: 0.9761, test_f1: 0.5710
 epoch: 46, train_loss: 0.8455, test_loss: 0.9595, test_f1: 0.5733
 epoch: 47, train_loss: 0.8457, test_loss: 0.9506, test_f1: 0.5774
 epoch: 48, train_loss: 0.8519, test_loss: 0.9710, test_f1: 0.5543
 epoch: 49, train_loss: 0.8359, test_loss: 0.9885, test_f1: 0.5629
 epoch: 50, train_loss: 0.8379, test_loss: 0.9745, test_f1: 0.5667
 epoch: 51, train_loss: 0.8260, test_loss: 0.9489, test_f1: 0.5747
 epoch: 52, train_loss: 0.8292, test_loss: 0.9620, test_f1: 0.5851
 epoch: 53, train_loss: 0.8270, test_loss: 0.9577, test_f1: 0.5630
 epoch: 54, train_loss: 0.8270, test_loss: 0.9714, test_f1: 0.5604
 epoch: 55, train_loss: 0.8283, test_loss: 0.9768, test_f1: 0.5566
 epoch: 56, train_loss: 0.8187, test_loss: 0.9555, test_f1: 0.5698
 epoch: 57, train_loss: 0.8154, test_loss: 0.9597, test_f1: 0.5700
 epoch: 58, train_loss: 0.8214, test_loss: 0.9942, test_f1: 0.5674
 epoch: 59, train_loss: 0.8062, test_loss: 0.9853, test_f1: 0.5629
 epoch: 60, train_loss: 0.8057, test_loss: 0.9745, test_f1: 0.5615
 epoch: 61, train_loss: 0.8067, test_loss: 0.9852, test_f1: 0.5707
 epoch: 62, train_loss: 0.7984, test_loss: 0.9593, test_f1: 0.5628
 epoch: 63, train_loss: 0.8124, test_loss: 0.9874, test_f1: 0.5827
 epoch: 64, train_loss: 0.8087, test_loss: 0.9776, test_f1: 0.5752
 epoch: 65, train_loss: 0.8025, test_loss: 0.9909, test_f1: 0.5805
 epoch: 66, train_loss: 0.8058, test_loss: 0.9719, test_f1: 0.5835
 epoch: 67, train_loss: 0.8081, test_loss: 0.9654, test_f1: 0.5833
 epoch: 68, train_loss: 0.7955, test_loss: 0.9785, test_f1: 0.5601
 epoch: 69, train_loss: 0.7941, test_loss: 0.9812, test_f1: 0.5737
 epoch: 70, train_loss: 0.7931, test_loss: 0.9752, test_f1: 0.5690
 epoch: 71, train_loss: 0.7934, test_loss: 0.9893, test_f1: 0.5681
 epoch: 72, train_loss: 0.7899, test_loss: 0.9956, test_f1: 0.5641
 epoch: 73, train_loss: 0.7921, test_loss: 0.9683, test_f1: 0.5800
 epoch: 74, train_loss: 0.7985, test_loss: 0.9687, test_f1: 0.5735
 epoch: 75, train_loss: 0.8018, test_loss: 0.9658, test_f1: 0.5846
 epoch: 76, train_loss: 0.7866, test_loss: 0.9982, test_f1: 0.5794
 epoch: 77, train_loss: 0.7978, test_loss: 0.9867, test_f1: 0.5945
 epoch: 78, train_loss: 0.7859, test_loss: 0.9946, test_f1: 0.5629
 epoch: 79, train_loss: 0.8003, test_loss: 0.9949, test_f1: 0.5825
 epoch: 80, train_loss: 0.7685, test_loss: 0.9779, test_f1: 0.5939
 epoch: 81, train_loss: 0.7771, test_loss: 0.9849, test_f1: 0.5701
 epoch: 82, train_loss: 0.7768, test_loss: 0.9898, test_f1: 0.5736
 epoch: 83, train_loss: 0.7616, test_loss: 0.9937, test_f1: 0.5583
 epoch: 84, train_loss: 0.7762, test_loss: 0.9994, test_f1: 0.5500
 epoch: 85, train_loss: 0.7791, test_loss: 0.9851, test_f1: 0.5676
 epoch: 86, train_loss: 0.7701, test_loss: 1.0061, test_f1: 0.5698
 epoch: 87, train_loss: 0.7603, test_loss: 1.0103, test_f1: 0.5526
 epoch: 88, train_loss: 0.7727, test_loss: 0.9939, test_f1: 0.5628
 epoch: 89, train_loss: 0.7704, test_loss: 0.9819, test_f1: 0.5796
 epoch: 90, train_loss: 0.7595, test_loss: 0.9954, test_f1: 0.5742
 epoch: 91, train_loss: 0.7678, test_loss: 0.9898, test_f1: 0.5821
 epoch: 92, train_loss: 0.7693, test_loss: 0.9977, test_f1: 0.5778
 epoch: 93, train_loss: 0.7644, test_loss: 1.0060, test_f1: 0.5692
 epoch: 94, train_loss: 0.7688, test_loss: 1.0481, test_f1: 0.5700
 epoch: 95, train_loss: 0.7544, test_loss: 1.0182, test_f1: 0.5588
 epoch: 96, train_loss: 0.7623, test_loss: 1.0255, test_f1: 0.5689
 epoch: 97, train_loss: 0.7662, test_loss: 1.0206, test_f1: 0.5596
 epoch: 98, train_loss: 0.7592, test_loss: 1.0189, test_f1: 0.5686
 epoch: 99, train_loss: 0.7664, test_loss: 1.0381, test_f1: 0.5599

Training completed in 1085.33 seconds
Best F1: 0.6009 at epoch 79
Mean F1 across iterations: 0.5534  0.0387
========================FINAL RESULTS================================
FEGIN weighted F1: 0.6009  0.0387
python main.py --data ltspice_demos --representation component_pin --model FEGIN --layers 5 --hiddens 32 --batch_size 32 --lr 0.0001 --emb_size 250 --epochs 100 --save_appendix component_pin_L5_H32_BS32_LR0.0001_E250 --no_val
-----



STDERR:
  File "main.py", line 370, in <module>
    main()
  File "main.py", line 254, in main
    dataset = dataset_class(
  File "/home/philip/projects/ltspice_examples_code_repo/Circuit-Completion-Using-GNNs/component_classification_with_link_prediction_head/evaluation/FEGIN/kernel/circuit_datasets.py", line 15, in __init__
    self.data, self.slices = torch.load(self.processed_paths[0])
  File "/home/philip/.local/lib/python3.8/site-packages/torch/serialization.py", line 1040, in load
    warnings.warn(
  File "/usr/lib/python3.8/warnings.py", line 109, in _showwarnmsg
    sw(msg.message, msg.category, msg.filename, msg.lineno,
  File "main.py", line 47, in warn_with_traceback
    traceback.print_stack(file=log)
/home/philip/projects/ltspice_examples_code_repo/Circuit-Completion-Using-GNNs/component_classification_with_link_prediction_head/evaluation/FEGIN/kernel/circuit_datasets.py:15: FutureWarning: You are using `torch.load` with `weights_only=False` (the current default value), which uses the default pickle module implicitly. It is possible to construct malicious pickle data which will execute arbitrary code during unpickling (See https://github.com/pytorch/pytorch/blob/main/SECURITY.md#untrusted-models for more details). In a future release, the default value for `weights_only` will be flipped to `True`. This limits the functions that could be executed during unpickling. Arbitrary objects will no longer be allowed to be loaded via this mode unless they are explicitly allowlisted by the user via `torch.serialization.add_safe_globals`. We recommend you start setting `weights_only=True` for any use case where you don't have full control of the loaded file. Please open an issue on GitHub for any issues related to this experimental feature.
  self.data, self.slices = torch.load(self.processed_paths[0])
