STDOUT:
Results will be saved in /home/philip/projects/ltspice_examples_code_repo/Circuit-Completion-Using-GNNs/component_classification_with_link_prediction_head/evaluation/FEGIN/results/model_FEGIN_dataset_ltspice_examples
Command line input: python main.py --data ltspice_examples --representation component_net --model FEGIN --layers 2 --hiddens 128 --batch_size 256 --lr 0.001 --emb_size 250 --epochs 100 --save_appendix component_net_L2_H128_BS256_LR0.001_E250 --no_val
 is saved.
-----
ltspice_examples - FEGIN
Using 2 layers, 128 hidden units, h = 2
Loading component_net representation dataset
ENTERED
Training FEGIN on component_net representation
Train: 3558, Test: 846
##################ITERATION #0 ****************************************
 epoch: 0, train_loss: 1.2996, test_loss: 1.3034, test_f1: 0.2270
 epoch: 1, train_loss: 1.1809, test_loss: 1.2153, test_f1: 0.2690
 epoch: 2, train_loss: 1.0919, test_loss: 1.1161, test_f1: 0.4352
 epoch: 3, train_loss: 1.0113, test_loss: 1.0175, test_f1: 0.4619
 epoch: 4, train_loss: 0.9634, test_loss: 0.9941, test_f1: 0.4292
 epoch: 5, train_loss: 0.9371, test_loss: 0.9470, test_f1: 0.5335
 epoch: 6, train_loss: 0.9160, test_loss: 0.9074, test_f1: 0.5002
 epoch: 7, train_loss: 0.8883, test_loss: 0.9619, test_f1: 0.5197
 epoch: 8, train_loss: 0.8647, test_loss: 0.9681, test_f1: 0.5046
 epoch: 9, train_loss: 0.8568, test_loss: 1.0637, test_f1: 0.5034
 epoch: 10, train_loss: 0.8511, test_loss: 0.9728, test_f1: 0.5206
 epoch: 11, train_loss: 0.8398, test_loss: 0.9935, test_f1: 0.5072
 epoch: 12, train_loss: 0.8173, test_loss: 0.8996, test_f1: 0.5346
 epoch: 13, train_loss: 0.8042, test_loss: 0.9127, test_f1: 0.5526
 epoch: 14, train_loss: 0.8034, test_loss: 0.9548, test_f1: 0.5699
 epoch: 15, train_loss: 0.7882, test_loss: 1.0283, test_f1: 0.5692
 epoch: 16, train_loss: 0.7733, test_loss: 0.9662, test_f1: 0.5409
 epoch: 17, train_loss: 0.7754, test_loss: 1.0519, test_f1: 0.5043
 epoch: 18, train_loss: 0.7540, test_loss: 0.9628, test_f1: 0.5257
 epoch: 19, train_loss: 0.7321, test_loss: 0.9752, test_f1: 0.5922
 epoch: 20, train_loss: 0.7195, test_loss: 0.9680, test_f1: 0.5753
 epoch: 21, train_loss: 0.7162, test_loss: 0.9737, test_f1: 0.5581
 epoch: 22, train_loss: 0.7240, test_loss: 0.9839, test_f1: 0.5844
 epoch: 23, train_loss: 0.7223, test_loss: 0.9325, test_f1: 0.6054
 epoch: 24, train_loss: 0.7175, test_loss: 1.0218, test_f1: 0.5845
 epoch: 25, train_loss: 0.6972, test_loss: 0.9402, test_f1: 0.5897
 epoch: 26, train_loss: 0.6922, test_loss: 0.9639, test_f1: 0.5939
 epoch: 27, train_loss: 0.6753, test_loss: 0.9354, test_f1: 0.5945
 epoch: 28, train_loss: 0.6598, test_loss: 1.0325, test_f1: 0.5600
 epoch: 29, train_loss: 0.6407, test_loss: 0.9526, test_f1: 0.6007
 epoch: 30, train_loss: 0.6480, test_loss: 1.0401, test_f1: 0.5906
 epoch: 31, train_loss: 0.6350, test_loss: 0.9823, test_f1: 0.6138
 epoch: 32, train_loss: 0.6308, test_loss: 1.0231, test_f1: 0.6164
 epoch: 33, train_loss: 0.6308, test_loss: 0.9356, test_f1: 0.6208
 epoch: 34, train_loss: 0.6189, test_loss: 1.0681, test_f1: 0.5875
 epoch: 35, train_loss: 0.6026, test_loss: 0.9151, test_f1: 0.6433
 epoch: 36, train_loss: 0.5914, test_loss: 1.0409, test_f1: 0.5996
 epoch: 37, train_loss: 0.5990, test_loss: 1.1133, test_f1: 0.5989
 epoch: 38, train_loss: 0.5911, test_loss: 1.1937, test_f1: 0.5633
 epoch: 39, train_loss: 0.5787, test_loss: 1.0345, test_f1: 0.5794
 epoch: 40, train_loss: 0.5600, test_loss: 1.0827, test_f1: 0.6344
 epoch: 41, train_loss: 0.5390, test_loss: 1.0826, test_f1: 0.6068
 epoch: 42, train_loss: 0.5338, test_loss: 1.1289, test_f1: 0.5857
 epoch: 43, train_loss: 0.5248, test_loss: 1.1351, test_f1: 0.5955
 epoch: 44, train_loss: 0.5278, test_loss: 1.1482, test_f1: 0.6235
 epoch: 45, train_loss: 0.5162, test_loss: 1.1198, test_f1: 0.6231
 epoch: 46, train_loss: 0.5097, test_loss: 1.1021, test_f1: 0.6168
 epoch: 47, train_loss: 0.4850, test_loss: 1.2042, test_f1: 0.6187
 epoch: 48, train_loss: 0.5013, test_loss: 1.1729, test_f1: 0.6171
 epoch: 49, train_loss: 0.5009, test_loss: 1.1140, test_f1: 0.6327
 epoch: 50, train_loss: 0.5232, test_loss: 1.2548, test_f1: 0.6399
 epoch: 51, train_loss: 0.4651, test_loss: 1.0689, test_f1: 0.6599
 epoch: 52, train_loss: 0.4419, test_loss: 1.1517, test_f1: 0.6375
 epoch: 53, train_loss: 0.4313, test_loss: 1.2391, test_f1: 0.6411
 epoch: 54, train_loss: 0.4168, test_loss: 1.1698, test_f1: 0.6509
 epoch: 55, train_loss: 0.4047, test_loss: 1.3041, test_f1: 0.6330
 epoch: 56, train_loss: 0.4026, test_loss: 1.1690, test_f1: 0.6695
 epoch: 57, train_loss: 0.3984, test_loss: 1.1916, test_f1: 0.6463
 epoch: 58, train_loss: 0.4051, test_loss: 1.2067, test_f1: 0.6546
 epoch: 59, train_loss: 0.3824, test_loss: 1.2408, test_f1: 0.6318
 epoch: 60, train_loss: 0.3849, test_loss: 1.2851, test_f1: 0.6466
 epoch: 61, train_loss: 0.3823, test_loss: 1.3740, test_f1: 0.6381
 epoch: 62, train_loss: 0.3735, test_loss: 1.3372, test_f1: 0.6513
 epoch: 63, train_loss: 0.3583, test_loss: 1.3615, test_f1: 0.6518
 epoch: 64, train_loss: 0.3589, test_loss: 1.2963, test_f1: 0.6549
 epoch: 65, train_loss: 0.3611, test_loss: 1.3496, test_f1: 0.6416
 epoch: 66, train_loss: 0.3553, test_loss: 1.5026, test_f1: 0.6406
 epoch: 67, train_loss: 0.3523, test_loss: 1.4183, test_f1: 0.6138
 epoch: 68, train_loss: 0.3527, test_loss: 1.4774, test_f1: 0.6303
 epoch: 69, train_loss: 0.3502, test_loss: 1.3029, test_f1: 0.6255
 epoch: 70, train_loss: 0.3358, test_loss: 1.3771, test_f1: 0.6607
 epoch: 71, train_loss: 0.3315, test_loss: 1.4472, test_f1: 0.6211
 epoch: 72, train_loss: 0.3238, test_loss: 1.5444, test_f1: 0.6460
 epoch: 73, train_loss: 0.3321, test_loss: 1.4879, test_f1: 0.6485
 epoch: 74, train_loss: 0.3334, test_loss: 1.4823, test_f1: 0.6163
 epoch: 75, train_loss: 0.3258, test_loss: 1.4570, test_f1: 0.6349
 epoch: 76, train_loss: 0.3111, test_loss: 1.6158, test_f1: 0.6235
 epoch: 77, train_loss: 0.2958, test_loss: 1.5647, test_f1: 0.6249
 epoch: 78, train_loss: 0.3198, test_loss: 1.4437, test_f1: 0.6353
 epoch: 79, train_loss: 0.3203, test_loss: 1.6817, test_f1: 0.6399
 epoch: 80, train_loss: 0.3182, test_loss: 1.6684, test_f1: 0.6379
 epoch: 81, train_loss: 0.3111, test_loss: 1.6869, test_f1: 0.6270
 epoch: 82, train_loss: 0.3074, test_loss: 1.7700, test_f1: 0.6107
 epoch: 83, train_loss: 0.3080, test_loss: 1.6879, test_f1: 0.6286
 epoch: 84, train_loss: 0.3086, test_loss: 1.6270, test_f1: 0.6460
 epoch: 85, train_loss: 0.2960, test_loss: 1.6570, test_f1: 0.6446
 epoch: 86, train_loss: 0.2914, test_loss: 1.6459, test_f1: 0.6522
 epoch: 87, train_loss: 0.2868, test_loss: 1.6173, test_f1: 0.6421
 epoch: 88, train_loss: 0.2720, test_loss: 1.6358, test_f1: 0.6214
 epoch: 89, train_loss: 0.2696, test_loss: 1.6940, test_f1: 0.6539
 epoch: 90, train_loss: 0.2821, test_loss: 1.6877, test_f1: 0.6318
 epoch: 91, train_loss: 0.2794, test_loss: 1.6469, test_f1: 0.6529
 epoch: 92, train_loss: 0.2744, test_loss: 2.0563, test_f1: 0.6271
 epoch: 93, train_loss: 0.2766, test_loss: 1.6610, test_f1: 0.6548
 epoch: 94, train_loss: 0.2931, test_loss: 1.6767, test_f1: 0.6424
 epoch: 95, train_loss: 0.2719, test_loss: 1.8947, test_f1: 0.6033
 epoch: 96, train_loss: 0.2610, test_loss: 1.7218, test_f1: 0.6534
 epoch: 97, train_loss: 0.2497, test_loss: 1.7248, test_f1: 0.6364
 epoch: 98, train_loss: 0.2537, test_loss: 1.8640, test_f1: 0.6262
 epoch: 99, train_loss: 0.2470, test_loss: 1.8604, test_f1: 0.6434
##################ITERATION #1 ****************************************
 epoch: 0, train_loss: 1.2020, test_loss: 1.2544, test_f1: 0.2270
 epoch: 1, train_loss: 1.0458, test_loss: 1.1139, test_f1: 0.3491
 epoch: 2, train_loss: 0.9885, test_loss: 1.0019, test_f1: 0.4709
 epoch: 3, train_loss: 0.9462, test_loss: 0.9443, test_f1: 0.5235
 epoch: 4, train_loss: 0.9302, test_loss: 0.9546, test_f1: 0.4868
 epoch: 5, train_loss: 0.9009, test_loss: 0.9884, test_f1: 0.5124
 epoch: 6, train_loss: 0.8684, test_loss: 1.0750, test_f1: 0.5008
 epoch: 7, train_loss: 0.8679, test_loss: 0.9481, test_f1: 0.5426
 epoch: 8, train_loss: 0.8403, test_loss: 0.9370, test_f1: 0.5102
 epoch: 9, train_loss: 0.8359, test_loss: 1.0775, test_f1: 0.4962
 epoch: 10, train_loss: 0.8113, test_loss: 0.9673, test_f1: 0.5353
 epoch: 11, train_loss: 0.8047, test_loss: 0.9256, test_f1: 0.5540
 epoch: 12, train_loss: 0.7786, test_loss: 1.0034, test_f1: 0.5830
 epoch: 13, train_loss: 0.7710, test_loss: 0.9582, test_f1: 0.5542
 epoch: 14, train_loss: 0.7521, test_loss: 0.9034, test_f1: 0.6032
 epoch: 15, train_loss: 0.7405, test_loss: 0.9586, test_f1: 0.6273
 epoch: 16, train_loss: 0.7281, test_loss: 0.9693, test_f1: 0.6182
 epoch: 17, train_loss: 0.7298, test_loss: 0.9612, test_f1: 0.6146
 epoch: 18, train_loss: 0.7091, test_loss: 1.0241, test_f1: 0.5949
 epoch: 19, train_loss: 0.6933, test_loss: 0.9356, test_f1: 0.6228
 epoch: 20, train_loss: 0.6902, test_loss: 0.9132, test_f1: 0.6221
 epoch: 21, train_loss: 0.6768, test_loss: 0.9173, test_f1: 0.6348
 epoch: 22, train_loss: 0.6611, test_loss: 0.9507, test_f1: 0.6132
 epoch: 23, train_loss: 0.6565, test_loss: 0.9581, test_f1: 0.6339
 epoch: 24, train_loss: 0.6630, test_loss: 0.9844, test_f1: 0.6339
 epoch: 25, train_loss: 0.6324, test_loss: 1.0467, test_f1: 0.6115
 epoch: 26, train_loss: 0.6294, test_loss: 1.1239, test_f1: 0.5775
 epoch: 27, train_loss: 0.6290, test_loss: 1.0028, test_f1: 0.6616
 epoch: 28, train_loss: 0.6194, test_loss: 1.0122, test_f1: 0.6317
 epoch: 29, train_loss: 0.6183, test_loss: 0.9438, test_f1: 0.6494
 epoch: 30, train_loss: 0.6069, test_loss: 1.0578, test_f1: 0.6337
 epoch: 31, train_loss: 0.5887, test_loss: 0.9705, test_f1: 0.6700
 epoch: 32, train_loss: 0.5742, test_loss: 1.0739, test_f1: 0.6227
 epoch: 33, train_loss: 0.5760, test_loss: 0.9147, test_f1: 0.6812
 epoch: 34, train_loss: 0.5588, test_loss: 0.9731, test_f1: 0.6595
 epoch: 35, train_loss: 0.5503, test_loss: 0.9941, test_f1: 0.6326
 epoch: 36, train_loss: 0.5464, test_loss: 1.0924, test_f1: 0.6398
 epoch: 37, train_loss: 0.5357, test_loss: 1.0725, test_f1: 0.6434
 epoch: 38, train_loss: 0.5537, test_loss: 1.1681, test_f1: 0.5951
 epoch: 39, train_loss: 0.5393, test_loss: 1.0782, test_f1: 0.6365
 epoch: 40, train_loss: 0.5278, test_loss: 1.2051, test_f1: 0.5936
 epoch: 41, train_loss: 0.5276, test_loss: 1.1148, test_f1: 0.6581
 epoch: 42, train_loss: 0.5052, test_loss: 1.2136, test_f1: 0.6163
 epoch: 43, train_loss: 0.5167, test_loss: 1.0216, test_f1: 0.6386
 epoch: 44, train_loss: 0.4862, test_loss: 1.1553, test_f1: 0.6441
 epoch: 45, train_loss: 0.5001, test_loss: 1.3806, test_f1: 0.6323
 epoch: 46, train_loss: 0.5179, test_loss: 1.1424, test_f1: 0.6450
 epoch: 47, train_loss: 0.5061, test_loss: 1.1333, test_f1: 0.6238
 epoch: 48, train_loss: 0.4787, test_loss: 1.0616, test_f1: 0.6866
 epoch: 49, train_loss: 0.4541, test_loss: 1.2714, test_f1: 0.6355
 epoch: 50, train_loss: 0.4370, test_loss: 1.1695, test_f1: 0.6701
 epoch: 51, train_loss: 0.4227, test_loss: 1.1725, test_f1: 0.6658
 epoch: 52, train_loss: 0.4085, test_loss: 1.2733, test_f1: 0.6518
 epoch: 53, train_loss: 0.4143, test_loss: 1.2026, test_f1: 0.6254
 epoch: 54, train_loss: 0.3905, test_loss: 1.2100, test_f1: 0.6541
 epoch: 55, train_loss: 0.3874, test_loss: 1.2293, test_f1: 0.6374
 epoch: 56, train_loss: 0.3810, test_loss: 1.2856, test_f1: 0.6562
 epoch: 57, train_loss: 0.4044, test_loss: 1.3262, test_f1: 0.6193
 epoch: 58, train_loss: 0.3799, test_loss: 1.2824, test_f1: 0.6634
 epoch: 59, train_loss: 0.3899, test_loss: 1.3461, test_f1: 0.6224
 epoch: 60, train_loss: 0.3750, test_loss: 1.2133, test_f1: 0.6676
 epoch: 61, train_loss: 0.3729, test_loss: 1.4199, test_f1: 0.6347
 epoch: 62, train_loss: 0.3642, test_loss: 1.3500, test_f1: 0.6680
 epoch: 63, train_loss: 0.3649, test_loss: 1.3723, test_f1: 0.6668
 epoch: 64, train_loss: 0.3767, test_loss: 1.4643, test_f1: 0.6544
 epoch: 65, train_loss: 0.3544, test_loss: 1.3194, test_f1: 0.6519
 epoch: 66, train_loss: 0.3413, test_loss: 1.4784, test_f1: 0.6235
 epoch: 67, train_loss: 0.3347, test_loss: 1.4352, test_f1: 0.6396
 epoch: 68, train_loss: 0.3354, test_loss: 1.4331, test_f1: 0.6469
 epoch: 69, train_loss: 0.3397, test_loss: 1.4160, test_f1: 0.6669
 epoch: 70, train_loss: 0.3290, test_loss: 1.4809, test_f1: 0.6503
 epoch: 71, train_loss: 0.3159, test_loss: 1.4820, test_f1: 0.6519
 epoch: 72, train_loss: 0.3253, test_loss: 1.4421, test_f1: 0.6557
 epoch: 73, train_loss: 0.3048, test_loss: 1.5622, test_f1: 0.6261
 epoch: 74, train_loss: 0.3273, test_loss: 1.4419, test_f1: 0.6698
 epoch: 75, train_loss: 0.3257, test_loss: 1.5304, test_f1: 0.6507
 epoch: 76, train_loss: 0.3125, test_loss: 1.5024, test_f1: 0.6447
 epoch: 77, train_loss: 0.3130, test_loss: 1.6058, test_f1: 0.6437
 epoch: 78, train_loss: 0.3066, test_loss: 1.4845, test_f1: 0.6545
 epoch: 79, train_loss: 0.3013, test_loss: 1.6761, test_f1: 0.6412
 epoch: 80, train_loss: 0.2837, test_loss: 1.6228, test_f1: 0.6197
 epoch: 81, train_loss: 0.2932, test_loss: 1.5762, test_f1: 0.6339
 epoch: 82, train_loss: 0.2991, test_loss: 1.5134, test_f1: 0.6505
 epoch: 83, train_loss: 0.2915, test_loss: 1.6322, test_f1: 0.6349
 epoch: 84, train_loss: 0.2836, test_loss: 1.6549, test_f1: 0.6423
 epoch: 85, train_loss: 0.2877, test_loss: 1.5671, test_f1: 0.6541
 epoch: 86, train_loss: 0.2832, test_loss: 1.6717, test_f1: 0.6478
 epoch: 87, train_loss: 0.2761, test_loss: 1.5673, test_f1: 0.6426
 epoch: 88, train_loss: 0.2775, test_loss: 1.6948, test_f1: 0.6402
 epoch: 89, train_loss: 0.2782, test_loss: 1.6308, test_f1: 0.6598
 epoch: 90, train_loss: 0.2752, test_loss: 1.6766, test_f1: 0.6459
 epoch: 91, train_loss: 0.2759, test_loss: 1.8239, test_f1: 0.6416
 epoch: 92, train_loss: 0.2734, test_loss: 1.6275, test_f1: 0.6590
 epoch: 93, train_loss: 0.2766, test_loss: 1.8667, test_f1: 0.6296
 epoch: 94, train_loss: 0.2664, test_loss: 1.7244, test_f1: 0.6624
 epoch: 95, train_loss: 0.2510, test_loss: 1.7171, test_f1: 0.6387
 epoch: 96, train_loss: 0.2569, test_loss: 1.8405, test_f1: 0.6468
 epoch: 97, train_loss: 0.2372, test_loss: 1.8091, test_f1: 0.6464
 epoch: 98, train_loss: 0.2322, test_loss: 1.8839, test_f1: 0.6392
 epoch: 99, train_loss: 0.2374, test_loss: 1.8493, test_f1: 0.6505
##################ITERATION #2 ****************************************
 epoch: 0, train_loss: 1.2562, test_loss: 1.2629, test_f1: 0.2270
 epoch: 1, train_loss: 1.0404, test_loss: 1.1136, test_f1: 0.3635
 epoch: 2, train_loss: 0.9817, test_loss: 1.0253, test_f1: 0.4211
 epoch: 3, train_loss: 0.9475, test_loss: 1.0018, test_f1: 0.4672
 epoch: 4, train_loss: 0.9271, test_loss: 0.9373, test_f1: 0.4906
 epoch: 5, train_loss: 0.8973, test_loss: 0.9736, test_f1: 0.4959
 epoch: 6, train_loss: 0.8773, test_loss: 0.9819, test_f1: 0.4852
 epoch: 7, train_loss: 0.8643, test_loss: 0.8682, test_f1: 0.5490
 epoch: 8, train_loss: 0.8334, test_loss: 0.8737, test_f1: 0.5437
 epoch: 9, train_loss: 0.8227, test_loss: 0.8709, test_f1: 0.5594
 epoch: 10, train_loss: 0.8137, test_loss: 0.8690, test_f1: 0.5524
 epoch: 11, train_loss: 0.8187, test_loss: 0.8919, test_f1: 0.5400
 epoch: 12, train_loss: 0.7859, test_loss: 0.9109, test_f1: 0.5400
 epoch: 13, train_loss: 0.7630, test_loss: 0.9180, test_f1: 0.6020
 epoch: 14, train_loss: 0.7578, test_loss: 0.8439, test_f1: 0.5842
 epoch: 15, train_loss: 0.7455, test_loss: 0.7993, test_f1: 0.6060
 epoch: 16, train_loss: 0.7358, test_loss: 0.9779, test_f1: 0.5944
 epoch: 17, train_loss: 0.7268, test_loss: 0.8340, test_f1: 0.5873
 epoch: 18, train_loss: 0.7229, test_loss: 0.9022, test_f1: 0.6223
 epoch: 19, train_loss: 0.7098, test_loss: 0.9145, test_f1: 0.5842
 epoch: 20, train_loss: 0.7025, test_loss: 0.8967, test_f1: 0.5975
 epoch: 21, train_loss: 0.6951, test_loss: 0.9646, test_f1: 0.5628
 epoch: 22, train_loss: 0.6881, test_loss: 0.8827, test_f1: 0.6337
 epoch: 23, train_loss: 0.6612, test_loss: 0.8978, test_f1: 0.6327
 epoch: 24, train_loss: 0.6680, test_loss: 0.8562, test_f1: 0.6368
 epoch: 25, train_loss: 0.6463, test_loss: 0.9281, test_f1: 0.6485
 epoch: 26, train_loss: 0.6586, test_loss: 0.9843, test_f1: 0.6014
 epoch: 27, train_loss: 0.6481, test_loss: 0.9024, test_f1: 0.6263
 epoch: 28, train_loss: 0.6378, test_loss: 1.0423, test_f1: 0.5962
 epoch: 29, train_loss: 0.6220, test_loss: 0.9541, test_f1: 0.6180
 epoch: 30, train_loss: 0.6079, test_loss: 0.8799, test_f1: 0.6458
 epoch: 31, train_loss: 0.5952, test_loss: 0.9800, test_f1: 0.6391
 epoch: 32, train_loss: 0.5921, test_loss: 1.0450, test_f1: 0.6383
 epoch: 33, train_loss: 0.5739, test_loss: 0.9793, test_f1: 0.6586
 epoch: 34, train_loss: 0.5734, test_loss: 0.8843, test_f1: 0.6531
 epoch: 35, train_loss: 0.5673, test_loss: 1.0723, test_f1: 0.6407
 epoch: 36, train_loss: 0.5600, test_loss: 0.9779, test_f1: 0.6483
 epoch: 37, train_loss: 0.5494, test_loss: 1.0018, test_f1: 0.6316
 epoch: 38, train_loss: 0.5460, test_loss: 1.0714, test_f1: 0.6431
 epoch: 39, train_loss: 0.5339, test_loss: 0.9998, test_f1: 0.6411
 epoch: 40, train_loss: 0.5142, test_loss: 1.0085, test_f1: 0.6278
 epoch: 41, train_loss: 0.5234, test_loss: 1.0206, test_f1: 0.6313
 epoch: 42, train_loss: 0.5220, test_loss: 1.1332, test_f1: 0.6168
 epoch: 43, train_loss: 0.5006, test_loss: 0.9844, test_f1: 0.6595
 epoch: 44, train_loss: 0.4966, test_loss: 1.0418, test_f1: 0.6511
 epoch: 45, train_loss: 0.4758, test_loss: 0.9984, test_f1: 0.6890
 epoch: 46, train_loss: 0.4779, test_loss: 1.1659, test_f1: 0.6444
 epoch: 47, train_loss: 0.4759, test_loss: 1.0693, test_f1: 0.6608
 epoch: 48, train_loss: 0.4614, test_loss: 1.0322, test_f1: 0.6552
 epoch: 49, train_loss: 0.4721, test_loss: 1.1824, test_f1: 0.6571
 epoch: 50, train_loss: 0.4493, test_loss: 1.1671, test_f1: 0.6155
 epoch: 51, train_loss: 0.4262, test_loss: 1.0818, test_f1: 0.7020
 epoch: 52, train_loss: 0.4034, test_loss: 1.1719, test_f1: 0.6769
 epoch: 53, train_loss: 0.4058, test_loss: 1.1226, test_f1: 0.6653
 epoch: 54, train_loss: 0.3907, test_loss: 1.1265, test_f1: 0.6584
 epoch: 55, train_loss: 0.3861, test_loss: 1.1801, test_f1: 0.6584
 epoch: 56, train_loss: 0.3821, test_loss: 1.1212, test_f1: 0.6861
 epoch: 57, train_loss: 0.3788, test_loss: 1.1028, test_f1: 0.6646
 epoch: 58, train_loss: 0.3712, test_loss: 1.3361, test_f1: 0.6293
 epoch: 59, train_loss: 0.3656, test_loss: 1.1965, test_f1: 0.6728
 epoch: 60, train_loss: 0.3689, test_loss: 1.2001, test_f1: 0.6775
 epoch: 61, train_loss: 0.3534, test_loss: 1.1548, test_f1: 0.6554
 epoch: 62, train_loss: 0.3491, test_loss: 1.3678, test_f1: 0.6526
 epoch: 63, train_loss: 0.3447, test_loss: 1.1876, test_f1: 0.6689
 epoch: 64, train_loss: 0.3593, test_loss: 1.2396, test_f1: 0.6507
 epoch: 65, train_loss: 0.3391, test_loss: 1.3656, test_f1: 0.6180
 epoch: 66, train_loss: 0.3387, test_loss: 1.4703, test_f1: 0.6526
 epoch: 67, train_loss: 0.3466, test_loss: 1.3300, test_f1: 0.6715
 epoch: 68, train_loss: 0.3244, test_loss: 1.3049, test_f1: 0.6505
 epoch: 69, train_loss: 0.3238, test_loss: 1.3170, test_f1: 0.6632
 epoch: 70, train_loss: 0.3220, test_loss: 1.2946, test_f1: 0.6519
 epoch: 71, train_loss: 0.3252, test_loss: 1.6666, test_f1: 0.5923
 epoch: 72, train_loss: 0.3237, test_loss: 1.3822, test_f1: 0.6508
 epoch: 73, train_loss: 0.3033, test_loss: 1.4009, test_f1: 0.6791
 epoch: 74, train_loss: 0.3085, test_loss: 1.4611, test_f1: 0.6745
 epoch: 75, train_loss: 0.3190, test_loss: 1.2906, test_f1: 0.6690
 epoch: 76, train_loss: 0.3048, test_loss: 1.5297, test_f1: 0.6212
 epoch: 77, train_loss: 0.2985, test_loss: 1.4286, test_f1: 0.6550
 epoch: 78, train_loss: 0.3160, test_loss: 1.4295, test_f1: 0.6653
 epoch: 79, train_loss: 0.3018, test_loss: 1.4665, test_f1: 0.6325
 epoch: 80, train_loss: 0.3005, test_loss: 1.4175, test_f1: 0.6651
 epoch: 81, train_loss: 0.2965, test_loss: 1.5693, test_f1: 0.6577
 epoch: 82, train_loss: 0.2903, test_loss: 1.5405, test_f1: 0.6338
 epoch: 83, train_loss: 0.2868, test_loss: 1.4424, test_f1: 0.6524
 epoch: 84, train_loss: 0.2933, test_loss: 1.4631, test_f1: 0.6590
 epoch: 85, train_loss: 0.2857, test_loss: 1.4475, test_f1: 0.6545
 epoch: 86, train_loss: 0.3139, test_loss: 1.4967, test_f1: 0.6464
 epoch: 87, train_loss: 0.2908, test_loss: 1.4247, test_f1: 0.6773
 epoch: 88, train_loss: 0.2774, test_loss: 1.4296, test_f1: 0.6362
 epoch: 89, train_loss: 0.2656, test_loss: 1.5601, test_f1: 0.6483
 epoch: 90, train_loss: 0.2676, test_loss: 1.4575, test_f1: 0.6602
 epoch: 91, train_loss: 0.2605, test_loss: 1.6125, test_f1: 0.6490
 epoch: 92, train_loss: 0.2571, test_loss: 1.5374, test_f1: 0.6695
 epoch: 93, train_loss: 0.2603, test_loss: 1.3990, test_f1: 0.6674
 epoch: 94, train_loss: 0.2610, test_loss: 1.7942, test_f1: 0.6470
 epoch: 95, train_loss: 0.2611, test_loss: 1.4948, test_f1: 0.6450
 epoch: 96, train_loss: 0.2533, test_loss: 1.8725, test_f1: 0.6062
 epoch: 97, train_loss: 0.2387, test_loss: 1.6275, test_f1: 0.6389
 epoch: 98, train_loss: 0.2420, test_loss: 1.5780, test_f1: 0.6507
 epoch: 99, train_loss: 0.2420, test_loss: 1.6070, test_f1: 0.6568
##################ITERATION #3 ****************************************
 epoch: 0, train_loss: 1.3661, test_loss: 1.2765, test_f1: 0.2432
 epoch: 1, train_loss: 1.0925, test_loss: 1.1641, test_f1: 0.2818
 epoch: 2, train_loss: 1.0077, test_loss: 1.0206, test_f1: 0.4250
 epoch: 3, train_loss: 0.9617, test_loss: 0.9603, test_f1: 0.5088
 epoch: 4, train_loss: 0.9230, test_loss: 0.9273, test_f1: 0.5028
 epoch: 5, train_loss: 0.9103, test_loss: 0.9242, test_f1: 0.5497
 epoch: 6, train_loss: 0.8658, test_loss: 0.9149, test_f1: 0.5461
 epoch: 7, train_loss: 0.8471, test_loss: 0.8929, test_f1: 0.5607
 epoch: 8, train_loss: 0.8369, test_loss: 0.8976, test_f1: 0.5770
 epoch: 9, train_loss: 0.8228, test_loss: 0.9150, test_f1: 0.5846
 epoch: 10, train_loss: 0.8002, test_loss: 0.8636, test_f1: 0.6202
 epoch: 11, train_loss: 0.8029, test_loss: 0.9165, test_f1: 0.5626
 epoch: 12, train_loss: 0.8024, test_loss: 0.9355, test_f1: 0.5946
 epoch: 13, train_loss: 0.7831, test_loss: 0.8844, test_f1: 0.5970
 epoch: 14, train_loss: 0.7669, test_loss: 0.9176, test_f1: 0.5936
 epoch: 15, train_loss: 0.7469, test_loss: 0.9363, test_f1: 0.5545
 epoch: 16, train_loss: 0.7441, test_loss: 0.9077, test_f1: 0.6193
 epoch: 17, train_loss: 0.7285, test_loss: 0.9712, test_f1: 0.6193
 epoch: 18, train_loss: 0.7329, test_loss: 0.9327, test_f1: 0.5967
 epoch: 19, train_loss: 0.7215, test_loss: 0.9414, test_f1: 0.5971
 epoch: 20, train_loss: 0.7189, test_loss: 0.9070, test_f1: 0.6108
 epoch: 21, train_loss: 0.6853, test_loss: 0.9183, test_f1: 0.6128
 epoch: 22, train_loss: 0.6917, test_loss: 0.9254, test_f1: 0.5894
 epoch: 23, train_loss: 0.6746, test_loss: 0.8829, test_f1: 0.6086
 epoch: 24, train_loss: 0.6790, test_loss: 0.9751, test_f1: 0.6161
 epoch: 25, train_loss: 0.6669, test_loss: 0.9602, test_f1: 0.5808
 epoch: 26, train_loss: 0.6804, test_loss: 0.9096, test_f1: 0.5777
 epoch: 27, train_loss: 0.6445, test_loss: 0.9502, test_f1: 0.6166
 epoch: 28, train_loss: 0.6422, test_loss: 0.9742, test_f1: 0.6319
 epoch: 29, train_loss: 0.6385, test_loss: 1.0415, test_f1: 0.6107
 epoch: 30, train_loss: 0.6145, test_loss: 0.9522, test_f1: 0.6299
 epoch: 31, train_loss: 0.6325, test_loss: 1.0018, test_f1: 0.6053
 epoch: 32, train_loss: 0.6067, test_loss: 0.9160, test_f1: 0.6493
 epoch: 33, train_loss: 0.5995, test_loss: 0.9129, test_f1: 0.6390
 epoch: 34, train_loss: 0.5861, test_loss: 0.9644, test_f1: 0.6230
 epoch: 35, train_loss: 0.5838, test_loss: 0.9651, test_f1: 0.6024
 epoch: 36, train_loss: 0.5803, test_loss: 0.9468, test_f1: 0.6624
 epoch: 37, train_loss: 0.5694, test_loss: 1.0031, test_f1: 0.6226
 epoch: 38, train_loss: 0.5594, test_loss: 0.9908, test_f1: 0.6160
 epoch: 39, train_loss: 0.5542, test_loss: 1.0313, test_f1: 0.6251
 epoch: 40, train_loss: 0.5515, test_loss: 1.0194, test_f1: 0.6196
 epoch: 41, train_loss: 0.5489, test_loss: 1.0519, test_f1: 0.6225
 epoch: 42, train_loss: 0.5360, test_loss: 0.9631, test_f1: 0.6698
 epoch: 43, train_loss: 0.5021, test_loss: 0.9907, test_f1: 0.6432
 epoch: 44, train_loss: 0.5244, test_loss: 1.0839, test_f1: 0.6092
 epoch: 45, train_loss: 0.5283, test_loss: 1.0821, test_f1: 0.6159
 epoch: 46, train_loss: 0.4985, test_loss: 0.9933, test_f1: 0.6755
 epoch: 47, train_loss: 0.4856, test_loss: 1.0116, test_f1: 0.6875
 epoch: 48, train_loss: 0.4969, test_loss: 1.0229, test_f1: 0.6858
 epoch: 49, train_loss: 0.4831, test_loss: 1.0301, test_f1: 0.6881
 epoch: 50, train_loss: 0.4721, test_loss: 0.9898, test_f1: 0.6693
 epoch: 51, train_loss: 0.4551, test_loss: 1.0983, test_f1: 0.6597
 epoch: 52, train_loss: 0.4239, test_loss: 1.0488, test_f1: 0.6662
 epoch: 53, train_loss: 0.4287, test_loss: 1.0322, test_f1: 0.6625
 epoch: 54, train_loss: 0.4190, test_loss: 1.0234, test_f1: 0.6916
 epoch: 55, train_loss: 0.4156, test_loss: 1.0458, test_f1: 0.6563
 epoch: 56, train_loss: 0.4172, test_loss: 1.0344, test_f1: 0.6781
 epoch: 57, train_loss: 0.4093, test_loss: 1.1120, test_f1: 0.6730
 epoch: 58, train_loss: 0.3927, test_loss: 1.0566, test_f1: 0.6603
 epoch: 59, train_loss: 0.3889, test_loss: 1.1215, test_f1: 0.6720
 epoch: 60, train_loss: 0.4066, test_loss: 1.1352, test_f1: 0.6677
 epoch: 61, train_loss: 0.3920, test_loss: 1.0658, test_f1: 0.6587
 epoch: 62, train_loss: 0.3853, test_loss: 1.1096, test_f1: 0.6558
 epoch: 63, train_loss: 0.3795, test_loss: 1.0957, test_f1: 0.6759
 epoch: 64, train_loss: 0.3662, test_loss: 1.1509, test_f1: 0.6651
 epoch: 65, train_loss: 0.3705, test_loss: 1.2327, test_f1: 0.6324
 epoch: 66, train_loss: 0.3890, test_loss: 1.2135, test_f1: 0.6505
 epoch: 67, train_loss: 0.3821, test_loss: 1.1804, test_f1: 0.6694
 epoch: 68, train_loss: 0.3622, test_loss: 1.1693, test_f1: 0.6548
 epoch: 69, train_loss: 0.3477, test_loss: 1.1896, test_f1: 0.6641
 epoch: 70, train_loss: 0.3498, test_loss: 1.2279, test_f1: 0.6497
 epoch: 71, train_loss: 0.3513, test_loss: 1.1870, test_f1: 0.6796
 epoch: 72, train_loss: 0.3467, test_loss: 1.2339, test_f1: 0.6723
 epoch: 73, train_loss: 0.3499, test_loss: 1.2562, test_f1: 0.6624
 epoch: 74, train_loss: 0.3470, test_loss: 1.2794, test_f1: 0.6646
 epoch: 75, train_loss: 0.3528, test_loss: 1.2298, test_f1: 0.6422
 epoch: 76, train_loss: 0.3293, test_loss: 1.2856, test_f1: 0.6681
 epoch: 77, train_loss: 0.3153, test_loss: 1.2519, test_f1: 0.6510
 epoch: 78, train_loss: 0.3285, test_loss: 1.2201, test_f1: 0.6808
 epoch: 79, train_loss: 0.3288, test_loss: 1.2547, test_f1: 0.6543
 epoch: 80, train_loss: 0.3322, test_loss: 1.2926, test_f1: 0.6510
 epoch: 81, train_loss: 0.3160, test_loss: 1.3095, test_f1: 0.6610
 epoch: 82, train_loss: 0.3386, test_loss: 1.2707, test_f1: 0.6550
 epoch: 83, train_loss: 0.3117, test_loss: 1.4152, test_f1: 0.6357
 epoch: 84, train_loss: 0.3021, test_loss: 1.3265, test_f1: 0.6862
 epoch: 85, train_loss: 0.2996, test_loss: 1.2783, test_f1: 0.6595
 epoch: 86, train_loss: 0.2974, test_loss: 1.3459, test_f1: 0.6711
 epoch: 87, train_loss: 0.2955, test_loss: 1.4050, test_f1: 0.6701
 epoch: 88, train_loss: 0.3000, test_loss: 1.3975, test_f1: 0.6679
 epoch: 89, train_loss: 0.2882, test_loss: 1.3943, test_f1: 0.6641
 epoch: 90, train_loss: 0.3040, test_loss: 1.4557, test_f1: 0.6399
 epoch: 91, train_loss: 0.3200, test_loss: 1.4349, test_f1: 0.6710
 epoch: 92, train_loss: 0.2855, test_loss: 1.3274, test_f1: 0.6431
 epoch: 93, train_loss: 0.2918, test_loss: 1.3918, test_f1: 0.6563
 epoch: 94, train_loss: 0.3011, test_loss: 1.5313, test_f1: 0.6675
 epoch: 95, train_loss: 0.2874, test_loss: 1.3468, test_f1: 0.6564
 epoch: 96, train_loss: 0.2969, test_loss: 1.4696, test_f1: 0.6456
 epoch: 97, train_loss: 0.2985, test_loss: 1.4743, test_f1: 0.6482
 epoch: 98, train_loss: 0.2892, test_loss: 1.5053, test_f1: 0.6558
 epoch: 99, train_loss: 0.2770, test_loss: 1.4697, test_f1: 0.6635
##################ITERATION #4 ****************************************
 epoch: 0, train_loss: 1.4542, test_loss: 1.3363, test_f1: 0.2270
 epoch: 1, train_loss: 1.1065, test_loss: 1.2434, test_f1: 0.2354
 epoch: 2, train_loss: 1.0168, test_loss: 1.0483, test_f1: 0.3974
 epoch: 3, train_loss: 0.9468, test_loss: 0.9444, test_f1: 0.4804
 epoch: 4, train_loss: 0.9269, test_loss: 0.9576, test_f1: 0.4940
 epoch: 5, train_loss: 0.9119, test_loss: 0.9305, test_f1: 0.5232
 epoch: 6, train_loss: 0.8710, test_loss: 0.8549, test_f1: 0.5384
 epoch: 7, train_loss: 0.8632, test_loss: 0.8679, test_f1: 0.5293
 epoch: 8, train_loss: 0.8421, test_loss: 0.8932, test_f1: 0.5445
 epoch: 9, train_loss: 0.8359, test_loss: 0.8974, test_f1: 0.5627
 epoch: 10, train_loss: 0.8260, test_loss: 0.8654, test_f1: 0.5763
 epoch: 11, train_loss: 0.8082, test_loss: 0.9128, test_f1: 0.5610
 epoch: 12, train_loss: 0.7897, test_loss: 0.8863, test_f1: 0.5845
 epoch: 13, train_loss: 0.7754, test_loss: 0.8875, test_f1: 0.5808
 epoch: 14, train_loss: 0.7565, test_loss: 0.9139, test_f1: 0.5927
 epoch: 15, train_loss: 0.7692, test_loss: 0.9456, test_f1: 0.5748
 epoch: 16, train_loss: 0.7596, test_loss: 0.8552, test_f1: 0.6066
 epoch: 17, train_loss: 0.7236, test_loss: 0.9136, test_f1: 0.5861
 epoch: 18, train_loss: 0.7277, test_loss: 0.8271, test_f1: 0.6316
 epoch: 19, train_loss: 0.7080, test_loss: 0.9175, test_f1: 0.5837
 epoch: 20, train_loss: 0.7047, test_loss: 0.9071, test_f1: 0.6276
 epoch: 21, train_loss: 0.7024, test_loss: 0.8362, test_f1: 0.6258
 epoch: 22, train_loss: 0.7021, test_loss: 0.9622, test_f1: 0.5999
 epoch: 23, train_loss: 0.6909, test_loss: 0.9142, test_f1: 0.6349
 epoch: 24, train_loss: 0.6756, test_loss: 0.8980, test_f1: 0.6309
 epoch: 25, train_loss: 0.6729, test_loss: 0.9085, test_f1: 0.6490
 epoch: 26, train_loss: 0.6449, test_loss: 0.9493, test_f1: 0.6356
 epoch: 27, train_loss: 0.6443, test_loss: 0.8670, test_f1: 0.6211
 epoch: 28, train_loss: 0.6462, test_loss: 0.9762, test_f1: 0.6252
 epoch: 29, train_loss: 0.6372, test_loss: 0.8749, test_f1: 0.6297
 epoch: 30, train_loss: 0.6207, test_loss: 0.9244, test_f1: 0.6429
 epoch: 31, train_loss: 0.6107, test_loss: 0.8900, test_f1: 0.6249
 epoch: 32, train_loss: 0.6290, test_loss: 1.0057, test_f1: 0.6290
 epoch: 33, train_loss: 0.6077, test_loss: 0.9137, test_f1: 0.6306
 epoch: 34, train_loss: 0.6020, test_loss: 0.9978, test_f1: 0.6335
 epoch: 35, train_loss: 0.5967, test_loss: 0.9253, test_f1: 0.6363
 epoch: 36, train_loss: 0.5889, test_loss: 1.0287, test_f1: 0.6485
 epoch: 37, train_loss: 0.5729, test_loss: 0.9172, test_f1: 0.6282
 epoch: 38, train_loss: 0.5556, test_loss: 0.9459, test_f1: 0.6574
 epoch: 39, train_loss: 0.5547, test_loss: 1.0131, test_f1: 0.6298
 epoch: 40, train_loss: 0.5566, test_loss: 1.0072, test_f1: 0.6467
 epoch: 41, train_loss: 0.5478, test_loss: 0.9951, test_f1: 0.6454
 epoch: 42, train_loss: 0.5709, test_loss: 1.0023, test_f1: 0.6130
 epoch: 43, train_loss: 0.5405, test_loss: 0.9822, test_f1: 0.6535
 epoch: 44, train_loss: 0.5307, test_loss: 0.9779, test_f1: 0.6738
 epoch: 45, train_loss: 0.5168, test_loss: 1.0029, test_f1: 0.6570
 epoch: 46, train_loss: 0.4978, test_loss: 0.9865, test_f1: 0.6577
 epoch: 47, train_loss: 0.5092, test_loss: 1.0344, test_f1: 0.6882
 epoch: 48, train_loss: 0.5008, test_loss: 1.1368, test_f1: 0.6242
 epoch: 49, train_loss: 0.4930, test_loss: 1.0706, test_f1: 0.6346
 epoch: 50, train_loss: 0.4903, test_loss: 1.0809, test_f1: 0.6497
 epoch: 51, train_loss: 0.4656, test_loss: 1.0307, test_f1: 0.6680
 epoch: 52, train_loss: 0.4472, test_loss: 1.1229, test_f1: 0.6475
 epoch: 53, train_loss: 0.4311, test_loss: 1.0421, test_f1: 0.6873
 epoch: 54, train_loss: 0.4156, test_loss: 1.0778, test_f1: 0.6633
 epoch: 55, train_loss: 0.4224, test_loss: 1.0768, test_f1: 0.6855
 epoch: 56, train_loss: 0.4148, test_loss: 1.1328, test_f1: 0.6787
 epoch: 57, train_loss: 0.3954, test_loss: 1.1296, test_f1: 0.6629
 epoch: 58, train_loss: 0.4025, test_loss: 1.1533, test_f1: 0.6836
 epoch: 59, train_loss: 0.3962, test_loss: 1.1683, test_f1: 0.6513
 epoch: 60, train_loss: 0.3939, test_loss: 1.0969, test_f1: 0.6774
 epoch: 61, train_loss: 0.3899, test_loss: 1.1821, test_f1: 0.6652
 epoch: 62, train_loss: 0.3924, test_loss: 1.1730, test_f1: 0.6802
 epoch: 63, train_loss: 0.3736, test_loss: 1.1719, test_f1: 0.6653
 epoch: 64, train_loss: 0.3855, test_loss: 1.2596, test_f1: 0.6455
 epoch: 65, train_loss: 0.3828, test_loss: 1.1504, test_f1: 0.6829
 epoch: 66, train_loss: 0.3904, test_loss: 1.2381, test_f1: 0.6609
 epoch: 67, train_loss: 0.3691, test_loss: 1.2153, test_f1: 0.6659
 epoch: 68, train_loss: 0.3581, test_loss: 1.2008, test_f1: 0.6646
 epoch: 69, train_loss: 0.3613, test_loss: 1.1765, test_f1: 0.6689
 epoch: 70, train_loss: 0.3555, test_loss: 1.2485, test_f1: 0.6553
 epoch: 71, train_loss: 0.3579, test_loss: 1.3782, test_f1: 0.6744
 epoch: 72, train_loss: 0.3555, test_loss: 1.2151, test_f1: 0.6584
 epoch: 73, train_loss: 0.3645, test_loss: 1.2396, test_f1: 0.6635
 epoch: 74, train_loss: 0.3426, test_loss: 1.2585, test_f1: 0.6569
 epoch: 75, train_loss: 0.3365, test_loss: 1.2541, test_f1: 0.6694
 epoch: 76, train_loss: 0.3396, test_loss: 1.2234, test_f1: 0.6825
 epoch: 77, train_loss: 0.3300, test_loss: 1.3205, test_f1: 0.6573
 epoch: 78, train_loss: 0.3301, test_loss: 1.3653, test_f1: 0.6507
 epoch: 79, train_loss: 0.3192, test_loss: 1.2464, test_f1: 0.6777
 epoch: 80, train_loss: 0.3025, test_loss: 1.3930, test_f1: 0.6683
 epoch: 81, train_loss: 0.3218, test_loss: 1.3429, test_f1: 0.6307
 epoch: 82, train_loss: 0.3306, test_loss: 1.3398, test_f1: 0.6636
 epoch: 83, train_loss: 0.3241, test_loss: 1.2910, test_f1: 0.6739
 epoch: 84, train_loss: 0.3172, test_loss: 1.3712, test_f1: 0.6594
 epoch: 85, train_loss: 0.3240, test_loss: 1.3700, test_f1: 0.6527
 epoch: 86, train_loss: 0.2993, test_loss: 1.3905, test_f1: 0.6928
 epoch: 87, train_loss: 0.3154, test_loss: 1.3928, test_f1: 0.6665
 epoch: 88, train_loss: 0.2954, test_loss: 1.3916, test_f1: 0.6638
 epoch: 89, train_loss: 0.2950, test_loss: 1.3738, test_f1: 0.6633
 epoch: 90, train_loss: 0.2885, test_loss: 1.4249, test_f1: 0.6719
 epoch: 91, train_loss: 0.3125, test_loss: 1.4760, test_f1: 0.6766
 epoch: 92, train_loss: 0.2990, test_loss: 1.4102, test_f1: 0.6716
 epoch: 93, train_loss: 0.2929, test_loss: 1.3493, test_f1: 0.6529
 epoch: 94, train_loss: 0.2990, test_loss: 1.4115, test_f1: 0.6713
 epoch: 95, train_loss: 0.2841, test_loss: 1.5544, test_f1: 0.6578
 epoch: 96, train_loss: 0.2852, test_loss: 1.5481, test_f1: 0.6410
 epoch: 97, train_loss: 0.2808, test_loss: 1.4639, test_f1: 0.6736
 epoch: 98, train_loss: 0.2738, test_loss: 1.4549, test_f1: 0.6624
 epoch: 99, train_loss: 0.2914, test_loss: 1.4621, test_f1: 0.6781
##################ITERATION #5 ****************************************
 epoch: 0, train_loss: 1.8856, test_loss: 1.4757, test_f1: 0.2270
 epoch: 1, train_loss: 1.1669, test_loss: 1.2891, test_f1: 0.3462
 epoch: 2, train_loss: 1.0499, test_loss: 1.0853, test_f1: 0.3506
 epoch: 3, train_loss: 0.9670, test_loss: 1.0055, test_f1: 0.4298
 epoch: 4, train_loss: 0.9424, test_loss: 0.9573, test_f1: 0.4632
 epoch: 5, train_loss: 0.9204, test_loss: 0.9221, test_f1: 0.5054
 epoch: 6, train_loss: 0.9007, test_loss: 0.9135, test_f1: 0.4940
 epoch: 7, train_loss: 0.8697, test_loss: 0.8922, test_f1: 0.5276
 epoch: 8, train_loss: 0.8687, test_loss: 0.8740, test_f1: 0.5658
 epoch: 9, train_loss: 0.8435, test_loss: 0.9059, test_f1: 0.5455
 epoch: 10, train_loss: 0.8386, test_loss: 0.9168, test_f1: 0.5541
 epoch: 11, train_loss: 0.8363, test_loss: 0.9032, test_f1: 0.5844
 epoch: 12, train_loss: 0.8168, test_loss: 0.9462, test_f1: 0.5613
 epoch: 13, train_loss: 0.7983, test_loss: 0.8980, test_f1: 0.5694
 epoch: 14, train_loss: 0.7994, test_loss: 0.9032, test_f1: 0.5853
 epoch: 15, train_loss: 0.7956, test_loss: 0.8798, test_f1: 0.6272
 epoch: 16, train_loss: 0.7726, test_loss: 0.8901, test_f1: 0.6125
 epoch: 17, train_loss: 0.7455, test_loss: 0.8691, test_f1: 0.6149
 epoch: 18, train_loss: 0.7517, test_loss: 0.8463, test_f1: 0.5725
 epoch: 19, train_loss: 0.7458, test_loss: 0.9114, test_f1: 0.5936
 epoch: 20, train_loss: 0.7333, test_loss: 0.9523, test_f1: 0.5543
 epoch: 21, train_loss: 0.7306, test_loss: 0.8816, test_f1: 0.6624
 epoch: 22, train_loss: 0.7118, test_loss: 0.8953, test_f1: 0.6223
 epoch: 23, train_loss: 0.7086, test_loss: 0.8872, test_f1: 0.6231
 epoch: 24, train_loss: 0.6918, test_loss: 0.8689, test_f1: 0.6401
 epoch: 25, train_loss: 0.6932, test_loss: 0.9773, test_f1: 0.5755
 epoch: 26, train_loss: 0.6918, test_loss: 0.8811, test_f1: 0.6036
 epoch: 27, train_loss: 0.6882, test_loss: 0.8977, test_f1: 0.6243
 epoch: 28, train_loss: 0.6792, test_loss: 1.0026, test_f1: 0.5633
 epoch: 29, train_loss: 0.6727, test_loss: 0.9029, test_f1: 0.6686
 epoch: 30, train_loss: 0.6610, test_loss: 0.8962, test_f1: 0.6208
 epoch: 31, train_loss: 0.6421, test_loss: 0.9477, test_f1: 0.6550
 epoch: 32, train_loss: 0.6277, test_loss: 0.8756, test_f1: 0.6617
 epoch: 33, train_loss: 0.6178, test_loss: 0.9511, test_f1: 0.5900
 epoch: 34, train_loss: 0.6217, test_loss: 0.9066, test_f1: 0.6732
 epoch: 35, train_loss: 0.6155, test_loss: 0.9499, test_f1: 0.6257
 epoch: 36, train_loss: 0.6173, test_loss: 0.9237, test_f1: 0.6268
 epoch: 37, train_loss: 0.5929, test_loss: 0.9014, test_f1: 0.6383
 epoch: 38, train_loss: 0.5822, test_loss: 0.8736, test_f1: 0.6416
 epoch: 39, train_loss: 0.5986, test_loss: 0.9405, test_f1: 0.6779
 epoch: 40, train_loss: 0.5972, test_loss: 0.9289, test_f1: 0.6528
 epoch: 41, train_loss: 0.5814, test_loss: 0.8792, test_f1: 0.6367
 epoch: 42, train_loss: 0.5834, test_loss: 1.0130, test_f1: 0.5937
 epoch: 43, train_loss: 0.5565, test_loss: 0.9623, test_f1: 0.6571
 epoch: 44, train_loss: 0.5524, test_loss: 0.9013, test_f1: 0.6426
 epoch: 45, train_loss: 0.5477, test_loss: 0.9232, test_f1: 0.6578
 epoch: 46, train_loss: 0.5521, test_loss: 0.9814, test_f1: 0.6345
 epoch: 47, train_loss: 0.5340, test_loss: 0.9902, test_f1: 0.6261
 epoch: 48, train_loss: 0.5191, test_loss: 0.9866, test_f1: 0.6535
 epoch: 49, train_loss: 0.5255, test_loss: 0.9566, test_f1: 0.6748
 epoch: 50, train_loss: 0.5172, test_loss: 1.1202, test_f1: 0.6115
 epoch: 51, train_loss: 0.5009, test_loss: 0.9302, test_f1: 0.6887
 epoch: 52, train_loss: 0.4636, test_loss: 0.9610, test_f1: 0.6838
 epoch: 53, train_loss: 0.4543, test_loss: 1.0403, test_f1: 0.6474
 epoch: 54, train_loss: 0.4663, test_loss: 0.9605, test_f1: 0.6747
 epoch: 55, train_loss: 0.4459, test_loss: 0.9853, test_f1: 0.6795
 epoch: 56, train_loss: 0.4542, test_loss: 0.9581, test_f1: 0.6818
 epoch: 57, train_loss: 0.4464, test_loss: 0.9503, test_f1: 0.6990
 epoch: 58, train_loss: 0.4523, test_loss: 1.0947, test_f1: 0.6800
 epoch: 59, train_loss: 0.4412, test_loss: 1.0363, test_f1: 0.6249
 epoch: 60, train_loss: 0.4308, test_loss: 1.0049, test_f1: 0.6677
 epoch: 61, train_loss: 0.4305, test_loss: 0.9810, test_f1: 0.6900
 epoch: 62, train_loss: 0.4353, test_loss: 1.0215, test_f1: 0.6627
 epoch: 63, train_loss: 0.4378, test_loss: 1.0056, test_f1: 0.6867
 epoch: 64, train_loss: 0.4231, test_loss: 1.0226, test_f1: 0.6731
 epoch: 65, train_loss: 0.4205, test_loss: 1.1045, test_f1: 0.6476
 epoch: 66, train_loss: 0.3925, test_loss: 1.0082, test_f1: 0.6703
 epoch: 67, train_loss: 0.4102, test_loss: 1.0565, test_f1: 0.6736
 epoch: 68, train_loss: 0.4021, test_loss: 1.1160, test_f1: 0.6603
 epoch: 69, train_loss: 0.3978, test_loss: 1.0608, test_f1: 0.6844
 epoch: 70, train_loss: 0.3973, test_loss: 1.1871, test_f1: 0.6636
 epoch: 71, train_loss: 0.3876, test_loss: 1.0246, test_f1: 0.6735
 epoch: 72, train_loss: 0.3983, test_loss: 1.1130, test_f1: 0.6748
 epoch: 73, train_loss: 0.3973, test_loss: 1.0489, test_f1: 0.6966
 epoch: 74, train_loss: 0.3665, test_loss: 1.0904, test_f1: 0.6962
 epoch: 75, train_loss: 0.3851, test_loss: 1.1452, test_f1: 0.6677
 epoch: 76, train_loss: 0.3864, test_loss: 1.2316, test_f1: 0.6623
 epoch: 77, train_loss: 0.3800, test_loss: 1.0931, test_f1: 0.6613
 epoch: 78, train_loss: 0.3972, test_loss: 1.1504, test_f1: 0.6740
 epoch: 79, train_loss: 0.3715, test_loss: 1.0930, test_f1: 0.6848
 epoch: 80, train_loss: 0.3684, test_loss: 1.1649, test_f1: 0.6543
 epoch: 81, train_loss: 0.3692, test_loss: 1.2056, test_f1: 0.6704
 epoch: 82, train_loss: 0.3647, test_loss: 1.1467, test_f1: 0.6675
 epoch: 83, train_loss: 0.3689, test_loss: 1.2501, test_f1: 0.6795
 epoch: 84, train_loss: 0.3580, test_loss: 1.2031, test_f1: 0.6503
 epoch: 85, train_loss: 0.3612, test_loss: 1.1451, test_f1: 0.6588
 epoch: 86, train_loss: 0.3625, test_loss: 1.2383, test_f1: 0.6928
 epoch: 87, train_loss: 0.3658, test_loss: 1.2311, test_f1: 0.6648
 epoch: 88, train_loss: 0.3603, test_loss: 1.2518, test_f1: 0.6775
 epoch: 89, train_loss: 0.3458, test_loss: 1.3038, test_f1: 0.6602
 epoch: 90, train_loss: 0.3476, test_loss: 1.1911, test_f1: 0.6568
 epoch: 91, train_loss: 0.3391, test_loss: 1.2062, test_f1: 0.6592
 epoch: 92, train_loss: 0.3332, test_loss: 1.1252, test_f1: 0.6855
 epoch: 93, train_loss: 0.3216, test_loss: 1.1952, test_f1: 0.6707
 epoch: 94, train_loss: 0.3172, test_loss: 1.1909, test_f1: 0.6916
 epoch: 95, train_loss: 0.3219, test_loss: 1.2343, test_f1: 0.6735
 epoch: 96, train_loss: 0.3191, test_loss: 1.2405, test_f1: 0.6560
 epoch: 97, train_loss: 0.3269, test_loss: 1.2548, test_f1: 0.6732
 epoch: 98, train_loss: 0.3212, test_loss: 1.3169, test_f1: 0.6473
 epoch: 99, train_loss: 0.3051, test_loss: 1.3528, test_f1: 0.6613
##################ITERATION #6 ****************************************
 epoch: 0, train_loss: 1.6622, test_loss: 1.2668, test_f1: 0.2421
 epoch: 1, train_loss: 1.0723, test_loss: 1.0876, test_f1: 0.3623
 epoch: 2, train_loss: 0.9947, test_loss: 0.9777, test_f1: 0.4197
 epoch: 3, train_loss: 0.9629, test_loss: 0.9564, test_f1: 0.4643
 epoch: 4, train_loss: 0.9242, test_loss: 0.9191, test_f1: 0.4898
 epoch: 5, train_loss: 0.9033, test_loss: 0.9287, test_f1: 0.5221
 epoch: 6, train_loss: 0.8959, test_loss: 0.8874, test_f1: 0.5440
 epoch: 7, train_loss: 0.8916, test_loss: 0.9124, test_f1: 0.5401
 epoch: 8, train_loss: 0.8690, test_loss: 0.9143, test_f1: 0.5664
 epoch: 9, train_loss: 0.8482, test_loss: 0.9094, test_f1: 0.5609
 epoch: 10, train_loss: 0.8272, test_loss: 0.8955, test_f1: 0.5471
 epoch: 11, train_loss: 0.8186, test_loss: 0.9436, test_f1: 0.5564
 epoch: 12, train_loss: 0.8127, test_loss: 0.8929, test_f1: 0.5341
 epoch: 13, train_loss: 0.8005, test_loss: 0.9146, test_f1: 0.5490
 epoch: 14, train_loss: 0.7866, test_loss: 0.9276, test_f1: 0.5694
 epoch: 15, train_loss: 0.7801, test_loss: 0.9025, test_f1: 0.5900
 epoch: 16, train_loss: 0.7714, test_loss: 0.9461, test_f1: 0.5389
 epoch: 17, train_loss: 0.7549, test_loss: 0.9282, test_f1: 0.5449
 epoch: 18, train_loss: 0.7255, test_loss: 0.8916, test_f1: 0.6055
 epoch: 19, train_loss: 0.7357, test_loss: 0.8967, test_f1: 0.5711
 epoch: 20, train_loss: 0.7314, test_loss: 0.9379, test_f1: 0.5847
 epoch: 21, train_loss: 0.7263, test_loss: 0.9027, test_f1: 0.5872
 epoch: 22, train_loss: 0.7179, test_loss: 0.9527, test_f1: 0.5791
 epoch: 23, train_loss: 0.7013, test_loss: 0.9193, test_f1: 0.5372
 epoch: 24, train_loss: 0.6904, test_loss: 0.9177, test_f1: 0.5707
 epoch: 25, train_loss: 0.6763, test_loss: 0.9171, test_f1: 0.6020
 epoch: 26, train_loss: 0.6779, test_loss: 0.8984, test_f1: 0.5900
 epoch: 27, train_loss: 0.6643, test_loss: 0.9479, test_f1: 0.6129
 epoch: 28, train_loss: 0.6616, test_loss: 0.9409, test_f1: 0.5727
 epoch: 29, train_loss: 0.6431, test_loss: 0.9489, test_f1: 0.5841
 epoch: 30, train_loss: 0.6337, test_loss: 0.9333, test_f1: 0.6076
 epoch: 31, train_loss: 0.6437, test_loss: 0.9683, test_f1: 0.6050
 epoch: 32, train_loss: 0.6238, test_loss: 0.9533, test_f1: 0.5906
 epoch: 33, train_loss: 0.6008, test_loss: 1.0758, test_f1: 0.5653
 epoch: 34, train_loss: 0.6053, test_loss: 0.9100, test_f1: 0.6039
 epoch: 35, train_loss: 0.5927, test_loss: 1.0572, test_f1: 0.5806
 epoch: 36, train_loss: 0.5942, test_loss: 1.0160, test_f1: 0.6310
 epoch: 37, train_loss: 0.5910, test_loss: 0.9470, test_f1: 0.6123
 epoch: 38, train_loss: 0.5800, test_loss: 1.0476, test_f1: 0.5820
 epoch: 39, train_loss: 0.5626, test_loss: 0.9609, test_f1: 0.6309
 epoch: 40, train_loss: 0.5449, test_loss: 1.0069, test_f1: 0.6133
 epoch: 41, train_loss: 0.5621, test_loss: 1.1327, test_f1: 0.5632
 epoch: 42, train_loss: 0.5487, test_loss: 1.0429, test_f1: 0.6317
 epoch: 43, train_loss: 0.5528, test_loss: 0.9956, test_f1: 0.6504
 epoch: 44, train_loss: 0.5424, test_loss: 1.0653, test_f1: 0.6114
 epoch: 45, train_loss: 0.5144, test_loss: 1.0365, test_f1: 0.6214
 epoch: 46, train_loss: 0.5226, test_loss: 1.0523, test_f1: 0.6321
 epoch: 47, train_loss: 0.5075, test_loss: 1.0375, test_f1: 0.6342
 epoch: 48, train_loss: 0.5271, test_loss: 1.2165, test_f1: 0.5940
 epoch: 49, train_loss: 0.5157, test_loss: 1.1063, test_f1: 0.6331
 epoch: 50, train_loss: 0.4919, test_loss: 1.1853, test_f1: 0.6301
 epoch: 51, train_loss: 0.4686, test_loss: 1.1057, test_f1: 0.6205
 epoch: 52, train_loss: 0.4405, test_loss: 1.0564, test_f1: 0.6474
 epoch: 53, train_loss: 0.4223, test_loss: 1.0788, test_f1: 0.6306
 epoch: 54, train_loss: 0.4036, test_loss: 1.2055, test_f1: 0.6161
 epoch: 55, train_loss: 0.4240, test_loss: 1.1593, test_f1: 0.6506
 epoch: 56, train_loss: 0.4009, test_loss: 1.1466, test_f1: 0.6480
 epoch: 57, train_loss: 0.4029, test_loss: 1.2154, test_f1: 0.6627
 epoch: 58, train_loss: 0.4066, test_loss: 1.1921, test_f1: 0.6379
 epoch: 59, train_loss: 0.4057, test_loss: 1.2681, test_f1: 0.6363
 epoch: 60, train_loss: 0.4037, test_loss: 1.1413, test_f1: 0.6389
 epoch: 61, train_loss: 0.4024, test_loss: 1.2582, test_f1: 0.6358
 epoch: 62, train_loss: 0.3940, test_loss: 1.2762, test_f1: 0.6323
 epoch: 63, train_loss: 0.3706, test_loss: 1.2642, test_f1: 0.6353
 epoch: 64, train_loss: 0.3739, test_loss: 1.4304, test_f1: 0.6284
 epoch: 65, train_loss: 0.3738, test_loss: 1.2287, test_f1: 0.6215
 epoch: 66, train_loss: 0.3723, test_loss: 1.2894, test_f1: 0.6285
 epoch: 67, train_loss: 0.3631, test_loss: 1.2946, test_f1: 0.6438
 epoch: 68, train_loss: 0.3641, test_loss: 1.3633, test_f1: 0.6152
 epoch: 69, train_loss: 0.3581, test_loss: 1.3804, test_f1: 0.6369
 epoch: 70, train_loss: 0.3561, test_loss: 1.3673, test_f1: 0.6400
 epoch: 71, train_loss: 0.3727, test_loss: 1.2918, test_f1: 0.6227
 epoch: 72, train_loss: 0.3582, test_loss: 1.4171, test_f1: 0.6178
 epoch: 73, train_loss: 0.3606, test_loss: 1.3985, test_f1: 0.6199
 epoch: 74, train_loss: 0.3611, test_loss: 1.3813, test_f1: 0.6160
 epoch: 75, train_loss: 0.3684, test_loss: 1.5332, test_f1: 0.6039
 epoch: 76, train_loss: 0.3448, test_loss: 1.2903, test_f1: 0.6347
 epoch: 77, train_loss: 0.3555, test_loss: 1.4550, test_f1: 0.6090
 epoch: 78, train_loss: 0.3368, test_loss: 1.4951, test_f1: 0.6219
 epoch: 79, train_loss: 0.3288, test_loss: 1.4845, test_f1: 0.6137
 epoch: 80, train_loss: 0.3510, test_loss: 1.3194, test_f1: 0.6189
 epoch: 81, train_loss: 0.3375, test_loss: 1.5255, test_f1: 0.5994
 epoch: 82, train_loss: 0.3361, test_loss: 1.4244, test_f1: 0.6351
 epoch: 83, train_loss: 0.3534, test_loss: 1.4358, test_f1: 0.5978
 epoch: 84, train_loss: 0.3270, test_loss: 1.5821, test_f1: 0.6306
 epoch: 85, train_loss: 0.3223, test_loss: 1.5223, test_f1: 0.6178
 epoch: 86, train_loss: 0.3312, test_loss: 1.4550, test_f1: 0.6436
 epoch: 87, train_loss: 0.3361, test_loss: 1.4445, test_f1: 0.6413
 epoch: 88, train_loss: 0.3060, test_loss: 1.5059, test_f1: 0.6334
 epoch: 89, train_loss: 0.3172, test_loss: 1.5412, test_f1: 0.6284
 epoch: 90, train_loss: 0.3186, test_loss: 1.5316, test_f1: 0.6175
 epoch: 91, train_loss: 0.3234, test_loss: 1.4779, test_f1: 0.6222
 epoch: 92, train_loss: 0.3059, test_loss: 1.5023, test_f1: 0.6449
 epoch: 93, train_loss: 0.2942, test_loss: 1.5913, test_f1: 0.6298
 epoch: 94, train_loss: 0.2950, test_loss: 1.6040, test_f1: 0.6135
 epoch: 95, train_loss: 0.2858, test_loss: 1.5958, test_f1: 0.6146
 epoch: 96, train_loss: 0.2928, test_loss: 1.6206, test_f1: 0.6409
 epoch: 97, train_loss: 0.3064, test_loss: 1.6313, test_f1: 0.6364
 epoch: 98, train_loss: 0.3019, test_loss: 1.6204, test_f1: 0.5945
 epoch: 99, train_loss: 0.2910, test_loss: 1.5835, test_f1: 0.6090
##################ITERATION #7 ****************************************
 epoch: 0, train_loss: 1.6647, test_loss: 1.5092, test_f1: 0.2497
 epoch: 1, train_loss: 1.1269, test_loss: 1.2668, test_f1: 0.2622
 epoch: 2, train_loss: 1.0114, test_loss: 1.0201, test_f1: 0.4290
 epoch: 3, train_loss: 0.9888, test_loss: 0.9443, test_f1: 0.4760
 epoch: 4, train_loss: 0.9423, test_loss: 0.9385, test_f1: 0.4843
 epoch: 5, train_loss: 0.9098, test_loss: 0.9369, test_f1: 0.5015
 epoch: 6, train_loss: 0.8937, test_loss: 0.9039, test_f1: 0.5346
 epoch: 7, train_loss: 0.8838, test_loss: 0.9403, test_f1: 0.5353
 epoch: 8, train_loss: 0.8576, test_loss: 0.8584, test_f1: 0.5446
 epoch: 9, train_loss: 0.8519, test_loss: 0.8528, test_f1: 0.5725
 epoch: 10, train_loss: 0.8338, test_loss: 0.9349, test_f1: 0.5473
 epoch: 11, train_loss: 0.8134, test_loss: 0.8734, test_f1: 0.5610
 epoch: 12, train_loss: 0.8120, test_loss: 0.9034, test_f1: 0.5595
 epoch: 13, train_loss: 0.7923, test_loss: 0.9371, test_f1: 0.5501
 epoch: 14, train_loss: 0.7968, test_loss: 0.9040, test_f1: 0.5586
 epoch: 15, train_loss: 0.7844, test_loss: 0.9043, test_f1: 0.5746
 epoch: 16, train_loss: 0.7594, test_loss: 0.8368, test_f1: 0.5935
 epoch: 17, train_loss: 0.7498, test_loss: 0.9276, test_f1: 0.5717
 epoch: 18, train_loss: 0.7466, test_loss: 0.8766, test_f1: 0.5978
 epoch: 19, train_loss: 0.7524, test_loss: 0.9541, test_f1: 0.5641
 epoch: 20, train_loss: 0.7340, test_loss: 0.8933, test_f1: 0.5672
 epoch: 21, train_loss: 0.7155, test_loss: 0.8486, test_f1: 0.5692
 epoch: 22, train_loss: 0.7155, test_loss: 0.9801, test_f1: 0.5594
 epoch: 23, train_loss: 0.7112, test_loss: 0.9497, test_f1: 0.5703
 epoch: 24, train_loss: 0.7055, test_loss: 0.8679, test_f1: 0.5790
 epoch: 25, train_loss: 0.6896, test_loss: 0.9334, test_f1: 0.5888
 epoch: 26, train_loss: 0.6834, test_loss: 0.9470, test_f1: 0.5622
 epoch: 27, train_loss: 0.6808, test_loss: 0.9086, test_f1: 0.6025
 epoch: 28, train_loss: 0.6547, test_loss: 0.8773, test_f1: 0.5746
 epoch: 29, train_loss: 0.6636, test_loss: 0.8402, test_f1: 0.5708
 epoch: 30, train_loss: 0.6673, test_loss: 0.9270, test_f1: 0.5940
 epoch: 31, train_loss: 0.6467, test_loss: 0.9130, test_f1: 0.5808
 epoch: 32, train_loss: 0.6534, test_loss: 0.9589, test_f1: 0.5831
 epoch: 33, train_loss: 0.6239, test_loss: 0.9315, test_f1: 0.5962
 epoch: 34, train_loss: 0.6130, test_loss: 0.9555, test_f1: 0.5868
 epoch: 35, train_loss: 0.6135, test_loss: 1.0486, test_f1: 0.5925
 epoch: 36, train_loss: 0.6263, test_loss: 0.9952, test_f1: 0.5811
 epoch: 37, train_loss: 0.6264, test_loss: 0.9625, test_f1: 0.6076
 epoch: 38, train_loss: 0.5954, test_loss: 0.9590, test_f1: 0.6153
 epoch: 39, train_loss: 0.5986, test_loss: 1.0971, test_f1: 0.5808
 epoch: 40, train_loss: 0.5824, test_loss: 1.0314, test_f1: 0.5820
 epoch: 41, train_loss: 0.5893, test_loss: 0.9851, test_f1: 0.5907
 epoch: 42, train_loss: 0.5881, test_loss: 1.0630, test_f1: 0.5954
 epoch: 43, train_loss: 0.5808, test_loss: 0.9653, test_f1: 0.6261
 epoch: 44, train_loss: 0.5826, test_loss: 0.9546, test_f1: 0.6162
 epoch: 45, train_loss: 0.5605, test_loss: 0.9836, test_f1: 0.5865
 epoch: 46, train_loss: 0.5485, test_loss: 1.0247, test_f1: 0.6184
 epoch: 47, train_loss: 0.5367, test_loss: 0.9652, test_f1: 0.6144
 epoch: 48, train_loss: 0.5284, test_loss: 1.0058, test_f1: 0.6227
 epoch: 49, train_loss: 0.5574, test_loss: 1.0505, test_f1: 0.6064
 epoch: 50, train_loss: 0.5349, test_loss: 1.0066, test_f1: 0.5842
 epoch: 51, train_loss: 0.5088, test_loss: 1.0346, test_f1: 0.6242
 epoch: 52, train_loss: 0.5002, test_loss: 1.0952, test_f1: 0.5958
 epoch: 53, train_loss: 0.4743, test_loss: 1.0227, test_f1: 0.6304
 epoch: 54, train_loss: 0.4740, test_loss: 1.0352, test_f1: 0.6439
 epoch: 55, train_loss: 0.4750, test_loss: 1.1091, test_f1: 0.6179
 epoch: 56, train_loss: 0.4735, test_loss: 1.1171, test_f1: 0.6215
 epoch: 57, train_loss: 0.4605, test_loss: 1.0768, test_f1: 0.6562
 epoch: 58, train_loss: 0.4469, test_loss: 1.0984, test_f1: 0.6315
 epoch: 59, train_loss: 0.4435, test_loss: 1.1664, test_f1: 0.6087
 epoch: 60, train_loss: 0.4546, test_loss: 1.1287, test_f1: 0.6305
 epoch: 61, train_loss: 0.4304, test_loss: 1.0816, test_f1: 0.6468
 epoch: 62, train_loss: 0.4497, test_loss: 1.1345, test_f1: 0.6223
 epoch: 63, train_loss: 0.4247, test_loss: 1.1333, test_f1: 0.6476
 epoch: 64, train_loss: 0.4204, test_loss: 1.1546, test_f1: 0.6200
 epoch: 65, train_loss: 0.4296, test_loss: 1.1556, test_f1: 0.6021
 epoch: 66, train_loss: 0.4153, test_loss: 1.0895, test_f1: 0.6514
 epoch: 67, train_loss: 0.4188, test_loss: 1.1910, test_f1: 0.6378
 epoch: 68, train_loss: 0.4038, test_loss: 1.1889, test_f1: 0.6483
 epoch: 69, train_loss: 0.4123, test_loss: 1.2095, test_f1: 0.6281
 epoch: 70, train_loss: 0.4171, test_loss: 1.2543, test_f1: 0.6142
 epoch: 71, train_loss: 0.4030, test_loss: 1.1643, test_f1: 0.6451
 epoch: 72, train_loss: 0.4055, test_loss: 1.1869, test_f1: 0.6470
 epoch: 73, train_loss: 0.3863, test_loss: 1.1352, test_f1: 0.6797
 epoch: 74, train_loss: 0.3964, test_loss: 1.2052, test_f1: 0.6531
 epoch: 75, train_loss: 0.3753, test_loss: 1.2676, test_f1: 0.6146
 epoch: 76, train_loss: 0.3872, test_loss: 1.2108, test_f1: 0.6310
 epoch: 77, train_loss: 0.3713, test_loss: 1.3368, test_f1: 0.6341
 epoch: 78, train_loss: 0.3768, test_loss: 1.2012, test_f1: 0.6498
 epoch: 79, train_loss: 0.3811, test_loss: 1.2136, test_f1: 0.6406
 epoch: 80, train_loss: 0.3805, test_loss: 1.2522, test_f1: 0.6352
 epoch: 81, train_loss: 0.3595, test_loss: 1.2833, test_f1: 0.6321
 epoch: 82, train_loss: 0.3524, test_loss: 1.2594, test_f1: 0.6409
 epoch: 83, train_loss: 0.3534, test_loss: 1.2266, test_f1: 0.6436
 epoch: 84, train_loss: 0.3501, test_loss: 1.3626, test_f1: 0.6112
 epoch: 85, train_loss: 0.3740, test_loss: 1.2713, test_f1: 0.6327
 epoch: 86, train_loss: 0.3634, test_loss: 1.3685, test_f1: 0.6319
 epoch: 87, train_loss: 0.3622, test_loss: 1.2946, test_f1: 0.6552
 epoch: 88, train_loss: 0.3519, test_loss: 1.3175, test_f1: 0.6506
 epoch: 89, train_loss: 0.3484, test_loss: 1.3500, test_f1: 0.6565
 epoch: 90, train_loss: 0.3500, test_loss: 1.3040, test_f1: 0.6674
 epoch: 91, train_loss: 0.3294, test_loss: 1.3977, test_f1: 0.6557
 epoch: 92, train_loss: 0.3436, test_loss: 1.3916, test_f1: 0.6349
 epoch: 93, train_loss: 0.3410, test_loss: 1.3063, test_f1: 0.6607
 epoch: 94, train_loss: 0.3453, test_loss: 1.3226, test_f1: 0.6506
 epoch: 95, train_loss: 0.3361, test_loss: 1.5096, test_f1: 0.6418
 epoch: 96, train_loss: 0.3266, test_loss: 1.4928, test_f1: 0.6187
 epoch: 97, train_loss: 0.3198, test_loss: 1.4659, test_f1: 0.6552
 epoch: 98, train_loss: 0.3183, test_loss: 1.4532, test_f1: 0.6296
 epoch: 99, train_loss: 0.3330, test_loss: 1.3375, test_f1: 0.6614
##################ITERATION #8 ****************************************
 epoch: 0, train_loss: 1.9491, test_loss: 1.6157, test_f1: 0.2270
 epoch: 1, train_loss: 1.0925, test_loss: 1.3062, test_f1: 0.2392
 epoch: 2, train_loss: 1.0104, test_loss: 1.0517, test_f1: 0.3538
 epoch: 3, train_loss: 0.9667, test_loss: 0.9604, test_f1: 0.4375
 epoch: 4, train_loss: 0.9268, test_loss: 0.9570, test_f1: 0.4872
 epoch: 5, train_loss: 0.9156, test_loss: 0.9478, test_f1: 0.4988
 epoch: 6, train_loss: 0.8888, test_loss: 0.9446, test_f1: 0.4904
 epoch: 7, train_loss: 0.8648, test_loss: 0.9259, test_f1: 0.5314
 epoch: 8, train_loss: 0.8659, test_loss: 0.8782, test_f1: 0.5450
 epoch: 9, train_loss: 0.8364, test_loss: 0.9130, test_f1: 0.5251
 epoch: 10, train_loss: 0.8325, test_loss: 0.9390, test_f1: 0.5688
 epoch: 11, train_loss: 0.8303, test_loss: 0.8780, test_f1: 0.5488
 epoch: 12, train_loss: 0.8064, test_loss: 0.9213, test_f1: 0.5278
 epoch: 13, train_loss: 0.7940, test_loss: 0.9374, test_f1: 0.5490
 epoch: 14, train_loss: 0.7928, test_loss: 0.9298, test_f1: 0.5327
 epoch: 15, train_loss: 0.7738, test_loss: 0.9232, test_f1: 0.5572
 epoch: 16, train_loss: 0.7722, test_loss: 0.9330, test_f1: 0.5660
 epoch: 17, train_loss: 0.7486, test_loss: 0.9502, test_f1: 0.5483
 epoch: 18, train_loss: 0.7454, test_loss: 0.9290, test_f1: 0.6088
 epoch: 19, train_loss: 0.7392, test_loss: 0.9391, test_f1: 0.5763
 epoch: 20, train_loss: 0.7562, test_loss: 0.9510, test_f1: 0.5443
 epoch: 21, train_loss: 0.7281, test_loss: 0.8646, test_f1: 0.5904
 epoch: 22, train_loss: 0.7251, test_loss: 0.9214, test_f1: 0.5782
 epoch: 23, train_loss: 0.6950, test_loss: 0.9630, test_f1: 0.5946
 epoch: 24, train_loss: 0.6962, test_loss: 0.8885, test_f1: 0.6099
 epoch: 25, train_loss: 0.6893, test_loss: 0.8878, test_f1: 0.5894
 epoch: 26, train_loss: 0.6762, test_loss: 0.8962, test_f1: 0.5871
 epoch: 27, train_loss: 0.6852, test_loss: 0.9046, test_f1: 0.5902
 epoch: 28, train_loss: 0.6653, test_loss: 0.9474, test_f1: 0.6367
 epoch: 29, train_loss: 0.6795, test_loss: 0.9953, test_f1: 0.5580
 epoch: 30, train_loss: 0.6705, test_loss: 0.8956, test_f1: 0.5902
 epoch: 31, train_loss: 0.6426, test_loss: 0.9017, test_f1: 0.6454
 epoch: 32, train_loss: 0.6354, test_loss: 0.9610, test_f1: 0.6324
 epoch: 33, train_loss: 0.6463, test_loss: 0.9368, test_f1: 0.6336
 epoch: 34, train_loss: 0.6172, test_loss: 0.9857, test_f1: 0.5977
 epoch: 35, train_loss: 0.6196, test_loss: 1.0048, test_f1: 0.5691
 epoch: 36, train_loss: 0.5995, test_loss: 0.9778, test_f1: 0.5793
 epoch: 37, train_loss: 0.5979, test_loss: 0.9678, test_f1: 0.5802
 epoch: 38, train_loss: 0.5982, test_loss: 0.9569, test_f1: 0.5953
 epoch: 39, train_loss: 0.5804, test_loss: 0.9392, test_f1: 0.6155
 epoch: 40, train_loss: 0.5768, test_loss: 0.9472, test_f1: 0.6263
 epoch: 41, train_loss: 0.5944, test_loss: 0.9656, test_f1: 0.6349
 epoch: 42, train_loss: 0.5916, test_loss: 0.9568, test_f1: 0.6545
 epoch: 43, train_loss: 0.5761, test_loss: 1.0060, test_f1: 0.5973
 epoch: 44, train_loss: 0.5608, test_loss: 0.9880, test_f1: 0.6098
 epoch: 45, train_loss: 0.5462, test_loss: 1.0298, test_f1: 0.6401
 epoch: 46, train_loss: 0.5335, test_loss: 1.0985, test_f1: 0.6230
 epoch: 47, train_loss: 0.5506, test_loss: 1.0490, test_f1: 0.6206
 epoch: 48, train_loss: 0.5547, test_loss: 1.0072, test_f1: 0.6788
 epoch: 49, train_loss: 0.5380, test_loss: 1.0489, test_f1: 0.6289
 epoch: 50, train_loss: 0.5141, test_loss: 1.0165, test_f1: 0.6216
 epoch: 51, train_loss: 0.4891, test_loss: 1.0051, test_f1: 0.6683
 epoch: 52, train_loss: 0.4638, test_loss: 1.0819, test_f1: 0.6418
 epoch: 53, train_loss: 0.4531, test_loss: 1.0824, test_f1: 0.6552
 epoch: 54, train_loss: 0.4475, test_loss: 1.0626, test_f1: 0.6480
 epoch: 55, train_loss: 0.4388, test_loss: 1.0715, test_f1: 0.6674
 epoch: 56, train_loss: 0.4576, test_loss: 1.0714, test_f1: 0.6386
 epoch: 57, train_loss: 0.4440, test_loss: 1.1497, test_f1: 0.6566
 epoch: 58, train_loss: 0.4390, test_loss: 1.1275, test_f1: 0.6596
 epoch: 59, train_loss: 0.4206, test_loss: 1.1018, test_f1: 0.6626
 epoch: 60, train_loss: 0.4264, test_loss: 1.0833, test_f1: 0.6500
 epoch: 61, train_loss: 0.4156, test_loss: 1.1564, test_f1: 0.6443
 epoch: 62, train_loss: 0.4165, test_loss: 1.1624, test_f1: 0.6342
 epoch: 63, train_loss: 0.4146, test_loss: 1.1812, test_f1: 0.6512
 epoch: 64, train_loss: 0.4158, test_loss: 1.1284, test_f1: 0.6475
 epoch: 65, train_loss: 0.3996, test_loss: 1.1587, test_f1: 0.6435
 epoch: 66, train_loss: 0.3999, test_loss: 1.1987, test_f1: 0.6490
 epoch: 67, train_loss: 0.4054, test_loss: 1.1380, test_f1: 0.6408
 epoch: 68, train_loss: 0.4000, test_loss: 1.1483, test_f1: 0.6678
 epoch: 69, train_loss: 0.4009, test_loss: 1.1912, test_f1: 0.6355
 epoch: 70, train_loss: 0.3878, test_loss: 1.2619, test_f1: 0.6555
 epoch: 71, train_loss: 0.3765, test_loss: 1.2932, test_f1: 0.6427
 epoch: 72, train_loss: 0.3720, test_loss: 1.1899, test_f1: 0.6563
 epoch: 73, train_loss: 0.3661, test_loss: 1.3268, test_f1: 0.6569
 epoch: 74, train_loss: 0.3648, test_loss: 1.2285, test_f1: 0.6392
 epoch: 75, train_loss: 0.3715, test_loss: 1.3056, test_f1: 0.6292
 epoch: 76, train_loss: 0.3688, test_loss: 1.2690, test_f1: 0.6752
 epoch: 77, train_loss: 0.3706, test_loss: 1.2335, test_f1: 0.6643
 epoch: 78, train_loss: 0.3698, test_loss: 1.3341, test_f1: 0.6126
 epoch: 79, train_loss: 0.3380, test_loss: 1.3648, test_f1: 0.6382
 epoch: 80, train_loss: 0.3532, test_loss: 1.3273, test_f1: 0.6529
 epoch: 81, train_loss: 0.3488, test_loss: 1.4062, test_f1: 0.6237
 epoch: 82, train_loss: 0.3477, test_loss: 1.3581, test_f1: 0.6640
 epoch: 83, train_loss: 0.3540, test_loss: 1.3583, test_f1: 0.6488
 epoch: 84, train_loss: 0.3383, test_loss: 1.4120, test_f1: 0.6414
 epoch: 85, train_loss: 0.3323, test_loss: 1.3461, test_f1: 0.6650
 epoch: 86, train_loss: 0.3405, test_loss: 1.4759, test_f1: 0.6403
 epoch: 87, train_loss: 0.3366, test_loss: 1.5325, test_f1: 0.6321
 epoch: 88, train_loss: 0.3365, test_loss: 1.3947, test_f1: 0.6474
 epoch: 89, train_loss: 0.3207, test_loss: 1.4714, test_f1: 0.6418
 epoch: 90, train_loss: 0.3404, test_loss: 1.4067, test_f1: 0.6557
 epoch: 91, train_loss: 0.3340, test_loss: 1.5077, test_f1: 0.6358
 epoch: 92, train_loss: 0.3202, test_loss: 1.4918, test_f1: 0.6529
 epoch: 93, train_loss: 0.3188, test_loss: 1.4397, test_f1: 0.6537
 epoch: 94, train_loss: 0.3219, test_loss: 1.4444, test_f1: 0.6549
 epoch: 95, train_loss: 0.3214, test_loss: 1.4085, test_f1: 0.6298
 epoch: 96, train_loss: 0.3035, test_loss: 1.5292, test_f1: 0.6699
 epoch: 97, train_loss: 0.3067, test_loss: 1.5735, test_f1: 0.6275
 epoch: 98, train_loss: 0.3111, test_loss: 1.4488, test_f1: 0.6629
 epoch: 99, train_loss: 0.2923, test_loss: 1.4502, test_f1: 0.6566
##################ITERATION #9 ****************************************
 epoch: 0, train_loss: 1.7810, test_loss: 1.6341, test_f1: 0.2270
 epoch: 1, train_loss: 1.0876, test_loss: 1.1879, test_f1: 0.2817
 epoch: 2, train_loss: 1.0034, test_loss: 1.0514, test_f1: 0.3907
 epoch: 3, train_loss: 0.9459, test_loss: 1.0021, test_f1: 0.4354
 epoch: 4, train_loss: 0.9227, test_loss: 0.9499, test_f1: 0.4821
 epoch: 5, train_loss: 0.9153, test_loss: 0.9205, test_f1: 0.5050
 epoch: 6, train_loss: 0.8853, test_loss: 0.9086, test_f1: 0.5158
 epoch: 7, train_loss: 0.8756, test_loss: 0.9702, test_f1: 0.4680
 epoch: 8, train_loss: 0.8559, test_loss: 0.9059, test_f1: 0.5299
 epoch: 9, train_loss: 0.8358, test_loss: 0.8541, test_f1: 0.5507
 epoch: 10, train_loss: 0.8317, test_loss: 0.8912, test_f1: 0.5093
 epoch: 11, train_loss: 0.8205, test_loss: 0.9014, test_f1: 0.5344
 epoch: 12, train_loss: 0.8216, test_loss: 0.8663, test_f1: 0.5605
 epoch: 13, train_loss: 0.8103, test_loss: 0.8795, test_f1: 0.5476
 epoch: 14, train_loss: 0.7871, test_loss: 0.8602, test_f1: 0.5663
 epoch: 15, train_loss: 0.7574, test_loss: 0.8707, test_f1: 0.5661
 epoch: 16, train_loss: 0.7449, test_loss: 0.8574, test_f1: 0.5912
 epoch: 17, train_loss: 0.7434, test_loss: 0.8729, test_f1: 0.5749
 epoch: 18, train_loss: 0.7386, test_loss: 0.8546, test_f1: 0.5962
 epoch: 19, train_loss: 0.7224, test_loss: 0.9095, test_f1: 0.5507
 epoch: 20, train_loss: 0.7152, test_loss: 0.8958, test_f1: 0.5461
 epoch: 21, train_loss: 0.7152, test_loss: 0.8457, test_f1: 0.5764
 epoch: 22, train_loss: 0.7092, test_loss: 0.8954, test_f1: 0.6000
 epoch: 23, train_loss: 0.7025, test_loss: 0.8968, test_f1: 0.5889
 epoch: 24, train_loss: 0.6893, test_loss: 0.8218, test_f1: 0.6015
 epoch: 25, train_loss: 0.6914, test_loss: 0.9549, test_f1: 0.5612
 epoch: 26, train_loss: 0.6789, test_loss: 0.8878, test_f1: 0.6140
 epoch: 27, train_loss: 0.6782, test_loss: 0.8538, test_f1: 0.5920
 epoch: 28, train_loss: 0.6610, test_loss: 0.8604, test_f1: 0.6107
 epoch: 29, train_loss: 0.6610, test_loss: 0.8804, test_f1: 0.5676
 epoch: 30, train_loss: 0.6605, test_loss: 0.9615, test_f1: 0.5950
 epoch: 31, train_loss: 0.6475, test_loss: 0.8999, test_f1: 0.6061
 epoch: 32, train_loss: 0.6439, test_loss: 1.0707, test_f1: 0.5554
 epoch: 33, train_loss: 0.6047, test_loss: 0.9431, test_f1: 0.6240
 epoch: 34, train_loss: 0.5989, test_loss: 0.9163, test_f1: 0.5947
 epoch: 35, train_loss: 0.6096, test_loss: 0.9419, test_f1: 0.6294
 epoch: 36, train_loss: 0.6013, test_loss: 0.8834, test_f1: 0.6180
 epoch: 37, train_loss: 0.5805, test_loss: 0.9612, test_f1: 0.6200
 epoch: 38, train_loss: 0.5692, test_loss: 0.9361, test_f1: 0.6250
 epoch: 39, train_loss: 0.5629, test_loss: 0.9508, test_f1: 0.6258
 epoch: 40, train_loss: 0.5725, test_loss: 1.0411, test_f1: 0.6179
 epoch: 41, train_loss: 0.5360, test_loss: 0.9140, test_f1: 0.6398
 epoch: 42, train_loss: 0.5621, test_loss: 0.9866, test_f1: 0.5885
 epoch: 43, train_loss: 0.5391, test_loss: 0.9521, test_f1: 0.6118
 epoch: 44, train_loss: 0.5312, test_loss: 1.0125, test_f1: 0.6308
 epoch: 45, train_loss: 0.5366, test_loss: 0.9548, test_f1: 0.6518
 epoch: 46, train_loss: 0.5235, test_loss: 0.9835, test_f1: 0.6553
 epoch: 47, train_loss: 0.5227, test_loss: 0.9800, test_f1: 0.6340
 epoch: 48, train_loss: 0.5275, test_loss: 0.9618, test_f1: 0.6308
 epoch: 49, train_loss: 0.5205, test_loss: 1.0114, test_f1: 0.6197
 epoch: 50, train_loss: 0.4980, test_loss: 1.1056, test_f1: 0.6221
 epoch: 51, train_loss: 0.4787, test_loss: 0.9714, test_f1: 0.6689
 epoch: 52, train_loss: 0.4762, test_loss: 1.0372, test_f1: 0.6694
 epoch: 53, train_loss: 0.4376, test_loss: 1.0135, test_f1: 0.6852
 epoch: 54, train_loss: 0.4372, test_loss: 1.0480, test_f1: 0.6749
 epoch: 55, train_loss: 0.4457, test_loss: 1.0348, test_f1: 0.6730
 epoch: 56, train_loss: 0.4308, test_loss: 1.0342, test_f1: 0.6169
 epoch: 57, train_loss: 0.4268, test_loss: 1.0183, test_f1: 0.6116
 epoch: 58, train_loss: 0.4168, test_loss: 1.0307, test_f1: 0.6890
 epoch: 59, train_loss: 0.4256, test_loss: 1.1197, test_f1: 0.6330
 epoch: 60, train_loss: 0.4056, test_loss: 1.1153, test_f1: 0.6506
 epoch: 61, train_loss: 0.4204, test_loss: 1.0746, test_f1: 0.6592
 epoch: 62, train_loss: 0.4098, test_loss: 1.0589, test_f1: 0.6388
 epoch: 63, train_loss: 0.3933, test_loss: 1.0845, test_f1: 0.6339
 epoch: 64, train_loss: 0.4034, test_loss: 1.1024, test_f1: 0.6494
 epoch: 65, train_loss: 0.3942, test_loss: 1.1939, test_f1: 0.6388
 epoch: 66, train_loss: 0.3955, test_loss: 1.1415, test_f1: 0.6377
 epoch: 67, train_loss: 0.3765, test_loss: 1.0637, test_f1: 0.6749
 epoch: 68, train_loss: 0.4002, test_loss: 1.2121, test_f1: 0.6230
 epoch: 69, train_loss: 0.4022, test_loss: 1.1966, test_f1: 0.6438
 epoch: 70, train_loss: 0.3800, test_loss: 1.1147, test_f1: 0.6672
 epoch: 71, train_loss: 0.3875, test_loss: 1.0671, test_f1: 0.6563
 epoch: 72, train_loss: 0.3778, test_loss: 1.1350, test_f1: 0.6613
 epoch: 73, train_loss: 0.3747, test_loss: 1.2495, test_f1: 0.6048
 epoch: 74, train_loss: 0.3622, test_loss: 1.1757, test_f1: 0.6411
 epoch: 75, train_loss: 0.3767, test_loss: 1.1572, test_f1: 0.6570
 epoch: 76, train_loss: 0.3587, test_loss: 1.1766, test_f1: 0.6407
 epoch: 77, train_loss: 0.3602, test_loss: 1.2211, test_f1: 0.6423
 epoch: 78, train_loss: 0.3480, test_loss: 1.2578, test_f1: 0.6398
 epoch: 79, train_loss: 0.3647, test_loss: 1.1491, test_f1: 0.6980
 epoch: 80, train_loss: 0.3634, test_loss: 1.1583, test_f1: 0.6426
 epoch: 81, train_loss: 0.3514, test_loss: 1.2032, test_f1: 0.6480
 epoch: 82, train_loss: 0.3627, test_loss: 1.1710, test_f1: 0.6732
 epoch: 83, train_loss: 0.3498, test_loss: 1.2826, test_f1: 0.6305
 epoch: 84, train_loss: 0.3724, test_loss: 1.1626, test_f1: 0.6437
 epoch: 85, train_loss: 0.3490, test_loss: 1.2460, test_f1: 0.6303
 epoch: 86, train_loss: 0.3345, test_loss: 1.2690, test_f1: 0.6178
 epoch: 87, train_loss: 0.3435, test_loss: 1.2458, test_f1: 0.6648
 epoch: 88, train_loss: 0.3349, test_loss: 1.2598, test_f1: 0.6370
 epoch: 89, train_loss: 0.3395, test_loss: 1.2841, test_f1: 0.6737
 epoch: 90, train_loss: 0.3327, test_loss: 1.2905, test_f1: 0.6301
 epoch: 91, train_loss: 0.3242, test_loss: 1.2418, test_f1: 0.6271
 epoch: 92, train_loss: 0.3135, test_loss: 1.3050, test_f1: 0.6438
 epoch: 93, train_loss: 0.3200, test_loss: 1.3082, test_f1: 0.6217
 epoch: 94, train_loss: 0.3025, test_loss: 1.2671, test_f1: 0.6640
 epoch: 95, train_loss: 0.3109, test_loss: 1.3612, test_f1: 0.6558
 epoch: 96, train_loss: 0.3165, test_loss: 1.3251, test_f1: 0.6365
 epoch: 97, train_loss: 0.3058, test_loss: 1.2985, test_f1: 0.6339
 epoch: 98, train_loss: 0.3167, test_loss: 1.2841, test_f1: 0.6325
 epoch: 99, train_loss: 0.3018, test_loss: 1.3724, test_f1: 0.6311

Training completed in 376.15 seconds
Best F1: 0.7020 at epoch 51
Mean F1 across iterations: 0.6861  0.0125
========================FINAL RESULTS================================
FEGIN weighted F1: 0.7020  0.0125
python main.py --data ltspice_examples --representation component_net --model FEGIN --layers 2 --hiddens 128 --batch_size 256 --lr 0.001 --emb_size 250 --epochs 100 --save_appendix component_net_L2_H128_BS256_LR0.001_E250 --no_val
-----



STDERR:
  File "main.py", line 370, in <module>
    main()
  File "main.py", line 254, in main
    dataset = dataset_class(
  File "/home/philip/projects/ltspice_examples_code_repo/Circuit-Completion-Using-GNNs/component_classification_with_link_prediction_head/evaluation/FEGIN/kernel/circuit_datasets.py", line 15, in __init__
    self.data, self.slices = torch.load(self.processed_paths[0])
  File "/home/philip/.local/lib/python3.8/site-packages/torch/serialization.py", line 1040, in load
    warnings.warn(
  File "/usr/lib/python3.8/warnings.py", line 109, in _showwarnmsg
    sw(msg.message, msg.category, msg.filename, msg.lineno,
  File "main.py", line 47, in warn_with_traceback
    traceback.print_stack(file=log)
/home/philip/projects/ltspice_examples_code_repo/Circuit-Completion-Using-GNNs/component_classification_with_link_prediction_head/evaluation/FEGIN/kernel/circuit_datasets.py:15: FutureWarning: You are using `torch.load` with `weights_only=False` (the current default value), which uses the default pickle module implicitly. It is possible to construct malicious pickle data which will execute arbitrary code during unpickling (See https://github.com/pytorch/pytorch/blob/main/SECURITY.md#untrusted-models for more details). In a future release, the default value for `weights_only` will be flipped to `True`. This limits the functions that could be executed during unpickling. Arbitrary objects will no longer be allowed to be loaded via this mode unless they are explicitly allowlisted by the user via `torch.serialization.add_safe_globals`. We recommend you start setting `weights_only=True` for any use case where you don't have full control of the loaded file. Please open an issue on GitHub for any issues related to this experimental feature.
  self.data, self.slices = torch.load(self.processed_paths[0])
