STDOUT:
Results will be saved in /home/philip/projects/ltspice_examples_code_repo/Circuit-Completion-Using-GNNs/component_classification_with_link_prediction_head/evaluation/FEGIN/results/model_FEGIN_dataset_ltspice_examples
Command line input: python main.py --data ltspice_examples --representation component_pin_net --model FEGIN --layers 4 --hiddens 16 --batch_size 256 --lr 0.001 --emb_size 128 --epochs 100 --save_appendix component_pin_net_L4_H16_BS256_LR0.001_E128 --no_val
 is saved.
-----
ltspice_examples - FEGIN
Using 4 layers, 16 hidden units, h = 2
Loading component_pin_net representation dataset
ENTERED
Training FEGIN on component_pin_net representation
Train: 3558, Test: 846
##################ITERATION #0 ****************************************
 epoch: 0, train_loss: 1.4147, test_loss: 1.4126, test_f1: 0.1004
 epoch: 1, train_loss: 1.3925, test_loss: 1.3980, test_f1: 0.1004
 epoch: 2, train_loss: 1.3711, test_loss: 1.3674, test_f1: 0.1964
 epoch: 3, train_loss: 1.3431, test_loss: 1.3216, test_f1: 0.1929
 epoch: 4, train_loss: 1.3135, test_loss: 1.2790, test_f1: 0.2713
 epoch: 5, train_loss: 1.2801, test_loss: 1.2408, test_f1: 0.3212
 epoch: 6, train_loss: 1.2454, test_loss: 1.2053, test_f1: 0.2372
 epoch: 7, train_loss: 1.2132, test_loss: 1.1850, test_f1: 0.2387
 epoch: 8, train_loss: 1.1979, test_loss: 1.1649, test_f1: 0.3138
 epoch: 9, train_loss: 1.1781, test_loss: 1.1540, test_f1: 0.3219
 epoch: 10, train_loss: 1.1593, test_loss: 1.1259, test_f1: 0.3446
 epoch: 11, train_loss: 1.1427, test_loss: 1.1028, test_f1: 0.3403
 epoch: 12, train_loss: 1.1236, test_loss: 1.0767, test_f1: 0.3413
 epoch: 13, train_loss: 1.0989, test_loss: 1.0618, test_f1: 0.3446
 epoch: 14, train_loss: 1.0938, test_loss: 1.0323, test_f1: 0.3407
 epoch: 15, train_loss: 1.0612, test_loss: 1.0256, test_f1: 0.3457
 epoch: 16, train_loss: 1.0546, test_loss: 1.0141, test_f1: 0.4213
 epoch: 17, train_loss: 1.0422, test_loss: 1.0005, test_f1: 0.4254
 epoch: 18, train_loss: 1.0365, test_loss: 1.0139, test_f1: 0.4192
 epoch: 19, train_loss: 1.0200, test_loss: 0.9861, test_f1: 0.4380
 epoch: 20, train_loss: 1.0166, test_loss: 1.0175, test_f1: 0.4591
 epoch: 21, train_loss: 1.0043, test_loss: 1.0002, test_f1: 0.4470
 epoch: 22, train_loss: 0.9962, test_loss: 0.9555, test_f1: 0.4638
 epoch: 23, train_loss: 0.9897, test_loss: 0.9483, test_f1: 0.4746
 epoch: 24, train_loss: 0.9917, test_loss: 0.9638, test_f1: 0.4672
 epoch: 25, train_loss: 0.9749, test_loss: 0.9303, test_f1: 0.4941
 epoch: 26, train_loss: 0.9686, test_loss: 0.9274, test_f1: 0.5004
 epoch: 27, train_loss: 0.9681, test_loss: 0.9584, test_f1: 0.4596
 epoch: 28, train_loss: 0.9598, test_loss: 0.9282, test_f1: 0.4684
 epoch: 29, train_loss: 0.9569, test_loss: 0.9512, test_f1: 0.4803
 epoch: 30, train_loss: 0.9582, test_loss: 0.9269, test_f1: 0.4949
 epoch: 31, train_loss: 0.9490, test_loss: 0.9221, test_f1: 0.4901
 epoch: 32, train_loss: 0.9420, test_loss: 0.9226, test_f1: 0.4945
 epoch: 33, train_loss: 0.9359, test_loss: 0.9082, test_f1: 0.4924
 epoch: 34, train_loss: 0.9349, test_loss: 0.9095, test_f1: 0.4951
 epoch: 35, train_loss: 0.9362, test_loss: 0.9308, test_f1: 0.4958
 epoch: 36, train_loss: 0.9328, test_loss: 0.9242, test_f1: 0.4977
 epoch: 37, train_loss: 0.9257, test_loss: 0.9101, test_f1: 0.4841
 epoch: 38, train_loss: 0.9231, test_loss: 0.9225, test_f1: 0.4862
 epoch: 39, train_loss: 0.9079, test_loss: 0.9030, test_f1: 0.5188
 epoch: 40, train_loss: 0.9055, test_loss: 0.9024, test_f1: 0.4997
 epoch: 41, train_loss: 0.9070, test_loss: 0.8938, test_f1: 0.5224
 epoch: 42, train_loss: 0.9011, test_loss: 0.9411, test_f1: 0.5055
 epoch: 43, train_loss: 0.9064, test_loss: 0.9043, test_f1: 0.5047
 epoch: 44, train_loss: 0.8941, test_loss: 0.9132, test_f1: 0.5201
 epoch: 45, train_loss: 0.8951, test_loss: 0.8932, test_f1: 0.5211
 epoch: 46, train_loss: 0.8908, test_loss: 0.8901, test_f1: 0.5205
 epoch: 47, train_loss: 0.8926, test_loss: 0.9142, test_f1: 0.5138
 epoch: 48, train_loss: 0.8857, test_loss: 0.8965, test_f1: 0.5332
 epoch: 49, train_loss: 0.8785, test_loss: 0.9127, test_f1: 0.5198
 epoch: 50, train_loss: 0.8783, test_loss: 0.8875, test_f1: 0.5041
 epoch: 51, train_loss: 0.8695, test_loss: 0.8722, test_f1: 0.5285
 epoch: 52, train_loss: 0.8656, test_loss: 0.8824, test_f1: 0.5182
 epoch: 53, train_loss: 0.8628, test_loss: 0.8671, test_f1: 0.5394
 epoch: 54, train_loss: 0.8701, test_loss: 0.8779, test_f1: 0.5426
 epoch: 55, train_loss: 0.8678, test_loss: 0.8671, test_f1: 0.5415
 epoch: 56, train_loss: 0.8509, test_loss: 0.8948, test_f1: 0.5167
 epoch: 57, train_loss: 0.8592, test_loss: 0.8753, test_f1: 0.5188
 epoch: 58, train_loss: 0.8636, test_loss: 0.8750, test_f1: 0.5257
 epoch: 59, train_loss: 0.8524, test_loss: 0.8674, test_f1: 0.5323
 epoch: 60, train_loss: 0.8576, test_loss: 0.8917, test_f1: 0.5156
 epoch: 61, train_loss: 0.8506, test_loss: 0.8929, test_f1: 0.5390
 epoch: 62, train_loss: 0.8540, test_loss: 0.8835, test_f1: 0.5222
 epoch: 63, train_loss: 0.8493, test_loss: 0.8843, test_f1: 0.5237
 epoch: 64, train_loss: 0.8423, test_loss: 0.8783, test_f1: 0.5210
 epoch: 65, train_loss: 0.8450, test_loss: 0.9038, test_f1: 0.5187
 epoch: 66, train_loss: 0.8437, test_loss: 0.8703, test_f1: 0.5250
 epoch: 67, train_loss: 0.8437, test_loss: 0.8777, test_f1: 0.5368
 epoch: 68, train_loss: 0.8352, test_loss: 0.8765, test_f1: 0.5147
 epoch: 69, train_loss: 0.8497, test_loss: 0.8614, test_f1: 0.5334
 epoch: 70, train_loss: 0.8383, test_loss: 0.8831, test_f1: 0.5234
 epoch: 71, train_loss: 0.8423, test_loss: 0.8665, test_f1: 0.5301
 epoch: 72, train_loss: 0.8340, test_loss: 0.8773, test_f1: 0.5191
 epoch: 73, train_loss: 0.8377, test_loss: 0.8606, test_f1: 0.5339
 epoch: 74, train_loss: 0.8359, test_loss: 0.8778, test_f1: 0.5293
 epoch: 75, train_loss: 0.8316, test_loss: 0.8636, test_f1: 0.5404
 epoch: 76, train_loss: 0.8289, test_loss: 0.8569, test_f1: 0.5519
 epoch: 77, train_loss: 0.8296, test_loss: 0.8734, test_f1: 0.5344
 epoch: 78, train_loss: 0.8251, test_loss: 0.8731, test_f1: 0.5303
 epoch: 79, train_loss: 0.8181, test_loss: 0.8743, test_f1: 0.5363
 epoch: 80, train_loss: 0.8241, test_loss: 0.8718, test_f1: 0.5321
 epoch: 81, train_loss: 0.8225, test_loss: 0.8719, test_f1: 0.5281
 epoch: 82, train_loss: 0.8267, test_loss: 0.8611, test_f1: 0.5362
 epoch: 83, train_loss: 0.8220, test_loss: 0.8956, test_f1: 0.5368
 epoch: 84, train_loss: 0.8164, test_loss: 0.9030, test_f1: 0.5226
 epoch: 85, train_loss: 0.8211, test_loss: 0.8747, test_f1: 0.5419
 epoch: 86, train_loss: 0.8194, test_loss: 0.8741, test_f1: 0.5281
 epoch: 87, train_loss: 0.8267, test_loss: 0.8657, test_f1: 0.5378
 epoch: 88, train_loss: 0.8226, test_loss: 0.8732, test_f1: 0.5361
 epoch: 89, train_loss: 0.8186, test_loss: 0.8911, test_f1: 0.5230
 epoch: 90, train_loss: 0.8171, test_loss: 0.8692, test_f1: 0.5283
 epoch: 91, train_loss: 0.8143, test_loss: 0.8703, test_f1: 0.5405
 epoch: 92, train_loss: 0.8105, test_loss: 0.8893, test_f1: 0.5430
 epoch: 93, train_loss: 0.8122, test_loss: 0.8763, test_f1: 0.5523
 epoch: 94, train_loss: 0.8123, test_loss: 0.8686, test_f1: 0.5437
 epoch: 95, train_loss: 0.8062, test_loss: 0.8702, test_f1: 0.5367
 epoch: 96, train_loss: 0.8153, test_loss: 0.8869, test_f1: 0.5348
 epoch: 97, train_loss: 0.8131, test_loss: 0.8693, test_f1: 0.5432
 epoch: 98, train_loss: 0.8068, test_loss: 0.8920, test_f1: 0.5123
 epoch: 99, train_loss: 0.7993, test_loss: 0.9039, test_f1: 0.5374
##################ITERATION #1 ****************************************
 epoch: 0, train_loss: 1.3219, test_loss: 1.3335, test_f1: 0.2270
 epoch: 1, train_loss: 1.2523, test_loss: 1.3141, test_f1: 0.2270
 epoch: 2, train_loss: 1.2137, test_loss: 1.2852, test_f1: 0.2270
 epoch: 3, train_loss: 1.1695, test_loss: 1.2027, test_f1: 0.2631
 epoch: 4, train_loss: 1.1331, test_loss: 1.1160, test_f1: 0.3460
 epoch: 5, train_loss: 1.1006, test_loss: 1.0875, test_f1: 0.3469
 epoch: 6, train_loss: 1.0850, test_loss: 1.0733, test_f1: 0.3460
 epoch: 7, train_loss: 1.0666, test_loss: 1.0639, test_f1: 0.3357
 epoch: 8, train_loss: 1.0456, test_loss: 1.3028, test_f1: 0.2901
 epoch: 9, train_loss: 1.0464, test_loss: 1.0586, test_f1: 0.3563
 epoch: 10, train_loss: 1.0352, test_loss: 1.1683, test_f1: 0.3410
 epoch: 11, train_loss: 1.0305, test_loss: 1.0569, test_f1: 0.3754
 epoch: 12, train_loss: 1.0258, test_loss: 1.0443, test_f1: 0.3988
 epoch: 13, train_loss: 1.0119, test_loss: 1.0577, test_f1: 0.3994
 epoch: 14, train_loss: 1.0079, test_loss: 1.1026, test_f1: 0.4034
 epoch: 15, train_loss: 1.0025, test_loss: 1.0520, test_f1: 0.4916
 epoch: 16, train_loss: 0.9881, test_loss: 1.0381, test_f1: 0.4372
 epoch: 17, train_loss: 0.9936, test_loss: 1.0694, test_f1: 0.4270
 epoch: 18, train_loss: 0.9829, test_loss: 1.0047, test_f1: 0.4932
 epoch: 19, train_loss: 0.9743, test_loss: 1.0090, test_f1: 0.4978
 epoch: 20, train_loss: 0.9658, test_loss: 1.0064, test_f1: 0.4771
 epoch: 21, train_loss: 0.9622, test_loss: 1.0830, test_f1: 0.4699
 epoch: 22, train_loss: 0.9517, test_loss: 0.9875, test_f1: 0.5045
 epoch: 23, train_loss: 0.9479, test_loss: 0.9948, test_f1: 0.4969
 epoch: 24, train_loss: 0.9458, test_loss: 0.9860, test_f1: 0.5134
 epoch: 25, train_loss: 0.9361, test_loss: 0.9962, test_f1: 0.4936
 epoch: 26, train_loss: 0.9261, test_loss: 0.9882, test_f1: 0.5106
 epoch: 27, train_loss: 0.9289, test_loss: 1.0121, test_f1: 0.4880
 epoch: 28, train_loss: 0.9263, test_loss: 0.9985, test_f1: 0.5082
 epoch: 29, train_loss: 0.9239, test_loss: 1.0019, test_f1: 0.4993
 epoch: 30, train_loss: 0.9321, test_loss: 0.9851, test_f1: 0.5004
 epoch: 31, train_loss: 0.9192, test_loss: 0.9759, test_f1: 0.5266
 epoch: 32, train_loss: 0.9120, test_loss: 1.1446, test_f1: 0.4618
 epoch: 33, train_loss: 0.9126, test_loss: 1.0584, test_f1: 0.4637
 epoch: 34, train_loss: 0.9064, test_loss: 1.0308, test_f1: 0.4690
 epoch: 35, train_loss: 0.8983, test_loss: 0.9558, test_f1: 0.5278
 epoch: 36, train_loss: 0.8926, test_loss: 0.9897, test_f1: 0.5125
 epoch: 37, train_loss: 0.8980, test_loss: 0.9898, test_f1: 0.5193
 epoch: 38, train_loss: 0.8957, test_loss: 0.9771, test_f1: 0.5219
 epoch: 39, train_loss: 0.9006, test_loss: 1.0141, test_f1: 0.4757
 epoch: 40, train_loss: 0.8825, test_loss: 0.9860, test_f1: 0.5121
 epoch: 41, train_loss: 0.8795, test_loss: 0.9524, test_f1: 0.5283
 epoch: 42, train_loss: 0.8728, test_loss: 1.0053, test_f1: 0.4898
 epoch: 43, train_loss: 0.8751, test_loss: 0.9614, test_f1: 0.5155
 epoch: 44, train_loss: 0.8679, test_loss: 1.0640, test_f1: 0.4731
 epoch: 45, train_loss: 0.8653, test_loss: 1.1771, test_f1: 0.4683
 epoch: 46, train_loss: 0.8694, test_loss: 1.0746, test_f1: 0.4775
 epoch: 47, train_loss: 0.8708, test_loss: 0.9902, test_f1: 0.4776
 epoch: 48, train_loss: 0.8603, test_loss: 0.9968, test_f1: 0.5116
 epoch: 49, train_loss: 0.8594, test_loss: 1.1351, test_f1: 0.4514
 epoch: 50, train_loss: 0.8481, test_loss: 0.9659, test_f1: 0.5057
 epoch: 51, train_loss: 0.8521, test_loss: 0.9724, test_f1: 0.4964
 epoch: 52, train_loss: 0.8498, test_loss: 1.0131, test_f1: 0.4828
 epoch: 53, train_loss: 0.8418, test_loss: 0.9612, test_f1: 0.5401
 epoch: 54, train_loss: 0.8334, test_loss: 0.9544, test_f1: 0.5019
 epoch: 55, train_loss: 0.8395, test_loss: 0.9464, test_f1: 0.5262
 epoch: 56, train_loss: 0.8369, test_loss: 0.9493, test_f1: 0.5145
 epoch: 57, train_loss: 0.8333, test_loss: 1.0661, test_f1: 0.4811
 epoch: 58, train_loss: 0.8308, test_loss: 0.9683, test_f1: 0.5193
 epoch: 59, train_loss: 0.8260, test_loss: 0.9756, test_f1: 0.5076
 epoch: 60, train_loss: 0.8228, test_loss: 0.9485, test_f1: 0.5106
 epoch: 61, train_loss: 0.8182, test_loss: 0.9720, test_f1: 0.5246
 epoch: 62, train_loss: 0.8172, test_loss: 0.9958, test_f1: 0.5038
 epoch: 63, train_loss: 0.8291, test_loss: 0.9901, test_f1: 0.5195
 epoch: 64, train_loss: 0.8231, test_loss: 0.9661, test_f1: 0.5096
 epoch: 65, train_loss: 0.8137, test_loss: 1.0111, test_f1: 0.4981
 epoch: 66, train_loss: 0.8173, test_loss: 0.9678, test_f1: 0.5077
 epoch: 67, train_loss: 0.8096, test_loss: 0.9830, test_f1: 0.5062
 epoch: 68, train_loss: 0.8183, test_loss: 0.9909, test_f1: 0.5197
 epoch: 69, train_loss: 0.8171, test_loss: 0.9845, test_f1: 0.5007
 epoch: 70, train_loss: 0.8120, test_loss: 0.9924, test_f1: 0.5096
 epoch: 71, train_loss: 0.8120, test_loss: 0.9764, test_f1: 0.5154
 epoch: 72, train_loss: 0.8069, test_loss: 0.9730, test_f1: 0.5124
 epoch: 73, train_loss: 0.8093, test_loss: 1.0065, test_f1: 0.4922
 epoch: 74, train_loss: 0.8092, test_loss: 0.9687, test_f1: 0.5264
 epoch: 75, train_loss: 0.8133, test_loss: 0.9629, test_f1: 0.5171
 epoch: 76, train_loss: 0.8042, test_loss: 0.9737, test_f1: 0.5103
 epoch: 77, train_loss: 0.8087, test_loss: 0.9739, test_f1: 0.5126
 epoch: 78, train_loss: 0.7979, test_loss: 1.0888, test_f1: 0.4845
 epoch: 79, train_loss: 0.7983, test_loss: 1.0025, test_f1: 0.5027
 epoch: 80, train_loss: 0.8028, test_loss: 0.9701, test_f1: 0.5190
 epoch: 81, train_loss: 0.7983, test_loss: 1.0036, test_f1: 0.5110
 epoch: 82, train_loss: 0.7924, test_loss: 1.0204, test_f1: 0.5102
 epoch: 83, train_loss: 0.8024, test_loss: 1.1544, test_f1: 0.4744
 epoch: 84, train_loss: 0.7953, test_loss: 1.0059, test_f1: 0.5045
 epoch: 85, train_loss: 0.7915, test_loss: 0.9803, test_f1: 0.5163
 epoch: 86, train_loss: 0.7964, test_loss: 0.9961, test_f1: 0.5154
 epoch: 87, train_loss: 0.7874, test_loss: 1.1221, test_f1: 0.4679
 epoch: 88, train_loss: 0.8033, test_loss: 0.9769, test_f1: 0.5248
 epoch: 89, train_loss: 0.7897, test_loss: 1.0037, test_f1: 0.5307
 epoch: 90, train_loss: 0.7944, test_loss: 1.1169, test_f1: 0.4876
 epoch: 91, train_loss: 0.7959, test_loss: 1.0126, test_f1: 0.5127
 epoch: 92, train_loss: 0.7834, test_loss: 0.9777, test_f1: 0.5237
 epoch: 93, train_loss: 0.7888, test_loss: 1.0280, test_f1: 0.5003
 epoch: 94, train_loss: 0.7824, test_loss: 1.0563, test_f1: 0.4913
 epoch: 95, train_loss: 0.7717, test_loss: 1.0014, test_f1: 0.4985
 epoch: 96, train_loss: 0.7739, test_loss: 0.9709, test_f1: 0.5267
 epoch: 97, train_loss: 0.7731, test_loss: 1.0993, test_f1: 0.4914
 epoch: 98, train_loss: 0.7830, test_loss: 1.0120, test_f1: 0.5004
 epoch: 99, train_loss: 0.7749, test_loss: 0.9791, test_f1: 0.5184
##################ITERATION #2 ****************************************
 epoch: 0, train_loss: 1.2958, test_loss: 1.3201, test_f1: 0.2270
 epoch: 1, train_loss: 1.2243, test_loss: 1.3105, test_f1: 0.2270
 epoch: 2, train_loss: 1.1794, test_loss: 1.2723, test_f1: 0.2270
 epoch: 3, train_loss: 1.1418, test_loss: 1.1876, test_f1: 0.2651
 epoch: 4, train_loss: 1.1011, test_loss: 1.1186, test_f1: 0.3586
 epoch: 5, train_loss: 1.0706, test_loss: 1.0632, test_f1: 0.4018
 epoch: 6, train_loss: 1.0477, test_loss: 1.0260, test_f1: 0.4297
 epoch: 7, train_loss: 1.0257, test_loss: 1.0053, test_f1: 0.4464
 epoch: 8, train_loss: 1.0049, test_loss: 1.0239, test_f1: 0.4304
 epoch: 9, train_loss: 0.9898, test_loss: 1.0254, test_f1: 0.4240
 epoch: 10, train_loss: 0.9755, test_loss: 1.0088, test_f1: 0.4382
 epoch: 11, train_loss: 0.9745, test_loss: 0.9514, test_f1: 0.4958
 epoch: 12, train_loss: 0.9604, test_loss: 0.9469, test_f1: 0.4932
 epoch: 13, train_loss: 0.9521, test_loss: 0.9843, test_f1: 0.4643
 epoch: 14, train_loss: 0.9371, test_loss: 1.0054, test_f1: 0.4389
 epoch: 15, train_loss: 0.9327, test_loss: 0.9297, test_f1: 0.4893
 epoch: 16, train_loss: 0.9164, test_loss: 0.9426, test_f1: 0.4931
 epoch: 17, train_loss: 0.9113, test_loss: 0.9351, test_f1: 0.4966
 epoch: 18, train_loss: 0.9109, test_loss: 0.9466, test_f1: 0.4754
 epoch: 19, train_loss: 0.9118, test_loss: 0.9447, test_f1: 0.4875
 epoch: 20, train_loss: 0.9051, test_loss: 0.9722, test_f1: 0.4843
 epoch: 21, train_loss: 0.8922, test_loss: 0.9401, test_f1: 0.5016
 epoch: 22, train_loss: 0.8929, test_loss: 1.0210, test_f1: 0.4612
 epoch: 23, train_loss: 0.8946, test_loss: 1.0462, test_f1: 0.4557
 epoch: 24, train_loss: 0.9069, test_loss: 0.9944, test_f1: 0.4814
 epoch: 25, train_loss: 0.8947, test_loss: 0.9627, test_f1: 0.4927
 epoch: 26, train_loss: 0.8753, test_loss: 0.9452, test_f1: 0.5050
 epoch: 27, train_loss: 0.8657, test_loss: 0.9366, test_f1: 0.5012
 epoch: 28, train_loss: 0.8560, test_loss: 0.9340, test_f1: 0.5291
 epoch: 29, train_loss: 0.8576, test_loss: 0.9468, test_f1: 0.5072
 epoch: 30, train_loss: 0.8511, test_loss: 0.9759, test_f1: 0.5111
 epoch: 31, train_loss: 0.8497, test_loss: 0.9528, test_f1: 0.5037
 epoch: 32, train_loss: 0.8378, test_loss: 0.9324, test_f1: 0.5106
 epoch: 33, train_loss: 0.8379, test_loss: 0.9215, test_f1: 0.5216
 epoch: 34, train_loss: 0.8320, test_loss: 0.9791, test_f1: 0.5075
 epoch: 35, train_loss: 0.8525, test_loss: 0.9718, test_f1: 0.5090
 epoch: 36, train_loss: 0.8426, test_loss: 1.1336, test_f1: 0.4466
 epoch: 37, train_loss: 0.8336, test_loss: 0.9441, test_f1: 0.5115
 epoch: 38, train_loss: 0.8296, test_loss: 1.0038, test_f1: 0.4997
 epoch: 39, train_loss: 0.8361, test_loss: 0.9301, test_f1: 0.5319
 epoch: 40, train_loss: 0.8391, test_loss: 0.9457, test_f1: 0.5098
 epoch: 41, train_loss: 0.8175, test_loss: 0.9453, test_f1: 0.5193
 epoch: 42, train_loss: 0.8166, test_loss: 0.9523, test_f1: 0.5336
 epoch: 43, train_loss: 0.8127, test_loss: 0.9453, test_f1: 0.5116
 epoch: 44, train_loss: 0.8113, test_loss: 0.9296, test_f1: 0.5211
 epoch: 45, train_loss: 0.8079, test_loss: 0.9629, test_f1: 0.5326
 epoch: 46, train_loss: 0.8052, test_loss: 0.9555, test_f1: 0.5269
 epoch: 47, train_loss: 0.8059, test_loss: 0.9510, test_f1: 0.5107
 epoch: 48, train_loss: 0.8038, test_loss: 0.9813, test_f1: 0.5357
 epoch: 49, train_loss: 0.8122, test_loss: 0.9604, test_f1: 0.5159
 epoch: 50, train_loss: 0.7956, test_loss: 0.9461, test_f1: 0.5175
 epoch: 51, train_loss: 0.7865, test_loss: 0.9248, test_f1: 0.5254
 epoch: 52, train_loss: 0.7882, test_loss: 0.9501, test_f1: 0.5283
 epoch: 53, train_loss: 0.7819, test_loss: 0.9457, test_f1: 0.5278
 epoch: 54, train_loss: 0.7801, test_loss: 0.9363, test_f1: 0.5331
 epoch: 55, train_loss: 0.7779, test_loss: 0.9453, test_f1: 0.5221
 epoch: 56, train_loss: 0.7754, test_loss: 0.9413, test_f1: 0.5350
 epoch: 57, train_loss: 0.7665, test_loss: 0.9333, test_f1: 0.5368
 epoch: 58, train_loss: 0.7736, test_loss: 0.9611, test_f1: 0.5243
 epoch: 59, train_loss: 0.7698, test_loss: 0.9367, test_f1: 0.5290
 epoch: 60, train_loss: 0.7700, test_loss: 0.9390, test_f1: 0.5298
 epoch: 61, train_loss: 0.7745, test_loss: 0.9423, test_f1: 0.5387
 epoch: 62, train_loss: 0.7653, test_loss: 0.9459, test_f1: 0.5351
 epoch: 63, train_loss: 0.7629, test_loss: 0.9406, test_f1: 0.5492
 epoch: 64, train_loss: 0.7608, test_loss: 0.9446, test_f1: 0.5514
 epoch: 65, train_loss: 0.7667, test_loss: 0.9445, test_f1: 0.5357
 epoch: 66, train_loss: 0.7664, test_loss: 0.9537, test_f1: 0.5445
 epoch: 67, train_loss: 0.7625, test_loss: 0.9517, test_f1: 0.5435
 epoch: 68, train_loss: 0.7593, test_loss: 0.9576, test_f1: 0.5425
 epoch: 69, train_loss: 0.7565, test_loss: 0.9595, test_f1: 0.5340
 epoch: 70, train_loss: 0.7553, test_loss: 0.9474, test_f1: 0.5218
 epoch: 71, train_loss: 0.7543, test_loss: 0.9474, test_f1: 0.5418
 epoch: 72, train_loss: 0.7611, test_loss: 0.9725, test_f1: 0.5392
 epoch: 73, train_loss: 0.7576, test_loss: 0.9546, test_f1: 0.5377
 epoch: 74, train_loss: 0.7456, test_loss: 0.9467, test_f1: 0.5454
 epoch: 75, train_loss: 0.7532, test_loss: 0.9545, test_f1: 0.5288
 epoch: 76, train_loss: 0.7479, test_loss: 0.9553, test_f1: 0.5489
 epoch: 77, train_loss: 0.7502, test_loss: 0.9492, test_f1: 0.5397
 epoch: 78, train_loss: 0.7493, test_loss: 0.9492, test_f1: 0.5383
 epoch: 79, train_loss: 0.7381, test_loss: 0.9554, test_f1: 0.5416
 epoch: 80, train_loss: 0.7460, test_loss: 0.9597, test_f1: 0.5429
 epoch: 81, train_loss: 0.7428, test_loss: 0.9649, test_f1: 0.5349
 epoch: 82, train_loss: 0.7506, test_loss: 0.9631, test_f1: 0.5358
 epoch: 83, train_loss: 0.7386, test_loss: 0.9581, test_f1: 0.5595
 epoch: 84, train_loss: 0.7446, test_loss: 0.9584, test_f1: 0.5450
 epoch: 85, train_loss: 0.7355, test_loss: 0.9702, test_f1: 0.5388
 epoch: 86, train_loss: 0.7383, test_loss: 0.9689, test_f1: 0.5411
 epoch: 87, train_loss: 0.7404, test_loss: 0.9591, test_f1: 0.5446
 epoch: 88, train_loss: 0.7416, test_loss: 0.9461, test_f1: 0.5469
 epoch: 89, train_loss: 0.7445, test_loss: 0.9524, test_f1: 0.5490
 epoch: 90, train_loss: 0.7249, test_loss: 0.9633, test_f1: 0.5316
 epoch: 91, train_loss: 0.7283, test_loss: 0.9508, test_f1: 0.5395
 epoch: 92, train_loss: 0.7146, test_loss: 0.9621, test_f1: 0.5246
 epoch: 93, train_loss: 0.7289, test_loss: 0.9589, test_f1: 0.5375
 epoch: 94, train_loss: 0.7303, test_loss: 0.9694, test_f1: 0.5262
 epoch: 95, train_loss: 0.7216, test_loss: 0.9464, test_f1: 0.5338
 epoch: 96, train_loss: 0.7305, test_loss: 0.9621, test_f1: 0.5360
 epoch: 97, train_loss: 0.7346, test_loss: 0.9721, test_f1: 0.5348
 epoch: 98, train_loss: 0.7328, test_loss: 0.9683, test_f1: 0.5311
 epoch: 99, train_loss: 0.7250, test_loss: 0.9443, test_f1: 0.5441
##################ITERATION #3 ****************************************
 epoch: 0, train_loss: 1.2973, test_loss: 1.3416, test_f1: 0.2270
 epoch: 1, train_loss: 1.1711, test_loss: 1.3467, test_f1: 0.2270
 epoch: 2, train_loss: 1.1343, test_loss: 1.4100, test_f1: 0.2435
 epoch: 3, train_loss: 1.0976, test_loss: 1.2661, test_f1: 0.3507
 epoch: 4, train_loss: 1.0834, test_loss: 1.0479, test_f1: 0.4541
 epoch: 5, train_loss: 1.0656, test_loss: 1.0250, test_f1: 0.4473
 epoch: 6, train_loss: 1.0493, test_loss: 0.9998, test_f1: 0.4831
 epoch: 7, train_loss: 1.0420, test_loss: 0.9858, test_f1: 0.4756
 epoch: 8, train_loss: 1.0213, test_loss: 0.9890, test_f1: 0.4910
 epoch: 9, train_loss: 1.0117, test_loss: 0.9759, test_f1: 0.4885
 epoch: 10, train_loss: 0.9940, test_loss: 0.9519, test_f1: 0.5091
 epoch: 11, train_loss: 0.9963, test_loss: 0.9477, test_f1: 0.5006
 epoch: 12, train_loss: 0.9775, test_loss: 0.9445, test_f1: 0.4976
 epoch: 13, train_loss: 0.9850, test_loss: 0.9229, test_f1: 0.5252
 epoch: 14, train_loss: 0.9653, test_loss: 0.9311, test_f1: 0.5064
 epoch: 15, train_loss: 0.9630, test_loss: 0.9118, test_f1: 0.5240
 epoch: 16, train_loss: 0.9544, test_loss: 0.9105, test_f1: 0.5151
 epoch: 17, train_loss: 0.9547, test_loss: 0.9049, test_f1: 0.5317
 epoch: 18, train_loss: 0.9430, test_loss: 0.9131, test_f1: 0.5122
 epoch: 19, train_loss: 0.9365, test_loss: 0.8951, test_f1: 0.5344
 epoch: 20, train_loss: 0.9335, test_loss: 0.8997, test_f1: 0.5144
 epoch: 21, train_loss: 0.9237, test_loss: 0.8959, test_f1: 0.5216
 epoch: 22, train_loss: 0.9241, test_loss: 0.8947, test_f1: 0.5175
 epoch: 23, train_loss: 0.9228, test_loss: 0.8792, test_f1: 0.5223
 epoch: 24, train_loss: 0.9174, test_loss: 0.8867, test_f1: 0.5276
 epoch: 25, train_loss: 0.9064, test_loss: 0.8990, test_f1: 0.5438
 epoch: 26, train_loss: 0.9135, test_loss: 0.9185, test_f1: 0.5207
 epoch: 27, train_loss: 0.9017, test_loss: 0.8968, test_f1: 0.5115
 epoch: 28, train_loss: 0.8894, test_loss: 0.9250, test_f1: 0.5166
 epoch: 29, train_loss: 0.9032, test_loss: 0.8848, test_f1: 0.5342
 epoch: 30, train_loss: 0.9077, test_loss: 0.8779, test_f1: 0.5353
 epoch: 31, train_loss: 0.8920, test_loss: 0.8766, test_f1: 0.5323
 epoch: 32, train_loss: 0.8834, test_loss: 0.8729, test_f1: 0.5300
 epoch: 33, train_loss: 0.8903, test_loss: 0.9121, test_f1: 0.5358
 epoch: 34, train_loss: 0.8878, test_loss: 0.8650, test_f1: 0.5580
 epoch: 35, train_loss: 0.8832, test_loss: 0.8747, test_f1: 0.5462
 epoch: 36, train_loss: 0.8798, test_loss: 0.8751, test_f1: 0.5513
 epoch: 37, train_loss: 0.8809, test_loss: 0.8576, test_f1: 0.5626
 epoch: 38, train_loss: 0.8791, test_loss: 0.8837, test_f1: 0.5285
 epoch: 39, train_loss: 0.8848, test_loss: 0.8828, test_f1: 0.5310
 epoch: 40, train_loss: 0.8878, test_loss: 0.8856, test_f1: 0.5280
 epoch: 41, train_loss: 0.8736, test_loss: 0.8819, test_f1: 0.5411
 epoch: 42, train_loss: 0.8625, test_loss: 0.8687, test_f1: 0.5571
 epoch: 43, train_loss: 0.8794, test_loss: 0.8605, test_f1: 0.5565
 epoch: 44, train_loss: 0.8661, test_loss: 0.8917, test_f1: 0.5410
 epoch: 45, train_loss: 0.8669, test_loss: 0.8768, test_f1: 0.5373
 epoch: 46, train_loss: 0.8587, test_loss: 0.8739, test_f1: 0.5295
 epoch: 47, train_loss: 0.8630, test_loss: 0.8670, test_f1: 0.5415
 epoch: 48, train_loss: 0.8533, test_loss: 0.9138, test_f1: 0.5266
 epoch: 49, train_loss: 0.8512, test_loss: 0.8513, test_f1: 0.5605
 epoch: 50, train_loss: 0.8449, test_loss: 0.9046, test_f1: 0.5306
 epoch: 51, train_loss: 0.8455, test_loss: 0.8585, test_f1: 0.5629
 epoch: 52, train_loss: 0.8284, test_loss: 0.8581, test_f1: 0.5679
 epoch: 53, train_loss: 0.8391, test_loss: 0.8665, test_f1: 0.5657
 epoch: 54, train_loss: 0.8354, test_loss: 0.8584, test_f1: 0.5664
 epoch: 55, train_loss: 0.8287, test_loss: 0.8540, test_f1: 0.5561
 epoch: 56, train_loss: 0.8265, test_loss: 0.8537, test_f1: 0.5629
 epoch: 57, train_loss: 0.8238, test_loss: 0.8606, test_f1: 0.5628
 epoch: 58, train_loss: 0.8343, test_loss: 0.8674, test_f1: 0.5575
 epoch: 59, train_loss: 0.8245, test_loss: 0.8765, test_f1: 0.5503
 epoch: 60, train_loss: 0.8301, test_loss: 0.8631, test_f1: 0.5575
 epoch: 61, train_loss: 0.8179, test_loss: 0.8585, test_f1: 0.5629
 epoch: 62, train_loss: 0.8180, test_loss: 0.8640, test_f1: 0.5402
 epoch: 63, train_loss: 0.8163, test_loss: 0.8590, test_f1: 0.5627
 epoch: 64, train_loss: 0.8166, test_loss: 0.8653, test_f1: 0.5595
 epoch: 65, train_loss: 0.8197, test_loss: 0.8760, test_f1: 0.5487
 epoch: 66, train_loss: 0.8129, test_loss: 0.8787, test_f1: 0.5511
 epoch: 67, train_loss: 0.8125, test_loss: 0.8624, test_f1: 0.5494
 epoch: 68, train_loss: 0.8133, test_loss: 0.8922, test_f1: 0.5514
 epoch: 69, train_loss: 0.8127, test_loss: 0.8648, test_f1: 0.5599
 epoch: 70, train_loss: 0.8149, test_loss: 0.8550, test_f1: 0.5557
 epoch: 71, train_loss: 0.8078, test_loss: 0.8639, test_f1: 0.5592
 epoch: 72, train_loss: 0.8010, test_loss: 0.8603, test_f1: 0.5684
 epoch: 73, train_loss: 0.8044, test_loss: 0.8727, test_f1: 0.5508
 epoch: 74, train_loss: 0.8062, test_loss: 0.8646, test_f1: 0.5653
 epoch: 75, train_loss: 0.8054, test_loss: 0.8487, test_f1: 0.5557
 epoch: 76, train_loss: 0.8102, test_loss: 0.8701, test_f1: 0.5584
 epoch: 77, train_loss: 0.8127, test_loss: 0.8857, test_f1: 0.5634
 epoch: 78, train_loss: 0.7962, test_loss: 0.8900, test_f1: 0.5605
 epoch: 79, train_loss: 0.8073, test_loss: 0.8682, test_f1: 0.5571
 epoch: 80, train_loss: 0.7870, test_loss: 0.8814, test_f1: 0.5454
 epoch: 81, train_loss: 0.8083, test_loss: 0.8596, test_f1: 0.5571
 epoch: 82, train_loss: 0.7868, test_loss: 0.8513, test_f1: 0.5596
 epoch: 83, train_loss: 0.7992, test_loss: 0.8669, test_f1: 0.5445
 epoch: 84, train_loss: 0.7967, test_loss: 0.8731, test_f1: 0.5561
 epoch: 85, train_loss: 0.8005, test_loss: 0.8584, test_f1: 0.5625
 epoch: 86, train_loss: 0.8100, test_loss: 0.8673, test_f1: 0.5625
 epoch: 87, train_loss: 0.7985, test_loss: 0.8774, test_f1: 0.5494
 epoch: 88, train_loss: 0.7928, test_loss: 0.8585, test_f1: 0.5429
 epoch: 89, train_loss: 0.7922, test_loss: 0.8676, test_f1: 0.5605
 epoch: 90, train_loss: 0.7919, test_loss: 0.8593, test_f1: 0.5648
 epoch: 91, train_loss: 0.7826, test_loss: 0.8632, test_f1: 0.5594
 epoch: 92, train_loss: 0.7896, test_loss: 0.8758, test_f1: 0.5582
 epoch: 93, train_loss: 0.7814, test_loss: 0.8768, test_f1: 0.5760
 epoch: 94, train_loss: 0.7855, test_loss: 0.8509, test_f1: 0.5657
 epoch: 95, train_loss: 0.7931, test_loss: 0.8683, test_f1: 0.5681
 epoch: 96, train_loss: 0.7878, test_loss: 0.8650, test_f1: 0.5618
 epoch: 97, train_loss: 0.7768, test_loss: 0.8552, test_f1: 0.5570
 epoch: 98, train_loss: 0.7854, test_loss: 0.8629, test_f1: 0.5660
 epoch: 99, train_loss: 0.7778, test_loss: 0.8618, test_f1: 0.5665
##################ITERATION #4 ****************************************
 epoch: 0, train_loss: 1.3955, test_loss: 1.3968, test_f1: 0.2270
 epoch: 1, train_loss: 1.2057, test_loss: 1.3736, test_f1: 0.2270
 epoch: 2, train_loss: 1.1531, test_loss: 1.3810, test_f1: 0.2270
 epoch: 3, train_loss: 1.1181, test_loss: 1.3825, test_f1: 0.2270
 epoch: 4, train_loss: 1.0905, test_loss: 1.2504, test_f1: 0.2851
 epoch: 5, train_loss: 1.0752, test_loss: 1.0799, test_f1: 0.3589
 epoch: 6, train_loss: 1.0574, test_loss: 1.0478, test_f1: 0.4119
 epoch: 7, train_loss: 1.0510, test_loss: 1.0337, test_f1: 0.4414
 epoch: 8, train_loss: 1.0320, test_loss: 1.0245, test_f1: 0.4537
 epoch: 9, train_loss: 1.0253, test_loss: 1.0341, test_f1: 0.4343
 epoch: 10, train_loss: 1.0109, test_loss: 1.0138, test_f1: 0.4508
 epoch: 11, train_loss: 0.9999, test_loss: 1.0208, test_f1: 0.4522
 epoch: 12, train_loss: 0.9947, test_loss: 0.9811, test_f1: 0.4576
 epoch: 13, train_loss: 0.9860, test_loss: 0.9964, test_f1: 0.4465
 epoch: 14, train_loss: 0.9802, test_loss: 0.9894, test_f1: 0.4716
 epoch: 15, train_loss: 0.9778, test_loss: 1.0027, test_f1: 0.4503
 epoch: 16, train_loss: 0.9570, test_loss: 0.9714, test_f1: 0.4669
 epoch: 17, train_loss: 0.9609, test_loss: 0.9774, test_f1: 0.4758
 epoch: 18, train_loss: 0.9578, test_loss: 0.9811, test_f1: 0.4670
 epoch: 19, train_loss: 0.9505, test_loss: 0.9725, test_f1: 0.4719
 epoch: 20, train_loss: 0.9437, test_loss: 0.9344, test_f1: 0.4832
 epoch: 21, train_loss: 0.9399, test_loss: 0.9290, test_f1: 0.4882
 epoch: 22, train_loss: 0.9348, test_loss: 0.9351, test_f1: 0.5013
 epoch: 23, train_loss: 0.9320, test_loss: 0.9349, test_f1: 0.4714
 epoch: 24, train_loss: 0.9270, test_loss: 0.9351, test_f1: 0.4982
 epoch: 25, train_loss: 0.9270, test_loss: 0.9157, test_f1: 0.5155
 epoch: 26, train_loss: 0.9245, test_loss: 0.9323, test_f1: 0.4838
 epoch: 27, train_loss: 0.9206, test_loss: 0.9173, test_f1: 0.4884
 epoch: 28, train_loss: 0.9008, test_loss: 0.8957, test_f1: 0.5103
 epoch: 29, train_loss: 0.8977, test_loss: 0.9858, test_f1: 0.4914
 epoch: 30, train_loss: 0.9045, test_loss: 0.9090, test_f1: 0.5145
 epoch: 31, train_loss: 0.9013, test_loss: 0.9064, test_f1: 0.5014
 epoch: 32, train_loss: 0.8925, test_loss: 0.9208, test_f1: 0.5027
 epoch: 33, train_loss: 0.8923, test_loss: 0.9260, test_f1: 0.4883
 epoch: 34, train_loss: 0.8925, test_loss: 0.9414, test_f1: 0.4930
 epoch: 35, train_loss: 0.9002, test_loss: 0.9643, test_f1: 0.4765
 epoch: 36, train_loss: 0.8855, test_loss: 0.9154, test_f1: 0.5202
 epoch: 37, train_loss: 0.8861, test_loss: 0.9007, test_f1: 0.5247
 epoch: 38, train_loss: 0.8765, test_loss: 0.9612, test_f1: 0.4992
 epoch: 39, train_loss: 0.8815, test_loss: 0.8906, test_f1: 0.5219
 epoch: 40, train_loss: 0.8791, test_loss: 0.9233, test_f1: 0.4979
 epoch: 41, train_loss: 0.8682, test_loss: 0.9316, test_f1: 0.4872
 epoch: 42, train_loss: 0.8793, test_loss: 0.9267, test_f1: 0.5110
 epoch: 43, train_loss: 0.8655, test_loss: 0.9577, test_f1: 0.5035
 epoch: 44, train_loss: 0.8677, test_loss: 0.9289, test_f1: 0.5098
 epoch: 45, train_loss: 0.8709, test_loss: 0.9107, test_f1: 0.5162
 epoch: 46, train_loss: 0.8604, test_loss: 0.9072, test_f1: 0.5183
 epoch: 47, train_loss: 0.8574, test_loss: 0.9131, test_f1: 0.5138
 epoch: 48, train_loss: 0.8637, test_loss: 0.9339, test_f1: 0.5025
 epoch: 49, train_loss: 0.8606, test_loss: 0.9324, test_f1: 0.5175
 epoch: 50, train_loss: 0.8549, test_loss: 0.9501, test_f1: 0.5003
 epoch: 51, train_loss: 0.8554, test_loss: 0.9229, test_f1: 0.5171
 epoch: 52, train_loss: 0.8402, test_loss: 0.8990, test_f1: 0.5279
 epoch: 53, train_loss: 0.8323, test_loss: 0.9109, test_f1: 0.5199
 epoch: 54, train_loss: 0.8387, test_loss: 0.8996, test_f1: 0.5282
 epoch: 55, train_loss: 0.8378, test_loss: 0.9392, test_f1: 0.5122
 epoch: 56, train_loss: 0.8443, test_loss: 0.8944, test_f1: 0.5334
 epoch: 57, train_loss: 0.8351, test_loss: 0.9215, test_f1: 0.5286
 epoch: 58, train_loss: 0.8327, test_loss: 0.8953, test_f1: 0.5290
 epoch: 59, train_loss: 0.8395, test_loss: 0.8961, test_f1: 0.5289
 epoch: 60, train_loss: 0.8368, test_loss: 0.9131, test_f1: 0.5268
 epoch: 61, train_loss: 0.8332, test_loss: 0.8740, test_f1: 0.5445
 epoch: 62, train_loss: 0.8245, test_loss: 0.9080, test_f1: 0.5388
 epoch: 63, train_loss: 0.8304, test_loss: 0.9174, test_f1: 0.5291
 epoch: 64, train_loss: 0.8263, test_loss: 0.8924, test_f1: 0.5352
 epoch: 65, train_loss: 0.8197, test_loss: 0.9442, test_f1: 0.5141
 epoch: 66, train_loss: 0.8314, test_loss: 0.9254, test_f1: 0.5126
 epoch: 67, train_loss: 0.8229, test_loss: 0.9151, test_f1: 0.5204
 epoch: 68, train_loss: 0.8207, test_loss: 0.8844, test_f1: 0.5358
 epoch: 69, train_loss: 0.8175, test_loss: 0.9066, test_f1: 0.5297
 epoch: 70, train_loss: 0.8111, test_loss: 0.9097, test_f1: 0.5273
 epoch: 71, train_loss: 0.8007, test_loss: 0.9100, test_f1: 0.5268
 epoch: 72, train_loss: 0.8094, test_loss: 0.9278, test_f1: 0.5203
 epoch: 73, train_loss: 0.8001, test_loss: 0.9388, test_f1: 0.5315
 epoch: 74, train_loss: 0.8104, test_loss: 0.9345, test_f1: 0.5243
 epoch: 75, train_loss: 0.8100, test_loss: 0.9063, test_f1: 0.5240
 epoch: 76, train_loss: 0.7974, test_loss: 0.9319, test_f1: 0.5166
 epoch: 77, train_loss: 0.8148, test_loss: 0.9369, test_f1: 0.5253
 epoch: 78, train_loss: 0.8038, test_loss: 0.9198, test_f1: 0.5229
 epoch: 79, train_loss: 0.8060, test_loss: 0.9117, test_f1: 0.5290
 epoch: 80, train_loss: 0.8071, test_loss: 0.8983, test_f1: 0.5353
 epoch: 81, train_loss: 0.8014, test_loss: 0.9131, test_f1: 0.5256
 epoch: 82, train_loss: 0.8013, test_loss: 0.9224, test_f1: 0.5232
 epoch: 83, train_loss: 0.7981, test_loss: 0.9022, test_f1: 0.5281
 epoch: 84, train_loss: 0.8033, test_loss: 0.9334, test_f1: 0.5206
 epoch: 85, train_loss: 0.7979, test_loss: 0.9179, test_f1: 0.5230
 epoch: 86, train_loss: 0.7981, test_loss: 0.9265, test_f1: 0.5247
 epoch: 87, train_loss: 0.8009, test_loss: 0.9187, test_f1: 0.5276
 epoch: 88, train_loss: 0.7996, test_loss: 0.9087, test_f1: 0.5351
 epoch: 89, train_loss: 0.7984, test_loss: 0.9347, test_f1: 0.5229
 epoch: 90, train_loss: 0.7809, test_loss: 0.9128, test_f1: 0.5280
 epoch: 91, train_loss: 0.7975, test_loss: 0.9240, test_f1: 0.5238
 epoch: 92, train_loss: 0.7869, test_loss: 0.9319, test_f1: 0.5307
 epoch: 93, train_loss: 0.7896, test_loss: 0.9330, test_f1: 0.5215
 epoch: 94, train_loss: 0.7768, test_loss: 0.9314, test_f1: 0.5186
 epoch: 95, train_loss: 0.7871, test_loss: 0.9474, test_f1: 0.5220
 epoch: 96, train_loss: 0.7935, test_loss: 0.9483, test_f1: 0.5029
 epoch: 97, train_loss: 0.7893, test_loss: 0.9667, test_f1: 0.5191
 epoch: 98, train_loss: 0.7809, test_loss: 0.9206, test_f1: 0.5240
 epoch: 99, train_loss: 0.7765, test_loss: 0.9057, test_f1: 0.5421
##################ITERATION #5 ****************************************
 epoch: 0, train_loss: 1.2764, test_loss: 1.3516, test_f1: 0.2270
 epoch: 1, train_loss: 1.1814, test_loss: 1.3169, test_f1: 0.2270
 epoch: 2, train_loss: 1.1286, test_loss: 1.2286, test_f1: 0.3097
 epoch: 3, train_loss: 1.1027, test_loss: 1.1919, test_f1: 0.3322
 epoch: 4, train_loss: 1.0867, test_loss: 1.2202, test_f1: 0.3233
 epoch: 5, train_loss: 1.0680, test_loss: 1.1280, test_f1: 0.3659
 epoch: 6, train_loss: 1.0573, test_loss: 1.0862, test_f1: 0.3717
 epoch: 7, train_loss: 1.0396, test_loss: 1.0545, test_f1: 0.3931
 epoch: 8, train_loss: 1.0405, test_loss: 1.0738, test_f1: 0.4181
 epoch: 9, train_loss: 1.0153, test_loss: 1.0520, test_f1: 0.4226
 epoch: 10, train_loss: 1.0081, test_loss: 1.0650, test_f1: 0.4506
 epoch: 11, train_loss: 1.0076, test_loss: 1.0586, test_f1: 0.4607
 epoch: 12, train_loss: 0.9904, test_loss: 1.0460, test_f1: 0.4438
 epoch: 13, train_loss: 0.9978, test_loss: 1.0545, test_f1: 0.4554
 epoch: 14, train_loss: 0.9863, test_loss: 1.0317, test_f1: 0.4842
 epoch: 15, train_loss: 0.9738, test_loss: 1.0118, test_f1: 0.4840
 epoch: 16, train_loss: 0.9731, test_loss: 1.0545, test_f1: 0.4977
 epoch: 17, train_loss: 0.9641, test_loss: 1.0417, test_f1: 0.4604
 epoch: 18, train_loss: 0.9550, test_loss: 1.0239, test_f1: 0.4754
 epoch: 19, train_loss: 0.9544, test_loss: 0.9926, test_f1: 0.5112
 epoch: 20, train_loss: 0.9498, test_loss: 0.9840, test_f1: 0.4823
 epoch: 21, train_loss: 0.9337, test_loss: 0.9938, test_f1: 0.5175
 epoch: 22, train_loss: 0.9278, test_loss: 1.0108, test_f1: 0.4964
 epoch: 23, train_loss: 0.9300, test_loss: 0.9685, test_f1: 0.5138
 epoch: 24, train_loss: 0.9227, test_loss: 1.0856, test_f1: 0.4580
 epoch: 25, train_loss: 0.9184, test_loss: 1.0105, test_f1: 0.5114
 epoch: 26, train_loss: 0.9121, test_loss: 0.9760, test_f1: 0.4981
 epoch: 27, train_loss: 0.9132, test_loss: 1.0553, test_f1: 0.4573
 epoch: 28, train_loss: 0.9112, test_loss: 0.9998, test_f1: 0.4986
 epoch: 29, train_loss: 0.9018, test_loss: 0.9547, test_f1: 0.5005
 epoch: 30, train_loss: 0.9007, test_loss: 0.9201, test_f1: 0.5304
 epoch: 31, train_loss: 0.8915, test_loss: 0.9666, test_f1: 0.5074
 epoch: 32, train_loss: 0.8851, test_loss: 1.0368, test_f1: 0.4674
 epoch: 33, train_loss: 0.8949, test_loss: 0.9104, test_f1: 0.5072
 epoch: 34, train_loss: 0.8951, test_loss: 0.9124, test_f1: 0.5048
 epoch: 35, train_loss: 0.8814, test_loss: 1.0098, test_f1: 0.5018
 epoch: 36, train_loss: 0.8923, test_loss: 0.9216, test_f1: 0.5046
 epoch: 37, train_loss: 0.8852, test_loss: 0.9457, test_f1: 0.4998
 epoch: 38, train_loss: 0.8633, test_loss: 0.8905, test_f1: 0.5284
 epoch: 39, train_loss: 0.8654, test_loss: 0.9640, test_f1: 0.5138
 epoch: 40, train_loss: 0.8657, test_loss: 0.9373, test_f1: 0.5320
 epoch: 41, train_loss: 0.8716, test_loss: 0.8958, test_f1: 0.5334
 epoch: 42, train_loss: 0.8518, test_loss: 0.9295, test_f1: 0.5254
 epoch: 43, train_loss: 0.8448, test_loss: 0.8956, test_f1: 0.5225
 epoch: 44, train_loss: 0.8484, test_loss: 0.8766, test_f1: 0.5402
 epoch: 45, train_loss: 0.8379, test_loss: 0.8651, test_f1: 0.5377
 epoch: 46, train_loss: 0.8361, test_loss: 0.9046, test_f1: 0.5211
 epoch: 47, train_loss: 0.8334, test_loss: 0.9496, test_f1: 0.5300
 epoch: 48, train_loss: 0.8364, test_loss: 0.8639, test_f1: 0.5460
 epoch: 49, train_loss: 0.8377, test_loss: 0.9187, test_f1: 0.5304
 epoch: 50, train_loss: 0.8280, test_loss: 0.8286, test_f1: 0.5568
 epoch: 51, train_loss: 0.8088, test_loss: 0.8753, test_f1: 0.5329
 epoch: 52, train_loss: 0.8225, test_loss: 0.8378, test_f1: 0.5537
 epoch: 53, train_loss: 0.8017, test_loss: 0.8497, test_f1: 0.5465
 epoch: 54, train_loss: 0.8117, test_loss: 0.8658, test_f1: 0.5371
 epoch: 55, train_loss: 0.8167, test_loss: 0.8482, test_f1: 0.5475
 epoch: 56, train_loss: 0.8004, test_loss: 0.8434, test_f1: 0.5468
 epoch: 57, train_loss: 0.8002, test_loss: 0.8645, test_f1: 0.5418
 epoch: 58, train_loss: 0.8079, test_loss: 0.8355, test_f1: 0.5562
 epoch: 59, train_loss: 0.7930, test_loss: 0.8440, test_f1: 0.5532
 epoch: 60, train_loss: 0.7899, test_loss: 0.8360, test_f1: 0.5634
 epoch: 61, train_loss: 0.7931, test_loss: 0.8434, test_f1: 0.5495
 epoch: 62, train_loss: 0.7951, test_loss: 0.8421, test_f1: 0.5486
 epoch: 63, train_loss: 0.7905, test_loss: 0.8316, test_f1: 0.5595
 epoch: 64, train_loss: 0.7899, test_loss: 0.8469, test_f1: 0.5436
 epoch: 65, train_loss: 0.7865, test_loss: 0.8374, test_f1: 0.5453
 epoch: 66, train_loss: 0.7969, test_loss: 0.8483, test_f1: 0.5598
 epoch: 67, train_loss: 0.7895, test_loss: 0.8457, test_f1: 0.5524
 epoch: 68, train_loss: 0.7800, test_loss: 0.8380, test_f1: 0.5582
 epoch: 69, train_loss: 0.7887, test_loss: 0.8514, test_f1: 0.5444
 epoch: 70, train_loss: 0.7801, test_loss: 0.8908, test_f1: 0.5488
 epoch: 71, train_loss: 0.7858, test_loss: 0.8451, test_f1: 0.5500
 epoch: 72, train_loss: 0.7727, test_loss: 0.8308, test_f1: 0.5620
 epoch: 73, train_loss: 0.7754, test_loss: 0.8512, test_f1: 0.5540
 epoch: 74, train_loss: 0.7712, test_loss: 0.8704, test_f1: 0.5436
 epoch: 75, train_loss: 0.7688, test_loss: 0.8565, test_f1: 0.5466
 epoch: 76, train_loss: 0.7526, test_loss: 0.8485, test_f1: 0.5489
 epoch: 77, train_loss: 0.7659, test_loss: 0.8392, test_f1: 0.5456
 epoch: 78, train_loss: 0.7591, test_loss: 0.8603, test_f1: 0.5580
 epoch: 79, train_loss: 0.7711, test_loss: 0.8395, test_f1: 0.5626
 epoch: 80, train_loss: 0.7713, test_loss: 0.8381, test_f1: 0.5532
 epoch: 81, train_loss: 0.7682, test_loss: 0.8944, test_f1: 0.5252
 epoch: 82, train_loss: 0.7713, test_loss: 0.8508, test_f1: 0.5633
 epoch: 83, train_loss: 0.7577, test_loss: 0.9002, test_f1: 0.5371
 epoch: 84, train_loss: 0.7691, test_loss: 0.8600, test_f1: 0.5409
 epoch: 85, train_loss: 0.7647, test_loss: 0.9076, test_f1: 0.5479
 epoch: 86, train_loss: 0.7560, test_loss: 0.8435, test_f1: 0.5505
 epoch: 87, train_loss: 0.7581, test_loss: 0.8404, test_f1: 0.5592
 epoch: 88, train_loss: 0.7445, test_loss: 0.8392, test_f1: 0.5659
 epoch: 89, train_loss: 0.7473, test_loss: 0.8678, test_f1: 0.5484
 epoch: 90, train_loss: 0.7512, test_loss: 0.8518, test_f1: 0.5519
 epoch: 91, train_loss: 0.7523, test_loss: 0.8575, test_f1: 0.5589
 epoch: 92, train_loss: 0.7414, test_loss: 0.8437, test_f1: 0.5617
 epoch: 93, train_loss: 0.7530, test_loss: 0.8682, test_f1: 0.5493
 epoch: 94, train_loss: 0.7352, test_loss: 0.8593, test_f1: 0.5560
 epoch: 95, train_loss: 0.7418, test_loss: 0.8320, test_f1: 0.5684
 epoch: 96, train_loss: 0.7454, test_loss: 0.8520, test_f1: 0.5507
 epoch: 97, train_loss: 0.7376, test_loss: 0.8360, test_f1: 0.5839
 epoch: 98, train_loss: 0.7392, test_loss: 0.8628, test_f1: 0.5551
 epoch: 99, train_loss: 0.7377, test_loss: 0.8577, test_f1: 0.5601
##################ITERATION #6 ****************************************
 epoch: 0, train_loss: 1.2793, test_loss: 1.3323, test_f1: 0.2270
 epoch: 1, train_loss: 1.1405, test_loss: 1.3290, test_f1: 0.2270
 epoch: 2, train_loss: 1.1049, test_loss: 1.2834, test_f1: 0.2270
 epoch: 3, train_loss: 1.0623, test_loss: 1.0726, test_f1: 0.3530
 epoch: 4, train_loss: 1.0369, test_loss: 1.0044, test_f1: 0.4320
 epoch: 5, train_loss: 1.0373, test_loss: 1.0010, test_f1: 0.4385
 epoch: 6, train_loss: 1.0103, test_loss: 0.9658, test_f1: 0.4583
 epoch: 7, train_loss: 1.0034, test_loss: 0.9632, test_f1: 0.4602
 epoch: 8, train_loss: 0.9884, test_loss: 0.9572, test_f1: 0.4661
 epoch: 9, train_loss: 0.9877, test_loss: 0.9500, test_f1: 0.4742
 epoch: 10, train_loss: 0.9726, test_loss: 0.9757, test_f1: 0.4702
 epoch: 11, train_loss: 0.9708, test_loss: 0.9691, test_f1: 0.4794
 epoch: 12, train_loss: 0.9613, test_loss: 0.9543, test_f1: 0.4723
 epoch: 13, train_loss: 0.9565, test_loss: 0.9413, test_f1: 0.4813
 epoch: 14, train_loss: 0.9533, test_loss: 1.0043, test_f1: 0.4398
 epoch: 15, train_loss: 0.9606, test_loss: 0.9575, test_f1: 0.4654
 epoch: 16, train_loss: 0.9509, test_loss: 0.9734, test_f1: 0.5056
 epoch: 17, train_loss: 0.9392, test_loss: 0.9950, test_f1: 0.4433
 epoch: 18, train_loss: 0.9289, test_loss: 0.9302, test_f1: 0.4931
 epoch: 19, train_loss: 0.9246, test_loss: 0.9468, test_f1: 0.4838
 epoch: 20, train_loss: 0.9267, test_loss: 0.9171, test_f1: 0.4983
 epoch: 21, train_loss: 0.9267, test_loss: 0.9599, test_f1: 0.4624
 epoch: 22, train_loss: 0.9055, test_loss: 0.9543, test_f1: 0.4889
 epoch: 23, train_loss: 0.8931, test_loss: 0.9358, test_f1: 0.4957
 epoch: 24, train_loss: 0.8993, test_loss: 0.9465, test_f1: 0.4887
 epoch: 25, train_loss: 0.8912, test_loss: 0.9037, test_f1: 0.5016
 epoch: 26, train_loss: 0.8960, test_loss: 0.9709, test_f1: 0.4894
 epoch: 27, train_loss: 0.8919, test_loss: 0.8837, test_f1: 0.4877
 epoch: 28, train_loss: 0.8774, test_loss: 0.9037, test_f1: 0.5132
 epoch: 29, train_loss: 0.8889, test_loss: 1.1314, test_f1: 0.4322
 epoch: 30, train_loss: 0.8780, test_loss: 0.9642, test_f1: 0.4941
 epoch: 31, train_loss: 0.8674, test_loss: 0.9178, test_f1: 0.5370
 epoch: 32, train_loss: 0.8747, test_loss: 0.8921, test_f1: 0.5176
 epoch: 33, train_loss: 0.8596, test_loss: 0.9139, test_f1: 0.5098
 epoch: 34, train_loss: 0.8621, test_loss: 0.9161, test_f1: 0.5130
 epoch: 35, train_loss: 0.8458, test_loss: 0.9394, test_f1: 0.5198
 epoch: 36, train_loss: 0.8548, test_loss: 0.9818, test_f1: 0.4778
 epoch: 37, train_loss: 0.8599, test_loss: 0.8623, test_f1: 0.5253
 epoch: 38, train_loss: 0.8472, test_loss: 0.9020, test_f1: 0.5402
 epoch: 39, train_loss: 0.8495, test_loss: 0.8496, test_f1: 0.5430
 epoch: 40, train_loss: 0.8472, test_loss: 0.9039, test_f1: 0.5424
 epoch: 41, train_loss: 0.8524, test_loss: 0.9802, test_f1: 0.5134
 epoch: 42, train_loss: 0.8366, test_loss: 0.8971, test_f1: 0.5485
 epoch: 43, train_loss: 0.8385, test_loss: 0.9063, test_f1: 0.5376
 epoch: 44, train_loss: 0.8434, test_loss: 0.9490, test_f1: 0.5242
 epoch: 45, train_loss: 0.8299, test_loss: 0.8373, test_f1: 0.5401
 epoch: 46, train_loss: 0.8239, test_loss: 0.8582, test_f1: 0.5349
 epoch: 47, train_loss: 0.8328, test_loss: 0.9298, test_f1: 0.5342
 epoch: 48, train_loss: 0.8179, test_loss: 0.8697, test_f1: 0.5367
 epoch: 49, train_loss: 0.8227, test_loss: 0.8980, test_f1: 0.5253
 epoch: 50, train_loss: 0.8222, test_loss: 0.9270, test_f1: 0.5343
 epoch: 51, train_loss: 0.8051, test_loss: 0.9095, test_f1: 0.5441
 epoch: 52, train_loss: 0.8018, test_loss: 0.8662, test_f1: 0.5535
 epoch: 53, train_loss: 0.7992, test_loss: 0.8983, test_f1: 0.5409
 epoch: 54, train_loss: 0.7934, test_loss: 0.8995, test_f1: 0.5381
 epoch: 55, train_loss: 0.7968, test_loss: 0.8752, test_f1: 0.5601
 epoch: 56, train_loss: 0.7953, test_loss: 0.8543, test_f1: 0.5405
 epoch: 57, train_loss: 0.7976, test_loss: 0.9041, test_f1: 0.5438
 epoch: 58, train_loss: 0.7926, test_loss: 0.8853, test_f1: 0.5565
 epoch: 59, train_loss: 0.7870, test_loss: 0.8872, test_f1: 0.5522
 epoch: 60, train_loss: 0.7950, test_loss: 0.8819, test_f1: 0.5608
 epoch: 61, train_loss: 0.7825, test_loss: 0.9020, test_f1: 0.5505
 epoch: 62, train_loss: 0.7970, test_loss: 0.8701, test_f1: 0.5495
 epoch: 63, train_loss: 0.7859, test_loss: 0.8650, test_f1: 0.5533
 epoch: 64, train_loss: 0.7905, test_loss: 0.8657, test_f1: 0.5521
 epoch: 65, train_loss: 0.7783, test_loss: 0.8782, test_f1: 0.5516
 epoch: 66, train_loss: 0.7785, test_loss: 0.9079, test_f1: 0.5595
 epoch: 67, train_loss: 0.7829, test_loss: 0.8771, test_f1: 0.5563
 epoch: 68, train_loss: 0.7760, test_loss: 0.8711, test_f1: 0.5606
 epoch: 69, train_loss: 0.7744, test_loss: 0.8796, test_f1: 0.5534
 epoch: 70, train_loss: 0.7746, test_loss: 0.8924, test_f1: 0.5522
 epoch: 71, train_loss: 0.7699, test_loss: 0.8832, test_f1: 0.5585
 epoch: 72, train_loss: 0.7611, test_loss: 0.8632, test_f1: 0.5549
 epoch: 73, train_loss: 0.7657, test_loss: 0.9298, test_f1: 0.5433
 epoch: 74, train_loss: 0.7678, test_loss: 0.9182, test_f1: 0.5499
 epoch: 75, train_loss: 0.7705, test_loss: 0.8910, test_f1: 0.5570
 epoch: 76, train_loss: 0.7679, test_loss: 0.8867, test_f1: 0.5543
 epoch: 77, train_loss: 0.7671, test_loss: 0.8699, test_f1: 0.5545
 epoch: 78, train_loss: 0.7636, test_loss: 0.9002, test_f1: 0.5527
 epoch: 79, train_loss: 0.7655, test_loss: 0.8883, test_f1: 0.5524
 epoch: 80, train_loss: 0.7555, test_loss: 0.9302, test_f1: 0.5498
 epoch: 81, train_loss: 0.7602, test_loss: 0.8655, test_f1: 0.5532
 epoch: 82, train_loss: 0.7603, test_loss: 0.8965, test_f1: 0.5466
 epoch: 83, train_loss: 0.7618, test_loss: 0.8797, test_f1: 0.5562
 epoch: 84, train_loss: 0.7437, test_loss: 0.8826, test_f1: 0.5542
 epoch: 85, train_loss: 0.7596, test_loss: 0.8925, test_f1: 0.5462
 epoch: 86, train_loss: 0.7691, test_loss: 0.9130, test_f1: 0.5505
 epoch: 87, train_loss: 0.7523, test_loss: 0.9060, test_f1: 0.5537
 epoch: 88, train_loss: 0.7507, test_loss: 0.9124, test_f1: 0.5451
 epoch: 89, train_loss: 0.7529, test_loss: 0.8743, test_f1: 0.5776
 epoch: 90, train_loss: 0.7519, test_loss: 0.8822, test_f1: 0.5561
 epoch: 91, train_loss: 0.7437, test_loss: 0.8627, test_f1: 0.5646
 epoch: 92, train_loss: 0.7410, test_loss: 0.8879, test_f1: 0.5622
 epoch: 93, train_loss: 0.7502, test_loss: 0.8941, test_f1: 0.5587
 epoch: 94, train_loss: 0.7442, test_loss: 0.8816, test_f1: 0.5710
 epoch: 95, train_loss: 0.7407, test_loss: 0.8976, test_f1: 0.5510
 epoch: 96, train_loss: 0.7466, test_loss: 0.9080, test_f1: 0.5461
 epoch: 97, train_loss: 0.7447, test_loss: 0.8894, test_f1: 0.5600
 epoch: 98, train_loss: 0.7484, test_loss: 0.9185, test_f1: 0.5557
 epoch: 99, train_loss: 0.7454, test_loss: 0.9252, test_f1: 0.5492
##################ITERATION #7 ****************************************
 epoch: 0, train_loss: 1.5266, test_loss: 1.3260, test_f1: 0.2270
 epoch: 1, train_loss: 1.2282, test_loss: 1.3560, test_f1: 0.2270
 epoch: 2, train_loss: 1.1690, test_loss: 1.2770, test_f1: 0.2277
 epoch: 3, train_loss: 1.1458, test_loss: 1.1369, test_f1: 0.3726
 epoch: 4, train_loss: 1.1134, test_loss: 1.0731, test_f1: 0.3941
 epoch: 5, train_loss: 1.0804, test_loss: 1.0513, test_f1: 0.4133
 epoch: 6, train_loss: 1.0585, test_loss: 1.0224, test_f1: 0.4315
 epoch: 7, train_loss: 1.0546, test_loss: 1.0103, test_f1: 0.4286
 epoch: 8, train_loss: 1.0455, test_loss: 0.9970, test_f1: 0.4499
 epoch: 9, train_loss: 1.0320, test_loss: 0.9910, test_f1: 0.4575
 epoch: 10, train_loss: 1.0163, test_loss: 0.9817, test_f1: 0.4659
 epoch: 11, train_loss: 1.0156, test_loss: 0.9764, test_f1: 0.4709
 epoch: 12, train_loss: 0.9973, test_loss: 0.9633, test_f1: 0.4675
 epoch: 13, train_loss: 0.9969, test_loss: 0.9578, test_f1: 0.4765
 epoch: 14, train_loss: 0.9810, test_loss: 0.9459, test_f1: 0.4818
 epoch: 15, train_loss: 0.9726, test_loss: 0.9362, test_f1: 0.4911
 epoch: 16, train_loss: 0.9789, test_loss: 0.9324, test_f1: 0.4871
 epoch: 17, train_loss: 0.9727, test_loss: 0.9224, test_f1: 0.4988
 epoch: 18, train_loss: 0.9674, test_loss: 0.9297, test_f1: 0.4931
 epoch: 19, train_loss: 0.9520, test_loss: 0.9205, test_f1: 0.4992
 epoch: 20, train_loss: 0.9518, test_loss: 0.9225, test_f1: 0.4931
 epoch: 21, train_loss: 0.9524, test_loss: 0.9079, test_f1: 0.5081
 epoch: 22, train_loss: 0.9349, test_loss: 0.9128, test_f1: 0.5100
 epoch: 23, train_loss: 0.9388, test_loss: 0.9016, test_f1: 0.5146
 epoch: 24, train_loss: 0.9373, test_loss: 0.9036, test_f1: 0.4995
 epoch: 25, train_loss: 0.9240, test_loss: 0.8986, test_f1: 0.5182
 epoch: 26, train_loss: 0.9151, test_loss: 0.8977, test_f1: 0.5284
 epoch: 27, train_loss: 0.9072, test_loss: 0.8828, test_f1: 0.5329
 epoch: 28, train_loss: 0.9080, test_loss: 0.8744, test_f1: 0.5335
 epoch: 29, train_loss: 0.9115, test_loss: 0.8851, test_f1: 0.5287
 epoch: 30, train_loss: 0.9007, test_loss: 0.8779, test_f1: 0.5264
 epoch: 31, train_loss: 0.8913, test_loss: 0.8806, test_f1: 0.5227
 epoch: 32, train_loss: 0.8974, test_loss: 0.9066, test_f1: 0.5183
 epoch: 33, train_loss: 0.8884, test_loss: 0.8715, test_f1: 0.5395
 epoch: 34, train_loss: 0.8805, test_loss: 0.8749, test_f1: 0.5279
 epoch: 35, train_loss: 0.8803, test_loss: 0.8729, test_f1: 0.5303
 epoch: 36, train_loss: 0.8776, test_loss: 0.8797, test_f1: 0.5180
 epoch: 37, train_loss: 0.8806, test_loss: 0.8652, test_f1: 0.5295
 epoch: 38, train_loss: 0.8693, test_loss: 0.8494, test_f1: 0.5432
 epoch: 39, train_loss: 0.8678, test_loss: 0.8539, test_f1: 0.5464
 epoch: 40, train_loss: 0.8667, test_loss: 0.8672, test_f1: 0.5283
 epoch: 41, train_loss: 0.8583, test_loss: 0.8636, test_f1: 0.5346
 epoch: 42, train_loss: 0.8518, test_loss: 0.8831, test_f1: 0.5436
 epoch: 43, train_loss: 0.8603, test_loss: 0.9261, test_f1: 0.5048
 epoch: 44, train_loss: 0.8594, test_loss: 0.8928, test_f1: 0.5487
 epoch: 45, train_loss: 0.8560, test_loss: 0.8444, test_f1: 0.5445
 epoch: 46, train_loss: 0.8547, test_loss: 0.8417, test_f1: 0.5557
 epoch: 47, train_loss: 0.8342, test_loss: 0.8429, test_f1: 0.5467
 epoch: 48, train_loss: 0.8415, test_loss: 0.8507, test_f1: 0.5414
 epoch: 49, train_loss: 0.8336, test_loss: 0.8528, test_f1: 0.5597
 epoch: 50, train_loss: 0.8395, test_loss: 0.8498, test_f1: 0.5439
 epoch: 51, train_loss: 0.8260, test_loss: 0.8480, test_f1: 0.5333
 epoch: 52, train_loss: 0.8333, test_loss: 0.8192, test_f1: 0.5489
 epoch: 53, train_loss: 0.8303, test_loss: 0.8357, test_f1: 0.5541
 epoch: 54, train_loss: 0.8215, test_loss: 0.8163, test_f1: 0.5687
 epoch: 55, train_loss: 0.8148, test_loss: 0.8436, test_f1: 0.5428
 epoch: 56, train_loss: 0.8113, test_loss: 0.8282, test_f1: 0.5587
 epoch: 57, train_loss: 0.8074, test_loss: 0.8281, test_f1: 0.5529
 epoch: 58, train_loss: 0.8066, test_loss: 0.8334, test_f1: 0.5574
 epoch: 59, train_loss: 0.8031, test_loss: 0.8331, test_f1: 0.5520
 epoch: 60, train_loss: 0.8150, test_loss: 0.8283, test_f1: 0.5571
 epoch: 61, train_loss: 0.8111, test_loss: 0.8351, test_f1: 0.5472
 epoch: 62, train_loss: 0.8025, test_loss: 0.8163, test_f1: 0.5716
 epoch: 63, train_loss: 0.8076, test_loss: 0.8324, test_f1: 0.5479
 epoch: 64, train_loss: 0.8014, test_loss: 0.8417, test_f1: 0.5612
 epoch: 65, train_loss: 0.8028, test_loss: 0.8327, test_f1: 0.5567
 epoch: 66, train_loss: 0.8046, test_loss: 0.8209, test_f1: 0.5628
 epoch: 67, train_loss: 0.8008, test_loss: 0.8156, test_f1: 0.5626
 epoch: 68, train_loss: 0.8026, test_loss: 0.8193, test_f1: 0.5689
 epoch: 69, train_loss: 0.7973, test_loss: 0.8316, test_f1: 0.5496
 epoch: 70, train_loss: 0.8035, test_loss: 0.8317, test_f1: 0.5682
 epoch: 71, train_loss: 0.7904, test_loss: 0.8399, test_f1: 0.5565
 epoch: 72, train_loss: 0.8027, test_loss: 0.8250, test_f1: 0.5693
 epoch: 73, train_loss: 0.7918, test_loss: 0.8246, test_f1: 0.5448
 epoch: 74, train_loss: 0.7955, test_loss: 0.8403, test_f1: 0.5471
 epoch: 75, train_loss: 0.7982, test_loss: 0.8291, test_f1: 0.5615
 epoch: 76, train_loss: 0.7877, test_loss: 0.8337, test_f1: 0.5604
 epoch: 77, train_loss: 0.7950, test_loss: 0.8447, test_f1: 0.5578
 epoch: 78, train_loss: 0.7912, test_loss: 0.8126, test_f1: 0.5589
 epoch: 79, train_loss: 0.7931, test_loss: 0.8356, test_f1: 0.5473
 epoch: 80, train_loss: 0.7835, test_loss: 0.8181, test_f1: 0.5664
 epoch: 81, train_loss: 0.7868, test_loss: 0.8564, test_f1: 0.5319
 epoch: 82, train_loss: 0.7784, test_loss: 0.8749, test_f1: 0.5388
 epoch: 83, train_loss: 0.7942, test_loss: 0.8384, test_f1: 0.5625
 epoch: 84, train_loss: 0.7808, test_loss: 0.8425, test_f1: 0.5461
 epoch: 85, train_loss: 0.7862, test_loss: 0.8429, test_f1: 0.5552
 epoch: 86, train_loss: 0.7694, test_loss: 0.8403, test_f1: 0.5647
 epoch: 87, train_loss: 0.7697, test_loss: 0.8394, test_f1: 0.5539
 epoch: 88, train_loss: 0.7726, test_loss: 0.8585, test_f1: 0.5675
 epoch: 89, train_loss: 0.7717, test_loss: 0.8347, test_f1: 0.5583
 epoch: 90, train_loss: 0.7765, test_loss: 0.8352, test_f1: 0.5637
 epoch: 91, train_loss: 0.7765, test_loss: 0.8435, test_f1: 0.5663
 epoch: 92, train_loss: 0.7753, test_loss: 0.8546, test_f1: 0.5542
 epoch: 93, train_loss: 0.7729, test_loss: 0.8536, test_f1: 0.5581
 epoch: 94, train_loss: 0.7675, test_loss: 0.8504, test_f1: 0.5645
 epoch: 95, train_loss: 0.7714, test_loss: 0.8584, test_f1: 0.5462
 epoch: 96, train_loss: 0.7667, test_loss: 0.8415, test_f1: 0.5598
 epoch: 97, train_loss: 0.7631, test_loss: 0.8489, test_f1: 0.5527
 epoch: 98, train_loss: 0.7624, test_loss: 0.8625, test_f1: 0.5448
 epoch: 99, train_loss: 0.7664, test_loss: 0.8518, test_f1: 0.5619
##################ITERATION #8 ****************************************
 epoch: 0, train_loss: 1.4453, test_loss: 1.4918, test_f1: 0.2270
 epoch: 1, train_loss: 1.1621, test_loss: 1.3078, test_f1: 0.2270
 epoch: 2, train_loss: 1.1104, test_loss: 1.2810, test_f1: 0.3016
 epoch: 3, train_loss: 1.0783, test_loss: 1.3009, test_f1: 0.3332
 epoch: 4, train_loss: 1.0651, test_loss: 1.2302, test_f1: 0.3988
 epoch: 5, train_loss: 1.0440, test_loss: 1.1095, test_f1: 0.4461
 epoch: 6, train_loss: 1.0389, test_loss: 0.9984, test_f1: 0.4575
 epoch: 7, train_loss: 1.0293, test_loss: 0.9754, test_f1: 0.4749
 epoch: 8, train_loss: 1.0047, test_loss: 0.9991, test_f1: 0.4475
 epoch: 9, train_loss: 1.0074, test_loss: 0.9637, test_f1: 0.4845
 epoch: 10, train_loss: 0.9948, test_loss: 0.9752, test_f1: 0.4753
 epoch: 11, train_loss: 0.9967, test_loss: 0.9576, test_f1: 0.4774
 epoch: 12, train_loss: 0.9884, test_loss: 0.9421, test_f1: 0.4938
 epoch: 13, train_loss: 0.9718, test_loss: 0.9944, test_f1: 0.4743
 epoch: 14, train_loss: 0.9640, test_loss: 0.9616, test_f1: 0.4795
 epoch: 15, train_loss: 0.9662, test_loss: 0.9513, test_f1: 0.4927
 epoch: 16, train_loss: 0.9639, test_loss: 0.9330, test_f1: 0.4964
 epoch: 17, train_loss: 0.9489, test_loss: 0.9380, test_f1: 0.4850
 epoch: 18, train_loss: 0.9428, test_loss: 0.9184, test_f1: 0.4958
 epoch: 19, train_loss: 0.9388, test_loss: 0.9142, test_f1: 0.4913
 epoch: 20, train_loss: 0.9318, test_loss: 0.9052, test_f1: 0.4972
 epoch: 21, train_loss: 0.9335, test_loss: 0.9177, test_f1: 0.4717
 epoch: 22, train_loss: 0.9223, test_loss: 0.9043, test_f1: 0.5096
 epoch: 23, train_loss: 0.9201, test_loss: 0.9132, test_f1: 0.5172
 epoch: 24, train_loss: 0.9166, test_loss: 0.9400, test_f1: 0.4574
 epoch: 25, train_loss: 0.9179, test_loss: 0.9001, test_f1: 0.5135
 epoch: 26, train_loss: 0.9301, test_loss: 0.9745, test_f1: 0.5072
 epoch: 27, train_loss: 0.9124, test_loss: 0.8906, test_f1: 0.5101
 epoch: 28, train_loss: 0.9018, test_loss: 0.9067, test_f1: 0.4882
 epoch: 29, train_loss: 0.9149, test_loss: 0.8965, test_f1: 0.4935
 epoch: 30, train_loss: 0.8928, test_loss: 0.8962, test_f1: 0.4925
 epoch: 31, train_loss: 0.8918, test_loss: 0.8900, test_f1: 0.5203
 epoch: 32, train_loss: 0.9040, test_loss: 0.9431, test_f1: 0.4869
 epoch: 33, train_loss: 0.8973, test_loss: 0.8914, test_f1: 0.5057
 epoch: 34, train_loss: 0.8990, test_loss: 0.8872, test_f1: 0.5040
 epoch: 35, train_loss: 0.8814, test_loss: 0.8852, test_f1: 0.5281
 epoch: 36, train_loss: 0.8804, test_loss: 0.9060, test_f1: 0.4896
 epoch: 37, train_loss: 0.8717, test_loss: 0.8677, test_f1: 0.5274
 epoch: 38, train_loss: 0.8777, test_loss: 0.8929, test_f1: 0.5069
 epoch: 39, train_loss: 0.8759, test_loss: 0.8858, test_f1: 0.5062
 epoch: 40, train_loss: 0.8692, test_loss: 0.8685, test_f1: 0.5061
 epoch: 41, train_loss: 0.8744, test_loss: 0.9559, test_f1: 0.4848
 epoch: 42, train_loss: 0.8638, test_loss: 0.9376, test_f1: 0.5110
 epoch: 43, train_loss: 0.8594, test_loss: 0.8578, test_f1: 0.5309
 epoch: 44, train_loss: 0.8547, test_loss: 0.9282, test_f1: 0.4904
 epoch: 45, train_loss: 0.8571, test_loss: 0.8615, test_f1: 0.5113
 epoch: 46, train_loss: 0.8620, test_loss: 0.9304, test_f1: 0.5019
 epoch: 47, train_loss: 0.8451, test_loss: 0.8700, test_f1: 0.5243
 epoch: 48, train_loss: 0.8461, test_loss: 0.8674, test_f1: 0.5202
 epoch: 49, train_loss: 0.8569, test_loss: 0.8925, test_f1: 0.5276
 epoch: 50, train_loss: 0.8390, test_loss: 0.8789, test_f1: 0.5067
 epoch: 51, train_loss: 0.8276, test_loss: 0.8696, test_f1: 0.5186
 epoch: 52, train_loss: 0.8285, test_loss: 0.8518, test_f1: 0.5361
 epoch: 53, train_loss: 0.8424, test_loss: 0.8494, test_f1: 0.5296
 epoch: 54, train_loss: 0.8200, test_loss: 0.8666, test_f1: 0.5258
 epoch: 55, train_loss: 0.8281, test_loss: 0.8702, test_f1: 0.5126
 epoch: 56, train_loss: 0.8169, test_loss: 0.8575, test_f1: 0.5288
 epoch: 57, train_loss: 0.8212, test_loss: 0.8509, test_f1: 0.5345
 epoch: 58, train_loss: 0.8126, test_loss: 0.8683, test_f1: 0.5114
 epoch: 59, train_loss: 0.8156, test_loss: 0.8620, test_f1: 0.5174
 epoch: 60, train_loss: 0.8054, test_loss: 0.8439, test_f1: 0.5446
 epoch: 61, train_loss: 0.8076, test_loss: 0.9022, test_f1: 0.5288
 epoch: 62, train_loss: 0.8071, test_loss: 0.8782, test_f1: 0.5268
 epoch: 63, train_loss: 0.8278, test_loss: 0.8690, test_f1: 0.5373
 epoch: 64, train_loss: 0.8163, test_loss: 0.8659, test_f1: 0.5243
 epoch: 65, train_loss: 0.8084, test_loss: 0.8590, test_f1: 0.5237
 epoch: 66, train_loss: 0.8074, test_loss: 0.8650, test_f1: 0.5283
 epoch: 67, train_loss: 0.8038, test_loss: 0.8693, test_f1: 0.5258
 epoch: 68, train_loss: 0.8046, test_loss: 0.8638, test_f1: 0.5289
 epoch: 69, train_loss: 0.7978, test_loss: 0.8659, test_f1: 0.5388
 epoch: 70, train_loss: 0.8017, test_loss: 0.8632, test_f1: 0.5250
 epoch: 71, train_loss: 0.8092, test_loss: 0.8657, test_f1: 0.5239
 epoch: 72, train_loss: 0.8031, test_loss: 0.8524, test_f1: 0.5368
 epoch: 73, train_loss: 0.8081, test_loss: 0.8545, test_f1: 0.5248
 epoch: 74, train_loss: 0.8009, test_loss: 0.8513, test_f1: 0.5374
 epoch: 75, train_loss: 0.7915, test_loss: 0.9441, test_f1: 0.4945
 epoch: 76, train_loss: 0.8010, test_loss: 0.8513, test_f1: 0.5386
 epoch: 77, train_loss: 0.7991, test_loss: 0.8724, test_f1: 0.5237
 epoch: 78, train_loss: 0.7910, test_loss: 0.8841, test_f1: 0.5223
 epoch: 79, train_loss: 0.7935, test_loss: 0.8753, test_f1: 0.5096
 epoch: 80, train_loss: 0.7941, test_loss: 0.8532, test_f1: 0.5215
 epoch: 81, train_loss: 0.7857, test_loss: 0.8682, test_f1: 0.5372
 epoch: 82, train_loss: 0.7828, test_loss: 0.8676, test_f1: 0.5336
 epoch: 83, train_loss: 0.7889, test_loss: 0.8594, test_f1: 0.5372
 epoch: 84, train_loss: 0.7841, test_loss: 0.8975, test_f1: 0.5134
 epoch: 85, train_loss: 0.7717, test_loss: 0.8598, test_f1: 0.5327
 epoch: 86, train_loss: 0.7854, test_loss: 0.8537, test_f1: 0.5258
 epoch: 87, train_loss: 0.7809, test_loss: 0.8659, test_f1: 0.5307
 epoch: 88, train_loss: 0.7967, test_loss: 0.9057, test_f1: 0.5044
 epoch: 89, train_loss: 0.7800, test_loss: 0.8465, test_f1: 0.5213
 epoch: 90, train_loss: 0.7867, test_loss: 0.8573, test_f1: 0.5216
 epoch: 91, train_loss: 0.7920, test_loss: 0.8790, test_f1: 0.5282
 epoch: 92, train_loss: 0.7922, test_loss: 0.8765, test_f1: 0.5282
 epoch: 93, train_loss: 0.7719, test_loss: 0.8923, test_f1: 0.5283
 epoch: 94, train_loss: 0.7714, test_loss: 0.8851, test_f1: 0.5138
 epoch: 95, train_loss: 0.7650, test_loss: 0.8793, test_f1: 0.5141
 epoch: 96, train_loss: 0.7732, test_loss: 0.8627, test_f1: 0.5276
 epoch: 97, train_loss: 0.7707, test_loss: 0.9302, test_f1: 0.5163
 epoch: 98, train_loss: 0.7662, test_loss: 0.8974, test_f1: 0.5146
 epoch: 99, train_loss: 0.7689, test_loss: 0.8983, test_f1: 0.5366
##################ITERATION #9 ****************************************
 epoch: 0, train_loss: 1.3891, test_loss: 1.3801, test_f1: 0.2270
 epoch: 1, train_loss: 1.1539, test_loss: 1.3816, test_f1: 0.2270
 epoch: 2, train_loss: 1.1146, test_loss: 1.1606, test_f1: 0.2801
 epoch: 3, train_loss: 1.0763, test_loss: 1.1356, test_f1: 0.3426
 epoch: 4, train_loss: 1.0517, test_loss: 1.1346, test_f1: 0.3412
 epoch: 5, train_loss: 1.0274, test_loss: 1.0705, test_f1: 0.4030
 epoch: 6, train_loss: 1.0188, test_loss: 1.0304, test_f1: 0.4418
 epoch: 7, train_loss: 1.0034, test_loss: 1.0203, test_f1: 0.4599
 epoch: 8, train_loss: 0.9989, test_loss: 1.0267, test_f1: 0.4653
 epoch: 9, train_loss: 0.9828, test_loss: 1.0107, test_f1: 0.4698
 epoch: 10, train_loss: 0.9751, test_loss: 1.0379, test_f1: 0.4629
 epoch: 11, train_loss: 0.9675, test_loss: 0.9864, test_f1: 0.4816
 epoch: 12, train_loss: 0.9703, test_loss: 0.9912, test_f1: 0.4745
 epoch: 13, train_loss: 0.9523, test_loss: 1.0129, test_f1: 0.4670
 epoch: 14, train_loss: 0.9503, test_loss: 0.9889, test_f1: 0.4929
 epoch: 15, train_loss: 0.9464, test_loss: 0.9918, test_f1: 0.4867
 epoch: 16, train_loss: 0.9485, test_loss: 0.9983, test_f1: 0.4897
 epoch: 17, train_loss: 0.9416, test_loss: 0.9984, test_f1: 0.4879
 epoch: 18, train_loss: 0.9352, test_loss: 0.9875, test_f1: 0.4926
 epoch: 19, train_loss: 0.9311, test_loss: 0.9782, test_f1: 0.5098
 epoch: 20, train_loss: 0.9334, test_loss: 0.9852, test_f1: 0.4957
 epoch: 21, train_loss: 0.9144, test_loss: 0.9859, test_f1: 0.4912
 epoch: 22, train_loss: 0.9309, test_loss: 0.9860, test_f1: 0.4915
 epoch: 23, train_loss: 0.9156, test_loss: 0.9749, test_f1: 0.4922
 epoch: 24, train_loss: 0.9103, test_loss: 0.9965, test_f1: 0.4946
 epoch: 25, train_loss: 0.9052, test_loss: 0.9896, test_f1: 0.4916
 epoch: 26, train_loss: 0.9105, test_loss: 0.9691, test_f1: 0.4983
 epoch: 27, train_loss: 0.8988, test_loss: 0.9936, test_f1: 0.4938
 epoch: 28, train_loss: 0.8966, test_loss: 0.9800, test_f1: 0.4988
 epoch: 29, train_loss: 0.8972, test_loss: 0.9582, test_f1: 0.5383
 epoch: 30, train_loss: 0.8923, test_loss: 0.9557, test_f1: 0.5270
 epoch: 31, train_loss: 0.8951, test_loss: 0.9698, test_f1: 0.5000
 epoch: 32, train_loss: 0.8876, test_loss: 0.9786, test_f1: 0.4973
 epoch: 33, train_loss: 0.8787, test_loss: 0.9739, test_f1: 0.5007
 epoch: 34, train_loss: 0.8791, test_loss: 0.9525, test_f1: 0.5236
 epoch: 35, train_loss: 0.8819, test_loss: 0.9502, test_f1: 0.5216
 epoch: 36, train_loss: 0.8720, test_loss: 0.9621, test_f1: 0.5230
 epoch: 37, train_loss: 0.8647, test_loss: 0.9424, test_f1: 0.5013
 epoch: 38, train_loss: 0.8701, test_loss: 0.9282, test_f1: 0.5200
 epoch: 39, train_loss: 0.8751, test_loss: 0.9567, test_f1: 0.5087
 epoch: 40, train_loss: 0.8555, test_loss: 0.9587, test_f1: 0.5307
 epoch: 41, train_loss: 0.8550, test_loss: 0.9451, test_f1: 0.5139
 epoch: 42, train_loss: 0.8616, test_loss: 0.9284, test_f1: 0.5299
 epoch: 43, train_loss: 0.8586, test_loss: 0.9494, test_f1: 0.5180
 epoch: 44, train_loss: 0.8536, test_loss: 0.9440, test_f1: 0.5179
 epoch: 45, train_loss: 0.8549, test_loss: 0.9417, test_f1: 0.5178
 epoch: 46, train_loss: 0.8410, test_loss: 0.9399, test_f1: 0.5325
 epoch: 47, train_loss: 0.8501, test_loss: 0.9527, test_f1: 0.5232
 epoch: 48, train_loss: 0.8400, test_loss: 0.9832, test_f1: 0.5115
 epoch: 49, train_loss: 0.8497, test_loss: 0.9609, test_f1: 0.5190
 epoch: 50, train_loss: 0.8478, test_loss: 0.9445, test_f1: 0.5151
 epoch: 51, train_loss: 0.8420, test_loss: 0.9525, test_f1: 0.5181
 epoch: 52, train_loss: 0.8243, test_loss: 0.9398, test_f1: 0.5205
 epoch: 53, train_loss: 0.8284, test_loss: 0.9413, test_f1: 0.5256
 epoch: 54, train_loss: 0.8261, test_loss: 0.9365, test_f1: 0.5281
 epoch: 55, train_loss: 0.8301, test_loss: 0.9176, test_f1: 0.5221
 epoch: 56, train_loss: 0.8290, test_loss: 0.9224, test_f1: 0.5314
 epoch: 57, train_loss: 0.8275, test_loss: 0.9166, test_f1: 0.5270
 epoch: 58, train_loss: 0.8375, test_loss: 0.9224, test_f1: 0.5336
 epoch: 59, train_loss: 0.8252, test_loss: 0.9345, test_f1: 0.5244
 epoch: 60, train_loss: 0.8243, test_loss: 0.9374, test_f1: 0.5208
 epoch: 61, train_loss: 0.8144, test_loss: 0.9480, test_f1: 0.5298
 epoch: 62, train_loss: 0.8286, test_loss: 0.9432, test_f1: 0.5180
 epoch: 63, train_loss: 0.8228, test_loss: 0.9160, test_f1: 0.5245
 epoch: 64, train_loss: 0.8149, test_loss: 0.9151, test_f1: 0.5336
 epoch: 65, train_loss: 0.8126, test_loss: 0.9012, test_f1: 0.5265
 epoch: 66, train_loss: 0.8106, test_loss: 0.9295, test_f1: 0.5243
 epoch: 67, train_loss: 0.8201, test_loss: 0.9255, test_f1: 0.5286
 epoch: 68, train_loss: 0.8146, test_loss: 0.9296, test_f1: 0.5254
 epoch: 69, train_loss: 0.8070, test_loss: 0.9464, test_f1: 0.5238
 epoch: 70, train_loss: 0.8157, test_loss: 0.9077, test_f1: 0.5237
 epoch: 71, train_loss: 0.8104, test_loss: 0.9264, test_f1: 0.5343
 epoch: 72, train_loss: 0.8045, test_loss: 0.9328, test_f1: 0.5267
 epoch: 73, train_loss: 0.8187, test_loss: 0.9357, test_f1: 0.5405
 epoch: 74, train_loss: 0.8092, test_loss: 0.9252, test_f1: 0.5355
 epoch: 75, train_loss: 0.8013, test_loss: 0.9222, test_f1: 0.5324
 epoch: 76, train_loss: 0.8010, test_loss: 0.9313, test_f1: 0.5292
 epoch: 77, train_loss: 0.8154, test_loss: 0.9432, test_f1: 0.5061
 epoch: 78, train_loss: 0.8072, test_loss: 0.9265, test_f1: 0.5306
 epoch: 79, train_loss: 0.8009, test_loss: 0.9233, test_f1: 0.5324
 epoch: 80, train_loss: 0.8027, test_loss: 0.9174, test_f1: 0.5275
 epoch: 81, train_loss: 0.8010, test_loss: 0.9299, test_f1: 0.5434
 epoch: 82, train_loss: 0.7973, test_loss: 0.9294, test_f1: 0.5406
 epoch: 83, train_loss: 0.7881, test_loss: 0.9351, test_f1: 0.5303
 epoch: 84, train_loss: 0.7864, test_loss: 0.9252, test_f1: 0.5334
 epoch: 85, train_loss: 0.7975, test_loss: 0.9282, test_f1: 0.5319
 epoch: 86, train_loss: 0.7966, test_loss: 0.9366, test_f1: 0.5393
 epoch: 87, train_loss: 0.7963, test_loss: 0.9223, test_f1: 0.5370
 epoch: 88, train_loss: 0.7939, test_loss: 0.9312, test_f1: 0.5397
 epoch: 89, train_loss: 0.7942, test_loss: 0.9199, test_f1: 0.5349
 epoch: 90, train_loss: 0.7979, test_loss: 0.9230, test_f1: 0.5490
 epoch: 91, train_loss: 0.7946, test_loss: 0.9415, test_f1: 0.5318
 epoch: 92, train_loss: 0.7861, test_loss: 0.9378, test_f1: 0.5370
 epoch: 93, train_loss: 0.7878, test_loss: 0.9134, test_f1: 0.5409
 epoch: 94, train_loss: 0.7867, test_loss: 0.9280, test_f1: 0.5396
 epoch: 95, train_loss: 0.7864, test_loss: 0.9418, test_f1: 0.5425
 epoch: 96, train_loss: 0.7890, test_loss: 0.9175, test_f1: 0.5442
 epoch: 97, train_loss: 0.7813, test_loss: 0.9171, test_f1: 0.5474
 epoch: 98, train_loss: 0.7744, test_loss: 0.9347, test_f1: 0.5402
 epoch: 99, train_loss: 0.7817, test_loss: 0.9424, test_f1: 0.5376

Training completed in 415.81 seconds
Best F1: 0.5839 at epoch 97
Mean F1 across iterations: 0.5599  0.0153
========================FINAL RESULTS================================
FEGIN weighted F1: 0.5839  0.0153
python main.py --data ltspice_examples --representation component_pin_net --model FEGIN --layers 4 --hiddens 16 --batch_size 256 --lr 0.001 --emb_size 128 --epochs 100 --save_appendix component_pin_net_L4_H16_BS256_LR0.001_E128 --no_val
-----



STDERR:
  File "main.py", line 370, in <module>
    main()
  File "main.py", line 254, in main
    dataset = dataset_class(
  File "/home/philip/projects/ltspice_examples_code_repo/Circuit-Completion-Using-GNNs/component_classification_with_link_prediction_head/evaluation/FEGIN/kernel/circuit_datasets.py", line 15, in __init__
    self.data, self.slices = torch.load(self.processed_paths[0])
  File "/home/philip/.local/lib/python3.8/site-packages/torch/serialization.py", line 1040, in load
    warnings.warn(
  File "/usr/lib/python3.8/warnings.py", line 109, in _showwarnmsg
    sw(msg.message, msg.category, msg.filename, msg.lineno,
  File "main.py", line 47, in warn_with_traceback
    traceback.print_stack(file=log)
/home/philip/projects/ltspice_examples_code_repo/Circuit-Completion-Using-GNNs/component_classification_with_link_prediction_head/evaluation/FEGIN/kernel/circuit_datasets.py:15: FutureWarning: You are using `torch.load` with `weights_only=False` (the current default value), which uses the default pickle module implicitly. It is possible to construct malicious pickle data which will execute arbitrary code during unpickling (See https://github.com/pytorch/pytorch/blob/main/SECURITY.md#untrusted-models for more details). In a future release, the default value for `weights_only` will be flipped to `True`. This limits the functions that could be executed during unpickling. Arbitrary objects will no longer be allowed to be loaded via this mode unless they are explicitly allowlisted by the user via `torch.serialization.add_safe_globals`. We recommend you start setting `weights_only=True` for any use case where you don't have full control of the loaded file. Please open an issue on GitHub for any issues related to this experimental feature.
  self.data, self.slices = torch.load(self.processed_paths[0])
