STDOUT:
Results will be saved in /home/philip/projects/ltspice_examples_code_repo/Circuit-Completion-Using-GNNs/component_classification_with_link_prediction_head/evaluation/FEGIN/results/model_FEGIN_dataset_ltspice_examples
Command line input: python main.py --data ltspice_examples --representation component_component --model FEGIN --layers 5 --hiddens 16 --batch_size 128 --lr 0.001 --emb_size 128 --epochs 100 --save_appendix component_component_L5_H16_BS128_LR0.001_E128 --no_val
 is saved.
-----
ltspice_examples - FEGIN
Using 5 layers, 16 hidden units, h = 2
Loading component_component representation dataset
Loading component_component representation data...
Loaded 4401 examples (component_component)
saving path: data/processed/ltspice_examples_component_component_processed.pt
ENTERED
Training FEGIN on component_component representation
Train: 3556, Test: 845
##################ITERATION #0 ****************************************
 epoch: 0, train_loss: 1.3935, test_loss: 1.3672, test_f1: 0.2220
 epoch: 1, train_loss: 1.3379, test_loss: 1.3257, test_f1: 0.2274
 epoch: 2, train_loss: 1.3099, test_loss: 1.3068, test_f1: 0.2274
 epoch: 3, train_loss: 1.2914, test_loss: 1.2851, test_f1: 0.2274
 epoch: 4, train_loss: 1.2745, test_loss: 1.2695, test_f1: 0.2274
 epoch: 5, train_loss: 1.2615, test_loss: 1.2552, test_f1: 0.2274
 epoch: 6, train_loss: 1.2514, test_loss: 1.2448, test_f1: 0.2274
 epoch: 7, train_loss: 1.2407, test_loss: 1.2260, test_f1: 0.2274
 epoch: 8, train_loss: 1.2336, test_loss: 1.2122, test_f1: 0.2274
 epoch: 9, train_loss: 1.2159, test_loss: 1.1987, test_f1: 0.2574
 epoch: 10, train_loss: 1.2108, test_loss: 1.1857, test_f1: 0.3790
 epoch: 11, train_loss: 1.1967, test_loss: 1.1722, test_f1: 0.4206
 epoch: 12, train_loss: 1.1854, test_loss: 1.1567, test_f1: 0.4390
 epoch: 13, train_loss: 1.1793, test_loss: 1.1430, test_f1: 0.4317
 epoch: 14, train_loss: 1.1805, test_loss: 1.1352, test_f1: 0.4323
 epoch: 15, train_loss: 1.1653, test_loss: 1.1276, test_f1: 0.4495
 epoch: 16, train_loss: 1.1557, test_loss: 1.1112, test_f1: 0.4616
 epoch: 17, train_loss: 1.1473, test_loss: 1.1004, test_f1: 0.4599
 epoch: 18, train_loss: 1.1352, test_loss: 1.0923, test_f1: 0.4521
 epoch: 19, train_loss: 1.1201, test_loss: 1.0856, test_f1: 0.4642
 epoch: 20, train_loss: 1.1278, test_loss: 1.0800, test_f1: 0.4648
 epoch: 21, train_loss: 1.1159, test_loss: 1.0656, test_f1: 0.4569
 epoch: 22, train_loss: 1.1049, test_loss: 1.0595, test_f1: 0.4640
 epoch: 23, train_loss: 1.0956, test_loss: 1.0540, test_f1: 0.4667
 epoch: 24, train_loss: 1.0812, test_loss: 1.0599, test_f1: 0.4597
 epoch: 25, train_loss: 1.0924, test_loss: 1.0612, test_f1: 0.4565
 epoch: 26, train_loss: 1.0692, test_loss: 1.0464, test_f1: 0.4686
 epoch: 27, train_loss: 1.0705, test_loss: 1.0375, test_f1: 0.4498
 epoch: 28, train_loss: 1.0675, test_loss: 1.0500, test_f1: 0.4779
 epoch: 29, train_loss: 1.0517, test_loss: 1.0292, test_f1: 0.4837
 epoch: 30, train_loss: 1.0529, test_loss: 1.0297, test_f1: 0.4584
 epoch: 31, train_loss: 1.0368, test_loss: 1.0332, test_f1: 0.4632
 epoch: 32, train_loss: 1.0271, test_loss: 1.0191, test_f1: 0.4795
 epoch: 33, train_loss: 1.0319, test_loss: 1.0243, test_f1: 0.5094
 epoch: 34, train_loss: 1.0335, test_loss: 1.0378, test_f1: 0.4682
 epoch: 35, train_loss: 1.0129, test_loss: 1.0538, test_f1: 0.4669
 epoch: 36, train_loss: 1.0081, test_loss: 1.0319, test_f1: 0.4810
 epoch: 37, train_loss: 1.0077, test_loss: 1.0143, test_f1: 0.4794
 epoch: 38, train_loss: 0.9981, test_loss: 1.0066, test_f1: 0.4764
 epoch: 39, train_loss: 0.9993, test_loss: 1.0223, test_f1: 0.4762
 epoch: 40, train_loss: 0.9855, test_loss: 0.9987, test_f1: 0.4919
 epoch: 41, train_loss: 0.9742, test_loss: 1.0124, test_f1: 0.4842
 epoch: 42, train_loss: 0.9958, test_loss: 0.9888, test_f1: 0.5058
 epoch: 43, train_loss: 0.9794, test_loss: 1.0225, test_f1: 0.4714
 epoch: 44, train_loss: 0.9746, test_loss: 1.0079, test_f1: 0.4771
 epoch: 45, train_loss: 0.9809, test_loss: 0.9866, test_f1: 0.5095
 epoch: 46, train_loss: 0.9679, test_loss: 1.0048, test_f1: 0.4959
 epoch: 47, train_loss: 0.9598, test_loss: 1.0192, test_f1: 0.4871
 epoch: 48, train_loss: 0.9794, test_loss: 0.9822, test_f1: 0.4926
 epoch: 49, train_loss: 0.9591, test_loss: 0.9981, test_f1: 0.5170
 epoch: 50, train_loss: 0.9549, test_loss: 0.9815, test_f1: 0.4921
 epoch: 51, train_loss: 0.9444, test_loss: 0.9767, test_f1: 0.5297
 epoch: 52, train_loss: 0.9426, test_loss: 0.9834, test_f1: 0.4974
 epoch: 53, train_loss: 0.9386, test_loss: 1.0196, test_f1: 0.5122
 epoch: 54, train_loss: 0.9355, test_loss: 0.9825, test_f1: 0.5149
 epoch: 55, train_loss: 0.9353, test_loss: 1.0009, test_f1: 0.5212
 epoch: 56, train_loss: 0.9290, test_loss: 0.9938, test_f1: 0.4958
 epoch: 57, train_loss: 0.9368, test_loss: 1.0075, test_f1: 0.4946
 epoch: 58, train_loss: 0.9303, test_loss: 0.9816, test_f1: 0.4956
 epoch: 59, train_loss: 0.9195, test_loss: 0.9884, test_f1: 0.5009
 epoch: 60, train_loss: 0.9188, test_loss: 0.9934, test_f1: 0.5210
 epoch: 61, train_loss: 0.9276, test_loss: 0.9885, test_f1: 0.5172
 epoch: 62, train_loss: 0.9148, test_loss: 1.0069, test_f1: 0.4929
 epoch: 63, train_loss: 0.9173, test_loss: 1.0077, test_f1: 0.5117
 epoch: 64, train_loss: 0.9176, test_loss: 1.0021, test_f1: 0.4948
 epoch: 65, train_loss: 0.9118, test_loss: 1.0101, test_f1: 0.5176
 epoch: 66, train_loss: 0.9173, test_loss: 0.9766, test_f1: 0.5249
 epoch: 67, train_loss: 0.9024, test_loss: 1.0270, test_f1: 0.5138
 epoch: 68, train_loss: 0.9068, test_loss: 0.9884, test_f1: 0.4978
 epoch: 69, train_loss: 0.9095, test_loss: 1.0287, test_f1: 0.5113
 epoch: 70, train_loss: 0.9042, test_loss: 1.0332, test_f1: 0.5007
 epoch: 71, train_loss: 0.9015, test_loss: 1.0125, test_f1: 0.5191
 epoch: 72, train_loss: 0.9061, test_loss: 1.0181, test_f1: 0.5080
 epoch: 73, train_loss: 0.9013, test_loss: 1.0178, test_f1: 0.5127
 epoch: 74, train_loss: 0.9011, test_loss: 1.0245, test_f1: 0.4848
 epoch: 75, train_loss: 0.8981, test_loss: 1.0018, test_f1: 0.5137
 epoch: 76, train_loss: 0.9055, test_loss: 0.9975, test_f1: 0.5150
 epoch: 77, train_loss: 0.9065, test_loss: 1.0068, test_f1: 0.4957
 epoch: 78, train_loss: 0.8974, test_loss: 0.9934, test_f1: 0.5027
 epoch: 79, train_loss: 0.9006, test_loss: 1.0048, test_f1: 0.5074
 epoch: 80, train_loss: 0.8966, test_loss: 1.0061, test_f1: 0.5222
 epoch: 81, train_loss: 0.8918, test_loss: 1.0150, test_f1: 0.5077
 epoch: 82, train_loss: 0.8938, test_loss: 1.0277, test_f1: 0.4930
 epoch: 83, train_loss: 0.9052, test_loss: 1.0072, test_f1: 0.4990
 epoch: 84, train_loss: 0.8869, test_loss: 1.0134, test_f1: 0.5084
 epoch: 85, train_loss: 0.8839, test_loss: 1.0216, test_f1: 0.5058
 epoch: 86, train_loss: 0.8924, test_loss: 1.0158, test_f1: 0.4970
 epoch: 87, train_loss: 0.8854, test_loss: 1.0200, test_f1: 0.4969
 epoch: 88, train_loss: 0.8866, test_loss: 1.0114, test_f1: 0.5036
 epoch: 89, train_loss: 0.9020, test_loss: 1.0070, test_f1: 0.4956
 epoch: 90, train_loss: 0.8814, test_loss: 0.9857, test_f1: 0.5182
 epoch: 91, train_loss: 0.8843, test_loss: 1.0151, test_f1: 0.5132
 epoch: 92, train_loss: 0.8823, test_loss: 1.0062, test_f1: 0.5143
 epoch: 93, train_loss: 0.8782, test_loss: 1.0179, test_f1: 0.4964
 epoch: 94, train_loss: 0.8784, test_loss: 1.0165, test_f1: 0.5075
 epoch: 95, train_loss: 0.8780, test_loss: 1.0219, test_f1: 0.5045
 epoch: 96, train_loss: 0.8852, test_loss: 0.9956, test_f1: 0.5069
 epoch: 97, train_loss: 0.8710, test_loss: 0.9981, test_f1: 0.5067
 epoch: 98, train_loss: 0.8786, test_loss: 1.0007, test_f1: 0.5046
 epoch: 99, train_loss: 0.8808, test_loss: 1.0208, test_f1: 0.4938
##################ITERATION #1 ****************************************
 epoch: 0, train_loss: 1.3286, test_loss: 1.3092, test_f1: 0.2274
 epoch: 1, train_loss: 1.2835, test_loss: 1.2821, test_f1: 0.2274
 epoch: 2, train_loss: 1.2701, test_loss: 1.2556, test_f1: 0.2482
 epoch: 3, train_loss: 1.2515, test_loss: 1.2407, test_f1: 0.2653
 epoch: 4, train_loss: 1.2411, test_loss: 1.2173, test_f1: 0.2701
 epoch: 5, train_loss: 1.2278, test_loss: 1.2071, test_f1: 0.2799
 epoch: 6, train_loss: 1.2163, test_loss: 1.1873, test_f1: 0.3128
 epoch: 7, train_loss: 1.2063, test_loss: 1.1740, test_f1: 0.3529
 epoch: 8, train_loss: 1.1918, test_loss: 1.1558, test_f1: 0.4149
 epoch: 9, train_loss: 1.1808, test_loss: 1.1580, test_f1: 0.4211
 epoch: 10, train_loss: 1.1820, test_loss: 1.1452, test_f1: 0.4124
 epoch: 11, train_loss: 1.1630, test_loss: 1.1245, test_f1: 0.4072
 epoch: 12, train_loss: 1.1487, test_loss: 1.1412, test_f1: 0.3832
 epoch: 13, train_loss: 1.1477, test_loss: 1.1257, test_f1: 0.4288
 epoch: 14, train_loss: 1.1445, test_loss: 1.1282, test_f1: 0.4059
 epoch: 15, train_loss: 1.1338, test_loss: 1.1340, test_f1: 0.3879
 epoch: 16, train_loss: 1.1290, test_loss: 1.1193, test_f1: 0.4095
 epoch: 17, train_loss: 1.1194, test_loss: 1.1157, test_f1: 0.4118
 epoch: 18, train_loss: 1.1273, test_loss: 1.0858, test_f1: 0.4184
 epoch: 19, train_loss: 1.1187, test_loss: 1.0959, test_f1: 0.3954
 epoch: 20, train_loss: 1.1059, test_loss: 1.0865, test_f1: 0.3947
 epoch: 21, train_loss: 1.0995, test_loss: 1.0874, test_f1: 0.3968
 epoch: 22, train_loss: 1.0957, test_loss: 1.0651, test_f1: 0.4343
 epoch: 23, train_loss: 1.0950, test_loss: 1.0857, test_f1: 0.4131
 epoch: 24, train_loss: 1.0921, test_loss: 1.0673, test_f1: 0.4403
 epoch: 25, train_loss: 1.0925, test_loss: 1.0622, test_f1: 0.4467
 epoch: 26, train_loss: 1.0860, test_loss: 1.0794, test_f1: 0.4076
 epoch: 27, train_loss: 1.0774, test_loss: 1.0520, test_f1: 0.4513
 epoch: 28, train_loss: 1.0742, test_loss: 1.0492, test_f1: 0.4498
 epoch: 29, train_loss: 1.0682, test_loss: 1.0838, test_f1: 0.4184
 epoch: 30, train_loss: 1.0735, test_loss: 1.0273, test_f1: 0.4691
 epoch: 31, train_loss: 1.0748, test_loss: 1.0352, test_f1: 0.4473
 epoch: 32, train_loss: 1.0686, test_loss: 1.0348, test_f1: 0.4528
 epoch: 33, train_loss: 1.0542, test_loss: 1.0384, test_f1: 0.4527
 epoch: 34, train_loss: 1.0607, test_loss: 1.0244, test_f1: 0.4601
 epoch: 35, train_loss: 1.0508, test_loss: 1.0173, test_f1: 0.4856
 epoch: 36, train_loss: 1.0477, test_loss: 1.0173, test_f1: 0.4368
 epoch: 37, train_loss: 1.0516, test_loss: 1.0309, test_f1: 0.4404
 epoch: 38, train_loss: 1.0374, test_loss: 1.0333, test_f1: 0.4566
 epoch: 39, train_loss: 1.0381, test_loss: 1.0029, test_f1: 0.4812
 epoch: 40, train_loss: 1.0368, test_loss: 1.0195, test_f1: 0.4691
 epoch: 41, train_loss: 1.0274, test_loss: 1.0343, test_f1: 0.4505
 epoch: 42, train_loss: 1.0355, test_loss: 1.0235, test_f1: 0.4575
 epoch: 43, train_loss: 1.0341, test_loss: 1.0151, test_f1: 0.4634
 epoch: 44, train_loss: 1.0208, test_loss: 1.0223, test_f1: 0.4659
 epoch: 45, train_loss: 1.0205, test_loss: 0.9857, test_f1: 0.4862
 epoch: 46, train_loss: 1.0154, test_loss: 1.0116, test_f1: 0.4672
 epoch: 47, train_loss: 1.0106, test_loss: 1.0169, test_f1: 0.4660
 epoch: 48, train_loss: 1.0176, test_loss: 1.0152, test_f1: 0.4711
 epoch: 49, train_loss: 1.0152, test_loss: 0.9974, test_f1: 0.4678
 epoch: 50, train_loss: 1.0140, test_loss: 1.0235, test_f1: 0.4770
 epoch: 51, train_loss: 1.0047, test_loss: 0.9782, test_f1: 0.4842
 epoch: 52, train_loss: 0.9940, test_loss: 0.9750, test_f1: 0.4985
 epoch: 53, train_loss: 0.9890, test_loss: 0.9818, test_f1: 0.4909
 epoch: 54, train_loss: 0.9954, test_loss: 0.9720, test_f1: 0.4951
 epoch: 55, train_loss: 0.9912, test_loss: 0.9974, test_f1: 0.5014
 epoch: 56, train_loss: 0.9945, test_loss: 0.9985, test_f1: 0.5050
 epoch: 57, train_loss: 0.9903, test_loss: 0.9792, test_f1: 0.4937
 epoch: 58, train_loss: 0.9891, test_loss: 0.9723, test_f1: 0.5149
 epoch: 59, train_loss: 0.9978, test_loss: 0.9764, test_f1: 0.4944
 epoch: 60, train_loss: 0.9901, test_loss: 0.9795, test_f1: 0.4990
 epoch: 61, train_loss: 0.9948, test_loss: 0.9829, test_f1: 0.4819
 epoch: 62, train_loss: 0.9798, test_loss: 0.9729, test_f1: 0.4879
 epoch: 63, train_loss: 0.9825, test_loss: 0.9828, test_f1: 0.4672
 epoch: 64, train_loss: 0.9870, test_loss: 0.9986, test_f1: 0.4880
 epoch: 65, train_loss: 0.9808, test_loss: 0.9776, test_f1: 0.4831
 epoch: 66, train_loss: 0.9815, test_loss: 0.9708, test_f1: 0.5192
 epoch: 67, train_loss: 0.9847, test_loss: 0.9654, test_f1: 0.4983
 epoch: 68, train_loss: 0.9806, test_loss: 0.9770, test_f1: 0.4959
 epoch: 69, train_loss: 0.9816, test_loss: 0.9927, test_f1: 0.4727
 epoch: 70, train_loss: 0.9758, test_loss: 0.9885, test_f1: 0.4670
 epoch: 71, train_loss: 0.9700, test_loss: 0.9722, test_f1: 0.4888
 epoch: 72, train_loss: 0.9729, test_loss: 0.9929, test_f1: 0.4832
 epoch: 73, train_loss: 0.9757, test_loss: 0.9828, test_f1: 0.4923
 epoch: 74, train_loss: 0.9676, test_loss: 0.9792, test_f1: 0.4889
 epoch: 75, train_loss: 0.9809, test_loss: 0.9834, test_f1: 0.4739
 epoch: 76, train_loss: 0.9701, test_loss: 0.9672, test_f1: 0.4888
 epoch: 77, train_loss: 0.9715, test_loss: 0.9766, test_f1: 0.5025
 epoch: 78, train_loss: 0.9750, test_loss: 0.9962, test_f1: 0.4835
 epoch: 79, train_loss: 0.9621, test_loss: 0.9854, test_f1: 0.4853
 epoch: 80, train_loss: 0.9512, test_loss: 0.9827, test_f1: 0.4714
 epoch: 81, train_loss: 0.9636, test_loss: 0.9789, test_f1: 0.4917
 epoch: 82, train_loss: 0.9666, test_loss: 0.9916, test_f1: 0.4889
 epoch: 83, train_loss: 0.9580, test_loss: 0.9727, test_f1: 0.4750
 epoch: 84, train_loss: 0.9644, test_loss: 0.9936, test_f1: 0.4940
 epoch: 85, train_loss: 0.9661, test_loss: 0.9986, test_f1: 0.4746
 epoch: 86, train_loss: 0.9624, test_loss: 0.9947, test_f1: 0.4810
 epoch: 87, train_loss: 0.9684, test_loss: 0.9922, test_f1: 0.4778
 epoch: 88, train_loss: 0.9548, test_loss: 1.0094, test_f1: 0.4846
 epoch: 89, train_loss: 0.9602, test_loss: 0.9842, test_f1: 0.4744
 epoch: 90, train_loss: 0.9607, test_loss: 1.0202, test_f1: 0.4618
 epoch: 91, train_loss: 0.9580, test_loss: 1.0253, test_f1: 0.4722
 epoch: 92, train_loss: 0.9559, test_loss: 0.9990, test_f1: 0.4875
 epoch: 93, train_loss: 0.9530, test_loss: 0.9982, test_f1: 0.4597
 epoch: 94, train_loss: 0.9621, test_loss: 1.0260, test_f1: 0.4605
 epoch: 95, train_loss: 0.9537, test_loss: 1.0107, test_f1: 0.4855
 epoch: 96, train_loss: 0.9541, test_loss: 1.0229, test_f1: 0.4810
 epoch: 97, train_loss: 0.9554, test_loss: 0.9853, test_f1: 0.4769
 epoch: 98, train_loss: 0.9580, test_loss: 0.9971, test_f1: 0.4722
 epoch: 99, train_loss: 0.9478, test_loss: 0.9973, test_f1: 0.4924
##################ITERATION #2 ****************************************
 epoch: 0, train_loss: 1.3498, test_loss: 1.2915, test_f1: 0.2274
 epoch: 1, train_loss: 1.2727, test_loss: 1.2567, test_f1: 0.2555
 epoch: 2, train_loss: 1.2508, test_loss: 1.2234, test_f1: 0.2557
 epoch: 3, train_loss: 1.2383, test_loss: 1.2122, test_f1: 0.2557
 epoch: 4, train_loss: 1.2345, test_loss: 1.2086, test_f1: 0.2657
 epoch: 5, train_loss: 1.2237, test_loss: 1.2040, test_f1: 0.2658
 epoch: 6, train_loss: 1.2214, test_loss: 1.1995, test_f1: 0.2753
 epoch: 7, train_loss: 1.2110, test_loss: 1.1969, test_f1: 0.2868
 epoch: 8, train_loss: 1.2064, test_loss: 1.1916, test_f1: 0.2988
 epoch: 9, train_loss: 1.1983, test_loss: 1.1909, test_f1: 0.3228
 epoch: 10, train_loss: 1.1913, test_loss: 1.1831, test_f1: 0.3446
 epoch: 11, train_loss: 1.1834, test_loss: 1.1717, test_f1: 0.3478
 epoch: 12, train_loss: 1.1791, test_loss: 1.1650, test_f1: 0.3874
 epoch: 13, train_loss: 1.1742, test_loss: 1.1587, test_f1: 0.3913
 epoch: 14, train_loss: 1.1637, test_loss: 1.1581, test_f1: 0.4042
 epoch: 15, train_loss: 1.1677, test_loss: 1.1496, test_f1: 0.4088
 epoch: 16, train_loss: 1.1525, test_loss: 1.1391, test_f1: 0.4045
 epoch: 17, train_loss: 1.1373, test_loss: 1.1460, test_f1: 0.3889
 epoch: 18, train_loss: 1.1330, test_loss: 1.1433, test_f1: 0.4144
 epoch: 19, train_loss: 1.1288, test_loss: 1.1251, test_f1: 0.4306
 epoch: 20, train_loss: 1.1353, test_loss: 1.1131, test_f1: 0.4215
 epoch: 21, train_loss: 1.1195, test_loss: 1.1190, test_f1: 0.4259
 epoch: 22, train_loss: 1.1086, test_loss: 1.1045, test_f1: 0.4154
 epoch: 23, train_loss: 1.1056, test_loss: 1.0915, test_f1: 0.4369
 epoch: 24, train_loss: 1.1055, test_loss: 1.0848, test_f1: 0.4476
 epoch: 25, train_loss: 1.0950, test_loss: 1.0883, test_f1: 0.4611
 epoch: 26, train_loss: 1.0774, test_loss: 1.0720, test_f1: 0.4586
 epoch: 27, train_loss: 1.0806, test_loss: 1.0888, test_f1: 0.4449
 epoch: 28, train_loss: 1.0695, test_loss: 1.0656, test_f1: 0.4640
 epoch: 29, train_loss: 1.0630, test_loss: 1.0542, test_f1: 0.4753
 epoch: 30, train_loss: 1.0547, test_loss: 1.0752, test_f1: 0.4501
 epoch: 31, train_loss: 1.0594, test_loss: 1.0336, test_f1: 0.4605
 epoch: 32, train_loss: 1.0450, test_loss: 1.0517, test_f1: 0.4668
 epoch: 33, train_loss: 1.0492, test_loss: 1.0288, test_f1: 0.4686
 epoch: 34, train_loss: 1.0332, test_loss: 1.0258, test_f1: 0.4875
 epoch: 35, train_loss: 1.0247, test_loss: 1.0181, test_f1: 0.4910
 epoch: 36, train_loss: 1.0171, test_loss: 1.0489, test_f1: 0.4424
 epoch: 37, train_loss: 1.0301, test_loss: 1.0205, test_f1: 0.4949
 epoch: 38, train_loss: 1.0117, test_loss: 1.0236, test_f1: 0.4940
 epoch: 39, train_loss: 1.0171, test_loss: 1.0290, test_f1: 0.4561
 epoch: 40, train_loss: 1.0200, test_loss: 1.0184, test_f1: 0.4890
 epoch: 41, train_loss: 1.0068, test_loss: 1.0106, test_f1: 0.4448
 epoch: 42, train_loss: 0.9955, test_loss: 1.0246, test_f1: 0.4577
 epoch: 43, train_loss: 1.0064, test_loss: 1.0031, test_f1: 0.4643
 epoch: 44, train_loss: 1.0045, test_loss: 1.0192, test_f1: 0.4707
 epoch: 45, train_loss: 0.9897, test_loss: 1.0193, test_f1: 0.4467
 epoch: 46, train_loss: 0.9938, test_loss: 1.0289, test_f1: 0.4574
 epoch: 47, train_loss: 0.9933, test_loss: 1.0667, test_f1: 0.4794
 epoch: 48, train_loss: 0.9882, test_loss: 1.0174, test_f1: 0.4732
 epoch: 49, train_loss: 0.9801, test_loss: 1.0197, test_f1: 0.4782
 epoch: 50, train_loss: 0.9864, test_loss: 1.0399, test_f1: 0.4766
 epoch: 51, train_loss: 0.9611, test_loss: 1.0355, test_f1: 0.4767
 epoch: 52, train_loss: 0.9616, test_loss: 1.0236, test_f1: 0.4676
 epoch: 53, train_loss: 0.9529, test_loss: 1.0314, test_f1: 0.4871
 epoch: 54, train_loss: 0.9606, test_loss: 1.0210, test_f1: 0.4895
 epoch: 55, train_loss: 0.9620, test_loss: 1.0025, test_f1: 0.4651
 epoch: 56, train_loss: 0.9650, test_loss: 1.0388, test_f1: 0.4777
 epoch: 57, train_loss: 0.9568, test_loss: 1.0697, test_f1: 0.4761
 epoch: 58, train_loss: 0.9610, test_loss: 1.0382, test_f1: 0.4767
 epoch: 59, train_loss: 0.9534, test_loss: 1.0319, test_f1: 0.4749
 epoch: 60, train_loss: 0.9413, test_loss: 1.0450, test_f1: 0.4655
 epoch: 61, train_loss: 0.9534, test_loss: 1.0342, test_f1: 0.4791
 epoch: 62, train_loss: 0.9446, test_loss: 1.0189, test_f1: 0.4689
 epoch: 63, train_loss: 0.9568, test_loss: 1.0131, test_f1: 0.4724
 epoch: 64, train_loss: 0.9396, test_loss: 1.0256, test_f1: 0.4737
 epoch: 65, train_loss: 0.9362, test_loss: 1.0280, test_f1: 0.4835
 epoch: 66, train_loss: 0.9311, test_loss: 1.0127, test_f1: 0.4739
 epoch: 67, train_loss: 0.9436, test_loss: 1.0164, test_f1: 0.4644
 epoch: 68, train_loss: 0.9299, test_loss: 1.0266, test_f1: 0.4775
 epoch: 69, train_loss: 0.9303, test_loss: 1.0389, test_f1: 0.4763
 epoch: 70, train_loss: 0.9478, test_loss: 1.0424, test_f1: 0.4866
 epoch: 71, train_loss: 0.9459, test_loss: 1.0037, test_f1: 0.4704
 epoch: 72, train_loss: 0.9389, test_loss: 1.0490, test_f1: 0.4607
 epoch: 73, train_loss: 0.9291, test_loss: 1.0570, test_f1: 0.4630
 epoch: 74, train_loss: 0.9329, test_loss: 1.0609, test_f1: 0.4657
 epoch: 75, train_loss: 0.9284, test_loss: 1.0443, test_f1: 0.4758
 epoch: 76, train_loss: 0.9247, test_loss: 1.0515, test_f1: 0.4665
 epoch: 77, train_loss: 0.9372, test_loss: 1.0672, test_f1: 0.4656
 epoch: 78, train_loss: 0.9208, test_loss: 1.0706, test_f1: 0.4467
 epoch: 79, train_loss: 0.9334, test_loss: 1.0500, test_f1: 0.4612
 epoch: 80, train_loss: 0.9203, test_loss: 1.0676, test_f1: 0.4662
 epoch: 81, train_loss: 0.9212, test_loss: 1.0452, test_f1: 0.4711
 epoch: 82, train_loss: 0.9239, test_loss: 1.0438, test_f1: 0.4788
 epoch: 83, train_loss: 0.9193, test_loss: 1.0588, test_f1: 0.4704
 epoch: 84, train_loss: 0.9226, test_loss: 1.0636, test_f1: 0.4545
 epoch: 85, train_loss: 0.9308, test_loss: 1.0585, test_f1: 0.4776
 epoch: 86, train_loss: 0.9218, test_loss: 1.0666, test_f1: 0.4599
 epoch: 87, train_loss: 0.9016, test_loss: 1.0670, test_f1: 0.4788
 epoch: 88, train_loss: 0.9211, test_loss: 1.1092, test_f1: 0.4542
 epoch: 89, train_loss: 0.9024, test_loss: 1.0568, test_f1: 0.4652
 epoch: 90, train_loss: 0.8927, test_loss: 1.0936, test_f1: 0.4671
 epoch: 91, train_loss: 0.9227, test_loss: 1.0650, test_f1: 0.4676
 epoch: 92, train_loss: 0.9106, test_loss: 1.0646, test_f1: 0.4632
 epoch: 93, train_loss: 0.9012, test_loss: 1.1090, test_f1: 0.4701
 epoch: 94, train_loss: 0.8988, test_loss: 1.1073, test_f1: 0.4715
 epoch: 95, train_loss: 0.9015, test_loss: 1.0775, test_f1: 0.4733
 epoch: 96, train_loss: 0.8978, test_loss: 1.0738, test_f1: 0.4541
 epoch: 97, train_loss: 0.8895, test_loss: 1.0717, test_f1: 0.4787
 epoch: 98, train_loss: 0.8991, test_loss: 1.0790, test_f1: 0.4756
 epoch: 99, train_loss: 0.8965, test_loss: 1.1012, test_f1: 0.4599
##################ITERATION #3 ****************************************
 epoch: 0, train_loss: 1.5057, test_loss: 1.2928, test_f1: 0.2274
 epoch: 1, train_loss: 1.2977, test_loss: 1.2698, test_f1: 0.2399
 epoch: 2, train_loss: 1.2709, test_loss: 1.2536, test_f1: 0.2308
 epoch: 3, train_loss: 1.2600, test_loss: 1.2365, test_f1: 0.2303
 epoch: 4, train_loss: 1.2530, test_loss: 1.2254, test_f1: 0.2330
 epoch: 5, train_loss: 1.2421, test_loss: 1.2179, test_f1: 0.2872
 epoch: 6, train_loss: 1.2368, test_loss: 1.2045, test_f1: 0.2541
 epoch: 7, train_loss: 1.2217, test_loss: 1.2059, test_f1: 0.2475
 epoch: 8, train_loss: 1.2168, test_loss: 1.1841, test_f1: 0.3444
 epoch: 9, train_loss: 1.2148, test_loss: 1.1869, test_f1: 0.3152
 epoch: 10, train_loss: 1.2013, test_loss: 1.1650, test_f1: 0.3553
 epoch: 11, train_loss: 1.1898, test_loss: 1.1621, test_f1: 0.3499
 epoch: 12, train_loss: 1.1879, test_loss: 1.1628, test_f1: 0.3720
 epoch: 13, train_loss: 1.1776, test_loss: 1.1650, test_f1: 0.3534
 epoch: 14, train_loss: 1.1655, test_loss: 1.1333, test_f1: 0.3660
 epoch: 15, train_loss: 1.1684, test_loss: 1.1423, test_f1: 0.3855
 epoch: 16, train_loss: 1.1552, test_loss: 1.1135, test_f1: 0.3937
 epoch: 17, train_loss: 1.1464, test_loss: 1.0997, test_f1: 0.3924
 epoch: 18, train_loss: 1.1257, test_loss: 1.1055, test_f1: 0.3866
 epoch: 19, train_loss: 1.1180, test_loss: 1.0909, test_f1: 0.4098
 epoch: 20, train_loss: 1.1083, test_loss: 1.0657, test_f1: 0.4403
 epoch: 21, train_loss: 1.0944, test_loss: 1.0561, test_f1: 0.4325
 epoch: 22, train_loss: 1.0805, test_loss: 1.0612, test_f1: 0.4270
 epoch: 23, train_loss: 1.0788, test_loss: 1.0551, test_f1: 0.4404
 epoch: 24, train_loss: 1.0770, test_loss: 1.0491, test_f1: 0.4508
 epoch: 25, train_loss: 1.0744, test_loss: 1.0889, test_f1: 0.4115
 epoch: 26, train_loss: 1.0786, test_loss: 1.0443, test_f1: 0.4379
 epoch: 27, train_loss: 1.0616, test_loss: 1.0483, test_f1: 0.4689
 epoch: 28, train_loss: 1.0717, test_loss: 1.0484, test_f1: 0.4515
 epoch: 29, train_loss: 1.0508, test_loss: 1.0390, test_f1: 0.4592
 epoch: 30, train_loss: 1.0505, test_loss: 1.0241, test_f1: 0.4652
 epoch: 31, train_loss: 1.0437, test_loss: 1.0477, test_f1: 0.4367
 epoch: 32, train_loss: 1.0371, test_loss: 1.0464, test_f1: 0.4434
 epoch: 33, train_loss: 1.0347, test_loss: 1.0545, test_f1: 0.4794
 epoch: 34, train_loss: 1.0379, test_loss: 1.0474, test_f1: 0.4573
 epoch: 35, train_loss: 1.0259, test_loss: 1.0477, test_f1: 0.4457
 epoch: 36, train_loss: 1.0241, test_loss: 1.0564, test_f1: 0.4574
 epoch: 37, train_loss: 1.0143, test_loss: 1.1009, test_f1: 0.4546
 epoch: 38, train_loss: 1.0230, test_loss: 1.1041, test_f1: 0.4470
 epoch: 39, train_loss: 1.0227, test_loss: 1.0163, test_f1: 0.4640
 epoch: 40, train_loss: 1.0125, test_loss: 1.0378, test_f1: 0.4657
 epoch: 41, train_loss: 1.0148, test_loss: 1.0609, test_f1: 0.4435
 epoch: 42, train_loss: 1.0098, test_loss: 1.0738, test_f1: 0.4612
 epoch: 43, train_loss: 1.0039, test_loss: 1.0507, test_f1: 0.4781
 epoch: 44, train_loss: 1.0068, test_loss: 1.0606, test_f1: 0.4653
 epoch: 45, train_loss: 1.0035, test_loss: 1.0563, test_f1: 0.4460
 epoch: 46, train_loss: 1.0002, test_loss: 1.0584, test_f1: 0.4472
 epoch: 47, train_loss: 0.9913, test_loss: 1.0663, test_f1: 0.4769
 epoch: 48, train_loss: 1.0081, test_loss: 1.0379, test_f1: 0.4542
 epoch: 49, train_loss: 0.9839, test_loss: 1.0663, test_f1: 0.4615
 epoch: 50, train_loss: 0.9837, test_loss: 1.0712, test_f1: 0.4538
 epoch: 51, train_loss: 0.9781, test_loss: 1.0562, test_f1: 0.4702
 epoch: 52, train_loss: 0.9682, test_loss: 1.0677, test_f1: 0.4668
 epoch: 53, train_loss: 0.9656, test_loss: 1.0761, test_f1: 0.4604
 epoch: 54, train_loss: 0.9636, test_loss: 1.0865, test_f1: 0.4709
 epoch: 55, train_loss: 0.9672, test_loss: 1.0765, test_f1: 0.4698
 epoch: 56, train_loss: 0.9663, test_loss: 1.0869, test_f1: 0.4556
 epoch: 57, train_loss: 0.9664, test_loss: 1.0471, test_f1: 0.4796
 epoch: 58, train_loss: 0.9544, test_loss: 1.0793, test_f1: 0.4561
 epoch: 59, train_loss: 0.9643, test_loss: 1.0898, test_f1: 0.4499
 epoch: 60, train_loss: 0.9576, test_loss: 1.0728, test_f1: 0.4725
 epoch: 61, train_loss: 0.9405, test_loss: 1.0826, test_f1: 0.4656
 epoch: 62, train_loss: 0.9568, test_loss: 1.0899, test_f1: 0.4753
 epoch: 63, train_loss: 0.9530, test_loss: 1.1276, test_f1: 0.4703
 epoch: 64, train_loss: 0.9591, test_loss: 1.0616, test_f1: 0.4693
 epoch: 65, train_loss: 0.9516, test_loss: 1.0699, test_f1: 0.4793
 epoch: 66, train_loss: 0.9559, test_loss: 1.0848, test_f1: 0.4692
 epoch: 67, train_loss: 0.9507, test_loss: 1.0860, test_f1: 0.4713
 epoch: 68, train_loss: 0.9357, test_loss: 1.0746, test_f1: 0.4804
 epoch: 69, train_loss: 0.9502, test_loss: 1.0896, test_f1: 0.4738
 epoch: 70, train_loss: 0.9500, test_loss: 1.0877, test_f1: 0.4671
 epoch: 71, train_loss: 0.9393, test_loss: 1.0569, test_f1: 0.4703
 epoch: 72, train_loss: 0.9387, test_loss: 1.0823, test_f1: 0.4709
 epoch: 73, train_loss: 0.9384, test_loss: 1.0666, test_f1: 0.4631
 epoch: 74, train_loss: 0.9446, test_loss: 1.1404, test_f1: 0.4639
 epoch: 75, train_loss: 0.9344, test_loss: 1.1296, test_f1: 0.4472
 epoch: 76, train_loss: 0.9515, test_loss: 1.0937, test_f1: 0.4564
 epoch: 77, train_loss: 0.9357, test_loss: 1.1101, test_f1: 0.4452
 epoch: 78, train_loss: 0.9286, test_loss: 1.1447, test_f1: 0.4495
 epoch: 79, train_loss: 0.9361, test_loss: 1.1033, test_f1: 0.4581
 epoch: 80, train_loss: 0.9318, test_loss: 1.1741, test_f1: 0.4352
 epoch: 81, train_loss: 0.9252, test_loss: 1.1114, test_f1: 0.4618
 epoch: 82, train_loss: 0.9266, test_loss: 1.1073, test_f1: 0.4575
 epoch: 83, train_loss: 0.9316, test_loss: 1.1279, test_f1: 0.4520
 epoch: 84, train_loss: 0.9366, test_loss: 1.1627, test_f1: 0.4388
 epoch: 85, train_loss: 0.9340, test_loss: 1.1092, test_f1: 0.4394
 epoch: 86, train_loss: 0.9256, test_loss: 1.1394, test_f1: 0.4419
 epoch: 87, train_loss: 0.9353, test_loss: 1.1326, test_f1: 0.4559
 epoch: 88, train_loss: 0.9167, test_loss: 1.1861, test_f1: 0.4295
 epoch: 89, train_loss: 0.9311, test_loss: 1.1238, test_f1: 0.4603
 epoch: 90, train_loss: 0.9233, test_loss: 1.1146, test_f1: 0.4552
 epoch: 91, train_loss: 0.9232, test_loss: 1.2083, test_f1: 0.4460
 epoch: 92, train_loss: 0.9214, test_loss: 1.1310, test_f1: 0.4241
 epoch: 93, train_loss: 0.9228, test_loss: 1.1090, test_f1: 0.4701
 epoch: 94, train_loss: 0.9247, test_loss: 1.1148, test_f1: 0.4541
 epoch: 95, train_loss: 0.9210, test_loss: 1.1134, test_f1: 0.4478
 epoch: 96, train_loss: 0.9179, test_loss: 1.2630, test_f1: 0.4348
 epoch: 97, train_loss: 0.9140, test_loss: 1.1206, test_f1: 0.4636
 epoch: 98, train_loss: 0.9246, test_loss: 1.1320, test_f1: 0.4409
 epoch: 99, train_loss: 0.9111, test_loss: 1.1168, test_f1: 0.4510
##################ITERATION #4 ****************************************
 epoch: 0, train_loss: 1.3341, test_loss: 1.2832, test_f1: 0.2274
 epoch: 1, train_loss: 1.2551, test_loss: 1.2280, test_f1: 0.2857
 epoch: 2, train_loss: 1.2327, test_loss: 1.1843, test_f1: 0.3128
 epoch: 3, train_loss: 1.2150, test_loss: 1.1714, test_f1: 0.3453
 epoch: 4, train_loss: 1.2007, test_loss: 1.1552, test_f1: 0.3855
 epoch: 5, train_loss: 1.1846, test_loss: 1.1312, test_f1: 0.3906
 epoch: 6, train_loss: 1.1901, test_loss: 1.1268, test_f1: 0.4047
 epoch: 7, train_loss: 1.1557, test_loss: 1.1068, test_f1: 0.3973
 epoch: 8, train_loss: 1.1585, test_loss: 1.0933, test_f1: 0.4168
 epoch: 9, train_loss: 1.1443, test_loss: 1.0798, test_f1: 0.4324
 epoch: 10, train_loss: 1.1310, test_loss: 1.0753, test_f1: 0.4125
 epoch: 11, train_loss: 1.1266, test_loss: 1.0614, test_f1: 0.4212
 epoch: 12, train_loss: 1.1201, test_loss: 1.0509, test_f1: 0.4456
 epoch: 13, train_loss: 1.0995, test_loss: 1.0436, test_f1: 0.4518
 epoch: 14, train_loss: 1.0968, test_loss: 1.0343, test_f1: 0.4173
 epoch: 15, train_loss: 1.0850, test_loss: 1.0134, test_f1: 0.4639
 epoch: 16, train_loss: 1.0820, test_loss: 1.0234, test_f1: 0.4259
 epoch: 17, train_loss: 1.0670, test_loss: 0.9923, test_f1: 0.4597
 epoch: 18, train_loss: 1.0510, test_loss: 0.9959, test_f1: 0.4628
 epoch: 19, train_loss: 1.0572, test_loss: 0.9891, test_f1: 0.4461
 epoch: 20, train_loss: 1.0381, test_loss: 0.9709, test_f1: 0.4898
 epoch: 21, train_loss: 1.0258, test_loss: 0.9788, test_f1: 0.4625
 epoch: 22, train_loss: 1.0131, test_loss: 0.9729, test_f1: 0.5043
 epoch: 23, train_loss: 1.0171, test_loss: 0.9738, test_f1: 0.4810
 epoch: 24, train_loss: 1.0193, test_loss: 0.9613, test_f1: 0.4812
 epoch: 25, train_loss: 1.0104, test_loss: 0.9496, test_f1: 0.4851
 epoch: 26, train_loss: 1.0119, test_loss: 0.9599, test_f1: 0.4977
 epoch: 27, train_loss: 0.9917, test_loss: 0.9414, test_f1: 0.5092
 epoch: 28, train_loss: 0.9856, test_loss: 0.9542, test_f1: 0.4938
 epoch: 29, train_loss: 0.9932, test_loss: 0.9424, test_f1: 0.4920
 epoch: 30, train_loss: 0.9686, test_loss: 0.9379, test_f1: 0.4908
 epoch: 31, train_loss: 0.9775, test_loss: 0.9324, test_f1: 0.5007
 epoch: 32, train_loss: 0.9726, test_loss: 0.9386, test_f1: 0.4616
 epoch: 33, train_loss: 0.9697, test_loss: 0.9244, test_f1: 0.4831
 epoch: 34, train_loss: 0.9545, test_loss: 0.9158, test_f1: 0.4873
 epoch: 35, train_loss: 0.9583, test_loss: 0.9410, test_f1: 0.4743
 epoch: 36, train_loss: 0.9553, test_loss: 0.9211, test_f1: 0.5090
 epoch: 37, train_loss: 0.9611, test_loss: 0.9230, test_f1: 0.5202
 epoch: 38, train_loss: 0.9433, test_loss: 0.9298, test_f1: 0.5135
 epoch: 39, train_loss: 0.9450, test_loss: 0.9222, test_f1: 0.4900
 epoch: 40, train_loss: 0.9371, test_loss: 0.9226, test_f1: 0.5107
 epoch: 41, train_loss: 0.9340, test_loss: 0.9263, test_f1: 0.5164
 epoch: 42, train_loss: 0.9332, test_loss: 0.9428, test_f1: 0.5108
 epoch: 43, train_loss: 0.9244, test_loss: 0.9172, test_f1: 0.5068
 epoch: 44, train_loss: 0.9266, test_loss: 0.9446, test_f1: 0.4915
 epoch: 45, train_loss: 0.9207, test_loss: 0.9363, test_f1: 0.5086
 epoch: 46, train_loss: 0.9379, test_loss: 0.9451, test_f1: 0.5006
 epoch: 47, train_loss: 0.9098, test_loss: 0.9084, test_f1: 0.5134
 epoch: 48, train_loss: 0.9320, test_loss: 0.9502, test_f1: 0.5002
 epoch: 49, train_loss: 0.9184, test_loss: 0.9190, test_f1: 0.5037
 epoch: 50, train_loss: 0.9327, test_loss: 0.9316, test_f1: 0.5022
 epoch: 51, train_loss: 0.9074, test_loss: 0.9469, test_f1: 0.4966
 epoch: 52, train_loss: 0.9019, test_loss: 0.9282, test_f1: 0.5163
 epoch: 53, train_loss: 0.9046, test_loss: 0.9285, test_f1: 0.5100
 epoch: 54, train_loss: 0.9016, test_loss: 0.9394, test_f1: 0.5069
 epoch: 55, train_loss: 0.8953, test_loss: 0.9383, test_f1: 0.5053
 epoch: 56, train_loss: 0.8941, test_loss: 0.9230, test_f1: 0.5093
 epoch: 57, train_loss: 0.8861, test_loss: 0.9536, test_f1: 0.5006
 epoch: 58, train_loss: 0.9004, test_loss: 0.9206, test_f1: 0.5165
 epoch: 59, train_loss: 0.8868, test_loss: 0.9395, test_f1: 0.5043
 epoch: 60, train_loss: 0.8839, test_loss: 0.9376, test_f1: 0.5023
 epoch: 61, train_loss: 0.8909, test_loss: 0.9521, test_f1: 0.5160
 epoch: 62, train_loss: 0.9052, test_loss: 0.9448, test_f1: 0.5049
 epoch: 63, train_loss: 0.8897, test_loss: 0.9413, test_f1: 0.5087
 epoch: 64, train_loss: 0.8779, test_loss: 0.9323, test_f1: 0.5215
 epoch: 65, train_loss: 0.8853, test_loss: 0.9289, test_f1: 0.5127
 epoch: 66, train_loss: 0.8774, test_loss: 0.9451, test_f1: 0.5109
 epoch: 67, train_loss: 0.8804, test_loss: 0.9438, test_f1: 0.5128
 epoch: 68, train_loss: 0.8852, test_loss: 0.9316, test_f1: 0.5183
 epoch: 69, train_loss: 0.8787, test_loss: 0.9562, test_f1: 0.5146
 epoch: 70, train_loss: 0.8756, test_loss: 0.9534, test_f1: 0.4992
 epoch: 71, train_loss: 0.8844, test_loss: 0.9609, test_f1: 0.5167
 epoch: 72, train_loss: 0.8815, test_loss: 0.9314, test_f1: 0.5152
 epoch: 73, train_loss: 0.8795, test_loss: 0.9515, test_f1: 0.5132
 epoch: 74, train_loss: 0.8734, test_loss: 0.9265, test_f1: 0.5153
 epoch: 75, train_loss: 0.8776, test_loss: 0.9352, test_f1: 0.5159
 epoch: 76, train_loss: 0.8695, test_loss: 0.9478, test_f1: 0.5071
 epoch: 77, train_loss: 0.8871, test_loss: 0.9244, test_f1: 0.5186
 epoch: 78, train_loss: 0.8655, test_loss: 0.9571, test_f1: 0.5126
 epoch: 79, train_loss: 0.8661, test_loss: 0.9452, test_f1: 0.5096
 epoch: 80, train_loss: 0.8780, test_loss: 0.9484, test_f1: 0.5083
 epoch: 81, train_loss: 0.8574, test_loss: 0.9418, test_f1: 0.5156
 epoch: 82, train_loss: 0.8624, test_loss: 0.9402, test_f1: 0.5012
 epoch: 83, train_loss: 0.8583, test_loss: 0.9398, test_f1: 0.5047
 epoch: 84, train_loss: 0.8822, test_loss: 0.9676, test_f1: 0.5035
 epoch: 85, train_loss: 0.8665, test_loss: 0.9835, test_f1: 0.4965
 epoch: 86, train_loss: 0.8596, test_loss: 0.9351, test_f1: 0.4970
 epoch: 87, train_loss: 0.8529, test_loss: 0.9486, test_f1: 0.5038
 epoch: 88, train_loss: 0.8608, test_loss: 0.9569, test_f1: 0.4955
 epoch: 89, train_loss: 0.8475, test_loss: 0.9754, test_f1: 0.4885
 epoch: 90, train_loss: 0.8670, test_loss: 0.9462, test_f1: 0.5142
 epoch: 91, train_loss: 0.8504, test_loss: 0.9873, test_f1: 0.5103
 epoch: 92, train_loss: 0.8673, test_loss: 0.9806, test_f1: 0.5016
 epoch: 93, train_loss: 0.8601, test_loss: 0.9555, test_f1: 0.5218
 epoch: 94, train_loss: 0.8629, test_loss: 0.9277, test_f1: 0.5234
 epoch: 95, train_loss: 0.8451, test_loss: 0.9641, test_f1: 0.5079
 epoch: 96, train_loss: 0.8517, test_loss: 0.9699, test_f1: 0.5116
 epoch: 97, train_loss: 0.8519, test_loss: 0.9765, test_f1: 0.5116
 epoch: 98, train_loss: 0.8457, test_loss: 0.9597, test_f1: 0.5032
 epoch: 99, train_loss: 0.8586, test_loss: 0.9696, test_f1: 0.4862
##################ITERATION #5 ****************************************
 epoch: 0, train_loss: 1.4073, test_loss: 1.2857, test_f1: 0.2417
 epoch: 1, train_loss: 1.2951, test_loss: 1.2350, test_f1: 0.2912
 epoch: 2, train_loss: 1.2641, test_loss: 1.2129, test_f1: 0.3036
 epoch: 3, train_loss: 1.2404, test_loss: 1.1928, test_f1: 0.3118
 epoch: 4, train_loss: 1.2321, test_loss: 1.1867, test_f1: 0.3178
 epoch: 5, train_loss: 1.2222, test_loss: 1.1779, test_f1: 0.3325
 epoch: 6, train_loss: 1.2157, test_loss: 1.1612, test_f1: 0.3330
 epoch: 7, train_loss: 1.2137, test_loss: 1.1505, test_f1: 0.3361
 epoch: 8, train_loss: 1.2037, test_loss: 1.1461, test_f1: 0.3891
 epoch: 9, train_loss: 1.1951, test_loss: 1.1370, test_f1: 0.3666
 epoch: 10, train_loss: 1.1836, test_loss: 1.1219, test_f1: 0.3921
 epoch: 11, train_loss: 1.1741, test_loss: 1.1183, test_f1: 0.3736
 epoch: 12, train_loss: 1.1759, test_loss: 1.1097, test_f1: 0.3800
 epoch: 13, train_loss: 1.1634, test_loss: 1.1007, test_f1: 0.4164
 epoch: 14, train_loss: 1.1592, test_loss: 1.0949, test_f1: 0.4164
 epoch: 15, train_loss: 1.1532, test_loss: 1.0848, test_f1: 0.4257
 epoch: 16, train_loss: 1.1482, test_loss: 1.0709, test_f1: 0.4449
 epoch: 17, train_loss: 1.1362, test_loss: 1.0615, test_f1: 0.4489
 epoch: 18, train_loss: 1.1304, test_loss: 1.0481, test_f1: 0.4618
 epoch: 19, train_loss: 1.1201, test_loss: 1.0450, test_f1: 0.4530
 epoch: 20, train_loss: 1.1143, test_loss: 1.0242, test_f1: 0.4754
 epoch: 21, train_loss: 1.1037, test_loss: 1.0229, test_f1: 0.4431
 epoch: 22, train_loss: 1.1083, test_loss: 1.0010, test_f1: 0.5003
 epoch: 23, train_loss: 1.0908, test_loss: 0.9957, test_f1: 0.4592
 epoch: 24, train_loss: 1.0846, test_loss: 0.9904, test_f1: 0.4770
 epoch: 25, train_loss: 1.0736, test_loss: 0.9757, test_f1: 0.4762
 epoch: 26, train_loss: 1.0771, test_loss: 0.9894, test_f1: 0.4665
 epoch: 27, train_loss: 1.0624, test_loss: 0.9971, test_f1: 0.4543
 epoch: 28, train_loss: 1.0556, test_loss: 0.9832, test_f1: 0.4656
 epoch: 29, train_loss: 1.0442, test_loss: 0.9634, test_f1: 0.4743
 epoch: 30, train_loss: 1.0474, test_loss: 0.9593, test_f1: 0.4756
 epoch: 31, train_loss: 1.0366, test_loss: 0.9573, test_f1: 0.4746
 epoch: 32, train_loss: 1.0270, test_loss: 0.9397, test_f1: 0.4693
 epoch: 33, train_loss: 1.0337, test_loss: 0.9514, test_f1: 0.4834
 epoch: 34, train_loss: 1.0320, test_loss: 0.9806, test_f1: 0.4577
 epoch: 35, train_loss: 1.0323, test_loss: 0.9401, test_f1: 0.4771
 epoch: 36, train_loss: 1.0059, test_loss: 0.9591, test_f1: 0.4716
 epoch: 37, train_loss: 1.0209, test_loss: 0.9517, test_f1: 0.4764
 epoch: 38, train_loss: 0.9989, test_loss: 0.9426, test_f1: 0.4764
 epoch: 39, train_loss: 1.0048, test_loss: 0.9314, test_f1: 0.5000
 epoch: 40, train_loss: 0.9988, test_loss: 0.9290, test_f1: 0.4902
 epoch: 41, train_loss: 0.9996, test_loss: 0.9375, test_f1: 0.4892
 epoch: 42, train_loss: 0.9991, test_loss: 0.9363, test_f1: 0.4850
 epoch: 43, train_loss: 0.9841, test_loss: 0.9548, test_f1: 0.4756
 epoch: 44, train_loss: 0.9809, test_loss: 0.9320, test_f1: 0.4889
 epoch: 45, train_loss: 0.9832, test_loss: 0.9297, test_f1: 0.5130
 epoch: 46, train_loss: 0.9694, test_loss: 0.9483, test_f1: 0.4903
 epoch: 47, train_loss: 0.9678, test_loss: 0.9553, test_f1: 0.4782
 epoch: 48, train_loss: 0.9715, test_loss: 0.9421, test_f1: 0.4736
 epoch: 49, train_loss: 0.9661, test_loss: 0.9398, test_f1: 0.5054
 epoch: 50, train_loss: 0.9615, test_loss: 0.9210, test_f1: 0.5015
 epoch: 51, train_loss: 0.9504, test_loss: 0.9186, test_f1: 0.4958
 epoch: 52, train_loss: 0.9457, test_loss: 0.9264, test_f1: 0.5094
 epoch: 53, train_loss: 0.9477, test_loss: 0.9532, test_f1: 0.4983
 epoch: 54, train_loss: 0.9355, test_loss: 0.9063, test_f1: 0.5099
 epoch: 55, train_loss: 0.9427, test_loss: 0.9108, test_f1: 0.5119
 epoch: 56, train_loss: 0.9366, test_loss: 0.9092, test_f1: 0.5119
 epoch: 57, train_loss: 0.9315, test_loss: 0.9088, test_f1: 0.5228
 epoch: 58, train_loss: 0.9375, test_loss: 0.9182, test_f1: 0.4998
 epoch: 59, train_loss: 0.9383, test_loss: 0.9141, test_f1: 0.5119
 epoch: 60, train_loss: 0.9318, test_loss: 0.9212, test_f1: 0.5131
 epoch: 61, train_loss: 0.9286, test_loss: 0.9282, test_f1: 0.4974
 epoch: 62, train_loss: 0.9309, test_loss: 0.9218, test_f1: 0.5090
 epoch: 63, train_loss: 0.9342, test_loss: 0.9068, test_f1: 0.5240
 epoch: 64, train_loss: 0.9227, test_loss: 0.9223, test_f1: 0.5016
 epoch: 65, train_loss: 0.9214, test_loss: 0.9146, test_f1: 0.5113
 epoch: 66, train_loss: 0.9180, test_loss: 0.9201, test_f1: 0.5058
 epoch: 67, train_loss: 0.9241, test_loss: 0.9137, test_f1: 0.5164
 epoch: 68, train_loss: 0.9225, test_loss: 0.9031, test_f1: 0.5183
 epoch: 69, train_loss: 0.9267, test_loss: 0.9244, test_f1: 0.5173
 epoch: 70, train_loss: 0.9209, test_loss: 0.9111, test_f1: 0.5212
 epoch: 71, train_loss: 0.9176, test_loss: 0.9183, test_f1: 0.5119
 epoch: 72, train_loss: 0.9108, test_loss: 0.9078, test_f1: 0.5087
 epoch: 73, train_loss: 0.9028, test_loss: 0.9296, test_f1: 0.4947
 epoch: 74, train_loss: 0.9073, test_loss: 0.9008, test_f1: 0.5180
 epoch: 75, train_loss: 0.9084, test_loss: 0.9131, test_f1: 0.5162
 epoch: 76, train_loss: 0.9083, test_loss: 0.9102, test_f1: 0.5144
 epoch: 77, train_loss: 0.8998, test_loss: 0.9035, test_f1: 0.5142
 epoch: 78, train_loss: 0.9005, test_loss: 0.9058, test_f1: 0.5118
 epoch: 79, train_loss: 0.9057, test_loss: 0.9098, test_f1: 0.5040
 epoch: 80, train_loss: 0.9003, test_loss: 0.9250, test_f1: 0.4997
 epoch: 81, train_loss: 0.9059, test_loss: 0.9279, test_f1: 0.5086
 epoch: 82, train_loss: 0.9083, test_loss: 0.9169, test_f1: 0.5187
 epoch: 83, train_loss: 0.8889, test_loss: 0.9163, test_f1: 0.5047
 epoch: 84, train_loss: 0.8924, test_loss: 0.9177, test_f1: 0.4952
 epoch: 85, train_loss: 0.8982, test_loss: 0.9024, test_f1: 0.5088
 epoch: 86, train_loss: 0.9097, test_loss: 0.9034, test_f1: 0.5243
 epoch: 87, train_loss: 0.8953, test_loss: 0.9156, test_f1: 0.4987
 epoch: 88, train_loss: 0.8906, test_loss: 0.9029, test_f1: 0.5301
 epoch: 89, train_loss: 0.8859, test_loss: 0.9033, test_f1: 0.5037
 epoch: 90, train_loss: 0.8818, test_loss: 0.8972, test_f1: 0.4900
 epoch: 91, train_loss: 0.8814, test_loss: 0.9055, test_f1: 0.5040
 epoch: 92, train_loss: 0.8812, test_loss: 0.8950, test_f1: 0.5266
 epoch: 93, train_loss: 0.8966, test_loss: 0.9080, test_f1: 0.5025
 epoch: 94, train_loss: 0.8867, test_loss: 0.9110, test_f1: 0.5263
 epoch: 95, train_loss: 0.8953, test_loss: 0.9048, test_f1: 0.5298
 epoch: 96, train_loss: 0.8770, test_loss: 0.9198, test_f1: 0.5173
 epoch: 97, train_loss: 0.8790, test_loss: 0.9164, test_f1: 0.5289
 epoch: 98, train_loss: 0.8799, test_loss: 0.9085, test_f1: 0.5014
 epoch: 99, train_loss: 0.8713, test_loss: 0.9075, test_f1: 0.4920
##################ITERATION #6 ****************************************
 epoch: 0, train_loss: 1.4152, test_loss: 1.2984, test_f1: 0.2274
 epoch: 1, train_loss: 1.2576, test_loss: 1.2278, test_f1: 0.3450
 epoch: 2, train_loss: 1.2394, test_loss: 1.2153, test_f1: 0.3683
 epoch: 3, train_loss: 1.2245, test_loss: 1.1955, test_f1: 0.3683
 epoch: 4, train_loss: 1.2185, test_loss: 1.1863, test_f1: 0.4149
 epoch: 5, train_loss: 1.2019, test_loss: 1.1699, test_f1: 0.4248
 epoch: 6, train_loss: 1.1978, test_loss: 1.1677, test_f1: 0.4097
 epoch: 7, train_loss: 1.1881, test_loss: 1.1467, test_f1: 0.4103
 epoch: 8, train_loss: 1.1671, test_loss: 1.1257, test_f1: 0.4302
 epoch: 9, train_loss: 1.1661, test_loss: 1.1197, test_f1: 0.4532
 epoch: 10, train_loss: 1.1407, test_loss: 1.1055, test_f1: 0.4518
 epoch: 11, train_loss: 1.1337, test_loss: 1.0994, test_f1: 0.4773
 epoch: 12, train_loss: 1.1236, test_loss: 1.0749, test_f1: 0.4554
 epoch: 13, train_loss: 1.1123, test_loss: 1.0766, test_f1: 0.4539
 epoch: 14, train_loss: 1.1080, test_loss: 1.0650, test_f1: 0.4526
 epoch: 15, train_loss: 1.0927, test_loss: 1.0620, test_f1: 0.4725
 epoch: 16, train_loss: 1.0930, test_loss: 1.0624, test_f1: 0.4652
 epoch: 17, train_loss: 1.0845, test_loss: 1.0454, test_f1: 0.4621
 epoch: 18, train_loss: 1.0812, test_loss: 1.0517, test_f1: 0.4319
 epoch: 19, train_loss: 1.0798, test_loss: 1.0410, test_f1: 0.4571
 epoch: 20, train_loss: 1.0711, test_loss: 1.0327, test_f1: 0.4772
 epoch: 21, train_loss: 1.0797, test_loss: 1.0830, test_f1: 0.4785
 epoch: 22, train_loss: 1.0665, test_loss: 1.0133, test_f1: 0.4984
 epoch: 23, train_loss: 1.0529, test_loss: 1.0202, test_f1: 0.4812
 epoch: 24, train_loss: 1.0454, test_loss: 1.0158, test_f1: 0.4749
 epoch: 25, train_loss: 1.0544, test_loss: 1.0104, test_f1: 0.5039
 epoch: 26, train_loss: 1.0339, test_loss: 1.0031, test_f1: 0.4776
 epoch: 27, train_loss: 1.0492, test_loss: 1.0301, test_f1: 0.4483
 epoch: 28, train_loss: 1.0452, test_loss: 0.9978, test_f1: 0.4820
 epoch: 29, train_loss: 1.0277, test_loss: 0.9908, test_f1: 0.4837
 epoch: 30, train_loss: 1.0255, test_loss: 0.9944, test_f1: 0.4773
 epoch: 31, train_loss: 1.0260, test_loss: 0.9862, test_f1: 0.4761
 epoch: 32, train_loss: 1.0142, test_loss: 0.9854, test_f1: 0.4701
 epoch: 33, train_loss: 1.0073, test_loss: 0.9977, test_f1: 0.4660
 epoch: 34, train_loss: 1.0093, test_loss: 0.9744, test_f1: 0.4805
 epoch: 35, train_loss: 1.0020, test_loss: 0.9767, test_f1: 0.4769
 epoch: 36, train_loss: 1.0034, test_loss: 0.9687, test_f1: 0.4851
 epoch: 37, train_loss: 1.0012, test_loss: 0.9748, test_f1: 0.4998
 epoch: 38, train_loss: 1.0030, test_loss: 0.9668, test_f1: 0.5036
 epoch: 39, train_loss: 0.9989, test_loss: 1.0403, test_f1: 0.4337
 epoch: 40, train_loss: 0.9945, test_loss: 0.9669, test_f1: 0.5137
 epoch: 41, train_loss: 0.9855, test_loss: 0.9462, test_f1: 0.4965
 epoch: 42, train_loss: 0.9855, test_loss: 0.9395, test_f1: 0.4892
 epoch: 43, train_loss: 0.9921, test_loss: 0.9442, test_f1: 0.5220
 epoch: 44, train_loss: 0.9855, test_loss: 0.9530, test_f1: 0.4839
 epoch: 45, train_loss: 0.9730, test_loss: 0.9481, test_f1: 0.4929
 epoch: 46, train_loss: 0.9813, test_loss: 0.9459, test_f1: 0.4845
 epoch: 47, train_loss: 0.9608, test_loss: 0.9294, test_f1: 0.4908
 epoch: 48, train_loss: 0.9764, test_loss: 0.9649, test_f1: 0.4911
 epoch: 49, train_loss: 0.9722, test_loss: 0.9682, test_f1: 0.5000
 epoch: 50, train_loss: 0.9729, test_loss: 0.9210, test_f1: 0.4988
 epoch: 51, train_loss: 0.9621, test_loss: 0.9393, test_f1: 0.4940
 epoch: 52, train_loss: 0.9523, test_loss: 0.9617, test_f1: 0.4836
 epoch: 53, train_loss: 0.9505, test_loss: 0.9503, test_f1: 0.4891
 epoch: 54, train_loss: 0.9549, test_loss: 0.9612, test_f1: 0.5151
 epoch: 55, train_loss: 0.9502, test_loss: 0.9415, test_f1: 0.4830
 epoch: 56, train_loss: 0.9453, test_loss: 0.9295, test_f1: 0.5005
 epoch: 57, train_loss: 0.9433, test_loss: 0.9340, test_f1: 0.4927
 epoch: 58, train_loss: 0.9523, test_loss: 0.9484, test_f1: 0.4866
 epoch: 59, train_loss: 0.9386, test_loss: 0.9316, test_f1: 0.4912
 epoch: 60, train_loss: 0.9428, test_loss: 0.9316, test_f1: 0.4870
 epoch: 61, train_loss: 0.9517, test_loss: 0.9741, test_f1: 0.4795
 epoch: 62, train_loss: 0.9605, test_loss: 0.9329, test_f1: 0.4848
 epoch: 63, train_loss: 0.9348, test_loss: 0.9389, test_f1: 0.4993
 epoch: 64, train_loss: 0.9423, test_loss: 0.9354, test_f1: 0.5039
 epoch: 65, train_loss: 0.9487, test_loss: 0.9365, test_f1: 0.4818
 epoch: 66, train_loss: 0.9440, test_loss: 0.9467, test_f1: 0.4862
 epoch: 67, train_loss: 0.9344, test_loss: 0.9292, test_f1: 0.4792
 epoch: 68, train_loss: 0.9346, test_loss: 0.9339, test_f1: 0.4779
 epoch: 69, train_loss: 0.9355, test_loss: 0.9356, test_f1: 0.4998
 epoch: 70, train_loss: 0.9382, test_loss: 0.9259, test_f1: 0.4982
 epoch: 71, train_loss: 0.9269, test_loss: 0.9482, test_f1: 0.4724
 epoch: 72, train_loss: 0.9387, test_loss: 0.9286, test_f1: 0.4857
 epoch: 73, train_loss: 0.9395, test_loss: 0.9267, test_f1: 0.5033
 epoch: 74, train_loss: 0.9247, test_loss: 0.9342, test_f1: 0.4894
 epoch: 75, train_loss: 0.9218, test_loss: 0.9410, test_f1: 0.4796
 epoch: 76, train_loss: 0.9165, test_loss: 0.9353, test_f1: 0.4936
 epoch: 77, train_loss: 0.9266, test_loss: 0.9389, test_f1: 0.5043
 epoch: 78, train_loss: 0.9248, test_loss: 0.9437, test_f1: 0.4939
 epoch: 79, train_loss: 0.9320, test_loss: 0.9242, test_f1: 0.4968
 epoch: 80, train_loss: 0.9178, test_loss: 0.9296, test_f1: 0.4890
 epoch: 81, train_loss: 0.9269, test_loss: 0.9341, test_f1: 0.4919
 epoch: 82, train_loss: 0.9246, test_loss: 0.9255, test_f1: 0.4813
 epoch: 83, train_loss: 0.9166, test_loss: 0.9271, test_f1: 0.4954
 epoch: 84, train_loss: 0.9216, test_loss: 0.9386, test_f1: 0.4934
 epoch: 85, train_loss: 0.9219, test_loss: 0.9293, test_f1: 0.5036
 epoch: 86, train_loss: 0.9171, test_loss: 0.9242, test_f1: 0.4966
 epoch: 87, train_loss: 0.9229, test_loss: 0.9436, test_f1: 0.5047
 epoch: 88, train_loss: 0.9257, test_loss: 0.9314, test_f1: 0.4945
 epoch: 89, train_loss: 0.9021, test_loss: 0.9383, test_f1: 0.4883
 epoch: 90, train_loss: 0.9091, test_loss: 0.9378, test_f1: 0.4882
 epoch: 91, train_loss: 0.9160, test_loss: 0.9286, test_f1: 0.4908
 epoch: 92, train_loss: 0.9137, test_loss: 0.9409, test_f1: 0.4830
 epoch: 93, train_loss: 0.9017, test_loss: 0.9374, test_f1: 0.5011
 epoch: 94, train_loss: 0.9188, test_loss: 0.9294, test_f1: 0.4910
 epoch: 95, train_loss: 0.9130, test_loss: 0.9550, test_f1: 0.4769
 epoch: 96, train_loss: 0.9041, test_loss: 0.9365, test_f1: 0.4872
 epoch: 97, train_loss: 0.9030, test_loss: 0.9396, test_f1: 0.5032
 epoch: 98, train_loss: 0.9100, test_loss: 0.9362, test_f1: 0.4922
 epoch: 99, train_loss: 0.9048, test_loss: 0.9277, test_f1: 0.5043
##################ITERATION #7 ****************************************
 epoch: 0, train_loss: 1.4064, test_loss: 1.2841, test_f1: 0.2274
 epoch: 1, train_loss: 1.2679, test_loss: 1.2285, test_f1: 0.2907
 epoch: 2, train_loss: 1.2472, test_loss: 1.1994, test_f1: 0.3328
 epoch: 3, train_loss: 1.2279, test_loss: 1.1897, test_f1: 0.4072
 epoch: 4, train_loss: 1.2100, test_loss: 1.1755, test_f1: 0.4317
 epoch: 5, train_loss: 1.1956, test_loss: 1.1492, test_f1: 0.4100
 epoch: 6, train_loss: 1.1765, test_loss: 1.1182, test_f1: 0.4431
 epoch: 7, train_loss: 1.1614, test_loss: 1.0983, test_f1: 0.4552
 epoch: 8, train_loss: 1.1535, test_loss: 1.0853, test_f1: 0.4401
 epoch: 9, train_loss: 1.1422, test_loss: 1.0730, test_f1: 0.4605
 epoch: 10, train_loss: 1.1270, test_loss: 1.0432, test_f1: 0.4679
 epoch: 11, train_loss: 1.1180, test_loss: 1.0494, test_f1: 0.4537
 epoch: 12, train_loss: 1.1174, test_loss: 1.0376, test_f1: 0.4575
 epoch: 13, train_loss: 1.0992, test_loss: 1.0230, test_f1: 0.4443
 epoch: 14, train_loss: 1.1006, test_loss: 1.0242, test_f1: 0.4495
 epoch: 15, train_loss: 1.0974, test_loss: 1.0207, test_f1: 0.4447
 epoch: 16, train_loss: 1.0936, test_loss: 1.0129, test_f1: 0.4480
 epoch: 17, train_loss: 1.0785, test_loss: 1.0040, test_f1: 0.4568
 epoch: 18, train_loss: 1.0706, test_loss: 1.0025, test_f1: 0.4474
 epoch: 19, train_loss: 1.0625, test_loss: 0.9995, test_f1: 0.4469
 epoch: 20, train_loss: 1.0628, test_loss: 0.9901, test_f1: 0.4660
 epoch: 21, train_loss: 1.0631, test_loss: 0.9912, test_f1: 0.4571
 epoch: 22, train_loss: 1.0533, test_loss: 0.9841, test_f1: 0.4555
 epoch: 23, train_loss: 1.0629, test_loss: 0.9868, test_f1: 0.4446
 epoch: 24, train_loss: 1.0346, test_loss: 0.9731, test_f1: 0.4558
 epoch: 25, train_loss: 1.0458, test_loss: 0.9711, test_f1: 0.4531
 epoch: 26, train_loss: 1.0413, test_loss: 0.9706, test_f1: 0.4607
 epoch: 27, train_loss: 1.0374, test_loss: 0.9708, test_f1: 0.4555
 epoch: 28, train_loss: 1.0340, test_loss: 0.9746, test_f1: 0.4480
 epoch: 29, train_loss: 1.0175, test_loss: 0.9638, test_f1: 0.4573
 epoch: 30, train_loss: 1.0331, test_loss: 0.9792, test_f1: 0.4656
 epoch: 31, train_loss: 1.0168, test_loss: 0.9703, test_f1: 0.4637
 epoch: 32, train_loss: 1.0077, test_loss: 0.9599, test_f1: 0.4630
 epoch: 33, train_loss: 1.0154, test_loss: 0.9573, test_f1: 0.4566
 epoch: 34, train_loss: 1.0011, test_loss: 0.9635, test_f1: 0.4623
 epoch: 35, train_loss: 1.0092, test_loss: 0.9815, test_f1: 0.4507
 epoch: 36, train_loss: 1.0122, test_loss: 0.9609, test_f1: 0.4671
 epoch: 37, train_loss: 0.9974, test_loss: 0.9476, test_f1: 0.4649
 epoch: 38, train_loss: 0.9994, test_loss: 0.9490, test_f1: 0.4670
 epoch: 39, train_loss: 0.9930, test_loss: 0.9557, test_f1: 0.4656
 epoch: 40, train_loss: 0.9979, test_loss: 0.9603, test_f1: 0.4578
 epoch: 41, train_loss: 0.9942, test_loss: 0.9890, test_f1: 0.4488
 epoch: 42, train_loss: 0.9755, test_loss: 0.9694, test_f1: 0.4610
 epoch: 43, train_loss: 0.9787, test_loss: 1.0025, test_f1: 0.4469
 epoch: 44, train_loss: 0.9788, test_loss: 0.9630, test_f1: 0.4578
 epoch: 45, train_loss: 0.9861, test_loss: 1.0081, test_f1: 0.4471
 epoch: 46, train_loss: 0.9905, test_loss: 0.9648, test_f1: 0.4566
 epoch: 47, train_loss: 0.9684, test_loss: 0.9663, test_f1: 0.4655
 epoch: 48, train_loss: 0.9635, test_loss: 0.9562, test_f1: 0.4651
 epoch: 49, train_loss: 0.9605, test_loss: 0.9635, test_f1: 0.4653
 epoch: 50, train_loss: 0.9681, test_loss: 0.9469, test_f1: 0.4710
 epoch: 51, train_loss: 0.9604, test_loss: 0.9692, test_f1: 0.4555
 epoch: 52, train_loss: 0.9451, test_loss: 0.9799, test_f1: 0.4555
 epoch: 53, train_loss: 0.9603, test_loss: 0.9917, test_f1: 0.4611
 epoch: 54, train_loss: 0.9505, test_loss: 0.9839, test_f1: 0.4484
 epoch: 55, train_loss: 0.9460, test_loss: 0.9761, test_f1: 0.4586
 epoch: 56, train_loss: 0.9564, test_loss: 0.9614, test_f1: 0.4538
 epoch: 57, train_loss: 0.9464, test_loss: 0.9899, test_f1: 0.4456
 epoch: 58, train_loss: 0.9432, test_loss: 0.9982, test_f1: 0.4469
 epoch: 59, train_loss: 0.9477, test_loss: 0.9914, test_f1: 0.4575
 epoch: 60, train_loss: 0.9467, test_loss: 1.0186, test_f1: 0.4524
 epoch: 61, train_loss: 0.9394, test_loss: 1.0152, test_f1: 0.4489
 epoch: 62, train_loss: 0.9355, test_loss: 0.9994, test_f1: 0.4495
 epoch: 63, train_loss: 0.9378, test_loss: 1.0536, test_f1: 0.4522
 epoch: 64, train_loss: 0.9318, test_loss: 1.0701, test_f1: 0.4435
 epoch: 65, train_loss: 0.9375, test_loss: 1.0462, test_f1: 0.4488
 epoch: 66, train_loss: 0.9257, test_loss: 1.0165, test_f1: 0.4515
 epoch: 67, train_loss: 0.9325, test_loss: 1.0573, test_f1: 0.4506
 epoch: 68, train_loss: 0.9357, test_loss: 0.9940, test_f1: 0.4589
 epoch: 69, train_loss: 0.9300, test_loss: 0.9935, test_f1: 0.4608
 epoch: 70, train_loss: 0.9340, test_loss: 1.0188, test_f1: 0.4555
 epoch: 71, train_loss: 0.9237, test_loss: 0.9533, test_f1: 0.4634
 epoch: 72, train_loss: 0.9278, test_loss: 1.0161, test_f1: 0.4541
 epoch: 73, train_loss: 0.9340, test_loss: 0.9783, test_f1: 0.4574
 epoch: 74, train_loss: 0.9248, test_loss: 1.0104, test_f1: 0.4577
 epoch: 75, train_loss: 0.9266, test_loss: 1.0700, test_f1: 0.4577
 epoch: 76, train_loss: 0.9285, test_loss: 1.0367, test_f1: 0.4775
 epoch: 77, train_loss: 0.9241, test_loss: 1.0611, test_f1: 0.4569
 epoch: 78, train_loss: 0.9297, test_loss: 1.0483, test_f1: 0.4671
 epoch: 79, train_loss: 0.9223, test_loss: 1.0298, test_f1: 0.4706
 epoch: 80, train_loss: 0.9166, test_loss: 1.0805, test_f1: 0.4492
 epoch: 81, train_loss: 0.9225, test_loss: 1.0508, test_f1: 0.4658
 epoch: 82, train_loss: 0.9152, test_loss: 1.0502, test_f1: 0.4610
 epoch: 83, train_loss: 0.9203, test_loss: 1.0255, test_f1: 0.4730
 epoch: 84, train_loss: 0.9190, test_loss: 1.0138, test_f1: 0.4537
 epoch: 85, train_loss: 0.9122, test_loss: 1.0848, test_f1: 0.4513
 epoch: 86, train_loss: 0.9113, test_loss: 1.0818, test_f1: 0.4448
 epoch: 87, train_loss: 0.9055, test_loss: 1.0379, test_f1: 0.4610
 epoch: 88, train_loss: 0.9150, test_loss: 1.0479, test_f1: 0.4656
 epoch: 89, train_loss: 0.9081, test_loss: 1.0638, test_f1: 0.4585
 epoch: 90, train_loss: 0.9032, test_loss: 1.0866, test_f1: 0.4508
 epoch: 91, train_loss: 0.9093, test_loss: 1.0572, test_f1: 0.4565
 epoch: 92, train_loss: 0.9104, test_loss: 1.0456, test_f1: 0.4601
 epoch: 93, train_loss: 0.9109, test_loss: 1.0466, test_f1: 0.4562
 epoch: 94, train_loss: 0.9199, test_loss: 1.0454, test_f1: 0.4657
 epoch: 95, train_loss: 0.8972, test_loss: 1.0749, test_f1: 0.4418
 epoch: 96, train_loss: 0.9049, test_loss: 1.0484, test_f1: 0.4608
 epoch: 97, train_loss: 0.8926, test_loss: 1.0533, test_f1: 0.4632
 epoch: 98, train_loss: 0.8937, test_loss: 1.0846, test_f1: 0.4623
 epoch: 99, train_loss: 0.9075, test_loss: 1.1676, test_f1: 0.4417
##################ITERATION #8 ****************************************
 epoch: 0, train_loss: 1.4562, test_loss: 1.3107, test_f1: 0.2278
 epoch: 1, train_loss: 1.2902, test_loss: 1.2653, test_f1: 0.2632
 epoch: 2, train_loss: 1.2686, test_loss: 1.2218, test_f1: 0.3582
 epoch: 3, train_loss: 1.2450, test_loss: 1.2038, test_f1: 0.3215
 epoch: 4, train_loss: 1.2380, test_loss: 1.1942, test_f1: 0.3470
 epoch: 5, train_loss: 1.2199, test_loss: 1.1802, test_f1: 0.3533
 epoch: 6, train_loss: 1.2093, test_loss: 1.1672, test_f1: 0.3684
 epoch: 7, train_loss: 1.2045, test_loss: 1.1538, test_f1: 0.3787
 epoch: 8, train_loss: 1.1983, test_loss: 1.1450, test_f1: 0.4045
 epoch: 9, train_loss: 1.1950, test_loss: 1.1282, test_f1: 0.4242
 epoch: 10, train_loss: 1.1794, test_loss: 1.1328, test_f1: 0.4270
 epoch: 11, train_loss: 1.1706, test_loss: 1.1140, test_f1: 0.4188
 epoch: 12, train_loss: 1.1643, test_loss: 1.1037, test_f1: 0.4342
 epoch: 13, train_loss: 1.1442, test_loss: 1.0835, test_f1: 0.4376
 epoch: 14, train_loss: 1.1550, test_loss: 1.0904, test_f1: 0.4324
 epoch: 15, train_loss: 1.1312, test_loss: 1.0673, test_f1: 0.4389
 epoch: 16, train_loss: 1.1258, test_loss: 1.0505, test_f1: 0.4519
 epoch: 17, train_loss: 1.1142, test_loss: 1.0452, test_f1: 0.4521
 epoch: 18, train_loss: 1.1006, test_loss: 1.0458, test_f1: 0.4237
 epoch: 19, train_loss: 1.0882, test_loss: 1.0181, test_f1: 0.4603
 epoch: 20, train_loss: 1.0927, test_loss: 1.0311, test_f1: 0.4535
 epoch: 21, train_loss: 1.0823, test_loss: 1.0040, test_f1: 0.4686
 epoch: 22, train_loss: 1.0676, test_loss: 1.0386, test_f1: 0.4407
 epoch: 23, train_loss: 1.0625, test_loss: 0.9975, test_f1: 0.4676
 epoch: 24, train_loss: 1.0522, test_loss: 0.9821, test_f1: 0.4704
 epoch: 25, train_loss: 1.0499, test_loss: 1.0010, test_f1: 0.4536
 epoch: 26, train_loss: 1.0428, test_loss: 0.9791, test_f1: 0.4659
 epoch: 27, train_loss: 1.0377, test_loss: 0.9838, test_f1: 0.4502
 epoch: 28, train_loss: 1.0358, test_loss: 0.9848, test_f1: 0.4612
 epoch: 29, train_loss: 1.0210, test_loss: 0.9594, test_f1: 0.4809
 epoch: 30, train_loss: 1.0189, test_loss: 0.9716, test_f1: 0.4746
 epoch: 31, train_loss: 1.0160, test_loss: 0.9836, test_f1: 0.4846
 epoch: 32, train_loss: 1.0123, test_loss: 0.9468, test_f1: 0.4963
 epoch: 33, train_loss: 1.0038, test_loss: 0.9505, test_f1: 0.4924
 epoch: 34, train_loss: 0.9824, test_loss: 0.9612, test_f1: 0.4629
 epoch: 35, train_loss: 0.9924, test_loss: 0.9538, test_f1: 0.4637
 epoch: 36, train_loss: 1.0000, test_loss: 0.9972, test_f1: 0.4377
 epoch: 37, train_loss: 0.9984, test_loss: 0.9351, test_f1: 0.4612
 epoch: 38, train_loss: 0.9819, test_loss: 0.9694, test_f1: 0.4558
 epoch: 39, train_loss: 0.9740, test_loss: 0.9313, test_f1: 0.4847
 epoch: 40, train_loss: 0.9749, test_loss: 0.9768, test_f1: 0.4610
 epoch: 41, train_loss: 0.9764, test_loss: 0.9610, test_f1: 0.4814
 epoch: 42, train_loss: 0.9688, test_loss: 0.9787, test_f1: 0.4581
 epoch: 43, train_loss: 0.9704, test_loss: 0.9778, test_f1: 0.4748
 epoch: 44, train_loss: 0.9698, test_loss: 0.9202, test_f1: 0.5016
 epoch: 45, train_loss: 0.9515, test_loss: 0.9278, test_f1: 0.4915
 epoch: 46, train_loss: 0.9587, test_loss: 0.9491, test_f1: 0.4982
 epoch: 47, train_loss: 0.9560, test_loss: 0.9293, test_f1: 0.4896
 epoch: 48, train_loss: 0.9521, test_loss: 0.9421, test_f1: 0.5012
 epoch: 49, train_loss: 0.9367, test_loss: 0.9926, test_f1: 0.4801
 epoch: 50, train_loss: 0.9518, test_loss: 0.9720, test_f1: 0.4951
 epoch: 51, train_loss: 0.9314, test_loss: 0.9605, test_f1: 0.4839
 epoch: 52, train_loss: 0.9288, test_loss: 0.9453, test_f1: 0.4969
 epoch: 53, train_loss: 0.9260, test_loss: 0.9343, test_f1: 0.4979
 epoch: 54, train_loss: 0.9324, test_loss: 0.9506, test_f1: 0.4961
 epoch: 55, train_loss: 0.9220, test_loss: 0.9890, test_f1: 0.4983
 epoch: 56, train_loss: 0.9346, test_loss: 1.0090, test_f1: 0.4668
 epoch: 57, train_loss: 0.9183, test_loss: 0.9340, test_f1: 0.4977
 epoch: 58, train_loss: 0.9290, test_loss: 0.9628, test_f1: 0.4981
 epoch: 59, train_loss: 0.9224, test_loss: 0.9659, test_f1: 0.5079
 epoch: 60, train_loss: 0.9132, test_loss: 0.9898, test_f1: 0.4767
 epoch: 61, train_loss: 0.9186, test_loss: 0.9670, test_f1: 0.4973
 epoch: 62, train_loss: 0.9060, test_loss: 0.9463, test_f1: 0.5021
 epoch: 63, train_loss: 0.9177, test_loss: 0.9929, test_f1: 0.4821
 epoch: 64, train_loss: 0.9064, test_loss: 0.9596, test_f1: 0.4927
 epoch: 65, train_loss: 0.9038, test_loss: 0.9933, test_f1: 0.4821
 epoch: 66, train_loss: 0.9090, test_loss: 0.9793, test_f1: 0.4905
 epoch: 67, train_loss: 0.9074, test_loss: 0.9457, test_f1: 0.4973
 epoch: 68, train_loss: 0.8992, test_loss: 0.9285, test_f1: 0.4985
 epoch: 69, train_loss: 0.9040, test_loss: 0.9950, test_f1: 0.4814
 epoch: 70, train_loss: 0.8962, test_loss: 0.9688, test_f1: 0.5016
 epoch: 71, train_loss: 0.8965, test_loss: 0.9588, test_f1: 0.4943
 epoch: 72, train_loss: 0.9015, test_loss: 0.9743, test_f1: 0.4926
 epoch: 73, train_loss: 0.8913, test_loss: 0.9846, test_f1: 0.5020
 epoch: 74, train_loss: 0.8863, test_loss: 0.9709, test_f1: 0.4869
 epoch: 75, train_loss: 0.8934, test_loss: 0.9917, test_f1: 0.4927
 epoch: 76, train_loss: 0.9027, test_loss: 1.0280, test_f1: 0.4819
 epoch: 77, train_loss: 0.8943, test_loss: 0.9453, test_f1: 0.4916
 epoch: 78, train_loss: 0.9057, test_loss: 0.9860, test_f1: 0.5030
 epoch: 79, train_loss: 0.8833, test_loss: 1.0034, test_f1: 0.4955
 epoch: 80, train_loss: 0.8880, test_loss: 0.9446, test_f1: 0.4958
 epoch: 81, train_loss: 0.8828, test_loss: 1.0153, test_f1: 0.4886
 epoch: 82, train_loss: 0.8757, test_loss: 1.0196, test_f1: 0.4839
 epoch: 83, train_loss: 0.8796, test_loss: 1.0037, test_f1: 0.5012
 epoch: 84, train_loss: 0.8954, test_loss: 0.9698, test_f1: 0.4900
 epoch: 85, train_loss: 0.8673, test_loss: 0.9614, test_f1: 0.5014
 epoch: 86, train_loss: 0.8823, test_loss: 0.9946, test_f1: 0.4895
 epoch: 87, train_loss: 0.8817, test_loss: 0.9954, test_f1: 0.5046
 epoch: 88, train_loss: 0.8724, test_loss: 0.9861, test_f1: 0.4955
 epoch: 89, train_loss: 0.8833, test_loss: 1.0050, test_f1: 0.4912
 epoch: 90, train_loss: 0.8837, test_loss: 1.0114, test_f1: 0.4869
 epoch: 91, train_loss: 0.8768, test_loss: 0.9718, test_f1: 0.5024
 epoch: 92, train_loss: 0.8723, test_loss: 0.9774, test_f1: 0.5022
 epoch: 93, train_loss: 0.8791, test_loss: 1.0062, test_f1: 0.4921
 epoch: 94, train_loss: 0.8689, test_loss: 1.0037, test_f1: 0.4922
 epoch: 95, train_loss: 0.8685, test_loss: 0.9972, test_f1: 0.4952
 epoch: 96, train_loss: 0.8715, test_loss: 0.9529, test_f1: 0.4992
 epoch: 97, train_loss: 0.8690, test_loss: 1.0148, test_f1: 0.4995
 epoch: 98, train_loss: 0.8719, test_loss: 0.9746, test_f1: 0.4965
 epoch: 99, train_loss: 0.8603, test_loss: 0.9246, test_f1: 0.5032
##################ITERATION #9 ****************************************
 epoch: 0, train_loss: 1.5696, test_loss: 1.3442, test_f1: 0.2355
 epoch: 1, train_loss: 1.3374, test_loss: 1.2584, test_f1: 0.3349
 epoch: 2, train_loss: 1.2845, test_loss: 1.2128, test_f1: 0.3580
 epoch: 3, train_loss: 1.2650, test_loss: 1.1882, test_f1: 0.3915
 epoch: 4, train_loss: 1.2344, test_loss: 1.1695, test_f1: 0.3933
 epoch: 5, train_loss: 1.2230, test_loss: 1.1580, test_f1: 0.3998
 epoch: 6, train_loss: 1.2052, test_loss: 1.1414, test_f1: 0.3657
 epoch: 7, train_loss: 1.1977, test_loss: 1.1447, test_f1: 0.3886
 epoch: 8, train_loss: 1.1885, test_loss: 1.1226, test_f1: 0.4040
 epoch: 9, train_loss: 1.1718, test_loss: 1.1059, test_f1: 0.4115
 epoch: 10, train_loss: 1.1583, test_loss: 1.1083, test_f1: 0.4307
 epoch: 11, train_loss: 1.1604, test_loss: 1.0988, test_f1: 0.4173
 epoch: 12, train_loss: 1.1409, test_loss: 1.0891, test_f1: 0.4393
 epoch: 13, train_loss: 1.1517, test_loss: 1.0726, test_f1: 0.4145
 epoch: 14, train_loss: 1.1397, test_loss: 1.0756, test_f1: 0.4198
 epoch: 15, train_loss: 1.1351, test_loss: 1.0695, test_f1: 0.4260
 epoch: 16, train_loss: 1.1260, test_loss: 1.0715, test_f1: 0.4255
 epoch: 17, train_loss: 1.1160, test_loss: 1.0605, test_f1: 0.4578
 epoch: 18, train_loss: 1.1147, test_loss: 1.0707, test_f1: 0.4391
 epoch: 19, train_loss: 1.1032, test_loss: 1.0568, test_f1: 0.4245
 epoch: 20, train_loss: 1.1044, test_loss: 1.0503, test_f1: 0.4462
 epoch: 21, train_loss: 1.0960, test_loss: 1.0607, test_f1: 0.4490
 epoch: 22, train_loss: 1.1068, test_loss: 1.0385, test_f1: 0.4549
 epoch: 23, train_loss: 1.1011, test_loss: 1.0463, test_f1: 0.4684
 epoch: 24, train_loss: 1.0945, test_loss: 1.0540, test_f1: 0.4420
 epoch: 25, train_loss: 1.0825, test_loss: 1.0478, test_f1: 0.4469
 epoch: 26, train_loss: 1.0847, test_loss: 1.0422, test_f1: 0.4531
 epoch: 27, train_loss: 1.0788, test_loss: 1.0405, test_f1: 0.4521
 epoch: 28, train_loss: 1.0734, test_loss: 1.0402, test_f1: 0.4674
 epoch: 29, train_loss: 1.0810, test_loss: 1.0344, test_f1: 0.4541
 epoch: 30, train_loss: 1.0795, test_loss: 1.0424, test_f1: 0.4569
 epoch: 31, train_loss: 1.0670, test_loss: 1.0375, test_f1: 0.4596
 epoch: 32, train_loss: 1.0789, test_loss: 1.0297, test_f1: 0.4716
 epoch: 33, train_loss: 1.0727, test_loss: 1.0493, test_f1: 0.4497
 epoch: 34, train_loss: 1.0585, test_loss: 1.0174, test_f1: 0.4734
 epoch: 35, train_loss: 1.0524, test_loss: 1.0292, test_f1: 0.4673
 epoch: 36, train_loss: 1.0604, test_loss: 1.0325, test_f1: 0.4606
 epoch: 37, train_loss: 1.0472, test_loss: 1.0431, test_f1: 0.4450
 epoch: 38, train_loss: 1.0571, test_loss: 1.0445, test_f1: 0.4427
 epoch: 39, train_loss: 1.0527, test_loss: 1.0120, test_f1: 0.4479
 epoch: 40, train_loss: 1.0431, test_loss: 1.0222, test_f1: 0.4470
 epoch: 41, train_loss: 1.0367, test_loss: 1.0158, test_f1: 0.4574
 epoch: 42, train_loss: 1.0362, test_loss: 1.0485, test_f1: 0.4532
 epoch: 43, train_loss: 1.0318, test_loss: 0.9909, test_f1: 0.4586
 epoch: 44, train_loss: 1.0359, test_loss: 1.0033, test_f1: 0.4594
 epoch: 45, train_loss: 1.0360, test_loss: 1.0309, test_f1: 0.4469
 epoch: 46, train_loss: 1.0299, test_loss: 1.0073, test_f1: 0.4661
 epoch: 47, train_loss: 1.0281, test_loss: 1.0167, test_f1: 0.4656
 epoch: 48, train_loss: 1.0246, test_loss: 1.0236, test_f1: 0.4685
 epoch: 49, train_loss: 1.0152, test_loss: 1.0158, test_f1: 0.4551
 epoch: 50, train_loss: 1.0161, test_loss: 1.0134, test_f1: 0.4688
 epoch: 51, train_loss: 1.0131, test_loss: 1.0051, test_f1: 0.4729
 epoch: 52, train_loss: 1.0021, test_loss: 1.0051, test_f1: 0.4703
 epoch: 53, train_loss: 1.0079, test_loss: 1.0026, test_f1: 0.4745
 epoch: 54, train_loss: 1.0025, test_loss: 0.9973, test_f1: 0.4773
 epoch: 55, train_loss: 0.9992, test_loss: 1.0059, test_f1: 0.4765
 epoch: 56, train_loss: 1.0011, test_loss: 1.0031, test_f1: 0.4767
 epoch: 57, train_loss: 0.9925, test_loss: 0.9991, test_f1: 0.4757
 epoch: 58, train_loss: 1.0037, test_loss: 0.9874, test_f1: 0.4697
 epoch: 59, train_loss: 0.9927, test_loss: 1.0043, test_f1: 0.4812
 epoch: 60, train_loss: 0.9961, test_loss: 1.0124, test_f1: 0.4686
 epoch: 61, train_loss: 0.9831, test_loss: 0.9985, test_f1: 0.4704
 epoch: 62, train_loss: 0.9874, test_loss: 1.0031, test_f1: 0.4785
 epoch: 63, train_loss: 0.9964, test_loss: 0.9938, test_f1: 0.4700
 epoch: 64, train_loss: 0.9891, test_loss: 0.9983, test_f1: 0.4687
 epoch: 65, train_loss: 0.9890, test_loss: 0.9947, test_f1: 0.4809
 epoch: 66, train_loss: 0.9778, test_loss: 0.9894, test_f1: 0.4792
 epoch: 67, train_loss: 0.9901, test_loss: 0.9913, test_f1: 0.4693
 epoch: 68, train_loss: 0.9776, test_loss: 0.9753, test_f1: 0.4846
 epoch: 69, train_loss: 0.9885, test_loss: 0.9816, test_f1: 0.4741
 epoch: 70, train_loss: 0.9848, test_loss: 0.9936, test_f1: 0.4771
 epoch: 71, train_loss: 0.9936, test_loss: 0.9935, test_f1: 0.4753
 epoch: 72, train_loss: 0.9733, test_loss: 0.9871, test_f1: 0.4714
 epoch: 73, train_loss: 0.9827, test_loss: 0.9870, test_f1: 0.4709
 epoch: 74, train_loss: 0.9778, test_loss: 0.9801, test_f1: 0.4678
 epoch: 75, train_loss: 0.9780, test_loss: 0.9832, test_f1: 0.4757
 epoch: 76, train_loss: 0.9718, test_loss: 0.9861, test_f1: 0.4767
 epoch: 77, train_loss: 0.9720, test_loss: 0.9808, test_f1: 0.4637
 epoch: 78, train_loss: 0.9684, test_loss: 1.0052, test_f1: 0.4654
 epoch: 79, train_loss: 0.9810, test_loss: 0.9862, test_f1: 0.4796
 epoch: 80, train_loss: 0.9726, test_loss: 0.9851, test_f1: 0.4735
 epoch: 81, train_loss: 0.9643, test_loss: 0.9920, test_f1: 0.4681
 epoch: 82, train_loss: 0.9617, test_loss: 1.0003, test_f1: 0.4721
 epoch: 83, train_loss: 0.9631, test_loss: 1.0057, test_f1: 0.4725
 epoch: 84, train_loss: 0.9622, test_loss: 0.9916, test_f1: 0.4691
 epoch: 85, train_loss: 0.9671, test_loss: 1.0168, test_f1: 0.4694
 epoch: 86, train_loss: 0.9543, test_loss: 0.9906, test_f1: 0.4691
 epoch: 87, train_loss: 0.9556, test_loss: 0.9754, test_f1: 0.4752
 epoch: 88, train_loss: 0.9717, test_loss: 0.9867, test_f1: 0.4701
 epoch: 89, train_loss: 0.9664, test_loss: 0.9794, test_f1: 0.4672
 epoch: 90, train_loss: 0.9525, test_loss: 0.9769, test_f1: 0.4837
 epoch: 91, train_loss: 0.9566, test_loss: 0.9866, test_f1: 0.4777
 epoch: 92, train_loss: 0.9540, test_loss: 0.9726, test_f1: 0.4865
 epoch: 93, train_loss: 0.9464, test_loss: 0.9939, test_f1: 0.4726
 epoch: 94, train_loss: 0.9627, test_loss: 0.9752, test_f1: 0.4782
 epoch: 95, train_loss: 0.9557, test_loss: 0.9854, test_f1: 0.4807
 epoch: 96, train_loss: 0.9649, test_loss: 0.9927, test_f1: 0.4944
 epoch: 97, train_loss: 0.9373, test_loss: 0.9807, test_f1: 0.4790
 epoch: 98, train_loss: 0.9445, test_loss: 0.9968, test_f1: 0.4721
 epoch: 99, train_loss: 0.9457, test_loss: 0.9843, test_f1: 0.4744

Training completed in 522.44 seconds
Best F1: 0.5301 at epoch 88
Mean F1 across iterations: 0.5080  0.0189
========================FINAL RESULTS================================
FEGIN weighted F1: 0.5301  0.0189
python main.py --data ltspice_examples --representation component_component --model FEGIN --layers 5 --hiddens 16 --batch_size 128 --lr 0.001 --emb_size 128 --epochs 100 --save_appendix component_component_L5_H16_BS128_LR0.001_E128 --no_val
-----



STDERR:
Processing...
Done!
  File "main.py", line 370, in <module>
    main()
  File "main.py", line 254, in main
    dataset = dataset_class(
  File "/home/philip/projects/ltspice_examples_code_repo/Circuit-Completion-Using-GNNs/component_classification_with_link_prediction_head/evaluation/FEGIN/kernel/circuit_datasets.py", line 15, in __init__
    self.data, self.slices = torch.load(self.processed_paths[0])
  File "/home/philip/.local/lib/python3.8/site-packages/torch/serialization.py", line 1040, in load
    warnings.warn(
  File "/usr/lib/python3.8/warnings.py", line 109, in _showwarnmsg
    sw(msg.message, msg.category, msg.filename, msg.lineno,
  File "main.py", line 47, in warn_with_traceback
    traceback.print_stack(file=log)
/home/philip/projects/ltspice_examples_code_repo/Circuit-Completion-Using-GNNs/component_classification_with_link_prediction_head/evaluation/FEGIN/kernel/circuit_datasets.py:15: FutureWarning: You are using `torch.load` with `weights_only=False` (the current default value), which uses the default pickle module implicitly. It is possible to construct malicious pickle data which will execute arbitrary code during unpickling (See https://github.com/pytorch/pytorch/blob/main/SECURITY.md#untrusted-models for more details). In a future release, the default value for `weights_only` will be flipped to `True`. This limits the functions that could be executed during unpickling. Arbitrary objects will no longer be allowed to be loaded via this mode unless they are explicitly allowlisted by the user via `torch.serialization.add_safe_globals`. We recommend you start setting `weights_only=True` for any use case where you don't have full control of the loaded file. Please open an issue on GitHub for any issues related to this experimental feature.
  self.data, self.slices = torch.load(self.processed_paths[0])
