STDOUT:
Results will be saved in /home/philip/projects/ltspice_examples_code_repo/Circuit-Completion-Using-GNNs/component_classification_with_link_prediction_head/evaluation/FEGIN/results/model_FEGIN_dataset_ltspice_examples
Command line input: python main.py --data ltspice_examples --representation component_net --model FEGIN --layers 5 --hiddens 128 --batch_size 64 --lr 0.001 --emb_size 250 --epochs 100 --save_appendix component_net_L5_H128_BS64_LR0.001_E250 --no_val
 is saved.
-----
ltspice_examples - FEGIN
Using 5 layers, 128 hidden units, h = 2
Loading component_net representation dataset
ENTERED
Training FEGIN on component_net representation
Train: 3558, Test: 846
##################ITERATION #0 ****************************************
 epoch: 0, train_loss: 1.1986, test_loss: 1.0935, test_f1: 0.4002
 epoch: 1, train_loss: 0.9828, test_loss: 0.9634, test_f1: 0.5148
 epoch: 2, train_loss: 0.9509, test_loss: 0.9166, test_f1: 0.5516
 epoch: 3, train_loss: 0.9072, test_loss: 0.9097, test_f1: 0.5235
 epoch: 4, train_loss: 0.8865, test_loss: 0.8791, test_f1: 0.5522
 epoch: 5, train_loss: 0.8648, test_loss: 0.9302, test_f1: 0.5298
 epoch: 6, train_loss: 0.8505, test_loss: 0.9164, test_f1: 0.5715
 epoch: 7, train_loss: 0.8467, test_loss: 0.8459, test_f1: 0.5559
 epoch: 8, train_loss: 0.8192, test_loss: 0.8629, test_f1: 0.5725
 epoch: 9, train_loss: 0.8212, test_loss: 0.9662, test_f1: 0.5499
 epoch: 10, train_loss: 0.8142, test_loss: 0.9270, test_f1: 0.5832
 epoch: 11, train_loss: 0.8112, test_loss: 0.9473, test_f1: 0.5248
 epoch: 12, train_loss: 0.7810, test_loss: 0.9865, test_f1: 0.5874
 epoch: 13, train_loss: 0.7582, test_loss: 0.9590, test_f1: 0.5925
 epoch: 14, train_loss: 0.7754, test_loss: 0.9495, test_f1: 0.5806
 epoch: 15, train_loss: 0.7544, test_loss: 0.8831, test_f1: 0.5803
 epoch: 16, train_loss: 0.7331, test_loss: 0.9548, test_f1: 0.5981
 epoch: 17, train_loss: 0.7362, test_loss: 1.0217, test_f1: 0.5851
 epoch: 18, train_loss: 0.6952, test_loss: 0.9513, test_f1: 0.6196
 epoch: 19, train_loss: 0.7044, test_loss: 1.0983, test_f1: 0.5865
 epoch: 20, train_loss: 0.6935, test_loss: 0.9443, test_f1: 0.6041
 epoch: 21, train_loss: 0.6904, test_loss: 0.9614, test_f1: 0.6184
 epoch: 22, train_loss: 0.6541, test_loss: 0.9661, test_f1: 0.6486
 epoch: 23, train_loss: 0.6636, test_loss: 0.9617, test_f1: 0.6015
 epoch: 24, train_loss: 0.6505, test_loss: 0.9393, test_f1: 0.5997
 epoch: 25, train_loss: 0.6407, test_loss: 1.0085, test_f1: 0.6107
 epoch: 26, train_loss: 0.6268, test_loss: 0.9342, test_f1: 0.6404
 epoch: 27, train_loss: 0.6238, test_loss: 0.9885, test_f1: 0.6154
 epoch: 28, train_loss: 0.6007, test_loss: 0.9538, test_f1: 0.6467
 epoch: 29, train_loss: 0.5814, test_loss: 1.0544, test_f1: 0.6274
 epoch: 30, train_loss: 0.6009, test_loss: 1.0241, test_f1: 0.6348
 epoch: 31, train_loss: 0.5601, test_loss: 1.0097, test_f1: 0.6655
 epoch: 32, train_loss: 0.5472, test_loss: 1.0655, test_f1: 0.6279
 epoch: 33, train_loss: 0.5573, test_loss: 1.0411, test_f1: 0.6584
 epoch: 34, train_loss: 0.5274, test_loss: 1.0590, test_f1: 0.6807
 epoch: 35, train_loss: 0.5359, test_loss: 1.1196, test_f1: 0.6444
 epoch: 36, train_loss: 0.5227, test_loss: 1.1606, test_f1: 0.6332
 epoch: 37, train_loss: 0.5119, test_loss: 1.0288, test_f1: 0.6626
 epoch: 38, train_loss: 0.4891, test_loss: 1.2190, test_f1: 0.6352
 epoch: 39, train_loss: 0.5019, test_loss: 1.1361, test_f1: 0.6216
 epoch: 40, train_loss: 0.4821, test_loss: 1.2369, test_f1: 0.6231
 epoch: 41, train_loss: 0.4901, test_loss: 1.1092, test_f1: 0.6470
 epoch: 42, train_loss: 0.4885, test_loss: 1.4540, test_f1: 0.5948
 epoch: 43, train_loss: 0.4851, test_loss: 1.3126, test_f1: 0.6314
 epoch: 44, train_loss: 0.4871, test_loss: 1.1251, test_f1: 0.6587
 epoch: 45, train_loss: 0.4649, test_loss: 1.2853, test_f1: 0.6548
 epoch: 46, train_loss: 0.4332, test_loss: 1.2801, test_f1: 0.6342
 epoch: 47, train_loss: 0.4171, test_loss: 1.3153, test_f1: 0.6648
 epoch: 48, train_loss: 0.4388, test_loss: 1.2566, test_f1: 0.6634
 epoch: 49, train_loss: 0.4328, test_loss: 1.2384, test_f1: 0.6687
 epoch: 50, train_loss: 0.4017, test_loss: 1.3754, test_f1: 0.6561
 epoch: 51, train_loss: 0.3565, test_loss: 1.4381, test_f1: 0.6884
 epoch: 52, train_loss: 0.3388, test_loss: 1.5533, test_f1: 0.6798
 epoch: 53, train_loss: 0.3225, test_loss: 1.4742, test_f1: 0.6686
 epoch: 54, train_loss: 0.3323, test_loss: 1.7374, test_f1: 0.6771
 epoch: 55, train_loss: 0.3054, test_loss: 1.6172, test_f1: 0.6465
 epoch: 56, train_loss: 0.3035, test_loss: 1.5564, test_f1: 0.6595
 epoch: 57, train_loss: 0.2888, test_loss: 1.6544, test_f1: 0.6754
 epoch: 58, train_loss: 0.2838, test_loss: 1.5994, test_f1: 0.6735
 epoch: 59, train_loss: 0.2924, test_loss: 1.8102, test_f1: 0.6508
 epoch: 60, train_loss: 0.2599, test_loss: 1.8192, test_f1: 0.6645
 epoch: 61, train_loss: 0.2735, test_loss: 1.6932, test_f1: 0.6641
 epoch: 62, train_loss: 0.2626, test_loss: 1.7169, test_f1: 0.6709
 epoch: 63, train_loss: 0.2615, test_loss: 1.7324, test_f1: 0.6867
 epoch: 64, train_loss: 0.2692, test_loss: 1.9310, test_f1: 0.6687
 epoch: 65, train_loss: 0.2495, test_loss: 1.9144, test_f1: 0.6539
 epoch: 66, train_loss: 0.2586, test_loss: 1.8241, test_f1: 0.6514
 epoch: 67, train_loss: 0.2482, test_loss: 1.8788, test_f1: 0.6909
 epoch: 68, train_loss: 0.2609, test_loss: 1.8412, test_f1: 0.6659
 epoch: 69, train_loss: 0.2502, test_loss: 1.7982, test_f1: 0.6954
 epoch: 70, train_loss: 0.2451, test_loss: 1.9596, test_f1: 0.6696
 epoch: 71, train_loss: 0.2391, test_loss: 2.0280, test_f1: 0.6396
 epoch: 72, train_loss: 0.2342, test_loss: 1.9552, test_f1: 0.6683
 epoch: 73, train_loss: 0.2157, test_loss: 2.1043, test_f1: 0.6440
 epoch: 74, train_loss: 0.2289, test_loss: 1.9287, test_f1: 0.6473
 epoch: 75, train_loss: 0.2207, test_loss: 2.1614, test_f1: 0.6368
 epoch: 76, train_loss: 0.2084, test_loss: 2.0568, test_f1: 0.6778
 epoch: 77, train_loss: 0.2110, test_loss: 2.1872, test_f1: 0.6622
 epoch: 78, train_loss: 0.1939, test_loss: 2.1025, test_f1: 0.6639
 epoch: 79, train_loss: 0.2046, test_loss: 2.2142, test_f1: 0.6807
 epoch: 80, train_loss: 0.2056, test_loss: 2.3498, test_f1: 0.6638
 epoch: 81, train_loss: 0.2070, test_loss: 2.2554, test_f1: 0.6708
 epoch: 82, train_loss: 0.2059, test_loss: 2.3474, test_f1: 0.6516
 epoch: 83, train_loss: 0.1958, test_loss: 2.3288, test_f1: 0.6412
 epoch: 84, train_loss: 0.2156, test_loss: 2.2580, test_f1: 0.6533
 epoch: 85, train_loss: 0.1872, test_loss: 2.3068, test_f1: 0.6730
 epoch: 86, train_loss: 0.2143, test_loss: 2.2786, test_f1: 0.6610
 epoch: 87, train_loss: 0.2031, test_loss: 2.3766, test_f1: 0.6626
 epoch: 88, train_loss: 0.1885, test_loss: 2.4892, test_f1: 0.6536
 epoch: 89, train_loss: 0.2013, test_loss: 2.3122, test_f1: 0.6359
 epoch: 90, train_loss: 0.1951, test_loss: 2.3549, test_f1: 0.6396
 epoch: 91, train_loss: 0.1901, test_loss: 2.2569, test_f1: 0.6530
 epoch: 92, train_loss: 0.1992, test_loss: 2.4707, test_f1: 0.6382
 epoch: 93, train_loss: 0.1768, test_loss: 2.4205, test_f1: 0.6370
 epoch: 94, train_loss: 0.1710, test_loss: 2.4055, test_f1: 0.6314
 epoch: 95, train_loss: 0.1656, test_loss: 2.3582, test_f1: 0.6560
 epoch: 96, train_loss: 0.1921, test_loss: 2.4771, test_f1: 0.6586
 epoch: 97, train_loss: 0.1775, test_loss: 2.4290, test_f1: 0.6520
 epoch: 98, train_loss: 0.1666, test_loss: 2.4837, test_f1: 0.6587
 epoch: 99, train_loss: 0.1741, test_loss: 2.5373, test_f1: 0.6360
##################ITERATION #1 ****************************************
 epoch: 0, train_loss: 1.1295, test_loss: 1.0101, test_f1: 0.4321
 epoch: 1, train_loss: 0.9844, test_loss: 0.9904, test_f1: 0.4952
 epoch: 2, train_loss: 0.9410, test_loss: 0.9264, test_f1: 0.5073
 epoch: 3, train_loss: 0.8922, test_loss: 0.9064, test_f1: 0.5744
 epoch: 4, train_loss: 0.8883, test_loss: 0.9073, test_f1: 0.5718
 epoch: 5, train_loss: 0.8627, test_loss: 0.9924, test_f1: 0.5178
 epoch: 6, train_loss: 0.8524, test_loss: 0.9570, test_f1: 0.5459
 epoch: 7, train_loss: 0.8301, test_loss: 0.9217, test_f1: 0.5817
 epoch: 8, train_loss: 0.8258, test_loss: 0.9457, test_f1: 0.5867
 epoch: 9, train_loss: 0.8229, test_loss: 0.9692, test_f1: 0.5759
 epoch: 10, train_loss: 0.8064, test_loss: 0.9096, test_f1: 0.5675
 epoch: 11, train_loss: 0.7959, test_loss: 0.9920, test_f1: 0.5787
 epoch: 12, train_loss: 0.7823, test_loss: 0.9708, test_f1: 0.5533
 epoch: 13, train_loss: 0.7756, test_loss: 0.9280, test_f1: 0.5556
 epoch: 14, train_loss: 0.7523, test_loss: 0.9444, test_f1: 0.5651
 epoch: 15, train_loss: 0.7509, test_loss: 1.0076, test_f1: 0.5974
 epoch: 16, train_loss: 0.7304, test_loss: 0.9590, test_f1: 0.6084
 epoch: 17, train_loss: 0.7483, test_loss: 0.9867, test_f1: 0.6293
 epoch: 18, train_loss: 0.7134, test_loss: 1.0229, test_f1: 0.6056
 epoch: 19, train_loss: 0.7001, test_loss: 0.9990, test_f1: 0.5947
 epoch: 20, train_loss: 0.6853, test_loss: 1.0736, test_f1: 0.5517
 epoch: 21, train_loss: 0.6812, test_loss: 0.9969, test_f1: 0.5853
 epoch: 22, train_loss: 0.6714, test_loss: 1.0090, test_f1: 0.6097
 epoch: 23, train_loss: 0.6748, test_loss: 0.9632, test_f1: 0.5634
 epoch: 24, train_loss: 0.6671, test_loss: 1.0041, test_f1: 0.5856
 epoch: 25, train_loss: 0.6599, test_loss: 0.9792, test_f1: 0.6319
 epoch: 26, train_loss: 0.6291, test_loss: 1.0197, test_f1: 0.5891
 epoch: 27, train_loss: 0.6301, test_loss: 1.0236, test_f1: 0.5852
 epoch: 28, train_loss: 0.6183, test_loss: 0.9679, test_f1: 0.6351
 epoch: 29, train_loss: 0.6319, test_loss: 0.9845, test_f1: 0.6440
 epoch: 30, train_loss: 0.6226, test_loss: 1.1527, test_f1: 0.6071
 epoch: 31, train_loss: 0.6075, test_loss: 0.9726, test_f1: 0.6075
 epoch: 32, train_loss: 0.5703, test_loss: 1.0220, test_f1: 0.6205
 epoch: 33, train_loss: 0.5835, test_loss: 0.9890, test_f1: 0.6186
 epoch: 34, train_loss: 0.5978, test_loss: 1.0373, test_f1: 0.6194
 epoch: 35, train_loss: 0.5667, test_loss: 1.1123, test_f1: 0.6413
 epoch: 36, train_loss: 0.5664, test_loss: 1.1068, test_f1: 0.6339
 epoch: 37, train_loss: 0.5238, test_loss: 1.3305, test_f1: 0.5994
 epoch: 38, train_loss: 0.5281, test_loss: 1.1310, test_f1: 0.6294
 epoch: 39, train_loss: 0.5262, test_loss: 1.0333, test_f1: 0.6330
 epoch: 40, train_loss: 0.5270, test_loss: 1.0582, test_f1: 0.6472
 epoch: 41, train_loss: 0.5143, test_loss: 1.1979, test_f1: 0.6390
 epoch: 42, train_loss: 0.5077, test_loss: 1.1801, test_f1: 0.6653
 epoch: 43, train_loss: 0.4815, test_loss: 1.2030, test_f1: 0.6457
 epoch: 44, train_loss: 0.4801, test_loss: 1.1929, test_f1: 0.6712
 epoch: 45, train_loss: 0.4575, test_loss: 1.1333, test_f1: 0.6645
 epoch: 46, train_loss: 0.4528, test_loss: 1.2026, test_f1: 0.6700
 epoch: 47, train_loss: 0.4543, test_loss: 1.2257, test_f1: 0.6803
 epoch: 48, train_loss: 0.4546, test_loss: 1.4832, test_f1: 0.6319
 epoch: 49, train_loss: 0.4412, test_loss: 1.3247, test_f1: 0.6418
 epoch: 50, train_loss: 0.4398, test_loss: 1.3892, test_f1: 0.6442
 epoch: 51, train_loss: 0.3988, test_loss: 1.3657, test_f1: 0.6479
 epoch: 52, train_loss: 0.3675, test_loss: 1.4111, test_f1: 0.6393
 epoch: 53, train_loss: 0.3549, test_loss: 1.4541, test_f1: 0.6682
 epoch: 54, train_loss: 0.3464, test_loss: 1.4428, test_f1: 0.6456
 epoch: 55, train_loss: 0.3437, test_loss: 1.4844, test_f1: 0.6395
 epoch: 56, train_loss: 0.3008, test_loss: 1.6198, test_f1: 0.6570
 epoch: 57, train_loss: 0.3231, test_loss: 1.6633, test_f1: 0.6595
 epoch: 58, train_loss: 0.3276, test_loss: 1.5130, test_f1: 0.6577
 epoch: 59, train_loss: 0.3141, test_loss: 1.5418, test_f1: 0.6650
 epoch: 60, train_loss: 0.2985, test_loss: 1.6423, test_f1: 0.6518
 epoch: 61, train_loss: 0.2921, test_loss: 1.7973, test_f1: 0.6466
 epoch: 62, train_loss: 0.3069, test_loss: 1.6624, test_f1: 0.6399
 epoch: 63, train_loss: 0.2847, test_loss: 1.7411, test_f1: 0.6366
 epoch: 64, train_loss: 0.3059, test_loss: 1.6486, test_f1: 0.6607
 epoch: 65, train_loss: 0.2684, test_loss: 1.7266, test_f1: 0.6503
 epoch: 66, train_loss: 0.2568, test_loss: 1.7512, test_f1: 0.6455
 epoch: 67, train_loss: 0.2653, test_loss: 1.9835, test_f1: 0.6290
 epoch: 68, train_loss: 0.2793, test_loss: 1.6734, test_f1: 0.6460
 epoch: 69, train_loss: 0.2433, test_loss: 1.7312, test_f1: 0.6544
 epoch: 70, train_loss: 0.2650, test_loss: 1.7759, test_f1: 0.6325
 epoch: 71, train_loss: 0.2460, test_loss: 1.8039, test_f1: 0.6396
 epoch: 72, train_loss: 0.2585, test_loss: 1.9521, test_f1: 0.6307
 epoch: 73, train_loss: 0.2438, test_loss: 1.9500, test_f1: 0.6408
 epoch: 74, train_loss: 0.2444, test_loss: 1.9419, test_f1: 0.6298
 epoch: 75, train_loss: 0.2609, test_loss: 2.0139, test_f1: 0.6313
 epoch: 76, train_loss: 0.2396, test_loss: 2.0062, test_f1: 0.6376
 epoch: 77, train_loss: 0.2256, test_loss: 1.8997, test_f1: 0.6378
 epoch: 78, train_loss: 0.2356, test_loss: 1.7749, test_f1: 0.6583
 epoch: 79, train_loss: 0.2516, test_loss: 1.8658, test_f1: 0.6491
 epoch: 80, train_loss: 0.2120, test_loss: 1.9355, test_f1: 0.6389
 epoch: 81, train_loss: 0.2137, test_loss: 2.0779, test_f1: 0.6376
 epoch: 82, train_loss: 0.2087, test_loss: 1.8454, test_f1: 0.6435
 epoch: 83, train_loss: 0.2187, test_loss: 1.9756, test_f1: 0.6577
 epoch: 84, train_loss: 0.2106, test_loss: 1.9465, test_f1: 0.6594
 epoch: 85, train_loss: 0.2146, test_loss: 2.1122, test_f1: 0.6420
 epoch: 86, train_loss: 0.2218, test_loss: 2.0122, test_f1: 0.6586
 epoch: 87, train_loss: 0.2233, test_loss: 2.0488, test_f1: 0.6374
 epoch: 88, train_loss: 0.1993, test_loss: 2.0876, test_f1: 0.6456
 epoch: 89, train_loss: 0.2013, test_loss: 2.0411, test_f1: 0.6486
 epoch: 90, train_loss: 0.1974, test_loss: 2.1893, test_f1: 0.6409
 epoch: 91, train_loss: 0.2047, test_loss: 2.2147, test_f1: 0.6454
 epoch: 92, train_loss: 0.1976, test_loss: 2.1093, test_f1: 0.6365
 epoch: 93, train_loss: 0.1810, test_loss: 2.2057, test_f1: 0.6508
 epoch: 94, train_loss: 0.2077, test_loss: 2.0787, test_f1: 0.6548
 epoch: 95, train_loss: 0.2097, test_loss: 2.2751, test_f1: 0.6350
 epoch: 96, train_loss: 0.2108, test_loss: 2.0384, test_f1: 0.6417
 epoch: 97, train_loss: 0.1895, test_loss: 2.1568, test_f1: 0.6446
 epoch: 98, train_loss: 0.1748, test_loss: 2.4875, test_f1: 0.6332
 epoch: 99, train_loss: 0.1888, test_loss: 2.0491, test_f1: 0.6454
##################ITERATION #2 ****************************************
 epoch: 0, train_loss: 1.1595, test_loss: 1.0273, test_f1: 0.4505
 epoch: 1, train_loss: 0.9810, test_loss: 0.9539, test_f1: 0.5181
 epoch: 2, train_loss: 0.9404, test_loss: 0.9428, test_f1: 0.5081
 epoch: 3, train_loss: 0.9165, test_loss: 0.9165, test_f1: 0.5117
 epoch: 4, train_loss: 0.8992, test_loss: 0.9414, test_f1: 0.5165
 epoch: 5, train_loss: 0.8964, test_loss: 0.9260, test_f1: 0.5519
 epoch: 6, train_loss: 0.8684, test_loss: 0.9209, test_f1: 0.5145
 epoch: 7, train_loss: 0.8570, test_loss: 0.9205, test_f1: 0.5711
 epoch: 8, train_loss: 0.8493, test_loss: 0.9574, test_f1: 0.5401
 epoch: 9, train_loss: 0.8256, test_loss: 0.9749, test_f1: 0.5708
 epoch: 10, train_loss: 0.8205, test_loss: 0.9439, test_f1: 0.5452
 epoch: 11, train_loss: 0.8130, test_loss: 0.9486, test_f1: 0.5635
 epoch: 12, train_loss: 0.8066, test_loss: 0.9346, test_f1: 0.5342
 epoch: 13, train_loss: 0.7876, test_loss: 0.9459, test_f1: 0.5765
 epoch: 14, train_loss: 0.7869, test_loss: 0.9455, test_f1: 0.5489
 epoch: 15, train_loss: 0.7877, test_loss: 0.9450, test_f1: 0.5485
 epoch: 16, train_loss: 0.7593, test_loss: 0.9149, test_f1: 0.5941
 epoch: 17, train_loss: 0.7670, test_loss: 1.0088, test_f1: 0.5476
 epoch: 18, train_loss: 0.7564, test_loss: 0.9511, test_f1: 0.5867
 epoch: 19, train_loss: 0.7485, test_loss: 1.0300, test_f1: 0.5245
 epoch: 20, train_loss: 0.7524, test_loss: 1.0100, test_f1: 0.5947
 epoch: 21, train_loss: 0.7398, test_loss: 0.9477, test_f1: 0.5906
 epoch: 22, train_loss: 0.7208, test_loss: 1.0082, test_f1: 0.5853
 epoch: 23, train_loss: 0.7175, test_loss: 0.9385, test_f1: 0.5988
 epoch: 24, train_loss: 0.6892, test_loss: 0.9411, test_f1: 0.5957
 epoch: 25, train_loss: 0.6967, test_loss: 1.0251, test_f1: 0.5970
 epoch: 26, train_loss: 0.6818, test_loss: 1.0116, test_f1: 0.5716
 epoch: 27, train_loss: 0.6598, test_loss: 0.9215, test_f1: 0.6255
 epoch: 28, train_loss: 0.6635, test_loss: 1.0283, test_f1: 0.5739
 epoch: 29, train_loss: 0.6473, test_loss: 0.9415, test_f1: 0.6107
 epoch: 30, train_loss: 0.6464, test_loss: 0.9775, test_f1: 0.5892
 epoch: 31, train_loss: 0.6421, test_loss: 1.0151, test_f1: 0.6040
 epoch: 32, train_loss: 0.6338, test_loss: 1.0129, test_f1: 0.6635
 epoch: 33, train_loss: 0.6095, test_loss: 1.0933, test_f1: 0.6294
 epoch: 34, train_loss: 0.6226, test_loss: 1.0761, test_f1: 0.6181
 epoch: 35, train_loss: 0.5975, test_loss: 1.0678, test_f1: 0.6465
 epoch: 36, train_loss: 0.6043, test_loss: 0.9989, test_f1: 0.6335
 epoch: 37, train_loss: 0.5967, test_loss: 1.0472, test_f1: 0.5781
 epoch: 38, train_loss: 0.5927, test_loss: 1.0374, test_f1: 0.6373
 epoch: 39, train_loss: 0.5652, test_loss: 1.1395, test_f1: 0.6112
 epoch: 40, train_loss: 0.5647, test_loss: 1.0649, test_f1: 0.6271
 epoch: 41, train_loss: 0.5645, test_loss: 0.9477, test_f1: 0.6196
 epoch: 42, train_loss: 0.5481, test_loss: 1.0558, test_f1: 0.6465
 epoch: 43, train_loss: 0.5327, test_loss: 1.1562, test_f1: 0.6236
 epoch: 44, train_loss: 0.5332, test_loss: 1.1433, test_f1: 0.6365
 epoch: 45, train_loss: 0.5088, test_loss: 1.0599, test_f1: 0.6511
 epoch: 46, train_loss: 0.5135, test_loss: 1.1360, test_f1: 0.6818
 epoch: 47, train_loss: 0.5102, test_loss: 1.1869, test_f1: 0.6153
 epoch: 48, train_loss: 0.4840, test_loss: 1.1282, test_f1: 0.6366
 epoch: 49, train_loss: 0.4786, test_loss: 1.2269, test_f1: 0.6238
 epoch: 50, train_loss: 0.5085, test_loss: 1.1884, test_f1: 0.6720
 epoch: 51, train_loss: 0.4431, test_loss: 1.2182, test_f1: 0.6881
 epoch: 52, train_loss: 0.4062, test_loss: 1.2443, test_f1: 0.6550
 epoch: 53, train_loss: 0.3942, test_loss: 1.3165, test_f1: 0.6682
 epoch: 54, train_loss: 0.3886, test_loss: 1.3127, test_f1: 0.6426
 epoch: 55, train_loss: 0.3727, test_loss: 1.2960, test_f1: 0.6522
 epoch: 56, train_loss: 0.3691, test_loss: 1.4039, test_f1: 0.6507
 epoch: 57, train_loss: 0.3563, test_loss: 1.4037, test_f1: 0.6678
 epoch: 58, train_loss: 0.3667, test_loss: 1.3459, test_f1: 0.6383
 epoch: 59, train_loss: 0.3566, test_loss: 1.4014, test_f1: 0.6473
 epoch: 60, train_loss: 0.3586, test_loss: 1.3812, test_f1: 0.6459
 epoch: 61, train_loss: 0.3250, test_loss: 1.4625, test_f1: 0.6432
 epoch: 62, train_loss: 0.3230, test_loss: 1.5331, test_f1: 0.6498
 epoch: 63, train_loss: 0.3053, test_loss: 1.5121, test_f1: 0.6412
 epoch: 64, train_loss: 0.3219, test_loss: 1.5593, test_f1: 0.6411
 epoch: 65, train_loss: 0.3278, test_loss: 1.5654, test_f1: 0.6534
 epoch: 66, train_loss: 0.2946, test_loss: 1.5123, test_f1: 0.6342
 epoch: 67, train_loss: 0.3232, test_loss: 1.3663, test_f1: 0.6624
 epoch: 68, train_loss: 0.3214, test_loss: 1.5162, test_f1: 0.6779
 epoch: 69, train_loss: 0.2945, test_loss: 1.6274, test_f1: 0.6478
 epoch: 70, train_loss: 0.2959, test_loss: 1.4934, test_f1: 0.6286
 epoch: 71, train_loss: 0.2804, test_loss: 1.6116, test_f1: 0.6541
 epoch: 72, train_loss: 0.2841, test_loss: 1.6018, test_f1: 0.6595
 epoch: 73, train_loss: 0.2737, test_loss: 1.7078, test_f1: 0.6375
 epoch: 74, train_loss: 0.2834, test_loss: 1.6100, test_f1: 0.6528
 epoch: 75, train_loss: 0.2883, test_loss: 1.6918, test_f1: 0.6190
 epoch: 76, train_loss: 0.2623, test_loss: 1.6239, test_f1: 0.6419
 epoch: 77, train_loss: 0.2874, test_loss: 1.6280, test_f1: 0.6360
 epoch: 78, train_loss: 0.2561, test_loss: 1.6409, test_f1: 0.6296
 epoch: 79, train_loss: 0.2507, test_loss: 1.7241, test_f1: 0.6451
 epoch: 80, train_loss: 0.2582, test_loss: 1.8111, test_f1: 0.6200
 epoch: 81, train_loss: 0.2354, test_loss: 1.7245, test_f1: 0.6372
 epoch: 82, train_loss: 0.2300, test_loss: 2.0758, test_f1: 0.6110
 epoch: 83, train_loss: 0.2400, test_loss: 1.8204, test_f1: 0.6246
 epoch: 84, train_loss: 0.2385, test_loss: 1.7893, test_f1: 0.6282
 epoch: 85, train_loss: 0.2530, test_loss: 1.7946, test_f1: 0.6345
 epoch: 86, train_loss: 0.2438, test_loss: 1.7191, test_f1: 0.6577
 epoch: 87, train_loss: 0.2413, test_loss: 1.8169, test_f1: 0.6359
 epoch: 88, train_loss: 0.2105, test_loss: 1.6321, test_f1: 0.6608
 epoch: 89, train_loss: 0.2274, test_loss: 1.7932, test_f1: 0.6265
 epoch: 90, train_loss: 0.2246, test_loss: 1.7951, test_f1: 0.6448
 epoch: 91, train_loss: 0.2357, test_loss: 1.7630, test_f1: 0.6308
 epoch: 92, train_loss: 0.2125, test_loss: 1.7447, test_f1: 0.6555
 epoch: 93, train_loss: 0.2327, test_loss: 1.7996, test_f1: 0.6629
 epoch: 94, train_loss: 0.2164, test_loss: 1.9212, test_f1: 0.6339
 epoch: 95, train_loss: 0.2311, test_loss: 1.7745, test_f1: 0.6276
 epoch: 96, train_loss: 0.2022, test_loss: 1.9708, test_f1: 0.6485
 epoch: 97, train_loss: 0.2121, test_loss: 2.0069, test_f1: 0.6304
 epoch: 98, train_loss: 0.2006, test_loss: 1.8163, test_f1: 0.6675
 epoch: 99, train_loss: 0.2085, test_loss: 2.1160, test_f1: 0.6319
##################ITERATION #3 ****************************************
 epoch: 0, train_loss: 1.2608, test_loss: 1.0234, test_f1: 0.4926
 epoch: 1, train_loss: 0.9991, test_loss: 0.9458, test_f1: 0.5203
 epoch: 2, train_loss: 0.9493, test_loss: 0.9584, test_f1: 0.5305
 epoch: 3, train_loss: 0.9242, test_loss: 0.9413, test_f1: 0.5348
 epoch: 4, train_loss: 0.9080, test_loss: 0.9422, test_f1: 0.5327
 epoch: 5, train_loss: 0.8765, test_loss: 0.9423, test_f1: 0.5558
 epoch: 6, train_loss: 0.8555, test_loss: 0.9131, test_f1: 0.5561
 epoch: 7, train_loss: 0.8443, test_loss: 0.9996, test_f1: 0.5025
 epoch: 8, train_loss: 0.8350, test_loss: 0.9708, test_f1: 0.5633
 epoch: 9, train_loss: 0.8157, test_loss: 0.9755, test_f1: 0.5412
 epoch: 10, train_loss: 0.8149, test_loss: 0.9149, test_f1: 0.6225
 epoch: 11, train_loss: 0.7990, test_loss: 0.9078, test_f1: 0.5512
 epoch: 12, train_loss: 0.7996, test_loss: 0.9651, test_f1: 0.5501
 epoch: 13, train_loss: 0.7781, test_loss: 0.9645, test_f1: 0.5549
 epoch: 14, train_loss: 0.7695, test_loss: 0.9198, test_f1: 0.5805
 epoch: 15, train_loss: 0.7643, test_loss: 1.0101, test_f1: 0.5884
 epoch: 16, train_loss: 0.7639, test_loss: 0.9728, test_f1: 0.6015
 epoch: 17, train_loss: 0.7353, test_loss: 0.9624, test_f1: 0.5892
 epoch: 18, train_loss: 0.7316, test_loss: 1.1011, test_f1: 0.5674
 epoch: 19, train_loss: 0.7255, test_loss: 0.9064, test_f1: 0.6025
 epoch: 20, train_loss: 0.7091, test_loss: 1.0601, test_f1: 0.5694
 epoch: 21, train_loss: 0.6971, test_loss: 0.8871, test_f1: 0.6282
 epoch: 22, train_loss: 0.6907, test_loss: 0.9902, test_f1: 0.5875
 epoch: 23, train_loss: 0.6816, test_loss: 0.9708, test_f1: 0.6446
 epoch: 24, train_loss: 0.6985, test_loss: 0.9936, test_f1: 0.6141
 epoch: 25, train_loss: 0.6694, test_loss: 1.1924, test_f1: 0.5731
 epoch: 26, train_loss: 0.6526, test_loss: 1.1071, test_f1: 0.5857
 epoch: 27, train_loss: 0.6730, test_loss: 0.9888, test_f1: 0.6330
 epoch: 28, train_loss: 0.6586, test_loss: 1.0619, test_f1: 0.6365
 epoch: 29, train_loss: 0.6426, test_loss: 1.3296, test_f1: 0.5435
 epoch: 30, train_loss: 0.6418, test_loss: 1.0289, test_f1: 0.6224
 epoch: 31, train_loss: 0.6199, test_loss: 1.0165, test_f1: 0.6052
 epoch: 32, train_loss: 0.6015, test_loss: 1.0654, test_f1: 0.6308
 epoch: 33, train_loss: 0.6046, test_loss: 0.9899, test_f1: 0.6548
 epoch: 34, train_loss: 0.5907, test_loss: 1.0744, test_f1: 0.6279
 epoch: 35, train_loss: 0.5816, test_loss: 0.9123, test_f1: 0.6480
 epoch: 36, train_loss: 0.5750, test_loss: 1.1046, test_f1: 0.6419
 epoch: 37, train_loss: 0.5502, test_loss: 0.9292, test_f1: 0.6647
 epoch: 38, train_loss: 0.5569, test_loss: 1.2082, test_f1: 0.6330
 epoch: 39, train_loss: 0.5471, test_loss: 1.0813, test_f1: 0.6172
 epoch: 40, train_loss: 0.5485, test_loss: 1.0982, test_f1: 0.6322
 epoch: 41, train_loss: 0.5162, test_loss: 1.0098, test_f1: 0.6393
 epoch: 42, train_loss: 0.4971, test_loss: 1.0456, test_f1: 0.6950
 epoch: 43, train_loss: 0.5066, test_loss: 1.0347, test_f1: 0.6382
 epoch: 44, train_loss: 0.5000, test_loss: 1.1005, test_f1: 0.6767
 epoch: 45, train_loss: 0.5179, test_loss: 1.2558, test_f1: 0.6407
 epoch: 46, train_loss: 0.4940, test_loss: 1.1834, test_f1: 0.6562
 epoch: 47, train_loss: 0.4661, test_loss: 1.1022, test_f1: 0.6657
 epoch: 48, train_loss: 0.4766, test_loss: 1.1174, test_f1: 0.6499
 epoch: 49, train_loss: 0.4442, test_loss: 1.1570, test_f1: 0.6653
 epoch: 50, train_loss: 0.4447, test_loss: 1.1920, test_f1: 0.6415
 epoch: 51, train_loss: 0.4138, test_loss: 1.2671, test_f1: 0.6679
 epoch: 52, train_loss: 0.3894, test_loss: 1.2214, test_f1: 0.6909
 epoch: 53, train_loss: 0.3638, test_loss: 1.1961, test_f1: 0.6536
 epoch: 54, train_loss: 0.3374, test_loss: 1.3776, test_f1: 0.6490
 epoch: 55, train_loss: 0.3470, test_loss: 1.4455, test_f1: 0.6323
 epoch: 56, train_loss: 0.3553, test_loss: 1.3324, test_f1: 0.6460
 epoch: 57, train_loss: 0.3476, test_loss: 1.2885, test_f1: 0.6771
 epoch: 58, train_loss: 0.3345, test_loss: 1.4467, test_f1: 0.6367
 epoch: 59, train_loss: 0.3194, test_loss: 1.3914, test_f1: 0.6743
 epoch: 60, train_loss: 0.3125, test_loss: 1.4353, test_f1: 0.6763
 epoch: 61, train_loss: 0.2999, test_loss: 1.4012, test_f1: 0.6540
 epoch: 62, train_loss: 0.2968, test_loss: 1.4756, test_f1: 0.6475
 epoch: 63, train_loss: 0.3160, test_loss: 1.4760, test_f1: 0.6375
 epoch: 64, train_loss: 0.3058, test_loss: 1.3747, test_f1: 0.6420
 epoch: 65, train_loss: 0.2894, test_loss: 1.5252, test_f1: 0.6625
 epoch: 66, train_loss: 0.2843, test_loss: 1.4699, test_f1: 0.6918
 epoch: 67, train_loss: 0.2928, test_loss: 1.5026, test_f1: 0.6386
 epoch: 68, train_loss: 0.2770, test_loss: 1.5754, test_f1: 0.6552
 epoch: 69, train_loss: 0.2843, test_loss: 1.5896, test_f1: 0.6509
 epoch: 70, train_loss: 0.2802, test_loss: 1.5944, test_f1: 0.6358
 epoch: 71, train_loss: 0.2780, test_loss: 1.6265, test_f1: 0.6276
 epoch: 72, train_loss: 0.2585, test_loss: 1.7083, test_f1: 0.6453
 epoch: 73, train_loss: 0.2861, test_loss: 1.6619, test_f1: 0.6510
 epoch: 74, train_loss: 0.2609, test_loss: 1.5626, test_f1: 0.6564
 epoch: 75, train_loss: 0.2511, test_loss: 1.7334, test_f1: 0.6356
 epoch: 76, train_loss: 0.2751, test_loss: 1.6586, test_f1: 0.6460
 epoch: 77, train_loss: 0.2446, test_loss: 1.6341, test_f1: 0.6642
 epoch: 78, train_loss: 0.2599, test_loss: 1.6552, test_f1: 0.6506
 epoch: 79, train_loss: 0.2542, test_loss: 1.6686, test_f1: 0.6683
 epoch: 80, train_loss: 0.2434, test_loss: 1.7342, test_f1: 0.6558
 epoch: 81, train_loss: 0.2656, test_loss: 1.5990, test_f1: 0.6691
 epoch: 82, train_loss: 0.2554, test_loss: 1.7394, test_f1: 0.6562
 epoch: 83, train_loss: 0.2490, test_loss: 1.6621, test_f1: 0.6644
 epoch: 84, train_loss: 0.2311, test_loss: 1.7750, test_f1: 0.6656
 epoch: 85, train_loss: 0.2598, test_loss: 1.7776, test_f1: 0.6596
 epoch: 86, train_loss: 0.2385, test_loss: 1.6267, test_f1: 0.6519
 epoch: 87, train_loss: 0.2241, test_loss: 1.9051, test_f1: 0.6463
 epoch: 88, train_loss: 0.2143, test_loss: 1.8182, test_f1: 0.6466
 epoch: 89, train_loss: 0.2126, test_loss: 1.7136, test_f1: 0.6560
 epoch: 90, train_loss: 0.2213, test_loss: 1.8432, test_f1: 0.6567
 epoch: 91, train_loss: 0.2172, test_loss: 1.8112, test_f1: 0.6530
 epoch: 92, train_loss: 0.2313, test_loss: 1.8993, test_f1: 0.6694
 epoch: 93, train_loss: 0.2126, test_loss: 1.9347, test_f1: 0.6682
 epoch: 94, train_loss: 0.1931, test_loss: 1.7728, test_f1: 0.6531
 epoch: 95, train_loss: 0.2292, test_loss: 1.9143, test_f1: 0.6372
 epoch: 96, train_loss: 0.2283, test_loss: 1.8389, test_f1: 0.6410
 epoch: 97, train_loss: 0.2166, test_loss: 1.9489, test_f1: 0.6300
 epoch: 98, train_loss: 0.1955, test_loss: 1.8728, test_f1: 0.6331
 epoch: 99, train_loss: 0.2055, test_loss: 1.8889, test_f1: 0.6332
##################ITERATION #4 ****************************************
 epoch: 0, train_loss: 1.2550, test_loss: 0.9810, test_f1: 0.4464
 epoch: 1, train_loss: 0.9758, test_loss: 0.9192, test_f1: 0.5109
 epoch: 2, train_loss: 0.9433, test_loss: 0.9235, test_f1: 0.5163
 epoch: 3, train_loss: 0.9220, test_loss: 0.9351, test_f1: 0.5205
 epoch: 4, train_loss: 0.8873, test_loss: 0.9786, test_f1: 0.4940
 epoch: 5, train_loss: 0.8744, test_loss: 0.9445, test_f1: 0.5313
 epoch: 6, train_loss: 0.8656, test_loss: 0.9036, test_f1: 0.5650
 epoch: 7, train_loss: 0.8356, test_loss: 0.9259, test_f1: 0.5433
 epoch: 8, train_loss: 0.8368, test_loss: 0.8730, test_f1: 0.5582
 epoch: 9, train_loss: 0.8212, test_loss: 0.9137, test_f1: 0.5456
 epoch: 10, train_loss: 0.7933, test_loss: 0.9443, test_f1: 0.5423
 epoch: 11, train_loss: 0.8092, test_loss: 0.9502, test_f1: 0.5530
 epoch: 12, train_loss: 0.7902, test_loss: 0.8577, test_f1: 0.5533
 epoch: 13, train_loss: 0.7734, test_loss: 0.9533, test_f1: 0.5435
 epoch: 14, train_loss: 0.7653, test_loss: 0.9453, test_f1: 0.5652
 epoch: 15, train_loss: 0.7478, test_loss: 0.9175, test_f1: 0.5579
 epoch: 16, train_loss: 0.7438, test_loss: 0.9469, test_f1: 0.6026
 epoch: 17, train_loss: 0.7312, test_loss: 0.8824, test_f1: 0.5797
 epoch: 18, train_loss: 0.7478, test_loss: 0.9589, test_f1: 0.5984
 epoch: 19, train_loss: 0.7189, test_loss: 0.9123, test_f1: 0.5971
 epoch: 20, train_loss: 0.7111, test_loss: 0.9275, test_f1: 0.6260
 epoch: 21, train_loss: 0.7088, test_loss: 0.8761, test_f1: 0.5618
 epoch: 22, train_loss: 0.6816, test_loss: 0.9200, test_f1: 0.6229
 epoch: 23, train_loss: 0.6882, test_loss: 0.8853, test_f1: 0.6238
 epoch: 24, train_loss: 0.6737, test_loss: 0.8813, test_f1: 0.6127
 epoch: 25, train_loss: 0.6648, test_loss: 0.9260, test_f1: 0.6222
 epoch: 26, train_loss: 0.6556, test_loss: 0.8865, test_f1: 0.6089
 epoch: 27, train_loss: 0.6631, test_loss: 0.8981, test_f1: 0.6299
 epoch: 28, train_loss: 0.6522, test_loss: 0.9096, test_f1: 0.6193
 epoch: 29, train_loss: 0.6242, test_loss: 0.9274, test_f1: 0.6088
 epoch: 30, train_loss: 0.6211, test_loss: 0.9465, test_f1: 0.6371
 epoch: 31, train_loss: 0.6156, test_loss: 0.9646, test_f1: 0.6034
 epoch: 32, train_loss: 0.6040, test_loss: 0.9177, test_f1: 0.6656
 epoch: 33, train_loss: 0.5925, test_loss: 0.8759, test_f1: 0.6253
 epoch: 34, train_loss: 0.5907, test_loss: 0.9582, test_f1: 0.6441
 epoch: 35, train_loss: 0.5902, test_loss: 0.9930, test_f1: 0.6408
 epoch: 36, train_loss: 0.5801, test_loss: 0.9975, test_f1: 0.6409
 epoch: 37, train_loss: 0.5805, test_loss: 1.0186, test_f1: 0.6239
 epoch: 38, train_loss: 0.5806, test_loss: 0.9848, test_f1: 0.6242
 epoch: 39, train_loss: 0.5483, test_loss: 1.0852, test_f1: 0.6127
 epoch: 40, train_loss: 0.5460, test_loss: 1.1291, test_f1: 0.6213
 epoch: 41, train_loss: 0.5315, test_loss: 1.1273, test_f1: 0.6223
 epoch: 42, train_loss: 0.5399, test_loss: 1.0451, test_f1: 0.6641
 epoch: 43, train_loss: 0.5422, test_loss: 1.1413, test_f1: 0.6481
 epoch: 44, train_loss: 0.5160, test_loss: 1.0848, test_f1: 0.6385
 epoch: 45, train_loss: 0.5006, test_loss: 1.2376, test_f1: 0.6359
 epoch: 46, train_loss: 0.4909, test_loss: 1.1292, test_f1: 0.6328
 epoch: 47, train_loss: 0.4902, test_loss: 1.1505, test_f1: 0.6483
 epoch: 48, train_loss: 0.4891, test_loss: 1.1193, test_f1: 0.6350
 epoch: 49, train_loss: 0.4969, test_loss: 0.9935, test_f1: 0.6404
 epoch: 50, train_loss: 0.4759, test_loss: 1.1891, test_f1: 0.6680
 epoch: 51, train_loss: 0.4248, test_loss: 1.1449, test_f1: 0.6332
 epoch: 52, train_loss: 0.4008, test_loss: 1.1134, test_f1: 0.6547
 epoch: 53, train_loss: 0.3894, test_loss: 1.2395, test_f1: 0.6383
 epoch: 54, train_loss: 0.3887, test_loss: 1.1448, test_f1: 0.6730
 epoch: 55, train_loss: 0.3632, test_loss: 1.2378, test_f1: 0.6655
 epoch: 56, train_loss: 0.3695, test_loss: 1.2982, test_f1: 0.6433
 epoch: 57, train_loss: 0.3525, test_loss: 1.2237, test_f1: 0.6428
 epoch: 58, train_loss: 0.3586, test_loss: 1.2752, test_f1: 0.6461
 epoch: 59, train_loss: 0.3363, test_loss: 1.2730, test_f1: 0.6571
 epoch: 60, train_loss: 0.3302, test_loss: 1.2963, test_f1: 0.6556
 epoch: 61, train_loss: 0.3179, test_loss: 1.3935, test_f1: 0.6508
 epoch: 62, train_loss: 0.3569, test_loss: 1.3229, test_f1: 0.6547
 epoch: 63, train_loss: 0.3308, test_loss: 1.3558, test_f1: 0.6865
 epoch: 64, train_loss: 0.3369, test_loss: 1.3094, test_f1: 0.6420
 epoch: 65, train_loss: 0.3263, test_loss: 1.3536, test_f1: 0.6503
 epoch: 66, train_loss: 0.3123, test_loss: 1.3545, test_f1: 0.6558
 epoch: 67, train_loss: 0.2970, test_loss: 1.3330, test_f1: 0.6771
 epoch: 68, train_loss: 0.3128, test_loss: 1.3955, test_f1: 0.6551
 epoch: 69, train_loss: 0.3102, test_loss: 1.4747, test_f1: 0.6426
 epoch: 70, train_loss: 0.3040, test_loss: 1.3878, test_f1: 0.6563
 epoch: 71, train_loss: 0.3069, test_loss: 1.4310, test_f1: 0.6443
 epoch: 72, train_loss: 0.2911, test_loss: 1.5047, test_f1: 0.6453
 epoch: 73, train_loss: 0.2983, test_loss: 1.5227, test_f1: 0.6301
 epoch: 74, train_loss: 0.2779, test_loss: 1.4967, test_f1: 0.6412
 epoch: 75, train_loss: 0.2912, test_loss: 1.4547, test_f1: 0.6407
 epoch: 76, train_loss: 0.2735, test_loss: 1.5597, test_f1: 0.6463
 epoch: 77, train_loss: 0.2608, test_loss: 1.6890, test_f1: 0.6478
 epoch: 78, train_loss: 0.2553, test_loss: 1.6223, test_f1: 0.6540
 epoch: 79, train_loss: 0.2635, test_loss: 1.6181, test_f1: 0.6378
 epoch: 80, train_loss: 0.2618, test_loss: 1.6172, test_f1: 0.6543
 epoch: 81, train_loss: 0.2514, test_loss: 1.5893, test_f1: 0.6600
 epoch: 82, train_loss: 0.2433, test_loss: 1.5817, test_f1: 0.6403
 epoch: 83, train_loss: 0.2379, test_loss: 1.5576, test_f1: 0.6547
 epoch: 84, train_loss: 0.2396, test_loss: 1.6911, test_f1: 0.6485
 epoch: 85, train_loss: 0.2523, test_loss: 1.5702, test_f1: 0.6651
 epoch: 86, train_loss: 0.2424, test_loss: 1.5921, test_f1: 0.6526
 epoch: 87, train_loss: 0.2447, test_loss: 1.6656, test_f1: 0.6535
 epoch: 88, train_loss: 0.2279, test_loss: 1.7345, test_f1: 0.6398
 epoch: 89, train_loss: 0.2511, test_loss: 1.5927, test_f1: 0.6610
 epoch: 90, train_loss: 0.2555, test_loss: 1.6788, test_f1: 0.6734
 epoch: 91, train_loss: 0.2231, test_loss: 1.6892, test_f1: 0.6546
 epoch: 92, train_loss: 0.2465, test_loss: 1.7516, test_f1: 0.6301
 epoch: 93, train_loss: 0.2282, test_loss: 1.7862, test_f1: 0.6523
 epoch: 94, train_loss: 0.2395, test_loss: 1.6380, test_f1: 0.6592
 epoch: 95, train_loss: 0.2212, test_loss: 1.6933, test_f1: 0.6610
 epoch: 96, train_loss: 0.2153, test_loss: 1.8396, test_f1: 0.6405
 epoch: 97, train_loss: 0.2185, test_loss: 1.8520, test_f1: 0.6495
 epoch: 98, train_loss: 0.2122, test_loss: 1.9329, test_f1: 0.6412
 epoch: 99, train_loss: 0.2163, test_loss: 1.8997, test_f1: 0.6357
##################ITERATION #5 ****************************************
 epoch: 0, train_loss: 1.3238, test_loss: 1.0822, test_f1: 0.3579
 epoch: 1, train_loss: 0.9972, test_loss: 0.9514, test_f1: 0.4761
 epoch: 2, train_loss: 0.9479, test_loss: 0.9411, test_f1: 0.5103
 epoch: 3, train_loss: 0.9324, test_loss: 0.9500, test_f1: 0.4977
 epoch: 4, train_loss: 0.9120, test_loss: 0.9379, test_f1: 0.5312
 epoch: 5, train_loss: 0.8981, test_loss: 0.8934, test_f1: 0.5336
 epoch: 6, train_loss: 0.8677, test_loss: 0.9364, test_f1: 0.5566
 epoch: 7, train_loss: 0.8536, test_loss: 0.9400, test_f1: 0.5349
 epoch: 8, train_loss: 0.8462, test_loss: 0.9152, test_f1: 0.5746
 epoch: 9, train_loss: 0.8241, test_loss: 1.0114, test_f1: 0.5579
 epoch: 10, train_loss: 0.8387, test_loss: 0.9432, test_f1: 0.5473
 epoch: 11, train_loss: 0.7940, test_loss: 0.9445, test_f1: 0.5614
 epoch: 12, train_loss: 0.7855, test_loss: 0.9402, test_f1: 0.5695
 epoch: 13, train_loss: 0.7933, test_loss: 0.9441, test_f1: 0.5917
 epoch: 14, train_loss: 0.7623, test_loss: 0.9149, test_f1: 0.5692
 epoch: 15, train_loss: 0.7712, test_loss: 0.9524, test_f1: 0.5816
 epoch: 16, train_loss: 0.7727, test_loss: 0.9440, test_f1: 0.5936
 epoch: 17, train_loss: 0.7542, test_loss: 0.9478, test_f1: 0.5860
 epoch: 18, train_loss: 0.7299, test_loss: 0.9252, test_f1: 0.6038
 epoch: 19, train_loss: 0.7260, test_loss: 0.9984, test_f1: 0.6032
 epoch: 20, train_loss: 0.7144, test_loss: 0.8898, test_f1: 0.6140
 epoch: 21, train_loss: 0.7124, test_loss: 0.9728, test_f1: 0.6048
 epoch: 22, train_loss: 0.6804, test_loss: 1.0053, test_f1: 0.6042
 epoch: 23, train_loss: 0.6791, test_loss: 0.8898, test_f1: 0.5884
 epoch: 24, train_loss: 0.6575, test_loss: 0.9908, test_f1: 0.6502
 epoch: 25, train_loss: 0.6716, test_loss: 1.0144, test_f1: 0.5728
 epoch: 26, train_loss: 0.6639, test_loss: 1.0692, test_f1: 0.6120
 epoch: 27, train_loss: 0.6458, test_loss: 1.0278, test_f1: 0.6209
 epoch: 28, train_loss: 0.6304, test_loss: 0.9573, test_f1: 0.6434
 epoch: 29, train_loss: 0.6328, test_loss: 1.0228, test_f1: 0.6190
 epoch: 30, train_loss: 0.6162, test_loss: 1.0088, test_f1: 0.6056
 epoch: 31, train_loss: 0.6082, test_loss: 1.1003, test_f1: 0.6073
 epoch: 32, train_loss: 0.5925, test_loss: 1.0020, test_f1: 0.5972
 epoch: 33, train_loss: 0.5968, test_loss: 1.0385, test_f1: 0.6267
 epoch: 34, train_loss: 0.5843, test_loss: 1.1367, test_f1: 0.6221
 epoch: 35, train_loss: 0.5912, test_loss: 1.0263, test_f1: 0.6950
 epoch: 36, train_loss: 0.5617, test_loss: 1.0704, test_f1: 0.6684
 epoch: 37, train_loss: 0.5620, test_loss: 0.9740, test_f1: 0.6617
 epoch: 38, train_loss: 0.5569, test_loss: 1.1002, test_f1: 0.6422
 epoch: 39, train_loss: 0.5258, test_loss: 1.0649, test_f1: 0.6658
 epoch: 40, train_loss: 0.5253, test_loss: 1.1268, test_f1: 0.6616
 epoch: 41, train_loss: 0.5183, test_loss: 1.1149, test_f1: 0.6522
 epoch: 42, train_loss: 0.5244, test_loss: 1.1796, test_f1: 0.6563
 epoch: 43, train_loss: 0.5062, test_loss: 1.1235, test_f1: 0.6530
 epoch: 44, train_loss: 0.4818, test_loss: 1.2028, test_f1: 0.6336
 epoch: 45, train_loss: 0.5023, test_loss: 1.0825, test_f1: 0.6674
 epoch: 46, train_loss: 0.4885, test_loss: 1.1015, test_f1: 0.6822
 epoch: 47, train_loss: 0.4726, test_loss: 1.1424, test_f1: 0.6606
 epoch: 48, train_loss: 0.4554, test_loss: 1.1202, test_f1: 0.6795
 epoch: 49, train_loss: 0.4611, test_loss: 1.1541, test_f1: 0.6407
 epoch: 50, train_loss: 0.4752, test_loss: 1.1372, test_f1: 0.6698
 epoch: 51, train_loss: 0.4327, test_loss: 1.2028, test_f1: 0.6651
 epoch: 52, train_loss: 0.3858, test_loss: 1.2023, test_f1: 0.7019
 epoch: 53, train_loss: 0.3755, test_loss: 1.2186, test_f1: 0.6594
 epoch: 54, train_loss: 0.3750, test_loss: 1.1268, test_f1: 0.6984
 epoch: 55, train_loss: 0.3466, test_loss: 1.1819, test_f1: 0.6764
 epoch: 56, train_loss: 0.3415, test_loss: 1.2663, test_f1: 0.6649
 epoch: 57, train_loss: 0.3418, test_loss: 1.4475, test_f1: 0.6522
 epoch: 58, train_loss: 0.3488, test_loss: 1.2914, test_f1: 0.6735
 epoch: 59, train_loss: 0.3366, test_loss: 1.3649, test_f1: 0.6614
 epoch: 60, train_loss: 0.3136, test_loss: 1.2046, test_f1: 0.6622
 epoch: 61, train_loss: 0.3236, test_loss: 1.2670, test_f1: 0.6748
 epoch: 62, train_loss: 0.3073, test_loss: 1.2437, test_f1: 0.6847
 epoch: 63, train_loss: 0.3212, test_loss: 1.3531, test_f1: 0.6705
 epoch: 64, train_loss: 0.3084, test_loss: 1.2936, test_f1: 0.6694
 epoch: 65, train_loss: 0.3050, test_loss: 1.3442, test_f1: 0.6952
 epoch: 66, train_loss: 0.3157, test_loss: 1.3226, test_f1: 0.6635
 epoch: 67, train_loss: 0.2971, test_loss: 1.4218, test_f1: 0.6447
 epoch: 68, train_loss: 0.2971, test_loss: 1.3738, test_f1: 0.6738
 epoch: 69, train_loss: 0.2851, test_loss: 1.2972, test_f1: 0.6777
 epoch: 70, train_loss: 0.2850, test_loss: 1.4187, test_f1: 0.6639
 epoch: 71, train_loss: 0.2672, test_loss: 1.5204, test_f1: 0.6487
 epoch: 72, train_loss: 0.2854, test_loss: 1.4576, test_f1: 0.6738
 epoch: 73, train_loss: 0.2680, test_loss: 1.4706, test_f1: 0.6887
 epoch: 74, train_loss: 0.2622, test_loss: 1.4588, test_f1: 0.6551
 epoch: 75, train_loss: 0.2740, test_loss: 1.4759, test_f1: 0.6524
 epoch: 76, train_loss: 0.2795, test_loss: 1.4603, test_f1: 0.6651
 epoch: 77, train_loss: 0.2769, test_loss: 1.4161, test_f1: 0.6736
 epoch: 78, train_loss: 0.2691, test_loss: 1.4558, test_f1: 0.6472
 epoch: 79, train_loss: 0.2643, test_loss: 1.4168, test_f1: 0.6764
 epoch: 80, train_loss: 0.2526, test_loss: 1.6014, test_f1: 0.6250
 epoch: 81, train_loss: 0.2502, test_loss: 1.4931, test_f1: 0.6726
 epoch: 82, train_loss: 0.2612, test_loss: 1.4836, test_f1: 0.6616
 epoch: 83, train_loss: 0.2435, test_loss: 1.6249, test_f1: 0.6656
 epoch: 84, train_loss: 0.2503, test_loss: 1.5603, test_f1: 0.6542
 epoch: 85, train_loss: 0.2417, test_loss: 1.6404, test_f1: 0.6685
 epoch: 86, train_loss: 0.2264, test_loss: 1.6435, test_f1: 0.6541
 epoch: 87, train_loss: 0.2349, test_loss: 1.5878, test_f1: 0.6518
 epoch: 88, train_loss: 0.2423, test_loss: 1.6773, test_f1: 0.6373
 epoch: 89, train_loss: 0.2617, test_loss: 1.6097, test_f1: 0.6600
 epoch: 90, train_loss: 0.2385, test_loss: 1.5801, test_f1: 0.6789
 epoch: 91, train_loss: 0.2205, test_loss: 1.6157, test_f1: 0.6448
 epoch: 92, train_loss: 0.2154, test_loss: 1.5531, test_f1: 0.6439
 epoch: 93, train_loss: 0.2162, test_loss: 1.6404, test_f1: 0.6538
 epoch: 94, train_loss: 0.2118, test_loss: 1.7970, test_f1: 0.6473
 epoch: 95, train_loss: 0.2097, test_loss: 1.5879, test_f1: 0.6580
 epoch: 96, train_loss: 0.2219, test_loss: 1.6637, test_f1: 0.6527
 epoch: 97, train_loss: 0.2249, test_loss: 1.5416, test_f1: 0.6789
 epoch: 98, train_loss: 0.2344, test_loss: 1.5935, test_f1: 0.6801
 epoch: 99, train_loss: 0.2247, test_loss: 1.5251, test_f1: 0.6549
##################ITERATION #6 ****************************************
 epoch: 0, train_loss: 1.3319, test_loss: 1.0204, test_f1: 0.4663
 epoch: 1, train_loss: 1.0273, test_loss: 0.9381, test_f1: 0.4938
 epoch: 2, train_loss: 0.9738, test_loss: 0.9427, test_f1: 0.5092
 epoch: 3, train_loss: 0.9473, test_loss: 0.9615, test_f1: 0.4633
 epoch: 4, train_loss: 0.9226, test_loss: 0.9398, test_f1: 0.5194
 epoch: 5, train_loss: 0.8937, test_loss: 0.9105, test_f1: 0.5156
 epoch: 6, train_loss: 0.8751, test_loss: 0.9203, test_f1: 0.5495
 epoch: 7, train_loss: 0.8620, test_loss: 1.0035, test_f1: 0.4730
 epoch: 8, train_loss: 0.8472, test_loss: 0.9855, test_f1: 0.5847
 epoch: 9, train_loss: 0.8343, test_loss: 1.0216, test_f1: 0.4986
 epoch: 10, train_loss: 0.8236, test_loss: 0.9266, test_f1: 0.5521
 epoch: 11, train_loss: 0.8173, test_loss: 0.9871, test_f1: 0.5689
 epoch: 12, train_loss: 0.8069, test_loss: 0.9538, test_f1: 0.5312
 epoch: 13, train_loss: 0.7874, test_loss: 0.9396, test_f1: 0.5462
 epoch: 14, train_loss: 0.8068, test_loss: 1.0455, test_f1: 0.5319
 epoch: 15, train_loss: 0.7675, test_loss: 0.9739, test_f1: 0.6014
 epoch: 16, train_loss: 0.7601, test_loss: 1.0403, test_f1: 0.5824
 epoch: 17, train_loss: 0.7704, test_loss: 0.9075, test_f1: 0.5997
 epoch: 18, train_loss: 0.7344, test_loss: 0.9235, test_f1: 0.5948
 epoch: 19, train_loss: 0.7423, test_loss: 0.9736, test_f1: 0.5882
 epoch: 20, train_loss: 0.7187, test_loss: 0.9244, test_f1: 0.5969
 epoch: 21, train_loss: 0.7199, test_loss: 1.0040, test_f1: 0.5477
 epoch: 22, train_loss: 0.7132, test_loss: 0.9397, test_f1: 0.5802
 epoch: 23, train_loss: 0.7066, test_loss: 0.9883, test_f1: 0.5550
 epoch: 24, train_loss: 0.6924, test_loss: 1.0145, test_f1: 0.5869
 epoch: 25, train_loss: 0.6861, test_loss: 0.9618, test_f1: 0.6251
 epoch: 26, train_loss: 0.6965, test_loss: 0.9859, test_f1: 0.5529
 epoch: 27, train_loss: 0.6962, test_loss: 1.0357, test_f1: 0.5449
 epoch: 28, train_loss: 0.6569, test_loss: 0.9511, test_f1: 0.5951
 epoch: 29, train_loss: 0.6497, test_loss: 1.0467, test_f1: 0.6021
 epoch: 30, train_loss: 0.6627, test_loss: 1.0220, test_f1: 0.5978
 epoch: 31, train_loss: 0.6335, test_loss: 0.9770, test_f1: 0.6293
 epoch: 32, train_loss: 0.6269, test_loss: 0.9670, test_f1: 0.6127
 epoch: 33, train_loss: 0.6093, test_loss: 1.0053, test_f1: 0.6203
 epoch: 34, train_loss: 0.5957, test_loss: 1.0620, test_f1: 0.5782
 epoch: 35, train_loss: 0.5831, test_loss: 1.0663, test_f1: 0.5982
 epoch: 36, train_loss: 0.6066, test_loss: 1.0527, test_f1: 0.6014
 epoch: 37, train_loss: 0.5726, test_loss: 0.9543, test_f1: 0.6344
 epoch: 38, train_loss: 0.5849, test_loss: 1.0541, test_f1: 0.6109
 epoch: 39, train_loss: 0.5757, test_loss: 1.0312, test_f1: 0.6159
 epoch: 40, train_loss: 0.5399, test_loss: 1.0682, test_f1: 0.6228
 epoch: 41, train_loss: 0.5560, test_loss: 0.9973, test_f1: 0.6175
 epoch: 42, train_loss: 0.5483, test_loss: 1.0611, test_f1: 0.6478
 epoch: 43, train_loss: 0.5356, test_loss: 1.1759, test_f1: 0.6108
 epoch: 44, train_loss: 0.5325, test_loss: 1.0772, test_f1: 0.6142
 epoch: 45, train_loss: 0.5222, test_loss: 1.1063, test_f1: 0.6294
 epoch: 46, train_loss: 0.4911, test_loss: 1.1212, test_f1: 0.6647
 epoch: 47, train_loss: 0.5020, test_loss: 1.0786, test_f1: 0.6396
 epoch: 48, train_loss: 0.4982, test_loss: 1.0993, test_f1: 0.6417
 epoch: 49, train_loss: 0.4837, test_loss: 1.0986, test_f1: 0.6415
 epoch: 50, train_loss: 0.4603, test_loss: 1.2121, test_f1: 0.6249
 epoch: 51, train_loss: 0.4331, test_loss: 1.1387, test_f1: 0.6513
 epoch: 52, train_loss: 0.3972, test_loss: 1.1752, test_f1: 0.6421
 epoch: 53, train_loss: 0.3833, test_loss: 1.1608, test_f1: 0.6718
 epoch: 54, train_loss: 0.3731, test_loss: 1.2417, test_f1: 0.6323
 epoch: 55, train_loss: 0.3579, test_loss: 1.2827, test_f1: 0.6251
 epoch: 56, train_loss: 0.3586, test_loss: 1.2840, test_f1: 0.6432
 epoch: 57, train_loss: 0.3568, test_loss: 1.2448, test_f1: 0.6580
 epoch: 58, train_loss: 0.3538, test_loss: 1.2481, test_f1: 0.6599
 epoch: 59, train_loss: 0.3368, test_loss: 1.2833, test_f1: 0.6647
 epoch: 60, train_loss: 0.3400, test_loss: 1.2428, test_f1: 0.6560
 epoch: 61, train_loss: 0.3154, test_loss: 1.3324, test_f1: 0.6693
 epoch: 62, train_loss: 0.3187, test_loss: 1.4625, test_f1: 0.6520
 epoch: 63, train_loss: 0.3280, test_loss: 1.3695, test_f1: 0.6622
 epoch: 64, train_loss: 0.3329, test_loss: 1.2840, test_f1: 0.6525
 epoch: 65, train_loss: 0.3037, test_loss: 1.3749, test_f1: 0.6398
 epoch: 66, train_loss: 0.3207, test_loss: 1.3296, test_f1: 0.6600
 epoch: 67, train_loss: 0.3283, test_loss: 1.3643, test_f1: 0.6581
 epoch: 68, train_loss: 0.2953, test_loss: 1.5003, test_f1: 0.6498
 epoch: 69, train_loss: 0.3120, test_loss: 1.3865, test_f1: 0.6763
 epoch: 70, train_loss: 0.2795, test_loss: 1.5395, test_f1: 0.6390
 epoch: 71, train_loss: 0.2963, test_loss: 1.4602, test_f1: 0.6318
 epoch: 72, train_loss: 0.3083, test_loss: 1.3589, test_f1: 0.6659
 epoch: 73, train_loss: 0.2936, test_loss: 1.5571, test_f1: 0.6329
 epoch: 74, train_loss: 0.2733, test_loss: 1.4697, test_f1: 0.6601
 epoch: 75, train_loss: 0.2572, test_loss: 1.5359, test_f1: 0.6659
 epoch: 76, train_loss: 0.2733, test_loss: 1.5875, test_f1: 0.6286
 epoch: 77, train_loss: 0.2716, test_loss: 1.6139, test_f1: 0.6244
 epoch: 78, train_loss: 0.2629, test_loss: 1.6450, test_f1: 0.6357
 epoch: 79, train_loss: 0.2670, test_loss: 1.6308, test_f1: 0.6535
 epoch: 80, train_loss: 0.2829, test_loss: 1.5889, test_f1: 0.6563
 epoch: 81, train_loss: 0.2503, test_loss: 1.6260, test_f1: 0.6552
 epoch: 82, train_loss: 0.2488, test_loss: 1.6910, test_f1: 0.6529
 epoch: 83, train_loss: 0.2318, test_loss: 1.5125, test_f1: 0.6647
 epoch: 84, train_loss: 0.2456, test_loss: 1.6253, test_f1: 0.6603
 epoch: 85, train_loss: 0.2359, test_loss: 1.6601, test_f1: 0.6500
 epoch: 86, train_loss: 0.2471, test_loss: 1.7834, test_f1: 0.6408
 epoch: 87, train_loss: 0.2368, test_loss: 1.7613, test_f1: 0.6358
 epoch: 88, train_loss: 0.2230, test_loss: 1.7593, test_f1: 0.6287
 epoch: 89, train_loss: 0.2166, test_loss: 1.8591, test_f1: 0.6402
 epoch: 90, train_loss: 0.2420, test_loss: 1.7221, test_f1: 0.6793
 epoch: 91, train_loss: 0.2391, test_loss: 1.7549, test_f1: 0.6405
 epoch: 92, train_loss: 0.2192, test_loss: 1.7612, test_f1: 0.6761
 epoch: 93, train_loss: 0.2223, test_loss: 1.7973, test_f1: 0.6672
 epoch: 94, train_loss: 0.2151, test_loss: 1.6739, test_f1: 0.6755
 epoch: 95, train_loss: 0.2264, test_loss: 1.8171, test_f1: 0.6297
 epoch: 96, train_loss: 0.2156, test_loss: 1.7892, test_f1: 0.6744
 epoch: 97, train_loss: 0.2232, test_loss: 1.7697, test_f1: 0.6400
 epoch: 98, train_loss: 0.2078, test_loss: 1.7575, test_f1: 0.6471
 epoch: 99, train_loss: 0.2092, test_loss: 1.8034, test_f1: 0.6435
##################ITERATION #7 ****************************************
 epoch: 0, train_loss: 1.2518, test_loss: 1.0127, test_f1: 0.4931
 epoch: 1, train_loss: 0.9803, test_loss: 0.9394, test_f1: 0.4775
 epoch: 2, train_loss: 0.9356, test_loss: 0.9299, test_f1: 0.5064
 epoch: 3, train_loss: 0.9214, test_loss: 0.9274, test_f1: 0.5051
 epoch: 4, train_loss: 0.8872, test_loss: 0.8652, test_f1: 0.5266
 epoch: 5, train_loss: 0.8627, test_loss: 0.9370, test_f1: 0.5282
 epoch: 6, train_loss: 0.8500, test_loss: 0.9923, test_f1: 0.5195
 epoch: 7, train_loss: 0.8455, test_loss: 1.0341, test_f1: 0.5263
 epoch: 8, train_loss: 0.8194, test_loss: 0.9775, test_f1: 0.5773
 epoch: 9, train_loss: 0.8056, test_loss: 0.9850, test_f1: 0.5571
 epoch: 10, train_loss: 0.7955, test_loss: 0.9735, test_f1: 0.5637
 epoch: 11, train_loss: 0.7980, test_loss: 1.0070, test_f1: 0.5419
 epoch: 12, train_loss: 0.7866, test_loss: 0.9606, test_f1: 0.5711
 epoch: 13, train_loss: 0.7887, test_loss: 0.8749, test_f1: 0.5723
 epoch: 14, train_loss: 0.7799, test_loss: 1.0280, test_f1: 0.5709
 epoch: 15, train_loss: 0.7628, test_loss: 0.9765, test_f1: 0.5655
 epoch: 16, train_loss: 0.7831, test_loss: 0.9649, test_f1: 0.5442
 epoch: 17, train_loss: 0.7469, test_loss: 1.0457, test_f1: 0.5562
 epoch: 18, train_loss: 0.7320, test_loss: 1.1501, test_f1: 0.5646
 epoch: 19, train_loss: 0.7283, test_loss: 1.0045, test_f1: 0.6108
 epoch: 20, train_loss: 0.6965, test_loss: 1.0078, test_f1: 0.5900
 epoch: 21, train_loss: 0.6914, test_loss: 1.0589, test_f1: 0.5734
 epoch: 22, train_loss: 0.6870, test_loss: 1.2188, test_f1: 0.5508
 epoch: 23, train_loss: 0.6844, test_loss: 0.9215, test_f1: 0.6273
 epoch: 24, train_loss: 0.6780, test_loss: 0.9789, test_f1: 0.6309
 epoch: 25, train_loss: 0.6635, test_loss: 1.0807, test_f1: 0.6003
 epoch: 26, train_loss: 0.6538, test_loss: 1.0059, test_f1: 0.5974
 epoch: 27, train_loss: 0.6479, test_loss: 1.0470, test_f1: 0.6193
 epoch: 28, train_loss: 0.6413, test_loss: 0.9756, test_f1: 0.6144
 epoch: 29, train_loss: 0.6586, test_loss: 1.0416, test_f1: 0.6270
 epoch: 30, train_loss: 0.6238, test_loss: 0.9716, test_f1: 0.6390
 epoch: 31, train_loss: 0.6092, test_loss: 0.9910, test_f1: 0.6148
 epoch: 32, train_loss: 0.6144, test_loss: 1.0510, test_f1: 0.6498
 epoch: 33, train_loss: 0.6014, test_loss: 1.1026, test_f1: 0.6111
 epoch: 34, train_loss: 0.5791, test_loss: 1.0763, test_f1: 0.6208
 epoch: 35, train_loss: 0.5729, test_loss: 1.0606, test_f1: 0.6379
 epoch: 36, train_loss: 0.5688, test_loss: 1.1472, test_f1: 0.6265
 epoch: 37, train_loss: 0.5628, test_loss: 1.0558, test_f1: 0.6566
 epoch: 38, train_loss: 0.5807, test_loss: 1.0976, test_f1: 0.5978
 epoch: 39, train_loss: 0.5459, test_loss: 1.1946, test_f1: 0.6529
 epoch: 40, train_loss: 0.5293, test_loss: 1.1573, test_f1: 0.6138
 epoch: 41, train_loss: 0.5158, test_loss: 1.2188, test_f1: 0.6356
 epoch: 42, train_loss: 0.5162, test_loss: 1.2020, test_f1: 0.6158
 epoch: 43, train_loss: 0.5062, test_loss: 1.1222, test_f1: 0.6332
 epoch: 44, train_loss: 0.4926, test_loss: 1.1898, test_f1: 0.6416
 epoch: 45, train_loss: 0.4894, test_loss: 1.0511, test_f1: 0.6429
 epoch: 46, train_loss: 0.4940, test_loss: 0.9973, test_f1: 0.6629
 epoch: 47, train_loss: 0.4835, test_loss: 1.1296, test_f1: 0.6450
 epoch: 48, train_loss: 0.4686, test_loss: 1.3072, test_f1: 0.6132
 epoch: 49, train_loss: 0.4534, test_loss: 1.1798, test_f1: 0.6563
 epoch: 50, train_loss: 0.4625, test_loss: 1.2371, test_f1: 0.6630
 epoch: 51, train_loss: 0.4246, test_loss: 1.2040, test_f1: 0.6420
 epoch: 52, train_loss: 0.3879, test_loss: 1.2323, test_f1: 0.6683
 epoch: 53, train_loss: 0.3714, test_loss: 1.2463, test_f1: 0.6590
 epoch: 54, train_loss: 0.3615, test_loss: 1.3482, test_f1: 0.6628
 epoch: 55, train_loss: 0.3582, test_loss: 1.2677, test_f1: 0.6667
 epoch: 56, train_loss: 0.3362, test_loss: 1.3633, test_f1: 0.6371
 epoch: 57, train_loss: 0.3337, test_loss: 1.4354, test_f1: 0.6386
 epoch: 58, train_loss: 0.3295, test_loss: 1.3734, test_f1: 0.6624
 epoch: 59, train_loss: 0.3261, test_loss: 1.3965, test_f1: 0.6557
 epoch: 60, train_loss: 0.3224, test_loss: 1.3550, test_f1: 0.6647
 epoch: 61, train_loss: 0.2968, test_loss: 1.4122, test_f1: 0.6491
 epoch: 62, train_loss: 0.3148, test_loss: 1.4233, test_f1: 0.6402
 epoch: 63, train_loss: 0.3035, test_loss: 1.4555, test_f1: 0.6235
 epoch: 64, train_loss: 0.3202, test_loss: 1.3849, test_f1: 0.6655
 epoch: 65, train_loss: 0.2900, test_loss: 1.5220, test_f1: 0.6192
 epoch: 66, train_loss: 0.3033, test_loss: 1.5479, test_f1: 0.6328
 epoch: 67, train_loss: 0.2864, test_loss: 1.6198, test_f1: 0.6252
 epoch: 68, train_loss: 0.3096, test_loss: 1.5259, test_f1: 0.6690
 epoch: 69, train_loss: 0.2738, test_loss: 1.5198, test_f1: 0.6772
 epoch: 70, train_loss: 0.2729, test_loss: 1.5776, test_f1: 0.6656
 epoch: 71, train_loss: 0.2574, test_loss: 1.6597, test_f1: 0.6328
 epoch: 72, train_loss: 0.2554, test_loss: 1.5022, test_f1: 0.6509
 epoch: 73, train_loss: 0.2739, test_loss: 1.6723, test_f1: 0.6598
 epoch: 74, train_loss: 0.2585, test_loss: 1.6423, test_f1: 0.6462
 epoch: 75, train_loss: 0.2547, test_loss: 1.6568, test_f1: 0.6510
 epoch: 76, train_loss: 0.2698, test_loss: 1.6392, test_f1: 0.6221
 epoch: 77, train_loss: 0.2594, test_loss: 1.6410, test_f1: 0.6507
 epoch: 78, train_loss: 0.2506, test_loss: 1.6854, test_f1: 0.6438
 epoch: 79, train_loss: 0.2433, test_loss: 1.6401, test_f1: 0.6537
 epoch: 80, train_loss: 0.2364, test_loss: 1.6968, test_f1: 0.6234
 epoch: 81, train_loss: 0.2575, test_loss: 1.5790, test_f1: 0.6202
 epoch: 82, train_loss: 0.2602, test_loss: 1.6670, test_f1: 0.6412
 epoch: 83, train_loss: 0.2229, test_loss: 1.7186, test_f1: 0.6288
 epoch: 84, train_loss: 0.2321, test_loss: 1.7486, test_f1: 0.6352
 epoch: 85, train_loss: 0.2249, test_loss: 1.8015, test_f1: 0.6306
 epoch: 86, train_loss: 0.2173, test_loss: 1.7425, test_f1: 0.6567
 epoch: 87, train_loss: 0.2116, test_loss: 1.6942, test_f1: 0.6407
 epoch: 88, train_loss: 0.2112, test_loss: 1.8801, test_f1: 0.6487
 epoch: 89, train_loss: 0.2226, test_loss: 1.7374, test_f1: 0.6478
 epoch: 90, train_loss: 0.2222, test_loss: 1.8073, test_f1: 0.6640
 epoch: 91, train_loss: 0.2058, test_loss: 1.9140, test_f1: 0.6393
 epoch: 92, train_loss: 0.2131, test_loss: 1.8998, test_f1: 0.6426
 epoch: 93, train_loss: 0.2132, test_loss: 1.8471, test_f1: 0.6433
 epoch: 94, train_loss: 0.2168, test_loss: 1.8562, test_f1: 0.6534
 epoch: 95, train_loss: 0.2148, test_loss: 1.8206, test_f1: 0.6410
 epoch: 96, train_loss: 0.2081, test_loss: 1.8895, test_f1: 0.6269
 epoch: 97, train_loss: 0.2023, test_loss: 1.9149, test_f1: 0.6441
 epoch: 98, train_loss: 0.2032, test_loss: 1.8504, test_f1: 0.6679
 epoch: 99, train_loss: 0.2021, test_loss: 1.9344, test_f1: 0.6381
##################ITERATION #8 ****************************************
 epoch: 0, train_loss: 1.3490, test_loss: 1.0243, test_f1: 0.4729
 epoch: 1, train_loss: 1.0179, test_loss: 0.9463, test_f1: 0.4909
 epoch: 2, train_loss: 0.9663, test_loss: 0.9825, test_f1: 0.4966
 epoch: 3, train_loss: 0.9329, test_loss: 0.9247, test_f1: 0.4902
 epoch: 4, train_loss: 0.8897, test_loss: 0.9566, test_f1: 0.5326
 epoch: 5, train_loss: 0.8903, test_loss: 0.9480, test_f1: 0.5052
 epoch: 6, train_loss: 0.8928, test_loss: 0.9282, test_f1: 0.5418
 epoch: 7, train_loss: 0.8593, test_loss: 0.8843, test_f1: 0.5654
 epoch: 8, train_loss: 0.8396, test_loss: 0.9721, test_f1: 0.5391
 epoch: 9, train_loss: 0.8300, test_loss: 0.9412, test_f1: 0.5274
 epoch: 10, train_loss: 0.8223, test_loss: 0.9377, test_f1: 0.5835
 epoch: 11, train_loss: 0.8135, test_loss: 0.9392, test_f1: 0.5626
 epoch: 12, train_loss: 0.7948, test_loss: 0.9230, test_f1: 0.5513
 epoch: 13, train_loss: 0.7909, test_loss: 0.9655, test_f1: 0.5554
 epoch: 14, train_loss: 0.7929, test_loss: 0.9857, test_f1: 0.5612
 epoch: 15, train_loss: 0.7711, test_loss: 0.9002, test_f1: 0.5955
 epoch: 16, train_loss: 0.7661, test_loss: 0.9089, test_f1: 0.5765
 epoch: 17, train_loss: 0.7547, test_loss: 0.9614, test_f1: 0.5579
 epoch: 18, train_loss: 0.7533, test_loss: 0.9551, test_f1: 0.5915
 epoch: 19, train_loss: 0.7478, test_loss: 0.9275, test_f1: 0.5849
 epoch: 20, train_loss: 0.7575, test_loss: 0.9371, test_f1: 0.6005
 epoch: 21, train_loss: 0.7316, test_loss: 0.9458, test_f1: 0.6032
 epoch: 22, train_loss: 0.7164, test_loss: 0.8836, test_f1: 0.5828
 epoch: 23, train_loss: 0.7085, test_loss: 0.9578, test_f1: 0.5905
 epoch: 24, train_loss: 0.7031, test_loss: 1.0835, test_f1: 0.6139
 epoch: 25, train_loss: 0.6967, test_loss: 1.0820, test_f1: 0.6092
 epoch: 26, train_loss: 0.7090, test_loss: 0.9121, test_f1: 0.6027
 epoch: 27, train_loss: 0.6839, test_loss: 1.0794, test_f1: 0.6138
 epoch: 28, train_loss: 0.6903, test_loss: 0.8842, test_f1: 0.6182
 epoch: 29, train_loss: 0.6707, test_loss: 1.0118, test_f1: 0.6223
 epoch: 30, train_loss: 0.6594, test_loss: 0.9229, test_f1: 0.6056
 epoch: 31, train_loss: 0.6707, test_loss: 1.0494, test_f1: 0.6164
 epoch: 32, train_loss: 0.6625, test_loss: 0.9529, test_f1: 0.5883
 epoch: 33, train_loss: 0.6621, test_loss: 1.0226, test_f1: 0.5710
 epoch: 34, train_loss: 0.6377, test_loss: 1.0154, test_f1: 0.6291
 epoch: 35, train_loss: 0.6282, test_loss: 1.1672, test_f1: 0.6093
 epoch: 36, train_loss: 0.6398, test_loss: 0.9890, test_f1: 0.6398
 epoch: 37, train_loss: 0.6092, test_loss: 0.9142, test_f1: 0.6316
 epoch: 38, train_loss: 0.5995, test_loss: 0.9582, test_f1: 0.6344
 epoch: 39, train_loss: 0.5987, test_loss: 1.1009, test_f1: 0.6190
 epoch: 40, train_loss: 0.5892, test_loss: 0.9896, test_f1: 0.6265
 epoch: 41, train_loss: 0.5861, test_loss: 0.9606, test_f1: 0.6152
 epoch: 42, train_loss: 0.5662, test_loss: 1.0459, test_f1: 0.6224
 epoch: 43, train_loss: 0.5932, test_loss: 1.0915, test_f1: 0.5916
 epoch: 44, train_loss: 0.5803, test_loss: 0.9881, test_f1: 0.6252
 epoch: 45, train_loss: 0.5701, test_loss: 1.0616, test_f1: 0.6212
 epoch: 46, train_loss: 0.5416, test_loss: 1.0528, test_f1: 0.6316
 epoch: 47, train_loss: 0.5340, test_loss: 1.0381, test_f1: 0.6241
 epoch: 48, train_loss: 0.5604, test_loss: 1.0522, test_f1: 0.6132
 epoch: 49, train_loss: 0.5480, test_loss: 1.0752, test_f1: 0.6281
 epoch: 50, train_loss: 0.5228, test_loss: 1.0582, test_f1: 0.6225
 epoch: 51, train_loss: 0.4977, test_loss: 1.0418, test_f1: 0.6654
 epoch: 52, train_loss: 0.4554, test_loss: 1.1087, test_f1: 0.6253
 epoch: 53, train_loss: 0.4283, test_loss: 1.0859, test_f1: 0.6678
 epoch: 54, train_loss: 0.4203, test_loss: 1.1716, test_f1: 0.6330
 epoch: 55, train_loss: 0.4200, test_loss: 1.2494, test_f1: 0.6174
 epoch: 56, train_loss: 0.4106, test_loss: 1.1463, test_f1: 0.6398
 epoch: 57, train_loss: 0.4019, test_loss: 1.1771, test_f1: 0.6530
 epoch: 58, train_loss: 0.4132, test_loss: 1.3038, test_f1: 0.6364
 epoch: 59, train_loss: 0.3938, test_loss: 1.2582, test_f1: 0.6262
 epoch: 60, train_loss: 0.3968, test_loss: 1.3330, test_f1: 0.6402
 epoch: 61, train_loss: 0.3778, test_loss: 1.3232, test_f1: 0.6520
 epoch: 62, train_loss: 0.4121, test_loss: 1.3705, test_f1: 0.6374
 epoch: 63, train_loss: 0.4074, test_loss: 1.2975, test_f1: 0.6301
 epoch: 64, train_loss: 0.3676, test_loss: 1.4852, test_f1: 0.5992
 epoch: 65, train_loss: 0.3590, test_loss: 1.4893, test_f1: 0.6325
 epoch: 66, train_loss: 0.3584, test_loss: 1.4159, test_f1: 0.6266
 epoch: 67, train_loss: 0.3447, test_loss: 1.4213, test_f1: 0.6299
 epoch: 68, train_loss: 0.3545, test_loss: 1.4226, test_f1: 0.6372
 epoch: 69, train_loss: 0.3340, test_loss: 1.4651, test_f1: 0.6338
 epoch: 70, train_loss: 0.3313, test_loss: 1.4636, test_f1: 0.6168
 epoch: 71, train_loss: 0.3343, test_loss: 1.5070, test_f1: 0.6078
 epoch: 72, train_loss: 0.3365, test_loss: 1.4062, test_f1: 0.6387
 epoch: 73, train_loss: 0.3461, test_loss: 1.3900, test_f1: 0.6153
 epoch: 74, train_loss: 0.3451, test_loss: 1.3556, test_f1: 0.6345
 epoch: 75, train_loss: 0.3344, test_loss: 1.3499, test_f1: 0.6293
 epoch: 76, train_loss: 0.3255, test_loss: 1.4392, test_f1: 0.6305
 epoch: 77, train_loss: 0.3408, test_loss: 1.4494, test_f1: 0.6516
 epoch: 78, train_loss: 0.3174, test_loss: 1.5002, test_f1: 0.6355
 epoch: 79, train_loss: 0.3120, test_loss: 1.4341, test_f1: 0.6371
 epoch: 80, train_loss: 0.2953, test_loss: 1.3949, test_f1: 0.6338
 epoch: 81, train_loss: 0.2982, test_loss: 1.5992, test_f1: 0.6425
 epoch: 82, train_loss: 0.3019, test_loss: 1.5189, test_f1: 0.6432
 epoch: 83, train_loss: 0.2979, test_loss: 1.4259, test_f1: 0.6221
 epoch: 84, train_loss: 0.2790, test_loss: 1.4998, test_f1: 0.6084
 epoch: 85, train_loss: 0.2738, test_loss: 1.6418, test_f1: 0.6095
 epoch: 86, train_loss: 0.2970, test_loss: 1.5375, test_f1: 0.6416
 epoch: 87, train_loss: 0.2812, test_loss: 1.4965, test_f1: 0.6238
 epoch: 88, train_loss: 0.2760, test_loss: 1.5459, test_f1: 0.6308
 epoch: 89, train_loss: 0.2821, test_loss: 1.5666, test_f1: 0.6139
 epoch: 90, train_loss: 0.2575, test_loss: 1.7003, test_f1: 0.6423
 epoch: 91, train_loss: 0.2607, test_loss: 1.6592, test_f1: 0.6120
 epoch: 92, train_loss: 0.2727, test_loss: 1.8350, test_f1: 0.5962
 epoch: 93, train_loss: 0.2684, test_loss: 1.7232, test_f1: 0.6231
 epoch: 94, train_loss: 0.2614, test_loss: 1.7668, test_f1: 0.6216
 epoch: 95, train_loss: 0.2826, test_loss: 1.6712, test_f1: 0.6150
 epoch: 96, train_loss: 0.2451, test_loss: 1.6557, test_f1: 0.6377
 epoch: 97, train_loss: 0.2303, test_loss: 1.7451, test_f1: 0.6289
 epoch: 98, train_loss: 0.2483, test_loss: 1.8031, test_f1: 0.6111
 epoch: 99, train_loss: 0.2634, test_loss: 1.6962, test_f1: 0.6331
##################ITERATION #9 ****************************************
 epoch: 0, train_loss: 1.3094, test_loss: 0.9886, test_f1: 0.4779
 epoch: 1, train_loss: 0.9843, test_loss: 0.9476, test_f1: 0.5060
 epoch: 2, train_loss: 0.9440, test_loss: 0.9897, test_f1: 0.4905
 epoch: 3, train_loss: 0.9370, test_loss: 0.9248, test_f1: 0.5413
 epoch: 4, train_loss: 0.9019, test_loss: 0.9430, test_f1: 0.5599
 epoch: 5, train_loss: 0.8827, test_loss: 0.9509, test_f1: 0.5317
 epoch: 6, train_loss: 0.8648, test_loss: 0.9308, test_f1: 0.5329
 epoch: 7, train_loss: 0.8479, test_loss: 0.9500, test_f1: 0.5222
 epoch: 8, train_loss: 0.8366, test_loss: 0.9352, test_f1: 0.5170
 epoch: 9, train_loss: 0.8443, test_loss: 0.9868, test_f1: 0.5489
 epoch: 10, train_loss: 0.8306, test_loss: 0.9577, test_f1: 0.5636
 epoch: 11, train_loss: 0.8138, test_loss: 0.9588, test_f1: 0.5367
 epoch: 12, train_loss: 0.8133, test_loss: 0.9604, test_f1: 0.5895
 epoch: 13, train_loss: 0.8054, test_loss: 0.9556, test_f1: 0.5630
 epoch: 14, train_loss: 0.7740, test_loss: 0.9542, test_f1: 0.5597
 epoch: 15, train_loss: 0.7782, test_loss: 0.9234, test_f1: 0.5637
 epoch: 16, train_loss: 0.7613, test_loss: 0.9825, test_f1: 0.6049
 epoch: 17, train_loss: 0.7624, test_loss: 0.9602, test_f1: 0.5892
 epoch: 18, train_loss: 0.7562, test_loss: 0.9276, test_f1: 0.5936
 epoch: 19, train_loss: 0.7370, test_loss: 1.0160, test_f1: 0.5682
 epoch: 20, train_loss: 0.7174, test_loss: 0.9370, test_f1: 0.6013
 epoch: 21, train_loss: 0.7089, test_loss: 1.0016, test_f1: 0.5753
 epoch: 22, train_loss: 0.7041, test_loss: 0.9132, test_f1: 0.5958
 epoch: 23, train_loss: 0.7063, test_loss: 0.9856, test_f1: 0.5850
 epoch: 24, train_loss: 0.6974, test_loss: 1.0169, test_f1: 0.6181
 epoch: 25, train_loss: 0.6958, test_loss: 0.9147, test_f1: 0.6088
 epoch: 26, train_loss: 0.6919, test_loss: 1.0533, test_f1: 0.6209
 epoch: 27, train_loss: 0.6707, test_loss: 0.8736, test_f1: 0.6073
 epoch: 28, train_loss: 0.6748, test_loss: 0.9964, test_f1: 0.5963
 epoch: 29, train_loss: 0.6523, test_loss: 0.9692, test_f1: 0.6035
 epoch: 30, train_loss: 0.6421, test_loss: 0.9846, test_f1: 0.5969
 epoch: 31, train_loss: 0.6355, test_loss: 0.9871, test_f1: 0.5967
 epoch: 32, train_loss: 0.6019, test_loss: 1.2337, test_f1: 0.6197
 epoch: 33, train_loss: 0.6261, test_loss: 1.0677, test_f1: 0.6076
 epoch: 34, train_loss: 0.6034, test_loss: 1.0501, test_f1: 0.5944
 epoch: 35, train_loss: 0.5799, test_loss: 0.9314, test_f1: 0.6193
 epoch: 36, train_loss: 0.5916, test_loss: 1.0120, test_f1: 0.6478
 epoch: 37, train_loss: 0.5973, test_loss: 1.0823, test_f1: 0.6557
 epoch: 38, train_loss: 0.5684, test_loss: 1.1492, test_f1: 0.6596
 epoch: 39, train_loss: 0.5988, test_loss: 1.1199, test_f1: 0.6292
 epoch: 40, train_loss: 0.5695, test_loss: 1.0676, test_f1: 0.6660
 epoch: 41, train_loss: 0.5533, test_loss: 0.9766, test_f1: 0.6593
 epoch: 42, train_loss: 0.5328, test_loss: 0.9422, test_f1: 0.6612
 epoch: 43, train_loss: 0.5472, test_loss: 1.0240, test_f1: 0.6257
 epoch: 44, train_loss: 0.5130, test_loss: 0.9911, test_f1: 0.6689
 epoch: 45, train_loss: 0.5213, test_loss: 1.1656, test_f1: 0.5870
 epoch: 46, train_loss: 0.5199, test_loss: 1.1381, test_f1: 0.6308
 epoch: 47, train_loss: 0.5033, test_loss: 1.1779, test_f1: 0.6478
 epoch: 48, train_loss: 0.4976, test_loss: 1.0546, test_f1: 0.6401
 epoch: 49, train_loss: 0.4836, test_loss: 1.0298, test_f1: 0.6374
 epoch: 50, train_loss: 0.5020, test_loss: 1.0727, test_f1: 0.6238
 epoch: 51, train_loss: 0.4449, test_loss: 1.1516, test_f1: 0.6456
 epoch: 52, train_loss: 0.3911, test_loss: 1.2152, test_f1: 0.6600
 epoch: 53, train_loss: 0.4000, test_loss: 1.2213, test_f1: 0.6627
 epoch: 54, train_loss: 0.3882, test_loss: 1.2477, test_f1: 0.6551
 epoch: 55, train_loss: 0.3798, test_loss: 1.1951, test_f1: 0.6796
 epoch: 56, train_loss: 0.3807, test_loss: 1.2073, test_f1: 0.6509
 epoch: 57, train_loss: 0.3785, test_loss: 1.1800, test_f1: 0.6674
 epoch: 58, train_loss: 0.3595, test_loss: 1.2758, test_f1: 0.6738
 epoch: 59, train_loss: 0.3612, test_loss: 1.2958, test_f1: 0.6583
 epoch: 60, train_loss: 0.3394, test_loss: 1.2633, test_f1: 0.6421
 epoch: 61, train_loss: 0.3301, test_loss: 1.3684, test_f1: 0.6313
 epoch: 62, train_loss: 0.3354, test_loss: 1.3287, test_f1: 0.6611
 epoch: 63, train_loss: 0.3298, test_loss: 1.3524, test_f1: 0.6700
 epoch: 64, train_loss: 0.3259, test_loss: 1.4243, test_f1: 0.6455
 epoch: 65, train_loss: 0.3095, test_loss: 1.2415, test_f1: 0.6856
 epoch: 66, train_loss: 0.3045, test_loss: 1.3435, test_f1: 0.6613
 epoch: 67, train_loss: 0.3046, test_loss: 1.2852, test_f1: 0.7052
 epoch: 68, train_loss: 0.3017, test_loss: 1.5587, test_f1: 0.6482
 epoch: 69, train_loss: 0.3011, test_loss: 1.4364, test_f1: 0.6761
 epoch: 70, train_loss: 0.2948, test_loss: 1.4260, test_f1: 0.6776
 epoch: 71, train_loss: 0.3181, test_loss: 1.4497, test_f1: 0.6693
 epoch: 72, train_loss: 0.2897, test_loss: 1.3660, test_f1: 0.6709
 epoch: 73, train_loss: 0.2753, test_loss: 1.4192, test_f1: 0.6669
 epoch: 74, train_loss: 0.2628, test_loss: 1.4805, test_f1: 0.6619
 epoch: 75, train_loss: 0.2784, test_loss: 1.4332, test_f1: 0.6733
 epoch: 76, train_loss: 0.2831, test_loss: 1.3723, test_f1: 0.6737
 epoch: 77, train_loss: 0.2759, test_loss: 1.5049, test_f1: 0.6573
 epoch: 78, train_loss: 0.2482, test_loss: 1.3506, test_f1: 0.7108
 epoch: 79, train_loss: 0.2619, test_loss: 1.5432, test_f1: 0.6609
 epoch: 80, train_loss: 0.2645, test_loss: 1.6267, test_f1: 0.6502
 epoch: 81, train_loss: 0.2682, test_loss: 1.5285, test_f1: 0.6603
 epoch: 82, train_loss: 0.2676, test_loss: 1.5554, test_f1: 0.6530
 epoch: 83, train_loss: 0.2472, test_loss: 1.4913, test_f1: 0.6768
 epoch: 84, train_loss: 0.2792, test_loss: 1.7487, test_f1: 0.6323
 epoch: 85, train_loss: 0.2515, test_loss: 1.6861, test_f1: 0.6494
 epoch: 86, train_loss: 0.2563, test_loss: 1.5702, test_f1: 0.6495
 epoch: 87, train_loss: 0.2287, test_loss: 1.6684, test_f1: 0.6506
 epoch: 88, train_loss: 0.2445, test_loss: 1.6305, test_f1: 0.6282
 epoch: 89, train_loss: 0.2324, test_loss: 1.5857, test_f1: 0.6430
 epoch: 90, train_loss: 0.2685, test_loss: 1.5702, test_f1: 0.6327
 epoch: 91, train_loss: 0.2237, test_loss: 1.5942, test_f1: 0.6294
 epoch: 92, train_loss: 0.2272, test_loss: 1.6294, test_f1: 0.6651
 epoch: 93, train_loss: 0.2223, test_loss: 1.5680, test_f1: 0.6736
 epoch: 94, train_loss: 0.2100, test_loss: 1.6008, test_f1: 0.6635
 epoch: 95, train_loss: 0.2157, test_loss: 1.6179, test_f1: 0.6719
 epoch: 96, train_loss: 0.2302, test_loss: 1.7059, test_f1: 0.6562
 epoch: 97, train_loss: 0.2275, test_loss: 1.7606, test_f1: 0.6260
 epoch: 98, train_loss: 0.2280, test_loss: 1.7068, test_f1: 0.6251
 epoch: 99, train_loss: 0.2279, test_loss: 1.6000, test_f1: 0.6514

Training completed in 823.05 seconds
Best F1: 0.7108 at epoch 78
Mean F1 across iterations: 0.6882  0.0122
========================FINAL RESULTS================================
FEGIN weighted F1: 0.7108  0.0122
python main.py --data ltspice_examples --representation component_net --model FEGIN --layers 5 --hiddens 128 --batch_size 64 --lr 0.001 --emb_size 250 --epochs 100 --save_appendix component_net_L5_H128_BS64_LR0.001_E250 --no_val
-----



STDERR:
  File "main.py", line 370, in <module>
    main()
  File "main.py", line 254, in main
    dataset = dataset_class(
  File "/home/philip/projects/ltspice_examples_code_repo/Circuit-Completion-Using-GNNs/component_classification_with_link_prediction_head/evaluation/FEGIN/kernel/circuit_datasets.py", line 15, in __init__
    self.data, self.slices = torch.load(self.processed_paths[0])
  File "/home/philip/.local/lib/python3.8/site-packages/torch/serialization.py", line 1040, in load
    warnings.warn(
  File "/usr/lib/python3.8/warnings.py", line 109, in _showwarnmsg
    sw(msg.message, msg.category, msg.filename, msg.lineno,
  File "main.py", line 47, in warn_with_traceback
    traceback.print_stack(file=log)
/home/philip/projects/ltspice_examples_code_repo/Circuit-Completion-Using-GNNs/component_classification_with_link_prediction_head/evaluation/FEGIN/kernel/circuit_datasets.py:15: FutureWarning: You are using `torch.load` with `weights_only=False` (the current default value), which uses the default pickle module implicitly. It is possible to construct malicious pickle data which will execute arbitrary code during unpickling (See https://github.com/pytorch/pytorch/blob/main/SECURITY.md#untrusted-models for more details). In a future release, the default value for `weights_only` will be flipped to `True`. This limits the functions that could be executed during unpickling. Arbitrary objects will no longer be allowed to be loaded via this mode unless they are explicitly allowlisted by the user via `torch.serialization.add_safe_globals`. We recommend you start setting `weights_only=True` for any use case where you don't have full control of the loaded file. Please open an issue on GitHub for any issues related to this experimental feature.
  self.data, self.slices = torch.load(self.processed_paths[0])
