STDOUT:
Results will be saved in /home/philip/projects/ltspice_examples_code_repo/Circuit-Completion-Using-GNNs/component_classification_with_link_prediction_head/evaluation/FEGIN/results/model_FEGIN_dataset_ltspice_examples
Command line input: python main.py --data ltspice_examples --representation component_component --model FEGIN --layers 2 --hiddens 128 --batch_size 32 --lr 0.0001 --emb_size 250 --epochs 100 --save_appendix component_component_L2_H128_BS32_LR0.0001_E250 --no_val
 is saved.
-----
ltspice_examples - FEGIN
Using 2 layers, 128 hidden units, h = 2
Loading component_component representation dataset
ENTERED
Training FEGIN on component_component representation
Train: 3556, Test: 845
##################ITERATION #0 ****************************************
 epoch: 0, train_loss: 1.3325, test_loss: 1.2692, test_f1: 0.2274
 epoch: 1, train_loss: 1.2561, test_loss: 1.2241, test_f1: 0.2274
 epoch: 2, train_loss: 1.2237, test_loss: 1.1886, test_f1: 0.3277
 epoch: 3, train_loss: 1.1909, test_loss: 1.1619, test_f1: 0.3612
 epoch: 4, train_loss: 1.1623, test_loss: 1.1308, test_f1: 0.4423
 epoch: 5, train_loss: 1.1316, test_loss: 1.1050, test_f1: 0.4598
 epoch: 6, train_loss: 1.1055, test_loss: 1.0687, test_f1: 0.4638
 epoch: 7, train_loss: 1.0876, test_loss: 1.0509, test_f1: 0.4797
 epoch: 8, train_loss: 1.0601, test_loss: 1.0366, test_f1: 0.4786
 epoch: 9, train_loss: 1.0476, test_loss: 1.0086, test_f1: 0.4636
 epoch: 10, train_loss: 1.0264, test_loss: 0.9988, test_f1: 0.4588
 epoch: 11, train_loss: 1.0028, test_loss: 1.0232, test_f1: 0.4531
 epoch: 12, train_loss: 0.9897, test_loss: 0.9868, test_f1: 0.4915
 epoch: 13, train_loss: 0.9836, test_loss: 0.9719, test_f1: 0.4866
 epoch: 14, train_loss: 0.9636, test_loss: 0.9802, test_f1: 0.5060
 epoch: 15, train_loss: 0.9606, test_loss: 0.9783, test_f1: 0.4859
 epoch: 16, train_loss: 0.9480, test_loss: 0.9792, test_f1: 0.5035
 epoch: 17, train_loss: 0.9320, test_loss: 0.9723, test_f1: 0.5074
 epoch: 18, train_loss: 0.9293, test_loss: 0.9766, test_f1: 0.4984
 epoch: 19, train_loss: 0.9222, test_loss: 0.9569, test_f1: 0.5040
 epoch: 20, train_loss: 0.9197, test_loss: 0.9855, test_f1: 0.4904
 epoch: 21, train_loss: 0.9026, test_loss: 0.9624, test_f1: 0.5207
 epoch: 22, train_loss: 0.8971, test_loss: 0.9797, test_f1: 0.5081
 epoch: 23, train_loss: 0.8954, test_loss: 0.9887, test_f1: 0.5177
 epoch: 24, train_loss: 0.8863, test_loss: 0.9869, test_f1: 0.5106
 epoch: 25, train_loss: 0.8657, test_loss: 1.0018, test_f1: 0.5203
 epoch: 26, train_loss: 0.8724, test_loss: 1.0033, test_f1: 0.5106
 epoch: 27, train_loss: 0.8693, test_loss: 0.9777, test_f1: 0.5132
 epoch: 28, train_loss: 0.8629, test_loss: 0.9999, test_f1: 0.5082
 epoch: 29, train_loss: 0.8422, test_loss: 1.0112, test_f1: 0.4992
 epoch: 30, train_loss: 0.8459, test_loss: 1.0137, test_f1: 0.5069
 epoch: 31, train_loss: 0.8310, test_loss: 1.0346, test_f1: 0.4998
 epoch: 32, train_loss: 0.8346, test_loss: 0.9969, test_f1: 0.5175
 epoch: 33, train_loss: 0.8243, test_loss: 0.9987, test_f1: 0.5079
 epoch: 34, train_loss: 0.8151, test_loss: 1.0752, test_f1: 0.5138
 epoch: 35, train_loss: 0.8070, test_loss: 1.0719, test_f1: 0.4838
 epoch: 36, train_loss: 0.8196, test_loss: 1.0603, test_f1: 0.5383
 epoch: 37, train_loss: 0.8059, test_loss: 1.0324, test_f1: 0.5239
 epoch: 38, train_loss: 0.7965, test_loss: 1.0557, test_f1: 0.5198
 epoch: 39, train_loss: 0.7952, test_loss: 1.0431, test_f1: 0.5129
 epoch: 40, train_loss: 0.7830, test_loss: 1.1065, test_f1: 0.4715
 epoch: 41, train_loss: 0.7902, test_loss: 1.0562, test_f1: 0.5128
 epoch: 42, train_loss: 0.7796, test_loss: 1.0911, test_f1: 0.5088
 epoch: 43, train_loss: 0.7750, test_loss: 1.0335, test_f1: 0.4979
 epoch: 44, train_loss: 0.7761, test_loss: 1.0937, test_f1: 0.4912
 epoch: 45, train_loss: 0.7645, test_loss: 1.0486, test_f1: 0.5123
 epoch: 46, train_loss: 0.7608, test_loss: 1.0681, test_f1: 0.5232
 epoch: 47, train_loss: 0.7456, test_loss: 1.0804, test_f1: 0.5263
 epoch: 48, train_loss: 0.7589, test_loss: 1.1340, test_f1: 0.5046
 epoch: 49, train_loss: 0.7466, test_loss: 1.0725, test_f1: 0.5124
 epoch: 50, train_loss: 0.7388, test_loss: 1.0733, test_f1: 0.5466
 epoch: 51, train_loss: 0.7342, test_loss: 1.1295, test_f1: 0.5228
 epoch: 52, train_loss: 0.7219, test_loss: 1.1057, test_f1: 0.5186
 epoch: 53, train_loss: 0.7164, test_loss: 1.1305, test_f1: 0.5041
 epoch: 54, train_loss: 0.7027, test_loss: 1.0969, test_f1: 0.5432
 epoch: 55, train_loss: 0.7179, test_loss: 1.1169, test_f1: 0.5014
 epoch: 56, train_loss: 0.7130, test_loss: 1.2038, test_f1: 0.5002
 epoch: 57, train_loss: 0.7182, test_loss: 1.1721, test_f1: 0.5264
 epoch: 58, train_loss: 0.7089, test_loss: 1.1391, test_f1: 0.5380
 epoch: 59, train_loss: 0.7036, test_loss: 1.2462, test_f1: 0.4955
 epoch: 60, train_loss: 0.7006, test_loss: 1.1174, test_f1: 0.5075
 epoch: 61, train_loss: 0.6911, test_loss: 1.1857, test_f1: 0.5149
 epoch: 62, train_loss: 0.6962, test_loss: 1.1999, test_f1: 0.5228
 epoch: 63, train_loss: 0.7004, test_loss: 1.1617, test_f1: 0.5248
 epoch: 64, train_loss: 0.6844, test_loss: 1.1812, test_f1: 0.5287
 epoch: 65, train_loss: 0.6824, test_loss: 1.2017, test_f1: 0.5076
 epoch: 66, train_loss: 0.6859, test_loss: 1.2308, test_f1: 0.4966
 epoch: 67, train_loss: 0.6826, test_loss: 1.1841, test_f1: 0.5272
 epoch: 68, train_loss: 0.6754, test_loss: 1.2164, test_f1: 0.5257
 epoch: 69, train_loss: 0.6862, test_loss: 1.2374, test_f1: 0.5197
 epoch: 70, train_loss: 0.6683, test_loss: 1.2095, test_f1: 0.5284
 epoch: 71, train_loss: 0.6567, test_loss: 1.2236, test_f1: 0.5110
 epoch: 72, train_loss: 0.6726, test_loss: 1.2629, test_f1: 0.5243
 epoch: 73, train_loss: 0.6882, test_loss: 1.2231, test_f1: 0.5202
 epoch: 74, train_loss: 0.6784, test_loss: 1.2091, test_f1: 0.5031
 epoch: 75, train_loss: 0.6700, test_loss: 1.2202, test_f1: 0.5112
 epoch: 76, train_loss: 0.6659, test_loss: 1.2834, test_f1: 0.5079
 epoch: 77, train_loss: 0.6639, test_loss: 1.2973, test_f1: 0.4982
 epoch: 78, train_loss: 0.6653, test_loss: 1.2483, test_f1: 0.5089
 epoch: 79, train_loss: 0.6641, test_loss: 1.2702, test_f1: 0.5283
 epoch: 80, train_loss: 0.6620, test_loss: 1.2376, test_f1: 0.5117
 epoch: 81, train_loss: 0.6444, test_loss: 1.2128, test_f1: 0.5300
 epoch: 82, train_loss: 0.6507, test_loss: 1.2858, test_f1: 0.5205
 epoch: 83, train_loss: 0.6569, test_loss: 1.2602, test_f1: 0.5165
 epoch: 84, train_loss: 0.6559, test_loss: 1.3091, test_f1: 0.5062
 epoch: 85, train_loss: 0.6468, test_loss: 1.2749, test_f1: 0.5343
 epoch: 86, train_loss: 0.6349, test_loss: 1.3116, test_f1: 0.5153
 epoch: 87, train_loss: 0.6409, test_loss: 1.3355, test_f1: 0.5316
 epoch: 88, train_loss: 0.6531, test_loss: 1.2890, test_f1: 0.5116
 epoch: 89, train_loss: 0.6531, test_loss: 1.2737, test_f1: 0.5088
 epoch: 90, train_loss: 0.6290, test_loss: 1.3733, test_f1: 0.5068
 epoch: 91, train_loss: 0.6335, test_loss: 1.2835, test_f1: 0.5058
 epoch: 92, train_loss: 0.6496, test_loss: 1.3447, test_f1: 0.5307
 epoch: 93, train_loss: 0.6383, test_loss: 1.3788, test_f1: 0.4962
 epoch: 94, train_loss: 0.6356, test_loss: 1.3577, test_f1: 0.5309
 epoch: 95, train_loss: 0.6266, test_loss: 1.3781, test_f1: 0.4971
 epoch: 96, train_loss: 0.6306, test_loss: 1.3705, test_f1: 0.5142
 epoch: 97, train_loss: 0.6077, test_loss: 1.3472, test_f1: 0.5068
 epoch: 98, train_loss: 0.6207, test_loss: 1.3623, test_f1: 0.5228
 epoch: 99, train_loss: 0.6256, test_loss: 1.3334, test_f1: 0.5356
##################ITERATION #1 ****************************************
 epoch: 0, train_loss: 1.2647, test_loss: 1.1861, test_f1: 0.4273
 epoch: 1, train_loss: 1.1917, test_loss: 1.1392, test_f1: 0.4466
 epoch: 2, train_loss: 1.1513, test_loss: 1.1043, test_f1: 0.4726
 epoch: 3, train_loss: 1.1298, test_loss: 1.0812, test_f1: 0.4663
 epoch: 4, train_loss: 1.0962, test_loss: 1.0583, test_f1: 0.4681
 epoch: 5, train_loss: 1.0823, test_loss: 1.0437, test_f1: 0.4745
 epoch: 6, train_loss: 1.0587, test_loss: 1.0208, test_f1: 0.4717
 epoch: 7, train_loss: 1.0473, test_loss: 1.0112, test_f1: 0.4830
 epoch: 8, train_loss: 1.0343, test_loss: 0.9993, test_f1: 0.4903
 epoch: 9, train_loss: 1.0221, test_loss: 0.9852, test_f1: 0.4840
 epoch: 10, train_loss: 1.0000, test_loss: 0.9679, test_f1: 0.4858
 epoch: 11, train_loss: 0.9869, test_loss: 0.9668, test_f1: 0.4922
 epoch: 12, train_loss: 0.9686, test_loss: 0.9513, test_f1: 0.4962
 epoch: 13, train_loss: 0.9578, test_loss: 0.9560, test_f1: 0.5103
 epoch: 14, train_loss: 0.9565, test_loss: 0.9812, test_f1: 0.4992
 epoch: 15, train_loss: 0.9431, test_loss: 0.9430, test_f1: 0.4982
 epoch: 16, train_loss: 0.9322, test_loss: 0.9426, test_f1: 0.5193
 epoch: 17, train_loss: 0.9198, test_loss: 0.9425, test_f1: 0.5076
 epoch: 18, train_loss: 0.9152, test_loss: 0.9336, test_f1: 0.4852
 epoch: 19, train_loss: 0.8993, test_loss: 0.9856, test_f1: 0.5105
 epoch: 20, train_loss: 0.9038, test_loss: 0.9639, test_f1: 0.4862
 epoch: 21, train_loss: 0.8814, test_loss: 0.9786, test_f1: 0.5027
 epoch: 22, train_loss: 0.8825, test_loss: 0.9555, test_f1: 0.5153
 epoch: 23, train_loss: 0.8801, test_loss: 0.9758, test_f1: 0.4961
 epoch: 24, train_loss: 0.8636, test_loss: 0.9799, test_f1: 0.4988
 epoch: 25, train_loss: 0.8546, test_loss: 0.9569, test_f1: 0.5160
 epoch: 26, train_loss: 0.8510, test_loss: 0.9475, test_f1: 0.5138
 epoch: 27, train_loss: 0.8481, test_loss: 0.9968, test_f1: 0.4946
 epoch: 28, train_loss: 0.8403, test_loss: 0.9846, test_f1: 0.5139
 epoch: 29, train_loss: 0.8361, test_loss: 0.9723, test_f1: 0.5013
 epoch: 30, train_loss: 0.8445, test_loss: 0.9535, test_f1: 0.5196
 epoch: 31, train_loss: 0.8465, test_loss: 0.9654, test_f1: 0.4830
 epoch: 32, train_loss: 0.8283, test_loss: 0.9367, test_f1: 0.5099
 epoch: 33, train_loss: 0.8166, test_loss: 0.9712, test_f1: 0.4893
 epoch: 34, train_loss: 0.8018, test_loss: 0.9896, test_f1: 0.5176
 epoch: 35, train_loss: 0.8051, test_loss: 1.0191, test_f1: 0.4922
 epoch: 36, train_loss: 0.8099, test_loss: 0.9836, test_f1: 0.5230
 epoch: 37, train_loss: 0.8025, test_loss: 0.9959, test_f1: 0.5145
 epoch: 38, train_loss: 0.7919, test_loss: 1.0054, test_f1: 0.5167
 epoch: 39, train_loss: 0.7766, test_loss: 0.9957, test_f1: 0.5014
 epoch: 40, train_loss: 0.7838, test_loss: 0.9637, test_f1: 0.5161
 epoch: 41, train_loss: 0.7740, test_loss: 1.0181, test_f1: 0.4981
 epoch: 42, train_loss: 0.7663, test_loss: 1.0023, test_f1: 0.5075
 epoch: 43, train_loss: 0.7686, test_loss: 1.0002, test_f1: 0.5016
 epoch: 44, train_loss: 0.7623, test_loss: 0.9965, test_f1: 0.5240
 epoch: 45, train_loss: 0.7652, test_loss: 1.0321, test_f1: 0.5368
 epoch: 46, train_loss: 0.7464, test_loss: 1.0390, test_f1: 0.5223
 epoch: 47, train_loss: 0.7525, test_loss: 0.9906, test_f1: 0.5440
 epoch: 48, train_loss: 0.7377, test_loss: 1.0363, test_f1: 0.5221
 epoch: 49, train_loss: 0.7416, test_loss: 1.0607, test_f1: 0.5209
 epoch: 50, train_loss: 0.7447, test_loss: 1.0976, test_f1: 0.4883
 epoch: 51, train_loss: 0.7266, test_loss: 1.0541, test_f1: 0.5132
 epoch: 52, train_loss: 0.7200, test_loss: 1.0543, test_f1: 0.5113
 epoch: 53, train_loss: 0.7011, test_loss: 1.0403, test_f1: 0.5220
 epoch: 54, train_loss: 0.7090, test_loss: 1.0451, test_f1: 0.5189
 epoch: 55, train_loss: 0.7010, test_loss: 1.0957, test_f1: 0.5220
 epoch: 56, train_loss: 0.6971, test_loss: 1.0648, test_f1: 0.5255
 epoch: 57, train_loss: 0.7160, test_loss: 1.0575, test_f1: 0.5342
 epoch: 58, train_loss: 0.6999, test_loss: 1.0599, test_f1: 0.5282
 epoch: 59, train_loss: 0.7023, test_loss: 1.0832, test_f1: 0.5133
 epoch: 60, train_loss: 0.6881, test_loss: 1.0394, test_f1: 0.5370
 epoch: 61, train_loss: 0.6880, test_loss: 1.0783, test_f1: 0.5266
 epoch: 62, train_loss: 0.6886, test_loss: 1.0941, test_f1: 0.5153
 epoch: 63, train_loss: 0.6918, test_loss: 1.1220, test_f1: 0.4879
 epoch: 64, train_loss: 0.6875, test_loss: 1.1887, test_f1: 0.4794
 epoch: 65, train_loss: 0.6722, test_loss: 1.0895, test_f1: 0.5218
 epoch: 66, train_loss: 0.6754, test_loss: 1.1334, test_f1: 0.5044
 epoch: 67, train_loss: 0.6638, test_loss: 1.1462, test_f1: 0.4976
 epoch: 68, train_loss: 0.6786, test_loss: 1.1808, test_f1: 0.5084
 epoch: 69, train_loss: 0.6720, test_loss: 1.1414, test_f1: 0.5049
 epoch: 70, train_loss: 0.6750, test_loss: 1.1079, test_f1: 0.5051
 epoch: 71, train_loss: 0.6750, test_loss: 1.1146, test_f1: 0.5135
 epoch: 72, train_loss: 0.6597, test_loss: 1.1479, test_f1: 0.5111
 epoch: 73, train_loss: 0.6666, test_loss: 1.2228, test_f1: 0.4980
 epoch: 74, train_loss: 0.6388, test_loss: 1.1202, test_f1: 0.5383
 epoch: 75, train_loss: 0.6566, test_loss: 1.1473, test_f1: 0.5257
 epoch: 76, train_loss: 0.6756, test_loss: 1.1692, test_f1: 0.5056
 epoch: 77, train_loss: 0.6573, test_loss: 1.1176, test_f1: 0.5177
 epoch: 78, train_loss: 0.6419, test_loss: 1.1852, test_f1: 0.4803
 epoch: 79, train_loss: 0.6450, test_loss: 1.1340, test_f1: 0.5307
 epoch: 80, train_loss: 0.6526, test_loss: 1.1286, test_f1: 0.5059
 epoch: 81, train_loss: 0.6602, test_loss: 1.1485, test_f1: 0.5242
 epoch: 82, train_loss: 0.6495, test_loss: 1.0995, test_f1: 0.5376
 epoch: 83, train_loss: 0.6413, test_loss: 1.1678, test_f1: 0.5266
 epoch: 84, train_loss: 0.6313, test_loss: 1.2157, test_f1: 0.5183
 epoch: 85, train_loss: 0.6401, test_loss: 1.2145, test_f1: 0.4983
 epoch: 86, train_loss: 0.6405, test_loss: 1.2044, test_f1: 0.5041
 epoch: 87, train_loss: 0.6360, test_loss: 1.2168, test_f1: 0.5280
 epoch: 88, train_loss: 0.6267, test_loss: 1.1807, test_f1: 0.5282
 epoch: 89, train_loss: 0.6376, test_loss: 1.2004, test_f1: 0.5081
 epoch: 90, train_loss: 0.6195, test_loss: 1.2200, test_f1: 0.5245
 epoch: 91, train_loss: 0.6397, test_loss: 1.2177, test_f1: 0.5477
 epoch: 92, train_loss: 0.6166, test_loss: 1.2772, test_f1: 0.4956
 epoch: 93, train_loss: 0.6193, test_loss: 1.2064, test_f1: 0.5296
 epoch: 94, train_loss: 0.6209, test_loss: 1.2516, test_f1: 0.5157
 epoch: 95, train_loss: 0.6174, test_loss: 1.2099, test_f1: 0.5325
 epoch: 96, train_loss: 0.6057, test_loss: 1.2286, test_f1: 0.5202
 epoch: 97, train_loss: 0.5956, test_loss: 1.1990, test_f1: 0.5241
 epoch: 98, train_loss: 0.6092, test_loss: 1.2189, test_f1: 0.5235
 epoch: 99, train_loss: 0.6123, test_loss: 1.2137, test_f1: 0.5410
##################ITERATION #2 ****************************************
 epoch: 0, train_loss: 1.2533, test_loss: 1.1503, test_f1: 0.4362
 epoch: 1, train_loss: 1.1723, test_loss: 1.1160, test_f1: 0.4462
 epoch: 2, train_loss: 1.1400, test_loss: 1.0939, test_f1: 0.4523
 epoch: 3, train_loss: 1.1197, test_loss: 1.0732, test_f1: 0.4492
 epoch: 4, train_loss: 1.0950, test_loss: 1.0498, test_f1: 0.4726
 epoch: 5, train_loss: 1.0769, test_loss: 1.0246, test_f1: 0.4739
 epoch: 6, train_loss: 1.0618, test_loss: 1.0044, test_f1: 0.4719
 epoch: 7, train_loss: 1.0460, test_loss: 0.9862, test_f1: 0.5090
 epoch: 8, train_loss: 1.0214, test_loss: 0.9879, test_f1: 0.4917
 epoch: 9, train_loss: 1.0192, test_loss: 0.9697, test_f1: 0.4759
 epoch: 10, train_loss: 1.0068, test_loss: 0.9666, test_f1: 0.4618
 epoch: 11, train_loss: 0.9965, test_loss: 0.9578, test_f1: 0.4794
 epoch: 12, train_loss: 0.9809, test_loss: 0.9543, test_f1: 0.4810
 epoch: 13, train_loss: 0.9630, test_loss: 0.9562, test_f1: 0.4846
 epoch: 14, train_loss: 0.9625, test_loss: 0.9758, test_f1: 0.4896
 epoch: 15, train_loss: 0.9550, test_loss: 0.9549, test_f1: 0.4810
 epoch: 16, train_loss: 0.9469, test_loss: 0.9360, test_f1: 0.4916
 epoch: 17, train_loss: 0.9426, test_loss: 0.9343, test_f1: 0.4906
 epoch: 18, train_loss: 0.9250, test_loss: 0.9303, test_f1: 0.4978
 epoch: 19, train_loss: 0.9125, test_loss: 0.9459, test_f1: 0.5097
 epoch: 20, train_loss: 0.9156, test_loss: 0.9256, test_f1: 0.5037
 epoch: 21, train_loss: 0.9163, test_loss: 0.9531, test_f1: 0.5042
 epoch: 22, train_loss: 0.8929, test_loss: 0.9240, test_f1: 0.4955
 epoch: 23, train_loss: 0.8857, test_loss: 0.9286, test_f1: 0.5182
 epoch: 24, train_loss: 0.9005, test_loss: 0.9301, test_f1: 0.5088
 epoch: 25, train_loss: 0.8815, test_loss: 0.9446, test_f1: 0.5199
 epoch: 26, train_loss: 0.8761, test_loss: 0.9557, test_f1: 0.5017
 epoch: 27, train_loss: 0.8685, test_loss: 0.9535, test_f1: 0.5103
 epoch: 28, train_loss: 0.8597, test_loss: 0.9656, test_f1: 0.5107
 epoch: 29, train_loss: 0.8771, test_loss: 0.9436, test_f1: 0.5232
 epoch: 30, train_loss: 0.8532, test_loss: 0.9653, test_f1: 0.5232
 epoch: 31, train_loss: 0.8634, test_loss: 0.9573, test_f1: 0.5202
 epoch: 32, train_loss: 0.8553, test_loss: 0.9614, test_f1: 0.5110
 epoch: 33, train_loss: 0.8393, test_loss: 0.9458, test_f1: 0.4828
 epoch: 34, train_loss: 0.8364, test_loss: 0.9681, test_f1: 0.4904
 epoch: 35, train_loss: 0.8411, test_loss: 0.9481, test_f1: 0.5173
 epoch: 36, train_loss: 0.8301, test_loss: 0.9520, test_f1: 0.5144
 epoch: 37, train_loss: 0.8239, test_loss: 0.9960, test_f1: 0.5159
 epoch: 38, train_loss: 0.8128, test_loss: 0.9990, test_f1: 0.5011
 epoch: 39, train_loss: 0.8106, test_loss: 1.0156, test_f1: 0.5249
 epoch: 40, train_loss: 0.8008, test_loss: 1.0016, test_f1: 0.5097
 epoch: 41, train_loss: 0.8070, test_loss: 1.0037, test_f1: 0.5206
 epoch: 42, train_loss: 0.8051, test_loss: 1.0249, test_f1: 0.4907
 epoch: 43, train_loss: 0.8000, test_loss: 0.9929, test_f1: 0.5313
 epoch: 44, train_loss: 0.7849, test_loss: 1.0034, test_f1: 0.5038
 epoch: 45, train_loss: 0.7761, test_loss: 1.0274, test_f1: 0.5273
 epoch: 46, train_loss: 0.7786, test_loss: 0.9949, test_f1: 0.5361
 epoch: 47, train_loss: 0.7738, test_loss: 1.0411, test_f1: 0.5127
 epoch: 48, train_loss: 0.7826, test_loss: 1.0129, test_f1: 0.5398
 epoch: 49, train_loss: 0.7838, test_loss: 1.0238, test_f1: 0.5201
 epoch: 50, train_loss: 0.7661, test_loss: 1.0183, test_f1: 0.5261
 epoch: 51, train_loss: 0.7465, test_loss: 1.0376, test_f1: 0.5308
 epoch: 52, train_loss: 0.7452, test_loss: 1.0061, test_f1: 0.5256
 epoch: 53, train_loss: 0.7369, test_loss: 1.0377, test_f1: 0.5360
 epoch: 54, train_loss: 0.7319, test_loss: 1.0744, test_f1: 0.5116
 epoch: 55, train_loss: 0.7380, test_loss: 1.0562, test_f1: 0.5337
 epoch: 56, train_loss: 0.7379, test_loss: 1.0248, test_f1: 0.5064
 epoch: 57, train_loss: 0.7295, test_loss: 1.0706, test_f1: 0.5112
 epoch: 58, train_loss: 0.7248, test_loss: 1.0775, test_f1: 0.5203
 epoch: 59, train_loss: 0.7265, test_loss: 1.0608, test_f1: 0.5391
 epoch: 60, train_loss: 0.7201, test_loss: 1.0717, test_f1: 0.5318
 epoch: 61, train_loss: 0.7211, test_loss: 1.0813, test_f1: 0.5360
 epoch: 62, train_loss: 0.7186, test_loss: 1.0961, test_f1: 0.5120
 epoch: 63, train_loss: 0.7137, test_loss: 1.0909, test_f1: 0.5285
 epoch: 64, train_loss: 0.7088, test_loss: 1.0798, test_f1: 0.5388
 epoch: 65, train_loss: 0.7229, test_loss: 1.1241, test_f1: 0.5237
 epoch: 66, train_loss: 0.7091, test_loss: 1.0892, test_f1: 0.5134
 epoch: 67, train_loss: 0.7069, test_loss: 1.1028, test_f1: 0.5289
 epoch: 68, train_loss: 0.7020, test_loss: 1.1149, test_f1: 0.5165
 epoch: 69, train_loss: 0.7026, test_loss: 1.1347, test_f1: 0.4910
 epoch: 70, train_loss: 0.6911, test_loss: 1.1695, test_f1: 0.4938
 epoch: 71, train_loss: 0.7073, test_loss: 1.1640, test_f1: 0.5165
 epoch: 72, train_loss: 0.7040, test_loss: 1.1545, test_f1: 0.5344
 epoch: 73, train_loss: 0.6926, test_loss: 1.1222, test_f1: 0.5178
 epoch: 74, train_loss: 0.6945, test_loss: 1.1248, test_f1: 0.5421
 epoch: 75, train_loss: 0.6812, test_loss: 1.1733, test_f1: 0.5254
 epoch: 76, train_loss: 0.6766, test_loss: 1.1021, test_f1: 0.5418
 epoch: 77, train_loss: 0.6948, test_loss: 1.1784, test_f1: 0.5127
 epoch: 78, train_loss: 0.6821, test_loss: 1.1749, test_f1: 0.5196
 epoch: 79, train_loss: 0.6781, test_loss: 1.1605, test_f1: 0.5171
 epoch: 80, train_loss: 0.6728, test_loss: 1.1738, test_f1: 0.5141
 epoch: 81, train_loss: 0.6830, test_loss: 1.0999, test_f1: 0.5460
 epoch: 82, train_loss: 0.6700, test_loss: 1.1568, test_f1: 0.5323
 epoch: 83, train_loss: 0.6822, test_loss: 1.1591, test_f1: 0.5056
 epoch: 84, train_loss: 0.6787, test_loss: 1.1765, test_f1: 0.5362
 epoch: 85, train_loss: 0.6686, test_loss: 1.1822, test_f1: 0.5152
 epoch: 86, train_loss: 0.6673, test_loss: 1.1728, test_f1: 0.5105
 epoch: 87, train_loss: 0.6711, test_loss: 1.2149, test_f1: 0.5022
 epoch: 88, train_loss: 0.6546, test_loss: 1.1556, test_f1: 0.5264
 epoch: 89, train_loss: 0.6526, test_loss: 1.2001, test_f1: 0.5279
 epoch: 90, train_loss: 0.6613, test_loss: 1.2067, test_f1: 0.5159
 epoch: 91, train_loss: 0.6533, test_loss: 1.2138, test_f1: 0.5137
 epoch: 92, train_loss: 0.6630, test_loss: 1.2546, test_f1: 0.5271
 epoch: 93, train_loss: 0.6511, test_loss: 1.1997, test_f1: 0.5079
 epoch: 94, train_loss: 0.6550, test_loss: 1.1627, test_f1: 0.5332
 epoch: 95, train_loss: 0.6485, test_loss: 1.2888, test_f1: 0.4912
 epoch: 96, train_loss: 0.6398, test_loss: 1.1964, test_f1: 0.4916
 epoch: 97, train_loss: 0.6447, test_loss: 1.2592, test_f1: 0.5251
 epoch: 98, train_loss: 0.6372, test_loss: 1.2468, test_f1: 0.5159
 epoch: 99, train_loss: 0.6426, test_loss: 1.2873, test_f1: 0.5226
##################ITERATION #3 ****************************************
 epoch: 0, train_loss: 1.2623, test_loss: 1.1592, test_f1: 0.4342
 epoch: 1, train_loss: 1.1892, test_loss: 1.1144, test_f1: 0.4500
 epoch: 2, train_loss: 1.1489, test_loss: 1.0858, test_f1: 0.4466
 epoch: 3, train_loss: 1.1339, test_loss: 1.0759, test_f1: 0.4648
 epoch: 4, train_loss: 1.1093, test_loss: 1.0443, test_f1: 0.4439
 epoch: 5, train_loss: 1.0862, test_loss: 1.0267, test_f1: 0.4547
 epoch: 6, train_loss: 1.0734, test_loss: 1.0124, test_f1: 0.4906
 epoch: 7, train_loss: 1.0528, test_loss: 1.0058, test_f1: 0.4542
 epoch: 8, train_loss: 1.0422, test_loss: 0.9820, test_f1: 0.4814
 epoch: 9, train_loss: 1.0245, test_loss: 0.9737, test_f1: 0.4619
 epoch: 10, train_loss: 1.0178, test_loss: 0.9617, test_f1: 0.4784
 epoch: 11, train_loss: 1.0141, test_loss: 0.9550, test_f1: 0.4843
 epoch: 12, train_loss: 0.9879, test_loss: 0.9528, test_f1: 0.4715
 epoch: 13, train_loss: 0.9881, test_loss: 0.9450, test_f1: 0.4795
 epoch: 14, train_loss: 0.9711, test_loss: 0.9414, test_f1: 0.4667
 epoch: 15, train_loss: 0.9673, test_loss: 0.9373, test_f1: 0.4899
 epoch: 16, train_loss: 0.9557, test_loss: 0.9423, test_f1: 0.4695
 epoch: 17, train_loss: 0.9505, test_loss: 0.9454, test_f1: 0.4730
 epoch: 18, train_loss: 0.9562, test_loss: 0.9485, test_f1: 0.5063
 epoch: 19, train_loss: 0.9408, test_loss: 0.9296, test_f1: 0.4930
 epoch: 20, train_loss: 0.9182, test_loss: 0.9426, test_f1: 0.5159
 epoch: 21, train_loss: 0.9088, test_loss: 0.9463, test_f1: 0.5047
 epoch: 22, train_loss: 0.9004, test_loss: 0.9532, test_f1: 0.5126
 epoch: 23, train_loss: 0.9050, test_loss: 0.9698, test_f1: 0.4801
 epoch: 24, train_loss: 0.9024, test_loss: 0.9497, test_f1: 0.4761
 epoch: 25, train_loss: 0.8982, test_loss: 0.9720, test_f1: 0.4956
 epoch: 26, train_loss: 0.8916, test_loss: 0.9443, test_f1: 0.4913
 epoch: 27, train_loss: 0.8755, test_loss: 0.9614, test_f1: 0.4964
 epoch: 28, train_loss: 0.8808, test_loss: 0.9894, test_f1: 0.5059
 epoch: 29, train_loss: 0.8645, test_loss: 0.9933, test_f1: 0.5106
 epoch: 30, train_loss: 0.8605, test_loss: 0.9477, test_f1: 0.5176
 epoch: 31, train_loss: 0.8640, test_loss: 1.0219, test_f1: 0.5194
 epoch: 32, train_loss: 0.8647, test_loss: 0.9527, test_f1: 0.5153
 epoch: 33, train_loss: 0.8560, test_loss: 0.9878, test_f1: 0.5167
 epoch: 34, train_loss: 0.8538, test_loss: 0.9542, test_f1: 0.5277
 epoch: 35, train_loss: 0.8449, test_loss: 1.0030, test_f1: 0.5112
 epoch: 36, train_loss: 0.8387, test_loss: 0.9728, test_f1: 0.5347
 epoch: 37, train_loss: 0.8501, test_loss: 0.9759, test_f1: 0.5137
 epoch: 38, train_loss: 0.8335, test_loss: 0.9628, test_f1: 0.5319
 epoch: 39, train_loss: 0.8261, test_loss: 0.9713, test_f1: 0.5319
 epoch: 40, train_loss: 0.8307, test_loss: 1.0195, test_f1: 0.4997
 epoch: 41, train_loss: 0.8107, test_loss: 0.9819, test_f1: 0.5091
 epoch: 42, train_loss: 0.8123, test_loss: 0.9754, test_f1: 0.5379
 epoch: 43, train_loss: 0.8040, test_loss: 1.0202, test_f1: 0.5028
 epoch: 44, train_loss: 0.8056, test_loss: 0.9854, test_f1: 0.5372
 epoch: 45, train_loss: 0.7994, test_loss: 1.0036, test_f1: 0.5197
 epoch: 46, train_loss: 0.8007, test_loss: 1.0141, test_f1: 0.5295
 epoch: 47, train_loss: 0.7914, test_loss: 1.0343, test_f1: 0.5104
 epoch: 48, train_loss: 0.7872, test_loss: 1.0153, test_f1: 0.5287
 epoch: 49, train_loss: 0.7863, test_loss: 0.9748, test_f1: 0.5165
 epoch: 50, train_loss: 0.7730, test_loss: 1.0593, test_f1: 0.5249
 epoch: 51, train_loss: 0.7697, test_loss: 1.0169, test_f1: 0.5268
 epoch: 52, train_loss: 0.7546, test_loss: 1.0031, test_f1: 0.5248
 epoch: 53, train_loss: 0.7568, test_loss: 1.0282, test_f1: 0.5334
 epoch: 54, train_loss: 0.7435, test_loss: 1.0167, test_f1: 0.5251
 epoch: 55, train_loss: 0.7507, test_loss: 1.0265, test_f1: 0.5236
 epoch: 56, train_loss: 0.7463, test_loss: 1.0560, test_f1: 0.5214
 epoch: 57, train_loss: 0.7530, test_loss: 1.0116, test_f1: 0.5270
 epoch: 58, train_loss: 0.7551, test_loss: 1.0316, test_f1: 0.5172
 epoch: 59, train_loss: 0.7377, test_loss: 1.0741, test_f1: 0.5123
 epoch: 60, train_loss: 0.7396, test_loss: 1.0293, test_f1: 0.5301
 epoch: 61, train_loss: 0.7347, test_loss: 1.0614, test_f1: 0.5199
 epoch: 62, train_loss: 0.7289, test_loss: 1.0436, test_f1: 0.5199
 epoch: 63, train_loss: 0.7313, test_loss: 1.0205, test_f1: 0.5381
 epoch: 64, train_loss: 0.7325, test_loss: 1.0220, test_f1: 0.5243
 epoch: 65, train_loss: 0.7332, test_loss: 1.0566, test_f1: 0.5259
 epoch: 66, train_loss: 0.7317, test_loss: 1.0411, test_f1: 0.5182
 epoch: 67, train_loss: 0.7249, test_loss: 1.0348, test_f1: 0.5293
 epoch: 68, train_loss: 0.7181, test_loss: 1.0515, test_f1: 0.5316
 epoch: 69, train_loss: 0.7154, test_loss: 1.0722, test_f1: 0.5299
 epoch: 70, train_loss: 0.7214, test_loss: 1.0320, test_f1: 0.5347
 epoch: 71, train_loss: 0.7107, test_loss: 1.0865, test_f1: 0.5242
 epoch: 72, train_loss: 0.7065, test_loss: 1.0670, test_f1: 0.5208
 epoch: 73, train_loss: 0.6956, test_loss: 1.0592, test_f1: 0.5304
 epoch: 74, train_loss: 0.7005, test_loss: 1.0951, test_f1: 0.5161
 epoch: 75, train_loss: 0.7074, test_loss: 1.1287, test_f1: 0.5286
 epoch: 76, train_loss: 0.6971, test_loss: 1.0797, test_f1: 0.5272
 epoch: 77, train_loss: 0.6932, test_loss: 1.1071, test_f1: 0.5276
 epoch: 78, train_loss: 0.7012, test_loss: 1.1634, test_f1: 0.5132
 epoch: 79, train_loss: 0.7011, test_loss: 1.1036, test_f1: 0.5028
 epoch: 80, train_loss: 0.6932, test_loss: 1.1229, test_f1: 0.5130
 epoch: 81, train_loss: 0.6946, test_loss: 1.1219, test_f1: 0.5047
 epoch: 82, train_loss: 0.6761, test_loss: 1.1017, test_f1: 0.5028
 epoch: 83, train_loss: 0.6865, test_loss: 1.1070, test_f1: 0.5104
 epoch: 84, train_loss: 0.6813, test_loss: 1.0608, test_f1: 0.5393
 epoch: 85, train_loss: 0.6772, test_loss: 1.1037, test_f1: 0.5187
 epoch: 86, train_loss: 0.6861, test_loss: 1.1089, test_f1: 0.5317
 epoch: 87, train_loss: 0.6832, test_loss: 1.1545, test_f1: 0.5104
 epoch: 88, train_loss: 0.6805, test_loss: 1.1479, test_f1: 0.5221
 epoch: 89, train_loss: 0.6661, test_loss: 1.1065, test_f1: 0.5305
 epoch: 90, train_loss: 0.6684, test_loss: 1.2045, test_f1: 0.4929
 epoch: 91, train_loss: 0.6785, test_loss: 1.1251, test_f1: 0.5408
 epoch: 92, train_loss: 0.6718, test_loss: 1.1211, test_f1: 0.5218
 epoch: 93, train_loss: 0.6555, test_loss: 1.1166, test_f1: 0.5318
 epoch: 94, train_loss: 0.6643, test_loss: 1.1632, test_f1: 0.5310
 epoch: 95, train_loss: 0.6655, test_loss: 1.1574, test_f1: 0.5229
 epoch: 96, train_loss: 0.6688, test_loss: 1.2120, test_f1: 0.5024
 epoch: 97, train_loss: 0.6481, test_loss: 1.1384, test_f1: 0.5287
 epoch: 98, train_loss: 0.6691, test_loss: 1.1452, test_f1: 0.5209
 epoch: 99, train_loss: 0.6521, test_loss: 1.1474, test_f1: 0.5130
##################ITERATION #4 ****************************************
 epoch: 0, train_loss: 1.2546, test_loss: 1.1043, test_f1: 0.4743
 epoch: 1, train_loss: 1.1553, test_loss: 1.0831, test_f1: 0.4696
 epoch: 2, train_loss: 1.1270, test_loss: 1.0558, test_f1: 0.4760
 epoch: 3, train_loss: 1.1060, test_loss: 1.0418, test_f1: 0.4595
 epoch: 4, train_loss: 1.0881, test_loss: 1.0220, test_f1: 0.4372
 epoch: 5, train_loss: 1.0712, test_loss: 1.0073, test_f1: 0.4761
 epoch: 6, train_loss: 1.0458, test_loss: 1.0045, test_f1: 0.4526
 epoch: 7, train_loss: 1.0415, test_loss: 0.9995, test_f1: 0.4516
 epoch: 8, train_loss: 1.0195, test_loss: 1.0100, test_f1: 0.4565
 epoch: 9, train_loss: 1.0176, test_loss: 0.9873, test_f1: 0.4565
 epoch: 10, train_loss: 1.0011, test_loss: 0.9811, test_f1: 0.4643
 epoch: 11, train_loss: 0.9900, test_loss: 0.9994, test_f1: 0.4758
 epoch: 12, train_loss: 0.9797, test_loss: 0.9815, test_f1: 0.4622
 epoch: 13, train_loss: 0.9649, test_loss: 0.9665, test_f1: 0.4802
 epoch: 14, train_loss: 0.9636, test_loss: 1.0049, test_f1: 0.4587
 epoch: 15, train_loss: 0.9541, test_loss: 0.9854, test_f1: 0.5015
 epoch: 16, train_loss: 0.9571, test_loss: 0.9904, test_f1: 0.4909
 epoch: 17, train_loss: 0.9433, test_loss: 0.9563, test_f1: 0.4948
 epoch: 18, train_loss: 0.9402, test_loss: 0.9635, test_f1: 0.4747
 epoch: 19, train_loss: 0.9280, test_loss: 0.9578, test_f1: 0.4882
 epoch: 20, train_loss: 0.9208, test_loss: 0.9397, test_f1: 0.4896
 epoch: 21, train_loss: 0.9068, test_loss: 0.9758, test_f1: 0.4899
 epoch: 22, train_loss: 0.9163, test_loss: 0.9588, test_f1: 0.5071
 epoch: 23, train_loss: 0.9048, test_loss: 0.9681, test_f1: 0.5019
 epoch: 24, train_loss: 0.8864, test_loss: 0.9565, test_f1: 0.5061
 epoch: 25, train_loss: 0.8901, test_loss: 0.9727, test_f1: 0.4884
 epoch: 26, train_loss: 0.8804, test_loss: 0.9726, test_f1: 0.5068
 epoch: 27, train_loss: 0.8794, test_loss: 0.9868, test_f1: 0.5022
 epoch: 28, train_loss: 0.8721, test_loss: 1.0105, test_f1: 0.4968
 epoch: 29, train_loss: 0.8541, test_loss: 1.0085, test_f1: 0.4885
 epoch: 30, train_loss: 0.8608, test_loss: 1.0106, test_f1: 0.4984
 epoch: 31, train_loss: 0.8563, test_loss: 0.9812, test_f1: 0.5125
 epoch: 32, train_loss: 0.8428, test_loss: 1.0252, test_f1: 0.4982
 epoch: 33, train_loss: 0.8418, test_loss: 1.0097, test_f1: 0.5112
 epoch: 34, train_loss: 0.8279, test_loss: 1.0025, test_f1: 0.5084
 epoch: 35, train_loss: 0.8438, test_loss: 0.9665, test_f1: 0.5132
 epoch: 36, train_loss: 0.8312, test_loss: 1.0166, test_f1: 0.5090
 epoch: 37, train_loss: 0.8246, test_loss: 1.0140, test_f1: 0.5250
 epoch: 38, train_loss: 0.8114, test_loss: 1.0329, test_f1: 0.5068
 epoch: 39, train_loss: 0.8140, test_loss: 1.0256, test_f1: 0.5069
 epoch: 40, train_loss: 0.8052, test_loss: 1.0046, test_f1: 0.5061
 epoch: 41, train_loss: 0.8049, test_loss: 1.0319, test_f1: 0.5164
 epoch: 42, train_loss: 0.8090, test_loss: 1.0273, test_f1: 0.4994
 epoch: 43, train_loss: 0.8012, test_loss: 1.0918, test_f1: 0.5042
 epoch: 44, train_loss: 0.7826, test_loss: 1.0770, test_f1: 0.5154
 epoch: 45, train_loss: 0.7914, test_loss: 1.0788, test_f1: 0.5129
 epoch: 46, train_loss: 0.7839, test_loss: 1.0255, test_f1: 0.4967
 epoch: 47, train_loss: 0.7723, test_loss: 1.0758, test_f1: 0.4875
 epoch: 48, train_loss: 0.7695, test_loss: 1.0102, test_f1: 0.5255
 epoch: 49, train_loss: 0.7706, test_loss: 1.0677, test_f1: 0.5047
 epoch: 50, train_loss: 0.7618, test_loss: 1.0593, test_f1: 0.5380
 epoch: 51, train_loss: 0.7444, test_loss: 1.0237, test_f1: 0.5228
 epoch: 52, train_loss: 0.7483, test_loss: 1.0409, test_f1: 0.5325
 epoch: 53, train_loss: 0.7475, test_loss: 1.0724, test_f1: 0.5162
 epoch: 54, train_loss: 0.7325, test_loss: 1.0618, test_f1: 0.5249
 epoch: 55, train_loss: 0.7465, test_loss: 1.0464, test_f1: 0.5164
 epoch: 56, train_loss: 0.7264, test_loss: 1.0785, test_f1: 0.5113
 epoch: 57, train_loss: 0.7403, test_loss: 1.0700, test_f1: 0.5005
 epoch: 58, train_loss: 0.7350, test_loss: 1.0441, test_f1: 0.5195
 epoch: 59, train_loss: 0.7366, test_loss: 1.0681, test_f1: 0.5041
 epoch: 60, train_loss: 0.7215, test_loss: 1.1310, test_f1: 0.4982
 epoch: 61, train_loss: 0.7220, test_loss: 1.0792, test_f1: 0.5180
 epoch: 62, train_loss: 0.7297, test_loss: 1.1003, test_f1: 0.4977
 epoch: 63, train_loss: 0.7120, test_loss: 1.0646, test_f1: 0.5211
 epoch: 64, train_loss: 0.7190, test_loss: 1.0758, test_f1: 0.5183
 epoch: 65, train_loss: 0.7238, test_loss: 1.1218, test_f1: 0.5177
 epoch: 66, train_loss: 0.7161, test_loss: 1.0647, test_f1: 0.5177
 epoch: 67, train_loss: 0.7237, test_loss: 1.1115, test_f1: 0.5205
 epoch: 68, train_loss: 0.7062, test_loss: 1.0932, test_f1: 0.5102
 epoch: 69, train_loss: 0.7019, test_loss: 1.0442, test_f1: 0.5264
 epoch: 70, train_loss: 0.6991, test_loss: 1.1401, test_f1: 0.4995
 epoch: 71, train_loss: 0.6972, test_loss: 1.1204, test_f1: 0.5224
 epoch: 72, train_loss: 0.6963, test_loss: 1.1381, test_f1: 0.5085
 epoch: 73, train_loss: 0.6851, test_loss: 1.1255, test_f1: 0.5137
 epoch: 74, train_loss: 0.6918, test_loss: 1.1005, test_f1: 0.5207
 epoch: 75, train_loss: 0.6850, test_loss: 1.1162, test_f1: 0.5134
 epoch: 76, train_loss: 0.6998, test_loss: 1.1258, test_f1: 0.5117
 epoch: 77, train_loss: 0.6845, test_loss: 1.0857, test_f1: 0.5258
 epoch: 78, train_loss: 0.6832, test_loss: 1.1286, test_f1: 0.5011
 epoch: 79, train_loss: 0.6824, test_loss: 1.1189, test_f1: 0.5212
 epoch: 80, train_loss: 0.6732, test_loss: 1.1409, test_f1: 0.5176
 epoch: 81, train_loss: 0.6679, test_loss: 1.1080, test_f1: 0.5328
 epoch: 82, train_loss: 0.6753, test_loss: 1.0910, test_f1: 0.5262
 epoch: 83, train_loss: 0.6723, test_loss: 1.1209, test_f1: 0.5454
 epoch: 84, train_loss: 0.6774, test_loss: 1.1207, test_f1: 0.5425
 epoch: 85, train_loss: 0.6774, test_loss: 1.1162, test_f1: 0.5261
 epoch: 86, train_loss: 0.6608, test_loss: 1.1440, test_f1: 0.5324
 epoch: 87, train_loss: 0.6604, test_loss: 1.1005, test_f1: 0.5429
 epoch: 88, train_loss: 0.6609, test_loss: 1.1791, test_f1: 0.5362
 epoch: 89, train_loss: 0.6508, test_loss: 1.1479, test_f1: 0.5247
 epoch: 90, train_loss: 0.6608, test_loss: 1.1644, test_f1: 0.5351
 epoch: 91, train_loss: 0.6496, test_loss: 1.1179, test_f1: 0.5409
 epoch: 92, train_loss: 0.6606, test_loss: 1.1946, test_f1: 0.5122
 epoch: 93, train_loss: 0.6600, test_loss: 1.1156, test_f1: 0.5306
 epoch: 94, train_loss: 0.6471, test_loss: 1.1990, test_f1: 0.5252
 epoch: 95, train_loss: 0.6509, test_loss: 1.1702, test_f1: 0.5320
 epoch: 96, train_loss: 0.6341, test_loss: 1.1661, test_f1: 0.5334
 epoch: 97, train_loss: 0.6490, test_loss: 1.1921, test_f1: 0.5273
 epoch: 98, train_loss: 0.6424, test_loss: 1.1784, test_f1: 0.5398
 epoch: 99, train_loss: 0.6430, test_loss: 1.1360, test_f1: 0.5442
##################ITERATION #5 ****************************************
 epoch: 0, train_loss: 1.3031, test_loss: 1.1672, test_f1: 0.4209
 epoch: 1, train_loss: 1.1837, test_loss: 1.1241, test_f1: 0.4366
 epoch: 2, train_loss: 1.1565, test_loss: 1.1018, test_f1: 0.4221
 epoch: 3, train_loss: 1.1258, test_loss: 1.0867, test_f1: 0.4669
 epoch: 4, train_loss: 1.1222, test_loss: 1.0833, test_f1: 0.4621
 epoch: 5, train_loss: 1.0965, test_loss: 1.0533, test_f1: 0.4542
 epoch: 6, train_loss: 1.0870, test_loss: 1.0391, test_f1: 0.4338
 epoch: 7, train_loss: 1.0802, test_loss: 1.0360, test_f1: 0.4751
 epoch: 8, train_loss: 1.0612, test_loss: 1.0264, test_f1: 0.4758
 epoch: 9, train_loss: 1.0450, test_loss: 1.0136, test_f1: 0.4584
 epoch: 10, train_loss: 1.0295, test_loss: 1.0061, test_f1: 0.4752
 epoch: 11, train_loss: 1.0216, test_loss: 0.9916, test_f1: 0.4705
 epoch: 12, train_loss: 1.0064, test_loss: 1.0096, test_f1: 0.4884
 epoch: 13, train_loss: 1.0092, test_loss: 0.9922, test_f1: 0.4734
 epoch: 14, train_loss: 0.9946, test_loss: 0.9794, test_f1: 0.4856
 epoch: 15, train_loss: 0.9901, test_loss: 0.9736, test_f1: 0.4867
 epoch: 16, train_loss: 0.9737, test_loss: 0.9585, test_f1: 0.4915
 epoch: 17, train_loss: 0.9645, test_loss: 0.9792, test_f1: 0.4557
 epoch: 18, train_loss: 0.9604, test_loss: 0.9699, test_f1: 0.4642
 epoch: 19, train_loss: 0.9487, test_loss: 0.9655, test_f1: 0.4812
 epoch: 20, train_loss: 0.9387, test_loss: 0.9823, test_f1: 0.4580
 epoch: 21, train_loss: 0.9459, test_loss: 0.9603, test_f1: 0.4944
 epoch: 22, train_loss: 0.9387, test_loss: 0.9636, test_f1: 0.4867
 epoch: 23, train_loss: 0.9316, test_loss: 0.9864, test_f1: 0.4631
 epoch: 24, train_loss: 0.9209, test_loss: 0.9983, test_f1: 0.4627
 epoch: 25, train_loss: 0.9181, test_loss: 0.9902, test_f1: 0.4989
 epoch: 26, train_loss: 0.9203, test_loss: 0.9732, test_f1: 0.4945
 epoch: 27, train_loss: 0.8966, test_loss: 0.9335, test_f1: 0.5094
 epoch: 28, train_loss: 0.8986, test_loss: 0.9506, test_f1: 0.5244
 epoch: 29, train_loss: 0.8959, test_loss: 0.9741, test_f1: 0.5034
 epoch: 30, train_loss: 0.8995, test_loss: 0.9793, test_f1: 0.5023
 epoch: 31, train_loss: 0.8664, test_loss: 1.0034, test_f1: 0.5054
 epoch: 32, train_loss: 0.8706, test_loss: 0.9590, test_f1: 0.5028
 epoch: 33, train_loss: 0.8660, test_loss: 0.9586, test_f1: 0.5196
 epoch: 34, train_loss: 0.8621, test_loss: 1.0905, test_f1: 0.4896
 epoch: 35, train_loss: 0.8628, test_loss: 0.9808, test_f1: 0.4908
 epoch: 36, train_loss: 0.8491, test_loss: 1.0056, test_f1: 0.5010
 epoch: 37, train_loss: 0.8537, test_loss: 0.9775, test_f1: 0.5042
 epoch: 38, train_loss: 0.8355, test_loss: 0.9851, test_f1: 0.5010
 epoch: 39, train_loss: 0.8379, test_loss: 0.9908, test_f1: 0.5092
 epoch: 40, train_loss: 0.8258, test_loss: 0.9855, test_f1: 0.5245
 epoch: 41, train_loss: 0.8347, test_loss: 1.0451, test_f1: 0.5127
 epoch: 42, train_loss: 0.8298, test_loss: 0.9961, test_f1: 0.5100
 epoch: 43, train_loss: 0.8302, test_loss: 1.0018, test_f1: 0.5185
 epoch: 44, train_loss: 0.8221, test_loss: 1.0356, test_f1: 0.5163
 epoch: 45, train_loss: 0.8158, test_loss: 1.0733, test_f1: 0.5129
 epoch: 46, train_loss: 0.8103, test_loss: 1.0468, test_f1: 0.4943
 epoch: 47, train_loss: 0.8249, test_loss: 1.0764, test_f1: 0.5187
 epoch: 48, train_loss: 0.7988, test_loss: 1.0885, test_f1: 0.4975
 epoch: 49, train_loss: 0.7910, test_loss: 1.0871, test_f1: 0.5171
 epoch: 50, train_loss: 0.7994, test_loss: 1.0908, test_f1: 0.5407
 epoch: 51, train_loss: 0.7806, test_loss: 1.0801, test_f1: 0.5067
 epoch: 52, train_loss: 0.7834, test_loss: 1.1198, test_f1: 0.5236
 epoch: 53, train_loss: 0.7902, test_loss: 1.1579, test_f1: 0.5152
 epoch: 54, train_loss: 0.7648, test_loss: 1.0732, test_f1: 0.5303
 epoch: 55, train_loss: 0.7728, test_loss: 1.1296, test_f1: 0.5116
 epoch: 56, train_loss: 0.7654, test_loss: 1.1394, test_f1: 0.5206
 epoch: 57, train_loss: 0.7661, test_loss: 1.1153, test_f1: 0.5189
 epoch: 58, train_loss: 0.7669, test_loss: 1.1224, test_f1: 0.5241
 epoch: 59, train_loss: 0.7476, test_loss: 1.1370, test_f1: 0.5381
 epoch: 60, train_loss: 0.7684, test_loss: 1.1489, test_f1: 0.5338
 epoch: 61, train_loss: 0.7535, test_loss: 1.1645, test_f1: 0.5194
 epoch: 62, train_loss: 0.7529, test_loss: 1.1345, test_f1: 0.5154
 epoch: 63, train_loss: 0.7576, test_loss: 1.1810, test_f1: 0.5432
 epoch: 64, train_loss: 0.7634, test_loss: 1.1589, test_f1: 0.5282
 epoch: 65, train_loss: 0.7591, test_loss: 1.2305, test_f1: 0.5157
 epoch: 66, train_loss: 0.7442, test_loss: 1.2432, test_f1: 0.5391
 epoch: 67, train_loss: 0.7371, test_loss: 1.3664, test_f1: 0.5412
 epoch: 68, train_loss: 0.7351, test_loss: 1.2875, test_f1: 0.5412
 epoch: 69, train_loss: 0.7356, test_loss: 1.2573, test_f1: 0.5398
 epoch: 70, train_loss: 0.7328, test_loss: 1.2854, test_f1: 0.5555
 epoch: 71, train_loss: 0.7403, test_loss: 1.2855, test_f1: 0.5309
 epoch: 72, train_loss: 0.7265, test_loss: 1.2402, test_f1: 0.5350
 epoch: 73, train_loss: 0.7263, test_loss: 1.3107, test_f1: 0.5339
 epoch: 74, train_loss: 0.7237, test_loss: 1.2266, test_f1: 0.5192
 epoch: 75, train_loss: 0.7224, test_loss: 1.3125, test_f1: 0.5337
 epoch: 76, train_loss: 0.7250, test_loss: 1.3127, test_f1: 0.5191
 epoch: 77, train_loss: 0.7201, test_loss: 1.3728, test_f1: 0.5165
 epoch: 78, train_loss: 0.7173, test_loss: 1.3492, test_f1: 0.5358
 epoch: 79, train_loss: 0.7129, test_loss: 1.3402, test_f1: 0.5392
 epoch: 80, train_loss: 0.7306, test_loss: 1.4001, test_f1: 0.5213
 epoch: 81, train_loss: 0.7322, test_loss: 1.4435, test_f1: 0.5273
 epoch: 82, train_loss: 0.7019, test_loss: 1.3018, test_f1: 0.5336
 epoch: 83, train_loss: 0.7117, test_loss: 1.3746, test_f1: 0.5092
 epoch: 84, train_loss: 0.6957, test_loss: 1.4075, test_f1: 0.5191
 epoch: 85, train_loss: 0.7093, test_loss: 1.4052, test_f1: 0.5356
 epoch: 86, train_loss: 0.7021, test_loss: 1.3347, test_f1: 0.5345
 epoch: 87, train_loss: 0.7112, test_loss: 1.3283, test_f1: 0.5513
 epoch: 88, train_loss: 0.6975, test_loss: 1.3970, test_f1: 0.5340
 epoch: 89, train_loss: 0.6923, test_loss: 1.3337, test_f1: 0.5117
 epoch: 90, train_loss: 0.6843, test_loss: 1.3979, test_f1: 0.5176
 epoch: 91, train_loss: 0.7061, test_loss: 1.5856, test_f1: 0.5333
 epoch: 92, train_loss: 0.6941, test_loss: 1.3226, test_f1: 0.5245
 epoch: 93, train_loss: 0.6946, test_loss: 1.4225, test_f1: 0.5312
 epoch: 94, train_loss: 0.7076, test_loss: 1.3506, test_f1: 0.5241
 epoch: 95, train_loss: 0.6968, test_loss: 1.5386, test_f1: 0.5218
 epoch: 96, train_loss: 0.6851, test_loss: 1.2319, test_f1: 0.5541
 epoch: 97, train_loss: 0.6829, test_loss: 1.3127, test_f1: 0.5252
 epoch: 98, train_loss: 0.6853, test_loss: 1.4382, test_f1: 0.5324
 epoch: 99, train_loss: 0.6864, test_loss: 1.5400, test_f1: 0.5368
##################ITERATION #6 ****************************************
 epoch: 0, train_loss: 1.3351, test_loss: 1.1367, test_f1: 0.4181
 epoch: 1, train_loss: 1.1826, test_loss: 1.0940, test_f1: 0.4355
 epoch: 2, train_loss: 1.1617, test_loss: 1.0866, test_f1: 0.4500
 epoch: 3, train_loss: 1.1164, test_loss: 1.0582, test_f1: 0.4578
 epoch: 4, train_loss: 1.1102, test_loss: 1.0413, test_f1: 0.4385
 epoch: 5, train_loss: 1.0800, test_loss: 1.0284, test_f1: 0.4654
 epoch: 6, train_loss: 1.0666, test_loss: 1.0192, test_f1: 0.4597
 epoch: 7, train_loss: 1.0508, test_loss: 0.9932, test_f1: 0.4888
 epoch: 8, train_loss: 1.0437, test_loss: 1.0037, test_f1: 0.4833
 epoch: 9, train_loss: 1.0304, test_loss: 0.9875, test_f1: 0.4746
 epoch: 10, train_loss: 1.0175, test_loss: 0.9996, test_f1: 0.4794
 epoch: 11, train_loss: 1.0132, test_loss: 0.9759, test_f1: 0.4892
 epoch: 12, train_loss: 0.9895, test_loss: 0.9913, test_f1: 0.4924
 epoch: 13, train_loss: 0.9812, test_loss: 0.9661, test_f1: 0.5048
 epoch: 14, train_loss: 0.9750, test_loss: 0.9928, test_f1: 0.4963
 epoch: 15, train_loss: 0.9789, test_loss: 0.9715, test_f1: 0.4912
 epoch: 16, train_loss: 0.9546, test_loss: 0.9603, test_f1: 0.5144
 epoch: 17, train_loss: 0.9585, test_loss: 1.0036, test_f1: 0.4769
 epoch: 18, train_loss: 0.9388, test_loss: 0.9893, test_f1: 0.5020
 epoch: 19, train_loss: 0.9395, test_loss: 0.9639, test_f1: 0.4981
 epoch: 20, train_loss: 0.9366, test_loss: 0.9789, test_f1: 0.5075
 epoch: 21, train_loss: 0.9316, test_loss: 0.9676, test_f1: 0.5131
 epoch: 22, train_loss: 0.9180, test_loss: 0.9616, test_f1: 0.5194
 epoch: 23, train_loss: 0.9219, test_loss: 0.9553, test_f1: 0.5229
 epoch: 24, train_loss: 0.9036, test_loss: 0.9758, test_f1: 0.5219
 epoch: 25, train_loss: 0.8872, test_loss: 0.9908, test_f1: 0.5089
 epoch: 26, train_loss: 0.8966, test_loss: 0.9804, test_f1: 0.5123
 epoch: 27, train_loss: 0.8898, test_loss: 0.9977, test_f1: 0.5117
 epoch: 28, train_loss: 0.8715, test_loss: 0.9762, test_f1: 0.5321
 epoch: 29, train_loss: 0.8684, test_loss: 0.9900, test_f1: 0.5023
 epoch: 30, train_loss: 0.8643, test_loss: 1.0047, test_f1: 0.5221
 epoch: 31, train_loss: 0.8706, test_loss: 0.9821, test_f1: 0.5477
 epoch: 32, train_loss: 0.8558, test_loss: 0.9744, test_f1: 0.5374
 epoch: 33, train_loss: 0.8567, test_loss: 1.0014, test_f1: 0.5255
 epoch: 34, train_loss: 0.8526, test_loss: 0.9899, test_f1: 0.5226
 epoch: 35, train_loss: 0.8436, test_loss: 1.0413, test_f1: 0.5063
 epoch: 36, train_loss: 0.8403, test_loss: 1.0464, test_f1: 0.5360
 epoch: 37, train_loss: 0.8300, test_loss: 1.0331, test_f1: 0.5249
 epoch: 38, train_loss: 0.8240, test_loss: 1.0568, test_f1: 0.5168
 epoch: 39, train_loss: 0.8314, test_loss: 1.0324, test_f1: 0.5447
 epoch: 40, train_loss: 0.8298, test_loss: 0.9954, test_f1: 0.5362
 epoch: 41, train_loss: 0.8176, test_loss: 1.0159, test_f1: 0.5440
 epoch: 42, train_loss: 0.8149, test_loss: 1.0178, test_f1: 0.5598
 epoch: 43, train_loss: 0.8132, test_loss: 1.0454, test_f1: 0.5246
 epoch: 44, train_loss: 0.8061, test_loss: 0.9992, test_f1: 0.5506
 epoch: 45, train_loss: 0.8016, test_loss: 1.0293, test_f1: 0.5277
 epoch: 46, train_loss: 0.7843, test_loss: 1.0368, test_f1: 0.5434
 epoch: 47, train_loss: 0.7898, test_loss: 1.0377, test_f1: 0.5390
 epoch: 48, train_loss: 0.7954, test_loss: 0.9997, test_f1: 0.5455
 epoch: 49, train_loss: 0.7821, test_loss: 1.0365, test_f1: 0.5273
 epoch: 50, train_loss: 0.7737, test_loss: 1.0111, test_f1: 0.5477
 epoch: 51, train_loss: 0.7660, test_loss: 1.0364, test_f1: 0.5330
 epoch: 52, train_loss: 0.7711, test_loss: 1.0426, test_f1: 0.5302
 epoch: 53, train_loss: 0.7667, test_loss: 1.0315, test_f1: 0.5619
 epoch: 54, train_loss: 0.7593, test_loss: 1.0449, test_f1: 0.5428
 epoch: 55, train_loss: 0.7582, test_loss: 1.0491, test_f1: 0.5247
 epoch: 56, train_loss: 0.7571, test_loss: 1.0566, test_f1: 0.5364
 epoch: 57, train_loss: 0.7457, test_loss: 1.0529, test_f1: 0.5481
 epoch: 58, train_loss: 0.7485, test_loss: 1.1129, test_f1: 0.5225
 epoch: 59, train_loss: 0.7429, test_loss: 1.0546, test_f1: 0.5378
 epoch: 60, train_loss: 0.7509, test_loss: 1.0939, test_f1: 0.5237
 epoch: 61, train_loss: 0.7495, test_loss: 1.0676, test_f1: 0.5295
 epoch: 62, train_loss: 0.7444, test_loss: 1.0646, test_f1: 0.5447
 epoch: 63, train_loss: 0.7369, test_loss: 1.0768, test_f1: 0.5230
 epoch: 64, train_loss: 0.7335, test_loss: 1.1070, test_f1: 0.5070
 epoch: 65, train_loss: 0.7382, test_loss: 1.1287, test_f1: 0.5061
 epoch: 66, train_loss: 0.7309, test_loss: 1.0488, test_f1: 0.5492
 epoch: 67, train_loss: 0.7398, test_loss: 1.0587, test_f1: 0.5467
 epoch: 68, train_loss: 0.7275, test_loss: 1.0772, test_f1: 0.5354
 epoch: 69, train_loss: 0.7221, test_loss: 1.1507, test_f1: 0.5105
 epoch: 70, train_loss: 0.7111, test_loss: 1.1207, test_f1: 0.5310
 epoch: 71, train_loss: 0.7267, test_loss: 1.1385, test_f1: 0.5276
 epoch: 72, train_loss: 0.7181, test_loss: 1.0814, test_f1: 0.5400
 epoch: 73, train_loss: 0.7237, test_loss: 1.0980, test_f1: 0.5480
 epoch: 74, train_loss: 0.7165, test_loss: 1.1498, test_f1: 0.5184
 epoch: 75, train_loss: 0.7149, test_loss: 1.0573, test_f1: 0.5440
 epoch: 76, train_loss: 0.7038, test_loss: 1.0893, test_f1: 0.5588
 epoch: 77, train_loss: 0.7059, test_loss: 1.0930, test_f1: 0.5405
 epoch: 78, train_loss: 0.7108, test_loss: 1.1281, test_f1: 0.5275
 epoch: 79, train_loss: 0.7039, test_loss: 1.0999, test_f1: 0.5354
 epoch: 80, train_loss: 0.7144, test_loss: 1.0889, test_f1: 0.5502
 epoch: 81, train_loss: 0.7056, test_loss: 1.1409, test_f1: 0.5343
 epoch: 82, train_loss: 0.7058, test_loss: 1.0770, test_f1: 0.5508
 epoch: 83, train_loss: 0.7011, test_loss: 1.1598, test_f1: 0.5251
 epoch: 84, train_loss: 0.7125, test_loss: 1.1126, test_f1: 0.5428
 epoch: 85, train_loss: 0.7161, test_loss: 1.1582, test_f1: 0.5307
 epoch: 86, train_loss: 0.7026, test_loss: 1.1301, test_f1: 0.5304
 epoch: 87, train_loss: 0.6876, test_loss: 1.1375, test_f1: 0.5317
 epoch: 88, train_loss: 0.7022, test_loss: 1.1017, test_f1: 0.5329
 epoch: 89, train_loss: 0.6754, test_loss: 1.0836, test_f1: 0.5584
 epoch: 90, train_loss: 0.7045, test_loss: 1.1026, test_f1: 0.5551
 epoch: 91, train_loss: 0.6955, test_loss: 1.1599, test_f1: 0.5297
 epoch: 92, train_loss: 0.6799, test_loss: 1.1227, test_f1: 0.5310
 epoch: 93, train_loss: 0.6716, test_loss: 1.1007, test_f1: 0.5400
 epoch: 94, train_loss: 0.6766, test_loss: 1.1705, test_f1: 0.5380
 epoch: 95, train_loss: 0.6852, test_loss: 1.1523, test_f1: 0.5436
 epoch: 96, train_loss: 0.6767, test_loss: 1.1444, test_f1: 0.5328
 epoch: 97, train_loss: 0.6769, test_loss: 1.1638, test_f1: 0.5187
 epoch: 98, train_loss: 0.6933, test_loss: 1.1532, test_f1: 0.5272
 epoch: 99, train_loss: 0.6880, test_loss: 1.1657, test_f1: 0.5439
##################ITERATION #7 ****************************************
 epoch: 0, train_loss: 1.3103, test_loss: 1.1319, test_f1: 0.4326
 epoch: 1, train_loss: 1.1925, test_loss: 1.1082, test_f1: 0.4308
 epoch: 2, train_loss: 1.1603, test_loss: 1.0682, test_f1: 0.4571
 epoch: 3, train_loss: 1.1391, test_loss: 1.0556, test_f1: 0.4664
 epoch: 4, train_loss: 1.1159, test_loss: 1.0590, test_f1: 0.4473
 epoch: 5, train_loss: 1.1064, test_loss: 1.0451, test_f1: 0.4542
 epoch: 6, train_loss: 1.0864, test_loss: 1.0323, test_f1: 0.4458
 epoch: 7, train_loss: 1.0665, test_loss: 1.0209, test_f1: 0.4568
 epoch: 8, train_loss: 1.0601, test_loss: 0.9960, test_f1: 0.4683
 epoch: 9, train_loss: 1.0556, test_loss: 0.9932, test_f1: 0.4563
 epoch: 10, train_loss: 1.0416, test_loss: 0.9892, test_f1: 0.4929
 epoch: 11, train_loss: 1.0372, test_loss: 0.9938, test_f1: 0.4776
 epoch: 12, train_loss: 1.0148, test_loss: 0.9693, test_f1: 0.4725
 epoch: 13, train_loss: 1.0002, test_loss: 0.9807, test_f1: 0.4380
 epoch: 14, train_loss: 0.9959, test_loss: 0.9859, test_f1: 0.4853
 epoch: 15, train_loss: 0.9773, test_loss: 0.9635, test_f1: 0.4659
 epoch: 16, train_loss: 0.9710, test_loss: 0.9505, test_f1: 0.4887
 epoch: 17, train_loss: 0.9750, test_loss: 0.9763, test_f1: 0.5071
 epoch: 18, train_loss: 0.9715, test_loss: 0.9650, test_f1: 0.5015
 epoch: 19, train_loss: 0.9596, test_loss: 0.9705, test_f1: 0.5168
 epoch: 20, train_loss: 0.9620, test_loss: 0.9725, test_f1: 0.4955
 epoch: 21, train_loss: 0.9479, test_loss: 0.9700, test_f1: 0.4949
 epoch: 22, train_loss: 0.9430, test_loss: 0.9685, test_f1: 0.4999
 epoch: 23, train_loss: 0.9339, test_loss: 0.9719, test_f1: 0.4832
 epoch: 24, train_loss: 0.9242, test_loss: 0.9525, test_f1: 0.5066
 epoch: 25, train_loss: 0.9078, test_loss: 0.9611, test_f1: 0.5225
 epoch: 26, train_loss: 0.9085, test_loss: 0.9574, test_f1: 0.5324
 epoch: 27, train_loss: 0.9122, test_loss: 0.9444, test_f1: 0.5083
 epoch: 28, train_loss: 0.9003, test_loss: 0.9386, test_f1: 0.5161
 epoch: 29, train_loss: 0.8976, test_loss: 0.9618, test_f1: 0.5325
 epoch: 30, train_loss: 0.9085, test_loss: 0.9675, test_f1: 0.5105
 epoch: 31, train_loss: 0.8903, test_loss: 0.9601, test_f1: 0.5302
 epoch: 32, train_loss: 0.8857, test_loss: 0.9585, test_f1: 0.5184
 epoch: 33, train_loss: 0.8794, test_loss: 0.9457, test_f1: 0.5381
 epoch: 34, train_loss: 0.8786, test_loss: 0.9633, test_f1: 0.5280
 epoch: 35, train_loss: 0.8648, test_loss: 0.9467, test_f1: 0.5318
 epoch: 36, train_loss: 0.8482, test_loss: 0.9528, test_f1: 0.5149
 epoch: 37, train_loss: 0.8678, test_loss: 0.9534, test_f1: 0.5322
 epoch: 38, train_loss: 0.8499, test_loss: 0.9663, test_f1: 0.5234
 epoch: 39, train_loss: 0.8534, test_loss: 0.9939, test_f1: 0.5244
 epoch: 40, train_loss: 0.8421, test_loss: 0.9879, test_f1: 0.5414
 epoch: 41, train_loss: 0.8448, test_loss: 0.9666, test_f1: 0.5347
 epoch: 42, train_loss: 0.8369, test_loss: 1.0004, test_f1: 0.5215
 epoch: 43, train_loss: 0.8342, test_loss: 0.9709, test_f1: 0.5179
 epoch: 44, train_loss: 0.8242, test_loss: 0.9609, test_f1: 0.5466
 epoch: 45, train_loss: 0.8240, test_loss: 1.0191, test_f1: 0.5414
 epoch: 46, train_loss: 0.8234, test_loss: 0.9809, test_f1: 0.5449
 epoch: 47, train_loss: 0.8104, test_loss: 1.0149, test_f1: 0.5319
 epoch: 48, train_loss: 0.8049, test_loss: 0.9576, test_f1: 0.5316
 epoch: 49, train_loss: 0.8058, test_loss: 0.9708, test_f1: 0.5392
 epoch: 50, train_loss: 0.8007, test_loss: 0.9791, test_f1: 0.5421
 epoch: 51, train_loss: 0.7940, test_loss: 0.9684, test_f1: 0.5504
 epoch: 52, train_loss: 0.7876, test_loss: 0.9791, test_f1: 0.5335
 epoch: 53, train_loss: 0.7889, test_loss: 0.9664, test_f1: 0.5276
 epoch: 54, train_loss: 0.7792, test_loss: 0.9976, test_f1: 0.5462
 epoch: 55, train_loss: 0.7812, test_loss: 0.9773, test_f1: 0.5432
 epoch: 56, train_loss: 0.7740, test_loss: 0.9962, test_f1: 0.5159
 epoch: 57, train_loss: 0.7623, test_loss: 0.9931, test_f1: 0.5207
 epoch: 58, train_loss: 0.7676, test_loss: 0.9947, test_f1: 0.5285
 epoch: 59, train_loss: 0.7594, test_loss: 0.9772, test_f1: 0.5540
 epoch: 60, train_loss: 0.7554, test_loss: 0.9780, test_f1: 0.5421
 epoch: 61, train_loss: 0.7629, test_loss: 0.9747, test_f1: 0.5427
 epoch: 62, train_loss: 0.7587, test_loss: 0.9848, test_f1: 0.5371
 epoch: 63, train_loss: 0.7466, test_loss: 0.9878, test_f1: 0.5630
 epoch: 64, train_loss: 0.7603, test_loss: 0.9993, test_f1: 0.5455
 epoch: 65, train_loss: 0.7367, test_loss: 0.9905, test_f1: 0.5406
 epoch: 66, train_loss: 0.7464, test_loss: 0.9853, test_f1: 0.5547
 epoch: 67, train_loss: 0.7421, test_loss: 0.9982, test_f1: 0.5335
 epoch: 68, train_loss: 0.7368, test_loss: 0.9985, test_f1: 0.5528
 epoch: 69, train_loss: 0.7495, test_loss: 0.9974, test_f1: 0.5463
 epoch: 70, train_loss: 0.7357, test_loss: 0.9940, test_f1: 0.5398
 epoch: 71, train_loss: 0.7401, test_loss: 0.9845, test_f1: 0.5520
 epoch: 72, train_loss: 0.7289, test_loss: 1.0130, test_f1: 0.5606
 epoch: 73, train_loss: 0.7296, test_loss: 0.9798, test_f1: 0.5492
 epoch: 74, train_loss: 0.7381, test_loss: 0.9819, test_f1: 0.5629
 epoch: 75, train_loss: 0.7221, test_loss: 0.9954, test_f1: 0.5526
 epoch: 76, train_loss: 0.7365, test_loss: 0.9745, test_f1: 0.5626
 epoch: 77, train_loss: 0.7216, test_loss: 1.0004, test_f1: 0.5481
 epoch: 78, train_loss: 0.7201, test_loss: 1.0183, test_f1: 0.5534
 epoch: 79, train_loss: 0.7281, test_loss: 1.0151, test_f1: 0.5577
 epoch: 80, train_loss: 0.7180, test_loss: 1.0382, test_f1: 0.5383
 epoch: 81, train_loss: 0.7170, test_loss: 0.9928, test_f1: 0.5562
 epoch: 82, train_loss: 0.7148, test_loss: 1.0422, test_f1: 0.5367
 epoch: 83, train_loss: 0.7202, test_loss: 1.0246, test_f1: 0.5535
 epoch: 84, train_loss: 0.7165, test_loss: 1.0548, test_f1: 0.5509
 epoch: 85, train_loss: 0.7124, test_loss: 1.0335, test_f1: 0.5487
 epoch: 86, train_loss: 0.7154, test_loss: 1.0320, test_f1: 0.5474
 epoch: 87, train_loss: 0.7036, test_loss: 1.0294, test_f1: 0.5448
 epoch: 88, train_loss: 0.7189, test_loss: 1.0437, test_f1: 0.5452
 epoch: 89, train_loss: 0.7067, test_loss: 1.0120, test_f1: 0.5512
 epoch: 90, train_loss: 0.6980, test_loss: 1.0489, test_f1: 0.5496
 epoch: 91, train_loss: 0.7054, test_loss: 1.0130, test_f1: 0.5498
 epoch: 92, train_loss: 0.6844, test_loss: 1.0361, test_f1: 0.5584
 epoch: 93, train_loss: 0.7028, test_loss: 1.0261, test_f1: 0.5425
 epoch: 94, train_loss: 0.6837, test_loss: 1.0208, test_f1: 0.5662
 epoch: 95, train_loss: 0.6828, test_loss: 1.0289, test_f1: 0.5610
 epoch: 96, train_loss: 0.6778, test_loss: 1.0095, test_f1: 0.5501
 epoch: 97, train_loss: 0.6881, test_loss: 1.0134, test_f1: 0.5520
 epoch: 98, train_loss: 0.6778, test_loss: 1.0300, test_f1: 0.5623
 epoch: 99, train_loss: 0.6817, test_loss: 1.0328, test_f1: 0.5487
##################ITERATION #8 ****************************************
 epoch: 0, train_loss: 1.3726, test_loss: 1.1825, test_f1: 0.4444
 epoch: 1, train_loss: 1.2047, test_loss: 1.1375, test_f1: 0.4266
 epoch: 2, train_loss: 1.1842, test_loss: 1.0896, test_f1: 0.4347
 epoch: 3, train_loss: 1.1588, test_loss: 1.0706, test_f1: 0.4440
 epoch: 4, train_loss: 1.1147, test_loss: 1.0524, test_f1: 0.4642
 epoch: 5, train_loss: 1.1057, test_loss: 1.0362, test_f1: 0.4588
 epoch: 6, train_loss: 1.0929, test_loss: 1.0456, test_f1: 0.4720
 epoch: 7, train_loss: 1.0717, test_loss: 1.0195, test_f1: 0.4457
 epoch: 8, train_loss: 1.0655, test_loss: 0.9998, test_f1: 0.4755
 epoch: 9, train_loss: 1.0332, test_loss: 1.0028, test_f1: 0.4794
 epoch: 10, train_loss: 1.0329, test_loss: 0.9866, test_f1: 0.4810
 epoch: 11, train_loss: 1.0197, test_loss: 0.9845, test_f1: 0.4823
 epoch: 12, train_loss: 1.0007, test_loss: 0.9772, test_f1: 0.4769
 epoch: 13, train_loss: 1.0043, test_loss: 0.9897, test_f1: 0.4591
 epoch: 14, train_loss: 0.9843, test_loss: 0.9926, test_f1: 0.4713
 epoch: 15, train_loss: 0.9947, test_loss: 0.9788, test_f1: 0.4594
 epoch: 16, train_loss: 0.9770, test_loss: 0.9812, test_f1: 0.4715
 epoch: 17, train_loss: 0.9646, test_loss: 0.9659, test_f1: 0.4792
 epoch: 18, train_loss: 0.9467, test_loss: 0.9862, test_f1: 0.4788
 epoch: 19, train_loss: 0.9478, test_loss: 0.9966, test_f1: 0.4766
 epoch: 20, train_loss: 0.9334, test_loss: 0.9824, test_f1: 0.5023
 epoch: 21, train_loss: 0.9397, test_loss: 0.9705, test_f1: 0.4872
 epoch: 22, train_loss: 0.9325, test_loss: 0.9971, test_f1: 0.4874
 epoch: 23, train_loss: 0.9367, test_loss: 0.9928, test_f1: 0.4842
 epoch: 24, train_loss: 0.9168, test_loss: 1.0166, test_f1: 0.4685
 epoch: 25, train_loss: 0.9057, test_loss: 1.0125, test_f1: 0.5010
 epoch: 26, train_loss: 0.9007, test_loss: 1.0015, test_f1: 0.4996
 epoch: 27, train_loss: 0.8928, test_loss: 1.0209, test_f1: 0.4864
 epoch: 28, train_loss: 0.8931, test_loss: 1.0419, test_f1: 0.4897
 epoch: 29, train_loss: 0.8795, test_loss: 1.0481, test_f1: 0.4898
 epoch: 30, train_loss: 0.8752, test_loss: 1.0307, test_f1: 0.4892
 epoch: 31, train_loss: 0.8623, test_loss: 1.0265, test_f1: 0.4986
 epoch: 32, train_loss: 0.8804, test_loss: 1.0215, test_f1: 0.5023
 epoch: 33, train_loss: 0.8598, test_loss: 1.0290, test_f1: 0.4952
 epoch: 34, train_loss: 0.8542, test_loss: 1.0409, test_f1: 0.5075
 epoch: 35, train_loss: 0.8532, test_loss: 1.0596, test_f1: 0.4898
 epoch: 36, train_loss: 0.8376, test_loss: 1.0512, test_f1: 0.4944
 epoch: 37, train_loss: 0.8384, test_loss: 0.9986, test_f1: 0.4960
 epoch: 38, train_loss: 0.8571, test_loss: 1.0399, test_f1: 0.4928
 epoch: 39, train_loss: 0.8304, test_loss: 1.0248, test_f1: 0.5055
 epoch: 40, train_loss: 0.8272, test_loss: 1.0213, test_f1: 0.4998
 epoch: 41, train_loss: 0.8184, test_loss: 1.0567, test_f1: 0.5007
 epoch: 42, train_loss: 0.8177, test_loss: 1.0197, test_f1: 0.5199
 epoch: 43, train_loss: 0.8116, test_loss: 1.0740, test_f1: 0.5125
 epoch: 44, train_loss: 0.8027, test_loss: 1.0873, test_f1: 0.5039
 epoch: 45, train_loss: 0.8109, test_loss: 1.0807, test_f1: 0.5052
 epoch: 46, train_loss: 0.8034, test_loss: 1.0399, test_f1: 0.5257
 epoch: 47, train_loss: 0.7907, test_loss: 1.0623, test_f1: 0.5104
 epoch: 48, train_loss: 0.7858, test_loss: 1.0315, test_f1: 0.5241
 epoch: 49, train_loss: 0.7856, test_loss: 1.0562, test_f1: 0.5324
 epoch: 50, train_loss: 0.7833, test_loss: 1.0978, test_f1: 0.4982
 epoch: 51, train_loss: 0.7704, test_loss: 1.1167, test_f1: 0.5142
 epoch: 52, train_loss: 0.7568, test_loss: 1.1043, test_f1: 0.5153
 epoch: 53, train_loss: 0.7480, test_loss: 1.1168, test_f1: 0.5138
 epoch: 54, train_loss: 0.7455, test_loss: 1.0863, test_f1: 0.5046
 epoch: 55, train_loss: 0.7568, test_loss: 1.1132, test_f1: 0.5123
 epoch: 56, train_loss: 0.7448, test_loss: 1.1144, test_f1: 0.5173
 epoch: 57, train_loss: 0.7431, test_loss: 1.0964, test_f1: 0.5180
 epoch: 58, train_loss: 0.7473, test_loss: 1.1277, test_f1: 0.5028
 epoch: 59, train_loss: 0.7444, test_loss: 1.0979, test_f1: 0.5246
 epoch: 60, train_loss: 0.7321, test_loss: 1.1457, test_f1: 0.5148
 epoch: 61, train_loss: 0.7278, test_loss: 1.0834, test_f1: 0.5324
 epoch: 62, train_loss: 0.7395, test_loss: 1.1356, test_f1: 0.5239
 epoch: 63, train_loss: 0.7132, test_loss: 1.1328, test_f1: 0.5156
 epoch: 64, train_loss: 0.7436, test_loss: 1.1160, test_f1: 0.5182
 epoch: 65, train_loss: 0.7282, test_loss: 1.1599, test_f1: 0.5115
 epoch: 66, train_loss: 0.7118, test_loss: 1.1570, test_f1: 0.5144
 epoch: 67, train_loss: 0.7230, test_loss: 1.1593, test_f1: 0.5058
 epoch: 68, train_loss: 0.7141, test_loss: 1.1907, test_f1: 0.5015
 epoch: 69, train_loss: 0.7202, test_loss: 1.1666, test_f1: 0.5294
 epoch: 70, train_loss: 0.7083, test_loss: 1.1755, test_f1: 0.4956
 epoch: 71, train_loss: 0.7015, test_loss: 1.1522, test_f1: 0.5180
 epoch: 72, train_loss: 0.7258, test_loss: 1.1636, test_f1: 0.5084
 epoch: 73, train_loss: 0.7078, test_loss: 1.1908, test_f1: 0.5013
 epoch: 74, train_loss: 0.7119, test_loss: 1.1997, test_f1: 0.5020
 epoch: 75, train_loss: 0.7052, test_loss: 1.1514, test_f1: 0.5290
 epoch: 76, train_loss: 0.6866, test_loss: 1.1511, test_f1: 0.5139
 epoch: 77, train_loss: 0.6923, test_loss: 1.1416, test_f1: 0.5148
 epoch: 78, train_loss: 0.6853, test_loss: 1.1503, test_f1: 0.5163
 epoch: 79, train_loss: 0.6962, test_loss: 1.1539, test_f1: 0.5040
 epoch: 80, train_loss: 0.6856, test_loss: 1.1453, test_f1: 0.5020
 epoch: 81, train_loss: 0.6939, test_loss: 1.1670, test_f1: 0.5128
 epoch: 82, train_loss: 0.7073, test_loss: 1.1527, test_f1: 0.5084
 epoch: 83, train_loss: 0.6950, test_loss: 1.1773, test_f1: 0.5206
 epoch: 84, train_loss: 0.6877, test_loss: 1.1897, test_f1: 0.5079
 epoch: 85, train_loss: 0.7009, test_loss: 1.1981, test_f1: 0.5097
 epoch: 86, train_loss: 0.6750, test_loss: 1.2106, test_f1: 0.5021
 epoch: 87, train_loss: 0.6859, test_loss: 1.1977, test_f1: 0.4977
 epoch: 88, train_loss: 0.6709, test_loss: 1.1299, test_f1: 0.5092
 epoch: 89, train_loss: 0.6663, test_loss: 1.1700, test_f1: 0.5233
 epoch: 90, train_loss: 0.6934, test_loss: 1.2371, test_f1: 0.5191
 epoch: 91, train_loss: 0.6604, test_loss: 1.2243, test_f1: 0.5104
 epoch: 92, train_loss: 0.6658, test_loss: 1.1838, test_f1: 0.5237
 epoch: 93, train_loss: 0.6717, test_loss: 1.2395, test_f1: 0.5233
 epoch: 94, train_loss: 0.6716, test_loss: 1.2885, test_f1: 0.5053
 epoch: 95, train_loss: 0.6761, test_loss: 1.2627, test_f1: 0.5244
 epoch: 96, train_loss: 0.6550, test_loss: 1.2725, test_f1: 0.5220
 epoch: 97, train_loss: 0.6554, test_loss: 1.2665, test_f1: 0.5165
 epoch: 98, train_loss: 0.6593, test_loss: 1.2193, test_f1: 0.5319
 epoch: 99, train_loss: 0.6594, test_loss: 1.3058, test_f1: 0.5167
##################ITERATION #9 ****************************************
 epoch: 0, train_loss: 1.3407, test_loss: 1.1394, test_f1: 0.4142
 epoch: 1, train_loss: 1.2133, test_loss: 1.0846, test_f1: 0.4321
 epoch: 2, train_loss: 1.1771, test_loss: 1.0586, test_f1: 0.4666
 epoch: 3, train_loss: 1.1451, test_loss: 1.0443, test_f1: 0.4819
 epoch: 4, train_loss: 1.1178, test_loss: 1.0306, test_f1: 0.4834
 epoch: 5, train_loss: 1.0962, test_loss: 1.0236, test_f1: 0.4873
 epoch: 6, train_loss: 1.0884, test_loss: 1.0095, test_f1: 0.4884
 epoch: 7, train_loss: 1.0629, test_loss: 0.9955, test_f1: 0.5007
 epoch: 8, train_loss: 1.0477, test_loss: 0.9901, test_f1: 0.4693
 epoch: 9, train_loss: 1.0298, test_loss: 0.9799, test_f1: 0.4802
 epoch: 10, train_loss: 1.0315, test_loss: 0.9669, test_f1: 0.4914
 epoch: 11, train_loss: 1.0140, test_loss: 0.9617, test_f1: 0.4594
 epoch: 12, train_loss: 0.9997, test_loss: 0.9525, test_f1: 0.4987
 epoch: 13, train_loss: 0.9984, test_loss: 0.9890, test_f1: 0.4690
 epoch: 14, train_loss: 0.9890, test_loss: 0.9728, test_f1: 0.4670
 epoch: 15, train_loss: 0.9816, test_loss: 0.9594, test_f1: 0.5091
 epoch: 16, train_loss: 0.9648, test_loss: 0.9483, test_f1: 0.4755
 epoch: 17, train_loss: 0.9621, test_loss: 0.9816, test_f1: 0.4788
 epoch: 18, train_loss: 0.9583, test_loss: 1.0166, test_f1: 0.4635
 epoch: 19, train_loss: 0.9425, test_loss: 0.9703, test_f1: 0.5093
 epoch: 20, train_loss: 0.9400, test_loss: 0.9582, test_f1: 0.4850
 epoch: 21, train_loss: 0.9266, test_loss: 0.9747, test_f1: 0.4951
 epoch: 22, train_loss: 0.9183, test_loss: 0.9601, test_f1: 0.4872
 epoch: 23, train_loss: 0.9323, test_loss: 0.9213, test_f1: 0.5063
 epoch: 24, train_loss: 0.9170, test_loss: 0.9576, test_f1: 0.4868
 epoch: 25, train_loss: 0.9062, test_loss: 0.9732, test_f1: 0.5133
 epoch: 26, train_loss: 0.8917, test_loss: 0.9811, test_f1: 0.4928
 epoch: 27, train_loss: 0.8878, test_loss: 0.9848, test_f1: 0.4979
 epoch: 28, train_loss: 0.8820, test_loss: 0.9668, test_f1: 0.5020
 epoch: 29, train_loss: 0.8789, test_loss: 0.9669, test_f1: 0.5198
 epoch: 30, train_loss: 0.8739, test_loss: 0.9677, test_f1: 0.5027
 epoch: 31, train_loss: 0.8793, test_loss: 0.9915, test_f1: 0.5224
 epoch: 32, train_loss: 0.8730, test_loss: 0.9952, test_f1: 0.5002
 epoch: 33, train_loss: 0.8686, test_loss: 0.9872, test_f1: 0.4890
 epoch: 34, train_loss: 0.8590, test_loss: 0.9917, test_f1: 0.5145
 epoch: 35, train_loss: 0.8538, test_loss: 0.9926, test_f1: 0.4850
 epoch: 36, train_loss: 0.8590, test_loss: 0.9823, test_f1: 0.5077
 epoch: 37, train_loss: 0.8524, test_loss: 0.9985, test_f1: 0.4815
 epoch: 38, train_loss: 0.8345, test_loss: 1.0012, test_f1: 0.4842
 epoch: 39, train_loss: 0.8291, test_loss: 1.0700, test_f1: 0.4896
 epoch: 40, train_loss: 0.8360, test_loss: 1.0464, test_f1: 0.4838
 epoch: 41, train_loss: 0.8307, test_loss: 0.9986, test_f1: 0.5104
 epoch: 42, train_loss: 0.8319, test_loss: 0.9850, test_f1: 0.4933
 epoch: 43, train_loss: 0.8277, test_loss: 0.9561, test_f1: 0.5204
 epoch: 44, train_loss: 0.8216, test_loss: 1.0113, test_f1: 0.4911
 epoch: 45, train_loss: 0.8050, test_loss: 0.9890, test_f1: 0.5025
 epoch: 46, train_loss: 0.8078, test_loss: 0.9975, test_f1: 0.5415
 epoch: 47, train_loss: 0.8168, test_loss: 1.0081, test_f1: 0.5179
 epoch: 48, train_loss: 0.7979, test_loss: 1.0355, test_f1: 0.5077
 epoch: 49, train_loss: 0.8003, test_loss: 1.0016, test_f1: 0.5320
 epoch: 50, train_loss: 0.7841, test_loss: 1.0859, test_f1: 0.5157
 epoch: 51, train_loss: 0.7743, test_loss: 1.0570, test_f1: 0.5064
 epoch: 52, train_loss: 0.7701, test_loss: 1.0608, test_f1: 0.5114
 epoch: 53, train_loss: 0.7733, test_loss: 1.0558, test_f1: 0.5074
 epoch: 54, train_loss: 0.7537, test_loss: 1.0281, test_f1: 0.5164
 epoch: 55, train_loss: 0.7587, test_loss: 1.0355, test_f1: 0.5107
 epoch: 56, train_loss: 0.7408, test_loss: 1.0695, test_f1: 0.5009
 epoch: 57, train_loss: 0.7704, test_loss: 1.0809, test_f1: 0.5013
 epoch: 58, train_loss: 0.7513, test_loss: 1.0677, test_f1: 0.4840
 epoch: 59, train_loss: 0.7610, test_loss: 1.0726, test_f1: 0.4958
 epoch: 60, train_loss: 0.7468, test_loss: 1.1187, test_f1: 0.5026
 epoch: 61, train_loss: 0.7477, test_loss: 1.0512, test_f1: 0.4963
 epoch: 62, train_loss: 0.7427, test_loss: 1.0539, test_f1: 0.5005
 epoch: 63, train_loss: 0.7370, test_loss: 1.1168, test_f1: 0.4984
 epoch: 64, train_loss: 0.7348, test_loss: 1.0726, test_f1: 0.5249
 epoch: 65, train_loss: 0.7491, test_loss: 1.0732, test_f1: 0.5004
 epoch: 66, train_loss: 0.7303, test_loss: 1.0434, test_f1: 0.5187
 epoch: 67, train_loss: 0.7324, test_loss: 1.0716, test_f1: 0.4930
 epoch: 68, train_loss: 0.7188, test_loss: 1.0270, test_f1: 0.5203
 epoch: 69, train_loss: 0.7346, test_loss: 1.0729, test_f1: 0.5065
 epoch: 70, train_loss: 0.7343, test_loss: 1.1385, test_f1: 0.5143
 epoch: 71, train_loss: 0.7205, test_loss: 1.0832, test_f1: 0.5294
 epoch: 72, train_loss: 0.7224, test_loss: 1.1009, test_f1: 0.5126
 epoch: 73, train_loss: 0.7249, test_loss: 1.0319, test_f1: 0.5432
 epoch: 74, train_loss: 0.7147, test_loss: 1.0137, test_f1: 0.5194
 epoch: 75, train_loss: 0.7324, test_loss: 1.0802, test_f1: 0.5140
 epoch: 76, train_loss: 0.7121, test_loss: 1.0819, test_f1: 0.5153
 epoch: 77, train_loss: 0.7174, test_loss: 1.1154, test_f1: 0.5192
 epoch: 78, train_loss: 0.7137, test_loss: 1.1801, test_f1: 0.5065
 epoch: 79, train_loss: 0.6977, test_loss: 1.1160, test_f1: 0.5162
 epoch: 80, train_loss: 0.7002, test_loss: 1.1008, test_f1: 0.5234
 epoch: 81, train_loss: 0.7037, test_loss: 1.1339, test_f1: 0.5292
 epoch: 82, train_loss: 0.7048, test_loss: 1.0724, test_f1: 0.5411
 epoch: 83, train_loss: 0.6884, test_loss: 1.0908, test_f1: 0.5177
 epoch: 84, train_loss: 0.6973, test_loss: 1.1355, test_f1: 0.5208
 epoch: 85, train_loss: 0.7041, test_loss: 1.1187, test_f1: 0.5248
 epoch: 86, train_loss: 0.6715, test_loss: 1.2027, test_f1: 0.5293
 epoch: 87, train_loss: 0.6993, test_loss: 1.1198, test_f1: 0.5152
 epoch: 88, train_loss: 0.6958, test_loss: 1.1092, test_f1: 0.5117
 epoch: 89, train_loss: 0.6865, test_loss: 1.1035, test_f1: 0.5209
 epoch: 90, train_loss: 0.6948, test_loss: 1.0673, test_f1: 0.5508
 epoch: 91, train_loss: 0.6992, test_loss: 1.1127, test_f1: 0.5046
 epoch: 92, train_loss: 0.6886, test_loss: 1.0744, test_f1: 0.5290
 epoch: 93, train_loss: 0.6721, test_loss: 1.1089, test_f1: 0.5440
 epoch: 94, train_loss: 0.6770, test_loss: 1.0633, test_f1: 0.5536
 epoch: 95, train_loss: 0.6756, test_loss: 1.1576, test_f1: 0.5164
 epoch: 96, train_loss: 0.6722, test_loss: 1.1324, test_f1: 0.4994
 epoch: 97, train_loss: 0.6729, test_loss: 1.1287, test_f1: 0.5222
 epoch: 98, train_loss: 0.6742, test_loss: 1.1451, test_f1: 0.5043
 epoch: 99, train_loss: 0.6682, test_loss: 1.1268, test_f1: 0.5336

Training completed in 793.96 seconds
Best F1: 0.5662 at epoch 94
Mean F1 across iterations: 0.5496  0.0095
========================FINAL RESULTS================================
FEGIN weighted F1: 0.5662  0.0095
python main.py --data ltspice_examples --representation component_component --model FEGIN --layers 2 --hiddens 128 --batch_size 32 --lr 0.0001 --emb_size 250 --epochs 100 --save_appendix component_component_L2_H128_BS32_LR0.0001_E250 --no_val
-----



STDERR:
  File "main.py", line 370, in <module>
    main()
  File "main.py", line 254, in main
    dataset = dataset_class(
  File "/home/philip/projects/ltspice_examples_code_repo/Circuit-Completion-Using-GNNs/component_classification_with_link_prediction_head/evaluation/FEGIN/kernel/circuit_datasets.py", line 15, in __init__
    self.data, self.slices = torch.load(self.processed_paths[0])
  File "/home/philip/.local/lib/python3.8/site-packages/torch/serialization.py", line 1040, in load
    warnings.warn(
  File "/usr/lib/python3.8/warnings.py", line 109, in _showwarnmsg
    sw(msg.message, msg.category, msg.filename, msg.lineno,
  File "main.py", line 47, in warn_with_traceback
    traceback.print_stack(file=log)
/home/philip/projects/ltspice_examples_code_repo/Circuit-Completion-Using-GNNs/component_classification_with_link_prediction_head/evaluation/FEGIN/kernel/circuit_datasets.py:15: FutureWarning: You are using `torch.load` with `weights_only=False` (the current default value), which uses the default pickle module implicitly. It is possible to construct malicious pickle data which will execute arbitrary code during unpickling (See https://github.com/pytorch/pytorch/blob/main/SECURITY.md#untrusted-models for more details). In a future release, the default value for `weights_only` will be flipped to `True`. This limits the functions that could be executed during unpickling. Arbitrary objects will no longer be allowed to be loaded via this mode unless they are explicitly allowlisted by the user via `torch.serialization.add_safe_globals`. We recommend you start setting `weights_only=True` for any use case where you don't have full control of the loaded file. Please open an issue on GitHub for any issues related to this experimental feature.
  self.data, self.slices = torch.load(self.processed_paths[0])
