STDOUT:
Results will be saved in /home/philip/projects/ltspice_examples_code_repo/Circuit-Completion-Using-GNNs/component_classification_with_link_prediction_head/evaluation/FEGIN/results/model_FEGIN_dataset_ltspice_demos
Command line input: python main.py --data ltspice_demos --representation component_component --model FEGIN --layers 2 --hiddens 64 --batch_size 64 --lr 0.0001 --emb_size 128 --epochs 100 --save_appendix component_component_L2_H64_BS64_LR0.0001_E128 --no_val
 is saved.
-----
ltspice_demos - FEGIN
Using 2 layers, 64 hidden units, h = 2
Loading component_component representation dataset
ENTERED
Training FEGIN on component_component representation
Train: 1565, Test: 383
##################ITERATION #0 ****************************************
 epoch: 0, train_loss: 1.4045, test_loss: 1.3969, test_f1: 0.0457
 epoch: 1, train_loss: 1.3904, test_loss: 1.3866, test_f1: 0.1077
 epoch: 2, train_loss: 1.3808, test_loss: 1.3766, test_f1: 0.2681
 epoch: 3, train_loss: 1.3696, test_loss: 1.3659, test_f1: 0.2331
 epoch: 4, train_loss: 1.3538, test_loss: 1.3545, test_f1: 0.2281
 epoch: 5, train_loss: 1.3373, test_loss: 1.3416, test_f1: 0.2614
 epoch: 6, train_loss: 1.3159, test_loss: 1.3276, test_f1: 0.2587
 epoch: 7, train_loss: 1.2920, test_loss: 1.3126, test_f1: 0.2594
 epoch: 8, train_loss: 1.2685, test_loss: 1.3008, test_f1: 0.2634
 epoch: 9, train_loss: 1.2460, test_loss: 1.2915, test_f1: 0.2600
 epoch: 10, train_loss: 1.2250, test_loss: 1.2853, test_f1: 0.2618
 epoch: 11, train_loss: 1.2078, test_loss: 1.2795, test_f1: 0.2597
 epoch: 12, train_loss: 1.1962, test_loss: 1.2790, test_f1: 0.2643
 epoch: 13, train_loss: 1.1859, test_loss: 1.2802, test_f1: 0.2599
 epoch: 14, train_loss: 1.1736, test_loss: 1.2731, test_f1: 0.2619
 epoch: 15, train_loss: 1.1628, test_loss: 1.2751, test_f1: 0.2747
 epoch: 16, train_loss: 1.1569, test_loss: 1.2750, test_f1: 0.3386
 epoch: 17, train_loss: 1.1499, test_loss: 1.2777, test_f1: 0.3263
 epoch: 18, train_loss: 1.1468, test_loss: 1.2680, test_f1: 0.3741
 epoch: 19, train_loss: 1.1423, test_loss: 1.2681, test_f1: 0.4035
 epoch: 20, train_loss: 1.1255, test_loss: 1.2703, test_f1: 0.4092
 epoch: 21, train_loss: 1.1256, test_loss: 1.2659, test_f1: 0.4001
 epoch: 22, train_loss: 1.1148, test_loss: 1.2632, test_f1: 0.3956
 epoch: 23, train_loss: 1.1073, test_loss: 1.2455, test_f1: 0.3888
 epoch: 24, train_loss: 1.1026, test_loss: 1.2418, test_f1: 0.3885
 epoch: 25, train_loss: 1.0888, test_loss: 1.2383, test_f1: 0.3843
 epoch: 26, train_loss: 1.0772, test_loss: 1.2320, test_f1: 0.3863
 epoch: 27, train_loss: 1.0744, test_loss: 1.2302, test_f1: 0.3930
 epoch: 28, train_loss: 1.0629, test_loss: 1.2212, test_f1: 0.3952
 epoch: 29, train_loss: 1.0564, test_loss: 1.2325, test_f1: 0.4207
 epoch: 30, train_loss: 1.0516, test_loss: 1.2277, test_f1: 0.4033
 epoch: 31, train_loss: 1.0359, test_loss: 1.2288, test_f1: 0.4263
 epoch: 32, train_loss: 1.0259, test_loss: 1.2278, test_f1: 0.4328
 epoch: 33, train_loss: 1.0246, test_loss: 1.2218, test_f1: 0.4238
 epoch: 34, train_loss: 1.0091, test_loss: 1.2352, test_f1: 0.4248
 epoch: 35, train_loss: 1.0062, test_loss: 1.2213, test_f1: 0.4239
 epoch: 36, train_loss: 0.9970, test_loss: 1.2188, test_f1: 0.4283
 epoch: 37, train_loss: 0.9994, test_loss: 1.2321, test_f1: 0.4345
 epoch: 38, train_loss: 1.0004, test_loss: 1.2291, test_f1: 0.4358
 epoch: 39, train_loss: 0.9891, test_loss: 1.2312, test_f1: 0.4356
 epoch: 40, train_loss: 0.9811, test_loss: 1.2363, test_f1: 0.4274
 epoch: 41, train_loss: 0.9675, test_loss: 1.2464, test_f1: 0.4324
 epoch: 42, train_loss: 0.9796, test_loss: 1.2481, test_f1: 0.4430
 epoch: 43, train_loss: 0.9740, test_loss: 1.2608, test_f1: 0.4465
 epoch: 44, train_loss: 0.9640, test_loss: 1.2641, test_f1: 0.4460
 epoch: 45, train_loss: 0.9620, test_loss: 1.2779, test_f1: 0.4533
 epoch: 46, train_loss: 0.9601, test_loss: 1.2810, test_f1: 0.4576
 epoch: 47, train_loss: 0.9464, test_loss: 1.2805, test_f1: 0.4688
 epoch: 48, train_loss: 0.9454, test_loss: 1.3033, test_f1: 0.4397
 epoch: 49, train_loss: 0.9559, test_loss: 1.3099, test_f1: 0.4770
 epoch: 50, train_loss: 0.9362, test_loss: 1.2912, test_f1: 0.4562
 epoch: 51, train_loss: 0.9195, test_loss: 1.3148, test_f1: 0.4738
 epoch: 52, train_loss: 0.9268, test_loss: 1.3245, test_f1: 0.4668
 epoch: 53, train_loss: 0.9196, test_loss: 1.3235, test_f1: 0.4791
 epoch: 54, train_loss: 0.9180, test_loss: 1.3150, test_f1: 0.4658
 epoch: 55, train_loss: 0.9230, test_loss: 1.3246, test_f1: 0.4832
 epoch: 56, train_loss: 0.9180, test_loss: 1.3192, test_f1: 0.4761
 epoch: 57, train_loss: 0.9111, test_loss: 1.3196, test_f1: 0.4824
 epoch: 58, train_loss: 0.9175, test_loss: 1.3271, test_f1: 0.4892
 epoch: 59, train_loss: 0.9180, test_loss: 1.3285, test_f1: 0.4750
 epoch: 60, train_loss: 0.9100, test_loss: 1.3358, test_f1: 0.4857
 epoch: 61, train_loss: 0.9012, test_loss: 1.3425, test_f1: 0.5080
 epoch: 62, train_loss: 0.9070, test_loss: 1.3349, test_f1: 0.4930
 epoch: 63, train_loss: 0.9055, test_loss: 1.3402, test_f1: 0.5021
 epoch: 64, train_loss: 0.9010, test_loss: 1.3476, test_f1: 0.4772
 epoch: 65, train_loss: 0.9061, test_loss: 1.3597, test_f1: 0.4967
 epoch: 66, train_loss: 0.8944, test_loss: 1.3540, test_f1: 0.5149
 epoch: 67, train_loss: 0.8974, test_loss: 1.3633, test_f1: 0.5064
 epoch: 68, train_loss: 0.8995, test_loss: 1.3710, test_f1: 0.5115
 epoch: 69, train_loss: 0.8914, test_loss: 1.3608, test_f1: 0.5242
 epoch: 70, train_loss: 0.8947, test_loss: 1.3700, test_f1: 0.5268
 epoch: 71, train_loss: 0.8902, test_loss: 1.3638, test_f1: 0.5186
 epoch: 72, train_loss: 0.8791, test_loss: 1.3879, test_f1: 0.5203
 epoch: 73, train_loss: 0.8927, test_loss: 1.4210, test_f1: 0.5324
 epoch: 74, train_loss: 0.8921, test_loss: 1.4173, test_f1: 0.5271
 epoch: 75, train_loss: 0.8835, test_loss: 1.4175, test_f1: 0.5263
 epoch: 76, train_loss: 0.8828, test_loss: 1.4124, test_f1: 0.5057
 epoch: 77, train_loss: 0.8847, test_loss: 1.3955, test_f1: 0.5151
 epoch: 78, train_loss: 0.8825, test_loss: 1.4273, test_f1: 0.5235
 epoch: 79, train_loss: 0.8714, test_loss: 1.4483, test_f1: 0.5293
 epoch: 80, train_loss: 0.8731, test_loss: 1.4222, test_f1: 0.5371
 epoch: 81, train_loss: 0.8613, test_loss: 1.4157, test_f1: 0.5371
 epoch: 82, train_loss: 0.8642, test_loss: 1.4187, test_f1: 0.5423
 epoch: 83, train_loss: 0.8720, test_loss: 1.4248, test_f1: 0.5174
 epoch: 84, train_loss: 0.8581, test_loss: 1.4539, test_f1: 0.5428
 epoch: 85, train_loss: 0.8625, test_loss: 1.4739, test_f1: 0.5379
 epoch: 86, train_loss: 0.8547, test_loss: 1.4476, test_f1: 0.5285
 epoch: 87, train_loss: 0.8585, test_loss: 1.4651, test_f1: 0.5299
 epoch: 88, train_loss: 0.8568, test_loss: 1.4655, test_f1: 0.5311
 epoch: 89, train_loss: 0.8571, test_loss: 1.4298, test_f1: 0.5367
 epoch: 90, train_loss: 0.8630, test_loss: 1.4340, test_f1: 0.5460
 epoch: 91, train_loss: 0.8585, test_loss: 1.4560, test_f1: 0.5459
 epoch: 92, train_loss: 0.8450, test_loss: 1.4590, test_f1: 0.5435
 epoch: 93, train_loss: 0.8455, test_loss: 1.4899, test_f1: 0.5488
 epoch: 94, train_loss: 0.8438, test_loss: 1.4748, test_f1: 0.5482
 epoch: 95, train_loss: 0.8510, test_loss: 1.4817, test_f1: 0.5505
 epoch: 96, train_loss: 0.8447, test_loss: 1.4692, test_f1: 0.5389
 epoch: 97, train_loss: 0.8266, test_loss: 1.5014, test_f1: 0.5484
 epoch: 98, train_loss: 0.8346, test_loss: 1.5157, test_f1: 0.5487
 epoch: 99, train_loss: 0.8414, test_loss: 1.5280, test_f1: 0.5372
##################ITERATION #1 ****************************************
 epoch: 0, train_loss: 1.3773, test_loss: 1.3754, test_f1: 0.2112
 epoch: 1, train_loss: 1.3333, test_loss: 1.3531, test_f1: 0.2336
 epoch: 2, train_loss: 1.3025, test_loss: 1.3333, test_f1: 0.2281
 epoch: 3, train_loss: 1.2792, test_loss: 1.3142, test_f1: 0.2289
 epoch: 4, train_loss: 1.2550, test_loss: 1.3044, test_f1: 0.2281
 epoch: 5, train_loss: 1.2353, test_loss: 1.2914, test_f1: 0.2281
 epoch: 6, train_loss: 1.2196, test_loss: 1.2870, test_f1: 0.2285
 epoch: 7, train_loss: 1.2028, test_loss: 1.2787, test_f1: 0.2653
 epoch: 8, train_loss: 1.1967, test_loss: 1.2695, test_f1: 0.2976
 epoch: 9, train_loss: 1.1766, test_loss: 1.2609, test_f1: 0.3072
 epoch: 10, train_loss: 1.1714, test_loss: 1.2512, test_f1: 0.3692
 epoch: 11, train_loss: 1.1512, test_loss: 1.2469, test_f1: 0.3637
 epoch: 12, train_loss: 1.1464, test_loss: 1.2440, test_f1: 0.3996
 epoch: 13, train_loss: 1.1299, test_loss: 1.2362, test_f1: 0.3946
 epoch: 14, train_loss: 1.1214, test_loss: 1.2225, test_f1: 0.4248
 epoch: 15, train_loss: 1.1108, test_loss: 1.2170, test_f1: 0.4001
 epoch: 16, train_loss: 1.1083, test_loss: 1.2235, test_f1: 0.4412
 epoch: 17, train_loss: 1.0925, test_loss: 1.2013, test_f1: 0.4422
 epoch: 18, train_loss: 1.0825, test_loss: 1.2015, test_f1: 0.4354
 epoch: 19, train_loss: 1.0753, test_loss: 1.1905, test_f1: 0.4395
 epoch: 20, train_loss: 1.0616, test_loss: 1.1730, test_f1: 0.4446
 epoch: 21, train_loss: 1.0448, test_loss: 1.1715, test_f1: 0.4482
 epoch: 22, train_loss: 1.0403, test_loss: 1.1661, test_f1: 0.4522
 epoch: 23, train_loss: 1.0275, test_loss: 1.1598, test_f1: 0.4450
 epoch: 24, train_loss: 1.0282, test_loss: 1.1603, test_f1: 0.4398
 epoch: 25, train_loss: 1.0141, test_loss: 1.1473, test_f1: 0.4383
 epoch: 26, train_loss: 1.0097, test_loss: 1.1487, test_f1: 0.4446
 epoch: 27, train_loss: 1.0049, test_loss: 1.1482, test_f1: 0.4731
 epoch: 28, train_loss: 0.9952, test_loss: 1.1480, test_f1: 0.4798
 epoch: 29, train_loss: 0.9754, test_loss: 1.1452, test_f1: 0.4971
 epoch: 30, train_loss: 0.9722, test_loss: 1.1457, test_f1: 0.4970
 epoch: 31, train_loss: 0.9648, test_loss: 1.1468, test_f1: 0.5064
 epoch: 32, train_loss: 0.9649, test_loss: 1.1558, test_f1: 0.5026
 epoch: 33, train_loss: 0.9575, test_loss: 1.1532, test_f1: 0.5234
 epoch: 34, train_loss: 0.9535, test_loss: 1.1373, test_f1: 0.5146
 epoch: 35, train_loss: 0.9527, test_loss: 1.1448, test_f1: 0.5334
 epoch: 36, train_loss: 0.9378, test_loss: 1.1471, test_f1: 0.5303
 epoch: 37, train_loss: 0.9277, test_loss: 1.1621, test_f1: 0.5382
 epoch: 38, train_loss: 0.9231, test_loss: 1.1438, test_f1: 0.5416
 epoch: 39, train_loss: 0.9202, test_loss: 1.1322, test_f1: 0.5540
 epoch: 40, train_loss: 0.9064, test_loss: 1.1232, test_f1: 0.5573
 epoch: 41, train_loss: 0.9036, test_loss: 1.1477, test_f1: 0.5615
 epoch: 42, train_loss: 0.8946, test_loss: 1.1382, test_f1: 0.5552
 epoch: 43, train_loss: 0.8921, test_loss: 1.1649, test_f1: 0.5246
 epoch: 44, train_loss: 0.9045, test_loss: 1.1470, test_f1: 0.5456
 epoch: 45, train_loss: 0.8817, test_loss: 1.1812, test_f1: 0.5153
 epoch: 46, train_loss: 0.8929, test_loss: 1.1791, test_f1: 0.5342
 epoch: 47, train_loss: 0.8811, test_loss: 1.1520, test_f1: 0.5535
 epoch: 48, train_loss: 0.8823, test_loss: 1.1623, test_f1: 0.5389
 epoch: 49, train_loss: 0.8674, test_loss: 1.1470, test_f1: 0.5752
 epoch: 50, train_loss: 0.8510, test_loss: 1.1214, test_f1: 0.5613
 epoch: 51, train_loss: 0.8583, test_loss: 1.1427, test_f1: 0.5581
 epoch: 52, train_loss: 0.8500, test_loss: 1.1529, test_f1: 0.5608
 epoch: 53, train_loss: 0.8582, test_loss: 1.1574, test_f1: 0.5592
 epoch: 54, train_loss: 0.8460, test_loss: 1.1489, test_f1: 0.5596
 epoch: 55, train_loss: 0.8586, test_loss: 1.1590, test_f1: 0.5684
 epoch: 56, train_loss: 0.8489, test_loss: 1.1555, test_f1: 0.5599
 epoch: 57, train_loss: 0.8394, test_loss: 1.1657, test_f1: 0.5636
 epoch: 58, train_loss: 0.8350, test_loss: 1.1742, test_f1: 0.5809
 epoch: 59, train_loss: 0.8468, test_loss: 1.1889, test_f1: 0.5559
 epoch: 60, train_loss: 0.8397, test_loss: 1.1755, test_f1: 0.5733
 epoch: 61, train_loss: 0.8327, test_loss: 1.1551, test_f1: 0.5363
 epoch: 62, train_loss: 0.8292, test_loss: 1.1644, test_f1: 0.5337
 epoch: 63, train_loss: 0.8215, test_loss: 1.1665, test_f1: 0.5564
 epoch: 64, train_loss: 0.8348, test_loss: 1.1689, test_f1: 0.5649
 epoch: 65, train_loss: 0.8172, test_loss: 1.1771, test_f1: 0.5363
 epoch: 66, train_loss: 0.8260, test_loss: 1.1791, test_f1: 0.5525
 epoch: 67, train_loss: 0.8256, test_loss: 1.1907, test_f1: 0.5648
 epoch: 68, train_loss: 0.8294, test_loss: 1.2065, test_f1: 0.5857
 epoch: 69, train_loss: 0.8120, test_loss: 1.2137, test_f1: 0.5517
 epoch: 70, train_loss: 0.8193, test_loss: 1.2070, test_f1: 0.5482
 epoch: 71, train_loss: 0.8194, test_loss: 1.2044, test_f1: 0.5604
 epoch: 72, train_loss: 0.8016, test_loss: 1.1912, test_f1: 0.5870
 epoch: 73, train_loss: 0.8208, test_loss: 1.2025, test_f1: 0.5519
 epoch: 74, train_loss: 0.8141, test_loss: 1.2100, test_f1: 0.5625
 epoch: 75, train_loss: 0.8039, test_loss: 1.2107, test_f1: 0.5569
 epoch: 76, train_loss: 0.8015, test_loss: 1.1929, test_f1: 0.5542
 epoch: 77, train_loss: 0.8005, test_loss: 1.1979, test_f1: 0.5607
 epoch: 78, train_loss: 0.8136, test_loss: 1.1961, test_f1: 0.5404
 epoch: 79, train_loss: 0.7964, test_loss: 1.2063, test_f1: 0.5624
 epoch: 80, train_loss: 0.8092, test_loss: 1.1920, test_f1: 0.5569
 epoch: 81, train_loss: 0.7967, test_loss: 1.2103, test_f1: 0.5551
 epoch: 82, train_loss: 0.7804, test_loss: 1.2114, test_f1: 0.5556
 epoch: 83, train_loss: 0.7853, test_loss: 1.2352, test_f1: 0.5678
 epoch: 84, train_loss: 0.7937, test_loss: 1.2237, test_f1: 0.5624
 epoch: 85, train_loss: 0.7909, test_loss: 1.2391, test_f1: 0.5630
 epoch: 86, train_loss: 0.7976, test_loss: 1.2363, test_f1: 0.5650
 epoch: 87, train_loss: 0.7748, test_loss: 1.2503, test_f1: 0.5572
 epoch: 88, train_loss: 0.8005, test_loss: 1.2449, test_f1: 0.5553
 epoch: 89, train_loss: 0.7877, test_loss: 1.2370, test_f1: 0.5686
 epoch: 90, train_loss: 0.7726, test_loss: 1.2508, test_f1: 0.5603
 epoch: 91, train_loss: 0.7820, test_loss: 1.2268, test_f1: 0.5674
 epoch: 92, train_loss: 0.7839, test_loss: 1.2418, test_f1: 0.5608
 epoch: 93, train_loss: 0.7894, test_loss: 1.2373, test_f1: 0.5558
 epoch: 94, train_loss: 0.7720, test_loss: 1.2475, test_f1: 0.5527
 epoch: 95, train_loss: 0.7586, test_loss: 1.2454, test_f1: 0.5604
 epoch: 96, train_loss: 0.7961, test_loss: 1.2463, test_f1: 0.5526
 epoch: 97, train_loss: 0.7690, test_loss: 1.2607, test_f1: 0.5582
 epoch: 98, train_loss: 0.7612, test_loss: 1.2808, test_f1: 0.5536
 epoch: 99, train_loss: 0.7648, test_loss: 1.2657, test_f1: 0.5631
##################ITERATION #2 ****************************************
 epoch: 0, train_loss: 1.3161, test_loss: 1.3601, test_f1: 0.2383
 epoch: 1, train_loss: 1.2782, test_loss: 1.3404, test_f1: 0.2867
 epoch: 2, train_loss: 1.2586, test_loss: 1.3255, test_f1: 0.3028
 epoch: 3, train_loss: 1.2411, test_loss: 1.3216, test_f1: 0.3155
 epoch: 4, train_loss: 1.2219, test_loss: 1.3173, test_f1: 0.3188
 epoch: 5, train_loss: 1.2098, test_loss: 1.2973, test_f1: 0.3351
 epoch: 6, train_loss: 1.1949, test_loss: 1.2882, test_f1: 0.3313
 epoch: 7, train_loss: 1.1803, test_loss: 1.2819, test_f1: 0.3561
 epoch: 8, train_loss: 1.1647, test_loss: 1.2744, test_f1: 0.3924
 epoch: 9, train_loss: 1.1562, test_loss: 1.2588, test_f1: 0.4276
 epoch: 10, train_loss: 1.1407, test_loss: 1.2500, test_f1: 0.4383
 epoch: 11, train_loss: 1.1308, test_loss: 1.2419, test_f1: 0.4472
 epoch: 12, train_loss: 1.1155, test_loss: 1.2329, test_f1: 0.4460
 epoch: 13, train_loss: 1.1072, test_loss: 1.2286, test_f1: 0.4556
 epoch: 14, train_loss: 1.0846, test_loss: 1.2220, test_f1: 0.4470
 epoch: 15, train_loss: 1.0744, test_loss: 1.2173, test_f1: 0.4442
 epoch: 16, train_loss: 1.0671, test_loss: 1.2121, test_f1: 0.4531
 epoch: 17, train_loss: 1.0592, test_loss: 1.2097, test_f1: 0.4464
 epoch: 18, train_loss: 1.0477, test_loss: 1.2106, test_f1: 0.4425
 epoch: 19, train_loss: 1.0487, test_loss: 1.2008, test_f1: 0.4837
 epoch: 20, train_loss: 1.0299, test_loss: 1.2012, test_f1: 0.4499
 epoch: 21, train_loss: 1.0242, test_loss: 1.1901, test_f1: 0.4503
 epoch: 22, train_loss: 1.0166, test_loss: 1.1974, test_f1: 0.4673
 epoch: 23, train_loss: 1.0122, test_loss: 1.2079, test_f1: 0.4740
 epoch: 24, train_loss: 1.0082, test_loss: 1.2088, test_f1: 0.4718
 epoch: 25, train_loss: 1.0074, test_loss: 1.2060, test_f1: 0.4960
 epoch: 26, train_loss: 1.0032, test_loss: 1.1999, test_f1: 0.4707
 epoch: 27, train_loss: 0.9866, test_loss: 1.1967, test_f1: 0.4810
 epoch: 28, train_loss: 0.9881, test_loss: 1.1900, test_f1: 0.4797
 epoch: 29, train_loss: 0.9785, test_loss: 1.1982, test_f1: 0.4707
 epoch: 30, train_loss: 0.9709, test_loss: 1.1977, test_f1: 0.4772
 epoch: 31, train_loss: 0.9856, test_loss: 1.1870, test_f1: 0.4862
 epoch: 32, train_loss: 0.9737, test_loss: 1.1995, test_f1: 0.4925
 epoch: 33, train_loss: 0.9608, test_loss: 1.1865, test_f1: 0.4967
 epoch: 34, train_loss: 0.9643, test_loss: 1.1938, test_f1: 0.4936
 epoch: 35, train_loss: 0.9550, test_loss: 1.1981, test_f1: 0.4786
 epoch: 36, train_loss: 0.9426, test_loss: 1.2007, test_f1: 0.4971
 epoch: 37, train_loss: 0.9475, test_loss: 1.2021, test_f1: 0.4921
 epoch: 38, train_loss: 0.9476, test_loss: 1.2062, test_f1: 0.5019
 epoch: 39, train_loss: 0.9277, test_loss: 1.1979, test_f1: 0.4976
 epoch: 40, train_loss: 0.9339, test_loss: 1.1955, test_f1: 0.4951
 epoch: 41, train_loss: 0.9335, test_loss: 1.1938, test_f1: 0.4904
 epoch: 42, train_loss: 0.9293, test_loss: 1.2089, test_f1: 0.4993
 epoch: 43, train_loss: 0.9238, test_loss: 1.2235, test_f1: 0.5007
 epoch: 44, train_loss: 0.9128, test_loss: 1.2068, test_f1: 0.4935
 epoch: 45, train_loss: 0.9124, test_loss: 1.2213, test_f1: 0.5049
 epoch: 46, train_loss: 0.9022, test_loss: 1.2157, test_f1: 0.5015
 epoch: 47, train_loss: 0.9124, test_loss: 1.2282, test_f1: 0.5045
 epoch: 48, train_loss: 0.9153, test_loss: 1.2126, test_f1: 0.4854
 epoch: 49, train_loss: 0.9015, test_loss: 1.2197, test_f1: 0.5123
 epoch: 50, train_loss: 0.8909, test_loss: 1.2216, test_f1: 0.5047
 epoch: 51, train_loss: 0.8859, test_loss: 1.2310, test_f1: 0.5001
 epoch: 52, train_loss: 0.8857, test_loss: 1.2423, test_f1: 0.4990
 epoch: 53, train_loss: 0.8907, test_loss: 1.2310, test_f1: 0.5087
 epoch: 54, train_loss: 0.8882, test_loss: 1.2283, test_f1: 0.5070
 epoch: 55, train_loss: 0.8837, test_loss: 1.2303, test_f1: 0.5097
 epoch: 56, train_loss: 0.8723, test_loss: 1.2235, test_f1: 0.5042
 epoch: 57, train_loss: 0.8700, test_loss: 1.2350, test_f1: 0.5047
 epoch: 58, train_loss: 0.8819, test_loss: 1.2412, test_f1: 0.5078
 epoch: 59, train_loss: 0.8763, test_loss: 1.2399, test_f1: 0.5124
 epoch: 60, train_loss: 0.8680, test_loss: 1.2583, test_f1: 0.4994
 epoch: 61, train_loss: 0.8738, test_loss: 1.2400, test_f1: 0.5127
 epoch: 62, train_loss: 0.8688, test_loss: 1.2511, test_f1: 0.5042
 epoch: 63, train_loss: 0.8817, test_loss: 1.2311, test_f1: 0.5155
 epoch: 64, train_loss: 0.8679, test_loss: 1.2368, test_f1: 0.5156
 epoch: 65, train_loss: 0.8659, test_loss: 1.2381, test_f1: 0.5153
 epoch: 66, train_loss: 0.8620, test_loss: 1.2454, test_f1: 0.5414
 epoch: 67, train_loss: 0.8562, test_loss: 1.2241, test_f1: 0.5205
 epoch: 68, train_loss: 0.8581, test_loss: 1.2385, test_f1: 0.5155
 epoch: 69, train_loss: 0.8614, test_loss: 1.2272, test_f1: 0.5148
 epoch: 70, train_loss: 0.8442, test_loss: 1.2349, test_f1: 0.4993
 epoch: 71, train_loss: 0.8604, test_loss: 1.2435, test_f1: 0.5048
 epoch: 72, train_loss: 0.8492, test_loss: 1.2507, test_f1: 0.5257
 epoch: 73, train_loss: 0.8608, test_loss: 1.2521, test_f1: 0.5334
 epoch: 74, train_loss: 0.8526, test_loss: 1.2413, test_f1: 0.5200
 epoch: 75, train_loss: 0.8510, test_loss: 1.2399, test_f1: 0.5150
 epoch: 76, train_loss: 0.8555, test_loss: 1.2496, test_f1: 0.5152
 epoch: 77, train_loss: 0.8398, test_loss: 1.2487, test_f1: 0.5307
 epoch: 78, train_loss: 0.8480, test_loss: 1.2568, test_f1: 0.5360
 epoch: 79, train_loss: 0.8462, test_loss: 1.2455, test_f1: 0.5210
 epoch: 80, train_loss: 0.8456, test_loss: 1.2326, test_f1: 0.5176
 epoch: 81, train_loss: 0.8295, test_loss: 1.2589, test_f1: 0.5228
 epoch: 82, train_loss: 0.8345, test_loss: 1.2718, test_f1: 0.5330
 epoch: 83, train_loss: 0.8386, test_loss: 1.2587, test_f1: 0.5204
 epoch: 84, train_loss: 0.8301, test_loss: 1.2700, test_f1: 0.5177
 epoch: 85, train_loss: 0.8331, test_loss: 1.2796, test_f1: 0.5333
 epoch: 86, train_loss: 0.8354, test_loss: 1.2737, test_f1: 0.5359
 epoch: 87, train_loss: 0.8374, test_loss: 1.2806, test_f1: 0.5209
 epoch: 88, train_loss: 0.8309, test_loss: 1.2659, test_f1: 0.5280
 epoch: 89, train_loss: 0.8564, test_loss: 1.2568, test_f1: 0.5227
 epoch: 90, train_loss: 0.8285, test_loss: 1.2505, test_f1: 0.5334
 epoch: 91, train_loss: 0.8249, test_loss: 1.2540, test_f1: 0.5201
 epoch: 92, train_loss: 0.8196, test_loss: 1.2590, test_f1: 0.5302
 epoch: 93, train_loss: 0.8295, test_loss: 1.2647, test_f1: 0.5437
 epoch: 94, train_loss: 0.8151, test_loss: 1.2778, test_f1: 0.5412
 epoch: 95, train_loss: 0.8124, test_loss: 1.2745, test_f1: 0.5181
 epoch: 96, train_loss: 0.8194, test_loss: 1.2718, test_f1: 0.5387
 epoch: 97, train_loss: 0.8110, test_loss: 1.2645, test_f1: 0.5434
 epoch: 98, train_loss: 0.8248, test_loss: 1.2877, test_f1: 0.5234
 epoch: 99, train_loss: 0.8153, test_loss: 1.2727, test_f1: 0.5366
##################ITERATION #3 ****************************************
 epoch: 0, train_loss: 1.2912, test_loss: 1.3339, test_f1: 0.2281
 epoch: 1, train_loss: 1.2360, test_loss: 1.3068, test_f1: 0.2626
 epoch: 2, train_loss: 1.2269, test_loss: 1.2861, test_f1: 0.3278
 epoch: 3, train_loss: 1.1967, test_loss: 1.2695, test_f1: 0.3805
 epoch: 4, train_loss: 1.1768, test_loss: 1.2506, test_f1: 0.3718
 epoch: 5, train_loss: 1.1657, test_loss: 1.2382, test_f1: 0.4058
 epoch: 6, train_loss: 1.1478, test_loss: 1.2254, test_f1: 0.4313
 epoch: 7, train_loss: 1.1374, test_loss: 1.2135, test_f1: 0.4381
 epoch: 8, train_loss: 1.1227, test_loss: 1.2077, test_f1: 0.4660
 epoch: 9, train_loss: 1.1032, test_loss: 1.2008, test_f1: 0.4653
 epoch: 10, train_loss: 1.1025, test_loss: 1.1897, test_f1: 0.4850
 epoch: 11, train_loss: 1.0892, test_loss: 1.1862, test_f1: 0.4882
 epoch: 12, train_loss: 1.0709, test_loss: 1.1834, test_f1: 0.4936
 epoch: 13, train_loss: 1.0639, test_loss: 1.1855, test_f1: 0.4797
 epoch: 14, train_loss: 1.0575, test_loss: 1.1839, test_f1: 0.4837
 epoch: 15, train_loss: 1.0509, test_loss: 1.1835, test_f1: 0.4937
 epoch: 16, train_loss: 1.0404, test_loss: 1.1838, test_f1: 0.5105
 epoch: 17, train_loss: 1.0316, test_loss: 1.1773, test_f1: 0.5154
 epoch: 18, train_loss: 1.0302, test_loss: 1.1725, test_f1: 0.5210
 epoch: 19, train_loss: 1.0190, test_loss: 1.1749, test_f1: 0.5334
 epoch: 20, train_loss: 1.0129, test_loss: 1.1717, test_f1: 0.5371
 epoch: 21, train_loss: 1.0058, test_loss: 1.1737, test_f1: 0.5466
 epoch: 22, train_loss: 1.0094, test_loss: 1.1721, test_f1: 0.5513
 epoch: 23, train_loss: 0.9953, test_loss: 1.1665, test_f1: 0.5419
 epoch: 24, train_loss: 0.9810, test_loss: 1.1645, test_f1: 0.5639
 epoch: 25, train_loss: 0.9757, test_loss: 1.1718, test_f1: 0.5531
 epoch: 26, train_loss: 0.9699, test_loss: 1.1668, test_f1: 0.5589
 epoch: 27, train_loss: 0.9643, test_loss: 1.1603, test_f1: 0.5720
 epoch: 28, train_loss: 0.9574, test_loss: 1.1642, test_f1: 0.5647
 epoch: 29, train_loss: 0.9664, test_loss: 1.1657, test_f1: 0.5666
 epoch: 30, train_loss: 0.9466, test_loss: 1.1734, test_f1: 0.5497
 epoch: 31, train_loss: 0.9439, test_loss: 1.1812, test_f1: 0.5421
 epoch: 32, train_loss: 0.9433, test_loss: 1.1727, test_f1: 0.5536
 epoch: 33, train_loss: 0.9252, test_loss: 1.1759, test_f1: 0.5582
 epoch: 34, train_loss: 0.9134, test_loss: 1.1613, test_f1: 0.5540
 epoch: 35, train_loss: 0.9139, test_loss: 1.1620, test_f1: 0.5669
 epoch: 36, train_loss: 0.9193, test_loss: 1.1645, test_f1: 0.5649
 epoch: 37, train_loss: 0.9093, test_loss: 1.1757, test_f1: 0.5573
 epoch: 38, train_loss: 0.9058, test_loss: 1.1636, test_f1: 0.5623
 epoch: 39, train_loss: 0.8956, test_loss: 1.1700, test_f1: 0.5518
 epoch: 40, train_loss: 0.8981, test_loss: 1.1702, test_f1: 0.5437
 epoch: 41, train_loss: 0.8917, test_loss: 1.1650, test_f1: 0.5217
 epoch: 42, train_loss: 0.8895, test_loss: 1.1927, test_f1: 0.5467
 epoch: 43, train_loss: 0.8836, test_loss: 1.1781, test_f1: 0.5464
 epoch: 44, train_loss: 0.8811, test_loss: 1.1752, test_f1: 0.5412
 epoch: 45, train_loss: 0.8697, test_loss: 1.1711, test_f1: 0.5495
 epoch: 46, train_loss: 0.8601, test_loss: 1.1906, test_f1: 0.5437
 epoch: 47, train_loss: 0.8599, test_loss: 1.1902, test_f1: 0.5492
 epoch: 48, train_loss: 0.8581, test_loss: 1.1991, test_f1: 0.5339
 epoch: 49, train_loss: 0.8518, test_loss: 1.2059, test_f1: 0.5583
 epoch: 50, train_loss: 0.8530, test_loss: 1.1894, test_f1: 0.5593
 epoch: 51, train_loss: 0.8529, test_loss: 1.1842, test_f1: 0.5554
 epoch: 52, train_loss: 0.8229, test_loss: 1.1866, test_f1: 0.5650
 epoch: 53, train_loss: 0.8365, test_loss: 1.1980, test_f1: 0.5506
 epoch: 54, train_loss: 0.8458, test_loss: 1.2084, test_f1: 0.5633
 epoch: 55, train_loss: 0.8337, test_loss: 1.1883, test_f1: 0.5557
 epoch: 56, train_loss: 0.8381, test_loss: 1.2086, test_f1: 0.5461
 epoch: 57, train_loss: 0.8296, test_loss: 1.1945, test_f1: 0.5619
 epoch: 58, train_loss: 0.8382, test_loss: 1.2093, test_f1: 0.5396
 epoch: 59, train_loss: 0.8371, test_loss: 1.2064, test_f1: 0.5418
 epoch: 60, train_loss: 0.8148, test_loss: 1.2200, test_f1: 0.5392
 epoch: 61, train_loss: 0.8245, test_loss: 1.2193, test_f1: 0.5364
 epoch: 62, train_loss: 0.8197, test_loss: 1.2074, test_f1: 0.5440
 epoch: 63, train_loss: 0.8133, test_loss: 1.2113, test_f1: 0.5535
 epoch: 64, train_loss: 0.8149, test_loss: 1.2207, test_f1: 0.5337
 epoch: 65, train_loss: 0.8193, test_loss: 1.2181, test_f1: 0.5594
 epoch: 66, train_loss: 0.8160, test_loss: 1.2257, test_f1: 0.5506
 epoch: 67, train_loss: 0.8017, test_loss: 1.2121, test_f1: 0.5531
 epoch: 68, train_loss: 0.8047, test_loss: 1.2113, test_f1: 0.5501
 epoch: 69, train_loss: 0.8272, test_loss: 1.2197, test_f1: 0.5315
 epoch: 70, train_loss: 0.8021, test_loss: 1.2247, test_f1: 0.5411
 epoch: 71, train_loss: 0.7826, test_loss: 1.2348, test_f1: 0.5411
 epoch: 72, train_loss: 0.7945, test_loss: 1.2308, test_f1: 0.5313
 epoch: 73, train_loss: 0.8012, test_loss: 1.2135, test_f1: 0.5312
 epoch: 74, train_loss: 0.7993, test_loss: 1.2314, test_f1: 0.5386
 epoch: 75, train_loss: 0.7915, test_loss: 1.2260, test_f1: 0.5374
 epoch: 76, train_loss: 0.8040, test_loss: 1.2369, test_f1: 0.5365
 epoch: 77, train_loss: 0.7869, test_loss: 1.2427, test_f1: 0.5462
 epoch: 78, train_loss: 0.7900, test_loss: 1.2265, test_f1: 0.5349
 epoch: 79, train_loss: 0.7765, test_loss: 1.2259, test_f1: 0.5337
 epoch: 80, train_loss: 0.7758, test_loss: 1.2276, test_f1: 0.5495
 epoch: 81, train_loss: 0.7806, test_loss: 1.2565, test_f1: 0.5159
 epoch: 82, train_loss: 0.7787, test_loss: 1.2406, test_f1: 0.5433
 epoch: 83, train_loss: 0.7782, test_loss: 1.2422, test_f1: 0.5308
 epoch: 84, train_loss: 0.7853, test_loss: 1.2413, test_f1: 0.5353
 epoch: 85, train_loss: 0.7756, test_loss: 1.2511, test_f1: 0.5473
 epoch: 86, train_loss: 0.7626, test_loss: 1.2393, test_f1: 0.5424
 epoch: 87, train_loss: 0.7633, test_loss: 1.2267, test_f1: 0.5323
 epoch: 88, train_loss: 0.7617, test_loss: 1.2499, test_f1: 0.5354
 epoch: 89, train_loss: 0.7736, test_loss: 1.2684, test_f1: 0.5364
 epoch: 90, train_loss: 0.7670, test_loss: 1.2490, test_f1: 0.5425
 epoch: 91, train_loss: 0.7622, test_loss: 1.2680, test_f1: 0.5401
 epoch: 92, train_loss: 0.7582, test_loss: 1.2670, test_f1: 0.5477
 epoch: 93, train_loss: 0.7528, test_loss: 1.2825, test_f1: 0.5290
 epoch: 94, train_loss: 0.7498, test_loss: 1.2882, test_f1: 0.5260
 epoch: 95, train_loss: 0.7643, test_loss: 1.3010, test_f1: 0.5305
 epoch: 96, train_loss: 0.7535, test_loss: 1.2812, test_f1: 0.5389
 epoch: 97, train_loss: 0.7665, test_loss: 1.2742, test_f1: 0.5558
 epoch: 98, train_loss: 0.7498, test_loss: 1.2939, test_f1: 0.5286
 epoch: 99, train_loss: 0.7536, test_loss: 1.3080, test_f1: 0.5219
##################ITERATION #4 ****************************************
 epoch: 0, train_loss: 1.3018, test_loss: 1.3485, test_f1: 0.3114
 epoch: 1, train_loss: 1.2484, test_loss: 1.3239, test_f1: 0.3280
 epoch: 2, train_loss: 1.2220, test_loss: 1.3010, test_f1: 0.3489
 epoch: 3, train_loss: 1.1900, test_loss: 1.2946, test_f1: 0.3848
 epoch: 4, train_loss: 1.1776, test_loss: 1.2757, test_f1: 0.4235
 epoch: 5, train_loss: 1.1503, test_loss: 1.2699, test_f1: 0.4262
 epoch: 6, train_loss: 1.1363, test_loss: 1.2564, test_f1: 0.4357
 epoch: 7, train_loss: 1.1242, test_loss: 1.2393, test_f1: 0.4619
 epoch: 8, train_loss: 1.1080, test_loss: 1.2367, test_f1: 0.4699
 epoch: 9, train_loss: 1.0952, test_loss: 1.2039, test_f1: 0.4840
 epoch: 10, train_loss: 1.0716, test_loss: 1.1962, test_f1: 0.5010
 epoch: 11, train_loss: 1.0727, test_loss: 1.1915, test_f1: 0.5002
 epoch: 12, train_loss: 1.0633, test_loss: 1.1852, test_f1: 0.5159
 epoch: 13, train_loss: 1.0510, test_loss: 1.1847, test_f1: 0.5294
 epoch: 14, train_loss: 1.0353, test_loss: 1.1924, test_f1: 0.5323
 epoch: 15, train_loss: 1.0286, test_loss: 1.1871, test_f1: 0.5171
 epoch: 16, train_loss: 1.0199, test_loss: 1.1849, test_f1: 0.5501
 epoch: 17, train_loss: 1.0195, test_loss: 1.1873, test_f1: 0.5098
 epoch: 18, train_loss: 1.0064, test_loss: 1.1836, test_f1: 0.5101
 epoch: 19, train_loss: 1.0084, test_loss: 1.1793, test_f1: 0.5178
 epoch: 20, train_loss: 0.9951, test_loss: 1.1646, test_f1: 0.5473
 epoch: 21, train_loss: 0.9849, test_loss: 1.1701, test_f1: 0.5499
 epoch: 22, train_loss: 0.9744, test_loss: 1.1658, test_f1: 0.5400
 epoch: 23, train_loss: 0.9765, test_loss: 1.1690, test_f1: 0.5304
 epoch: 24, train_loss: 0.9746, test_loss: 1.1752, test_f1: 0.5090
 epoch: 25, train_loss: 0.9553, test_loss: 1.1711, test_f1: 0.5249
 epoch: 26, train_loss: 0.9662, test_loss: 1.1646, test_f1: 0.5357
 epoch: 27, train_loss: 0.9511, test_loss: 1.1552, test_f1: 0.5461
 epoch: 28, train_loss: 0.9468, test_loss: 1.1428, test_f1: 0.5644
 epoch: 29, train_loss: 0.9538, test_loss: 1.1482, test_f1: 0.5827
 epoch: 30, train_loss: 0.9470, test_loss: 1.1821, test_f1: 0.5460
 epoch: 31, train_loss: 0.9331, test_loss: 1.1735, test_f1: 0.5563
 epoch: 32, train_loss: 0.9277, test_loss: 1.1658, test_f1: 0.5489
 epoch: 33, train_loss: 0.9370, test_loss: 1.1679, test_f1: 0.5596
 epoch: 34, train_loss: 0.9261, test_loss: 1.1654, test_f1: 0.5844
 epoch: 35, train_loss: 0.9102, test_loss: 1.1578, test_f1: 0.5769
 epoch: 36, train_loss: 0.9165, test_loss: 1.1569, test_f1: 0.5865
 epoch: 37, train_loss: 0.9183, test_loss: 1.1785, test_f1: 0.5413
 epoch: 38, train_loss: 0.9022, test_loss: 1.1585, test_f1: 0.5929
 epoch: 39, train_loss: 0.8977, test_loss: 1.1618, test_f1: 0.5925
 epoch: 40, train_loss: 0.8951, test_loss: 1.1519, test_f1: 0.5870
 epoch: 41, train_loss: 0.9001, test_loss: 1.1780, test_f1: 0.5958
 epoch: 42, train_loss: 0.9073, test_loss: 1.1655, test_f1: 0.5723
 epoch: 43, train_loss: 0.8948, test_loss: 1.1824, test_f1: 0.5871
 epoch: 44, train_loss: 0.8856, test_loss: 1.2089, test_f1: 0.5726
 epoch: 45, train_loss: 0.8870, test_loss: 1.1838, test_f1: 0.6056
 epoch: 46, train_loss: 0.8764, test_loss: 1.1943, test_f1: 0.5861
 epoch: 47, train_loss: 0.8677, test_loss: 1.1962, test_f1: 0.5965
 epoch: 48, train_loss: 0.8745, test_loss: 1.2374, test_f1: 0.5783
 epoch: 49, train_loss: 0.8616, test_loss: 1.2087, test_f1: 0.5981
 epoch: 50, train_loss: 0.8544, test_loss: 1.2015, test_f1: 0.5897
 epoch: 51, train_loss: 0.8496, test_loss: 1.2093, test_f1: 0.5762
 epoch: 52, train_loss: 0.8565, test_loss: 1.2090, test_f1: 0.6009
 epoch: 53, train_loss: 0.8443, test_loss: 1.1859, test_f1: 0.5892
 epoch: 54, train_loss: 0.8567, test_loss: 1.2156, test_f1: 0.5858
 epoch: 55, train_loss: 0.8434, test_loss: 1.2052, test_f1: 0.5875
 epoch: 56, train_loss: 0.8429, test_loss: 1.1992, test_f1: 0.5683
 epoch: 57, train_loss: 0.8295, test_loss: 1.1886, test_f1: 0.5875
 epoch: 58, train_loss: 0.8399, test_loss: 1.1912, test_f1: 0.5764
 epoch: 59, train_loss: 0.8482, test_loss: 1.1858, test_f1: 0.5826
 epoch: 60, train_loss: 0.8415, test_loss: 1.2125, test_f1: 0.5955
 epoch: 61, train_loss: 0.8410, test_loss: 1.2068, test_f1: 0.5855
 epoch: 62, train_loss: 0.8386, test_loss: 1.2131, test_f1: 0.5796
 epoch: 63, train_loss: 0.8416, test_loss: 1.2006, test_f1: 0.5821
 epoch: 64, train_loss: 0.8250, test_loss: 1.2051, test_f1: 0.5846
 epoch: 65, train_loss: 0.8317, test_loss: 1.2058, test_f1: 0.5844
 epoch: 66, train_loss: 0.8220, test_loss: 1.1915, test_f1: 0.5934
 epoch: 67, train_loss: 0.8342, test_loss: 1.2075, test_f1: 0.5855
 epoch: 68, train_loss: 0.8265, test_loss: 1.2344, test_f1: 0.5903
 epoch: 69, train_loss: 0.8081, test_loss: 1.2361, test_f1: 0.5850
 epoch: 70, train_loss: 0.8066, test_loss: 1.2203, test_f1: 0.5934
 epoch: 71, train_loss: 0.8195, test_loss: 1.2504, test_f1: 0.5803
 epoch: 72, train_loss: 0.8126, test_loss: 1.2525, test_f1: 0.5659
 epoch: 73, train_loss: 0.8178, test_loss: 1.2314, test_f1: 0.5820
 epoch: 74, train_loss: 0.8170, test_loss: 1.2439, test_f1: 0.5932
 epoch: 75, train_loss: 0.8183, test_loss: 1.2431, test_f1: 0.5725
 epoch: 76, train_loss: 0.8049, test_loss: 1.2466, test_f1: 0.5853
 epoch: 77, train_loss: 0.8118, test_loss: 1.2247, test_f1: 0.5745
 epoch: 78, train_loss: 0.8058, test_loss: 1.2276, test_f1: 0.5835
 epoch: 79, train_loss: 0.8096, test_loss: 1.2350, test_f1: 0.5882
 epoch: 80, train_loss: 0.7906, test_loss: 1.2499, test_f1: 0.5910
 epoch: 81, train_loss: 0.8039, test_loss: 1.2439, test_f1: 0.5828
 epoch: 82, train_loss: 0.7911, test_loss: 1.2211, test_f1: 0.5963
 epoch: 83, train_loss: 0.8014, test_loss: 1.2322, test_f1: 0.5846
 epoch: 84, train_loss: 0.8005, test_loss: 1.2241, test_f1: 0.5775
 epoch: 85, train_loss: 0.7862, test_loss: 1.2404, test_f1: 0.5964
 epoch: 86, train_loss: 0.7779, test_loss: 1.2330, test_f1: 0.5801
 epoch: 87, train_loss: 0.7840, test_loss: 1.2405, test_f1: 0.5997
 epoch: 88, train_loss: 0.7951, test_loss: 1.2351, test_f1: 0.5791
 epoch: 89, train_loss: 0.7752, test_loss: 1.2405, test_f1: 0.5912
 epoch: 90, train_loss: 0.7894, test_loss: 1.2467, test_f1: 0.5751
 epoch: 91, train_loss: 0.7944, test_loss: 1.2230, test_f1: 0.5854
 epoch: 92, train_loss: 0.7831, test_loss: 1.2427, test_f1: 0.5731
 epoch: 93, train_loss: 0.7778, test_loss: 1.2488, test_f1: 0.5864
 epoch: 94, train_loss: 0.7852, test_loss: 1.2359, test_f1: 0.5939
 epoch: 95, train_loss: 0.7759, test_loss: 1.2510, test_f1: 0.5779
 epoch: 96, train_loss: 0.7699, test_loss: 1.2561, test_f1: 0.5991
 epoch: 97, train_loss: 0.7796, test_loss: 1.2410, test_f1: 0.5822
 epoch: 98, train_loss: 0.7793, test_loss: 1.2567, test_f1: 0.5888
 epoch: 99, train_loss: 0.7769, test_loss: 1.2572, test_f1: 0.5857
##################ITERATION #5 ****************************************
 epoch: 0, train_loss: 1.3146, test_loss: 1.3487, test_f1: 0.2447
 epoch: 1, train_loss: 1.2456, test_loss: 1.3267, test_f1: 0.2914
 epoch: 2, train_loss: 1.2210, test_loss: 1.2842, test_f1: 0.3824
 epoch: 3, train_loss: 1.1875, test_loss: 1.2684, test_f1: 0.4078
 epoch: 4, train_loss: 1.1840, test_loss: 1.2458, test_f1: 0.4244
 epoch: 5, train_loss: 1.1520, test_loss: 1.2278, test_f1: 0.4370
 epoch: 6, train_loss: 1.1415, test_loss: 1.2180, test_f1: 0.4239
 epoch: 7, train_loss: 1.1277, test_loss: 1.2098, test_f1: 0.4498
 epoch: 8, train_loss: 1.1124, test_loss: 1.1936, test_f1: 0.4207
 epoch: 9, train_loss: 1.1109, test_loss: 1.1867, test_f1: 0.4132
 epoch: 10, train_loss: 1.0812, test_loss: 1.1758, test_f1: 0.4295
 epoch: 11, train_loss: 1.0684, test_loss: 1.1696, test_f1: 0.4559
 epoch: 12, train_loss: 1.0589, test_loss: 1.1638, test_f1: 0.4590
 epoch: 13, train_loss: 1.0499, test_loss: 1.1713, test_f1: 0.4852
 epoch: 14, train_loss: 1.0366, test_loss: 1.1656, test_f1: 0.4825
 epoch: 15, train_loss: 1.0390, test_loss: 1.1707, test_f1: 0.4590
 epoch: 16, train_loss: 1.0234, test_loss: 1.1695, test_f1: 0.5018
 epoch: 17, train_loss: 1.0166, test_loss: 1.1722, test_f1: 0.4724
 epoch: 18, train_loss: 1.0077, test_loss: 1.1565, test_f1: 0.5128
 epoch: 19, train_loss: 1.0137, test_loss: 1.1571, test_f1: 0.5265
 epoch: 20, train_loss: 0.9999, test_loss: 1.1594, test_f1: 0.5048
 epoch: 21, train_loss: 0.9908, test_loss: 1.1625, test_f1: 0.4926
 epoch: 22, train_loss: 0.9881, test_loss: 1.1564, test_f1: 0.5357
 epoch: 23, train_loss: 0.9762, test_loss: 1.1825, test_f1: 0.4869
 epoch: 24, train_loss: 0.9547, test_loss: 1.1573, test_f1: 0.5093
 epoch: 25, train_loss: 0.9773, test_loss: 1.1507, test_f1: 0.5275
 epoch: 26, train_loss: 0.9614, test_loss: 1.1550, test_f1: 0.4954
 epoch: 27, train_loss: 0.9831, test_loss: 1.1454, test_f1: 0.5164
 epoch: 28, train_loss: 0.9587, test_loss: 1.1499, test_f1: 0.5006
 epoch: 29, train_loss: 0.9425, test_loss: 1.1571, test_f1: 0.5000
 epoch: 30, train_loss: 0.9387, test_loss: 1.1503, test_f1: 0.5200
 epoch: 31, train_loss: 0.9393, test_loss: 1.1540, test_f1: 0.4947
 epoch: 32, train_loss: 0.9259, test_loss: 1.1765, test_f1: 0.5063
 epoch: 33, train_loss: 0.9293, test_loss: 1.1538, test_f1: 0.5102
 epoch: 34, train_loss: 0.9273, test_loss: 1.1334, test_f1: 0.5493
 epoch: 35, train_loss: 0.9261, test_loss: 1.1408, test_f1: 0.5284
 epoch: 36, train_loss: 0.9201, test_loss: 1.1544, test_f1: 0.5201
 epoch: 37, train_loss: 0.9054, test_loss: 1.1257, test_f1: 0.5603
 epoch: 38, train_loss: 0.9053, test_loss: 1.1514, test_f1: 0.5123
 epoch: 39, train_loss: 0.9082, test_loss: 1.1212, test_f1: 0.5386
 epoch: 40, train_loss: 0.9104, test_loss: 1.1555, test_f1: 0.5410
 epoch: 41, train_loss: 0.8864, test_loss: 1.1398, test_f1: 0.5002
 epoch: 42, train_loss: 0.8839, test_loss: 1.1317, test_f1: 0.5264
 epoch: 43, train_loss: 0.8934, test_loss: 1.1233, test_f1: 0.5196
 epoch: 44, train_loss: 0.8772, test_loss: 1.1319, test_f1: 0.5186
 epoch: 45, train_loss: 0.8822, test_loss: 1.1302, test_f1: 0.5244
 epoch: 46, train_loss: 0.8795, test_loss: 1.1357, test_f1: 0.5431
 epoch: 47, train_loss: 0.8611, test_loss: 1.1356, test_f1: 0.5331
 epoch: 48, train_loss: 0.8622, test_loss: 1.1242, test_f1: 0.5350
 epoch: 49, train_loss: 0.8561, test_loss: 1.1485, test_f1: 0.5323
 epoch: 50, train_loss: 0.8580, test_loss: 1.1223, test_f1: 0.5316
 epoch: 51, train_loss: 0.8559, test_loss: 1.1248, test_f1: 0.5526
 epoch: 52, train_loss: 0.8519, test_loss: 1.1293, test_f1: 0.5240
 epoch: 53, train_loss: 0.8478, test_loss: 1.1190, test_f1: 0.5342
 epoch: 54, train_loss: 0.8401, test_loss: 1.1298, test_f1: 0.5439
 epoch: 55, train_loss: 0.8506, test_loss: 1.1280, test_f1: 0.5391
 epoch: 56, train_loss: 0.8258, test_loss: 1.1471, test_f1: 0.5338
 epoch: 57, train_loss: 0.8454, test_loss: 1.1151, test_f1: 0.5441
 epoch: 58, train_loss: 0.8282, test_loss: 1.1110, test_f1: 0.5420
 epoch: 59, train_loss: 0.8465, test_loss: 1.1179, test_f1: 0.5471
 epoch: 60, train_loss: 0.8350, test_loss: 1.1401, test_f1: 0.5496
 epoch: 61, train_loss: 0.8311, test_loss: 1.1251, test_f1: 0.5561
 epoch: 62, train_loss: 0.8185, test_loss: 1.1371, test_f1: 0.5429
 epoch: 63, train_loss: 0.8316, test_loss: 1.1562, test_f1: 0.5428
 epoch: 64, train_loss: 0.8154, test_loss: 1.1617, test_f1: 0.5368
 epoch: 65, train_loss: 0.8246, test_loss: 1.1485, test_f1: 0.5371
 epoch: 66, train_loss: 0.8356, test_loss: 1.1500, test_f1: 0.5425
 epoch: 67, train_loss: 0.8238, test_loss: 1.1382, test_f1: 0.5445
 epoch: 68, train_loss: 0.8136, test_loss: 1.1400, test_f1: 0.5427
 epoch: 69, train_loss: 0.8089, test_loss: 1.1423, test_f1: 0.5447
 epoch: 70, train_loss: 0.8101, test_loss: 1.1358, test_f1: 0.5378
 epoch: 71, train_loss: 0.8196, test_loss: 1.1454, test_f1: 0.5379
 epoch: 72, train_loss: 0.8243, test_loss: 1.1405, test_f1: 0.5451
 epoch: 73, train_loss: 0.8077, test_loss: 1.1381, test_f1: 0.5330
 epoch: 74, train_loss: 0.8158, test_loss: 1.1389, test_f1: 0.5482
 epoch: 75, train_loss: 0.8019, test_loss: 1.1239, test_f1: 0.5616
 epoch: 76, train_loss: 0.8029, test_loss: 1.1305, test_f1: 0.5530
 epoch: 77, train_loss: 0.7871, test_loss: 1.1365, test_f1: 0.5561
 epoch: 78, train_loss: 0.7993, test_loss: 1.1383, test_f1: 0.5667
 epoch: 79, train_loss: 0.8072, test_loss: 1.1581, test_f1: 0.5370
 epoch: 80, train_loss: 0.7918, test_loss: 1.1422, test_f1: 0.5422
 epoch: 81, train_loss: 0.7926, test_loss: 1.1666, test_f1: 0.5609
 epoch: 82, train_loss: 0.7945, test_loss: 1.1498, test_f1: 0.5419
 epoch: 83, train_loss: 0.7894, test_loss: 1.1481, test_f1: 0.5442
 epoch: 84, train_loss: 0.7951, test_loss: 1.1311, test_f1: 0.5589
 epoch: 85, train_loss: 0.7964, test_loss: 1.1733, test_f1: 0.5373
 epoch: 86, train_loss: 0.7896, test_loss: 1.1242, test_f1: 0.5517
 epoch: 87, train_loss: 0.7837, test_loss: 1.1879, test_f1: 0.5450
 epoch: 88, train_loss: 0.7797, test_loss: 1.1778, test_f1: 0.5424
 epoch: 89, train_loss: 0.7746, test_loss: 1.1912, test_f1: 0.5293
 epoch: 90, train_loss: 0.7658, test_loss: 1.1387, test_f1: 0.5487
 epoch: 91, train_loss: 0.7688, test_loss: 1.1514, test_f1: 0.5483
 epoch: 92, train_loss: 0.7798, test_loss: 1.1747, test_f1: 0.5589
 epoch: 93, train_loss: 0.7732, test_loss: 1.1172, test_f1: 0.5616
 epoch: 94, train_loss: 0.7804, test_loss: 1.1571, test_f1: 0.5534
 epoch: 95, train_loss: 0.7747, test_loss: 1.1414, test_f1: 0.5533
 epoch: 96, train_loss: 0.7789, test_loss: 1.1186, test_f1: 0.5699
 epoch: 97, train_loss: 0.7756, test_loss: 1.1383, test_f1: 0.5507
 epoch: 98, train_loss: 0.7844, test_loss: 1.1441, test_f1: 0.5438
 epoch: 99, train_loss: 0.7780, test_loss: 1.1421, test_f1: 0.5563
##################ITERATION #6 ****************************************
 epoch: 0, train_loss: 1.2952, test_loss: 1.3347, test_f1: 0.2556
 epoch: 1, train_loss: 1.2362, test_loss: 1.3036, test_f1: 0.2979
 epoch: 2, train_loss: 1.2011, test_loss: 1.2904, test_f1: 0.3458
 epoch: 3, train_loss: 1.1889, test_loss: 1.2742, test_f1: 0.3635
 epoch: 4, train_loss: 1.1732, test_loss: 1.2605, test_f1: 0.3836
 epoch: 5, train_loss: 1.1619, test_loss: 1.2490, test_f1: 0.4039
 epoch: 6, train_loss: 1.1446, test_loss: 1.2387, test_f1: 0.3988
 epoch: 7, train_loss: 1.1433, test_loss: 1.2194, test_f1: 0.4058
 epoch: 8, train_loss: 1.1161, test_loss: 1.2071, test_f1: 0.4228
 epoch: 9, train_loss: 1.1174, test_loss: 1.2011, test_f1: 0.4471
 epoch: 10, train_loss: 1.1006, test_loss: 1.1907, test_f1: 0.4689
 epoch: 11, train_loss: 1.0933, test_loss: 1.1862, test_f1: 0.4883
 epoch: 12, train_loss: 1.0634, test_loss: 1.1760, test_f1: 0.5056
 epoch: 13, train_loss: 1.0770, test_loss: 1.1616, test_f1: 0.4945
 epoch: 14, train_loss: 1.0522, test_loss: 1.1602, test_f1: 0.5029
 epoch: 15, train_loss: 1.0439, test_loss: 1.1465, test_f1: 0.5156
 epoch: 16, train_loss: 1.0324, test_loss: 1.1472, test_f1: 0.5153
 epoch: 17, train_loss: 1.0352, test_loss: 1.1415, test_f1: 0.5176
 epoch: 18, train_loss: 1.0242, test_loss: 1.1390, test_f1: 0.5083
 epoch: 19, train_loss: 1.0208, test_loss: 1.1348, test_f1: 0.5025
 epoch: 20, train_loss: 1.0110, test_loss: 1.1405, test_f1: 0.5011
 epoch: 21, train_loss: 0.9897, test_loss: 1.1369, test_f1: 0.5006
 epoch: 22, train_loss: 0.9936, test_loss: 1.1300, test_f1: 0.5131
 epoch: 23, train_loss: 1.0001, test_loss: 1.1287, test_f1: 0.4982
 epoch: 24, train_loss: 0.9828, test_loss: 1.1291, test_f1: 0.4829
 epoch: 25, train_loss: 0.9791, test_loss: 1.1234, test_f1: 0.4851
 epoch: 26, train_loss: 0.9651, test_loss: 1.1218, test_f1: 0.5056
 epoch: 27, train_loss: 0.9580, test_loss: 1.1098, test_f1: 0.5136
 epoch: 28, train_loss: 0.9485, test_loss: 1.1213, test_f1: 0.4983
 epoch: 29, train_loss: 0.9441, test_loss: 1.1344, test_f1: 0.4798
 epoch: 30, train_loss: 0.9428, test_loss: 1.1370, test_f1: 0.4831
 epoch: 31, train_loss: 0.9393, test_loss: 1.1083, test_f1: 0.4925
 epoch: 32, train_loss: 0.9341, test_loss: 1.1247, test_f1: 0.4829
 epoch: 33, train_loss: 0.9413, test_loss: 1.1322, test_f1: 0.4856
 epoch: 34, train_loss: 0.9376, test_loss: 1.1215, test_f1: 0.5336
 epoch: 35, train_loss: 0.9299, test_loss: 1.1249, test_f1: 0.5229
 epoch: 36, train_loss: 0.9282, test_loss: 1.1242, test_f1: 0.5203
 epoch: 37, train_loss: 0.9106, test_loss: 1.1482, test_f1: 0.4947
 epoch: 38, train_loss: 0.9178, test_loss: 1.1361, test_f1: 0.5020
 epoch: 39, train_loss: 0.9110, test_loss: 1.1638, test_f1: 0.4875
 epoch: 40, train_loss: 0.8987, test_loss: 1.1521, test_f1: 0.5123
 epoch: 41, train_loss: 0.8914, test_loss: 1.1498, test_f1: 0.5096
 epoch: 42, train_loss: 0.9092, test_loss: 1.1502, test_f1: 0.5232
 epoch: 43, train_loss: 0.8888, test_loss: 1.1579, test_f1: 0.5180
 epoch: 44, train_loss: 0.8850, test_loss: 1.1522, test_f1: 0.5245
 epoch: 45, train_loss: 0.8804, test_loss: 1.1585, test_f1: 0.5054
 epoch: 46, train_loss: 0.8747, test_loss: 1.1342, test_f1: 0.5190
 epoch: 47, train_loss: 0.8786, test_loss: 1.1757, test_f1: 0.5165
 epoch: 48, train_loss: 0.8727, test_loss: 1.1532, test_f1: 0.5262
 epoch: 49, train_loss: 0.8690, test_loss: 1.1542, test_f1: 0.5226
 epoch: 50, train_loss: 0.8740, test_loss: 1.1593, test_f1: 0.5405
 epoch: 51, train_loss: 0.8572, test_loss: 1.1742, test_f1: 0.5537
 epoch: 52, train_loss: 0.8482, test_loss: 1.1725, test_f1: 0.5222
 epoch: 53, train_loss: 0.8394, test_loss: 1.1802, test_f1: 0.5186
 epoch: 54, train_loss: 0.8643, test_loss: 1.1743, test_f1: 0.5319
 epoch: 55, train_loss: 0.8483, test_loss: 1.1664, test_f1: 0.5327
 epoch: 56, train_loss: 0.8383, test_loss: 1.1629, test_f1: 0.5408
 epoch: 57, train_loss: 0.8440, test_loss: 1.1696, test_f1: 0.5443
 epoch: 58, train_loss: 0.8397, test_loss: 1.2040, test_f1: 0.5354
 epoch: 59, train_loss: 0.8410, test_loss: 1.1756, test_f1: 0.5590
 epoch: 60, train_loss: 0.8387, test_loss: 1.1953, test_f1: 0.5379
 epoch: 61, train_loss: 0.8431, test_loss: 1.1814, test_f1: 0.5395
 epoch: 62, train_loss: 0.8474, test_loss: 1.1994, test_f1: 0.5621
 epoch: 63, train_loss: 0.8364, test_loss: 1.1767, test_f1: 0.5600
 epoch: 64, train_loss: 0.8442, test_loss: 1.1952, test_f1: 0.5475
 epoch: 65, train_loss: 0.8260, test_loss: 1.1919, test_f1: 0.5339
 epoch: 66, train_loss: 0.8340, test_loss: 1.2348, test_f1: 0.5332
 epoch: 67, train_loss: 0.8409, test_loss: 1.2167, test_f1: 0.5493
 epoch: 68, train_loss: 0.8210, test_loss: 1.1898, test_f1: 0.5542
 epoch: 69, train_loss: 0.8287, test_loss: 1.2062, test_f1: 0.5637
 epoch: 70, train_loss: 0.8336, test_loss: 1.2027, test_f1: 0.5603
 epoch: 71, train_loss: 0.8320, test_loss: 1.1930, test_f1: 0.5624
 epoch: 72, train_loss: 0.8309, test_loss: 1.2456, test_f1: 0.5414
 epoch: 73, train_loss: 0.8152, test_loss: 1.2569, test_f1: 0.5323
 epoch: 74, train_loss: 0.8152, test_loss: 1.2575, test_f1: 0.5541
 epoch: 75, train_loss: 0.8374, test_loss: 1.2185, test_f1: 0.5679
 epoch: 76, train_loss: 0.8113, test_loss: 1.2687, test_f1: 0.5436
 epoch: 77, train_loss: 0.8170, test_loss: 1.2261, test_f1: 0.5285
 epoch: 78, train_loss: 0.8292, test_loss: 1.2393, test_f1: 0.5418
 epoch: 79, train_loss: 0.8159, test_loss: 1.2371, test_f1: 0.5481
 epoch: 80, train_loss: 0.8125, test_loss: 1.2516, test_f1: 0.5463
 epoch: 81, train_loss: 0.8089, test_loss: 1.2334, test_f1: 0.5448
 epoch: 82, train_loss: 0.8007, test_loss: 1.2639, test_f1: 0.5232
 epoch: 83, train_loss: 0.8061, test_loss: 1.2141, test_f1: 0.5470
 epoch: 84, train_loss: 0.8050, test_loss: 1.2377, test_f1: 0.5433
 epoch: 85, train_loss: 0.8073, test_loss: 1.2617, test_f1: 0.5295
 epoch: 86, train_loss: 0.7885, test_loss: 1.2150, test_f1: 0.5706
 epoch: 87, train_loss: 0.8046, test_loss: 1.2185, test_f1: 0.5571
 epoch: 88, train_loss: 0.7990, test_loss: 1.2239, test_f1: 0.5605
 epoch: 89, train_loss: 0.7957, test_loss: 1.2282, test_f1: 0.5873
 epoch: 90, train_loss: 0.7902, test_loss: 1.2721, test_f1: 0.5570
 epoch: 91, train_loss: 0.7973, test_loss: 1.2890, test_f1: 0.5404
 epoch: 92, train_loss: 0.7971, test_loss: 1.2565, test_f1: 0.5489
 epoch: 93, train_loss: 0.7849, test_loss: 1.2677, test_f1: 0.5440
 epoch: 94, train_loss: 0.7809, test_loss: 1.2631, test_f1: 0.5714
 epoch: 95, train_loss: 0.7827, test_loss: 1.2739, test_f1: 0.5406
 epoch: 96, train_loss: 0.7744, test_loss: 1.2868, test_f1: 0.5513
 epoch: 97, train_loss: 0.7854, test_loss: 1.2617, test_f1: 0.5576
 epoch: 98, train_loss: 0.7833, test_loss: 1.3102, test_f1: 0.5525
 epoch: 99, train_loss: 0.7823, test_loss: 1.2638, test_f1: 0.5641
##################ITERATION #7 ****************************************
 epoch: 0, train_loss: 1.3046, test_loss: 1.3706, test_f1: 0.2929
 epoch: 1, train_loss: 1.2427, test_loss: 1.3185, test_f1: 0.3274
 epoch: 2, train_loss: 1.2005, test_loss: 1.2908, test_f1: 0.3579
 epoch: 3, train_loss: 1.1980, test_loss: 1.2642, test_f1: 0.3801
 epoch: 4, train_loss: 1.1787, test_loss: 1.2427, test_f1: 0.3824
 epoch: 5, train_loss: 1.1643, test_loss: 1.2366, test_f1: 0.3812
 epoch: 6, train_loss: 1.1480, test_loss: 1.2208, test_f1: 0.4020
 epoch: 7, train_loss: 1.1263, test_loss: 1.2153, test_f1: 0.3909
 epoch: 8, train_loss: 1.1348, test_loss: 1.1991, test_f1: 0.3999
 epoch: 9, train_loss: 1.1225, test_loss: 1.1946, test_f1: 0.4026
 epoch: 10, train_loss: 1.1089, test_loss: 1.1937, test_f1: 0.4237
 epoch: 11, train_loss: 1.0926, test_loss: 1.1788, test_f1: 0.4320
 epoch: 12, train_loss: 1.0858, test_loss: 1.1683, test_f1: 0.4273
 epoch: 13, train_loss: 1.0858, test_loss: 1.1624, test_f1: 0.4382
 epoch: 14, train_loss: 1.0617, test_loss: 1.1568, test_f1: 0.4310
 epoch: 15, train_loss: 1.0641, test_loss: 1.1503, test_f1: 0.4470
 epoch: 16, train_loss: 1.0536, test_loss: 1.1517, test_f1: 0.4657
 epoch: 17, train_loss: 1.0490, test_loss: 1.1431, test_f1: 0.4774
 epoch: 18, train_loss: 1.0397, test_loss: 1.1432, test_f1: 0.4746
 epoch: 19, train_loss: 1.0088, test_loss: 1.1439, test_f1: 0.4797
 epoch: 20, train_loss: 1.0084, test_loss: 1.1461, test_f1: 0.4851
 epoch: 21, train_loss: 0.9989, test_loss: 1.1341, test_f1: 0.4886
 epoch: 22, train_loss: 1.0212, test_loss: 1.1324, test_f1: 0.4891
 epoch: 23, train_loss: 0.9947, test_loss: 1.1362, test_f1: 0.4909
 epoch: 24, train_loss: 1.0035, test_loss: 1.1309, test_f1: 0.4969
 epoch: 25, train_loss: 0.9924, test_loss: 1.1091, test_f1: 0.4893
 epoch: 26, train_loss: 0.9617, test_loss: 1.1287, test_f1: 0.4993
 epoch: 27, train_loss: 0.9722, test_loss: 1.1156, test_f1: 0.4999
 epoch: 28, train_loss: 0.9624, test_loss: 1.1233, test_f1: 0.5018
 epoch: 29, train_loss: 0.9600, test_loss: 1.1113, test_f1: 0.5027
 epoch: 30, train_loss: 0.9454, test_loss: 1.1027, test_f1: 0.5138
 epoch: 31, train_loss: 0.9600, test_loss: 1.1128, test_f1: 0.5046
 epoch: 32, train_loss: 0.9486, test_loss: 1.1041, test_f1: 0.5045
 epoch: 33, train_loss: 0.9247, test_loss: 1.1129, test_f1: 0.5195
 epoch: 34, train_loss: 0.9263, test_loss: 1.1240, test_f1: 0.4954
 epoch: 35, train_loss: 0.9020, test_loss: 1.1128, test_f1: 0.5041
 epoch: 36, train_loss: 0.9334, test_loss: 1.1124, test_f1: 0.4963
 epoch: 37, train_loss: 0.9201, test_loss: 1.1168, test_f1: 0.4986
 epoch: 38, train_loss: 0.9205, test_loss: 1.1062, test_f1: 0.5091
 epoch: 39, train_loss: 0.8986, test_loss: 1.1229, test_f1: 0.4807
 epoch: 40, train_loss: 0.9184, test_loss: 1.0930, test_f1: 0.5503
 epoch: 41, train_loss: 0.9019, test_loss: 1.1167, test_f1: 0.5147
 epoch: 42, train_loss: 0.8963, test_loss: 1.0979, test_f1: 0.5276
 epoch: 43, train_loss: 0.8849, test_loss: 1.1066, test_f1: 0.5245
 epoch: 44, train_loss: 0.8905, test_loss: 1.1043, test_f1: 0.5357
 epoch: 45, train_loss: 0.8785, test_loss: 1.1200, test_f1: 0.5200
 epoch: 46, train_loss: 0.8812, test_loss: 1.1004, test_f1: 0.5449
 epoch: 47, train_loss: 0.8718, test_loss: 1.1077, test_f1: 0.5197
 epoch: 48, train_loss: 0.8665, test_loss: 1.1086, test_f1: 0.5070
 epoch: 49, train_loss: 0.8605, test_loss: 1.1091, test_f1: 0.5234
 epoch: 50, train_loss: 0.8709, test_loss: 1.1283, test_f1: 0.5279
 epoch: 51, train_loss: 0.8621, test_loss: 1.1019, test_f1: 0.5493
 epoch: 52, train_loss: 0.8556, test_loss: 1.1133, test_f1: 0.5539
 epoch: 53, train_loss: 0.8509, test_loss: 1.1106, test_f1: 0.5484
 epoch: 54, train_loss: 0.8545, test_loss: 1.1149, test_f1: 0.5489
 epoch: 55, train_loss: 0.8476, test_loss: 1.1041, test_f1: 0.5592
 epoch: 56, train_loss: 0.8581, test_loss: 1.1267, test_f1: 0.5295
 epoch: 57, train_loss: 0.8489, test_loss: 1.1111, test_f1: 0.5527
 epoch: 58, train_loss: 0.8504, test_loss: 1.1095, test_f1: 0.5791
 epoch: 59, train_loss: 0.8449, test_loss: 1.1099, test_f1: 0.5651
 epoch: 60, train_loss: 0.8469, test_loss: 1.1277, test_f1: 0.5366
 epoch: 61, train_loss: 0.8363, test_loss: 1.1345, test_f1: 0.5394
 epoch: 62, train_loss: 0.8407, test_loss: 1.1193, test_f1: 0.5623
 epoch: 63, train_loss: 0.8391, test_loss: 1.1118, test_f1: 0.5580
 epoch: 64, train_loss: 0.8445, test_loss: 1.1147, test_f1: 0.5708
 epoch: 65, train_loss: 0.8454, test_loss: 1.1178, test_f1: 0.5503
 epoch: 66, train_loss: 0.8345, test_loss: 1.1203, test_f1: 0.5548
 epoch: 67, train_loss: 0.8255, test_loss: 1.1237, test_f1: 0.5599
 epoch: 68, train_loss: 0.8191, test_loss: 1.1192, test_f1: 0.5699
 epoch: 69, train_loss: 0.8274, test_loss: 1.1317, test_f1: 0.5703
 epoch: 70, train_loss: 0.8220, test_loss: 1.1323, test_f1: 0.5537
 epoch: 71, train_loss: 0.8219, test_loss: 1.1285, test_f1: 0.5730
 epoch: 72, train_loss: 0.8368, test_loss: 1.1280, test_f1: 0.5563
 epoch: 73, train_loss: 0.8159, test_loss: 1.1172, test_f1: 0.5615
 epoch: 74, train_loss: 0.8167, test_loss: 1.1329, test_f1: 0.5589
 epoch: 75, train_loss: 0.8218, test_loss: 1.1308, test_f1: 0.5729
 epoch: 76, train_loss: 0.8189, test_loss: 1.1228, test_f1: 0.5889
 epoch: 77, train_loss: 0.8128, test_loss: 1.1172, test_f1: 0.5753
 epoch: 78, train_loss: 0.8198, test_loss: 1.1201, test_f1: 0.5866
 epoch: 79, train_loss: 0.8125, test_loss: 1.1324, test_f1: 0.5620
 epoch: 80, train_loss: 0.8067, test_loss: 1.1330, test_f1: 0.5781
 epoch: 81, train_loss: 0.8108, test_loss: 1.1374, test_f1: 0.5892
 epoch: 82, train_loss: 0.8037, test_loss: 1.1298, test_f1: 0.5682
 epoch: 83, train_loss: 0.8116, test_loss: 1.1267, test_f1: 0.5865
 epoch: 84, train_loss: 0.8106, test_loss: 1.1132, test_f1: 0.6077
 epoch: 85, train_loss: 0.8127, test_loss: 1.1401, test_f1: 0.5652
 epoch: 86, train_loss: 0.7941, test_loss: 1.1267, test_f1: 0.5729
 epoch: 87, train_loss: 0.8082, test_loss: 1.1539, test_f1: 0.5567
 epoch: 88, train_loss: 0.7866, test_loss: 1.1445, test_f1: 0.5755
 epoch: 89, train_loss: 0.7948, test_loss: 1.1558, test_f1: 0.5685
 epoch: 90, train_loss: 0.7782, test_loss: 1.1403, test_f1: 0.5800
 epoch: 91, train_loss: 0.7909, test_loss: 1.1453, test_f1: 0.5660
 epoch: 92, train_loss: 0.7849, test_loss: 1.1575, test_f1: 0.5802
 epoch: 93, train_loss: 0.7857, test_loss: 1.1571, test_f1: 0.5688
 epoch: 94, train_loss: 0.7840, test_loss: 1.1603, test_f1: 0.5781
 epoch: 95, train_loss: 0.7944, test_loss: 1.1443, test_f1: 0.5764
 epoch: 96, train_loss: 0.7921, test_loss: 1.1428, test_f1: 0.5833
 epoch: 97, train_loss: 0.7735, test_loss: 1.1541, test_f1: 0.5772
 epoch: 98, train_loss: 0.7626, test_loss: 1.1566, test_f1: 0.5800
 epoch: 99, train_loss: 0.7975, test_loss: 1.1695, test_f1: 0.5643
##################ITERATION #8 ****************************************
 epoch: 0, train_loss: 1.3070, test_loss: 1.3307, test_f1: 0.2545
 epoch: 1, train_loss: 1.2536, test_loss: 1.2929, test_f1: 0.2847
 epoch: 2, train_loss: 1.2286, test_loss: 1.2792, test_f1: 0.3485
 epoch: 3, train_loss: 1.2108, test_loss: 1.2630, test_f1: 0.3354
 epoch: 4, train_loss: 1.1808, test_loss: 1.2596, test_f1: 0.3729
 epoch: 5, train_loss: 1.1844, test_loss: 1.2493, test_f1: 0.3822
 epoch: 6, train_loss: 1.1716, test_loss: 1.2600, test_f1: 0.3880
 epoch: 7, train_loss: 1.1513, test_loss: 1.2412, test_f1: 0.4142
 epoch: 8, train_loss: 1.1416, test_loss: 1.2327, test_f1: 0.4225
 epoch: 9, train_loss: 1.1329, test_loss: 1.2315, test_f1: 0.4397
 epoch: 10, train_loss: 1.1237, test_loss: 1.2508, test_f1: 0.4685
 epoch: 11, train_loss: 1.1135, test_loss: 1.2190, test_f1: 0.4699
 epoch: 12, train_loss: 1.0930, test_loss: 1.2303, test_f1: 0.4844
 epoch: 13, train_loss: 1.0819, test_loss: 1.2314, test_f1: 0.5084
 epoch: 14, train_loss: 1.0757, test_loss: 1.2185, test_f1: 0.4982
 epoch: 15, train_loss: 1.0661, test_loss: 1.2129, test_f1: 0.4985
 epoch: 16, train_loss: 1.0559, test_loss: 1.2006, test_f1: 0.4938
 epoch: 17, train_loss: 1.0515, test_loss: 1.1928, test_f1: 0.4910
 epoch: 18, train_loss: 1.0436, test_loss: 1.2276, test_f1: 0.4973
 epoch: 19, train_loss: 1.0253, test_loss: 1.2551, test_f1: 0.4883
 epoch: 20, train_loss: 1.0206, test_loss: 1.2478, test_f1: 0.4919
 epoch: 21, train_loss: 1.0126, test_loss: 1.2122, test_f1: 0.4943
 epoch: 22, train_loss: 1.0091, test_loss: 1.2124, test_f1: 0.4776
 epoch: 23, train_loss: 1.0003, test_loss: 1.2052, test_f1: 0.4908
 epoch: 24, train_loss: 0.9967, test_loss: 1.1971, test_f1: 0.5076
 epoch: 25, train_loss: 0.9815, test_loss: 1.2111, test_f1: 0.5156
 epoch: 26, train_loss: 0.9797, test_loss: 1.2248, test_f1: 0.5059
 epoch: 27, train_loss: 0.9628, test_loss: 1.2431, test_f1: 0.5292
 epoch: 28, train_loss: 0.9586, test_loss: 1.2514, test_f1: 0.5346
 epoch: 29, train_loss: 0.9494, test_loss: 1.2982, test_f1: 0.5316
 epoch: 30, train_loss: 0.9569, test_loss: 1.2737, test_f1: 0.5273
 epoch: 31, train_loss: 0.9513, test_loss: 1.2519, test_f1: 0.5266
 epoch: 32, train_loss: 0.9577, test_loss: 1.2708, test_f1: 0.5144
 epoch: 33, train_loss: 0.9427, test_loss: 1.2771, test_f1: 0.5457
 epoch: 34, train_loss: 0.9173, test_loss: 1.2874, test_f1: 0.5394
 epoch: 35, train_loss: 0.9266, test_loss: 1.2837, test_f1: 0.5113
 epoch: 36, train_loss: 0.9084, test_loss: 1.2784, test_f1: 0.5061
 epoch: 37, train_loss: 0.9072, test_loss: 1.2699, test_f1: 0.5132
 epoch: 38, train_loss: 0.9077, test_loss: 1.2596, test_f1: 0.5361
 epoch: 39, train_loss: 0.8913, test_loss: 1.2728, test_f1: 0.5175
 epoch: 40, train_loss: 0.8878, test_loss: 1.2612, test_f1: 0.5357
 epoch: 41, train_loss: 0.8994, test_loss: 1.2807, test_f1: 0.5274
 epoch: 42, train_loss: 0.8846, test_loss: 1.2792, test_f1: 0.5227
 epoch: 43, train_loss: 0.8930, test_loss: 1.2591, test_f1: 0.5091
 epoch: 44, train_loss: 0.8705, test_loss: 1.2549, test_f1: 0.5148
 epoch: 45, train_loss: 0.8808, test_loss: 1.2657, test_f1: 0.5382
 epoch: 46, train_loss: 0.8727, test_loss: 1.2454, test_f1: 0.5353
 epoch: 47, train_loss: 0.8679, test_loss: 1.2530, test_f1: 0.5225
 epoch: 48, train_loss: 0.8693, test_loss: 1.2733, test_f1: 0.5146
 epoch: 49, train_loss: 0.8605, test_loss: 1.2524, test_f1: 0.5146
 epoch: 50, train_loss: 0.8488, test_loss: 1.2468, test_f1: 0.5176
 epoch: 51, train_loss: 0.8486, test_loss: 1.2681, test_f1: 0.5201
 epoch: 52, train_loss: 0.8446, test_loss: 1.2726, test_f1: 0.5176
 epoch: 53, train_loss: 0.8462, test_loss: 1.2708, test_f1: 0.5330
 epoch: 54, train_loss: 0.8334, test_loss: 1.2946, test_f1: 0.5060
 epoch: 55, train_loss: 0.8298, test_loss: 1.2865, test_f1: 0.5202
 epoch: 56, train_loss: 0.8343, test_loss: 1.2992, test_f1: 0.5068
 epoch: 57, train_loss: 0.8444, test_loss: 1.3039, test_f1: 0.5200
 epoch: 58, train_loss: 0.8373, test_loss: 1.2849, test_f1: 0.5305
 epoch: 59, train_loss: 0.8293, test_loss: 1.3034, test_f1: 0.5063
 epoch: 60, train_loss: 0.8315, test_loss: 1.2967, test_f1: 0.5171
 epoch: 61, train_loss: 0.8251, test_loss: 1.3171, test_f1: 0.5146
 epoch: 62, train_loss: 0.8307, test_loss: 1.2855, test_f1: 0.5277
 epoch: 63, train_loss: 0.8296, test_loss: 1.2946, test_f1: 0.5385
 epoch: 64, train_loss: 0.8374, test_loss: 1.3131, test_f1: 0.5356
 epoch: 65, train_loss: 0.8157, test_loss: 1.3217, test_f1: 0.5223
 epoch: 66, train_loss: 0.8074, test_loss: 1.3170, test_f1: 0.5387
 epoch: 67, train_loss: 0.8197, test_loss: 1.3448, test_f1: 0.5116
 epoch: 68, train_loss: 0.8221, test_loss: 1.3126, test_f1: 0.5359
 epoch: 69, train_loss: 0.8075, test_loss: 1.3192, test_f1: 0.5519
 epoch: 70, train_loss: 0.8146, test_loss: 1.3344, test_f1: 0.5499
 epoch: 71, train_loss: 0.8183, test_loss: 1.3611, test_f1: 0.5388
 epoch: 72, train_loss: 0.8090, test_loss: 1.3553, test_f1: 0.5279
 epoch: 73, train_loss: 0.7987, test_loss: 1.3697, test_f1: 0.5438
 epoch: 74, train_loss: 0.7951, test_loss: 1.3391, test_f1: 0.5356
 epoch: 75, train_loss: 0.7959, test_loss: 1.3427, test_f1: 0.5440
 epoch: 76, train_loss: 0.7908, test_loss: 1.3447, test_f1: 0.5702
 epoch: 77, train_loss: 0.7912, test_loss: 1.3756, test_f1: 0.5354
 epoch: 78, train_loss: 0.8060, test_loss: 1.3883, test_f1: 0.5320
 epoch: 79, train_loss: 0.7916, test_loss: 1.3627, test_f1: 0.5619
 epoch: 80, train_loss: 0.7970, test_loss: 1.3563, test_f1: 0.5545
 epoch: 81, train_loss: 0.7959, test_loss: 1.3803, test_f1: 0.5624
 epoch: 82, train_loss: 0.7915, test_loss: 1.4249, test_f1: 0.5391
 epoch: 83, train_loss: 0.7880, test_loss: 1.3697, test_f1: 0.5625
 epoch: 84, train_loss: 0.7977, test_loss: 1.3934, test_f1: 0.5726
 epoch: 85, train_loss: 0.7829, test_loss: 1.3549, test_f1: 0.5622
 epoch: 86, train_loss: 0.7895, test_loss: 1.3876, test_f1: 0.5704
 epoch: 87, train_loss: 0.8002, test_loss: 1.4188, test_f1: 0.5540
 epoch: 88, train_loss: 0.7719, test_loss: 1.3652, test_f1: 0.5573
 epoch: 89, train_loss: 0.7840, test_loss: 1.4184, test_f1: 0.5644
 epoch: 90, train_loss: 0.7842, test_loss: 1.4515, test_f1: 0.5526
 epoch: 91, train_loss: 0.7666, test_loss: 1.4253, test_f1: 0.5519
 epoch: 92, train_loss: 0.7906, test_loss: 1.4289, test_f1: 0.5570
 epoch: 93, train_loss: 0.7687, test_loss: 1.4214, test_f1: 0.5433
 epoch: 94, train_loss: 0.7851, test_loss: 1.4126, test_f1: 0.5386
 epoch: 95, train_loss: 0.7689, test_loss: 1.4419, test_f1: 0.5435
 epoch: 96, train_loss: 0.7689, test_loss: 1.4395, test_f1: 0.5551
 epoch: 97, train_loss: 0.7687, test_loss: 1.4071, test_f1: 0.5544
 epoch: 98, train_loss: 0.7829, test_loss: 1.4327, test_f1: 0.5492
 epoch: 99, train_loss: 0.7640, test_loss: 1.4211, test_f1: 0.5518
##################ITERATION #9 ****************************************
 epoch: 0, train_loss: 1.3577, test_loss: 1.3602, test_f1: 0.2308
 epoch: 1, train_loss: 1.2710, test_loss: 1.3240, test_f1: 0.3453
 epoch: 2, train_loss: 1.2301, test_loss: 1.3115, test_f1: 0.3571
 epoch: 3, train_loss: 1.2083, test_loss: 1.3091, test_f1: 0.4126
 epoch: 4, train_loss: 1.2096, test_loss: 1.2872, test_f1: 0.4089
 epoch: 5, train_loss: 1.1747, test_loss: 1.2783, test_f1: 0.4295
 epoch: 6, train_loss: 1.1641, test_loss: 1.2590, test_f1: 0.4722
 epoch: 7, train_loss: 1.1446, test_loss: 1.2369, test_f1: 0.4902
 epoch: 8, train_loss: 1.1503, test_loss: 1.2378, test_f1: 0.4719
 epoch: 9, train_loss: 1.0997, test_loss: 1.2415, test_f1: 0.4511
 epoch: 10, train_loss: 1.0979, test_loss: 1.2279, test_f1: 0.4633
 epoch: 11, train_loss: 1.0999, test_loss: 1.2241, test_f1: 0.4734
 epoch: 12, train_loss: 1.0918, test_loss: 1.2174, test_f1: 0.4735
 epoch: 13, train_loss: 1.0537, test_loss: 1.2069, test_f1: 0.4841
 epoch: 14, train_loss: 1.0587, test_loss: 1.1964, test_f1: 0.4915
 epoch: 15, train_loss: 1.0559, test_loss: 1.2038, test_f1: 0.4974
 epoch: 16, train_loss: 1.0464, test_loss: 1.2040, test_f1: 0.5107
 epoch: 17, train_loss: 1.0282, test_loss: 1.1957, test_f1: 0.4978
 epoch: 18, train_loss: 1.0089, test_loss: 1.1901, test_f1: 0.5038
 epoch: 19, train_loss: 0.9996, test_loss: 1.2014, test_f1: 0.4776
 epoch: 20, train_loss: 0.9969, test_loss: 1.1894, test_f1: 0.4847
 epoch: 21, train_loss: 1.0018, test_loss: 1.2066, test_f1: 0.4654
 epoch: 22, train_loss: 0.9889, test_loss: 1.1698, test_f1: 0.4983
 epoch: 23, train_loss: 0.9782, test_loss: 1.1759, test_f1: 0.5007
 epoch: 24, train_loss: 0.9851, test_loss: 1.1725, test_f1: 0.5142
 epoch: 25, train_loss: 0.9456, test_loss: 1.1690, test_f1: 0.4990
 epoch: 26, train_loss: 0.9533, test_loss: 1.1676, test_f1: 0.5140
 epoch: 27, train_loss: 0.9637, test_loss: 1.1569, test_f1: 0.4936
 epoch: 28, train_loss: 0.9557, test_loss: 1.1768, test_f1: 0.4892
 epoch: 29, train_loss: 0.9392, test_loss: 1.1626, test_f1: 0.4910
 epoch: 30, train_loss: 0.9447, test_loss: 1.1578, test_f1: 0.4826
 epoch: 31, train_loss: 0.9420, test_loss: 1.1825, test_f1: 0.4502
 epoch: 32, train_loss: 0.9261, test_loss: 1.1742, test_f1: 0.4983
 epoch: 33, train_loss: 0.9299, test_loss: 1.1699, test_f1: 0.5142
 epoch: 34, train_loss: 0.9206, test_loss: 1.1790, test_f1: 0.4803
 epoch: 35, train_loss: 0.9052, test_loss: 1.1604, test_f1: 0.4752
 epoch: 36, train_loss: 0.9186, test_loss: 1.1661, test_f1: 0.4820
 epoch: 37, train_loss: 0.9176, test_loss: 1.1494, test_f1: 0.5035
 epoch: 38, train_loss: 0.9129, test_loss: 1.1429, test_f1: 0.4902
 epoch: 39, train_loss: 0.8922, test_loss: 1.1399, test_f1: 0.4778
 epoch: 40, train_loss: 0.8926, test_loss: 1.1587, test_f1: 0.4834
 epoch: 41, train_loss: 0.8920, test_loss: 1.1410, test_f1: 0.4878
 epoch: 42, train_loss: 0.8888, test_loss: 1.1987, test_f1: 0.4584
 epoch: 43, train_loss: 0.8969, test_loss: 1.1418, test_f1: 0.4799
 epoch: 44, train_loss: 0.8708, test_loss: 1.1604, test_f1: 0.4702
 epoch: 45, train_loss: 0.8629, test_loss: 1.1730, test_f1: 0.4964
 epoch: 46, train_loss: 0.8713, test_loss: 1.1634, test_f1: 0.4807
 epoch: 47, train_loss: 0.8782, test_loss: 1.1782, test_f1: 0.4714
 epoch: 48, train_loss: 0.8578, test_loss: 1.1676, test_f1: 0.4767
 epoch: 49, train_loss: 0.8532, test_loss: 1.2084, test_f1: 0.4423
 epoch: 50, train_loss: 0.8518, test_loss: 1.1736, test_f1: 0.4816
 epoch: 51, train_loss: 0.8457, test_loss: 1.1704, test_f1: 0.4841
 epoch: 52, train_loss: 0.8528, test_loss: 1.2063, test_f1: 0.4783
 epoch: 53, train_loss: 0.8361, test_loss: 1.2261, test_f1: 0.4844
 epoch: 54, train_loss: 0.8419, test_loss: 1.2077, test_f1: 0.4780
 epoch: 55, train_loss: 0.8422, test_loss: 1.2216, test_f1: 0.4782
 epoch: 56, train_loss: 0.8446, test_loss: 1.2236, test_f1: 0.4688
 epoch: 57, train_loss: 0.8370, test_loss: 1.2279, test_f1: 0.4750
 epoch: 58, train_loss: 0.8405, test_loss: 1.2430, test_f1: 0.4584
 epoch: 59, train_loss: 0.8404, test_loss: 1.2329, test_f1: 0.4724
 epoch: 60, train_loss: 0.8294, test_loss: 1.2468, test_f1: 0.4687
 epoch: 61, train_loss: 0.8303, test_loss: 1.2357, test_f1: 0.4857
 epoch: 62, train_loss: 0.8222, test_loss: 1.2344, test_f1: 0.4866
 epoch: 63, train_loss: 0.8323, test_loss: 1.2320, test_f1: 0.4746
 epoch: 64, train_loss: 0.8227, test_loss: 1.2582, test_f1: 0.4637
 epoch: 65, train_loss: 0.8335, test_loss: 1.2151, test_f1: 0.4841
 epoch: 66, train_loss: 0.8284, test_loss: 1.2108, test_f1: 0.4912
 epoch: 67, train_loss: 0.8262, test_loss: 1.2511, test_f1: 0.4644
 epoch: 68, train_loss: 0.8206, test_loss: 1.2418, test_f1: 0.4681
 epoch: 69, train_loss: 0.8264, test_loss: 1.2430, test_f1: 0.4849
 epoch: 70, train_loss: 0.8246, test_loss: 1.3035, test_f1: 0.4908
 epoch: 71, train_loss: 0.8205, test_loss: 1.2583, test_f1: 0.4734
 epoch: 72, train_loss: 0.8168, test_loss: 1.2715, test_f1: 0.4842
 epoch: 73, train_loss: 0.8270, test_loss: 1.2495, test_f1: 0.4766
 epoch: 74, train_loss: 0.8140, test_loss: 1.3039, test_f1: 0.4734
 epoch: 75, train_loss: 0.7973, test_loss: 1.2843, test_f1: 0.4827
 epoch: 76, train_loss: 0.8073, test_loss: 1.3288, test_f1: 0.4822
 epoch: 77, train_loss: 0.8180, test_loss: 1.3287, test_f1: 0.4648
 epoch: 78, train_loss: 0.8094, test_loss: 1.2479, test_f1: 0.4989
 epoch: 79, train_loss: 0.8072, test_loss: 1.3139, test_f1: 0.4892
 epoch: 80, train_loss: 0.8116, test_loss: 1.3429, test_f1: 0.4697
 epoch: 81, train_loss: 0.8040, test_loss: 1.3285, test_f1: 0.4642
 epoch: 82, train_loss: 0.7953, test_loss: 1.3137, test_f1: 0.4738
 epoch: 83, train_loss: 0.8037, test_loss: 1.3455, test_f1: 0.4839
 epoch: 84, train_loss: 0.7982, test_loss: 1.3347, test_f1: 0.4812
 epoch: 85, train_loss: 0.7824, test_loss: 1.3480, test_f1: 0.4895
 epoch: 86, train_loss: 0.7920, test_loss: 1.3608, test_f1: 0.4731
 epoch: 87, train_loss: 0.7836, test_loss: 1.3072, test_f1: 0.4950
 epoch: 88, train_loss: 0.7984, test_loss: 1.3348, test_f1: 0.4786
 epoch: 89, train_loss: 0.7844, test_loss: 1.3132, test_f1: 0.4936
 epoch: 90, train_loss: 0.7869, test_loss: 1.3294, test_f1: 0.4824
 epoch: 91, train_loss: 0.7697, test_loss: 1.3556, test_f1: 0.4792
 epoch: 92, train_loss: 0.7784, test_loss: 1.3503, test_f1: 0.4849
 epoch: 93, train_loss: 0.7852, test_loss: 1.3159, test_f1: 0.4873
 epoch: 94, train_loss: 0.7805, test_loss: 1.3438, test_f1: 0.4880
 epoch: 95, train_loss: 0.7773, test_loss: 1.3569, test_f1: 0.4887
 epoch: 96, train_loss: 0.7977, test_loss: 1.3049, test_f1: 0.4822
 epoch: 97, train_loss: 0.7679, test_loss: 1.3457, test_f1: 0.4954
 epoch: 98, train_loss: 0.7731, test_loss: 1.3609, test_f1: 0.4812
 epoch: 99, train_loss: 0.7738, test_loss: 1.3199, test_f1: 0.4896

Training completed in 372.00 seconds
Best F1: 0.6077 at epoch 84
Mean F1 across iterations: 0.5710  0.0273
========================FINAL RESULTS================================
FEGIN weighted F1: 0.6077  0.0273
python main.py --data ltspice_demos --representation component_component --model FEGIN --layers 2 --hiddens 64 --batch_size 64 --lr 0.0001 --emb_size 128 --epochs 100 --save_appendix component_component_L2_H64_BS64_LR0.0001_E128 --no_val
-----



STDERR:
  File "main.py", line 370, in <module>
    main()
  File "main.py", line 254, in main
    dataset = dataset_class(
  File "/home/philip/projects/ltspice_examples_code_repo/Circuit-Completion-Using-GNNs/component_classification_with_link_prediction_head/evaluation/FEGIN/kernel/circuit_datasets.py", line 15, in __init__
    self.data, self.slices = torch.load(self.processed_paths[0])
  File "/home/philip/.local/lib/python3.8/site-packages/torch/serialization.py", line 1040, in load
    warnings.warn(
  File "/usr/lib/python3.8/warnings.py", line 109, in _showwarnmsg
    sw(msg.message, msg.category, msg.filename, msg.lineno,
  File "main.py", line 47, in warn_with_traceback
    traceback.print_stack(file=log)
/home/philip/projects/ltspice_examples_code_repo/Circuit-Completion-Using-GNNs/component_classification_with_link_prediction_head/evaluation/FEGIN/kernel/circuit_datasets.py:15: FutureWarning: You are using `torch.load` with `weights_only=False` (the current default value), which uses the default pickle module implicitly. It is possible to construct malicious pickle data which will execute arbitrary code during unpickling (See https://github.com/pytorch/pytorch/blob/main/SECURITY.md#untrusted-models for more details). In a future release, the default value for `weights_only` will be flipped to `True`. This limits the functions that could be executed during unpickling. Arbitrary objects will no longer be allowed to be loaded via this mode unless they are explicitly allowlisted by the user via `torch.serialization.add_safe_globals`. We recommend you start setting `weights_only=True` for any use case where you don't have full control of the loaded file. Please open an issue on GitHub for any issues related to this experimental feature.
  self.data, self.slices = torch.load(self.processed_paths[0])
