STDOUT:
Results will be saved in /home/philip/projects/ltspice_examples_code_repo/Circuit-Completion-Using-GNNs/component_classification_with_link_prediction_head/evaluation/FEGIN/results/model_FEGIN_dataset_ltspice_examples
Command line input: python main.py --data ltspice_examples --representation component_net --model FEGIN --layers 4 --hiddens 32 --batch_size 128 --lr 0.01 --emb_size 250 --epochs 100 --save_appendix component_net_L4_H32_BS128_LR0.01_E250 --no_val
 is saved.
-----
ltspice_examples - FEGIN
Using 4 layers, 32 hidden units, h = 2
Loading component_net representation dataset
ENTERED
Training FEGIN on component_net representation
Train: 3558, Test: 846
##################ITERATION #0 ****************************************
 epoch: 0, train_loss: 1.2337, test_loss: 1.3154, test_f1: 0.2728
 epoch: 1, train_loss: 1.0472, test_loss: 1.1043, test_f1: 0.4007
 epoch: 2, train_loss: 0.9792, test_loss: 1.0093, test_f1: 0.4758
 epoch: 3, train_loss: 0.9506, test_loss: 0.9667, test_f1: 0.5134
 epoch: 4, train_loss: 0.9538, test_loss: 0.9363, test_f1: 0.4922
 epoch: 5, train_loss: 0.9234, test_loss: 0.9423, test_f1: 0.5047
 epoch: 6, train_loss: 0.9139, test_loss: 0.9615, test_f1: 0.5243
 epoch: 7, train_loss: 0.8915, test_loss: 1.0268, test_f1: 0.4579
 epoch: 8, train_loss: 0.8811, test_loss: 0.9103, test_f1: 0.5117
 epoch: 9, train_loss: 0.8748, test_loss: 0.9572, test_f1: 0.4949
 epoch: 10, train_loss: 0.8704, test_loss: 0.9875, test_f1: 0.5188
 epoch: 11, train_loss: 0.8702, test_loss: 1.0675, test_f1: 0.5272
 epoch: 12, train_loss: 0.8530, test_loss: 1.0834, test_f1: 0.5106
 epoch: 13, train_loss: 0.8596, test_loss: 0.9526, test_f1: 0.5364
 epoch: 14, train_loss: 0.8514, test_loss: 0.8694, test_f1: 0.5437
 epoch: 15, train_loss: 0.8407, test_loss: 0.9504, test_f1: 0.5389
 epoch: 16, train_loss: 0.8330, test_loss: 0.9511, test_f1: 0.5880
 epoch: 17, train_loss: 0.8157, test_loss: 1.0098, test_f1: 0.5615
 epoch: 18, train_loss: 0.8280, test_loss: 0.9262, test_f1: 0.5361
 epoch: 19, train_loss: 0.8119, test_loss: 0.9198, test_f1: 0.5404
 epoch: 20, train_loss: 0.7995, test_loss: 1.0315, test_f1: 0.5150
 epoch: 21, train_loss: 0.7954, test_loss: 0.9917, test_f1: 0.5485
 epoch: 22, train_loss: 0.7783, test_loss: 1.4832, test_f1: 0.4638
 epoch: 23, train_loss: 0.7718, test_loss: 1.0818, test_f1: 0.5376
 epoch: 24, train_loss: 0.7858, test_loss: 1.0461, test_f1: 0.5800
 epoch: 25, train_loss: 0.7748, test_loss: 1.2815, test_f1: 0.5470
 epoch: 26, train_loss: 0.7720, test_loss: 0.9897, test_f1: 0.5582
 epoch: 27, train_loss: 0.7620, test_loss: 0.9968, test_f1: 0.5616
 epoch: 28, train_loss: 0.7777, test_loss: 1.2875, test_f1: 0.5291
 epoch: 29, train_loss: 0.7427, test_loss: 1.0055, test_f1: 0.5940
 epoch: 30, train_loss: 0.7711, test_loss: 1.1576, test_f1: 0.5183
 epoch: 31, train_loss: 0.7642, test_loss: 1.1052, test_f1: 0.6049
 epoch: 32, train_loss: 0.7383, test_loss: 1.0790, test_f1: 0.5539
 epoch: 33, train_loss: 0.7483, test_loss: 1.1193, test_f1: 0.5287
 epoch: 34, train_loss: 0.7458, test_loss: 1.3968, test_f1: 0.4980
 epoch: 35, train_loss: 0.7359, test_loss: 1.0076, test_f1: 0.5790
 epoch: 36, train_loss: 0.7201, test_loss: 1.0384, test_f1: 0.6051
 epoch: 37, train_loss: 0.7192, test_loss: 1.0387, test_f1: 0.6036
 epoch: 38, train_loss: 0.7470, test_loss: 1.0617, test_f1: 0.5727
 epoch: 39, train_loss: 0.7132, test_loss: 1.1680, test_f1: 0.5922
 epoch: 40, train_loss: 0.7103, test_loss: 1.1600, test_f1: 0.5099
 epoch: 41, train_loss: 0.7206, test_loss: 0.9997, test_f1: 0.5804
 epoch: 42, train_loss: 0.7230, test_loss: 1.1210, test_f1: 0.5704
 epoch: 43, train_loss: 0.7127, test_loss: 1.4359, test_f1: 0.5388
 epoch: 44, train_loss: 0.7066, test_loss: 1.1115, test_f1: 0.5963
 epoch: 45, train_loss: 0.7015, test_loss: 1.0321, test_f1: 0.6134
 epoch: 46, train_loss: 0.7087, test_loss: 0.9630, test_f1: 0.6208
 epoch: 47, train_loss: 0.7053, test_loss: 1.0071, test_f1: 0.5423
 epoch: 48, train_loss: 0.6972, test_loss: 1.0303, test_f1: 0.6164
 epoch: 49, train_loss: 0.7089, test_loss: 0.9811, test_f1: 0.5997
 epoch: 50, train_loss: 0.6873, test_loss: 1.0162, test_f1: 0.6416
 epoch: 51, train_loss: 0.6586, test_loss: 1.0956, test_f1: 0.6070
 epoch: 52, train_loss: 0.6441, test_loss: 1.0709, test_f1: 0.6161
 epoch: 53, train_loss: 0.6370, test_loss: 1.0815, test_f1: 0.5998
 epoch: 54, train_loss: 0.6297, test_loss: 1.0661, test_f1: 0.6183
 epoch: 55, train_loss: 0.6441, test_loss: 1.0034, test_f1: 0.6387
 epoch: 56, train_loss: 0.6214, test_loss: 1.0555, test_f1: 0.6198
 epoch: 57, train_loss: 0.6213, test_loss: 0.9698, test_f1: 0.6420
 epoch: 58, train_loss: 0.6231, test_loss: 0.9737, test_f1: 0.6582
 epoch: 59, train_loss: 0.6006, test_loss: 1.0001, test_f1: 0.6405
 epoch: 60, train_loss: 0.6366, test_loss: 0.9696, test_f1: 0.6418
 epoch: 61, train_loss: 0.6218, test_loss: 1.0442, test_f1: 0.6284
 epoch: 62, train_loss: 0.6207, test_loss: 1.0420, test_f1: 0.6173
 epoch: 63, train_loss: 0.6042, test_loss: 1.0171, test_f1: 0.6430
 epoch: 64, train_loss: 0.6044, test_loss: 1.0077, test_f1: 0.6379
 epoch: 65, train_loss: 0.5841, test_loss: 0.9836, test_f1: 0.6328
 epoch: 66, train_loss: 0.5952, test_loss: 0.9620, test_f1: 0.6547
 epoch: 67, train_loss: 0.5977, test_loss: 1.2072, test_f1: 0.6239
 epoch: 68, train_loss: 0.6089, test_loss: 0.9744, test_f1: 0.6582
 epoch: 69, train_loss: 0.5895, test_loss: 1.0428, test_f1: 0.6246
 epoch: 70, train_loss: 0.5847, test_loss: 1.1117, test_f1: 0.6441
 epoch: 71, train_loss: 0.5852, test_loss: 1.0960, test_f1: 0.6173
 epoch: 72, train_loss: 0.5870, test_loss: 1.1256, test_f1: 0.6329
 epoch: 73, train_loss: 0.5724, test_loss: 1.1004, test_f1: 0.6460
 epoch: 74, train_loss: 0.5724, test_loss: 1.0807, test_f1: 0.6415
 epoch: 75, train_loss: 0.5821, test_loss: 1.2574, test_f1: 0.6166
 epoch: 76, train_loss: 0.5799, test_loss: 1.1250, test_f1: 0.6456
 epoch: 77, train_loss: 0.5862, test_loss: 1.1137, test_f1: 0.6228
 epoch: 78, train_loss: 0.5674, test_loss: 1.0455, test_f1: 0.6763
 epoch: 79, train_loss: 0.5714, test_loss: 1.0875, test_f1: 0.6551
 epoch: 80, train_loss: 0.5619, test_loss: 1.1638, test_f1: 0.6468
 epoch: 81, train_loss: 0.5749, test_loss: 1.1169, test_f1: 0.6494
 epoch: 82, train_loss: 0.5642, test_loss: 1.3402, test_f1: 0.6011
 epoch: 83, train_loss: 0.5765, test_loss: 0.9708, test_f1: 0.6535
 epoch: 84, train_loss: 0.5465, test_loss: 1.1091, test_f1: 0.6584
 epoch: 85, train_loss: 0.5630, test_loss: 1.1371, test_f1: 0.6587
 epoch: 86, train_loss: 0.5668, test_loss: 1.1535, test_f1: 0.6382
 epoch: 87, train_loss: 0.5668, test_loss: 1.0782, test_f1: 0.6279
 epoch: 88, train_loss: 0.5546, test_loss: 1.1209, test_f1: 0.6471
 epoch: 89, train_loss: 0.5527, test_loss: 1.1679, test_f1: 0.6695
 epoch: 90, train_loss: 0.5487, test_loss: 1.1275, test_f1: 0.6485
 epoch: 91, train_loss: 0.5445, test_loss: 1.1177, test_f1: 0.6374
 epoch: 92, train_loss: 0.5580, test_loss: 1.2119, test_f1: 0.6401
 epoch: 93, train_loss: 0.5353, test_loss: 1.2350, test_f1: 0.6555
 epoch: 94, train_loss: 0.5245, test_loss: 1.0611, test_f1: 0.6775
 epoch: 95, train_loss: 0.5266, test_loss: 1.1688, test_f1: 0.6408
 epoch: 96, train_loss: 0.5366, test_loss: 1.2161, test_f1: 0.6456
 epoch: 97, train_loss: 0.5330, test_loss: 1.2542, test_f1: 0.6652
 epoch: 98, train_loss: 0.5354, test_loss: 1.1910, test_f1: 0.6747
 epoch: 99, train_loss: 0.5408, test_loss: 1.1878, test_f1: 0.6615
##################ITERATION #1 ****************************************
 epoch: 0, train_loss: 1.1901, test_loss: 1.1928, test_f1: 0.3124
 epoch: 1, train_loss: 1.0308, test_loss: 1.0146, test_f1: 0.4384
 epoch: 2, train_loss: 0.9862, test_loss: 1.0114, test_f1: 0.4909
 epoch: 3, train_loss: 0.9549, test_loss: 1.0448, test_f1: 0.4588
 epoch: 4, train_loss: 0.9544, test_loss: 1.0456, test_f1: 0.5043
 epoch: 5, train_loss: 0.9438, test_loss: 0.9423, test_f1: 0.5113
 epoch: 6, train_loss: 0.9143, test_loss: 1.0347, test_f1: 0.5040
 epoch: 7, train_loss: 0.9215, test_loss: 0.9396, test_f1: 0.5199
 epoch: 8, train_loss: 0.9013, test_loss: 0.9071, test_f1: 0.4991
 epoch: 9, train_loss: 0.8914, test_loss: 0.9611, test_f1: 0.5191
 epoch: 10, train_loss: 0.8804, test_loss: 0.9654, test_f1: 0.5026
 epoch: 11, train_loss: 0.8732, test_loss: 0.9906, test_f1: 0.5145
 epoch: 12, train_loss: 0.8668, test_loss: 0.9332, test_f1: 0.5277
 epoch: 13, train_loss: 0.8703, test_loss: 0.9786, test_f1: 0.5410
 epoch: 14, train_loss: 0.8611, test_loss: 0.8805, test_f1: 0.5917
 epoch: 15, train_loss: 0.8289, test_loss: 0.8843, test_f1: 0.5551
 epoch: 16, train_loss: 0.8393, test_loss: 0.8881, test_f1: 0.5519
 epoch: 17, train_loss: 0.8364, test_loss: 0.9531, test_f1: 0.5551
 epoch: 18, train_loss: 0.8269, test_loss: 0.9529, test_f1: 0.4819
 epoch: 19, train_loss: 0.8229, test_loss: 0.9447, test_f1: 0.5548
 epoch: 20, train_loss: 0.8309, test_loss: 0.9400, test_f1: 0.5203
 epoch: 21, train_loss: 0.8151, test_loss: 0.9069, test_f1: 0.5676
 epoch: 22, train_loss: 0.8047, test_loss: 0.8975, test_f1: 0.5698
 epoch: 23, train_loss: 0.8109, test_loss: 0.8705, test_f1: 0.5703
 epoch: 24, train_loss: 0.7893, test_loss: 0.8685, test_f1: 0.5694
 epoch: 25, train_loss: 0.7740, test_loss: 0.9327, test_f1: 0.5586
 epoch: 26, train_loss: 0.7750, test_loss: 0.8998, test_f1: 0.6065
 epoch: 27, train_loss: 0.7862, test_loss: 0.8894, test_f1: 0.5976
 epoch: 28, train_loss: 0.7627, test_loss: 0.8924, test_f1: 0.5973
 epoch: 29, train_loss: 0.7749, test_loss: 0.9770, test_f1: 0.5526
 epoch: 30, train_loss: 0.7605, test_loss: 0.9408, test_f1: 0.5997
 epoch: 31, train_loss: 0.7312, test_loss: 0.9155, test_f1: 0.5933
 epoch: 32, train_loss: 0.7809, test_loss: 0.9293, test_f1: 0.5287
 epoch: 33, train_loss: 0.7877, test_loss: 0.8713, test_f1: 0.5761
 epoch: 34, train_loss: 0.7654, test_loss: 1.0036, test_f1: 0.5872
 epoch: 35, train_loss: 0.7499, test_loss: 0.8478, test_f1: 0.6142
 epoch: 36, train_loss: 0.7291, test_loss: 0.9474, test_f1: 0.6018
 epoch: 37, train_loss: 0.7453, test_loss: 0.9761, test_f1: 0.5718
 epoch: 38, train_loss: 0.7407, test_loss: 0.8579, test_f1: 0.6014
 epoch: 39, train_loss: 0.7111, test_loss: 0.9055, test_f1: 0.6231
 epoch: 40, train_loss: 0.7099, test_loss: 0.8211, test_f1: 0.5531
 epoch: 41, train_loss: 0.7106, test_loss: 0.8712, test_f1: 0.5755
 epoch: 42, train_loss: 0.7074, test_loss: 0.8288, test_f1: 0.6226
 epoch: 43, train_loss: 0.7066, test_loss: 0.8421, test_f1: 0.5779
 epoch: 44, train_loss: 0.7059, test_loss: 0.8461, test_f1: 0.6215
 epoch: 45, train_loss: 0.7090, test_loss: 0.9115, test_f1: 0.5774
 epoch: 46, train_loss: 0.6980, test_loss: 0.9083, test_f1: 0.6004
 epoch: 47, train_loss: 0.7072, test_loss: 0.9917, test_f1: 0.5763
 epoch: 48, train_loss: 0.6949, test_loss: 0.9443, test_f1: 0.6214
 epoch: 49, train_loss: 0.6782, test_loss: 0.9540, test_f1: 0.6290
 epoch: 50, train_loss: 0.6843, test_loss: 0.9496, test_f1: 0.6374
 epoch: 51, train_loss: 0.6471, test_loss: 0.9346, test_f1: 0.6105
 epoch: 52, train_loss: 0.6336, test_loss: 0.9120, test_f1: 0.6274
 epoch: 53, train_loss: 0.6254, test_loss: 0.9846, test_f1: 0.5935
 epoch: 54, train_loss: 0.6242, test_loss: 1.0051, test_f1: 0.6196
 epoch: 55, train_loss: 0.6243, test_loss: 0.9263, test_f1: 0.6269
 epoch: 56, train_loss: 0.6049, test_loss: 0.9409, test_f1: 0.6253
 epoch: 57, train_loss: 0.6188, test_loss: 0.9543, test_f1: 0.6412
 epoch: 58, train_loss: 0.6107, test_loss: 0.9996, test_f1: 0.6303
 epoch: 59, train_loss: 0.5975, test_loss: 0.9215, test_f1: 0.6143
 epoch: 60, train_loss: 0.5852, test_loss: 1.0441, test_f1: 0.6074
 epoch: 61, train_loss: 0.6095, test_loss: 1.0112, test_f1: 0.6563
 epoch: 62, train_loss: 0.5991, test_loss: 0.9754, test_f1: 0.6028
 epoch: 63, train_loss: 0.5865, test_loss: 0.9715, test_f1: 0.6238
 epoch: 64, train_loss: 0.5617, test_loss: 1.0729, test_f1: 0.6169
 epoch: 65, train_loss: 0.5770, test_loss: 0.9978, test_f1: 0.6549
 epoch: 66, train_loss: 0.5811, test_loss: 1.0267, test_f1: 0.6598
 epoch: 67, train_loss: 0.5908, test_loss: 1.0339, test_f1: 0.6154
 epoch: 68, train_loss: 0.6050, test_loss: 1.0184, test_f1: 0.6612
 epoch: 69, train_loss: 0.5921, test_loss: 1.0175, test_f1: 0.6517
 epoch: 70, train_loss: 0.5785, test_loss: 1.0197, test_f1: 0.6459
 epoch: 71, train_loss: 0.5715, test_loss: 1.0196, test_f1: 0.6402
 epoch: 72, train_loss: 0.5790, test_loss: 1.0619, test_f1: 0.6455
 epoch: 73, train_loss: 0.5673, test_loss: 1.0269, test_f1: 0.6482
 epoch: 74, train_loss: 0.5553, test_loss: 0.9525, test_f1: 0.6329
 epoch: 75, train_loss: 0.5599, test_loss: 0.9966, test_f1: 0.6217
 epoch: 76, train_loss: 0.5448, test_loss: 1.0085, test_f1: 0.6083
 epoch: 77, train_loss: 0.5551, test_loss: 1.0336, test_f1: 0.6216
 epoch: 78, train_loss: 0.5601, test_loss: 1.0139, test_f1: 0.6735
 epoch: 79, train_loss: 0.5439, test_loss: 1.0415, test_f1: 0.6431
 epoch: 80, train_loss: 0.5843, test_loss: 0.9915, test_f1: 0.6122
 epoch: 81, train_loss: 0.5511, test_loss: 1.0664, test_f1: 0.6519
 epoch: 82, train_loss: 0.5401, test_loss: 1.1560, test_f1: 0.6014
 epoch: 83, train_loss: 0.5377, test_loss: 0.9768, test_f1: 0.6171
 epoch: 84, train_loss: 0.5169, test_loss: 1.0773, test_f1: 0.6447
 epoch: 85, train_loss: 0.5356, test_loss: 0.9929, test_f1: 0.6293
 epoch: 86, train_loss: 0.5279, test_loss: 0.9931, test_f1: 0.6428
 epoch: 87, train_loss: 0.5377, test_loss: 1.0889, test_f1: 0.6406
 epoch: 88, train_loss: 0.5442, test_loss: 1.0244, test_f1: 0.6626
 epoch: 89, train_loss: 0.5286, test_loss: 1.0039, test_f1: 0.6457
 epoch: 90, train_loss: 0.5473, test_loss: 1.0951, test_f1: 0.6362
 epoch: 91, train_loss: 0.5331, test_loss: 1.0391, test_f1: 0.6221
 epoch: 92, train_loss: 0.5277, test_loss: 1.0367, test_f1: 0.6419
 epoch: 93, train_loss: 0.5114, test_loss: 1.1212, test_f1: 0.6355
 epoch: 94, train_loss: 0.5281, test_loss: 1.0902, test_f1: 0.6151
 epoch: 95, train_loss: 0.5233, test_loss: 1.1091, test_f1: 0.6014
 epoch: 96, train_loss: 0.5203, test_loss: 1.0288, test_f1: 0.6427
 epoch: 97, train_loss: 0.5040, test_loss: 1.0884, test_f1: 0.6564
 epoch: 98, train_loss: 0.4947, test_loss: 1.1650, test_f1: 0.6259
 epoch: 99, train_loss: 0.5160, test_loss: 1.0620, test_f1: 0.6265
##################ITERATION #2 ****************************************
 epoch: 0, train_loss: 1.2112, test_loss: 1.1050, test_f1: 0.3623
 epoch: 1, train_loss: 1.0355, test_loss: 1.0749, test_f1: 0.4422
 epoch: 2, train_loss: 0.9773, test_loss: 0.9590, test_f1: 0.5051
 epoch: 3, train_loss: 0.9562, test_loss: 0.9832, test_f1: 0.4935
 epoch: 4, train_loss: 0.9290, test_loss: 0.9412, test_f1: 0.5130
 epoch: 5, train_loss: 0.9325, test_loss: 1.0002, test_f1: 0.5212
 epoch: 6, train_loss: 0.9240, test_loss: 0.9536, test_f1: 0.4854
 epoch: 7, train_loss: 0.9056, test_loss: 0.9444, test_f1: 0.4695
 epoch: 8, train_loss: 0.8955, test_loss: 1.2288, test_f1: 0.4680
 epoch: 9, train_loss: 0.8920, test_loss: 0.9140, test_f1: 0.5243
 epoch: 10, train_loss: 0.8811, test_loss: 1.0255, test_f1: 0.4781
 epoch: 11, train_loss: 0.8800, test_loss: 0.9834, test_f1: 0.4944
 epoch: 12, train_loss: 0.8810, test_loss: 0.9369, test_f1: 0.5180
 epoch: 13, train_loss: 0.8668, test_loss: 0.9389, test_f1: 0.5092
 epoch: 14, train_loss: 0.8721, test_loss: 0.8663, test_f1: 0.5548
 epoch: 15, train_loss: 0.8669, test_loss: 0.9638, test_f1: 0.5614
 epoch: 16, train_loss: 0.8427, test_loss: 0.9266, test_f1: 0.5266
 epoch: 17, train_loss: 0.8298, test_loss: 0.9190, test_f1: 0.5475
 epoch: 18, train_loss: 0.8421, test_loss: 0.9342, test_f1: 0.5289
 epoch: 19, train_loss: 0.8285, test_loss: 0.9706, test_f1: 0.5669
 epoch: 20, train_loss: 0.8244, test_loss: 0.9279, test_f1: 0.5798
 epoch: 21, train_loss: 0.8056, test_loss: 0.9020, test_f1: 0.5757
 epoch: 22, train_loss: 0.8103, test_loss: 0.9426, test_f1: 0.5585
 epoch: 23, train_loss: 0.7896, test_loss: 1.0326, test_f1: 0.5556
 epoch: 24, train_loss: 0.8067, test_loss: 0.9514, test_f1: 0.5286
 epoch: 25, train_loss: 0.7914, test_loss: 0.9653, test_f1: 0.5843
 epoch: 26, train_loss: 0.7824, test_loss: 0.9853, test_f1: 0.5353
 epoch: 27, train_loss: 0.7785, test_loss: 0.9475, test_f1: 0.5884
 epoch: 28, train_loss: 0.7683, test_loss: 1.0040, test_f1: 0.5768
 epoch: 29, train_loss: 0.7585, test_loss: 1.1997, test_f1: 0.5061
 epoch: 30, train_loss: 0.7838, test_loss: 1.0297, test_f1: 0.5322
 epoch: 31, train_loss: 0.7682, test_loss: 1.1240, test_f1: 0.5449
 epoch: 32, train_loss: 0.7630, test_loss: 1.0515, test_f1: 0.6241
 epoch: 33, train_loss: 0.7687, test_loss: 0.9745, test_f1: 0.5884
 epoch: 34, train_loss: 0.7463, test_loss: 0.9776, test_f1: 0.6109
 epoch: 35, train_loss: 0.7373, test_loss: 0.8958, test_f1: 0.6170
 epoch: 36, train_loss: 0.7292, test_loss: 1.0082, test_f1: 0.6510
 epoch: 37, train_loss: 0.7205, test_loss: 0.9906, test_f1: 0.5813
 epoch: 38, train_loss: 0.7424, test_loss: 0.9829, test_f1: 0.5901
 epoch: 39, train_loss: 0.7201, test_loss: 0.9574, test_f1: 0.6168
 epoch: 40, train_loss: 0.7267, test_loss: 0.9328, test_f1: 0.6053
 epoch: 41, train_loss: 0.7209, test_loss: 0.9113, test_f1: 0.6218
 epoch: 42, train_loss: 0.7123, test_loss: 0.9586, test_f1: 0.6339
 epoch: 43, train_loss: 0.6938, test_loss: 1.0336, test_f1: 0.5847
 epoch: 44, train_loss: 0.7190, test_loss: 0.9030, test_f1: 0.6076
 epoch: 45, train_loss: 0.7071, test_loss: 0.9829, test_f1: 0.6264
 epoch: 46, train_loss: 0.7061, test_loss: 0.9234, test_f1: 0.6490
 epoch: 47, train_loss: 0.6975, test_loss: 0.9352, test_f1: 0.6261
 epoch: 48, train_loss: 0.6894, test_loss: 0.9610, test_f1: 0.6531
 epoch: 49, train_loss: 0.6881, test_loss: 0.9554, test_f1: 0.6800
 epoch: 50, train_loss: 0.6860, test_loss: 1.0238, test_f1: 0.6116
 epoch: 51, train_loss: 0.6632, test_loss: 0.9755, test_f1: 0.6286
 epoch: 52, train_loss: 0.6339, test_loss: 0.9801, test_f1: 0.6533
 epoch: 53, train_loss: 0.6365, test_loss: 0.9887, test_f1: 0.6717
 epoch: 54, train_loss: 0.6277, test_loss: 0.9618, test_f1: 0.6401
 epoch: 55, train_loss: 0.6050, test_loss: 0.9643, test_f1: 0.6523
 epoch: 56, train_loss: 0.6182, test_loss: 1.0125, test_f1: 0.6347
 epoch: 57, train_loss: 0.6079, test_loss: 1.0229, test_f1: 0.6548
 epoch: 58, train_loss: 0.5976, test_loss: 1.0620, test_f1: 0.6502
 epoch: 59, train_loss: 0.6075, test_loss: 1.0437, test_f1: 0.6718
 epoch: 60, train_loss: 0.6006, test_loss: 1.1313, test_f1: 0.6536
 epoch: 61, train_loss: 0.5971, test_loss: 1.0694, test_f1: 0.6830
 epoch: 62, train_loss: 0.5931, test_loss: 1.1395, test_f1: 0.6347
 epoch: 63, train_loss: 0.5946, test_loss: 1.0410, test_f1: 0.6817
 epoch: 64, train_loss: 0.5713, test_loss: 1.1021, test_f1: 0.6620
 epoch: 65, train_loss: 0.5816, test_loss: 1.0613, test_f1: 0.6525
 epoch: 66, train_loss: 0.5805, test_loss: 1.0601, test_f1: 0.6525
 epoch: 67, train_loss: 0.5790, test_loss: 1.1022, test_f1: 0.6673
 epoch: 68, train_loss: 0.5847, test_loss: 1.0087, test_f1: 0.6464
 epoch: 69, train_loss: 0.5750, test_loss: 1.1715, test_f1: 0.6746
 epoch: 70, train_loss: 0.5709, test_loss: 1.0956, test_f1: 0.6675
 epoch: 71, train_loss: 0.5835, test_loss: 1.1123, test_f1: 0.6615
 epoch: 72, train_loss: 0.5799, test_loss: 1.0938, test_f1: 0.6717
 epoch: 73, train_loss: 0.5734, test_loss: 1.0942, test_f1: 0.6558
 epoch: 74, train_loss: 0.5579, test_loss: 1.0530, test_f1: 0.6570
 epoch: 75, train_loss: 0.5590, test_loss: 1.1156, test_f1: 0.6379
 epoch: 76, train_loss: 0.5636, test_loss: 1.1002, test_f1: 0.6537
 epoch: 77, train_loss: 0.5673, test_loss: 1.0744, test_f1: 0.6505
 epoch: 78, train_loss: 0.5795, test_loss: 1.1651, test_f1: 0.6357
 epoch: 79, train_loss: 0.5616, test_loss: 1.1804, test_f1: 0.6822
 epoch: 80, train_loss: 0.5431, test_loss: 1.0965, test_f1: 0.6511
 epoch: 81, train_loss: 0.5524, test_loss: 1.1058, test_f1: 0.6614
 epoch: 82, train_loss: 0.5399, test_loss: 1.2089, test_f1: 0.6858
 epoch: 83, train_loss: 0.5395, test_loss: 1.0964, test_f1: 0.7071
 epoch: 84, train_loss: 0.5485, test_loss: 1.1258, test_f1: 0.6517
 epoch: 85, train_loss: 0.5370, test_loss: 1.1459, test_f1: 0.6610
 epoch: 86, train_loss: 0.5315, test_loss: 1.1167, test_f1: 0.6832
 epoch: 87, train_loss: 0.5482, test_loss: 1.1321, test_f1: 0.6769
 epoch: 88, train_loss: 0.5369, test_loss: 1.1795, test_f1: 0.6557
 epoch: 89, train_loss: 0.5332, test_loss: 1.2093, test_f1: 0.6322
 epoch: 90, train_loss: 0.5436, test_loss: 1.1383, test_f1: 0.6371
 epoch: 91, train_loss: 0.5312, test_loss: 1.1487, test_f1: 0.6910
 epoch: 92, train_loss: 0.5225, test_loss: 1.1137, test_f1: 0.6699
 epoch: 93, train_loss: 0.5210, test_loss: 1.0136, test_f1: 0.6694
 epoch: 94, train_loss: 0.5240, test_loss: 1.2283, test_f1: 0.6384
 epoch: 95, train_loss: 0.5409, test_loss: 1.1669, test_f1: 0.6788
 epoch: 96, train_loss: 0.5361, test_loss: 1.1351, test_f1: 0.6554
 epoch: 97, train_loss: 0.5312, test_loss: 1.1436, test_f1: 0.6698
 epoch: 98, train_loss: 0.5210, test_loss: 1.1838, test_f1: 0.7019
 epoch: 99, train_loss: 0.5219, test_loss: 1.0679, test_f1: 0.6557
##################ITERATION #3 ****************************************
 epoch: 0, train_loss: 1.2383, test_loss: 1.2188, test_f1: 0.3226
 epoch: 1, train_loss: 1.0775, test_loss: 1.0416, test_f1: 0.4651
 epoch: 2, train_loss: 0.9932, test_loss: 1.0110, test_f1: 0.4487
 epoch: 3, train_loss: 0.9963, test_loss: 1.0083, test_f1: 0.4772
 epoch: 4, train_loss: 0.9714, test_loss: 1.0576, test_f1: 0.4388
 epoch: 5, train_loss: 0.9544, test_loss: 0.9871, test_f1: 0.4965
 epoch: 6, train_loss: 0.9377, test_loss: 1.0057, test_f1: 0.4795
 epoch: 7, train_loss: 0.9277, test_loss: 0.9406, test_f1: 0.5409
 epoch: 8, train_loss: 0.9453, test_loss: 0.9932, test_f1: 0.5104
 epoch: 9, train_loss: 0.9135, test_loss: 0.9207, test_f1: 0.5477
 epoch: 10, train_loss: 0.9339, test_loss: 0.9763, test_f1: 0.4954
 epoch: 11, train_loss: 0.9102, test_loss: 0.9835, test_f1: 0.5090
 epoch: 12, train_loss: 0.9191, test_loss: 0.9883, test_f1: 0.5120
 epoch: 13, train_loss: 0.8919, test_loss: 0.9685, test_f1: 0.5878
 epoch: 14, train_loss: 0.8771, test_loss: 0.9491, test_f1: 0.5351
 epoch: 15, train_loss: 0.8872, test_loss: 1.0113, test_f1: 0.4697
 epoch: 16, train_loss: 0.8995, test_loss: 0.9575, test_f1: 0.5228
 epoch: 17, train_loss: 0.8799, test_loss: 0.9579, test_f1: 0.5839
 epoch: 18, train_loss: 0.8916, test_loss: 0.9478, test_f1: 0.5301
 epoch: 19, train_loss: 0.8679, test_loss: 0.9895, test_f1: 0.5141
 epoch: 20, train_loss: 0.8659, test_loss: 0.9159, test_f1: 0.5524
 epoch: 21, train_loss: 0.8508, test_loss: 0.8744, test_f1: 0.5800
 epoch: 22, train_loss: 0.8581, test_loss: 0.9170, test_f1: 0.5705
 epoch: 23, train_loss: 0.8378, test_loss: 0.8957, test_f1: 0.5761
 epoch: 24, train_loss: 0.8310, test_loss: 0.9259, test_f1: 0.5915
 epoch: 25, train_loss: 0.8324, test_loss: 0.9757, test_f1: 0.5550
 epoch: 26, train_loss: 0.8556, test_loss: 0.8924, test_f1: 0.5770
 epoch: 27, train_loss: 0.8332, test_loss: 0.9133, test_f1: 0.5795
 epoch: 28, train_loss: 0.8280, test_loss: 0.9978, test_f1: 0.5277
 epoch: 29, train_loss: 0.8194, test_loss: 0.9139, test_f1: 0.5523
 epoch: 30, train_loss: 0.8137, test_loss: 0.9821, test_f1: 0.5900
 epoch: 31, train_loss: 0.8117, test_loss: 0.9992, test_f1: 0.5810
 epoch: 32, train_loss: 0.7879, test_loss: 0.9714, test_f1: 0.5352
 epoch: 33, train_loss: 0.8000, test_loss: 0.9192, test_f1: 0.6189
 epoch: 34, train_loss: 0.7820, test_loss: 0.9743, test_f1: 0.5568
 epoch: 35, train_loss: 0.7832, test_loss: 1.0155, test_f1: 0.5872
 epoch: 36, train_loss: 0.7740, test_loss: 1.0267, test_f1: 0.5204
 epoch: 37, train_loss: 0.7688, test_loss: 0.9911, test_f1: 0.5811
 epoch: 38, train_loss: 0.7696, test_loss: 0.9074, test_f1: 0.5815
 epoch: 39, train_loss: 0.7726, test_loss: 0.9692, test_f1: 0.6304
 epoch: 40, train_loss: 0.7578, test_loss: 1.0053, test_f1: 0.6160
 epoch: 41, train_loss: 0.7454, test_loss: 1.0299, test_f1: 0.6173
 epoch: 42, train_loss: 0.7586, test_loss: 0.9724, test_f1: 0.6541
 epoch: 43, train_loss: 0.7642, test_loss: 1.0522, test_f1: 0.5805
 epoch: 44, train_loss: 0.7438, test_loss: 0.9394, test_f1: 0.5917
 epoch: 45, train_loss: 0.7467, test_loss: 0.9590, test_f1: 0.5840
 epoch: 46, train_loss: 0.7565, test_loss: 0.8946, test_f1: 0.5754
 epoch: 47, train_loss: 0.7295, test_loss: 1.0336, test_f1: 0.5855
 epoch: 48, train_loss: 0.7341, test_loss: 0.9994, test_f1: 0.6304
 epoch: 49, train_loss: 0.7215, test_loss: 0.9432, test_f1: 0.6012
 epoch: 50, train_loss: 0.7353, test_loss: 1.1026, test_f1: 0.5383
 epoch: 51, train_loss: 0.7106, test_loss: 0.9438, test_f1: 0.6069
 epoch: 52, train_loss: 0.6804, test_loss: 0.9092, test_f1: 0.6269
 epoch: 53, train_loss: 0.6895, test_loss: 0.9721, test_f1: 0.6179
 epoch: 54, train_loss: 0.6661, test_loss: 0.9210, test_f1: 0.6371
 epoch: 55, train_loss: 0.6655, test_loss: 1.0088, test_f1: 0.6650
 epoch: 56, train_loss: 0.6589, test_loss: 0.9355, test_f1: 0.6484
 epoch: 57, train_loss: 0.6613, test_loss: 1.1312, test_f1: 0.6256
 epoch: 58, train_loss: 0.6760, test_loss: 1.0275, test_f1: 0.6218
 epoch: 59, train_loss: 0.6624, test_loss: 1.0293, test_f1: 0.6266
 epoch: 60, train_loss: 0.6452, test_loss: 0.9593, test_f1: 0.6571
 epoch: 61, train_loss: 0.6311, test_loss: 0.9928, test_f1: 0.6550
 epoch: 62, train_loss: 0.6280, test_loss: 0.9352, test_f1: 0.6367
 epoch: 63, train_loss: 0.6552, test_loss: 0.9640, test_f1: 0.6194
 epoch: 64, train_loss: 0.6445, test_loss: 0.9742, test_f1: 0.6470
 epoch: 65, train_loss: 0.6371, test_loss: 1.0870, test_f1: 0.6164
 epoch: 66, train_loss: 0.6335, test_loss: 0.9642, test_f1: 0.6196
 epoch: 67, train_loss: 0.6218, test_loss: 0.9562, test_f1: 0.6539
 epoch: 68, train_loss: 0.6348, test_loss: 0.9356, test_f1: 0.6265
 epoch: 69, train_loss: 0.6428, test_loss: 1.0226, test_f1: 0.6423
 epoch: 70, train_loss: 0.6263, test_loss: 0.9695, test_f1: 0.6628
 epoch: 71, train_loss: 0.6372, test_loss: 1.1122, test_f1: 0.5980
 epoch: 72, train_loss: 0.6337, test_loss: 0.9325, test_f1: 0.6623
 epoch: 73, train_loss: 0.6189, test_loss: 1.0964, test_f1: 0.6117
 epoch: 74, train_loss: 0.6110, test_loss: 1.0550, test_f1: 0.6552
 epoch: 75, train_loss: 0.6266, test_loss: 1.0349, test_f1: 0.6295
 epoch: 76, train_loss: 0.6250, test_loss: 1.0400, test_f1: 0.6533
 epoch: 77, train_loss: 0.6067, test_loss: 1.0102, test_f1: 0.6274
 epoch: 78, train_loss: 0.5918, test_loss: 1.0272, test_f1: 0.6726
 epoch: 79, train_loss: 0.6013, test_loss: 1.1288, test_f1: 0.6279
 epoch: 80, train_loss: 0.5919, test_loss: 1.0730, test_f1: 0.6342
 epoch: 81, train_loss: 0.5933, test_loss: 0.9907, test_f1: 0.6475
 epoch: 82, train_loss: 0.5840, test_loss: 1.0736, test_f1: 0.6372
 epoch: 83, train_loss: 0.5978, test_loss: 0.8852, test_f1: 0.6584
 epoch: 84, train_loss: 0.5835, test_loss: 1.1007, test_f1: 0.6378
 epoch: 85, train_loss: 0.5740, test_loss: 1.0364, test_f1: 0.6276
 epoch: 86, train_loss: 0.5800, test_loss: 1.1024, test_f1: 0.6122
 epoch: 87, train_loss: 0.5990, test_loss: 1.1239, test_f1: 0.6434
 epoch: 88, train_loss: 0.5836, test_loss: 1.0200, test_f1: 0.6491
 epoch: 89, train_loss: 0.5811, test_loss: 1.0748, test_f1: 0.6117
 epoch: 90, train_loss: 0.5812, test_loss: 1.1692, test_f1: 0.6331
 epoch: 91, train_loss: 0.5764, test_loss: 1.1373, test_f1: 0.6420
 epoch: 92, train_loss: 0.5505, test_loss: 1.0746, test_f1: 0.6486
 epoch: 93, train_loss: 0.5723, test_loss: 1.0950, test_f1: 0.6051
 epoch: 94, train_loss: 0.5788, test_loss: 1.0508, test_f1: 0.6406
 epoch: 95, train_loss: 0.5513, test_loss: 1.1167, test_f1: 0.6337
 epoch: 96, train_loss: 0.5441, test_loss: 1.1642, test_f1: 0.6516
 epoch: 97, train_loss: 0.5531, test_loss: 1.0653, test_f1: 0.6560
 epoch: 98, train_loss: 0.5643, test_loss: 1.0690, test_f1: 0.6732
 epoch: 99, train_loss: 0.5548, test_loss: 1.1784, test_f1: 0.6425
##################ITERATION #4 ****************************************
 epoch: 0, train_loss: 1.1994, test_loss: 1.2837, test_f1: 0.2584
 epoch: 1, train_loss: 0.9985, test_loss: 1.0237, test_f1: 0.4703
 epoch: 2, train_loss: 0.9827, test_loss: 0.9797, test_f1: 0.5133
 epoch: 3, train_loss: 0.9568, test_loss: 1.0040, test_f1: 0.5029
 epoch: 4, train_loss: 0.9340, test_loss: 0.9921, test_f1: 0.5069
 epoch: 5, train_loss: 0.9292, test_loss: 0.9566, test_f1: 0.5648
 epoch: 6, train_loss: 0.9201, test_loss: 0.9901, test_f1: 0.5204
 epoch: 7, train_loss: 0.9048, test_loss: 0.9325, test_f1: 0.5427
 epoch: 8, train_loss: 0.8941, test_loss: 1.0850, test_f1: 0.4679
 epoch: 9, train_loss: 0.9013, test_loss: 1.1226, test_f1: 0.4848
 epoch: 10, train_loss: 0.8863, test_loss: 1.0253, test_f1: 0.5374
 epoch: 11, train_loss: 0.8795, test_loss: 1.0368, test_f1: 0.4999
 epoch: 12, train_loss: 0.8726, test_loss: 0.9919, test_f1: 0.5428
 epoch: 13, train_loss: 0.8793, test_loss: 0.9642, test_f1: 0.5375
 epoch: 14, train_loss: 0.8665, test_loss: 0.9904, test_f1: 0.5635
 epoch: 15, train_loss: 0.8588, test_loss: 0.9856, test_f1: 0.5285
 epoch: 16, train_loss: 0.8491, test_loss: 0.9545, test_f1: 0.5384
 epoch: 17, train_loss: 0.8273, test_loss: 0.9331, test_f1: 0.5831
 epoch: 18, train_loss: 0.8316, test_loss: 0.9648, test_f1: 0.5994
 epoch: 19, train_loss: 0.8285, test_loss: 0.9701, test_f1: 0.6095
 epoch: 20, train_loss: 0.8125, test_loss: 1.0284, test_f1: 0.5834
 epoch: 21, train_loss: 0.8052, test_loss: 1.0854, test_f1: 0.6073
 epoch: 22, train_loss: 0.8061, test_loss: 0.9444, test_f1: 0.5831
 epoch: 23, train_loss: 0.7980, test_loss: 0.8960, test_f1: 0.6161
 epoch: 24, train_loss: 0.8012, test_loss: 1.0791, test_f1: 0.5580
 epoch: 25, train_loss: 0.8108, test_loss: 1.0028, test_f1: 0.6364
 epoch: 26, train_loss: 0.7964, test_loss: 0.9977, test_f1: 0.5765
 epoch: 27, train_loss: 0.7826, test_loss: 1.1529, test_f1: 0.5749
 epoch: 28, train_loss: 0.7822, test_loss: 1.0096, test_f1: 0.5996
 epoch: 29, train_loss: 0.7892, test_loss: 1.0499, test_f1: 0.6049
 epoch: 30, train_loss: 0.7661, test_loss: 1.1064, test_f1: 0.6332
 epoch: 31, train_loss: 0.7579, test_loss: 0.9929, test_f1: 0.5631
 epoch: 32, train_loss: 0.7802, test_loss: 1.0711, test_f1: 0.5809
 epoch: 33, train_loss: 0.7738, test_loss: 0.9380, test_f1: 0.5762
 epoch: 34, train_loss: 0.7421, test_loss: 1.0787, test_f1: 0.5731
 epoch: 35, train_loss: 0.7451, test_loss: 1.1566, test_f1: 0.6254
 epoch: 36, train_loss: 0.7731, test_loss: 0.9963, test_f1: 0.6173
 epoch: 37, train_loss: 0.7576, test_loss: 1.1751, test_f1: 0.5738
 epoch: 38, train_loss: 0.7518, test_loss: 1.0472, test_f1: 0.5710
 epoch: 39, train_loss: 0.7507, test_loss: 0.9657, test_f1: 0.5937
 epoch: 40, train_loss: 0.7420, test_loss: 1.1176, test_f1: 0.5931
 epoch: 41, train_loss: 0.7392, test_loss: 1.1688, test_f1: 0.5935
 epoch: 42, train_loss: 0.7325, test_loss: 1.1207, test_f1: 0.6466
 epoch: 43, train_loss: 0.7319, test_loss: 1.0803, test_f1: 0.6215
 epoch: 44, train_loss: 0.7330, test_loss: 1.1140, test_f1: 0.6295
 epoch: 45, train_loss: 0.7177, test_loss: 1.1479, test_f1: 0.6273
 epoch: 46, train_loss: 0.7269, test_loss: 1.1516, test_f1: 0.6239
 epoch: 47, train_loss: 0.7396, test_loss: 1.1084, test_f1: 0.6056
 epoch: 48, train_loss: 0.7243, test_loss: 1.1869, test_f1: 0.5950
 epoch: 49, train_loss: 0.7238, test_loss: 1.1817, test_f1: 0.6218
 epoch: 50, train_loss: 0.7178, test_loss: 1.1483, test_f1: 0.5974
 epoch: 51, train_loss: 0.6980, test_loss: 1.1589, test_f1: 0.6301
 epoch: 52, train_loss: 0.6754, test_loss: 1.1318, test_f1: 0.5864
 epoch: 53, train_loss: 0.6686, test_loss: 1.2783, test_f1: 0.6270
 epoch: 54, train_loss: 0.6606, test_loss: 1.1336, test_f1: 0.6742
 epoch: 55, train_loss: 0.6681, test_loss: 1.1179, test_f1: 0.6588
 epoch: 56, train_loss: 0.6689, test_loss: 1.1737, test_f1: 0.6430
 epoch: 57, train_loss: 0.6516, test_loss: 1.1261, test_f1: 0.6357
 epoch: 58, train_loss: 0.6435, test_loss: 1.1731, test_f1: 0.6224
 epoch: 59, train_loss: 0.6388, test_loss: 1.1404, test_f1: 0.6414
 epoch: 60, train_loss: 0.6505, test_loss: 1.1966, test_f1: 0.6309
 epoch: 61, train_loss: 0.6375, test_loss: 1.1497, test_f1: 0.6227
 epoch: 62, train_loss: 0.6489, test_loss: 1.2210, test_f1: 0.6149
 epoch: 63, train_loss: 0.6162, test_loss: 1.1314, test_f1: 0.6364
 epoch: 64, train_loss: 0.6645, test_loss: 1.1398, test_f1: 0.6564
 epoch: 65, train_loss: 0.6294, test_loss: 1.2951, test_f1: 0.6068
 epoch: 66, train_loss: 0.6475, test_loss: 1.1547, test_f1: 0.6444
 epoch: 67, train_loss: 0.6277, test_loss: 1.2338, test_f1: 0.6387
 epoch: 68, train_loss: 0.6336, test_loss: 1.2102, test_f1: 0.6284
 epoch: 69, train_loss: 0.6301, test_loss: 1.2221, test_f1: 0.6456
 epoch: 70, train_loss: 0.6246, test_loss: 1.0928, test_f1: 0.6423
 epoch: 71, train_loss: 0.6183, test_loss: 1.2520, test_f1: 0.6395
 epoch: 72, train_loss: 0.6065, test_loss: 1.1877, test_f1: 0.6506
 epoch: 73, train_loss: 0.6167, test_loss: 1.1241, test_f1: 0.6446
 epoch: 74, train_loss: 0.5901, test_loss: 1.2307, test_f1: 0.6590
 epoch: 75, train_loss: 0.6031, test_loss: 1.3178, test_f1: 0.6046
 epoch: 76, train_loss: 0.6015, test_loss: 1.2889, test_f1: 0.6404
 epoch: 77, train_loss: 0.6031, test_loss: 1.2714, test_f1: 0.6699
 epoch: 78, train_loss: 0.6059, test_loss: 1.2438, test_f1: 0.6278
 epoch: 79, train_loss: 0.6079, test_loss: 1.2422, test_f1: 0.6440
 epoch: 80, train_loss: 0.6079, test_loss: 1.2202, test_f1: 0.6333
 epoch: 81, train_loss: 0.5931, test_loss: 1.2804, test_f1: 0.6324
 epoch: 82, train_loss: 0.5947, test_loss: 1.2138, test_f1: 0.6545
 epoch: 83, train_loss: 0.5994, test_loss: 1.2827, test_f1: 0.6492
 epoch: 84, train_loss: 0.5921, test_loss: 1.3576, test_f1: 0.6316
 epoch: 85, train_loss: 0.6050, test_loss: 1.1975, test_f1: 0.6562
 epoch: 86, train_loss: 0.6029, test_loss: 1.3312, test_f1: 0.6443
 epoch: 87, train_loss: 0.6082, test_loss: 1.3262, test_f1: 0.6520
 epoch: 88, train_loss: 0.5967, test_loss: 1.3351, test_f1: 0.6389
 epoch: 89, train_loss: 0.5845, test_loss: 1.1752, test_f1: 0.6562
 epoch: 90, train_loss: 0.5665, test_loss: 1.1329, test_f1: 0.6417
 epoch: 91, train_loss: 0.5922, test_loss: 1.4126, test_f1: 0.6349
 epoch: 92, train_loss: 0.5778, test_loss: 1.1495, test_f1: 0.6405
 epoch: 93, train_loss: 0.5874, test_loss: 1.3696, test_f1: 0.6435
 epoch: 94, train_loss: 0.5741, test_loss: 1.1337, test_f1: 0.6674
 epoch: 95, train_loss: 0.5852, test_loss: 1.3495, test_f1: 0.6276
 epoch: 96, train_loss: 0.5711, test_loss: 1.2199, test_f1: 0.6538
 epoch: 97, train_loss: 0.5864, test_loss: 1.3692, test_f1: 0.6543
 epoch: 98, train_loss: 0.5593, test_loss: 1.2721, test_f1: 0.6593
 epoch: 99, train_loss: 0.5693, test_loss: 1.3262, test_f1: 0.6791
##################ITERATION #5 ****************************************
 epoch: 0, train_loss: 1.2173, test_loss: 1.1515, test_f1: 0.3332
 epoch: 1, train_loss: 1.0355, test_loss: 0.9862, test_f1: 0.4839
 epoch: 2, train_loss: 1.0051, test_loss: 0.9951, test_f1: 0.4997
 epoch: 3, train_loss: 0.9889, test_loss: 0.9915, test_f1: 0.5165
 epoch: 4, train_loss: 0.9707, test_loss: 0.9922, test_f1: 0.4968
 epoch: 5, train_loss: 0.9465, test_loss: 0.9513, test_f1: 0.5003
 epoch: 6, train_loss: 0.9377, test_loss: 0.9623, test_f1: 0.4679
 epoch: 7, train_loss: 0.9315, test_loss: 0.9585, test_f1: 0.4682
 epoch: 8, train_loss: 0.9144, test_loss: 0.9690, test_f1: 0.4922
 epoch: 9, train_loss: 0.9059, test_loss: 0.9881, test_f1: 0.4948
 epoch: 10, train_loss: 0.9068, test_loss: 0.9912, test_f1: 0.5435
 epoch: 11, train_loss: 0.8847, test_loss: 0.9509, test_f1: 0.4932
 epoch: 12, train_loss: 0.8855, test_loss: 0.9842, test_f1: 0.4945
 epoch: 13, train_loss: 0.8674, test_loss: 0.9138, test_f1: 0.5619
 epoch: 14, train_loss: 0.8714, test_loss: 0.9208, test_f1: 0.4913
 epoch: 15, train_loss: 0.8645, test_loss: 0.9823, test_f1: 0.5259
 epoch: 16, train_loss: 0.8526, test_loss: 0.9476, test_f1: 0.5125
 epoch: 17, train_loss: 0.8391, test_loss: 0.9314, test_f1: 0.5700
 epoch: 18, train_loss: 0.8360, test_loss: 0.8925, test_f1: 0.5520
 epoch: 19, train_loss: 0.8365, test_loss: 0.9926, test_f1: 0.5022
 epoch: 20, train_loss: 0.8392, test_loss: 0.9336, test_f1: 0.5048
 epoch: 21, train_loss: 0.8185, test_loss: 0.9268, test_f1: 0.5601
 epoch: 22, train_loss: 0.8204, test_loss: 0.9235, test_f1: 0.5815
 epoch: 23, train_loss: 0.8192, test_loss: 0.9781, test_f1: 0.5224
 epoch: 24, train_loss: 0.8126, test_loss: 1.0059, test_f1: 0.5282
 epoch: 25, train_loss: 0.8144, test_loss: 1.0673, test_f1: 0.4759
 epoch: 26, train_loss: 0.8024, test_loss: 1.0059, test_f1: 0.5471
 epoch: 27, train_loss: 0.8082, test_loss: 1.0234, test_f1: 0.5227
 epoch: 28, train_loss: 0.7962, test_loss: 0.8654, test_f1: 0.5693
 epoch: 29, train_loss: 0.7958, test_loss: 0.9348, test_f1: 0.5432
 epoch: 30, train_loss: 0.7833, test_loss: 1.1013, test_f1: 0.4851
 epoch: 31, train_loss: 0.8142, test_loss: 0.9243, test_f1: 0.5742
 epoch: 32, train_loss: 0.7948, test_loss: 0.9365, test_f1: 0.5716
 epoch: 33, train_loss: 0.7837, test_loss: 0.9277, test_f1: 0.5451
 epoch: 34, train_loss: 0.7759, test_loss: 0.9558, test_f1: 0.5341
 epoch: 35, train_loss: 0.7541, test_loss: 1.0126, test_f1: 0.5650
 epoch: 36, train_loss: 0.7813, test_loss: 1.0184, test_f1: 0.5477
 epoch: 37, train_loss: 0.7705, test_loss: 0.9678, test_f1: 0.5406
 epoch: 38, train_loss: 0.7661, test_loss: 0.9408, test_f1: 0.5532
 epoch: 39, train_loss: 0.7510, test_loss: 0.9962, test_f1: 0.5870
 epoch: 40, train_loss: 0.7743, test_loss: 1.0630, test_f1: 0.5213
 epoch: 41, train_loss: 0.7622, test_loss: 0.9357, test_f1: 0.5874
 epoch: 42, train_loss: 0.7646, test_loss: 0.9913, test_f1: 0.5990
 epoch: 43, train_loss: 0.7375, test_loss: 0.9377, test_f1: 0.5912
 epoch: 44, train_loss: 0.7391, test_loss: 0.9743, test_f1: 0.5879
 epoch: 45, train_loss: 0.7225, test_loss: 0.9501, test_f1: 0.5831
 epoch: 46, train_loss: 0.7397, test_loss: 1.0180, test_f1: 0.5324
 epoch: 47, train_loss: 0.7213, test_loss: 1.0771, test_f1: 0.5259
 epoch: 48, train_loss: 0.7324, test_loss: 0.9194, test_f1: 0.5869
 epoch: 49, train_loss: 0.7287, test_loss: 1.0527, test_f1: 0.6043
 epoch: 50, train_loss: 0.7088, test_loss: 0.9511, test_f1: 0.5972
 epoch: 51, train_loss: 0.6954, test_loss: 0.9515, test_f1: 0.5809
 epoch: 52, train_loss: 0.6630, test_loss: 0.9403, test_f1: 0.6158
 epoch: 53, train_loss: 0.6664, test_loss: 1.0003, test_f1: 0.6168
 epoch: 54, train_loss: 0.6553, test_loss: 0.9655, test_f1: 0.5961
 epoch: 55, train_loss: 0.6450, test_loss: 1.0500, test_f1: 0.5644
 epoch: 56, train_loss: 0.6640, test_loss: 0.9289, test_f1: 0.6177
 epoch: 57, train_loss: 0.6638, test_loss: 0.9482, test_f1: 0.6513
 epoch: 58, train_loss: 0.6501, test_loss: 0.9877, test_f1: 0.5819
 epoch: 59, train_loss: 0.6353, test_loss: 0.9292, test_f1: 0.6254
 epoch: 60, train_loss: 0.6402, test_loss: 1.0212, test_f1: 0.5857
 epoch: 61, train_loss: 0.6426, test_loss: 0.9838, test_f1: 0.6235
 epoch: 62, train_loss: 0.6069, test_loss: 0.9822, test_f1: 0.6174
 epoch: 63, train_loss: 0.6208, test_loss: 0.9651, test_f1: 0.6348
 epoch: 64, train_loss: 0.6142, test_loss: 0.9704, test_f1: 0.6205
 epoch: 65, train_loss: 0.6190, test_loss: 1.0527, test_f1: 0.5737
 epoch: 66, train_loss: 0.6169, test_loss: 0.9410, test_f1: 0.6547
 epoch: 67, train_loss: 0.6126, test_loss: 0.9385, test_f1: 0.6182
 epoch: 68, train_loss: 0.6040, test_loss: 0.9798, test_f1: 0.5911
 epoch: 69, train_loss: 0.6064, test_loss: 0.9696, test_f1: 0.6527
 epoch: 70, train_loss: 0.6049, test_loss: 1.0296, test_f1: 0.5799
 epoch: 71, train_loss: 0.5991, test_loss: 0.9566, test_f1: 0.6199
 epoch: 72, train_loss: 0.5777, test_loss: 0.9333, test_f1: 0.6620
 epoch: 73, train_loss: 0.5806, test_loss: 0.9646, test_f1: 0.6159
 epoch: 74, train_loss: 0.5765, test_loss: 0.9471, test_f1: 0.6266
 epoch: 75, train_loss: 0.5873, test_loss: 0.9838, test_f1: 0.6024
 epoch: 76, train_loss: 0.5940, test_loss: 0.9433, test_f1: 0.6138
 epoch: 77, train_loss: 0.5985, test_loss: 1.0042, test_f1: 0.6142
 epoch: 78, train_loss: 0.5996, test_loss: 0.9750, test_f1: 0.5958
 epoch: 79, train_loss: 0.5853, test_loss: 0.9912, test_f1: 0.6431
 epoch: 80, train_loss: 0.5801, test_loss: 0.9553, test_f1: 0.6056
 epoch: 81, train_loss: 0.5847, test_loss: 0.9646, test_f1: 0.6153
 epoch: 82, train_loss: 0.5778, test_loss: 0.9794, test_f1: 0.6222
 epoch: 83, train_loss: 0.5862, test_loss: 1.0507, test_f1: 0.6376
 epoch: 84, train_loss: 0.6095, test_loss: 0.9309, test_f1: 0.6389
 epoch: 85, train_loss: 0.5839, test_loss: 1.0486, test_f1: 0.6093
 epoch: 86, train_loss: 0.5590, test_loss: 1.0032, test_f1: 0.6615
 epoch: 87, train_loss: 0.5460, test_loss: 1.0088, test_f1: 0.6165
 epoch: 88, train_loss: 0.5697, test_loss: 1.4150, test_f1: 0.5860
 epoch: 89, train_loss: 0.5825, test_loss: 1.0115, test_f1: 0.5922
 epoch: 90, train_loss: 0.5720, test_loss: 1.0443, test_f1: 0.5874
 epoch: 91, train_loss: 0.5737, test_loss: 1.0308, test_f1: 0.6148
 epoch: 92, train_loss: 0.5517, test_loss: 1.0014, test_f1: 0.6279
 epoch: 93, train_loss: 0.5572, test_loss: 0.8856, test_f1: 0.6486
 epoch: 94, train_loss: 0.5414, test_loss: 1.0273, test_f1: 0.6153
 epoch: 95, train_loss: 0.5505, test_loss: 1.0001, test_f1: 0.6430
 epoch: 96, train_loss: 0.5319, test_loss: 0.9656, test_f1: 0.6387
 epoch: 97, train_loss: 0.5329, test_loss: 0.9696, test_f1: 0.6229
 epoch: 98, train_loss: 0.5286, test_loss: 0.9847, test_f1: 0.6022
 epoch: 99, train_loss: 0.5328, test_loss: 1.0902, test_f1: 0.6212
##################ITERATION #6 ****************************************
 epoch: 0, train_loss: 1.2507, test_loss: 1.1765, test_f1: 0.3281
 epoch: 1, train_loss: 1.0584, test_loss: 0.9768, test_f1: 0.4608
 epoch: 2, train_loss: 1.0095, test_loss: 0.9909, test_f1: 0.5354
 epoch: 3, train_loss: 0.9872, test_loss: 0.9643, test_f1: 0.4929
 epoch: 4, train_loss: 0.9745, test_loss: 0.9604, test_f1: 0.4671
 epoch: 5, train_loss: 0.9618, test_loss: 1.0038, test_f1: 0.5154
 epoch: 6, train_loss: 0.9376, test_loss: 0.9480, test_f1: 0.4860
 epoch: 7, train_loss: 0.9309, test_loss: 0.9886, test_f1: 0.5026
 epoch: 8, train_loss: 0.9169, test_loss: 1.0055, test_f1: 0.5058
 epoch: 9, train_loss: 0.9157, test_loss: 0.9727, test_f1: 0.5013
 epoch: 10, train_loss: 0.9042, test_loss: 1.1189, test_f1: 0.4694
 epoch: 11, train_loss: 0.9027, test_loss: 0.9418, test_f1: 0.5209
 epoch: 12, train_loss: 0.8846, test_loss: 0.9734, test_f1: 0.5199
 epoch: 13, train_loss: 0.8800, test_loss: 0.9416, test_f1: 0.5080
 epoch: 14, train_loss: 0.8784, test_loss: 0.9580, test_f1: 0.5511
 epoch: 15, train_loss: 0.8812, test_loss: 0.9839, test_f1: 0.5375
 epoch: 16, train_loss: 0.8546, test_loss: 0.9208, test_f1: 0.5317
 epoch: 17, train_loss: 0.8860, test_loss: 1.0131, test_f1: 0.5044
 epoch: 18, train_loss: 0.8524, test_loss: 0.9579, test_f1: 0.5430
 epoch: 19, train_loss: 0.8396, test_loss: 0.9955, test_f1: 0.5024
 epoch: 20, train_loss: 0.8550, test_loss: 0.9766, test_f1: 0.5387
 epoch: 21, train_loss: 0.8433, test_loss: 0.9601, test_f1: 0.5933
 epoch: 22, train_loss: 0.8299, test_loss: 0.9502, test_f1: 0.5622
 epoch: 23, train_loss: 0.8206, test_loss: 0.9711, test_f1: 0.6031
 epoch: 24, train_loss: 0.7986, test_loss: 0.9368, test_f1: 0.6200
 epoch: 25, train_loss: 0.7983, test_loss: 0.9893, test_f1: 0.5961
 epoch: 26, train_loss: 0.7890, test_loss: 0.9987, test_f1: 0.5882
 epoch: 27, train_loss: 0.7923, test_loss: 0.9870, test_f1: 0.5705
 epoch: 28, train_loss: 0.8180, test_loss: 1.0201, test_f1: 0.5505
 epoch: 29, train_loss: 0.7842, test_loss: 0.9831, test_f1: 0.5808
 epoch: 30, train_loss: 0.7706, test_loss: 0.9653, test_f1: 0.5742
 epoch: 31, train_loss: 0.7737, test_loss: 1.0647, test_f1: 0.5776
 epoch: 32, train_loss: 0.7506, test_loss: 1.1923, test_f1: 0.5210
 epoch: 33, train_loss: 0.7511, test_loss: 0.9785, test_f1: 0.6021
 epoch: 34, train_loss: 0.7436, test_loss: 1.0087, test_f1: 0.5982
 epoch: 35, train_loss: 0.7471, test_loss: 0.9157, test_f1: 0.6204
 epoch: 36, train_loss: 0.7475, test_loss: 0.9209, test_f1: 0.6164
 epoch: 37, train_loss: 0.7607, test_loss: 1.0176, test_f1: 0.5818
 epoch: 38, train_loss: 0.7431, test_loss: 0.9474, test_f1: 0.6235
 epoch: 39, train_loss: 0.7561, test_loss: 0.9212, test_f1: 0.6106
 epoch: 40, train_loss: 0.7594, test_loss: 0.9690, test_f1: 0.5982
 epoch: 41, train_loss: 0.7579, test_loss: 1.0083, test_f1: 0.5690
 epoch: 42, train_loss: 0.7503, test_loss: 0.9386, test_f1: 0.5721
 epoch: 43, train_loss: 0.7273, test_loss: 0.9370, test_f1: 0.6217
 epoch: 44, train_loss: 0.7125, test_loss: 1.1083, test_f1: 0.5620
 epoch: 45, train_loss: 0.7231, test_loss: 0.9344, test_f1: 0.6013
 epoch: 46, train_loss: 0.7003, test_loss: 0.9719, test_f1: 0.6285
 epoch: 47, train_loss: 0.7180, test_loss: 1.1089, test_f1: 0.5740
 epoch: 48, train_loss: 0.7304, test_loss: 0.9748, test_f1: 0.6063
 epoch: 49, train_loss: 0.7047, test_loss: 1.0074, test_f1: 0.6194
 epoch: 50, train_loss: 0.7003, test_loss: 0.9452, test_f1: 0.6045
 epoch: 51, train_loss: 0.6916, test_loss: 0.9250, test_f1: 0.6407
 epoch: 52, train_loss: 0.6603, test_loss: 0.9732, test_f1: 0.6214
 epoch: 53, train_loss: 0.6575, test_loss: 0.9638, test_f1: 0.6417
 epoch: 54, train_loss: 0.6458, test_loss: 0.9866, test_f1: 0.6060
 epoch: 55, train_loss: 0.6238, test_loss: 0.9790, test_f1: 0.6481
 epoch: 56, train_loss: 0.6366, test_loss: 1.0275, test_f1: 0.6239
 epoch: 57, train_loss: 0.6377, test_loss: 0.9741, test_f1: 0.6146
 epoch: 58, train_loss: 0.6347, test_loss: 1.0296, test_f1: 0.6059
 epoch: 59, train_loss: 0.6280, test_loss: 1.0113, test_f1: 0.6238
 epoch: 60, train_loss: 0.6274, test_loss: 1.0415, test_f1: 0.6305
 epoch: 61, train_loss: 0.6126, test_loss: 1.0122, test_f1: 0.6045
 epoch: 62, train_loss: 0.6137, test_loss: 1.0303, test_f1: 0.6195
 epoch: 63, train_loss: 0.6154, test_loss: 1.0057, test_f1: 0.6039
 epoch: 64, train_loss: 0.6210, test_loss: 1.0170, test_f1: 0.6234
 epoch: 65, train_loss: 0.6079, test_loss: 1.0278, test_f1: 0.6378
 epoch: 66, train_loss: 0.6249, test_loss: 1.0475, test_f1: 0.6256
 epoch: 67, train_loss: 0.6182, test_loss: 1.0082, test_f1: 0.6164
 epoch: 68, train_loss: 0.6033, test_loss: 1.0997, test_f1: 0.6306
 epoch: 69, train_loss: 0.6224, test_loss: 1.0232, test_f1: 0.6337
 epoch: 70, train_loss: 0.6039, test_loss: 1.0788, test_f1: 0.6192
 epoch: 71, train_loss: 0.5961, test_loss: 1.0924, test_f1: 0.6123
 epoch: 72, train_loss: 0.6125, test_loss: 1.0978, test_f1: 0.6132
 epoch: 73, train_loss: 0.5894, test_loss: 0.9768, test_f1: 0.6297
 epoch: 74, train_loss: 0.5940, test_loss: 1.1017, test_f1: 0.6314
 epoch: 75, train_loss: 0.5904, test_loss: 1.1103, test_f1: 0.6350
 epoch: 76, train_loss: 0.5885, test_loss: 1.1293, test_f1: 0.6061
 epoch: 77, train_loss: 0.5893, test_loss: 1.0719, test_f1: 0.6395
 epoch: 78, train_loss: 0.5785, test_loss: 1.0699, test_f1: 0.6357
 epoch: 79, train_loss: 0.5853, test_loss: 1.1575, test_f1: 0.6078
 epoch: 80, train_loss: 0.5958, test_loss: 1.1309, test_f1: 0.6352
 epoch: 81, train_loss: 0.5803, test_loss: 1.1586, test_f1: 0.6405
 epoch: 82, train_loss: 0.5833, test_loss: 1.1175, test_f1: 0.6135
 epoch: 83, train_loss: 0.5821, test_loss: 1.1732, test_f1: 0.6129
 epoch: 84, train_loss: 0.5805, test_loss: 1.1537, test_f1: 0.6550
 epoch: 85, train_loss: 0.5775, test_loss: 1.1032, test_f1: 0.6182
 epoch: 86, train_loss: 0.5733, test_loss: 1.1554, test_f1: 0.6008
 epoch: 87, train_loss: 0.5602, test_loss: 1.1282, test_f1: 0.6417
 epoch: 88, train_loss: 0.5676, test_loss: 1.1135, test_f1: 0.6640
 epoch: 89, train_loss: 0.5731, test_loss: 1.1512, test_f1: 0.6326
 epoch: 90, train_loss: 0.5693, test_loss: 1.2119, test_f1: 0.6513
 epoch: 91, train_loss: 0.5564, test_loss: 1.2263, test_f1: 0.6343
 epoch: 92, train_loss: 0.5714, test_loss: 1.1114, test_f1: 0.6279
 epoch: 93, train_loss: 0.5507, test_loss: 1.1860, test_f1: 0.6241
 epoch: 94, train_loss: 0.5551, test_loss: 1.1552, test_f1: 0.6321
 epoch: 95, train_loss: 0.5443, test_loss: 1.2044, test_f1: 0.6549
 epoch: 96, train_loss: 0.5464, test_loss: 1.2496, test_f1: 0.6514
 epoch: 97, train_loss: 0.5437, test_loss: 1.1649, test_f1: 0.6386
 epoch: 98, train_loss: 0.5538, test_loss: 1.1287, test_f1: 0.6627
 epoch: 99, train_loss: 0.5230, test_loss: 1.1351, test_f1: 0.6556
##################ITERATION #7 ****************************************
 epoch: 0, train_loss: 1.2682, test_loss: 1.2086, test_f1: 0.3722
 epoch: 1, train_loss: 1.0439, test_loss: 1.0198, test_f1: 0.4997
 epoch: 2, train_loss: 0.9928, test_loss: 1.0355, test_f1: 0.4550
 epoch: 3, train_loss: 0.9923, test_loss: 1.1286, test_f1: 0.4227
 epoch: 4, train_loss: 0.9771, test_loss: 1.0324, test_f1: 0.4903
 epoch: 5, train_loss: 0.9530, test_loss: 1.0001, test_f1: 0.4671
 epoch: 6, train_loss: 0.9240, test_loss: 1.0394, test_f1: 0.4427
 epoch: 7, train_loss: 0.9325, test_loss: 1.0185, test_f1: 0.4873
 epoch: 8, train_loss: 0.9135, test_loss: 1.0000, test_f1: 0.4716
 epoch: 9, train_loss: 0.9096, test_loss: 0.9598, test_f1: 0.4897
 epoch: 10, train_loss: 0.9047, test_loss: 0.9582, test_f1: 0.4954
 epoch: 11, train_loss: 0.8914, test_loss: 0.9896, test_f1: 0.4763
 epoch: 12, train_loss: 0.9104, test_loss: 0.9727, test_f1: 0.4909
 epoch: 13, train_loss: 0.8883, test_loss: 0.9618, test_f1: 0.5605
 epoch: 14, train_loss: 0.8801, test_loss: 0.9799, test_f1: 0.5038
 epoch: 15, train_loss: 0.8916, test_loss: 0.9745, test_f1: 0.5182
 epoch: 16, train_loss: 0.8768, test_loss: 0.9657, test_f1: 0.5101
 epoch: 17, train_loss: 0.8735, test_loss: 0.9919, test_f1: 0.4892
 epoch: 18, train_loss: 0.8658, test_loss: 0.9573, test_f1: 0.5176
 epoch: 19, train_loss: 0.8711, test_loss: 0.9185, test_f1: 0.5548
 epoch: 20, train_loss: 0.8457, test_loss: 0.9403, test_f1: 0.5517
 epoch: 21, train_loss: 0.8456, test_loss: 0.9331, test_f1: 0.5636
 epoch: 22, train_loss: 0.8392, test_loss: 0.9273, test_f1: 0.5458
 epoch: 23, train_loss: 0.8474, test_loss: 0.9411, test_f1: 0.5372
 epoch: 24, train_loss: 0.8430, test_loss: 1.0382, test_f1: 0.5510
 epoch: 25, train_loss: 0.8426, test_loss: 0.9828, test_f1: 0.5287
 epoch: 26, train_loss: 0.8246, test_loss: 1.0088, test_f1: 0.5328
 epoch: 27, train_loss: 0.8480, test_loss: 0.9598, test_f1: 0.5275
 epoch: 28, train_loss: 0.8205, test_loss: 0.9429, test_f1: 0.5708
 epoch: 29, train_loss: 0.8172, test_loss: 0.9713, test_f1: 0.5734
 epoch: 30, train_loss: 0.8172, test_loss: 0.9184, test_f1: 0.5704
 epoch: 31, train_loss: 0.8047, test_loss: 0.9743, test_f1: 0.5517
 epoch: 32, train_loss: 0.8077, test_loss: 0.9442, test_f1: 0.5843
 epoch: 33, train_loss: 0.7958, test_loss: 1.0178, test_f1: 0.5485
 epoch: 34, train_loss: 0.8055, test_loss: 0.9951, test_f1: 0.5615
 epoch: 35, train_loss: 0.7829, test_loss: 0.9960, test_f1: 0.5449
 epoch: 36, train_loss: 0.8047, test_loss: 0.9623, test_f1: 0.5210
 epoch: 37, train_loss: 0.7916, test_loss: 1.0400, test_f1: 0.5778
 epoch: 38, train_loss: 0.7823, test_loss: 0.9775, test_f1: 0.6044
 epoch: 39, train_loss: 0.8001, test_loss: 1.0880, test_f1: 0.5913
 epoch: 40, train_loss: 0.7883, test_loss: 1.0886, test_f1: 0.5502
 epoch: 41, train_loss: 0.7745, test_loss: 1.0197, test_f1: 0.5810
 epoch: 42, train_loss: 0.7739, test_loss: 1.0915, test_f1: 0.5865
 epoch: 43, train_loss: 0.7732, test_loss: 1.0122, test_f1: 0.6328
 epoch: 44, train_loss: 0.7656, test_loss: 1.0056, test_f1: 0.5707
 epoch: 45, train_loss: 0.7533, test_loss: 1.1024, test_f1: 0.5527
 epoch: 46, train_loss: 0.7744, test_loss: 0.9838, test_f1: 0.5787
 epoch: 47, train_loss: 0.7742, test_loss: 1.0205, test_f1: 0.5626
 epoch: 48, train_loss: 0.7524, test_loss: 1.0229, test_f1: 0.5577
 epoch: 49, train_loss: 0.7492, test_loss: 0.9988, test_f1: 0.5915
 epoch: 50, train_loss: 0.7327, test_loss: 1.0884, test_f1: 0.5750
 epoch: 51, train_loss: 0.7222, test_loss: 1.0301, test_f1: 0.5923
 epoch: 52, train_loss: 0.7187, test_loss: 1.0366, test_f1: 0.5945
 epoch: 53, train_loss: 0.7055, test_loss: 1.0304, test_f1: 0.6105
 epoch: 54, train_loss: 0.7043, test_loss: 1.0388, test_f1: 0.5940
 epoch: 55, train_loss: 0.6976, test_loss: 1.0670, test_f1: 0.5798
 epoch: 56, train_loss: 0.6686, test_loss: 1.0119, test_f1: 0.6319
 epoch: 57, train_loss: 0.6954, test_loss: 1.0124, test_f1: 0.5884
 epoch: 58, train_loss: 0.6914, test_loss: 0.9698, test_f1: 0.6499
 epoch: 59, train_loss: 0.6934, test_loss: 1.0092, test_f1: 0.5991
 epoch: 60, train_loss: 0.6631, test_loss: 0.9700, test_f1: 0.6204
 epoch: 61, train_loss: 0.6871, test_loss: 0.9949, test_f1: 0.5975
 epoch: 62, train_loss: 0.6874, test_loss: 1.0402, test_f1: 0.6222
 epoch: 63, train_loss: 0.6577, test_loss: 0.9953, test_f1: 0.6293
 epoch: 64, train_loss: 0.6839, test_loss: 0.9681, test_f1: 0.6358
 epoch: 65, train_loss: 0.6848, test_loss: 0.9954, test_f1: 0.6335
 epoch: 66, train_loss: 0.6721, test_loss: 1.0167, test_f1: 0.6252
 epoch: 67, train_loss: 0.6805, test_loss: 0.9949, test_f1: 0.6489
 epoch: 68, train_loss: 0.6591, test_loss: 1.0641, test_f1: 0.5447
 epoch: 69, train_loss: 0.6748, test_loss: 0.9808, test_f1: 0.6253
 epoch: 70, train_loss: 0.6594, test_loss: 0.9755, test_f1: 0.6137
 epoch: 71, train_loss: 0.6616, test_loss: 1.0294, test_f1: 0.6200
 epoch: 72, train_loss: 0.6491, test_loss: 1.0247, test_f1: 0.6274
 epoch: 73, train_loss: 0.6500, test_loss: 1.0058, test_f1: 0.6290
 epoch: 74, train_loss: 0.6572, test_loss: 1.0062, test_f1: 0.6539
 epoch: 75, train_loss: 0.6595, test_loss: 1.0540, test_f1: 0.6239
 epoch: 76, train_loss: 0.6597, test_loss: 1.0656, test_f1: 0.6151
 epoch: 77, train_loss: 0.6515, test_loss: 1.1151, test_f1: 0.6070
 epoch: 78, train_loss: 0.6479, test_loss: 0.9745, test_f1: 0.6783
 epoch: 79, train_loss: 0.6491, test_loss: 1.0815, test_f1: 0.6270
 epoch: 80, train_loss: 0.6425, test_loss: 1.0451, test_f1: 0.6378
 epoch: 81, train_loss: 0.6378, test_loss: 1.1079, test_f1: 0.6314
 epoch: 82, train_loss: 0.6360, test_loss: 1.0363, test_f1: 0.6381
 epoch: 83, train_loss: 0.6420, test_loss: 1.0839, test_f1: 0.6191
 epoch: 84, train_loss: 0.6448, test_loss: 0.9866, test_f1: 0.6247
 epoch: 85, train_loss: 0.6537, test_loss: 1.0430, test_f1: 0.6502
 epoch: 86, train_loss: 0.6441, test_loss: 1.1860, test_f1: 0.6093
 epoch: 87, train_loss: 0.6306, test_loss: 1.1834, test_f1: 0.6250
 epoch: 88, train_loss: 0.6356, test_loss: 1.0364, test_f1: 0.6658
 epoch: 89, train_loss: 0.6400, test_loss: 1.2419, test_f1: 0.5944
 epoch: 90, train_loss: 0.6400, test_loss: 1.0952, test_f1: 0.6167
 epoch: 91, train_loss: 0.6281, test_loss: 1.0514, test_f1: 0.6070
 epoch: 92, train_loss: 0.6208, test_loss: 1.0519, test_f1: 0.6552
 epoch: 93, train_loss: 0.6317, test_loss: 1.0691, test_f1: 0.6003
 epoch: 94, train_loss: 0.6293, test_loss: 1.1938, test_f1: 0.6036
 epoch: 95, train_loss: 0.6398, test_loss: 1.2012, test_f1: 0.6054
 epoch: 96, train_loss: 0.6071, test_loss: 1.0013, test_f1: 0.6733
 epoch: 97, train_loss: 0.5943, test_loss: 1.0401, test_f1: 0.6441
 epoch: 98, train_loss: 0.5958, test_loss: 1.0042, test_f1: 0.6600
 epoch: 99, train_loss: 0.6177, test_loss: 1.0472, test_f1: 0.6745
##################ITERATION #8 ****************************************
 epoch: 0, train_loss: 1.2468, test_loss: 1.2390, test_f1: 0.3377
 epoch: 1, train_loss: 1.0504, test_loss: 1.0013, test_f1: 0.4324
 epoch: 2, train_loss: 0.9974, test_loss: 0.9584, test_f1: 0.4779
 epoch: 3, train_loss: 0.9827, test_loss: 1.0143, test_f1: 0.4489
 epoch: 4, train_loss: 0.9498, test_loss: 0.9791, test_f1: 0.4740
 epoch: 5, train_loss: 0.9454, test_loss: 0.9530, test_f1: 0.5039
 epoch: 6, train_loss: 0.9374, test_loss: 1.0011, test_f1: 0.4594
 epoch: 7, train_loss: 0.9258, test_loss: 0.9015, test_f1: 0.5362
 epoch: 8, train_loss: 0.9141, test_loss: 0.9938, test_f1: 0.4926
 epoch: 9, train_loss: 0.9102, test_loss: 0.9293, test_f1: 0.5208
 epoch: 10, train_loss: 0.8905, test_loss: 0.9378, test_f1: 0.5262
 epoch: 11, train_loss: 0.8712, test_loss: 0.9998, test_f1: 0.4954
 epoch: 12, train_loss: 0.8829, test_loss: 0.9750, test_f1: 0.5033
 epoch: 13, train_loss: 0.8657, test_loss: 0.9169, test_f1: 0.5503
 epoch: 14, train_loss: 0.8476, test_loss: 0.9521, test_f1: 0.5436
 epoch: 15, train_loss: 0.8507, test_loss: 0.9647, test_f1: 0.5372
 epoch: 16, train_loss: 0.8500, test_loss: 0.9018, test_f1: 0.5429
 epoch: 17, train_loss: 0.8536, test_loss: 0.8663, test_f1: 0.5562
 epoch: 18, train_loss: 0.8342, test_loss: 0.9249, test_f1: 0.5953
 epoch: 19, train_loss: 0.8441, test_loss: 0.9217, test_f1: 0.5251
 epoch: 20, train_loss: 0.8303, test_loss: 0.9226, test_f1: 0.5473
 epoch: 21, train_loss: 0.8110, test_loss: 0.8753, test_f1: 0.5864
 epoch: 22, train_loss: 0.8247, test_loss: 0.9033, test_f1: 0.5559
 epoch: 23, train_loss: 0.7975, test_loss: 0.8944, test_f1: 0.5887
 epoch: 24, train_loss: 0.8019, test_loss: 0.9997, test_f1: 0.5204
 epoch: 25, train_loss: 0.8226, test_loss: 0.8784, test_f1: 0.5708
 epoch: 26, train_loss: 0.8017, test_loss: 0.9522, test_f1: 0.5824
 epoch: 27, train_loss: 0.8128, test_loss: 0.9250, test_f1: 0.5566
 epoch: 28, train_loss: 0.8020, test_loss: 0.9147, test_f1: 0.5704
 epoch: 29, train_loss: 0.7914, test_loss: 0.8798, test_f1: 0.5953
 epoch: 30, train_loss: 0.7940, test_loss: 0.9031, test_f1: 0.5979
 epoch: 31, train_loss: 0.7806, test_loss: 0.9178, test_f1: 0.6066
 epoch: 32, train_loss: 0.7787, test_loss: 0.9008, test_f1: 0.5804
 epoch: 33, train_loss: 0.7671, test_loss: 0.9212, test_f1: 0.5883
 epoch: 34, train_loss: 0.7691, test_loss: 0.9193, test_f1: 0.6068
 epoch: 35, train_loss: 0.7569, test_loss: 0.9158, test_f1: 0.5802
 epoch: 36, train_loss: 0.7572, test_loss: 0.9605, test_f1: 0.5656
 epoch: 37, train_loss: 0.7545, test_loss: 0.9367, test_f1: 0.5599
 epoch: 38, train_loss: 0.7453, test_loss: 0.9502, test_f1: 0.6082
 epoch: 39, train_loss: 0.7488, test_loss: 0.8681, test_f1: 0.5769
 epoch: 40, train_loss: 0.7389, test_loss: 0.8917, test_f1: 0.6322
 epoch: 41, train_loss: 0.7369, test_loss: 0.8735, test_f1: 0.6211
 epoch: 42, train_loss: 0.7364, test_loss: 0.9516, test_f1: 0.5472
 epoch: 43, train_loss: 0.7297, test_loss: 0.9632, test_f1: 0.5665
 epoch: 44, train_loss: 0.7321, test_loss: 0.8893, test_f1: 0.5528
 epoch: 45, train_loss: 0.7409, test_loss: 0.9683, test_f1: 0.5670
 epoch: 46, train_loss: 0.7453, test_loss: 0.8917, test_f1: 0.5920
 epoch: 47, train_loss: 0.7327, test_loss: 0.8818, test_f1: 0.5958
 epoch: 48, train_loss: 0.7080, test_loss: 0.9767, test_f1: 0.5919
 epoch: 49, train_loss: 0.7334, test_loss: 0.8993, test_f1: 0.5900
 epoch: 50, train_loss: 0.7281, test_loss: 0.8611, test_f1: 0.6022
 epoch: 51, train_loss: 0.7069, test_loss: 0.8812, test_f1: 0.5976
 epoch: 52, train_loss: 0.6857, test_loss: 0.9589, test_f1: 0.5889
 epoch: 53, train_loss: 0.6710, test_loss: 0.8380, test_f1: 0.6267
 epoch: 54, train_loss: 0.6736, test_loss: 0.8900, test_f1: 0.6051
 epoch: 55, train_loss: 0.6531, test_loss: 0.9169, test_f1: 0.6168
 epoch: 56, train_loss: 0.6456, test_loss: 0.9327, test_f1: 0.6256
 epoch: 57, train_loss: 0.6477, test_loss: 0.8800, test_f1: 0.6114
 epoch: 58, train_loss: 0.6578, test_loss: 0.8801, test_f1: 0.6408
 epoch: 59, train_loss: 0.6414, test_loss: 0.8841, test_f1: 0.5989
 epoch: 60, train_loss: 0.6428, test_loss: 0.9374, test_f1: 0.6152
 epoch: 61, train_loss: 0.6435, test_loss: 0.9190, test_f1: 0.6379
 epoch: 62, train_loss: 0.6259, test_loss: 0.9003, test_f1: 0.6184
 epoch: 63, train_loss: 0.6351, test_loss: 0.8846, test_f1: 0.6289
 epoch: 64, train_loss: 0.6488, test_loss: 0.9311, test_f1: 0.6219
 epoch: 65, train_loss: 0.6345, test_loss: 0.8878, test_f1: 0.6263
 epoch: 66, train_loss: 0.6260, test_loss: 0.9839, test_f1: 0.5892
 epoch: 67, train_loss: 0.6400, test_loss: 0.9247, test_f1: 0.6189
 epoch: 68, train_loss: 0.6336, test_loss: 0.9207, test_f1: 0.6174
 epoch: 69, train_loss: 0.6168, test_loss: 0.9190, test_f1: 0.6125
 epoch: 70, train_loss: 0.6183, test_loss: 0.9294, test_f1: 0.6078
 epoch: 71, train_loss: 0.6139, test_loss: 0.9106, test_f1: 0.6247
 epoch: 72, train_loss: 0.6308, test_loss: 0.9799, test_f1: 0.6288
 epoch: 73, train_loss: 0.6303, test_loss: 0.9883, test_f1: 0.6344
 epoch: 74, train_loss: 0.6328, test_loss: 0.9538, test_f1: 0.6089
 epoch: 75, train_loss: 0.6097, test_loss: 0.9405, test_f1: 0.6471
 epoch: 76, train_loss: 0.6195, test_loss: 0.9231, test_f1: 0.6047
 epoch: 77, train_loss: 0.6095, test_loss: 1.0149, test_f1: 0.6164
 epoch: 78, train_loss: 0.6007, test_loss: 0.9245, test_f1: 0.6004
 epoch: 79, train_loss: 0.5930, test_loss: 0.9072, test_f1: 0.6521
 epoch: 80, train_loss: 0.5926, test_loss: 0.9607, test_f1: 0.6282
 epoch: 81, train_loss: 0.6143, test_loss: 1.0093, test_f1: 0.5929
 epoch: 82, train_loss: 0.6083, test_loss: 1.0261, test_f1: 0.5959
 epoch: 83, train_loss: 0.6056, test_loss: 0.9438, test_f1: 0.6289
 epoch: 84, train_loss: 0.6033, test_loss: 0.9565, test_f1: 0.5872
 epoch: 85, train_loss: 0.5815, test_loss: 0.9137, test_f1: 0.6485
 epoch: 86, train_loss: 0.5848, test_loss: 0.9493, test_f1: 0.6309
 epoch: 87, train_loss: 0.6025, test_loss: 0.9569, test_f1: 0.6292
 epoch: 88, train_loss: 0.5858, test_loss: 0.9784, test_f1: 0.6359
 epoch: 89, train_loss: 0.5936, test_loss: 0.9757, test_f1: 0.6311
 epoch: 90, train_loss: 0.5704, test_loss: 0.9351, test_f1: 0.6419
 epoch: 91, train_loss: 0.5811, test_loss: 1.0177, test_f1: 0.6242
 epoch: 92, train_loss: 0.5766, test_loss: 0.9560, test_f1: 0.6509
 epoch: 93, train_loss: 0.5977, test_loss: 0.9097, test_f1: 0.6228
 epoch: 94, train_loss: 0.5737, test_loss: 0.9607, test_f1: 0.6447
 epoch: 95, train_loss: 0.5916, test_loss: 0.9269, test_f1: 0.6438
 epoch: 96, train_loss: 0.5870, test_loss: 0.9316, test_f1: 0.5982
 epoch: 97, train_loss: 0.5697, test_loss: 0.9400, test_f1: 0.6421
 epoch: 98, train_loss: 0.5517, test_loss: 1.0159, test_f1: 0.6060
 epoch: 99, train_loss: 0.5781, test_loss: 0.9331, test_f1: 0.6417
##################ITERATION #9 ****************************************
 epoch: 0, train_loss: 1.2264, test_loss: 1.1604, test_f1: 0.3927
 epoch: 1, train_loss: 1.0162, test_loss: 0.9778, test_f1: 0.4920
 epoch: 2, train_loss: 0.9736, test_loss: 0.9211, test_f1: 0.4906
 epoch: 3, train_loss: 0.9512, test_loss: 1.0325, test_f1: 0.5040
 epoch: 4, train_loss: 0.9511, test_loss: 0.9658, test_f1: 0.5338
 epoch: 5, train_loss: 0.9261, test_loss: 0.9494, test_f1: 0.5330
 epoch: 6, train_loss: 0.9071, test_loss: 0.9239, test_f1: 0.5154
 epoch: 7, train_loss: 0.9089, test_loss: 0.9429, test_f1: 0.5184
 epoch: 8, train_loss: 0.8940, test_loss: 0.9659, test_f1: 0.5320
 epoch: 9, train_loss: 0.8842, test_loss: 0.9662, test_f1: 0.5011
 epoch: 10, train_loss: 0.8868, test_loss: 1.0031, test_f1: 0.4991
 epoch: 11, train_loss: 0.8787, test_loss: 1.0437, test_f1: 0.4904
 epoch: 12, train_loss: 0.8634, test_loss: 0.9963, test_f1: 0.4860
 epoch: 13, train_loss: 0.8619, test_loss: 1.0165, test_f1: 0.4825
 epoch: 14, train_loss: 0.8848, test_loss: 1.0903, test_f1: 0.4666
 epoch: 15, train_loss: 0.8717, test_loss: 0.9176, test_f1: 0.5116
 epoch: 16, train_loss: 0.8403, test_loss: 1.2473, test_f1: 0.4444
 epoch: 17, train_loss: 0.8388, test_loss: 0.8864, test_f1: 0.5140
 epoch: 18, train_loss: 0.8254, test_loss: 0.8494, test_f1: 0.5351
 epoch: 19, train_loss: 0.8255, test_loss: 1.0799, test_f1: 0.5221
 epoch: 20, train_loss: 0.8189, test_loss: 0.9259, test_f1: 0.5374
 epoch: 21, train_loss: 0.8174, test_loss: 0.9313, test_f1: 0.5195
 epoch: 22, train_loss: 0.8006, test_loss: 0.9729, test_f1: 0.5086
 epoch: 23, train_loss: 0.7943, test_loss: 0.8977, test_f1: 0.5739
 epoch: 24, train_loss: 0.7952, test_loss: 0.8838, test_f1: 0.5621
 epoch: 25, train_loss: 0.8010, test_loss: 0.9411, test_f1: 0.5714
 epoch: 26, train_loss: 0.8011, test_loss: 0.9818, test_f1: 0.5611
 epoch: 27, train_loss: 0.7739, test_loss: 0.9305, test_f1: 0.5620
 epoch: 28, train_loss: 0.7617, test_loss: 0.9298, test_f1: 0.5330
 epoch: 29, train_loss: 0.7877, test_loss: 0.9275, test_f1: 0.5656
 epoch: 30, train_loss: 0.7623, test_loss: 0.9140, test_f1: 0.5545
 epoch: 31, train_loss: 0.7596, test_loss: 0.9249, test_f1: 0.5559
 epoch: 32, train_loss: 0.7543, test_loss: 0.9195, test_f1: 0.5673
 epoch: 33, train_loss: 0.7530, test_loss: 0.9925, test_f1: 0.5741
 epoch: 34, train_loss: 0.7677, test_loss: 0.8976, test_f1: 0.5947
 epoch: 35, train_loss: 0.7649, test_loss: 0.9663, test_f1: 0.6091
 epoch: 36, train_loss: 0.7209, test_loss: 0.8856, test_f1: 0.5797
 epoch: 37, train_loss: 0.7304, test_loss: 0.8620, test_f1: 0.5979
 epoch: 38, train_loss: 0.7474, test_loss: 0.9550, test_f1: 0.6107
 epoch: 39, train_loss: 0.7469, test_loss: 0.9338, test_f1: 0.6137
 epoch: 40, train_loss: 0.7212, test_loss: 0.8533, test_f1: 0.6341
 epoch: 41, train_loss: 0.7301, test_loss: 0.9099, test_f1: 0.5754
 epoch: 42, train_loss: 0.7245, test_loss: 0.9699, test_f1: 0.5648
 epoch: 43, train_loss: 0.7276, test_loss: 0.9442, test_f1: 0.6026
 epoch: 44, train_loss: 0.7109, test_loss: 0.9255, test_f1: 0.6203
 epoch: 45, train_loss: 0.7234, test_loss: 0.9481, test_f1: 0.5904
 epoch: 46, train_loss: 0.7162, test_loss: 0.9259, test_f1: 0.6143
 epoch: 47, train_loss: 0.7284, test_loss: 0.9125, test_f1: 0.6013
 epoch: 48, train_loss: 0.7154, test_loss: 0.9430, test_f1: 0.5942
 epoch: 49, train_loss: 0.7138, test_loss: 0.9074, test_f1: 0.6092
 epoch: 50, train_loss: 0.7094, test_loss: 0.9581, test_f1: 0.5426
 epoch: 51, train_loss: 0.6948, test_loss: 0.9269, test_f1: 0.6038
 epoch: 52, train_loss: 0.6695, test_loss: 0.9133, test_f1: 0.6030
 epoch: 53, train_loss: 0.6628, test_loss: 0.9216, test_f1: 0.6294
 epoch: 54, train_loss: 0.6579, test_loss: 0.9146, test_f1: 0.6183
 epoch: 55, train_loss: 0.6452, test_loss: 0.9236, test_f1: 0.6088
 epoch: 56, train_loss: 0.6449, test_loss: 0.9802, test_f1: 0.6363
 epoch: 57, train_loss: 0.6344, test_loss: 0.9572, test_f1: 0.6184
 epoch: 58, train_loss: 0.6404, test_loss: 0.9482, test_f1: 0.6201
 epoch: 59, train_loss: 0.6357, test_loss: 0.9880, test_f1: 0.6016
 epoch: 60, train_loss: 0.6229, test_loss: 0.9863, test_f1: 0.6026
 epoch: 61, train_loss: 0.6250, test_loss: 0.9391, test_f1: 0.5987
 epoch: 62, train_loss: 0.6067, test_loss: 1.0115, test_f1: 0.6334
 epoch: 63, train_loss: 0.6354, test_loss: 1.0367, test_f1: 0.5978
 epoch: 64, train_loss: 0.6096, test_loss: 0.9968, test_f1: 0.6222
 epoch: 65, train_loss: 0.5874, test_loss: 1.0538, test_f1: 0.5828
 epoch: 66, train_loss: 0.6085, test_loss: 1.1161, test_f1: 0.5889
 epoch: 67, train_loss: 0.6056, test_loss: 0.9332, test_f1: 0.6441
 epoch: 68, train_loss: 0.6217, test_loss: 1.0442, test_f1: 0.6214
 epoch: 69, train_loss: 0.6067, test_loss: 1.0384, test_f1: 0.6138
 epoch: 70, train_loss: 0.5897, test_loss: 1.0742, test_f1: 0.6157
 epoch: 71, train_loss: 0.6014, test_loss: 0.9836, test_f1: 0.6371
 epoch: 72, train_loss: 0.5929, test_loss: 1.0896, test_f1: 0.5904
 epoch: 73, train_loss: 0.5916, test_loss: 1.0628, test_f1: 0.6170
 epoch: 74, train_loss: 0.5861, test_loss: 1.0852, test_f1: 0.6123
 epoch: 75, train_loss: 0.5995, test_loss: 1.0670, test_f1: 0.5984
 epoch: 76, train_loss: 0.6142, test_loss: 1.1327, test_f1: 0.5941
 epoch: 77, train_loss: 0.5781, test_loss: 1.0564, test_f1: 0.6085
 epoch: 78, train_loss: 0.5820, test_loss: 1.0436, test_f1: 0.6297
 epoch: 79, train_loss: 0.5869, test_loss: 1.1088, test_f1: 0.5950
 epoch: 80, train_loss: 0.5710, test_loss: 1.1143, test_f1: 0.5929
 epoch: 81, train_loss: 0.5714, test_loss: 1.1518, test_f1: 0.6264
 epoch: 82, train_loss: 0.5627, test_loss: 1.1033, test_f1: 0.6116
 epoch: 83, train_loss: 0.5669, test_loss: 1.1618, test_f1: 0.6090
 epoch: 84, train_loss: 0.5731, test_loss: 1.1295, test_f1: 0.6127
 epoch: 85, train_loss: 0.5759, test_loss: 1.2351, test_f1: 0.6099
 epoch: 86, train_loss: 0.5592, test_loss: 1.1439, test_f1: 0.6051
 epoch: 87, train_loss: 0.5536, test_loss: 1.2035, test_f1: 0.6236
 epoch: 88, train_loss: 0.5550, test_loss: 1.2018, test_f1: 0.6291
 epoch: 89, train_loss: 0.5551, test_loss: 1.2459, test_f1: 0.5952
 epoch: 90, train_loss: 0.5575, test_loss: 1.0873, test_f1: 0.6402
 epoch: 91, train_loss: 0.5638, test_loss: 1.1671, test_f1: 0.5885
 epoch: 92, train_loss: 0.5540, test_loss: 1.2861, test_f1: 0.5809
 epoch: 93, train_loss: 0.5597, test_loss: 1.1589, test_f1: 0.6160
 epoch: 94, train_loss: 0.5480, test_loss: 1.1796, test_f1: 0.6121
 epoch: 95, train_loss: 0.5492, test_loss: 1.4201, test_f1: 0.6039
 epoch: 96, train_loss: 0.5663, test_loss: 1.0580, test_f1: 0.6077
 epoch: 97, train_loss: 0.5369, test_loss: 1.3679, test_f1: 0.6026
 epoch: 98, train_loss: 0.5476, test_loss: 1.2909, test_f1: 0.5993
 epoch: 99, train_loss: 0.5311, test_loss: 1.3752, test_f1: 0.6017

Training completed in 487.14 seconds
Best F1: 0.7071 at epoch 83
Mean F1 across iterations: 0.6711  0.0164
========================FINAL RESULTS================================
FEGIN weighted F1: 0.7071  0.0164
python main.py --data ltspice_examples --representation component_net --model FEGIN --layers 4 --hiddens 32 --batch_size 128 --lr 0.01 --emb_size 250 --epochs 100 --save_appendix component_net_L4_H32_BS128_LR0.01_E250 --no_val
-----



STDERR:
  File "main.py", line 370, in <module>
    main()
  File "main.py", line 254, in main
    dataset = dataset_class(
  File "/home/philip/projects/ltspice_examples_code_repo/Circuit-Completion-Using-GNNs/component_classification_with_link_prediction_head/evaluation/FEGIN/kernel/circuit_datasets.py", line 15, in __init__
    self.data, self.slices = torch.load(self.processed_paths[0])
  File "/home/philip/.local/lib/python3.8/site-packages/torch/serialization.py", line 1040, in load
    warnings.warn(
  File "/usr/lib/python3.8/warnings.py", line 109, in _showwarnmsg
    sw(msg.message, msg.category, msg.filename, msg.lineno,
  File "main.py", line 47, in warn_with_traceback
    traceback.print_stack(file=log)
/home/philip/projects/ltspice_examples_code_repo/Circuit-Completion-Using-GNNs/component_classification_with_link_prediction_head/evaluation/FEGIN/kernel/circuit_datasets.py:15: FutureWarning: You are using `torch.load` with `weights_only=False` (the current default value), which uses the default pickle module implicitly. It is possible to construct malicious pickle data which will execute arbitrary code during unpickling (See https://github.com/pytorch/pytorch/blob/main/SECURITY.md#untrusted-models for more details). In a future release, the default value for `weights_only` will be flipped to `True`. This limits the functions that could be executed during unpickling. Arbitrary objects will no longer be allowed to be loaded via this mode unless they are explicitly allowlisted by the user via `torch.serialization.add_safe_globals`. We recommend you start setting `weights_only=True` for any use case where you don't have full control of the loaded file. Please open an issue on GitHub for any issues related to this experimental feature.
  self.data, self.slices = torch.load(self.processed_paths[0])
