STDOUT:
Results will be saved in /home/philip/projects/ltspice_examples_code_repo/Circuit-Completion-Using-GNNs/component_classification_with_link_prediction_head/evaluation/FEGIN/results/model_FEGIN_dataset_ltspice_demos
Command line input: python main.py --data ltspice_demos --representation component_net --model FEGIN --layers 2 --hiddens 128 --batch_size 64 --lr 0.0001 --emb_size 128 --epochs 100 --save_appendix component_net_L2_H128_BS64_LR0.0001_E128 --no_val
 is saved.
-----
ltspice_demos - FEGIN
Using 2 layers, 128 hidden units, h = 2
Loading component_net representation dataset
ENTERED
Training FEGIN on component_net representation
Train: 1565, Test: 383
##################ITERATION #0 ****************************************
 epoch: 0, train_loss: 1.3674, test_loss: 1.3694, test_f1: 0.2281
 epoch: 1, train_loss: 1.3356, test_loss: 1.3531, test_f1: 0.2281
 epoch: 2, train_loss: 1.3089, test_loss: 1.3230, test_f1: 0.2281
 epoch: 3, train_loss: 1.2753, test_loss: 1.2916, test_f1: 0.2281
 epoch: 4, train_loss: 1.2340, test_loss: 1.2668, test_f1: 0.2721
 epoch: 5, train_loss: 1.1982, test_loss: 1.2455, test_f1: 0.2775
 epoch: 6, train_loss: 1.1759, test_loss: 1.2331, test_f1: 0.2833
 epoch: 7, train_loss: 1.1480, test_loss: 1.2210, test_f1: 0.2886
 epoch: 8, train_loss: 1.1301, test_loss: 1.2108, test_f1: 0.3179
 epoch: 9, train_loss: 1.1158, test_loss: 1.1997, test_f1: 0.3720
 epoch: 10, train_loss: 1.0990, test_loss: 1.1934, test_f1: 0.4035
 epoch: 11, train_loss: 1.0763, test_loss: 1.1779, test_f1: 0.4075
 epoch: 12, train_loss: 1.0599, test_loss: 1.1706, test_f1: 0.4049
 epoch: 13, train_loss: 1.0401, test_loss: 1.1538, test_f1: 0.4051
 epoch: 14, train_loss: 1.0292, test_loss: 1.1486, test_f1: 0.4146
 epoch: 15, train_loss: 1.0154, test_loss: 1.1287, test_f1: 0.4142
 epoch: 16, train_loss: 1.0022, test_loss: 1.1298, test_f1: 0.4245
 epoch: 17, train_loss: 0.9866, test_loss: 1.1086, test_f1: 0.4532
 epoch: 18, train_loss: 0.9733, test_loss: 1.0928, test_f1: 0.4482
 epoch: 19, train_loss: 0.9639, test_loss: 1.0962, test_f1: 0.4729
 epoch: 20, train_loss: 0.9537, test_loss: 1.0929, test_f1: 0.4697
 epoch: 21, train_loss: 0.9389, test_loss: 1.0648, test_f1: 0.5073
 epoch: 22, train_loss: 0.9335, test_loss: 1.0816, test_f1: 0.4827
 epoch: 23, train_loss: 0.9147, test_loss: 1.0642, test_f1: 0.4987
 epoch: 24, train_loss: 0.9114, test_loss: 1.0859, test_f1: 0.5053
 epoch: 25, train_loss: 0.8955, test_loss: 1.0614, test_f1: 0.5090
 epoch: 26, train_loss: 0.8994, test_loss: 1.0509, test_f1: 0.5117
 epoch: 27, train_loss: 0.8876, test_loss: 1.0462, test_f1: 0.5384
 epoch: 28, train_loss: 0.8786, test_loss: 1.0616, test_f1: 0.5315
 epoch: 29, train_loss: 0.8702, test_loss: 1.0465, test_f1: 0.5402
 epoch: 30, train_loss: 0.8641, test_loss: 1.0335, test_f1: 0.5457
 epoch: 31, train_loss: 0.8593, test_loss: 1.0545, test_f1: 0.5135
 epoch: 32, train_loss: 0.8528, test_loss: 1.0338, test_f1: 0.5413
 epoch: 33, train_loss: 0.8416, test_loss: 1.0269, test_f1: 0.5500
 epoch: 34, train_loss: 0.8370, test_loss: 0.9950, test_f1: 0.5868
 epoch: 35, train_loss: 0.8313, test_loss: 1.0432, test_f1: 0.5693
 epoch: 36, train_loss: 0.8277, test_loss: 1.0400, test_f1: 0.5886
 epoch: 37, train_loss: 0.8176, test_loss: 1.0322, test_f1: 0.5590
 epoch: 38, train_loss: 0.8220, test_loss: 1.0892, test_f1: 0.5546
 epoch: 39, train_loss: 0.8044, test_loss: 1.0100, test_f1: 0.5730
 epoch: 40, train_loss: 0.8067, test_loss: 1.0615, test_f1: 0.5596
 epoch: 41, train_loss: 0.7934, test_loss: 1.0589, test_f1: 0.5519
 epoch: 42, train_loss: 0.7929, test_loss: 1.0453, test_f1: 0.5479
 epoch: 43, train_loss: 0.7875, test_loss: 1.0408, test_f1: 0.5525
 epoch: 44, train_loss: 0.7755, test_loss: 1.0755, test_f1: 0.5477
 epoch: 45, train_loss: 0.7774, test_loss: 1.0338, test_f1: 0.6015
 epoch: 46, train_loss: 0.7719, test_loss: 1.0443, test_f1: 0.5592
 epoch: 47, train_loss: 0.7598, test_loss: 1.0405, test_f1: 0.5880
 epoch: 48, train_loss: 0.7552, test_loss: 1.0615, test_f1: 0.5727
 epoch: 49, train_loss: 0.7455, test_loss: 1.0279, test_f1: 0.5588
 epoch: 50, train_loss: 0.7519, test_loss: 1.0055, test_f1: 0.5727
 epoch: 51, train_loss: 0.7333, test_loss: 1.0347, test_f1: 0.5809
 epoch: 52, train_loss: 0.7277, test_loss: 1.0190, test_f1: 0.5865
 epoch: 53, train_loss: 0.7287, test_loss: 1.0319, test_f1: 0.5990
 epoch: 54, train_loss: 0.7192, test_loss: 1.0285, test_f1: 0.5799
 epoch: 55, train_loss: 0.7189, test_loss: 1.0208, test_f1: 0.5828
 epoch: 56, train_loss: 0.7118, test_loss: 1.0351, test_f1: 0.5829
 epoch: 57, train_loss: 0.7138, test_loss: 1.0459, test_f1: 0.5988
 epoch: 58, train_loss: 0.7134, test_loss: 1.0478, test_f1: 0.5830
 epoch: 59, train_loss: 0.7094, test_loss: 1.0414, test_f1: 0.5840
 epoch: 60, train_loss: 0.7137, test_loss: 1.0202, test_f1: 0.5841
 epoch: 61, train_loss: 0.7068, test_loss: 1.0585, test_f1: 0.5677
 epoch: 62, train_loss: 0.7023, test_loss: 1.0368, test_f1: 0.5751
 epoch: 63, train_loss: 0.7011, test_loss: 1.0166, test_f1: 0.5947
 epoch: 64, train_loss: 0.7041, test_loss: 1.0421, test_f1: 0.6045
 epoch: 65, train_loss: 0.6969, test_loss: 1.0821, test_f1: 0.5941
 epoch: 66, train_loss: 0.6908, test_loss: 1.0435, test_f1: 0.6037
 epoch: 67, train_loss: 0.6964, test_loss: 1.0421, test_f1: 0.5890
 epoch: 68, train_loss: 0.6752, test_loss: 1.0343, test_f1: 0.5959
 epoch: 69, train_loss: 0.6715, test_loss: 1.0294, test_f1: 0.6149
 epoch: 70, train_loss: 0.6797, test_loss: 1.0413, test_f1: 0.5925
 epoch: 71, train_loss: 0.6809, test_loss: 1.0554, test_f1: 0.5949
 epoch: 72, train_loss: 0.6745, test_loss: 1.0466, test_f1: 0.6014
 epoch: 73, train_loss: 0.6738, test_loss: 1.0315, test_f1: 0.5847
 epoch: 74, train_loss: 0.6607, test_loss: 1.0683, test_f1: 0.5950
 epoch: 75, train_loss: 0.6537, test_loss: 1.0532, test_f1: 0.5856
 epoch: 76, train_loss: 0.6590, test_loss: 1.0634, test_f1: 0.5939
 epoch: 77, train_loss: 0.6605, test_loss: 1.0462, test_f1: 0.5961
 epoch: 78, train_loss: 0.6598, test_loss: 1.0456, test_f1: 0.6000
 epoch: 79, train_loss: 0.6544, test_loss: 1.0857, test_f1: 0.5807
 epoch: 80, train_loss: 0.6436, test_loss: 1.0477, test_f1: 0.5956
 epoch: 81, train_loss: 0.6401, test_loss: 1.0737, test_f1: 0.5923
 epoch: 82, train_loss: 0.6410, test_loss: 1.0736, test_f1: 0.5918
 epoch: 83, train_loss: 0.6435, test_loss: 1.0955, test_f1: 0.5798
 epoch: 84, train_loss: 0.6465, test_loss: 1.0461, test_f1: 0.5974
 epoch: 85, train_loss: 0.6427, test_loss: 1.0492, test_f1: 0.6232
 epoch: 86, train_loss: 0.6292, test_loss: 1.0542, test_f1: 0.6022
 epoch: 87, train_loss: 0.6410, test_loss: 1.0778, test_f1: 0.5923
 epoch: 88, train_loss: 0.6295, test_loss: 1.0852, test_f1: 0.6064
 epoch: 89, train_loss: 0.6310, test_loss: 1.0672, test_f1: 0.5969
 epoch: 90, train_loss: 0.6203, test_loss: 1.1185, test_f1: 0.5924
 epoch: 91, train_loss: 0.6260, test_loss: 1.0828, test_f1: 0.6077
 epoch: 92, train_loss: 0.6208, test_loss: 1.0953, test_f1: 0.6266
 epoch: 93, train_loss: 0.6184, test_loss: 1.0743, test_f1: 0.6114
 epoch: 94, train_loss: 0.6145, test_loss: 1.0981, test_f1: 0.6138
 epoch: 95, train_loss: 0.6215, test_loss: 1.0742, test_f1: 0.6160
 epoch: 96, train_loss: 0.6264, test_loss: 1.1250, test_f1: 0.6139
 epoch: 97, train_loss: 0.6072, test_loss: 1.0915, test_f1: 0.6104
 epoch: 98, train_loss: 0.6097, test_loss: 1.0732, test_f1: 0.6253
 epoch: 99, train_loss: 0.6026, test_loss: 1.1305, test_f1: 0.5975
##################ITERATION #1 ****************************************
 epoch: 0, train_loss: 1.2834, test_loss: 1.3214, test_f1: 0.1801
 epoch: 1, train_loss: 1.1875, test_loss: 1.2720, test_f1: 0.3302
 epoch: 2, train_loss: 1.1480, test_loss: 1.2246, test_f1: 0.3491
 epoch: 3, train_loss: 1.1232, test_loss: 1.1909, test_f1: 0.3932
 epoch: 4, train_loss: 1.0929, test_loss: 1.1681, test_f1: 0.4193
 epoch: 5, train_loss: 1.0667, test_loss: 1.1458, test_f1: 0.4351
 epoch: 6, train_loss: 1.0501, test_loss: 1.1274, test_f1: 0.4673
 epoch: 7, train_loss: 1.0242, test_loss: 1.1116, test_f1: 0.4743
 epoch: 8, train_loss: 0.9991, test_loss: 1.0940, test_f1: 0.4811
 epoch: 9, train_loss: 0.9807, test_loss: 1.0805, test_f1: 0.4866
 epoch: 10, train_loss: 0.9686, test_loss: 1.0784, test_f1: 0.4915
 epoch: 11, train_loss: 0.9601, test_loss: 1.0660, test_f1: 0.4938
 epoch: 12, train_loss: 0.9424, test_loss: 1.0493, test_f1: 0.4917
 epoch: 13, train_loss: 0.9352, test_loss: 1.0520, test_f1: 0.4993
 epoch: 14, train_loss: 0.9232, test_loss: 1.0489, test_f1: 0.5066
 epoch: 15, train_loss: 0.9149, test_loss: 1.0375, test_f1: 0.5157
 epoch: 16, train_loss: 0.8976, test_loss: 1.0477, test_f1: 0.5161
 epoch: 17, train_loss: 0.8898, test_loss: 1.0562, test_f1: 0.5145
 epoch: 18, train_loss: 0.8985, test_loss: 1.0593, test_f1: 0.5319
 epoch: 19, train_loss: 0.8829, test_loss: 1.0556, test_f1: 0.5085
 epoch: 20, train_loss: 0.8733, test_loss: 1.0425, test_f1: 0.5342
 epoch: 21, train_loss: 0.8652, test_loss: 1.0365, test_f1: 0.5377
 epoch: 22, train_loss: 0.8545, test_loss: 1.0590, test_f1: 0.5405
 epoch: 23, train_loss: 0.8661, test_loss: 1.0403, test_f1: 0.5409
 epoch: 24, train_loss: 0.8423, test_loss: 1.0636, test_f1: 0.5299
 epoch: 25, train_loss: 0.8508, test_loss: 1.0516, test_f1: 0.5404
 epoch: 26, train_loss: 0.8390, test_loss: 1.0428, test_f1: 0.5643
 epoch: 27, train_loss: 0.8344, test_loss: 1.0429, test_f1: 0.5793
 epoch: 28, train_loss: 0.8233, test_loss: 1.0509, test_f1: 0.5712
 epoch: 29, train_loss: 0.8112, test_loss: 1.0526, test_f1: 0.5561
 epoch: 30, train_loss: 0.8164, test_loss: 1.0593, test_f1: 0.5790
 epoch: 31, train_loss: 0.8167, test_loss: 1.0761, test_f1: 0.5788
 epoch: 32, train_loss: 0.8082, test_loss: 1.0587, test_f1: 0.5730
 epoch: 33, train_loss: 0.8019, test_loss: 1.0399, test_f1: 0.5820
 epoch: 34, train_loss: 0.7981, test_loss: 1.0579, test_f1: 0.5871
 epoch: 35, train_loss: 0.7921, test_loss: 1.0606, test_f1: 0.5834
 epoch: 36, train_loss: 0.7802, test_loss: 1.0819, test_f1: 0.5736
 epoch: 37, train_loss: 0.7839, test_loss: 1.0513, test_f1: 0.5670
 epoch: 38, train_loss: 0.7779, test_loss: 1.0554, test_f1: 0.5814
 epoch: 39, train_loss: 0.7612, test_loss: 1.0432, test_f1: 0.5844
 epoch: 40, train_loss: 0.7568, test_loss: 1.0755, test_f1: 0.5755
 epoch: 41, train_loss: 0.7516, test_loss: 1.0786, test_f1: 0.5847
 epoch: 42, train_loss: 0.7497, test_loss: 1.0722, test_f1: 0.5852
 epoch: 43, train_loss: 0.7474, test_loss: 1.0839, test_f1: 0.5701
 epoch: 44, train_loss: 0.7477, test_loss: 1.0864, test_f1: 0.5814
 epoch: 45, train_loss: 0.7385, test_loss: 1.1019, test_f1: 0.5754
 epoch: 46, train_loss: 0.7330, test_loss: 1.0882, test_f1: 0.5662
 epoch: 47, train_loss: 0.7290, test_loss: 1.1155, test_f1: 0.5826
 epoch: 48, train_loss: 0.7119, test_loss: 1.0813, test_f1: 0.5759
 epoch: 49, train_loss: 0.7152, test_loss: 1.0708, test_f1: 0.5866
 epoch: 50, train_loss: 0.7214, test_loss: 1.1099, test_f1: 0.5821
 epoch: 51, train_loss: 0.7024, test_loss: 1.0966, test_f1: 0.5855
 epoch: 52, train_loss: 0.6938, test_loss: 1.1101, test_f1: 0.5947
 epoch: 53, train_loss: 0.6918, test_loss: 1.0988, test_f1: 0.5906
 epoch: 54, train_loss: 0.6938, test_loss: 1.0903, test_f1: 0.5839
 epoch: 55, train_loss: 0.6809, test_loss: 1.0846, test_f1: 0.5901
 epoch: 56, train_loss: 0.6720, test_loss: 1.1088, test_f1: 0.5920
 epoch: 57, train_loss: 0.6839, test_loss: 1.1233, test_f1: 0.5848
 epoch: 58, train_loss: 0.6777, test_loss: 1.1041, test_f1: 0.5900
 epoch: 59, train_loss: 0.6769, test_loss: 1.1131, test_f1: 0.5815
 epoch: 60, train_loss: 0.6653, test_loss: 1.1336, test_f1: 0.5786
 epoch: 61, train_loss: 0.6746, test_loss: 1.1163, test_f1: 0.5966
 epoch: 62, train_loss: 0.6629, test_loss: 1.1248, test_f1: 0.5931
 epoch: 63, train_loss: 0.6474, test_loss: 1.1293, test_f1: 0.5918
 epoch: 64, train_loss: 0.6495, test_loss: 1.1220, test_f1: 0.6003
 epoch: 65, train_loss: 0.6508, test_loss: 1.1234, test_f1: 0.6128
 epoch: 66, train_loss: 0.6478, test_loss: 1.1529, test_f1: 0.5997
 epoch: 67, train_loss: 0.6444, test_loss: 1.1277, test_f1: 0.6024
 epoch: 68, train_loss: 0.6475, test_loss: 1.1217, test_f1: 0.6047
 epoch: 69, train_loss: 0.6426, test_loss: 1.1688, test_f1: 0.6123
 epoch: 70, train_loss: 0.6438, test_loss: 1.1540, test_f1: 0.5977
 epoch: 71, train_loss: 0.6418, test_loss: 1.1700, test_f1: 0.6003
 epoch: 72, train_loss: 0.6295, test_loss: 1.1937, test_f1: 0.5862
 epoch: 73, train_loss: 0.6338, test_loss: 1.1800, test_f1: 0.5885
 epoch: 74, train_loss: 0.6300, test_loss: 1.1751, test_f1: 0.6068
 epoch: 75, train_loss: 0.6281, test_loss: 1.1824, test_f1: 0.5981
 epoch: 76, train_loss: 0.6199, test_loss: 1.1764, test_f1: 0.6028
 epoch: 77, train_loss: 0.6242, test_loss: 1.1905, test_f1: 0.6001
 epoch: 78, train_loss: 0.6169, test_loss: 1.1979, test_f1: 0.5905
 epoch: 79, train_loss: 0.6122, test_loss: 1.2338, test_f1: 0.5952
 epoch: 80, train_loss: 0.6146, test_loss: 1.2142, test_f1: 0.5824
 epoch: 81, train_loss: 0.6051, test_loss: 1.2217, test_f1: 0.6008
 epoch: 82, train_loss: 0.6104, test_loss: 1.2134, test_f1: 0.5806
 epoch: 83, train_loss: 0.5896, test_loss: 1.1918, test_f1: 0.6031
 epoch: 84, train_loss: 0.6073, test_loss: 1.2221, test_f1: 0.6019
 epoch: 85, train_loss: 0.5975, test_loss: 1.2195, test_f1: 0.5957
 epoch: 86, train_loss: 0.6046, test_loss: 1.2490, test_f1: 0.5716
 epoch: 87, train_loss: 0.5954, test_loss: 1.2295, test_f1: 0.5840
 epoch: 88, train_loss: 0.5863, test_loss: 1.2509, test_f1: 0.5711
 epoch: 89, train_loss: 0.5844, test_loss: 1.2293, test_f1: 0.5656
 epoch: 90, train_loss: 0.5779, test_loss: 1.2470, test_f1: 0.5897
 epoch: 91, train_loss: 0.5812, test_loss: 1.2350, test_f1: 0.5812
 epoch: 92, train_loss: 0.5769, test_loss: 1.2706, test_f1: 0.5761
 epoch: 93, train_loss: 0.5667, test_loss: 1.2592, test_f1: 0.5823
 epoch: 94, train_loss: 0.5610, test_loss: 1.2866, test_f1: 0.5925
 epoch: 95, train_loss: 0.5571, test_loss: 1.2865, test_f1: 0.5689
 epoch: 96, train_loss: 0.5740, test_loss: 1.2920, test_f1: 0.5731
 epoch: 97, train_loss: 0.5556, test_loss: 1.3126, test_f1: 0.5733
 epoch: 98, train_loss: 0.5525, test_loss: 1.3186, test_f1: 0.5704
 epoch: 99, train_loss: 0.5751, test_loss: 1.2808, test_f1: 0.5870
##################ITERATION #2 ****************************************
 epoch: 0, train_loss: 1.2471, test_loss: 1.2929, test_f1: 0.2583
 epoch: 1, train_loss: 1.1655, test_loss: 1.2486, test_f1: 0.3630
 epoch: 2, train_loss: 1.1282, test_loss: 1.2020, test_f1: 0.4083
 epoch: 3, train_loss: 1.0939, test_loss: 1.1707, test_f1: 0.3929
 epoch: 4, train_loss: 1.0721, test_loss: 1.1401, test_f1: 0.4391
 epoch: 5, train_loss: 1.0443, test_loss: 1.1210, test_f1: 0.4540
 epoch: 6, train_loss: 1.0174, test_loss: 1.1086, test_f1: 0.4504
 epoch: 7, train_loss: 1.0047, test_loss: 1.0920, test_f1: 0.4499
 epoch: 8, train_loss: 0.9885, test_loss: 1.0795, test_f1: 0.4847
 epoch: 9, train_loss: 0.9770, test_loss: 1.0706, test_f1: 0.4959
 epoch: 10, train_loss: 0.9625, test_loss: 1.0646, test_f1: 0.4986
 epoch: 11, train_loss: 0.9492, test_loss: 1.0607, test_f1: 0.5029
 epoch: 12, train_loss: 0.9316, test_loss: 1.0553, test_f1: 0.5009
 epoch: 13, train_loss: 0.9296, test_loss: 1.0551, test_f1: 0.5006
 epoch: 14, train_loss: 0.9268, test_loss: 1.0524, test_f1: 0.5100
 epoch: 15, train_loss: 0.9135, test_loss: 1.0430, test_f1: 0.5101
 epoch: 16, train_loss: 0.8970, test_loss: 1.0557, test_f1: 0.5148
 epoch: 17, train_loss: 0.8920, test_loss: 1.0402, test_f1: 0.5117
 epoch: 18, train_loss: 0.8928, test_loss: 1.0470, test_f1: 0.5315
 epoch: 19, train_loss: 0.8830, test_loss: 1.0478, test_f1: 0.5137
 epoch: 20, train_loss: 0.8720, test_loss: 1.0392, test_f1: 0.5241
 epoch: 21, train_loss: 0.8730, test_loss: 1.0394, test_f1: 0.5293
 epoch: 22, train_loss: 0.8563, test_loss: 1.0537, test_f1: 0.5244
 epoch: 23, train_loss: 0.8521, test_loss: 1.0414, test_f1: 0.5195
 epoch: 24, train_loss: 0.8480, test_loss: 1.0366, test_f1: 0.5227
 epoch: 25, train_loss: 0.8556, test_loss: 1.0561, test_f1: 0.5457
 epoch: 26, train_loss: 0.8435, test_loss: 1.0460, test_f1: 0.5359
 epoch: 27, train_loss: 0.8414, test_loss: 1.0490, test_f1: 0.5392
 epoch: 28, train_loss: 0.8316, test_loss: 1.0411, test_f1: 0.5555
 epoch: 29, train_loss: 0.8306, test_loss: 1.0469, test_f1: 0.5395
 epoch: 30, train_loss: 0.8292, test_loss: 1.0399, test_f1: 0.5839
 epoch: 31, train_loss: 0.8238, test_loss: 1.0468, test_f1: 0.5576
 epoch: 32, train_loss: 0.8244, test_loss: 1.0405, test_f1: 0.5790
 epoch: 33, train_loss: 0.8104, test_loss: 1.0554, test_f1: 0.5494
 epoch: 34, train_loss: 0.8100, test_loss: 1.0538, test_f1: 0.5488
 epoch: 35, train_loss: 0.8073, test_loss: 1.0613, test_f1: 0.5484
 epoch: 36, train_loss: 0.7920, test_loss: 1.0309, test_f1: 0.5967
 epoch: 37, train_loss: 0.7941, test_loss: 1.0470, test_f1: 0.5378
 epoch: 38, train_loss: 0.7853, test_loss: 1.0332, test_f1: 0.5512
 epoch: 39, train_loss: 0.7789, test_loss: 1.0822, test_f1: 0.5549
 epoch: 40, train_loss: 0.7723, test_loss: 1.0405, test_f1: 0.5781
 epoch: 41, train_loss: 0.7688, test_loss: 1.0499, test_f1: 0.5479
 epoch: 42, train_loss: 0.7665, test_loss: 1.0842, test_f1: 0.5560
 epoch: 43, train_loss: 0.7685, test_loss: 1.0941, test_f1: 0.5602
 epoch: 44, train_loss: 0.7662, test_loss: 1.0941, test_f1: 0.5783
 epoch: 45, train_loss: 0.7566, test_loss: 1.0231, test_f1: 0.5674
 epoch: 46, train_loss: 0.7570, test_loss: 1.0588, test_f1: 0.5761
 epoch: 47, train_loss: 0.7396, test_loss: 1.0711, test_f1: 0.5889
 epoch: 48, train_loss: 0.7336, test_loss: 1.0863, test_f1: 0.5656
 epoch: 49, train_loss: 0.7309, test_loss: 1.0694, test_f1: 0.5766
 epoch: 50, train_loss: 0.7279, test_loss: 1.0300, test_f1: 0.5712
 epoch: 51, train_loss: 0.7129, test_loss: 1.0466, test_f1: 0.5902
 epoch: 52, train_loss: 0.7074, test_loss: 1.0657, test_f1: 0.5812
 epoch: 53, train_loss: 0.7138, test_loss: 1.0681, test_f1: 0.5948
 epoch: 54, train_loss: 0.7114, test_loss: 1.0682, test_f1: 0.5913
 epoch: 55, train_loss: 0.7065, test_loss: 1.1017, test_f1: 0.5908
 epoch: 56, train_loss: 0.6976, test_loss: 1.0798, test_f1: 0.6007
 epoch: 57, train_loss: 0.6941, test_loss: 1.0760, test_f1: 0.6014
 epoch: 58, train_loss: 0.6865, test_loss: 1.0734, test_f1: 0.5985
 epoch: 59, train_loss: 0.6903, test_loss: 1.0681, test_f1: 0.5937
 epoch: 60, train_loss: 0.6900, test_loss: 1.0611, test_f1: 0.5963
 epoch: 61, train_loss: 0.6855, test_loss: 1.0716, test_f1: 0.6017
 epoch: 62, train_loss: 0.6720, test_loss: 1.0840, test_f1: 0.6000
 epoch: 63, train_loss: 0.6771, test_loss: 1.0856, test_f1: 0.6086
 epoch: 64, train_loss: 0.6744, test_loss: 1.0580, test_f1: 0.6006
 epoch: 65, train_loss: 0.6649, test_loss: 1.1035, test_f1: 0.6042
 epoch: 66, train_loss: 0.6702, test_loss: 1.0817, test_f1: 0.6003
 epoch: 67, train_loss: 0.6603, test_loss: 1.1023, test_f1: 0.6024
 epoch: 68, train_loss: 0.6534, test_loss: 1.1141, test_f1: 0.5917
 epoch: 69, train_loss: 0.6546, test_loss: 1.1021, test_f1: 0.6199
 epoch: 70, train_loss: 0.6601, test_loss: 1.0979, test_f1: 0.6080
 epoch: 71, train_loss: 0.6584, test_loss: 1.0893, test_f1: 0.6143
 epoch: 72, train_loss: 0.6591, test_loss: 1.1084, test_f1: 0.5999
 epoch: 73, train_loss: 0.6444, test_loss: 1.1069, test_f1: 0.6048
 epoch: 74, train_loss: 0.6437, test_loss: 1.1035, test_f1: 0.6092
 epoch: 75, train_loss: 0.6294, test_loss: 1.1302, test_f1: 0.6122
 epoch: 76, train_loss: 0.6435, test_loss: 1.1461, test_f1: 0.6081
 epoch: 77, train_loss: 0.6258, test_loss: 1.1152, test_f1: 0.6150
 epoch: 78, train_loss: 0.6508, test_loss: 1.1077, test_f1: 0.6100
 epoch: 79, train_loss: 0.6363, test_loss: 1.1475, test_f1: 0.6002
 epoch: 80, train_loss: 0.6236, test_loss: 1.1521, test_f1: 0.6085
 epoch: 81, train_loss: 0.6262, test_loss: 1.0973, test_f1: 0.6154
 epoch: 82, train_loss: 0.6309, test_loss: 1.1526, test_f1: 0.6044
 epoch: 83, train_loss: 0.6191, test_loss: 1.1286, test_f1: 0.6179
 epoch: 84, train_loss: 0.6176, test_loss: 1.1618, test_f1: 0.6205
 epoch: 85, train_loss: 0.6149, test_loss: 1.1714, test_f1: 0.6224
 epoch: 86, train_loss: 0.6221, test_loss: 1.1350, test_f1: 0.6156
 epoch: 87, train_loss: 0.5991, test_loss: 1.1842, test_f1: 0.6206
 epoch: 88, train_loss: 0.6201, test_loss: 1.1427, test_f1: 0.6202
 epoch: 89, train_loss: 0.6042, test_loss: 1.1666, test_f1: 0.6155
 epoch: 90, train_loss: 0.6013, test_loss: 1.1676, test_f1: 0.5989
 epoch: 91, train_loss: 0.5986, test_loss: 1.1403, test_f1: 0.6188
 epoch: 92, train_loss: 0.5935, test_loss: 1.1500, test_f1: 0.6208
 epoch: 93, train_loss: 0.6026, test_loss: 1.1587, test_f1: 0.6344
 epoch: 94, train_loss: 0.5965, test_loss: 1.1815, test_f1: 0.6410
 epoch: 95, train_loss: 0.5985, test_loss: 1.2018, test_f1: 0.6266
 epoch: 96, train_loss: 0.5935, test_loss: 1.2260, test_f1: 0.5971
 epoch: 97, train_loss: 0.5896, test_loss: 1.1812, test_f1: 0.6393
 epoch: 98, train_loss: 0.5769, test_loss: 1.2111, test_f1: 0.6187
 epoch: 99, train_loss: 0.5720, test_loss: 1.2098, test_f1: 0.6388
##################ITERATION #3 ****************************************
 epoch: 0, train_loss: 1.2399, test_loss: 1.2851, test_f1: 0.2722
 epoch: 1, train_loss: 1.1375, test_loss: 1.2213, test_f1: 0.3398
 epoch: 2, train_loss: 1.1050, test_loss: 1.1665, test_f1: 0.4146
 epoch: 3, train_loss: 1.0760, test_loss: 1.1410, test_f1: 0.4354
 epoch: 4, train_loss: 1.0435, test_loss: 1.1206, test_f1: 0.4548
 epoch: 5, train_loss: 1.0250, test_loss: 1.1054, test_f1: 0.4870
 epoch: 6, train_loss: 1.0067, test_loss: 1.0940, test_f1: 0.4818
 epoch: 7, train_loss: 0.9900, test_loss: 1.0796, test_f1: 0.4823
 epoch: 8, train_loss: 0.9761, test_loss: 1.0582, test_f1: 0.4982
 epoch: 9, train_loss: 0.9654, test_loss: 1.0634, test_f1: 0.4895
 epoch: 10, train_loss: 0.9444, test_loss: 1.0560, test_f1: 0.5116
 epoch: 11, train_loss: 0.9386, test_loss: 1.0492, test_f1: 0.5133
 epoch: 12, train_loss: 0.9273, test_loss: 1.0473, test_f1: 0.5153
 epoch: 13, train_loss: 0.9307, test_loss: 1.0475, test_f1: 0.5207
 epoch: 14, train_loss: 0.9101, test_loss: 1.0394, test_f1: 0.5189
 epoch: 15, train_loss: 0.9038, test_loss: 1.0364, test_f1: 0.5393
 epoch: 16, train_loss: 0.8978, test_loss: 1.0534, test_f1: 0.5287
 epoch: 17, train_loss: 0.8824, test_loss: 1.0586, test_f1: 0.5087
 epoch: 18, train_loss: 0.8753, test_loss: 1.0414, test_f1: 0.5417
 epoch: 19, train_loss: 0.8642, test_loss: 1.0384, test_f1: 0.5510
 epoch: 20, train_loss: 0.8608, test_loss: 1.0596, test_f1: 0.5540
 epoch: 21, train_loss: 0.8560, test_loss: 1.0408, test_f1: 0.5455
 epoch: 22, train_loss: 0.8440, test_loss: 1.0335, test_f1: 0.5555
 epoch: 23, train_loss: 0.8384, test_loss: 1.0436, test_f1: 0.5478
 epoch: 24, train_loss: 0.8293, test_loss: 1.0383, test_f1: 0.5608
 epoch: 25, train_loss: 0.8237, test_loss: 1.0292, test_f1: 0.5837
 epoch: 26, train_loss: 0.8144, test_loss: 1.0221, test_f1: 0.5776
 epoch: 27, train_loss: 0.8005, test_loss: 1.0318, test_f1: 0.5884
 epoch: 28, train_loss: 0.8093, test_loss: 1.0576, test_f1: 0.5386
 epoch: 29, train_loss: 0.8014, test_loss: 1.0316, test_f1: 0.5703
 epoch: 30, train_loss: 0.7910, test_loss: 1.0379, test_f1: 0.5917
 epoch: 31, train_loss: 0.7864, test_loss: 1.0360, test_f1: 0.5680
 epoch: 32, train_loss: 0.7687, test_loss: 1.0591, test_f1: 0.5891
 epoch: 33, train_loss: 0.7823, test_loss: 1.0255, test_f1: 0.6066
 epoch: 34, train_loss: 0.7561, test_loss: 1.0515, test_f1: 0.5451
 epoch: 35, train_loss: 0.7541, test_loss: 1.0274, test_f1: 0.6005
 epoch: 36, train_loss: 0.7545, test_loss: 1.0445, test_f1: 0.5913
 epoch: 37, train_loss: 0.7458, test_loss: 1.0411, test_f1: 0.6121
 epoch: 38, train_loss: 0.7362, test_loss: 1.0461, test_f1: 0.5943
 epoch: 39, train_loss: 0.7481, test_loss: 1.0750, test_f1: 0.5608
 epoch: 40, train_loss: 0.7284, test_loss: 1.0715, test_f1: 0.5807
 epoch: 41, train_loss: 0.7200, test_loss: 1.0651, test_f1: 0.5682
 epoch: 42, train_loss: 0.7143, test_loss: 1.0628, test_f1: 0.5985
 epoch: 43, train_loss: 0.7003, test_loss: 1.0337, test_f1: 0.6211
 epoch: 44, train_loss: 0.7030, test_loss: 1.0631, test_f1: 0.6030
 epoch: 45, train_loss: 0.7066, test_loss: 1.0680, test_f1: 0.5691
 epoch: 46, train_loss: 0.7014, test_loss: 1.0731, test_f1: 0.6222
 epoch: 47, train_loss: 0.6867, test_loss: 1.0899, test_f1: 0.5737
 epoch: 48, train_loss: 0.6753, test_loss: 1.0610, test_f1: 0.6441
 epoch: 49, train_loss: 0.6808, test_loss: 1.0934, test_f1: 0.6101
 epoch: 50, train_loss: 0.6721, test_loss: 1.1172, test_f1: 0.5995
 epoch: 51, train_loss: 0.6589, test_loss: 1.0868, test_f1: 0.5894
 epoch: 52, train_loss: 0.6486, test_loss: 1.0780, test_f1: 0.5953
 epoch: 53, train_loss: 0.6451, test_loss: 1.0813, test_f1: 0.6132
 epoch: 54, train_loss: 0.6582, test_loss: 1.0782, test_f1: 0.6125
 epoch: 55, train_loss: 0.6503, test_loss: 1.0772, test_f1: 0.5992
 epoch: 56, train_loss: 0.6370, test_loss: 1.0932, test_f1: 0.6029
 epoch: 57, train_loss: 0.6533, test_loss: 1.0986, test_f1: 0.6012
 epoch: 58, train_loss: 0.6350, test_loss: 1.0797, test_f1: 0.6150
 epoch: 59, train_loss: 0.6367, test_loss: 1.1055, test_f1: 0.6125
 epoch: 60, train_loss: 0.6316, test_loss: 1.1333, test_f1: 0.6237
 epoch: 61, train_loss: 0.6315, test_loss: 1.1013, test_f1: 0.6257
 epoch: 62, train_loss: 0.6301, test_loss: 1.1077, test_f1: 0.5999
 epoch: 63, train_loss: 0.6293, test_loss: 1.1001, test_f1: 0.6091
 epoch: 64, train_loss: 0.6280, test_loss: 1.1093, test_f1: 0.6030
 epoch: 65, train_loss: 0.6162, test_loss: 1.0959, test_f1: 0.6149
 epoch: 66, train_loss: 0.6164, test_loss: 1.1217, test_f1: 0.6186
 epoch: 67, train_loss: 0.6091, test_loss: 1.1053, test_f1: 0.6034
 epoch: 68, train_loss: 0.5977, test_loss: 1.1289, test_f1: 0.6129
 epoch: 69, train_loss: 0.6047, test_loss: 1.1368, test_f1: 0.6083
 epoch: 70, train_loss: 0.5925, test_loss: 1.1192, test_f1: 0.6238
 epoch: 71, train_loss: 0.6111, test_loss: 1.1372, test_f1: 0.5959
 epoch: 72, train_loss: 0.5909, test_loss: 1.1485, test_f1: 0.6191
 epoch: 73, train_loss: 0.5902, test_loss: 1.1378, test_f1: 0.6163
 epoch: 74, train_loss: 0.6023, test_loss: 1.1548, test_f1: 0.6139
 epoch: 75, train_loss: 0.5823, test_loss: 1.1175, test_f1: 0.6145
 epoch: 76, train_loss: 0.5839, test_loss: 1.1468, test_f1: 0.6103
 epoch: 77, train_loss: 0.5757, test_loss: 1.1724, test_f1: 0.6133
 epoch: 78, train_loss: 0.5742, test_loss: 1.1452, test_f1: 0.6142
 epoch: 79, train_loss: 0.5828, test_loss: 1.1801, test_f1: 0.6107
 epoch: 80, train_loss: 0.5785, test_loss: 1.1695, test_f1: 0.6047
 epoch: 81, train_loss: 0.5692, test_loss: 1.1665, test_f1: 0.6184
 epoch: 82, train_loss: 0.5510, test_loss: 1.1921, test_f1: 0.6195
 epoch: 83, train_loss: 0.5497, test_loss: 1.1980, test_f1: 0.6056
 epoch: 84, train_loss: 0.5763, test_loss: 1.1979, test_f1: 0.6016
 epoch: 85, train_loss: 0.5508, test_loss: 1.1798, test_f1: 0.6051
 epoch: 86, train_loss: 0.5587, test_loss: 1.1889, test_f1: 0.6110
 epoch: 87, train_loss: 0.5600, test_loss: 1.1861, test_f1: 0.6129
 epoch: 88, train_loss: 0.5627, test_loss: 1.1851, test_f1: 0.6101
 epoch: 89, train_loss: 0.5476, test_loss: 1.2088, test_f1: 0.5912
 epoch: 90, train_loss: 0.5441, test_loss: 1.2114, test_f1: 0.6044
 epoch: 91, train_loss: 0.5641, test_loss: 1.2365, test_f1: 0.6097
 epoch: 92, train_loss: 0.5371, test_loss: 1.2079, test_f1: 0.5960
 epoch: 93, train_loss: 0.5429, test_loss: 1.2060, test_f1: 0.6067
 epoch: 94, train_loss: 0.5450, test_loss: 1.2255, test_f1: 0.5951
 epoch: 95, train_loss: 0.5279, test_loss: 1.1902, test_f1: 0.6118
 epoch: 96, train_loss: 0.5281, test_loss: 1.2195, test_f1: 0.5954
 epoch: 97, train_loss: 0.5297, test_loss: 1.2373, test_f1: 0.6002
 epoch: 98, train_loss: 0.5345, test_loss: 1.2707, test_f1: 0.6112
 epoch: 99, train_loss: 0.5357, test_loss: 1.2494, test_f1: 0.5940
##################ITERATION #4 ****************************************
 epoch: 0, train_loss: 1.2227, test_loss: 1.2982, test_f1: 0.1365
 epoch: 1, train_loss: 1.1254, test_loss: 1.2222, test_f1: 0.3842
 epoch: 2, train_loss: 1.0644, test_loss: 1.1475, test_f1: 0.4719
 epoch: 3, train_loss: 1.0564, test_loss: 1.1227, test_f1: 0.4769
 epoch: 4, train_loss: 1.0312, test_loss: 1.1066, test_f1: 0.4914
 epoch: 5, train_loss: 1.0130, test_loss: 1.0919, test_f1: 0.5228
 epoch: 6, train_loss: 0.9907, test_loss: 1.0764, test_f1: 0.5214
 epoch: 7, train_loss: 0.9800, test_loss: 1.0712, test_f1: 0.5114
 epoch: 8, train_loss: 0.9610, test_loss: 1.0568, test_f1: 0.5342
 epoch: 9, train_loss: 0.9358, test_loss: 1.0606, test_f1: 0.5245
 epoch: 10, train_loss: 0.9436, test_loss: 1.0408, test_f1: 0.5124
 epoch: 11, train_loss: 0.9225, test_loss: 1.0369, test_f1: 0.5261
 epoch: 12, train_loss: 0.9129, test_loss: 1.0584, test_f1: 0.5261
 epoch: 13, train_loss: 0.8943, test_loss: 1.0396, test_f1: 0.5350
 epoch: 14, train_loss: 0.8886, test_loss: 1.0292, test_f1: 0.5214
 epoch: 15, train_loss: 0.9039, test_loss: 1.0125, test_f1: 0.5172
 epoch: 16, train_loss: 0.8880, test_loss: 1.0019, test_f1: 0.5488
 epoch: 17, train_loss: 0.8780, test_loss: 1.0070, test_f1: 0.5395
 epoch: 18, train_loss: 0.8653, test_loss: 1.0072, test_f1: 0.5442
 epoch: 19, train_loss: 0.8552, test_loss: 0.9934, test_f1: 0.5502
 epoch: 20, train_loss: 0.8397, test_loss: 0.9971, test_f1: 0.5545
 epoch: 21, train_loss: 0.8396, test_loss: 0.9890, test_f1: 0.5534
 epoch: 22, train_loss: 0.8272, test_loss: 0.9830, test_f1: 0.5721
 epoch: 23, train_loss: 0.8317, test_loss: 0.9781, test_f1: 0.5944
 epoch: 24, train_loss: 0.8233, test_loss: 1.0019, test_f1: 0.5577
 epoch: 25, train_loss: 0.8262, test_loss: 0.9775, test_f1: 0.5897
 epoch: 26, train_loss: 0.8073, test_loss: 0.9701, test_f1: 0.5816
 epoch: 27, train_loss: 0.8062, test_loss: 0.9631, test_f1: 0.6004
 epoch: 28, train_loss: 0.7839, test_loss: 0.9616, test_f1: 0.5993
 epoch: 29, train_loss: 0.7788, test_loss: 0.9770, test_f1: 0.5796
 epoch: 30, train_loss: 0.7820, test_loss: 0.9786, test_f1: 0.5994
 epoch: 31, train_loss: 0.7762, test_loss: 0.9922, test_f1: 0.5974
 epoch: 32, train_loss: 0.7514, test_loss: 0.9580, test_f1: 0.6013
 epoch: 33, train_loss: 0.7563, test_loss: 0.9764, test_f1: 0.6117
 epoch: 34, train_loss: 0.7512, test_loss: 1.0083, test_f1: 0.6291
 epoch: 35, train_loss: 0.7464, test_loss: 1.0053, test_f1: 0.6306
 epoch: 36, train_loss: 0.7440, test_loss: 1.0002, test_f1: 0.6162
 epoch: 37, train_loss: 0.7393, test_loss: 1.0164, test_f1: 0.6183
 epoch: 38, train_loss: 0.7265, test_loss: 0.9969, test_f1: 0.6089
 epoch: 39, train_loss: 0.7390, test_loss: 1.0119, test_f1: 0.6044
 epoch: 40, train_loss: 0.7092, test_loss: 1.0142, test_f1: 0.5954
 epoch: 41, train_loss: 0.7100, test_loss: 1.0379, test_f1: 0.6037
 epoch: 42, train_loss: 0.7089, test_loss: 1.0107, test_f1: 0.6069
 epoch: 43, train_loss: 0.6960, test_loss: 1.0196, test_f1: 0.5935
 epoch: 44, train_loss: 0.6931, test_loss: 1.0330, test_f1: 0.6097
 epoch: 45, train_loss: 0.6954, test_loss: 1.0523, test_f1: 0.6257
 epoch: 46, train_loss: 0.6793, test_loss: 1.0305, test_f1: 0.6039
 epoch: 47, train_loss: 0.6701, test_loss: 1.0738, test_f1: 0.6060
 epoch: 48, train_loss: 0.6601, test_loss: 0.9968, test_f1: 0.6152
 epoch: 49, train_loss: 0.6588, test_loss: 1.0666, test_f1: 0.5885
 epoch: 50, train_loss: 0.6683, test_loss: 1.0956, test_f1: 0.6045
 epoch: 51, train_loss: 0.6542, test_loss: 1.1057, test_f1: 0.6074
 epoch: 52, train_loss: 0.6476, test_loss: 1.1029, test_f1: 0.6150
 epoch: 53, train_loss: 0.6552, test_loss: 1.0893, test_f1: 0.5932
 epoch: 54, train_loss: 0.6320, test_loss: 1.0931, test_f1: 0.6123
 epoch: 55, train_loss: 0.6232, test_loss: 1.1217, test_f1: 0.6022
 epoch: 56, train_loss: 0.6289, test_loss: 1.1105, test_f1: 0.6101
 epoch: 57, train_loss: 0.6128, test_loss: 1.1054, test_f1: 0.6185
 epoch: 58, train_loss: 0.6223, test_loss: 1.1659, test_f1: 0.6201
 epoch: 59, train_loss: 0.6195, test_loss: 1.1613, test_f1: 0.6081
 epoch: 60, train_loss: 0.6215, test_loss: 1.1697, test_f1: 0.5857
 epoch: 61, train_loss: 0.6088, test_loss: 1.1589, test_f1: 0.6098
 epoch: 62, train_loss: 0.6135, test_loss: 1.2202, test_f1: 0.5882
 epoch: 63, train_loss: 0.6166, test_loss: 1.1903, test_f1: 0.5763
 epoch: 64, train_loss: 0.6128, test_loss: 1.2232, test_f1: 0.5856
 epoch: 65, train_loss: 0.6014, test_loss: 1.1879, test_f1: 0.6249
 epoch: 66, train_loss: 0.5888, test_loss: 1.2196, test_f1: 0.5956
 epoch: 67, train_loss: 0.5883, test_loss: 1.2501, test_f1: 0.6002
 epoch: 68, train_loss: 0.5967, test_loss: 1.2599, test_f1: 0.5916
 epoch: 69, train_loss: 0.5718, test_loss: 1.2483, test_f1: 0.6237
 epoch: 70, train_loss: 0.5976, test_loss: 1.2396, test_f1: 0.6237
 epoch: 71, train_loss: 0.5826, test_loss: 1.2381, test_f1: 0.5751
 epoch: 72, train_loss: 0.5783, test_loss: 1.2466, test_f1: 0.6035
 epoch: 73, train_loss: 0.5679, test_loss: 1.3200, test_f1: 0.5619
 epoch: 74, train_loss: 0.5803, test_loss: 1.2599, test_f1: 0.5720
 epoch: 75, train_loss: 0.5725, test_loss: 1.2630, test_f1: 0.6337
 epoch: 76, train_loss: 0.5723, test_loss: 1.3255, test_f1: 0.6082
 epoch: 77, train_loss: 0.5721, test_loss: 1.3354, test_f1: 0.6140
 epoch: 78, train_loss: 0.5666, test_loss: 1.3672, test_f1: 0.5844
 epoch: 79, train_loss: 0.5673, test_loss: 1.3899, test_f1: 0.5825
 epoch: 80, train_loss: 0.5519, test_loss: 1.3386, test_f1: 0.6095
 epoch: 81, train_loss: 0.5489, test_loss: 1.4008, test_f1: 0.6018
 epoch: 82, train_loss: 0.5415, test_loss: 1.4122, test_f1: 0.5904
 epoch: 83, train_loss: 0.5622, test_loss: 1.4554, test_f1: 0.5819
 epoch: 84, train_loss: 0.5328, test_loss: 1.4183, test_f1: 0.5955
 epoch: 85, train_loss: 0.5452, test_loss: 1.5414, test_f1: 0.5634
 epoch: 86, train_loss: 0.5461, test_loss: 1.4662, test_f1: 0.5712
 epoch: 87, train_loss: 0.5256, test_loss: 1.5217, test_f1: 0.5653
 epoch: 88, train_loss: 0.5432, test_loss: 1.5517, test_f1: 0.5711
 epoch: 89, train_loss: 0.5318, test_loss: 1.5638, test_f1: 0.5636
 epoch: 90, train_loss: 0.5194, test_loss: 1.5602, test_f1: 0.5924
 epoch: 91, train_loss: 0.5394, test_loss: 1.6614, test_f1: 0.5942
 epoch: 92, train_loss: 0.5192, test_loss: 1.5888, test_f1: 0.6121
 epoch: 93, train_loss: 0.5369, test_loss: 1.6304, test_f1: 0.6013
 epoch: 94, train_loss: 0.5081, test_loss: 1.6538, test_f1: 0.5947
 epoch: 95, train_loss: 0.5200, test_loss: 1.7044, test_f1: 0.6150
 epoch: 96, train_loss: 0.5196, test_loss: 1.7382, test_f1: 0.5786
 epoch: 97, train_loss: 0.5019, test_loss: 1.7268, test_f1: 0.6055
 epoch: 98, train_loss: 0.5057, test_loss: 1.6955, test_f1: 0.6192
 epoch: 99, train_loss: 0.5104, test_loss: 1.7553, test_f1: 0.5806
##################ITERATION #5 ****************************************
 epoch: 0, train_loss: 1.2391, test_loss: 1.2965, test_f1: 0.3199
 epoch: 1, train_loss: 1.1116, test_loss: 1.1995, test_f1: 0.3808
 epoch: 2, train_loss: 1.0704, test_loss: 1.1618, test_f1: 0.4456
 epoch: 3, train_loss: 1.0373, test_loss: 1.1387, test_f1: 0.4974
 epoch: 4, train_loss: 1.0235, test_loss: 1.1263, test_f1: 0.4799
 epoch: 5, train_loss: 1.0001, test_loss: 1.1273, test_f1: 0.4764
 epoch: 6, train_loss: 0.9719, test_loss: 1.1043, test_f1: 0.5017
 epoch: 7, train_loss: 0.9753, test_loss: 1.1177, test_f1: 0.4981
 epoch: 8, train_loss: 0.9514, test_loss: 1.1090, test_f1: 0.4982
 epoch: 9, train_loss: 0.9505, test_loss: 1.0988, test_f1: 0.5023
 epoch: 10, train_loss: 0.9275, test_loss: 1.0917, test_f1: 0.5302
 epoch: 11, train_loss: 0.9252, test_loss: 1.0932, test_f1: 0.5206
 epoch: 12, train_loss: 0.9235, test_loss: 1.0967, test_f1: 0.5248
 epoch: 13, train_loss: 0.8951, test_loss: 1.0807, test_f1: 0.5111
 epoch: 14, train_loss: 0.8990, test_loss: 1.0765, test_f1: 0.5539
 epoch: 15, train_loss: 0.8769, test_loss: 1.0707, test_f1: 0.5392
 epoch: 16, train_loss: 0.8708, test_loss: 1.0676, test_f1: 0.5574
 epoch: 17, train_loss: 0.8620, test_loss: 1.0691, test_f1: 0.5767
 epoch: 18, train_loss: 0.8566, test_loss: 1.0587, test_f1: 0.5506
 epoch: 19, train_loss: 0.8506, test_loss: 1.0425, test_f1: 0.5434
 epoch: 20, train_loss: 0.8387, test_loss: 1.0613, test_f1: 0.5742
 epoch: 21, train_loss: 0.8289, test_loss: 1.0518, test_f1: 0.5784
 epoch: 22, train_loss: 0.8212, test_loss: 1.0546, test_f1: 0.5569
 epoch: 23, train_loss: 0.8112, test_loss: 1.0472, test_f1: 0.5648
 epoch: 24, train_loss: 0.8126, test_loss: 1.0506, test_f1: 0.5597
 epoch: 25, train_loss: 0.7950, test_loss: 1.0361, test_f1: 0.5778
 epoch: 26, train_loss: 0.7895, test_loss: 1.0546, test_f1: 0.5846
 epoch: 27, train_loss: 0.7835, test_loss: 1.0382, test_f1: 0.5968
 epoch: 28, train_loss: 0.7714, test_loss: 1.0251, test_f1: 0.6093
 epoch: 29, train_loss: 0.7648, test_loss: 1.0469, test_f1: 0.6064
 epoch: 30, train_loss: 0.7745, test_loss: 1.0175, test_f1: 0.6078
 epoch: 31, train_loss: 0.7643, test_loss: 1.0395, test_f1: 0.6151
 epoch: 32, train_loss: 0.7540, test_loss: 1.0547, test_f1: 0.6013
 epoch: 33, train_loss: 0.7442, test_loss: 1.0438, test_f1: 0.6253
 epoch: 34, train_loss: 0.7508, test_loss: 1.0391, test_f1: 0.6109
 epoch: 35, train_loss: 0.7359, test_loss: 1.0265, test_f1: 0.6241
 epoch: 36, train_loss: 0.7298, test_loss: 1.0277, test_f1: 0.6088
 epoch: 37, train_loss: 0.7162, test_loss: 1.0293, test_f1: 0.5874
 epoch: 38, train_loss: 0.7234, test_loss: 1.0487, test_f1: 0.6150
 epoch: 39, train_loss: 0.7039, test_loss: 1.0651, test_f1: 0.6092
 epoch: 40, train_loss: 0.7108, test_loss: 1.0676, test_f1: 0.6325
 epoch: 41, train_loss: 0.7051, test_loss: 1.0626, test_f1: 0.6256
 epoch: 42, train_loss: 0.7040, test_loss: 1.0384, test_f1: 0.6294
 epoch: 43, train_loss: 0.6816, test_loss: 1.0654, test_f1: 0.6276
 epoch: 44, train_loss: 0.6768, test_loss: 1.0539, test_f1: 0.6342
 epoch: 45, train_loss: 0.6767, test_loss: 1.0634, test_f1: 0.6497
 epoch: 46, train_loss: 0.6754, test_loss: 1.0721, test_f1: 0.6225
 epoch: 47, train_loss: 0.6740, test_loss: 1.0272, test_f1: 0.6444
 epoch: 48, train_loss: 0.6561, test_loss: 1.0953, test_f1: 0.6122
 epoch: 49, train_loss: 0.6562, test_loss: 1.0723, test_f1: 0.6253
 epoch: 50, train_loss: 0.6482, test_loss: 1.1053, test_f1: 0.6286
 epoch: 51, train_loss: 0.6370, test_loss: 1.0931, test_f1: 0.6285
 epoch: 52, train_loss: 0.6310, test_loss: 1.1023, test_f1: 0.6283
 epoch: 53, train_loss: 0.6276, test_loss: 1.1015, test_f1: 0.6542
 epoch: 54, train_loss: 0.6207, test_loss: 1.0832, test_f1: 0.6471
 epoch: 55, train_loss: 0.6320, test_loss: 1.0997, test_f1: 0.6423
 epoch: 56, train_loss: 0.6300, test_loss: 1.1126, test_f1: 0.6294
 epoch: 57, train_loss: 0.6000, test_loss: 1.0833, test_f1: 0.6601
 epoch: 58, train_loss: 0.6165, test_loss: 1.1048, test_f1: 0.6264
 epoch: 59, train_loss: 0.5995, test_loss: 1.1024, test_f1: 0.6464
 epoch: 60, train_loss: 0.6070, test_loss: 1.1261, test_f1: 0.6426
 epoch: 61, train_loss: 0.5953, test_loss: 1.1098, test_f1: 0.6307
 epoch: 62, train_loss: 0.6180, test_loss: 1.1083, test_f1: 0.6172
 epoch: 63, train_loss: 0.5901, test_loss: 1.1072, test_f1: 0.6247
 epoch: 64, train_loss: 0.5897, test_loss: 1.1525, test_f1: 0.6246
 epoch: 65, train_loss: 0.5954, test_loss: 1.1240, test_f1: 0.6276
 epoch: 66, train_loss: 0.6032, test_loss: 1.1193, test_f1: 0.6565
 epoch: 67, train_loss: 0.5845, test_loss: 1.1269, test_f1: 0.6377
 epoch: 68, train_loss: 0.5870, test_loss: 1.1373, test_f1: 0.6606
 epoch: 69, train_loss: 0.5770, test_loss: 1.1673, test_f1: 0.6147
 epoch: 70, train_loss: 0.5868, test_loss: 1.1452, test_f1: 0.6698
 epoch: 71, train_loss: 0.5651, test_loss: 1.1589, test_f1: 0.6409
 epoch: 72, train_loss: 0.5677, test_loss: 1.1699, test_f1: 0.6521
 epoch: 73, train_loss: 0.5749, test_loss: 1.1524, test_f1: 0.6414
 epoch: 74, train_loss: 0.5777, test_loss: 1.1842, test_f1: 0.6329
 epoch: 75, train_loss: 0.5716, test_loss: 1.1928, test_f1: 0.6502
 epoch: 76, train_loss: 0.5699, test_loss: 1.1756, test_f1: 0.6360
 epoch: 77, train_loss: 0.5534, test_loss: 1.1665, test_f1: 0.6409
 epoch: 78, train_loss: 0.5509, test_loss: 1.1508, test_f1: 0.6532
 epoch: 79, train_loss: 0.5609, test_loss: 1.1862, test_f1: 0.6383
 epoch: 80, train_loss: 0.5518, test_loss: 1.1772, test_f1: 0.6533
 epoch: 81, train_loss: 0.5552, test_loss: 1.2014, test_f1: 0.6360
 epoch: 82, train_loss: 0.5354, test_loss: 1.1770, test_f1: 0.6331
 epoch: 83, train_loss: 0.5415, test_loss: 1.1855, test_f1: 0.6349
 epoch: 84, train_loss: 0.5389, test_loss: 1.1796, test_f1: 0.6386
 epoch: 85, train_loss: 0.5385, test_loss: 1.2007, test_f1: 0.6362
 epoch: 86, train_loss: 0.5399, test_loss: 1.1684, test_f1: 0.6577
 epoch: 87, train_loss: 0.5327, test_loss: 1.2178, test_f1: 0.6380
 epoch: 88, train_loss: 0.5227, test_loss: 1.1974, test_f1: 0.6399
 epoch: 89, train_loss: 0.5245, test_loss: 1.2257, test_f1: 0.6310
 epoch: 90, train_loss: 0.5219, test_loss: 1.1734, test_f1: 0.6438
 epoch: 91, train_loss: 0.5162, test_loss: 1.2100, test_f1: 0.6406
 epoch: 92, train_loss: 0.5182, test_loss: 1.2286, test_f1: 0.6658
 epoch: 93, train_loss: 0.5236, test_loss: 1.1948, test_f1: 0.6303
 epoch: 94, train_loss: 0.5294, test_loss: 1.2250, test_f1: 0.6489
 epoch: 95, train_loss: 0.5225, test_loss: 1.2177, test_f1: 0.6430
 epoch: 96, train_loss: 0.5023, test_loss: 1.2329, test_f1: 0.6312
 epoch: 97, train_loss: 0.5157, test_loss: 1.1894, test_f1: 0.6467
 epoch: 98, train_loss: 0.5100, test_loss: 1.2313, test_f1: 0.6458
 epoch: 99, train_loss: 0.4840, test_loss: 1.2234, test_f1: 0.6562
##################ITERATION #6 ****************************************
 epoch: 0, train_loss: 1.2517, test_loss: 1.2656, test_f1: 0.2777
 epoch: 1, train_loss: 1.1112, test_loss: 1.2226, test_f1: 0.3924
 epoch: 2, train_loss: 1.0708, test_loss: 1.1581, test_f1: 0.4639
 epoch: 3, train_loss: 1.0493, test_loss: 1.1169, test_f1: 0.4756
 epoch: 4, train_loss: 1.0252, test_loss: 1.1025, test_f1: 0.4770
 epoch: 5, train_loss: 1.0091, test_loss: 1.0847, test_f1: 0.4972
 epoch: 6, train_loss: 1.0019, test_loss: 1.0752, test_f1: 0.4988
 epoch: 7, train_loss: 0.9845, test_loss: 1.0688, test_f1: 0.5113
 epoch: 8, train_loss: 0.9527, test_loss: 1.0607, test_f1: 0.5203
 epoch: 9, train_loss: 0.9582, test_loss: 1.0457, test_f1: 0.5289
 epoch: 10, train_loss: 0.9428, test_loss: 1.0465, test_f1: 0.5355
 epoch: 11, train_loss: 0.9148, test_loss: 1.0379, test_f1: 0.5425
 epoch: 12, train_loss: 0.9125, test_loss: 1.0310, test_f1: 0.5503
 epoch: 13, train_loss: 0.9097, test_loss: 1.0192, test_f1: 0.5763
 epoch: 14, train_loss: 0.8992, test_loss: 1.0186, test_f1: 0.5577
 epoch: 15, train_loss: 0.8891, test_loss: 1.0180, test_f1: 0.5637
 epoch: 16, train_loss: 0.8712, test_loss: 1.0231, test_f1: 0.5723
 epoch: 17, train_loss: 0.8844, test_loss: 1.0134, test_f1: 0.5601
 epoch: 18, train_loss: 0.8673, test_loss: 1.0167, test_f1: 0.5568
 epoch: 19, train_loss: 0.8615, test_loss: 0.9925, test_f1: 0.5771
 epoch: 20, train_loss: 0.8704, test_loss: 1.0112, test_f1: 0.5784
 epoch: 21, train_loss: 0.8335, test_loss: 0.9954, test_f1: 0.5887
 epoch: 22, train_loss: 0.8393, test_loss: 0.9834, test_f1: 0.6041
 epoch: 23, train_loss: 0.8146, test_loss: 0.9974, test_f1: 0.5945
 epoch: 24, train_loss: 0.8139, test_loss: 0.9991, test_f1: 0.5997
 epoch: 25, train_loss: 0.8054, test_loss: 0.9857, test_f1: 0.5969
 epoch: 26, train_loss: 0.8097, test_loss: 1.0068, test_f1: 0.6087
 epoch: 27, train_loss: 0.7977, test_loss: 0.9871, test_f1: 0.6037
 epoch: 28, train_loss: 0.7964, test_loss: 0.9925, test_f1: 0.6212
 epoch: 29, train_loss: 0.7908, test_loss: 0.9879, test_f1: 0.6144
 epoch: 30, train_loss: 0.7797, test_loss: 0.9895, test_f1: 0.6270
 epoch: 31, train_loss: 0.7701, test_loss: 0.9820, test_f1: 0.6160
 epoch: 32, train_loss: 0.7645, test_loss: 0.9899, test_f1: 0.6156
 epoch: 33, train_loss: 0.7692, test_loss: 0.9945, test_f1: 0.6361
 epoch: 34, train_loss: 0.7657, test_loss: 0.9948, test_f1: 0.6273
 epoch: 35, train_loss: 0.7629, test_loss: 1.0039, test_f1: 0.6299
 epoch: 36, train_loss: 0.7536, test_loss: 0.9694, test_f1: 0.6399
 epoch: 37, train_loss: 0.7414, test_loss: 0.9861, test_f1: 0.6036
 epoch: 38, train_loss: 0.7348, test_loss: 0.9814, test_f1: 0.6335
 epoch: 39, train_loss: 0.7351, test_loss: 1.0016, test_f1: 0.6271
 epoch: 40, train_loss: 0.7169, test_loss: 0.9685, test_f1: 0.6498
 epoch: 41, train_loss: 0.7208, test_loss: 0.9995, test_f1: 0.6256
 epoch: 42, train_loss: 0.7169, test_loss: 1.0113, test_f1: 0.6396
 epoch: 43, train_loss: 0.7065, test_loss: 1.0120, test_f1: 0.6486
 epoch: 44, train_loss: 0.7002, test_loss: 0.9968, test_f1: 0.6445
 epoch: 45, train_loss: 0.6848, test_loss: 1.0180, test_f1: 0.6421
 epoch: 46, train_loss: 0.7036, test_loss: 1.0137, test_f1: 0.6317
 epoch: 47, train_loss: 0.6891, test_loss: 0.9947, test_f1: 0.6476
 epoch: 48, train_loss: 0.6863, test_loss: 1.0033, test_f1: 0.6494
 epoch: 49, train_loss: 0.6701, test_loss: 1.0173, test_f1: 0.6192
 epoch: 50, train_loss: 0.6834, test_loss: 1.0270, test_f1: 0.6336
 epoch: 51, train_loss: 0.6535, test_loss: 1.0329, test_f1: 0.6333
 epoch: 52, train_loss: 0.6526, test_loss: 1.0409, test_f1: 0.6468
 epoch: 53, train_loss: 0.6517, test_loss: 1.0336, test_f1: 0.6480
 epoch: 54, train_loss: 0.6479, test_loss: 1.0449, test_f1: 0.6502
 epoch: 55, train_loss: 0.6367, test_loss: 1.0359, test_f1: 0.6313
 epoch: 56, train_loss: 0.6506, test_loss: 1.0404, test_f1: 0.6493
 epoch: 57, train_loss: 0.6408, test_loss: 1.0072, test_f1: 0.6564
 epoch: 58, train_loss: 0.6252, test_loss: 1.0141, test_f1: 0.6344
 epoch: 59, train_loss: 0.6241, test_loss: 1.0303, test_f1: 0.6318
 epoch: 60, train_loss: 0.6320, test_loss: 1.0171, test_f1: 0.6579
 epoch: 61, train_loss: 0.6174, test_loss: 1.0380, test_f1: 0.6319
 epoch: 62, train_loss: 0.6326, test_loss: 1.0497, test_f1: 0.6178
 epoch: 63, train_loss: 0.6229, test_loss: 1.0426, test_f1: 0.6401
 epoch: 64, train_loss: 0.6110, test_loss: 1.0845, test_f1: 0.6408
 epoch: 65, train_loss: 0.6051, test_loss: 1.0445, test_f1: 0.6287
 epoch: 66, train_loss: 0.6063, test_loss: 1.0646, test_f1: 0.6344
 epoch: 67, train_loss: 0.6041, test_loss: 1.0834, test_f1: 0.6339
 epoch: 68, train_loss: 0.6187, test_loss: 1.0738, test_f1: 0.6180
 epoch: 69, train_loss: 0.5893, test_loss: 1.0722, test_f1: 0.6286
 epoch: 70, train_loss: 0.6076, test_loss: 1.0683, test_f1: 0.6397
 epoch: 71, train_loss: 0.6056, test_loss: 1.0659, test_f1: 0.6398
 epoch: 72, train_loss: 0.5992, test_loss: 1.1002, test_f1: 0.6283
 epoch: 73, train_loss: 0.6022, test_loss: 1.0772, test_f1: 0.6271
 epoch: 74, train_loss: 0.5909, test_loss: 1.1124, test_f1: 0.6227
 epoch: 75, train_loss: 0.5861, test_loss: 1.0950, test_f1: 0.6273
 epoch: 76, train_loss: 0.5865, test_loss: 1.1045, test_f1: 0.6261
 epoch: 77, train_loss: 0.5749, test_loss: 1.1039, test_f1: 0.6341
 epoch: 78, train_loss: 0.5696, test_loss: 1.0870, test_f1: 0.6411
 epoch: 79, train_loss: 0.5705, test_loss: 1.0976, test_f1: 0.6444
 epoch: 80, train_loss: 0.5618, test_loss: 1.1191, test_f1: 0.6051
 epoch: 81, train_loss: 0.5622, test_loss: 1.1037, test_f1: 0.6274
 epoch: 82, train_loss: 0.5677, test_loss: 1.1037, test_f1: 0.6216
 epoch: 83, train_loss: 0.5690, test_loss: 1.1136, test_f1: 0.6328
 epoch: 84, train_loss: 0.5503, test_loss: 1.1276, test_f1: 0.6057
 epoch: 85, train_loss: 0.5648, test_loss: 1.1326, test_f1: 0.6153
 epoch: 86, train_loss: 0.5382, test_loss: 1.1293, test_f1: 0.6351
 epoch: 87, train_loss: 0.5481, test_loss: 1.1698, test_f1: 0.6069
 epoch: 88, train_loss: 0.5507, test_loss: 1.1533, test_f1: 0.6211
 epoch: 89, train_loss: 0.5374, test_loss: 1.1670, test_f1: 0.6296
 epoch: 90, train_loss: 0.5526, test_loss: 1.1496, test_f1: 0.6185
 epoch: 91, train_loss: 0.5499, test_loss: 1.1793, test_f1: 0.6215
 epoch: 92, train_loss: 0.5418, test_loss: 1.1949, test_f1: 0.5960
 epoch: 93, train_loss: 0.5505, test_loss: 1.1485, test_f1: 0.6306
 epoch: 94, train_loss: 0.5410, test_loss: 1.2077, test_f1: 0.5998
 epoch: 95, train_loss: 0.5483, test_loss: 1.1859, test_f1: 0.6107
 epoch: 96, train_loss: 0.5263, test_loss: 1.1356, test_f1: 0.6245
 epoch: 97, train_loss: 0.5224, test_loss: 1.1922, test_f1: 0.6244
 epoch: 98, train_loss: 0.5141, test_loss: 1.1480, test_f1: 0.6262
 epoch: 99, train_loss: 0.5197, test_loss: 1.2432, test_f1: 0.6016
##################ITERATION #7 ****************************************
 epoch: 0, train_loss: 1.2221, test_loss: 1.2712, test_f1: 0.1663
 epoch: 1, train_loss: 1.1110, test_loss: 1.1930, test_f1: 0.4112
 epoch: 2, train_loss: 1.0678, test_loss: 1.1306, test_f1: 0.4813
 epoch: 3, train_loss: 1.0583, test_loss: 1.1123, test_f1: 0.5124
 epoch: 4, train_loss: 1.0222, test_loss: 1.0999, test_f1: 0.5209
 epoch: 5, train_loss: 1.0033, test_loss: 1.1085, test_f1: 0.5080
 epoch: 6, train_loss: 0.9906, test_loss: 1.0791, test_f1: 0.5236
 epoch: 7, train_loss: 0.9735, test_loss: 1.0529, test_f1: 0.5167
 epoch: 8, train_loss: 0.9568, test_loss: 1.0555, test_f1: 0.5368
 epoch: 9, train_loss: 0.9324, test_loss: 1.0582, test_f1: 0.5158
 epoch: 10, train_loss: 0.9355, test_loss: 1.0552, test_f1: 0.5240
 epoch: 11, train_loss: 0.9194, test_loss: 1.0505, test_f1: 0.5237
 epoch: 12, train_loss: 0.9085, test_loss: 1.0398, test_f1: 0.5073
 epoch: 13, train_loss: 0.8855, test_loss: 1.0477, test_f1: 0.5313
 epoch: 14, train_loss: 0.8818, test_loss: 1.0452, test_f1: 0.5307
 epoch: 15, train_loss: 0.8838, test_loss: 1.0308, test_f1: 0.5089
 epoch: 16, train_loss: 0.8661, test_loss: 1.0157, test_f1: 0.5270
 epoch: 17, train_loss: 0.8572, test_loss: 1.0266, test_f1: 0.5472
 epoch: 18, train_loss: 0.8543, test_loss: 1.0355, test_f1: 0.5291
 epoch: 19, train_loss: 0.8559, test_loss: 1.0341, test_f1: 0.5423
 epoch: 20, train_loss: 0.8283, test_loss: 1.0308, test_f1: 0.5547
 epoch: 21, train_loss: 0.8263, test_loss: 1.0445, test_f1: 0.5509
 epoch: 22, train_loss: 0.8334, test_loss: 1.0317, test_f1: 0.5702
 epoch: 23, train_loss: 0.8238, test_loss: 1.0337, test_f1: 0.5672
 epoch: 24, train_loss: 0.8243, test_loss: 1.0324, test_f1: 0.5524
 epoch: 25, train_loss: 0.8058, test_loss: 1.0354, test_f1: 0.5905
 epoch: 26, train_loss: 0.8093, test_loss: 1.0372, test_f1: 0.5810
 epoch: 27, train_loss: 0.7931, test_loss: 1.0217, test_f1: 0.5582
 epoch: 28, train_loss: 0.7987, test_loss: 1.0420, test_f1: 0.5759
 epoch: 29, train_loss: 0.7749, test_loss: 1.0354, test_f1: 0.6118
 epoch: 30, train_loss: 0.7932, test_loss: 1.0664, test_f1: 0.5823
 epoch: 31, train_loss: 0.7693, test_loss: 1.0232, test_f1: 0.5929
 epoch: 32, train_loss: 0.7750, test_loss: 1.0434, test_f1: 0.5999
 epoch: 33, train_loss: 0.7625, test_loss: 1.0473, test_f1: 0.5784
 epoch: 34, train_loss: 0.7626, test_loss: 1.0470, test_f1: 0.5762
 epoch: 35, train_loss: 0.7468, test_loss: 1.0700, test_f1: 0.6053
 epoch: 36, train_loss: 0.7548, test_loss: 1.0408, test_f1: 0.5973
 epoch: 37, train_loss: 0.7332, test_loss: 1.0634, test_f1: 0.6118
 epoch: 38, train_loss: 0.7429, test_loss: 1.0425, test_f1: 0.5990
 epoch: 39, train_loss: 0.7314, test_loss: 1.0864, test_f1: 0.5835
 epoch: 40, train_loss: 0.7194, test_loss: 1.0673, test_f1: 0.6101
 epoch: 41, train_loss: 0.7152, test_loss: 1.0398, test_f1: 0.6115
 epoch: 42, train_loss: 0.7113, test_loss: 1.0550, test_f1: 0.6082
 epoch: 43, train_loss: 0.6952, test_loss: 1.0707, test_f1: 0.5868
 epoch: 44, train_loss: 0.6969, test_loss: 1.0869, test_f1: 0.6185
 epoch: 45, train_loss: 0.6904, test_loss: 1.0953, test_f1: 0.6068
 epoch: 46, train_loss: 0.7056, test_loss: 1.0736, test_f1: 0.6347
 epoch: 47, train_loss: 0.6991, test_loss: 1.1153, test_f1: 0.5937
 epoch: 48, train_loss: 0.6655, test_loss: 1.1269, test_f1: 0.6084
 epoch: 49, train_loss: 0.6759, test_loss: 1.1149, test_f1: 0.6194
 epoch: 50, train_loss: 0.6596, test_loss: 1.1313, test_f1: 0.6191
 epoch: 51, train_loss: 0.6571, test_loss: 1.1180, test_f1: 0.6134
 epoch: 52, train_loss: 0.6450, test_loss: 1.1478, test_f1: 0.6113
 epoch: 53, train_loss: 0.6427, test_loss: 1.1112, test_f1: 0.6171
 epoch: 54, train_loss: 0.6569, test_loss: 1.1260, test_f1: 0.6295
 epoch: 55, train_loss: 0.6475, test_loss: 1.1526, test_f1: 0.6189
 epoch: 56, train_loss: 0.6319, test_loss: 1.1404, test_f1: 0.6243
 epoch: 57, train_loss: 0.6328, test_loss: 1.1449, test_f1: 0.6212
 epoch: 58, train_loss: 0.6266, test_loss: 1.1479, test_f1: 0.6145
 epoch: 59, train_loss: 0.6179, test_loss: 1.1500, test_f1: 0.6169
 epoch: 60, train_loss: 0.6100, test_loss: 1.1554, test_f1: 0.6242
 epoch: 61, train_loss: 0.6307, test_loss: 1.1574, test_f1: 0.6141
 epoch: 62, train_loss: 0.6032, test_loss: 1.1690, test_f1: 0.6148
 epoch: 63, train_loss: 0.6182, test_loss: 1.1759, test_f1: 0.6249
 epoch: 64, train_loss: 0.5937, test_loss: 1.1657, test_f1: 0.6171
 epoch: 65, train_loss: 0.5977, test_loss: 1.1941, test_f1: 0.6245
 epoch: 66, train_loss: 0.6060, test_loss: 1.1867, test_f1: 0.6298
 epoch: 67, train_loss: 0.5983, test_loss: 1.2081, test_f1: 0.5963
 epoch: 68, train_loss: 0.6027, test_loss: 1.1957, test_f1: 0.6300
 epoch: 69, train_loss: 0.5905, test_loss: 1.2105, test_f1: 0.6301
 epoch: 70, train_loss: 0.5942, test_loss: 1.2340, test_f1: 0.6174
 epoch: 71, train_loss: 0.5950, test_loss: 1.2089, test_f1: 0.6202
 epoch: 72, train_loss: 0.5940, test_loss: 1.2172, test_f1: 0.6297
 epoch: 73, train_loss: 0.5955, test_loss: 1.2074, test_f1: 0.6170
 epoch: 74, train_loss: 0.5832, test_loss: 1.2165, test_f1: 0.6170
 epoch: 75, train_loss: 0.6037, test_loss: 1.1878, test_f1: 0.6292
 epoch: 76, train_loss: 0.5848, test_loss: 1.2405, test_f1: 0.6221
 epoch: 77, train_loss: 0.5757, test_loss: 1.2203, test_f1: 0.6145
 epoch: 78, train_loss: 0.5881, test_loss: 1.2531, test_f1: 0.6074
 epoch: 79, train_loss: 0.5630, test_loss: 1.2635, test_f1: 0.6297
 epoch: 80, train_loss: 0.5673, test_loss: 1.2360, test_f1: 0.6273
 epoch: 81, train_loss: 0.5598, test_loss: 1.2462, test_f1: 0.6245
 epoch: 82, train_loss: 0.5638, test_loss: 1.2374, test_f1: 0.6195
 epoch: 83, train_loss: 0.5464, test_loss: 1.2747, test_f1: 0.6143
 epoch: 84, train_loss: 0.5554, test_loss: 1.2569, test_f1: 0.6044
 epoch: 85, train_loss: 0.5375, test_loss: 1.2497, test_f1: 0.6022
 epoch: 86, train_loss: 0.5479, test_loss: 1.2836, test_f1: 0.6123
 epoch: 87, train_loss: 0.5499, test_loss: 1.2804, test_f1: 0.6171
 epoch: 88, train_loss: 0.5411, test_loss: 1.2713, test_f1: 0.6146
 epoch: 89, train_loss: 0.5453, test_loss: 1.3077, test_f1: 0.6169
 epoch: 90, train_loss: 0.5327, test_loss: 1.2853, test_f1: 0.6147
 epoch: 91, train_loss: 0.5348, test_loss: 1.2685, test_f1: 0.6117
 epoch: 92, train_loss: 0.5391, test_loss: 1.2929, test_f1: 0.6122
 epoch: 93, train_loss: 0.5359, test_loss: 1.2926, test_f1: 0.6092
 epoch: 94, train_loss: 0.5354, test_loss: 1.2807, test_f1: 0.6252
 epoch: 95, train_loss: 0.5296, test_loss: 1.2922, test_f1: 0.6168
 epoch: 96, train_loss: 0.5266, test_loss: 1.3271, test_f1: 0.6095
 epoch: 97, train_loss: 0.5045, test_loss: 1.3405, test_f1: 0.5972
 epoch: 98, train_loss: 0.5164, test_loss: 1.3301, test_f1: 0.6047
 epoch: 99, train_loss: 0.5210, test_loss: 1.3454, test_f1: 0.5973
##################ITERATION #8 ****************************************
 epoch: 0, train_loss: 1.2536, test_loss: 1.2535, test_f1: 0.3551
 epoch: 1, train_loss: 1.1119, test_loss: 1.1888, test_f1: 0.4551
 epoch: 2, train_loss: 1.0819, test_loss: 1.1221, test_f1: 0.4991
 epoch: 3, train_loss: 1.0654, test_loss: 1.1073, test_f1: 0.4913
 epoch: 4, train_loss: 1.0099, test_loss: 1.0922, test_f1: 0.4903
 epoch: 5, train_loss: 0.9925, test_loss: 1.0786, test_f1: 0.5021
 epoch: 6, train_loss: 0.9949, test_loss: 1.0695, test_f1: 0.5073
 epoch: 7, train_loss: 0.9816, test_loss: 1.0730, test_f1: 0.4845
 epoch: 8, train_loss: 0.9440, test_loss: 1.0576, test_f1: 0.4933
 epoch: 9, train_loss: 0.9565, test_loss: 1.0559, test_f1: 0.4987
 epoch: 10, train_loss: 0.9436, test_loss: 1.0515, test_f1: 0.5140
 epoch: 11, train_loss: 0.9158, test_loss: 1.0433, test_f1: 0.5498
 epoch: 12, train_loss: 0.9025, test_loss: 1.0415, test_f1: 0.5309
 epoch: 13, train_loss: 0.9114, test_loss: 1.0425, test_f1: 0.5314
 epoch: 14, train_loss: 0.8891, test_loss: 1.0535, test_f1: 0.5283
 epoch: 15, train_loss: 0.8819, test_loss: 1.0511, test_f1: 0.5526
 epoch: 16, train_loss: 0.8906, test_loss: 1.0473, test_f1: 0.5634
 epoch: 17, train_loss: 0.8652, test_loss: 1.0442, test_f1: 0.5622
 epoch: 18, train_loss: 0.8538, test_loss: 1.0369, test_f1: 0.5749
 epoch: 19, train_loss: 0.8518, test_loss: 1.0423, test_f1: 0.5680
 epoch: 20, train_loss: 0.8519, test_loss: 1.0388, test_f1: 0.5834
 epoch: 21, train_loss: 0.8416, test_loss: 1.0552, test_f1: 0.5969
 epoch: 22, train_loss: 0.8356, test_loss: 1.0407, test_f1: 0.5700
 epoch: 23, train_loss: 0.8112, test_loss: 1.0313, test_f1: 0.5864
 epoch: 24, train_loss: 0.8149, test_loss: 1.0225, test_f1: 0.6039
 epoch: 25, train_loss: 0.8092, test_loss: 1.0266, test_f1: 0.6033
 epoch: 26, train_loss: 0.8112, test_loss: 1.0251, test_f1: 0.6159
 epoch: 27, train_loss: 0.7894, test_loss: 1.0221, test_f1: 0.6145
 epoch: 28, train_loss: 0.7842, test_loss: 1.0539, test_f1: 0.6160
 epoch: 29, train_loss: 0.7911, test_loss: 1.0260, test_f1: 0.6093
 epoch: 30, train_loss: 0.7750, test_loss: 1.0237, test_f1: 0.6161
 epoch: 31, train_loss: 0.7659, test_loss: 1.0620, test_f1: 0.6019
 epoch: 32, train_loss: 0.7664, test_loss: 1.0305, test_f1: 0.6046
 epoch: 33, train_loss: 0.7693, test_loss: 1.0067, test_f1: 0.6192
 epoch: 34, train_loss: 0.7549, test_loss: 1.0153, test_f1: 0.6488
 epoch: 35, train_loss: 0.7390, test_loss: 1.0361, test_f1: 0.6368
 epoch: 36, train_loss: 0.7337, test_loss: 1.0391, test_f1: 0.6073
 epoch: 37, train_loss: 0.7482, test_loss: 1.0532, test_f1: 0.6382
 epoch: 38, train_loss: 0.7355, test_loss: 1.0394, test_f1: 0.6249
 epoch: 39, train_loss: 0.7218, test_loss: 1.0526, test_f1: 0.6423
 epoch: 40, train_loss: 0.6969, test_loss: 1.0173, test_f1: 0.6395
 epoch: 41, train_loss: 0.7359, test_loss: 1.0304, test_f1: 0.6294
 epoch: 42, train_loss: 0.7223, test_loss: 1.0592, test_f1: 0.6271
 epoch: 43, train_loss: 0.7107, test_loss: 1.0691, test_f1: 0.6452
 epoch: 44, train_loss: 0.7031, test_loss: 1.0550, test_f1: 0.6719
 epoch: 45, train_loss: 0.6886, test_loss: 1.0317, test_f1: 0.6584
 epoch: 46, train_loss: 0.6934, test_loss: 1.0515, test_f1: 0.6224
 epoch: 47, train_loss: 0.6935, test_loss: 1.0476, test_f1: 0.6507
 epoch: 48, train_loss: 0.6803, test_loss: 1.0433, test_f1: 0.6773
 epoch: 49, train_loss: 0.6656, test_loss: 1.0317, test_f1: 0.6735
 epoch: 50, train_loss: 0.6572, test_loss: 1.0517, test_f1: 0.6934
 epoch: 51, train_loss: 0.6533, test_loss: 1.0268, test_f1: 0.6771
 epoch: 52, train_loss: 0.6502, test_loss: 1.0438, test_f1: 0.6839
 epoch: 53, train_loss: 0.6373, test_loss: 1.0558, test_f1: 0.6635
 epoch: 54, train_loss: 0.6382, test_loss: 1.0560, test_f1: 0.6778
 epoch: 55, train_loss: 0.6449, test_loss: 1.0714, test_f1: 0.6538
 epoch: 56, train_loss: 0.6394, test_loss: 1.0710, test_f1: 0.6720
 epoch: 57, train_loss: 0.6376, test_loss: 1.0795, test_f1: 0.6712
 epoch: 58, train_loss: 0.6330, test_loss: 1.0926, test_f1: 0.6354
 epoch: 59, train_loss: 0.6243, test_loss: 1.0894, test_f1: 0.6504
 epoch: 60, train_loss: 0.6179, test_loss: 1.0711, test_f1: 0.6718
 epoch: 61, train_loss: 0.6380, test_loss: 1.0776, test_f1: 0.6415
 epoch: 62, train_loss: 0.6060, test_loss: 1.0871, test_f1: 0.6310
 epoch: 63, train_loss: 0.6278, test_loss: 1.0676, test_f1: 0.6840
 epoch: 64, train_loss: 0.6015, test_loss: 1.0878, test_f1: 0.6679
 epoch: 65, train_loss: 0.6012, test_loss: 1.0867, test_f1: 0.6609
 epoch: 66, train_loss: 0.5935, test_loss: 1.0956, test_f1: 0.6405
 epoch: 67, train_loss: 0.5922, test_loss: 1.0856, test_f1: 0.6718
 epoch: 68, train_loss: 0.5997, test_loss: 1.0777, test_f1: 0.6338
 epoch: 69, train_loss: 0.5876, test_loss: 1.1138, test_f1: 0.6423
 epoch: 70, train_loss: 0.5696, test_loss: 1.1209, test_f1: 0.6111
 epoch: 71, train_loss: 0.5838, test_loss: 1.1119, test_f1: 0.6358
 epoch: 72, train_loss: 0.5996, test_loss: 1.1273, test_f1: 0.6255
 epoch: 73, train_loss: 0.5803, test_loss: 1.1229, test_f1: 0.6519
 epoch: 74, train_loss: 0.5743, test_loss: 1.1077, test_f1: 0.6460
 epoch: 75, train_loss: 0.5823, test_loss: 1.1419, test_f1: 0.6048
 epoch: 76, train_loss: 0.5722, test_loss: 1.1299, test_f1: 0.6238
 epoch: 77, train_loss: 0.5765, test_loss: 1.1686, test_f1: 0.6256
 epoch: 78, train_loss: 0.5582, test_loss: 1.1371, test_f1: 0.6496
 epoch: 79, train_loss: 0.5621, test_loss: 1.1349, test_f1: 0.6340
 epoch: 80, train_loss: 0.5423, test_loss: 1.1470, test_f1: 0.6444
 epoch: 81, train_loss: 0.5592, test_loss: 1.1433, test_f1: 0.6499
 epoch: 82, train_loss: 0.5510, test_loss: 1.1370, test_f1: 0.6520
 epoch: 83, train_loss: 0.5346, test_loss: 1.1351, test_f1: 0.6298
 epoch: 84, train_loss: 0.5474, test_loss: 1.1645, test_f1: 0.6303
 epoch: 85, train_loss: 0.5631, test_loss: 1.1932, test_f1: 0.6318
 epoch: 86, train_loss: 0.5457, test_loss: 1.1828, test_f1: 0.6498
 epoch: 87, train_loss: 0.5449, test_loss: 1.1700, test_f1: 0.6361
 epoch: 88, train_loss: 0.5384, test_loss: 1.1783, test_f1: 0.6143
 epoch: 89, train_loss: 0.5421, test_loss: 1.2226, test_f1: 0.6200
 epoch: 90, train_loss: 0.5242, test_loss: 1.1960, test_f1: 0.6065
 epoch: 91, train_loss: 0.5137, test_loss: 1.1690, test_f1: 0.6286
 epoch: 92, train_loss: 0.5212, test_loss: 1.2240, test_f1: 0.6281
 epoch: 93, train_loss: 0.5275, test_loss: 1.2427, test_f1: 0.6083
 epoch: 94, train_loss: 0.5447, test_loss: 1.1844, test_f1: 0.6484
 epoch: 95, train_loss: 0.5378, test_loss: 1.1989, test_f1: 0.6297
 epoch: 96, train_loss: 0.5212, test_loss: 1.2233, test_f1: 0.6363
 epoch: 97, train_loss: 0.5190, test_loss: 1.1844, test_f1: 0.6402
 epoch: 98, train_loss: 0.5085, test_loss: 1.2370, test_f1: 0.6127
 epoch: 99, train_loss: 0.5143, test_loss: 1.2221, test_f1: 0.6138
##################ITERATION #9 ****************************************
 epoch: 0, train_loss: 1.3069, test_loss: 1.3512, test_f1: 0.1365
 epoch: 1, train_loss: 1.1396, test_loss: 1.1729, test_f1: 0.4204
 epoch: 2, train_loss: 1.0769, test_loss: 1.1117, test_f1: 0.4932
 epoch: 3, train_loss: 1.0682, test_loss: 1.1173, test_f1: 0.4519
 epoch: 4, train_loss: 1.0423, test_loss: 1.1127, test_f1: 0.4473
 epoch: 5, train_loss: 1.0294, test_loss: 1.1198, test_f1: 0.4575
 epoch: 6, train_loss: 0.9960, test_loss: 1.1120, test_f1: 0.4615
 epoch: 7, train_loss: 0.9822, test_loss: 1.1316, test_f1: 0.4514
 epoch: 8, train_loss: 0.9668, test_loss: 1.1357, test_f1: 0.4951
 epoch: 9, train_loss: 0.9543, test_loss: 1.1216, test_f1: 0.4813
 epoch: 10, train_loss: 0.9494, test_loss: 1.1137, test_f1: 0.4761
 epoch: 11, train_loss: 0.9279, test_loss: 1.1120, test_f1: 0.4797
 epoch: 12, train_loss: 0.9089, test_loss: 1.1271, test_f1: 0.5041
 epoch: 13, train_loss: 0.8894, test_loss: 1.1144, test_f1: 0.5115
 epoch: 14, train_loss: 0.8906, test_loss: 1.1231, test_f1: 0.5000
 epoch: 15, train_loss: 0.8814, test_loss: 1.1137, test_f1: 0.5278
 epoch: 16, train_loss: 0.8708, test_loss: 1.1302, test_f1: 0.5558
 epoch: 17, train_loss: 0.8598, test_loss: 1.1178, test_f1: 0.5659
 epoch: 18, train_loss: 0.8683, test_loss: 1.1119, test_f1: 0.5478
 epoch: 19, train_loss: 0.8523, test_loss: 1.1059, test_f1: 0.5477
 epoch: 20, train_loss: 0.8446, test_loss: 1.1091, test_f1: 0.5462
 epoch: 21, train_loss: 0.8446, test_loss: 1.1013, test_f1: 0.5738
 epoch: 22, train_loss: 0.8214, test_loss: 1.0728, test_f1: 0.5560
 epoch: 23, train_loss: 0.8191, test_loss: 1.0547, test_f1: 0.6096
 epoch: 24, train_loss: 0.8066, test_loss: 1.0925, test_f1: 0.5775
 epoch: 25, train_loss: 0.8113, test_loss: 1.1061, test_f1: 0.5890
 epoch: 26, train_loss: 0.8114, test_loss: 1.1162, test_f1: 0.5796
 epoch: 27, train_loss: 0.7992, test_loss: 1.1007, test_f1: 0.5790
 epoch: 28, train_loss: 0.7929, test_loss: 1.0996, test_f1: 0.5914
 epoch: 29, train_loss: 0.7849, test_loss: 1.0858, test_f1: 0.5704
 epoch: 30, train_loss: 0.7907, test_loss: 1.0904, test_f1: 0.5940
 epoch: 31, train_loss: 0.7547, test_loss: 1.0922, test_f1: 0.6007
 epoch: 32, train_loss: 0.7757, test_loss: 1.0714, test_f1: 0.6230
 epoch: 33, train_loss: 0.7754, test_loss: 1.0599, test_f1: 0.6091
 epoch: 34, train_loss: 0.7581, test_loss: 1.0982, test_f1: 0.6021
 epoch: 35, train_loss: 0.7605, test_loss: 1.1161, test_f1: 0.6030
 epoch: 36, train_loss: 0.7362, test_loss: 1.1041, test_f1: 0.6273
 epoch: 37, train_loss: 0.7288, test_loss: 1.0699, test_f1: 0.6199
 epoch: 38, train_loss: 0.7460, test_loss: 1.1014, test_f1: 0.6264
 epoch: 39, train_loss: 0.7237, test_loss: 1.0748, test_f1: 0.6209
 epoch: 40, train_loss: 0.7246, test_loss: 1.0804, test_f1: 0.6274
 epoch: 41, train_loss: 0.7227, test_loss: 1.1050, test_f1: 0.6085
 epoch: 42, train_loss: 0.6937, test_loss: 1.0738, test_f1: 0.6173
 epoch: 43, train_loss: 0.7181, test_loss: 1.0865, test_f1: 0.6163
 epoch: 44, train_loss: 0.7105, test_loss: 1.1152, test_f1: 0.5994
 epoch: 45, train_loss: 0.6922, test_loss: 1.1117, test_f1: 0.6295
 epoch: 46, train_loss: 0.7000, test_loss: 1.0995, test_f1: 0.6082
 epoch: 47, train_loss: 0.6819, test_loss: 1.0992, test_f1: 0.6162
 epoch: 48, train_loss: 0.6719, test_loss: 1.0889, test_f1: 0.6345
 epoch: 49, train_loss: 0.6784, test_loss: 1.1352, test_f1: 0.6391
 epoch: 50, train_loss: 0.6728, test_loss: 1.0983, test_f1: 0.6240
 epoch: 51, train_loss: 0.6563, test_loss: 1.1254, test_f1: 0.6135
 epoch: 52, train_loss: 0.6560, test_loss: 1.1155, test_f1: 0.6269
 epoch: 53, train_loss: 0.6582, test_loss: 1.1027, test_f1: 0.6136
 epoch: 54, train_loss: 0.6547, test_loss: 1.1204, test_f1: 0.6181
 epoch: 55, train_loss: 0.6375, test_loss: 1.1309, test_f1: 0.6132
 epoch: 56, train_loss: 0.6357, test_loss: 1.1584, test_f1: 0.5964
 epoch: 57, train_loss: 0.6339, test_loss: 1.1609, test_f1: 0.6064
 epoch: 58, train_loss: 0.6335, test_loss: 1.1528, test_f1: 0.6214
 epoch: 59, train_loss: 0.6283, test_loss: 1.1450, test_f1: 0.5991
 epoch: 60, train_loss: 0.6169, test_loss: 1.1491, test_f1: 0.6000
 epoch: 61, train_loss: 0.6121, test_loss: 1.1385, test_f1: 0.6244
 epoch: 62, train_loss: 0.6330, test_loss: 1.1771, test_f1: 0.6223
 epoch: 63, train_loss: 0.6387, test_loss: 1.1649, test_f1: 0.6164
 epoch: 64, train_loss: 0.6236, test_loss: 1.1655, test_f1: 0.5946
 epoch: 65, train_loss: 0.6147, test_loss: 1.1660, test_f1: 0.5888
 epoch: 66, train_loss: 0.6133, test_loss: 1.1874, test_f1: 0.5964
 epoch: 67, train_loss: 0.6174, test_loss: 1.1596, test_f1: 0.6240
 epoch: 68, train_loss: 0.6009, test_loss: 1.1783, test_f1: 0.5991
 epoch: 69, train_loss: 0.6118, test_loss: 1.1880, test_f1: 0.6033
 epoch: 70, train_loss: 0.5977, test_loss: 1.1722, test_f1: 0.6216
 epoch: 71, train_loss: 0.6046, test_loss: 1.2005, test_f1: 0.6347
 epoch: 72, train_loss: 0.6056, test_loss: 1.1718, test_f1: 0.5991
 epoch: 73, train_loss: 0.5908, test_loss: 1.1718, test_f1: 0.6017
 epoch: 74, train_loss: 0.5951, test_loss: 1.1952, test_f1: 0.6003
 epoch: 75, train_loss: 0.5761, test_loss: 1.1837, test_f1: 0.6112
 epoch: 76, train_loss: 0.5759, test_loss: 1.2002, test_f1: 0.6064
 epoch: 77, train_loss: 0.5768, test_loss: 1.1841, test_f1: 0.6025
 epoch: 78, train_loss: 0.5834, test_loss: 1.1870, test_f1: 0.5995
 epoch: 79, train_loss: 0.5769, test_loss: 1.1921, test_f1: 0.6172
 epoch: 80, train_loss: 0.5644, test_loss: 1.2190, test_f1: 0.6064
 epoch: 81, train_loss: 0.5762, test_loss: 1.1961, test_f1: 0.6064
 epoch: 82, train_loss: 0.5601, test_loss: 1.1756, test_f1: 0.6190
 epoch: 83, train_loss: 0.5702, test_loss: 1.1997, test_f1: 0.6131
 epoch: 84, train_loss: 0.5490, test_loss: 1.2379, test_f1: 0.6062
 epoch: 85, train_loss: 0.5524, test_loss: 1.2083, test_f1: 0.6159
 epoch: 86, train_loss: 0.5735, test_loss: 1.2410, test_f1: 0.5887
 epoch: 87, train_loss: 0.5587, test_loss: 1.2382, test_f1: 0.6200
 epoch: 88, train_loss: 0.5588, test_loss: 1.2522, test_f1: 0.6213
 epoch: 89, train_loss: 0.5596, test_loss: 1.2183, test_f1: 0.6121
 epoch: 90, train_loss: 0.5350, test_loss: 1.1999, test_f1: 0.6174
 epoch: 91, train_loss: 0.5388, test_loss: 1.2187, test_f1: 0.6342
 epoch: 92, train_loss: 0.5326, test_loss: 1.2175, test_f1: 0.6368
 epoch: 93, train_loss: 0.5500, test_loss: 1.2237, test_f1: 0.6114
 epoch: 94, train_loss: 0.5418, test_loss: 1.2759, test_f1: 0.6176
 epoch: 95, train_loss: 0.5483, test_loss: 1.2724, test_f1: 0.6209
 epoch: 96, train_loss: 0.5481, test_loss: 1.2328, test_f1: 0.6390
 epoch: 97, train_loss: 0.5267, test_loss: 1.2317, test_f1: 0.6139
 epoch: 98, train_loss: 0.5311, test_loss: 1.2684, test_f1: 0.6196
 epoch: 99, train_loss: 0.5244, test_loss: 1.2468, test_f1: 0.6140

Training completed in 379.49 seconds
Best F1: 0.6934 at epoch 50
Mean F1 across iterations: 0.6453  0.0219
========================FINAL RESULTS================================
FEGIN weighted F1: 0.6934  0.0219
python main.py --data ltspice_demos --representation component_net --model FEGIN --layers 2 --hiddens 128 --batch_size 64 --lr 0.0001 --emb_size 128 --epochs 100 --save_appendix component_net_L2_H128_BS64_LR0.0001_E128 --no_val
-----



STDERR:
  File "main.py", line 370, in <module>
    main()
  File "main.py", line 254, in main
    dataset = dataset_class(
  File "/home/philip/projects/ltspice_examples_code_repo/Circuit-Completion-Using-GNNs/component_classification_with_link_prediction_head/evaluation/FEGIN/kernel/circuit_datasets.py", line 15, in __init__
    self.data, self.slices = torch.load(self.processed_paths[0])
  File "/home/philip/.local/lib/python3.8/site-packages/torch/serialization.py", line 1040, in load
    warnings.warn(
  File "/usr/lib/python3.8/warnings.py", line 109, in _showwarnmsg
    sw(msg.message, msg.category, msg.filename, msg.lineno,
  File "main.py", line 47, in warn_with_traceback
    traceback.print_stack(file=log)
/home/philip/projects/ltspice_examples_code_repo/Circuit-Completion-Using-GNNs/component_classification_with_link_prediction_head/evaluation/FEGIN/kernel/circuit_datasets.py:15: FutureWarning: You are using `torch.load` with `weights_only=False` (the current default value), which uses the default pickle module implicitly. It is possible to construct malicious pickle data which will execute arbitrary code during unpickling (See https://github.com/pytorch/pytorch/blob/main/SECURITY.md#untrusted-models for more details). In a future release, the default value for `weights_only` will be flipped to `True`. This limits the functions that could be executed during unpickling. Arbitrary objects will no longer be allowed to be loaded via this mode unless they are explicitly allowlisted by the user via `torch.serialization.add_safe_globals`. We recommend you start setting `weights_only=True` for any use case where you don't have full control of the loaded file. Please open an issue on GitHub for any issues related to this experimental feature.
  self.data, self.slices = torch.load(self.processed_paths[0])
