STDOUT:
Results will be saved in /home/philip/projects/ltspice_examples_code_repo/Circuit-Completion-Using-GNNs/component_classification_with_link_prediction_head/evaluation/FEGIN/results/model_FEGIN_dataset_ltspice_demos
Command line input: python main.py --data ltspice_demos --representation component_net --model FEGIN --layers 4 --hiddens 32 --batch_size 128 --lr 0.01 --emb_size 250 --epochs 100 --save_appendix component_net_L4_H32_BS128_LR0.01_E250 --no_val
 is saved.
-----
ltspice_demos - FEGIN
Using 4 layers, 32 hidden units, h = 2
Loading component_net representation dataset
ENTERED
Training FEGIN on component_net representation
Train: 1565, Test: 383
##################ITERATION #0 ****************************************
 epoch: 0, train_loss: 1.2391, test_loss: 1.3027, test_f1: 0.2281
 epoch: 1, train_loss: 1.1116, test_loss: 1.2541, test_f1: 0.2860
 epoch: 2, train_loss: 1.0552, test_loss: 1.1896, test_f1: 0.3658
 epoch: 3, train_loss: 1.0310, test_loss: 1.0773, test_f1: 0.4110
 epoch: 4, train_loss: 0.9827, test_loss: 1.2043, test_f1: 0.4165
 epoch: 5, train_loss: 0.9901, test_loss: 1.1732, test_f1: 0.3752
 epoch: 6, train_loss: 0.9516, test_loss: 1.2030, test_f1: 0.5178
 epoch: 7, train_loss: 0.9243, test_loss: 1.0592, test_f1: 0.5471
 epoch: 8, train_loss: 0.8929, test_loss: 1.1408, test_f1: 0.5430
 epoch: 9, train_loss: 0.9035, test_loss: 1.0410, test_f1: 0.5141
 epoch: 10, train_loss: 0.8884, test_loss: 1.0694, test_f1: 0.5759
 epoch: 11, train_loss: 0.8823, test_loss: 1.0973, test_f1: 0.5301
 epoch: 12, train_loss: 0.8940, test_loss: 1.0984, test_f1: 0.5875
 epoch: 13, train_loss: 0.8810, test_loss: 1.1543, test_f1: 0.5474
 epoch: 14, train_loss: 0.8867, test_loss: 1.1045, test_f1: 0.4671
 epoch: 15, train_loss: 0.8457, test_loss: 1.0000, test_f1: 0.5551
 epoch: 16, train_loss: 0.8561, test_loss: 1.0147, test_f1: 0.5656
 epoch: 17, train_loss: 0.8395, test_loss: 1.1515, test_f1: 0.5312
 epoch: 18, train_loss: 0.8275, test_loss: 0.9665, test_f1: 0.5797
 epoch: 19, train_loss: 0.8275, test_loss: 1.0164, test_f1: 0.5694
 epoch: 20, train_loss: 0.8216, test_loss: 1.0581, test_f1: 0.5802
 epoch: 21, train_loss: 0.7917, test_loss: 1.1258, test_f1: 0.5890
 epoch: 22, train_loss: 0.8461, test_loss: 1.2580, test_f1: 0.5765
 epoch: 23, train_loss: 0.7926, test_loss: 1.4397, test_f1: 0.4699
 epoch: 24, train_loss: 0.7796, test_loss: 1.2590, test_f1: 0.4884
 epoch: 25, train_loss: 0.7814, test_loss: 1.0990, test_f1: 0.5802
 epoch: 26, train_loss: 0.7623, test_loss: 1.0681, test_f1: 0.5841
 epoch: 27, train_loss: 0.7787, test_loss: 1.2882, test_f1: 0.5410
 epoch: 28, train_loss: 0.7369, test_loss: 1.1528, test_f1: 0.6168
 epoch: 29, train_loss: 0.7220, test_loss: 1.1832, test_f1: 0.5207
 epoch: 30, train_loss: 0.7174, test_loss: 1.1139, test_f1: 0.5619
 epoch: 31, train_loss: 0.7249, test_loss: 0.9994, test_f1: 0.5725
 epoch: 32, train_loss: 0.7309, test_loss: 1.2452, test_f1: 0.5571
 epoch: 33, train_loss: 0.7250, test_loss: 1.0977, test_f1: 0.5934
 epoch: 34, train_loss: 0.6913, test_loss: 1.1899, test_f1: 0.5798
 epoch: 35, train_loss: 0.6923, test_loss: 1.1715, test_f1: 0.6073
 epoch: 36, train_loss: 0.6510, test_loss: 1.0690, test_f1: 0.6033
 epoch: 37, train_loss: 0.6958, test_loss: 1.2494, test_f1: 0.5936
 epoch: 38, train_loss: 0.7187, test_loss: 1.6522, test_f1: 0.5528
 epoch: 39, train_loss: 0.7079, test_loss: 1.1328, test_f1: 0.5944
 epoch: 40, train_loss: 0.6780, test_loss: 1.2337, test_f1: 0.5764
 epoch: 41, train_loss: 0.6856, test_loss: 1.2791, test_f1: 0.5931
 epoch: 42, train_loss: 0.6416, test_loss: 1.1542, test_f1: 0.5941
 epoch: 43, train_loss: 0.6648, test_loss: 1.8253, test_f1: 0.5641
 epoch: 44, train_loss: 0.6874, test_loss: 1.1792, test_f1: 0.5627
 epoch: 45, train_loss: 0.6889, test_loss: 1.0463, test_f1: 0.5862
 epoch: 46, train_loss: 0.6838, test_loss: 1.1291, test_f1: 0.5783
 epoch: 47, train_loss: 0.6352, test_loss: 1.1272, test_f1: 0.5839
 epoch: 48, train_loss: 0.6294, test_loss: 1.4668, test_f1: 0.5925
 epoch: 49, train_loss: 0.6568, test_loss: 1.3794, test_f1: 0.5805
 epoch: 50, train_loss: 0.6833, test_loss: 1.2381, test_f1: 0.5506
 epoch: 51, train_loss: 0.6690, test_loss: 1.1007, test_f1: 0.6104
 epoch: 52, train_loss: 0.6081, test_loss: 1.2418, test_f1: 0.6195
 epoch: 53, train_loss: 0.6006, test_loss: 1.1803, test_f1: 0.6115
 epoch: 54, train_loss: 0.5927, test_loss: 1.2756, test_f1: 0.6076
 epoch: 55, train_loss: 0.5696, test_loss: 1.2593, test_f1: 0.6022
 epoch: 56, train_loss: 0.5514, test_loss: 1.1458, test_f1: 0.6191
 epoch: 57, train_loss: 0.5652, test_loss: 1.2367, test_f1: 0.6401
 epoch: 58, train_loss: 0.5365, test_loss: 1.2444, test_f1: 0.6112
 epoch: 59, train_loss: 0.5175, test_loss: 1.3666, test_f1: 0.6174
 epoch: 60, train_loss: 0.5218, test_loss: 1.3701, test_f1: 0.6394
 epoch: 61, train_loss: 0.5568, test_loss: 1.2406, test_f1: 0.6316
 epoch: 62, train_loss: 0.5328, test_loss: 1.2162, test_f1: 0.6265
 epoch: 63, train_loss: 0.5127, test_loss: 1.2956, test_f1: 0.6345
 epoch: 64, train_loss: 0.5080, test_loss: 1.4347, test_f1: 0.5912
 epoch: 65, train_loss: 0.5435, test_loss: 1.4626, test_f1: 0.6161
 epoch: 66, train_loss: 0.5250, test_loss: 1.4419, test_f1: 0.5501
 epoch: 67, train_loss: 0.5157, test_loss: 1.6487, test_f1: 0.6069
 epoch: 68, train_loss: 0.4792, test_loss: 1.4636, test_f1: 0.5778
 epoch: 69, train_loss: 0.5234, test_loss: 1.7008, test_f1: 0.6075
 epoch: 70, train_loss: 0.5110, test_loss: 1.5268, test_f1: 0.6179
 epoch: 71, train_loss: 0.4970, test_loss: 1.5296, test_f1: 0.5661
 epoch: 72, train_loss: 0.4922, test_loss: 1.5000, test_f1: 0.5648
 epoch: 73, train_loss: 0.4880, test_loss: 1.4656, test_f1: 0.5985
 epoch: 74, train_loss: 0.4790, test_loss: 1.5393, test_f1: 0.5901
 epoch: 75, train_loss: 0.4920, test_loss: 1.3366, test_f1: 0.6331
 epoch: 76, train_loss: 0.5181, test_loss: 1.6010, test_f1: 0.6155
 epoch: 77, train_loss: 0.4809, test_loss: 1.6928, test_f1: 0.5783
 epoch: 78, train_loss: 0.4495, test_loss: 1.8497, test_f1: 0.6136
 epoch: 79, train_loss: 0.4631, test_loss: 1.6666, test_f1: 0.6090
 epoch: 80, train_loss: 0.4570, test_loss: 1.8777, test_f1: 0.5923
 epoch: 81, train_loss: 0.4384, test_loss: 1.6393, test_f1: 0.6089
 epoch: 82, train_loss: 0.4590, test_loss: 1.8418, test_f1: 0.5941
 epoch: 83, train_loss: 0.4769, test_loss: 1.8384, test_f1: 0.6111
 epoch: 84, train_loss: 0.4983, test_loss: 1.5351, test_f1: 0.6426
 epoch: 85, train_loss: 0.4737, test_loss: 1.6006, test_f1: 0.5698
 epoch: 86, train_loss: 0.4710, test_loss: 1.9910, test_f1: 0.6145
 epoch: 87, train_loss: 0.4675, test_loss: 1.6744, test_f1: 0.6077
 epoch: 88, train_loss: 0.4319, test_loss: 1.9485, test_f1: 0.5942
 epoch: 89, train_loss: 0.4270, test_loss: 1.6209, test_f1: 0.6316
 epoch: 90, train_loss: 0.5074, test_loss: 2.0436, test_f1: 0.6329
 epoch: 91, train_loss: 0.5224, test_loss: 1.7395, test_f1: 0.6008
 epoch: 92, train_loss: 0.4838, test_loss: 1.7266, test_f1: 0.6312
 epoch: 93, train_loss: 0.4714, test_loss: 1.6991, test_f1: 0.6325
 epoch: 94, train_loss: 0.4543, test_loss: 1.6026, test_f1: 0.6289
 epoch: 95, train_loss: 0.4388, test_loss: 1.8515, test_f1: 0.6285
 epoch: 96, train_loss: 0.4455, test_loss: 1.5865, test_f1: 0.6019
 epoch: 97, train_loss: 0.4193, test_loss: 1.7345, test_f1: 0.6501
 epoch: 98, train_loss: 0.4343, test_loss: 1.6981, test_f1: 0.6311
 epoch: 99, train_loss: 0.4530, test_loss: 1.8275, test_f1: 0.6097
##################ITERATION #1 ****************************************
 epoch: 0, train_loss: 1.1859, test_loss: 1.3460, test_f1: 0.2281
 epoch: 1, train_loss: 1.0364, test_loss: 1.1684, test_f1: 0.3214
 epoch: 2, train_loss: 0.9774, test_loss: 1.1286, test_f1: 0.4420
 epoch: 3, train_loss: 0.9378, test_loss: 1.2145, test_f1: 0.3919
 epoch: 4, train_loss: 0.9384, test_loss: 1.1461, test_f1: 0.4850
 epoch: 5, train_loss: 0.9180, test_loss: 1.1481, test_f1: 0.5394
 epoch: 6, train_loss: 0.9196, test_loss: 1.1495, test_f1: 0.4811
 epoch: 7, train_loss: 0.8864, test_loss: 1.0249, test_f1: 0.5469
 epoch: 8, train_loss: 0.8620, test_loss: 1.1776, test_f1: 0.5264
 epoch: 9, train_loss: 0.8663, test_loss: 1.0744, test_f1: 0.5978
 epoch: 10, train_loss: 0.8458, test_loss: 1.1515, test_f1: 0.5199
 epoch: 11, train_loss: 0.8544, test_loss: 1.1460, test_f1: 0.5239
 epoch: 12, train_loss: 0.8542, test_loss: 1.2148, test_f1: 0.5131
 epoch: 13, train_loss: 0.8551, test_loss: 1.2473, test_f1: 0.4904
 epoch: 14, train_loss: 0.8316, test_loss: 1.0701, test_f1: 0.5669
 epoch: 15, train_loss: 0.8050, test_loss: 1.0989, test_f1: 0.5313
 epoch: 16, train_loss: 0.7869, test_loss: 1.1449, test_f1: 0.5261
 epoch: 17, train_loss: 0.7677, test_loss: 1.2686, test_f1: 0.4997
 epoch: 18, train_loss: 0.8047, test_loss: 1.2470, test_f1: 0.5159
 epoch: 19, train_loss: 0.8076, test_loss: 1.4775, test_f1: 0.4920
 epoch: 20, train_loss: 0.7804, test_loss: 1.2361, test_f1: 0.5188
 epoch: 21, train_loss: 0.7388, test_loss: 1.1116, test_f1: 0.5905
 epoch: 22, train_loss: 0.7375, test_loss: 1.2152, test_f1: 0.5631
 epoch: 23, train_loss: 0.7998, test_loss: 1.1825, test_f1: 0.5470
 epoch: 24, train_loss: 0.7599, test_loss: 1.0232, test_f1: 0.6122
 epoch: 25, train_loss: 0.7362, test_loss: 1.1990, test_f1: 0.5954
 epoch: 26, train_loss: 0.7065, test_loss: 1.2113, test_f1: 0.5610
 epoch: 27, train_loss: 0.6972, test_loss: 1.2822, test_f1: 0.5593
 epoch: 28, train_loss: 0.7338, test_loss: 1.2210, test_f1: 0.5939
 epoch: 29, train_loss: 0.6998, test_loss: 1.2828, test_f1: 0.5455
 epoch: 30, train_loss: 0.6761, test_loss: 1.2485, test_f1: 0.5636
 epoch: 31, train_loss: 0.6587, test_loss: 1.5402, test_f1: 0.5183
 epoch: 32, train_loss: 0.6995, test_loss: 1.2302, test_f1: 0.5548
 epoch: 33, train_loss: 0.6526, test_loss: 1.4727, test_f1: 0.5564
 epoch: 34, train_loss: 0.6815, test_loss: 1.4780, test_f1: 0.5993
 epoch: 35, train_loss: 0.6683, test_loss: 1.3959, test_f1: 0.5271
 epoch: 36, train_loss: 0.6318, test_loss: 1.3787, test_f1: 0.5670
 epoch: 37, train_loss: 0.6323, test_loss: 1.5652, test_f1: 0.5530
 epoch: 38, train_loss: 0.6631, test_loss: 1.3251, test_f1: 0.5950
 epoch: 39, train_loss: 0.6599, test_loss: 1.3477, test_f1: 0.5778
 epoch: 40, train_loss: 0.6136, test_loss: 1.9291, test_f1: 0.5106
 epoch: 41, train_loss: 0.6229, test_loss: 1.6230, test_f1: 0.5576
 epoch: 42, train_loss: 0.6423, test_loss: 1.3599, test_f1: 0.5486
 epoch: 43, train_loss: 0.6512, test_loss: 1.3390, test_f1: 0.5744
 epoch: 44, train_loss: 0.6473, test_loss: 1.5921, test_f1: 0.5590
 epoch: 45, train_loss: 0.6047, test_loss: 1.7353, test_f1: 0.5664
 epoch: 46, train_loss: 0.6233, test_loss: 1.2576, test_f1: 0.5768
 epoch: 47, train_loss: 0.5879, test_loss: 1.3467, test_f1: 0.6017
 epoch: 48, train_loss: 0.5586, test_loss: 1.6280, test_f1: 0.5568
 epoch: 49, train_loss: 0.5543, test_loss: 2.0283, test_f1: 0.5295
 epoch: 50, train_loss: 0.5860, test_loss: 2.0214, test_f1: 0.6185
 epoch: 51, train_loss: 0.5455, test_loss: 1.4807, test_f1: 0.5972
 epoch: 52, train_loss: 0.5292, test_loss: 1.4460, test_f1: 0.6047
 epoch: 53, train_loss: 0.4987, test_loss: 2.1882, test_f1: 0.5266
 epoch: 54, train_loss: 0.4980, test_loss: 1.5216, test_f1: 0.6106
 epoch: 55, train_loss: 0.4986, test_loss: 1.5275, test_f1: 0.5811
 epoch: 56, train_loss: 0.4855, test_loss: 1.4509, test_f1: 0.5950
 epoch: 57, train_loss: 0.5423, test_loss: 2.0700, test_f1: 0.5594
 epoch: 58, train_loss: 0.5322, test_loss: 1.5487, test_f1: 0.6098
 epoch: 59, train_loss: 0.5130, test_loss: 1.6431, test_f1: 0.5716
 epoch: 60, train_loss: 0.4717, test_loss: 1.8455, test_f1: 0.5676
 epoch: 61, train_loss: 0.4506, test_loss: 1.8981, test_f1: 0.6005
 epoch: 62, train_loss: 0.4438, test_loss: 1.7682, test_f1: 0.6057
 epoch: 63, train_loss: 0.4312, test_loss: 1.6201, test_f1: 0.6290
 epoch: 64, train_loss: 0.4368, test_loss: 1.8793, test_f1: 0.6364
 epoch: 65, train_loss: 0.4344, test_loss: 1.9134, test_f1: 0.5946
 epoch: 66, train_loss: 0.4628, test_loss: 1.7576, test_f1: 0.6342
 epoch: 67, train_loss: 0.4566, test_loss: 1.6453, test_f1: 0.6335
 epoch: 68, train_loss: 0.4549, test_loss: 1.7633, test_f1: 0.6113
 epoch: 69, train_loss: 0.4285, test_loss: 2.1376, test_f1: 0.5719
 epoch: 70, train_loss: 0.4708, test_loss: 1.8135, test_f1: 0.6052
 epoch: 71, train_loss: 0.4667, test_loss: 1.5444, test_f1: 0.6066
 epoch: 72, train_loss: 0.4636, test_loss: 1.6803, test_f1: 0.6261
 epoch: 73, train_loss: 0.4289, test_loss: 2.2316, test_f1: 0.5998
 epoch: 74, train_loss: 0.4451, test_loss: 1.7130, test_f1: 0.6192
 epoch: 75, train_loss: 0.4087, test_loss: 1.9319, test_f1: 0.6059
 epoch: 76, train_loss: 0.4240, test_loss: 1.8904, test_f1: 0.5994
 epoch: 77, train_loss: 0.3872, test_loss: 2.2249, test_f1: 0.5894
 epoch: 78, train_loss: 0.4056, test_loss: 1.9305, test_f1: 0.5939
 epoch: 79, train_loss: 0.4018, test_loss: 1.8729, test_f1: 0.6013
 epoch: 80, train_loss: 0.4094, test_loss: 1.7984, test_f1: 0.5791
 epoch: 81, train_loss: 0.3967, test_loss: 2.0084, test_f1: 0.6208
 epoch: 82, train_loss: 0.4116, test_loss: 2.6261, test_f1: 0.5639
 epoch: 83, train_loss: 0.3984, test_loss: 2.0426, test_f1: 0.5650
 epoch: 84, train_loss: 0.4065, test_loss: 2.1027, test_f1: 0.5881
 epoch: 85, train_loss: 0.3730, test_loss: 2.2915, test_f1: 0.5924
 epoch: 86, train_loss: 0.3839, test_loss: 2.7325, test_f1: 0.5787
 epoch: 87, train_loss: 0.3529, test_loss: 2.4348, test_f1: 0.5922
 epoch: 88, train_loss: 0.3621, test_loss: 2.4437, test_f1: 0.5965
 epoch: 89, train_loss: 0.4009, test_loss: 2.8097, test_f1: 0.5539
 epoch: 90, train_loss: 0.3921, test_loss: 1.9785, test_f1: 0.6235
 epoch: 91, train_loss: 0.4028, test_loss: 2.3437, test_f1: 0.5967
 epoch: 92, train_loss: 0.4135, test_loss: 2.3413, test_f1: 0.5988
 epoch: 93, train_loss: 0.3948, test_loss: 2.0254, test_f1: 0.6075
 epoch: 94, train_loss: 0.4156, test_loss: 1.8685, test_f1: 0.6249
 epoch: 95, train_loss: 0.3762, test_loss: 1.9769, test_f1: 0.6402
 epoch: 96, train_loss: 0.4090, test_loss: 1.9498, test_f1: 0.6075
 epoch: 97, train_loss: 0.3758, test_loss: 2.5286, test_f1: 0.6054
 epoch: 98, train_loss: 0.3545, test_loss: 2.4754, test_f1: 0.6153
 epoch: 99, train_loss: 0.3376, test_loss: 2.2381, test_f1: 0.5892
##################ITERATION #2 ****************************************
 epoch: 0, train_loss: 1.2495, test_loss: 1.4804, test_f1: 0.2281
 epoch: 1, train_loss: 1.0741, test_loss: 1.2413, test_f1: 0.3089
 epoch: 2, train_loss: 1.0213, test_loss: 1.1361, test_f1: 0.3555
 epoch: 3, train_loss: 0.9977, test_loss: 1.1086, test_f1: 0.4511
 epoch: 4, train_loss: 0.9615, test_loss: 1.1006, test_f1: 0.4888
 epoch: 5, train_loss: 0.9765, test_loss: 1.0790, test_f1: 0.5199
 epoch: 6, train_loss: 0.9559, test_loss: 1.1314, test_f1: 0.4591
 epoch: 7, train_loss: 0.9226, test_loss: 1.0927, test_f1: 0.5393
 epoch: 8, train_loss: 0.9131, test_loss: 1.0972, test_f1: 0.4991
 epoch: 9, train_loss: 0.9246, test_loss: 1.0824, test_f1: 0.5151
 epoch: 10, train_loss: 0.9168, test_loss: 1.1548, test_f1: 0.5277
 epoch: 11, train_loss: 0.9037, test_loss: 1.0652, test_f1: 0.5427
 epoch: 12, train_loss: 0.8852, test_loss: 1.0962, test_f1: 0.5009
 epoch: 13, train_loss: 0.9012, test_loss: 1.0727, test_f1: 0.5298
 epoch: 14, train_loss: 0.8975, test_loss: 1.2032, test_f1: 0.4996
 epoch: 15, train_loss: 0.9039, test_loss: 1.0901, test_f1: 0.4337
 epoch: 16, train_loss: 0.8775, test_loss: 1.0885, test_f1: 0.5360
 epoch: 17, train_loss: 0.8589, test_loss: 1.1743, test_f1: 0.4682
 epoch: 18, train_loss: 0.8689, test_loss: 1.1756, test_f1: 0.5203
 epoch: 19, train_loss: 0.8627, test_loss: 1.1918, test_f1: 0.5216
 epoch: 20, train_loss: 0.8230, test_loss: 1.0916, test_f1: 0.5671
 epoch: 21, train_loss: 0.8366, test_loss: 1.1386, test_f1: 0.5422
 epoch: 22, train_loss: 0.8440, test_loss: 1.1051, test_f1: 0.5255
 epoch: 23, train_loss: 0.8411, test_loss: 1.2131, test_f1: 0.5150
 epoch: 24, train_loss: 0.8240, test_loss: 1.1623, test_f1: 0.5129
 epoch: 25, train_loss: 0.8437, test_loss: 1.1351, test_f1: 0.5486
 epoch: 26, train_loss: 0.8222, test_loss: 1.3373, test_f1: 0.5290
 epoch: 27, train_loss: 0.8076, test_loss: 1.2083, test_f1: 0.5598
 epoch: 28, train_loss: 0.7755, test_loss: 1.0729, test_f1: 0.5316
 epoch: 29, train_loss: 0.7643, test_loss: 1.1329, test_f1: 0.5347
 epoch: 30, train_loss: 0.7529, test_loss: 1.2782, test_f1: 0.5112
 epoch: 31, train_loss: 0.7651, test_loss: 1.1316, test_f1: 0.5294
 epoch: 32, train_loss: 0.7179, test_loss: 1.1029, test_f1: 0.5634
 epoch: 33, train_loss: 0.7224, test_loss: 1.1723, test_f1: 0.5688
 epoch: 34, train_loss: 0.7041, test_loss: 1.1894, test_f1: 0.5751
 epoch: 35, train_loss: 0.7082, test_loss: 1.2954, test_f1: 0.4297
 epoch: 36, train_loss: 0.7133, test_loss: 1.1032, test_f1: 0.5785
 epoch: 37, train_loss: 0.6827, test_loss: 1.1814, test_f1: 0.5912
 epoch: 38, train_loss: 0.6952, test_loss: 1.1929, test_f1: 0.5293
 epoch: 39, train_loss: 0.7161, test_loss: 1.1081, test_f1: 0.6126
 epoch: 40, train_loss: 0.7060, test_loss: 1.2771, test_f1: 0.5441
 epoch: 41, train_loss: 0.7478, test_loss: 1.1910, test_f1: 0.4760
 epoch: 42, train_loss: 0.7528, test_loss: 1.6136, test_f1: 0.4992
 epoch: 43, train_loss: 0.6895, test_loss: 1.1355, test_f1: 0.5118
 epoch: 44, train_loss: 0.6859, test_loss: 1.0666, test_f1: 0.5664
 epoch: 45, train_loss: 0.6567, test_loss: 1.2681, test_f1: 0.5198
 epoch: 46, train_loss: 0.6615, test_loss: 1.1774, test_f1: 0.5992
 epoch: 47, train_loss: 0.6527, test_loss: 1.2885, test_f1: 0.5562
 epoch: 48, train_loss: 0.6547, test_loss: 1.2963, test_f1: 0.5812
 epoch: 49, train_loss: 0.6452, test_loss: 1.4988, test_f1: 0.5278
 epoch: 50, train_loss: 0.6609, test_loss: 1.1485, test_f1: 0.5768
 epoch: 51, train_loss: 0.6418, test_loss: 1.1614, test_f1: 0.6012
 epoch: 52, train_loss: 0.6220, test_loss: 1.2709, test_f1: 0.5690
 epoch: 53, train_loss: 0.6076, test_loss: 1.2539, test_f1: 0.5431
 epoch: 54, train_loss: 0.5642, test_loss: 1.5155, test_f1: 0.5189
 epoch: 55, train_loss: 0.5694, test_loss: 1.3574, test_f1: 0.5342
 epoch: 56, train_loss: 0.5653, test_loss: 1.3151, test_f1: 0.5832
 epoch: 57, train_loss: 0.5661, test_loss: 1.2949, test_f1: 0.6047
 epoch: 58, train_loss: 0.5493, test_loss: 1.4474, test_f1: 0.5851
 epoch: 59, train_loss: 0.5524, test_loss: 1.5186, test_f1: 0.5858
 epoch: 60, train_loss: 0.5339, test_loss: 1.4677, test_f1: 0.5872
 epoch: 61, train_loss: 0.5394, test_loss: 1.3625, test_f1: 0.6054
 epoch: 62, train_loss: 0.5219, test_loss: 1.5486, test_f1: 0.6019
 epoch: 63, train_loss: 0.5129, test_loss: 1.4608, test_f1: 0.5826
 epoch: 64, train_loss: 0.5315, test_loss: 1.5909, test_f1: 0.5873
 epoch: 65, train_loss: 0.5004, test_loss: 1.8725, test_f1: 0.5300
 epoch: 66, train_loss: 0.4925, test_loss: 1.6847, test_f1: 0.5907
 epoch: 67, train_loss: 0.5377, test_loss: 1.4930, test_f1: 0.6054
 epoch: 68, train_loss: 0.5217, test_loss: 1.6823, test_f1: 0.5869
 epoch: 69, train_loss: 0.5129, test_loss: 1.4790, test_f1: 0.5100
 epoch: 70, train_loss: 0.4695, test_loss: 1.5861, test_f1: 0.5962
 epoch: 71, train_loss: 0.4744, test_loss: 1.5279, test_f1: 0.6119
 epoch: 72, train_loss: 0.4644, test_loss: 1.7680, test_f1: 0.5823
 epoch: 73, train_loss: 0.4862, test_loss: 1.5224, test_f1: 0.5830
 epoch: 74, train_loss: 0.4709, test_loss: 1.5524, test_f1: 0.5989
 epoch: 75, train_loss: 0.4951, test_loss: 1.8335, test_f1: 0.5775
 epoch: 76, train_loss: 0.5090, test_loss: 2.6006, test_f1: 0.5125
 epoch: 77, train_loss: 0.5584, test_loss: 1.5313, test_f1: 0.5782
 epoch: 78, train_loss: 0.5107, test_loss: 1.4932, test_f1: 0.6241
 epoch: 79, train_loss: 0.5006, test_loss: 1.7927, test_f1: 0.5143
 epoch: 80, train_loss: 0.4819, test_loss: 1.7550, test_f1: 0.6061
 epoch: 81, train_loss: 0.4776, test_loss: 1.5546, test_f1: 0.5104
 epoch: 82, train_loss: 0.4729, test_loss: 1.7524, test_f1: 0.5576
 epoch: 83, train_loss: 0.4783, test_loss: 2.1206, test_f1: 0.5156
 epoch: 84, train_loss: 0.4501, test_loss: 1.6691, test_f1: 0.6012
 epoch: 85, train_loss: 0.4293, test_loss: 1.9688, test_f1: 0.5994
 epoch: 86, train_loss: 0.4561, test_loss: 2.0792, test_f1: 0.5472
 epoch: 87, train_loss: 0.4317, test_loss: 1.7224, test_f1: 0.5731
 epoch: 88, train_loss: 0.4503, test_loss: 1.6990, test_f1: 0.5721
 epoch: 89, train_loss: 0.4300, test_loss: 1.7550, test_f1: 0.6022
 epoch: 90, train_loss: 0.4275, test_loss: 1.9465, test_f1: 0.5801
 epoch: 91, train_loss: 0.4365, test_loss: 1.9519, test_f1: 0.6180
 epoch: 92, train_loss: 0.4063, test_loss: 1.7812, test_f1: 0.5876
 epoch: 93, train_loss: 0.4268, test_loss: 2.1444, test_f1: 0.5743
 epoch: 94, train_loss: 0.4338, test_loss: 1.8875, test_f1: 0.5804
 epoch: 95, train_loss: 0.3951, test_loss: 1.8494, test_f1: 0.6102
 epoch: 96, train_loss: 0.4125, test_loss: 2.0607, test_f1: 0.6018
 epoch: 97, train_loss: 0.4346, test_loss: 1.9804, test_f1: 0.5948
 epoch: 98, train_loss: 0.3944, test_loss: 2.0326, test_f1: 0.5842
 epoch: 99, train_loss: 0.4003, test_loss: 2.1339, test_f1: 0.5578
##################ITERATION #3 ****************************************
 epoch: 0, train_loss: 1.2974, test_loss: 1.2737, test_f1: 0.2583
 epoch: 1, train_loss: 1.1354, test_loss: 1.1969, test_f1: 0.3738
 epoch: 2, train_loss: 1.0527, test_loss: 1.1073, test_f1: 0.3836
 epoch: 3, train_loss: 1.0038, test_loss: 1.1014, test_f1: 0.4513
 epoch: 4, train_loss: 0.9837, test_loss: 1.0758, test_f1: 0.4474
 epoch: 5, train_loss: 0.9527, test_loss: 1.0811, test_f1: 0.5218
 epoch: 6, train_loss: 0.9458, test_loss: 1.0524, test_f1: 0.5737
 epoch: 7, train_loss: 0.9150, test_loss: 1.1011, test_f1: 0.5465
 epoch: 8, train_loss: 0.9188, test_loss: 1.1581, test_f1: 0.4603
 epoch: 9, train_loss: 0.9296, test_loss: 1.0802, test_f1: 0.5496
 epoch: 10, train_loss: 0.9028, test_loss: 1.1380, test_f1: 0.4860
 epoch: 11, train_loss: 0.9320, test_loss: 1.1604, test_f1: 0.4754
 epoch: 12, train_loss: 0.9007, test_loss: 1.2211, test_f1: 0.4963
 epoch: 13, train_loss: 0.9027, test_loss: 1.0632, test_f1: 0.5530
 epoch: 14, train_loss: 0.8707, test_loss: 1.0937, test_f1: 0.5421
 epoch: 15, train_loss: 0.8534, test_loss: 1.1045, test_f1: 0.5667
 epoch: 16, train_loss: 0.8693, test_loss: 1.1309, test_f1: 0.5372
 epoch: 17, train_loss: 0.8746, test_loss: 1.0773, test_f1: 0.5627
 epoch: 18, train_loss: 0.8527, test_loss: 1.2103, test_f1: 0.5266
 epoch: 19, train_loss: 0.8424, test_loss: 1.1620, test_f1: 0.5496
 epoch: 20, train_loss: 0.8412, test_loss: 1.0820, test_f1: 0.5618
 epoch: 21, train_loss: 0.8115, test_loss: 1.1487, test_f1: 0.5529
 epoch: 22, train_loss: 0.8288, test_loss: 1.1509, test_f1: 0.5423
 epoch: 23, train_loss: 0.8179, test_loss: 1.1840, test_f1: 0.5420
 epoch: 24, train_loss: 0.8006, test_loss: 1.1616, test_f1: 0.5721
 epoch: 25, train_loss: 0.7771, test_loss: 1.2088, test_f1: 0.5447
 epoch: 26, train_loss: 0.7887, test_loss: 1.1926, test_f1: 0.4849
 epoch: 27, train_loss: 0.7562, test_loss: 1.3218, test_f1: 0.5533
 epoch: 28, train_loss: 0.7540, test_loss: 1.4041, test_f1: 0.5554
 epoch: 29, train_loss: 0.7780, test_loss: 1.3829, test_f1: 0.5208
 epoch: 30, train_loss: 0.7545, test_loss: 1.4402, test_f1: 0.4462
 epoch: 31, train_loss: 0.7463, test_loss: 1.3334, test_f1: 0.5692
 epoch: 32, train_loss: 0.7445, test_loss: 1.1156, test_f1: 0.6217
 epoch: 33, train_loss: 0.7257, test_loss: 1.1503, test_f1: 0.5425
 epoch: 34, train_loss: 0.7238, test_loss: 1.5387, test_f1: 0.4866
 epoch: 35, train_loss: 0.7099, test_loss: 1.4551, test_f1: 0.5076
 epoch: 36, train_loss: 0.7181, test_loss: 1.3243, test_f1: 0.5648
 epoch: 37, train_loss: 0.7808, test_loss: 1.2789, test_f1: 0.4507
 epoch: 38, train_loss: 0.7579, test_loss: 1.4488, test_f1: 0.4808
 epoch: 39, train_loss: 0.7182, test_loss: 1.3823, test_f1: 0.4875
 epoch: 40, train_loss: 0.6869, test_loss: 1.2382, test_f1: 0.5699
 epoch: 41, train_loss: 0.6879, test_loss: 1.2798, test_f1: 0.5410
 epoch: 42, train_loss: 0.6549, test_loss: 1.6878, test_f1: 0.4896
 epoch: 43, train_loss: 0.6771, test_loss: 1.3626, test_f1: 0.5729
 epoch: 44, train_loss: 0.6511, test_loss: 1.6410, test_f1: 0.4917
 epoch: 45, train_loss: 0.6472, test_loss: 1.3641, test_f1: 0.5708
 epoch: 46, train_loss: 0.6451, test_loss: 1.6286, test_f1: 0.5555
 epoch: 47, train_loss: 0.6729, test_loss: 1.5044, test_f1: 0.5602
 epoch: 48, train_loss: 0.7076, test_loss: 1.3094, test_f1: 0.5094
 epoch: 49, train_loss: 0.7083, test_loss: 1.5611, test_f1: 0.4828
 epoch: 50, train_loss: 0.6899, test_loss: 1.5239, test_f1: 0.5467
 epoch: 51, train_loss: 0.6464, test_loss: 1.4403, test_f1: 0.5715
 epoch: 52, train_loss: 0.6180, test_loss: 1.4081, test_f1: 0.5522
 epoch: 53, train_loss: 0.5844, test_loss: 1.4260, test_f1: 0.5893
 epoch: 54, train_loss: 0.5797, test_loss: 1.5406, test_f1: 0.5874
 epoch: 55, train_loss: 0.5526, test_loss: 1.5938, test_f1: 0.5487
 epoch: 56, train_loss: 0.5488, test_loss: 1.7756, test_f1: 0.5819
 epoch: 57, train_loss: 0.5617, test_loss: 1.4709, test_f1: 0.5776
 epoch: 58, train_loss: 0.5559, test_loss: 1.6601, test_f1: 0.5622
 epoch: 59, train_loss: 0.5798, test_loss: 1.6743, test_f1: 0.5779
 epoch: 60, train_loss: 0.5502, test_loss: 1.7108, test_f1: 0.5891
 epoch: 61, train_loss: 0.5610, test_loss: 1.5550, test_f1: 0.5377
 epoch: 62, train_loss: 0.5311, test_loss: 1.6226, test_f1: 0.5305
 epoch: 63, train_loss: 0.5473, test_loss: 1.7244, test_f1: 0.5680
 epoch: 64, train_loss: 0.5364, test_loss: 1.7006, test_f1: 0.5518
 epoch: 65, train_loss: 0.5456, test_loss: 1.9818, test_f1: 0.5124
 epoch: 66, train_loss: 0.5553, test_loss: 1.7031, test_f1: 0.5792
 epoch: 67, train_loss: 0.5092, test_loss: 1.7732, test_f1: 0.5792
 epoch: 68, train_loss: 0.4940, test_loss: 1.8251, test_f1: 0.5840
 epoch: 69, train_loss: 0.5139, test_loss: 1.9580, test_f1: 0.5923
 epoch: 70, train_loss: 0.5113, test_loss: 1.7932, test_f1: 0.5722
 epoch: 71, train_loss: 0.4865, test_loss: 1.8942, test_f1: 0.5836
 epoch: 72, train_loss: 0.5040, test_loss: 1.8232, test_f1: 0.5397
 epoch: 73, train_loss: 0.5001, test_loss: 1.7610, test_f1: 0.5921
 epoch: 74, train_loss: 0.4801, test_loss: 1.8740, test_f1: 0.5128
 epoch: 75, train_loss: 0.4672, test_loss: 2.3031, test_f1: 0.5031
 epoch: 76, train_loss: 0.4821, test_loss: 2.0664, test_f1: 0.5445
 epoch: 77, train_loss: 0.5003, test_loss: 1.7394, test_f1: 0.5437
 epoch: 78, train_loss: 0.4746, test_loss: 1.9304, test_f1: 0.5417
 epoch: 79, train_loss: 0.4648, test_loss: 2.1551, test_f1: 0.5146
 epoch: 80, train_loss: 0.4517, test_loss: 2.0010, test_f1: 0.5591
 epoch: 81, train_loss: 0.4392, test_loss: 2.0132, test_f1: 0.5715
 epoch: 82, train_loss: 0.4626, test_loss: 2.0269, test_f1: 0.5987
 epoch: 83, train_loss: 0.4578, test_loss: 1.8857, test_f1: 0.5141
 epoch: 84, train_loss: 0.4338, test_loss: 1.9871, test_f1: 0.5480
 epoch: 85, train_loss: 0.4624, test_loss: 1.9002, test_f1: 0.5563
 epoch: 86, train_loss: 0.4593, test_loss: 2.0778, test_f1: 0.4923
 epoch: 87, train_loss: 0.4571, test_loss: 1.9925, test_f1: 0.5966
 epoch: 88, train_loss: 0.4637, test_loss: 1.9618, test_f1: 0.5274
 epoch: 89, train_loss: 0.4480, test_loss: 2.0758, test_f1: 0.5737
 epoch: 90, train_loss: 0.4896, test_loss: 2.2620, test_f1: 0.5879
 epoch: 91, train_loss: 0.4545, test_loss: 1.9845, test_f1: 0.5709
 epoch: 92, train_loss: 0.4316, test_loss: 1.8812, test_f1: 0.5149
 epoch: 93, train_loss: 0.4314, test_loss: 2.3526, test_f1: 0.5784
 epoch: 94, train_loss: 0.4717, test_loss: 1.8451, test_f1: 0.5621
 epoch: 95, train_loss: 0.4222, test_loss: 1.8804, test_f1: 0.5148
 epoch: 96, train_loss: 0.4669, test_loss: 2.0059, test_f1: 0.5843
 epoch: 97, train_loss: 0.4131, test_loss: 1.9822, test_f1: 0.5906
 epoch: 98, train_loss: 0.4122, test_loss: 2.0224, test_f1: 0.5607
 epoch: 99, train_loss: 0.4027, test_loss: 1.9730, test_f1: 0.5676
##################ITERATION #4 ****************************************
 epoch: 0, train_loss: 1.3463, test_loss: 1.5604, test_f1: 0.2281
 epoch: 1, train_loss: 1.1516, test_loss: 1.3675, test_f1: 0.2606
 epoch: 2, train_loss: 1.0874, test_loss: 1.2217, test_f1: 0.3041
 epoch: 3, train_loss: 1.0365, test_loss: 1.1134, test_f1: 0.3770
 epoch: 4, train_loss: 1.0100, test_loss: 1.1016, test_f1: 0.4084
 epoch: 5, train_loss: 0.9974, test_loss: 1.0973, test_f1: 0.4749
 epoch: 6, train_loss: 0.9923, test_loss: 1.1008, test_f1: 0.4997
 epoch: 7, train_loss: 0.9716, test_loss: 1.1396, test_f1: 0.5088
 epoch: 8, train_loss: 0.9506, test_loss: 1.1530, test_f1: 0.4522
 epoch: 9, train_loss: 0.9228, test_loss: 1.1130, test_f1: 0.4722
 epoch: 10, train_loss: 0.9065, test_loss: 1.1822, test_f1: 0.5211
 epoch: 11, train_loss: 0.8978, test_loss: 1.1412, test_f1: 0.5492
 epoch: 12, train_loss: 0.8961, test_loss: 1.0779, test_f1: 0.5640
 epoch: 13, train_loss: 0.9069, test_loss: 1.0965, test_f1: 0.4671
 epoch: 14, train_loss: 0.9279, test_loss: 1.0424, test_f1: 0.5398
 epoch: 15, train_loss: 0.9094, test_loss: 1.1273, test_f1: 0.5037
 epoch: 16, train_loss: 0.8936, test_loss: 1.0561, test_f1: 0.5377
 epoch: 17, train_loss: 0.8916, test_loss: 1.0706, test_f1: 0.5530
 epoch: 18, train_loss: 0.8577, test_loss: 1.0093, test_f1: 0.5735
 epoch: 19, train_loss: 0.8482, test_loss: 1.0661, test_f1: 0.5943
 epoch: 20, train_loss: 0.8581, test_loss: 1.1838, test_f1: 0.5259
 epoch: 21, train_loss: 0.8386, test_loss: 1.0468, test_f1: 0.5918
 epoch: 22, train_loss: 0.8199, test_loss: 1.0167, test_f1: 0.6082
 epoch: 23, train_loss: 0.8418, test_loss: 1.0968, test_f1: 0.5792
 epoch: 24, train_loss: 0.8541, test_loss: 1.2374, test_f1: 0.5741
 epoch: 25, train_loss: 0.8835, test_loss: 1.1166, test_f1: 0.5562
 epoch: 26, train_loss: 0.8543, test_loss: 1.1085, test_f1: 0.5661
 epoch: 27, train_loss: 0.8327, test_loss: 1.0340, test_f1: 0.5264
 epoch: 28, train_loss: 0.8073, test_loss: 1.2367, test_f1: 0.5442
 epoch: 29, train_loss: 0.7882, test_loss: 1.2077, test_f1: 0.5399
 epoch: 30, train_loss: 0.7937, test_loss: 1.0446, test_f1: 0.5809
 epoch: 31, train_loss: 0.7873, test_loss: 1.3066, test_f1: 0.5116
 epoch: 32, train_loss: 0.8026, test_loss: 1.0698, test_f1: 0.5777
 epoch: 33, train_loss: 0.7705, test_loss: 1.0670, test_f1: 0.5886
 epoch: 34, train_loss: 0.7523, test_loss: 1.3067, test_f1: 0.5551
 epoch: 35, train_loss: 0.7614, test_loss: 0.9826, test_f1: 0.6046
 epoch: 36, train_loss: 0.7591, test_loss: 1.0845, test_f1: 0.5000
 epoch: 37, train_loss: 0.7684, test_loss: 1.0306, test_f1: 0.5964
 epoch: 38, train_loss: 0.7364, test_loss: 1.1395, test_f1: 0.5537
 epoch: 39, train_loss: 0.7422, test_loss: 1.1599, test_f1: 0.5902
 epoch: 40, train_loss: 0.8064, test_loss: 1.1803, test_f1: 0.5713
 epoch: 41, train_loss: 0.7648, test_loss: 1.1109, test_f1: 0.5800
 epoch: 42, train_loss: 0.7436, test_loss: 1.1755, test_f1: 0.5477
 epoch: 43, train_loss: 0.7233, test_loss: 1.0275, test_f1: 0.6081
 epoch: 44, train_loss: 0.7048, test_loss: 1.0092, test_f1: 0.6539
 epoch: 45, train_loss: 0.7080, test_loss: 1.0126, test_f1: 0.6015
 epoch: 46, train_loss: 0.7376, test_loss: 1.1013, test_f1: 0.5782
 epoch: 47, train_loss: 0.6930, test_loss: 1.1547, test_f1: 0.5822
 epoch: 48, train_loss: 0.6962, test_loss: 1.2429, test_f1: 0.5137
 epoch: 49, train_loss: 0.6818, test_loss: 1.1421, test_f1: 0.5946
 epoch: 50, train_loss: 0.6918, test_loss: 1.1413, test_f1: 0.5819
 epoch: 51, train_loss: 0.6718, test_loss: 1.0704, test_f1: 0.6068
 epoch: 52, train_loss: 0.6456, test_loss: 1.0468, test_f1: 0.6026
 epoch: 53, train_loss: 0.6216, test_loss: 1.0881, test_f1: 0.6044
 epoch: 54, train_loss: 0.6231, test_loss: 1.1062, test_f1: 0.5895
 epoch: 55, train_loss: 0.6314, test_loss: 1.1076, test_f1: 0.5843
 epoch: 56, train_loss: 0.5873, test_loss: 1.1584, test_f1: 0.5877
 epoch: 57, train_loss: 0.5861, test_loss: 1.1438, test_f1: 0.5982
 epoch: 58, train_loss: 0.5939, test_loss: 1.1226, test_f1: 0.5898
 epoch: 59, train_loss: 0.5805, test_loss: 1.2739, test_f1: 0.5989
 epoch: 60, train_loss: 0.5812, test_loss: 1.1721, test_f1: 0.6211
 epoch: 61, train_loss: 0.5581, test_loss: 1.3250, test_f1: 0.5794
 epoch: 62, train_loss: 0.5588, test_loss: 1.2165, test_f1: 0.6024
 epoch: 63, train_loss: 0.5607, test_loss: 1.2426, test_f1: 0.6052
 epoch: 64, train_loss: 0.5368, test_loss: 1.2156, test_f1: 0.6178
 epoch: 65, train_loss: 0.5515, test_loss: 1.2220, test_f1: 0.6070
 epoch: 66, train_loss: 0.5360, test_loss: 1.2960, test_f1: 0.6137
 epoch: 67, train_loss: 0.5352, test_loss: 1.2469, test_f1: 0.6254
 epoch: 68, train_loss: 0.5378, test_loss: 1.3807, test_f1: 0.5941
 epoch: 69, train_loss: 0.5426, test_loss: 1.3688, test_f1: 0.5762
 epoch: 70, train_loss: 0.5329, test_loss: 1.2544, test_f1: 0.6362
 epoch: 71, train_loss: 0.5102, test_loss: 1.3751, test_f1: 0.6473
 epoch: 72, train_loss: 0.5159, test_loss: 1.3363, test_f1: 0.5920
 epoch: 73, train_loss: 0.5152, test_loss: 1.3589, test_f1: 0.6307
 epoch: 74, train_loss: 0.4832, test_loss: 1.4208, test_f1: 0.6130
 epoch: 75, train_loss: 0.4740, test_loss: 1.3707, test_f1: 0.6053
 epoch: 76, train_loss: 0.4656, test_loss: 1.3828, test_f1: 0.6288
 epoch: 77, train_loss: 0.4892, test_loss: 1.4044, test_f1: 0.6011
 epoch: 78, train_loss: 0.4891, test_loss: 1.5580, test_f1: 0.5938
 epoch: 79, train_loss: 0.5133, test_loss: 1.4146, test_f1: 0.6195
 epoch: 80, train_loss: 0.4860, test_loss: 1.3693, test_f1: 0.6162
 epoch: 81, train_loss: 0.5223, test_loss: 1.4182, test_f1: 0.6194
 epoch: 82, train_loss: 0.5232, test_loss: 1.5587, test_f1: 0.6178
 epoch: 83, train_loss: 0.5108, test_loss: 1.2418, test_f1: 0.5802
 epoch: 84, train_loss: 0.5244, test_loss: 1.5209, test_f1: 0.6000
 epoch: 85, train_loss: 0.4950, test_loss: 1.3726, test_f1: 0.5970
 epoch: 86, train_loss: 0.4837, test_loss: 1.5883, test_f1: 0.5724
 epoch: 87, train_loss: 0.4672, test_loss: 1.4297, test_f1: 0.6079
 epoch: 88, train_loss: 0.4624, test_loss: 1.2958, test_f1: 0.6216
 epoch: 89, train_loss: 0.4738, test_loss: 1.3183, test_f1: 0.6575
 epoch: 90, train_loss: 0.5439, test_loss: 1.4172, test_f1: 0.5836
 epoch: 91, train_loss: 0.4790, test_loss: 1.4311, test_f1: 0.5955
 epoch: 92, train_loss: 0.4814, test_loss: 1.5308, test_f1: 0.6053
 epoch: 93, train_loss: 0.4607, test_loss: 1.5586, test_f1: 0.5948
 epoch: 94, train_loss: 0.4796, test_loss: 1.4600, test_f1: 0.5927
 epoch: 95, train_loss: 0.4488, test_loss: 1.3905, test_f1: 0.6230
 epoch: 96, train_loss: 0.4610, test_loss: 1.7839, test_f1: 0.5775
 epoch: 97, train_loss: 0.4497, test_loss: 1.5399, test_f1: 0.6334
 epoch: 98, train_loss: 0.4238, test_loss: 1.4560, test_f1: 0.6376
 epoch: 99, train_loss: 0.4221, test_loss: 1.4206, test_f1: 0.5833
##################ITERATION #5 ****************************************
 epoch: 0, train_loss: 1.2727, test_loss: 1.4220, test_f1: 0.2642
 epoch: 1, train_loss: 1.0613, test_loss: 1.1838, test_f1: 0.3322
 epoch: 2, train_loss: 1.0378, test_loss: 1.1485, test_f1: 0.3726
 epoch: 3, train_loss: 0.9845, test_loss: 1.1563, test_f1: 0.4275
 epoch: 4, train_loss: 0.9627, test_loss: 1.1243, test_f1: 0.4439
 epoch: 5, train_loss: 0.9581, test_loss: 1.1120, test_f1: 0.4710
 epoch: 6, train_loss: 0.9519, test_loss: 1.0323, test_f1: 0.4256
 epoch: 7, train_loss: 0.9202, test_loss: 1.1261, test_f1: 0.5177
 epoch: 8, train_loss: 0.9159, test_loss: 1.2319, test_f1: 0.5227
 epoch: 9, train_loss: 0.9300, test_loss: 1.1572, test_f1: 0.5255
 epoch: 10, train_loss: 0.9118, test_loss: 1.2075, test_f1: 0.5102
 epoch: 11, train_loss: 0.9095, test_loss: 1.1484, test_f1: 0.4794
 epoch: 12, train_loss: 0.8891, test_loss: 1.0461, test_f1: 0.5346
 epoch: 13, train_loss: 0.8774, test_loss: 1.0670, test_f1: 0.5357
 epoch: 14, train_loss: 0.8517, test_loss: 1.1713, test_f1: 0.5086
 epoch: 15, train_loss: 0.8696, test_loss: 1.1477, test_f1: 0.5179
 epoch: 16, train_loss: 0.8518, test_loss: 1.1551, test_f1: 0.5417
 epoch: 17, train_loss: 0.8356, test_loss: 1.1007, test_f1: 0.5343
 epoch: 18, train_loss: 0.8254, test_loss: 1.0261, test_f1: 0.5817
 epoch: 19, train_loss: 0.8378, test_loss: 1.2781, test_f1: 0.5004
 epoch: 20, train_loss: 0.8405, test_loss: 1.1949, test_f1: 0.5087
 epoch: 21, train_loss: 0.8323, test_loss: 1.0909, test_f1: 0.5484
 epoch: 22, train_loss: 0.8177, test_loss: 1.0666, test_f1: 0.5632
 epoch: 23, train_loss: 0.8368, test_loss: 1.2219, test_f1: 0.5187
 epoch: 24, train_loss: 0.8205, test_loss: 1.1020, test_f1: 0.5476
 epoch: 25, train_loss: 0.7945, test_loss: 1.0270, test_f1: 0.5687
 epoch: 26, train_loss: 0.7859, test_loss: 1.0716, test_f1: 0.5168
 epoch: 27, train_loss: 0.7648, test_loss: 1.2280, test_f1: 0.5288
 epoch: 28, train_loss: 0.7706, test_loss: 1.1922, test_f1: 0.5450
 epoch: 29, train_loss: 0.7718, test_loss: 1.1525, test_f1: 0.5604
 epoch: 30, train_loss: 0.7411, test_loss: 1.1062, test_f1: 0.5525
 epoch: 31, train_loss: 0.7469, test_loss: 1.2527, test_f1: 0.5275
 epoch: 32, train_loss: 0.7300, test_loss: 1.2114, test_f1: 0.5254
 epoch: 33, train_loss: 0.7300, test_loss: 1.2864, test_f1: 0.5546
 epoch: 34, train_loss: 0.7170, test_loss: 1.1490, test_f1: 0.5811
 epoch: 35, train_loss: 0.7275, test_loss: 1.1742, test_f1: 0.5713
 epoch: 36, train_loss: 0.7278, test_loss: 1.1554, test_f1: 0.5707
 epoch: 37, train_loss: 0.7724, test_loss: 1.4700, test_f1: 0.4688
 epoch: 38, train_loss: 0.7222, test_loss: 1.2988, test_f1: 0.5029
 epoch: 39, train_loss: 0.7104, test_loss: 1.3962, test_f1: 0.5229
 epoch: 40, train_loss: 0.7178, test_loss: 1.1305, test_f1: 0.5433
 epoch: 41, train_loss: 0.7105, test_loss: 1.1000, test_f1: 0.5946
 epoch: 42, train_loss: 0.6860, test_loss: 1.1859, test_f1: 0.5370
 epoch: 43, train_loss: 0.6772, test_loss: 1.2175, test_f1: 0.5850
 epoch: 44, train_loss: 0.6625, test_loss: 1.2269, test_f1: 0.5492
 epoch: 45, train_loss: 0.6389, test_loss: 1.3143, test_f1: 0.5544
 epoch: 46, train_loss: 0.6586, test_loss: 1.3907, test_f1: 0.5682
 epoch: 47, train_loss: 0.6447, test_loss: 1.4206, test_f1: 0.5611
 epoch: 48, train_loss: 0.6359, test_loss: 1.3214, test_f1: 0.5706
 epoch: 49, train_loss: 0.6375, test_loss: 1.5696, test_f1: 0.4906
 epoch: 50, train_loss: 0.6484, test_loss: 1.3567, test_f1: 0.5292
 epoch: 51, train_loss: 0.6518, test_loss: 1.1936, test_f1: 0.6023
 epoch: 52, train_loss: 0.6000, test_loss: 1.1939, test_f1: 0.5921
 epoch: 53, train_loss: 0.5987, test_loss: 1.2307, test_f1: 0.5737
 epoch: 54, train_loss: 0.5801, test_loss: 1.1950, test_f1: 0.6224
 epoch: 55, train_loss: 0.5588, test_loss: 1.2418, test_f1: 0.6167
 epoch: 56, train_loss: 0.5543, test_loss: 1.3707, test_f1: 0.5861
 epoch: 57, train_loss: 0.5508, test_loss: 1.2647, test_f1: 0.6072
 epoch: 58, train_loss: 0.5543, test_loss: 1.3271, test_f1: 0.5971
 epoch: 59, train_loss: 0.5640, test_loss: 1.2668, test_f1: 0.6322
 epoch: 60, train_loss: 0.5642, test_loss: 1.3462, test_f1: 0.6006
 epoch: 61, train_loss: 0.5472, test_loss: 1.4070, test_f1: 0.5751
 epoch: 62, train_loss: 0.5389, test_loss: 1.2237, test_f1: 0.6126
 epoch: 63, train_loss: 0.5225, test_loss: 1.2356, test_f1: 0.5938
 epoch: 64, train_loss: 0.4978, test_loss: 1.4338, test_f1: 0.5974
 epoch: 65, train_loss: 0.5405, test_loss: 1.4391, test_f1: 0.5746
 epoch: 66, train_loss: 0.5112, test_loss: 1.3228, test_f1: 0.5725
 epoch: 67, train_loss: 0.5055, test_loss: 1.4048, test_f1: 0.5798
 epoch: 68, train_loss: 0.4885, test_loss: 1.3206, test_f1: 0.6348
 epoch: 69, train_loss: 0.5016, test_loss: 1.4629, test_f1: 0.5587
 epoch: 70, train_loss: 0.4862, test_loss: 1.5110, test_f1: 0.5673
 epoch: 71, train_loss: 0.4808, test_loss: 1.4099, test_f1: 0.6197
 epoch: 72, train_loss: 0.4891, test_loss: 1.5207, test_f1: 0.5645
 epoch: 73, train_loss: 0.4636, test_loss: 1.4411, test_f1: 0.6002
 epoch: 74, train_loss: 0.4763, test_loss: 1.7186, test_f1: 0.5463
 epoch: 75, train_loss: 0.4776, test_loss: 1.6986, test_f1: 0.5526
 epoch: 76, train_loss: 0.4642, test_loss: 1.4469, test_f1: 0.5932
 epoch: 77, train_loss: 0.5132, test_loss: 1.2472, test_f1: 0.6348
 epoch: 78, train_loss: 0.4993, test_loss: 1.6036, test_f1: 0.5602
 epoch: 79, train_loss: 0.4717, test_loss: 1.4053, test_f1: 0.5972
 epoch: 80, train_loss: 0.4875, test_loss: 1.4207, test_f1: 0.5765
 epoch: 81, train_loss: 0.4617, test_loss: 1.5204, test_f1: 0.5926
 epoch: 82, train_loss: 0.4376, test_loss: 1.6768, test_f1: 0.5496
 epoch: 83, train_loss: 0.4509, test_loss: 1.5405, test_f1: 0.5922
 epoch: 84, train_loss: 0.4260, test_loss: 1.8029, test_f1: 0.5377
 epoch: 85, train_loss: 0.4670, test_loss: 1.6902, test_f1: 0.5381
 epoch: 86, train_loss: 0.4650, test_loss: 1.7095, test_f1: 0.5237
 epoch: 87, train_loss: 0.4799, test_loss: 1.6331, test_f1: 0.5564
 epoch: 88, train_loss: 0.4824, test_loss: 1.3059, test_f1: 0.6140
 epoch: 89, train_loss: 0.4410, test_loss: 1.4158, test_f1: 0.5889
 epoch: 90, train_loss: 0.4664, test_loss: 1.7494, test_f1: 0.5553
 epoch: 91, train_loss: 0.4400, test_loss: 1.5123, test_f1: 0.5716
 epoch: 92, train_loss: 0.4401, test_loss: 1.9031, test_f1: 0.5414
 epoch: 93, train_loss: 0.4418, test_loss: 1.5433, test_f1: 0.5911
 epoch: 94, train_loss: 0.4423, test_loss: 1.7084, test_f1: 0.5556
 epoch: 95, train_loss: 0.4157, test_loss: 1.7098, test_f1: 0.5613
 epoch: 96, train_loss: 0.4142, test_loss: 1.7748, test_f1: 0.5795
 epoch: 97, train_loss: 0.4469, test_loss: 1.4441, test_f1: 0.6154
 epoch: 98, train_loss: 0.4187, test_loss: 1.5092, test_f1: 0.6118
 epoch: 99, train_loss: 0.4091, test_loss: 1.7236, test_f1: 0.5899
##################ITERATION #6 ****************************************
 epoch: 0, train_loss: 1.3487, test_loss: 1.3041, test_f1: 0.1730
 epoch: 1, train_loss: 1.0993, test_loss: 1.2443, test_f1: 0.3859
 epoch: 2, train_loss: 1.0279, test_loss: 1.1596, test_f1: 0.4709
 epoch: 3, train_loss: 1.0083, test_loss: 1.1931, test_f1: 0.4499
 epoch: 4, train_loss: 0.9659, test_loss: 1.1649, test_f1: 0.5003
 epoch: 5, train_loss: 0.9486, test_loss: 1.1559, test_f1: 0.4278
 epoch: 6, train_loss: 0.9351, test_loss: 1.1355, test_f1: 0.5227
 epoch: 7, train_loss: 0.9509, test_loss: 1.1753, test_f1: 0.4787
 epoch: 8, train_loss: 0.9351, test_loss: 1.1660, test_f1: 0.5110
 epoch: 9, train_loss: 0.9177, test_loss: 1.0669, test_f1: 0.5222
 epoch: 10, train_loss: 0.9294, test_loss: 1.0283, test_f1: 0.5379
 epoch: 11, train_loss: 0.9137, test_loss: 1.0713, test_f1: 0.5449
 epoch: 12, train_loss: 0.9043, test_loss: 1.1526, test_f1: 0.5168
 epoch: 13, train_loss: 0.8890, test_loss: 1.0808, test_f1: 0.5517
 epoch: 14, train_loss: 0.8995, test_loss: 1.2801, test_f1: 0.4876
 epoch: 15, train_loss: 0.8701, test_loss: 1.1040, test_f1: 0.5432
 epoch: 16, train_loss: 0.8598, test_loss: 1.1504, test_f1: 0.5103
 epoch: 17, train_loss: 0.8601, test_loss: 1.0431, test_f1: 0.5376
 epoch: 18, train_loss: 0.8358, test_loss: 1.0809, test_f1: 0.5547
 epoch: 19, train_loss: 0.7953, test_loss: 1.0870, test_f1: 0.5720
 epoch: 20, train_loss: 0.8110, test_loss: 1.0820, test_f1: 0.5908
 epoch: 21, train_loss: 0.7886, test_loss: 1.1057, test_f1: 0.5636
 epoch: 22, train_loss: 0.7831, test_loss: 1.0101, test_f1: 0.5917
 epoch: 23, train_loss: 0.7326, test_loss: 1.2497, test_f1: 0.4938
 epoch: 24, train_loss: 0.7627, test_loss: 1.1594, test_f1: 0.5774
 epoch: 25, train_loss: 0.7897, test_loss: 1.3209, test_f1: 0.4841
 epoch: 26, train_loss: 0.7792, test_loss: 1.1810, test_f1: 0.5402
 epoch: 27, train_loss: 0.7669, test_loss: 0.9882, test_f1: 0.5968
 epoch: 28, train_loss: 0.7705, test_loss: 1.0869, test_f1: 0.4735
 epoch: 29, train_loss: 0.7429, test_loss: 1.0458, test_f1: 0.5813
 epoch: 30, train_loss: 0.7386, test_loss: 1.0570, test_f1: 0.5791
 epoch: 31, train_loss: 0.7159, test_loss: 1.0342, test_f1: 0.5941
 epoch: 32, train_loss: 0.7135, test_loss: 1.1868, test_f1: 0.5417
 epoch: 33, train_loss: 0.7534, test_loss: 0.9870, test_f1: 0.5714
 epoch: 34, train_loss: 0.7632, test_loss: 1.0226, test_f1: 0.5801
 epoch: 35, train_loss: 0.7217, test_loss: 0.9635, test_f1: 0.5839
 epoch: 36, train_loss: 0.6892, test_loss: 1.0004, test_f1: 0.5530
 epoch: 37, train_loss: 0.7099, test_loss: 1.2841, test_f1: 0.4920
 epoch: 38, train_loss: 0.7246, test_loss: 1.0481, test_f1: 0.5516
 epoch: 39, train_loss: 0.6936, test_loss: 1.0230, test_f1: 0.6233
 epoch: 40, train_loss: 0.6899, test_loss: 1.0529, test_f1: 0.6165
 epoch: 41, train_loss: 0.6846, test_loss: 1.0798, test_f1: 0.5920
 epoch: 42, train_loss: 0.6881, test_loss: 1.1175, test_f1: 0.5761
 epoch: 43, train_loss: 0.6924, test_loss: 1.1039, test_f1: 0.5740
 epoch: 44, train_loss: 0.6741, test_loss: 1.1399, test_f1: 0.5601
 epoch: 45, train_loss: 0.6543, test_loss: 1.1513, test_f1: 0.5512
 epoch: 46, train_loss: 0.6825, test_loss: 1.1736, test_f1: 0.5611
 epoch: 47, train_loss: 0.6741, test_loss: 1.0645, test_f1: 0.6184
 epoch: 48, train_loss: 0.6506, test_loss: 1.0802, test_f1: 0.6020
 epoch: 49, train_loss: 0.6592, test_loss: 1.0247, test_f1: 0.6006
 epoch: 50, train_loss: 0.6534, test_loss: 1.0636, test_f1: 0.5841
 epoch: 51, train_loss: 0.6108, test_loss: 1.0775, test_f1: 0.6084
 epoch: 52, train_loss: 0.5916, test_loss: 1.1434, test_f1: 0.6036
 epoch: 53, train_loss: 0.5671, test_loss: 1.1706, test_f1: 0.5794
 epoch: 54, train_loss: 0.5617, test_loss: 1.1813, test_f1: 0.5405
 epoch: 55, train_loss: 0.5605, test_loss: 1.1698, test_f1: 0.6022
 epoch: 56, train_loss: 0.5752, test_loss: 1.1841, test_f1: 0.5860
 epoch: 57, train_loss: 0.5687, test_loss: 1.2797, test_f1: 0.6060
 epoch: 58, train_loss: 0.5731, test_loss: 1.1708, test_f1: 0.6160
 epoch: 59, train_loss: 0.5498, test_loss: 1.1481, test_f1: 0.5848
 epoch: 60, train_loss: 0.5260, test_loss: 1.2727, test_f1: 0.5685
 epoch: 61, train_loss: 0.5467, test_loss: 1.2949, test_f1: 0.5808
 epoch: 62, train_loss: 0.5281, test_loss: 1.2486, test_f1: 0.6033
 epoch: 63, train_loss: 0.5479, test_loss: 1.1318, test_f1: 0.6085
 epoch: 64, train_loss: 0.5511, test_loss: 1.1006, test_f1: 0.6288
 epoch: 65, train_loss: 0.5004, test_loss: 1.1791, test_f1: 0.5995
 epoch: 66, train_loss: 0.5000, test_loss: 1.2921, test_f1: 0.5803
 epoch: 67, train_loss: 0.5231, test_loss: 1.2370, test_f1: 0.5677
 epoch: 68, train_loss: 0.5191, test_loss: 1.2969, test_f1: 0.6088
 epoch: 69, train_loss: 0.5159, test_loss: 1.1948, test_f1: 0.6057
 epoch: 70, train_loss: 0.4879, test_loss: 1.3942, test_f1: 0.5855
 epoch: 71, train_loss: 0.5052, test_loss: 1.2849, test_f1: 0.6037
 epoch: 72, train_loss: 0.4922, test_loss: 1.3786, test_f1: 0.5756
 epoch: 73, train_loss: 0.5043, test_loss: 1.3935, test_f1: 0.5770
 epoch: 74, train_loss: 0.5303, test_loss: 1.3228, test_f1: 0.6026
 epoch: 75, train_loss: 0.5322, test_loss: 1.3011, test_f1: 0.6116
 epoch: 76, train_loss: 0.4987, test_loss: 1.3810, test_f1: 0.5931
 epoch: 77, train_loss: 0.5019, test_loss: 1.3467, test_f1: 0.6021
 epoch: 78, train_loss: 0.5086, test_loss: 1.3784, test_f1: 0.5927
 epoch: 79, train_loss: 0.4743, test_loss: 1.3244, test_f1: 0.5767
 epoch: 80, train_loss: 0.4829, test_loss: 1.4611, test_f1: 0.5764
 epoch: 81, train_loss: 0.4977, test_loss: 1.4936, test_f1: 0.5111
 epoch: 82, train_loss: 0.5319, test_loss: 1.2255, test_f1: 0.5741
 epoch: 83, train_loss: 0.4804, test_loss: 1.2709, test_f1: 0.5844
 epoch: 84, train_loss: 0.4796, test_loss: 1.3755, test_f1: 0.5970
 epoch: 85, train_loss: 0.4648, test_loss: 1.4688, test_f1: 0.5901
 epoch: 86, train_loss: 0.4539, test_loss: 1.3639, test_f1: 0.5655
 epoch: 87, train_loss: 0.4536, test_loss: 1.5300, test_f1: 0.5727
 epoch: 88, train_loss: 0.4334, test_loss: 1.3147, test_f1: 0.6262
 epoch: 89, train_loss: 0.4352, test_loss: 1.6241, test_f1: 0.5583
 epoch: 90, train_loss: 0.4485, test_loss: 1.4284, test_f1: 0.6026
 epoch: 91, train_loss: 0.4325, test_loss: 1.4845, test_f1: 0.6056
 epoch: 92, train_loss: 0.4536, test_loss: 1.6213, test_f1: 0.5736
 epoch: 93, train_loss: 0.4409, test_loss: 1.3602, test_f1: 0.6045
 epoch: 94, train_loss: 0.4540, test_loss: 1.5135, test_f1: 0.5599
 epoch: 95, train_loss: 0.4828, test_loss: 1.5099, test_f1: 0.5885
 epoch: 96, train_loss: 0.4150, test_loss: 1.4861, test_f1: 0.6085
 epoch: 97, train_loss: 0.4174, test_loss: 1.4963, test_f1: 0.5972
 epoch: 98, train_loss: 0.4282, test_loss: 1.5551, test_f1: 0.5895
 epoch: 99, train_loss: 0.4313, test_loss: 1.7013, test_f1: 0.5986
##################ITERATION #7 ****************************************
 epoch: 0, train_loss: 1.3639, test_loss: 1.4875, test_f1: 0.2001
 epoch: 1, train_loss: 1.1239, test_loss: 1.1653, test_f1: 0.4529
 epoch: 2, train_loss: 1.0444, test_loss: 1.1799, test_f1: 0.4862
 epoch: 3, train_loss: 1.0114, test_loss: 1.1821, test_f1: 0.4544
 epoch: 4, train_loss: 0.9909, test_loss: 1.1249, test_f1: 0.4685
 epoch: 5, train_loss: 0.9612, test_loss: 1.1210, test_f1: 0.4628
 epoch: 6, train_loss: 0.9357, test_loss: 1.3448, test_f1: 0.3953
 epoch: 7, train_loss: 0.9508, test_loss: 1.2746, test_f1: 0.4152
 epoch: 8, train_loss: 0.9435, test_loss: 1.2199, test_f1: 0.4933
 epoch: 9, train_loss: 0.9445, test_loss: 1.0964, test_f1: 0.4917
 epoch: 10, train_loss: 0.9178, test_loss: 1.0773, test_f1: 0.4944
 epoch: 11, train_loss: 0.9074, test_loss: 1.0793, test_f1: 0.4870
 epoch: 12, train_loss: 0.9091, test_loss: 1.2390, test_f1: 0.4789
 epoch: 13, train_loss: 0.8938, test_loss: 1.0992, test_f1: 0.5561
 epoch: 14, train_loss: 0.8883, test_loss: 1.1946, test_f1: 0.4793
 epoch: 15, train_loss: 0.8735, test_loss: 1.0358, test_f1: 0.5777
 epoch: 16, train_loss: 0.8875, test_loss: 1.1909, test_f1: 0.5198
 epoch: 17, train_loss: 0.8972, test_loss: 1.2375, test_f1: 0.4821
 epoch: 18, train_loss: 0.8457, test_loss: 1.1507, test_f1: 0.5100
 epoch: 19, train_loss: 0.8627, test_loss: 1.1404, test_f1: 0.5515
 epoch: 20, train_loss: 0.8451, test_loss: 1.1149, test_f1: 0.5514
 epoch: 21, train_loss: 0.8058, test_loss: 1.0577, test_f1: 0.5734
 epoch: 22, train_loss: 0.8394, test_loss: 1.0444, test_f1: 0.5888
 epoch: 23, train_loss: 0.8182, test_loss: 1.0807, test_f1: 0.5462
 epoch: 24, train_loss: 0.8402, test_loss: 1.0377, test_f1: 0.5609
 epoch: 25, train_loss: 0.8424, test_loss: 1.1364, test_f1: 0.5192
 epoch: 26, train_loss: 0.8698, test_loss: 1.1986, test_f1: 0.5219
 epoch: 27, train_loss: 0.8130, test_loss: 1.1309, test_f1: 0.5518
 epoch: 28, train_loss: 0.8148, test_loss: 1.4906, test_f1: 0.4744
 epoch: 29, train_loss: 0.8127, test_loss: 1.3282, test_f1: 0.5115
 epoch: 30, train_loss: 0.7837, test_loss: 1.0575, test_f1: 0.5768
 epoch: 31, train_loss: 0.7684, test_loss: 1.3031, test_f1: 0.5113
 epoch: 32, train_loss: 0.7614, test_loss: 1.1444, test_f1: 0.5710
 epoch: 33, train_loss: 0.7529, test_loss: 1.6426, test_f1: 0.4991
 epoch: 34, train_loss: 0.7810, test_loss: 1.1079, test_f1: 0.5355
 epoch: 35, train_loss: 0.7579, test_loss: 1.2899, test_f1: 0.5441
 epoch: 36, train_loss: 0.7672, test_loss: 1.8676, test_f1: 0.4145
 epoch: 37, train_loss: 0.7442, test_loss: 1.2860, test_f1: 0.4891
 epoch: 38, train_loss: 0.7537, test_loss: 1.1336, test_f1: 0.5881
 epoch: 39, train_loss: 0.7395, test_loss: 1.0999, test_f1: 0.6222
 epoch: 40, train_loss: 0.7194, test_loss: 1.1551, test_f1: 0.5552
 epoch: 41, train_loss: 0.7114, test_loss: 1.1875, test_f1: 0.5863
 epoch: 42, train_loss: 0.6986, test_loss: 1.4067, test_f1: 0.5539
 epoch: 43, train_loss: 0.7107, test_loss: 1.3363, test_f1: 0.4922
 epoch: 44, train_loss: 0.6941, test_loss: 1.2219, test_f1: 0.5198
 epoch: 45, train_loss: 0.6765, test_loss: 1.2422, test_f1: 0.5785
 epoch: 46, train_loss: 0.6663, test_loss: 1.4619, test_f1: 0.4944
 epoch: 47, train_loss: 0.6732, test_loss: 1.3623, test_f1: 0.5349
 epoch: 48, train_loss: 0.7068, test_loss: 1.2220, test_f1: 0.5800
 epoch: 49, train_loss: 0.6858, test_loss: 1.5304, test_f1: 0.5508
 epoch: 50, train_loss: 0.6522, test_loss: 1.3817, test_f1: 0.5372
 epoch: 51, train_loss: 0.6371, test_loss: 1.2680, test_f1: 0.5828
 epoch: 52, train_loss: 0.6346, test_loss: 1.3254, test_f1: 0.5822
 epoch: 53, train_loss: 0.6272, test_loss: 1.2253, test_f1: 0.5719
 epoch: 54, train_loss: 0.6016, test_loss: 1.2916, test_f1: 0.5695
 epoch: 55, train_loss: 0.5870, test_loss: 1.1977, test_f1: 0.6240
 epoch: 56, train_loss: 0.6011, test_loss: 1.3301, test_f1: 0.6018
 epoch: 57, train_loss: 0.5844, test_loss: 1.2093, test_f1: 0.6481
 epoch: 58, train_loss: 0.5627, test_loss: 1.3064, test_f1: 0.5849
 epoch: 59, train_loss: 0.5768, test_loss: 1.3205, test_f1: 0.5971
 epoch: 60, train_loss: 0.5606, test_loss: 1.2105, test_f1: 0.6306
 epoch: 61, train_loss: 0.5827, test_loss: 1.2367, test_f1: 0.6364
 epoch: 62, train_loss: 0.5902, test_loss: 1.2078, test_f1: 0.6511
 epoch: 63, train_loss: 0.5647, test_loss: 1.2355, test_f1: 0.6474
 epoch: 64, train_loss: 0.5560, test_loss: 1.3744, test_f1: 0.6145
 epoch: 65, train_loss: 0.5476, test_loss: 1.3233, test_f1: 0.6151
 epoch: 66, train_loss: 0.5442, test_loss: 1.3860, test_f1: 0.6286
 epoch: 67, train_loss: 0.5243, test_loss: 1.3765, test_f1: 0.6305
 epoch: 68, train_loss: 0.5181, test_loss: 1.3492, test_f1: 0.6159
 epoch: 69, train_loss: 0.5536, test_loss: 1.4586, test_f1: 0.6195
 epoch: 70, train_loss: 0.5598, test_loss: 1.2690, test_f1: 0.6449
 epoch: 71, train_loss: 0.5527, test_loss: 1.4440, test_f1: 0.6361
 epoch: 72, train_loss: 0.5342, test_loss: 1.4198, test_f1: 0.5170
 epoch: 73, train_loss: 0.5560, test_loss: 1.3475, test_f1: 0.6241
 epoch: 74, train_loss: 0.5217, test_loss: 1.5653, test_f1: 0.6190
 epoch: 75, train_loss: 0.4882, test_loss: 1.4608, test_f1: 0.6128
 epoch: 76, train_loss: 0.4887, test_loss: 1.7757, test_f1: 0.5952
 epoch: 77, train_loss: 0.4918, test_loss: 1.3935, test_f1: 0.6325
 epoch: 78, train_loss: 0.5139, test_loss: 1.6705, test_f1: 0.5554
 epoch: 79, train_loss: 0.4940, test_loss: 1.5863, test_f1: 0.6019
 epoch: 80, train_loss: 0.5049, test_loss: 1.6585, test_f1: 0.5652
 epoch: 81, train_loss: 0.4726, test_loss: 1.5034, test_f1: 0.6180
 epoch: 82, train_loss: 0.5037, test_loss: 1.5406, test_f1: 0.5924
 epoch: 83, train_loss: 0.4994, test_loss: 1.6682, test_f1: 0.6260
 epoch: 84, train_loss: 0.5001, test_loss: 1.7009, test_f1: 0.5984
 epoch: 85, train_loss: 0.4815, test_loss: 1.6066, test_f1: 0.6146
 epoch: 86, train_loss: 0.5068, test_loss: 1.7548, test_f1: 0.6175
 epoch: 87, train_loss: 0.5065, test_loss: 1.4874, test_f1: 0.6633
 epoch: 88, train_loss: 0.4894, test_loss: 1.8299, test_f1: 0.5862
 epoch: 89, train_loss: 0.4498, test_loss: 1.4833, test_f1: 0.6390
 epoch: 90, train_loss: 0.4759, test_loss: 1.5548, test_f1: 0.6514
 epoch: 91, train_loss: 0.4866, test_loss: 1.5579, test_f1: 0.6444
 epoch: 92, train_loss: 0.4805, test_loss: 2.3501, test_f1: 0.5642
 epoch: 93, train_loss: 0.4761, test_loss: 1.5088, test_f1: 0.5662
 epoch: 94, train_loss: 0.4515, test_loss: 1.6998, test_f1: 0.6293
 epoch: 95, train_loss: 0.4739, test_loss: 1.5528, test_f1: 0.6795
 epoch: 96, train_loss: 0.4880, test_loss: 1.6324, test_f1: 0.6500
 epoch: 97, train_loss: 0.4504, test_loss: 1.7659, test_f1: 0.5841
 epoch: 98, train_loss: 0.4601, test_loss: 1.4557, test_f1: 0.6322
 epoch: 99, train_loss: 0.4556, test_loss: 1.7403, test_f1: 0.6474
##################ITERATION #8 ****************************************
 epoch: 0, train_loss: 1.4700, test_loss: 1.3168, test_f1: 0.2281
 epoch: 1, train_loss: 1.1331, test_loss: 1.1551, test_f1: 0.4131
 epoch: 2, train_loss: 1.0591, test_loss: 1.1546, test_f1: 0.4847
 epoch: 3, train_loss: 1.0274, test_loss: 1.1125, test_f1: 0.4799
 epoch: 4, train_loss: 0.9890, test_loss: 1.1080, test_f1: 0.4893
 epoch: 5, train_loss: 0.9719, test_loss: 1.1551, test_f1: 0.4603
 epoch: 6, train_loss: 0.9750, test_loss: 1.1154, test_f1: 0.4988
 epoch: 7, train_loss: 0.9096, test_loss: 1.2058, test_f1: 0.5019
 epoch: 8, train_loss: 0.9092, test_loss: 1.1446, test_f1: 0.4958
 epoch: 9, train_loss: 0.9347, test_loss: 1.1759, test_f1: 0.4901
 epoch: 10, train_loss: 0.9108, test_loss: 1.0978, test_f1: 0.5043
 epoch: 11, train_loss: 0.9049, test_loss: 1.0654, test_f1: 0.5432
 epoch: 12, train_loss: 0.9013, test_loss: 1.0458, test_f1: 0.5420
 epoch: 13, train_loss: 0.9000, test_loss: 1.1308, test_f1: 0.5127
 epoch: 14, train_loss: 0.8721, test_loss: 1.1952, test_f1: 0.5039
 epoch: 15, train_loss: 0.8706, test_loss: 1.1918, test_f1: 0.5017
 epoch: 16, train_loss: 0.8604, test_loss: 1.1083, test_f1: 0.5582
 epoch: 17, train_loss: 0.8762, test_loss: 1.1652, test_f1: 0.5401
 epoch: 18, train_loss: 0.8368, test_loss: 1.0869, test_f1: 0.5505
 epoch: 19, train_loss: 0.8539, test_loss: 1.1905, test_f1: 0.5520
 epoch: 20, train_loss: 0.8235, test_loss: 1.0970, test_f1: 0.5311
 epoch: 21, train_loss: 0.8215, test_loss: 1.1724, test_f1: 0.5310
 epoch: 22, train_loss: 0.8402, test_loss: 1.2309, test_f1: 0.5064
 epoch: 23, train_loss: 0.8062, test_loss: 1.0523, test_f1: 0.5898
 epoch: 24, train_loss: 0.8189, test_loss: 1.1847, test_f1: 0.5252
 epoch: 25, train_loss: 0.8050, test_loss: 1.1943, test_f1: 0.4610
 epoch: 26, train_loss: 0.7935, test_loss: 1.2601, test_f1: 0.4463
 epoch: 27, train_loss: 0.7923, test_loss: 1.2911, test_f1: 0.5598
 epoch: 28, train_loss: 0.7727, test_loss: 1.2628, test_f1: 0.5427
 epoch: 29, train_loss: 0.7512, test_loss: 1.0822, test_f1: 0.5618
 epoch: 30, train_loss: 0.7518, test_loss: 1.1523, test_f1: 0.5227
 epoch: 31, train_loss: 0.7290, test_loss: 1.2910, test_f1: 0.4863
 epoch: 32, train_loss: 0.7234, test_loss: 1.1466, test_f1: 0.5311
 epoch: 33, train_loss: 0.7378, test_loss: 1.1839, test_f1: 0.5761
 epoch: 34, train_loss: 0.7156, test_loss: 1.1216, test_f1: 0.5446
 epoch: 35, train_loss: 0.6999, test_loss: 1.3072, test_f1: 0.5127
 epoch: 36, train_loss: 0.7109, test_loss: 1.1072, test_f1: 0.5577
 epoch: 37, train_loss: 0.7019, test_loss: 1.3270, test_f1: 0.5362
 epoch: 38, train_loss: 0.7234, test_loss: 1.2824, test_f1: 0.5740
 epoch: 39, train_loss: 0.7515, test_loss: 1.1721, test_f1: 0.5295
 epoch: 40, train_loss: 0.7223, test_loss: 1.2250, test_f1: 0.5427
 epoch: 41, train_loss: 0.6941, test_loss: 1.2687, test_f1: 0.5686
 epoch: 42, train_loss: 0.6759, test_loss: 1.3079, test_f1: 0.5542
 epoch: 43, train_loss: 0.6579, test_loss: 1.2033, test_f1: 0.5603
 epoch: 44, train_loss: 0.6718, test_loss: 1.3218, test_f1: 0.5486
 epoch: 45, train_loss: 0.7109, test_loss: 1.2551, test_f1: 0.5451
 epoch: 46, train_loss: 0.6890, test_loss: 1.2933, test_f1: 0.5592
 epoch: 47, train_loss: 0.6822, test_loss: 1.2682, test_f1: 0.5339
 epoch: 48, train_loss: 0.6820, test_loss: 1.4441, test_f1: 0.5367
 epoch: 49, train_loss: 0.6631, test_loss: 1.2426, test_f1: 0.5783
 epoch: 50, train_loss: 0.6469, test_loss: 1.6549, test_f1: 0.5184
 epoch: 51, train_loss: 0.6314, test_loss: 1.2056, test_f1: 0.5478
 epoch: 52, train_loss: 0.6217, test_loss: 1.3214, test_f1: 0.5456
 epoch: 53, train_loss: 0.6032, test_loss: 1.3848, test_f1: 0.5514
 epoch: 54, train_loss: 0.5930, test_loss: 1.4569, test_f1: 0.5365
 epoch: 55, train_loss: 0.5822, test_loss: 1.4410, test_f1: 0.5686
 epoch: 56, train_loss: 0.5712, test_loss: 1.4100, test_f1: 0.5341
 epoch: 57, train_loss: 0.5904, test_loss: 1.4039, test_f1: 0.5763
 epoch: 58, train_loss: 0.5639, test_loss: 1.4118, test_f1: 0.5622
 epoch: 59, train_loss: 0.5576, test_loss: 1.5487, test_f1: 0.5851
 epoch: 60, train_loss: 0.5219, test_loss: 1.3826, test_f1: 0.5198
 epoch: 61, train_loss: 0.5619, test_loss: 1.6298, test_f1: 0.5296
 epoch: 62, train_loss: 0.5435, test_loss: 1.4672, test_f1: 0.5760
 epoch: 63, train_loss: 0.5542, test_loss: 1.4777, test_f1: 0.5519
 epoch: 64, train_loss: 0.5338, test_loss: 1.5364, test_f1: 0.5687
 epoch: 65, train_loss: 0.5402, test_loss: 1.5807, test_f1: 0.5713
 epoch: 66, train_loss: 0.5286, test_loss: 1.6024, test_f1: 0.5614
 epoch: 67, train_loss: 0.4984, test_loss: 1.5962, test_f1: 0.5711
 epoch: 68, train_loss: 0.4879, test_loss: 1.6674, test_f1: 0.5974
 epoch: 69, train_loss: 0.5043, test_loss: 1.7057, test_f1: 0.6186
 epoch: 70, train_loss: 0.5663, test_loss: 2.3117, test_f1: 0.5914
 epoch: 71, train_loss: 0.4941, test_loss: 1.6864, test_f1: 0.5787
 epoch: 72, train_loss: 0.4673, test_loss: 1.6269, test_f1: 0.5880
 epoch: 73, train_loss: 0.5006, test_loss: 1.4829, test_f1: 0.6037
 epoch: 74, train_loss: 0.5149, test_loss: 1.5410, test_f1: 0.5726
 epoch: 75, train_loss: 0.5003, test_loss: 1.8320, test_f1: 0.5972
 epoch: 76, train_loss: 0.4637, test_loss: 1.7581, test_f1: 0.5943
 epoch: 77, train_loss: 0.4658, test_loss: 1.7643, test_f1: 0.5704
 epoch: 78, train_loss: 0.4664, test_loss: 1.7029, test_f1: 0.6030
 epoch: 79, train_loss: 0.4787, test_loss: 1.5194, test_f1: 0.5738
 epoch: 80, train_loss: 0.4999, test_loss: 1.8467, test_f1: 0.5760
 epoch: 81, train_loss: 0.4972, test_loss: 1.8570, test_f1: 0.5791
 epoch: 82, train_loss: 0.4689, test_loss: 1.8067, test_f1: 0.5524
 epoch: 83, train_loss: 0.4642, test_loss: 1.7549, test_f1: 0.5536
 epoch: 84, train_loss: 0.4669, test_loss: 1.7888, test_f1: 0.5987
 epoch: 85, train_loss: 0.4650, test_loss: 1.6187, test_f1: 0.5440
 epoch: 86, train_loss: 0.4674, test_loss: 1.8626, test_f1: 0.5085
 epoch: 87, train_loss: 0.4738, test_loss: 1.6650, test_f1: 0.5920
 epoch: 88, train_loss: 0.4466, test_loss: 1.8529, test_f1: 0.5447
 epoch: 89, train_loss: 0.5020, test_loss: 1.7190, test_f1: 0.5683
 epoch: 90, train_loss: 0.4939, test_loss: 2.0781, test_f1: 0.5684
 epoch: 91, train_loss: 0.5156, test_loss: 1.6235, test_f1: 0.5702
 epoch: 92, train_loss: 0.4776, test_loss: 1.7406, test_f1: 0.5841
 epoch: 93, train_loss: 0.4536, test_loss: 1.6126, test_f1: 0.5730
 epoch: 94, train_loss: 0.4519, test_loss: 1.7580, test_f1: 0.5944
 epoch: 95, train_loss: 0.4444, test_loss: 1.8328, test_f1: 0.5851
 epoch: 96, train_loss: 0.4358, test_loss: 1.9706, test_f1: 0.5778
 epoch: 97, train_loss: 0.4529, test_loss: 1.5464, test_f1: 0.5866
 epoch: 98, train_loss: 0.4477, test_loss: 2.0057, test_f1: 0.5987
 epoch: 99, train_loss: 0.4491, test_loss: 1.7038, test_f1: 0.5553
##################ITERATION #9 ****************************************
 epoch: 0, train_loss: 1.3319, test_loss: 1.4368, test_f1: 0.3316
 epoch: 1, train_loss: 1.1119, test_loss: 1.2492, test_f1: 0.2720
 epoch: 2, train_loss: 1.0512, test_loss: 1.1773, test_f1: 0.3693
 epoch: 3, train_loss: 1.0147, test_loss: 1.1337, test_f1: 0.4888
 epoch: 4, train_loss: 0.9710, test_loss: 1.1385, test_f1: 0.5150
 epoch: 5, train_loss: 0.9647, test_loss: 1.1142, test_f1: 0.4589
 epoch: 6, train_loss: 0.9544, test_loss: 1.0310, test_f1: 0.5260
 epoch: 7, train_loss: 0.9236, test_loss: 1.0275, test_f1: 0.5441
 epoch: 8, train_loss: 0.9344, test_loss: 1.1794, test_f1: 0.4778
 epoch: 9, train_loss: 0.9161, test_loss: 1.1500, test_f1: 0.5144
 epoch: 10, train_loss: 0.9003, test_loss: 1.0881, test_f1: 0.5208
 epoch: 11, train_loss: 0.8820, test_loss: 1.1021, test_f1: 0.5440
 epoch: 12, train_loss: 0.8867, test_loss: 1.1151, test_f1: 0.5332
 epoch: 13, train_loss: 0.8692, test_loss: 1.1613, test_f1: 0.5210
 epoch: 14, train_loss: 0.8658, test_loss: 1.0500, test_f1: 0.5722
 epoch: 15, train_loss: 0.9206, test_loss: 1.1009, test_f1: 0.5555
 epoch: 16, train_loss: 0.8808, test_loss: 1.0833, test_f1: 0.5520
 epoch: 17, train_loss: 0.8516, test_loss: 1.1594, test_f1: 0.5421
 epoch: 18, train_loss: 0.8650, test_loss: 1.0681, test_f1: 0.5832
 epoch: 19, train_loss: 0.8308, test_loss: 1.1057, test_f1: 0.5377
 epoch: 20, train_loss: 0.8061, test_loss: 1.1380, test_f1: 0.5559
 epoch: 21, train_loss: 0.8017, test_loss: 1.1985, test_f1: 0.5578
 epoch: 22, train_loss: 0.7713, test_loss: 1.1128, test_f1: 0.5728
 epoch: 23, train_loss: 0.8011, test_loss: 1.0971, test_f1: 0.5714
 epoch: 24, train_loss: 0.7969, test_loss: 1.0349, test_f1: 0.5423
 epoch: 25, train_loss: 0.7640, test_loss: 1.0949, test_f1: 0.5596
 epoch: 26, train_loss: 0.7687, test_loss: 1.1920, test_f1: 0.5749
 epoch: 27, train_loss: 0.7625, test_loss: 1.4741, test_f1: 0.5067
 epoch: 28, train_loss: 0.7512, test_loss: 1.2241, test_f1: 0.4277
 epoch: 29, train_loss: 0.7724, test_loss: 1.2881, test_f1: 0.4783
 epoch: 30, train_loss: 0.7544, test_loss: 1.0912, test_f1: 0.5436
 epoch: 31, train_loss: 0.7351, test_loss: 1.6447, test_f1: 0.4368
 epoch: 32, train_loss: 0.7596, test_loss: 1.2406, test_f1: 0.5746
 epoch: 33, train_loss: 0.7283, test_loss: 1.1097, test_f1: 0.5607
 epoch: 34, train_loss: 0.7230, test_loss: 1.0751, test_f1: 0.5530
 epoch: 35, train_loss: 0.8278, test_loss: 1.1354, test_f1: 0.5237
 epoch: 36, train_loss: 0.7773, test_loss: 1.0844, test_f1: 0.5116
 epoch: 37, train_loss: 0.7398, test_loss: 1.0835, test_f1: 0.5677
 epoch: 38, train_loss: 0.7176, test_loss: 1.2239, test_f1: 0.5370
 epoch: 39, train_loss: 0.7171, test_loss: 1.1471, test_f1: 0.4763
 epoch: 40, train_loss: 0.6966, test_loss: 1.1429, test_f1: 0.5753
 epoch: 41, train_loss: 0.6821, test_loss: 1.2305, test_f1: 0.5436
 epoch: 42, train_loss: 0.6967, test_loss: 1.6599, test_f1: 0.5047
 epoch: 43, train_loss: 0.6627, test_loss: 1.1333, test_f1: 0.5647
 epoch: 44, train_loss: 0.6850, test_loss: 1.3439, test_f1: 0.5208
 epoch: 45, train_loss: 0.7071, test_loss: 1.1641, test_f1: 0.5500
 epoch: 46, train_loss: 0.6968, test_loss: 1.2870, test_f1: 0.5758
 epoch: 47, train_loss: 0.6720, test_loss: 1.1469, test_f1: 0.5958
 epoch: 48, train_loss: 0.6542, test_loss: 1.1522, test_f1: 0.5821
 epoch: 49, train_loss: 0.6414, test_loss: 1.2532, test_f1: 0.5644
 epoch: 50, train_loss: 0.6488, test_loss: 1.4781, test_f1: 0.5801
 epoch: 51, train_loss: 0.6158, test_loss: 1.2287, test_f1: 0.5485
 epoch: 52, train_loss: 0.6064, test_loss: 1.3137, test_f1: 0.5807
 epoch: 53, train_loss: 0.5856, test_loss: 1.4431, test_f1: 0.5865
 epoch: 54, train_loss: 0.5668, test_loss: 1.2036, test_f1: 0.5745
 epoch: 55, train_loss: 0.5646, test_loss: 1.3993, test_f1: 0.5998
 epoch: 56, train_loss: 0.5592, test_loss: 1.2095, test_f1: 0.5896
 epoch: 57, train_loss: 0.5630, test_loss: 1.3346, test_f1: 0.5870
 epoch: 58, train_loss: 0.5446, test_loss: 1.4424, test_f1: 0.5870
 epoch: 59, train_loss: 0.5372, test_loss: 1.3359, test_f1: 0.5415
 epoch: 60, train_loss: 0.5326, test_loss: 1.5816, test_f1: 0.6111
 epoch: 61, train_loss: 0.5223, test_loss: 1.7172, test_f1: 0.5692
 epoch: 62, train_loss: 0.5265, test_loss: 1.2913, test_f1: 0.6007
 epoch: 63, train_loss: 0.5148, test_loss: 2.0037, test_f1: 0.5800
 epoch: 64, train_loss: 0.5173, test_loss: 1.7926, test_f1: 0.6056
 epoch: 65, train_loss: 0.5314, test_loss: 1.4144, test_f1: 0.6087
 epoch: 66, train_loss: 0.5596, test_loss: 1.2742, test_f1: 0.5622
 epoch: 67, train_loss: 0.5827, test_loss: 1.5093, test_f1: 0.5559
 epoch: 68, train_loss: 0.5560, test_loss: 1.2416, test_f1: 0.6128
 epoch: 69, train_loss: 0.5223, test_loss: 1.4195, test_f1: 0.6039
 epoch: 70, train_loss: 0.5133, test_loss: 1.4638, test_f1: 0.5902
 epoch: 71, train_loss: 0.4992, test_loss: 1.7135, test_f1: 0.5901
 epoch: 72, train_loss: 0.5873, test_loss: 1.1688, test_f1: 0.5994
 epoch: 73, train_loss: 0.6016, test_loss: 1.3189, test_f1: 0.5644
 epoch: 74, train_loss: 0.5766, test_loss: 1.5300, test_f1: 0.5970
 epoch: 75, train_loss: 0.5681, test_loss: 1.5101, test_f1: 0.6180
 epoch: 76, train_loss: 0.5461, test_loss: 1.3316, test_f1: 0.5960
 epoch: 77, train_loss: 0.5102, test_loss: 1.4374, test_f1: 0.5859
 epoch: 78, train_loss: 0.5175, test_loss: 1.7073, test_f1: 0.5885
 epoch: 79, train_loss: 0.5319, test_loss: 1.5189, test_f1: 0.5893
 epoch: 80, train_loss: 0.5128, test_loss: 1.4678, test_f1: 0.5563
 epoch: 81, train_loss: 0.4982, test_loss: 1.6432, test_f1: 0.5694
 epoch: 82, train_loss: 0.5111, test_loss: 1.7752, test_f1: 0.5815
 epoch: 83, train_loss: 0.4721, test_loss: 1.3880, test_f1: 0.5868
 epoch: 84, train_loss: 0.4652, test_loss: 1.7947, test_f1: 0.5899
 epoch: 85, train_loss: 0.4816, test_loss: 1.6692, test_f1: 0.5889
 epoch: 86, train_loss: 0.4821, test_loss: 1.5353, test_f1: 0.5655
 epoch: 87, train_loss: 0.4702, test_loss: 2.0550, test_f1: 0.5695
 epoch: 88, train_loss: 0.4743, test_loss: 1.7011, test_f1: 0.5550
 epoch: 89, train_loss: 0.5148, test_loss: 1.5712, test_f1: 0.5511
 epoch: 90, train_loss: 0.5075, test_loss: 1.5759, test_f1: 0.5766
 epoch: 91, train_loss: 0.4729, test_loss: 1.6996, test_f1: 0.6019
 epoch: 92, train_loss: 0.4599, test_loss: 1.8148, test_f1: 0.5619
 epoch: 93, train_loss: 0.4617, test_loss: 1.6639, test_f1: 0.5595
 epoch: 94, train_loss: 0.4469, test_loss: 1.6763, test_f1: 0.5831
 epoch: 95, train_loss: 0.4379, test_loss: 1.7935, test_f1: 0.5785
 epoch: 96, train_loss: 0.4580, test_loss: 1.9486, test_f1: 0.6078
 epoch: 97, train_loss: 0.4653, test_loss: 1.6000, test_f1: 0.5843
 epoch: 98, train_loss: 0.4721, test_loss: 1.6237, test_f1: 0.5481
 epoch: 99, train_loss: 0.4614, test_loss: 1.9411, test_f1: 0.5590

Training completed in 556.40 seconds
Best F1: 0.6795 at epoch 95
Mean F1 across iterations: 0.6373  0.0189
========================FINAL RESULTS================================
FEGIN weighted F1: 0.6795  0.0189
python main.py --data ltspice_demos --representation component_net --model FEGIN --layers 4 --hiddens 32 --batch_size 128 --lr 0.01 --emb_size 250 --epochs 100 --save_appendix component_net_L4_H32_BS128_LR0.01_E250 --no_val
-----



STDERR:
  File "main.py", line 370, in <module>
    main()
  File "main.py", line 254, in main
    dataset = dataset_class(
  File "/home/philip/projects/ltspice_examples_code_repo/Circuit-Completion-Using-GNNs/component_classification_with_link_prediction_head/evaluation/FEGIN/kernel/circuit_datasets.py", line 15, in __init__
    self.data, self.slices = torch.load(self.processed_paths[0])
  File "/home/philip/.local/lib/python3.8/site-packages/torch/serialization.py", line 1040, in load
    warnings.warn(
  File "/usr/lib/python3.8/warnings.py", line 109, in _showwarnmsg
    sw(msg.message, msg.category, msg.filename, msg.lineno,
  File "main.py", line 47, in warn_with_traceback
    traceback.print_stack(file=log)
/home/philip/projects/ltspice_examples_code_repo/Circuit-Completion-Using-GNNs/component_classification_with_link_prediction_head/evaluation/FEGIN/kernel/circuit_datasets.py:15: FutureWarning: You are using `torch.load` with `weights_only=False` (the current default value), which uses the default pickle module implicitly. It is possible to construct malicious pickle data which will execute arbitrary code during unpickling (See https://github.com/pytorch/pytorch/blob/main/SECURITY.md#untrusted-models for more details). In a future release, the default value for `weights_only` will be flipped to `True`. This limits the functions that could be executed during unpickling. Arbitrary objects will no longer be allowed to be loaded via this mode unless they are explicitly allowlisted by the user via `torch.serialization.add_safe_globals`. We recommend you start setting `weights_only=True` for any use case where you don't have full control of the loaded file. Please open an issue on GitHub for any issues related to this experimental feature.
  self.data, self.slices = torch.load(self.processed_paths[0])
