STDOUT:
Results will be saved in /home/philip/projects/ltspice_examples_code_repo/Circuit-Completion-Using-GNNs/component_classification_with_link_prediction_head/evaluation/FEGIN/results/model_FEGIN_dataset_ltspice_demos
Command line input: python main.py --data ltspice_demos --representation component_net --model FEGIN --layers 4 --hiddens 32 --batch_size 32 --lr 0.01 --emb_size 128 --epochs 100 --save_appendix component_net_L4_H32_BS32_LR0.01_E128 --no_val
 is saved.
-----
ltspice_demos - FEGIN
Using 4 layers, 32 hidden units, h = 2
Loading component_net representation dataset
ENTERED
Training FEGIN on component_net representation
Train: 1565, Test: 383
##################ITERATION #0 ****************************************
 epoch: 0, train_loss: 1.2044, test_loss: 1.5205, test_f1: 0.2390
 epoch: 1, train_loss: 1.0613, test_loss: 1.1343, test_f1: 0.4652
 epoch: 2, train_loss: 1.0317, test_loss: 1.1072, test_f1: 0.4732
 epoch: 3, train_loss: 1.0074, test_loss: 1.0957, test_f1: 0.4660
 epoch: 4, train_loss: 0.9721, test_loss: 1.0609, test_f1: 0.3917
 epoch: 5, train_loss: 0.9671, test_loss: 1.0861, test_f1: 0.4036
 epoch: 6, train_loss: 0.9859, test_loss: 1.1110, test_f1: 0.4623
 epoch: 7, train_loss: 0.9641, test_loss: 1.0527, test_f1: 0.4963
 epoch: 8, train_loss: 0.9494, test_loss: 1.1273, test_f1: 0.4651
 epoch: 9, train_loss: 0.9396, test_loss: 1.1232, test_f1: 0.4652
 epoch: 10, train_loss: 0.9375, test_loss: 1.0162, test_f1: 0.5509
 epoch: 11, train_loss: 0.9492, test_loss: 1.1389, test_f1: 0.4850
 epoch: 12, train_loss: 0.9173, test_loss: 1.0907, test_f1: 0.5407
 epoch: 13, train_loss: 0.9148, test_loss: 1.0395, test_f1: 0.5864
 epoch: 14, train_loss: 0.9093, test_loss: 1.0665, test_f1: 0.5360
 epoch: 15, train_loss: 0.9100, test_loss: 1.0215, test_f1: 0.5497
 epoch: 16, train_loss: 0.8613, test_loss: 1.1233, test_f1: 0.5009
 epoch: 17, train_loss: 0.8727, test_loss: 1.0667, test_f1: 0.5712
 epoch: 18, train_loss: 0.8730, test_loss: 1.0347, test_f1: 0.5251
 epoch: 19, train_loss: 0.8458, test_loss: 1.2633, test_f1: 0.4783
 epoch: 20, train_loss: 0.8438, test_loss: 0.9944, test_f1: 0.5612
 epoch: 21, train_loss: 0.8506, test_loss: 1.0608, test_f1: 0.5738
 epoch: 22, train_loss: 0.8195, test_loss: 1.0282, test_f1: 0.5395
 epoch: 23, train_loss: 0.8197, test_loss: 1.0195, test_f1: 0.5809
 epoch: 24, train_loss: 0.8490, test_loss: 1.1160, test_f1: 0.5337
 epoch: 25, train_loss: 0.7995, test_loss: 1.0783, test_f1: 0.5697
 epoch: 26, train_loss: 0.8284, test_loss: 1.1631, test_f1: 0.5475
 epoch: 27, train_loss: 0.7906, test_loss: 1.0184, test_f1: 0.5719
 epoch: 28, train_loss: 0.7784, test_loss: 1.1396, test_f1: 0.5700
 epoch: 29, train_loss: 0.7753, test_loss: 1.1812, test_f1: 0.4618
 epoch: 30, train_loss: 0.7565, test_loss: 1.2961, test_f1: 0.5190
 epoch: 31, train_loss: 0.7894, test_loss: 1.0815, test_f1: 0.5207
 epoch: 32, train_loss: 0.7674, test_loss: 1.2091, test_f1: 0.5742
 epoch: 33, train_loss: 0.7727, test_loss: 1.1455, test_f1: 0.5826
 epoch: 34, train_loss: 0.7280, test_loss: 1.0793, test_f1: 0.6146
 epoch: 35, train_loss: 0.7395, test_loss: 1.2553, test_f1: 0.5669
 epoch: 36, train_loss: 0.7449, test_loss: 1.1913, test_f1: 0.5565
 epoch: 37, train_loss: 0.7491, test_loss: 1.1488, test_f1: 0.5426
 epoch: 38, train_loss: 0.7544, test_loss: 1.0719, test_f1: 0.6083
 epoch: 39, train_loss: 0.7693, test_loss: 1.0965, test_f1: 0.5907
 epoch: 40, train_loss: 0.7118, test_loss: 1.1998, test_f1: 0.5550
 epoch: 41, train_loss: 0.7228, test_loss: 1.1647, test_f1: 0.5326
 epoch: 42, train_loss: 0.7260, test_loss: 1.2545, test_f1: 0.6022
 epoch: 43, train_loss: 0.7127, test_loss: 1.1571, test_f1: 0.5299
 epoch: 44, train_loss: 0.7259, test_loss: 1.1641, test_f1: 0.6085
 epoch: 45, train_loss: 0.7118, test_loss: 1.2039, test_f1: 0.5447
 epoch: 46, train_loss: 0.6961, test_loss: 1.2096, test_f1: 0.5867
 epoch: 47, train_loss: 0.7011, test_loss: 1.2020, test_f1: 0.5894
 epoch: 48, train_loss: 0.6735, test_loss: 1.3791, test_f1: 0.5861
 epoch: 49, train_loss: 0.7170, test_loss: 1.1382, test_f1: 0.6190
 epoch: 50, train_loss: 0.7125, test_loss: 1.1175, test_f1: 0.5446
 epoch: 51, train_loss: 0.6606, test_loss: 1.2841, test_f1: 0.6184
 epoch: 52, train_loss: 0.6516, test_loss: 1.3636, test_f1: 0.5860
 epoch: 53, train_loss: 0.6198, test_loss: 1.3316, test_f1: 0.5637
 epoch: 54, train_loss: 0.6186, test_loss: 1.3586, test_f1: 0.5890
 epoch: 55, train_loss: 0.6334, test_loss: 1.4092, test_f1: 0.5758
 epoch: 56, train_loss: 0.6126, test_loss: 1.3506, test_f1: 0.5917
 epoch: 57, train_loss: 0.6535, test_loss: 1.3735, test_f1: 0.5717
 epoch: 58, train_loss: 0.6190, test_loss: 1.3136, test_f1: 0.6073
 epoch: 59, train_loss: 0.6011, test_loss: 1.3701, test_f1: 0.5814
 epoch: 60, train_loss: 0.6162, test_loss: 1.3442, test_f1: 0.5770
 epoch: 61, train_loss: 0.6144, test_loss: 1.3656, test_f1: 0.5792
 epoch: 62, train_loss: 0.6164, test_loss: 1.3353, test_f1: 0.5886
 epoch: 63, train_loss: 0.5877, test_loss: 1.4243, test_f1: 0.6107
 epoch: 64, train_loss: 0.5780, test_loss: 1.3649, test_f1: 0.5930
 epoch: 65, train_loss: 0.6255, test_loss: 1.3994, test_f1: 0.5968
 epoch: 66, train_loss: 0.6112, test_loss: 1.2249, test_f1: 0.5867
 epoch: 67, train_loss: 0.6052, test_loss: 1.4501, test_f1: 0.6035
 epoch: 68, train_loss: 0.5722, test_loss: 1.3975, test_f1: 0.5585
 epoch: 69, train_loss: 0.5771, test_loss: 1.7369, test_f1: 0.5721
 epoch: 70, train_loss: 0.5983, test_loss: 1.2900, test_f1: 0.6508
 epoch: 71, train_loss: 0.5992, test_loss: 1.5601, test_f1: 0.5840
 epoch: 72, train_loss: 0.5597, test_loss: 1.5586, test_f1: 0.6003
 epoch: 73, train_loss: 0.5503, test_loss: 1.6472, test_f1: 0.6278
 epoch: 74, train_loss: 0.5711, test_loss: 1.6329, test_f1: 0.5850
 epoch: 75, train_loss: 0.5501, test_loss: 1.6151, test_f1: 0.5930
 epoch: 76, train_loss: 0.5774, test_loss: 1.5209, test_f1: 0.6159
 epoch: 77, train_loss: 0.5767, test_loss: 1.5660, test_f1: 0.5740
 epoch: 78, train_loss: 0.5524, test_loss: 1.6259, test_f1: 0.5938
 epoch: 79, train_loss: 0.5538, test_loss: 1.5481, test_f1: 0.6137
 epoch: 80, train_loss: 0.5621, test_loss: 1.5278, test_f1: 0.6332
 epoch: 81, train_loss: 0.5552, test_loss: 1.6344, test_f1: 0.6066
 epoch: 82, train_loss: 0.5577, test_loss: 1.5697, test_f1: 0.5969
 epoch: 83, train_loss: 0.5754, test_loss: 1.5168, test_f1: 0.5809
 epoch: 84, train_loss: 0.5587, test_loss: 1.5416, test_f1: 0.5670
 epoch: 85, train_loss: 0.5475, test_loss: 1.7591, test_f1: 0.6086
 epoch: 86, train_loss: 0.5821, test_loss: 1.4340, test_f1: 0.6038
 epoch: 87, train_loss: 0.5465, test_loss: 1.5706, test_f1: 0.6184
 epoch: 88, train_loss: 0.5535, test_loss: 1.7476, test_f1: 0.5658
 epoch: 89, train_loss: 0.5470, test_loss: 1.6844, test_f1: 0.6130
 epoch: 90, train_loss: 0.5612, test_loss: 1.5807, test_f1: 0.5483
 epoch: 91, train_loss: 0.5553, test_loss: 1.7547, test_f1: 0.5942
 epoch: 92, train_loss: 0.5193, test_loss: 1.4974, test_f1: 0.6573
 epoch: 93, train_loss: 0.5408, test_loss: 1.7151, test_f1: 0.5941
 epoch: 94, train_loss: 0.5305, test_loss: 1.7298, test_f1: 0.6128
 epoch: 95, train_loss: 0.5316, test_loss: 1.6687, test_f1: 0.6403
 epoch: 96, train_loss: 0.5063, test_loss: 1.7093, test_f1: 0.6239
 epoch: 97, train_loss: 0.5278, test_loss: 1.6256, test_f1: 0.6137
 epoch: 98, train_loss: 0.5120, test_loss: 2.0023, test_f1: 0.6088
 epoch: 99, train_loss: 0.5200, test_loss: 1.7655, test_f1: 0.6407
##################ITERATION #1 ****************************************
 epoch: 0, train_loss: 1.1875, test_loss: 1.1715, test_f1: 0.4550
 epoch: 1, train_loss: 1.0261, test_loss: 1.1509, test_f1: 0.4088
 epoch: 2, train_loss: 1.0077, test_loss: 1.1124, test_f1: 0.3875
 epoch: 3, train_loss: 0.9919, test_loss: 1.0438, test_f1: 0.4214
 epoch: 4, train_loss: 0.9593, test_loss: 1.0484, test_f1: 0.4612
 epoch: 5, train_loss: 0.9535, test_loss: 1.1101, test_f1: 0.5037
 epoch: 6, train_loss: 0.9387, test_loss: 0.9886, test_f1: 0.5613
 epoch: 7, train_loss: 0.9299, test_loss: 1.1810, test_f1: 0.4118
 epoch: 8, train_loss: 0.9394, test_loss: 1.0552, test_f1: 0.5055
 epoch: 9, train_loss: 0.9239, test_loss: 1.0151, test_f1: 0.5913
 epoch: 10, train_loss: 0.9119, test_loss: 0.9669, test_f1: 0.5488
 epoch: 11, train_loss: 0.8984, test_loss: 1.0341, test_f1: 0.5604
 epoch: 12, train_loss: 0.8668, test_loss: 1.0571, test_f1: 0.5665
 epoch: 13, train_loss: 0.9085, test_loss: 1.0137, test_f1: 0.5764
 epoch: 14, train_loss: 0.8653, test_loss: 1.3314, test_f1: 0.4859
 epoch: 15, train_loss: 0.8587, test_loss: 0.9666, test_f1: 0.6005
 epoch: 16, train_loss: 0.8248, test_loss: 1.1064, test_f1: 0.5459
 epoch: 17, train_loss: 0.8379, test_loss: 1.0886, test_f1: 0.5176
 epoch: 18, train_loss: 0.8259, test_loss: 1.5386, test_f1: 0.5084
 epoch: 19, train_loss: 0.8493, test_loss: 1.0562, test_f1: 0.5565
 epoch: 20, train_loss: 0.8039, test_loss: 1.1958, test_f1: 0.5711
 epoch: 21, train_loss: 0.8753, test_loss: 1.1891, test_f1: 0.4947
 epoch: 22, train_loss: 0.8583, test_loss: 1.0554, test_f1: 0.5617
 epoch: 23, train_loss: 0.8155, test_loss: 1.0784, test_f1: 0.5198
 epoch: 24, train_loss: 0.8508, test_loss: 1.0895, test_f1: 0.5391
 epoch: 25, train_loss: 0.7960, test_loss: 1.0912, test_f1: 0.5924
 epoch: 26, train_loss: 0.7718, test_loss: 1.1062, test_f1: 0.5265
 epoch: 27, train_loss: 0.7660, test_loss: 1.1020, test_f1: 0.5132
 epoch: 28, train_loss: 0.7561, test_loss: 1.1568, test_f1: 0.5519
 epoch: 29, train_loss: 0.7361, test_loss: 1.0855, test_f1: 0.5826
 epoch: 30, train_loss: 0.7435, test_loss: 1.0625, test_f1: 0.5465
 epoch: 31, train_loss: 0.7315, test_loss: 1.2170, test_f1: 0.4509
 epoch: 32, train_loss: 0.7384, test_loss: 1.2031, test_f1: 0.5811
 epoch: 33, train_loss: 0.7262, test_loss: 1.0949, test_f1: 0.5358
 epoch: 34, train_loss: 0.7250, test_loss: 1.1390, test_f1: 0.5470
 epoch: 35, train_loss: 0.7334, test_loss: 1.1892, test_f1: 0.5587
 epoch: 36, train_loss: 0.7224, test_loss: 0.9992, test_f1: 0.5720
 epoch: 37, train_loss: 0.6880, test_loss: 1.1066, test_f1: 0.5992
 epoch: 38, train_loss: 0.6837, test_loss: 1.1912, test_f1: 0.5626
 epoch: 39, train_loss: 0.7006, test_loss: 1.1976, test_f1: 0.5439
 epoch: 40, train_loss: 0.6903, test_loss: 1.1573, test_f1: 0.5520
 epoch: 41, train_loss: 0.6572, test_loss: 1.6864, test_f1: 0.5198
 epoch: 42, train_loss: 0.6548, test_loss: 1.2361, test_f1: 0.5924
 epoch: 43, train_loss: 0.6914, test_loss: 1.2584, test_f1: 0.6059
 epoch: 44, train_loss: 0.6944, test_loss: 1.1439, test_f1: 0.5727
 epoch: 45, train_loss: 0.6592, test_loss: 1.1612, test_f1: 0.6108
 epoch: 46, train_loss: 0.6334, test_loss: 1.2252, test_f1: 0.5805
 epoch: 47, train_loss: 0.6539, test_loss: 1.2589, test_f1: 0.5750
 epoch: 48, train_loss: 0.6695, test_loss: 1.2316, test_f1: 0.5762
 epoch: 49, train_loss: 0.6283, test_loss: 1.2047, test_f1: 0.5570
 epoch: 50, train_loss: 0.6485, test_loss: 1.2366, test_f1: 0.5859
 epoch: 51, train_loss: 0.6273, test_loss: 1.2211, test_f1: 0.6019
 epoch: 52, train_loss: 0.6098, test_loss: 1.2847, test_f1: 0.6078
 epoch: 53, train_loss: 0.5998, test_loss: 1.2591, test_f1: 0.5774
 epoch: 54, train_loss: 0.5632, test_loss: 1.2832, test_f1: 0.5866
 epoch: 55, train_loss: 0.5927, test_loss: 1.2005, test_f1: 0.5644
 epoch: 56, train_loss: 0.5799, test_loss: 1.3181, test_f1: 0.6029
 epoch: 57, train_loss: 0.6045, test_loss: 1.2124, test_f1: 0.6019
 epoch: 58, train_loss: 0.5803, test_loss: 1.3611, test_f1: 0.5997
 epoch: 59, train_loss: 0.5653, test_loss: 1.4096, test_f1: 0.6062
 epoch: 60, train_loss: 0.5928, test_loss: 1.3256, test_f1: 0.5808
 epoch: 61, train_loss: 0.5567, test_loss: 1.4903, test_f1: 0.5851
 epoch: 62, train_loss: 0.5710, test_loss: 1.2760, test_f1: 0.6149
 epoch: 63, train_loss: 0.5764, test_loss: 1.3569, test_f1: 0.6062
 epoch: 64, train_loss: 0.5387, test_loss: 1.4407, test_f1: 0.5560
 epoch: 65, train_loss: 0.5850, test_loss: 1.2674, test_f1: 0.6000
 epoch: 66, train_loss: 0.5627, test_loss: 1.3753, test_f1: 0.5737
 epoch: 67, train_loss: 0.5760, test_loss: 1.3661, test_f1: 0.5548
 epoch: 68, train_loss: 0.5470, test_loss: 1.3161, test_f1: 0.5971
 epoch: 69, train_loss: 0.5634, test_loss: 1.3413, test_f1: 0.6126
 epoch: 70, train_loss: 0.5463, test_loss: 1.3038, test_f1: 0.6179
 epoch: 71, train_loss: 0.5438, test_loss: 1.2295, test_f1: 0.6126
 epoch: 72, train_loss: 0.5597, test_loss: 1.4232, test_f1: 0.5641
 epoch: 73, train_loss: 0.5322, test_loss: 1.3080, test_f1: 0.6364
 epoch: 74, train_loss: 0.5063, test_loss: 1.5039, test_f1: 0.5614
 epoch: 75, train_loss: 0.5162, test_loss: 1.4600, test_f1: 0.5969
 epoch: 76, train_loss: 0.5487, test_loss: 1.2963, test_f1: 0.6491
 epoch: 77, train_loss: 0.5525, test_loss: 1.3196, test_f1: 0.6141
 epoch: 78, train_loss: 0.5424, test_loss: 1.2907, test_f1: 0.6537
 epoch: 79, train_loss: 0.5250, test_loss: 1.3396, test_f1: 0.5957
 epoch: 80, train_loss: 0.5275, test_loss: 1.4571, test_f1: 0.5907
 epoch: 81, train_loss: 0.5067, test_loss: 1.4668, test_f1: 0.6338
 epoch: 82, train_loss: 0.5106, test_loss: 1.5452, test_f1: 0.6048
 epoch: 83, train_loss: 0.5348, test_loss: 1.5679, test_f1: 0.6003
 epoch: 84, train_loss: 0.5028, test_loss: 1.4812, test_f1: 0.6203
 epoch: 85, train_loss: 0.5198, test_loss: 1.5493, test_f1: 0.5940
 epoch: 86, train_loss: 0.5159, test_loss: 1.4629, test_f1: 0.6034
 epoch: 87, train_loss: 0.4846, test_loss: 1.4125, test_f1: 0.6273
 epoch: 88, train_loss: 0.5033, test_loss: 1.5351, test_f1: 0.6316
 epoch: 89, train_loss: 0.4910, test_loss: 1.4575, test_f1: 0.6146
 epoch: 90, train_loss: 0.5327, test_loss: 1.2854, test_f1: 0.6266
 epoch: 91, train_loss: 0.5430, test_loss: 1.3425, test_f1: 0.6249
 epoch: 92, train_loss: 0.4796, test_loss: 1.4959, test_f1: 0.5759
 epoch: 93, train_loss: 0.4929, test_loss: 1.3485, test_f1: 0.6399
 epoch: 94, train_loss: 0.5019, test_loss: 1.4822, test_f1: 0.5889
 epoch: 95, train_loss: 0.4784, test_loss: 1.5462, test_f1: 0.6251
 epoch: 96, train_loss: 0.5126, test_loss: 1.4341, test_f1: 0.6218
 epoch: 97, train_loss: 0.4748, test_loss: 1.5123, test_f1: 0.5920
 epoch: 98, train_loss: 0.4858, test_loss: 1.4481, test_f1: 0.6187
 epoch: 99, train_loss: 0.5147, test_loss: 1.4645, test_f1: 0.5751
##################ITERATION #2 ****************************************
 epoch: 0, train_loss: 1.2073, test_loss: 1.1469, test_f1: 0.3342
 epoch: 1, train_loss: 1.0572, test_loss: 1.1161, test_f1: 0.3994
 epoch: 2, train_loss: 0.9939, test_loss: 1.0971, test_f1: 0.4935
 epoch: 3, train_loss: 0.9907, test_loss: 1.1725, test_f1: 0.3869
 epoch: 4, train_loss: 0.9715, test_loss: 1.0975, test_f1: 0.4027
 epoch: 5, train_loss: 0.9777, test_loss: 1.0520, test_f1: 0.5124
 epoch: 6, train_loss: 0.9465, test_loss: 1.0571, test_f1: 0.4937
 epoch: 7, train_loss: 0.9424, test_loss: 1.1013, test_f1: 0.4579
 epoch: 8, train_loss: 0.9340, test_loss: 1.0262, test_f1: 0.5305
 epoch: 9, train_loss: 0.9228, test_loss: 1.0344, test_f1: 0.5350
 epoch: 10, train_loss: 0.9052, test_loss: 1.0785, test_f1: 0.5427
 epoch: 11, train_loss: 0.9143, test_loss: 1.0158, test_f1: 0.5099
 epoch: 12, train_loss: 0.8799, test_loss: 0.9884, test_f1: 0.5404
 epoch: 13, train_loss: 0.8984, test_loss: 1.0178, test_f1: 0.5548
 epoch: 14, train_loss: 0.8679, test_loss: 1.0579, test_f1: 0.5060
 epoch: 15, train_loss: 0.8651, test_loss: 1.1103, test_f1: 0.5155
 epoch: 16, train_loss: 0.8661, test_loss: 1.0244, test_f1: 0.4853
 epoch: 17, train_loss: 0.8476, test_loss: 1.0163, test_f1: 0.5664
 epoch: 18, train_loss: 0.8303, test_loss: 1.0234, test_f1: 0.4849
 epoch: 19, train_loss: 0.8263, test_loss: 1.1492, test_f1: 0.5276
 epoch: 20, train_loss: 0.8557, test_loss: 1.0010, test_f1: 0.5485
 epoch: 21, train_loss: 0.7948, test_loss: 0.9948, test_f1: 0.5643
 epoch: 22, train_loss: 0.8008, test_loss: 1.0258, test_f1: 0.4643
 epoch: 23, train_loss: 0.7738, test_loss: 1.0675, test_f1: 0.5339
 epoch: 24, train_loss: 0.7898, test_loss: 1.2160, test_f1: 0.4860
 epoch: 25, train_loss: 0.7806, test_loss: 1.0895, test_f1: 0.5133
 epoch: 26, train_loss: 0.7870, test_loss: 1.2686, test_f1: 0.4841
 epoch: 27, train_loss: 0.7909, test_loss: 1.0542, test_f1: 0.5559
 epoch: 28, train_loss: 0.7589, test_loss: 1.0418, test_f1: 0.5492
 epoch: 29, train_loss: 0.7740, test_loss: 1.0839, test_f1: 0.5207
 epoch: 30, train_loss: 0.7777, test_loss: 1.0914, test_f1: 0.5477
 epoch: 31, train_loss: 0.7619, test_loss: 1.1021, test_f1: 0.4969
 epoch: 32, train_loss: 0.7451, test_loss: 1.3135, test_f1: 0.5449
 epoch: 33, train_loss: 0.7576, test_loss: 1.1187, test_f1: 0.5468
 epoch: 34, train_loss: 0.7539, test_loss: 1.1525, test_f1: 0.5191
 epoch: 35, train_loss: 0.7603, test_loss: 1.1115, test_f1: 0.5443
 epoch: 36, train_loss: 0.7513, test_loss: 1.0655, test_f1: 0.5799
 epoch: 37, train_loss: 0.7179, test_loss: 1.2557, test_f1: 0.5560
 epoch: 38, train_loss: 0.7203, test_loss: 1.0929, test_f1: 0.5172
 epoch: 39, train_loss: 0.7241, test_loss: 1.1340, test_f1: 0.5376
 epoch: 40, train_loss: 0.7347, test_loss: 1.1747, test_f1: 0.4869
 epoch: 41, train_loss: 0.7201, test_loss: 1.2031, test_f1: 0.5336
 epoch: 42, train_loss: 0.6974, test_loss: 1.1431, test_f1: 0.5270
 epoch: 43, train_loss: 0.7221, test_loss: 1.1828, test_f1: 0.5478
 epoch: 44, train_loss: 0.7016, test_loss: 1.3182, test_f1: 0.5340
 epoch: 45, train_loss: 0.6850, test_loss: 1.3492, test_f1: 0.5055
 epoch: 46, train_loss: 0.7286, test_loss: 1.2285, test_f1: 0.5368
 epoch: 47, train_loss: 0.7573, test_loss: 1.1801, test_f1: 0.5149
 epoch: 48, train_loss: 0.7119, test_loss: 1.2646, test_f1: 0.5205
 epoch: 49, train_loss: 0.7105, test_loss: 1.3181, test_f1: 0.5769
 epoch: 50, train_loss: 0.6998, test_loss: 1.1771, test_f1: 0.5253
 epoch: 51, train_loss: 0.6789, test_loss: 1.3358, test_f1: 0.5594
 epoch: 52, train_loss: 0.6694, test_loss: 1.3723, test_f1: 0.5509
 epoch: 53, train_loss: 0.6341, test_loss: 1.3933, test_f1: 0.5321
 epoch: 54, train_loss: 0.6112, test_loss: 1.3319, test_f1: 0.5704
 epoch: 55, train_loss: 0.6152, test_loss: 1.4017, test_f1: 0.5464
 epoch: 56, train_loss: 0.6018, test_loss: 1.6859, test_f1: 0.5271
 epoch: 57, train_loss: 0.6128, test_loss: 1.3733, test_f1: 0.5209
 epoch: 58, train_loss: 0.6179, test_loss: 1.5306, test_f1: 0.5535
 epoch: 59, train_loss: 0.6152, test_loss: 1.4728, test_f1: 0.5531
 epoch: 60, train_loss: 0.6137, test_loss: 1.6032, test_f1: 0.5730
 epoch: 61, train_loss: 0.6173, test_loss: 1.5210, test_f1: 0.5167
 epoch: 62, train_loss: 0.6173, test_loss: 1.6055, test_f1: 0.5636
 epoch: 63, train_loss: 0.6034, test_loss: 1.4229, test_f1: 0.5678
 epoch: 64, train_loss: 0.6144, test_loss: 1.4535, test_f1: 0.5439
 epoch: 65, train_loss: 0.5916, test_loss: 1.4790, test_f1: 0.5809
 epoch: 66, train_loss: 0.5798, test_loss: 1.5204, test_f1: 0.5463
 epoch: 67, train_loss: 0.6136, test_loss: 1.5086, test_f1: 0.5705
 epoch: 68, train_loss: 0.6067, test_loss: 1.8267, test_f1: 0.5093
 epoch: 69, train_loss: 0.5699, test_loss: 1.5014, test_f1: 0.5341
 epoch: 70, train_loss: 0.5614, test_loss: 1.7150, test_f1: 0.5409
 epoch: 71, train_loss: 0.6018, test_loss: 1.5607, test_f1: 0.5597
 epoch: 72, train_loss: 0.5904, test_loss: 1.3718, test_f1: 0.5661
 epoch: 73, train_loss: 0.5694, test_loss: 1.7283, test_f1: 0.5632
 epoch: 74, train_loss: 0.5831, test_loss: 1.6510, test_f1: 0.5313
 epoch: 75, train_loss: 0.5872, test_loss: 1.6122, test_f1: 0.5503
 epoch: 76, train_loss: 0.5637, test_loss: 1.5597, test_f1: 0.5871
 epoch: 77, train_loss: 0.5448, test_loss: 1.6362, test_f1: 0.5716
 epoch: 78, train_loss: 0.5320, test_loss: 1.5746, test_f1: 0.5712
 epoch: 79, train_loss: 0.5361, test_loss: 1.6358, test_f1: 0.5926
 epoch: 80, train_loss: 0.5384, test_loss: 1.6061, test_f1: 0.6090
 epoch: 81, train_loss: 0.5647, test_loss: 1.4932, test_f1: 0.5577
 epoch: 82, train_loss: 0.5698, test_loss: 1.6056, test_f1: 0.5579
 epoch: 83, train_loss: 0.5576, test_loss: 1.5929, test_f1: 0.5783
 epoch: 84, train_loss: 0.5356, test_loss: 1.5870, test_f1: 0.5874
 epoch: 85, train_loss: 0.5329, test_loss: 1.4624, test_f1: 0.6207
 epoch: 86, train_loss: 0.5123, test_loss: 1.6234, test_f1: 0.5777
 epoch: 87, train_loss: 0.5307, test_loss: 1.5792, test_f1: 0.5999
 epoch: 88, train_loss: 0.5431, test_loss: 1.3657, test_f1: 0.6233
 epoch: 89, train_loss: 0.4980, test_loss: 1.5310, test_f1: 0.6490
 epoch: 90, train_loss: 0.5220, test_loss: 1.5555, test_f1: 0.5803
 epoch: 91, train_loss: 0.5100, test_loss: 1.5722, test_f1: 0.6316
 epoch: 92, train_loss: 0.5161, test_loss: 1.3893, test_f1: 0.5883
 epoch: 93, train_loss: 0.5595, test_loss: 1.4581, test_f1: 0.6104
 epoch: 94, train_loss: 0.5189, test_loss: 1.6310, test_f1: 0.5773
 epoch: 95, train_loss: 0.5269, test_loss: 1.5476, test_f1: 0.5898
 epoch: 96, train_loss: 0.5091, test_loss: 1.6337, test_f1: 0.6050
 epoch: 97, train_loss: 0.4845, test_loss: 1.7195, test_f1: 0.6115
 epoch: 98, train_loss: 0.4870, test_loss: 1.6614, test_f1: 0.6194
 epoch: 99, train_loss: 0.4719, test_loss: 1.6873, test_f1: 0.5544
##################ITERATION #3 ****************************************
 epoch: 0, train_loss: 1.2078, test_loss: 1.1642, test_f1: 0.3282
 epoch: 1, train_loss: 1.0583, test_loss: 1.0520, test_f1: 0.5159
 epoch: 2, train_loss: 1.0059, test_loss: 1.0322, test_f1: 0.4788
 epoch: 3, train_loss: 0.9944, test_loss: 1.0347, test_f1: 0.4980
 epoch: 4, train_loss: 0.9527, test_loss: 1.1113, test_f1: 0.4574
 epoch: 5, train_loss: 0.9637, test_loss: 1.0945, test_f1: 0.4775
 epoch: 6, train_loss: 0.9465, test_loss: 1.1186, test_f1: 0.4817
 epoch: 7, train_loss: 0.9314, test_loss: 1.0332, test_f1: 0.5371
 epoch: 8, train_loss: 0.9078, test_loss: 1.1012, test_f1: 0.5368
 epoch: 9, train_loss: 0.9003, test_loss: 1.0432, test_f1: 0.5165
 epoch: 10, train_loss: 0.8878, test_loss: 1.0710, test_f1: 0.5424
 epoch: 11, train_loss: 0.8652, test_loss: 1.0943, test_f1: 0.5597
 epoch: 12, train_loss: 0.8301, test_loss: 1.0210, test_f1: 0.5508
 epoch: 13, train_loss: 0.8342, test_loss: 1.0055, test_f1: 0.5751
 epoch: 14, train_loss: 0.8239, test_loss: 1.0337, test_f1: 0.5798
 epoch: 15, train_loss: 0.8259, test_loss: 1.0105, test_f1: 0.5773
 epoch: 16, train_loss: 0.8052, test_loss: 1.0759, test_f1: 0.5739
 epoch: 17, train_loss: 0.8181, test_loss: 1.0558, test_f1: 0.5813
 epoch: 18, train_loss: 0.7943, test_loss: 1.0280, test_f1: 0.5790
 epoch: 19, train_loss: 0.7764, test_loss: 1.0691, test_f1: 0.5459
 epoch: 20, train_loss: 0.7827, test_loss: 1.0186, test_f1: 0.5687
 epoch: 21, train_loss: 0.7892, test_loss: 1.0390, test_f1: 0.5406
 epoch: 22, train_loss: 0.7795, test_loss: 1.0140, test_f1: 0.5901
 epoch: 23, train_loss: 0.7669, test_loss: 1.1639, test_f1: 0.4771
 epoch: 24, train_loss: 0.7654, test_loss: 1.0384, test_f1: 0.5791
 epoch: 25, train_loss: 0.7717, test_loss: 1.0606, test_f1: 0.5798
 epoch: 26, train_loss: 0.7790, test_loss: 1.0256, test_f1: 0.6013
 epoch: 27, train_loss: 0.7662, test_loss: 1.0765, test_f1: 0.5606
 epoch: 28, train_loss: 0.7269, test_loss: 1.0829, test_f1: 0.5536
 epoch: 29, train_loss: 0.7504, test_loss: 1.0644, test_f1: 0.5644
 epoch: 30, train_loss: 0.7145, test_loss: 1.1504, test_f1: 0.5502
 epoch: 31, train_loss: 0.7357, test_loss: 1.1813, test_f1: 0.5311
 epoch: 32, train_loss: 0.7118, test_loss: 1.1061, test_f1: 0.5933
 epoch: 33, train_loss: 0.7558, test_loss: 1.0498, test_f1: 0.5936
 epoch: 34, train_loss: 0.7282, test_loss: 1.1453, test_f1: 0.5325
 epoch: 35, train_loss: 0.7008, test_loss: 1.1746, test_f1: 0.5388
 epoch: 36, train_loss: 0.7342, test_loss: 1.1438, test_f1: 0.5328
 epoch: 37, train_loss: 0.7252, test_loss: 1.1026, test_f1: 0.5665
 epoch: 38, train_loss: 0.6959, test_loss: 1.1034, test_f1: 0.5706
 epoch: 39, train_loss: 0.6818, test_loss: 1.0705, test_f1: 0.5823
 epoch: 40, train_loss: 0.7125, test_loss: 1.1191, test_f1: 0.5783
 epoch: 41, train_loss: 0.6954, test_loss: 1.1945, test_f1: 0.5529
 epoch: 42, train_loss: 0.7029, test_loss: 1.1067, test_f1: 0.5535
 epoch: 43, train_loss: 0.6880, test_loss: 1.1037, test_f1: 0.5769
 epoch: 44, train_loss: 0.7048, test_loss: 1.1071, test_f1: 0.5610
 epoch: 45, train_loss: 0.7205, test_loss: 0.9611, test_f1: 0.5481
 epoch: 46, train_loss: 0.7117, test_loss: 1.0450, test_f1: 0.5990
 epoch: 47, train_loss: 0.6675, test_loss: 1.0382, test_f1: 0.5827
 epoch: 48, train_loss: 0.6832, test_loss: 1.1007, test_f1: 0.5546
 epoch: 49, train_loss: 0.6712, test_loss: 1.1064, test_f1: 0.5815
 epoch: 50, train_loss: 0.6716, test_loss: 1.0463, test_f1: 0.5794
 epoch: 51, train_loss: 0.6560, test_loss: 1.0968, test_f1: 0.5937
 epoch: 52, train_loss: 0.6258, test_loss: 1.0135, test_f1: 0.6075
 epoch: 53, train_loss: 0.5966, test_loss: 1.0435, test_f1: 0.5939
 epoch: 54, train_loss: 0.6152, test_loss: 1.0939, test_f1: 0.6113
 epoch: 55, train_loss: 0.6229, test_loss: 1.1024, test_f1: 0.6042
 epoch: 56, train_loss: 0.6203, test_loss: 1.1444, test_f1: 0.6035
 epoch: 57, train_loss: 0.6034, test_loss: 1.1540, test_f1: 0.5692
 epoch: 58, train_loss: 0.5831, test_loss: 1.1649, test_f1: 0.5812
 epoch: 59, train_loss: 0.6094, test_loss: 1.1341, test_f1: 0.5956
 epoch: 60, train_loss: 0.5986, test_loss: 1.1688, test_f1: 0.6074
 epoch: 61, train_loss: 0.5853, test_loss: 1.1968, test_f1: 0.6128
 epoch: 62, train_loss: 0.5963, test_loss: 1.1408, test_f1: 0.6191
 epoch: 63, train_loss: 0.5755, test_loss: 1.1155, test_f1: 0.6299
 epoch: 64, train_loss: 0.5788, test_loss: 1.1554, test_f1: 0.5831
 epoch: 65, train_loss: 0.5659, test_loss: 1.1473, test_f1: 0.6215
 epoch: 66, train_loss: 0.5806, test_loss: 1.1650, test_f1: 0.6089
 epoch: 67, train_loss: 0.5783, test_loss: 1.1494, test_f1: 0.6411
 epoch: 68, train_loss: 0.5502, test_loss: 1.1991, test_f1: 0.6009
 epoch: 69, train_loss: 0.5650, test_loss: 1.2546, test_f1: 0.5856
 epoch: 70, train_loss: 0.5670, test_loss: 1.1913, test_f1: 0.5844
 epoch: 71, train_loss: 0.5517, test_loss: 1.1811, test_f1: 0.6005
 epoch: 72, train_loss: 0.5746, test_loss: 1.1378, test_f1: 0.5980
 epoch: 73, train_loss: 0.5542, test_loss: 1.1719, test_f1: 0.5766
 epoch: 74, train_loss: 0.5456, test_loss: 1.2116, test_f1: 0.5456
 epoch: 75, train_loss: 0.5871, test_loss: 1.1548, test_f1: 0.6282
 epoch: 76, train_loss: 0.5270, test_loss: 1.2585, test_f1: 0.5808
 epoch: 77, train_loss: 0.5672, test_loss: 1.2014, test_f1: 0.5852
 epoch: 78, train_loss: 0.5334, test_loss: 1.3043, test_f1: 0.5961
 epoch: 79, train_loss: 0.5158, test_loss: 1.2344, test_f1: 0.6177
 epoch: 80, train_loss: 0.5490, test_loss: 1.2394, test_f1: 0.6106
 epoch: 81, train_loss: 0.5546, test_loss: 1.2845, test_f1: 0.6148
 epoch: 82, train_loss: 0.5463, test_loss: 1.1706, test_f1: 0.6123
 epoch: 83, train_loss: 0.5187, test_loss: 1.2454, test_f1: 0.6139
 epoch: 84, train_loss: 0.5299, test_loss: 1.1894, test_f1: 0.6149
 epoch: 85, train_loss: 0.5091, test_loss: 1.2655, test_f1: 0.6119
 epoch: 86, train_loss: 0.5527, test_loss: 1.2732, test_f1: 0.6100
 epoch: 87, train_loss: 0.5259, test_loss: 1.2202, test_f1: 0.6097
 epoch: 88, train_loss: 0.5287, test_loss: 1.2692, test_f1: 0.6360
 epoch: 89, train_loss: 0.5112, test_loss: 1.3594, test_f1: 0.5808
 epoch: 90, train_loss: 0.5243, test_loss: 1.2471, test_f1: 0.5884
 epoch: 91, train_loss: 0.5201, test_loss: 1.2767, test_f1: 0.6161
 epoch: 92, train_loss: 0.4928, test_loss: 1.2791, test_f1: 0.5976
 epoch: 93, train_loss: 0.5339, test_loss: 1.2944, test_f1: 0.6106
 epoch: 94, train_loss: 0.5174, test_loss: 1.1877, test_f1: 0.5877
 epoch: 95, train_loss: 0.5187, test_loss: 1.2388, test_f1: 0.6214
 epoch: 96, train_loss: 0.4702, test_loss: 1.4577, test_f1: 0.5655
 epoch: 97, train_loss: 0.4948, test_loss: 1.3398, test_f1: 0.6211
 epoch: 98, train_loss: 0.5217, test_loss: 1.2395, test_f1: 0.5937
 epoch: 99, train_loss: 0.4883, test_loss: 1.3293, test_f1: 0.6026
##################ITERATION #4 ****************************************
 epoch: 0, train_loss: 1.2234, test_loss: 1.1552, test_f1: 0.3672
 epoch: 1, train_loss: 1.0677, test_loss: 1.1076, test_f1: 0.3896
 epoch: 2, train_loss: 1.0175, test_loss: 1.1109, test_f1: 0.4165
 epoch: 3, train_loss: 0.9940, test_loss: 1.1107, test_f1: 0.4808
 epoch: 4, train_loss: 0.9846, test_loss: 1.0408, test_f1: 0.4800
 epoch: 5, train_loss: 0.9795, test_loss: 1.0712, test_f1: 0.4616
 epoch: 6, train_loss: 0.9887, test_loss: 1.0412, test_f1: 0.5010
 epoch: 7, train_loss: 0.9544, test_loss: 1.0717, test_f1: 0.4787
 epoch: 8, train_loss: 0.9515, test_loss: 1.0081, test_f1: 0.5380
 epoch: 9, train_loss: 0.9371, test_loss: 1.0665, test_f1: 0.5128
 epoch: 10, train_loss: 0.9354, test_loss: 1.0543, test_f1: 0.4877
 epoch: 11, train_loss: 0.9218, test_loss: 1.1610, test_f1: 0.5272
 epoch: 12, train_loss: 0.9108, test_loss: 1.0364, test_f1: 0.5038
 epoch: 13, train_loss: 0.9007, test_loss: 1.1335, test_f1: 0.5026
 epoch: 14, train_loss: 0.8852, test_loss: 1.0182, test_f1: 0.5185
 epoch: 15, train_loss: 0.8973, test_loss: 1.1412, test_f1: 0.5299
 epoch: 16, train_loss: 0.8898, test_loss: 1.0309, test_f1: 0.5592
 epoch: 17, train_loss: 0.8791, test_loss: 0.9879, test_f1: 0.5939
 epoch: 18, train_loss: 0.8572, test_loss: 1.0200, test_f1: 0.5680
 epoch: 19, train_loss: 0.8537, test_loss: 1.1740, test_f1: 0.5466
 epoch: 20, train_loss: 0.8541, test_loss: 1.0531, test_f1: 0.5698
 epoch: 21, train_loss: 0.8349, test_loss: 1.0255, test_f1: 0.5684
 epoch: 22, train_loss: 0.8072, test_loss: 1.1244, test_f1: 0.5374
 epoch: 23, train_loss: 0.8082, test_loss: 1.1371, test_f1: 0.5325
 epoch: 24, train_loss: 0.8109, test_loss: 1.2477, test_f1: 0.5145
 epoch: 25, train_loss: 0.7743, test_loss: 1.0783, test_f1: 0.5642
 epoch: 26, train_loss: 0.7802, test_loss: 1.1486, test_f1: 0.5461
 epoch: 27, train_loss: 0.7680, test_loss: 1.1975, test_f1: 0.5484
 epoch: 28, train_loss: 0.7635, test_loss: 1.1192, test_f1: 0.5232
 epoch: 29, train_loss: 0.7565, test_loss: 1.1231, test_f1: 0.5710
 epoch: 30, train_loss: 0.7655, test_loss: 1.0820, test_f1: 0.5600
 epoch: 31, train_loss: 0.7731, test_loss: 1.0749, test_f1: 0.5330
 epoch: 32, train_loss: 0.7681, test_loss: 1.1596, test_f1: 0.5790
 epoch: 33, train_loss: 0.7526, test_loss: 1.1220, test_f1: 0.5258
 epoch: 34, train_loss: 0.7538, test_loss: 1.1137, test_f1: 0.5731
 epoch: 35, train_loss: 0.7379, test_loss: 1.0605, test_f1: 0.6016
 epoch: 36, train_loss: 0.7431, test_loss: 1.1111, test_f1: 0.5768
 epoch: 37, train_loss: 0.7092, test_loss: 1.0958, test_f1: 0.5608
 epoch: 38, train_loss: 0.7306, test_loss: 1.1072, test_f1: 0.5763
 epoch: 39, train_loss: 0.7367, test_loss: 1.2130, test_f1: 0.5588
 epoch: 40, train_loss: 0.7146, test_loss: 1.1718, test_f1: 0.5495
 epoch: 41, train_loss: 0.6967, test_loss: 1.0888, test_f1: 0.5709
 epoch: 42, train_loss: 0.7162, test_loss: 1.2019, test_f1: 0.5375
 epoch: 43, train_loss: 0.7037, test_loss: 1.1577, test_f1: 0.5346
 epoch: 44, train_loss: 0.7058, test_loss: 1.1736, test_f1: 0.5464
 epoch: 45, train_loss: 0.7116, test_loss: 1.1586, test_f1: 0.5705
 epoch: 46, train_loss: 0.6910, test_loss: 1.2055, test_f1: 0.5431
 epoch: 47, train_loss: 0.6853, test_loss: 1.2734, test_f1: 0.5572
 epoch: 48, train_loss: 0.6767, test_loss: 1.2179, test_f1: 0.5858
 epoch: 49, train_loss: 0.7034, test_loss: 1.1539, test_f1: 0.5652
 epoch: 50, train_loss: 0.6969, test_loss: 1.1601, test_f1: 0.5342
 epoch: 51, train_loss: 0.6461, test_loss: 1.2926, test_f1: 0.5770
 epoch: 52, train_loss: 0.6327, test_loss: 1.1412, test_f1: 0.5827
 epoch: 53, train_loss: 0.6123, test_loss: 1.1531, test_f1: 0.5727
 epoch: 54, train_loss: 0.6371, test_loss: 1.1201, test_f1: 0.5895
 epoch: 55, train_loss: 0.6108, test_loss: 1.3077, test_f1: 0.5585
 epoch: 56, train_loss: 0.6117, test_loss: 1.1732, test_f1: 0.5611
 epoch: 57, train_loss: 0.6044, test_loss: 1.2834, test_f1: 0.5652
 epoch: 58, train_loss: 0.6082, test_loss: 1.3384, test_f1: 0.5698
 epoch: 59, train_loss: 0.5961, test_loss: 1.5093, test_f1: 0.5451
 epoch: 60, train_loss: 0.6239, test_loss: 1.3274, test_f1: 0.5457
 epoch: 61, train_loss: 0.5918, test_loss: 1.3915, test_f1: 0.5780
 epoch: 62, train_loss: 0.5953, test_loss: 1.4400, test_f1: 0.5526
 epoch: 63, train_loss: 0.6042, test_loss: 1.3535, test_f1: 0.5327
 epoch: 64, train_loss: 0.5990, test_loss: 1.2297, test_f1: 0.5835
 epoch: 65, train_loss: 0.5823, test_loss: 1.3029, test_f1: 0.5794
 epoch: 66, train_loss: 0.5911, test_loss: 1.4294, test_f1: 0.5722
 epoch: 67, train_loss: 0.5730, test_loss: 1.4122, test_f1: 0.5717
 epoch: 68, train_loss: 0.5524, test_loss: 1.4365, test_f1: 0.5708
 epoch: 69, train_loss: 0.5832, test_loss: 1.3755, test_f1: 0.5646
 epoch: 70, train_loss: 0.5773, test_loss: 1.4428, test_f1: 0.5628
 epoch: 71, train_loss: 0.5778, test_loss: 1.3724, test_f1: 0.5901
 epoch: 72, train_loss: 0.6124, test_loss: 1.3356, test_f1: 0.5652
 epoch: 73, train_loss: 0.5585, test_loss: 1.3499, test_f1: 0.5723
 epoch: 74, train_loss: 0.5679, test_loss: 1.3355, test_f1: 0.5699
 epoch: 75, train_loss: 0.5545, test_loss: 1.6066, test_f1: 0.5282
 epoch: 76, train_loss: 0.5498, test_loss: 1.2970, test_f1: 0.5940
 epoch: 77, train_loss: 0.5583, test_loss: 1.5402, test_f1: 0.5681
 epoch: 78, train_loss: 0.5388, test_loss: 1.3532, test_f1: 0.5903
 epoch: 79, train_loss: 0.5913, test_loss: 1.3598, test_f1: 0.6042
 epoch: 80, train_loss: 0.5726, test_loss: 1.3209, test_f1: 0.5763
 epoch: 81, train_loss: 0.5466, test_loss: 1.3203, test_f1: 0.5965
 epoch: 82, train_loss: 0.5573, test_loss: 1.4094, test_f1: 0.5763
 epoch: 83, train_loss: 0.5444, test_loss: 1.3526, test_f1: 0.5838
 epoch: 84, train_loss: 0.5361, test_loss: 1.3406, test_f1: 0.5858
 epoch: 85, train_loss: 0.5351, test_loss: 1.3943, test_f1: 0.5685
 epoch: 86, train_loss: 0.5278, test_loss: 1.4478, test_f1: 0.5959
 epoch: 87, train_loss: 0.5295, test_loss: 1.3846, test_f1: 0.6249
 epoch: 88, train_loss: 0.5170, test_loss: 1.4678, test_f1: 0.5873
 epoch: 89, train_loss: 0.5388, test_loss: 1.4657, test_f1: 0.5798
 epoch: 90, train_loss: 0.5291, test_loss: 1.4997, test_f1: 0.5769
 epoch: 91, train_loss: 0.5301, test_loss: 1.4611, test_f1: 0.5779
 epoch: 92, train_loss: 0.4921, test_loss: 1.4580, test_f1: 0.5954
 epoch: 93, train_loss: 0.5466, test_loss: 1.4150, test_f1: 0.5683
 epoch: 94, train_loss: 0.5265, test_loss: 1.4610, test_f1: 0.5439
 epoch: 95, train_loss: 0.5268, test_loss: 1.3914, test_f1: 0.5876
 epoch: 96, train_loss: 0.5776, test_loss: 1.4635, test_f1: 0.5341
 epoch: 97, train_loss: 0.5094, test_loss: 1.4622, test_f1: 0.5994
 epoch: 98, train_loss: 0.5264, test_loss: 1.3820, test_f1: 0.5731
 epoch: 99, train_loss: 0.4988, test_loss: 1.4807, test_f1: 0.6117
##################ITERATION #5 ****************************************
 epoch: 0, train_loss: 1.2058, test_loss: 1.2001, test_f1: 0.4274
 epoch: 1, train_loss: 1.0630, test_loss: 1.1076, test_f1: 0.4908
 epoch: 2, train_loss: 1.0157, test_loss: 1.0786, test_f1: 0.4913
 epoch: 3, train_loss: 0.9821, test_loss: 1.1087, test_f1: 0.4626
 epoch: 4, train_loss: 0.9729, test_loss: 1.0797, test_f1: 0.5031
 epoch: 5, train_loss: 0.9800, test_loss: 1.0569, test_f1: 0.5235
 epoch: 6, train_loss: 0.9626, test_loss: 1.0843, test_f1: 0.5161
 epoch: 7, train_loss: 0.9566, test_loss: 1.0200, test_f1: 0.5050
 epoch: 8, train_loss: 0.9439, test_loss: 1.1187, test_f1: 0.4706
 epoch: 9, train_loss: 0.9601, test_loss: 1.0334, test_f1: 0.5455
 epoch: 10, train_loss: 0.9280, test_loss: 1.1792, test_f1: 0.4306
 epoch: 11, train_loss: 0.9222, test_loss: 1.0008, test_f1: 0.5209
 epoch: 12, train_loss: 0.9340, test_loss: 1.0453, test_f1: 0.5244
 epoch: 13, train_loss: 0.9345, test_loss: 1.1549, test_f1: 0.5322
 epoch: 14, train_loss: 0.9263, test_loss: 1.0032, test_f1: 0.5390
 epoch: 15, train_loss: 0.9344, test_loss: 1.0714, test_f1: 0.4989
 epoch: 16, train_loss: 0.8804, test_loss: 1.2829, test_f1: 0.4003
 epoch: 17, train_loss: 0.9195, test_loss: 1.0179, test_f1: 0.5532
 epoch: 18, train_loss: 0.8825, test_loss: 1.0622, test_f1: 0.5624
 epoch: 19, train_loss: 0.8678, test_loss: 1.1337, test_f1: 0.4987
 epoch: 20, train_loss: 0.8900, test_loss: 1.0843, test_f1: 0.5226
 epoch: 21, train_loss: 0.8661, test_loss: 1.0162, test_f1: 0.5690
 epoch: 22, train_loss: 0.8509, test_loss: 1.1413, test_f1: 0.4933
 epoch: 23, train_loss: 0.8762, test_loss: 1.1059, test_f1: 0.5258
 epoch: 24, train_loss: 0.8280, test_loss: 1.0664, test_f1: 0.5685
 epoch: 25, train_loss: 0.8107, test_loss: 0.9988, test_f1: 0.5523
 epoch: 26, train_loss: 0.8136, test_loss: 1.0116, test_f1: 0.5754
 epoch: 27, train_loss: 0.8309, test_loss: 1.1089, test_f1: 0.5609
 epoch: 28, train_loss: 0.8110, test_loss: 1.9385, test_f1: 0.4092
 epoch: 29, train_loss: 0.8153, test_loss: 1.0531, test_f1: 0.5393
 epoch: 30, train_loss: 0.7974, test_loss: 1.1042, test_f1: 0.5018
 epoch: 31, train_loss: 0.7975, test_loss: 1.1376, test_f1: 0.5034
 epoch: 32, train_loss: 0.7829, test_loss: 1.1371, test_f1: 0.5216
 epoch: 33, train_loss: 0.7631, test_loss: 1.1440, test_f1: 0.5130
 epoch: 34, train_loss: 0.7676, test_loss: 1.2844, test_f1: 0.5702
 epoch: 35, train_loss: 0.7708, test_loss: 1.1364, test_f1: 0.5562
 epoch: 36, train_loss: 0.7972, test_loss: 1.1223, test_f1: 0.5553
 epoch: 37, train_loss: 0.7705, test_loss: 1.1357, test_f1: 0.5230
 epoch: 38, train_loss: 0.7601, test_loss: 1.2153, test_f1: 0.5245
 epoch: 39, train_loss: 0.7462, test_loss: 1.2196, test_f1: 0.5379
 epoch: 40, train_loss: 0.7488, test_loss: 1.2787, test_f1: 0.4544
 epoch: 41, train_loss: 0.7790, test_loss: 1.3017, test_f1: 0.5617
 epoch: 42, train_loss: 0.7317, test_loss: 1.2283, test_f1: 0.5066
 epoch: 43, train_loss: 0.7638, test_loss: 1.2416, test_f1: 0.5307
 epoch: 44, train_loss: 0.7540, test_loss: 1.2303, test_f1: 0.5507
 epoch: 45, train_loss: 0.7442, test_loss: 1.2260, test_f1: 0.5682
 epoch: 46, train_loss: 0.7057, test_loss: 1.1568, test_f1: 0.5546
 epoch: 47, train_loss: 0.7650, test_loss: 1.2269, test_f1: 0.5420
 epoch: 48, train_loss: 0.7254, test_loss: 1.0788, test_f1: 0.5691
 epoch: 49, train_loss: 0.7450, test_loss: 1.1257, test_f1: 0.5573
 epoch: 50, train_loss: 0.7042, test_loss: 1.1571, test_f1: 0.5496
 epoch: 51, train_loss: 0.7060, test_loss: 1.2801, test_f1: 0.5485
 epoch: 52, train_loss: 0.6697, test_loss: 1.3127, test_f1: 0.5558
 epoch: 53, train_loss: 0.6754, test_loss: 1.2121, test_f1: 0.5680
 epoch: 54, train_loss: 0.6811, test_loss: 1.1875, test_f1: 0.5617
 epoch: 55, train_loss: 0.6794, test_loss: 1.2809, test_f1: 0.5574
 epoch: 56, train_loss: 0.6722, test_loss: 1.2445, test_f1: 0.5156
 epoch: 57, train_loss: 0.6707, test_loss: 1.2065, test_f1: 0.5783
 epoch: 58, train_loss: 0.6652, test_loss: 1.1514, test_f1: 0.5737
 epoch: 59, train_loss: 0.6671, test_loss: 1.2153, test_f1: 0.5722
 epoch: 60, train_loss: 0.6568, test_loss: 1.2238, test_f1: 0.5426
 epoch: 61, train_loss: 0.6412, test_loss: 1.2333, test_f1: 0.5711
 epoch: 62, train_loss: 0.6497, test_loss: 1.3388, test_f1: 0.5533
 epoch: 63, train_loss: 0.6384, test_loss: 1.2196, test_f1: 0.5882
 epoch: 64, train_loss: 0.6515, test_loss: 1.3413, test_f1: 0.5646
 epoch: 65, train_loss: 0.6378, test_loss: 1.1493, test_f1: 0.5778
 epoch: 66, train_loss: 0.6687, test_loss: 1.1115, test_f1: 0.5692
 epoch: 67, train_loss: 0.6223, test_loss: 1.2359, test_f1: 0.5691
 epoch: 68, train_loss: 0.6293, test_loss: 1.4089, test_f1: 0.5568
 epoch: 69, train_loss: 0.6301, test_loss: 1.3691, test_f1: 0.6067
 epoch: 70, train_loss: 0.6404, test_loss: 1.4299, test_f1: 0.5396
 epoch: 71, train_loss: 0.6359, test_loss: 1.3703, test_f1: 0.5349
 epoch: 72, train_loss: 0.6262, test_loss: 1.3980, test_f1: 0.5416
 epoch: 73, train_loss: 0.7479, test_loss: 1.0827, test_f1: 0.5908
 epoch: 74, train_loss: 0.6761, test_loss: 1.3159, test_f1: 0.5479
 epoch: 75, train_loss: 0.6393, test_loss: 1.2094, test_f1: 0.6015
 epoch: 76, train_loss: 0.6019, test_loss: 1.2557, test_f1: 0.5898
 epoch: 77, train_loss: 0.6232, test_loss: 1.2698, test_f1: 0.6003
 epoch: 78, train_loss: 0.6189, test_loss: 1.1988, test_f1: 0.6038
 epoch: 79, train_loss: 0.5891, test_loss: 1.3260, test_f1: 0.5913
 epoch: 80, train_loss: 0.6261, test_loss: 1.2527, test_f1: 0.5869
 epoch: 81, train_loss: 0.6054, test_loss: 1.2670, test_f1: 0.5954
 epoch: 82, train_loss: 0.5961, test_loss: 1.3563, test_f1: 0.5849
 epoch: 83, train_loss: 0.5826, test_loss: 1.2662, test_f1: 0.6170
 epoch: 84, train_loss: 0.5933, test_loss: 1.2122, test_f1: 0.5963
 epoch: 85, train_loss: 0.6134, test_loss: 1.5335, test_f1: 0.5953
 epoch: 86, train_loss: 0.6093, test_loss: 1.3397, test_f1: 0.5813
 epoch: 87, train_loss: 0.5975, test_loss: 1.2290, test_f1: 0.6170
 epoch: 88, train_loss: 0.5791, test_loss: 1.4066, test_f1: 0.6102
 epoch: 89, train_loss: 0.5854, test_loss: 1.3474, test_f1: 0.6032
 epoch: 90, train_loss: 0.6074, test_loss: 1.3703, test_f1: 0.5673
 epoch: 91, train_loss: 0.5922, test_loss: 1.3068, test_f1: 0.5803
 epoch: 92, train_loss: 0.5627, test_loss: 1.3367, test_f1: 0.6193
 epoch: 93, train_loss: 0.5803, test_loss: 1.5200, test_f1: 0.5873
 epoch: 94, train_loss: 0.5697, test_loss: 1.3905, test_f1: 0.6131
 epoch: 95, train_loss: 0.5957, test_loss: 1.3563, test_f1: 0.6186
 epoch: 96, train_loss: 0.5763, test_loss: 1.3452, test_f1: 0.5859
 epoch: 97, train_loss: 0.5713, test_loss: 1.3995, test_f1: 0.6602
 epoch: 98, train_loss: 0.5590, test_loss: 1.3742, test_f1: 0.6245
 epoch: 99, train_loss: 0.5655, test_loss: 1.6203, test_f1: 0.5795
##################ITERATION #6 ****************************************
 epoch: 0, train_loss: 1.2050, test_loss: 1.2252, test_f1: 0.3969
 epoch: 1, train_loss: 1.0681, test_loss: 1.0805, test_f1: 0.4467
 epoch: 2, train_loss: 1.0174, test_loss: 1.0455, test_f1: 0.5260
 epoch: 3, train_loss: 1.0001, test_loss: 1.1151, test_f1: 0.4908
 epoch: 4, train_loss: 0.9764, test_loss: 1.0675, test_f1: 0.4877
 epoch: 5, train_loss: 0.9622, test_loss: 1.1199, test_f1: 0.5033
 epoch: 6, train_loss: 0.9566, test_loss: 1.1880, test_f1: 0.4472
 epoch: 7, train_loss: 0.9253, test_loss: 1.1132, test_f1: 0.4851
 epoch: 8, train_loss: 0.8918, test_loss: 1.0071, test_f1: 0.5838
 epoch: 9, train_loss: 0.9015, test_loss: 1.0222, test_f1: 0.5491
 epoch: 10, train_loss: 0.9204, test_loss: 1.0058, test_f1: 0.4950
 epoch: 11, train_loss: 0.9163, test_loss: 0.9784, test_f1: 0.5421
 epoch: 12, train_loss: 0.8947, test_loss: 1.1075, test_f1: 0.5318
 epoch: 13, train_loss: 0.8850, test_loss: 1.3961, test_f1: 0.4847
 epoch: 14, train_loss: 0.8576, test_loss: 1.1412, test_f1: 0.5313
 epoch: 15, train_loss: 0.8484, test_loss: 1.0804, test_f1: 0.5373
 epoch: 16, train_loss: 0.8867, test_loss: 1.0183, test_f1: 0.5315
 epoch: 17, train_loss: 0.8416, test_loss: 0.9995, test_f1: 0.5360
 epoch: 18, train_loss: 0.8257, test_loss: 0.9904, test_f1: 0.5985
 epoch: 19, train_loss: 0.8468, test_loss: 1.0210, test_f1: 0.5604
 epoch: 20, train_loss: 0.8116, test_loss: 1.0192, test_f1: 0.6006
 epoch: 21, train_loss: 0.7895, test_loss: 1.0285, test_f1: 0.5746
 epoch: 22, train_loss: 0.7865, test_loss: 1.0394, test_f1: 0.5412
 epoch: 23, train_loss: 0.7988, test_loss: 1.0026, test_f1: 0.5596
 epoch: 24, train_loss: 0.7855, test_loss: 1.1142, test_f1: 0.5478
 epoch: 25, train_loss: 0.8002, test_loss: 1.1831, test_f1: 0.5405
 epoch: 26, train_loss: 0.7832, test_loss: 1.0535, test_f1: 0.5569
 epoch: 27, train_loss: 0.7660, test_loss: 1.2284, test_f1: 0.5629
 epoch: 28, train_loss: 0.7740, test_loss: 1.1385, test_f1: 0.5424
 epoch: 29, train_loss: 0.7745, test_loss: 1.0278, test_f1: 0.6167
 epoch: 30, train_loss: 0.7527, test_loss: 1.1531, test_f1: 0.5650
 epoch: 31, train_loss: 0.7751, test_loss: 1.0468, test_f1: 0.5759
 epoch: 32, train_loss: 0.7512, test_loss: 1.1853, test_f1: 0.5504
 epoch: 33, train_loss: 0.7692, test_loss: 1.0393, test_f1: 0.5987
 epoch: 34, train_loss: 0.7719, test_loss: 1.0544, test_f1: 0.6165
 epoch: 35, train_loss: 0.7480, test_loss: 1.0797, test_f1: 0.5842
 epoch: 36, train_loss: 0.7491, test_loss: 1.1663, test_f1: 0.5598
 epoch: 37, train_loss: 0.7174, test_loss: 1.0946, test_f1: 0.5787
 epoch: 38, train_loss: 0.7430, test_loss: 1.2915, test_f1: 0.5634
 epoch: 39, train_loss: 0.7526, test_loss: 1.2306, test_f1: 0.5735
 epoch: 40, train_loss: 0.7358, test_loss: 1.0268, test_f1: 0.5982
 epoch: 41, train_loss: 0.7304, test_loss: 1.2289, test_f1: 0.6074
 epoch: 42, train_loss: 0.7358, test_loss: 1.1236, test_f1: 0.5712
 epoch: 43, train_loss: 0.7362, test_loss: 1.0941, test_f1: 0.5730
 epoch: 44, train_loss: 0.7406, test_loss: 1.3639, test_f1: 0.5308
 epoch: 45, train_loss: 0.7423, test_loss: 1.1437, test_f1: 0.6044
 epoch: 46, train_loss: 0.7213, test_loss: 1.1737, test_f1: 0.5368
 epoch: 47, train_loss: 0.7155, test_loss: 1.2145, test_f1: 0.5664
 epoch: 48, train_loss: 0.7361, test_loss: 1.2887, test_f1: 0.5869
 epoch: 49, train_loss: 0.7484, test_loss: 1.1755, test_f1: 0.6157
 epoch: 50, train_loss: 0.7096, test_loss: 1.1911, test_f1: 0.5941
 epoch: 51, train_loss: 0.6685, test_loss: 1.2609, test_f1: 0.6001
 epoch: 52, train_loss: 0.6628, test_loss: 1.2598, test_f1: 0.6173
 epoch: 53, train_loss: 0.6613, test_loss: 1.2766, test_f1: 0.5818
 epoch: 54, train_loss: 0.6753, test_loss: 1.2786, test_f1: 0.6117
 epoch: 55, train_loss: 0.6673, test_loss: 1.2427, test_f1: 0.6060
 epoch: 56, train_loss: 0.6397, test_loss: 1.3003, test_f1: 0.5829
 epoch: 57, train_loss: 0.6740, test_loss: 1.2631, test_f1: 0.5931
 epoch: 58, train_loss: 0.6530, test_loss: 1.3406, test_f1: 0.6162
 epoch: 59, train_loss: 0.6482, test_loss: 1.3699, test_f1: 0.5948
 epoch: 60, train_loss: 0.6428, test_loss: 1.3118, test_f1: 0.5983
 epoch: 61, train_loss: 0.6605, test_loss: 1.3536, test_f1: 0.6359
 epoch: 62, train_loss: 0.6406, test_loss: 1.4046, test_f1: 0.6040
 epoch: 63, train_loss: 0.6547, test_loss: 1.3605, test_f1: 0.6145
 epoch: 64, train_loss: 0.6510, test_loss: 1.4032, test_f1: 0.5237
 epoch: 65, train_loss: 0.6188, test_loss: 1.4490, test_f1: 0.5738
 epoch: 66, train_loss: 0.6537, test_loss: 1.3861, test_f1: 0.6180
 epoch: 67, train_loss: 0.6380, test_loss: 1.3570, test_f1: 0.5473
 epoch: 68, train_loss: 0.6379, test_loss: 1.4248, test_f1: 0.5559
 epoch: 69, train_loss: 0.6444, test_loss: 1.3590, test_f1: 0.6078
 epoch: 70, train_loss: 0.6258, test_loss: 1.3413, test_f1: 0.5954
 epoch: 71, train_loss: 0.6295, test_loss: 1.4397, test_f1: 0.6043
 epoch: 72, train_loss: 0.6199, test_loss: 1.4564, test_f1: 0.5948
 epoch: 73, train_loss: 0.6065, test_loss: 1.3823, test_f1: 0.6179
 epoch: 74, train_loss: 0.6078, test_loss: 1.4788, test_f1: 0.5789
 epoch: 75, train_loss: 0.5884, test_loss: 1.4633, test_f1: 0.5754
 epoch: 76, train_loss: 0.6049, test_loss: 1.3689, test_f1: 0.5948
 epoch: 77, train_loss: 0.6190, test_loss: 1.5540, test_f1: 0.5988
 epoch: 78, train_loss: 0.6053, test_loss: 1.3990, test_f1: 0.6155
 epoch: 79, train_loss: 0.5946, test_loss: 1.4167, test_f1: 0.5887
 epoch: 80, train_loss: 0.6113, test_loss: 1.4146, test_f1: 0.5940
 epoch: 81, train_loss: 0.5979, test_loss: 1.6213, test_f1: 0.6089
 epoch: 82, train_loss: 0.5839, test_loss: 1.6069, test_f1: 0.5872
 epoch: 83, train_loss: 0.5739, test_loss: 1.5019, test_f1: 0.6036
 epoch: 84, train_loss: 0.5799, test_loss: 1.4696, test_f1: 0.5949
 epoch: 85, train_loss: 0.5644, test_loss: 1.6842, test_f1: 0.6255
 epoch: 86, train_loss: 0.5944, test_loss: 1.6551, test_f1: 0.5381
 epoch: 87, train_loss: 0.5814, test_loss: 1.4629, test_f1: 0.6165
 epoch: 88, train_loss: 0.5886, test_loss: 1.4862, test_f1: 0.6315
 epoch: 89, train_loss: 0.5942, test_loss: 1.4467, test_f1: 0.5903
 epoch: 90, train_loss: 0.5974, test_loss: 1.4882, test_f1: 0.6252
 epoch: 91, train_loss: 0.5874, test_loss: 1.6443, test_f1: 0.5966
 epoch: 92, train_loss: 0.5678, test_loss: 1.4529, test_f1: 0.6163
 epoch: 93, train_loss: 0.5869, test_loss: 1.4509, test_f1: 0.5602
 epoch: 94, train_loss: 0.6195, test_loss: 1.2815, test_f1: 0.6121
 epoch: 95, train_loss: 0.6091, test_loss: 1.4035, test_f1: 0.6222
 epoch: 96, train_loss: 0.5878, test_loss: 1.4049, test_f1: 0.5962
 epoch: 97, train_loss: 0.5699, test_loss: 1.4262, test_f1: 0.6354
 epoch: 98, train_loss: 0.5708, test_loss: 1.7730, test_f1: 0.6117
 epoch: 99, train_loss: 0.6010, test_loss: 1.4923, test_f1: 0.5914
##################ITERATION #7 ****************************************
 epoch: 0, train_loss: 1.1908, test_loss: 1.1928, test_f1: 0.3489
 epoch: 1, train_loss: 1.0340, test_loss: 1.0831, test_f1: 0.4905
 epoch: 2, train_loss: 0.9907, test_loss: 1.0694, test_f1: 0.5024
 epoch: 3, train_loss: 0.9985, test_loss: 1.0735, test_f1: 0.4689
 epoch: 4, train_loss: 0.9546, test_loss: 1.0358, test_f1: 0.4985
 epoch: 5, train_loss: 0.9418, test_loss: 1.1125, test_f1: 0.4784
 epoch: 6, train_loss: 0.9295, test_loss: 1.0056, test_f1: 0.4979
 epoch: 7, train_loss: 0.9314, test_loss: 1.0354, test_f1: 0.5289
 epoch: 8, train_loss: 0.9211, test_loss: 7.6781, test_f1: 0.2229
 epoch: 9, train_loss: 0.9254, test_loss: 1.0193, test_f1: 0.5358
 epoch: 10, train_loss: 0.9136, test_loss: 1.0244, test_f1: 0.5609
 epoch: 11, train_loss: 0.9059, test_loss: 0.9840, test_f1: 0.5448
 epoch: 12, train_loss: 0.8948, test_loss: 0.9903, test_f1: 0.5001
 epoch: 13, train_loss: 0.8665, test_loss: 0.9888, test_f1: 0.5376
 epoch: 14, train_loss: 0.8609, test_loss: 0.9737, test_f1: 0.5632
 epoch: 15, train_loss: 0.8756, test_loss: 1.0994, test_f1: 0.5082
 epoch: 16, train_loss: 0.8727, test_loss: 1.0721, test_f1: 0.5041
 epoch: 17, train_loss: 0.8455, test_loss: 1.0302, test_f1: 0.5057
 epoch: 18, train_loss: 0.8214, test_loss: 1.0126, test_f1: 0.5252
 epoch: 19, train_loss: 0.8048, test_loss: 1.0127, test_f1: 0.5345
 epoch: 20, train_loss: 0.8224, test_loss: 0.9916, test_f1: 0.5280
 epoch: 21, train_loss: 0.7913, test_loss: 1.0153, test_f1: 0.5612
 epoch: 22, train_loss: 0.7892, test_loss: 1.0149, test_f1: 0.5361
 epoch: 23, train_loss: 0.7873, test_loss: 1.0102, test_f1: 0.5531
 epoch: 24, train_loss: 0.7917, test_loss: 1.0982, test_f1: 0.5646
 epoch: 25, train_loss: 0.7800, test_loss: 1.0224, test_f1: 0.5940
 epoch: 26, train_loss: 0.7854, test_loss: 1.0407, test_f1: 0.5332
 epoch: 27, train_loss: 0.8021, test_loss: 1.1534, test_f1: 0.4559
 epoch: 28, train_loss: 0.7950, test_loss: 1.0697, test_f1: 0.5394
 epoch: 29, train_loss: 0.7650, test_loss: 1.1004, test_f1: 0.4985
 epoch: 30, train_loss: 0.7730, test_loss: 1.0138, test_f1: 0.5647
 epoch: 31, train_loss: 0.7530, test_loss: 1.0531, test_f1: 0.5348
 epoch: 32, train_loss: 0.7657, test_loss: 1.2087, test_f1: 0.5037
 epoch: 33, train_loss: 0.7497, test_loss: 1.0938, test_f1: 0.5307
 epoch: 34, train_loss: 0.7500, test_loss: 1.0582, test_f1: 0.5561
 epoch: 35, train_loss: 0.7318, test_loss: 1.2152, test_f1: 0.5613
 epoch: 36, train_loss: 0.7294, test_loss: 1.0856, test_f1: 0.5403
 epoch: 37, train_loss: 0.7404, test_loss: 1.0926, test_f1: 0.5356
 epoch: 38, train_loss: 0.7326, test_loss: 1.2374, test_f1: 0.5362
 epoch: 39, train_loss: 0.7373, test_loss: 1.1547, test_f1: 0.5746
 epoch: 40, train_loss: 0.7371, test_loss: 1.2773, test_f1: 0.5175
 epoch: 41, train_loss: 0.7224, test_loss: 1.0461, test_f1: 0.5861
 epoch: 42, train_loss: 0.7038, test_loss: 1.2201, test_f1: 0.5462
 epoch: 43, train_loss: 0.7342, test_loss: 1.2063, test_f1: 0.5365
 epoch: 44, train_loss: 0.7333, test_loss: 1.1848, test_f1: 0.5408
 epoch: 45, train_loss: 0.7176, test_loss: 1.1478, test_f1: 0.5840
 epoch: 46, train_loss: 0.6896, test_loss: 1.2228, test_f1: 0.5558
 epoch: 47, train_loss: 0.6952, test_loss: 1.2546, test_f1: 0.5807
 epoch: 48, train_loss: 0.6941, test_loss: 1.1424, test_f1: 0.5667
 epoch: 49, train_loss: 0.6817, test_loss: 1.2110, test_f1: 0.5895
 epoch: 50, train_loss: 0.6871, test_loss: 1.0512, test_f1: 0.5714
 epoch: 51, train_loss: 0.6904, test_loss: 1.1580, test_f1: 0.6085
 epoch: 52, train_loss: 0.6286, test_loss: 1.3481, test_f1: 0.6098
 epoch: 53, train_loss: 0.6414, test_loss: 1.1251, test_f1: 0.6262
 epoch: 54, train_loss: 0.6543, test_loss: 1.2865, test_f1: 0.6520
 epoch: 55, train_loss: 0.6301, test_loss: 1.0975, test_f1: 0.6175
 epoch: 56, train_loss: 0.6378, test_loss: 1.1032, test_f1: 0.6291
 epoch: 57, train_loss: 0.6505, test_loss: 1.2610, test_f1: 0.6412
 epoch: 58, train_loss: 0.6018, test_loss: 1.1268, test_f1: 0.5855
 epoch: 59, train_loss: 0.6091, test_loss: 1.2548, test_f1: 0.5861
 epoch: 60, train_loss: 0.5919, test_loss: 1.3360, test_f1: 0.6318
 epoch: 61, train_loss: 0.5958, test_loss: 1.4589, test_f1: 0.5659
 epoch: 62, train_loss: 0.6011, test_loss: 1.2199, test_f1: 0.5884
 epoch: 63, train_loss: 0.5849, test_loss: 1.2801, test_f1: 0.5872
 epoch: 64, train_loss: 0.5993, test_loss: 1.3071, test_f1: 0.5634
 epoch: 65, train_loss: 0.6014, test_loss: 1.2546, test_f1: 0.5914
 epoch: 66, train_loss: 0.5921, test_loss: 1.2483, test_f1: 0.6133
 epoch: 67, train_loss: 0.5995, test_loss: 1.1987, test_f1: 0.5496
 epoch: 68, train_loss: 0.5850, test_loss: 1.2501, test_f1: 0.6275
 epoch: 69, train_loss: 0.5830, test_loss: 1.5316, test_f1: 0.6192
 epoch: 70, train_loss: 0.5786, test_loss: 1.3500, test_f1: 0.6333
 epoch: 71, train_loss: 0.5634, test_loss: 1.3572, test_f1: 0.6458
 epoch: 72, train_loss: 0.5531, test_loss: 1.3834, test_f1: 0.6055
 epoch: 73, train_loss: 0.5905, test_loss: 1.2890, test_f1: 0.6173
 epoch: 74, train_loss: 0.5727, test_loss: 1.3113, test_f1: 0.6113
 epoch: 75, train_loss: 0.5668, test_loss: 1.3829, test_f1: 0.5348
 epoch: 76, train_loss: 0.5769, test_loss: 1.3507, test_f1: 0.5756
 epoch: 77, train_loss: 0.5624, test_loss: 1.4471, test_f1: 0.6235
 epoch: 78, train_loss: 0.5400, test_loss: 1.3724, test_f1: 0.5671
 epoch: 79, train_loss: 0.5952, test_loss: 1.2273, test_f1: 0.6218
 epoch: 80, train_loss: 0.5440, test_loss: 1.2896, test_f1: 0.6386
 epoch: 81, train_loss: 0.5546, test_loss: 1.2583, test_f1: 0.6116
 epoch: 82, train_loss: 0.5599, test_loss: 1.2966, test_f1: 0.5789
 epoch: 83, train_loss: 0.5496, test_loss: 1.3771, test_f1: 0.6048
 epoch: 84, train_loss: 0.5422, test_loss: 1.2039, test_f1: 0.5876
 epoch: 85, train_loss: 0.5446, test_loss: 1.2123, test_f1: 0.6001
 epoch: 86, train_loss: 0.5363, test_loss: 1.2479, test_f1: 0.5987
 epoch: 87, train_loss: 0.5213, test_loss: 1.4122, test_f1: 0.6054
 epoch: 88, train_loss: 0.5396, test_loss: 1.5439, test_f1: 0.5846
 epoch: 89, train_loss: 0.5656, test_loss: 1.5043, test_f1: 0.5715
 epoch: 90, train_loss: 0.5735, test_loss: 1.2236, test_f1: 0.6508
 epoch: 91, train_loss: 0.5242, test_loss: 1.3029, test_f1: 0.6165
 epoch: 92, train_loss: 0.5258, test_loss: 1.3038, test_f1: 0.6216
 epoch: 93, train_loss: 0.5202, test_loss: 1.6470, test_f1: 0.5183
 epoch: 94, train_loss: 0.5172, test_loss: 1.4338, test_f1: 0.6211
 epoch: 95, train_loss: 0.5441, test_loss: 1.3445, test_f1: 0.6150
 epoch: 96, train_loss: 0.5102, test_loss: 1.6650, test_f1: 0.5897
 epoch: 97, train_loss: 0.5139, test_loss: 1.4613, test_f1: 0.5919
 epoch: 98, train_loss: 0.5227, test_loss: 1.5437, test_f1: 0.5960
 epoch: 99, train_loss: 0.5135, test_loss: 1.3841, test_f1: 0.6355
##################ITERATION #8 ****************************************
 epoch: 0, train_loss: 1.2424, test_loss: 1.1520, test_f1: 0.4404
 epoch: 1, train_loss: 1.0416, test_loss: 1.0963, test_f1: 0.4807
 epoch: 2, train_loss: 0.9926, test_loss: 1.0912, test_f1: 0.4688
 epoch: 3, train_loss: 0.9937, test_loss: 1.0214, test_f1: 0.4971
 epoch: 4, train_loss: 0.9672, test_loss: 1.0999, test_f1: 0.4753
 epoch: 5, train_loss: 0.9760, test_loss: 1.0880, test_f1: 0.4576
 epoch: 6, train_loss: 0.9497, test_loss: 1.0305, test_f1: 0.5108
 epoch: 7, train_loss: 0.9293, test_loss: 1.0947, test_f1: 0.4961
 epoch: 8, train_loss: 0.9321, test_loss: 1.0029, test_f1: 0.5558
 epoch: 9, train_loss: 0.9009, test_loss: 1.0241, test_f1: 0.5386
 epoch: 10, train_loss: 0.8967, test_loss: 1.0345, test_f1: 0.5250
 epoch: 11, train_loss: 0.9087, test_loss: 1.0525, test_f1: 0.5335
 epoch: 12, train_loss: 0.8985, test_loss: 1.0571, test_f1: 0.5182
 epoch: 13, train_loss: 0.8727, test_loss: 1.0235, test_f1: 0.5052
 epoch: 14, train_loss: 0.8559, test_loss: 1.0043, test_f1: 0.5207
 epoch: 15, train_loss: 0.8437, test_loss: 1.0212, test_f1: 0.5493
 epoch: 16, train_loss: 0.8348, test_loss: 1.2580, test_f1: 0.4626
 epoch: 17, train_loss: 0.8515, test_loss: 1.0197, test_f1: 0.5225
 epoch: 18, train_loss: 0.8231, test_loss: 1.1174, test_f1: 0.4734
 epoch: 19, train_loss: 0.8165, test_loss: 0.9817, test_f1: 0.5849
 epoch: 20, train_loss: 0.7982, test_loss: 0.9905, test_f1: 0.5799
 epoch: 21, train_loss: 0.8055, test_loss: 0.9723, test_f1: 0.5331
 epoch: 22, train_loss: 0.8093, test_loss: 1.0678, test_f1: 0.5554
 epoch: 23, train_loss: 0.7927, test_loss: 1.0779, test_f1: 0.4887
 epoch: 24, train_loss: 0.8191, test_loss: 1.0572, test_f1: 0.5694
 epoch: 25, train_loss: 0.7967, test_loss: 1.0002, test_f1: 0.5661
 epoch: 26, train_loss: 0.7616, test_loss: 0.9631, test_f1: 0.5961
 epoch: 27, train_loss: 0.7477, test_loss: 1.0809, test_f1: 0.5907
 epoch: 28, train_loss: 0.7459, test_loss: 1.0566, test_f1: 0.5512
 epoch: 29, train_loss: 0.7681, test_loss: 0.9935, test_f1: 0.5717
 epoch: 30, train_loss: 0.7497, test_loss: 1.1514, test_f1: 0.4987
 epoch: 31, train_loss: 0.7347, test_loss: 1.0578, test_f1: 0.5694
 epoch: 32, train_loss: 0.7408, test_loss: 1.2009, test_f1: 0.4905
 epoch: 33, train_loss: 0.7615, test_loss: 0.9782, test_f1: 0.5723
 epoch: 34, train_loss: 0.7552, test_loss: 1.0951, test_f1: 0.5950
 epoch: 35, train_loss: 0.7453, test_loss: 1.0321, test_f1: 0.5572
 epoch: 36, train_loss: 0.7209, test_loss: 1.0475, test_f1: 0.5584
 epoch: 37, train_loss: 0.7200, test_loss: 1.2478, test_f1: 0.5303
 epoch: 38, train_loss: 0.7153, test_loss: 1.0948, test_f1: 0.5794
 epoch: 39, train_loss: 0.7193, test_loss: 0.9683, test_f1: 0.5833
 epoch: 40, train_loss: 0.7161, test_loss: 1.0361, test_f1: 0.5590
 epoch: 41, train_loss: 0.7220, test_loss: 1.1713, test_f1: 0.5201
 epoch: 42, train_loss: 0.7663, test_loss: 1.0704, test_f1: 0.5532
 epoch: 43, train_loss: 0.7325, test_loss: 1.0719, test_f1: 0.5557
 epoch: 44, train_loss: 0.7047, test_loss: 1.0238, test_f1: 0.6020
 epoch: 45, train_loss: 0.7461, test_loss: 0.9812, test_f1: 0.5740
 epoch: 46, train_loss: 0.6807, test_loss: 1.0714, test_f1: 0.5701
 epoch: 47, train_loss: 0.6594, test_loss: 1.3125, test_f1: 0.5290
 epoch: 48, train_loss: 0.7298, test_loss: 1.0617, test_f1: 0.5495
 epoch: 49, train_loss: 0.7301, test_loss: 1.0404, test_f1: 0.5849
 epoch: 50, train_loss: 0.6886, test_loss: 1.0848, test_f1: 0.5757
 epoch: 51, train_loss: 0.6569, test_loss: 1.0680, test_f1: 0.5529
 epoch: 52, train_loss: 0.6506, test_loss: 1.0897, test_f1: 0.5624
 epoch: 53, train_loss: 0.6304, test_loss: 1.0734, test_f1: 0.5865
 epoch: 54, train_loss: 0.6394, test_loss: 1.1188, test_f1: 0.5950
 epoch: 55, train_loss: 0.6195, test_loss: 1.1408, test_f1: 0.5707
 epoch: 56, train_loss: 0.6364, test_loss: 1.1704, test_f1: 0.5669
 epoch: 57, train_loss: 0.6050, test_loss: 1.1632, test_f1: 0.5532
 epoch: 58, train_loss: 0.6044, test_loss: 1.2076, test_f1: 0.5563
 epoch: 59, train_loss: 0.5992, test_loss: 1.1653, test_f1: 0.5871
 epoch: 60, train_loss: 0.6034, test_loss: 1.1139, test_f1: 0.5728
 epoch: 61, train_loss: 0.6108, test_loss: 1.1763, test_f1: 0.5689
 epoch: 62, train_loss: 0.6007, test_loss: 1.1270, test_f1: 0.5836
 epoch: 63, train_loss: 0.6017, test_loss: 1.2454, test_f1: 0.5407
 epoch: 64, train_loss: 0.5916, test_loss: 1.2194, test_f1: 0.5565
 epoch: 65, train_loss: 0.5813, test_loss: 1.2752, test_f1: 0.5484
 epoch: 66, train_loss: 0.5935, test_loss: 1.2339, test_f1: 0.5766
 epoch: 67, train_loss: 0.5878, test_loss: 1.2585, test_f1: 0.5788
 epoch: 68, train_loss: 0.5944, test_loss: 1.1841, test_f1: 0.5670
 epoch: 69, train_loss: 0.5715, test_loss: 1.3013, test_f1: 0.5504
 epoch: 70, train_loss: 0.5796, test_loss: 1.3444, test_f1: 0.5539
 epoch: 71, train_loss: 0.5795, test_loss: 1.2201, test_f1: 0.5870
 epoch: 72, train_loss: 0.5391, test_loss: 1.3563, test_f1: 0.5073
 epoch: 73, train_loss: 0.5675, test_loss: 1.4549, test_f1: 0.5806
 epoch: 74, train_loss: 0.5708, test_loss: 1.2137, test_f1: 0.6049
 epoch: 75, train_loss: 0.5824, test_loss: 1.3256, test_f1: 0.5695
 epoch: 76, train_loss: 0.5705, test_loss: 1.3832, test_f1: 0.5204
 epoch: 77, train_loss: 0.5669, test_loss: 1.2832, test_f1: 0.5973
 epoch: 78, train_loss: 0.5405, test_loss: 1.2346, test_f1: 0.5703
 epoch: 79, train_loss: 0.5585, test_loss: 1.3135, test_f1: 0.5604
 epoch: 80, train_loss: 0.5571, test_loss: 1.5188, test_f1: 0.5712
 epoch: 81, train_loss: 0.5580, test_loss: 1.3194, test_f1: 0.5782
 epoch: 82, train_loss: 0.5713, test_loss: 1.2554, test_f1: 0.5630
 epoch: 83, train_loss: 0.5363, test_loss: 1.2319, test_f1: 0.6047
 epoch: 84, train_loss: 0.5206, test_loss: 1.3200, test_f1: 0.6030
 epoch: 85, train_loss: 0.5415, test_loss: 1.3715, test_f1: 0.5597
 epoch: 86, train_loss: 0.5387, test_loss: 1.2625, test_f1: 0.5966
 epoch: 87, train_loss: 0.5036, test_loss: 1.3159, test_f1: 0.5294
 epoch: 88, train_loss: 0.5312, test_loss: 1.2202, test_f1: 0.6186
 epoch: 89, train_loss: 0.5166, test_loss: 1.3950, test_f1: 0.5565
 epoch: 90, train_loss: 0.5364, test_loss: 1.3513, test_f1: 0.5764
 epoch: 91, train_loss: 0.5059, test_loss: 1.3703, test_f1: 0.5730
 epoch: 92, train_loss: 0.4988, test_loss: 1.4662, test_f1: 0.5899
 epoch: 93, train_loss: 0.5269, test_loss: 1.3100, test_f1: 0.5842
 epoch: 94, train_loss: 0.5109, test_loss: 1.4686, test_f1: 0.5736
 epoch: 95, train_loss: 0.4834, test_loss: 1.4302, test_f1: 0.5398
 epoch: 96, train_loss: 0.5291, test_loss: 1.4334, test_f1: 0.5685
 epoch: 97, train_loss: 0.5146, test_loss: 1.2789, test_f1: 0.5771
 epoch: 98, train_loss: 0.4852, test_loss: 1.4601, test_f1: 0.5570
 epoch: 99, train_loss: 0.5114, test_loss: 1.4615, test_f1: 0.5618
##################ITERATION #9 ****************************************
 epoch: 0, train_loss: 1.2221, test_loss: 1.3065, test_f1: 0.3466
 epoch: 1, train_loss: 1.0955, test_loss: 1.1011, test_f1: 0.4987
 epoch: 2, train_loss: 1.0404, test_loss: 1.0691, test_f1: 0.4917
 epoch: 3, train_loss: 0.9940, test_loss: 1.0515, test_f1: 0.4831
 epoch: 4, train_loss: 0.9645, test_loss: 1.2068, test_f1: 0.3613
 epoch: 5, train_loss: 0.9827, test_loss: 1.0883, test_f1: 0.5090
 epoch: 6, train_loss: 0.9638, test_loss: 1.0197, test_f1: 0.5751
 epoch: 7, train_loss: 0.9271, test_loss: 1.0085, test_f1: 0.5824
 epoch: 8, train_loss: 0.9429, test_loss: 1.0218, test_f1: 0.5481
 epoch: 9, train_loss: 0.8985, test_loss: 1.0652, test_f1: 0.4894
 epoch: 10, train_loss: 0.8773, test_loss: 1.0150, test_f1: 0.5642
 epoch: 11, train_loss: 0.8623, test_loss: 1.0612, test_f1: 0.5356
 epoch: 12, train_loss: 0.8481, test_loss: 0.9692, test_f1: 0.6017
 epoch: 13, train_loss: 0.9104, test_loss: 1.0315, test_f1: 0.5469
 epoch: 14, train_loss: 0.8523, test_loss: 1.0795, test_f1: 0.5611
 epoch: 15, train_loss: 0.8250, test_loss: 1.0285, test_f1: 0.5654
 epoch: 16, train_loss: 0.8253, test_loss: 0.9376, test_f1: 0.4753
 epoch: 17, train_loss: 0.7850, test_loss: 1.0727, test_f1: 0.5804
 epoch: 18, train_loss: 0.8506, test_loss: 1.1687, test_f1: 0.3568
 epoch: 19, train_loss: 0.8714, test_loss: 0.9994, test_f1: 0.5403
 epoch: 20, train_loss: 0.8460, test_loss: 0.9514, test_f1: 0.6115
 epoch: 21, train_loss: 0.7965, test_loss: 1.0073, test_f1: 0.5852
 epoch: 22, train_loss: 0.8179, test_loss: 1.0028, test_f1: 0.5699
 epoch: 23, train_loss: 0.8136, test_loss: 0.9804, test_f1: 0.5340
 epoch: 24, train_loss: 0.8130, test_loss: 1.0127, test_f1: 0.5574
 epoch: 25, train_loss: 0.7892, test_loss: 0.9942, test_f1: 0.5678
 epoch: 26, train_loss: 0.7574, test_loss: 1.1083, test_f1: 0.4995
 epoch: 27, train_loss: 0.7738, test_loss: 1.0919, test_f1: 0.5366
 epoch: 28, train_loss: 0.7644, test_loss: 1.0344, test_f1: 0.6274
 epoch: 29, train_loss: 0.7657, test_loss: 1.0579, test_f1: 0.5433
 epoch: 30, train_loss: 0.7637, test_loss: 1.0778, test_f1: 0.6017
 epoch: 31, train_loss: 0.7721, test_loss: 1.0503, test_f1: 0.5974
 epoch: 32, train_loss: 0.7559, test_loss: 1.0636, test_f1: 0.5841
 epoch: 33, train_loss: 0.7628, test_loss: 1.1451, test_f1: 0.5474
 epoch: 34, train_loss: 0.7531, test_loss: 1.1803, test_f1: 0.5102
 epoch: 35, train_loss: 0.7513, test_loss: 1.0378, test_f1: 0.5977
 epoch: 36, train_loss: 0.7568, test_loss: 1.1509, test_f1: 0.6042
 epoch: 37, train_loss: 0.7324, test_loss: 1.1959, test_f1: 0.5409
 epoch: 38, train_loss: 0.7401, test_loss: 1.1224, test_f1: 0.5870
 epoch: 39, train_loss: 0.7215, test_loss: 1.0576, test_f1: 0.5979
 epoch: 40, train_loss: 0.7214, test_loss: 1.2356, test_f1: 0.5607
 epoch: 41, train_loss: 0.7143, test_loss: 1.2685, test_f1: 0.5429
 epoch: 42, train_loss: 0.7254, test_loss: 1.3338, test_f1: 0.5300
 epoch: 43, train_loss: 0.7253, test_loss: 1.2975, test_f1: 0.5461
 epoch: 44, train_loss: 0.7105, test_loss: 1.2589, test_f1: 0.5407
 epoch: 45, train_loss: 0.7120, test_loss: 1.1746, test_f1: 0.5133
 epoch: 46, train_loss: 0.7071, test_loss: 1.2093, test_f1: 0.5452
 epoch: 47, train_loss: 0.6874, test_loss: 1.4848, test_f1: 0.5221
 epoch: 48, train_loss: 0.6953, test_loss: 1.3445, test_f1: 0.5219
 epoch: 49, train_loss: 0.6855, test_loss: 1.1224, test_f1: 0.5688
 epoch: 50, train_loss: 0.6867, test_loss: 1.1590, test_f1: 0.5758
 epoch: 51, train_loss: 0.6442, test_loss: 1.1506, test_f1: 0.5943
 epoch: 52, train_loss: 0.6525, test_loss: 1.1844, test_f1: 0.5802
 epoch: 53, train_loss: 0.6517, test_loss: 1.2091, test_f1: 0.5883
 epoch: 54, train_loss: 0.6418, test_loss: 1.1903, test_f1: 0.5866
 epoch: 55, train_loss: 0.6305, test_loss: 1.2568, test_f1: 0.5941
 epoch: 56, train_loss: 0.6277, test_loss: 1.2005, test_f1: 0.5818
 epoch: 57, train_loss: 0.6120, test_loss: 1.2779, test_f1: 0.5652
 epoch: 58, train_loss: 0.6030, test_loss: 1.3825, test_f1: 0.5558
 epoch: 59, train_loss: 0.6345, test_loss: 1.2322, test_f1: 0.5909
 epoch: 60, train_loss: 0.6340, test_loss: 1.2425, test_f1: 0.6022
 epoch: 61, train_loss: 0.5939, test_loss: 1.2792, test_f1: 0.6020
 epoch: 62, train_loss: 0.5981, test_loss: 1.2259, test_f1: 0.5923
 epoch: 63, train_loss: 0.5661, test_loss: 1.3895, test_f1: 0.6038
 epoch: 64, train_loss: 0.5945, test_loss: 1.3177, test_f1: 0.5822
 epoch: 65, train_loss: 0.5900, test_loss: 1.3763, test_f1: 0.5627
 epoch: 66, train_loss: 0.6174, test_loss: 1.5331, test_f1: 0.5365
 epoch: 67, train_loss: 0.6480, test_loss: 1.2997, test_f1: 0.5436
 epoch: 68, train_loss: 0.6111, test_loss: 1.3103, test_f1: 0.5645
 epoch: 69, train_loss: 0.5897, test_loss: 1.4311, test_f1: 0.6162
 epoch: 70, train_loss: 0.5527, test_loss: 1.4311, test_f1: 0.5682
 epoch: 71, train_loss: 0.5694, test_loss: 1.4066, test_f1: 0.5891
 epoch: 72, train_loss: 0.5707, test_loss: 1.3336, test_f1: 0.5909
 epoch: 73, train_loss: 0.5629, test_loss: 1.3249, test_f1: 0.5733
 epoch: 74, train_loss: 0.5579, test_loss: 1.4028, test_f1: 0.5986
 epoch: 75, train_loss: 0.5838, test_loss: 1.3519, test_f1: 0.5907
 epoch: 76, train_loss: 0.5634, test_loss: 1.3441, test_f1: 0.5996
 epoch: 77, train_loss: 0.5729, test_loss: 1.4770, test_f1: 0.5709
 epoch: 78, train_loss: 0.5568, test_loss: 1.4468, test_f1: 0.6010
 epoch: 79, train_loss: 0.5689, test_loss: 1.3941, test_f1: 0.5655
 epoch: 80, train_loss: 0.5459, test_loss: 1.5080, test_f1: 0.5524
 epoch: 81, train_loss: 0.5418, test_loss: 1.3619, test_f1: 0.5952
 epoch: 82, train_loss: 0.5718, test_loss: 1.4983, test_f1: 0.5983
 epoch: 83, train_loss: 0.5314, test_loss: 1.5439, test_f1: 0.5898
 epoch: 84, train_loss: 0.5538, test_loss: 1.4137, test_f1: 0.5802
 epoch: 85, train_loss: 0.5216, test_loss: 1.4895, test_f1: 0.6007
 epoch: 86, train_loss: 0.5371, test_loss: 1.5155, test_f1: 0.5640
 epoch: 87, train_loss: 0.5605, test_loss: 2.0320, test_f1: 0.5611
 epoch: 88, train_loss: 0.5890, test_loss: 1.4621, test_f1: 0.5644
 epoch: 89, train_loss: 0.5351, test_loss: 1.3621, test_f1: 0.6188
 epoch: 90, train_loss: 0.5640, test_loss: 1.5051, test_f1: 0.5934
 epoch: 91, train_loss: 0.5660, test_loss: 1.4711, test_f1: 0.5586
 epoch: 92, train_loss: 0.5646, test_loss: 1.4564, test_f1: 0.5939
 epoch: 93, train_loss: 0.5258, test_loss: 1.5182, test_f1: 0.6057
 epoch: 94, train_loss: 0.5606, test_loss: 1.5348, test_f1: 0.6099
 epoch: 95, train_loss: 0.5518, test_loss: 1.5226, test_f1: 0.5756
 epoch: 96, train_loss: 0.5495, test_loss: 1.4163, test_f1: 0.6007
 epoch: 97, train_loss: 0.5252, test_loss: 1.4312, test_f1: 0.6009
 epoch: 98, train_loss: 0.4998, test_loss: 1.6122, test_f1: 0.5743
 epoch: 99, train_loss: 0.5443, test_loss: 1.6512, test_f1: 0.5425

Training completed in 667.99 seconds
Best F1: 0.6602 at epoch 97
Mean F1 across iterations: 0.6420  0.0139
========================FINAL RESULTS================================
FEGIN weighted F1: 0.6602  0.0139
python main.py --data ltspice_demos --representation component_net --model FEGIN --layers 4 --hiddens 32 --batch_size 32 --lr 0.01 --emb_size 128 --epochs 100 --save_appendix component_net_L4_H32_BS32_LR0.01_E128 --no_val
-----



STDERR:
  File "main.py", line 370, in <module>
    main()
  File "main.py", line 254, in main
    dataset = dataset_class(
  File "/home/philip/projects/ltspice_examples_code_repo/Circuit-Completion-Using-GNNs/component_classification_with_link_prediction_head/evaluation/FEGIN/kernel/circuit_datasets.py", line 15, in __init__
    self.data, self.slices = torch.load(self.processed_paths[0])
  File "/home/philip/.local/lib/python3.8/site-packages/torch/serialization.py", line 1040, in load
    warnings.warn(
  File "/usr/lib/python3.8/warnings.py", line 109, in _showwarnmsg
    sw(msg.message, msg.category, msg.filename, msg.lineno,
  File "main.py", line 47, in warn_with_traceback
    traceback.print_stack(file=log)
/home/philip/projects/ltspice_examples_code_repo/Circuit-Completion-Using-GNNs/component_classification_with_link_prediction_head/evaluation/FEGIN/kernel/circuit_datasets.py:15: FutureWarning: You are using `torch.load` with `weights_only=False` (the current default value), which uses the default pickle module implicitly. It is possible to construct malicious pickle data which will execute arbitrary code during unpickling (See https://github.com/pytorch/pytorch/blob/main/SECURITY.md#untrusted-models for more details). In a future release, the default value for `weights_only` will be flipped to `True`. This limits the functions that could be executed during unpickling. Arbitrary objects will no longer be allowed to be loaded via this mode unless they are explicitly allowlisted by the user via `torch.serialization.add_safe_globals`. We recommend you start setting `weights_only=True` for any use case where you don't have full control of the loaded file. Please open an issue on GitHub for any issues related to this experimental feature.
  self.data, self.slices = torch.load(self.processed_paths[0])
