STDOUT:
Results will be saved in /home/philip/projects/ltspice_examples_code_repo/Circuit-Completion-Using-GNNs/component_classification_with_link_prediction_head/evaluation/FEGIN/results/model_FEGIN_dataset_ltspice_examples
Command line input: python main.py --data ltspice_examples --representation component_pin_net --model FEGIN --layers 2 --hiddens 64 --batch_size 32 --lr 0.001 --emb_size 128 --epochs 100 --save_appendix component_pin_net_L2_H64_BS32_LR0.001_E128 --no_val
 is saved.
-----
ltspice_examples - FEGIN
Using 2 layers, 64 hidden units, h = 2
Loading component_pin_net representation dataset
ENTERED
Training FEGIN on component_pin_net representation
Train: 3558, Test: 846
##################ITERATION #0 ****************************************
 epoch: 0, train_loss: 1.1717, test_loss: 1.0125, test_f1: 0.4659
 epoch: 1, train_loss: 0.9958, test_loss: 0.9788, test_f1: 0.4772
 epoch: 2, train_loss: 0.9707, test_loss: 0.9235, test_f1: 0.4802
 epoch: 3, train_loss: 0.9503, test_loss: 0.9006, test_f1: 0.5020
 epoch: 4, train_loss: 0.9215, test_loss: 0.8958, test_f1: 0.5553
 epoch: 5, train_loss: 0.9153, test_loss: 0.8839, test_f1: 0.4908
 epoch: 6, train_loss: 0.8980, test_loss: 0.8369, test_f1: 0.5445
 epoch: 7, train_loss: 0.8845, test_loss: 0.8231, test_f1: 0.5525
 epoch: 8, train_loss: 0.8594, test_loss: 0.8256, test_f1: 0.5496
 epoch: 9, train_loss: 0.8405, test_loss: 0.8288, test_f1: 0.5522
 epoch: 10, train_loss: 0.8167, test_loss: 0.8256, test_f1: 0.5495
 epoch: 11, train_loss: 0.8042, test_loss: 0.8124, test_f1: 0.6334
 epoch: 12, train_loss: 0.8025, test_loss: 0.9288, test_f1: 0.5414
 epoch: 13, train_loss: 0.7983, test_loss: 0.8714, test_f1: 0.5742
 epoch: 14, train_loss: 0.7720, test_loss: 0.7898, test_f1: 0.5988
 epoch: 15, train_loss: 0.7510, test_loss: 0.7870, test_f1: 0.6072
 epoch: 16, train_loss: 0.7537, test_loss: 0.8293, test_f1: 0.5918
 epoch: 17, train_loss: 0.7534, test_loss: 0.7589, test_f1: 0.6213
 epoch: 18, train_loss: 0.7339, test_loss: 0.8183, test_f1: 0.5989
 epoch: 19, train_loss: 0.7217, test_loss: 0.8334, test_f1: 0.5773
 epoch: 20, train_loss: 0.7193, test_loss: 0.7787, test_f1: 0.6356
 epoch: 21, train_loss: 0.7013, test_loss: 0.8174, test_f1: 0.5933
 epoch: 22, train_loss: 0.6883, test_loss: 0.7547, test_f1: 0.6422
 epoch: 23, train_loss: 0.6830, test_loss: 0.7639, test_f1: 0.6569
 epoch: 24, train_loss: 0.6870, test_loss: 0.8084, test_f1: 0.6496
 epoch: 25, train_loss: 0.6758, test_loss: 0.9259, test_f1: 0.5784
 epoch: 26, train_loss: 0.6712, test_loss: 0.7968, test_f1: 0.6029
 epoch: 27, train_loss: 0.6659, test_loss: 0.7812, test_f1: 0.6369
 epoch: 28, train_loss: 0.6674, test_loss: 0.7803, test_f1: 0.6395
 epoch: 29, train_loss: 0.6481, test_loss: 0.8162, test_f1: 0.6297
 epoch: 30, train_loss: 0.6508, test_loss: 0.7764, test_f1: 0.6585
 epoch: 31, train_loss: 0.6475, test_loss: 0.8848, test_f1: 0.6266
 epoch: 32, train_loss: 0.6220, test_loss: 0.7957, test_f1: 0.6474
 epoch: 33, train_loss: 0.6215, test_loss: 0.8348, test_f1: 0.6478
 epoch: 34, train_loss: 0.6165, test_loss: 0.7118, test_f1: 0.6907
 epoch: 35, train_loss: 0.6245, test_loss: 0.7462, test_f1: 0.6752
 epoch: 36, train_loss: 0.6017, test_loss: 0.8640, test_f1: 0.6315
 epoch: 37, train_loss: 0.6149, test_loss: 0.8428, test_f1: 0.6777
 epoch: 38, train_loss: 0.5802, test_loss: 0.8149, test_f1: 0.6460
 epoch: 39, train_loss: 0.5933, test_loss: 0.8977, test_f1: 0.6486
 epoch: 40, train_loss: 0.5722, test_loss: 0.7972, test_f1: 0.6620
 epoch: 41, train_loss: 0.6057, test_loss: 0.7854, test_f1: 0.6412
 epoch: 42, train_loss: 0.5864, test_loss: 0.7994, test_f1: 0.6472
 epoch: 43, train_loss: 0.5721, test_loss: 0.8196, test_f1: 0.6721
 epoch: 44, train_loss: 0.5665, test_loss: 0.7217, test_f1: 0.6768
 epoch: 45, train_loss: 0.5523, test_loss: 0.8189, test_f1: 0.6518
 epoch: 46, train_loss: 0.5510, test_loss: 0.8784, test_f1: 0.6512
 epoch: 47, train_loss: 0.5528, test_loss: 0.8667, test_f1: 0.6479
 epoch: 48, train_loss: 0.5356, test_loss: 0.8793, test_f1: 0.6635
 epoch: 49, train_loss: 0.5479, test_loss: 0.7838, test_f1: 0.6724
 epoch: 50, train_loss: 0.5578, test_loss: 0.7982, test_f1: 0.6514
 epoch: 51, train_loss: 0.5221, test_loss: 0.8100, test_f1: 0.6573
 epoch: 52, train_loss: 0.5069, test_loss: 0.8369, test_f1: 0.6548
 epoch: 53, train_loss: 0.5094, test_loss: 0.9167, test_f1: 0.6669
 epoch: 54, train_loss: 0.4879, test_loss: 0.8696, test_f1: 0.6421
 epoch: 55, train_loss: 0.4897, test_loss: 0.9740, test_f1: 0.6453
 epoch: 56, train_loss: 0.4787, test_loss: 0.8846, test_f1: 0.6678
 epoch: 57, train_loss: 0.4821, test_loss: 0.9131, test_f1: 0.6711
 epoch: 58, train_loss: 0.4725, test_loss: 0.9299, test_f1: 0.6788
 epoch: 59, train_loss: 0.4741, test_loss: 0.9523, test_f1: 0.6473
 epoch: 60, train_loss: 0.4715, test_loss: 0.9262, test_f1: 0.6568
 epoch: 61, train_loss: 0.4747, test_loss: 0.9713, test_f1: 0.6383
 epoch: 62, train_loss: 0.4616, test_loss: 0.9711, test_f1: 0.7026
 epoch: 63, train_loss: 0.4671, test_loss: 0.9288, test_f1: 0.6532
 epoch: 64, train_loss: 0.4523, test_loss: 0.9661, test_f1: 0.6622
 epoch: 65, train_loss: 0.4529, test_loss: 0.9733, test_f1: 0.6445
 epoch: 66, train_loss: 0.4591, test_loss: 0.9457, test_f1: 0.6672
 epoch: 67, train_loss: 0.4455, test_loss: 0.9376, test_f1: 0.6590
 epoch: 68, train_loss: 0.4399, test_loss: 0.9285, test_f1: 0.6732
 epoch: 69, train_loss: 0.4573, test_loss: 0.9800, test_f1: 0.6437
 epoch: 70, train_loss: 0.4265, test_loss: 1.0101, test_f1: 0.6465
 epoch: 71, train_loss: 0.4518, test_loss: 0.9942, test_f1: 0.6486
 epoch: 72, train_loss: 0.4603, test_loss: 0.8814, test_f1: 0.6547
 epoch: 73, train_loss: 0.4451, test_loss: 1.0008, test_f1: 0.6622
 epoch: 74, train_loss: 0.4306, test_loss: 0.9791, test_f1: 0.6884
 epoch: 75, train_loss: 0.4415, test_loss: 1.0009, test_f1: 0.6588
 epoch: 76, train_loss: 0.4263, test_loss: 0.9892, test_f1: 0.6584
 epoch: 77, train_loss: 0.4250, test_loss: 1.0263, test_f1: 0.6576
 epoch: 78, train_loss: 0.4179, test_loss: 1.0888, test_f1: 0.6528
 epoch: 79, train_loss: 0.4354, test_loss: 1.0809, test_f1: 0.6504
 epoch: 80, train_loss: 0.4194, test_loss: 1.0712, test_f1: 0.6654
 epoch: 81, train_loss: 0.4089, test_loss: 1.0135, test_f1: 0.6448
 epoch: 82, train_loss: 0.4168, test_loss: 1.0807, test_f1: 0.6486
 epoch: 83, train_loss: 0.4123, test_loss: 1.1005, test_f1: 0.6676
 epoch: 84, train_loss: 0.4110, test_loss: 1.0581, test_f1: 0.6728
 epoch: 85, train_loss: 0.4005, test_loss: 1.0586, test_f1: 0.6885
 epoch: 86, train_loss: 0.4001, test_loss: 1.0823, test_f1: 0.6669
 epoch: 87, train_loss: 0.3945, test_loss: 1.1326, test_f1: 0.6708
 epoch: 88, train_loss: 0.4028, test_loss: 1.1481, test_f1: 0.6745
 epoch: 89, train_loss: 0.3789, test_loss: 1.1781, test_f1: 0.6590
 epoch: 90, train_loss: 0.4003, test_loss: 1.1729, test_f1: 0.6576
 epoch: 91, train_loss: 0.4013, test_loss: 1.1839, test_f1: 0.6462
 epoch: 92, train_loss: 0.3986, test_loss: 1.1876, test_f1: 0.6493
 epoch: 93, train_loss: 0.3859, test_loss: 1.1392, test_f1: 0.6829
 epoch: 94, train_loss: 0.3869, test_loss: 1.2003, test_f1: 0.6724
 epoch: 95, train_loss: 0.3766, test_loss: 1.1798, test_f1: 0.6506
 epoch: 96, train_loss: 0.3907, test_loss: 1.1571, test_f1: 0.6809
 epoch: 97, train_loss: 0.3684, test_loss: 1.1993, test_f1: 0.6728
 epoch: 98, train_loss: 0.3834, test_loss: 1.1226, test_f1: 0.6827
 epoch: 99, train_loss: 0.3826, test_loss: 1.1332, test_f1: 0.6779
##################ITERATION #1 ****************************************
 epoch: 0, train_loss: 1.0869, test_loss: 0.9942, test_f1: 0.4598
 epoch: 1, train_loss: 0.9598, test_loss: 0.9473, test_f1: 0.5210
 epoch: 2, train_loss: 0.9340, test_loss: 0.9538, test_f1: 0.5236
 epoch: 3, train_loss: 0.9181, test_loss: 0.9463, test_f1: 0.5018
 epoch: 4, train_loss: 0.8919, test_loss: 0.8892, test_f1: 0.5584
 epoch: 5, train_loss: 0.8735, test_loss: 0.8703, test_f1: 0.5044
 epoch: 6, train_loss: 0.8489, test_loss: 0.8765, test_f1: 0.5324
 epoch: 7, train_loss: 0.8505, test_loss: 0.8311, test_f1: 0.6035
 epoch: 8, train_loss: 0.8207, test_loss: 0.8168, test_f1: 0.5705
 epoch: 9, train_loss: 0.8103, test_loss: 0.8431, test_f1: 0.5697
 epoch: 10, train_loss: 0.8086, test_loss: 0.7880, test_f1: 0.5725
 epoch: 11, train_loss: 0.7790, test_loss: 0.8300, test_f1: 0.5830
 epoch: 12, train_loss: 0.7711, test_loss: 0.7821, test_f1: 0.6344
 epoch: 13, train_loss: 0.7716, test_loss: 0.7411, test_f1: 0.6614
 epoch: 14, train_loss: 0.7443, test_loss: 0.8253, test_f1: 0.6365
 epoch: 15, train_loss: 0.7469, test_loss: 0.7909, test_f1: 0.6022
 epoch: 16, train_loss: 0.7378, test_loss: 0.7778, test_f1: 0.6166
 epoch: 17, train_loss: 0.7258, test_loss: 0.8102, test_f1: 0.6372
 epoch: 18, train_loss: 0.7017, test_loss: 0.8104, test_f1: 0.6434
 epoch: 19, train_loss: 0.7164, test_loss: 0.7647, test_f1: 0.6422
 epoch: 20, train_loss: 0.6981, test_loss: 0.7931, test_f1: 0.6478
 epoch: 21, train_loss: 0.7052, test_loss: 0.7753, test_f1: 0.6616
 epoch: 22, train_loss: 0.6851, test_loss: 0.7486, test_f1: 0.6662
 epoch: 23, train_loss: 0.6703, test_loss: 0.7874, test_f1: 0.6547
 epoch: 24, train_loss: 0.6717, test_loss: 0.7321, test_f1: 0.6761
 epoch: 25, train_loss: 0.6646, test_loss: 0.7622, test_f1: 0.6248
 epoch: 26, train_loss: 0.6768, test_loss: 0.7410, test_f1: 0.6568
 epoch: 27, train_loss: 0.6399, test_loss: 0.7876, test_f1: 0.6441
 epoch: 28, train_loss: 0.6499, test_loss: 0.7520, test_f1: 0.6472
 epoch: 29, train_loss: 0.6377, test_loss: 0.7632, test_f1: 0.6850
 epoch: 30, train_loss: 0.6449, test_loss: 0.7494, test_f1: 0.6651
 epoch: 31, train_loss: 0.6279, test_loss: 0.8205, test_f1: 0.6641
 epoch: 32, train_loss: 0.6122, test_loss: 0.7847, test_f1: 0.6561
 epoch: 33, train_loss: 0.6163, test_loss: 0.8523, test_f1: 0.6395
 epoch: 34, train_loss: 0.6233, test_loss: 0.7155, test_f1: 0.6750
 epoch: 35, train_loss: 0.6106, test_loss: 0.7869, test_f1: 0.6785
 epoch: 36, train_loss: 0.5951, test_loss: 0.7053, test_f1: 0.6922
 epoch: 37, train_loss: 0.5944, test_loss: 0.7519, test_f1: 0.6744
 epoch: 38, train_loss: 0.5905, test_loss: 0.7029, test_f1: 0.6747
 epoch: 39, train_loss: 0.5737, test_loss: 0.8798, test_f1: 0.6604
 epoch: 40, train_loss: 0.5585, test_loss: 0.7918, test_f1: 0.6462
 epoch: 41, train_loss: 0.5668, test_loss: 0.8770, test_f1: 0.6514
 epoch: 42, train_loss: 0.5680, test_loss: 0.9077, test_f1: 0.6526
 epoch: 43, train_loss: 0.5655, test_loss: 0.7195, test_f1: 0.6812
 epoch: 44, train_loss: 0.5667, test_loss: 0.8490, test_f1: 0.6718
 epoch: 45, train_loss: 0.5592, test_loss: 0.7868, test_f1: 0.6723
 epoch: 46, train_loss: 0.5549, test_loss: 0.6983, test_f1: 0.6790
 epoch: 47, train_loss: 0.5448, test_loss: 0.8185, test_f1: 0.6589
 epoch: 48, train_loss: 0.5337, test_loss: 0.7161, test_f1: 0.6564
 epoch: 49, train_loss: 0.5386, test_loss: 0.8905, test_f1: 0.6518
 epoch: 50, train_loss: 0.5368, test_loss: 0.7745, test_f1: 0.6798
 epoch: 51, train_loss: 0.5017, test_loss: 0.8511, test_f1: 0.6766
 epoch: 52, train_loss: 0.4888, test_loss: 0.8558, test_f1: 0.6701
 epoch: 53, train_loss: 0.4763, test_loss: 0.8464, test_f1: 0.6649
 epoch: 54, train_loss: 0.4825, test_loss: 0.8517, test_f1: 0.6413
 epoch: 55, train_loss: 0.4834, test_loss: 0.9088, test_f1: 0.6716
 epoch: 56, train_loss: 0.4750, test_loss: 0.8603, test_f1: 0.6699
 epoch: 57, train_loss: 0.4557, test_loss: 0.8177, test_f1: 0.6563
 epoch: 58, train_loss: 0.4702, test_loss: 0.8514, test_f1: 0.6727
 epoch: 59, train_loss: 0.4684, test_loss: 0.9848, test_f1: 0.6698
 epoch: 60, train_loss: 0.4599, test_loss: 0.9174, test_f1: 0.6835
 epoch: 61, train_loss: 0.4633, test_loss: 0.8937, test_f1: 0.6822
 epoch: 62, train_loss: 0.4624, test_loss: 0.7219, test_f1: 0.6727
 epoch: 63, train_loss: 0.4515, test_loss: 0.8524, test_f1: 0.6731
 epoch: 64, train_loss: 0.4574, test_loss: 0.8416, test_f1: 0.6637
 epoch: 65, train_loss: 0.4455, test_loss: 0.9322, test_f1: 0.6589
 epoch: 66, train_loss: 0.4435, test_loss: 0.9013, test_f1: 0.6578
 epoch: 67, train_loss: 0.4403, test_loss: 0.8816, test_f1: 0.6574
 epoch: 68, train_loss: 0.4423, test_loss: 0.8956, test_f1: 0.6610
 epoch: 69, train_loss: 0.4482, test_loss: 0.9782, test_f1: 0.6511
 epoch: 70, train_loss: 0.4320, test_loss: 0.9845, test_f1: 0.6503
 epoch: 71, train_loss: 0.4273, test_loss: 0.9430, test_f1: 0.6635
 epoch: 72, train_loss: 0.4400, test_loss: 0.9969, test_f1: 0.6647
 epoch: 73, train_loss: 0.4291, test_loss: 1.0132, test_f1: 0.6585
 epoch: 74, train_loss: 0.4241, test_loss: 0.9667, test_f1: 0.6642
 epoch: 75, train_loss: 0.4297, test_loss: 1.0164, test_f1: 0.6581
 epoch: 76, train_loss: 0.4317, test_loss: 0.9401, test_f1: 0.6712
 epoch: 77, train_loss: 0.4164, test_loss: 1.0143, test_f1: 0.6619
 epoch: 78, train_loss: 0.4206, test_loss: 0.9240, test_f1: 0.6754
 epoch: 79, train_loss: 0.4406, test_loss: 1.0408, test_f1: 0.6652
 epoch: 80, train_loss: 0.4108, test_loss: 1.0786, test_f1: 0.6675
 epoch: 81, train_loss: 0.4110, test_loss: 1.0449, test_f1: 0.6574
 epoch: 82, train_loss: 0.4026, test_loss: 1.0457, test_f1: 0.6882
 epoch: 83, train_loss: 0.4185, test_loss: 1.0734, test_f1: 0.6652
 epoch: 84, train_loss: 0.3999, test_loss: 0.9501, test_f1: 0.6580
 epoch: 85, train_loss: 0.4167, test_loss: 0.9983, test_f1: 0.6744
 epoch: 86, train_loss: 0.4129, test_loss: 1.0024, test_f1: 0.6606
 epoch: 87, train_loss: 0.4251, test_loss: 1.0489, test_f1: 0.6697
 epoch: 88, train_loss: 0.3944, test_loss: 0.9835, test_f1: 0.6766
 epoch: 89, train_loss: 0.3983, test_loss: 1.0560, test_f1: 0.6511
 epoch: 90, train_loss: 0.3962, test_loss: 1.0857, test_f1: 0.6556
 epoch: 91, train_loss: 0.4024, test_loss: 1.0288, test_f1: 0.6631
 epoch: 92, train_loss: 0.4053, test_loss: 1.1044, test_f1: 0.6628
 epoch: 93, train_loss: 0.3797, test_loss: 1.0891, test_f1: 0.6617
 epoch: 94, train_loss: 0.3774, test_loss: 1.0149, test_f1: 0.6648
 epoch: 95, train_loss: 0.3833, test_loss: 1.1545, test_f1: 0.6584
 epoch: 96, train_loss: 0.3859, test_loss: 1.0074, test_f1: 0.6758
 epoch: 97, train_loss: 0.3814, test_loss: 1.0000, test_f1: 0.6553
 epoch: 98, train_loss: 0.3908, test_loss: 1.0772, test_f1: 0.6504
 epoch: 99, train_loss: 0.3838, test_loss: 1.0856, test_f1: 0.6634
##################ITERATION #2 ****************************************
 epoch: 0, train_loss: 1.0880, test_loss: 0.9374, test_f1: 0.5007
 epoch: 1, train_loss: 0.9844, test_loss: 0.9542, test_f1: 0.4887
 epoch: 2, train_loss: 0.9442, test_loss: 0.8933, test_f1: 0.5391
 epoch: 3, train_loss: 0.9275, test_loss: 0.8868, test_f1: 0.5382
 epoch: 4, train_loss: 0.8964, test_loss: 0.8536, test_f1: 0.5441
 epoch: 5, train_loss: 0.8960, test_loss: 0.8693, test_f1: 0.5393
 epoch: 6, train_loss: 0.8648, test_loss: 0.8324, test_f1: 0.5819
 epoch: 7, train_loss: 0.8436, test_loss: 0.8033, test_f1: 0.5900
 epoch: 8, train_loss: 0.8268, test_loss: 0.8097, test_f1: 0.5785
 epoch: 9, train_loss: 0.8237, test_loss: 0.8279, test_f1: 0.5916
 epoch: 10, train_loss: 0.8042, test_loss: 0.8017, test_f1: 0.6260
 epoch: 11, train_loss: 0.7901, test_loss: 0.7571, test_f1: 0.6077
 epoch: 12, train_loss: 0.8006, test_loss: 0.7999, test_f1: 0.6183
 epoch: 13, train_loss: 0.7717, test_loss: 0.7622, test_f1: 0.6069
 epoch: 14, train_loss: 0.7589, test_loss: 0.7576, test_f1: 0.6158
 epoch: 15, train_loss: 0.7505, test_loss: 0.7757, test_f1: 0.6077
 epoch: 16, train_loss: 0.7398, test_loss: 0.8392, test_f1: 0.5925
 epoch: 17, train_loss: 0.7175, test_loss: 0.7858, test_f1: 0.6390
 epoch: 18, train_loss: 0.7231, test_loss: 0.7412, test_f1: 0.6540
 epoch: 19, train_loss: 0.7131, test_loss: 0.7524, test_f1: 0.6460
 epoch: 20, train_loss: 0.7086, test_loss: 0.7616, test_f1: 0.6175
 epoch: 21, train_loss: 0.6963, test_loss: 0.7474, test_f1: 0.6387
 epoch: 22, train_loss: 0.6881, test_loss: 0.7755, test_f1: 0.6222
 epoch: 23, train_loss: 0.7037, test_loss: 0.7542, test_f1: 0.6497
 epoch: 24, train_loss: 0.6766, test_loss: 0.7341, test_f1: 0.6779
 epoch: 25, train_loss: 0.6619, test_loss: 0.7363, test_f1: 0.6448
 epoch: 26, train_loss: 0.6802, test_loss: 0.7285, test_f1: 0.6233
 epoch: 27, train_loss: 0.6458, test_loss: 0.7632, test_f1: 0.6500
 epoch: 28, train_loss: 0.6527, test_loss: 0.7223, test_f1: 0.6442
 epoch: 29, train_loss: 0.6401, test_loss: 0.7455, test_f1: 0.6495
 epoch: 30, train_loss: 0.6390, test_loss: 0.7528, test_f1: 0.6603
 epoch: 31, train_loss: 0.6425, test_loss: 0.7406, test_f1: 0.6658
 epoch: 32, train_loss: 0.6359, test_loss: 0.7545, test_f1: 0.6488
 epoch: 33, train_loss: 0.6440, test_loss: 0.7817, test_f1: 0.6424
 epoch: 34, train_loss: 0.6293, test_loss: 0.7718, test_f1: 0.6682
 epoch: 35, train_loss: 0.6252, test_loss: 0.7782, test_f1: 0.6256
 epoch: 36, train_loss: 0.6068, test_loss: 0.8216, test_f1: 0.6532
 epoch: 37, train_loss: 0.6148, test_loss: 0.7426, test_f1: 0.6718
 epoch: 38, train_loss: 0.5855, test_loss: 0.8135, test_f1: 0.6739
 epoch: 39, train_loss: 0.5813, test_loss: 0.7625, test_f1: 0.6872
 epoch: 40, train_loss: 0.5879, test_loss: 0.7834, test_f1: 0.6414
 epoch: 41, train_loss: 0.5818, test_loss: 0.7647, test_f1: 0.6898
 epoch: 42, train_loss: 0.5902, test_loss: 0.7244, test_f1: 0.7041
 epoch: 43, train_loss: 0.5711, test_loss: 0.7704, test_f1: 0.6688
 epoch: 44, train_loss: 0.5748, test_loss: 0.8326, test_f1: 0.6703
 epoch: 45, train_loss: 0.5680, test_loss: 0.8814, test_f1: 0.6407
 epoch: 46, train_loss: 0.5567, test_loss: 0.8118, test_f1: 0.7068
 epoch: 47, train_loss: 0.5844, test_loss: 0.8067, test_f1: 0.6654
 epoch: 48, train_loss: 0.5579, test_loss: 0.8266, test_f1: 0.6623
 epoch: 49, train_loss: 0.5471, test_loss: 0.7898, test_f1: 0.6977
 epoch: 50, train_loss: 0.5483, test_loss: 0.7554, test_f1: 0.6826
 epoch: 51, train_loss: 0.5272, test_loss: 0.8148, test_f1: 0.6973
 epoch: 52, train_loss: 0.4988, test_loss: 0.8123, test_f1: 0.6533
 epoch: 53, train_loss: 0.4894, test_loss: 0.8106, test_f1: 0.7060
 epoch: 54, train_loss: 0.4973, test_loss: 0.8366, test_f1: 0.6831
 epoch: 55, train_loss: 0.5036, test_loss: 0.8258, test_f1: 0.6889
 epoch: 56, train_loss: 0.4885, test_loss: 0.8061, test_f1: 0.6836
 epoch: 57, train_loss: 0.4925, test_loss: 0.8123, test_f1: 0.6631
 epoch: 58, train_loss: 0.4903, test_loss: 0.8491, test_f1: 0.6878
 epoch: 59, train_loss: 0.4912, test_loss: 0.8589, test_f1: 0.6598
 epoch: 60, train_loss: 0.4801, test_loss: 0.8606, test_f1: 0.6850
 epoch: 61, train_loss: 0.4798, test_loss: 0.8319, test_f1: 0.7018
 epoch: 62, train_loss: 0.4726, test_loss: 0.9241, test_f1: 0.6547
 epoch: 63, train_loss: 0.4517, test_loss: 0.8526, test_f1: 0.6704
 epoch: 64, train_loss: 0.4592, test_loss: 0.9156, test_f1: 0.6510
 epoch: 65, train_loss: 0.4548, test_loss: 0.9187, test_f1: 0.6838
 epoch: 66, train_loss: 0.4587, test_loss: 0.8986, test_f1: 0.6736
 epoch: 67, train_loss: 0.4648, test_loss: 0.9576, test_f1: 0.6715
 epoch: 68, train_loss: 0.4586, test_loss: 0.9518, test_f1: 0.6368
 epoch: 69, train_loss: 0.4570, test_loss: 0.9312, test_f1: 0.6547
 epoch: 70, train_loss: 0.4537, test_loss: 0.8995, test_f1: 0.7065
 epoch: 71, train_loss: 0.4545, test_loss: 0.8707, test_f1: 0.6957
 epoch: 72, train_loss: 0.4550, test_loss: 0.9331, test_f1: 0.6865
 epoch: 73, train_loss: 0.4391, test_loss: 0.9071, test_f1: 0.6891
 epoch: 74, train_loss: 0.4501, test_loss: 0.9183, test_f1: 0.7100
 epoch: 75, train_loss: 0.4386, test_loss: 0.9576, test_f1: 0.6764
 epoch: 76, train_loss: 0.4536, test_loss: 0.9063, test_f1: 0.6789
 epoch: 77, train_loss: 0.4310, test_loss: 0.9727, test_f1: 0.6771
 epoch: 78, train_loss: 0.4395, test_loss: 0.8959, test_f1: 0.6900
 epoch: 79, train_loss: 0.4243, test_loss: 0.9244, test_f1: 0.6860
 epoch: 80, train_loss: 0.4590, test_loss: 0.9142, test_f1: 0.6698
 epoch: 81, train_loss: 0.4295, test_loss: 0.9229, test_f1: 0.6755
 epoch: 82, train_loss: 0.4252, test_loss: 0.9281, test_f1: 0.6708
 epoch: 83, train_loss: 0.4229, test_loss: 0.9653, test_f1: 0.6702
 epoch: 84, train_loss: 0.4406, test_loss: 1.0172, test_f1: 0.6621
 epoch: 85, train_loss: 0.4356, test_loss: 0.9921, test_f1: 0.6930
 epoch: 86, train_loss: 0.4281, test_loss: 0.9862, test_f1: 0.6754
 epoch: 87, train_loss: 0.4113, test_loss: 0.9505, test_f1: 0.6831
 epoch: 88, train_loss: 0.4099, test_loss: 1.0000, test_f1: 0.6690
 epoch: 89, train_loss: 0.4251, test_loss: 0.9947, test_f1: 0.6661
 epoch: 90, train_loss: 0.4045, test_loss: 0.9847, test_f1: 0.6697
 epoch: 91, train_loss: 0.3882, test_loss: 1.0176, test_f1: 0.6749
 epoch: 92, train_loss: 0.4093, test_loss: 0.9930, test_f1: 0.6738
 epoch: 93, train_loss: 0.4204, test_loss: 1.0010, test_f1: 0.6470
 epoch: 94, train_loss: 0.4141, test_loss: 1.0304, test_f1: 0.6709
 epoch: 95, train_loss: 0.3929, test_loss: 0.9987, test_f1: 0.6830
 epoch: 96, train_loss: 0.4063, test_loss: 0.9973, test_f1: 0.6860
 epoch: 97, train_loss: 0.3883, test_loss: 1.0516, test_f1: 0.6719
 epoch: 98, train_loss: 0.3982, test_loss: 0.9836, test_f1: 0.7004
 epoch: 99, train_loss: 0.3810, test_loss: 1.0461, test_f1: 0.6666
##################ITERATION #3 ****************************************
 epoch: 0, train_loss: 1.1506, test_loss: 0.9694, test_f1: 0.4706
 epoch: 1, train_loss: 0.9950, test_loss: 0.9873, test_f1: 0.5395
 epoch: 2, train_loss: 0.9634, test_loss: 0.8923, test_f1: 0.5514
 epoch: 3, train_loss: 0.9309, test_loss: 0.8569, test_f1: 0.5397
 epoch: 4, train_loss: 0.9143, test_loss: 0.8806, test_f1: 0.5159
 epoch: 5, train_loss: 0.9022, test_loss: 0.8587, test_f1: 0.5631
 epoch: 6, train_loss: 0.8692, test_loss: 0.8696, test_f1: 0.5232
 epoch: 7, train_loss: 0.8599, test_loss: 0.8337, test_f1: 0.5833
 epoch: 8, train_loss: 0.8524, test_loss: 0.8248, test_f1: 0.6107
 epoch: 9, train_loss: 0.8426, test_loss: 0.8232, test_f1: 0.5977
 epoch: 10, train_loss: 0.8099, test_loss: 0.8124, test_f1: 0.6217
 epoch: 11, train_loss: 0.8081, test_loss: 0.7805, test_f1: 0.5970
 epoch: 12, train_loss: 0.7951, test_loss: 0.7818, test_f1: 0.6225
 epoch: 13, train_loss: 0.7891, test_loss: 0.7914, test_f1: 0.6449
 epoch: 14, train_loss: 0.7895, test_loss: 0.8171, test_f1: 0.6160
 epoch: 15, train_loss: 0.7545, test_loss: 0.8182, test_f1: 0.6355
 epoch: 16, train_loss: 0.7671, test_loss: 0.7891, test_f1: 0.6328
 epoch: 17, train_loss: 0.7480, test_loss: 0.7935, test_f1: 0.6343
 epoch: 18, train_loss: 0.7450, test_loss: 0.8616, test_f1: 0.6451
 epoch: 19, train_loss: 0.7181, test_loss: 0.7906, test_f1: 0.6430
 epoch: 20, train_loss: 0.7221, test_loss: 0.8650, test_f1: 0.6102
 epoch: 21, train_loss: 0.7280, test_loss: 0.8362, test_f1: 0.6468
 epoch: 22, train_loss: 0.7121, test_loss: 0.7965, test_f1: 0.6588
 epoch: 23, train_loss: 0.6936, test_loss: 0.8028, test_f1: 0.6207
 epoch: 24, train_loss: 0.6926, test_loss: 0.7964, test_f1: 0.6592
 epoch: 25, train_loss: 0.6922, test_loss: 0.8798, test_f1: 0.6286
 epoch: 26, train_loss: 0.6773, test_loss: 0.8301, test_f1: 0.6341
 epoch: 27, train_loss: 0.6904, test_loss: 0.8585, test_f1: 0.6456
 epoch: 28, train_loss: 0.6779, test_loss: 0.8940, test_f1: 0.6278
 epoch: 29, train_loss: 0.6760, test_loss: 0.8987, test_f1: 0.6123
 epoch: 30, train_loss: 0.6548, test_loss: 0.8122, test_f1: 0.6530
 epoch: 31, train_loss: 0.6486, test_loss: 0.8137, test_f1: 0.6596
 epoch: 32, train_loss: 0.6456, test_loss: 0.8427, test_f1: 0.6522
 epoch: 33, train_loss: 0.6258, test_loss: 0.8224, test_f1: 0.6512
 epoch: 34, train_loss: 0.6246, test_loss: 0.8317, test_f1: 0.6437
 epoch: 35, train_loss: 0.6233, test_loss: 0.9323, test_f1: 0.6278
 epoch: 36, train_loss: 0.6274, test_loss: 0.8478, test_f1: 0.6558
 epoch: 37, train_loss: 0.6158, test_loss: 0.8460, test_f1: 0.6700
 epoch: 38, train_loss: 0.6213, test_loss: 0.8646, test_f1: 0.6735
 epoch: 39, train_loss: 0.5959, test_loss: 0.8338, test_f1: 0.6455
 epoch: 40, train_loss: 0.5972, test_loss: 0.8703, test_f1: 0.6426
 epoch: 41, train_loss: 0.6029, test_loss: 0.8350, test_f1: 0.6717
 epoch: 42, train_loss: 0.6131, test_loss: 0.8509, test_f1: 0.6382
 epoch: 43, train_loss: 0.5868, test_loss: 0.8844, test_f1: 0.6479
 epoch: 44, train_loss: 0.5773, test_loss: 0.8360, test_f1: 0.6777
 epoch: 45, train_loss: 0.5561, test_loss: 0.8873, test_f1: 0.6497
 epoch: 46, train_loss: 0.5681, test_loss: 0.8968, test_f1: 0.6617
 epoch: 47, train_loss: 0.5514, test_loss: 0.8545, test_f1: 0.6856
 epoch: 48, train_loss: 0.5429, test_loss: 0.9494, test_f1: 0.6478
 epoch: 49, train_loss: 0.5376, test_loss: 0.9004, test_f1: 0.6623
 epoch: 50, train_loss: 0.5313, test_loss: 0.9043, test_f1: 0.6487
 epoch: 51, train_loss: 0.5115, test_loss: 0.8822, test_f1: 0.6981
 epoch: 52, train_loss: 0.4968, test_loss: 0.8838, test_f1: 0.6591
 epoch: 53, train_loss: 0.5020, test_loss: 0.9039, test_f1: 0.7079
 epoch: 54, train_loss: 0.4911, test_loss: 0.9304, test_f1: 0.6839
 epoch: 55, train_loss: 0.4922, test_loss: 0.8977, test_f1: 0.6897
 epoch: 56, train_loss: 0.4714, test_loss: 0.8887, test_f1: 0.6756
 epoch: 57, train_loss: 0.4692, test_loss: 0.9507, test_f1: 0.6887
 epoch: 58, train_loss: 0.4746, test_loss: 0.9095, test_f1: 0.6913
 epoch: 59, train_loss: 0.4689, test_loss: 0.9305, test_f1: 0.6970
 epoch: 60, train_loss: 0.4805, test_loss: 0.9455, test_f1: 0.6890
 epoch: 61, train_loss: 0.4803, test_loss: 0.9838, test_f1: 0.6424
 epoch: 62, train_loss: 0.4714, test_loss: 0.9103, test_f1: 0.7011
 epoch: 63, train_loss: 0.4578, test_loss: 0.9558, test_f1: 0.7010
 epoch: 64, train_loss: 0.4571, test_loss: 0.9857, test_f1: 0.6724
 epoch: 65, train_loss: 0.4528, test_loss: 0.9428, test_f1: 0.7193
 epoch: 66, train_loss: 0.4628, test_loss: 0.9213, test_f1: 0.7029
 epoch: 67, train_loss: 0.4563, test_loss: 0.9818, test_f1: 0.6538
 epoch: 68, train_loss: 0.4512, test_loss: 0.9458, test_f1: 0.6824
 epoch: 69, train_loss: 0.4460, test_loss: 0.9061, test_f1: 0.7087
 epoch: 70, train_loss: 0.4634, test_loss: 1.0118, test_f1: 0.6759
 epoch: 71, train_loss: 0.4554, test_loss: 1.0145, test_f1: 0.6976
 epoch: 72, train_loss: 0.4430, test_loss: 0.9993, test_f1: 0.6836
 epoch: 73, train_loss: 0.4549, test_loss: 1.0016, test_f1: 0.6840
 epoch: 74, train_loss: 0.4373, test_loss: 1.0005, test_f1: 0.6813
 epoch: 75, train_loss: 0.4314, test_loss: 1.0206, test_f1: 0.6865
 epoch: 76, train_loss: 0.4387, test_loss: 1.0366, test_f1: 0.6699
 epoch: 77, train_loss: 0.4408, test_loss: 1.0598, test_f1: 0.6577
 epoch: 78, train_loss: 0.4136, test_loss: 0.9871, test_f1: 0.6826
 epoch: 79, train_loss: 0.4205, test_loss: 1.0396, test_f1: 0.6649
 epoch: 80, train_loss: 0.4347, test_loss: 0.9857, test_f1: 0.6902
 epoch: 81, train_loss: 0.4407, test_loss: 1.0054, test_f1: 0.6699
 epoch: 82, train_loss: 0.4177, test_loss: 1.0471, test_f1: 0.6712
 epoch: 83, train_loss: 0.4170, test_loss: 1.0177, test_f1: 0.6503
 epoch: 84, train_loss: 0.4322, test_loss: 1.0104, test_f1: 0.6913
 epoch: 85, train_loss: 0.4098, test_loss: 1.0325, test_f1: 0.6754
 epoch: 86, train_loss: 0.4160, test_loss: 1.0320, test_f1: 0.6882
 epoch: 87, train_loss: 0.4019, test_loss: 1.0072, test_f1: 0.6796
 epoch: 88, train_loss: 0.4112, test_loss: 1.0712, test_f1: 0.6532
 epoch: 89, train_loss: 0.3991, test_loss: 1.0248, test_f1: 0.6882
 epoch: 90, train_loss: 0.4016, test_loss: 1.0632, test_f1: 0.6798
 epoch: 91, train_loss: 0.4254, test_loss: 1.0464, test_f1: 0.6843
 epoch: 92, train_loss: 0.4071, test_loss: 1.0807, test_f1: 0.6585
 epoch: 93, train_loss: 0.3985, test_loss: 1.1414, test_f1: 0.6588
 epoch: 94, train_loss: 0.4078, test_loss: 1.0864, test_f1: 0.6950
 epoch: 95, train_loss: 0.3872, test_loss: 1.1331, test_f1: 0.6702
 epoch: 96, train_loss: 0.4082, test_loss: 1.0449, test_f1: 0.6910
 epoch: 97, train_loss: 0.4022, test_loss: 1.1284, test_f1: 0.6746
 epoch: 98, train_loss: 0.3936, test_loss: 1.1132, test_f1: 0.6572
 epoch: 99, train_loss: 0.3850, test_loss: 1.1258, test_f1: 0.6788
##################ITERATION #4 ****************************************
 epoch: 0, train_loss: 1.1875, test_loss: 1.0424, test_f1: 0.4459
 epoch: 1, train_loss: 0.9877, test_loss: 0.9753, test_f1: 0.5040
 epoch: 2, train_loss: 0.9522, test_loss: 0.9413, test_f1: 0.5040
 epoch: 3, train_loss: 0.9264, test_loss: 0.9374, test_f1: 0.5289
 epoch: 4, train_loss: 0.9137, test_loss: 0.9384, test_f1: 0.5604
 epoch: 5, train_loss: 0.8911, test_loss: 0.8481, test_f1: 0.5487
 epoch: 6, train_loss: 0.8787, test_loss: 0.8271, test_f1: 0.5538
 epoch: 7, train_loss: 0.8595, test_loss: 0.8443, test_f1: 0.5696
 epoch: 8, train_loss: 0.8378, test_loss: 0.7987, test_f1: 0.5732
 epoch: 9, train_loss: 0.8359, test_loss: 0.7896, test_f1: 0.5956
 epoch: 10, train_loss: 0.8215, test_loss: 0.7769, test_f1: 0.6036
 epoch: 11, train_loss: 0.7986, test_loss: 0.7846, test_f1: 0.6308
 epoch: 12, train_loss: 0.7941, test_loss: 0.7780, test_f1: 0.5966
 epoch: 13, train_loss: 0.7743, test_loss: 0.7898, test_f1: 0.6016
 epoch: 14, train_loss: 0.7718, test_loss: 0.7549, test_f1: 0.6626
 epoch: 15, train_loss: 0.7696, test_loss: 0.7470, test_f1: 0.6423
 epoch: 16, train_loss: 0.7547, test_loss: 0.7776, test_f1: 0.6324
 epoch: 17, train_loss: 0.7478, test_loss: 0.7513, test_f1: 0.6620
 epoch: 18, train_loss: 0.7270, test_loss: 0.7419, test_f1: 0.6735
 epoch: 19, train_loss: 0.7429, test_loss: 0.7486, test_f1: 0.6426
 epoch: 20, train_loss: 0.7259, test_loss: 0.7023, test_f1: 0.6635
 epoch: 21, train_loss: 0.6980, test_loss: 0.8167, test_f1: 0.6701
 epoch: 22, train_loss: 0.7127, test_loss: 0.7735, test_f1: 0.6458
 epoch: 23, train_loss: 0.7148, test_loss: 0.7768, test_f1: 0.6631
 epoch: 24, train_loss: 0.6970, test_loss: 0.7716, test_f1: 0.6756
 epoch: 25, train_loss: 0.6998, test_loss: 0.7527, test_f1: 0.6670
 epoch: 26, train_loss: 0.6537, test_loss: 0.7328, test_f1: 0.6456
 epoch: 27, train_loss: 0.6824, test_loss: 0.7796, test_f1: 0.6474
 epoch: 28, train_loss: 0.6754, test_loss: 0.7428, test_f1: 0.6740
 epoch: 29, train_loss: 0.6510, test_loss: 0.7528, test_f1: 0.6888
 epoch: 30, train_loss: 0.6575, test_loss: 0.7812, test_f1: 0.6749
 epoch: 31, train_loss: 0.6354, test_loss: 0.7501, test_f1: 0.6795
 epoch: 32, train_loss: 0.6188, test_loss: 0.7590, test_f1: 0.6661
 epoch: 33, train_loss: 0.6453, test_loss: 0.7530, test_f1: 0.6561
 epoch: 34, train_loss: 0.6375, test_loss: 0.7833, test_f1: 0.6534
 epoch: 35, train_loss: 0.6181, test_loss: 0.7674, test_f1: 0.6672
 epoch: 36, train_loss: 0.6341, test_loss: 0.8175, test_f1: 0.7008
 epoch: 37, train_loss: 0.6183, test_loss: 0.7748, test_f1: 0.6745
 epoch: 38, train_loss: 0.6130, test_loss: 0.8379, test_f1: 0.6705
 epoch: 39, train_loss: 0.6345, test_loss: 0.7796, test_f1: 0.6740
 epoch: 40, train_loss: 0.6134, test_loss: 0.7856, test_f1: 0.6665
 epoch: 41, train_loss: 0.6187, test_loss: 0.7739, test_f1: 0.6829
 epoch: 42, train_loss: 0.5983, test_loss: 0.8144, test_f1: 0.6749
 epoch: 43, train_loss: 0.5841, test_loss: 0.8018, test_f1: 0.6791
 epoch: 44, train_loss: 0.5789, test_loss: 0.7944, test_f1: 0.7018
 epoch: 45, train_loss: 0.5766, test_loss: 0.8444, test_f1: 0.6692
 epoch: 46, train_loss: 0.5732, test_loss: 0.8185, test_f1: 0.6565
 epoch: 47, train_loss: 0.5986, test_loss: 0.7719, test_f1: 0.6825
 epoch: 48, train_loss: 0.5725, test_loss: 0.7370, test_f1: 0.7175
 epoch: 49, train_loss: 0.5740, test_loss: 0.8267, test_f1: 0.6882
 epoch: 50, train_loss: 0.5656, test_loss: 0.8356, test_f1: 0.6829
 epoch: 51, train_loss: 0.5287, test_loss: 0.8260, test_f1: 0.6885
 epoch: 52, train_loss: 0.5239, test_loss: 0.8049, test_f1: 0.6878
 epoch: 53, train_loss: 0.5268, test_loss: 0.7967, test_f1: 0.6925
 epoch: 54, train_loss: 0.5140, test_loss: 0.8132, test_f1: 0.6918
 epoch: 55, train_loss: 0.4930, test_loss: 0.8331, test_f1: 0.6830
 epoch: 56, train_loss: 0.5013, test_loss: 0.8295, test_f1: 0.6925
 epoch: 57, train_loss: 0.4940, test_loss: 0.8603, test_f1: 0.7075
 epoch: 58, train_loss: 0.4947, test_loss: 0.8548, test_f1: 0.6781
 epoch: 59, train_loss: 0.4925, test_loss: 0.8588, test_f1: 0.6981
 epoch: 60, train_loss: 0.4769, test_loss: 0.8399, test_f1: 0.6876
 epoch: 61, train_loss: 0.4768, test_loss: 0.8521, test_f1: 0.6826
 epoch: 62, train_loss: 0.4742, test_loss: 0.8670, test_f1: 0.6884
 epoch: 63, train_loss: 0.4825, test_loss: 0.8585, test_f1: 0.6870
 epoch: 64, train_loss: 0.4835, test_loss: 0.8345, test_f1: 0.6914
 epoch: 65, train_loss: 0.4922, test_loss: 0.8645, test_f1: 0.6826
 epoch: 66, train_loss: 0.4965, test_loss: 0.8956, test_f1: 0.6845
 epoch: 67, train_loss: 0.4784, test_loss: 0.9171, test_f1: 0.6785
 epoch: 68, train_loss: 0.4672, test_loss: 0.9532, test_f1: 0.6581
 epoch: 69, train_loss: 0.4796, test_loss: 0.8987, test_f1: 0.6721
 epoch: 70, train_loss: 0.4599, test_loss: 0.8747, test_f1: 0.6813
 epoch: 71, train_loss: 0.4765, test_loss: 0.8603, test_f1: 0.6823
 epoch: 72, train_loss: 0.4600, test_loss: 0.8468, test_f1: 0.7056
 epoch: 73, train_loss: 0.4736, test_loss: 0.8989, test_f1: 0.6773
 epoch: 74, train_loss: 0.4498, test_loss: 0.9050, test_f1: 0.6776
 epoch: 75, train_loss: 0.4436, test_loss: 1.0109, test_f1: 0.6935
 epoch: 76, train_loss: 0.4489, test_loss: 0.9226, test_f1: 0.6715
 epoch: 77, train_loss: 0.4741, test_loss: 0.9013, test_f1: 0.6938
 epoch: 78, train_loss: 0.4381, test_loss: 0.9336, test_f1: 0.6868
 epoch: 79, train_loss: 0.4658, test_loss: 0.8932, test_f1: 0.7045
 epoch: 80, train_loss: 0.4361, test_loss: 0.9460, test_f1: 0.6805
 epoch: 81, train_loss: 0.4506, test_loss: 0.8894, test_f1: 0.6730
 epoch: 82, train_loss: 0.4499, test_loss: 0.9710, test_f1: 0.6693
 epoch: 83, train_loss: 0.4427, test_loss: 0.9079, test_f1: 0.6811
 epoch: 84, train_loss: 0.4285, test_loss: 0.9095, test_f1: 0.6881
 epoch: 85, train_loss: 0.4190, test_loss: 0.9957, test_f1: 0.6844
 epoch: 86, train_loss: 0.4405, test_loss: 0.9479, test_f1: 0.6940
 epoch: 87, train_loss: 0.4357, test_loss: 0.9317, test_f1: 0.6750
 epoch: 88, train_loss: 0.4214, test_loss: 0.9005, test_f1: 0.6988
 epoch: 89, train_loss: 0.4091, test_loss: 0.9215, test_f1: 0.6848
 epoch: 90, train_loss: 0.4254, test_loss: 0.9437, test_f1: 0.6929
 epoch: 91, train_loss: 0.4217, test_loss: 0.9970, test_f1: 0.6851
 epoch: 92, train_loss: 0.4026, test_loss: 0.9659, test_f1: 0.6740
 epoch: 93, train_loss: 0.4429, test_loss: 0.9674, test_f1: 0.6829
 epoch: 94, train_loss: 0.4103, test_loss: 0.9437, test_f1: 0.6908
 epoch: 95, train_loss: 0.4207, test_loss: 1.0156, test_f1: 0.6912
 epoch: 96, train_loss: 0.4220, test_loss: 0.9608, test_f1: 0.6906
 epoch: 97, train_loss: 0.4265, test_loss: 0.9062, test_f1: 0.7092
 epoch: 98, train_loss: 0.4119, test_loss: 0.9719, test_f1: 0.6830
 epoch: 99, train_loss: 0.4036, test_loss: 0.9521, test_f1: 0.6909
##################ITERATION #5 ****************************************
 epoch: 0, train_loss: 1.1569, test_loss: 0.9998, test_f1: 0.5087
 epoch: 1, train_loss: 0.9817, test_loss: 0.9300, test_f1: 0.5574
 epoch: 2, train_loss: 0.9544, test_loss: 0.9213, test_f1: 0.5564
 epoch: 3, train_loss: 0.9281, test_loss: 0.8781, test_f1: 0.5687
 epoch: 4, train_loss: 0.9066, test_loss: 0.8951, test_f1: 0.5275
 epoch: 5, train_loss: 0.8975, test_loss: 0.8500, test_f1: 0.5799
 epoch: 6, train_loss: 0.8735, test_loss: 0.8469, test_f1: 0.5742
 epoch: 7, train_loss: 0.8647, test_loss: 0.8415, test_f1: 0.5763
 epoch: 8, train_loss: 0.8377, test_loss: 0.9191, test_f1: 0.5246
 epoch: 9, train_loss: 0.8436, test_loss: 0.8330, test_f1: 0.5864
 epoch: 10, train_loss: 0.8284, test_loss: 0.8836, test_f1: 0.5881
 epoch: 11, train_loss: 0.8085, test_loss: 0.8371, test_f1: 0.6184
 epoch: 12, train_loss: 0.8029, test_loss: 0.8516, test_f1: 0.6301
 epoch: 13, train_loss: 0.7789, test_loss: 0.8305, test_f1: 0.6094
 epoch: 14, train_loss: 0.7841, test_loss: 0.8183, test_f1: 0.6204
 epoch: 15, train_loss: 0.7890, test_loss: 0.8646, test_f1: 0.5779
 epoch: 16, train_loss: 0.7868, test_loss: 0.7938, test_f1: 0.6378
 epoch: 17, train_loss: 0.7652, test_loss: 0.8110, test_f1: 0.6324
 epoch: 18, train_loss: 0.7493, test_loss: 0.8585, test_f1: 0.6500
 epoch: 19, train_loss: 0.7444, test_loss: 0.8147, test_f1: 0.6303
 epoch: 20, train_loss: 0.7310, test_loss: 0.8019, test_f1: 0.6359
 epoch: 21, train_loss: 0.7273, test_loss: 0.8030, test_f1: 0.6456
 epoch: 22, train_loss: 0.7115, test_loss: 0.8209, test_f1: 0.6438
 epoch: 23, train_loss: 0.7329, test_loss: 0.8022, test_f1: 0.6299
 epoch: 24, train_loss: 0.7127, test_loss: 0.8424, test_f1: 0.6576
 epoch: 25, train_loss: 0.6951, test_loss: 0.8217, test_f1: 0.6530
 epoch: 26, train_loss: 0.6812, test_loss: 0.8278, test_f1: 0.6403
 epoch: 27, train_loss: 0.6835, test_loss: 0.8169, test_f1: 0.6514
 epoch: 28, train_loss: 0.6654, test_loss: 0.7919, test_f1: 0.6745
 epoch: 29, train_loss: 0.6497, test_loss: 0.8375, test_f1: 0.6573
 epoch: 30, train_loss: 0.6508, test_loss: 0.8635, test_f1: 0.6420
 epoch: 31, train_loss: 0.6444, test_loss: 0.8528, test_f1: 0.6280
 epoch: 32, train_loss: 0.6562, test_loss: 0.7878, test_f1: 0.6718
 epoch: 33, train_loss: 0.6339, test_loss: 0.8209, test_f1: 0.6515
 epoch: 34, train_loss: 0.6382, test_loss: 0.8413, test_f1: 0.6707
 epoch: 35, train_loss: 0.6486, test_loss: 0.8209, test_f1: 0.6560
 epoch: 36, train_loss: 0.6194, test_loss: 0.8285, test_f1: 0.6634
 epoch: 37, train_loss: 0.6316, test_loss: 0.8027, test_f1: 0.6944
 epoch: 38, train_loss: 0.6163, test_loss: 0.8218, test_f1: 0.6433
 epoch: 39, train_loss: 0.6286, test_loss: 0.8207, test_f1: 0.6669
 epoch: 40, train_loss: 0.6161, test_loss: 0.8418, test_f1: 0.6632
 epoch: 41, train_loss: 0.6149, test_loss: 0.8085, test_f1: 0.6715
 epoch: 42, train_loss: 0.6256, test_loss: 0.8403, test_f1: 0.6667
 epoch: 43, train_loss: 0.5929, test_loss: 0.8277, test_f1: 0.6607
 epoch: 44, train_loss: 0.5883, test_loss: 0.8350, test_f1: 0.6326
 epoch: 45, train_loss: 0.5951, test_loss: 0.8458, test_f1: 0.6695
 epoch: 46, train_loss: 0.5723, test_loss: 0.8235, test_f1: 0.6760
 epoch: 47, train_loss: 0.5918, test_loss: 0.8139, test_f1: 0.6894
 epoch: 48, train_loss: 0.5541, test_loss: 1.0065, test_f1: 0.6403
 epoch: 49, train_loss: 0.5753, test_loss: 0.8213, test_f1: 0.6646
 epoch: 50, train_loss: 0.5509, test_loss: 0.8402, test_f1: 0.6777
 epoch: 51, train_loss: 0.5295, test_loss: 0.8579, test_f1: 0.6818
 epoch: 52, train_loss: 0.5312, test_loss: 0.8761, test_f1: 0.6719
 epoch: 53, train_loss: 0.5120, test_loss: 0.9413, test_f1: 0.6443
 epoch: 54, train_loss: 0.5095, test_loss: 0.8878, test_f1: 0.6824
 epoch: 55, train_loss: 0.5059, test_loss: 0.9053, test_f1: 0.6646
 epoch: 56, train_loss: 0.5101, test_loss: 0.9312, test_f1: 0.6593
 epoch: 57, train_loss: 0.4842, test_loss: 0.9109, test_f1: 0.6839
 epoch: 58, train_loss: 0.4966, test_loss: 0.9170, test_f1: 0.6681
 epoch: 59, train_loss: 0.5083, test_loss: 0.9100, test_f1: 0.6949
 epoch: 60, train_loss: 0.4937, test_loss: 0.9371, test_f1: 0.6724
 epoch: 61, train_loss: 0.4947, test_loss: 0.9913, test_f1: 0.6563
 epoch: 62, train_loss: 0.4718, test_loss: 0.9221, test_f1: 0.6604
 epoch: 63, train_loss: 0.4769, test_loss: 0.9878, test_f1: 0.6806
 epoch: 64, train_loss: 0.4894, test_loss: 0.9435, test_f1: 0.6640
 epoch: 65, train_loss: 0.4816, test_loss: 0.9854, test_f1: 0.6476
 epoch: 66, train_loss: 0.4729, test_loss: 0.9550, test_f1: 0.6679
 epoch: 67, train_loss: 0.4682, test_loss: 0.9976, test_f1: 0.6725
 epoch: 68, train_loss: 0.4771, test_loss: 0.9101, test_f1: 0.6787
 epoch: 69, train_loss: 0.4851, test_loss: 0.9061, test_f1: 0.6824
 epoch: 70, train_loss: 0.4554, test_loss: 0.9522, test_f1: 0.6662
 epoch: 71, train_loss: 0.4583, test_loss: 1.0076, test_f1: 0.6728
 epoch: 72, train_loss: 0.4694, test_loss: 1.0395, test_f1: 0.6588
 epoch: 73, train_loss: 0.4446, test_loss: 1.0087, test_f1: 0.6742
 epoch: 74, train_loss: 0.4638, test_loss: 1.0612, test_f1: 0.6759
 epoch: 75, train_loss: 0.4686, test_loss: 0.9718, test_f1: 0.6796
 epoch: 76, train_loss: 0.4479, test_loss: 0.9941, test_f1: 0.6693
 epoch: 77, train_loss: 0.4511, test_loss: 1.0193, test_f1: 0.6657
 epoch: 78, train_loss: 0.4571, test_loss: 1.0791, test_f1: 0.6669
 epoch: 79, train_loss: 0.4322, test_loss: 1.0591, test_f1: 0.6728
 epoch: 80, train_loss: 0.4389, test_loss: 1.0497, test_f1: 0.6818
 epoch: 81, train_loss: 0.4571, test_loss: 1.0603, test_f1: 0.6494
 epoch: 82, train_loss: 0.4377, test_loss: 1.0279, test_f1: 0.6772
 epoch: 83, train_loss: 0.4150, test_loss: 1.0558, test_f1: 0.6672
 epoch: 84, train_loss: 0.4357, test_loss: 1.0714, test_f1: 0.6717
 epoch: 85, train_loss: 0.4230, test_loss: 1.0476, test_f1: 0.6654
 epoch: 86, train_loss: 0.4165, test_loss: 1.0831, test_f1: 0.6746
 epoch: 87, train_loss: 0.4310, test_loss: 1.0180, test_f1: 0.6829
 epoch: 88, train_loss: 0.4327, test_loss: 1.0545, test_f1: 0.6672
 epoch: 89, train_loss: 0.4201, test_loss: 1.1190, test_f1: 0.6559
 epoch: 90, train_loss: 0.4187, test_loss: 1.1366, test_f1: 0.6553
 epoch: 91, train_loss: 0.4242, test_loss: 1.0549, test_f1: 0.6929
 epoch: 92, train_loss: 0.4376, test_loss: 1.0977, test_f1: 0.6704
 epoch: 93, train_loss: 0.4270, test_loss: 1.2020, test_f1: 0.6559
 epoch: 94, train_loss: 0.4235, test_loss: 1.1114, test_f1: 0.6608
 epoch: 95, train_loss: 0.4445, test_loss: 1.1255, test_f1: 0.6507
 epoch: 96, train_loss: 0.4167, test_loss: 1.1354, test_f1: 0.6599
 epoch: 97, train_loss: 0.4132, test_loss: 1.1532, test_f1: 0.6641
 epoch: 98, train_loss: 0.4110, test_loss: 1.0731, test_f1: 0.6426
 epoch: 99, train_loss: 0.3960, test_loss: 1.0787, test_f1: 0.6733
##################ITERATION #6 ****************************************
 epoch: 0, train_loss: 1.2317, test_loss: 0.9489, test_f1: 0.5289
 epoch: 1, train_loss: 0.9872, test_loss: 0.9400, test_f1: 0.5398
 epoch: 2, train_loss: 0.9453, test_loss: 0.9224, test_f1: 0.5568
 epoch: 3, train_loss: 0.9266, test_loss: 0.8895, test_f1: 0.5466
 epoch: 4, train_loss: 0.9052, test_loss: 0.8924, test_f1: 0.5750
 epoch: 5, train_loss: 0.8948, test_loss: 0.8659, test_f1: 0.5372
 epoch: 6, train_loss: 0.8745, test_loss: 0.8851, test_f1: 0.5834
 epoch: 7, train_loss: 0.8518, test_loss: 0.8716, test_f1: 0.5812
 epoch: 8, train_loss: 0.8400, test_loss: 0.8648, test_f1: 0.6242
 epoch: 9, train_loss: 0.8325, test_loss: 0.8088, test_f1: 0.6195
 epoch: 10, train_loss: 0.8316, test_loss: 0.8528, test_f1: 0.6012
 epoch: 11, train_loss: 0.8220, test_loss: 0.8401, test_f1: 0.6214
 epoch: 12, train_loss: 0.7946, test_loss: 0.8386, test_f1: 0.6255
 epoch: 13, train_loss: 0.7906, test_loss: 0.7797, test_f1: 0.6020
 epoch: 14, train_loss: 0.7725, test_loss: 0.7982, test_f1: 0.6375
 epoch: 15, train_loss: 0.7572, test_loss: 0.7686, test_f1: 0.6426
 epoch: 16, train_loss: 0.7742, test_loss: 0.8228, test_f1: 0.6326
 epoch: 17, train_loss: 0.7513, test_loss: 0.8130, test_f1: 0.6282
 epoch: 18, train_loss: 0.7394, test_loss: 0.8251, test_f1: 0.6403
 epoch: 19, train_loss: 0.7382, test_loss: 0.7387, test_f1: 0.6369
 epoch: 20, train_loss: 0.7431, test_loss: 0.7141, test_f1: 0.6448
 epoch: 21, train_loss: 0.7207, test_loss: 0.7289, test_f1: 0.6383
 epoch: 22, train_loss: 0.6997, test_loss: 0.8070, test_f1: 0.6663
 epoch: 23, train_loss: 0.7071, test_loss: 0.7827, test_f1: 0.6533
 epoch: 24, train_loss: 0.6894, test_loss: 0.7039, test_f1: 0.6764
 epoch: 25, train_loss: 0.6832, test_loss: 0.7900, test_f1: 0.6765
 epoch: 26, train_loss: 0.6553, test_loss: 0.8110, test_f1: 0.6396
 epoch: 27, train_loss: 0.6735, test_loss: 0.7676, test_f1: 0.6546
 epoch: 28, train_loss: 0.6657, test_loss: 0.7929, test_f1: 0.6504
 epoch: 29, train_loss: 0.6561, test_loss: 0.8119, test_f1: 0.6408
 epoch: 30, train_loss: 0.6627, test_loss: 0.7885, test_f1: 0.6659
 epoch: 31, train_loss: 0.6372, test_loss: 0.7287, test_f1: 0.6615
 epoch: 32, train_loss: 0.6427, test_loss: 0.7751, test_f1: 0.6524
 epoch: 33, train_loss: 0.6125, test_loss: 0.8155, test_f1: 0.6729
 epoch: 34, train_loss: 0.6196, test_loss: 0.7951, test_f1: 0.6582
 epoch: 35, train_loss: 0.6088, test_loss: 0.7940, test_f1: 0.6638
 epoch: 36, train_loss: 0.6178, test_loss: 0.8149, test_f1: 0.6571
 epoch: 37, train_loss: 0.6160, test_loss: 0.7399, test_f1: 0.6635
 epoch: 38, train_loss: 0.6044, test_loss: 0.7748, test_f1: 0.6628
 epoch: 39, train_loss: 0.5967, test_loss: 0.8910, test_f1: 0.6397
 epoch: 40, train_loss: 0.5937, test_loss: 0.8636, test_f1: 0.6588
 epoch: 41, train_loss: 0.5949, test_loss: 0.9306, test_f1: 0.6752
 epoch: 42, train_loss: 0.6001, test_loss: 0.8488, test_f1: 0.6437
 epoch: 43, train_loss: 0.5756, test_loss: 0.8597, test_f1: 0.6740
 epoch: 44, train_loss: 0.5728, test_loss: 0.8650, test_f1: 0.6840
 epoch: 45, train_loss: 0.5493, test_loss: 0.8644, test_f1: 0.6792
 epoch: 46, train_loss: 0.5677, test_loss: 0.8635, test_f1: 0.6530
 epoch: 47, train_loss: 0.5492, test_loss: 0.8084, test_f1: 0.6755
 epoch: 48, train_loss: 0.5520, test_loss: 0.9170, test_f1: 0.6610
 epoch: 49, train_loss: 0.5554, test_loss: 0.9418, test_f1: 0.6438
 epoch: 50, train_loss: 0.5342, test_loss: 0.8320, test_f1: 0.6533
 epoch: 51, train_loss: 0.5176, test_loss: 0.9192, test_f1: 0.6570
 epoch: 52, train_loss: 0.5065, test_loss: 0.9244, test_f1: 0.6606
 epoch: 53, train_loss: 0.4828, test_loss: 0.9391, test_f1: 0.6541
 epoch: 54, train_loss: 0.5005, test_loss: 0.9202, test_f1: 0.6630
 epoch: 55, train_loss: 0.4859, test_loss: 0.9511, test_f1: 0.6720
 epoch: 56, train_loss: 0.4822, test_loss: 0.9461, test_f1: 0.6857
 epoch: 57, train_loss: 0.4735, test_loss: 0.9918, test_f1: 0.6696
 epoch: 58, train_loss: 0.4793, test_loss: 1.0221, test_f1: 0.6535
 epoch: 59, train_loss: 0.4728, test_loss: 0.9759, test_f1: 0.6593
 epoch: 60, train_loss: 0.4583, test_loss: 1.0192, test_f1: 0.6700
 epoch: 61, train_loss: 0.4747, test_loss: 0.9659, test_f1: 0.6730
 epoch: 62, train_loss: 0.4608, test_loss: 0.9395, test_f1: 0.6829
 epoch: 63, train_loss: 0.4622, test_loss: 0.9832, test_f1: 0.6625
 epoch: 64, train_loss: 0.4503, test_loss: 1.0320, test_f1: 0.6839
 epoch: 65, train_loss: 0.4592, test_loss: 0.9712, test_f1: 0.6677
 epoch: 66, train_loss: 0.4583, test_loss: 0.9804, test_f1: 0.6809
 epoch: 67, train_loss: 0.4517, test_loss: 1.0359, test_f1: 0.6614
 epoch: 68, train_loss: 0.4543, test_loss: 0.9789, test_f1: 0.6709
 epoch: 69, train_loss: 0.4548, test_loss: 1.0303, test_f1: 0.6746
 epoch: 70, train_loss: 0.4474, test_loss: 0.9626, test_f1: 0.6880
 epoch: 71, train_loss: 0.4365, test_loss: 0.9467, test_f1: 0.6900
 epoch: 72, train_loss: 0.4364, test_loss: 1.1290, test_f1: 0.6768
 epoch: 73, train_loss: 0.4423, test_loss: 1.0791, test_f1: 0.6671
 epoch: 74, train_loss: 0.4269, test_loss: 1.0392, test_f1: 0.6721
 epoch: 75, train_loss: 0.4424, test_loss: 1.0854, test_f1: 0.6735
 epoch: 76, train_loss: 0.4407, test_loss: 1.1111, test_f1: 0.6860
 epoch: 77, train_loss: 0.4135, test_loss: 1.0360, test_f1: 0.6805
 epoch: 78, train_loss: 0.4262, test_loss: 1.0996, test_f1: 0.6836
 epoch: 79, train_loss: 0.4303, test_loss: 1.1492, test_f1: 0.6883
 epoch: 80, train_loss: 0.4276, test_loss: 1.0549, test_f1: 0.6781
 epoch: 81, train_loss: 0.4057, test_loss: 1.1113, test_f1: 0.6940
 epoch: 82, train_loss: 0.4278, test_loss: 1.1463, test_f1: 0.6815
 epoch: 83, train_loss: 0.4192, test_loss: 1.0884, test_f1: 0.6678
 epoch: 84, train_loss: 0.4163, test_loss: 1.1049, test_f1: 0.6642
 epoch: 85, train_loss: 0.4133, test_loss: 1.1364, test_f1: 0.6707
 epoch: 86, train_loss: 0.3981, test_loss: 1.1181, test_f1: 0.6878
 epoch: 87, train_loss: 0.4016, test_loss: 1.1526, test_f1: 0.6784
 epoch: 88, train_loss: 0.4115, test_loss: 1.1501, test_f1: 0.7032
 epoch: 89, train_loss: 0.3987, test_loss: 1.1580, test_f1: 0.6765
 epoch: 90, train_loss: 0.3866, test_loss: 1.1735, test_f1: 0.6796
 epoch: 91, train_loss: 0.4153, test_loss: 1.1384, test_f1: 0.6816
 epoch: 92, train_loss: 0.3906, test_loss: 1.1592, test_f1: 0.6756
 epoch: 93, train_loss: 0.3997, test_loss: 1.1569, test_f1: 0.6659
 epoch: 94, train_loss: 0.3988, test_loss: 1.1296, test_f1: 0.6874
 epoch: 95, train_loss: 0.3976, test_loss: 1.1603, test_f1: 0.6628
 epoch: 96, train_loss: 0.3899, test_loss: 1.2155, test_f1: 0.6566
 epoch: 97, train_loss: 0.3845, test_loss: 1.1849, test_f1: 0.6931
 epoch: 98, train_loss: 0.4110, test_loss: 1.1725, test_f1: 0.6886
 epoch: 99, train_loss: 0.3938, test_loss: 1.0772, test_f1: 0.6698
##################ITERATION #7 ****************************************
 epoch: 0, train_loss: 1.1784, test_loss: 0.9695, test_f1: 0.5196
 epoch: 1, train_loss: 0.9847, test_loss: 0.9427, test_f1: 0.5202
 epoch: 2, train_loss: 0.9390, test_loss: 0.9122, test_f1: 0.5510
 epoch: 3, train_loss: 0.9247, test_loss: 0.8597, test_f1: 0.5449
 epoch: 4, train_loss: 0.8988, test_loss: 0.8741, test_f1: 0.5724
 epoch: 5, train_loss: 0.8858, test_loss: 0.8820, test_f1: 0.5622
 epoch: 6, train_loss: 0.8633, test_loss: 0.8516, test_f1: 0.5708
 epoch: 7, train_loss: 0.8454, test_loss: 0.8148, test_f1: 0.5973
 epoch: 8, train_loss: 0.8397, test_loss: 0.8429, test_f1: 0.5492
 epoch: 9, train_loss: 0.8364, test_loss: 0.8467, test_f1: 0.5761
 epoch: 10, train_loss: 0.8143, test_loss: 0.7958, test_f1: 0.5931
 epoch: 11, train_loss: 0.7981, test_loss: 0.7626, test_f1: 0.6127
 epoch: 12, train_loss: 0.7819, test_loss: 0.7961, test_f1: 0.6421
 epoch: 13, train_loss: 0.7882, test_loss: 0.8290, test_f1: 0.5961
 epoch: 14, train_loss: 0.7638, test_loss: 0.7432, test_f1: 0.6374
 epoch: 15, train_loss: 0.7576, test_loss: 0.8152, test_f1: 0.6169
 epoch: 16, train_loss: 0.7512, test_loss: 0.7771, test_f1: 0.6249
 epoch: 17, train_loss: 0.7377, test_loss: 0.7551, test_f1: 0.6604
 epoch: 18, train_loss: 0.7359, test_loss: 0.7707, test_f1: 0.6611
 epoch: 19, train_loss: 0.7174, test_loss: 0.8063, test_f1: 0.6665
 epoch: 20, train_loss: 0.7193, test_loss: 0.7997, test_f1: 0.6793
 epoch: 21, train_loss: 0.7025, test_loss: 0.7829, test_f1: 0.6512
 epoch: 22, train_loss: 0.7071, test_loss: 0.7811, test_f1: 0.6725
 epoch: 23, train_loss: 0.6982, test_loss: 0.7637, test_f1: 0.6476
 epoch: 24, train_loss: 0.6733, test_loss: 0.8172, test_f1: 0.6525
 epoch: 25, train_loss: 0.6626, test_loss: 0.8115, test_f1: 0.6508
 epoch: 26, train_loss: 0.6830, test_loss: 0.7179, test_f1: 0.6872
 epoch: 27, train_loss: 0.6789, test_loss: 0.7346, test_f1: 0.6757
 epoch: 28, train_loss: 0.6632, test_loss: 0.7613, test_f1: 0.6744
 epoch: 29, train_loss: 0.6564, test_loss: 0.7407, test_f1: 0.6680
 epoch: 30, train_loss: 0.6363, test_loss: 0.7515, test_f1: 0.6602
 epoch: 31, train_loss: 0.6402, test_loss: 0.7165, test_f1: 0.6892
 epoch: 32, train_loss: 0.6428, test_loss: 0.7583, test_f1: 0.6511
 epoch: 33, train_loss: 0.6381, test_loss: 0.7609, test_f1: 0.6556
 epoch: 34, train_loss: 0.6222, test_loss: 0.8122, test_f1: 0.6633
 epoch: 35, train_loss: 0.6194, test_loss: 0.7759, test_f1: 0.6686
 epoch: 36, train_loss: 0.6096, test_loss: 0.7511, test_f1: 0.6769
 epoch: 37, train_loss: 0.6004, test_loss: 0.6968, test_f1: 0.6831
 epoch: 38, train_loss: 0.5935, test_loss: 0.7221, test_f1: 0.6753
 epoch: 39, train_loss: 0.5793, test_loss: 0.8238, test_f1: 0.6514
 epoch: 40, train_loss: 0.6020, test_loss: 0.7423, test_f1: 0.6934
 epoch: 41, train_loss: 0.5956, test_loss: 0.7853, test_f1: 0.6435
 epoch: 42, train_loss: 0.5834, test_loss: 0.7552, test_f1: 0.6593
 epoch: 43, train_loss: 0.5815, test_loss: 0.7475, test_f1: 0.6715
 epoch: 44, train_loss: 0.5892, test_loss: 0.7980, test_f1: 0.6600
 epoch: 45, train_loss: 0.5760, test_loss: 0.7830, test_f1: 0.6453
 epoch: 46, train_loss: 0.5866, test_loss: 0.7427, test_f1: 0.6880
 epoch: 47, train_loss: 0.5608, test_loss: 0.7957, test_f1: 0.6633
 epoch: 48, train_loss: 0.5586, test_loss: 0.7646, test_f1: 0.6722
 epoch: 49, train_loss: 0.5333, test_loss: 0.8239, test_f1: 0.6528
 epoch: 50, train_loss: 0.5696, test_loss: 0.7629, test_f1: 0.6634
 epoch: 51, train_loss: 0.5321, test_loss: 0.7601, test_f1: 0.6816
 epoch: 52, train_loss: 0.5082, test_loss: 0.7828, test_f1: 0.6765
 epoch: 53, train_loss: 0.4995, test_loss: 0.8032, test_f1: 0.6722
 epoch: 54, train_loss: 0.4974, test_loss: 0.8076, test_f1: 0.6643
 epoch: 55, train_loss: 0.5047, test_loss: 0.8161, test_f1: 0.6670
 epoch: 56, train_loss: 0.4970, test_loss: 0.8059, test_f1: 0.6588
 epoch: 57, train_loss: 0.4892, test_loss: 0.8254, test_f1: 0.6882
 epoch: 58, train_loss: 0.4838, test_loss: 0.7838, test_f1: 0.6633
 epoch: 59, train_loss: 0.4937, test_loss: 0.8133, test_f1: 0.6515
 epoch: 60, train_loss: 0.4756, test_loss: 0.8153, test_f1: 0.6744
 epoch: 61, train_loss: 0.4717, test_loss: 0.8400, test_f1: 0.6704
 epoch: 62, train_loss: 0.4513, test_loss: 0.8560, test_f1: 0.6755
 epoch: 63, train_loss: 0.4775, test_loss: 0.8377, test_f1: 0.6703
 epoch: 64, train_loss: 0.4748, test_loss: 0.8569, test_f1: 0.6782
 epoch: 65, train_loss: 0.4624, test_loss: 0.8096, test_f1: 0.6816
 epoch: 66, train_loss: 0.4764, test_loss: 0.8538, test_f1: 0.6723
 epoch: 67, train_loss: 0.4580, test_loss: 0.8729, test_f1: 0.6754
 epoch: 68, train_loss: 0.4528, test_loss: 0.8870, test_f1: 0.6591
 epoch: 69, train_loss: 0.4470, test_loss: 0.8414, test_f1: 0.6902
 epoch: 70, train_loss: 0.4552, test_loss: 0.8254, test_f1: 0.6838
 epoch: 71, train_loss: 0.4441, test_loss: 0.8649, test_f1: 0.6891
 epoch: 72, train_loss: 0.4386, test_loss: 0.9149, test_f1: 0.6442
 epoch: 73, train_loss: 0.4460, test_loss: 0.8589, test_f1: 0.6907
 epoch: 74, train_loss: 0.4405, test_loss: 0.8868, test_f1: 0.6843
 epoch: 75, train_loss: 0.4406, test_loss: 0.9314, test_f1: 0.6755
 epoch: 76, train_loss: 0.4324, test_loss: 0.8494, test_f1: 0.6823
 epoch: 77, train_loss: 0.4389, test_loss: 0.9398, test_f1: 0.6695
 epoch: 78, train_loss: 0.4276, test_loss: 0.9497, test_f1: 0.6808
 epoch: 79, train_loss: 0.4205, test_loss: 0.8890, test_f1: 0.6562
 epoch: 80, train_loss: 0.4170, test_loss: 1.0045, test_f1: 0.6704
 epoch: 81, train_loss: 0.4366, test_loss: 0.9702, test_f1: 0.6799
 epoch: 82, train_loss: 0.4168, test_loss: 0.9591, test_f1: 0.6592
 epoch: 83, train_loss: 0.4457, test_loss: 0.9642, test_f1: 0.6710
 epoch: 84, train_loss: 0.4117, test_loss: 0.8783, test_f1: 0.6785
 epoch: 85, train_loss: 0.4226, test_loss: 0.9251, test_f1: 0.6650
 epoch: 86, train_loss: 0.4105, test_loss: 0.9223, test_f1: 0.6817
 epoch: 87, train_loss: 0.4170, test_loss: 0.9353, test_f1: 0.6742
 epoch: 88, train_loss: 0.4122, test_loss: 0.9791, test_f1: 0.6852
 epoch: 89, train_loss: 0.4206, test_loss: 0.9579, test_f1: 0.6815
 epoch: 90, train_loss: 0.4170, test_loss: 0.9540, test_f1: 0.6744
 epoch: 91, train_loss: 0.4021, test_loss: 0.9747, test_f1: 0.6869
 epoch: 92, train_loss: 0.4106, test_loss: 0.9952, test_f1: 0.6767
 epoch: 93, train_loss: 0.3975, test_loss: 0.9771, test_f1: 0.6687
 epoch: 94, train_loss: 0.4073, test_loss: 0.8874, test_f1: 0.6801
 epoch: 95, train_loss: 0.3739, test_loss: 0.9431, test_f1: 0.6768
 epoch: 96, train_loss: 0.3726, test_loss: 1.0195, test_f1: 0.6766
 epoch: 97, train_loss: 0.3905, test_loss: 1.0001, test_f1: 0.6817
 epoch: 98, train_loss: 0.4034, test_loss: 1.0217, test_f1: 0.6715
 epoch: 99, train_loss: 0.3600, test_loss: 1.0637, test_f1: 0.6669
##################ITERATION #8 ****************************************
 epoch: 0, train_loss: 1.1724, test_loss: 0.9702, test_f1: 0.4758
 epoch: 1, train_loss: 0.9922, test_loss: 0.9455, test_f1: 0.4752
 epoch: 2, train_loss: 0.9608, test_loss: 0.9431, test_f1: 0.5375
 epoch: 3, train_loss: 0.9256, test_loss: 0.9189, test_f1: 0.5435
 epoch: 4, train_loss: 0.9026, test_loss: 0.9190, test_f1: 0.5493
 epoch: 5, train_loss: 0.8897, test_loss: 0.8437, test_f1: 0.5603
 epoch: 6, train_loss: 0.8755, test_loss: 0.8464, test_f1: 0.5876
 epoch: 7, train_loss: 0.8587, test_loss: 0.8343, test_f1: 0.5954
 epoch: 8, train_loss: 0.8382, test_loss: 0.8102, test_f1: 0.5993
 epoch: 9, train_loss: 0.8137, test_loss: 0.8217, test_f1: 0.6329
 epoch: 10, train_loss: 0.8136, test_loss: 0.7936, test_f1: 0.6177
 epoch: 11, train_loss: 0.7977, test_loss: 0.7879, test_f1: 0.6701
 epoch: 12, train_loss: 0.7850, test_loss: 0.7679, test_f1: 0.6299
 epoch: 13, train_loss: 0.7655, test_loss: 0.7691, test_f1: 0.6371
 epoch: 14, train_loss: 0.7781, test_loss: 0.7893, test_f1: 0.6469
 epoch: 15, train_loss: 0.7502, test_loss: 0.8131, test_f1: 0.6326
 epoch: 16, train_loss: 0.7216, test_loss: 0.7731, test_f1: 0.6345
 epoch: 17, train_loss: 0.7445, test_loss: 0.7997, test_f1: 0.6504
 epoch: 18, train_loss: 0.7220, test_loss: 0.7120, test_f1: 0.6661
 epoch: 19, train_loss: 0.7204, test_loss: 0.7513, test_f1: 0.6601
 epoch: 20, train_loss: 0.7187, test_loss: 0.7264, test_f1: 0.6755
 epoch: 21, train_loss: 0.7059, test_loss: 0.7671, test_f1: 0.6403
 epoch: 22, train_loss: 0.7024, test_loss: 0.7564, test_f1: 0.6460
 epoch: 23, train_loss: 0.6958, test_loss: 0.7241, test_f1: 0.6613
 epoch: 24, train_loss: 0.6666, test_loss: 0.7566, test_f1: 0.6601
 epoch: 25, train_loss: 0.6774, test_loss: 0.7882, test_f1: 0.6634
 epoch: 26, train_loss: 0.6805, test_loss: 0.7135, test_f1: 0.6617
 epoch: 27, train_loss: 0.6611, test_loss: 0.7021, test_f1: 0.6780
 epoch: 28, train_loss: 0.6796, test_loss: 0.7648, test_f1: 0.6720
 epoch: 29, train_loss: 0.6603, test_loss: 0.8244, test_f1: 0.6583
 epoch: 30, train_loss: 0.6454, test_loss: 0.7911, test_f1: 0.6603
 epoch: 31, train_loss: 0.6343, test_loss: 0.7807, test_f1: 0.6667
 epoch: 32, train_loss: 0.6344, test_loss: 0.7356, test_f1: 0.6600
 epoch: 33, train_loss: 0.6264, test_loss: 0.7843, test_f1: 0.6730
 epoch: 34, train_loss: 0.6085, test_loss: 0.7770, test_f1: 0.6681
 epoch: 35, train_loss: 0.6035, test_loss: 0.7808, test_f1: 0.6803
 epoch: 36, train_loss: 0.5931, test_loss: 0.7725, test_f1: 0.6787
 epoch: 37, train_loss: 0.6000, test_loss: 0.7381, test_f1: 0.6937
 epoch: 38, train_loss: 0.6075, test_loss: 0.7760, test_f1: 0.6521
 epoch: 39, train_loss: 0.5894, test_loss: 0.7393, test_f1: 0.6823
 epoch: 40, train_loss: 0.5863, test_loss: 0.7545, test_f1: 0.6795
 epoch: 41, train_loss: 0.5942, test_loss: 0.8077, test_f1: 0.6342
 epoch: 42, train_loss: 0.5994, test_loss: 0.7436, test_f1: 0.6772
 epoch: 43, train_loss: 0.5809, test_loss: 0.7147, test_f1: 0.6843
 epoch: 44, train_loss: 0.5737, test_loss: 0.7705, test_f1: 0.6684
 epoch: 45, train_loss: 0.5678, test_loss: 0.8066, test_f1: 0.6596
 epoch: 46, train_loss: 0.5552, test_loss: 0.7582, test_f1: 0.6798
 epoch: 47, train_loss: 0.5719, test_loss: 0.7830, test_f1: 0.6592
 epoch: 48, train_loss: 0.5527, test_loss: 0.7632, test_f1: 0.6770
 epoch: 49, train_loss: 0.5463, test_loss: 0.7977, test_f1: 0.6818
 epoch: 50, train_loss: 0.5402, test_loss: 0.7403, test_f1: 0.6736
 epoch: 51, train_loss: 0.5340, test_loss: 0.7856, test_f1: 0.6853
 epoch: 52, train_loss: 0.5060, test_loss: 0.7554, test_f1: 0.7114
 epoch: 53, train_loss: 0.4945, test_loss: 0.7689, test_f1: 0.6965
 epoch: 54, train_loss: 0.4991, test_loss: 0.7795, test_f1: 0.7042
 epoch: 55, train_loss: 0.4778, test_loss: 0.7683, test_f1: 0.6976
 epoch: 56, train_loss: 0.4803, test_loss: 0.7713, test_f1: 0.6949
 epoch: 57, train_loss: 0.4956, test_loss: 0.7893, test_f1: 0.6877
 epoch: 58, train_loss: 0.4925, test_loss: 0.7893, test_f1: 0.6965
 epoch: 59, train_loss: 0.4611, test_loss: 0.7790, test_f1: 0.6828
 epoch: 60, train_loss: 0.4871, test_loss: 0.8206, test_f1: 0.6876
 epoch: 61, train_loss: 0.4682, test_loss: 0.8422, test_f1: 0.6884
 epoch: 62, train_loss: 0.4694, test_loss: 0.8267, test_f1: 0.6783
 epoch: 63, train_loss: 0.4636, test_loss: 0.8225, test_f1: 0.6864
 epoch: 64, train_loss: 0.4457, test_loss: 0.9025, test_f1: 0.6973
 epoch: 65, train_loss: 0.4536, test_loss: 0.8257, test_f1: 0.6774
 epoch: 66, train_loss: 0.4617, test_loss: 0.8808, test_f1: 0.6696
 epoch: 67, train_loss: 0.4708, test_loss: 0.8986, test_f1: 0.6874
 epoch: 68, train_loss: 0.4584, test_loss: 0.9027, test_f1: 0.6767
 epoch: 69, train_loss: 0.4574, test_loss: 0.8512, test_f1: 0.6786
 epoch: 70, train_loss: 0.4551, test_loss: 0.8407, test_f1: 0.6910
 epoch: 71, train_loss: 0.4550, test_loss: 0.7995, test_f1: 0.6971
 epoch: 72, train_loss: 0.4459, test_loss: 0.8039, test_f1: 0.7056
 epoch: 73, train_loss: 0.4445, test_loss: 0.8036, test_f1: 0.6903
 epoch: 74, train_loss: 0.4352, test_loss: 0.8693, test_f1: 0.6713
 epoch: 75, train_loss: 0.4328, test_loss: 0.9124, test_f1: 0.6842
 epoch: 76, train_loss: 0.4412, test_loss: 0.8650, test_f1: 0.6943
 epoch: 77, train_loss: 0.4347, test_loss: 0.8905, test_f1: 0.6959
 epoch: 78, train_loss: 0.4490, test_loss: 0.8957, test_f1: 0.6879
 epoch: 79, train_loss: 0.4285, test_loss: 0.9024, test_f1: 0.6907
 epoch: 80, train_loss: 0.4190, test_loss: 0.8580, test_f1: 0.6830
 epoch: 81, train_loss: 0.4179, test_loss: 0.9385, test_f1: 0.6967
 epoch: 82, train_loss: 0.4192, test_loss: 0.9000, test_f1: 0.7120
 epoch: 83, train_loss: 0.4231, test_loss: 0.8860, test_f1: 0.6889
 epoch: 84, train_loss: 0.4220, test_loss: 0.9576, test_f1: 0.6666
 epoch: 85, train_loss: 0.4194, test_loss: 0.8718, test_f1: 0.7116
 epoch: 86, train_loss: 0.4327, test_loss: 0.9010, test_f1: 0.6638
 epoch: 87, train_loss: 0.4267, test_loss: 0.9103, test_f1: 0.6756
 epoch: 88, train_loss: 0.4023, test_loss: 0.9555, test_f1: 0.6655
 epoch: 89, train_loss: 0.4133, test_loss: 0.8877, test_f1: 0.6793
 epoch: 90, train_loss: 0.4221, test_loss: 0.8556, test_f1: 0.7154
 epoch: 91, train_loss: 0.4205, test_loss: 0.9161, test_f1: 0.6800
 epoch: 92, train_loss: 0.4049, test_loss: 0.9219, test_f1: 0.6823
 epoch: 93, train_loss: 0.3911, test_loss: 0.9045, test_f1: 0.6795
 epoch: 94, train_loss: 0.4050, test_loss: 0.8896, test_f1: 0.6936
 epoch: 95, train_loss: 0.3975, test_loss: 0.9036, test_f1: 0.6796
 epoch: 96, train_loss: 0.4220, test_loss: 1.0133, test_f1: 0.6671
 epoch: 97, train_loss: 0.4019, test_loss: 0.8937, test_f1: 0.6837
 epoch: 98, train_loss: 0.3809, test_loss: 0.8551, test_f1: 0.6906
 epoch: 99, train_loss: 0.3930, test_loss: 0.8902, test_f1: 0.6755
##################ITERATION #9 ****************************************
 epoch: 0, train_loss: 1.2017, test_loss: 1.0071, test_f1: 0.4785
 epoch: 1, train_loss: 0.9781, test_loss: 0.9794, test_f1: 0.5577
 epoch: 2, train_loss: 0.9482, test_loss: 0.9522, test_f1: 0.5085
 epoch: 3, train_loss: 0.9282, test_loss: 0.9131, test_f1: 0.5415
 epoch: 4, train_loss: 0.8961, test_loss: 0.8848, test_f1: 0.5018
 epoch: 5, train_loss: 0.8761, test_loss: 0.8492, test_f1: 0.5932
 epoch: 6, train_loss: 0.8732, test_loss: 0.8548, test_f1: 0.5829
 epoch: 7, train_loss: 0.8593, test_loss: 0.8424, test_f1: 0.5821
 epoch: 8, train_loss: 0.8327, test_loss: 0.8131, test_f1: 0.5818
 epoch: 9, train_loss: 0.8179, test_loss: 0.8062, test_f1: 0.6135
 epoch: 10, train_loss: 0.8062, test_loss: 0.8301, test_f1: 0.5988
 epoch: 11, train_loss: 0.7929, test_loss: 0.7711, test_f1: 0.5914
 epoch: 12, train_loss: 0.7729, test_loss: 0.8247, test_f1: 0.6146
 epoch: 13, train_loss: 0.7861, test_loss: 0.8085, test_f1: 0.6314
 epoch: 14, train_loss: 0.7545, test_loss: 0.7379, test_f1: 0.6566
 epoch: 15, train_loss: 0.7571, test_loss: 0.7847, test_f1: 0.6056
 epoch: 16, train_loss: 0.7515, test_loss: 0.7487, test_f1: 0.6201
 epoch: 17, train_loss: 0.7326, test_loss: 0.7328, test_f1: 0.6496
 epoch: 18, train_loss: 0.7464, test_loss: 0.8063, test_f1: 0.6350
 epoch: 19, train_loss: 0.7174, test_loss: 0.7455, test_f1: 0.6343
 epoch: 20, train_loss: 0.7165, test_loss: 0.7631, test_f1: 0.6605
 epoch: 21, train_loss: 0.7042, test_loss: 0.7862, test_f1: 0.6257
 epoch: 22, train_loss: 0.6988, test_loss: 0.7398, test_f1: 0.6478
 epoch: 23, train_loss: 0.6854, test_loss: 0.7299, test_f1: 0.6534
 epoch: 24, train_loss: 0.6816, test_loss: 0.7370, test_f1: 0.6441
 epoch: 25, train_loss: 0.6726, test_loss: 0.7022, test_f1: 0.6784
 epoch: 26, train_loss: 0.6741, test_loss: 0.7306, test_f1: 0.6611
 epoch: 27, train_loss: 0.6573, test_loss: 0.7317, test_f1: 0.6668
 epoch: 28, train_loss: 0.6485, test_loss: 0.7660, test_f1: 0.6541
 epoch: 29, train_loss: 0.6607, test_loss: 0.7589, test_f1: 0.6605
 epoch: 30, train_loss: 0.6354, test_loss: 0.7789, test_f1: 0.6596
 epoch: 31, train_loss: 0.6433, test_loss: 0.7460, test_f1: 0.6613
 epoch: 32, train_loss: 0.6515, test_loss: 0.7780, test_f1: 0.6623
 epoch: 33, train_loss: 0.6281, test_loss: 0.7789, test_f1: 0.6524
 epoch: 34, train_loss: 0.5923, test_loss: 0.7850, test_f1: 0.6606
 epoch: 35, train_loss: 0.5947, test_loss: 0.8074, test_f1: 0.6555
 epoch: 36, train_loss: 0.6206, test_loss: 0.7763, test_f1: 0.6284
 epoch: 37, train_loss: 0.5941, test_loss: 0.7482, test_f1: 0.6539
 epoch: 38, train_loss: 0.5995, test_loss: 0.7641, test_f1: 0.6663
 epoch: 39, train_loss: 0.5995, test_loss: 0.8107, test_f1: 0.6595
 epoch: 40, train_loss: 0.5847, test_loss: 0.7548, test_f1: 0.6481
 epoch: 41, train_loss: 0.6180, test_loss: 0.8044, test_f1: 0.6581
 epoch: 42, train_loss: 0.5883, test_loss: 0.8757, test_f1: 0.6540
 epoch: 43, train_loss: 0.5864, test_loss: 0.8233, test_f1: 0.6437
 epoch: 44, train_loss: 0.5620, test_loss: 0.8787, test_f1: 0.6635
 epoch: 45, train_loss: 0.5715, test_loss: 0.8132, test_f1: 0.6432
 epoch: 46, train_loss: 0.5803, test_loss: 0.8546, test_f1: 0.6489
 epoch: 47, train_loss: 0.5568, test_loss: 0.8856, test_f1: 0.6492
 epoch: 48, train_loss: 0.5656, test_loss: 0.8374, test_f1: 0.6541
 epoch: 49, train_loss: 0.5600, test_loss: 0.7701, test_f1: 0.6808
 epoch: 50, train_loss: 0.5487, test_loss: 0.7533, test_f1: 0.6589
 epoch: 51, train_loss: 0.5256, test_loss: 0.7379, test_f1: 0.6683
 epoch: 52, train_loss: 0.4958, test_loss: 0.7517, test_f1: 0.6643
 epoch: 53, train_loss: 0.5158, test_loss: 0.8190, test_f1: 0.6566
 epoch: 54, train_loss: 0.5116, test_loss: 0.7716, test_f1: 0.6701
 epoch: 55, train_loss: 0.4820, test_loss: 0.7966, test_f1: 0.6789
 epoch: 56, train_loss: 0.4783, test_loss: 0.8896, test_f1: 0.6654
 epoch: 57, train_loss: 0.4775, test_loss: 0.8614, test_f1: 0.6594
 epoch: 58, train_loss: 0.4761, test_loss: 0.8553, test_f1: 0.6815
 epoch: 59, train_loss: 0.4858, test_loss: 0.8107, test_f1: 0.6755
 epoch: 60, train_loss: 0.4673, test_loss: 0.8404, test_f1: 0.6671
 epoch: 61, train_loss: 0.4653, test_loss: 0.8519, test_f1: 0.6798
 epoch: 62, train_loss: 0.4618, test_loss: 0.9349, test_f1: 0.6619
 epoch: 63, train_loss: 0.4595, test_loss: 0.8939, test_f1: 0.6733
 epoch: 64, train_loss: 0.4671, test_loss: 0.9605, test_f1: 0.6664
 epoch: 65, train_loss: 0.4483, test_loss: 0.9207, test_f1: 0.6760
 epoch: 66, train_loss: 0.4566, test_loss: 0.8815, test_f1: 0.6733
 epoch: 67, train_loss: 0.4426, test_loss: 0.9407, test_f1: 0.6773
 epoch: 68, train_loss: 0.4580, test_loss: 0.8887, test_f1: 0.6809
 epoch: 69, train_loss: 0.4320, test_loss: 0.8774, test_f1: 0.6634
 epoch: 70, train_loss: 0.4446, test_loss: 0.8811, test_f1: 0.6654
 epoch: 71, train_loss: 0.4381, test_loss: 0.9348, test_f1: 0.6577
 epoch: 72, train_loss: 0.4496, test_loss: 0.9602, test_f1: 0.6492
 epoch: 73, train_loss: 0.4573, test_loss: 0.9757, test_f1: 0.6612
 epoch: 74, train_loss: 0.4355, test_loss: 0.9484, test_f1: 0.6761
 epoch: 75, train_loss: 0.4305, test_loss: 0.8984, test_f1: 0.6684
 epoch: 76, train_loss: 0.4267, test_loss: 0.9322, test_f1: 0.6650
 epoch: 77, train_loss: 0.4399, test_loss: 0.9689, test_f1: 0.6768
 epoch: 78, train_loss: 0.4441, test_loss: 0.9568, test_f1: 0.6611
 epoch: 79, train_loss: 0.4193, test_loss: 0.9537, test_f1: 0.6664
 epoch: 80, train_loss: 0.4068, test_loss: 0.9556, test_f1: 0.6890
 epoch: 81, train_loss: 0.4290, test_loss: 0.9108, test_f1: 0.6865
 epoch: 82, train_loss: 0.4059, test_loss: 0.9515, test_f1: 0.6728
 epoch: 83, train_loss: 0.4250, test_loss: 0.9881, test_f1: 0.6820
 epoch: 84, train_loss: 0.4249, test_loss: 0.9628, test_f1: 0.6928
 epoch: 85, train_loss: 0.4238, test_loss: 1.0612, test_f1: 0.6697
 epoch: 86, train_loss: 0.4260, test_loss: 0.9298, test_f1: 0.6899
 epoch: 87, train_loss: 0.4131, test_loss: 0.9394, test_f1: 0.6728
 epoch: 88, train_loss: 0.4006, test_loss: 0.9694, test_f1: 0.6804
 epoch: 89, train_loss: 0.3882, test_loss: 1.0324, test_f1: 0.6904
 epoch: 90, train_loss: 0.3929, test_loss: 1.0933, test_f1: 0.6761
 epoch: 91, train_loss: 0.3994, test_loss: 1.0338, test_f1: 0.6848
 epoch: 92, train_loss: 0.4091, test_loss: 1.0362, test_f1: 0.6927
 epoch: 93, train_loss: 0.3991, test_loss: 0.9358, test_f1: 0.6875
 epoch: 94, train_loss: 0.3999, test_loss: 0.9833, test_f1: 0.6981
 epoch: 95, train_loss: 0.3988, test_loss: 1.0966, test_f1: 0.6490
 epoch: 96, train_loss: 0.4155, test_loss: 1.0113, test_f1: 0.6790
 epoch: 97, train_loss: 0.3972, test_loss: 1.0535, test_f1: 0.6893
 epoch: 98, train_loss: 0.3867, test_loss: 1.0952, test_f1: 0.6761
 epoch: 99, train_loss: 0.4090, test_loss: 1.0790, test_f1: 0.6892

Training completed in 815.77 seconds
Best F1: 0.7193 at epoch 65
Mean F1 across iterations: 0.7047  0.0097
========================FINAL RESULTS================================
FEGIN weighted F1: 0.7193  0.0097
python main.py --data ltspice_examples --representation component_pin_net --model FEGIN --layers 2 --hiddens 64 --batch_size 32 --lr 0.001 --emb_size 128 --epochs 100 --save_appendix component_pin_net_L2_H64_BS32_LR0.001_E128 --no_val
-----



STDERR:
  File "main.py", line 370, in <module>
    main()
  File "main.py", line 254, in main
    dataset = dataset_class(
  File "/home/philip/projects/ltspice_examples_code_repo/Circuit-Completion-Using-GNNs/component_classification_with_link_prediction_head/evaluation/FEGIN/kernel/circuit_datasets.py", line 15, in __init__
    self.data, self.slices = torch.load(self.processed_paths[0])
  File "/home/philip/.local/lib/python3.8/site-packages/torch/serialization.py", line 1040, in load
    warnings.warn(
  File "/usr/lib/python3.8/warnings.py", line 109, in _showwarnmsg
    sw(msg.message, msg.category, msg.filename, msg.lineno,
  File "main.py", line 47, in warn_with_traceback
    traceback.print_stack(file=log)
/home/philip/projects/ltspice_examples_code_repo/Circuit-Completion-Using-GNNs/component_classification_with_link_prediction_head/evaluation/FEGIN/kernel/circuit_datasets.py:15: FutureWarning: You are using `torch.load` with `weights_only=False` (the current default value), which uses the default pickle module implicitly. It is possible to construct malicious pickle data which will execute arbitrary code during unpickling (See https://github.com/pytorch/pytorch/blob/main/SECURITY.md#untrusted-models for more details). In a future release, the default value for `weights_only` will be flipped to `True`. This limits the functions that could be executed during unpickling. Arbitrary objects will no longer be allowed to be loaded via this mode unless they are explicitly allowlisted by the user via `torch.serialization.add_safe_globals`. We recommend you start setting `weights_only=True` for any use case where you don't have full control of the loaded file. Please open an issue on GitHub for any issues related to this experimental feature.
  self.data, self.slices = torch.load(self.processed_paths[0])
