STDOUT:
Results will be saved in /home/philip/projects/ltspice_examples_code_repo/Circuit-Completion-Using-GNNs/component_classification_with_link_prediction_head/evaluation/FEGIN/results/model_FEGIN_dataset_ltspice_demos
Command line input: python main.py --data ltspice_demos --representation component_pin --model FEGIN --layers 3 --hiddens 128 --batch_size 32 --lr 0.001 --emb_size 128 --epochs 100 --save_appendix component_pin_L3_H128_BS32_LR0.001_E128 --no_val
 is saved.
-----
ltspice_demos - FEGIN
Using 3 layers, 128 hidden units, h = 2
Loading component_pin representation dataset
ENTERED
Training FEGIN on component_pin representation
Train: 1565, Test: 383
##################ITERATION #0 ****************************************
 epoch: 0, train_loss: 1.2037, test_loss: 1.2790, test_f1: 0.3346
 epoch: 1, train_loss: 0.9882, test_loss: 1.0646, test_f1: 0.4864
 epoch: 2, train_loss: 0.9112, test_loss: 1.0740, test_f1: 0.4920
 epoch: 3, train_loss: 0.8679, test_loss: 0.9426, test_f1: 0.5548
 epoch: 4, train_loss: 0.8092, test_loss: 1.0344, test_f1: 0.4409
 epoch: 5, train_loss: 0.7698, test_loss: 1.0060, test_f1: 0.5898
 epoch: 6, train_loss: 0.7659, test_loss: 0.9766, test_f1: 0.5705
 epoch: 7, train_loss: 0.7531, test_loss: 1.1404, test_f1: 0.4787
 epoch: 8, train_loss: 0.7068, test_loss: 1.1548, test_f1: 0.5082
 epoch: 9, train_loss: 0.6817, test_loss: 1.0751, test_f1: 0.5280
 epoch: 10, train_loss: 0.6480, test_loss: 1.1250, test_f1: 0.5786
 epoch: 11, train_loss: 0.6767, test_loss: 1.0696, test_f1: 0.6095
 epoch: 12, train_loss: 0.6520, test_loss: 1.1740, test_f1: 0.5677
 epoch: 13, train_loss: 0.6488, test_loss: 1.3969, test_f1: 0.5562
 epoch: 14, train_loss: 0.6451, test_loss: 1.1313, test_f1: 0.5665
 epoch: 15, train_loss: 0.5913, test_loss: 1.1485, test_f1: 0.5308
 epoch: 16, train_loss: 0.5586, test_loss: 1.1609, test_f1: 0.5873
 epoch: 17, train_loss: 0.5624, test_loss: 1.2367, test_f1: 0.5031
 epoch: 18, train_loss: 0.5554, test_loss: 1.3063, test_f1: 0.5833
 epoch: 19, train_loss: 0.5331, test_loss: 1.1018, test_f1: 0.6733
 epoch: 20, train_loss: 0.5408, test_loss: 1.6718, test_f1: 0.4787
 epoch: 21, train_loss: 0.5437, test_loss: 1.3025, test_f1: 0.5312
 epoch: 22, train_loss: 0.5419, test_loss: 1.2775, test_f1: 0.5752
 epoch: 23, train_loss: 0.4846, test_loss: 1.3397, test_f1: 0.5938
 epoch: 24, train_loss: 0.4707, test_loss: 1.3036, test_f1: 0.6034
 epoch: 25, train_loss: 0.4624, test_loss: 1.1480, test_f1: 0.6265
 epoch: 26, train_loss: 0.4689, test_loss: 1.2750, test_f1: 0.5822
 epoch: 27, train_loss: 0.4483, test_loss: 1.4109, test_f1: 0.6094
 epoch: 28, train_loss: 0.4404, test_loss: 1.3754, test_f1: 0.6268
 epoch: 29, train_loss: 0.3887, test_loss: 1.2901, test_f1: 0.6326
 epoch: 30, train_loss: 0.4030, test_loss: 1.3645, test_f1: 0.6041
 epoch: 31, train_loss: 0.3844, test_loss: 1.6349, test_f1: 0.6211
 epoch: 32, train_loss: 0.3819, test_loss: 1.7268, test_f1: 0.6150
 epoch: 33, train_loss: 0.3677, test_loss: 1.3771, test_f1: 0.6173
 epoch: 34, train_loss: 0.3952, test_loss: 1.3572, test_f1: 0.6450
 epoch: 35, train_loss: 0.3658, test_loss: 1.5537, test_f1: 0.6424
 epoch: 36, train_loss: 0.3498, test_loss: 1.3959, test_f1: 0.6293
 epoch: 37, train_loss: 0.3562, test_loss: 1.5521, test_f1: 0.6389
 epoch: 38, train_loss: 0.3185, test_loss: 1.6092, test_f1: 0.6333
 epoch: 39, train_loss: 0.3161, test_loss: 1.5704, test_f1: 0.6571
 epoch: 40, train_loss: 0.3047, test_loss: 1.6335, test_f1: 0.6016
 epoch: 41, train_loss: 0.3383, test_loss: 1.5427, test_f1: 0.6580
 epoch: 42, train_loss: 0.3002, test_loss: 1.5427, test_f1: 0.6673
 epoch: 43, train_loss: 0.2879, test_loss: 1.9213, test_f1: 0.6255
 epoch: 44, train_loss: 0.3086, test_loss: 1.6714, test_f1: 0.6079
 epoch: 45, train_loss: 0.3075, test_loss: 1.8276, test_f1: 0.5841
 epoch: 46, train_loss: 0.3049, test_loss: 1.8202, test_f1: 0.6501
 epoch: 47, train_loss: 0.2459, test_loss: 1.6687, test_f1: 0.6292
 epoch: 48, train_loss: 0.2746, test_loss: 1.7709, test_f1: 0.6210
 epoch: 49, train_loss: 0.2687, test_loss: 1.6039, test_f1: 0.6439
 epoch: 50, train_loss: 0.2922, test_loss: 1.7352, test_f1: 0.5853
 epoch: 51, train_loss: 0.2309, test_loss: 1.9512, test_f1: 0.6230
 epoch: 52, train_loss: 0.1889, test_loss: 1.7944, test_f1: 0.6223
 epoch: 53, train_loss: 0.1868, test_loss: 1.8880, test_f1: 0.6255
 epoch: 54, train_loss: 0.1753, test_loss: 1.7650, test_f1: 0.6476
 epoch: 55, train_loss: 0.1590, test_loss: 2.0229, test_f1: 0.6663
 epoch: 56, train_loss: 0.1799, test_loss: 2.0568, test_f1: 0.6349
 epoch: 57, train_loss: 0.1515, test_loss: 2.1175, test_f1: 0.6256
 epoch: 58, train_loss: 0.1399, test_loss: 2.2627, test_f1: 0.6380
 epoch: 59, train_loss: 0.1612, test_loss: 2.0644, test_f1: 0.6626
 epoch: 60, train_loss: 0.1475, test_loss: 2.0875, test_f1: 0.6327
 epoch: 61, train_loss: 0.1324, test_loss: 2.1580, test_f1: 0.6743
 epoch: 62, train_loss: 0.1609, test_loss: 2.2396, test_f1: 0.6500
 epoch: 63, train_loss: 0.1402, test_loss: 2.0473, test_f1: 0.6684
 epoch: 64, train_loss: 0.1305, test_loss: 2.2294, test_f1: 0.6736
 epoch: 65, train_loss: 0.1432, test_loss: 2.2620, test_f1: 0.6366
 epoch: 66, train_loss: 0.1346, test_loss: 2.1219, test_f1: 0.6365
 epoch: 67, train_loss: 0.1293, test_loss: 2.7146, test_f1: 0.6246
 epoch: 68, train_loss: 0.1588, test_loss: 2.3623, test_f1: 0.6638
 epoch: 69, train_loss: 0.1395, test_loss: 2.6374, test_f1: 0.6270
 epoch: 70, train_loss: 0.1214, test_loss: 2.6507, test_f1: 0.6370
 epoch: 71, train_loss: 0.1429, test_loss: 2.5160, test_f1: 0.6351
 epoch: 72, train_loss: 0.1276, test_loss: 2.8772, test_f1: 0.6199
 epoch: 73, train_loss: 0.1357, test_loss: 2.7785, test_f1: 0.6006
 epoch: 74, train_loss: 0.1165, test_loss: 2.6634, test_f1: 0.6311
 epoch: 75, train_loss: 0.1320, test_loss: 2.6421, test_f1: 0.6419
 epoch: 76, train_loss: 0.1507, test_loss: 2.2819, test_f1: 0.6564
 epoch: 77, train_loss: 0.1389, test_loss: 2.5041, test_f1: 0.6645
 epoch: 78, train_loss: 0.0911, test_loss: 2.4849, test_f1: 0.6603
 epoch: 79, train_loss: 0.1222, test_loss: 2.7339, test_f1: 0.6260
 epoch: 80, train_loss: 0.1224, test_loss: 2.4567, test_f1: 0.6575
 epoch: 81, train_loss: 0.1031, test_loss: 2.7631, test_f1: 0.6483
 epoch: 82, train_loss: 0.0886, test_loss: 2.7237, test_f1: 0.6500
 epoch: 83, train_loss: 0.1352, test_loss: 2.6520, test_f1: 0.6245
 epoch: 84, train_loss: 0.1038, test_loss: 2.7269, test_f1: 0.6115
 epoch: 85, train_loss: 0.0824, test_loss: 2.7607, test_f1: 0.6160
 epoch: 86, train_loss: 0.0886, test_loss: 2.9848, test_f1: 0.6223
 epoch: 87, train_loss: 0.1090, test_loss: 2.5660, test_f1: 0.6602
 epoch: 88, train_loss: 0.1203, test_loss: 2.6272, test_f1: 0.6434
 epoch: 89, train_loss: 0.1002, test_loss: 3.1200, test_f1: 0.6035
 epoch: 90, train_loss: 0.1131, test_loss: 3.2685, test_f1: 0.6095
 epoch: 91, train_loss: 0.0992, test_loss: 3.1379, test_f1: 0.6252
 epoch: 92, train_loss: 0.1025, test_loss: 2.8493, test_f1: 0.6238
 epoch: 93, train_loss: 0.0913, test_loss: 2.8285, test_f1: 0.6158
 epoch: 94, train_loss: 0.0943, test_loss: 2.8771, test_f1: 0.6127
 epoch: 95, train_loss: 0.1206, test_loss: 3.6727, test_f1: 0.6198
 epoch: 96, train_loss: 0.1546, test_loss: 2.6608, test_f1: 0.6311
 epoch: 97, train_loss: 0.0982, test_loss: 2.8523, test_f1: 0.6444
 epoch: 98, train_loss: 0.0912, test_loss: 2.5771, test_f1: 0.6346
 epoch: 99, train_loss: 0.1077, test_loss: 2.9316, test_f1: 0.6122
##################ITERATION #1 ****************************************
 epoch: 0, train_loss: 1.1070, test_loss: 1.1850, test_f1: 0.4102
 epoch: 1, train_loss: 0.9078, test_loss: 0.9880, test_f1: 0.5762
 epoch: 2, train_loss: 0.8197, test_loss: 1.0664, test_f1: 0.5351
 epoch: 3, train_loss: 0.8109, test_loss: 0.9942, test_f1: 0.5966
 epoch: 4, train_loss: 0.7714, test_loss: 1.0179, test_f1: 0.5211
 epoch: 5, train_loss: 0.7573, test_loss: 1.0119, test_f1: 0.5890
 epoch: 6, train_loss: 0.7243, test_loss: 0.9692, test_f1: 0.6087
 epoch: 7, train_loss: 0.6963, test_loss: 0.9903, test_f1: 0.5698
 epoch: 8, train_loss: 0.6845, test_loss: 1.1306, test_f1: 0.5729
 epoch: 9, train_loss: 0.6695, test_loss: 0.8929, test_f1: 0.6229
 epoch: 10, train_loss: 0.6593, test_loss: 1.1028, test_f1: 0.6291
 epoch: 11, train_loss: 0.6327, test_loss: 0.9745, test_f1: 0.5971
 epoch: 12, train_loss: 0.6044, test_loss: 0.9679, test_f1: 0.6467
 epoch: 13, train_loss: 0.5924, test_loss: 1.1400, test_f1: 0.6358
 epoch: 14, train_loss: 0.5779, test_loss: 1.0106, test_f1: 0.6564
 epoch: 15, train_loss: 0.5379, test_loss: 1.2536, test_f1: 0.5971
 epoch: 16, train_loss: 0.5519, test_loss: 1.0752, test_f1: 0.6213
 epoch: 17, train_loss: 0.5360, test_loss: 0.9789, test_f1: 0.6957
 epoch: 18, train_loss: 0.5532, test_loss: 1.0796, test_f1: 0.5900
 epoch: 19, train_loss: 0.5068, test_loss: 1.0722, test_f1: 0.6228
 epoch: 20, train_loss: 0.4985, test_loss: 1.3195, test_f1: 0.5796
 epoch: 21, train_loss: 0.4928, test_loss: 1.3174, test_f1: 0.6805
 epoch: 22, train_loss: 0.4745, test_loss: 1.2933, test_f1: 0.5969
 epoch: 23, train_loss: 0.4617, test_loss: 1.2271, test_f1: 0.6461
 epoch: 24, train_loss: 0.4252, test_loss: 1.2759, test_f1: 0.6593
 epoch: 25, train_loss: 0.4662, test_loss: 1.1280, test_f1: 0.6505
 epoch: 26, train_loss: 0.4257, test_loss: 1.3658, test_f1: 0.6156
 epoch: 27, train_loss: 0.3843, test_loss: 1.3410, test_f1: 0.6325
 epoch: 28, train_loss: 0.4096, test_loss: 1.3670, test_f1: 0.6587
 epoch: 29, train_loss: 0.3752, test_loss: 1.3489, test_f1: 0.6368
 epoch: 30, train_loss: 0.4169, test_loss: 1.2364, test_f1: 0.6338
 epoch: 31, train_loss: 0.3830, test_loss: 1.8464, test_f1: 0.4875
 epoch: 32, train_loss: 0.3481, test_loss: 1.4113, test_f1: 0.6672
 epoch: 33, train_loss: 0.3489, test_loss: 1.4647, test_f1: 0.6282
 epoch: 34, train_loss: 0.3366, test_loss: 1.5599, test_f1: 0.6153
 epoch: 35, train_loss: 0.3229, test_loss: 1.3466, test_f1: 0.6496
 epoch: 36, train_loss: 0.3221, test_loss: 2.0628, test_f1: 0.6457
 epoch: 37, train_loss: 0.3090, test_loss: 1.7634, test_f1: 0.6019
 epoch: 38, train_loss: 0.3048, test_loss: 1.6791, test_f1: 0.6202
 epoch: 39, train_loss: 0.3274, test_loss: 1.7049, test_f1: 0.6440
 epoch: 40, train_loss: 0.3078, test_loss: 1.6010, test_f1: 0.6713
 epoch: 41, train_loss: 0.2887, test_loss: 1.7192, test_f1: 0.6385
 epoch: 42, train_loss: 0.2923, test_loss: 1.5895, test_f1: 0.6500
 epoch: 43, train_loss: 0.2397, test_loss: 1.7262, test_f1: 0.6042
 epoch: 44, train_loss: 0.2934, test_loss: 1.7127, test_f1: 0.6474
 epoch: 45, train_loss: 0.2716, test_loss: 1.6717, test_f1: 0.6312
 epoch: 46, train_loss: 0.2408, test_loss: 1.7008, test_f1: 0.6450
 epoch: 47, train_loss: 0.2410, test_loss: 1.6476, test_f1: 0.6732
 epoch: 48, train_loss: 0.2466, test_loss: 1.6321, test_f1: 0.6269
 epoch: 49, train_loss: 0.2894, test_loss: 2.3125, test_f1: 0.5478
 epoch: 50, train_loss: 0.2339, test_loss: 1.9246, test_f1: 0.6138
 epoch: 51, train_loss: 0.1976, test_loss: 1.9400, test_f1: 0.6009
 epoch: 52, train_loss: 0.1498, test_loss: 2.1258, test_f1: 0.5899
 epoch: 53, train_loss: 0.1601, test_loss: 2.2253, test_f1: 0.6308
 epoch: 54, train_loss: 0.1589, test_loss: 2.2170, test_f1: 0.6100
 epoch: 55, train_loss: 0.1322, test_loss: 2.2751, test_f1: 0.5970
 epoch: 56, train_loss: 0.1214, test_loss: 2.2725, test_f1: 0.6490
 epoch: 57, train_loss: 0.1360, test_loss: 2.2830, test_f1: 0.6299
 epoch: 58, train_loss: 0.1696, test_loss: 2.3889, test_f1: 0.6260
 epoch: 59, train_loss: 0.1453, test_loss: 2.5671, test_f1: 0.6225
 epoch: 60, train_loss: 0.1345, test_loss: 2.5420, test_f1: 0.6099
 epoch: 61, train_loss: 0.1338, test_loss: 2.6334, test_f1: 0.6403
 epoch: 62, train_loss: 0.1178, test_loss: 2.3542, test_f1: 0.5987
 epoch: 63, train_loss: 0.1163, test_loss: 2.7015, test_f1: 0.5858
 epoch: 64, train_loss: 0.1147, test_loss: 2.3593, test_f1: 0.6039
 epoch: 65, train_loss: 0.1303, test_loss: 2.4878, test_f1: 0.6079
 epoch: 66, train_loss: 0.1300, test_loss: 2.6433, test_f1: 0.6148
 epoch: 67, train_loss: 0.1095, test_loss: 2.4082, test_f1: 0.6264
 epoch: 68, train_loss: 0.1351, test_loss: 2.5620, test_f1: 0.5877
 epoch: 69, train_loss: 0.1342, test_loss: 2.6219, test_f1: 0.6095
 epoch: 70, train_loss: 0.1524, test_loss: 2.2904, test_f1: 0.6449
 epoch: 71, train_loss: 0.1164, test_loss: 2.7886, test_f1: 0.5932
 epoch: 72, train_loss: 0.1239, test_loss: 2.6766, test_f1: 0.6194
 epoch: 73, train_loss: 0.0890, test_loss: 2.6794, test_f1: 0.6272
 epoch: 74, train_loss: 0.1010, test_loss: 3.1621, test_f1: 0.5860
 epoch: 75, train_loss: 0.1190, test_loss: 3.0911, test_f1: 0.5868
 epoch: 76, train_loss: 0.1107, test_loss: 2.7661, test_f1: 0.6279
 epoch: 77, train_loss: 0.0854, test_loss: 2.9870, test_f1: 0.5784
 epoch: 78, train_loss: 0.1018, test_loss: 3.1960, test_f1: 0.5754
 epoch: 79, train_loss: 0.0984, test_loss: 3.0873, test_f1: 0.6171
 epoch: 80, train_loss: 0.1191, test_loss: 2.6400, test_f1: 0.6525
 epoch: 81, train_loss: 0.1176, test_loss: 2.6073, test_f1: 0.6400
 epoch: 82, train_loss: 0.0777, test_loss: 2.8888, test_f1: 0.6192
 epoch: 83, train_loss: 0.1147, test_loss: 2.9999, test_f1: 0.5981
 epoch: 84, train_loss: 0.1118, test_loss: 2.9226, test_f1: 0.6476
 epoch: 85, train_loss: 0.0845, test_loss: 2.7650, test_f1: 0.6350
 epoch: 86, train_loss: 0.0789, test_loss: 2.7717, test_f1: 0.6334
 epoch: 87, train_loss: 0.0880, test_loss: 3.1893, test_f1: 0.6182
 epoch: 88, train_loss: 0.0983, test_loss: 3.3999, test_f1: 0.6120
 epoch: 89, train_loss: 0.0791, test_loss: 3.3516, test_f1: 0.5897
 epoch: 90, train_loss: 0.0822, test_loss: 2.7370, test_f1: 0.6364
 epoch: 91, train_loss: 0.0685, test_loss: 3.0909, test_f1: 0.6035
 epoch: 92, train_loss: 0.0926, test_loss: 3.3575, test_f1: 0.5908
 epoch: 93, train_loss: 0.0842, test_loss: 2.8151, test_f1: 0.6328
 epoch: 94, train_loss: 0.0667, test_loss: 3.0924, test_f1: 0.6134
 epoch: 95, train_loss: 0.1001, test_loss: 3.1681, test_f1: 0.6248
 epoch: 96, train_loss: 0.0691, test_loss: 3.1054, test_f1: 0.6125
 epoch: 97, train_loss: 0.0832, test_loss: 3.1149, test_f1: 0.5936
 epoch: 98, train_loss: 0.0877, test_loss: 2.9784, test_f1: 0.6503
 epoch: 99, train_loss: 0.1411, test_loss: 2.7340, test_f1: 0.6552
##################ITERATION #2 ****************************************
 epoch: 0, train_loss: 1.0866, test_loss: 1.3712, test_f1: 0.4072
 epoch: 1, train_loss: 0.8960, test_loss: 1.0574, test_f1: 0.6088
 epoch: 2, train_loss: 0.8373, test_loss: 1.0177, test_f1: 0.5562
 epoch: 3, train_loss: 0.7589, test_loss: 1.0497, test_f1: 0.5892
 epoch: 4, train_loss: 0.7518, test_loss: 1.4138, test_f1: 0.4926
 epoch: 5, train_loss: 0.7377, test_loss: 1.3536, test_f1: 0.5020
 epoch: 6, train_loss: 0.6908, test_loss: 1.0949, test_f1: 0.5391
 epoch: 7, train_loss: 0.6862, test_loss: 1.2008, test_f1: 0.5357
 epoch: 8, train_loss: 0.6548, test_loss: 1.1765, test_f1: 0.6218
 epoch: 9, train_loss: 0.6619, test_loss: 1.1586, test_f1: 0.5447
 epoch: 10, train_loss: 0.6301, test_loss: 1.2222, test_f1: 0.5786
 epoch: 11, train_loss: 0.6052, test_loss: 0.9377, test_f1: 0.6666
 epoch: 12, train_loss: 0.6034, test_loss: 0.9206, test_f1: 0.6230
 epoch: 13, train_loss: 0.5952, test_loss: 1.1259, test_f1: 0.5344
 epoch: 14, train_loss: 0.5825, test_loss: 1.1244, test_f1: 0.6570
 epoch: 15, train_loss: 0.5810, test_loss: 1.2466, test_f1: 0.5866
 epoch: 16, train_loss: 0.5723, test_loss: 1.1193, test_f1: 0.6405
 epoch: 17, train_loss: 0.5146, test_loss: 1.3938, test_f1: 0.6123
 epoch: 18, train_loss: 0.5183, test_loss: 1.2095, test_f1: 0.6104
 epoch: 19, train_loss: 0.5329, test_loss: 1.2974, test_f1: 0.6439
 epoch: 20, train_loss: 0.5334, test_loss: 1.1289, test_f1: 0.6466
 epoch: 21, train_loss: 0.4516, test_loss: 1.1490, test_f1: 0.6327
 epoch: 22, train_loss: 0.4461, test_loss: 1.4895, test_f1: 0.6792
 epoch: 23, train_loss: 0.4723, test_loss: 1.4298, test_f1: 0.5400
 epoch: 24, train_loss: 0.4631, test_loss: 1.2620, test_f1: 0.6357
 epoch: 25, train_loss: 0.4010, test_loss: 1.3504, test_f1: 0.6502
 epoch: 26, train_loss: 0.4177, test_loss: 1.4653, test_f1: 0.6058
 epoch: 27, train_loss: 0.4305, test_loss: 1.4615, test_f1: 0.5745
 epoch: 28, train_loss: 0.3901, test_loss: 1.3799, test_f1: 0.6307
 epoch: 29, train_loss: 0.3984, test_loss: 1.4094, test_f1: 0.6233
 epoch: 30, train_loss: 0.3728, test_loss: 1.3683, test_f1: 0.6503
 epoch: 31, train_loss: 0.3496, test_loss: 1.4562, test_f1: 0.6597
 epoch: 32, train_loss: 0.3809, test_loss: 1.5024, test_f1: 0.6488
 epoch: 33, train_loss: 0.3506, test_loss: 1.5639, test_f1: 0.6359
 epoch: 34, train_loss: 0.3520, test_loss: 1.8014, test_f1: 0.6086
 epoch: 35, train_loss: 0.3337, test_loss: 1.6762, test_f1: 0.6124
 epoch: 36, train_loss: 0.3080, test_loss: 1.6937, test_f1: 0.6331
 epoch: 37, train_loss: 0.3426, test_loss: 1.4644, test_f1: 0.6267
 epoch: 38, train_loss: 0.3289, test_loss: 2.0848, test_f1: 0.5986
 epoch: 39, train_loss: 0.2922, test_loss: 1.7062, test_f1: 0.6293
 epoch: 40, train_loss: 0.2913, test_loss: 1.7028, test_f1: 0.6183
 epoch: 41, train_loss: 0.2926, test_loss: 1.8577, test_f1: 0.6242
 epoch: 42, train_loss: 0.2371, test_loss: 1.7839, test_f1: 0.6298
 epoch: 43, train_loss: 0.2445, test_loss: 2.0227, test_f1: 0.6603
 epoch: 44, train_loss: 0.2459, test_loss: 1.8374, test_f1: 0.6635
 epoch: 45, train_loss: 0.2695, test_loss: 1.8127, test_f1: 0.6425
 epoch: 46, train_loss: 0.2997, test_loss: 1.8517, test_f1: 0.6198
 epoch: 47, train_loss: 0.2261, test_loss: 1.9426, test_f1: 0.6448
 epoch: 48, train_loss: 0.2093, test_loss: 2.1026, test_f1: 0.6596
 epoch: 49, train_loss: 0.2272, test_loss: 1.9610, test_f1: 0.6472
 epoch: 50, train_loss: 0.2239, test_loss: 2.0317, test_f1: 0.6272
 epoch: 51, train_loss: 0.2174, test_loss: 1.9365, test_f1: 0.6480
 epoch: 52, train_loss: 0.1652, test_loss: 2.2025, test_f1: 0.6646
 epoch: 53, train_loss: 0.1643, test_loss: 2.1374, test_f1: 0.6634
 epoch: 54, train_loss: 0.1497, test_loss: 2.1176, test_f1: 0.6680
 epoch: 55, train_loss: 0.1394, test_loss: 2.0985, test_f1: 0.6406
 epoch: 56, train_loss: 0.1583, test_loss: 2.4613, test_f1: 0.6400
 epoch: 57, train_loss: 0.1478, test_loss: 2.3264, test_f1: 0.6299
 epoch: 58, train_loss: 0.1340, test_loss: 2.5081, test_f1: 0.6368
 epoch: 59, train_loss: 0.1504, test_loss: 2.3452, test_f1: 0.6587
 epoch: 60, train_loss: 0.1336, test_loss: 2.3768, test_f1: 0.6383
 epoch: 61, train_loss: 0.1181, test_loss: 2.4719, test_f1: 0.6264
 epoch: 62, train_loss: 0.1271, test_loss: 2.9315, test_f1: 0.6112
 epoch: 63, train_loss: 0.1207, test_loss: 2.7652, test_f1: 0.6026
 epoch: 64, train_loss: 0.1604, test_loss: 2.6499, test_f1: 0.6289
 epoch: 65, train_loss: 0.1538, test_loss: 2.4974, test_f1: 0.6100
 epoch: 66, train_loss: 0.1354, test_loss: 2.6787, test_f1: 0.6293
 epoch: 67, train_loss: 0.1120, test_loss: 2.5347, test_f1: 0.6102
 epoch: 68, train_loss: 0.1199, test_loss: 2.6942, test_f1: 0.6183
 epoch: 69, train_loss: 0.1103, test_loss: 2.7066, test_f1: 0.6398
 epoch: 70, train_loss: 0.1309, test_loss: 2.7707, test_f1: 0.6369
 epoch: 71, train_loss: 0.1211, test_loss: 2.8228, test_f1: 0.6069
 epoch: 72, train_loss: 0.0927, test_loss: 2.9338, test_f1: 0.6162
 epoch: 73, train_loss: 0.1188, test_loss: 3.1039, test_f1: 0.6370
 epoch: 74, train_loss: 0.1036, test_loss: 2.8295, test_f1: 0.6023
 epoch: 75, train_loss: 0.1036, test_loss: 2.9525, test_f1: 0.5892
 epoch: 76, train_loss: 0.1066, test_loss: 2.5774, test_f1: 0.6336
 epoch: 77, train_loss: 0.1504, test_loss: 2.7634, test_f1: 0.6268
 epoch: 78, train_loss: 0.1493, test_loss: 2.6946, test_f1: 0.6170
 epoch: 79, train_loss: 0.1470, test_loss: 2.4469, test_f1: 0.6500
 epoch: 80, train_loss: 0.1002, test_loss: 2.8897, test_f1: 0.6264
 epoch: 81, train_loss: 0.0904, test_loss: 3.1376, test_f1: 0.6011
 epoch: 82, train_loss: 0.0981, test_loss: 2.9715, test_f1: 0.6147
 epoch: 83, train_loss: 0.1069, test_loss: 3.1518, test_f1: 0.6061
 epoch: 84, train_loss: 0.0799, test_loss: 3.1899, test_f1: 0.6322
 epoch: 85, train_loss: 0.1008, test_loss: 2.9766, test_f1: 0.6148
 epoch: 86, train_loss: 0.1052, test_loss: 2.9759, test_f1: 0.6626
 epoch: 87, train_loss: 0.1028, test_loss: 2.8547, test_f1: 0.6322
 epoch: 88, train_loss: 0.0889, test_loss: 3.0693, test_f1: 0.6313
 epoch: 89, train_loss: 0.0938, test_loss: 2.9275, test_f1: 0.6543
 epoch: 90, train_loss: 0.0982, test_loss: 2.7888, test_f1: 0.6290
 epoch: 91, train_loss: 0.1070, test_loss: 2.9212, test_f1: 0.6565
 epoch: 92, train_loss: 0.1267, test_loss: 2.5791, test_f1: 0.6786
 epoch: 93, train_loss: 0.0928, test_loss: 2.8025, test_f1: 0.6361
 epoch: 94, train_loss: 0.0955, test_loss: 2.7559, test_f1: 0.6400
 epoch: 95, train_loss: 0.0931, test_loss: 2.9211, test_f1: 0.6565
 epoch: 96, train_loss: 0.1059, test_loss: 3.0742, test_f1: 0.6188
 epoch: 97, train_loss: 0.0778, test_loss: 3.2966, test_f1: 0.6172
 epoch: 98, train_loss: 0.0897, test_loss: 3.1906, test_f1: 0.5947
 epoch: 99, train_loss: 0.0750, test_loss: 3.3737, test_f1: 0.6266
##################ITERATION #3 ****************************************
 epoch: 0, train_loss: 1.1558, test_loss: 1.2864, test_f1: 0.3613
 epoch: 1, train_loss: 0.9223, test_loss: 1.0535, test_f1: 0.5618
 epoch: 2, train_loss: 0.8300, test_loss: 1.2039, test_f1: 0.4969
 epoch: 3, train_loss: 0.8031, test_loss: 1.0072, test_f1: 0.5894
 epoch: 4, train_loss: 0.7769, test_loss: 1.0857, test_f1: 0.5583
 epoch: 5, train_loss: 0.7478, test_loss: 0.9945, test_f1: 0.6210
 epoch: 6, train_loss: 0.7153, test_loss: 1.1695, test_f1: 0.5862
 epoch: 7, train_loss: 0.7170, test_loss: 1.0869, test_f1: 0.5825
 epoch: 8, train_loss: 0.6895, test_loss: 1.1049, test_f1: 0.5519
 epoch: 9, train_loss: 0.6701, test_loss: 1.1256, test_f1: 0.5620
 epoch: 10, train_loss: 0.7027, test_loss: 1.0633, test_f1: 0.6065
 epoch: 11, train_loss: 0.6684, test_loss: 1.0321, test_f1: 0.6270
 epoch: 12, train_loss: 0.6574, test_loss: 0.9618, test_f1: 0.6042
 epoch: 13, train_loss: 0.6190, test_loss: 1.0365, test_f1: 0.6076
 epoch: 14, train_loss: 0.6097, test_loss: 1.0084, test_f1: 0.6762
 epoch: 15, train_loss: 0.5803, test_loss: 0.9158, test_f1: 0.6648
 epoch: 16, train_loss: 0.5835, test_loss: 1.0300, test_f1: 0.6416
 epoch: 17, train_loss: 0.5726, test_loss: 1.2511, test_f1: 0.5913
 epoch: 18, train_loss: 0.5800, test_loss: 1.0899, test_f1: 0.5818
 epoch: 19, train_loss: 0.5707, test_loss: 1.0220, test_f1: 0.6396
 epoch: 20, train_loss: 0.5802, test_loss: 1.3218, test_f1: 0.5339
 epoch: 21, train_loss: 0.5373, test_loss: 1.3190, test_f1: 0.5891
 epoch: 22, train_loss: 0.5035, test_loss: 1.1237, test_f1: 0.5943
 epoch: 23, train_loss: 0.4751, test_loss: 0.9793, test_f1: 0.6431
 epoch: 24, train_loss: 0.4768, test_loss: 1.2697, test_f1: 0.5984
 epoch: 25, train_loss: 0.4810, test_loss: 1.3508, test_f1: 0.5772
 epoch: 26, train_loss: 0.4572, test_loss: 1.3950, test_f1: 0.5747
 epoch: 27, train_loss: 0.4470, test_loss: 1.0961, test_f1: 0.6375
 epoch: 28, train_loss: 0.4485, test_loss: 1.1970, test_f1: 0.6317
 epoch: 29, train_loss: 0.3801, test_loss: 1.4547, test_f1: 0.5960
 epoch: 30, train_loss: 0.3944, test_loss: 1.8442, test_f1: 0.5525
 epoch: 31, train_loss: 0.4285, test_loss: 1.2402, test_f1: 0.6145
 epoch: 32, train_loss: 0.3951, test_loss: 1.1973, test_f1: 0.6506
 epoch: 33, train_loss: 0.3678, test_loss: 1.3514, test_f1: 0.5892
 epoch: 34, train_loss: 0.4088, test_loss: 1.2842, test_f1: 0.6152
 epoch: 35, train_loss: 0.4046, test_loss: 1.2160, test_f1: 0.6441
 epoch: 36, train_loss: 0.3557, test_loss: 1.3056, test_f1: 0.6184
 epoch: 37, train_loss: 0.3306, test_loss: 1.7831, test_f1: 0.5893
 epoch: 38, train_loss: 0.3572, test_loss: 1.5316, test_f1: 0.5855
 epoch: 39, train_loss: 0.3837, test_loss: 1.4695, test_f1: 0.5706
 epoch: 40, train_loss: 0.3177, test_loss: 1.4352, test_f1: 0.5892
 epoch: 41, train_loss: 0.2901, test_loss: 1.6283, test_f1: 0.6020
 epoch: 42, train_loss: 0.3303, test_loss: 1.4530, test_f1: 0.6345
 epoch: 43, train_loss: 0.3074, test_loss: 1.5796, test_f1: 0.6562
 epoch: 44, train_loss: 0.3202, test_loss: 1.6217, test_f1: 0.5816
 epoch: 45, train_loss: 0.2795, test_loss: 1.7163, test_f1: 0.5888
 epoch: 46, train_loss: 0.2490, test_loss: 1.6479, test_f1: 0.6422
 epoch: 47, train_loss: 0.2970, test_loss: 1.7720, test_f1: 0.5728
 epoch: 48, train_loss: 0.2646, test_loss: 1.6595, test_f1: 0.5795
 epoch: 49, train_loss: 0.3078, test_loss: 1.4061, test_f1: 0.6716
 epoch: 50, train_loss: 0.2378, test_loss: 1.6192, test_f1: 0.6183
 epoch: 51, train_loss: 0.1947, test_loss: 1.8590, test_f1: 0.5929
 epoch: 52, train_loss: 0.1881, test_loss: 1.9431, test_f1: 0.5748
 epoch: 53, train_loss: 0.1565, test_loss: 1.9440, test_f1: 0.5900
 epoch: 54, train_loss: 0.1814, test_loss: 2.0753, test_f1: 0.6026
 epoch: 55, train_loss: 0.1758, test_loss: 1.9690, test_f1: 0.5890
 epoch: 56, train_loss: 0.1377, test_loss: 1.9236, test_f1: 0.5933
 epoch: 57, train_loss: 0.1840, test_loss: 2.0298, test_f1: 0.5785
 epoch: 58, train_loss: 0.1489, test_loss: 1.9615, test_f1: 0.5994
 epoch: 59, train_loss: 0.1630, test_loss: 2.0021, test_f1: 0.6049
 epoch: 60, train_loss: 0.1320, test_loss: 2.3485, test_f1: 0.5748
 epoch: 61, train_loss: 0.1420, test_loss: 2.2484, test_f1: 0.5841
 epoch: 62, train_loss: 0.1408, test_loss: 2.2963, test_f1: 0.6079
 epoch: 63, train_loss: 0.1437, test_loss: 2.3216, test_f1: 0.5996
 epoch: 64, train_loss: 0.1086, test_loss: 2.2425, test_f1: 0.6012
 epoch: 65, train_loss: 0.1229, test_loss: 2.3309, test_f1: 0.5924
 epoch: 66, train_loss: 0.1433, test_loss: 2.5383, test_f1: 0.5761
 epoch: 67, train_loss: 0.1255, test_loss: 2.1529, test_f1: 0.6272
 epoch: 68, train_loss: 0.1553, test_loss: 2.1792, test_f1: 0.6231
 epoch: 69, train_loss: 0.1458, test_loss: 2.2155, test_f1: 0.5845
 epoch: 70, train_loss: 0.1124, test_loss: 2.0218, test_f1: 0.6164
 epoch: 71, train_loss: 0.1086, test_loss: 2.2322, test_f1: 0.6176
 epoch: 72, train_loss: 0.1273, test_loss: 1.9389, test_f1: 0.6509
 epoch: 73, train_loss: 0.1326, test_loss: 2.2425, test_f1: 0.5891
 epoch: 74, train_loss: 0.1086, test_loss: 2.0774, test_f1: 0.6294
 epoch: 75, train_loss: 0.0950, test_loss: 2.5580, test_f1: 0.6072
 epoch: 76, train_loss: 0.1188, test_loss: 2.3389, test_f1: 0.6007
 epoch: 77, train_loss: 0.1194, test_loss: 2.5635, test_f1: 0.6049
 epoch: 78, train_loss: 0.1029, test_loss: 2.4998, test_f1: 0.6065
 epoch: 79, train_loss: 0.0947, test_loss: 2.5337, test_f1: 0.6122
 epoch: 80, train_loss: 0.1078, test_loss: 2.5238, test_f1: 0.5953
 epoch: 81, train_loss: 0.1404, test_loss: 2.2102, test_f1: 0.5782
 epoch: 82, train_loss: 0.1399, test_loss: 2.4584, test_f1: 0.6072
 epoch: 83, train_loss: 0.1049, test_loss: 2.4681, test_f1: 0.5979
 epoch: 84, train_loss: 0.0762, test_loss: 2.3769, test_f1: 0.6223
 epoch: 85, train_loss: 0.1522, test_loss: 2.5907, test_f1: 0.5960
 epoch: 86, train_loss: 0.1265, test_loss: 2.6913, test_f1: 0.6037
 epoch: 87, train_loss: 0.1077, test_loss: 2.5507, test_f1: 0.6165
 epoch: 88, train_loss: 0.0759, test_loss: 2.9608, test_f1: 0.5836
 epoch: 89, train_loss: 0.0896, test_loss: 2.6391, test_f1: 0.5899
 epoch: 90, train_loss: 0.1010, test_loss: 2.6339, test_f1: 0.5815
 epoch: 91, train_loss: 0.1089, test_loss: 2.7567, test_f1: 0.6088
 epoch: 92, train_loss: 0.1104, test_loss: 2.5985, test_f1: 0.6058
 epoch: 93, train_loss: 0.1427, test_loss: 2.5029, test_f1: 0.5959
 epoch: 94, train_loss: 0.1053, test_loss: 2.5558, test_f1: 0.6261
 epoch: 95, train_loss: 0.1453, test_loss: 2.5047, test_f1: 0.5863
 epoch: 96, train_loss: 0.0985, test_loss: 2.6988, test_f1: 0.5949
 epoch: 97, train_loss: 0.0825, test_loss: 2.3744, test_f1: 0.6166
 epoch: 98, train_loss: 0.1190, test_loss: 2.4914, test_f1: 0.5775
 epoch: 99, train_loss: 0.0761, test_loss: 2.3460, test_f1: 0.5979
##################ITERATION #4 ****************************************
 epoch: 0, train_loss: 1.1517, test_loss: 1.1864, test_f1: 0.3949
 epoch: 1, train_loss: 0.9343, test_loss: 1.0698, test_f1: 0.5123
 epoch: 2, train_loss: 0.8622, test_loss: 1.0422, test_f1: 0.5451
 epoch: 3, train_loss: 0.8336, test_loss: 1.1769, test_f1: 0.5897
 epoch: 4, train_loss: 0.8112, test_loss: 1.0831, test_f1: 0.5560
 epoch: 5, train_loss: 0.7703, test_loss: 1.0639, test_f1: 0.6090
 epoch: 6, train_loss: 0.7145, test_loss: 1.0186, test_f1: 0.5861
 epoch: 7, train_loss: 0.7324, test_loss: 0.9653, test_f1: 0.6326
 epoch: 8, train_loss: 0.6928, test_loss: 1.1013, test_f1: 0.5337
 epoch: 9, train_loss: 0.7042, test_loss: 1.1841, test_f1: 0.5523
 epoch: 10, train_loss: 0.6896, test_loss: 1.1428, test_f1: 0.5853
 epoch: 11, train_loss: 0.6457, test_loss: 1.0767, test_f1: 0.6446
 epoch: 12, train_loss: 0.6344, test_loss: 1.0908, test_f1: 0.5871
 epoch: 13, train_loss: 0.6189, test_loss: 1.1047, test_f1: 0.6363
 epoch: 14, train_loss: 0.6005, test_loss: 1.3125, test_f1: 0.5986
 epoch: 15, train_loss: 0.5965, test_loss: 1.1026, test_f1: 0.6517
 epoch: 16, train_loss: 0.5627, test_loss: 1.0590, test_f1: 0.5806
 epoch: 17, train_loss: 0.5676, test_loss: 0.9943, test_f1: 0.6650
 epoch: 18, train_loss: 0.5376, test_loss: 1.3973, test_f1: 0.6346
 epoch: 19, train_loss: 0.5504, test_loss: 1.0814, test_f1: 0.6069
 epoch: 20, train_loss: 0.4929, test_loss: 1.2292, test_f1: 0.5944
 epoch: 21, train_loss: 0.5179, test_loss: 1.1054, test_f1: 0.6288
 epoch: 22, train_loss: 0.5269, test_loss: 1.2039, test_f1: 0.6900
 epoch: 23, train_loss: 0.5033, test_loss: 1.1364, test_f1: 0.6614
 epoch: 24, train_loss: 0.4623, test_loss: 1.0451, test_f1: 0.6774
 epoch: 25, train_loss: 0.4694, test_loss: 1.4014, test_f1: 0.6162
 epoch: 26, train_loss: 0.4571, test_loss: 1.3043, test_f1: 0.6162
 epoch: 27, train_loss: 0.4232, test_loss: 1.6003, test_f1: 0.6328
 epoch: 28, train_loss: 0.4405, test_loss: 1.6447, test_f1: 0.6220
 epoch: 29, train_loss: 0.4174, test_loss: 1.5249, test_f1: 0.6314
 epoch: 30, train_loss: 0.4125, test_loss: 1.2699, test_f1: 0.6476
 epoch: 31, train_loss: 0.3787, test_loss: 1.4782, test_f1: 0.5925
 epoch: 32, train_loss: 0.3964, test_loss: 1.3802, test_f1: 0.6360
 epoch: 33, train_loss: 0.3784, test_loss: 1.5792, test_f1: 0.6831
 epoch: 34, train_loss: 0.3838, test_loss: 1.4306, test_f1: 0.6431
 epoch: 35, train_loss: 0.3219, test_loss: 1.6029, test_f1: 0.6567
 epoch: 36, train_loss: 0.3665, test_loss: 1.5123, test_f1: 0.6394
 epoch: 37, train_loss: 0.3470, test_loss: 1.5464, test_f1: 0.6697
 epoch: 38, train_loss: 0.2967, test_loss: 1.7115, test_f1: 0.5785
 epoch: 39, train_loss: 0.3380, test_loss: 1.7690, test_f1: 0.5944
 epoch: 40, train_loss: 0.3050, test_loss: 1.5673, test_f1: 0.7046
 epoch: 41, train_loss: 0.3177, test_loss: 1.7574, test_f1: 0.6494
 epoch: 42, train_loss: 0.2835, test_loss: 1.6344, test_f1: 0.6953
 epoch: 43, train_loss: 0.2744, test_loss: 1.9790, test_f1: 0.6586
 epoch: 44, train_loss: 0.3047, test_loss: 1.8936, test_f1: 0.6140
 epoch: 45, train_loss: 0.3415, test_loss: 1.7478, test_f1: 0.6350
 epoch: 46, train_loss: 0.2652, test_loss: 1.8018, test_f1: 0.6395
 epoch: 47, train_loss: 0.2774, test_loss: 1.7032, test_f1: 0.6357
 epoch: 48, train_loss: 0.2724, test_loss: 1.8734, test_f1: 0.6569
 epoch: 49, train_loss: 0.2618, test_loss: 1.7550, test_f1: 0.6404
 epoch: 50, train_loss: 0.2547, test_loss: 1.9823, test_f1: 0.6134
 epoch: 51, train_loss: 0.2370, test_loss: 1.7896, test_f1: 0.6491
 epoch: 52, train_loss: 0.1732, test_loss: 1.7714, test_f1: 0.6771
 epoch: 53, train_loss: 0.1691, test_loss: 1.8765, test_f1: 0.6522
 epoch: 54, train_loss: 0.1727, test_loss: 2.1387, test_f1: 0.6664
 epoch: 55, train_loss: 0.1661, test_loss: 2.0789, test_f1: 0.6803
 epoch: 56, train_loss: 0.1504, test_loss: 2.1203, test_f1: 0.6514
 epoch: 57, train_loss: 0.1599, test_loss: 1.9451, test_f1: 0.6540
 epoch: 58, train_loss: 0.1511, test_loss: 2.1610, test_f1: 0.6591
 epoch: 59, train_loss: 0.1366, test_loss: 2.0745, test_f1: 0.6616
 epoch: 60, train_loss: 0.1493, test_loss: 2.2714, test_f1: 0.6630
 epoch: 61, train_loss: 0.1559, test_loss: 2.3701, test_f1: 0.6262
 epoch: 62, train_loss: 0.1516, test_loss: 2.3986, test_f1: 0.6276
 epoch: 63, train_loss: 0.1402, test_loss: 2.4969, test_f1: 0.6411
 epoch: 64, train_loss: 0.1302, test_loss: 2.1674, test_f1: 0.6793
 epoch: 65, train_loss: 0.1531, test_loss: 2.2504, test_f1: 0.6438
 epoch: 66, train_loss: 0.1360, test_loss: 2.1895, test_f1: 0.6586
 epoch: 67, train_loss: 0.1224, test_loss: 2.3321, test_f1: 0.6565
 epoch: 68, train_loss: 0.1375, test_loss: 2.6393, test_f1: 0.6236
 epoch: 69, train_loss: 0.1370, test_loss: 2.5728, test_f1: 0.6048
 epoch: 70, train_loss: 0.1342, test_loss: 2.5220, test_f1: 0.6308
 epoch: 71, train_loss: 0.1366, test_loss: 2.5095, test_f1: 0.6281
 epoch: 72, train_loss: 0.0995, test_loss: 2.4313, test_f1: 0.6691
 epoch: 73, train_loss: 0.1285, test_loss: 2.3959, test_f1: 0.6436
 epoch: 74, train_loss: 0.1484, test_loss: 2.3577, test_f1: 0.6634
 epoch: 75, train_loss: 0.1404, test_loss: 2.4732, test_f1: 0.6932
 epoch: 76, train_loss: 0.1244, test_loss: 2.4397, test_f1: 0.6587
 epoch: 77, train_loss: 0.1109, test_loss: 2.4195, test_f1: 0.6517
 epoch: 78, train_loss: 0.1079, test_loss: 2.4800, test_f1: 0.6410
 epoch: 79, train_loss: 0.1102, test_loss: 2.7148, test_f1: 0.6480
 epoch: 80, train_loss: 0.1181, test_loss: 2.8467, test_f1: 0.6528
 epoch: 81, train_loss: 0.1339, test_loss: 2.4056, test_f1: 0.6312
 epoch: 82, train_loss: 0.1086, test_loss: 2.4558, test_f1: 0.6600
 epoch: 83, train_loss: 0.1272, test_loss: 2.7985, test_f1: 0.6489
 epoch: 84, train_loss: 0.1002, test_loss: 2.6956, test_f1: 0.6449
 epoch: 85, train_loss: 0.1028, test_loss: 2.8273, test_f1: 0.6373
 epoch: 86, train_loss: 0.0981, test_loss: 2.7510, test_f1: 0.6469
 epoch: 87, train_loss: 0.0946, test_loss: 2.6353, test_f1: 0.7036
 epoch: 88, train_loss: 0.0954, test_loss: 2.5816, test_f1: 0.6754
 epoch: 89, train_loss: 0.0978, test_loss: 2.9063, test_f1: 0.6195
 epoch: 90, train_loss: 0.1104, test_loss: 2.7023, test_f1: 0.6514
 epoch: 91, train_loss: 0.1275, test_loss: 2.5734, test_f1: 0.6681
 epoch: 92, train_loss: 0.1341, test_loss: 2.6630, test_f1: 0.6437
 epoch: 93, train_loss: 0.1036, test_loss: 2.7626, test_f1: 0.6565
 epoch: 94, train_loss: 0.0916, test_loss: 2.7944, test_f1: 0.6220
 epoch: 95, train_loss: 0.0960, test_loss: 2.8646, test_f1: 0.6601
 epoch: 96, train_loss: 0.0986, test_loss: 2.6468, test_f1: 0.6773
 epoch: 97, train_loss: 0.1145, test_loss: 2.6026, test_f1: 0.6531
 epoch: 98, train_loss: 0.0843, test_loss: 2.7492, test_f1: 0.6571
 epoch: 99, train_loss: 0.1067, test_loss: 2.9218, test_f1: 0.6331
##################ITERATION #5 ****************************************
 epoch: 0, train_loss: 1.2331, test_loss: 1.3462, test_f1: 0.3995
 epoch: 1, train_loss: 0.9523, test_loss: 1.0561, test_f1: 0.5551
 epoch: 2, train_loss: 0.8591, test_loss: 1.0530, test_f1: 0.6411
 epoch: 3, train_loss: 0.8112, test_loss: 1.1140, test_f1: 0.5488
 epoch: 4, train_loss: 0.7921, test_loss: 1.1305, test_f1: 0.5770
 epoch: 5, train_loss: 0.7773, test_loss: 0.9964, test_f1: 0.5771
 epoch: 6, train_loss: 0.7533, test_loss: 0.9879, test_f1: 0.6529
 epoch: 7, train_loss: 0.7365, test_loss: 1.3112, test_f1: 0.5136
 epoch: 8, train_loss: 0.7341, test_loss: 0.9212, test_f1: 0.6565
 epoch: 9, train_loss: 0.6889, test_loss: 1.0491, test_f1: 0.5775
 epoch: 10, train_loss: 0.6861, test_loss: 0.9373, test_f1: 0.5707
 epoch: 11, train_loss: 0.6420, test_loss: 0.9650, test_f1: 0.6549
 epoch: 12, train_loss: 0.6393, test_loss: 1.0106, test_f1: 0.6229
 epoch: 13, train_loss: 0.6196, test_loss: 1.1717, test_f1: 0.6322
 epoch: 14, train_loss: 0.5949, test_loss: 1.1769, test_f1: 0.5685
 epoch: 15, train_loss: 0.5960, test_loss: 1.0617, test_f1: 0.6257
 epoch: 16, train_loss: 0.5832, test_loss: 1.1075, test_f1: 0.5981
 epoch: 17, train_loss: 0.5571, test_loss: 1.0487, test_f1: 0.5909
 epoch: 18, train_loss: 0.5569, test_loss: 0.9394, test_f1: 0.6655
 epoch: 19, train_loss: 0.5262, test_loss: 1.1427, test_f1: 0.5654
 epoch: 20, train_loss: 0.5335, test_loss: 1.1381, test_f1: 0.5739
 epoch: 21, train_loss: 0.5273, test_loss: 1.0480, test_f1: 0.6812
 epoch: 22, train_loss: 0.4937, test_loss: 1.2100, test_f1: 0.5839
 epoch: 23, train_loss: 0.5130, test_loss: 1.1625, test_f1: 0.6322
 epoch: 24, train_loss: 0.4592, test_loss: 1.2085, test_f1: 0.5977
 epoch: 25, train_loss: 0.4891, test_loss: 1.2318, test_f1: 0.5912
 epoch: 26, train_loss: 0.4588, test_loss: 1.2018, test_f1: 0.6413
 epoch: 27, train_loss: 0.4442, test_loss: 1.2749, test_f1: 0.6344
 epoch: 28, train_loss: 0.4410, test_loss: 1.3713, test_f1: 0.6422
 epoch: 29, train_loss: 0.4155, test_loss: 1.3932, test_f1: 0.6091
 epoch: 30, train_loss: 0.4301, test_loss: 1.3255, test_f1: 0.6053
 epoch: 31, train_loss: 0.4096, test_loss: 1.2110, test_f1: 0.6454
 epoch: 32, train_loss: 0.3844, test_loss: 1.3658, test_f1: 0.6313
 epoch: 33, train_loss: 0.3549, test_loss: 1.4010, test_f1: 0.6145
 epoch: 34, train_loss: 0.3623, test_loss: 1.4105, test_f1: 0.6115
 epoch: 35, train_loss: 0.3755, test_loss: 1.4901, test_f1: 0.6274
 epoch: 36, train_loss: 0.3924, test_loss: 1.4564, test_f1: 0.6256
 epoch: 37, train_loss: 0.3484, test_loss: 1.4662, test_f1: 0.5925
 epoch: 38, train_loss: 0.3396, test_loss: 1.4988, test_f1: 0.6417
 epoch: 39, train_loss: 0.3459, test_loss: 1.4806, test_f1: 0.5998
 epoch: 40, train_loss: 0.3259, test_loss: 1.5650, test_f1: 0.5851
 epoch: 41, train_loss: 0.3344, test_loss: 1.3200, test_f1: 0.6490
 epoch: 42, train_loss: 0.3603, test_loss: 1.4337, test_f1: 0.6686
 epoch: 43, train_loss: 0.3473, test_loss: 1.2683, test_f1: 0.6582
 epoch: 44, train_loss: 0.3388, test_loss: 1.3368, test_f1: 0.6386
 epoch: 45, train_loss: 0.2970, test_loss: 1.4636, test_f1: 0.6705
 epoch: 46, train_loss: 0.2919, test_loss: 1.4950, test_f1: 0.5660
 epoch: 47, train_loss: 0.2760, test_loss: 1.7071, test_f1: 0.6085
 epoch: 48, train_loss: 0.2669, test_loss: 1.5628, test_f1: 0.6374
 epoch: 49, train_loss: 0.2400, test_loss: 1.7797, test_f1: 0.5999
 epoch: 50, train_loss: 0.2875, test_loss: 1.5516, test_f1: 0.6233
 epoch: 51, train_loss: 0.2201, test_loss: 1.6467, test_f1: 0.6148
 epoch: 52, train_loss: 0.2060, test_loss: 1.7261, test_f1: 0.6246
 epoch: 53, train_loss: 0.1696, test_loss: 1.7310, test_f1: 0.6243
 epoch: 54, train_loss: 0.1552, test_loss: 1.8274, test_f1: 0.6054
 epoch: 55, train_loss: 0.1856, test_loss: 1.9523, test_f1: 0.6083
 epoch: 56, train_loss: 0.1651, test_loss: 2.2131, test_f1: 0.5934
 epoch: 57, train_loss: 0.1488, test_loss: 2.0445, test_f1: 0.6163
 epoch: 58, train_loss: 0.1571, test_loss: 2.0094, test_f1: 0.6022
 epoch: 59, train_loss: 0.1715, test_loss: 1.9747, test_f1: 0.6240
 epoch: 60, train_loss: 0.1529, test_loss: 1.9319, test_f1: 0.6092
 epoch: 61, train_loss: 0.1682, test_loss: 2.1105, test_f1: 0.5985
 epoch: 62, train_loss: 0.1596, test_loss: 2.1634, test_f1: 0.5772
 epoch: 63, train_loss: 0.1641, test_loss: 2.1273, test_f1: 0.6141
 epoch: 64, train_loss: 0.1388, test_loss: 2.0518, test_f1: 0.6056
 epoch: 65, train_loss: 0.1380, test_loss: 2.2083, test_f1: 0.6085
 epoch: 66, train_loss: 0.1391, test_loss: 2.3696, test_f1: 0.5934
 epoch: 67, train_loss: 0.1436, test_loss: 2.2094, test_f1: 0.6277
 epoch: 68, train_loss: 0.1166, test_loss: 2.2250, test_f1: 0.6271
 epoch: 69, train_loss: 0.1418, test_loss: 2.1082, test_f1: 0.6282
 epoch: 70, train_loss: 0.1419, test_loss: 2.0131, test_f1: 0.6456
 epoch: 71, train_loss: 0.1683, test_loss: 2.3366, test_f1: 0.5940
 epoch: 72, train_loss: 0.1555, test_loss: 2.2288, test_f1: 0.6132
 epoch: 73, train_loss: 0.1466, test_loss: 2.1860, test_f1: 0.6391
 epoch: 74, train_loss: 0.1297, test_loss: 2.6744, test_f1: 0.6106
 epoch: 75, train_loss: 0.1370, test_loss: 2.5455, test_f1: 0.5952
 epoch: 76, train_loss: 0.1232, test_loss: 2.2587, test_f1: 0.5921
 epoch: 77, train_loss: 0.1228, test_loss: 2.3072, test_f1: 0.6235
 epoch: 78, train_loss: 0.1277, test_loss: 2.1480, test_f1: 0.6218
 epoch: 79, train_loss: 0.1312, test_loss: 2.1574, test_f1: 0.6077
 epoch: 80, train_loss: 0.0999, test_loss: 2.2914, test_f1: 0.6227
 epoch: 81, train_loss: 0.0972, test_loss: 2.3560, test_f1: 0.6164
 epoch: 82, train_loss: 0.0946, test_loss: 2.4536, test_f1: 0.6006
 epoch: 83, train_loss: 0.1226, test_loss: 2.3753, test_f1: 0.6059
 epoch: 84, train_loss: 0.1187, test_loss: 2.6957, test_f1: 0.6088
 epoch: 85, train_loss: 0.1114, test_loss: 2.6593, test_f1: 0.6069
 epoch: 86, train_loss: 0.0976, test_loss: 2.6560, test_f1: 0.5919
 epoch: 87, train_loss: 0.1007, test_loss: 2.8112, test_f1: 0.5790
 epoch: 88, train_loss: 0.1114, test_loss: 2.4669, test_f1: 0.6263
 epoch: 89, train_loss: 0.1158, test_loss: 2.5588, test_f1: 0.5939
 epoch: 90, train_loss: 0.0964, test_loss: 2.3603, test_f1: 0.6045
 epoch: 91, train_loss: 0.0834, test_loss: 2.5947, test_f1: 0.5955
 epoch: 92, train_loss: 0.1108, test_loss: 2.4913, test_f1: 0.5962
 epoch: 93, train_loss: 0.1270, test_loss: 2.7468, test_f1: 0.6003
 epoch: 94, train_loss: 0.1133, test_loss: 2.5279, test_f1: 0.6328
 epoch: 95, train_loss: 0.1151, test_loss: 2.3833, test_f1: 0.6243
 epoch: 96, train_loss: 0.1095, test_loss: 2.5704, test_f1: 0.6126
 epoch: 97, train_loss: 0.0830, test_loss: 2.3569, test_f1: 0.6369
 epoch: 98, train_loss: 0.1118, test_loss: 2.4496, test_f1: 0.6261
 epoch: 99, train_loss: 0.0978, test_loss: 2.5378, test_f1: 0.6442
##################ITERATION #6 ****************************************
 epoch: 0, train_loss: 1.2081, test_loss: 1.3185, test_f1: 0.4925
 epoch: 1, train_loss: 0.9553, test_loss: 1.1118, test_f1: 0.5069
 epoch: 2, train_loss: 0.8754, test_loss: 1.0490, test_f1: 0.5625
 epoch: 3, train_loss: 0.7990, test_loss: 1.1068, test_f1: 0.5569
 epoch: 4, train_loss: 0.7831, test_loss: 0.9683, test_f1: 0.6309
 epoch: 5, train_loss: 0.7555, test_loss: 1.1227, test_f1: 0.5416
 epoch: 6, train_loss: 0.7769, test_loss: 1.0126, test_f1: 0.5353
 epoch: 7, train_loss: 0.7446, test_loss: 1.2049, test_f1: 0.5879
 epoch: 8, train_loss: 0.7292, test_loss: 0.9996, test_f1: 0.5675
 epoch: 9, train_loss: 0.6951, test_loss: 0.9539, test_f1: 0.6169
 epoch: 10, train_loss: 0.7090, test_loss: 0.9906, test_f1: 0.6128
 epoch: 11, train_loss: 0.6792, test_loss: 0.9388, test_f1: 0.6242
 epoch: 12, train_loss: 0.6742, test_loss: 1.0118, test_f1: 0.6022
 epoch: 13, train_loss: 0.6458, test_loss: 1.0608, test_f1: 0.5953
 epoch: 14, train_loss: 0.6085, test_loss: 1.0707, test_f1: 0.6209
 epoch: 15, train_loss: 0.6170, test_loss: 1.5407, test_f1: 0.5360
 epoch: 16, train_loss: 0.6055, test_loss: 1.1645, test_f1: 0.6020
 epoch: 17, train_loss: 0.6073, test_loss: 1.2770, test_f1: 0.5973
 epoch: 18, train_loss: 0.5765, test_loss: 1.0445, test_f1: 0.5694
 epoch: 19, train_loss: 0.5452, test_loss: 1.4703, test_f1: 0.5414
 epoch: 20, train_loss: 0.5423, test_loss: 1.1690, test_f1: 0.5908
 epoch: 21, train_loss: 0.5027, test_loss: 1.2928, test_f1: 0.6136
 epoch: 22, train_loss: 0.5327, test_loss: 1.2702, test_f1: 0.6113
 epoch: 23, train_loss: 0.5463, test_loss: 1.1243, test_f1: 0.6002
 epoch: 24, train_loss: 0.5172, test_loss: 1.1446, test_f1: 0.6208
 epoch: 25, train_loss: 0.4838, test_loss: 1.3007, test_f1: 0.5992
 epoch: 26, train_loss: 0.4877, test_loss: 1.2840, test_f1: 0.5216
 epoch: 27, train_loss: 0.4674, test_loss: 1.2291, test_f1: 0.6098
 epoch: 28, train_loss: 0.4638, test_loss: 1.4101, test_f1: 0.6133
 epoch: 29, train_loss: 0.4954, test_loss: 1.3106, test_f1: 0.5971
 epoch: 30, train_loss: 0.4371, test_loss: 1.2373, test_f1: 0.6529
 epoch: 31, train_loss: 0.4176, test_loss: 1.2260, test_f1: 0.6403
 epoch: 32, train_loss: 0.4326, test_loss: 1.4677, test_f1: 0.5880
 epoch: 33, train_loss: 0.4515, test_loss: 1.2795, test_f1: 0.6291
 epoch: 34, train_loss: 0.4290, test_loss: 1.2663, test_f1: 0.6260
 epoch: 35, train_loss: 0.3941, test_loss: 1.3347, test_f1: 0.6005
 epoch: 36, train_loss: 0.3828, test_loss: 1.3493, test_f1: 0.6199
 epoch: 37, train_loss: 0.3643, test_loss: 1.5521, test_f1: 0.6099
 epoch: 38, train_loss: 0.3499, test_loss: 1.8762, test_f1: 0.5509
 epoch: 39, train_loss: 0.3536, test_loss: 1.5310, test_f1: 0.6322
 epoch: 40, train_loss: 0.3361, test_loss: 1.3761, test_f1: 0.6316
 epoch: 41, train_loss: 0.3526, test_loss: 1.5396, test_f1: 0.5960
 epoch: 42, train_loss: 0.3613, test_loss: 1.2526, test_f1: 0.6556
 epoch: 43, train_loss: 0.3064, test_loss: 1.8684, test_f1: 0.6136
 epoch: 44, train_loss: 0.3222, test_loss: 1.5607, test_f1: 0.6461
 epoch: 45, train_loss: 0.3628, test_loss: 1.5729, test_f1: 0.6233
 epoch: 46, train_loss: 0.3110, test_loss: 1.6903, test_f1: 0.6297
 epoch: 47, train_loss: 0.3006, test_loss: 1.7566, test_f1: 0.6189
 epoch: 48, train_loss: 0.2987, test_loss: 1.6127, test_f1: 0.6487
 epoch: 49, train_loss: 0.2711, test_loss: 1.7900, test_f1: 0.6269
 epoch: 50, train_loss: 0.2709, test_loss: 1.7264, test_f1: 0.6253
 epoch: 51, train_loss: 0.2240, test_loss: 1.8738, test_f1: 0.6377
 epoch: 52, train_loss: 0.2363, test_loss: 1.7849, test_f1: 0.6548
 epoch: 53, train_loss: 0.1826, test_loss: 1.8487, test_f1: 0.6474
 epoch: 54, train_loss: 0.1753, test_loss: 2.1584, test_f1: 0.6006
 epoch: 55, train_loss: 0.1751, test_loss: 2.1933, test_f1: 0.6006
 epoch: 56, train_loss: 0.2025, test_loss: 2.3027, test_f1: 0.6028
 epoch: 57, train_loss: 0.1848, test_loss: 2.2548, test_f1: 0.5964
 epoch: 58, train_loss: 0.1798, test_loss: 2.1656, test_f1: 0.6175
 epoch: 59, train_loss: 0.1799, test_loss: 2.1911, test_f1: 0.5935
 epoch: 60, train_loss: 0.1580, test_loss: 2.2464, test_f1: 0.6124
 epoch: 61, train_loss: 0.1664, test_loss: 2.2174, test_f1: 0.6360
 epoch: 62, train_loss: 0.1501, test_loss: 2.1686, test_f1: 0.6281
 epoch: 63, train_loss: 0.1628, test_loss: 2.1978, test_f1: 0.6505
 epoch: 64, train_loss: 0.1870, test_loss: 2.3761, test_f1: 0.5880
 epoch: 65, train_loss: 0.1860, test_loss: 2.2216, test_f1: 0.6185
 epoch: 66, train_loss: 0.1834, test_loss: 2.0967, test_f1: 0.6368
 epoch: 67, train_loss: 0.1517, test_loss: 2.3950, test_f1: 0.6127
 epoch: 68, train_loss: 0.1344, test_loss: 2.3944, test_f1: 0.6446
 epoch: 69, train_loss: 0.1582, test_loss: 2.2957, test_f1: 0.6407
 epoch: 70, train_loss: 0.1564, test_loss: 2.6271, test_f1: 0.6012
 epoch: 71, train_loss: 0.1510, test_loss: 2.3716, test_f1: 0.6318
 epoch: 72, train_loss: 0.1611, test_loss: 2.2596, test_f1: 0.6396
 epoch: 73, train_loss: 0.1369, test_loss: 2.2278, test_f1: 0.6455
 epoch: 74, train_loss: 0.1478, test_loss: 2.4312, test_f1: 0.6145
 epoch: 75, train_loss: 0.1367, test_loss: 2.4758, test_f1: 0.6265
 epoch: 76, train_loss: 0.1293, test_loss: 2.5861, test_f1: 0.6207
 epoch: 77, train_loss: 0.1136, test_loss: 2.5673, test_f1: 0.6265
 epoch: 78, train_loss: 0.1327, test_loss: 2.5924, test_f1: 0.6294
 epoch: 79, train_loss: 0.1462, test_loss: 2.3201, test_f1: 0.6484
 epoch: 80, train_loss: 0.1257, test_loss: 2.5722, test_f1: 0.6393
 epoch: 81, train_loss: 0.1511, test_loss: 2.3486, test_f1: 0.6406
 epoch: 82, train_loss: 0.1189, test_loss: 2.2876, test_f1: 0.6174
 epoch: 83, train_loss: 0.0923, test_loss: 2.6151, test_f1: 0.5974
 epoch: 84, train_loss: 0.1231, test_loss: 2.6067, test_f1: 0.6711
 epoch: 85, train_loss: 0.1311, test_loss: 2.6580, test_f1: 0.6376
 epoch: 86, train_loss: 0.1350, test_loss: 2.7853, test_f1: 0.6280
 epoch: 87, train_loss: 0.1223, test_loss: 2.7807, test_f1: 0.6346
 epoch: 88, train_loss: 0.1007, test_loss: 2.6638, test_f1: 0.6313
 epoch: 89, train_loss: 0.1071, test_loss: 2.8023, test_f1: 0.6036
 epoch: 90, train_loss: 0.0986, test_loss: 2.9877, test_f1: 0.6172
 epoch: 91, train_loss: 0.1303, test_loss: 2.2166, test_f1: 0.6525
 epoch: 92, train_loss: 0.1191, test_loss: 2.7463, test_f1: 0.6339
 epoch: 93, train_loss: 0.1025, test_loss: 2.6865, test_f1: 0.5871
 epoch: 94, train_loss: 0.1150, test_loss: 2.7597, test_f1: 0.6216
 epoch: 95, train_loss: 0.1098, test_loss: 2.8609, test_f1: 0.6230
 epoch: 96, train_loss: 0.1161, test_loss: 2.8503, test_f1: 0.6322
 epoch: 97, train_loss: 0.0890, test_loss: 3.0408, test_f1: 0.6163
 epoch: 98, train_loss: 0.1001, test_loss: 2.9884, test_f1: 0.6207
 epoch: 99, train_loss: 0.1123, test_loss: 3.5866, test_f1: 0.5922
##################ITERATION #7 ****************************************
 epoch: 0, train_loss: 1.2196, test_loss: 1.4422, test_f1: 0.4345
 epoch: 1, train_loss: 0.9430, test_loss: 1.1415, test_f1: 0.5024
 epoch: 2, train_loss: 0.8727, test_loss: 1.0313, test_f1: 0.5671
 epoch: 3, train_loss: 0.8018, test_loss: 1.0919, test_f1: 0.5794
 epoch: 4, train_loss: 0.7990, test_loss: 1.0114, test_f1: 0.6441
 epoch: 5, train_loss: 0.7382, test_loss: 1.0608, test_f1: 0.5791
 epoch: 6, train_loss: 0.7406, test_loss: 1.0084, test_f1: 0.6293
 epoch: 7, train_loss: 0.7019, test_loss: 1.1212, test_f1: 0.6438
 epoch: 8, train_loss: 0.7055, test_loss: 1.1420, test_f1: 0.6214
 epoch: 9, train_loss: 0.6835, test_loss: 1.1356, test_f1: 0.6230
 epoch: 10, train_loss: 0.6658, test_loss: 1.1554, test_f1: 0.6162
 epoch: 11, train_loss: 0.6388, test_loss: 1.0508, test_f1: 0.6350
 epoch: 12, train_loss: 0.6295, test_loss: 1.1975, test_f1: 0.5974
 epoch: 13, train_loss: 0.6116, test_loss: 1.2958, test_f1: 0.5490
 epoch: 14, train_loss: 0.5981, test_loss: 1.0878, test_f1: 0.6628
 epoch: 15, train_loss: 0.5830, test_loss: 1.0677, test_f1: 0.7014
 epoch: 16, train_loss: 0.5547, test_loss: 1.0757, test_f1: 0.6329
 epoch: 17, train_loss: 0.5708, test_loss: 1.1970, test_f1: 0.6247
 epoch: 18, train_loss: 0.5438, test_loss: 1.2078, test_f1: 0.6182
 epoch: 19, train_loss: 0.5446, test_loss: 1.1112, test_f1: 0.6163
 epoch: 20, train_loss: 0.5128, test_loss: 1.1823, test_f1: 0.5723
 epoch: 21, train_loss: 0.4843, test_loss: 1.3601, test_f1: 0.5678
 epoch: 22, train_loss: 0.4630, test_loss: 1.5462, test_f1: 0.5947
 epoch: 23, train_loss: 0.4663, test_loss: 1.5994, test_f1: 0.5307
 epoch: 24, train_loss: 0.4691, test_loss: 1.2998, test_f1: 0.6076
 epoch: 25, train_loss: 0.4606, test_loss: 1.5826, test_f1: 0.5794
 epoch: 26, train_loss: 0.4598, test_loss: 1.6252, test_f1: 0.5655
 epoch: 27, train_loss: 0.4741, test_loss: 1.0765, test_f1: 0.6665
 epoch: 28, train_loss: 0.4527, test_loss: 1.2253, test_f1: 0.6225
 epoch: 29, train_loss: 0.4280, test_loss: 1.2097, test_f1: 0.6207
 epoch: 30, train_loss: 0.4163, test_loss: 1.4558, test_f1: 0.6172
 epoch: 31, train_loss: 0.4210, test_loss: 1.4221, test_f1: 0.5919
 epoch: 32, train_loss: 0.4004, test_loss: 1.3869, test_f1: 0.6024
 epoch: 33, train_loss: 0.4035, test_loss: 1.3756, test_f1: 0.6572
 epoch: 34, train_loss: 0.3708, test_loss: 1.3694, test_f1: 0.6443
 epoch: 35, train_loss: 0.3490, test_loss: 1.5028, test_f1: 0.6396
 epoch: 36, train_loss: 0.3294, test_loss: 1.8978, test_f1: 0.6197
 epoch: 37, train_loss: 0.3399, test_loss: 1.6634, test_f1: 0.5994
 epoch: 38, train_loss: 0.3648, test_loss: 1.4393, test_f1: 0.6375
 epoch: 39, train_loss: 0.3107, test_loss: 1.3049, test_f1: 0.6618
 epoch: 40, train_loss: 0.3218, test_loss: 1.3809, test_f1: 0.6705
 epoch: 41, train_loss: 0.3387, test_loss: 1.7599, test_f1: 0.6455
 epoch: 42, train_loss: 0.2757, test_loss: 1.6553, test_f1: 0.6107
 epoch: 43, train_loss: 0.3330, test_loss: 1.2955, test_f1: 0.6485
 epoch: 44, train_loss: 0.3190, test_loss: 1.8754, test_f1: 0.6250
 epoch: 45, train_loss: 0.3069, test_loss: 1.4591, test_f1: 0.6319
 epoch: 46, train_loss: 0.3166, test_loss: 1.6311, test_f1: 0.6308
 epoch: 47, train_loss: 0.2870, test_loss: 1.6337, test_f1: 0.6102
 epoch: 48, train_loss: 0.2840, test_loss: 1.9692, test_f1: 0.6137
 epoch: 49, train_loss: 0.2715, test_loss: 1.8973, test_f1: 0.6187
 epoch: 50, train_loss: 0.2655, test_loss: 1.9730, test_f1: 0.6344
 epoch: 51, train_loss: 0.2035, test_loss: 1.8702, test_f1: 0.6326
 epoch: 52, train_loss: 0.1661, test_loss: 1.9906, test_f1: 0.6460
 epoch: 53, train_loss: 0.1602, test_loss: 2.0683, test_f1: 0.6306
 epoch: 54, train_loss: 0.1445, test_loss: 2.0906, test_f1: 0.6288
 epoch: 55, train_loss: 0.1591, test_loss: 2.1285, test_f1: 0.6232
 epoch: 56, train_loss: 0.1725, test_loss: 1.9306, test_f1: 0.6368
 epoch: 57, train_loss: 0.1566, test_loss: 2.0601, test_f1: 0.6364
 epoch: 58, train_loss: 0.1507, test_loss: 2.2178, test_f1: 0.6243
 epoch: 59, train_loss: 0.1389, test_loss: 2.2576, test_f1: 0.6508
 epoch: 60, train_loss: 0.1372, test_loss: 2.2824, test_f1: 0.6159
 epoch: 61, train_loss: 0.1277, test_loss: 2.4431, test_f1: 0.6595
 epoch: 62, train_loss: 0.1212, test_loss: 2.4687, test_f1: 0.6194
 epoch: 63, train_loss: 0.1588, test_loss: 2.5776, test_f1: 0.6098
 epoch: 64, train_loss: 0.1352, test_loss: 2.5968, test_f1: 0.6391
 epoch: 65, train_loss: 0.1471, test_loss: 2.4226, test_f1: 0.6337
 epoch: 66, train_loss: 0.1585, test_loss: 2.2034, test_f1: 0.6395
 epoch: 67, train_loss: 0.1362, test_loss: 2.4295, test_f1: 0.6623
 epoch: 68, train_loss: 0.1019, test_loss: 2.6052, test_f1: 0.6775
 epoch: 69, train_loss: 0.1630, test_loss: 2.1879, test_f1: 0.6690
 epoch: 70, train_loss: 0.1097, test_loss: 2.4097, test_f1: 0.6677
 epoch: 71, train_loss: 0.1377, test_loss: 2.7549, test_f1: 0.5989
 epoch: 72, train_loss: 0.1110, test_loss: 2.3152, test_f1: 0.6292
 epoch: 73, train_loss: 0.1293, test_loss: 2.3115, test_f1: 0.6755
 epoch: 74, train_loss: 0.1482, test_loss: 2.4718, test_f1: 0.6322
 epoch: 75, train_loss: 0.1224, test_loss: 2.4711, test_f1: 0.6343
 epoch: 76, train_loss: 0.1280, test_loss: 2.5315, test_f1: 0.6184
 epoch: 77, train_loss: 0.1152, test_loss: 2.5291, test_f1: 0.6654
 epoch: 78, train_loss: 0.1059, test_loss: 2.6246, test_f1: 0.6203
 epoch: 79, train_loss: 0.1084, test_loss: 2.4458, test_f1: 0.6468
 epoch: 80, train_loss: 0.1424, test_loss: 2.4388, test_f1: 0.6395
 epoch: 81, train_loss: 0.1180, test_loss: 2.4818, test_f1: 0.6596
 epoch: 82, train_loss: 0.1303, test_loss: 2.4978, test_f1: 0.6909
 epoch: 83, train_loss: 0.1005, test_loss: 2.9668, test_f1: 0.6528
 epoch: 84, train_loss: 0.1135, test_loss: 2.6658, test_f1: 0.6598
 epoch: 85, train_loss: 0.1051, test_loss: 2.5846, test_f1: 0.6591
 epoch: 86, train_loss: 0.1048, test_loss: 2.6269, test_f1: 0.6489
 epoch: 87, train_loss: 0.0995, test_loss: 2.8834, test_f1: 0.6203
 epoch: 88, train_loss: 0.1004, test_loss: 2.9235, test_f1: 0.6071
 epoch: 89, train_loss: 0.0926, test_loss: 2.7987, test_f1: 0.6338
 epoch: 90, train_loss: 0.0891, test_loss: 2.7427, test_f1: 0.6142
 epoch: 91, train_loss: 0.1105, test_loss: 2.7440, test_f1: 0.6584
 epoch: 92, train_loss: 0.1128, test_loss: 2.8337, test_f1: 0.6342
 epoch: 93, train_loss: 0.0928, test_loss: 2.6626, test_f1: 0.6891
 epoch: 94, train_loss: 0.1044, test_loss: 2.5654, test_f1: 0.6194
 epoch: 95, train_loss: 0.0873, test_loss: 3.0054, test_f1: 0.6056
 epoch: 96, train_loss: 0.1128, test_loss: 2.7654, test_f1: 0.6344
 epoch: 97, train_loss: 0.0804, test_loss: 2.5599, test_f1: 0.6500
 epoch: 98, train_loss: 0.1069, test_loss: 2.5634, test_f1: 0.6487
 epoch: 99, train_loss: 0.1043, test_loss: 2.8178, test_f1: 0.6073
##################ITERATION #8 ****************************************
 epoch: 0, train_loss: 1.2286, test_loss: 1.1344, test_f1: 0.5437
 epoch: 1, train_loss: 0.9388, test_loss: 1.1363, test_f1: 0.5954
 epoch: 2, train_loss: 0.8827, test_loss: 1.0470, test_f1: 0.6214
 epoch: 3, train_loss: 0.8384, test_loss: 1.0598, test_f1: 0.5933
 epoch: 4, train_loss: 0.7933, test_loss: 1.0129, test_f1: 0.6379
 epoch: 5, train_loss: 0.7391, test_loss: 1.0619, test_f1: 0.5950
 epoch: 6, train_loss: 0.7138, test_loss: 1.0127, test_f1: 0.6615
 epoch: 7, train_loss: 0.7052, test_loss: 0.9938, test_f1: 0.5719
 epoch: 8, train_loss: 0.6832, test_loss: 1.1173, test_f1: 0.5742
 epoch: 9, train_loss: 0.6606, test_loss: 1.0983, test_f1: 0.5777
 epoch: 10, train_loss: 0.7222, test_loss: 0.9572, test_f1: 0.6691
 epoch: 11, train_loss: 0.6331, test_loss: 1.1402, test_f1: 0.6213
 epoch: 12, train_loss: 0.6130, test_loss: 1.1196, test_f1: 0.6143
 epoch: 13, train_loss: 0.5944, test_loss: 1.0867, test_f1: 0.5821
 epoch: 14, train_loss: 0.5876, test_loss: 1.1377, test_f1: 0.6053
 epoch: 15, train_loss: 0.5507, test_loss: 1.1287, test_f1: 0.5729
 epoch: 16, train_loss: 0.5779, test_loss: 1.0810, test_f1: 0.5862
 epoch: 17, train_loss: 0.5360, test_loss: 1.1252, test_f1: 0.5801
 epoch: 18, train_loss: 0.5259, test_loss: 1.1584, test_f1: 0.5623
 epoch: 19, train_loss: 0.5152, test_loss: 1.1844, test_f1: 0.6139
 epoch: 20, train_loss: 0.5338, test_loss: 1.1017, test_f1: 0.6097
 epoch: 21, train_loss: 0.5072, test_loss: 1.1204, test_f1: 0.6336
 epoch: 22, train_loss: 0.4899, test_loss: 1.1529, test_f1: 0.5990
 epoch: 23, train_loss: 0.4833, test_loss: 1.2401, test_f1: 0.5810
 epoch: 24, train_loss: 0.4573, test_loss: 1.2408, test_f1: 0.6258
 epoch: 25, train_loss: 0.4455, test_loss: 1.1821, test_f1: 0.5924
 epoch: 26, train_loss: 0.4204, test_loss: 1.2847, test_f1: 0.5696
 epoch: 27, train_loss: 0.4449, test_loss: 1.4132, test_f1: 0.6108
 epoch: 28, train_loss: 0.4333, test_loss: 1.3126, test_f1: 0.6241
 epoch: 29, train_loss: 0.4114, test_loss: 1.4715, test_f1: 0.6376
 epoch: 30, train_loss: 0.3956, test_loss: 1.3726, test_f1: 0.6106
 epoch: 31, train_loss: 0.3974, test_loss: 1.4149, test_f1: 0.5847
 epoch: 32, train_loss: 0.3811, test_loss: 1.3714, test_f1: 0.5869
 epoch: 33, train_loss: 0.3843, test_loss: 1.2491, test_f1: 0.6755
 epoch: 34, train_loss: 0.3624, test_loss: 1.6112, test_f1: 0.6308
 epoch: 35, train_loss: 0.3855, test_loss: 1.7276, test_f1: 0.5736
 epoch: 36, train_loss: 0.3294, test_loss: 1.5184, test_f1: 0.6269
 epoch: 37, train_loss: 0.2907, test_loss: 1.6713, test_f1: 0.5845
 epoch: 38, train_loss: 0.3434, test_loss: 1.7864, test_f1: 0.5835
 epoch: 39, train_loss: 0.3050, test_loss: 1.5525, test_f1: 0.6278
 epoch: 40, train_loss: 0.3314, test_loss: 1.8054, test_f1: 0.6100
 epoch: 41, train_loss: 0.2764, test_loss: 1.6217, test_f1: 0.6050
 epoch: 42, train_loss: 0.3211, test_loss: 1.6379, test_f1: 0.6153
 epoch: 43, train_loss: 0.2753, test_loss: 1.6354, test_f1: 0.6122
 epoch: 44, train_loss: 0.3095, test_loss: 1.7942, test_f1: 0.5658
 epoch: 45, train_loss: 0.2716, test_loss: 1.7849, test_f1: 0.6013
 epoch: 46, train_loss: 0.2571, test_loss: 1.9884, test_f1: 0.5771
 epoch: 47, train_loss: 0.2986, test_loss: 1.7706, test_f1: 0.6203
 epoch: 48, train_loss: 0.2611, test_loss: 2.0637, test_f1: 0.6033
 epoch: 49, train_loss: 0.2695, test_loss: 1.8228, test_f1: 0.6375
 epoch: 50, train_loss: 0.2546, test_loss: 2.2317, test_f1: 0.5793
 epoch: 51, train_loss: 0.2096, test_loss: 1.9243, test_f1: 0.6134
 epoch: 52, train_loss: 0.1665, test_loss: 1.8866, test_f1: 0.6287
 epoch: 53, train_loss: 0.1614, test_loss: 2.1464, test_f1: 0.6395
 epoch: 54, train_loss: 0.1492, test_loss: 2.0996, test_f1: 0.6362
 epoch: 55, train_loss: 0.1683, test_loss: 2.1984, test_f1: 0.6212
 epoch: 56, train_loss: 0.1480, test_loss: 2.1495, test_f1: 0.6059
 epoch: 57, train_loss: 0.1456, test_loss: 2.3365, test_f1: 0.5923
 epoch: 58, train_loss: 0.1396, test_loss: 2.3309, test_f1: 0.5954
 epoch: 59, train_loss: 0.1519, test_loss: 2.3183, test_f1: 0.5619
 epoch: 60, train_loss: 0.1359, test_loss: 2.3511, test_f1: 0.6189
 epoch: 61, train_loss: 0.1592, test_loss: 2.4626, test_f1: 0.6078
 epoch: 62, train_loss: 0.1454, test_loss: 2.2825, test_f1: 0.6379
 epoch: 63, train_loss: 0.1179, test_loss: 2.2580, test_f1: 0.6228
 epoch: 64, train_loss: 0.1124, test_loss: 2.3510, test_f1: 0.6189
 epoch: 65, train_loss: 0.1277, test_loss: 2.1987, test_f1: 0.6270
 epoch: 66, train_loss: 0.1211, test_loss: 2.5211, test_f1: 0.5809
 epoch: 67, train_loss: 0.1399, test_loss: 2.1425, test_f1: 0.6137
 epoch: 68, train_loss: 0.1138, test_loss: 2.3759, test_f1: 0.6150
 epoch: 69, train_loss: 0.1419, test_loss: 2.2263, test_f1: 0.6157
 epoch: 70, train_loss: 0.1518, test_loss: 2.2585, test_f1: 0.6389
 epoch: 71, train_loss: 0.1287, test_loss: 2.1546, test_f1: 0.6694
 epoch: 72, train_loss: 0.1258, test_loss: 2.6108, test_f1: 0.6069
 epoch: 73, train_loss: 0.1265, test_loss: 2.3036, test_f1: 0.6409
 epoch: 74, train_loss: 0.1212, test_loss: 2.5521, test_f1: 0.6113
 epoch: 75, train_loss: 0.1218, test_loss: 2.7911, test_f1: 0.6179
 epoch: 76, train_loss: 0.1296, test_loss: 2.4764, test_f1: 0.6451
 epoch: 77, train_loss: 0.1394, test_loss: 2.3444, test_f1: 0.6508
 epoch: 78, train_loss: 0.1209, test_loss: 2.3497, test_f1: 0.6331
 epoch: 79, train_loss: 0.1116, test_loss: 2.4980, test_f1: 0.6250
 epoch: 80, train_loss: 0.1144, test_loss: 2.5047, test_f1: 0.6109
 epoch: 81, train_loss: 0.1429, test_loss: 2.4836, test_f1: 0.6172
 epoch: 82, train_loss: 0.1110, test_loss: 2.4710, test_f1: 0.6172
 epoch: 83, train_loss: 0.0797, test_loss: 2.6056, test_f1: 0.5721
 epoch: 84, train_loss: 0.0944, test_loss: 2.5035, test_f1: 0.6254
 epoch: 85, train_loss: 0.1336, test_loss: 2.6154, test_f1: 0.5697
 epoch: 86, train_loss: 0.0890, test_loss: 2.6938, test_f1: 0.5710
 epoch: 87, train_loss: 0.0920, test_loss: 2.8365, test_f1: 0.5800
 epoch: 88, train_loss: 0.1047, test_loss: 2.8263, test_f1: 0.5821
 epoch: 89, train_loss: 0.1158, test_loss: 2.5623, test_f1: 0.5947
 epoch: 90, train_loss: 0.1041, test_loss: 2.8391, test_f1: 0.5795
 epoch: 91, train_loss: 0.1049, test_loss: 2.8638, test_f1: 0.6007
 epoch: 92, train_loss: 0.0961, test_loss: 2.6091, test_f1: 0.6093
 epoch: 93, train_loss: 0.0869, test_loss: 2.7542, test_f1: 0.5781
 epoch: 94, train_loss: 0.0917, test_loss: 2.6304, test_f1: 0.6032
 epoch: 95, train_loss: 0.0971, test_loss: 2.6349, test_f1: 0.6071
 epoch: 96, train_loss: 0.1076, test_loss: 2.6641, test_f1: 0.5832
 epoch: 97, train_loss: 0.0812, test_loss: 2.9631, test_f1: 0.5970
 epoch: 98, train_loss: 0.1144, test_loss: 2.9372, test_f1: 0.5786
 epoch: 99, train_loss: 0.1250, test_loss: 3.0909, test_f1: 0.6035
##################ITERATION #9 ****************************************
 epoch: 0, train_loss: 1.2335, test_loss: 1.2911, test_f1: 0.3595
 epoch: 1, train_loss: 0.9485, test_loss: 1.0494, test_f1: 0.5288
 epoch: 2, train_loss: 0.8707, test_loss: 1.1139, test_f1: 0.5469
 epoch: 3, train_loss: 0.8189, test_loss: 1.0177, test_f1: 0.5504
 epoch: 4, train_loss: 0.7929, test_loss: 1.0414, test_f1: 0.5743
 epoch: 5, train_loss: 0.7785, test_loss: 1.0415, test_f1: 0.5972
 epoch: 6, train_loss: 0.7552, test_loss: 0.9554, test_f1: 0.6450
 epoch: 7, train_loss: 0.7294, test_loss: 1.2118, test_f1: 0.5440
 epoch: 8, train_loss: 0.7118, test_loss: 1.0051, test_f1: 0.5890
 epoch: 9, train_loss: 0.6771, test_loss: 1.0033, test_f1: 0.5497
 epoch: 10, train_loss: 0.6747, test_loss: 1.0988, test_f1: 0.5114
 epoch: 11, train_loss: 0.6720, test_loss: 1.1004, test_f1: 0.5874
 epoch: 12, train_loss: 0.6568, test_loss: 1.0520, test_f1: 0.6195
 epoch: 13, train_loss: 0.6186, test_loss: 1.0565, test_f1: 0.5947
 epoch: 14, train_loss: 0.6213, test_loss: 0.9336, test_f1: 0.6296
 epoch: 15, train_loss: 0.6017, test_loss: 0.9942, test_f1: 0.6512
 epoch: 16, train_loss: 0.5742, test_loss: 1.0125, test_f1: 0.6503
 epoch: 17, train_loss: 0.5988, test_loss: 1.0142, test_f1: 0.6052
 epoch: 18, train_loss: 0.5863, test_loss: 1.2581, test_f1: 0.5191
 epoch: 19, train_loss: 0.5589, test_loss: 1.0585, test_f1: 0.6249
 epoch: 20, train_loss: 0.5472, test_loss: 1.0496, test_f1: 0.6022
 epoch: 21, train_loss: 0.5114, test_loss: 0.9802, test_f1: 0.6679
 epoch: 22, train_loss: 0.5461, test_loss: 1.0508, test_f1: 0.5969
 epoch: 23, train_loss: 0.5333, test_loss: 1.0933, test_f1: 0.5695
 epoch: 24, train_loss: 0.4975, test_loss: 1.1189, test_f1: 0.6215
 epoch: 25, train_loss: 0.4726, test_loss: 1.0956, test_f1: 0.5830
 epoch: 26, train_loss: 0.4643, test_loss: 1.1307, test_f1: 0.6647
 epoch: 27, train_loss: 0.4738, test_loss: 1.1564, test_f1: 0.5434
 epoch: 28, train_loss: 0.4330, test_loss: 1.1545, test_f1: 0.5913
 epoch: 29, train_loss: 0.4777, test_loss: 1.0430, test_f1: 0.6065
 epoch: 30, train_loss: 0.4125, test_loss: 1.1536, test_f1: 0.6243
 epoch: 31, train_loss: 0.4227, test_loss: 1.3645, test_f1: 0.5842
 epoch: 32, train_loss: 0.4289, test_loss: 1.2842, test_f1: 0.6009
 epoch: 33, train_loss: 0.4151, test_loss: 1.2716, test_f1: 0.6127
 epoch: 34, train_loss: 0.3883, test_loss: 1.1580, test_f1: 0.6323
 epoch: 35, train_loss: 0.3910, test_loss: 1.3763, test_f1: 0.6084
 epoch: 36, train_loss: 0.3771, test_loss: 1.4454, test_f1: 0.5879
 epoch: 37, train_loss: 0.3761, test_loss: 1.3457, test_f1: 0.6262
 epoch: 38, train_loss: 0.3836, test_loss: 1.1886, test_f1: 0.6436
 epoch: 39, train_loss: 0.3636, test_loss: 1.2353, test_f1: 0.6475
 epoch: 40, train_loss: 0.3531, test_loss: 1.4932, test_f1: 0.6227
 epoch: 41, train_loss: 0.3959, test_loss: 1.3250, test_f1: 0.5994
 epoch: 42, train_loss: 0.3542, test_loss: 1.4058, test_f1: 0.5992
 epoch: 43, train_loss: 0.3146, test_loss: 1.3760, test_f1: 0.6320
 epoch: 44, train_loss: 0.2959, test_loss: 1.5694, test_f1: 0.6153
 epoch: 45, train_loss: 0.2771, test_loss: 1.6090, test_f1: 0.6194
 epoch: 46, train_loss: 0.2722, test_loss: 1.4898, test_f1: 0.6141
 epoch: 47, train_loss: 0.3374, test_loss: 1.4944, test_f1: 0.5794
 epoch: 48, train_loss: 0.2981, test_loss: 1.5388, test_f1: 0.6168
 epoch: 49, train_loss: 0.2742, test_loss: 1.7232, test_f1: 0.5871
 epoch: 50, train_loss: 0.2713, test_loss: 1.7833, test_f1: 0.5986
 epoch: 51, train_loss: 0.2574, test_loss: 1.8633, test_f1: 0.6097
 epoch: 52, train_loss: 0.1689, test_loss: 1.8401, test_f1: 0.6271
 epoch: 53, train_loss: 0.1931, test_loss: 2.0966, test_f1: 0.5994
 epoch: 54, train_loss: 0.1769, test_loss: 2.1535, test_f1: 0.6344
 epoch: 55, train_loss: 0.2567, test_loss: 1.7793, test_f1: 0.6155
 epoch: 56, train_loss: 0.1934, test_loss: 2.1703, test_f1: 0.6114
 epoch: 57, train_loss: 0.1603, test_loss: 2.0953, test_f1: 0.6296
 epoch: 58, train_loss: 0.1594, test_loss: 2.0573, test_f1: 0.6030
 epoch: 59, train_loss: 0.1472, test_loss: 2.2348, test_f1: 0.5984
 epoch: 60, train_loss: 0.1546, test_loss: 2.0946, test_f1: 0.6284
 epoch: 61, train_loss: 0.1742, test_loss: 1.9961, test_f1: 0.6170
 epoch: 62, train_loss: 0.1774, test_loss: 2.0349, test_f1: 0.6106
 epoch: 63, train_loss: 0.1476, test_loss: 2.2125, test_f1: 0.6103
 epoch: 64, train_loss: 0.1548, test_loss: 2.1759, test_f1: 0.6176
 epoch: 65, train_loss: 0.1248, test_loss: 2.1907, test_f1: 0.6119
 epoch: 66, train_loss: 0.1760, test_loss: 2.3400, test_f1: 0.5953
 epoch: 67, train_loss: 0.1602, test_loss: 2.3004, test_f1: 0.6040
 epoch: 68, train_loss: 0.1367, test_loss: 2.3757, test_f1: 0.5857
 epoch: 69, train_loss: 0.1338, test_loss: 2.1862, test_f1: 0.6538
 epoch: 70, train_loss: 0.1356, test_loss: 2.6611, test_f1: 0.6091
 epoch: 71, train_loss: 0.1284, test_loss: 2.5741, test_f1: 0.5949
 epoch: 72, train_loss: 0.1323, test_loss: 2.4428, test_f1: 0.6376
 epoch: 73, train_loss: 0.1512, test_loss: 2.2465, test_f1: 0.6104
 epoch: 74, train_loss: 0.1374, test_loss: 2.2237, test_f1: 0.6269
 epoch: 75, train_loss: 0.1134, test_loss: 2.3752, test_f1: 0.6084
 epoch: 76, train_loss: 0.1251, test_loss: 2.3422, test_f1: 0.6146
 epoch: 77, train_loss: 0.1415, test_loss: 2.2724, test_f1: 0.6175
 epoch: 78, train_loss: 0.1333, test_loss: 2.4830, test_f1: 0.6258
 epoch: 79, train_loss: 0.1391, test_loss: 2.2752, test_f1: 0.6354
 epoch: 80, train_loss: 0.1328, test_loss: 2.2388, test_f1: 0.6122
 epoch: 81, train_loss: 0.1653, test_loss: 2.2934, test_f1: 0.5913
 epoch: 82, train_loss: 0.1257, test_loss: 2.2537, test_f1: 0.6116
 epoch: 83, train_loss: 0.1145, test_loss: 2.6178, test_f1: 0.6055
 epoch: 84, train_loss: 0.1283, test_loss: 2.2903, test_f1: 0.6123
 epoch: 85, train_loss: 0.1164, test_loss: 2.7047, test_f1: 0.6146
 epoch: 86, train_loss: 0.1483, test_loss: 2.4132, test_f1: 0.6031
 epoch: 87, train_loss: 0.1274, test_loss: 2.3481, test_f1: 0.6093
 epoch: 88, train_loss: 0.1197, test_loss: 2.5121, test_f1: 0.5927
 epoch: 89, train_loss: 0.1393, test_loss: 2.7411, test_f1: 0.5854
 epoch: 90, train_loss: 0.1014, test_loss: 2.7307, test_f1: 0.6146
 epoch: 91, train_loss: 0.1258, test_loss: 2.7335, test_f1: 0.5856
 epoch: 92, train_loss: 0.1378, test_loss: 2.4145, test_f1: 0.6092
 epoch: 93, train_loss: 0.1043, test_loss: 2.6293, test_f1: 0.5930
 epoch: 94, train_loss: 0.1089, test_loss: 2.3930, test_f1: 0.6264
 epoch: 95, train_loss: 0.1015, test_loss: 2.4582, test_f1: 0.6477
 epoch: 96, train_loss: 0.1141, test_loss: 2.7488, test_f1: 0.5919
 epoch: 97, train_loss: 0.1047, test_loss: 2.5799, test_f1: 0.6002
 epoch: 98, train_loss: 0.1051, test_loss: 2.4338, test_f1: 0.6091
 epoch: 99, train_loss: 0.1142, test_loss: 2.6392, test_f1: 0.5925

Training completed in 602.38 seconds
Best F1: 0.7046 at epoch 40
Mean F1 across iterations: 0.6827  0.0124
========================FINAL RESULTS================================
FEGIN weighted F1: 0.7046  0.0124
python main.py --data ltspice_demos --representation component_pin --model FEGIN --layers 3 --hiddens 128 --batch_size 32 --lr 0.001 --emb_size 128 --epochs 100 --save_appendix component_pin_L3_H128_BS32_LR0.001_E128 --no_val
-----



STDERR:
  File "main.py", line 370, in <module>
    main()
  File "main.py", line 254, in main
    dataset = dataset_class(
  File "/home/philip/projects/ltspice_examples_code_repo/Circuit-Completion-Using-GNNs/component_classification_with_link_prediction_head/evaluation/FEGIN/kernel/circuit_datasets.py", line 15, in __init__
    self.data, self.slices = torch.load(self.processed_paths[0])
  File "/home/philip/.local/lib/python3.8/site-packages/torch/serialization.py", line 1040, in load
    warnings.warn(
  File "/usr/lib/python3.8/warnings.py", line 109, in _showwarnmsg
    sw(msg.message, msg.category, msg.filename, msg.lineno,
  File "main.py", line 47, in warn_with_traceback
    traceback.print_stack(file=log)
/home/philip/projects/ltspice_examples_code_repo/Circuit-Completion-Using-GNNs/component_classification_with_link_prediction_head/evaluation/FEGIN/kernel/circuit_datasets.py:15: FutureWarning: You are using `torch.load` with `weights_only=False` (the current default value), which uses the default pickle module implicitly. It is possible to construct malicious pickle data which will execute arbitrary code during unpickling (See https://github.com/pytorch/pytorch/blob/main/SECURITY.md#untrusted-models for more details). In a future release, the default value for `weights_only` will be flipped to `True`. This limits the functions that could be executed during unpickling. Arbitrary objects will no longer be allowed to be loaded via this mode unless they are explicitly allowlisted by the user via `torch.serialization.add_safe_globals`. We recommend you start setting `weights_only=True` for any use case where you don't have full control of the loaded file. Please open an issue on GitHub for any issues related to this experimental feature.
  self.data, self.slices = torch.load(self.processed_paths[0])
