STDOUT:
Results will be saved in /home/philip/projects/ltspice_examples_code_repo/Circuit-Completion-Using-GNNs/component_classification_with_link_prediction_head/evaluation/FEGIN/results/model_FEGIN_dataset_ltspice_examples
Command line input: python main.py --data ltspice_examples --representation component_net --model FEGIN --layers 5 --hiddens 64 --batch_size 32 --lr 0.0001 --emb_size 250 --epochs 100 --save_appendix component_net_L5_H64_BS32_LR0.0001_E250 --no_val
 is saved.
-----
ltspice_examples - FEGIN
Using 5 layers, 64 hidden units, h = 2
Loading component_net representation dataset
ENTERED
Training FEGIN on component_net representation
Train: 3558, Test: 846
##################ITERATION #0 ****************************************
 epoch: 0, train_loss: 1.3793, test_loss: 1.3255, test_f1: 0.2954
 epoch: 1, train_loss: 1.2987, test_loss: 1.2612, test_f1: 0.2656
 epoch: 2, train_loss: 1.2545, test_loss: 1.2222, test_f1: 0.3096
 epoch: 3, train_loss: 1.2192, test_loss: 1.1842, test_f1: 0.3373
 epoch: 4, train_loss: 1.1881, test_loss: 1.1480, test_f1: 0.3442
 epoch: 5, train_loss: 1.1610, test_loss: 1.1226, test_f1: 0.3839
 epoch: 6, train_loss: 1.1375, test_loss: 1.0931, test_f1: 0.4217
 epoch: 7, train_loss: 1.1151, test_loss: 1.0628, test_f1: 0.4903
 epoch: 8, train_loss: 1.0898, test_loss: 1.0308, test_f1: 0.5076
 epoch: 9, train_loss: 1.0632, test_loss: 1.0114, test_f1: 0.5030
 epoch: 10, train_loss: 1.0412, test_loss: 1.0062, test_f1: 0.4875
 epoch: 11, train_loss: 1.0170, test_loss: 0.9798, test_f1: 0.5050
 epoch: 12, train_loss: 1.0031, test_loss: 0.9615, test_f1: 0.4993
 epoch: 13, train_loss: 0.9839, test_loss: 0.9581, test_f1: 0.4893
 epoch: 14, train_loss: 0.9784, test_loss: 0.9416, test_f1: 0.5022
 epoch: 15, train_loss: 0.9548, test_loss: 0.9713, test_f1: 0.5111
 epoch: 16, train_loss: 0.9412, test_loss: 0.9494, test_f1: 0.5003
 epoch: 17, train_loss: 0.9387, test_loss: 0.9397, test_f1: 0.5016
 epoch: 18, train_loss: 0.9254, test_loss: 0.9114, test_f1: 0.5054
 epoch: 19, train_loss: 0.9144, test_loss: 0.9290, test_f1: 0.5125
 epoch: 20, train_loss: 0.9249, test_loss: 0.9299, test_f1: 0.5268
 epoch: 21, train_loss: 0.9210, test_loss: 0.9397, test_f1: 0.5126
 epoch: 22, train_loss: 0.9041, test_loss: 0.9266, test_f1: 0.5183
 epoch: 23, train_loss: 0.8905, test_loss: 0.9273, test_f1: 0.5102
 epoch: 24, train_loss: 0.9013, test_loss: 0.9271, test_f1: 0.5160
 epoch: 25, train_loss: 0.8897, test_loss: 0.9361, test_f1: 0.5348
 epoch: 26, train_loss: 0.8856, test_loss: 0.9480, test_f1: 0.5062
 epoch: 27, train_loss: 0.8904, test_loss: 0.9521, test_f1: 0.5047
 epoch: 28, train_loss: 0.8728, test_loss: 0.9400, test_f1: 0.5201
 epoch: 29, train_loss: 0.8616, test_loss: 0.9376, test_f1: 0.5260
 epoch: 30, train_loss: 0.8694, test_loss: 0.9216, test_f1: 0.5339
 epoch: 31, train_loss: 0.8671, test_loss: 0.9157, test_f1: 0.5429
 epoch: 32, train_loss: 0.8653, test_loss: 0.9501, test_f1: 0.5115
 epoch: 33, train_loss: 0.8457, test_loss: 0.9654, test_f1: 0.5169
 epoch: 34, train_loss: 0.8511, test_loss: 0.9271, test_f1: 0.5322
 epoch: 35, train_loss: 0.8465, test_loss: 0.9413, test_f1: 0.5291
 epoch: 36, train_loss: 0.8543, test_loss: 0.9662, test_f1: 0.5253
 epoch: 37, train_loss: 0.8354, test_loss: 0.9542, test_f1: 0.5258
 epoch: 38, train_loss: 0.8420, test_loss: 0.9319, test_f1: 0.5621
 epoch: 39, train_loss: 0.8287, test_loss: 0.9709, test_f1: 0.5383
 epoch: 40, train_loss: 0.8340, test_loss: 0.9348, test_f1: 0.5359
 epoch: 41, train_loss: 0.8194, test_loss: 0.9683, test_f1: 0.5555
 epoch: 42, train_loss: 0.8300, test_loss: 0.9629, test_f1: 0.5281
 epoch: 43, train_loss: 0.8220, test_loss: 0.9460, test_f1: 0.5718
 epoch: 44, train_loss: 0.8143, test_loss: 0.9398, test_f1: 0.5641
 epoch: 45, train_loss: 0.8169, test_loss: 0.9334, test_f1: 0.5733
 epoch: 46, train_loss: 0.8167, test_loss: 0.9531, test_f1: 0.5493
 epoch: 47, train_loss: 0.8131, test_loss: 0.9602, test_f1: 0.5423
 epoch: 48, train_loss: 0.8013, test_loss: 0.9430, test_f1: 0.5636
 epoch: 49, train_loss: 0.7912, test_loss: 0.9664, test_f1: 0.5639
 epoch: 50, train_loss: 0.7984, test_loss: 0.9700, test_f1: 0.5511
 epoch: 51, train_loss: 0.8057, test_loss: 0.9517, test_f1: 0.5799
 epoch: 52, train_loss: 0.7787, test_loss: 0.9433, test_f1: 0.5697
 epoch: 53, train_loss: 0.7793, test_loss: 0.9451, test_f1: 0.5779
 epoch: 54, train_loss: 0.7815, test_loss: 0.9435, test_f1: 0.5965
 epoch: 55, train_loss: 0.7950, test_loss: 0.9530, test_f1: 0.5783
 epoch: 56, train_loss: 0.7842, test_loss: 0.9394, test_f1: 0.5864
 epoch: 57, train_loss: 0.7729, test_loss: 0.9408, test_f1: 0.5764
 epoch: 58, train_loss: 0.7777, test_loss: 0.9502, test_f1: 0.5794
 epoch: 59, train_loss: 0.7729, test_loss: 0.9317, test_f1: 0.5780
 epoch: 60, train_loss: 0.7816, test_loss: 0.9344, test_f1: 0.5831
 epoch: 61, train_loss: 0.7715, test_loss: 0.9403, test_f1: 0.5879
 epoch: 62, train_loss: 0.7857, test_loss: 0.9554, test_f1: 0.5915
 epoch: 63, train_loss: 0.7828, test_loss: 0.9558, test_f1: 0.5790
 epoch: 64, train_loss: 0.7769, test_loss: 0.9283, test_f1: 0.6067
 epoch: 65, train_loss: 0.7659, test_loss: 0.9485, test_f1: 0.5856
 epoch: 66, train_loss: 0.7602, test_loss: 0.9460, test_f1: 0.5754
 epoch: 67, train_loss: 0.7749, test_loss: 0.9578, test_f1: 0.5851
 epoch: 68, train_loss: 0.7668, test_loss: 0.9511, test_f1: 0.5766
 epoch: 69, train_loss: 0.7562, test_loss: 0.9333, test_f1: 0.5892
 epoch: 70, train_loss: 0.7712, test_loss: 0.9443, test_f1: 0.6000
 epoch: 71, train_loss: 0.7512, test_loss: 0.9640, test_f1: 0.5912
 epoch: 72, train_loss: 0.7653, test_loss: 0.9679, test_f1: 0.5944
 epoch: 73, train_loss: 0.7638, test_loss: 0.9316, test_f1: 0.5975
 epoch: 74, train_loss: 0.7551, test_loss: 0.9344, test_f1: 0.5976
 epoch: 75, train_loss: 0.7607, test_loss: 0.9614, test_f1: 0.6001
 epoch: 76, train_loss: 0.7546, test_loss: 0.9352, test_f1: 0.5939
 epoch: 77, train_loss: 0.7478, test_loss: 0.9422, test_f1: 0.5939
 epoch: 78, train_loss: 0.7409, test_loss: 0.9578, test_f1: 0.5960
 epoch: 79, train_loss: 0.7533, test_loss: 0.9477, test_f1: 0.6151
 epoch: 80, train_loss: 0.7484, test_loss: 0.9497, test_f1: 0.6225
 epoch: 81, train_loss: 0.7508, test_loss: 0.9388, test_f1: 0.6131
 epoch: 82, train_loss: 0.7517, test_loss: 0.9545, test_f1: 0.6130
 epoch: 83, train_loss: 0.7450, test_loss: 0.9391, test_f1: 0.6078
 epoch: 84, train_loss: 0.7412, test_loss: 0.9704, test_f1: 0.5944
 epoch: 85, train_loss: 0.7427, test_loss: 0.9451, test_f1: 0.5947
 epoch: 86, train_loss: 0.7343, test_loss: 0.9427, test_f1: 0.6048
 epoch: 87, train_loss: 0.7432, test_loss: 0.9499, test_f1: 0.6036
 epoch: 88, train_loss: 0.7423, test_loss: 0.9452, test_f1: 0.5890
 epoch: 89, train_loss: 0.7426, test_loss: 0.9729, test_f1: 0.5855
 epoch: 90, train_loss: 0.7392, test_loss: 0.9366, test_f1: 0.6036
 epoch: 91, train_loss: 0.7299, test_loss: 0.9479, test_f1: 0.5949
 epoch: 92, train_loss: 0.7255, test_loss: 0.9374, test_f1: 0.5966
 epoch: 93, train_loss: 0.7242, test_loss: 0.9591, test_f1: 0.6090
 epoch: 94, train_loss: 0.7303, test_loss: 0.9597, test_f1: 0.5917
 epoch: 95, train_loss: 0.7224, test_loss: 0.9520, test_f1: 0.5968
 epoch: 96, train_loss: 0.7287, test_loss: 0.9526, test_f1: 0.6181
 epoch: 97, train_loss: 0.7313, test_loss: 0.9467, test_f1: 0.6144
 epoch: 98, train_loss: 0.7242, test_loss: 0.9462, test_f1: 0.6014
 epoch: 99, train_loss: 0.7217, test_loss: 0.9457, test_f1: 0.6025
##################ITERATION #1 ****************************************
 epoch: 0, train_loss: 1.2834, test_loss: 1.2052, test_f1: 0.3361
 epoch: 1, train_loss: 1.2104, test_loss: 1.1645, test_f1: 0.3951
 epoch: 2, train_loss: 1.1737, test_loss: 1.1254, test_f1: 0.4200
 epoch: 3, train_loss: 1.1344, test_loss: 1.0724, test_f1: 0.4498
 epoch: 4, train_loss: 1.0920, test_loss: 1.0387, test_f1: 0.4407
 epoch: 5, train_loss: 1.0622, test_loss: 1.0077, test_f1: 0.4667
 epoch: 6, train_loss: 1.0282, test_loss: 0.9836, test_f1: 0.4659
 epoch: 7, train_loss: 1.0190, test_loss: 0.9671, test_f1: 0.4833
 epoch: 8, train_loss: 0.9945, test_loss: 0.9565, test_f1: 0.4730
 epoch: 9, train_loss: 0.9883, test_loss: 0.9363, test_f1: 0.5057
 epoch: 10, train_loss: 0.9657, test_loss: 0.9535, test_f1: 0.5015
 epoch: 11, train_loss: 0.9611, test_loss: 0.9385, test_f1: 0.5087
 epoch: 12, train_loss: 0.9554, test_loss: 0.9562, test_f1: 0.5190
 epoch: 13, train_loss: 0.9449, test_loss: 0.9507, test_f1: 0.5095
 epoch: 14, train_loss: 0.9468, test_loss: 0.9429, test_f1: 0.5243
 epoch: 15, train_loss: 0.9289, test_loss: 0.9223, test_f1: 0.5139
 epoch: 16, train_loss: 0.9298, test_loss: 0.9586, test_f1: 0.5171
 epoch: 17, train_loss: 0.9176, test_loss: 0.9295, test_f1: 0.5061
 epoch: 18, train_loss: 0.9021, test_loss: 0.9506, test_f1: 0.5329
 epoch: 19, train_loss: 0.9032, test_loss: 0.9203, test_f1: 0.5352
 epoch: 20, train_loss: 0.8958, test_loss: 0.9255, test_f1: 0.5259
 epoch: 21, train_loss: 0.8934, test_loss: 0.9220, test_f1: 0.5375
 epoch: 22, train_loss: 0.8963, test_loss: 0.9531, test_f1: 0.5039
 epoch: 23, train_loss: 0.8892, test_loss: 0.9428, test_f1: 0.5237
 epoch: 24, train_loss: 0.8850, test_loss: 0.9354, test_f1: 0.5440
 epoch: 25, train_loss: 0.8756, test_loss: 0.9329, test_f1: 0.5442
 epoch: 26, train_loss: 0.8731, test_loss: 0.9478, test_f1: 0.5336
 epoch: 27, train_loss: 0.8723, test_loss: 0.9416, test_f1: 0.5332
 epoch: 28, train_loss: 0.8618, test_loss: 0.9323, test_f1: 0.5451
 epoch: 29, train_loss: 0.8569, test_loss: 0.9380, test_f1: 0.5660
 epoch: 30, train_loss: 0.8579, test_loss: 0.9334, test_f1: 0.5612
 epoch: 31, train_loss: 0.8493, test_loss: 0.9199, test_f1: 0.5762
 epoch: 32, train_loss: 0.8405, test_loss: 0.9512, test_f1: 0.5552
 epoch: 33, train_loss: 0.8377, test_loss: 0.9514, test_f1: 0.5599
 epoch: 34, train_loss: 0.8353, test_loss: 0.9418, test_f1: 0.5524
 epoch: 35, train_loss: 0.8308, test_loss: 0.9126, test_f1: 0.5605
 epoch: 36, train_loss: 0.8282, test_loss: 0.9497, test_f1: 0.5638
 epoch: 37, train_loss: 0.8224, test_loss: 0.9557, test_f1: 0.5525
 epoch: 38, train_loss: 0.8262, test_loss: 0.9340, test_f1: 0.5671
 epoch: 39, train_loss: 0.8176, test_loss: 0.9333, test_f1: 0.5647
 epoch: 40, train_loss: 0.8107, test_loss: 0.9440, test_f1: 0.5696
 epoch: 41, train_loss: 0.8153, test_loss: 0.9492, test_f1: 0.5693
 epoch: 42, train_loss: 0.8028, test_loss: 0.9496, test_f1: 0.5621
 epoch: 43, train_loss: 0.8046, test_loss: 0.9283, test_f1: 0.5678
 epoch: 44, train_loss: 0.8159, test_loss: 0.9672, test_f1: 0.5377
 epoch: 45, train_loss: 0.8056, test_loss: 0.9266, test_f1: 0.5610
 epoch: 46, train_loss: 0.8005, test_loss: 0.9508, test_f1: 0.5699
 epoch: 47, train_loss: 0.7954, test_loss: 0.9443, test_f1: 0.5864
 epoch: 48, train_loss: 0.7905, test_loss: 0.9536, test_f1: 0.5706
 epoch: 49, train_loss: 0.7911, test_loss: 0.9551, test_f1: 0.5753
 epoch: 50, train_loss: 0.7902, test_loss: 0.9601, test_f1: 0.5780
 epoch: 51, train_loss: 0.7765, test_loss: 0.9580, test_f1: 0.5825
 epoch: 52, train_loss: 0.7725, test_loss: 0.9707, test_f1: 0.5778
 epoch: 53, train_loss: 0.7745, test_loss: 0.9514, test_f1: 0.5715
 epoch: 54, train_loss: 0.7796, test_loss: 0.9485, test_f1: 0.5755
 epoch: 55, train_loss: 0.7748, test_loss: 1.0000, test_f1: 0.5625
 epoch: 56, train_loss: 0.7560, test_loss: 0.9503, test_f1: 0.5825
 epoch: 57, train_loss: 0.7732, test_loss: 0.9609, test_f1: 0.5667
 epoch: 58, train_loss: 0.7601, test_loss: 0.9631, test_f1: 0.5547
 epoch: 59, train_loss: 0.7636, test_loss: 0.9589, test_f1: 0.5686
 epoch: 60, train_loss: 0.7606, test_loss: 0.9351, test_f1: 0.5843
 epoch: 61, train_loss: 0.7612, test_loss: 0.9674, test_f1: 0.5763
 epoch: 62, train_loss: 0.7610, test_loss: 0.9615, test_f1: 0.5636
 epoch: 63, train_loss: 0.7667, test_loss: 0.9514, test_f1: 0.5834
 epoch: 64, train_loss: 0.7542, test_loss: 0.9549, test_f1: 0.5792
 epoch: 65, train_loss: 0.7606, test_loss: 0.9534, test_f1: 0.5589
 epoch: 66, train_loss: 0.7514, test_loss: 0.9521, test_f1: 0.5815
 epoch: 67, train_loss: 0.7510, test_loss: 0.9685, test_f1: 0.5705
 epoch: 68, train_loss: 0.7477, test_loss: 0.9915, test_f1: 0.5602
 epoch: 69, train_loss: 0.7612, test_loss: 1.0180, test_f1: 0.5630
 epoch: 70, train_loss: 0.7458, test_loss: 0.9855, test_f1: 0.5803
 epoch: 71, train_loss: 0.7548, test_loss: 0.9542, test_f1: 0.5709
 epoch: 72, train_loss: 0.7431, test_loss: 0.9389, test_f1: 0.5841
 epoch: 73, train_loss: 0.7429, test_loss: 0.9534, test_f1: 0.5808
 epoch: 74, train_loss: 0.7471, test_loss: 0.9529, test_f1: 0.5657
 epoch: 75, train_loss: 0.7563, test_loss: 0.9594, test_f1: 0.5839
 epoch: 76, train_loss: 0.7380, test_loss: 0.9637, test_f1: 0.5662
 epoch: 77, train_loss: 0.7285, test_loss: 0.9824, test_f1: 0.5608
 epoch: 78, train_loss: 0.7345, test_loss: 1.0036, test_f1: 0.5604
 epoch: 79, train_loss: 0.7329, test_loss: 0.9684, test_f1: 0.5770
 epoch: 80, train_loss: 0.7360, test_loss: 0.9491, test_f1: 0.5823
 epoch: 81, train_loss: 0.7305, test_loss: 0.9816, test_f1: 0.5716
 epoch: 82, train_loss: 0.7342, test_loss: 0.9702, test_f1: 0.5683
 epoch: 83, train_loss: 0.7147, test_loss: 0.9546, test_f1: 0.5654
 epoch: 84, train_loss: 0.7409, test_loss: 0.9440, test_f1: 0.5752
 epoch: 85, train_loss: 0.7251, test_loss: 0.9877, test_f1: 0.5859
 epoch: 86, train_loss: 0.7362, test_loss: 0.9726, test_f1: 0.5825
 epoch: 87, train_loss: 0.7222, test_loss: 0.9736, test_f1: 0.5760
 epoch: 88, train_loss: 0.7259, test_loss: 0.9788, test_f1: 0.5824
 epoch: 89, train_loss: 0.7079, test_loss: 0.9792, test_f1: 0.5951
 epoch: 90, train_loss: 0.7252, test_loss: 0.9829, test_f1: 0.5880
 epoch: 91, train_loss: 0.7204, test_loss: 0.9493, test_f1: 0.5886
 epoch: 92, train_loss: 0.7226, test_loss: 0.9548, test_f1: 0.5958
 epoch: 93, train_loss: 0.7200, test_loss: 0.9784, test_f1: 0.5791
 epoch: 94, train_loss: 0.7096, test_loss: 0.9430, test_f1: 0.5917
 epoch: 95, train_loss: 0.7151, test_loss: 0.9488, test_f1: 0.5881
 epoch: 96, train_loss: 0.7107, test_loss: 0.9494, test_f1: 0.5993
 epoch: 97, train_loss: 0.7100, test_loss: 0.9745, test_f1: 0.5890
 epoch: 98, train_loss: 0.7165, test_loss: 0.9847, test_f1: 0.5780
 epoch: 99, train_loss: 0.7166, test_loss: 0.9807, test_f1: 0.5817
##################ITERATION #2 ****************************************
 epoch: 0, train_loss: 1.2609, test_loss: 1.1652, test_f1: 0.3658
 epoch: 1, train_loss: 1.1743, test_loss: 1.1093, test_f1: 0.4228
 epoch: 2, train_loss: 1.1336, test_loss: 1.0741, test_f1: 0.4408
 epoch: 3, train_loss: 1.0987, test_loss: 1.0272, test_f1: 0.4559
 epoch: 4, train_loss: 1.0658, test_loss: 1.0060, test_f1: 0.4498
 epoch: 5, train_loss: 1.0403, test_loss: 0.9982, test_f1: 0.4488
 epoch: 6, train_loss: 1.0084, test_loss: 0.9812, test_f1: 0.4451
 epoch: 7, train_loss: 1.0073, test_loss: 0.9711, test_f1: 0.4661
 epoch: 8, train_loss: 0.9951, test_loss: 0.9572, test_f1: 0.4668
 epoch: 9, train_loss: 0.9708, test_loss: 0.9486, test_f1: 0.4846
 epoch: 10, train_loss: 0.9647, test_loss: 0.9428, test_f1: 0.5030
 epoch: 11, train_loss: 0.9588, test_loss: 0.9308, test_f1: 0.5023
 epoch: 12, train_loss: 0.9560, test_loss: 0.9424, test_f1: 0.5070
 epoch: 13, train_loss: 0.9324, test_loss: 0.9393, test_f1: 0.5160
 epoch: 14, train_loss: 0.9279, test_loss: 0.9536, test_f1: 0.5174
 epoch: 15, train_loss: 0.9275, test_loss: 0.9386, test_f1: 0.5259
 epoch: 16, train_loss: 0.9141, test_loss: 0.9647, test_f1: 0.5306
 epoch: 17, train_loss: 0.9131, test_loss: 0.9400, test_f1: 0.5205
 epoch: 18, train_loss: 0.9103, test_loss: 0.9328, test_f1: 0.5293
 epoch: 19, train_loss: 0.8903, test_loss: 0.9204, test_f1: 0.5563
 epoch: 20, train_loss: 0.8969, test_loss: 0.9408, test_f1: 0.5346
 epoch: 21, train_loss: 0.8869, test_loss: 0.9308, test_f1: 0.5342
 epoch: 22, train_loss: 0.8879, test_loss: 0.9447, test_f1: 0.5368
 epoch: 23, train_loss: 0.8842, test_loss: 0.9234, test_f1: 0.5494
 epoch: 24, train_loss: 0.8874, test_loss: 0.9067, test_f1: 0.5473
 epoch: 25, train_loss: 0.8664, test_loss: 0.9339, test_f1: 0.5526
 epoch: 26, train_loss: 0.8685, test_loss: 0.9316, test_f1: 0.5842
 epoch: 27, train_loss: 0.8609, test_loss: 0.9163, test_f1: 0.5479
 epoch: 28, train_loss: 0.8646, test_loss: 0.9293, test_f1: 0.5561
 epoch: 29, train_loss: 0.8513, test_loss: 0.9526, test_f1: 0.5736
 epoch: 30, train_loss: 0.8541, test_loss: 0.9283, test_f1: 0.5828
 epoch: 31, train_loss: 0.8500, test_loss: 0.9295, test_f1: 0.5674
 epoch: 32, train_loss: 0.8417, test_loss: 0.8966, test_f1: 0.5734
 epoch: 33, train_loss: 0.8385, test_loss: 0.9199, test_f1: 0.5977
 epoch: 34, train_loss: 0.8307, test_loss: 0.9296, test_f1: 0.5916
 epoch: 35, train_loss: 0.8168, test_loss: 0.9150, test_f1: 0.5790
 epoch: 36, train_loss: 0.8270, test_loss: 0.9275, test_f1: 0.5703
 epoch: 37, train_loss: 0.8253, test_loss: 0.9230, test_f1: 0.6039
 epoch: 38, train_loss: 0.8166, test_loss: 0.9053, test_f1: 0.5850
 epoch: 39, train_loss: 0.8219, test_loss: 0.9082, test_f1: 0.5849
 epoch: 40, train_loss: 0.8067, test_loss: 0.9164, test_f1: 0.5800
 epoch: 41, train_loss: 0.8132, test_loss: 0.9122, test_f1: 0.5871
 epoch: 42, train_loss: 0.8051, test_loss: 0.9251, test_f1: 0.5918
 epoch: 43, train_loss: 0.7957, test_loss: 0.9153, test_f1: 0.5866
 epoch: 44, train_loss: 0.8022, test_loss: 0.9097, test_f1: 0.6022
 epoch: 45, train_loss: 0.8002, test_loss: 0.9296, test_f1: 0.5699
 epoch: 46, train_loss: 0.8079, test_loss: 0.8810, test_f1: 0.5894
 epoch: 47, train_loss: 0.7933, test_loss: 0.9142, test_f1: 0.6083
 epoch: 48, train_loss: 0.7935, test_loss: 0.9399, test_f1: 0.5968
 epoch: 49, train_loss: 0.7923, test_loss: 0.9326, test_f1: 0.5896
 epoch: 50, train_loss: 0.7768, test_loss: 0.9310, test_f1: 0.6075
 epoch: 51, train_loss: 0.7791, test_loss: 0.9209, test_f1: 0.5957
 epoch: 52, train_loss: 0.7750, test_loss: 0.9244, test_f1: 0.6221
 epoch: 53, train_loss: 0.7688, test_loss: 0.9385, test_f1: 0.6082
 epoch: 54, train_loss: 0.7726, test_loss: 0.9570, test_f1: 0.5986
 epoch: 55, train_loss: 0.7661, test_loss: 0.9378, test_f1: 0.6006
 epoch: 56, train_loss: 0.7680, test_loss: 0.9436, test_f1: 0.6201
 epoch: 57, train_loss: 0.7650, test_loss: 0.9478, test_f1: 0.5796
 epoch: 58, train_loss: 0.7666, test_loss: 0.9414, test_f1: 0.5964
 epoch: 59, train_loss: 0.7624, test_loss: 0.9147, test_f1: 0.6174
 epoch: 60, train_loss: 0.7557, test_loss: 0.9302, test_f1: 0.6181
 epoch: 61, train_loss: 0.7657, test_loss: 0.9392, test_f1: 0.5977
 epoch: 62, train_loss: 0.7548, test_loss: 0.9472, test_f1: 0.6109
 epoch: 63, train_loss: 0.7522, test_loss: 0.9116, test_f1: 0.5918
 epoch: 64, train_loss: 0.7418, test_loss: 0.9475, test_f1: 0.6023
 epoch: 65, train_loss: 0.7408, test_loss: 0.9329, test_f1: 0.6000
 epoch: 66, train_loss: 0.7408, test_loss: 0.9404, test_f1: 0.6032
 epoch: 67, train_loss: 0.7354, test_loss: 0.9478, test_f1: 0.6072
 epoch: 68, train_loss: 0.7355, test_loss: 0.9483, test_f1: 0.5851
 epoch: 69, train_loss: 0.7404, test_loss: 0.9395, test_f1: 0.6097
 epoch: 70, train_loss: 0.7446, test_loss: 0.9251, test_f1: 0.6114
 epoch: 71, train_loss: 0.7337, test_loss: 0.9492, test_f1: 0.6017
 epoch: 72, train_loss: 0.7322, test_loss: 0.9299, test_f1: 0.5950
 epoch: 73, train_loss: 0.7287, test_loss: 0.9157, test_f1: 0.5957
 epoch: 74, train_loss: 0.7450, test_loss: 0.9387, test_f1: 0.5962
 epoch: 75, train_loss: 0.7303, test_loss: 0.9225, test_f1: 0.5973
 epoch: 76, train_loss: 0.7278, test_loss: 0.9447, test_f1: 0.5852
 epoch: 77, train_loss: 0.7359, test_loss: 0.9436, test_f1: 0.5969
 epoch: 78, train_loss: 0.7351, test_loss: 0.9466, test_f1: 0.5870
 epoch: 79, train_loss: 0.7157, test_loss: 0.9325, test_f1: 0.5940
 epoch: 80, train_loss: 0.7338, test_loss: 0.9298, test_f1: 0.5990
 epoch: 81, train_loss: 0.7217, test_loss: 0.9409, test_f1: 0.5942
 epoch: 82, train_loss: 0.7187, test_loss: 0.9487, test_f1: 0.5931
 epoch: 83, train_loss: 0.7166, test_loss: 0.9347, test_f1: 0.6037
 epoch: 84, train_loss: 0.7169, test_loss: 0.9471, test_f1: 0.5959
 epoch: 85, train_loss: 0.7244, test_loss: 0.9089, test_f1: 0.6110
 epoch: 86, train_loss: 0.7178, test_loss: 0.9194, test_f1: 0.6010
 epoch: 87, train_loss: 0.7145, test_loss: 0.9313, test_f1: 0.6014
 epoch: 88, train_loss: 0.7049, test_loss: 0.9294, test_f1: 0.5891
 epoch: 89, train_loss: 0.7223, test_loss: 0.9590, test_f1: 0.5785
 epoch: 90, train_loss: 0.7083, test_loss: 0.9521, test_f1: 0.6049
 epoch: 91, train_loss: 0.7010, test_loss: 0.9488, test_f1: 0.6006
 epoch: 92, train_loss: 0.7086, test_loss: 0.9524, test_f1: 0.6017
 epoch: 93, train_loss: 0.7193, test_loss: 0.9435, test_f1: 0.5908
 epoch: 94, train_loss: 0.7167, test_loss: 0.9604, test_f1: 0.5929
 epoch: 95, train_loss: 0.7035, test_loss: 0.9699, test_f1: 0.5754
 epoch: 96, train_loss: 0.7114, test_loss: 0.9490, test_f1: 0.5703
 epoch: 97, train_loss: 0.6972, test_loss: 0.9542, test_f1: 0.5999
 epoch: 98, train_loss: 0.7075, test_loss: 0.9573, test_f1: 0.5994
 epoch: 99, train_loss: 0.6968, test_loss: 0.9633, test_f1: 0.5921
##################ITERATION #3 ****************************************
 epoch: 0, train_loss: 1.2658, test_loss: 1.1381, test_f1: 0.4420
 epoch: 1, train_loss: 1.1671, test_loss: 1.0811, test_f1: 0.4623
 epoch: 2, train_loss: 1.1243, test_loss: 1.0447, test_f1: 0.4618
 epoch: 3, train_loss: 1.0855, test_loss: 1.0156, test_f1: 0.4411
 epoch: 4, train_loss: 1.0646, test_loss: 0.9847, test_f1: 0.4659
 epoch: 5, train_loss: 1.0420, test_loss: 0.9883, test_f1: 0.4660
 epoch: 6, train_loss: 1.0183, test_loss: 0.9736, test_f1: 0.4832
 epoch: 7, train_loss: 1.0050, test_loss: 0.9539, test_f1: 0.4897
 epoch: 8, train_loss: 0.9928, test_loss: 0.9343, test_f1: 0.4920
 epoch: 9, train_loss: 0.9669, test_loss: 0.9394, test_f1: 0.4983
 epoch: 10, train_loss: 0.9667, test_loss: 0.9279, test_f1: 0.5279
 epoch: 11, train_loss: 0.9427, test_loss: 0.9112, test_f1: 0.5386
 epoch: 12, train_loss: 0.9319, test_loss: 0.9108, test_f1: 0.5277
 epoch: 13, train_loss: 0.9391, test_loss: 0.9332, test_f1: 0.5265
 epoch: 14, train_loss: 0.9302, test_loss: 0.9092, test_f1: 0.5237
 epoch: 15, train_loss: 0.9114, test_loss: 0.9151, test_f1: 0.5176
 epoch: 16, train_loss: 0.9203, test_loss: 0.9339, test_f1: 0.5135
 epoch: 17, train_loss: 0.9208, test_loss: 0.9576, test_f1: 0.5086
 epoch: 18, train_loss: 0.9157, test_loss: 0.9140, test_f1: 0.5096
 epoch: 19, train_loss: 0.9050, test_loss: 0.9493, test_f1: 0.5169
 epoch: 20, train_loss: 0.8952, test_loss: 0.9208, test_f1: 0.5063
 epoch: 21, train_loss: 0.8886, test_loss: 0.9449, test_f1: 0.5211
 epoch: 22, train_loss: 0.8983, test_loss: 0.9329, test_f1: 0.5053
 epoch: 23, train_loss: 0.8864, test_loss: 0.9223, test_f1: 0.5176
 epoch: 24, train_loss: 0.8724, test_loss: 0.9318, test_f1: 0.5402
 epoch: 25, train_loss: 0.8773, test_loss: 0.9293, test_f1: 0.5218
 epoch: 26, train_loss: 0.8721, test_loss: 0.9288, test_f1: 0.5355
 epoch: 27, train_loss: 0.8677, test_loss: 0.9489, test_f1: 0.5222
 epoch: 28, train_loss: 0.8595, test_loss: 0.9525, test_f1: 0.5296
 epoch: 29, train_loss: 0.8507, test_loss: 0.9363, test_f1: 0.5305
 epoch: 30, train_loss: 0.8432, test_loss: 0.8993, test_f1: 0.5486
 epoch: 31, train_loss: 0.8467, test_loss: 0.9292, test_f1: 0.5391
 epoch: 32, train_loss: 0.8511, test_loss: 0.9281, test_f1: 0.5436
 epoch: 33, train_loss: 0.8373, test_loss: 0.9328, test_f1: 0.5398
 epoch: 34, train_loss: 0.8334, test_loss: 0.9464, test_f1: 0.5345
 epoch: 35, train_loss: 0.8313, test_loss: 0.9342, test_f1: 0.5557
 epoch: 36, train_loss: 0.8461, test_loss: 0.9400, test_f1: 0.5571
 epoch: 37, train_loss: 0.8302, test_loss: 0.9465, test_f1: 0.5530
 epoch: 38, train_loss: 0.8342, test_loss: 0.9363, test_f1: 0.5710
 epoch: 39, train_loss: 0.8241, test_loss: 0.9394, test_f1: 0.5580
 epoch: 40, train_loss: 0.8166, test_loss: 0.9272, test_f1: 0.5445
 epoch: 41, train_loss: 0.8153, test_loss: 0.9473, test_f1: 0.5674
 epoch: 42, train_loss: 0.8066, test_loss: 0.9369, test_f1: 0.5460
 epoch: 43, train_loss: 0.8086, test_loss: 0.9662, test_f1: 0.5546
 epoch: 44, train_loss: 0.8230, test_loss: 0.9512, test_f1: 0.5630
 epoch: 45, train_loss: 0.8100, test_loss: 0.9391, test_f1: 0.5556
 epoch: 46, train_loss: 0.8062, test_loss: 0.9402, test_f1: 0.5537
 epoch: 47, train_loss: 0.7940, test_loss: 0.9436, test_f1: 0.5677
 epoch: 48, train_loss: 0.7894, test_loss: 0.9547, test_f1: 0.5481
 epoch: 49, train_loss: 0.7884, test_loss: 0.9627, test_f1: 0.5663
 epoch: 50, train_loss: 0.7983, test_loss: 0.9463, test_f1: 0.5663
 epoch: 51, train_loss: 0.7831, test_loss: 0.9628, test_f1: 0.5652
 epoch: 52, train_loss: 0.7739, test_loss: 0.9650, test_f1: 0.5564
 epoch: 53, train_loss: 0.7777, test_loss: 0.9501, test_f1: 0.5556
 epoch: 54, train_loss: 0.7743, test_loss: 0.9558, test_f1: 0.5512
 epoch: 55, train_loss: 0.7741, test_loss: 0.9538, test_f1: 0.5523
 epoch: 56, train_loss: 0.7685, test_loss: 0.9579, test_f1: 0.5418
 epoch: 57, train_loss: 0.7762, test_loss: 0.9553, test_f1: 0.5697
 epoch: 58, train_loss: 0.7713, test_loss: 0.9712, test_f1: 0.5415
 epoch: 59, train_loss: 0.7622, test_loss: 0.9565, test_f1: 0.5574
 epoch: 60, train_loss: 0.7659, test_loss: 0.9698, test_f1: 0.5540
 epoch: 61, train_loss: 0.7618, test_loss: 0.9576, test_f1: 0.5518
 epoch: 62, train_loss: 0.7549, test_loss: 0.9731, test_f1: 0.5647
 epoch: 63, train_loss: 0.7596, test_loss: 0.9424, test_f1: 0.5711
 epoch: 64, train_loss: 0.7700, test_loss: 0.9875, test_f1: 0.5581
 epoch: 65, train_loss: 0.7589, test_loss: 0.9644, test_f1: 0.5586
 epoch: 66, train_loss: 0.7561, test_loss: 0.9731, test_f1: 0.5560
 epoch: 67, train_loss: 0.7589, test_loss: 0.9440, test_f1: 0.5836
 epoch: 68, train_loss: 0.7534, test_loss: 0.9654, test_f1: 0.5608
 epoch: 69, train_loss: 0.7518, test_loss: 0.9650, test_f1: 0.5535
 epoch: 70, train_loss: 0.7519, test_loss: 0.9629, test_f1: 0.5544
 epoch: 71, train_loss: 0.7533, test_loss: 0.9722, test_f1: 0.5642
 epoch: 72, train_loss: 0.7587, test_loss: 0.9832, test_f1: 0.5575
 epoch: 73, train_loss: 0.7448, test_loss: 0.9840, test_f1: 0.5614
 epoch: 74, train_loss: 0.7379, test_loss: 0.9910, test_f1: 0.5637
 epoch: 75, train_loss: 0.7388, test_loss: 0.9921, test_f1: 0.5800
 epoch: 76, train_loss: 0.7397, test_loss: 0.9855, test_f1: 0.5653
 epoch: 77, train_loss: 0.7335, test_loss: 0.9676, test_f1: 0.5787
 epoch: 78, train_loss: 0.7324, test_loss: 0.9657, test_f1: 0.5620
 epoch: 79, train_loss: 0.7420, test_loss: 0.9767, test_f1: 0.5530
 epoch: 80, train_loss: 0.7338, test_loss: 0.9756, test_f1: 0.5588
 epoch: 81, train_loss: 0.7293, test_loss: 0.9937, test_f1: 0.5813
 epoch: 82, train_loss: 0.7282, test_loss: 0.9881, test_f1: 0.5523
 epoch: 83, train_loss: 0.7281, test_loss: 0.9927, test_f1: 0.5714
 epoch: 84, train_loss: 0.7365, test_loss: 0.9848, test_f1: 0.5691
 epoch: 85, train_loss: 0.7233, test_loss: 0.9994, test_f1: 0.5609
 epoch: 86, train_loss: 0.7109, test_loss: 0.9921, test_f1: 0.5607
 epoch: 87, train_loss: 0.7231, test_loss: 0.9970, test_f1: 0.5666
 epoch: 88, train_loss: 0.7280, test_loss: 1.0203, test_f1: 0.5629
 epoch: 89, train_loss: 0.7336, test_loss: 1.0052, test_f1: 0.5592
 epoch: 90, train_loss: 0.7157, test_loss: 1.0320, test_f1: 0.5631
 epoch: 91, train_loss: 0.7218, test_loss: 1.0020, test_f1: 0.5568
 epoch: 92, train_loss: 0.7197, test_loss: 1.0049, test_f1: 0.5805
 epoch: 93, train_loss: 0.7138, test_loss: 0.9890, test_f1: 0.5662
 epoch: 94, train_loss: 0.7043, test_loss: 0.9999, test_f1: 0.5818
 epoch: 95, train_loss: 0.7115, test_loss: 1.0036, test_f1: 0.5898
 epoch: 96, train_loss: 0.7064, test_loss: 1.0094, test_f1: 0.5882
 epoch: 97, train_loss: 0.7081, test_loss: 1.0245, test_f1: 0.5612
 epoch: 98, train_loss: 0.7199, test_loss: 0.9927, test_f1: 0.5812
 epoch: 99, train_loss: 0.7100, test_loss: 1.0109, test_f1: 0.5806
##################ITERATION #4 ****************************************
 epoch: 0, train_loss: 1.2711, test_loss: 1.1308, test_f1: 0.4024
 epoch: 1, train_loss: 1.1644, test_loss: 1.0947, test_f1: 0.4366
 epoch: 2, train_loss: 1.1323, test_loss: 1.0603, test_f1: 0.4333
 epoch: 3, train_loss: 1.0937, test_loss: 1.0273, test_f1: 0.4692
 epoch: 4, train_loss: 1.0721, test_loss: 1.0059, test_f1: 0.4661
 epoch: 5, train_loss: 1.0545, test_loss: 1.0147, test_f1: 0.4504
 epoch: 6, train_loss: 1.0331, test_loss: 0.9956, test_f1: 0.4980
 epoch: 7, train_loss: 1.0227, test_loss: 0.9757, test_f1: 0.4629
 epoch: 8, train_loss: 1.0110, test_loss: 0.9661, test_f1: 0.4917
 epoch: 9, train_loss: 1.0025, test_loss: 0.9457, test_f1: 0.4955
 epoch: 10, train_loss: 0.9895, test_loss: 0.9425, test_f1: 0.5214
 epoch: 11, train_loss: 0.9741, test_loss: 0.9256, test_f1: 0.5167
 epoch: 12, train_loss: 0.9665, test_loss: 0.9174, test_f1: 0.4995
 epoch: 13, train_loss: 0.9589, test_loss: 0.9081, test_f1: 0.5318
 epoch: 14, train_loss: 0.9563, test_loss: 0.9123, test_f1: 0.5335
 epoch: 15, train_loss: 0.9357, test_loss: 0.8980, test_f1: 0.5440
 epoch: 16, train_loss: 0.9302, test_loss: 0.9110, test_f1: 0.5150
 epoch: 17, train_loss: 0.9221, test_loss: 0.8874, test_f1: 0.5349
 epoch: 18, train_loss: 0.9266, test_loss: 0.8805, test_f1: 0.5445
 epoch: 19, train_loss: 0.9130, test_loss: 0.8890, test_f1: 0.5160
 epoch: 20, train_loss: 0.9129, test_loss: 0.8839, test_f1: 0.5503
 epoch: 21, train_loss: 0.9003, test_loss: 0.8828, test_f1: 0.5426
 epoch: 22, train_loss: 0.8970, test_loss: 0.8815, test_f1: 0.5345
 epoch: 23, train_loss: 0.8926, test_loss: 0.8705, test_f1: 0.5529
 epoch: 24, train_loss: 0.8936, test_loss: 0.8841, test_f1: 0.5446
 epoch: 25, train_loss: 0.8900, test_loss: 0.8865, test_f1: 0.5512
 epoch: 26, train_loss: 0.8886, test_loss: 0.8876, test_f1: 0.5591
 epoch: 27, train_loss: 0.8809, test_loss: 0.8705, test_f1: 0.5479
 epoch: 28, train_loss: 0.8810, test_loss: 0.8723, test_f1: 0.5504
 epoch: 29, train_loss: 0.8784, test_loss: 0.8556, test_f1: 0.5601
 epoch: 30, train_loss: 0.8722, test_loss: 0.9001, test_f1: 0.5493
 epoch: 31, train_loss: 0.8644, test_loss: 0.8674, test_f1: 0.5679
 epoch: 32, train_loss: 0.8685, test_loss: 0.8661, test_f1: 0.5618
 epoch: 33, train_loss: 0.8576, test_loss: 0.8629, test_f1: 0.5655
 epoch: 34, train_loss: 0.8644, test_loss: 0.8673, test_f1: 0.5426
 epoch: 35, train_loss: 0.8579, test_loss: 0.8569, test_f1: 0.5666
 epoch: 36, train_loss: 0.8514, test_loss: 0.8892, test_f1: 0.5668
 epoch: 37, train_loss: 0.8597, test_loss: 0.8789, test_f1: 0.5736
 epoch: 38, train_loss: 0.8362, test_loss: 0.8628, test_f1: 0.5544
 epoch: 39, train_loss: 0.8469, test_loss: 0.8611, test_f1: 0.5621
 epoch: 40, train_loss: 0.8484, test_loss: 0.8889, test_f1: 0.5375
 epoch: 41, train_loss: 0.8339, test_loss: 0.8837, test_f1: 0.5488
 epoch: 42, train_loss: 0.8293, test_loss: 0.8850, test_f1: 0.5649
 epoch: 43, train_loss: 0.8267, test_loss: 0.9282, test_f1: 0.5501
 epoch: 44, train_loss: 0.8362, test_loss: 0.8671, test_f1: 0.5454
 epoch: 45, train_loss: 0.8361, test_loss: 0.8665, test_f1: 0.5726
 epoch: 46, train_loss: 0.8162, test_loss: 0.8852, test_f1: 0.5773
 epoch: 47, train_loss: 0.8183, test_loss: 0.8801, test_f1: 0.5660
 epoch: 48, train_loss: 0.8124, test_loss: 0.8870, test_f1: 0.5749
 epoch: 49, train_loss: 0.8138, test_loss: 0.8947, test_f1: 0.5810
 epoch: 50, train_loss: 0.8065, test_loss: 0.9115, test_f1: 0.5623
 epoch: 51, train_loss: 0.8027, test_loss: 0.8574, test_f1: 0.5690
 epoch: 52, train_loss: 0.8016, test_loss: 0.8703, test_f1: 0.5612
 epoch: 53, train_loss: 0.7955, test_loss: 0.8719, test_f1: 0.5580
 epoch: 54, train_loss: 0.8066, test_loss: 0.8996, test_f1: 0.5610
 epoch: 55, train_loss: 0.7983, test_loss: 0.8958, test_f1: 0.5823
 epoch: 56, train_loss: 0.7979, test_loss: 0.9078, test_f1: 0.5754
 epoch: 57, train_loss: 0.7926, test_loss: 0.8859, test_f1: 0.5963
 epoch: 58, train_loss: 0.7810, test_loss: 0.8765, test_f1: 0.5787
 epoch: 59, train_loss: 0.7883, test_loss: 0.8969, test_f1: 0.5720
 epoch: 60, train_loss: 0.7925, test_loss: 0.8836, test_f1: 0.5627
 epoch: 61, train_loss: 0.7909, test_loss: 0.8912, test_f1: 0.5809
 epoch: 62, train_loss: 0.7802, test_loss: 0.9027, test_f1: 0.5938
 epoch: 63, train_loss: 0.7911, test_loss: 0.9173, test_f1: 0.5692
 epoch: 64, train_loss: 0.7721, test_loss: 0.8953, test_f1: 0.5850
 epoch: 65, train_loss: 0.7781, test_loss: 0.9079, test_f1: 0.5806
 epoch: 66, train_loss: 0.7804, test_loss: 0.8809, test_f1: 0.5734
 epoch: 67, train_loss: 0.7807, test_loss: 0.8740, test_f1: 0.5842
 epoch: 68, train_loss: 0.7599, test_loss: 0.9038, test_f1: 0.5827
 epoch: 69, train_loss: 0.7784, test_loss: 0.9150, test_f1: 0.5933
 epoch: 70, train_loss: 0.7782, test_loss: 0.9039, test_f1: 0.5577
 epoch: 71, train_loss: 0.7756, test_loss: 0.8657, test_f1: 0.5765
 epoch: 72, train_loss: 0.7702, test_loss: 0.9104, test_f1: 0.5643
 epoch: 73, train_loss: 0.7573, test_loss: 0.9181, test_f1: 0.5861
 epoch: 74, train_loss: 0.7690, test_loss: 0.9226, test_f1: 0.6057
 epoch: 75, train_loss: 0.7620, test_loss: 0.9133, test_f1: 0.5969
 epoch: 76, train_loss: 0.7649, test_loss: 0.9099, test_f1: 0.5761
 epoch: 77, train_loss: 0.7570, test_loss: 0.9052, test_f1: 0.5766
 epoch: 78, train_loss: 0.7573, test_loss: 0.9034, test_f1: 0.5694
 epoch: 79, train_loss: 0.7648, test_loss: 0.9035, test_f1: 0.5990
 epoch: 80, train_loss: 0.7519, test_loss: 0.8969, test_f1: 0.5622
 epoch: 81, train_loss: 0.7585, test_loss: 0.9087, test_f1: 0.5734
 epoch: 82, train_loss: 0.7581, test_loss: 0.9166, test_f1: 0.5692
 epoch: 83, train_loss: 0.7516, test_loss: 0.9091, test_f1: 0.5691
 epoch: 84, train_loss: 0.7457, test_loss: 0.9190, test_f1: 0.5720
 epoch: 85, train_loss: 0.7547, test_loss: 0.8907, test_f1: 0.5625
 epoch: 86, train_loss: 0.7529, test_loss: 0.9321, test_f1: 0.5617
 epoch: 87, train_loss: 0.7485, test_loss: 0.8870, test_f1: 0.5720
 epoch: 88, train_loss: 0.7588, test_loss: 0.9326, test_f1: 0.5665
 epoch: 89, train_loss: 0.7414, test_loss: 0.8970, test_f1: 0.5697
 epoch: 90, train_loss: 0.7442, test_loss: 0.9001, test_f1: 0.5746
 epoch: 91, train_loss: 0.7528, test_loss: 0.9369, test_f1: 0.5715
 epoch: 92, train_loss: 0.7426, test_loss: 0.9180, test_f1: 0.5725
 epoch: 93, train_loss: 0.7454, test_loss: 0.8857, test_f1: 0.5712
 epoch: 94, train_loss: 0.7424, test_loss: 0.8844, test_f1: 0.5717
 epoch: 95, train_loss: 0.7547, test_loss: 0.9078, test_f1: 0.5734
 epoch: 96, train_loss: 0.7332, test_loss: 0.8899, test_f1: 0.5654
 epoch: 97, train_loss: 0.7530, test_loss: 0.8945, test_f1: 0.5623
 epoch: 98, train_loss: 0.7444, test_loss: 0.9072, test_f1: 0.5623
 epoch: 99, train_loss: 0.7364, test_loss: 0.9068, test_f1: 0.5811
##################ITERATION #5 ****************************************
 epoch: 0, train_loss: 1.2683, test_loss: 1.1046, test_f1: 0.3860
 epoch: 1, train_loss: 1.1354, test_loss: 1.0572, test_f1: 0.4032
 epoch: 2, train_loss: 1.1055, test_loss: 1.0262, test_f1: 0.4295
 epoch: 3, train_loss: 1.0825, test_loss: 1.0072, test_f1: 0.4593
 epoch: 4, train_loss: 1.0759, test_loss: 0.9974, test_f1: 0.4478
 epoch: 5, train_loss: 1.0485, test_loss: 0.9724, test_f1: 0.4807
 epoch: 6, train_loss: 1.0272, test_loss: 0.9552, test_f1: 0.4966
 epoch: 7, train_loss: 1.0219, test_loss: 0.9619, test_f1: 0.4751
 epoch: 8, train_loss: 1.0042, test_loss: 0.9676, test_f1: 0.4715
 epoch: 9, train_loss: 0.9947, test_loss: 0.9411, test_f1: 0.4929
 epoch: 10, train_loss: 0.9929, test_loss: 0.9340, test_f1: 0.4892
 epoch: 11, train_loss: 0.9725, test_loss: 0.9421, test_f1: 0.4881
 epoch: 12, train_loss: 0.9638, test_loss: 0.9300, test_f1: 0.5089
 epoch: 13, train_loss: 0.9515, test_loss: 0.9325, test_f1: 0.4913
 epoch: 14, train_loss: 0.9521, test_loss: 0.9454, test_f1: 0.5050
 epoch: 15, train_loss: 0.9419, test_loss: 0.9459, test_f1: 0.5080
 epoch: 16, train_loss: 0.9326, test_loss: 0.9140, test_f1: 0.5028
 epoch: 17, train_loss: 0.9332, test_loss: 0.9290, test_f1: 0.5060
 epoch: 18, train_loss: 0.9228, test_loss: 0.9261, test_f1: 0.5189
 epoch: 19, train_loss: 0.9134, test_loss: 0.9279, test_f1: 0.5257
 epoch: 20, train_loss: 0.9174, test_loss: 0.9166, test_f1: 0.5274
 epoch: 21, train_loss: 0.8993, test_loss: 0.9162, test_f1: 0.5310
 epoch: 22, train_loss: 0.9029, test_loss: 0.9220, test_f1: 0.5217
 epoch: 23, train_loss: 0.8929, test_loss: 0.9294, test_f1: 0.5075
 epoch: 24, train_loss: 0.8877, test_loss: 0.9255, test_f1: 0.5211
 epoch: 25, train_loss: 0.8857, test_loss: 0.9234, test_f1: 0.5239
 epoch: 26, train_loss: 0.8838, test_loss: 0.9393, test_f1: 0.5360
 epoch: 27, train_loss: 0.8726, test_loss: 0.9347, test_f1: 0.5197
 epoch: 28, train_loss: 0.8757, test_loss: 0.9506, test_f1: 0.5330
 epoch: 29, train_loss: 0.8704, test_loss: 0.9340, test_f1: 0.5212
 epoch: 30, train_loss: 0.8684, test_loss: 0.9296, test_f1: 0.5233
 epoch: 31, train_loss: 0.8646, test_loss: 0.9222, test_f1: 0.5482
 epoch: 32, train_loss: 0.8506, test_loss: 0.9288, test_f1: 0.5297
 epoch: 33, train_loss: 0.8591, test_loss: 0.9222, test_f1: 0.5244
 epoch: 34, train_loss: 0.8547, test_loss: 0.9387, test_f1: 0.5647
 epoch: 35, train_loss: 0.8470, test_loss: 0.9451, test_f1: 0.5410
 epoch: 36, train_loss: 0.8496, test_loss: 0.9412, test_f1: 0.5437
 epoch: 37, train_loss: 0.8439, test_loss: 0.9468, test_f1: 0.5563
 epoch: 38, train_loss: 0.8319, test_loss: 0.9266, test_f1: 0.5598
 epoch: 39, train_loss: 0.8370, test_loss: 0.9208, test_f1: 0.5702
 epoch: 40, train_loss: 0.8291, test_loss: 0.9121, test_f1: 0.5727
 epoch: 41, train_loss: 0.8286, test_loss: 0.9501, test_f1: 0.5582
 epoch: 42, train_loss: 0.8251, test_loss: 0.9228, test_f1: 0.5659
 epoch: 43, train_loss: 0.8294, test_loss: 0.9076, test_f1: 0.5647
 epoch: 44, train_loss: 0.8276, test_loss: 0.9200, test_f1: 0.5842
 epoch: 45, train_loss: 0.8222, test_loss: 0.9141, test_f1: 0.5517
 epoch: 46, train_loss: 0.8062, test_loss: 0.9135, test_f1: 0.5884
 epoch: 47, train_loss: 0.8141, test_loss: 0.9273, test_f1: 0.5791
 epoch: 48, train_loss: 0.8093, test_loss: 0.9291, test_f1: 0.5863
 epoch: 49, train_loss: 0.8125, test_loss: 0.9533, test_f1: 0.5762
 epoch: 50, train_loss: 0.8098, test_loss: 0.9230, test_f1: 0.5797
 epoch: 51, train_loss: 0.8005, test_loss: 0.9382, test_f1: 0.5702
 epoch: 52, train_loss: 0.8075, test_loss: 0.9281, test_f1: 0.5872
 epoch: 53, train_loss: 0.7904, test_loss: 0.9264, test_f1: 0.5797
 epoch: 54, train_loss: 0.7837, test_loss: 0.9211, test_f1: 0.5758
 epoch: 55, train_loss: 0.7934, test_loss: 0.9099, test_f1: 0.5891
 epoch: 56, train_loss: 0.7887, test_loss: 0.9296, test_f1: 0.5770
 epoch: 57, train_loss: 0.7873, test_loss: 0.9147, test_f1: 0.5821
 epoch: 58, train_loss: 0.7684, test_loss: 0.9370, test_f1: 0.5807
 epoch: 59, train_loss: 0.7717, test_loss: 0.9303, test_f1: 0.5889
 epoch: 60, train_loss: 0.7804, test_loss: 0.9141, test_f1: 0.5745
 epoch: 61, train_loss: 0.7723, test_loss: 0.9206, test_f1: 0.5824
 epoch: 62, train_loss: 0.7752, test_loss: 0.9365, test_f1: 0.5896
 epoch: 63, train_loss: 0.7752, test_loss: 0.9516, test_f1: 0.5812
 epoch: 64, train_loss: 0.7778, test_loss: 0.9316, test_f1: 0.5836
 epoch: 65, train_loss: 0.7715, test_loss: 0.9216, test_f1: 0.5840
 epoch: 66, train_loss: 0.7640, test_loss: 0.9195, test_f1: 0.5859
 epoch: 67, train_loss: 0.7687, test_loss: 0.9278, test_f1: 0.5823
 epoch: 68, train_loss: 0.7754, test_loss: 0.9321, test_f1: 0.5983
 epoch: 69, train_loss: 0.7609, test_loss: 0.9224, test_f1: 0.5984
 epoch: 70, train_loss: 0.7652, test_loss: 0.9188, test_f1: 0.5952
 epoch: 71, train_loss: 0.7553, test_loss: 0.9161, test_f1: 0.6029
 epoch: 72, train_loss: 0.7568, test_loss: 0.9128, test_f1: 0.5967
 epoch: 73, train_loss: 0.7647, test_loss: 0.9156, test_f1: 0.5975
 epoch: 74, train_loss: 0.7683, test_loss: 0.9261, test_f1: 0.5938
 epoch: 75, train_loss: 0.7550, test_loss: 0.9320, test_f1: 0.5774
 epoch: 76, train_loss: 0.7507, test_loss: 0.9246, test_f1: 0.5932
 epoch: 77, train_loss: 0.7596, test_loss: 0.9400, test_f1: 0.5837
 epoch: 78, train_loss: 0.7596, test_loss: 0.9355, test_f1: 0.6052
 epoch: 79, train_loss: 0.7488, test_loss: 0.9313, test_f1: 0.6047
 epoch: 80, train_loss: 0.7646, test_loss: 0.9177, test_f1: 0.6128
 epoch: 81, train_loss: 0.7462, test_loss: 0.9116, test_f1: 0.5900
 epoch: 82, train_loss: 0.7462, test_loss: 0.9142, test_f1: 0.6068
 epoch: 83, train_loss: 0.7479, test_loss: 0.9215, test_f1: 0.5980
 epoch: 84, train_loss: 0.7588, test_loss: 0.9234, test_f1: 0.5994
 epoch: 85, train_loss: 0.7388, test_loss: 0.9244, test_f1: 0.6096
 epoch: 86, train_loss: 0.7412, test_loss: 0.9448, test_f1: 0.5913
 epoch: 87, train_loss: 0.7454, test_loss: 0.9343, test_f1: 0.5955
 epoch: 88, train_loss: 0.7433, test_loss: 0.9495, test_f1: 0.6000
 epoch: 89, train_loss: 0.7349, test_loss: 0.9274, test_f1: 0.6061
 epoch: 90, train_loss: 0.7464, test_loss: 0.9014, test_f1: 0.6232
 epoch: 91, train_loss: 0.7447, test_loss: 0.9146, test_f1: 0.6009
 epoch: 92, train_loss: 0.7236, test_loss: 0.9205, test_f1: 0.6103
 epoch: 93, train_loss: 0.7217, test_loss: 0.9246, test_f1: 0.6235
 epoch: 94, train_loss: 0.7360, test_loss: 0.9252, test_f1: 0.6149
 epoch: 95, train_loss: 0.7382, test_loss: 0.9525, test_f1: 0.6021
 epoch: 96, train_loss: 0.7256, test_loss: 0.9520, test_f1: 0.6062
 epoch: 97, train_loss: 0.7285, test_loss: 0.9605, test_f1: 0.6104
 epoch: 98, train_loss: 0.7230, test_loss: 0.9369, test_f1: 0.6033
 epoch: 99, train_loss: 0.7173, test_loss: 0.9506, test_f1: 0.6181
##################ITERATION #6 ****************************************
 epoch: 0, train_loss: 1.2533, test_loss: 1.1240, test_f1: 0.3569
 epoch: 1, train_loss: 1.1586, test_loss: 1.0764, test_f1: 0.4131
 epoch: 2, train_loss: 1.1144, test_loss: 1.0434, test_f1: 0.4489
 epoch: 3, train_loss: 1.0839, test_loss: 1.0181, test_f1: 0.4546
 epoch: 4, train_loss: 1.0598, test_loss: 0.9926, test_f1: 0.4435
 epoch: 5, train_loss: 1.0337, test_loss: 0.9881, test_f1: 0.4658
 epoch: 6, train_loss: 1.0134, test_loss: 0.9653, test_f1: 0.4635
 epoch: 7, train_loss: 1.0075, test_loss: 0.9592, test_f1: 0.4833
 epoch: 8, train_loss: 0.9872, test_loss: 0.9485, test_f1: 0.5045
 epoch: 9, train_loss: 0.9796, test_loss: 0.9508, test_f1: 0.5263
 epoch: 10, train_loss: 0.9724, test_loss: 0.9363, test_f1: 0.4991
 epoch: 11, train_loss: 0.9615, test_loss: 0.9441, test_f1: 0.5000
 epoch: 12, train_loss: 0.9461, test_loss: 0.9361, test_f1: 0.5327
 epoch: 13, train_loss: 0.9532, test_loss: 0.9286, test_f1: 0.5308
 epoch: 14, train_loss: 0.9364, test_loss: 0.9455, test_f1: 0.5526
 epoch: 15, train_loss: 0.9284, test_loss: 0.9472, test_f1: 0.5112
 epoch: 16, train_loss: 0.9327, test_loss: 0.9430, test_f1: 0.5277
 epoch: 17, train_loss: 0.9279, test_loss: 0.9373, test_f1: 0.5236
 epoch: 18, train_loss: 0.9155, test_loss: 0.9096, test_f1: 0.5419
 epoch: 19, train_loss: 0.9026, test_loss: 0.9240, test_f1: 0.5418
 epoch: 20, train_loss: 0.8953, test_loss: 0.9296, test_f1: 0.5291
 epoch: 21, train_loss: 0.8894, test_loss: 0.9412, test_f1: 0.5243
 epoch: 22, train_loss: 0.8933, test_loss: 0.9376, test_f1: 0.5142
 epoch: 23, train_loss: 0.8895, test_loss: 0.9273, test_f1: 0.5625
 epoch: 24, train_loss: 0.8677, test_loss: 0.9197, test_f1: 0.5749
 epoch: 25, train_loss: 0.8835, test_loss: 0.9383, test_f1: 0.5442
 epoch: 26, train_loss: 0.8732, test_loss: 0.9034, test_f1: 0.5710
 epoch: 27, train_loss: 0.8743, test_loss: 0.9118, test_f1: 0.5620
 epoch: 28, train_loss: 0.8634, test_loss: 0.9173, test_f1: 0.5539
 epoch: 29, train_loss: 0.8653, test_loss: 0.9332, test_f1: 0.5699
 epoch: 30, train_loss: 0.8553, test_loss: 0.9168, test_f1: 0.5726
 epoch: 31, train_loss: 0.8639, test_loss: 0.9416, test_f1: 0.5511
 epoch: 32, train_loss: 0.8449, test_loss: 0.9528, test_f1: 0.5241
 epoch: 33, train_loss: 0.8475, test_loss: 0.9572, test_f1: 0.5476
 epoch: 34, train_loss: 0.8510, test_loss: 0.9217, test_f1: 0.5817
 epoch: 35, train_loss: 0.8285, test_loss: 0.9185, test_f1: 0.5398
 epoch: 36, train_loss: 0.8420, test_loss: 0.9050, test_f1: 0.5558
 epoch: 37, train_loss: 0.8298, test_loss: 0.9205, test_f1: 0.5603
 epoch: 38, train_loss: 0.8309, test_loss: 0.9366, test_f1: 0.5799
 epoch: 39, train_loss: 0.8162, test_loss: 0.9396, test_f1: 0.5457
 epoch: 40, train_loss: 0.8306, test_loss: 0.9212, test_f1: 0.5603
 epoch: 41, train_loss: 0.8369, test_loss: 0.9407, test_f1: 0.5517
 epoch: 42, train_loss: 0.8160, test_loss: 0.9248, test_f1: 0.5516
 epoch: 43, train_loss: 0.8074, test_loss: 0.9157, test_f1: 0.5682
 epoch: 44, train_loss: 0.8121, test_loss: 0.9205, test_f1: 0.5406
 epoch: 45, train_loss: 0.8090, test_loss: 0.9450, test_f1: 0.5779
 epoch: 46, train_loss: 0.8035, test_loss: 0.9096, test_f1: 0.5764
 epoch: 47, train_loss: 0.7892, test_loss: 0.9197, test_f1: 0.5846
 epoch: 48, train_loss: 0.8065, test_loss: 0.9462, test_f1: 0.5607
 epoch: 49, train_loss: 0.8020, test_loss: 0.8963, test_f1: 0.5729
 epoch: 50, train_loss: 0.7956, test_loss: 0.8934, test_f1: 0.5536
 epoch: 51, train_loss: 0.7791, test_loss: 0.9161, test_f1: 0.5583
 epoch: 52, train_loss: 0.7754, test_loss: 0.9238, test_f1: 0.5583
 epoch: 53, train_loss: 0.7887, test_loss: 0.8945, test_f1: 0.5800
 epoch: 54, train_loss: 0.7738, test_loss: 0.9266, test_f1: 0.5475
 epoch: 55, train_loss: 0.7738, test_loss: 0.9040, test_f1: 0.5725
 epoch: 56, train_loss: 0.7747, test_loss: 0.9093, test_f1: 0.5761
 epoch: 57, train_loss: 0.7705, test_loss: 0.9205, test_f1: 0.5698
 epoch: 58, train_loss: 0.7704, test_loss: 0.9188, test_f1: 0.5604
 epoch: 59, train_loss: 0.7656, test_loss: 0.9190, test_f1: 0.5551
 epoch: 60, train_loss: 0.7618, test_loss: 0.9277, test_f1: 0.5703
 epoch: 61, train_loss: 0.7646, test_loss: 0.9428, test_f1: 0.5569
 epoch: 62, train_loss: 0.7729, test_loss: 0.9528, test_f1: 0.5601
 epoch: 63, train_loss: 0.7606, test_loss: 0.9377, test_f1: 0.5921
 epoch: 64, train_loss: 0.7636, test_loss: 0.9087, test_f1: 0.5799
 epoch: 65, train_loss: 0.7711, test_loss: 0.9283, test_f1: 0.5889
 epoch: 66, train_loss: 0.7555, test_loss: 0.9134, test_f1: 0.5707
 epoch: 67, train_loss: 0.7580, test_loss: 0.9183, test_f1: 0.5857
 epoch: 68, train_loss: 0.7543, test_loss: 0.9243, test_f1: 0.5861
 epoch: 69, train_loss: 0.7640, test_loss: 0.9366, test_f1: 0.5695
 epoch: 70, train_loss: 0.7554, test_loss: 0.9172, test_f1: 0.5866
 epoch: 71, train_loss: 0.7544, test_loss: 0.9312, test_f1: 0.5866
 epoch: 72, train_loss: 0.7585, test_loss: 0.9168, test_f1: 0.5856
 epoch: 73, train_loss: 0.7481, test_loss: 0.9367, test_f1: 0.5658
 epoch: 74, train_loss: 0.7559, test_loss: 0.9333, test_f1: 0.5798
 epoch: 75, train_loss: 0.7498, test_loss: 0.9368, test_f1: 0.5837
 epoch: 76, train_loss: 0.7495, test_loss: 0.9197, test_f1: 0.5726
 epoch: 77, train_loss: 0.7512, test_loss: 0.9366, test_f1: 0.5728
 epoch: 78, train_loss: 0.7432, test_loss: 0.9269, test_f1: 0.5818
 epoch: 79, train_loss: 0.7485, test_loss: 0.9443, test_f1: 0.5773
 epoch: 80, train_loss: 0.7379, test_loss: 0.9182, test_f1: 0.5863
 epoch: 81, train_loss: 0.7382, test_loss: 0.9261, test_f1: 0.5938
 epoch: 82, train_loss: 0.7332, test_loss: 0.9444, test_f1: 0.5585
 epoch: 83, train_loss: 0.7349, test_loss: 0.9318, test_f1: 0.5733
 epoch: 84, train_loss: 0.7376, test_loss: 0.9391, test_f1: 0.5974
 epoch: 85, train_loss: 0.7380, test_loss: 0.9333, test_f1: 0.5946
 epoch: 86, train_loss: 0.7334, test_loss: 0.9321, test_f1: 0.5906
 epoch: 87, train_loss: 0.7292, test_loss: 0.9135, test_f1: 0.6055
 epoch: 88, train_loss: 0.7300, test_loss: 0.9380, test_f1: 0.6036
 epoch: 89, train_loss: 0.7263, test_loss: 0.9480, test_f1: 0.5786
 epoch: 90, train_loss: 0.7261, test_loss: 0.9416, test_f1: 0.6047
 epoch: 91, train_loss: 0.7351, test_loss: 0.9227, test_f1: 0.5815
 epoch: 92, train_loss: 0.7213, test_loss: 0.9261, test_f1: 0.5841
 epoch: 93, train_loss: 0.7185, test_loss: 0.9247, test_f1: 0.5885
 epoch: 94, train_loss: 0.7122, test_loss: 0.9565, test_f1: 0.5861
 epoch: 95, train_loss: 0.7254, test_loss: 0.9283, test_f1: 0.5989
 epoch: 96, train_loss: 0.7199, test_loss: 0.9322, test_f1: 0.5895
 epoch: 97, train_loss: 0.7174, test_loss: 0.9558, test_f1: 0.5853
 epoch: 98, train_loss: 0.7216, test_loss: 0.9381, test_f1: 0.5925
 epoch: 99, train_loss: 0.7071, test_loss: 0.9401, test_f1: 0.5952
##################ITERATION #7 ****************************************
 epoch: 0, train_loss: 1.2880, test_loss: 1.1254, test_f1: 0.4202
 epoch: 1, train_loss: 1.1690, test_loss: 1.0668, test_f1: 0.4383
 epoch: 2, train_loss: 1.1342, test_loss: 1.0252, test_f1: 0.4817
 epoch: 3, train_loss: 1.1060, test_loss: 1.0090, test_f1: 0.4884
 epoch: 4, train_loss: 1.0836, test_loss: 1.0023, test_f1: 0.4840
 epoch: 5, train_loss: 1.0592, test_loss: 0.9921, test_f1: 0.5168
 epoch: 6, train_loss: 1.0416, test_loss: 0.9828, test_f1: 0.4893
 epoch: 7, train_loss: 1.0278, test_loss: 0.9805, test_f1: 0.5091
 epoch: 8, train_loss: 1.0099, test_loss: 0.9791, test_f1: 0.5024
 epoch: 9, train_loss: 0.9992, test_loss: 0.9659, test_f1: 0.4829
 epoch: 10, train_loss: 0.9833, test_loss: 0.9661, test_f1: 0.5183
 epoch: 11, train_loss: 0.9786, test_loss: 0.9702, test_f1: 0.4754
 epoch: 12, train_loss: 0.9755, test_loss: 0.9633, test_f1: 0.5151
 epoch: 13, train_loss: 0.9615, test_loss: 0.9576, test_f1: 0.5074
 epoch: 14, train_loss: 0.9545, test_loss: 0.9311, test_f1: 0.5022
 epoch: 15, train_loss: 0.9450, test_loss: 0.9726, test_f1: 0.5016
 epoch: 16, train_loss: 0.9304, test_loss: 0.9510, test_f1: 0.5184
 epoch: 17, train_loss: 0.9323, test_loss: 0.9556, test_f1: 0.4967
 epoch: 18, train_loss: 0.9299, test_loss: 0.9475, test_f1: 0.5331
 epoch: 19, train_loss: 0.9205, test_loss: 0.9701, test_f1: 0.5145
 epoch: 20, train_loss: 0.9160, test_loss: 0.9733, test_f1: 0.5063
 epoch: 21, train_loss: 0.9032, test_loss: 0.9480, test_f1: 0.5314
 epoch: 22, train_loss: 0.8966, test_loss: 0.9652, test_f1: 0.5226
 epoch: 23, train_loss: 0.9050, test_loss: 0.9634, test_f1: 0.5310
 epoch: 24, train_loss: 0.8924, test_loss: 0.9704, test_f1: 0.5228
 epoch: 25, train_loss: 0.8893, test_loss: 0.9736, test_f1: 0.5349
 epoch: 26, train_loss: 0.8869, test_loss: 0.9655, test_f1: 0.5315
 epoch: 27, train_loss: 0.8758, test_loss: 0.9747, test_f1: 0.5273
 epoch: 28, train_loss: 0.8759, test_loss: 0.9771, test_f1: 0.5313
 epoch: 29, train_loss: 0.8745, test_loss: 0.9393, test_f1: 0.5461
 epoch: 30, train_loss: 0.8712, test_loss: 0.9696, test_f1: 0.5333
 epoch: 31, train_loss: 0.8688, test_loss: 0.9641, test_f1: 0.5473
 epoch: 32, train_loss: 0.8591, test_loss: 0.9599, test_f1: 0.5291
 epoch: 33, train_loss: 0.8632, test_loss: 0.9585, test_f1: 0.5420
 epoch: 34, train_loss: 0.8525, test_loss: 0.9623, test_f1: 0.5610
 epoch: 35, train_loss: 0.8539, test_loss: 0.9631, test_f1: 0.5594
 epoch: 36, train_loss: 0.8538, test_loss: 0.9748, test_f1: 0.5255
 epoch: 37, train_loss: 0.8463, test_loss: 0.9660, test_f1: 0.5320
 epoch: 38, train_loss: 0.8424, test_loss: 0.9639, test_f1: 0.5455
 epoch: 39, train_loss: 0.8347, test_loss: 0.9705, test_f1: 0.5349
 epoch: 40, train_loss: 0.8371, test_loss: 0.9737, test_f1: 0.5446
 epoch: 41, train_loss: 0.8325, test_loss: 0.9509, test_f1: 0.5756
 epoch: 42, train_loss: 0.8325, test_loss: 0.9648, test_f1: 0.5449
 epoch: 43, train_loss: 0.8294, test_loss: 0.9760, test_f1: 0.5679
 epoch: 44, train_loss: 0.8258, test_loss: 0.9693, test_f1: 0.5482
 epoch: 45, train_loss: 0.8093, test_loss: 0.9765, test_f1: 0.5518
 epoch: 46, train_loss: 0.8146, test_loss: 0.9621, test_f1: 0.5594
 epoch: 47, train_loss: 0.8137, test_loss: 1.0169, test_f1: 0.5701
 epoch: 48, train_loss: 0.8149, test_loss: 0.9503, test_f1: 0.5658
 epoch: 49, train_loss: 0.8107, test_loss: 0.9561, test_f1: 0.5674
 epoch: 50, train_loss: 0.8096, test_loss: 0.9892, test_f1: 0.5439
 epoch: 51, train_loss: 0.7994, test_loss: 0.9557, test_f1: 0.5621
 epoch: 52, train_loss: 0.7964, test_loss: 0.9611, test_f1: 0.5745
 epoch: 53, train_loss: 0.7890, test_loss: 0.9505, test_f1: 0.5728
 epoch: 54, train_loss: 0.7861, test_loss: 0.9536, test_f1: 0.5708
 epoch: 55, train_loss: 0.7862, test_loss: 0.9408, test_f1: 0.5829
 epoch: 56, train_loss: 0.7894, test_loss: 0.9590, test_f1: 0.5618
 epoch: 57, train_loss: 0.7733, test_loss: 0.9584, test_f1: 0.5558
 epoch: 58, train_loss: 0.7861, test_loss: 0.9669, test_f1: 0.5678
 epoch: 59, train_loss: 0.7801, test_loss: 0.9927, test_f1: 0.5495
 epoch: 60, train_loss: 0.7802, test_loss: 0.9544, test_f1: 0.5584
 epoch: 61, train_loss: 0.7763, test_loss: 0.9614, test_f1: 0.5537
 epoch: 62, train_loss: 0.7753, test_loss: 0.9732, test_f1: 0.5571
 epoch: 63, train_loss: 0.7796, test_loss: 0.9609, test_f1: 0.5709
 epoch: 64, train_loss: 0.7691, test_loss: 0.9548, test_f1: 0.5636
 epoch: 65, train_loss: 0.7790, test_loss: 0.9664, test_f1: 0.5698
 epoch: 66, train_loss: 0.7654, test_loss: 0.9477, test_f1: 0.5806
 epoch: 67, train_loss: 0.7744, test_loss: 0.9611, test_f1: 0.5675
 epoch: 68, train_loss: 0.7705, test_loss: 0.9583, test_f1: 0.5806
 epoch: 69, train_loss: 0.7705, test_loss: 0.9464, test_f1: 0.5964
 epoch: 70, train_loss: 0.7700, test_loss: 0.9506, test_f1: 0.5911
 epoch: 71, train_loss: 0.7660, test_loss: 0.9842, test_f1: 0.5792
 epoch: 72, train_loss: 0.7656, test_loss: 0.9816, test_f1: 0.5823
 epoch: 73, train_loss: 0.7522, test_loss: 0.9403, test_f1: 0.5755
 epoch: 74, train_loss: 0.7600, test_loss: 0.9668, test_f1: 0.5795
 epoch: 75, train_loss: 0.7531, test_loss: 0.9846, test_f1: 0.5747
 epoch: 76, train_loss: 0.7574, test_loss: 0.9658, test_f1: 0.5769
 epoch: 77, train_loss: 0.7537, test_loss: 0.9725, test_f1: 0.5710
 epoch: 78, train_loss: 0.7565, test_loss: 0.9411, test_f1: 0.5949
 epoch: 79, train_loss: 0.7471, test_loss: 0.9924, test_f1: 0.5596
 epoch: 80, train_loss: 0.7505, test_loss: 0.9940, test_f1: 0.5807
 epoch: 81, train_loss: 0.7476, test_loss: 0.9607, test_f1: 0.5869
 epoch: 82, train_loss: 0.7314, test_loss: 0.9840, test_f1: 0.6028
 epoch: 83, train_loss: 0.7460, test_loss: 0.9800, test_f1: 0.5775
 epoch: 84, train_loss: 0.7437, test_loss: 0.9591, test_f1: 0.5803
 epoch: 85, train_loss: 0.7492, test_loss: 0.9744, test_f1: 0.6030
 epoch: 86, train_loss: 0.7525, test_loss: 1.0027, test_f1: 0.5793
 epoch: 87, train_loss: 0.7479, test_loss: 1.0094, test_f1: 0.6032
 epoch: 88, train_loss: 0.7336, test_loss: 0.9935, test_f1: 0.5891
 epoch: 89, train_loss: 0.7408, test_loss: 0.9853, test_f1: 0.5776
 epoch: 90, train_loss: 0.7270, test_loss: 0.9932, test_f1: 0.5701
 epoch: 91, train_loss: 0.7433, test_loss: 0.9786, test_f1: 0.5800
 epoch: 92, train_loss: 0.7410, test_loss: 0.9934, test_f1: 0.5661
 epoch: 93, train_loss: 0.7296, test_loss: 0.9786, test_f1: 0.5922
 epoch: 94, train_loss: 0.7310, test_loss: 0.9881, test_f1: 0.5964
 epoch: 95, train_loss: 0.7153, test_loss: 0.9771, test_f1: 0.5963
 epoch: 96, train_loss: 0.7249, test_loss: 0.9798, test_f1: 0.5875
 epoch: 97, train_loss: 0.7344, test_loss: 0.9848, test_f1: 0.5964
 epoch: 98, train_loss: 0.7365, test_loss: 0.9741, test_f1: 0.5859
 epoch: 99, train_loss: 0.7285, test_loss: 1.0031, test_f1: 0.5655
##################ITERATION #8 ****************************************
 epoch: 0, train_loss: 1.3049, test_loss: 1.1375, test_f1: 0.3593
 epoch: 1, train_loss: 1.1768, test_loss: 1.0944, test_f1: 0.4083
 epoch: 2, train_loss: 1.1327, test_loss: 1.0559, test_f1: 0.4048
 epoch: 3, train_loss: 1.0981, test_loss: 1.0175, test_f1: 0.4514
 epoch: 4, train_loss: 1.0756, test_loss: 0.9982, test_f1: 0.4667
 epoch: 5, train_loss: 1.0554, test_loss: 0.9812, test_f1: 0.4464
 epoch: 6, train_loss: 1.0390, test_loss: 0.9735, test_f1: 0.4454
 epoch: 7, train_loss: 1.0163, test_loss: 0.9471, test_f1: 0.4678
 epoch: 8, train_loss: 1.0153, test_loss: 0.9374, test_f1: 0.5177
 epoch: 9, train_loss: 0.9854, test_loss: 0.9315, test_f1: 0.4800
 epoch: 10, train_loss: 0.9743, test_loss: 0.9207, test_f1: 0.5037
 epoch: 11, train_loss: 0.9768, test_loss: 0.9610, test_f1: 0.4717
 epoch: 12, train_loss: 0.9611, test_loss: 0.9415, test_f1: 0.4744
 epoch: 13, train_loss: 0.9489, test_loss: 0.9434, test_f1: 0.4789
 epoch: 14, train_loss: 0.9558, test_loss: 0.9471, test_f1: 0.4871
 epoch: 15, train_loss: 0.9347, test_loss: 0.9295, test_f1: 0.5041
 epoch: 16, train_loss: 0.9358, test_loss: 0.9331, test_f1: 0.5086
 epoch: 17, train_loss: 0.9085, test_loss: 0.9086, test_f1: 0.5173
 epoch: 18, train_loss: 0.9263, test_loss: 0.9390, test_f1: 0.5035
 epoch: 19, train_loss: 0.9045, test_loss: 0.9088, test_f1: 0.5051
 epoch: 20, train_loss: 0.8992, test_loss: 0.9361, test_f1: 0.4991
 epoch: 21, train_loss: 0.8884, test_loss: 0.9366, test_f1: 0.5024
 epoch: 22, train_loss: 0.8930, test_loss: 0.9088, test_f1: 0.5073
 epoch: 23, train_loss: 0.8847, test_loss: 0.9267, test_f1: 0.5079
 epoch: 24, train_loss: 0.8788, test_loss: 0.9386, test_f1: 0.4916
 epoch: 25, train_loss: 0.8623, test_loss: 0.9450, test_f1: 0.5142
 epoch: 26, train_loss: 0.8559, test_loss: 0.9305, test_f1: 0.5305
 epoch: 27, train_loss: 0.8669, test_loss: 0.9490, test_f1: 0.5190
 epoch: 28, train_loss: 0.8604, test_loss: 0.9196, test_f1: 0.5314
 epoch: 29, train_loss: 0.8670, test_loss: 0.9283, test_f1: 0.5030
 epoch: 30, train_loss: 0.8544, test_loss: 0.9355, test_f1: 0.5019
 epoch: 31, train_loss: 0.8479, test_loss: 0.9000, test_f1: 0.5586
 epoch: 32, train_loss: 0.8512, test_loss: 0.9598, test_f1: 0.5394
 epoch: 33, train_loss: 0.8406, test_loss: 0.9184, test_f1: 0.5555
 epoch: 34, train_loss: 0.8425, test_loss: 0.9510, test_f1: 0.5197
 epoch: 35, train_loss: 0.8347, test_loss: 0.9603, test_f1: 0.5378
 epoch: 36, train_loss: 0.8381, test_loss: 0.9355, test_f1: 0.5275
 epoch: 37, train_loss: 0.8367, test_loss: 0.9327, test_f1: 0.5453
 epoch: 38, train_loss: 0.8158, test_loss: 0.9214, test_f1: 0.5390
 epoch: 39, train_loss: 0.8184, test_loss: 0.9352, test_f1: 0.5605
 epoch: 40, train_loss: 0.8187, test_loss: 0.9436, test_f1: 0.5523
 epoch: 41, train_loss: 0.8060, test_loss: 0.9424, test_f1: 0.5507
 epoch: 42, train_loss: 0.8075, test_loss: 0.9541, test_f1: 0.5391
 epoch: 43, train_loss: 0.8049, test_loss: 0.9638, test_f1: 0.5496
 epoch: 44, train_loss: 0.8042, test_loss: 0.9411, test_f1: 0.5606
 epoch: 45, train_loss: 0.8062, test_loss: 0.9375, test_f1: 0.5523
 epoch: 46, train_loss: 0.8027, test_loss: 0.9544, test_f1: 0.5601
 epoch: 47, train_loss: 0.7955, test_loss: 0.9510, test_f1: 0.5544
 epoch: 48, train_loss: 0.7940, test_loss: 0.9619, test_f1: 0.5665
 epoch: 49, train_loss: 0.7821, test_loss: 0.9648, test_f1: 0.5592
 epoch: 50, train_loss: 0.7875, test_loss: 0.9450, test_f1: 0.5627
 epoch: 51, train_loss: 0.7824, test_loss: 0.9468, test_f1: 0.5715
 epoch: 52, train_loss: 0.7703, test_loss: 0.9755, test_f1: 0.5635
 epoch: 53, train_loss: 0.7782, test_loss: 0.9432, test_f1: 0.5741
 epoch: 54, train_loss: 0.7706, test_loss: 0.9641, test_f1: 0.5685
 epoch: 55, train_loss: 0.7705, test_loss: 0.9410, test_f1: 0.5709
 epoch: 56, train_loss: 0.7684, test_loss: 0.9351, test_f1: 0.5805
 epoch: 57, train_loss: 0.7708, test_loss: 0.9472, test_f1: 0.5696
 epoch: 58, train_loss: 0.7615, test_loss: 0.9489, test_f1: 0.5770
 epoch: 59, train_loss: 0.7599, test_loss: 0.9506, test_f1: 0.5700
 epoch: 60, train_loss: 0.7748, test_loss: 0.9528, test_f1: 0.5672
 epoch: 61, train_loss: 0.7568, test_loss: 0.9532, test_f1: 0.5762
 epoch: 62, train_loss: 0.7662, test_loss: 0.9541, test_f1: 0.5739
 epoch: 63, train_loss: 0.7766, test_loss: 0.9530, test_f1: 0.5632
 epoch: 64, train_loss: 0.7586, test_loss: 0.9559, test_f1: 0.5596
 epoch: 65, train_loss: 0.7545, test_loss: 0.9579, test_f1: 0.5607
 epoch: 66, train_loss: 0.7539, test_loss: 0.9649, test_f1: 0.5665
 epoch: 67, train_loss: 0.7679, test_loss: 0.9563, test_f1: 0.5698
 epoch: 68, train_loss: 0.7500, test_loss: 0.9710, test_f1: 0.5686
 epoch: 69, train_loss: 0.7619, test_loss: 0.9742, test_f1: 0.5674
 epoch: 70, train_loss: 0.7589, test_loss: 0.9468, test_f1: 0.5703
 epoch: 71, train_loss: 0.7528, test_loss: 0.9476, test_f1: 0.5650
 epoch: 72, train_loss: 0.7436, test_loss: 0.9608, test_f1: 0.5721
 epoch: 73, train_loss: 0.7416, test_loss: 0.9753, test_f1: 0.5512
 epoch: 74, train_loss: 0.7426, test_loss: 0.9723, test_f1: 0.5697
 epoch: 75, train_loss: 0.7400, test_loss: 0.9763, test_f1: 0.5643
 epoch: 76, train_loss: 0.7418, test_loss: 0.9700, test_f1: 0.5650
 epoch: 77, train_loss: 0.7357, test_loss: 0.9693, test_f1: 0.5713
 epoch: 78, train_loss: 0.7341, test_loss: 0.9891, test_f1: 0.5746
 epoch: 79, train_loss: 0.7445, test_loss: 0.9787, test_f1: 0.5647
 epoch: 80, train_loss: 0.7420, test_loss: 0.9929, test_f1: 0.5632
 epoch: 81, train_loss: 0.7267, test_loss: 0.9908, test_f1: 0.5703
 epoch: 82, train_loss: 0.7309, test_loss: 0.9960, test_f1: 0.5712
 epoch: 83, train_loss: 0.7382, test_loss: 0.9877, test_f1: 0.5502
 epoch: 84, train_loss: 0.7353, test_loss: 0.9856, test_f1: 0.5676
 epoch: 85, train_loss: 0.7316, test_loss: 0.9912, test_f1: 0.5675
 epoch: 86, train_loss: 0.7359, test_loss: 0.9791, test_f1: 0.5513
 epoch: 87, train_loss: 0.7424, test_loss: 0.9698, test_f1: 0.5729
 epoch: 88, train_loss: 0.7268, test_loss: 0.9904, test_f1: 0.5782
 epoch: 89, train_loss: 0.7425, test_loss: 1.0106, test_f1: 0.5629
 epoch: 90, train_loss: 0.7188, test_loss: 0.9954, test_f1: 0.5762
 epoch: 91, train_loss: 0.7292, test_loss: 0.9939, test_f1: 0.5646
 epoch: 92, train_loss: 0.7112, test_loss: 0.9727, test_f1: 0.5792
 epoch: 93, train_loss: 0.7209, test_loss: 0.9737, test_f1: 0.5734
 epoch: 94, train_loss: 0.7168, test_loss: 0.9726, test_f1: 0.5777
 epoch: 95, train_loss: 0.7245, test_loss: 0.9888, test_f1: 0.5797
 epoch: 96, train_loss: 0.7251, test_loss: 0.9934, test_f1: 0.5695
 epoch: 97, train_loss: 0.7244, test_loss: 0.9757, test_f1: 0.5874
 epoch: 98, train_loss: 0.7135, test_loss: 0.9672, test_f1: 0.5813
 epoch: 99, train_loss: 0.7228, test_loss: 1.0074, test_f1: 0.5729
##################ITERATION #9 ****************************************
 epoch: 0, train_loss: 1.2707, test_loss: 1.1201, test_f1: 0.3728
 epoch: 1, train_loss: 1.1539, test_loss: 1.0584, test_f1: 0.4256
 epoch: 2, train_loss: 1.1274, test_loss: 1.0495, test_f1: 0.4305
 epoch: 3, train_loss: 1.1188, test_loss: 1.0080, test_f1: 0.4368
 epoch: 4, train_loss: 1.0823, test_loss: 1.0181, test_f1: 0.4419
 epoch: 5, train_loss: 1.0575, test_loss: 0.9610, test_f1: 0.4759
 epoch: 6, train_loss: 1.0464, test_loss: 0.9818, test_f1: 0.4567
 epoch: 7, train_loss: 1.0180, test_loss: 0.9818, test_f1: 0.4721
 epoch: 8, train_loss: 1.0124, test_loss: 0.9569, test_f1: 0.4769
 epoch: 9, train_loss: 1.0032, test_loss: 1.0020, test_f1: 0.4385
 epoch: 10, train_loss: 0.9852, test_loss: 0.9532, test_f1: 0.4737
 epoch: 11, train_loss: 0.9957, test_loss: 0.9344, test_f1: 0.4962
 epoch: 12, train_loss: 0.9842, test_loss: 0.9126, test_f1: 0.5110
 epoch: 13, train_loss: 0.9660, test_loss: 0.9046, test_f1: 0.4946
 epoch: 14, train_loss: 0.9592, test_loss: 0.9055, test_f1: 0.5046
 epoch: 15, train_loss: 0.9554, test_loss: 0.9078, test_f1: 0.4902
 epoch: 16, train_loss: 0.9423, test_loss: 0.9067, test_f1: 0.5106
 epoch: 17, train_loss: 0.9448, test_loss: 0.8961, test_f1: 0.5101
 epoch: 18, train_loss: 0.9283, test_loss: 0.8983, test_f1: 0.5011
 epoch: 19, train_loss: 0.9178, test_loss: 0.9033, test_f1: 0.5083
 epoch: 20, train_loss: 0.9153, test_loss: 0.8871, test_f1: 0.5039
 epoch: 21, train_loss: 0.9186, test_loss: 0.8922, test_f1: 0.5153
 epoch: 22, train_loss: 0.9192, test_loss: 0.8767, test_f1: 0.5168
 epoch: 23, train_loss: 0.9063, test_loss: 0.8705, test_f1: 0.5364
 epoch: 24, train_loss: 0.9099, test_loss: 0.8864, test_f1: 0.5340
 epoch: 25, train_loss: 0.8948, test_loss: 0.8860, test_f1: 0.5380
 epoch: 26, train_loss: 0.8826, test_loss: 0.9024, test_f1: 0.5276
 epoch: 27, train_loss: 0.8781, test_loss: 0.9028, test_f1: 0.5447
 epoch: 28, train_loss: 0.8859, test_loss: 0.9184, test_f1: 0.5347
 epoch: 29, train_loss: 0.8737, test_loss: 0.9148, test_f1: 0.5414
 epoch: 30, train_loss: 0.8713, test_loss: 0.8895, test_f1: 0.5472
 epoch: 31, train_loss: 0.8739, test_loss: 0.9003, test_f1: 0.5427
 epoch: 32, train_loss: 0.8699, test_loss: 0.8942, test_f1: 0.5309
 epoch: 33, train_loss: 0.8681, test_loss: 0.9052, test_f1: 0.5463
 epoch: 34, train_loss: 0.8625, test_loss: 0.9156, test_f1: 0.5487
 epoch: 35, train_loss: 0.8632, test_loss: 0.8918, test_f1: 0.5512
 epoch: 36, train_loss: 0.8587, test_loss: 0.8821, test_f1: 0.5425
 epoch: 37, train_loss: 0.8427, test_loss: 0.8926, test_f1: 0.5735
 epoch: 38, train_loss: 0.8302, test_loss: 0.8911, test_f1: 0.5555
 epoch: 39, train_loss: 0.8380, test_loss: 0.9044, test_f1: 0.5511
 epoch: 40, train_loss: 0.8395, test_loss: 0.8786, test_f1: 0.5540
 epoch: 41, train_loss: 0.8338, test_loss: 0.9011, test_f1: 0.5552
 epoch: 42, train_loss: 0.8231, test_loss: 0.8886, test_f1: 0.5532
 epoch: 43, train_loss: 0.8309, test_loss: 0.9080, test_f1: 0.5725
 epoch: 44, train_loss: 0.8229, test_loss: 0.8763, test_f1: 0.5657
 epoch: 45, train_loss: 0.8184, test_loss: 0.8898, test_f1: 0.5770
 epoch: 46, train_loss: 0.8120, test_loss: 0.9142, test_f1: 0.5729
 epoch: 47, train_loss: 0.8142, test_loss: 0.9001, test_f1: 0.5813
 epoch: 48, train_loss: 0.8277, test_loss: 0.9085, test_f1: 0.5750
 epoch: 49, train_loss: 0.8106, test_loss: 0.9194, test_f1: 0.5823
 epoch: 50, train_loss: 0.7964, test_loss: 0.8880, test_f1: 0.5789
 epoch: 51, train_loss: 0.8060, test_loss: 0.9163, test_f1: 0.5751
 epoch: 52, train_loss: 0.8058, test_loss: 0.9110, test_f1: 0.5843
 epoch: 53, train_loss: 0.7927, test_loss: 0.9117, test_f1: 0.5860
 epoch: 54, train_loss: 0.7884, test_loss: 0.9197, test_f1: 0.5843
 epoch: 55, train_loss: 0.7898, test_loss: 0.9204, test_f1: 0.5760
 epoch: 56, train_loss: 0.7853, test_loss: 0.9070, test_f1: 0.5748
 epoch: 57, train_loss: 0.7948, test_loss: 0.8827, test_f1: 0.5857
 epoch: 58, train_loss: 0.7829, test_loss: 0.9080, test_f1: 0.5837
 epoch: 59, train_loss: 0.7751, test_loss: 0.8796, test_f1: 0.5828
 epoch: 60, train_loss: 0.7741, test_loss: 0.8862, test_f1: 0.5758
 epoch: 61, train_loss: 0.7784, test_loss: 0.8978, test_f1: 0.5883
 epoch: 62, train_loss: 0.7708, test_loss: 0.8979, test_f1: 0.5880
 epoch: 63, train_loss: 0.7736, test_loss: 0.9131, test_f1: 0.5722
 epoch: 64, train_loss: 0.7608, test_loss: 0.9034, test_f1: 0.5838
 epoch: 65, train_loss: 0.7749, test_loss: 0.9269, test_f1: 0.6019
 epoch: 66, train_loss: 0.7767, test_loss: 0.9029, test_f1: 0.5853
 epoch: 67, train_loss: 0.7660, test_loss: 0.9001, test_f1: 0.5944
 epoch: 68, train_loss: 0.7668, test_loss: 0.8991, test_f1: 0.5970
 epoch: 69, train_loss: 0.7639, test_loss: 0.8978, test_f1: 0.5947
 epoch: 70, train_loss: 0.7634, test_loss: 0.9093, test_f1: 0.5915
 epoch: 71, train_loss: 0.7565, test_loss: 0.9061, test_f1: 0.5868
 epoch: 72, train_loss: 0.7550, test_loss: 0.8908, test_f1: 0.5989
 epoch: 73, train_loss: 0.7628, test_loss: 0.8871, test_f1: 0.5923
 epoch: 74, train_loss: 0.7455, test_loss: 0.9016, test_f1: 0.6046
 epoch: 75, train_loss: 0.7523, test_loss: 0.8779, test_f1: 0.6018
 epoch: 76, train_loss: 0.7449, test_loss: 0.8772, test_f1: 0.5886
 epoch: 77, train_loss: 0.7435, test_loss: 0.8793, test_f1: 0.5884
 epoch: 78, train_loss: 0.7519, test_loss: 0.8890, test_f1: 0.5893
 epoch: 79, train_loss: 0.7462, test_loss: 0.8885, test_f1: 0.6129
 epoch: 80, train_loss: 0.7630, test_loss: 0.8706, test_f1: 0.6195
 epoch: 81, train_loss: 0.7569, test_loss: 0.8937, test_f1: 0.5873
 epoch: 82, train_loss: 0.7455, test_loss: 0.9016, test_f1: 0.6033
 epoch: 83, train_loss: 0.7520, test_loss: 0.9229, test_f1: 0.6213
 epoch: 84, train_loss: 0.7215, test_loss: 0.9199, test_f1: 0.6060
 epoch: 85, train_loss: 0.7335, test_loss: 0.9007, test_f1: 0.6102
 epoch: 86, train_loss: 0.7350, test_loss: 0.9173, test_f1: 0.5994
 epoch: 87, train_loss: 0.7327, test_loss: 0.9284, test_f1: 0.5925
 epoch: 88, train_loss: 0.7286, test_loss: 0.9204, test_f1: 0.5905
 epoch: 89, train_loss: 0.7282, test_loss: 0.8998, test_f1: 0.6024
 epoch: 90, train_loss: 0.7370, test_loss: 0.9030, test_f1: 0.5993
 epoch: 91, train_loss: 0.7245, test_loss: 0.9197, test_f1: 0.6028
 epoch: 92, train_loss: 0.7344, test_loss: 0.9304, test_f1: 0.6090
 epoch: 93, train_loss: 0.7240, test_loss: 0.9233, test_f1: 0.6140
 epoch: 94, train_loss: 0.7251, test_loss: 0.8920, test_f1: 0.5904
 epoch: 95, train_loss: 0.7298, test_loss: 0.9137, test_f1: 0.5839
 epoch: 96, train_loss: 0.7259, test_loss: 0.9369, test_f1: 0.6048
 epoch: 97, train_loss: 0.7256, test_loss: 0.9402, test_f1: 0.6030
 epoch: 98, train_loss: 0.7268, test_loss: 0.9518, test_f1: 0.6079
 epoch: 99, train_loss: 0.7198, test_loss: 0.9167, test_f1: 0.6081

Training completed in 1280.69 seconds
Best F1: 0.6235 at epoch 93
Mean F1 across iterations: 0.6080  0.0130
========================FINAL RESULTS================================
FEGIN weighted F1: 0.6235  0.0130
python main.py --data ltspice_examples --representation component_net --model FEGIN --layers 5 --hiddens 64 --batch_size 32 --lr 0.0001 --emb_size 250 --epochs 100 --save_appendix component_net_L5_H64_BS32_LR0.0001_E250 --no_val
-----



STDERR:
  File "main.py", line 370, in <module>
    main()
  File "main.py", line 254, in main
    dataset = dataset_class(
  File "/home/philip/projects/ltspice_examples_code_repo/Circuit-Completion-Using-GNNs/component_classification_with_link_prediction_head/evaluation/FEGIN/kernel/circuit_datasets.py", line 15, in __init__
    self.data, self.slices = torch.load(self.processed_paths[0])
  File "/home/philip/.local/lib/python3.8/site-packages/torch/serialization.py", line 1040, in load
    warnings.warn(
  File "/usr/lib/python3.8/warnings.py", line 109, in _showwarnmsg
    sw(msg.message, msg.category, msg.filename, msg.lineno,
  File "main.py", line 47, in warn_with_traceback
    traceback.print_stack(file=log)
/home/philip/projects/ltspice_examples_code_repo/Circuit-Completion-Using-GNNs/component_classification_with_link_prediction_head/evaluation/FEGIN/kernel/circuit_datasets.py:15: FutureWarning: You are using `torch.load` with `weights_only=False` (the current default value), which uses the default pickle module implicitly. It is possible to construct malicious pickle data which will execute arbitrary code during unpickling (See https://github.com/pytorch/pytorch/blob/main/SECURITY.md#untrusted-models for more details). In a future release, the default value for `weights_only` will be flipped to `True`. This limits the functions that could be executed during unpickling. Arbitrary objects will no longer be allowed to be loaded via this mode unless they are explicitly allowlisted by the user via `torch.serialization.add_safe_globals`. We recommend you start setting `weights_only=True` for any use case where you don't have full control of the loaded file. Please open an issue on GitHub for any issues related to this experimental feature.
  self.data, self.slices = torch.load(self.processed_paths[0])
