STDOUT:
Results will be saved in /home/philip/projects/llm_inference_code_repo/Circuit-Completion-Using-GNNs/component_classification_with_link_prediction_head/evaluation/FEGIN/results/model_FEGIN_dataset_ltspice_examples
Command line input: python main.py --data ltspice_examples --representation component_pin_net --model FEGIN --layers 2 --hiddens 64 --batch_size 256 --lr 0.01 --emb_size 128 --epochs 100 --save_appendix component_pin_net_L2_H64_BS256_LR0.01_E128 --no_val
 is saved.
-----
ltspice_examples - FEGIN
Using 2 layers, 64 hidden units, h = 2
Loading component_pin_net representation dataset
ENTERED
Training FEGIN on component_pin_net representation
Train: 3558, Test: 846
##################ITERATION #0 ****************************************
 epoch: 0, train_loss: 1.2152, test_loss: 1.3297, test_f1: 0.2270
 epoch: 1, train_loss: 1.0361, test_loss: 1.3406, test_f1: 0.2500
 epoch: 2, train_loss: 0.9742, test_loss: 1.0321, test_f1: 0.4866
 epoch: 3, train_loss: 0.9509, test_loss: 0.9862, test_f1: 0.4643
 epoch: 4, train_loss: 0.9427, test_loss: 1.2825, test_f1: 0.4032
 epoch: 5, train_loss: 0.9202, test_loss: 0.9134, test_f1: 0.5321
 epoch: 6, train_loss: 0.8905, test_loss: 0.9606, test_f1: 0.5175
 epoch: 7, train_loss: 0.8689, test_loss: 0.9310, test_f1: 0.5282
 epoch: 8, train_loss: 0.8523, test_loss: 0.8590, test_f1: 0.5221
 epoch: 9, train_loss: 0.8474, test_loss: 1.0475, test_f1: 0.5156
 epoch: 10, train_loss: 0.8318, test_loss: 0.9348, test_f1: 0.4916
 epoch: 11, train_loss: 0.8186, test_loss: 1.2380, test_f1: 0.4701
 epoch: 12, train_loss: 0.7819, test_loss: 0.9103, test_f1: 0.5439
 epoch: 13, train_loss: 0.7850, test_loss: 0.9898, test_f1: 0.5483
 epoch: 14, train_loss: 0.7671, test_loss: 0.9463, test_f1: 0.6157
 epoch: 15, train_loss: 0.7725, test_loss: 0.9237, test_f1: 0.6030
 epoch: 16, train_loss: 0.7466, test_loss: 0.8097, test_f1: 0.6089
 epoch: 17, train_loss: 0.7380, test_loss: 0.8484, test_f1: 0.6060
 epoch: 18, train_loss: 0.7289, test_loss: 0.9175, test_f1: 0.5912
 epoch: 19, train_loss: 0.7106, test_loss: 0.8887, test_f1: 0.5601
 epoch: 20, train_loss: 0.6952, test_loss: 0.8360, test_f1: 0.6185
 epoch: 21, train_loss: 0.6993, test_loss: 1.0102, test_f1: 0.5519
 epoch: 22, train_loss: 0.7063, test_loss: 0.7411, test_f1: 0.6330
 epoch: 23, train_loss: 0.6786, test_loss: 0.8617, test_f1: 0.6223
 epoch: 24, train_loss: 0.6575, test_loss: 0.8832, test_f1: 0.6202
 epoch: 25, train_loss: 0.6411, test_loss: 1.0039, test_f1: 0.5797
 epoch: 26, train_loss: 0.6155, test_loss: 0.9281, test_f1: 0.6395
 epoch: 27, train_loss: 0.6283, test_loss: 1.0023, test_f1: 0.6029
 epoch: 28, train_loss: 0.6148, test_loss: 1.0064, test_f1: 0.6130
 epoch: 29, train_loss: 0.6279, test_loss: 0.9216, test_f1: 0.5845
 epoch: 30, train_loss: 0.6125, test_loss: 0.8521, test_f1: 0.6500
 epoch: 31, train_loss: 0.5842, test_loss: 0.9420, test_f1: 0.6503
 epoch: 32, train_loss: 0.5768, test_loss: 1.2027, test_f1: 0.5994
 epoch: 33, train_loss: 0.5834, test_loss: 0.9568, test_f1: 0.6241
 epoch: 34, train_loss: 0.5746, test_loss: 0.9658, test_f1: 0.6333
 epoch: 35, train_loss: 0.5609, test_loss: 0.8454, test_f1: 0.6815
 epoch: 36, train_loss: 0.5714, test_loss: 0.8717, test_f1: 0.6734
 epoch: 37, train_loss: 0.5493, test_loss: 0.9234, test_f1: 0.5936
 epoch: 38, train_loss: 0.5357, test_loss: 1.2355, test_f1: 0.5895
 epoch: 39, train_loss: 0.5628, test_loss: 1.1732, test_f1: 0.6101
 epoch: 40, train_loss: 0.5415, test_loss: 0.8373, test_f1: 0.6652
 epoch: 41, train_loss: 0.5268, test_loss: 0.9018, test_f1: 0.6656
 epoch: 42, train_loss: 0.5216, test_loss: 1.1346, test_f1: 0.6312
 epoch: 43, train_loss: 0.5378, test_loss: 1.3166, test_f1: 0.6374
 epoch: 44, train_loss: 0.5270, test_loss: 1.0601, test_f1: 0.6639
 epoch: 45, train_loss: 0.5503, test_loss: 1.5865, test_f1: 0.5819
 epoch: 46, train_loss: 0.5155, test_loss: 0.9947, test_f1: 0.6182
 epoch: 47, train_loss: 0.5161, test_loss: 1.0878, test_f1: 0.5824
 epoch: 48, train_loss: 0.4947, test_loss: 0.9403, test_f1: 0.6701
 epoch: 49, train_loss: 0.5019, test_loss: 1.3167, test_f1: 0.5630
 epoch: 50, train_loss: 0.5030, test_loss: 1.0531, test_f1: 0.6101
 epoch: 51, train_loss: 0.4589, test_loss: 0.8354, test_f1: 0.6836
 epoch: 52, train_loss: 0.4315, test_loss: 1.0117, test_f1: 0.6310
 epoch: 53, train_loss: 0.4226, test_loss: 1.0285, test_f1: 0.6523
 epoch: 54, train_loss: 0.4031, test_loss: 0.9216, test_f1: 0.6827
 epoch: 55, train_loss: 0.4138, test_loss: 0.8831, test_f1: 0.6857
 epoch: 56, train_loss: 0.3986, test_loss: 1.1052, test_f1: 0.6775
 epoch: 57, train_loss: 0.3999, test_loss: 0.9817, test_f1: 0.6743
 epoch: 58, train_loss: 0.3931, test_loss: 0.9452, test_f1: 0.7021
 epoch: 59, train_loss: 0.3865, test_loss: 1.0951, test_f1: 0.6815
 epoch: 60, train_loss: 0.3718, test_loss: 0.9344, test_f1: 0.6650
 epoch: 61, train_loss: 0.4062, test_loss: 1.0631, test_f1: 0.6304
 epoch: 62, train_loss: 0.4244, test_loss: 1.0894, test_f1: 0.6732
 epoch: 63, train_loss: 0.4003, test_loss: 1.0736, test_f1: 0.6703
 epoch: 64, train_loss: 0.3924, test_loss: 1.0888, test_f1: 0.6782
 epoch: 65, train_loss: 0.3687, test_loss: 1.1288, test_f1: 0.6857
 epoch: 66, train_loss: 0.3551, test_loss: 0.9859, test_f1: 0.6880
 epoch: 67, train_loss: 0.3637, test_loss: 1.0010, test_f1: 0.6642
 epoch: 68, train_loss: 0.3525, test_loss: 1.0982, test_f1: 0.6658
 epoch: 69, train_loss: 0.3688, test_loss: 1.1055, test_f1: 0.6826
 epoch: 70, train_loss: 0.3620, test_loss: 1.0905, test_f1: 0.6751
 epoch: 71, train_loss: 0.3549, test_loss: 0.9964, test_f1: 0.6783
 epoch: 72, train_loss: 0.3503, test_loss: 1.1634, test_f1: 0.6557
 epoch: 73, train_loss: 0.3547, test_loss: 1.1535, test_f1: 0.6561
 epoch: 74, train_loss: 0.3622, test_loss: 1.0596, test_f1: 0.6707
 epoch: 75, train_loss: 0.3403, test_loss: 1.1107, test_f1: 0.6796
 epoch: 76, train_loss: 0.3409, test_loss: 1.2720, test_f1: 0.6514
 epoch: 77, train_loss: 0.3386, test_loss: 1.1414, test_f1: 0.6440
 epoch: 78, train_loss: 0.3309, test_loss: 1.1105, test_f1: 0.6505
 epoch: 79, train_loss: 0.3411, test_loss: 1.2947, test_f1: 0.6604
 epoch: 80, train_loss: 0.3416, test_loss: 1.2852, test_f1: 0.6743
 epoch: 81, train_loss: 0.3366, test_loss: 1.1124, test_f1: 0.6706
 epoch: 82, train_loss: 0.3343, test_loss: 1.0916, test_f1: 0.6735
 epoch: 83, train_loss: 0.3338, test_loss: 1.2571, test_f1: 0.6616
 epoch: 84, train_loss: 0.3365, test_loss: 1.1906, test_f1: 0.6309
 epoch: 85, train_loss: 0.3291, test_loss: 1.3186, test_f1: 0.6720
 epoch: 86, train_loss: 0.3372, test_loss: 1.1320, test_f1: 0.6527
 epoch: 87, train_loss: 0.3184, test_loss: 1.3435, test_f1: 0.6672
 epoch: 88, train_loss: 0.3173, test_loss: 1.2161, test_f1: 0.6518
 epoch: 89, train_loss: 0.3127, test_loss: 1.2091, test_f1: 0.6756
 epoch: 90, train_loss: 0.2998, test_loss: 1.2056, test_f1: 0.6778
 epoch: 91, train_loss: 0.2994, test_loss: 1.2210, test_f1: 0.6386
 epoch: 92, train_loss: 0.3057, test_loss: 1.3358, test_f1: 0.6699
 epoch: 93, train_loss: 0.3111, test_loss: 1.1647, test_f1: 0.6554
 epoch: 94, train_loss: 0.2855, test_loss: 1.3383, test_f1: 0.6622
 epoch: 95, train_loss: 0.2835, test_loss: 1.3387, test_f1: 0.6615
 epoch: 96, train_loss: 0.2998, test_loss: 1.2151, test_f1: 0.6625
 epoch: 97, train_loss: 0.3014, test_loss: 1.5151, test_f1: 0.6445
 epoch: 98, train_loss: 0.2998, test_loss: 1.5211, test_f1: 0.6084
 epoch: 99, train_loss: 0.3005, test_loss: 1.5269, test_f1: 0.6775
##################ITERATION #1 ****************************************
 epoch: 0, train_loss: 1.1785, test_loss: 1.3912, test_f1: 0.2405
 epoch: 1, train_loss: 0.9977, test_loss: 1.2663, test_f1: 0.2774
 epoch: 2, train_loss: 0.9537, test_loss: 1.0434, test_f1: 0.4907
 epoch: 3, train_loss: 0.9277, test_loss: 0.9288, test_f1: 0.5012
 epoch: 4, train_loss: 0.8982, test_loss: 0.9544, test_f1: 0.4926
 epoch: 5, train_loss: 0.8826, test_loss: 0.9250, test_f1: 0.4820
 epoch: 6, train_loss: 0.8603, test_loss: 0.9356, test_f1: 0.5475
 epoch: 7, train_loss: 0.8310, test_loss: 0.9288, test_f1: 0.5500
 epoch: 8, train_loss: 0.8142, test_loss: 0.8552, test_f1: 0.5678
 epoch: 9, train_loss: 0.8031, test_loss: 0.9080, test_f1: 0.5403
 epoch: 10, train_loss: 0.7801, test_loss: 0.7868, test_f1: 0.6079
 epoch: 11, train_loss: 0.7749, test_loss: 0.9170, test_f1: 0.5460
 epoch: 12, train_loss: 0.7634, test_loss: 0.7915, test_f1: 0.5929
 epoch: 13, train_loss: 0.7518, test_loss: 0.8202, test_f1: 0.5974
 epoch: 14, train_loss: 0.7137, test_loss: 0.8445, test_f1: 0.5824
 epoch: 15, train_loss: 0.7170, test_loss: 0.8015, test_f1: 0.6247
 epoch: 16, train_loss: 0.7008, test_loss: 0.8859, test_f1: 0.5840
 epoch: 17, train_loss: 0.6920, test_loss: 0.8039, test_f1: 0.6381
 epoch: 18, train_loss: 0.6868, test_loss: 0.8080, test_f1: 0.6156
 epoch: 19, train_loss: 0.7115, test_loss: 0.7456, test_f1: 0.6497
 epoch: 20, train_loss: 0.6626, test_loss: 0.8683, test_f1: 0.6076
 epoch: 21, train_loss: 0.6495, test_loss: 0.8722, test_f1: 0.5589
 epoch: 22, train_loss: 0.6413, test_loss: 0.8587, test_f1: 0.6134
 epoch: 23, train_loss: 0.6432, test_loss: 0.8933, test_f1: 0.6031
 epoch: 24, train_loss: 0.6412, test_loss: 0.8257, test_f1: 0.6607
 epoch: 25, train_loss: 0.6218, test_loss: 0.8481, test_f1: 0.6372
 epoch: 26, train_loss: 0.5996, test_loss: 0.7844, test_f1: 0.6422
 epoch: 27, train_loss: 0.6217, test_loss: 0.8580, test_f1: 0.6464
 epoch: 28, train_loss: 0.5987, test_loss: 0.9013, test_f1: 0.6220
 epoch: 29, train_loss: 0.5995, test_loss: 0.9192, test_f1: 0.6132
 epoch: 30, train_loss: 0.6073, test_loss: 1.1262, test_f1: 0.5614
 epoch: 31, train_loss: 0.5886, test_loss: 0.8477, test_f1: 0.6457
 epoch: 32, train_loss: 0.5818, test_loss: 0.9227, test_f1: 0.6037
 epoch: 33, train_loss: 0.5740, test_loss: 0.8215, test_f1: 0.6686
 epoch: 34, train_loss: 0.5607, test_loss: 0.9667, test_f1: 0.6258
 epoch: 35, train_loss: 0.5490, test_loss: 0.8525, test_f1: 0.5958
 epoch: 36, train_loss: 0.5464, test_loss: 0.8788, test_f1: 0.6195
 epoch: 37, train_loss: 0.5235, test_loss: 1.0720, test_f1: 0.6043
 epoch: 38, train_loss: 0.5401, test_loss: 1.0377, test_f1: 0.6536
 epoch: 39, train_loss: 0.5252, test_loss: 0.9691, test_f1: 0.5830
 epoch: 40, train_loss: 0.5251, test_loss: 1.0452, test_f1: 0.6409
 epoch: 41, train_loss: 0.5254, test_loss: 1.4087, test_f1: 0.5403
 epoch: 42, train_loss: 0.5207, test_loss: 1.1330, test_f1: 0.6028
 epoch: 43, train_loss: 0.5192, test_loss: 1.1097, test_f1: 0.5688
 epoch: 44, train_loss: 0.5071, test_loss: 1.0525, test_f1: 0.6138
 epoch: 45, train_loss: 0.5118, test_loss: 1.0998, test_f1: 0.6552
 epoch: 46, train_loss: 0.4768, test_loss: 1.0769, test_f1: 0.6171
 epoch: 47, train_loss: 0.4752, test_loss: 1.0680, test_f1: 0.6381
 epoch: 48, train_loss: 0.4901, test_loss: 1.0090, test_f1: 0.6036
 epoch: 49, train_loss: 0.4801, test_loss: 0.9761, test_f1: 0.6324
 epoch: 50, train_loss: 0.4704, test_loss: 1.1317, test_f1: 0.5694
 epoch: 51, train_loss: 0.4336, test_loss: 1.1329, test_f1: 0.6446
 epoch: 52, train_loss: 0.4109, test_loss: 1.1244, test_f1: 0.6552
 epoch: 53, train_loss: 0.4092, test_loss: 0.9613, test_f1: 0.6643
 epoch: 54, train_loss: 0.4032, test_loss: 1.0248, test_f1: 0.6483
 epoch: 55, train_loss: 0.3871, test_loss: 1.0574, test_f1: 0.6716
 epoch: 56, train_loss: 0.4047, test_loss: 1.0627, test_f1: 0.6494
 epoch: 57, train_loss: 0.3849, test_loss: 1.0191, test_f1: 0.6378
 epoch: 58, train_loss: 0.3844, test_loss: 1.0747, test_f1: 0.6503
 epoch: 59, train_loss: 0.3713, test_loss: 1.1174, test_f1: 0.6589
 epoch: 60, train_loss: 0.3771, test_loss: 1.2519, test_f1: 0.6251
 epoch: 61, train_loss: 0.3785, test_loss: 1.1096, test_f1: 0.6821
 epoch: 62, train_loss: 0.3709, test_loss: 1.2196, test_f1: 0.6532
 epoch: 63, train_loss: 0.3716, test_loss: 1.1655, test_f1: 0.6439
 epoch: 64, train_loss: 0.3680, test_loss: 1.3877, test_f1: 0.6293
 epoch: 65, train_loss: 0.3411, test_loss: 1.2211, test_f1: 0.6306
 epoch: 66, train_loss: 0.3479, test_loss: 1.1955, test_f1: 0.6629
 epoch: 67, train_loss: 0.3588, test_loss: 1.2358, test_f1: 0.6592
 epoch: 68, train_loss: 0.3553, test_loss: 1.2452, test_f1: 0.6464
 epoch: 69, train_loss: 0.3506, test_loss: 1.2586, test_f1: 0.6572
 epoch: 70, train_loss: 0.3343, test_loss: 1.2941, test_f1: 0.6557
 epoch: 71, train_loss: 0.3605, test_loss: 1.3216, test_f1: 0.6331
 epoch: 72, train_loss: 0.3469, test_loss: 1.2524, test_f1: 0.6352
 epoch: 73, train_loss: 0.3562, test_loss: 1.3373, test_f1: 0.6275
 epoch: 74, train_loss: 0.3477, test_loss: 1.3874, test_f1: 0.6306
 epoch: 75, train_loss: 0.3701, test_loss: 1.1537, test_f1: 0.6358
 epoch: 76, train_loss: 0.3384, test_loss: 1.1007, test_f1: 0.6411
 epoch: 77, train_loss: 0.3436, test_loss: 1.2499, test_f1: 0.6681
 epoch: 78, train_loss: 0.3225, test_loss: 1.1110, test_f1: 0.6644
 epoch: 79, train_loss: 0.3251, test_loss: 1.2012, test_f1: 0.6540
 epoch: 80, train_loss: 0.3279, test_loss: 1.3904, test_f1: 0.6679
 epoch: 81, train_loss: 0.3236, test_loss: 1.3171, test_f1: 0.6491
 epoch: 82, train_loss: 0.3098, test_loss: 1.4468, test_f1: 0.6521
 epoch: 83, train_loss: 0.3117, test_loss: 1.3972, test_f1: 0.6506
 epoch: 84, train_loss: 0.3202, test_loss: 1.2091, test_f1: 0.6707
 epoch: 85, train_loss: 0.3047, test_loss: 1.3542, test_f1: 0.6714
 epoch: 86, train_loss: 0.3233, test_loss: 1.4741, test_f1: 0.6273
 epoch: 87, train_loss: 0.3236, test_loss: 1.3769, test_f1: 0.6767
 epoch: 88, train_loss: 0.3287, test_loss: 1.3627, test_f1: 0.6623
 epoch: 89, train_loss: 0.3123, test_loss: 1.3924, test_f1: 0.6680
 epoch: 90, train_loss: 0.3109, test_loss: 1.2311, test_f1: 0.6510
 epoch: 91, train_loss: 0.2869, test_loss: 1.4139, test_f1: 0.6256
 epoch: 92, train_loss: 0.3150, test_loss: 1.3296, test_f1: 0.6705
 epoch: 93, train_loss: 0.3128, test_loss: 1.4032, test_f1: 0.6550
 epoch: 94, train_loss: 0.3218, test_loss: 1.4511, test_f1: 0.6467
 epoch: 95, train_loss: 0.3212, test_loss: 1.2877, test_f1: 0.6628
 epoch: 96, train_loss: 0.2655, test_loss: 1.2923, test_f1: 0.6763
 epoch: 97, train_loss: 0.2867, test_loss: 1.5289, test_f1: 0.6488
 epoch: 98, train_loss: 0.2886, test_loss: 1.5613, test_f1: 0.6571
 epoch: 99, train_loss: 0.2860, test_loss: 1.4465, test_f1: 0.6602
##################ITERATION #2 ****************************************
 epoch: 0, train_loss: 1.4398, test_loss: 1.4334, test_f1: 0.2273
 epoch: 1, train_loss: 1.0448, test_loss: 1.0803, test_f1: 0.3444
 epoch: 2, train_loss: 0.9921, test_loss: 0.9825, test_f1: 0.3899
 epoch: 3, train_loss: 0.9605, test_loss: 0.9516, test_f1: 0.4995
 epoch: 4, train_loss: 0.9362, test_loss: 0.9078, test_f1: 0.5045
 epoch: 5, train_loss: 0.9048, test_loss: 0.9223, test_f1: 0.5797
 epoch: 6, train_loss: 0.8860, test_loss: 0.9555, test_f1: 0.5363
 epoch: 7, train_loss: 0.8682, test_loss: 0.9428, test_f1: 0.5218
 epoch: 8, train_loss: 0.8609, test_loss: 0.8880, test_f1: 0.5311
 epoch: 9, train_loss: 0.8455, test_loss: 0.9175, test_f1: 0.5498
 epoch: 10, train_loss: 0.8193, test_loss: 0.9360, test_f1: 0.5791
 epoch: 11, train_loss: 0.7979, test_loss: 0.8176, test_f1: 0.6096
 epoch: 12, train_loss: 0.7901, test_loss: 0.9321, test_f1: 0.5339
 epoch: 13, train_loss: 0.7729, test_loss: 0.9320, test_f1: 0.5726
 epoch: 14, train_loss: 0.7620, test_loss: 0.9544, test_f1: 0.6064
 epoch: 15, train_loss: 0.7649, test_loss: 1.3384, test_f1: 0.5113
 epoch: 16, train_loss: 0.7550, test_loss: 0.8783, test_f1: 0.5714
 epoch: 17, train_loss: 0.7319, test_loss: 0.9124, test_f1: 0.6098
 epoch: 18, train_loss: 0.7211, test_loss: 0.9841, test_f1: 0.5290
 epoch: 19, train_loss: 0.7069, test_loss: 1.1080, test_f1: 0.4874
 epoch: 20, train_loss: 0.7095, test_loss: 0.8526, test_f1: 0.6430
 epoch: 21, train_loss: 0.7163, test_loss: 0.9668, test_f1: 0.5983
 epoch: 22, train_loss: 0.6849, test_loss: 0.9057, test_f1: 0.5796
 epoch: 23, train_loss: 0.6840, test_loss: 0.9753, test_f1: 0.5700
 epoch: 24, train_loss: 0.6551, test_loss: 0.8810, test_f1: 0.6256
 epoch: 25, train_loss: 0.6564, test_loss: 0.9073, test_f1: 0.6297
 epoch: 26, train_loss: 0.6529, test_loss: 0.8154, test_f1: 0.6349
 epoch: 27, train_loss: 0.6588, test_loss: 1.0268, test_f1: 0.6025
 epoch: 28, train_loss: 0.6451, test_loss: 0.8836, test_f1: 0.6429
 epoch: 29, train_loss: 0.6273, test_loss: 1.2027, test_f1: 0.5601
 epoch: 30, train_loss: 0.6070, test_loss: 0.9859, test_f1: 0.5735
 epoch: 31, train_loss: 0.5975, test_loss: 0.8171, test_f1: 0.6385
 epoch: 32, train_loss: 0.5933, test_loss: 0.8921, test_f1: 0.6302
 epoch: 33, train_loss: 0.6072, test_loss: 0.9741, test_f1: 0.6244
 epoch: 34, train_loss: 0.6066, test_loss: 1.0402, test_f1: 0.5882
 epoch: 35, train_loss: 0.5968, test_loss: 1.0655, test_f1: 0.5842
 epoch: 36, train_loss: 0.5961, test_loss: 1.2842, test_f1: 0.6208
 epoch: 37, train_loss: 0.5840, test_loss: 1.0292, test_f1: 0.6244
 epoch: 38, train_loss: 0.5684, test_loss: 0.9085, test_f1: 0.6359
 epoch: 39, train_loss: 0.5635, test_loss: 1.0353, test_f1: 0.6215
 epoch: 40, train_loss: 0.5569, test_loss: 0.9898, test_f1: 0.6500
 epoch: 41, train_loss: 0.5651, test_loss: 1.1110, test_f1: 0.5929
 epoch: 42, train_loss: 0.5459, test_loss: 1.2404, test_f1: 0.5711
 epoch: 43, train_loss: 0.5402, test_loss: 1.0319, test_f1: 0.6085
 epoch: 44, train_loss: 0.5547, test_loss: 0.9196, test_f1: 0.6518
 epoch: 45, train_loss: 0.5307, test_loss: 1.0843, test_f1: 0.6304
 epoch: 46, train_loss: 0.5354, test_loss: 0.9403, test_f1: 0.6317
 epoch: 47, train_loss: 0.5323, test_loss: 1.0743, test_f1: 0.6139
 epoch: 48, train_loss: 0.5282, test_loss: 0.9533, test_f1: 0.6216
 epoch: 49, train_loss: 0.5153, test_loss: 1.0071, test_f1: 0.6414
 epoch: 50, train_loss: 0.5191, test_loss: 1.2444, test_f1: 0.6465
 epoch: 51, train_loss: 0.5061, test_loss: 1.0021, test_f1: 0.6526
 epoch: 52, train_loss: 0.4718, test_loss: 1.1045, test_f1: 0.6421
 epoch: 53, train_loss: 0.4530, test_loss: 1.0716, test_f1: 0.6545
 epoch: 54, train_loss: 0.4286, test_loss: 1.0554, test_f1: 0.6468
 epoch: 55, train_loss: 0.4294, test_loss: 1.1089, test_f1: 0.6633
 epoch: 56, train_loss: 0.4294, test_loss: 1.1594, test_f1: 0.6387
 epoch: 57, train_loss: 0.4255, test_loss: 1.0263, test_f1: 0.6468
 epoch: 58, train_loss: 0.4257, test_loss: 1.2316, test_f1: 0.6408
 epoch: 59, train_loss: 0.4180, test_loss: 1.1928, test_f1: 0.6317
 epoch: 60, train_loss: 0.4225, test_loss: 1.1919, test_f1: 0.6432
 epoch: 61, train_loss: 0.4176, test_loss: 1.2985, test_f1: 0.6357
 epoch: 62, train_loss: 0.4100, test_loss: 1.0522, test_f1: 0.6393
 epoch: 63, train_loss: 0.3910, test_loss: 1.2589, test_f1: 0.6438
 epoch: 64, train_loss: 0.4062, test_loss: 1.1701, test_f1: 0.6490
 epoch: 65, train_loss: 0.4278, test_loss: 1.3388, test_f1: 0.6401
 epoch: 66, train_loss: 0.3991, test_loss: 1.1198, test_f1: 0.6442
 epoch: 67, train_loss: 0.3860, test_loss: 1.3106, test_f1: 0.6339
 epoch: 68, train_loss: 0.4012, test_loss: 1.4884, test_f1: 0.6431
 epoch: 69, train_loss: 0.4034, test_loss: 1.3183, test_f1: 0.6427
 epoch: 70, train_loss: 0.3888, test_loss: 1.4091, test_f1: 0.6244
 epoch: 71, train_loss: 0.3875, test_loss: 1.2522, test_f1: 0.6329
 epoch: 72, train_loss: 0.3702, test_loss: 1.3079, test_f1: 0.6245
 epoch: 73, train_loss: 0.3859, test_loss: 1.3454, test_f1: 0.6460
 epoch: 74, train_loss: 0.3972, test_loss: 1.4168, test_f1: 0.6252
 epoch: 75, train_loss: 0.3809, test_loss: 1.3650, test_f1: 0.6383
 epoch: 76, train_loss: 0.3849, test_loss: 1.2505, test_f1: 0.6491
 epoch: 77, train_loss: 0.3753, test_loss: 1.1234, test_f1: 0.6458
 epoch: 78, train_loss: 0.3487, test_loss: 1.4033, test_f1: 0.6424
 epoch: 79, train_loss: 0.3723, test_loss: 1.2371, test_f1: 0.6644
 epoch: 80, train_loss: 0.3529, test_loss: 1.2708, test_f1: 0.6654
 epoch: 81, train_loss: 0.3525, test_loss: 1.2923, test_f1: 0.6477
 epoch: 82, train_loss: 0.3485, test_loss: 1.3902, test_f1: 0.6441
 epoch: 83, train_loss: 0.3490, test_loss: 1.3896, test_f1: 0.6475
 epoch: 84, train_loss: 0.3452, test_loss: 1.2246, test_f1: 0.6714
 epoch: 85, train_loss: 0.3610, test_loss: 1.3307, test_f1: 0.6464
 epoch: 86, train_loss: 0.3576, test_loss: 1.4568, test_f1: 0.6221
 epoch: 87, train_loss: 0.3293, test_loss: 1.5764, test_f1: 0.6328
 epoch: 88, train_loss: 0.3711, test_loss: 1.5435, test_f1: 0.6510
 epoch: 89, train_loss: 0.3525, test_loss: 1.3082, test_f1: 0.6513
 epoch: 90, train_loss: 0.3414, test_loss: 1.4283, test_f1: 0.6367
 epoch: 91, train_loss: 0.3475, test_loss: 1.2525, test_f1: 0.6617
 epoch: 92, train_loss: 0.3328, test_loss: 1.3366, test_f1: 0.6663
 epoch: 93, train_loss: 0.3216, test_loss: 1.5353, test_f1: 0.6365
 epoch: 94, train_loss: 0.3468, test_loss: 1.3465, test_f1: 0.6790
 epoch: 95, train_loss: 0.3276, test_loss: 1.4852, test_f1: 0.6510
 epoch: 96, train_loss: 0.3603, test_loss: 1.5032, test_f1: 0.6329
 epoch: 97, train_loss: 0.3321, test_loss: 1.2577, test_f1: 0.6630
 epoch: 98, train_loss: 0.3301, test_loss: 1.5474, test_f1: 0.6332
 epoch: 99, train_loss: 0.3304, test_loss: 1.6912, test_f1: 0.6039
##################ITERATION #3 ****************************************
 epoch: 0, train_loss: 1.7838, test_loss: 1.2582, test_f1: 0.2439
 epoch: 1, train_loss: 1.0599, test_loss: 1.1050, test_f1: 0.3422
 epoch: 2, train_loss: 0.9778, test_loss: 1.0650, test_f1: 0.3816
 epoch: 3, train_loss: 0.9468, test_loss: 0.9488, test_f1: 0.4995
 epoch: 4, train_loss: 0.9256, test_loss: 0.9979, test_f1: 0.5351
 epoch: 5, train_loss: 0.9036, test_loss: 0.9466, test_f1: 0.5117
 epoch: 6, train_loss: 0.8759, test_loss: 0.8479, test_f1: 0.5645
 epoch: 7, train_loss: 0.8627, test_loss: 0.8339, test_f1: 0.5193
 epoch: 8, train_loss: 0.8466, test_loss: 0.8263, test_f1: 0.5246
 epoch: 9, train_loss: 0.8191, test_loss: 0.8595, test_f1: 0.5433
 epoch: 10, train_loss: 0.8117, test_loss: 0.8507, test_f1: 0.5791
 epoch: 11, train_loss: 0.7974, test_loss: 0.8289, test_f1: 0.5698
 epoch: 12, train_loss: 0.7909, test_loss: 1.0043, test_f1: 0.4953
 epoch: 13, train_loss: 0.7842, test_loss: 0.8823, test_f1: 0.5597
 epoch: 14, train_loss: 0.7815, test_loss: 0.8469, test_f1: 0.6115
 epoch: 15, train_loss: 0.7655, test_loss: 0.7821, test_f1: 0.5968
 epoch: 16, train_loss: 0.7516, test_loss: 0.8750, test_f1: 0.5826
 epoch: 17, train_loss: 0.7361, test_loss: 0.8446, test_f1: 0.5986
 epoch: 18, train_loss: 0.7378, test_loss: 0.8919, test_f1: 0.5672
 epoch: 19, train_loss: 0.7245, test_loss: 0.9398, test_f1: 0.5541
 epoch: 20, train_loss: 0.7261, test_loss: 1.0573, test_f1: 0.5350
 epoch: 21, train_loss: 0.6973, test_loss: 0.8618, test_f1: 0.5915
 epoch: 22, train_loss: 0.6962, test_loss: 0.8368, test_f1: 0.6097
 epoch: 23, train_loss: 0.6934, test_loss: 0.8427, test_f1: 0.6027
 epoch: 24, train_loss: 0.6970, test_loss: 0.9703, test_f1: 0.6099
 epoch: 25, train_loss: 0.6870, test_loss: 0.8173, test_f1: 0.6257
 epoch: 26, train_loss: 0.6792, test_loss: 0.8966, test_f1: 0.6019
 epoch: 27, train_loss: 0.6780, test_loss: 0.7892, test_f1: 0.6391
 epoch: 28, train_loss: 0.6539, test_loss: 0.7713, test_f1: 0.6279
 epoch: 29, train_loss: 0.6418, test_loss: 0.9763, test_f1: 0.6282
 epoch: 30, train_loss: 0.6423, test_loss: 0.9358, test_f1: 0.6293
 epoch: 31, train_loss: 0.6530, test_loss: 0.9157, test_f1: 0.6186
 epoch: 32, train_loss: 0.6449, test_loss: 0.8664, test_f1: 0.6275
 epoch: 33, train_loss: 0.6179, test_loss: 0.9518, test_f1: 0.6356
 epoch: 34, train_loss: 0.6173, test_loss: 0.9360, test_f1: 0.6715
 epoch: 35, train_loss: 0.6063, test_loss: 0.8827, test_f1: 0.6191
 epoch: 36, train_loss: 0.6128, test_loss: 1.2862, test_f1: 0.5751
 epoch: 37, train_loss: 0.6302, test_loss: 0.9584, test_f1: 0.6687
 epoch: 38, train_loss: 0.5992, test_loss: 0.9453, test_f1: 0.6746
 epoch: 39, train_loss: 0.5907, test_loss: 1.1332, test_f1: 0.5829
 epoch: 40, train_loss: 0.5813, test_loss: 0.8753, test_f1: 0.6419
 epoch: 41, train_loss: 0.5668, test_loss: 0.9142, test_f1: 0.6688
 epoch: 42, train_loss: 0.5770, test_loss: 0.9236, test_f1: 0.6622
 epoch: 43, train_loss: 0.5757, test_loss: 0.8910, test_f1: 0.6686
 epoch: 44, train_loss: 0.5554, test_loss: 0.8506, test_f1: 0.6301
 epoch: 45, train_loss: 0.5462, test_loss: 0.9593, test_f1: 0.6708
 epoch: 46, train_loss: 0.5434, test_loss: 1.1610, test_f1: 0.6322
 epoch: 47, train_loss: 0.5468, test_loss: 1.0149, test_f1: 0.6709
 epoch: 48, train_loss: 0.5345, test_loss: 0.9447, test_f1: 0.6699
 epoch: 49, train_loss: 0.5365, test_loss: 1.1247, test_f1: 0.6271
 epoch: 50, train_loss: 0.5469, test_loss: 1.2124, test_f1: 0.6140
 epoch: 51, train_loss: 0.5159, test_loss: 1.0943, test_f1: 0.6466
 epoch: 52, train_loss: 0.4894, test_loss: 0.9911, test_f1: 0.6589
 epoch: 53, train_loss: 0.4634, test_loss: 0.9671, test_f1: 0.6711
 epoch: 54, train_loss: 0.4648, test_loss: 0.9955, test_f1: 0.6658
 epoch: 55, train_loss: 0.4583, test_loss: 1.0362, test_f1: 0.6612
 epoch: 56, train_loss: 0.4553, test_loss: 1.0329, test_f1: 0.6669
 epoch: 57, train_loss: 0.4606, test_loss: 1.0206, test_f1: 0.6691
 epoch: 58, train_loss: 0.4381, test_loss: 0.9778, test_f1: 0.6722
 epoch: 59, train_loss: 0.4232, test_loss: 1.1297, test_f1: 0.6605
 epoch: 60, train_loss: 0.4244, test_loss: 1.0975, test_f1: 0.6887
 epoch: 61, train_loss: 0.4432, test_loss: 1.0035, test_f1: 0.6668
 epoch: 62, train_loss: 0.4259, test_loss: 1.1206, test_f1: 0.6758
 epoch: 63, train_loss: 0.4254, test_loss: 1.1507, test_f1: 0.6724
 epoch: 64, train_loss: 0.3906, test_loss: 1.0295, test_f1: 0.6913
 epoch: 65, train_loss: 0.4124, test_loss: 1.0993, test_f1: 0.6776
 epoch: 66, train_loss: 0.3960, test_loss: 1.1212, test_f1: 0.6754
 epoch: 67, train_loss: 0.4070, test_loss: 1.1350, test_f1: 0.6814
 epoch: 68, train_loss: 0.4251, test_loss: 1.2241, test_f1: 0.6845
 epoch: 69, train_loss: 0.4065, test_loss: 1.1455, test_f1: 0.6709
 epoch: 70, train_loss: 0.4119, test_loss: 1.2225, test_f1: 0.6582
 epoch: 71, train_loss: 0.4078, test_loss: 1.1698, test_f1: 0.6660
 epoch: 72, train_loss: 0.3959, test_loss: 1.1866, test_f1: 0.6985
 epoch: 73, train_loss: 0.4143, test_loss: 1.1292, test_f1: 0.6801
 epoch: 74, train_loss: 0.3888, test_loss: 1.1492, test_f1: 0.6801
 epoch: 75, train_loss: 0.3905, test_loss: 1.1673, test_f1: 0.6694
 epoch: 76, train_loss: 0.3867, test_loss: 1.3145, test_f1: 0.6335
 epoch: 77, train_loss: 0.3889, test_loss: 1.2632, test_f1: 0.6980
 epoch: 78, train_loss: 0.3953, test_loss: 1.1758, test_f1: 0.6612
 epoch: 79, train_loss: 0.3819, test_loss: 1.3685, test_f1: 0.6341
 epoch: 80, train_loss: 0.3636, test_loss: 1.3015, test_f1: 0.6714
 epoch: 81, train_loss: 0.3919, test_loss: 1.2852, test_f1: 0.6916
 epoch: 82, train_loss: 0.3810, test_loss: 1.3031, test_f1: 0.6676
 epoch: 83, train_loss: 0.3821, test_loss: 1.2642, test_f1: 0.6571
 epoch: 84, train_loss: 0.3512, test_loss: 1.2000, test_f1: 0.6606
 epoch: 85, train_loss: 0.3472, test_loss: 1.2755, test_f1: 0.6909
 epoch: 86, train_loss: 0.3495, test_loss: 1.2480, test_f1: 0.6620
 epoch: 87, train_loss: 0.3590, test_loss: 1.2903, test_f1: 0.6719
 epoch: 88, train_loss: 0.3628, test_loss: 1.3428, test_f1: 0.6606
 epoch: 89, train_loss: 0.3803, test_loss: 1.3151, test_f1: 0.6802
 epoch: 90, train_loss: 0.3529, test_loss: 1.2307, test_f1: 0.6861
 epoch: 91, train_loss: 0.3263, test_loss: 1.2356, test_f1: 0.6903
 epoch: 92, train_loss: 0.3423, test_loss: 1.2692, test_f1: 0.6739
 epoch: 93, train_loss: 0.3207, test_loss: 1.3643, test_f1: 0.6804
 epoch: 94, train_loss: 0.3123, test_loss: 1.4186, test_f1: 0.6676
 epoch: 95, train_loss: 0.3379, test_loss: 1.2264, test_f1: 0.6714
 epoch: 96, train_loss: 0.3360, test_loss: 1.7421, test_f1: 0.5968
 epoch: 97, train_loss: 0.3752, test_loss: 1.3587, test_f1: 0.6588
 epoch: 98, train_loss: 0.3724, test_loss: 1.2596, test_f1: 0.6669
 epoch: 99, train_loss: 0.3508, test_loss: 1.2612, test_f1: 0.6947
##################ITERATION #4 ****************************************
 epoch: 0, train_loss: 1.5474, test_loss: 1.3803, test_f1: 0.2270
 epoch: 1, train_loss: 1.0260, test_loss: 1.1650, test_f1: 0.3938
 epoch: 2, train_loss: 0.9798, test_loss: 1.0847, test_f1: 0.5105
 epoch: 3, train_loss: 0.9614, test_loss: 1.0098, test_f1: 0.4983
 epoch: 4, train_loss: 0.9466, test_loss: 1.0262, test_f1: 0.4862
 epoch: 5, train_loss: 0.9229, test_loss: 1.0267, test_f1: 0.4866
 epoch: 6, train_loss: 0.9074, test_loss: 1.0200, test_f1: 0.4981
 epoch: 7, train_loss: 0.8952, test_loss: 1.0267, test_f1: 0.5079
 epoch: 8, train_loss: 0.8831, test_loss: 0.9906, test_f1: 0.5279
 epoch: 9, train_loss: 0.8634, test_loss: 0.9325, test_f1: 0.4798
 epoch: 10, train_loss: 0.8463, test_loss: 0.9708, test_f1: 0.5387
 epoch: 11, train_loss: 0.8237, test_loss: 0.9564, test_f1: 0.5718
 epoch: 12, train_loss: 0.8093, test_loss: 0.9474, test_f1: 0.5187
 epoch: 13, train_loss: 0.8023, test_loss: 0.8856, test_f1: 0.5575
 epoch: 14, train_loss: 0.7783, test_loss: 0.8565, test_f1: 0.5876
 epoch: 15, train_loss: 0.7672, test_loss: 0.9769, test_f1: 0.5497
 epoch: 16, train_loss: 0.7542, test_loss: 0.8784, test_f1: 0.5514
 epoch: 17, train_loss: 0.7392, test_loss: 0.7937, test_f1: 0.6492
 epoch: 18, train_loss: 0.7383, test_loss: 0.8884, test_f1: 0.6183
 epoch: 19, train_loss: 0.7347, test_loss: 0.8514, test_f1: 0.6208
 epoch: 20, train_loss: 0.7146, test_loss: 0.9009, test_f1: 0.5996
 epoch: 21, train_loss: 0.7239, test_loss: 1.1257, test_f1: 0.5545
 epoch: 22, train_loss: 0.7127, test_loss: 0.8619, test_f1: 0.5932
 epoch: 23, train_loss: 0.7061, test_loss: 0.8627, test_f1: 0.6113
 epoch: 24, train_loss: 0.6806, test_loss: 0.8700, test_f1: 0.6294
 epoch: 25, train_loss: 0.6740, test_loss: 0.9430, test_f1: 0.5350
 epoch: 26, train_loss: 0.6489, test_loss: 0.9564, test_f1: 0.6048
 epoch: 27, train_loss: 0.6443, test_loss: 0.8331, test_f1: 0.6308
 epoch: 28, train_loss: 0.6346, test_loss: 0.9669, test_f1: 0.6001
 epoch: 29, train_loss: 0.6517, test_loss: 0.8551, test_f1: 0.6451
 epoch: 30, train_loss: 0.6365, test_loss: 0.9190, test_f1: 0.6035
 epoch: 31, train_loss: 0.6170, test_loss: 1.3555, test_f1: 0.5193
 epoch: 32, train_loss: 0.6112, test_loss: 0.8807, test_f1: 0.6332
 epoch: 33, train_loss: 0.6180, test_loss: 0.9749, test_f1: 0.6265
 epoch: 34, train_loss: 0.6285, test_loss: 0.9714, test_f1: 0.6185
 epoch: 35, train_loss: 0.6268, test_loss: 0.8293, test_f1: 0.6664
 epoch: 36, train_loss: 0.6009, test_loss: 1.1646, test_f1: 0.5482
 epoch: 37, train_loss: 0.5854, test_loss: 0.9251, test_f1: 0.5734
 epoch: 38, train_loss: 0.5924, test_loss: 0.9253, test_f1: 0.6110
 epoch: 39, train_loss: 0.6007, test_loss: 0.8779, test_f1: 0.6126
 epoch: 40, train_loss: 0.5735, test_loss: 0.8976, test_f1: 0.6210
 epoch: 41, train_loss: 0.5605, test_loss: 1.0264, test_f1: 0.6055
 epoch: 42, train_loss: 0.5676, test_loss: 0.9529, test_f1: 0.6472
 epoch: 43, train_loss: 0.5772, test_loss: 1.0034, test_f1: 0.6463
 epoch: 44, train_loss: 0.6026, test_loss: 0.9008, test_f1: 0.6603
 epoch: 45, train_loss: 0.5566, test_loss: 0.9198, test_f1: 0.6407
 epoch: 46, train_loss: 0.5485, test_loss: 0.8585, test_f1: 0.6621
 epoch: 47, train_loss: 0.5594, test_loss: 0.8794, test_f1: 0.6441
 epoch: 48, train_loss: 0.5196, test_loss: 1.0391, test_f1: 0.6338
 epoch: 49, train_loss: 0.5138, test_loss: 0.9137, test_f1: 0.6840
 epoch: 50, train_loss: 0.5066, test_loss: 0.9474, test_f1: 0.6673
 epoch: 51, train_loss: 0.4904, test_loss: 0.8776, test_f1: 0.6795
 epoch: 52, train_loss: 0.4484, test_loss: 0.8863, test_f1: 0.6668
 epoch: 53, train_loss: 0.4616, test_loss: 0.9170, test_f1: 0.6727
 epoch: 54, train_loss: 0.4364, test_loss: 0.9883, test_f1: 0.6495
 epoch: 55, train_loss: 0.4406, test_loss: 0.9586, test_f1: 0.6801
 epoch: 56, train_loss: 0.4351, test_loss: 0.9067, test_f1: 0.6647
 epoch: 57, train_loss: 0.4218, test_loss: 0.9541, test_f1: 0.6358
 epoch: 58, train_loss: 0.3903, test_loss: 1.0390, test_f1: 0.6575
 epoch: 59, train_loss: 0.4164, test_loss: 1.0777, test_f1: 0.6505
 epoch: 60, train_loss: 0.4176, test_loss: 1.0400, test_f1: 0.6836
 epoch: 61, train_loss: 0.3957, test_loss: 1.0024, test_f1: 0.6385
 epoch: 62, train_loss: 0.4065, test_loss: 1.1601, test_f1: 0.6292
 epoch: 63, train_loss: 0.4219, test_loss: 0.9780, test_f1: 0.6687
 epoch: 64, train_loss: 0.4298, test_loss: 1.0214, test_f1: 0.6551
 epoch: 65, train_loss: 0.4262, test_loss: 1.0204, test_f1: 0.6617
 epoch: 66, train_loss: 0.3878, test_loss: 0.9790, test_f1: 0.6742
 epoch: 67, train_loss: 0.3964, test_loss: 1.0383, test_f1: 0.6621
 epoch: 68, train_loss: 0.3845, test_loss: 1.0106, test_f1: 0.6807
 epoch: 69, train_loss: 0.3865, test_loss: 1.0694, test_f1: 0.6887
 epoch: 70, train_loss: 0.3844, test_loss: 1.0529, test_f1: 0.6825
 epoch: 71, train_loss: 0.3664, test_loss: 1.0894, test_f1: 0.6830
 epoch: 72, train_loss: 0.3725, test_loss: 1.0341, test_f1: 0.6964
 epoch: 73, train_loss: 0.3859, test_loss: 1.0704, test_f1: 0.6551
 epoch: 74, train_loss: 0.3879, test_loss: 0.9960, test_f1: 0.6684
 epoch: 75, train_loss: 0.3651, test_loss: 1.1282, test_f1: 0.6597
 epoch: 76, train_loss: 0.3532, test_loss: 1.0731, test_f1: 0.6604
 epoch: 77, train_loss: 0.3813, test_loss: 1.0890, test_f1: 0.6605
 epoch: 78, train_loss: 0.3736, test_loss: 1.0807, test_f1: 0.6628
 epoch: 79, train_loss: 0.3818, test_loss: 1.1232, test_f1: 0.6755
 epoch: 80, train_loss: 0.3671, test_loss: 1.0794, test_f1: 0.6810
 epoch: 81, train_loss: 0.3840, test_loss: 1.2122, test_f1: 0.6724
 epoch: 82, train_loss: 0.3655, test_loss: 1.2384, test_f1: 0.6422
 epoch: 83, train_loss: 0.3435, test_loss: 1.1477, test_f1: 0.6832
 epoch: 84, train_loss: 0.3751, test_loss: 1.2005, test_f1: 0.6480
 epoch: 85, train_loss: 0.3693, test_loss: 1.1450, test_f1: 0.6610
 epoch: 86, train_loss: 0.3569, test_loss: 1.1275, test_f1: 0.6846
 epoch: 87, train_loss: 0.3347, test_loss: 1.1549, test_f1: 0.7021
 epoch: 88, train_loss: 0.3294, test_loss: 1.1746, test_f1: 0.6853
 epoch: 89, train_loss: 0.3495, test_loss: 1.2161, test_f1: 0.6692
 epoch: 90, train_loss: 0.3513, test_loss: 1.2682, test_f1: 0.6449
 epoch: 91, train_loss: 0.3594, test_loss: 1.3838, test_f1: 0.6392
 epoch: 92, train_loss: 0.3465, test_loss: 1.2234, test_f1: 0.6530
 epoch: 93, train_loss: 0.3300, test_loss: 1.1478, test_f1: 0.6464
 epoch: 94, train_loss: 0.3389, test_loss: 1.4052, test_f1: 0.6386
 epoch: 95, train_loss: 0.3316, test_loss: 1.3167, test_f1: 0.6045
 epoch: 96, train_loss: 0.3423, test_loss: 1.2232, test_f1: 0.6808
 epoch: 97, train_loss: 0.3260, test_loss: 1.2905, test_f1: 0.6630
 epoch: 98, train_loss: 0.3360, test_loss: 1.0999, test_f1: 0.6791
 epoch: 99, train_loss: 0.3238, test_loss: 1.2636, test_f1: 0.6718
##################ITERATION #5 ****************************************
 epoch: 0, train_loss: 1.3310, test_loss: 1.6913, test_f1: 0.2864
 epoch: 1, train_loss: 0.9921, test_loss: 1.2613, test_f1: 0.3021
 epoch: 2, train_loss: 0.9588, test_loss: 1.0747, test_f1: 0.4069
 epoch: 3, train_loss: 0.9356, test_loss: 1.0093, test_f1: 0.5283
 epoch: 4, train_loss: 0.9152, test_loss: 0.9670, test_f1: 0.5470
 epoch: 5, train_loss: 0.8993, test_loss: 0.9573, test_f1: 0.4918
 epoch: 6, train_loss: 0.8891, test_loss: 0.9439, test_f1: 0.5225
 epoch: 7, train_loss: 0.8571, test_loss: 0.9039, test_f1: 0.5344
 epoch: 8, train_loss: 0.8553, test_loss: 0.9165, test_f1: 0.5913
 epoch: 9, train_loss: 0.8343, test_loss: 0.9612, test_f1: 0.5192
 epoch: 10, train_loss: 0.8317, test_loss: 0.9506, test_f1: 0.5050
 epoch: 11, train_loss: 0.8274, test_loss: 0.9818, test_f1: 0.5720
 epoch: 12, train_loss: 0.7922, test_loss: 0.9090, test_f1: 0.5495
 epoch: 13, train_loss: 0.7893, test_loss: 0.8656, test_f1: 0.6273
 epoch: 14, train_loss: 0.7662, test_loss: 0.8185, test_f1: 0.5975
 epoch: 15, train_loss: 0.7454, test_loss: 0.8524, test_f1: 0.6196
 epoch: 16, train_loss: 0.7528, test_loss: 0.9599, test_f1: 0.6153
 epoch: 17, train_loss: 0.7393, test_loss: 0.8714, test_f1: 0.5740
 epoch: 18, train_loss: 0.7239, test_loss: 0.7889, test_f1: 0.6152
 epoch: 19, train_loss: 0.7019, test_loss: 0.9999, test_f1: 0.5561
 epoch: 20, train_loss: 0.6906, test_loss: 0.9338, test_f1: 0.6079
 epoch: 21, train_loss: 0.7008, test_loss: 0.8895, test_f1: 0.6373
 epoch: 22, train_loss: 0.6988, test_loss: 1.1430, test_f1: 0.5381
 epoch: 23, train_loss: 0.6933, test_loss: 0.9412, test_f1: 0.6064
 epoch: 24, train_loss: 0.6766, test_loss: 0.9137, test_f1: 0.6184
 epoch: 25, train_loss: 0.6641, test_loss: 1.1250, test_f1: 0.5057
 epoch: 26, train_loss: 0.6386, test_loss: 0.9416, test_f1: 0.6147
 epoch: 27, train_loss: 0.6377, test_loss: 0.8834, test_f1: 0.6320
 epoch: 28, train_loss: 0.6256, test_loss: 1.0164, test_f1: 0.6020
 epoch: 29, train_loss: 0.6128, test_loss: 0.9437, test_f1: 0.6436
 epoch: 30, train_loss: 0.5939, test_loss: 0.8309, test_f1: 0.6448
 epoch: 31, train_loss: 0.6268, test_loss: 0.9457, test_f1: 0.6426
 epoch: 32, train_loss: 0.6273, test_loss: 0.9432, test_f1: 0.6231
 epoch: 33, train_loss: 0.5994, test_loss: 0.9847, test_f1: 0.6400
 epoch: 34, train_loss: 0.6028, test_loss: 0.9070, test_f1: 0.6402
 epoch: 35, train_loss: 0.6014, test_loss: 1.0164, test_f1: 0.5852
 epoch: 36, train_loss: 0.5822, test_loss: 1.0142, test_f1: 0.6301
 epoch: 37, train_loss: 0.5603, test_loss: 1.0321, test_f1: 0.6271
 epoch: 38, train_loss: 0.5672, test_loss: 0.9144, test_f1: 0.6471
 epoch: 39, train_loss: 0.5614, test_loss: 1.0408, test_f1: 0.6124
 epoch: 40, train_loss: 0.5626, test_loss: 0.9947, test_f1: 0.6544
 epoch: 41, train_loss: 0.5364, test_loss: 1.0080, test_f1: 0.5994
 epoch: 42, train_loss: 0.5462, test_loss: 1.2618, test_f1: 0.5268
 epoch: 43, train_loss: 0.5410, test_loss: 0.9687, test_f1: 0.6684
 epoch: 44, train_loss: 0.5516, test_loss: 1.1144, test_f1: 0.6313
 epoch: 45, train_loss: 0.5246, test_loss: 1.1346, test_f1: 0.6619
 epoch: 46, train_loss: 0.5219, test_loss: 1.0746, test_f1: 0.6760
 epoch: 47, train_loss: 0.5208, test_loss: 1.1397, test_f1: 0.6592
 epoch: 48, train_loss: 0.5115, test_loss: 1.0876, test_f1: 0.6620
 epoch: 49, train_loss: 0.5377, test_loss: 1.0218, test_f1: 0.6336
 epoch: 50, train_loss: 0.5280, test_loss: 1.0321, test_f1: 0.6349
 epoch: 51, train_loss: 0.4958, test_loss: 1.0438, test_f1: 0.6607
 epoch: 52, train_loss: 0.4552, test_loss: 0.9947, test_f1: 0.6696
 epoch: 53, train_loss: 0.4476, test_loss: 1.1480, test_f1: 0.6589
 epoch: 54, train_loss: 0.4496, test_loss: 1.0354, test_f1: 0.6840
 epoch: 55, train_loss: 0.4360, test_loss: 1.1099, test_f1: 0.6272
 epoch: 56, train_loss: 0.4141, test_loss: 1.0407, test_f1: 0.6769
 epoch: 57, train_loss: 0.4153, test_loss: 1.0791, test_f1: 0.6791
 epoch: 58, train_loss: 0.4046, test_loss: 1.2052, test_f1: 0.6930
 epoch: 59, train_loss: 0.4297, test_loss: 1.1800, test_f1: 0.6754
 epoch: 60, train_loss: 0.4120, test_loss: 1.2037, test_f1: 0.6648
 epoch: 61, train_loss: 0.4109, test_loss: 1.0698, test_f1: 0.6835
 epoch: 62, train_loss: 0.3972, test_loss: 1.1739, test_f1: 0.6618
 epoch: 63, train_loss: 0.3889, test_loss: 1.1779, test_f1: 0.6767
 epoch: 64, train_loss: 0.3815, test_loss: 1.2493, test_f1: 0.6588
 epoch: 65, train_loss: 0.3747, test_loss: 1.3007, test_f1: 0.6613
 epoch: 66, train_loss: 0.3850, test_loss: 1.3114, test_f1: 0.6260
 epoch: 67, train_loss: 0.3657, test_loss: 1.3197, test_f1: 0.6657
 epoch: 68, train_loss: 0.3778, test_loss: 1.1950, test_f1: 0.6692
 epoch: 69, train_loss: 0.3698, test_loss: 1.2640, test_f1: 0.6550
 epoch: 70, train_loss: 0.3805, test_loss: 1.2825, test_f1: 0.6816
 epoch: 71, train_loss: 0.3654, test_loss: 1.1672, test_f1: 0.6816
 epoch: 72, train_loss: 0.3608, test_loss: 1.3020, test_f1: 0.6389
 epoch: 73, train_loss: 0.3671, test_loss: 1.6173, test_f1: 0.6124
 epoch: 74, train_loss: 0.3636, test_loss: 1.2823, test_f1: 0.6571
 epoch: 75, train_loss: 0.3876, test_loss: 1.2604, test_f1: 0.6519
 epoch: 76, train_loss: 0.3974, test_loss: 1.5224, test_f1: 0.6065
 epoch: 77, train_loss: 0.3757, test_loss: 1.2994, test_f1: 0.6569
 epoch: 78, train_loss: 0.3669, test_loss: 1.2594, test_f1: 0.6882
 epoch: 79, train_loss: 0.3575, test_loss: 1.3224, test_f1: 0.6778
 epoch: 80, train_loss: 0.3481, test_loss: 1.2519, test_f1: 0.6835
 epoch: 81, train_loss: 0.3264, test_loss: 1.3937, test_f1: 0.6613
 epoch: 82, train_loss: 0.3440, test_loss: 1.3282, test_f1: 0.6753
 epoch: 83, train_loss: 0.3604, test_loss: 1.4776, test_f1: 0.6599
 epoch: 84, train_loss: 0.3572, test_loss: 1.3792, test_f1: 0.6685
 epoch: 85, train_loss: 0.3654, test_loss: 1.3693, test_f1: 0.6632
 epoch: 86, train_loss: 0.3402, test_loss: 1.5464, test_f1: 0.6569
 epoch: 87, train_loss: 0.3423, test_loss: 1.4666, test_f1: 0.6726
 epoch: 88, train_loss: 0.3378, test_loss: 1.2921, test_f1: 0.6742
 epoch: 89, train_loss: 0.3486, test_loss: 1.3731, test_f1: 0.6782
 epoch: 90, train_loss: 0.3603, test_loss: 1.5525, test_f1: 0.6911
 epoch: 91, train_loss: 0.3393, test_loss: 1.4683, test_f1: 0.6223
 epoch: 92, train_loss: 0.3292, test_loss: 1.4066, test_f1: 0.6867
 epoch: 93, train_loss: 0.3323, test_loss: 1.3913, test_f1: 0.6669
 epoch: 94, train_loss: 0.3175, test_loss: 1.5530, test_f1: 0.6623
 epoch: 95, train_loss: 0.3349, test_loss: 1.5765, test_f1: 0.6585
 epoch: 96, train_loss: 0.3183, test_loss: 1.4804, test_f1: 0.6648
 epoch: 97, train_loss: 0.3126, test_loss: 1.4686, test_f1: 0.6648
 epoch: 98, train_loss: 0.3211, test_loss: 1.4648, test_f1: 0.6810
 epoch: 99, train_loss: 0.3105, test_loss: 1.3766, test_f1: 0.6713
##################ITERATION #6 ****************************************
 epoch: 0, train_loss: 1.4880, test_loss: 1.2227, test_f1: 0.2344
 epoch: 1, train_loss: 1.0637, test_loss: 1.1070, test_f1: 0.3394
 epoch: 2, train_loss: 1.0325, test_loss: 1.0700, test_f1: 0.3898
 epoch: 3, train_loss: 0.9969, test_loss: 1.0111, test_f1: 0.4671
 epoch: 4, train_loss: 0.9580, test_loss: 0.9951, test_f1: 0.4365
 epoch: 5, train_loss: 0.9455, test_loss: 0.9272, test_f1: 0.5525
 epoch: 6, train_loss: 0.9203, test_loss: 0.9441, test_f1: 0.5263
 epoch: 7, train_loss: 0.9025, test_loss: 0.9141, test_f1: 0.5481
 epoch: 8, train_loss: 0.8755, test_loss: 1.0767, test_f1: 0.5008
 epoch: 9, train_loss: 0.8654, test_loss: 0.8874, test_f1: 0.5075
 epoch: 10, train_loss: 0.8579, test_loss: 0.8732, test_f1: 0.5772
 epoch: 11, train_loss: 0.8475, test_loss: 0.8456, test_f1: 0.5316
 epoch: 12, train_loss: 0.8330, test_loss: 0.8809, test_f1: 0.5745
 epoch: 13, train_loss: 0.8048, test_loss: 0.8506, test_f1: 0.6182
 epoch: 14, train_loss: 0.7908, test_loss: 0.8575, test_f1: 0.5746
 epoch: 15, train_loss: 0.7960, test_loss: 0.9913, test_f1: 0.5873
 epoch: 16, train_loss: 0.7767, test_loss: 0.8892, test_f1: 0.5957
 epoch: 17, train_loss: 0.7772, test_loss: 0.8747, test_f1: 0.5768
 epoch: 18, train_loss: 0.7562, test_loss: 0.8848, test_f1: 0.5749
 epoch: 19, train_loss: 0.7449, test_loss: 1.0195, test_f1: 0.5732
 epoch: 20, train_loss: 0.7554, test_loss: 0.8546, test_f1: 0.5941
 epoch: 21, train_loss: 0.7439, test_loss: 0.8437, test_f1: 0.6202
 epoch: 22, train_loss: 0.7193, test_loss: 0.9476, test_f1: 0.5930
 epoch: 23, train_loss: 0.7165, test_loss: 0.8688, test_f1: 0.6179
 epoch: 24, train_loss: 0.7113, test_loss: 1.0199, test_f1: 0.5245
 epoch: 25, train_loss: 0.6930, test_loss: 0.8250, test_f1: 0.6360
 epoch: 26, train_loss: 0.6916, test_loss: 0.9276, test_f1: 0.6398
 epoch: 27, train_loss: 0.6941, test_loss: 0.8226, test_f1: 0.6301
 epoch: 28, train_loss: 0.6789, test_loss: 0.7994, test_f1: 0.6338
 epoch: 29, train_loss: 0.6735, test_loss: 0.9029, test_f1: 0.6161
 epoch: 30, train_loss: 0.6769, test_loss: 0.9993, test_f1: 0.6272
 epoch: 31, train_loss: 0.6704, test_loss: 0.9132, test_f1: 0.6328
 epoch: 32, train_loss: 0.6544, test_loss: 0.8506, test_f1: 0.6422
 epoch: 33, train_loss: 0.6468, test_loss: 0.9523, test_f1: 0.5951
 epoch: 34, train_loss: 0.6565, test_loss: 0.8848, test_f1: 0.6401
 epoch: 35, train_loss: 0.6284, test_loss: 0.8345, test_f1: 0.6394
 epoch: 36, train_loss: 0.6399, test_loss: 0.9795, test_f1: 0.6154
 epoch: 37, train_loss: 0.6322, test_loss: 0.8827, test_f1: 0.6467
 epoch: 38, train_loss: 0.6223, test_loss: 0.7989, test_f1: 0.6746
 epoch: 39, train_loss: 0.5966, test_loss: 0.8996, test_f1: 0.6440
 epoch: 40, train_loss: 0.5982, test_loss: 0.9104, test_f1: 0.6461
 epoch: 41, train_loss: 0.6172, test_loss: 1.0002, test_f1: 0.6539
 epoch: 42, train_loss: 0.6105, test_loss: 0.8753, test_f1: 0.6526
 epoch: 43, train_loss: 0.5825, test_loss: 1.0096, test_f1: 0.6359
 epoch: 44, train_loss: 0.5629, test_loss: 0.9468, test_f1: 0.6436
 epoch: 45, train_loss: 0.5775, test_loss: 0.8733, test_f1: 0.6665
 epoch: 46, train_loss: 0.5606, test_loss: 0.8440, test_f1: 0.6434
 epoch: 47, train_loss: 0.5708, test_loss: 0.9064, test_f1: 0.6471
 epoch: 48, train_loss: 0.5635, test_loss: 0.9289, test_f1: 0.6401
 epoch: 49, train_loss: 0.5544, test_loss: 0.9319, test_f1: 0.6492
 epoch: 50, train_loss: 0.5510, test_loss: 1.0379, test_f1: 0.6305
 epoch: 51, train_loss: 0.5394, test_loss: 0.9240, test_f1: 0.6705
 epoch: 52, train_loss: 0.4998, test_loss: 1.0701, test_f1: 0.6622
 epoch: 53, train_loss: 0.4885, test_loss: 1.0072, test_f1: 0.6691
 epoch: 54, train_loss: 0.4622, test_loss: 0.9766, test_f1: 0.6880
 epoch: 55, train_loss: 0.4612, test_loss: 0.9782, test_f1: 0.6886
 epoch: 56, train_loss: 0.4664, test_loss: 1.0907, test_f1: 0.6659
 epoch: 57, train_loss: 0.4618, test_loss: 1.0505, test_f1: 0.6725
 epoch: 58, train_loss: 0.4524, test_loss: 1.0846, test_f1: 0.6671
 epoch: 59, train_loss: 0.4485, test_loss: 0.9234, test_f1: 0.6787
 epoch: 60, train_loss: 0.4488, test_loss: 0.9375, test_f1: 0.6856
 epoch: 61, train_loss: 0.4390, test_loss: 1.1049, test_f1: 0.6718
 epoch: 62, train_loss: 0.4378, test_loss: 1.2018, test_f1: 0.6707
 epoch: 63, train_loss: 0.4389, test_loss: 1.1972, test_f1: 0.6654
 epoch: 64, train_loss: 0.4556, test_loss: 0.9722, test_f1: 0.6821
 epoch: 65, train_loss: 0.4385, test_loss: 0.9155, test_f1: 0.7028
 epoch: 66, train_loss: 0.4266, test_loss: 1.1172, test_f1: 0.6511
 epoch: 67, train_loss: 0.4280, test_loss: 1.0322, test_f1: 0.6838
 epoch: 68, train_loss: 0.4227, test_loss: 0.9737, test_f1: 0.6856
 epoch: 69, train_loss: 0.3950, test_loss: 0.9739, test_f1: 0.6962
 epoch: 70, train_loss: 0.4139, test_loss: 1.0031, test_f1: 0.6921
 epoch: 71, train_loss: 0.4096, test_loss: 1.0692, test_f1: 0.6772
 epoch: 72, train_loss: 0.4017, test_loss: 1.1309, test_f1: 0.6823
 epoch: 73, train_loss: 0.4160, test_loss: 1.1503, test_f1: 0.6775
 epoch: 74, train_loss: 0.3995, test_loss: 1.1430, test_f1: 0.6796
 epoch: 75, train_loss: 0.3948, test_loss: 1.0916, test_f1: 0.6863
 epoch: 76, train_loss: 0.4100, test_loss: 1.1640, test_f1: 0.6868
 epoch: 77, train_loss: 0.3985, test_loss: 1.0516, test_f1: 0.6715
 epoch: 78, train_loss: 0.3615, test_loss: 1.0553, test_f1: 0.6903
 epoch: 79, train_loss: 0.3698, test_loss: 1.2832, test_f1: 0.6820
 epoch: 80, train_loss: 0.3883, test_loss: 1.1754, test_f1: 0.6734
 epoch: 81, train_loss: 0.3846, test_loss: 1.1602, test_f1: 0.6894
 epoch: 82, train_loss: 0.3931, test_loss: 1.2905, test_f1: 0.6436
 epoch: 83, train_loss: 0.3883, test_loss: 1.5592, test_f1: 0.6259
 epoch: 84, train_loss: 0.3863, test_loss: 1.1387, test_f1: 0.6887
 epoch: 85, train_loss: 0.4077, test_loss: 1.1351, test_f1: 0.6943
 epoch: 86, train_loss: 0.3764, test_loss: 1.1348, test_f1: 0.6904
 epoch: 87, train_loss: 0.3623, test_loss: 1.1669, test_f1: 0.6920
 epoch: 88, train_loss: 0.3707, test_loss: 1.2014, test_f1: 0.6708
 epoch: 89, train_loss: 0.3784, test_loss: 1.1984, test_f1: 0.6800
 epoch: 90, train_loss: 0.3516, test_loss: 1.2478, test_f1: 0.6693
 epoch: 91, train_loss: 0.3724, test_loss: 1.1134, test_f1: 0.6779
 epoch: 92, train_loss: 0.3724, test_loss: 1.2483, test_f1: 0.6785
 epoch: 93, train_loss: 0.3593, test_loss: 1.2248, test_f1: 0.6680
 epoch: 94, train_loss: 0.3492, test_loss: 1.2299, test_f1: 0.7074
 epoch: 95, train_loss: 0.3533, test_loss: 1.2493, test_f1: 0.6884
 epoch: 96, train_loss: 0.3427, test_loss: 1.2353, test_f1: 0.6773
 epoch: 97, train_loss: 0.3456, test_loss: 1.2866, test_f1: 0.6753
 epoch: 98, train_loss: 0.3306, test_loss: 1.3631, test_f1: 0.6931
 epoch: 99, train_loss: 0.3504, test_loss: 1.3127, test_f1: 0.6911
##################ITERATION #7 ****************************************
 epoch: 0, train_loss: 1.6524, test_loss: 1.6245, test_f1: 0.2377
 epoch: 1, train_loss: 1.0503, test_loss: 1.1017, test_f1: 0.3567
 epoch: 2, train_loss: 1.0100, test_loss: 1.0494, test_f1: 0.3815
 epoch: 3, train_loss: 0.9666, test_loss: 0.9854, test_f1: 0.4582
 epoch: 4, train_loss: 0.9361, test_loss: 0.9890, test_f1: 0.4750
 epoch: 5, train_loss: 0.9243, test_loss: 1.1086, test_f1: 0.3816
 epoch: 6, train_loss: 0.9096, test_loss: 1.1046, test_f1: 0.4572
 epoch: 7, train_loss: 0.9085, test_loss: 1.0065, test_f1: 0.5374
 epoch: 8, train_loss: 0.8797, test_loss: 0.9721, test_f1: 0.5274
 epoch: 9, train_loss: 0.8752, test_loss: 0.9475, test_f1: 0.5278
 epoch: 10, train_loss: 0.8544, test_loss: 0.9480, test_f1: 0.5429
 epoch: 11, train_loss: 0.8477, test_loss: 1.5241, test_f1: 0.3383
 epoch: 12, train_loss: 0.8216, test_loss: 0.9500, test_f1: 0.5741
 epoch: 13, train_loss: 0.8093, test_loss: 1.1430, test_f1: 0.4854
 epoch: 14, train_loss: 0.8136, test_loss: 0.8907, test_f1: 0.5717
 epoch: 15, train_loss: 0.7926, test_loss: 0.9061, test_f1: 0.5623
 epoch: 16, train_loss: 0.7940, test_loss: 0.9603, test_f1: 0.5393
 epoch: 17, train_loss: 0.7819, test_loss: 0.8980, test_f1: 0.5655
 epoch: 18, train_loss: 0.7524, test_loss: 0.9232, test_f1: 0.5846
 epoch: 19, train_loss: 0.7370, test_loss: 1.1193, test_f1: 0.5118
 epoch: 20, train_loss: 0.7332, test_loss: 1.0656, test_f1: 0.5540
 epoch: 21, train_loss: 0.7302, test_loss: 0.9600, test_f1: 0.5756
 epoch: 22, train_loss: 0.6993, test_loss: 0.8442, test_f1: 0.5950
 epoch: 23, train_loss: 0.7023, test_loss: 0.8165, test_f1: 0.5901
 epoch: 24, train_loss: 0.6931, test_loss: 0.9453, test_f1: 0.5819
 epoch: 25, train_loss: 0.6932, test_loss: 1.1058, test_f1: 0.4839
 epoch: 26, train_loss: 0.6858, test_loss: 0.9583, test_f1: 0.5975
 epoch: 27, train_loss: 0.6710, test_loss: 0.9675, test_f1: 0.5736
 epoch: 28, train_loss: 0.6645, test_loss: 0.8965, test_f1: 0.6268
 epoch: 29, train_loss: 0.6573, test_loss: 0.8335, test_f1: 0.6261
 epoch: 30, train_loss: 0.6466, test_loss: 0.9099, test_f1: 0.6122
 epoch: 31, train_loss: 0.6512, test_loss: 0.9204, test_f1: 0.5880
 epoch: 32, train_loss: 0.6599, test_loss: 0.9444, test_f1: 0.6148
 epoch: 33, train_loss: 0.6447, test_loss: 0.9753, test_f1: 0.5430
 epoch: 34, train_loss: 0.6414, test_loss: 0.9385, test_f1: 0.6053
 epoch: 35, train_loss: 0.6256, test_loss: 0.8496, test_f1: 0.6512
 epoch: 36, train_loss: 0.6298, test_loss: 0.9758, test_f1: 0.6072
 epoch: 37, train_loss: 0.6145, test_loss: 0.9785, test_f1: 0.5912
 epoch: 38, train_loss: 0.6075, test_loss: 0.9478, test_f1: 0.6136
 epoch: 39, train_loss: 0.6382, test_loss: 0.8656, test_f1: 0.6341
 epoch: 40, train_loss: 0.6194, test_loss: 0.9031, test_f1: 0.6224
 epoch: 41, train_loss: 0.5815, test_loss: 0.8834, test_f1: 0.6271
 epoch: 42, train_loss: 0.5629, test_loss: 0.9507, test_f1: 0.6278
 epoch: 43, train_loss: 0.5833, test_loss: 1.0152, test_f1: 0.5714
 epoch: 44, train_loss: 0.5801, test_loss: 0.9221, test_f1: 0.6174
 epoch: 45, train_loss: 0.5840, test_loss: 1.0612, test_f1: 0.5899
 epoch: 46, train_loss: 0.5862, test_loss: 0.9555, test_f1: 0.6465
 epoch: 47, train_loss: 0.5442, test_loss: 0.9043, test_f1: 0.6277
 epoch: 48, train_loss: 0.5439, test_loss: 1.0174, test_f1: 0.5877
 epoch: 49, train_loss: 0.5457, test_loss: 0.8341, test_f1: 0.6418
 epoch: 50, train_loss: 0.5391, test_loss: 1.0869, test_f1: 0.6231
 epoch: 51, train_loss: 0.5049, test_loss: 0.8181, test_f1: 0.6848
 epoch: 52, train_loss: 0.4766, test_loss: 0.8155, test_f1: 0.6698
 epoch: 53, train_loss: 0.4786, test_loss: 0.8227, test_f1: 0.6737
 epoch: 54, train_loss: 0.4585, test_loss: 0.8699, test_f1: 0.6757
 epoch: 55, train_loss: 0.4750, test_loss: 0.7627, test_f1: 0.7037
 epoch: 56, train_loss: 0.4646, test_loss: 0.8959, test_f1: 0.6494
 epoch: 57, train_loss: 0.4454, test_loss: 0.8765, test_f1: 0.6577
 epoch: 58, train_loss: 0.4706, test_loss: 1.0422, test_f1: 0.6609
 epoch: 59, train_loss: 0.4673, test_loss: 0.9596, test_f1: 0.6427
 epoch: 60, train_loss: 0.4360, test_loss: 0.8264, test_f1: 0.6993
 epoch: 61, train_loss: 0.4429, test_loss: 0.9466, test_f1: 0.6533
 epoch: 62, train_loss: 0.4544, test_loss: 0.9828, test_f1: 0.6593
 epoch: 63, train_loss: 0.4500, test_loss: 0.8318, test_f1: 0.6856
 epoch: 64, train_loss: 0.4476, test_loss: 0.9808, test_f1: 0.6799
 epoch: 65, train_loss: 0.4465, test_loss: 1.0697, test_f1: 0.6354
 epoch: 66, train_loss: 0.4231, test_loss: 0.9736, test_f1: 0.6573
 epoch: 67, train_loss: 0.4523, test_loss: 0.9502, test_f1: 0.6930
 epoch: 68, train_loss: 0.4430, test_loss: 0.9963, test_f1: 0.6601
 epoch: 69, train_loss: 0.4261, test_loss: 0.9414, test_f1: 0.6390
 epoch: 70, train_loss: 0.4170, test_loss: 0.8914, test_f1: 0.6670
 epoch: 71, train_loss: 0.4098, test_loss: 1.0035, test_f1: 0.6546
 epoch: 72, train_loss: 0.4165, test_loss: 0.9872, test_f1: 0.6548
 epoch: 73, train_loss: 0.4083, test_loss: 0.9391, test_f1: 0.6662
 epoch: 74, train_loss: 0.4141, test_loss: 0.9727, test_f1: 0.6584
 epoch: 75, train_loss: 0.3945, test_loss: 1.0280, test_f1: 0.6422
 epoch: 76, train_loss: 0.4110, test_loss: 1.0655, test_f1: 0.6540
 epoch: 77, train_loss: 0.3888, test_loss: 0.9818, test_f1: 0.6711
 epoch: 78, train_loss: 0.3913, test_loss: 1.0036, test_f1: 0.6739
 epoch: 79, train_loss: 0.3890, test_loss: 0.9491, test_f1: 0.6891
 epoch: 80, train_loss: 0.3963, test_loss: 1.0405, test_f1: 0.6779
 epoch: 81, train_loss: 0.4023, test_loss: 1.0430, test_f1: 0.6312
 epoch: 82, train_loss: 0.3999, test_loss: 1.0456, test_f1: 0.6470
 epoch: 83, train_loss: 0.4024, test_loss: 1.0533, test_f1: 0.6648
 epoch: 84, train_loss: 0.3817, test_loss: 0.9820, test_f1: 0.6680
 epoch: 85, train_loss: 0.3771, test_loss: 1.0629, test_f1: 0.6478
 epoch: 86, train_loss: 0.4204, test_loss: 0.9484, test_f1: 0.6808
 epoch: 87, train_loss: 0.3809, test_loss: 0.9654, test_f1: 0.6747
 epoch: 88, train_loss: 0.3748, test_loss: 1.1216, test_f1: 0.6749
 epoch: 89, train_loss: 0.3791, test_loss: 1.0058, test_f1: 0.6668
 epoch: 90, train_loss: 0.3701, test_loss: 1.0860, test_f1: 0.6595
 epoch: 91, train_loss: 0.3751, test_loss: 1.0168, test_f1: 0.6964
 epoch: 92, train_loss: 0.3571, test_loss: 0.9587, test_f1: 0.6486
 epoch: 93, train_loss: 0.3694, test_loss: 1.0488, test_f1: 0.6361
 epoch: 94, train_loss: 0.3604, test_loss: 1.3837, test_f1: 0.6419
 epoch: 95, train_loss: 0.3788, test_loss: 0.9681, test_f1: 0.6613
 epoch: 96, train_loss: 0.3548, test_loss: 1.1524, test_f1: 0.6410
 epoch: 97, train_loss: 0.3622, test_loss: 0.9750, test_f1: 0.6809
 epoch: 98, train_loss: 0.3750, test_loss: 1.0619, test_f1: 0.6703
 epoch: 99, train_loss: 0.3791, test_loss: 1.1240, test_f1: 0.6269
##################ITERATION #8 ****************************************
 epoch: 0, train_loss: 1.7385, test_loss: 1.1914, test_f1: 0.2650
 epoch: 1, train_loss: 1.0678, test_loss: 1.0755, test_f1: 0.4649
 epoch: 2, train_loss: 1.0395, test_loss: 1.1950, test_f1: 0.4470
 epoch: 3, train_loss: 1.0210, test_loss: 1.0624, test_f1: 0.4413
 epoch: 4, train_loss: 0.9948, test_loss: 1.0568, test_f1: 0.4660
 epoch: 5, train_loss: 0.9688, test_loss: 1.0088, test_f1: 0.4717
 epoch: 6, train_loss: 0.9468, test_loss: 1.0519, test_f1: 0.4782
 epoch: 7, train_loss: 0.9234, test_loss: 0.9445, test_f1: 0.4744
 epoch: 8, train_loss: 0.9091, test_loss: 1.0465, test_f1: 0.5350
 epoch: 9, train_loss: 0.8919, test_loss: 1.0725, test_f1: 0.4851
 epoch: 10, train_loss: 0.8969, test_loss: 1.0260, test_f1: 0.4541
 epoch: 11, train_loss: 0.8869, test_loss: 0.9235, test_f1: 0.5228
 epoch: 12, train_loss: 0.8550, test_loss: 0.9997, test_f1: 0.5091
 epoch: 13, train_loss: 0.8515, test_loss: 1.1026, test_f1: 0.4813
 epoch: 14, train_loss: 0.8408, test_loss: 0.9315, test_f1: 0.5326
 epoch: 15, train_loss: 0.8282, test_loss: 0.9610, test_f1: 0.5220
 epoch: 16, train_loss: 0.8153, test_loss: 0.9552, test_f1: 0.5458
 epoch: 17, train_loss: 0.7997, test_loss: 0.8740, test_f1: 0.5537
 epoch: 18, train_loss: 0.8115, test_loss: 0.9076, test_f1: 0.5402
 epoch: 19, train_loss: 0.7809, test_loss: 1.0516, test_f1: 0.4906
 epoch: 20, train_loss: 0.7609, test_loss: 0.8637, test_f1: 0.5909
 epoch: 21, train_loss: 0.7777, test_loss: 0.8349, test_f1: 0.5712
 epoch: 22, train_loss: 0.7845, test_loss: 0.8450, test_f1: 0.5663
 epoch: 23, train_loss: 0.7580, test_loss: 0.8734, test_f1: 0.6069
 epoch: 24, train_loss: 0.7394, test_loss: 0.8515, test_f1: 0.5781
 epoch: 25, train_loss: 0.7333, test_loss: 0.9392, test_f1: 0.5499
 epoch: 26, train_loss: 0.7159, test_loss: 0.8483, test_f1: 0.6120
 epoch: 27, train_loss: 0.7154, test_loss: 1.0458, test_f1: 0.5583
 epoch: 28, train_loss: 0.7068, test_loss: 0.9265, test_f1: 0.5973
 epoch: 29, train_loss: 0.6983, test_loss: 0.9899, test_f1: 0.5618
 epoch: 30, train_loss: 0.7291, test_loss: 0.9051, test_f1: 0.5920
 epoch: 31, train_loss: 0.7106, test_loss: 0.8456, test_f1: 0.6295
 epoch: 32, train_loss: 0.6847, test_loss: 0.9080, test_f1: 0.5977
 epoch: 33, train_loss: 0.6881, test_loss: 0.7906, test_f1: 0.6274
 epoch: 34, train_loss: 0.6826, test_loss: 0.9486, test_f1: 0.5648
 epoch: 35, train_loss: 0.6695, test_loss: 0.9127, test_f1: 0.5852
 epoch: 36, train_loss: 0.6726, test_loss: 0.7934, test_f1: 0.6185
 epoch: 37, train_loss: 0.6644, test_loss: 0.9938, test_f1: 0.5878
 epoch: 38, train_loss: 0.6476, test_loss: 0.9527, test_f1: 0.6309
 epoch: 39, train_loss: 0.6513, test_loss: 0.8191, test_f1: 0.5905
 epoch: 40, train_loss: 0.6407, test_loss: 0.9230, test_f1: 0.6408
 epoch: 41, train_loss: 0.6464, test_loss: 1.0368, test_f1: 0.5831
 epoch: 42, train_loss: 0.6366, test_loss: 0.9072, test_f1: 0.6678
 epoch: 43, train_loss: 0.6104, test_loss: 0.8566, test_f1: 0.6121
 epoch: 44, train_loss: 0.6185, test_loss: 1.0378, test_f1: 0.5785
 epoch: 45, train_loss: 0.6065, test_loss: 0.9524, test_f1: 0.5956
 epoch: 46, train_loss: 0.6040, test_loss: 0.8329, test_f1: 0.6453
 epoch: 47, train_loss: 0.5949, test_loss: 0.9441, test_f1: 0.6155
 epoch: 48, train_loss: 0.5975, test_loss: 1.1444, test_f1: 0.5274
 epoch: 49, train_loss: 0.5826, test_loss: 0.9296, test_f1: 0.6036
 epoch: 50, train_loss: 0.5914, test_loss: 0.9506, test_f1: 0.6471
 epoch: 51, train_loss: 0.5703, test_loss: 1.0003, test_f1: 0.6073
 epoch: 52, train_loss: 0.5445, test_loss: 1.0465, test_f1: 0.6060
 epoch: 53, train_loss: 0.5442, test_loss: 0.8658, test_f1: 0.6467
 epoch: 54, train_loss: 0.5345, test_loss: 0.8450, test_f1: 0.7064
 epoch: 55, train_loss: 0.5216, test_loss: 1.0499, test_f1: 0.6172
 epoch: 56, train_loss: 0.5226, test_loss: 0.9758, test_f1: 0.6391
 epoch: 57, train_loss: 0.5026, test_loss: 0.8846, test_f1: 0.6525
 epoch: 58, train_loss: 0.5245, test_loss: 1.0800, test_f1: 0.6262
 epoch: 59, train_loss: 0.5093, test_loss: 1.0364, test_f1: 0.6250
 epoch: 60, train_loss: 0.5030, test_loss: 0.9700, test_f1: 0.6544
 epoch: 61, train_loss: 0.4954, test_loss: 0.8757, test_f1: 0.6473
 epoch: 62, train_loss: 0.4884, test_loss: 1.0792, test_f1: 0.6233
 epoch: 63, train_loss: 0.4945, test_loss: 1.1190, test_f1: 0.6213
 epoch: 64, train_loss: 0.4954, test_loss: 0.9855, test_f1: 0.6569
 epoch: 65, train_loss: 0.4984, test_loss: 0.9855, test_f1: 0.6572
 epoch: 66, train_loss: 0.4924, test_loss: 1.1156, test_f1: 0.6295
 epoch: 67, train_loss: 0.4888, test_loss: 1.0128, test_f1: 0.6147
 epoch: 68, train_loss: 0.4942, test_loss: 0.9298, test_f1: 0.6331
 epoch: 69, train_loss: 0.4736, test_loss: 1.0960, test_f1: 0.6332
 epoch: 70, train_loss: 0.4602, test_loss: 1.0311, test_f1: 0.6312
 epoch: 71, train_loss: 0.4416, test_loss: 1.0040, test_f1: 0.6557
 epoch: 72, train_loss: 0.4598, test_loss: 1.0921, test_f1: 0.6337
 epoch: 73, train_loss: 0.4730, test_loss: 1.1099, test_f1: 0.6131
 epoch: 74, train_loss: 0.4720, test_loss: 0.9790, test_f1: 0.6568
 epoch: 75, train_loss: 0.4518, test_loss: 0.9914, test_f1: 0.6418
 epoch: 76, train_loss: 0.4504, test_loss: 1.0749, test_f1: 0.6333
 epoch: 77, train_loss: 0.4387, test_loss: 1.0779, test_f1: 0.6286
 epoch: 78, train_loss: 0.4383, test_loss: 1.0334, test_f1: 0.6720
 epoch: 79, train_loss: 0.4586, test_loss: 1.2690, test_f1: 0.6219
 epoch: 80, train_loss: 0.4456, test_loss: 1.0365, test_f1: 0.6406
 epoch: 81, train_loss: 0.4469, test_loss: 1.0733, test_f1: 0.6594
 epoch: 82, train_loss: 0.4467, test_loss: 1.1410, test_f1: 0.6146
 epoch: 83, train_loss: 0.4632, test_loss: 1.1092, test_f1: 0.6182
 epoch: 84, train_loss: 0.4480, test_loss: 1.1823, test_f1: 0.6403
 epoch: 85, train_loss: 0.4523, test_loss: 1.1005, test_f1: 0.6555
 epoch: 86, train_loss: 0.4450, test_loss: 1.0730, test_f1: 0.6510
 epoch: 87, train_loss: 0.4350, test_loss: 1.1057, test_f1: 0.6050
 epoch: 88, train_loss: 0.4438, test_loss: 1.0643, test_f1: 0.6415
 epoch: 89, train_loss: 0.4143, test_loss: 1.1934, test_f1: 0.6218
 epoch: 90, train_loss: 0.4228, test_loss: 1.0295, test_f1: 0.6485
 epoch: 91, train_loss: 0.4001, test_loss: 1.1309, test_f1: 0.6431
 epoch: 92, train_loss: 0.4142, test_loss: 1.2127, test_f1: 0.6330
 epoch: 93, train_loss: 0.4225, test_loss: 1.1254, test_f1: 0.6465
 epoch: 94, train_loss: 0.4068, test_loss: 1.1339, test_f1: 0.6360
 epoch: 95, train_loss: 0.4038, test_loss: 1.1770, test_f1: 0.6474
 epoch: 96, train_loss: 0.4213, test_loss: 1.1566, test_f1: 0.6521
 epoch: 97, train_loss: 0.4190, test_loss: 1.1575, test_f1: 0.6353
 epoch: 98, train_loss: 0.4238, test_loss: 1.1483, test_f1: 0.6558
 epoch: 99, train_loss: 0.4190, test_loss: 1.1291, test_f1: 0.6363
##################ITERATION #9 ****************************************
 epoch: 0, train_loss: 1.4066, test_loss: 1.5562, test_f1: 0.2311
 epoch: 1, train_loss: 1.0051, test_loss: 1.2115, test_f1: 0.3056
 epoch: 2, train_loss: 0.9726, test_loss: 0.9970, test_f1: 0.4716
 epoch: 3, train_loss: 0.9505, test_loss: 0.9703, test_f1: 0.4802
 epoch: 4, train_loss: 0.9392, test_loss: 0.9447, test_f1: 0.5138
 epoch: 5, train_loss: 0.9092, test_loss: 0.9590, test_f1: 0.5075
 epoch: 6, train_loss: 0.8908, test_loss: 1.0348, test_f1: 0.4813
 epoch: 7, train_loss: 0.8750, test_loss: 0.8864, test_f1: 0.5753
 epoch: 8, train_loss: 0.8704, test_loss: 0.9967, test_f1: 0.4830
 epoch: 9, train_loss: 0.8712, test_loss: 0.8855, test_f1: 0.5491
 epoch: 10, train_loss: 0.8564, test_loss: 0.8784, test_f1: 0.5311
 epoch: 11, train_loss: 0.8340, test_loss: 0.8395, test_f1: 0.5459
 epoch: 12, train_loss: 0.8340, test_loss: 0.8509, test_f1: 0.5854
 epoch: 13, train_loss: 0.8165, test_loss: 0.8771, test_f1: 0.5662
 epoch: 14, train_loss: 0.8049, test_loss: 0.9168, test_f1: 0.5528
 epoch: 15, train_loss: 0.7877, test_loss: 0.9655, test_f1: 0.5294
 epoch: 16, train_loss: 0.7979, test_loss: 0.8857, test_f1: 0.5231
 epoch: 17, train_loss: 0.7833, test_loss: 0.9085, test_f1: 0.5856
 epoch: 18, train_loss: 0.7895, test_loss: 0.9283, test_f1: 0.5326
 epoch: 19, train_loss: 0.7915, test_loss: 0.8935, test_f1: 0.5770
 epoch: 20, train_loss: 0.7745, test_loss: 0.8509, test_f1: 0.5968
 epoch: 21, train_loss: 0.7494, test_loss: 0.8903, test_f1: 0.6251
 epoch: 22, train_loss: 0.7446, test_loss: 0.9953, test_f1: 0.5602
 epoch: 23, train_loss: 0.7321, test_loss: 0.9310, test_f1: 0.5530
 epoch: 24, train_loss: 0.7351, test_loss: 0.9804, test_f1: 0.6178
 epoch: 25, train_loss: 0.7310, test_loss: 0.8863, test_f1: 0.6027
 epoch: 26, train_loss: 0.7128, test_loss: 0.9599, test_f1: 0.5999
 epoch: 27, train_loss: 0.7005, test_loss: 0.8984, test_f1: 0.6083
 epoch: 28, train_loss: 0.6910, test_loss: 1.0653, test_f1: 0.6045
 epoch: 29, train_loss: 0.6774, test_loss: 0.9402, test_f1: 0.5963
 epoch: 30, train_loss: 0.6631, test_loss: 0.9792, test_f1: 0.6073
 epoch: 31, train_loss: 0.6615, test_loss: 1.0478, test_f1: 0.5900
 epoch: 32, train_loss: 0.6778, test_loss: 0.8519, test_f1: 0.6304
 epoch: 33, train_loss: 0.6578, test_loss: 0.9696, test_f1: 0.6098
 epoch: 34, train_loss: 0.6499, test_loss: 1.0245, test_f1: 0.6094
 epoch: 35, train_loss: 0.6716, test_loss: 1.3456, test_f1: 0.5520
 epoch: 36, train_loss: 0.6453, test_loss: 1.2999, test_f1: 0.5601
 epoch: 37, train_loss: 0.6636, test_loss: 1.1507, test_f1: 0.5927
 epoch: 38, train_loss: 0.6404, test_loss: 1.1095, test_f1: 0.6413
 epoch: 39, train_loss: 0.6363, test_loss: 1.3306, test_f1: 0.6062
 epoch: 40, train_loss: 0.6333, test_loss: 1.1894, test_f1: 0.6058
 epoch: 41, train_loss: 0.6259, test_loss: 1.1283, test_f1: 0.6193
 epoch: 42, train_loss: 0.6027, test_loss: 1.2286, test_f1: 0.5625
 epoch: 43, train_loss: 0.5955, test_loss: 1.0070, test_f1: 0.6385
 epoch: 44, train_loss: 0.6036, test_loss: 1.1664, test_f1: 0.6006
 epoch: 45, train_loss: 0.6149, test_loss: 1.1326, test_f1: 0.6107
 epoch: 46, train_loss: 0.6049, test_loss: 1.3745, test_f1: 0.5951
 epoch: 47, train_loss: 0.5989, test_loss: 1.0890, test_f1: 0.6119
 epoch: 48, train_loss: 0.5842, test_loss: 1.1393, test_f1: 0.6218
 epoch: 49, train_loss: 0.5732, test_loss: 1.0534, test_f1: 0.6420
 epoch: 50, train_loss: 0.5527, test_loss: 1.0686, test_f1: 0.6457
 epoch: 51, train_loss: 0.5385, test_loss: 1.0640, test_f1: 0.6837
 epoch: 52, train_loss: 0.5348, test_loss: 1.0955, test_f1: 0.6756
 epoch: 53, train_loss: 0.5178, test_loss: 1.1249, test_f1: 0.6551
 epoch: 54, train_loss: 0.4958, test_loss: 1.1316, test_f1: 0.6705
 epoch: 55, train_loss: 0.5063, test_loss: 1.0839, test_f1: 0.6761
 epoch: 56, train_loss: 0.4867, test_loss: 1.0788, test_f1: 0.6640
 epoch: 57, train_loss: 0.4884, test_loss: 1.0703, test_f1: 0.6805
 epoch: 58, train_loss: 0.4787, test_loss: 1.1331, test_f1: 0.6634
 epoch: 59, train_loss: 0.4594, test_loss: 1.0627, test_f1: 0.6725
 epoch: 60, train_loss: 0.4612, test_loss: 1.1538, test_f1: 0.6609
 epoch: 61, train_loss: 0.4501, test_loss: 1.1165, test_f1: 0.6386
 epoch: 62, train_loss: 0.4697, test_loss: 1.0843, test_f1: 0.6551
 epoch: 63, train_loss: 0.4594, test_loss: 1.0595, test_f1: 0.6392
 epoch: 64, train_loss: 0.4763, test_loss: 1.0480, test_f1: 0.6351
 epoch: 65, train_loss: 0.4795, test_loss: 1.2124, test_f1: 0.6387
 epoch: 66, train_loss: 0.4636, test_loss: 1.2063, test_f1: 0.6677
 epoch: 67, train_loss: 0.4453, test_loss: 1.2114, test_f1: 0.6330
 epoch: 68, train_loss: 0.4421, test_loss: 1.2367, test_f1: 0.6353
 epoch: 69, train_loss: 0.4458, test_loss: 1.1158, test_f1: 0.6599
 epoch: 70, train_loss: 0.4439, test_loss: 1.3272, test_f1: 0.6213
 epoch: 71, train_loss: 0.4353, test_loss: 1.3016, test_f1: 0.6605
 epoch: 72, train_loss: 0.4426, test_loss: 1.1840, test_f1: 0.6543
 epoch: 73, train_loss: 0.4300, test_loss: 1.2722, test_f1: 0.6475
 epoch: 74, train_loss: 0.4200, test_loss: 1.1811, test_f1: 0.6620
 epoch: 75, train_loss: 0.4023, test_loss: 1.2873, test_f1: 0.6623
 epoch: 76, train_loss: 0.4110, test_loss: 1.3744, test_f1: 0.6598
 epoch: 77, train_loss: 0.4097, test_loss: 1.2226, test_f1: 0.6738
 epoch: 78, train_loss: 0.4063, test_loss: 1.3473, test_f1: 0.6457
 epoch: 79, train_loss: 0.4047, test_loss: 1.4200, test_f1: 0.6679
 epoch: 80, train_loss: 0.4297, test_loss: 1.1216, test_f1: 0.6607
 epoch: 81, train_loss: 0.4118, test_loss: 1.2717, test_f1: 0.6765
 epoch: 82, train_loss: 0.3934, test_loss: 1.3964, test_f1: 0.6446
 epoch: 83, train_loss: 0.4128, test_loss: 1.3835, test_f1: 0.6617
 epoch: 84, train_loss: 0.4085, test_loss: 1.2263, test_f1: 0.6524
 epoch: 85, train_loss: 0.4028, test_loss: 1.3405, test_f1: 0.6592
 epoch: 86, train_loss: 0.3966, test_loss: 1.2671, test_f1: 0.6588
 epoch: 87, train_loss: 0.4086, test_loss: 1.3981, test_f1: 0.6867
 epoch: 88, train_loss: 0.3730, test_loss: 1.1677, test_f1: 0.6442
 epoch: 89, train_loss: 0.3933, test_loss: 1.5182, test_f1: 0.6448
 epoch: 90, train_loss: 0.3937, test_loss: 1.5602, test_f1: 0.6539
 epoch: 91, train_loss: 0.3851, test_loss: 1.3378, test_f1: 0.6520
 epoch: 92, train_loss: 0.3658, test_loss: 1.3981, test_f1: 0.6593
 epoch: 93, train_loss: 0.4100, test_loss: 1.4503, test_f1: 0.6693
 epoch: 94, train_loss: 0.4059, test_loss: 1.5086, test_f1: 0.6608
 epoch: 95, train_loss: 0.3934, test_loss: 1.4960, test_f1: 0.6528
 epoch: 96, train_loss: 0.3829, test_loss: 1.5361, test_f1: 0.6573
 epoch: 97, train_loss: 0.3669, test_loss: 1.4313, test_f1: 0.6734
 epoch: 98, train_loss: 0.3635, test_loss: 1.4107, test_f1: 0.6551
 epoch: 99, train_loss: 0.3654, test_loss: 1.3144, test_f1: 0.6558

Training completed in 683.56 seconds
Best F1: 0.7074 at epoch 94
Mean F1 across iterations: 0.6961  0.0098
========================FINAL RESULTS================================
FEGIN weighted F1: 0.7074  0.0098
python main.py --data ltspice_examples --representation component_pin_net --model FEGIN --layers 2 --hiddens 64 --batch_size 256 --lr 0.01 --emb_size 128 --epochs 100 --save_appendix component_pin_net_L2_H64_BS256_LR0.01_E128 --no_val
-----



STDERR:
  File "main.py", line 370, in <module>
    main()
  File "main.py", line 254, in main
    dataset = dataset_class(
  File "/home/philip/projects/llm_inference_code_repo/Circuit-Completion-Using-GNNs/component_classification_with_link_prediction_head/evaluation/FEGIN/kernel/circuit_datasets.py", line 15, in __init__
    self.data, self.slices = torch.load(self.processed_paths[0])
  File "/home/philip/.local/lib/python3.8/site-packages/torch/serialization.py", line 1040, in load
    warnings.warn(
  File "/usr/lib/python3.8/warnings.py", line 109, in _showwarnmsg
    sw(msg.message, msg.category, msg.filename, msg.lineno,
  File "main.py", line 47, in warn_with_traceback
    traceback.print_stack(file=log)
/home/philip/projects/llm_inference_code_repo/Circuit-Completion-Using-GNNs/component_classification_with_link_prediction_head/evaluation/FEGIN/kernel/circuit_datasets.py:15: FutureWarning: You are using `torch.load` with `weights_only=False` (the current default value), which uses the default pickle module implicitly. It is possible to construct malicious pickle data which will execute arbitrary code during unpickling (See https://github.com/pytorch/pytorch/blob/main/SECURITY.md#untrusted-models for more details). In a future release, the default value for `weights_only` will be flipped to `True`. This limits the functions that could be executed during unpickling. Arbitrary objects will no longer be allowed to be loaded via this mode unless they are explicitly allowlisted by the user via `torch.serialization.add_safe_globals`. We recommend you start setting `weights_only=True` for any use case where you don't have full control of the loaded file. Please open an issue on GitHub for any issues related to this experimental feature.
  self.data, self.slices = torch.load(self.processed_paths[0])
