STDOUT:
Results will be saved in /home/philip/projects/ltspice_examples_code_repo/Circuit-Completion-Using-GNNs/component_classification_with_link_prediction_head/evaluation/FEGIN/results/model_FEGIN_dataset_ltspice_demos
Command line input: python main.py --data ltspice_demos --representation component_net --model FEGIN --layers 5 --hiddens 16 --batch_size 256 --lr 0.001 --emb_size 512 --epochs 100 --save_appendix component_net_L5_H16_BS256_LR0.001_E512 --no_val
 is saved.
-----
ltspice_demos - FEGIN
Using 5 layers, 16 hidden units, h = 2
Loading component_net representation dataset
ENTERED
Training FEGIN on component_net representation
Train: 1565, Test: 383
##################ITERATION #0 ****************************************
 epoch: 0, train_loss: 1.4551, test_loss: 1.4354, test_f1: 0.0507
 epoch: 1, train_loss: 1.4397, test_loss: 1.4300, test_f1: 0.0507
 epoch: 2, train_loss: 1.4298, test_loss: 1.4246, test_f1: 0.0507
 epoch: 3, train_loss: 1.4205, test_loss: 1.4190, test_f1: 0.0507
 epoch: 4, train_loss: 1.4084, test_loss: 1.4132, test_f1: 0.0507
 epoch: 5, train_loss: 1.3956, test_loss: 1.4051, test_f1: 0.0876
 epoch: 6, train_loss: 1.3827, test_loss: 1.3933, test_f1: 0.1934
 epoch: 7, train_loss: 1.3634, test_loss: 1.3767, test_f1: 0.2488
 epoch: 8, train_loss: 1.3445, test_loss: 1.3594, test_f1: 0.2615
 epoch: 9, train_loss: 1.3195, test_loss: 1.3420, test_f1: 0.3025
 epoch: 10, train_loss: 1.2959, test_loss: 1.3240, test_f1: 0.3090
 epoch: 11, train_loss: 1.2654, test_loss: 1.3022, test_f1: 0.3216
 epoch: 12, train_loss: 1.2491, test_loss: 1.2791, test_f1: 0.2971
 epoch: 13, train_loss: 1.2278, test_loss: 1.2683, test_f1: 0.2906
 epoch: 14, train_loss: 1.2122, test_loss: 1.2613, test_f1: 0.3103
 epoch: 15, train_loss: 1.2031, test_loss: 1.2510, test_f1: 0.3487
 epoch: 16, train_loss: 1.1865, test_loss: 1.2497, test_f1: 0.3385
 epoch: 17, train_loss: 1.1753, test_loss: 1.2334, test_f1: 0.3261
 epoch: 18, train_loss: 1.1850, test_loss: 1.2242, test_f1: 0.3255
 epoch: 19, train_loss: 1.1696, test_loss: 1.2312, test_f1: 0.3212
 epoch: 20, train_loss: 1.1577, test_loss: 1.2182, test_f1: 0.3164
 epoch: 21, train_loss: 1.1543, test_loss: 1.2030, test_f1: 0.3261
 epoch: 22, train_loss: 1.1425, test_loss: 1.2009, test_f1: 0.3527
 epoch: 23, train_loss: 1.1387, test_loss: 1.2174, test_f1: 0.3660
 epoch: 24, train_loss: 1.1308, test_loss: 1.2075, test_f1: 0.3555
 epoch: 25, train_loss: 1.1204, test_loss: 1.1975, test_f1: 0.3600
 epoch: 26, train_loss: 1.1268, test_loss: 1.2033, test_f1: 0.3501
 epoch: 27, train_loss: 1.1285, test_loss: 1.2089, test_f1: 0.3602
 epoch: 28, train_loss: 1.1087, test_loss: 1.1935, test_f1: 0.3497
 epoch: 29, train_loss: 1.1106, test_loss: 1.1765, test_f1: 0.3879
 epoch: 30, train_loss: 1.1095, test_loss: 1.1823, test_f1: 0.3833
 epoch: 31, train_loss: 1.1034, test_loss: 1.1742, test_f1: 0.3895
 epoch: 32, train_loss: 1.1020, test_loss: 1.1668, test_f1: 0.3849
 epoch: 33, train_loss: 1.1052, test_loss: 1.1781, test_f1: 0.3767
 epoch: 34, train_loss: 1.1016, test_loss: 1.1737, test_f1: 0.3775
 epoch: 35, train_loss: 1.0900, test_loss: 1.1766, test_f1: 0.3777
 epoch: 36, train_loss: 1.0740, test_loss: 1.1660, test_f1: 0.3798
 epoch: 37, train_loss: 1.0873, test_loss: 1.1658, test_f1: 0.3710
 epoch: 38, train_loss: 1.0778, test_loss: 1.1811, test_f1: 0.3776
 epoch: 39, train_loss: 1.0741, test_loss: 1.1853, test_f1: 0.3752
 epoch: 40, train_loss: 1.0675, test_loss: 1.1705, test_f1: 0.3990
 epoch: 41, train_loss: 1.0627, test_loss: 1.1693, test_f1: 0.3982
 epoch: 42, train_loss: 1.0628, test_loss: 1.1713, test_f1: 0.3956
 epoch: 43, train_loss: 1.0549, test_loss: 1.1835, test_f1: 0.3871
 epoch: 44, train_loss: 1.0598, test_loss: 1.1568, test_f1: 0.4081
 epoch: 45, train_loss: 1.0584, test_loss: 1.1851, test_f1: 0.4165
 epoch: 46, train_loss: 1.0607, test_loss: 1.2032, test_f1: 0.4060
 epoch: 47, train_loss: 1.0558, test_loss: 1.1760, test_f1: 0.4018
 epoch: 48, train_loss: 1.0586, test_loss: 1.1870, test_f1: 0.4151
 epoch: 49, train_loss: 1.0498, test_loss: 1.1840, test_f1: 0.4065
 epoch: 50, train_loss: 1.0525, test_loss: 1.1468, test_f1: 0.4268
 epoch: 51, train_loss: 1.0487, test_loss: 1.1467, test_f1: 0.4231
 epoch: 52, train_loss: 1.0474, test_loss: 1.1526, test_f1: 0.4111
 epoch: 53, train_loss: 1.0410, test_loss: 1.1793, test_f1: 0.4162
 epoch: 54, train_loss: 1.0373, test_loss: 1.1769, test_f1: 0.4187
 epoch: 55, train_loss: 1.0407, test_loss: 1.1570, test_f1: 0.4209
 epoch: 56, train_loss: 1.0362, test_loss: 1.1721, test_f1: 0.4173
 epoch: 57, train_loss: 1.0297, test_loss: 1.1610, test_f1: 0.4371
 epoch: 58, train_loss: 1.0366, test_loss: 1.1389, test_f1: 0.4285
 epoch: 59, train_loss: 1.0308, test_loss: 1.1330, test_f1: 0.4303
 epoch: 60, train_loss: 1.0297, test_loss: 1.1410, test_f1: 0.4393
 epoch: 61, train_loss: 1.0215, test_loss: 1.1374, test_f1: 0.4411
 epoch: 62, train_loss: 1.0173, test_loss: 1.1553, test_f1: 0.4500
 epoch: 63, train_loss: 1.0263, test_loss: 1.1712, test_f1: 0.4468
 epoch: 64, train_loss: 1.0255, test_loss: 1.1531, test_f1: 0.4361
 epoch: 65, train_loss: 1.0339, test_loss: 1.1370, test_f1: 0.4466
 epoch: 66, train_loss: 1.0250, test_loss: 1.1317, test_f1: 0.4618
 epoch: 67, train_loss: 1.0270, test_loss: 1.1197, test_f1: 0.4572
 epoch: 68, train_loss: 1.0074, test_loss: 1.1309, test_f1: 0.4583
 epoch: 69, train_loss: 1.0075, test_loss: 1.1338, test_f1: 0.4636
 epoch: 70, train_loss: 1.0081, test_loss: 1.1324, test_f1: 0.4546
 epoch: 71, train_loss: 1.0121, test_loss: 1.1491, test_f1: 0.4484
 epoch: 72, train_loss: 1.0048, test_loss: 1.1727, test_f1: 0.4573
 epoch: 73, train_loss: 1.0011, test_loss: 1.1717, test_f1: 0.4824
 epoch: 74, train_loss: 1.0095, test_loss: 1.1642, test_f1: 0.4889
 epoch: 75, train_loss: 1.0070, test_loss: 1.1412, test_f1: 0.5035
 epoch: 76, train_loss: 1.0033, test_loss: 1.1379, test_f1: 0.5257
 epoch: 77, train_loss: 1.0024, test_loss: 1.1427, test_f1: 0.5479
 epoch: 78, train_loss: 1.0109, test_loss: 1.1524, test_f1: 0.5433
 epoch: 79, train_loss: 0.9992, test_loss: 1.1438, test_f1: 0.5325
 epoch: 80, train_loss: 0.9978, test_loss: 1.1553, test_f1: 0.5315
 epoch: 81, train_loss: 0.9953, test_loss: 1.1600, test_f1: 0.5463
 epoch: 82, train_loss: 0.9972, test_loss: 1.1632, test_f1: 0.5469
 epoch: 83, train_loss: 0.9958, test_loss: 1.1406, test_f1: 0.5435
 epoch: 84, train_loss: 0.9977, test_loss: 1.1258, test_f1: 0.5273
 epoch: 85, train_loss: 0.9972, test_loss: 1.1392, test_f1: 0.5377
 epoch: 86, train_loss: 0.9914, test_loss: 1.1585, test_f1: 0.5445
 epoch: 87, train_loss: 0.9927, test_loss: 1.1570, test_f1: 0.5285
 epoch: 88, train_loss: 1.0009, test_loss: 1.1464, test_f1: 0.5073
 epoch: 89, train_loss: 0.9905, test_loss: 1.1398, test_f1: 0.5300
 epoch: 90, train_loss: 0.9966, test_loss: 1.1448, test_f1: 0.5395
 epoch: 91, train_loss: 0.9823, test_loss: 1.1656, test_f1: 0.5221
 epoch: 92, train_loss: 0.9824, test_loss: 1.1591, test_f1: 0.5297
 epoch: 93, train_loss: 0.9843, test_loss: 1.1765, test_f1: 0.5344
 epoch: 94, train_loss: 0.9734, test_loss: 1.1784, test_f1: 0.5404
 epoch: 95, train_loss: 0.9887, test_loss: 1.1640, test_f1: 0.5329
 epoch: 96, train_loss: 0.9786, test_loss: 1.1964, test_f1: 0.5245
 epoch: 97, train_loss: 0.9824, test_loss: 1.2085, test_f1: 0.5176
 epoch: 98, train_loss: 0.9830, test_loss: 1.1562, test_f1: 0.5031
 epoch: 99, train_loss: 0.9783, test_loss: 1.1417, test_f1: 0.5141
##################ITERATION #1 ****************************************
 epoch: 0, train_loss: 1.3598, test_loss: 1.3686, test_f1: 0.1365
 epoch: 1, train_loss: 1.3040, test_loss: 1.3516, test_f1: 0.1365
 epoch: 2, train_loss: 1.2804, test_loss: 1.3387, test_f1: 0.1368
 epoch: 3, train_loss: 1.2519, test_loss: 1.3261, test_f1: 0.3162
 epoch: 4, train_loss: 1.2313, test_loss: 1.3120, test_f1: 0.2722
 epoch: 5, train_loss: 1.2106, test_loss: 1.2951, test_f1: 0.2722
 epoch: 6, train_loss: 1.1943, test_loss: 1.2751, test_f1: 0.2465
 epoch: 7, train_loss: 1.1766, test_loss: 1.2586, test_f1: 0.2315
 epoch: 8, train_loss: 1.1704, test_loss: 1.2445, test_f1: 0.2283
 epoch: 9, train_loss: 1.1486, test_loss: 1.2283, test_f1: 0.2340
 epoch: 10, train_loss: 1.1496, test_loss: 1.2198, test_f1: 0.2368
 epoch: 11, train_loss: 1.1409, test_loss: 1.2101, test_f1: 0.2397
 epoch: 12, train_loss: 1.1279, test_loss: 1.2084, test_f1: 0.2526
 epoch: 13, train_loss: 1.1330, test_loss: 1.2122, test_f1: 0.2509
 epoch: 14, train_loss: 1.1168, test_loss: 1.1964, test_f1: 0.2650
 epoch: 15, train_loss: 1.1160, test_loss: 1.1912, test_f1: 0.3134
 epoch: 16, train_loss: 1.1108, test_loss: 1.1872, test_f1: 0.3703
 epoch: 17, train_loss: 1.1077, test_loss: 1.1937, test_f1: 0.3468
 epoch: 18, train_loss: 1.1068, test_loss: 1.1980, test_f1: 0.3610
 epoch: 19, train_loss: 1.1002, test_loss: 1.2018, test_f1: 0.3621
 epoch: 20, train_loss: 1.0938, test_loss: 1.1947, test_f1: 0.3844
 epoch: 21, train_loss: 1.0843, test_loss: 1.1830, test_f1: 0.3929
 epoch: 22, train_loss: 1.0889, test_loss: 1.1853, test_f1: 0.3828
 epoch: 23, train_loss: 1.0805, test_loss: 1.1952, test_f1: 0.4018
 epoch: 24, train_loss: 1.0875, test_loss: 1.1809, test_f1: 0.4021
 epoch: 25, train_loss: 1.0767, test_loss: 1.1724, test_f1: 0.4001
 epoch: 26, train_loss: 1.0699, test_loss: 1.1681, test_f1: 0.3943
 epoch: 27, train_loss: 1.0654, test_loss: 1.1674, test_f1: 0.3926
 epoch: 28, train_loss: 1.0715, test_loss: 1.1610, test_f1: 0.3957
 epoch: 29, train_loss: 1.0577, test_loss: 1.1726, test_f1: 0.4005
 epoch: 30, train_loss: 1.0548, test_loss: 1.1793, test_f1: 0.3954
 epoch: 31, train_loss: 1.0369, test_loss: 1.1690, test_f1: 0.4018
 epoch: 32, train_loss: 1.0538, test_loss: 1.1788, test_f1: 0.3952
 epoch: 33, train_loss: 1.0432, test_loss: 1.2001, test_f1: 0.3967
 epoch: 34, train_loss: 1.0438, test_loss: 1.1908, test_f1: 0.4165
 epoch: 35, train_loss: 1.0328, test_loss: 1.1981, test_f1: 0.4248
 epoch: 36, train_loss: 1.0345, test_loss: 1.2119, test_f1: 0.4049
 epoch: 37, train_loss: 1.0310, test_loss: 1.1899, test_f1: 0.3940
 epoch: 38, train_loss: 1.0262, test_loss: 1.1705, test_f1: 0.4099
 epoch: 39, train_loss: 1.0322, test_loss: 1.1694, test_f1: 0.4250
 epoch: 40, train_loss: 1.0283, test_loss: 1.1795, test_f1: 0.4179
 epoch: 41, train_loss: 1.0090, test_loss: 1.1803, test_f1: 0.4132
 epoch: 42, train_loss: 1.0123, test_loss: 1.1787, test_f1: 0.3984
 epoch: 43, train_loss: 1.0236, test_loss: 1.1965, test_f1: 0.4155
 epoch: 44, train_loss: 1.0052, test_loss: 1.1835, test_f1: 0.4341
 epoch: 45, train_loss: 0.9970, test_loss: 1.1783, test_f1: 0.4426
 epoch: 46, train_loss: 1.0068, test_loss: 1.1812, test_f1: 0.4483
 epoch: 47, train_loss: 0.9980, test_loss: 1.1747, test_f1: 0.4633
 epoch: 48, train_loss: 0.9912, test_loss: 1.1506, test_f1: 0.4503
 epoch: 49, train_loss: 0.9979, test_loss: 1.1705, test_f1: 0.4348
 epoch: 50, train_loss: 0.9980, test_loss: 1.1888, test_f1: 0.4567
 epoch: 51, train_loss: 0.9989, test_loss: 1.1849, test_f1: 0.4448
 epoch: 52, train_loss: 1.0004, test_loss: 1.1826, test_f1: 0.4583
 epoch: 53, train_loss: 0.9935, test_loss: 1.1653, test_f1: 0.4689
 epoch: 54, train_loss: 0.9814, test_loss: 1.1659, test_f1: 0.4631
 epoch: 55, train_loss: 0.9817, test_loss: 1.1695, test_f1: 0.4609
 epoch: 56, train_loss: 0.9794, test_loss: 1.1685, test_f1: 0.4822
 epoch: 57, train_loss: 0.9707, test_loss: 1.1814, test_f1: 0.4738
 epoch: 58, train_loss: 0.9692, test_loss: 1.1985, test_f1: 0.4850
 epoch: 59, train_loss: 0.9676, test_loss: 1.2061, test_f1: 0.4924
 epoch: 60, train_loss: 0.9618, test_loss: 1.2006, test_f1: 0.4942
 epoch: 61, train_loss: 0.9694, test_loss: 1.1953, test_f1: 0.4879
 epoch: 62, train_loss: 0.9683, test_loss: 1.1857, test_f1: 0.4841
 epoch: 63, train_loss: 0.9687, test_loss: 1.1829, test_f1: 0.4728
 epoch: 64, train_loss: 0.9737, test_loss: 1.2026, test_f1: 0.4626
 epoch: 65, train_loss: 0.9694, test_loss: 1.1847, test_f1: 0.4952
 epoch: 66, train_loss: 0.9580, test_loss: 1.1721, test_f1: 0.4754
 epoch: 67, train_loss: 0.9584, test_loss: 1.1825, test_f1: 0.4584
 epoch: 68, train_loss: 0.9564, test_loss: 1.1729, test_f1: 0.4658
 epoch: 69, train_loss: 0.9572, test_loss: 1.1778, test_f1: 0.4949
 epoch: 70, train_loss: 0.9583, test_loss: 1.1878, test_f1: 0.4977
 epoch: 71, train_loss: 0.9565, test_loss: 1.1991, test_f1: 0.5202
 epoch: 72, train_loss: 0.9501, test_loss: 1.1917, test_f1: 0.4963
 epoch: 73, train_loss: 0.9540, test_loss: 1.1803, test_f1: 0.4994
 epoch: 74, train_loss: 0.9458, test_loss: 1.1640, test_f1: 0.4631
 epoch: 75, train_loss: 0.9520, test_loss: 1.1602, test_f1: 0.4747
 epoch: 76, train_loss: 0.9599, test_loss: 1.1826, test_f1: 0.5021
 epoch: 77, train_loss: 0.9504, test_loss: 1.1806, test_f1: 0.4935
 epoch: 78, train_loss: 0.9423, test_loss: 1.1871, test_f1: 0.4751
 epoch: 79, train_loss: 0.9458, test_loss: 1.1935, test_f1: 0.5040
 epoch: 80, train_loss: 0.9481, test_loss: 1.1743, test_f1: 0.5044
 epoch: 81, train_loss: 0.9292, test_loss: 1.1791, test_f1: 0.5040
 epoch: 82, train_loss: 0.9483, test_loss: 1.1982, test_f1: 0.4944
 epoch: 83, train_loss: 0.9440, test_loss: 1.1805, test_f1: 0.4949
 epoch: 84, train_loss: 0.9479, test_loss: 1.1567, test_f1: 0.4928
 epoch: 85, train_loss: 0.9354, test_loss: 1.1645, test_f1: 0.5000
 epoch: 86, train_loss: 0.9298, test_loss: 1.1782, test_f1: 0.5053
 epoch: 87, train_loss: 0.9299, test_loss: 1.1871, test_f1: 0.5142
 epoch: 88, train_loss: 0.9282, test_loss: 1.1916, test_f1: 0.5176
 epoch: 89, train_loss: 0.9353, test_loss: 1.1921, test_f1: 0.5069
 epoch: 90, train_loss: 0.9318, test_loss: 1.1725, test_f1: 0.5291
 epoch: 91, train_loss: 0.9396, test_loss: 1.1850, test_f1: 0.5103
 epoch: 92, train_loss: 0.9355, test_loss: 1.1708, test_f1: 0.5151
 epoch: 93, train_loss: 0.9354, test_loss: 1.1728, test_f1: 0.5206
 epoch: 94, train_loss: 0.9286, test_loss: 1.1916, test_f1: 0.5184
 epoch: 95, train_loss: 0.9399, test_loss: 1.1949, test_f1: 0.5139
 epoch: 96, train_loss: 0.9175, test_loss: 1.1886, test_f1: 0.4835
 epoch: 97, train_loss: 0.9274, test_loss: 1.1586, test_f1: 0.5013
 epoch: 98, train_loss: 0.9117, test_loss: 1.1623, test_f1: 0.5338
 epoch: 99, train_loss: 0.9216, test_loss: 1.1830, test_f1: 0.5270
##################ITERATION #2 ****************************************
 epoch: 0, train_loss: 1.3094, test_loss: 1.3453, test_f1: 0.2281
 epoch: 1, train_loss: 1.2441, test_loss: 1.3345, test_f1: 0.2281
 epoch: 2, train_loss: 1.2172, test_loss: 1.3250, test_f1: 0.2281
 epoch: 3, train_loss: 1.2007, test_loss: 1.3125, test_f1: 0.2281
 epoch: 4, train_loss: 1.1921, test_loss: 1.3005, test_f1: 0.2281
 epoch: 5, train_loss: 1.1732, test_loss: 1.2906, test_f1: 0.2281
 epoch: 6, train_loss: 1.1580, test_loss: 1.2730, test_f1: 0.2281
 epoch: 7, train_loss: 1.1450, test_loss: 1.2531, test_f1: 0.2439
 epoch: 8, train_loss: 1.1392, test_loss: 1.2379, test_f1: 0.2876
 epoch: 9, train_loss: 1.1363, test_loss: 1.2180, test_f1: 0.3170
 epoch: 10, train_loss: 1.1209, test_loss: 1.1990, test_f1: 0.3616
 epoch: 11, train_loss: 1.1285, test_loss: 1.2023, test_f1: 0.3979
 epoch: 12, train_loss: 1.1103, test_loss: 1.2233, test_f1: 0.3879
 epoch: 13, train_loss: 1.1099, test_loss: 1.2055, test_f1: 0.3986
 epoch: 14, train_loss: 1.1110, test_loss: 1.1992, test_f1: 0.4261
 epoch: 15, train_loss: 1.0908, test_loss: 1.2162, test_f1: 0.4133
 epoch: 16, train_loss: 1.0820, test_loss: 1.2147, test_f1: 0.4197
 epoch: 17, train_loss: 1.0759, test_loss: 1.1946, test_f1: 0.4057
 epoch: 18, train_loss: 1.0801, test_loss: 1.1898, test_f1: 0.4253
 epoch: 19, train_loss: 1.0649, test_loss: 1.1849, test_f1: 0.4559
 epoch: 20, train_loss: 1.0731, test_loss: 1.1741, test_f1: 0.4521
 epoch: 21, train_loss: 1.0622, test_loss: 1.1768, test_f1: 0.3901
 epoch: 22, train_loss: 1.0522, test_loss: 1.1502, test_f1: 0.4335
 epoch: 23, train_loss: 1.0520, test_loss: 1.2032, test_f1: 0.4181
 epoch: 24, train_loss: 1.0447, test_loss: 1.2092, test_f1: 0.4184
 epoch: 25, train_loss: 1.0480, test_loss: 1.1978, test_f1: 0.4225
 epoch: 26, train_loss: 1.0582, test_loss: 1.2173, test_f1: 0.4427
 epoch: 27, train_loss: 1.0466, test_loss: 1.2088, test_f1: 0.4456
 epoch: 28, train_loss: 1.0428, test_loss: 1.1934, test_f1: 0.4233
 epoch: 29, train_loss: 1.0423, test_loss: 1.1577, test_f1: 0.3805
 epoch: 30, train_loss: 1.0343, test_loss: 1.1594, test_f1: 0.4334
 epoch: 31, train_loss: 1.0394, test_loss: 1.1701, test_f1: 0.4081
 epoch: 32, train_loss: 1.0294, test_loss: 1.1566, test_f1: 0.4303
 epoch: 33, train_loss: 1.0365, test_loss: 1.1825, test_f1: 0.4232
 epoch: 34, train_loss: 1.0112, test_loss: 1.1972, test_f1: 0.4238
 epoch: 35, train_loss: 1.0137, test_loss: 1.1686, test_f1: 0.4366
 epoch: 36, train_loss: 1.0237, test_loss: 1.1724, test_f1: 0.4287
 epoch: 37, train_loss: 1.0287, test_loss: 1.1916, test_f1: 0.4281
 epoch: 38, train_loss: 1.0238, test_loss: 1.2154, test_f1: 0.3851
 epoch: 39, train_loss: 1.0249, test_loss: 1.2045, test_f1: 0.4069
 epoch: 40, train_loss: 1.0212, test_loss: 1.2257, test_f1: 0.4298
 epoch: 41, train_loss: 1.0113, test_loss: 1.2226, test_f1: 0.4411
 epoch: 42, train_loss: 1.0131, test_loss: 1.1525, test_f1: 0.4458
 epoch: 43, train_loss: 1.0207, test_loss: 1.1543, test_f1: 0.4493
 epoch: 44, train_loss: 1.0044, test_loss: 1.1789, test_f1: 0.4339
 epoch: 45, train_loss: 1.0028, test_loss: 1.1731, test_f1: 0.4214
 epoch: 46, train_loss: 1.0003, test_loss: 1.1662, test_f1: 0.4222
 epoch: 47, train_loss: 1.0092, test_loss: 1.1586, test_f1: 0.4282
 epoch: 48, train_loss: 1.0010, test_loss: 1.1908, test_f1: 0.4341
 epoch: 49, train_loss: 1.0001, test_loss: 1.2040, test_f1: 0.4313
 epoch: 50, train_loss: 0.9920, test_loss: 1.1665, test_f1: 0.4358
 epoch: 51, train_loss: 0.9868, test_loss: 1.1803, test_f1: 0.4230
 epoch: 52, train_loss: 0.9928, test_loss: 1.1799, test_f1: 0.4353
 epoch: 53, train_loss: 0.9904, test_loss: 1.1661, test_f1: 0.4249
 epoch: 54, train_loss: 0.9776, test_loss: 1.1636, test_f1: 0.4262
 epoch: 55, train_loss: 0.9797, test_loss: 1.1539, test_f1: 0.4331
 epoch: 56, train_loss: 0.9838, test_loss: 1.1516, test_f1: 0.4336
 epoch: 57, train_loss: 0.9809, test_loss: 1.1426, test_f1: 0.4312
 epoch: 58, train_loss: 0.9788, test_loss: 1.1562, test_f1: 0.4271
 epoch: 59, train_loss: 0.9726, test_loss: 1.1651, test_f1: 0.4201
 epoch: 60, train_loss: 0.9722, test_loss: 1.1618, test_f1: 0.4242
 epoch: 61, train_loss: 0.9628, test_loss: 1.1804, test_f1: 0.4335
 epoch: 62, train_loss: 0.9603, test_loss: 1.1700, test_f1: 0.4269
 epoch: 63, train_loss: 0.9666, test_loss: 1.1806, test_f1: 0.4306
 epoch: 64, train_loss: 0.9619, test_loss: 1.1699, test_f1: 0.4333
 epoch: 65, train_loss: 0.9586, test_loss: 1.1791, test_f1: 0.4303
 epoch: 66, train_loss: 0.9665, test_loss: 1.1842, test_f1: 0.4358
 epoch: 67, train_loss: 0.9677, test_loss: 1.1836, test_f1: 0.4361
 epoch: 68, train_loss: 0.9540, test_loss: 1.1929, test_f1: 0.4270
 epoch: 69, train_loss: 0.9554, test_loss: 1.1831, test_f1: 0.4277
 epoch: 70, train_loss: 0.9426, test_loss: 1.1513, test_f1: 0.4248
 epoch: 71, train_loss: 0.9520, test_loss: 1.1452, test_f1: 0.4414
 epoch: 72, train_loss: 0.9627, test_loss: 1.1937, test_f1: 0.4372
 epoch: 73, train_loss: 0.9656, test_loss: 1.2104, test_f1: 0.4553
 epoch: 74, train_loss: 0.9629, test_loss: 1.2103, test_f1: 0.4496
 epoch: 75, train_loss: 0.9611, test_loss: 1.2209, test_f1: 0.4374
 epoch: 76, train_loss: 0.9550, test_loss: 1.1972, test_f1: 0.4418
 epoch: 77, train_loss: 0.9625, test_loss: 1.1598, test_f1: 0.4481
 epoch: 78, train_loss: 0.9523, test_loss: 1.1480, test_f1: 0.4546
 epoch: 79, train_loss: 0.9489, test_loss: 1.1845, test_f1: 0.4418
 epoch: 80, train_loss: 0.9506, test_loss: 1.1388, test_f1: 0.4398
 epoch: 81, train_loss: 0.9504, test_loss: 1.1252, test_f1: 0.4360
 epoch: 82, train_loss: 0.9520, test_loss: 1.1342, test_f1: 0.4250
 epoch: 83, train_loss: 0.9462, test_loss: 1.1549, test_f1: 0.4392
 epoch: 84, train_loss: 0.9373, test_loss: 1.1684, test_f1: 0.4444
 epoch: 85, train_loss: 0.9595, test_loss: 1.1716, test_f1: 0.4277
 epoch: 86, train_loss: 0.9416, test_loss: 1.1832, test_f1: 0.4356
 epoch: 87, train_loss: 0.9473, test_loss: 1.1668, test_f1: 0.4320
 epoch: 88, train_loss: 0.9338, test_loss: 1.1768, test_f1: 0.4303
 epoch: 89, train_loss: 0.9379, test_loss: 1.1915, test_f1: 0.4309
 epoch: 90, train_loss: 0.9303, test_loss: 1.2202, test_f1: 0.4290
 epoch: 91, train_loss: 0.9327, test_loss: 1.1920, test_f1: 0.4359
 epoch: 92, train_loss: 0.9331, test_loss: 1.2070, test_f1: 0.4409
 epoch: 93, train_loss: 0.9305, test_loss: 1.2358, test_f1: 0.4333
 epoch: 94, train_loss: 0.9347, test_loss: 1.2000, test_f1: 0.4395
 epoch: 95, train_loss: 0.9308, test_loss: 1.1862, test_f1: 0.4359
 epoch: 96, train_loss: 0.9327, test_loss: 1.1899, test_f1: 0.4398
 epoch: 97, train_loss: 0.9370, test_loss: 1.1858, test_f1: 0.4367
 epoch: 98, train_loss: 0.9329, test_loss: 1.2055, test_f1: 0.4432
 epoch: 99, train_loss: 0.9189, test_loss: 1.2286, test_f1: 0.4366
##################ITERATION #3 ****************************************
 epoch: 0, train_loss: 1.3084, test_loss: 1.3096, test_f1: 0.2281
 epoch: 1, train_loss: 1.2099, test_loss: 1.2988, test_f1: 0.2281
 epoch: 2, train_loss: 1.1833, test_loss: 1.2951, test_f1: 0.2281
 epoch: 3, train_loss: 1.1687, test_loss: 1.2883, test_f1: 0.2281
 epoch: 4, train_loss: 1.1461, test_loss: 1.2807, test_f1: 0.2281
 epoch: 5, train_loss: 1.1353, test_loss: 1.2673, test_f1: 0.2525
 epoch: 6, train_loss: 1.1202, test_loss: 1.2406, test_f1: 0.2790
 epoch: 7, train_loss: 1.1144, test_loss: 1.2149, test_f1: 0.2773
 epoch: 8, train_loss: 1.1155, test_loss: 1.1916, test_f1: 0.2729
 epoch: 9, train_loss: 1.0947, test_loss: 1.1677, test_f1: 0.3324
 epoch: 10, train_loss: 1.1057, test_loss: 1.1555, test_f1: 0.3922
 epoch: 11, train_loss: 1.0919, test_loss: 1.1577, test_f1: 0.4247
 epoch: 12, train_loss: 1.0867, test_loss: 1.1854, test_f1: 0.4140
 epoch: 13, train_loss: 1.0772, test_loss: 1.2202, test_f1: 0.4209
 epoch: 14, train_loss: 1.0706, test_loss: 1.3202, test_f1: 0.4232
 epoch: 15, train_loss: 1.0647, test_loss: 1.4030, test_f1: 0.4311
 epoch: 16, train_loss: 1.0709, test_loss: 1.4149, test_f1: 0.4195
 epoch: 17, train_loss: 1.0447, test_loss: 1.4512, test_f1: 0.4196
 epoch: 18, train_loss: 1.0466, test_loss: 1.4669, test_f1: 0.4269
 epoch: 19, train_loss: 1.0436, test_loss: 1.4927, test_f1: 0.4258
 epoch: 20, train_loss: 1.0375, test_loss: 1.4711, test_f1: 0.4225
 epoch: 21, train_loss: 1.0161, test_loss: 1.4221, test_f1: 0.4373
 epoch: 22, train_loss: 1.0279, test_loss: 1.3750, test_f1: 0.4378
 epoch: 23, train_loss: 1.0247, test_loss: 1.3409, test_f1: 0.4344
 epoch: 24, train_loss: 1.0224, test_loss: 1.2871, test_f1: 0.4417
 epoch: 25, train_loss: 1.0141, test_loss: 1.2648, test_f1: 0.4590
 epoch: 26, train_loss: 1.0023, test_loss: 1.2532, test_f1: 0.4547
 epoch: 27, train_loss: 1.0107, test_loss: 1.2550, test_f1: 0.4675
 epoch: 28, train_loss: 0.9979, test_loss: 1.3811, test_f1: 0.4414
 epoch: 29, train_loss: 0.9930, test_loss: 1.4132, test_f1: 0.4553
 epoch: 30, train_loss: 0.9842, test_loss: 1.4612, test_f1: 0.4586
 epoch: 31, train_loss: 0.9903, test_loss: 1.4697, test_f1: 0.4641
 epoch: 32, train_loss: 0.9904, test_loss: 1.4631, test_f1: 0.4465
 epoch: 33, train_loss: 0.9772, test_loss: 1.4626, test_f1: 0.4715
 epoch: 34, train_loss: 0.9802, test_loss: 1.3698, test_f1: 0.4709
 epoch: 35, train_loss: 0.9675, test_loss: 1.4595, test_f1: 0.4851
 epoch: 36, train_loss: 0.9708, test_loss: 1.4343, test_f1: 0.4825
 epoch: 37, train_loss: 0.9749, test_loss: 1.4692, test_f1: 0.4560
 epoch: 38, train_loss: 0.9767, test_loss: 1.5162, test_f1: 0.4408
 epoch: 39, train_loss: 0.9724, test_loss: 1.4588, test_f1: 0.4769
 epoch: 40, train_loss: 0.9721, test_loss: 1.4151, test_f1: 0.4984
 epoch: 41, train_loss: 0.9580, test_loss: 1.3054, test_f1: 0.4694
 epoch: 42, train_loss: 0.9450, test_loss: 1.2537, test_f1: 0.4805
 epoch: 43, train_loss: 0.9613, test_loss: 1.1851, test_f1: 0.4738
 epoch: 44, train_loss: 0.9463, test_loss: 1.1650, test_f1: 0.4803
 epoch: 45, train_loss: 0.9468, test_loss: 1.1553, test_f1: 0.4699
 epoch: 46, train_loss: 0.9428, test_loss: 1.1629, test_f1: 0.4968
 epoch: 47, train_loss: 0.9453, test_loss: 1.1821, test_f1: 0.4865
 epoch: 48, train_loss: 0.9328, test_loss: 1.2404, test_f1: 0.4923
 epoch: 49, train_loss: 0.9406, test_loss: 1.2742, test_f1: 0.4827
 epoch: 50, train_loss: 0.9366, test_loss: 1.3098, test_f1: 0.4839
 epoch: 51, train_loss: 0.9329, test_loss: 1.3126, test_f1: 0.4853
 epoch: 52, train_loss: 0.9258, test_loss: 1.3267, test_f1: 0.4820
 epoch: 53, train_loss: 0.9381, test_loss: 1.2668, test_f1: 0.4771
 epoch: 54, train_loss: 0.9297, test_loss: 1.2537, test_f1: 0.4964
 epoch: 55, train_loss: 0.9186, test_loss: 1.1987, test_f1: 0.5037
 epoch: 56, train_loss: 0.9220, test_loss: 1.1559, test_f1: 0.5235
 epoch: 57, train_loss: 0.9154, test_loss: 1.1891, test_f1: 0.5102
 epoch: 58, train_loss: 0.9261, test_loss: 1.1087, test_f1: 0.5142
 epoch: 59, train_loss: 0.9159, test_loss: 1.0817, test_f1: 0.5135
 epoch: 60, train_loss: 0.9328, test_loss: 1.1214, test_f1: 0.5165
 epoch: 61, train_loss: 0.9166, test_loss: 1.2264, test_f1: 0.5055
 epoch: 62, train_loss: 0.9226, test_loss: 1.2606, test_f1: 0.4949
 epoch: 63, train_loss: 0.9232, test_loss: 1.0566, test_f1: 0.4985
 epoch: 64, train_loss: 0.9170, test_loss: 1.0392, test_f1: 0.5028
 epoch: 65, train_loss: 0.9123, test_loss: 1.0301, test_f1: 0.5166
 epoch: 66, train_loss: 0.9185, test_loss: 0.9969, test_f1: 0.5313
 epoch: 67, train_loss: 0.9224, test_loss: 1.0239, test_f1: 0.5046
 epoch: 68, train_loss: 0.9229, test_loss: 1.0537, test_f1: 0.5085
 epoch: 69, train_loss: 0.9161, test_loss: 1.0700, test_f1: 0.5117
 epoch: 70, train_loss: 0.9168, test_loss: 1.0711, test_f1: 0.5078
 epoch: 71, train_loss: 0.9235, test_loss: 1.0515, test_f1: 0.5079
 epoch: 72, train_loss: 0.9017, test_loss: 1.0512, test_f1: 0.4958
 epoch: 73, train_loss: 0.9029, test_loss: 1.0428, test_f1: 0.5080
 epoch: 74, train_loss: 0.9079, test_loss: 1.0574, test_f1: 0.5231
 epoch: 75, train_loss: 0.9085, test_loss: 1.0978, test_f1: 0.5178
 epoch: 76, train_loss: 0.9092, test_loss: 1.0977, test_f1: 0.5247
 epoch: 77, train_loss: 0.9095, test_loss: 1.0798, test_f1: 0.5239
 epoch: 78, train_loss: 0.9104, test_loss: 1.0470, test_f1: 0.5296
 epoch: 79, train_loss: 0.9089, test_loss: 1.0313, test_f1: 0.5054
 epoch: 80, train_loss: 0.9127, test_loss: 1.0261, test_f1: 0.5166
 epoch: 81, train_loss: 0.9014, test_loss: 1.0284, test_f1: 0.5260
 epoch: 82, train_loss: 0.9038, test_loss: 1.0389, test_f1: 0.5345
 epoch: 83, train_loss: 0.9057, test_loss: 1.0785, test_f1: 0.5120
 epoch: 84, train_loss: 0.9072, test_loss: 1.0888, test_f1: 0.5196
 epoch: 85, train_loss: 0.9064, test_loss: 1.0843, test_f1: 0.5199
 epoch: 86, train_loss: 0.8992, test_loss: 1.0658, test_f1: 0.4955
 epoch: 87, train_loss: 0.9006, test_loss: 1.0735, test_f1: 0.5071
 epoch: 88, train_loss: 0.8989, test_loss: 1.0406, test_f1: 0.5074
 epoch: 89, train_loss: 0.8984, test_loss: 1.0530, test_f1: 0.5026
 epoch: 90, train_loss: 0.8982, test_loss: 1.0524, test_f1: 0.5001
 epoch: 91, train_loss: 0.8905, test_loss: 1.0500, test_f1: 0.5004
 epoch: 92, train_loss: 0.8943, test_loss: 1.0317, test_f1: 0.5031
 epoch: 93, train_loss: 0.9005, test_loss: 1.0507, test_f1: 0.5167
 epoch: 94, train_loss: 0.9075, test_loss: 1.0382, test_f1: 0.5115
 epoch: 95, train_loss: 0.8993, test_loss: 1.0431, test_f1: 0.5019
 epoch: 96, train_loss: 0.8910, test_loss: 1.0543, test_f1: 0.4928
 epoch: 97, train_loss: 0.9074, test_loss: 1.0566, test_f1: 0.5141
 epoch: 98, train_loss: 0.8984, test_loss: 1.0610, test_f1: 0.5185
 epoch: 99, train_loss: 0.8883, test_loss: 1.0249, test_f1: 0.5441
##################ITERATION #4 ****************************************
 epoch: 0, train_loss: 1.2907, test_loss: 1.3058, test_f1: 0.2281
 epoch: 1, train_loss: 1.2269, test_loss: 1.3012, test_f1: 0.2281
 epoch: 2, train_loss: 1.2142, test_loss: 1.2950, test_f1: 0.2281
 epoch: 3, train_loss: 1.1931, test_loss: 1.2874, test_f1: 0.2281
 epoch: 4, train_loss: 1.1728, test_loss: 1.2795, test_f1: 0.2281
 epoch: 5, train_loss: 1.1555, test_loss: 1.2754, test_f1: 0.2281
 epoch: 6, train_loss: 1.1363, test_loss: 1.2481, test_f1: 0.2448
 epoch: 7, train_loss: 1.1326, test_loss: 1.2276, test_f1: 0.2561
 epoch: 8, train_loss: 1.1275, test_loss: 1.2040, test_f1: 0.2897
 epoch: 9, train_loss: 1.1216, test_loss: 1.1952, test_f1: 0.3208
 epoch: 10, train_loss: 1.0968, test_loss: 1.2019, test_f1: 0.3277
 epoch: 11, train_loss: 1.1077, test_loss: 1.1682, test_f1: 0.3397
 epoch: 12, train_loss: 1.0989, test_loss: 1.1575, test_f1: 0.3361
 epoch: 13, train_loss: 1.0921, test_loss: 1.1561, test_f1: 0.3453
 epoch: 14, train_loss: 1.0992, test_loss: 1.1550, test_f1: 0.3481
 epoch: 15, train_loss: 1.0818, test_loss: 1.1486, test_f1: 0.3762
 epoch: 16, train_loss: 1.0818, test_loss: 1.1444, test_f1: 0.3697
 epoch: 17, train_loss: 1.0865, test_loss: 1.1341, test_f1: 0.3926
 epoch: 18, train_loss: 1.0805, test_loss: 1.1258, test_f1: 0.4152
 epoch: 19, train_loss: 1.0688, test_loss: 1.1183, test_f1: 0.4207
 epoch: 20, train_loss: 1.0538, test_loss: 1.1287, test_f1: 0.4144
 epoch: 21, train_loss: 1.0431, test_loss: 1.1269, test_f1: 0.4117
 epoch: 22, train_loss: 1.0537, test_loss: 1.1112, test_f1: 0.4215
 epoch: 23, train_loss: 1.0517, test_loss: 1.1079, test_f1: 0.4296
 epoch: 24, train_loss: 1.0443, test_loss: 1.0976, test_f1: 0.4269
 epoch: 25, train_loss: 1.0344, test_loss: 1.0899, test_f1: 0.4315
 epoch: 26, train_loss: 1.0199, test_loss: 1.0985, test_f1: 0.4254
 epoch: 27, train_loss: 1.0307, test_loss: 1.0989, test_f1: 0.4410
 epoch: 28, train_loss: 1.0351, test_loss: 1.0877, test_f1: 0.4593
 epoch: 29, train_loss: 1.0172, test_loss: 1.0800, test_f1: 0.4664
 epoch: 30, train_loss: 1.0314, test_loss: 1.0915, test_f1: 0.4575
 epoch: 31, train_loss: 1.0147, test_loss: 1.0862, test_f1: 0.4489
 epoch: 32, train_loss: 0.9998, test_loss: 1.0776, test_f1: 0.4486
 epoch: 33, train_loss: 1.0155, test_loss: 1.0862, test_f1: 0.4544
 epoch: 34, train_loss: 1.0112, test_loss: 1.0809, test_f1: 0.4315
 epoch: 35, train_loss: 0.9951, test_loss: 1.0790, test_f1: 0.4433
 epoch: 36, train_loss: 0.9918, test_loss: 1.0699, test_f1: 0.4712
 epoch: 37, train_loss: 0.9938, test_loss: 1.0599, test_f1: 0.4635
 epoch: 38, train_loss: 1.0136, test_loss: 1.0786, test_f1: 0.4810
 epoch: 39, train_loss: 1.0142, test_loss: 1.1044, test_f1: 0.4777
 epoch: 40, train_loss: 0.9896, test_loss: 1.1451, test_f1: 0.4496
 epoch: 41, train_loss: 0.9973, test_loss: 1.1495, test_f1: 0.4412
 epoch: 42, train_loss: 0.9886, test_loss: 1.1396, test_f1: 0.4391
 epoch: 43, train_loss: 0.9718, test_loss: 1.1040, test_f1: 0.4363
 epoch: 44, train_loss: 0.9738, test_loss: 1.0810, test_f1: 0.4417
 epoch: 45, train_loss: 0.9711, test_loss: 1.0763, test_f1: 0.4419
 epoch: 46, train_loss: 0.9705, test_loss: 1.0868, test_f1: 0.4499
 epoch: 47, train_loss: 0.9703, test_loss: 1.0880, test_f1: 0.4580
 epoch: 48, train_loss: 0.9688, test_loss: 1.1048, test_f1: 0.4583
 epoch: 49, train_loss: 0.9588, test_loss: 1.1137, test_f1: 0.4446
 epoch: 50, train_loss: 0.9585, test_loss: 1.1001, test_f1: 0.4736
 epoch: 51, train_loss: 0.9546, test_loss: 1.0936, test_f1: 0.4758
 epoch: 52, train_loss: 0.9506, test_loss: 1.0934, test_f1: 0.4801
 epoch: 53, train_loss: 0.9441, test_loss: 1.1023, test_f1: 0.4798
 epoch: 54, train_loss: 0.9438, test_loss: 1.0982, test_f1: 0.4657
 epoch: 55, train_loss: 0.9471, test_loss: 1.0976, test_f1: 0.4668
 epoch: 56, train_loss: 0.9440, test_loss: 1.0880, test_f1: 0.4830
 epoch: 57, train_loss: 0.9446, test_loss: 1.0860, test_f1: 0.4917
 epoch: 58, train_loss: 0.9376, test_loss: 1.1001, test_f1: 0.4725
 epoch: 59, train_loss: 0.9440, test_loss: 1.1162, test_f1: 0.4733
 epoch: 60, train_loss: 0.9367, test_loss: 1.1263, test_f1: 0.4748
 epoch: 61, train_loss: 0.9410, test_loss: 1.1211, test_f1: 0.4783
 epoch: 62, train_loss: 0.9306, test_loss: 1.1285, test_f1: 0.4778
 epoch: 63, train_loss: 0.9379, test_loss: 1.1154, test_f1: 0.4878
 epoch: 64, train_loss: 0.9321, test_loss: 1.1133, test_f1: 0.4849
 epoch: 65, train_loss: 0.9313, test_loss: 1.1174, test_f1: 0.4703
 epoch: 66, train_loss: 0.9359, test_loss: 1.0970, test_f1: 0.4735
 epoch: 67, train_loss: 0.9255, test_loss: 1.1050, test_f1: 0.4755
 epoch: 68, train_loss: 0.9346, test_loss: 1.1054, test_f1: 0.4758
 epoch: 69, train_loss: 0.9349, test_loss: 1.0973, test_f1: 0.4715
 epoch: 70, train_loss: 0.9274, test_loss: 1.0973, test_f1: 0.4737
 epoch: 71, train_loss: 0.9225, test_loss: 1.1061, test_f1: 0.4760
 epoch: 72, train_loss: 0.9229, test_loss: 1.1064, test_f1: 0.4773
 epoch: 73, train_loss: 0.9191, test_loss: 1.1087, test_f1: 0.4830
 epoch: 74, train_loss: 0.9317, test_loss: 1.1056, test_f1: 0.4814
 epoch: 75, train_loss: 0.9167, test_loss: 1.1120, test_f1: 0.4851
 epoch: 76, train_loss: 0.9141, test_loss: 1.1212, test_f1: 0.4810
 epoch: 77, train_loss: 0.9129, test_loss: 1.1225, test_f1: 0.4750
 epoch: 78, train_loss: 0.9155, test_loss: 1.1119, test_f1: 0.4898
 epoch: 79, train_loss: 0.9219, test_loss: 1.1146, test_f1: 0.4928
 epoch: 80, train_loss: 0.9191, test_loss: 1.1079, test_f1: 0.4858
 epoch: 81, train_loss: 0.9040, test_loss: 1.0991, test_f1: 0.4917
 epoch: 82, train_loss: 0.9097, test_loss: 1.1072, test_f1: 0.4960
 epoch: 83, train_loss: 0.9042, test_loss: 1.1200, test_f1: 0.4861
 epoch: 84, train_loss: 0.9001, test_loss: 1.1305, test_f1: 0.4776
 epoch: 85, train_loss: 0.9133, test_loss: 1.1360, test_f1: 0.4795
 epoch: 86, train_loss: 0.9067, test_loss: 1.1467, test_f1: 0.4678
 epoch: 87, train_loss: 0.9007, test_loss: 1.1558, test_f1: 0.4651
 epoch: 88, train_loss: 0.9062, test_loss: 1.1252, test_f1: 0.4892
 epoch: 89, train_loss: 0.9085, test_loss: 1.1226, test_f1: 0.4999
 epoch: 90, train_loss: 0.9004, test_loss: 1.1240, test_f1: 0.4991
 epoch: 91, train_loss: 0.9048, test_loss: 1.1332, test_f1: 0.4857
 epoch: 92, train_loss: 0.8914, test_loss: 1.1341, test_f1: 0.4986
 epoch: 93, train_loss: 0.9090, test_loss: 1.1255, test_f1: 0.4809
 epoch: 94, train_loss: 0.9130, test_loss: 1.1357, test_f1: 0.4802
 epoch: 95, train_loss: 0.9038, test_loss: 1.1371, test_f1: 0.4792
 epoch: 96, train_loss: 0.8966, test_loss: 1.1537, test_f1: 0.4855
 epoch: 97, train_loss: 0.8918, test_loss: 1.1849, test_f1: 0.4772
 epoch: 98, train_loss: 0.9072, test_loss: 1.1984, test_f1: 0.4860
 epoch: 99, train_loss: 0.9004, test_loss: 1.1728, test_f1: 0.5008
##################ITERATION #5 ****************************************
 epoch: 0, train_loss: 1.2653, test_loss: 1.3132, test_f1: 0.2281
 epoch: 1, train_loss: 1.2063, test_loss: 1.3028, test_f1: 0.2281
 epoch: 2, train_loss: 1.1757, test_loss: 1.3043, test_f1: 0.2281
 epoch: 3, train_loss: 1.1561, test_loss: 1.3055, test_f1: 0.2281
 epoch: 4, train_loss: 1.1542, test_loss: 1.2853, test_f1: 0.2583
 epoch: 5, train_loss: 1.1464, test_loss: 1.2737, test_f1: 0.2749
 epoch: 6, train_loss: 1.1355, test_loss: 1.2499, test_f1: 0.2982
 epoch: 7, train_loss: 1.1343, test_loss: 1.2165, test_f1: 0.3302
 epoch: 8, train_loss: 1.1143, test_loss: 1.1997, test_f1: 0.3394
 epoch: 9, train_loss: 1.1025, test_loss: 1.1885, test_f1: 0.3791
 epoch: 10, train_loss: 1.1094, test_loss: 1.1675, test_f1: 0.3976
 epoch: 11, train_loss: 1.0978, test_loss: 1.1546, test_f1: 0.4200
 epoch: 12, train_loss: 1.0986, test_loss: 1.1539, test_f1: 0.3995
 epoch: 13, train_loss: 1.0849, test_loss: 1.1448, test_f1: 0.4159
 epoch: 14, train_loss: 1.0846, test_loss: 1.1434, test_f1: 0.4204
 epoch: 15, train_loss: 1.0719, test_loss: 1.1861, test_f1: 0.4057
 epoch: 16, train_loss: 1.0700, test_loss: 1.1694, test_f1: 0.3988
 epoch: 17, train_loss: 1.0640, test_loss: 1.1209, test_f1: 0.4030
 epoch: 18, train_loss: 1.0722, test_loss: 1.1152, test_f1: 0.4198
 epoch: 19, train_loss: 1.0765, test_loss: 1.1247, test_f1: 0.4316
 epoch: 20, train_loss: 1.0563, test_loss: 1.1139, test_f1: 0.4381
 epoch: 21, train_loss: 1.0510, test_loss: 1.1164, test_f1: 0.4360
 epoch: 22, train_loss: 1.0516, test_loss: 1.1098, test_f1: 0.4360
 epoch: 23, train_loss: 1.0496, test_loss: 1.1275, test_f1: 0.4209
 epoch: 24, train_loss: 1.0457, test_loss: 1.1362, test_f1: 0.4567
 epoch: 25, train_loss: 1.0474, test_loss: 1.1489, test_f1: 0.4388
 epoch: 26, train_loss: 1.0447, test_loss: 1.1244, test_f1: 0.4776
 epoch: 27, train_loss: 1.0344, test_loss: 1.1100, test_f1: 0.4696
 epoch: 28, train_loss: 1.0364, test_loss: 1.1089, test_f1: 0.4664
 epoch: 29, train_loss: 1.0258, test_loss: 1.1033, test_f1: 0.4533
 epoch: 30, train_loss: 1.0346, test_loss: 1.0997, test_f1: 0.4676
 epoch: 31, train_loss: 1.0225, test_loss: 1.1040, test_f1: 0.4627
 epoch: 32, train_loss: 1.0105, test_loss: 1.1057, test_f1: 0.4590
 epoch: 33, train_loss: 1.0258, test_loss: 1.0996, test_f1: 0.4416
 epoch: 34, train_loss: 1.0184, test_loss: 1.0975, test_f1: 0.4334
 epoch: 35, train_loss: 1.0195, test_loss: 1.1010, test_f1: 0.4532
 epoch: 36, train_loss: 1.0074, test_loss: 1.1115, test_f1: 0.4575
 epoch: 37, train_loss: 1.0037, test_loss: 1.1068, test_f1: 0.4525
 epoch: 38, train_loss: 1.0130, test_loss: 1.1130, test_f1: 0.4418
 epoch: 39, train_loss: 1.0241, test_loss: 1.0836, test_f1: 0.4527
 epoch: 40, train_loss: 1.0026, test_loss: 1.0890, test_f1: 0.4707
 epoch: 41, train_loss: 1.0064, test_loss: 1.0975, test_f1: 0.4836
 epoch: 42, train_loss: 1.0145, test_loss: 1.1258, test_f1: 0.4744
 epoch: 43, train_loss: 1.0116, test_loss: 1.0959, test_f1: 0.4889
 epoch: 44, train_loss: 1.0043, test_loss: 1.0877, test_f1: 0.4672
 epoch: 45, train_loss: 0.9928, test_loss: 1.0812, test_f1: 0.4727
 epoch: 46, train_loss: 0.9955, test_loss: 1.0714, test_f1: 0.4627
 epoch: 47, train_loss: 0.9764, test_loss: 1.0710, test_f1: 0.4556
 epoch: 48, train_loss: 0.9827, test_loss: 1.0751, test_f1: 0.4724
 epoch: 49, train_loss: 0.9833, test_loss: 1.0794, test_f1: 0.4853
 epoch: 50, train_loss: 0.9712, test_loss: 1.0785, test_f1: 0.4688
 epoch: 51, train_loss: 0.9718, test_loss: 1.0662, test_f1: 0.4636
 epoch: 52, train_loss: 0.9669, test_loss: 1.0687, test_f1: 0.4924
 epoch: 53, train_loss: 0.9715, test_loss: 1.0842, test_f1: 0.4901
 epoch: 54, train_loss: 0.9581, test_loss: 1.0831, test_f1: 0.4744
 epoch: 55, train_loss: 0.9584, test_loss: 1.0757, test_f1: 0.4924
 epoch: 56, train_loss: 0.9618, test_loss: 1.0729, test_f1: 0.4934
 epoch: 57, train_loss: 0.9636, test_loss: 1.0662, test_f1: 0.4737
 epoch: 58, train_loss: 0.9502, test_loss: 1.0685, test_f1: 0.4953
 epoch: 59, train_loss: 0.9605, test_loss: 1.0544, test_f1: 0.4881
 epoch: 60, train_loss: 0.9681, test_loss: 1.0532, test_f1: 0.4904
 epoch: 61, train_loss: 0.9697, test_loss: 1.0788, test_f1: 0.4980
 epoch: 62, train_loss: 0.9567, test_loss: 1.0802, test_f1: 0.4905
 epoch: 63, train_loss: 0.9440, test_loss: 1.0573, test_f1: 0.4951
 epoch: 64, train_loss: 0.9494, test_loss: 1.0699, test_f1: 0.5074
 epoch: 65, train_loss: 0.9395, test_loss: 1.0798, test_f1: 0.4891
 epoch: 66, train_loss: 0.9479, test_loss: 1.0860, test_f1: 0.4861
 epoch: 67, train_loss: 0.9460, test_loss: 1.0679, test_f1: 0.4918
 epoch: 68, train_loss: 0.9525, test_loss: 1.0428, test_f1: 0.4792
 epoch: 69, train_loss: 0.9419, test_loss: 1.0528, test_f1: 0.4806
 epoch: 70, train_loss: 0.9490, test_loss: 1.0594, test_f1: 0.4896
 epoch: 71, train_loss: 0.9345, test_loss: 1.0663, test_f1: 0.5084
 epoch: 72, train_loss: 0.9494, test_loss: 1.0703, test_f1: 0.5024
 epoch: 73, train_loss: 0.9403, test_loss: 1.0520, test_f1: 0.4808
 epoch: 74, train_loss: 0.9374, test_loss: 1.0559, test_f1: 0.4889
 epoch: 75, train_loss: 0.9411, test_loss: 1.0652, test_f1: 0.4874
 epoch: 76, train_loss: 0.9339, test_loss: 1.0719, test_f1: 0.4707
 epoch: 77, train_loss: 0.9334, test_loss: 1.0763, test_f1: 0.4831
 epoch: 78, train_loss: 0.9292, test_loss: 1.0724, test_f1: 0.4728
 epoch: 79, train_loss: 0.9446, test_loss: 1.0591, test_f1: 0.4822
 epoch: 80, train_loss: 0.9444, test_loss: 1.0818, test_f1: 0.4928
 epoch: 81, train_loss: 0.9325, test_loss: 1.0887, test_f1: 0.4916
 epoch: 82, train_loss: 0.9185, test_loss: 1.0834, test_f1: 0.4866
 epoch: 83, train_loss: 0.9242, test_loss: 1.0595, test_f1: 0.5063
 epoch: 84, train_loss: 0.9239, test_loss: 1.0592, test_f1: 0.5049
 epoch: 85, train_loss: 0.9201, test_loss: 1.0648, test_f1: 0.5121
 epoch: 86, train_loss: 0.9243, test_loss: 1.0678, test_f1: 0.5081
 epoch: 87, train_loss: 0.9112, test_loss: 1.0569, test_f1: 0.4650
 epoch: 88, train_loss: 0.9117, test_loss: 1.0693, test_f1: 0.4563
 epoch: 89, train_loss: 0.9161, test_loss: 1.0537, test_f1: 0.4814
 epoch: 90, train_loss: 0.9084, test_loss: 1.0721, test_f1: 0.4957
 epoch: 91, train_loss: 0.9184, test_loss: 1.0877, test_f1: 0.5007
 epoch: 92, train_loss: 0.9121, test_loss: 1.0789, test_f1: 0.5111
 epoch: 93, train_loss: 0.9223, test_loss: 1.0489, test_f1: 0.4914
 epoch: 94, train_loss: 0.9097, test_loss: 1.0684, test_f1: 0.4935
 epoch: 95, train_loss: 0.9211, test_loss: 1.0760, test_f1: 0.5041
 epoch: 96, train_loss: 0.9222, test_loss: 1.0698, test_f1: 0.4965
 epoch: 97, train_loss: 0.9158, test_loss: 1.0631, test_f1: 0.4988
 epoch: 98, train_loss: 0.9114, test_loss: 1.0713, test_f1: 0.4969
 epoch: 99, train_loss: 0.9076, test_loss: 1.0856, test_f1: 0.5027
##################ITERATION #6 ****************************************
 epoch: 0, train_loss: 1.2687, test_loss: 1.2987, test_f1: 0.2281
 epoch: 1, train_loss: 1.2117, test_loss: 1.2971, test_f1: 0.2281
 epoch: 2, train_loss: 1.1804, test_loss: 1.3074, test_f1: 0.2281
 epoch: 3, train_loss: 1.1794, test_loss: 1.3319, test_f1: 0.2631
 epoch: 4, train_loss: 1.1615, test_loss: 1.3507, test_f1: 0.2415
 epoch: 5, train_loss: 1.1520, test_loss: 1.3220, test_f1: 0.2650
 epoch: 6, train_loss: 1.1467, test_loss: 1.2746, test_f1: 0.2844
 epoch: 7, train_loss: 1.1482, test_loss: 1.2520, test_f1: 0.3178
 epoch: 8, train_loss: 1.1338, test_loss: 1.2320, test_f1: 0.3178
 epoch: 9, train_loss: 1.1255, test_loss: 1.2144, test_f1: 0.3051
 epoch: 10, train_loss: 1.1148, test_loss: 1.2042, test_f1: 0.3524
 epoch: 11, train_loss: 1.1003, test_loss: 1.2051, test_f1: 0.3870
 epoch: 12, train_loss: 1.0933, test_loss: 1.1951, test_f1: 0.4103
 epoch: 13, train_loss: 1.0861, test_loss: 1.1890, test_f1: 0.4018
 epoch: 14, train_loss: 1.0836, test_loss: 1.1774, test_f1: 0.4144
 epoch: 15, train_loss: 1.0656, test_loss: 1.1622, test_f1: 0.4307
 epoch: 16, train_loss: 1.0671, test_loss: 1.1696, test_f1: 0.4227
 epoch: 17, train_loss: 1.0677, test_loss: 1.1604, test_f1: 0.4183
 epoch: 18, train_loss: 1.0505, test_loss: 1.1610, test_f1: 0.4350
 epoch: 19, train_loss: 1.0484, test_loss: 1.1471, test_f1: 0.4327
 epoch: 20, train_loss: 1.0400, test_loss: 1.1433, test_f1: 0.4235
 epoch: 21, train_loss: 1.0446, test_loss: 1.1392, test_f1: 0.4272
 epoch: 22, train_loss: 1.0378, test_loss: 1.1362, test_f1: 0.4362
 epoch: 23, train_loss: 1.0389, test_loss: 1.1349, test_f1: 0.4380
 epoch: 24, train_loss: 1.0351, test_loss: 1.1527, test_f1: 0.4506
 epoch: 25, train_loss: 1.0333, test_loss: 1.1431, test_f1: 0.4186
 epoch: 26, train_loss: 1.0244, test_loss: 1.1412, test_f1: 0.4290
 epoch: 27, train_loss: 1.0245, test_loss: 1.1458, test_f1: 0.4258
 epoch: 28, train_loss: 1.0085, test_loss: 1.1408, test_f1: 0.4554
 epoch: 29, train_loss: 1.0179, test_loss: 1.1324, test_f1: 0.4425
 epoch: 30, train_loss: 1.0109, test_loss: 1.1199, test_f1: 0.4448
 epoch: 31, train_loss: 1.0038, test_loss: 1.1207, test_f1: 0.4490
 epoch: 32, train_loss: 1.0039, test_loss: 1.1319, test_f1: 0.4528
 epoch: 33, train_loss: 1.0017, test_loss: 1.1347, test_f1: 0.4588
 epoch: 34, train_loss: 1.0015, test_loss: 1.1447, test_f1: 0.4753
 epoch: 35, train_loss: 0.9863, test_loss: 1.1252, test_f1: 0.4537
 epoch: 36, train_loss: 0.9854, test_loss: 1.1120, test_f1: 0.4027
 epoch: 37, train_loss: 1.0028, test_loss: 1.1206, test_f1: 0.4052
 epoch: 38, train_loss: 0.9986, test_loss: 1.1237, test_f1: 0.3709
 epoch: 39, train_loss: 0.9878, test_loss: 1.1560, test_f1: 0.4245
 epoch: 40, train_loss: 0.9920, test_loss: 1.1509, test_f1: 0.4505
 epoch: 41, train_loss: 0.9905, test_loss: 1.1432, test_f1: 0.4498
 epoch: 42, train_loss: 0.9801, test_loss: 1.1438, test_f1: 0.4611
 epoch: 43, train_loss: 0.9833, test_loss: 1.1381, test_f1: 0.4533
 epoch: 44, train_loss: 0.9743, test_loss: 1.1253, test_f1: 0.4515
 epoch: 45, train_loss: 0.9717, test_loss: 1.1212, test_f1: 0.4615
 epoch: 46, train_loss: 0.9695, test_loss: 1.1290, test_f1: 0.4664
 epoch: 47, train_loss: 0.9705, test_loss: 1.1522, test_f1: 0.4799
 epoch: 48, train_loss: 0.9681, test_loss: 1.1589, test_f1: 0.4813
 epoch: 49, train_loss: 0.9676, test_loss: 1.1659, test_f1: 0.4761
 epoch: 50, train_loss: 0.9513, test_loss: 1.1789, test_f1: 0.4707
 epoch: 51, train_loss: 0.9541, test_loss: 1.1677, test_f1: 0.4783
 epoch: 52, train_loss: 0.9552, test_loss: 1.1566, test_f1: 0.4755
 epoch: 53, train_loss: 0.9608, test_loss: 1.1507, test_f1: 0.4673
 epoch: 54, train_loss: 0.9431, test_loss: 1.1426, test_f1: 0.4716
 epoch: 55, train_loss: 0.9437, test_loss: 1.1239, test_f1: 0.4857
 epoch: 56, train_loss: 0.9433, test_loss: 1.1196, test_f1: 0.4849
 epoch: 57, train_loss: 0.9491, test_loss: 1.1323, test_f1: 0.4767
 epoch: 58, train_loss: 0.9429, test_loss: 1.1512, test_f1: 0.4765
 epoch: 59, train_loss: 0.9436, test_loss: 1.1415, test_f1: 0.4869
 epoch: 60, train_loss: 0.9404, test_loss: 1.1542, test_f1: 0.5022
 epoch: 61, train_loss: 0.9472, test_loss: 1.1401, test_f1: 0.4951
 epoch: 62, train_loss: 0.9311, test_loss: 1.1483, test_f1: 0.4974
 epoch: 63, train_loss: 0.9411, test_loss: 1.1632, test_f1: 0.4934
 epoch: 64, train_loss: 0.9314, test_loss: 1.1481, test_f1: 0.4950
 epoch: 65, train_loss: 0.9388, test_loss: 1.1474, test_f1: 0.4920
 epoch: 66, train_loss: 0.9272, test_loss: 1.1381, test_f1: 0.5045
 epoch: 67, train_loss: 0.9379, test_loss: 1.1543, test_f1: 0.4834
 epoch: 68, train_loss: 0.9396, test_loss: 1.1700, test_f1: 0.4879
 epoch: 69, train_loss: 0.9332, test_loss: 1.1495, test_f1: 0.4884
 epoch: 70, train_loss: 0.9362, test_loss: 1.1419, test_f1: 0.4880
 epoch: 71, train_loss: 0.9232, test_loss: 1.1548, test_f1: 0.4777
 epoch: 72, train_loss: 0.9177, test_loss: 1.1674, test_f1: 0.4917
 epoch: 73, train_loss: 0.9220, test_loss: 1.1493, test_f1: 0.5167
 epoch: 74, train_loss: 0.9106, test_loss: 1.1434, test_f1: 0.5082
 epoch: 75, train_loss: 0.9242, test_loss: 1.1465, test_f1: 0.4977
 epoch: 76, train_loss: 0.9299, test_loss: 1.1486, test_f1: 0.5018
 epoch: 77, train_loss: 0.9179, test_loss: 1.1688, test_f1: 0.4841
 epoch: 78, train_loss: 0.9068, test_loss: 1.1639, test_f1: 0.4815
 epoch: 79, train_loss: 0.9168, test_loss: 1.1368, test_f1: 0.5008
 epoch: 80, train_loss: 0.9219, test_loss: 1.1423, test_f1: 0.5051
 epoch: 81, train_loss: 0.9164, test_loss: 1.1517, test_f1: 0.5103
 epoch: 82, train_loss: 0.9179, test_loss: 1.1584, test_f1: 0.5037
 epoch: 83, train_loss: 0.9159, test_loss: 1.1435, test_f1: 0.5071
 epoch: 84, train_loss: 0.9095, test_loss: 1.1614, test_f1: 0.4998
 epoch: 85, train_loss: 0.9108, test_loss: 1.1496, test_f1: 0.5128
 epoch: 86, train_loss: 0.9056, test_loss: 1.1351, test_f1: 0.5005
 epoch: 87, train_loss: 0.9111, test_loss: 1.1551, test_f1: 0.5155
 epoch: 88, train_loss: 0.9054, test_loss: 1.1504, test_f1: 0.5072
 epoch: 89, train_loss: 0.9006, test_loss: 1.1548, test_f1: 0.5221
 epoch: 90, train_loss: 0.8985, test_loss: 1.1728, test_f1: 0.5111
 epoch: 91, train_loss: 0.9050, test_loss: 1.1719, test_f1: 0.5068
 epoch: 92, train_loss: 0.9062, test_loss: 1.1629, test_f1: 0.5081
 epoch: 93, train_loss: 0.9065, test_loss: 1.1627, test_f1: 0.5209
 epoch: 94, train_loss: 0.9053, test_loss: 1.1800, test_f1: 0.5286
 epoch: 95, train_loss: 0.9131, test_loss: 1.1743, test_f1: 0.5229
 epoch: 96, train_loss: 0.8956, test_loss: 1.1378, test_f1: 0.5160
 epoch: 97, train_loss: 0.9175, test_loss: 1.1530, test_f1: 0.5048
 epoch: 98, train_loss: 0.9056, test_loss: 1.2062, test_f1: 0.5125
 epoch: 99, train_loss: 0.8992, test_loss: 1.2636, test_f1: 0.5091
##################ITERATION #7 ****************************************
 epoch: 0, train_loss: 1.2868, test_loss: 1.3246, test_f1: 0.2281
 epoch: 1, train_loss: 1.1872, test_loss: 1.3190, test_f1: 0.2281
 epoch: 2, train_loss: 1.1495, test_loss: 1.2826, test_f1: 0.2281
 epoch: 3, train_loss: 1.1289, test_loss: 1.2595, test_f1: 0.2281
 epoch: 4, train_loss: 1.1068, test_loss: 1.2501, test_f1: 0.3092
 epoch: 5, train_loss: 1.1135, test_loss: 1.2574, test_f1: 0.2984
 epoch: 6, train_loss: 1.0979, test_loss: 1.2742, test_f1: 0.3013
 epoch: 7, train_loss: 1.0912, test_loss: 1.2434, test_f1: 0.2971
 epoch: 8, train_loss: 1.0857, test_loss: 1.2217, test_f1: 0.3198
 epoch: 9, train_loss: 1.0688, test_loss: 1.1759, test_f1: 0.3719
 epoch: 10, train_loss: 1.0655, test_loss: 1.1601, test_f1: 0.3714
 epoch: 11, train_loss: 1.0522, test_loss: 1.1562, test_f1: 0.4006
 epoch: 12, train_loss: 1.0503, test_loss: 1.1530, test_f1: 0.4203
 epoch: 13, train_loss: 1.0588, test_loss: 1.1573, test_f1: 0.3980
 epoch: 14, train_loss: 1.0486, test_loss: 1.1385, test_f1: 0.4008
 epoch: 15, train_loss: 1.0367, test_loss: 1.1301, test_f1: 0.4264
 epoch: 16, train_loss: 1.0227, test_loss: 1.1219, test_f1: 0.4287
 epoch: 17, train_loss: 1.0395, test_loss: 1.1225, test_f1: 0.4247
 epoch: 18, train_loss: 1.0229, test_loss: 1.1251, test_f1: 0.4083
 epoch: 19, train_loss: 1.0168, test_loss: 1.1081, test_f1: 0.4280
 epoch: 20, train_loss: 1.0272, test_loss: 1.0954, test_f1: 0.4062
 epoch: 21, train_loss: 1.0117, test_loss: 1.1113, test_f1: 0.4415
 epoch: 22, train_loss: 1.0043, test_loss: 1.1324, test_f1: 0.4466
 epoch: 23, train_loss: 0.9934, test_loss: 1.1059, test_f1: 0.4438
 epoch: 24, train_loss: 0.9948, test_loss: 1.1183, test_f1: 0.4555
 epoch: 25, train_loss: 1.0011, test_loss: 1.1339, test_f1: 0.4635
 epoch: 26, train_loss: 0.9848, test_loss: 1.1305, test_f1: 0.4710
 epoch: 27, train_loss: 0.9782, test_loss: 1.1454, test_f1: 0.4509
 epoch: 28, train_loss: 0.9825, test_loss: 1.1688, test_f1: 0.4655
 epoch: 29, train_loss: 0.9709, test_loss: 1.1717, test_f1: 0.4779
 epoch: 30, train_loss: 0.9771, test_loss: 1.1590, test_f1: 0.4416
 epoch: 31, train_loss: 0.9639, test_loss: 1.1377, test_f1: 0.4692
 epoch: 32, train_loss: 0.9513, test_loss: 1.1476, test_f1: 0.4522
 epoch: 33, train_loss: 0.9526, test_loss: 1.1395, test_f1: 0.4588
 epoch: 34, train_loss: 0.9606, test_loss: 1.1451, test_f1: 0.4767
 epoch: 35, train_loss: 0.9420, test_loss: 1.1837, test_f1: 0.4789
 epoch: 36, train_loss: 0.9506, test_loss: 1.2044, test_f1: 0.4766
 epoch: 37, train_loss: 0.9521, test_loss: 1.1796, test_f1: 0.4742
 epoch: 38, train_loss: 0.9706, test_loss: 1.1917, test_f1: 0.4785
 epoch: 39, train_loss: 0.9553, test_loss: 1.1820, test_f1: 0.4299
 epoch: 40, train_loss: 0.9423, test_loss: 1.1719, test_f1: 0.4274
 epoch: 41, train_loss: 0.9404, test_loss: 1.1732, test_f1: 0.4424
 epoch: 42, train_loss: 0.9249, test_loss: 1.1944, test_f1: 0.4608
 epoch: 43, train_loss: 0.9388, test_loss: 1.2202, test_f1: 0.4825
 epoch: 44, train_loss: 0.9394, test_loss: 1.1887, test_f1: 0.4857
 epoch: 45, train_loss: 0.9261, test_loss: 1.1883, test_f1: 0.5147
 epoch: 46, train_loss: 0.9292, test_loss: 1.1296, test_f1: 0.4763
 epoch: 47, train_loss: 0.9253, test_loss: 1.1454, test_f1: 0.4684
 epoch: 48, train_loss: 0.9168, test_loss: 1.1378, test_f1: 0.4825
 epoch: 49, train_loss: 0.9102, test_loss: 1.1660, test_f1: 0.4864
 epoch: 50, train_loss: 0.9083, test_loss: 1.2137, test_f1: 0.4586
 epoch: 51, train_loss: 0.9174, test_loss: 1.1941, test_f1: 0.4765
 epoch: 52, train_loss: 0.9010, test_loss: 1.1935, test_f1: 0.4786
 epoch: 53, train_loss: 0.9015, test_loss: 1.1935, test_f1: 0.4795
 epoch: 54, train_loss: 0.9175, test_loss: 1.1979, test_f1: 0.4942
 epoch: 55, train_loss: 0.9097, test_loss: 1.2126, test_f1: 0.5116
 epoch: 56, train_loss: 0.8921, test_loss: 1.1997, test_f1: 0.5131
 epoch: 57, train_loss: 0.8967, test_loss: 1.2006, test_f1: 0.5078
 epoch: 58, train_loss: 0.9014, test_loss: 1.2054, test_f1: 0.5009
 epoch: 59, train_loss: 0.8940, test_loss: 1.2182, test_f1: 0.5192
 epoch: 60, train_loss: 0.8875, test_loss: 1.2109, test_f1: 0.5038
 epoch: 61, train_loss: 0.8864, test_loss: 1.2166, test_f1: 0.4930
 epoch: 62, train_loss: 0.8883, test_loss: 1.2202, test_f1: 0.4929
 epoch: 63, train_loss: 0.8972, test_loss: 1.2145, test_f1: 0.4949
 epoch: 64, train_loss: 0.8823, test_loss: 1.2035, test_f1: 0.4980
 epoch: 65, train_loss: 0.8899, test_loss: 1.1824, test_f1: 0.4980
 epoch: 66, train_loss: 0.9015, test_loss: 1.1951, test_f1: 0.4975
 epoch: 67, train_loss: 0.8818, test_loss: 1.2210, test_f1: 0.5051
 epoch: 68, train_loss: 0.8997, test_loss: 1.2384, test_f1: 0.4960
 epoch: 69, train_loss: 0.8807, test_loss: 1.2364, test_f1: 0.5036
 epoch: 70, train_loss: 0.8896, test_loss: 1.2439, test_f1: 0.5078
 epoch: 71, train_loss: 0.8840, test_loss: 1.2313, test_f1: 0.5037
 epoch: 72, train_loss: 0.8936, test_loss: 1.2219, test_f1: 0.4961
 epoch: 73, train_loss: 0.8738, test_loss: 1.2195, test_f1: 0.5037
 epoch: 74, train_loss: 0.8857, test_loss: 1.2417, test_f1: 0.5073
 epoch: 75, train_loss: 0.8804, test_loss: 1.2617, test_f1: 0.4949
 epoch: 76, train_loss: 0.8781, test_loss: 1.2556, test_f1: 0.4964
 epoch: 77, train_loss: 0.8829, test_loss: 1.2688, test_f1: 0.4950
 epoch: 78, train_loss: 0.8897, test_loss: 1.2318, test_f1: 0.5004
 epoch: 79, train_loss: 0.8711, test_loss: 1.2200, test_f1: 0.5023
 epoch: 80, train_loss: 0.8703, test_loss: 1.2081, test_f1: 0.5043
 epoch: 81, train_loss: 0.8768, test_loss: 1.2020, test_f1: 0.5039
 epoch: 82, train_loss: 0.8821, test_loss: 1.2120, test_f1: 0.5191
 epoch: 83, train_loss: 0.8705, test_loss: 1.2174, test_f1: 0.5012
 epoch: 84, train_loss: 0.8701, test_loss: 1.2405, test_f1: 0.5026
 epoch: 85, train_loss: 0.8701, test_loss: 1.2591, test_f1: 0.4981
 epoch: 86, train_loss: 0.8814, test_loss: 1.2208, test_f1: 0.4970
 epoch: 87, train_loss: 0.8736, test_loss: 1.2125, test_f1: 0.4904
 epoch: 88, train_loss: 0.8983, test_loss: 1.2457, test_f1: 0.4963
 epoch: 89, train_loss: 0.8630, test_loss: 1.2189, test_f1: 0.4869
 epoch: 90, train_loss: 0.8916, test_loss: 1.2344, test_f1: 0.4961
 epoch: 91, train_loss: 0.8619, test_loss: 1.2705, test_f1: 0.5066
 epoch: 92, train_loss: 0.8837, test_loss: 1.2807, test_f1: 0.5025
 epoch: 93, train_loss: 0.8677, test_loss: 1.2542, test_f1: 0.4960
 epoch: 94, train_loss: 0.8538, test_loss: 1.2650, test_f1: 0.4954
 epoch: 95, train_loss: 0.8577, test_loss: 1.2652, test_f1: 0.4953
 epoch: 96, train_loss: 0.8571, test_loss: 1.2701, test_f1: 0.4995
 epoch: 97, train_loss: 0.8578, test_loss: 1.2752, test_f1: 0.4990
 epoch: 98, train_loss: 0.8514, test_loss: 1.2537, test_f1: 0.4997
 epoch: 99, train_loss: 0.8550, test_loss: 1.2472, test_f1: 0.5073
##################ITERATION #8 ****************************************
 epoch: 0, train_loss: 1.2832, test_loss: 1.3116, test_f1: 0.2281
 epoch: 1, train_loss: 1.1994, test_loss: 1.3029, test_f1: 0.2281
 epoch: 2, train_loss: 1.1741, test_loss: 1.3127, test_f1: 0.2281
 epoch: 3, train_loss: 1.1592, test_loss: 1.3154, test_f1: 0.2281
 epoch: 4, train_loss: 1.1262, test_loss: 1.2996, test_f1: 0.2281
 epoch: 5, train_loss: 1.1179, test_loss: 1.2529, test_f1: 0.2628
 epoch: 6, train_loss: 1.1122, test_loss: 1.2378, test_f1: 0.3320
 epoch: 7, train_loss: 1.0966, test_loss: 1.2098, test_f1: 0.3342
 epoch: 8, train_loss: 1.0872, test_loss: 1.1836, test_f1: 0.3997
 epoch: 9, train_loss: 1.0910, test_loss: 1.1586, test_f1: 0.4518
 epoch: 10, train_loss: 1.0821, test_loss: 1.1463, test_f1: 0.4384
 epoch: 11, train_loss: 1.0612, test_loss: 1.1367, test_f1: 0.4484
 epoch: 12, train_loss: 1.0561, test_loss: 1.1280, test_f1: 0.4508
 epoch: 13, train_loss: 1.0386, test_loss: 1.1198, test_f1: 0.4551
 epoch: 14, train_loss: 1.0411, test_loss: 1.1312, test_f1: 0.4512
 epoch: 15, train_loss: 1.0382, test_loss: 1.1104, test_f1: 0.4620
 epoch: 16, train_loss: 1.0133, test_loss: 1.1185, test_f1: 0.4611
 epoch: 17, train_loss: 1.0234, test_loss: 1.1065, test_f1: 0.4692
 epoch: 18, train_loss: 1.0183, test_loss: 1.1053, test_f1: 0.4749
 epoch: 19, train_loss: 1.0158, test_loss: 1.1131, test_f1: 0.4694
 epoch: 20, train_loss: 0.9973, test_loss: 1.1207, test_f1: 0.5019
 epoch: 21, train_loss: 1.0090, test_loss: 1.1447, test_f1: 0.5022
 epoch: 22, train_loss: 0.9991, test_loss: 1.1299, test_f1: 0.4801
 epoch: 23, train_loss: 0.9931, test_loss: 1.1155, test_f1: 0.4855
 epoch: 24, train_loss: 1.0003, test_loss: 1.0895, test_f1: 0.4888
 epoch: 25, train_loss: 0.9928, test_loss: 1.1040, test_f1: 0.4915
 epoch: 26, train_loss: 0.9924, test_loss: 1.1194, test_f1: 0.4809
 epoch: 27, train_loss: 0.9925, test_loss: 1.1161, test_f1: 0.4839
 epoch: 28, train_loss: 0.9921, test_loss: 1.1105, test_f1: 0.4841
 epoch: 29, train_loss: 0.9925, test_loss: 1.1113, test_f1: 0.4875
 epoch: 30, train_loss: 0.9806, test_loss: 1.1110, test_f1: 0.4834
 epoch: 31, train_loss: 0.9678, test_loss: 1.1211, test_f1: 0.4948
 epoch: 32, train_loss: 0.9670, test_loss: 1.1154, test_f1: 0.4911
 epoch: 33, train_loss: 0.9677, test_loss: 1.1074, test_f1: 0.5055
 epoch: 34, train_loss: 0.9631, test_loss: 1.1060, test_f1: 0.5116
 epoch: 35, train_loss: 0.9599, test_loss: 1.1095, test_f1: 0.5092
 epoch: 36, train_loss: 0.9475, test_loss: 1.0764, test_f1: 0.5123
 epoch: 37, train_loss: 0.9621, test_loss: 1.0668, test_f1: 0.4841
 epoch: 38, train_loss: 0.9656, test_loss: 1.0946, test_f1: 0.4993
 epoch: 39, train_loss: 0.9541, test_loss: 1.0921, test_f1: 0.4809
 epoch: 40, train_loss: 0.9512, test_loss: 1.0817, test_f1: 0.4873
 epoch: 41, train_loss: 0.9555, test_loss: 1.0926, test_f1: 0.4816
 epoch: 42, train_loss: 0.9370, test_loss: 1.0873, test_f1: 0.4834
 epoch: 43, train_loss: 0.9379, test_loss: 1.0789, test_f1: 0.4734
 epoch: 44, train_loss: 0.9358, test_loss: 1.0960, test_f1: 0.4771
 epoch: 45, train_loss: 0.9473, test_loss: 1.1184, test_f1: 0.4660
 epoch: 46, train_loss: 0.9335, test_loss: 1.1416, test_f1: 0.4681
 epoch: 47, train_loss: 0.9392, test_loss: 1.0953, test_f1: 0.5081
 epoch: 48, train_loss: 0.9345, test_loss: 1.0487, test_f1: 0.4964
 epoch: 49, train_loss: 0.9459, test_loss: 1.0876, test_f1: 0.4925
 epoch: 50, train_loss: 0.9511, test_loss: 1.1486, test_f1: 0.5149
 epoch: 51, train_loss: 0.9298, test_loss: 1.1604, test_f1: 0.5034
 epoch: 52, train_loss: 0.9348, test_loss: 1.1803, test_f1: 0.4921
 epoch: 53, train_loss: 0.9355, test_loss: 1.1993, test_f1: 0.4976
 epoch: 54, train_loss: 0.9152, test_loss: 1.2026, test_f1: 0.4918
 epoch: 55, train_loss: 0.9184, test_loss: 1.1928, test_f1: 0.4962
 epoch: 56, train_loss: 0.9100, test_loss: 1.2043, test_f1: 0.4922
 epoch: 57, train_loss: 0.9070, test_loss: 1.2350, test_f1: 0.5133
 epoch: 58, train_loss: 0.9179, test_loss: 1.2278, test_f1: 0.5067
 epoch: 59, train_loss: 0.9081, test_loss: 1.2385, test_f1: 0.5061
 epoch: 60, train_loss: 0.9046, test_loss: 1.2275, test_f1: 0.5101
 epoch: 61, train_loss: 0.9207, test_loss: 1.2169, test_f1: 0.5049
 epoch: 62, train_loss: 0.9048, test_loss: 1.1877, test_f1: 0.4837
 epoch: 63, train_loss: 0.9176, test_loss: 1.1952, test_f1: 0.4900
 epoch: 64, train_loss: 0.9104, test_loss: 1.1985, test_f1: 0.4834
 epoch: 65, train_loss: 0.9105, test_loss: 1.2195, test_f1: 0.5009
 epoch: 66, train_loss: 0.9054, test_loss: 1.2103, test_f1: 0.5138
 epoch: 67, train_loss: 0.8960, test_loss: 1.2202, test_f1: 0.4965
 epoch: 68, train_loss: 0.9128, test_loss: 1.2189, test_f1: 0.4850
 epoch: 69, train_loss: 0.8902, test_loss: 1.1897, test_f1: 0.4938
 epoch: 70, train_loss: 0.9024, test_loss: 1.1861, test_f1: 0.5258
 epoch: 71, train_loss: 0.9013, test_loss: 1.1785, test_f1: 0.5247
 epoch: 72, train_loss: 0.8877, test_loss: 1.1948, test_f1: 0.5081
 epoch: 73, train_loss: 0.9010, test_loss: 1.2000, test_f1: 0.5083
 epoch: 74, train_loss: 0.8938, test_loss: 1.2016, test_f1: 0.5153
 epoch: 75, train_loss: 0.8894, test_loss: 1.1845, test_f1: 0.4971
 epoch: 76, train_loss: 0.8904, test_loss: 1.1629, test_f1: 0.4944
 epoch: 77, train_loss: 0.8793, test_loss: 1.1400, test_f1: 0.4953
 epoch: 78, train_loss: 0.8890, test_loss: 1.1390, test_f1: 0.5178
 epoch: 79, train_loss: 0.8904, test_loss: 1.1539, test_f1: 0.5178
 epoch: 80, train_loss: 0.8819, test_loss: 1.2080, test_f1: 0.5235
 epoch: 81, train_loss: 0.8833, test_loss: 1.2366, test_f1: 0.5165
 epoch: 82, train_loss: 0.8973, test_loss: 1.2311, test_f1: 0.4921
 epoch: 83, train_loss: 0.8828, test_loss: 1.2128, test_f1: 0.4796
 epoch: 84, train_loss: 0.8820, test_loss: 1.2162, test_f1: 0.5096
 epoch: 85, train_loss: 0.8936, test_loss: 1.2573, test_f1: 0.4986
 epoch: 86, train_loss: 0.8759, test_loss: 1.2573, test_f1: 0.5100
 epoch: 87, train_loss: 0.8757, test_loss: 1.2612, test_f1: 0.5000
 epoch: 88, train_loss: 0.8624, test_loss: 1.2626, test_f1: 0.5183
 epoch: 89, train_loss: 0.8818, test_loss: 1.2990, test_f1: 0.5330
 epoch: 90, train_loss: 0.8747, test_loss: 1.3071, test_f1: 0.5219
 epoch: 91, train_loss: 0.8811, test_loss: 1.3221, test_f1: 0.5240
 epoch: 92, train_loss: 0.8650, test_loss: 1.3385, test_f1: 0.5447
 epoch: 93, train_loss: 0.8757, test_loss: 1.3216, test_f1: 0.5386
 epoch: 94, train_loss: 0.8727, test_loss: 1.2888, test_f1: 0.5134
 epoch: 95, train_loss: 0.8801, test_loss: 1.2742, test_f1: 0.5151
 epoch: 96, train_loss: 0.8651, test_loss: 1.3177, test_f1: 0.5100
 epoch: 97, train_loss: 0.8758, test_loss: 1.2923, test_f1: 0.5100
 epoch: 98, train_loss: 0.8798, test_loss: 1.2610, test_f1: 0.5190
 epoch: 99, train_loss: 0.8718, test_loss: 1.2192, test_f1: 0.5231
##################ITERATION #9 ****************************************
 epoch: 0, train_loss: 1.7171, test_loss: 1.4643, test_f1: 0.0507
 epoch: 1, train_loss: 1.4187, test_loss: 1.4244, test_f1: 0.0507
 epoch: 2, train_loss: 1.3360, test_loss: 1.4094, test_f1: 0.0507
 epoch: 3, train_loss: 1.2743, test_loss: 1.3934, test_f1: 0.0507
 epoch: 4, train_loss: 1.2499, test_loss: 1.3892, test_f1: 0.0713
 epoch: 5, train_loss: 1.2177, test_loss: 1.3354, test_f1: 0.2673
 epoch: 6, train_loss: 1.1920, test_loss: 1.2723, test_f1: 0.3803
 epoch: 7, train_loss: 1.1552, test_loss: 1.2341, test_f1: 0.3539
 epoch: 8, train_loss: 1.1483, test_loss: 1.1990, test_f1: 0.4049
 epoch: 9, train_loss: 1.1266, test_loss: 1.1843, test_f1: 0.4417
 epoch: 10, train_loss: 1.1146, test_loss: 1.2037, test_f1: 0.4176
 epoch: 11, train_loss: 1.0985, test_loss: 1.1827, test_f1: 0.4633
 epoch: 12, train_loss: 1.1119, test_loss: 1.1655, test_f1: 0.4613
 epoch: 13, train_loss: 1.1044, test_loss: 1.1624, test_f1: 0.4514
 epoch: 14, train_loss: 1.0939, test_loss: 1.1487, test_f1: 0.4482
 epoch: 15, train_loss: 1.0790, test_loss: 1.1507, test_f1: 0.4664
 epoch: 16, train_loss: 1.0665, test_loss: 1.1442, test_f1: 0.4845
 epoch: 17, train_loss: 1.0767, test_loss: 1.1482, test_f1: 0.4685
 epoch: 18, train_loss: 1.0620, test_loss: 1.1563, test_f1: 0.4687
 epoch: 19, train_loss: 1.0603, test_loss: 1.1455, test_f1: 0.4808
 epoch: 20, train_loss: 1.0517, test_loss: 1.1424, test_f1: 0.5010
 epoch: 21, train_loss: 1.0541, test_loss: 1.1496, test_f1: 0.4991
 epoch: 22, train_loss: 1.0508, test_loss: 1.1193, test_f1: 0.4922
 epoch: 23, train_loss: 1.0459, test_loss: 1.1006, test_f1: 0.4954
 epoch: 24, train_loss: 1.0332, test_loss: 1.1302, test_f1: 0.5227
 epoch: 25, train_loss: 1.0313, test_loss: 1.1246, test_f1: 0.5084
 epoch: 26, train_loss: 1.0232, test_loss: 1.1007, test_f1: 0.5278
 epoch: 27, train_loss: 1.0208, test_loss: 1.1255, test_f1: 0.5189
 epoch: 28, train_loss: 1.0293, test_loss: 1.1253, test_f1: 0.5220
 epoch: 29, train_loss: 1.0188, test_loss: 1.1173, test_f1: 0.5184
 epoch: 30, train_loss: 0.9997, test_loss: 1.1183, test_f1: 0.5116
 epoch: 31, train_loss: 1.0010, test_loss: 1.1382, test_f1: 0.5227
 epoch: 32, train_loss: 1.0003, test_loss: 1.1512, test_f1: 0.5084
 epoch: 33, train_loss: 0.9954, test_loss: 1.1088, test_f1: 0.5168
 epoch: 34, train_loss: 0.9902, test_loss: 1.0999, test_f1: 0.5198
 epoch: 35, train_loss: 0.9942, test_loss: 1.1323, test_f1: 0.5303
 epoch: 36, train_loss: 0.9820, test_loss: 1.1212, test_f1: 0.5160
 epoch: 37, train_loss: 1.0055, test_loss: 1.1210, test_f1: 0.5188
 epoch: 38, train_loss: 0.9832, test_loss: 1.1105, test_f1: 0.5124
 epoch: 39, train_loss: 0.9747, test_loss: 1.1029, test_f1: 0.4932
 epoch: 40, train_loss: 0.9685, test_loss: 1.1150, test_f1: 0.5165
 epoch: 41, train_loss: 0.9783, test_loss: 1.1195, test_f1: 0.5217
 epoch: 42, train_loss: 0.9894, test_loss: 1.0928, test_f1: 0.5070
 epoch: 43, train_loss: 0.9827, test_loss: 1.0906, test_f1: 0.4942
 epoch: 44, train_loss: 0.9897, test_loss: 1.1043, test_f1: 0.4927
 epoch: 45, train_loss: 0.9836, test_loss: 1.1043, test_f1: 0.5246
 epoch: 46, train_loss: 0.9767, test_loss: 1.0986, test_f1: 0.5194
 epoch: 47, train_loss: 0.9665, test_loss: 1.0820, test_f1: 0.4828
 epoch: 48, train_loss: 0.9679, test_loss: 1.0771, test_f1: 0.4941
 epoch: 49, train_loss: 0.9719, test_loss: 1.0781, test_f1: 0.5127
 epoch: 50, train_loss: 0.9671, test_loss: 1.0895, test_f1: 0.5359
 epoch: 51, train_loss: 0.9519, test_loss: 1.0942, test_f1: 0.5246
 epoch: 52, train_loss: 0.9670, test_loss: 1.0977, test_f1: 0.5276
 epoch: 53, train_loss: 0.9397, test_loss: 1.1057, test_f1: 0.5303
 epoch: 54, train_loss: 0.9493, test_loss: 1.1040, test_f1: 0.5265
 epoch: 55, train_loss: 0.9508, test_loss: 1.0858, test_f1: 0.5298
 epoch: 56, train_loss: 0.9511, test_loss: 1.0743, test_f1: 0.5276
 epoch: 57, train_loss: 0.9409, test_loss: 1.0715, test_f1: 0.5271
 epoch: 58, train_loss: 0.9325, test_loss: 1.1050, test_f1: 0.5106
 epoch: 59, train_loss: 0.9316, test_loss: 1.1196, test_f1: 0.4896
 epoch: 60, train_loss: 0.9340, test_loss: 1.1191, test_f1: 0.4934
 epoch: 61, train_loss: 0.9210, test_loss: 1.1086, test_f1: 0.5181
 epoch: 62, train_loss: 0.9339, test_loss: 1.1160, test_f1: 0.5188
 epoch: 63, train_loss: 0.9248, test_loss: 1.1147, test_f1: 0.5177
 epoch: 64, train_loss: 0.9353, test_loss: 1.1130, test_f1: 0.5232
 epoch: 65, train_loss: 0.9257, test_loss: 1.1092, test_f1: 0.5263
 epoch: 66, train_loss: 0.9305, test_loss: 1.1169, test_f1: 0.5176
 epoch: 67, train_loss: 0.9266, test_loss: 1.1180, test_f1: 0.5196
 epoch: 68, train_loss: 0.9339, test_loss: 1.1154, test_f1: 0.4998
 epoch: 69, train_loss: 0.9225, test_loss: 1.0779, test_f1: 0.5351
 epoch: 70, train_loss: 0.9183, test_loss: 1.0525, test_f1: 0.5396
 epoch: 71, train_loss: 0.9363, test_loss: 1.0546, test_f1: 0.5223
 epoch: 72, train_loss: 0.9346, test_loss: 1.0565, test_f1: 0.5221
 epoch: 73, train_loss: 0.9328, test_loss: 1.0757, test_f1: 0.5306
 epoch: 74, train_loss: 0.9109, test_loss: 1.0834, test_f1: 0.5286
 epoch: 75, train_loss: 0.9264, test_loss: 1.0882, test_f1: 0.5196
 epoch: 76, train_loss: 0.9189, test_loss: 1.0851, test_f1: 0.5370
 epoch: 77, train_loss: 0.9172, test_loss: 1.0985, test_f1: 0.5092
 epoch: 78, train_loss: 0.9122, test_loss: 1.0997, test_f1: 0.5029
 epoch: 79, train_loss: 0.9111, test_loss: 1.1375, test_f1: 0.5080
 epoch: 80, train_loss: 0.9244, test_loss: 1.1272, test_f1: 0.5178
 epoch: 81, train_loss: 0.9029, test_loss: 1.1028, test_f1: 0.5258
 epoch: 82, train_loss: 0.9107, test_loss: 1.0936, test_f1: 0.5326
 epoch: 83, train_loss: 0.9203, test_loss: 1.0872, test_f1: 0.5320
 epoch: 84, train_loss: 0.9195, test_loss: 1.0921, test_f1: 0.5348
 epoch: 85, train_loss: 0.9097, test_loss: 1.1031, test_f1: 0.5329
 epoch: 86, train_loss: 0.9135, test_loss: 1.1174, test_f1: 0.5397
 epoch: 87, train_loss: 0.9135, test_loss: 1.1230, test_f1: 0.5374
 epoch: 88, train_loss: 0.9075, test_loss: 1.1036, test_f1: 0.5413
 epoch: 89, train_loss: 0.9032, test_loss: 1.0971, test_f1: 0.5443
 epoch: 90, train_loss: 0.8969, test_loss: 1.1049, test_f1: 0.5344
 epoch: 91, train_loss: 0.9009, test_loss: 1.1084, test_f1: 0.5373
 epoch: 92, train_loss: 0.9050, test_loss: 1.1131, test_f1: 0.5357
 epoch: 93, train_loss: 0.9146, test_loss: 1.1143, test_f1: 0.5214
 epoch: 94, train_loss: 0.9037, test_loss: 1.1289, test_f1: 0.5218
 epoch: 95, train_loss: 0.9045, test_loss: 1.1271, test_f1: 0.5329
 epoch: 96, train_loss: 0.9023, test_loss: 1.1250, test_f1: 0.5385
 epoch: 97, train_loss: 0.8999, test_loss: 1.1347, test_f1: 0.5345
 epoch: 98, train_loss: 0.9070, test_loss: 1.1396, test_f1: 0.5303
 epoch: 99, train_loss: 0.8925, test_loss: 1.1371, test_f1: 0.5244

Training completed in 310.77 seconds
Best F1: 0.5479 at epoch 77
Mean F1 across iterations: 0.5231  0.0270
========================FINAL RESULTS================================
FEGIN weighted F1: 0.5479  0.0270
python main.py --data ltspice_demos --representation component_net --model FEGIN --layers 5 --hiddens 16 --batch_size 256 --lr 0.001 --emb_size 512 --epochs 100 --save_appendix component_net_L5_H16_BS256_LR0.001_E512 --no_val
-----



STDERR:
  File "main.py", line 370, in <module>
    main()
  File "main.py", line 254, in main
    dataset = dataset_class(
  File "/home/philip/projects/ltspice_examples_code_repo/Circuit-Completion-Using-GNNs/component_classification_with_link_prediction_head/evaluation/FEGIN/kernel/circuit_datasets.py", line 15, in __init__
    self.data, self.slices = torch.load(self.processed_paths[0])
  File "/home/philip/.local/lib/python3.8/site-packages/torch/serialization.py", line 1040, in load
    warnings.warn(
  File "/usr/lib/python3.8/warnings.py", line 109, in _showwarnmsg
    sw(msg.message, msg.category, msg.filename, msg.lineno,
  File "main.py", line 47, in warn_with_traceback
    traceback.print_stack(file=log)
/home/philip/projects/ltspice_examples_code_repo/Circuit-Completion-Using-GNNs/component_classification_with_link_prediction_head/evaluation/FEGIN/kernel/circuit_datasets.py:15: FutureWarning: You are using `torch.load` with `weights_only=False` (the current default value), which uses the default pickle module implicitly. It is possible to construct malicious pickle data which will execute arbitrary code during unpickling (See https://github.com/pytorch/pytorch/blob/main/SECURITY.md#untrusted-models for more details). In a future release, the default value for `weights_only` will be flipped to `True`. This limits the functions that could be executed during unpickling. Arbitrary objects will no longer be allowed to be loaded via this mode unless they are explicitly allowlisted by the user via `torch.serialization.add_safe_globals`. We recommend you start setting `weights_only=True` for any use case where you don't have full control of the loaded file. Please open an issue on GitHub for any issues related to this experimental feature.
  self.data, self.slices = torch.load(self.processed_paths[0])
