STDOUT:
Results will be saved in /home/philip/projects/ltspice_examples_code_repo/Circuit-Completion-Using-GNNs/component_classification_with_link_prediction_head/evaluation/FEGIN/results/model_FEGIN_dataset_ltspice_demos
Command line input: python main.py --data ltspice_demos --representation component_component --model FEGIN --layers 6 --hiddens 64 --batch_size 64 --lr 0.001 --emb_size 512 --epochs 100 --save_appendix component_component_L6_H64_BS64_LR0.001_E512 --no_val
 is saved.
-----
ltspice_demos - FEGIN
Using 6 layers, 64 hidden units, h = 2
Loading component_component representation dataset
ENTERED
Training FEGIN on component_component representation
Train: 1565, Test: 383
##################ITERATION #0 ****************************************
 epoch: 0, train_loss: 1.2755, test_loss: 1.2946, test_f1: 0.2281
 epoch: 1, train_loss: 1.1878, test_loss: 1.2457, test_f1: 0.3514
 epoch: 2, train_loss: 1.1474, test_loss: 1.2255, test_f1: 0.3301
 epoch: 3, train_loss: 1.0931, test_loss: 1.1689, test_f1: 0.3844
 epoch: 4, train_loss: 1.0729, test_loss: 1.1485, test_f1: 0.4468
 epoch: 5, train_loss: 1.0146, test_loss: 1.1464, test_f1: 0.4200
 epoch: 6, train_loss: 0.9868, test_loss: 1.1310, test_f1: 0.4441
 epoch: 7, train_loss: 0.9475, test_loss: 1.1694, test_f1: 0.4768
 epoch: 8, train_loss: 0.9192, test_loss: 1.1666, test_f1: 0.4722
 epoch: 9, train_loss: 0.8899, test_loss: 1.1162, test_f1: 0.5007
 epoch: 10, train_loss: 0.8747, test_loss: 1.1186, test_f1: 0.4968
 epoch: 11, train_loss: 0.8513, test_loss: 1.1515, test_f1: 0.5170
 epoch: 12, train_loss: 0.8249, test_loss: 1.1071, test_f1: 0.5502
 epoch: 13, train_loss: 0.8272, test_loss: 1.2742, test_f1: 0.5439
 epoch: 14, train_loss: 0.8034, test_loss: 1.0899, test_f1: 0.5029
 epoch: 15, train_loss: 0.8053, test_loss: 1.2378, test_f1: 0.5750
 epoch: 16, train_loss: 0.7654, test_loss: 1.3184, test_f1: 0.5128
 epoch: 17, train_loss: 0.7666, test_loss: 1.4144, test_f1: 0.5023
 epoch: 18, train_loss: 0.7606, test_loss: 1.3303, test_f1: 0.5152
 epoch: 19, train_loss: 0.7365, test_loss: 1.5336, test_f1: 0.5581
 epoch: 20, train_loss: 0.7167, test_loss: 1.5061, test_f1: 0.5376
 epoch: 21, train_loss: 0.7011, test_loss: 1.2860, test_f1: 0.5552
 epoch: 22, train_loss: 0.7106, test_loss: 1.4411, test_f1: 0.5188
 epoch: 23, train_loss: 0.7084, test_loss: 1.4010, test_f1: 0.5693
 epoch: 24, train_loss: 0.6807, test_loss: 1.4313, test_f1: 0.5320
 epoch: 25, train_loss: 0.6789, test_loss: 1.4102, test_f1: 0.5577
 epoch: 26, train_loss: 0.6678, test_loss: 1.5762, test_f1: 0.5234
 epoch: 27, train_loss: 0.6384, test_loss: 1.6080, test_f1: 0.4977
 epoch: 28, train_loss: 0.6482, test_loss: 1.4060, test_f1: 0.5512
 epoch: 29, train_loss: 0.6548, test_loss: 1.4847, test_f1: 0.5252
 epoch: 30, train_loss: 0.6450, test_loss: 1.6309, test_f1: 0.5141
 epoch: 31, train_loss: 0.6197, test_loss: 1.5749, test_f1: 0.5624
 epoch: 32, train_loss: 0.6069, test_loss: 1.6242, test_f1: 0.5581
 epoch: 33, train_loss: 0.5644, test_loss: 1.5900, test_f1: 0.5656
 epoch: 34, train_loss: 0.5577, test_loss: 1.6020, test_f1: 0.5410
 epoch: 35, train_loss: 0.5826, test_loss: 1.6680, test_f1: 0.5150
 epoch: 36, train_loss: 0.5681, test_loss: 1.8233, test_f1: 0.5330
 epoch: 37, train_loss: 0.5590, test_loss: 1.8519, test_f1: 0.4985
 epoch: 38, train_loss: 0.5834, test_loss: 2.0342, test_f1: 0.5052
 epoch: 39, train_loss: 0.5549, test_loss: 1.8379, test_f1: 0.5187
 epoch: 40, train_loss: 0.5390, test_loss: 1.9751, test_f1: 0.5342
 epoch: 41, train_loss: 0.5593, test_loss: 2.0643, test_f1: 0.5738
 epoch: 42, train_loss: 0.5715, test_loss: 2.1180, test_f1: 0.4919
 epoch: 43, train_loss: 0.5397, test_loss: 2.0818, test_f1: 0.4941
 epoch: 44, train_loss: 0.5209, test_loss: 2.1765, test_f1: 0.5113
 epoch: 45, train_loss: 0.4932, test_loss: 2.1297, test_f1: 0.5407
 epoch: 46, train_loss: 0.4653, test_loss: 2.0998, test_f1: 0.4872
 epoch: 47, train_loss: 0.4588, test_loss: 2.0457, test_f1: 0.5136
 epoch: 48, train_loss: 0.4830, test_loss: 2.1410, test_f1: 0.5404
 epoch: 49, train_loss: 0.4789, test_loss: 2.1111, test_f1: 0.4813
 epoch: 50, train_loss: 0.4895, test_loss: 2.0136, test_f1: 0.5379
 epoch: 51, train_loss: 0.4382, test_loss: 1.9648, test_f1: 0.5517
 epoch: 52, train_loss: 0.4083, test_loss: 2.1089, test_f1: 0.5395
 epoch: 53, train_loss: 0.3934, test_loss: 1.8739, test_f1: 0.5672
 epoch: 54, train_loss: 0.3886, test_loss: 2.2959, test_f1: 0.5216
 epoch: 55, train_loss: 0.3780, test_loss: 2.0819, test_f1: 0.5274
 epoch: 56, train_loss: 0.3589, test_loss: 2.2992, test_f1: 0.5120
 epoch: 57, train_loss: 0.3584, test_loss: 2.2899, test_f1: 0.5370
 epoch: 58, train_loss: 0.3682, test_loss: 2.3462, test_f1: 0.5656
 epoch: 59, train_loss: 0.3380, test_loss: 2.3738, test_f1: 0.5722
 epoch: 60, train_loss: 0.3375, test_loss: 2.5724, test_f1: 0.5582
 epoch: 61, train_loss: 0.3428, test_loss: 2.3626, test_f1: 0.5669
 epoch: 62, train_loss: 0.3620, test_loss: 2.4259, test_f1: 0.5946
 epoch: 63, train_loss: 0.3780, test_loss: 2.5819, test_f1: 0.5528
 epoch: 64, train_loss: 0.3473, test_loss: 2.8102, test_f1: 0.5482
 epoch: 65, train_loss: 0.3196, test_loss: 2.8748, test_f1: 0.5316
 epoch: 66, train_loss: 0.3097, test_loss: 2.7391, test_f1: 0.5687
 epoch: 67, train_loss: 0.3503, test_loss: 2.9411, test_f1: 0.5502
 epoch: 68, train_loss: 0.3396, test_loss: 2.9245, test_f1: 0.5415
 epoch: 69, train_loss: 0.3176, test_loss: 3.0753, test_f1: 0.5689
 epoch: 70, train_loss: 0.3322, test_loss: 3.1313, test_f1: 0.5295
 epoch: 71, train_loss: 0.2925, test_loss: 3.0553, test_f1: 0.5229
 epoch: 72, train_loss: 0.2876, test_loss: 2.9731, test_f1: 0.5381
 epoch: 73, train_loss: 0.3084, test_loss: 3.0707, test_f1: 0.5339
 epoch: 74, train_loss: 0.2942, test_loss: 2.7563, test_f1: 0.5673
 epoch: 75, train_loss: 0.2919, test_loss: 3.1744, test_f1: 0.5384
 epoch: 76, train_loss: 0.3094, test_loss: 3.4940, test_f1: 0.5559
 epoch: 77, train_loss: 0.2993, test_loss: 2.9214, test_f1: 0.5493
 epoch: 78, train_loss: 0.2747, test_loss: 3.1561, test_f1: 0.5525
 epoch: 79, train_loss: 0.3086, test_loss: 2.9085, test_f1: 0.4861
 epoch: 80, train_loss: 0.2599, test_loss: 3.3225, test_f1: 0.5545
 epoch: 81, train_loss: 0.2886, test_loss: 2.9261, test_f1: 0.5438
 epoch: 82, train_loss: 0.2815, test_loss: 3.0013, test_f1: 0.5320
 epoch: 83, train_loss: 0.2695, test_loss: 3.0045, test_f1: 0.5571
 epoch: 84, train_loss: 0.2793, test_loss: 3.4139, test_f1: 0.5558
 epoch: 85, train_loss: 0.2595, test_loss: 3.6239, test_f1: 0.5769
 epoch: 86, train_loss: 0.2868, test_loss: 3.2791, test_f1: 0.5489
 epoch: 87, train_loss: 0.2647, test_loss: 3.0263, test_f1: 0.5587
 epoch: 88, train_loss: 0.2790, test_loss: 3.3477, test_f1: 0.5337
 epoch: 89, train_loss: 0.2553, test_loss: 3.3153, test_f1: 0.5367
 epoch: 90, train_loss: 0.2547, test_loss: 3.1819, test_f1: 0.5473
 epoch: 91, train_loss: 0.2390, test_loss: 3.3817, test_f1: 0.5339
 epoch: 92, train_loss: 0.2388, test_loss: 3.2403, test_f1: 0.5164
 epoch: 93, train_loss: 0.2611, test_loss: 2.9958, test_f1: 0.5517
 epoch: 94, train_loss: 0.2595, test_loss: 3.4967, test_f1: 0.5492
 epoch: 95, train_loss: 0.2518, test_loss: 3.7268, test_f1: 0.5224
 epoch: 96, train_loss: 0.2600, test_loss: 3.6049, test_f1: 0.5255
 epoch: 97, train_loss: 0.2721, test_loss: 3.5945, test_f1: 0.5382
 epoch: 98, train_loss: 0.2461, test_loss: 3.3353, test_f1: 0.5425
 epoch: 99, train_loss: 0.2545, test_loss: 3.5595, test_f1: 0.5489
##################ITERATION #1 ****************************************
 epoch: 0, train_loss: 1.2066, test_loss: 1.2583, test_f1: 0.3863
 epoch: 1, train_loss: 1.1112, test_loss: 1.2277, test_f1: 0.4344
 epoch: 2, train_loss: 1.0413, test_loss: 1.2172, test_f1: 0.4645
 epoch: 3, train_loss: 0.9990, test_loss: 1.1117, test_f1: 0.5020
 epoch: 4, train_loss: 0.9688, test_loss: 1.2531, test_f1: 0.4284
 epoch: 5, train_loss: 0.9381, test_loss: 1.1585, test_f1: 0.4967
 epoch: 6, train_loss: 0.9228, test_loss: 1.1873, test_f1: 0.5198
 epoch: 7, train_loss: 0.8968, test_loss: 1.1719, test_f1: 0.5300
 epoch: 8, train_loss: 0.8538, test_loss: 1.1410, test_f1: 0.4843
 epoch: 9, train_loss: 0.8487, test_loss: 1.2280, test_f1: 0.5563
 epoch: 10, train_loss: 0.8240, test_loss: 1.1384, test_f1: 0.5708
 epoch: 11, train_loss: 0.8181, test_loss: 1.2424, test_f1: 0.5509
 epoch: 12, train_loss: 0.7738, test_loss: 1.3123, test_f1: 0.5227
 epoch: 13, train_loss: 0.7615, test_loss: 1.4501, test_f1: 0.5067
 epoch: 14, train_loss: 0.7687, test_loss: 1.5641, test_f1: 0.5141
 epoch: 15, train_loss: 0.7683, test_loss: 1.2885, test_f1: 0.5503
 epoch: 16, train_loss: 0.7579, test_loss: 1.2075, test_f1: 0.5404
 epoch: 17, train_loss: 0.7510, test_loss: 1.2577, test_f1: 0.5579
 epoch: 18, train_loss: 0.7066, test_loss: 1.1566, test_f1: 0.5956
 epoch: 19, train_loss: 0.7226, test_loss: 1.5017, test_f1: 0.5937
 epoch: 20, train_loss: 0.7020, test_loss: 1.4120, test_f1: 0.5212
 epoch: 21, train_loss: 0.6760, test_loss: 1.6629, test_f1: 0.5276
 epoch: 22, train_loss: 0.7096, test_loss: 1.4744, test_f1: 0.5618
 epoch: 23, train_loss: 0.6755, test_loss: 1.4084, test_f1: 0.5532
 epoch: 24, train_loss: 0.6718, test_loss: 1.6055, test_f1: 0.5346
 epoch: 25, train_loss: 0.6787, test_loss: 1.2888, test_f1: 0.5448
 epoch: 26, train_loss: 0.6476, test_loss: 1.6204, test_f1: 0.5458
 epoch: 27, train_loss: 0.6217, test_loss: 1.9092, test_f1: 0.5953
 epoch: 28, train_loss: 0.6198, test_loss: 1.8562, test_f1: 0.5636
 epoch: 29, train_loss: 0.6122, test_loss: 1.7804, test_f1: 0.5589
 epoch: 30, train_loss: 0.6122, test_loss: 1.7675, test_f1: 0.5642
 epoch: 31, train_loss: 0.5811, test_loss: 1.6317, test_f1: 0.5787
 epoch: 32, train_loss: 0.5895, test_loss: 2.0570, test_f1: 0.5037
 epoch: 33, train_loss: 0.6016, test_loss: 1.7525, test_f1: 0.5758
 epoch: 34, train_loss: 0.5761, test_loss: 1.4678, test_f1: 0.6004
 epoch: 35, train_loss: 0.5913, test_loss: 1.6636, test_f1: 0.5646
 epoch: 36, train_loss: 0.5878, test_loss: 1.8470, test_f1: 0.5645
 epoch: 37, train_loss: 0.5649, test_loss: 1.6106, test_f1: 0.5824
 epoch: 38, train_loss: 0.5415, test_loss: 1.8425, test_f1: 0.5334
 epoch: 39, train_loss: 0.5371, test_loss: 2.0455, test_f1: 0.5681
 epoch: 40, train_loss: 0.5236, test_loss: 2.0330, test_f1: 0.5525
 epoch: 41, train_loss: 0.5161, test_loss: 2.6005, test_f1: 0.5317
 epoch: 42, train_loss: 0.4923, test_loss: 1.9811, test_f1: 0.5782
 epoch: 43, train_loss: 0.5151, test_loss: 2.5829, test_f1: 0.5339
 epoch: 44, train_loss: 0.5262, test_loss: 2.0496, test_f1: 0.5603
 epoch: 45, train_loss: 0.4952, test_loss: 2.1021, test_f1: 0.5782
 epoch: 46, train_loss: 0.4785, test_loss: 1.8078, test_f1: 0.5646
 epoch: 47, train_loss: 0.4996, test_loss: 1.8940, test_f1: 0.5788
 epoch: 48, train_loss: 0.5457, test_loss: 2.4160, test_f1: 0.5664
 epoch: 49, train_loss: 0.4991, test_loss: 2.5068, test_f1: 0.5290
 epoch: 50, train_loss: 0.5110, test_loss: 2.0153, test_f1: 0.5846
 epoch: 51, train_loss: 0.4801, test_loss: 2.1229, test_f1: 0.5651
 epoch: 52, train_loss: 0.4222, test_loss: 2.6341, test_f1: 0.5817
 epoch: 53, train_loss: 0.4044, test_loss: 2.5159, test_f1: 0.5935
 epoch: 54, train_loss: 0.4020, test_loss: 2.3384, test_f1: 0.5755
 epoch: 55, train_loss: 0.3885, test_loss: 2.3726, test_f1: 0.5529
 epoch: 56, train_loss: 0.3700, test_loss: 2.6398, test_f1: 0.5912
 epoch: 57, train_loss: 0.3796, test_loss: 2.1947, test_f1: 0.5708
 epoch: 58, train_loss: 0.3518, test_loss: 2.5909, test_f1: 0.5759
 epoch: 59, train_loss: 0.3539, test_loss: 2.8863, test_f1: 0.5551
 epoch: 60, train_loss: 0.3574, test_loss: 2.7429, test_f1: 0.5799
 epoch: 61, train_loss: 0.3462, test_loss: 2.7203, test_f1: 0.6056
 epoch: 62, train_loss: 0.3543, test_loss: 2.9324, test_f1: 0.6150
 epoch: 63, train_loss: 0.3558, test_loss: 2.8250, test_f1: 0.5772
 epoch: 64, train_loss: 0.3324, test_loss: 3.3988, test_f1: 0.5710
 epoch: 65, train_loss: 0.3480, test_loss: 3.0917, test_f1: 0.5546
 epoch: 66, train_loss: 0.3447, test_loss: 2.6773, test_f1: 0.5599
 epoch: 67, train_loss: 0.3800, test_loss: 3.4722, test_f1: 0.5400
 epoch: 68, train_loss: 0.3436, test_loss: 3.3146, test_f1: 0.5714
 epoch: 69, train_loss: 0.3445, test_loss: 3.4814, test_f1: 0.5285
 epoch: 70, train_loss: 0.3491, test_loss: 3.8233, test_f1: 0.5645
 epoch: 71, train_loss: 0.3404, test_loss: 3.5184, test_f1: 0.5746
 epoch: 72, train_loss: 0.3181, test_loss: 3.4508, test_f1: 0.5759
 epoch: 73, train_loss: 0.3337, test_loss: 3.3841, test_f1: 0.5769
 epoch: 74, train_loss: 0.3161, test_loss: 3.4292, test_f1: 0.5684
 epoch: 75, train_loss: 0.3318, test_loss: 3.9028, test_f1: 0.5674
 epoch: 76, train_loss: 0.3390, test_loss: 3.3652, test_f1: 0.5727
 epoch: 77, train_loss: 0.3145, test_loss: 3.1360, test_f1: 0.5615
 epoch: 78, train_loss: 0.3278, test_loss: 3.5445, test_f1: 0.5546
 epoch: 79, train_loss: 0.3090, test_loss: 3.4841, test_f1: 0.5453
 epoch: 80, train_loss: 0.3104, test_loss: 3.5762, test_f1: 0.5532
 epoch: 81, train_loss: 0.3031, test_loss: 3.4039, test_f1: 0.5377
 epoch: 82, train_loss: 0.2828, test_loss: 3.6534, test_f1: 0.5761
 epoch: 83, train_loss: 0.3002, test_loss: 3.5726, test_f1: 0.5614
 epoch: 84, train_loss: 0.2584, test_loss: 3.4872, test_f1: 0.5525
 epoch: 85, train_loss: 0.2750, test_loss: 3.4113, test_f1: 0.5536
 epoch: 86, train_loss: 0.3072, test_loss: 3.4987, test_f1: 0.5786
 epoch: 87, train_loss: 0.2813, test_loss: 3.5740, test_f1: 0.5510
 epoch: 88, train_loss: 0.2762, test_loss: 4.0352, test_f1: 0.5394
 epoch: 89, train_loss: 0.2823, test_loss: 3.5325, test_f1: 0.5504
 epoch: 90, train_loss: 0.2628, test_loss: 4.1533, test_f1: 0.5725
 epoch: 91, train_loss: 0.2727, test_loss: 3.5549, test_f1: 0.5590
 epoch: 92, train_loss: 0.2752, test_loss: 3.6002, test_f1: 0.5601
 epoch: 93, train_loss: 0.2807, test_loss: 3.8714, test_f1: 0.5435
 epoch: 94, train_loss: 0.2662, test_loss: 3.5710, test_f1: 0.5464
 epoch: 95, train_loss: 0.2556, test_loss: 3.7431, test_f1: 0.5607
 epoch: 96, train_loss: 0.2877, test_loss: 3.9212, test_f1: 0.5644
 epoch: 97, train_loss: 0.2897, test_loss: 3.9526, test_f1: 0.5509
 epoch: 98, train_loss: 0.2450, test_loss: 3.4407, test_f1: 0.5561
 epoch: 99, train_loss: 0.2586, test_loss: 3.3584, test_f1: 0.5734
##################ITERATION #2 ****************************************
 epoch: 0, train_loss: 1.2260, test_loss: 1.3270, test_f1: 0.3063
 epoch: 1, train_loss: 1.1515, test_loss: 1.2959, test_f1: 0.3410
 epoch: 2, train_loss: 1.1196, test_loss: 1.2238, test_f1: 0.4495
 epoch: 3, train_loss: 1.0627, test_loss: 1.2552, test_f1: 0.4923
 epoch: 4, train_loss: 1.0270, test_loss: 1.1466, test_f1: 0.4721
 epoch: 5, train_loss: 0.9968, test_loss: 1.2079, test_f1: 0.5421
 epoch: 6, train_loss: 0.9719, test_loss: 1.2333, test_f1: 0.5554
 epoch: 7, train_loss: 0.9342, test_loss: 1.3156, test_f1: 0.4943
 epoch: 8, train_loss: 0.9286, test_loss: 1.1301, test_f1: 0.5737
 epoch: 9, train_loss: 0.9073, test_loss: 1.2378, test_f1: 0.5476
 epoch: 10, train_loss: 0.9097, test_loss: 1.1892, test_f1: 0.5504
 epoch: 11, train_loss: 0.8641, test_loss: 1.3221, test_f1: 0.5076
 epoch: 12, train_loss: 0.8639, test_loss: 1.1279, test_f1: 0.5621
 epoch: 13, train_loss: 0.8537, test_loss: 1.2539, test_f1: 0.4981
 epoch: 14, train_loss: 0.8316, test_loss: 1.2375, test_f1: 0.5155
 epoch: 15, train_loss: 0.8405, test_loss: 1.2153, test_f1: 0.5571
 epoch: 16, train_loss: 0.8211, test_loss: 1.4386, test_f1: 0.4953
 epoch: 17, train_loss: 0.7840, test_loss: 1.2735, test_f1: 0.4973
 epoch: 18, train_loss: 0.7743, test_loss: 1.2841, test_f1: 0.5948
 epoch: 19, train_loss: 0.7772, test_loss: 1.2876, test_f1: 0.5963
 epoch: 20, train_loss: 0.7249, test_loss: 1.3535, test_f1: 0.5661
 epoch: 21, train_loss: 0.7187, test_loss: 1.7843, test_f1: 0.5369
 epoch: 22, train_loss: 0.7531, test_loss: 1.6418, test_f1: 0.5867
 epoch: 23, train_loss: 0.7081, test_loss: 1.4584, test_f1: 0.6097
 epoch: 24, train_loss: 0.7093, test_loss: 1.5755, test_f1: 0.5916
 epoch: 25, train_loss: 0.6931, test_loss: 1.8873, test_f1: 0.5807
 epoch: 26, train_loss: 0.7086, test_loss: 1.4884, test_f1: 0.5729
 epoch: 27, train_loss: 0.6885, test_loss: 2.1048, test_f1: 0.5258
 epoch: 28, train_loss: 0.6594, test_loss: 1.8442, test_f1: 0.5693
 epoch: 29, train_loss: 0.6358, test_loss: 1.8154, test_f1: 0.5980
 epoch: 30, train_loss: 0.6442, test_loss: 2.1020, test_f1: 0.6079
 epoch: 31, train_loss: 0.6628, test_loss: 2.5591, test_f1: 0.6110
 epoch: 32, train_loss: 0.6314, test_loss: 1.8965, test_f1: 0.5742
 epoch: 33, train_loss: 0.6303, test_loss: 2.1820, test_f1: 0.5449
 epoch: 34, train_loss: 0.6308, test_loss: 2.3859, test_f1: 0.5790
 epoch: 35, train_loss: 0.6084, test_loss: 2.5629, test_f1: 0.5985
 epoch: 36, train_loss: 0.6359, test_loss: 2.4599, test_f1: 0.5494
 epoch: 37, train_loss: 0.5993, test_loss: 2.8658, test_f1: 0.5997
 epoch: 38, train_loss: 0.6009, test_loss: 2.1818, test_f1: 0.5943
 epoch: 39, train_loss: 0.5857, test_loss: 2.2271, test_f1: 0.5845
 epoch: 40, train_loss: 0.5772, test_loss: 3.8385, test_f1: 0.5984
 epoch: 41, train_loss: 0.5659, test_loss: 2.7447, test_f1: 0.5908
 epoch: 42, train_loss: 0.5489, test_loss: 2.5750, test_f1: 0.5962
 epoch: 43, train_loss: 0.5539, test_loss: 2.5536, test_f1: 0.5846
 epoch: 44, train_loss: 0.5381, test_loss: 2.4355, test_f1: 0.5494
 epoch: 45, train_loss: 0.5343, test_loss: 2.6093, test_f1: 0.5892
 epoch: 46, train_loss: 0.5414, test_loss: 1.9978, test_f1: 0.5771
 epoch: 47, train_loss: 0.5028, test_loss: 2.8044, test_f1: 0.5413
 epoch: 48, train_loss: 0.5420, test_loss: 2.3185, test_f1: 0.5711
 epoch: 49, train_loss: 0.5242, test_loss: 2.7078, test_f1: 0.5548
 epoch: 50, train_loss: 0.5276, test_loss: 2.9557, test_f1: 0.5395
 epoch: 51, train_loss: 0.4710, test_loss: 2.2895, test_f1: 0.6007
 epoch: 52, train_loss: 0.4395, test_loss: 2.6494, test_f1: 0.6151
 epoch: 53, train_loss: 0.4405, test_loss: 2.5979, test_f1: 0.5882
 epoch: 54, train_loss: 0.4337, test_loss: 2.8253, test_f1: 0.5997
 epoch: 55, train_loss: 0.4434, test_loss: 2.9572, test_f1: 0.5970
 epoch: 56, train_loss: 0.4045, test_loss: 2.9375, test_f1: 0.5976
 epoch: 57, train_loss: 0.4199, test_loss: 2.5692, test_f1: 0.5818
 epoch: 58, train_loss: 0.4180, test_loss: 2.9679, test_f1: 0.6080
 epoch: 59, train_loss: 0.4045, test_loss: 3.3797, test_f1: 0.5730
 epoch: 60, train_loss: 0.4132, test_loss: 3.6033, test_f1: 0.6002
 epoch: 61, train_loss: 0.3940, test_loss: 2.7450, test_f1: 0.5784
 epoch: 62, train_loss: 0.3970, test_loss: 2.7506, test_f1: 0.5968
 epoch: 63, train_loss: 0.4302, test_loss: 2.6728, test_f1: 0.5370
 epoch: 64, train_loss: 0.5605, test_loss: 2.2933, test_f1: 0.6139
 epoch: 65, train_loss: 0.4691, test_loss: 2.2760, test_f1: 0.5686
 epoch: 66, train_loss: 0.4206, test_loss: 2.1920, test_f1: 0.5805
 epoch: 67, train_loss: 0.4003, test_loss: 2.5802, test_f1: 0.5967
 epoch: 68, train_loss: 0.3820, test_loss: 2.7986, test_f1: 0.5853
 epoch: 69, train_loss: 0.3902, test_loss: 2.7043, test_f1: 0.5722
 epoch: 70, train_loss: 0.3691, test_loss: 2.6912, test_f1: 0.5834
 epoch: 71, train_loss: 0.3962, test_loss: 2.5840, test_f1: 0.5895
 epoch: 72, train_loss: 0.3790, test_loss: 2.5700, test_f1: 0.5937
 epoch: 73, train_loss: 0.3663, test_loss: 2.5541, test_f1: 0.5828
 epoch: 74, train_loss: 0.3563, test_loss: 2.7430, test_f1: 0.5946
 epoch: 75, train_loss: 0.3389, test_loss: 2.8115, test_f1: 0.5844
 epoch: 76, train_loss: 0.3700, test_loss: 2.7708, test_f1: 0.5749
 epoch: 77, train_loss: 0.3583, test_loss: 2.4376, test_f1: 0.6309
 epoch: 78, train_loss: 0.3572, test_loss: 2.7003, test_f1: 0.6106
 epoch: 79, train_loss: 0.3455, test_loss: 2.6923, test_f1: 0.5793
 epoch: 80, train_loss: 0.3401, test_loss: 3.0618, test_f1: 0.5514
 epoch: 81, train_loss: 0.3262, test_loss: 2.8722, test_f1: 0.6050
 epoch: 82, train_loss: 0.3392, test_loss: 2.9988, test_f1: 0.6118
 epoch: 83, train_loss: 0.3719, test_loss: 3.1787, test_f1: 0.5768
 epoch: 84, train_loss: 0.3393, test_loss: 3.0379, test_f1: 0.5813
 epoch: 85, train_loss: 0.3355, test_loss: 3.7935, test_f1: 0.5924
 epoch: 86, train_loss: 0.3142, test_loss: 3.9779, test_f1: 0.5787
 epoch: 87, train_loss: 0.3643, test_loss: 3.6533, test_f1: 0.5996
 epoch: 88, train_loss: 0.3295, test_loss: 3.8897, test_f1: 0.5791
 epoch: 89, train_loss: 0.3238, test_loss: 4.1247, test_f1: 0.5868
 epoch: 90, train_loss: 0.3308, test_loss: 4.0442, test_f1: 0.5894
 epoch: 91, train_loss: 0.3014, test_loss: 4.2438, test_f1: 0.5719
 epoch: 92, train_loss: 0.3060, test_loss: 3.9660, test_f1: 0.5672
 epoch: 93, train_loss: 0.3292, test_loss: 3.7476, test_f1: 0.5767
 epoch: 94, train_loss: 0.3249, test_loss: 3.6242, test_f1: 0.6178
 epoch: 95, train_loss: 0.2978, test_loss: 3.2892, test_f1: 0.6137
 epoch: 96, train_loss: 0.3052, test_loss: 3.3483, test_f1: 0.5942
 epoch: 97, train_loss: 0.2908, test_loss: 3.5380, test_f1: 0.5778
 epoch: 98, train_loss: 0.2960, test_loss: 3.2365, test_f1: 0.6028
 epoch: 99, train_loss: 0.3082, test_loss: 3.7836, test_f1: 0.5702
##################ITERATION #3 ****************************************
 epoch: 0, train_loss: 1.2716, test_loss: 1.3778, test_f1: 0.3350
 epoch: 1, train_loss: 1.1642, test_loss: 1.2430, test_f1: 0.4809
 epoch: 2, train_loss: 1.1294, test_loss: 1.2230, test_f1: 0.4734
 epoch: 3, train_loss: 1.0596, test_loss: 1.2255, test_f1: 0.4686
 epoch: 4, train_loss: 1.0447, test_loss: 1.1770, test_f1: 0.5188
 epoch: 5, train_loss: 0.9981, test_loss: 1.1492, test_f1: 0.5498
 epoch: 6, train_loss: 0.9679, test_loss: 1.3358, test_f1: 0.5103
 epoch: 7, train_loss: 0.9453, test_loss: 1.2018, test_f1: 0.5220
 epoch: 8, train_loss: 0.9369, test_loss: 1.3458, test_f1: 0.4975
 epoch: 9, train_loss: 0.9147, test_loss: 1.2654, test_f1: 0.5357
 epoch: 10, train_loss: 0.8810, test_loss: 1.2207, test_f1: 0.5281
 epoch: 11, train_loss: 0.8638, test_loss: 1.3173, test_f1: 0.5066
 epoch: 12, train_loss: 0.8527, test_loss: 1.5984, test_f1: 0.4607
 epoch: 13, train_loss: 0.8416, test_loss: 1.2896, test_f1: 0.6032
 epoch: 14, train_loss: 0.8139, test_loss: 1.5130, test_f1: 0.5309
 epoch: 15, train_loss: 0.8179, test_loss: 1.3057, test_f1: 0.5333
 epoch: 16, train_loss: 0.8106, test_loss: 1.2413, test_f1: 0.5843
 epoch: 17, train_loss: 0.7881, test_loss: 1.2101, test_f1: 0.6166
 epoch: 18, train_loss: 0.7878, test_loss: 1.3115, test_f1: 0.5576
 epoch: 19, train_loss: 0.7678, test_loss: 1.3237, test_f1: 0.5545
 epoch: 20, train_loss: 0.7515, test_loss: 1.3724, test_f1: 0.5847
 epoch: 21, train_loss: 0.7281, test_loss: 1.2484, test_f1: 0.5398
 epoch: 22, train_loss: 0.7467, test_loss: 1.4004, test_f1: 0.5378
 epoch: 23, train_loss: 0.7409, test_loss: 1.3237, test_f1: 0.5609
 epoch: 24, train_loss: 0.6953, test_loss: 1.6209, test_f1: 0.5838
 epoch: 25, train_loss: 0.7071, test_loss: 1.3077, test_f1: 0.5827
 epoch: 26, train_loss: 0.6717, test_loss: 1.4674, test_f1: 0.5652
 epoch: 27, train_loss: 0.6700, test_loss: 1.5410, test_f1: 0.5722
 epoch: 28, train_loss: 0.6788, test_loss: 1.4866, test_f1: 0.5979
 epoch: 29, train_loss: 0.7020, test_loss: 1.9855, test_f1: 0.4758
 epoch: 30, train_loss: 0.7154, test_loss: 1.5650, test_f1: 0.5448
 epoch: 31, train_loss: 0.6872, test_loss: 1.4464, test_f1: 0.5948
 epoch: 32, train_loss: 0.6709, test_loss: 1.6130, test_f1: 0.5855
 epoch: 33, train_loss: 0.6393, test_loss: 1.4641, test_f1: 0.6203
 epoch: 34, train_loss: 0.6380, test_loss: 1.6559, test_f1: 0.5640
 epoch: 35, train_loss: 0.6245, test_loss: 1.8379, test_f1: 0.5564
 epoch: 36, train_loss: 0.6098, test_loss: 1.7905, test_f1: 0.5422
 epoch: 37, train_loss: 0.6518, test_loss: 2.0148, test_f1: 0.5368
 epoch: 38, train_loss: 0.6233, test_loss: 1.8807, test_f1: 0.5724
 epoch: 39, train_loss: 0.6220, test_loss: 2.0214, test_f1: 0.6174
 epoch: 40, train_loss: 0.5698, test_loss: 1.7551, test_f1: 0.5936
 epoch: 41, train_loss: 0.6089, test_loss: 1.9965, test_f1: 0.5824
 epoch: 42, train_loss: 0.5788, test_loss: 2.0900, test_f1: 0.5646
 epoch: 43, train_loss: 0.5731, test_loss: 1.7553, test_f1: 0.5703
 epoch: 44, train_loss: 0.5643, test_loss: 1.8243, test_f1: 0.6289
 epoch: 45, train_loss: 0.5609, test_loss: 2.0391, test_f1: 0.5879
 epoch: 46, train_loss: 0.5347, test_loss: 2.4076, test_f1: 0.5225
 epoch: 47, train_loss: 0.5499, test_loss: 2.4937, test_f1: 0.5619
 epoch: 48, train_loss: 0.5349, test_loss: 2.4477, test_f1: 0.5846
 epoch: 49, train_loss: 0.5276, test_loss: 2.2820, test_f1: 0.5421
 epoch: 50, train_loss: 0.5737, test_loss: 2.3194, test_f1: 0.5708
 epoch: 51, train_loss: 0.5041, test_loss: 2.2158, test_f1: 0.5764
 epoch: 52, train_loss: 0.4710, test_loss: 2.4535, test_f1: 0.5986
 epoch: 53, train_loss: 0.4627, test_loss: 2.8001, test_f1: 0.6018
 epoch: 54, train_loss: 0.4489, test_loss: 2.3690, test_f1: 0.6117
 epoch: 55, train_loss: 0.4193, test_loss: 2.3474, test_f1: 0.5872
 epoch: 56, train_loss: 0.4042, test_loss: 2.4964, test_f1: 0.6129
 epoch: 57, train_loss: 0.4171, test_loss: 2.6172, test_f1: 0.5865
 epoch: 58, train_loss: 0.4162, test_loss: 2.6670, test_f1: 0.5667
 epoch: 59, train_loss: 0.4096, test_loss: 2.8125, test_f1: 0.5790
 epoch: 60, train_loss: 0.4187, test_loss: 2.8736, test_f1: 0.5665
 epoch: 61, train_loss: 0.4005, test_loss: 2.8647, test_f1: 0.5835
 epoch: 62, train_loss: 0.3998, test_loss: 3.1700, test_f1: 0.6067
 epoch: 63, train_loss: 0.3873, test_loss: 2.6822, test_f1: 0.5818
 epoch: 64, train_loss: 0.3933, test_loss: 2.4578, test_f1: 0.5999
 epoch: 65, train_loss: 0.4245, test_loss: 2.9751, test_f1: 0.5993
 epoch: 66, train_loss: 0.3701, test_loss: 3.4222, test_f1: 0.5958
 epoch: 67, train_loss: 0.3659, test_loss: 3.1770, test_f1: 0.5838
 epoch: 68, train_loss: 0.3920, test_loss: 3.4556, test_f1: 0.6331
 epoch: 69, train_loss: 0.3765, test_loss: 3.8215, test_f1: 0.5432
 epoch: 70, train_loss: 0.3884, test_loss: 4.2013, test_f1: 0.5861
 epoch: 71, train_loss: 0.3669, test_loss: 3.6987, test_f1: 0.5512
 epoch: 72, train_loss: 0.3689, test_loss: 3.7392, test_f1: 0.6093
 epoch: 73, train_loss: 0.3751, test_loss: 3.6363, test_f1: 0.5539
 epoch: 74, train_loss: 0.3492, test_loss: 3.9044, test_f1: 0.5518
 epoch: 75, train_loss: 0.3649, test_loss: 4.1848, test_f1: 0.5917
 epoch: 76, train_loss: 0.3465, test_loss: 3.6220, test_f1: 0.5799
 epoch: 77, train_loss: 0.3377, test_loss: 4.0857, test_f1: 0.5848
 epoch: 78, train_loss: 0.3587, test_loss: 3.6756, test_f1: 0.5829
 epoch: 79, train_loss: 0.3329, test_loss: 4.5537, test_f1: 0.5968
 epoch: 80, train_loss: 0.3681, test_loss: 3.9508, test_f1: 0.5543
 epoch: 81, train_loss: 0.3303, test_loss: 3.7875, test_f1: 0.5812
 epoch: 82, train_loss: 0.3342, test_loss: 4.3192, test_f1: 0.5907
 epoch: 83, train_loss: 0.3489, test_loss: 6.0250, test_f1: 0.5582
 epoch: 84, train_loss: 0.3610, test_loss: 5.0101, test_f1: 0.6191
 epoch: 85, train_loss: 0.3209, test_loss: 4.2998, test_f1: 0.5535
 epoch: 86, train_loss: 0.3444, test_loss: 5.1620, test_f1: 0.5856
 epoch: 87, train_loss: 0.3541, test_loss: 4.7305, test_f1: 0.6214
 epoch: 88, train_loss: 0.3265, test_loss: 4.5083, test_f1: 0.6037
 epoch: 89, train_loss: 0.3231, test_loss: 4.7551, test_f1: 0.5956
 epoch: 90, train_loss: 0.3091, test_loss: 4.6564, test_f1: 0.5786
 epoch: 91, train_loss: 0.3376, test_loss: 4.1813, test_f1: 0.5904
 epoch: 92, train_loss: 0.3128, test_loss: 4.6135, test_f1: 0.5995
 epoch: 93, train_loss: 0.3054, test_loss: 4.8030, test_f1: 0.6008
 epoch: 94, train_loss: 0.3103, test_loss: 4.5747, test_f1: 0.5950
 epoch: 95, train_loss: 0.2910, test_loss: 5.5740, test_f1: 0.5754
 epoch: 96, train_loss: 0.3183, test_loss: 5.6403, test_f1: 0.5936
 epoch: 97, train_loss: 0.3192, test_loss: 5.2977, test_f1: 0.5728
 epoch: 98, train_loss: 0.3005, test_loss: 5.1084, test_f1: 0.5522
 epoch: 99, train_loss: 0.3056, test_loss: 5.2474, test_f1: 0.6112
##################ITERATION #4 ****************************************
 epoch: 0, train_loss: 1.2612, test_loss: 1.2547, test_f1: 0.2382
 epoch: 1, train_loss: 1.1288, test_loss: 1.2262, test_f1: 0.4407
 epoch: 2, train_loss: 1.0995, test_loss: 1.1737, test_f1: 0.4847
 epoch: 3, train_loss: 1.0197, test_loss: 1.1133, test_f1: 0.5430
 epoch: 4, train_loss: 0.9995, test_loss: 1.1264, test_f1: 0.5347
 epoch: 5, train_loss: 0.9416, test_loss: 1.3311, test_f1: 0.4583
 epoch: 6, train_loss: 0.9224, test_loss: 1.1839, test_f1: 0.5211
 epoch: 7, train_loss: 0.8852, test_loss: 1.2526, test_f1: 0.4643
 epoch: 8, train_loss: 0.8648, test_loss: 1.2563, test_f1: 0.4893
 epoch: 9, train_loss: 0.8755, test_loss: 1.1589, test_f1: 0.5091
 epoch: 10, train_loss: 0.8414, test_loss: 1.1968, test_f1: 0.4875
 epoch: 11, train_loss: 0.8146, test_loss: 1.3049, test_f1: 0.4807
 epoch: 12, train_loss: 0.8239, test_loss: 1.2196, test_f1: 0.5390
 epoch: 13, train_loss: 0.8262, test_loss: 1.0864, test_f1: 0.5423
 epoch: 14, train_loss: 0.7913, test_loss: 1.2459, test_f1: 0.5454
 epoch: 15, train_loss: 0.7761, test_loss: 1.3722, test_f1: 0.4902
 epoch: 16, train_loss: 0.7815, test_loss: 1.2780, test_f1: 0.5474
 epoch: 17, train_loss: 0.7328, test_loss: 1.2907, test_f1: 0.5519
 epoch: 18, train_loss: 0.7361, test_loss: 1.3163, test_f1: 0.5550
 epoch: 19, train_loss: 0.7585, test_loss: 1.2056, test_f1: 0.5484
 epoch: 20, train_loss: 0.7283, test_loss: 1.2261, test_f1: 0.5188
 epoch: 21, train_loss: 0.7294, test_loss: 1.3636, test_f1: 0.5763
 epoch: 22, train_loss: 0.7108, test_loss: 1.2976, test_f1: 0.5380
 epoch: 23, train_loss: 0.6984, test_loss: 1.1901, test_f1: 0.5525
 epoch: 24, train_loss: 0.6802, test_loss: 1.3218, test_f1: 0.5715
 epoch: 25, train_loss: 0.6673, test_loss: 1.2785, test_f1: 0.5643
 epoch: 26, train_loss: 0.6512, test_loss: 1.3955, test_f1: 0.5803
 epoch: 27, train_loss: 0.6483, test_loss: 1.3344, test_f1: 0.5757
 epoch: 28, train_loss: 0.6339, test_loss: 1.4811, test_f1: 0.4961
 epoch: 29, train_loss: 0.6257, test_loss: 1.5993, test_f1: 0.5241
 epoch: 30, train_loss: 0.6314, test_loss: 1.5428, test_f1: 0.5818
 epoch: 31, train_loss: 0.6194, test_loss: 1.4152, test_f1: 0.5348
 epoch: 32, train_loss: 0.6048, test_loss: 1.6754, test_f1: 0.5395
 epoch: 33, train_loss: 0.6132, test_loss: 1.4948, test_f1: 0.5587
 epoch: 34, train_loss: 0.6228, test_loss: 1.5197, test_f1: 0.5183
 epoch: 35, train_loss: 0.5987, test_loss: 1.5681, test_f1: 0.5380
 epoch: 36, train_loss: 0.5680, test_loss: 1.4711, test_f1: 0.5712
 epoch: 37, train_loss: 0.5549, test_loss: 1.5174, test_f1: 0.5865
 epoch: 38, train_loss: 0.5752, test_loss: 1.4456, test_f1: 0.5567
 epoch: 39, train_loss: 0.5814, test_loss: 1.6132, test_f1: 0.5426
 epoch: 40, train_loss: 0.5469, test_loss: 1.6739, test_f1: 0.5805
 epoch: 41, train_loss: 0.5509, test_loss: 1.7068, test_f1: 0.5471
 epoch: 42, train_loss: 0.5474, test_loss: 1.6845, test_f1: 0.5441
 epoch: 43, train_loss: 0.5579, test_loss: 1.7792, test_f1: 0.5357
 epoch: 44, train_loss: 0.5130, test_loss: 1.8159, test_f1: 0.5287
 epoch: 45, train_loss: 0.5172, test_loss: 1.8171, test_f1: 0.5136
 epoch: 46, train_loss: 0.4814, test_loss: 1.7002, test_f1: 0.5508
 epoch: 47, train_loss: 0.5067, test_loss: 1.8733, test_f1: 0.5157
 epoch: 48, train_loss: 0.4659, test_loss: 1.6438, test_f1: 0.5742
 epoch: 49, train_loss: 0.5279, test_loss: 1.9653, test_f1: 0.5405
 epoch: 50, train_loss: 0.5067, test_loss: 1.6471, test_f1: 0.5969
 epoch: 51, train_loss: 0.4717, test_loss: 1.8167, test_f1: 0.5247
 epoch: 52, train_loss: 0.4466, test_loss: 1.7342, test_f1: 0.5319
 epoch: 53, train_loss: 0.4163, test_loss: 1.8052, test_f1: 0.5657
 epoch: 54, train_loss: 0.4094, test_loss: 1.8515, test_f1: 0.5742
 epoch: 55, train_loss: 0.4095, test_loss: 1.7979, test_f1: 0.5717
 epoch: 56, train_loss: 0.3951, test_loss: 1.9277, test_f1: 0.5679
 epoch: 57, train_loss: 0.3859, test_loss: 1.8017, test_f1: 0.5538
 epoch: 58, train_loss: 0.4032, test_loss: 1.8833, test_f1: 0.5361
 epoch: 59, train_loss: 0.3684, test_loss: 1.8310, test_f1: 0.5611
 epoch: 60, train_loss: 0.3544, test_loss: 1.9221, test_f1: 0.5815
 epoch: 61, train_loss: 0.3455, test_loss: 1.9999, test_f1: 0.5409
 epoch: 62, train_loss: 0.3652, test_loss: 1.9961, test_f1: 0.5528
 epoch: 63, train_loss: 0.3553, test_loss: 2.0839, test_f1: 0.5454
 epoch: 64, train_loss: 0.3456, test_loss: 2.3106, test_f1: 0.5308
 epoch: 65, train_loss: 0.3740, test_loss: 2.1890, test_f1: 0.5591
 epoch: 66, train_loss: 0.3661, test_loss: 2.4592, test_f1: 0.5018
 epoch: 67, train_loss: 0.3819, test_loss: 2.0027, test_f1: 0.5492
 epoch: 68, train_loss: 0.3596, test_loss: 1.9151, test_f1: 0.5920
 epoch: 69, train_loss: 0.3347, test_loss: 2.0452, test_f1: 0.5401
 epoch: 70, train_loss: 0.3528, test_loss: 2.0717, test_f1: 0.5780
 epoch: 71, train_loss: 0.3442, test_loss: 1.9531, test_f1: 0.5719
 epoch: 72, train_loss: 0.3286, test_loss: 1.9440, test_f1: 0.5704
 epoch: 73, train_loss: 0.3552, test_loss: 2.0783, test_f1: 0.5786
 epoch: 74, train_loss: 0.3540, test_loss: 2.2337, test_f1: 0.5385
 epoch: 75, train_loss: 0.3328, test_loss: 2.3886, test_f1: 0.5482
 epoch: 76, train_loss: 0.3009, test_loss: 2.2296, test_f1: 0.5685
 epoch: 77, train_loss: 0.3492, test_loss: 2.2877, test_f1: 0.5652
 epoch: 78, train_loss: 0.3234, test_loss: 2.3933, test_f1: 0.5570
 epoch: 79, train_loss: 0.3011, test_loss: 2.3586, test_f1: 0.5649
 epoch: 80, train_loss: 0.3132, test_loss: 2.1686, test_f1: 0.5803
 epoch: 81, train_loss: 0.2874, test_loss: 2.4716, test_f1: 0.5666
 epoch: 82, train_loss: 0.3181, test_loss: 2.4788, test_f1: 0.5727
 epoch: 83, train_loss: 0.3240, test_loss: 2.5533, test_f1: 0.5441
 epoch: 84, train_loss: 0.3045, test_loss: 2.4339, test_f1: 0.5390
 epoch: 85, train_loss: 0.3106, test_loss: 2.3209, test_f1: 0.5553
 epoch: 86, train_loss: 0.3002, test_loss: 2.5255, test_f1: 0.5643
 epoch: 87, train_loss: 0.2857, test_loss: 2.6169, test_f1: 0.5490
 epoch: 88, train_loss: 0.3134, test_loss: 2.2066, test_f1: 0.5645
 epoch: 89, train_loss: 0.2945, test_loss: 2.3588, test_f1: 0.5881
 epoch: 90, train_loss: 0.2634, test_loss: 2.6839, test_f1: 0.5489
 epoch: 91, train_loss: 0.2788, test_loss: 2.3873, test_f1: 0.5609
 epoch: 92, train_loss: 0.2862, test_loss: 2.5241, test_f1: 0.5747
 epoch: 93, train_loss: 0.2996, test_loss: 2.3941, test_f1: 0.5780
 epoch: 94, train_loss: 0.2957, test_loss: 2.5834, test_f1: 0.5723
 epoch: 95, train_loss: 0.2688, test_loss: 2.3608, test_f1: 0.5412
 epoch: 96, train_loss: 0.2904, test_loss: 2.3511, test_f1: 0.5884
 epoch: 97, train_loss: 0.2995, test_loss: 2.4148, test_f1: 0.5639
 epoch: 98, train_loss: 0.2645, test_loss: 2.4078, test_f1: 0.5652
 epoch: 99, train_loss: 0.2875, test_loss: 2.5394, test_f1: 0.5620
##################ITERATION #5 ****************************************
 epoch: 0, train_loss: 1.2516, test_loss: 1.2813, test_f1: 0.2858
 epoch: 1, train_loss: 1.1165, test_loss: 1.3409, test_f1: 0.4621
 epoch: 2, train_loss: 1.0826, test_loss: 1.1877, test_f1: 0.5203
 epoch: 3, train_loss: 1.0184, test_loss: 1.1389, test_f1: 0.5195
 epoch: 4, train_loss: 1.0130, test_loss: 1.1120, test_f1: 0.5080
 epoch: 5, train_loss: 0.9861, test_loss: 1.0856, test_f1: 0.5541
 epoch: 6, train_loss: 0.9640, test_loss: 1.1895, test_f1: 0.5536
 epoch: 7, train_loss: 0.9331, test_loss: 1.0774, test_f1: 0.5706
 epoch: 8, train_loss: 0.9116, test_loss: 1.1191, test_f1: 0.5228
 epoch: 9, train_loss: 0.8876, test_loss: 1.1949, test_f1: 0.5646
 epoch: 10, train_loss: 0.8867, test_loss: 1.0735, test_f1: 0.5774
 epoch: 11, train_loss: 0.8433, test_loss: 1.1203, test_f1: 0.5817
 epoch: 12, train_loss: 0.8286, test_loss: 1.0882, test_f1: 0.5235
 epoch: 13, train_loss: 0.8272, test_loss: 1.0815, test_f1: 0.5845
 epoch: 14, train_loss: 0.8159, test_loss: 1.1710, test_f1: 0.5690
 epoch: 15, train_loss: 0.8222, test_loss: 1.1494, test_f1: 0.5644
 epoch: 16, train_loss: 0.8037, test_loss: 1.2565, test_f1: 0.5288
 epoch: 17, train_loss: 0.7783, test_loss: 1.2667, test_f1: 0.5022
 epoch: 18, train_loss: 0.7801, test_loss: 1.1792, test_f1: 0.5380
 epoch: 19, train_loss: 0.7849, test_loss: 1.1021, test_f1: 0.5928
 epoch: 20, train_loss: 0.7596, test_loss: 1.1304, test_f1: 0.5796
 epoch: 21, train_loss: 0.7653, test_loss: 1.2126, test_f1: 0.5854
 epoch: 22, train_loss: 0.7632, test_loss: 1.2538, test_f1: 0.5084
 epoch: 23, train_loss: 0.7222, test_loss: 1.1372, test_f1: 0.5784
 epoch: 24, train_loss: 0.7128, test_loss: 1.2068, test_f1: 0.5490
 epoch: 25, train_loss: 0.7210, test_loss: 1.2529, test_f1: 0.5694
 epoch: 26, train_loss: 0.6896, test_loss: 1.2174, test_f1: 0.5355
 epoch: 27, train_loss: 0.7042, test_loss: 1.2811, test_f1: 0.5544
 epoch: 28, train_loss: 0.6873, test_loss: 1.3455, test_f1: 0.5268
 epoch: 29, train_loss: 0.6971, test_loss: 1.5052, test_f1: 0.5440
 epoch: 30, train_loss: 0.6722, test_loss: 1.5091, test_f1: 0.5291
 epoch: 31, train_loss: 0.6692, test_loss: 1.5438, test_f1: 0.5332
 epoch: 32, train_loss: 0.6583, test_loss: 1.7893, test_f1: 0.4667
 epoch: 33, train_loss: 0.6490, test_loss: 1.5365, test_f1: 0.5320
 epoch: 34, train_loss: 0.6695, test_loss: 1.4922, test_f1: 0.4997
 epoch: 35, train_loss: 0.6530, test_loss: 1.3662, test_f1: 0.5447
 epoch: 36, train_loss: 0.6513, test_loss: 1.4399, test_f1: 0.5452
 epoch: 37, train_loss: 0.6472, test_loss: 1.2483, test_f1: 0.5567
 epoch: 38, train_loss: 0.6214, test_loss: 1.6271, test_f1: 0.4803
 epoch: 39, train_loss: 0.6269, test_loss: 1.3686, test_f1: 0.5177
 epoch: 40, train_loss: 0.6047, test_loss: 1.6157, test_f1: 0.6044
 epoch: 41, train_loss: 0.6307, test_loss: 1.4370, test_f1: 0.5243
 epoch: 42, train_loss: 0.5936, test_loss: 1.4225, test_f1: 0.5422
 epoch: 43, train_loss: 0.6082, test_loss: 1.3465, test_f1: 0.5786
 epoch: 44, train_loss: 0.6084, test_loss: 1.5263, test_f1: 0.5248
 epoch: 45, train_loss: 0.5674, test_loss: 1.4813, test_f1: 0.5587
 epoch: 46, train_loss: 0.5977, test_loss: 1.5485, test_f1: 0.5873
 epoch: 47, train_loss: 0.5886, test_loss: 1.5775, test_f1: 0.5496
 epoch: 48, train_loss: 0.5659, test_loss: 1.5217, test_f1: 0.5707
 epoch: 49, train_loss: 0.5760, test_loss: 1.5217, test_f1: 0.6015
 epoch: 50, train_loss: 0.5848, test_loss: 1.4400, test_f1: 0.5377
 epoch: 51, train_loss: 0.5504, test_loss: 1.5214, test_f1: 0.5900
 epoch: 52, train_loss: 0.5049, test_loss: 1.4017, test_f1: 0.5956
 epoch: 53, train_loss: 0.5026, test_loss: 1.4932, test_f1: 0.5768
 epoch: 54, train_loss: 0.4811, test_loss: 1.6125, test_f1: 0.5372
 epoch: 55, train_loss: 0.4786, test_loss: 1.5324, test_f1: 0.5454
 epoch: 56, train_loss: 0.4781, test_loss: 1.5852, test_f1: 0.6036
 epoch: 57, train_loss: 0.4668, test_loss: 1.5413, test_f1: 0.5672
 epoch: 58, train_loss: 0.4590, test_loss: 1.5793, test_f1: 0.5785
 epoch: 59, train_loss: 0.4611, test_loss: 1.6124, test_f1: 0.5583
 epoch: 60, train_loss: 0.4659, test_loss: 1.5748, test_f1: 0.5544
 epoch: 61, train_loss: 0.4447, test_loss: 1.5801, test_f1: 0.5737
 epoch: 62, train_loss: 0.4541, test_loss: 1.5841, test_f1: 0.5404
 epoch: 63, train_loss: 0.4293, test_loss: 1.5161, test_f1: 0.5904
 epoch: 64, train_loss: 0.4269, test_loss: 1.7020, test_f1: 0.5623
 epoch: 65, train_loss: 0.4170, test_loss: 1.7824, test_f1: 0.5618
 epoch: 66, train_loss: 0.4347, test_loss: 1.8656, test_f1: 0.5527
 epoch: 67, train_loss: 0.4155, test_loss: 1.7977, test_f1: 0.5699
 epoch: 68, train_loss: 0.4024, test_loss: 1.8212, test_f1: 0.5924
 epoch: 69, train_loss: 0.4105, test_loss: 1.8082, test_f1: 0.5556
 epoch: 70, train_loss: 0.4005, test_loss: 2.4688, test_f1: 0.5192
 epoch: 71, train_loss: 0.3823, test_loss: 1.7415, test_f1: 0.5789
 epoch: 72, train_loss: 0.4134, test_loss: 1.9379, test_f1: 0.5685
 epoch: 73, train_loss: 0.3961, test_loss: 1.6376, test_f1: 0.5879
 epoch: 74, train_loss: 0.4201, test_loss: 1.7960, test_f1: 0.5805
 epoch: 75, train_loss: 0.3898, test_loss: 1.8729, test_f1: 0.5756
 epoch: 76, train_loss: 0.3732, test_loss: 1.9724, test_f1: 0.5729
 epoch: 77, train_loss: 0.3942, test_loss: 1.7809, test_f1: 0.5555
 epoch: 78, train_loss: 0.3866, test_loss: 1.9445, test_f1: 0.5804
 epoch: 79, train_loss: 0.3936, test_loss: 1.7331, test_f1: 0.5829
 epoch: 80, train_loss: 0.3934, test_loss: 1.9519, test_f1: 0.5692
 epoch: 81, train_loss: 0.3916, test_loss: 1.6740, test_f1: 0.5721
 epoch: 82, train_loss: 0.3688, test_loss: 1.8455, test_f1: 0.5967
 epoch: 83, train_loss: 0.3674, test_loss: 1.9000, test_f1: 0.5510
 epoch: 84, train_loss: 0.3893, test_loss: 1.8753, test_f1: 0.5944
 epoch: 85, train_loss: 0.3901, test_loss: 1.8806, test_f1: 0.5848
 epoch: 86, train_loss: 0.3734, test_loss: 2.5801, test_f1: 0.5571
 epoch: 87, train_loss: 0.3582, test_loss: 2.0338, test_f1: 0.5931
 epoch: 88, train_loss: 0.3256, test_loss: 1.9261, test_f1: 0.6027
 epoch: 89, train_loss: 0.3466, test_loss: 2.3569, test_f1: 0.6328
 epoch: 90, train_loss: 0.3507, test_loss: 2.2676, test_f1: 0.5751
 epoch: 91, train_loss: 0.3685, test_loss: 2.2152, test_f1: 0.5734
 epoch: 92, train_loss: 0.3392, test_loss: 2.2702, test_f1: 0.5430
 epoch: 93, train_loss: 0.3333, test_loss: 1.8825, test_f1: 0.5510
 epoch: 94, train_loss: 0.3268, test_loss: 1.9533, test_f1: 0.5753
 epoch: 95, train_loss: 0.3395, test_loss: 2.1992, test_f1: 0.5641
 epoch: 96, train_loss: 0.3291, test_loss: 2.0740, test_f1: 0.5575
 epoch: 97, train_loss: 0.3214, test_loss: 2.2614, test_f1: 0.5624
 epoch: 98, train_loss: 0.3367, test_loss: 1.9066, test_f1: 0.5853
 epoch: 99, train_loss: 0.3271, test_loss: 2.1520, test_f1: 0.5589
##################ITERATION #6 ****************************************
 epoch: 0, train_loss: 1.2736, test_loss: 1.3121, test_f1: 0.2546
 epoch: 1, train_loss: 1.1796, test_loss: 1.1883, test_f1: 0.4033
 epoch: 2, train_loss: 1.1091, test_loss: 1.1827, test_f1: 0.5320
 epoch: 3, train_loss: 1.0709, test_loss: 1.2727, test_f1: 0.5093
 epoch: 4, train_loss: 1.0349, test_loss: 1.2129, test_f1: 0.5335
 epoch: 5, train_loss: 0.9993, test_loss: 1.1427, test_f1: 0.5321
 epoch: 6, train_loss: 0.9815, test_loss: 1.3457, test_f1: 0.5002
 epoch: 7, train_loss: 0.9567, test_loss: 1.2369, test_f1: 0.5917
 epoch: 8, train_loss: 0.8954, test_loss: 2.0285, test_f1: 0.5698
 epoch: 9, train_loss: 0.9183, test_loss: 3.5193, test_f1: 0.5520
 epoch: 10, train_loss: 0.8840, test_loss: 1.8689, test_f1: 0.5536
 epoch: 11, train_loss: 0.8628, test_loss: 1.4969, test_f1: 0.5882
 epoch: 12, train_loss: 0.8481, test_loss: 1.4823, test_f1: 0.5801
 epoch: 13, train_loss: 0.8386, test_loss: 2.2759, test_f1: 0.5260
 epoch: 14, train_loss: 0.8386, test_loss: 1.3528, test_f1: 0.5521
 epoch: 15, train_loss: 0.8200, test_loss: 1.4071, test_f1: 0.5534
 epoch: 16, train_loss: 0.8121, test_loss: 1.5192, test_f1: 0.5845
 epoch: 17, train_loss: 0.7856, test_loss: 1.2355, test_f1: 0.5657
 epoch: 18, train_loss: 0.7731, test_loss: 1.6312, test_f1: 0.5697
 epoch: 19, train_loss: 0.7475, test_loss: 1.2659, test_f1: 0.5672
 epoch: 20, train_loss: 0.7527, test_loss: 1.1790, test_f1: 0.5775
 epoch: 21, train_loss: 0.7362, test_loss: 1.6739, test_f1: 0.5202
 epoch: 22, train_loss: 0.7029, test_loss: 1.2785, test_f1: 0.5930
 epoch: 23, train_loss: 0.7042, test_loss: 1.7222, test_f1: 0.5446
 epoch: 24, train_loss: 0.6573, test_loss: 1.9460, test_f1: 0.5866
 epoch: 25, train_loss: 0.6795, test_loss: 1.5404, test_f1: 0.5425
 epoch: 26, train_loss: 0.6864, test_loss: 1.8894, test_f1: 0.5296
 epoch: 27, train_loss: 0.6824, test_loss: 1.5314, test_f1: 0.5895
 epoch: 28, train_loss: 0.6666, test_loss: 1.5607, test_f1: 0.5357
 epoch: 29, train_loss: 0.6690, test_loss: 1.5737, test_f1: 0.5488
 epoch: 30, train_loss: 0.6441, test_loss: 1.2946, test_f1: 0.5352
 epoch: 31, train_loss: 0.6558, test_loss: 1.4639, test_f1: 0.5539
 epoch: 32, train_loss: 0.6732, test_loss: 1.5595, test_f1: 0.5322
 epoch: 33, train_loss: 0.6497, test_loss: 1.5635, test_f1: 0.5643
 epoch: 34, train_loss: 0.5955, test_loss: 1.5680, test_f1: 0.5967
 epoch: 35, train_loss: 0.5770, test_loss: 1.5941, test_f1: 0.5804
 epoch: 36, train_loss: 0.6010, test_loss: 1.7434, test_f1: 0.5227
 epoch: 37, train_loss: 0.5948, test_loss: 1.8192, test_f1: 0.5745
 epoch: 38, train_loss: 0.5728, test_loss: 1.3928, test_f1: 0.5670
 epoch: 39, train_loss: 0.5703, test_loss: 1.6114, test_f1: 0.5702
 epoch: 40, train_loss: 0.5582, test_loss: 1.8820, test_f1: 0.5585
 epoch: 41, train_loss: 0.5623, test_loss: 1.7059, test_f1: 0.5520
 epoch: 42, train_loss: 0.5822, test_loss: 1.9894, test_f1: 0.5177
 epoch: 43, train_loss: 0.5935, test_loss: 1.6429, test_f1: 0.5631
 epoch: 44, train_loss: 0.5490, test_loss: 1.5294, test_f1: 0.5912
 epoch: 45, train_loss: 0.5455, test_loss: 1.9120, test_f1: 0.5516
 epoch: 46, train_loss: 0.5613, test_loss: 2.1016, test_f1: 0.5684
 epoch: 47, train_loss: 0.5237, test_loss: 1.8867, test_f1: 0.5884
 epoch: 48, train_loss: 0.4993, test_loss: 1.7508, test_f1: 0.5759
 epoch: 49, train_loss: 0.5497, test_loss: 1.6746, test_f1: 0.5683
 epoch: 50, train_loss: 0.5310, test_loss: 1.7293, test_f1: 0.5833
 epoch: 51, train_loss: 0.4768, test_loss: 1.8678, test_f1: 0.5458
 epoch: 52, train_loss: 0.4343, test_loss: 1.7646, test_f1: 0.5914
 epoch: 53, train_loss: 0.4423, test_loss: 1.7730, test_f1: 0.5653
 epoch: 54, train_loss: 0.4227, test_loss: 1.8601, test_f1: 0.5635
 epoch: 55, train_loss: 0.4012, test_loss: 1.9573, test_f1: 0.5917
 epoch: 56, train_loss: 0.4162, test_loss: 2.1128, test_f1: 0.5615
 epoch: 57, train_loss: 0.3965, test_loss: 2.0220, test_f1: 0.5683
 epoch: 58, train_loss: 0.4062, test_loss: 2.3724, test_f1: 0.5405
 epoch: 59, train_loss: 0.3951, test_loss: 1.9586, test_f1: 0.5778
 epoch: 60, train_loss: 0.3915, test_loss: 2.1213, test_f1: 0.5781
 epoch: 61, train_loss: 0.3776, test_loss: 2.0478, test_f1: 0.5893
 epoch: 62, train_loss: 0.3843, test_loss: 2.2051, test_f1: 0.5974
 epoch: 63, train_loss: 0.3935, test_loss: 2.1119, test_f1: 0.5942
 epoch: 64, train_loss: 0.3737, test_loss: 2.1725, test_f1: 0.5472
 epoch: 65, train_loss: 0.3937, test_loss: 2.3900, test_f1: 0.5880
 epoch: 66, train_loss: 0.3938, test_loss: 2.1655, test_f1: 0.5864
 epoch: 67, train_loss: 0.3768, test_loss: 2.3349, test_f1: 0.6001
 epoch: 68, train_loss: 0.3756, test_loss: 2.4500, test_f1: 0.5528
 epoch: 69, train_loss: 0.3761, test_loss: 2.4189, test_f1: 0.5797
 epoch: 70, train_loss: 0.3603, test_loss: 2.3382, test_f1: 0.5680
 epoch: 71, train_loss: 0.3625, test_loss: 2.2933, test_f1: 0.5910
 epoch: 72, train_loss: 0.3508, test_loss: 2.3473, test_f1: 0.5937
 epoch: 73, train_loss: 0.3647, test_loss: 2.5652, test_f1: 0.6083
 epoch: 74, train_loss: 0.3702, test_loss: 2.5135, test_f1: 0.5515
 epoch: 75, train_loss: 0.3551, test_loss: 2.3067, test_f1: 0.5969
 epoch: 76, train_loss: 0.3518, test_loss: 2.8204, test_f1: 0.5889
 epoch: 77, train_loss: 0.3589, test_loss: 2.6447, test_f1: 0.5632
 epoch: 78, train_loss: 0.3308, test_loss: 2.4139, test_f1: 0.5836
 epoch: 79, train_loss: 0.3312, test_loss: 2.6553, test_f1: 0.5659
 epoch: 80, train_loss: 0.3225, test_loss: 2.9508, test_f1: 0.5582
 epoch: 81, train_loss: 0.3332, test_loss: 2.6008, test_f1: 0.5859
 epoch: 82, train_loss: 0.3370, test_loss: 3.2337, test_f1: 0.5634
 epoch: 83, train_loss: 0.3279, test_loss: 3.1268, test_f1: 0.5826
 epoch: 84, train_loss: 0.3060, test_loss: 3.6838, test_f1: 0.5791
 epoch: 85, train_loss: 0.3312, test_loss: 2.5557, test_f1: 0.5766
 epoch: 86, train_loss: 0.3411, test_loss: 2.7198, test_f1: 0.6163
 epoch: 87, train_loss: 0.3239, test_loss: 3.1226, test_f1: 0.5729
 epoch: 88, train_loss: 0.3456, test_loss: 2.5074, test_f1: 0.5806
 epoch: 89, train_loss: 0.3114, test_loss: 3.3837, test_f1: 0.5634
 epoch: 90, train_loss: 0.3144, test_loss: 2.8977, test_f1: 0.5808
 epoch: 91, train_loss: 0.3232, test_loss: 2.9582, test_f1: 0.5705
 epoch: 92, train_loss: 0.3310, test_loss: 2.7878, test_f1: 0.5753
 epoch: 93, train_loss: 0.2981, test_loss: 2.8476, test_f1: 0.5740
 epoch: 94, train_loss: 0.3256, test_loss: 2.8082, test_f1: 0.6017
 epoch: 95, train_loss: 0.2951, test_loss: 3.1100, test_f1: 0.6098
 epoch: 96, train_loss: 0.2977, test_loss: 3.0466, test_f1: 0.5826
 epoch: 97, train_loss: 0.2857, test_loss: 3.2104, test_f1: 0.5679
 epoch: 98, train_loss: 0.2985, test_loss: 2.9316, test_f1: 0.5715
 epoch: 99, train_loss: 0.3223, test_loss: 3.2342, test_f1: 0.6114
##################ITERATION #7 ****************************************
 epoch: 0, train_loss: 1.3531, test_loss: 1.3655, test_f1: 0.3437
 epoch: 1, train_loss: 1.2283, test_loss: 1.2555, test_f1: 0.3687
 epoch: 2, train_loss: 1.1514, test_loss: 1.2162, test_f1: 0.4869
 epoch: 3, train_loss: 1.1172, test_loss: 1.2836, test_f1: 0.5006
 epoch: 4, train_loss: 1.0610, test_loss: 1.3541, test_f1: 0.5042
 epoch: 5, train_loss: 1.0230, test_loss: 1.3199, test_f1: 0.5451
 epoch: 6, train_loss: 1.0167, test_loss: 1.3681, test_f1: 0.4879
 epoch: 7, train_loss: 0.9731, test_loss: 1.3469, test_f1: 0.5250
 epoch: 8, train_loss: 0.9224, test_loss: 1.2842, test_f1: 0.5313
 epoch: 9, train_loss: 0.9244, test_loss: 1.4326, test_f1: 0.4554
 epoch: 10, train_loss: 0.9050, test_loss: 1.3940, test_f1: 0.5335
 epoch: 11, train_loss: 0.9186, test_loss: 1.3016, test_f1: 0.5388
 epoch: 12, train_loss: 0.8822, test_loss: 1.3400, test_f1: 0.5247
 epoch: 13, train_loss: 0.8468, test_loss: 1.3946, test_f1: 0.5585
 epoch: 14, train_loss: 0.8333, test_loss: 1.3031, test_f1: 0.5451
 epoch: 15, train_loss: 0.8184, test_loss: 1.4877, test_f1: 0.5456
 epoch: 16, train_loss: 0.8052, test_loss: 1.4958, test_f1: 0.5462
 epoch: 17, train_loss: 0.7951, test_loss: 1.4700, test_f1: 0.5461
 epoch: 18, train_loss: 0.7763, test_loss: 1.3172, test_f1: 0.5677
 epoch: 19, train_loss: 0.7777, test_loss: 1.5617, test_f1: 0.5509
 epoch: 20, train_loss: 0.7727, test_loss: 1.3850, test_f1: 0.5624
 epoch: 21, train_loss: 0.7376, test_loss: 1.6258, test_f1: 0.5400
 epoch: 22, train_loss: 0.7380, test_loss: 1.5119, test_f1: 0.5711
 epoch: 23, train_loss: 0.7534, test_loss: 1.4243, test_f1: 0.5813
 epoch: 24, train_loss: 0.7409, test_loss: 1.3503, test_f1: 0.5620
 epoch: 25, train_loss: 0.7150, test_loss: 1.4922, test_f1: 0.5781
 epoch: 26, train_loss: 0.7392, test_loss: 1.5747, test_f1: 0.5528
 epoch: 27, train_loss: 0.7443, test_loss: 1.4903, test_f1: 0.5710
 epoch: 28, train_loss: 0.7045, test_loss: 1.5429, test_f1: 0.5560
 epoch: 29, train_loss: 0.6949, test_loss: 1.4632, test_f1: 0.6057
 epoch: 30, train_loss: 0.6822, test_loss: 1.4397, test_f1: 0.5641
 epoch: 31, train_loss: 0.6739, test_loss: 1.5386, test_f1: 0.5922
 epoch: 32, train_loss: 0.6493, test_loss: 1.5384, test_f1: 0.5638
 epoch: 33, train_loss: 0.6236, test_loss: 1.8211, test_f1: 0.5520
 epoch: 34, train_loss: 0.6231, test_loss: 1.5969, test_f1: 0.5838
 epoch: 35, train_loss: 0.6238, test_loss: 1.6359, test_f1: 0.5631
 epoch: 36, train_loss: 0.6378, test_loss: 1.6077, test_f1: 0.6045
 epoch: 37, train_loss: 0.6413, test_loss: 1.9012, test_f1: 0.5020
 epoch: 38, train_loss: 0.6360, test_loss: 1.8947, test_f1: 0.5411
 epoch: 39, train_loss: 0.6301, test_loss: 1.7560, test_f1: 0.5029
 epoch: 40, train_loss: 0.6133, test_loss: 1.9003, test_f1: 0.5303
 epoch: 41, train_loss: 0.5893, test_loss: 2.2079, test_f1: 0.5640
 epoch: 42, train_loss: 0.6175, test_loss: 2.0425, test_f1: 0.5418
 epoch: 43, train_loss: 0.5940, test_loss: 2.1135, test_f1: 0.5651
 epoch: 44, train_loss: 0.5826, test_loss: 1.8699, test_f1: 0.5240
 epoch: 45, train_loss: 0.5960, test_loss: 1.7546, test_f1: 0.5526
 epoch: 46, train_loss: 0.5771, test_loss: 1.7938, test_f1: 0.5585
 epoch: 47, train_loss: 0.5434, test_loss: 1.7973, test_f1: 0.5700
 epoch: 48, train_loss: 0.5411, test_loss: 1.8968, test_f1: 0.5238
 epoch: 49, train_loss: 0.5384, test_loss: 1.8836, test_f1: 0.6206
 epoch: 50, train_loss: 0.5472, test_loss: 2.2611, test_f1: 0.5113
 epoch: 51, train_loss: 0.5198, test_loss: 1.9886, test_f1: 0.5451
 epoch: 52, train_loss: 0.4810, test_loss: 2.0942, test_f1: 0.5677
 epoch: 53, train_loss: 0.4694, test_loss: 2.3903, test_f1: 0.5490
 epoch: 54, train_loss: 0.4686, test_loss: 2.0476, test_f1: 0.5703
 epoch: 55, train_loss: 0.4763, test_loss: 2.2050, test_f1: 0.5438
 epoch: 56, train_loss: 0.4613, test_loss: 2.1477, test_f1: 0.5571
 epoch: 57, train_loss: 0.4291, test_loss: 2.5393, test_f1: 0.5373
 epoch: 58, train_loss: 0.4307, test_loss: 2.2261, test_f1: 0.5622
 epoch: 59, train_loss: 0.4238, test_loss: 2.3060, test_f1: 0.5372
 epoch: 60, train_loss: 0.4282, test_loss: 2.2877, test_f1: 0.5690
 epoch: 61, train_loss: 0.4278, test_loss: 2.2111, test_f1: 0.5401
 epoch: 62, train_loss: 0.4631, test_loss: 2.7953, test_f1: 0.5495
 epoch: 63, train_loss: 0.4754, test_loss: 3.0850, test_f1: 0.5210
 epoch: 64, train_loss: 0.4719, test_loss: 2.2255, test_f1: 0.5517
 epoch: 65, train_loss: 0.4227, test_loss: 2.4986, test_f1: 0.5527
 epoch: 66, train_loss: 0.4123, test_loss: 2.5164, test_f1: 0.5356
 epoch: 67, train_loss: 0.3910, test_loss: 3.2701, test_f1: 0.5491
 epoch: 68, train_loss: 0.3924, test_loss: 2.9434, test_f1: 0.5359
 epoch: 69, train_loss: 0.4266, test_loss: 3.9824, test_f1: 0.5578
 epoch: 70, train_loss: 0.4120, test_loss: 2.4858, test_f1: 0.5541
 epoch: 71, train_loss: 0.3893, test_loss: 2.9493, test_f1: 0.5175
 epoch: 72, train_loss: 0.4120, test_loss: 2.6529, test_f1: 0.5657
 epoch: 73, train_loss: 0.3712, test_loss: 2.9096, test_f1: 0.5236
 epoch: 74, train_loss: 0.3857, test_loss: 3.0586, test_f1: 0.5481
 epoch: 75, train_loss: 0.3981, test_loss: 3.7209, test_f1: 0.5257
 epoch: 76, train_loss: 0.3604, test_loss: 4.2108, test_f1: 0.5325
 epoch: 77, train_loss: 0.3770, test_loss: 4.6814, test_f1: 0.5423
 epoch: 78, train_loss: 0.3826, test_loss: 4.5192, test_f1: 0.5293
 epoch: 79, train_loss: 0.3548, test_loss: 5.7616, test_f1: 0.5483
 epoch: 80, train_loss: 0.3548, test_loss: 3.7809, test_f1: 0.5403
 epoch: 81, train_loss: 0.3512, test_loss: 3.4780, test_f1: 0.5890
 epoch: 82, train_loss: 0.3406, test_loss: 4.4438, test_f1: 0.5343
 epoch: 83, train_loss: 0.3520, test_loss: 4.6871, test_f1: 0.5724
 epoch: 84, train_loss: 0.3611, test_loss: 3.1022, test_f1: 0.5359
 epoch: 85, train_loss: 0.3735, test_loss: 3.1537, test_f1: 0.5599
 epoch: 86, train_loss: 0.3724, test_loss: 3.2724, test_f1: 0.5161
 epoch: 87, train_loss: 0.3634, test_loss: 3.3878, test_f1: 0.5850
 epoch: 88, train_loss: 0.3678, test_loss: 3.4817, test_f1: 0.5318
 epoch: 89, train_loss: 0.3306, test_loss: 4.4414, test_f1: 0.5677
 epoch: 90, train_loss: 0.3369, test_loss: 3.8193, test_f1: 0.5500
 epoch: 91, train_loss: 0.3632, test_loss: 3.9907, test_f1: 0.5466
 epoch: 92, train_loss: 0.3303, test_loss: 4.2373, test_f1: 0.5527
 epoch: 93, train_loss: 0.3440, test_loss: 4.4616, test_f1: 0.5637
 epoch: 94, train_loss: 0.3214, test_loss: 3.9168, test_f1: 0.5698
 epoch: 95, train_loss: 0.3415, test_loss: 5.3772, test_f1: 0.5672
 epoch: 96, train_loss: 0.3690, test_loss: 3.2295, test_f1: 0.5232
 epoch: 97, train_loss: 0.3458, test_loss: 3.6611, test_f1: 0.5403
 epoch: 98, train_loss: 0.3074, test_loss: 3.3206, test_f1: 0.5553
 epoch: 99, train_loss: 0.3153, test_loss: 4.2444, test_f1: 0.5465
##################ITERATION #8 ****************************************
 epoch: 0, train_loss: 1.3641, test_loss: 1.3627, test_f1: 0.2957
 epoch: 1, train_loss: 1.2052, test_loss: 1.2801, test_f1: 0.3868
 epoch: 2, train_loss: 1.1160, test_loss: 1.3419, test_f1: 0.4459
 epoch: 3, train_loss: 1.0880, test_loss: 1.2193, test_f1: 0.5128
 epoch: 4, train_loss: 1.0528, test_loss: 1.1991, test_f1: 0.4586
 epoch: 5, train_loss: 1.0418, test_loss: 1.1613, test_f1: 0.5087
 epoch: 6, train_loss: 1.0144, test_loss: 1.1974, test_f1: 0.5119
 epoch: 7, train_loss: 0.9763, test_loss: 1.1820, test_f1: 0.5635
 epoch: 8, train_loss: 0.9722, test_loss: 1.1739, test_f1: 0.4994
 epoch: 9, train_loss: 0.9458, test_loss: 1.1656, test_f1: 0.5177
 epoch: 10, train_loss: 0.9158, test_loss: 1.1037, test_f1: 0.5574
 epoch: 11, train_loss: 0.8966, test_loss: 1.2886, test_f1: 0.4505
 epoch: 12, train_loss: 0.9063, test_loss: 1.1518, test_f1: 0.5465
 epoch: 13, train_loss: 0.8736, test_loss: 1.2320, test_f1: 0.4960
 epoch: 14, train_loss: 0.8646, test_loss: 1.1471, test_f1: 0.4835
 epoch: 15, train_loss: 0.8318, test_loss: 1.0544, test_f1: 0.5519
 epoch: 16, train_loss: 0.8239, test_loss: 1.0637, test_f1: 0.5104
 epoch: 17, train_loss: 0.8355, test_loss: 1.2719, test_f1: 0.5451
 epoch: 18, train_loss: 0.8266, test_loss: 1.1888, test_f1: 0.5329
 epoch: 19, train_loss: 0.8096, test_loss: 1.3755, test_f1: 0.4652
 epoch: 20, train_loss: 0.7848, test_loss: 1.1698, test_f1: 0.5596
 epoch: 21, train_loss: 0.7712, test_loss: 1.4427, test_f1: 0.5306
 epoch: 22, train_loss: 0.7545, test_loss: 1.2519, test_f1: 0.5144
 epoch: 23, train_loss: 0.7612, test_loss: 1.4141, test_f1: 0.5027
 epoch: 24, train_loss: 0.7628, test_loss: 1.3929, test_f1: 0.5417
 epoch: 25, train_loss: 0.7400, test_loss: 1.5027, test_f1: 0.4989
 epoch: 26, train_loss: 0.7336, test_loss: 1.2606, test_f1: 0.5444
 epoch: 27, train_loss: 0.7222, test_loss: 1.4065, test_f1: 0.5064
 epoch: 28, train_loss: 0.7219, test_loss: 1.9144, test_f1: 0.4118
 epoch: 29, train_loss: 0.7207, test_loss: 1.2381, test_f1: 0.5580
 epoch: 30, train_loss: 0.6950, test_loss: 1.3077, test_f1: 0.5758
 epoch: 31, train_loss: 0.7324, test_loss: 1.5726, test_f1: 0.5157
 epoch: 32, train_loss: 0.6846, test_loss: 1.3311, test_f1: 0.5398
 epoch: 33, train_loss: 0.6562, test_loss: 1.4517, test_f1: 0.5275
 epoch: 34, train_loss: 0.6589, test_loss: 1.5179, test_f1: 0.5668
 epoch: 35, train_loss: 0.6674, test_loss: 1.4483, test_f1: 0.5534
 epoch: 36, train_loss: 0.7066, test_loss: 1.2157, test_f1: 0.5567
 epoch: 37, train_loss: 0.6573, test_loss: 1.3747, test_f1: 0.5722
 epoch: 38, train_loss: 0.6485, test_loss: 1.1881, test_f1: 0.5826
 epoch: 39, train_loss: 0.6304, test_loss: 1.3030, test_f1: 0.5648
 epoch: 40, train_loss: 0.6225, test_loss: 1.4907, test_f1: 0.5338
 epoch: 41, train_loss: 0.6331, test_loss: 1.3607, test_f1: 0.5729
 epoch: 42, train_loss: 0.6236, test_loss: 1.7552, test_f1: 0.5132
 epoch: 43, train_loss: 0.6034, test_loss: 1.3033, test_f1: 0.5626
 epoch: 44, train_loss: 0.6484, test_loss: 1.6424, test_f1: 0.5657
 epoch: 45, train_loss: 0.6523, test_loss: 1.3193, test_f1: 0.6138
 epoch: 46, train_loss: 0.6292, test_loss: 1.2536, test_f1: 0.6128
 epoch: 47, train_loss: 0.6079, test_loss: 1.5039, test_f1: 0.5603
 epoch: 48, train_loss: 0.5914, test_loss: 1.5475, test_f1: 0.5355
 epoch: 49, train_loss: 0.5866, test_loss: 1.5535, test_f1: 0.5729
 epoch: 50, train_loss: 0.5570, test_loss: 1.5485, test_f1: 0.5807
 epoch: 51, train_loss: 0.5371, test_loss: 1.5877, test_f1: 0.5708
 epoch: 52, train_loss: 0.5113, test_loss: 1.4401, test_f1: 0.5855
 epoch: 53, train_loss: 0.4912, test_loss: 1.5028, test_f1: 0.5731
 epoch: 54, train_loss: 0.4981, test_loss: 1.5613, test_f1: 0.5645
 epoch: 55, train_loss: 0.4843, test_loss: 1.6810, test_f1: 0.5814
 epoch: 56, train_loss: 0.4930, test_loss: 1.8181, test_f1: 0.5625
 epoch: 57, train_loss: 0.4837, test_loss: 1.6403, test_f1: 0.5892
 epoch: 58, train_loss: 0.4697, test_loss: 1.9594, test_f1: 0.5539
 epoch: 59, train_loss: 0.4644, test_loss: 1.8015, test_f1: 0.5585
 epoch: 60, train_loss: 0.4706, test_loss: 1.9003, test_f1: 0.5494
 epoch: 61, train_loss: 0.4725, test_loss: 1.5097, test_f1: 0.6095
 epoch: 62, train_loss: 0.4576, test_loss: 1.8508, test_f1: 0.5605
 epoch: 63, train_loss: 0.4699, test_loss: 1.8581, test_f1: 0.5847
 epoch: 64, train_loss: 0.4487, test_loss: 1.6986, test_f1: 0.5869
 epoch: 65, train_loss: 0.4573, test_loss: 1.7813, test_f1: 0.5648
 epoch: 66, train_loss: 0.4574, test_loss: 1.9673, test_f1: 0.5487
 epoch: 67, train_loss: 0.4600, test_loss: 1.7868, test_f1: 0.5688
 epoch: 68, train_loss: 0.4526, test_loss: 1.7281, test_f1: 0.5861
 epoch: 69, train_loss: 0.4264, test_loss: 1.6937, test_f1: 0.5830
 epoch: 70, train_loss: 0.4286, test_loss: 1.6459, test_f1: 0.5662
 epoch: 71, train_loss: 0.4146, test_loss: 1.9557, test_f1: 0.5334
 epoch: 72, train_loss: 0.4078, test_loss: 1.6767, test_f1: 0.5771
 epoch: 73, train_loss: 0.4195, test_loss: 1.5827, test_f1: 0.5746
 epoch: 74, train_loss: 0.4329, test_loss: 1.7453, test_f1: 0.5578
 epoch: 75, train_loss: 0.4286, test_loss: 1.7857, test_f1: 0.5767
 epoch: 76, train_loss: 0.3855, test_loss: 1.9349, test_f1: 0.5676
 epoch: 77, train_loss: 0.3885, test_loss: 1.7997, test_f1: 0.5678
 epoch: 78, train_loss: 0.3946, test_loss: 1.8048, test_f1: 0.5537
 epoch: 79, train_loss: 0.4045, test_loss: 2.1942, test_f1: 0.5497
 epoch: 80, train_loss: 0.4257, test_loss: 2.0233, test_f1: 0.5291
 epoch: 81, train_loss: 0.4160, test_loss: 2.1729, test_f1: 0.5452
 epoch: 82, train_loss: 0.4243, test_loss: 2.0287, test_f1: 0.5810
 epoch: 83, train_loss: 0.3927, test_loss: 1.9738, test_f1: 0.5719
 epoch: 84, train_loss: 0.3778, test_loss: 2.0521, test_f1: 0.5687
 epoch: 85, train_loss: 0.3796, test_loss: 2.0641, test_f1: 0.5698
 epoch: 86, train_loss: 0.3570, test_loss: 2.4332, test_f1: 0.5362
 epoch: 87, train_loss: 0.4041, test_loss: 2.0300, test_f1: 0.5833
 epoch: 88, train_loss: 0.3857, test_loss: 1.9791, test_f1: 0.5937
 epoch: 89, train_loss: 0.3871, test_loss: 2.2168, test_f1: 0.5449
 epoch: 90, train_loss: 0.3577, test_loss: 2.1608, test_f1: 0.5468
 epoch: 91, train_loss: 0.3566, test_loss: 2.2562, test_f1: 0.5843
 epoch: 92, train_loss: 0.3501, test_loss: 2.3720, test_f1: 0.5588
 epoch: 93, train_loss: 0.3553, test_loss: 1.9516, test_f1: 0.5743
 epoch: 94, train_loss: 0.3557, test_loss: 2.1435, test_f1: 0.5735
 epoch: 95, train_loss: 0.3092, test_loss: 2.1752, test_f1: 0.5899
 epoch: 96, train_loss: 0.3392, test_loss: 2.0554, test_f1: 0.6050
 epoch: 97, train_loss: 0.3644, test_loss: 2.2348, test_f1: 0.5525
 epoch: 98, train_loss: 0.3431, test_loss: 2.2764, test_f1: 0.5476
 epoch: 99, train_loss: 0.3327, test_loss: 2.4043, test_f1: 0.5617
##################ITERATION #9 ****************************************
 epoch: 0, train_loss: 1.2932, test_loss: 1.2745, test_f1: 0.2534
 epoch: 1, train_loss: 1.1338, test_loss: 1.2237, test_f1: 0.4339
 epoch: 2, train_loss: 1.0601, test_loss: 1.2312, test_f1: 0.5254
 epoch: 3, train_loss: 1.0389, test_loss: 1.2137, test_f1: 0.5540
 epoch: 4, train_loss: 0.9955, test_loss: 1.1923, test_f1: 0.5207
 epoch: 5, train_loss: 0.9606, test_loss: 1.1403, test_f1: 0.5185
 epoch: 6, train_loss: 0.9232, test_loss: 1.1417, test_f1: 0.5752
 epoch: 7, train_loss: 0.9410, test_loss: 1.1577, test_f1: 0.5851
 epoch: 8, train_loss: 0.8938, test_loss: 1.1277, test_f1: 0.5983
 epoch: 9, train_loss: 0.8722, test_loss: 1.2153, test_f1: 0.4836
 epoch: 10, train_loss: 0.8563, test_loss: 1.0997, test_f1: 0.6000
 epoch: 11, train_loss: 0.8534, test_loss: 1.2753, test_f1: 0.5124
 epoch: 12, train_loss: 0.8420, test_loss: 1.2738, test_f1: 0.5549
 epoch: 13, train_loss: 0.8039, test_loss: 1.3469, test_f1: 0.5611
 epoch: 14, train_loss: 0.7732, test_loss: 1.2259, test_f1: 0.5980
 epoch: 15, train_loss: 0.8092, test_loss: 1.4104, test_f1: 0.5655
 epoch: 16, train_loss: 0.8056, test_loss: 1.4908, test_f1: 0.4765
 epoch: 17, train_loss: 0.7700, test_loss: 1.2287, test_f1: 0.5713
 epoch: 18, train_loss: 0.7280, test_loss: 1.2791, test_f1: 0.5819
 epoch: 19, train_loss: 0.7294, test_loss: 1.2174, test_f1: 0.5883
 epoch: 20, train_loss: 0.7282, test_loss: 1.4844, test_f1: 0.5292
 epoch: 21, train_loss: 0.7132, test_loss: 1.1760, test_f1: 0.5893
 epoch: 22, train_loss: 0.7077, test_loss: 1.4302, test_f1: 0.5467
 epoch: 23, train_loss: 0.6551, test_loss: 1.2715, test_f1: 0.6022
 epoch: 24, train_loss: 0.6698, test_loss: 1.3975, test_f1: 0.5537
 epoch: 25, train_loss: 0.6651, test_loss: 1.3933, test_f1: 0.5941
 epoch: 26, train_loss: 0.6422, test_loss: 1.5382, test_f1: 0.5582
 epoch: 27, train_loss: 0.6667, test_loss: 1.6827, test_f1: 0.4950
 epoch: 28, train_loss: 0.6478, test_loss: 1.4423, test_f1: 0.5516
 epoch: 29, train_loss: 0.6396, test_loss: 1.7181, test_f1: 0.5720
 epoch: 30, train_loss: 0.6211, test_loss: 1.6230, test_f1: 0.5360
 epoch: 31, train_loss: 0.6441, test_loss: 1.5506, test_f1: 0.5540
 epoch: 32, train_loss: 0.5983, test_loss: 1.4526, test_f1: 0.5477
 epoch: 33, train_loss: 0.5568, test_loss: 1.5268, test_f1: 0.5445
 epoch: 34, train_loss: 0.5858, test_loss: 1.7014, test_f1: 0.5406
 epoch: 35, train_loss: 0.5867, test_loss: 1.6634, test_f1: 0.5651
 epoch: 36, train_loss: 0.6016, test_loss: 1.8428, test_f1: 0.5432
 epoch: 37, train_loss: 0.5965, test_loss: 1.7440, test_f1: 0.5636
 epoch: 38, train_loss: 0.5948, test_loss: 1.5507, test_f1: 0.5532
 epoch: 39, train_loss: 0.5782, test_loss: 1.5617, test_f1: 0.5642
 epoch: 40, train_loss: 0.5455, test_loss: 1.7295, test_f1: 0.5379
 epoch: 41, train_loss: 0.5347, test_loss: 1.8839, test_f1: 0.4976
 epoch: 42, train_loss: 0.5381, test_loss: 1.6921, test_f1: 0.5871
 epoch: 43, train_loss: 0.5494, test_loss: 1.9893, test_f1: 0.5081
 epoch: 44, train_loss: 0.5811, test_loss: 1.5010, test_f1: 0.5632
 epoch: 45, train_loss: 0.5354, test_loss: 1.4440, test_f1: 0.5892
 epoch: 46, train_loss: 0.5060, test_loss: 1.7732, test_f1: 0.5649
 epoch: 47, train_loss: 0.4955, test_loss: 1.8089, test_f1: 0.5383
 epoch: 48, train_loss: 0.4987, test_loss: 1.8279, test_f1: 0.5587
 epoch: 49, train_loss: 0.4922, test_loss: 1.9523, test_f1: 0.5412
 epoch: 50, train_loss: 0.4662, test_loss: 1.8409, test_f1: 0.5924
 epoch: 51, train_loss: 0.4561, test_loss: 1.9583, test_f1: 0.5404
 epoch: 52, train_loss: 0.4058, test_loss: 2.0210, test_f1: 0.5631
 epoch: 53, train_loss: 0.3820, test_loss: 2.0669, test_f1: 0.5385
 epoch: 54, train_loss: 0.4161, test_loss: 1.7961, test_f1: 0.5636
 epoch: 55, train_loss: 0.3777, test_loss: 1.7500, test_f1: 0.5951
 epoch: 56, train_loss: 0.3939, test_loss: 1.9073, test_f1: 0.5707
 epoch: 57, train_loss: 0.3806, test_loss: 1.9788, test_f1: 0.5858
 epoch: 58, train_loss: 0.3887, test_loss: 1.8195, test_f1: 0.5789
 epoch: 59, train_loss: 0.3819, test_loss: 2.0807, test_f1: 0.5456
 epoch: 60, train_loss: 0.3802, test_loss: 2.1853, test_f1: 0.5933
 epoch: 61, train_loss: 0.3671, test_loss: 2.0388, test_f1: 0.5514
 epoch: 62, train_loss: 0.3856, test_loss: 2.1065, test_f1: 0.5789
 epoch: 63, train_loss: 0.3841, test_loss: 2.2328, test_f1: 0.5834
 epoch: 64, train_loss: 0.3600, test_loss: 2.5958, test_f1: 0.5562
 epoch: 65, train_loss: 0.3649, test_loss: 2.3337, test_f1: 0.5449
 epoch: 66, train_loss: 0.3503, test_loss: 2.1215, test_f1: 0.5611
 epoch: 67, train_loss: 0.3254, test_loss: 2.0560, test_f1: 0.5698
 epoch: 68, train_loss: 0.3305, test_loss: 2.1126, test_f1: 0.5905
 epoch: 69, train_loss: 0.3550, test_loss: 1.8834, test_f1: 0.5960
 epoch: 70, train_loss: 0.3359, test_loss: 1.9531, test_f1: 0.6218
 epoch: 71, train_loss: 0.3444, test_loss: 2.2224, test_f1: 0.5595
 epoch: 72, train_loss: 0.3449, test_loss: 2.0468, test_f1: 0.5765
 epoch: 73, train_loss: 0.3361, test_loss: 2.1897, test_f1: 0.5590
 epoch: 74, train_loss: 0.2773, test_loss: 2.1147, test_f1: 0.6006
 epoch: 75, train_loss: 0.3266, test_loss: 2.5451, test_f1: 0.5831
 epoch: 76, train_loss: 0.3143, test_loss: 2.1970, test_f1: 0.5619
 epoch: 77, train_loss: 0.2939, test_loss: 2.2428, test_f1: 0.5727
 epoch: 78, train_loss: 0.3036, test_loss: 2.2428, test_f1: 0.5939
 epoch: 79, train_loss: 0.3054, test_loss: 2.3904, test_f1: 0.5803
 epoch: 80, train_loss: 0.3046, test_loss: 2.3665, test_f1: 0.5696
 epoch: 81, train_loss: 0.3162, test_loss: 2.7006, test_f1: 0.5479
 epoch: 82, train_loss: 0.3227, test_loss: 2.4664, test_f1: 0.5831
 epoch: 83, train_loss: 0.3122, test_loss: 2.3897, test_f1: 0.5928
 epoch: 84, train_loss: 0.3074, test_loss: 2.2191, test_f1: 0.6174
 epoch: 85, train_loss: 0.3160, test_loss: 2.5340, test_f1: 0.5954
 epoch: 86, train_loss: 0.3054, test_loss: 2.1676, test_f1: 0.6223
 epoch: 87, train_loss: 0.2713, test_loss: 2.2885, test_f1: 0.5736
 epoch: 88, train_loss: 0.3398, test_loss: 2.2376, test_f1: 0.6141
 epoch: 89, train_loss: 0.3184, test_loss: 2.3948, test_f1: 0.6005
 epoch: 90, train_loss: 0.3013, test_loss: 2.2486, test_f1: 0.5995
 epoch: 91, train_loss: 0.2978, test_loss: 2.3302, test_f1: 0.5777
 epoch: 92, train_loss: 0.2839, test_loss: 2.6269, test_f1: 0.5622
 epoch: 93, train_loss: 0.3012, test_loss: 2.3367, test_f1: 0.5894
 epoch: 94, train_loss: 0.2814, test_loss: 2.5958, test_f1: 0.5855
 epoch: 95, train_loss: 0.2502, test_loss: 2.6480, test_f1: 0.5912
 epoch: 96, train_loss: 0.2553, test_loss: 2.4422, test_f1: 0.6152
 epoch: 97, train_loss: 0.2768, test_loss: 2.4701, test_f1: 0.5965
 epoch: 98, train_loss: 0.2850, test_loss: 2.4796, test_f1: 0.5809
 epoch: 99, train_loss: 0.2791, test_loss: 2.6968, test_f1: 0.5886

Training completed in 550.79 seconds
Best F1: 0.6331 at epoch 68
Mean F1 across iterations: 0.6176  0.0129
========================FINAL RESULTS================================
FEGIN weighted F1: 0.6331  0.0129
python main.py --data ltspice_demos --representation component_component --model FEGIN --layers 6 --hiddens 64 --batch_size 64 --lr 0.001 --emb_size 512 --epochs 100 --save_appendix component_component_L6_H64_BS64_LR0.001_E512 --no_val
-----



STDERR:
  File "main.py", line 370, in <module>
    main()
  File "main.py", line 254, in main
    dataset = dataset_class(
  File "/home/philip/projects/ltspice_examples_code_repo/Circuit-Completion-Using-GNNs/component_classification_with_link_prediction_head/evaluation/FEGIN/kernel/circuit_datasets.py", line 15, in __init__
    self.data, self.slices = torch.load(self.processed_paths[0])
  File "/home/philip/.local/lib/python3.8/site-packages/torch/serialization.py", line 1040, in load
    warnings.warn(
  File "/usr/lib/python3.8/warnings.py", line 109, in _showwarnmsg
    sw(msg.message, msg.category, msg.filename, msg.lineno,
  File "main.py", line 47, in warn_with_traceback
    traceback.print_stack(file=log)
/home/philip/projects/ltspice_examples_code_repo/Circuit-Completion-Using-GNNs/component_classification_with_link_prediction_head/evaluation/FEGIN/kernel/circuit_datasets.py:15: FutureWarning: You are using `torch.load` with `weights_only=False` (the current default value), which uses the default pickle module implicitly. It is possible to construct malicious pickle data which will execute arbitrary code during unpickling (See https://github.com/pytorch/pytorch/blob/main/SECURITY.md#untrusted-models for more details). In a future release, the default value for `weights_only` will be flipped to `True`. This limits the functions that could be executed during unpickling. Arbitrary objects will no longer be allowed to be loaded via this mode unless they are explicitly allowlisted by the user via `torch.serialization.add_safe_globals`. We recommend you start setting `weights_only=True` for any use case where you don't have full control of the loaded file. Please open an issue on GitHub for any issues related to this experimental feature.
  self.data, self.slices = torch.load(self.processed_paths[0])
