STDOUT:
Results will be saved in /home/philip/projects/ltspice_examples_code_repo/Circuit-Completion-Using-GNNs/component_classification_with_link_prediction_head/evaluation/FEGIN/results/model_FEGIN_dataset_ltspice_examples
Command line input: python main.py --data ltspice_examples --representation component_pin --model FEGIN --layers 3 --hiddens 16 --batch_size 256 --lr 0.1 --emb_size 128 --epochs 100 --save_appendix component_pin_L3_H16_BS256_LR0.1_E128 --no_val
 is saved.
-----
ltspice_examples - FEGIN
Using 3 layers, 16 hidden units, h = 2
Loading component_pin representation dataset
ENTERED
Training FEGIN on component_pin representation
Train: 3560, Test: 848
##################ITERATION #0 ****************************************
 epoch: 0, train_loss: 1.3008, test_loss: 1.2307, test_f1: 0.3976
 epoch: 1, train_loss: 1.1196, test_loss: 1.1126, test_f1: 0.3627
 epoch: 2, train_loss: 1.0698, test_loss: 1.1026, test_f1: 0.3392
 epoch: 3, train_loss: 1.0648, test_loss: 1.0569, test_f1: 0.3634
 epoch: 4, train_loss: 1.0567, test_loss: 1.2871, test_f1: 0.3088
 epoch: 5, train_loss: 1.0589, test_loss: 1.1153, test_f1: 0.3486
 epoch: 6, train_loss: 1.0446, test_loss: 1.0983, test_f1: 0.3519
 epoch: 7, train_loss: 1.0394, test_loss: 1.2256, test_f1: 0.4309
 epoch: 8, train_loss: 1.0414, test_loss: 1.0947, test_f1: 0.3811
 epoch: 9, train_loss: 1.0304, test_loss: 1.1597, test_f1: 0.4115
 epoch: 10, train_loss: 1.0213, test_loss: 1.1224, test_f1: 0.3447
 epoch: 11, train_loss: 1.0222, test_loss: 1.4564, test_f1: 0.3527
 epoch: 12, train_loss: 1.0398, test_loss: 1.2031, test_f1: 0.4321
 epoch: 13, train_loss: 1.0378, test_loss: 1.0975, test_f1: 0.4324
 epoch: 14, train_loss: 1.0463, test_loss: 1.0436, test_f1: 0.4845
 epoch: 15, train_loss: 1.0153, test_loss: 1.2393, test_f1: 0.4187
 epoch: 16, train_loss: 0.9951, test_loss: 1.1360, test_f1: 0.4435
 epoch: 17, train_loss: 0.9801, test_loss: 1.0456, test_f1: 0.5152
 epoch: 18, train_loss: 0.9925, test_loss: 1.0650, test_f1: 0.4577
 epoch: 19, train_loss: 0.9708, test_loss: 1.2739, test_f1: 0.3619
 epoch: 20, train_loss: 0.9924, test_loss: 1.1781, test_f1: 0.4676
 epoch: 21, train_loss: 0.9740, test_loss: 1.1756, test_f1: 0.4837
 epoch: 22, train_loss: 0.9597, test_loss: 1.1510, test_f1: 0.4822
 epoch: 23, train_loss: 0.9632, test_loss: 1.2996, test_f1: 0.4751
 epoch: 24, train_loss: 0.9613, test_loss: 1.1303, test_f1: 0.3853
 epoch: 25, train_loss: 0.9558, test_loss: 0.9944, test_f1: 0.4886
 epoch: 26, train_loss: 0.9455, test_loss: 1.1525, test_f1: 0.3939
 epoch: 27, train_loss: 0.9602, test_loss: 1.0122, test_f1: 0.5010
 epoch: 28, train_loss: 0.9225, test_loss: 1.0766, test_f1: 0.4585
 epoch: 29, train_loss: 0.9420, test_loss: 0.9998, test_f1: 0.4913
 epoch: 30, train_loss: 0.9623, test_loss: 0.9842, test_f1: 0.4787
 epoch: 31, train_loss: 0.9254, test_loss: 0.9888, test_f1: 0.5390
 epoch: 32, train_loss: 0.9409, test_loss: 1.0912, test_f1: 0.5126
 epoch: 33, train_loss: 0.9579, test_loss: 1.2345, test_f1: 0.3967
 epoch: 34, train_loss: 0.9416, test_loss: 1.0660, test_f1: 0.5213
 epoch: 35, train_loss: 0.9247, test_loss: 1.0894, test_f1: 0.5222
 epoch: 36, train_loss: 0.9302, test_loss: 1.0013, test_f1: 0.4874
 epoch: 37, train_loss: 0.9210, test_loss: 1.0150, test_f1: 0.4928
 epoch: 38, train_loss: 0.9217, test_loss: 0.9758, test_f1: 0.5504
 epoch: 39, train_loss: 0.9215, test_loss: 1.3045, test_f1: 0.4518
 epoch: 40, train_loss: 0.9393, test_loss: 1.0509, test_f1: 0.4329
 epoch: 41, train_loss: 0.9219, test_loss: 1.1820, test_f1: 0.4164
 epoch: 42, train_loss: 0.9278, test_loss: 1.6330, test_f1: 0.4592
 epoch: 43, train_loss: 0.9244, test_loss: 1.2130, test_f1: 0.4715
 epoch: 44, train_loss: 0.9126, test_loss: 1.2508, test_f1: 0.5240
 epoch: 45, train_loss: 0.9625, test_loss: 1.0725, test_f1: 0.4990
 epoch: 46, train_loss: 0.9295, test_loss: 1.0271, test_f1: 0.4676
 epoch: 47, train_loss: 0.9133, test_loss: 0.9664, test_f1: 0.5193
 epoch: 48, train_loss: 0.8916, test_loss: 1.0693, test_f1: 0.5156
 epoch: 49, train_loss: 0.9078, test_loss: 1.0744, test_f1: 0.4844
 epoch: 50, train_loss: 0.9273, test_loss: 0.9248, test_f1: 0.5014
 epoch: 51, train_loss: 0.9134, test_loss: 0.9824, test_f1: 0.5231
 epoch: 52, train_loss: 0.8882, test_loss: 1.0320, test_f1: 0.5488
 epoch: 53, train_loss: 0.8949, test_loss: 1.0756, test_f1: 0.5279
 epoch: 54, train_loss: 0.8867, test_loss: 1.0839, test_f1: 0.4733
 epoch: 55, train_loss: 0.8585, test_loss: 1.2195, test_f1: 0.4909
 epoch: 56, train_loss: 0.8667, test_loss: 1.2744, test_f1: 0.5229
 epoch: 57, train_loss: 0.8892, test_loss: 0.9561, test_f1: 0.5270
 epoch: 58, train_loss: 0.8667, test_loss: 0.9661, test_f1: 0.5414
 epoch: 59, train_loss: 0.8491, test_loss: 1.0416, test_f1: 0.5510
 epoch: 60, train_loss: 0.8494, test_loss: 1.1055, test_f1: 0.5024
 epoch: 61, train_loss: 0.8575, test_loss: 1.0291, test_f1: 0.5856
 epoch: 62, train_loss: 0.8658, test_loss: 1.4128, test_f1: 0.4510
 epoch: 63, train_loss: 0.8553, test_loss: 1.0855, test_f1: 0.4937
 epoch: 64, train_loss: 0.8629, test_loss: 1.2535, test_f1: 0.4786
 epoch: 65, train_loss: 0.8411, test_loss: 1.2213, test_f1: 0.4928
 epoch: 66, train_loss: 0.8599, test_loss: 0.9458, test_f1: 0.5701
 epoch: 67, train_loss: 0.8761, test_loss: 0.9144, test_f1: 0.5077
 epoch: 68, train_loss: 0.8692, test_loss: 1.0065, test_f1: 0.5122
 epoch: 69, train_loss: 0.8654, test_loss: 1.2343, test_f1: 0.4655
 epoch: 70, train_loss: 0.8400, test_loss: 1.1533, test_f1: 0.5131
 epoch: 71, train_loss: 0.8478, test_loss: 1.0044, test_f1: 0.5110
 epoch: 72, train_loss: 0.8460, test_loss: 1.0906, test_f1: 0.5253
 epoch: 73, train_loss: 0.8581, test_loss: 0.9610, test_f1: 0.5494
 epoch: 74, train_loss: 0.8498, test_loss: 1.1383, test_f1: 0.5184
 epoch: 75, train_loss: 0.8525, test_loss: 1.0978, test_f1: 0.4997
 epoch: 76, train_loss: 0.8544, test_loss: 1.3064, test_f1: 0.4932
 epoch: 77, train_loss: 0.8691, test_loss: 1.0614, test_f1: 0.5195
 epoch: 78, train_loss: 0.8392, test_loss: 1.1982, test_f1: 0.5497
 epoch: 79, train_loss: 0.8299, test_loss: 1.2296, test_f1: 0.5127
 epoch: 80, train_loss: 0.8389, test_loss: 1.1136, test_f1: 0.4779
 epoch: 81, train_loss: 0.8464, test_loss: 1.0746, test_f1: 0.5548
 epoch: 82, train_loss: 0.8498, test_loss: 1.0230, test_f1: 0.5418
 epoch: 83, train_loss: 0.8449, test_loss: 1.0537, test_f1: 0.5347
 epoch: 84, train_loss: 0.8332, test_loss: 1.1723, test_f1: 0.5739
 epoch: 85, train_loss: 0.8455, test_loss: 1.0555, test_f1: 0.5339
 epoch: 86, train_loss: 0.8348, test_loss: 1.1317, test_f1: 0.5108
 epoch: 87, train_loss: 0.8343, test_loss: 1.0172, test_f1: 0.4922
 epoch: 88, train_loss: 0.8447, test_loss: 1.1048, test_f1: 0.5025
 epoch: 89, train_loss: 0.8337, test_loss: 1.0775, test_f1: 0.4988
 epoch: 90, train_loss: 0.8162, test_loss: 1.0437, test_f1: 0.5055
 epoch: 91, train_loss: 0.8387, test_loss: 0.9993, test_f1: 0.5335
 epoch: 92, train_loss: 0.8256, test_loss: 1.1754, test_f1: 0.5208
 epoch: 93, train_loss: 0.8415, test_loss: 1.5950, test_f1: 0.4603
 epoch: 94, train_loss: 0.8610, test_loss: 1.2104, test_f1: 0.4838
 epoch: 95, train_loss: 0.8371, test_loss: 1.1423, test_f1: 0.5068
 epoch: 96, train_loss: 0.8503, test_loss: 1.1242, test_f1: 0.4855
 epoch: 97, train_loss: 0.8243, test_loss: 1.1190, test_f1: 0.5749
 epoch: 98, train_loss: 0.8111, test_loss: 1.0323, test_f1: 0.5316
 epoch: 99, train_loss: 0.8247, test_loss: 1.0545, test_f1: 0.5327
##################ITERATION #1 ****************************************
 epoch: 0, train_loss: 1.3727, test_loss: 1.3224, test_f1: 0.2260
 epoch: 1, train_loss: 1.3053, test_loss: 1.3216, test_f1: 0.2260
 epoch: 2, train_loss: 1.3032, test_loss: 1.3147, test_f1: 0.2260
 epoch: 3, train_loss: 1.3024, test_loss: 1.3146, test_f1: 0.2260
 epoch: 4, train_loss: 1.3027, test_loss: 1.3172, test_f1: 0.2260
 epoch: 5, train_loss: 1.3020, test_loss: 1.3156, test_f1: 0.2260
 epoch: 6, train_loss: 1.3017, test_loss: 1.3149, test_f1: 0.2260
 epoch: 7, train_loss: 1.3022, test_loss: 1.3162, test_f1: 0.2260
 epoch: 8, train_loss: 1.3023, test_loss: 1.3147, test_f1: 0.2260
 epoch: 9, train_loss: 1.3019, test_loss: 1.3155, test_f1: 0.2260
 epoch: 10, train_loss: 1.3019, test_loss: 1.3148, test_f1: 0.2260
 epoch: 11, train_loss: 1.3024, test_loss: 1.3156, test_f1: 0.2260
 epoch: 12, train_loss: 1.3024, test_loss: 1.3147, test_f1: 0.2260
 epoch: 13, train_loss: 1.3022, test_loss: 1.3155, test_f1: 0.2260
 epoch: 14, train_loss: 1.3018, test_loss: 1.3163, test_f1: 0.2260
 epoch: 15, train_loss: 1.3017, test_loss: 1.3142, test_f1: 0.2260
 epoch: 16, train_loss: 1.3020, test_loss: 1.3149, test_f1: 0.2260
 epoch: 17, train_loss: 1.3021, test_loss: 1.3155, test_f1: 0.2260
 epoch: 18, train_loss: 1.3029, test_loss: 1.3141, test_f1: 0.2260
 epoch: 19, train_loss: 1.3028, test_loss: 1.3162, test_f1: 0.2260
 epoch: 20, train_loss: 1.3020, test_loss: 1.3151, test_f1: 0.2260
 epoch: 21, train_loss: 1.3018, test_loss: 1.3153, test_f1: 0.2260
 epoch: 22, train_loss: 1.3030, test_loss: 1.3154, test_f1: 0.2260
 epoch: 23, train_loss: 1.3025, test_loss: 1.3158, test_f1: 0.2260
 epoch: 24, train_loss: 1.3018, test_loss: 1.3147, test_f1: 0.2260
 epoch: 25, train_loss: 1.3022, test_loss: 1.3149, test_f1: 0.2260
 epoch: 26, train_loss: 1.3018, test_loss: 1.3153, test_f1: 0.2260
 epoch: 27, train_loss: 1.3028, test_loss: 1.3147, test_f1: 0.2260
 epoch: 28, train_loss: 1.3024, test_loss: 1.3160, test_f1: 0.2260
 epoch: 29, train_loss: 1.3023, test_loss: 1.3149, test_f1: 0.2260
 epoch: 30, train_loss: 1.3020, test_loss: 1.3155, test_f1: 0.2260
 epoch: 31, train_loss: 1.3018, test_loss: 1.3156, test_f1: 0.2260
 epoch: 32, train_loss: 1.3019, test_loss: 1.3154, test_f1: 0.2260
 epoch: 33, train_loss: 1.3027, test_loss: 1.3146, test_f1: 0.2260
 epoch: 34, train_loss: 1.3020, test_loss: 1.3156, test_f1: 0.2260
 epoch: 35, train_loss: 1.3017, test_loss: 1.3147, test_f1: 0.2260
 epoch: 36, train_loss: 1.3016, test_loss: 1.3164, test_f1: 0.2260
 epoch: 37, train_loss: 1.3026, test_loss: 1.3171, test_f1: 0.2260
 epoch: 38, train_loss: 1.3027, test_loss: 1.3147, test_f1: 0.2260
 epoch: 39, train_loss: 1.3018, test_loss: 1.3156, test_f1: 0.2260
 epoch: 40, train_loss: 1.3026, test_loss: 1.3142, test_f1: 0.2260
 epoch: 41, train_loss: 1.3023, test_loss: 1.3155, test_f1: 0.2260
 epoch: 42, train_loss: 1.3019, test_loss: 1.3151, test_f1: 0.2260
 epoch: 43, train_loss: 1.3019, test_loss: 1.3164, test_f1: 0.2260
 epoch: 44, train_loss: 1.3018, test_loss: 1.3150, test_f1: 0.2260
 epoch: 45, train_loss: 1.3023, test_loss: 1.3164, test_f1: 0.2260
 epoch: 46, train_loss: 1.3020, test_loss: 1.3151, test_f1: 0.2260
 epoch: 47, train_loss: 1.3016, test_loss: 1.3162, test_f1: 0.2260
 epoch: 48, train_loss: 1.3023, test_loss: 1.3153, test_f1: 0.2260
 epoch: 49, train_loss: 1.3019, test_loss: 1.3158, test_f1: 0.2260
 epoch: 50, train_loss: 1.3018, test_loss: 1.3147, test_f1: 0.2260
 epoch: 51, train_loss: 1.3015, test_loss: 1.3150, test_f1: 0.2260
 epoch: 52, train_loss: 1.3016, test_loss: 1.3146, test_f1: 0.2260
 epoch: 53, train_loss: 1.3015, test_loss: 1.3160, test_f1: 0.2260
 epoch: 54, train_loss: 1.3017, test_loss: 1.3151, test_f1: 0.2260
 epoch: 55, train_loss: 1.3016, test_loss: 1.3151, test_f1: 0.2260
 epoch: 56, train_loss: 1.3015, test_loss: 1.3151, test_f1: 0.2260
 epoch: 57, train_loss: 1.3016, test_loss: 1.3160, test_f1: 0.2260
 epoch: 58, train_loss: 1.3017, test_loss: 1.3150, test_f1: 0.2260
 epoch: 59, train_loss: 1.3018, test_loss: 1.3147, test_f1: 0.2260
 epoch: 60, train_loss: 1.3018, test_loss: 1.3159, test_f1: 0.2260
 epoch: 61, train_loss: 1.3017, test_loss: 1.3150, test_f1: 0.2260
 epoch: 62, train_loss: 1.3014, test_loss: 1.3155, test_f1: 0.2260
 epoch: 63, train_loss: 1.3023, test_loss: 1.3156, test_f1: 0.2260
 epoch: 64, train_loss: 1.3017, test_loss: 1.3144, test_f1: 0.2260
 epoch: 65, train_loss: 1.3017, test_loss: 1.3167, test_f1: 0.2260
 epoch: 66, train_loss: 1.3016, test_loss: 1.3149, test_f1: 0.2260
 epoch: 67, train_loss: 1.3016, test_loss: 1.3154, test_f1: 0.2260
 epoch: 68, train_loss: 1.3017, test_loss: 1.3145, test_f1: 0.2260
 epoch: 69, train_loss: 1.3022, test_loss: 1.3155, test_f1: 0.2260
 epoch: 70, train_loss: 1.3025, test_loss: 1.3154, test_f1: 0.2260
 epoch: 71, train_loss: 1.3016, test_loss: 1.3145, test_f1: 0.2260
 epoch: 72, train_loss: 1.3019, test_loss: 1.3156, test_f1: 0.2260
 epoch: 73, train_loss: 1.3016, test_loss: 1.3151, test_f1: 0.2260
 epoch: 74, train_loss: 1.3016, test_loss: 1.3151, test_f1: 0.2260
 epoch: 75, train_loss: 1.3014, test_loss: 1.3153, test_f1: 0.2260
 epoch: 76, train_loss: 1.3017, test_loss: 1.3164, test_f1: 0.2260
 epoch: 77, train_loss: 1.3020, test_loss: 1.3146, test_f1: 0.2260
 epoch: 78, train_loss: 1.3018, test_loss: 1.3149, test_f1: 0.2260
 epoch: 79, train_loss: 1.3018, test_loss: 1.3160, test_f1: 0.2260
 epoch: 80, train_loss: 1.3018, test_loss: 1.3143, test_f1: 0.2260
 epoch: 81, train_loss: 1.3014, test_loss: 1.3160, test_f1: 0.2260
 epoch: 82, train_loss: 1.3017, test_loss: 1.3152, test_f1: 0.2260
 epoch: 83, train_loss: 1.3018, test_loss: 1.3145, test_f1: 0.2260
 epoch: 84, train_loss: 1.3018, test_loss: 1.3163, test_f1: 0.2260
 epoch: 85, train_loss: 1.3014, test_loss: 1.3153, test_f1: 0.2260
 epoch: 86, train_loss: 1.3019, test_loss: 1.3155, test_f1: 0.2260
 epoch: 87, train_loss: 1.3020, test_loss: 1.3145, test_f1: 0.2260
 epoch: 88, train_loss: 1.3021, test_loss: 1.3163, test_f1: 0.2260
 epoch: 89, train_loss: 1.3024, test_loss: 1.3151, test_f1: 0.2260
 epoch: 90, train_loss: 1.3015, test_loss: 1.3168, test_f1: 0.2260
 epoch: 91, train_loss: 1.3016, test_loss: 1.3147, test_f1: 0.2260
 epoch: 92, train_loss: 1.3015, test_loss: 1.3149, test_f1: 0.2260
 epoch: 93, train_loss: 1.3019, test_loss: 1.3165, test_f1: 0.2260
 epoch: 94, train_loss: 1.3018, test_loss: 1.3143, test_f1: 0.2260
 epoch: 95, train_loss: 1.3015, test_loss: 1.3161, test_f1: 0.2260
 epoch: 96, train_loss: 1.3017, test_loss: 1.3149, test_f1: 0.2260
 epoch: 97, train_loss: 1.3015, test_loss: 1.3153, test_f1: 0.2260
 epoch: 98, train_loss: 1.3017, test_loss: 1.3155, test_f1: 0.2260
 epoch: 99, train_loss: 1.3017, test_loss: 1.3151, test_f1: 0.2260
##################ITERATION #2 ****************************************
 epoch: 0, train_loss: 1.3059, test_loss: 1.3183, test_f1: 0.2260
 epoch: 1, train_loss: 1.3041, test_loss: 1.3149, test_f1: 0.2260
 epoch: 2, train_loss: 1.3039, test_loss: 1.3180, test_f1: 0.2260
 epoch: 3, train_loss: 1.3028, test_loss: 1.3143, test_f1: 0.2260
 epoch: 4, train_loss: 1.3014, test_loss: 1.3172, test_f1: 0.2260
 epoch: 5, train_loss: 1.3018, test_loss: 1.3150, test_f1: 0.2260
 epoch: 6, train_loss: 1.3019, test_loss: 1.3138, test_f1: 0.2260
 epoch: 7, train_loss: 1.3021, test_loss: 1.3164, test_f1: 0.2260
 epoch: 8, train_loss: 1.3024, test_loss: 1.3154, test_f1: 0.2260
 epoch: 9, train_loss: 1.3018, test_loss: 1.3149, test_f1: 0.2260
 epoch: 10, train_loss: 1.3032, test_loss: 1.3145, test_f1: 0.2260
 epoch: 11, train_loss: 1.3018, test_loss: 1.3163, test_f1: 0.2260
 epoch: 12, train_loss: 1.3023, test_loss: 1.3146, test_f1: 0.2260
 epoch: 13, train_loss: 1.3017, test_loss: 1.3153, test_f1: 0.2260
 epoch: 14, train_loss: 1.3025, test_loss: 1.3151, test_f1: 0.2260
 epoch: 15, train_loss: 1.3036, test_loss: 1.3158, test_f1: 0.2260
 epoch: 16, train_loss: 1.3045, test_loss: 1.3142, test_f1: 0.2260
 epoch: 17, train_loss: 1.3040, test_loss: 1.3173, test_f1: 0.2260
 epoch: 18, train_loss: 1.3031, test_loss: 1.3144, test_f1: 0.2260
 epoch: 19, train_loss: 1.3037, test_loss: 1.3159, test_f1: 0.2260
 epoch: 20, train_loss: 1.3031, test_loss: 1.3148, test_f1: 0.2260
 epoch: 21, train_loss: 1.3017, test_loss: 1.3149, test_f1: 0.2260
 epoch: 22, train_loss: 1.3022, test_loss: 1.3156, test_f1: 0.2260
 epoch: 23, train_loss: 1.3024, test_loss: 1.3145, test_f1: 0.2260
 epoch: 24, train_loss: 1.3029, test_loss: 1.3162, test_f1: 0.2260
 epoch: 25, train_loss: 1.3024, test_loss: 1.3154, test_f1: 0.2260
 epoch: 26, train_loss: 1.3020, test_loss: 1.3146, test_f1: 0.2260
 epoch: 27, train_loss: 1.3023, test_loss: 1.3153, test_f1: 0.2260
 epoch: 28, train_loss: 1.3019, test_loss: 1.3150, test_f1: 0.2260
 epoch: 29, train_loss: 1.3023, test_loss: 1.3148, test_f1: 0.2260
 epoch: 30, train_loss: 1.3022, test_loss: 1.3165, test_f1: 0.2260
 epoch: 31, train_loss: 1.3035, test_loss: 1.3154, test_f1: 0.2260
 epoch: 32, train_loss: 1.3023, test_loss: 1.3143, test_f1: 0.2260
 epoch: 33, train_loss: 1.3025, test_loss: 1.3153, test_f1: 0.2260
 epoch: 34, train_loss: 1.3019, test_loss: 1.3146, test_f1: 0.2260
 epoch: 35, train_loss: 1.3026, test_loss: 1.3147, test_f1: 0.2260
 epoch: 36, train_loss: 1.3022, test_loss: 1.3149, test_f1: 0.2260
 epoch: 37, train_loss: 1.3018, test_loss: 1.3159, test_f1: 0.2260
 epoch: 38, train_loss: 1.3021, test_loss: 1.3143, test_f1: 0.2260
 epoch: 39, train_loss: 1.3030, test_loss: 1.3157, test_f1: 0.2260
 epoch: 40, train_loss: 1.3019, test_loss: 1.3162, test_f1: 0.2260
 epoch: 41, train_loss: 1.3018, test_loss: 1.3151, test_f1: 0.2260
 epoch: 42, train_loss: 1.3021, test_loss: 1.3155, test_f1: 0.2260
 epoch: 43, train_loss: 1.3027, test_loss: 1.3148, test_f1: 0.2260
 epoch: 44, train_loss: 1.3021, test_loss: 1.3153, test_f1: 0.2260
 epoch: 45, train_loss: 1.3017, test_loss: 1.3162, test_f1: 0.2260
 epoch: 46, train_loss: 1.3023, test_loss: 1.3141, test_f1: 0.2260
 epoch: 47, train_loss: 1.3017, test_loss: 1.3161, test_f1: 0.2260
 epoch: 48, train_loss: 1.3023, test_loss: 1.3145, test_f1: 0.2260
 epoch: 49, train_loss: 1.3021, test_loss: 1.3146, test_f1: 0.2260
 epoch: 50, train_loss: 1.3025, test_loss: 1.3166, test_f1: 0.2260
 epoch: 51, train_loss: 1.3017, test_loss: 1.3148, test_f1: 0.2260
 epoch: 52, train_loss: 1.3013, test_loss: 1.3156, test_f1: 0.2260
 epoch: 53, train_loss: 1.3015, test_loss: 1.3153, test_f1: 0.2260
 epoch: 54, train_loss: 1.3016, test_loss: 1.3147, test_f1: 0.2260
 epoch: 55, train_loss: 1.3021, test_loss: 1.3159, test_f1: 0.2260
 epoch: 56, train_loss: 1.3018, test_loss: 1.3151, test_f1: 0.2260
 epoch: 57, train_loss: 1.3016, test_loss: 1.3162, test_f1: 0.2260
 epoch: 58, train_loss: 1.3016, test_loss: 1.3145, test_f1: 0.2260
 epoch: 59, train_loss: 1.3015, test_loss: 1.3158, test_f1: 0.2260
 epoch: 60, train_loss: 1.3021, test_loss: 1.3151, test_f1: 0.2260
 epoch: 61, train_loss: 1.3015, test_loss: 1.3157, test_f1: 0.2260
 epoch: 62, train_loss: 1.3020, test_loss: 1.3153, test_f1: 0.2260
 epoch: 63, train_loss: 1.3015, test_loss: 1.3149, test_f1: 0.2260
 epoch: 64, train_loss: 1.3023, test_loss: 1.3142, test_f1: 0.2260
 epoch: 65, train_loss: 1.3015, test_loss: 1.3166, test_f1: 0.2260
 epoch: 66, train_loss: 1.3020, test_loss: 1.3156, test_f1: 0.2260
 epoch: 67, train_loss: 1.3015, test_loss: 1.3145, test_f1: 0.2260
 epoch: 68, train_loss: 1.3016, test_loss: 1.3152, test_f1: 0.2260
 epoch: 69, train_loss: 1.3016, test_loss: 1.3157, test_f1: 0.2260
 epoch: 70, train_loss: 1.3017, test_loss: 1.3151, test_f1: 0.2260
 epoch: 71, train_loss: 1.3022, test_loss: 1.3143, test_f1: 0.2260
 epoch: 72, train_loss: 1.3020, test_loss: 1.3166, test_f1: 0.2260
 epoch: 73, train_loss: 1.3020, test_loss: 1.3150, test_f1: 0.2260
 epoch: 74, train_loss: 1.3018, test_loss: 1.3159, test_f1: 0.2260
 epoch: 75, train_loss: 1.3021, test_loss: 1.3145, test_f1: 0.2260
 epoch: 76, train_loss: 1.3016, test_loss: 1.3161, test_f1: 0.2260
 epoch: 77, train_loss: 1.3015, test_loss: 1.3153, test_f1: 0.2260
 epoch: 78, train_loss: 1.3016, test_loss: 1.3147, test_f1: 0.2260
 epoch: 79, train_loss: 1.3016, test_loss: 1.3147, test_f1: 0.2260
 epoch: 80, train_loss: 1.3014, test_loss: 1.3156, test_f1: 0.2260
 epoch: 81, train_loss: 1.3015, test_loss: 1.3151, test_f1: 0.2260
 epoch: 82, train_loss: 1.3017, test_loss: 1.3161, test_f1: 0.2260
 epoch: 83, train_loss: 1.3016, test_loss: 1.3148, test_f1: 0.2260
 epoch: 84, train_loss: 1.3020, test_loss: 1.3157, test_f1: 0.2260
 epoch: 85, train_loss: 1.3014, test_loss: 1.3152, test_f1: 0.2260
 epoch: 86, train_loss: 1.3018, test_loss: 1.3147, test_f1: 0.2260
 epoch: 87, train_loss: 1.3017, test_loss: 1.3148, test_f1: 0.2260
 epoch: 88, train_loss: 1.3017, test_loss: 1.3161, test_f1: 0.2260
 epoch: 89, train_loss: 1.3017, test_loss: 1.3154, test_f1: 0.2260
 epoch: 90, train_loss: 1.3020, test_loss: 1.3165, test_f1: 0.2260
 epoch: 91, train_loss: 1.3018, test_loss: 1.3147, test_f1: 0.2260
 epoch: 92, train_loss: 1.3017, test_loss: 1.3150, test_f1: 0.2260
 epoch: 93, train_loss: 1.3017, test_loss: 1.3152, test_f1: 0.2260
 epoch: 94, train_loss: 1.3016, test_loss: 1.3147, test_f1: 0.2260
 epoch: 95, train_loss: 1.3017, test_loss: 1.3160, test_f1: 0.2260
 epoch: 96, train_loss: 1.3027, test_loss: 1.3146, test_f1: 0.2260
 epoch: 97, train_loss: 1.3018, test_loss: 1.3159, test_f1: 0.2260
 epoch: 98, train_loss: 1.3013, test_loss: 1.3156, test_f1: 0.2260
 epoch: 99, train_loss: 1.3016, test_loss: 1.3149, test_f1: 0.2260
##################ITERATION #3 ****************************************
 epoch: 0, train_loss: 1.3143, test_loss: 1.3182, test_f1: 0.2260
 epoch: 1, train_loss: 1.3030, test_loss: 1.3163, test_f1: 0.2260
 epoch: 2, train_loss: 1.3017, test_loss: 1.3149, test_f1: 0.2260
 epoch: 3, train_loss: 1.3017, test_loss: 1.3165, test_f1: 0.2260
 epoch: 4, train_loss: 1.3019, test_loss: 1.3153, test_f1: 0.2260
 epoch: 5, train_loss: 1.3026, test_loss: 1.3142, test_f1: 0.2260
 epoch: 6, train_loss: 1.3020, test_loss: 1.3163, test_f1: 0.2260
 epoch: 7, train_loss: 1.3021, test_loss: 1.3149, test_f1: 0.2260
 epoch: 8, train_loss: 1.3028, test_loss: 1.3175, test_f1: 0.2260
 epoch: 9, train_loss: 1.3032, test_loss: 1.3141, test_f1: 0.2260
 epoch: 10, train_loss: 1.3025, test_loss: 1.3160, test_f1: 0.2260
 epoch: 11, train_loss: 1.3021, test_loss: 1.3158, test_f1: 0.2260
 epoch: 12, train_loss: 1.3030, test_loss: 1.3140, test_f1: 0.2260
 epoch: 13, train_loss: 1.3041, test_loss: 1.3163, test_f1: 0.2260
 epoch: 14, train_loss: 1.3035, test_loss: 1.3153, test_f1: 0.2260
 epoch: 15, train_loss: 1.3020, test_loss: 1.3164, test_f1: 0.2260
 epoch: 16, train_loss: 1.3017, test_loss: 1.3150, test_f1: 0.2260
 epoch: 17, train_loss: 1.3020, test_loss: 1.3155, test_f1: 0.2260
 epoch: 18, train_loss: 1.3021, test_loss: 1.3146, test_f1: 0.2260
 epoch: 19, train_loss: 1.3023, test_loss: 1.3167, test_f1: 0.2260
 epoch: 20, train_loss: 1.3019, test_loss: 1.3140, test_f1: 0.2260
 epoch: 21, train_loss: 1.3028, test_loss: 1.3165, test_f1: 0.2260
 epoch: 22, train_loss: 1.3029, test_loss: 1.3146, test_f1: 0.2260
 epoch: 23, train_loss: 1.3035, test_loss: 1.3159, test_f1: 0.2260
 epoch: 24, train_loss: 1.3025, test_loss: 1.3151, test_f1: 0.2260
 epoch: 25, train_loss: 1.3015, test_loss: 1.3149, test_f1: 0.2260
 epoch: 26, train_loss: 1.3020, test_loss: 1.3153, test_f1: 0.2260
 epoch: 27, train_loss: 1.3019, test_loss: 1.3149, test_f1: 0.2260
 epoch: 28, train_loss: 1.3014, test_loss: 1.3155, test_f1: 0.2260
 epoch: 29, train_loss: 1.3019, test_loss: 1.3152, test_f1: 0.2260
 epoch: 30, train_loss: 1.3038, test_loss: 1.3172, test_f1: 0.2260
 epoch: 31, train_loss: 1.3023, test_loss: 1.3158, test_f1: 0.2260
 epoch: 32, train_loss: 1.3023, test_loss: 1.3160, test_f1: 0.2260
 epoch: 33, train_loss: 1.3020, test_loss: 1.3156, test_f1: 0.2260
 epoch: 34, train_loss: 1.3022, test_loss: 1.3153, test_f1: 0.2260
 epoch: 35, train_loss: 1.3028, test_loss: 1.3147, test_f1: 0.2260
 epoch: 36, train_loss: 1.3020, test_loss: 1.3158, test_f1: 0.2260
 epoch: 37, train_loss: 1.3026, test_loss: 1.3157, test_f1: 0.2260
 epoch: 38, train_loss: 1.3019, test_loss: 1.3146, test_f1: 0.2260
 epoch: 39, train_loss: 1.3024, test_loss: 1.3158, test_f1: 0.2260
 epoch: 40, train_loss: 1.3022, test_loss: 1.3153, test_f1: 0.2260
 epoch: 41, train_loss: 1.3018, test_loss: 1.3158, test_f1: 0.2260
 epoch: 42, train_loss: 1.3025, test_loss: 1.3153, test_f1: 0.2260
 epoch: 43, train_loss: 1.3021, test_loss: 1.3148, test_f1: 0.2260
 epoch: 44, train_loss: 1.3016, test_loss: 1.3148, test_f1: 0.2260
 epoch: 45, train_loss: 1.3021, test_loss: 1.3148, test_f1: 0.2260
 epoch: 46, train_loss: 1.3019, test_loss: 1.3156, test_f1: 0.2260
 epoch: 47, train_loss: 1.3018, test_loss: 1.3156, test_f1: 0.2260
 epoch: 48, train_loss: 1.3020, test_loss: 1.3162, test_f1: 0.2260
 epoch: 49, train_loss: 1.3023, test_loss: 1.3162, test_f1: 0.2260
 epoch: 50, train_loss: 1.3021, test_loss: 1.3151, test_f1: 0.2260
 epoch: 51, train_loss: 1.3019, test_loss: 1.3142, test_f1: 0.2260
 epoch: 52, train_loss: 1.3016, test_loss: 1.3159, test_f1: 0.2260
 epoch: 53, train_loss: 1.3014, test_loss: 1.3161, test_f1: 0.2260
 epoch: 54, train_loss: 1.3016, test_loss: 1.3158, test_f1: 0.2260
 epoch: 55, train_loss: 1.3017, test_loss: 1.3141, test_f1: 0.2260
 epoch: 56, train_loss: 1.3017, test_loss: 1.3154, test_f1: 0.2260
 epoch: 57, train_loss: 1.3015, test_loss: 1.3151, test_f1: 0.2260
 epoch: 58, train_loss: 1.3015, test_loss: 1.3157, test_f1: 0.2260
 epoch: 59, train_loss: 1.3018, test_loss: 1.3150, test_f1: 0.2260
 epoch: 60, train_loss: 1.3017, test_loss: 1.3153, test_f1: 0.2260
 epoch: 61, train_loss: 1.3020, test_loss: 1.3144, test_f1: 0.2260
 epoch: 62, train_loss: 1.3017, test_loss: 1.3164, test_f1: 0.2260
 epoch: 63, train_loss: 1.3016, test_loss: 1.3148, test_f1: 0.2260
 epoch: 64, train_loss: 1.3016, test_loss: 1.3156, test_f1: 0.2260
 epoch: 65, train_loss: 1.3014, test_loss: 1.3155, test_f1: 0.2260
 epoch: 66, train_loss: 1.3014, test_loss: 1.3152, test_f1: 0.2260
 epoch: 67, train_loss: 1.3015, test_loss: 1.3149, test_f1: 0.2260
 epoch: 68, train_loss: 1.3016, test_loss: 1.3152, test_f1: 0.2260
 epoch: 69, train_loss: 1.3014, test_loss: 1.3156, test_f1: 0.2260
 epoch: 70, train_loss: 1.3016, test_loss: 1.3149, test_f1: 0.2260
 epoch: 71, train_loss: 1.3018, test_loss: 1.3146, test_f1: 0.2260
 epoch: 72, train_loss: 1.3018, test_loss: 1.3158, test_f1: 0.2260
 epoch: 73, train_loss: 1.3016, test_loss: 1.3152, test_f1: 0.2260
 epoch: 74, train_loss: 1.3017, test_loss: 1.3158, test_f1: 0.2260
 epoch: 75, train_loss: 1.3016, test_loss: 1.3147, test_f1: 0.2260
 epoch: 76, train_loss: 1.3017, test_loss: 1.3159, test_f1: 0.2260
 epoch: 77, train_loss: 1.3016, test_loss: 1.3147, test_f1: 0.2260
 epoch: 78, train_loss: 1.3015, test_loss: 1.3153, test_f1: 0.2260
 epoch: 79, train_loss: 1.3015, test_loss: 1.3153, test_f1: 0.2260
 epoch: 80, train_loss: 1.3016, test_loss: 1.3152, test_f1: 0.2260
 epoch: 81, train_loss: 1.3018, test_loss: 1.3151, test_f1: 0.2260
 epoch: 82, train_loss: 1.3016, test_loss: 1.3156, test_f1: 0.2260
 epoch: 83, train_loss: 1.3016, test_loss: 1.3151, test_f1: 0.2260
 epoch: 84, train_loss: 1.3017, test_loss: 1.3150, test_f1: 0.2260
 epoch: 85, train_loss: 1.3021, test_loss: 1.3159, test_f1: 0.2260
 epoch: 86, train_loss: 1.3018, test_loss: 1.3156, test_f1: 0.2260
 epoch: 87, train_loss: 1.3025, test_loss: 1.3146, test_f1: 0.2260
 epoch: 88, train_loss: 1.3020, test_loss: 1.3164, test_f1: 0.2260
 epoch: 89, train_loss: 1.3016, test_loss: 1.3147, test_f1: 0.2260
 epoch: 90, train_loss: 1.3015, test_loss: 1.3157, test_f1: 0.2260
 epoch: 91, train_loss: 1.3016, test_loss: 1.3152, test_f1: 0.2260
 epoch: 92, train_loss: 1.3014, test_loss: 1.3151, test_f1: 0.2260
 epoch: 93, train_loss: 1.3018, test_loss: 1.3149, test_f1: 0.2260
 epoch: 94, train_loss: 1.3022, test_loss: 1.3168, test_f1: 0.2260
 epoch: 95, train_loss: 1.3018, test_loss: 1.3140, test_f1: 0.2260
 epoch: 96, train_loss: 1.3017, test_loss: 1.3160, test_f1: 0.2260
 epoch: 97, train_loss: 1.3022, test_loss: 1.3159, test_f1: 0.2260
 epoch: 98, train_loss: 1.3017, test_loss: 1.3155, test_f1: 0.2260
 epoch: 99, train_loss: 1.3018, test_loss: 1.3151, test_f1: 0.2260
##################ITERATION #4 ****************************************
 epoch: 0, train_loss: 1.3139, test_loss: 1.3174, test_f1: 0.2260
 epoch: 1, train_loss: 1.3018, test_loss: 1.3145, test_f1: 0.2260
 epoch: 2, train_loss: 1.3015, test_loss: 1.3156, test_f1: 0.2260
 epoch: 3, train_loss: 1.3020, test_loss: 1.3153, test_f1: 0.2260
 epoch: 4, train_loss: 1.3033, test_loss: 1.3144, test_f1: 0.2260
 epoch: 5, train_loss: 1.3028, test_loss: 1.3159, test_f1: 0.2260
 epoch: 6, train_loss: 1.3023, test_loss: 1.3146, test_f1: 0.2260
 epoch: 7, train_loss: 1.3022, test_loss: 1.3158, test_f1: 0.2260
 epoch: 8, train_loss: 1.3024, test_loss: 1.3164, test_f1: 0.2260
 epoch: 9, train_loss: 1.3027, test_loss: 1.3157, test_f1: 0.2260
 epoch: 10, train_loss: 1.3019, test_loss: 1.3154, test_f1: 0.2260
 epoch: 11, train_loss: 1.3023, test_loss: 1.3145, test_f1: 0.2260
 epoch: 12, train_loss: 1.3027, test_loss: 1.3159, test_f1: 0.2260
 epoch: 13, train_loss: 1.3021, test_loss: 1.3138, test_f1: 0.2260
 epoch: 14, train_loss: 1.3018, test_loss: 1.3155, test_f1: 0.2260
 epoch: 15, train_loss: 1.3024, test_loss: 1.3144, test_f1: 0.2260
 epoch: 16, train_loss: 1.3023, test_loss: 1.3155, test_f1: 0.2260
 epoch: 17, train_loss: 1.3028, test_loss: 1.3163, test_f1: 0.2260
 epoch: 18, train_loss: 1.3023, test_loss: 1.3157, test_f1: 0.2260
 epoch: 19, train_loss: 1.3037, test_loss: 1.3146, test_f1: 0.2260
 epoch: 20, train_loss: 1.3038, test_loss: 1.3159, test_f1: 0.2260
 epoch: 21, train_loss: 1.3022, test_loss: 1.3144, test_f1: 0.2260
 epoch: 22, train_loss: 1.3020, test_loss: 1.3151, test_f1: 0.2260
 epoch: 23, train_loss: 1.3016, test_loss: 1.3158, test_f1: 0.2260
 epoch: 24, train_loss: 1.3022, test_loss: 1.3146, test_f1: 0.2260
 epoch: 25, train_loss: 1.3024, test_loss: 1.3146, test_f1: 0.2260
 epoch: 26, train_loss: 1.3023, test_loss: 1.3161, test_f1: 0.2260
 epoch: 27, train_loss: 1.3022, test_loss: 1.3144, test_f1: 0.2260
 epoch: 28, train_loss: 1.3026, test_loss: 1.3182, test_f1: 0.2260
 epoch: 29, train_loss: 1.3032, test_loss: 1.3146, test_f1: 0.2260
 epoch: 30, train_loss: 1.3016, test_loss: 1.3151, test_f1: 0.2260
 epoch: 31, train_loss: 1.3019, test_loss: 1.3155, test_f1: 0.2260
 epoch: 32, train_loss: 1.3030, test_loss: 1.3171, test_f1: 0.2260
 epoch: 33, train_loss: 1.3023, test_loss: 1.3153, test_f1: 0.2260
 epoch: 34, train_loss: 1.3029, test_loss: 1.3144, test_f1: 0.2260
 epoch: 35, train_loss: 1.3020, test_loss: 1.3172, test_f1: 0.2260
 epoch: 36, train_loss: 1.3017, test_loss: 1.3147, test_f1: 0.2260
 epoch: 37, train_loss: 1.3020, test_loss: 1.3170, test_f1: 0.2260
 epoch: 38, train_loss: 1.3034, test_loss: 1.3153, test_f1: 0.2260
 epoch: 39, train_loss: 1.3023, test_loss: 1.3160, test_f1: 0.2260
 epoch: 40, train_loss: 1.3019, test_loss: 1.3161, test_f1: 0.2260
 epoch: 41, train_loss: 1.3025, test_loss: 1.3150, test_f1: 0.2260
 epoch: 42, train_loss: 1.3020, test_loss: 1.3164, test_f1: 0.2260
 epoch: 43, train_loss: 1.3028, test_loss: 1.3145, test_f1: 0.2260
 epoch: 44, train_loss: 1.3021, test_loss: 1.3155, test_f1: 0.2260
 epoch: 45, train_loss: 1.3019, test_loss: 1.3158, test_f1: 0.2260
 epoch: 46, train_loss: 1.3018, test_loss: 1.3156, test_f1: 0.2260
 epoch: 47, train_loss: 1.3015, test_loss: 1.3158, test_f1: 0.2260
 epoch: 48, train_loss: 1.3018, test_loss: 1.3150, test_f1: 0.2260
 epoch: 49, train_loss: 1.3022, test_loss: 1.3144, test_f1: 0.2260
 epoch: 50, train_loss: 1.3024, test_loss: 1.3157, test_f1: 0.2260
 epoch: 51, train_loss: 1.3016, test_loss: 1.3150, test_f1: 0.2260
 epoch: 52, train_loss: 1.3019, test_loss: 1.3153, test_f1: 0.2260
 epoch: 53, train_loss: 1.3017, test_loss: 1.3155, test_f1: 0.2260
 epoch: 54, train_loss: 1.3019, test_loss: 1.3153, test_f1: 0.2260
 epoch: 55, train_loss: 1.3020, test_loss: 1.3149, test_f1: 0.2260
 epoch: 56, train_loss: 1.3019, test_loss: 1.3159, test_f1: 0.2260
 epoch: 57, train_loss: 1.3014, test_loss: 1.3150, test_f1: 0.2260
 epoch: 58, train_loss: 1.3018, test_loss: 1.3148, test_f1: 0.2260
 epoch: 59, train_loss: 1.3017, test_loss: 1.3154, test_f1: 0.2260
 epoch: 60, train_loss: 1.3016, test_loss: 1.3167, test_f1: 0.2260
 epoch: 61, train_loss: 1.3014, test_loss: 1.3148, test_f1: 0.2260
 epoch: 62, train_loss: 1.3017, test_loss: 1.3156, test_f1: 0.2260
 epoch: 63, train_loss: 1.3014, test_loss: 1.3148, test_f1: 0.2260
 epoch: 64, train_loss: 1.3016, test_loss: 1.3148, test_f1: 0.2260
 epoch: 65, train_loss: 1.3013, test_loss: 1.3155, test_f1: 0.2260
 epoch: 66, train_loss: 1.3016, test_loss: 1.3165, test_f1: 0.2260
 epoch: 67, train_loss: 1.3014, test_loss: 1.3151, test_f1: 0.2260
 epoch: 68, train_loss: 1.3019, test_loss: 1.3145, test_f1: 0.2260
 epoch: 69, train_loss: 1.3019, test_loss: 1.3157, test_f1: 0.2260
 epoch: 70, train_loss: 1.3017, test_loss: 1.3154, test_f1: 0.2260
 epoch: 71, train_loss: 1.3015, test_loss: 1.3146, test_f1: 0.2260
 epoch: 72, train_loss: 1.3022, test_loss: 1.3158, test_f1: 0.2260
 epoch: 73, train_loss: 1.3019, test_loss: 1.3149, test_f1: 0.2260
 epoch: 74, train_loss: 1.3019, test_loss: 1.3156, test_f1: 0.2260
 epoch: 75, train_loss: 1.3024, test_loss: 1.3146, test_f1: 0.2260
 epoch: 76, train_loss: 1.3022, test_loss: 1.3161, test_f1: 0.2260
 epoch: 77, train_loss: 1.3016, test_loss: 1.3142, test_f1: 0.2260
 epoch: 78, train_loss: 1.3015, test_loss: 1.3158, test_f1: 0.2260
 epoch: 79, train_loss: 1.3016, test_loss: 1.3155, test_f1: 0.2260
 epoch: 80, train_loss: 1.3015, test_loss: 1.3153, test_f1: 0.2260
 epoch: 81, train_loss: 1.3015, test_loss: 1.3154, test_f1: 0.2260
 epoch: 82, train_loss: 1.3022, test_loss: 1.3143, test_f1: 0.2260
 epoch: 83, train_loss: 1.3018, test_loss: 1.3160, test_f1: 0.2260
 epoch: 84, train_loss: 1.3017, test_loss: 1.3150, test_f1: 0.2260
 epoch: 85, train_loss: 1.3016, test_loss: 1.3160, test_f1: 0.2260
 epoch: 86, train_loss: 1.3016, test_loss: 1.3163, test_f1: 0.2260
 epoch: 87, train_loss: 1.3016, test_loss: 1.3149, test_f1: 0.2260
 epoch: 88, train_loss: 1.3023, test_loss: 1.3141, test_f1: 0.2260
 epoch: 89, train_loss: 1.3016, test_loss: 1.3167, test_f1: 0.2260
 epoch: 90, train_loss: 1.3019, test_loss: 1.3147, test_f1: 0.2260
 epoch: 91, train_loss: 1.3014, test_loss: 1.3153, test_f1: 0.2260
 epoch: 92, train_loss: 1.3016, test_loss: 1.3153, test_f1: 0.2260
 epoch: 93, train_loss: 1.3016, test_loss: 1.3155, test_f1: 0.2260
 epoch: 94, train_loss: 1.3017, test_loss: 1.3157, test_f1: 0.2260
 epoch: 95, train_loss: 1.3024, test_loss: 1.3152, test_f1: 0.2260
 epoch: 96, train_loss: 1.3021, test_loss: 1.3143, test_f1: 0.2260
 epoch: 97, train_loss: 1.3019, test_loss: 1.3166, test_f1: 0.2260
 epoch: 98, train_loss: 1.3018, test_loss: 1.3150, test_f1: 0.2260
 epoch: 99, train_loss: 1.3022, test_loss: 1.3146, test_f1: 0.2260
##################ITERATION #5 ****************************************
 epoch: 0, train_loss: 1.3039, test_loss: 1.3201, test_f1: 0.2260
 epoch: 1, train_loss: 1.3051, test_loss: 1.3169, test_f1: 0.2260
 epoch: 2, train_loss: 1.3025, test_loss: 1.3150, test_f1: 0.2260
 epoch: 3, train_loss: 1.3023, test_loss: 1.3144, test_f1: 0.2260
 epoch: 4, train_loss: 1.3021, test_loss: 1.3168, test_f1: 0.2260
 epoch: 5, train_loss: 1.3022, test_loss: 1.3158, test_f1: 0.2260
 epoch: 6, train_loss: 1.3016, test_loss: 1.3156, test_f1: 0.2260
 epoch: 7, train_loss: 1.3024, test_loss: 1.3147, test_f1: 0.2260
 epoch: 8, train_loss: 1.3023, test_loss: 1.3157, test_f1: 0.2260
 epoch: 9, train_loss: 1.3037, test_loss: 1.3140, test_f1: 0.2260
 epoch: 10, train_loss: 1.3035, test_loss: 1.3171, test_f1: 0.2260
 epoch: 11, train_loss: 1.3026, test_loss: 1.3151, test_f1: 0.2260
 epoch: 12, train_loss: 1.3020, test_loss: 1.3154, test_f1: 0.2260
 epoch: 13, train_loss: 1.3017, test_loss: 1.3146, test_f1: 0.2260
 epoch: 14, train_loss: 1.3027, test_loss: 1.3163, test_f1: 0.2260
 epoch: 15, train_loss: 1.3029, test_loss: 1.3158, test_f1: 0.2260
 epoch: 16, train_loss: 1.3016, test_loss: 1.3152, test_f1: 0.2260
 epoch: 17, train_loss: 1.3027, test_loss: 1.3144, test_f1: 0.2260
 epoch: 18, train_loss: 1.3019, test_loss: 1.3151, test_f1: 0.2260
 epoch: 19, train_loss: 1.3015, test_loss: 1.3158, test_f1: 0.2260
 epoch: 20, train_loss: 1.3019, test_loss: 1.3146, test_f1: 0.2260
 epoch: 21, train_loss: 1.3017, test_loss: 1.3154, test_f1: 0.2260
 epoch: 22, train_loss: 1.3019, test_loss: 1.3146, test_f1: 0.2260
 epoch: 23, train_loss: 1.3024, test_loss: 1.3158, test_f1: 0.2260
 epoch: 24, train_loss: 1.3017, test_loss: 1.3154, test_f1: 0.2260
 epoch: 25, train_loss: 1.3025, test_loss: 1.3153, test_f1: 0.2260
 epoch: 26, train_loss: 1.3022, test_loss: 1.3149, test_f1: 0.2260
 epoch: 27, train_loss: 1.3033, test_loss: 1.3171, test_f1: 0.2260
 epoch: 28, train_loss: 1.3027, test_loss: 1.3138, test_f1: 0.2260
 epoch: 29, train_loss: 1.3020, test_loss: 1.3167, test_f1: 0.2260
 epoch: 30, train_loss: 1.3021, test_loss: 1.3144, test_f1: 0.2260
 epoch: 31, train_loss: 1.3021, test_loss: 1.3158, test_f1: 0.2260
 epoch: 32, train_loss: 1.3022, test_loss: 1.3156, test_f1: 0.2260
 epoch: 33, train_loss: 1.3020, test_loss: 1.3165, test_f1: 0.2260
 epoch: 34, train_loss: 1.3022, test_loss: 1.3144, test_f1: 0.2260
 epoch: 35, train_loss: 1.3016, test_loss: 1.3173, test_f1: 0.2260
 epoch: 36, train_loss: 1.3020, test_loss: 1.3148, test_f1: 0.2260
 epoch: 37, train_loss: 1.3023, test_loss: 1.3144, test_f1: 0.2260
 epoch: 38, train_loss: 1.3018, test_loss: 1.3171, test_f1: 0.2260
 epoch: 39, train_loss: 1.3021, test_loss: 1.3147, test_f1: 0.2260
 epoch: 40, train_loss: 1.3028, test_loss: 1.3160, test_f1: 0.2260
 epoch: 41, train_loss: 1.3027, test_loss: 1.3159, test_f1: 0.2260
 epoch: 42, train_loss: 1.3020, test_loss: 1.3150, test_f1: 0.2260
 epoch: 43, train_loss: 1.3024, test_loss: 1.3154, test_f1: 0.2260
 epoch: 44, train_loss: 1.3020, test_loss: 1.3146, test_f1: 0.2260
 epoch: 45, train_loss: 1.3020, test_loss: 1.3155, test_f1: 0.2260
 epoch: 46, train_loss: 1.3018, test_loss: 1.3154, test_f1: 0.2260
 epoch: 47, train_loss: 1.3017, test_loss: 1.3154, test_f1: 0.2260
 epoch: 48, train_loss: 1.3025, test_loss: 1.3161, test_f1: 0.2260
 epoch: 49, train_loss: 1.3024, test_loss: 1.3151, test_f1: 0.2260
 epoch: 50, train_loss: 1.3019, test_loss: 1.3149, test_f1: 0.2260
 epoch: 51, train_loss: 1.3018, test_loss: 1.3152, test_f1: 0.2260
 epoch: 52, train_loss: 1.3017, test_loss: 1.3156, test_f1: 0.2260
 epoch: 53, train_loss: 1.3016, test_loss: 1.3155, test_f1: 0.2260
 epoch: 54, train_loss: 1.3016, test_loss: 1.3145, test_f1: 0.2260
 epoch: 55, train_loss: 1.3024, test_loss: 1.3161, test_f1: 0.2260
 epoch: 56, train_loss: 1.3019, test_loss: 1.3143, test_f1: 0.2260
 epoch: 57, train_loss: 1.3017, test_loss: 1.3159, test_f1: 0.2260
 epoch: 58, train_loss: 1.3017, test_loss: 1.3155, test_f1: 0.2260
 epoch: 59, train_loss: 1.3017, test_loss: 1.3152, test_f1: 0.2260
 epoch: 60, train_loss: 1.3016, test_loss: 1.3147, test_f1: 0.2260
 epoch: 61, train_loss: 1.3017, test_loss: 1.3160, test_f1: 0.2260
 epoch: 62, train_loss: 1.3021, test_loss: 1.3150, test_f1: 0.2260
 epoch: 63, train_loss: 1.3016, test_loss: 1.3153, test_f1: 0.2260
 epoch: 64, train_loss: 1.3017, test_loss: 1.3152, test_f1: 0.2260
 epoch: 65, train_loss: 1.3015, test_loss: 1.3158, test_f1: 0.2260
 epoch: 66, train_loss: 1.3016, test_loss: 1.3152, test_f1: 0.2260
 epoch: 67, train_loss: 1.3019, test_loss: 1.3142, test_f1: 0.2260
 epoch: 68, train_loss: 1.3032, test_loss: 1.3167, test_f1: 0.2260
 epoch: 69, train_loss: 1.3014, test_loss: 1.3142, test_f1: 0.2260
 epoch: 70, train_loss: 1.3018, test_loss: 1.3156, test_f1: 0.2260
 epoch: 71, train_loss: 1.3017, test_loss: 1.3156, test_f1: 0.2260
 epoch: 72, train_loss: 1.3016, test_loss: 1.3151, test_f1: 0.2260
 epoch: 73, train_loss: 1.3016, test_loss: 1.3155, test_f1: 0.2260
 epoch: 74, train_loss: 1.3017, test_loss: 1.3143, test_f1: 0.2260
 epoch: 75, train_loss: 1.3016, test_loss: 1.3154, test_f1: 0.2260
 epoch: 76, train_loss: 1.3016, test_loss: 1.3150, test_f1: 0.2260
 epoch: 77, train_loss: 1.3016, test_loss: 1.3150, test_f1: 0.2260
 epoch: 78, train_loss: 1.3016, test_loss: 1.3154, test_f1: 0.2260
 epoch: 79, train_loss: 1.3016, test_loss: 1.3165, test_f1: 0.2260
 epoch: 80, train_loss: 1.3015, test_loss: 1.3146, test_f1: 0.2260
 epoch: 81, train_loss: 1.3021, test_loss: 1.3156, test_f1: 0.2260
 epoch: 82, train_loss: 1.3018, test_loss: 1.3159, test_f1: 0.2260
 epoch: 83, train_loss: 1.3015, test_loss: 1.3147, test_f1: 0.2260
 epoch: 84, train_loss: 1.3015, test_loss: 1.3150, test_f1: 0.2260
 epoch: 85, train_loss: 1.3017, test_loss: 1.3159, test_f1: 0.2260
 epoch: 86, train_loss: 1.3020, test_loss: 1.3148, test_f1: 0.2260
 epoch: 87, train_loss: 1.3013, test_loss: 1.3154, test_f1: 0.2260
 epoch: 88, train_loss: 1.3023, test_loss: 1.3163, test_f1: 0.2260
 epoch: 89, train_loss: 1.3018, test_loss: 1.3142, test_f1: 0.2260
 epoch: 90, train_loss: 1.3019, test_loss: 1.3160, test_f1: 0.2260
 epoch: 91, train_loss: 1.3014, test_loss: 1.3151, test_f1: 0.2260
 epoch: 92, train_loss: 1.3016, test_loss: 1.3150, test_f1: 0.2260
 epoch: 93, train_loss: 1.3016, test_loss: 1.3147, test_f1: 0.2260
 epoch: 94, train_loss: 1.3014, test_loss: 1.3157, test_f1: 0.2260
 epoch: 95, train_loss: 1.3016, test_loss: 1.3153, test_f1: 0.2260
 epoch: 96, train_loss: 1.3017, test_loss: 1.3158, test_f1: 0.2260
 epoch: 97, train_loss: 1.3021, test_loss: 1.3149, test_f1: 0.2260
 epoch: 98, train_loss: 1.3023, test_loss: 1.3151, test_f1: 0.2260
 epoch: 99, train_loss: 1.3015, test_loss: 1.3159, test_f1: 0.2260
##################ITERATION #6 ****************************************
 epoch: 0, train_loss: 1.3053, test_loss: 1.3285, test_f1: 0.2260
 epoch: 1, train_loss: 1.3067, test_loss: 1.3140, test_f1: 0.2260
 epoch: 2, train_loss: 1.3028, test_loss: 1.3160, test_f1: 0.2260
 epoch: 3, train_loss: 1.3019, test_loss: 1.3146, test_f1: 0.2260
 epoch: 4, train_loss: 1.3026, test_loss: 1.3153, test_f1: 0.2260
 epoch: 5, train_loss: 1.3018, test_loss: 1.3159, test_f1: 0.2260
 epoch: 6, train_loss: 1.3023, test_loss: 1.3155, test_f1: 0.2260
 epoch: 7, train_loss: 1.3017, test_loss: 1.3155, test_f1: 0.2260
 epoch: 8, train_loss: 1.3017, test_loss: 1.3149, test_f1: 0.2260
 epoch: 9, train_loss: 1.3025, test_loss: 1.3160, test_f1: 0.2260
 epoch: 10, train_loss: 1.3016, test_loss: 1.3148, test_f1: 0.2260
 epoch: 11, train_loss: 1.3017, test_loss: 1.3145, test_f1: 0.2260
 epoch: 12, train_loss: 1.3021, test_loss: 1.3160, test_f1: 0.2260
 epoch: 13, train_loss: 1.3018, test_loss: 1.3148, test_f1: 0.2260
 epoch: 14, train_loss: 1.3019, test_loss: 1.3163, test_f1: 0.2260
 epoch: 15, train_loss: 1.3024, test_loss: 1.3168, test_f1: 0.2260
 epoch: 16, train_loss: 1.3020, test_loss: 1.3151, test_f1: 0.2260
 epoch: 17, train_loss: 1.3017, test_loss: 1.3152, test_f1: 0.2260
 epoch: 18, train_loss: 1.3020, test_loss: 1.3158, test_f1: 0.2260
 epoch: 19, train_loss: 1.3037, test_loss: 1.3150, test_f1: 0.2260
 epoch: 20, train_loss: 1.3027, test_loss: 1.3150, test_f1: 0.2260
 epoch: 21, train_loss: 1.3025, test_loss: 1.3158, test_f1: 0.2260
 epoch: 22, train_loss: 1.3020, test_loss: 1.3149, test_f1: 0.2260
 epoch: 23, train_loss: 1.3016, test_loss: 1.3146, test_f1: 0.2260
 epoch: 24, train_loss: 1.3021, test_loss: 1.3158, test_f1: 0.2260
 epoch: 25, train_loss: 1.3019, test_loss: 1.3154, test_f1: 0.2260
 epoch: 26, train_loss: 1.3017, test_loss: 1.3158, test_f1: 0.2260
 epoch: 27, train_loss: 1.3021, test_loss: 1.3141, test_f1: 0.2260
 epoch: 28, train_loss: 1.3021, test_loss: 1.3154, test_f1: 0.2260
 epoch: 29, train_loss: 1.3016, test_loss: 1.3145, test_f1: 0.2260
 epoch: 30, train_loss: 1.3016, test_loss: 1.3166, test_f1: 0.2260
 epoch: 31, train_loss: 1.3019, test_loss: 1.3152, test_f1: 0.2260
 epoch: 32, train_loss: 1.3020, test_loss: 1.3147, test_f1: 0.2260
 epoch: 33, train_loss: 1.3042, test_loss: 1.3188, test_f1: 0.2260
 epoch: 34, train_loss: 1.3044, test_loss: 1.3142, test_f1: 0.2260
 epoch: 35, train_loss: 1.3021, test_loss: 1.3181, test_f1: 0.2260
 epoch: 36, train_loss: 1.3033, test_loss: 1.3140, test_f1: 0.2260
 epoch: 37, train_loss: 1.3023, test_loss: 1.3158, test_f1: 0.2260
 epoch: 38, train_loss: 1.3017, test_loss: 1.3154, test_f1: 0.2260
 epoch: 39, train_loss: 1.3023, test_loss: 1.3160, test_f1: 0.2260
 epoch: 40, train_loss: 1.3025, test_loss: 1.3145, test_f1: 0.2260
 epoch: 41, train_loss: 1.3031, test_loss: 1.3157, test_f1: 0.2260
 epoch: 42, train_loss: 1.3024, test_loss: 1.3147, test_f1: 0.2260
 epoch: 43, train_loss: 1.3027, test_loss: 1.3146, test_f1: 0.2260
 epoch: 44, train_loss: 1.3018, test_loss: 1.3168, test_f1: 0.2260
 epoch: 45, train_loss: 1.3016, test_loss: 1.3153, test_f1: 0.2260
 epoch: 46, train_loss: 1.3026, test_loss: 1.3149, test_f1: 0.2260
 epoch: 47, train_loss: 1.3026, test_loss: 1.3143, test_f1: 0.2260
 epoch: 48, train_loss: 1.3022, test_loss: 1.3151, test_f1: 0.2260
 epoch: 49, train_loss: 1.3027, test_loss: 1.3157, test_f1: 0.2260
 epoch: 50, train_loss: 1.3026, test_loss: 1.3154, test_f1: 0.2260
 epoch: 51, train_loss: 1.3020, test_loss: 1.3147, test_f1: 0.2260
 epoch: 52, train_loss: 1.3016, test_loss: 1.3169, test_f1: 0.2260
 epoch: 53, train_loss: 1.3017, test_loss: 1.3148, test_f1: 0.2260
 epoch: 54, train_loss: 1.3016, test_loss: 1.3148, test_f1: 0.2260
 epoch: 55, train_loss: 1.3019, test_loss: 1.3160, test_f1: 0.2260
 epoch: 56, train_loss: 1.3017, test_loss: 1.3147, test_f1: 0.2260
 epoch: 57, train_loss: 1.3016, test_loss: 1.3153, test_f1: 0.2260
 epoch: 58, train_loss: 1.3026, test_loss: 1.3147, test_f1: 0.2260
 epoch: 59, train_loss: 1.3024, test_loss: 1.3164, test_f1: 0.2260
 epoch: 60, train_loss: 1.3019, test_loss: 1.3149, test_f1: 0.2260
 epoch: 61, train_loss: 1.3017, test_loss: 1.3155, test_f1: 0.2260
 epoch: 62, train_loss: 1.3015, test_loss: 1.3147, test_f1: 0.2260
 epoch: 63, train_loss: 1.3017, test_loss: 1.3149, test_f1: 0.2260
 epoch: 64, train_loss: 1.3016, test_loss: 1.3156, test_f1: 0.2260
 epoch: 65, train_loss: 1.3018, test_loss: 1.3153, test_f1: 0.2260
 epoch: 66, train_loss: 1.3015, test_loss: 1.3157, test_f1: 0.2260
 epoch: 67, train_loss: 1.3016, test_loss: 1.3153, test_f1: 0.2260
 epoch: 68, train_loss: 1.3018, test_loss: 1.3146, test_f1: 0.2260
 epoch: 69, train_loss: 1.3016, test_loss: 1.3156, test_f1: 0.2260
 epoch: 70, train_loss: 1.3017, test_loss: 1.3150, test_f1: 0.2260
 epoch: 71, train_loss: 1.3023, test_loss: 1.3151, test_f1: 0.2260
 epoch: 72, train_loss: 1.3018, test_loss: 1.3161, test_f1: 0.2260
 epoch: 73, train_loss: 1.3015, test_loss: 1.3155, test_f1: 0.2260
 epoch: 74, train_loss: 1.3017, test_loss: 1.3156, test_f1: 0.2260
 epoch: 75, train_loss: 1.3016, test_loss: 1.3147, test_f1: 0.2260
 epoch: 76, train_loss: 1.3018, test_loss: 1.3155, test_f1: 0.2260
 epoch: 77, train_loss: 1.3014, test_loss: 1.3146, test_f1: 0.2260
 epoch: 78, train_loss: 1.3015, test_loss: 1.3155, test_f1: 0.2260
 epoch: 79, train_loss: 1.3014, test_loss: 1.3155, test_f1: 0.2260
 epoch: 80, train_loss: 1.3016, test_loss: 1.3150, test_f1: 0.2260
 epoch: 81, train_loss: 1.3014, test_loss: 1.3154, test_f1: 0.2260
 epoch: 82, train_loss: 1.3017, test_loss: 1.3156, test_f1: 0.2260
 epoch: 83, train_loss: 1.3018, test_loss: 1.3145, test_f1: 0.2260
 epoch: 84, train_loss: 1.3015, test_loss: 1.3159, test_f1: 0.2260
 epoch: 85, train_loss: 1.3022, test_loss: 1.3160, test_f1: 0.2260
 epoch: 86, train_loss: 1.3020, test_loss: 1.3151, test_f1: 0.2260
 epoch: 87, train_loss: 1.3015, test_loss: 1.3156, test_f1: 0.2260
 epoch: 88, train_loss: 1.3017, test_loss: 1.3150, test_f1: 0.2260
 epoch: 89, train_loss: 1.3015, test_loss: 1.3160, test_f1: 0.2260
 epoch: 90, train_loss: 1.3016, test_loss: 1.3151, test_f1: 0.2260
 epoch: 91, train_loss: 1.3015, test_loss: 1.3147, test_f1: 0.2260
 epoch: 92, train_loss: 1.3019, test_loss: 1.3152, test_f1: 0.2260
 epoch: 93, train_loss: 1.3015, test_loss: 1.3153, test_f1: 0.2260
 epoch: 94, train_loss: 1.3015, test_loss: 1.3149, test_f1: 0.2260
 epoch: 95, train_loss: 1.3024, test_loss: 1.3153, test_f1: 0.2260
 epoch: 96, train_loss: 1.3018, test_loss: 1.3144, test_f1: 0.2260
 epoch: 97, train_loss: 1.3021, test_loss: 1.3161, test_f1: 0.2260
 epoch: 98, train_loss: 1.3015, test_loss: 1.3148, test_f1: 0.2260
 epoch: 99, train_loss: 1.3016, test_loss: 1.3149, test_f1: 0.2260
##################ITERATION #7 ****************************************
 epoch: 0, train_loss: 1.3036, test_loss: 1.3243, test_f1: 0.2260
 epoch: 1, train_loss: 1.3033, test_loss: 1.3140, test_f1: 0.2260
 epoch: 2, train_loss: 1.3029, test_loss: 1.3161, test_f1: 0.2260
 epoch: 3, train_loss: 1.3019, test_loss: 1.3145, test_f1: 0.2260
 epoch: 4, train_loss: 1.3020, test_loss: 1.3164, test_f1: 0.2260
 epoch: 5, train_loss: 1.3021, test_loss: 1.3154, test_f1: 0.2260
 epoch: 6, train_loss: 1.3027, test_loss: 1.3156, test_f1: 0.2260
 epoch: 7, train_loss: 1.3020, test_loss: 1.3156, test_f1: 0.2260
 epoch: 8, train_loss: 1.3022, test_loss: 1.3150, test_f1: 0.2260
 epoch: 9, train_loss: 1.3025, test_loss: 1.3166, test_f1: 0.2260
 epoch: 10, train_loss: 1.3023, test_loss: 1.3137, test_f1: 0.2260
 epoch: 11, train_loss: 1.3028, test_loss: 1.3170, test_f1: 0.2260
 epoch: 12, train_loss: 1.3019, test_loss: 1.3161, test_f1: 0.2260
 epoch: 13, train_loss: 1.3019, test_loss: 1.3147, test_f1: 0.2260
 epoch: 14, train_loss: 1.3022, test_loss: 1.3166, test_f1: 0.2260
 epoch: 15, train_loss: 1.3018, test_loss: 1.3142, test_f1: 0.2260
 epoch: 16, train_loss: 1.3019, test_loss: 1.3155, test_f1: 0.2260
 epoch: 17, train_loss: 1.3019, test_loss: 1.3141, test_f1: 0.2260
 epoch: 18, train_loss: 1.3023, test_loss: 1.3178, test_f1: 0.2260
 epoch: 19, train_loss: 1.3019, test_loss: 1.3150, test_f1: 0.2260
 epoch: 20, train_loss: 1.3019, test_loss: 1.3149, test_f1: 0.2260
 epoch: 21, train_loss: 1.3027, test_loss: 1.3164, test_f1: 0.2260
 epoch: 22, train_loss: 1.3034, test_loss: 1.3155, test_f1: 0.2260
 epoch: 23, train_loss: 1.3030, test_loss: 1.3154, test_f1: 0.2260
 epoch: 24, train_loss: 1.3021, test_loss: 1.3144, test_f1: 0.2260
 epoch: 25, train_loss: 1.3016, test_loss: 1.3166, test_f1: 0.2260
 epoch: 26, train_loss: 1.3022, test_loss: 1.3142, test_f1: 0.2260
 epoch: 27, train_loss: 1.3021, test_loss: 1.3156, test_f1: 0.2260
 epoch: 28, train_loss: 1.3023, test_loss: 1.3160, test_f1: 0.2260
 epoch: 29, train_loss: 1.3026, test_loss: 1.3151, test_f1: 0.2260
 epoch: 30, train_loss: 1.3031, test_loss: 1.3166, test_f1: 0.2260
 epoch: 31, train_loss: 1.3031, test_loss: 1.3146, test_f1: 0.2260
 epoch: 32, train_loss: 1.3022, test_loss: 1.3151, test_f1: 0.2260
 epoch: 33, train_loss: 1.3020, test_loss: 1.3153, test_f1: 0.2260
 epoch: 34, train_loss: 1.3023, test_loss: 1.3161, test_f1: 0.2260
 epoch: 35, train_loss: 1.3025, test_loss: 1.3167, test_f1: 0.2260
 epoch: 36, train_loss: 1.3020, test_loss: 1.3153, test_f1: 0.2260
 epoch: 37, train_loss: 1.3021, test_loss: 1.3165, test_f1: 0.2260
 epoch: 38, train_loss: 1.3026, test_loss: 1.3166, test_f1: 0.2260
 epoch: 39, train_loss: 1.3017, test_loss: 1.3157, test_f1: 0.2260
 epoch: 40, train_loss: 1.3020, test_loss: 1.3153, test_f1: 0.2260
 epoch: 41, train_loss: 1.3015, test_loss: 1.3162, test_f1: 0.2260
 epoch: 42, train_loss: 1.3021, test_loss: 1.3142, test_f1: 0.2260
 epoch: 43, train_loss: 1.3017, test_loss: 1.3165, test_f1: 0.2260
 epoch: 44, train_loss: 1.3019, test_loss: 1.3148, test_f1: 0.2260
 epoch: 45, train_loss: 1.3019, test_loss: 1.3158, test_f1: 0.2260
 epoch: 46, train_loss: 1.3023, test_loss: 1.3147, test_f1: 0.2260
 epoch: 47, train_loss: 1.3026, test_loss: 1.3168, test_f1: 0.2260
 epoch: 48, train_loss: 1.3027, test_loss: 1.3144, test_f1: 0.2260
 epoch: 49, train_loss: 1.3022, test_loss: 1.3157, test_f1: 0.2260
 epoch: 50, train_loss: 1.3026, test_loss: 1.3167, test_f1: 0.2260
 epoch: 51, train_loss: 1.3016, test_loss: 1.3140, test_f1: 0.2260
 epoch: 52, train_loss: 1.3016, test_loss: 1.3151, test_f1: 0.2260
 epoch: 53, train_loss: 1.3016, test_loss: 1.3164, test_f1: 0.2260
 epoch: 54, train_loss: 1.3018, test_loss: 1.3145, test_f1: 0.2260
 epoch: 55, train_loss: 1.3018, test_loss: 1.3156, test_f1: 0.2260
 epoch: 56, train_loss: 1.3016, test_loss: 1.3157, test_f1: 0.2260
 epoch: 57, train_loss: 1.3018, test_loss: 1.3150, test_f1: 0.2260
 epoch: 58, train_loss: 1.3016, test_loss: 1.3156, test_f1: 0.2260
 epoch: 59, train_loss: 1.3025, test_loss: 1.3144, test_f1: 0.2260
 epoch: 60, train_loss: 1.3017, test_loss: 1.3164, test_f1: 0.2260
 epoch: 61, train_loss: 1.3026, test_loss: 1.3144, test_f1: 0.2260
 epoch: 62, train_loss: 1.3016, test_loss: 1.3165, test_f1: 0.2260
 epoch: 63, train_loss: 1.3016, test_loss: 1.3148, test_f1: 0.2260
 epoch: 64, train_loss: 1.3017, test_loss: 1.3157, test_f1: 0.2260
 epoch: 65, train_loss: 1.3016, test_loss: 1.3150, test_f1: 0.2260
 epoch: 66, train_loss: 1.3015, test_loss: 1.3157, test_f1: 0.2260
 epoch: 67, train_loss: 1.3015, test_loss: 1.3150, test_f1: 0.2260
 epoch: 68, train_loss: 1.3021, test_loss: 1.3154, test_f1: 0.2260
 epoch: 69, train_loss: 1.3017, test_loss: 1.3150, test_f1: 0.2260
 epoch: 70, train_loss: 1.3018, test_loss: 1.3163, test_f1: 0.2260
 epoch: 71, train_loss: 1.3014, test_loss: 1.3147, test_f1: 0.2260
 epoch: 72, train_loss: 1.3016, test_loss: 1.3154, test_f1: 0.2260
 epoch: 73, train_loss: 1.3015, test_loss: 1.3153, test_f1: 0.2260
 epoch: 74, train_loss: 1.3016, test_loss: 1.3154, test_f1: 0.2260
 epoch: 75, train_loss: 1.3016, test_loss: 1.3160, test_f1: 0.2260
 epoch: 76, train_loss: 1.3016, test_loss: 1.3148, test_f1: 0.2260
 epoch: 77, train_loss: 1.3016, test_loss: 1.3159, test_f1: 0.2260
 epoch: 78, train_loss: 1.3015, test_loss: 1.3152, test_f1: 0.2260
 epoch: 79, train_loss: 1.3020, test_loss: 1.3150, test_f1: 0.2260
 epoch: 80, train_loss: 1.3020, test_loss: 1.3150, test_f1: 0.2260
 epoch: 81, train_loss: 1.3015, test_loss: 1.3150, test_f1: 0.2260
 epoch: 82, train_loss: 1.3020, test_loss: 1.3159, test_f1: 0.2260
 epoch: 83, train_loss: 1.3015, test_loss: 1.3150, test_f1: 0.2260
 epoch: 84, train_loss: 1.3019, test_loss: 1.3147, test_f1: 0.2260
 epoch: 85, train_loss: 1.3015, test_loss: 1.3156, test_f1: 0.2260
 epoch: 86, train_loss: 1.3014, test_loss: 1.3158, test_f1: 0.2260
 epoch: 87, train_loss: 1.3017, test_loss: 1.3150, test_f1: 0.2260
 epoch: 88, train_loss: 1.3015, test_loss: 1.3154, test_f1: 0.2260
 epoch: 89, train_loss: 1.3018, test_loss: 1.3157, test_f1: 0.2260
 epoch: 90, train_loss: 1.3018, test_loss: 1.3157, test_f1: 0.2260
 epoch: 91, train_loss: 1.3015, test_loss: 1.3147, test_f1: 0.2260
 epoch: 92, train_loss: 1.3018, test_loss: 1.3152, test_f1: 0.2260
 epoch: 93, train_loss: 1.3014, test_loss: 1.3151, test_f1: 0.2260
 epoch: 94, train_loss: 1.3018, test_loss: 1.3154, test_f1: 0.2260
 epoch: 95, train_loss: 1.3014, test_loss: 1.3150, test_f1: 0.2260
 epoch: 96, train_loss: 1.3015, test_loss: 1.3151, test_f1: 0.2260
 epoch: 97, train_loss: 1.3015, test_loss: 1.3153, test_f1: 0.2260
 epoch: 98, train_loss: 1.3017, test_loss: 1.3160, test_f1: 0.2260
 epoch: 99, train_loss: 1.3013, test_loss: 1.3156, test_f1: 0.2260
##################ITERATION #8 ****************************************
 epoch: 0, train_loss: 1.3037, test_loss: 1.3164, test_f1: 0.2260
 epoch: 1, train_loss: 1.3023, test_loss: 1.3167, test_f1: 0.2260
 epoch: 2, train_loss: 1.3031, test_loss: 1.3162, test_f1: 0.2260
 epoch: 3, train_loss: 1.3025, test_loss: 1.3151, test_f1: 0.2260
 epoch: 4, train_loss: 1.3022, test_loss: 1.3161, test_f1: 0.2260
 epoch: 5, train_loss: 1.3018, test_loss: 1.3154, test_f1: 0.2260
 epoch: 6, train_loss: 1.3027, test_loss: 1.3163, test_f1: 0.2260
 epoch: 7, train_loss: 1.3024, test_loss: 1.3157, test_f1: 0.2260
 epoch: 8, train_loss: 1.3026, test_loss: 1.3149, test_f1: 0.2260
 epoch: 9, train_loss: 1.3025, test_loss: 1.3146, test_f1: 0.2260
 epoch: 10, train_loss: 1.3020, test_loss: 1.3156, test_f1: 0.2260
 epoch: 11, train_loss: 1.3026, test_loss: 1.3151, test_f1: 0.2260
 epoch: 12, train_loss: 1.3030, test_loss: 1.3149, test_f1: 0.2260
 epoch: 13, train_loss: 1.3038, test_loss: 1.3166, test_f1: 0.2260
 epoch: 14, train_loss: 1.3042, test_loss: 1.3146, test_f1: 0.2260
 epoch: 15, train_loss: 1.3021, test_loss: 1.3153, test_f1: 0.2260
 epoch: 16, train_loss: 1.3021, test_loss: 1.3162, test_f1: 0.2260
 epoch: 17, train_loss: 1.3023, test_loss: 1.3155, test_f1: 0.2260
 epoch: 18, train_loss: 1.3027, test_loss: 1.3148, test_f1: 0.2260
 epoch: 19, train_loss: 1.3022, test_loss: 1.3151, test_f1: 0.2260
 epoch: 20, train_loss: 1.3031, test_loss: 1.3161, test_f1: 0.2260
 epoch: 21, train_loss: 1.3023, test_loss: 1.3148, test_f1: 0.2260
 epoch: 22, train_loss: 1.3022, test_loss: 1.3157, test_f1: 0.2260
 epoch: 23, train_loss: 1.3022, test_loss: 1.3158, test_f1: 0.2260
 epoch: 24, train_loss: 1.3022, test_loss: 1.3145, test_f1: 0.2260
 epoch: 25, train_loss: 1.3021, test_loss: 1.3164, test_f1: 0.2260
 epoch: 26, train_loss: 1.3021, test_loss: 1.3151, test_f1: 0.2260
 epoch: 27, train_loss: 1.3019, test_loss: 1.3148, test_f1: 0.2260
 epoch: 28, train_loss: 1.3025, test_loss: 1.3163, test_f1: 0.2260
 epoch: 29, train_loss: 1.3028, test_loss: 1.3158, test_f1: 0.2260
 epoch: 30, train_loss: 1.3037, test_loss: 1.3154, test_f1: 0.2260
 epoch: 31, train_loss: 1.3023, test_loss: 1.3158, test_f1: 0.2260
 epoch: 32, train_loss: 1.3025, test_loss: 1.3150, test_f1: 0.2260
 epoch: 33, train_loss: 1.3025, test_loss: 1.3151, test_f1: 0.2260
 epoch: 34, train_loss: 1.3023, test_loss: 1.3168, test_f1: 0.2260
 epoch: 35, train_loss: 1.3027, test_loss: 1.3147, test_f1: 0.2260
 epoch: 36, train_loss: 1.3023, test_loss: 1.3152, test_f1: 0.2260
 epoch: 37, train_loss: 1.3022, test_loss: 1.3159, test_f1: 0.2260
 epoch: 38, train_loss: 1.3028, test_loss: 1.3144, test_f1: 0.2260
 epoch: 39, train_loss: 1.3024, test_loss: 1.3162, test_f1: 0.2260
 epoch: 40, train_loss: 1.3026, test_loss: 1.3146, test_f1: 0.2260
 epoch: 41, train_loss: 1.3019, test_loss: 1.3164, test_f1: 0.2260
 epoch: 42, train_loss: 1.3021, test_loss: 1.3159, test_f1: 0.2260
 epoch: 43, train_loss: 1.3024, test_loss: 1.3154, test_f1: 0.2260
 epoch: 44, train_loss: 1.3026, test_loss: 1.3161, test_f1: 0.2260
 epoch: 45, train_loss: 1.3027, test_loss: 1.3148, test_f1: 0.2260
 epoch: 46, train_loss: 1.3025, test_loss: 1.3164, test_f1: 0.2260
 epoch: 47, train_loss: 1.3026, test_loss: 1.3158, test_f1: 0.2260
 epoch: 48, train_loss: 1.3038, test_loss: 1.3150, test_f1: 0.2260
 epoch: 49, train_loss: 1.3015, test_loss: 1.3147, test_f1: 0.2260
 epoch: 50, train_loss: 1.3021, test_loss: 1.3161, test_f1: 0.2260
 epoch: 51, train_loss: 1.3018, test_loss: 1.3152, test_f1: 0.2260
 epoch: 52, train_loss: 1.3015, test_loss: 1.3159, test_f1: 0.2260
 epoch: 53, train_loss: 1.3016, test_loss: 1.3151, test_f1: 0.2260
 epoch: 54, train_loss: 1.3017, test_loss: 1.3159, test_f1: 0.2260
 epoch: 55, train_loss: 1.3015, test_loss: 1.3151, test_f1: 0.2260
 epoch: 56, train_loss: 1.3016, test_loss: 1.3150, test_f1: 0.2260
 epoch: 57, train_loss: 1.3017, test_loss: 1.3160, test_f1: 0.2260
 epoch: 58, train_loss: 1.3017, test_loss: 1.3143, test_f1: 0.2260
 epoch: 59, train_loss: 1.3018, test_loss: 1.3146, test_f1: 0.2260
 epoch: 60, train_loss: 1.3019, test_loss: 1.3170, test_f1: 0.2260
 epoch: 61, train_loss: 1.3017, test_loss: 1.3152, test_f1: 0.2260
 epoch: 62, train_loss: 1.3017, test_loss: 1.3144, test_f1: 0.2260
 epoch: 63, train_loss: 1.3015, test_loss: 1.3160, test_f1: 0.2260
 epoch: 64, train_loss: 1.3017, test_loss: 1.3148, test_f1: 0.2260
 epoch: 65, train_loss: 1.3016, test_loss: 1.3163, test_f1: 0.2260
 epoch: 66, train_loss: 1.3016, test_loss: 1.3144, test_f1: 0.2260
 epoch: 67, train_loss: 1.3018, test_loss: 1.3155, test_f1: 0.2260
 epoch: 68, train_loss: 1.3019, test_loss: 1.3148, test_f1: 0.2260
 epoch: 69, train_loss: 1.3020, test_loss: 1.3164, test_f1: 0.2260
 epoch: 70, train_loss: 1.3015, test_loss: 1.3149, test_f1: 0.2260
 epoch: 71, train_loss: 1.3016, test_loss: 1.3147, test_f1: 0.2260
 epoch: 72, train_loss: 1.3024, test_loss: 1.3156, test_f1: 0.2260
 epoch: 73, train_loss: 1.3014, test_loss: 1.3152, test_f1: 0.2260
 epoch: 74, train_loss: 1.3017, test_loss: 1.3150, test_f1: 0.2260
 epoch: 75, train_loss: 1.3019, test_loss: 1.3151, test_f1: 0.2260
 epoch: 76, train_loss: 1.3019, test_loss: 1.3147, test_f1: 0.2260
 epoch: 77, train_loss: 1.3013, test_loss: 1.3162, test_f1: 0.2260
 epoch: 78, train_loss: 1.3016, test_loss: 1.3152, test_f1: 0.2260
 epoch: 79, train_loss: 1.3016, test_loss: 1.3150, test_f1: 0.2260
 epoch: 80, train_loss: 1.3017, test_loss: 1.3145, test_f1: 0.2260
 epoch: 81, train_loss: 1.3020, test_loss: 1.3162, test_f1: 0.2260
 epoch: 82, train_loss: 1.3018, test_loss: 1.3144, test_f1: 0.2260
 epoch: 83, train_loss: 1.3016, test_loss: 1.3152, test_f1: 0.2260
 epoch: 84, train_loss: 1.3015, test_loss: 1.3158, test_f1: 0.2260
 epoch: 85, train_loss: 1.3020, test_loss: 1.3154, test_f1: 0.2260
 epoch: 86, train_loss: 1.3020, test_loss: 1.3140, test_f1: 0.2260
 epoch: 87, train_loss: 1.3016, test_loss: 1.3161, test_f1: 0.2260
 epoch: 88, train_loss: 1.3016, test_loss: 1.3157, test_f1: 0.2260
 epoch: 89, train_loss: 1.3015, test_loss: 1.3149, test_f1: 0.2260
 epoch: 90, train_loss: 1.3015, test_loss: 1.3150, test_f1: 0.2260
 epoch: 91, train_loss: 1.3025, test_loss: 1.3157, test_f1: 0.2260
 epoch: 92, train_loss: 1.3022, test_loss: 1.3151, test_f1: 0.2260
 epoch: 93, train_loss: 1.3016, test_loss: 1.3161, test_f1: 0.2260
 epoch: 94, train_loss: 1.3022, test_loss: 1.3145, test_f1: 0.2260
 epoch: 95, train_loss: 1.3013, test_loss: 1.3160, test_f1: 0.2260
 epoch: 96, train_loss: 1.3021, test_loss: 1.3160, test_f1: 0.2260
 epoch: 97, train_loss: 1.3019, test_loss: 1.3143, test_f1: 0.2260
 epoch: 98, train_loss: 1.3016, test_loss: 1.3162, test_f1: 0.2260
 epoch: 99, train_loss: 1.3018, test_loss: 1.3157, test_f1: 0.2260
##################ITERATION #9 ****************************************
 epoch: 0, train_loss: 1.3048, test_loss: 1.3184, test_f1: 0.2260
 epoch: 1, train_loss: 1.3017, test_loss: 1.3156, test_f1: 0.2260
 epoch: 2, train_loss: 1.3027, test_loss: 1.3161, test_f1: 0.2260
 epoch: 3, train_loss: 1.3019, test_loss: 1.3155, test_f1: 0.2260
 epoch: 4, train_loss: 1.3018, test_loss: 1.3149, test_f1: 0.2260
 epoch: 5, train_loss: 1.3023, test_loss: 1.3150, test_f1: 0.2260
 epoch: 6, train_loss: 1.3028, test_loss: 1.3143, test_f1: 0.2260
 epoch: 7, train_loss: 1.3024, test_loss: 1.3160, test_f1: 0.2260
 epoch: 8, train_loss: 1.3018, test_loss: 1.3158, test_f1: 0.2260
 epoch: 9, train_loss: 1.3028, test_loss: 1.3157, test_f1: 0.2260
 epoch: 10, train_loss: 1.3024, test_loss: 1.3141, test_f1: 0.2260
 epoch: 11, train_loss: 1.3028, test_loss: 1.3145, test_f1: 0.2260
 epoch: 12, train_loss: 1.3025, test_loss: 1.3150, test_f1: 0.2260
 epoch: 13, train_loss: 1.3042, test_loss: 1.3150, test_f1: 0.2260
 epoch: 14, train_loss: 1.3045, test_loss: 1.3166, test_f1: 0.2260
 epoch: 15, train_loss: 1.3024, test_loss: 1.3151, test_f1: 0.2260
 epoch: 16, train_loss: 1.3024, test_loss: 1.3150, test_f1: 0.2260
 epoch: 17, train_loss: 1.3018, test_loss: 1.3149, test_f1: 0.2260
 epoch: 18, train_loss: 1.3033, test_loss: 1.3148, test_f1: 0.2260
 epoch: 19, train_loss: 1.3033, test_loss: 1.3153, test_f1: 0.2260
 epoch: 20, train_loss: 1.3021, test_loss: 1.3157, test_f1: 0.2260
 epoch: 21, train_loss: 1.3024, test_loss: 1.3152, test_f1: 0.2260
 epoch: 22, train_loss: 1.3026, test_loss: 1.3165, test_f1: 0.2260
 epoch: 23, train_loss: 1.3021, test_loss: 1.3145, test_f1: 0.2260
 epoch: 24, train_loss: 1.3030, test_loss: 1.3172, test_f1: 0.2260
 epoch: 25, train_loss: 1.3024, test_loss: 1.3147, test_f1: 0.2260
 epoch: 26, train_loss: 1.3031, test_loss: 1.3162, test_f1: 0.2260
 epoch: 27, train_loss: 1.3038, test_loss: 1.3165, test_f1: 0.2260
 epoch: 28, train_loss: 1.3018, test_loss: 1.3144, test_f1: 0.2260
 epoch: 29, train_loss: 1.3019, test_loss: 1.3155, test_f1: 0.2260
 epoch: 30, train_loss: 1.3028, test_loss: 1.3145, test_f1: 0.2260
 epoch: 31, train_loss: 1.3025, test_loss: 1.3155, test_f1: 0.2260
 epoch: 32, train_loss: 1.3022, test_loss: 1.3144, test_f1: 0.2260
 epoch: 33, train_loss: 1.3025, test_loss: 1.3165, test_f1: 0.2260
 epoch: 34, train_loss: 1.3023, test_loss: 1.3155, test_f1: 0.2260
 epoch: 35, train_loss: 1.3027, test_loss: 1.3159, test_f1: 0.2260
 epoch: 36, train_loss: 1.3017, test_loss: 1.3158, test_f1: 0.2260
 epoch: 37, train_loss: 1.3035, test_loss: 1.3153, test_f1: 0.2260
 epoch: 38, train_loss: 1.3025, test_loss: 1.3166, test_f1: 0.2260
 epoch: 39, train_loss: 1.3024, test_loss: 1.3160, test_f1: 0.2260
 epoch: 40, train_loss: 1.3026, test_loss: 1.3157, test_f1: 0.2260
 epoch: 41, train_loss: 1.3019, test_loss: 1.3150, test_f1: 0.2260
 epoch: 42, train_loss: 1.3024, test_loss: 1.3165, test_f1: 0.2260
 epoch: 43, train_loss: 1.3031, test_loss: 1.3147, test_f1: 0.2260
 epoch: 44, train_loss: 1.3033, test_loss: 1.3153, test_f1: 0.2260
 epoch: 45, train_loss: 1.3017, test_loss: 1.3154, test_f1: 0.2260
 epoch: 46, train_loss: 1.3024, test_loss: 1.3161, test_f1: 0.2260
 epoch: 47, train_loss: 1.3026, test_loss: 1.3141, test_f1: 0.2260
 epoch: 48, train_loss: 1.3027, test_loss: 1.3169, test_f1: 0.2260
 epoch: 49, train_loss: 1.3024, test_loss: 1.3145, test_f1: 0.2260
 epoch: 50, train_loss: 1.3020, test_loss: 1.3163, test_f1: 0.2260
 epoch: 51, train_loss: 1.3021, test_loss: 1.3150, test_f1: 0.2260
 epoch: 52, train_loss: 1.3016, test_loss: 1.3157, test_f1: 0.2260
 epoch: 53, train_loss: 1.3022, test_loss: 1.3149, test_f1: 0.2260
 epoch: 54, train_loss: 1.3022, test_loss: 1.3155, test_f1: 0.2260
 epoch: 55, train_loss: 1.3017, test_loss: 1.3154, test_f1: 0.2260
 epoch: 56, train_loss: 1.3015, test_loss: 1.3151, test_f1: 0.2260
 epoch: 57, train_loss: 1.3019, test_loss: 1.3166, test_f1: 0.2260
 epoch: 58, train_loss: 1.3018, test_loss: 1.3146, test_f1: 0.2260
 epoch: 59, train_loss: 1.3020, test_loss: 1.3152, test_f1: 0.2260
 epoch: 60, train_loss: 1.3018, test_loss: 1.3158, test_f1: 0.2260
 epoch: 61, train_loss: 1.3016, test_loss: 1.3150, test_f1: 0.2260
 epoch: 62, train_loss: 1.3020, test_loss: 1.3154, test_f1: 0.2260
 epoch: 63, train_loss: 1.3017, test_loss: 1.3151, test_f1: 0.2260
 epoch: 64, train_loss: 1.3018, test_loss: 1.3156, test_f1: 0.2260
 epoch: 65, train_loss: 1.3017, test_loss: 1.3146, test_f1: 0.2260
 epoch: 66, train_loss: 1.3016, test_loss: 1.3155, test_f1: 0.2260
 epoch: 67, train_loss: 1.3019, test_loss: 1.3150, test_f1: 0.2260
 epoch: 68, train_loss: 1.3023, test_loss: 1.3166, test_f1: 0.2260
 epoch: 69, train_loss: 1.3020, test_loss: 1.3145, test_f1: 0.2260
 epoch: 70, train_loss: 1.3015, test_loss: 1.3154, test_f1: 0.2260
 epoch: 71, train_loss: 1.3025, test_loss: 1.3153, test_f1: 0.2260
 epoch: 72, train_loss: 1.3018, test_loss: 1.3160, test_f1: 0.2260
 epoch: 73, train_loss: 1.3025, test_loss: 1.3155, test_f1: 0.2260
 epoch: 74, train_loss: 1.3014, test_loss: 1.3154, test_f1: 0.2260
 epoch: 75, train_loss: 1.3017, test_loss: 1.3155, test_f1: 0.2260
 epoch: 76, train_loss: 1.3015, test_loss: 1.3150, test_f1: 0.2260
 epoch: 77, train_loss: 1.3018, test_loss: 1.3152, test_f1: 0.2260
 epoch: 78, train_loss: 1.3016, test_loss: 1.3151, test_f1: 0.2260
 epoch: 79, train_loss: 1.3017, test_loss: 1.3154, test_f1: 0.2260
 epoch: 80, train_loss: 1.3020, test_loss: 1.3149, test_f1: 0.2260
 epoch: 81, train_loss: 1.3015, test_loss: 1.3164, test_f1: 0.2260
 epoch: 82, train_loss: 1.3016, test_loss: 1.3149, test_f1: 0.2260
 epoch: 83, train_loss: 1.3014, test_loss: 1.3155, test_f1: 0.2260
 epoch: 84, train_loss: 1.3018, test_loss: 1.3152, test_f1: 0.2260
 epoch: 85, train_loss: 1.3017, test_loss: 1.3155, test_f1: 0.2260
 epoch: 86, train_loss: 1.3015, test_loss: 1.3147, test_f1: 0.2260
 epoch: 87, train_loss: 1.3015, test_loss: 1.3154, test_f1: 0.2260
 epoch: 88, train_loss: 1.3015, test_loss: 1.3151, test_f1: 0.2260
 epoch: 89, train_loss: 1.3017, test_loss: 1.3158, test_f1: 0.2260
 epoch: 90, train_loss: 1.3016, test_loss: 1.3156, test_f1: 0.2260
 epoch: 91, train_loss: 1.3019, test_loss: 1.3158, test_f1: 0.2260
 epoch: 92, train_loss: 1.3015, test_loss: 1.3150, test_f1: 0.2260
 epoch: 93, train_loss: 1.3017, test_loss: 1.3154, test_f1: 0.2260
 epoch: 94, train_loss: 1.3016, test_loss: 1.3148, test_f1: 0.2260
 epoch: 95, train_loss: 1.3018, test_loss: 1.3153, test_f1: 0.2260
 epoch: 96, train_loss: 1.3017, test_loss: 1.3153, test_f1: 0.2260
 epoch: 97, train_loss: 1.3015, test_loss: 1.3153, test_f1: 0.2260
 epoch: 98, train_loss: 1.3019, test_loss: 1.3152, test_f1: 0.2260
 epoch: 99, train_loss: 1.3016, test_loss: 1.3156, test_f1: 0.2260

Training completed in 399.74 seconds
Best F1: 0.5856 at epoch 61
Mean F1 across iterations: 0.2620  0.1079
========================FINAL RESULTS================================
FEGIN weighted F1: 0.5856  0.1079
python main.py --data ltspice_examples --representation component_pin --model FEGIN --layers 3 --hiddens 16 --batch_size 256 --lr 0.1 --emb_size 128 --epochs 100 --save_appendix component_pin_L3_H16_BS256_LR0.1_E128 --no_val
-----



STDERR:
  File "main.py", line 370, in <module>
    main()
  File "main.py", line 254, in main
    dataset = dataset_class(
  File "/home/philip/projects/ltspice_examples_code_repo/Circuit-Completion-Using-GNNs/component_classification_with_link_prediction_head/evaluation/FEGIN/kernel/circuit_datasets.py", line 15, in __init__
    self.data, self.slices = torch.load(self.processed_paths[0])
  File "/home/philip/.local/lib/python3.8/site-packages/torch/serialization.py", line 1040, in load
    warnings.warn(
  File "/usr/lib/python3.8/warnings.py", line 109, in _showwarnmsg
    sw(msg.message, msg.category, msg.filename, msg.lineno,
  File "main.py", line 47, in warn_with_traceback
    traceback.print_stack(file=log)
/home/philip/projects/ltspice_examples_code_repo/Circuit-Completion-Using-GNNs/component_classification_with_link_prediction_head/evaluation/FEGIN/kernel/circuit_datasets.py:15: FutureWarning: You are using `torch.load` with `weights_only=False` (the current default value), which uses the default pickle module implicitly. It is possible to construct malicious pickle data which will execute arbitrary code during unpickling (See https://github.com/pytorch/pytorch/blob/main/SECURITY.md#untrusted-models for more details). In a future release, the default value for `weights_only` will be flipped to `True`. This limits the functions that could be executed during unpickling. Arbitrary objects will no longer be allowed to be loaded via this mode unless they are explicitly allowlisted by the user via `torch.serialization.add_safe_globals`. We recommend you start setting `weights_only=True` for any use case where you don't have full control of the loaded file. Please open an issue on GitHub for any issues related to this experimental feature.
  self.data, self.slices = torch.load(self.processed_paths[0])
