STDOUT:
Results will be saved in /home/philip/projects/llm_inference_code_repo/Circuit-Completion-Using-GNNs/component_classification_with_link_prediction_head/evaluation/FEGIN/results/model_FEGIN_dataset_ltspice_examples
Command line input: python main.py --data ltspice_examples --representation component_pin_net --model FEGIN --layers 6 --hiddens 128 --batch_size 128 --lr 0.01 --emb_size 250 --epochs 100 --save_appendix component_pin_net_L6_H128_BS128_LR0.01_E250 --no_val
 is saved.
-----
ltspice_examples - FEGIN
Using 6 layers, 128 hidden units, h = 2
Loading component_pin_net representation dataset
ENTERED
Training FEGIN on component_pin_net representation
Train: 3558, Test: 846
##################ITERATION #0 ****************************************
 epoch: 0, train_loss: 1.1870, test_loss: 1.4241, test_f1: 0.2288
 epoch: 1, train_loss: 1.0471, test_loss: 1.2439, test_f1: 0.3902
 epoch: 2, train_loss: 0.9959, test_loss: 1.0806, test_f1: 0.4291
 epoch: 3, train_loss: 0.9753, test_loss: 0.9807, test_f1: 0.4718
 epoch: 4, train_loss: 0.9703, test_loss: 0.9722, test_f1: 0.5376
 epoch: 5, train_loss: 0.9425, test_loss: 1.1257, test_f1: 0.4356
 epoch: 6, train_loss: 0.9125, test_loss: 0.9792, test_f1: 0.4920
 epoch: 7, train_loss: 0.8963, test_loss: 2.2209, test_f1: 0.2318
 epoch: 8, train_loss: 0.8738, test_loss: 0.9411, test_f1: 0.5114
 epoch: 9, train_loss: 0.8712, test_loss: 0.9333, test_f1: 0.4769
 epoch: 10, train_loss: 0.8468, test_loss: 0.8601, test_f1: 0.5368
 epoch: 11, train_loss: 0.8269, test_loss: 0.7942, test_f1: 0.5910
 epoch: 12, train_loss: 0.7930, test_loss: 0.7562, test_f1: 0.6366
 epoch: 13, train_loss: 0.8012, test_loss: 0.9766, test_f1: 0.5447
 epoch: 14, train_loss: 0.7963, test_loss: 0.8517, test_f1: 0.5946
 epoch: 15, train_loss: 0.7677, test_loss: 0.7947, test_f1: 0.6199
 epoch: 16, train_loss: 0.7586, test_loss: 0.8256, test_f1: 0.5671
 epoch: 17, train_loss: 0.7527, test_loss: 0.7680, test_f1: 0.6116
 epoch: 18, train_loss: 0.7219, test_loss: 1.4784, test_f1: 0.4870
 epoch: 19, train_loss: 0.7278, test_loss: 0.9062, test_f1: 0.5603
 epoch: 20, train_loss: 0.7165, test_loss: 0.7708, test_f1: 0.6457
 epoch: 21, train_loss: 0.6898, test_loss: 0.7795, test_f1: 0.6236
 epoch: 22, train_loss: 0.6909, test_loss: 1.0708, test_f1: 0.5660
 epoch: 23, train_loss: 0.7077, test_loss: 0.8429, test_f1: 0.5736
 epoch: 24, train_loss: 0.6901, test_loss: 0.7691, test_f1: 0.6879
 epoch: 25, train_loss: 0.6704, test_loss: 0.8081, test_f1: 0.6150
 epoch: 26, train_loss: 0.6413, test_loss: 0.8591, test_f1: 0.6222
 epoch: 27, train_loss: 0.6463, test_loss: 0.8690, test_f1: 0.6270
 epoch: 28, train_loss: 0.6549, test_loss: 0.8261, test_f1: 0.5699
 epoch: 29, train_loss: 0.6361, test_loss: 0.7817, test_f1: 0.6632
 epoch: 30, train_loss: 0.6289, test_loss: 0.8042, test_f1: 0.6290
 epoch: 31, train_loss: 0.6183, test_loss: 0.9931, test_f1: 0.6075
 epoch: 32, train_loss: 0.6161, test_loss: 0.8909, test_f1: 0.6021
 epoch: 33, train_loss: 0.6084, test_loss: 0.8136, test_f1: 0.6389
 epoch: 34, train_loss: 0.6184, test_loss: 0.7622, test_f1: 0.6538
 epoch: 35, train_loss: 0.5886, test_loss: 0.8592, test_f1: 0.6338
 epoch: 36, train_loss: 0.5954, test_loss: 0.8656, test_f1: 0.5836
 epoch: 37, train_loss: 0.5989, test_loss: 0.8155, test_f1: 0.6584
 epoch: 38, train_loss: 0.5884, test_loss: 0.9427, test_f1: 0.6121
 epoch: 39, train_loss: 0.5675, test_loss: 0.8766, test_f1: 0.6295
 epoch: 40, train_loss: 0.5833, test_loss: 0.9622, test_f1: 0.6011
 epoch: 41, train_loss: 0.5647, test_loss: 0.8901, test_f1: 0.6008
 epoch: 42, train_loss: 0.5617, test_loss: 0.8326, test_f1: 0.6664
 epoch: 43, train_loss: 0.5570, test_loss: 0.9503, test_f1: 0.6392
 epoch: 44, train_loss: 0.5409, test_loss: 1.1955, test_f1: 0.5813
 epoch: 45, train_loss: 0.5343, test_loss: 0.8735, test_f1: 0.6294
 epoch: 46, train_loss: 0.5303, test_loss: 0.7869, test_f1: 0.6679
 epoch: 47, train_loss: 0.5139, test_loss: 0.9077, test_f1: 0.5949
 epoch: 48, train_loss: 0.5208, test_loss: 0.9974, test_f1: 0.5837
 epoch: 49, train_loss: 0.5251, test_loss: 0.9045, test_f1: 0.6168
 epoch: 50, train_loss: 0.5355, test_loss: 0.9657, test_f1: 0.5971
 epoch: 51, train_loss: 0.4602, test_loss: 0.8913, test_f1: 0.6561
 epoch: 52, train_loss: 0.4215, test_loss: 0.9518, test_f1: 0.6612
 epoch: 53, train_loss: 0.4206, test_loss: 0.9131, test_f1: 0.6502
 epoch: 54, train_loss: 0.4243, test_loss: 0.9367, test_f1: 0.6780
 epoch: 55, train_loss: 0.4030, test_loss: 0.9393, test_f1: 0.6773
 epoch: 56, train_loss: 0.3944, test_loss: 0.9325, test_f1: 0.6477
 epoch: 57, train_loss: 0.3996, test_loss: 0.9931, test_f1: 0.6720
 epoch: 58, train_loss: 0.3818, test_loss: 0.9839, test_f1: 0.6460
 epoch: 59, train_loss: 0.3914, test_loss: 0.9557, test_f1: 0.6785
 epoch: 60, train_loss: 0.3789, test_loss: 1.0405, test_f1: 0.6239
 epoch: 61, train_loss: 0.3635, test_loss: 1.1291, test_f1: 0.6629
 epoch: 62, train_loss: 0.3751, test_loss: 1.0486, test_f1: 0.6235
 epoch: 63, train_loss: 0.3570, test_loss: 0.9292, test_f1: 0.6888
 epoch: 64, train_loss: 0.3838, test_loss: 1.0012, test_f1: 0.6533
 epoch: 65, train_loss: 0.3514, test_loss: 1.0426, test_f1: 0.6538
 epoch: 66, train_loss: 0.3572, test_loss: 1.0565, test_f1: 0.6457
 epoch: 67, train_loss: 0.3305, test_loss: 1.0430, test_f1: 0.6411
 epoch: 68, train_loss: 0.3227, test_loss: 1.1150, test_f1: 0.6336
 epoch: 69, train_loss: 0.3565, test_loss: 1.0750, test_f1: 0.6440
 epoch: 70, train_loss: 0.3609, test_loss: 1.0203, test_f1: 0.6589
 epoch: 71, train_loss: 0.3534, test_loss: 1.0391, test_f1: 0.6477
 epoch: 72, train_loss: 0.3435, test_loss: 1.0901, test_f1: 0.6315
 epoch: 73, train_loss: 0.3285, test_loss: 1.0899, test_f1: 0.6423
 epoch: 74, train_loss: 0.3292, test_loss: 1.1309, test_f1: 0.6327
 epoch: 75, train_loss: 0.3148, test_loss: 1.1801, test_f1: 0.6235
 epoch: 76, train_loss: 0.3428, test_loss: 0.9474, test_f1: 0.6650
 epoch: 77, train_loss: 0.3014, test_loss: 1.0132, test_f1: 0.6953
 epoch: 78, train_loss: 0.2985, test_loss: 1.0555, test_f1: 0.6529
 epoch: 79, train_loss: 0.3339, test_loss: 1.1033, test_f1: 0.6638
 epoch: 80, train_loss: 0.3216, test_loss: 0.9808, test_f1: 0.6592
 epoch: 81, train_loss: 0.2971, test_loss: 1.0182, test_f1: 0.6627
 epoch: 82, train_loss: 0.2945, test_loss: 1.0585, test_f1: 0.6820
 epoch: 83, train_loss: 0.2847, test_loss: 1.0715, test_f1: 0.6411
 epoch: 84, train_loss: 0.2875, test_loss: 1.0956, test_f1: 0.6326
 epoch: 85, train_loss: 0.2762, test_loss: 1.1414, test_f1: 0.6730
 epoch: 86, train_loss: 0.2866, test_loss: 1.0282, test_f1: 0.6877
 epoch: 87, train_loss: 0.2837, test_loss: 1.2302, test_f1: 0.6233
 epoch: 88, train_loss: 0.2745, test_loss: 1.1933, test_f1: 0.6300
 epoch: 89, train_loss: 0.2840, test_loss: 1.2828, test_f1: 0.6481
 epoch: 90, train_loss: 0.2953, test_loss: 1.2263, test_f1: 0.6488
 epoch: 91, train_loss: 0.2611, test_loss: 1.2146, test_f1: 0.6584
 epoch: 92, train_loss: 0.2366, test_loss: 1.1897, test_f1: 0.6781
 epoch: 93, train_loss: 0.2776, test_loss: 1.3314, test_f1: 0.6437
 epoch: 94, train_loss: 0.2756, test_loss: 1.1558, test_f1: 0.6740
 epoch: 95, train_loss: 0.2806, test_loss: 1.1876, test_f1: 0.6304
 epoch: 96, train_loss: 0.2577, test_loss: 1.1662, test_f1: 0.6551
 epoch: 97, train_loss: 0.2484, test_loss: 1.2351, test_f1: 0.6672
 epoch: 98, train_loss: 0.2646, test_loss: 1.3506, test_f1: 0.6304
 epoch: 99, train_loss: 0.2608, test_loss: 1.0965, test_f1: 0.6745
##################ITERATION #1 ****************************************
 epoch: 0, train_loss: 1.2113, test_loss: 1.4396, test_f1: 0.2970
 epoch: 1, train_loss: 1.0441, test_loss: 1.0796, test_f1: 0.3832
 epoch: 2, train_loss: 1.0066, test_loss: 1.0787, test_f1: 0.4308
 epoch: 3, train_loss: 0.9858, test_loss: 1.0687, test_f1: 0.4117
 epoch: 4, train_loss: 0.9763, test_loss: 1.0376, test_f1: 0.4731
 epoch: 5, train_loss: 0.9656, test_loss: 1.1132, test_f1: 0.4860
 epoch: 6, train_loss: 0.9361, test_loss: 1.0412, test_f1: 0.4605
 epoch: 7, train_loss: 0.9264, test_loss: 0.9802, test_f1: 0.5043
 epoch: 8, train_loss: 0.9073, test_loss: 0.9080, test_f1: 0.5379
 epoch: 9, train_loss: 0.8918, test_loss: 1.0341, test_f1: 0.4532
 epoch: 10, train_loss: 0.8743, test_loss: 1.0578, test_f1: 0.5110
 epoch: 11, train_loss: 0.8753, test_loss: 1.2759, test_f1: 0.4479
 epoch: 12, train_loss: 0.8402, test_loss: 1.0932, test_f1: 0.4875
 epoch: 13, train_loss: 0.8403, test_loss: 0.8768, test_f1: 0.5582
 epoch: 14, train_loss: 0.8297, test_loss: 0.8334, test_f1: 0.5527
 epoch: 15, train_loss: 0.8022, test_loss: 0.9876, test_f1: 0.5379
 epoch: 16, train_loss: 0.7865, test_loss: 0.8814, test_f1: 0.5484
 epoch: 17, train_loss: 0.7704, test_loss: 0.8065, test_f1: 0.6321
 epoch: 18, train_loss: 0.7637, test_loss: 0.8808, test_f1: 0.5499
 epoch: 19, train_loss: 0.7540, test_loss: 0.8877, test_f1: 0.6237
 epoch: 20, train_loss: 0.7465, test_loss: 1.1038, test_f1: 0.5246
 epoch: 21, train_loss: 0.7638, test_loss: 0.8577, test_f1: 0.6387
 epoch: 22, train_loss: 0.7285, test_loss: 0.8844, test_f1: 0.6061
 epoch: 23, train_loss: 0.7102, test_loss: 0.8354, test_f1: 0.5915
 epoch: 24, train_loss: 0.6966, test_loss: 0.8021, test_f1: 0.6472
 epoch: 25, train_loss: 0.7014, test_loss: 0.8904, test_f1: 0.6099
 epoch: 26, train_loss: 0.6798, test_loss: 0.8823, test_f1: 0.6471
 epoch: 27, train_loss: 0.6981, test_loss: 2.3974, test_f1: 0.3871
 epoch: 28, train_loss: 0.6690, test_loss: 0.9339, test_f1: 0.6543
 epoch: 29, train_loss: 0.7045, test_loss: 0.9072, test_f1: 0.5760
 epoch: 30, train_loss: 0.6907, test_loss: 0.9772, test_f1: 0.6165
 epoch: 31, train_loss: 0.6778, test_loss: 0.9421, test_f1: 0.6207
 epoch: 32, train_loss: 0.6426, test_loss: 1.0891, test_f1: 0.5498
 epoch: 33, train_loss: 0.6286, test_loss: 1.4945, test_f1: 0.5905
 epoch: 34, train_loss: 0.6483, test_loss: 0.8641, test_f1: 0.6211
 epoch: 35, train_loss: 0.6546, test_loss: 0.9276, test_f1: 0.6218
 epoch: 36, train_loss: 0.6405, test_loss: 0.8516, test_f1: 0.6385
 epoch: 37, train_loss: 0.6004, test_loss: 0.8546, test_f1: 0.6427
 epoch: 38, train_loss: 0.6065, test_loss: 0.8905, test_f1: 0.6521
 epoch: 39, train_loss: 0.6010, test_loss: 1.1686, test_f1: 0.5948
 epoch: 40, train_loss: 0.6222, test_loss: 1.0603, test_f1: 0.6195
 epoch: 41, train_loss: 0.6053, test_loss: 0.9600, test_f1: 0.6389
 epoch: 42, train_loss: 0.5906, test_loss: 0.9400, test_f1: 0.6000
 epoch: 43, train_loss: 0.5802, test_loss: 1.0668, test_f1: 0.6294
 epoch: 44, train_loss: 0.5748, test_loss: 1.2291, test_f1: 0.6180
 epoch: 45, train_loss: 0.5818, test_loss: 0.9329, test_f1: 0.6204
 epoch: 46, train_loss: 0.5696, test_loss: 0.8124, test_f1: 0.6519
 epoch: 47, train_loss: 0.5737, test_loss: 1.1437, test_f1: 0.6472
 epoch: 48, train_loss: 0.5535, test_loss: 0.9981, test_f1: 0.6934
 epoch: 49, train_loss: 0.5145, test_loss: 1.1219, test_f1: 0.6340
 epoch: 50, train_loss: 0.5674, test_loss: 1.0945, test_f1: 0.5990
 epoch: 51, train_loss: 0.5167, test_loss: 0.9438, test_f1: 0.6519
 epoch: 52, train_loss: 0.4720, test_loss: 0.9994, test_f1: 0.6807
 epoch: 53, train_loss: 0.4627, test_loss: 1.2163, test_f1: 0.6677
 epoch: 54, train_loss: 0.4425, test_loss: 1.0757, test_f1: 0.6483
 epoch: 55, train_loss: 0.4486, test_loss: 1.0413, test_f1: 0.6775
 epoch: 56, train_loss: 0.4424, test_loss: 1.0998, test_f1: 0.6587
 epoch: 57, train_loss: 0.4295, test_loss: 1.0778, test_f1: 0.6577
 epoch: 58, train_loss: 0.4085, test_loss: 1.1592, test_f1: 0.6520
 epoch: 59, train_loss: 0.4105, test_loss: 1.1503, test_f1: 0.6557
 epoch: 60, train_loss: 0.4154, test_loss: 1.2027, test_f1: 0.6593
 epoch: 61, train_loss: 0.4063, test_loss: 1.0910, test_f1: 0.6877
 epoch: 62, train_loss: 0.3943, test_loss: 1.2878, test_f1: 0.6746
 epoch: 63, train_loss: 0.4252, test_loss: 1.2249, test_f1: 0.6627
 epoch: 64, train_loss: 0.4178, test_loss: 1.0660, test_f1: 0.6630
 epoch: 65, train_loss: 0.3891, test_loss: 1.1718, test_f1: 0.6537
 epoch: 66, train_loss: 0.3769, test_loss: 1.2351, test_f1: 0.6929
 epoch: 67, train_loss: 0.3996, test_loss: 1.4775, test_f1: 0.6596
 epoch: 68, train_loss: 0.3685, test_loss: 1.4788, test_f1: 0.6720
 epoch: 69, train_loss: 0.3851, test_loss: 1.2183, test_f1: 0.6722
 epoch: 70, train_loss: 0.3645, test_loss: 1.3444, test_f1: 0.6852
 epoch: 71, train_loss: 0.3916, test_loss: 1.3416, test_f1: 0.6555
 epoch: 72, train_loss: 0.3960, test_loss: 1.2678, test_f1: 0.6835
 epoch: 73, train_loss: 0.3723, test_loss: 1.4614, test_f1: 0.6708
 epoch: 74, train_loss: 0.3537, test_loss: 1.5699, test_f1: 0.6764
 epoch: 75, train_loss: 0.3514, test_loss: 1.2583, test_f1: 0.6792
 epoch: 76, train_loss: 0.3485, test_loss: 1.2789, test_f1: 0.6749
 epoch: 77, train_loss: 0.3448, test_loss: 1.4843, test_f1: 0.6877
 epoch: 78, train_loss: 0.3788, test_loss: 1.3095, test_f1: 0.6906
 epoch: 79, train_loss: 0.3577, test_loss: 1.3009, test_f1: 0.6999
 epoch: 80, train_loss: 0.3670, test_loss: 1.4326, test_f1: 0.6645
 epoch: 81, train_loss: 0.3185, test_loss: 1.5695, test_f1: 0.6731
 epoch: 82, train_loss: 0.3334, test_loss: 1.2796, test_f1: 0.6566
 epoch: 83, train_loss: 0.3108, test_loss: 1.4292, test_f1: 0.6798
 epoch: 84, train_loss: 0.3202, test_loss: 1.3515, test_f1: 0.6930
 epoch: 85, train_loss: 0.3120, test_loss: 1.4781, test_f1: 0.6637
 epoch: 86, train_loss: 0.3364, test_loss: 1.4109, test_f1: 0.6643
 epoch: 87, train_loss: 0.3259, test_loss: 1.4467, test_f1: 0.6657
 epoch: 88, train_loss: 0.3026, test_loss: 1.5849, test_f1: 0.6679
 epoch: 89, train_loss: 0.2924, test_loss: 1.7588, test_f1: 0.6888
 epoch: 90, train_loss: 0.3045, test_loss: 1.4751, test_f1: 0.6846
 epoch: 91, train_loss: 0.3281, test_loss: 1.5145, test_f1: 0.6708
 epoch: 92, train_loss: 0.3065, test_loss: 1.5966, test_f1: 0.6802
 epoch: 93, train_loss: 0.3537, test_loss: 1.5520, test_f1: 0.6710
 epoch: 94, train_loss: 0.2946, test_loss: 1.3433, test_f1: 0.6673
 epoch: 95, train_loss: 0.2823, test_loss: 1.5863, test_f1: 0.6811
 epoch: 96, train_loss: 0.3140, test_loss: 1.6716, test_f1: 0.6526
 epoch: 97, train_loss: 0.3111, test_loss: 1.4012, test_f1: 0.6706
 epoch: 98, train_loss: 0.2825, test_loss: 1.5607, test_f1: 0.6470
 epoch: 99, train_loss: 0.3085, test_loss: 1.6116, test_f1: 0.6525
##################ITERATION #2 ****************************************
 epoch: 0, train_loss: 1.2113, test_loss: 1.5969, test_f1: 0.3094
 epoch: 1, train_loss: 1.0057, test_loss: 1.0760, test_f1: 0.4678
 epoch: 2, train_loss: 0.9712, test_loss: 0.9222, test_f1: 0.5211
 epoch: 3, train_loss: 0.9724, test_loss: 0.9490, test_f1: 0.4771
 epoch: 4, train_loss: 0.9378, test_loss: 0.9953, test_f1: 0.5076
 epoch: 5, train_loss: 0.9278, test_loss: 1.0473, test_f1: 0.5001
 epoch: 6, train_loss: 0.9194, test_loss: 0.9756, test_f1: 0.5248
 epoch: 7, train_loss: 0.9149, test_loss: 0.9635, test_f1: 0.5190
 epoch: 8, train_loss: 0.9024, test_loss: 1.0128, test_f1: 0.5068
 epoch: 9, train_loss: 0.8870, test_loss: 0.9736, test_f1: 0.5545
 epoch: 10, train_loss: 0.8696, test_loss: 1.0185, test_f1: 0.5189
 epoch: 11, train_loss: 0.8614, test_loss: 1.0173, test_f1: 0.5063
 epoch: 12, train_loss: 0.8479, test_loss: 0.9640, test_f1: 0.4776
 epoch: 13, train_loss: 0.8280, test_loss: 0.9481, test_f1: 0.5433
 epoch: 14, train_loss: 0.8250, test_loss: 1.0096, test_f1: 0.5518
 epoch: 15, train_loss: 0.8138, test_loss: 1.1785, test_f1: 0.4346
 epoch: 16, train_loss: 0.8129, test_loss: 1.2331, test_f1: 0.5034
 epoch: 17, train_loss: 0.8218, test_loss: 1.1068, test_f1: 0.5246
 epoch: 18, train_loss: 0.7969, test_loss: 0.9563, test_f1: 0.5530
 epoch: 19, train_loss: 0.7584, test_loss: 0.9641, test_f1: 0.5293
 epoch: 20, train_loss: 0.7640, test_loss: 1.0989, test_f1: 0.4922
 epoch: 21, train_loss: 0.7860, test_loss: 1.1391, test_f1: 0.5025
 epoch: 22, train_loss: 0.7818, test_loss: 0.8651, test_f1: 0.5252
 epoch: 23, train_loss: 0.7447, test_loss: 0.9306, test_f1: 0.6101
 epoch: 24, train_loss: 0.7509, test_loss: 0.9107, test_f1: 0.5995
 epoch: 25, train_loss: 0.7319, test_loss: 0.8988, test_f1: 0.5936
 epoch: 26, train_loss: 0.7124, test_loss: 0.8803, test_f1: 0.6102
 epoch: 27, train_loss: 0.7211, test_loss: 1.0945, test_f1: 0.5469
 epoch: 28, train_loss: 0.7333, test_loss: 1.0409, test_f1: 0.6100
 epoch: 29, train_loss: 0.7087, test_loss: 0.9507, test_f1: 0.5943
 epoch: 30, train_loss: 0.6857, test_loss: 0.8964, test_f1: 0.6011
 epoch: 31, train_loss: 0.6832, test_loss: 0.8637, test_f1: 0.5981
 epoch: 32, train_loss: 0.6737, test_loss: 0.9611, test_f1: 0.6421
 epoch: 33, train_loss: 0.6695, test_loss: 0.8507, test_f1: 0.6153
 epoch: 34, train_loss: 0.6462, test_loss: 1.0547, test_f1: 0.6190
 epoch: 35, train_loss: 0.6665, test_loss: 1.2253, test_f1: 0.6114
 epoch: 36, train_loss: 0.6669, test_loss: 1.0067, test_f1: 0.6144
 epoch: 37, train_loss: 0.6550, test_loss: 0.9414, test_f1: 0.6531
 epoch: 38, train_loss: 0.6293, test_loss: 1.0622, test_f1: 0.5894
 epoch: 39, train_loss: 0.6419, test_loss: 1.2296, test_f1: 0.5846
 epoch: 40, train_loss: 0.6248, test_loss: 0.9668, test_f1: 0.6529
 epoch: 41, train_loss: 0.6029, test_loss: 1.1477, test_f1: 0.5997
 epoch: 42, train_loss: 0.6059, test_loss: 1.0133, test_f1: 0.6449
 epoch: 43, train_loss: 0.5941, test_loss: 1.0759, test_f1: 0.6188
 epoch: 44, train_loss: 0.5862, test_loss: 1.0794, test_f1: 0.6018
 epoch: 45, train_loss: 0.5889, test_loss: 0.9962, test_f1: 0.5989
 epoch: 46, train_loss: 0.5808, test_loss: 1.0241, test_f1: 0.6177
 epoch: 47, train_loss: 0.5882, test_loss: 1.1208, test_f1: 0.6524
 epoch: 48, train_loss: 0.5781, test_loss: 0.9505, test_f1: 0.6543
 epoch: 49, train_loss: 0.5754, test_loss: 1.1777, test_f1: 0.5808
 epoch: 50, train_loss: 0.5837, test_loss: 1.1732, test_f1: 0.6510
 epoch: 51, train_loss: 0.5146, test_loss: 1.0650, test_f1: 0.6680
 epoch: 52, train_loss: 0.4879, test_loss: 1.0255, test_f1: 0.6729
 epoch: 53, train_loss: 0.4920, test_loss: 1.0168, test_f1: 0.6480
 epoch: 54, train_loss: 0.4849, test_loss: 1.0738, test_f1: 0.6612
 epoch: 55, train_loss: 0.4501, test_loss: 1.4345, test_f1: 0.6457
 epoch: 56, train_loss: 0.4608, test_loss: 1.1797, test_f1: 0.6455
 epoch: 57, train_loss: 0.4547, test_loss: 1.3211, test_f1: 0.6617
 epoch: 58, train_loss: 0.4335, test_loss: 1.3130, test_f1: 0.6465
 epoch: 59, train_loss: 0.4472, test_loss: 1.2386, test_f1: 0.6412
 epoch: 60, train_loss: 0.4285, test_loss: 1.3143, test_f1: 0.6521
 epoch: 61, train_loss: 0.4298, test_loss: 1.4370, test_f1: 0.6256
 epoch: 62, train_loss: 0.4258, test_loss: 1.3978, test_f1: 0.6330
 epoch: 63, train_loss: 0.4134, test_loss: 1.5333, test_f1: 0.6462
 epoch: 64, train_loss: 0.4092, test_loss: 1.3322, test_f1: 0.6359
 epoch: 65, train_loss: 0.4005, test_loss: 1.3242, test_f1: 0.6572
 epoch: 66, train_loss: 0.3956, test_loss: 1.1704, test_f1: 0.6651
 epoch: 67, train_loss: 0.4277, test_loss: 1.2918, test_f1: 0.6159
 epoch: 68, train_loss: 0.4002, test_loss: 1.4723, test_f1: 0.5962
 epoch: 69, train_loss: 0.4146, test_loss: 1.4326, test_f1: 0.6482
 epoch: 70, train_loss: 0.3957, test_loss: 1.2425, test_f1: 0.6225
 epoch: 71, train_loss: 0.4086, test_loss: 1.5689, test_f1: 0.6266
 epoch: 72, train_loss: 0.4004, test_loss: 1.5032, test_f1: 0.6585
 epoch: 73, train_loss: 0.3873, test_loss: 1.2464, test_f1: 0.6524
 epoch: 74, train_loss: 0.3774, test_loss: 1.3948, test_f1: 0.6251
 epoch: 75, train_loss: 0.3799, test_loss: 1.4551, test_f1: 0.6703
 epoch: 76, train_loss: 0.3930, test_loss: 1.6419, test_f1: 0.6143
 epoch: 77, train_loss: 0.3752, test_loss: 1.5417, test_f1: 0.6512
 epoch: 78, train_loss: 0.3563, test_loss: 1.4075, test_f1: 0.6691
 epoch: 79, train_loss: 0.3480, test_loss: 1.5077, test_f1: 0.6315
 epoch: 80, train_loss: 0.3336, test_loss: 1.5758, test_f1: 0.6466
 epoch: 81, train_loss: 0.3327, test_loss: 1.6557, test_f1: 0.6671
 epoch: 82, train_loss: 0.3453, test_loss: 1.7146, test_f1: 0.6016
 epoch: 83, train_loss: 0.3749, test_loss: 1.4879, test_f1: 0.6582
 epoch: 84, train_loss: 0.3463, test_loss: 1.7160, test_f1: 0.6509
 epoch: 85, train_loss: 0.3337, test_loss: 1.6550, test_f1: 0.6624
 epoch: 86, train_loss: 0.3159, test_loss: 1.5446, test_f1: 0.6859
 epoch: 87, train_loss: 0.3221, test_loss: 1.6112, test_f1: 0.6802
 epoch: 88, train_loss: 0.3250, test_loss: 1.7664, test_f1: 0.6449
 epoch: 89, train_loss: 0.3186, test_loss: 1.6763, test_f1: 0.6439
 epoch: 90, train_loss: 0.3149, test_loss: 1.6533, test_f1: 0.6594
 epoch: 91, train_loss: 0.3099, test_loss: 1.7912, test_f1: 0.6443
 epoch: 92, train_loss: 0.3101, test_loss: 1.6514, test_f1: 0.6566
 epoch: 93, train_loss: 0.3236, test_loss: 1.8197, test_f1: 0.5899
 epoch: 94, train_loss: 0.3067, test_loss: 1.9619, test_f1: 0.6438
 epoch: 95, train_loss: 0.2907, test_loss: 2.2170, test_f1: 0.6392
 epoch: 96, train_loss: 0.3255, test_loss: 1.6205, test_f1: 0.6609
 epoch: 97, train_loss: 0.3069, test_loss: 1.6559, test_f1: 0.6325
 epoch: 98, train_loss: 0.3034, test_loss: 1.5740, test_f1: 0.6475
 epoch: 99, train_loss: 0.3003, test_loss: 1.7073, test_f1: 0.6386
##################ITERATION #3 ****************************************
 epoch: 0, train_loss: 1.2219, test_loss: 1.3271, test_f1: 0.2709
 epoch: 1, train_loss: 1.0718, test_loss: 1.1056, test_f1: 0.4627
 epoch: 2, train_loss: 1.0192, test_loss: 1.1191, test_f1: 0.4387
 epoch: 3, train_loss: 0.9866, test_loss: 1.0056, test_f1: 0.4867
 epoch: 4, train_loss: 0.9821, test_loss: 1.0434, test_f1: 0.4529
 epoch: 5, train_loss: 1.0061, test_loss: 1.0921, test_f1: 0.4597
 epoch: 6, train_loss: 0.9555, test_loss: 1.0090, test_f1: 0.4586
 epoch: 7, train_loss: 0.9290, test_loss: 0.9871, test_f1: 0.4855
 epoch: 8, train_loss: 0.9154, test_loss: 0.9391, test_f1: 0.4890
 epoch: 9, train_loss: 0.8857, test_loss: 0.9369, test_f1: 0.4846
 epoch: 10, train_loss: 0.8756, test_loss: 0.9016, test_f1: 0.5078
 epoch: 11, train_loss: 0.8535, test_loss: 1.1290, test_f1: 0.4664
 epoch: 12, train_loss: 0.8522, test_loss: 0.9395, test_f1: 0.5495
 epoch: 13, train_loss: 0.8449, test_loss: 0.8581, test_f1: 0.5650
 epoch: 14, train_loss: 0.8257, test_loss: 1.0263, test_f1: 0.5456
 epoch: 15, train_loss: 0.8379, test_loss: 0.8776, test_f1: 0.4953
 epoch: 16, train_loss: 0.8089, test_loss: 1.2161, test_f1: 0.5250
 epoch: 17, train_loss: 0.8039, test_loss: 0.9017, test_f1: 0.5445
 epoch: 18, train_loss: 0.8039, test_loss: 1.0200, test_f1: 0.4925
 epoch: 19, train_loss: 0.7957, test_loss: 0.9411, test_f1: 0.5641
 epoch: 20, train_loss: 0.7671, test_loss: 0.9660, test_f1: 0.5449
 epoch: 21, train_loss: 0.7514, test_loss: 0.9747, test_f1: 0.5550
 epoch: 22, train_loss: 0.7680, test_loss: 0.8658, test_f1: 0.5557
 epoch: 23, train_loss: 0.7315, test_loss: 1.1283, test_f1: 0.5476
 epoch: 24, train_loss: 0.7320, test_loss: 0.9820, test_f1: 0.5317
 epoch: 25, train_loss: 0.7306, test_loss: 0.8643, test_f1: 0.5528
 epoch: 26, train_loss: 0.7239, test_loss: 0.9147, test_f1: 0.5726
 epoch: 27, train_loss: 0.7210, test_loss: 0.8139, test_f1: 0.5488
 epoch: 28, train_loss: 0.7093, test_loss: 0.9064, test_f1: 0.6180
 epoch: 29, train_loss: 0.6893, test_loss: 0.8765, test_f1: 0.6326
 epoch: 30, train_loss: 0.7076, test_loss: 0.9144, test_f1: 0.5784
 epoch: 31, train_loss: 0.6706, test_loss: 0.8769, test_f1: 0.5673
 epoch: 32, train_loss: 0.6707, test_loss: 0.9108, test_f1: 0.6545
 epoch: 33, train_loss: 0.6639, test_loss: 0.9541, test_f1: 0.5993
 epoch: 34, train_loss: 0.6693, test_loss: 1.8041, test_f1: 0.3933
 epoch: 35, train_loss: 0.6531, test_loss: 0.9121, test_f1: 0.6346
 epoch: 36, train_loss: 0.6512, test_loss: 0.8832, test_f1: 0.5569
 epoch: 37, train_loss: 0.6542, test_loss: 0.9211, test_f1: 0.6130
 epoch: 38, train_loss: 0.6335, test_loss: 0.9093, test_f1: 0.6111
 epoch: 39, train_loss: 0.6323, test_loss: 0.9774, test_f1: 0.6033
 epoch: 40, train_loss: 0.6169, test_loss: 1.0127, test_f1: 0.5724
 epoch: 41, train_loss: 0.6285, test_loss: 0.9570, test_f1: 0.5736
 epoch: 42, train_loss: 0.5935, test_loss: 0.8959, test_f1: 0.6243
 epoch: 43, train_loss: 0.6114, test_loss: 0.8925, test_f1: 0.6327
 epoch: 44, train_loss: 0.5978, test_loss: 0.9824, test_f1: 0.5883
 epoch: 45, train_loss: 0.6135, test_loss: 0.9243, test_f1: 0.6106
 epoch: 46, train_loss: 0.5970, test_loss: 1.0306, test_f1: 0.5966
 epoch: 47, train_loss: 0.5942, test_loss: 0.9607, test_f1: 0.6203
 epoch: 48, train_loss: 0.5945, test_loss: 0.8640, test_f1: 0.6522
 epoch: 49, train_loss: 0.5662, test_loss: 1.4886, test_f1: 0.5841
 epoch: 50, train_loss: 0.5786, test_loss: 1.0382, test_f1: 0.6109
 epoch: 51, train_loss: 0.5242, test_loss: 0.8119, test_f1: 0.6767
 epoch: 52, train_loss: 0.4876, test_loss: 1.0827, test_f1: 0.6603
 epoch: 53, train_loss: 0.4727, test_loss: 0.8433, test_f1: 0.6643
 epoch: 54, train_loss: 0.4625, test_loss: 1.1892, test_f1: 0.6550
 epoch: 55, train_loss: 0.4724, test_loss: 0.9435, test_f1: 0.6573
 epoch: 56, train_loss: 0.4928, test_loss: 1.1107, test_f1: 0.6430
 epoch: 57, train_loss: 0.4660, test_loss: 0.9706, test_f1: 0.6392
 epoch: 58, train_loss: 0.4334, test_loss: 1.0403, test_f1: 0.6692
 epoch: 59, train_loss: 0.4540, test_loss: 1.0553, test_f1: 0.6586
 epoch: 60, train_loss: 0.4246, test_loss: 1.1602, test_f1: 0.6634
 epoch: 61, train_loss: 0.4493, test_loss: 1.1740, test_f1: 0.6644
 epoch: 62, train_loss: 0.4171, test_loss: 1.2405, test_f1: 0.6541
 epoch: 63, train_loss: 0.4349, test_loss: 0.9159, test_f1: 0.6379
 epoch: 64, train_loss: 0.4282, test_loss: 1.2767, test_f1: 0.6609
 epoch: 65, train_loss: 0.4151, test_loss: 1.1800, test_f1: 0.6417
 epoch: 66, train_loss: 0.4040, test_loss: 1.4764, test_f1: 0.6389
 epoch: 67, train_loss: 0.4020, test_loss: 1.1334, test_f1: 0.6513
 epoch: 68, train_loss: 0.4199, test_loss: 1.2643, test_f1: 0.6469
 epoch: 69, train_loss: 0.3867, test_loss: 1.2732, test_f1: 0.6747
 epoch: 70, train_loss: 0.3898, test_loss: 1.1602, test_f1: 0.6599
 epoch: 71, train_loss: 0.3953, test_loss: 1.6233, test_f1: 0.6801
 epoch: 72, train_loss: 0.4101, test_loss: 1.1758, test_f1: 0.6732
 epoch: 73, train_loss: 0.3915, test_loss: 1.0968, test_f1: 0.6619
 epoch: 74, train_loss: 0.3726, test_loss: 1.3381, test_f1: 0.6453
 epoch: 75, train_loss: 0.3956, test_loss: 1.4158, test_f1: 0.6601
 epoch: 76, train_loss: 0.3906, test_loss: 1.3945, test_f1: 0.6624
 epoch: 77, train_loss: 0.3919, test_loss: 1.2734, test_f1: 0.6238
 epoch: 78, train_loss: 0.3729, test_loss: 1.3898, test_f1: 0.6620
 epoch: 79, train_loss: 0.3636, test_loss: 1.3855, test_f1: 0.6468
 epoch: 80, train_loss: 0.3507, test_loss: 1.5741, test_f1: 0.6721
 epoch: 81, train_loss: 0.3312, test_loss: 1.3624, test_f1: 0.6761
 epoch: 82, train_loss: 0.3747, test_loss: 1.2702, test_f1: 0.6572
 epoch: 83, train_loss: 0.3663, test_loss: 1.4726, test_f1: 0.6452
 epoch: 84, train_loss: 0.3351, test_loss: 1.3646, test_f1: 0.6575
 epoch: 85, train_loss: 0.3348, test_loss: 1.4454, test_f1: 0.6377
 epoch: 86, train_loss: 0.3510, test_loss: 1.7507, test_f1: 0.6623
 epoch: 87, train_loss: 0.3310, test_loss: 1.5291, test_f1: 0.6568
 epoch: 88, train_loss: 0.3270, test_loss: 1.6907, test_f1: 0.6334
 epoch: 89, train_loss: 0.3431, test_loss: 1.5427, test_f1: 0.6433
 epoch: 90, train_loss: 0.3323, test_loss: 1.3404, test_f1: 0.6726
 epoch: 91, train_loss: 0.3202, test_loss: 1.4769, test_f1: 0.6383
 epoch: 92, train_loss: 0.3431, test_loss: 1.8395, test_f1: 0.6496
 epoch: 93, train_loss: 0.3509, test_loss: 1.2225, test_f1: 0.6493
 epoch: 94, train_loss: 0.3545, test_loss: 1.6111, test_f1: 0.6299
 epoch: 95, train_loss: 0.3181, test_loss: 1.5146, test_f1: 0.6608
 epoch: 96, train_loss: 0.2915, test_loss: 1.6769, test_f1: 0.6454
 epoch: 97, train_loss: 0.3113, test_loss: 1.5785, test_f1: 0.6463
 epoch: 98, train_loss: 0.3048, test_loss: 1.7465, test_f1: 0.6445
 epoch: 99, train_loss: 0.3024, test_loss: 1.2952, test_f1: 0.6361
##################ITERATION #4 ****************************************
 epoch: 0, train_loss: 1.2103, test_loss: 1.2637, test_f1: 0.3252
 epoch: 1, train_loss: 0.9887, test_loss: 0.9960, test_f1: 0.4661
 epoch: 2, train_loss: 0.9527, test_loss: 0.9444, test_f1: 0.5108
 epoch: 3, train_loss: 0.9368, test_loss: 0.9273, test_f1: 0.5172
 epoch: 4, train_loss: 0.9070, test_loss: 0.9146, test_f1: 0.4906
 epoch: 5, train_loss: 0.8989, test_loss: 1.0073, test_f1: 0.5004
 epoch: 6, train_loss: 0.9015, test_loss: 0.8781, test_f1: 0.5240
 epoch: 7, train_loss: 0.8713, test_loss: 0.9073, test_f1: 0.5052
 epoch: 8, train_loss: 0.8707, test_loss: 1.0295, test_f1: 0.4975
 epoch: 9, train_loss: 0.8277, test_loss: 0.8468, test_f1: 0.5290
 epoch: 10, train_loss: 0.8384, test_loss: 0.8030, test_f1: 0.5826
 epoch: 11, train_loss: 0.8376, test_loss: 2.5526, test_f1: 0.2965
 epoch: 12, train_loss: 0.8516, test_loss: 0.8475, test_f1: 0.5629
 epoch: 13, train_loss: 0.8160, test_loss: 0.9342, test_f1: 0.5091
 epoch: 14, train_loss: 0.8134, test_loss: 0.8485, test_f1: 0.5792
 epoch: 15, train_loss: 0.8706, test_loss: 0.8786, test_f1: 0.5414
 epoch: 16, train_loss: 0.8242, test_loss: 0.8170, test_f1: 0.5701
 epoch: 17, train_loss: 0.8029, test_loss: 0.9045, test_f1: 0.5659
 epoch: 18, train_loss: 0.7983, test_loss: 0.8635, test_f1: 0.5333
 epoch: 19, train_loss: 0.7682, test_loss: 0.8138, test_f1: 0.5638
 epoch: 20, train_loss: 0.7753, test_loss: 0.7964, test_f1: 0.6531
 epoch: 21, train_loss: 0.7595, test_loss: 0.8369, test_f1: 0.5919
 epoch: 22, train_loss: 0.7348, test_loss: 0.7783, test_f1: 0.5977
 epoch: 23, train_loss: 0.7340, test_loss: 1.0603, test_f1: 0.5438
 epoch: 24, train_loss: 0.7544, test_loss: 0.7911, test_f1: 0.5683
 epoch: 25, train_loss: 0.7242, test_loss: 0.7430, test_f1: 0.6331
 epoch: 26, train_loss: 0.6978, test_loss: 0.7922, test_f1: 0.6319
 epoch: 27, train_loss: 0.6867, test_loss: 0.7741, test_f1: 0.6469
 epoch: 28, train_loss: 0.6915, test_loss: 0.7634, test_f1: 0.6263
 epoch: 29, train_loss: 0.6887, test_loss: 0.8809, test_f1: 0.6471
 epoch: 30, train_loss: 0.6894, test_loss: 0.7738, test_f1: 0.6539
 epoch: 31, train_loss: 0.6566, test_loss: 0.7809, test_f1: 0.6805
 epoch: 32, train_loss: 0.6546, test_loss: 0.8837, test_f1: 0.6173
 epoch: 33, train_loss: 0.6716, test_loss: 0.7917, test_f1: 0.6257
 epoch: 34, train_loss: 0.6531, test_loss: 0.8414, test_f1: 0.6049
 epoch: 35, train_loss: 0.6389, test_loss: 0.8143, test_f1: 0.6668
 epoch: 36, train_loss: 0.6308, test_loss: 0.7348, test_f1: 0.6858
 epoch: 37, train_loss: 0.6397, test_loss: 0.7873, test_f1: 0.6227
 epoch: 38, train_loss: 0.6291, test_loss: 0.7832, test_f1: 0.6389
 epoch: 39, train_loss: 0.6353, test_loss: 0.7620, test_f1: 0.6560
 epoch: 40, train_loss: 0.5985, test_loss: 0.8606, test_f1: 0.6435
 epoch: 41, train_loss: 0.6224, test_loss: 0.8329, test_f1: 0.6396
 epoch: 42, train_loss: 0.6038, test_loss: 0.7194, test_f1: 0.6586
 epoch: 43, train_loss: 0.5981, test_loss: 0.8270, test_f1: 0.6555
 epoch: 44, train_loss: 0.5995, test_loss: 0.8151, test_f1: 0.6034
 epoch: 45, train_loss: 0.5884, test_loss: 0.7596, test_f1: 0.6594
 epoch: 46, train_loss: 0.5740, test_loss: 0.8719, test_f1: 0.6067
 epoch: 47, train_loss: 0.5970, test_loss: 0.7746, test_f1: 0.6458
 epoch: 48, train_loss: 0.6073, test_loss: 1.3535, test_f1: 0.5136
 epoch: 49, train_loss: 0.6022, test_loss: 0.9957, test_f1: 0.6326
 epoch: 50, train_loss: 0.6118, test_loss: 0.7949, test_f1: 0.6631
 epoch: 51, train_loss: 0.5401, test_loss: 0.7675, test_f1: 0.6617
 epoch: 52, train_loss: 0.5147, test_loss: 0.8291, test_f1: 0.6633
 epoch: 53, train_loss: 0.4830, test_loss: 0.7372, test_f1: 0.6900
 epoch: 54, train_loss: 0.4877, test_loss: 0.7738, test_f1: 0.6633
 epoch: 55, train_loss: 0.4634, test_loss: 0.8739, test_f1: 0.6929
 epoch: 56, train_loss: 0.4880, test_loss: 0.8357, test_f1: 0.6518
 epoch: 57, train_loss: 0.4634, test_loss: 2.0602, test_f1: 0.5325
 epoch: 58, train_loss: 0.4436, test_loss: 0.8246, test_f1: 0.6816
 epoch: 59, train_loss: 0.4273, test_loss: 0.7950, test_f1: 0.6692
 epoch: 60, train_loss: 0.4486, test_loss: 0.7985, test_f1: 0.6806
 epoch: 61, train_loss: 0.4363, test_loss: 0.8149, test_f1: 0.6719
 epoch: 62, train_loss: 0.4257, test_loss: 0.7742, test_f1: 0.7060
 epoch: 63, train_loss: 0.4249, test_loss: 0.8419, test_f1: 0.6692
 epoch: 64, train_loss: 0.4278, test_loss: 0.8854, test_f1: 0.6727
 epoch: 65, train_loss: 0.4257, test_loss: 0.9080, test_f1: 0.6624
 epoch: 66, train_loss: 0.4210, test_loss: 0.8809, test_f1: 0.6789
 epoch: 67, train_loss: 0.4050, test_loss: 0.9588, test_f1: 0.6402
 epoch: 68, train_loss: 0.4077, test_loss: 0.8115, test_f1: 0.7062
 epoch: 69, train_loss: 0.3956, test_loss: 0.9613, test_f1: 0.6500
 epoch: 70, train_loss: 0.4095, test_loss: 0.8290, test_f1: 0.6726
 epoch: 71, train_loss: 0.4161, test_loss: 0.8805, test_f1: 0.6822
 epoch: 72, train_loss: 0.4108, test_loss: 0.9029, test_f1: 0.6735
 epoch: 73, train_loss: 0.3801, test_loss: 0.8366, test_f1: 0.6724
 epoch: 74, train_loss: 0.3861, test_loss: 0.8457, test_f1: 0.6790
 epoch: 75, train_loss: 0.3865, test_loss: 0.9405, test_f1: 0.6560
 epoch: 76, train_loss: 0.3881, test_loss: 0.7347, test_f1: 0.7178
 epoch: 77, train_loss: 0.3953, test_loss: 0.8311, test_f1: 0.6827
 epoch: 78, train_loss: 0.3534, test_loss: 0.8809, test_f1: 0.6749
 epoch: 79, train_loss: 0.3645, test_loss: 0.7893, test_f1: 0.7085
 epoch: 80, train_loss: 0.3780, test_loss: 0.7881, test_f1: 0.6831
 epoch: 81, train_loss: 0.3554, test_loss: 0.9099, test_f1: 0.6881
 epoch: 82, train_loss: 0.3555, test_loss: 0.8700, test_f1: 0.6955
 epoch: 83, train_loss: 0.3597, test_loss: 0.9582, test_f1: 0.6633
 epoch: 84, train_loss: 0.3587, test_loss: 0.8488, test_f1: 0.6994
 epoch: 85, train_loss: 0.3519, test_loss: 0.9694, test_f1: 0.6767
 epoch: 86, train_loss: 0.3609, test_loss: 0.8361, test_f1: 0.6916
 epoch: 87, train_loss: 0.3370, test_loss: 0.8470, test_f1: 0.7162
 epoch: 88, train_loss: 0.3369, test_loss: 0.8997, test_f1: 0.7135
 epoch: 89, train_loss: 0.3412, test_loss: 1.0097, test_f1: 0.6749
 epoch: 90, train_loss: 0.3108, test_loss: 1.0361, test_f1: 0.6346
 epoch: 91, train_loss: 0.3428, test_loss: 0.9398, test_f1: 0.6805
 epoch: 92, train_loss: 0.3318, test_loss: 0.8336, test_f1: 0.7097
 epoch: 93, train_loss: 0.3130, test_loss: 1.0721, test_f1: 0.6457
 epoch: 94, train_loss: 0.3430, test_loss: 1.1236, test_f1: 0.6807
 epoch: 95, train_loss: 0.3241, test_loss: 0.8854, test_f1: 0.6911
 epoch: 96, train_loss: 0.2978, test_loss: 1.0197, test_f1: 0.6742
 epoch: 97, train_loss: 0.3182, test_loss: 1.1330, test_f1: 0.6349
 epoch: 98, train_loss: 0.3040, test_loss: 1.0054, test_f1: 0.7034
 epoch: 99, train_loss: 0.2918, test_loss: 0.9473, test_f1: 0.6873
##################ITERATION #5 ****************************************
 epoch: 0, train_loss: 1.3174, test_loss: 1.3928, test_f1: 0.2715
 epoch: 1, train_loss: 0.9995, test_loss: 1.0065, test_f1: 0.4983
 epoch: 2, train_loss: 0.9552, test_loss: 0.9446, test_f1: 0.4874
 epoch: 3, train_loss: 0.9466, test_loss: 1.0150, test_f1: 0.5138
 epoch: 4, train_loss: 0.9360, test_loss: 1.0753, test_f1: 0.5033
 epoch: 5, train_loss: 0.8931, test_loss: 0.8884, test_f1: 0.5775
 epoch: 6, train_loss: 0.8646, test_loss: 0.9248, test_f1: 0.5273
 epoch: 7, train_loss: 0.8461, test_loss: 0.8778, test_f1: 0.5753
 epoch: 8, train_loss: 0.8428, test_loss: 0.8014, test_f1: 0.5822
 epoch: 9, train_loss: 0.8291, test_loss: 0.8195, test_f1: 0.6017
 epoch: 10, train_loss: 0.8103, test_loss: 0.7902, test_f1: 0.5825
 epoch: 11, train_loss: 0.7733, test_loss: 0.8129, test_f1: 0.5914
 epoch: 12, train_loss: 0.7734, test_loss: 0.8157, test_f1: 0.6069
 epoch: 13, train_loss: 0.7638, test_loss: 0.7749, test_f1: 0.5912
 epoch: 14, train_loss: 0.7613, test_loss: 0.7802, test_f1: 0.6058
 epoch: 15, train_loss: 0.7531, test_loss: 0.7844, test_f1: 0.6137
 epoch: 16, train_loss: 0.7403, test_loss: 0.8834, test_f1: 0.5796
 epoch: 17, train_loss: 0.7403, test_loss: 0.7725, test_f1: 0.6135
 epoch: 18, train_loss: 0.7131, test_loss: 0.8246, test_f1: 0.6080
 epoch: 19, train_loss: 0.7331, test_loss: 0.8059, test_f1: 0.5527
 epoch: 20, train_loss: 0.7222, test_loss: 0.8308, test_f1: 0.5815
 epoch: 21, train_loss: 0.6870, test_loss: 0.8558, test_f1: 0.6021
 epoch: 22, train_loss: 0.6940, test_loss: 0.7618, test_f1: 0.6249
 epoch: 23, train_loss: 0.6952, test_loss: 0.8253, test_f1: 0.6209
 epoch: 24, train_loss: 0.6766, test_loss: 0.7571, test_f1: 0.6374
 epoch: 25, train_loss: 0.6635, test_loss: 0.7508, test_f1: 0.6316
 epoch: 26, train_loss: 0.6571, test_loss: 0.9076, test_f1: 0.5786
 epoch: 27, train_loss: 0.6236, test_loss: 0.7363, test_f1: 0.6603
 epoch: 28, train_loss: 0.6396, test_loss: 0.8918, test_f1: 0.6326
 epoch: 29, train_loss: 0.6670, test_loss: 0.7436, test_f1: 0.6282
 epoch: 30, train_loss: 0.6858, test_loss: 0.7169, test_f1: 0.6557
 epoch: 31, train_loss: 0.6124, test_loss: 0.6964, test_f1: 0.6549
 epoch: 32, train_loss: 0.6303, test_loss: 0.8385, test_f1: 0.6010
 epoch: 33, train_loss: 0.6539, test_loss: 0.9347, test_f1: 0.5638
 epoch: 34, train_loss: 0.6223, test_loss: 0.7025, test_f1: 0.6726
 epoch: 35, train_loss: 0.6190, test_loss: 0.8850, test_f1: 0.5867
 epoch: 36, train_loss: 0.6102, test_loss: 0.7993, test_f1: 0.6543
 epoch: 37, train_loss: 0.5911, test_loss: 0.7147, test_f1: 0.6562
 epoch: 38, train_loss: 0.6030, test_loss: 0.7582, test_f1: 0.6467
 epoch: 39, train_loss: 0.6006, test_loss: 0.7624, test_f1: 0.6235
 epoch: 40, train_loss: 0.5746, test_loss: 0.7647, test_f1: 0.6730
 epoch: 41, train_loss: 0.5769, test_loss: 0.8901, test_f1: 0.6366
 epoch: 42, train_loss: 0.5806, test_loss: 0.6900, test_f1: 0.6705
 epoch: 43, train_loss: 0.5755, test_loss: 0.7781, test_f1: 0.6677
 epoch: 44, train_loss: 0.5423, test_loss: 0.9580, test_f1: 0.6266
 epoch: 45, train_loss: 0.5434, test_loss: 0.8417, test_f1: 0.5998
 epoch: 46, train_loss: 0.5470, test_loss: 0.7998, test_f1: 0.6579
 epoch: 47, train_loss: 0.5350, test_loss: 1.2180, test_f1: 0.6093
 epoch: 48, train_loss: 0.5282, test_loss: 0.9172, test_f1: 0.6254
 epoch: 49, train_loss: 0.5192, test_loss: 0.7079, test_f1: 0.6793
 epoch: 50, train_loss: 0.5114, test_loss: 0.8003, test_f1: 0.6678
 epoch: 51, train_loss: 0.4769, test_loss: 0.9260, test_f1: 0.6640
 epoch: 52, train_loss: 0.4473, test_loss: 0.8626, test_f1: 0.6756
 epoch: 53, train_loss: 0.4531, test_loss: 0.9408, test_f1: 0.6655
 epoch: 54, train_loss: 0.4405, test_loss: 0.8297, test_f1: 0.6866
 epoch: 55, train_loss: 0.4080, test_loss: 0.9046, test_f1: 0.6776
 epoch: 56, train_loss: 0.4051, test_loss: 0.8970, test_f1: 0.6488
 epoch: 57, train_loss: 0.4037, test_loss: 0.8772, test_f1: 0.6749
 epoch: 58, train_loss: 0.4017, test_loss: 0.8255, test_f1: 0.6642
 epoch: 59, train_loss: 0.3966, test_loss: 0.7565, test_f1: 0.6769
 epoch: 60, train_loss: 0.4060, test_loss: 0.7963, test_f1: 0.6552
 epoch: 61, train_loss: 0.3945, test_loss: 0.7559, test_f1: 0.6975
 epoch: 62, train_loss: 0.3870, test_loss: 0.8103, test_f1: 0.6760
 epoch: 63, train_loss: 0.4016, test_loss: 0.8756, test_f1: 0.6860
 epoch: 64, train_loss: 0.3743, test_loss: 0.7927, test_f1: 0.7000
 epoch: 65, train_loss: 0.3710, test_loss: 0.8853, test_f1: 0.6663
 epoch: 66, train_loss: 0.3592, test_loss: 1.0406, test_f1: 0.6514
 epoch: 67, train_loss: 0.3567, test_loss: 0.8528, test_f1: 0.6803
 epoch: 68, train_loss: 0.3756, test_loss: 0.8691, test_f1: 0.6660
 epoch: 69, train_loss: 0.3701, test_loss: 0.9993, test_f1: 0.6839
 epoch: 70, train_loss: 0.3759, test_loss: 0.9927, test_f1: 0.6755
 epoch: 71, train_loss: 0.3478, test_loss: 0.9297, test_f1: 0.6511
 epoch: 72, train_loss: 0.3493, test_loss: 0.9465, test_f1: 0.6843
 epoch: 73, train_loss: 0.3407, test_loss: 0.8177, test_f1: 0.6925
 epoch: 74, train_loss: 0.3533, test_loss: 0.9460, test_f1: 0.6824
 epoch: 75, train_loss: 0.3314, test_loss: 1.0433, test_f1: 0.6512
 epoch: 76, train_loss: 0.3446, test_loss: 0.8636, test_f1: 0.6669
 epoch: 77, train_loss: 0.3503, test_loss: 0.8219, test_f1: 0.7011
 epoch: 78, train_loss: 0.3135, test_loss: 0.9551, test_f1: 0.6420
 epoch: 79, train_loss: 0.3374, test_loss: 0.8692, test_f1: 0.6990
 epoch: 80, train_loss: 0.3187, test_loss: 1.1102, test_f1: 0.6649
 epoch: 81, train_loss: 0.3148, test_loss: 0.8524, test_f1: 0.6832
 epoch: 82, train_loss: 0.3252, test_loss: 1.0936, test_f1: 0.6707
 epoch: 83, train_loss: 0.3179, test_loss: 0.8908, test_f1: 0.6706
 epoch: 84, train_loss: 0.2985, test_loss: 0.8910, test_f1: 0.6699
 epoch: 85, train_loss: 0.3120, test_loss: 1.0087, test_f1: 0.6469
 epoch: 86, train_loss: 0.3070, test_loss: 0.9790, test_f1: 0.6533
 epoch: 87, train_loss: 0.3161, test_loss: 0.8584, test_f1: 0.6948
 epoch: 88, train_loss: 0.3111, test_loss: 1.1490, test_f1: 0.6592
 epoch: 89, train_loss: 0.2808, test_loss: 1.0276, test_f1: 0.6827
 epoch: 90, train_loss: 0.2885, test_loss: 1.0261, test_f1: 0.6710
 epoch: 91, train_loss: 0.3043, test_loss: 0.9713, test_f1: 0.6664
 epoch: 92, train_loss: 0.3072, test_loss: 1.0974, test_f1: 0.6206
 epoch: 93, train_loss: 0.3108, test_loss: 0.9819, test_f1: 0.6594
 epoch: 94, train_loss: 0.2766, test_loss: 0.9526, test_f1: 0.7042
 epoch: 95, train_loss: 0.2848, test_loss: 0.9851, test_f1: 0.6955
 epoch: 96, train_loss: 0.2962, test_loss: 1.0755, test_f1: 0.6256
 epoch: 97, train_loss: 0.2677, test_loss: 1.0906, test_f1: 0.6380
 epoch: 98, train_loss: 0.2561, test_loss: 1.0105, test_f1: 0.6747
 epoch: 99, train_loss: 0.2597, test_loss: 1.4428, test_f1: 0.6140
##################ITERATION #6 ****************************************
 epoch: 0, train_loss: 1.2498, test_loss: 1.3598, test_f1: 0.2804
 epoch: 1, train_loss: 1.0235, test_loss: 1.0228, test_f1: 0.4790
 epoch: 2, train_loss: 0.9689, test_loss: 1.0177, test_f1: 0.4807
 epoch: 3, train_loss: 0.9462, test_loss: 1.0258, test_f1: 0.4992
 epoch: 4, train_loss: 0.9152, test_loss: 0.9480, test_f1: 0.5003
 epoch: 5, train_loss: 0.9083, test_loss: 0.9908, test_f1: 0.5245
 epoch: 6, train_loss: 0.8924, test_loss: 0.9542, test_f1: 0.4936
 epoch: 7, train_loss: 0.8636, test_loss: 0.9114, test_f1: 0.5390
 epoch: 8, train_loss: 0.8465, test_loss: 0.9001, test_f1: 0.5776
 epoch: 9, train_loss: 0.8292, test_loss: 0.9311, test_f1: 0.5204
 epoch: 10, train_loss: 0.8181, test_loss: 1.2806, test_f1: 0.4812
 epoch: 11, train_loss: 0.8343, test_loss: 0.8567, test_f1: 0.5729
 epoch: 12, train_loss: 0.7850, test_loss: 0.9789, test_f1: 0.5701
 epoch: 13, train_loss: 0.7945, test_loss: 0.9196, test_f1: 0.5822
 epoch: 14, train_loss: 0.7712, test_loss: 0.9547, test_f1: 0.5859
 epoch: 15, train_loss: 0.7563, test_loss: 0.8428, test_f1: 0.5862
 epoch: 16, train_loss: 0.7509, test_loss: 0.9318, test_f1: 0.5630
 epoch: 17, train_loss: 0.7508, test_loss: 0.8617, test_f1: 0.6344
 epoch: 18, train_loss: 0.7315, test_loss: 0.8591, test_f1: 0.5805
 epoch: 19, train_loss: 0.7256, test_loss: 0.8394, test_f1: 0.6219
 epoch: 20, train_loss: 0.7296, test_loss: 0.8316, test_f1: 0.6145
 epoch: 21, train_loss: 0.7024, test_loss: 0.7706, test_f1: 0.6113
 epoch: 22, train_loss: 0.7002, test_loss: 0.9447, test_f1: 0.5590
 epoch: 23, train_loss: 0.6974, test_loss: 0.7826, test_f1: 0.6420
 epoch: 24, train_loss: 0.6689, test_loss: 0.8743, test_f1: 0.5678
 epoch: 25, train_loss: 0.6709, test_loss: 0.7812, test_f1: 0.6472
 epoch: 26, train_loss: 0.6839, test_loss: 1.0331, test_f1: 0.5602
 epoch: 27, train_loss: 0.6577, test_loss: 0.9878, test_f1: 0.5871
 epoch: 28, train_loss: 0.6604, test_loss: 0.8192, test_f1: 0.6076
 epoch: 29, train_loss: 0.6509, test_loss: 1.0707, test_f1: 0.5685
 epoch: 30, train_loss: 0.6760, test_loss: 0.9295, test_f1: 0.6159
 epoch: 31, train_loss: 0.6388, test_loss: 1.0903, test_f1: 0.5769
 epoch: 32, train_loss: 0.6417, test_loss: 0.9344, test_f1: 0.6218
 epoch: 33, train_loss: 0.5951, test_loss: 0.8871, test_f1: 0.6464
 epoch: 34, train_loss: 0.6048, test_loss: 0.9078, test_f1: 0.6239
 epoch: 35, train_loss: 0.5947, test_loss: 1.1577, test_f1: 0.5891
 epoch: 36, train_loss: 0.6249, test_loss: 0.9913, test_f1: 0.5966
 epoch: 37, train_loss: 0.5959, test_loss: 0.9305, test_f1: 0.6376
 epoch: 38, train_loss: 0.5935, test_loss: 1.1798, test_f1: 0.5816
 epoch: 39, train_loss: 0.6006, test_loss: 1.0450, test_f1: 0.5889
 epoch: 40, train_loss: 0.5996, test_loss: 0.9233, test_f1: 0.6563
 epoch: 41, train_loss: 0.5932, test_loss: 0.9459, test_f1: 0.6291
 epoch: 42, train_loss: 0.5676, test_loss: 1.1772, test_f1: 0.5629
 epoch: 43, train_loss: 0.5846, test_loss: 0.8765, test_f1: 0.6704
 epoch: 44, train_loss: 0.5837, test_loss: 1.0597, test_f1: 0.5844
 epoch: 45, train_loss: 0.5580, test_loss: 0.9765, test_f1: 0.6163
 epoch: 46, train_loss: 0.5203, test_loss: 1.0357, test_f1: 0.6159
 epoch: 47, train_loss: 0.5401, test_loss: 1.0132, test_f1: 0.6611
 epoch: 48, train_loss: 0.5367, test_loss: 0.9636, test_f1: 0.6655
 epoch: 49, train_loss: 0.5027, test_loss: 0.9608, test_f1: 0.6736
 epoch: 50, train_loss: 0.5118, test_loss: 0.9212, test_f1: 0.6572
 epoch: 51, train_loss: 0.4813, test_loss: 0.9573, test_f1: 0.6780
 epoch: 52, train_loss: 0.4629, test_loss: 0.9085, test_f1: 0.6618
 epoch: 53, train_loss: 0.4560, test_loss: 0.8912, test_f1: 0.6823
 epoch: 54, train_loss: 0.4370, test_loss: 0.9411, test_f1: 0.6777
 epoch: 55, train_loss: 0.4252, test_loss: 0.9503, test_f1: 0.6763
 epoch: 56, train_loss: 0.4153, test_loss: 0.9625, test_f1: 0.6904
 epoch: 57, train_loss: 0.4030, test_loss: 0.8946, test_f1: 0.6798
 epoch: 58, train_loss: 0.4096, test_loss: 0.9924, test_f1: 0.6856
 epoch: 59, train_loss: 0.3994, test_loss: 0.9597, test_f1: 0.6598
 epoch: 60, train_loss: 0.3866, test_loss: 1.1065, test_f1: 0.6930
 epoch: 61, train_loss: 0.4006, test_loss: 1.2077, test_f1: 0.6777
 epoch: 62, train_loss: 0.3861, test_loss: 1.1438, test_f1: 0.6829
 epoch: 63, train_loss: 0.3865, test_loss: 1.1340, test_f1: 0.6906
 epoch: 64, train_loss: 0.3695, test_loss: 0.8440, test_f1: 0.6977
 epoch: 65, train_loss: 0.3742, test_loss: 1.1462, test_f1: 0.6653
 epoch: 66, train_loss: 0.3697, test_loss: 1.0650, test_f1: 0.6783
 epoch: 67, train_loss: 0.3584, test_loss: 1.2039, test_f1: 0.6819
 epoch: 68, train_loss: 0.3682, test_loss: 1.1739, test_f1: 0.6776
 epoch: 69, train_loss: 0.3635, test_loss: 1.3314, test_f1: 0.6855
 epoch: 70, train_loss: 0.3677, test_loss: 1.3260, test_f1: 0.6572
 epoch: 71, train_loss: 0.3541, test_loss: 1.1104, test_f1: 0.6684
 epoch: 72, train_loss: 0.3406, test_loss: 1.0307, test_f1: 0.6929
 epoch: 73, train_loss: 0.3432, test_loss: 1.2276, test_f1: 0.6582
 epoch: 74, train_loss: 0.3075, test_loss: 1.3595, test_f1: 0.6846
 epoch: 75, train_loss: 0.3506, test_loss: 1.1150, test_f1: 0.6913
 epoch: 76, train_loss: 0.3462, test_loss: 1.3593, test_f1: 0.6532
 epoch: 77, train_loss: 0.3353, test_loss: 1.2219, test_f1: 0.6692
 epoch: 78, train_loss: 0.3427, test_loss: 1.1082, test_f1: 0.6786
 epoch: 79, train_loss: 0.3493, test_loss: 1.1068, test_f1: 0.6918
 epoch: 80, train_loss: 0.3418, test_loss: 1.2761, test_f1: 0.6723
 epoch: 81, train_loss: 0.3255, test_loss: 1.2036, test_f1: 0.6772
 epoch: 82, train_loss: 0.3174, test_loss: 1.2569, test_f1: 0.6586
 epoch: 83, train_loss: 0.3449, test_loss: 0.9461, test_f1: 0.6928
 epoch: 84, train_loss: 0.3233, test_loss: 1.1551, test_f1: 0.6740
 epoch: 85, train_loss: 0.3242, test_loss: 1.0868, test_f1: 0.6958
 epoch: 86, train_loss: 0.3165, test_loss: 1.3414, test_f1: 0.6751
 epoch: 87, train_loss: 0.3039, test_loss: 1.2170, test_f1: 0.6776
 epoch: 88, train_loss: 0.3124, test_loss: 1.1194, test_f1: 0.6728
 epoch: 89, train_loss: 0.3226, test_loss: 1.1012, test_f1: 0.6346
 epoch: 90, train_loss: 0.2957, test_loss: 1.3924, test_f1: 0.6486
 epoch: 91, train_loss: 0.3253, test_loss: 1.3357, test_f1: 0.6669
 epoch: 92, train_loss: 0.3393, test_loss: 1.2176, test_f1: 0.6660
 epoch: 93, train_loss: 0.2858, test_loss: 1.1763, test_f1: 0.6876
 epoch: 94, train_loss: 0.2787, test_loss: 1.2217, test_f1: 0.6776
 epoch: 95, train_loss: 0.2794, test_loss: 1.2505, test_f1: 0.6844
 epoch: 96, train_loss: 0.2872, test_loss: 1.5864, test_f1: 0.6618
 epoch: 97, train_loss: 0.2805, test_loss: 1.3181, test_f1: 0.6899
 epoch: 98, train_loss: 0.3035, test_loss: 1.1345, test_f1: 0.6485
 epoch: 99, train_loss: 0.2904, test_loss: 1.1513, test_f1: 0.6593
##################ITERATION #7 ****************************************
 epoch: 0, train_loss: 1.3136, test_loss: 1.3024, test_f1: 0.2697
 epoch: 1, train_loss: 0.9878, test_loss: 0.9545, test_f1: 0.4834
 epoch: 2, train_loss: 0.9317, test_loss: 0.9395, test_f1: 0.4862
 epoch: 3, train_loss: 0.9250, test_loss: 0.9741, test_f1: 0.5054
 epoch: 4, train_loss: 0.9075, test_loss: 0.9462, test_f1: 0.5173
 epoch: 5, train_loss: 0.9021, test_loss: 1.0009, test_f1: 0.5110
 epoch: 6, train_loss: 0.8731, test_loss: 0.9425, test_f1: 0.5241
 epoch: 7, train_loss: 0.8808, test_loss: 0.9235, test_f1: 0.4808
 epoch: 8, train_loss: 0.8616, test_loss: 0.9346, test_f1: 0.5269
 epoch: 9, train_loss: 0.8348, test_loss: 0.8731, test_f1: 0.5391
 epoch: 10, train_loss: 0.8334, test_loss: 1.1533, test_f1: 0.5136
 epoch: 11, train_loss: 0.8415, test_loss: 0.8394, test_f1: 0.5625
 epoch: 12, train_loss: 0.8086, test_loss: 0.9193, test_f1: 0.5840
 epoch: 13, train_loss: 0.8039, test_loss: 0.9800, test_f1: 0.5579
 epoch: 14, train_loss: 0.7978, test_loss: 0.9426, test_f1: 0.5474
 epoch: 15, train_loss: 0.7757, test_loss: 0.8482, test_f1: 0.5990
 epoch: 16, train_loss: 0.7524, test_loss: 0.9104, test_f1: 0.5849
 epoch: 17, train_loss: 0.7464, test_loss: 0.8597, test_f1: 0.5793
 epoch: 18, train_loss: 0.7352, test_loss: 0.7839, test_f1: 0.6196
 epoch: 19, train_loss: 0.7390, test_loss: 0.8610, test_f1: 0.6029
 epoch: 20, train_loss: 0.7182, test_loss: 0.9493, test_f1: 0.5519
 epoch: 21, train_loss: 0.7260, test_loss: 0.8833, test_f1: 0.5672
 epoch: 22, train_loss: 0.7480, test_loss: 0.9273, test_f1: 0.5535
 epoch: 23, train_loss: 0.7034, test_loss: 0.9023, test_f1: 0.5236
 epoch: 24, train_loss: 0.6870, test_loss: 0.8297, test_f1: 0.6296
 epoch: 25, train_loss: 0.6873, test_loss: 0.8224, test_f1: 0.6059
 epoch: 26, train_loss: 0.6524, test_loss: 1.1416, test_f1: 0.5993
 epoch: 27, train_loss: 0.6513, test_loss: 0.9225, test_f1: 0.6480
 epoch: 28, train_loss: 0.6503, test_loss: 0.9042, test_f1: 0.6000
 epoch: 29, train_loss: 0.6397, test_loss: 0.7560, test_f1: 0.6375
 epoch: 30, train_loss: 0.6425, test_loss: 0.9344, test_f1: 0.5776
 epoch: 31, train_loss: 0.6347, test_loss: 0.9653, test_f1: 0.6299
 epoch: 32, train_loss: 0.6301, test_loss: 0.9558, test_f1: 0.6024
 epoch: 33, train_loss: 0.6361, test_loss: 0.8927, test_f1: 0.5870
 epoch: 34, train_loss: 0.6202, test_loss: 0.8115, test_f1: 0.6360
 epoch: 35, train_loss: 0.6316, test_loss: 0.7710, test_f1: 0.6326
 epoch: 36, train_loss: 0.6104, test_loss: 0.7394, test_f1: 0.6426
 epoch: 37, train_loss: 0.6221, test_loss: 0.7919, test_f1: 0.6212
 epoch: 38, train_loss: 0.5826, test_loss: 0.7547, test_f1: 0.6233
 epoch: 39, train_loss: 0.5746, test_loss: 0.8575, test_f1: 0.6282
 epoch: 40, train_loss: 0.5596, test_loss: 0.8221, test_f1: 0.6062
 epoch: 41, train_loss: 0.5889, test_loss: 1.0823, test_f1: 0.6076
 epoch: 42, train_loss: 0.5955, test_loss: 0.9179, test_f1: 0.5913
 epoch: 43, train_loss: 0.5444, test_loss: 0.8510, test_f1: 0.6290
 epoch: 44, train_loss: 0.5703, test_loss: 0.8255, test_f1: 0.6541
 epoch: 45, train_loss: 0.5677, test_loss: 0.9433, test_f1: 0.6165
 epoch: 46, train_loss: 0.5359, test_loss: 0.8556, test_f1: 0.6347
 epoch: 47, train_loss: 0.5247, test_loss: 0.9409, test_f1: 0.6274
 epoch: 48, train_loss: 0.5280, test_loss: 0.8938, test_f1: 0.6046
 epoch: 49, train_loss: 0.5096, test_loss: 0.9729, test_f1: 0.6449
 epoch: 50, train_loss: 0.5334, test_loss: 1.0551, test_f1: 0.5894
 epoch: 51, train_loss: 0.4952, test_loss: 0.8830, test_f1: 0.6232
 epoch: 52, train_loss: 0.4780, test_loss: 0.8373, test_f1: 0.6437
 epoch: 53, train_loss: 0.4334, test_loss: 0.9050, test_f1: 0.6488
 epoch: 54, train_loss: 0.4483, test_loss: 0.9679, test_f1: 0.6323
 epoch: 55, train_loss: 0.4459, test_loss: 0.9683, test_f1: 0.6393
 epoch: 56, train_loss: 0.4123, test_loss: 0.8622, test_f1: 0.6482
 epoch: 57, train_loss: 0.3985, test_loss: 0.9807, test_f1: 0.6141
 epoch: 58, train_loss: 0.4105, test_loss: 0.9319, test_f1: 0.6441
 epoch: 59, train_loss: 0.4051, test_loss: 1.0699, test_f1: 0.6282
 epoch: 60, train_loss: 0.3999, test_loss: 1.0163, test_f1: 0.6373
 epoch: 61, train_loss: 0.4058, test_loss: 0.9806, test_f1: 0.6184
 epoch: 62, train_loss: 0.3891, test_loss: 1.2172, test_f1: 0.6103
 epoch: 63, train_loss: 0.3886, test_loss: 0.9204, test_f1: 0.6335
 epoch: 64, train_loss: 0.3977, test_loss: 0.8991, test_f1: 0.6378
 epoch: 65, train_loss: 0.3761, test_loss: 0.9737, test_f1: 0.6340
 epoch: 66, train_loss: 0.3755, test_loss: 1.0740, test_f1: 0.6506
 epoch: 67, train_loss: 0.3735, test_loss: 1.0457, test_f1: 0.6119
 epoch: 68, train_loss: 0.3600, test_loss: 1.0121, test_f1: 0.6360
 epoch: 69, train_loss: 0.3471, test_loss: 1.0992, test_f1: 0.6056
 epoch: 70, train_loss: 0.3786, test_loss: 1.0131, test_f1: 0.6286
 epoch: 71, train_loss: 0.3573, test_loss: 1.1162, test_f1: 0.6253
 epoch: 72, train_loss: 0.3625, test_loss: 1.0177, test_f1: 0.6261
 epoch: 73, train_loss: 0.3659, test_loss: 1.1648, test_f1: 0.6353
 epoch: 74, train_loss: 0.3564, test_loss: 1.0584, test_f1: 0.6602
 epoch: 75, train_loss: 0.3251, test_loss: 1.0767, test_f1: 0.6072
 epoch: 76, train_loss: 0.3428, test_loss: 1.1832, test_f1: 0.6111
 epoch: 77, train_loss: 0.3423, test_loss: 1.2148, test_f1: 0.6213
 epoch: 78, train_loss: 0.3233, test_loss: 1.3231, test_f1: 0.6475
 epoch: 79, train_loss: 0.3241, test_loss: 1.1852, test_f1: 0.6376
 epoch: 80, train_loss: 0.3231, test_loss: 1.2621, test_f1: 0.5901
 epoch: 81, train_loss: 0.3154, test_loss: 1.4920, test_f1: 0.6177
 epoch: 82, train_loss: 0.3273, test_loss: 1.2894, test_f1: 0.6129
 epoch: 83, train_loss: 0.3366, test_loss: 1.2311, test_f1: 0.5956
 epoch: 84, train_loss: 0.3301, test_loss: 1.2595, test_f1: 0.6403
 epoch: 85, train_loss: 0.3222, test_loss: 1.2128, test_f1: 0.6140
 epoch: 86, train_loss: 0.3174, test_loss: 1.2532, test_f1: 0.6517
 epoch: 87, train_loss: 0.3237, test_loss: 1.2350, test_f1: 0.6143
 epoch: 88, train_loss: 0.3022, test_loss: 1.1561, test_f1: 0.6386
 epoch: 89, train_loss: 0.2974, test_loss: 1.3136, test_f1: 0.6552
 epoch: 90, train_loss: 0.3130, test_loss: 1.3134, test_f1: 0.6073
 epoch: 91, train_loss: 0.2877, test_loss: 1.2862, test_f1: 0.5975
 epoch: 92, train_loss: 0.3270, test_loss: 1.2751, test_f1: 0.6101
 epoch: 93, train_loss: 0.2801, test_loss: 1.3116, test_f1: 0.6350
 epoch: 94, train_loss: 0.2901, test_loss: 1.2833, test_f1: 0.6050
 epoch: 95, train_loss: 0.2758, test_loss: 1.3038, test_f1: 0.6266
 epoch: 96, train_loss: 0.2919, test_loss: 1.1595, test_f1: 0.6473
 epoch: 97, train_loss: 0.2813, test_loss: 1.1959, test_f1: 0.6337
 epoch: 98, train_loss: 0.2666, test_loss: 1.0560, test_f1: 0.6317
 epoch: 99, train_loss: 0.2897, test_loss: 1.2746, test_f1: 0.6330
##################ITERATION #8 ****************************************
 epoch: 0, train_loss: 1.4510, test_loss: 1.4916, test_f1: 0.2262
 epoch: 1, train_loss: 1.0191, test_loss: 1.0282, test_f1: 0.4901
 epoch: 2, train_loss: 0.9886, test_loss: 0.9883, test_f1: 0.5024
 epoch: 3, train_loss: 0.9559, test_loss: 0.9339, test_f1: 0.5474
 epoch: 4, train_loss: 0.9287, test_loss: 0.9094, test_f1: 0.5870
 epoch: 5, train_loss: 0.9329, test_loss: 0.9203, test_f1: 0.5523
 epoch: 6, train_loss: 0.9153, test_loss: 0.9415, test_f1: 0.5298
 epoch: 7, train_loss: 0.9039, test_loss: 0.9492, test_f1: 0.5497
 epoch: 8, train_loss: 0.8936, test_loss: 0.9105, test_f1: 0.5630
 epoch: 9, train_loss: 0.8731, test_loss: 1.0032, test_f1: 0.5458
 epoch: 10, train_loss: 0.8811, test_loss: 1.0134, test_f1: 0.5396
 epoch: 11, train_loss: 0.8618, test_loss: 0.8791, test_f1: 0.5413
 epoch: 12, train_loss: 0.8604, test_loss: 0.8883, test_f1: 0.5667
 epoch: 13, train_loss: 0.8449, test_loss: 0.9017, test_f1: 0.5802
 epoch: 14, train_loss: 0.8414, test_loss: 0.9697, test_f1: 0.5000
 epoch: 15, train_loss: 0.8271, test_loss: 0.9382, test_f1: 0.5535
 epoch: 16, train_loss: 0.8091, test_loss: 0.8309, test_f1: 0.5870
 epoch: 17, train_loss: 0.8019, test_loss: 0.7872, test_f1: 0.6041
 epoch: 18, train_loss: 0.7959, test_loss: 0.7927, test_f1: 0.6000
 epoch: 19, train_loss: 0.7897, test_loss: 0.8870, test_f1: 0.5801
 epoch: 20, train_loss: 0.7698, test_loss: 0.7719, test_f1: 0.6117
 epoch: 21, train_loss: 0.7552, test_loss: 0.8136, test_f1: 0.6058
 epoch: 22, train_loss: 0.7588, test_loss: 0.8619, test_f1: 0.5892
 epoch: 23, train_loss: 0.7494, test_loss: 0.7983, test_f1: 0.6081
 epoch: 24, train_loss: 0.7511, test_loss: 0.8706, test_f1: 0.5797
 epoch: 25, train_loss: 0.7456, test_loss: 0.8341, test_f1: 0.6180
 epoch: 26, train_loss: 0.7342, test_loss: 0.8485, test_f1: 0.5936
 epoch: 27, train_loss: 0.7175, test_loss: 0.9142, test_f1: 0.5593
 epoch: 28, train_loss: 0.7253, test_loss: 0.8147, test_f1: 0.6156
 epoch: 29, train_loss: 0.7033, test_loss: 0.9286, test_f1: 0.6244
 epoch: 30, train_loss: 0.6933, test_loss: 0.8184, test_f1: 0.6153
 epoch: 31, train_loss: 0.6879, test_loss: 0.8408, test_f1: 0.6072
 epoch: 32, train_loss: 0.6685, test_loss: 0.9110, test_f1: 0.5344
 epoch: 33, train_loss: 0.6542, test_loss: 0.8726, test_f1: 0.5828
 epoch: 34, train_loss: 0.6630, test_loss: 0.8284, test_f1: 0.6049
 epoch: 35, train_loss: 0.6745, test_loss: 0.9542, test_f1: 0.6235
 epoch: 36, train_loss: 0.6400, test_loss: 0.9392, test_f1: 0.6098
 epoch: 37, train_loss: 0.6589, test_loss: 0.8422, test_f1: 0.5837
 epoch: 38, train_loss: 0.6424, test_loss: 0.7945, test_f1: 0.6379
 epoch: 39, train_loss: 0.6691, test_loss: 0.8007, test_f1: 0.6284
 epoch: 40, train_loss: 0.6123, test_loss: 0.8568, test_f1: 0.6055
 epoch: 41, train_loss: 0.6047, test_loss: 0.8594, test_f1: 0.6163
 epoch: 42, train_loss: 0.6110, test_loss: 0.8115, test_f1: 0.6501
 epoch: 43, train_loss: 0.6055, test_loss: 0.8178, test_f1: 0.6069
 epoch: 44, train_loss: 0.6059, test_loss: 0.7625, test_f1: 0.6416
 epoch: 45, train_loss: 0.6038, test_loss: 0.7224, test_f1: 0.6425
 epoch: 46, train_loss: 0.5672, test_loss: 0.7232, test_f1: 0.6313
 epoch: 47, train_loss: 0.5756, test_loss: 0.8962, test_f1: 0.6136
 epoch: 48, train_loss: 0.5647, test_loss: 0.7948, test_f1: 0.6371
 epoch: 49, train_loss: 0.5744, test_loss: 0.7778, test_f1: 0.6483
 epoch: 50, train_loss: 0.5491, test_loss: 1.2466, test_f1: 0.5094
 epoch: 51, train_loss: 0.5475, test_loss: 0.9679, test_f1: 0.6528
 epoch: 52, train_loss: 0.4786, test_loss: 0.8434, test_f1: 0.6425
 epoch: 53, train_loss: 0.4710, test_loss: 0.8164, test_f1: 0.6707
 epoch: 54, train_loss: 0.4525, test_loss: 0.7932, test_f1: 0.6398
 epoch: 55, train_loss: 0.4657, test_loss: 0.7364, test_f1: 0.6505
 epoch: 56, train_loss: 0.4641, test_loss: 0.8943, test_f1: 0.6343
 epoch: 57, train_loss: 0.4573, test_loss: 0.7597, test_f1: 0.6700
 epoch: 58, train_loss: 0.4613, test_loss: 0.8399, test_f1: 0.6280
 epoch: 59, train_loss: 0.4333, test_loss: 0.9399, test_f1: 0.6245
 epoch: 60, train_loss: 0.4425, test_loss: 0.8736, test_f1: 0.6422
 epoch: 61, train_loss: 0.4218, test_loss: 0.9242, test_f1: 0.6606
 epoch: 62, train_loss: 0.4063, test_loss: 0.8091, test_f1: 0.6524
 epoch: 63, train_loss: 0.4106, test_loss: 1.0274, test_f1: 0.6617
 epoch: 64, train_loss: 0.4035, test_loss: 0.8826, test_f1: 0.6526
 epoch: 65, train_loss: 0.4088, test_loss: 1.1761, test_f1: 0.5872
 epoch: 66, train_loss: 0.4105, test_loss: 0.8564, test_f1: 0.6634
 epoch: 67, train_loss: 0.4250, test_loss: 0.9128, test_f1: 0.6408
 epoch: 68, train_loss: 0.4199, test_loss: 0.9218, test_f1: 0.6533
 epoch: 69, train_loss: 0.4038, test_loss: 0.8554, test_f1: 0.6381
 epoch: 70, train_loss: 0.4009, test_loss: 0.8956, test_f1: 0.6661
 epoch: 71, train_loss: 0.3858, test_loss: 0.9776, test_f1: 0.6381
 epoch: 72, train_loss: 0.4194, test_loss: 0.8429, test_f1: 0.6807
 epoch: 73, train_loss: 0.4082, test_loss: 0.9082, test_f1: 0.6482
 epoch: 74, train_loss: 0.4003, test_loss: 0.8269, test_f1: 0.6635
 epoch: 75, train_loss: 0.3814, test_loss: 1.0080, test_f1: 0.6720
 epoch: 76, train_loss: 0.3739, test_loss: 1.0034, test_f1: 0.6694
 epoch: 77, train_loss: 0.3723, test_loss: 0.9369, test_f1: 0.6795
 epoch: 78, train_loss: 0.3729, test_loss: 0.9637, test_f1: 0.6502
 epoch: 79, train_loss: 0.3785, test_loss: 1.1179, test_f1: 0.6674
 epoch: 80, train_loss: 0.3840, test_loss: 0.9100, test_f1: 0.6585
 epoch: 81, train_loss: 0.3808, test_loss: 0.8721, test_f1: 0.6862
 epoch: 82, train_loss: 0.3661, test_loss: 0.9835, test_f1: 0.6960
 epoch: 83, train_loss: 0.3455, test_loss: 0.9615, test_f1: 0.6496
 epoch: 84, train_loss: 0.3340, test_loss: 1.0194, test_f1: 0.6557
 epoch: 85, train_loss: 0.3544, test_loss: 1.0364, test_f1: 0.6572
 epoch: 86, train_loss: 0.3638, test_loss: 0.9409, test_f1: 0.6730
 epoch: 87, train_loss: 0.3625, test_loss: 0.8925, test_f1: 0.6704
 epoch: 88, train_loss: 0.3474, test_loss: 0.8433, test_f1: 0.6706
 epoch: 89, train_loss: 0.3405, test_loss: 0.9982, test_f1: 0.6579
 epoch: 90, train_loss: 0.3348, test_loss: 1.0401, test_f1: 0.6156
 epoch: 91, train_loss: 0.3630, test_loss: 0.7604, test_f1: 0.7000
 epoch: 92, train_loss: 0.3449, test_loss: 0.8219, test_f1: 0.6725
 epoch: 93, train_loss: 0.3146, test_loss: 1.0081, test_f1: 0.6745
 epoch: 94, train_loss: 0.3162, test_loss: 1.0618, test_f1: 0.6869
 epoch: 95, train_loss: 0.3310, test_loss: 1.0623, test_f1: 0.6634
 epoch: 96, train_loss: 0.3032, test_loss: 1.0048, test_f1: 0.6490
 epoch: 97, train_loss: 0.3221, test_loss: 1.0110, test_f1: 0.6661
 epoch: 98, train_loss: 0.3166, test_loss: 1.1552, test_f1: 0.6580
 epoch: 99, train_loss: 0.3182, test_loss: 0.9462, test_f1: 0.6653
##################ITERATION #9 ****************************************
 epoch: 0, train_loss: 1.3865, test_loss: 1.1435, test_f1: 0.4783
 epoch: 1, train_loss: 1.0076, test_loss: 1.1175, test_f1: 0.4414
 epoch: 2, train_loss: 0.9664, test_loss: 0.9895, test_f1: 0.4846
 epoch: 3, train_loss: 0.9359, test_loss: 1.0473, test_f1: 0.4778
 epoch: 4, train_loss: 0.9134, test_loss: 0.8888, test_f1: 0.5227
 epoch: 5, train_loss: 0.9134, test_loss: 1.0098, test_f1: 0.4940
 epoch: 6, train_loss: 0.9266, test_loss: 1.1460, test_f1: 0.4313
 epoch: 7, train_loss: 0.9210, test_loss: 1.0806, test_f1: 0.5032
 epoch: 8, train_loss: 0.8962, test_loss: 0.9601, test_f1: 0.5289
 epoch: 9, train_loss: 0.8852, test_loss: 0.9067, test_f1: 0.5525
 epoch: 10, train_loss: 0.8675, test_loss: 0.9363, test_f1: 0.5499
 epoch: 11, train_loss: 0.8461, test_loss: 1.0769, test_f1: 0.5160
 epoch: 12, train_loss: 0.8306, test_loss: 0.9248, test_f1: 0.5656
 epoch: 13, train_loss: 0.8241, test_loss: 0.8634, test_f1: 0.5563
 epoch: 14, train_loss: 0.7909, test_loss: 0.8381, test_f1: 0.5706
 epoch: 15, train_loss: 0.7855, test_loss: 0.8935, test_f1: 0.5638
 epoch: 16, train_loss: 0.7785, test_loss: 0.8768, test_f1: 0.5732
 epoch: 17, train_loss: 0.7783, test_loss: 0.9857, test_f1: 0.5295
 epoch: 18, train_loss: 0.7656, test_loss: 0.7762, test_f1: 0.6324
 epoch: 19, train_loss: 0.7649, test_loss: 0.8062, test_f1: 0.6151
 epoch: 20, train_loss: 0.7738, test_loss: 0.8692, test_f1: 0.5862
 epoch: 21, train_loss: 0.7596, test_loss: 0.8350, test_f1: 0.6039
 epoch: 22, train_loss: 0.7421, test_loss: 0.7770, test_f1: 0.6072
 epoch: 23, train_loss: 0.7539, test_loss: 0.9454, test_f1: 0.5395
 epoch: 24, train_loss: 0.7228, test_loss: 0.8159, test_f1: 0.5583
 epoch: 25, train_loss: 0.7159, test_loss: 0.7921, test_f1: 0.6079
 epoch: 26, train_loss: 0.7036, test_loss: 0.9688, test_f1: 0.5835
 epoch: 27, train_loss: 0.7239, test_loss: 0.8990, test_f1: 0.5462
 epoch: 28, train_loss: 0.6976, test_loss: 0.9794, test_f1: 0.5260
 epoch: 29, train_loss: 0.6819, test_loss: 0.7893, test_f1: 0.5948
 epoch: 30, train_loss: 0.7025, test_loss: 0.7615, test_f1: 0.6180
 epoch: 31, train_loss: 0.6580, test_loss: 0.7216, test_f1: 0.6610
 epoch: 32, train_loss: 0.6648, test_loss: 0.7586, test_f1: 0.6175
 epoch: 33, train_loss: 0.6551, test_loss: 0.7969, test_f1: 0.6521
 epoch: 34, train_loss: 0.6883, test_loss: 0.8224, test_f1: 0.6067
 epoch: 35, train_loss: 0.6796, test_loss: 0.7744, test_f1: 0.6065
 epoch: 36, train_loss: 0.6653, test_loss: 0.7784, test_f1: 0.6146
 epoch: 37, train_loss: 0.6325, test_loss: 0.8462, test_f1: 0.6226
 epoch: 38, train_loss: 0.6585, test_loss: 0.7888, test_f1: 0.6302
 epoch: 39, train_loss: 0.6249, test_loss: 0.8037, test_f1: 0.6211
 epoch: 40, train_loss: 0.6018, test_loss: 0.8581, test_f1: 0.5948
 epoch: 41, train_loss: 0.6263, test_loss: 0.8377, test_f1: 0.6233
 epoch: 42, train_loss: 0.6107, test_loss: 0.9254, test_f1: 0.6263
 epoch: 43, train_loss: 0.5832, test_loss: 0.7508, test_f1: 0.6500
 epoch: 44, train_loss: 0.5993, test_loss: 0.7914, test_f1: 0.6185
 epoch: 45, train_loss: 0.6042, test_loss: 0.7559, test_f1: 0.6565
 epoch: 46, train_loss: 0.6112, test_loss: 0.8661, test_f1: 0.6186
 epoch: 47, train_loss: 0.6125, test_loss: 0.8076, test_f1: 0.6222
 epoch: 48, train_loss: 0.5832, test_loss: 0.8344, test_f1: 0.6407
 epoch: 49, train_loss: 0.5713, test_loss: 0.7974, test_f1: 0.6569
 epoch: 50, train_loss: 0.6017, test_loss: 1.1319, test_f1: 0.5482
 epoch: 51, train_loss: 0.5966, test_loss: 0.7452, test_f1: 0.6371
 epoch: 52, train_loss: 0.5812, test_loss: 0.7522, test_f1: 0.6627
 epoch: 53, train_loss: 0.5275, test_loss: 0.7723, test_f1: 0.6407
 epoch: 54, train_loss: 0.5260, test_loss: 0.8643, test_f1: 0.6296
 epoch: 55, train_loss: 0.5083, test_loss: 0.7707, test_f1: 0.6708
 epoch: 56, train_loss: 0.4797, test_loss: 0.9383, test_f1: 0.6380
 epoch: 57, train_loss: 0.5134, test_loss: 0.7735, test_f1: 0.6745
 epoch: 58, train_loss: 0.4877, test_loss: 0.8698, test_f1: 0.6334
 epoch: 59, train_loss: 0.4814, test_loss: 0.7769, test_f1: 0.6504
 epoch: 60, train_loss: 0.4587, test_loss: 0.9327, test_f1: 0.6566
 epoch: 61, train_loss: 0.4707, test_loss: 0.9175, test_f1: 0.6546
 epoch: 62, train_loss: 0.4510, test_loss: 0.8035, test_f1: 0.6613
 epoch: 63, train_loss: 0.4564, test_loss: 0.7540, test_f1: 0.6654
 epoch: 64, train_loss: 0.4451, test_loss: 0.7657, test_f1: 0.6691
 epoch: 65, train_loss: 0.4435, test_loss: 1.0715, test_f1: 0.6300
 epoch: 66, train_loss: 0.4548, test_loss: 0.9264, test_f1: 0.5947
 epoch: 67, train_loss: 0.4503, test_loss: 0.9098, test_f1: 0.6426
 epoch: 68, train_loss: 0.4513, test_loss: 0.8783, test_f1: 0.6809
 epoch: 69, train_loss: 0.4425, test_loss: 0.9769, test_f1: 0.6273
 epoch: 70, train_loss: 0.4460, test_loss: 0.9374, test_f1: 0.6614
 epoch: 71, train_loss: 0.4417, test_loss: 0.8447, test_f1: 0.6815
 epoch: 72, train_loss: 0.4420, test_loss: 0.8238, test_f1: 0.6671
 epoch: 73, train_loss: 0.4179, test_loss: 0.9822, test_f1: 0.6680
 epoch: 74, train_loss: 0.4296, test_loss: 1.0536, test_f1: 0.6509
 epoch: 75, train_loss: 0.4254, test_loss: 0.9315, test_f1: 0.6679
 epoch: 76, train_loss: 0.4369, test_loss: 0.9162, test_f1: 0.6869
 epoch: 77, train_loss: 0.4073, test_loss: 0.9332, test_f1: 0.6415
 epoch: 78, train_loss: 0.4153, test_loss: 1.0446, test_f1: 0.6440
 epoch: 79, train_loss: 0.4158, test_loss: 0.8730, test_f1: 0.6726
 epoch: 80, train_loss: 0.4222, test_loss: 1.0164, test_f1: 0.6694
 epoch: 81, train_loss: 0.4052, test_loss: 1.2322, test_f1: 0.6604
 epoch: 82, train_loss: 0.3827, test_loss: 1.0334, test_f1: 0.6796
 epoch: 83, train_loss: 0.3829, test_loss: 1.1629, test_f1: 0.6379
 epoch: 84, train_loss: 0.3895, test_loss: 1.1640, test_f1: 0.6805
 epoch: 85, train_loss: 0.3940, test_loss: 1.0684, test_f1: 0.6569
 epoch: 86, train_loss: 0.3893, test_loss: 0.9810, test_f1: 0.6701
 epoch: 87, train_loss: 0.4025, test_loss: 1.0575, test_f1: 0.6482
 epoch: 88, train_loss: 0.4095, test_loss: 1.0215, test_f1: 0.6637
 epoch: 89, train_loss: 0.3693, test_loss: 1.2683, test_f1: 0.6469
 epoch: 90, train_loss: 0.3855, test_loss: 0.9472, test_f1: 0.6680
 epoch: 91, train_loss: 0.3630, test_loss: 1.1771, test_f1: 0.6662
 epoch: 92, train_loss: 0.3889, test_loss: 1.0164, test_f1: 0.6572
 epoch: 93, train_loss: 0.3532, test_loss: 1.0396, test_f1: 0.6739
 epoch: 94, train_loss: 0.3620, test_loss: 1.0870, test_f1: 0.6613
 epoch: 95, train_loss: 0.3729, test_loss: 1.1779, test_f1: 0.6528
 epoch: 96, train_loss: 0.3600, test_loss: 1.1125, test_f1: 0.6517
 epoch: 97, train_loss: 0.3459, test_loss: 1.1385, test_f1: 0.6566
 epoch: 98, train_loss: 0.3503, test_loss: 1.2490, test_f1: 0.6610
 epoch: 99, train_loss: 0.3701, test_loss: 1.1507, test_f1: 0.6590

Training completed in 2126.62 seconds
Best F1: 0.7178 at epoch 76
Mean F1 across iterations: 0.6928  0.0148
========================FINAL RESULTS================================
FEGIN weighted F1: 0.7178  0.0148
python main.py --data ltspice_examples --representation component_pin_net --model FEGIN --layers 6 --hiddens 128 --batch_size 128 --lr 0.01 --emb_size 250 --epochs 100 --save_appendix component_pin_net_L6_H128_BS128_LR0.01_E250 --no_val
-----



STDERR:
  File "main.py", line 370, in <module>
    main()
  File "main.py", line 254, in main
    dataset = dataset_class(
  File "/home/philip/projects/llm_inference_code_repo/Circuit-Completion-Using-GNNs/component_classification_with_link_prediction_head/evaluation/FEGIN/kernel/circuit_datasets.py", line 15, in __init__
    self.data, self.slices = torch.load(self.processed_paths[0])
  File "/home/philip/.local/lib/python3.8/site-packages/torch/serialization.py", line 1040, in load
    warnings.warn(
  File "/usr/lib/python3.8/warnings.py", line 109, in _showwarnmsg
    sw(msg.message, msg.category, msg.filename, msg.lineno,
  File "main.py", line 47, in warn_with_traceback
    traceback.print_stack(file=log)
/home/philip/projects/llm_inference_code_repo/Circuit-Completion-Using-GNNs/component_classification_with_link_prediction_head/evaluation/FEGIN/kernel/circuit_datasets.py:15: FutureWarning: You are using `torch.load` with `weights_only=False` (the current default value), which uses the default pickle module implicitly. It is possible to construct malicious pickle data which will execute arbitrary code during unpickling (See https://github.com/pytorch/pytorch/blob/main/SECURITY.md#untrusted-models for more details). In a future release, the default value for `weights_only` will be flipped to `True`. This limits the functions that could be executed during unpickling. Arbitrary objects will no longer be allowed to be loaded via this mode unless they are explicitly allowlisted by the user via `torch.serialization.add_safe_globals`. We recommend you start setting `weights_only=True` for any use case where you don't have full control of the loaded file. Please open an issue on GitHub for any issues related to this experimental feature.
  self.data, self.slices = torch.load(self.processed_paths[0])
