STDOUT:
Results will be saved in /home/philip/projects/ltspice_examples_code_repo/Circuit-Completion-Using-GNNs/component_classification_with_link_prediction_head/evaluation/FEGIN/results/model_FEGIN_dataset_ltspice_demos
Command line input: python main.py --data ltspice_demos --representation component_component --model FEGIN --layers 4 --hiddens 16 --batch_size 32 --lr 0.01 --emb_size 512 --epochs 100 --save_appendix component_component_L4_H16_BS32_LR0.01_E512 --no_val
 is saved.
-----
ltspice_demos - FEGIN
Using 4 layers, 16 hidden units, h = 2
Loading component_component representation dataset
ENTERED
Training FEGIN on component_component representation
Train: 1565, Test: 383
##################ITERATION #0 ****************************************
 epoch: 0, train_loss: 1.2521, test_loss: 1.4013, test_f1: 0.3331
 epoch: 1, train_loss: 1.2001, test_loss: 1.3004, test_f1: 0.3054
 epoch: 2, train_loss: 1.1666, test_loss: 1.2849, test_f1: 0.3762
 epoch: 3, train_loss: 1.1304, test_loss: 1.2718, test_f1: 0.4202
 epoch: 4, train_loss: 1.1076, test_loss: 1.2356, test_f1: 0.3173
 epoch: 5, train_loss: 1.0960, test_loss: 1.3054, test_f1: 0.4118
 epoch: 6, train_loss: 1.0908, test_loss: 1.2489, test_f1: 0.4186
 epoch: 7, train_loss: 1.0510, test_loss: 1.2132, test_f1: 0.3602
 epoch: 8, train_loss: 1.0343, test_loss: 1.2693, test_f1: 0.4722
 epoch: 9, train_loss: 1.0297, test_loss: 1.2656, test_f1: 0.3606
 epoch: 10, train_loss: 0.9769, test_loss: 1.1628, test_f1: 0.4918
 epoch: 11, train_loss: 0.9629, test_loss: 1.0946, test_f1: 0.5011
 epoch: 12, train_loss: 0.9354, test_loss: 1.2501, test_f1: 0.5222
 epoch: 13, train_loss: 0.9243, test_loss: 1.1154, test_f1: 0.5357
 epoch: 14, train_loss: 0.9262, test_loss: 1.2245, test_f1: 0.4671
 epoch: 15, train_loss: 0.9249, test_loss: 1.1134, test_f1: 0.5607
 epoch: 16, train_loss: 0.9054, test_loss: 1.0785, test_f1: 0.5275
 epoch: 17, train_loss: 0.9083, test_loss: 1.0442, test_f1: 0.5757
 epoch: 18, train_loss: 0.8995, test_loss: 1.0706, test_f1: 0.5124
 epoch: 19, train_loss: 0.8882, test_loss: 1.1831, test_f1: 0.4959
 epoch: 20, train_loss: 0.8953, test_loss: 1.0821, test_f1: 0.5312
 epoch: 21, train_loss: 0.9007, test_loss: 1.2755, test_f1: 0.4443
 epoch: 22, train_loss: 0.8821, test_loss: 1.0809, test_f1: 0.5619
 epoch: 23, train_loss: 0.8846, test_loss: 1.0158, test_f1: 0.4340
 epoch: 24, train_loss: 0.8579, test_loss: 1.0734, test_f1: 0.5736
 epoch: 25, train_loss: 0.8734, test_loss: 1.2530, test_f1: 0.5894
 epoch: 26, train_loss: 0.8682, test_loss: 1.0469, test_f1: 0.4222
 epoch: 27, train_loss: 0.8629, test_loss: 1.1909, test_f1: 0.5005
 epoch: 28, train_loss: 0.8587, test_loss: 1.0544, test_f1: 0.5807
 epoch: 29, train_loss: 0.8738, test_loss: 1.1025, test_f1: 0.5644
 epoch: 30, train_loss: 0.8551, test_loss: 1.1118, test_f1: 0.4701
 epoch: 31, train_loss: 0.8726, test_loss: 1.0332, test_f1: 0.5599
 epoch: 32, train_loss: 0.8504, test_loss: 1.2092, test_f1: 0.5369
 epoch: 33, train_loss: 0.8426, test_loss: 1.0403, test_f1: 0.4489
 epoch: 34, train_loss: 0.8516, test_loss: 1.1458, test_f1: 0.5677
 epoch: 35, train_loss: 0.8390, test_loss: 1.1551, test_f1: 0.4407
 epoch: 36, train_loss: 0.8387, test_loss: 1.1505, test_f1: 0.5094
 epoch: 37, train_loss: 0.8340, test_loss: 1.1860, test_f1: 0.5382
 epoch: 38, train_loss: 0.8350, test_loss: 1.1010, test_f1: 0.6070
 epoch: 39, train_loss: 0.8263, test_loss: 1.1743, test_f1: 0.5481
 epoch: 40, train_loss: 0.8506, test_loss: 1.2763, test_f1: 0.5172
 epoch: 41, train_loss: 0.8331, test_loss: 1.1837, test_f1: 0.5354
 epoch: 42, train_loss: 0.8501, test_loss: 1.1370, test_f1: 0.5057
 epoch: 43, train_loss: 0.8337, test_loss: 1.0908, test_f1: 0.5676
 epoch: 44, train_loss: 0.8397, test_loss: 1.0599, test_f1: 0.5609
 epoch: 45, train_loss: 0.8461, test_loss: 1.0914, test_f1: 0.5639
 epoch: 46, train_loss: 0.8472, test_loss: 1.0805, test_f1: 0.5710
 epoch: 47, train_loss: 0.8291, test_loss: 1.2542, test_f1: 0.4695
 epoch: 48, train_loss: 0.8152, test_loss: 1.0686, test_f1: 0.4896
 epoch: 49, train_loss: 0.8292, test_loss: 1.1405, test_f1: 0.4699
 epoch: 50, train_loss: 0.8348, test_loss: 1.1956, test_f1: 0.4676
 epoch: 51, train_loss: 0.8046, test_loss: 1.1662, test_f1: 0.5518
 epoch: 52, train_loss: 0.8171, test_loss: 1.1998, test_f1: 0.5342
 epoch: 53, train_loss: 0.8237, test_loss: 1.2054, test_f1: 0.5385
 epoch: 54, train_loss: 0.7988, test_loss: 1.1172, test_f1: 0.5278
 epoch: 55, train_loss: 0.8025, test_loss: 1.0819, test_f1: 0.5395
 epoch: 56, train_loss: 0.7892, test_loss: 1.1459, test_f1: 0.6107
 epoch: 57, train_loss: 0.8020, test_loss: 1.1282, test_f1: 0.5654
 epoch: 58, train_loss: 0.7888, test_loss: 1.1935, test_f1: 0.5856
 epoch: 59, train_loss: 0.7957, test_loss: 1.2048, test_f1: 0.4780
 epoch: 60, train_loss: 0.7880, test_loss: 1.1979, test_f1: 0.6298
 epoch: 61, train_loss: 0.7834, test_loss: 1.1823, test_f1: 0.5928
 epoch: 62, train_loss: 0.7830, test_loss: 1.1551, test_f1: 0.5845
 epoch: 63, train_loss: 0.7994, test_loss: 1.1712, test_f1: 0.6031
 epoch: 64, train_loss: 0.7801, test_loss: 1.1313, test_f1: 0.5934
 epoch: 65, train_loss: 0.7979, test_loss: 1.0911, test_f1: 0.6138
 epoch: 66, train_loss: 0.8118, test_loss: 1.2452, test_f1: 0.5892
 epoch: 67, train_loss: 0.8023, test_loss: 1.2140, test_f1: 0.5502
 epoch: 68, train_loss: 0.7918, test_loss: 1.1239, test_f1: 0.5958
 epoch: 69, train_loss: 0.7717, test_loss: 1.2170, test_f1: 0.5689
 epoch: 70, train_loss: 0.7781, test_loss: 1.1952, test_f1: 0.6014
 epoch: 71, train_loss: 0.7855, test_loss: 1.1514, test_f1: 0.5680
 epoch: 72, train_loss: 0.7774, test_loss: 1.1774, test_f1: 0.5492
 epoch: 73, train_loss: 0.7783, test_loss: 1.1540, test_f1: 0.6033
 epoch: 74, train_loss: 0.7794, test_loss: 1.1428, test_f1: 0.5884
 epoch: 75, train_loss: 0.7699, test_loss: 1.1202, test_f1: 0.5986
 epoch: 76, train_loss: 0.7750, test_loss: 1.1661, test_f1: 0.6187
 epoch: 77, train_loss: 0.7697, test_loss: 1.1019, test_f1: 0.5965
 epoch: 78, train_loss: 0.7823, test_loss: 1.1260, test_f1: 0.5865
 epoch: 79, train_loss: 0.7784, test_loss: 1.2547, test_f1: 0.5950
 epoch: 80, train_loss: 0.7831, test_loss: 1.1782, test_f1: 0.5900
 epoch: 81, train_loss: 0.7745, test_loss: 1.2740, test_f1: 0.5693
 epoch: 82, train_loss: 0.7743, test_loss: 1.1729, test_f1: 0.5582
 epoch: 83, train_loss: 0.7742, test_loss: 1.1453, test_f1: 0.5533
 epoch: 84, train_loss: 0.7951, test_loss: 1.2180, test_f1: 0.5913
 epoch: 85, train_loss: 0.7659, test_loss: 1.1155, test_f1: 0.5969
 epoch: 86, train_loss: 0.7531, test_loss: 1.1919, test_f1: 0.5611
 epoch: 87, train_loss: 0.7772, test_loss: 1.1798, test_f1: 0.5710
 epoch: 88, train_loss: 0.7553, test_loss: 1.2472, test_f1: 0.6038
 epoch: 89, train_loss: 0.7736, test_loss: 1.1531, test_f1: 0.5965
 epoch: 90, train_loss: 0.7467, test_loss: 1.1900, test_f1: 0.5466
 epoch: 91, train_loss: 0.7584, test_loss: 1.3464, test_f1: 0.5824
 epoch: 92, train_loss: 0.7704, test_loss: 1.1722, test_f1: 0.6118
 epoch: 93, train_loss: 0.7561, test_loss: 1.3260, test_f1: 0.5354
 epoch: 94, train_loss: 0.7533, test_loss: 1.1381, test_f1: 0.6171
 epoch: 95, train_loss: 0.7464, test_loss: 1.2461, test_f1: 0.5752
 epoch: 96, train_loss: 0.7638, test_loss: 1.1752, test_f1: 0.5644
 epoch: 97, train_loss: 0.7636, test_loss: 1.2972, test_f1: 0.5622
 epoch: 98, train_loss: 0.7538, test_loss: 1.2862, test_f1: 0.6061
 epoch: 99, train_loss: 0.7818, test_loss: 1.0942, test_f1: 0.5847
##################ITERATION #1 ****************************************
 epoch: 0, train_loss: 1.2264, test_loss: 1.2624, test_f1: 0.3747
 epoch: 1, train_loss: 1.1632, test_loss: 1.2696, test_f1: 0.3410
 epoch: 2, train_loss: 1.1093, test_loss: 1.2726, test_f1: 0.4128
 epoch: 3, train_loss: 1.0931, test_loss: 1.1941, test_f1: 0.4416
 epoch: 4, train_loss: 1.0674, test_loss: 1.1928, test_f1: 0.3737
 epoch: 5, train_loss: 1.0427, test_loss: 1.1991, test_f1: 0.4956
 epoch: 6, train_loss: 1.0351, test_loss: 1.1347, test_f1: 0.5190
 epoch: 7, train_loss: 1.0237, test_loss: 1.1422, test_f1: 0.4739
 epoch: 8, train_loss: 1.0130, test_loss: 1.1435, test_f1: 0.4479
 epoch: 9, train_loss: 0.9872, test_loss: 1.1079, test_f1: 0.4217
 epoch: 10, train_loss: 0.9269, test_loss: 1.0978, test_f1: 0.4155
 epoch: 11, train_loss: 0.9393, test_loss: 1.0942, test_f1: 0.5180
 epoch: 12, train_loss: 0.9434, test_loss: 1.0245, test_f1: 0.4339
 epoch: 13, train_loss: 0.9335, test_loss: 1.1025, test_f1: 0.5017
 epoch: 14, train_loss: 0.9014, test_loss: 1.0580, test_f1: 0.5306
 epoch: 15, train_loss: 0.9046, test_loss: 1.0416, test_f1: 0.5254
 epoch: 16, train_loss: 0.9116, test_loss: 1.1779, test_f1: 0.4310
 epoch: 17, train_loss: 0.9008, test_loss: 1.1178, test_f1: 0.4824
 epoch: 18, train_loss: 0.8895, test_loss: 1.0260, test_f1: 0.5347
 epoch: 19, train_loss: 0.8789, test_loss: 1.4042, test_f1: 0.5710
 epoch: 20, train_loss: 0.8753, test_loss: 1.0662, test_f1: 0.5469
 epoch: 21, train_loss: 0.8742, test_loss: 1.0751, test_f1: 0.5503
 epoch: 22, train_loss: 0.8932, test_loss: 1.0736, test_f1: 0.4828
 epoch: 23, train_loss: 0.8606, test_loss: 1.1998, test_f1: 0.4519
 epoch: 24, train_loss: 0.9020, test_loss: 1.0421, test_f1: 0.4556
 epoch: 25, train_loss: 0.8752, test_loss: 1.0328, test_f1: 0.5143
 epoch: 26, train_loss: 0.8733, test_loss: 0.9808, test_f1: 0.4450
 epoch: 27, train_loss: 0.8780, test_loss: 1.0773, test_f1: 0.5586
 epoch: 28, train_loss: 0.8645, test_loss: 0.9906, test_f1: 0.5406
 epoch: 29, train_loss: 0.8734, test_loss: 1.0166, test_f1: 0.5490
 epoch: 30, train_loss: 0.8499, test_loss: 1.0221, test_f1: 0.5005
 epoch: 31, train_loss: 0.8531, test_loss: 1.1083, test_f1: 0.5542
 epoch: 32, train_loss: 0.8569, test_loss: 1.0419, test_f1: 0.5345
 epoch: 33, train_loss: 0.8650, test_loss: 1.0892, test_f1: 0.5010
 epoch: 34, train_loss: 0.8778, test_loss: 1.0964, test_f1: 0.4491
 epoch: 35, train_loss: 0.8694, test_loss: 1.0290, test_f1: 0.5414
 epoch: 36, train_loss: 0.8526, test_loss: 1.0641, test_f1: 0.4519
 epoch: 37, train_loss: 0.8419, test_loss: 1.0687, test_f1: 0.5179
 epoch: 38, train_loss: 0.8540, test_loss: 1.0844, test_f1: 0.5405
 epoch: 39, train_loss: 0.8537, test_loss: 1.1475, test_f1: 0.5189
 epoch: 40, train_loss: 0.8721, test_loss: 1.1029, test_f1: 0.5385
 epoch: 41, train_loss: 0.8361, test_loss: 1.0853, test_f1: 0.5322
 epoch: 42, train_loss: 0.8298, test_loss: 1.3105, test_f1: 0.5468
 epoch: 43, train_loss: 0.8779, test_loss: 1.0046, test_f1: 0.5590
 epoch: 44, train_loss: 0.8342, test_loss: 1.0320, test_f1: 0.5356
 epoch: 45, train_loss: 0.8450, test_loss: 1.0742, test_f1: 0.5656
 epoch: 46, train_loss: 0.8324, test_loss: 1.1886, test_f1: 0.5328
 epoch: 47, train_loss: 0.8346, test_loss: 1.1301, test_f1: 0.5082
 epoch: 48, train_loss: 0.8272, test_loss: 1.1122, test_f1: 0.4641
 epoch: 49, train_loss: 0.8181, test_loss: 1.2182, test_f1: 0.5244
 epoch: 50, train_loss: 0.8552, test_loss: 1.2118, test_f1: 0.5558
 epoch: 51, train_loss: 0.8111, test_loss: 1.2754, test_f1: 0.5032
 epoch: 52, train_loss: 0.7937, test_loss: 1.1919, test_f1: 0.5068
 epoch: 53, train_loss: 0.7760, test_loss: 1.1283, test_f1: 0.5162
 epoch: 54, train_loss: 0.7842, test_loss: 1.1143, test_f1: 0.5201
 epoch: 55, train_loss: 0.7808, test_loss: 1.2186, test_f1: 0.5127
 epoch: 56, train_loss: 0.7797, test_loss: 1.1718, test_f1: 0.5446
 epoch: 57, train_loss: 0.7646, test_loss: 1.3221, test_f1: 0.5419
 epoch: 58, train_loss: 0.7993, test_loss: 1.4653, test_f1: 0.4904
 epoch: 59, train_loss: 0.7767, test_loss: 1.2088, test_f1: 0.5301
 epoch: 60, train_loss: 0.7862, test_loss: 1.1455, test_f1: 0.5055
 epoch: 61, train_loss: 0.7696, test_loss: 1.1953, test_f1: 0.5426
 epoch: 62, train_loss: 0.7724, test_loss: 1.1500, test_f1: 0.5451
 epoch: 63, train_loss: 0.7597, test_loss: 1.3594, test_f1: 0.5334
 epoch: 64, train_loss: 0.7636, test_loss: 1.1052, test_f1: 0.5645
 epoch: 65, train_loss: 0.7697, test_loss: 1.2415, test_f1: 0.5202
 epoch: 66, train_loss: 0.7605, test_loss: 1.2562, test_f1: 0.5694
 epoch: 67, train_loss: 0.7566, test_loss: 1.1191, test_f1: 0.5608
 epoch: 68, train_loss: 0.7540, test_loss: 1.1534, test_f1: 0.5158
 epoch: 69, train_loss: 0.7573, test_loss: 1.2285, test_f1: 0.5496
 epoch: 70, train_loss: 0.7571, test_loss: 1.2267, test_f1: 0.5131
 epoch: 71, train_loss: 0.7526, test_loss: 1.3011, test_f1: 0.4900
 epoch: 72, train_loss: 0.7756, test_loss: 1.3093, test_f1: 0.4813
 epoch: 73, train_loss: 0.7592, test_loss: 1.3045, test_f1: 0.5092
 epoch: 74, train_loss: 0.7518, test_loss: 1.1063, test_f1: 0.5390
 epoch: 75, train_loss: 0.7714, test_loss: 1.1731, test_f1: 0.5163
 epoch: 76, train_loss: 0.7475, test_loss: 1.1404, test_f1: 0.5181
 epoch: 77, train_loss: 0.7562, test_loss: 1.1308, test_f1: 0.5416
 epoch: 78, train_loss: 0.7482, test_loss: 1.2276, test_f1: 0.5261
 epoch: 79, train_loss: 0.7605, test_loss: 1.1545, test_f1: 0.5190
 epoch: 80, train_loss: 0.7412, test_loss: 1.2246, test_f1: 0.5404
 epoch: 81, train_loss: 0.7629, test_loss: 1.1250, test_f1: 0.5593
 epoch: 82, train_loss: 0.7582, test_loss: 1.1608, test_f1: 0.5155
 epoch: 83, train_loss: 0.7402, test_loss: 1.1568, test_f1: 0.5460
 epoch: 84, train_loss: 0.7581, test_loss: 1.1863, test_f1: 0.5420
 epoch: 85, train_loss: 0.7427, test_loss: 1.2545, test_f1: 0.5266
 epoch: 86, train_loss: 0.7339, test_loss: 1.2847, test_f1: 0.5428
 epoch: 87, train_loss: 0.7528, test_loss: 1.1268, test_f1: 0.5780
 epoch: 88, train_loss: 0.7665, test_loss: 1.1506, test_f1: 0.4938
 epoch: 89, train_loss: 0.7277, test_loss: 1.3252, test_f1: 0.4882
 epoch: 90, train_loss: 0.7339, test_loss: 1.1886, test_f1: 0.5038
 epoch: 91, train_loss: 0.7218, test_loss: 1.1466, test_f1: 0.5819
 epoch: 92, train_loss: 0.7479, test_loss: 1.2987, test_f1: 0.5313
 epoch: 93, train_loss: 0.7502, test_loss: 1.1646, test_f1: 0.5798
 epoch: 94, train_loss: 0.7585, test_loss: 1.2553, test_f1: 0.5139
 epoch: 95, train_loss: 0.7556, test_loss: 1.5642, test_f1: 0.5423
 epoch: 96, train_loss: 0.7432, test_loss: 1.2451, test_f1: 0.5582
 epoch: 97, train_loss: 0.7345, test_loss: 1.1772, test_f1: 0.5590
 epoch: 98, train_loss: 0.7530, test_loss: 1.2092, test_f1: 0.5687
 epoch: 99, train_loss: 0.7335, test_loss: 1.2093, test_f1: 0.5619
##################ITERATION #2 ****************************************
 epoch: 0, train_loss: 1.2516, test_loss: 1.2975, test_f1: 0.2910
 epoch: 1, train_loss: 1.2142, test_loss: 1.2482, test_f1: 0.3244
 epoch: 2, train_loss: 1.1743, test_loss: 1.2406, test_f1: 0.3782
 epoch: 3, train_loss: 1.1437, test_loss: 1.3134, test_f1: 0.3842
 epoch: 4, train_loss: 1.1342, test_loss: 1.2258, test_f1: 0.3430
 epoch: 5, train_loss: 1.1129, test_loss: 1.1853, test_f1: 0.4188
 epoch: 6, train_loss: 1.0936, test_loss: 1.2704, test_f1: 0.4058
 epoch: 7, train_loss: 1.0949, test_loss: 1.2048, test_f1: 0.4046
 epoch: 8, train_loss: 1.0612, test_loss: 1.2250, test_f1: 0.3425
 epoch: 9, train_loss: 1.0624, test_loss: 1.1923, test_f1: 0.3192
 epoch: 10, train_loss: 1.0697, test_loss: 1.2169, test_f1: 0.4136
 epoch: 11, train_loss: 1.0426, test_loss: 1.1834, test_f1: 0.3822
 epoch: 12, train_loss: 1.0244, test_loss: 1.1810, test_f1: 0.4271
 epoch: 13, train_loss: 0.9870, test_loss: 1.4059, test_f1: 0.3606
 epoch: 14, train_loss: 0.9958, test_loss: 1.1385, test_f1: 0.4722
 epoch: 15, train_loss: 0.9785, test_loss: 1.0571, test_f1: 0.4730
 epoch: 16, train_loss: 0.9477, test_loss: 1.0222, test_f1: 0.4232
 epoch: 17, train_loss: 0.9450, test_loss: 1.0952, test_f1: 0.4534
 epoch: 18, train_loss: 0.9251, test_loss: 1.1132, test_f1: 0.3717
 epoch: 19, train_loss: 0.9026, test_loss: 1.1478, test_f1: 0.5600
 epoch: 20, train_loss: 0.9170, test_loss: 1.2147, test_f1: 0.5185
 epoch: 21, train_loss: 0.8894, test_loss: 1.2562, test_f1: 0.5269
 epoch: 22, train_loss: 0.8986, test_loss: 1.1365, test_f1: 0.4085
 epoch: 23, train_loss: 0.8920, test_loss: 1.1430, test_f1: 0.4337
 epoch: 24, train_loss: 0.8871, test_loss: 1.2731, test_f1: 0.4389
 epoch: 25, train_loss: 0.8897, test_loss: 1.5014, test_f1: 0.5608
 epoch: 26, train_loss: 0.8704, test_loss: 1.9991, test_f1: 0.5274
 epoch: 27, train_loss: 0.8702, test_loss: 1.5435, test_f1: 0.5669
 epoch: 28, train_loss: 0.8370, test_loss: 1.2109, test_f1: 0.5409
 epoch: 29, train_loss: 0.8478, test_loss: 1.0842, test_f1: 0.5565
 epoch: 30, train_loss: 0.8648, test_loss: 1.0610, test_f1: 0.5262
 epoch: 31, train_loss: 0.8507, test_loss: 1.1066, test_f1: 0.5157
 epoch: 32, train_loss: 0.8788, test_loss: 1.0853, test_f1: 0.5302
 epoch: 33, train_loss: 0.8521, test_loss: 1.0534, test_f1: 0.5379
 epoch: 34, train_loss: 0.8519, test_loss: 1.0697, test_f1: 0.4929
 epoch: 35, train_loss: 0.8271, test_loss: 1.1214, test_f1: 0.3946
 epoch: 36, train_loss: 0.8667, test_loss: 1.1262, test_f1: 0.5375
 epoch: 37, train_loss: 0.8528, test_loss: 1.3661, test_f1: 0.4998
 epoch: 38, train_loss: 0.8369, test_loss: 1.0868, test_f1: 0.5374
 epoch: 39, train_loss: 0.8590, test_loss: 1.1867, test_f1: 0.4781
 epoch: 40, train_loss: 0.8533, test_loss: 1.1950, test_f1: 0.5601
 epoch: 41, train_loss: 0.8335, test_loss: 1.0244, test_f1: 0.5243
 epoch: 42, train_loss: 0.8248, test_loss: 1.0826, test_f1: 0.5112
 epoch: 43, train_loss: 0.8187, test_loss: 1.1227, test_f1: 0.5416
 epoch: 44, train_loss: 0.8184, test_loss: 1.1128, test_f1: 0.5038
 epoch: 45, train_loss: 0.8367, test_loss: 1.1036, test_f1: 0.5547
 epoch: 46, train_loss: 0.8116, test_loss: 1.0245, test_f1: 0.5708
 epoch: 47, train_loss: 0.8409, test_loss: 1.0771, test_f1: 0.4738
 epoch: 48, train_loss: 0.8188, test_loss: 1.1044, test_f1: 0.5220
 epoch: 49, train_loss: 0.8198, test_loss: 1.1911, test_f1: 0.4966
 epoch: 50, train_loss: 0.8104, test_loss: 1.1339, test_f1: 0.4792
 epoch: 51, train_loss: 0.8077, test_loss: 1.1816, test_f1: 0.4736
 epoch: 52, train_loss: 0.7888, test_loss: 1.0927, test_f1: 0.5579
 epoch: 53, train_loss: 0.7920, test_loss: 1.1241, test_f1: 0.5491
 epoch: 54, train_loss: 0.7839, test_loss: 1.1317, test_f1: 0.5691
 epoch: 55, train_loss: 0.7785, test_loss: 1.1680, test_f1: 0.4789
 epoch: 56, train_loss: 0.7749, test_loss: 1.1090, test_f1: 0.5949
 epoch: 57, train_loss: 0.7935, test_loss: 1.0589, test_f1: 0.5561
 epoch: 58, train_loss: 0.7758, test_loss: 1.1557, test_f1: 0.5432
 epoch: 59, train_loss: 0.7814, test_loss: 1.1131, test_f1: 0.5726
 epoch: 60, train_loss: 0.7736, test_loss: 1.0685, test_f1: 0.5731
 epoch: 61, train_loss: 0.7774, test_loss: 1.1657, test_f1: 0.5550
 epoch: 62, train_loss: 0.7761, test_loss: 1.1704, test_f1: 0.5287
 epoch: 63, train_loss: 0.7993, test_loss: 1.1388, test_f1: 0.5348
 epoch: 64, train_loss: 0.7717, test_loss: 1.1234, test_f1: 0.5231
 epoch: 65, train_loss: 0.7697, test_loss: 1.1619, test_f1: 0.5180
 epoch: 66, train_loss: 0.7665, test_loss: 1.1956, test_f1: 0.4991
 epoch: 67, train_loss: 0.7693, test_loss: 1.1483, test_f1: 0.5886
 epoch: 68, train_loss: 0.7703, test_loss: 1.1408, test_f1: 0.5445
 epoch: 69, train_loss: 0.7781, test_loss: 1.1778, test_f1: 0.5655
 epoch: 70, train_loss: 0.7631, test_loss: 1.1271, test_f1: 0.5888
 epoch: 71, train_loss: 0.7764, test_loss: 1.0986, test_f1: 0.5560
 epoch: 72, train_loss: 0.7523, test_loss: 1.0936, test_f1: 0.5661
 epoch: 73, train_loss: 0.7438, test_loss: 1.1545, test_f1: 0.5840
 epoch: 74, train_loss: 0.7682, test_loss: 1.1473, test_f1: 0.5445
 epoch: 75, train_loss: 0.7593, test_loss: 1.1940, test_f1: 0.5622
 epoch: 76, train_loss: 0.7460, test_loss: 1.0884, test_f1: 0.5630
 epoch: 77, train_loss: 0.7445, test_loss: 1.1817, test_f1: 0.5996
 epoch: 78, train_loss: 0.7494, test_loss: 1.2650, test_f1: 0.5255
 epoch: 79, train_loss: 0.7779, test_loss: 1.2503, test_f1: 0.5162
 epoch: 80, train_loss: 0.7491, test_loss: 1.0912, test_f1: 0.5585
 epoch: 81, train_loss: 0.7493, test_loss: 1.1755, test_f1: 0.5551
 epoch: 82, train_loss: 0.7507, test_loss: 1.1424, test_f1: 0.5117
 epoch: 83, train_loss: 0.7439, test_loss: 1.0574, test_f1: 0.5502
 epoch: 84, train_loss: 0.7591, test_loss: 1.1138, test_f1: 0.5630
 epoch: 85, train_loss: 0.7381, test_loss: 1.0766, test_f1: 0.5473
 epoch: 86, train_loss: 0.7461, test_loss: 1.0988, test_f1: 0.5785
 epoch: 87, train_loss: 0.7473, test_loss: 1.0996, test_f1: 0.5472
 epoch: 88, train_loss: 0.7702, test_loss: 1.1255, test_f1: 0.5529
 epoch: 89, train_loss: 0.7418, test_loss: 1.1831, test_f1: 0.5553
 epoch: 90, train_loss: 0.7541, test_loss: 1.1192, test_f1: 0.5631
 epoch: 91, train_loss: 0.7193, test_loss: 1.1023, test_f1: 0.5784
 epoch: 92, train_loss: 0.7361, test_loss: 1.0556, test_f1: 0.5734
 epoch: 93, train_loss: 0.7294, test_loss: 1.2561, test_f1: 0.5484
 epoch: 94, train_loss: 0.7261, test_loss: 1.1532, test_f1: 0.5444
 epoch: 95, train_loss: 0.7565, test_loss: 1.0963, test_f1: 0.5274
 epoch: 96, train_loss: 0.7376, test_loss: 1.1511, test_f1: 0.5362
 epoch: 97, train_loss: 0.7630, test_loss: 1.0834, test_f1: 0.5485
 epoch: 98, train_loss: 0.7341, test_loss: 1.0714, test_f1: 0.5934
 epoch: 99, train_loss: 0.7327, test_loss: 1.1151, test_f1: 0.5899
##################ITERATION #3 ****************************************
 epoch: 0, train_loss: 1.2458, test_loss: 1.2896, test_f1: 0.3412
 epoch: 1, train_loss: 1.1865, test_loss: 1.2876, test_f1: 0.3512
 epoch: 2, train_loss: 1.1348, test_loss: 1.2186, test_f1: 0.3657
 epoch: 3, train_loss: 1.1108, test_loss: 1.3596, test_f1: 0.3318
 epoch: 4, train_loss: 1.1507, test_loss: 1.2090, test_f1: 0.3971
 epoch: 5, train_loss: 1.1047, test_loss: 1.2247, test_f1: 0.3765
 epoch: 6, train_loss: 1.1054, test_loss: 1.1747, test_f1: 0.4372
 epoch: 7, train_loss: 1.0766, test_loss: 1.1548, test_f1: 0.4022
 epoch: 8, train_loss: 1.0678, test_loss: 1.2281, test_f1: 0.4142
 epoch: 9, train_loss: 1.0703, test_loss: 1.1931, test_f1: 0.4804
 epoch: 10, train_loss: 1.0321, test_loss: 1.1687, test_f1: 0.3876
 epoch: 11, train_loss: 1.0225, test_loss: 1.1938, test_f1: 0.4657
 epoch: 12, train_loss: 1.0599, test_loss: 1.2003, test_f1: 0.4236
 epoch: 13, train_loss: 1.0037, test_loss: 1.3336, test_f1: 0.3576
 epoch: 14, train_loss: 1.0323, test_loss: 1.1392, test_f1: 0.4663
 epoch: 15, train_loss: 1.0270, test_loss: 1.2976, test_f1: 0.4231
 epoch: 16, train_loss: 1.0225, test_loss: 1.1763, test_f1: 0.4230
 epoch: 17, train_loss: 1.0003, test_loss: 1.1423, test_f1: 0.4721
 epoch: 18, train_loss: 0.9679, test_loss: 1.2490, test_f1: 0.4213
 epoch: 19, train_loss: 0.9803, test_loss: 1.0745, test_f1: 0.5352
 epoch: 20, train_loss: 0.9706, test_loss: 1.0805, test_f1: 0.5154
 epoch: 21, train_loss: 0.9771, test_loss: 1.1636, test_f1: 0.4875
 epoch: 22, train_loss: 0.9972, test_loss: 1.2152, test_f1: 0.4330
 epoch: 23, train_loss: 1.0141, test_loss: 1.1290, test_f1: 0.4970
 epoch: 24, train_loss: 0.9757, test_loss: 1.0794, test_f1: 0.4415
 epoch: 25, train_loss: 0.9342, test_loss: 1.0952, test_f1: 0.4286
 epoch: 26, train_loss: 0.9584, test_loss: 1.3344, test_f1: 0.3987
 epoch: 27, train_loss: 0.9577, test_loss: 1.0846, test_f1: 0.5169
 epoch: 28, train_loss: 0.9367, test_loss: 1.1722, test_f1: 0.4201
 epoch: 29, train_loss: 0.9567, test_loss: 1.1077, test_f1: 0.4090
 epoch: 30, train_loss: 0.9478, test_loss: 1.0653, test_f1: 0.5261
 epoch: 31, train_loss: 0.9373, test_loss: 1.0707, test_f1: 0.5181
 epoch: 32, train_loss: 0.9286, test_loss: 1.0499, test_f1: 0.5523
 epoch: 33, train_loss: 0.9214, test_loss: 1.0832, test_f1: 0.4393
 epoch: 34, train_loss: 0.9381, test_loss: 1.0635, test_f1: 0.4261
 epoch: 35, train_loss: 0.9374, test_loss: 1.0196, test_f1: 0.5365
 epoch: 36, train_loss: 0.9369, test_loss: 1.0172, test_f1: 0.5503
 epoch: 37, train_loss: 0.9339, test_loss: 1.0665, test_f1: 0.5376
 epoch: 38, train_loss: 0.9274, test_loss: 1.0166, test_f1: 0.5228
 epoch: 39, train_loss: 0.9104, test_loss: 1.1082, test_f1: 0.5284
 epoch: 40, train_loss: 0.8974, test_loss: 1.0735, test_f1: 0.5495
 epoch: 41, train_loss: 0.9012, test_loss: 1.0431, test_f1: 0.5029
 epoch: 42, train_loss: 0.9153, test_loss: 1.1697, test_f1: 0.4966
 epoch: 43, train_loss: 0.9094, test_loss: 1.0596, test_f1: 0.5331
 epoch: 44, train_loss: 0.8886, test_loss: 1.0558, test_f1: 0.5663
 epoch: 45, train_loss: 0.8892, test_loss: 1.0425, test_f1: 0.5241
 epoch: 46, train_loss: 0.8905, test_loss: 1.1388, test_f1: 0.4915
 epoch: 47, train_loss: 0.9234, test_loss: 1.0918, test_f1: 0.5394
 epoch: 48, train_loss: 0.8998, test_loss: 1.0193, test_f1: 0.5403
 epoch: 49, train_loss: 0.8919, test_loss: 1.1747, test_f1: 0.4543
 epoch: 50, train_loss: 0.8833, test_loss: 1.0643, test_f1: 0.5459
 epoch: 51, train_loss: 0.8775, test_loss: 1.1034, test_f1: 0.4943
 epoch: 52, train_loss: 0.8678, test_loss: 1.0256, test_f1: 0.5442
 epoch: 53, train_loss: 0.8738, test_loss: 1.0624, test_f1: 0.5415
 epoch: 54, train_loss: 0.8680, test_loss: 1.0831, test_f1: 0.5510
 epoch: 55, train_loss: 0.8549, test_loss: 1.0662, test_f1: 0.5453
 epoch: 56, train_loss: 0.8452, test_loss: 1.1468, test_f1: 0.5268
 epoch: 57, train_loss: 0.8459, test_loss: 1.0567, test_f1: 0.5655
 epoch: 58, train_loss: 0.8449, test_loss: 1.1421, test_f1: 0.5214
 epoch: 59, train_loss: 0.8406, test_loss: 1.1432, test_f1: 0.5236
 epoch: 60, train_loss: 0.8582, test_loss: 1.0850, test_f1: 0.5372
 epoch: 61, train_loss: 0.8557, test_loss: 1.0952, test_f1: 0.5688
 epoch: 62, train_loss: 0.8244, test_loss: 1.1031, test_f1: 0.5438
 epoch: 63, train_loss: 0.8500, test_loss: 1.1193, test_f1: 0.5249
 epoch: 64, train_loss: 0.8400, test_loss: 1.1377, test_f1: 0.4926
 epoch: 65, train_loss: 0.8272, test_loss: 1.2912, test_f1: 0.4822
 epoch: 66, train_loss: 0.8542, test_loss: 1.1009, test_f1: 0.5294
 epoch: 67, train_loss: 0.8535, test_loss: 1.1066, test_f1: 0.5280
 epoch: 68, train_loss: 0.8817, test_loss: 1.0649, test_f1: 0.5341
 epoch: 69, train_loss: 0.8480, test_loss: 1.1493, test_f1: 0.5241
 epoch: 70, train_loss: 0.8502, test_loss: 1.1853, test_f1: 0.5689
 epoch: 71, train_loss: 0.8202, test_loss: 1.1846, test_f1: 0.5496
 epoch: 72, train_loss: 0.8406, test_loss: 1.2298, test_f1: 0.5498
 epoch: 73, train_loss: 0.8374, test_loss: 1.1712, test_f1: 0.5414
 epoch: 74, train_loss: 0.8707, test_loss: 1.0928, test_f1: 0.5159
 epoch: 75, train_loss: 0.8284, test_loss: 1.1265, test_f1: 0.5411
 epoch: 76, train_loss: 0.8447, test_loss: 1.1292, test_f1: 0.5485
 epoch: 77, train_loss: 0.8276, test_loss: 1.1417, test_f1: 0.5184
 epoch: 78, train_loss: 0.8373, test_loss: 1.1347, test_f1: 0.5384
 epoch: 79, train_loss: 0.8277, test_loss: 1.1488, test_f1: 0.5006
 epoch: 80, train_loss: 0.8223, test_loss: 1.1797, test_f1: 0.5216
 epoch: 81, train_loss: 0.8397, test_loss: 1.1988, test_f1: 0.5575
 epoch: 82, train_loss: 0.8224, test_loss: 1.1265, test_f1: 0.5232
 epoch: 83, train_loss: 0.8346, test_loss: 1.1640, test_f1: 0.5184
 epoch: 84, train_loss: 0.8345, test_loss: 1.1652, test_f1: 0.5332
 epoch: 85, train_loss: 0.8315, test_loss: 1.1545, test_f1: 0.5217
 epoch: 86, train_loss: 0.8196, test_loss: 1.0808, test_f1: 0.5451
 epoch: 87, train_loss: 0.8320, test_loss: 1.1168, test_f1: 0.5196
 epoch: 88, train_loss: 0.8160, test_loss: 1.1952, test_f1: 0.5263
 epoch: 89, train_loss: 0.8185, test_loss: 1.1527, test_f1: 0.5533
 epoch: 90, train_loss: 0.8247, test_loss: 1.1878, test_f1: 0.5321
 epoch: 91, train_loss: 0.8215, test_loss: 1.1885, test_f1: 0.5284
 epoch: 92, train_loss: 0.8302, test_loss: 1.2236, test_f1: 0.5336
 epoch: 93, train_loss: 0.8187, test_loss: 1.2353, test_f1: 0.5101
 epoch: 94, train_loss: 0.8151, test_loss: 1.3628, test_f1: 0.4685
 epoch: 95, train_loss: 0.8285, test_loss: 1.1512, test_f1: 0.5233
 epoch: 96, train_loss: 0.8048, test_loss: 1.2890, test_f1: 0.5212
 epoch: 97, train_loss: 0.8020, test_loss: 1.2421, test_f1: 0.5033
 epoch: 98, train_loss: 0.8206, test_loss: 1.1907, test_f1: 0.5352
 epoch: 99, train_loss: 0.8080, test_loss: 1.1106, test_f1: 0.5208
##################ITERATION #4 ****************************************
 epoch: 0, train_loss: 1.2143, test_loss: 1.2257, test_f1: 0.3142
 epoch: 1, train_loss: 1.1248, test_loss: 1.1990, test_f1: 0.3410
 epoch: 2, train_loss: 1.0945, test_loss: 1.1467, test_f1: 0.3513
 epoch: 3, train_loss: 1.0486, test_loss: 1.2323, test_f1: 0.3658
 epoch: 4, train_loss: 1.0429, test_loss: 1.1268, test_f1: 0.4757
 epoch: 5, train_loss: 1.0126, test_loss: 1.0674, test_f1: 0.4711
 epoch: 6, train_loss: 0.9595, test_loss: 1.0886, test_f1: 0.4269
 epoch: 7, train_loss: 0.9732, test_loss: 1.0837, test_f1: 0.4546
 epoch: 8, train_loss: 0.9265, test_loss: 1.0209, test_f1: 0.5329
 epoch: 9, train_loss: 0.9196, test_loss: 1.0605, test_f1: 0.5163
 epoch: 10, train_loss: 0.9107, test_loss: 1.1038, test_f1: 0.5263
 epoch: 11, train_loss: 0.9025, test_loss: 1.0237, test_f1: 0.5324
 epoch: 12, train_loss: 0.9069, test_loss: 1.1566, test_f1: 0.4696
 epoch: 13, train_loss: 0.8939, test_loss: 0.9759, test_f1: 0.5656
 epoch: 14, train_loss: 0.8972, test_loss: 1.0484, test_f1: 0.5167
 epoch: 15, train_loss: 0.8608, test_loss: 1.0468, test_f1: 0.5695
 epoch: 16, train_loss: 0.8834, test_loss: 1.1615, test_f1: 0.5015
 epoch: 17, train_loss: 0.8595, test_loss: 1.0278, test_f1: 0.5779
 epoch: 18, train_loss: 0.8568, test_loss: 1.0268, test_f1: 0.5359
 epoch: 19, train_loss: 0.8928, test_loss: 1.0012, test_f1: 0.5649
 epoch: 20, train_loss: 0.9043, test_loss: 1.0544, test_f1: 0.5273
 epoch: 21, train_loss: 0.8576, test_loss: 1.3544, test_f1: 0.4738
 epoch: 22, train_loss: 0.8673, test_loss: 1.0406, test_f1: 0.5318
 epoch: 23, train_loss: 0.8766, test_loss: 1.0924, test_f1: 0.5232
 epoch: 24, train_loss: 0.9026, test_loss: 1.0459, test_f1: 0.5538
 epoch: 25, train_loss: 0.8640, test_loss: 1.0521, test_f1: 0.5248
 epoch: 26, train_loss: 0.8711, test_loss: 1.1243, test_f1: 0.4885
 epoch: 27, train_loss: 0.8817, test_loss: 1.0652, test_f1: 0.5841
 epoch: 28, train_loss: 0.8754, test_loss: 1.0720, test_f1: 0.5273
 epoch: 29, train_loss: 0.8616, test_loss: 1.0453, test_f1: 0.5324
 epoch: 30, train_loss: 0.8508, test_loss: 1.0439, test_f1: 0.5621
 epoch: 31, train_loss: 0.8575, test_loss: 1.0226, test_f1: 0.5620
 epoch: 32, train_loss: 0.8598, test_loss: 1.0005, test_f1: 0.5631
 epoch: 33, train_loss: 0.8374, test_loss: 1.0928, test_f1: 0.5094
 epoch: 34, train_loss: 0.8707, test_loss: 1.0384, test_f1: 0.5604
 epoch: 35, train_loss: 0.8337, test_loss: 1.0600, test_f1: 0.5179
 epoch: 36, train_loss: 0.8372, test_loss: 1.0052, test_f1: 0.5498
 epoch: 37, train_loss: 0.8222, test_loss: 1.0287, test_f1: 0.5864
 epoch: 38, train_loss: 0.8096, test_loss: 1.1028, test_f1: 0.5700
 epoch: 39, train_loss: 0.8029, test_loss: 1.2283, test_f1: 0.5115
 epoch: 40, train_loss: 0.8362, test_loss: 1.1536, test_f1: 0.4553
 epoch: 41, train_loss: 0.7979, test_loss: 1.1457, test_f1: 0.5258
 epoch: 42, train_loss: 0.8233, test_loss: 1.0894, test_f1: 0.5690
 epoch: 43, train_loss: 0.8355, test_loss: 1.1736, test_f1: 0.5571
 epoch: 44, train_loss: 0.8176, test_loss: 1.0159, test_f1: 0.5810
 epoch: 45, train_loss: 0.7933, test_loss: 1.0105, test_f1: 0.6159
 epoch: 46, train_loss: 0.8155, test_loss: 1.0100, test_f1: 0.5581
 epoch: 47, train_loss: 0.8263, test_loss: 1.1314, test_f1: 0.4789
 epoch: 48, train_loss: 0.8190, test_loss: 1.1119, test_f1: 0.5159
 epoch: 49, train_loss: 0.8077, test_loss: 1.0738, test_f1: 0.5841
 epoch: 50, train_loss: 0.8197, test_loss: 1.0709, test_f1: 0.5189
 epoch: 51, train_loss: 0.7971, test_loss: 1.0962, test_f1: 0.5884
 epoch: 52, train_loss: 0.7945, test_loss: 1.1633, test_f1: 0.5462
 epoch: 53, train_loss: 0.7904, test_loss: 1.1337, test_f1: 0.5687
 epoch: 54, train_loss: 0.7658, test_loss: 1.2239, test_f1: 0.5765
 epoch: 55, train_loss: 0.7538, test_loss: 1.2460, test_f1: 0.5659
 epoch: 56, train_loss: 0.7614, test_loss: 1.1976, test_f1: 0.5450
 epoch: 57, train_loss: 0.7572, test_loss: 1.3181, test_f1: 0.5436
 epoch: 58, train_loss: 0.7763, test_loss: 1.1662, test_f1: 0.5754
 epoch: 59, train_loss: 0.7647, test_loss: 1.3282, test_f1: 0.5361
 epoch: 60, train_loss: 0.7669, test_loss: 1.0939, test_f1: 0.5831
 epoch: 61, train_loss: 0.7506, test_loss: 1.1709, test_f1: 0.5560
 epoch: 62, train_loss: 0.7669, test_loss: 1.1430, test_f1: 0.5627
 epoch: 63, train_loss: 0.7748, test_loss: 1.2380, test_f1: 0.5483
 epoch: 64, train_loss: 0.7599, test_loss: 1.1282, test_f1: 0.5518
 epoch: 65, train_loss: 0.7547, test_loss: 1.1940, test_f1: 0.5994
 epoch: 66, train_loss: 0.7637, test_loss: 1.1344, test_f1: 0.5847
 epoch: 67, train_loss: 0.7755, test_loss: 1.1842, test_f1: 0.5187
 epoch: 68, train_loss: 0.7521, test_loss: 1.3368, test_f1: 0.5014
 epoch: 69, train_loss: 0.7794, test_loss: 1.2811, test_f1: 0.5307
 epoch: 70, train_loss: 0.7678, test_loss: 1.2169, test_f1: 0.5312
 epoch: 71, train_loss: 0.7555, test_loss: 1.2112, test_f1: 0.5624
 epoch: 72, train_loss: 0.7470, test_loss: 1.2407, test_f1: 0.5700
 epoch: 73, train_loss: 0.7407, test_loss: 1.1237, test_f1: 0.6217
 epoch: 74, train_loss: 0.7442, test_loss: 1.2385, test_f1: 0.5531
 epoch: 75, train_loss: 0.7564, test_loss: 1.1789, test_f1: 0.5883
 epoch: 76, train_loss: 0.7482, test_loss: 1.1947, test_f1: 0.5904
 epoch: 77, train_loss: 0.7578, test_loss: 1.1661, test_f1: 0.5732
 epoch: 78, train_loss: 0.7456, test_loss: 1.0389, test_f1: 0.6154
 epoch: 79, train_loss: 0.7581, test_loss: 1.0815, test_f1: 0.5959
 epoch: 80, train_loss: 0.7377, test_loss: 1.2791, test_f1: 0.5523
 epoch: 81, train_loss: 0.7416, test_loss: 1.1452, test_f1: 0.5659
 epoch: 82, train_loss: 0.7395, test_loss: 1.1275, test_f1: 0.5290
 epoch: 83, train_loss: 0.7439, test_loss: 1.1352, test_f1: 0.5463
 epoch: 84, train_loss: 0.7479, test_loss: 1.2317, test_f1: 0.6243
 epoch: 85, train_loss: 0.7302, test_loss: 1.1591, test_f1: 0.6094
 epoch: 86, train_loss: 0.7403, test_loss: 1.1685, test_f1: 0.6087
 epoch: 87, train_loss: 0.7309, test_loss: 1.1749, test_f1: 0.5634
 epoch: 88, train_loss: 0.7347, test_loss: 1.1867, test_f1: 0.5900
 epoch: 89, train_loss: 0.7259, test_loss: 1.2036, test_f1: 0.5869
 epoch: 90, train_loss: 0.7155, test_loss: 1.0559, test_f1: 0.5904
 epoch: 91, train_loss: 0.7336, test_loss: 1.2365, test_f1: 0.5394
 epoch: 92, train_loss: 0.7489, test_loss: 1.1847, test_f1: 0.5078
 epoch: 93, train_loss: 0.7512, test_loss: 1.1029, test_f1: 0.5549
 epoch: 94, train_loss: 0.7391, test_loss: 1.1769, test_f1: 0.5776
 epoch: 95, train_loss: 0.7260, test_loss: 1.1667, test_f1: 0.5578
 epoch: 96, train_loss: 0.7119, test_loss: 1.1035, test_f1: 0.5540
 epoch: 97, train_loss: 0.7155, test_loss: 1.1871, test_f1: 0.6058
 epoch: 98, train_loss: 0.7418, test_loss: 1.1232, test_f1: 0.5745
 epoch: 99, train_loss: 0.7269, test_loss: 1.1672, test_f1: 0.5518
##################ITERATION #5 ****************************************
 epoch: 0, train_loss: 1.2645, test_loss: 1.2623, test_f1: 0.3647
 epoch: 1, train_loss: 1.1418, test_loss: 1.2220, test_f1: 0.4116
 epoch: 2, train_loss: 1.0916, test_loss: 1.2746, test_f1: 0.3985
 epoch: 3, train_loss: 1.0358, test_loss: 1.3081, test_f1: 0.4449
 epoch: 4, train_loss: 1.0229, test_loss: 1.1770, test_f1: 0.4610
 epoch: 5, train_loss: 0.9916, test_loss: 1.2280, test_f1: 0.4546
 epoch: 6, train_loss: 0.9687, test_loss: 1.2546, test_f1: 0.3981
 epoch: 7, train_loss: 0.9591, test_loss: 1.0613, test_f1: 0.5366
 epoch: 8, train_loss: 0.9440, test_loss: 1.0536, test_f1: 0.4859
 epoch: 9, train_loss: 0.9097, test_loss: 1.0271, test_f1: 0.5548
 epoch: 10, train_loss: 0.9216, test_loss: 1.0491, test_f1: 0.5155
 epoch: 11, train_loss: 0.9166, test_loss: 1.0312, test_f1: 0.5414
 epoch: 12, train_loss: 0.9084, test_loss: 0.9771, test_f1: 0.5681
 epoch: 13, train_loss: 0.8825, test_loss: 1.0979, test_f1: 0.5135
 epoch: 14, train_loss: 0.8790, test_loss: 1.0539, test_f1: 0.5512
 epoch: 15, train_loss: 0.8951, test_loss: 0.9520, test_f1: 0.5607
 epoch: 16, train_loss: 0.8814, test_loss: 0.9835, test_f1: 0.5535
 epoch: 17, train_loss: 0.8880, test_loss: 1.0009, test_f1: 0.5583
 epoch: 18, train_loss: 0.8676, test_loss: 1.0143, test_f1: 0.5742
 epoch: 19, train_loss: 0.8604, test_loss: 1.1444, test_f1: 0.4457
 epoch: 20, train_loss: 0.8799, test_loss: 2.4215, test_f1: 0.3784
 epoch: 21, train_loss: 0.8727, test_loss: 1.2622, test_f1: 0.4998
 epoch: 22, train_loss: 0.8961, test_loss: 1.0003, test_f1: 0.5214
 epoch: 23, train_loss: 0.8706, test_loss: 1.0687, test_f1: 0.5675
 epoch: 24, train_loss: 0.8710, test_loss: 1.5555, test_f1: 0.5444
 epoch: 25, train_loss: 0.8380, test_loss: 1.0248, test_f1: 0.5678
 epoch: 26, train_loss: 0.8423, test_loss: 1.0569, test_f1: 0.5388
 epoch: 27, train_loss: 0.8187, test_loss: 1.0858, test_f1: 0.5726
 epoch: 28, train_loss: 0.8524, test_loss: 1.0583, test_f1: 0.5534
 epoch: 29, train_loss: 0.8688, test_loss: 0.9993, test_f1: 0.5200
 epoch: 30, train_loss: 0.8341, test_loss: 1.0509, test_f1: 0.5833
 epoch: 31, train_loss: 0.8274, test_loss: 1.0711, test_f1: 0.5167
 epoch: 32, train_loss: 0.8745, test_loss: 1.0655, test_f1: 0.5288
 epoch: 33, train_loss: 0.8161, test_loss: 1.0714, test_f1: 0.5496
 epoch: 34, train_loss: 0.8200, test_loss: 1.1304, test_f1: 0.5352
 epoch: 35, train_loss: 0.8438, test_loss: 1.0956, test_f1: 0.5776
 epoch: 36, train_loss: 0.8521, test_loss: 1.0455, test_f1: 0.5550
 epoch: 37, train_loss: 0.8227, test_loss: 1.1657, test_f1: 0.4917
 epoch: 38, train_loss: 0.8209, test_loss: 1.0381, test_f1: 0.4730
 epoch: 39, train_loss: 0.8342, test_loss: 1.1160, test_f1: 0.5373
 epoch: 40, train_loss: 0.8304, test_loss: 1.1417, test_f1: 0.5247
 epoch: 41, train_loss: 0.8165, test_loss: 1.0621, test_f1: 0.5676
 epoch: 42, train_loss: 0.8342, test_loss: 1.2640, test_f1: 0.5339
 epoch: 43, train_loss: 0.8100, test_loss: 1.1057, test_f1: 0.5527
 epoch: 44, train_loss: 0.8075, test_loss: 1.0403, test_f1: 0.5363
 epoch: 45, train_loss: 0.7888, test_loss: 1.0676, test_f1: 0.5188
 epoch: 46, train_loss: 0.7932, test_loss: 1.0662, test_f1: 0.5441
 epoch: 47, train_loss: 0.8089, test_loss: 1.0552, test_f1: 0.5535
 epoch: 48, train_loss: 0.8062, test_loss: 1.1003, test_f1: 0.5476
 epoch: 49, train_loss: 0.8103, test_loss: 1.1201, test_f1: 0.5043
 epoch: 50, train_loss: 0.8156, test_loss: 1.7792, test_f1: 0.3996
 epoch: 51, train_loss: 0.8025, test_loss: 1.0366, test_f1: 0.5674
 epoch: 52, train_loss: 0.7796, test_loss: 1.0582, test_f1: 0.5822
 epoch: 53, train_loss: 0.7659, test_loss: 1.0677, test_f1: 0.5745
 epoch: 54, train_loss: 0.7827, test_loss: 1.1202, test_f1: 0.5572
 epoch: 55, train_loss: 0.7823, test_loss: 1.0318, test_f1: 0.5471
 epoch: 56, train_loss: 0.7733, test_loss: 1.1245, test_f1: 0.5568
 epoch: 57, train_loss: 0.7711, test_loss: 1.0815, test_f1: 0.5600
 epoch: 58, train_loss: 0.7646, test_loss: 0.9898, test_f1: 0.6052
 epoch: 59, train_loss: 0.7855, test_loss: 1.0757, test_f1: 0.5721
 epoch: 60, train_loss: 0.7730, test_loss: 1.0831, test_f1: 0.5883
 epoch: 61, train_loss: 0.7725, test_loss: 1.1064, test_f1: 0.5520
 epoch: 62, train_loss: 0.7579, test_loss: 1.0419, test_f1: 0.6157
 epoch: 63, train_loss: 0.7788, test_loss: 1.1218, test_f1: 0.5486
 epoch: 64, train_loss: 0.7590, test_loss: 1.0907, test_f1: 0.6081
 epoch: 65, train_loss: 0.7571, test_loss: 1.0282, test_f1: 0.5959
 epoch: 66, train_loss: 0.7735, test_loss: 1.0326, test_f1: 0.6102
 epoch: 67, train_loss: 0.7510, test_loss: 1.0938, test_f1: 0.5806
 epoch: 68, train_loss: 0.7463, test_loss: 1.0411, test_f1: 0.5916
 epoch: 69, train_loss: 0.7373, test_loss: 1.2486, test_f1: 0.5548
 epoch: 70, train_loss: 0.7460, test_loss: 1.0768, test_f1: 0.5854
 epoch: 71, train_loss: 0.7449, test_loss: 1.1505, test_f1: 0.5253
 epoch: 72, train_loss: 0.7652, test_loss: 1.0619, test_f1: 0.5719
 epoch: 73, train_loss: 0.7451, test_loss: 1.1140, test_f1: 0.5893
 epoch: 74, train_loss: 0.7645, test_loss: 1.1158, test_f1: 0.5522
 epoch: 75, train_loss: 0.7567, test_loss: 1.0329, test_f1: 0.5991
 epoch: 76, train_loss: 0.7396, test_loss: 0.9739, test_f1: 0.6131
 epoch: 77, train_loss: 0.7439, test_loss: 1.0646, test_f1: 0.5698
 epoch: 78, train_loss: 0.7517, test_loss: 1.1145, test_f1: 0.5524
 epoch: 79, train_loss: 0.7490, test_loss: 1.1910, test_f1: 0.5559
 epoch: 80, train_loss: 0.7438, test_loss: 1.0604, test_f1: 0.5678
 epoch: 81, train_loss: 0.7724, test_loss: 1.0589, test_f1: 0.5852
 epoch: 82, train_loss: 0.7433, test_loss: 1.0612, test_f1: 0.5878
 epoch: 83, train_loss: 0.7347, test_loss: 1.0882, test_f1: 0.5899
 epoch: 84, train_loss: 0.7418, test_loss: 1.1644, test_f1: 0.5770
 epoch: 85, train_loss: 0.7291, test_loss: 1.1055, test_f1: 0.5655
 epoch: 86, train_loss: 0.7289, test_loss: 1.1730, test_f1: 0.5626
 epoch: 87, train_loss: 0.7367, test_loss: 1.0568, test_f1: 0.5626
 epoch: 88, train_loss: 0.7457, test_loss: 1.1408, test_f1: 0.5606
 epoch: 89, train_loss: 0.7257, test_loss: 1.0877, test_f1: 0.5798
 epoch: 90, train_loss: 0.7407, test_loss: 1.1128, test_f1: 0.5705
 epoch: 91, train_loss: 0.7191, test_loss: 1.0449, test_f1: 0.5774
 epoch: 92, train_loss: 0.7365, test_loss: 1.1232, test_f1: 0.5669
 epoch: 93, train_loss: 0.7302, test_loss: 1.0726, test_f1: 0.5868
 epoch: 94, train_loss: 0.7175, test_loss: 1.2072, test_f1: 0.5669
 epoch: 95, train_loss: 0.7273, test_loss: 1.1916, test_f1: 0.5586
 epoch: 96, train_loss: 0.7286, test_loss: 1.0929, test_f1: 0.5673
 epoch: 97, train_loss: 0.7183, test_loss: 1.0291, test_f1: 0.5657
 epoch: 98, train_loss: 0.7390, test_loss: 1.1129, test_f1: 0.5688
 epoch: 99, train_loss: 0.7274, test_loss: 1.0810, test_f1: 0.5866
##################ITERATION #6 ****************************************
 epoch: 0, train_loss: 1.2819, test_loss: 2.7313, test_f1: 0.2946
 epoch: 1, train_loss: 1.1886, test_loss: 1.2145, test_f1: 0.3353
 epoch: 2, train_loss: 1.1421, test_loss: 1.2092, test_f1: 0.3601
 epoch: 3, train_loss: 1.1391, test_loss: 1.2658, test_f1: 0.3423
 epoch: 4, train_loss: 1.1002, test_loss: 1.3294, test_f1: 0.3843
 epoch: 5, train_loss: 1.0555, test_loss: 1.2397, test_f1: 0.3996
 epoch: 6, train_loss: 1.0418, test_loss: 1.2280, test_f1: 0.3896
 epoch: 7, train_loss: 1.0305, test_loss: 1.0750, test_f1: 0.4381
 epoch: 8, train_loss: 1.0213, test_loss: 1.1229, test_f1: 0.4376
 epoch: 9, train_loss: 0.9808, test_loss: 1.0770, test_f1: 0.4240
 epoch: 10, train_loss: 0.9819, test_loss: 1.0653, test_f1: 0.4005
 epoch: 11, train_loss: 0.9564, test_loss: 0.9771, test_f1: 0.5636
 epoch: 12, train_loss: 0.9685, test_loss: 1.0046, test_f1: 0.5541
 epoch: 13, train_loss: 0.9415, test_loss: 1.0134, test_f1: 0.5588
 epoch: 14, train_loss: 0.9230, test_loss: 1.0187, test_f1: 0.4419
 epoch: 15, train_loss: 0.9124, test_loss: 1.0038, test_f1: 0.4383
 epoch: 16, train_loss: 0.9204, test_loss: 1.0381, test_f1: 0.4913
 epoch: 17, train_loss: 0.9528, test_loss: 0.9935, test_f1: 0.5604
 epoch: 18, train_loss: 0.9018, test_loss: 1.0276, test_f1: 0.4679
 epoch: 19, train_loss: 0.9006, test_loss: 0.9740, test_f1: 0.4874
 epoch: 20, train_loss: 0.8847, test_loss: 1.0207, test_f1: 0.5469
 epoch: 21, train_loss: 0.9107, test_loss: 0.9814, test_f1: 0.5640
 epoch: 22, train_loss: 0.8778, test_loss: 0.9704, test_f1: 0.4529
 epoch: 23, train_loss: 0.8777, test_loss: 0.9981, test_f1: 0.4785
 epoch: 24, train_loss: 0.9045, test_loss: 1.1548, test_f1: 0.3977
 epoch: 25, train_loss: 0.9163, test_loss: 0.9806, test_f1: 0.5295
 epoch: 26, train_loss: 0.8948, test_loss: 0.9801, test_f1: 0.5788
 epoch: 27, train_loss: 0.9421, test_loss: 1.0853, test_f1: 0.4653
 epoch: 28, train_loss: 0.9321, test_loss: 1.1182, test_f1: 0.5275
 epoch: 29, train_loss: 0.9037, test_loss: 1.0361, test_f1: 0.5272
 epoch: 30, train_loss: 0.8911, test_loss: 1.0057, test_f1: 0.5352
 epoch: 31, train_loss: 0.8901, test_loss: 0.9856, test_f1: 0.4567
 epoch: 32, train_loss: 0.8846, test_loss: 1.0494, test_f1: 0.5628
 epoch: 33, train_loss: 0.8722, test_loss: 0.9926, test_f1: 0.5834
 epoch: 34, train_loss: 0.8723, test_loss: 0.9808, test_f1: 0.5602
 epoch: 35, train_loss: 0.8808, test_loss: 0.9609, test_f1: 0.5369
 epoch: 36, train_loss: 0.8684, test_loss: 1.0433, test_f1: 0.5581
 epoch: 37, train_loss: 0.8723, test_loss: 0.9926, test_f1: 0.5532
 epoch: 38, train_loss: 0.8565, test_loss: 0.9441, test_f1: 0.5760
 epoch: 39, train_loss: 0.8588, test_loss: 1.0025, test_f1: 0.5822
 epoch: 40, train_loss: 0.8639, test_loss: 1.0001, test_f1: 0.5879
 epoch: 41, train_loss: 0.8670, test_loss: 1.0150, test_f1: 0.5410
 epoch: 42, train_loss: 0.8590, test_loss: 1.0090, test_f1: 0.5793
 epoch: 43, train_loss: 0.8786, test_loss: 0.9933, test_f1: 0.5690
 epoch: 44, train_loss: 0.8517, test_loss: 1.0002, test_f1: 0.5526
 epoch: 45, train_loss: 0.8468, test_loss: 1.0086, test_f1: 0.5819
 epoch: 46, train_loss: 0.8625, test_loss: 0.9855, test_f1: 0.5240
 epoch: 47, train_loss: 0.8654, test_loss: 0.9937, test_f1: 0.5976
 epoch: 48, train_loss: 0.8396, test_loss: 1.0393, test_f1: 0.5690
 epoch: 49, train_loss: 0.8344, test_loss: 1.1906, test_f1: 0.5019
 epoch: 50, train_loss: 0.8714, test_loss: 0.9951, test_f1: 0.5329
 epoch: 51, train_loss: 0.8243, test_loss: 0.9879, test_f1: 0.5915
 epoch: 52, train_loss: 0.8227, test_loss: 1.0019, test_f1: 0.5295
 epoch: 53, train_loss: 0.8289, test_loss: 0.9971, test_f1: 0.5768
 epoch: 54, train_loss: 0.8128, test_loss: 1.0232, test_f1: 0.5484
 epoch: 55, train_loss: 0.8146, test_loss: 0.9914, test_f1: 0.5677
 epoch: 56, train_loss: 0.8217, test_loss: 0.9989, test_f1: 0.5673
 epoch: 57, train_loss: 0.8107, test_loss: 1.0387, test_f1: 0.5335
 epoch: 58, train_loss: 0.8185, test_loss: 1.0578, test_f1: 0.4979
 epoch: 59, train_loss: 0.8077, test_loss: 0.9913, test_f1: 0.5477
 epoch: 60, train_loss: 0.8003, test_loss: 1.0162, test_f1: 0.6007
 epoch: 61, train_loss: 0.7968, test_loss: 0.9980, test_f1: 0.5624
 epoch: 62, train_loss: 0.8181, test_loss: 1.0192, test_f1: 0.5549
 epoch: 63, train_loss: 0.8189, test_loss: 0.9780, test_f1: 0.5818
 epoch: 64, train_loss: 0.8074, test_loss: 1.0551, test_f1: 0.5408
 epoch: 65, train_loss: 0.7978, test_loss: 0.9937, test_f1: 0.5921
 epoch: 66, train_loss: 0.8026, test_loss: 0.9935, test_f1: 0.5561
 epoch: 67, train_loss: 0.8064, test_loss: 1.0425, test_f1: 0.5843
 epoch: 68, train_loss: 0.7754, test_loss: 1.2659, test_f1: 0.5032
 epoch: 69, train_loss: 0.7910, test_loss: 1.0312, test_f1: 0.5310
 epoch: 70, train_loss: 0.7841, test_loss: 1.0342, test_f1: 0.6032
 epoch: 71, train_loss: 0.7871, test_loss: 1.1329, test_f1: 0.5354
 epoch: 72, train_loss: 0.7720, test_loss: 1.0492, test_f1: 0.5664
 epoch: 73, train_loss: 0.7905, test_loss: 1.0562, test_f1: 0.5825
 epoch: 74, train_loss: 0.7861, test_loss: 0.9815, test_f1: 0.5907
 epoch: 75, train_loss: 0.8035, test_loss: 1.0089, test_f1: 0.5688
 epoch: 76, train_loss: 0.7556, test_loss: 1.0858, test_f1: 0.5336
 epoch: 77, train_loss: 0.7925, test_loss: 1.0478, test_f1: 0.5787
 epoch: 78, train_loss: 0.7868, test_loss: 1.0668, test_f1: 0.5355
 epoch: 79, train_loss: 0.7910, test_loss: 1.0309, test_f1: 0.5521
 epoch: 80, train_loss: 0.8087, test_loss: 0.9480, test_f1: 0.6209
 epoch: 81, train_loss: 0.7814, test_loss: 1.0831, test_f1: 0.5813
 epoch: 82, train_loss: 0.7741, test_loss: 1.0749, test_f1: 0.6071
 epoch: 83, train_loss: 0.7649, test_loss: 1.0223, test_f1: 0.6038
 epoch: 84, train_loss: 0.7704, test_loss: 1.1111, test_f1: 0.5601
 epoch: 85, train_loss: 0.7724, test_loss: 1.0442, test_f1: 0.5949
 epoch: 86, train_loss: 0.7918, test_loss: 1.1250, test_f1: 0.5585
 epoch: 87, train_loss: 0.7936, test_loss: 1.1181, test_f1: 0.5005
 epoch: 88, train_loss: 0.7825, test_loss: 1.0689, test_f1: 0.5717
 epoch: 89, train_loss: 0.7757, test_loss: 1.1402, test_f1: 0.5396
 epoch: 90, train_loss: 0.7614, test_loss: 1.1577, test_f1: 0.5596
 epoch: 91, train_loss: 0.7620, test_loss: 1.0541, test_f1: 0.5905
 epoch: 92, train_loss: 0.7500, test_loss: 1.1144, test_f1: 0.5662
 epoch: 93, train_loss: 0.7572, test_loss: 1.0982, test_f1: 0.5407
 epoch: 94, train_loss: 0.7620, test_loss: 1.0697, test_f1: 0.5816
 epoch: 95, train_loss: 0.7465, test_loss: 1.0796, test_f1: 0.5506
 epoch: 96, train_loss: 0.7589, test_loss: 1.0834, test_f1: 0.5479
 epoch: 97, train_loss: 0.7477, test_loss: 1.1196, test_f1: 0.5655
 epoch: 98, train_loss: 0.7473, test_loss: 1.2046, test_f1: 0.5402
 epoch: 99, train_loss: 0.7467, test_loss: 1.1304, test_f1: 0.5671
##################ITERATION #7 ****************************************
 epoch: 0, train_loss: 1.2833, test_loss: 1.3096, test_f1: 0.2391
 epoch: 1, train_loss: 1.2347, test_loss: 1.2926, test_f1: 0.3682
 epoch: 2, train_loss: 1.1868, test_loss: 1.2344, test_f1: 0.3589
 epoch: 3, train_loss: 1.1285, test_loss: 1.2077, test_f1: 0.3448
 epoch: 4, train_loss: 1.0994, test_loss: 1.1463, test_f1: 0.4231
 epoch: 5, train_loss: 1.0557, test_loss: 1.1236, test_f1: 0.4593
 epoch: 6, train_loss: 1.0268, test_loss: 1.1597, test_f1: 0.4206
 epoch: 7, train_loss: 0.9862, test_loss: 1.1017, test_f1: 0.4323
 epoch: 8, train_loss: 0.9558, test_loss: 1.0759, test_f1: 0.4896
 epoch: 9, train_loss: 0.9471, test_loss: 1.1295, test_f1: 0.4697
 epoch: 10, train_loss: 0.9719, test_loss: 1.1754, test_f1: 0.3746
 epoch: 11, train_loss: 0.9639, test_loss: 1.4498, test_f1: 0.4420
 epoch: 12, train_loss: 0.9577, test_loss: 1.1176, test_f1: 0.4979
 epoch: 13, train_loss: 0.9281, test_loss: 1.0524, test_f1: 0.5038
 epoch: 14, train_loss: 0.9054, test_loss: 1.0693, test_f1: 0.5191
 epoch: 15, train_loss: 0.8970, test_loss: 1.0912, test_f1: 0.5451
 epoch: 16, train_loss: 0.8893, test_loss: 1.1502, test_f1: 0.4758
 epoch: 17, train_loss: 0.9037, test_loss: 1.0741, test_f1: 0.5195
 epoch: 18, train_loss: 0.9290, test_loss: 1.3999, test_f1: 0.4322
 epoch: 19, train_loss: 0.8847, test_loss: 1.2937, test_f1: 0.4683
 epoch: 20, train_loss: 0.8892, test_loss: 1.0638, test_f1: 0.5229
 epoch: 21, train_loss: 0.8785, test_loss: 1.0999, test_f1: 0.4790
 epoch: 22, train_loss: 0.8509, test_loss: 1.0430, test_f1: 0.4939
 epoch: 23, train_loss: 0.8901, test_loss: 1.1192, test_f1: 0.5340
 epoch: 24, train_loss: 0.8774, test_loss: 1.1046, test_f1: 0.5235
 epoch: 25, train_loss: 0.8896, test_loss: 1.1134, test_f1: 0.5703
 epoch: 26, train_loss: 0.8593, test_loss: 1.1245, test_f1: 0.5797
 epoch: 27, train_loss: 0.8684, test_loss: 1.0818, test_f1: 0.5635
 epoch: 28, train_loss: 0.8477, test_loss: 1.0792, test_f1: 0.5452
 epoch: 29, train_loss: 0.8667, test_loss: 1.4815, test_f1: 0.4908
 epoch: 30, train_loss: 0.8668, test_loss: 1.1552, test_f1: 0.5114
 epoch: 31, train_loss: 0.8524, test_loss: 1.0214, test_f1: 0.5489
 epoch: 32, train_loss: 0.8433, test_loss: 1.0282, test_f1: 0.5592
 epoch: 33, train_loss: 0.8570, test_loss: 1.0314, test_f1: 0.5440
 epoch: 34, train_loss: 0.8544, test_loss: 0.9879, test_f1: 0.5625
 epoch: 35, train_loss: 0.8582, test_loss: 1.5130, test_f1: 0.3419
 epoch: 36, train_loss: 0.8872, test_loss: 0.9902, test_f1: 0.4450
 epoch: 37, train_loss: 0.8486, test_loss: 1.1167, test_f1: 0.4764
 epoch: 38, train_loss: 0.8320, test_loss: 1.0126, test_f1: 0.5467
 epoch: 39, train_loss: 0.8320, test_loss: 1.2432, test_f1: 0.4708
 epoch: 40, train_loss: 0.8297, test_loss: 1.0207, test_f1: 0.5143
 epoch: 41, train_loss: 0.8569, test_loss: 1.0527, test_f1: 0.5447
 epoch: 42, train_loss: 0.8583, test_loss: 1.0734, test_f1: 0.5234
 epoch: 43, train_loss: 0.8688, test_loss: 1.0111, test_f1: 0.5546
 epoch: 44, train_loss: 0.8630, test_loss: 1.1169, test_f1: 0.5075
 epoch: 45, train_loss: 0.8602, test_loss: 1.0041, test_f1: 0.5406
 epoch: 46, train_loss: 0.8262, test_loss: 0.9782, test_f1: 0.5705
 epoch: 47, train_loss: 0.8259, test_loss: 1.0745, test_f1: 0.5294
 epoch: 48, train_loss: 0.8097, test_loss: 1.0313, test_f1: 0.5490
 epoch: 49, train_loss: 0.8278, test_loss: 0.9721, test_f1: 0.5716
 epoch: 50, train_loss: 0.7975, test_loss: 0.9425, test_f1: 0.5830
 epoch: 51, train_loss: 0.8319, test_loss: 0.9638, test_f1: 0.5463
 epoch: 52, train_loss: 0.7993, test_loss: 1.0039, test_f1: 0.5703
 epoch: 53, train_loss: 0.7951, test_loss: 0.9543, test_f1: 0.5637
 epoch: 54, train_loss: 0.7967, test_loss: 1.0015, test_f1: 0.5709
 epoch: 55, train_loss: 0.7886, test_loss: 1.0130, test_f1: 0.5647
 epoch: 56, train_loss: 0.8037, test_loss: 0.9973, test_f1: 0.5748
 epoch: 57, train_loss: 0.7916, test_loss: 0.9497, test_f1: 0.5824
 epoch: 58, train_loss: 0.7818, test_loss: 0.9782, test_f1: 0.5750
 epoch: 59, train_loss: 0.7882, test_loss: 1.0027, test_f1: 0.5781
 epoch: 60, train_loss: 0.7732, test_loss: 0.9927, test_f1: 0.5736
 epoch: 61, train_loss: 0.7911, test_loss: 1.0191, test_f1: 0.5689
 epoch: 62, train_loss: 0.7836, test_loss: 1.0308, test_f1: 0.5394
 epoch: 63, train_loss: 0.7793, test_loss: 1.0662, test_f1: 0.5781
 epoch: 64, train_loss: 0.7892, test_loss: 1.0595, test_f1: 0.5483
 epoch: 65, train_loss: 0.7675, test_loss: 1.0338, test_f1: 0.5990
 epoch: 66, train_loss: 0.7704, test_loss: 1.0644, test_f1: 0.5819
 epoch: 67, train_loss: 0.7693, test_loss: 1.0618, test_f1: 0.5373
 epoch: 68, train_loss: 0.7816, test_loss: 1.0277, test_f1: 0.5828
 epoch: 69, train_loss: 0.7734, test_loss: 1.0096, test_f1: 0.5937
 epoch: 70, train_loss: 0.7795, test_loss: 1.0399, test_f1: 0.5723
 epoch: 71, train_loss: 0.7639, test_loss: 1.0682, test_f1: 0.5843
 epoch: 72, train_loss: 0.7660, test_loss: 1.0379, test_f1: 0.5807
 epoch: 73, train_loss: 0.7730, test_loss: 0.9799, test_f1: 0.5954
 epoch: 74, train_loss: 0.7649, test_loss: 0.9931, test_f1: 0.6225
 epoch: 75, train_loss: 0.7819, test_loss: 1.1255, test_f1: 0.5176
 epoch: 76, train_loss: 0.7554, test_loss: 1.0139, test_f1: 0.5837
 epoch: 77, train_loss: 0.7412, test_loss: 1.0288, test_f1: 0.5582
 epoch: 78, train_loss: 0.7492, test_loss: 1.0520, test_f1: 0.5990
 epoch: 79, train_loss: 0.7612, test_loss: 1.0411, test_f1: 0.5943
 epoch: 80, train_loss: 0.7462, test_loss: 1.0545, test_f1: 0.5731
 epoch: 81, train_loss: 0.7655, test_loss: 1.1161, test_f1: 0.5810
 epoch: 82, train_loss: 0.7549, test_loss: 1.0694, test_f1: 0.5466
 epoch: 83, train_loss: 0.7740, test_loss: 1.0811, test_f1: 0.5588
 epoch: 84, train_loss: 0.7470, test_loss: 1.0846, test_f1: 0.5683
 epoch: 85, train_loss: 0.7641, test_loss: 1.0093, test_f1: 0.5811
 epoch: 86, train_loss: 0.7580, test_loss: 0.9915, test_f1: 0.5958
 epoch: 87, train_loss: 0.7518, test_loss: 0.9992, test_f1: 0.6055
 epoch: 88, train_loss: 0.7709, test_loss: 1.0084, test_f1: 0.5744
 epoch: 89, train_loss: 0.7453, test_loss: 1.0037, test_f1: 0.5809
 epoch: 90, train_loss: 0.7441, test_loss: 1.0154, test_f1: 0.5952
 epoch: 91, train_loss: 0.7433, test_loss: 0.9658, test_f1: 0.6129
 epoch: 92, train_loss: 0.7599, test_loss: 0.9528, test_f1: 0.5972
 epoch: 93, train_loss: 0.7451, test_loss: 0.9996, test_f1: 0.6176
 epoch: 94, train_loss: 0.7700, test_loss: 0.9902, test_f1: 0.6181
 epoch: 95, train_loss: 0.7458, test_loss: 0.9707, test_f1: 0.6199
 epoch: 96, train_loss: 0.7551, test_loss: 0.9966, test_f1: 0.6038
 epoch: 97, train_loss: 0.7151, test_loss: 1.0357, test_f1: 0.6119
 epoch: 98, train_loss: 0.7404, test_loss: 1.0969, test_f1: 0.5903
 epoch: 99, train_loss: 0.7450, test_loss: 1.0172, test_f1: 0.5875
##################ITERATION #8 ****************************************
 epoch: 0, train_loss: 1.2245, test_loss: 1.2467, test_f1: 0.4297
 epoch: 1, train_loss: 1.1410, test_loss: 1.2461, test_f1: 0.3401
 epoch: 2, train_loss: 1.0970, test_loss: 1.2479, test_f1: 0.3684
 epoch: 3, train_loss: 1.0991, test_loss: 1.1628, test_f1: 0.3964
 epoch: 4, train_loss: 1.0825, test_loss: 1.1906, test_f1: 0.3831
 epoch: 5, train_loss: 1.0647, test_loss: 1.1600, test_f1: 0.4239
 epoch: 6, train_loss: 1.0239, test_loss: 1.1905, test_f1: 0.4468
 epoch: 7, train_loss: 1.0005, test_loss: 1.2013, test_f1: 0.4342
 epoch: 8, train_loss: 0.9684, test_loss: 1.1196, test_f1: 0.5111
 epoch: 9, train_loss: 0.9600, test_loss: 1.0779, test_f1: 0.5515
 epoch: 10, train_loss: 0.9683, test_loss: 1.0760, test_f1: 0.4108
 epoch: 11, train_loss: 0.9182, test_loss: 1.0541, test_f1: 0.5385
 epoch: 12, train_loss: 0.9338, test_loss: 1.0789, test_f1: 0.5646
 epoch: 13, train_loss: 0.9094, test_loss: 0.9868, test_f1: 0.5655
 epoch: 14, train_loss: 0.8963, test_loss: 1.0761, test_f1: 0.5134
 epoch: 15, train_loss: 0.8912, test_loss: 1.0372, test_f1: 0.5382
 epoch: 16, train_loss: 0.8770, test_loss: 1.0078, test_f1: 0.5492
 epoch: 17, train_loss: 0.8754, test_loss: 0.9863, test_f1: 0.5789
 epoch: 18, train_loss: 0.8997, test_loss: 1.0388, test_f1: 0.4585
 epoch: 19, train_loss: 0.8882, test_loss: 1.0702, test_f1: 0.4830
 epoch: 20, train_loss: 0.8834, test_loss: 1.0091, test_f1: 0.5856
 epoch: 21, train_loss: 0.8800, test_loss: 1.0070, test_f1: 0.5586
 epoch: 22, train_loss: 0.8790, test_loss: 0.9714, test_f1: 0.4393
 epoch: 23, train_loss: 0.8639, test_loss: 1.0828, test_f1: 0.5459
 epoch: 24, train_loss: 0.8938, test_loss: 1.0366, test_f1: 0.4236
 epoch: 25, train_loss: 0.8714, test_loss: 1.0164, test_f1: 0.5515
 epoch: 26, train_loss: 0.8592, test_loss: 1.0270, test_f1: 0.5734
 epoch: 27, train_loss: 0.8410, test_loss: 1.0752, test_f1: 0.5868
 epoch: 28, train_loss: 0.8761, test_loss: 1.0619, test_f1: 0.5621
 epoch: 29, train_loss: 0.8735, test_loss: 0.9803, test_f1: 0.5929
 epoch: 30, train_loss: 0.8528, test_loss: 0.9968, test_f1: 0.5898
 epoch: 31, train_loss: 0.8466, test_loss: 1.0067, test_f1: 0.5954
 epoch: 32, train_loss: 0.8440, test_loss: 1.0153, test_f1: 0.5868
 epoch: 33, train_loss: 0.8578, test_loss: 1.0001, test_f1: 0.5634
 epoch: 34, train_loss: 0.8589, test_loss: 1.0044, test_f1: 0.5682
 epoch: 35, train_loss: 0.8659, test_loss: 0.9929, test_f1: 0.6113
 epoch: 36, train_loss: 0.8496, test_loss: 1.0210, test_f1: 0.5933
 epoch: 37, train_loss: 0.8303, test_loss: 1.1065, test_f1: 0.5798
 epoch: 38, train_loss: 0.8436, test_loss: 1.0525, test_f1: 0.5029
 epoch: 39, train_loss: 0.8618, test_loss: 1.0481, test_f1: 0.5884
 epoch: 40, train_loss: 0.8399, test_loss: 1.0732, test_f1: 0.5636
 epoch: 41, train_loss: 0.9041, test_loss: 1.0786, test_f1: 0.5652
 epoch: 42, train_loss: 0.8954, test_loss: 1.0380, test_f1: 0.5761
 epoch: 43, train_loss: 0.8380, test_loss: 1.0354, test_f1: 0.5771
 epoch: 44, train_loss: 0.8523, test_loss: 1.0424, test_f1: 0.5808
 epoch: 45, train_loss: 0.8486, test_loss: 1.0437, test_f1: 0.5174
 epoch: 46, train_loss: 0.8310, test_loss: 1.0495, test_f1: 0.6003
 epoch: 47, train_loss: 0.8245, test_loss: 1.0304, test_f1: 0.5655
 epoch: 48, train_loss: 0.8402, test_loss: 1.0642, test_f1: 0.5876
 epoch: 49, train_loss: 0.8326, test_loss: 1.0421, test_f1: 0.5945
 epoch: 50, train_loss: 0.8387, test_loss: 0.9918, test_f1: 0.5920
 epoch: 51, train_loss: 0.8025, test_loss: 1.0336, test_f1: 0.5729
 epoch: 52, train_loss: 0.8004, test_loss: 0.9853, test_f1: 0.6040
 epoch: 53, train_loss: 0.7946, test_loss: 1.0046, test_f1: 0.6242
 epoch: 54, train_loss: 0.7821, test_loss: 1.0050, test_f1: 0.6036
 epoch: 55, train_loss: 0.7817, test_loss: 1.0077, test_f1: 0.6032
 epoch: 56, train_loss: 0.7746, test_loss: 1.0749, test_f1: 0.5545
 epoch: 57, train_loss: 0.7855, test_loss: 1.0166, test_f1: 0.6334
 epoch: 58, train_loss: 0.7834, test_loss: 1.0339, test_f1: 0.5883
 epoch: 59, train_loss: 0.7815, test_loss: 1.0305, test_f1: 0.5160
 epoch: 60, train_loss: 0.7624, test_loss: 1.0424, test_f1: 0.5264
 epoch: 61, train_loss: 0.7771, test_loss: 1.1941, test_f1: 0.5609
 epoch: 62, train_loss: 0.7718, test_loss: 1.0880, test_f1: 0.5619
 epoch: 63, train_loss: 0.7803, test_loss: 1.0797, test_f1: 0.5284
 epoch: 64, train_loss: 0.7739, test_loss: 1.0694, test_f1: 0.5603
 epoch: 65, train_loss: 0.7654, test_loss: 1.0244, test_f1: 0.5946
 epoch: 66, train_loss: 0.7854, test_loss: 1.1031, test_f1: 0.5393
 epoch: 67, train_loss: 0.7548, test_loss: 1.0768, test_f1: 0.5358
 epoch: 68, train_loss: 0.7739, test_loss: 1.0874, test_f1: 0.5412
 epoch: 69, train_loss: 0.7770, test_loss: 1.0940, test_f1: 0.5514
 epoch: 70, train_loss: 0.7484, test_loss: 1.0220, test_f1: 0.5648
 epoch: 71, train_loss: 0.7756, test_loss: 1.0223, test_f1: 0.6334
 epoch: 72, train_loss: 0.7440, test_loss: 1.0748, test_f1: 0.5870
 epoch: 73, train_loss: 0.7414, test_loss: 1.0687, test_f1: 0.5551
 epoch: 74, train_loss: 0.7549, test_loss: 1.0899, test_f1: 0.5530
 epoch: 75, train_loss: 0.7430, test_loss: 1.1664, test_f1: 0.5251
 epoch: 76, train_loss: 0.7677, test_loss: 1.0766, test_f1: 0.5511
 epoch: 77, train_loss: 0.7401, test_loss: 1.0470, test_f1: 0.5470
 epoch: 78, train_loss: 0.7619, test_loss: 1.1183, test_f1: 0.5957
 epoch: 79, train_loss: 0.7358, test_loss: 1.1143, test_f1: 0.5920
 epoch: 80, train_loss: 0.7384, test_loss: 1.0806, test_f1: 0.5344
 epoch: 81, train_loss: 0.7283, test_loss: 1.1724, test_f1: 0.5648
 epoch: 82, train_loss: 0.7375, test_loss: 1.0973, test_f1: 0.5705
 epoch: 83, train_loss: 0.7377, test_loss: 1.0671, test_f1: 0.5854
 epoch: 84, train_loss: 0.7425, test_loss: 1.0842, test_f1: 0.5640
 epoch: 85, train_loss: 0.7212, test_loss: 1.0900, test_f1: 0.5998
 epoch: 86, train_loss: 0.7606, test_loss: 1.1077, test_f1: 0.5696
 epoch: 87, train_loss: 0.7381, test_loss: 1.0810, test_f1: 0.5748
 epoch: 88, train_loss: 0.7436, test_loss: 1.1449, test_f1: 0.5648
 epoch: 89, train_loss: 0.7245, test_loss: 1.1409, test_f1: 0.5077
 epoch: 90, train_loss: 0.7431, test_loss: 1.1797, test_f1: 0.5240
 epoch: 91, train_loss: 0.7235, test_loss: 1.0379, test_f1: 0.5969
 epoch: 92, train_loss: 0.7481, test_loss: 1.0835, test_f1: 0.5152
 epoch: 93, train_loss: 0.7382, test_loss: 1.0501, test_f1: 0.6068
 epoch: 94, train_loss: 0.7065, test_loss: 1.1508, test_f1: 0.5559
 epoch: 95, train_loss: 0.7218, test_loss: 1.0591, test_f1: 0.6044
 epoch: 96, train_loss: 0.7186, test_loss: 1.1020, test_f1: 0.6213
 epoch: 97, train_loss: 0.7101, test_loss: 1.1185, test_f1: 0.5829
 epoch: 98, train_loss: 0.7310, test_loss: 1.0696, test_f1: 0.6016
 epoch: 99, train_loss: 0.7170, test_loss: 1.0818, test_f1: 0.6027
##################ITERATION #9 ****************************************
 epoch: 0, train_loss: 1.3041, test_loss: 1.3021, test_f1: 0.2736
 epoch: 1, train_loss: 1.2148, test_loss: 1.2565, test_f1: 0.3406
 epoch: 2, train_loss: 1.1849, test_loss: 1.2769, test_f1: 0.3253
 epoch: 3, train_loss: 1.1457, test_loss: 1.2028, test_f1: 0.3546
 epoch: 4, train_loss: 1.1314, test_loss: 1.1532, test_f1: 0.4381
 epoch: 5, train_loss: 1.1078, test_loss: 1.2140, test_f1: 0.3781
 epoch: 6, train_loss: 1.0807, test_loss: 1.1350, test_f1: 0.4638
 epoch: 7, train_loss: 1.0463, test_loss: 1.1107, test_f1: 0.4959
 epoch: 8, train_loss: 1.0362, test_loss: 1.1189, test_f1: 0.4744
 epoch: 9, train_loss: 1.0164, test_loss: 1.0990, test_f1: 0.5270
 epoch: 10, train_loss: 0.9839, test_loss: 1.0749, test_f1: 0.5207
 epoch: 11, train_loss: 0.9745, test_loss: 1.1218, test_f1: 0.4307
 epoch: 12, train_loss: 0.9983, test_loss: 1.0593, test_f1: 0.4507
 epoch: 13, train_loss: 0.9891, test_loss: 1.1194, test_f1: 0.4799
 epoch: 14, train_loss: 0.9954, test_loss: 1.1948, test_f1: 0.4245
 epoch: 15, train_loss: 0.9775, test_loss: 1.0951, test_f1: 0.5295
 epoch: 16, train_loss: 0.9375, test_loss: 1.0674, test_f1: 0.5094
 epoch: 17, train_loss: 0.9170, test_loss: 1.0267, test_f1: 0.5075
 epoch: 18, train_loss: 0.9096, test_loss: 1.0465, test_f1: 0.5376
 epoch: 19, train_loss: 0.9308, test_loss: 1.1176, test_f1: 0.4807
 epoch: 20, train_loss: 0.9360, test_loss: 1.0231, test_f1: 0.4888
 epoch: 21, train_loss: 0.9176, test_loss: 1.1791, test_f1: 0.3816
 epoch: 22, train_loss: 0.9325, test_loss: 1.0438, test_f1: 0.5506
 epoch: 23, train_loss: 0.9185, test_loss: 1.0287, test_f1: 0.5650
 epoch: 24, train_loss: 0.9315, test_loss: 1.0434, test_f1: 0.5230
 epoch: 25, train_loss: 0.9218, test_loss: 1.0315, test_f1: 0.5515
 epoch: 26, train_loss: 0.9130, test_loss: 1.0665, test_f1: 0.5526
 epoch: 27, train_loss: 0.9008, test_loss: 1.0220, test_f1: 0.5575
 epoch: 28, train_loss: 0.8965, test_loss: 1.0737, test_f1: 0.4213
 epoch: 29, train_loss: 0.8977, test_loss: 1.0096, test_f1: 0.4805
 epoch: 30, train_loss: 0.8985, test_loss: 1.0366, test_f1: 0.5330
 epoch: 31, train_loss: 0.8863, test_loss: 1.0610, test_f1: 0.5250
 epoch: 32, train_loss: 0.9107, test_loss: 1.0814, test_f1: 0.5010
 epoch: 33, train_loss: 0.8614, test_loss: 0.9992, test_f1: 0.5946
 epoch: 34, train_loss: 0.8864, test_loss: 1.0044, test_f1: 0.5400
 epoch: 35, train_loss: 0.8888, test_loss: 0.9832, test_f1: 0.5734
 epoch: 36, train_loss: 0.8653, test_loss: 1.0753, test_f1: 0.5622
 epoch: 37, train_loss: 0.8700, test_loss: 1.0092, test_f1: 0.5653
 epoch: 38, train_loss: 0.8591, test_loss: 1.0889, test_f1: 0.5277
 epoch: 39, train_loss: 0.8692, test_loss: 0.9913, test_f1: 0.5623
 epoch: 40, train_loss: 0.8662, test_loss: 1.0226, test_f1: 0.5754
 epoch: 41, train_loss: 0.8862, test_loss: 0.9907, test_f1: 0.5711
 epoch: 42, train_loss: 0.8673, test_loss: 1.0032, test_f1: 0.5586
 epoch: 43, train_loss: 0.8694, test_loss: 1.0412, test_f1: 0.5358
 epoch: 44, train_loss: 0.8428, test_loss: 0.9899, test_f1: 0.5685
 epoch: 45, train_loss: 0.8411, test_loss: 1.0142, test_f1: 0.5821
 epoch: 46, train_loss: 0.8539, test_loss: 1.0067, test_f1: 0.5679
 epoch: 47, train_loss: 0.8442, test_loss: 0.9957, test_f1: 0.5717
 epoch: 48, train_loss: 0.8430, test_loss: 1.0355, test_f1: 0.5590
 epoch: 49, train_loss: 0.8469, test_loss: 1.0972, test_f1: 0.5803
 epoch: 50, train_loss: 0.8381, test_loss: 1.0438, test_f1: 0.5783
 epoch: 51, train_loss: 0.8482, test_loss: 0.9950, test_f1: 0.6163
 epoch: 52, train_loss: 0.8124, test_loss: 1.0249, test_f1: 0.5596
 epoch: 53, train_loss: 0.8532, test_loss: 1.1936, test_f1: 0.6012
 epoch: 54, train_loss: 0.8289, test_loss: 1.0127, test_f1: 0.5894
 epoch: 55, train_loss: 0.7982, test_loss: 0.9979, test_f1: 0.6201
 epoch: 56, train_loss: 0.8133, test_loss: 1.0280, test_f1: 0.5589
 epoch: 57, train_loss: 0.8088, test_loss: 1.0298, test_f1: 0.5982
 epoch: 58, train_loss: 0.8111, test_loss: 1.0490, test_f1: 0.5962
 epoch: 59, train_loss: 0.8051, test_loss: 1.0350, test_f1: 0.5945
 epoch: 60, train_loss: 0.7988, test_loss: 1.0828, test_f1: 0.5905
 epoch: 61, train_loss: 0.7894, test_loss: 1.1157, test_f1: 0.5759
 epoch: 62, train_loss: 0.8036, test_loss: 1.0997, test_f1: 0.6206
 epoch: 63, train_loss: 0.8087, test_loss: 1.0547, test_f1: 0.5881
 epoch: 64, train_loss: 0.7974, test_loss: 1.0415, test_f1: 0.5704
 epoch: 65, train_loss: 0.7950, test_loss: 1.1266, test_f1: 0.5800
 epoch: 66, train_loss: 0.7991, test_loss: 1.0270, test_f1: 0.5820
 epoch: 67, train_loss: 0.7945, test_loss: 1.0270, test_f1: 0.5921
 epoch: 68, train_loss: 0.7923, test_loss: 1.0604, test_f1: 0.5699
 epoch: 69, train_loss: 0.7780, test_loss: 1.0558, test_f1: 0.6071
 epoch: 70, train_loss: 0.7823, test_loss: 1.1060, test_f1: 0.5882
 epoch: 71, train_loss: 0.7989, test_loss: 1.0556, test_f1: 0.5932
 epoch: 72, train_loss: 0.7730, test_loss: 1.0760, test_f1: 0.5761
 epoch: 73, train_loss: 0.7858, test_loss: 1.1662, test_f1: 0.5773
 epoch: 74, train_loss: 0.7966, test_loss: 1.1758, test_f1: 0.5633
 epoch: 75, train_loss: 0.7856, test_loss: 1.0725, test_f1: 0.5414
 epoch: 76, train_loss: 0.7767, test_loss: 1.1435, test_f1: 0.5856
 epoch: 77, train_loss: 0.7929, test_loss: 1.0757, test_f1: 0.5955
 epoch: 78, train_loss: 0.7892, test_loss: 1.0729, test_f1: 0.5741
 epoch: 79, train_loss: 0.7842, test_loss: 1.1490, test_f1: 0.5653
 epoch: 80, train_loss: 0.7845, test_loss: 1.1283, test_f1: 0.5518
 epoch: 81, train_loss: 0.7726, test_loss: 1.0971, test_f1: 0.5657
 epoch: 82, train_loss: 0.7712, test_loss: 1.1623, test_f1: 0.5568
 epoch: 83, train_loss: 0.7560, test_loss: 1.0407, test_f1: 0.5688
 epoch: 84, train_loss: 0.7652, test_loss: 1.1522, test_f1: 0.5663
 epoch: 85, train_loss: 0.7691, test_loss: 1.0089, test_f1: 0.5896
 epoch: 86, train_loss: 0.7623, test_loss: 1.0566, test_f1: 0.5932
 epoch: 87, train_loss: 0.7446, test_loss: 1.0571, test_f1: 0.5937
 epoch: 88, train_loss: 0.7681, test_loss: 1.0942, test_f1: 0.5412
 epoch: 89, train_loss: 0.7480, test_loss: 1.0516, test_f1: 0.5788
 epoch: 90, train_loss: 0.7625, test_loss: 1.0426, test_f1: 0.6102
 epoch: 91, train_loss: 0.7693, test_loss: 1.0886, test_f1: 0.5438
 epoch: 92, train_loss: 0.7820, test_loss: 1.0358, test_f1: 0.5853
 epoch: 93, train_loss: 0.7519, test_loss: 1.0952, test_f1: 0.6045
 epoch: 94, train_loss: 0.7402, test_loss: 1.1109, test_f1: 0.5743
 epoch: 95, train_loss: 0.7542, test_loss: 1.1170, test_f1: 0.6265
 epoch: 96, train_loss: 0.7422, test_loss: 1.0971, test_f1: 0.5593
 epoch: 97, train_loss: 0.7554, test_loss: 1.0782, test_f1: 0.5825
 epoch: 98, train_loss: 0.7384, test_loss: 1.0670, test_f1: 0.5872
 epoch: 99, train_loss: 0.7614, test_loss: 1.0508, test_f1: 0.5772

Training completed in 668.60 seconds
Best F1: 0.6334 at epoch 57
Mean F1 across iterations: 0.6123  0.0206
========================FINAL RESULTS================================
FEGIN weighted F1: 0.6334  0.0206
python main.py --data ltspice_demos --representation component_component --model FEGIN --layers 4 --hiddens 16 --batch_size 32 --lr 0.01 --emb_size 512 --epochs 100 --save_appendix component_component_L4_H16_BS32_LR0.01_E512 --no_val
-----



STDERR:
  File "main.py", line 370, in <module>
    main()
  File "main.py", line 254, in main
    dataset = dataset_class(
  File "/home/philip/projects/ltspice_examples_code_repo/Circuit-Completion-Using-GNNs/component_classification_with_link_prediction_head/evaluation/FEGIN/kernel/circuit_datasets.py", line 15, in __init__
    self.data, self.slices = torch.load(self.processed_paths[0])
  File "/home/philip/.local/lib/python3.8/site-packages/torch/serialization.py", line 1040, in load
    warnings.warn(
  File "/usr/lib/python3.8/warnings.py", line 109, in _showwarnmsg
    sw(msg.message, msg.category, msg.filename, msg.lineno,
  File "main.py", line 47, in warn_with_traceback
    traceback.print_stack(file=log)
/home/philip/projects/ltspice_examples_code_repo/Circuit-Completion-Using-GNNs/component_classification_with_link_prediction_head/evaluation/FEGIN/kernel/circuit_datasets.py:15: FutureWarning: You are using `torch.load` with `weights_only=False` (the current default value), which uses the default pickle module implicitly. It is possible to construct malicious pickle data which will execute arbitrary code during unpickling (See https://github.com/pytorch/pytorch/blob/main/SECURITY.md#untrusted-models for more details). In a future release, the default value for `weights_only` will be flipped to `True`. This limits the functions that could be executed during unpickling. Arbitrary objects will no longer be allowed to be loaded via this mode unless they are explicitly allowlisted by the user via `torch.serialization.add_safe_globals`. We recommend you start setting `weights_only=True` for any use case where you don't have full control of the loaded file. Please open an issue on GitHub for any issues related to this experimental feature.
  self.data, self.slices = torch.load(self.processed_paths[0])
