STDOUT:
Results will be saved in /home/philip/projects/ltspice_examples_code_repo/Circuit-Completion-Using-GNNs/component_classification_with_link_prediction_head/evaluation/FEGIN/results/model_FEGIN_dataset_ltspice_demos
Command line input: python main.py --data ltspice_demos --representation component_net --model FEGIN --layers 6 --hiddens 64 --batch_size 64 --lr 0.0001 --emb_size 512 --epochs 100 --save_appendix component_net_L6_H64_BS64_LR0.0001_E512 --no_val
 is saved.
-----
ltspice_demos - FEGIN
Using 6 layers, 64 hidden units, h = 2
Loading component_net representation dataset
ENTERED
Training FEGIN on component_net representation
Train: 1565, Test: 383
##################ITERATION #0 ****************************************
 epoch: 0, train_loss: 1.3760, test_loss: 1.3863, test_f1: 0.1365
 epoch: 1, train_loss: 1.3529, test_loss: 1.3746, test_f1: 0.1365
 epoch: 2, train_loss: 1.3337, test_loss: 1.3611, test_f1: 0.1365
 epoch: 3, train_loss: 1.3089, test_loss: 1.3352, test_f1: 0.1365
 epoch: 4, train_loss: 1.2803, test_loss: 1.3066, test_f1: 0.1365
 epoch: 5, train_loss: 1.2491, test_loss: 1.2779, test_f1: 0.1735
 epoch: 6, train_loss: 1.2169, test_loss: 1.2528, test_f1: 0.1977
 epoch: 7, train_loss: 1.1911, test_loss: 1.2324, test_f1: 0.2978
 epoch: 8, train_loss: 1.1681, test_loss: 1.2175, test_f1: 0.3450
 epoch: 9, train_loss: 1.1570, test_loss: 1.2051, test_f1: 0.3054
 epoch: 10, train_loss: 1.1463, test_loss: 1.1958, test_f1: 0.3170
 epoch: 11, train_loss: 1.1403, test_loss: 1.1882, test_f1: 0.3109
 epoch: 12, train_loss: 1.1342, test_loss: 1.1814, test_f1: 0.3103
 epoch: 13, train_loss: 1.1203, test_loss: 1.1746, test_f1: 0.3302
 epoch: 14, train_loss: 1.1155, test_loss: 1.1669, test_f1: 0.3255
 epoch: 15, train_loss: 1.1118, test_loss: 1.1646, test_f1: 0.3208
 epoch: 16, train_loss: 1.1036, test_loss: 1.1549, test_f1: 0.3303
 epoch: 17, train_loss: 1.0915, test_loss: 1.1550, test_f1: 0.3463
 epoch: 18, train_loss: 1.0919, test_loss: 1.1523, test_f1: 0.3714
 epoch: 19, train_loss: 1.0813, test_loss: 1.1399, test_f1: 0.4071
 epoch: 20, train_loss: 1.0741, test_loss: 1.1305, test_f1: 0.4361
 epoch: 21, train_loss: 1.0663, test_loss: 1.1319, test_f1: 0.4339
 epoch: 22, train_loss: 1.0607, test_loss: 1.1253, test_f1: 0.4328
 epoch: 23, train_loss: 1.0607, test_loss: 1.1223, test_f1: 0.4583
 epoch: 24, train_loss: 1.0538, test_loss: 1.1133, test_f1: 0.4718
 epoch: 25, train_loss: 1.0383, test_loss: 1.1130, test_f1: 0.4797
 epoch: 26, train_loss: 1.0326, test_loss: 1.1073, test_f1: 0.4764
 epoch: 27, train_loss: 1.0272, test_loss: 1.1184, test_f1: 0.4475
 epoch: 28, train_loss: 1.0208, test_loss: 1.1238, test_f1: 0.4960
 epoch: 29, train_loss: 1.0173, test_loss: 1.0816, test_f1: 0.4921
 epoch: 30, train_loss: 1.0101, test_loss: 1.0767, test_f1: 0.5036
 epoch: 31, train_loss: 0.9961, test_loss: 1.0764, test_f1: 0.4908
 epoch: 32, train_loss: 0.9903, test_loss: 1.0734, test_f1: 0.4971
 epoch: 33, train_loss: 0.9803, test_loss: 1.0688, test_f1: 0.5183
 epoch: 34, train_loss: 0.9761, test_loss: 1.0685, test_f1: 0.4952
 epoch: 35, train_loss: 0.9737, test_loss: 1.0670, test_f1: 0.5303
 epoch: 36, train_loss: 0.9712, test_loss: 1.0670, test_f1: 0.5281
 epoch: 37, train_loss: 0.9600, test_loss: 1.0609, test_f1: 0.5350
 epoch: 38, train_loss: 0.9446, test_loss: 1.0568, test_f1: 0.5198
 epoch: 39, train_loss: 0.9501, test_loss: 1.0503, test_f1: 0.5204
 epoch: 40, train_loss: 0.9380, test_loss: 1.0449, test_f1: 0.5432
 epoch: 41, train_loss: 0.9338, test_loss: 1.0449, test_f1: 0.5540
 epoch: 42, train_loss: 0.9230, test_loss: 1.0314, test_f1: 0.5458
 epoch: 43, train_loss: 0.9110, test_loss: 1.0521, test_f1: 0.5425
 epoch: 44, train_loss: 0.9158, test_loss: 1.0524, test_f1: 0.5475
 epoch: 45, train_loss: 0.9008, test_loss: 1.0577, test_f1: 0.5197
 epoch: 46, train_loss: 0.8958, test_loss: 1.0640, test_f1: 0.5481
 epoch: 47, train_loss: 0.8895, test_loss: 1.0502, test_f1: 0.5442
 epoch: 48, train_loss: 0.8796, test_loss: 1.0813, test_f1: 0.5382
 epoch: 49, train_loss: 0.8759, test_loss: 1.0688, test_f1: 0.5550
 epoch: 50, train_loss: 0.8724, test_loss: 1.0517, test_f1: 0.5452
 epoch: 51, train_loss: 0.8667, test_loss: 1.0967, test_f1: 0.5450
 epoch: 52, train_loss: 0.8555, test_loss: 1.0907, test_f1: 0.5576
 epoch: 53, train_loss: 0.8680, test_loss: 1.1042, test_f1: 0.5528
 epoch: 54, train_loss: 0.8600, test_loss: 1.0779, test_f1: 0.5659
 epoch: 55, train_loss: 0.8615, test_loss: 1.0852, test_f1: 0.5443
 epoch: 56, train_loss: 0.8442, test_loss: 1.0911, test_f1: 0.5537
 epoch: 57, train_loss: 0.8548, test_loss: 1.1112, test_f1: 0.5441
 epoch: 58, train_loss: 0.8469, test_loss: 1.0834, test_f1: 0.5632
 epoch: 59, train_loss: 0.8572, test_loss: 1.0899, test_f1: 0.5606
 epoch: 60, train_loss: 0.8528, test_loss: 1.0889, test_f1: 0.5489
 epoch: 61, train_loss: 0.8439, test_loss: 1.0870, test_f1: 0.5509
 epoch: 62, train_loss: 0.8496, test_loss: 1.0842, test_f1: 0.5627
 epoch: 63, train_loss: 0.8548, test_loss: 1.1029, test_f1: 0.5550
 epoch: 64, train_loss: 0.8416, test_loss: 1.0754, test_f1: 0.5633
 epoch: 65, train_loss: 0.8460, test_loss: 1.1105, test_f1: 0.5490
 epoch: 66, train_loss: 0.8452, test_loss: 1.1117, test_f1: 0.5409
 epoch: 67, train_loss: 0.8297, test_loss: 1.1421, test_f1: 0.5448
 epoch: 68, train_loss: 0.8278, test_loss: 1.1190, test_f1: 0.5548
 epoch: 69, train_loss: 0.8348, test_loss: 1.1410, test_f1: 0.5456
 epoch: 70, train_loss: 0.8307, test_loss: 1.1130, test_f1: 0.5576
 epoch: 71, train_loss: 0.8325, test_loss: 1.1357, test_f1: 0.5370
 epoch: 72, train_loss: 0.8377, test_loss: 1.1257, test_f1: 0.5526
 epoch: 73, train_loss: 0.8435, test_loss: 1.1207, test_f1: 0.5440
 epoch: 74, train_loss: 0.8200, test_loss: 1.1332, test_f1: 0.5446
 epoch: 75, train_loss: 0.8306, test_loss: 1.1395, test_f1: 0.5363
 epoch: 76, train_loss: 0.8313, test_loss: 1.1373, test_f1: 0.5554
 epoch: 77, train_loss: 0.8073, test_loss: 1.1360, test_f1: 0.5575
 epoch: 78, train_loss: 0.8080, test_loss: 1.1715, test_f1: 0.5192
 epoch: 79, train_loss: 0.8225, test_loss: 1.1576, test_f1: 0.5449
 epoch: 80, train_loss: 0.8389, test_loss: 1.1559, test_f1: 0.5405
 epoch: 81, train_loss: 0.8155, test_loss: 1.1345, test_f1: 0.5500
 epoch: 82, train_loss: 0.8193, test_loss: 1.1634, test_f1: 0.5407
 epoch: 83, train_loss: 0.7982, test_loss: 1.1605, test_f1: 0.5592
 epoch: 84, train_loss: 0.8136, test_loss: 1.1764, test_f1: 0.5446
 epoch: 85, train_loss: 0.8159, test_loss: 1.1837, test_f1: 0.5498
 epoch: 86, train_loss: 0.8114, test_loss: 1.1756, test_f1: 0.5401
 epoch: 87, train_loss: 0.7965, test_loss: 1.1363, test_f1: 0.5474
 epoch: 88, train_loss: 0.8161, test_loss: 1.1784, test_f1: 0.5498
 epoch: 89, train_loss: 0.8018, test_loss: 1.1697, test_f1: 0.5405
 epoch: 90, train_loss: 0.8055, test_loss: 1.1645, test_f1: 0.5383
 epoch: 91, train_loss: 0.8040, test_loss: 1.1977, test_f1: 0.5378
 epoch: 92, train_loss: 0.7950, test_loss: 1.2045, test_f1: 0.5364
 epoch: 93, train_loss: 0.7853, test_loss: 1.1804, test_f1: 0.5317
 epoch: 94, train_loss: 0.7852, test_loss: 1.1824, test_f1: 0.5308
 epoch: 95, train_loss: 0.8010, test_loss: 1.1490, test_f1: 0.5454
 epoch: 96, train_loss: 0.7770, test_loss: 1.2352, test_f1: 0.5269
 epoch: 97, train_loss: 0.7978, test_loss: 1.2195, test_f1: 0.5388
 epoch: 98, train_loss: 0.7933, test_loss: 1.2140, test_f1: 0.5410
 epoch: 99, train_loss: 0.8059, test_loss: 1.1962, test_f1: 0.5432
##################ITERATION #1 ****************************************
 epoch: 0, train_loss: 1.3370, test_loss: 1.3620, test_f1: 0.1365
 epoch: 1, train_loss: 1.2745, test_loss: 1.3218, test_f1: 0.2057
 epoch: 2, train_loss: 1.2314, test_loss: 1.2627, test_f1: 0.2744
 epoch: 3, train_loss: 1.2028, test_loss: 1.2316, test_f1: 0.3357
 epoch: 4, train_loss: 1.1763, test_loss: 1.2055, test_f1: 0.3580
 epoch: 5, train_loss: 1.1567, test_loss: 1.1878, test_f1: 0.3899
 epoch: 6, train_loss: 1.1366, test_loss: 1.1709, test_f1: 0.3985
 epoch: 7, train_loss: 1.1210, test_loss: 1.1600, test_f1: 0.4342
 epoch: 8, train_loss: 1.1064, test_loss: 1.1457, test_f1: 0.4355
 epoch: 9, train_loss: 1.0961, test_loss: 1.1342, test_f1: 0.4551
 epoch: 10, train_loss: 1.0876, test_loss: 1.1274, test_f1: 0.4758
 epoch: 11, train_loss: 1.0805, test_loss: 1.1195, test_f1: 0.4789
 epoch: 12, train_loss: 1.0665, test_loss: 1.1111, test_f1: 0.4784
 epoch: 13, train_loss: 1.0568, test_loss: 1.1007, test_f1: 0.4856
 epoch: 14, train_loss: 1.0457, test_loss: 1.0992, test_f1: 0.4832
 epoch: 15, train_loss: 1.0427, test_loss: 1.0963, test_f1: 0.4878
 epoch: 16, train_loss: 1.0356, test_loss: 1.0845, test_f1: 0.4911
 epoch: 17, train_loss: 1.0233, test_loss: 1.0747, test_f1: 0.4969
 epoch: 18, train_loss: 1.0150, test_loss: 1.0699, test_f1: 0.4927
 epoch: 19, train_loss: 1.0094, test_loss: 1.0620, test_f1: 0.4881
 epoch: 20, train_loss: 0.9913, test_loss: 1.0434, test_f1: 0.5079
 epoch: 21, train_loss: 0.9865, test_loss: 1.0515, test_f1: 0.5157
 epoch: 22, train_loss: 0.9746, test_loss: 1.0360, test_f1: 0.5295
 epoch: 23, train_loss: 0.9629, test_loss: 1.0482, test_f1: 0.5186
 epoch: 24, train_loss: 0.9710, test_loss: 1.0238, test_f1: 0.5161
 epoch: 25, train_loss: 0.9609, test_loss: 1.0333, test_f1: 0.5235
 epoch: 26, train_loss: 0.9470, test_loss: 1.0298, test_f1: 0.5217
 epoch: 27, train_loss: 0.9507, test_loss: 1.0229, test_f1: 0.5299
 epoch: 28, train_loss: 0.9408, test_loss: 1.0270, test_f1: 0.5306
 epoch: 29, train_loss: 0.9375, test_loss: 1.0278, test_f1: 0.5341
 epoch: 30, train_loss: 0.9206, test_loss: 1.0320, test_f1: 0.5312
 epoch: 31, train_loss: 0.9384, test_loss: 1.0439, test_f1: 0.5382
 epoch: 32, train_loss: 0.9141, test_loss: 1.0050, test_f1: 0.5539
 epoch: 33, train_loss: 0.9162, test_loss: 1.0136, test_f1: 0.5496
 epoch: 34, train_loss: 0.9176, test_loss: 1.0114, test_f1: 0.5521
 epoch: 35, train_loss: 0.9008, test_loss: 0.9980, test_f1: 0.5473
 epoch: 36, train_loss: 0.9021, test_loss: 1.0247, test_f1: 0.5381
 epoch: 37, train_loss: 0.8894, test_loss: 1.0222, test_f1: 0.5523
 epoch: 38, train_loss: 0.8821, test_loss: 1.0272, test_f1: 0.5546
 epoch: 39, train_loss: 0.8765, test_loss: 1.0107, test_f1: 0.5571
 epoch: 40, train_loss: 0.8833, test_loss: 1.0040, test_f1: 0.5521
 epoch: 41, train_loss: 0.8758, test_loss: 1.0333, test_f1: 0.5566
 epoch: 42, train_loss: 0.8694, test_loss: 1.0364, test_f1: 0.5514
 epoch: 43, train_loss: 0.8695, test_loss: 1.0325, test_f1: 0.5496
 epoch: 44, train_loss: 0.8630, test_loss: 0.9983, test_f1: 0.5553
 epoch: 45, train_loss: 0.8549, test_loss: 1.0106, test_f1: 0.5602
 epoch: 46, train_loss: 0.8568, test_loss: 1.0117, test_f1: 0.5605
 epoch: 47, train_loss: 0.8396, test_loss: 1.0268, test_f1: 0.5653
 epoch: 48, train_loss: 0.8372, test_loss: 1.0126, test_f1: 0.5601
 epoch: 49, train_loss: 0.8344, test_loss: 1.0280, test_f1: 0.5708
 epoch: 50, train_loss: 0.8378, test_loss: 1.0502, test_f1: 0.5557
 epoch: 51, train_loss: 0.8387, test_loss: 1.0347, test_f1: 0.5645
 epoch: 52, train_loss: 0.8316, test_loss: 1.0555, test_f1: 0.5805
 epoch: 53, train_loss: 0.8281, test_loss: 1.0368, test_f1: 0.5641
 epoch: 54, train_loss: 0.8133, test_loss: 1.0387, test_f1: 0.5768
 epoch: 55, train_loss: 0.8159, test_loss: 1.0416, test_f1: 0.5778
 epoch: 56, train_loss: 0.8174, test_loss: 1.0333, test_f1: 0.5623
 epoch: 57, train_loss: 0.8217, test_loss: 1.0491, test_f1: 0.5680
 epoch: 58, train_loss: 0.8197, test_loss: 1.0384, test_f1: 0.5711
 epoch: 59, train_loss: 0.8201, test_loss: 1.0245, test_f1: 0.5745
 epoch: 60, train_loss: 0.8041, test_loss: 1.0434, test_f1: 0.5799
 epoch: 61, train_loss: 0.8085, test_loss: 1.0461, test_f1: 0.5648
 epoch: 62, train_loss: 0.8144, test_loss: 1.0802, test_f1: 0.5784
 epoch: 63, train_loss: 0.8036, test_loss: 1.0514, test_f1: 0.5730
 epoch: 64, train_loss: 0.8085, test_loss: 1.0654, test_f1: 0.5700
 epoch: 65, train_loss: 0.8090, test_loss: 1.0715, test_f1: 0.5790
 epoch: 66, train_loss: 0.8043, test_loss: 1.0744, test_f1: 0.5771
 epoch: 67, train_loss: 0.8030, test_loss: 1.0666, test_f1: 0.5614
 epoch: 68, train_loss: 0.8081, test_loss: 1.0693, test_f1: 0.5831
 epoch: 69, train_loss: 0.8031, test_loss: 1.0955, test_f1: 0.5704
 epoch: 70, train_loss: 0.8010, test_loss: 1.0621, test_f1: 0.5643
 epoch: 71, train_loss: 0.7980, test_loss: 1.0635, test_f1: 0.5717
 epoch: 72, train_loss: 0.7837, test_loss: 1.0770, test_f1: 0.5723
 epoch: 73, train_loss: 0.7916, test_loss: 1.0619, test_f1: 0.5643
 epoch: 74, train_loss: 0.7913, test_loss: 1.0761, test_f1: 0.5618
 epoch: 75, train_loss: 0.7889, test_loss: 1.0963, test_f1: 0.5562
 epoch: 76, train_loss: 0.7869, test_loss: 1.0922, test_f1: 0.5714
 epoch: 77, train_loss: 0.7921, test_loss: 1.0822, test_f1: 0.5654
 epoch: 78, train_loss: 0.7875, test_loss: 1.0799, test_f1: 0.5667
 epoch: 79, train_loss: 0.7798, test_loss: 1.0859, test_f1: 0.5640
 epoch: 80, train_loss: 0.7787, test_loss: 1.1103, test_f1: 0.5615
 epoch: 81, train_loss: 0.7844, test_loss: 1.0850, test_f1: 0.5610
 epoch: 82, train_loss: 0.7751, test_loss: 1.1079, test_f1: 0.5604
 epoch: 83, train_loss: 0.7660, test_loss: 1.0968, test_f1: 0.5677
 epoch: 84, train_loss: 0.7752, test_loss: 1.0728, test_f1: 0.5758
 epoch: 85, train_loss: 0.7726, test_loss: 1.0942, test_f1: 0.5697
 epoch: 86, train_loss: 0.7796, test_loss: 1.0900, test_f1: 0.5758
 epoch: 87, train_loss: 0.7788, test_loss: 1.1005, test_f1: 0.5704
 epoch: 88, train_loss: 0.7827, test_loss: 1.1054, test_f1: 0.5723
 epoch: 89, train_loss: 0.7687, test_loss: 1.1223, test_f1: 0.5802
 epoch: 90, train_loss: 0.7822, test_loss: 1.1140, test_f1: 0.5801
 epoch: 91, train_loss: 0.7555, test_loss: 1.1408, test_f1: 0.5727
 epoch: 92, train_loss: 0.7624, test_loss: 1.1595, test_f1: 0.5603
 epoch: 93, train_loss: 0.7617, test_loss: 1.1354, test_f1: 0.5761
 epoch: 94, train_loss: 0.7711, test_loss: 1.1459, test_f1: 0.5712
 epoch: 95, train_loss: 0.7659, test_loss: 1.1617, test_f1: 0.5716
 epoch: 96, train_loss: 0.7694, test_loss: 1.1405, test_f1: 0.5740
 epoch: 97, train_loss: 0.7627, test_loss: 1.1732, test_f1: 0.5673
 epoch: 98, train_loss: 0.7698, test_loss: 1.1098, test_f1: 0.5649
 epoch: 99, train_loss: 0.7591, test_loss: 1.1586, test_f1: 0.5617
##################ITERATION #2 ****************************************
 epoch: 0, train_loss: 1.2758, test_loss: 1.3468, test_f1: 0.2281
 epoch: 1, train_loss: 1.2078, test_loss: 1.3248, test_f1: 0.2614
 epoch: 2, train_loss: 1.1758, test_loss: 1.2904, test_f1: 0.3401
 epoch: 3, train_loss: 1.1538, test_loss: 1.2249, test_f1: 0.4002
 epoch: 4, train_loss: 1.1321, test_loss: 1.1842, test_f1: 0.4234
 epoch: 5, train_loss: 1.1093, test_loss: 1.1637, test_f1: 0.4733
 epoch: 6, train_loss: 1.0963, test_loss: 1.1433, test_f1: 0.4837
 epoch: 7, train_loss: 1.0816, test_loss: 1.1296, test_f1: 0.4927
 epoch: 8, train_loss: 1.0644, test_loss: 1.1214, test_f1: 0.4682
 epoch: 9, train_loss: 1.0657, test_loss: 1.1061, test_f1: 0.4983
 epoch: 10, train_loss: 1.0370, test_loss: 1.1029, test_f1: 0.5176
 epoch: 11, train_loss: 1.0245, test_loss: 1.0984, test_f1: 0.5113
 epoch: 12, train_loss: 1.0168, test_loss: 1.0904, test_f1: 0.5101
 epoch: 13, train_loss: 1.0079, test_loss: 1.0836, test_f1: 0.5174
 epoch: 14, train_loss: 0.9954, test_loss: 1.0758, test_f1: 0.5200
 epoch: 15, train_loss: 0.9862, test_loss: 1.0640, test_f1: 0.5359
 epoch: 16, train_loss: 0.9726, test_loss: 1.0704, test_f1: 0.5257
 epoch: 17, train_loss: 0.9609, test_loss: 1.0749, test_f1: 0.5265
 epoch: 18, train_loss: 0.9540, test_loss: 1.0577, test_f1: 0.5168
 epoch: 19, train_loss: 0.9521, test_loss: 1.0612, test_f1: 0.5374
 epoch: 20, train_loss: 0.9373, test_loss: 1.0682, test_f1: 0.5343
 epoch: 21, train_loss: 0.9371, test_loss: 1.0465, test_f1: 0.5329
 epoch: 22, train_loss: 0.9367, test_loss: 1.0592, test_f1: 0.5306
 epoch: 23, train_loss: 0.9288, test_loss: 1.0616, test_f1: 0.5144
 epoch: 24, train_loss: 0.9181, test_loss: 1.0293, test_f1: 0.5307
 epoch: 25, train_loss: 0.9172, test_loss: 1.0410, test_f1: 0.5440
 epoch: 26, train_loss: 0.9014, test_loss: 1.0212, test_f1: 0.5570
 epoch: 27, train_loss: 0.9078, test_loss: 1.0276, test_f1: 0.5571
 epoch: 28, train_loss: 0.9023, test_loss: 1.0372, test_f1: 0.5403
 epoch: 29, train_loss: 0.8956, test_loss: 1.0312, test_f1: 0.5410
 epoch: 30, train_loss: 0.8964, test_loss: 1.0216, test_f1: 0.5450
 epoch: 31, train_loss: 0.8901, test_loss: 1.0326, test_f1: 0.5568
 epoch: 32, train_loss: 0.8795, test_loss: 1.0567, test_f1: 0.5657
 epoch: 33, train_loss: 0.8796, test_loss: 1.0503, test_f1: 0.5744
 epoch: 34, train_loss: 0.8717, test_loss: 1.0157, test_f1: 0.5755
 epoch: 35, train_loss: 0.8587, test_loss: 1.0127, test_f1: 0.5612
 epoch: 36, train_loss: 0.8651, test_loss: 1.0304, test_f1: 0.5807
 epoch: 37, train_loss: 0.8699, test_loss: 1.0331, test_f1: 0.5783
 epoch: 38, train_loss: 0.8657, test_loss: 1.0307, test_f1: 0.5699
 epoch: 39, train_loss: 0.8604, test_loss: 1.0077, test_f1: 0.5912
 epoch: 40, train_loss: 0.8452, test_loss: 1.0244, test_f1: 0.5589
 epoch: 41, train_loss: 0.8457, test_loss: 1.0322, test_f1: 0.5929
 epoch: 42, train_loss: 0.8421, test_loss: 1.0203, test_f1: 0.5913
 epoch: 43, train_loss: 0.8409, test_loss: 0.9951, test_f1: 0.5752
 epoch: 44, train_loss: 0.8354, test_loss: 1.0223, test_f1: 0.5804
 epoch: 45, train_loss: 0.8326, test_loss: 1.0441, test_f1: 0.5760
 epoch: 46, train_loss: 0.8179, test_loss: 1.0734, test_f1: 0.5668
 epoch: 47, train_loss: 0.8236, test_loss: 1.0039, test_f1: 0.5910
 epoch: 48, train_loss: 0.8146, test_loss: 1.0100, test_f1: 0.5853
 epoch: 49, train_loss: 0.8271, test_loss: 1.0302, test_f1: 0.5701
 epoch: 50, train_loss: 0.8265, test_loss: 1.0314, test_f1: 0.5796
 epoch: 51, train_loss: 0.7975, test_loss: 1.0341, test_f1: 0.5762
 epoch: 52, train_loss: 0.7994, test_loss: 1.0287, test_f1: 0.6117
 epoch: 53, train_loss: 0.7901, test_loss: 1.0308, test_f1: 0.5987
 epoch: 54, train_loss: 0.7988, test_loss: 1.0257, test_f1: 0.5986
 epoch: 55, train_loss: 0.7863, test_loss: 1.0429, test_f1: 0.5815
 epoch: 56, train_loss: 0.7928, test_loss: 1.0385, test_f1: 0.5761
 epoch: 57, train_loss: 0.7885, test_loss: 1.0379, test_f1: 0.5892
 epoch: 58, train_loss: 0.7925, test_loss: 1.0354, test_f1: 0.5809
 epoch: 59, train_loss: 0.7712, test_loss: 1.0509, test_f1: 0.5912
 epoch: 60, train_loss: 0.7973, test_loss: 1.0301, test_f1: 0.5947
 epoch: 61, train_loss: 0.7870, test_loss: 1.0167, test_f1: 0.6066
 epoch: 62, train_loss: 0.7946, test_loss: 1.0384, test_f1: 0.6108
 epoch: 63, train_loss: 0.7914, test_loss: 1.0054, test_f1: 0.6121
 epoch: 64, train_loss: 0.7799, test_loss: 1.0253, test_f1: 0.5924
 epoch: 65, train_loss: 0.7785, test_loss: 1.0181, test_f1: 0.5927
 epoch: 66, train_loss: 0.7677, test_loss: 1.0428, test_f1: 0.5710
 epoch: 67, train_loss: 0.7628, test_loss: 1.0226, test_f1: 0.5830
 epoch: 68, train_loss: 0.7711, test_loss: 1.0204, test_f1: 0.5934
 epoch: 69, train_loss: 0.7692, test_loss: 1.0331, test_f1: 0.5687
 epoch: 70, train_loss: 0.7696, test_loss: 1.0532, test_f1: 0.5813
 epoch: 71, train_loss: 0.7683, test_loss: 1.0259, test_f1: 0.6032
 epoch: 72, train_loss: 0.7537, test_loss: 1.0289, test_f1: 0.5846
 epoch: 73, train_loss: 0.7564, test_loss: 1.0380, test_f1: 0.5836
 epoch: 74, train_loss: 0.7543, test_loss: 1.0565, test_f1: 0.5840
 epoch: 75, train_loss: 0.7421, test_loss: 1.0434, test_f1: 0.5831
 epoch: 76, train_loss: 0.7417, test_loss: 1.0411, test_f1: 0.5921
 epoch: 77, train_loss: 0.7495, test_loss: 1.0368, test_f1: 0.6045
 epoch: 78, train_loss: 0.7569, test_loss: 1.0719, test_f1: 0.5942
 epoch: 79, train_loss: 0.7638, test_loss: 1.0754, test_f1: 0.5775
 epoch: 80, train_loss: 0.7374, test_loss: 1.0427, test_f1: 0.6101
 epoch: 81, train_loss: 0.7567, test_loss: 1.0534, test_f1: 0.5948
 epoch: 82, train_loss: 0.7369, test_loss: 1.0659, test_f1: 0.5894
 epoch: 83, train_loss: 0.7580, test_loss: 1.0581, test_f1: 0.5875
 epoch: 84, train_loss: 0.7451, test_loss: 1.0710, test_f1: 0.5998
 epoch: 85, train_loss: 0.7219, test_loss: 1.0582, test_f1: 0.6043
 epoch: 86, train_loss: 0.7373, test_loss: 1.0746, test_f1: 0.6057
 epoch: 87, train_loss: 0.7447, test_loss: 1.0543, test_f1: 0.5766
 epoch: 88, train_loss: 0.7369, test_loss: 1.0456, test_f1: 0.6070
 epoch: 89, train_loss: 0.7491, test_loss: 1.1063, test_f1: 0.5804
 epoch: 90, train_loss: 0.7384, test_loss: 1.0860, test_f1: 0.5800
 epoch: 91, train_loss: 0.7228, test_loss: 1.0804, test_f1: 0.5921
 epoch: 92, train_loss: 0.7275, test_loss: 1.0951, test_f1: 0.5943
 epoch: 93, train_loss: 0.7243, test_loss: 1.1212, test_f1: 0.5738
 epoch: 94, train_loss: 0.7372, test_loss: 1.0834, test_f1: 0.5830
 epoch: 95, train_loss: 0.7325, test_loss: 1.0950, test_f1: 0.5954
 epoch: 96, train_loss: 0.7210, test_loss: 1.1047, test_f1: 0.5938
 epoch: 97, train_loss: 0.7069, test_loss: 1.1139, test_f1: 0.6108
 epoch: 98, train_loss: 0.7124, test_loss: 1.1016, test_f1: 0.5858
 epoch: 99, train_loss: 0.7259, test_loss: 1.0853, test_f1: 0.5942
##################ITERATION #3 ****************************************
 epoch: 0, train_loss: 1.2634, test_loss: 1.3462, test_f1: 0.2281
 epoch: 1, train_loss: 1.2036, test_loss: 1.2786, test_f1: 0.2583
 epoch: 2, train_loss: 1.1747, test_loss: 1.2469, test_f1: 0.2520
 epoch: 3, train_loss: 1.1520, test_loss: 1.2187, test_f1: 0.3038
 epoch: 4, train_loss: 1.1312, test_loss: 1.1951, test_f1: 0.4034
 epoch: 5, train_loss: 1.1144, test_loss: 1.1840, test_f1: 0.4276
 epoch: 6, train_loss: 1.0988, test_loss: 1.1701, test_f1: 0.4229
 epoch: 7, train_loss: 1.0855, test_loss: 1.1600, test_f1: 0.4234
 epoch: 8, train_loss: 1.0802, test_loss: 1.1496, test_f1: 0.4485
 epoch: 9, train_loss: 1.0626, test_loss: 1.1390, test_f1: 0.4583
 epoch: 10, train_loss: 1.0474, test_loss: 1.1387, test_f1: 0.4707
 epoch: 11, train_loss: 1.0315, test_loss: 1.1164, test_f1: 0.4882
 epoch: 12, train_loss: 1.0374, test_loss: 1.1095, test_f1: 0.5004
 epoch: 13, train_loss: 1.0138, test_loss: 1.0979, test_f1: 0.4986
 epoch: 14, train_loss: 1.0056, test_loss: 1.1024, test_f1: 0.4921
 epoch: 15, train_loss: 1.0084, test_loss: 1.0829, test_f1: 0.5151
 epoch: 16, train_loss: 0.9875, test_loss: 1.0775, test_f1: 0.4991
 epoch: 17, train_loss: 0.9768, test_loss: 1.0656, test_f1: 0.5131
 epoch: 18, train_loss: 0.9756, test_loss: 1.0705, test_f1: 0.5151
 epoch: 19, train_loss: 0.9630, test_loss: 1.0648, test_f1: 0.5101
 epoch: 20, train_loss: 0.9596, test_loss: 1.0590, test_f1: 0.5256
 epoch: 21, train_loss: 0.9625, test_loss: 1.0710, test_f1: 0.5304
 epoch: 22, train_loss: 0.9467, test_loss: 1.0484, test_f1: 0.5369
 epoch: 23, train_loss: 0.9397, test_loss: 1.0527, test_f1: 0.5366
 epoch: 24, train_loss: 0.9332, test_loss: 1.0341, test_f1: 0.5385
 epoch: 25, train_loss: 0.9275, test_loss: 1.0389, test_f1: 0.5393
 epoch: 26, train_loss: 0.9230, test_loss: 1.0534, test_f1: 0.5369
 epoch: 27, train_loss: 0.9229, test_loss: 1.0555, test_f1: 0.5351
 epoch: 28, train_loss: 0.9047, test_loss: 1.0398, test_f1: 0.5339
 epoch: 29, train_loss: 0.9111, test_loss: 1.0371, test_f1: 0.5508
 epoch: 30, train_loss: 0.9074, test_loss: 1.0454, test_f1: 0.5518
 epoch: 31, train_loss: 0.8945, test_loss: 1.0277, test_f1: 0.5502
 epoch: 32, train_loss: 0.8859, test_loss: 1.0550, test_f1: 0.5570
 epoch: 33, train_loss: 0.8685, test_loss: 1.0663, test_f1: 0.5410
 epoch: 34, train_loss: 0.8778, test_loss: 1.0521, test_f1: 0.5381
 epoch: 35, train_loss: 0.8819, test_loss: 1.0579, test_f1: 0.5309
 epoch: 36, train_loss: 0.8667, test_loss: 1.0489, test_f1: 0.5289
 epoch: 37, train_loss: 0.8678, test_loss: 1.0501, test_f1: 0.5373
 epoch: 38, train_loss: 0.8679, test_loss: 1.0857, test_f1: 0.5276
 epoch: 39, train_loss: 0.8590, test_loss: 1.0496, test_f1: 0.5543
 epoch: 40, train_loss: 0.8506, test_loss: 1.0598, test_f1: 0.5443
 epoch: 41, train_loss: 0.8416, test_loss: 1.0578, test_f1: 0.5510
 epoch: 42, train_loss: 0.8484, test_loss: 1.0496, test_f1: 0.5603
 epoch: 43, train_loss: 0.8374, test_loss: 1.1022, test_f1: 0.5504
 epoch: 44, train_loss: 0.8387, test_loss: 1.0788, test_f1: 0.5375
 epoch: 45, train_loss: 0.8233, test_loss: 1.0847, test_f1: 0.5415
 epoch: 46, train_loss: 0.8183, test_loss: 1.0754, test_f1: 0.5685
 epoch: 47, train_loss: 0.8207, test_loss: 1.0741, test_f1: 0.5585
 epoch: 48, train_loss: 0.8264, test_loss: 1.1089, test_f1: 0.5279
 epoch: 49, train_loss: 0.8252, test_loss: 1.0756, test_f1: 0.5466
 epoch: 50, train_loss: 0.8146, test_loss: 1.1204, test_f1: 0.5568
 epoch: 51, train_loss: 0.8111, test_loss: 1.1209, test_f1: 0.5488
 epoch: 52, train_loss: 0.7958, test_loss: 1.0989, test_f1: 0.5419
 epoch: 53, train_loss: 0.8011, test_loss: 1.1154, test_f1: 0.5448
 epoch: 54, train_loss: 0.8034, test_loss: 1.1026, test_f1: 0.5472
 epoch: 55, train_loss: 0.7919, test_loss: 1.0910, test_f1: 0.5514
 epoch: 56, train_loss: 0.7965, test_loss: 1.1078, test_f1: 0.5524
 epoch: 57, train_loss: 0.7845, test_loss: 1.1472, test_f1: 0.5586
 epoch: 58, train_loss: 0.7876, test_loss: 1.1445, test_f1: 0.5555
 epoch: 59, train_loss: 0.7904, test_loss: 1.1327, test_f1: 0.5549
 epoch: 60, train_loss: 0.7664, test_loss: 1.1234, test_f1: 0.5690
 epoch: 61, train_loss: 0.7837, test_loss: 1.1249, test_f1: 0.5630
 epoch: 62, train_loss: 0.7779, test_loss: 1.1200, test_f1: 0.5634
 epoch: 63, train_loss: 0.7891, test_loss: 1.1307, test_f1: 0.5709
 epoch: 64, train_loss: 0.7738, test_loss: 1.1533, test_f1: 0.5512
 epoch: 65, train_loss: 0.7825, test_loss: 1.1173, test_f1: 0.5597
 epoch: 66, train_loss: 0.7794, test_loss: 1.1355, test_f1: 0.5547
 epoch: 67, train_loss: 0.7812, test_loss: 1.1266, test_f1: 0.5689
 epoch: 68, train_loss: 0.7811, test_loss: 1.1546, test_f1: 0.5668
 epoch: 69, train_loss: 0.7671, test_loss: 1.1706, test_f1: 0.5638
 epoch: 70, train_loss: 0.7633, test_loss: 1.1285, test_f1: 0.5540
 epoch: 71, train_loss: 0.7693, test_loss: 1.1685, test_f1: 0.5518
 epoch: 72, train_loss: 0.7750, test_loss: 1.1383, test_f1: 0.5641
 epoch: 73, train_loss: 0.7590, test_loss: 1.1644, test_f1: 0.5572
 epoch: 74, train_loss: 0.7615, test_loss: 1.1692, test_f1: 0.5572
 epoch: 75, train_loss: 0.7621, test_loss: 1.1513, test_f1: 0.5561
 epoch: 76, train_loss: 0.7581, test_loss: 1.1548, test_f1: 0.5725
 epoch: 77, train_loss: 0.7541, test_loss: 1.1441, test_f1: 0.5679
 epoch: 78, train_loss: 0.7762, test_loss: 1.1418, test_f1: 0.5634
 epoch: 79, train_loss: 0.7709, test_loss: 1.1684, test_f1: 0.5699
 epoch: 80, train_loss: 0.7662, test_loss: 1.1744, test_f1: 0.5705
 epoch: 81, train_loss: 0.7574, test_loss: 1.1428, test_f1: 0.5614
 epoch: 82, train_loss: 0.7656, test_loss: 1.1558, test_f1: 0.5694
 epoch: 83, train_loss: 0.7619, test_loss: 1.1665, test_f1: 0.5686
 epoch: 84, train_loss: 0.7644, test_loss: 1.1781, test_f1: 0.5685
 epoch: 85, train_loss: 0.7429, test_loss: 1.1672, test_f1: 0.5714
 epoch: 86, train_loss: 0.7405, test_loss: 1.1917, test_f1: 0.5691
 epoch: 87, train_loss: 0.7543, test_loss: 1.1967, test_f1: 0.5717
 epoch: 88, train_loss: 0.7532, test_loss: 1.1570, test_f1: 0.5495
 epoch: 89, train_loss: 0.7513, test_loss: 1.1751, test_f1: 0.5616
 epoch: 90, train_loss: 0.7549, test_loss: 1.1652, test_f1: 0.5637
 epoch: 91, train_loss: 0.7228, test_loss: 1.1782, test_f1: 0.5716
 epoch: 92, train_loss: 0.7278, test_loss: 1.1574, test_f1: 0.5607
 epoch: 93, train_loss: 0.7389, test_loss: 1.1805, test_f1: 0.5564
 epoch: 94, train_loss: 0.7384, test_loss: 1.1522, test_f1: 0.5690
 epoch: 95, train_loss: 0.7273, test_loss: 1.1638, test_f1: 0.5761
 epoch: 96, train_loss: 0.7468, test_loss: 1.1782, test_f1: 0.5705
 epoch: 97, train_loss: 0.7255, test_loss: 1.2015, test_f1: 0.5654
 epoch: 98, train_loss: 0.7189, test_loss: 1.1918, test_f1: 0.5626
 epoch: 99, train_loss: 0.7215, test_loss: 1.1887, test_f1: 0.5657
##################ITERATION #4 ****************************************
 epoch: 0, train_loss: 1.2682, test_loss: 1.3681, test_f1: 0.2585
 epoch: 1, train_loss: 1.1695, test_loss: 1.2803, test_f1: 0.2604
 epoch: 2, train_loss: 1.1376, test_loss: 1.2168, test_f1: 0.3558
 epoch: 3, train_loss: 1.1197, test_loss: 1.1778, test_f1: 0.3501
 epoch: 4, train_loss: 1.0960, test_loss: 1.1505, test_f1: 0.3839
 epoch: 5, train_loss: 1.0776, test_loss: 1.1336, test_f1: 0.4180
 epoch: 6, train_loss: 1.0718, test_loss: 1.1183, test_f1: 0.4145
 epoch: 7, train_loss: 1.0535, test_loss: 1.1118, test_f1: 0.4396
 epoch: 8, train_loss: 1.0449, test_loss: 1.1046, test_f1: 0.4590
 epoch: 9, train_loss: 1.0207, test_loss: 1.0916, test_f1: 0.4783
 epoch: 10, train_loss: 1.0094, test_loss: 1.0817, test_f1: 0.4826
 epoch: 11, train_loss: 1.0114, test_loss: 1.0754, test_f1: 0.4703
 epoch: 12, train_loss: 0.9918, test_loss: 1.0737, test_f1: 0.4745
 epoch: 13, train_loss: 0.9898, test_loss: 1.0758, test_f1: 0.4992
 epoch: 14, train_loss: 0.9820, test_loss: 1.0632, test_f1: 0.5002
 epoch: 15, train_loss: 0.9698, test_loss: 1.0644, test_f1: 0.5018
 epoch: 16, train_loss: 0.9722, test_loss: 1.0664, test_f1: 0.4882
 epoch: 17, train_loss: 0.9504, test_loss: 1.0542, test_f1: 0.5023
 epoch: 18, train_loss: 0.9369, test_loss: 1.0600, test_f1: 0.5155
 epoch: 19, train_loss: 0.9419, test_loss: 1.0564, test_f1: 0.5066
 epoch: 20, train_loss: 0.9304, test_loss: 1.0468, test_f1: 0.5244
 epoch: 21, train_loss: 0.9401, test_loss: 1.0497, test_f1: 0.5081
 epoch: 22, train_loss: 0.9169, test_loss: 1.0448, test_f1: 0.5087
 epoch: 23, train_loss: 0.9182, test_loss: 1.0711, test_f1: 0.5046
 epoch: 24, train_loss: 0.9087, test_loss: 1.0620, test_f1: 0.5258
 epoch: 25, train_loss: 0.9050, test_loss: 1.0448, test_f1: 0.5196
 epoch: 26, train_loss: 0.9047, test_loss: 1.0359, test_f1: 0.5217
 epoch: 27, train_loss: 0.8952, test_loss: 1.0384, test_f1: 0.5277
 epoch: 28, train_loss: 0.9039, test_loss: 1.0438, test_f1: 0.5115
 epoch: 29, train_loss: 0.8976, test_loss: 1.0354, test_f1: 0.5419
 epoch: 30, train_loss: 0.8836, test_loss: 1.0422, test_f1: 0.5420
 epoch: 31, train_loss: 0.8723, test_loss: 1.0526, test_f1: 0.5450
 epoch: 32, train_loss: 0.8708, test_loss: 1.0315, test_f1: 0.5695
 epoch: 33, train_loss: 0.8610, test_loss: 1.0587, test_f1: 0.5363
 epoch: 34, train_loss: 0.8652, test_loss: 1.0717, test_f1: 0.5871
 epoch: 35, train_loss: 0.8614, test_loss: 1.0706, test_f1: 0.5428
 epoch: 36, train_loss: 0.8570, test_loss: 1.0542, test_f1: 0.5707
 epoch: 37, train_loss: 0.8511, test_loss: 1.0856, test_f1: 0.5497
 epoch: 38, train_loss: 0.8477, test_loss: 1.0574, test_f1: 0.5595
 epoch: 39, train_loss: 0.8461, test_loss: 1.0776, test_f1: 0.5667
 epoch: 40, train_loss: 0.8383, test_loss: 1.0600, test_f1: 0.5849
 epoch: 41, train_loss: 0.8385, test_loss: 1.0748, test_f1: 0.5612
 epoch: 42, train_loss: 0.8212, test_loss: 1.0510, test_f1: 0.5635
 epoch: 43, train_loss: 0.8307, test_loss: 1.0398, test_f1: 0.5699
 epoch: 44, train_loss: 0.8171, test_loss: 1.0881, test_f1: 0.5565
 epoch: 45, train_loss: 0.8205, test_loss: 1.1033, test_f1: 0.5525
 epoch: 46, train_loss: 0.8238, test_loss: 1.0681, test_f1: 0.5817
 epoch: 47, train_loss: 0.8133, test_loss: 1.0821, test_f1: 0.5710
 epoch: 48, train_loss: 0.8043, test_loss: 1.0946, test_f1: 0.5778
 epoch: 49, train_loss: 0.7992, test_loss: 1.1299, test_f1: 0.5618
 epoch: 50, train_loss: 0.7986, test_loss: 1.0690, test_f1: 0.5699
 epoch: 51, train_loss: 0.7909, test_loss: 1.1030, test_f1: 0.5636
 epoch: 52, train_loss: 0.7974, test_loss: 1.1083, test_f1: 0.5763
 epoch: 53, train_loss: 0.7830, test_loss: 1.1385, test_f1: 0.5788
 epoch: 54, train_loss: 0.7695, test_loss: 1.1369, test_f1: 0.5603
 epoch: 55, train_loss: 0.7776, test_loss: 1.1555, test_f1: 0.5723
 epoch: 56, train_loss: 0.7900, test_loss: 1.1966, test_f1: 0.5724
 epoch: 57, train_loss: 0.7749, test_loss: 1.1620, test_f1: 0.5754
 epoch: 58, train_loss: 0.7637, test_loss: 1.1678, test_f1: 0.5749
 epoch: 59, train_loss: 0.7641, test_loss: 1.1677, test_f1: 0.5857
 epoch: 60, train_loss: 0.7577, test_loss: 1.1679, test_f1: 0.5741
 epoch: 61, train_loss: 0.7631, test_loss: 1.1795, test_f1: 0.5690
 epoch: 62, train_loss: 0.7673, test_loss: 1.1430, test_f1: 0.5690
 epoch: 63, train_loss: 0.7709, test_loss: 1.1569, test_f1: 0.5775
 epoch: 64, train_loss: 0.7611, test_loss: 1.1390, test_f1: 0.5831
 epoch: 65, train_loss: 0.7586, test_loss: 1.1400, test_f1: 0.5803
 epoch: 66, train_loss: 0.7608, test_loss: 1.1775, test_f1: 0.5852
 epoch: 67, train_loss: 0.7451, test_loss: 1.1856, test_f1: 0.5882
 epoch: 68, train_loss: 0.7435, test_loss: 1.1549, test_f1: 0.5873
 epoch: 69, train_loss: 0.7431, test_loss: 1.1905, test_f1: 0.5861
 epoch: 70, train_loss: 0.7492, test_loss: 1.1948, test_f1: 0.5710
 epoch: 71, train_loss: 0.7363, test_loss: 1.2018, test_f1: 0.5767
 epoch: 72, train_loss: 0.7502, test_loss: 1.2200, test_f1: 0.5743
 epoch: 73, train_loss: 0.7492, test_loss: 1.1986, test_f1: 0.5883
 epoch: 74, train_loss: 0.7415, test_loss: 1.2329, test_f1: 0.5693
 epoch: 75, train_loss: 0.7420, test_loss: 1.2246, test_f1: 0.5777
 epoch: 76, train_loss: 0.7381, test_loss: 1.2182, test_f1: 0.5666
 epoch: 77, train_loss: 0.7364, test_loss: 1.2000, test_f1: 0.5691
 epoch: 78, train_loss: 0.7511, test_loss: 1.2215, test_f1: 0.5661
 epoch: 79, train_loss: 0.7409, test_loss: 1.1828, test_f1: 0.5741
 epoch: 80, train_loss: 0.7370, test_loss: 1.2423, test_f1: 0.5665
 epoch: 81, train_loss: 0.7288, test_loss: 1.1864, test_f1: 0.5872
 epoch: 82, train_loss: 0.7384, test_loss: 1.2033, test_f1: 0.5743
 epoch: 83, train_loss: 0.7177, test_loss: 1.1568, test_f1: 0.5723
 epoch: 84, train_loss: 0.7365, test_loss: 1.2326, test_f1: 0.5698
 epoch: 85, train_loss: 0.7379, test_loss: 1.2058, test_f1: 0.5684
 epoch: 86, train_loss: 0.7205, test_loss: 1.2483, test_f1: 0.5642
 epoch: 87, train_loss: 0.7254, test_loss: 1.2211, test_f1: 0.5802
 epoch: 88, train_loss: 0.7237, test_loss: 1.2136, test_f1: 0.5862
 epoch: 89, train_loss: 0.7292, test_loss: 1.2186, test_f1: 0.5688
 epoch: 90, train_loss: 0.7272, test_loss: 1.2518, test_f1: 0.5782
 epoch: 91, train_loss: 0.7304, test_loss: 1.2332, test_f1: 0.5926
 epoch: 92, train_loss: 0.7175, test_loss: 1.2311, test_f1: 0.5837
 epoch: 93, train_loss: 0.7287, test_loss: 1.2399, test_f1: 0.5912
 epoch: 94, train_loss: 0.7129, test_loss: 1.2277, test_f1: 0.5831
 epoch: 95, train_loss: 0.7174, test_loss: 1.2266, test_f1: 0.5802
 epoch: 96, train_loss: 0.7223, test_loss: 1.2417, test_f1: 0.5864
 epoch: 97, train_loss: 0.7030, test_loss: 1.2410, test_f1: 0.5789
 epoch: 98, train_loss: 0.7046, test_loss: 1.2677, test_f1: 0.5787
 epoch: 99, train_loss: 0.7012, test_loss: 1.2934, test_f1: 0.5788
##################ITERATION #5 ****************************************
 epoch: 0, train_loss: 1.2199, test_loss: 1.3057, test_f1: 0.2281
 epoch: 1, train_loss: 1.1575, test_loss: 1.2669, test_f1: 0.2622
 epoch: 2, train_loss: 1.1267, test_loss: 1.2359, test_f1: 0.3360
 epoch: 3, train_loss: 1.1122, test_loss: 1.1847, test_f1: 0.3923
 epoch: 4, train_loss: 1.0866, test_loss: 1.1656, test_f1: 0.4097
 epoch: 5, train_loss: 1.0709, test_loss: 1.1390, test_f1: 0.4344
 epoch: 6, train_loss: 1.0676, test_loss: 1.1350, test_f1: 0.4435
 epoch: 7, train_loss: 1.0434, test_loss: 1.1265, test_f1: 0.4432
 epoch: 8, train_loss: 1.0376, test_loss: 1.1097, test_f1: 0.4396
 epoch: 9, train_loss: 1.0288, test_loss: 1.1031, test_f1: 0.4599
 epoch: 10, train_loss: 1.0187, test_loss: 1.1069, test_f1: 0.4814
 epoch: 11, train_loss: 0.9986, test_loss: 1.1068, test_f1: 0.4923
 epoch: 12, train_loss: 0.9957, test_loss: 1.0927, test_f1: 0.5174
 epoch: 13, train_loss: 0.9921, test_loss: 1.0849, test_f1: 0.5190
 epoch: 14, train_loss: 0.9812, test_loss: 1.0780, test_f1: 0.5305
 epoch: 15, train_loss: 0.9630, test_loss: 1.0777, test_f1: 0.5163
 epoch: 16, train_loss: 0.9643, test_loss: 1.0781, test_f1: 0.5096
 epoch: 17, train_loss: 0.9605, test_loss: 1.0797, test_f1: 0.5238
 epoch: 18, train_loss: 0.9511, test_loss: 1.0781, test_f1: 0.5098
 epoch: 19, train_loss: 0.9455, test_loss: 1.0699, test_f1: 0.5130
 epoch: 20, train_loss: 0.9382, test_loss: 1.0808, test_f1: 0.5138
 epoch: 21, train_loss: 0.9442, test_loss: 1.0721, test_f1: 0.5038
 epoch: 22, train_loss: 0.9368, test_loss: 1.0834, test_f1: 0.5048
 epoch: 23, train_loss: 0.9232, test_loss: 1.0654, test_f1: 0.5248
 epoch: 24, train_loss: 0.9229, test_loss: 1.0718, test_f1: 0.5316
 epoch: 25, train_loss: 0.9087, test_loss: 1.0727, test_f1: 0.5409
 epoch: 26, train_loss: 0.9024, test_loss: 1.0775, test_f1: 0.5293
 epoch: 27, train_loss: 0.9011, test_loss: 1.0771, test_f1: 0.5355
 epoch: 28, train_loss: 0.8992, test_loss: 1.0827, test_f1: 0.5319
 epoch: 29, train_loss: 0.8900, test_loss: 1.0513, test_f1: 0.5379
 epoch: 30, train_loss: 0.8840, test_loss: 1.0625, test_f1: 0.5347
 epoch: 31, train_loss: 0.8811, test_loss: 1.0642, test_f1: 0.5367
 epoch: 32, train_loss: 0.8704, test_loss: 1.0663, test_f1: 0.5389
 epoch: 33, train_loss: 0.8765, test_loss: 1.0399, test_f1: 0.5405
 epoch: 34, train_loss: 0.8682, test_loss: 1.0322, test_f1: 0.5459
 epoch: 35, train_loss: 0.8596, test_loss: 1.0552, test_f1: 0.5407
 epoch: 36, train_loss: 0.8534, test_loss: 1.0455, test_f1: 0.5492
 epoch: 37, train_loss: 0.8709, test_loss: 1.0535, test_f1: 0.5484
 epoch: 38, train_loss: 0.8536, test_loss: 1.0699, test_f1: 0.5381
 epoch: 39, train_loss: 0.8548, test_loss: 1.0454, test_f1: 0.5624
 epoch: 40, train_loss: 0.8422, test_loss: 1.0489, test_f1: 0.5523
 epoch: 41, train_loss: 0.8410, test_loss: 1.0395, test_f1: 0.5633
 epoch: 42, train_loss: 0.8397, test_loss: 1.0767, test_f1: 0.5493
 epoch: 43, train_loss: 0.8334, test_loss: 1.0505, test_f1: 0.5609
 epoch: 44, train_loss: 0.8475, test_loss: 1.0611, test_f1: 0.5491
 epoch: 45, train_loss: 0.8308, test_loss: 1.0695, test_f1: 0.5606
 epoch: 46, train_loss: 0.8305, test_loss: 1.0868, test_f1: 0.5666
 epoch: 47, train_loss: 0.8238, test_loss: 1.0667, test_f1: 0.5754
 epoch: 48, train_loss: 0.8351, test_loss: 1.0378, test_f1: 0.5645
 epoch: 49, train_loss: 0.8149, test_loss: 1.0619, test_f1: 0.5571
 epoch: 50, train_loss: 0.8156, test_loss: 1.0567, test_f1: 0.5612
 epoch: 51, train_loss: 0.8070, test_loss: 1.0644, test_f1: 0.5518
 epoch: 52, train_loss: 0.8064, test_loss: 1.0708, test_f1: 0.5565
 epoch: 53, train_loss: 0.8066, test_loss: 1.0509, test_f1: 0.5599
 epoch: 54, train_loss: 0.7962, test_loss: 1.0743, test_f1: 0.5651
 epoch: 55, train_loss: 0.8025, test_loss: 1.0697, test_f1: 0.5565
 epoch: 56, train_loss: 0.8025, test_loss: 1.0685, test_f1: 0.5575
 epoch: 57, train_loss: 0.7874, test_loss: 1.0643, test_f1: 0.5632
 epoch: 58, train_loss: 0.7935, test_loss: 1.0616, test_f1: 0.5665
 epoch: 59, train_loss: 0.7804, test_loss: 1.0647, test_f1: 0.5579
 epoch: 60, train_loss: 0.7853, test_loss: 1.0646, test_f1: 0.5687
 epoch: 61, train_loss: 0.7931, test_loss: 1.0696, test_f1: 0.5865
 epoch: 62, train_loss: 0.7771, test_loss: 1.0533, test_f1: 0.5808
 epoch: 63, train_loss: 0.7735, test_loss: 1.0775, test_f1: 0.5628
 epoch: 64, train_loss: 0.7634, test_loss: 1.0620, test_f1: 0.5690
 epoch: 65, train_loss: 0.7822, test_loss: 1.0548, test_f1: 0.5838
 epoch: 66, train_loss: 0.7802, test_loss: 1.0666, test_f1: 0.5709
 epoch: 67, train_loss: 0.7788, test_loss: 1.0838, test_f1: 0.5736
 epoch: 68, train_loss: 0.7856, test_loss: 1.0834, test_f1: 0.5686
 epoch: 69, train_loss: 0.7751, test_loss: 1.0771, test_f1: 0.5627
 epoch: 70, train_loss: 0.7762, test_loss: 1.0923, test_f1: 0.5748
 epoch: 71, train_loss: 0.7683, test_loss: 1.0754, test_f1: 0.5659
 epoch: 72, train_loss: 0.7578, test_loss: 1.0908, test_f1: 0.5660
 epoch: 73, train_loss: 0.7719, test_loss: 1.1058, test_f1: 0.5752
 epoch: 74, train_loss: 0.7799, test_loss: 1.0939, test_f1: 0.5784
 epoch: 75, train_loss: 0.7698, test_loss: 1.1052, test_f1: 0.5667
 epoch: 76, train_loss: 0.7499, test_loss: 1.0894, test_f1: 0.5740
 epoch: 77, train_loss: 0.7671, test_loss: 1.0844, test_f1: 0.5777
 epoch: 78, train_loss: 0.7588, test_loss: 1.0708, test_f1: 0.5603
 epoch: 79, train_loss: 0.7545, test_loss: 1.0866, test_f1: 0.5717
 epoch: 80, train_loss: 0.7632, test_loss: 1.0992, test_f1: 0.5672
 epoch: 81, train_loss: 0.7575, test_loss: 1.1294, test_f1: 0.5797
 epoch: 82, train_loss: 0.7573, test_loss: 1.0965, test_f1: 0.5757
 epoch: 83, train_loss: 0.7499, test_loss: 1.0989, test_f1: 0.5907
 epoch: 84, train_loss: 0.7596, test_loss: 1.0843, test_f1: 0.5776
 epoch: 85, train_loss: 0.7537, test_loss: 1.0850, test_f1: 0.5808
 epoch: 86, train_loss: 0.7397, test_loss: 1.0828, test_f1: 0.5721
 epoch: 87, train_loss: 0.7400, test_loss: 1.0621, test_f1: 0.5894
 epoch: 88, train_loss: 0.7440, test_loss: 1.1070, test_f1: 0.5836
 epoch: 89, train_loss: 0.7413, test_loss: 1.0905, test_f1: 0.5804
 epoch: 90, train_loss: 0.7421, test_loss: 1.0859, test_f1: 0.5782
 epoch: 91, train_loss: 0.7242, test_loss: 1.1275, test_f1: 0.5741
 epoch: 92, train_loss: 0.7444, test_loss: 1.1363, test_f1: 0.5768
 epoch: 93, train_loss: 0.7348, test_loss: 1.1153, test_f1: 0.5800
 epoch: 94, train_loss: 0.7379, test_loss: 1.1268, test_f1: 0.5802
 epoch: 95, train_loss: 0.7225, test_loss: 1.1148, test_f1: 0.5691
 epoch: 96, train_loss: 0.7281, test_loss: 1.1328, test_f1: 0.5698
 epoch: 97, train_loss: 0.7320, test_loss: 1.1172, test_f1: 0.5786
 epoch: 98, train_loss: 0.7425, test_loss: 1.1325, test_f1: 0.5814
 epoch: 99, train_loss: 0.7238, test_loss: 1.1243, test_f1: 0.5764
##################ITERATION #6 ****************************************
 epoch: 0, train_loss: 1.2135, test_loss: 1.3185, test_f1: 0.2281
 epoch: 1, train_loss: 1.1431, test_loss: 1.3156, test_f1: 0.2363
 epoch: 2, train_loss: 1.1115, test_loss: 1.2006, test_f1: 0.3258
 epoch: 3, train_loss: 1.0881, test_loss: 1.1378, test_f1: 0.4253
 epoch: 4, train_loss: 1.0800, test_loss: 1.1324, test_f1: 0.4403
 epoch: 5, train_loss: 1.0620, test_loss: 1.1140, test_f1: 0.4459
 epoch: 6, train_loss: 1.0500, test_loss: 1.1015, test_f1: 0.4634
 epoch: 7, train_loss: 1.0510, test_loss: 1.0911, test_f1: 0.4612
 epoch: 8, train_loss: 1.0224, test_loss: 1.0850, test_f1: 0.4764
 epoch: 9, train_loss: 1.0206, test_loss: 1.0771, test_f1: 0.4897
 epoch: 10, train_loss: 1.0201, test_loss: 1.0704, test_f1: 0.5190
 epoch: 11, train_loss: 1.0021, test_loss: 1.0629, test_f1: 0.5110
 epoch: 12, train_loss: 0.9895, test_loss: 1.0664, test_f1: 0.5026
 epoch: 13, train_loss: 0.9860, test_loss: 1.0600, test_f1: 0.5017
 epoch: 14, train_loss: 0.9743, test_loss: 1.0602, test_f1: 0.5188
 epoch: 15, train_loss: 0.9710, test_loss: 1.0499, test_f1: 0.5297
 epoch: 16, train_loss: 0.9571, test_loss: 1.0483, test_f1: 0.5436
 epoch: 17, train_loss: 0.9516, test_loss: 1.0512, test_f1: 0.5249
 epoch: 18, train_loss: 0.9543, test_loss: 1.0720, test_f1: 0.5431
 epoch: 19, train_loss: 0.9378, test_loss: 1.0761, test_f1: 0.5533
 epoch: 20, train_loss: 0.9465, test_loss: 1.0494, test_f1: 0.5305
 epoch: 21, train_loss: 0.9242, test_loss: 1.0575, test_f1: 0.5332
 epoch: 22, train_loss: 0.9278, test_loss: 1.0548, test_f1: 0.5419
 epoch: 23, train_loss: 0.9303, test_loss: 1.0632, test_f1: 0.5497
 epoch: 24, train_loss: 0.9105, test_loss: 1.0565, test_f1: 0.5630
 epoch: 25, train_loss: 0.8931, test_loss: 1.0682, test_f1: 0.5683
 epoch: 26, train_loss: 0.9110, test_loss: 1.0904, test_f1: 0.5630
 epoch: 27, train_loss: 0.9077, test_loss: 1.0746, test_f1: 0.5813
 epoch: 28, train_loss: 0.8930, test_loss: 1.0734, test_f1: 0.5728
 epoch: 29, train_loss: 0.8884, test_loss: 1.0763, test_f1: 0.5722
 epoch: 30, train_loss: 0.8823, test_loss: 1.0864, test_f1: 0.5664
 epoch: 31, train_loss: 0.8819, test_loss: 1.1190, test_f1: 0.5646
 epoch: 32, train_loss: 0.8711, test_loss: 1.0986, test_f1: 0.5811
 epoch: 33, train_loss: 0.8596, test_loss: 1.1100, test_f1: 0.5579
 epoch: 34, train_loss: 0.8536, test_loss: 1.0827, test_f1: 0.5900
 epoch: 35, train_loss: 0.8755, test_loss: 1.0893, test_f1: 0.5718
 epoch: 36, train_loss: 0.8435, test_loss: 1.0766, test_f1: 0.5778
 epoch: 37, train_loss: 0.8521, test_loss: 1.1164, test_f1: 0.5681
 epoch: 38, train_loss: 0.8537, test_loss: 1.0811, test_f1: 0.5681
 epoch: 39, train_loss: 0.8404, test_loss: 1.1290, test_f1: 0.5524
 epoch: 40, train_loss: 0.8375, test_loss: 1.1024, test_f1: 0.5694
 epoch: 41, train_loss: 0.8241, test_loss: 1.1105, test_f1: 0.5584
 epoch: 42, train_loss: 0.8260, test_loss: 1.1103, test_f1: 0.5904
 epoch: 43, train_loss: 0.8211, test_loss: 1.1439, test_f1: 0.5697
 epoch: 44, train_loss: 0.8247, test_loss: 1.1173, test_f1: 0.5737
 epoch: 45, train_loss: 0.8270, test_loss: 1.1334, test_f1: 0.5691
 epoch: 46, train_loss: 0.8373, test_loss: 1.0785, test_f1: 0.5835
 epoch: 47, train_loss: 0.8091, test_loss: 1.1219, test_f1: 0.5722
 epoch: 48, train_loss: 0.8026, test_loss: 1.1312, test_f1: 0.5731
 epoch: 49, train_loss: 0.7972, test_loss: 1.1344, test_f1: 0.5658
 epoch: 50, train_loss: 0.7958, test_loss: 1.0934, test_f1: 0.5695
 epoch: 51, train_loss: 0.7904, test_loss: 1.1402, test_f1: 0.5789
 epoch: 52, train_loss: 0.7917, test_loss: 1.1340, test_f1: 0.5835
 epoch: 53, train_loss: 0.7844, test_loss: 1.1132, test_f1: 0.5922
 epoch: 54, train_loss: 0.7835, test_loss: 1.1167, test_f1: 0.5915
 epoch: 55, train_loss: 0.7845, test_loss: 1.1410, test_f1: 0.5888
 epoch: 56, train_loss: 0.7879, test_loss: 1.1286, test_f1: 0.5762
 epoch: 57, train_loss: 0.7867, test_loss: 1.1276, test_f1: 0.5877
 epoch: 58, train_loss: 0.7770, test_loss: 1.1319, test_f1: 0.6013
 epoch: 59, train_loss: 0.7709, test_loss: 1.1309, test_f1: 0.5968
 epoch: 60, train_loss: 0.7681, test_loss: 1.1532, test_f1: 0.5885
 epoch: 61, train_loss: 0.7689, test_loss: 1.1652, test_f1: 0.6031
 epoch: 62, train_loss: 0.7697, test_loss: 1.1420, test_f1: 0.5997
 epoch: 63, train_loss: 0.7697, test_loss: 1.1484, test_f1: 0.6030
 epoch: 64, train_loss: 0.7711, test_loss: 1.1748, test_f1: 0.5880
 epoch: 65, train_loss: 0.7698, test_loss: 1.1395, test_f1: 0.5971
 epoch: 66, train_loss: 0.7705, test_loss: 1.1705, test_f1: 0.6047
 epoch: 67, train_loss: 0.7691, test_loss: 1.1751, test_f1: 0.6015
 epoch: 68, train_loss: 0.7500, test_loss: 1.1833, test_f1: 0.6091
 epoch: 69, train_loss: 0.7792, test_loss: 1.1751, test_f1: 0.6007
 epoch: 70, train_loss: 0.7632, test_loss: 1.1537, test_f1: 0.6012
 epoch: 71, train_loss: 0.7560, test_loss: 1.1530, test_f1: 0.6119
 epoch: 72, train_loss: 0.7464, test_loss: 1.1904, test_f1: 0.5861
 epoch: 73, train_loss: 0.7544, test_loss: 1.1785, test_f1: 0.5990
 epoch: 74, train_loss: 0.7501, test_loss: 1.1830, test_f1: 0.5913
 epoch: 75, train_loss: 0.7509, test_loss: 1.1686, test_f1: 0.6039
 epoch: 76, train_loss: 0.7459, test_loss: 1.1984, test_f1: 0.6139
 epoch: 77, train_loss: 0.7497, test_loss: 1.1957, test_f1: 0.5885
 epoch: 78, train_loss: 0.7417, test_loss: 1.1720, test_f1: 0.6119
 epoch: 79, train_loss: 0.7336, test_loss: 1.1837, test_f1: 0.5971
 epoch: 80, train_loss: 0.7355, test_loss: 1.1943, test_f1: 0.6011
 epoch: 81, train_loss: 0.7340, test_loss: 1.1884, test_f1: 0.5825
 epoch: 82, train_loss: 0.7370, test_loss: 1.1779, test_f1: 0.5856
 epoch: 83, train_loss: 0.7500, test_loss: 1.1739, test_f1: 0.5959
 epoch: 84, train_loss: 0.7375, test_loss: 1.1723, test_f1: 0.5908
 epoch: 85, train_loss: 0.7339, test_loss: 1.1941, test_f1: 0.5860
 epoch: 86, train_loss: 0.7320, test_loss: 1.2186, test_f1: 0.5813
 epoch: 87, train_loss: 0.7386, test_loss: 1.1957, test_f1: 0.6018
 epoch: 88, train_loss: 0.7273, test_loss: 1.1951, test_f1: 0.6048
 epoch: 89, train_loss: 0.7333, test_loss: 1.2055, test_f1: 0.5951
 epoch: 90, train_loss: 0.7410, test_loss: 1.1601, test_f1: 0.5984
 epoch: 91, train_loss: 0.7213, test_loss: 1.2098, test_f1: 0.5887
 epoch: 92, train_loss: 0.7313, test_loss: 1.1976, test_f1: 0.5860
 epoch: 93, train_loss: 0.7234, test_loss: 1.2317, test_f1: 0.5836
 epoch: 94, train_loss: 0.7284, test_loss: 1.2361, test_f1: 0.5889
 epoch: 95, train_loss: 0.7151, test_loss: 1.2035, test_f1: 0.5916
 epoch: 96, train_loss: 0.7024, test_loss: 1.1812, test_f1: 0.6036
 epoch: 97, train_loss: 0.7152, test_loss: 1.1836, test_f1: 0.6085
 epoch: 98, train_loss: 0.7161, test_loss: 1.1854, test_f1: 0.5843
 epoch: 99, train_loss: 0.7023, test_loss: 1.2255, test_f1: 0.5872
##################ITERATION #7 ****************************************
 epoch: 0, train_loss: 1.2314, test_loss: 1.3558, test_f1: 0.2284
 epoch: 1, train_loss: 1.1488, test_loss: 1.2494, test_f1: 0.3555
 epoch: 2, train_loss: 1.1217, test_loss: 1.2163, test_f1: 0.3795
 epoch: 3, train_loss: 1.0898, test_loss: 1.1654, test_f1: 0.4016
 epoch: 4, train_loss: 1.0807, test_loss: 1.1460, test_f1: 0.4371
 epoch: 5, train_loss: 1.0571, test_loss: 1.1237, test_f1: 0.4409
 epoch: 6, train_loss: 1.0406, test_loss: 1.1210, test_f1: 0.4523
 epoch: 7, train_loss: 1.0396, test_loss: 1.1001, test_f1: 0.4754
 epoch: 8, train_loss: 1.0203, test_loss: 1.0862, test_f1: 0.4767
 epoch: 9, train_loss: 1.0166, test_loss: 1.0929, test_f1: 0.4729
 epoch: 10, train_loss: 0.9943, test_loss: 1.0996, test_f1: 0.4843
 epoch: 11, train_loss: 1.0001, test_loss: 1.0875, test_f1: 0.4894
 epoch: 12, train_loss: 0.9818, test_loss: 1.0987, test_f1: 0.4835
 epoch: 13, train_loss: 0.9796, test_loss: 1.0799, test_f1: 0.4756
 epoch: 14, train_loss: 0.9553, test_loss: 1.0634, test_f1: 0.5020
 epoch: 15, train_loss: 0.9709, test_loss: 1.0947, test_f1: 0.4999
 epoch: 16, train_loss: 0.9532, test_loss: 1.0614, test_f1: 0.5083
 epoch: 17, train_loss: 0.9500, test_loss: 1.0521, test_f1: 0.5292
 epoch: 18, train_loss: 0.9530, test_loss: 1.0543, test_f1: 0.5276
 epoch: 19, train_loss: 0.9297, test_loss: 1.0511, test_f1: 0.5210
 epoch: 20, train_loss: 0.9286, test_loss: 1.0642, test_f1: 0.5124
 epoch: 21, train_loss: 0.9369, test_loss: 1.0564, test_f1: 0.5277
 epoch: 22, train_loss: 0.9328, test_loss: 1.0549, test_f1: 0.5062
 epoch: 23, train_loss: 0.9208, test_loss: 1.0742, test_f1: 0.5136
 epoch: 24, train_loss: 0.9161, test_loss: 1.0508, test_f1: 0.5148
 epoch: 25, train_loss: 0.9079, test_loss: 1.0474, test_f1: 0.5363
 epoch: 26, train_loss: 0.9050, test_loss: 1.0535, test_f1: 0.5304
 epoch: 27, train_loss: 0.9009, test_loss: 1.0553, test_f1: 0.5314
 epoch: 28, train_loss: 0.8944, test_loss: 1.0868, test_f1: 0.5216
 epoch: 29, train_loss: 0.8895, test_loss: 1.0597, test_f1: 0.5514
 epoch: 30, train_loss: 0.8922, test_loss: 1.0717, test_f1: 0.5390
 epoch: 31, train_loss: 0.8744, test_loss: 1.0662, test_f1: 0.5325
 epoch: 32, train_loss: 0.8819, test_loss: 1.1026, test_f1: 0.5367
 epoch: 33, train_loss: 0.8749, test_loss: 1.0777, test_f1: 0.5393
 epoch: 34, train_loss: 0.8611, test_loss: 1.0783, test_f1: 0.5371
 epoch: 35, train_loss: 0.8668, test_loss: 1.1024, test_f1: 0.5361
 epoch: 36, train_loss: 0.8620, test_loss: 1.0894, test_f1: 0.5441
 epoch: 37, train_loss: 0.8706, test_loss: 1.1165, test_f1: 0.5274
 epoch: 38, train_loss: 0.8603, test_loss: 1.1159, test_f1: 0.5493
 epoch: 39, train_loss: 0.8595, test_loss: 1.1085, test_f1: 0.5396
 epoch: 40, train_loss: 0.8408, test_loss: 1.1021, test_f1: 0.5528
 epoch: 41, train_loss: 0.8563, test_loss: 1.1122, test_f1: 0.5431
 epoch: 42, train_loss: 0.8249, test_loss: 1.1038, test_f1: 0.5660
 epoch: 43, train_loss: 0.8511, test_loss: 1.0956, test_f1: 0.5582
 epoch: 44, train_loss: 0.8386, test_loss: 1.1235, test_f1: 0.5699
 epoch: 45, train_loss: 0.8608, test_loss: 1.1027, test_f1: 0.5626
 epoch: 46, train_loss: 0.8347, test_loss: 1.1271, test_f1: 0.5526
 epoch: 47, train_loss: 0.8418, test_loss: 1.1227, test_f1: 0.5538
 epoch: 48, train_loss: 0.8316, test_loss: 1.1151, test_f1: 0.5496
 epoch: 49, train_loss: 0.8316, test_loss: 1.1173, test_f1: 0.5492
 epoch: 50, train_loss: 0.8318, test_loss: 1.1420, test_f1: 0.5668
 epoch: 51, train_loss: 0.8244, test_loss: 1.1315, test_f1: 0.5471
 epoch: 52, train_loss: 0.8314, test_loss: 1.1208, test_f1: 0.5505
 epoch: 53, train_loss: 0.8096, test_loss: 1.1367, test_f1: 0.5423
 epoch: 54, train_loss: 0.8179, test_loss: 1.1484, test_f1: 0.5467
 epoch: 55, train_loss: 0.8162, test_loss: 1.1409, test_f1: 0.5588
 epoch: 56, train_loss: 0.8079, test_loss: 1.1541, test_f1: 0.5688
 epoch: 57, train_loss: 0.8062, test_loss: 1.1666, test_f1: 0.5468
 epoch: 58, train_loss: 0.7882, test_loss: 1.1570, test_f1: 0.5557
 epoch: 59, train_loss: 0.8011, test_loss: 1.1624, test_f1: 0.5496
 epoch: 60, train_loss: 0.7909, test_loss: 1.1720, test_f1: 0.5429
 epoch: 61, train_loss: 0.7969, test_loss: 1.1683, test_f1: 0.5642
 epoch: 62, train_loss: 0.7936, test_loss: 1.1699, test_f1: 0.5646
 epoch: 63, train_loss: 0.7956, test_loss: 1.1587, test_f1: 0.5520
 epoch: 64, train_loss: 0.7968, test_loss: 1.1721, test_f1: 0.5664
 epoch: 65, train_loss: 0.7916, test_loss: 1.1643, test_f1: 0.5548
 epoch: 66, train_loss: 0.7900, test_loss: 1.1676, test_f1: 0.5547
 epoch: 67, train_loss: 0.7896, test_loss: 1.1891, test_f1: 0.5525
 epoch: 68, train_loss: 0.7879, test_loss: 1.1888, test_f1: 0.5575
 epoch: 69, train_loss: 0.7845, test_loss: 1.1889, test_f1: 0.5556
 epoch: 70, train_loss: 0.7728, test_loss: 1.1987, test_f1: 0.5559
 epoch: 71, train_loss: 0.7766, test_loss: 1.1838, test_f1: 0.5593
 epoch: 72, train_loss: 0.7818, test_loss: 1.1902, test_f1: 0.5579
 epoch: 73, train_loss: 0.7776, test_loss: 1.1934, test_f1: 0.5552
 epoch: 74, train_loss: 0.7729, test_loss: 1.2087, test_f1: 0.5477
 epoch: 75, train_loss: 0.7848, test_loss: 1.1775, test_f1: 0.5586
 epoch: 76, train_loss: 0.7780, test_loss: 1.1835, test_f1: 0.5608
 epoch: 77, train_loss: 0.7571, test_loss: 1.2261, test_f1: 0.5432
 epoch: 78, train_loss: 0.7800, test_loss: 1.2249, test_f1: 0.5502
 epoch: 79, train_loss: 0.7676, test_loss: 1.2312, test_f1: 0.5569
 epoch: 80, train_loss: 0.7728, test_loss: 1.2109, test_f1: 0.5559
 epoch: 81, train_loss: 0.7625, test_loss: 1.2066, test_f1: 0.5632
 epoch: 82, train_loss: 0.7597, test_loss: 1.1843, test_f1: 0.5510
 epoch: 83, train_loss: 0.7715, test_loss: 1.2059, test_f1: 0.5493
 epoch: 84, train_loss: 0.7729, test_loss: 1.2217, test_f1: 0.5581
 epoch: 85, train_loss: 0.7556, test_loss: 1.2194, test_f1: 0.5509
 epoch: 86, train_loss: 0.7720, test_loss: 1.2324, test_f1: 0.5540
 epoch: 87, train_loss: 0.7581, test_loss: 1.2116, test_f1: 0.5720
 epoch: 88, train_loss: 0.7530, test_loss: 1.2298, test_f1: 0.5612
 epoch: 89, train_loss: 0.7540, test_loss: 1.2309, test_f1: 0.5622
 epoch: 90, train_loss: 0.7497, test_loss: 1.2066, test_f1: 0.5644
 epoch: 91, train_loss: 0.7597, test_loss: 1.2335, test_f1: 0.5611
 epoch: 92, train_loss: 0.7365, test_loss: 1.2312, test_f1: 0.5515
 epoch: 93, train_loss: 0.7488, test_loss: 1.2536, test_f1: 0.5494
 epoch: 94, train_loss: 0.7471, test_loss: 1.2485, test_f1: 0.5537
 epoch: 95, train_loss: 0.7502, test_loss: 1.2249, test_f1: 0.5767
 epoch: 96, train_loss: 0.7327, test_loss: 1.2323, test_f1: 0.5599
 epoch: 97, train_loss: 0.7457, test_loss: 1.2576, test_f1: 0.5443
 epoch: 98, train_loss: 0.7361, test_loss: 1.2592, test_f1: 0.5469
 epoch: 99, train_loss: 0.7240, test_loss: 1.2463, test_f1: 0.5574
##################ITERATION #8 ****************************************
 epoch: 0, train_loss: 1.2401, test_loss: 1.3564, test_f1: 0.2673
 epoch: 1, train_loss: 1.1484, test_loss: 1.2825, test_f1: 0.2886
 epoch: 2, train_loss: 1.1328, test_loss: 1.2176, test_f1: 0.4273
 epoch: 3, train_loss: 1.1210, test_loss: 1.1735, test_f1: 0.4288
 epoch: 4, train_loss: 1.0986, test_loss: 1.1720, test_f1: 0.4477
 epoch: 5, train_loss: 1.0784, test_loss: 1.1624, test_f1: 0.4480
 epoch: 6, train_loss: 1.0727, test_loss: 1.1576, test_f1: 0.4664
 epoch: 7, train_loss: 1.0587, test_loss: 1.1393, test_f1: 0.4732
 epoch: 8, train_loss: 1.0515, test_loss: 1.1227, test_f1: 0.4856
 epoch: 9, train_loss: 1.0332, test_loss: 1.1129, test_f1: 0.4948
 epoch: 10, train_loss: 1.0291, test_loss: 1.1008, test_f1: 0.5033
 epoch: 11, train_loss: 1.0162, test_loss: 1.0881, test_f1: 0.5098
 epoch: 12, train_loss: 0.9949, test_loss: 1.1050, test_f1: 0.5220
 epoch: 13, train_loss: 1.0043, test_loss: 1.0973, test_f1: 0.5301
 epoch: 14, train_loss: 0.9921, test_loss: 1.0857, test_f1: 0.5280
 epoch: 15, train_loss: 1.0068, test_loss: 1.0989, test_f1: 0.5324
 epoch: 16, train_loss: 0.9652, test_loss: 1.0889, test_f1: 0.5218
 epoch: 17, train_loss: 0.9678, test_loss: 1.0771, test_f1: 0.5335
 epoch: 18, train_loss: 0.9689, test_loss: 1.0854, test_f1: 0.5302
 epoch: 19, train_loss: 0.9509, test_loss: 1.0836, test_f1: 0.5478
 epoch: 20, train_loss: 0.9555, test_loss: 1.0697, test_f1: 0.5207
 epoch: 21, train_loss: 0.9544, test_loss: 1.0652, test_f1: 0.5492
 epoch: 22, train_loss: 0.9292, test_loss: 1.0922, test_f1: 0.5462
 epoch: 23, train_loss: 0.9284, test_loss: 1.1035, test_f1: 0.5642
 epoch: 24, train_loss: 0.9357, test_loss: 1.0723, test_f1: 0.5430
 epoch: 25, train_loss: 0.9208, test_loss: 1.0899, test_f1: 0.5540
 epoch: 26, train_loss: 0.9183, test_loss: 1.0763, test_f1: 0.5632
 epoch: 27, train_loss: 0.9149, test_loss: 1.0569, test_f1: 0.5766
 epoch: 28, train_loss: 0.9147, test_loss: 1.0670, test_f1: 0.5536
 epoch: 29, train_loss: 0.9113, test_loss: 1.0398, test_f1: 0.5734
 epoch: 30, train_loss: 0.8815, test_loss: 1.0922, test_f1: 0.5741
 epoch: 31, train_loss: 0.9010, test_loss: 1.0880, test_f1: 0.5711
 epoch: 32, train_loss: 0.9036, test_loss: 1.0807, test_f1: 0.5652
 epoch: 33, train_loss: 0.8843, test_loss: 1.0831, test_f1: 0.5523
 epoch: 34, train_loss: 0.8855, test_loss: 1.1095, test_f1: 0.5820
 epoch: 35, train_loss: 0.8779, test_loss: 1.0864, test_f1: 0.5556
 epoch: 36, train_loss: 0.8787, test_loss: 1.1038, test_f1: 0.5870
 epoch: 37, train_loss: 0.8590, test_loss: 1.1233, test_f1: 0.5914
 epoch: 38, train_loss: 0.8765, test_loss: 1.0967, test_f1: 0.5996
 epoch: 39, train_loss: 0.8544, test_loss: 1.0977, test_f1: 0.6072
 epoch: 40, train_loss: 0.8672, test_loss: 1.1262, test_f1: 0.5935
 epoch: 41, train_loss: 0.8744, test_loss: 1.1548, test_f1: 0.5819
 epoch: 42, train_loss: 0.8424, test_loss: 1.1602, test_f1: 0.5898
 epoch: 43, train_loss: 0.8509, test_loss: 1.1304, test_f1: 0.5762
 epoch: 44, train_loss: 0.8483, test_loss: 1.1598, test_f1: 0.5900
 epoch: 45, train_loss: 0.8428, test_loss: 1.1148, test_f1: 0.5847
 epoch: 46, train_loss: 0.8441, test_loss: 1.1397, test_f1: 0.5699
 epoch: 47, train_loss: 0.8354, test_loss: 1.1894, test_f1: 0.5633
 epoch: 48, train_loss: 0.8270, test_loss: 1.1838, test_f1: 0.5776
 epoch: 49, train_loss: 0.8450, test_loss: 1.1842, test_f1: 0.5628
 epoch: 50, train_loss: 0.8316, test_loss: 1.1168, test_f1: 0.5808
 epoch: 51, train_loss: 0.8080, test_loss: 1.1411, test_f1: 0.5845
 epoch: 52, train_loss: 0.8143, test_loss: 1.1495, test_f1: 0.6037
 epoch: 53, train_loss: 0.8208, test_loss: 1.1612, test_f1: 0.6003
 epoch: 54, train_loss: 0.8135, test_loss: 1.1733, test_f1: 0.5937
 epoch: 55, train_loss: 0.7962, test_loss: 1.1610, test_f1: 0.5942
 epoch: 56, train_loss: 0.8019, test_loss: 1.1571, test_f1: 0.5891
 epoch: 57, train_loss: 0.8106, test_loss: 1.1733, test_f1: 0.5962
 epoch: 58, train_loss: 0.8121, test_loss: 1.1786, test_f1: 0.5828
 epoch: 59, train_loss: 0.8012, test_loss: 1.2013, test_f1: 0.5780
 epoch: 60, train_loss: 0.7972, test_loss: 1.1915, test_f1: 0.5998
 epoch: 61, train_loss: 0.8011, test_loss: 1.1786, test_f1: 0.5939
 epoch: 62, train_loss: 0.7920, test_loss: 1.1751, test_f1: 0.5968
 epoch: 63, train_loss: 0.7785, test_loss: 1.1862, test_f1: 0.5872
 epoch: 64, train_loss: 0.7899, test_loss: 1.1986, test_f1: 0.5806
 epoch: 65, train_loss: 0.7845, test_loss: 1.1842, test_f1: 0.5854
 epoch: 66, train_loss: 0.7851, test_loss: 1.1957, test_f1: 0.5806
 epoch: 67, train_loss: 0.7835, test_loss: 1.1809, test_f1: 0.5748
 epoch: 68, train_loss: 0.7882, test_loss: 1.2455, test_f1: 0.5870
 epoch: 69, train_loss: 0.7847, test_loss: 1.2262, test_f1: 0.5819
 epoch: 70, train_loss: 0.7779, test_loss: 1.2005, test_f1: 0.5774
 epoch: 71, train_loss: 0.7877, test_loss: 1.2099, test_f1: 0.5833
 epoch: 72, train_loss: 0.7766, test_loss: 1.1913, test_f1: 0.5809
 epoch: 73, train_loss: 0.7799, test_loss: 1.2066, test_f1: 0.5856
 epoch: 74, train_loss: 0.7938, test_loss: 1.1904, test_f1: 0.5863
 epoch: 75, train_loss: 0.7828, test_loss: 1.2113, test_f1: 0.5774
 epoch: 76, train_loss: 0.7763, test_loss: 1.2158, test_f1: 0.5837
 epoch: 77, train_loss: 0.7775, test_loss: 1.1971, test_f1: 0.5777
 epoch: 78, train_loss: 0.7784, test_loss: 1.1955, test_f1: 0.5856
 epoch: 79, train_loss: 0.7888, test_loss: 1.2190, test_f1: 0.5878
 epoch: 80, train_loss: 0.7650, test_loss: 1.2187, test_f1: 0.5779
 epoch: 81, train_loss: 0.7687, test_loss: 1.2144, test_f1: 0.5785
 epoch: 82, train_loss: 0.7830, test_loss: 1.2273, test_f1: 0.5626
 epoch: 83, train_loss: 0.7599, test_loss: 1.2278, test_f1: 0.5747
 epoch: 84, train_loss: 0.7757, test_loss: 1.2305, test_f1: 0.5784
 epoch: 85, train_loss: 0.7703, test_loss: 1.2272, test_f1: 0.5804
 epoch: 86, train_loss: 0.7658, test_loss: 1.2210, test_f1: 0.5806
 epoch: 87, train_loss: 0.7497, test_loss: 1.2096, test_f1: 0.5922
 epoch: 88, train_loss: 0.7570, test_loss: 1.2474, test_f1: 0.5861
 epoch: 89, train_loss: 0.7716, test_loss: 1.2506, test_f1: 0.5816
 epoch: 90, train_loss: 0.7537, test_loss: 1.2367, test_f1: 0.5779
 epoch: 91, train_loss: 0.7506, test_loss: 1.2391, test_f1: 0.5837
 epoch: 92, train_loss: 0.7533, test_loss: 1.2522, test_f1: 0.5719
 epoch: 93, train_loss: 0.7679, test_loss: 1.2445, test_f1: 0.5836
 epoch: 94, train_loss: 0.7582, test_loss: 1.2543, test_f1: 0.5803
 epoch: 95, train_loss: 0.7608, test_loss: 1.2668, test_f1: 0.5703
 epoch: 96, train_loss: 0.7557, test_loss: 1.2756, test_f1: 0.5749
 epoch: 97, train_loss: 0.7447, test_loss: 1.2908, test_f1: 0.5808
 epoch: 98, train_loss: 0.7443, test_loss: 1.2866, test_f1: 0.5702
 epoch: 99, train_loss: 0.7440, test_loss: 1.2517, test_f1: 0.5679
##################ITERATION #9 ****************************************
 epoch: 0, train_loss: 1.2450, test_loss: 1.2767, test_f1: 0.2281
 epoch: 1, train_loss: 1.1564, test_loss: 1.2286, test_f1: 0.3025
 epoch: 2, train_loss: 1.1111, test_loss: 1.2337, test_f1: 0.3845
 epoch: 3, train_loss: 1.0996, test_loss: 1.1733, test_f1: 0.4780
 epoch: 4, train_loss: 1.0682, test_loss: 1.1428, test_f1: 0.4834
 epoch: 5, train_loss: 1.0551, test_loss: 1.1308, test_f1: 0.4838
 epoch: 6, train_loss: 1.0479, test_loss: 1.0944, test_f1: 0.4939
 epoch: 7, train_loss: 1.0443, test_loss: 1.0996, test_f1: 0.5263
 epoch: 8, train_loss: 1.0145, test_loss: 1.0696, test_f1: 0.5049
 epoch: 9, train_loss: 1.0104, test_loss: 1.0707, test_f1: 0.5199
 epoch: 10, train_loss: 1.0035, test_loss: 1.0722, test_f1: 0.5077
 epoch: 11, train_loss: 1.0000, test_loss: 1.0626, test_f1: 0.5301
 epoch: 12, train_loss: 0.9779, test_loss: 1.0618, test_f1: 0.5323
 epoch: 13, train_loss: 0.9848, test_loss: 1.0602, test_f1: 0.5188
 epoch: 14, train_loss: 0.9669, test_loss: 1.0644, test_f1: 0.5358
 epoch: 15, train_loss: 0.9586, test_loss: 1.0533, test_f1: 0.5297
 epoch: 16, train_loss: 0.9454, test_loss: 1.0728, test_f1: 0.5276
 epoch: 17, train_loss: 0.9578, test_loss: 1.0643, test_f1: 0.5505
 epoch: 18, train_loss: 0.9502, test_loss: 1.0545, test_f1: 0.5429
 epoch: 19, train_loss: 0.9330, test_loss: 1.0370, test_f1: 0.5304
 epoch: 20, train_loss: 0.9383, test_loss: 1.0496, test_f1: 0.5466
 epoch: 21, train_loss: 0.9375, test_loss: 1.0454, test_f1: 0.5334
 epoch: 22, train_loss: 0.9186, test_loss: 1.0515, test_f1: 0.5409
 epoch: 23, train_loss: 0.9290, test_loss: 1.0414, test_f1: 0.5452
 epoch: 24, train_loss: 0.9223, test_loss: 1.0110, test_f1: 0.5520
 epoch: 25, train_loss: 0.9101, test_loss: 1.0319, test_f1: 0.5406
 epoch: 26, train_loss: 0.9165, test_loss: 1.0382, test_f1: 0.5596
 epoch: 27, train_loss: 0.9013, test_loss: 1.0351, test_f1: 0.5652
 epoch: 28, train_loss: 0.8963, test_loss: 1.0397, test_f1: 0.5620
 epoch: 29, train_loss: 0.9162, test_loss: 1.0237, test_f1: 0.5616
 epoch: 30, train_loss: 0.9000, test_loss: 1.0320, test_f1: 0.5582
 epoch: 31, train_loss: 0.8971, test_loss: 1.0349, test_f1: 0.5732
 epoch: 32, train_loss: 0.8954, test_loss: 1.0492, test_f1: 0.5773
 epoch: 33, train_loss: 0.8850, test_loss: 1.0479, test_f1: 0.5595
 epoch: 34, train_loss: 0.8881, test_loss: 1.0581, test_f1: 0.5583
 epoch: 35, train_loss: 0.8800, test_loss: 1.0507, test_f1: 0.5672
 epoch: 36, train_loss: 0.8776, test_loss: 1.0183, test_f1: 0.5685
 epoch: 37, train_loss: 0.8563, test_loss: 1.0383, test_f1: 0.5672
 epoch: 38, train_loss: 0.8587, test_loss: 1.0163, test_f1: 0.5770
 epoch: 39, train_loss: 0.8659, test_loss: 1.0448, test_f1: 0.5532
 epoch: 40, train_loss: 0.8555, test_loss: 1.0416, test_f1: 0.5736
 epoch: 41, train_loss: 0.8422, test_loss: 1.0265, test_f1: 0.5683
 epoch: 42, train_loss: 0.8423, test_loss: 1.0569, test_f1: 0.5654
 epoch: 43, train_loss: 0.8309, test_loss: 1.0328, test_f1: 0.5844
 epoch: 44, train_loss: 0.8414, test_loss: 1.0632, test_f1: 0.5732
 epoch: 45, train_loss: 0.8163, test_loss: 1.0254, test_f1: 0.5814
 epoch: 46, train_loss: 0.8390, test_loss: 1.0563, test_f1: 0.5779
 epoch: 47, train_loss: 0.8390, test_loss: 1.1152, test_f1: 0.5549
 epoch: 48, train_loss: 0.8401, test_loss: 1.0839, test_f1: 0.5717
 epoch: 49, train_loss: 0.8343, test_loss: 1.0237, test_f1: 0.5921
 epoch: 50, train_loss: 0.8092, test_loss: 1.0240, test_f1: 0.5938
 epoch: 51, train_loss: 0.8227, test_loss: 1.0498, test_f1: 0.5898
 epoch: 52, train_loss: 0.8175, test_loss: 1.0832, test_f1: 0.5730
 epoch: 53, train_loss: 0.8187, test_loss: 1.0486, test_f1: 0.5905
 epoch: 54, train_loss: 0.8026, test_loss: 1.0589, test_f1: 0.5734
 epoch: 55, train_loss: 0.8063, test_loss: 1.0543, test_f1: 0.5838
 epoch: 56, train_loss: 0.8048, test_loss: 1.0687, test_f1: 0.5735
 epoch: 57, train_loss: 0.7947, test_loss: 1.0444, test_f1: 0.5944
 epoch: 58, train_loss: 0.8134, test_loss: 1.0549, test_f1: 0.5763
 epoch: 59, train_loss: 0.7861, test_loss: 1.0428, test_f1: 0.5889
 epoch: 60, train_loss: 0.7938, test_loss: 1.0443, test_f1: 0.5901
 epoch: 61, train_loss: 0.7893, test_loss: 1.0360, test_f1: 0.5892
 epoch: 62, train_loss: 0.7873, test_loss: 1.0640, test_f1: 0.5754
 epoch: 63, train_loss: 0.7817, test_loss: 1.0488, test_f1: 0.5914
 epoch: 64, train_loss: 0.7919, test_loss: 1.0697, test_f1: 0.5800
 epoch: 65, train_loss: 0.7829, test_loss: 1.0606, test_f1: 0.5922
 epoch: 66, train_loss: 0.7855, test_loss: 1.0812, test_f1: 0.5912
 epoch: 67, train_loss: 0.7784, test_loss: 1.1054, test_f1: 0.5745
 epoch: 68, train_loss: 0.7751, test_loss: 1.0694, test_f1: 0.5828
 epoch: 69, train_loss: 0.7774, test_loss: 1.0785, test_f1: 0.5896
 epoch: 70, train_loss: 0.7727, test_loss: 1.0891, test_f1: 0.5857
 epoch: 71, train_loss: 0.7802, test_loss: 1.0585, test_f1: 0.6033
 epoch: 72, train_loss: 0.7710, test_loss: 1.0962, test_f1: 0.5895
 epoch: 73, train_loss: 0.7508, test_loss: 1.1050, test_f1: 0.5902
 epoch: 74, train_loss: 0.7682, test_loss: 1.0726, test_f1: 0.5950
 epoch: 75, train_loss: 0.7629, test_loss: 1.0989, test_f1: 0.5782
 epoch: 76, train_loss: 0.7791, test_loss: 1.1118, test_f1: 0.5798
 epoch: 77, train_loss: 0.7714, test_loss: 1.1145, test_f1: 0.5902
 epoch: 78, train_loss: 0.7568, test_loss: 1.1143, test_f1: 0.5794
 epoch: 79, train_loss: 0.7794, test_loss: 1.1317, test_f1: 0.5833
 epoch: 80, train_loss: 0.7678, test_loss: 1.1050, test_f1: 0.5836
 epoch: 81, train_loss: 0.7658, test_loss: 1.1134, test_f1: 0.5853
 epoch: 82, train_loss: 0.7654, test_loss: 1.1071, test_f1: 0.5940
 epoch: 83, train_loss: 0.7491, test_loss: 1.1270, test_f1: 0.5864
 epoch: 84, train_loss: 0.7450, test_loss: 1.0840, test_f1: 0.6058
 epoch: 85, train_loss: 0.7449, test_loss: 1.0672, test_f1: 0.6033
 epoch: 86, train_loss: 0.7539, test_loss: 1.1520, test_f1: 0.5742
 epoch: 87, train_loss: 0.7542, test_loss: 1.1242, test_f1: 0.5856
 epoch: 88, train_loss: 0.7423, test_loss: 1.1155, test_f1: 0.5887
 epoch: 89, train_loss: 0.7409, test_loss: 1.1442, test_f1: 0.5769
 epoch: 90, train_loss: 0.7480, test_loss: 1.1431, test_f1: 0.5943
 epoch: 91, train_loss: 0.7383, test_loss: 1.1001, test_f1: 0.5908
 epoch: 92, train_loss: 0.7582, test_loss: 1.1413, test_f1: 0.5886
 epoch: 93, train_loss: 0.7385, test_loss: 1.1318, test_f1: 0.5875
 epoch: 94, train_loss: 0.7413, test_loss: 1.1184, test_f1: 0.5814
 epoch: 95, train_loss: 0.7457, test_loss: 1.1528, test_f1: 0.5734
 epoch: 96, train_loss: 0.7329, test_loss: 1.1050, test_f1: 0.5984
 epoch: 97, train_loss: 0.7340, test_loss: 1.1404, test_f1: 0.5917
 epoch: 98, train_loss: 0.7417, test_loss: 1.1411, test_f1: 0.5837
 epoch: 99, train_loss: 0.7369, test_loss: 1.1379, test_f1: 0.5883

Training completed in 537.31 seconds
Best F1: 0.6139 at epoch 76
Mean F1 across iterations: 0.5924  0.0160
========================FINAL RESULTS================================
FEGIN weighted F1: 0.6139  0.0160
python main.py --data ltspice_demos --representation component_net --model FEGIN --layers 6 --hiddens 64 --batch_size 64 --lr 0.0001 --emb_size 512 --epochs 100 --save_appendix component_net_L6_H64_BS64_LR0.0001_E512 --no_val
-----



STDERR:
  File "main.py", line 370, in <module>
    main()
  File "main.py", line 254, in main
    dataset = dataset_class(
  File "/home/philip/projects/ltspice_examples_code_repo/Circuit-Completion-Using-GNNs/component_classification_with_link_prediction_head/evaluation/FEGIN/kernel/circuit_datasets.py", line 15, in __init__
    self.data, self.slices = torch.load(self.processed_paths[0])
  File "/home/philip/.local/lib/python3.8/site-packages/torch/serialization.py", line 1040, in load
    warnings.warn(
  File "/usr/lib/python3.8/warnings.py", line 109, in _showwarnmsg
    sw(msg.message, msg.category, msg.filename, msg.lineno,
  File "main.py", line 47, in warn_with_traceback
    traceback.print_stack(file=log)
/home/philip/projects/ltspice_examples_code_repo/Circuit-Completion-Using-GNNs/component_classification_with_link_prediction_head/evaluation/FEGIN/kernel/circuit_datasets.py:15: FutureWarning: You are using `torch.load` with `weights_only=False` (the current default value), which uses the default pickle module implicitly. It is possible to construct malicious pickle data which will execute arbitrary code during unpickling (See https://github.com/pytorch/pytorch/blob/main/SECURITY.md#untrusted-models for more details). In a future release, the default value for `weights_only` will be flipped to `True`. This limits the functions that could be executed during unpickling. Arbitrary objects will no longer be allowed to be loaded via this mode unless they are explicitly allowlisted by the user via `torch.serialization.add_safe_globals`. We recommend you start setting `weights_only=True` for any use case where you don't have full control of the loaded file. Please open an issue on GitHub for any issues related to this experimental feature.
  self.data, self.slices = torch.load(self.processed_paths[0])
