STDOUT:
Results will be saved in /home/philip/projects/ltspice_examples_code_repo/Circuit-Completion-Using-GNNs/component_classification_with_link_prediction_head/evaluation/FEGIN/results/model_FEGIN_dataset_ltspice_demos
Command line input: python main.py --data ltspice_demos --representation component_net --model FEGIN --layers 6 --hiddens 64 --batch_size 64 --lr 0.0001 --emb_size 512 --epochs 100 --save_appendix component_net_L6_H64_BS64_LR0.0001_E512 --no_val
 is saved.
-----
ltspice_demos - FEGIN
Using 6 layers, 64 hidden units, h = 2
Loading component_net representation dataset
ENTERED
Training FEGIN on component_net representation
Train: 1565, Test: 383
##################ITERATION #0 ****************************************
 epoch: 0, train_loss: 1.3760, test_loss: 1.3862, test_f1: 0.1365
 epoch: 1, train_loss: 1.3528, test_loss: 1.3745, test_f1: 0.1365
 epoch: 2, train_loss: 1.3337, test_loss: 1.3612, test_f1: 0.1365
 epoch: 3, train_loss: 1.3087, test_loss: 1.3348, test_f1: 0.1365
 epoch: 4, train_loss: 1.2798, test_loss: 1.3038, test_f1: 0.1365
 epoch: 5, train_loss: 1.2485, test_loss: 1.2782, test_f1: 0.1632
 epoch: 6, train_loss: 1.2165, test_loss: 1.2528, test_f1: 0.2004
 epoch: 7, train_loss: 1.1914, test_loss: 1.2330, test_f1: 0.3139
 epoch: 8, train_loss: 1.1685, test_loss: 1.2175, test_f1: 0.3598
 epoch: 9, train_loss: 1.1576, test_loss: 1.2069, test_f1: 0.3039
 epoch: 10, train_loss: 1.1481, test_loss: 1.1961, test_f1: 0.3158
 epoch: 11, train_loss: 1.1416, test_loss: 1.1897, test_f1: 0.3189
 epoch: 12, train_loss: 1.1353, test_loss: 1.1838, test_f1: 0.3124
 epoch: 13, train_loss: 1.1216, test_loss: 1.1742, test_f1: 0.3270
 epoch: 14, train_loss: 1.1158, test_loss: 1.1679, test_f1: 0.3427
 epoch: 15, train_loss: 1.1125, test_loss: 1.1635, test_f1: 0.3225
 epoch: 16, train_loss: 1.1045, test_loss: 1.1572, test_f1: 0.3409
 epoch: 17, train_loss: 1.0923, test_loss: 1.1558, test_f1: 0.3460
 epoch: 18, train_loss: 1.0926, test_loss: 1.1529, test_f1: 0.3601
 epoch: 19, train_loss: 1.0816, test_loss: 1.1449, test_f1: 0.4104
 epoch: 20, train_loss: 1.0749, test_loss: 1.1385, test_f1: 0.4373
 epoch: 21, train_loss: 1.0663, test_loss: 1.1297, test_f1: 0.4298
 epoch: 22, train_loss: 1.0618, test_loss: 1.1272, test_f1: 0.4525
 epoch: 23, train_loss: 1.0587, test_loss: 1.1194, test_f1: 0.4557
 epoch: 24, train_loss: 1.0553, test_loss: 1.1099, test_f1: 0.4891
 epoch: 25, train_loss: 1.0391, test_loss: 1.1036, test_f1: 0.4653
 epoch: 26, train_loss: 1.0333, test_loss: 1.0996, test_f1: 0.4969
 epoch: 27, train_loss: 1.0269, test_loss: 1.1147, test_f1: 0.4618
 epoch: 28, train_loss: 1.0229, test_loss: 1.1316, test_f1: 0.4946
 epoch: 29, train_loss: 1.0179, test_loss: 1.0793, test_f1: 0.5116
 epoch: 30, train_loss: 1.0129, test_loss: 1.0779, test_f1: 0.4975
 epoch: 31, train_loss: 1.0021, test_loss: 1.0819, test_f1: 0.4915
 epoch: 32, train_loss: 0.9922, test_loss: 1.0792, test_f1: 0.4885
 epoch: 33, train_loss: 0.9829, test_loss: 1.0706, test_f1: 0.5107
 epoch: 34, train_loss: 0.9790, test_loss: 1.0603, test_f1: 0.5263
 epoch: 35, train_loss: 0.9746, test_loss: 1.0744, test_f1: 0.5077
 epoch: 36, train_loss: 0.9738, test_loss: 1.0511, test_f1: 0.5269
 epoch: 37, train_loss: 0.9586, test_loss: 1.0515, test_f1: 0.5171
 epoch: 38, train_loss: 0.9454, test_loss: 1.0415, test_f1: 0.5223
 epoch: 39, train_loss: 0.9578, test_loss: 1.0583, test_f1: 0.5363
 epoch: 40, train_loss: 0.9432, test_loss: 1.0541, test_f1: 0.5283
 epoch: 41, train_loss: 0.9339, test_loss: 1.0491, test_f1: 0.5202
 epoch: 42, train_loss: 0.9281, test_loss: 1.0409, test_f1: 0.5374
 epoch: 43, train_loss: 0.9081, test_loss: 1.0532, test_f1: 0.5250
 epoch: 44, train_loss: 0.9145, test_loss: 1.0493, test_f1: 0.5263
 epoch: 45, train_loss: 0.9026, test_loss: 1.0559, test_f1: 0.5371
 epoch: 46, train_loss: 0.8962, test_loss: 1.0628, test_f1: 0.5336
 epoch: 47, train_loss: 0.8919, test_loss: 1.0645, test_f1: 0.5346
 epoch: 48, train_loss: 0.8849, test_loss: 1.0667, test_f1: 0.5317
 epoch: 49, train_loss: 0.8822, test_loss: 1.0767, test_f1: 0.5198
 epoch: 50, train_loss: 0.8827, test_loss: 1.0778, test_f1: 0.5258
 epoch: 51, train_loss: 0.8692, test_loss: 1.1059, test_f1: 0.5233
 epoch: 52, train_loss: 0.8603, test_loss: 1.0944, test_f1: 0.5326
 epoch: 53, train_loss: 0.8681, test_loss: 1.0863, test_f1: 0.5350
 epoch: 54, train_loss: 0.8613, test_loss: 1.0807, test_f1: 0.5389
 epoch: 55, train_loss: 0.8658, test_loss: 1.0694, test_f1: 0.5313
 epoch: 56, train_loss: 0.8558, test_loss: 1.0833, test_f1: 0.5409
 epoch: 57, train_loss: 0.8611, test_loss: 1.0814, test_f1: 0.5377
 epoch: 58, train_loss: 0.8490, test_loss: 1.0788, test_f1: 0.5438
 epoch: 59, train_loss: 0.8607, test_loss: 1.0873, test_f1: 0.5322
 epoch: 60, train_loss: 0.8533, test_loss: 1.0938, test_f1: 0.5317
 epoch: 61, train_loss: 0.8478, test_loss: 1.0931, test_f1: 0.5515
 epoch: 62, train_loss: 0.8546, test_loss: 1.1017, test_f1: 0.5517
 epoch: 63, train_loss: 0.8578, test_loss: 1.1111, test_f1: 0.5413
 epoch: 64, train_loss: 0.8477, test_loss: 1.0608, test_f1: 0.5367
 epoch: 65, train_loss: 0.8538, test_loss: 1.0993, test_f1: 0.5447
 epoch: 66, train_loss: 0.8532, test_loss: 1.1241, test_f1: 0.5425
 epoch: 67, train_loss: 0.8449, test_loss: 1.0977, test_f1: 0.5377
 epoch: 68, train_loss: 0.8339, test_loss: 1.1176, test_f1: 0.5396
 epoch: 69, train_loss: 0.8338, test_loss: 1.1183, test_f1: 0.5404
 epoch: 70, train_loss: 0.8340, test_loss: 1.1091, test_f1: 0.5402
 epoch: 71, train_loss: 0.8294, test_loss: 1.1281, test_f1: 0.5364
 epoch: 72, train_loss: 0.8345, test_loss: 1.1170, test_f1: 0.5355
 epoch: 73, train_loss: 0.8410, test_loss: 1.1265, test_f1: 0.5325
 epoch: 74, train_loss: 0.8178, test_loss: 1.1552, test_f1: 0.5256
 epoch: 75, train_loss: 0.8307, test_loss: 1.1030, test_f1: 0.5405
 epoch: 76, train_loss: 0.8300, test_loss: 1.1451, test_f1: 0.5434
 epoch: 77, train_loss: 0.8173, test_loss: 1.1387, test_f1: 0.5456
 epoch: 78, train_loss: 0.8075, test_loss: 1.1687, test_f1: 0.5158
 epoch: 79, train_loss: 0.8179, test_loss: 1.1392, test_f1: 0.5320
 epoch: 80, train_loss: 0.8297, test_loss: 1.1446, test_f1: 0.5305
 epoch: 81, train_loss: 0.8130, test_loss: 1.1213, test_f1: 0.5280
 epoch: 82, train_loss: 0.8142, test_loss: 1.1629, test_f1: 0.5194
 epoch: 83, train_loss: 0.7999, test_loss: 1.1517, test_f1: 0.5403
 epoch: 84, train_loss: 0.8101, test_loss: 1.1502, test_f1: 0.5374
 epoch: 85, train_loss: 0.8179, test_loss: 1.1529, test_f1: 0.5420
 epoch: 86, train_loss: 0.8107, test_loss: 1.1575, test_f1: 0.5326
 epoch: 87, train_loss: 0.8011, test_loss: 1.1193, test_f1: 0.5477
 epoch: 88, train_loss: 0.8149, test_loss: 1.1620, test_f1: 0.5347
 epoch: 89, train_loss: 0.8063, test_loss: 1.1205, test_f1: 0.5407
 epoch: 90, train_loss: 0.8044, test_loss: 1.1393, test_f1: 0.5466
 epoch: 91, train_loss: 0.8029, test_loss: 1.1636, test_f1: 0.5374
 epoch: 92, train_loss: 0.7989, test_loss: 1.1222, test_f1: 0.5356
 epoch: 93, train_loss: 0.7835, test_loss: 1.1437, test_f1: 0.5252
 epoch: 94, train_loss: 0.7962, test_loss: 1.1657, test_f1: 0.5390
 epoch: 95, train_loss: 0.8005, test_loss: 1.1436, test_f1: 0.5373
 epoch: 96, train_loss: 0.7836, test_loss: 1.1905, test_f1: 0.5213
 epoch: 97, train_loss: 0.8002, test_loss: 1.1831, test_f1: 0.5297
 epoch: 98, train_loss: 0.7947, test_loss: 1.1482, test_f1: 0.5328
 epoch: 99, train_loss: 0.7999, test_loss: 1.1654, test_f1: 0.5486
##################ITERATION #1 ****************************************
 epoch: 0, train_loss: 1.3359, test_loss: 1.3625, test_f1: 0.1365
 epoch: 1, train_loss: 1.2746, test_loss: 1.3231, test_f1: 0.2018
 epoch: 2, train_loss: 1.2313, test_loss: 1.2623, test_f1: 0.2746
 epoch: 3, train_loss: 1.2021, test_loss: 1.2284, test_f1: 0.3243
 epoch: 4, train_loss: 1.1768, test_loss: 1.2079, test_f1: 0.3537
 epoch: 5, train_loss: 1.1584, test_loss: 1.1892, test_f1: 0.3622
 epoch: 6, train_loss: 1.1370, test_loss: 1.1751, test_f1: 0.3777
 epoch: 7, train_loss: 1.1226, test_loss: 1.1652, test_f1: 0.4082
 epoch: 8, train_loss: 1.1076, test_loss: 1.1483, test_f1: 0.4182
 epoch: 9, train_loss: 1.1000, test_loss: 1.1393, test_f1: 0.4221
 epoch: 10, train_loss: 1.0916, test_loss: 1.1321, test_f1: 0.4641
 epoch: 11, train_loss: 1.0833, test_loss: 1.1238, test_f1: 0.4691
 epoch: 12, train_loss: 1.0690, test_loss: 1.1113, test_f1: 0.4743
 epoch: 13, train_loss: 1.0648, test_loss: 1.1002, test_f1: 0.4848
 epoch: 14, train_loss: 1.0505, test_loss: 1.0961, test_f1: 0.4961
 epoch: 15, train_loss: 1.0455, test_loss: 1.0872, test_f1: 0.4999
 epoch: 16, train_loss: 1.0366, test_loss: 1.0799, test_f1: 0.4994
 epoch: 17, train_loss: 1.0274, test_loss: 1.0711, test_f1: 0.5138
 epoch: 18, train_loss: 1.0208, test_loss: 1.0676, test_f1: 0.5009
 epoch: 19, train_loss: 1.0138, test_loss: 1.0555, test_f1: 0.5027
 epoch: 20, train_loss: 0.9985, test_loss: 1.0454, test_f1: 0.5126
 epoch: 21, train_loss: 0.9958, test_loss: 1.0567, test_f1: 0.5150
 epoch: 22, train_loss: 0.9774, test_loss: 1.0368, test_f1: 0.5192
 epoch: 23, train_loss: 0.9713, test_loss: 1.0408, test_f1: 0.5239
 epoch: 24, train_loss: 0.9747, test_loss: 1.0319, test_f1: 0.5049
 epoch: 25, train_loss: 0.9600, test_loss: 1.0212, test_f1: 0.5428
 epoch: 26, train_loss: 0.9497, test_loss: 1.0321, test_f1: 0.5374
 epoch: 27, train_loss: 0.9542, test_loss: 1.0168, test_f1: 0.5474
 epoch: 28, train_loss: 0.9457, test_loss: 1.0232, test_f1: 0.5300
 epoch: 29, train_loss: 0.9435, test_loss: 1.0126, test_f1: 0.5324
 epoch: 30, train_loss: 0.9301, test_loss: 1.0128, test_f1: 0.5237
 epoch: 31, train_loss: 0.9429, test_loss: 1.0131, test_f1: 0.5445
 epoch: 32, train_loss: 0.9204, test_loss: 0.9943, test_f1: 0.5355
 epoch: 33, train_loss: 0.9181, test_loss: 0.9885, test_f1: 0.5299
 epoch: 34, train_loss: 0.9138, test_loss: 1.0006, test_f1: 0.5362
 epoch: 35, train_loss: 0.9048, test_loss: 0.9837, test_f1: 0.5360
 epoch: 36, train_loss: 0.9031, test_loss: 1.0111, test_f1: 0.5349
 epoch: 37, train_loss: 0.8949, test_loss: 0.9989, test_f1: 0.5339
 epoch: 38, train_loss: 0.8833, test_loss: 0.9922, test_f1: 0.5452
 epoch: 39, train_loss: 0.8770, test_loss: 0.9909, test_f1: 0.5435
 epoch: 40, train_loss: 0.8837, test_loss: 0.9693, test_f1: 0.5416
 epoch: 41, train_loss: 0.8756, test_loss: 0.9883, test_f1: 0.5596
 epoch: 42, train_loss: 0.8731, test_loss: 1.0097, test_f1: 0.5705
 epoch: 43, train_loss: 0.8680, test_loss: 0.9799, test_f1: 0.5556
 epoch: 44, train_loss: 0.8589, test_loss: 0.9727, test_f1: 0.5560
 epoch: 45, train_loss: 0.8573, test_loss: 0.9732, test_f1: 0.5577
 epoch: 46, train_loss: 0.8598, test_loss: 0.9883, test_f1: 0.5475
 epoch: 47, train_loss: 0.8344, test_loss: 1.0001, test_f1: 0.5579
 epoch: 48, train_loss: 0.8368, test_loss: 0.9530, test_f1: 0.5750
 epoch: 49, train_loss: 0.8347, test_loss: 0.9790, test_f1: 0.5626
 epoch: 50, train_loss: 0.8322, test_loss: 0.9906, test_f1: 0.5655
 epoch: 51, train_loss: 0.8362, test_loss: 0.9632, test_f1: 0.5588
 epoch: 52, train_loss: 0.8271, test_loss: 0.9933, test_f1: 0.5778
 epoch: 53, train_loss: 0.8292, test_loss: 0.9986, test_f1: 0.5607
 epoch: 54, train_loss: 0.8107, test_loss: 1.0065, test_f1: 0.5711
 epoch: 55, train_loss: 0.8163, test_loss: 1.0007, test_f1: 0.5568
 epoch: 56, train_loss: 0.8170, test_loss: 0.9868, test_f1: 0.5569
 epoch: 57, train_loss: 0.8222, test_loss: 1.0055, test_f1: 0.5707
 epoch: 58, train_loss: 0.8111, test_loss: 1.0113, test_f1: 0.5690
 epoch: 59, train_loss: 0.8170, test_loss: 0.9886, test_f1: 0.5690
 epoch: 60, train_loss: 0.7979, test_loss: 0.9968, test_f1: 0.5854
 epoch: 61, train_loss: 0.8016, test_loss: 1.0155, test_f1: 0.5636
 epoch: 62, train_loss: 0.8104, test_loss: 1.0487, test_f1: 0.5695
 epoch: 63, train_loss: 0.8058, test_loss: 1.0198, test_f1: 0.5685
 epoch: 64, train_loss: 0.7981, test_loss: 1.0165, test_f1: 0.5728
 epoch: 65, train_loss: 0.8074, test_loss: 1.0020, test_f1: 0.5817
 epoch: 66, train_loss: 0.8004, test_loss: 1.0175, test_f1: 0.5707
 epoch: 67, train_loss: 0.7954, test_loss: 1.0063, test_f1: 0.5973
 epoch: 68, train_loss: 0.7999, test_loss: 1.0167, test_f1: 0.5828
 epoch: 69, train_loss: 0.7908, test_loss: 1.0254, test_f1: 0.5951
 epoch: 70, train_loss: 0.7965, test_loss: 1.0136, test_f1: 0.5784
 epoch: 71, train_loss: 0.7951, test_loss: 1.0219, test_f1: 0.5783
 epoch: 72, train_loss: 0.7746, test_loss: 1.0428, test_f1: 0.5872
 epoch: 73, train_loss: 0.7761, test_loss: 1.0271, test_f1: 0.5902
 epoch: 74, train_loss: 0.7854, test_loss: 1.0167, test_f1: 0.5854
 epoch: 75, train_loss: 0.7828, test_loss: 1.0598, test_f1: 0.5883
 epoch: 76, train_loss: 0.7842, test_loss: 1.0455, test_f1: 0.5820
 epoch: 77, train_loss: 0.7823, test_loss: 1.0184, test_f1: 0.5758
 epoch: 78, train_loss: 0.7808, test_loss: 1.0311, test_f1: 0.5927
 epoch: 79, train_loss: 0.7674, test_loss: 1.0475, test_f1: 0.5828
 epoch: 80, train_loss: 0.7734, test_loss: 1.0436, test_f1: 0.5904
 epoch: 81, train_loss: 0.7741, test_loss: 1.0006, test_f1: 0.5930
 epoch: 82, train_loss: 0.7719, test_loss: 1.0258, test_f1: 0.5846
 epoch: 83, train_loss: 0.7621, test_loss: 1.0605, test_f1: 0.5863
 epoch: 84, train_loss: 0.7736, test_loss: 1.0238, test_f1: 0.5911
 epoch: 85, train_loss: 0.7620, test_loss: 1.0291, test_f1: 0.5945
 epoch: 86, train_loss: 0.7772, test_loss: 1.0357, test_f1: 0.5878
 epoch: 87, train_loss: 0.7650, test_loss: 1.0581, test_f1: 0.5860
 epoch: 88, train_loss: 0.7644, test_loss: 1.0544, test_f1: 0.5719
 epoch: 89, train_loss: 0.7565, test_loss: 1.0556, test_f1: 0.5894
 epoch: 90, train_loss: 0.7688, test_loss: 1.0825, test_f1: 0.5848
 epoch: 91, train_loss: 0.7512, test_loss: 1.0697, test_f1: 0.5784
 epoch: 92, train_loss: 0.7597, test_loss: 1.0862, test_f1: 0.5833
 epoch: 93, train_loss: 0.7570, test_loss: 1.0625, test_f1: 0.5833
 epoch: 94, train_loss: 0.7717, test_loss: 1.0858, test_f1: 0.5695
 epoch: 95, train_loss: 0.7509, test_loss: 1.0613, test_f1: 0.5813
 epoch: 96, train_loss: 0.7555, test_loss: 1.0760, test_f1: 0.5823
 epoch: 97, train_loss: 0.7598, test_loss: 1.0839, test_f1: 0.5770
 epoch: 98, train_loss: 0.7616, test_loss: 1.0668, test_f1: 0.5781
 epoch: 99, train_loss: 0.7489, test_loss: 1.0791, test_f1: 0.5837
##################ITERATION #2 ****************************************
 epoch: 0, train_loss: 1.2751, test_loss: 1.3450, test_f1: 0.2281
 epoch: 1, train_loss: 1.2094, test_loss: 1.3133, test_f1: 0.2806
 epoch: 2, train_loss: 1.1772, test_loss: 1.2779, test_f1: 0.3252
 epoch: 3, train_loss: 1.1542, test_loss: 1.2280, test_f1: 0.3824
 epoch: 4, train_loss: 1.1332, test_loss: 1.1919, test_f1: 0.3574
 epoch: 5, train_loss: 1.1143, test_loss: 1.1695, test_f1: 0.4499
 epoch: 6, train_loss: 1.0979, test_loss: 1.1478, test_f1: 0.4502
 epoch: 7, train_loss: 1.0844, test_loss: 1.1355, test_f1: 0.4754
 epoch: 8, train_loss: 1.0655, test_loss: 1.1246, test_f1: 0.4845
 epoch: 9, train_loss: 1.0685, test_loss: 1.1126, test_f1: 0.4636
 epoch: 10, train_loss: 1.0371, test_loss: 1.1071, test_f1: 0.4970
 epoch: 11, train_loss: 1.0275, test_loss: 1.0938, test_f1: 0.5010
 epoch: 12, train_loss: 1.0173, test_loss: 1.0838, test_f1: 0.4975
 epoch: 13, train_loss: 1.0078, test_loss: 1.0750, test_f1: 0.5141
 epoch: 14, train_loss: 0.9971, test_loss: 1.0696, test_f1: 0.5044
 epoch: 15, train_loss: 0.9881, test_loss: 1.0688, test_f1: 0.5140
 epoch: 16, train_loss: 0.9723, test_loss: 1.0648, test_f1: 0.5188
 epoch: 17, train_loss: 0.9644, test_loss: 1.0681, test_f1: 0.5257
 epoch: 18, train_loss: 0.9531, test_loss: 1.0497, test_f1: 0.5264
 epoch: 19, train_loss: 0.9546, test_loss: 1.0418, test_f1: 0.5377
 epoch: 20, train_loss: 0.9394, test_loss: 1.0553, test_f1: 0.5381
 epoch: 21, train_loss: 0.9384, test_loss: 1.0413, test_f1: 0.5471
 epoch: 22, train_loss: 0.9381, test_loss: 1.0401, test_f1: 0.5620
 epoch: 23, train_loss: 0.9243, test_loss: 1.0734, test_f1: 0.5512
 epoch: 24, train_loss: 0.9171, test_loss: 1.0308, test_f1: 0.5415
 epoch: 25, train_loss: 0.9136, test_loss: 1.0407, test_f1: 0.5639
 epoch: 26, train_loss: 0.8992, test_loss: 1.0508, test_f1: 0.5728
 epoch: 27, train_loss: 0.9066, test_loss: 1.0639, test_f1: 0.5568
 epoch: 28, train_loss: 0.9071, test_loss: 1.0640, test_f1: 0.5620
 epoch: 29, train_loss: 0.8888, test_loss: 1.0423, test_f1: 0.5702
 epoch: 30, train_loss: 0.8864, test_loss: 1.0400, test_f1: 0.5484
 epoch: 31, train_loss: 0.8842, test_loss: 1.0480, test_f1: 0.5721
 epoch: 32, train_loss: 0.8695, test_loss: 1.0788, test_f1: 0.5679
 epoch: 33, train_loss: 0.8661, test_loss: 1.0794, test_f1: 0.5702
 epoch: 34, train_loss: 0.8644, test_loss: 1.0568, test_f1: 0.5826
 epoch: 35, train_loss: 0.8502, test_loss: 1.0786, test_f1: 0.5745
 epoch: 36, train_loss: 0.8602, test_loss: 1.0779, test_f1: 0.5801
 epoch: 37, train_loss: 0.8596, test_loss: 1.0828, test_f1: 0.5599
 epoch: 38, train_loss: 0.8539, test_loss: 1.0580, test_f1: 0.5765
 epoch: 39, train_loss: 0.8434, test_loss: 1.0684, test_f1: 0.5921
 epoch: 40, train_loss: 0.8389, test_loss: 1.1154, test_f1: 0.5701
 epoch: 41, train_loss: 0.8391, test_loss: 1.0938, test_f1: 0.5788
 epoch: 42, train_loss: 0.8338, test_loss: 1.0629, test_f1: 0.5847
 epoch: 43, train_loss: 0.8351, test_loss: 1.1200, test_f1: 0.5675
 epoch: 44, train_loss: 0.8268, test_loss: 1.1262, test_f1: 0.5649
 epoch: 45, train_loss: 0.8268, test_loss: 1.1118, test_f1: 0.5726
 epoch: 46, train_loss: 0.8019, test_loss: 1.1986, test_f1: 0.5592
 epoch: 47, train_loss: 0.8106, test_loss: 1.1014, test_f1: 0.5837
 epoch: 48, train_loss: 0.8114, test_loss: 1.1283, test_f1: 0.5522
 epoch: 49, train_loss: 0.8180, test_loss: 1.0867, test_f1: 0.6048
 epoch: 50, train_loss: 0.8055, test_loss: 1.1683, test_f1: 0.5736
 epoch: 51, train_loss: 0.7976, test_loss: 1.1508, test_f1: 0.5827
 epoch: 52, train_loss: 0.7906, test_loss: 1.1518, test_f1: 0.5860
 epoch: 53, train_loss: 0.7862, test_loss: 1.1390, test_f1: 0.5868
 epoch: 54, train_loss: 0.7943, test_loss: 1.1454, test_f1: 0.5842
 epoch: 55, train_loss: 0.7825, test_loss: 1.1313, test_f1: 0.5810
 epoch: 56, train_loss: 0.7943, test_loss: 1.1530, test_f1: 0.5841
 epoch: 57, train_loss: 0.7864, test_loss: 1.1564, test_f1: 0.5834
 epoch: 58, train_loss: 0.7801, test_loss: 1.1696, test_f1: 0.5843
 epoch: 59, train_loss: 0.7597, test_loss: 1.2031, test_f1: 0.5607
 epoch: 60, train_loss: 0.7831, test_loss: 1.2095, test_f1: 0.5714
 epoch: 61, train_loss: 0.7748, test_loss: 1.2218, test_f1: 0.5697
 epoch: 62, train_loss: 0.7779, test_loss: 1.1999, test_f1: 0.5731
 epoch: 63, train_loss: 0.7773, test_loss: 1.1765, test_f1: 0.5760
 epoch: 64, train_loss: 0.7755, test_loss: 1.2171, test_f1: 0.5626
 epoch: 65, train_loss: 0.7652, test_loss: 1.1822, test_f1: 0.5683
 epoch: 66, train_loss: 0.7640, test_loss: 1.1894, test_f1: 0.5672
 epoch: 67, train_loss: 0.7567, test_loss: 1.1796, test_f1: 0.5788
 epoch: 68, train_loss: 0.7703, test_loss: 1.1647, test_f1: 0.5649
 epoch: 69, train_loss: 0.7662, test_loss: 1.2408, test_f1: 0.5608
 epoch: 70, train_loss: 0.7572, test_loss: 1.2202, test_f1: 0.5615
 epoch: 71, train_loss: 0.7603, test_loss: 1.1743, test_f1: 0.5692
 epoch: 72, train_loss: 0.7553, test_loss: 1.1628, test_f1: 0.5641
 epoch: 73, train_loss: 0.7571, test_loss: 1.1993, test_f1: 0.5704
 epoch: 74, train_loss: 0.7481, test_loss: 1.1535, test_f1: 0.5803
 epoch: 75, train_loss: 0.7326, test_loss: 1.2000, test_f1: 0.5739
 epoch: 76, train_loss: 0.7386, test_loss: 1.2346, test_f1: 0.5714
 epoch: 77, train_loss: 0.7404, test_loss: 1.2179, test_f1: 0.5701
 epoch: 78, train_loss: 0.7501, test_loss: 1.2378, test_f1: 0.5700
 epoch: 79, train_loss: 0.7627, test_loss: 1.2395, test_f1: 0.5750
 epoch: 80, train_loss: 0.7329, test_loss: 1.1753, test_f1: 0.5712
 epoch: 81, train_loss: 0.7377, test_loss: 1.2328, test_f1: 0.5668
 epoch: 82, train_loss: 0.7293, test_loss: 1.1984, test_f1: 0.5599
 epoch: 83, train_loss: 0.7528, test_loss: 1.2386, test_f1: 0.5604
 epoch: 84, train_loss: 0.7392, test_loss: 1.2425, test_f1: 0.5849
 epoch: 85, train_loss: 0.7194, test_loss: 1.2808, test_f1: 0.5699
 epoch: 86, train_loss: 0.7287, test_loss: 1.3149, test_f1: 0.5644
 epoch: 87, train_loss: 0.7314, test_loss: 1.3007, test_f1: 0.5744
 epoch: 88, train_loss: 0.7350, test_loss: 1.2528, test_f1: 0.5780
 epoch: 89, train_loss: 0.7387, test_loss: 1.3059, test_f1: 0.5642
 epoch: 90, train_loss: 0.7281, test_loss: 1.2504, test_f1: 0.5667
 epoch: 91, train_loss: 0.7316, test_loss: 1.2934, test_f1: 0.5695
 epoch: 92, train_loss: 0.7261, test_loss: 1.3077, test_f1: 0.5577
 epoch: 93, train_loss: 0.7165, test_loss: 1.3337, test_f1: 0.5759
 epoch: 94, train_loss: 0.7283, test_loss: 1.3063, test_f1: 0.5618
 epoch: 95, train_loss: 0.7378, test_loss: 1.3438, test_f1: 0.5569
 epoch: 96, train_loss: 0.7242, test_loss: 1.3376, test_f1: 0.5540
 epoch: 97, train_loss: 0.7076, test_loss: 1.3024, test_f1: 0.5660
 epoch: 98, train_loss: 0.7098, test_loss: 1.3083, test_f1: 0.5621
 epoch: 99, train_loss: 0.7166, test_loss: 1.3004, test_f1: 0.5713
##################ITERATION #3 ****************************************
 epoch: 0, train_loss: 1.2615, test_loss: 1.3474, test_f1: 0.2281
 epoch: 1, train_loss: 1.2026, test_loss: 1.2822, test_f1: 0.2587
 epoch: 2, train_loss: 1.1756, test_loss: 1.2473, test_f1: 0.2325
 epoch: 3, train_loss: 1.1507, test_loss: 1.2166, test_f1: 0.3161
 epoch: 4, train_loss: 1.1331, test_loss: 1.1861, test_f1: 0.4075
 epoch: 5, train_loss: 1.1156, test_loss: 1.1726, test_f1: 0.4208
 epoch: 6, train_loss: 1.1005, test_loss: 1.1522, test_f1: 0.4163
 epoch: 7, train_loss: 1.0860, test_loss: 1.1381, test_f1: 0.4363
 epoch: 8, train_loss: 1.0787, test_loss: 1.1275, test_f1: 0.4396
 epoch: 9, train_loss: 1.0603, test_loss: 1.1227, test_f1: 0.4515
 epoch: 10, train_loss: 1.0431, test_loss: 1.1169, test_f1: 0.4780
 epoch: 11, train_loss: 1.0302, test_loss: 1.1015, test_f1: 0.4737
 epoch: 12, train_loss: 1.0326, test_loss: 1.1012, test_f1: 0.4811
 epoch: 13, train_loss: 1.0117, test_loss: 1.0791, test_f1: 0.4867
 epoch: 14, train_loss: 1.0004, test_loss: 1.0840, test_f1: 0.4968
 epoch: 15, train_loss: 1.0058, test_loss: 1.0876, test_f1: 0.4883
 epoch: 16, train_loss: 0.9850, test_loss: 1.0733, test_f1: 0.4974
 epoch: 17, train_loss: 0.9777, test_loss: 1.0687, test_f1: 0.5027
 epoch: 18, train_loss: 0.9736, test_loss: 1.0682, test_f1: 0.5065
 epoch: 19, train_loss: 0.9551, test_loss: 1.0599, test_f1: 0.5150
 epoch: 20, train_loss: 0.9625, test_loss: 1.0719, test_f1: 0.5046
 epoch: 21, train_loss: 0.9587, test_loss: 1.0775, test_f1: 0.5183
 epoch: 22, train_loss: 0.9465, test_loss: 1.0495, test_f1: 0.5189
 epoch: 23, train_loss: 0.9381, test_loss: 1.0490, test_f1: 0.5343
 epoch: 24, train_loss: 0.9302, test_loss: 1.0582, test_f1: 0.5214
 epoch: 25, train_loss: 0.9296, test_loss: 1.0505, test_f1: 0.5316
 epoch: 26, train_loss: 0.9164, test_loss: 1.0424, test_f1: 0.5326
 epoch: 27, train_loss: 0.9220, test_loss: 1.0582, test_f1: 0.5394
 epoch: 28, train_loss: 0.9015, test_loss: 1.0316, test_f1: 0.5402
 epoch: 29, train_loss: 0.9131, test_loss: 1.0473, test_f1: 0.5362
 epoch: 30, train_loss: 0.9025, test_loss: 1.0377, test_f1: 0.5314
 epoch: 31, train_loss: 0.8882, test_loss: 1.0260, test_f1: 0.5572
 epoch: 32, train_loss: 0.8861, test_loss: 1.0344, test_f1: 0.5650
 epoch: 33, train_loss: 0.8674, test_loss: 1.0630, test_f1: 0.5371
 epoch: 34, train_loss: 0.8791, test_loss: 1.0432, test_f1: 0.5518
 epoch: 35, train_loss: 0.8807, test_loss: 1.0871, test_f1: 0.5350
 epoch: 36, train_loss: 0.8558, test_loss: 1.0561, test_f1: 0.5308
 epoch: 37, train_loss: 0.8701, test_loss: 1.0879, test_f1: 0.5393
 epoch: 38, train_loss: 0.8699, test_loss: 1.0689, test_f1: 0.5434
 epoch: 39, train_loss: 0.8593, test_loss: 1.0597, test_f1: 0.5517
 epoch: 40, train_loss: 0.8478, test_loss: 1.0743, test_f1: 0.5478
 epoch: 41, train_loss: 0.8432, test_loss: 1.1059, test_f1: 0.5277
 epoch: 42, train_loss: 0.8477, test_loss: 1.0828, test_f1: 0.5413
 epoch: 43, train_loss: 0.8398, test_loss: 1.1011, test_f1: 0.5554
 epoch: 44, train_loss: 0.8487, test_loss: 1.1156, test_f1: 0.5449
 epoch: 45, train_loss: 0.8216, test_loss: 1.1035, test_f1: 0.5570
 epoch: 46, train_loss: 0.8249, test_loss: 1.0890, test_f1: 0.5357
 epoch: 47, train_loss: 0.8199, test_loss: 1.1116, test_f1: 0.5345
 epoch: 48, train_loss: 0.8246, test_loss: 1.1329, test_f1: 0.5435
 epoch: 49, train_loss: 0.8259, test_loss: 1.1223, test_f1: 0.5466
 epoch: 50, train_loss: 0.8176, test_loss: 1.1489, test_f1: 0.5349
 epoch: 51, train_loss: 0.8110, test_loss: 1.1674, test_f1: 0.5314
 epoch: 52, train_loss: 0.7981, test_loss: 1.1411, test_f1: 0.5407
 epoch: 53, train_loss: 0.7984, test_loss: 1.1485, test_f1: 0.5430
 epoch: 54, train_loss: 0.8082, test_loss: 1.1145, test_f1: 0.5648
 epoch: 55, train_loss: 0.7925, test_loss: 1.1067, test_f1: 0.5574
 epoch: 56, train_loss: 0.7906, test_loss: 1.1247, test_f1: 0.5589
 epoch: 57, train_loss: 0.7969, test_loss: 1.1420, test_f1: 0.5368
 epoch: 58, train_loss: 0.7853, test_loss: 1.1462, test_f1: 0.5404
 epoch: 59, train_loss: 0.7932, test_loss: 1.1592, test_f1: 0.5387
 epoch: 60, train_loss: 0.7685, test_loss: 1.1462, test_f1: 0.5518
 epoch: 61, train_loss: 0.7923, test_loss: 1.1527, test_f1: 0.5475
 epoch: 62, train_loss: 0.7827, test_loss: 1.1491, test_f1: 0.5483
 epoch: 63, train_loss: 0.7911, test_loss: 1.1577, test_f1: 0.5574
 epoch: 64, train_loss: 0.7736, test_loss: 1.1822, test_f1: 0.5534
 epoch: 65, train_loss: 0.7859, test_loss: 1.1417, test_f1: 0.5548
 epoch: 66, train_loss: 0.7856, test_loss: 1.1847, test_f1: 0.5467
 epoch: 67, train_loss: 0.7790, test_loss: 1.1711, test_f1: 0.5368
 epoch: 68, train_loss: 0.7780, test_loss: 1.1546, test_f1: 0.5569
 epoch: 69, train_loss: 0.7748, test_loss: 1.1603, test_f1: 0.5551
 epoch: 70, train_loss: 0.7714, test_loss: 1.1378, test_f1: 0.5563
 epoch: 71, train_loss: 0.7698, test_loss: 1.1480, test_f1: 0.5592
 epoch: 72, train_loss: 0.7853, test_loss: 1.1419, test_f1: 0.5522
 epoch: 73, train_loss: 0.7592, test_loss: 1.1815, test_f1: 0.5482
 epoch: 74, train_loss: 0.7630, test_loss: 1.1648, test_f1: 0.5379
 epoch: 75, train_loss: 0.7628, test_loss: 1.1610, test_f1: 0.5538
 epoch: 76, train_loss: 0.7650, test_loss: 1.1647, test_f1: 0.5479
 epoch: 77, train_loss: 0.7562, test_loss: 1.1710, test_f1: 0.5413
 epoch: 78, train_loss: 0.7705, test_loss: 1.1683, test_f1: 0.5584
 epoch: 79, train_loss: 0.7770, test_loss: 1.1543, test_f1: 0.5526
 epoch: 80, train_loss: 0.7721, test_loss: 1.1764, test_f1: 0.5545
 epoch: 81, train_loss: 0.7646, test_loss: 1.1775, test_f1: 0.5369
 epoch: 82, train_loss: 0.7672, test_loss: 1.1880, test_f1: 0.5479
 epoch: 83, train_loss: 0.7674, test_loss: 1.1796, test_f1: 0.5460
 epoch: 84, train_loss: 0.7631, test_loss: 1.1904, test_f1: 0.5554
 epoch: 85, train_loss: 0.7423, test_loss: 1.1925, test_f1: 0.5467
 epoch: 86, train_loss: 0.7520, test_loss: 1.1886, test_f1: 0.5646
 epoch: 87, train_loss: 0.7570, test_loss: 1.2147, test_f1: 0.5549
 epoch: 88, train_loss: 0.7518, test_loss: 1.1872, test_f1: 0.5614
 epoch: 89, train_loss: 0.7439, test_loss: 1.2126, test_f1: 0.5424
 epoch: 90, train_loss: 0.7580, test_loss: 1.2120, test_f1: 0.5499
 epoch: 91, train_loss: 0.7267, test_loss: 1.2055, test_f1: 0.5532
 epoch: 92, train_loss: 0.7277, test_loss: 1.1912, test_f1: 0.5551
 epoch: 93, train_loss: 0.7446, test_loss: 1.1987, test_f1: 0.5466
 epoch: 94, train_loss: 0.7414, test_loss: 1.1985, test_f1: 0.5645
 epoch: 95, train_loss: 0.7297, test_loss: 1.2094, test_f1: 0.5620
 epoch: 96, train_loss: 0.7455, test_loss: 1.1958, test_f1: 0.5618
 epoch: 97, train_loss: 0.7364, test_loss: 1.2113, test_f1: 0.5773
 epoch: 98, train_loss: 0.7184, test_loss: 1.1770, test_f1: 0.5530
 epoch: 99, train_loss: 0.7256, test_loss: 1.2137, test_f1: 0.5419
##################ITERATION #4 ****************************************
 epoch: 0, train_loss: 1.2648, test_loss: 1.3719, test_f1: 0.2821
 epoch: 1, train_loss: 1.1680, test_loss: 1.2795, test_f1: 0.2607
 epoch: 2, train_loss: 1.1377, test_loss: 1.2343, test_f1: 0.3394
 epoch: 3, train_loss: 1.1207, test_loss: 1.1946, test_f1: 0.3235
 epoch: 4, train_loss: 1.0978, test_loss: 1.1637, test_f1: 0.3582
 epoch: 5, train_loss: 1.0775, test_loss: 1.1517, test_f1: 0.3699
 epoch: 6, train_loss: 1.0681, test_loss: 1.1337, test_f1: 0.3925
 epoch: 7, train_loss: 1.0600, test_loss: 1.1268, test_f1: 0.4257
 epoch: 8, train_loss: 1.0478, test_loss: 1.1135, test_f1: 0.4442
 epoch: 9, train_loss: 1.0214, test_loss: 1.1187, test_f1: 0.4579
 epoch: 10, train_loss: 1.0124, test_loss: 1.1032, test_f1: 0.4777
 epoch: 11, train_loss: 1.0071, test_loss: 1.0905, test_f1: 0.4746
 epoch: 12, train_loss: 0.9907, test_loss: 1.0939, test_f1: 0.4750
 epoch: 13, train_loss: 0.9898, test_loss: 1.0873, test_f1: 0.5052
 epoch: 14, train_loss: 0.9831, test_loss: 1.0700, test_f1: 0.5125
 epoch: 15, train_loss: 0.9689, test_loss: 1.0658, test_f1: 0.5338
 epoch: 16, train_loss: 0.9702, test_loss: 1.0645, test_f1: 0.5267
 epoch: 17, train_loss: 0.9505, test_loss: 1.0657, test_f1: 0.5165
 epoch: 18, train_loss: 0.9387, test_loss: 1.0784, test_f1: 0.5061
 epoch: 19, train_loss: 0.9430, test_loss: 1.0680, test_f1: 0.5308
 epoch: 20, train_loss: 0.9334, test_loss: 1.0636, test_f1: 0.5147
 epoch: 21, train_loss: 0.9396, test_loss: 1.0615, test_f1: 0.5187
 epoch: 22, train_loss: 0.9078, test_loss: 1.0727, test_f1: 0.5363
 epoch: 23, train_loss: 0.9099, test_loss: 1.0610, test_f1: 0.5368
 epoch: 24, train_loss: 0.9049, test_loss: 1.0659, test_f1: 0.5407
 epoch: 25, train_loss: 0.9057, test_loss: 1.0757, test_f1: 0.5187
 epoch: 26, train_loss: 0.9067, test_loss: 1.0546, test_f1: 0.5291
 epoch: 27, train_loss: 0.9008, test_loss: 1.0628, test_f1: 0.5401
 epoch: 28, train_loss: 0.9021, test_loss: 1.0467, test_f1: 0.5484
 epoch: 29, train_loss: 0.8961, test_loss: 1.0265, test_f1: 0.5411
 epoch: 30, train_loss: 0.8807, test_loss: 1.0436, test_f1: 0.5386
 epoch: 31, train_loss: 0.8785, test_loss: 1.0621, test_f1: 0.5569
 epoch: 32, train_loss: 0.8600, test_loss: 1.0462, test_f1: 0.5531
 epoch: 33, train_loss: 0.8571, test_loss: 1.0627, test_f1: 0.5276
 epoch: 34, train_loss: 0.8661, test_loss: 1.0626, test_f1: 0.5417
 epoch: 35, train_loss: 0.8548, test_loss: 1.0875, test_f1: 0.5407
 epoch: 36, train_loss: 0.8457, test_loss: 1.0994, test_f1: 0.5479
 epoch: 37, train_loss: 0.8415, test_loss: 1.0860, test_f1: 0.5506
 epoch: 38, train_loss: 0.8500, test_loss: 1.0751, test_f1: 0.5601
 epoch: 39, train_loss: 0.8318, test_loss: 1.0719, test_f1: 0.5449
 epoch: 40, train_loss: 0.8383, test_loss: 1.0600, test_f1: 0.5725
 epoch: 41, train_loss: 0.8423, test_loss: 1.0656, test_f1: 0.5426
 epoch: 42, train_loss: 0.8254, test_loss: 1.0787, test_f1: 0.5679
 epoch: 43, train_loss: 0.8215, test_loss: 1.0876, test_f1: 0.5481
 epoch: 44, train_loss: 0.8176, test_loss: 1.0951, test_f1: 0.5602
 epoch: 45, train_loss: 0.8140, test_loss: 1.0925, test_f1: 0.5470
 epoch: 46, train_loss: 0.8255, test_loss: 1.0975, test_f1: 0.5697
 epoch: 47, train_loss: 0.8017, test_loss: 1.0839, test_f1: 0.5585
 epoch: 48, train_loss: 0.7971, test_loss: 1.0680, test_f1: 0.5639
 epoch: 49, train_loss: 0.7985, test_loss: 1.0987, test_f1: 0.5586
 epoch: 50, train_loss: 0.8037, test_loss: 1.0753, test_f1: 0.5677
 epoch: 51, train_loss: 0.7951, test_loss: 1.0850, test_f1: 0.5652
 epoch: 52, train_loss: 0.7959, test_loss: 1.0819, test_f1: 0.5752
 epoch: 53, train_loss: 0.7794, test_loss: 1.0997, test_f1: 0.5679
 epoch: 54, train_loss: 0.7698, test_loss: 1.1074, test_f1: 0.5632
 epoch: 55, train_loss: 0.7708, test_loss: 1.1133, test_f1: 0.5693
 epoch: 56, train_loss: 0.7792, test_loss: 1.1347, test_f1: 0.5693
 epoch: 57, train_loss: 0.7755, test_loss: 1.1217, test_f1: 0.5656
 epoch: 58, train_loss: 0.7779, test_loss: 1.1179, test_f1: 0.5656
 epoch: 59, train_loss: 0.7560, test_loss: 1.1658, test_f1: 0.5617
 epoch: 60, train_loss: 0.7583, test_loss: 1.1380, test_f1: 0.5619
 epoch: 61, train_loss: 0.7631, test_loss: 1.1382, test_f1: 0.5614
 epoch: 62, train_loss: 0.7567, test_loss: 1.1490, test_f1: 0.5696
 epoch: 63, train_loss: 0.7675, test_loss: 1.1365, test_f1: 0.5642
 epoch: 64, train_loss: 0.7535, test_loss: 1.1231, test_f1: 0.5750
 epoch: 65, train_loss: 0.7595, test_loss: 1.1230, test_f1: 0.5640
 epoch: 66, train_loss: 0.7629, test_loss: 1.1379, test_f1: 0.5664
 epoch: 67, train_loss: 0.7371, test_loss: 1.1655, test_f1: 0.5691
 epoch: 68, train_loss: 0.7463, test_loss: 1.1690, test_f1: 0.5719
 epoch: 69, train_loss: 0.7464, test_loss: 1.1776, test_f1: 0.5689
 epoch: 70, train_loss: 0.7441, test_loss: 1.1579, test_f1: 0.5599
 epoch: 71, train_loss: 0.7449, test_loss: 1.1673, test_f1: 0.5742
 epoch: 72, train_loss: 0.7446, test_loss: 1.1671, test_f1: 0.5724
 epoch: 73, train_loss: 0.7470, test_loss: 1.1811, test_f1: 0.5643
 epoch: 74, train_loss: 0.7332, test_loss: 1.1923, test_f1: 0.5721
 epoch: 75, train_loss: 0.7307, test_loss: 1.2016, test_f1: 0.5663
 epoch: 76, train_loss: 0.7339, test_loss: 1.1860, test_f1: 0.5666
 epoch: 77, train_loss: 0.7324, test_loss: 1.1616, test_f1: 0.5646
 epoch: 78, train_loss: 0.7465, test_loss: 1.2154, test_f1: 0.5640
 epoch: 79, train_loss: 0.7381, test_loss: 1.1679, test_f1: 0.5748
 epoch: 80, train_loss: 0.7313, test_loss: 1.1789, test_f1: 0.5609
 epoch: 81, train_loss: 0.7286, test_loss: 1.1578, test_f1: 0.5687
 epoch: 82, train_loss: 0.7336, test_loss: 1.1633, test_f1: 0.5684
 epoch: 83, train_loss: 0.7172, test_loss: 1.1663, test_f1: 0.5750
 epoch: 84, train_loss: 0.7299, test_loss: 1.2090, test_f1: 0.5654
 epoch: 85, train_loss: 0.7295, test_loss: 1.1700, test_f1: 0.5686
 epoch: 86, train_loss: 0.7261, test_loss: 1.2542, test_f1: 0.5671
 epoch: 87, train_loss: 0.7220, test_loss: 1.1950, test_f1: 0.5749
 epoch: 88, train_loss: 0.7261, test_loss: 1.2035, test_f1: 0.5830
 epoch: 89, train_loss: 0.7265, test_loss: 1.2001, test_f1: 0.5679
 epoch: 90, train_loss: 0.7248, test_loss: 1.2055, test_f1: 0.5777
 epoch: 91, train_loss: 0.7254, test_loss: 1.2047, test_f1: 0.5674
 epoch: 92, train_loss: 0.7164, test_loss: 1.1953, test_f1: 0.5779
 epoch: 93, train_loss: 0.7208, test_loss: 1.2136, test_f1: 0.5812
 epoch: 94, train_loss: 0.7114, test_loss: 1.2093, test_f1: 0.5759
 epoch: 95, train_loss: 0.7141, test_loss: 1.2082, test_f1: 0.5779
 epoch: 96, train_loss: 0.7160, test_loss: 1.2324, test_f1: 0.5757
 epoch: 97, train_loss: 0.7075, test_loss: 1.2177, test_f1: 0.5786
 epoch: 98, train_loss: 0.6976, test_loss: 1.2447, test_f1: 0.5807
 epoch: 99, train_loss: 0.7031, test_loss: 1.2325, test_f1: 0.5803
##################ITERATION #5 ****************************************
 epoch: 0, train_loss: 1.2237, test_loss: 1.3061, test_f1: 0.2281
 epoch: 1, train_loss: 1.1500, test_loss: 1.2775, test_f1: 0.2721
 epoch: 2, train_loss: 1.1247, test_loss: 1.2435, test_f1: 0.3708
 epoch: 3, train_loss: 1.1146, test_loss: 1.1755, test_f1: 0.3745
 epoch: 4, train_loss: 1.0806, test_loss: 1.1595, test_f1: 0.4201
 epoch: 5, train_loss: 1.0733, test_loss: 1.1393, test_f1: 0.4373
 epoch: 6, train_loss: 1.0741, test_loss: 1.1322, test_f1: 0.4634
 epoch: 7, train_loss: 1.0462, test_loss: 1.1242, test_f1: 0.4523
 epoch: 8, train_loss: 1.0413, test_loss: 1.1012, test_f1: 0.4560
 epoch: 9, train_loss: 1.0304, test_loss: 1.1005, test_f1: 0.4599
 epoch: 10, train_loss: 1.0279, test_loss: 1.0858, test_f1: 0.4985
 epoch: 11, train_loss: 1.0051, test_loss: 1.0863, test_f1: 0.4940
 epoch: 12, train_loss: 1.0001, test_loss: 1.0824, test_f1: 0.4978
 epoch: 13, train_loss: 1.0041, test_loss: 1.0734, test_f1: 0.4998
 epoch: 14, train_loss: 0.9935, test_loss: 1.0813, test_f1: 0.5246
 epoch: 15, train_loss: 0.9690, test_loss: 1.0702, test_f1: 0.5233
 epoch: 16, train_loss: 0.9726, test_loss: 1.0642, test_f1: 0.5228
 epoch: 17, train_loss: 0.9666, test_loss: 1.0643, test_f1: 0.5188
 epoch: 18, train_loss: 0.9555, test_loss: 1.0614, test_f1: 0.5293
 epoch: 19, train_loss: 0.9533, test_loss: 1.0789, test_f1: 0.5236
 epoch: 20, train_loss: 0.9474, test_loss: 1.0708, test_f1: 0.5049
 epoch: 21, train_loss: 0.9533, test_loss: 1.0665, test_f1: 0.5163
 epoch: 22, train_loss: 0.9427, test_loss: 1.0677, test_f1: 0.5220
 epoch: 23, train_loss: 0.9315, test_loss: 1.0690, test_f1: 0.5290
 epoch: 24, train_loss: 0.9275, test_loss: 1.0714, test_f1: 0.5247
 epoch: 25, train_loss: 0.9229, test_loss: 1.0561, test_f1: 0.5425
 epoch: 26, train_loss: 0.9056, test_loss: 1.0572, test_f1: 0.5458
 epoch: 27, train_loss: 0.9097, test_loss: 1.0471, test_f1: 0.5300
 epoch: 28, train_loss: 0.9118, test_loss: 1.0448, test_f1: 0.5403
 epoch: 29, train_loss: 0.9054, test_loss: 1.0368, test_f1: 0.5431
 epoch: 30, train_loss: 0.8920, test_loss: 1.0562, test_f1: 0.5407
 epoch: 31, train_loss: 0.8835, test_loss: 1.0663, test_f1: 0.5298
 epoch: 32, train_loss: 0.8808, test_loss: 1.0620, test_f1: 0.5323
 epoch: 33, train_loss: 0.8917, test_loss: 1.0196, test_f1: 0.5496
 epoch: 34, train_loss: 0.8729, test_loss: 1.0531, test_f1: 0.5359
 epoch: 35, train_loss: 0.8704, test_loss: 1.0595, test_f1: 0.5393
 epoch: 36, train_loss: 0.8676, test_loss: 1.0591, test_f1: 0.5367
 epoch: 37, train_loss: 0.8776, test_loss: 1.0501, test_f1: 0.5393
 epoch: 38, train_loss: 0.8593, test_loss: 1.0480, test_f1: 0.5459
 epoch: 39, train_loss: 0.8673, test_loss: 1.0295, test_f1: 0.5467
 epoch: 40, train_loss: 0.8565, test_loss: 1.0529, test_f1: 0.5451
 epoch: 41, train_loss: 0.8446, test_loss: 1.0270, test_f1: 0.5491
 epoch: 42, train_loss: 0.8444, test_loss: 1.0340, test_f1: 0.5608
 epoch: 43, train_loss: 0.8520, test_loss: 1.0349, test_f1: 0.5576
 epoch: 44, train_loss: 0.8559, test_loss: 1.0344, test_f1: 0.5566
 epoch: 45, train_loss: 0.8305, test_loss: 1.0369, test_f1: 0.5812
 epoch: 46, train_loss: 0.8392, test_loss: 1.0558, test_f1: 0.5514
 epoch: 47, train_loss: 0.8468, test_loss: 1.0516, test_f1: 0.5805
 epoch: 48, train_loss: 0.8389, test_loss: 1.0456, test_f1: 0.5404
 epoch: 49, train_loss: 0.8184, test_loss: 1.0646, test_f1: 0.5611
 epoch: 50, train_loss: 0.8283, test_loss: 1.0418, test_f1: 0.6014
 epoch: 51, train_loss: 0.8133, test_loss: 1.0313, test_f1: 0.5717
 epoch: 52, train_loss: 0.8178, test_loss: 1.0601, test_f1: 0.5746
 epoch: 53, train_loss: 0.8111, test_loss: 1.0314, test_f1: 0.5805
 epoch: 54, train_loss: 0.8100, test_loss: 1.0587, test_f1: 0.5815
 epoch: 55, train_loss: 0.8142, test_loss: 1.0365, test_f1: 0.5628
 epoch: 56, train_loss: 0.8066, test_loss: 1.0288, test_f1: 0.5716
 epoch: 57, train_loss: 0.7962, test_loss: 1.0350, test_f1: 0.5715
 epoch: 58, train_loss: 0.8050, test_loss: 1.0476, test_f1: 0.5938
 epoch: 59, train_loss: 0.7923, test_loss: 1.0440, test_f1: 0.5754
 epoch: 60, train_loss: 0.7880, test_loss: 1.0262, test_f1: 0.5728
 epoch: 61, train_loss: 0.7851, test_loss: 1.0492, test_f1: 0.5636
 epoch: 62, train_loss: 0.7790, test_loss: 1.0360, test_f1: 0.5734
 epoch: 63, train_loss: 0.7831, test_loss: 1.0519, test_f1: 0.5777
 epoch: 64, train_loss: 0.7725, test_loss: 1.0264, test_f1: 0.5731
 epoch: 65, train_loss: 0.7894, test_loss: 1.0397, test_f1: 0.5675
 epoch: 66, train_loss: 0.7917, test_loss: 1.0428, test_f1: 0.5777
 epoch: 67, train_loss: 0.8002, test_loss: 1.0327, test_f1: 0.5680
 epoch: 68, train_loss: 0.7901, test_loss: 1.0374, test_f1: 0.5756
 epoch: 69, train_loss: 0.7892, test_loss: 1.0343, test_f1: 0.5705
 epoch: 70, train_loss: 0.7799, test_loss: 1.0330, test_f1: 0.5845
 epoch: 71, train_loss: 0.7788, test_loss: 1.0377, test_f1: 0.5998
 epoch: 72, train_loss: 0.7677, test_loss: 1.0533, test_f1: 0.5978
 epoch: 73, train_loss: 0.7902, test_loss: 1.0454, test_f1: 0.5861
 epoch: 74, train_loss: 0.7768, test_loss: 1.0583, test_f1: 0.5985
 epoch: 75, train_loss: 0.7735, test_loss: 1.0688, test_f1: 0.5967
 epoch: 76, train_loss: 0.7730, test_loss: 1.0625, test_f1: 0.5775
 epoch: 77, train_loss: 0.7773, test_loss: 1.0348, test_f1: 0.5767
 epoch: 78, train_loss: 0.7648, test_loss: 1.0304, test_f1: 0.5750
 epoch: 79, train_loss: 0.7535, test_loss: 1.0519, test_f1: 0.5695
 epoch: 80, train_loss: 0.7839, test_loss: 1.0480, test_f1: 0.5624
 epoch: 81, train_loss: 0.7644, test_loss: 1.0376, test_f1: 0.5769
 epoch: 82, train_loss: 0.7652, test_loss: 1.0537, test_f1: 0.5672
 epoch: 83, train_loss: 0.7657, test_loss: 1.0519, test_f1: 0.5825
 epoch: 84, train_loss: 0.7674, test_loss: 1.0366, test_f1: 0.5776
 epoch: 85, train_loss: 0.7583, test_loss: 1.0367, test_f1: 0.5915
 epoch: 86, train_loss: 0.7499, test_loss: 1.0231, test_f1: 0.5808
 epoch: 87, train_loss: 0.7592, test_loss: 1.0218, test_f1: 0.5858
 epoch: 88, train_loss: 0.7506, test_loss: 1.0447, test_f1: 0.6002
 epoch: 89, train_loss: 0.7500, test_loss: 1.0184, test_f1: 0.6064
 epoch: 90, train_loss: 0.7380, test_loss: 1.0264, test_f1: 0.5933
 epoch: 91, train_loss: 0.7334, test_loss: 1.0390, test_f1: 0.5911
 epoch: 92, train_loss: 0.7514, test_loss: 1.0368, test_f1: 0.5981
 epoch: 93, train_loss: 0.7545, test_loss: 1.0336, test_f1: 0.5838
 epoch: 94, train_loss: 0.7412, test_loss: 1.0520, test_f1: 0.5909
 epoch: 95, train_loss: 0.7363, test_loss: 1.0732, test_f1: 0.5723
 epoch: 96, train_loss: 0.7392, test_loss: 1.0483, test_f1: 0.5976
 epoch: 97, train_loss: 0.7377, test_loss: 1.0211, test_f1: 0.5956
 epoch: 98, train_loss: 0.7465, test_loss: 1.0178, test_f1: 0.5940
 epoch: 99, train_loss: 0.7365, test_loss: 1.0453, test_f1: 0.5823
##################ITERATION #6 ****************************************
 epoch: 0, train_loss: 1.2123, test_loss: 1.3193, test_f1: 0.2281
 epoch: 1, train_loss: 1.1423, test_loss: 1.3139, test_f1: 0.2506
 epoch: 2, train_loss: 1.1146, test_loss: 1.2174, test_f1: 0.3336
 epoch: 3, train_loss: 1.0871, test_loss: 1.1410, test_f1: 0.4039
 epoch: 4, train_loss: 1.0755, test_loss: 1.1212, test_f1: 0.4324
 epoch: 5, train_loss: 1.0535, test_loss: 1.1092, test_f1: 0.4553
 epoch: 6, train_loss: 1.0478, test_loss: 1.1104, test_f1: 0.4659
 epoch: 7, train_loss: 1.0460, test_loss: 1.0851, test_f1: 0.4907
 epoch: 8, train_loss: 1.0187, test_loss: 1.0836, test_f1: 0.4986
 epoch: 9, train_loss: 1.0125, test_loss: 1.0676, test_f1: 0.5008
 epoch: 10, train_loss: 1.0097, test_loss: 1.0697, test_f1: 0.4811
 epoch: 11, train_loss: 0.9925, test_loss: 1.0657, test_f1: 0.4933
 epoch: 12, train_loss: 0.9877, test_loss: 1.0720, test_f1: 0.4975
 epoch: 13, train_loss: 0.9821, test_loss: 1.0692, test_f1: 0.5116
 epoch: 14, train_loss: 0.9713, test_loss: 1.0529, test_f1: 0.5143
 epoch: 15, train_loss: 0.9635, test_loss: 1.0414, test_f1: 0.5395
 epoch: 16, train_loss: 0.9515, test_loss: 1.0397, test_f1: 0.5299
 epoch: 17, train_loss: 0.9453, test_loss: 1.0630, test_f1: 0.5393
 epoch: 18, train_loss: 0.9492, test_loss: 1.0371, test_f1: 0.5450
 epoch: 19, train_loss: 0.9351, test_loss: 1.0527, test_f1: 0.5465
 epoch: 20, train_loss: 0.9354, test_loss: 1.0376, test_f1: 0.5595
 epoch: 21, train_loss: 0.9159, test_loss: 1.0470, test_f1: 0.5593
 epoch: 22, train_loss: 0.9211, test_loss: 1.0531, test_f1: 0.5564
 epoch: 23, train_loss: 0.9233, test_loss: 1.0566, test_f1: 0.5600
 epoch: 24, train_loss: 0.8986, test_loss: 1.0395, test_f1: 0.5720
 epoch: 25, train_loss: 0.8882, test_loss: 1.0433, test_f1: 0.5691
 epoch: 26, train_loss: 0.9036, test_loss: 1.0886, test_f1: 0.5468
 epoch: 27, train_loss: 0.8905, test_loss: 1.0638, test_f1: 0.5554
 epoch: 28, train_loss: 0.8900, test_loss: 1.0498, test_f1: 0.5772
 epoch: 29, train_loss: 0.8916, test_loss: 1.0533, test_f1: 0.5682
 epoch: 30, train_loss: 0.8733, test_loss: 1.0734, test_f1: 0.5534
 epoch: 31, train_loss: 0.8811, test_loss: 1.0707, test_f1: 0.5663
 epoch: 32, train_loss: 0.8593, test_loss: 1.0980, test_f1: 0.5513
 epoch: 33, train_loss: 0.8585, test_loss: 1.0744, test_f1: 0.5606
 epoch: 34, train_loss: 0.8549, test_loss: 1.0831, test_f1: 0.5594
 epoch: 35, train_loss: 0.8701, test_loss: 1.0567, test_f1: 0.5730
 epoch: 36, train_loss: 0.8387, test_loss: 1.1041, test_f1: 0.5620
 epoch: 37, train_loss: 0.8493, test_loss: 1.1010, test_f1: 0.5566
 epoch: 38, train_loss: 0.8476, test_loss: 1.0608, test_f1: 0.5718
 epoch: 39, train_loss: 0.8372, test_loss: 1.0735, test_f1: 0.5758
 epoch: 40, train_loss: 0.8297, test_loss: 1.0580, test_f1: 0.5809
 epoch: 41, train_loss: 0.8202, test_loss: 1.1109, test_f1: 0.5552
 epoch: 42, train_loss: 0.8253, test_loss: 1.0711, test_f1: 0.5842
 epoch: 43, train_loss: 0.8200, test_loss: 1.0911, test_f1: 0.5842
 epoch: 44, train_loss: 0.8180, test_loss: 1.0704, test_f1: 0.5769
 epoch: 45, train_loss: 0.8185, test_loss: 1.1080, test_f1: 0.5747
 epoch: 46, train_loss: 0.8265, test_loss: 1.0852, test_f1: 0.5968
 epoch: 47, train_loss: 0.8153, test_loss: 1.0665, test_f1: 0.5808
 epoch: 48, train_loss: 0.8052, test_loss: 1.0901, test_f1: 0.5860
 epoch: 49, train_loss: 0.7932, test_loss: 1.0983, test_f1: 0.5857
 epoch: 50, train_loss: 0.7923, test_loss: 1.0608, test_f1: 0.5854
 epoch: 51, train_loss: 0.7862, test_loss: 1.0556, test_f1: 0.5890
 epoch: 52, train_loss: 0.7883, test_loss: 1.0658, test_f1: 0.5970
 epoch: 53, train_loss: 0.7809, test_loss: 1.0856, test_f1: 0.5864
 epoch: 54, train_loss: 0.7776, test_loss: 1.0951, test_f1: 0.5811
 epoch: 55, train_loss: 0.7809, test_loss: 1.1056, test_f1: 0.5854
 epoch: 56, train_loss: 0.7876, test_loss: 1.1001, test_f1: 0.5735
 epoch: 57, train_loss: 0.7752, test_loss: 1.1124, test_f1: 0.5810
 epoch: 58, train_loss: 0.7780, test_loss: 1.0983, test_f1: 0.6016
 epoch: 59, train_loss: 0.7635, test_loss: 1.1303, test_f1: 0.5794
 epoch: 60, train_loss: 0.7701, test_loss: 1.1337, test_f1: 0.5770
 epoch: 61, train_loss: 0.7648, test_loss: 1.1249, test_f1: 0.5784
 epoch: 62, train_loss: 0.7742, test_loss: 1.1301, test_f1: 0.6039
 epoch: 63, train_loss: 0.7699, test_loss: 1.0986, test_f1: 0.5836
 epoch: 64, train_loss: 0.7711, test_loss: 1.1126, test_f1: 0.5854
 epoch: 65, train_loss: 0.7618, test_loss: 1.1144, test_f1: 0.5997
 epoch: 66, train_loss: 0.7615, test_loss: 1.1250, test_f1: 0.5850
 epoch: 67, train_loss: 0.7671, test_loss: 1.1384, test_f1: 0.5828
 epoch: 68, train_loss: 0.7519, test_loss: 1.1528, test_f1: 0.5959
 epoch: 69, train_loss: 0.7690, test_loss: 1.1682, test_f1: 0.5730
 epoch: 70, train_loss: 0.7645, test_loss: 1.1505, test_f1: 0.5998
 epoch: 71, train_loss: 0.7522, test_loss: 1.1718, test_f1: 0.5919
 epoch: 72, train_loss: 0.7492, test_loss: 1.1671, test_f1: 0.5854
 epoch: 73, train_loss: 0.7489, test_loss: 1.1890, test_f1: 0.5880
 epoch: 74, train_loss: 0.7556, test_loss: 1.1869, test_f1: 0.5606
 epoch: 75, train_loss: 0.7567, test_loss: 1.1692, test_f1: 0.5693
 epoch: 76, train_loss: 0.7368, test_loss: 1.1774, test_f1: 0.5919
 epoch: 77, train_loss: 0.7483, test_loss: 1.1555, test_f1: 0.5856
 epoch: 78, train_loss: 0.7381, test_loss: 1.1551, test_f1: 0.5879
 epoch: 79, train_loss: 0.7345, test_loss: 1.1524, test_f1: 0.5834
 epoch: 80, train_loss: 0.7431, test_loss: 1.1694, test_f1: 0.5900
 epoch: 81, train_loss: 0.7396, test_loss: 1.1788, test_f1: 0.5988
 epoch: 82, train_loss: 0.7300, test_loss: 1.1617, test_f1: 0.6047
 epoch: 83, train_loss: 0.7406, test_loss: 1.1578, test_f1: 0.5986
 epoch: 84, train_loss: 0.7360, test_loss: 1.1698, test_f1: 0.5909
 epoch: 85, train_loss: 0.7298, test_loss: 1.1903, test_f1: 0.6026
 epoch: 86, train_loss: 0.7329, test_loss: 1.1740, test_f1: 0.6122
 epoch: 87, train_loss: 0.7224, test_loss: 1.1838, test_f1: 0.5986
 epoch: 88, train_loss: 0.7206, test_loss: 1.1849, test_f1: 0.5809
 epoch: 89, train_loss: 0.7306, test_loss: 1.1803, test_f1: 0.6014
 epoch: 90, train_loss: 0.7403, test_loss: 1.1386, test_f1: 0.6063
 epoch: 91, train_loss: 0.7225, test_loss: 1.1741, test_f1: 0.6075
 epoch: 92, train_loss: 0.7268, test_loss: 1.1774, test_f1: 0.6043
 epoch: 93, train_loss: 0.7161, test_loss: 1.2093, test_f1: 0.6001
 epoch: 94, train_loss: 0.7236, test_loss: 1.1947, test_f1: 0.6019
 epoch: 95, train_loss: 0.7141, test_loss: 1.2073, test_f1: 0.6026
 epoch: 96, train_loss: 0.7053, test_loss: 1.1937, test_f1: 0.6054
 epoch: 97, train_loss: 0.7168, test_loss: 1.1803, test_f1: 0.6069
 epoch: 98, train_loss: 0.7058, test_loss: 1.1791, test_f1: 0.6074
 epoch: 99, train_loss: 0.7012, test_loss: 1.2056, test_f1: 0.6235
##################ITERATION #7 ****************************************
 epoch: 0, train_loss: 1.2267, test_loss: 1.3495, test_f1: 0.2344
 epoch: 1, train_loss: 1.1365, test_loss: 1.2290, test_f1: 0.3544
 epoch: 2, train_loss: 1.1171, test_loss: 1.1951, test_f1: 0.3665
 epoch: 3, train_loss: 1.0870, test_loss: 1.1767, test_f1: 0.4108
 epoch: 4, train_loss: 1.0833, test_loss: 1.1326, test_f1: 0.4155
 epoch: 5, train_loss: 1.0569, test_loss: 1.1147, test_f1: 0.4265
 epoch: 6, train_loss: 1.0368, test_loss: 1.1004, test_f1: 0.4677
 epoch: 7, train_loss: 1.0325, test_loss: 1.1057, test_f1: 0.4342
 epoch: 8, train_loss: 1.0243, test_loss: 1.1067, test_f1: 0.4858
 epoch: 9, train_loss: 1.0067, test_loss: 1.1049, test_f1: 0.4737
 epoch: 10, train_loss: 0.9964, test_loss: 1.1002, test_f1: 0.4555
 epoch: 11, train_loss: 0.9915, test_loss: 1.0856, test_f1: 0.4749
 epoch: 12, train_loss: 0.9803, test_loss: 1.1016, test_f1: 0.5088
 epoch: 13, train_loss: 0.9822, test_loss: 1.0825, test_f1: 0.5114
 epoch: 14, train_loss: 0.9496, test_loss: 1.0840, test_f1: 0.5211
 epoch: 15, train_loss: 0.9640, test_loss: 1.1044, test_f1: 0.5105
 epoch: 16, train_loss: 0.9469, test_loss: 1.0792, test_f1: 0.5291
 epoch: 17, train_loss: 0.9483, test_loss: 1.0724, test_f1: 0.5253
 epoch: 18, train_loss: 0.9573, test_loss: 1.0695, test_f1: 0.5270
 epoch: 19, train_loss: 0.9288, test_loss: 1.0878, test_f1: 0.5268
 epoch: 20, train_loss: 0.9234, test_loss: 1.1004, test_f1: 0.5223
 epoch: 21, train_loss: 0.9277, test_loss: 1.0883, test_f1: 0.5261
 epoch: 22, train_loss: 0.9225, test_loss: 1.0847, test_f1: 0.5204
 epoch: 23, train_loss: 0.9223, test_loss: 1.0942, test_f1: 0.5153
 epoch: 24, train_loss: 0.9099, test_loss: 1.0921, test_f1: 0.5305
 epoch: 25, train_loss: 0.9069, test_loss: 1.0795, test_f1: 0.5233
 epoch: 26, train_loss: 0.8966, test_loss: 1.0815, test_f1: 0.5294
 epoch: 27, train_loss: 0.8865, test_loss: 1.0896, test_f1: 0.5221
 epoch: 28, train_loss: 0.8942, test_loss: 1.1080, test_f1: 0.5160
 epoch: 29, train_loss: 0.8818, test_loss: 1.0873, test_f1: 0.5381
 epoch: 30, train_loss: 0.8800, test_loss: 1.0840, test_f1: 0.5332
 epoch: 31, train_loss: 0.8694, test_loss: 1.0786, test_f1: 0.5410
 epoch: 32, train_loss: 0.8710, test_loss: 1.0884, test_f1: 0.5146
 epoch: 33, train_loss: 0.8707, test_loss: 1.0720, test_f1: 0.5283
 epoch: 34, train_loss: 0.8694, test_loss: 1.0903, test_f1: 0.5144
 epoch: 35, train_loss: 0.8651, test_loss: 1.0871, test_f1: 0.5264
 epoch: 36, train_loss: 0.8517, test_loss: 1.0931, test_f1: 0.5367
 epoch: 37, train_loss: 0.8664, test_loss: 1.0879, test_f1: 0.5357
 epoch: 38, train_loss: 0.8512, test_loss: 1.0897, test_f1: 0.5486
 epoch: 39, train_loss: 0.8519, test_loss: 1.0919, test_f1: 0.5303
 epoch: 40, train_loss: 0.8358, test_loss: 1.0789, test_f1: 0.5187
 epoch: 41, train_loss: 0.8431, test_loss: 1.1042, test_f1: 0.5302
 epoch: 42, train_loss: 0.8274, test_loss: 1.1275, test_f1: 0.5286
 epoch: 43, train_loss: 0.8357, test_loss: 1.0958, test_f1: 0.5398
 epoch: 44, train_loss: 0.8297, test_loss: 1.1005, test_f1: 0.5476
 epoch: 45, train_loss: 0.8274, test_loss: 1.1090, test_f1: 0.5400
 epoch: 46, train_loss: 0.8256, test_loss: 1.0924, test_f1: 0.5401
 epoch: 47, train_loss: 0.8162, test_loss: 1.1032, test_f1: 0.5378
 epoch: 48, train_loss: 0.8193, test_loss: 1.1270, test_f1: 0.5462
 epoch: 49, train_loss: 0.8153, test_loss: 1.1097, test_f1: 0.5531
 epoch: 50, train_loss: 0.8192, test_loss: 1.1322, test_f1: 0.5496
 epoch: 51, train_loss: 0.8117, test_loss: 1.1303, test_f1: 0.5546
 epoch: 52, train_loss: 0.8162, test_loss: 1.1290, test_f1: 0.5585
 epoch: 53, train_loss: 0.8041, test_loss: 1.1091, test_f1: 0.5450
 epoch: 54, train_loss: 0.7996, test_loss: 1.1109, test_f1: 0.5494
 epoch: 55, train_loss: 0.8045, test_loss: 1.1187, test_f1: 0.5437
 epoch: 56, train_loss: 0.7932, test_loss: 1.1220, test_f1: 0.5488
 epoch: 57, train_loss: 0.7930, test_loss: 1.1264, test_f1: 0.5534
 epoch: 58, train_loss: 0.7863, test_loss: 1.1310, test_f1: 0.5473
 epoch: 59, train_loss: 0.7947, test_loss: 1.1222, test_f1: 0.5578
 epoch: 60, train_loss: 0.7833, test_loss: 1.1168, test_f1: 0.5598
 epoch: 61, train_loss: 0.7832, test_loss: 1.1150, test_f1: 0.5539
 epoch: 62, train_loss: 0.7837, test_loss: 1.1220, test_f1: 0.5561
 epoch: 63, train_loss: 0.7806, test_loss: 1.1214, test_f1: 0.5533
 epoch: 64, train_loss: 0.7830, test_loss: 1.1264, test_f1: 0.5552
 epoch: 65, train_loss: 0.7668, test_loss: 1.1216, test_f1: 0.5437
 epoch: 66, train_loss: 0.7901, test_loss: 1.1280, test_f1: 0.5512
 epoch: 67, train_loss: 0.7834, test_loss: 1.1465, test_f1: 0.5503
 epoch: 68, train_loss: 0.7800, test_loss: 1.1370, test_f1: 0.5513
 epoch: 69, train_loss: 0.7678, test_loss: 1.1406, test_f1: 0.5435
 epoch: 70, train_loss: 0.7640, test_loss: 1.1418, test_f1: 0.5456
 epoch: 71, train_loss: 0.7631, test_loss: 1.1200, test_f1: 0.5482
 epoch: 72, train_loss: 0.7553, test_loss: 1.1212, test_f1: 0.5561
 epoch: 73, train_loss: 0.7672, test_loss: 1.1203, test_f1: 0.5488
 epoch: 74, train_loss: 0.7515, test_loss: 1.1381, test_f1: 0.5547
 epoch: 75, train_loss: 0.7645, test_loss: 1.1343, test_f1: 0.5518
 epoch: 76, train_loss: 0.7637, test_loss: 1.1342, test_f1: 0.5661
 epoch: 77, train_loss: 0.7495, test_loss: 1.1601, test_f1: 0.5567
 epoch: 78, train_loss: 0.7682, test_loss: 1.1286, test_f1: 0.5471
 epoch: 79, train_loss: 0.7564, test_loss: 1.1423, test_f1: 0.5414
 epoch: 80, train_loss: 0.7477, test_loss: 1.1691, test_f1: 0.5434
 epoch: 81, train_loss: 0.7497, test_loss: 1.1667, test_f1: 0.5507
 epoch: 82, train_loss: 0.7404, test_loss: 1.1485, test_f1: 0.5579
 epoch: 83, train_loss: 0.7534, test_loss: 1.1777, test_f1: 0.5433
 epoch: 84, train_loss: 0.7624, test_loss: 1.1614, test_f1: 0.5563
 epoch: 85, train_loss: 0.7532, test_loss: 1.1546, test_f1: 0.5635
 epoch: 86, train_loss: 0.7627, test_loss: 1.1467, test_f1: 0.5638
 epoch: 87, train_loss: 0.7433, test_loss: 1.1563, test_f1: 0.5610
 epoch: 88, train_loss: 0.7355, test_loss: 1.1709, test_f1: 0.5625
 epoch: 89, train_loss: 0.7449, test_loss: 1.1403, test_f1: 0.5597
 epoch: 90, train_loss: 0.7400, test_loss: 1.1294, test_f1: 0.5608
 epoch: 91, train_loss: 0.7465, test_loss: 1.1547, test_f1: 0.5520
 epoch: 92, train_loss: 0.7220, test_loss: 1.1625, test_f1: 0.5514
 epoch: 93, train_loss: 0.7344, test_loss: 1.1881, test_f1: 0.5575
 epoch: 94, train_loss: 0.7360, test_loss: 1.1624, test_f1: 0.5599
 epoch: 95, train_loss: 0.7303, test_loss: 1.1068, test_f1: 0.5535
 epoch: 96, train_loss: 0.7225, test_loss: 1.1428, test_f1: 0.5482
 epoch: 97, train_loss: 0.7327, test_loss: 1.1566, test_f1: 0.5656
 epoch: 98, train_loss: 0.7261, test_loss: 1.1710, test_f1: 0.5600
 epoch: 99, train_loss: 0.7215, test_loss: 1.1583, test_f1: 0.5574
##################ITERATION #8 ****************************************
 epoch: 0, train_loss: 1.2358, test_loss: 1.3498, test_f1: 0.2822
 epoch: 1, train_loss: 1.1431, test_loss: 1.2818, test_f1: 0.2831
 epoch: 2, train_loss: 1.1298, test_loss: 1.2088, test_f1: 0.4307
 epoch: 3, train_loss: 1.1211, test_loss: 1.1986, test_f1: 0.4381
 epoch: 4, train_loss: 1.1030, test_loss: 1.1740, test_f1: 0.4837
 epoch: 5, train_loss: 1.0775, test_loss: 1.1770, test_f1: 0.4993
 epoch: 6, train_loss: 1.0716, test_loss: 1.1531, test_f1: 0.5074
 epoch: 7, train_loss: 1.0571, test_loss: 1.1440, test_f1: 0.5049
 epoch: 8, train_loss: 1.0477, test_loss: 1.1384, test_f1: 0.5097
 epoch: 9, train_loss: 1.0385, test_loss: 1.1276, test_f1: 0.5081
 epoch: 10, train_loss: 1.0320, test_loss: 1.1172, test_f1: 0.5089
 epoch: 11, train_loss: 1.0185, test_loss: 1.1134, test_f1: 0.5358
 epoch: 12, train_loss: 1.0037, test_loss: 1.1017, test_f1: 0.5377
 epoch: 13, train_loss: 1.0118, test_loss: 1.1229, test_f1: 0.5299
 epoch: 14, train_loss: 0.9981, test_loss: 1.0949, test_f1: 0.5296
 epoch: 15, train_loss: 1.0082, test_loss: 1.0983, test_f1: 0.5411
 epoch: 16, train_loss: 0.9744, test_loss: 1.0862, test_f1: 0.5359
 epoch: 17, train_loss: 0.9753, test_loss: 1.0844, test_f1: 0.5390
 epoch: 18, train_loss: 0.9761, test_loss: 1.0789, test_f1: 0.5380
 epoch: 19, train_loss: 0.9566, test_loss: 1.0715, test_f1: 0.5623
 epoch: 20, train_loss: 0.9540, test_loss: 1.0842, test_f1: 0.5387
 epoch: 21, train_loss: 0.9571, test_loss: 1.1048, test_f1: 0.5572
 epoch: 22, train_loss: 0.9283, test_loss: 1.0983, test_f1: 0.5447
 epoch: 23, train_loss: 0.9349, test_loss: 1.1241, test_f1: 0.5613
 epoch: 24, train_loss: 0.9291, test_loss: 1.1229, test_f1: 0.5700
 epoch: 25, train_loss: 0.9312, test_loss: 1.1186, test_f1: 0.5777
 epoch: 26, train_loss: 0.9274, test_loss: 1.0894, test_f1: 0.5800
 epoch: 27, train_loss: 0.9162, test_loss: 1.0810, test_f1: 0.5668
 epoch: 28, train_loss: 0.9031, test_loss: 1.0640, test_f1: 0.5772
 epoch: 29, train_loss: 0.9098, test_loss: 1.0577, test_f1: 0.5714
 epoch: 30, train_loss: 0.8955, test_loss: 1.0872, test_f1: 0.5925
 epoch: 31, train_loss: 0.9017, test_loss: 1.0965, test_f1: 0.5993
 epoch: 32, train_loss: 0.8956, test_loss: 1.0801, test_f1: 0.5893
 epoch: 33, train_loss: 0.8927, test_loss: 1.0965, test_f1: 0.5852
 epoch: 34, train_loss: 0.8837, test_loss: 1.0837, test_f1: 0.5911
 epoch: 35, train_loss: 0.8844, test_loss: 1.1186, test_f1: 0.5602
 epoch: 36, train_loss: 0.8900, test_loss: 1.0998, test_f1: 0.5807
 epoch: 37, train_loss: 0.8623, test_loss: 1.0928, test_f1: 0.6030
 epoch: 38, train_loss: 0.8717, test_loss: 1.0690, test_f1: 0.5867
 epoch: 39, train_loss: 0.8570, test_loss: 1.0831, test_f1: 0.5842
 epoch: 40, train_loss: 0.8636, test_loss: 1.1214, test_f1: 0.5870
 epoch: 41, train_loss: 0.8808, test_loss: 1.0835, test_f1: 0.5949
 epoch: 42, train_loss: 0.8369, test_loss: 1.0884, test_f1: 0.5975
 epoch: 43, train_loss: 0.8566, test_loss: 1.1072, test_f1: 0.5935
 epoch: 44, train_loss: 0.8397, test_loss: 1.0938, test_f1: 0.6038
 epoch: 45, train_loss: 0.8397, test_loss: 1.0803, test_f1: 0.5984
 epoch: 46, train_loss: 0.8548, test_loss: 1.1005, test_f1: 0.6164
 epoch: 47, train_loss: 0.8317, test_loss: 1.1472, test_f1: 0.5828
 epoch: 48, train_loss: 0.8299, test_loss: 1.1321, test_f1: 0.5912
 epoch: 49, train_loss: 0.8400, test_loss: 1.1482, test_f1: 0.5927
 epoch: 50, train_loss: 0.8313, test_loss: 1.1324, test_f1: 0.6201
 epoch: 51, train_loss: 0.8152, test_loss: 1.1523, test_f1: 0.6096
 epoch: 52, train_loss: 0.8108, test_loss: 1.1745, test_f1: 0.5866
 epoch: 53, train_loss: 0.8245, test_loss: 1.1879, test_f1: 0.6074
 epoch: 54, train_loss: 0.8098, test_loss: 1.2064, test_f1: 0.6064
 epoch: 55, train_loss: 0.8083, test_loss: 1.1969, test_f1: 0.6099
 epoch: 56, train_loss: 0.8047, test_loss: 1.1982, test_f1: 0.5963
 epoch: 57, train_loss: 0.8157, test_loss: 1.2069, test_f1: 0.5997
 epoch: 58, train_loss: 0.8076, test_loss: 1.1862, test_f1: 0.5881
 epoch: 59, train_loss: 0.8031, test_loss: 1.2106, test_f1: 0.5952
 epoch: 60, train_loss: 0.8130, test_loss: 1.2311, test_f1: 0.5942
 epoch: 61, train_loss: 0.8032, test_loss: 1.2246, test_f1: 0.5996
 epoch: 62, train_loss: 0.7910, test_loss: 1.2307, test_f1: 0.5871
 epoch: 63, train_loss: 0.7814, test_loss: 1.2266, test_f1: 0.6049
 epoch: 64, train_loss: 0.8093, test_loss: 1.2251, test_f1: 0.6068
 epoch: 65, train_loss: 0.8040, test_loss: 1.2356, test_f1: 0.5969
 epoch: 66, train_loss: 0.7887, test_loss: 1.2764, test_f1: 0.5911
 epoch: 67, train_loss: 0.7825, test_loss: 1.2394, test_f1: 0.5865
 epoch: 68, train_loss: 0.7826, test_loss: 1.2819, test_f1: 0.5998
 epoch: 69, train_loss: 0.7848, test_loss: 1.2704, test_f1: 0.5914
 epoch: 70, train_loss: 0.7746, test_loss: 1.2302, test_f1: 0.5943
 epoch: 71, train_loss: 0.7953, test_loss: 1.2652, test_f1: 0.5754
 epoch: 72, train_loss: 0.7782, test_loss: 1.2756, test_f1: 0.5905
 epoch: 73, train_loss: 0.7895, test_loss: 1.2913, test_f1: 0.5836
 epoch: 74, train_loss: 0.7891, test_loss: 1.2624, test_f1: 0.6082
 epoch: 75, train_loss: 0.7798, test_loss: 1.2928, test_f1: 0.5823
 epoch: 76, train_loss: 0.7699, test_loss: 1.2843, test_f1: 0.5875
 epoch: 77, train_loss: 0.7697, test_loss: 1.2890, test_f1: 0.5842
 epoch: 78, train_loss: 0.7675, test_loss: 1.2525, test_f1: 0.6027
 epoch: 79, train_loss: 0.7931, test_loss: 1.2478, test_f1: 0.5815
 epoch: 80, train_loss: 0.7640, test_loss: 1.2688, test_f1: 0.5860
 epoch: 81, train_loss: 0.7698, test_loss: 1.2855, test_f1: 0.5987
 epoch: 82, train_loss: 0.7727, test_loss: 1.2880, test_f1: 0.5949
 epoch: 83, train_loss: 0.7609, test_loss: 1.2755, test_f1: 0.6016
 epoch: 84, train_loss: 0.7758, test_loss: 1.2724, test_f1: 0.6049
 epoch: 85, train_loss: 0.7712, test_loss: 1.3155, test_f1: 0.5931
 epoch: 86, train_loss: 0.7640, test_loss: 1.2893, test_f1: 0.6008
 epoch: 87, train_loss: 0.7624, test_loss: 1.2846, test_f1: 0.6076
 epoch: 88, train_loss: 0.7595, test_loss: 1.3191, test_f1: 0.5721
 epoch: 89, train_loss: 0.7709, test_loss: 1.3170, test_f1: 0.5881
 epoch: 90, train_loss: 0.7527, test_loss: 1.3294, test_f1: 0.5937
 epoch: 91, train_loss: 0.7457, test_loss: 1.3468, test_f1: 0.5749
 epoch: 92, train_loss: 0.7584, test_loss: 1.3125, test_f1: 0.5771
 epoch: 93, train_loss: 0.7623, test_loss: 1.3426, test_f1: 0.5750
 epoch: 94, train_loss: 0.7429, test_loss: 1.3269, test_f1: 0.6006
 epoch: 95, train_loss: 0.7526, test_loss: 1.3327, test_f1: 0.6018
 epoch: 96, train_loss: 0.7549, test_loss: 1.3453, test_f1: 0.5826
 epoch: 97, train_loss: 0.7355, test_loss: 1.3175, test_f1: 0.6070
 epoch: 98, train_loss: 0.7415, test_loss: 1.3395, test_f1: 0.5733
 epoch: 99, train_loss: 0.7407, test_loss: 1.3496, test_f1: 0.5791
##################ITERATION #9 ****************************************
 epoch: 0, train_loss: 1.2458, test_loss: 1.2781, test_f1: 0.2281
 epoch: 1, train_loss: 1.1455, test_loss: 1.2408, test_f1: 0.3068
 epoch: 2, train_loss: 1.1146, test_loss: 1.2444, test_f1: 0.4000
 epoch: 3, train_loss: 1.0947, test_loss: 1.1635, test_f1: 0.4716
 epoch: 4, train_loss: 1.0697, test_loss: 1.1341, test_f1: 0.4821
 epoch: 5, train_loss: 1.0476, test_loss: 1.1147, test_f1: 0.4762
 epoch: 6, train_loss: 1.0439, test_loss: 1.0945, test_f1: 0.4789
 epoch: 7, train_loss: 1.0481, test_loss: 1.0895, test_f1: 0.5365
 epoch: 8, train_loss: 1.0083, test_loss: 1.0966, test_f1: 0.5049
 epoch: 9, train_loss: 1.0087, test_loss: 1.0812, test_f1: 0.5172
 epoch: 10, train_loss: 1.0042, test_loss: 1.0645, test_f1: 0.5357
 epoch: 11, train_loss: 0.9973, test_loss: 1.0574, test_f1: 0.5248
 epoch: 12, train_loss: 0.9806, test_loss: 1.0754, test_f1: 0.5286
 epoch: 13, train_loss: 0.9820, test_loss: 1.0651, test_f1: 0.5350
 epoch: 14, train_loss: 0.9675, test_loss: 1.0675, test_f1: 0.5331
 epoch: 15, train_loss: 0.9563, test_loss: 1.0505, test_f1: 0.5356
 epoch: 16, train_loss: 0.9400, test_loss: 1.0517, test_f1: 0.5487
 epoch: 17, train_loss: 0.9605, test_loss: 1.0524, test_f1: 0.5463
 epoch: 18, train_loss: 0.9529, test_loss: 1.0422, test_f1: 0.5400
 epoch: 19, train_loss: 0.9326, test_loss: 1.0499, test_f1: 0.5450
 epoch: 20, train_loss: 0.9447, test_loss: 1.0528, test_f1: 0.5391
 epoch: 21, train_loss: 0.9297, test_loss: 1.0585, test_f1: 0.5394
 epoch: 22, train_loss: 0.9238, test_loss: 1.0356, test_f1: 0.5565
 epoch: 23, train_loss: 0.9348, test_loss: 1.0430, test_f1: 0.5422
 epoch: 24, train_loss: 0.9232, test_loss: 1.0464, test_f1: 0.5638
 epoch: 25, train_loss: 0.9254, test_loss: 1.0521, test_f1: 0.5505
 epoch: 26, train_loss: 0.9174, test_loss: 1.0511, test_f1: 0.5676
 epoch: 27, train_loss: 0.9010, test_loss: 1.0319, test_f1: 0.5744
 epoch: 28, train_loss: 0.9059, test_loss: 1.0277, test_f1: 0.5888
 epoch: 29, train_loss: 0.9033, test_loss: 1.0333, test_f1: 0.5908
 epoch: 30, train_loss: 0.9084, test_loss: 1.0776, test_f1: 0.5673
 epoch: 31, train_loss: 0.8933, test_loss: 1.0563, test_f1: 0.5759
 epoch: 32, train_loss: 0.8969, test_loss: 1.0369, test_f1: 0.5753
 epoch: 33, train_loss: 0.8866, test_loss: 1.0149, test_f1: 0.5685
 epoch: 34, train_loss: 0.8920, test_loss: 1.0559, test_f1: 0.5864
 epoch: 35, train_loss: 0.8881, test_loss: 1.0220, test_f1: 0.5994
 epoch: 36, train_loss: 0.8775, test_loss: 1.0755, test_f1: 0.5724
 epoch: 37, train_loss: 0.8548, test_loss: 1.0689, test_f1: 0.5874
 epoch: 38, train_loss: 0.8720, test_loss: 1.0690, test_f1: 0.6009
 epoch: 39, train_loss: 0.8654, test_loss: 1.0871, test_f1: 0.5673
 epoch: 40, train_loss: 0.8538, test_loss: 1.0507, test_f1: 0.5984
 epoch: 41, train_loss: 0.8449, test_loss: 1.0854, test_f1: 0.5649
 epoch: 42, train_loss: 0.8470, test_loss: 1.0724, test_f1: 0.5691
 epoch: 43, train_loss: 0.8298, test_loss: 1.0532, test_f1: 0.5932
 epoch: 44, train_loss: 0.8453, test_loss: 1.0873, test_f1: 0.5823
 epoch: 45, train_loss: 0.8162, test_loss: 1.0757, test_f1: 0.5999
 epoch: 46, train_loss: 0.8331, test_loss: 1.1121, test_f1: 0.5875
 epoch: 47, train_loss: 0.8371, test_loss: 1.1471, test_f1: 0.5638
 epoch: 48, train_loss: 0.8320, test_loss: 1.1324, test_f1: 0.5534
 epoch: 49, train_loss: 0.8432, test_loss: 1.1120, test_f1: 0.5723
 epoch: 50, train_loss: 0.8191, test_loss: 1.1245, test_f1: 0.5773
 epoch: 51, train_loss: 0.8259, test_loss: 1.0926, test_f1: 0.5798
 epoch: 52, train_loss: 0.8253, test_loss: 1.1463, test_f1: 0.5762
 epoch: 53, train_loss: 0.8165, test_loss: 1.1298, test_f1: 0.5824
 epoch: 54, train_loss: 0.8065, test_loss: 1.1371, test_f1: 0.5732
 epoch: 55, train_loss: 0.8128, test_loss: 1.1357, test_f1: 0.5790
 epoch: 56, train_loss: 0.8075, test_loss: 1.1333, test_f1: 0.5802
 epoch: 57, train_loss: 0.7879, test_loss: 1.1064, test_f1: 0.5767
 epoch: 58, train_loss: 0.8042, test_loss: 1.1021, test_f1: 0.5792
 epoch: 59, train_loss: 0.7985, test_loss: 1.0910, test_f1: 0.6048
 epoch: 60, train_loss: 0.7959, test_loss: 1.1045, test_f1: 0.5890
 epoch: 61, train_loss: 0.7910, test_loss: 1.0946, test_f1: 0.5835
 epoch: 62, train_loss: 0.7801, test_loss: 1.1186, test_f1: 0.5979
 epoch: 63, train_loss: 0.7794, test_loss: 1.1322, test_f1: 0.5724
 epoch: 64, train_loss: 0.7959, test_loss: 1.1170, test_f1: 0.5781
 epoch: 65, train_loss: 0.7804, test_loss: 1.1153, test_f1: 0.5846
 epoch: 66, train_loss: 0.7816, test_loss: 1.1438, test_f1: 0.5772
 epoch: 67, train_loss: 0.7843, test_loss: 1.1544, test_f1: 0.5842
 epoch: 68, train_loss: 0.7788, test_loss: 1.1282, test_f1: 0.5671
 epoch: 69, train_loss: 0.7839, test_loss: 1.1709, test_f1: 0.5611
 epoch: 70, train_loss: 0.7817, test_loss: 1.1513, test_f1: 0.5850
 epoch: 71, train_loss: 0.7763, test_loss: 1.1402, test_f1: 0.5730
 epoch: 72, train_loss: 0.7788, test_loss: 1.1420, test_f1: 0.5687
 epoch: 73, train_loss: 0.7576, test_loss: 1.1915, test_f1: 0.5756
 epoch: 74, train_loss: 0.7649, test_loss: 1.1664, test_f1: 0.5666
 epoch: 75, train_loss: 0.7608, test_loss: 1.1664, test_f1: 0.5778
 epoch: 76, train_loss: 0.7722, test_loss: 1.1744, test_f1: 0.5718
 epoch: 77, train_loss: 0.7614, test_loss: 1.1715, test_f1: 0.5769
 epoch: 78, train_loss: 0.7606, test_loss: 1.1787, test_f1: 0.5697
 epoch: 79, train_loss: 0.7722, test_loss: 1.1423, test_f1: 0.5735
 epoch: 80, train_loss: 0.7642, test_loss: 1.1535, test_f1: 0.5883
 epoch: 81, train_loss: 0.7743, test_loss: 1.1893, test_f1: 0.5825
 epoch: 82, train_loss: 0.7529, test_loss: 1.1467, test_f1: 0.5908
 epoch: 83, train_loss: 0.7551, test_loss: 1.1449, test_f1: 0.5851
 epoch: 84, train_loss: 0.7389, test_loss: 1.1490, test_f1: 0.5780
 epoch: 85, train_loss: 0.7534, test_loss: 1.1497, test_f1: 0.5818
 epoch: 86, train_loss: 0.7531, test_loss: 1.2053, test_f1: 0.5629
 epoch: 87, train_loss: 0.7521, test_loss: 1.2089, test_f1: 0.5722
 epoch: 88, train_loss: 0.7491, test_loss: 1.1756, test_f1: 0.5678
 epoch: 89, train_loss: 0.7523, test_loss: 1.1823, test_f1: 0.5674
 epoch: 90, train_loss: 0.7626, test_loss: 1.1898, test_f1: 0.5720
 epoch: 91, train_loss: 0.7426, test_loss: 1.1638, test_f1: 0.5977
 epoch: 92, train_loss: 0.7604, test_loss: 1.1650, test_f1: 0.6007
 epoch: 93, train_loss: 0.7335, test_loss: 1.1386, test_f1: 0.6013
 epoch: 94, train_loss: 0.7410, test_loss: 1.1789, test_f1: 0.5837
 epoch: 95, train_loss: 0.7465, test_loss: 1.2015, test_f1: 0.5891
 epoch: 96, train_loss: 0.7362, test_loss: 1.1670, test_f1: 0.6015
 epoch: 97, train_loss: 0.7352, test_loss: 1.1994, test_f1: 0.5794
 epoch: 98, train_loss: 0.7353, test_loss: 1.2072, test_f1: 0.5655
 epoch: 99, train_loss: 0.7271, test_loss: 1.1585, test_f1: 0.5740

Training completed in 530.45 seconds
Best F1: 0.6235 at epoch 99
Mean F1 across iterations: 0.5935  0.0222
========================FINAL RESULTS================================
FEGIN weighted F1: 0.6235  0.0222
python main.py --data ltspice_demos --representation component_net --model FEGIN --layers 6 --hiddens 64 --batch_size 64 --lr 0.0001 --emb_size 512 --epochs 100 --save_appendix component_net_L6_H64_BS64_LR0.0001_E512 --no_val
-----



STDERR:
  File "main.py", line 370, in <module>
    main()
  File "main.py", line 254, in main
    dataset = dataset_class(
  File "/home/philip/projects/ltspice_examples_code_repo/Circuit-Completion-Using-GNNs/component_classification_with_link_prediction_head/evaluation/FEGIN/kernel/circuit_datasets.py", line 15, in __init__
    self.data, self.slices = torch.load(self.processed_paths[0])
  File "/home/philip/.local/lib/python3.8/site-packages/torch/serialization.py", line 1040, in load
    warnings.warn(
  File "/usr/lib/python3.8/warnings.py", line 109, in _showwarnmsg
    sw(msg.message, msg.category, msg.filename, msg.lineno,
  File "main.py", line 47, in warn_with_traceback
    traceback.print_stack(file=log)
/home/philip/projects/ltspice_examples_code_repo/Circuit-Completion-Using-GNNs/component_classification_with_link_prediction_head/evaluation/FEGIN/kernel/circuit_datasets.py:15: FutureWarning: You are using `torch.load` with `weights_only=False` (the current default value), which uses the default pickle module implicitly. It is possible to construct malicious pickle data which will execute arbitrary code during unpickling (See https://github.com/pytorch/pytorch/blob/main/SECURITY.md#untrusted-models for more details). In a future release, the default value for `weights_only` will be flipped to `True`. This limits the functions that could be executed during unpickling. Arbitrary objects will no longer be allowed to be loaded via this mode unless they are explicitly allowlisted by the user via `torch.serialization.add_safe_globals`. We recommend you start setting `weights_only=True` for any use case where you don't have full control of the loaded file. Please open an issue on GitHub for any issues related to this experimental feature.
  self.data, self.slices = torch.load(self.processed_paths[0])
