STDOUT:
Results will be saved in /home/philip/projects/ltspice_examples_code_repo/Circuit-Completion-Using-GNNs/component_classification_with_link_prediction_head/evaluation/FEGIN/results/model_FEGIN_dataset_ltspice_demos
Command line input: python main.py --data ltspice_demos --representation component_pin_net --model FEGIN --layers 6 --hiddens 128 --batch_size 128 --lr 0.01 --emb_size 250 --epochs 100 --save_appendix component_pin_net_L6_H128_BS128_LR0.01_E250 --no_val
 is saved.
-----
ltspice_demos - FEGIN
Using 6 layers, 128 hidden units, h = 2
Loading component_pin_net representation dataset
ENTERED
Training FEGIN on component_pin_net representation
Train: 1565, Test: 383
##################ITERATION #0 ****************************************
 epoch: 0, train_loss: 1.3681, test_loss: 1.2850, test_f1: 0.3276
 epoch: 1, train_loss: 1.0921, test_loss: 1.1890, test_f1: 0.4094
 epoch: 2, train_loss: 1.0220, test_loss: 1.1818, test_f1: 0.4345
 epoch: 3, train_loss: 1.0097, test_loss: 1.0963, test_f1: 0.4239
 epoch: 4, train_loss: 0.9831, test_loss: 1.0663, test_f1: 0.4558
 epoch: 5, train_loss: 0.9797, test_loss: 1.0908, test_f1: 0.5008
 epoch: 6, train_loss: 0.9533, test_loss: 1.1621, test_f1: 0.4983
 epoch: 7, train_loss: 0.9401, test_loss: 1.0481, test_f1: 0.5053
 epoch: 8, train_loss: 0.9156, test_loss: 1.2265, test_f1: 0.4517
 epoch: 9, train_loss: 0.9165, test_loss: 1.0824, test_f1: 0.5080
 epoch: 10, train_loss: 0.8934, test_loss: 1.1204, test_f1: 0.5137
 epoch: 11, train_loss: 0.9146, test_loss: 1.0763, test_f1: 0.5131
 epoch: 12, train_loss: 0.9195, test_loss: 1.2106, test_f1: 0.4470
 epoch: 13, train_loss: 0.8895, test_loss: 1.1056, test_f1: 0.5274
 epoch: 14, train_loss: 0.8412, test_loss: 1.0567, test_f1: 0.5008
 epoch: 15, train_loss: 0.8114, test_loss: 1.1636, test_f1: 0.4554
 epoch: 16, train_loss: 0.8869, test_loss: 1.0525, test_f1: 0.5447
 epoch: 17, train_loss: 0.8276, test_loss: 1.0464, test_f1: 0.5516
 epoch: 18, train_loss: 0.7842, test_loss: 1.2249, test_f1: 0.5586
 epoch: 19, train_loss: 0.8128, test_loss: 1.4120, test_f1: 0.5066
 epoch: 20, train_loss: 0.8118, test_loss: 0.9812, test_f1: 0.5856
 epoch: 21, train_loss: 0.7492, test_loss: 1.1432, test_f1: 0.4479
 epoch: 22, train_loss: 0.7570, test_loss: 1.2287, test_f1: 0.5523
 epoch: 23, train_loss: 0.7536, test_loss: 1.0226, test_f1: 0.5806
 epoch: 24, train_loss: 0.7185, test_loss: 0.9610, test_f1: 0.5988
 epoch: 25, train_loss: 0.7343, test_loss: 1.2244, test_f1: 0.5604
 epoch: 26, train_loss: 0.6786, test_loss: 1.3558, test_f1: 0.5186
 epoch: 27, train_loss: 0.7095, test_loss: 1.0556, test_f1: 0.5605
 epoch: 28, train_loss: 0.7126, test_loss: 1.1129, test_f1: 0.5498
 epoch: 29, train_loss: 0.7254, test_loss: 1.2772, test_f1: 0.5409
 epoch: 30, train_loss: 0.6711, test_loss: 1.1706, test_f1: 0.5749
 epoch: 31, train_loss: 0.6522, test_loss: 1.1481, test_f1: 0.5709
 epoch: 32, train_loss: 0.6723, test_loss: 1.1039, test_f1: 0.5849
 epoch: 33, train_loss: 0.6339, test_loss: 1.5438, test_f1: 0.4853
 epoch: 34, train_loss: 0.6256, test_loss: 1.7228, test_f1: 0.4698
 epoch: 35, train_loss: 0.6301, test_loss: 1.4406, test_f1: 0.5183
 epoch: 36, train_loss: 0.6132, test_loss: 1.1818, test_f1: 0.5772
 epoch: 37, train_loss: 0.5904, test_loss: 1.2916, test_f1: 0.5488
 epoch: 38, train_loss: 0.5780, test_loss: 1.4699, test_f1: 0.5610
 epoch: 39, train_loss: 0.5786, test_loss: 1.9215, test_f1: 0.5018
 epoch: 40, train_loss: 0.5786, test_loss: 1.2058, test_f1: 0.6286
 epoch: 41, train_loss: 0.5524, test_loss: 1.3881, test_f1: 0.6225
 epoch: 42, train_loss: 0.6477, test_loss: 1.2640, test_f1: 0.5615
 epoch: 43, train_loss: 0.6088, test_loss: 1.3258, test_f1: 0.5439
 epoch: 44, train_loss: 0.5214, test_loss: 1.4943, test_f1: 0.5370
 epoch: 45, train_loss: 0.5564, test_loss: 1.6857, test_f1: 0.4823
 epoch: 46, train_loss: 0.5897, test_loss: 1.3891, test_f1: 0.5174
 epoch: 47, train_loss: 0.6081, test_loss: 1.6542, test_f1: 0.5221
 epoch: 48, train_loss: 0.5441, test_loss: 1.2538, test_f1: 0.6273
 epoch: 49, train_loss: 0.5377, test_loss: 1.8705, test_f1: 0.5268
 epoch: 50, train_loss: 0.5871, test_loss: 1.3321, test_f1: 0.5487
 epoch: 51, train_loss: 0.4936, test_loss: 1.3456, test_f1: 0.6024
 epoch: 52, train_loss: 0.4456, test_loss: 1.4483, test_f1: 0.6360
 epoch: 53, train_loss: 0.4317, test_loss: 1.4467, test_f1: 0.5594
 epoch: 54, train_loss: 0.4358, test_loss: 1.7178, test_f1: 0.5998
 epoch: 55, train_loss: 0.3908, test_loss: 1.5711, test_f1: 0.6162
 epoch: 56, train_loss: 0.3930, test_loss: 1.6424, test_f1: 0.5869
 epoch: 57, train_loss: 0.3888, test_loss: 1.7342, test_f1: 0.6253
 epoch: 58, train_loss: 0.3962, test_loss: 1.7331, test_f1: 0.6259
 epoch: 59, train_loss: 0.3980, test_loss: 1.8205, test_f1: 0.6255
 epoch: 60, train_loss: 0.4065, test_loss: 1.7896, test_f1: 0.6094
 epoch: 61, train_loss: 0.3361, test_loss: 1.7494, test_f1: 0.6400
 epoch: 62, train_loss: 0.3942, test_loss: 2.1768, test_f1: 0.5660
 epoch: 63, train_loss: 0.4098, test_loss: 1.7708, test_f1: 0.6123
 epoch: 64, train_loss: 0.4093, test_loss: 1.3800, test_f1: 0.6547
 epoch: 65, train_loss: 0.3547, test_loss: 1.5542, test_f1: 0.6742
 epoch: 66, train_loss: 0.3679, test_loss: 1.5484, test_f1: 0.5835
 epoch: 67, train_loss: 0.3789, test_loss: 2.0547, test_f1: 0.6065
 epoch: 68, train_loss: 0.3484, test_loss: 1.8227, test_f1: 0.6328
 epoch: 69, train_loss: 0.3486, test_loss: 1.7910, test_f1: 0.5926
 epoch: 70, train_loss: 0.3587, test_loss: 1.6643, test_f1: 0.6360
 epoch: 71, train_loss: 0.3216, test_loss: 1.8167, test_f1: 0.6507
 epoch: 72, train_loss: 0.3645, test_loss: 1.7856, test_f1: 0.6340
 epoch: 73, train_loss: 0.3539, test_loss: 1.8257, test_f1: 0.5883
 epoch: 74, train_loss: 0.3040, test_loss: 2.0867, test_f1: 0.6145
 epoch: 75, train_loss: 0.3330, test_loss: 1.8639, test_f1: 0.6541
 epoch: 76, train_loss: 0.3672, test_loss: 2.0629, test_f1: 0.5894
 epoch: 77, train_loss: 0.3087, test_loss: 1.6905, test_f1: 0.6448
 epoch: 78, train_loss: 0.2955, test_loss: 1.9653, test_f1: 0.6458
 epoch: 79, train_loss: 0.3042, test_loss: 1.8722, test_f1: 0.6802
 epoch: 80, train_loss: 0.3035, test_loss: 1.9464, test_f1: 0.6434
 epoch: 81, train_loss: 0.3004, test_loss: 1.8920, test_f1: 0.6344
 epoch: 82, train_loss: 0.2652, test_loss: 2.2612, test_f1: 0.6075
 epoch: 83, train_loss: 0.2749, test_loss: 2.2990, test_f1: 0.6309
 epoch: 84, train_loss: 0.3230, test_loss: 2.0974, test_f1: 0.6109
 epoch: 85, train_loss: 0.3346, test_loss: 2.5013, test_f1: 0.6062
 epoch: 86, train_loss: 0.2790, test_loss: 2.1072, test_f1: 0.6233
 epoch: 87, train_loss: 0.2740, test_loss: 2.0888, test_f1: 0.6271
 epoch: 88, train_loss: 0.2404, test_loss: 2.4223, test_f1: 0.6286
 epoch: 89, train_loss: 0.2604, test_loss: 2.2281, test_f1: 0.6059
 epoch: 90, train_loss: 0.2787, test_loss: 2.0557, test_f1: 0.6275
 epoch: 91, train_loss: 0.2613, test_loss: 2.0790, test_f1: 0.6454
 epoch: 92, train_loss: 0.2396, test_loss: 2.2035, test_f1: 0.6834
 epoch: 93, train_loss: 0.2563, test_loss: 2.3006, test_f1: 0.6384
 epoch: 94, train_loss: 0.2544, test_loss: 2.0741, test_f1: 0.6753
 epoch: 95, train_loss: 0.2646, test_loss: 2.3614, test_f1: 0.6243
 epoch: 96, train_loss: 0.2550, test_loss: 2.5785, test_f1: 0.6072
 epoch: 97, train_loss: 0.2201, test_loss: 2.5186, test_f1: 0.6452
 epoch: 98, train_loss: 0.2172, test_loss: 2.5259, test_f1: 0.6212
 epoch: 99, train_loss: 0.2055, test_loss: 2.4105, test_f1: 0.6214
##################ITERATION #1 ****************************************
 epoch: 0, train_loss: 1.2624, test_loss: 1.8555, test_f1: 0.2281
 epoch: 1, train_loss: 1.0245, test_loss: 1.2516, test_f1: 0.3949
 epoch: 2, train_loss: 0.9704, test_loss: 1.0928, test_f1: 0.3804
 epoch: 3, train_loss: 0.9528, test_loss: 1.0467, test_f1: 0.5232
 epoch: 4, train_loss: 0.9289, test_loss: 1.1951, test_f1: 0.4713
 epoch: 5, train_loss: 0.9149, test_loss: 1.1906, test_f1: 0.4435
 epoch: 6, train_loss: 0.9109, test_loss: 1.0188, test_f1: 0.5296
 epoch: 7, train_loss: 0.8901, test_loss: 0.9965, test_f1: 0.5302
 epoch: 8, train_loss: 0.8673, test_loss: 1.1111, test_f1: 0.5226
 epoch: 9, train_loss: 0.8530, test_loss: 1.0512, test_f1: 0.5086
 epoch: 10, train_loss: 0.8177, test_loss: 1.1557, test_f1: 0.4489
 epoch: 11, train_loss: 0.8367, test_loss: 1.1852, test_f1: 0.4213
 epoch: 12, train_loss: 0.7867, test_loss: 1.0732, test_f1: 0.5542
 epoch: 13, train_loss: 0.7722, test_loss: 2.0839, test_f1: 0.3488
 epoch: 14, train_loss: 0.7812, test_loss: 1.0762, test_f1: 0.5547
 epoch: 15, train_loss: 0.7932, test_loss: 1.1534, test_f1: 0.5171
 epoch: 16, train_loss: 0.7792, test_loss: 1.3902, test_f1: 0.4215
 epoch: 17, train_loss: 0.7595, test_loss: 1.2993, test_f1: 0.4497
 epoch: 18, train_loss: 0.7484, test_loss: 1.2989, test_f1: 0.5226
 epoch: 19, train_loss: 0.7365, test_loss: 1.1236, test_f1: 0.4897
 epoch: 20, train_loss: 0.7079, test_loss: 1.2012, test_f1: 0.5086
 epoch: 21, train_loss: 0.6956, test_loss: 1.2878, test_f1: 0.4730
 epoch: 22, train_loss: 0.7005, test_loss: 1.0623, test_f1: 0.5902
 epoch: 23, train_loss: 0.6886, test_loss: 1.2042, test_f1: 0.4883
 epoch: 24, train_loss: 0.6513, test_loss: 1.1334, test_f1: 0.6018
 epoch: 25, train_loss: 0.6665, test_loss: 1.2053, test_f1: 0.5410
 epoch: 26, train_loss: 0.6469, test_loss: 1.2501, test_f1: 0.4856
 epoch: 27, train_loss: 0.6666, test_loss: 1.1215, test_f1: 0.5750
 epoch: 28, train_loss: 0.6929, test_loss: 1.1269, test_f1: 0.5396
 epoch: 29, train_loss: 0.6727, test_loss: 1.1968, test_f1: 0.5543
 epoch: 30, train_loss: 0.6040, test_loss: 1.5082, test_f1: 0.5037
 epoch: 31, train_loss: 0.6280, test_loss: 1.3345, test_f1: 0.5489
 epoch: 32, train_loss: 0.6262, test_loss: 2.2353, test_f1: 0.4598
 epoch: 33, train_loss: 0.6345, test_loss: 1.3573, test_f1: 0.4936
 epoch: 34, train_loss: 0.5952, test_loss: 1.5635, test_f1: 0.5110
 epoch: 35, train_loss: 0.6095, test_loss: 1.1688, test_f1: 0.5364
 epoch: 36, train_loss: 0.6158, test_loss: 1.1010, test_f1: 0.5706
 epoch: 37, train_loss: 0.5628, test_loss: 1.6774, test_f1: 0.5457
 epoch: 38, train_loss: 0.6136, test_loss: 1.2474, test_f1: 0.5420
 epoch: 39, train_loss: 0.6180, test_loss: 1.2273, test_f1: 0.5467
 epoch: 40, train_loss: 0.5630, test_loss: 1.8020, test_f1: 0.5417
 epoch: 41, train_loss: 0.5366, test_loss: 2.0522, test_f1: 0.4993
 epoch: 42, train_loss: 0.5567, test_loss: 1.5149, test_f1: 0.6034
 epoch: 43, train_loss: 0.6261, test_loss: 1.6911, test_f1: 0.5045
 epoch: 44, train_loss: 0.5629, test_loss: 1.8152, test_f1: 0.5083
 epoch: 45, train_loss: 0.5700, test_loss: 1.7114, test_f1: 0.4963
 epoch: 46, train_loss: 0.6041, test_loss: 1.2164, test_f1: 0.5406
 epoch: 47, train_loss: 0.5589, test_loss: 1.4916, test_f1: 0.5179
 epoch: 48, train_loss: 0.5385, test_loss: 1.6517, test_f1: 0.5425
 epoch: 49, train_loss: 0.5095, test_loss: 1.5327, test_f1: 0.5570
 epoch: 50, train_loss: 0.5165, test_loss: 1.4054, test_f1: 0.5250
 epoch: 51, train_loss: 0.4801, test_loss: 1.2827, test_f1: 0.5842
 epoch: 52, train_loss: 0.4398, test_loss: 1.5293, test_f1: 0.5914
 epoch: 53, train_loss: 0.4222, test_loss: 1.4350, test_f1: 0.6249
 epoch: 54, train_loss: 0.4185, test_loss: 1.7183, test_f1: 0.5527
 epoch: 55, train_loss: 0.4149, test_loss: 1.8977, test_f1: 0.5988
 epoch: 56, train_loss: 0.3755, test_loss: 1.9162, test_f1: 0.5889
 epoch: 57, train_loss: 0.4011, test_loss: 1.6220, test_f1: 0.6541
 epoch: 58, train_loss: 0.4047, test_loss: 1.5380, test_f1: 0.6248
 epoch: 59, train_loss: 0.4042, test_loss: 1.5980, test_f1: 0.6053
 epoch: 60, train_loss: 0.3725, test_loss: 1.6805, test_f1: 0.6146
 epoch: 61, train_loss: 0.4046, test_loss: 1.8262, test_f1: 0.6295
 epoch: 62, train_loss: 0.3561, test_loss: 1.9002, test_f1: 0.6183
 epoch: 63, train_loss: 0.3597, test_loss: 2.1866, test_f1: 0.6006
 epoch: 64, train_loss: 0.3472, test_loss: 1.9940, test_f1: 0.6369
 epoch: 65, train_loss: 0.3322, test_loss: 1.8266, test_f1: 0.6320
 epoch: 66, train_loss: 0.3308, test_loss: 1.6905, test_f1: 0.6507
 epoch: 67, train_loss: 0.3181, test_loss: 1.9855, test_f1: 0.6171
 epoch: 68, train_loss: 0.2960, test_loss: 2.1526, test_f1: 0.6030
 epoch: 69, train_loss: 0.2965, test_loss: 1.9910, test_f1: 0.6296
 epoch: 70, train_loss: 0.3460, test_loss: 1.7802, test_f1: 0.6364
 epoch: 71, train_loss: 0.3186, test_loss: 2.0726, test_f1: 0.5968
 epoch: 72, train_loss: 0.3264, test_loss: 1.8214, test_f1: 0.6429
 epoch: 73, train_loss: 0.3092, test_loss: 1.7490, test_f1: 0.6312
 epoch: 74, train_loss: 0.3157, test_loss: 1.9205, test_f1: 0.6601
 epoch: 75, train_loss: 0.3146, test_loss: 2.0704, test_f1: 0.6243
 epoch: 76, train_loss: 0.3191, test_loss: 1.9432, test_f1: 0.6224
 epoch: 77, train_loss: 0.2993, test_loss: 1.7812, test_f1: 0.6227
 epoch: 78, train_loss: 0.2925, test_loss: 2.5295, test_f1: 0.6122
 epoch: 79, train_loss: 0.3297, test_loss: 2.1428, test_f1: 0.5688
 epoch: 80, train_loss: 0.3847, test_loss: 1.8836, test_f1: 0.5950
 epoch: 81, train_loss: 0.3461, test_loss: 1.9399, test_f1: 0.6057
 epoch: 82, train_loss: 0.3236, test_loss: 1.9432, test_f1: 0.6221
 epoch: 83, train_loss: 0.3134, test_loss: 2.0659, test_f1: 0.6247
 epoch: 84, train_loss: 0.2405, test_loss: 2.0078, test_f1: 0.6292
 epoch: 85, train_loss: 0.2637, test_loss: 2.9244, test_f1: 0.5803
 epoch: 86, train_loss: 0.2483, test_loss: 2.2659, test_f1: 0.6269
 epoch: 87, train_loss: 0.2679, test_loss: 2.2489, test_f1: 0.6087
 epoch: 88, train_loss: 0.2901, test_loss: 2.2921, test_f1: 0.6029
 epoch: 89, train_loss: 0.3052, test_loss: 2.1643, test_f1: 0.5691
 epoch: 90, train_loss: 0.2961, test_loss: 2.5040, test_f1: 0.5752
 epoch: 91, train_loss: 0.2431, test_loss: 2.5828, test_f1: 0.5865
 epoch: 92, train_loss: 0.2291, test_loss: 2.4986, test_f1: 0.5986
 epoch: 93, train_loss: 0.2556, test_loss: 2.8566, test_f1: 0.5656
 epoch: 94, train_loss: 0.2583, test_loss: 2.1441, test_f1: 0.6575
 epoch: 95, train_loss: 0.1945, test_loss: 2.3176, test_f1: 0.6230
 epoch: 96, train_loss: 0.2536, test_loss: 2.7200, test_f1: 0.6029
 epoch: 97, train_loss: 0.2364, test_loss: 2.8538, test_f1: 0.5681
 epoch: 98, train_loss: 0.2101, test_loss: 2.5380, test_f1: 0.6140
 epoch: 99, train_loss: 0.2360, test_loss: 2.4115, test_f1: 0.5974
##################ITERATION #2 ****************************************
 epoch: 0, train_loss: 1.3126, test_loss: 1.5362, test_f1: 0.2719
 epoch: 1, train_loss: 1.0445, test_loss: 1.2175, test_f1: 0.3753
 epoch: 2, train_loss: 0.9935, test_loss: 1.3040, test_f1: 0.4261
 epoch: 3, train_loss: 0.9547, test_loss: 1.0649, test_f1: 0.4938
 epoch: 4, train_loss: 0.9487, test_loss: 1.1176, test_f1: 0.4971
 epoch: 5, train_loss: 0.9476, test_loss: 1.1019, test_f1: 0.5319
 epoch: 6, train_loss: 0.9052, test_loss: 1.1863, test_f1: 0.4779
 epoch: 7, train_loss: 0.9119, test_loss: 1.1525, test_f1: 0.4880
 epoch: 8, train_loss: 0.8816, test_loss: 1.2013, test_f1: 0.4698
 epoch: 9, train_loss: 0.8887, test_loss: 1.1124, test_f1: 0.5288
 epoch: 10, train_loss: 0.8478, test_loss: 1.4473, test_f1: 0.3675
 epoch: 11, train_loss: 0.8270, test_loss: 1.6170, test_f1: 0.4978
 epoch: 12, train_loss: 0.8484, test_loss: 1.0474, test_f1: 0.4729
 epoch: 13, train_loss: 0.8704, test_loss: 1.1953, test_f1: 0.5665
 epoch: 14, train_loss: 0.8156, test_loss: 1.0194, test_f1: 0.5954
 epoch: 15, train_loss: 0.7602, test_loss: 1.5741, test_f1: 0.4748
 epoch: 16, train_loss: 0.8039, test_loss: 1.1560, test_f1: 0.4892
 epoch: 17, train_loss: 0.7744, test_loss: 1.0820, test_f1: 0.5210
 epoch: 18, train_loss: 0.8060, test_loss: 1.1861, test_f1: 0.4186
 epoch: 19, train_loss: 0.7313, test_loss: 1.1287, test_f1: 0.4945
 epoch: 20, train_loss: 0.7574, test_loss: 1.1636, test_f1: 0.5723
 epoch: 21, train_loss: 0.6992, test_loss: 1.1967, test_f1: 0.5376
 epoch: 22, train_loss: 0.7364, test_loss: 1.4296, test_f1: 0.4442
 epoch: 23, train_loss: 0.7295, test_loss: 1.0910, test_f1: 0.5387
 epoch: 24, train_loss: 0.7496, test_loss: 1.1550, test_f1: 0.5752
 epoch: 25, train_loss: 0.7272, test_loss: 1.3180, test_f1: 0.5076
 epoch: 26, train_loss: 0.7535, test_loss: 1.6739, test_f1: 0.5053
 epoch: 27, train_loss: 0.7041, test_loss: 1.2608, test_f1: 0.5469
 epoch: 28, train_loss: 0.6893, test_loss: 1.1933, test_f1: 0.5777
 epoch: 29, train_loss: 0.7052, test_loss: 1.0809, test_f1: 0.5949
 epoch: 30, train_loss: 0.6529, test_loss: 1.6283, test_f1: 0.5690
 epoch: 31, train_loss: 0.6463, test_loss: 1.9993, test_f1: 0.4849
 epoch: 32, train_loss: 0.6637, test_loss: 1.3175, test_f1: 0.4808
 epoch: 33, train_loss: 0.6836, test_loss: 1.6239, test_f1: 0.4536
 epoch: 34, train_loss: 0.6619, test_loss: 1.2504, test_f1: 0.5389
 epoch: 35, train_loss: 0.6327, test_loss: 1.1832, test_f1: 0.5173
 epoch: 36, train_loss: 0.6138, test_loss: 1.7656, test_f1: 0.5261
 epoch: 37, train_loss: 0.6298, test_loss: 1.2014, test_f1: 0.5786
 epoch: 38, train_loss: 0.6189, test_loss: 1.3007, test_f1: 0.5654
 epoch: 39, train_loss: 0.6312, test_loss: 1.5939, test_f1: 0.5548
 epoch: 40, train_loss: 0.6032, test_loss: 1.6685, test_f1: 0.5959
 epoch: 41, train_loss: 0.5700, test_loss: 1.4889, test_f1: 0.6168
 epoch: 42, train_loss: 0.5875, test_loss: 1.4267, test_f1: 0.5833
 epoch: 43, train_loss: 0.5642, test_loss: 1.1839, test_f1: 0.6405
 epoch: 44, train_loss: 0.5365, test_loss: 1.4151, test_f1: 0.5552
 epoch: 45, train_loss: 0.5385, test_loss: 1.8908, test_f1: 0.4752
 epoch: 46, train_loss: 0.6160, test_loss: 1.4127, test_f1: 0.5842
 epoch: 47, train_loss: 0.5768, test_loss: 1.5323, test_f1: 0.5665
 epoch: 48, train_loss: 0.5740, test_loss: 1.5949, test_f1: 0.5073
 epoch: 49, train_loss: 0.5579, test_loss: 1.7447, test_f1: 0.5553
 epoch: 50, train_loss: 0.5792, test_loss: 1.6400, test_f1: 0.5267
 epoch: 51, train_loss: 0.5483, test_loss: 1.7120, test_f1: 0.5998
 epoch: 52, train_loss: 0.4803, test_loss: 1.2966, test_f1: 0.5841
 epoch: 53, train_loss: 0.5519, test_loss: 1.3045, test_f1: 0.5917
 epoch: 54, train_loss: 0.4715, test_loss: 1.4362, test_f1: 0.6172
 epoch: 55, train_loss: 0.4542, test_loss: 1.5058, test_f1: 0.6118
 epoch: 56, train_loss: 0.4597, test_loss: 1.5802, test_f1: 0.5523
 epoch: 57, train_loss: 0.4376, test_loss: 1.4212, test_f1: 0.6389
 epoch: 58, train_loss: 0.4222, test_loss: 1.7435, test_f1: 0.5972
 epoch: 59, train_loss: 0.4271, test_loss: 1.4758, test_f1: 0.6132
 epoch: 60, train_loss: 0.4057, test_loss: 1.7085, test_f1: 0.6074
 epoch: 61, train_loss: 0.3940, test_loss: 1.5926, test_f1: 0.5925
 epoch: 62, train_loss: 0.3824, test_loss: 1.7757, test_f1: 0.6209
 epoch: 63, train_loss: 0.3951, test_loss: 1.7392, test_f1: 0.6010
 epoch: 64, train_loss: 0.3915, test_loss: 1.8167, test_f1: 0.6239
 epoch: 65, train_loss: 0.4151, test_loss: 1.4809, test_f1: 0.6289
 epoch: 66, train_loss: 0.4240, test_loss: 1.7757, test_f1: 0.6064
 epoch: 67, train_loss: 0.3899, test_loss: 1.4939, test_f1: 0.6371
 epoch: 68, train_loss: 0.3814, test_loss: 1.8249, test_f1: 0.5759
 epoch: 69, train_loss: 0.3498, test_loss: 1.7193, test_f1: 0.5989
 epoch: 70, train_loss: 0.3364, test_loss: 1.6461, test_f1: 0.6048
 epoch: 71, train_loss: 0.3636, test_loss: 2.0428, test_f1: 0.5789
 epoch: 72, train_loss: 0.3831, test_loss: 2.0765, test_f1: 0.5800
 epoch: 73, train_loss: 0.3658, test_loss: 1.7024, test_f1: 0.6332
 epoch: 74, train_loss: 0.3999, test_loss: 1.5849, test_f1: 0.6194
 epoch: 75, train_loss: 0.3784, test_loss: 1.7208, test_f1: 0.6232
 epoch: 76, train_loss: 0.3579, test_loss: 1.7225, test_f1: 0.6114
 epoch: 77, train_loss: 0.3171, test_loss: 1.8149, test_f1: 0.6357
 epoch: 78, train_loss: 0.3058, test_loss: 1.8311, test_f1: 0.6048
 epoch: 79, train_loss: 0.3375, test_loss: 1.7021, test_f1: 0.6425
 epoch: 80, train_loss: 0.3458, test_loss: 1.9584, test_f1: 0.6138
 epoch: 81, train_loss: 0.3646, test_loss: 2.0340, test_f1: 0.5919
 epoch: 82, train_loss: 0.3267, test_loss: 1.8506, test_f1: 0.5927
 epoch: 83, train_loss: 0.2774, test_loss: 1.9996, test_f1: 0.6217
 epoch: 84, train_loss: 0.3014, test_loss: 2.0106, test_f1: 0.5818
 epoch: 85, train_loss: 0.2771, test_loss: 1.7849, test_f1: 0.6194
 epoch: 86, train_loss: 0.2901, test_loss: 1.8065, test_f1: 0.6312
 epoch: 87, train_loss: 0.2662, test_loss: 1.9944, test_f1: 0.6074
 epoch: 88, train_loss: 0.2552, test_loss: 2.2250, test_f1: 0.6097
 epoch: 89, train_loss: 0.2725, test_loss: 2.1014, test_f1: 0.5876
 epoch: 90, train_loss: 0.2489, test_loss: 1.8201, test_f1: 0.6044
 epoch: 91, train_loss: 0.2359, test_loss: 1.9086, test_f1: 0.6298
 epoch: 92, train_loss: 0.3079, test_loss: 1.9821, test_f1: 0.6278
 epoch: 93, train_loss: 0.2954, test_loss: 1.8698, test_f1: 0.6047
 epoch: 94, train_loss: 0.3161, test_loss: 1.9043, test_f1: 0.6105
 epoch: 95, train_loss: 0.2635, test_loss: 2.3950, test_f1: 0.6036
 epoch: 96, train_loss: 0.2852, test_loss: 1.9811, test_f1: 0.6157
 epoch: 97, train_loss: 0.2379, test_loss: 2.0403, test_f1: 0.6143
 epoch: 98, train_loss: 0.2474, test_loss: 2.1529, test_f1: 0.6231
 epoch: 99, train_loss: 0.2254, test_loss: 2.2105, test_f1: 0.6637
##################ITERATION #3 ****************************************
 epoch: 0, train_loss: 1.3154, test_loss: 1.6629, test_f1: 0.3281
 epoch: 1, train_loss: 1.0335, test_loss: 1.4086, test_f1: 0.3692
 epoch: 2, train_loss: 0.9946, test_loss: 1.1750, test_f1: 0.4372
 epoch: 3, train_loss: 0.9724, test_loss: 1.1176, test_f1: 0.4054
 epoch: 4, train_loss: 0.9399, test_loss: 1.0508, test_f1: 0.4801
 epoch: 5, train_loss: 0.9273, test_loss: 1.0566, test_f1: 0.4444
 epoch: 6, train_loss: 0.8826, test_loss: 0.9942, test_f1: 0.4743
 epoch: 7, train_loss: 0.8556, test_loss: 0.9601, test_f1: 0.4239
 epoch: 8, train_loss: 0.8468, test_loss: 1.4495, test_f1: 0.4690
 epoch: 9, train_loss: 0.8677, test_loss: 0.9824, test_f1: 0.4991
 epoch: 10, train_loss: 0.8086, test_loss: 0.9759, test_f1: 0.5669
 epoch: 11, train_loss: 0.8168, test_loss: 1.1168, test_f1: 0.4468
 epoch: 12, train_loss: 0.8490, test_loss: 1.1091, test_f1: 0.5018
 epoch: 13, train_loss: 0.8381, test_loss: 1.0176, test_f1: 0.5529
 epoch: 14, train_loss: 0.8134, test_loss: 1.3537, test_f1: 0.4144
 epoch: 15, train_loss: 0.7698, test_loss: 1.0960, test_f1: 0.4970
 epoch: 16, train_loss: 0.7775, test_loss: 1.0809, test_f1: 0.4645
 epoch: 17, train_loss: 0.7829, test_loss: 0.9945, test_f1: 0.5210
 epoch: 18, train_loss: 0.7495, test_loss: 1.0458, test_f1: 0.5452
 epoch: 19, train_loss: 0.7255, test_loss: 1.0601, test_f1: 0.4866
 epoch: 20, train_loss: 0.7226, test_loss: 1.0921, test_f1: 0.4603
 epoch: 21, train_loss: 0.7219, test_loss: 1.1084, test_f1: 0.5485
 epoch: 22, train_loss: 0.6979, test_loss: 1.2581, test_f1: 0.5025
 epoch: 23, train_loss: 0.7142, test_loss: 1.0979, test_f1: 0.5354
 epoch: 24, train_loss: 0.6748, test_loss: 1.2703, test_f1: 0.4444
 epoch: 25, train_loss: 0.6910, test_loss: 2.0190, test_f1: 0.4203
 epoch: 26, train_loss: 0.6943, test_loss: 1.6970, test_f1: 0.4040
 epoch: 27, train_loss: 0.6593, test_loss: 1.3533, test_f1: 0.5174
 epoch: 28, train_loss: 0.6998, test_loss: 1.2261, test_f1: 0.5310
 epoch: 29, train_loss: 0.6749, test_loss: 1.4902, test_f1: 0.4721
 epoch: 30, train_loss: 0.6770, test_loss: 1.1716, test_f1: 0.5518
 epoch: 31, train_loss: 0.7054, test_loss: 1.2978, test_f1: 0.5846
 epoch: 32, train_loss: 0.7482, test_loss: 1.2134, test_f1: 0.5534
 epoch: 33, train_loss: 0.6750, test_loss: 1.4364, test_f1: 0.5083
 epoch: 34, train_loss: 0.6506, test_loss: 2.4443, test_f1: 0.4480
 epoch: 35, train_loss: 0.6376, test_loss: 1.5007, test_f1: 0.4928
 epoch: 36, train_loss: 0.6192, test_loss: 1.4986, test_f1: 0.4832
 epoch: 37, train_loss: 0.6904, test_loss: 1.3236, test_f1: 0.5557
 epoch: 38, train_loss: 0.6659, test_loss: 1.2755, test_f1: 0.5341
 epoch: 39, train_loss: 0.5909, test_loss: 1.3416, test_f1: 0.5755
 epoch: 40, train_loss: 0.6193, test_loss: 1.3323, test_f1: 0.4603
 epoch: 41, train_loss: 0.5793, test_loss: 1.6531, test_f1: 0.5057
 epoch: 42, train_loss: 0.6159, test_loss: 1.3622, test_f1: 0.5493
 epoch: 43, train_loss: 0.5824, test_loss: 1.9206, test_f1: 0.4284
 epoch: 44, train_loss: 0.6326, test_loss: 1.3226, test_f1: 0.4580
 epoch: 45, train_loss: 0.5832, test_loss: 1.2411, test_f1: 0.5589
 epoch: 46, train_loss: 0.6007, test_loss: 1.3753, test_f1: 0.5042
 epoch: 47, train_loss: 0.5925, test_loss: 1.7862, test_f1: 0.4583
 epoch: 48, train_loss: 0.6023, test_loss: 1.5141, test_f1: 0.4973
 epoch: 49, train_loss: 0.6253, test_loss: 1.3841, test_f1: 0.5430
 epoch: 50, train_loss: 0.5451, test_loss: 1.7789, test_f1: 0.4958
 epoch: 51, train_loss: 0.5321, test_loss: 1.4627, test_f1: 0.5844
 epoch: 52, train_loss: 0.4827, test_loss: 1.3386, test_f1: 0.6101
 epoch: 53, train_loss: 0.4274, test_loss: 1.5388, test_f1: 0.6064
 epoch: 54, train_loss: 0.4641, test_loss: 1.3875, test_f1: 0.6113
 epoch: 55, train_loss: 0.4203, test_loss: 1.5394, test_f1: 0.5820
 epoch: 56, train_loss: 0.4263, test_loss: 1.6961, test_f1: 0.5883
 epoch: 57, train_loss: 0.4162, test_loss: 1.5836, test_f1: 0.5560
 epoch: 58, train_loss: 0.4135, test_loss: 1.8985, test_f1: 0.5470
 epoch: 59, train_loss: 0.3990, test_loss: 1.6400, test_f1: 0.6158
 epoch: 60, train_loss: 0.3909, test_loss: 1.7239, test_f1: 0.5723
 epoch: 61, train_loss: 0.3843, test_loss: 1.7164, test_f1: 0.5720
 epoch: 62, train_loss: 0.4220, test_loss: 1.7113, test_f1: 0.5186
 epoch: 63, train_loss: 0.4279, test_loss: 1.7538, test_f1: 0.5388
 epoch: 64, train_loss: 0.4043, test_loss: 1.5859, test_f1: 0.5424
 epoch: 65, train_loss: 0.3752, test_loss: 2.1257, test_f1: 0.5439
 epoch: 66, train_loss: 0.3837, test_loss: 2.0190, test_f1: 0.6003
 epoch: 67, train_loss: 0.4628, test_loss: 1.5904, test_f1: 0.5535
 epoch: 68, train_loss: 0.3622, test_loss: 1.8628, test_f1: 0.5366
 epoch: 69, train_loss: 0.3652, test_loss: 2.1518, test_f1: 0.5647
 epoch: 70, train_loss: 0.3665, test_loss: 2.1914, test_f1: 0.5261
 epoch: 71, train_loss: 0.3562, test_loss: 1.9988, test_f1: 0.5657
 epoch: 72, train_loss: 0.3195, test_loss: 1.9853, test_f1: 0.6213
 epoch: 73, train_loss: 0.3291, test_loss: 2.1552, test_f1: 0.6184
 epoch: 74, train_loss: 0.3149, test_loss: 1.9813, test_f1: 0.6015
 epoch: 75, train_loss: 0.3961, test_loss: 2.3476, test_f1: 0.5881
 epoch: 76, train_loss: 0.3665, test_loss: 2.0391, test_f1: 0.5910
 epoch: 77, train_loss: 0.3510, test_loss: 2.3063, test_f1: 0.5826
 epoch: 78, train_loss: 0.3921, test_loss: 1.8359, test_f1: 0.5979
 epoch: 79, train_loss: 0.3634, test_loss: 1.7547, test_f1: 0.6073
 epoch: 80, train_loss: 0.3975, test_loss: 1.8335, test_f1: 0.5798
 epoch: 81, train_loss: 0.3383, test_loss: 1.8408, test_f1: 0.6012
 epoch: 82, train_loss: 0.3277, test_loss: 1.6961, test_f1: 0.6159
 epoch: 83, train_loss: 0.3155, test_loss: 1.6100, test_f1: 0.6209
 epoch: 84, train_loss: 0.3243, test_loss: 1.7391, test_f1: 0.5899
 epoch: 85, train_loss: 0.2954, test_loss: 1.9361, test_f1: 0.6196
 epoch: 86, train_loss: 0.2848, test_loss: 2.3299, test_f1: 0.5875
 epoch: 87, train_loss: 0.2713, test_loss: 2.1689, test_f1: 0.6072
 epoch: 88, train_loss: 0.2695, test_loss: 2.2552, test_f1: 0.5891
 epoch: 89, train_loss: 0.2762, test_loss: 2.6375, test_f1: 0.5776
 epoch: 90, train_loss: 0.2707, test_loss: 2.6289, test_f1: 0.6048
 epoch: 91, train_loss: 0.2958, test_loss: 2.0341, test_f1: 0.6199
 epoch: 92, train_loss: 0.2957, test_loss: 2.2349, test_f1: 0.5943
 epoch: 93, train_loss: 0.3078, test_loss: 2.2697, test_f1: 0.5977
 epoch: 94, train_loss: 0.3001, test_loss: 2.0960, test_f1: 0.5914
 epoch: 95, train_loss: 0.2829, test_loss: 2.3960, test_f1: 0.5595
 epoch: 96, train_loss: 0.2336, test_loss: 2.3280, test_f1: 0.5997
 epoch: 97, train_loss: 0.2516, test_loss: 2.2248, test_f1: 0.5916
 epoch: 98, train_loss: 0.2531, test_loss: 2.0150, test_f1: 0.6464
 epoch: 99, train_loss: 0.2692, test_loss: 2.4042, test_f1: 0.5836
##################ITERATION #4 ****************************************
 epoch: 0, train_loss: 1.3525, test_loss: 1.3490, test_f1: 0.2285
 epoch: 1, train_loss: 1.0429, test_loss: 1.3765, test_f1: 0.3676
 epoch: 2, train_loss: 0.9768, test_loss: 1.1240, test_f1: 0.4153
 epoch: 3, train_loss: 0.9437, test_loss: 1.1534, test_f1: 0.5124
 epoch: 4, train_loss: 0.9566, test_loss: 1.1231, test_f1: 0.5490
 epoch: 5, train_loss: 0.9426, test_loss: 1.1222, test_f1: 0.4777
 epoch: 6, train_loss: 0.8966, test_loss: 1.0447, test_f1: 0.5424
 epoch: 7, train_loss: 0.8977, test_loss: 1.1087, test_f1: 0.4613
 epoch: 8, train_loss: 0.8718, test_loss: 1.0899, test_f1: 0.5225
 epoch: 9, train_loss: 0.8348, test_loss: 1.0658, test_f1: 0.5156
 epoch: 10, train_loss: 0.8506, test_loss: 1.0604, test_f1: 0.5423
 epoch: 11, train_loss: 0.8140, test_loss: 1.0931, test_f1: 0.5128
 epoch: 12, train_loss: 0.8145, test_loss: 1.2698, test_f1: 0.4910
 epoch: 13, train_loss: 0.8428, test_loss: 1.2801, test_f1: 0.5015
 epoch: 14, train_loss: 0.7679, test_loss: 1.2932, test_f1: 0.4842
 epoch: 15, train_loss: 0.7738, test_loss: 1.2143, test_f1: 0.5285
 epoch: 16, train_loss: 0.7565, test_loss: 1.1260, test_f1: 0.5402
 epoch: 17, train_loss: 0.7372, test_loss: 1.0932, test_f1: 0.5409
 epoch: 18, train_loss: 0.6923, test_loss: 1.3339, test_f1: 0.5401
 epoch: 19, train_loss: 0.6797, test_loss: 1.4037, test_f1: 0.5140
 epoch: 20, train_loss: 0.6895, test_loss: 1.3470, test_f1: 0.5082
 epoch: 21, train_loss: 0.6933, test_loss: 1.3123, test_f1: 0.5628
 epoch: 22, train_loss: 0.6944, test_loss: 1.3787, test_f1: 0.5638
 epoch: 23, train_loss: 0.6767, test_loss: 1.9790, test_f1: 0.5017
 epoch: 24, train_loss: 0.6646, test_loss: 1.2050, test_f1: 0.5798
 epoch: 25, train_loss: 0.6643, test_loss: 1.4340, test_f1: 0.5160
 epoch: 26, train_loss: 0.7021, test_loss: 1.3467, test_f1: 0.5265
 epoch: 27, train_loss: 0.6932, test_loss: 1.3141, test_f1: 0.5777
 epoch: 28, train_loss: 0.6416, test_loss: 1.3733, test_f1: 0.5746
 epoch: 29, train_loss: 0.6146, test_loss: 1.4726, test_f1: 0.5784
 epoch: 30, train_loss: 0.6414, test_loss: 1.2817, test_f1: 0.5356
 epoch: 31, train_loss: 0.6595, test_loss: 1.1496, test_f1: 0.5247
 epoch: 32, train_loss: 0.6324, test_loss: 1.4898, test_f1: 0.5622
 epoch: 33, train_loss: 0.6333, test_loss: 1.2550, test_f1: 0.5655
 epoch: 34, train_loss: 0.6166, test_loss: 1.2048, test_f1: 0.5933
 epoch: 35, train_loss: 0.6142, test_loss: 1.2104, test_f1: 0.5857
 epoch: 36, train_loss: 0.6080, test_loss: 1.3228, test_f1: 0.5523
 epoch: 37, train_loss: 0.6038, test_loss: 1.2239, test_f1: 0.5830
 epoch: 38, train_loss: 0.6098, test_loss: 1.1906, test_f1: 0.6018
 epoch: 39, train_loss: 0.5984, test_loss: 1.2517, test_f1: 0.6051
 epoch: 40, train_loss: 0.5509, test_loss: 1.3014, test_f1: 0.5791
 epoch: 41, train_loss: 0.5838, test_loss: 1.2543, test_f1: 0.6053
 epoch: 42, train_loss: 0.5807, test_loss: 1.5599, test_f1: 0.5775
 epoch: 43, train_loss: 0.6311, test_loss: 1.1543, test_f1: 0.5976
 epoch: 44, train_loss: 0.5683, test_loss: 1.2608, test_f1: 0.5136
 epoch: 45, train_loss: 0.5449, test_loss: 1.5241, test_f1: 0.4806
 epoch: 46, train_loss: 0.5586, test_loss: 1.3613, test_f1: 0.5145
 epoch: 47, train_loss: 0.5731, test_loss: 1.4271, test_f1: 0.5809
 epoch: 48, train_loss: 0.5149, test_loss: 1.7708, test_f1: 0.5626
 epoch: 49, train_loss: 0.5587, test_loss: 1.1239, test_f1: 0.5956
 epoch: 50, train_loss: 0.5749, test_loss: 1.5635, test_f1: 0.5620
 epoch: 51, train_loss: 0.5201, test_loss: 1.4874, test_f1: 0.5299
 epoch: 52, train_loss: 0.4865, test_loss: 1.5404, test_f1: 0.5772
 epoch: 53, train_loss: 0.4532, test_loss: 1.5659, test_f1: 0.5655
 epoch: 54, train_loss: 0.4524, test_loss: 1.5501, test_f1: 0.6043
 epoch: 55, train_loss: 0.4239, test_loss: 1.6062, test_f1: 0.5638
 epoch: 56, train_loss: 0.3941, test_loss: 1.8445, test_f1: 0.6133
 epoch: 57, train_loss: 0.4614, test_loss: 1.5535, test_f1: 0.6268
 epoch: 58, train_loss: 0.4466, test_loss: 1.8078, test_f1: 0.5552
 epoch: 59, train_loss: 0.4133, test_loss: 2.7724, test_f1: 0.5454
 epoch: 60, train_loss: 0.4051, test_loss: 1.6476, test_f1: 0.6413
 epoch: 61, train_loss: 0.4011, test_loss: 1.7942, test_f1: 0.6045
 epoch: 62, train_loss: 0.3575, test_loss: 1.8892, test_f1: 0.6505
 epoch: 63, train_loss: 0.4023, test_loss: 1.8645, test_f1: 0.5882
 epoch: 64, train_loss: 0.3862, test_loss: 2.0309, test_f1: 0.6182
 epoch: 65, train_loss: 0.3937, test_loss: 1.8117, test_f1: 0.5944
 epoch: 66, train_loss: 0.4109, test_loss: 1.6256, test_f1: 0.5941
 epoch: 67, train_loss: 0.3797, test_loss: 1.7000, test_f1: 0.5823
 epoch: 68, train_loss: 0.3462, test_loss: 1.7980, test_f1: 0.6055
 epoch: 69, train_loss: 0.3239, test_loss: 1.9663, test_f1: 0.5506
 epoch: 70, train_loss: 0.3524, test_loss: 2.1247, test_f1: 0.5943
 epoch: 71, train_loss: 0.3574, test_loss: 2.2814, test_f1: 0.5733
 epoch: 72, train_loss: 0.3474, test_loss: 1.7988, test_f1: 0.6368
 epoch: 73, train_loss: 0.3485, test_loss: 1.9707, test_f1: 0.5826
 epoch: 74, train_loss: 0.3501, test_loss: 2.0571, test_f1: 0.5950
 epoch: 75, train_loss: 0.3131, test_loss: 2.5024, test_f1: 0.5579
 epoch: 76, train_loss: 0.3203, test_loss: 2.5015, test_f1: 0.5625
 epoch: 77, train_loss: 0.3147, test_loss: 2.1354, test_f1: 0.6088
 epoch: 78, train_loss: 0.3436, test_loss: 2.1977, test_f1: 0.5801
 epoch: 79, train_loss: 0.2995, test_loss: 2.0597, test_f1: 0.6105
 epoch: 80, train_loss: 0.2962, test_loss: 2.4212, test_f1: 0.5879
 epoch: 81, train_loss: 0.3076, test_loss: 2.4043, test_f1: 0.5634
 epoch: 82, train_loss: 0.3272, test_loss: 1.9999, test_f1: 0.6083
 epoch: 83, train_loss: 0.3022, test_loss: 1.8904, test_f1: 0.5831
 epoch: 84, train_loss: 0.3373, test_loss: 1.8283, test_f1: 0.6021
 epoch: 85, train_loss: 0.3386, test_loss: 2.0183, test_f1: 0.6043
 epoch: 86, train_loss: 0.3570, test_loss: 2.0504, test_f1: 0.5327
 epoch: 87, train_loss: 0.3400, test_loss: 2.0364, test_f1: 0.5620
 epoch: 88, train_loss: 0.3084, test_loss: 2.1797, test_f1: 0.5827
 epoch: 89, train_loss: 0.2574, test_loss: 2.6722, test_f1: 0.5576
 epoch: 90, train_loss: 0.2638, test_loss: 2.1513, test_f1: 0.6027
 epoch: 91, train_loss: 0.2393, test_loss: 2.4654, test_f1: 0.6095
 epoch: 92, train_loss: 0.2602, test_loss: 2.2200, test_f1: 0.6421
 epoch: 93, train_loss: 0.2731, test_loss: 2.4225, test_f1: 0.5884
 epoch: 94, train_loss: 0.2982, test_loss: 2.1464, test_f1: 0.6214
 epoch: 95, train_loss: 0.2902, test_loss: 2.3687, test_f1: 0.6011
 epoch: 96, train_loss: 0.3129, test_loss: 2.4693, test_f1: 0.5890
 epoch: 97, train_loss: 0.2727, test_loss: 2.4412, test_f1: 0.5695
 epoch: 98, train_loss: 0.3224, test_loss: 2.1798, test_f1: 0.6165
 epoch: 99, train_loss: 0.2931, test_loss: 1.9951, test_f1: 0.6452
##################ITERATION #5 ****************************************
 epoch: 0, train_loss: 1.4445, test_loss: 1.3301, test_f1: 0.2883
 epoch: 1, train_loss: 1.0531, test_loss: 1.1786, test_f1: 0.4781
 epoch: 2, train_loss: 0.9377, test_loss: 1.0000, test_f1: 0.5293
 epoch: 3, train_loss: 0.9015, test_loss: 1.0300, test_f1: 0.5738
 epoch: 4, train_loss: 0.8722, test_loss: 0.9607, test_f1: 0.5676
 epoch: 5, train_loss: 0.8496, test_loss: 1.0349, test_f1: 0.5632
 epoch: 6, train_loss: 0.8143, test_loss: 1.0974, test_f1: 0.5515
 epoch: 7, train_loss: 0.8099, test_loss: 1.0592, test_f1: 0.5411
 epoch: 8, train_loss: 0.7755, test_loss: 1.3092, test_f1: 0.4546
 epoch: 9, train_loss: 0.8061, test_loss: 1.3174, test_f1: 0.5488
 epoch: 10, train_loss: 0.8365, test_loss: 1.1813, test_f1: 0.5204
 epoch: 11, train_loss: 0.7915, test_loss: 1.1671, test_f1: 0.5061
 epoch: 12, train_loss: 0.7705, test_loss: 1.0935, test_f1: 0.5713
 epoch: 13, train_loss: 0.7531, test_loss: 1.2043, test_f1: 0.5584
 epoch: 14, train_loss: 0.7257, test_loss: 0.9920, test_f1: 0.5994
 epoch: 15, train_loss: 0.7606, test_loss: 1.1689, test_f1: 0.5274
 epoch: 16, train_loss: 0.7612, test_loss: 1.1816, test_f1: 0.5278
 epoch: 17, train_loss: 0.6968, test_loss: 1.2916, test_f1: 0.5048
 epoch: 18, train_loss: 0.7234, test_loss: 1.6642, test_f1: 0.5207
 epoch: 19, train_loss: 0.7464, test_loss: 1.1842, test_f1: 0.5326
 epoch: 20, train_loss: 0.7385, test_loss: 1.2675, test_f1: 0.5481
 epoch: 21, train_loss: 0.6799, test_loss: 1.3682, test_f1: 0.5922
 epoch: 22, train_loss: 0.6691, test_loss: 1.1522, test_f1: 0.5343
 epoch: 23, train_loss: 0.7062, test_loss: 1.1664, test_f1: 0.5527
 epoch: 24, train_loss: 0.6740, test_loss: 1.0735, test_f1: 0.5597
 epoch: 25, train_loss: 0.6368, test_loss: 1.6111, test_f1: 0.4923
 epoch: 26, train_loss: 0.6458, test_loss: 1.2277, test_f1: 0.5800
 epoch: 27, train_loss: 0.6796, test_loss: 1.2042, test_f1: 0.5482
 epoch: 28, train_loss: 0.6626, test_loss: 1.1237, test_f1: 0.6036
 epoch: 29, train_loss: 0.6397, test_loss: 1.2457, test_f1: 0.5509
 epoch: 30, train_loss: 0.6218, test_loss: 1.3550, test_f1: 0.5752
 epoch: 31, train_loss: 0.6053, test_loss: 1.2603, test_f1: 0.5507
 epoch: 32, train_loss: 0.6253, test_loss: 1.4420, test_f1: 0.5202
 epoch: 33, train_loss: 0.6242, test_loss: 1.2577, test_f1: 0.5282
 epoch: 34, train_loss: 0.6198, test_loss: 1.3947, test_f1: 0.5247
 epoch: 35, train_loss: 0.6638, test_loss: 1.1667, test_f1: 0.5911
 epoch: 36, train_loss: 0.6094, test_loss: 1.2623, test_f1: 0.5881
 epoch: 37, train_loss: 0.6572, test_loss: 1.0877, test_f1: 0.6131
 epoch: 38, train_loss: 0.6236, test_loss: 1.6145, test_f1: 0.5107
 epoch: 39, train_loss: 0.5768, test_loss: 1.5782, test_f1: 0.5827
 epoch: 40, train_loss: 0.5649, test_loss: 1.6033, test_f1: 0.5952
 epoch: 41, train_loss: 0.5969, test_loss: 1.4778, test_f1: 0.5573
 epoch: 42, train_loss: 0.5771, test_loss: 1.7837, test_f1: 0.5163
 epoch: 43, train_loss: 0.5536, test_loss: 1.8448, test_f1: 0.5745
 epoch: 44, train_loss: 0.5855, test_loss: 1.6869, test_f1: 0.5415
 epoch: 45, train_loss: 0.5838, test_loss: 1.1704, test_f1: 0.5932
 epoch: 46, train_loss: 0.5779, test_loss: 1.4206, test_f1: 0.5269
 epoch: 47, train_loss: 0.5777, test_loss: 2.0592, test_f1: 0.5175
 epoch: 48, train_loss: 0.5463, test_loss: 1.6800, test_f1: 0.6012
 epoch: 49, train_loss: 0.5431, test_loss: 1.6342, test_f1: 0.4955
 epoch: 50, train_loss: 0.5270, test_loss: 1.3902, test_f1: 0.5075
 epoch: 51, train_loss: 0.4913, test_loss: 1.5740, test_f1: 0.6173
 epoch: 52, train_loss: 0.4658, test_loss: 1.6250, test_f1: 0.5668
 epoch: 53, train_loss: 0.4542, test_loss: 1.6430, test_f1: 0.5620
 epoch: 54, train_loss: 0.4291, test_loss: 1.8692, test_f1: 0.5857
 epoch: 55, train_loss: 0.4518, test_loss: 1.8125, test_f1: 0.5892
 epoch: 56, train_loss: 0.4070, test_loss: 1.8363, test_f1: 0.5342
 epoch: 57, train_loss: 0.4132, test_loss: 1.8745, test_f1: 0.5678
 epoch: 58, train_loss: 0.4236, test_loss: 1.8637, test_f1: 0.6086
 epoch: 59, train_loss: 0.4026, test_loss: 2.1322, test_f1: 0.5899
 epoch: 60, train_loss: 0.3775, test_loss: 1.9818, test_f1: 0.5955
 epoch: 61, train_loss: 0.3552, test_loss: 1.9119, test_f1: 0.6050
 epoch: 62, train_loss: 0.3968, test_loss: 2.0742, test_f1: 0.5906
 epoch: 63, train_loss: 0.4243, test_loss: 2.0688, test_f1: 0.5828
 epoch: 64, train_loss: 0.4403, test_loss: 2.8014, test_f1: 0.5014
 epoch: 65, train_loss: 0.3697, test_loss: 1.8351, test_f1: 0.5747
 epoch: 66, train_loss: 0.3882, test_loss: 1.7570, test_f1: 0.5971
 epoch: 67, train_loss: 0.3701, test_loss: 2.4636, test_f1: 0.5597
 epoch: 68, train_loss: 0.3856, test_loss: 1.7364, test_f1: 0.6052
 epoch: 69, train_loss: 0.3772, test_loss: 2.0104, test_f1: 0.5737
 epoch: 70, train_loss: 0.3294, test_loss: 2.0049, test_f1: 0.5600
 epoch: 71, train_loss: 0.3373, test_loss: 1.7650, test_f1: 0.6074
 epoch: 72, train_loss: 0.3560, test_loss: 2.0961, test_f1: 0.5500
 epoch: 73, train_loss: 0.3719, test_loss: 1.8685, test_f1: 0.5860
 epoch: 74, train_loss: 0.4034, test_loss: 2.2932, test_f1: 0.5533
 epoch: 75, train_loss: 0.4492, test_loss: 2.5212, test_f1: 0.5349
 epoch: 76, train_loss: 0.4172, test_loss: 2.8247, test_f1: 0.5766
 epoch: 77, train_loss: 0.3798, test_loss: 1.7587, test_f1: 0.6039
 epoch: 78, train_loss: 0.3838, test_loss: 2.2474, test_f1: 0.5476
 epoch: 79, train_loss: 0.3840, test_loss: 1.9252, test_f1: 0.5858
 epoch: 80, train_loss: 0.3452, test_loss: 2.2441, test_f1: 0.5749
 epoch: 81, train_loss: 0.3136, test_loss: 2.1721, test_f1: 0.5743
 epoch: 82, train_loss: 0.3109, test_loss: 1.9743, test_f1: 0.6137
 epoch: 83, train_loss: 0.3056, test_loss: 2.3500, test_f1: 0.5974
 epoch: 84, train_loss: 0.3029, test_loss: 2.1426, test_f1: 0.5752
 epoch: 85, train_loss: 0.2982, test_loss: 2.1918, test_f1: 0.5827
 epoch: 86, train_loss: 0.3033, test_loss: 2.2355, test_f1: 0.5795
 epoch: 87, train_loss: 0.3020, test_loss: 2.6429, test_f1: 0.5433
 epoch: 88, train_loss: 0.3638, test_loss: 3.4235, test_f1: 0.4717
 epoch: 89, train_loss: 0.3170, test_loss: 2.2440, test_f1: 0.5703
 epoch: 90, train_loss: 0.3373, test_loss: 1.8522, test_f1: 0.5489
 epoch: 91, train_loss: 0.3252, test_loss: 2.0040, test_f1: 0.5891
 epoch: 92, train_loss: 0.3395, test_loss: 2.0963, test_f1: 0.5668
 epoch: 93, train_loss: 0.2973, test_loss: 2.6790, test_f1: 0.5300
 epoch: 94, train_loss: 0.2860, test_loss: 2.4716, test_f1: 0.5660
 epoch: 95, train_loss: 0.2581, test_loss: 3.0097, test_f1: 0.5469
 epoch: 96, train_loss: 0.2941, test_loss: 2.3659, test_f1: 0.5339
 epoch: 97, train_loss: 0.2899, test_loss: 2.5308, test_f1: 0.5516
 epoch: 98, train_loss: 0.2369, test_loss: 2.2940, test_f1: 0.6011
 epoch: 99, train_loss: 0.2415, test_loss: 2.5329, test_f1: 0.5586
##################ITERATION #6 ****************************************
 epoch: 0, train_loss: 1.3469, test_loss: 1.3303, test_f1: 0.3388
 epoch: 1, train_loss: 0.9821, test_loss: 1.1964, test_f1: 0.3517
 epoch: 2, train_loss: 0.9278, test_loss: 1.1237, test_f1: 0.4511
 epoch: 3, train_loss: 0.9224, test_loss: 1.0232, test_f1: 0.4847
 epoch: 4, train_loss: 0.8906, test_loss: 1.0177, test_f1: 0.5283
 epoch: 5, train_loss: 0.8512, test_loss: 1.0262, test_f1: 0.5526
 epoch: 6, train_loss: 0.8348, test_loss: 1.2683, test_f1: 0.4254
 epoch: 7, train_loss: 0.8078, test_loss: 1.1148, test_f1: 0.4893
 epoch: 8, train_loss: 0.7866, test_loss: 1.3211, test_f1: 0.5506
 epoch: 9, train_loss: 0.7853, test_loss: 1.1448, test_f1: 0.5278
 epoch: 10, train_loss: 0.7714, test_loss: 1.3425, test_f1: 0.5268
 epoch: 11, train_loss: 0.7480, test_loss: 1.3539, test_f1: 0.4718
 epoch: 12, train_loss: 0.7499, test_loss: 1.0898, test_f1: 0.5489
 epoch: 13, train_loss: 0.7511, test_loss: 1.1449, test_f1: 0.5074
 epoch: 14, train_loss: 0.7511, test_loss: 1.0691, test_f1: 0.5069
 epoch: 15, train_loss: 0.7374, test_loss: 1.0816, test_f1: 0.5952
 epoch: 16, train_loss: 0.6972, test_loss: 1.1836, test_f1: 0.5947
 epoch: 17, train_loss: 0.6650, test_loss: 1.2657, test_f1: 0.6091
 epoch: 18, train_loss: 0.6563, test_loss: 1.0824, test_f1: 0.6664
 epoch: 19, train_loss: 0.6363, test_loss: 1.3707, test_f1: 0.5588
 epoch: 20, train_loss: 0.6665, test_loss: 1.2548, test_f1: 0.6101
 epoch: 21, train_loss: 0.6604, test_loss: 1.2069, test_f1: 0.6262
 epoch: 22, train_loss: 0.6695, test_loss: 1.8552, test_f1: 0.4357
 epoch: 23, train_loss: 0.6332, test_loss: 1.3764, test_f1: 0.5623
 epoch: 24, train_loss: 0.6438, test_loss: 1.2232, test_f1: 0.5734
 epoch: 25, train_loss: 0.6455, test_loss: 1.7225, test_f1: 0.5278
 epoch: 26, train_loss: 0.6323, test_loss: 1.2623, test_f1: 0.5984
 epoch: 27, train_loss: 0.5899, test_loss: 2.2271, test_f1: 0.4981
 epoch: 28, train_loss: 0.6787, test_loss: 1.3715, test_f1: 0.5044
 epoch: 29, train_loss: 0.6304, test_loss: 1.0747, test_f1: 0.6123
 epoch: 30, train_loss: 0.6383, test_loss: 1.2234, test_f1: 0.5993
 epoch: 31, train_loss: 0.5972, test_loss: 1.0610, test_f1: 0.6156
 epoch: 32, train_loss: 0.5905, test_loss: 1.3669, test_f1: 0.5796
 epoch: 33, train_loss: 0.5974, test_loss: 1.5829, test_f1: 0.5411
 epoch: 34, train_loss: 0.5921, test_loss: 1.3782, test_f1: 0.6040
 epoch: 35, train_loss: 0.5946, test_loss: 1.3538, test_f1: 0.5716
 epoch: 36, train_loss: 0.5813, test_loss: 1.3491, test_f1: 0.5611
 epoch: 37, train_loss: 0.5860, test_loss: 1.3527, test_f1: 0.5935
 epoch: 38, train_loss: 0.5466, test_loss: 1.4209, test_f1: 0.6194
 epoch: 39, train_loss: 0.5697, test_loss: 1.2415, test_f1: 0.5901
 epoch: 40, train_loss: 0.5386, test_loss: 1.4888, test_f1: 0.6139
 epoch: 41, train_loss: 0.4959, test_loss: 1.4428, test_f1: 0.6486
 epoch: 42, train_loss: 0.5664, test_loss: 1.2872, test_f1: 0.6335
 epoch: 43, train_loss: 0.5403, test_loss: 1.4380, test_f1: 0.5857
 epoch: 44, train_loss: 0.5256, test_loss: 1.5267, test_f1: 0.5709
 epoch: 45, train_loss: 0.5276, test_loss: 1.3972, test_f1: 0.5440
 epoch: 46, train_loss: 0.6001, test_loss: 1.2819, test_f1: 0.6004
 epoch: 47, train_loss: 0.5991, test_loss: 1.4694, test_f1: 0.5414
 epoch: 48, train_loss: 0.5270, test_loss: 1.7226, test_f1: 0.5812
 epoch: 49, train_loss: 0.4955, test_loss: 1.4163, test_f1: 0.6086
 epoch: 50, train_loss: 0.5587, test_loss: 1.4822, test_f1: 0.6297
 epoch: 51, train_loss: 0.4836, test_loss: 1.4152, test_f1: 0.5886
 epoch: 52, train_loss: 0.4412, test_loss: 1.4463, test_f1: 0.6350
 epoch: 53, train_loss: 0.4209, test_loss: 1.5133, test_f1: 0.6102
 epoch: 54, train_loss: 0.4076, test_loss: 1.6375, test_f1: 0.5968
 epoch: 55, train_loss: 0.4341, test_loss: 1.7220, test_f1: 0.6063
 epoch: 56, train_loss: 0.4053, test_loss: 1.6841, test_f1: 0.6279
 epoch: 57, train_loss: 0.3966, test_loss: 1.6688, test_f1: 0.6603
 epoch: 58, train_loss: 0.3649, test_loss: 1.5550, test_f1: 0.6549
 epoch: 59, train_loss: 0.3988, test_loss: 1.8023, test_f1: 0.5876
 epoch: 60, train_loss: 0.3878, test_loss: 1.8074, test_f1: 0.5655
 epoch: 61, train_loss: 0.3611, test_loss: 1.6545, test_f1: 0.5954
 epoch: 62, train_loss: 0.4010, test_loss: 1.6712, test_f1: 0.6229
 epoch: 63, train_loss: 0.3738, test_loss: 1.7758, test_f1: 0.6241
 epoch: 64, train_loss: 0.3433, test_loss: 1.8465, test_f1: 0.6439
 epoch: 65, train_loss: 0.3014, test_loss: 1.9557, test_f1: 0.6537
 epoch: 66, train_loss: 0.3406, test_loss: 1.9324, test_f1: 0.6332
 epoch: 67, train_loss: 0.3339, test_loss: 1.7570, test_f1: 0.6230
 epoch: 68, train_loss: 0.3609, test_loss: 2.1413, test_f1: 0.5354
 epoch: 69, train_loss: 0.3641, test_loss: 2.0914, test_f1: 0.6280
 epoch: 70, train_loss: 0.3989, test_loss: 1.5433, test_f1: 0.5836
 epoch: 71, train_loss: 0.3504, test_loss: 1.8373, test_f1: 0.6128
 epoch: 72, train_loss: 0.3702, test_loss: 2.2392, test_f1: 0.5659
 epoch: 73, train_loss: 0.3523, test_loss: 1.9027, test_f1: 0.5969
 epoch: 74, train_loss: 0.3714, test_loss: 1.7608, test_f1: 0.6138
 epoch: 75, train_loss: 0.3305, test_loss: 1.6894, test_f1: 0.6156
 epoch: 76, train_loss: 0.3725, test_loss: 2.3852, test_f1: 0.4652
 epoch: 77, train_loss: 0.3713, test_loss: 1.9802, test_f1: 0.6000
 epoch: 78, train_loss: 0.4289, test_loss: 1.5528, test_f1: 0.6084
 epoch: 79, train_loss: 0.4186, test_loss: 1.6097, test_f1: 0.6277
 epoch: 80, train_loss: 0.3570, test_loss: 1.9483, test_f1: 0.5899
 epoch: 81, train_loss: 0.3324, test_loss: 1.8062, test_f1: 0.6325
 epoch: 82, train_loss: 0.3288, test_loss: 1.8264, test_f1: 0.6577
 epoch: 83, train_loss: 0.3225, test_loss: 2.1038, test_f1: 0.5914
 epoch: 84, train_loss: 0.3229, test_loss: 2.1027, test_f1: 0.5845
 epoch: 85, train_loss: 0.3937, test_loss: 1.6285, test_f1: 0.6196
 epoch: 86, train_loss: 0.3186, test_loss: 1.7135, test_f1: 0.6392
 epoch: 87, train_loss: 0.3038, test_loss: 1.8175, test_f1: 0.5843
 epoch: 88, train_loss: 0.3005, test_loss: 2.0688, test_f1: 0.5870
 epoch: 89, train_loss: 0.3147, test_loss: 2.1294, test_f1: 0.5917
 epoch: 90, train_loss: 0.3613, test_loss: 2.1460, test_f1: 0.5940
 epoch: 91, train_loss: 0.3239, test_loss: 2.0415, test_f1: 0.5942
 epoch: 92, train_loss: 0.3232, test_loss: 1.8351, test_f1: 0.6433
 epoch: 93, train_loss: 0.2710, test_loss: 2.1475, test_f1: 0.6175
 epoch: 94, train_loss: 0.2747, test_loss: 1.9725, test_f1: 0.6036
 epoch: 95, train_loss: 0.2910, test_loss: 2.0030, test_f1: 0.6172
 epoch: 96, train_loss: 0.2701, test_loss: 1.9897, test_f1: 0.6486
 epoch: 97, train_loss: 0.2714, test_loss: 2.2908, test_f1: 0.6136
 epoch: 98, train_loss: 0.2541, test_loss: 2.2459, test_f1: 0.6318
 epoch: 99, train_loss: 0.2582, test_loss: 2.3181, test_f1: 0.5874
##################ITERATION #7 ****************************************
 epoch: 0, train_loss: 1.3282, test_loss: 1.3717, test_f1: 0.1697
 epoch: 1, train_loss: 0.9904, test_loss: 1.1114, test_f1: 0.4145
 epoch: 2, train_loss: 0.9296, test_loss: 1.0810, test_f1: 0.4136
 epoch: 3, train_loss: 0.8852, test_loss: 1.0270, test_f1: 0.4579
 epoch: 4, train_loss: 0.8534, test_loss: 1.0407, test_f1: 0.4242
 epoch: 5, train_loss: 0.8198, test_loss: 1.1305, test_f1: 0.5554
 epoch: 6, train_loss: 0.8346, test_loss: 1.0867, test_f1: 0.5079
 epoch: 7, train_loss: 0.8376, test_loss: 1.7492, test_f1: 0.3652
 epoch: 8, train_loss: 0.7906, test_loss: 1.4071, test_f1: 0.4540
 epoch: 9, train_loss: 0.7702, test_loss: 1.1383, test_f1: 0.4737
 epoch: 10, train_loss: 0.7548, test_loss: 1.0915, test_f1: 0.4939
 epoch: 11, train_loss: 0.7402, test_loss: 0.9982, test_f1: 0.5758
 epoch: 12, train_loss: 0.7080, test_loss: 1.2004, test_f1: 0.5382
 epoch: 13, train_loss: 0.7185, test_loss: 1.3304, test_f1: 0.5376
 epoch: 14, train_loss: 0.6748, test_loss: 1.3641, test_f1: 0.5276
 epoch: 15, train_loss: 0.6741, test_loss: 1.0703, test_f1: 0.5961
 epoch: 16, train_loss: 0.6631, test_loss: 1.4352, test_f1: 0.5105
 epoch: 17, train_loss: 0.6759, test_loss: 1.1833, test_f1: 0.5963
 epoch: 18, train_loss: 0.6504, test_loss: 1.3268, test_f1: 0.5573
 epoch: 19, train_loss: 0.6561, test_loss: 1.3189, test_f1: 0.5705
 epoch: 20, train_loss: 0.6433, test_loss: 1.2273, test_f1: 0.5375
 epoch: 21, train_loss: 0.6589, test_loss: 1.0988, test_f1: 0.5961
 epoch: 22, train_loss: 0.6102, test_loss: 1.2684, test_f1: 0.5540
 epoch: 23, train_loss: 0.5906, test_loss: 1.3247, test_f1: 0.5745
 epoch: 24, train_loss: 0.6311, test_loss: 1.3543, test_f1: 0.5699
 epoch: 25, train_loss: 0.6024, test_loss: 2.1683, test_f1: 0.4778
 epoch: 26, train_loss: 0.5718, test_loss: 1.1713, test_f1: 0.6088
 epoch: 27, train_loss: 0.5639, test_loss: 1.3725, test_f1: 0.5472
 epoch: 28, train_loss: 0.5752, test_loss: 1.7246, test_f1: 0.5065
 epoch: 29, train_loss: 0.5385, test_loss: 2.4000, test_f1: 0.4833
 epoch: 30, train_loss: 0.5778, test_loss: 1.2495, test_f1: 0.5992
 epoch: 31, train_loss: 0.5666, test_loss: 1.4108, test_f1: 0.5857
 epoch: 32, train_loss: 0.5579, test_loss: 1.3986, test_f1: 0.5907
 epoch: 33, train_loss: 0.5161, test_loss: 1.1897, test_f1: 0.5857
 epoch: 34, train_loss: 0.5331, test_loss: 1.7936, test_f1: 0.5740
 epoch: 35, train_loss: 0.5666, test_loss: 1.4644, test_f1: 0.5187
 epoch: 36, train_loss: 0.5183, test_loss: 1.3596, test_f1: 0.5614
 epoch: 37, train_loss: 0.5518, test_loss: 1.9583, test_f1: 0.5630
 epoch: 38, train_loss: 0.5580, test_loss: 1.2796, test_f1: 0.5952
 epoch: 39, train_loss: 0.5320, test_loss: 1.5168, test_f1: 0.6268
 epoch: 40, train_loss: 0.5362, test_loss: 1.5220, test_f1: 0.5722
 epoch: 41, train_loss: 0.5283, test_loss: 1.7051, test_f1: 0.5525
 epoch: 42, train_loss: 0.5465, test_loss: 1.7006, test_f1: 0.5039
 epoch: 43, train_loss: 0.5396, test_loss: 1.3504, test_f1: 0.6115
 epoch: 44, train_loss: 0.4887, test_loss: 1.2484, test_f1: 0.6088
 epoch: 45, train_loss: 0.4660, test_loss: 1.7913, test_f1: 0.5313
 epoch: 46, train_loss: 0.4860, test_loss: 1.3226, test_f1: 0.6277
 epoch: 47, train_loss: 0.4586, test_loss: 1.4535, test_f1: 0.6190
 epoch: 48, train_loss: 0.4567, test_loss: 1.5352, test_f1: 0.5338
 epoch: 49, train_loss: 0.5280, test_loss: 1.1938, test_f1: 0.6006
 epoch: 50, train_loss: 0.4771, test_loss: 1.6803, test_f1: 0.5775
 epoch: 51, train_loss: 0.4398, test_loss: 1.4834, test_f1: 0.6289
 epoch: 52, train_loss: 0.3806, test_loss: 1.5957, test_f1: 0.6027
 epoch: 53, train_loss: 0.3537, test_loss: 1.5110, test_f1: 0.6281
 epoch: 54, train_loss: 0.3668, test_loss: 1.4170, test_f1: 0.5885
 epoch: 55, train_loss: 0.3348, test_loss: 1.5631, test_f1: 0.6323
 epoch: 56, train_loss: 0.3635, test_loss: 1.3593, test_f1: 0.6482
 epoch: 57, train_loss: 0.3289, test_loss: 1.6226, test_f1: 0.6205
 epoch: 58, train_loss: 0.3401, test_loss: 1.6760, test_f1: 0.6205
 epoch: 59, train_loss: 0.3191, test_loss: 1.5991, test_f1: 0.6217
 epoch: 60, train_loss: 0.3121, test_loss: 1.6531, test_f1: 0.6353
 epoch: 61, train_loss: 0.2943, test_loss: 1.8000, test_f1: 0.5909
 epoch: 62, train_loss: 0.3193, test_loss: 1.8627, test_f1: 0.5856
 epoch: 63, train_loss: 0.2835, test_loss: 1.7433, test_f1: 0.6392
 epoch: 64, train_loss: 0.2903, test_loss: 2.0927, test_f1: 0.6234
 epoch: 65, train_loss: 0.3097, test_loss: 1.9702, test_f1: 0.6207
 epoch: 66, train_loss: 0.2755, test_loss: 1.6912, test_f1: 0.5618
 epoch: 67, train_loss: 0.2782, test_loss: 1.7547, test_f1: 0.6145
 epoch: 68, train_loss: 0.2855, test_loss: 1.6688, test_f1: 0.6331
 epoch: 69, train_loss: 0.2909, test_loss: 1.9136, test_f1: 0.6137
 epoch: 70, train_loss: 0.2761, test_loss: 1.9415, test_f1: 0.6354
 epoch: 71, train_loss: 0.2550, test_loss: 1.8309, test_f1: 0.5984
 epoch: 72, train_loss: 0.2902, test_loss: 1.8160, test_f1: 0.6070
 epoch: 73, train_loss: 0.2652, test_loss: 2.1609, test_f1: 0.5883
 epoch: 74, train_loss: 0.2621, test_loss: 1.9270, test_f1: 0.6072
 epoch: 75, train_loss: 0.2613, test_loss: 1.8209, test_f1: 0.5768
 epoch: 76, train_loss: 0.2639, test_loss: 1.9775, test_f1: 0.5815
 epoch: 77, train_loss: 0.2579, test_loss: 2.0259, test_f1: 0.6120
 epoch: 78, train_loss: 0.2478, test_loss: 1.6910, test_f1: 0.6338
 epoch: 79, train_loss: 0.2469, test_loss: 1.9747, test_f1: 0.6278
 epoch: 80, train_loss: 0.2742, test_loss: 2.4663, test_f1: 0.5804
 epoch: 81, train_loss: 0.2826, test_loss: 2.2899, test_f1: 0.6210
 epoch: 82, train_loss: 0.2547, test_loss: 2.2000, test_f1: 0.6371
 epoch: 83, train_loss: 0.3103, test_loss: 1.8606, test_f1: 0.6461
 epoch: 84, train_loss: 0.2605, test_loss: 2.0267, test_f1: 0.6332
 epoch: 85, train_loss: 0.2746, test_loss: 1.9372, test_f1: 0.6348
 epoch: 86, train_loss: 0.2199, test_loss: 2.0202, test_f1: 0.6619
 epoch: 87, train_loss: 0.2369, test_loss: 1.9830, test_f1: 0.6002
 epoch: 88, train_loss: 0.2216, test_loss: 1.8885, test_f1: 0.6163
 epoch: 89, train_loss: 0.2323, test_loss: 2.1311, test_f1: 0.6367
 epoch: 90, train_loss: 0.2685, test_loss: 2.2630, test_f1: 0.5884
 epoch: 91, train_loss: 0.2753, test_loss: 1.9106, test_f1: 0.6097
 epoch: 92, train_loss: 0.2369, test_loss: 2.0582, test_f1: 0.6380
 epoch: 93, train_loss: 0.2272, test_loss: 2.1163, test_f1: 0.6125
 epoch: 94, train_loss: 0.2081, test_loss: 2.1099, test_f1: 0.6301
 epoch: 95, train_loss: 0.1892, test_loss: 2.2635, test_f1: 0.6339
 epoch: 96, train_loss: 0.1845, test_loss: 2.8448, test_f1: 0.5571
 epoch: 97, train_loss: 0.3493, test_loss: 1.9107, test_f1: 0.5851
 epoch: 98, train_loss: 0.2336, test_loss: 2.0686, test_f1: 0.6091
 epoch: 99, train_loss: 0.2214, test_loss: 1.9464, test_f1: 0.6116
##################ITERATION #8 ****************************************
 epoch: 0, train_loss: 1.5055, test_loss: 1.4767, test_f1: 0.2281
 epoch: 1, train_loss: 1.1001, test_loss: 1.3702, test_f1: 0.2420
 epoch: 2, train_loss: 1.0495, test_loss: 1.2171, test_f1: 0.4630
 epoch: 3, train_loss: 1.0277, test_loss: 1.1034, test_f1: 0.4134
 epoch: 4, train_loss: 0.9984, test_loss: 1.0995, test_f1: 0.4003
 epoch: 5, train_loss: 0.9781, test_loss: 1.0469, test_f1: 0.4907
 epoch: 6, train_loss: 0.9445, test_loss: 1.0747, test_f1: 0.4523
 epoch: 7, train_loss: 0.9222, test_loss: 1.0285, test_f1: 0.4871
 epoch: 8, train_loss: 0.9234, test_loss: 1.0575, test_f1: 0.5267
 epoch: 9, train_loss: 0.9010, test_loss: 1.1371, test_f1: 0.3980
 epoch: 10, train_loss: 0.8812, test_loss: 1.1676, test_f1: 0.5067
 epoch: 11, train_loss: 0.8434, test_loss: 1.1580, test_f1: 0.4942
 epoch: 12, train_loss: 0.8410, test_loss: 1.2071, test_f1: 0.4989
 epoch: 13, train_loss: 0.8527, test_loss: 1.0305, test_f1: 0.5544
 epoch: 14, train_loss: 0.7915, test_loss: 1.2854, test_f1: 0.5323
 epoch: 15, train_loss: 0.8003, test_loss: 1.1371, test_f1: 0.5520
 epoch: 16, train_loss: 0.7797, test_loss: 1.0817, test_f1: 0.5277
 epoch: 17, train_loss: 0.7478, test_loss: 1.2120, test_f1: 0.5360
 epoch: 18, train_loss: 0.7549, test_loss: 1.2063, test_f1: 0.5023
 epoch: 19, train_loss: 0.7505, test_loss: 1.1971, test_f1: 0.5235
 epoch: 20, train_loss: 0.7632, test_loss: 1.0375, test_f1: 0.4955
 epoch: 21, train_loss: 0.7571, test_loss: 1.2871, test_f1: 0.5009
 epoch: 22, train_loss: 0.7365, test_loss: 1.2487, test_f1: 0.5477
 epoch: 23, train_loss: 0.7203, test_loss: 1.1034, test_f1: 0.5765
 epoch: 24, train_loss: 0.7191, test_loss: 1.2023, test_f1: 0.5431
 epoch: 25, train_loss: 0.7779, test_loss: 1.0736, test_f1: 0.4826
 epoch: 26, train_loss: 0.7345, test_loss: 1.0718, test_f1: 0.5047
 epoch: 27, train_loss: 0.7347, test_loss: 1.2278, test_f1: 0.5044
 epoch: 28, train_loss: 0.7148, test_loss: 1.0931, test_f1: 0.5101
 epoch: 29, train_loss: 0.7000, test_loss: 1.1083, test_f1: 0.5876
 epoch: 30, train_loss: 0.6782, test_loss: 1.6209, test_f1: 0.4950
 epoch: 31, train_loss: 0.6906, test_loss: 1.2055, test_f1: 0.5902
 epoch: 32, train_loss: 0.6975, test_loss: 1.1262, test_f1: 0.5889
 epoch: 33, train_loss: 0.6767, test_loss: 1.2272, test_f1: 0.5723
 epoch: 34, train_loss: 0.6545, test_loss: 1.2991, test_f1: 0.5882
 epoch: 35, train_loss: 0.6467, test_loss: 1.2592, test_f1: 0.5604
 epoch: 36, train_loss: 0.6866, test_loss: 1.0171, test_f1: 0.6240
 epoch: 37, train_loss: 0.6313, test_loss: 1.1274, test_f1: 0.5398
 epoch: 38, train_loss: 0.6443, test_loss: 1.1691, test_f1: 0.5577
 epoch: 39, train_loss: 0.6448, test_loss: 1.2135, test_f1: 0.6047
 epoch: 40, train_loss: 0.6384, test_loss: 1.1997, test_f1: 0.5760
 epoch: 41, train_loss: 0.6199, test_loss: 0.9850, test_f1: 0.6199
 epoch: 42, train_loss: 0.6101, test_loss: 1.5781, test_f1: 0.5575
 epoch: 43, train_loss: 0.6358, test_loss: 1.0034, test_f1: 0.6071
 epoch: 44, train_loss: 0.5905, test_loss: 1.1108, test_f1: 0.6183
 epoch: 45, train_loss: 0.6141, test_loss: 1.2947, test_f1: 0.5729
 epoch: 46, train_loss: 0.6553, test_loss: 3.3159, test_f1: 0.4023
 epoch: 47, train_loss: 0.6472, test_loss: 1.3301, test_f1: 0.5448
 epoch: 48, train_loss: 0.5937, test_loss: 1.2418, test_f1: 0.5957
 epoch: 49, train_loss: 0.5686, test_loss: 1.1403, test_f1: 0.5935
 epoch: 50, train_loss: 0.6255, test_loss: 1.1132, test_f1: 0.5975
 epoch: 51, train_loss: 0.5931, test_loss: 1.2542, test_f1: 0.6080
 epoch: 52, train_loss: 0.5434, test_loss: 1.3756, test_f1: 0.6156
 epoch: 53, train_loss: 0.5305, test_loss: 1.2014, test_f1: 0.6245
 epoch: 54, train_loss: 0.5143, test_loss: 1.2242, test_f1: 0.6255
 epoch: 55, train_loss: 0.5136, test_loss: 1.4059, test_f1: 0.5966
 epoch: 56, train_loss: 0.5085, test_loss: 1.3976, test_f1: 0.5950
 epoch: 57, train_loss: 0.4724, test_loss: 1.3459, test_f1: 0.5992
 epoch: 58, train_loss: 0.4540, test_loss: 1.3678, test_f1: 0.6351
 epoch: 59, train_loss: 0.4445, test_loss: 1.6346, test_f1: 0.6091
 epoch: 60, train_loss: 0.4347, test_loss: 1.4146, test_f1: 0.6454
 epoch: 61, train_loss: 0.4642, test_loss: 1.6768, test_f1: 0.5843
 epoch: 62, train_loss: 0.4558, test_loss: 1.6434, test_f1: 0.5746
 epoch: 63, train_loss: 0.4511, test_loss: 2.1306, test_f1: 0.5164
 epoch: 64, train_loss: 0.4803, test_loss: 1.3267, test_f1: 0.6244
 epoch: 65, train_loss: 0.4786, test_loss: 1.5440, test_f1: 0.5796
 epoch: 66, train_loss: 0.4659, test_loss: 1.4608, test_f1: 0.6097
 epoch: 67, train_loss: 0.4292, test_loss: 1.3232, test_f1: 0.6288
 epoch: 68, train_loss: 0.4148, test_loss: 1.6604, test_f1: 0.6331
 epoch: 69, train_loss: 0.4241, test_loss: 1.7900, test_f1: 0.5929
 epoch: 70, train_loss: 0.4275, test_loss: 1.5220, test_f1: 0.5879
 epoch: 71, train_loss: 0.4272, test_loss: 1.6998, test_f1: 0.6046
 epoch: 72, train_loss: 0.4226, test_loss: 1.7263, test_f1: 0.6091
 epoch: 73, train_loss: 0.4246, test_loss: 2.1296, test_f1: 0.5751
 epoch: 74, train_loss: 0.4747, test_loss: 1.5334, test_f1: 0.5757
 epoch: 75, train_loss: 0.4366, test_loss: 2.1009, test_f1: 0.5465
 epoch: 76, train_loss: 0.4161, test_loss: 1.8630, test_f1: 0.6348
 epoch: 77, train_loss: 0.3938, test_loss: 1.7828, test_f1: 0.6411
 epoch: 78, train_loss: 0.3626, test_loss: 1.9997, test_f1: 0.6494
 epoch: 79, train_loss: 0.4201, test_loss: 1.9893, test_f1: 0.5919
 epoch: 80, train_loss: 0.3888, test_loss: 1.7867, test_f1: 0.5876
 epoch: 81, train_loss: 0.3561, test_loss: 2.1370, test_f1: 0.5907
 epoch: 82, train_loss: 0.3751, test_loss: 1.9236, test_f1: 0.6037
 epoch: 83, train_loss: 0.3669, test_loss: 2.0374, test_f1: 0.5881
 epoch: 84, train_loss: 0.3716, test_loss: 1.8742, test_f1: 0.6085
 epoch: 85, train_loss: 0.4056, test_loss: 1.8949, test_f1: 0.6121
 epoch: 86, train_loss: 0.3953, test_loss: 2.1196, test_f1: 0.6250
 epoch: 87, train_loss: 0.3794, test_loss: 1.9726, test_f1: 0.5910
 epoch: 88, train_loss: 0.3702, test_loss: 1.6691, test_f1: 0.6187
 epoch: 89, train_loss: 0.3453, test_loss: 1.9085, test_f1: 0.6032
 epoch: 90, train_loss: 0.4094, test_loss: 2.4811, test_f1: 0.5640
 epoch: 91, train_loss: 0.3957, test_loss: 1.9955, test_f1: 0.5876
 epoch: 92, train_loss: 0.3521, test_loss: 1.9572, test_f1: 0.6532
 epoch: 93, train_loss: 0.3398, test_loss: 1.9906, test_f1: 0.6208
 epoch: 94, train_loss: 0.3263, test_loss: 1.9984, test_f1: 0.6148
 epoch: 95, train_loss: 0.3163, test_loss: 2.2553, test_f1: 0.5967
 epoch: 96, train_loss: 0.3006, test_loss: 1.9620, test_f1: 0.5988
 epoch: 97, train_loss: 0.3153, test_loss: 2.8324, test_f1: 0.6024
 epoch: 98, train_loss: 0.3058, test_loss: 1.9545, test_f1: 0.6043
 epoch: 99, train_loss: 0.3183, test_loss: 2.3530, test_f1: 0.6088
##################ITERATION #9 ****************************************
 epoch: 0, train_loss: 1.4266, test_loss: 1.7031, test_f1: 0.2436
 epoch: 1, train_loss: 0.9942, test_loss: 1.4622, test_f1: 0.3471
 epoch: 2, train_loss: 0.9654, test_loss: 1.1090, test_f1: 0.4766
 epoch: 3, train_loss: 0.9252, test_loss: 0.9921, test_f1: 0.5550
 epoch: 4, train_loss: 0.8933, test_loss: 1.0293, test_f1: 0.5293
 epoch: 5, train_loss: 0.8699, test_loss: 1.0387, test_f1: 0.5213
 epoch: 6, train_loss: 0.8199, test_loss: 1.0896, test_f1: 0.4998
 epoch: 7, train_loss: 0.8154, test_loss: 1.0532, test_f1: 0.4153
 epoch: 8, train_loss: 0.8211, test_loss: 1.1406, test_f1: 0.5164
 epoch: 9, train_loss: 0.8008, test_loss: 1.3981, test_f1: 0.4315
 epoch: 10, train_loss: 0.8214, test_loss: 1.3651, test_f1: 0.4075
 epoch: 11, train_loss: 0.7934, test_loss: 1.7378, test_f1: 0.3214
 epoch: 12, train_loss: 0.7666, test_loss: 1.0156, test_f1: 0.5512
 epoch: 13, train_loss: 0.7391, test_loss: 1.2242, test_f1: 0.4370
 epoch: 14, train_loss: 0.7156, test_loss: 1.4302, test_f1: 0.4879
 epoch: 15, train_loss: 0.7505, test_loss: 1.2663, test_f1: 0.5316
 epoch: 16, train_loss: 0.7529, test_loss: 1.6209, test_f1: 0.4896
 epoch: 17, train_loss: 0.7156, test_loss: 1.4924, test_f1: 0.4513
 epoch: 18, train_loss: 0.7171, test_loss: 2.0536, test_f1: 0.3584
 epoch: 19, train_loss: 0.6912, test_loss: 1.3069, test_f1: 0.5366
 epoch: 20, train_loss: 0.6912, test_loss: 1.1031, test_f1: 0.5668
 epoch: 21, train_loss: 0.6879, test_loss: 1.2060, test_f1: 0.5311
 epoch: 22, train_loss: 0.6966, test_loss: 1.3330, test_f1: 0.4599
 epoch: 23, train_loss: 0.7081, test_loss: 1.1805, test_f1: 0.5308
 epoch: 24, train_loss: 0.6763, test_loss: 1.5891, test_f1: 0.5313
 epoch: 25, train_loss: 0.7050, test_loss: 2.8062, test_f1: 0.3816
 epoch: 26, train_loss: 0.7020, test_loss: 1.4378, test_f1: 0.4967
 epoch: 27, train_loss: 0.6775, test_loss: 1.2423, test_f1: 0.5558
 epoch: 28, train_loss: 0.6457, test_loss: 1.2958, test_f1: 0.5626
 epoch: 29, train_loss: 0.6575, test_loss: 1.2879, test_f1: 0.5195
 epoch: 30, train_loss: 0.6396, test_loss: 1.1803, test_f1: 0.5535
 epoch: 31, train_loss: 0.6028, test_loss: 1.5936, test_f1: 0.5885
 epoch: 32, train_loss: 0.6067, test_loss: 1.2005, test_f1: 0.5592
 epoch: 33, train_loss: 0.5816, test_loss: 1.1048, test_f1: 0.6132
 epoch: 34, train_loss: 0.6058, test_loss: 1.3669, test_f1: 0.5712
 epoch: 35, train_loss: 0.6286, test_loss: 1.6096, test_f1: 0.4984
 epoch: 36, train_loss: 0.5905, test_loss: 1.5677, test_f1: 0.5867
 epoch: 37, train_loss: 0.6485, test_loss: 0.9999, test_f1: 0.5688
 epoch: 38, train_loss: 0.5902, test_loss: 1.1155, test_f1: 0.5594
 epoch: 39, train_loss: 0.5970, test_loss: 1.0875, test_f1: 0.6361
 epoch: 40, train_loss: 0.5518, test_loss: 1.9637, test_f1: 0.5390
 epoch: 41, train_loss: 0.5328, test_loss: 1.4927, test_f1: 0.5772
 epoch: 42, train_loss: 0.5291, test_loss: 1.1484, test_f1: 0.5947
 epoch: 43, train_loss: 0.5663, test_loss: 1.3507, test_f1: 0.5564
 epoch: 44, train_loss: 0.5722, test_loss: 1.9720, test_f1: 0.5046
 epoch: 45, train_loss: 0.5443, test_loss: 1.2183, test_f1: 0.5969
 epoch: 46, train_loss: 0.5597, test_loss: 1.4025, test_f1: 0.5599
 epoch: 47, train_loss: 0.5829, test_loss: 1.6159, test_f1: 0.5251
 epoch: 48, train_loss: 0.5828, test_loss: 2.0165, test_f1: 0.4724
 epoch: 49, train_loss: 0.6012, test_loss: 1.0506, test_f1: 0.5870
 epoch: 50, train_loss: 0.5321, test_loss: 1.1707, test_f1: 0.6167
 epoch: 51, train_loss: 0.5208, test_loss: 1.1542, test_f1: 0.6240
 epoch: 52, train_loss: 0.4902, test_loss: 1.4131, test_f1: 0.6128
 epoch: 53, train_loss: 0.4553, test_loss: 1.3826, test_f1: 0.6432
 epoch: 54, train_loss: 0.4488, test_loss: 1.2718, test_f1: 0.6133
 epoch: 55, train_loss: 0.4377, test_loss: 1.6037, test_f1: 0.6154
 epoch: 56, train_loss: 0.4523, test_loss: 1.4093, test_f1: 0.6037
 epoch: 57, train_loss: 0.4237, test_loss: 1.3957, test_f1: 0.5987
 epoch: 58, train_loss: 0.4095, test_loss: 1.5054, test_f1: 0.6006
 epoch: 59, train_loss: 0.4298, test_loss: 1.2591, test_f1: 0.6075
 epoch: 60, train_loss: 0.3954, test_loss: 1.3658, test_f1: 0.6051
 epoch: 61, train_loss: 0.4078, test_loss: 1.2849, test_f1: 0.6343
 epoch: 62, train_loss: 0.4355, test_loss: 1.9488, test_f1: 0.5957
 epoch: 63, train_loss: 0.3741, test_loss: 1.7355, test_f1: 0.6335
 epoch: 64, train_loss: 0.3792, test_loss: 1.6476, test_f1: 0.6717
 epoch: 65, train_loss: 0.3683, test_loss: 1.5780, test_f1: 0.6048
 epoch: 66, train_loss: 0.3562, test_loss: 1.5782, test_f1: 0.6545
 epoch: 67, train_loss: 0.4208, test_loss: 1.4828, test_f1: 0.6037
 epoch: 68, train_loss: 0.4175, test_loss: 1.7328, test_f1: 0.5911
 epoch: 69, train_loss: 0.3722, test_loss: 1.8051, test_f1: 0.6232
 epoch: 70, train_loss: 0.3862, test_loss: 1.4428, test_f1: 0.6040
 epoch: 71, train_loss: 0.3725, test_loss: 1.4803, test_f1: 0.6167
 epoch: 72, train_loss: 0.3799, test_loss: 1.6124, test_f1: 0.6158
 epoch: 73, train_loss: 0.3442, test_loss: 1.5961, test_f1: 0.6175
 epoch: 74, train_loss: 0.3740, test_loss: 1.8442, test_f1: 0.5981
 epoch: 75, train_loss: 0.3580, test_loss: 1.6481, test_f1: 0.6687
 epoch: 76, train_loss: 0.3662, test_loss: 1.6661, test_f1: 0.6066
 epoch: 77, train_loss: 0.3536, test_loss: 1.7684, test_f1: 0.6340
 epoch: 78, train_loss: 0.3220, test_loss: 2.0871, test_f1: 0.6110
 epoch: 79, train_loss: 0.3188, test_loss: 1.7129, test_f1: 0.6193
 epoch: 80, train_loss: 0.3056, test_loss: 2.1225, test_f1: 0.6034
 epoch: 81, train_loss: 0.3291, test_loss: 2.2630, test_f1: 0.5935
 epoch: 82, train_loss: 0.3746, test_loss: 1.7503, test_f1: 0.5925
 epoch: 83, train_loss: 0.3207, test_loss: 1.8991, test_f1: 0.6040
 epoch: 84, train_loss: 0.3177, test_loss: 1.8225, test_f1: 0.6395
 epoch: 85, train_loss: 0.3209, test_loss: 1.9210, test_f1: 0.6033
 epoch: 86, train_loss: 0.3100, test_loss: 1.9102, test_f1: 0.5738
 epoch: 87, train_loss: 0.3440, test_loss: 1.9222, test_f1: 0.6339
 epoch: 88, train_loss: 0.3122, test_loss: 2.0085, test_f1: 0.6376
 epoch: 89, train_loss: 0.3074, test_loss: 2.3259, test_f1: 0.6004
 epoch: 90, train_loss: 0.2845, test_loss: 2.5973, test_f1: 0.5502
 epoch: 91, train_loss: 0.3356, test_loss: 1.8491, test_f1: 0.6032
 epoch: 92, train_loss: 0.3265, test_loss: 1.6415, test_f1: 0.6164
 epoch: 93, train_loss: 0.3196, test_loss: 1.6580, test_f1: 0.6371
 epoch: 94, train_loss: 0.2855, test_loss: 1.7510, test_f1: 0.6426
 epoch: 95, train_loss: 0.2807, test_loss: 2.0889, test_f1: 0.6075
 epoch: 96, train_loss: 0.2787, test_loss: 1.8391, test_f1: 0.6213
 epoch: 97, train_loss: 0.2755, test_loss: 1.8798, test_f1: 0.6030
 epoch: 98, train_loss: 0.2808, test_loss: 1.7081, test_f1: 0.6103
 epoch: 99, train_loss: 0.2630, test_loss: 2.0728, test_f1: 0.6079

Training completed in 404.13 seconds
Best F1: 0.6834 at epoch 92
Mean F1 across iterations: 0.6575  0.0168
========================FINAL RESULTS================================
FEGIN weighted F1: 0.6834  0.0168
python main.py --data ltspice_demos --representation component_pin_net --model FEGIN --layers 6 --hiddens 128 --batch_size 128 --lr 0.01 --emb_size 250 --epochs 100 --save_appendix component_pin_net_L6_H128_BS128_LR0.01_E250 --no_val
-----



STDERR:
  File "main.py", line 370, in <module>
    main()
  File "main.py", line 254, in main
    dataset = dataset_class(
  File "/home/philip/projects/ltspice_examples_code_repo/Circuit-Completion-Using-GNNs/component_classification_with_link_prediction_head/evaluation/FEGIN/kernel/circuit_datasets.py", line 15, in __init__
    self.data, self.slices = torch.load(self.processed_paths[0])
  File "/home/philip/.local/lib/python3.8/site-packages/torch/serialization.py", line 1040, in load
    warnings.warn(
  File "/usr/lib/python3.8/warnings.py", line 109, in _showwarnmsg
    sw(msg.message, msg.category, msg.filename, msg.lineno,
  File "main.py", line 47, in warn_with_traceback
    traceback.print_stack(file=log)
/home/philip/projects/ltspice_examples_code_repo/Circuit-Completion-Using-GNNs/component_classification_with_link_prediction_head/evaluation/FEGIN/kernel/circuit_datasets.py:15: FutureWarning: You are using `torch.load` with `weights_only=False` (the current default value), which uses the default pickle module implicitly. It is possible to construct malicious pickle data which will execute arbitrary code during unpickling (See https://github.com/pytorch/pytorch/blob/main/SECURITY.md#untrusted-models for more details). In a future release, the default value for `weights_only` will be flipped to `True`. This limits the functions that could be executed during unpickling. Arbitrary objects will no longer be allowed to be loaded via this mode unless they are explicitly allowlisted by the user via `torch.serialization.add_safe_globals`. We recommend you start setting `weights_only=True` for any use case where you don't have full control of the loaded file. Please open an issue on GitHub for any issues related to this experimental feature.
  self.data, self.slices = torch.load(self.processed_paths[0])
