STDOUT:
Results will be saved in /home/philip/projects/ltspice_examples_code_repo/Circuit-Completion-Using-GNNs/component_classification_with_link_prediction_head/evaluation/FEGIN/results/model_FEGIN_dataset_ltspice_examples
Command line input: python main.py --data ltspice_examples --representation component_component --model FEGIN --layers 3 --hiddens 16 --batch_size 256 --lr 0.001 --emb_size 128 --epochs 100 --save_appendix component_component_L3_H16_BS256_LR0.001_E128 --no_val
 is saved.
-----
ltspice_examples - FEGIN
Using 3 layers, 16 hidden units, h = 2
Loading component_component representation dataset
ENTERED
Training FEGIN on component_component representation
Train: 3556, Test: 845
##################ITERATION #0 ****************************************
 epoch: 0, train_loss: 1.3529, test_loss: 1.3466, test_f1: 0.2274
 epoch: 1, train_loss: 1.3288, test_loss: 1.3299, test_f1: 0.2274
 epoch: 2, train_loss: 1.3120, test_loss: 1.3086, test_f1: 0.2274
 epoch: 3, train_loss: 1.2965, test_loss: 1.2915, test_f1: 0.2274
 epoch: 4, train_loss: 1.2839, test_loss: 1.2821, test_f1: 0.2274
 epoch: 5, train_loss: 1.2761, test_loss: 1.2745, test_f1: 0.2274
 epoch: 6, train_loss: 1.2615, test_loss: 1.2632, test_f1: 0.2274
 epoch: 7, train_loss: 1.2527, test_loss: 1.2493, test_f1: 0.3044
 epoch: 8, train_loss: 1.2460, test_loss: 1.2372, test_f1: 0.3437
 epoch: 9, train_loss: 1.2363, test_loss: 1.2267, test_f1: 0.3448
 epoch: 10, train_loss: 1.2344, test_loss: 1.2198, test_f1: 0.3376
 epoch: 11, train_loss: 1.2210, test_loss: 1.2137, test_f1: 0.3347
 epoch: 12, train_loss: 1.2129, test_loss: 1.2034, test_f1: 0.3411
 epoch: 13, train_loss: 1.2023, test_loss: 1.1976, test_f1: 0.3381
 epoch: 14, train_loss: 1.1975, test_loss: 1.1940, test_f1: 0.3393
 epoch: 15, train_loss: 1.1926, test_loss: 1.1857, test_f1: 0.3581
 epoch: 16, train_loss: 1.1926, test_loss: 1.1793, test_f1: 0.3491
 epoch: 17, train_loss: 1.1794, test_loss: 1.1730, test_f1: 0.3508
 epoch: 18, train_loss: 1.1697, test_loss: 1.1698, test_f1: 0.3527
 epoch: 19, train_loss: 1.1693, test_loss: 1.1733, test_f1: 0.3505
 epoch: 20, train_loss: 1.1642, test_loss: 1.1669, test_f1: 0.3497
 epoch: 21, train_loss: 1.1576, test_loss: 1.1568, test_f1: 0.3528
 epoch: 22, train_loss: 1.1467, test_loss: 1.1493, test_f1: 0.3541
 epoch: 23, train_loss: 1.1444, test_loss: 1.1526, test_f1: 0.3485
 epoch: 24, train_loss: 1.1433, test_loss: 1.1418, test_f1: 0.3562
 epoch: 25, train_loss: 1.1289, test_loss: 1.1391, test_f1: 0.4154
 epoch: 26, train_loss: 1.1206, test_loss: 1.1355, test_f1: 0.4306
 epoch: 27, train_loss: 1.1162, test_loss: 1.1286, test_f1: 0.4326
 epoch: 28, train_loss: 1.1153, test_loss: 1.1265, test_f1: 0.4329
 epoch: 29, train_loss: 1.1056, test_loss: 1.1197, test_f1: 0.4344
 epoch: 30, train_loss: 1.1001, test_loss: 1.1132, test_f1: 0.4498
 epoch: 31, train_loss: 1.0943, test_loss: 1.1158, test_f1: 0.4477
 epoch: 32, train_loss: 1.0836, test_loss: 1.0995, test_f1: 0.4473
 epoch: 33, train_loss: 1.0680, test_loss: 1.1024, test_f1: 0.4399
 epoch: 34, train_loss: 1.0776, test_loss: 1.0937, test_f1: 0.4356
 epoch: 35, train_loss: 1.0788, test_loss: 1.0988, test_f1: 0.4414
 epoch: 36, train_loss: 1.0691, test_loss: 1.0881, test_f1: 0.4401
 epoch: 37, train_loss: 1.0618, test_loss: 1.0759, test_f1: 0.4432
 epoch: 38, train_loss: 1.0534, test_loss: 1.0660, test_f1: 0.4327
 epoch: 39, train_loss: 1.0470, test_loss: 1.0654, test_f1: 0.4374
 epoch: 40, train_loss: 1.0311, test_loss: 1.0608, test_f1: 0.4423
 epoch: 41, train_loss: 1.0317, test_loss: 1.0516, test_f1: 0.4482
 epoch: 42, train_loss: 1.0380, test_loss: 1.0591, test_f1: 0.4654
 epoch: 43, train_loss: 1.0263, test_loss: 1.0462, test_f1: 0.4630
 epoch: 44, train_loss: 1.0157, test_loss: 1.0505, test_f1: 0.4567
 epoch: 45, train_loss: 1.0133, test_loss: 1.0436, test_f1: 0.4404
 epoch: 46, train_loss: 1.0169, test_loss: 1.0547, test_f1: 0.4717
 epoch: 47, train_loss: 1.0038, test_loss: 1.0260, test_f1: 0.4766
 epoch: 48, train_loss: 1.0086, test_loss: 1.0518, test_f1: 0.4480
 epoch: 49, train_loss: 0.9998, test_loss: 1.0197, test_f1: 0.4858
 epoch: 50, train_loss: 0.9904, test_loss: 1.0260, test_f1: 0.4607
 epoch: 51, train_loss: 0.9856, test_loss: 1.0216, test_f1: 0.4534
 epoch: 52, train_loss: 0.9827, test_loss: 1.0101, test_f1: 0.4997
 epoch: 53, train_loss: 0.9804, test_loss: 1.0197, test_f1: 0.4792
 epoch: 54, train_loss: 0.9663, test_loss: 1.0149, test_f1: 0.4893
 epoch: 55, train_loss: 0.9729, test_loss: 1.0089, test_f1: 0.4752
 epoch: 56, train_loss: 0.9734, test_loss: 1.0105, test_f1: 0.4786
 epoch: 57, train_loss: 0.9769, test_loss: 1.0053, test_f1: 0.4904
 epoch: 58, train_loss: 0.9669, test_loss: 1.0028, test_f1: 0.5041
 epoch: 59, train_loss: 0.9632, test_loss: 1.0125, test_f1: 0.4956
 epoch: 60, train_loss: 0.9702, test_loss: 1.0177, test_f1: 0.4894
 epoch: 61, train_loss: 0.9548, test_loss: 1.0020, test_f1: 0.5020
 epoch: 62, train_loss: 0.9636, test_loss: 0.9952, test_f1: 0.5036
 epoch: 63, train_loss: 0.9528, test_loss: 1.0057, test_f1: 0.4978
 epoch: 64, train_loss: 0.9544, test_loss: 0.9997, test_f1: 0.5061
 epoch: 65, train_loss: 0.9543, test_loss: 0.9961, test_f1: 0.5014
 epoch: 66, train_loss: 0.9533, test_loss: 0.9934, test_f1: 0.5090
 epoch: 67, train_loss: 0.9499, test_loss: 0.9893, test_f1: 0.5121
 epoch: 68, train_loss: 0.9523, test_loss: 0.9981, test_f1: 0.5085
 epoch: 69, train_loss: 0.9532, test_loss: 0.9959, test_f1: 0.5071
 epoch: 70, train_loss: 0.9518, test_loss: 0.9926, test_f1: 0.5094
 epoch: 71, train_loss: 0.9427, test_loss: 0.9969, test_f1: 0.5071
 epoch: 72, train_loss: 0.9404, test_loss: 0.9968, test_f1: 0.5023
 epoch: 73, train_loss: 0.9456, test_loss: 1.0159, test_f1: 0.5076
 epoch: 74, train_loss: 0.9429, test_loss: 0.9998, test_f1: 0.5189
 epoch: 75, train_loss: 0.9359, test_loss: 1.0070, test_f1: 0.5061
 epoch: 76, train_loss: 0.9442, test_loss: 0.9861, test_f1: 0.5245
 epoch: 77, train_loss: 0.9428, test_loss: 0.9870, test_f1: 0.5107
 epoch: 78, train_loss: 0.9387, test_loss: 0.9801, test_f1: 0.5175
 epoch: 79, train_loss: 0.9259, test_loss: 0.9845, test_f1: 0.5154
 epoch: 80, train_loss: 0.9240, test_loss: 0.9961, test_f1: 0.5126
 epoch: 81, train_loss: 0.9319, test_loss: 0.9967, test_f1: 0.5052
 epoch: 82, train_loss: 0.9299, test_loss: 0.9888, test_f1: 0.5229
 epoch: 83, train_loss: 0.9289, test_loss: 0.9816, test_f1: 0.5138
 epoch: 84, train_loss: 0.9309, test_loss: 0.9818, test_f1: 0.5160
 epoch: 85, train_loss: 0.9229, test_loss: 0.9916, test_f1: 0.5186
 epoch: 86, train_loss: 0.9201, test_loss: 0.9821, test_f1: 0.5176
 epoch: 87, train_loss: 0.9154, test_loss: 0.9826, test_f1: 0.5175
 epoch: 88, train_loss: 0.9241, test_loss: 0.9799, test_f1: 0.5095
 epoch: 89, train_loss: 0.9137, test_loss: 0.9831, test_f1: 0.5106
 epoch: 90, train_loss: 0.9155, test_loss: 0.9818, test_f1: 0.5208
 epoch: 91, train_loss: 0.9141, test_loss: 0.9755, test_f1: 0.5255
 epoch: 92, train_loss: 0.9132, test_loss: 0.9902, test_f1: 0.5087
 epoch: 93, train_loss: 0.9088, test_loss: 0.9814, test_f1: 0.5248
 epoch: 94, train_loss: 0.9043, test_loss: 0.9843, test_f1: 0.5162
 epoch: 95, train_loss: 0.9079, test_loss: 0.9883, test_f1: 0.5126
 epoch: 96, train_loss: 0.9123, test_loss: 0.9854, test_f1: 0.5153
 epoch: 97, train_loss: 0.9058, test_loss: 0.9932, test_f1: 0.5140
 epoch: 98, train_loss: 0.9102, test_loss: 1.0030, test_f1: 0.5066
 epoch: 99, train_loss: 0.8964, test_loss: 0.9977, test_f1: 0.5206
##################ITERATION #1 ****************************************
 epoch: 0, train_loss: 1.3774, test_loss: 1.3768, test_f1: 0.2274
 epoch: 1, train_loss: 1.3278, test_loss: 1.3474, test_f1: 0.2274
 epoch: 2, train_loss: 1.3015, test_loss: 1.3057, test_f1: 0.2555
 epoch: 3, train_loss: 1.2844, test_loss: 1.2771, test_f1: 0.2555
 epoch: 4, train_loss: 1.2665, test_loss: 1.2618, test_f1: 0.2549
 epoch: 5, train_loss: 1.2557, test_loss: 1.2427, test_f1: 0.2599
 epoch: 6, train_loss: 1.2369, test_loss: 1.2222, test_f1: 0.3028
 epoch: 7, train_loss: 1.2318, test_loss: 1.2095, test_f1: 0.3183
 epoch: 8, train_loss: 1.2204, test_loss: 1.2017, test_f1: 0.3226
 epoch: 9, train_loss: 1.2117, test_loss: 1.1892, test_f1: 0.3386
 epoch: 10, train_loss: 1.2007, test_loss: 1.1814, test_f1: 0.3558
 epoch: 11, train_loss: 1.1916, test_loss: 1.1683, test_f1: 0.4047
 epoch: 12, train_loss: 1.1876, test_loss: 1.1644, test_f1: 0.3694
 epoch: 13, train_loss: 1.1810, test_loss: 1.1561, test_f1: 0.4086
 epoch: 14, train_loss: 1.1731, test_loss: 1.1559, test_f1: 0.3985
 epoch: 15, train_loss: 1.1743, test_loss: 1.1557, test_f1: 0.4098
 epoch: 16, train_loss: 1.1617, test_loss: 1.1479, test_f1: 0.4090
 epoch: 17, train_loss: 1.1553, test_loss: 1.1360, test_f1: 0.4175
 epoch: 18, train_loss: 1.1536, test_loss: 1.1380, test_f1: 0.4136
 epoch: 19, train_loss: 1.1436, test_loss: 1.1329, test_f1: 0.4151
 epoch: 20, train_loss: 1.1397, test_loss: 1.1306, test_f1: 0.4181
 epoch: 21, train_loss: 1.1284, test_loss: 1.1213, test_f1: 0.4225
 epoch: 22, train_loss: 1.1287, test_loss: 1.1153, test_f1: 0.4304
 epoch: 23, train_loss: 1.1261, test_loss: 1.1128, test_f1: 0.4173
 epoch: 24, train_loss: 1.1222, test_loss: 1.1057, test_f1: 0.4335
 epoch: 25, train_loss: 1.1175, test_loss: 1.1020, test_f1: 0.4407
 epoch: 26, train_loss: 1.1073, test_loss: 1.1031, test_f1: 0.4342
 epoch: 27, train_loss: 1.1060, test_loss: 1.0974, test_f1: 0.4381
 epoch: 28, train_loss: 1.1070, test_loss: 1.1006, test_f1: 0.4566
 epoch: 29, train_loss: 1.0996, test_loss: 1.0964, test_f1: 0.4527
 epoch: 30, train_loss: 1.0875, test_loss: 1.1100, test_f1: 0.4359
 epoch: 31, train_loss: 1.0902, test_loss: 1.0803, test_f1: 0.4642
 epoch: 32, train_loss: 1.0876, test_loss: 1.0816, test_f1: 0.4540
 epoch: 33, train_loss: 1.0814, test_loss: 1.0729, test_f1: 0.4578
 epoch: 34, train_loss: 1.0676, test_loss: 1.0738, test_f1: 0.4536
 epoch: 35, train_loss: 1.0738, test_loss: 1.0871, test_f1: 0.4494
 epoch: 36, train_loss: 1.0646, test_loss: 1.0672, test_f1: 0.4601
 epoch: 37, train_loss: 1.0711, test_loss: 1.0591, test_f1: 0.4564
 epoch: 38, train_loss: 1.0555, test_loss: 1.0600, test_f1: 0.4525
 epoch: 39, train_loss: 1.0594, test_loss: 1.0621, test_f1: 0.4627
 epoch: 40, train_loss: 1.0482, test_loss: 1.0494, test_f1: 0.4675
 epoch: 41, train_loss: 1.0414, test_loss: 1.0378, test_f1: 0.4663
 epoch: 42, train_loss: 1.0398, test_loss: 1.0726, test_f1: 0.4455
 epoch: 43, train_loss: 1.0334, test_loss: 1.0516, test_f1: 0.4506
 epoch: 44, train_loss: 1.0272, test_loss: 1.0571, test_f1: 0.4604
 epoch: 45, train_loss: 1.0387, test_loss: 1.0433, test_f1: 0.4585
 epoch: 46, train_loss: 1.0514, test_loss: 1.0461, test_f1: 0.4626
 epoch: 47, train_loss: 1.0290, test_loss: 1.0394, test_f1: 0.4653
 epoch: 48, train_loss: 1.0204, test_loss: 1.0523, test_f1: 0.4604
 epoch: 49, train_loss: 1.0186, test_loss: 1.0330, test_f1: 0.4653
 epoch: 50, train_loss: 1.0103, test_loss: 1.0120, test_f1: 0.4687
 epoch: 51, train_loss: 1.0104, test_loss: 1.0257, test_f1: 0.4608
 epoch: 52, train_loss: 1.0076, test_loss: 1.0020, test_f1: 0.4732
 epoch: 53, train_loss: 0.9975, test_loss: 1.0131, test_f1: 0.4731
 epoch: 54, train_loss: 0.9915, test_loss: 1.0169, test_f1: 0.4785
 epoch: 55, train_loss: 1.0023, test_loss: 1.0112, test_f1: 0.4731
 epoch: 56, train_loss: 1.0030, test_loss: 1.0124, test_f1: 0.4710
 epoch: 57, train_loss: 1.0073, test_loss: 1.0213, test_f1: 0.4600
 epoch: 58, train_loss: 0.9855, test_loss: 1.0093, test_f1: 0.4702
 epoch: 59, train_loss: 0.9870, test_loss: 1.0020, test_f1: 0.4686
 epoch: 60, train_loss: 0.9820, test_loss: 0.9967, test_f1: 0.4730
 epoch: 61, train_loss: 0.9839, test_loss: 1.0146, test_f1: 0.4685
 epoch: 62, train_loss: 0.9804, test_loss: 1.0072, test_f1: 0.4723
 epoch: 63, train_loss: 0.9688, test_loss: 0.9993, test_f1: 0.4755
 epoch: 64, train_loss: 0.9801, test_loss: 1.0009, test_f1: 0.4786
 epoch: 65, train_loss: 0.9732, test_loss: 0.9877, test_f1: 0.4888
 epoch: 66, train_loss: 0.9765, test_loss: 0.9944, test_f1: 0.4746
 epoch: 67, train_loss: 0.9816, test_loss: 0.9968, test_f1: 0.4760
 epoch: 68, train_loss: 0.9806, test_loss: 0.9960, test_f1: 0.4857
 epoch: 69, train_loss: 0.9749, test_loss: 0.9922, test_f1: 0.4806
 epoch: 70, train_loss: 0.9671, test_loss: 0.9857, test_f1: 0.4780
 epoch: 71, train_loss: 0.9587, test_loss: 0.9919, test_f1: 0.4643
 epoch: 72, train_loss: 0.9572, test_loss: 1.0022, test_f1: 0.4700
 epoch: 73, train_loss: 0.9635, test_loss: 0.9873, test_f1: 0.4822
 epoch: 74, train_loss: 0.9592, test_loss: 0.9908, test_f1: 0.4735
 epoch: 75, train_loss: 0.9541, test_loss: 0.9769, test_f1: 0.4817
 epoch: 76, train_loss: 0.9531, test_loss: 0.9815, test_f1: 0.4943
 epoch: 77, train_loss: 0.9598, test_loss: 0.9810, test_f1: 0.5027
 epoch: 78, train_loss: 0.9560, test_loss: 0.9813, test_f1: 0.4973
 epoch: 79, train_loss: 0.9601, test_loss: 0.9853, test_f1: 0.4839
 epoch: 80, train_loss: 0.9532, test_loss: 0.9852, test_f1: 0.4899
 epoch: 81, train_loss: 0.9483, test_loss: 0.9632, test_f1: 0.5043
 epoch: 82, train_loss: 0.9520, test_loss: 0.9938, test_f1: 0.4893
 epoch: 83, train_loss: 0.9575, test_loss: 0.9682, test_f1: 0.4898
 epoch: 84, train_loss: 0.9467, test_loss: 0.9851, test_f1: 0.4919
 epoch: 85, train_loss: 0.9438, test_loss: 0.9895, test_f1: 0.4884
 epoch: 86, train_loss: 0.9425, test_loss: 0.9788, test_f1: 0.5077
 epoch: 87, train_loss: 0.9494, test_loss: 0.9645, test_f1: 0.4911
 epoch: 88, train_loss: 0.9482, test_loss: 0.9778, test_f1: 0.4929
 epoch: 89, train_loss: 0.9384, test_loss: 0.9732, test_f1: 0.4924
 epoch: 90, train_loss: 0.9402, test_loss: 0.9649, test_f1: 0.5033
 epoch: 91, train_loss: 0.9402, test_loss: 0.9652, test_f1: 0.4951
 epoch: 92, train_loss: 0.9461, test_loss: 0.9677, test_f1: 0.4885
 epoch: 93, train_loss: 0.9365, test_loss: 0.9565, test_f1: 0.5027
 epoch: 94, train_loss: 0.9283, test_loss: 0.9626, test_f1: 0.5098
 epoch: 95, train_loss: 0.9323, test_loss: 0.9796, test_f1: 0.4951
 epoch: 96, train_loss: 0.9273, test_loss: 0.9639, test_f1: 0.4971
 epoch: 97, train_loss: 0.9469, test_loss: 0.9641, test_f1: 0.5155
 epoch: 98, train_loss: 0.9358, test_loss: 0.9567, test_f1: 0.4995
 epoch: 99, train_loss: 0.9304, test_loss: 0.9561, test_f1: 0.4957
##################ITERATION #2 ****************************************
 epoch: 0, train_loss: 1.3497, test_loss: 1.3368, test_f1: 0.2274
 epoch: 1, train_loss: 1.2970, test_loss: 1.3057, test_f1: 0.2274
 epoch: 2, train_loss: 1.2720, test_loss: 1.2764, test_f1: 0.2274
 epoch: 3, train_loss: 1.2598, test_loss: 1.2506, test_f1: 0.2274
 epoch: 4, train_loss: 1.2556, test_loss: 1.2358, test_f1: 0.2371
 epoch: 5, train_loss: 1.2402, test_loss: 1.2239, test_f1: 0.2557
 epoch: 6, train_loss: 1.2359, test_loss: 1.2169, test_f1: 0.2765
 epoch: 7, train_loss: 1.2255, test_loss: 1.2031, test_f1: 0.2856
 epoch: 8, train_loss: 1.2201, test_loss: 1.1916, test_f1: 0.2991
 epoch: 9, train_loss: 1.2101, test_loss: 1.1860, test_f1: 0.3012
 epoch: 10, train_loss: 1.2035, test_loss: 1.1693, test_f1: 0.3636
 epoch: 11, train_loss: 1.1990, test_loss: 1.1976, test_f1: 0.3594
 epoch: 12, train_loss: 1.1930, test_loss: 1.1579, test_f1: 0.3874
 epoch: 13, train_loss: 1.1896, test_loss: 1.1592, test_f1: 0.4305
 epoch: 14, train_loss: 1.1820, test_loss: 1.1427, test_f1: 0.4026
 epoch: 15, train_loss: 1.1704, test_loss: 1.1441, test_f1: 0.4127
 epoch: 16, train_loss: 1.1642, test_loss: 1.1302, test_f1: 0.4219
 epoch: 17, train_loss: 1.1533, test_loss: 1.1286, test_f1: 0.4508
 epoch: 18, train_loss: 1.1581, test_loss: 1.1264, test_f1: 0.4482
 epoch: 19, train_loss: 1.1514, test_loss: 1.1230, test_f1: 0.4300
 epoch: 20, train_loss: 1.1432, test_loss: 1.1131, test_f1: 0.4673
 epoch: 21, train_loss: 1.1425, test_loss: 1.1250, test_f1: 0.4196
 epoch: 22, train_loss: 1.1375, test_loss: 1.1052, test_f1: 0.4660
 epoch: 23, train_loss: 1.1333, test_loss: 1.1108, test_f1: 0.4297
 epoch: 24, train_loss: 1.1302, test_loss: 1.0990, test_f1: 0.4514
 epoch: 25, train_loss: 1.1262, test_loss: 1.1074, test_f1: 0.4455
 epoch: 26, train_loss: 1.1219, test_loss: 1.0894, test_f1: 0.4449
 epoch: 27, train_loss: 1.1070, test_loss: 1.0778, test_f1: 0.4806
 epoch: 28, train_loss: 1.1131, test_loss: 1.0983, test_f1: 0.4293
 epoch: 29, train_loss: 1.1050, test_loss: 1.0766, test_f1: 0.4555
 epoch: 30, train_loss: 1.0952, test_loss: 1.0639, test_f1: 0.4753
 epoch: 31, train_loss: 1.0961, test_loss: 1.0654, test_f1: 0.4744
 epoch: 32, train_loss: 1.0910, test_loss: 1.0649, test_f1: 0.4608
 epoch: 33, train_loss: 1.0894, test_loss: 1.0561, test_f1: 0.4730
 epoch: 34, train_loss: 1.0816, test_loss: 1.0538, test_f1: 0.4586
 epoch: 35, train_loss: 1.0760, test_loss: 1.0546, test_f1: 0.4408
 epoch: 36, train_loss: 1.0722, test_loss: 1.0366, test_f1: 0.4435
 epoch: 37, train_loss: 1.0732, test_loss: 1.0462, test_f1: 0.4490
 epoch: 38, train_loss: 1.0635, test_loss: 1.0232, test_f1: 0.4991
 epoch: 39, train_loss: 1.0697, test_loss: 1.0363, test_f1: 0.4823
 epoch: 40, train_loss: 1.0578, test_loss: 1.0307, test_f1: 0.4752
 epoch: 41, train_loss: 1.0512, test_loss: 1.0090, test_f1: 0.4754
 epoch: 42, train_loss: 1.0460, test_loss: 1.0211, test_f1: 0.4703
 epoch: 43, train_loss: 1.0394, test_loss: 1.0142, test_f1: 0.4640
 epoch: 44, train_loss: 1.0360, test_loss: 0.9918, test_f1: 0.5034
 epoch: 45, train_loss: 1.0309, test_loss: 1.0046, test_f1: 0.4693
 epoch: 46, train_loss: 1.0429, test_loss: 1.0005, test_f1: 0.4793
 epoch: 47, train_loss: 1.0369, test_loss: 1.0094, test_f1: 0.5014
 epoch: 48, train_loss: 1.0257, test_loss: 1.0003, test_f1: 0.4737
 epoch: 49, train_loss: 1.0211, test_loss: 0.9880, test_f1: 0.4885
 epoch: 50, train_loss: 1.0254, test_loss: 1.0106, test_f1: 0.4906
 epoch: 51, train_loss: 1.0273, test_loss: 0.9935, test_f1: 0.4843
 epoch: 52, train_loss: 1.0118, test_loss: 0.9865, test_f1: 0.4799
 epoch: 53, train_loss: 1.0040, test_loss: 0.9899, test_f1: 0.4821
 epoch: 54, train_loss: 1.0045, test_loss: 0.9960, test_f1: 0.4991
 epoch: 55, train_loss: 1.0059, test_loss: 0.9970, test_f1: 0.4807
 epoch: 56, train_loss: 1.0025, test_loss: 0.9816, test_f1: 0.4902
 epoch: 57, train_loss: 0.9950, test_loss: 0.9820, test_f1: 0.5133
 epoch: 58, train_loss: 1.0077, test_loss: 0.9941, test_f1: 0.5076
 epoch: 59, train_loss: 1.0126, test_loss: 0.9862, test_f1: 0.5032
 epoch: 60, train_loss: 1.0008, test_loss: 0.9974, test_f1: 0.4809
 epoch: 61, train_loss: 0.9916, test_loss: 0.9935, test_f1: 0.4906
 epoch: 62, train_loss: 0.9922, test_loss: 0.9778, test_f1: 0.4934
 epoch: 63, train_loss: 0.9881, test_loss: 0.9854, test_f1: 0.5139
 epoch: 64, train_loss: 0.9871, test_loss: 0.9896, test_f1: 0.4997
 epoch: 65, train_loss: 0.9949, test_loss: 0.9872, test_f1: 0.5075
 epoch: 66, train_loss: 0.9898, test_loss: 0.9995, test_f1: 0.4858
 epoch: 67, train_loss: 0.9985, test_loss: 1.0035, test_f1: 0.4739
 epoch: 68, train_loss: 0.9895, test_loss: 0.9950, test_f1: 0.4892
 epoch: 69, train_loss: 0.9789, test_loss: 0.9843, test_f1: 0.4913
 epoch: 70, train_loss: 0.9805, test_loss: 0.9936, test_f1: 0.4874
 epoch: 71, train_loss: 0.9833, test_loss: 0.9983, test_f1: 0.5123
 epoch: 72, train_loss: 0.9746, test_loss: 0.9967, test_f1: 0.4879
 epoch: 73, train_loss: 0.9752, test_loss: 1.0021, test_f1: 0.5118
 epoch: 74, train_loss: 0.9741, test_loss: 0.9940, test_f1: 0.4894
 epoch: 75, train_loss: 0.9717, test_loss: 0.9999, test_f1: 0.5216
 epoch: 76, train_loss: 0.9754, test_loss: 0.9992, test_f1: 0.4865
 epoch: 77, train_loss: 0.9703, test_loss: 1.0004, test_f1: 0.4993
 epoch: 78, train_loss: 0.9717, test_loss: 0.9866, test_f1: 0.4861
 epoch: 79, train_loss: 0.9769, test_loss: 1.0105, test_f1: 0.5113
 epoch: 80, train_loss: 0.9623, test_loss: 0.9931, test_f1: 0.4861
 epoch: 81, train_loss: 0.9661, test_loss: 1.0012, test_f1: 0.4961
 epoch: 82, train_loss: 0.9600, test_loss: 1.0093, test_f1: 0.4874
 epoch: 83, train_loss: 0.9650, test_loss: 1.0102, test_f1: 0.4834
 epoch: 84, train_loss: 0.9620, test_loss: 0.9960, test_f1: 0.4828
 epoch: 85, train_loss: 0.9586, test_loss: 1.0040, test_f1: 0.4907
 epoch: 86, train_loss: 0.9592, test_loss: 0.9987, test_f1: 0.4856
 epoch: 87, train_loss: 0.9696, test_loss: 1.0110, test_f1: 0.5095
 epoch: 88, train_loss: 0.9608, test_loss: 1.0102, test_f1: 0.4741
 epoch: 89, train_loss: 0.9460, test_loss: 0.9975, test_f1: 0.4792
 epoch: 90, train_loss: 0.9585, test_loss: 1.0017, test_f1: 0.4733
 epoch: 91, train_loss: 0.9565, test_loss: 1.0113, test_f1: 0.4874
 epoch: 92, train_loss: 0.9560, test_loss: 0.9964, test_f1: 0.4838
 epoch: 93, train_loss: 0.9466, test_loss: 1.0324, test_f1: 0.4747
 epoch: 94, train_loss: 0.9488, test_loss: 1.0026, test_f1: 0.4797
 epoch: 95, train_loss: 0.9576, test_loss: 1.0073, test_f1: 0.4971
 epoch: 96, train_loss: 0.9447, test_loss: 1.0133, test_f1: 0.4822
 epoch: 97, train_loss: 0.9599, test_loss: 1.0059, test_f1: 0.4849
 epoch: 98, train_loss: 0.9515, test_loss: 0.9937, test_f1: 0.4950
 epoch: 99, train_loss: 0.9434, test_loss: 0.9983, test_f1: 0.4858
##################ITERATION #3 ****************************************
 epoch: 0, train_loss: 1.4789, test_loss: 1.4713, test_f1: 0.0959
 epoch: 1, train_loss: 1.3285, test_loss: 1.3584, test_f1: 0.2304
 epoch: 2, train_loss: 1.3064, test_loss: 1.3139, test_f1: 0.2274
 epoch: 3, train_loss: 1.2811, test_loss: 1.2790, test_f1: 0.2274
 epoch: 4, train_loss: 1.2709, test_loss: 1.2520, test_f1: 0.2324
 epoch: 5, train_loss: 1.2653, test_loss: 1.2357, test_f1: 0.2490
 epoch: 6, train_loss: 1.2434, test_loss: 1.2302, test_f1: 0.2657
 epoch: 7, train_loss: 1.2439, test_loss: 1.2145, test_f1: 0.3009
 epoch: 8, train_loss: 1.2290, test_loss: 1.2122, test_f1: 0.2996
 epoch: 9, train_loss: 1.2224, test_loss: 1.1936, test_f1: 0.3332
 epoch: 10, train_loss: 1.2137, test_loss: 1.1848, test_f1: 0.3399
 epoch: 11, train_loss: 1.2053, test_loss: 1.1747, test_f1: 0.3193
 epoch: 12, train_loss: 1.1965, test_loss: 1.1706, test_f1: 0.3371
 epoch: 13, train_loss: 1.1948, test_loss: 1.1595, test_f1: 0.3628
 epoch: 14, train_loss: 1.1789, test_loss: 1.1473, test_f1: 0.3753
 epoch: 15, train_loss: 1.1717, test_loss: 1.1370, test_f1: 0.3765
 epoch: 16, train_loss: 1.1670, test_loss: 1.1350, test_f1: 0.4050
 epoch: 17, train_loss: 1.1534, test_loss: 1.1241, test_f1: 0.4045
 epoch: 18, train_loss: 1.1432, test_loss: 1.1134, test_f1: 0.4081
 epoch: 19, train_loss: 1.1502, test_loss: 1.1080, test_f1: 0.4231
 epoch: 20, train_loss: 1.1377, test_loss: 1.1047, test_f1: 0.4194
 epoch: 21, train_loss: 1.1274, test_loss: 1.0894, test_f1: 0.4212
 epoch: 22, train_loss: 1.1286, test_loss: 1.0891, test_f1: 0.4258
 epoch: 23, train_loss: 1.1148, test_loss: 1.0822, test_f1: 0.4186
 epoch: 24, train_loss: 1.1085, test_loss: 1.0689, test_f1: 0.4337
 epoch: 25, train_loss: 1.1069, test_loss: 1.0716, test_f1: 0.4211
 epoch: 26, train_loss: 1.1006, test_loss: 1.0664, test_f1: 0.4196
 epoch: 27, train_loss: 1.1002, test_loss: 1.0583, test_f1: 0.4126
 epoch: 28, train_loss: 1.0816, test_loss: 1.0547, test_f1: 0.4274
 epoch: 29, train_loss: 1.0829, test_loss: 1.0444, test_f1: 0.4115
 epoch: 30, train_loss: 1.0717, test_loss: 1.0371, test_f1: 0.4317
 epoch: 31, train_loss: 1.0764, test_loss: 1.0316, test_f1: 0.4368
 epoch: 32, train_loss: 1.0729, test_loss: 1.0291, test_f1: 0.4327
 epoch: 33, train_loss: 1.0666, test_loss: 1.0289, test_f1: 0.4225
 epoch: 34, train_loss: 1.0581, test_loss: 1.0170, test_f1: 0.4287
 epoch: 35, train_loss: 1.0546, test_loss: 1.0102, test_f1: 0.4425
 epoch: 36, train_loss: 1.0471, test_loss: 1.0100, test_f1: 0.4345
 epoch: 37, train_loss: 1.0435, test_loss: 1.0181, test_f1: 0.4157
 epoch: 38, train_loss: 1.0413, test_loss: 1.0061, test_f1: 0.4393
 epoch: 39, train_loss: 1.0388, test_loss: 1.0092, test_f1: 0.4393
 epoch: 40, train_loss: 1.0337, test_loss: 1.0029, test_f1: 0.4442
 epoch: 41, train_loss: 1.0250, test_loss: 1.0013, test_f1: 0.4313
 epoch: 42, train_loss: 1.0231, test_loss: 1.0054, test_f1: 0.4294
 epoch: 43, train_loss: 1.0172, test_loss: 1.0006, test_f1: 0.4397
 epoch: 44, train_loss: 1.0166, test_loss: 0.9951, test_f1: 0.4361
 epoch: 45, train_loss: 1.0183, test_loss: 1.0034, test_f1: 0.4486
 epoch: 46, train_loss: 1.0138, test_loss: 0.9952, test_f1: 0.4333
 epoch: 47, train_loss: 1.0136, test_loss: 0.9998, test_f1: 0.4422
 epoch: 48, train_loss: 0.9952, test_loss: 0.9912, test_f1: 0.4462
 epoch: 49, train_loss: 1.0046, test_loss: 0.9819, test_f1: 0.4441
 epoch: 50, train_loss: 0.9961, test_loss: 0.9761, test_f1: 0.4482
 epoch: 51, train_loss: 0.9912, test_loss: 0.9868, test_f1: 0.4516
 epoch: 52, train_loss: 0.9953, test_loss: 1.0044, test_f1: 0.4394
 epoch: 53, train_loss: 0.9886, test_loss: 1.0024, test_f1: 0.4454
 epoch: 54, train_loss: 0.9923, test_loss: 0.9888, test_f1: 0.4418
 epoch: 55, train_loss: 0.9912, test_loss: 0.9971, test_f1: 0.4487
 epoch: 56, train_loss: 0.9872, test_loss: 0.9945, test_f1: 0.4495
 epoch: 57, train_loss: 0.9791, test_loss: 0.9984, test_f1: 0.4387
 epoch: 58, train_loss: 0.9858, test_loss: 0.9877, test_f1: 0.4556
 epoch: 59, train_loss: 0.9793, test_loss: 1.0144, test_f1: 0.4569
 epoch: 60, train_loss: 0.9825, test_loss: 1.0094, test_f1: 0.4537
 epoch: 61, train_loss: 0.9748, test_loss: 0.9925, test_f1: 0.4562
 epoch: 62, train_loss: 0.9752, test_loss: 1.0177, test_f1: 0.4546
 epoch: 63, train_loss: 0.9669, test_loss: 1.0077, test_f1: 0.4462
 epoch: 64, train_loss: 0.9754, test_loss: 1.0050, test_f1: 0.4510
 epoch: 65, train_loss: 0.9641, test_loss: 1.0076, test_f1: 0.4518
 epoch: 66, train_loss: 0.9698, test_loss: 0.9998, test_f1: 0.4554
 epoch: 67, train_loss: 0.9641, test_loss: 1.0068, test_f1: 0.4545
 epoch: 68, train_loss: 0.9603, test_loss: 1.0036, test_f1: 0.4622
 epoch: 69, train_loss: 0.9626, test_loss: 1.0068, test_f1: 0.4549
 epoch: 70, train_loss: 0.9659, test_loss: 0.9995, test_f1: 0.4638
 epoch: 71, train_loss: 0.9679, test_loss: 1.0038, test_f1: 0.4522
 epoch: 72, train_loss: 0.9531, test_loss: 1.0069, test_f1: 0.4553
 epoch: 73, train_loss: 0.9541, test_loss: 1.0129, test_f1: 0.4633
 epoch: 74, train_loss: 0.9530, test_loss: 1.0162, test_f1: 0.4613
 epoch: 75, train_loss: 0.9584, test_loss: 1.0086, test_f1: 0.4668
 epoch: 76, train_loss: 0.9490, test_loss: 1.0226, test_f1: 0.4564
 epoch: 77, train_loss: 0.9429, test_loss: 1.0043, test_f1: 0.4592
 epoch: 78, train_loss: 0.9594, test_loss: 1.0124, test_f1: 0.4660
 epoch: 79, train_loss: 0.9582, test_loss: 1.0157, test_f1: 0.4573
 epoch: 80, train_loss: 0.9479, test_loss: 1.0136, test_f1: 0.4677
 epoch: 81, train_loss: 0.9516, test_loss: 1.0146, test_f1: 0.4547
 epoch: 82, train_loss: 0.9512, test_loss: 1.0138, test_f1: 0.4632
 epoch: 83, train_loss: 0.9512, test_loss: 1.0120, test_f1: 0.4534
 epoch: 84, train_loss: 0.9472, test_loss: 1.0109, test_f1: 0.4610
 epoch: 85, train_loss: 0.9464, test_loss: 1.0182, test_f1: 0.4585
 epoch: 86, train_loss: 0.9423, test_loss: 0.9945, test_f1: 0.4678
 epoch: 87, train_loss: 0.9389, test_loss: 1.0214, test_f1: 0.4568
 epoch: 88, train_loss: 0.9347, test_loss: 1.0199, test_f1: 0.4641
 epoch: 89, train_loss: 0.9333, test_loss: 1.0290, test_f1: 0.4605
 epoch: 90, train_loss: 0.9293, test_loss: 1.0290, test_f1: 0.4592
 epoch: 91, train_loss: 0.9315, test_loss: 1.0301, test_f1: 0.4544
 epoch: 92, train_loss: 0.9334, test_loss: 1.0198, test_f1: 0.4644
 epoch: 93, train_loss: 0.9346, test_loss: 1.0376, test_f1: 0.4645
 epoch: 94, train_loss: 0.9321, test_loss: 1.0304, test_f1: 0.4633
 epoch: 95, train_loss: 0.9246, test_loss: 1.0282, test_f1: 0.4585
 epoch: 96, train_loss: 0.9269, test_loss: 1.0346, test_f1: 0.4597
 epoch: 97, train_loss: 0.9180, test_loss: 1.0122, test_f1: 0.4619
 epoch: 98, train_loss: 0.9254, test_loss: 1.0203, test_f1: 0.4660
 epoch: 99, train_loss: 0.9248, test_loss: 1.0368, test_f1: 0.4577
##################ITERATION #4 ****************************************
 epoch: 0, train_loss: 1.3434, test_loss: 1.3211, test_f1: 0.2274
 epoch: 1, train_loss: 1.2887, test_loss: 1.2930, test_f1: 0.2274
 epoch: 2, train_loss: 1.2642, test_loss: 1.2508, test_f1: 0.2655
 epoch: 3, train_loss: 1.2505, test_loss: 1.2281, test_f1: 0.2869
 epoch: 4, train_loss: 1.2395, test_loss: 1.2150, test_f1: 0.2919
 epoch: 5, train_loss: 1.2358, test_loss: 1.2081, test_f1: 0.3127
 epoch: 6, train_loss: 1.2196, test_loss: 1.1915, test_f1: 0.3573
 epoch: 7, train_loss: 1.2122, test_loss: 1.1881, test_f1: 0.3398
 epoch: 8, train_loss: 1.2117, test_loss: 1.1792, test_f1: 0.3593
 epoch: 9, train_loss: 1.2064, test_loss: 1.1641, test_f1: 0.3675
 epoch: 10, train_loss: 1.1948, test_loss: 1.1538, test_f1: 0.4054
 epoch: 11, train_loss: 1.1841, test_loss: 1.1374, test_f1: 0.3810
 epoch: 12, train_loss: 1.1826, test_loss: 1.1276, test_f1: 0.4182
 epoch: 13, train_loss: 1.1668, test_loss: 1.1205, test_f1: 0.4430
 epoch: 14, train_loss: 1.1669, test_loss: 1.1155, test_f1: 0.4198
 epoch: 15, train_loss: 1.1618, test_loss: 1.1017, test_f1: 0.4274
 epoch: 16, train_loss: 1.1590, test_loss: 1.0918, test_f1: 0.4515
 epoch: 17, train_loss: 1.1428, test_loss: 1.0876, test_f1: 0.4516
 epoch: 18, train_loss: 1.1349, test_loss: 1.0824, test_f1: 0.4380
 epoch: 19, train_loss: 1.1397, test_loss: 1.0723, test_f1: 0.4488
 epoch: 20, train_loss: 1.1303, test_loss: 1.0599, test_f1: 0.4617
 epoch: 21, train_loss: 1.1144, test_loss: 1.0473, test_f1: 0.4374
 epoch: 22, train_loss: 1.1192, test_loss: 1.0529, test_f1: 0.4654
 epoch: 23, train_loss: 1.1071, test_loss: 1.0333, test_f1: 0.4628
 epoch: 24, train_loss: 1.0984, test_loss: 1.0219, test_f1: 0.4758
 epoch: 25, train_loss: 1.0988, test_loss: 1.0226, test_f1: 0.4754
 epoch: 26, train_loss: 1.0824, test_loss: 1.0202, test_f1: 0.4533
 epoch: 27, train_loss: 1.0839, test_loss: 1.0018, test_f1: 0.4866
 epoch: 28, train_loss: 1.0849, test_loss: 1.0014, test_f1: 0.4834
 epoch: 29, train_loss: 1.0750, test_loss: 0.9946, test_f1: 0.4761
 epoch: 30, train_loss: 1.0758, test_loss: 0.9965, test_f1: 0.4745
 epoch: 31, train_loss: 1.0704, test_loss: 0.9960, test_f1: 0.4581
 epoch: 32, train_loss: 1.0658, test_loss: 0.9875, test_f1: 0.4659
 epoch: 33, train_loss: 1.0484, test_loss: 0.9812, test_f1: 0.4800
 epoch: 34, train_loss: 1.0584, test_loss: 0.9701, test_f1: 0.4882
 epoch: 35, train_loss: 1.0511, test_loss: 0.9841, test_f1: 0.4864
 epoch: 36, train_loss: 1.0492, test_loss: 0.9746, test_f1: 0.4943
 epoch: 37, train_loss: 1.0524, test_loss: 0.9665, test_f1: 0.4923
 epoch: 38, train_loss: 1.0346, test_loss: 0.9696, test_f1: 0.4806
 epoch: 39, train_loss: 1.0362, test_loss: 0.9535, test_f1: 0.4982
 epoch: 40, train_loss: 1.0304, test_loss: 0.9694, test_f1: 0.4855
 epoch: 41, train_loss: 1.0256, test_loss: 0.9519, test_f1: 0.5098
 epoch: 42, train_loss: 1.0252, test_loss: 0.9635, test_f1: 0.4887
 epoch: 43, train_loss: 1.0266, test_loss: 0.9579, test_f1: 0.4744
 epoch: 44, train_loss: 1.0160, test_loss: 0.9561, test_f1: 0.4909
 epoch: 45, train_loss: 1.0178, test_loss: 0.9370, test_f1: 0.5122
 epoch: 46, train_loss: 1.0036, test_loss: 0.9433, test_f1: 0.4914
 epoch: 47, train_loss: 1.0143, test_loss: 0.9431, test_f1: 0.5188
 epoch: 48, train_loss: 1.0078, test_loss: 0.9318, test_f1: 0.5244
 epoch: 49, train_loss: 1.0005, test_loss: 0.9472, test_f1: 0.5056
 epoch: 50, train_loss: 1.0040, test_loss: 0.9591, test_f1: 0.5011
 epoch: 51, train_loss: 0.9967, test_loss: 0.9285, test_f1: 0.4945
 epoch: 52, train_loss: 0.9831, test_loss: 0.9288, test_f1: 0.4990
 epoch: 53, train_loss: 0.9918, test_loss: 0.9393, test_f1: 0.5074
 epoch: 54, train_loss: 0.9980, test_loss: 0.9362, test_f1: 0.4966
 epoch: 55, train_loss: 0.9843, test_loss: 0.9341, test_f1: 0.4886
 epoch: 56, train_loss: 0.9825, test_loss: 0.9281, test_f1: 0.4982
 epoch: 57, train_loss: 0.9849, test_loss: 0.9258, test_f1: 0.5126
 epoch: 58, train_loss: 0.9790, test_loss: 0.9454, test_f1: 0.5112
 epoch: 59, train_loss: 0.9776, test_loss: 0.9360, test_f1: 0.5005
 epoch: 60, train_loss: 0.9746, test_loss: 0.9243, test_f1: 0.5125
 epoch: 61, train_loss: 0.9763, test_loss: 0.9409, test_f1: 0.5005
 epoch: 62, train_loss: 0.9667, test_loss: 0.9386, test_f1: 0.4994
 epoch: 63, train_loss: 0.9803, test_loss: 0.9381, test_f1: 0.4879
 epoch: 64, train_loss: 0.9750, test_loss: 0.9248, test_f1: 0.5339
 epoch: 65, train_loss: 0.9724, test_loss: 0.9298, test_f1: 0.5148
 epoch: 66, train_loss: 0.9774, test_loss: 0.9363, test_f1: 0.5153
 epoch: 67, train_loss: 0.9731, test_loss: 0.9336, test_f1: 0.5129
 epoch: 68, train_loss: 0.9677, test_loss: 0.9263, test_f1: 0.5337
 epoch: 69, train_loss: 0.9656, test_loss: 0.9348, test_f1: 0.5161
 epoch: 70, train_loss: 0.9597, test_loss: 0.9310, test_f1: 0.5274
 epoch: 71, train_loss: 0.9608, test_loss: 0.9271, test_f1: 0.5365
 epoch: 72, train_loss: 0.9620, test_loss: 0.9201, test_f1: 0.5458
 epoch: 73, train_loss: 0.9611, test_loss: 0.9205, test_f1: 0.5086
 epoch: 74, train_loss: 0.9586, test_loss: 0.9243, test_f1: 0.5177
 epoch: 75, train_loss: 0.9570, test_loss: 0.9273, test_f1: 0.5363
 epoch: 76, train_loss: 0.9562, test_loss: 0.9212, test_f1: 0.5369
 epoch: 77, train_loss: 0.9705, test_loss: 0.9353, test_f1: 0.5192
 epoch: 78, train_loss: 0.9604, test_loss: 0.9254, test_f1: 0.5099
 epoch: 79, train_loss: 0.9547, test_loss: 0.9207, test_f1: 0.5120
 epoch: 80, train_loss: 0.9439, test_loss: 0.9235, test_f1: 0.5072
 epoch: 81, train_loss: 0.9505, test_loss: 0.9362, test_f1: 0.5097
 epoch: 82, train_loss: 0.9430, test_loss: 0.9089, test_f1: 0.5313
 epoch: 83, train_loss: 0.9498, test_loss: 0.9172, test_f1: 0.5159
 epoch: 84, train_loss: 0.9482, test_loss: 0.9319, test_f1: 0.5203
 epoch: 85, train_loss: 0.9488, test_loss: 0.9191, test_f1: 0.5196
 epoch: 86, train_loss: 0.9460, test_loss: 0.9192, test_f1: 0.5084
 epoch: 87, train_loss: 0.9470, test_loss: 0.9225, test_f1: 0.5183
 epoch: 88, train_loss: 0.9429, test_loss: 0.9123, test_f1: 0.5262
 epoch: 89, train_loss: 0.9324, test_loss: 0.9310, test_f1: 0.5219
 epoch: 90, train_loss: 0.9356, test_loss: 0.9195, test_f1: 0.5240
 epoch: 91, train_loss: 0.9376, test_loss: 0.9140, test_f1: 0.5296
 epoch: 92, train_loss: 0.9314, test_loss: 0.9066, test_f1: 0.5334
 epoch: 93, train_loss: 0.9377, test_loss: 0.9133, test_f1: 0.5172
 epoch: 94, train_loss: 0.9326, test_loss: 0.9285, test_f1: 0.5039
 epoch: 95, train_loss: 0.9314, test_loss: 0.9242, test_f1: 0.5255
 epoch: 96, train_loss: 0.9374, test_loss: 0.9285, test_f1: 0.5069
 epoch: 97, train_loss: 0.9362, test_loss: 0.9124, test_f1: 0.5266
 epoch: 98, train_loss: 0.9334, test_loss: 0.9193, test_f1: 0.5287
 epoch: 99, train_loss: 0.9336, test_loss: 0.9409, test_f1: 0.5046
##################ITERATION #5 ****************************************
 epoch: 0, train_loss: 1.3476, test_loss: 1.3267, test_f1: 0.2274
 epoch: 1, train_loss: 1.2834, test_loss: 1.3119, test_f1: 0.2274
 epoch: 2, train_loss: 1.2707, test_loss: 1.2895, test_f1: 0.2276
 epoch: 3, train_loss: 1.2480, test_loss: 1.2522, test_f1: 0.2522
 epoch: 4, train_loss: 1.2416, test_loss: 1.2229, test_f1: 0.2730
 epoch: 5, train_loss: 1.2316, test_loss: 1.1963, test_f1: 0.3234
 epoch: 6, train_loss: 1.2218, test_loss: 1.1751, test_f1: 0.3320
 epoch: 7, train_loss: 1.2070, test_loss: 1.1615, test_f1: 0.3779
 epoch: 8, train_loss: 1.2017, test_loss: 1.1550, test_f1: 0.3973
 epoch: 9, train_loss: 1.1924, test_loss: 1.1452, test_f1: 0.4075
 epoch: 10, train_loss: 1.1782, test_loss: 1.1422, test_f1: 0.3849
 epoch: 11, train_loss: 1.1709, test_loss: 1.1393, test_f1: 0.3987
 epoch: 12, train_loss: 1.1629, test_loss: 1.1331, test_f1: 0.4005
 epoch: 13, train_loss: 1.1546, test_loss: 1.1307, test_f1: 0.4063
 epoch: 14, train_loss: 1.1455, test_loss: 1.1298, test_f1: 0.3964
 epoch: 15, train_loss: 1.1446, test_loss: 1.1217, test_f1: 0.3977
 epoch: 16, train_loss: 1.1300, test_loss: 1.1178, test_f1: 0.4032
 epoch: 17, train_loss: 1.1298, test_loss: 1.1037, test_f1: 0.4099
 epoch: 18, train_loss: 1.1341, test_loss: 1.1139, test_f1: 0.4068
 epoch: 19, train_loss: 1.1159, test_loss: 1.1249, test_f1: 0.4146
 epoch: 20, train_loss: 1.1129, test_loss: 1.1149, test_f1: 0.4092
 epoch: 21, train_loss: 1.1072, test_loss: 1.1021, test_f1: 0.4144
 epoch: 22, train_loss: 1.1080, test_loss: 1.1090, test_f1: 0.4149
 epoch: 23, train_loss: 1.1044, test_loss: 1.1083, test_f1: 0.4131
 epoch: 24, train_loss: 1.1104, test_loss: 1.1051, test_f1: 0.4048
 epoch: 25, train_loss: 1.1089, test_loss: 1.0985, test_f1: 0.4221
 epoch: 26, train_loss: 1.0960, test_loss: 1.1038, test_f1: 0.4227
 epoch: 27, train_loss: 1.0933, test_loss: 1.1036, test_f1: 0.4066
 epoch: 28, train_loss: 1.0978, test_loss: 1.0899, test_f1: 0.4126
 epoch: 29, train_loss: 1.0879, test_loss: 1.0892, test_f1: 0.4213
 epoch: 30, train_loss: 1.0763, test_loss: 1.1084, test_f1: 0.4125
 epoch: 31, train_loss: 1.0799, test_loss: 1.1005, test_f1: 0.4072
 epoch: 32, train_loss: 1.0735, test_loss: 1.0946, test_f1: 0.4142
 epoch: 33, train_loss: 1.0659, test_loss: 1.1050, test_f1: 0.4123
 epoch: 34, train_loss: 1.0706, test_loss: 1.0731, test_f1: 0.4286
 epoch: 35, train_loss: 1.0606, test_loss: 1.0624, test_f1: 0.4331
 epoch: 36, train_loss: 1.0601, test_loss: 1.0730, test_f1: 0.4266
 epoch: 37, train_loss: 1.0560, test_loss: 1.0772, test_f1: 0.4257
 epoch: 38, train_loss: 1.0511, test_loss: 1.0907, test_f1: 0.4231
 epoch: 39, train_loss: 1.0500, test_loss: 1.0977, test_f1: 0.4262
 epoch: 40, train_loss: 1.0400, test_loss: 1.0723, test_f1: 0.4229
 epoch: 41, train_loss: 1.0365, test_loss: 1.0573, test_f1: 0.4325
 epoch: 42, train_loss: 1.0336, test_loss: 1.1468, test_f1: 0.4233
 epoch: 43, train_loss: 1.0258, test_loss: 1.0333, test_f1: 0.4363
 epoch: 44, train_loss: 1.0293, test_loss: 1.1571, test_f1: 0.4124
 epoch: 45, train_loss: 1.0232, test_loss: 1.0457, test_f1: 0.4368
 epoch: 46, train_loss: 1.0257, test_loss: 1.0496, test_f1: 0.4375
 epoch: 47, train_loss: 1.0211, test_loss: 1.0429, test_f1: 0.4277
 epoch: 48, train_loss: 1.0096, test_loss: 1.0550, test_f1: 0.4282
 epoch: 49, train_loss: 1.0122, test_loss: 1.0578, test_f1: 0.4190
 epoch: 50, train_loss: 1.0154, test_loss: 1.0576, test_f1: 0.4206
 epoch: 51, train_loss: 1.0094, test_loss: 1.0662, test_f1: 0.4284
 epoch: 52, train_loss: 1.0039, test_loss: 1.0357, test_f1: 0.4378
 epoch: 53, train_loss: 1.0036, test_loss: 1.0494, test_f1: 0.4343
 epoch: 54, train_loss: 1.0050, test_loss: 1.0553, test_f1: 0.4311
 epoch: 55, train_loss: 0.9938, test_loss: 1.0595, test_f1: 0.4296
 epoch: 56, train_loss: 0.9922, test_loss: 1.0748, test_f1: 0.4286
 epoch: 57, train_loss: 0.9879, test_loss: 1.0404, test_f1: 0.4344
 epoch: 58, train_loss: 0.9802, test_loss: 1.0647, test_f1: 0.4362
 epoch: 59, train_loss: 0.9913, test_loss: 1.0377, test_f1: 0.4369
 epoch: 60, train_loss: 0.9903, test_loss: 1.0318, test_f1: 0.4419
 epoch: 61, train_loss: 0.9955, test_loss: 1.0726, test_f1: 0.4324
 epoch: 62, train_loss: 0.9821, test_loss: 1.0555, test_f1: 0.4312
 epoch: 63, train_loss: 0.9970, test_loss: 1.0643, test_f1: 0.4338
 epoch: 64, train_loss: 0.9798, test_loss: 1.0612, test_f1: 0.4371
 epoch: 65, train_loss: 0.9798, test_loss: 1.0476, test_f1: 0.4404
 epoch: 66, train_loss: 0.9793, test_loss: 1.0898, test_f1: 0.4307
 epoch: 67, train_loss: 0.9779, test_loss: 1.0620, test_f1: 0.4388
 epoch: 68, train_loss: 0.9750, test_loss: 1.0452, test_f1: 0.4520
 epoch: 69, train_loss: 0.9706, test_loss: 1.0656, test_f1: 0.4320
 epoch: 70, train_loss: 0.9686, test_loss: 1.0601, test_f1: 0.4311
 epoch: 71, train_loss: 0.9588, test_loss: 1.0450, test_f1: 0.4424
 epoch: 72, train_loss: 0.9720, test_loss: 1.0443, test_f1: 0.4355
 epoch: 73, train_loss: 0.9546, test_loss: 1.0351, test_f1: 0.4434
 epoch: 74, train_loss: 0.9648, test_loss: 1.0415, test_f1: 0.4434
 epoch: 75, train_loss: 0.9654, test_loss: 1.0389, test_f1: 0.4496
 epoch: 76, train_loss: 0.9678, test_loss: 1.0231, test_f1: 0.4597
 epoch: 77, train_loss: 0.9655, test_loss: 1.0386, test_f1: 0.4413
 epoch: 78, train_loss: 0.9674, test_loss: 1.0359, test_f1: 0.4404
 epoch: 79, train_loss: 0.9548, test_loss: 1.0686, test_f1: 0.4360
 epoch: 80, train_loss: 0.9613, test_loss: 1.0671, test_f1: 0.4263
 epoch: 81, train_loss: 0.9562, test_loss: 1.0557, test_f1: 0.4407
 epoch: 82, train_loss: 0.9678, test_loss: 1.0381, test_f1: 0.4464
 epoch: 83, train_loss: 0.9587, test_loss: 1.0436, test_f1: 0.4457
 epoch: 84, train_loss: 0.9601, test_loss: 1.0209, test_f1: 0.4509
 epoch: 85, train_loss: 0.9538, test_loss: 1.0271, test_f1: 0.4516
 epoch: 86, train_loss: 0.9571, test_loss: 1.0459, test_f1: 0.4468
 epoch: 87, train_loss: 0.9636, test_loss: 1.0450, test_f1: 0.4419
 epoch: 88, train_loss: 0.9595, test_loss: 1.0386, test_f1: 0.4434
 epoch: 89, train_loss: 0.9454, test_loss: 1.0529, test_f1: 0.4433
 epoch: 90, train_loss: 0.9451, test_loss: 1.0294, test_f1: 0.4495
 epoch: 91, train_loss: 0.9536, test_loss: 1.0435, test_f1: 0.4514
 epoch: 92, train_loss: 0.9491, test_loss: 1.0412, test_f1: 0.4505
 epoch: 93, train_loss: 0.9389, test_loss: 1.0438, test_f1: 0.4495
 epoch: 94, train_loss: 0.9430, test_loss: 1.0371, test_f1: 0.4477
 epoch: 95, train_loss: 0.9462, test_loss: 1.0452, test_f1: 0.4531
 epoch: 96, train_loss: 0.9562, test_loss: 1.0555, test_f1: 0.4455
 epoch: 97, train_loss: 0.9463, test_loss: 1.0404, test_f1: 0.4468
 epoch: 98, train_loss: 0.9430, test_loss: 1.0343, test_f1: 0.4501
 epoch: 99, train_loss: 0.9472, test_loss: 1.0546, test_f1: 0.4478
##################ITERATION #6 ****************************************
 epoch: 0, train_loss: 1.4934, test_loss: 1.3732, test_f1: 0.2274
 epoch: 1, train_loss: 1.3353, test_loss: 1.3444, test_f1: 0.2274
 epoch: 2, train_loss: 1.3088, test_loss: 1.3034, test_f1: 0.2300
 epoch: 3, train_loss: 1.2877, test_loss: 1.2726, test_f1: 0.2591
 epoch: 4, train_loss: 1.2801, test_loss: 1.2580, test_f1: 0.3029
 epoch: 5, train_loss: 1.2600, test_loss: 1.2508, test_f1: 0.2949
 epoch: 6, train_loss: 1.2551, test_loss: 1.2443, test_f1: 0.2955
 epoch: 7, train_loss: 1.2460, test_loss: 1.2402, test_f1: 0.3102
 epoch: 8, train_loss: 1.2473, test_loss: 1.2358, test_f1: 0.3277
 epoch: 9, train_loss: 1.2419, test_loss: 1.2321, test_f1: 0.3311
 epoch: 10, train_loss: 1.2303, test_loss: 1.2315, test_f1: 0.3281
 epoch: 11, train_loss: 1.2321, test_loss: 1.2223, test_f1: 0.3317
 epoch: 12, train_loss: 1.2177, test_loss: 1.2189, test_f1: 0.3386
 epoch: 13, train_loss: 1.2235, test_loss: 1.2148, test_f1: 0.3404
 epoch: 14, train_loss: 1.2071, test_loss: 1.2112, test_f1: 0.3476
 epoch: 15, train_loss: 1.2001, test_loss: 1.2101, test_f1: 0.3582
 epoch: 16, train_loss: 1.1991, test_loss: 1.2022, test_f1: 0.3602
 epoch: 17, train_loss: 1.1954, test_loss: 1.1976, test_f1: 0.3614
 epoch: 18, train_loss: 1.1966, test_loss: 1.1893, test_f1: 0.3722
 epoch: 19, train_loss: 1.1923, test_loss: 1.1844, test_f1: 0.3716
 epoch: 20, train_loss: 1.1825, test_loss: 1.1800, test_f1: 0.3863
 epoch: 21, train_loss: 1.1800, test_loss: 1.1794, test_f1: 0.3915
 epoch: 22, train_loss: 1.1762, test_loss: 1.1652, test_f1: 0.3998
 epoch: 23, train_loss: 1.1760, test_loss: 1.1704, test_f1: 0.3979
 epoch: 24, train_loss: 1.1692, test_loss: 1.1688, test_f1: 0.3992
 epoch: 25, train_loss: 1.1666, test_loss: 1.1591, test_f1: 0.4092
 epoch: 26, train_loss: 1.1593, test_loss: 1.1506, test_f1: 0.4038
 epoch: 27, train_loss: 1.1577, test_loss: 1.1453, test_f1: 0.4029
 epoch: 28, train_loss: 1.1581, test_loss: 1.1406, test_f1: 0.4152
 epoch: 29, train_loss: 1.1454, test_loss: 1.1295, test_f1: 0.4202
 epoch: 30, train_loss: 1.1372, test_loss: 1.1331, test_f1: 0.4265
 epoch: 31, train_loss: 1.1349, test_loss: 1.1204, test_f1: 0.4192
 epoch: 32, train_loss: 1.1363, test_loss: 1.1156, test_f1: 0.4334
 epoch: 33, train_loss: 1.1283, test_loss: 1.1084, test_f1: 0.4259
 epoch: 34, train_loss: 1.1170, test_loss: 1.0991, test_f1: 0.4295
 epoch: 35, train_loss: 1.1221, test_loss: 1.0903, test_f1: 0.4251
 epoch: 36, train_loss: 1.1086, test_loss: 1.0768, test_f1: 0.4357
 epoch: 37, train_loss: 1.1066, test_loss: 1.0726, test_f1: 0.4326
 epoch: 38, train_loss: 1.0956, test_loss: 1.0550, test_f1: 0.4490
 epoch: 39, train_loss: 1.0853, test_loss: 1.0486, test_f1: 0.4521
 epoch: 40, train_loss: 1.0760, test_loss: 1.0432, test_f1: 0.4639
 epoch: 41, train_loss: 1.0654, test_loss: 1.0333, test_f1: 0.4674
 epoch: 42, train_loss: 1.0662, test_loss: 1.0282, test_f1: 0.4678
 epoch: 43, train_loss: 1.0501, test_loss: 1.0176, test_f1: 0.4502
 epoch: 44, train_loss: 1.0524, test_loss: 1.0030, test_f1: 0.4681
 epoch: 45, train_loss: 1.0419, test_loss: 1.0074, test_f1: 0.4710
 epoch: 46, train_loss: 1.0357, test_loss: 0.9958, test_f1: 0.4673
 epoch: 47, train_loss: 1.0362, test_loss: 0.9928, test_f1: 0.4664
 epoch: 48, train_loss: 1.0189, test_loss: 0.9682, test_f1: 0.4955
 epoch: 49, train_loss: 1.0251, test_loss: 0.9764, test_f1: 0.4837
 epoch: 50, train_loss: 0.9979, test_loss: 0.9672, test_f1: 0.4747
 epoch: 51, train_loss: 1.0010, test_loss: 0.9595, test_f1: 0.4893
 epoch: 52, train_loss: 0.9988, test_loss: 0.9763, test_f1: 0.4751
 epoch: 53, train_loss: 0.9999, test_loss: 0.9662, test_f1: 0.4866
 epoch: 54, train_loss: 0.9927, test_loss: 0.9642, test_f1: 0.4905
 epoch: 55, train_loss: 0.9903, test_loss: 0.9588, test_f1: 0.4919
 epoch: 56, train_loss: 0.9900, test_loss: 0.9609, test_f1: 0.4865
 epoch: 57, train_loss: 0.9828, test_loss: 0.9738, test_f1: 0.4755
 epoch: 58, train_loss: 0.9814, test_loss: 0.9649, test_f1: 0.4867
 epoch: 59, train_loss: 0.9766, test_loss: 0.9658, test_f1: 0.4711
 epoch: 60, train_loss: 0.9734, test_loss: 0.9597, test_f1: 0.4902
 epoch: 61, train_loss: 0.9742, test_loss: 0.9612, test_f1: 0.4646
 epoch: 62, train_loss: 0.9768, test_loss: 0.9594, test_f1: 0.4869
 epoch: 63, train_loss: 0.9726, test_loss: 0.9639, test_f1: 0.4839
 epoch: 64, train_loss: 0.9691, test_loss: 0.9625, test_f1: 0.4640
 epoch: 65, train_loss: 0.9634, test_loss: 0.9512, test_f1: 0.4812
 epoch: 66, train_loss: 0.9661, test_loss: 0.9540, test_f1: 0.4761
 epoch: 67, train_loss: 0.9631, test_loss: 0.9580, test_f1: 0.4806
 epoch: 68, train_loss: 0.9620, test_loss: 0.9553, test_f1: 0.4757
 epoch: 69, train_loss: 0.9622, test_loss: 0.9537, test_f1: 0.4734
 epoch: 70, train_loss: 0.9548, test_loss: 0.9583, test_f1: 0.4640
 epoch: 71, train_loss: 0.9507, test_loss: 0.9578, test_f1: 0.4776
 epoch: 72, train_loss: 0.9455, test_loss: 0.9506, test_f1: 0.4693
 epoch: 73, train_loss: 0.9483, test_loss: 0.9532, test_f1: 0.4747
 epoch: 74, train_loss: 0.9533, test_loss: 0.9451, test_f1: 0.4743
 epoch: 75, train_loss: 0.9552, test_loss: 0.9574, test_f1: 0.4746
 epoch: 76, train_loss: 0.9555, test_loss: 0.9530, test_f1: 0.4696
 epoch: 77, train_loss: 0.9306, test_loss: 0.9477, test_f1: 0.4717
 epoch: 78, train_loss: 0.9397, test_loss: 0.9537, test_f1: 0.4761
 epoch: 79, train_loss: 0.9375, test_loss: 0.9618, test_f1: 0.4687
 epoch: 80, train_loss: 0.9312, test_loss: 0.9552, test_f1: 0.4738
 epoch: 81, train_loss: 0.9439, test_loss: 0.9573, test_f1: 0.4790
 epoch: 82, train_loss: 0.9372, test_loss: 0.9464, test_f1: 0.4849
 epoch: 83, train_loss: 0.9401, test_loss: 0.9496, test_f1: 0.4836
 epoch: 84, train_loss: 0.9344, test_loss: 0.9460, test_f1: 0.4745
 epoch: 85, train_loss: 0.9354, test_loss: 0.9535, test_f1: 0.4855
 epoch: 86, train_loss: 0.9260, test_loss: 0.9732, test_f1: 0.4772
 epoch: 87, train_loss: 0.9366, test_loss: 0.9624, test_f1: 0.4827
 epoch: 88, train_loss: 0.9370, test_loss: 0.9568, test_f1: 0.4937
 epoch: 89, train_loss: 0.9269, test_loss: 0.9723, test_f1: 0.4697
 epoch: 90, train_loss: 0.9210, test_loss: 0.9630, test_f1: 0.4763
 epoch: 91, train_loss: 0.9318, test_loss: 0.9679, test_f1: 0.4788
 epoch: 92, train_loss: 0.9145, test_loss: 0.9689, test_f1: 0.4756
 epoch: 93, train_loss: 0.9182, test_loss: 0.9772, test_f1: 0.4845
 epoch: 94, train_loss: 0.9179, test_loss: 0.9748, test_f1: 0.4892
 epoch: 95, train_loss: 0.9118, test_loss: 0.9597, test_f1: 0.4829
 epoch: 96, train_loss: 0.9079, test_loss: 0.9567, test_f1: 0.4883
 epoch: 97, train_loss: 0.9137, test_loss: 0.9722, test_f1: 0.4836
 epoch: 98, train_loss: 0.9092, test_loss: 0.9792, test_f1: 0.4859
 epoch: 99, train_loss: 0.9070, test_loss: 0.9856, test_f1: 0.4815
##################ITERATION #7 ****************************************
 epoch: 0, train_loss: 1.3427, test_loss: 1.3192, test_f1: 0.2274
 epoch: 1, train_loss: 1.2778, test_loss: 1.2789, test_f1: 0.2274
 epoch: 2, train_loss: 1.2627, test_loss: 1.2575, test_f1: 0.2300
 epoch: 3, train_loss: 1.2519, test_loss: 1.2302, test_f1: 0.2727
 epoch: 4, train_loss: 1.2497, test_loss: 1.2192, test_f1: 0.2971
 epoch: 5, train_loss: 1.2382, test_loss: 1.2118, test_f1: 0.3069
 epoch: 6, train_loss: 1.2363, test_loss: 1.2044, test_f1: 0.3277
 epoch: 7, train_loss: 1.2276, test_loss: 1.1990, test_f1: 0.3362
 epoch: 8, train_loss: 1.2261, test_loss: 1.1955, test_f1: 0.3596
 epoch: 9, train_loss: 1.2116, test_loss: 1.1857, test_f1: 0.3546
 epoch: 10, train_loss: 1.2107, test_loss: 1.1795, test_f1: 0.3635
 epoch: 11, train_loss: 1.2008, test_loss: 1.1771, test_f1: 0.3562
 epoch: 12, train_loss: 1.2018, test_loss: 1.1734, test_f1: 0.3654
 epoch: 13, train_loss: 1.1881, test_loss: 1.1610, test_f1: 0.3579
 epoch: 14, train_loss: 1.1960, test_loss: 1.1602, test_f1: 0.3737
 epoch: 15, train_loss: 1.1844, test_loss: 1.1574, test_f1: 0.3650
 epoch: 16, train_loss: 1.1807, test_loss: 1.1426, test_f1: 0.3670
 epoch: 17, train_loss: 1.1698, test_loss: 1.1457, test_f1: 0.3540
 epoch: 18, train_loss: 1.1650, test_loss: 1.1315, test_f1: 0.3680
 epoch: 19, train_loss: 1.1658, test_loss: 1.1200, test_f1: 0.3651
 epoch: 20, train_loss: 1.1562, test_loss: 1.1196, test_f1: 0.3739
 epoch: 21, train_loss: 1.1522, test_loss: 1.1098, test_f1: 0.3795
 epoch: 22, train_loss: 1.1434, test_loss: 1.1157, test_f1: 0.4027
 epoch: 23, train_loss: 1.1385, test_loss: 1.0995, test_f1: 0.3989
 epoch: 24, train_loss: 1.1367, test_loss: 1.1007, test_f1: 0.4016
 epoch: 25, train_loss: 1.1259, test_loss: 1.0885, test_f1: 0.4242
 epoch: 26, train_loss: 1.1233, test_loss: 1.0799, test_f1: 0.4021
 epoch: 27, train_loss: 1.1211, test_loss: 1.0762, test_f1: 0.4331
 epoch: 28, train_loss: 1.1100, test_loss: 1.0666, test_f1: 0.4271
 epoch: 29, train_loss: 1.1106, test_loss: 1.0621, test_f1: 0.4470
 epoch: 30, train_loss: 1.1004, test_loss: 1.0539, test_f1: 0.4241
 epoch: 31, train_loss: 1.1060, test_loss: 1.0578, test_f1: 0.4325
 epoch: 32, train_loss: 1.0965, test_loss: 1.0519, test_f1: 0.4488
 epoch: 33, train_loss: 1.0950, test_loss: 1.0397, test_f1: 0.4665
 epoch: 34, train_loss: 1.0827, test_loss: 1.0572, test_f1: 0.4389
 epoch: 35, train_loss: 1.0837, test_loss: 1.0636, test_f1: 0.4395
 epoch: 36, train_loss: 1.0770, test_loss: 1.0420, test_f1: 0.4502
 epoch: 37, train_loss: 1.0776, test_loss: 1.0376, test_f1: 0.4567
 epoch: 38, train_loss: 1.0638, test_loss: 1.0329, test_f1: 0.4678
 epoch: 39, train_loss: 1.0654, test_loss: 1.0251, test_f1: 0.4784
 epoch: 40, train_loss: 1.0581, test_loss: 1.0473, test_f1: 0.4720
 epoch: 41, train_loss: 1.0596, test_loss: 1.0285, test_f1: 0.4623
 epoch: 42, train_loss: 1.0533, test_loss: 1.0478, test_f1: 0.4788
 epoch: 43, train_loss: 1.0572, test_loss: 1.0221, test_f1: 0.4677
 epoch: 44, train_loss: 1.0559, test_loss: 1.0375, test_f1: 0.4707
 epoch: 45, train_loss: 1.0439, test_loss: 1.0145, test_f1: 0.4969
 epoch: 46, train_loss: 1.0474, test_loss: 1.0233, test_f1: 0.4837
 epoch: 47, train_loss: 1.0421, test_loss: 1.0369, test_f1: 0.4796
 epoch: 48, train_loss: 1.0269, test_loss: 1.0294, test_f1: 0.4677
 epoch: 49, train_loss: 1.0236, test_loss: 1.0271, test_f1: 0.4686
 epoch: 50, train_loss: 1.0338, test_loss: 1.0184, test_f1: 0.4544
 epoch: 51, train_loss: 1.0144, test_loss: 1.0340, test_f1: 0.4777
 epoch: 52, train_loss: 1.0186, test_loss: 1.0435, test_f1: 0.4707
 epoch: 53, train_loss: 1.0116, test_loss: 1.0301, test_f1: 0.4870
 epoch: 54, train_loss: 1.0111, test_loss: 1.0156, test_f1: 0.4711
 epoch: 55, train_loss: 1.0067, test_loss: 1.0226, test_f1: 0.4780
 epoch: 56, train_loss: 1.0165, test_loss: 1.0150, test_f1: 0.4793
 epoch: 57, train_loss: 1.0040, test_loss: 1.0243, test_f1: 0.4789
 epoch: 58, train_loss: 1.0033, test_loss: 1.0327, test_f1: 0.4992
 epoch: 59, train_loss: 0.9947, test_loss: 1.0360, test_f1: 0.4758
 epoch: 60, train_loss: 1.0021, test_loss: 1.0280, test_f1: 0.4816
 epoch: 61, train_loss: 1.0025, test_loss: 1.0215, test_f1: 0.4857
 epoch: 62, train_loss: 0.9865, test_loss: 1.0215, test_f1: 0.4989
 epoch: 63, train_loss: 0.9890, test_loss: 1.0255, test_f1: 0.4847
 epoch: 64, train_loss: 0.9822, test_loss: 1.0373, test_f1: 0.4750
 epoch: 65, train_loss: 0.9827, test_loss: 1.0407, test_f1: 0.4666
 epoch: 66, train_loss: 0.9854, test_loss: 1.0322, test_f1: 0.4738
 epoch: 67, train_loss: 0.9865, test_loss: 1.0221, test_f1: 0.4792
 epoch: 68, train_loss: 0.9852, test_loss: 1.0234, test_f1: 0.4794
 epoch: 69, train_loss: 0.9896, test_loss: 1.0323, test_f1: 0.4729
 epoch: 70, train_loss: 0.9745, test_loss: 1.0224, test_f1: 0.4844
 epoch: 71, train_loss: 0.9822, test_loss: 1.0333, test_f1: 0.4760
 epoch: 72, train_loss: 0.9732, test_loss: 1.0174, test_f1: 0.4805
 epoch: 73, train_loss: 0.9786, test_loss: 1.0196, test_f1: 0.4768
 epoch: 74, train_loss: 0.9674, test_loss: 1.0353, test_f1: 0.4869
 epoch: 75, train_loss: 0.9744, test_loss: 1.0369, test_f1: 0.4747
 epoch: 76, train_loss: 0.9704, test_loss: 1.0288, test_f1: 0.4951
 epoch: 77, train_loss: 0.9658, test_loss: 1.0317, test_f1: 0.5006
 epoch: 78, train_loss: 0.9656, test_loss: 1.0299, test_f1: 0.4896
 epoch: 79, train_loss: 0.9610, test_loss: 1.0377, test_f1: 0.4681
 epoch: 80, train_loss: 0.9586, test_loss: 1.0282, test_f1: 0.4763
 epoch: 81, train_loss: 0.9567, test_loss: 1.0347, test_f1: 0.4776
 epoch: 82, train_loss: 0.9624, test_loss: 1.0254, test_f1: 0.4778
 epoch: 83, train_loss: 0.9547, test_loss: 1.0318, test_f1: 0.4768
 epoch: 84, train_loss: 0.9618, test_loss: 1.0279, test_f1: 0.4845
 epoch: 85, train_loss: 0.9658, test_loss: 1.0365, test_f1: 0.4814
 epoch: 86, train_loss: 0.9572, test_loss: 1.0217, test_f1: 0.4836
 epoch: 87, train_loss: 0.9479, test_loss: 1.0343, test_f1: 0.4772
 epoch: 88, train_loss: 0.9605, test_loss: 1.0429, test_f1: 0.4798
 epoch: 89, train_loss: 0.9524, test_loss: 1.0458, test_f1: 0.4762
 epoch: 90, train_loss: 0.9529, test_loss: 1.0254, test_f1: 0.4752
 epoch: 91, train_loss: 0.9514, test_loss: 1.0316, test_f1: 0.4674
 epoch: 92, train_loss: 0.9520, test_loss: 1.0335, test_f1: 0.4796
 epoch: 93, train_loss: 0.9514, test_loss: 1.0266, test_f1: 0.4771
 epoch: 94, train_loss: 0.9399, test_loss: 1.0293, test_f1: 0.4811
 epoch: 95, train_loss: 0.9449, test_loss: 1.0331, test_f1: 0.4766
 epoch: 96, train_loss: 0.9483, test_loss: 1.0353, test_f1: 0.4816
 epoch: 97, train_loss: 0.9440, test_loss: 1.0166, test_f1: 0.4853
 epoch: 98, train_loss: 0.9473, test_loss: 1.0428, test_f1: 0.4699
 epoch: 99, train_loss: 0.9481, test_loss: 1.0520, test_f1: 0.4996
##################ITERATION #8 ****************************************
 epoch: 0, train_loss: 1.3475, test_loss: 1.3178, test_f1: 0.2274
 epoch: 1, train_loss: 1.2979, test_loss: 1.2896, test_f1: 0.2274
 epoch: 2, train_loss: 1.2726, test_loss: 1.2634, test_f1: 0.2510
 epoch: 3, train_loss: 1.2606, test_loss: 1.2447, test_f1: 0.2654
 epoch: 4, train_loss: 1.2437, test_loss: 1.2324, test_f1: 0.2681
 epoch: 5, train_loss: 1.2471, test_loss: 1.2243, test_f1: 0.2879
 epoch: 6, train_loss: 1.2305, test_loss: 1.2130, test_f1: 0.3037
 epoch: 7, train_loss: 1.2183, test_loss: 1.1960, test_f1: 0.3280
 epoch: 8, train_loss: 1.2178, test_loss: 1.1894, test_f1: 0.3531
 epoch: 9, train_loss: 1.2108, test_loss: 1.1778, test_f1: 0.3918
 epoch: 10, train_loss: 1.2017, test_loss: 1.1733, test_f1: 0.4001
 epoch: 11, train_loss: 1.1863, test_loss: 1.1648, test_f1: 0.4016
 epoch: 12, train_loss: 1.1851, test_loss: 1.1507, test_f1: 0.4093
 epoch: 13, train_loss: 1.1807, test_loss: 1.1521, test_f1: 0.3944
 epoch: 14, train_loss: 1.1771, test_loss: 1.1384, test_f1: 0.4154
 epoch: 15, train_loss: 1.1675, test_loss: 1.1288, test_f1: 0.4249
 epoch: 16, train_loss: 1.1563, test_loss: 1.1233, test_f1: 0.4182
 epoch: 17, train_loss: 1.1579, test_loss: 1.1242, test_f1: 0.4151
 epoch: 18, train_loss: 1.1427, test_loss: 1.1146, test_f1: 0.4300
 epoch: 19, train_loss: 1.1488, test_loss: 1.0997, test_f1: 0.4291
 epoch: 20, train_loss: 1.1325, test_loss: 1.0983, test_f1: 0.4359
 epoch: 21, train_loss: 1.1334, test_loss: 1.0913, test_f1: 0.4419
 epoch: 22, train_loss: 1.1252, test_loss: 1.0854, test_f1: 0.4452
 epoch: 23, train_loss: 1.1269, test_loss: 1.0725, test_f1: 0.4463
 epoch: 24, train_loss: 1.1021, test_loss: 1.0684, test_f1: 0.4422
 epoch: 25, train_loss: 1.0974, test_loss: 1.0622, test_f1: 0.4506
 epoch: 26, train_loss: 1.0918, test_loss: 1.0611, test_f1: 0.4554
 epoch: 27, train_loss: 1.0934, test_loss: 1.0390, test_f1: 0.4566
 epoch: 28, train_loss: 1.0735, test_loss: 1.0397, test_f1: 0.4628
 epoch: 29, train_loss: 1.0739, test_loss: 1.0431, test_f1: 0.4560
 epoch: 30, train_loss: 1.0733, test_loss: 1.0182, test_f1: 0.4635
 epoch: 31, train_loss: 1.0692, test_loss: 1.0144, test_f1: 0.4666
 epoch: 32, train_loss: 1.0658, test_loss: 1.0162, test_f1: 0.4653
 epoch: 33, train_loss: 1.0618, test_loss: 1.0040, test_f1: 0.4506
 epoch: 34, train_loss: 1.0476, test_loss: 1.0127, test_f1: 0.4615
 epoch: 35, train_loss: 1.0487, test_loss: 1.0022, test_f1: 0.4474
 epoch: 36, train_loss: 1.0403, test_loss: 0.9998, test_f1: 0.4481
 epoch: 37, train_loss: 1.0384, test_loss: 1.0050, test_f1: 0.4460
 epoch: 38, train_loss: 1.0325, test_loss: 0.9884, test_f1: 0.4585
 epoch: 39, train_loss: 1.0266, test_loss: 0.9968, test_f1: 0.4462
 epoch: 40, train_loss: 1.0169, test_loss: 0.9833, test_f1: 0.4531
 epoch: 41, train_loss: 1.0073, test_loss: 0.9858, test_f1: 0.4535
 epoch: 42, train_loss: 1.0087, test_loss: 1.0169, test_f1: 0.4522
 epoch: 43, train_loss: 1.0173, test_loss: 0.9816, test_f1: 0.4648
 epoch: 44, train_loss: 1.0048, test_loss: 0.9747, test_f1: 0.4555
 epoch: 45, train_loss: 1.0062, test_loss: 0.9767, test_f1: 0.4508
 epoch: 46, train_loss: 1.0099, test_loss: 0.9683, test_f1: 0.4566
 epoch: 47, train_loss: 0.9904, test_loss: 0.9711, test_f1: 0.4506
 epoch: 48, train_loss: 0.9909, test_loss: 0.9819, test_f1: 0.4586
 epoch: 49, train_loss: 0.9809, test_loss: 0.9679, test_f1: 0.4610
 epoch: 50, train_loss: 0.9839, test_loss: 0.9666, test_f1: 0.4725
 epoch: 51, train_loss: 0.9735, test_loss: 0.9558, test_f1: 0.4610
 epoch: 52, train_loss: 0.9716, test_loss: 0.9642, test_f1: 0.4617
 epoch: 53, train_loss: 0.9513, test_loss: 0.9708, test_f1: 0.4658
 epoch: 54, train_loss: 0.9796, test_loss: 0.9720, test_f1: 0.4620
 epoch: 55, train_loss: 0.9627, test_loss: 0.9612, test_f1: 0.4619
 epoch: 56, train_loss: 0.9723, test_loss: 0.9619, test_f1: 0.4626
 epoch: 57, train_loss: 0.9671, test_loss: 0.9729, test_f1: 0.4567
 epoch: 58, train_loss: 0.9592, test_loss: 0.9919, test_f1: 0.4598
 epoch: 59, train_loss: 0.9579, test_loss: 0.9700, test_f1: 0.4596
 epoch: 60, train_loss: 0.9573, test_loss: 0.9730, test_f1: 0.4624
 epoch: 61, train_loss: 0.9536, test_loss: 0.9661, test_f1: 0.4598
 epoch: 62, train_loss: 0.9511, test_loss: 0.9882, test_f1: 0.4551
 epoch: 63, train_loss: 0.9529, test_loss: 0.9834, test_f1: 0.4557
 epoch: 64, train_loss: 0.9536, test_loss: 0.9763, test_f1: 0.4558
 epoch: 65, train_loss: 0.9579, test_loss: 0.9626, test_f1: 0.4608
 epoch: 66, train_loss: 0.9453, test_loss: 0.9846, test_f1: 0.4599
 epoch: 67, train_loss: 0.9413, test_loss: 0.9700, test_f1: 0.4654
 epoch: 68, train_loss: 0.9482, test_loss: 0.9778, test_f1: 0.4609
 epoch: 69, train_loss: 0.9494, test_loss: 0.9787, test_f1: 0.4609
 epoch: 70, train_loss: 0.9376, test_loss: 0.9828, test_f1: 0.4666
 epoch: 71, train_loss: 0.9412, test_loss: 0.9900, test_f1: 0.4721
 epoch: 72, train_loss: 0.9418, test_loss: 0.9771, test_f1: 0.4786
 epoch: 73, train_loss: 0.9414, test_loss: 0.9657, test_f1: 0.4791
 epoch: 74, train_loss: 0.9428, test_loss: 0.9880, test_f1: 0.4648
 epoch: 75, train_loss: 0.9291, test_loss: 0.9945, test_f1: 0.4599
 epoch: 76, train_loss: 0.9411, test_loss: 0.9911, test_f1: 0.4684
 epoch: 77, train_loss: 0.9360, test_loss: 0.9836, test_f1: 0.4719
 epoch: 78, train_loss: 0.9269, test_loss: 0.9957, test_f1: 0.4759
 epoch: 79, train_loss: 0.9414, test_loss: 0.9957, test_f1: 0.4769
 epoch: 80, train_loss: 0.9334, test_loss: 0.9833, test_f1: 0.4733
 epoch: 81, train_loss: 0.9272, test_loss: 1.0059, test_f1: 0.4647
 epoch: 82, train_loss: 0.9309, test_loss: 0.9966, test_f1: 0.4681
 epoch: 83, train_loss: 0.9155, test_loss: 1.0042, test_f1: 0.4732
 epoch: 84, train_loss: 0.9262, test_loss: 1.0173, test_f1: 0.4698
 epoch: 85, train_loss: 0.9205, test_loss: 0.9976, test_f1: 0.4651
 epoch: 86, train_loss: 0.9128, test_loss: 0.9801, test_f1: 0.4811
 epoch: 87, train_loss: 0.9225, test_loss: 0.9771, test_f1: 0.4741
 epoch: 88, train_loss: 0.9138, test_loss: 0.9843, test_f1: 0.4714
 epoch: 89, train_loss: 0.9181, test_loss: 0.9903, test_f1: 0.4773
 epoch: 90, train_loss: 0.9224, test_loss: 1.0030, test_f1: 0.4706
 epoch: 91, train_loss: 0.9140, test_loss: 1.0028, test_f1: 0.4712
 epoch: 92, train_loss: 0.9124, test_loss: 0.9861, test_f1: 0.4869
 epoch: 93, train_loss: 0.9145, test_loss: 1.0045, test_f1: 0.4740
 epoch: 94, train_loss: 0.8996, test_loss: 0.9770, test_f1: 0.4790
 epoch: 95, train_loss: 0.9164, test_loss: 0.9914, test_f1: 0.4809
 epoch: 96, train_loss: 0.9116, test_loss: 0.9931, test_f1: 0.4851
 epoch: 97, train_loss: 0.9087, test_loss: 0.9702, test_f1: 0.4949
 epoch: 98, train_loss: 0.8910, test_loss: 0.9930, test_f1: 0.4793
 epoch: 99, train_loss: 0.9136, test_loss: 1.0086, test_f1: 0.4678
##################ITERATION #9 ****************************************
 epoch: 0, train_loss: 1.6386, test_loss: 1.3174, test_f1: 0.2274
 epoch: 1, train_loss: 1.3478, test_loss: 1.2771, test_f1: 0.2274
 epoch: 2, train_loss: 1.2937, test_loss: 1.2494, test_f1: 0.2378
 epoch: 3, train_loss: 1.2840, test_loss: 1.2285, test_f1: 0.2677
 epoch: 4, train_loss: 1.2667, test_loss: 1.2092, test_f1: 0.2840
 epoch: 5, train_loss: 1.2437, test_loss: 1.1970, test_f1: 0.3093
 epoch: 6, train_loss: 1.2423, test_loss: 1.1882, test_f1: 0.3420
 epoch: 7, train_loss: 1.2333, test_loss: 1.1874, test_f1: 0.3389
 epoch: 8, train_loss: 1.2222, test_loss: 1.1733, test_f1: 0.3662
 epoch: 9, train_loss: 1.2226, test_loss: 1.1604, test_f1: 0.3689
 epoch: 10, train_loss: 1.2111, test_loss: 1.1549, test_f1: 0.3845
 epoch: 11, train_loss: 1.1977, test_loss: 1.1461, test_f1: 0.3965
 epoch: 12, train_loss: 1.1931, test_loss: 1.1391, test_f1: 0.4008
 epoch: 13, train_loss: 1.1910, test_loss: 1.1350, test_f1: 0.4055
 epoch: 14, train_loss: 1.1735, test_loss: 1.1243, test_f1: 0.4055
 epoch: 15, train_loss: 1.1712, test_loss: 1.1168, test_f1: 0.4232
 epoch: 16, train_loss: 1.1599, test_loss: 1.1144, test_f1: 0.4229
 epoch: 17, train_loss: 1.1523, test_loss: 1.1058, test_f1: 0.4314
 epoch: 18, train_loss: 1.1492, test_loss: 1.0960, test_f1: 0.4340
 epoch: 19, train_loss: 1.1422, test_loss: 1.0943, test_f1: 0.4344
 epoch: 20, train_loss: 1.1356, test_loss: 1.0900, test_f1: 0.4424
 epoch: 21, train_loss: 1.1308, test_loss: 1.0795, test_f1: 0.4407
 epoch: 22, train_loss: 1.1341, test_loss: 1.0696, test_f1: 0.4396
 epoch: 23, train_loss: 1.1158, test_loss: 1.0652, test_f1: 0.4456
 epoch: 24, train_loss: 1.1176, test_loss: 1.0639, test_f1: 0.4411
 epoch: 25, train_loss: 1.1052, test_loss: 1.0500, test_f1: 0.4511
 epoch: 26, train_loss: 1.1016, test_loss: 1.0444, test_f1: 0.4528
 epoch: 27, train_loss: 1.0911, test_loss: 1.0421, test_f1: 0.4455
 epoch: 28, train_loss: 1.0821, test_loss: 1.0354, test_f1: 0.4543
 epoch: 29, train_loss: 1.0826, test_loss: 1.0279, test_f1: 0.4457
 epoch: 30, train_loss: 1.0768, test_loss: 1.0265, test_f1: 0.4603
 epoch: 31, train_loss: 1.0734, test_loss: 1.0172, test_f1: 0.4572
 epoch: 32, train_loss: 1.0645, test_loss: 1.0142, test_f1: 0.4620
 epoch: 33, train_loss: 1.0737, test_loss: 1.0057, test_f1: 0.4514
 epoch: 34, train_loss: 1.0497, test_loss: 1.0027, test_f1: 0.4677
 epoch: 35, train_loss: 1.0594, test_loss: 0.9925, test_f1: 0.4589
 epoch: 36, train_loss: 1.0483, test_loss: 0.9821, test_f1: 0.4695
 epoch: 37, train_loss: 1.0468, test_loss: 0.9918, test_f1: 0.4657
 epoch: 38, train_loss: 1.0446, test_loss: 0.9781, test_f1: 0.4574
 epoch: 39, train_loss: 1.0315, test_loss: 0.9805, test_f1: 0.4739
 epoch: 40, train_loss: 1.0335, test_loss: 0.9745, test_f1: 0.4624
 epoch: 41, train_loss: 1.0339, test_loss: 0.9628, test_f1: 0.4671
 epoch: 42, train_loss: 1.0311, test_loss: 0.9593, test_f1: 0.4861
 epoch: 43, train_loss: 1.0189, test_loss: 0.9605, test_f1: 0.4824
 epoch: 44, train_loss: 1.0086, test_loss: 0.9530, test_f1: 0.4667
 epoch: 45, train_loss: 1.0096, test_loss: 0.9554, test_f1: 0.4819
 epoch: 46, train_loss: 0.9984, test_loss: 0.9554, test_f1: 0.4650
 epoch: 47, train_loss: 1.0016, test_loss: 0.9465, test_f1: 0.4610
 epoch: 48, train_loss: 1.0098, test_loss: 0.9503, test_f1: 0.4760
 epoch: 49, train_loss: 1.0042, test_loss: 0.9432, test_f1: 0.4841
 epoch: 50, train_loss: 0.9983, test_loss: 0.9311, test_f1: 0.4744
 epoch: 51, train_loss: 0.9857, test_loss: 0.9363, test_f1: 0.4788
 epoch: 52, train_loss: 0.9950, test_loss: 0.9426, test_f1: 0.4697
 epoch: 53, train_loss: 0.9876, test_loss: 0.9378, test_f1: 0.4796
 epoch: 54, train_loss: 0.9840, test_loss: 0.9419, test_f1: 0.4680
 epoch: 55, train_loss: 0.9746, test_loss: 0.9338, test_f1: 0.4749
 epoch: 56, train_loss: 0.9823, test_loss: 0.9373, test_f1: 0.4864
 epoch: 57, train_loss: 0.9834, test_loss: 0.9384, test_f1: 0.4713
 epoch: 58, train_loss: 0.9716, test_loss: 0.9402, test_f1: 0.4690
 epoch: 59, train_loss: 0.9771, test_loss: 0.9341, test_f1: 0.4675
 epoch: 60, train_loss: 0.9679, test_loss: 0.9348, test_f1: 0.4778
 epoch: 61, train_loss: 0.9605, test_loss: 0.9329, test_f1: 0.4683
 epoch: 62, train_loss: 0.9685, test_loss: 0.9320, test_f1: 0.4696
 epoch: 63, train_loss: 0.9725, test_loss: 0.9339, test_f1: 0.4738
 epoch: 64, train_loss: 0.9711, test_loss: 0.9249, test_f1: 0.4804
 epoch: 65, train_loss: 0.9581, test_loss: 0.9379, test_f1: 0.4731
 epoch: 66, train_loss: 0.9598, test_loss: 0.9316, test_f1: 0.4835
 epoch: 67, train_loss: 0.9590, test_loss: 0.9300, test_f1: 0.4829
 epoch: 68, train_loss: 0.9662, test_loss: 0.9326, test_f1: 0.4717
 epoch: 69, train_loss: 0.9525, test_loss: 0.9393, test_f1: 0.4711
 epoch: 70, train_loss: 0.9510, test_loss: 0.9394, test_f1: 0.4695
 epoch: 71, train_loss: 0.9572, test_loss: 0.9360, test_f1: 0.4742
 epoch: 72, train_loss: 0.9537, test_loss: 0.9456, test_f1: 0.4706
 epoch: 73, train_loss: 0.9460, test_loss: 0.9492, test_f1: 0.4630
 epoch: 74, train_loss: 0.9521, test_loss: 0.9440, test_f1: 0.4779
 epoch: 75, train_loss: 0.9527, test_loss: 0.9507, test_f1: 0.4587
 epoch: 76, train_loss: 0.9469, test_loss: 0.9497, test_f1: 0.4591
 epoch: 77, train_loss: 0.9467, test_loss: 0.9470, test_f1: 0.4747
 epoch: 78, train_loss: 0.9490, test_loss: 0.9366, test_f1: 0.4778
 epoch: 79, train_loss: 0.9396, test_loss: 0.9354, test_f1: 0.4808
 epoch: 80, train_loss: 0.9348, test_loss: 0.9301, test_f1: 0.4779
 epoch: 81, train_loss: 0.9373, test_loss: 0.9358, test_f1: 0.4756
 epoch: 82, train_loss: 0.9346, test_loss: 0.9305, test_f1: 0.4821
 epoch: 83, train_loss: 0.9418, test_loss: 0.9423, test_f1: 0.4695
 epoch: 84, train_loss: 0.9445, test_loss: 0.9331, test_f1: 0.4790
 epoch: 85, train_loss: 0.9355, test_loss: 0.9432, test_f1: 0.4680
 epoch: 86, train_loss: 0.9247, test_loss: 0.9409, test_f1: 0.4731
 epoch: 87, train_loss: 0.9269, test_loss: 0.9497, test_f1: 0.4698
 epoch: 88, train_loss: 0.9321, test_loss: 0.9415, test_f1: 0.4687
 epoch: 89, train_loss: 0.9231, test_loss: 0.9497, test_f1: 0.4803
 epoch: 90, train_loss: 0.9317, test_loss: 0.9317, test_f1: 0.4708
 epoch: 91, train_loss: 0.9286, test_loss: 0.9494, test_f1: 0.4585
 epoch: 92, train_loss: 0.9201, test_loss: 0.9300, test_f1: 0.4804
 epoch: 93, train_loss: 0.9316, test_loss: 0.9523, test_f1: 0.4797
 epoch: 94, train_loss: 0.9133, test_loss: 0.9338, test_f1: 0.4791
 epoch: 95, train_loss: 0.9249, test_loss: 0.9372, test_f1: 0.4812
 epoch: 96, train_loss: 0.9290, test_loss: 0.9452, test_f1: 0.4699
 epoch: 97, train_loss: 0.9260, test_loss: 0.9596, test_f1: 0.4706
 epoch: 98, train_loss: 0.9270, test_loss: 0.9558, test_f1: 0.4714
 epoch: 99, train_loss: 0.9128, test_loss: 0.9563, test_f1: 0.4717

Training completed in 372.75 seconds
Best F1: 0.5458 at epoch 72
Mean F1 across iterations: 0.5013  0.0251
========================FINAL RESULTS================================
FEGIN weighted F1: 0.5458  0.0251
python main.py --data ltspice_examples --representation component_component --model FEGIN --layers 3 --hiddens 16 --batch_size 256 --lr 0.001 --emb_size 128 --epochs 100 --save_appendix component_component_L3_H16_BS256_LR0.001_E128 --no_val
-----



STDERR:
  File "main.py", line 370, in <module>
    main()
  File "main.py", line 254, in main
    dataset = dataset_class(
  File "/home/philip/projects/ltspice_examples_code_repo/Circuit-Completion-Using-GNNs/component_classification_with_link_prediction_head/evaluation/FEGIN/kernel/circuit_datasets.py", line 15, in __init__
    self.data, self.slices = torch.load(self.processed_paths[0])
  File "/home/philip/.local/lib/python3.8/site-packages/torch/serialization.py", line 1040, in load
    warnings.warn(
  File "/usr/lib/python3.8/warnings.py", line 109, in _showwarnmsg
    sw(msg.message, msg.category, msg.filename, msg.lineno,
  File "main.py", line 47, in warn_with_traceback
    traceback.print_stack(file=log)
/home/philip/projects/ltspice_examples_code_repo/Circuit-Completion-Using-GNNs/component_classification_with_link_prediction_head/evaluation/FEGIN/kernel/circuit_datasets.py:15: FutureWarning: You are using `torch.load` with `weights_only=False` (the current default value), which uses the default pickle module implicitly. It is possible to construct malicious pickle data which will execute arbitrary code during unpickling (See https://github.com/pytorch/pytorch/blob/main/SECURITY.md#untrusted-models for more details). In a future release, the default value for `weights_only` will be flipped to `True`. This limits the functions that could be executed during unpickling. Arbitrary objects will no longer be allowed to be loaded via this mode unless they are explicitly allowlisted by the user via `torch.serialization.add_safe_globals`. We recommend you start setting `weights_only=True` for any use case where you don't have full control of the loaded file. Please open an issue on GitHub for any issues related to this experimental feature.
  self.data, self.slices = torch.load(self.processed_paths[0])
