STDOUT:
Results will be saved in /home/philip/projects/ltspice_examples_code_repo/Circuit-Completion-Using-GNNs/component_classification_with_link_prediction_head/evaluation/FEGIN/results/model_FEGIN_dataset_ltspice_examples
Command line input: python main.py --data ltspice_examples --representation component_net --model FEGIN --layers 6 --hiddens 128 --batch_size 128 --lr 0.001 --emb_size 128 --epochs 100 --save_appendix component_net_L6_H128_BS128_LR0.001_E128 --no_val
 is saved.
-----
ltspice_examples - FEGIN
Using 6 layers, 128 hidden units, h = 2
Loading component_net representation dataset
ENTERED
Training FEGIN on component_net representation
Train: 3558, Test: 846
##################ITERATION #0 ****************************************
 epoch: 0, train_loss: 1.2176, test_loss: 1.2855, test_f1: 0.3448
 epoch: 1, train_loss: 1.0354, test_loss: 1.0050, test_f1: 0.4877
 epoch: 2, train_loss: 0.9728, test_loss: 0.9378, test_f1: 0.5387
 epoch: 3, train_loss: 0.9233, test_loss: 0.9952, test_f1: 0.4966
 epoch: 4, train_loss: 0.9072, test_loss: 0.9664, test_f1: 0.5038
 epoch: 5, train_loss: 0.8813, test_loss: 0.9209, test_f1: 0.5238
 epoch: 6, train_loss: 0.8590, test_loss: 0.9054, test_f1: 0.5615
 epoch: 7, train_loss: 0.8588, test_loss: 1.0659, test_f1: 0.5211
 epoch: 8, train_loss: 0.8288, test_loss: 0.8499, test_f1: 0.5555
 epoch: 9, train_loss: 0.8081, test_loss: 0.8577, test_f1: 0.5666
 epoch: 10, train_loss: 0.8030, test_loss: 1.0244, test_f1: 0.5474
 epoch: 11, train_loss: 0.7797, test_loss: 1.1711, test_f1: 0.5176
 epoch: 12, train_loss: 0.7693, test_loss: 0.9795, test_f1: 0.5674
 epoch: 13, train_loss: 0.7567, test_loss: 0.8769, test_f1: 0.6013
 epoch: 14, train_loss: 0.7526, test_loss: 0.9923, test_f1: 0.6138
 epoch: 15, train_loss: 0.7352, test_loss: 0.9702, test_f1: 0.5926
 epoch: 16, train_loss: 0.7104, test_loss: 0.9573, test_f1: 0.6231
 epoch: 17, train_loss: 0.6904, test_loss: 0.9902, test_f1: 0.5780
 epoch: 18, train_loss: 0.7075, test_loss: 0.9616, test_f1: 0.5707
 epoch: 19, train_loss: 0.6882, test_loss: 0.9775, test_f1: 0.5922
 epoch: 20, train_loss: 0.6683, test_loss: 0.9160, test_f1: 0.6134
 epoch: 21, train_loss: 0.6600, test_loss: 0.9905, test_f1: 0.5947
 epoch: 22, train_loss: 0.6469, test_loss: 1.0035, test_f1: 0.5638
 epoch: 23, train_loss: 0.6519, test_loss: 1.0431, test_f1: 0.5854
 epoch: 24, train_loss: 0.6432, test_loss: 0.9213, test_f1: 0.6289
 epoch: 25, train_loss: 0.6181, test_loss: 1.0884, test_f1: 0.5742
 epoch: 26, train_loss: 0.6390, test_loss: 1.0075, test_f1: 0.5866
 epoch: 27, train_loss: 0.6112, test_loss: 0.9658, test_f1: 0.6432
 epoch: 28, train_loss: 0.5858, test_loss: 1.0397, test_f1: 0.6169
 epoch: 29, train_loss: 0.5696, test_loss: 1.0372, test_f1: 0.6287
 epoch: 30, train_loss: 0.5678, test_loss: 1.0588, test_f1: 0.6202
 epoch: 31, train_loss: 0.5512, test_loss: 1.1691, test_f1: 0.6177
 epoch: 32, train_loss: 0.5514, test_loss: 1.0878, test_f1: 0.5832
 epoch: 33, train_loss: 0.5462, test_loss: 0.9694, test_f1: 0.6416
 epoch: 34, train_loss: 0.5049, test_loss: 1.1151, test_f1: 0.6110
 epoch: 35, train_loss: 0.4973, test_loss: 1.2407, test_f1: 0.5864
 epoch: 36, train_loss: 0.5060, test_loss: 1.2292, test_f1: 0.5781
 epoch: 37, train_loss: 0.4971, test_loss: 1.5550, test_f1: 0.5527
 epoch: 38, train_loss: 0.4787, test_loss: 1.2198, test_f1: 0.6286
 epoch: 39, train_loss: 0.4708, test_loss: 1.0820, test_f1: 0.6224
 epoch: 40, train_loss: 0.4585, test_loss: 1.2934, test_f1: 0.6129
 epoch: 41, train_loss: 0.4393, test_loss: 1.3709, test_f1: 0.5985
 epoch: 42, train_loss: 0.4639, test_loss: 1.2349, test_f1: 0.6179
 epoch: 43, train_loss: 0.4562, test_loss: 1.2057, test_f1: 0.6286
 epoch: 44, train_loss: 0.4410, test_loss: 1.3769, test_f1: 0.6220
 epoch: 45, train_loss: 0.4343, test_loss: 1.4246, test_f1: 0.5953
 epoch: 46, train_loss: 0.4427, test_loss: 1.2370, test_f1: 0.6596
 epoch: 47, train_loss: 0.4327, test_loss: 1.4491, test_f1: 0.5896
 epoch: 48, train_loss: 0.4158, test_loss: 1.3508, test_f1: 0.6123
 epoch: 49, train_loss: 0.3869, test_loss: 1.3422, test_f1: 0.6091
 epoch: 50, train_loss: 0.3795, test_loss: 1.3485, test_f1: 0.6427
 epoch: 51, train_loss: 0.3373, test_loss: 1.4953, test_f1: 0.6148
 epoch: 52, train_loss: 0.2971, test_loss: 1.5700, test_f1: 0.6325
 epoch: 53, train_loss: 0.2851, test_loss: 1.5391, test_f1: 0.6282
 epoch: 54, train_loss: 0.2761, test_loss: 1.6080, test_f1: 0.6413
 epoch: 55, train_loss: 0.2600, test_loss: 1.6631, test_f1: 0.6469
 epoch: 56, train_loss: 0.2702, test_loss: 1.7778, test_f1: 0.6393
 epoch: 57, train_loss: 0.2696, test_loss: 1.6798, test_f1: 0.6288
 epoch: 58, train_loss: 0.2481, test_loss: 1.8269, test_f1: 0.6236
 epoch: 59, train_loss: 0.2586, test_loss: 1.7668, test_f1: 0.6249
 epoch: 60, train_loss: 0.2601, test_loss: 1.7598, test_f1: 0.6411
 epoch: 61, train_loss: 0.2553, test_loss: 1.7770, test_f1: 0.6191
 epoch: 62, train_loss: 0.2386, test_loss: 1.7522, test_f1: 0.6279
 epoch: 63, train_loss: 0.2564, test_loss: 1.8293, test_f1: 0.6351
 epoch: 64, train_loss: 0.2327, test_loss: 2.0260, test_f1: 0.6320
 epoch: 65, train_loss: 0.2251, test_loss: 1.7768, test_f1: 0.6261
 epoch: 66, train_loss: 0.2355, test_loss: 1.9253, test_f1: 0.6305
 epoch: 67, train_loss: 0.2391, test_loss: 1.8671, test_f1: 0.6288
 epoch: 68, train_loss: 0.2566, test_loss: 1.8077, test_f1: 0.6429
 epoch: 69, train_loss: 0.2218, test_loss: 1.9138, test_f1: 0.6460
 epoch: 70, train_loss: 0.2104, test_loss: 2.0242, test_f1: 0.6262
 epoch: 71, train_loss: 0.2024, test_loss: 2.1787, test_f1: 0.6166
 epoch: 72, train_loss: 0.2208, test_loss: 2.1561, test_f1: 0.6189
 epoch: 73, train_loss: 0.2331, test_loss: 2.1471, test_f1: 0.6231
 epoch: 74, train_loss: 0.1995, test_loss: 2.1606, test_f1: 0.6123
 epoch: 75, train_loss: 0.1960, test_loss: 2.1384, test_f1: 0.6333
 epoch: 76, train_loss: 0.2120, test_loss: 2.0748, test_f1: 0.5978
 epoch: 77, train_loss: 0.2162, test_loss: 2.1972, test_f1: 0.6117
 epoch: 78, train_loss: 0.2034, test_loss: 2.0798, test_f1: 0.6347
 epoch: 79, train_loss: 0.1890, test_loss: 2.1218, test_f1: 0.6374
 epoch: 80, train_loss: 0.1849, test_loss: 2.3194, test_f1: 0.6101
 epoch: 81, train_loss: 0.1789, test_loss: 2.1375, test_f1: 0.6284
 epoch: 82, train_loss: 0.1929, test_loss: 2.2264, test_f1: 0.6101
 epoch: 83, train_loss: 0.1797, test_loss: 2.3248, test_f1: 0.6388
 epoch: 84, train_loss: 0.1847, test_loss: 2.3654, test_f1: 0.6434
 epoch: 85, train_loss: 0.1845, test_loss: 2.3299, test_f1: 0.6095
 epoch: 86, train_loss: 0.1893, test_loss: 2.2618, test_f1: 0.6067
 epoch: 87, train_loss: 0.1707, test_loss: 2.3230, test_f1: 0.6106
 epoch: 88, train_loss: 0.1707, test_loss: 2.4875, test_f1: 0.6212
 epoch: 89, train_loss: 0.1690, test_loss: 2.4302, test_f1: 0.6298
 epoch: 90, train_loss: 0.1757, test_loss: 2.4532, test_f1: 0.6105
 epoch: 91, train_loss: 0.1744, test_loss: 2.5705, test_f1: 0.6458
 epoch: 92, train_loss: 0.1720, test_loss: 2.3514, test_f1: 0.6025
 epoch: 93, train_loss: 0.1716, test_loss: 2.2599, test_f1: 0.6317
 epoch: 94, train_loss: 0.1861, test_loss: 2.4991, test_f1: 0.6332
 epoch: 95, train_loss: 0.1570, test_loss: 2.5055, test_f1: 0.6253
 epoch: 96, train_loss: 0.1493, test_loss: 2.4612, test_f1: 0.6412
 epoch: 97, train_loss: 0.1466, test_loss: 2.5166, test_f1: 0.6445
 epoch: 98, train_loss: 0.1570, test_loss: 2.7172, test_f1: 0.6052
 epoch: 99, train_loss: 0.1615, test_loss: 2.7098, test_f1: 0.6079
##################ITERATION #1 ****************************************
 epoch: 0, train_loss: 1.1665, test_loss: 1.1764, test_f1: 0.3251
 epoch: 1, train_loss: 0.9964, test_loss: 0.9704, test_f1: 0.5062
 epoch: 2, train_loss: 0.9298, test_loss: 0.9771, test_f1: 0.4999
 epoch: 3, train_loss: 0.9185, test_loss: 0.9353, test_f1: 0.5103
 epoch: 4, train_loss: 0.8832, test_loss: 0.9034, test_f1: 0.5574
 epoch: 5, train_loss: 0.8706, test_loss: 0.8699, test_f1: 0.5638
 epoch: 6, train_loss: 0.8457, test_loss: 0.8916, test_f1: 0.5686
 epoch: 7, train_loss: 0.8209, test_loss: 1.0244, test_f1: 0.5015
 epoch: 8, train_loss: 0.8107, test_loss: 0.9078, test_f1: 0.5877
 epoch: 9, train_loss: 0.7826, test_loss: 1.0115, test_f1: 0.5380
 epoch: 10, train_loss: 0.7773, test_loss: 0.9264, test_f1: 0.5854
 epoch: 11, train_loss: 0.7574, test_loss: 0.9182, test_f1: 0.5768
 epoch: 12, train_loss: 0.7427, test_loss: 0.9992, test_f1: 0.5574
 epoch: 13, train_loss: 0.7347, test_loss: 0.9350, test_f1: 0.5472
 epoch: 14, train_loss: 0.7352, test_loss: 0.9928, test_f1: 0.5445
 epoch: 15, train_loss: 0.7220, test_loss: 0.9693, test_f1: 0.5829
 epoch: 16, train_loss: 0.6985, test_loss: 0.9561, test_f1: 0.6158
 epoch: 17, train_loss: 0.6816, test_loss: 0.9997, test_f1: 0.6063
 epoch: 18, train_loss: 0.6587, test_loss: 0.9941, test_f1: 0.5945
 epoch: 19, train_loss: 0.6600, test_loss: 1.0278, test_f1: 0.6153
 epoch: 20, train_loss: 0.6508, test_loss: 0.9454, test_f1: 0.6264
 epoch: 21, train_loss: 0.6324, test_loss: 0.9725, test_f1: 0.6247
 epoch: 22, train_loss: 0.6461, test_loss: 0.9407, test_f1: 0.6166
 epoch: 23, train_loss: 0.6202, test_loss: 1.0352, test_f1: 0.6034
 epoch: 24, train_loss: 0.6379, test_loss: 1.0095, test_f1: 0.6126
 epoch: 25, train_loss: 0.6200, test_loss: 0.9730, test_f1: 0.6379
 epoch: 26, train_loss: 0.5974, test_loss: 1.0552, test_f1: 0.6296
 epoch: 27, train_loss: 0.5653, test_loss: 1.0189, test_f1: 0.6406
 epoch: 28, train_loss: 0.5689, test_loss: 1.0920, test_f1: 0.6330
 epoch: 29, train_loss: 0.5629, test_loss: 1.0348, test_f1: 0.6523
 epoch: 30, train_loss: 0.5434, test_loss: 1.0847, test_f1: 0.6441
 epoch: 31, train_loss: 0.5146, test_loss: 1.0404, test_f1: 0.6593
 epoch: 32, train_loss: 0.5180, test_loss: 1.1821, test_f1: 0.6040
 epoch: 33, train_loss: 0.5075, test_loss: 1.0911, test_f1: 0.6631
 epoch: 34, train_loss: 0.4842, test_loss: 1.1268, test_f1: 0.6460
 epoch: 35, train_loss: 0.4851, test_loss: 1.2475, test_f1: 0.6184
 epoch: 36, train_loss: 0.5008, test_loss: 1.1822, test_f1: 0.6361
 epoch: 37, train_loss: 0.4738, test_loss: 1.1193, test_f1: 0.6743
 epoch: 38, train_loss: 0.4715, test_loss: 1.1945, test_f1: 0.6747
 epoch: 39, train_loss: 0.4673, test_loss: 1.0919, test_f1: 0.6565
 epoch: 40, train_loss: 0.4369, test_loss: 1.1453, test_f1: 0.6253
 epoch: 41, train_loss: 0.4230, test_loss: 1.2595, test_f1: 0.6064
 epoch: 42, train_loss: 0.4291, test_loss: 1.2068, test_f1: 0.6583
 epoch: 43, train_loss: 0.4220, test_loss: 1.1335, test_f1: 0.6377
 epoch: 44, train_loss: 0.4006, test_loss: 1.2098, test_f1: 0.6248
 epoch: 45, train_loss: 0.4006, test_loss: 1.2309, test_f1: 0.6616
 epoch: 46, train_loss: 0.3819, test_loss: 1.2591, test_f1: 0.6468
 epoch: 47, train_loss: 0.3946, test_loss: 1.3453, test_f1: 0.5933
 epoch: 48, train_loss: 0.3897, test_loss: 1.3836, test_f1: 0.6667
 epoch: 49, train_loss: 0.3781, test_loss: 1.3483, test_f1: 0.6309
 epoch: 50, train_loss: 0.3604, test_loss: 1.3944, test_f1: 0.5974
 epoch: 51, train_loss: 0.3330, test_loss: 1.4204, test_f1: 0.6550
 epoch: 52, train_loss: 0.2769, test_loss: 1.4116, test_f1: 0.6312
 epoch: 53, train_loss: 0.2753, test_loss: 1.4602, test_f1: 0.6629
 epoch: 54, train_loss: 0.2740, test_loss: 1.4350, test_f1: 0.6669
 epoch: 55, train_loss: 0.2691, test_loss: 1.4327, test_f1: 0.6685
 epoch: 56, train_loss: 0.2529, test_loss: 1.5906, test_f1: 0.6482
 epoch: 57, train_loss: 0.2554, test_loss: 1.6195, test_f1: 0.6566
 epoch: 58, train_loss: 0.2764, test_loss: 1.5365, test_f1: 0.6451
 epoch: 59, train_loss: 0.2393, test_loss: 1.6023, test_f1: 0.6369
 epoch: 60, train_loss: 0.2369, test_loss: 1.7785, test_f1: 0.6517
 epoch: 61, train_loss: 0.2276, test_loss: 1.6128, test_f1: 0.6626
 epoch: 62, train_loss: 0.2127, test_loss: 1.5808, test_f1: 0.6515
 epoch: 63, train_loss: 0.2257, test_loss: 1.6989, test_f1: 0.6481
 epoch: 64, train_loss: 0.2074, test_loss: 1.8747, test_f1: 0.6556
 epoch: 65, train_loss: 0.2296, test_loss: 1.7208, test_f1: 0.6525
 epoch: 66, train_loss: 0.2228, test_loss: 1.7092, test_f1: 0.6492
 epoch: 67, train_loss: 0.1991, test_loss: 2.0228, test_f1: 0.6210
 epoch: 68, train_loss: 0.2102, test_loss: 2.0029, test_f1: 0.6607
 epoch: 69, train_loss: 0.2040, test_loss: 1.8219, test_f1: 0.6631
 epoch: 70, train_loss: 0.2128, test_loss: 1.8823, test_f1: 0.6557
 epoch: 71, train_loss: 0.1844, test_loss: 1.9998, test_f1: 0.6485
 epoch: 72, train_loss: 0.1827, test_loss: 1.9695, test_f1: 0.6470
 epoch: 73, train_loss: 0.2058, test_loss: 1.9206, test_f1: 0.6326
 epoch: 74, train_loss: 0.1812, test_loss: 1.9934, test_f1: 0.6505
 epoch: 75, train_loss: 0.1935, test_loss: 2.0851, test_f1: 0.6454
 epoch: 76, train_loss: 0.1866, test_loss: 2.1353, test_f1: 0.6331
 epoch: 77, train_loss: 0.2041, test_loss: 2.0227, test_f1: 0.6452
 epoch: 78, train_loss: 0.1804, test_loss: 2.1501, test_f1: 0.6469
 epoch: 79, train_loss: 0.1820, test_loss: 2.0404, test_f1: 0.6218
 epoch: 80, train_loss: 0.1749, test_loss: 2.2334, test_f1: 0.6213
 epoch: 81, train_loss: 0.1636, test_loss: 2.1111, test_f1: 0.6402
 epoch: 82, train_loss: 0.1619, test_loss: 2.1874, test_f1: 0.6336
 epoch: 83, train_loss: 0.1796, test_loss: 2.2422, test_f1: 0.6441
 epoch: 84, train_loss: 0.1831, test_loss: 1.9919, test_f1: 0.6648
 epoch: 85, train_loss: 0.1635, test_loss: 2.1670, test_f1: 0.6272
 epoch: 86, train_loss: 0.1697, test_loss: 2.1041, test_f1: 0.6604
 epoch: 87, train_loss: 0.2036, test_loss: 2.0826, test_f1: 0.6508
 epoch: 88, train_loss: 0.1902, test_loss: 2.2100, test_f1: 0.6288
 epoch: 89, train_loss: 0.1750, test_loss: 1.9426, test_f1: 0.6388
 epoch: 90, train_loss: 0.1855, test_loss: 2.2187, test_f1: 0.6250
 epoch: 91, train_loss: 0.1897, test_loss: 2.0245, test_f1: 0.6530
 epoch: 92, train_loss: 0.1490, test_loss: 2.2683, test_f1: 0.6547
 epoch: 93, train_loss: 0.1454, test_loss: 2.0997, test_f1: 0.6779
 epoch: 94, train_loss: 0.1374, test_loss: 2.2754, test_f1: 0.6358
 epoch: 95, train_loss: 0.1462, test_loss: 2.1510, test_f1: 0.6627
 epoch: 96, train_loss: 0.1596, test_loss: 2.1497, test_f1: 0.6289
 epoch: 97, train_loss: 0.1555, test_loss: 2.2847, test_f1: 0.6419
 epoch: 98, train_loss: 0.1531, test_loss: 2.2251, test_f1: 0.6576
 epoch: 99, train_loss: 0.1515, test_loss: 2.3373, test_f1: 0.6292
##################ITERATION #2 ****************************************
 epoch: 0, train_loss: 1.2002, test_loss: 1.1774, test_f1: 0.3504
 epoch: 1, train_loss: 1.0360, test_loss: 0.9802, test_f1: 0.4786
 epoch: 2, train_loss: 0.9711, test_loss: 0.8996, test_f1: 0.4834
 epoch: 3, train_loss: 0.9306, test_loss: 0.9362, test_f1: 0.5021
 epoch: 4, train_loss: 0.9008, test_loss: 0.9214, test_f1: 0.5338
 epoch: 5, train_loss: 0.8850, test_loss: 0.8818, test_f1: 0.4981
 epoch: 6, train_loss: 0.8614, test_loss: 0.9603, test_f1: 0.5385
 epoch: 7, train_loss: 0.8546, test_loss: 0.8846, test_f1: 0.5374
 epoch: 8, train_loss: 0.8237, test_loss: 0.8647, test_f1: 0.5943
 epoch: 9, train_loss: 0.8180, test_loss: 0.9427, test_f1: 0.5703
 epoch: 10, train_loss: 0.8041, test_loss: 0.9836, test_f1: 0.5370
 epoch: 11, train_loss: 0.7982, test_loss: 0.9054, test_f1: 0.5610
 epoch: 12, train_loss: 0.7818, test_loss: 0.9449, test_f1: 0.5632
 epoch: 13, train_loss: 0.7705, test_loss: 0.9494, test_f1: 0.5967
 epoch: 14, train_loss: 0.7476, test_loss: 0.9869, test_f1: 0.5492
 epoch: 15, train_loss: 0.7528, test_loss: 0.8838, test_f1: 0.5862
 epoch: 16, train_loss: 0.7271, test_loss: 0.9579, test_f1: 0.5651
 epoch: 17, train_loss: 0.7205, test_loss: 0.8885, test_f1: 0.5920
 epoch: 18, train_loss: 0.6960, test_loss: 1.0017, test_f1: 0.6196
 epoch: 19, train_loss: 0.7083, test_loss: 0.9372, test_f1: 0.6107
 epoch: 20, train_loss: 0.6933, test_loss: 0.9476, test_f1: 0.5581
 epoch: 21, train_loss: 0.6711, test_loss: 1.0512, test_f1: 0.5393
 epoch: 22, train_loss: 0.6771, test_loss: 0.9536, test_f1: 0.6031
 epoch: 23, train_loss: 0.6975, test_loss: 0.9623, test_f1: 0.6032
 epoch: 24, train_loss: 0.6735, test_loss: 0.9722, test_f1: 0.5813
 epoch: 25, train_loss: 0.6514, test_loss: 0.9122, test_f1: 0.6292
 epoch: 26, train_loss: 0.6353, test_loss: 0.9348, test_f1: 0.6384
 epoch: 27, train_loss: 0.6414, test_loss: 1.0357, test_f1: 0.5762
 epoch: 28, train_loss: 0.6402, test_loss: 0.9422, test_f1: 0.5999
 epoch: 29, train_loss: 0.6178, test_loss: 0.8769, test_f1: 0.6493
 epoch: 30, train_loss: 0.6096, test_loss: 0.9001, test_f1: 0.6460
 epoch: 31, train_loss: 0.5975, test_loss: 1.0167, test_f1: 0.5930
 epoch: 32, train_loss: 0.5949, test_loss: 1.0172, test_f1: 0.6183
 epoch: 33, train_loss: 0.5804, test_loss: 1.0234, test_f1: 0.6452
 epoch: 34, train_loss: 0.5654, test_loss: 1.0178, test_f1: 0.6395
 epoch: 35, train_loss: 0.5577, test_loss: 1.0806, test_f1: 0.6066
 epoch: 36, train_loss: 0.5519, test_loss: 0.9974, test_f1: 0.6510
 epoch: 37, train_loss: 0.5417, test_loss: 1.0147, test_f1: 0.6307
 epoch: 38, train_loss: 0.5428, test_loss: 1.1685, test_f1: 0.6057
 epoch: 39, train_loss: 0.5227, test_loss: 1.1148, test_f1: 0.6462
 epoch: 40, train_loss: 0.5144, test_loss: 1.0010, test_f1: 0.6583
 epoch: 41, train_loss: 0.5179, test_loss: 1.0322, test_f1: 0.6270
 epoch: 42, train_loss: 0.5392, test_loss: 1.1136, test_f1: 0.6514
 epoch: 43, train_loss: 0.4791, test_loss: 1.1782, test_f1: 0.6333
 epoch: 44, train_loss: 0.4974, test_loss: 1.1366, test_f1: 0.6566
 epoch: 45, train_loss: 0.4909, test_loss: 1.1160, test_f1: 0.6167
 epoch: 46, train_loss: 0.4903, test_loss: 1.1555, test_f1: 0.6595
 epoch: 47, train_loss: 0.4894, test_loss: 1.0969, test_f1: 0.6296
 epoch: 48, train_loss: 0.4514, test_loss: 1.1427, test_f1: 0.6609
 epoch: 49, train_loss: 0.4853, test_loss: 1.1107, test_f1: 0.6307
 epoch: 50, train_loss: 0.4655, test_loss: 1.1379, test_f1: 0.6395
 epoch: 51, train_loss: 0.4130, test_loss: 1.2430, test_f1: 0.6528
 epoch: 52, train_loss: 0.3846, test_loss: 1.3114, test_f1: 0.6481
 epoch: 53, train_loss: 0.3583, test_loss: 1.3274, test_f1: 0.6484
 epoch: 54, train_loss: 0.3402, test_loss: 1.3495, test_f1: 0.6583
 epoch: 55, train_loss: 0.3458, test_loss: 1.3042, test_f1: 0.6428
 epoch: 56, train_loss: 0.3385, test_loss: 1.3877, test_f1: 0.6520
 epoch: 57, train_loss: 0.3418, test_loss: 1.3683, test_f1: 0.6474
 epoch: 58, train_loss: 0.3500, test_loss: 1.2898, test_f1: 0.6868
 epoch: 59, train_loss: 0.3257, test_loss: 1.3477, test_f1: 0.6599
 epoch: 60, train_loss: 0.3125, test_loss: 1.4106, test_f1: 0.6594
 epoch: 61, train_loss: 0.3188, test_loss: 1.5254, test_f1: 0.6570
 epoch: 62, train_loss: 0.3016, test_loss: 1.5278, test_f1: 0.6588
 epoch: 63, train_loss: 0.2944, test_loss: 1.5089, test_f1: 0.6843
 epoch: 64, train_loss: 0.2933, test_loss: 1.5582, test_f1: 0.6410
 epoch: 65, train_loss: 0.2854, test_loss: 1.5707, test_f1: 0.6567
 epoch: 66, train_loss: 0.2737, test_loss: 1.6915, test_f1: 0.6517
 epoch: 67, train_loss: 0.2822, test_loss: 1.5142, test_f1: 0.6507
 epoch: 68, train_loss: 0.2920, test_loss: 1.5179, test_f1: 0.6632
 epoch: 69, train_loss: 0.2725, test_loss: 1.5372, test_f1: 0.6818
 epoch: 70, train_loss: 0.2651, test_loss: 1.5525, test_f1: 0.6584
 epoch: 71, train_loss: 0.2674, test_loss: 1.6073, test_f1: 0.6550
 epoch: 72, train_loss: 0.2708, test_loss: 1.5090, test_f1: 0.6706
 epoch: 73, train_loss: 0.2816, test_loss: 1.6350, test_f1: 0.6507
 epoch: 74, train_loss: 0.2621, test_loss: 1.6068, test_f1: 0.6871
 epoch: 75, train_loss: 0.2575, test_loss: 1.6695, test_f1: 0.6828
 epoch: 76, train_loss: 0.2541, test_loss: 1.6380, test_f1: 0.6775
 epoch: 77, train_loss: 0.2510, test_loss: 1.6459, test_f1: 0.6601
 epoch: 78, train_loss: 0.2588, test_loss: 1.7093, test_f1: 0.6677
 epoch: 79, train_loss: 0.2573, test_loss: 1.6845, test_f1: 0.6606
 epoch: 80, train_loss: 0.2681, test_loss: 1.5188, test_f1: 0.6895
 epoch: 81, train_loss: 0.2321, test_loss: 1.6759, test_f1: 0.6530
 epoch: 82, train_loss: 0.2273, test_loss: 1.6892, test_f1: 0.6520
 epoch: 83, train_loss: 0.2162, test_loss: 1.7206, test_f1: 0.6630
 epoch: 84, train_loss: 0.2250, test_loss: 1.7685, test_f1: 0.6781
 epoch: 85, train_loss: 0.2123, test_loss: 1.8525, test_f1: 0.6512
 epoch: 86, train_loss: 0.2209, test_loss: 1.7674, test_f1: 0.6843
 epoch: 87, train_loss: 0.2292, test_loss: 1.9462, test_f1: 0.6300
 epoch: 88, train_loss: 0.2135, test_loss: 1.9570, test_f1: 0.6352
 epoch: 89, train_loss: 0.2232, test_loss: 1.9661, test_f1: 0.6586
 epoch: 90, train_loss: 0.2429, test_loss: 1.8792, test_f1: 0.6791
 epoch: 91, train_loss: 0.2351, test_loss: 1.7011, test_f1: 0.6727
 epoch: 92, train_loss: 0.2273, test_loss: 1.8143, test_f1: 0.6568
 epoch: 93, train_loss: 0.1946, test_loss: 1.8693, test_f1: 0.6348
 epoch: 94, train_loss: 0.2266, test_loss: 1.6198, test_f1: 0.6887
 epoch: 95, train_loss: 0.2109, test_loss: 1.9949, test_f1: 0.6346
 epoch: 96, train_loss: 0.2062, test_loss: 2.0150, test_f1: 0.6547
 epoch: 97, train_loss: 0.2015, test_loss: 2.0424, test_f1: 0.6471
 epoch: 98, train_loss: 0.2210, test_loss: 1.8901, test_f1: 0.6689
 epoch: 99, train_loss: 0.2138, test_loss: 1.7744, test_f1: 0.6427
##################ITERATION #3 ****************************************
 epoch: 0, train_loss: 1.2173, test_loss: 1.1396, test_f1: 0.3499
 epoch: 1, train_loss: 1.0060, test_loss: 0.9736, test_f1: 0.4738
 epoch: 2, train_loss: 0.9491, test_loss: 0.9294, test_f1: 0.5333
 epoch: 3, train_loss: 0.9065, test_loss: 0.9497, test_f1: 0.4928
 epoch: 4, train_loss: 0.8939, test_loss: 1.0105, test_f1: 0.5134
 epoch: 5, train_loss: 0.8859, test_loss: 0.9325, test_f1: 0.5422
 epoch: 6, train_loss: 0.8617, test_loss: 0.9848, test_f1: 0.5084
 epoch: 7, train_loss: 0.8381, test_loss: 0.9581, test_f1: 0.5501
 epoch: 8, train_loss: 0.8317, test_loss: 1.1146, test_f1: 0.5145
 epoch: 9, train_loss: 0.8242, test_loss: 0.9974, test_f1: 0.5652
 epoch: 10, train_loss: 0.8023, test_loss: 0.9504, test_f1: 0.5676
 epoch: 11, train_loss: 0.7887, test_loss: 0.9733, test_f1: 0.5748
 epoch: 12, train_loss: 0.7839, test_loss: 0.9662, test_f1: 0.5476
 epoch: 13, train_loss: 0.7515, test_loss: 0.9778, test_f1: 0.5996
 epoch: 14, train_loss: 0.7638, test_loss: 0.9910, test_f1: 0.5311
 epoch: 15, train_loss: 0.7367, test_loss: 0.9849, test_f1: 0.5746
 epoch: 16, train_loss: 0.7140, test_loss: 1.0799, test_f1: 0.6153
 epoch: 17, train_loss: 0.7188, test_loss: 1.0487, test_f1: 0.5734
 epoch: 18, train_loss: 0.7212, test_loss: 1.0367, test_f1: 0.5530
 epoch: 19, train_loss: 0.7121, test_loss: 0.9470, test_f1: 0.6304
 epoch: 20, train_loss: 0.6914, test_loss: 1.0526, test_f1: 0.6026
 epoch: 21, train_loss: 0.6691, test_loss: 1.0327, test_f1: 0.5940
 epoch: 22, train_loss: 0.6761, test_loss: 1.1110, test_f1: 0.5784
 epoch: 23, train_loss: 0.6777, test_loss: 1.0226, test_f1: 0.6142
 epoch: 24, train_loss: 0.6511, test_loss: 1.0872, test_f1: 0.6220
 epoch: 25, train_loss: 0.6374, test_loss: 1.0152, test_f1: 0.6130
 epoch: 26, train_loss: 0.6173, test_loss: 1.0657, test_f1: 0.5939
 epoch: 27, train_loss: 0.6171, test_loss: 1.1856, test_f1: 0.5752
 epoch: 28, train_loss: 0.6120, test_loss: 1.0833, test_f1: 0.6021
 epoch: 29, train_loss: 0.6071, test_loss: 1.0781, test_f1: 0.5972
 epoch: 30, train_loss: 0.5909, test_loss: 1.1442, test_f1: 0.6357
 epoch: 31, train_loss: 0.5782, test_loss: 1.0663, test_f1: 0.6029
 epoch: 32, train_loss: 0.6118, test_loss: 1.0764, test_f1: 0.5997
 epoch: 33, train_loss: 0.6166, test_loss: 1.0924, test_f1: 0.6349
 epoch: 34, train_loss: 0.5829, test_loss: 1.0486, test_f1: 0.6421
 epoch: 35, train_loss: 0.5574, test_loss: 1.1831, test_f1: 0.6145
 epoch: 36, train_loss: 0.5344, test_loss: 1.2124, test_f1: 0.6299
 epoch: 37, train_loss: 0.5522, test_loss: 1.2103, test_f1: 0.6380
 epoch: 38, train_loss: 0.5377, test_loss: 1.2410, test_f1: 0.6453
 epoch: 39, train_loss: 0.5100, test_loss: 1.1909, test_f1: 0.6619
 epoch: 40, train_loss: 0.5346, test_loss: 1.2217, test_f1: 0.6172
 epoch: 41, train_loss: 0.4961, test_loss: 1.2669, test_f1: 0.6243
 epoch: 42, train_loss: 0.5144, test_loss: 1.3496, test_f1: 0.6219
 epoch: 43, train_loss: 0.4916, test_loss: 1.2216, test_f1: 0.6338
 epoch: 44, train_loss: 0.5019, test_loss: 1.2047, test_f1: 0.6454
 epoch: 45, train_loss: 0.4931, test_loss: 1.3036, test_f1: 0.6082
 epoch: 46, train_loss: 0.4636, test_loss: 1.3119, test_f1: 0.6219
 epoch: 47, train_loss: 0.4522, test_loss: 1.2944, test_f1: 0.6353
 epoch: 48, train_loss: 0.4668, test_loss: 1.3299, test_f1: 0.6229
 epoch: 49, train_loss: 0.4600, test_loss: 1.2898, test_f1: 0.6340
 epoch: 50, train_loss: 0.4373, test_loss: 1.3760, test_f1: 0.6206
 epoch: 51, train_loss: 0.3833, test_loss: 1.3088, test_f1: 0.6379
 epoch: 52, train_loss: 0.3545, test_loss: 1.3375, test_f1: 0.6409
 epoch: 53, train_loss: 0.3417, test_loss: 1.4122, test_f1: 0.6520
 epoch: 54, train_loss: 0.3228, test_loss: 1.5487, test_f1: 0.6401
 epoch: 55, train_loss: 0.3339, test_loss: 1.5054, test_f1: 0.6466
 epoch: 56, train_loss: 0.3186, test_loss: 1.4917, test_f1: 0.6378
 epoch: 57, train_loss: 0.3276, test_loss: 1.6280, test_f1: 0.6718
 epoch: 58, train_loss: 0.3140, test_loss: 1.4935, test_f1: 0.6411
 epoch: 59, train_loss: 0.2868, test_loss: 1.6824, test_f1: 0.6284
 epoch: 60, train_loss: 0.2940, test_loss: 1.6755, test_f1: 0.6473
 epoch: 61, train_loss: 0.2899, test_loss: 1.6315, test_f1: 0.6460
 epoch: 62, train_loss: 0.2978, test_loss: 1.6489, test_f1: 0.6481
 epoch: 63, train_loss: 0.2968, test_loss: 1.7013, test_f1: 0.6267
 epoch: 64, train_loss: 0.2834, test_loss: 1.7999, test_f1: 0.6265
 epoch: 65, train_loss: 0.2808, test_loss: 1.7224, test_f1: 0.6251
 epoch: 66, train_loss: 0.2667, test_loss: 1.7456, test_f1: 0.6474
 epoch: 67, train_loss: 0.2745, test_loss: 1.9181, test_f1: 0.6456
 epoch: 68, train_loss: 0.2675, test_loss: 1.7831, test_f1: 0.6468
 epoch: 69, train_loss: 0.2876, test_loss: 1.7910, test_f1: 0.6290
 epoch: 70, train_loss: 0.2718, test_loss: 1.8961, test_f1: 0.6375
 epoch: 71, train_loss: 0.2554, test_loss: 1.8122, test_f1: 0.6433
 epoch: 72, train_loss: 0.2622, test_loss: 1.8388, test_f1: 0.6281
 epoch: 73, train_loss: 0.2459, test_loss: 1.9860, test_f1: 0.6308
 epoch: 74, train_loss: 0.2557, test_loss: 1.8762, test_f1: 0.6481
 epoch: 75, train_loss: 0.2553, test_loss: 1.9363, test_f1: 0.6313
 epoch: 76, train_loss: 0.2577, test_loss: 1.8107, test_f1: 0.6211
 epoch: 77, train_loss: 0.2387, test_loss: 1.9819, test_f1: 0.6413
 epoch: 78, train_loss: 0.2462, test_loss: 1.9676, test_f1: 0.6312
 epoch: 79, train_loss: 0.2281, test_loss: 1.9339, test_f1: 0.6243
 epoch: 80, train_loss: 0.2429, test_loss: 2.1938, test_f1: 0.6162
 epoch: 81, train_loss: 0.2471, test_loss: 1.8890, test_f1: 0.6522
 epoch: 82, train_loss: 0.2521, test_loss: 1.9745, test_f1: 0.6290
 epoch: 83, train_loss: 0.2449, test_loss: 2.0180, test_f1: 0.6573
 epoch: 84, train_loss: 0.2297, test_loss: 2.0894, test_f1: 0.6334
 epoch: 85, train_loss: 0.2383, test_loss: 1.9187, test_f1: 0.6351
 epoch: 86, train_loss: 0.2227, test_loss: 2.0674, test_f1: 0.6297
 epoch: 87, train_loss: 0.2133, test_loss: 1.9656, test_f1: 0.6443
 epoch: 88, train_loss: 0.2066, test_loss: 2.2234, test_f1: 0.6520
 epoch: 89, train_loss: 0.2093, test_loss: 2.0011, test_f1: 0.6472
 epoch: 90, train_loss: 0.1972, test_loss: 2.0421, test_f1: 0.6266
 epoch: 91, train_loss: 0.2027, test_loss: 2.0558, test_f1: 0.6523
 epoch: 92, train_loss: 0.1956, test_loss: 2.1420, test_f1: 0.6553
 epoch: 93, train_loss: 0.1961, test_loss: 2.1311, test_f1: 0.6598
 epoch: 94, train_loss: 0.2023, test_loss: 2.1601, test_f1: 0.6354
 epoch: 95, train_loss: 0.1952, test_loss: 2.2511, test_f1: 0.6401
 epoch: 96, train_loss: 0.2013, test_loss: 2.3159, test_f1: 0.6359
 epoch: 97, train_loss: 0.2068, test_loss: 2.1072, test_f1: 0.6476
 epoch: 98, train_loss: 0.2078, test_loss: 2.3631, test_f1: 0.6215
 epoch: 99, train_loss: 0.2150, test_loss: 2.2423, test_f1: 0.6398
##################ITERATION #4 ****************************************
 epoch: 0, train_loss: 1.2699, test_loss: 1.2238, test_f1: 0.3855
 epoch: 1, train_loss: 1.0143, test_loss: 0.9863, test_f1: 0.4622
 epoch: 2, train_loss: 0.9555, test_loss: 0.9934, test_f1: 0.4710
 epoch: 3, train_loss: 0.9171, test_loss: 0.9473, test_f1: 0.4985
 epoch: 4, train_loss: 0.8894, test_loss: 0.9593, test_f1: 0.4990
 epoch: 5, train_loss: 0.8670, test_loss: 0.9944, test_f1: 0.4896
 epoch: 6, train_loss: 0.8592, test_loss: 0.9539, test_f1: 0.5066
 epoch: 7, train_loss: 0.8250, test_loss: 0.9895, test_f1: 0.5269
 epoch: 8, train_loss: 0.8280, test_loss: 0.9757, test_f1: 0.5227
 epoch: 9, train_loss: 0.8169, test_loss: 0.9734, test_f1: 0.5122
 epoch: 10, train_loss: 0.8051, test_loss: 0.9286, test_f1: 0.5436
 epoch: 11, train_loss: 0.7966, test_loss: 0.9616, test_f1: 0.5806
 epoch: 12, train_loss: 0.7754, test_loss: 0.9609, test_f1: 0.5622
 epoch: 13, train_loss: 0.7744, test_loss: 0.9979, test_f1: 0.5407
 epoch: 14, train_loss: 0.7558, test_loss: 0.8979, test_f1: 0.5690
 epoch: 15, train_loss: 0.7526, test_loss: 0.9504, test_f1: 0.5988
 epoch: 16, train_loss: 0.7422, test_loss: 0.9652, test_f1: 0.5542
 epoch: 17, train_loss: 0.7307, test_loss: 0.9859, test_f1: 0.5691
 epoch: 18, train_loss: 0.7273, test_loss: 0.9793, test_f1: 0.5758
 epoch: 19, train_loss: 0.7099, test_loss: 0.9541, test_f1: 0.6078
 epoch: 20, train_loss: 0.6880, test_loss: 0.9582, test_f1: 0.6068
 epoch: 21, train_loss: 0.6914, test_loss: 0.9809, test_f1: 0.5957
 epoch: 22, train_loss: 0.6744, test_loss: 0.9660, test_f1: 0.6091
 epoch: 23, train_loss: 0.6825, test_loss: 0.9601, test_f1: 0.6084
 epoch: 24, train_loss: 0.6530, test_loss: 0.9992, test_f1: 0.6167
 epoch: 25, train_loss: 0.6521, test_loss: 1.0541, test_f1: 0.5773
 epoch: 26, train_loss: 0.6435, test_loss: 1.0041, test_f1: 0.5922
 epoch: 27, train_loss: 0.6335, test_loss: 0.9737, test_f1: 0.5868
 epoch: 28, train_loss: 0.6105, test_loss: 1.0141, test_f1: 0.6174
 epoch: 29, train_loss: 0.6096, test_loss: 0.9938, test_f1: 0.6011
 epoch: 30, train_loss: 0.5999, test_loss: 1.0981, test_f1: 0.6038
 epoch: 31, train_loss: 0.5775, test_loss: 1.0179, test_f1: 0.6531
 epoch: 32, train_loss: 0.5788, test_loss: 0.9788, test_f1: 0.6124
 epoch: 33, train_loss: 0.5786, test_loss: 1.1257, test_f1: 0.5966
 epoch: 34, train_loss: 0.5722, test_loss: 1.0503, test_f1: 0.6146
 epoch: 35, train_loss: 0.5583, test_loss: 1.2212, test_f1: 0.6204
 epoch: 36, train_loss: 0.5356, test_loss: 1.1816, test_f1: 0.6014
 epoch: 37, train_loss: 0.5301, test_loss: 1.1217, test_f1: 0.6247
 epoch: 38, train_loss: 0.5075, test_loss: 1.1367, test_f1: 0.6298
 epoch: 39, train_loss: 0.5299, test_loss: 1.2597, test_f1: 0.6059
 epoch: 40, train_loss: 0.5330, test_loss: 1.2300, test_f1: 0.6031
 epoch: 41, train_loss: 0.5139, test_loss: 1.1306, test_f1: 0.6449
 epoch: 42, train_loss: 0.5167, test_loss: 1.1514, test_f1: 0.6254
 epoch: 43, train_loss: 0.5119, test_loss: 1.2271, test_f1: 0.6483
 epoch: 44, train_loss: 0.4833, test_loss: 1.0521, test_f1: 0.6472
 epoch: 45, train_loss: 0.4644, test_loss: 1.1932, test_f1: 0.6460
 epoch: 46, train_loss: 0.4664, test_loss: 1.1713, test_f1: 0.6395
 epoch: 47, train_loss: 0.4769, test_loss: 1.4408, test_f1: 0.6083
 epoch: 48, train_loss: 0.4340, test_loss: 1.2846, test_f1: 0.6386
 epoch: 49, train_loss: 0.4564, test_loss: 1.2308, test_f1: 0.6382
 epoch: 50, train_loss: 0.4610, test_loss: 1.3985, test_f1: 0.6017
 epoch: 51, train_loss: 0.4065, test_loss: 1.3176, test_f1: 0.6537
 epoch: 52, train_loss: 0.3751, test_loss: 1.3246, test_f1: 0.6463
 epoch: 53, train_loss: 0.3621, test_loss: 1.4117, test_f1: 0.6436
 epoch: 54, train_loss: 0.3265, test_loss: 1.3624, test_f1: 0.6595
 epoch: 55, train_loss: 0.3243, test_loss: 1.3718, test_f1: 0.6540
 epoch: 56, train_loss: 0.3212, test_loss: 1.4240, test_f1: 0.6355
 epoch: 57, train_loss: 0.3153, test_loss: 1.5224, test_f1: 0.6353
 epoch: 58, train_loss: 0.3251, test_loss: 1.5172, test_f1: 0.6327
 epoch: 59, train_loss: 0.3026, test_loss: 1.5488, test_f1: 0.6408
 epoch: 60, train_loss: 0.3000, test_loss: 1.4849, test_f1: 0.6562
 epoch: 61, train_loss: 0.2962, test_loss: 1.6931, test_f1: 0.6104
 epoch: 62, train_loss: 0.3071, test_loss: 1.5918, test_f1: 0.6296
 epoch: 63, train_loss: 0.2921, test_loss: 1.5626, test_f1: 0.6609
 epoch: 64, train_loss: 0.2781, test_loss: 1.6871, test_f1: 0.6488
 epoch: 65, train_loss: 0.2748, test_loss: 1.7788, test_f1: 0.6668
 epoch: 66, train_loss: 0.2726, test_loss: 1.6991, test_f1: 0.6613
 epoch: 67, train_loss: 0.2793, test_loss: 1.7122, test_f1: 0.6111
 epoch: 68, train_loss: 0.2806, test_loss: 1.6112, test_f1: 0.6653
 epoch: 69, train_loss: 0.2868, test_loss: 1.6171, test_f1: 0.6460
 epoch: 70, train_loss: 0.2778, test_loss: 1.6173, test_f1: 0.6433
 epoch: 71, train_loss: 0.2596, test_loss: 1.7008, test_f1: 0.6430
 epoch: 72, train_loss: 0.2500, test_loss: 1.9421, test_f1: 0.6181
 epoch: 73, train_loss: 0.2379, test_loss: 1.8890, test_f1: 0.6310
 epoch: 74, train_loss: 0.2556, test_loss: 2.0049, test_f1: 0.6063
 epoch: 75, train_loss: 0.2354, test_loss: 1.9587, test_f1: 0.6510
 epoch: 76, train_loss: 0.2545, test_loss: 1.8792, test_f1: 0.6264
 epoch: 77, train_loss: 0.2522, test_loss: 1.8336, test_f1: 0.6294
 epoch: 78, train_loss: 0.2427, test_loss: 2.0734, test_f1: 0.6321
 epoch: 79, train_loss: 0.2298, test_loss: 2.0919, test_f1: 0.6433
 epoch: 80, train_loss: 0.2576, test_loss: 2.1671, test_f1: 0.6066
 epoch: 81, train_loss: 0.2420, test_loss: 1.9326, test_f1: 0.6678
 epoch: 82, train_loss: 0.2314, test_loss: 2.0209, test_f1: 0.6397
 epoch: 83, train_loss: 0.2252, test_loss: 1.9407, test_f1: 0.6428
 epoch: 84, train_loss: 0.2239, test_loss: 2.0057, test_f1: 0.6426
 epoch: 85, train_loss: 0.2240, test_loss: 1.9475, test_f1: 0.6380
 epoch: 86, train_loss: 0.2060, test_loss: 2.0618, test_f1: 0.6496
 epoch: 87, train_loss: 0.1927, test_loss: 2.0700, test_f1: 0.6459
 epoch: 88, train_loss: 0.2248, test_loss: 1.9570, test_f1: 0.6288
 epoch: 89, train_loss: 0.2265, test_loss: 2.0465, test_f1: 0.6211
 epoch: 90, train_loss: 0.2202, test_loss: 2.1117, test_f1: 0.6343
 epoch: 91, train_loss: 0.2040, test_loss: 2.1168, test_f1: 0.6667
 epoch: 92, train_loss: 0.2057, test_loss: 1.9263, test_f1: 0.6555
 epoch: 93, train_loss: 0.1866, test_loss: 2.0412, test_f1: 0.6619
 epoch: 94, train_loss: 0.1899, test_loss: 2.3368, test_f1: 0.6338
 epoch: 95, train_loss: 0.2039, test_loss: 2.1933, test_f1: 0.6248
 epoch: 96, train_loss: 0.1996, test_loss: 2.2582, test_f1: 0.6365
 epoch: 97, train_loss: 0.1916, test_loss: 2.0094, test_f1: 0.6352
 epoch: 98, train_loss: 0.1872, test_loss: 2.2240, test_f1: 0.6616
 epoch: 99, train_loss: 0.1925, test_loss: 2.1387, test_f1: 0.6578
##################ITERATION #5 ****************************************
 epoch: 0, train_loss: 1.3230, test_loss: 1.1078, test_f1: 0.3439
 epoch: 1, train_loss: 1.0230, test_loss: 0.9487, test_f1: 0.4740
 epoch: 2, train_loss: 0.9598, test_loss: 0.9471, test_f1: 0.4986
 epoch: 3, train_loss: 0.9252, test_loss: 0.9564, test_f1: 0.4865
 epoch: 4, train_loss: 0.9004, test_loss: 0.9219, test_f1: 0.5280
 epoch: 5, train_loss: 0.8861, test_loss: 0.9319, test_f1: 0.5396
 epoch: 6, train_loss: 0.8693, test_loss: 0.9214, test_f1: 0.5439
 epoch: 7, train_loss: 0.8431, test_loss: 0.9427, test_f1: 0.5275
 epoch: 8, train_loss: 0.8422, test_loss: 0.9322, test_f1: 0.5339
 epoch: 9, train_loss: 0.8174, test_loss: 0.9612, test_f1: 0.5245
 epoch: 10, train_loss: 0.8152, test_loss: 0.9352, test_f1: 0.5237
 epoch: 11, train_loss: 0.8016, test_loss: 0.9167, test_f1: 0.5817
 epoch: 12, train_loss: 0.7891, test_loss: 0.9871, test_f1: 0.5414
 epoch: 13, train_loss: 0.7799, test_loss: 0.9303, test_f1: 0.5856
 epoch: 14, train_loss: 0.7667, test_loss: 0.9488, test_f1: 0.5926
 epoch: 15, train_loss: 0.7694, test_loss: 0.9338, test_f1: 0.5648
 epoch: 16, train_loss: 0.7454, test_loss: 0.9418, test_f1: 0.5633
 epoch: 17, train_loss: 0.7350, test_loss: 0.9295, test_f1: 0.5827
 epoch: 18, train_loss: 0.7403, test_loss: 1.0225, test_f1: 0.5851
 epoch: 19, train_loss: 0.7345, test_loss: 0.9926, test_f1: 0.5590
 epoch: 20, train_loss: 0.7133, test_loss: 0.9512, test_f1: 0.5966
 epoch: 21, train_loss: 0.7025, test_loss: 0.9507, test_f1: 0.5772
 epoch: 22, train_loss: 0.6941, test_loss: 1.0016, test_f1: 0.5617
 epoch: 23, train_loss: 0.7000, test_loss: 0.9566, test_f1: 0.5871
 epoch: 24, train_loss: 0.6940, test_loss: 1.0344, test_f1: 0.5711
 epoch: 25, train_loss: 0.6735, test_loss: 1.0270, test_f1: 0.5872
 epoch: 26, train_loss: 0.6496, test_loss: 0.9448, test_f1: 0.5899
 epoch: 27, train_loss: 0.6641, test_loss: 0.9481, test_f1: 0.5871
 epoch: 28, train_loss: 0.6615, test_loss: 0.9671, test_f1: 0.5976
 epoch: 29, train_loss: 0.6428, test_loss: 1.0327, test_f1: 0.6001
 epoch: 30, train_loss: 0.6457, test_loss: 0.9785, test_f1: 0.6483
 epoch: 31, train_loss: 0.6486, test_loss: 1.0786, test_f1: 0.5363
 epoch: 32, train_loss: 0.6499, test_loss: 1.0090, test_f1: 0.5992
 epoch: 33, train_loss: 0.6449, test_loss: 1.0122, test_f1: 0.6087
 epoch: 34, train_loss: 0.6269, test_loss: 0.9910, test_f1: 0.5861
 epoch: 35, train_loss: 0.6053, test_loss: 1.0552, test_f1: 0.6025
 epoch: 36, train_loss: 0.6071, test_loss: 1.0393, test_f1: 0.6362
 epoch: 37, train_loss: 0.5851, test_loss: 1.0994, test_f1: 0.6149
 epoch: 38, train_loss: 0.5900, test_loss: 1.0662, test_f1: 0.6549
 epoch: 39, train_loss: 0.5786, test_loss: 1.0406, test_f1: 0.6122
 epoch: 40, train_loss: 0.6082, test_loss: 1.0103, test_f1: 0.6142
 epoch: 41, train_loss: 0.5595, test_loss: 1.1109, test_f1: 0.6288
 epoch: 42, train_loss: 0.5475, test_loss: 1.3150, test_f1: 0.5853
 epoch: 43, train_loss: 0.5464, test_loss: 1.1157, test_f1: 0.6262
 epoch: 44, train_loss: 0.5337, test_loss: 1.1202, test_f1: 0.6313
 epoch: 45, train_loss: 0.5280, test_loss: 1.1350, test_f1: 0.6168
 epoch: 46, train_loss: 0.5403, test_loss: 1.0542, test_f1: 0.6200
 epoch: 47, train_loss: 0.5187, test_loss: 1.3222, test_f1: 0.5787
 epoch: 48, train_loss: 0.5439, test_loss: 1.1101, test_f1: 0.6139
 epoch: 49, train_loss: 0.5115, test_loss: 1.1089, test_f1: 0.6163
 epoch: 50, train_loss: 0.5011, test_loss: 1.0961, test_f1: 0.6180
 epoch: 51, train_loss: 0.4610, test_loss: 1.1091, test_f1: 0.6388
 epoch: 52, train_loss: 0.4263, test_loss: 1.1499, test_f1: 0.6433
 epoch: 53, train_loss: 0.4054, test_loss: 1.1954, test_f1: 0.6421
 epoch: 54, train_loss: 0.3928, test_loss: 1.2278, test_f1: 0.6532
 epoch: 55, train_loss: 0.3878, test_loss: 1.3462, test_f1: 0.6217
 epoch: 56, train_loss: 0.3780, test_loss: 1.2901, test_f1: 0.6419
 epoch: 57, train_loss: 0.3870, test_loss: 1.2452, test_f1: 0.6460
 epoch: 58, train_loss: 0.3594, test_loss: 1.3625, test_f1: 0.6340
 epoch: 59, train_loss: 0.3633, test_loss: 1.2780, test_f1: 0.6456
 epoch: 60, train_loss: 0.3595, test_loss: 1.2838, test_f1: 0.6342
 epoch: 61, train_loss: 0.3398, test_loss: 1.2939, test_f1: 0.6410
 epoch: 62, train_loss: 0.3590, test_loss: 1.3734, test_f1: 0.6383
 epoch: 63, train_loss: 0.3447, test_loss: 1.4038, test_f1: 0.6210
 epoch: 64, train_loss: 0.3518, test_loss: 1.3484, test_f1: 0.6279
 epoch: 65, train_loss: 0.3612, test_loss: 1.3182, test_f1: 0.6176
 epoch: 66, train_loss: 0.3343, test_loss: 1.3993, test_f1: 0.6380
 epoch: 67, train_loss: 0.3400, test_loss: 1.4170, test_f1: 0.6219
 epoch: 68, train_loss: 0.3168, test_loss: 1.4342, test_f1: 0.6376
 epoch: 69, train_loss: 0.3236, test_loss: 1.4456, test_f1: 0.6352
 epoch: 70, train_loss: 0.3300, test_loss: 1.4915, test_f1: 0.6189
 epoch: 71, train_loss: 0.3151, test_loss: 1.4289, test_f1: 0.6470
 epoch: 72, train_loss: 0.2996, test_loss: 1.3960, test_f1: 0.6406
 epoch: 73, train_loss: 0.2771, test_loss: 1.5236, test_f1: 0.6325
 epoch: 74, train_loss: 0.2897, test_loss: 1.4768, test_f1: 0.6470
 epoch: 75, train_loss: 0.2655, test_loss: 1.5603, test_f1: 0.6272
 epoch: 76, train_loss: 0.2835, test_loss: 1.5890, test_f1: 0.6320
 epoch: 77, train_loss: 0.2841, test_loss: 1.5052, test_f1: 0.6453
 epoch: 78, train_loss: 0.2937, test_loss: 1.6639, test_f1: 0.6194
 epoch: 79, train_loss: 0.2811, test_loss: 1.5402, test_f1: 0.6145
 epoch: 80, train_loss: 0.2663, test_loss: 1.6461, test_f1: 0.6392
 epoch: 81, train_loss: 0.2580, test_loss: 1.6077, test_f1: 0.6092
 epoch: 82, train_loss: 0.2773, test_loss: 1.5937, test_f1: 0.6253
 epoch: 83, train_loss: 0.2653, test_loss: 1.5311, test_f1: 0.6530
 epoch: 84, train_loss: 0.2622, test_loss: 1.5909, test_f1: 0.6109
 epoch: 85, train_loss: 0.2656, test_loss: 1.6854, test_f1: 0.6442
 epoch: 86, train_loss: 0.2429, test_loss: 1.6253, test_f1: 0.6237
 epoch: 87, train_loss: 0.2508, test_loss: 1.6822, test_f1: 0.6537
 epoch: 88, train_loss: 0.2435, test_loss: 1.5148, test_f1: 0.6654
 epoch: 89, train_loss: 0.2430, test_loss: 1.7909, test_f1: 0.6088
 epoch: 90, train_loss: 0.2548, test_loss: 1.7912, test_f1: 0.6106
 epoch: 91, train_loss: 0.2359, test_loss: 1.6227, test_f1: 0.6355
 epoch: 92, train_loss: 0.2389, test_loss: 1.8221, test_f1: 0.6087
 epoch: 93, train_loss: 0.2292, test_loss: 1.6971, test_f1: 0.6318
 epoch: 94, train_loss: 0.2156, test_loss: 1.7444, test_f1: 0.6261
 epoch: 95, train_loss: 0.2295, test_loss: 1.6707, test_f1: 0.6386
 epoch: 96, train_loss: 0.2502, test_loss: 1.7750, test_f1: 0.6091
 epoch: 97, train_loss: 0.2375, test_loss: 1.7704, test_f1: 0.6220
 epoch: 98, train_loss: 0.2190, test_loss: 1.7750, test_f1: 0.6451
 epoch: 99, train_loss: 0.2145, test_loss: 1.7602, test_f1: 0.6432
##################ITERATION #6 ****************************************
 epoch: 0, train_loss: 1.3329, test_loss: 1.1107, test_f1: 0.3449
 epoch: 1, train_loss: 1.0043, test_loss: 1.0077, test_f1: 0.4518
 epoch: 2, train_loss: 0.9671, test_loss: 0.9882, test_f1: 0.4852
 epoch: 3, train_loss: 0.9119, test_loss: 0.9980, test_f1: 0.4799
 epoch: 4, train_loss: 0.8930, test_loss: 1.0193, test_f1: 0.4867
 epoch: 5, train_loss: 0.8900, test_loss: 0.9554, test_f1: 0.5043
 epoch: 6, train_loss: 0.8604, test_loss: 1.0145, test_f1: 0.5165
 epoch: 7, train_loss: 0.8603, test_loss: 1.0045, test_f1: 0.5248
 epoch: 8, train_loss: 0.8382, test_loss: 0.9358, test_f1: 0.5444
 epoch: 9, train_loss: 0.8278, test_loss: 0.9798, test_f1: 0.5324
 epoch: 10, train_loss: 0.8115, test_loss: 0.9535, test_f1: 0.5763
 epoch: 11, train_loss: 0.7980, test_loss: 0.9713, test_f1: 0.5292
 epoch: 12, train_loss: 0.7975, test_loss: 0.9908, test_f1: 0.5410
 epoch: 13, train_loss: 0.7663, test_loss: 0.9416, test_f1: 0.5502
 epoch: 14, train_loss: 0.7521, test_loss: 1.0064, test_f1: 0.5609
 epoch: 15, train_loss: 0.7378, test_loss: 0.9464, test_f1: 0.5564
 epoch: 16, train_loss: 0.7339, test_loss: 0.9412, test_f1: 0.5814
 epoch: 17, train_loss: 0.7376, test_loss: 0.9785, test_f1: 0.5807
 epoch: 18, train_loss: 0.7267, test_loss: 1.0108, test_f1: 0.5669
 epoch: 19, train_loss: 0.7001, test_loss: 1.0489, test_f1: 0.5611
 epoch: 20, train_loss: 0.7076, test_loss: 1.1003, test_f1: 0.5501
 epoch: 21, train_loss: 0.6855, test_loss: 1.0270, test_f1: 0.5847
 epoch: 22, train_loss: 0.6855, test_loss: 1.0241, test_f1: 0.5365
 epoch: 23, train_loss: 0.6791, test_loss: 1.0256, test_f1: 0.5538
 epoch: 24, train_loss: 0.6557, test_loss: 1.0086, test_f1: 0.5953
 epoch: 25, train_loss: 0.6799, test_loss: 1.0499, test_f1: 0.5982
 epoch: 26, train_loss: 0.6706, test_loss: 1.0052, test_f1: 0.5713
 epoch: 27, train_loss: 0.6458, test_loss: 1.0735, test_f1: 0.6221
 epoch: 28, train_loss: 0.6620, test_loss: 1.1008, test_f1: 0.5823
 epoch: 29, train_loss: 0.6265, test_loss: 1.0645, test_f1: 0.6203
 epoch: 30, train_loss: 0.6036, test_loss: 0.9898, test_f1: 0.6240
 epoch: 31, train_loss: 0.6064, test_loss: 1.0343, test_f1: 0.5716
 epoch: 32, train_loss: 0.6085, test_loss: 1.0179, test_f1: 0.6010
 epoch: 33, train_loss: 0.5905, test_loss: 1.0230, test_f1: 0.6104
 epoch: 34, train_loss: 0.5992, test_loss: 1.0693, test_f1: 0.5873
 epoch: 35, train_loss: 0.5883, test_loss: 1.0437, test_f1: 0.5679
 epoch: 36, train_loss: 0.5782, test_loss: 1.2325, test_f1: 0.5739
 epoch: 37, train_loss: 0.5893, test_loss: 1.0272, test_f1: 0.6072
 epoch: 38, train_loss: 0.5675, test_loss: 1.1416, test_f1: 0.6053
 epoch: 39, train_loss: 0.5602, test_loss: 1.1301, test_f1: 0.6085
 epoch: 40, train_loss: 0.5439, test_loss: 1.0990, test_f1: 0.5727
 epoch: 41, train_loss: 0.5476, test_loss: 1.0669, test_f1: 0.6424
 epoch: 42, train_loss: 0.5390, test_loss: 1.1577, test_f1: 0.6291
 epoch: 43, train_loss: 0.5297, test_loss: 1.0883, test_f1: 0.6391
 epoch: 44, train_loss: 0.4922, test_loss: 1.2295, test_f1: 0.6234
 epoch: 45, train_loss: 0.4874, test_loss: 1.1983, test_f1: 0.6202
 epoch: 46, train_loss: 0.4989, test_loss: 1.1126, test_f1: 0.6038
 epoch: 47, train_loss: 0.4932, test_loss: 1.1794, test_f1: 0.6275
 epoch: 48, train_loss: 0.4807, test_loss: 1.1387, test_f1: 0.6391
 epoch: 49, train_loss: 0.4800, test_loss: 1.2804, test_f1: 0.5911
 epoch: 50, train_loss: 0.4796, test_loss: 1.2343, test_f1: 0.6188
 epoch: 51, train_loss: 0.4404, test_loss: 1.1664, test_f1: 0.6209
 epoch: 52, train_loss: 0.3787, test_loss: 1.2176, test_f1: 0.6348
 epoch: 53, train_loss: 0.3766, test_loss: 1.2657, test_f1: 0.6330
 epoch: 54, train_loss: 0.3681, test_loss: 1.2813, test_f1: 0.6339
 epoch: 55, train_loss: 0.3586, test_loss: 1.2899, test_f1: 0.6225
 epoch: 56, train_loss: 0.3798, test_loss: 1.3413, test_f1: 0.6448
 epoch: 57, train_loss: 0.3613, test_loss: 1.3890, test_f1: 0.6429
 epoch: 58, train_loss: 0.3434, test_loss: 1.4191, test_f1: 0.5959
 epoch: 59, train_loss: 0.3372, test_loss: 1.3768, test_f1: 0.6300
 epoch: 60, train_loss: 0.3461, test_loss: 1.3514, test_f1: 0.6217
 epoch: 61, train_loss: 0.3365, test_loss: 1.4723, test_f1: 0.6083
 epoch: 62, train_loss: 0.3433, test_loss: 1.3753, test_f1: 0.6389
 epoch: 63, train_loss: 0.3335, test_loss: 1.4511, test_f1: 0.6186
 epoch: 64, train_loss: 0.3112, test_loss: 1.5055, test_f1: 0.6091
 epoch: 65, train_loss: 0.2986, test_loss: 1.5849, test_f1: 0.6236
 epoch: 66, train_loss: 0.3181, test_loss: 1.5048, test_f1: 0.6340
 epoch: 67, train_loss: 0.3134, test_loss: 1.5975, test_f1: 0.6111
 epoch: 68, train_loss: 0.3130, test_loss: 1.5365, test_f1: 0.6212
 epoch: 69, train_loss: 0.2798, test_loss: 1.5476, test_f1: 0.6185
 epoch: 70, train_loss: 0.2901, test_loss: 1.5922, test_f1: 0.6314
 epoch: 71, train_loss: 0.2825, test_loss: 1.5880, test_f1: 0.6459
 epoch: 72, train_loss: 0.2899, test_loss: 1.6091, test_f1: 0.6335
 epoch: 73, train_loss: 0.2766, test_loss: 1.6875, test_f1: 0.6376
 epoch: 74, train_loss: 0.2851, test_loss: 1.6930, test_f1: 0.6506
 epoch: 75, train_loss: 0.2852, test_loss: 1.6895, test_f1: 0.6411
 epoch: 76, train_loss: 0.2841, test_loss: 1.6243, test_f1: 0.6234
 epoch: 77, train_loss: 0.2661, test_loss: 1.7236, test_f1: 0.6195
 epoch: 78, train_loss: 0.2644, test_loss: 1.6646, test_f1: 0.6308
 epoch: 79, train_loss: 0.2671, test_loss: 1.7186, test_f1: 0.6510
 epoch: 80, train_loss: 0.2827, test_loss: 1.6258, test_f1: 0.6269
 epoch: 81, train_loss: 0.2845, test_loss: 1.6332, test_f1: 0.6449
 epoch: 82, train_loss: 0.2617, test_loss: 1.7556, test_f1: 0.6186
 epoch: 83, train_loss: 0.2607, test_loss: 1.6487, test_f1: 0.6237
 epoch: 84, train_loss: 0.2598, test_loss: 1.5887, test_f1: 0.6546
 epoch: 85, train_loss: 0.2492, test_loss: 1.6240, test_f1: 0.6455
 epoch: 86, train_loss: 0.2400, test_loss: 1.5992, test_f1: 0.6485
 epoch: 87, train_loss: 0.2558, test_loss: 1.7189, test_f1: 0.6275
 epoch: 88, train_loss: 0.2574, test_loss: 1.7315, test_f1: 0.6444
 epoch: 89, train_loss: 0.2585, test_loss: 1.7532, test_f1: 0.6401
 epoch: 90, train_loss: 0.2390, test_loss: 1.7402, test_f1: 0.6055
 epoch: 91, train_loss: 0.2206, test_loss: 1.7010, test_f1: 0.6284
 epoch: 92, train_loss: 0.2283, test_loss: 1.7712, test_f1: 0.6467
 epoch: 93, train_loss: 0.2123, test_loss: 1.7887, test_f1: 0.6342
 epoch: 94, train_loss: 0.2083, test_loss: 1.8495, test_f1: 0.6202
 epoch: 95, train_loss: 0.1977, test_loss: 1.9694, test_f1: 0.6180
 epoch: 96, train_loss: 0.1869, test_loss: 1.8598, test_f1: 0.6316
 epoch: 97, train_loss: 0.1973, test_loss: 1.9768, test_f1: 0.6088
 epoch: 98, train_loss: 0.2164, test_loss: 1.9104, test_f1: 0.6404
 epoch: 99, train_loss: 0.1875, test_loss: 1.9927, test_f1: 0.6310
##################ITERATION #7 ****************************************
 epoch: 0, train_loss: 1.3383, test_loss: 1.2772, test_f1: 0.2270
 epoch: 1, train_loss: 1.0529, test_loss: 1.0307, test_f1: 0.4421
 epoch: 2, train_loss: 0.9693, test_loss: 0.9481, test_f1: 0.4764
 epoch: 3, train_loss: 0.9394, test_loss: 0.9201, test_f1: 0.4769
 epoch: 4, train_loss: 0.9148, test_loss: 0.9140, test_f1: 0.4999
 epoch: 5, train_loss: 0.9050, test_loss: 0.9645, test_f1: 0.4974
 epoch: 6, train_loss: 0.8811, test_loss: 1.0006, test_f1: 0.5384
 epoch: 7, train_loss: 0.8580, test_loss: 0.9859, test_f1: 0.5031
 epoch: 8, train_loss: 0.8501, test_loss: 0.9687, test_f1: 0.5475
 epoch: 9, train_loss: 0.8563, test_loss: 0.9610, test_f1: 0.5707
 epoch: 10, train_loss: 0.8171, test_loss: 0.9312, test_f1: 0.5357
 epoch: 11, train_loss: 0.7911, test_loss: 0.9202, test_f1: 0.5674
 epoch: 12, train_loss: 0.7893, test_loss: 1.0015, test_f1: 0.5485
 epoch: 13, train_loss: 0.7951, test_loss: 1.0727, test_f1: 0.5388
 epoch: 14, train_loss: 0.7794, test_loss: 1.0164, test_f1: 0.5609
 epoch: 15, train_loss: 0.7677, test_loss: 0.9422, test_f1: 0.5346
 epoch: 16, train_loss: 0.7598, test_loss: 0.9974, test_f1: 0.5775
 epoch: 17, train_loss: 0.7459, test_loss: 0.9897, test_f1: 0.6122
 epoch: 18, train_loss: 0.7462, test_loss: 1.0473, test_f1: 0.5583
 epoch: 19, train_loss: 0.7185, test_loss: 1.0754, test_f1: 0.5789
 epoch: 20, train_loss: 0.7129, test_loss: 0.9764, test_f1: 0.5843
 epoch: 21, train_loss: 0.7082, test_loss: 1.0389, test_f1: 0.6045
 epoch: 22, train_loss: 0.7019, test_loss: 1.0499, test_f1: 0.5879
 epoch: 23, train_loss: 0.7057, test_loss: 1.0969, test_f1: 0.5733
 epoch: 24, train_loss: 0.6693, test_loss: 1.0325, test_f1: 0.5892
 epoch: 25, train_loss: 0.6633, test_loss: 1.1422, test_f1: 0.5957
 epoch: 26, train_loss: 0.6754, test_loss: 1.1767, test_f1: 0.6118
 epoch: 27, train_loss: 0.6719, test_loss: 1.0965, test_f1: 0.6187
 epoch: 28, train_loss: 0.6598, test_loss: 1.1264, test_f1: 0.6079
 epoch: 29, train_loss: 0.6469, test_loss: 1.0419, test_f1: 0.6388
 epoch: 30, train_loss: 0.6523, test_loss: 1.0399, test_f1: 0.6203
 epoch: 31, train_loss: 0.6217, test_loss: 1.0614, test_f1: 0.5909
 epoch: 32, train_loss: 0.6274, test_loss: 1.1044, test_f1: 0.5822
 epoch: 33, train_loss: 0.6198, test_loss: 1.1692, test_f1: 0.5992
 epoch: 34, train_loss: 0.6033, test_loss: 1.0932, test_f1: 0.6277
 epoch: 35, train_loss: 0.6137, test_loss: 1.1634, test_f1: 0.6393
 epoch: 36, train_loss: 0.5872, test_loss: 1.2000, test_f1: 0.6012
 epoch: 37, train_loss: 0.5999, test_loss: 1.1225, test_f1: 0.6073
 epoch: 38, train_loss: 0.5806, test_loss: 1.1648, test_f1: 0.6252
 epoch: 39, train_loss: 0.5596, test_loss: 1.1794, test_f1: 0.5921
 epoch: 40, train_loss: 0.5631, test_loss: 1.1114, test_f1: 0.6263
 epoch: 41, train_loss: 0.5521, test_loss: 1.2198, test_f1: 0.6292
 epoch: 42, train_loss: 0.5538, test_loss: 1.1435, test_f1: 0.6381
 epoch: 43, train_loss: 0.5320, test_loss: 1.1629, test_f1: 0.6183
 epoch: 44, train_loss: 0.5142, test_loss: 1.1798, test_f1: 0.6269
 epoch: 45, train_loss: 0.5298, test_loss: 1.1719, test_f1: 0.6240
 epoch: 46, train_loss: 0.5175, test_loss: 1.0996, test_f1: 0.6581
 epoch: 47, train_loss: 0.5011, test_loss: 1.2220, test_f1: 0.6270
 epoch: 48, train_loss: 0.4856, test_loss: 1.2209, test_f1: 0.6334
 epoch: 49, train_loss: 0.4912, test_loss: 1.2752, test_f1: 0.6523
 epoch: 50, train_loss: 0.4918, test_loss: 1.3149, test_f1: 0.6246
 epoch: 51, train_loss: 0.4275, test_loss: 1.2834, test_f1: 0.6667
 epoch: 52, train_loss: 0.3965, test_loss: 1.3615, test_f1: 0.6534
 epoch: 53, train_loss: 0.3990, test_loss: 1.3463, test_f1: 0.6361
 epoch: 54, train_loss: 0.3940, test_loss: 1.3965, test_f1: 0.6166
 epoch: 55, train_loss: 0.3749, test_loss: 1.3862, test_f1: 0.6307
 epoch: 56, train_loss: 0.3637, test_loss: 1.4376, test_f1: 0.6424
 epoch: 57, train_loss: 0.3640, test_loss: 1.4327, test_f1: 0.6529
 epoch: 58, train_loss: 0.3728, test_loss: 1.4706, test_f1: 0.6155
 epoch: 59, train_loss: 0.3560, test_loss: 1.5275, test_f1: 0.6279
 epoch: 60, train_loss: 0.3498, test_loss: 1.4611, test_f1: 0.6518
 epoch: 61, train_loss: 0.3514, test_loss: 1.5248, test_f1: 0.6182
 epoch: 62, train_loss: 0.3291, test_loss: 1.5104, test_f1: 0.6387
 epoch: 63, train_loss: 0.3286, test_loss: 1.6034, test_f1: 0.6268
 epoch: 64, train_loss: 0.3185, test_loss: 1.5269, test_f1: 0.6292
 epoch: 65, train_loss: 0.3158, test_loss: 1.6186, test_f1: 0.6233
 epoch: 66, train_loss: 0.3188, test_loss: 1.7329, test_f1: 0.6154
 epoch: 67, train_loss: 0.3365, test_loss: 1.6344, test_f1: 0.6673
 epoch: 68, train_loss: 0.3042, test_loss: 1.6102, test_f1: 0.6564
 epoch: 69, train_loss: 0.3142, test_loss: 1.6229, test_f1: 0.6376
 epoch: 70, train_loss: 0.3125, test_loss: 1.6475, test_f1: 0.6492
 epoch: 71, train_loss: 0.2893, test_loss: 1.6240, test_f1: 0.6253
 epoch: 72, train_loss: 0.2940, test_loss: 1.5965, test_f1: 0.6497
 epoch: 73, train_loss: 0.3076, test_loss: 1.6434, test_f1: 0.6507
 epoch: 74, train_loss: 0.2974, test_loss: 1.5726, test_f1: 0.6389
 epoch: 75, train_loss: 0.2869, test_loss: 1.6601, test_f1: 0.6351
 epoch: 76, train_loss: 0.2861, test_loss: 1.6102, test_f1: 0.6266
 epoch: 77, train_loss: 0.2848, test_loss: 1.5965, test_f1: 0.6287
 epoch: 78, train_loss: 0.2675, test_loss: 1.7776, test_f1: 0.6194
 epoch: 79, train_loss: 0.2668, test_loss: 1.7097, test_f1: 0.6221
 epoch: 80, train_loss: 0.2684, test_loss: 1.7631, test_f1: 0.6460
 epoch: 81, train_loss: 0.2756, test_loss: 1.7543, test_f1: 0.6247
 epoch: 82, train_loss: 0.2677, test_loss: 1.6286, test_f1: 0.6158
 epoch: 83, train_loss: 0.2628, test_loss: 1.7977, test_f1: 0.6438
 epoch: 84, train_loss: 0.2448, test_loss: 1.7845, test_f1: 0.6307
 epoch: 85, train_loss: 0.2341, test_loss: 1.6581, test_f1: 0.6575
 epoch: 86, train_loss: 0.2553, test_loss: 1.8566, test_f1: 0.6300
 epoch: 87, train_loss: 0.2536, test_loss: 1.7501, test_f1: 0.6365
 epoch: 88, train_loss: 0.2505, test_loss: 1.8348, test_f1: 0.6171
 epoch: 89, train_loss: 0.2381, test_loss: 1.8339, test_f1: 0.6519
 epoch: 90, train_loss: 0.2476, test_loss: 1.9004, test_f1: 0.6253
 epoch: 91, train_loss: 0.2239, test_loss: 1.8233, test_f1: 0.6573
 epoch: 92, train_loss: 0.2298, test_loss: 1.8725, test_f1: 0.6178
 epoch: 93, train_loss: 0.2362, test_loss: 1.8038, test_f1: 0.6388
 epoch: 94, train_loss: 0.2212, test_loss: 2.0295, test_f1: 0.6144
 epoch: 95, train_loss: 0.2155, test_loss: 2.0343, test_f1: 0.6233
 epoch: 96, train_loss: 0.2238, test_loss: 2.0019, test_f1: 0.5971
 epoch: 97, train_loss: 0.2239, test_loss: 1.8501, test_f1: 0.6197
 epoch: 98, train_loss: 0.2043, test_loss: 1.9943, test_f1: 0.6341
 epoch: 99, train_loss: 0.2621, test_loss: 1.9900, test_f1: 0.6089
##################ITERATION #8 ****************************************
 epoch: 0, train_loss: 1.3764, test_loss: 1.2639, test_f1: 0.2981
 epoch: 1, train_loss: 1.0177, test_loss: 0.9791, test_f1: 0.4857
 epoch: 2, train_loss: 0.9562, test_loss: 0.9743, test_f1: 0.4789
 epoch: 3, train_loss: 0.9256, test_loss: 0.9332, test_f1: 0.4826
 epoch: 4, train_loss: 0.9016, test_loss: 0.9622, test_f1: 0.5111
 epoch: 5, train_loss: 0.8746, test_loss: 0.9553, test_f1: 0.5134
 epoch: 6, train_loss: 0.8733, test_loss: 0.9805, test_f1: 0.5141
 epoch: 7, train_loss: 0.8517, test_loss: 0.9462, test_f1: 0.5235
 epoch: 8, train_loss: 0.8405, test_loss: 1.0051, test_f1: 0.5138
 epoch: 9, train_loss: 0.8353, test_loss: 0.9397, test_f1: 0.5033
 epoch: 10, train_loss: 0.8215, test_loss: 0.9745, test_f1: 0.5230
 epoch: 11, train_loss: 0.7929, test_loss: 1.0226, test_f1: 0.5457
 epoch: 12, train_loss: 0.7845, test_loss: 0.9790, test_f1: 0.5539
 epoch: 13, train_loss: 0.7847, test_loss: 1.0214, test_f1: 0.5395
 epoch: 14, train_loss: 0.7773, test_loss: 0.9288, test_f1: 0.5587
 epoch: 15, train_loss: 0.7531, test_loss: 1.0093, test_f1: 0.5767
 epoch: 16, train_loss: 0.7431, test_loss: 0.9888, test_f1: 0.5429
 epoch: 17, train_loss: 0.7427, test_loss: 0.9860, test_f1: 0.5664
 epoch: 18, train_loss: 0.7242, test_loss: 1.0032, test_f1: 0.5975
 epoch: 19, train_loss: 0.7187, test_loss: 1.0319, test_f1: 0.5961
 epoch: 20, train_loss: 0.7168, test_loss: 1.0478, test_f1: 0.5882
 epoch: 21, train_loss: 0.7051, test_loss: 1.0201, test_f1: 0.6017
 epoch: 22, train_loss: 0.7101, test_loss: 0.9519, test_f1: 0.5610
 epoch: 23, train_loss: 0.6917, test_loss: 1.0728, test_f1: 0.5707
 epoch: 24, train_loss: 0.6799, test_loss: 1.0853, test_f1: 0.5857
 epoch: 25, train_loss: 0.6697, test_loss: 1.0437, test_f1: 0.5991
 epoch: 26, train_loss: 0.6518, test_loss: 1.0915, test_f1: 0.5917
 epoch: 27, train_loss: 0.6604, test_loss: 1.0424, test_f1: 0.5815
 epoch: 28, train_loss: 0.6441, test_loss: 1.0778, test_f1: 0.5942
 epoch: 29, train_loss: 0.6347, test_loss: 1.1559, test_f1: 0.5648
 epoch: 30, train_loss: 0.6451, test_loss: 1.1566, test_f1: 0.5960
 epoch: 31, train_loss: 0.6336, test_loss: 1.1207, test_f1: 0.5983
 epoch: 32, train_loss: 0.6258, test_loss: 1.1390, test_f1: 0.5864
 epoch: 33, train_loss: 0.6159, test_loss: 1.1652, test_f1: 0.5939
 epoch: 34, train_loss: 0.5969, test_loss: 1.1011, test_f1: 0.6062
 epoch: 35, train_loss: 0.5987, test_loss: 1.1734, test_f1: 0.5933
 epoch: 36, train_loss: 0.6046, test_loss: 1.0843, test_f1: 0.6050
 epoch: 37, train_loss: 0.5977, test_loss: 1.2408, test_f1: 0.5698
 epoch: 38, train_loss: 0.5933, test_loss: 1.1084, test_f1: 0.5891
 epoch: 39, train_loss: 0.6073, test_loss: 1.1030, test_f1: 0.6059
 epoch: 40, train_loss: 0.5940, test_loss: 1.1496, test_f1: 0.6077
 epoch: 41, train_loss: 0.5555, test_loss: 1.2307, test_f1: 0.5723
 epoch: 42, train_loss: 0.5720, test_loss: 1.2008, test_f1: 0.5890
 epoch: 43, train_loss: 0.5658, test_loss: 1.2296, test_f1: 0.5930
 epoch: 44, train_loss: 0.5534, test_loss: 1.2163, test_f1: 0.5838
 epoch: 45, train_loss: 0.5438, test_loss: 1.1345, test_f1: 0.6026
 epoch: 46, train_loss: 0.4963, test_loss: 1.2662, test_f1: 0.6136
 epoch: 47, train_loss: 0.4947, test_loss: 1.2864, test_f1: 0.6017
 epoch: 48, train_loss: 0.5474, test_loss: 1.2285, test_f1: 0.5969
 epoch: 49, train_loss: 0.5172, test_loss: 1.2907, test_f1: 0.6091
 epoch: 50, train_loss: 0.4913, test_loss: 1.4080, test_f1: 0.5852
 epoch: 51, train_loss: 0.4656, test_loss: 1.2771, test_f1: 0.6321
 epoch: 52, train_loss: 0.4311, test_loss: 1.2958, test_f1: 0.6295
 epoch: 53, train_loss: 0.3974, test_loss: 1.3937, test_f1: 0.6235
 epoch: 54, train_loss: 0.3996, test_loss: 1.3368, test_f1: 0.6321
 epoch: 55, train_loss: 0.4046, test_loss: 1.3587, test_f1: 0.6161
 epoch: 56, train_loss: 0.3909, test_loss: 1.4623, test_f1: 0.6405
 epoch: 57, train_loss: 0.3931, test_loss: 1.4431, test_f1: 0.6257
 epoch: 58, train_loss: 0.3835, test_loss: 1.3484, test_f1: 0.6346
 epoch: 59, train_loss: 0.3853, test_loss: 1.4202, test_f1: 0.6193
 epoch: 60, train_loss: 0.3706, test_loss: 1.4600, test_f1: 0.6219
 epoch: 61, train_loss: 0.3498, test_loss: 1.4918, test_f1: 0.6189
 epoch: 62, train_loss: 0.3602, test_loss: 1.4769, test_f1: 0.6418
 epoch: 63, train_loss: 0.3453, test_loss: 1.5141, test_f1: 0.6276
 epoch: 64, train_loss: 0.3548, test_loss: 1.4004, test_f1: 0.6431
 epoch: 65, train_loss: 0.3266, test_loss: 1.4473, test_f1: 0.6293
 epoch: 66, train_loss: 0.3356, test_loss: 1.5379, test_f1: 0.6121
 epoch: 67, train_loss: 0.3429, test_loss: 1.5140, test_f1: 0.6397
 epoch: 68, train_loss: 0.3379, test_loss: 1.4295, test_f1: 0.6206
 epoch: 69, train_loss: 0.3369, test_loss: 1.4808, test_f1: 0.6336
 epoch: 70, train_loss: 0.3215, test_loss: 1.5688, test_f1: 0.6404
 epoch: 71, train_loss: 0.3199, test_loss: 1.4885, test_f1: 0.6332
 epoch: 72, train_loss: 0.3022, test_loss: 1.5353, test_f1: 0.6348
 epoch: 73, train_loss: 0.3041, test_loss: 1.6521, test_f1: 0.6471
 epoch: 74, train_loss: 0.2962, test_loss: 1.5804, test_f1: 0.6307
 epoch: 75, train_loss: 0.3095, test_loss: 1.6263, test_f1: 0.6484
 epoch: 76, train_loss: 0.3204, test_loss: 1.6327, test_f1: 0.6406
 epoch: 77, train_loss: 0.3031, test_loss: 1.7927, test_f1: 0.6128
 epoch: 78, train_loss: 0.2752, test_loss: 1.7737, test_f1: 0.6270
 epoch: 79, train_loss: 0.3044, test_loss: 1.7271, test_f1: 0.6459
 epoch: 80, train_loss: 0.2959, test_loss: 1.6702, test_f1: 0.6500
 epoch: 81, train_loss: 0.2821, test_loss: 1.6056, test_f1: 0.6533
 epoch: 82, train_loss: 0.2833, test_loss: 1.7597, test_f1: 0.6378
 epoch: 83, train_loss: 0.2694, test_loss: 1.7416, test_f1: 0.6402
 epoch: 84, train_loss: 0.2865, test_loss: 1.6427, test_f1: 0.6411
 epoch: 85, train_loss: 0.2678, test_loss: 1.7354, test_f1: 0.6458
 epoch: 86, train_loss: 0.2674, test_loss: 1.7830, test_f1: 0.6323
 epoch: 87, train_loss: 0.2678, test_loss: 1.7566, test_f1: 0.6392
 epoch: 88, train_loss: 0.2716, test_loss: 1.7793, test_f1: 0.6491
 epoch: 89, train_loss: 0.2615, test_loss: 1.7168, test_f1: 0.6487
 epoch: 90, train_loss: 0.2513, test_loss: 1.8621, test_f1: 0.6411
 epoch: 91, train_loss: 0.2539, test_loss: 1.6485, test_f1: 0.6481
 epoch: 92, train_loss: 0.2516, test_loss: 1.9298, test_f1: 0.6348
 epoch: 93, train_loss: 0.2595, test_loss: 1.7839, test_f1: 0.6441
 epoch: 94, train_loss: 0.2514, test_loss: 2.0692, test_f1: 0.6194
 epoch: 95, train_loss: 0.2228, test_loss: 1.7762, test_f1: 0.6455
 epoch: 96, train_loss: 0.2254, test_loss: 2.0239, test_f1: 0.6168
 epoch: 97, train_loss: 0.2434, test_loss: 1.9230, test_f1: 0.6362
 epoch: 98, train_loss: 0.2650, test_loss: 1.9217, test_f1: 0.6278
 epoch: 99, train_loss: 0.2296, test_loss: 1.9633, test_f1: 0.6295
##################ITERATION #9 ****************************************
 epoch: 0, train_loss: 1.4260, test_loss: 1.3826, test_f1: 0.2903
 epoch: 1, train_loss: 1.0360, test_loss: 1.0524, test_f1: 0.4620
 epoch: 2, train_loss: 0.9669, test_loss: 0.9917, test_f1: 0.4716
 epoch: 3, train_loss: 0.9480, test_loss: 0.9769, test_f1: 0.4599
 epoch: 4, train_loss: 0.9126, test_loss: 0.9819, test_f1: 0.4845
 epoch: 5, train_loss: 0.9027, test_loss: 1.0190, test_f1: 0.5018
 epoch: 6, train_loss: 0.8765, test_loss: 1.0353, test_f1: 0.4965
 epoch: 7, train_loss: 0.8625, test_loss: 0.9693, test_f1: 0.5128
 epoch: 8, train_loss: 0.8429, test_loss: 0.9925, test_f1: 0.5191
 epoch: 9, train_loss: 0.8239, test_loss: 1.0575, test_f1: 0.5283
 epoch: 10, train_loss: 0.7987, test_loss: 0.9771, test_f1: 0.5615
 epoch: 11, train_loss: 0.7989, test_loss: 0.9437, test_f1: 0.5342
 epoch: 12, train_loss: 0.7818, test_loss: 1.0053, test_f1: 0.5359
 epoch: 13, train_loss: 0.7981, test_loss: 0.9685, test_f1: 0.5547
 epoch: 14, train_loss: 0.7676, test_loss: 0.9699, test_f1: 0.5792
 epoch: 15, train_loss: 0.7429, test_loss: 1.0228, test_f1: 0.5506
 epoch: 16, train_loss: 0.7517, test_loss: 0.9486, test_f1: 0.5969
 epoch: 17, train_loss: 0.7333, test_loss: 1.0468, test_f1: 0.5316
 epoch: 18, train_loss: 0.7191, test_loss: 1.0054, test_f1: 0.5899
 epoch: 19, train_loss: 0.7131, test_loss: 1.0698, test_f1: 0.5628
 epoch: 20, train_loss: 0.7020, test_loss: 0.9719, test_f1: 0.5926
 epoch: 21, train_loss: 0.6967, test_loss: 1.0152, test_f1: 0.5981
 epoch: 22, train_loss: 0.6959, test_loss: 0.9754, test_f1: 0.5829
 epoch: 23, train_loss: 0.6738, test_loss: 1.0358, test_f1: 0.6013
 epoch: 24, train_loss: 0.6707, test_loss: 1.0026, test_f1: 0.6046
 epoch: 25, train_loss: 0.6827, test_loss: 1.0649, test_f1: 0.5815
 epoch: 26, train_loss: 0.6650, test_loss: 1.0621, test_f1: 0.6094
 epoch: 27, train_loss: 0.6424, test_loss: 1.0924, test_f1: 0.5846
 epoch: 28, train_loss: 0.6265, test_loss: 1.1417, test_f1: 0.5787
 epoch: 29, train_loss: 0.6427, test_loss: 1.0056, test_f1: 0.6223
 epoch: 30, train_loss: 0.6136, test_loss: 1.0025, test_f1: 0.6037
 epoch: 31, train_loss: 0.6116, test_loss: 1.2038, test_f1: 0.6284
 epoch: 32, train_loss: 0.6174, test_loss: 1.0214, test_f1: 0.6252
 epoch: 33, train_loss: 0.6126, test_loss: 1.0896, test_f1: 0.6054
 epoch: 34, train_loss: 0.5799, test_loss: 1.0973, test_f1: 0.6240
 epoch: 35, train_loss: 0.5704, test_loss: 1.1477, test_f1: 0.5958
 epoch: 36, train_loss: 0.5750, test_loss: 1.1116, test_f1: 0.6156
 epoch: 37, train_loss: 0.5647, test_loss: 1.0658, test_f1: 0.6043
 epoch: 38, train_loss: 0.5603, test_loss: 1.0642, test_f1: 0.6529
 epoch: 39, train_loss: 0.5352, test_loss: 1.1907, test_f1: 0.6073
 epoch: 40, train_loss: 0.5626, test_loss: 1.2840, test_f1: 0.5913
 epoch: 41, train_loss: 0.5664, test_loss: 1.1586, test_f1: 0.6099
 epoch: 42, train_loss: 0.5439, test_loss: 1.3247, test_f1: 0.6131
 epoch: 43, train_loss: 0.5185, test_loss: 1.2672, test_f1: 0.6068
 epoch: 44, train_loss: 0.5225, test_loss: 1.4527, test_f1: 0.5422
 epoch: 45, train_loss: 0.5093, test_loss: 1.4068, test_f1: 0.5985
 epoch: 46, train_loss: 0.5148, test_loss: 1.2081, test_f1: 0.6113
 epoch: 47, train_loss: 0.4935, test_loss: 1.2308, test_f1: 0.6157
 epoch: 48, train_loss: 0.4913, test_loss: 1.2106, test_f1: 0.6126
 epoch: 49, train_loss: 0.5154, test_loss: 1.2695, test_f1: 0.6114
 epoch: 50, train_loss: 0.4921, test_loss: 1.3213, test_f1: 0.6338
 epoch: 51, train_loss: 0.4490, test_loss: 1.3406, test_f1: 0.6479
 epoch: 52, train_loss: 0.4096, test_loss: 1.3815, test_f1: 0.6385
 epoch: 53, train_loss: 0.3957, test_loss: 1.4396, test_f1: 0.6305
 epoch: 54, train_loss: 0.3896, test_loss: 1.4705, test_f1: 0.6444
 epoch: 55, train_loss: 0.3858, test_loss: 1.5441, test_f1: 0.6225
 epoch: 56, train_loss: 0.3634, test_loss: 1.4992, test_f1: 0.6268
 epoch: 57, train_loss: 0.3633, test_loss: 1.6960, test_f1: 0.6514
 epoch: 58, train_loss: 0.3633, test_loss: 1.5594, test_f1: 0.6350
 epoch: 59, train_loss: 0.3512, test_loss: 1.6105, test_f1: 0.6285
 epoch: 60, train_loss: 0.3525, test_loss: 1.4350, test_f1: 0.6524
 epoch: 61, train_loss: 0.3415, test_loss: 1.6166, test_f1: 0.6368
 epoch: 62, train_loss: 0.3417, test_loss: 1.5751, test_f1: 0.6252
 epoch: 63, train_loss: 0.3155, test_loss: 1.6773, test_f1: 0.6217
 epoch: 64, train_loss: 0.3192, test_loss: 1.5986, test_f1: 0.6407
 epoch: 65, train_loss: 0.3129, test_loss: 1.6008, test_f1: 0.6376
 epoch: 66, train_loss: 0.3113, test_loss: 1.6563, test_f1: 0.6360
 epoch: 67, train_loss: 0.3187, test_loss: 1.6722, test_f1: 0.6843
 epoch: 68, train_loss: 0.3124, test_loss: 1.6008, test_f1: 0.6610
 epoch: 69, train_loss: 0.2975, test_loss: 1.7146, test_f1: 0.6359
 epoch: 70, train_loss: 0.3128, test_loss: 1.7131, test_f1: 0.6640
 epoch: 71, train_loss: 0.2985, test_loss: 1.7147, test_f1: 0.6681
 epoch: 72, train_loss: 0.2871, test_loss: 1.7837, test_f1: 0.6309
 epoch: 73, train_loss: 0.3066, test_loss: 1.8637, test_f1: 0.6367
 epoch: 74, train_loss: 0.2731, test_loss: 1.7260, test_f1: 0.6512
 epoch: 75, train_loss: 0.2829, test_loss: 1.8185, test_f1: 0.6243
 epoch: 76, train_loss: 0.2831, test_loss: 1.7571, test_f1: 0.6437
 epoch: 77, train_loss: 0.2845, test_loss: 1.7975, test_f1: 0.6643
 epoch: 78, train_loss: 0.2937, test_loss: 1.7122, test_f1: 0.6163
 epoch: 79, train_loss: 0.2612, test_loss: 1.7705, test_f1: 0.6405
 epoch: 80, train_loss: 0.2656, test_loss: 1.8715, test_f1: 0.6333
 epoch: 81, train_loss: 0.2629, test_loss: 2.2367, test_f1: 0.6183
 epoch: 82, train_loss: 0.2523, test_loss: 1.8963, test_f1: 0.6592
 epoch: 83, train_loss: 0.2699, test_loss: 1.8925, test_f1: 0.6433
 epoch: 84, train_loss: 0.2660, test_loss: 2.0310, test_f1: 0.6600
 epoch: 85, train_loss: 0.2702, test_loss: 1.6916, test_f1: 0.6125
 epoch: 86, train_loss: 0.2524, test_loss: 1.8303, test_f1: 0.6737
 epoch: 87, train_loss: 0.2659, test_loss: 1.8747, test_f1: 0.6423
 epoch: 88, train_loss: 0.2563, test_loss: 1.7974, test_f1: 0.6613
 epoch: 89, train_loss: 0.2397, test_loss: 1.9731, test_f1: 0.6513
 epoch: 90, train_loss: 0.2425, test_loss: 2.0894, test_f1: 0.6374
 epoch: 91, train_loss: 0.2456, test_loss: 2.0012, test_f1: 0.6317
 epoch: 92, train_loss: 0.2303, test_loss: 2.1985, test_f1: 0.6423
 epoch: 93, train_loss: 0.2435, test_loss: 2.0278, test_f1: 0.6336
 epoch: 94, train_loss: 0.2381, test_loss: 2.1283, test_f1: 0.6402
 epoch: 95, train_loss: 0.2347, test_loss: 2.1093, test_f1: 0.6401
 epoch: 96, train_loss: 0.2376, test_loss: 2.1367, test_f1: 0.6347
 epoch: 97, train_loss: 0.2273, test_loss: 2.1288, test_f1: 0.6457
 epoch: 98, train_loss: 0.2309, test_loss: 2.2245, test_f1: 0.6401
 epoch: 99, train_loss: 0.2096, test_loss: 2.2461, test_f1: 0.6491

Training completed in 568.53 seconds
Best F1: 0.6895 at epoch 80
Mean F1 across iterations: 0.6691  0.0114
========================FINAL RESULTS================================
FEGIN weighted F1: 0.6895  0.0114
python main.py --data ltspice_examples --representation component_net --model FEGIN --layers 6 --hiddens 128 --batch_size 128 --lr 0.001 --emb_size 128 --epochs 100 --save_appendix component_net_L6_H128_BS128_LR0.001_E128 --no_val
-----



STDERR:
  File "main.py", line 370, in <module>
    main()
  File "main.py", line 254, in main
    dataset = dataset_class(
  File "/home/philip/projects/ltspice_examples_code_repo/Circuit-Completion-Using-GNNs/component_classification_with_link_prediction_head/evaluation/FEGIN/kernel/circuit_datasets.py", line 15, in __init__
    self.data, self.slices = torch.load(self.processed_paths[0])
  File "/home/philip/.local/lib/python3.8/site-packages/torch/serialization.py", line 1040, in load
    warnings.warn(
  File "/usr/lib/python3.8/warnings.py", line 109, in _showwarnmsg
    sw(msg.message, msg.category, msg.filename, msg.lineno,
  File "main.py", line 47, in warn_with_traceback
    traceback.print_stack(file=log)
/home/philip/projects/ltspice_examples_code_repo/Circuit-Completion-Using-GNNs/component_classification_with_link_prediction_head/evaluation/FEGIN/kernel/circuit_datasets.py:15: FutureWarning: You are using `torch.load` with `weights_only=False` (the current default value), which uses the default pickle module implicitly. It is possible to construct malicious pickle data which will execute arbitrary code during unpickling (See https://github.com/pytorch/pytorch/blob/main/SECURITY.md#untrusted-models for more details). In a future release, the default value for `weights_only` will be flipped to `True`. This limits the functions that could be executed during unpickling. Arbitrary objects will no longer be allowed to be loaded via this mode unless they are explicitly allowlisted by the user via `torch.serialization.add_safe_globals`. We recommend you start setting `weights_only=True` for any use case where you don't have full control of the loaded file. Please open an issue on GitHub for any issues related to this experimental feature.
  self.data, self.slices = torch.load(self.processed_paths[0])
