STDOUT:
Results will be saved in /home/philip/projects/ltspice_examples_code_repo/Circuit-Completion-Using-GNNs/component_classification_with_link_prediction_head/evaluation/FEGIN/results/model_FEGIN_dataset_ltspice_examples
Command line input: python main.py --data ltspice_examples --representation component_net --model FEGIN --layers 2 --hiddens 64 --batch_size 64 --lr 0.0001 --emb_size 128 --epochs 100 --save_appendix component_net_L2_H64_BS64_LR0.0001_E128 --no_val
 is saved.
-----
ltspice_examples - FEGIN
Using 2 layers, 64 hidden units, h = 2
Loading component_net representation dataset
ENTERED
Training FEGIN on component_net representation
Train: 3558, Test: 846
##################ITERATION #0 ****************************************
 epoch: 0, train_loss: 1.3604, test_loss: 1.3541, test_f1: 0.2270
 epoch: 1, train_loss: 1.3442, test_loss: 1.3421, test_f1: 0.2270
 epoch: 2, train_loss: 1.3303, test_loss: 1.3267, test_f1: 0.2270
 epoch: 3, train_loss: 1.3108, test_loss: 1.3026, test_f1: 0.2270
 epoch: 4, train_loss: 1.2851, test_loss: 1.2721, test_f1: 0.2271
 epoch: 5, train_loss: 1.2584, test_loss: 1.2466, test_f1: 0.2289
 epoch: 6, train_loss: 1.2361, test_loss: 1.2236, test_f1: 0.2677
 epoch: 7, train_loss: 1.2189, test_loss: 1.2000, test_f1: 0.3062
 epoch: 8, train_loss: 1.1944, test_loss: 1.1738, test_f1: 0.3396
 epoch: 9, train_loss: 1.1781, test_loss: 1.1470, test_f1: 0.3723
 epoch: 10, train_loss: 1.1542, test_loss: 1.1201, test_f1: 0.3948
 epoch: 11, train_loss: 1.1317, test_loss: 1.0901, test_f1: 0.4294
 epoch: 12, train_loss: 1.1061, test_loss: 1.0641, test_f1: 0.4433
 epoch: 13, train_loss: 1.0839, test_loss: 1.0402, test_f1: 0.4371
 epoch: 14, train_loss: 1.0619, test_loss: 1.0205, test_f1: 0.4410
 epoch: 15, train_loss: 1.0393, test_loss: 1.0057, test_f1: 0.4430
 epoch: 16, train_loss: 1.0242, test_loss: 0.9886, test_f1: 0.4616
 epoch: 17, train_loss: 1.0131, test_loss: 0.9730, test_f1: 0.4596
 epoch: 18, train_loss: 0.9976, test_loss: 0.9697, test_f1: 0.4673
 epoch: 19, train_loss: 0.9834, test_loss: 0.9567, test_f1: 0.4705
 epoch: 20, train_loss: 0.9761, test_loss: 0.9567, test_f1: 0.4716
 epoch: 21, train_loss: 0.9692, test_loss: 0.9571, test_f1: 0.4735
 epoch: 22, train_loss: 0.9603, test_loss: 0.9506, test_f1: 0.4714
 epoch: 23, train_loss: 0.9597, test_loss: 0.9448, test_f1: 0.4806
 epoch: 24, train_loss: 0.9476, test_loss: 0.9435, test_f1: 0.4870
 epoch: 25, train_loss: 0.9457, test_loss: 0.9275, test_f1: 0.4906
 epoch: 26, train_loss: 0.9412, test_loss: 0.9320, test_f1: 0.4912
 epoch: 27, train_loss: 0.9371, test_loss: 0.9423, test_f1: 0.4802
 epoch: 28, train_loss: 0.9294, test_loss: 0.9278, test_f1: 0.4954
 epoch: 29, train_loss: 0.9241, test_loss: 0.9335, test_f1: 0.4816
 epoch: 30, train_loss: 0.9245, test_loss: 0.9274, test_f1: 0.4851
 epoch: 31, train_loss: 0.9231, test_loss: 0.9301, test_f1: 0.4980
 epoch: 32, train_loss: 0.9187, test_loss: 0.9221, test_f1: 0.4857
 epoch: 33, train_loss: 0.9165, test_loss: 0.9172, test_f1: 0.4987
 epoch: 34, train_loss: 0.9168, test_loss: 0.9163, test_f1: 0.5111
 epoch: 35, train_loss: 0.9065, test_loss: 0.9091, test_f1: 0.5187
 epoch: 36, train_loss: 0.9118, test_loss: 0.9176, test_f1: 0.5065
 epoch: 37, train_loss: 0.8978, test_loss: 0.9078, test_f1: 0.5116
 epoch: 38, train_loss: 0.8989, test_loss: 0.9068, test_f1: 0.5218
 epoch: 39, train_loss: 0.8965, test_loss: 0.8995, test_f1: 0.5160
 epoch: 40, train_loss: 0.8901, test_loss: 0.9125, test_f1: 0.5045
 epoch: 41, train_loss: 0.8891, test_loss: 0.9156, test_f1: 0.5085
 epoch: 42, train_loss: 0.8832, test_loss: 0.8886, test_f1: 0.5297
 epoch: 43, train_loss: 0.8802, test_loss: 0.9071, test_f1: 0.5087
 epoch: 44, train_loss: 0.8749, test_loss: 0.9152, test_f1: 0.5113
 epoch: 45, train_loss: 0.8841, test_loss: 0.8967, test_f1: 0.5150
 epoch: 46, train_loss: 0.8815, test_loss: 0.8980, test_f1: 0.5127
 epoch: 47, train_loss: 0.8662, test_loss: 0.9067, test_f1: 0.5148
 epoch: 48, train_loss: 0.8719, test_loss: 0.8924, test_f1: 0.5090
 epoch: 49, train_loss: 0.8811, test_loss: 0.9265, test_f1: 0.5015
 epoch: 50, train_loss: 0.8704, test_loss: 0.9113, test_f1: 0.5171
 epoch: 51, train_loss: 0.8684, test_loss: 0.8946, test_f1: 0.5196
 epoch: 52, train_loss: 0.8561, test_loss: 0.9050, test_f1: 0.5125
 epoch: 53, train_loss: 0.8646, test_loss: 0.9066, test_f1: 0.5099
 epoch: 54, train_loss: 0.8639, test_loss: 0.8961, test_f1: 0.5092
 epoch: 55, train_loss: 0.8606, test_loss: 0.8834, test_f1: 0.5130
 epoch: 56, train_loss: 0.8578, test_loss: 0.8978, test_f1: 0.5148
 epoch: 57, train_loss: 0.8482, test_loss: 0.8958, test_f1: 0.5164
 epoch: 58, train_loss: 0.8589, test_loss: 0.9100, test_f1: 0.5179
 epoch: 59, train_loss: 0.8623, test_loss: 0.9196, test_f1: 0.5172
 epoch: 60, train_loss: 0.8576, test_loss: 0.8978, test_f1: 0.5201
 epoch: 61, train_loss: 0.8531, test_loss: 0.8945, test_f1: 0.5139
 epoch: 62, train_loss: 0.8471, test_loss: 0.8990, test_f1: 0.5152
 epoch: 63, train_loss: 0.8517, test_loss: 0.8991, test_f1: 0.5204
 epoch: 64, train_loss: 0.8573, test_loss: 0.9047, test_f1: 0.5157
 epoch: 65, train_loss: 0.8436, test_loss: 0.9034, test_f1: 0.5162
 epoch: 66, train_loss: 0.8441, test_loss: 0.8967, test_f1: 0.5205
 epoch: 67, train_loss: 0.8478, test_loss: 0.9149, test_f1: 0.5176
 epoch: 68, train_loss: 0.8491, test_loss: 0.9153, test_f1: 0.5138
 epoch: 69, train_loss: 0.8403, test_loss: 0.9092, test_f1: 0.5140
 epoch: 70, train_loss: 0.8432, test_loss: 0.9043, test_f1: 0.5205
 epoch: 71, train_loss: 0.8414, test_loss: 0.9155, test_f1: 0.5138
 epoch: 72, train_loss: 0.8412, test_loss: 0.9062, test_f1: 0.5221
 epoch: 73, train_loss: 0.8419, test_loss: 0.8866, test_f1: 0.5130
 epoch: 74, train_loss: 0.8439, test_loss: 0.9119, test_f1: 0.5224
 epoch: 75, train_loss: 0.8430, test_loss: 0.9025, test_f1: 0.5228
 epoch: 76, train_loss: 0.8381, test_loss: 0.9292, test_f1: 0.5179
 epoch: 77, train_loss: 0.8411, test_loss: 0.8986, test_f1: 0.5197
 epoch: 78, train_loss: 0.8365, test_loss: 0.9210, test_f1: 0.5171
 epoch: 79, train_loss: 0.8369, test_loss: 0.8946, test_f1: 0.5210
 epoch: 80, train_loss: 0.8324, test_loss: 0.9020, test_f1: 0.5180
 epoch: 81, train_loss: 0.8475, test_loss: 0.9109, test_f1: 0.5228
 epoch: 82, train_loss: 0.8271, test_loss: 0.9129, test_f1: 0.5218
 epoch: 83, train_loss: 0.8309, test_loss: 0.9294, test_f1: 0.5167
 epoch: 84, train_loss: 0.8360, test_loss: 0.9160, test_f1: 0.5232
 epoch: 85, train_loss: 0.8345, test_loss: 0.9005, test_f1: 0.5282
 epoch: 86, train_loss: 0.8312, test_loss: 0.9176, test_f1: 0.5245
 epoch: 87, train_loss: 0.8311, test_loss: 0.8996, test_f1: 0.5175
 epoch: 88, train_loss: 0.8242, test_loss: 0.9136, test_f1: 0.5247
 epoch: 89, train_loss: 0.8261, test_loss: 0.9044, test_f1: 0.5210
 epoch: 90, train_loss: 0.8272, test_loss: 0.9132, test_f1: 0.5238
 epoch: 91, train_loss: 0.8274, test_loss: 0.9194, test_f1: 0.5275
 epoch: 92, train_loss: 0.8338, test_loss: 0.9202, test_f1: 0.5282
 epoch: 93, train_loss: 0.8264, test_loss: 0.9070, test_f1: 0.5250
 epoch: 94, train_loss: 0.8282, test_loss: 0.9214, test_f1: 0.5235
 epoch: 95, train_loss: 0.8251, test_loss: 0.9080, test_f1: 0.5263
 epoch: 96, train_loss: 0.8194, test_loss: 0.9169, test_f1: 0.5239
 epoch: 97, train_loss: 0.8127, test_loss: 0.9279, test_f1: 0.5274
 epoch: 98, train_loss: 0.8179, test_loss: 0.9188, test_f1: 0.5307
 epoch: 99, train_loss: 0.8146, test_loss: 0.8990, test_f1: 0.5335
##################ITERATION #1 ****************************************
 epoch: 0, train_loss: 1.3085, test_loss: 1.2881, test_f1: 0.2270
 epoch: 1, train_loss: 1.2596, test_loss: 1.2358, test_f1: 0.2783
 epoch: 2, train_loss: 1.2360, test_loss: 1.2076, test_f1: 0.2909
 epoch: 3, train_loss: 1.2112, test_loss: 1.1754, test_f1: 0.3149
 epoch: 4, train_loss: 1.1838, test_loss: 1.1458, test_f1: 0.3568
 epoch: 5, train_loss: 1.1527, test_loss: 1.1157, test_f1: 0.3818
 epoch: 6, train_loss: 1.1260, test_loss: 1.0832, test_f1: 0.3749
 epoch: 7, train_loss: 1.0971, test_loss: 1.0509, test_f1: 0.3886
 epoch: 8, train_loss: 1.0681, test_loss: 1.0359, test_f1: 0.4061
 epoch: 9, train_loss: 1.0510, test_loss: 1.0136, test_f1: 0.4117
 epoch: 10, train_loss: 1.0342, test_loss: 1.0029, test_f1: 0.4395
 epoch: 11, train_loss: 1.0181, test_loss: 0.9936, test_f1: 0.4379
 epoch: 12, train_loss: 1.0072, test_loss: 0.9825, test_f1: 0.4574
 epoch: 13, train_loss: 0.9907, test_loss: 0.9792, test_f1: 0.4690
 epoch: 14, train_loss: 0.9865, test_loss: 0.9668, test_f1: 0.4640
 epoch: 15, train_loss: 0.9761, test_loss: 0.9593, test_f1: 0.4645
 epoch: 16, train_loss: 0.9734, test_loss: 0.9565, test_f1: 0.4718
 epoch: 17, train_loss: 0.9645, test_loss: 0.9517, test_f1: 0.4793
 epoch: 18, train_loss: 0.9569, test_loss: 0.9353, test_f1: 0.4921
 epoch: 19, train_loss: 0.9434, test_loss: 0.9403, test_f1: 0.4938
 epoch: 20, train_loss: 0.9399, test_loss: 0.9224, test_f1: 0.4859
 epoch: 21, train_loss: 0.9450, test_loss: 0.9247, test_f1: 0.4954
 epoch: 22, train_loss: 0.9262, test_loss: 0.9270, test_f1: 0.4954
 epoch: 23, train_loss: 0.9255, test_loss: 0.9110, test_f1: 0.4955
 epoch: 24, train_loss: 0.9190, test_loss: 0.9331, test_f1: 0.4896
 epoch: 25, train_loss: 0.9205, test_loss: 0.9136, test_f1: 0.4978
 epoch: 26, train_loss: 0.9110, test_loss: 0.9146, test_f1: 0.4987
 epoch: 27, train_loss: 0.9065, test_loss: 0.9203, test_f1: 0.5079
 epoch: 28, train_loss: 0.9029, test_loss: 0.9184, test_f1: 0.5060
 epoch: 29, train_loss: 0.8995, test_loss: 0.9072, test_f1: 0.5073
 epoch: 30, train_loss: 0.8983, test_loss: 0.9018, test_f1: 0.5150
 epoch: 31, train_loss: 0.8925, test_loss: 0.9120, test_f1: 0.5101
 epoch: 32, train_loss: 0.8975, test_loss: 0.9023, test_f1: 0.5218
 epoch: 33, train_loss: 0.8872, test_loss: 0.9085, test_f1: 0.5209
 epoch: 34, train_loss: 0.8921, test_loss: 0.9047, test_f1: 0.5352
 epoch: 35, train_loss: 0.8843, test_loss: 0.9121, test_f1: 0.5214
 epoch: 36, train_loss: 0.8790, test_loss: 0.9112, test_f1: 0.5379
 epoch: 37, train_loss: 0.8750, test_loss: 0.8932, test_f1: 0.5439
 epoch: 38, train_loss: 0.8736, test_loss: 0.8974, test_f1: 0.5391
 epoch: 39, train_loss: 0.8670, test_loss: 0.9091, test_f1: 0.5450
 epoch: 40, train_loss: 0.8595, test_loss: 0.9189, test_f1: 0.5408
 epoch: 41, train_loss: 0.8566, test_loss: 0.9115, test_f1: 0.5430
 epoch: 42, train_loss: 0.8681, test_loss: 0.9111, test_f1: 0.5466
 epoch: 43, train_loss: 0.8550, test_loss: 0.9161, test_f1: 0.5385
 epoch: 44, train_loss: 0.8579, test_loss: 0.9001, test_f1: 0.5612
 epoch: 45, train_loss: 0.8521, test_loss: 0.9050, test_f1: 0.5438
 epoch: 46, train_loss: 0.8556, test_loss: 0.9087, test_f1: 0.5457
 epoch: 47, train_loss: 0.8528, test_loss: 0.9164, test_f1: 0.5506
 epoch: 48, train_loss: 0.8513, test_loss: 0.8990, test_f1: 0.5443
 epoch: 49, train_loss: 0.8409, test_loss: 0.9246, test_f1: 0.5305
 epoch: 50, train_loss: 0.8337, test_loss: 0.9159, test_f1: 0.5556
 epoch: 51, train_loss: 0.8317, test_loss: 0.9225, test_f1: 0.5424
 epoch: 52, train_loss: 0.8399, test_loss: 0.9146, test_f1: 0.5615
 epoch: 53, train_loss: 0.8310, test_loss: 0.9177, test_f1: 0.5448
 epoch: 54, train_loss: 0.8323, test_loss: 0.9227, test_f1: 0.5335
 epoch: 55, train_loss: 0.8312, test_loss: 0.9195, test_f1: 0.5465
 epoch: 56, train_loss: 0.8266, test_loss: 0.9105, test_f1: 0.5587
 epoch: 57, train_loss: 0.8233, test_loss: 0.9125, test_f1: 0.5596
 epoch: 58, train_loss: 0.8308, test_loss: 0.9070, test_f1: 0.5671
 epoch: 59, train_loss: 0.8245, test_loss: 0.9094, test_f1: 0.5671
 epoch: 60, train_loss: 0.8219, test_loss: 0.9128, test_f1: 0.5508
 epoch: 61, train_loss: 0.8213, test_loss: 0.9168, test_f1: 0.5556
 epoch: 62, train_loss: 0.8192, test_loss: 0.9151, test_f1: 0.5580
 epoch: 63, train_loss: 0.8252, test_loss: 0.9161, test_f1: 0.5663
 epoch: 64, train_loss: 0.8146, test_loss: 0.9242, test_f1: 0.5590
 epoch: 65, train_loss: 0.8189, test_loss: 0.9162, test_f1: 0.5681
 epoch: 66, train_loss: 0.8146, test_loss: 0.9182, test_f1: 0.5683
 epoch: 67, train_loss: 0.8160, test_loss: 0.9222, test_f1: 0.5576
 epoch: 68, train_loss: 0.8173, test_loss: 0.9269, test_f1: 0.5610
 epoch: 69, train_loss: 0.8190, test_loss: 0.9222, test_f1: 0.5633
 epoch: 70, train_loss: 0.8068, test_loss: 0.9164, test_f1: 0.5562
 epoch: 71, train_loss: 0.8050, test_loss: 0.9200, test_f1: 0.5542
 epoch: 72, train_loss: 0.8062, test_loss: 0.9188, test_f1: 0.5509
 epoch: 73, train_loss: 0.8038, test_loss: 0.9270, test_f1: 0.5583
 epoch: 74, train_loss: 0.8042, test_loss: 0.9236, test_f1: 0.5472
 epoch: 75, train_loss: 0.8137, test_loss: 0.9149, test_f1: 0.5634
 epoch: 76, train_loss: 0.7966, test_loss: 0.9096, test_f1: 0.5736
 epoch: 77, train_loss: 0.8103, test_loss: 0.9161, test_f1: 0.5658
 epoch: 78, train_loss: 0.8000, test_loss: 0.9191, test_f1: 0.5527
 epoch: 79, train_loss: 0.7995, test_loss: 0.9161, test_f1: 0.5590
 epoch: 80, train_loss: 0.8051, test_loss: 0.9159, test_f1: 0.5714
 epoch: 81, train_loss: 0.7929, test_loss: 0.9216, test_f1: 0.5531
 epoch: 82, train_loss: 0.7967, test_loss: 0.9211, test_f1: 0.5599
 epoch: 83, train_loss: 0.8020, test_loss: 0.9233, test_f1: 0.5637
 epoch: 84, train_loss: 0.7925, test_loss: 0.9244, test_f1: 0.5608
 epoch: 85, train_loss: 0.7949, test_loss: 0.9267, test_f1: 0.5660
 epoch: 86, train_loss: 0.7887, test_loss: 0.9208, test_f1: 0.5603
 epoch: 87, train_loss: 0.7887, test_loss: 0.9195, test_f1: 0.5685
 epoch: 88, train_loss: 0.8001, test_loss: 0.9254, test_f1: 0.5538
 epoch: 89, train_loss: 0.7895, test_loss: 0.9278, test_f1: 0.5566
 epoch: 90, train_loss: 0.7927, test_loss: 0.9171, test_f1: 0.5750
 epoch: 91, train_loss: 0.7803, test_loss: 0.9286, test_f1: 0.5622
 epoch: 92, train_loss: 0.7908, test_loss: 0.9248, test_f1: 0.5655
 epoch: 93, train_loss: 0.7799, test_loss: 0.9305, test_f1: 0.5644
 epoch: 94, train_loss: 0.7902, test_loss: 0.9316, test_f1: 0.5692
 epoch: 95, train_loss: 0.7781, test_loss: 0.9307, test_f1: 0.5578
 epoch: 96, train_loss: 0.7838, test_loss: 0.9434, test_f1: 0.5528
 epoch: 97, train_loss: 0.7828, test_loss: 0.9336, test_f1: 0.5593
 epoch: 98, train_loss: 0.7818, test_loss: 0.9270, test_f1: 0.5705
 epoch: 99, train_loss: 0.7810, test_loss: 0.9321, test_f1: 0.5634
##################ITERATION #2 ****************************************
 epoch: 0, train_loss: 1.2863, test_loss: 1.2556, test_f1: 0.2295
 epoch: 1, train_loss: 1.2253, test_loss: 1.1799, test_f1: 0.3229
 epoch: 2, train_loss: 1.1892, test_loss: 1.1451, test_f1: 0.3402
 epoch: 3, train_loss: 1.1550, test_loss: 1.1108, test_f1: 0.3467
 epoch: 4, train_loss: 1.1233, test_loss: 1.0873, test_f1: 0.3570
 epoch: 5, train_loss: 1.0970, test_loss: 1.0634, test_f1: 0.3767
 epoch: 6, train_loss: 1.0789, test_loss: 1.0446, test_f1: 0.3976
 epoch: 7, train_loss: 1.0472, test_loss: 1.0261, test_f1: 0.4138
 epoch: 8, train_loss: 1.0376, test_loss: 1.0141, test_f1: 0.4167
 epoch: 9, train_loss: 1.0228, test_loss: 1.0041, test_f1: 0.4447
 epoch: 10, train_loss: 1.0133, test_loss: 0.9995, test_f1: 0.4419
 epoch: 11, train_loss: 1.0056, test_loss: 0.9917, test_f1: 0.4532
 epoch: 12, train_loss: 1.0000, test_loss: 0.9890, test_f1: 0.4554
 epoch: 13, train_loss: 0.9875, test_loss: 0.9872, test_f1: 0.4679
 epoch: 14, train_loss: 0.9775, test_loss: 0.9640, test_f1: 0.4727
 epoch: 15, train_loss: 0.9727, test_loss: 0.9845, test_f1: 0.4753
 epoch: 16, train_loss: 0.9702, test_loss: 0.9635, test_f1: 0.4845
 epoch: 17, train_loss: 0.9656, test_loss: 0.9577, test_f1: 0.4854
 epoch: 18, train_loss: 0.9543, test_loss: 0.9686, test_f1: 0.4837
 epoch: 19, train_loss: 0.9475, test_loss: 0.9618, test_f1: 0.4877
 epoch: 20, train_loss: 0.9432, test_loss: 0.9562, test_f1: 0.4918
 epoch: 21, train_loss: 0.9379, test_loss: 0.9465, test_f1: 0.4956
 epoch: 22, train_loss: 0.9414, test_loss: 0.9552, test_f1: 0.4989
 epoch: 23, train_loss: 0.9300, test_loss: 0.9507, test_f1: 0.4944
 epoch: 24, train_loss: 0.9267, test_loss: 0.9342, test_f1: 0.5173
 epoch: 25, train_loss: 0.9296, test_loss: 0.9335, test_f1: 0.5187
 epoch: 26, train_loss: 0.9213, test_loss: 0.9211, test_f1: 0.5203
 epoch: 27, train_loss: 0.9188, test_loss: 0.9350, test_f1: 0.5170
 epoch: 28, train_loss: 0.9154, test_loss: 0.9281, test_f1: 0.5179
 epoch: 29, train_loss: 0.9147, test_loss: 0.9235, test_f1: 0.5252
 epoch: 30, train_loss: 0.9207, test_loss: 0.9329, test_f1: 0.5226
 epoch: 31, train_loss: 0.9069, test_loss: 0.9368, test_f1: 0.5267
 epoch: 32, train_loss: 0.9044, test_loss: 0.9295, test_f1: 0.5108
 epoch: 33, train_loss: 0.8994, test_loss: 0.9212, test_f1: 0.5111
 epoch: 34, train_loss: 0.8994, test_loss: 0.8974, test_f1: 0.5157
 epoch: 35, train_loss: 0.8886, test_loss: 0.9369, test_f1: 0.5147
 epoch: 36, train_loss: 0.8891, test_loss: 0.9268, test_f1: 0.5175
 epoch: 37, train_loss: 0.8891, test_loss: 0.9109, test_f1: 0.5113
 epoch: 38, train_loss: 0.8863, test_loss: 0.9185, test_f1: 0.5334
 epoch: 39, train_loss: 0.8789, test_loss: 0.8991, test_f1: 0.5243
 epoch: 40, train_loss: 0.8809, test_loss: 0.9200, test_f1: 0.5285
 epoch: 41, train_loss: 0.8721, test_loss: 0.9146, test_f1: 0.5406
 epoch: 42, train_loss: 0.8746, test_loss: 0.9167, test_f1: 0.5229
 epoch: 43, train_loss: 0.8623, test_loss: 0.9153, test_f1: 0.5217
 epoch: 44, train_loss: 0.8735, test_loss: 0.8935, test_f1: 0.5345
 epoch: 45, train_loss: 0.8628, test_loss: 0.9345, test_f1: 0.5190
 epoch: 46, train_loss: 0.8613, test_loss: 0.9198, test_f1: 0.5243
 epoch: 47, train_loss: 0.8641, test_loss: 0.9178, test_f1: 0.5332
 epoch: 48, train_loss: 0.8626, test_loss: 0.9106, test_f1: 0.5311
 epoch: 49, train_loss: 0.8607, test_loss: 0.9136, test_f1: 0.5278
 epoch: 50, train_loss: 0.8519, test_loss: 0.9155, test_f1: 0.5452
 epoch: 51, train_loss: 0.8539, test_loss: 0.9015, test_f1: 0.5368
 epoch: 52, train_loss: 0.8400, test_loss: 0.9051, test_f1: 0.5412
 epoch: 53, train_loss: 0.8553, test_loss: 0.8986, test_f1: 0.5399
 epoch: 54, train_loss: 0.8436, test_loss: 0.8896, test_f1: 0.5359
 epoch: 55, train_loss: 0.8495, test_loss: 0.8976, test_f1: 0.5373
 epoch: 56, train_loss: 0.8319, test_loss: 0.8948, test_f1: 0.5381
 epoch: 57, train_loss: 0.8400, test_loss: 0.8894, test_f1: 0.5346
 epoch: 58, train_loss: 0.8342, test_loss: 0.9076, test_f1: 0.5495
 epoch: 59, train_loss: 0.8342, test_loss: 0.8898, test_f1: 0.5412
 epoch: 60, train_loss: 0.8295, test_loss: 0.8821, test_f1: 0.5494
 epoch: 61, train_loss: 0.8412, test_loss: 0.8925, test_f1: 0.5379
 epoch: 62, train_loss: 0.8298, test_loss: 0.8890, test_f1: 0.5440
 epoch: 63, train_loss: 0.8292, test_loss: 0.8774, test_f1: 0.5282
 epoch: 64, train_loss: 0.8294, test_loss: 0.8979, test_f1: 0.5477
 epoch: 65, train_loss: 0.8371, test_loss: 0.8896, test_f1: 0.5320
 epoch: 66, train_loss: 0.8241, test_loss: 0.8977, test_f1: 0.5356
 epoch: 67, train_loss: 0.8335, test_loss: 0.9013, test_f1: 0.5416
 epoch: 68, train_loss: 0.8373, test_loss: 0.8891, test_f1: 0.5541
 epoch: 69, train_loss: 0.8307, test_loss: 0.8911, test_f1: 0.5436
 epoch: 70, train_loss: 0.8266, test_loss: 0.9020, test_f1: 0.5425
 epoch: 71, train_loss: 0.8226, test_loss: 0.8758, test_f1: 0.5497
 epoch: 72, train_loss: 0.8287, test_loss: 0.8807, test_f1: 0.5337
 epoch: 73, train_loss: 0.8254, test_loss: 0.9064, test_f1: 0.5392
 epoch: 74, train_loss: 0.8258, test_loss: 0.8766, test_f1: 0.5388
 epoch: 75, train_loss: 0.8201, test_loss: 0.8728, test_f1: 0.5402
 epoch: 76, train_loss: 0.8225, test_loss: 0.8863, test_f1: 0.5390
 epoch: 77, train_loss: 0.8273, test_loss: 0.8837, test_f1: 0.5334
 epoch: 78, train_loss: 0.8171, test_loss: 0.8801, test_f1: 0.5299
 epoch: 79, train_loss: 0.8220, test_loss: 0.8717, test_f1: 0.5332
 epoch: 80, train_loss: 0.8116, test_loss: 0.8850, test_f1: 0.5493
 epoch: 81, train_loss: 0.8161, test_loss: 0.8703, test_f1: 0.5525
 epoch: 82, train_loss: 0.8168, test_loss: 0.8996, test_f1: 0.5478
 epoch: 83, train_loss: 0.8191, test_loss: 0.8746, test_f1: 0.5395
 epoch: 84, train_loss: 0.8156, test_loss: 0.8745, test_f1: 0.5567
 epoch: 85, train_loss: 0.8119, test_loss: 0.8705, test_f1: 0.5461
 epoch: 86, train_loss: 0.8118, test_loss: 0.8721, test_f1: 0.5520
 epoch: 87, train_loss: 0.8072, test_loss: 0.8798, test_f1: 0.5463
 epoch: 88, train_loss: 0.8043, test_loss: 0.8618, test_f1: 0.5514
 epoch: 89, train_loss: 0.8074, test_loss: 0.8819, test_f1: 0.5461
 epoch: 90, train_loss: 0.8088, test_loss: 0.9006, test_f1: 0.5520
 epoch: 91, train_loss: 0.8013, test_loss: 0.8729, test_f1: 0.5560
 epoch: 92, train_loss: 0.8022, test_loss: 0.8650, test_f1: 0.5415
 epoch: 93, train_loss: 0.8028, test_loss: 0.8782, test_f1: 0.5489
 epoch: 94, train_loss: 0.8103, test_loss: 0.8968, test_f1: 0.5524
 epoch: 95, train_loss: 0.8065, test_loss: 0.8597, test_f1: 0.5541
 epoch: 96, train_loss: 0.8003, test_loss: 0.8757, test_f1: 0.5527
 epoch: 97, train_loss: 0.7917, test_loss: 0.8538, test_f1: 0.5532
 epoch: 98, train_loss: 0.7919, test_loss: 0.8839, test_f1: 0.5462
 epoch: 99, train_loss: 0.7970, test_loss: 0.8788, test_f1: 0.5441
##################ITERATION #3 ****************************************
 epoch: 0, train_loss: 1.2620, test_loss: 1.2207, test_f1: 0.2464
 epoch: 1, train_loss: 1.1990, test_loss: 1.1610, test_f1: 0.3580
 epoch: 2, train_loss: 1.1735, test_loss: 1.1300, test_f1: 0.3797
 epoch: 3, train_loss: 1.1464, test_loss: 1.1017, test_f1: 0.4437
 epoch: 4, train_loss: 1.1258, test_loss: 1.0759, test_f1: 0.4609
 epoch: 5, train_loss: 1.0998, test_loss: 1.0575, test_f1: 0.4396
 epoch: 6, train_loss: 1.0764, test_loss: 1.0341, test_f1: 0.4479
 epoch: 7, train_loss: 1.0532, test_loss: 1.0179, test_f1: 0.4513
 epoch: 8, train_loss: 1.0409, test_loss: 1.0012, test_f1: 0.4544
 epoch: 9, train_loss: 1.0222, test_loss: 0.9924, test_f1: 0.4631
 epoch: 10, train_loss: 1.0138, test_loss: 0.9806, test_f1: 0.4599
 epoch: 11, train_loss: 0.9991, test_loss: 0.9777, test_f1: 0.4556
 epoch: 12, train_loss: 0.9887, test_loss: 0.9689, test_f1: 0.4648
 epoch: 13, train_loss: 0.9823, test_loss: 0.9580, test_f1: 0.4721
 epoch: 14, train_loss: 0.9746, test_loss: 0.9609, test_f1: 0.4702
 epoch: 15, train_loss: 0.9586, test_loss: 0.9593, test_f1: 0.4759
 epoch: 16, train_loss: 0.9567, test_loss: 0.9570, test_f1: 0.4700
 epoch: 17, train_loss: 0.9527, test_loss: 0.9519, test_f1: 0.4986
 epoch: 18, train_loss: 0.9527, test_loss: 0.9450, test_f1: 0.5020
 epoch: 19, train_loss: 0.9357, test_loss: 0.9459, test_f1: 0.4916
 epoch: 20, train_loss: 0.9335, test_loss: 0.9600, test_f1: 0.4836
 epoch: 21, train_loss: 0.9290, test_loss: 0.9472, test_f1: 0.4906
 epoch: 22, train_loss: 0.9229, test_loss: 0.9500, test_f1: 0.5127
 epoch: 23, train_loss: 0.9161, test_loss: 0.9383, test_f1: 0.5138
 epoch: 24, train_loss: 0.9088, test_loss: 0.9222, test_f1: 0.5101
 epoch: 25, train_loss: 0.9144, test_loss: 0.9465, test_f1: 0.5175
 epoch: 26, train_loss: 0.9042, test_loss: 0.9430, test_f1: 0.5106
 epoch: 27, train_loss: 0.9050, test_loss: 0.9655, test_f1: 0.5103
 epoch: 28, train_loss: 0.8978, test_loss: 0.9392, test_f1: 0.5102
 epoch: 29, train_loss: 0.8931, test_loss: 0.9192, test_f1: 0.5288
 epoch: 30, train_loss: 0.9030, test_loss: 0.9455, test_f1: 0.5088
 epoch: 31, train_loss: 0.8941, test_loss: 0.9325, test_f1: 0.5169
 epoch: 32, train_loss: 0.8761, test_loss: 0.9275, test_f1: 0.5127
 epoch: 33, train_loss: 0.8817, test_loss: 0.9269, test_f1: 0.5168
 epoch: 34, train_loss: 0.8756, test_loss: 0.9320, test_f1: 0.5121
 epoch: 35, train_loss: 0.8721, test_loss: 0.9387, test_f1: 0.5038
 epoch: 36, train_loss: 0.8573, test_loss: 0.9335, test_f1: 0.5047
 epoch: 37, train_loss: 0.8749, test_loss: 0.9306, test_f1: 0.5091
 epoch: 38, train_loss: 0.8540, test_loss: 0.9223, test_f1: 0.5098
 epoch: 39, train_loss: 0.8609, test_loss: 0.9230, test_f1: 0.5191
 epoch: 40, train_loss: 0.8582, test_loss: 0.9266, test_f1: 0.5177
 epoch: 41, train_loss: 0.8665, test_loss: 0.9313, test_f1: 0.5146
 epoch: 42, train_loss: 0.8488, test_loss: 0.9341, test_f1: 0.4990
 epoch: 43, train_loss: 0.8524, test_loss: 0.9382, test_f1: 0.5164
 epoch: 44, train_loss: 0.8483, test_loss: 0.9298, test_f1: 0.5133
 epoch: 45, train_loss: 0.8506, test_loss: 0.9276, test_f1: 0.5216
 epoch: 46, train_loss: 0.8420, test_loss: 0.9458, test_f1: 0.5174
 epoch: 47, train_loss: 0.8437, test_loss: 0.9251, test_f1: 0.5155
 epoch: 48, train_loss: 0.8316, test_loss: 0.9255, test_f1: 0.5206
 epoch: 49, train_loss: 0.8378, test_loss: 0.9399, test_f1: 0.5192
 epoch: 50, train_loss: 0.8319, test_loss: 0.9565, test_f1: 0.5075
 epoch: 51, train_loss: 0.8299, test_loss: 0.9407, test_f1: 0.5232
 epoch: 52, train_loss: 0.8266, test_loss: 0.9212, test_f1: 0.5211
 epoch: 53, train_loss: 0.8190, test_loss: 0.9413, test_f1: 0.5014
 epoch: 54, train_loss: 0.8308, test_loss: 0.9371, test_f1: 0.5160
 epoch: 55, train_loss: 0.8239, test_loss: 0.9378, test_f1: 0.5156
 epoch: 56, train_loss: 0.8102, test_loss: 0.9425, test_f1: 0.5136
 epoch: 57, train_loss: 0.8126, test_loss: 0.9444, test_f1: 0.5131
 epoch: 58, train_loss: 0.8268, test_loss: 0.9462, test_f1: 0.5068
 epoch: 59, train_loss: 0.8249, test_loss: 0.9484, test_f1: 0.5196
 epoch: 60, train_loss: 0.8251, test_loss: 0.9445, test_f1: 0.5196
 epoch: 61, train_loss: 0.8215, test_loss: 0.9640, test_f1: 0.5139
 epoch: 62, train_loss: 0.8211, test_loss: 0.9348, test_f1: 0.5308
 epoch: 63, train_loss: 0.8145, test_loss: 0.9456, test_f1: 0.5102
 epoch: 64, train_loss: 0.8178, test_loss: 0.9304, test_f1: 0.5280
 epoch: 65, train_loss: 0.8156, test_loss: 0.9429, test_f1: 0.5249
 epoch: 66, train_loss: 0.8190, test_loss: 0.9319, test_f1: 0.5287
 epoch: 67, train_loss: 0.8128, test_loss: 0.9387, test_f1: 0.5129
 epoch: 68, train_loss: 0.8076, test_loss: 0.9449, test_f1: 0.5328
 epoch: 69, train_loss: 0.8108, test_loss: 0.9368, test_f1: 0.5190
 epoch: 70, train_loss: 0.8160, test_loss: 0.9473, test_f1: 0.5267
 epoch: 71, train_loss: 0.7991, test_loss: 0.9419, test_f1: 0.5279
 epoch: 72, train_loss: 0.8084, test_loss: 0.9500, test_f1: 0.5307
 epoch: 73, train_loss: 0.8004, test_loss: 0.9379, test_f1: 0.5245
 epoch: 74, train_loss: 0.7974, test_loss: 0.9411, test_f1: 0.5258
 epoch: 75, train_loss: 0.8059, test_loss: 0.9632, test_f1: 0.5110
 epoch: 76, train_loss: 0.8013, test_loss: 0.9469, test_f1: 0.5232
 epoch: 77, train_loss: 0.7935, test_loss: 0.9472, test_f1: 0.5176
 epoch: 78, train_loss: 0.8034, test_loss: 0.9423, test_f1: 0.5214
 epoch: 79, train_loss: 0.8062, test_loss: 0.9525, test_f1: 0.5213
 epoch: 80, train_loss: 0.7974, test_loss: 0.9577, test_f1: 0.5048
 epoch: 81, train_loss: 0.8035, test_loss: 0.9394, test_f1: 0.5148
 epoch: 82, train_loss: 0.7915, test_loss: 0.9287, test_f1: 0.5131
 epoch: 83, train_loss: 0.8014, test_loss: 0.9438, test_f1: 0.5065
 epoch: 84, train_loss: 0.8008, test_loss: 0.9663, test_f1: 0.4998
 epoch: 85, train_loss: 0.8067, test_loss: 0.9431, test_f1: 0.5146
 epoch: 86, train_loss: 0.8027, test_loss: 0.9490, test_f1: 0.5104
 epoch: 87, train_loss: 0.8002, test_loss: 0.9430, test_f1: 0.5187
 epoch: 88, train_loss: 0.7951, test_loss: 0.9500, test_f1: 0.5126
 epoch: 89, train_loss: 0.7905, test_loss: 0.9487, test_f1: 0.5100
 epoch: 90, train_loss: 0.7861, test_loss: 0.9532, test_f1: 0.5221
 epoch: 91, train_loss: 0.7925, test_loss: 0.9507, test_f1: 0.5131
 epoch: 92, train_loss: 0.7912, test_loss: 0.9675, test_f1: 0.5137
 epoch: 93, train_loss: 0.7919, test_loss: 0.9504, test_f1: 0.5161
 epoch: 94, train_loss: 0.7823, test_loss: 0.9543, test_f1: 0.5224
 epoch: 95, train_loss: 0.7862, test_loss: 0.9503, test_f1: 0.5217
 epoch: 96, train_loss: 0.7930, test_loss: 0.9565, test_f1: 0.5262
 epoch: 97, train_loss: 0.7917, test_loss: 0.9455, test_f1: 0.5101
 epoch: 98, train_loss: 0.7806, test_loss: 0.9600, test_f1: 0.5015
 epoch: 99, train_loss: 0.7815, test_loss: 0.9540, test_f1: 0.5265
##################ITERATION #4 ****************************************
 epoch: 0, train_loss: 1.2542, test_loss: 1.1859, test_f1: 0.2826
 epoch: 1, train_loss: 1.1742, test_loss: 1.1124, test_f1: 0.3753
 epoch: 2, train_loss: 1.1455, test_loss: 1.0877, test_f1: 0.3985
 epoch: 3, train_loss: 1.1197, test_loss: 1.0606, test_f1: 0.4228
 epoch: 4, train_loss: 1.0968, test_loss: 1.0367, test_f1: 0.4468
 epoch: 5, train_loss: 1.0723, test_loss: 1.0259, test_f1: 0.4382
 epoch: 6, train_loss: 1.0591, test_loss: 1.0085, test_f1: 0.4638
 epoch: 7, train_loss: 1.0366, test_loss: 1.0038, test_f1: 0.4620
 epoch: 8, train_loss: 1.0146, test_loss: 0.9852, test_f1: 0.4646
 epoch: 9, train_loss: 1.0089, test_loss: 0.9751, test_f1: 0.4965
 epoch: 10, train_loss: 0.9970, test_loss: 0.9715, test_f1: 0.4889
 epoch: 11, train_loss: 0.9848, test_loss: 0.9593, test_f1: 0.4952
 epoch: 12, train_loss: 0.9754, test_loss: 0.9519, test_f1: 0.4990
 epoch: 13, train_loss: 0.9638, test_loss: 0.9487, test_f1: 0.4984
 epoch: 14, train_loss: 0.9547, test_loss: 0.9475, test_f1: 0.5047
 epoch: 15, train_loss: 0.9596, test_loss: 0.9460, test_f1: 0.4997
 epoch: 16, train_loss: 0.9436, test_loss: 0.9398, test_f1: 0.5096
 epoch: 17, train_loss: 0.9414, test_loss: 0.9409, test_f1: 0.4960
 epoch: 18, train_loss: 0.9380, test_loss: 0.9289, test_f1: 0.5047
 epoch: 19, train_loss: 0.9284, test_loss: 0.9339, test_f1: 0.4977
 epoch: 20, train_loss: 0.9239, test_loss: 0.9301, test_f1: 0.5086
 epoch: 21, train_loss: 0.9175, test_loss: 0.9220, test_f1: 0.5146
 epoch: 22, train_loss: 0.9137, test_loss: 0.9184, test_f1: 0.5322
 epoch: 23, train_loss: 0.9076, test_loss: 0.9238, test_f1: 0.5337
 epoch: 24, train_loss: 0.9027, test_loss: 0.9170, test_f1: 0.5388
 epoch: 25, train_loss: 0.8970, test_loss: 0.9296, test_f1: 0.5238
 epoch: 26, train_loss: 0.8882, test_loss: 0.9204, test_f1: 0.5417
 epoch: 27, train_loss: 0.8963, test_loss: 0.9267, test_f1: 0.5429
 epoch: 28, train_loss: 0.8851, test_loss: 0.9476, test_f1: 0.5120
 epoch: 29, train_loss: 0.8932, test_loss: 0.9272, test_f1: 0.5381
 epoch: 30, train_loss: 0.8828, test_loss: 0.9321, test_f1: 0.5056
 epoch: 31, train_loss: 0.8751, test_loss: 0.9346, test_f1: 0.5267
 epoch: 32, train_loss: 0.8745, test_loss: 0.9346, test_f1: 0.5315
 epoch: 33, train_loss: 0.8831, test_loss: 0.9286, test_f1: 0.5277
 epoch: 34, train_loss: 0.8686, test_loss: 0.9355, test_f1: 0.5258
 epoch: 35, train_loss: 0.8705, test_loss: 0.9271, test_f1: 0.5317
 epoch: 36, train_loss: 0.8611, test_loss: 0.9293, test_f1: 0.5462
 epoch: 37, train_loss: 0.8609, test_loss: 0.9318, test_f1: 0.5284
 epoch: 38, train_loss: 0.8522, test_loss: 0.9272, test_f1: 0.5392
 epoch: 39, train_loss: 0.8523, test_loss: 0.9255, test_f1: 0.5435
 epoch: 40, train_loss: 0.8572, test_loss: 0.9230, test_f1: 0.5481
 epoch: 41, train_loss: 0.8544, test_loss: 0.9181, test_f1: 0.5377
 epoch: 42, train_loss: 0.8452, test_loss: 0.9195, test_f1: 0.5381
 epoch: 43, train_loss: 0.8422, test_loss: 0.9233, test_f1: 0.5370
 epoch: 44, train_loss: 0.8329, test_loss: 0.9290, test_f1: 0.5477
 epoch: 45, train_loss: 0.8427, test_loss: 0.9246, test_f1: 0.5369
 epoch: 46, train_loss: 0.8350, test_loss: 0.9395, test_f1: 0.5381
 epoch: 47, train_loss: 0.8310, test_loss: 0.9142, test_f1: 0.5413
 epoch: 48, train_loss: 0.8311, test_loss: 0.9204, test_f1: 0.5454
 epoch: 49, train_loss: 0.8220, test_loss: 0.9136, test_f1: 0.5378
 epoch: 50, train_loss: 0.8146, test_loss: 0.9132, test_f1: 0.5475
 epoch: 51, train_loss: 0.8222, test_loss: 0.9239, test_f1: 0.5440
 epoch: 52, train_loss: 0.8277, test_loss: 0.9230, test_f1: 0.5438
 epoch: 53, train_loss: 0.8172, test_loss: 0.9145, test_f1: 0.5510
 epoch: 54, train_loss: 0.8107, test_loss: 0.9190, test_f1: 0.5505
 epoch: 55, train_loss: 0.8131, test_loss: 0.9281, test_f1: 0.5493
 epoch: 56, train_loss: 0.8093, test_loss: 0.9242, test_f1: 0.5502
 epoch: 57, train_loss: 0.8118, test_loss: 0.9345, test_f1: 0.5412
 epoch: 58, train_loss: 0.8180, test_loss: 0.9278, test_f1: 0.5442
 epoch: 59, train_loss: 0.8053, test_loss: 0.9240, test_f1: 0.5523
 epoch: 60, train_loss: 0.8094, test_loss: 0.9198, test_f1: 0.5550
 epoch: 61, train_loss: 0.8188, test_loss: 0.9289, test_f1: 0.5406
 epoch: 62, train_loss: 0.7983, test_loss: 0.9310, test_f1: 0.5391
 epoch: 63, train_loss: 0.8026, test_loss: 0.9289, test_f1: 0.5498
 epoch: 64, train_loss: 0.8074, test_loss: 0.9209, test_f1: 0.5387
 epoch: 65, train_loss: 0.8070, test_loss: 0.9237, test_f1: 0.5495
 epoch: 66, train_loss: 0.7979, test_loss: 0.9201, test_f1: 0.5508
 epoch: 67, train_loss: 0.8009, test_loss: 0.9070, test_f1: 0.5577
 epoch: 68, train_loss: 0.7950, test_loss: 0.9147, test_f1: 0.5567
 epoch: 69, train_loss: 0.8084, test_loss: 0.9321, test_f1: 0.5567
 epoch: 70, train_loss: 0.8043, test_loss: 0.9201, test_f1: 0.5623
 epoch: 71, train_loss: 0.7976, test_loss: 0.9243, test_f1: 0.5668
 epoch: 72, train_loss: 0.8053, test_loss: 0.9342, test_f1: 0.5552
 epoch: 73, train_loss: 0.7877, test_loss: 0.9374, test_f1: 0.5633
 epoch: 74, train_loss: 0.7989, test_loss: 0.9157, test_f1: 0.5635
 epoch: 75, train_loss: 0.7973, test_loss: 0.9171, test_f1: 0.5570
 epoch: 76, train_loss: 0.7914, test_loss: 0.9273, test_f1: 0.5446
 epoch: 77, train_loss: 0.7943, test_loss: 0.9346, test_f1: 0.5514
 epoch: 78, train_loss: 0.7815, test_loss: 0.9218, test_f1: 0.5487
 epoch: 79, train_loss: 0.7844, test_loss: 0.9287, test_f1: 0.5728
 epoch: 80, train_loss: 0.7809, test_loss: 0.9200, test_f1: 0.5524
 epoch: 81, train_loss: 0.7889, test_loss: 0.9313, test_f1: 0.5583
 epoch: 82, train_loss: 0.7886, test_loss: 0.9236, test_f1: 0.5607
 epoch: 83, train_loss: 0.7906, test_loss: 0.9155, test_f1: 0.5638
 epoch: 84, train_loss: 0.7856, test_loss: 0.9199, test_f1: 0.5576
 epoch: 85, train_loss: 0.7934, test_loss: 0.9185, test_f1: 0.5663
 epoch: 86, train_loss: 0.7701, test_loss: 0.9173, test_f1: 0.5633
 epoch: 87, train_loss: 0.7798, test_loss: 0.9226, test_f1: 0.5583
 epoch: 88, train_loss: 0.7792, test_loss: 0.9300, test_f1: 0.5537
 epoch: 89, train_loss: 0.7748, test_loss: 0.9172, test_f1: 0.5594
 epoch: 90, train_loss: 0.7818, test_loss: 0.9295, test_f1: 0.5577
 epoch: 91, train_loss: 0.7803, test_loss: 0.9282, test_f1: 0.5581
 epoch: 92, train_loss: 0.7776, test_loss: 0.9295, test_f1: 0.5493
 epoch: 93, train_loss: 0.7660, test_loss: 0.9232, test_f1: 0.5594
 epoch: 94, train_loss: 0.7600, test_loss: 0.9232, test_f1: 0.5628
 epoch: 95, train_loss: 0.7713, test_loss: 0.9277, test_f1: 0.5599
 epoch: 96, train_loss: 0.7675, test_loss: 0.9262, test_f1: 0.5641
 epoch: 97, train_loss: 0.7706, test_loss: 0.9272, test_f1: 0.5630
 epoch: 98, train_loss: 0.7768, test_loss: 0.9223, test_f1: 0.5717
 epoch: 99, train_loss: 0.7756, test_loss: 0.9184, test_f1: 0.5682
##################ITERATION #5 ****************************************
 epoch: 0, train_loss: 1.2920, test_loss: 1.1784, test_f1: 0.3296
 epoch: 1, train_loss: 1.1814, test_loss: 1.1216, test_f1: 0.3470
 epoch: 2, train_loss: 1.1495, test_loss: 1.0862, test_f1: 0.3700
 epoch: 3, train_loss: 1.1176, test_loss: 1.0589, test_f1: 0.3941
 epoch: 4, train_loss: 1.0952, test_loss: 1.0410, test_f1: 0.4207
 epoch: 5, train_loss: 1.0700, test_loss: 1.0282, test_f1: 0.4318
 epoch: 6, train_loss: 1.0482, test_loss: 1.0083, test_f1: 0.4421
 epoch: 7, train_loss: 1.0318, test_loss: 1.0061, test_f1: 0.4577
 epoch: 8, train_loss: 1.0259, test_loss: 0.9927, test_f1: 0.4520
 epoch: 9, train_loss: 1.0149, test_loss: 0.9866, test_f1: 0.4556
 epoch: 10, train_loss: 1.0028, test_loss: 0.9738, test_f1: 0.4604
 epoch: 11, train_loss: 0.9948, test_loss: 0.9669, test_f1: 0.4669
 epoch: 12, train_loss: 0.9828, test_loss: 0.9644, test_f1: 0.4809
 epoch: 13, train_loss: 0.9711, test_loss: 0.9612, test_f1: 0.4708
 epoch: 14, train_loss: 0.9739, test_loss: 0.9566, test_f1: 0.4746
 epoch: 15, train_loss: 0.9681, test_loss: 0.9650, test_f1: 0.4854
 epoch: 16, train_loss: 0.9602, test_loss: 0.9592, test_f1: 0.5023
 epoch: 17, train_loss: 0.9574, test_loss: 0.9516, test_f1: 0.4802
 epoch: 18, train_loss: 0.9455, test_loss: 0.9637, test_f1: 0.4931
 epoch: 19, train_loss: 0.9363, test_loss: 0.9314, test_f1: 0.5038
 epoch: 20, train_loss: 0.9395, test_loss: 0.9571, test_f1: 0.4999
 epoch: 21, train_loss: 0.9316, test_loss: 0.9439, test_f1: 0.5004
 epoch: 22, train_loss: 0.9283, test_loss: 0.9311, test_f1: 0.5069
 epoch: 23, train_loss: 0.9314, test_loss: 0.9398, test_f1: 0.5150
 epoch: 24, train_loss: 0.9200, test_loss: 0.9267, test_f1: 0.5006
 epoch: 25, train_loss: 0.9158, test_loss: 0.9252, test_f1: 0.5176
 epoch: 26, train_loss: 0.9063, test_loss: 0.9234, test_f1: 0.5207
 epoch: 27, train_loss: 0.9103, test_loss: 0.9263, test_f1: 0.5154
 epoch: 28, train_loss: 0.9079, test_loss: 0.9204, test_f1: 0.5164
 epoch: 29, train_loss: 0.9123, test_loss: 0.9259, test_f1: 0.5229
 epoch: 30, train_loss: 0.8974, test_loss: 0.9256, test_f1: 0.5348
 epoch: 31, train_loss: 0.8921, test_loss: 0.9147, test_f1: 0.5193
 epoch: 32, train_loss: 0.8911, test_loss: 0.9194, test_f1: 0.5317
 epoch: 33, train_loss: 0.8901, test_loss: 0.9188, test_f1: 0.5168
 epoch: 34, train_loss: 0.8923, test_loss: 0.9289, test_f1: 0.5265
 epoch: 35, train_loss: 0.8871, test_loss: 0.9259, test_f1: 0.5312
 epoch: 36, train_loss: 0.8856, test_loss: 0.9280, test_f1: 0.5459
 epoch: 37, train_loss: 0.8874, test_loss: 0.9454, test_f1: 0.5262
 epoch: 38, train_loss: 0.8763, test_loss: 0.9264, test_f1: 0.5410
 epoch: 39, train_loss: 0.8651, test_loss: 0.9252, test_f1: 0.5456
 epoch: 40, train_loss: 0.8704, test_loss: 0.9302, test_f1: 0.5443
 epoch: 41, train_loss: 0.8669, test_loss: 0.9329, test_f1: 0.5415
 epoch: 42, train_loss: 0.8704, test_loss: 0.9087, test_f1: 0.5467
 epoch: 43, train_loss: 0.8654, test_loss: 0.9377, test_f1: 0.5298
 epoch: 44, train_loss: 0.8574, test_loss: 0.9358, test_f1: 0.5382
 epoch: 45, train_loss: 0.8483, test_loss: 0.9178, test_f1: 0.5384
 epoch: 46, train_loss: 0.8535, test_loss: 0.9075, test_f1: 0.5351
 epoch: 47, train_loss: 0.8594, test_loss: 0.9322, test_f1: 0.5548
 epoch: 48, train_loss: 0.8456, test_loss: 0.9160, test_f1: 0.5521
 epoch: 49, train_loss: 0.8428, test_loss: 0.9301, test_f1: 0.5433
 epoch: 50, train_loss: 0.8501, test_loss: 0.9207, test_f1: 0.5435
 epoch: 51, train_loss: 0.8403, test_loss: 0.9046, test_f1: 0.5632
 epoch: 52, train_loss: 0.8426, test_loss: 0.9211, test_f1: 0.5475
 epoch: 53, train_loss: 0.8384, test_loss: 0.9158, test_f1: 0.5550
 epoch: 54, train_loss: 0.8379, test_loss: 0.9347, test_f1: 0.5527
 epoch: 55, train_loss: 0.8281, test_loss: 0.9201, test_f1: 0.5476
 epoch: 56, train_loss: 0.8408, test_loss: 0.9201, test_f1: 0.5537
 epoch: 57, train_loss: 0.8348, test_loss: 0.9221, test_f1: 0.5642
 epoch: 58, train_loss: 0.8327, test_loss: 0.9258, test_f1: 0.5538
 epoch: 59, train_loss: 0.8350, test_loss: 0.9129, test_f1: 0.5448
 epoch: 60, train_loss: 0.8297, test_loss: 0.9208, test_f1: 0.5630
 epoch: 61, train_loss: 0.8265, test_loss: 0.9160, test_f1: 0.5558
 epoch: 62, train_loss: 0.8273, test_loss: 0.9215, test_f1: 0.5648
 epoch: 63, train_loss: 0.8272, test_loss: 0.9064, test_f1: 0.5573
 epoch: 64, train_loss: 0.8348, test_loss: 0.9087, test_f1: 0.5515
 epoch: 65, train_loss: 0.8194, test_loss: 0.9114, test_f1: 0.5465
 epoch: 66, train_loss: 0.8208, test_loss: 0.9157, test_f1: 0.5696
 epoch: 67, train_loss: 0.8243, test_loss: 0.9226, test_f1: 0.5496
 epoch: 68, train_loss: 0.8139, test_loss: 0.9228, test_f1: 0.5487
 epoch: 69, train_loss: 0.8222, test_loss: 0.9181, test_f1: 0.5661
 epoch: 70, train_loss: 0.8144, test_loss: 0.9263, test_f1: 0.5640
 epoch: 71, train_loss: 0.8208, test_loss: 0.9137, test_f1: 0.5523
 epoch: 72, train_loss: 0.8286, test_loss: 0.9132, test_f1: 0.5648
 epoch: 73, train_loss: 0.8178, test_loss: 0.9184, test_f1: 0.5728
 epoch: 74, train_loss: 0.8231, test_loss: 0.9127, test_f1: 0.5494
 epoch: 75, train_loss: 0.8155, test_loss: 0.9236, test_f1: 0.5671
 epoch: 76, train_loss: 0.8071, test_loss: 0.9212, test_f1: 0.5600
 epoch: 77, train_loss: 0.8056, test_loss: 0.9192, test_f1: 0.5551
 epoch: 78, train_loss: 0.8206, test_loss: 0.9211, test_f1: 0.5609
 epoch: 79, train_loss: 0.8093, test_loss: 0.9110, test_f1: 0.5591
 epoch: 80, train_loss: 0.8056, test_loss: 0.9176, test_f1: 0.5679
 epoch: 81, train_loss: 0.8122, test_loss: 0.9047, test_f1: 0.5478
 epoch: 82, train_loss: 0.8015, test_loss: 0.9224, test_f1: 0.5521
 epoch: 83, train_loss: 0.7984, test_loss: 0.9156, test_f1: 0.5522
 epoch: 84, train_loss: 0.8037, test_loss: 0.9196, test_f1: 0.5691
 epoch: 85, train_loss: 0.8025, test_loss: 0.9080, test_f1: 0.5603
 epoch: 86, train_loss: 0.8084, test_loss: 0.9141, test_f1: 0.5582
 epoch: 87, train_loss: 0.7998, test_loss: 0.9187, test_f1: 0.5500
 epoch: 88, train_loss: 0.8066, test_loss: 0.9141, test_f1: 0.5655
 epoch: 89, train_loss: 0.8128, test_loss: 0.9138, test_f1: 0.5647
 epoch: 90, train_loss: 0.7967, test_loss: 0.9215, test_f1: 0.5756
 epoch: 91, train_loss: 0.7886, test_loss: 0.9269, test_f1: 0.5675
 epoch: 92, train_loss: 0.7939, test_loss: 0.9195, test_f1: 0.5498
 epoch: 93, train_loss: 0.7938, test_loss: 0.9192, test_f1: 0.5506
 epoch: 94, train_loss: 0.7990, test_loss: 0.9189, test_f1: 0.5571
 epoch: 95, train_loss: 0.7812, test_loss: 0.9185, test_f1: 0.5539
 epoch: 96, train_loss: 0.8010, test_loss: 0.9231, test_f1: 0.5521
 epoch: 97, train_loss: 0.7997, test_loss: 0.9125, test_f1: 0.5604
 epoch: 98, train_loss: 0.7873, test_loss: 0.9206, test_f1: 0.5547
 epoch: 99, train_loss: 0.7983, test_loss: 0.9351, test_f1: 0.5495
##################ITERATION #6 ****************************************
 epoch: 0, train_loss: 1.2743, test_loss: 1.1929, test_f1: 0.2986
 epoch: 1, train_loss: 1.1719, test_loss: 1.0828, test_f1: 0.3836
 epoch: 2, train_loss: 1.1434, test_loss: 1.0587, test_f1: 0.4178
 epoch: 3, train_loss: 1.1086, test_loss: 1.0355, test_f1: 0.4364
 epoch: 4, train_loss: 1.0822, test_loss: 1.0150, test_f1: 0.4348
 epoch: 5, train_loss: 1.0750, test_loss: 1.0088, test_f1: 0.4276
 epoch: 6, train_loss: 1.0507, test_loss: 0.9853, test_f1: 0.4454
 epoch: 7, train_loss: 1.0326, test_loss: 0.9738, test_f1: 0.4470
 epoch: 8, train_loss: 1.0212, test_loss: 0.9669, test_f1: 0.4686
 epoch: 9, train_loss: 1.0027, test_loss: 0.9563, test_f1: 0.4743
 epoch: 10, train_loss: 0.9983, test_loss: 0.9562, test_f1: 0.4692
 epoch: 11, train_loss: 0.9928, test_loss: 0.9548, test_f1: 0.4824
 epoch: 12, train_loss: 0.9893, test_loss: 0.9465, test_f1: 0.4732
 epoch: 13, train_loss: 0.9735, test_loss: 0.9370, test_f1: 0.4822
 epoch: 14, train_loss: 0.9621, test_loss: 0.9439, test_f1: 0.4881
 epoch: 15, train_loss: 0.9595, test_loss: 0.9304, test_f1: 0.4852
 epoch: 16, train_loss: 0.9505, test_loss: 0.9303, test_f1: 0.4880
 epoch: 17, train_loss: 0.9416, test_loss: 0.9238, test_f1: 0.5148
 epoch: 18, train_loss: 0.9326, test_loss: 0.9467, test_f1: 0.5171
 epoch: 19, train_loss: 0.9274, test_loss: 0.9215, test_f1: 0.5148
 epoch: 20, train_loss: 0.9241, test_loss: 0.9092, test_f1: 0.5226
 epoch: 21, train_loss: 0.9288, test_loss: 0.9172, test_f1: 0.5159
 epoch: 22, train_loss: 0.9156, test_loss: 0.9084, test_f1: 0.5150
 epoch: 23, train_loss: 0.9144, test_loss: 0.9236, test_f1: 0.5160
 epoch: 24, train_loss: 0.9108, test_loss: 0.9222, test_f1: 0.5162
 epoch: 25, train_loss: 0.9158, test_loss: 0.8822, test_f1: 0.5358
 epoch: 26, train_loss: 0.9075, test_loss: 0.8883, test_f1: 0.5169
 epoch: 27, train_loss: 0.8991, test_loss: 0.8977, test_f1: 0.5347
 epoch: 28, train_loss: 0.8894, test_loss: 0.9087, test_f1: 0.5205
 epoch: 29, train_loss: 0.8906, test_loss: 0.8925, test_f1: 0.5286
 epoch: 30, train_loss: 0.8854, test_loss: 0.9031, test_f1: 0.5203
 epoch: 31, train_loss: 0.8815, test_loss: 0.8864, test_f1: 0.5294
 epoch: 32, train_loss: 0.8895, test_loss: 0.8893, test_f1: 0.5214
 epoch: 33, train_loss: 0.8707, test_loss: 0.8883, test_f1: 0.5253
 epoch: 34, train_loss: 0.8739, test_loss: 0.9100, test_f1: 0.5361
 epoch: 35, train_loss: 0.8728, test_loss: 0.8771, test_f1: 0.5266
 epoch: 36, train_loss: 0.8712, test_loss: 0.8899, test_f1: 0.5324
 epoch: 37, train_loss: 0.8703, test_loss: 0.8832, test_f1: 0.5273
 epoch: 38, train_loss: 0.8615, test_loss: 0.9031, test_f1: 0.5193
 epoch: 39, train_loss: 0.8632, test_loss: 0.8807, test_f1: 0.5358
 epoch: 40, train_loss: 0.8587, test_loss: 0.8642, test_f1: 0.5299
 epoch: 41, train_loss: 0.8501, test_loss: 0.8927, test_f1: 0.5313
 epoch: 42, train_loss: 0.8465, test_loss: 0.8861, test_f1: 0.5377
 epoch: 43, train_loss: 0.8524, test_loss: 0.8754, test_f1: 0.5351
 epoch: 44, train_loss: 0.8462, test_loss: 0.8875, test_f1: 0.5247
 epoch: 45, train_loss: 0.8457, test_loss: 0.8911, test_f1: 0.5351
 epoch: 46, train_loss: 0.8554, test_loss: 0.8913, test_f1: 0.5253
 epoch: 47, train_loss: 0.8413, test_loss: 0.9055, test_f1: 0.5276
 epoch: 48, train_loss: 0.8412, test_loss: 0.8914, test_f1: 0.5315
 epoch: 49, train_loss: 0.8393, test_loss: 0.8909, test_f1: 0.5399
 epoch: 50, train_loss: 0.8372, test_loss: 0.9050, test_f1: 0.5256
 epoch: 51, train_loss: 0.8301, test_loss: 0.8806, test_f1: 0.5274
 epoch: 52, train_loss: 0.8286, test_loss: 0.8788, test_f1: 0.5286
 epoch: 53, train_loss: 0.8296, test_loss: 0.8888, test_f1: 0.5273
 epoch: 54, train_loss: 0.8253, test_loss: 0.8852, test_f1: 0.5311
 epoch: 55, train_loss: 0.8230, test_loss: 0.8839, test_f1: 0.5302
 epoch: 56, train_loss: 0.8253, test_loss: 0.8768, test_f1: 0.5331
 epoch: 57, train_loss: 0.8272, test_loss: 0.8761, test_f1: 0.5397
 epoch: 58, train_loss: 0.8293, test_loss: 0.9107, test_f1: 0.5261
 epoch: 59, train_loss: 0.8128, test_loss: 0.9005, test_f1: 0.5336
 epoch: 60, train_loss: 0.8263, test_loss: 0.8914, test_f1: 0.5302
 epoch: 61, train_loss: 0.8176, test_loss: 0.8895, test_f1: 0.5303
 epoch: 62, train_loss: 0.8202, test_loss: 0.8847, test_f1: 0.5329
 epoch: 63, train_loss: 0.8178, test_loss: 0.8841, test_f1: 0.5344
 epoch: 64, train_loss: 0.8165, test_loss: 0.8942, test_f1: 0.5412
 epoch: 65, train_loss: 0.8173, test_loss: 0.8917, test_f1: 0.5377
 epoch: 66, train_loss: 0.8109, test_loss: 0.9007, test_f1: 0.5378
 epoch: 67, train_loss: 0.8100, test_loss: 0.8937, test_f1: 0.5413
 epoch: 68, train_loss: 0.8093, test_loss: 0.9092, test_f1: 0.5343
 epoch: 69, train_loss: 0.8084, test_loss: 0.8771, test_f1: 0.5382
 epoch: 70, train_loss: 0.8122, test_loss: 0.8998, test_f1: 0.5330
 epoch: 71, train_loss: 0.8041, test_loss: 0.9219, test_f1: 0.5358
 epoch: 72, train_loss: 0.8166, test_loss: 0.8936, test_f1: 0.5318
 epoch: 73, train_loss: 0.8165, test_loss: 0.9042, test_f1: 0.5301
 epoch: 74, train_loss: 0.8180, test_loss: 0.8863, test_f1: 0.5320
 epoch: 75, train_loss: 0.8000, test_loss: 0.9006, test_f1: 0.5428
 epoch: 76, train_loss: 0.8039, test_loss: 0.9075, test_f1: 0.5281
 epoch: 77, train_loss: 0.8094, test_loss: 0.8945, test_f1: 0.5348
 epoch: 78, train_loss: 0.8051, test_loss: 0.9111, test_f1: 0.5410
 epoch: 79, train_loss: 0.8036, test_loss: 0.9019, test_f1: 0.5440
 epoch: 80, train_loss: 0.7998, test_loss: 0.8873, test_f1: 0.5447
 epoch: 81, train_loss: 0.7928, test_loss: 0.8800, test_f1: 0.5506
 epoch: 82, train_loss: 0.7952, test_loss: 0.8934, test_f1: 0.5448
 epoch: 83, train_loss: 0.8039, test_loss: 0.8895, test_f1: 0.5459
 epoch: 84, train_loss: 0.8019, test_loss: 0.9026, test_f1: 0.5485
 epoch: 85, train_loss: 0.8065, test_loss: 0.9010, test_f1: 0.5388
 epoch: 86, train_loss: 0.7883, test_loss: 0.8947, test_f1: 0.5458
 epoch: 87, train_loss: 0.7962, test_loss: 0.8965, test_f1: 0.5546
 epoch: 88, train_loss: 0.7921, test_loss: 0.9057, test_f1: 0.5452
 epoch: 89, train_loss: 0.7940, test_loss: 0.8909, test_f1: 0.5560
 epoch: 90, train_loss: 0.7945, test_loss: 0.9118, test_f1: 0.5494
 epoch: 91, train_loss: 0.7888, test_loss: 0.9006, test_f1: 0.5494
 epoch: 92, train_loss: 0.7971, test_loss: 0.9063, test_f1: 0.5349
 epoch: 93, train_loss: 0.7920, test_loss: 0.9048, test_f1: 0.5517
 epoch: 94, train_loss: 0.7845, test_loss: 0.9011, test_f1: 0.5539
 epoch: 95, train_loss: 0.7853, test_loss: 0.9110, test_f1: 0.5459
 epoch: 96, train_loss: 0.7865, test_loss: 0.8942, test_f1: 0.5496
 epoch: 97, train_loss: 0.7866, test_loss: 0.8894, test_f1: 0.5542
 epoch: 98, train_loss: 0.7857, test_loss: 0.8992, test_f1: 0.5472
 epoch: 99, train_loss: 0.7914, test_loss: 0.8953, test_f1: 0.5528
##################ITERATION #7 ****************************************
 epoch: 0, train_loss: 1.3187, test_loss: 1.1779, test_f1: 0.2853
 epoch: 1, train_loss: 1.1660, test_loss: 1.0939, test_f1: 0.3912
 epoch: 2, train_loss: 1.1297, test_loss: 1.0583, test_f1: 0.4028
 epoch: 3, train_loss: 1.0999, test_loss: 1.0337, test_f1: 0.4045
 epoch: 4, train_loss: 1.0743, test_loss: 1.0170, test_f1: 0.4077
 epoch: 5, train_loss: 1.0609, test_loss: 1.0006, test_f1: 0.4177
 epoch: 6, train_loss: 1.0433, test_loss: 0.9940, test_f1: 0.4208
 epoch: 7, train_loss: 1.0152, test_loss: 0.9849, test_f1: 0.4335
 epoch: 8, train_loss: 1.0123, test_loss: 0.9764, test_f1: 0.4652
 epoch: 9, train_loss: 1.0057, test_loss: 0.9827, test_f1: 0.4593
 epoch: 10, train_loss: 0.9929, test_loss: 0.9646, test_f1: 0.4846
 epoch: 11, train_loss: 0.9843, test_loss: 0.9616, test_f1: 0.4806
 epoch: 12, train_loss: 0.9718, test_loss: 0.9563, test_f1: 0.4797
 epoch: 13, train_loss: 0.9678, test_loss: 0.9402, test_f1: 0.4976
 epoch: 14, train_loss: 0.9645, test_loss: 0.9535, test_f1: 0.4986
 epoch: 15, train_loss: 0.9504, test_loss: 0.9428, test_f1: 0.5025
 epoch: 16, train_loss: 0.9501, test_loss: 0.9475, test_f1: 0.5019
 epoch: 17, train_loss: 0.9531, test_loss: 0.9468, test_f1: 0.5084
 epoch: 18, train_loss: 0.9438, test_loss: 0.9475, test_f1: 0.5030
 epoch: 19, train_loss: 0.9471, test_loss: 0.9406, test_f1: 0.5195
 epoch: 20, train_loss: 0.9334, test_loss: 0.9358, test_f1: 0.5165
 epoch: 21, train_loss: 0.9324, test_loss: 0.9431, test_f1: 0.5053
 epoch: 22, train_loss: 0.9304, test_loss: 0.9461, test_f1: 0.5078
 epoch: 23, train_loss: 0.9213, test_loss: 0.9394, test_f1: 0.5154
 epoch: 24, train_loss: 0.9232, test_loss: 0.9546, test_f1: 0.5137
 epoch: 25, train_loss: 0.9085, test_loss: 0.9337, test_f1: 0.5213
 epoch: 26, train_loss: 0.9028, test_loss: 0.9475, test_f1: 0.5156
 epoch: 27, train_loss: 0.9038, test_loss: 0.9499, test_f1: 0.5125
 epoch: 28, train_loss: 0.9060, test_loss: 0.9471, test_f1: 0.5203
 epoch: 29, train_loss: 0.9078, test_loss: 0.9405, test_f1: 0.5146
 epoch: 30, train_loss: 0.8962, test_loss: 0.9399, test_f1: 0.5208
 epoch: 31, train_loss: 0.8991, test_loss: 0.9385, test_f1: 0.5280
 epoch: 32, train_loss: 0.8950, test_loss: 0.9418, test_f1: 0.5240
 epoch: 33, train_loss: 0.8841, test_loss: 0.9455, test_f1: 0.5146
 epoch: 34, train_loss: 0.8939, test_loss: 0.9515, test_f1: 0.5145
 epoch: 35, train_loss: 0.8844, test_loss: 0.9352, test_f1: 0.5231
 epoch: 36, train_loss: 0.8760, test_loss: 0.9390, test_f1: 0.5204
 epoch: 37, train_loss: 0.8720, test_loss: 0.9315, test_f1: 0.5280
 epoch: 38, train_loss: 0.8738, test_loss: 0.9261, test_f1: 0.5250
 epoch: 39, train_loss: 0.8710, test_loss: 0.9367, test_f1: 0.5270
 epoch: 40, train_loss: 0.8688, test_loss: 0.9433, test_f1: 0.5203
 epoch: 41, train_loss: 0.8586, test_loss: 0.9471, test_f1: 0.5155
 epoch: 42, train_loss: 0.8598, test_loss: 0.9340, test_f1: 0.5194
 epoch: 43, train_loss: 0.8517, test_loss: 0.9421, test_f1: 0.5268
 epoch: 44, train_loss: 0.8681, test_loss: 0.9317, test_f1: 0.5194
 epoch: 45, train_loss: 0.8499, test_loss: 0.9450, test_f1: 0.5251
 epoch: 46, train_loss: 0.8486, test_loss: 0.9436, test_f1: 0.5194
 epoch: 47, train_loss: 0.8454, test_loss: 0.9331, test_f1: 0.5245
 epoch: 48, train_loss: 0.8391, test_loss: 0.9543, test_f1: 0.5113
 epoch: 49, train_loss: 0.8417, test_loss: 0.9376, test_f1: 0.5367
 epoch: 50, train_loss: 0.8457, test_loss: 0.9464, test_f1: 0.5160
 epoch: 51, train_loss: 0.8288, test_loss: 0.9421, test_f1: 0.5289
 epoch: 52, train_loss: 0.8383, test_loss: 0.9351, test_f1: 0.5254
 epoch: 53, train_loss: 0.8372, test_loss: 0.9495, test_f1: 0.5197
 epoch: 54, train_loss: 0.8365, test_loss: 0.9492, test_f1: 0.5251
 epoch: 55, train_loss: 0.8382, test_loss: 0.9475, test_f1: 0.5236
 epoch: 56, train_loss: 0.8337, test_loss: 0.9422, test_f1: 0.5181
 epoch: 57, train_loss: 0.8264, test_loss: 0.9430, test_f1: 0.5250
 epoch: 58, train_loss: 0.8192, test_loss: 0.9468, test_f1: 0.5284
 epoch: 59, train_loss: 0.8214, test_loss: 0.9453, test_f1: 0.5276
 epoch: 60, train_loss: 0.8226, test_loss: 0.9485, test_f1: 0.5265
 epoch: 61, train_loss: 0.8297, test_loss: 0.9520, test_f1: 0.5247
 epoch: 62, train_loss: 0.8121, test_loss: 0.9606, test_f1: 0.5230
 epoch: 63, train_loss: 0.8190, test_loss: 0.9477, test_f1: 0.5302
 epoch: 64, train_loss: 0.8183, test_loss: 0.9541, test_f1: 0.5253
 epoch: 65, train_loss: 0.8235, test_loss: 0.9570, test_f1: 0.5266
 epoch: 66, train_loss: 0.8143, test_loss: 0.9418, test_f1: 0.5249
 epoch: 67, train_loss: 0.8126, test_loss: 0.9452, test_f1: 0.5308
 epoch: 68, train_loss: 0.8194, test_loss: 0.9467, test_f1: 0.5281
 epoch: 69, train_loss: 0.8151, test_loss: 0.9569, test_f1: 0.5265
 epoch: 70, train_loss: 0.8155, test_loss: 0.9489, test_f1: 0.5321
 epoch: 71, train_loss: 0.8012, test_loss: 0.9482, test_f1: 0.5402
 epoch: 72, train_loss: 0.8057, test_loss: 0.9481, test_f1: 0.5303
 epoch: 73, train_loss: 0.8162, test_loss: 0.9492, test_f1: 0.5299
 epoch: 74, train_loss: 0.8111, test_loss: 0.9420, test_f1: 0.5349
 epoch: 75, train_loss: 0.8126, test_loss: 0.9517, test_f1: 0.5342
 epoch: 76, train_loss: 0.8045, test_loss: 0.9524, test_f1: 0.5342
 epoch: 77, train_loss: 0.8107, test_loss: 0.9471, test_f1: 0.5426
 epoch: 78, train_loss: 0.8122, test_loss: 0.9514, test_f1: 0.5393
 epoch: 79, train_loss: 0.8052, test_loss: 0.9535, test_f1: 0.5376
 epoch: 80, train_loss: 0.8025, test_loss: 0.9535, test_f1: 0.5323
 epoch: 81, train_loss: 0.8054, test_loss: 0.9559, test_f1: 0.5342
 epoch: 82, train_loss: 0.7995, test_loss: 0.9594, test_f1: 0.5290
 epoch: 83, train_loss: 0.8091, test_loss: 0.9611, test_f1: 0.5449
 epoch: 84, train_loss: 0.7942, test_loss: 0.9556, test_f1: 0.5401
 epoch: 85, train_loss: 0.8069, test_loss: 0.9520, test_f1: 0.5440
 epoch: 86, train_loss: 0.7953, test_loss: 0.9527, test_f1: 0.5443
 epoch: 87, train_loss: 0.8045, test_loss: 0.9650, test_f1: 0.5386
 epoch: 88, train_loss: 0.7948, test_loss: 0.9548, test_f1: 0.5432
 epoch: 89, train_loss: 0.7966, test_loss: 0.9574, test_f1: 0.5393
 epoch: 90, train_loss: 0.7965, test_loss: 0.9543, test_f1: 0.5437
 epoch: 91, train_loss: 0.7891, test_loss: 0.9541, test_f1: 0.5397
 epoch: 92, train_loss: 0.7975, test_loss: 0.9550, test_f1: 0.5444
 epoch: 93, train_loss: 0.7943, test_loss: 0.9488, test_f1: 0.5397
 epoch: 94, train_loss: 0.7936, test_loss: 0.9562, test_f1: 0.5447
 epoch: 95, train_loss: 0.7868, test_loss: 0.9615, test_f1: 0.5382
 epoch: 96, train_loss: 0.7980, test_loss: 0.9596, test_f1: 0.5432
 epoch: 97, train_loss: 0.7875, test_loss: 0.9577, test_f1: 0.5393
 epoch: 98, train_loss: 0.7862, test_loss: 0.9568, test_f1: 0.5379
 epoch: 99, train_loss: 0.8035, test_loss: 0.9512, test_f1: 0.5493
##################ITERATION #8 ****************************************
 epoch: 0, train_loss: 1.3208, test_loss: 1.2009, test_f1: 0.2708
 epoch: 1, train_loss: 1.1938, test_loss: 1.0973, test_f1: 0.3631
 epoch: 2, train_loss: 1.1592, test_loss: 1.0714, test_f1: 0.3952
 epoch: 3, train_loss: 1.1172, test_loss: 1.0597, test_f1: 0.4357
 epoch: 4, train_loss: 1.0907, test_loss: 1.0371, test_f1: 0.4579
 epoch: 5, train_loss: 1.0802, test_loss: 1.0275, test_f1: 0.4449
 epoch: 6, train_loss: 1.0631, test_loss: 1.0120, test_f1: 0.4507
 epoch: 7, train_loss: 1.0461, test_loss: 1.0008, test_f1: 0.4762
 epoch: 8, train_loss: 1.0400, test_loss: 0.9949, test_f1: 0.4792
 epoch: 9, train_loss: 1.0184, test_loss: 0.9908, test_f1: 0.4569
 epoch: 10, train_loss: 1.0196, test_loss: 0.9814, test_f1: 0.4562
 epoch: 11, train_loss: 1.0026, test_loss: 0.9715, test_f1: 0.4636
 epoch: 12, train_loss: 0.9946, test_loss: 0.9651, test_f1: 0.4621
 epoch: 13, train_loss: 0.9815, test_loss: 0.9591, test_f1: 0.4743
 epoch: 14, train_loss: 0.9810, test_loss: 0.9571, test_f1: 0.4761
 epoch: 15, train_loss: 0.9802, test_loss: 0.9599, test_f1: 0.4861
 epoch: 16, train_loss: 0.9743, test_loss: 0.9593, test_f1: 0.4942
 epoch: 17, train_loss: 0.9575, test_loss: 0.9472, test_f1: 0.4975
 epoch: 18, train_loss: 0.9486, test_loss: 0.9483, test_f1: 0.4846
 epoch: 19, train_loss: 0.9488, test_loss: 0.9522, test_f1: 0.5017
 epoch: 20, train_loss: 0.9398, test_loss: 0.9500, test_f1: 0.4840
 epoch: 21, train_loss: 0.9390, test_loss: 0.9457, test_f1: 0.5061
 epoch: 22, train_loss: 0.9412, test_loss: 0.9269, test_f1: 0.5133
 epoch: 23, train_loss: 0.9319, test_loss: 0.9338, test_f1: 0.5153
 epoch: 24, train_loss: 0.9251, test_loss: 0.9418, test_f1: 0.5125
 epoch: 25, train_loss: 0.9255, test_loss: 0.9397, test_f1: 0.5108
 epoch: 26, train_loss: 0.9137, test_loss: 0.9445, test_f1: 0.5086
 epoch: 27, train_loss: 0.9118, test_loss: 0.9433, test_f1: 0.5117
 epoch: 28, train_loss: 0.9126, test_loss: 0.9347, test_f1: 0.5177
 epoch: 29, train_loss: 0.9033, test_loss: 0.9163, test_f1: 0.5126
 epoch: 30, train_loss: 0.9081, test_loss: 0.9208, test_f1: 0.5304
 epoch: 31, train_loss: 0.8978, test_loss: 0.9323, test_f1: 0.5182
 epoch: 32, train_loss: 0.9089, test_loss: 0.9300, test_f1: 0.5118
 epoch: 33, train_loss: 0.8950, test_loss: 0.9173, test_f1: 0.5202
 epoch: 34, train_loss: 0.8866, test_loss: 0.9154, test_f1: 0.5286
 epoch: 35, train_loss: 0.8855, test_loss: 0.9255, test_f1: 0.5257
 epoch: 36, train_loss: 0.8856, test_loss: 0.9258, test_f1: 0.5274
 epoch: 37, train_loss: 0.8824, test_loss: 0.9241, test_f1: 0.5258
 epoch: 38, train_loss: 0.8795, test_loss: 0.9207, test_f1: 0.5242
 epoch: 39, train_loss: 0.8765, test_loss: 0.9017, test_f1: 0.5333
 epoch: 40, train_loss: 0.8759, test_loss: 0.9331, test_f1: 0.5250
 epoch: 41, train_loss: 0.8766, test_loss: 0.9021, test_f1: 0.5242
 epoch: 42, train_loss: 0.8776, test_loss: 0.9044, test_f1: 0.5298
 epoch: 43, train_loss: 0.8651, test_loss: 0.9062, test_f1: 0.5289
 epoch: 44, train_loss: 0.8611, test_loss: 0.9068, test_f1: 0.5273
 epoch: 45, train_loss: 0.8730, test_loss: 0.9013, test_f1: 0.5228
 epoch: 46, train_loss: 0.8558, test_loss: 0.9072, test_f1: 0.5319
 epoch: 47, train_loss: 0.8475, test_loss: 0.9247, test_f1: 0.5321
 epoch: 48, train_loss: 0.8486, test_loss: 0.8703, test_f1: 0.5355
 epoch: 49, train_loss: 0.8567, test_loss: 0.9025, test_f1: 0.5414
 epoch: 50, train_loss: 0.8565, test_loss: 0.8925, test_f1: 0.5268
 epoch: 51, train_loss: 0.8502, test_loss: 0.8900, test_f1: 0.5388
 epoch: 52, train_loss: 0.8509, test_loss: 0.8930, test_f1: 0.5364
 epoch: 53, train_loss: 0.8425, test_loss: 0.9088, test_f1: 0.5392
 epoch: 54, train_loss: 0.8411, test_loss: 0.9105, test_f1: 0.5424
 epoch: 55, train_loss: 0.8345, test_loss: 0.8937, test_f1: 0.5396
 epoch: 56, train_loss: 0.8483, test_loss: 0.8909, test_f1: 0.5505
 epoch: 57, train_loss: 0.8434, test_loss: 0.9055, test_f1: 0.5355
 epoch: 58, train_loss: 0.8412, test_loss: 0.9088, test_f1: 0.5364
 epoch: 59, train_loss: 0.8310, test_loss: 0.9188, test_f1: 0.5292
 epoch: 60, train_loss: 0.8313, test_loss: 0.8980, test_f1: 0.5432
 epoch: 61, train_loss: 0.8240, test_loss: 0.9172, test_f1: 0.5388
 epoch: 62, train_loss: 0.8288, test_loss: 0.9116, test_f1: 0.5433
 epoch: 63, train_loss: 0.8372, test_loss: 0.9272, test_f1: 0.5431
 epoch: 64, train_loss: 0.8316, test_loss: 0.9098, test_f1: 0.5434
 epoch: 65, train_loss: 0.8332, test_loss: 0.8945, test_f1: 0.5424
 epoch: 66, train_loss: 0.8280, test_loss: 0.8880, test_f1: 0.5329
 epoch: 67, train_loss: 0.8277, test_loss: 0.9183, test_f1: 0.5405
 epoch: 68, train_loss: 0.8275, test_loss: 0.9195, test_f1: 0.5369
 epoch: 69, train_loss: 0.8351, test_loss: 0.9136, test_f1: 0.5399
 epoch: 70, train_loss: 0.8316, test_loss: 0.9004, test_f1: 0.5460
 epoch: 71, train_loss: 0.8180, test_loss: 0.9229, test_f1: 0.5457
 epoch: 72, train_loss: 0.8218, test_loss: 0.9150, test_f1: 0.5292
 epoch: 73, train_loss: 0.8212, test_loss: 0.8821, test_f1: 0.5493
 epoch: 74, train_loss: 0.8134, test_loss: 0.8984, test_f1: 0.5381
 epoch: 75, train_loss: 0.8195, test_loss: 0.9096, test_f1: 0.5409
 epoch: 76, train_loss: 0.8191, test_loss: 0.9015, test_f1: 0.5509
 epoch: 77, train_loss: 0.8248, test_loss: 0.9030, test_f1: 0.5474
 epoch: 78, train_loss: 0.8170, test_loss: 0.8902, test_f1: 0.5461
 epoch: 79, train_loss: 0.8066, test_loss: 0.9257, test_f1: 0.5445
 epoch: 80, train_loss: 0.8106, test_loss: 0.9168, test_f1: 0.5430
 epoch: 81, train_loss: 0.8023, test_loss: 0.8989, test_f1: 0.5496
 epoch: 82, train_loss: 0.8103, test_loss: 0.8944, test_f1: 0.5418
 epoch: 83, train_loss: 0.8225, test_loss: 0.9191, test_f1: 0.5462
 epoch: 84, train_loss: 0.8029, test_loss: 0.9072, test_f1: 0.5424
 epoch: 85, train_loss: 0.8029, test_loss: 0.8947, test_f1: 0.5432
 epoch: 86, train_loss: 0.8197, test_loss: 0.9111, test_f1: 0.5453
 epoch: 87, train_loss: 0.8059, test_loss: 0.9144, test_f1: 0.5394
 epoch: 88, train_loss: 0.8026, test_loss: 0.9168, test_f1: 0.5308
 epoch: 89, train_loss: 0.8139, test_loss: 0.9151, test_f1: 0.5452
 epoch: 90, train_loss: 0.7957, test_loss: 0.8944, test_f1: 0.5349
 epoch: 91, train_loss: 0.7930, test_loss: 0.9254, test_f1: 0.5432
 epoch: 92, train_loss: 0.7960, test_loss: 0.9100, test_f1: 0.5344
 epoch: 93, train_loss: 0.7959, test_loss: 0.8923, test_f1: 0.5315
 epoch: 94, train_loss: 0.8062, test_loss: 0.8942, test_f1: 0.5258
 epoch: 95, train_loss: 0.7904, test_loss: 0.8989, test_f1: 0.5495
 epoch: 96, train_loss: 0.7966, test_loss: 0.9012, test_f1: 0.5281
 epoch: 97, train_loss: 0.7969, test_loss: 0.9098, test_f1: 0.5480
 epoch: 98, train_loss: 0.7939, test_loss: 0.9175, test_f1: 0.5267
 epoch: 99, train_loss: 0.7901, test_loss: 0.8898, test_f1: 0.5301
##################ITERATION #9 ****************************************
 epoch: 0, train_loss: 1.3550, test_loss: 1.1539, test_f1: 0.3278
 epoch: 1, train_loss: 1.1985, test_loss: 1.0913, test_f1: 0.3673
 epoch: 2, train_loss: 1.1453, test_loss: 1.0657, test_f1: 0.3945
 epoch: 3, train_loss: 1.1192, test_loss: 1.0371, test_f1: 0.4154
 epoch: 4, train_loss: 1.0872, test_loss: 1.0222, test_f1: 0.4211
 epoch: 5, train_loss: 1.0724, test_loss: 1.0103, test_f1: 0.4303
 epoch: 6, train_loss: 1.0569, test_loss: 0.9971, test_f1: 0.4394
 epoch: 7, train_loss: 1.0342, test_loss: 0.9890, test_f1: 0.4546
 epoch: 8, train_loss: 1.0272, test_loss: 0.9937, test_f1: 0.4560
 epoch: 9, train_loss: 1.0023, test_loss: 0.9969, test_f1: 0.4684
 epoch: 10, train_loss: 0.9961, test_loss: 0.9889, test_f1: 0.4719
 epoch: 11, train_loss: 0.9769, test_loss: 0.9813, test_f1: 0.4818
 epoch: 12, train_loss: 0.9798, test_loss: 0.9718, test_f1: 0.4812
 epoch: 13, train_loss: 0.9718, test_loss: 0.9672, test_f1: 0.4804
 epoch: 14, train_loss: 0.9685, test_loss: 0.9720, test_f1: 0.4861
 epoch: 15, train_loss: 0.9564, test_loss: 0.9769, test_f1: 0.4827
 epoch: 16, train_loss: 0.9471, test_loss: 0.9669, test_f1: 0.4869
 epoch: 17, train_loss: 0.9444, test_loss: 0.9538, test_f1: 0.4835
 epoch: 18, train_loss: 0.9451, test_loss: 0.9672, test_f1: 0.4769
 epoch: 19, train_loss: 0.9449, test_loss: 0.9534, test_f1: 0.4945
 epoch: 20, train_loss: 0.9355, test_loss: 0.9576, test_f1: 0.4905
 epoch: 21, train_loss: 0.9372, test_loss: 0.9515, test_f1: 0.4918
 epoch: 22, train_loss: 0.9433, test_loss: 0.9513, test_f1: 0.4908
 epoch: 23, train_loss: 0.9326, test_loss: 0.9467, test_f1: 0.4981
 epoch: 24, train_loss: 0.9232, test_loss: 0.9487, test_f1: 0.4882
 epoch: 25, train_loss: 0.9137, test_loss: 0.9413, test_f1: 0.5008
 epoch: 26, train_loss: 0.9127, test_loss: 0.9425, test_f1: 0.5012
 epoch: 27, train_loss: 0.9197, test_loss: 0.9381, test_f1: 0.5081
 epoch: 28, train_loss: 0.9175, test_loss: 0.9250, test_f1: 0.5056
 epoch: 29, train_loss: 0.9110, test_loss: 0.9418, test_f1: 0.5023
 epoch: 30, train_loss: 0.9087, test_loss: 0.9364, test_f1: 0.5263
 epoch: 31, train_loss: 0.8955, test_loss: 0.9300, test_f1: 0.5107
 epoch: 32, train_loss: 0.8859, test_loss: 0.9380, test_f1: 0.5111
 epoch: 33, train_loss: 0.8857, test_loss: 0.9524, test_f1: 0.4989
 epoch: 34, train_loss: 0.8915, test_loss: 0.9321, test_f1: 0.5167
 epoch: 35, train_loss: 0.8846, test_loss: 0.9451, test_f1: 0.5092
 epoch: 36, train_loss: 0.8875, test_loss: 0.9228, test_f1: 0.5178
 epoch: 37, train_loss: 0.8727, test_loss: 0.9207, test_f1: 0.5400
 epoch: 38, train_loss: 0.8718, test_loss: 0.9339, test_f1: 0.5328
 epoch: 39, train_loss: 0.8821, test_loss: 0.9125, test_f1: 0.5155
 epoch: 40, train_loss: 0.8639, test_loss: 0.9217, test_f1: 0.5185
 epoch: 41, train_loss: 0.8661, test_loss: 0.9103, test_f1: 0.5511
 epoch: 42, train_loss: 0.8687, test_loss: 0.9209, test_f1: 0.5598
 epoch: 43, train_loss: 0.8711, test_loss: 0.9202, test_f1: 0.5599
 epoch: 44, train_loss: 0.8493, test_loss: 0.9269, test_f1: 0.5308
 epoch: 45, train_loss: 0.8628, test_loss: 0.9139, test_f1: 0.5346
 epoch: 46, train_loss: 0.8631, test_loss: 0.9172, test_f1: 0.5421
 epoch: 47, train_loss: 0.8483, test_loss: 0.9187, test_f1: 0.5504
 epoch: 48, train_loss: 0.8467, test_loss: 0.9127, test_f1: 0.5524
 epoch: 49, train_loss: 0.8490, test_loss: 0.9160, test_f1: 0.5399
 epoch: 50, train_loss: 0.8505, test_loss: 0.9810, test_f1: 0.4966
 epoch: 51, train_loss: 0.8429, test_loss: 0.9071, test_f1: 0.5567
 epoch: 52, train_loss: 0.8327, test_loss: 0.9191, test_f1: 0.5506
 epoch: 53, train_loss: 0.8343, test_loss: 0.9186, test_f1: 0.5584
 epoch: 54, train_loss: 0.8419, test_loss: 0.9136, test_f1: 0.5621
 epoch: 55, train_loss: 0.8380, test_loss: 0.9074, test_f1: 0.5513
 epoch: 56, train_loss: 0.8330, test_loss: 0.9115, test_f1: 0.5480
 epoch: 57, train_loss: 0.8302, test_loss: 0.9162, test_f1: 0.5452
 epoch: 58, train_loss: 0.8325, test_loss: 0.9120, test_f1: 0.5555
 epoch: 59, train_loss: 0.8294, test_loss: 0.9200, test_f1: 0.5489
 epoch: 60, train_loss: 0.8398, test_loss: 0.9066, test_f1: 0.5578
 epoch: 61, train_loss: 0.8232, test_loss: 0.9176, test_f1: 0.5283
 epoch: 62, train_loss: 0.8315, test_loss: 0.9120, test_f1: 0.5616
 epoch: 63, train_loss: 0.8171, test_loss: 0.8962, test_f1: 0.5577
 epoch: 64, train_loss: 0.8186, test_loss: 0.9011, test_f1: 0.5570
 epoch: 65, train_loss: 0.8259, test_loss: 0.9066, test_f1: 0.5617
 epoch: 66, train_loss: 0.8233, test_loss: 0.9078, test_f1: 0.5763
 epoch: 67, train_loss: 0.8168, test_loss: 0.9028, test_f1: 0.5607
 epoch: 68, train_loss: 0.8238, test_loss: 0.9124, test_f1: 0.5594
 epoch: 69, train_loss: 0.8127, test_loss: 0.9060, test_f1: 0.5694
 epoch: 70, train_loss: 0.8183, test_loss: 0.9056, test_f1: 0.5611
 epoch: 71, train_loss: 0.8122, test_loss: 0.9249, test_f1: 0.5550
 epoch: 72, train_loss: 0.8181, test_loss: 0.9106, test_f1: 0.5699
 epoch: 73, train_loss: 0.8143, test_loss: 0.9210, test_f1: 0.5518
 epoch: 74, train_loss: 0.8022, test_loss: 0.9175, test_f1: 0.5612
 epoch: 75, train_loss: 0.8068, test_loss: 0.9134, test_f1: 0.5576
 epoch: 76, train_loss: 0.8034, test_loss: 0.9058, test_f1: 0.5733
 epoch: 77, train_loss: 0.8052, test_loss: 0.9098, test_f1: 0.5730
 epoch: 78, train_loss: 0.8108, test_loss: 0.9202, test_f1: 0.5531
 epoch: 79, train_loss: 0.7998, test_loss: 0.9074, test_f1: 0.5687
 epoch: 80, train_loss: 0.8038, test_loss: 0.9208, test_f1: 0.5571
 epoch: 81, train_loss: 0.7881, test_loss: 0.9077, test_f1: 0.5721
 epoch: 82, train_loss: 0.7931, test_loss: 0.9107, test_f1: 0.5667
 epoch: 83, train_loss: 0.8000, test_loss: 0.9170, test_f1: 0.5668
 epoch: 84, train_loss: 0.8030, test_loss: 0.9092, test_f1: 0.5653
 epoch: 85, train_loss: 0.7950, test_loss: 0.9059, test_f1: 0.5781
 epoch: 86, train_loss: 0.8130, test_loss: 0.9125, test_f1: 0.5628
 epoch: 87, train_loss: 0.7916, test_loss: 0.9221, test_f1: 0.5667
 epoch: 88, train_loss: 0.7970, test_loss: 0.9093, test_f1: 0.5775
 epoch: 89, train_loss: 0.7912, test_loss: 0.9118, test_f1: 0.5535
 epoch: 90, train_loss: 0.7904, test_loss: 0.9064, test_f1: 0.5586
 epoch: 91, train_loss: 0.7980, test_loss: 0.9271, test_f1: 0.5601
 epoch: 92, train_loss: 0.7851, test_loss: 0.9170, test_f1: 0.5601
 epoch: 93, train_loss: 0.7819, test_loss: 0.9207, test_f1: 0.5719
 epoch: 94, train_loss: 0.7822, test_loss: 0.9079, test_f1: 0.5663
 epoch: 95, train_loss: 0.7779, test_loss: 0.9160, test_f1: 0.5520
 epoch: 96, train_loss: 0.7894, test_loss: 0.9044, test_f1: 0.5776
 epoch: 97, train_loss: 0.7888, test_loss: 0.9108, test_f1: 0.5770
 epoch: 98, train_loss: 0.7886, test_loss: 0.9135, test_f1: 0.5739
 epoch: 99, train_loss: 0.7840, test_loss: 0.9296, test_f1: 0.5602

Training completed in 554.96 seconds
Best F1: 0.5781 at epoch 85
Mean F1 across iterations: 0.5581  0.0161
========================FINAL RESULTS================================
FEGIN weighted F1: 0.5781  0.0161
python main.py --data ltspice_examples --representation component_net --model FEGIN --layers 2 --hiddens 64 --batch_size 64 --lr 0.0001 --emb_size 128 --epochs 100 --save_appendix component_net_L2_H64_BS64_LR0.0001_E128 --no_val
-----



STDERR:
  File "main.py", line 370, in <module>
    main()
  File "main.py", line 254, in main
    dataset = dataset_class(
  File "/home/philip/projects/ltspice_examples_code_repo/Circuit-Completion-Using-GNNs/component_classification_with_link_prediction_head/evaluation/FEGIN/kernel/circuit_datasets.py", line 15, in __init__
    self.data, self.slices = torch.load(self.processed_paths[0])
  File "/home/philip/.local/lib/python3.8/site-packages/torch/serialization.py", line 1040, in load
    warnings.warn(
  File "/usr/lib/python3.8/warnings.py", line 109, in _showwarnmsg
    sw(msg.message, msg.category, msg.filename, msg.lineno,
  File "main.py", line 47, in warn_with_traceback
    traceback.print_stack(file=log)
/home/philip/projects/ltspice_examples_code_repo/Circuit-Completion-Using-GNNs/component_classification_with_link_prediction_head/evaluation/FEGIN/kernel/circuit_datasets.py:15: FutureWarning: You are using `torch.load` with `weights_only=False` (the current default value), which uses the default pickle module implicitly. It is possible to construct malicious pickle data which will execute arbitrary code during unpickling (See https://github.com/pytorch/pytorch/blob/main/SECURITY.md#untrusted-models for more details). In a future release, the default value for `weights_only` will be flipped to `True`. This limits the functions that could be executed during unpickling. Arbitrary objects will no longer be allowed to be loaded via this mode unless they are explicitly allowlisted by the user via `torch.serialization.add_safe_globals`. We recommend you start setting `weights_only=True` for any use case where you don't have full control of the loaded file. Please open an issue on GitHub for any issues related to this experimental feature.
  self.data, self.slices = torch.load(self.processed_paths[0])
